library/src/blas3/Tensile/Logic/asm_full/arcturus_Cijk_Ailk_Bjlk_SB.yaml
- {MinimumRequiredVersion: 4.20.0}
- arcturus
- gfx908
- [Device 7380, Device 7388, Device 738c, Device 7390]
    SolutionIndex: 0
    SolutionIndex: 1
    SolutionIndex: 2
    SolutionIndex: 3
    SolutionIndex: 4
    SolutionIndex: 5
    SolutionIndex: 6
    SolutionIndex: 7
    SolutionIndex: 8
    SolutionIndex: 9
    SolutionIndex: 10
    SolutionIndex: 11
    SolutionIndex: 12
    SolutionIndex: 13
    SolutionIndex: 14
    SolutionIndex: 15
    SolutionIndex: 16
    SolutionIndex: 17
    SolutionIndex: 18
    SolutionIndex: 19
    SolutionIndex: 20
    SolutionIndex: 21
    SolutionIndex: 22
    SolutionIndex: 23
    SolutionIndex: 24
    SolutionIndex: 25
    SolutionNameMin: Cijk_Ailk_Bjlk_SB_MT032x016x08_GRVW02_GSU01_SNLL0_TT02_02_VW02_WG16_08_01
    SolutionIndex: 26
    SolutionNameMin: Cijk_Ailk_Bjlk_SB_MT016x016x16_GRVW02_GSU08_SNLL0_TT02_02_VW02_WG08_08_04
    SolutionIndex: 27
    SolutionNameMin: Cijk_Ailk_Bjlk_SB_MT064x064x16_GRVW04_GSU01_SNLL1_TT04_04_VW04_WG16_16_01
    SolutionIndex: 28
    SolutionNameMin: Cijk_Ailk_Bjlk_SB_MT064x128x16_GRVW04_GSU01_SNLL1_TT04_08_VW04_WG16_16_01
    SolutionIndex: 29
    SolutionNameMin: Cijk_Ailk_Bjlk_SB_MT032x032x16_GRVW04_GSU02_SNLL0_TT04_04_VW04_WG08_08_02
    SolutionIndex: 30
    SolutionNameMin: Cijk_Ailk_Bjlk_SB_MT016x016x16_GRVW02_GSU04_SNLL0_TT02_02_VW02_WG08_08_04
    SolutionIndex: 31
    SolutionNameMin: Cijk_Ailk_Bjlk_SB_MT128x128x16_GRVW04_GSU01_SNLL1_TT08_08_VW04_WG16_16_01
    SolutionIndex: 32
    SolutionNameMin: Cijk_Ailk_Bjlk_SB_MT032x032x32_GRVW04_GSU02_SNLL0_TT04_04_VW04_WG08_08_04
    SolutionIndex: 33
    SolutionNameMin: Cijk_Ailk_Bjlk_SB_MT008x008x08_GRVW02_GSU08_SNLL0_TT02_02_VW02_WG04_04_04
    SolutionIndex: 34
    SolutionNameMin: Cijk_Ailk_Bjlk_SB_MT128x064x16_GRVW04_GSU01_SNLL1_TT08_04_VW04_WG16_16_01
    SolutionIndex: 35
    SolutionNameMin: Cijk_Ailk_Bjlk_SB_MT128x128x08_GRVW04_GSU01_SNLL1_TT08_08_VW04_WG16_16_01
    SolutionIndex: 36
    SolutionNameMin: Cijk_Ailk_Bjlk_SB_MT064x064x16_GRVW04_GSU01_SNLL1_TT04_04_VW04_WG16_16_01
    SolutionIndex: 37
    SolutionNameMin: Cijk_Ailk_Bjlk_SB_MT064x064x16_GRVW04_GSU01_SNLL0_TT04_04_VW04_WG16_16_01
    SolutionIndex: 38
    SolutionNameMin: Cijk_Ailk_Bjlk_SB_MT064x128x16_GRVW04_GSU01_SNLL0_TT04_08_VW04_WG16_16_01
    SolutionIndex: 39
    SolutionNameMin: Cijk_Ailk_Bjlk_SB_MT128x064x16_GRVW04_GSU01_SNLL1_TT08_04_VW04_WG16_16_01
    SolutionIndex: 40
    SolutionNameMin: Cijk_Ailk_Bjlk_SB_MT016x016x16_GRVW02_GSU02_SNLL0_TT02_02_VW02_WG08_08_04
    SolutionIndex: 41
    SolutionNameMin: Cijk_Ailk_Bjlk_SB_MT032x008x08_GRVW02_GSU01_SNLL0_TT02_02_VW02_WG16_04_01
    SolutionIndex: 42
    SolutionNameMin: Cijk_Ailk_Bjlk_SB_MT032x032x02_GRVW04_GSU01_SNLL0_TT04_04_VW04_WG08_08_01
    SolutionIndex: 43
    SolutionNameMin: Cijk_Ailk_Bjlk_SB_MT064x064x16_GRVW04_GSU01_SNLL0_TT04_04_VW04_WG16_16_01
    SolutionIndex: 44
    SolutionNameMin: Cijk_Ailk_Bjlk_SB_MT128x096x16_GRVW02_GSU01_SNLL1_TT08_06_VW02_WG16_16_01
    SolutionIndex: 45
    SolutionNameMin: Cijk_Ailk_Bjlk_SB_MT064x008x16_GRVW02_GSU01_SNLL0_TT02_02_VW02_WG32_04_01
    SolutionIndex: 46
    SolutionNameMin: Cijk_Ailk_Bjlk_SB_MT064x128x16_GRVW04_GSU01_SNLL1_TT04_08_VW04_WG16_16_01
    SolutionIndex: 47
    SolutionNameMin: Cijk_Ailk_Bjlk_SB_MT128x128x08_GRVW04_GSU01_SNLL1_TT08_08_VW04_WG16_16_01
    SolutionIndex: 48
    SolutionNameMin: Cijk_Ailk_Bjlk_SB_MT032x016x32_GRVW02_GSU02_SNLL0_TT04_02_VW02_WG08_08_04
    SolutionIndex: 49
    SolutionNameMin: Cijk_Ailk_Bjlk_SB_MT016x016x08_GRVW02_GSU04_SNLL0_TT02_02_VW02_WG08_08_02
    SolutionIndex: 50
    SolutionNameMin: Cijk_Ailk_Bjlk_SB_MT032x016x08_GRVW02_GSU02_SNLL0_TT04_02_VW02_WG08_08_02
    SolutionIndex: 51
    SolutionNameMin: Cijk_Ailk_Bjlk_SB_MT032x016x16_GRVW02_GSU02_SNLL0_TT04_02_VW02_WG08_08_04
    SolutionIndex: 52
    SolutionNameMin: Cijk_Ailk_Bjlk_SB_MT032x016x08_GRVW02_GSU01_SNLL0_TT04_02_VW02_WG08_08_01
    SolutionIndex: 53
    SolutionNameMin: Cijk_Ailk_Bjlk_SB_MT064x032x32_GRVW04_GSU02_SNLL0_TT08_04_VW04_WG08_08_04
    SolutionIndex: 54
    SolutionNameMin: Cijk_Ailk_Bjlk_SB_MT016x016x16_GRVW02_GSU01_SNLL0_TT02_02_VW02_WG08_08_01
    SolutionIndex: 55
    SolutionNameMin: Cijk_Ailk_Bjlk_SB_MT016x016x04_GRVW02_GSU01_SNLL0_TT02_02_VW02_WG08_08_01
    SolutionIndex: 56
    SolutionNameMin: Cijk_Ailk_Bjlk_SB_MT096x128x16_GRVW02_GSU01_SNLL1_TT06_08_VW02_WG16_16_01
    SolutionIndex: 57
    SolutionNameMin: Cijk_Ailk_Bjlk_SB_MT032x032x32_GRVW04_GSU04_SNLL0_TT04_04_VW04_WG08_08_04
    SolutionIndex: 58
    SolutionNameMin: Cijk_Ailk_Bjlk_SB_MT016x016x08_GRVW02_GSU16_SNLL0_TT02_02_VW02_WG08_08_02
    SolutionIndex: 59
    SolutionNameMin: Cijk_Ailk_Bjlk_SB_MT032x016x16_GRVW02_GSU02_SNLL0_TT04_02_VW02_WG08_08_02
    SolutionIndex: 60
    SolutionNameMin: Cijk_Ailk_Bjlk_SB_MT064x032x16_GRVW04_GSU02_SNLL0_TT08_04_VW04_WG08_08_02
    SolutionIndex: 61
    SolutionNameMin: Cijk_Ailk_Bjlk_SB_MT032x032x32_GRVW04_GSU02_SNLL0_TT04_04_VW04_WG08_08_04
    SolutionIndex: 62
    SolutionNameMin: Cijk_Ailk_Bjlk_SB_MT016x016x16_GRVW02_GSU04_SNLL0_TT02_02_VW02_WG08_08_04
    SolutionIndex: 63
    SolutionNameMin: Cijk_Ailk_Bjlk_SB_MT016x016x04_GRVW02_GSU04_SNLL0_TT02_02_VW02_WG08_08_01
    SolutionIndex: 64
    SolutionNameMin: Cijk_Ailk_Bjlk_SB_MT032x016x16_GRVW02_GSU01_SNLL0_TT04_02_VW02_WG08_08_01
    SolutionIndex: 65
    SolutionNameMin: Cijk_Ailk_Bjlk_SB_MT096x128x16_GRVW02_GSU01_SNLL1_TT06_08_VW02_WG16_16_01
    SolutionIndex: 66
    SolutionNameMin: Cijk_Ailk_Bjlk_SB_MT128x064x16_GRVW04_GSU01_SNLL0_TT08_04_VW04_WG16_16_01
    SolutionIndex: 67
    SolutionNameMin: Cijk_Ailk_Bjlk_SB_MT032x032x32_GRVW04_GSU02_SNLL0_TT04_04_VW04_WG08_08_02
    SolutionIndex: 68
    SolutionNameMin: Cijk_Ailk_Bjlk_SB_MT016x016x08_GRVW02_GSU01_SNLL0_TT02_02_VW02_WG08_08_01
    SolutionIndex: 69
    SolutionNameMin: Cijk_Ailk_Bjlk_SB_MT032x008x32_GRVW02_GSU02_SNLL0_TT02_02_VW02_WG16_04_04
    SolutionIndex: 70
    SolutionNameMin: Cijk_Ailk_Bjlk_SB_MT064x032x32_GRVW04_GSU02_SNLL0_TT08_04_VW04_WG08_08_04
    SolutionIndex: 71
    SolutionNameMin: Cijk_Ailk_Bjlk_SB_MT016x016x04_GRVW02_GSU08_SNLL0_TT02_02_VW02_WG08_08_01
    SolutionIndex: 72
    SolutionNameMin: Cijk_Ailk_Bjlk_SB_MT032x016x16_GRVW02_GSU02_SNLL0_TT04_02_VW02_WG08_08_02
    SolutionIndex: 73
    SolutionNameMin: Cijk_Ailk_Bjlk_SB_MT128x128x16_GRVW04_GSU01_SNLL1_TT08_08_VW04_WG16_16_01
    SolutionIndex: 74
    SolutionNameMin: Cijk_Ailk_Bjlk_SB_MT032x032x16_GRVW04_GSU02_SNLL0_TT04_04_VW04_WG08_08_02
    SolutionIndex: 75
    SolutionNameMin: Cijk_Ailk_Bjlk_SB_MT032x032x32_GRVW04_GSU04_SNLL0_TT04_04_VW04_WG08_08_04
    SolutionIndex: 76
    SolutionNameMin: Cijk_Ailk_Bjlk_SB_MT008x008x08_GRVW02_GSU04_SNLL0_TT02_02_VW02_WG04_04_04
    SolutionIndex: 77
    SolutionNameMin: Cijk_Ailk_Bjlk_SB_MT064x016x08_GRVW02_GSU01_SNLL0_TT04_02_VW02_WG16_08_01
    SolutionIndex: 78
    SolutionNameMin: Cijk_Ailk_Bjlk_SB_MT016x016x16_GRVW02_GSU01_SNLL1_TT02_02_VW02_WG08_08_04
    SolutionIndex: 79
    SolutionNameMin: Cijk_Ailk_Bjlk_SB_MT032x032x16_GRVW04_GSU04_SNLL0_TT04_04_VW04_WG08_08_02
    SolutionIndex: 80
    SolutionNameMin: Cijk_Ailk_Bjlk_SB_MT128x128x08_GRVW04_GSU01_SNLL0_TT08_08_VW04_WG16_16_01
    SolutionIndex: 81
    SolutionNameMin: Cijk_Ailk_Bjlk_SB_MT032x016x16_GRVW02_GSU02_SNLL0_TT02_02_VW02_WG16_08_02
    SolutionIndex: 82
    SolutionNameMin: Cijk_Ailk_Bjlk_SB_MT064x016x08_GRVW02_GSU01_SNLL0_TT04_02_VW02_WG16_08_01
    SolutionIndex: 83
    SolutionNameMin: Cijk_Ailk_Bjlk_SB_MT016x016x16_GRVW02_GSU01_SNLL0_TT02_02_VW02_WG08_08_01
    SolutionIndex: 84
    SolutionNameMin: Cijk_Ailk_Bjlk_SB_MT016x016x32_GRVW02_GSU02_SNLL0_TT02_02_VW02_WG08_08_04
    SolutionIndex: 85
    SolutionNameMin: Cijk_Ailk_Bjlk_SB_MT008x008x08_GRVW02_GSU02_SNLL0_TT02_02_VW02_WG04_04_04
    SolutionIndex: 86
    SolutionNameMin: Cijk_Ailk_Bjlk_SB_MT128x096x16_GRVW02_GSU01_SNLL1_TT08_06_VW02_WG16_16_01
    SolutionIndex: 87
    SolutionNameMin: Cijk_Ailk_Bjlk_SB_MT032x016x32_GRVW02_GSU04_SNLL0_TT04_02_VW02_WG08_08_04
    SolutionIndex: 88
    SolutionNameMin: Cijk_Ailk_Bjlk_SB_MT016x016x08_GRVW02_GSU02_SNLL0_TT02_02_VW02_WG08_08_02
    SolutionIndex: 89
    SolutionNameMin: Cijk_Ailk_Bjlk_SB_MT016x016x16_GRVW02_GSU02_SNLL0_TT02_02_VW02_WG08_08_04
    SolutionIndex: 90
    SolutionNameMin: Cijk_Ailk_Bjlk_SB_MT016x016x16_GRVW02_GSU02_SNLL0_TT02_02_VW02_WG08_08_02
    SolutionIndex: 91
    SolutionNameMin: Cijk_Ailk_Bjlk_SB_MT128x064x16_GRVW04_GSU01_SNLL0_TT08_04_VW04_WG16_16_01
    SolutionIndex: 92
    SolutionNameMin: Cijk_Ailk_Bjlk_SB_MT064x016x16_GRVW02_GSU01_SNLL0_TT04_02_VW02_WG16_08_01
    SolutionIndex: 93
    SolutionNameMin: Cijk_Ailk_Bjlk_SB_MT016x016x32_GRVW02_GSU04_SNLL0_TT02_02_VW02_WG08_08_04
    SolutionIndex: 94
    SolutionNameMin: Cijk_Ailk_Bjlk_SB_MT064x128x16_GRVW04_GSU01_SNLL0_TT04_08_VW04_WG16_16_01
    SolutionIndex: 95
    SolutionNameMin: Cijk_Ailk_Bjlk_SB_MT016x016x16_GRVW02_GSU16_SNLL0_TT02_02_VW02_WG08_08_04
    SolutionIndex: 96
    SolutionNameMin: Cijk_Ailk_Bjlk_SB_MT032x016x16_GRVW02_GSU02_SNLL0_TT02_02_VW02_WG16_08_02
    SolutionIndex: 97
    SolutionNameMin: Cijk_Ailk_Bjlk_SB_MT064x016x16_GRVW04_GSU02_SNLL0_TT04_04_VW04_WG16_04_04
    SolutionIndex: 98
    SolutionNameMin: Cijk_Ailk_Bjlk_SB_MT016x016x08_GRVW02_GSU08_SNLL0_TT02_02_VW02_WG08_08_02
    SolutionIndex: 99
    SolutionNameMin: Cijk_Ailk_Bjlk_SB_MT008x008x08_GRVW02_GSU01_SNLL1_TT02_02_VW02_WG04_04_04
    SolutionIndex: 100
    SolutionNameMin: Cijk_Ailk_Bjlk_SB_MT032x032x08_GRVW04_GSU01_SNLL0_TT04_04_VW04_WG08_08_01
    SolutionIndex: 101
    SolutionNameMin: Cijk_Ailk_Bjlk_SB_MT016x016x16_GRVW02_GSU02_SNLL0_TT02_02_VW02_WG08_08_02
    SolutionIndex: 102
    SolutionNameMin: Cijk_Ailk_Bjlk_SB_MT008x008x08_GRVW02_GSU16_SNLL0_TT02_02_VW02_WG04_04_04
    SolutionIndex: 103
    SolutionNameMin: Cijk_Ailk_Bjlk_SB_MT032x016x08_GRVW02_GSU01_SNLL0_TT02_02_VW02_WG16_08_01
    SolutionIndex: 104
    SolutionNameMin: Cijk_Ailk_Bjlk_SB_MT016x016x32_GRVW02_GSU08_SNLL0_TT02_02_VW02_WG08_08_04
    SolutionIndex: 105
    SolutionNameMin: Cijk_Ailk_Bjlk_SB_MT032x016x08_GRVW02_GSU01_SNLL0_TT04_02_VW02_WG08_08_01
    SolutionIndex: 106
    SolutionNameMin: Cijk_Ailk_Bjlk_SB_MT016x016x32_GRVW02_GSU02_SNLL0_TT02_02_VW02_WG08_08_04
    SolutionIndex: 107
    SolutionNameMin: Cijk_Ailk_Bjlk_SB_MT032x008x32_GRVW02_GSU08_SNLL0_TT02_02_VW02_WG16_04_04
    SolutionIndex: 108
    SolutionNameMin: Cijk_Ailk_Bjlk_SB_MT032x016x16_GRVW02_GSU02_SNLL0_TT04_02_VW02_WG08_08_04
    SolutionIndex: 109
    SolutionNameMin: Cijk_Ailk_Bjlk_SB_MT016x016x08_GRVW02_GSU01_SNLL0_TT02_02_VW02_WG08_08_01
    SolutionIndex: 110
    SolutionNameMin: Cijk_Ailk_Bjlk_SB_MT128x032x32_GRVW04_GSU02_SNLL0_TT08_08_VW04_WG16_04_04
    SolutionIndex: 111
    SolutionNameMin: Cijk_Ailk_Bjlk_SB_MT016x016x24_GRVW02_GSU01_SNLL0_TT02_02_VW02_WG08_08_01
    SolutionIndex: 112
    SolutionNameMin: Cijk_Ailk_Bjlk_SB_MT064x016x16_GRVW02_GSU02_SNLL0_TT04_02_VW02_WG16_08_02
    SolutionIndex: 113
    SolutionNameMin: Cijk_Ailk_Bjlk_SB_MT064x032x32_GRVW04_GSU02_SNLL0_TT04_04_VW04_WG16_08_02
    SolutionIndex: 114
    SolutionNameMin: Cijk_Ailk_Bjlk_SB_MT032x016x32_GRVW02_GSU02_SNLL0_TT04_02_VW02_WG08_08_02
    SolutionIndex: 115
    SolutionNameMin: Cijk_Ailk_Bjlk_SB_MT064x008x16_GRVW02_GSU01_SNLL0_TT02_02_VW02_WG32_04_01
    SolutionIndex: 116
    SolutionNameMin: Cijk_Ailk_Bjlk_SB_MT032x016x32_GRVW02_GSU02_SNLL0_TT04_02_VW02_WG08_08_02
    SolutionIndex: 117
    SolutionNameMin: Cijk_Ailk_Bjlk_SB_MT032x016x32_GRVW02_GSU02_SNLL0_TT04_02_VW02_WG08_08_04
    SolutionIndex: 118
    SolutionNameMin: Cijk_Ailk_Bjlk_SB_MT064x032x16_GRVW04_GSU01_SNLL0_TT04_04_VW04_WG16_08_01
    SolutionIndex: 119
    SolutionNameMin: Cijk_Ailk_Bjlk_SB_MT032x032x16_GRVW04_GSU01_SNLL0_TT04_04_VW04_WG08_08_01
    SolutionIndex: 120
    SolutionNameMin: Cijk_Ailk_Bjlk_SB_MT032x008x16_GRVW02_GSU01_SNLL0_TT02_02_VW02_WG16_04_01
    SolutionIndex: 121
    SolutionNameMin: Cijk_Ailk_Bjlk_SB_MT032x032x08_GRVW04_GSU01_SNLL0_TT04_04_VW04_WG08_08_01
    SolutionIndex: 122
    SolutionNameMin: Cijk_Ailk_Bjlk_SB_MT064x008x32_GRVW02_GSU04_SNLL0_TT04_02_VW02_WG16_04_04
    SolutionIndex: 123
    SolutionNameMin: Cijk_Ailk_Bjlk_SB_MT064x064x16_DTL0_GRVW04_GSU01_PGR1_PLR1_TT04_04_USFGRO0_VW04_WG16_16_01_WGM01
    SolutionIndex: 124
    SolutionNameMin: Cijk_Ailk_Bjlk_SB_MT032x256x08_DTL1_GRVW01_GSU01_PGR0_PLR1_TT04_08_USFGRO01_VW04_WG08_32_01_WGM64
    SolutionIndex: 125
    SolutionNameMin: Cijk_Ailk_Bjlk_SB_MT032x256x08_DTL1_GRVW01_GSU01_PGR0_PLR1_TT04_08_USFGRO01_VW04_WG08_32_01_WGM01
    SolutionIndex: 126
    SolutionNameMin: Cijk_Ailk_Bjlk_SB_MT064x128x08_DTL0_GRVW01_GSU01_PGR1_PLR1_TT04_08_USFGRO01_VW02_WG16_16_01_WGM01
    SolutionIndex: 127
    SolutionNameMin: Cijk_Ailk_Bjlk_SB_MT064x128x16_DTL0_GRVW04_GSU01_PGR0_PLR1_TT08_04_USFGRO0_VW04_WG08_32_01_WGM01
    SolutionIndex: 128
    SolutionNameMin: Cijk_Ailk_Bjlk_SB_MT064x064x16_DTL0_GRVW01_GSU01_PGR0_PLR1_TT04_08_USFGRO01_VW04_WG16_08_01_WGM01
    SolutionIndex: 129
    SolutionNameMin: Cijk_Ailk_Bjlk_SB_MT064x064x08_DTL0_GRVW01_GSU01_PGR1_PLR1_TT04_08_USFGRO01_VW04_WG16_08_01_WGM01
    SolutionIndex: 130
    SolutionNameMin: Cijk_Ailk_Bjlk_SB_MT064x128x16_DTL0_GRVW04_GSU01_PGR0_PLR1_TT04_08_USFGRO0_VW04_WG16_16_01_WGM01
    SolutionIndex: 131
    SolutionNameMin: Cijk_Ailk_Bjlk_SB_MT032x256x08_DTL1_GRVW01_GSU01_PGR0_PLR1_TT04_08_USFGRO01_VW04_WG08_32_01_WGM08
    SolutionIndex: 132
    SolutionNameMin: Cijk_Ailk_Bjlk_SB_MT064x064x08_DTL0_GRVW04_GSU01_PGR1_PLR1_TT04_08_USFGRO0_VW04_WG16_08_01_WGM01
    SolutionIndex: 133
    SolutionNameMin: Cijk_Ailk_Bjlk_SB_MT064x128x16_DTL0_GRVW04_GSU01_PGR0_PLR1_TT04_08_USFGRO0_VW04_WG16_16_01_WGM08
    SolutionIndex: 134
    SolutionNameMin: Cijk_Ailk_Bjlk_SB_MT128x32x16_SE_EPS0_GSU1_PGR0_PLR1_SNLL0_TT8_4_VW4_WG16_8_1_WGM8
    SolutionIndex: 135
    SolutionNameMin: Cijk_Ailk_Bjlk_SB_MT64x64x8_SE_EPS1_GSU1_PGR1_PLR1_SNLL1_TT8_8_VW4_WG8_8_1_WGM64
    SolutionIndex: 136
    SolutionNameMin: Cijk_Ailk_Bjlk_SB_MT64x64x16_SE_EPS1_GSU1_PGR1_PLR1_SNLL1_TT4_4_VW4_WG16_16_1_WGM64
    SolutionIndex: 137
    SolutionNameMin: Cijk_Ailk_Bjlk_SB_MT64x64x16_SE_EPS0_GSU1_PGR0_PLR1_SNLL0_TT4_4_VW4_WG16_16_1_WGM64
    SolutionIndex: 138
    SolutionNameMin: Cijk_Ailk_Bjlk_SB_MT64x64x16_SE_EPS1_GSU1_PGR1_PLR1_SNLL1_TT4_4_VW4_WG16_16_1_WGM8
    SolutionIndex: 139
    SolutionNameMin: Cijk_Ailk_Bjlk_SB_MT64x64x8_SE_EPS1_GSU1_PGR1_PLR1_SNLL1_TT8_8_VW4_WG8_8_1_WGM8
    SolutionIndex: 140
    SolutionNameMin: Cijk_Ailk_Bjlk_SB_MT128x128x16_SE_EPS1_FL0_GRVW4_NLCA1_NLCB1_PGR1_PLR1_SNLL1_TT8_8_USFGRO0_VW4_WGM8
    SolutionIndex: 141
    SolutionNameMin: Cijk_Ailk_Bjlk_SB_MT128x128x16_SE_EPS1_FL1_GRVW4_NLCA1_NLCB1_PGR1_PLR1_SNLL1_TT8_8_USFGRO0_VW4_WGM8
    SolutionIndex: 142
    SolutionNameMin: Cijk_Ailk_Bjlk_SB_MT128x128x16_SE_EPS1_FL1_GRVW4_NLCA1_NLCB1_PGR1_PLR1_SNLL1_TT8_8_USFGRO0_VW4_WGM1
    SolutionIndex: 143
    SolutionNameMin: Cijk_Ailk_Bjlk_SB_MT128x128x16_SE_EPS1_FL0_GRVW4_NLCA1_NLCB1_PGR1_PLR1_SNLL1_TT8_8_USFGRO0_VW4_WGM1
    SolutionIndex: 144
    SolutionNameMin: Cijk_Ailk_Bjlk_SB_MT64x32x8_SE_EPS0_FL0_GRVW1_NLCA1_NLCB1_PGR0_PLR1_SNLL0_TT4_4_USFGRO1_VW1_WGM1
    SolutionIndex: 145
    SolutionNameMin: Cijk_Ailk_Bjlk_SB_MT128x64x16_SE_EPS1_FL0_GRVW4_NLCA1_NLCB1_PGR1_PLR1_SNLL1_TT8_4_USFGRO0_VW4_WGM1
    SolutionIndex: 146
    SolutionNameMin: Cijk_Ailk_Bjlk_SB_MT64x64x8_SE_EPS1_FL0_GRVW1_NLCA1_NLCB1_PGR1_PLR0_SNLL1_TT4_4_USFGRO1_VW1_WGM1
    SolutionIndex: 147
    SolutionNameMin: Cijk_Ailk_Bjlk_SB_MT64x32x8_SE_EPS0_FL0_GRVW1_NLCA1_NLCB1_PGR0_PLR0_SNLL0_TT4_4_USFGRO1_VW4_WGM1
    SolutionIndex: 148
    SolutionNameMin: Cijk_Ailk_Bjlk_SB_MT128x64x16_SE_EPS1_FL1_GRVW4_NLCA1_NLCB1_PGR1_PLR1_SNLL1_TT8_4_USFGRO0_VW4_WGM8
    SolutionIndex: 149
    SolutionNameMin: Cijk_Ailk_Bjlk_SB_MT64x32x8_SE_EPS0_FL0_GRVW1_NLCA1_NLCB1_PGR0_PLR1_SNLL0_TT4_4_USFGRO1_VW4_WGM8
    SolutionIndex: 150
    SolutionNameMin: Cijk_Ailk_Bjlk_SB_MT64x128x16_SE_EPS1_FL0_GRVW4_NLCA1_NLCB1_PGR1_PLR1_SNLL1_TT4_8_USFGRO0_VW4_WGM8
    SolutionIndex: 151
    SolutionNameMin: Cijk_Ailk_Bjlk_SB_MT64x64x16_SE_EPS1_FL1_GRVW4_NLCA1_NLCB1_PGR1_PLR1_SNLL1_TT4_4_USFGRO0_VW4_WGM1
    SolutionIndex: 152
    SolutionNameMin: Cijk_Ailk_Bjlk_SB_MT64x32x8_SE_EPS0_FL0_GRVW1_NLCA1_NLCB1_PGR0_PLR0_SNLL0_TT4_4_USFGRO1_VW1_WGM1
    SolutionIndex: 153
    SolutionNameMin: Cijk_Ailk_Bjlk_SB_MT64x32x8_SE_EPS0_FL0_GRVW1_NLCA1_NLCB1_PGR0_PLR1_SNLL0_TT4_4_USFGRO1_VW4_WGM1
    SolutionIndex: 154
    SolutionNameMin: Cijk_Ailk_Bjlk_SB_MT64x128x8_SE_EPS1_FL0_GRVW1_NLCA1_NLCB1_PGR1_PLR0_SNLL1_TT4_8_USFGRO1_VW1_WGM8
    SolutionIndex: 155
    SolutionNameMin: Cijk_Ailk_Bjlk_SB_MT128x64x16_SE_EPS1_FL1_GRVW4_NLCA1_NLCB1_PGR1_PLR1_SNLL1_TT8_4_USFGRO0_VW4_WGM1
    SolutionIndex: 156
    SolutionNameMin: Cijk_Ailk_Bjlk_SB_MT64x128x16_SE_EPS1_FL1_GRVW4_NLCA1_NLCB1_PGR1_PLR1_SNLL1_TT4_8_USFGRO0_VW4_WGM8
    SolutionIndex: 157
    SolutionNameMin: Cijk_Ailk_Bjlk_SB_MT64x16x8_SE_EPS0_FL0_GRVW1_NLCA1_NLCB1_PGR0_PLR1_SNLL0_TT4_2_USFGRO1_VW1_WGM1
    SolutionIndex: 158
    SolutionNameMin: Cijk_Ailk_Bjlk_SB_MT64x128x16_SE_EPS1_FL0_GRVW4_NLCA1_NLCB1_PGR1_PLR1_SNLL1_TT4_8_USFGRO0_VW4_WGM1
    SolutionIndex: 159
    SolutionNameMin: Cijk_Ailk_Bjlk_SB_MT128x64x16_SE_EPS1_FL0_GRVW4_NLCA1_NLCB1_PGR1_PLR1_SNLL1_TT8_4_USFGRO0_VW4_WGM8
    SolutionIndex: 160
    SolutionNameMin: Cijk_Ailk_Bjlk_SB_MT64x16x8_SE_EPS0_FL0_GRVW1_NLCA1_NLCB1_PGR0_PLR0_SNLL0_TT4_2_USFGRO1_VW1_WGM1
    SolutionIndex: 161
    SolutionNameMin: Cijk_Ailk_Bjlk_SB_MT64x16x8_SE_EPS0_FL0_GRVW1_NLCA1_NLCB1_PGR0_PLR1_SNLL0_TT4_2_USFGRO1_VW1_WGM8
    SolutionIndex: 162
    SolutionNameMin: Cijk_Ailk_Bjlk_SB_MT64x128x8_SE_EPS1_FL0_GRVW1_NLCA1_NLCB1_PGR1_PLR0_SNLL1_TT4_8_USFGRO1_VW1_WGM1
    SolutionIndex: 163
    SolutionNameMin: Cijk_Ailk_Bjlk_SB_MT64x64x16_SE_EPS1_FL0_GRVW4_NLCA1_NLCB1_PGR1_PLR1_SNLL1_TT4_4_USFGRO0_VW4_WGM1
    SolutionIndex: 164
    SolutionNameMin: Cijk_Ailk_Bjlk_SB_MT64x64x8_SE_EPS1_FL0_GRVW1_NLCA1_NLCB1_PGR1_PLR0_SNLL1_TT4_4_USFGRO1_VW1_WGM8
    SolutionIndex: 165
    SolutionNameMin: Cijk_Ailk_Bjlk_SB_MT64x32x8_SE_EPS0_FL0_GRVW1_NLCA1_NLCB1_PGR0_PLR1_SNLL0_TT4_2_USFGRO1_VW1_WGM1
    SolutionIndex: 166
    SolutionNameMin: Cijk_Ailk_Bjlk_SB_MT64x64x8_SE_EPS0_FL0_GRVW1_NLCA1_NLCB1_PGR0_PLR1_SNLL0_TT4_4_USFGRO1_VW1_WGM1
    SolutionIndex: 167
    SolutionNameMin: Cijk_Ailk_Bjlk_SB_MT64x16x16_SE_EPS0_FL0_GRVW1_NLCA1_NLCB1_PGR0_PLR1_SNLL0_TT4_2_USFGRO1_VW1_WGM1
    SolutionIndex: 168
    SolutionNameMin: Cijk_Ailk_Bjlk_SB_MT64x64x16_SE_EPS1_FL0_GRVW4_NLCA1_NLCB1_PGR1_PLR1_SNLL1_TT4_4_USFGRO0_VW4_WGM8
    SolutionIndex: 169
    SolutionNameMin: Cijk_Ailk_Bjlk_SB_MT64x32x32_SE_EPS0_FL0_GRVW1_NLCA1_NLCB1_PGR0_PLR1_SNLL0_TT4_2_USFGRO1_VW1_WGM8
    SolutionIndex: 170
    SolutionNameMin: Cijk_Ailk_Bjlk_SB_MT64x32x8_SE_EPS0_FL0_GRVW1_NLCA1_NLCB1_PGR0_PLR1_SNLL0_TT4_4_USFGRO1_VW1_WGM8
    SolutionIndex: 171
    SolutionNameMin: Cijk_Ailk_Bjlk_SB_MT64x32x8_SE_EPS0_FL0_GRVW1_NLCA1_NLCB1_PGR0_PLR0_SNLL0_TT4_4_USFGRO1_VW4_WGM8
    SolutionIndex: 172
    SolutionNameMin: Cijk_Ailk_Bjlk_SB_MT64x16x16_SE_EPS0_FL0_GRVW1_NLCA1_NLCB1_PGR0_PLR0_SNLL0_TT4_2_USFGRO1_VW1_WGM1
    SolutionIndex: 173
    SolutionNameMin: Cijk_Ailk_Bjlk_SB_MT64x64x16_SE_EPS0_FL0_GRVW1_NLCA1_NLCB1_PGR0_PLR0_SNLL0_TT4_4_USFGRO1_VW1_WGM1
    SolutionIndex: 174
    SolutionNameMin: Cijk_Ailk_Bjlk_SB_MT64x64x8_SE_EPS1_FL0_GRVW4_NLCA1_NLCB1_PGR1_PLR1_SNLL1_TT8_4_USFGRO0_VW4_WGM1
    SolutionIndex: 175
    SolutionNameMin: Cijk_Ailk_Bjlk_SB_MT64x32x8_SE_EPS0_FL0_GRVW1_NLCA1_NLCB1_PGR0_PLR0_SNLL0_TT4_4_USFGRO1_VW1_WGM8
    SolutionIndex: 176
    SolutionNameMin: Cijk_Ailk_Bjlk_SB_MT64x128x8_SE_EPS1_FL0_GRVW2_NLCA1_NLCB1_PGR1_PLR1_TT4_8_USFGRO0_VW2_WGM8
    SolutionIndex: 177
    SolutionNameMin: Cijk_Ailk_Bjlk_SB_MT128x64x8_SE_EPS1_FL0_GRVW1_NLCA1_NLCB1_PGR1_PLR0_TT8_4_USFGRO1_VW4_WGM8
    SolutionIndex: 178
    SolutionNameMin: Cijk_Ailk_Bjlk_SB_MT128x64x8_SE_EPS1_FL1_GRVW2_NLCA1_NLCB1_PGR1_PLR1_TT8_4_USFGRO0_VW2_WGM8
    SolutionIndex: 179
    SolutionNameMin: Cijk_Ailk_Bjlk_SB_MT64x64x16_SE_EPS1_FL1_GRVW4_NLCA1_NLCB1_PGR1_PLR0_TT4_4_USFGRO0_VW4_WGM8
    SolutionIndex: 180
    SolutionNameMin: Cijk_Ailk_Bjlk_SB_MT96x64x8_SE_DTL0_EPS1_FL1_GRVW2_PGR1_PLR1_TT6_4_USFGRO0_VW2_WG16_16_1_WGM8
    SolutionIndex: 181
    SolutionNameMin: Cijk_Ailk_Bjlk_SB_MT64x64x16_SE_DTL0_EPS1_FL0_GRVW4_PGR1_PLR1_TT4_4_USFGRO0_VW4_WG16_16_1_WGM1
    SolutionIndex: 182
    SolutionNameMin: Cijk_Ailk_Bjlk_SB_MT32x8x16_SE_DTL0_EPS1_FL1_GRVW2_PGR1_PLR0_TT2_2_USFGRO0_VW2_WG16_4_4_WGM1
    SolutionIndex: 183
    SolutionNameMin: Cijk_Ailk_Bjlk_SB_MT128x64x8_SE_DTL0_EPS1_FL1_GRVW2_PGR1_PLR1_TT8_4_USFGRO0_VW2_WG16_16_1_WGM1
    SolutionIndex: 184
    SolutionNameMin: Cijk_Ailk_Bjlk_SB_MT64x128x8_SE_DTL0_EPS1_FL0_GRVW1_PGR1_PLR0_TT4_8_USFGRO1_VW4_WG16_16_1_WGM1
    SolutionIndex: 185
    SolutionNameMin: Cijk_Ailk_Bjlk_SB_MT64x128x8_SE_DTL0_EPS1_FL0_GRVW2_PGR1_PLR1_TT4_8_USFGRO0_VW2_WG16_16_1_WGM1
    SolutionIndex: 186
    SolutionNameMin: Cijk_Ailk_Bjlk_SB_MT32x8x32_SE_DTL0_EPS1_FL0_GRVW1_PGR1_PLR0_TT2_2_USFGRO1_VW2_WG16_4_4_WGM1
    SolutionIndex: 187
    SolutionNameMin: Cijk_Ailk_Bjlk_SB_MT64x64x8_SE_AMAS3_GRVW4_TT4_4_USFGRO0_VW2_WG16_16_1_WGM1
    SolutionIndex: 188
    SolutionNameMin: Cijk_Ailk_Bjlk_SB_MT64x64x32_SE_AMAS3_GRVW2_TT8_4_USFGRO0_VW2_WG8_16_2_WGM8
    SolutionIndex: 189
    SolutionNameMin: Cijk_Ailk_Bjlk_SB_MT64x64x16_SE_AMAS3_GRVW1_TT4_4_USFGRO1_VW4_WG16_16_1_WGM1
    SolutionIndex: 190
    SolutionNameMin: Cijk_Ailk_Bjlk_SB_MT128x128x16_SE_AMAS3_GRVW2_TT8_8_USFGRO0_VW2_WG16_16_1_WGM8
    SolutionIndex: 191
    SolutionNameMin: Cijk_Ailk_Bjlk_SB_MT128x128x16_SE_AMAS3_GRVW1_TT8_8_USFGRO1_VW4_WG16_16_1_WGM8
    SolutionIndex: 192
    SolutionNameMin: Cijk_Ailk_Bjlk_SB_MT64x64x16_SE_AMAS3_GRVW4_TT4_4_USFGRO0_VW4_WG16_16_1_WGM1
    SolutionIndex: 193
    SolutionNameMin: Cijk_Ailk_Bjlk_SB_MT64x64x8_SE_AMAS3_GRVW2_TT4_4_USFGRO0_VW2_WG16_16_1_WGM1
    SolutionIndex: 194
    SolutionNameMin: Cijk_Ailk_Bjlk_SB_MT64x64x16_SE_AMAS1_GRVW1_TT4_4_USFGRO1_VW1_WG16_16_1_WGM1
    SolutionIndex: 195
    SolutionNameMin: Cijk_Ailk_Bjlk_SB_MT64x64x16_SE_AMAS3_GRVW4_TT4_4_USFGRO0_VW4_WG16_16_1_WGM1
    SolutionIndex: 196
    SolutionNameMin: Cijk_Ailk_Bjlk_SB_MT64x64x8_SE_AMAS3_GRVW1_TT4_4_USFGRO1_VW2_WG16_16_1_WGM1
    SolutionIndex: 197
    SolutionNameMin: Cijk_Ailk_Bjlk_SB_MT64x64x8_SE_AMAS3_GRVW1_TT4_4_USFGRO1_VW4_WG16_16_1_WGM8
    SolutionIndex: 198
    SolutionNameMin: Cijk_Ailk_Bjlk_SB_MT16x32x32_SE_AMAS3_GRVW2_TT2_4_USFGRO0_VW2_WG8_8_4_WGM1
    SolutionIndex: 199
    SolutionNameMin: Cijk_Ailk_Bjlk_SB_MT64x64x8_SE_AMAS3_GRVW1_TT4_4_USFGRO1_VW4_WG16_16_1_WGM1
    SolutionIndex: 200
    SolutionNameMin: Cijk_Ailk_Bjlk_SB_MT64x64x16_SE_AMAS3_GRVW4_TT4_4_USFGRO0_VW4_WG16_16_1_WGM8
    SolutionIndex: 201
    SolutionNameMin: Cijk_Ailk_Bjlk_SB_MT128x128x8_SE_AMAS3_GRVW1_TT8_8_USFGRO1_VW2_WG16_16_1_WGM8
    SolutionIndex: 202
    SolutionNameMin: Cijk_Ailk_Bjlk_SB_MT16x32x32_SE_AMAS3_GRVW2_TT2_4_USFGRO0_VW2_WG8_8_4_WGM8
    SolutionIndex: 203
    SolutionNameMin: Cijk_Ailk_Bjlk_SB_MT32x32x32_SE_AMAS3_GRVW4_TT4_4_USFGRO0_VW4_WG8_8_4_WGM8
    SolutionIndex: 204
    SolutionNameMin: Cijk_Ailk_Bjlk_SB_MT32x32x32_SE_AMAS3_GRVW4_TT4_4_USFGRO0_VW4_WG8_8_4_WGM1
    SolutionIndex: 205
    SolutionNameMin: Cijk_Ailk_Bjlk_SB_MT128x128x8_SE_AMAS3_GRVW1_TT8_8_USFGRO1_VW2_WG16_16_1_WGM1
    SolutionIndex: 206
    SolutionNameMin: Cijk_Ailk_Bjlk_SB_MT64x32x16_SE_AMAS3_GRVW1_TT4_4_USFGRO1_VW4_WG16_8_2_WGM8
    SolutionIndex: 207
    SolutionNameMin: Cijk_Ailk_Bjlk_SB_MT16x64x32_SE_AMAS3_GRVW2_TT2_4_USFGRO0_VW2_WG8_16_2_WGM1
    SolutionIndex: 208
    SolutionNameMin: Cijk_Ailk_Bjlk_SB_MT64x32x16_SE_AMAS3_GRVW2_TT4_4_USFGRO0_VW2_WG16_8_2_WGM1
    SolutionIndex: 209
    SolutionNameMin: Cijk_Ailk_Bjlk_SB_MT64x64x16_SE_AMAS3_GRVW2_TT4_4_USFGRO0_VW2_WG16_16_1_WGM8
    SolutionIndex: 210
    SolutionNameMin: Cijk_Ailk_Bjlk_SB_MT32x32x32_SE_AMAS3_GRVW4_TT4_4_USFGRO0_VW4_WG8_8_4_WGM1
    SolutionIndex: 211
    SolutionNameMin: Cijk_Ailk_Bjlk_SB_MT64x32x16_SE_AMAS3_GRVW2_TT4_4_USFGRO0_VW2_WG16_8_2_WGM1
    SolutionIndex: 212
    SolutionNameMin: Cijk_Ailk_Bjlk_SB_MT32x16x32_SE_AMAS3_GRVW2_TT4_2_USFGRO0_VW2_WG8_8_4_WGM8
    SolutionIndex: 213
    SolutionNameMin: Cijk_Ailk_Bjlk_SB_MT32x64x16_SE_AMAS3_GRVW2_TT4_4_USFGRO0_VW2_WG8_16_2_WGM8
    SolutionIndex: 214
    SolutionNameMin: Cijk_Ailk_Bjlk_SB_MT16x32x32_SE_AMAS1_GRVW1_TT2_4_USFGRO1_VW1_WG8_8_4_WGM8
    SolutionIndex: 215
    SolutionNameMin: Cijk_Ailk_Bjlk_SB_MT64x64x8_SE_AMAS3_GRVW4_TT4_4_USFGRO0_VW2_WG16_16_1_WGM8
    SolutionIndex: 216
    SolutionNameMin: Cijk_Ailk_Bjlk_SB_MT64x64x8_SE_AMAS1_GRVW1_TT4_4_USFGRO1_VW1_WG16_16_1_WGM1
    SolutionIndex: 217
    SolutionNameMin: Cijk_Ailk_Bjlk_SB_MT64x64x16_SE_AMAS3_GRVW4_TT4_4_USFGRO0_VW4_WG16_16_1_WGM8
    SolutionIndex: 218
    SolutionNameMin: Cijk_Ailk_Bjlk_SB_MT64x32x32_SE_AMAS3_GRVW4_TT4_4_USFGRO0_VW4_WG16_8_2_WGM8
    SolutionIndex: 219
    SolutionNameMin: Cijk_Ailk_Bjlk_SB_MT128x128x8_SE_AMAS3_GRVW1_TT8_8_USFGRO1_VW4_WG16_16_1_WGM8
    SolutionIndex: 220
    SolutionNameMin: Cijk_Ailk_Bjlk_SB_MT64x32x8_SE_AMAS1_GRVW1_TT4_2_USFGRO1_VW1_WG16_16_1_WGM8
    SolutionIndex: 221
    SolutionNameMin: Cijk_Ailk_Bjlk_SB_MT32x16x32_SE_AMAS1_GRVW1_TT4_2_USFGRO1_VW1_WG8_8_4_WGM1
    SolutionIndex: 222
    SolutionNameMin: Cijk_Ailk_Bjlk_SB_MT64x32x16_SE_AMAS3_GRVW2_TT4_4_USFGRO0_VW2_WG16_8_2_WGM8
    SolutionIndex: 223
    SolutionNameMin: Cijk_Ailk_Bjlk_SB_MT32x32x32_SE_AMAS3_GRVW4_TT4_4_USFGRO0_VW4_WG8_8_4_WGM8
    SolutionIndex: 224
    SolutionNameMin: Cijk_Ailk_Bjlk_SB_MT64x64x8_SE_AMAS3_GRVW2_TT4_4_USFGRO0_VW2_WG16_16_1_WGM1
    SolutionIndex: 225
    SolutionNameMin: Cijk_Ailk_Bjlk_SB_MT32x64x16_SE_AMAS3_GRVW2_TT4_4_USFGRO0_VW2_WG8_16_2_WGM1
    SolutionIndex: 226
    SolutionNameMin: Cijk_Ailk_Bjlk_SB_MT64x32x8_SE_AMAS3_GRVW1_TT4_2_USFGRO1_VW2_WG16_16_1_WGM1
    SolutionIndex: 227
    SolutionNameMin: Cijk_Ailk_Bjlk_SB_MT32x64x16_SE_AMAS3_GRVW2_TT4_4_USFGRO0_VW2_WG8_16_2_WGM8
    SolutionIndex: 228
    SolutionNameMin: Cijk_Ailk_Bjlk_SB_MT64x32x8_SE_AMAS3_GRVW4_TT4_2_USFGRO0_VW2_WG16_16_1_WGM1
    SolutionIndex: 229
    SolutionNameMin: Cijk_Ailk_Bjlk_SB_MT64x32x32_SE_AMAS3_GRVW4_TT4_4_USFGRO0_VW4_WG16_8_2_WGM1
    SolutionIndex: 230
    SolutionNameMin: Cijk_Ailk_Bjlk_SB_MT32x32x32_SE_AMAS3_GRVW2_TT4_4_USFGRO0_VW2_WG8_8_4_WGM1
    SolutionIndex: 231
    SolutionNameMin: Cijk_Ailk_Bjlk_SB_MT64x32x8_SE_AMAS3_GRVW1_TT4_4_USFGRO1_VW4_WG16_8_2_WGM1
    SolutionIndex: 232
    SolutionNameMin: Cijk_Ailk_Bjlk_SB_MT32x32x32_SE_AMAS3_GRVW2_TT4_4_USFGRO0_VW2_WG8_8_4_WGM1
    SolutionIndex: 233
    SolutionNameMin: Cijk_Ailk_Bjlk_SB_MT64x32x32_SE_AMAS3_GRVW2_TT4_4_USFGRO0_VW2_WG16_8_2_WGM1
    SolutionIndex: 234
    SolutionNameMin: Cijk_Ailk_Bjlk_SB_MT128x128x8_SE_AMAS3_GRVW1_TT8_8_USFGRO1_VW4_WG16_16_1_WGM1
    SolutionIndex: 235
    SolutionNameMin: Cijk_Ailk_Bjlk_SB_MT16x32x32_SE_AMAS3_GRVW1_TT2_4_USFGRO1_VW2_WG8_8_4_WGM8
    SolutionIndex: 236
    SolutionNameMin: Cijk_Ailk_Bjlk_SB_MT64x32x16_SE_AMAS3_GRVW1_TT4_4_USFGRO1_VW4_WG16_8_2_WGM1
    SolutionIndex: 237
    SolutionNameMin: Cijk_Ailk_Bjlk_SB_MT32x64x16_SE_AMAS3_GRVW2_TT4_4_USFGRO0_VW2_WG8_16_2_WGM1
    SolutionIndex: 238
    SolutionNameMin: Cijk_Ailk_Bjlk_SB_MT32x16x32_SE_AMAS1_GRVW1_TT4_2_USFGRO1_VW1_WG8_8_4_WGM8
    SolutionIndex: 239
    SolutionNameMin: Cijk_Ailk_Bjlk_SB_MT128x128x16_SE_AMAS3_GRVW1_TT8_8_USFGRO1_VW4_WG16_16_1_WGM1
    SolutionIndex: 240
    SolutionNameMin: Cijk_Ailk_Bjlk_SB_MT64x32x32_SE_AMAS3_GRVW2_TT8_4_USFGRO0_VW2_WG8_8_4_WGM1
    SolutionIndex: 241
    SolutionNameMin: Cijk_Ailk_Bjlk_SB_MT64x32x32_SE_AMAS3_GRVW4_TT4_4_USFGRO0_VW4_WG16_8_2_WGM1
    SolutionIndex: 242
    SolutionNameMin: Cijk_Ailk_Bjlk_SB_MT32x32x32_SE_AMAS3_GRVW2_TT4_4_USFGRO0_VW2_WG8_8_4_WGM8
    SolutionIndex: 243
    SolutionNameMin: Cijk_Ailk_Bjlk_SB_MT64x64x8_SE_AMAS3_GRVW4_TT4_4_USFGRO0_VW2_WG16_16_1_WGM1
    SolutionIndex: 244
    SolutionNameMin: Cijk_Ailk_Bjlk_SB_MT64x64x16_SE_AMAS3_GRVW2_TT4_4_USFGRO0_VW2_WG16_16_1_WGM1
    SolutionIndex: 245
    SolutionNameMin: Cijk_Ailk_Bjlk_SB_MT64x32x32_SE_AMAS3_GRVW2_TT8_4_USFGRO0_VW2_WG8_8_4_WGM8
    SolutionIndex: 246
    SolutionNameMin: Cijk_Ailk_Bjlk_SB_MT32x32x32_SE_AMAS3_GRVW1_TT4_4_USFGRO1_VW4_WG8_8_4_WGM1
    SolutionIndex: 247
    SolutionNameMin: Cijk_Ailk_Bjlk_SB_MT64x32x32_SE_AMAS3_GRVW4_TT4_4_USFGRO0_VW4_WG16_8_2_WGM8
    SolutionIndex: 248
    SolutionNameMin: Cijk_Ailk_Bjlk_SB_MT16x32x16_SE_AMAS3_GRVW1_TT2_4_USFGRO1_VW2_WG8_8_4_WGM1
    SolutionIndex: 249
    SolutionNameMin: Cijk_Ailk_Bjlk_SB_MT64x64x8_SE_AMAS3_GRVW1_TT4_4_USFGRO1_VW2_WG16_16_1_WGM8
    SolutionIndex: 250
    SolutionNameMin: Cijk_Ailk_Bjlk_SB_MT32x64x32_SE_AMAS3_GRVW2_TT4_4_USFGRO0_VW2_WG8_16_2_WGM1
    SolutionIndex: 251
    SolutionNameMin: Cijk_Ailk_Bjlk_SB_MT16x32x32_SE_AMAS1_GRVW1_TT2_4_USFGRO1_VW1_WG8_8_4_WGM1
    SolutionIndex: 252
    SolutionNameMin: Cijk_Ailk_Bjlk_SB_MT32x32x32_SE_AMAS3_GRVW1_TT4_4_USFGRO1_VW2_WG8_8_4_WGM8
    SolutionIndex: 253
    SolutionNameMin: Cijk_Ailk_Bjlk_SB_MT64x32x16_SE_AMAS3_GRVW1_TT4_4_USFGRO1_VW2_WG16_8_2_WGM8
    SolutionIndex: 254
    SolutionNameMin: Cijk_Ailk_Bjlk_SB_MT64x32x16_SE_AMAS3_GRVW2_TT4_4_USFGRO0_VW2_WG16_8_2_WGM8
    SolutionIndex: 255
    SolutionNameMin: Cijk_Ailk_Bjlk_SB_MT32x32x16_SE_AMAS3_GRVW2_TT4_4_USFGRO0_VW2_WG8_8_4_WGM1
    SolutionIndex: 256
    SolutionNameMin: Cijk_Ailk_Bjlk_SB_MT64x32x8_SE_AMAS1_GRVW1_TT4_2_USFGRO1_VW1_WG16_16_1_WGM1
    SolutionIndex: 257
    SolutionNameMin: Cijk_Ailk_Bjlk_SB_MT32x64x16_SE_AMAS3_GRVW1_TT4_4_USFGRO1_VW4_WG8_16_2_WGM8
    SolutionIndex: 258
    SolutionNameMin: Cijk_Ailk_Bjlk_SB_MT32x16x16_SE_AMAS3_GRVW2_TT4_2_USFGRO0_VW2_WG8_8_4_WGM1
    SolutionIndex: 259
    SolutionNameMin: Cijk_Ailk_Bjlk_SB_MT64x16x16_SE_AMAS3_GRVW1_TT4_2_USFGRO1_VW2_WG16_8_2_WGM1
    SolutionIndex: 260
    SolutionNameMin: Cijk_Ailk_Bjlk_SB_MT32x32x32_SE_AMAS3_GRVW2_TT4_4_USFGRO0_VW2_WG8_8_4_WGM8
    SolutionIndex: 261
    SolutionNameMin: Cijk_Ailk_Bjlk_SB_MT32x64x32_SE_AMAS3_GRVW4_TT4_4_USFGRO0_VW4_WG8_16_2_WGM1
    SolutionIndex: 262
    SolutionNameMin: Cijk_Ailk_Bjlk_SB_MT64x64x16_SE_AMAS3_GRVW1_TT4_4_USFGRO1_VW2_WG16_16_1_WGM1
    SolutionIndex: 263
    SolutionNameMin: Cijk_Ailk_Bjlk_SB_MT64x64x8_SE_AMAS3_GRVW4_TT4_4_USFGRO0_VW2_WG16_16_1_WGM8
    SolutionIndex: 264
    SolutionNameMin: Cijk_Ailk_Bjlk_SB_MT32x32x32_SE_AMAS3_GRVW1_TT4_4_USFGRO1_VW2_WG8_8_4_WGM1
    SolutionIndex: 265
    SolutionNameMin: Cijk_Ailk_Bjlk_SB_MT32x16x32_SE_AMAS3_GRVW2_TT4_2_USFGRO0_VW2_WG8_8_4_WGM1
    SolutionIndex: 266
    SolutionNameMin: Cijk_Ailk_Bjlk_SB_MT64x32x16_SE_AMAS1_GRVW1_TT4_4_USFGRO1_VW1_WG16_8_2_WGM8
    SolutionIndex: 267
    SolutionNameMin: Cijk_Ailk_Bjlk_SB_MT128x128x8_SE_AMAS3_GRVW4_TT8_8_USFGRO0_VW4_WG16_16_1_WGM1
    SolutionIndex: 268
    SolutionNameMin: Cijk_Ailk_Bjlk_SB_MT32x64x32_SE_AMAS3_GRVW2_TT4_8_USFGRO0_VW2_WG8_8_4_WGM1
    SolutionIndex: 269
    SolutionNameMin: Cijk_Ailk_Bjlk_SB_MT32x32x8_SE_AMAS3_GRVW4_TT4_2_USFGRO1_VW2_WG8_16_2_WGM8
    SolutionIndex: 270
    SolutionNameMin: Cijk_Ailk_Bjlk_SB_MT64x16x16_SE_AMAS3_GRVW2_TT4_2_USFGRO0_VW2_WG16_8_2_WGM8
    SolutionIndex: 271
    SolutionNameMin: Cijk_Ailk_Bjlk_SB_MT64x16x32_SE_AMAS3_GRVW1_TT4_2_USFGRO1_VW2_WG16_8_2_WGM8
    SolutionIndex: 272
    SolutionNameMin: Cijk_Ailk_Bjlk_SB_MT64x64x16_SE_DTL0_EPS0_FL0_GRVW1_PGR0_PLR1_TT4_4_USFGRO1_VW4_WG16_16_1_WGM8
    SolutionIndex: 273
    SolutionNameMin: Cijk_Ailk_Bjlk_SB_MT64x64x8_SE_DTL0_EPS1_FL0_GRVW1_PGR1_PLR0_TT4_4_USFGRO1_VW4_WG16_16_1_WGM1
    SolutionIndex: 274
    SolutionNameMin: Cijk_Ailk_Bjlk_SB_MT64x16x16_SE_DTL0_EPS1_FL0_GRVW4_PGR1_PLR1_TT4_4_USFGRO0_VW4_WG16_4_4_WGM8
    SolutionIndex: 275
    SolutionNameMin: Cijk_Ailk_Bjlk_SB_MT64x64x8_SE_DTL0_EPS1_FL1_GRVW2_PGR1_PLR1_TT4_4_USFGRO0_VW2_WG16_16_1_WGM8
    SolutionIndex: 276
    SolutionNameMin: Cijk_Ailk_Bjlk_SB_MT64x64x8_SE_DTL0_EPS0_FL0_GRVW1_PGR0_PLR0_TT4_4_USFGRO1_VW4_WG16_16_1_WGM8
    SolutionIndex: 277
    SolutionNameMin: Cijk_Ailk_Bjlk_SB_MT64x64x8_SE_DTL0_EPS1_FL0_GRVW1_PGR1_PLR1_TT4_4_USFGRO1_VW2_WG16_16_1_WGM8
    SolutionIndex: 278
    SolutionNameMin: Cijk_Ailk_Bjlk_SB_MT64x64x16_SE_DTL0_EPS0_FL0_GRVW1_PGR0_PLR1_TT4_4_USFGRO1_VW4_WG16_16_1_WGM1
    SolutionIndex: 279
    SolutionNameMin: Cijk_Ailk_Bjlk_SB_MT64x128x8_SE_DTL0_EPS1_FL0_GRVW2_PGR1_PLR1_TT4_8_USFGRO0_VW2_WG16_16_1_WGM8
    SolutionIndex: 280
    SolutionNameMin: Cijk_Ailk_Bjlk_SB_MT64x64x16_SE_DTL0_EPS0_FL0_GRVW1_PGR0_PLR1_TT4_4_USFGRO1_VW2_WG16_16_1_WGM8
    SolutionIndex: 281
    SolutionNameMin: Cijk_Ailk_Bjlk_SB_MT64x96x8_SE_DTL0_EPS1_FL1_GRVW2_PGR1_PLR1_TT4_6_USFGRO0_VW2_WG16_16_1_WGM8
    SolutionIndex: 282
    SolutionNameMin: Cijk_Ailk_Bjlk_SB_MT64x64x8_SE_DTL0_EPS1_FL0_GRVW1_PGR1_PLR0_TT4_4_USFGRO1_VW2_WG16_16_1_WGM8
    SolutionIndex: 283
    SolutionNameMin: Cijk_Ailk_Bjlk_SB_MT64x32x16_SE_DTL0_EPS0_FL0_GRVW2_PGR0_PLR1_TT4_4_USFGRO0_VW2_WG16_8_1_WGM8
    SolutionIndex: 284
    SolutionNameMin: Cijk_Ailk_Bjlk_SB_MT64x16x32_SE_DTL0_EPS1_FL1_GRVW2_PGR1_PLR1_TT4_4_USFGRO0_VW2_WG16_4_4_WGM1
    SolutionIndex: 285
    SolutionNameMin: Cijk_Ailk_Bjlk_SB_MT64x64x8_SE_DTL0_EPS1_FL0_GRVW1_PGR1_PLR0_TT4_8_USFGRO1_VW2_WG16_8_1_WGM1
    SolutionIndex: 286
    SolutionNameMin: Cijk_Ailk_Bjlk_SB_MT32x64x16_SE_DTL0_EPS1_FL0_GRVW1_PGR1_PLR1_TT4_4_USFGRO1_VW2_WG8_16_2_WGM1
    SolutionIndex: 287
    SolutionNameMin: Cijk_Ailk_Bjlk_SB_MT64x64x8_SE_DTL0_EPS1_FL0_GRVW4_PGR1_PLR0_TT4_8_USFGRO0_VW4_WG16_8_1_WGM1
    SolutionIndex: 288
    SolutionNameMin: Cijk_Ailk_Bjlk_SB_MT64x64x8_SE_DTL0_EPS1_FL1_GRVW4_PGR1_PLR0_TT8_4_USFGRO0_VW4_WG8_16_1_WGM1
    SolutionIndex: 289
    SolutionNameMin: Cijk_Ailk_Bjlk_SB_MT128x64x8_SE_DTL0_EPS1_FL0_GRVW1_PGR1_PLR0_TT8_4_USFGRO1_VW4_WG16_16_1_WGM8
    SolutionIndex: 290
    SolutionNameMin: Cijk_Ailk_Bjlk_SB_MT64x64x8_SE_DTL0_EPS1_FL0_GRVW4_PGR1_PLR0_TT8_4_USFGRO0_VW4_WG8_16_1_WGM1
    SolutionIndex: 291
    SolutionNameMin: Cijk_Ailk_Bjlk_SB_MT64x64x8_SE_DTL0_EPS1_FL0_GRVW1_PGR1_PLR0_TT4_8_USFGRO1_VW4_WG16_8_1_WGM1
    SolutionIndex: 292
    SolutionNameMin: Cijk_Ailk_Bjlk_SB_MT96x64x8_SE_DTL0_EPS1_FL0_GRVW1_PGR1_PLR1_TT6_4_USFGRO1_VW2_WG16_16_1_WGM8
    SolutionIndex: 293
    SolutionNameMin: Cijk_Ailk_Bjlk_SB_MT64x96x8_SE_DTL0_EPS1_FL1_GRVW2_PGR1_PLR1_TT4_6_USFGRO0_VW2_WG16_16_1_WGM1
    SolutionIndex: 294
    SolutionNameMin: Cijk_Ailk_Bjlk_SB_MT32x64x16_SE_DTL0_EPS0_FL1_GRVW2_PGR0_PLR1_TT4_4_USFGRO0_VW2_WG8_16_1_WGM1
    SolutionIndex: 295
    SolutionNameMin: Cijk_Ailk_Bjlk_SB_MT64x64x8_SE_DTL0_EPS1_FL0_GRVW4_PGR1_PLR0_TT4_8_USFGRO0_VW4_WG16_8_1_WGM8
    SolutionIndex: 296
    SolutionNameMin: Cijk_Ailk_Bjlk_SB_MT64x64x8_SE_DTL0_EPS0_FL0_GRVW1_PGR0_PLR1_TT4_4_USFGRO1_VW2_WG16_16_1_WGM1
    SolutionIndex: 297
    SolutionNameMin: Cijk_Ailk_Bjlk_SB_MT64x64x8_SE_DTL0_EPS1_FL1_GRVW4_PGR1_PLR0_TT4_8_USFGRO0_VW4_WG16_8_1_WGM8
    SolutionIndex: 298
    SolutionNameMin: Cijk_Ailk_Bjlk_SB_MT64x64x8_SE_DTL0_EPS1_FL0_GRVW1_PGR1_PLR1_TT4_4_USFGRO1_VW4_WG16_16_1_WGM8
    SolutionIndex: 299
    SolutionNameMin: Cijk_Ailk_Bjlk_SB_MT32x16x32_SE_DTL0_EPS1_FL0_GRVW1_PGR1_PLR1_TT2_4_USFGRO1_VW2_WG16_4_4_WGM1
    SolutionIndex: 300
    SolutionNameMin: Cijk_Ailk_Bjlk_SB_MT64x64x8_SE_DTL0_EPS1_FL1_GRVW4_PGR1_PLR1_TT4_8_USFGRO0_VW4_WG16_8_1_WGM8
    SolutionIndex: 301
    SolutionNameMin: Cijk_Ailk_Bjlk_SB_MT64x128x8_SE_DTL0_EPS1_FL1_GRVW2_PGR1_PLR1_TT4_8_USFGRO0_VW2_WG16_16_1_WGM1
    SolutionIndex: 302
    SolutionNameMin: Cijk_Ailk_Bjlk_SB_MT32x64x8_SE_DTL0_EPS1_FL1_GRVW2_PGR1_PLR1_TT4_4_USFGRO0_VW2_WG8_16_1_WGM1
    SolutionIndex: 303
    SolutionNameMin: Cijk_Ailk_Bjlk_SB_MT64x64x8_SE_DTL0_EPS1_FL0_GRVW1_PGR1_PLR0_TT4_4_USFGRO1_VW4_WG16_16_1_WGM8
    SolutionIndex: 304
    SolutionNameMin: Cijk_Ailk_Bjlk_SB_MT64x96x8_SE_DTL0_EPS1_FL0_GRVW1_PGR1_PLR1_TT4_6_USFGRO1_VW2_WG16_16_1_WGM8
    SolutionIndex: 305
    SolutionNameMin: Cijk_Ailk_Bjlk_SB_MT64x64x16_SE_DTL0_EPS0_FL0_GRVW1_PGR0_PLR1_TT4_4_USFGRO1_VW2_WG16_16_1_WGM1
    SolutionIndex: 306
    SolutionNameMin: Cijk_Ailk_Bjlk_SB_MT96x64x8_SE_DTL0_EPS1_FL0_GRVW1_PGR1_PLR1_TT6_4_USFGRO1_VW2_WG16_16_1_WGM1
    SolutionIndex: 307
    SolutionNameMin: Cijk_Ailk_Bjlk_SB_MT64x64x16_SE_DTL0_EPS1_FL0_GRVW4_PGR1_PLR1_TT4_4_USFGRO0_VW4_WG16_16_1_WGM8
    SolutionIndex: 308
    SolutionNameMin: Cijk_Ailk_Bjlk_SB_MT64x64x8_SE_DTL0_EPS1_FL0_GRVW1_PGR1_PLR0_TT4_8_USFGRO1_VW4_WG16_8_1_WGM8
    SolutionIndex: 309
    SolutionNameMin: Cijk_Ailk_Bjlk_SB_MT64x128x8_SE_DTL0_EPS1_FL1_GRVW2_PGR1_PLR1_TT4_8_USFGRO0_VW2_WG16_16_1_WGM8
    SolutionIndex: 310
    SolutionNameMin: Cijk_Ailk_Bjlk_SB_MT32x64x16_SE_DTL0_EPS1_FL0_GRVW1_PGR1_PLR1_TT4_4_USFGRO1_VW4_WG8_16_2_WGM1
    SolutionIndex: 311
    SolutionNameMin: Cijk_Ailk_Bjlk_SB_MT32x32x16_SE_DTL0_EPS1_FL1_GRVW4_PGR1_PLR1_TT2_4_USFGRO0_VW2_WG16_8_2_WGM1
    SolutionIndex: 312
    SolutionNameMin: Cijk_Ailk_Bjlk_SB_MT64x128x8_SE_DTL0_EPS1_FL0_GRVW2_PGR1_PLR1_TT4_8_USFGRO0_VW2_WG16_16_1_WGM1
    SolutionIndex: 313
    SolutionNameMin: Cijk_Ailk_Bjlk_SB_MT16x32x32_SE_DTL0_EPS1_FL1_GRVW2_PGR1_PLR1_TT4_2_USFGRO0_VW2_WG4_16_4_WGM1
    SolutionIndex: 314
    SolutionNameMin: Cijk_Ailk_Bjlk_SB_MT64x16x16_SE_DTL0_EPS1_FL0_GRVW4_PGR1_PLR1_TT4_4_USFGRO0_VW4_WG16_4_4_WGM1
    SolutionIndex: 315
    SolutionNameMin: Cijk_Ailk_Bjlk_SB_MT64x64x16_SE_DTL0_EPS1_FL0_GRVW4_PGR1_PLR1_TT4_4_USFGRO0_VW4_WG16_16_1_WGM1
    SolutionIndex: 316
    SolutionNameMin: Cijk_Ailk_Bjlk_SB_MT64x64x8_SE_DTL0_EPS1_FL0_GRVW4_PGR1_PLR1_TT4_4_USFGRO0_VW2_WG16_16_1_WGM1
    SolutionIndex: 317
    SolutionNameMin: Cijk_Ailk_Bjlk_SB_MT32x64x16_SE_DTL0_EPS0_FL0_GRVW1_PGR0_PLR1_TT2_4_USFGRO1_VW2_WG16_16_1_WGM1
    SolutionIndex: 318
    SolutionNameMin: Cijk_Ailk_Bjlk_SB_MT96x64x8_SE_DTL0_EPS1_FL1_GRVW2_PGR1_PLR1_TT6_4_USFGRO0_VW2_WG16_16_1_WGM8
    SolutionIndex: 319
    SolutionNameMin: Cijk_Ailk_Bjlk_SB_MT16x64x16_SE_DTL0_EPS1_FL0_GRVW4_PGR1_PLR1_TT4_4_USFGRO0_VW4_WG4_16_4_WGM8
    SolutionIndex: 320
    SolutionNameMin: Cijk_Ailk_Bjlk_SB_MT64x128x8_SE_DTL0_EPS1_FL0_GRVW1_PGR1_PLR0_TT4_8_USFGRO1_VW4_WG16_16_1_WGM1
    SolutionIndex: 321
    SolutionNameMin: Cijk_Ailk_Bjlk_SB_MT8x32x32_SE_DTL0_EPS1_FL0_GRVW1_PGR1_PLR1_TT2_2_USFGRO1_VW2_WG4_16_4_WGM1
    SolutionIndex: 322
    SolutionNameMin: Cijk_Ailk_Bjlk_SB_MT64x128x8_SE_DTL0_EPS1_FL0_GRVW1_PGR1_PLR0_TT4_8_USFGRO1_VW4_WG16_16_1_WGM8
    SolutionIndex: 323
    SolutionNameMin: Cijk_Ailk_Bjlk_SB_MT64x64x16_SE_DTL0_EPS1_FL0_GRVW1_PGR1_PLR1_TT4_4_USFGRO1_VW4_WG16_16_1_WGM1
    SolutionIndex: 324
    SolutionNameMin: Cijk_Ailk_Bjlk_SB_MT32x64x8_SE_DTL0_EPS1_FL0_GRVW4_PGR1_PLR1_TT2_4_USFGRO0_VW2_WG16_16_1_WGM8
    SolutionIndex: 325
    SolutionNameMin: Cijk_Ailk_Bjlk_SB_MT128x32x8_SE_DTL1_EPS0_FL0_GRVW1_PGR0_PLR1_TT8_4_USFGRO1_VW4_WG16_8_1_WGM8
    SolutionIndex: 326
    SolutionNameMin: Cijk_Ailk_Bjlk_SB_MT64x32x8_SE_DTL0_EPS0_FL0_GRVW1_PGR0_PLR1_TT4_4_USFGRO1_VW4_WG16_8_1_WGM1
    SolutionIndex: 327
    SolutionNameMin: Cijk_Ailk_Bjlk_SB_MT128x64x8_SE_DTL0_EPS1_FL0_GRVW2_PGR1_PLR0_TT8_4_USFGRO0_VW2_WG16_16_1_WGM1
    SolutionIndex: 328
    SolutionNameMin: Cijk_Ailk_Bjlk_SB_MT32x64x16_SE_DTL0_EPS0_FL0_GRVW2_PGR0_PLR1_TT4_4_USFGRO0_VW2_WG8_16_1_WGM8
    SolutionIndex: 329
    SolutionNameMin: Cijk_Ailk_Bjlk_SB_MT32x64x16_SE_DTL0_EPS0_FL0_GRVW1_PGR0_PLR1_TT2_4_USFGRO1_VW2_WG16_16_1_WGM8
    SolutionIndex: 330
    SolutionNameMin: Cijk_Ailk_Bjlk_SB_MT64x128x8_SE_DTL0_EPS1_FL0_GRVW2_PGR1_PLR0_TT4_8_USFGRO0_VW2_WG16_16_1_WGM1
    SolutionIndex: 331
    SolutionNameMin: Cijk_Ailk_Bjlk_SB_MT64x64x8_SE_DTL0_EPS1_FL0_GRVW4_PGR1_PLR0_TT8_4_USFGRO0_VW4_WG8_16_1_WGM8
    SolutionIndex: 332
    SolutionNameMin: Cijk_Ailk_Bjlk_SB_MT64x64x8_SE_DTL0_EPS1_FL0_GRVW2_PGR1_PLR1_TT4_4_USFGRO0_VW2_WG16_16_1_WGM8
    SolutionIndex: 333
    SolutionNameMin: Cijk_Ailk_Bjlk_SB_MT64x64x16_SE_DTL0_EPS1_FL1_GRVW4_PGR1_PLR1_TT4_4_USFGRO0_VW4_WG16_16_1_WGM8
    SolutionIndex: 334
    SolutionNameMin: Cijk_Ailk_Bjlk_SB_MT64x64x8_SE_DTL0_EPS0_FL0_GRVW1_PGR0_PLR1_TT4_4_USFGRO1_VW4_WG16_16_1_WGM1
    SolutionIndex: 335
    SolutionNameMin: Cijk_Ailk_Bjlk_SB_MT32x32x8_SE_DTL0_EPS1_FL0_GRVW4_PGR1_PLR1_TT2_4_USFGRO1_VW2_WG16_8_2_WGM1
    SolutionIndex: 336
    SolutionNameMin: Cijk_Ailk_Bjlk_SB_MT128x64x8_SE_DTL0_EPS1_FL0_GRVW1_PGR1_PLR1_TT8_4_USFGRO1_VW4_WG16_16_1_WGM8
    SolutionIndex: 337
    SolutionNameMin: Cijk_Ailk_Bjlk_SB_MT128x64x8_SE_DTL0_EPS1_FL0_GRVW1_PGR1_PLR0_TT8_4_USFGRO1_VW4_WG16_16_1_WGM1
    SolutionIndex: 338
    SolutionNameMin: Cijk_Ailk_Bjlk_SB_MT64x32x8_SE_DTL0_EPS0_FL0_GRVW1_PGR0_PLR1_TT4_4_USFGRO1_VW4_WG16_8_1_WGM8
    SolutionIndex: 339
    SolutionNameMin: Cijk_Ailk_Bjlk_SB_MT64x64x8_SE_DTL0_EPS1_FL0_GRVW1_PGR1_PLR1_TT4_4_USFGRO1_VW2_WG16_16_1_WGM1
    SolutionIndex: 340
    SolutionNameMin: Cijk_Ailk_Bjlk_SB_MT96x64x8_SE_DTL0_EPS1_FL1_GRVW2_PGR1_PLR1_TT6_4_USFGRO0_VW2_WG16_16_1_WGM1
    SolutionIndex: 341
    SolutionNameMin: Cijk_Ailk_Bjlk_SB_MT128x64x8_SE_DTL0_EPS1_FL1_GRVW2_PGR1_PLR1_TT8_4_USFGRO0_VW2_WG16_16_1_WGM8
    SolutionIndex: 342
    SolutionNameMin: Cijk_Ailk_Bjlk_SB_MT64x64x16_SE_DTL0_EPS1_FL0_GRVW1_PGR1_PLR1_TT4_4_USFGRO1_VW4_WG16_16_1_WGM8
    SolutionIndex: 343
    SolutionNameMin: Cijk_Ailk_Bjlk_SB_MT128x64x16_SE_DTL0_EPS0_FL0_GRVW1_PGR0_PLR1_TT8_4_USFGRO1_VW4_WG16_16_1_WGM1
    SolutionIndex: 344
    SolutionNameMin: Cijk_Ailk_Bjlk_SB_MT64x128x8_SE_DTL0_EPS1_FL1_GRVW2_PGR1_PLR1_TT4_8_USFGRO0_VW2_WG16_16_1_WGM1
    SolutionIndex: 345
    SolutionNameMin: Cijk_Ailk_Bjlk_SB_MT64x64x8_SE_DTL0_EPS1_FL0_GRVW4_PGR1_PLR0_TT4_8_USFGRO0_VW4_WG16_8_1_WGM1
    SolutionIndex: 346
    SolutionNameMin: Cijk_Ailk_Bjlk_SB_MT64x64x8_SE_DTL0_EPS1_FL0_GRVW1_PGR1_PLR0_TT4_4_USFGRO1_VW4_WG16_16_1_WGM1
    SolutionIndex: 347
    SolutionNameMin: Cijk_Ailk_Bjlk_SB_MT128x32x8_SE_DTL1_EPS0_FL0_GRVW1_PGR0_PLR1_TT8_4_USFGRO1_VW4_WG16_8_1_WGM8
    SolutionIndex: 348
    SolutionNameMin: Cijk_Ailk_Bjlk_SB_MT64x64x8_SE_DTL0_EPS1_FL1_GRVW4_PGR1_PLR0_TT8_4_USFGRO0_VW4_WG8_16_1_WGM1
    SolutionIndex: 349
    SolutionNameMin: Cijk_Ailk_Bjlk_SB_MT64x64x8_SE_DTL0_EPS1_FL0_GRVW4_PGR1_PLR0_TT4_8_USFGRO0_VW4_WG16_8_1_WGM8
    SolutionIndex: 350
    SolutionNameMin: Cijk_Ailk_Bjlk_SB_MT64x128x8_SE_DTL0_EPS1_FL0_GRVW1_PGR1_PLR0_TT4_8_USFGRO1_VW4_WG16_16_1_WGM8
    SolutionIndex: 351
    SolutionNameMin: Cijk_Ailk_Bjlk_SB_MT64x128x8_SE_DTL0_EPS1_FL1_GRVW2_PGR1_PLR1_TT4_8_USFGRO0_VW2_WG16_16_1_WGM8
    SolutionIndex: 352
    SolutionNameMin: Cijk_Ailk_Bjlk_SB_MT64x64x8_SE_DTL0_EPS1_FL0_GRVW1_PGR1_PLR0_TT4_4_USFGRO1_VW4_WG16_16_1_WGM8
    SolutionIndex: 353
    SolutionNameMin: Cijk_Ailk_Bjlk_SB_MT64x128x8_SE_DTL0_EPS1_FL0_GRVW1_PGR1_PLR0_TT4_8_USFGRO1_VW4_WG16_16_1_WGM1
    SolutionIndex: 354
    SolutionNameMin: Cijk_Ailk_Bjlk_SB_MT64x128x8_SE_DTL0_EPS1_FL1_GRVW2_PGR1_PLR0_TT4_8_USFGRO0_VW2_WG16_16_1_WGM8
    SolutionIndex: 355
    SolutionNameMin: Cijk_Ailk_Bjlk_SB_MT64x64x16_SE_DTL0_EPS0_FL0_GRVW1_PGR0_PLR1_TT4_4_USFGRO1_VW4_WG16_16_1_WGM1
    SolutionIndex: 356
    SolutionNameMin: Cijk_Ailk_Bjlk_SB_MT64x64x8_SE_DTL0_EPS1_FL0_GRVW4_PGR1_PLR0_TT8_4_USFGRO0_VW4_WG8_16_1_WGM1
    SolutionIndex: 357
    SolutionNameMin: Cijk_Ailk_Bjlk_SB_MT64x128x8_SE_DTL0_EPS1_FL0_GRVW1_PGR1_PLR1_TT4_8_USFGRO1_VW2_WG16_16_1_WGM8
    SolutionIndex: 358
    SolutionNameMin: Cijk_Ailk_Bjlk_SB_MT64x64x16_SE_EPS1_FL1_GRVW2_NLCA1_NLCB1_PGR1_PLR1_TT4_4_USFGRO0_VW2_WGM8
    SolutionIndex: 359
    SolutionNameMin: Cijk_Ailk_Bjlk_SB_MT64x128x8_SE_EPS1_FL1_GRVW2_NLCA1_NLCB1_PGR1_PLR1_TT4_8_USFGRO0_VW2_WGM1
    SolutionIndex: 360
    SolutionNameMin: Cijk_Ailk_Bjlk_SB_MT128x64x16_SE_EPS0_FL0_GRVW4_NLCA1_NLCB1_PGR0_PLR1_TT8_4_USFGRO0_VW4_WGM8
    SolutionIndex: 361
    SolutionNameMin: Cijk_Ailk_Bjlk_SB_MT128x128x8_SE_EPS1_FL0_GRVW1_NLCA1_NLCB1_PGR1_PLR1_TT8_8_USFGRO1_VW2_WGM1
    SolutionIndex: 362
    SolutionNameMin: Cijk_Ailk_Bjlk_SB_MT64x16x8_SE_DTL0_EPS0_FL0_GRVW1_PGR0_PLR1_TT4_2_USFGRO1_VW2_WG16_8_1_WGM1
    SolutionIndex: 363
    SolutionNameMin: Cijk_Ailk_Bjlk_SB_MT64x32x8_SE_DTL0_EPS0_FL0_GRVW1_PGR0_PLR1_TT4_4_USFGRO1_VW2_WG16_8_1_WGM1
    SolutionIndex: 364
    SolutionNameMin: Cijk_Ailk_Bjlk_SB_MT128x64x8_SE_DTL0_EPS1_FL0_GRVW2_PGR1_PLR1_TT8_4_USFGRO0_VW2_WG16_16_1_WGM1
    SolutionIndex: 365
    SolutionNameMin: Cijk_Ailk_Bjlk_SB_MT128x64x8_SE_DTL0_EPS1_FL1_GRVW2_PGR1_PLR1_TT8_4_USFGRO0_VW2_WG16_16_1_WGM1
    SolutionIndex: 366
    SolutionNameMin: Cijk_Ailk_Bjlk_SB_MT128x64x8_SE_DTL0_EPS1_FL0_GRVW2_PGR1_PLR1_TT8_4_USFGRO0_VW2_WG16_16_1_WGM8
    SolutionIndex: 367
    SolutionNameMin: Cijk_Ailk_Bjlk_SB_MT64x16x16_SE_DTL0_EPS0_FL1_GRVW2_PGR0_PLR1_TT4_2_USFGRO0_VW2_WG16_8_1_WGM1
    SolutionIndex: 368
    SolutionNameMin: Cijk_Ailk_Bjlk_SB_MT64x16x16_SE_DTL0_EPS0_FL0_GRVW2_PGR0_PLR1_TT4_2_USFGRO0_VW2_WG16_8_1_WGM8
    SolutionIndex: 369
    SolutionNameMin: Cijk_Ailk_Bjlk_SB_MT64x16x16_SE_DTL0_EPS0_FL0_GRVW2_PGR0_PLR1_TT4_2_USFGRO0_VW2_WG16_8_1_WGM1
    SolutionIndex: 370
    SolutionNameMin: Cijk_Ailk_Bjlk_SB_MT64x16x16_SE_DTL0_EPS0_FL0_GRVW1_PGR0_PLR0_TT4_2_USFGRO1_VW2_WG16_8_1_WGM8
    SolutionIndex: 371
    SolutionNameMin: Cijk_Ailk_Bjlk_SB_MT64x16x8_SE_DTL0_EPS0_FL0_GRVW1_PGR0_PLR0_TT4_2_USFGRO1_VW2_WG16_8_1_WGM1
    SolutionIndex: 372
    SolutionNameMin: Cijk_Ailk_Bjlk_SB_MT64x16x8_SE_DTL0_EPS0_FL0_GRVW1_PGR0_PLR1_TT4_2_USFGRO1_VW2_WG16_8_1_WGM8
    SolutionIndex: 373
    SolutionNameMin: Cijk_Ailk_Bjlk_SB_MT64x16x8_SE_DTL0_EPS0_FL0_GRVW2_PGR0_PLR1_TT4_2_USFGRO0_VW2_WG16_8_1_WGM1
    SolutionIndex: 374
    SolutionNameMin: Cijk_Ailk_Bjlk_SB_MT64x32x32_SE_DTL0_EPS0_FL0_GRVW1_PGR0_PLR1_TT4_2_USFGRO1_VW2_WG16_16_1_WGM8
    SolutionIndex: 375
    SolutionNameMin: Cijk_Ailk_Bjlk_SB_MT64x32x8_SE_DTL0_EPS0_FL0_GRVW1_PGR0_PLR0_TT4_4_USFGRO1_VW2_WG16_8_1_WGM1
    SolutionIndex: 376
    SolutionNameMin: Cijk_Ailk_Bjlk_SB_MT64x64x16_SE_DTL0_EPS1_FL0_GRVW1_PGR1_PLR1_TT4_4_USFGRO1_VW4_WG16_16_1_WGM1
    SolutionIndex: 377
    SolutionNameMin: Cijk_Ailk_Bjlk_SB_MT64x64x8_SE_DTL0_EPS1_FL0_GRVW4_PGR1_PLR0_TT4_8_USFGRO0_VW4_WG16_8_1_WGM1
    SolutionIndex: 378
    SolutionNameMin: Cijk_Ailk_Bjlk_SB_MT64x32x8_SE_DTL0_EPS0_FL0_GRVW1_PGR0_PLR1_TT4_4_USFGRO1_VW4_WG16_8_1_WGM1
    SolutionIndex: 379
    SolutionNameMin: Cijk_Ailk_Bjlk_SB_MT64x32x8_SE_DTL0_EPS0_FL0_GRVW1_PGR0_PLR1_TT4_4_USFGRO1_VW2_WG16_8_1_WGM8
    SolutionIndex: 380
    SolutionNameMin: Cijk_Ailk_Bjlk_SB_MT64x32x8_SE_DTL0_EPS0_FL1_GRVW2_PGR0_PLR1_TT4_4_USFGRO0_VW2_WG16_8_1_WGM8
    SolutionIndex: 381
    SolutionNameMin: Cijk_Ailk_Bjlk_SB_MT64x32x8_SE_DTL0_EPS1_FL0_GRVW2_PGR1_PLR1_TT4_4_USFGRO0_VW2_WG16_8_1_WGM1
    SolutionIndex: 382
    SolutionNameMin: Cijk_Ailk_Bjlk_SB_MT64x64x8_SE_DTL0_EPS1_FL1_GRVW4_PGR1_PLR0_TT4_4_USFGRO0_VW2_WG16_16_1_WGM1
    SolutionIndex: 383
    SolutionNameMin: Cijk_Ailk_Bjlk_SB_MT64x64x8_SE_DTL0_EPS1_FL1_GRVW2_PGR1_PLR1_TT4_4_USFGRO0_VW2_WG16_16_1_WGM1
    SolutionIndex: 384
    SolutionNameMin: Cijk_Ailk_Bjlk_SB_MT64x32x8_SE_DTL0_EPS1_FL0_GRVW2_PGR1_PLR1_TT4_4_USFGRO0_VW2_WG16_8_1_WGM8
    SolutionIndex: 385
    SolutionNameMin: Cijk_Ailk_Bjlk_SB_MT64x32x8_SE_DTL0_EPS1_FL1_GRVW2_PGR1_PLR1_TT4_4_USFGRO0_VW2_WG16_8_1_WGM1
    SolutionIndex: 386
    SolutionNameMin: Cijk_Ailk_Bjlk_SB_MT64x64x8_SE_DTL0_EPS1_FL0_GRVW2_PGR1_PLR0_TT8_4_USFGRO0_VW2_WG8_16_1_WGM8
    SolutionIndex: 387
    SolutionNameMin: Cijk_Ailk_Bjlk_SB_MT64x128x8_SE_DTL0_EPS1_FL1_GRVW2_PGR1_PLR1_TT4_8_USFGRO0_VW2_WG16_16_1_WGM1
    SolutionIndex: 388
    SolutionNameMin: Cijk_Ailk_Bjlk_SB_MT64x64x8_SE_DTL0_EPS1_FL1_GRVW4_PGR1_PLR0_TT4_8_USFGRO0_VW4_WG16_8_1_WGM8
    SolutionIndex: 389
    SolutionNameMin: Cijk_Ailk_Bjlk_SB_MT64x64x8_SE_DTL0_EPS1_FL1_GRVW4_PGR1_PLR0_TT4_8_USFGRO0_VW4_WG16_8_1_WGM1
    SolutionIndex: 390
    SolutionNameMin: Cijk_Ailk_Bjlk_SB_MT64x64x8_SE_DTL0_EPS1_FL0_GRVW4_PGR1_PLR0_TT8_4_USFGRO0_VW4_WG8_16_1_WGM8
    SolutionIndex: 391
    SolutionNameMin: Cijk_Ailk_Bjlk_SB_MT64x128x8_SE_DTL0_EPS1_FL0_GRVW2_PGR1_PLR1_TT4_8_USFGRO0_VW2_WG16_16_1_WGM1
    SolutionIndex: 392
    SolutionNameMin: Cijk_Ailk_Bjlk_SB_MT64x128x8_SE_DTL0_EPS1_FL0_GRVW1_PGR1_PLR0_TT4_8_USFGRO1_VW4_WG16_16_1_WGM1
    SolutionIndex: 393
    SolutionNameMin: Cijk_Ailk_Bjlk_SB_MT64x128x8_SE_DTL0_EPS1_FL0_GRVW1_PGR1_PLR0_TT4_8_USFGRO1_VW4_WG16_16_1_WGM8
    SolutionIndex: 394
    SolutionNameMin: Cijk_Ailk_Bjlk_SB_MT64x128x8_SE_DTL0_EPS1_FL0_GRVW2_PGR1_PLR1_TT4_8_USFGRO0_VW2_WG16_16_1_WGM8
    SolutionIndex: 395
    SolutionNameMin: Cijk_Ailk_Bjlk_SB_MT32x128x8_SE_DTL1_EPS0_FL0_GRVW1_PGR0_PLR1_TT4_8_USFGRO1_VW4_WG8_16_1_WGM1
    SolutionIndex: 396
    SolutionNameMin: Cijk_Ailk_Bjlk_SB_MT64x64x8_SE_DTL0_EPS1_FL0_GRVW4_PGR1_PLR0_TT4_8_USFGRO0_VW4_WG16_8_1_WGM1
    SolutionIndex: 397
    SolutionNameMin: Cijk_Ailk_Bjlk_SB_MT64x64x16_SE_DTL0_EPS0_FL0_GRVW1_PGR0_PLR1_TT4_4_USFGRO1_VW4_WG16_16_1_WGM8
    SolutionIndex: 398
    SolutionNameMin: Cijk_Ailk_Bjlk_SB_MT64x64x8_SE_DTL0_EPS1_FL0_GRVW1_PGR1_PLR0_TT4_4_USFGRO1_VW4_WG16_16_1_WGM8
    SolutionIndex: 399
    SolutionNameMin: Cijk_Ailk_Bjlk_SB_MT128x32x8_SE_DTL1_EPS0_FL0_GRVW1_PGR0_PLR1_TT8_4_USFGRO1_VW4_WG16_8_1_WGM8
    SolutionIndex: 400
    SolutionNameMin: Cijk_Ailk_Bjlk_SB_MT64x64x8_SE_DTL0_EPS1_FL0_GRVW1_PGR1_PLR0_TT4_4_USFGRO1_VW4_WG16_16_1_WGM1
    SolutionIndex: 401
    SolutionNameMin: Cijk_Ailk_Bjlk_SB_MT32x32x8_SE_EPS0_FL0_GRVW1_GSU1_PGR0_PLR0_TT2_2_USFGRO1_VW2_WG16_16_1_WGM1
    SolutionIndex: 402
    SolutionNameMin: Cijk_Ailk_Bjlk_SB_MT64x128x8_MI32x32x1x2_SE_ONLL0_SNLL0
    SolutionIndex: 403
    SolutionNameMin: Cijk_Ailk_Bjlk_SB_MT64x128x16_MI32x32x1x2_SE_ONLL0_SNLL1
    SolutionIndex: 404
    SolutionNameMin: Cijk_Ailk_Bjlk_SB_MT64x128x8_MI32x32x1x2_SE_ONLL1_SNLL1
    SolutionIndex: 405
    SolutionNameMin: Cijk_Ailk_Bjlk_SB_MT64x128x8_MI32x32x1x2_SE_ONLL1_SNLL0
    SolutionIndex: 406
    SolutionNameMin: Cijk_Ailk_Bjlk_SB_MT64x128x16_MI32x32x1x2_SE_ONLL1_SNLL0
    SolutionIndex: 407
    SolutionNameMin: Cijk_Ailk_Bjlk_SB_MT64x256x16_MI32x32x1x2_SE_ONLL1_SNLL0
    SolutionIndex: 408
    SolutionNameMin: Cijk_Ailk_Bjlk_SB_MT64x128x16_MI32x32x1x2_SE_ONLL0_SNLL0
    SolutionIndex: 409
    SolutionNameMin: Cijk_Ailk_Bjlk_SB_MT64x128x32_MI32x32x1x2_SE_ONLL1_SNLL0
    SolutionIndex: 410
    SolutionNameMin: Cijk_Ailk_Bjlk_SB_MT64x128x8_MI32x32x1x2_SE_ONLL0_SNLL1
    SolutionIndex: 411
    SolutionNameMin: Cijk_Ailk_Bjlk_SB_MT96x64x8_SE_EPS1_FL1_GRVW2_PGR1_PLR1_TT6_4_USFGRO0_VW2_WGM1
    SolutionIndex: 412
    SolutionNameMin: Cijk_Ailk_Bjlk_SB_MT64x96x8_SE_EPS1_FL1_GRVW2_PGR1_PLR1_TT4_6_USFGRO0_VW2_WGM1
    SolutionIndex: 413
    SolutionNameMin: Cijk_Ailk_Bjlk_SB_MT96x64x8_SE_EPS1_FL1_GRVW2_PGR1_PLR1_TT6_4_USFGRO0_VW2_WGM8
    SolutionIndex: 414
    SolutionNameMin: Cijk_Ailk_Bjlk_SB_MT64x96x8_SE_EPS1_FL1_GRVW2_PGR1_PLR1_TT4_6_USFGRO0_VW2_WGM8
    SolutionIndex: 415
    SolutionNameMin: Cijk_Ailk_Bjlk_SB_MT128x64x8_SE_EPS1_FL0_GRVW2_PGR1_PLR1_TT8_4_USFGRO0_VW2_WGM8
    SolutionIndex: 416
    SolutionNameMin: Cijk_Ailk_Bjlk_SB_MT128x64x8_SE_EPS1_FL1_GRVW2_PGR1_PLR1_TT8_4_USFGRO0_VW2_WGM8
    SolutionIndex: 417
    SolutionNameMin: Cijk_Ailk_Bjlk_SB_MT128x64x8_SE_EPS1_FL1_GRVW2_PGR1_PLR1_TT8_4_USFGRO0_VW2_WGM1
    SolutionIndex: 418
    SolutionNameMin: Cijk_Ailk_Bjlk_SB_MT96x64x16_SE_EPS1_FL0_GRVW2_PGR1_PLR1_TT6_4_USFGRO0_VW2_WGM8
    SolutionIndex: 419
    SolutionNameMin: Cijk_Ailk_Bjlk_SB_MT64x16x16_SE_EPS1_FL0_GRVW4_PGR1_PLR1_TT4_4_USFGRO0_VW4_WGM8
    SolutionIndex: 420
    SolutionNameMin: Cijk_Ailk_Bjlk_SB_MT16x64x16_SE_EPS1_FL0_GRVW4_PGR1_PLR1_TT4_4_USFGRO0_VW4_WGM1
    SolutionIndex: 421
    SolutionNameMin: Cijk_Ailk_Bjlk_SB_MT64x16x16_SE_EPS1_FL0_GRVW4_PGR1_PLR0_TT4_4_USFGRO0_VW4_WGM8
    SolutionIndex: 422
    SolutionNameMin: Cijk_Ailk_Bjlk_SB_MT64x64x8_SE_EPS0_FL1_GRVW2_PGR0_PLR0_TT4_4_USFGRO0_VW2_WGM8
    SolutionIndex: 423
    SolutionNameMin: Cijk_Ailk_Bjlk_SB_MT16x64x16_SE_EPS1_FL0_GRVW4_PGR1_PLR0_TT4_4_USFGRO0_VW4_WGM1
    SolutionIndex: 424
    SolutionNameMin: Cijk_Ailk_Bjlk_SB_MT64x64x8_SE_EPS0_FL0_GRVW2_PGR0_PLR0_TT4_4_USFGRO0_VW2_WGM8
    SolutionIndex: 425
    SolutionNameMin: Cijk_Ailk_Bjlk_SB_MT64x128x8_SE_EPS1_FL0_GRVW1_PGR1_PLR1_TT4_8_USFGRO1_VW2_WGM8
    SolutionIndex: 426
    SolutionNameMin: Cijk_Ailk_Bjlk_SB_MT64x32x16_SE_EPS1_FL1_GRVW4_GSU1_PGR1_PLR1_TT4_4_USFGRO0_VW4_WG16_8_1_WGM1
    SolutionIndex: 427
    SolutionNameMin: Cijk_Ailk_Bjlk_SB_MT64x32x8_SE_EPS1_FL1_GRVW2_GSU1_PGR1_PLR1_TT4_4_USFGRO0_VW2_WG16_8_1_WGM8
    SolutionIndex: 428
    SolutionNameMin: Cijk_Ailk_Bjlk_SB_MT128x128x16_SE_EPS0_FL0_GRVW2_GSU1_PGR0_PLR1_TT8_8_USFGRO0_VW2_WG16_16_1_WGM1
    SolutionIndex: 429
    SolutionNameMin: Cijk_Ailk_Bjlk_SB_MT96x64x8_SE_EPS1_FL1_GRVW2_GSU1_PGR1_PLR1_TT6_4_USFGRO0_VW2_WG16_16_1_WGM1
    SolutionIndex: 430
    SolutionNameMin: Cijk_Ailk_Bjlk_SB_MT128x64x16_SE_EPS0_FL0_GRVW1_GSU1_PGR0_PLR0_TT8_4_USFGRO1_VW2_WG16_16_1_WGM8
    SolutionIndex: 431
    SolutionNameMin: Cijk_Ailk_Bjlk_SB_MT128x64x16_SE_EPS0_FL0_GRVW4_GSU1_PGR0_PLR0_TT8_4_USFGRO0_VW4_WG16_16_1_WGM8
    SolutionIndex: 432
    SolutionNameMin: Cijk_Ailk_Bjlk_SB_MT64x64x8_SE_EPS1_FL0_GRVW1_GSU1_PGR1_PLR0_TT4_4_USFGRO1_VW4_WG16_16_1_WGM8
    SolutionIndex: 433
    SolutionNameMin: Cijk_Ailk_Bjlk_SB_MT32x32x8_SE_EPS1_FL0_GRVW1_GSU1_PGR1_PLR0_TT2_2_USFGRO1_VW2_WG16_16_1_WGM1
    SolutionIndex: 434
    SolutionNameMin: Cijk_Ailk_Bjlk_SB_MT32x8x32_SE_EPS1_FL0_GRVW1_GSU8_PGR1_PLR1_TT2_2_USFGRO1_VW2_WG16_4_4_WGM8
    SolutionIndex: 435
    SolutionNameMin: Cijk_Ailk_Bjlk_SB_MT128x128x32_MI32x32x1x2_SE_FL1_NLCB1_ONLL0_PLR1_SNLL0_TT2_32_USFGRO0_WG64_4_1
    SolutionIndex: 436
    SolutionNameMin: Cijk_Ailk_Bjlk_SB_MT128x128x32_MI32x32x1x2_SE_FL0_NLCB1_ONLL0_PLR1_SNLL0_TT2_32_USFGRO0_WG64_4_1
    SolutionIndex: 437
    SolutionNameMin: Cijk_Ailk_Bjlk_SB_MT128x128x32_MI32x32x1x2_SE_FL1_NLCB1_ONLL1_PLR1_SNLL0_TT2_32_USFGRO0_WG64_4_1
    SolutionIndex: 438
    SolutionNameMin: Cijk_Ailk_Bjlk_SB_MT128x128x8_MI32x32x1x2_SE_FL0_NLCB1_ONLL1_PLR0_SNLL0_TT2_32_USFGRO1_WG64_4_1
    SolutionIndex: 439
    SolutionNameMin: Cijk_Ailk_Bjlk_SB_MT32x256x8_MI32x32x1x2_SE_FL0_NLCB1_ONLL0_PLR0_SNLL1_TT1_32_USFGRO0_WG16_16_1
    SolutionIndex: 440
    SolutionNameMin: Cijk_Ailk_Bjlk_SB_MT32x256x8_MI32x32x1x2_SE_FL0_NLCB1_ONLL0_PLR0_SNLL0_TT1_32_USFGRO0_WG16_16_1
    SolutionIndex: 441
    SolutionNameMin: Cijk_Ailk_Bjlk_SB_MT64x128x16_MI32x32x1x2_SE_FL0_NLCB1_ONLL0_PLR0_SNLL0_TT1_32_USFGRO1_WG64_4_1
    SolutionIndex: 442
    SolutionNameMin: Cijk_Ailk_Bjlk_SB_MT32x256x8_MI32x32x1x2_SE_FL1_NLCB1_ONLL1_PLR1_SNLL1_TT1_32_USFGRO1_WG16_16_1
    SolutionIndex: 443
    SolutionNameMin: Cijk_Ailk_Bjlk_SB_MT32x256x8_MI32x32x1x2_SE_FL1_NLCB1_ONLL0_PLR1_SNLL0_TT1_32_USFGRO1_WG16_16_1
    SolutionIndex: 444
    SolutionNameMin: Cijk_Ailk_Bjlk_SB_MT32x256x8_MI32x32x1x2_SE_FL0_NLCB1_ONLL0_PLR0_SNLL0_TT1_32_USFGRO1_WG16_16_1
    SolutionIndex: 445
    SolutionNameMin: Cijk_Ailk_Bjlk_SB_MT32x256x16_MI32x32x1x2_SE_FL0_NLCB1_ONLL0_PLR0_SNLL1_TT1_32_USFGRO0_WG16_16_1
    SolutionIndex: 446
    SolutionNameMin: Cijk_Ailk_Bjlk_SB_MT64x128x8_MI32x32x1x2_SE_
    SolutionIndex: 447
    SolutionNameMin: Cijk_Ailk_Bjlk_SB_MT128x64x32_MI16x16x1x4_SE_GRVW2_TT2_16_VW2_WG64_4_1_WGM16
    SolutionIndex: 448
    SolutionNameMin: Cijk_Ailk_Bjlk_SB_MT128x64x32_MI16x16x1x4_SE_GRVW2_TT2_16_VW2_WG64_4_1_WGM8
    SolutionIndex: 449
    SolutionNameMin: Cijk_Ailk_Bjlk_SB_MT128x64x8_MI16x16x1x4_SE_GRVW2_TT2_16_VW2_WG64_4_1_WGM8
    SolutionIndex: 450
    SolutionNameMin: Cijk_Ailk_Bjlk_SB_MT256x64x8_MI16x16x1x4_SE_GRVW4_TT4_16_VW4_WG64_4_1_WGM16
    SolutionIndex: 451
    SolutionNameMin: Cijk_Ailk_Bjlk_SB_MT256x128x8_MI32x32x1x2_SE_GRVW4_TT4_32_VW4_WG64_4_1_WGM16
    SolutionIndex: 452
    SolutionNameMin: Cijk_Ailk_Bjlk_SB_MT128x64x32_MI16x16x1x4_SE_GRVW2_TT2_16_VW2_WG64_4_1_WGM4
    SolutionIndex: 453
    SolutionNameMin: Cijk_Ailk_Bjlk_SB_MT128x128x16_MI16x16x1x4_SE_GRVW2_TT2_32_VW2_WG64_4_1_WGM4
    SolutionIndex: 454
    SolutionNameMin: Cijk_Ailk_Bjlk_SB_MT128x64x8_MI16x16x1x4_SE_GRVW2_TT2_16_VW2_WG64_4_1_WGM4
    SolutionIndex: 455
    SolutionNameMin: Cijk_Ailk_Bjlk_SB_MT32x128x8_MI32x32x2x1_SE_FL0_ONLL0_PLR0_SNLL0_TT1_32_USFGRO0
    SolutionIndex: 456
    SolutionNameMin: Cijk_Ailk_Bjlk_SB_MT64x64x16_MI16x16x4x1_SE_FL1_ONLL1_PLR0_SNLL0_TT4_16_USFGRO1
    SolutionIndex: 457
    SolutionNameMin: Cijk_Ailk_Bjlk_SB_MT32x128x8_MI32x32x2x1_SE_FL0_ONLL0_PLR0_SNLL1_TT1_32_USFGRO0
    SolutionIndex: 458
    SolutionNameMin: Cijk_Ailk_Bjlk_SB_MT64x64x16_MI16x16x4x1_SE_FL0_ONLL1_PLR0_SNLL0_TT4_16_USFGRO1
    SolutionIndex: 459
    SolutionNameMin: Cijk_Ailk_Bjlk_SB_MT64x128x8_MI32x32x1x2_SE_FL1_ONLL0_PLR0_SNLL1_TT1_32_USFGRO0
    SolutionIndex: 460
    SolutionIndex: 461
    SolutionIndex: 462
    SolutionIndex: 463
    SolutionIndex: 464
    SolutionIndex: 465
    SolutionIndex: 466
    SolutionIndex: 467
    SolutionIndex: 468
    SolutionIndex: 469
    SolutionIndex: 470
    SolutionIndex: 471
    SolutionIndex: 472
    SolutionIndex: 473
    SolutionIndex: 474
    SolutionIndex: 475
    SolutionIndex: 476
    SolutionIndex: 477
    SolutionIndex: 478
    SolutionIndex: 479
    SolutionIndex: 480
    SolutionIndex: 481
    SolutionIndex: 482
    SolutionIndex: 483
    SolutionIndex: 484
    SolutionIndex: 485
    SolutionIndex: 486
    SolutionIndex: 487
    SolutionIndex: 488
    SolutionIndex: 489
    SolutionIndex: 490
    SolutionIndex: 491
    SolutionIndex: 492
    SolutionIndex: 493
    SolutionIndex: 494
    SolutionIndex: 495
    SolutionIndex: 496
    SolutionIndex: 497
    SolutionIndex: 498
    SolutionIndex: 499
    SolutionIndex: 500
    SolutionIndex: 501
    SolutionIndex: 502
    SolutionIndex: 503
    SolutionIndex: 504
    SolutionIndex: 505
    SolutionIndex: 506
    SolutionIndex: 507
    SolutionIndex: 508
    SolutionIndex: 509
    SolutionIndex: 510
    SolutionIndex: 511
    SolutionIndex: 512
    SolutionIndex: 513
    SolutionIndex: 514
    SolutionIndex: 515
    SolutionIndex: 516
    SolutionIndex: 517
    SolutionIndex: 518
    SolutionIndex: 519
    SolutionIndex: 520
    SolutionIndex: 521
    SolutionIndex: 522
    SolutionIndex: 523
    SolutionIndex: 524
    SolutionIndex: 525
    SolutionIndex: 526
    SolutionIndex: 527
    SolutionIndex: 528
    SolutionIndex: 529
    SolutionIndex: 530
    SolutionIndex: 531
    SolutionIndex: 532
    SolutionIndex: 533
    SolutionIndex: 534
    SolutionIndex: 535
    SolutionIndex: 536
    SolutionIndex: 537
    SolutionIndex: 538
    SolutionIndex: 539
    SolutionIndex: 540
    SolutionIndex: 541
    SolutionIndex: 542
    SolutionIndex: 543
    SolutionIndex: 544
    SolutionIndex: 545
    SolutionIndex: 546
    SolutionIndex: 547
    SolutionIndex: 548
    SolutionIndex: 549
    SolutionIndex: 550
    SolutionIndex: 551
    SolutionIndex: 552
    SolutionIndex: 553
    SolutionIndex: 554
    SolutionIndex: 555
    SolutionIndex: 556
    SolutionIndex: 557
    SolutionIndex: 558
    SolutionIndex: 559
    SolutionIndex: 560
    SolutionIndex: 561
    SolutionIndex: 562
    SolutionIndex: 563
    SolutionIndex: 564
    SolutionIndex: 565
    SolutionIndex: 566
    SolutionIndex: 567
    SolutionIndex: 568
    SolutionIndex: 569
    SolutionIndex: 570
    SolutionIndex: 571
    SolutionIndex: 572
    SolutionIndex: 573
    SolutionIndex: 574
    SolutionIndex: 575
    SolutionIndex: 576
    SolutionIndex: 577
    SolutionIndex: 578
    SolutionIndex: 579
    SolutionIndex: 580
    SolutionIndex: 581
    SolutionIndex: 582
    SolutionIndex: 583
    SolutionIndex: 584
    SolutionIndex: 585
    SolutionIndex: 586
    SolutionIndex: 587
    SolutionIndex: 588
    SolutionIndex: 589
    SolutionIndex: 590
- - - [1024, 64, 1, 512]
    - [13, 8.185]
  - - [512, 512, 1, 200]
    - [10, 18.894]
  - - [512, 32, 1, 200]
    - [3, 1.464]
  - - [2048, 2048, 1, 512]
    - [9, 69.996]
  - - [1600, 1024, 1, 512]
    - [4, 62.597]
  - - [1024, 1024, 1, 512]
    - [14, 51.132]
  - - [1024, 1024, 1, 200]
    - [11, 37.791]
  - - [1024, 1024, 1, 4096]
    - [540, 60.112]
  - - [4096, 1024, 1, 4096]
    - [0, 79.985]
  - - [1024, 1024, 1, 2048]
    - [536, 58.311]
  - - [4096, 1024, 1, 2048]
    - [542, 84.552]
  - - [768, 768, 1, 16]
    - [17, 6.505]
  - - [768, 768, 1, 320]
    - [24, 39.641]
  - - [3072, 768, 1, 4096]
    - [8, 76.392]
  - - [768, 768, 1, 4096]
    - [2, 56.092]
  - - [768, 768, 1, 32]
    - [23, 11.737]
  - - [768, 768, 1, 640]
    - [24, 45.52]
  - - [768, 768, 1, 64]
    - [12, 19.952]
  - - [768, 768, 1, 1280]
    - [2, 49.574]
  - - [1024, 1024, 1, 3072]
    - [1, 59.121]
  - - [3072, 1024, 1, 2048]
    - [543, 77.307]
  - - [3072, 1024, 1, 3072]
    - [12, 78.564]
  - - [3072, 1024, 1, 512]
    - [7, 68.841]
  - - [1024, 1024, 1, 120]
    - [6, 30.697]
  - - [1024, 1024, 1, 1]
    - [20, 0.617]
  - - [1024, 1024, 1, 20]
    - [19, 10.078]
  - - [1024, 1024, 1, 4]
    - [5, 2.418]
  - - [1024, 1024, 1, 6]
    - [18, 3.562]
  - - [1024, 1024, 1, 80]
    - [16, 25.829]
  - - [128, 64, 512, 128]
    - [21, 32.681]
  - - [512, 64, 64, 512]
    - [6, 45.956]
  - - [64, 64, 768, 64]
    - [22, 22.325]
  - - [1024, 128, 1, 128]
    - [25, 2.608]
  - - [4, 704, 1, 1280]
    - [26, 0.922]
  - - [4, 1856, 1, 3328]
    - [26, 1.47]
  - - [1856, 448, 1, 3328]
    - [27, 17.676]
  - - [2944, 4288, 1, 1280]
    - [28, 22.982]
  - - [2368, 64, 1, 3328]
    - [29, 14.811]
  - - [2368, 5888, 1, 256]
    - [27, 23.116]
  - - [128, 64, 1, 256]
    - [30, 0.95]
  - - [5888, 1024, 1, 1280]
    - [31, 21.745]
  - - [128, 6784, 1, 3328]
    - [32, 19.546]
  - - [64, 4, 1, 256]
    - [33, 0.028]
  - - [5888, 1856, 1, 3328]
    - [27, 23.835]
  - - [5056, 704, 1, 256]
    - [34, 20.366]
  - - [5888, 2944, 1, 3328]
    - [35, 19.303]
  - - [1856, 4288, 1, 256]
    - [36, 22.8]
  - - [1024, 5056, 1, 128]
    - [37, 9.891]
  - - [5056, 5056, 1, 3328]
    - [36, 24.196]
  - - [1408, 5888, 1, 1280]
    - [28, 23.543]
  - - [2368, 448, 1, 128]
    - [38, 6.278]
  - - [1024, 3584, 1, 3328]
    - [39, 23.49]
  - - [4, 2944, 1, 1280]
    - [40, 1.552]
  - - [1408, 64, 1, 128]
    - [41, 2.177]
  - - [256, 4288, 1, 3328]
    - [27, 19.323]
  - - [5888, 1408, 1, 1280]
    - [35, 24.408]
  - - [704, 1856, 1, 3328]
    - [36, 22.92]
  - - [4, 1408, 1, 128]
    - [42, 0.062]
  - - [1024, 2368, 1, 256]
    - [36, 19.095]
  - - [1408, 1856, 1, 1280]
    - [39, 21.12]
  - - [1408, 64, 1, 1280]
    - [32, 11.877]
  - - [448, 1024, 1, 1280]
    - [36, 18.046]
  - - [256, 1408, 1, 3328]
    - [27, 14.78]
  - - [5056, 5056, 1, 1280]
    - [34, 23.427]
  - - [448, 5056, 1, 256]
    - [28, 17.768]
  - - [704, 1856, 1, 1280]
    - [36, 22.523]
  - - [128, 5056, 1, 128]
    - [37, 5.838]
  - - [2368, 128, 1, 256]
    - [36, 9.765]
  - - [1856, 1408, 1, 128]
    - [43, 10.662]
  - - [64, 5056, 1, 256]
    - [28, 7.889]
  - - [6784, 256, 1, 3328]
    - [36, 16.209]
  - - [6784, 4288, 1, 3328]
    - [31, 23.125]
  - - [4288, 448, 1, 256]
    - [44, 14.672]
  - - [64, 704, 1, 128]
    - [45, 0.963]
  - - [1856, 2368, 1, 3328]
    - [36, 23.16]
  - - [4288, 2944, 1, 1280]
    - [27, 23.297]
  - - [704, 5056, 1, 1280]
    - [36, 23.016]
  - - [2368, 704, 1, 3328]
    - [27, 19.616]
  - - [256, 5888, 1, 256]
    - [36, 20.095]
  - - [1856, 4288, 1, 3328]
    - [27, 23.672]
  - - [256, 2944, 1, 256]
    - [46, 13.478]
  - - [5888, 1024, 1, 256]
    - [47, 17.027]
  - - [448, 64, 1, 1280]
    - [48, 7.141]
  - - [448, 5056, 1, 3328]
    - [36, 20.946]
  - - [3584, 4, 1, 1280]
    - [49, 1.626]
  - - [2944, 64, 1, 256]
    - [50, 6.651]
  - - [128, 4, 1, 1280]
    - [33, 0.219]
  - - [1408, 2944, 1, 256]
    - [36, 22.451]
  - - [256, 1856, 1, 1280]
    - [36, 18.69]
  - - [6784, 5056, 1, 3328]
    - [31, 21.14]
  - - [5056, 5056, 1, 256]
    - [27, 23.27]
  - - [1408, 6784, 1, 128]
    - [37, 12.887]
  - - [64, 1024, 1, 1280]
    - [51, 9.335]
  - - [2944, 4, 1, 256]
    - [40, 0.937]
  - - [704, 5056, 1, 128]
    - [37, 11.441]
  - - [4, 2368, 1, 1280]
    - [49, 1.446]
  - - [2368, 2944, 1, 1280]
    - [31, 18.905]
  - - [128, 3584, 1, 1280]
    - [34, 15.404]
  - - [6784, 6784, 1, 1280]
    - [27, 24.194]
  - - [1408, 4288, 1, 1280]
    - [34, 20.944]
  - - [3584, 4288, 1, 1280]
    - [31, 24.487]
  - - [2368, 704, 1, 1280]
    - [27, 21.037]
  - - [5056, 4288, 1, 3328]
    - [47, 23.865]
  - - [3584, 2368, 1, 3328]
    - [27, 23.723]
  - - [64, 704, 1, 1280]
    - [48, 8.587]
  - - [4288, 256, 1, 256]
    - [27, 14.192]
  - - [2944, 128, 1, 128]
    - [52, 5.405]
  - - [6784, 448, 1, 1280]
    - [34, 22.367]
  - - [1408, 2944, 1, 128]
    - [37, 11.565]
  - - [4288, 2944, 1, 256]
    - [31, 19.956]
  - - [5888, 704, 1, 1280]
    - [36, 23.502]
  - - [1856, 64, 1, 1280]
    - [32, 11.06]
  - - [448, 5888, 1, 128]
    - [43, 10.15]
  - - [5888, 64, 1, 3328]
    - [53, 16.754]
  - - [2944, 256, 1, 3328]
    - [36, 21.372]
  - - [1024, 64, 1, 128]
    - [54, 1.478]
  - - [5056, 2368, 1, 1280]
    - [36, 23.9]
  - - [448, 3584, 1, 1280]
    - [36, 20.261]
  - - [6784, 5888, 1, 256]
    - [47, 24.089]
  - - [704, 1024, 1, 128]
    - [37, 7.138]
  - - [704, 128, 1, 1280]
    - [32, 11.361]
  - - [5888, 2944, 1, 128]
    - [43, 12.041]
  - - [4, 3584, 1, 128]
    - [55, 0.245]
  - - [1408, 448, 1, 1280]
    - [36, 17.539]
  - - [1024, 1408, 1, 256]
    - [56, 14.743]
  - - [2368, 2368, 1, 3328]
    - [34, 23.059]
  - - [1856, 6784, 1, 128]
    - [43, 13.113]
  - - [5056, 704, 1, 3328]
    - [28, 18.94]
  - - [1408, 1856, 1, 256]
    - [27, 17.069]
  - - [1408, 704, 1, 3328]
    - [27, 21.26]
  - - [2368, 5056, 1, 256]
    - [27, 21.982]
  - - [5888, 1856, 1, 256]
    - [31, 14.741]
  - - [4288, 64, 1, 3328]
    - [57, 16.704]
  - - [2368, 4, 1, 1280]
    - [58, 1.383]
  - - [704, 5888, 1, 256]
    - [27, 22.362]
  - - [4288, 64, 1, 256]
    - [51, 7.763]
  - - [6784, 64, 1, 256]
    - [27, 8.857]
  - - [2944, 256, 1, 256]
    - [36, 17.685]
  - - [2944, 6784, 1, 3328]
    - [36, 24.042]
  - - [704, 1408, 1, 3328]
    - [36, 20.688]
  - - [3584, 704, 1, 3328]
    - [36, 22.822]
  - - [2944, 256, 1, 128]
    - [37, 7.165]
  - - [6784, 4, 1, 1280]
    - [49, 1.587]
  - - [1024, 64, 1, 1280]
    - [59, 8.393]
  - - [448, 4288, 1, 256]
    - [27, 15.412]
  - - [64, 3584, 1, 3328]
    - [60, 15.731]
  - - [704, 2368, 1, 1280]
    - [36, 21.037]
  - - [448, 2944, 1, 128]
    - [37, 8.174]
  - - [1856, 2368, 1, 1280]
    - [31, 17.393]
  - - [2368, 128, 1, 3328]
    - [29, 16.44]
  - - [2944, 128, 1, 256]
    - [36, 9.713]
  - - [448, 1408, 1, 256]
    - [28, 11.483]
  - - [1856, 4288, 1, 1280]
    - [35, 23.241]
  - - [64, 5056, 1, 3328]
    - [61, 17.302]
  - - [4, 704, 1, 256]
    - [62, 0.313]
  - - [1024, 448, 1, 128]
    - [43, 5.047]
  - - [704, 4, 1, 1280]
    - [26, 0.969]
  - - [704, 256, 1, 128]
    - [37, 2.814]
  - - [704, 2944, 1, 128]
    - [37, 10.374]
  - - [1408, 1024, 1, 1280]
    - [27, 20.785]
  - - [704, 6784, 1, 256]
    - [36, 17.044]
  - - [6784, 704, 1, 256]
    - [27, 13.775]
  - - [5056, 1408, 1, 128]
    - [37, 12.57]
  - - [256, 3584, 1, 3328]
    - [36, 20.021]
  - - [4, 5888, 1, 3328]
    - [63, 1.753]
  - - [128, 1408, 1, 128]
    - [64, 3.534]
  - - [3584, 4288, 1, 3328]
    - [65, 22.583]
  - - [5888, 1856, 1, 1280]
    - [39, 23.712]
  - - [5056, 1024, 1, 3328]
    - [44, 19.878]
  - - [5056, 64, 1, 1280]
    - [61, 14.944]
  - - [1024, 704, 1, 256]
    - [36, 15.242]
  - - [1024, 4288, 1, 128]
    - [66, 8.873]
  - - [4288, 64, 1, 1280]
    - [67, 11.992]
  - - [2368, 3584, 1, 1280]
    - [47, 20.624]
  - - [2368, 6784, 1, 1280]
    - [47, 24.049]
  - - [1024, 256, 1, 256]
    - [27, 10.382]
  - - [1856, 4, 1, 1280]
    - [58, 1.293]
  - - [448, 448, 1, 256]
    - [27, 7.615]
  - - [2944, 3584, 1, 3328]
    - [46, 23.042]
  - - [128, 4288, 1, 128]
    - [68, 5.894]
  - - [64, 448, 1, 256]
    - [69, 2.707]
  - - [128, 1024, 1, 3328]
    - [70, 16.218]
  - - [4, 1408, 1, 3328]
    - [62, 1.564]
  - - [6784, 2944, 1, 256]
    - [34, 21.687]
  - - [64, 1856, 1, 1280]
    - [61, 11.188]
  - - [64, 1024, 1, 128]
    - [41, 1.408]
  - - [4288, 2368, 1, 3328]
    - [65, 22.276]
  - - [1856, 2368, 1, 256]
    - [34, 12.627]
  - - [3584, 256, 1, 128]
    - [66, 7.135]
  - - [3584, 6784, 1, 3328]
    - [44, 23.54]
  - - [256, 1024, 1, 256]
    - [36, 11.028]
  - - [4, 6784, 1, 3328]
    - [71, 1.728]
  - - [1024, 5888, 1, 3328]
    - [36, 23.31]
  - - [1024, 128, 1, 1280]
    - [72, 9.286]
  - - [4288, 128, 1, 1280]
    - [27, 15.271]
  - - [5056, 4288, 1, 1280]
    - [47, 23.707]
  - - [5888, 64, 1, 256]
    - [36, 11.905]
  - - [1856, 256, 1, 1280]
    - [27, 12.154]
  - - [64, 5888, 1, 3328]
    - [32, 17.004]
  - - [2944, 5888, 1, 128]
    - [43, 13.2]
  - - [704, 5888, 1, 1280]
    - [36, 23.505]
  - - [2368, 3584, 1, 128]
    - [37, 12.822]
  - - [6784, 5888, 1, 3328]
    - [47, 20.112]
  - - [704, 1024, 1, 1280]
    - [35, 13.707]
  - - [448, 256, 1, 3328]
    - [61, 15.539]
  - - [448, 1856, 1, 128]
    - [38, 7.322]
  - - [128, 1024, 1, 128]
    - [68, 2.57]
  - - [2944, 4, 1, 128]
    - [55, 0.197]
  - - [1024, 704, 1, 1280]
    - [36, 18.688]
  - - [128, 5888, 1, 256]
    - [36, 17.736]
  - - [1024, 5056, 1, 1280]
    - [73, 23.905]
  - - [4288, 1024, 1, 256]
    - [46, 15.908]
  - - [2944, 2368, 1, 128]
    - [37, 12.478]
  - - [704, 704, 1, 3328]
    - [36, 20.205]
  - - [704, 1408, 1, 1280]
    - [36, 21.178]
  - - [5888, 448, 1, 1280]
    - [27, 13.236]
  - - [3584, 256, 1, 3328]
    - [36, 19.795]
  - - [704, 5888, 1, 3328]
    - [27, 21.265]
  - - [704, 1856, 1, 128]
    - [37, 9.13]
  - - [128, 3584, 1, 3328]
    - [29, 18.169]
  - - [6784, 2368, 1, 1280]
    - [31, 24.013]
  - - [4, 4288, 1, 128]
    - [55, 0.336]
  - - [128, 704, 1, 1280]
    - [32, 11.325]
  - - [3584, 2944, 1, 256]
    - [31, 20.808]
  - - [1856, 128, 1, 3328]
    - [74, 16.683]
  - - [4, 64, 1, 1280]
    - [26, 0.111]
  - - [4, 5056, 1, 3328]
    - [49, 1.713]
  - - [128, 2944, 1, 1280]
    - [74, 15.012]
  - - [2368, 1024, 1, 3328]
    - [27, 21.938]
  - - [128, 256, 1, 3328]
    - [75, 10.48]
  - - [1408, 5056, 1, 3328]
    - [73, 24.178]
  - - [1856, 1856, 1, 3328]
    - [44, 20.589]
  - - [3584, 128, 1, 256]
    - [36, 14.216]
  - - [448, 1408, 1, 3328]
    - [36, 17.945]
  - - [2368, 2368, 1, 256]
    - [46, 19.406]
  - - [4288, 4288, 1, 1280]
    - [65, 23.454]
  - - [64, 448, 1, 1280]
    - [48, 7.32]
  - - [1408, 4288, 1, 256]
    - [36, 20.501]
  - - [448, 4, 1, 256]
    - [76, 0.214]
  - - [5888, 448, 1, 128]
    - [43, 8.983]
  - - [448, 4, 1, 1280]
    - [26, 0.817]
  - - [704, 6784, 1, 3328]
    - [35, 21.854]
  - - [5888, 5888, 1, 1280]
    - [27, 24.108]
  - - [5056, 1024, 1, 1280]
    - [34, 23.114]
  - - [448, 5888, 1, 3328]
    - [36, 21.785]
  - - [128, 4, 1, 128]
    - [55, 0.011]
  - - [1024, 2944, 1, 1280]
    - [56, 18.005]
  - - [5056, 5888, 1, 1280]
    - [35, 24.594]
  - - [4288, 5888, 1, 128]
    - [37, 13.717]
  - - [256, 3584, 1, 256]
    - [36, 17.528]
  - - [1408, 3584, 1, 128]
    - [37, 11.787]
  - - [256, 2944, 1, 3328]
    - [39, 15.944]
  - - [448, 3584, 1, 128]
    - [43, 9.325]
  - - [5888, 2944, 1, 1280]
    - [73, 24.43]
  - - [4, 6784, 1, 1280]
    - [49, 1.746]
  - - [2368, 5888, 1, 128]
    - [37, 13.381]
  - - [64, 2944, 1, 128]
    - [77, 3.34]
  - - [3584, 5888, 1, 256]
    - [27, 23.441]
  - - [2368, 704, 1, 128]
    - [43, 8.975]
  - - [3584, 2944, 1, 1280]
    - [36, 23.658]
  - - [3584, 2368, 1, 128]
    - [37, 12.093]
  - - [5056, 704, 1, 128]
    - [37, 11.387]
  - - [448, 2368, 1, 128]
    - [43, 7.299]
  - - [5056, 1408, 1, 3328]
    - [31, 24.144]
  - - [1408, 704, 1, 256]
    - [39, 17.344]
  - - [6784, 1024, 1, 3328]
    - [47, 23.62]
  - - [6784, 2944, 1, 3328]
    - [35, 24.196]
  - - [2944, 5056, 1, 3328]
    - [36, 24.17]
  - - [1856, 1856, 1, 256]
    - [36, 13.293]
  - - [1024, 5888, 1, 128]
    - [37, 10.164]
  - - [2048, 7133, 1, 2048]
    - [47, 24.935]
  - - [256, 4, 1, 128]
    - [42, 0.011]
  - - [4288, 5888, 1, 1280]
    - [56, 23.349]
  - - [4288, 4288, 1, 256]
    - [39, 14.008]
  - - [448, 2944, 1, 3328]
    - [27, 19.598]
  - - [4288, 1856, 1, 1280]
    - [27, 22.394]
  - - [1856, 2944, 1, 3328]
    - [36, 23.329]
  - - [256, 6784, 1, 3328]
    - [36, 22.176]
  - - [64, 5888, 1, 256]
    - [36, 12.093]
  - - [256, 5056, 1, 128]
    - [37, 7.453]
  - - [5056, 1024, 1, 256]
    - [31, 13.873]
  - - [704, 64, 1, 3328]
    - [57, 12.225]
  - - [5056, 1856, 1, 3328]
    - [73, 22.483]
  - - [4, 2944, 1, 3328]
    - [40, 1.68]
  - - [4, 5056, 1, 256]
    - [78, 1.253]
  - - [1856, 1408, 1, 256]
    - [36, 22.009]
  - - [3584, 4, 1, 128]
    - [55, 0.275]
  - - [448, 448, 1, 3328]
    - [32, 16.383]
  - - [6784, 128, 1, 3328]
    - [79, 18.411]
  - - [4288, 1408, 1, 128]
    - [43, 12.157]
  - - [4288, 5056, 1, 256]
    - [36, 21.72]
  - - [1408, 128, 1, 1280]
    - [61, 12.903]
  - - [5056, 256, 1, 3328]
    - [39, 18.481]
  - - [704, 704, 1, 256]
    - [36, 15.657]
  - - [1024, 5888, 1, 1280]
    - [73, 22.461]
  - - [6784, 2368, 1, 128]
    - [38, 11.999]
  - - [4, 5056, 1, 1280]
    - [62, 1.7]
  - - [64, 128, 1, 256]
    - [30, 0.937]
  - - [128, 1856, 1, 1280]
    - [29, 14.079]
  - - [5056, 3584, 1, 256]
    - [27, 18.054]
  - - [1856, 1024, 1, 1280]
    - [47, 20.796]
  - - [6784, 4288, 1, 1280]
    - [35, 24.128]
  - - [1856, 1856, 1, 1280]
    - [28, 14.695]
  - - [6784, 2944, 1, 128]
    - [37, 13.49]
  - - [1408, 5056, 1, 1280]
    - [28, 22.786]
  - - [4, 2368, 1, 3328]
    - [62, 1.503]
  - - [5888, 1856, 1, 128]
    - [80, 11.671]
  - - [448, 704, 1, 1280]
    - [36, 5.801]
  - - [2368, 1024, 1, 128]
    - [43, 9.923]
  - - [1024, 448, 1, 3328]
    - [36, 18.509]
  - - [1856, 704, 1, 1280]
    - [36, 22.533]
  - - [5056, 3584, 1, 128]
    - [37, 12.462]
  - - [5888, 5888, 1, 3328]
    - [56, 23.453]
  - - [6784, 1024, 1, 256]
    - [31, 13.892]
  - - [2944, 2368, 1, 256]
    - [27, 14.388]
  - - [256, 448, 1, 256]
    - [81, 5.82]
  - - [5056, 5888, 1, 3328]
    - [28, 19.912]
  - - [1856, 1024, 1, 256]
    - [27, 19.074]
  - - [448, 1408, 1, 1280]
    - [36, 17.551]
  - - [3584, 448, 1, 1280]
    - [27, 20.249]
  - - [1024, 1024, 1, 1280]
    - [39, 21.273]
  - - [448, 5888, 1, 256]
    - [36, 18.688]
  - - [704, 64, 1, 128]
    - [54, 0.91]
  - - [1408, 6784, 1, 3328]
    - [27, 23.073]
  - - [448, 1024, 1, 128]
    - [43, 4.498]
  - - [4288, 704, 1, 128]
    - [37, 11.05]
  - - [128, 1856, 1, 128]
    - [82, 4.086]
  - - [448, 2368, 1, 3328]
    - [27, 18.69]
  - - [5056, 64, 1, 128]
    - [82, 5.473]
  - - [5056, 2944, 1, 256]
    - [36, 23.147]
  - - [6784, 5888, 1, 128]
    - [80, 13.411]
  - - [704, 1024, 1, 256]
    - [27, 16.916]
  - - [1024, 4, 1, 256]
    - [40, 0.475]
  - - [2368, 1856, 1, 256]
    - [27, 17.197]
  - - [128, 6784, 1, 1280]
    - [39, 17.894]
  - - [1408, 3584, 1, 3328]
    - [46, 22.931]
  - - [2368, 6784, 1, 256]
    - [36, 23.295]
  - - [5056, 1408, 1, 1280]
    - [73, 23.905]
  - - [256, 256, 1, 128]
    - [45, 1.378]
  - - [5056, 4288, 1, 128]
    - [43, 13.548]
  - - [1408, 1856, 1, 128]
    - [37, 10.836]
  - - [1408, 5888, 1, 3328]
    - [44, 22.923]
  - - [1856, 256, 1, 256]
    - [27, 14.837]
  - - [6784, 6784, 1, 256]
    - [35, 24.419]
  - - [64, 256, 1, 128]
    - [83, 0.372]
  - - [4288, 2368, 1, 128]
    - [80, 9.887]
  - - [1856, 4288, 1, 128]
    - [37, 11.004]
  - - [256, 4288, 1, 1280]
    - [36, 19.027]
  - - [2368, 2944, 1, 256]
    - [73, 19.544]
  - - [4, 1856, 1, 256]
    - [76, 0.67]
  - - [3584, 1856, 1, 1280]
    - [36, 23.404]
  - - [6784, 6784, 1, 128]
    - [37, 13.894]
  - - [256, 1856, 1, 128]
    - [43, 4.716]
  - - [704, 64, 1, 1280]
    - [48, 8.547]
  - - [5888, 5056, 1, 256]
    - [27, 14.867]
  - - [3584, 448, 1, 256]
    - [27, 18.517]
  - - [448, 4288, 1, 128]
    - [37, 9.675]
  - - [2944, 4288, 1, 3328]
    - [28, 23.214]
  - - [256, 6784, 1, 256]
    - [36, 20.259]
  - - [1408, 4288, 1, 128]
    - [43, 11.997]
  - - [2944, 704, 1, 3328]
    - [27, 18.14]
  - - [128, 448, 1, 256]
    - [84, 4.311]
  - - [512, 32, 1, 512]
    - [84, 2.861]
  - - [3584, 3584, 1, 256]
    - [28, 21.713]
  - - [448, 1408, 1, 128]
    - [37, 6.354]
  - - [128, 256, 1, 1280]
    - [48, 8.161]
  - - [3584, 5056, 1, 256]
    - [47, 14.397]
  - - [6784, 128, 1, 256]
    - [36, 15.772]
  - - [4288, 4, 1, 256]
    - [85, 1.105]
  - - [64, 1408, 1, 3328]
    - [32, 15.695]
  - - [704, 448, 1, 256]
    - [27, 10.161]
  - - [2944, 2368, 1, 1280]
    - [46, 21.674]
  - - [448, 64, 1, 3328]
    - [75, 9.731]
  - - [1408, 3584, 1, 256]
    - [36, 22.11]
  - - [3584, 4, 1, 3328]
    - [40, 1.749]
  - - [6784, 3584, 1, 256]
    - [73, 23.523]
  - - [256, 128, 1, 128]
    - [83, 0.719]
  - - [704, 1408, 1, 128]
    - [37, 8.146]
  - - [4, 2368, 1, 256]
    - [76, 0.916]
  - - [2944, 448, 1, 128]
    - [37, 8.485]
  - - [128, 1408, 1, 256]
    - [36, 8.084]
  - - [4, 2944, 1, 256]
    - [85, 0.976]
  - - [64, 128, 1, 3328]
    - [26, 5.337]
  - - [5056, 2368, 1, 128]
    - [37, 13.243]
  - - [2944, 2944, 1, 3328]
    - [34, 23.278]
  - - [5056, 6784, 1, 256]
    - [31, 22.815]
  - - [1856, 3584, 1, 128]
    - [37, 12.577]
  - - [128, 2944, 1, 128]
    - [25, 5.687]
  - - [1024, 704, 1, 3328]
    - [86, 16.606]
  - - [6784, 448, 1, 256]
    - [27, 13.648]
  - - [3584, 6784, 1, 128]
    - [37, 12.944]
  - - [128, 4288, 1, 256]
    - [36, 13.223]
  - - [704, 448, 1, 3328]
    - [28, 11.428]
  - - [1024, 1024, 1, 3328]
    - [39, 20.322]
  - - [128, 128, 1, 3328]
    - [87, 8.081]
  - - [5056, 1856, 1, 256]
    - [36, 23.186]
  - - [256, 128, 1, 256]
    - [84, 3.058]
  - - [1024, 1856, 1, 256]
    - [31, 16.175]
  - - [4288, 64, 1, 128]
    - [52, 4.301]
  - - [256, 448, 1, 3328]
    - [53, 14.359]
  - - [1408, 6784, 1, 1280]
    - [36, 23.72]
  - - [3584, 3584, 1, 1280]
    - [73, 23.601]
  - - [64, 2368, 1, 1280]
    - [32, 11.247]
  - - [448, 2368, 1, 1280]
    - [36, 18.396]
  - - [5888, 5888, 1, 128]
    - [37, 11.711]
  - - [64, 6784, 1, 3328]
    - [27, 17.728]
  - - [2944, 256, 1, 1280]
    - [34, 15.546]
  - - [5056, 5888, 1, 128]
    - [80, 12.956]
  - - [256, 2368, 1, 128]
    - [37, 5.432]
  - - [5056, 2368, 1, 3328]
    - [39, 22.94]
  - - [2944, 4288, 1, 256]
    - [31, 22.051]
  - - [1408, 3584, 1, 1280]
    - [36, 23.012]
  - - [2368, 64, 1, 256]
    - [84, 6.122]
  - - [64, 448, 1, 3328]
    - [75, 9.487]
  - - [256, 256, 1, 3328]
    - [32, 13.457]
  - - [5888, 4, 1, 128]
    - [42, 0.268]
  - - [1856, 704, 1, 256]
    - [36, 20.362]
  - - [4, 4288, 1, 1280]
    - [88, 1.469]
  - - [1408, 448, 1, 3328]
    - [56, 14.499]
  - - [1024, 4, 1, 3328]
    - [62, 1.544]
  - - [2368, 256, 1, 256]
    - [27, 13.125]
  - - [2368, 6784, 1, 3328]
    - [27, 23.993]
  - - [1856, 1408, 1, 1280]
    - [31, 19.803]
  - - [1856, 448, 1, 1280]
    - [47, 15.692]
  - - [6784, 704, 1, 128]
    - [37, 11.665]
  - - [4, 4, 1, 256]
    - [26, 0.002]
  - - [128, 5888, 1, 128]
    - [25, 6.829]
  - - [1408, 5888, 1, 256]
    - [73, 18.177]
  - - [704, 2944, 1, 1280]
    - [46, 20.652]
  - - [1856, 2368, 1, 128]
    - [43, 11.73]
  - - [4096, 7133, 1, 4096]
    - [35, 25.22]
  - - [256, 64, 1, 256]
    - [89, 1.75]
  - - [1024, 1024, 1, 256]
    - [27, 18.308]
  - - [704, 1856, 1, 256]
    - [27, 16.147]
  - - [128, 4288, 1, 3328]
    - [29, 18.269]
  - - [3584, 704, 1, 1280]
    - [34, 20.226]
  - - [256, 128, 1, 1280]
    - [90, 6.857]
  - - [2368, 4, 1, 256]
    - [40, 0.827]
  - - [256, 2368, 1, 1280]
    - [36, 16.844]
  - - [2944, 6784, 1, 128]
    - [80, 13.278]
  - - [3584, 448, 1, 3328]
    - [36, 20.537]
  - - [1408, 4, 1, 256]
    - [76, 0.618]
  - - [704, 2368, 1, 3328]
    - [36, 21.32]
  - - [2944, 448, 1, 256]
    - [36, 17.817]
  - - [1856, 448, 1, 128]
    - [43, 7.212]
  - - [2368, 128, 1, 1280]
    - [61, 14.425]
  - - [256, 5888, 1, 128]
    - [91, 5.528]
  - - [64, 6784, 1, 256]
    - [36, 13.663]
  - - [64, 5056, 1, 1280]
    - [32, 14.216]
  - - [4, 6784, 1, 128]
    - [55, 0.457]
  - - [2944, 2944, 1, 1280]
    - [34, 23.163]
  - - [5888, 2368, 1, 256]
    - [31, 17.663]
  - - [4, 3584, 1, 1280]
    - [40, 1.639]
  - - [1408, 128, 1, 128]
    - [92, 2.974]
  - - [6784, 704, 1, 3328]
    - [27, 23.049]
  - - [128, 64, 1, 1280]
    - [93, 3.198]
  - - [2368, 256, 1, 1280]
    - [27, 16.855]
  - - [4, 448, 1, 3328]
    - [26, 1.1]
  - - [5888, 4288, 1, 128]
    - [38, 12.059]
  - - [4, 5888, 1, 256]
    - [40, 1.195]
  - - [1408, 2944, 1, 3328]
    - [34, 23.36]
  - - [3584, 704, 1, 128]
    - [43, 9.546]
  - - [64, 1024, 1, 256]
    - [48, 4.587]
  - - [5056, 5056, 1, 128]
    - [94, 12.255]
  - - [2368, 448, 1, 1280]
    - [36, 18.428]
  - - [128, 3584, 1, 256]
    - [39, 11.085]
  - - [704, 448, 1, 1280]
    - [28, 10.669]
  - - [448, 5056, 1, 128]
    - [37, 9.782]
  - - [256, 4, 1, 1280]
    - [95, 0.4]
  - - [128, 5056, 1, 256]
    - [27, 15.5]
  - - [1408, 5056, 1, 128]
    - [43, 12.271]
  - - [2944, 3584, 1, 128]
    - [43, 11.499]
  - - [3584, 2368, 1, 256]
    - [36, 22.711]
  - - [5888, 5056, 1, 1280]
    - [31, 23.536]
  - - [2368, 5056, 1, 128]
    - [43, 13.111]
  - - [64, 704, 1, 256]
    - [40, 3.811]
  - - [4288, 256, 1, 1280]
    - [36, 19.019]
  - - [3584, 3584, 1, 3328]
    - [28, 23.6]
  - - [1024, 256, 1, 128]
    - [37, 3.828]
  - - [4, 704, 1, 128]
    - [42, 0.031]
  - - [5888, 6784, 1, 256]
    - [35, 23.774]
  - - [4288, 2944, 1, 3328]
    - [39, 23.213]
  - - [2944, 64, 1, 128]
    - [64, 3.695]
  - - [1856, 64, 1, 256]
    - [96, 5.607]
  - - [4288, 128, 1, 3328]
    - [97, 16.42]
  - - [4288, 704, 1, 1280]
    - [27, 22.669]
  - - [256, 5056, 1, 1280]
    - [36, 21.411]
  - - [1408, 256, 1, 128]
    - [43, 4.488]
  - - [2944, 5888, 1, 3328]
    - [36, 23.971]
  - - [6784, 5888, 1, 1280]
    - [31, 23.779]
  - - [704, 128, 1, 256]
    - [81, 5.226]
  - - [5888, 4288, 1, 1280]
    - [39, 23.454]
  - - [448, 256, 1, 1280]
    - [61, 12.03]
  - - [5888, 3584, 1, 128]
    - [80, 12.635]
  - - [1856, 1856, 1, 128]
    - [43, 11.072]
  - - [5056, 4, 1, 1280]
    - [78, 1.597]
  - - [256, 1408, 1, 1280]
    - [27, 14.179]
  - - [512, 16, 1, 512]
    - [62, 1.75]
  - - [704, 3584, 1, 128]
    - [43, 10.325]
  - - [5888, 448, 1, 3328]
    - [31, 20.109]
  - - [2368, 4288, 1, 1280]
    - [86, 21.547]
  - - [4288, 2944, 1, 128]
    - [37, 13.29]
  - - [1024, 6784, 1, 3328]
    - [27, 21.764]
  - - [128, 2368, 1, 256]
    - [27, 9.613]
  - - [6784, 64, 1, 3328]
    - [36, 17.769]
  - - [5056, 2944, 1, 3328]
    - [39, 21.757]
  - - [448, 128, 1, 256]
    - [40, 4.351]
  - - [2944, 3584, 1, 256]
    - [36, 22.82]
  - - [1408, 1408, 1, 3328]
    - [47, 22.22]
  - - [1856, 128, 1, 1280]
    - [36, 14.203]
  - - [3584, 3584, 1, 128]
    - [80, 12.146]
  - - [64, 3584, 1, 256]
    - [27, 8.997]
  - - [1408, 4, 1, 3328]
    - [98, 1.624]
  - - [128, 2944, 1, 3328]
    - [32, 18.278]
  - - [3584, 704, 1, 256]
    - [36, 15.831]
  - - [2944, 448, 1, 3328]
    - [27, 19.604]
  - - [3584, 1408, 1, 3328]
    - [47, 23.745]
  - - [704, 3584, 1, 1280]
    - [27, 20.311]
  - - [2944, 6784, 1, 1280]
    - [47, 24.072]
  - - [1856, 6784, 1, 256]
    - [36, 14.423]
  - - [4288, 448, 1, 3328]
    - [27, 21.338]
  - - [6784, 4288, 1, 128]
    - [94, 12.142]
  - - [6784, 704, 1, 1280]
    - [36, 14.155]
  - - [256, 4288, 1, 256]
    - [36, 17.205]
  - - [3584, 64, 1, 128]
    - [64, 3.74]
  - - [5888, 1024, 1, 3328]
    - [47, 21.92]
  - - [448, 64, 1, 128]
    - [25, 0.658]
  - - [704, 6784, 1, 1280]
    - [27, 22.904]
  - - [5888, 128, 1, 256]
    - [27, 17.285]
  - - [2368, 448, 1, 3328]
    - [27, 18.665]
  - - [1856, 5056, 1, 3328]
    - [73, 22.509]
  - - [4, 6784, 1, 256]
    - [99, 1.191]
  - - [1024, 3584, 1, 128]
    - [37, 8.697]
  - - [1024, 1408, 1, 128]
    - [43, 7.447]
  - - [2368, 2944, 1, 128]
    - [43, 12.402]
  - - [5056, 64, 1, 256]
    - [51, 8.084]
  - - [4, 448, 1, 1280]
    - [26, 0.693]
  - - [5056, 2944, 1, 128]
    - [94, 12.058]
  - - [5888, 5056, 1, 3328]
    - [86, 23.151]
  - - [1024, 704, 1, 128]
    - [43, 5.841]
  - - [1408, 2368, 1, 128]
    - [43, 9.709]
  - - [5888, 2368, 1, 128]
    - [37, 12.464]
  - - [128, 5056, 1, 3328]
    - [61, 19.241]
  - - [3584, 6784, 1, 1280]
    - [34, 23.63]
  - - [3072, 7435, 1, 1024]
    - [39, 23.652]
  - - [1856, 5888, 1, 256]
    - [36, 14.66]
  - - [256, 256, 1, 256]
    - [72, 4.001]
  - - [256, 64, 1, 128]
    - [83, 0.44]
  - - [4288, 4288, 1, 3328]
    - [73, 21.353]
  - - [4288, 1408, 1, 1280]
    - [31, 23.601]
  - - [3584, 5056, 1, 128]
    - [91, 11.024]
  - - [4, 1024, 1, 3328]
    - [62, 1.561]
  - - [4288, 2368, 1, 256]
    - [36, 23.196]
  - - [2944, 5056, 1, 1280]
    - [36, 23.848]
  - - [448, 6784, 1, 256]
    - [35, 14.489]
  - - [64, 1024, 1, 3328]
    - [61, 12.622]
  - - [6784, 2368, 1, 3328]
    - [34, 23.361]
  - - [256, 1024, 1, 1280]
    - [27, 15.181]
  - - [704, 4, 1, 128]
    - [55, 0.038]
  - - [256, 4, 1, 256]
    - [26, 0.134]
  - - [4288, 128, 1, 256]
    - [36, 13.302]
  - - [4288, 1856, 1, 3328]
    - [31, 23.733]
  - - [3584, 448, 1, 128]
    - [37, 8.509]
  - - [256, 4, 1, 3328]
    - [95, 0.795]
  - - [4, 1408, 1, 1280]
    - [62, 1.292]
  - - [3584, 64, 1, 1280]
    - [60, 13.189]
  - - [1408, 448, 1, 128]
    - [37, 6.668]
  - - [3584, 1024, 1, 1280]
    - [27, 21.655]
  - - [1856, 5056, 1, 256]
    - [47, 20.765]
  - - [4, 3584, 1, 256]
    - [85, 1.003]
  - - [1024, 4288, 1, 256]
    - [28, 15.138]
  - - [5888, 3584, 1, 3328]
    - [44, 23.315]
  - - [4, 256, 1, 256]
    - [33, 0.105]
  - - [5056, 3584, 1, 3328]
    - [73, 23.93]
  - - [128, 5888, 1, 1280]
    - [36, 20.785]
  - - [704, 448, 1, 128]
    - [37, 3.833]
  - - [2368, 1408, 1, 1280]
    - [36, 21.352]
  - - [5056, 2944, 1, 1280]
    - [31, 23.582]
  - - [4, 4, 1, 128]
    - [42, 0.0]
  - - [3584, 256, 1, 256]
    - [36, 17.125]
  - - [128, 1856, 1, 3328]
    - [74, 17.245]
  - - [1024, 6784, 1, 256]
    - [27, 22.284]
  - - [4, 128, 1, 256]
    - [62, 0.069]
  - - [64, 64, 1, 1280]
    - [93, 1.807]
  - - [6784, 4, 1, 128]
    - [42, 0.309]
  - - [2944, 1408, 1, 128]
    - [43, 11.241]
  - - [448, 128, 1, 3328]
    - [61, 12.933]
  - - [64, 2944, 1, 3328]
    - [61, 16.142]
  - - [64, 4288, 1, 3328]
    - [61, 16.656]
  - - [5056, 6784, 1, 3328]
    - [27, 20.605]
  - - [128, 2944, 1, 256]
    - [36, 11.905]
  - - [128, 6784, 1, 128]
    - [100, 6.818]
  - - [3584, 4288, 1, 256]
    - [27, 23.327]
  - - [448, 1856, 1, 256]
    - [27, 15.81]
  - - [1856, 6784, 1, 3328]
    - [31, 23.32]
  - - [3584, 128, 1, 3328]
    - [36, 18.695]
  - - [64, 1856, 1, 256]
    - [101, 5.543]
  - - [1024, 448, 1, 1280]
    - [27, 17.702]
  - - [5888, 4288, 1, 256]
    - [27, 14.666]
  - - [4, 448, 1, 128]
    - [42, 0.023]
  - - [5056, 1408, 1, 256]
    - [36, 14.211]
  - - [64, 256, 1, 1280]
    - [62, 4.891]
  - - [3584, 1024, 1, 256]
    - [31, 19.137]
  - - [256, 704, 1, 256]
    - [36, 7.504]
  - - [5888, 5888, 1, 256]
    - [31, 18.633]
  - - [4288, 1024, 1, 1280]
    - [27, 22.646]
  - - [5888, 128, 1, 3328]
    - [36, 21.338]
  - - [448, 6784, 1, 3328]
    - [36, 22.486]
  - - [2944, 1408, 1, 1280]
    - [31, 18.975]
  - - [1024, 32, 1, 512]
    - [40, 4.509]
  - - [2944, 1856, 1, 3328]
    - [36, 23.224]
  - - [2368, 64, 1, 128]
    - [64, 2.796]
  - - [2944, 2944, 1, 128]
    - [80, 11.65]
  - - [4, 128, 1, 3328]
    - [58, 0.302]
  - - [3584, 5888, 1, 1280]
    - [36, 23.399]
  - - [64, 4, 1, 128]
    - [55, 0.002]
  - - [6784, 1856, 1, 1280]
    - [36, 23.18]
  - - [2944, 5056, 1, 256]
    - [27, 22.48]
  - - [2944, 5888, 1, 1280]
    - [35, 24.467]
  - - [5888, 256, 1, 3328]
    - [27, 22.326]
  - - [1856, 5888, 1, 3328]
    - [27, 23.995]
  - - [3584, 1408, 1, 256]
    - [27, 22.004]
  - - [704, 3584, 1, 3328]
    - [27, 21.63]
  - - [5056, 448, 1, 1280]
    - [27, 22.438]
  - - [3584, 1856, 1, 3328]
    - [47, 22.534]
  - - [64, 1408, 1, 128]
    - [68, 1.895]
  - - [1408, 704, 1, 1280]
    - [36, 21.167]
  - - [2944, 1024, 1, 256]
    - [31, 20.499]
  - - [1024, 2368, 1, 128]
    - [43, 8.493]
  - - [2368, 4288, 1, 3328]
    - [27, 24.021]
  - - [4, 1408, 1, 256]
    - [76, 0.653]
  - - [1024, 1408, 1, 1280]
    - [27, 20.911]
  - - [64, 64, 1, 256]
    - [62, 0.482]
  - - [704, 256, 1, 3328]
    - [36, 11.466]
  - - [6784, 5056, 1, 256]
    - [35, 23.174]
  - - [4, 4288, 1, 3328]
    - [98, 1.7]
  - - [448, 6784, 1, 128]
    - [37, 11.371]
  - - [4, 704, 1, 3328]
    - [102, 1.327]
  - - [448, 2944, 1, 256]
    - [36, 17.817]
  - - [2944, 6784, 1, 256]
    - [27, 23.341]
  - - [2368, 2368, 1, 1280]
    - [31, 21.938]
  - - [4, 4, 1, 1280]
    - [26, 0.008]
  - - [1856, 3584, 1, 1280]
    - [47, 22.341]
  - - [64, 2944, 1, 256]
    - [84, 6.51]
  - - [3584, 1408, 1, 1280]
    - [31, 23.527]
  - - [448, 256, 1, 128]
    - [68, 2.388]
  - - [4288, 448, 1, 128]
    - [38, 8.157]
  - - [5056, 256, 1, 1280]
    - [27, 22.302]
  - - [1856, 1408, 1, 3328]
    - [36, 23.623]
  - - [128, 128, 1, 128]
    - [103, 0.394]
  - - [1024, 4288, 1, 3328]
    - [39, 21.637]
  - - [448, 2368, 1, 256]
    - [46, 12.933]
  - - [1024, 4, 1, 128]
    - [42, 0.026]
  - - [5056, 448, 1, 256]
    - [27, 20.898]
  - - [2944, 2368, 1, 3328]
    - [35, 23.675]
  - - [704, 128, 1, 3328]
    - [32, 15.145]
  - - [64, 64, 1, 3328]
    - [104, 3.792]
  - - [1024, 1856, 1, 1280]
    - [73, 16.127]
  - - [6784, 1856, 1, 256]
    - [27, 23.009]
  - - [128, 2368, 1, 3328]
    - [61, 17.035]
  - - [1024, 5888, 1, 256]
    - [27, 13.958]
  - - [5056, 128, 1, 1280]
    - [29, 16.379]
  - - [5056, 64, 1, 3328]
    - [79, 17.009]
  - - [128, 704, 1, 128]
    - [52, 1.767]
  - - [1408, 2368, 1, 256]
    - [36, 21.99]
  - - [1408, 1408, 1, 256]
    - [31, 19.322]
  - - [4, 64, 1, 128]
    - [42, 0.002]
  - - [64, 128, 1, 1280]
    - [93, 3.501]
  - - [2368, 2368, 1, 128]
    - [43, 11.626]
  - - [64, 5888, 1, 128]
    - [52, 5.293]
  - - [5888, 4, 1, 3328]
    - [49, 1.693]
  - - [6784, 1408, 1, 128]
    - [94, 11.459]
  - - [4288, 5888, 1, 256]
    - [31, 21.559]
  - - [1408, 5056, 1, 256]
    - [36, 22.498]
  - - [5056, 128, 1, 3328]
    - [61, 19.483]
  - - [128, 128, 1, 1280]
    - [69, 5.116]
  - - [448, 704, 1, 256]
    - [28, 7.69]
  - - [4288, 3584, 1, 128]
    - [37, 13.311]
  - - [2944, 128, 1, 3328]
    - [79, 17.24]
  - - [128, 5056, 1, 1280]
    - [74, 15.713]
  - - [3584, 5056, 1, 1280]
    - [73, 24.101]
  - - [256, 448, 1, 1280]
    - [59, 10.827]
  - - [704, 704, 1, 128]
    - [43, 5.732]
  - - [5056, 4, 1, 128]
    - [42, 0.032]
  - - [704, 256, 1, 1280]
    - [36, 11.052]
  - - [64, 2368, 1, 3328]
    - [32, 16.012]
  - - [1856, 1024, 1, 128]
    - [80, 10.314]
  - - [1856, 64, 1, 128]
    - [25, 2.375]
  - - [64, 6784, 1, 1280]
    - [74, 14.542]
  - - [704, 4288, 1, 256]
    - [27, 13.241]
  - - [5888, 2368, 1, 1280]
    - [36, 23.796]
  - - [128, 256, 1, 256]
    - [69, 3.094]
  - - [256, 64, 1, 1280]
    - [84, 4.619]
  - - [2368, 5888, 1, 1280]
    - [31, 23.199]
  - - [5888, 256, 1, 1280]
    - [36, 22.019]
  - - [4, 5888, 1, 1280]
    - [88, 1.695]
  - - [704, 128, 1, 128]
    - [103, 1.648]
  - - [1024, 4, 1, 1280]
    - [62, 1.214]
  - - [2368, 1856, 1, 3328]
    - [47, 20.688]
  - - [2368, 128, 1, 128]
    - [105, 4.714]
  - - [2944, 704, 1, 256]
    - [36, 21.409]
  - - [5056, 128, 1, 128]
    - [100, 6.824]
  - - [256, 704, 1, 3328]
    - [36, 11.522]
  - - [704, 3584, 1, 256]
    - [28, 19.716]
  - - [1024, 1024, 1, 1024]
    - [27, 21.073]
  - - [704, 2944, 1, 3328]
    - [27, 23.257]
  - - [6784, 1024, 1, 128]
    - [80, 11.068]
  - - [256, 448, 1, 128]
    - [83, 2.282]
  - - [448, 1024, 1, 3328]
    - [36, 18.738]
  - - [2944, 1024, 1, 3328]
    - [39, 22.276]
  - - [2944, 5056, 1, 128]
    - [43, 12.947]
  - - [1408, 6784, 1, 256]
    - [27, 21.177]
  - - [6784, 1408, 1, 3328]
    - [65, 22.526]
  - - [4288, 6784, 1, 128]
    - [80, 13.784]
  - - [704, 64, 1, 256]
    - [106, 3.658]
  - - [5888, 4, 1, 1280]
    - [63, 1.615]
  - - [256, 2368, 1, 3328]
    - [36, 17.265]
  - - [6784, 2944, 1, 1280]
    - [35, 24.033]
  - - [4288, 1856, 1, 128]
    - [43, 12.397]
  - - [1856, 2944, 1, 128]
    - [37, 11.78]
  - - [6784, 448, 1, 128]
    - [37, 11.085]
  - - [64, 3584, 1, 128]
    - [64, 4.176]
  - - [448, 5056, 1, 1280]
    - [36, 21.702]
  - - [2368, 1856, 1, 128]
    - [37, 12.031]
  - - [128, 448, 1, 1280]
    - [61, 9.502]
  - - [4288, 704, 1, 256]
    - [36, 21.424]
  - - [256, 3584, 1, 128]
    - [37, 6.228]
  - - [5888, 704, 1, 256]
    - [36, 22.377]
  - - [3584, 1024, 1, 128]
    - [43, 10.389]
  - - [256, 5888, 1, 3328]
    - [34, 21.663]
  - - [1408, 4288, 1, 3328]
    - [31, 23.374]
  - - [6784, 4288, 1, 256]
    - [35, 23.248]
  - - [4288, 256, 1, 128]
    - [37, 7.818]
  - - [5888, 256, 1, 256]
    - [36, 19.487]
  - - [6784, 1024, 1, 1280]
    - [31, 23.465]
  - - [5888, 1024, 1, 128]
    - [43, 10.306]
  - - [1024, 128, 1, 256]
    - [27, 5.879]
  - - [128, 64, 1, 3328]
    - [107, 5.37]
  - - [448, 64, 1, 256]
    - [84, 2.739]
  - - [2368, 256, 1, 128]
    - [38, 5.657]
  - - [6784, 3584, 1, 1280]
    - [27, 23.08]
  - - [1024, 6784, 1, 1280]
    - [44, 23.121]
  - - [2944, 64, 1, 1280]
    - [29, 12.643]
  - - [1408, 2944, 1, 1280]
    - [28, 23.168]
  - - [256, 1856, 1, 256]
    - [34, 11.247]
  - - [1408, 2368, 1, 3328]
    - [34, 21.437]
  - - [2944, 4, 1, 3328]
    - [40, 1.71]
  - - [128, 1408, 1, 3328]
    - [32, 16.701]
  - - [2944, 1856, 1, 128]
    - [37, 12.248]
  - - [256, 2944, 1, 128]
    - [43, 6.131]
  - - [256, 6784, 1, 128]
    - [43, 7.913]
  - - [2368, 4, 1, 128]
    - [42, 0.057]
  - - [1408, 256, 1, 3328]
    - [36, 9.473]
  - - [1856, 4, 1, 128]
    - [55, 0.018]
  - - [1024, 16, 1, 512]
    - [30, 2.956]
  - - [5056, 6784, 1, 128]
    - [94, 12.557]
  - - [4288, 5056, 1, 128]
    - [43, 12.602]
  - - [1856, 5888, 1, 128]
    - [80, 11.041]
  - - [2944, 5888, 1, 256]
    - [31, 21.467]
  - - [3584, 1856, 1, 256]
    - [27, 22.522]
  - - [4288, 3584, 1, 1280]
    - [35, 24.366]
  - - [2368, 448, 1, 256]
    - [36, 16.757]
  - - [4288, 256, 1, 3328]
    - [36, 19.333]
  - - [1856, 704, 1, 128]
    - [37, 9.209]
  - - [1408, 64, 1, 256]
    - [108, 5.501]
  - - [64, 1856, 1, 128]
    - [109, 2.486]
  - - [4, 256, 1, 128]
    - [42, 0.013]
  - - [704, 4288, 1, 3328]
    - [27, 22.871]
  - - [704, 5888, 1, 128]
    - [38, 10.711]
  - - [6784, 3584, 1, 128]
    - [80, 13.601]
  - - [1024, 64, 1, 256]
    - [101, 4.031]
  - - [64, 2368, 1, 256]
    - [27, 6.476]
  - - [4288, 5056, 1, 3328]
    - [73, 20.788]
  - - [4, 1856, 1, 1280]
    - [40, 1.266]
  - - [4288, 128, 1, 128]
    - [37, 6.022]
  - - [1408, 1408, 1, 128]
    - [43, 9.524]
  - - [1024, 128, 1, 3328]
    - [110, 14.351]
  - - [1856, 128, 1, 128]
    - [52, 4.104]
  - - [5056, 2368, 1, 256]
    - [31, 14.09]
  - - [4288, 704, 1, 3328]
    - [35, 17.664]
  - - [448, 3584, 1, 256]
    - [34, 15.176]
  - - [64, 128, 1, 128]
    - [111, 0.19]
  - - [2368, 64, 1, 1280]
    - [61, 12.791]
  - - [2368, 1024, 1, 1280]
    - [46, 19.64]
  - - [2944, 1408, 1, 3328]
    - [34, 23.354]
  - - [1408, 448, 1, 256]
    - [27, 15.107]
  - - [1024, 1408, 1, 3328]
    - [39, 20.707]
  - - [2560, 7133, 1, 2560]
    - [47, 24.45]
  - - [1408, 4, 1, 1280]
    - [98, 1.322]
  - - [5888, 3584, 1, 256]
    - [31, 23.406]
  - - [128, 1024, 1, 1280]
    - [74, 12.065]
  - - [1408, 1856, 1, 3328]
    - [39, 23.166]
  - - [4, 4, 1, 3328]
    - [95, 0.018]
  - - [6784, 1408, 1, 1280]
    - [36, 23.715]
  - - [4, 1024, 1, 1280]
    - [98, 1.073]
  - - [704, 2944, 1, 256]
    - [27, 21.14]
  - - [704, 4288, 1, 128]
    - [37, 11.09]
  - - [2368, 4288, 1, 128]
    - [37, 10.12]
  - - [64, 4288, 1, 1280]
    - [61, 13.72]
  - - [6784, 64, 1, 1280]
    - [29, 14.483]
  - - [3584, 128, 1, 128]
    - [52, 6.249]
  - - [1024, 6784, 1, 128]
    - [38, 9.799]
  - - [4, 1856, 1, 128]
    - [42, 0.077]
  - - [1408, 64, 1, 3328]
    - [61, 15.465]
  - - [6784, 4, 1, 256]
    - [78, 1.238]
  - - [1408, 1408, 1, 1280]
    - [31, 21.923]
  - - [256, 2368, 1, 256]
    - [39, 10.865]
  - - [448, 4288, 1, 3328]
    - [36, 21.607]
  - - [2368, 1408, 1, 256]
    - [27, 21.901]
  - - [5888, 5056, 1, 128]
    - [37, 12.917]
  - - [704, 2368, 1, 256]
    - [27, 19.447]
  - - [2944, 448, 1, 1280]
    - [27, 19.329]
  - - [5888, 2368, 1, 3328]
    - [34, 23.706]
  - - [64, 2944, 1, 1280]
    - [32, 13.097]
  - - [448, 1856, 1, 1280]
    - [36, 17.831]
  - - [4288, 448, 1, 1280]
    - [36, 14.857]
  - - [5888, 704, 1, 3328]
    - [34, 23.319]
  - - [5056, 256, 1, 128]
    - [43, 8.21]
  - - [1856, 256, 1, 128]
    - [38, 4.693]
  - - [5056, 128, 1, 256]
    - [27, 15.5]
  - - [704, 4, 1, 256]
    - [62, 0.318]
  - - [1408, 5888, 1, 128]
    - [37, 12.826]
  - - [4288, 4, 1, 128]
    - [55, 0.243]
  - - [1408, 1024, 1, 256]
    - [36, 18.7]
  - - [1024, 1856, 1, 128]
    - [37, 7.527]
  - - [256, 704, 1, 128]
    - [66, 1.34]
  - - [256, 1024, 1, 128]
    - [37, 2.973]
  - - [448, 1024, 1, 256]
    - [27, 14.271]
  - - [128, 4, 1, 3328]
    - [95, 0.487]
  - - [5056, 6784, 1, 1280]
    - [36, 24.215]
  - - [704, 5056, 1, 3328]
    - [46, 22.302]
  - - [64, 1408, 1, 1280]
    - [32, 11.432]
  - - [3584, 5056, 1, 3328]
    - [73, 23.021]
  - - [1856, 4, 1, 3328]
    - [95, 1.555]
  - - [4, 2944, 1, 128]
    - [55, 0.182]
  - - [2368, 2944, 1, 3328]
    - [47, 23.633]
  - - [448, 448, 1, 1280]
    - [61, 13.015]
  - - [2368, 3584, 1, 256]
    - [36, 22.831]
  - - [5056, 3584, 1, 1280]
    - [28, 23.71]
  - - [448, 4, 1, 3328]
    - [95, 1.236]
  - - [1856, 2944, 1, 1280]
    - [31, 21.411]
  - - [3584, 2368, 1, 1280]
    - [27, 23.593]
  - - [128, 1024, 1, 256]
    - [112, 5.978]
  - - [2944, 1408, 1, 256]
    - [47, 13.804]
  - - [4288, 1408, 1, 3328]
    - [47, 23.814]
  - - [3584, 64, 1, 3328]
    - [60, 16.012]
  - - [1408, 128, 1, 256]
    - [36, 7.465]
  - - [2944, 1024, 1, 128]
    - [43, 9.966]
  - - [4288, 5056, 1, 1280]
    - [65, 21.131]
  - - [5888, 6784, 1, 1280]
    - [31, 24.756]
  - - [6784, 5056, 1, 128]
    - [80, 12.943]
  - - [256, 1024, 1, 3328]
    - [36, 16.43]
  - - [3584, 4, 1, 256]
    - [85, 1.068]
  - - [1856, 64, 1, 3328]
    - [61, 16.261]
  - - [64, 6784, 1, 128]
    - [25, 6.057]
  - - [5888, 1408, 1, 3328]
    - [73, 24.499]
  - - [5888, 64, 1, 1280]
    - [36, 14.895]
  - - [256, 5056, 1, 256]
    - [39, 15.5]
  - - [128, 3584, 1, 128]
    - [105, 6.046]
  - - [448, 3584, 1, 3328]
    - [47, 17.994]
  - - [704, 2368, 1, 128]
    - [37, 9.492]
  - - [5888, 256, 1, 128]
    - [38, 7.554]
  - - [4, 5056, 1, 128]
    - [55, 0.336]
  - - [448, 256, 1, 256]
    - [51, 5.856]
  - - [704, 4, 1, 3328]
    - [26, 1.402]
  - - [1408, 256, 1, 256]
    - [36, 11.613]
  - - [3584, 1856, 1, 128]
    - [37, 11.599]
  - - [4288, 4288, 1, 128]
    - [43, 13.408]
  - - [1856, 1024, 1, 3328]
    - [27, 16.142]
  - - [128, 5888, 1, 3328]
    - [113, 17.864]
  - - [1024, 5056, 1, 256]
    - [31, 19.931]
  - - [2368, 1408, 1, 3328]
    - [27, 23.356]
  - - [5888, 448, 1, 256]
    - [39, 14.053]
  - - [5888, 6784, 1, 128]
    - [80, 11.419]
  - - [2368, 4, 1, 3328]
    - [26, 1.631]
  - - [6784, 5056, 1, 1280]
    - [46, 23.467]
  - - [5056, 704, 1, 1280]
    - [27, 22.538]
  - - [1408, 256, 1, 1280]
    - [36, 14.289]
  - - [4288, 6784, 1, 1280]
    - [27, 22.437]
  - - [128, 704, 1, 256]
    - [51, 5.189]
  - - [448, 128, 1, 1280]
    - [32, 9.659]
  - - [6784, 4, 1, 3328]
    - [63, 1.737]
  - - [4288, 4, 1, 1280]
    - [62, 1.527]
  - - [1024, 64, 1, 3328]
    - [114, 9.967]
  - - [1856, 4, 1, 256]
    - [85, 0.744]
  - - [64, 3584, 1, 1280]
    - [36, 13.359]
  - - [6784, 1408, 1, 256]
    - [36, 22.985]
  - - [3584, 5888, 1, 128]
    - [37, 12.9]
  - - [5056, 5888, 1, 256]
    - [31, 21.794]
  - - [2368, 1024, 1, 256]
    - [39, 11.4]
  - - [2944, 1856, 1, 256]
    - [34, 13.199]
  - - [1856, 6784, 1, 1280]
    - [46, 23.016]
  - - [64, 5056, 1, 128]
    - [25, 5.172]
  - - [5888, 64, 1, 128]
    - [100, 5.116]
  - - [448, 704, 1, 128]
    - [38, 2.978]
  - - [4, 1024, 1, 128]
    - [55, 0.022]
  - - [4288, 3584, 1, 256]
    - [27, 23.038]
  - - [1408, 704, 1, 128]
    - [37, 8.032]
  - - [64, 256, 1, 3328]
    - [87, 7.932]
  - - [5056, 1856, 1, 1280]
    - [39, 22.473]
  - - [1408, 1024, 1, 3328]
    - [34, 20.747]
  - - [2368, 256, 1, 3328]
    - [36, 17.279]
  - - [5888, 3584, 1, 1280]
    - [47, 24.193]
  - - [1856, 3584, 1, 3328]
    - [36, 23.55]
  - - [5888, 128, 1, 1280]
    - [27, 20.644]
  - - [1024, 2944, 1, 256]
    - [47, 18.389]
  - - [448, 6784, 1, 1280]
    - [27, 17.796]
  - - [256, 3584, 1, 1280]
    - [36, 19.634]
  - - [448, 128, 1, 128]
    - [25, 1.258]
  - - [704, 5056, 1, 256]
    - [27, 21.843]
  - - [3584, 1024, 1, 3328]
    - [35, 19.703]
  - - [2944, 1856, 1, 1280]
    - [31, 19.729]
  - - [128, 256, 1, 128]
    - [115, 0.752]
  - - [5056, 256, 1, 256]
    - [36, 19.865]
  - - [2368, 3584, 1, 3328]
    - [35, 22.571]
  - - [2944, 704, 1, 1280]
    - [34, 17.394]
  - - [128, 4, 1, 256]
    - [76, 0.063]
  - - [2944, 3584, 1, 1280]
    - [31, 22.959]
  - - [1856, 5888, 1, 1280]
    - [27, 23.931]
  - - [256, 256, 1, 1280]
    - [116, 10.002]
  - - [5056, 448, 1, 3328]
    - [31, 11.64]
  - - [4288, 1408, 1, 256]
    - [31, 13.723]
  - - [3584, 64, 1, 256]
    - [106, 6.334]
  - - [64, 1856, 1, 3328]
    - [74, 14.961]
  - - [256, 1408, 1, 128]
    - [37, 4.169]
  - - [5888, 1408, 1, 128]
    - [80, 11.256]
  - - [4288, 2368, 1, 1280]
    - [36, 23.933]
  - - [4, 4288, 1, 256]
    - [78, 1.123]
  - - [256, 4288, 1, 128]
    - [37, 7.141]
  - - [256, 128, 1, 3328]
    - [117, 10.025]
  - - [6784, 2368, 1, 256]
    - [36, 23.266]
  - - [5888, 128, 1, 128]
    - [100, 8.009]
  - - [4288, 1856, 1, 256]
    - [27, 14.356]
  - - [1856, 256, 1, 3328]
    - [36, 19.4]
  - - [1856, 2944, 1, 256]
    - [46, 16.352]
  - - [5056, 1024, 1, 128]
    - [80, 11.689]
  - - [64, 5888, 1, 1280]
    - [27, 14.823]
  - - [1760, 7133, 1, 1760]
    - [35, 23.083]
  - - [6784, 256, 1, 128]
    - [37, 9.35]
  - - [5888, 704, 1, 128]
    - [80, 9.276]
  - - [6784, 64, 1, 128]
    - [118, 5.56]
  - - [1024, 4288, 1, 1280]
    - [27, 23.34]
  - - [2368, 5056, 1, 3328]
    - [65, 23.019]
  - - [448, 4, 1, 128]
    - [42, 0.014]
  - - [4, 256, 1, 3328]
    - [95, 0.789]
  - - [4288, 1024, 1, 3328]
    - [44, 21.973]
  - - [1024, 5056, 1, 3328]
    - [36, 22.547]
  - - [1024, 1856, 1, 3328]
    - [73, 21.379]
  - - [704, 704, 1, 1280]
    - [36, 19.439]
  - - [128, 2368, 1, 1280]
    - [32, 14.579]
  - - [1408, 128, 1, 3328]
    - [61, 16.57]
  - - [3584, 256, 1, 1280]
    - [27, 19.369]
  - - [4, 128, 1, 128]
    - [42, 0.005]
  - - [704, 6784, 1, 128]
    - [43, 11.644]
  - - [3584, 128, 1, 1280]
    - [36, 17.959]
  - - [4, 256, 1, 1280]
    - [26, 0.452]
  - - [128, 704, 1, 3328]
    - [32, 15.121]
  - - [4288, 6784, 1, 256]
    - [36, 23.663]
  - - [3584, 2944, 1, 3328]
    - [65, 23.124]
  - - [128, 1856, 1, 256]
    - [27, 9.318]
  - - [64, 4288, 1, 256]
    - [36, 8.772]
  - - [4, 3584, 1, 3328]
    - [49, 1.761]
  - - [64, 4, 1, 3328]
    - [26, 0.181]
  - - [4, 64, 1, 3328]
    - [26, 0.233]
  - - [5888, 2944, 1, 256]
    - [35, 18.373]
  - - [2368, 6784, 1, 128]
    - [43, 13.268]
  - - [448, 4288, 1, 1280]
    - [36, 21.354]
  - - [448, 1856, 1, 3328]
    - [36, 18.17]
  - - [4, 1024, 1, 256]
    - [62, 0.475]
  - - [5056, 4288, 1, 256]
    - [31, 22.701]
  - - [1024, 448, 1, 256]
    - [27, 13.495]
  - - [1024, 3584, 1, 256]
    - [28, 15.609]
  - - [2944, 128, 1, 1280]
    - [61, 15.359]
  - - [1856, 5056, 1, 128]
    - [37, 12.918]
  - - [64, 256, 1, 256]
    - [40, 1.956]
  - - [1408, 4, 1, 128]
    - [55, 0.103]
  - - [128, 2368, 1, 128]
    - [119, 3.857]
  - - [256, 704, 1, 1280]
    - [36, 10.985]
  - - [64, 2368, 1, 128]
    - [82, 3.076]
  - - [6784, 6784, 1, 3328]
    - [31, 21.085]
  - - [448, 5888, 1, 1280]
    - [27, 21.572]
  - - [5056, 448, 1, 128]
    - [37, 10.557]
  - - [3584, 2944, 1, 128]
    - [37, 11.071]
  - - [6784, 256, 1, 1280]
    - [27, 21.895]
  - - [256, 2944, 1, 1280]
    - [27, 18.464]
  - - [64, 4288, 1, 128]
    - [82, 4.623]
  - - [2368, 5888, 1, 3328]
    - [36, 22.879]
  - - [4, 64, 1, 256]
    - [62, 0.041]
  - - [704, 1024, 1, 3328]
    - [27, 20.448]
  - - [2368, 1856, 1, 1280]
    - [27, 22.361]
  - - [128, 448, 1, 128]
    - [68, 1.492]
  - - [128, 6784, 1, 256]
    - [27, 16.589]
  - - [3584, 4288, 1, 128]
    - [37, 12.75]
  - - [64, 448, 1, 128]
    - [120, 0.588]
  - - [5888, 4288, 1, 3328]
    - [36, 24.143]
  - - [2368, 704, 1, 256]
    - [27, 19.391]
  - - [256, 1856, 1, 3328]
    - [27, 16.611]
  - - [1856, 128, 1, 256]
    - [36, 9.596]
  - - [6784, 128, 1, 128]
    - [121, 7.194]
  - - [3584, 1408, 1, 128]
    - [80, 7.736]
  - - [1856, 5056, 1, 1280]
    - [46, 22.488]
  - - [2944, 1024, 1, 1280]
    - [31, 22.513]
  - - [5056, 4, 1, 256]
    - [88, 1.253]
  - - [3584, 5888, 1, 3328]
    - [35, 24.319]
  - - [2368, 4288, 1, 256]
    - [31, 16.286]
  - - [1024, 2368, 1, 3328]
    - [27, 21.935]
  - - [64, 704, 1, 3328]
    - [57, 11.163]
  - - [704, 1408, 1, 256]
    - [36, 18.847]
  - - [6784, 1856, 1, 3328]
    - [31, 23.25]
  - - [1024, 2944, 1, 128]
    - [43, 9.012]
  - - [1024, 3584, 1, 1280]
    - [34, 23.12]
  - - [4288, 5888, 1, 3328]
    - [35, 21.627]
  - - [4288, 4, 1, 3328]
    - [62, 1.573]
  - - [256, 1408, 1, 256]
    - [36, 11.432]
  - - [448, 2944, 1, 1280]
    - [36, 19.315]
  - - [4, 5888, 1, 128]
    - [55, 0.443]
  - - [1024, 2944, 1, 3328]
    - [73, 23.181]
  - - [3584, 6784, 1, 256]
    - [73, 18.404]
  - - [256, 6784, 1, 1280]
    - [36, 21.915]
  - - [1856, 3584, 1, 256]
    - [27, 20.804]
  - - [128, 448, 1, 3328]
    - [75, 12.178]
  - - [6784, 1856, 1, 128]
    - [37, 13.157]
  - - [4, 448, 1, 256]
    - [62, 0.22]
  - - [2944, 704, 1, 128]
    - [43, 9.638]
  - - [256, 5888, 1, 1280]
    - [36, 22.019]
  - - [4, 128, 1, 1280]
    - [26, 0.26]
  - - [4288, 6784, 1, 3328]
    - [73, 20.829]
  - - [6784, 128, 1, 1280]
    - [61, 16.651]
  - - [64, 1408, 1, 256]
    - [84, 5.226]
  - - [7680, 5481, 1, 2560]
    - [31, 23.917]
  - - [2368, 1408, 1, 128]
    - [37, 11.5]
  - - [1856, 448, 1, 256]
    - [36, 15.922]
  - - [1408, 1024, 1, 128]
    - [37, 9.145]
  - - [128, 64, 1, 128]
    - [68, 0.222]
  - - [6784, 3584, 1, 3328]
    - [46, 22.814]
  - - [2944, 64, 1, 3328]
    - [113, 15.333]
  - - [64, 64, 1, 128]
    - [109, 0.092]
  - - [2368, 5056, 1, 1280]
    - [27, 23.947]
  - - [64, 4, 1, 1280]
    - [26, 0.102]
  - - [1408, 2368, 1, 1280]
    - [65, 19.633]
  - - [128, 1408, 1, 1280]
    - [32, 12.528]
  - - [256, 64, 1, 3328]
    - [122, 6.808]
  - - [2944, 4288, 1, 128]
    - [37, 13.127]
  - - [2944, 2944, 1, 256]
    - [36, 22.692]
  - - [2944, 4, 1, 1280]
    - [49, 1.567]
  - - [5888, 4, 1, 256]
    - [78, 1.226]
  - - [6784, 256, 1, 256]
    - [27, 20.086]
  - - [256, 5056, 1, 3328]
    - [36, 22.716]
  - - [128, 4288, 1, 1280]
    - [74, 15.261]
  - - [5056, 1856, 1, 128]
    - [66, 10.71]
  - - [5888, 1408, 1, 256]
    - [73, 23.202]
  - - [128, 128, 1, 256]
    - [40, 1.928]
  - - [5056, 4, 1, 3328]
    - [78, 1.631]
  - - [4288, 3584, 1, 3328]
    - [28, 23.596]
  - - [448, 704, 1, 3328]
    - [46, 11.369]
  - - [448, 448, 1, 128]
    - [82, 3.452]
  - - [1024, 2368, 1, 1280]
    - [36, 21.744]
  - - [1856, 704, 1, 3328]
    - [36, 21.435]
  - - [4, 2368, 1, 128]
    - [55, 0.164]
  - - [5888, 6784, 1, 3328]
    - [46, 23.969]
  - - [704, 4288, 1, 1280]
    - [34, 18.97]
  - - [704, 256, 1, 256]
    - [36, 7.504]
  - - [6784, 448, 1, 3328]
    - [39, 22.546]
  - - [4288, 1024, 1, 128]
    - [80, 9.805]
  - - [49, 512, 128, 2048]
    - [123, 18.046]
  - - [196, 256, 256, 1024]
    - [124, 21.065]
  - - [784, 512, 256, 128]
    - [125, 22.99]
  - - [49, 2048, 128, 512]
    - [126, 17.667]
  - - [784, 128, 128, 512]
    - [127, 22.793]
  - - [3136, 256, 256, 64]
    - [128, 22.965]
  - - [3136, 64, 128, 64]
    - [129, 21.772]
  - - [49, 2048, 256, 512]
    - [126, 17.886]
  - - [784, 128, 256, 512]
    - [130, 23.096]
  - - [196, 256, 128, 1024]
    - [131, 20.515]
  - - [3136, 64, 128, 256]
    - [132, 23.802]
  - - [3136, 256, 128, 64]
    - [128, 22.79]
  - - [784, 512, 128, 128]
    - [125, 22.748]
  - - [3136, 64, 256, 256]
    - [132, 24.272]
  - - [3136, 64, 256, 64]
    - [129, 22.184]
  - - [196, 1024, 128, 256]
    - [124, 20.6]
  - - [49, 512, 256, 2048]
    - [133, 18.182]
  - - [196, 1024, 256, 256]
    - [124, 20.832]
  - - [5329, 160, 64, 64]
    - [134, 20.695]
  - - [1225, 384, 64, 192]
    - [135, 23.246]
  - - [289, 1024, 64, 256]
    - [135, 21.525]
  - - [64, 1536, 64, 384]
    - [136, 23.656]
  - - [1225, 384, 64, 64]
    - [137, 20.7]
  - - [1225, 384, 64, 96]
    - [135, 21.669]
  - - [64, 1536, 64, 256]
    - [138, 23.197]
  - - [289, 1024, 64, 384]
    - [139, 22.138]
  - - [289, 1024, 64, 192]
    - [135, 21.092]
  - - [289, 1024, 64, 128]
    - [138, 20.271]
  - - [4096, 1024, 1, 2984]
    - [140, 24.982]
  - - [1024, 4096, 1, 3437]
    - [141, 25.158]
  - - [1024, 4096, 1, 3235]
    - [142, 25.153]
  - - [4096, 1024, 1, 4032]
    - [140, 25.184]
  - - [1024, 4096, 1, 3334]
    - [141, 25.164]
  - - [4096, 1024, 1, 3288]
    - [141, 25.003]
  - - [1024, 4096, 1, 3515]
    - [141, 25.179]
  - - [4096, 1024, 1, 3437]
    - [141, 25.041]
  - - [1024, 4096, 1, 3259]
    - [141, 25.137]
  - - [1024, 4096, 1, 3384]
    - [143, 25.172]
  - - [64, 92, 688, 92]
    - [144, 15.573]
  - - [4096, 1024, 1, 3458]
    - [140, 25.087]
  - - [1024, 4096, 1, 3412]
    - [140, 25.195]
  - - [1024, 4096, 1, 3529]
    - [142, 25.18]
  - - [1024, 4096, 1, 4032]
    - [141, 25.279]
  - - [4096, 1024, 1, 3999]
    - [141, 25.105]
  - - [1024, 4096, 1, 3079]
    - [142, 25.104]
  - - [1024, 4096, 1, 3876]
    - [143, 25.243]
  - - [1024, 4096, 1, 3450]
    - [141, 25.158]
  - - [1024, 4096, 1, 3256]
    - [141, 25.146]
  - - [4096, 1024, 1, 3403]
    - [140, 25.014]
  - - [1024, 1024, 1, 3975]
    - [145, 22.811]
  - - [1024, 4096, 1, 3359]
    - [141, 25.156]
  - - [4096, 1024, 1, 3549]
    - [140, 25.043]
  - - [4096, 1024, 1, 3176]
    - [141, 25.006]
  - - [1024, 4096, 1, 3504]
    - [143, 25.205]
  - - [4096, 1024, 1, 3314]
    - [140, 25.052]
  - - [4096, 1024, 1, 3183]
    - [140, 24.975]
  - - [1024, 4096, 1, 3209]
    - [142, 25.13]
  - - [1024, 4096, 1, 3720]
    - [143, 25.205]
  - - [1024, 4096, 1, 3859]
    - [143, 25.251]
  - - [1024, 33708, 1, 4059]
    - [143, 26.187]
  - - [64, 123, 528, 123]
    - [146, 17.547]
  - - [4096, 1024, 1, 3477]
    - [141, 25.047]
  - - [4096, 1024, 1, 3233]
    - [141, 25.022]
  - - [4096, 1024, 1, 3409]
    - [141, 25.059]
  - - [4096, 1024, 1, 3564]
    - [141, 25.043]
  - - [64, 102, 624, 100]
    - [146, 14.647]
  - - [4096, 1024, 1, 3190]
    - [140, 24.993]
  - - [64, 112, 576, 111]
    - [146, 16.535]
  - - [1024, 4096, 1, 3288]
    - [140, 25.148]
  - - [4096, 1024, 1, 3451]
    - [140, 25.015]
  - - [1024, 4096, 1, 3348]
    - [143, 25.157]
  - - [64, 102, 624, 102]
    - [146, 14.674]
  - - [1024, 4096, 1, 3465]
    - [142, 25.151]
  - - [1024, 33708, 1, 4032]
    - [143, 26.235]
  - - [1024, 33708, 1, 3840]
    - [143, 26.239]
  - - [4096, 1024, 1, 3391]
    - [141, 25.021]
  - - [1024, 4096, 1, 3530]
    - [143, 25.17]
  - - [4096, 1024, 1, 3209]
    - [140, 24.983]
  - - [1024, 4096, 1, 3457]
    - [142, 25.162]
  - - [1024, 4096, 1, 3386]
    - [143, 25.163]
  - - [4096, 1024, 1, 3350]
    - [140, 25.079]
  - - [1024, 4096, 1, 3184]
    - [141, 25.184]
  - - [1024, 4096, 1, 3093]
    - [140, 25.124]
  - - [64, 133, 480, 135]
    - [147, 15.745]
  - - [1024, 4096, 1, 3400]
    - [143, 25.161]
  - - [1024, 1024, 1, 4026]
    - [148, 22.871]
  - - [1024, 4096, 1, 3214]
    - [143, 25.108]
  - - [4096, 1024, 1, 3406]
    - [141, 25.011]
  - - [1024, 4096, 1, 3565]
    - [140, 25.167]
  - - [4096, 1024, 1, 3536]
    - [141, 25.09]
  - - [1024, 4096, 1, 3183]
    - [140, 25.137]
  - - [1024, 4096, 1, 3462]
    - [141, 25.175]
  - - [4096, 1024, 1, 3130]
    - [142, 24.981]
  - - [4096, 1024, 1, 3381]
    - [141, 25.037]
  - - [4096, 1024, 1, 3298]
    - [140, 25.043]
  - - [1024, 4096, 1, 3292]
    - [143, 25.134]
  - - [4096, 1024, 1, 3289]
    - [140, 25.008]
  - - [64, 160, 400, 159]
    - [149, 18.846]
  - - [1024, 4096, 1, 3379]
    - [143, 25.161]
  - - [1024, 4096, 1, 3990]
    - [142, 25.238]
  - - [1024, 4096, 1, 3540]
    - [141, 25.209]
  - - [4096, 1024, 1, 3412]
    - [141, 25.036]
  - - [1024, 1024, 1, 3780]
    - [150, 22.926]
  - - [1024, 4096, 1, 3555]
    - [140, 25.187]
  - - [1024, 4096, 1, 3518]
    - [142, 25.183]
  - - [4096, 1024, 1, 3189]
    - [140, 25.02]
  - - [1024, 4096, 1, 3298]
    - [142, 25.177]
  - - [4096, 1024, 1, 3072]
    - [140, 25.047]
  - - [1024, 4096, 1, 3393]
    - [141, 25.192]
  - - [1024, 4096, 1, 3207]
    - [143, 25.15]
  - - [64, 228, 272, 232]
    - [151, 18.648]
  - - [64, 23, 2720, 23]
    - [152, 6.699]
  - - [4096, 1024, 1, 3487]
    - [141, 25.019]
  - - [1024, 1024, 1, 3822]
    - [148, 22.819]
  - - [64, 77, 816, 77]
    - [144, 13.379]
  - - [4096, 1024, 1, 3431]
    - [141, 25.035]
  - - [4096, 1024, 1, 3378]
    - [140, 25.088]
  - - [4096, 1024, 1, 3529]
    - [142, 25.066]
  - - [4096, 1024, 1, 3460]
    - [141, 25.06]
  - - [1024, 4096, 1, 3336]
    - [143, 25.149]
  - - [1024, 4096, 1, 3501]
    - [142, 25.154]
  - - [64, 159, 400, 159]
    - [153, 17.802]
  - - [1024, 4096, 1, 3584]
    - [141, 25.221]
  - - [64, 135, 480, 134]
    - [153, 15.835]
  - - [64, 99, 624, 99]
    - [154, 14.252]
  - - [4096, 1024, 1, 2499]
    - [140, 24.899]
  - - [1024, 1024, 1, 3942]
    - [150, 22.987]
  - - [4096, 1024, 1, 3352]
    - [140, 25.034]
  - - [1024, 4096, 1, 3543]
    - [141, 25.191]
  - - [1024, 4096, 1, 3476]
    - [140, 25.198]
  - - [1024, 33708, 1, 3822]
    - [143, 26.195]
  - - [1024, 4096, 1, 3436]
    - [143, 25.162]
  - - [1024, 1024, 1, 3861]
    - [155, 22.831]
  - - [1024, 1024, 1, 4000]
    - [156, 22.982]
  - - [1024, 4096, 1, 3594]
    - [143, 25.189]
  - - [4096, 1024, 1, 3514]
    - [141, 25.048]
  - - [1024, 4096, 1, 3064]
    - [140, 25.136]
  - - [4096, 1024, 1, 3371]
    - [143, 25.011]
  - - [4096, 1024, 1, 3558]
    - [141, 25.058]
  - - [4096, 1024, 1, 3517]
    - [140, 25.033]
  - - [4096, 1024, 1, 3144]
    - [140, 24.982]
  - - [1024, 4096, 1, 3312]
    - [143, 25.201]
  - - [4096, 1024, 1, 3079]
    - [140, 24.994]
  - - [1024, 4096, 1, 3415]
    - [143, 25.167]
  - - [1024, 4096, 1, 3221]
    - [140, 25.139]
  - - [1024, 4096, 1, 3978]
    - [142, 25.231]
  - - [4096, 1024, 1, 3876]
    - [140, 25.115]
  - - [1024, 4096, 1, 3528]
    - [143, 25.168]
  - - [1024, 4096, 1, 3181]
    - [141, 25.105]
  - - [4096, 1024, 1, 3445]
    - [140, 25.063]
  - - [4096, 1024, 1, 3450]
    - [143, 25.029]
  - - [4096, 1024, 1, 3377]
    - [140, 25.066]
  - - [1024, 4096, 1, 3532]
    - [142, 25.189]
  - - [1024, 33708, 1, 3944]
    - [143, 26.208]
  - - [4096, 1024, 1, 3483]
    - [140, 25.021]
  - - [1024, 4096, 1, 3358]
    - [143, 25.127]
  - - [4096, 1024, 1, 3464]
    - [140, 25.059]
  - - [4096, 1024, 1, 3282]
    - [143, 25.014]
  - - [4096, 1024, 1, 3256]
    - [141, 25.004]
  - - [1024, 4096, 1, 3057]
    - [140, 25.145]
  - - [4096, 1024, 1, 3481]
    - [140, 25.032]
  - - [4096, 1024, 1, 3340]
    - [140, 25.022]
  - - [1024, 1024, 1, 3870]
    - [148, 23.044]
  - - [1024, 4096, 1, 3273]
    - [143, 25.159]
  - - [64, 65, 992, 65]
    - [153, 11.881]
  - - [4096, 1024, 1, 3392]
    - [142, 25.07]
  - - [4096, 1024, 1, 3337]
    - [140, 25.028]
  - - [4096, 1024, 1, 3359]
    - [140, 25.053]
  - - [4096, 1024, 1, 3498]
    - [141, 25.027]
  - - [4096, 1024, 1, 3169]
    - [140, 24.994]
  - - [1024, 33708, 1, 3859]
    - [142, 26.215]
  - - [64, 19, 3264, 19]
    - [152, 5.536]
  - - [1024, 4096, 1, 3103]
    - [143, 25.115]
  - - [4096, 1024, 1, 3900]
    - [140, 25.111]
  - - [1024, 4096, 1, 3442]
    - [140, 25.217]
  - - [1024, 4096, 1, 3248]
    - [140, 25.219]
  - - [1024, 4096, 1, 3351]
    - [141, 25.177]
  - - [4096, 1024, 1, 3593]
    - [140, 25.104]
  - - [1024, 4096, 1, 3780]
    - [140, 25.224]
  - - [64, 133, 480, 133]
    - [153, 15.682]
  - - [1024, 33708, 1, 3681]
    - [143, 26.215]
  - - [4096, 1024, 1, 3374]
    - [142, 25.015]
  - - [1024, 4096, 1, 3557]
    - [143, 25.189]
  - - [4096, 1024, 1, 3906]
    - [140, 25.136]
  - - [4096, 1024, 1, 3504]
    - [140, 25.082]
  - - [1024, 4096, 1, 3270]
    - [140, 25.159]
  - - [4096, 1024, 1, 3098]
    - [143, 25.003]
  - - [64, 232, 272, 232]
    - [151, 18.76]
  - - [4096, 1024, 1, 3216]
    - [141, 25.058]
  - - [64, 148, 432, 148]
    - [149, 16.907]
  - - [1024, 4096, 1, 3550]
    - [140, 25.169]
  - - [4096, 1024, 1, 3449]
    - [142, 25.043]
  - - [1024, 4096, 1, 3403]
    - [141, 25.139]
  - - [1024, 4096, 1, 3523]
    - [140, 25.201]
  - - [1024, 4096, 1, 3486]
    - [140, 25.162]
  - - [1024, 4096, 1, 3564]
    - [140, 25.177]
  - - [1024, 33708, 1, 4005]
    - [143, 26.233]
  - - [4096, 1024, 1, 3296]
    - [140, 25.067]
  - - [1024, 4096, 1, 3263]
    - [143, 25.136]
  - - [64, 25, 2512, 25]
    - [152, 7.226]
  - - [1024, 4096, 1, 3130]
    - [141, 25.118]
  - - [1024, 4096, 1, 3295]
    - [141, 25.106]
  - - [1024, 33708, 1, 3925]
    - [142, 26.24]
  - - [1024, 4096, 1, 3378]
    - [143, 25.172]
  - - [4096, 1024, 1, 3720]
    - [141, 25.082]
  - - [4096, 1024, 1, 3399]
    - [140, 25.069]
  - - [4096, 1024, 1, 3543]
    - [141, 25.044]
  - - [64, 9, 6544, 9]
    - [157, 2.423]
  - - [4096, 1024, 1, 3497]
    - [140, 25.038]
  - - [4096, 1024, 1, 3594]
    - [141, 25.059]
  - - [1024, 4096, 1, 3144]
    - [141, 25.123]
  - - [1024, 4096, 1, 3975]
    - [142, 25.245]
  - - [4096, 1024, 1, 3205]
    - [141, 25.006]
  - - [1024, 33708, 1, 3995]
    - [143, 26.212]
  - - [1024, 4096, 1, 3392]
    - [143, 25.209]
  - - [1024, 4096, 1, 3055]
    - [141, 25.101]
  - - [1024, 4096, 1, 4026]
    - [141, 25.22]
  - - [4096, 1024, 1, 3557]
    - [140, 25.077]
  - - [4096, 1024, 1, 3515]
    - [140, 25.047]
  - - [4096, 1024, 1, 3486]
    - [141, 25.018]
  - - [4096, 1024, 1, 3457]
    - [141, 25.081]
  - - [1024, 4096, 1, 3511]
    - [143, 25.19]
  - - [4096, 1024, 1, 3138]
    - [140, 25.001]
  - - [1024, 4096, 1, 3339]
    - [142, 25.151]
  - - [1024, 4096, 1, 3939]
    - [142, 25.25]
  - - [4096, 1024, 1, 3500]
    - [142, 25.026]
  - - [4096, 1024, 1, 3395]
    - [141, 25.077]
  - - [4096, 1024, 1, 4020]
    - [141, 25.15]
  - - [4096, 1024, 1, 3942]
    - [140, 25.144]
  - - [1024, 1024, 1, 4032]
    - [158, 22.897]
  - - [4096, 1024, 1, 3349]
    - [141, 25.032]
  - - [1024, 4096, 1, 3322]
    - [142, 25.139]
  - - [4096, 1024, 1, 3452]
    - [140, 25.049]
  - - [1024, 4096, 1, 3417]
    - [140, 25.15]
  - - [1024, 1024, 1, 4012]
    - [159, 23.051]
  - - [1024, 4096, 1, 3526]
    - [142, 25.17]
  - - [4096, 1024, 1, 3485]
    - [142, 25.021]
  - - [1024, 1024, 1, 3681]
    - [159, 22.813]
  - - [4096, 1024, 1, 3303]
    - [141, 25.02]
  - - [4096, 1024, 1, 3344]
    - [141, 25.099]
  - - [1024, 4096, 1, 3479]
    - [141, 25.173]
  - - [4096, 1024, 1, 3300]
    - [140, 25.038]
  - - [1024, 4096, 1, 3439]
    - [142, 25.164]
  - - [4096, 1024, 1, 3280]
    - [141, 25.055]
  - - [1024, 4096, 1, 3245]
    - [143, 25.144]
  - - [1024, 4096, 1, 3328]
    - [143, 25.223]
  - - [4096, 1024, 1, 3418]
    - [143, 25.044]
  - - [1024, 4096, 1, 3493]
    - [141, 25.215]
  - - [1024, 4096, 1, 3500]
    - [143, 25.161]
  - - [1024, 4096, 1, 3166]
    - [143, 25.113]
  - - [4096, 1024, 1, 3126]
    - [142, 24.984]
  - - [1024, 4096, 1, 3277]
    - [141, 25.114]
  - - [1024, 4096, 1, 3315]
    - [140, 25.177]
  - - [1024, 1024, 1, 3927]
    - [145, 22.803]
  - - [1024, 4096, 1, 3414]
    - [143, 25.158]
  - - [4096, 1024, 1, 3531]
    - [140, 25.047]
  - - [4096, 1024, 1, 3484]
    - [143, 25.036]
  - - [1024, 4096, 1, 3180]
    - [140, 25.128]
  - - [4096, 1024, 1, 3360]
    - [140, 25.066]
  - - [1024, 33708, 1, 3990]
    - [143, 26.222]
  - - [4096, 1024, 1, 3466]
    - [140, 25.054]
  - - [1024, 4096, 1, 3428]
    - [143, 25.159]
  - - [1024, 4096, 1, 3137]
    - [140, 25.152]
  - - [4096, 1024, 1, 4059]
    - [140, 25.123]
  - - [1024, 4096, 1, 3353]
    - [140, 25.155]
  - - [1024, 4096, 1, 3942]
    - [140, 25.231]
  - - [4096, 1024, 1, 3506]
    - [143, 25.056]
  - - [1024, 1024, 1, 3894]
    - [145, 22.699]
  - - [4096, 1024, 1, 3508]
    - [141, 25.061]
  - - [64, 132, 480, 135]
    - [153, 15.641]
  - - [4096, 1024, 1, 3956]
    - [143, 25.138]
  - - [64, 7, 8192, 7]
    - [160, 2.063]
  - - [1024, 4096, 1, 3272]
    - [142, 25.143]
  - - [1024, 4096, 1, 3443]
    - [141, 25.194]
  - - [1024, 4096, 1, 3375]
    - [141, 25.141]
  - - [1024, 4096, 1, 3525]
    - [141, 25.192]
  - - [4096, 1024, 1, 3472]
    - [140, 25.092]
  - - [1024, 4096, 1, 3520]
    - [143, 25.239]
  - - [4096, 1024, 1, 3322]
    - [140, 25.024]
  - - [4096, 1024, 1, 3387]
    - [140, 25.021]
  - - [64, 8, 7280, 8]
    - [161, 2.598]
  - - [1024, 33708, 1, 3939]
    - [143, 26.234]
  - - [4096, 1024, 1, 3345]
    - [141, 25.051]
  - - [4096, 1024, 1, 2967]
    - [140, 24.964]
  - - [1024, 4096, 1, 3453]
    - [143, 25.133]
  - - [1024, 4096, 1, 3640]
    - [140, 25.204]
  - - [4096, 1024, 1, 3291]
    - [142, 25.019]
  - - [1024, 4096, 1, 3350]
    - [141, 25.164]
  - - [4096, 1024, 1, 3417]
    - [140, 25.028]
  - - [64, 135, 480, 135]
    - [153, 15.896]
  - - [1024, 4096, 1, 3467]
    - [142, 25.136]
  - - [1024, 4096, 1, 3491]
    - [140, 25.202]
  - - [1024, 4096, 1, 3822]
    - [140, 25.216]
  - - [4096, 1024, 1, 3292]
    - [140, 24.989]
  - - [1024, 4096, 1, 3231]
    - [143, 25.133]
  - - [1024, 4096, 1, 3364]
    - [142, 25.195]
  - - [1024, 4096, 1, 3995]
    - [142, 25.229]
  - - [1024, 4096, 1, 3545]
    - [143, 25.19]
  - - [1024, 1024, 1, 3876]
    - [145, 22.842]
  - - [1024, 4096, 1, 3186]
    - [143, 25.171]
  - - [4096, 1024, 1, 3432]
    - [140, 25.055]
  - - [64, 84, 752, 85]
    - [144, 14.473]
  - - [4096, 1024, 1, 3367]
    - [142, 25.037]
  - - [4096, 1024, 1, 3503]
    - [141, 25.044]
  - - [1024, 4096, 1, 3095]
    - [142, 25.125]
  - - [4096, 1024, 1, 3465]
    - [141, 25.047]
  - - [1024, 4096, 1, 3402]
    - [140, 25.155]
  - - [4096, 1024, 1, 3140]
    - [140, 24.986]
  - - [1024, 1024, 1, 4050]
    - [156, 22.976]
  - - [4096, 1024, 1, 3424]
    - [142, 25.104]
  - - [4096, 1024, 1, 3257]
    - [143, 25.019]
  - - [4096, 1024, 1, 2917]
    - [140, 24.981]
  - - [1024, 33708, 1, 3640]
    - [143, 26.188]
  - - [1024, 4096, 1, 3456]
    - [143, 25.246]
  - - [1024, 4096, 1, 3014]
    - [143, 25.138]
  - - [4096, 1024, 1, 3372]
    - [141, 25.038]
  - - [64, 132, 480, 132]
    - [153, 15.531]
  - - [1024, 4096, 1, 3294]
    - [141, 25.126]
  - - [4096, 1024, 1, 3446]
    - [141, 25.046]
  - - [1024, 4096, 1, 3389]
    - [142, 25.141]
  - - [4096, 1024, 1, 3259]
    - [140, 25.018]
  - - [4096, 1024, 1, 3544]
    - [140, 25.064]
  - - [4096, 1024, 1, 3479]
    - [141, 25.052]
  - - [4096, 1024, 1, 3542]
    - [140, 25.065]
  - - [4096, 1024, 1, 3321]
    - [143, 25.019]
  - - [1024, 4096, 1, 3147]
    - [143, 25.105]
  - - [1024, 4096, 1, 3944]
    - [143, 25.246]
  - - [4096, 1024, 1, 3870]
    - [141, 25.072]
  - - [1024, 4096, 1, 3308]
    - [143, 25.136]
  - - [4096, 1024, 1, 3401]
    - [140, 25.028]
  - - [1024, 4096, 1, 3395]
    - [143, 25.192]
  - - [64, 99, 624, 102]
    - [162, 14.338]
  - - [1024, 4096, 1, 3563]
    - [140, 25.176]
  - - [1024, 33708, 1, 3870]
    - [143, 26.197]
  - - [4096, 1024, 1, 3494]
    - [140, 25.055]
  - - [1024, 4096, 1, 3271]
    - [143, 25.151]
  - - [1024, 33708, 1, 3910]
    - [143, 26.238]
  - - [1024, 4096, 1, 3287]
    - [141, 25.181]
  - - [1024, 33708, 1, 3860]
    - [143, 26.211]
  - - [64, 143, 432, 148]
    - [149, 16.674]
  - - [1024, 1024, 1, 3584]
    - [159, 22.772]
  - - [64, 162, 400, 162]
    - [163, 17.309]
  - - [4096, 1024, 1, 3341]
    - [140, 25.003]
  - - [1024, 4096, 1, 3136]
    - [143, 25.186]
  - - [4096, 1024, 1, 3439]
    - [140, 25.002]
  - - [64, 148, 432, 147]
    - [153, 16.942]
  - - [1024, 4096, 1, 3751]
    - [140, 25.216]
  - - [1024, 4096, 1, 3301]
    - [140, 25.166]
  - - [4096, 1024, 1, 3468]
    - [141, 25.016]
  - - [1024, 4096, 1, 3416]
    - [141, 25.165]
  - - [4096, 1024, 1, 3163]
    - [140, 25.003]
  - - [1024, 4096, 1, 3230]
    - [142, 25.112]
  - - [1024, 4096, 1, 3581]
    - [142, 25.157]
  - - [1024, 1024, 1, 3960]
    - [150, 22.951]
  - - [4096, 1024, 1, 3463]
    - [141, 25.079]
  - - [1024, 4096, 1, 3478]
    - [142, 25.186]
  - - [4096, 1024, 1, 3262]
    - [140, 24.997]
  - - [1024, 4096, 1, 3438]
    - [140, 25.15]
  - - [1024, 4096, 1, 3244]
    - [143, 25.119]
  - - [1024, 4096, 1, 3445]
    - [143, 25.169]
  - - [4096, 1024, 1, 3328]
    - [140, 25.088]
  - - [1024, 4096, 1, 3492]
    - [142, 25.212]
  - - [4096, 1024, 1, 3211]
    - [142, 24.986]
  - - [1024, 4096, 1, 3910]
    - [141, 25.236]
  - - [1024, 4096, 1, 3314]
    - [143, 25.201]
  - - [4096, 1024, 1, 3859]
    - [140, 25.125]
  - - [4096, 1024, 1, 3383]
    - [140, 25.055]
  - - [1024, 4096, 1, 3409]
    - [141, 25.186]
  - - [1024, 4096, 1, 4020]
    - [143, 25.224]
  - - [4096, 1024, 1, 3530]
    - [140, 25.049]
  - - [4096, 1024, 1, 3411]
    - [141, 25.054]
  - - [1024, 4096, 1, 3566]
    - [141, 25.171]
  - - [4096, 1024, 1, 3493]
    - [143, 25.056]
  - - [4096, 1024, 1, 3184]
    - [140, 25.05]
  - - [1024, 4096, 1, 3072]
    - [143, 25.178]
  - - [1024, 4096, 1, 3431]
    - [142, 25.146]
  - - [4096, 1024, 1, 3306]
    - [141, 25.0]
  - - [1024, 4096, 1, 3352]
    - [141, 25.152]
  - - [4096, 1024, 1, 3295]
    - [140, 25.023]
  - - [64, 123, 528, 122]
    - [146, 17.634]
  - - [1024, 4096, 1, 3517]
    - [142, 25.169]
  - - [64, 102, 624, 101]
    - [164, 14.694]
  - - [4096, 1024, 1, 3426]
    - [140, 25.095]
  - - [4096, 1024, 1, 3385]
    - [140, 25.038]
  - - [1024, 1024, 1, 3978]
    - [145, 22.856]
  - - [4096, 1024, 1, 3572]
    - [143, 25.079]
  - - [4096, 1024, 1, 3459]
    - [140, 25.098]
  - - [1024, 4096, 1, 3374]
    - [141, 25.139]
  - - [4096, 1024, 1, 3166]
    - [140, 24.946]
  - - [4096, 1024, 1, 3093]
    - [141, 24.969]
  - - [4096, 1024, 1, 3523]
    - [142, 25.065]
  - - [4096, 1024, 1, 3413]
    - [142, 25.069]
  - - [1024, 4096, 1, 3996]
    - [143, 25.24]
  - - [1024, 4096, 1, 3452]
    - [141, 25.158]
  - - [4096, 1024, 1, 3232]
    - [141, 25.058]
  - - [4096, 1024, 1, 3400]
    - [143, 25.035]
  - - [4096, 1024, 1, 3334]
    - [140, 25.039]
  - - [1024, 4096, 1, 3345]
    - [143, 25.17]
  - - [1024, 4096, 1, 3538]
    - [140, 25.202]
  - - [1024, 4096, 1, 3466]
    - [140, 25.171]
  - - [4096, 1024, 1, 3315]
    - [140, 25.059]
  - - [4096, 1024, 1, 3214]
    - [141, 24.986]
  - - [1024, 33708, 1, 3900]
    - [143, 26.213]
  - - [64, 160, 400, 160]
    - [149, 18.878]
  - - [1024, 4096, 1, 3367]
    - [140, 25.185]
  - - [1024, 4096, 1, 2917]
    - [141, 25.129]
  - - [1024, 1024, 1, 3995]
    - [155, 22.835]
  - - [64, 132, 480, 134]
    - [153, 15.596]
  - - [1024, 4096, 1, 3544]
    - [141, 25.179]
  - - [4096, 1024, 1, 3414]
    - [141, 25.036]
  - - [4096, 1024, 1, 3565]
    - [142, 25.042]
  - - [1024, 4096, 1, 3512]
    - [140, 25.168]
  - - [1024, 4096, 1, 3191]
    - [141, 25.155]
  - - [64, 27, 2336, 27]
    - [165, 7.75]
  - - [1024, 4096, 1, 3289]
    - [141, 25.162]
  - - [4096, 1024, 1, 3290]
    - [140, 25.012]
  - - [1024, 4096, 1, 3211]
    - [141, 25.111]
  - - [1024, 33708, 1, 3969]
    - [142, 26.224]
  - - [4096, 1024, 1, 3566]
    - [140, 25.024]
  - - [64, 111, 576, 111]
    - [164, 16.24]
  - - [1024, 4096, 1, 3459]
    - [140, 25.176]
  - - [1024, 4096, 1, 3372]
    - [143, 25.143]
  - - [4096, 1024, 1, 3339]
    - [140, 25.015]
  - - [4096, 1024, 1, 3425]
    - [140, 25.091]
  - - [4096, 1024, 1, 3388]
    - [140, 25.046]
  - - [1024, 4096, 1, 3531]
    - [143, 25.166]
  - - [4096, 1024, 1, 3286]
    - [141, 25.038]
  - - [4096, 1024, 1, 3462]
    - [140, 25.072]
  - - [1024, 4096, 1, 3388]
    - [143, 25.13]
  - - [4096, 1024, 1, 3165]
    - [143, 24.956]
  - - [4096, 1024, 1, 3304]
    - [140, 25.01]
  - - [1024, 4096, 1, 2736]
    - [140, 25.121]
  - - [4096, 1024, 1, 3397]
    - [140, 25.047]
  - - [64, 38, 1680, 38]
    - [166, 8.777]
  - - [1024, 4096, 1, 3311]
    - [141, 25.139]
  - - [1024, 4096, 1, 3394]
    - [141, 25.193]
  - - [4096, 1024, 1, 2736]
    - [140, 24.95]
  - - [1024, 4096, 1, 3559]
    - [142, 25.182]
  - - [4096, 1024, 1, 3180]
    - [140, 24.961]
  - - [1024, 4096, 1, 3480]
    - [143, 25.175]
  - - [4096, 1024, 1, 3318]
    - [140, 25.036]
  - - [4096, 1024, 1, 3213]
    - [140, 24.981]
  - - [1024, 4096, 1, 3286]
    - [140, 25.149]
  - - [4096, 1024, 1, 3471]
    - [140, 25.053]
  - - [1024, 4096, 1, 3381]
    - [141, 25.176]
  - - [64, 100, 624, 100]
    - [154, 14.475]
  - - [4096, 1024, 1, 3502]
    - [140, 25.048]
  - - [64, 16, 3840, 16]
    - [167, 5.307]
  - - [1024, 4096, 1, 3552]
    - [143, 25.229]
  - - [4096, 1024, 1, 3519]
    - [141, 25.042]
  - - [1024, 4096, 1, 3300]
    - [142, 25.159]
  - - [1024, 4096, 1, 3419]
    - [143, 25.154]
  - - [4096, 1024, 1, 4030]
    - [142, 25.102]
  - - [4096, 1024, 1, 3976]
    - [141, 25.114]
  - - [1024, 4096, 1, 3473]
    - [141, 25.19]
  - - [1024, 1024, 1, 3977]
    - [159, 22.858]
  - - [4096, 1024, 1, 3428]
    - [140, 25.059]
  - - [1024, 4096, 1, 3433]
    - [142, 25.179]
  - - [4096, 1024, 1, 3534]
    - [142, 25.027]
  - - [4096, 1024, 1, 3461]
    - [140, 25.05]
  - - [4096, 1024, 1, 3681]
    - [140, 25.114]
  - - [4096, 1024, 1, 3495]
    - [141, 25.057]
  - - [4096, 1024, 1, 3351]
    - [140, 25.066]
  - - [1024, 4096, 1, 4059]
    - [143, 25.241]
  - - [4096, 1024, 1, 3990]
    - [140, 25.12]
  - - [1024, 4096, 1, 3325]
    - [142, 25.126]
  - - [1024, 4096, 1, 3408]
    - [140, 25.199]
  - - [64, 59, 1088, 59]
    - [164, 13.558]
  - - [4096, 1024, 1, 3394]
    - [141, 25.062]
  - - [1024, 4096, 1, 3573]
    - [141, 25.207]
  - - [4096, 1024, 1, 3386]
    - [140, 25.033]
  - - [4096, 1024, 1, 3540]
    - [140, 25.073]
  - - [1024, 4096, 1, 3182]
    - [142, 25.104]
  - - [1024, 4096, 1, 3430]
    - [143, 25.157]
  - - [1024, 4096, 1, 3236]
    - [141, 25.17]
  - - [4096, 1024, 1, 2977]
    - [140, 24.986]
  - - [1024, 4096, 1, 3355]
    - [140, 25.14]
  - - [4096, 1024, 1, 3139]
    - [140, 24.993]
  - - [4096, 1024, 1, 3516]
    - [142, 25.052]
  - - [4096, 1024, 1, 3368]
    - [142, 25.048]
  - - [4096, 1024, 1, 3559]
    - [143, 25.078]
  - - [64, 11, 5456, 11]
    - [167, 3.508]
  - - [1024, 4096, 1, 3506]
    - [140, 25.214]
  - - [1024, 4096, 1, 3145]
    - [143, 25.131]
  - - [1024, 4096, 1, 3369]
    - [140, 25.15]
  - - [64, 112, 576, 112]
    - [146, 16.703]
  - - [4096, 1024, 1, 3522]
    - [140, 25.091]
  - - [1024, 33708, 1, 3894]
    - [143, 26.228]
  - - [64, 159, 400, 162]
    - [153, 17.905]
  - - [4096, 1024, 1, 3336]
    - [140, 25.036]
  - - [1024, 4096, 1, 3382]
    - [142, 25.158]
  - - [4096, 1024, 1, 3533]
    - [140, 25.063]
  - - [4096, 1024, 1, 4050]
    - [141, 25.161]
  - - [4096, 1024, 1, 3480]
    - [142, 25.04]
  - - [1024, 4096, 1, 3344]
    - [143, 25.208]
  - - [64, 122, 528, 122]
    - [146, 17.433]
  - - [1024, 4096, 1, 3509]
    - [142, 25.183]
  - - [1024, 4096, 1, 3956]
    - [143, 25.266]
  - - [4096, 1024, 1, 3616]
    - [140, 25.13]
  - - [1024, 4096, 1, 3366]
    - [143, 25.167]
  - - [4096, 1024, 1, 2935]
    - [143, 24.948]
  - - [4096, 1024, 1, 3393]
    - [140, 25.061]
  - - [4096, 1024, 1, 3547]
    - [142, 25.029]
  - - [1024, 4096, 1, 3499]
    - [141, 25.15]
  - - [4096, 1024, 1, 3357]
    - [140, 25.004]
  - - [4096, 1024, 1, 3272]
    - [140, 25.021]
  - - [4096, 1024, 1, 3207]
    - [140, 24.985]
  - - [4096, 1024, 1, 3894]
    - [140, 25.166]
  - - [1024, 4096, 1, 3444]
    - [140, 25.201]
  - - [4096, 1024, 1, 3561]
    - [140, 25.048]
  - - [4096, 1024, 1, 3376]
    - [140, 25.081]
  - - [1024, 4096, 1, 3458]
    - [140, 25.192]
  - - [4096, 1024, 1, 3231]
    - [142, 24.984]
  - - [64, 228, 272, 228]
    - [168, 18.528]
  - - [1024, 4096, 1, 3505]
    - [141, 25.198]
  - - [4096, 1024, 1, 3277]
    - [140, 25.009]
  - - [64, 21, 2976, 21]
    - [152, 6.181]
  - - [1024, 4096, 1, 3391]
    - [140, 25.146]
  - - [64, 32, 1984, 32]
    - [169, 9.063]
  - - [1024, 4096, 1, 3536]
    - [141, 25.237]
  - - [1024, 4096, 1, 3063]
    - [140, 25.135]
  - - [1024, 1024, 1, 3925]
    - [155, 22.863]
  - - [1024, 4096, 1, 3189]
    - [142, 25.12]
  - - [1024, 4096, 1, 2505]
    - [140, 25.003]
  - - [4096, 1024, 1, 3454]
    - [143, 25.029]
  - - [1024, 4096, 1, 3405]
    - [141, 25.134]
  - - [1024, 33708, 1, 4050]
    - [142, 26.244]
  - - [4096, 1024, 1, 3520]
    - [140, 25.085]
  - - [64, 93, 688, 93]
    - [170, 15.788]
  - - [1024, 4096, 1, 3487]
    - [141, 25.165]
  - - [1024, 4096, 1, 3558]
    - [141, 25.197]
  - - [4096, 1024, 1, 3297]
    - [140, 25.053]
  - - [1024, 4096, 1, 3483]
    - [140, 25.157]
  - - [1024, 1024, 1, 3956]
    - [148, 22.86]
  - - [1024, 33708, 1, 3751]
    - [142, 26.198]
  - - [4096, 1024, 1, 3380]
    - [140, 25.089]
  - - [1024, 4096, 1, 3380]
    - [143, 25.187]
  - - [1024, 4096, 1, 3396]
    - [141, 25.199]
  - - [1024, 4096, 1, 3497]
    - [142, 25.156]
  - - [1024, 4096, 1, 3502]
    - [141, 25.172]
  - - [1024, 1024, 1, 3976]
    - [150, 22.987]
  - - [1024, 4096, 1, 3138]
    - [142, 25.14]
  - - [4096, 1024, 1, 3939]
    - [143, 25.144]
  - - [1024, 4096, 1, 3303]
    - [142, 25.16]
  - - [64, 111, 576, 112]
    - [164, 16.479]
  - - [1024, 4096, 1, 3418]
    - [140, 25.152]
  - - [1024, 4096, 1, 3224]
    - [142, 25.128]
  - - [4096, 1024, 1, 3978]
    - [140, 25.108]
  - - [1024, 4096, 1, 3472]
    - [143, 25.213]
  - - [4096, 1024, 1, 3353]
    - [141, 25.026]
  - - [4096, 1024, 1, 3362]
    - [140, 25.044]
  - - [1024, 33708, 1, 3978]
    - [143, 26.197]
  - - [64, 100, 624, 102]
    - [162, 14.451]
  - - [1024, 4096, 1, 3432]
    - [141, 25.157]
  - - [1024, 4096, 1, 3139]
    - [140, 25.154]
  - - [1024, 4096, 1, 3341]
    - [141, 25.149]
  - - [1024, 4096, 1, 3494]
    - [142, 25.18]
  - - [1024, 4096, 1, 3969]
    - [143, 25.251]
  - - [1024, 4096, 1, 3163]
    - [141, 25.148]
  - - [1024, 1024, 1, 3955]
    - [145, 23.083]
  - - [4096, 1024, 1, 3405]
    - [140, 25.001]
  - - [1024, 1024, 1, 4030]
    - [145, 23.047]
  - - [4096, 1024, 1, 3453]
    - [140, 25.014]
  - - [1024, 4096, 1, 3411]
    - [141, 25.185]
  - - [1024, 4096, 1, 3527]
    - [142, 25.175]
  - - [4096, 1024, 1, 3474]
    - [140, 25.063]
  - - [1024, 4096, 1, 3572]
    - [140, 25.199]
  - - [4096, 1024, 1, 3293]
    - [140, 24.987]
  - - [4096, 1024, 1, 3247]
    - [140, 25.02]
  - - [64, 15, 4096, 15]
    - [167, 4.962]
  - - [1024, 4096, 1, 3425]
    - [141, 25.21]
  - - [1024, 4096, 1, 3354]
    - [143, 25.162]
  - - [4096, 1024, 1, 3382]
    - [140, 25.081]
  - - [4096, 1024, 1, 3236]
    - [140, 25.018]
  - - [1024, 4096, 1, 3519]
    - [141, 25.167]
  - - [4096, 1024, 1, 3354]
    - [140, 25.003]
  - - [4096, 1024, 1, 3501]
    - [141, 25.041]
  - - [1024, 1024, 1, 3906]
    - [148, 23.101]
  - - [4096, 1024, 1, 3266]
    - [140, 25.052]
  - - [64, 101, 624, 102]
    - [162, 14.628]
  - - [1024, 4096, 1, 3368]
    - [140, 25.143]
  - - [1024, 4096, 1, 4030]
    - [141, 25.22]
  - - [1024, 4096, 1, 3533]
    - [142, 25.16]
  - - [4096, 1024, 1, 3332]
    - [141, 25.058]
  - - [4096, 1024, 1, 3584]
    - [140, 25.109]
  - - [1024, 4096, 1, 3616]
    - [140, 25.263]
  - - [4096, 1024, 1, 3265]
    - [140, 25.062]
  - - [4096, 1024, 1, 3361]
    - [140, 25.089]
  - - [4096, 1024, 1, 3467]
    - [140, 25.025]
  - - [1024, 4096, 1, 3454]
    - [142, 25.13]
  - - [1024, 4096, 1, 3101]
    - [141, 25.1]
  - - [1024, 4096, 1, 3508]
    - [141, 25.198]
  - - [4096, 1024, 1, 3267]
    - [140, 25.028]
  - - [64, 54, 1184, 54]
    - [146, 12.447]
  - - [4096, 1024, 1, 3419]
    - [140, 25.048]
  - - [4096, 1024, 1, 3822]
    - [140, 25.099]
  - - [1024, 4096, 1, 3266]
    - [140, 25.165]
  - - [4096, 1024, 1, 3440]
    - [141, 25.093]
  - - [1024, 4096, 1, 3361]
    - [140, 25.196]
  - - [1024, 4096, 1, 3546]
    - [142, 25.185]
  - - [4096, 1024, 1, 3473]
    - [140, 25.09]
  - - [4096, 1024, 1, 3546]
    - [141, 25.048]
  - - [1024, 4096, 1, 3088]
    - [142, 25.164]
  - - [1024, 4096, 1, 3535]
    - [141, 25.172]
  - - [1024, 4096, 1, 3447]
    - [141, 25.17]
  - - [1024, 4096, 1, 3560]
    - [140, 25.183]
  - - [1024, 4096, 1, 3422]
    - [142, 25.174]
  - - [1024, 4096, 1, 3469]
    - [143, 25.134]
  - - [4096, 1024, 1, 3488]
    - [140, 25.126]
  - - [1024, 4096, 1, 3110]
    - [140, 25.135]
  - - [1024, 4096, 1, 3265]
    - [141, 25.16]
  - - [1024, 4096, 1, 3291]
    - [140, 25.125]
  - - [1024, 4096, 1, 3390]
    - [141, 25.136]
  - - [4096, 1024, 1, 3046]
    - [140, 24.985]
  - - [1024, 4096, 1, 3539]
    - [141, 25.203]
  - - [4096, 1024, 1, 3221]
    - [141, 25.018]
  - - [4096, 1024, 1, 3433]
    - [140, 25.049]
  - - [4096, 1024, 1, 3364]
    - [141, 25.072]
  - - [4096, 1024, 1, 3470]
    - [140, 25.013]
  - - [1024, 4096, 1, 3404]
    - [143, 25.136]
  - - [1024, 33708, 1, 3968]
    - [142, 26.26]
  - - [4096, 1024, 1, 3088]
    - [140, 25.039]
  - - [1024, 4096, 1, 3247]
    - [140, 25.12]
  - - [1024, 33708, 1, 3996]
    - [143, 26.205]
  - - [4096, 1024, 1, 3482]
    - [141, 25.034]
  - - [1024, 1024, 1, 3796]
    - [150, 22.915]
  - - [4096, 1024, 1, 3995]
    - [141, 25.11]
  - - [1024, 1024, 1, 3859]
    - [159, 23.081]
  - - [1024, 4096, 1, 3280]
    - [142, 25.204]
  - - [4096, 1024, 1, 3271]
    - [141, 25.017]
  - - [64, 10, 5952, 10]
    - [167, 3.098]
  - - [4096, 1024, 1, 3545]
    - [140, 25.06]
  - - [4096, 1024, 1, 3476]
    - [143, 25.074]
  - - [4096, 1024, 1, 3496]
    - [142, 25.068]
  - - [4096, 1024, 1, 3191]
    - [142, 25.013]
  - - [4096, 1024, 1, 3311]
    - [141, 24.999]
  - - [1024, 4096, 1, 3302]
    - [141, 25.167]
  - - [1024, 4096, 1, 3681]
    - [140, 25.232]
  - - [4096, 1024, 1, 3582]
    - [143, 25.041]
  - - [4096, 1024, 1, 3421]
    - [141, 25.006]
  - - [4096, 1024, 1, 3560]
    - [142, 25.079]
  - - [1024, 4096, 1, 3495]
    - [141, 25.194]
  - - [4096, 1024, 1, 3186]
    - [140, 25.043]
  - - [4096, 1024, 1, 3925]
    - [140, 25.128]
  - - [64, 71, 896, 71]
    - [171, 12.698]
  - - [1024, 4096, 1, 3435]
    - [141, 25.16]
  - - [4096, 1024, 1, 3434]
    - [140, 25.045]
  - - [1024, 33708, 1, 4012]
    - [143, 26.215]
  - - [1024, 4096, 1, 3340]
    - [143, 25.164]
  - - [1024, 1024, 1, 3860]
    - [145, 22.833]
  - - [4096, 1024, 1, 3489]
    - [140, 25.072]
  - - [1024, 4096, 1, 3162]
    - [141, 25.134]
  - - [4096, 1024, 1, 3436]
    - [140, 25.012]
  - - [1024, 1024, 1, 4005]
    - [156, 22.944]
  - - [64, 84, 752, 84]
    - [152, 14.284]
  - - [4096, 1024, 1, 3574]
    - [140, 25.084]
  - - [4096, 1024, 1, 3469]
    - [143, 25.007]
  - - [1024, 4096, 1, 3410]
    - [142, 25.181]
  - - [1024, 4096, 1, 3216]
    - [143, 25.196]
  - - [4096, 1024, 1, 3095]
    - [140, 24.983]
  - - [1024, 1024, 1, 3990]
    - [148, 23.06]
  - - [4096, 1024, 1, 3448]
    - [140, 25.026]
  - - [1024, 4096, 1, 3176]
    - [141, 25.153]
  - - [64, 49, 1296, 49]
    - [146, 11.258]
  - - [4096, 1024, 1, 2918]
    - [140, 24.943]
  - - [64, 14, 4368, 14]
    - [172, 4.573]
  - - [1024, 4096, 1, 3424]
    - [140, 25.204]
  - - [4096, 1024, 1, 3402]
    - [143, 25.024]
  - - [4096, 1024, 1, 3145]
    - [142, 25.008]
  - - [64, 134, 480, 134]
    - [149, 15.69]
  - - [1024, 33708, 1, 3976]
    - [142, 26.209]
  - - [4096, 1024, 1, 3518]
    - [143, 25.006]
  - - [4096, 1024, 1, 3110]
    - [140, 25.007]
  - - [4096, 1024, 1, 3325]
    - [140, 24.997]
  - - [1024, 33708, 1, 3999]
    - [143, 26.208]
  - - [4096, 1024, 1, 2985]
    - [140, 24.959]
  - - [1024, 4096, 1, 3371]
    - [143, 25.151]
  - - [4096, 1024, 1, 3342]
    - [140, 25.024]
  - - [4096, 1024, 1, 3141]
    - [142, 24.991]
  - - [4096, 1024, 1, 3532]
    - [142, 25.032]
  - - [64, 78, 816, 78]
    - [144, 13.49]
  - - [1024, 4096, 1, 3169]
    - [141, 25.144]
  - - [1024, 4096, 1, 3514]
    - [140, 25.164]
  - - [4096, 1024, 1, 3780]
    - [141, 25.117]
  - - [1024, 4096, 1, 3098]
    - [143, 25.122]
  - - [1024, 4096, 1, 3449]
    - [141, 25.168]
  - - [1024, 4096, 1, 3222]
    - [143, 25.163]
  - - [1024, 4096, 1, 3346]
    - [142, 25.151]
  - - [4096, 1024, 1, 3064]
    - [141, 24.988]
  - - [4096, 1024, 1, 3511]
    - [140, 25.05]
  - - [4096, 1024, 1, 3384]
    - [140, 25.044]
  - - [4096, 1024, 1, 3356]
    - [142, 25.0]
  - - [1024, 4096, 1, 3796]
    - [143, 25.221]
  - - [4096, 1024, 1, 3427]
    - [140, 25.075]
  - - [4096, 1024, 1, 3390]
    - [140, 25.026]
  - - [4096, 1024, 1, 3573]
    - [141, 25.082]
  - - [4096, 1024, 1, 3456]
    - [142, 25.094]
  - - [1024, 4096, 1, 3360]
    - [141, 25.215]
  - - [1024, 33708, 1, 3977]
    - [142, 26.202]
  - - [1024, 4096, 1, 2918]
    - [143, 25.125]
  - - [4096, 1024, 1, 3975]
    - [140, 25.131]
  - - [4096, 1024, 1, 3525]
    - [141, 25.067]
  - - [4096, 1024, 1, 3398]
    - [143, 25.052]
  - - [4096, 1024, 1, 3640]
    - [140, 25.08]
  - - [1024, 1024, 1, 3999]
    - [155, 22.823]
  - - [4096, 1024, 1, 3014]
    - [140, 24.969]
  - - [1024, 4096, 1, 3446]
    - [143, 25.162]
  - - [1024, 33708, 1, 3796]
    - [143, 26.232]
  - - [4096, 1024, 1, 3101]
    - [143, 24.934]
  - - [4096, 1024, 1, 3563]
    - [141, 25.024]
  - - [4096, 1024, 1, 3539]
    - [143, 25.091]
  - - [4096, 1024, 1, 3182]
    - [140, 24.95]
  - - [1024, 4096, 1, 3468]
    - [142, 25.151]
  - - [4096, 1024, 1, 3312]
    - [140, 25.092]
  - - [4096, 1024, 1, 3215]
    - [140, 25.001]
  - - [4096, 1024, 1, 3910]
    - [140, 25.104]
  - - [1024, 33708, 1, 3780]
    - [142, 26.214]
  - - [1024, 4096, 1, 3290]
    - [140, 25.156]
  - - [1024, 4096, 1, 4012]
    - [140, 25.226]
  - - [1024, 4096, 1, 3385]
    - [140, 25.158]
  - - [1024, 33708, 1, 3975]
    - [143, 26.209]
  - - [4096, 1024, 1, 3996]
    - [140, 25.096]
  - - [4096, 1024, 1, 2765]
    - [141, 24.865]
  - - [4096, 1024, 1, 3538]
    - [141, 25.083]
  - - [4096, 1024, 1, 3415]
    - [141, 25.053]
  - - [1024, 4096, 1, 3554]
    - [140, 25.199]
  - - [4096, 1024, 1, 3513]
    - [142, 25.053]
  - - [1024, 4096, 1, 3304]
    - [142, 25.137]
  - - [4096, 1024, 1, 3294]
    - [140, 24.994]
  - - [4096, 1024, 1, 3396]
    - [141, 25.069]
  - - [1024, 4096, 1, 3213]
    - [142, 25.095]
  - - [4096, 1024, 1, 3137]
    - [142, 25.01]
  - - [4096, 1024, 1, 3552]
    - [140, 25.129]
  - - [1024, 1024, 1, 4020]
    - [148, 23.085]
  - - [64, 13, 4672, 13]
    - [167, 4.297]
  - - [1024, 4096, 1, 3461]
    - [140, 25.165]
  - - [4096, 1024, 1, 3263]
    - [143, 24.976]
  - - [4096, 1024, 1, 3430]
    - [140, 25.08]
  - - [4096, 1024, 1, 3389]
    - [140, 25.014]
  - - [4096, 1024, 1, 3528]
    - [140, 25.049]
  - - [1024, 4096, 1, 3463]
    - [141, 25.193]
  - - [4096, 1024, 1, 3526]
    - [141, 25.059]
  - - [4096, 1024, 1, 3154]
    - [140, 25.012]
  - - [4096, 1024, 1, 3499]
    - [141, 25.024]
  - - [1024, 1024, 1, 3939]
    - [148, 23.107]
  - - [4096, 1024, 1, 3955]
    - [141, 25.134]
  - - [1024, 4096, 1, 3297]
    - [142, 25.182]
  - - [1024, 4096, 1, 3233]
    - [140, 25.17]
  - - [1024, 4096, 1, 3226]
    - [140, 25.147]
  - - [4096, 1024, 1, 3404]
    - [140, 25.035]
  - - [4096, 1024, 1, 3355]
    - [140, 25.023]
  - - [1024, 4096, 1, 3542]
    - [140, 25.185]
  - - [4096, 1024, 1, 3181]
    - [141, 24.945]
  - - [1024, 4096, 1, 3474]
    - [140, 25.189]
  - - [4096, 1024, 1, 3319]
    - [140, 25.042]
  - - [1024, 4096, 1, 3434]
    - [143, 25.162]
  - - [1024, 4096, 1, 3860]
    - [140, 25.233]
  - - [1024, 4096, 1, 3343]
    - [143, 25.155]
  - - [64, 77, 816, 78]
    - [144, 13.388]
  - - [1024, 4096, 1, 3488]
    - [140, 25.234]
  - - [1024, 4096, 1, 3046]
    - [140, 25.14]
  - - [1024, 4096, 1, 3141]
    - [141, 25.141]
  - - [1024, 4096, 1, 3516]
    - [141, 25.147]
  - - [4096, 1024, 1, 3147]
    - [140, 24.967]
  - - [1024, 1024, 1, 4059]
    - [155, 22.859]
  - - [1024, 1024, 1, 3944]
    - [155, 22.85]
  - - [1024, 4096, 1, 3421]
    - [141, 25.168]
  - - [4096, 1024, 1, 3944]
    - [142, 25.117]
  - - [64, 45, 1424, 45]
    - [173, 10.323]
  - - [1024, 4096, 1, 3574]
    - [142, 25.194]
  - - [1024, 4096, 1, 3977]
    - [143, 25.23]
  - - [1024, 4096, 1, 2985]
    - [140, 25.087]
  - - [64, 193, 320, 193]
    - [174, 16.825]
  - - [1024, 4096, 1, 3427]
    - [141, 25.203]
  - - [64, 12, 5040, 12]
    - [167, 3.939]
  - - [1024, 4096, 1, 3482]
    - [141, 25.225]
  - - [1024, 4096, 1, 3332]
    - [143, 25.178]
  - - [1024, 1024, 1, 3720]
    - [156, 22.935]
  - - [4096, 1024, 1, 3308]
    - [141, 24.998]
  - - [1024, 4096, 1, 3513]
    - [141, 25.169]
  - - [1024, 4096, 1, 3154]
    - [142, 25.139]
  - - [1024, 4096, 1, 3955]
    - [141, 25.245]
  - - [1024, 4096, 1, 2967]
    - [141, 25.111]
  - - [1024, 33708, 1, 3942]
    - [143, 26.224]
  - - [1024, 4096, 1, 3319]
    - [141, 25.149]
  - - [4096, 1024, 1, 3860]
    - [140, 25.141]
  - - [1024, 4096, 1, 3548]
    - [143, 25.179]
  - - [4096, 1024, 1, 3977]
    - [141, 25.096]
  - - [4096, 1024, 1, 3535]
    - [140, 25.036]
  - - [1024, 4096, 1, 3541]
    - [141, 25.177]
  - - [1024, 1024, 1, 3910]
    - [159, 23.038]
  - - [1024, 33708, 1, 3584]
    - [143, 26.216]
  - - [1024, 4096, 1, 3168]
    - [142, 25.185]
  - - [1024, 4096, 1, 3448]
    - [141, 25.175]
  - - [4096, 1024, 1, 3343]
    - [140, 25.009]
  - - [64, 35, 1808, 35]
    - [147, 8.056]
  - - [1024, 4096, 1, 3357]
    - [142, 25.124]
  - - [64, 143, 432, 143]
    - [153, 16.465]
  - - [4096, 1024, 1, 3510]
    - [140, 25.035]
  - - [4096, 1024, 1, 3369]
    - [140, 25.025]
  - - [64, 92, 688, 93]
    - [144, 15.701]
  - - [4096, 1024, 1, 3379]
    - [140, 25.042]
  - - [1024, 4096, 1, 3276]
    - [140, 25.13]
  - - [1024, 4096, 1, 3363]
    - [140, 25.182]
  - - [4096, 1024, 1, 3055]
    - [140, 24.945]
  - - [1024, 4096, 1, 3524]
    - [143, 25.178]
  - - [4096, 1024, 1, 3057]
    - [140, 24.998]
  - - [1024, 33708, 1, 3720]
    - [142, 26.202]
  - - [1024, 4096, 1, 3383]
    - [143, 25.167]
  - - [1024, 4096, 1, 3522]
    - [142, 25.2]
  - - [1024, 33708, 1, 3956]
    - [143, 26.219]
  - - [1024, 4096, 1, 3481]
    - [143, 25.174]
  - - [4096, 1024, 1, 3562]
    - [141, 25.054]
  - - [4096, 1024, 1, 3299]
    - [140, 25.049]
  - - [1024, 4096, 1, 3262]
    - [142, 25.181]
  - - [1024, 33708, 1, 4026]
    - [143, 26.22]
  - - [4096, 1024, 1, 3168]
    - [142, 25.063]
  - - [64, 101, 624, 101]
    - [164, 14.55]
  - - [1024, 4096, 1, 3999]
    - [143, 25.237]
  - - [1024, 4096, 1, 3549]
    - [143, 25.177]
  - - [4096, 1024, 1, 3375]
    - [140, 25.039]
  - - [1024, 4096, 1, 3496]
    - [141, 25.191]
  - - [64, 29, 2176, 29]
    - [152, 8.347]
  - - [1024, 4096, 1, 3190]
    - [141, 25.112]
  - - [4096, 1024, 1, 3273]
    - [141, 25.0]
  - - [1024, 4096, 1, 3406]
    - [140, 25.136]
  - - [4096, 1024, 1, 4005]
    - [143, 25.138]
  - - [4096, 1024, 1, 3555]
    - [140, 25.064]
  - - [4096, 1024, 1, 2505]
    - [140, 24.826]
  - - [1024, 4096, 1, 3460]
    - [140, 25.195]
  - - [64, 17, 3632, 17]
    - [144, 4.864]
  - - [1024, 4096, 1, 3579]
    - [142, 25.171]
  - - [1024, 33708, 1, 4030]
    - [142, 26.203]
  - - [1024, 4096, 1, 3510]
    - [142, 25.197]
  - - [1024, 1024, 1, 3969]
    - [145, 22.887]
  - - [1024, 4096, 1, 3282]
    - [141, 25.169]
  - - [1024, 4096, 1, 3377]
    - [143, 25.187]
  - - [1024, 4096, 1, 2935]
    - [141, 25.127]
  - - [64, 41, 1552, 41]
    - [144, 9.49]
  - - [1024, 4096, 1, 3498]
    - [143, 25.156]
  - - [1024, 4096, 1, 3593]
    - [140, 25.183]
  - - [1024, 1024, 1, 3948]
    - [148, 22.857]
  - - [4096, 1024, 1, 3226]
    - [141, 25.003]
  - - [1024, 4096, 1, 2499]
    - [140, 25.13]
  - - [1024, 4096, 1, 3296]
    - [143, 25.186]
  - - [1024, 4096, 1, 3455]
    - [140, 25.162]
  - - [1024, 4096, 1, 3399]
    - [142, 25.168]
  - - [1024, 4096, 1, 3205]
    - [143, 25.163]
  - - [4096, 1024, 1, 4026]
    - [141, 25.112]
  - - [1024, 4096, 1, 3484]
    - [143, 25.157]
  - - [4096, 1024, 1, 3302]
    - [141, 25.023]
  - - [1024, 4096, 1, 3485]
    - [141, 25.151]
  - - [1024, 1024, 1, 3996]
    - [148, 22.857]
  - - [1024, 4096, 1, 3126]
    - [142, 25.144]
  - - [1024, 4096, 1, 4050]
    - [143, 25.248]
  - - [4096, 1024, 1, 3235]
    - [142, 25.044]
  - - [1024, 33708, 1, 3955]
    - [143, 26.224]
  - - [1024, 4096, 1, 3342]
    - [143, 25.128]
  - - [1024, 1024, 1, 3900]
    - [159, 23.045]
  - - [1024, 4096, 1, 3397]
    - [141, 25.175]
  - - [4096, 1024, 1, 3491]
    - [141, 25.069]
  - - [1024, 4096, 1, 3503]
    - [143, 25.177]
  - - [1024, 4096, 1, 3140]
    - [142, 25.139]
  - - [4096, 1024, 1, 3121]
    - [140, 25.017]
  - - [4096, 1024, 1, 3276]
    - [140, 25.002]
  - - [1024, 4096, 1, 3321]
    - [141, 25.163]
  - - [1024, 4096, 1, 3870]
    - [141, 25.197]
  - - [4096, 1024, 1, 3475]
    - [140, 25.061]
  - - [1024, 4096, 1, 2984]
    - [140, 25.107]
  - - [4096, 1024, 1, 3363]
    - [142, 25.05]
  - - [1024, 4096, 1, 3582]
    - [140, 25.171]
  - - [4096, 1024, 1, 3509]
    - [140, 25.085]
  - - [1024, 4096, 1, 3426]
    - [143, 25.191]
  - - [4096, 1024, 1, 3136]
    - [140, 25.048]
  - - [1024, 4096, 1, 3232]
    - [141, 25.185]
  - - [4096, 1024, 1, 3103]
    - [140, 24.963]
  - - [1024, 4096, 1, 3335]
    - [142, 25.152]
  - - [1024, 4096, 1, 3900]
    - [143, 25.214]
  - - [4096, 1024, 1, 3512]
    - [142, 25.06]
  - - [4096, 1024, 1, 3222]
    - [140, 25.016]
  - - [1024, 4096, 1, 3165]
    - [140, 25.117]
  - - [4096, 1024, 1, 3408]
    - [140, 25.117]
  - - [4096, 1024, 1, 3751]
    - [140, 25.096]
  - - [1024, 4096, 1, 3318]
    - [143, 25.152]
  - - [4096, 1024, 1, 3442]
    - [141, 25.068]
  - - [1024, 4096, 1, 3413]
    - [140, 25.173]
  - - [4096, 1024, 1, 3524]
    - [140, 25.065]
  - - [1024, 4096, 1, 3976]
    - [141, 25.233]
  - - [1024, 4096, 1, 3475]
    - [141, 25.2]
  - - [1024, 4096, 1, 3534]
    - [143, 25.147]
  - - [4096, 1024, 1, 3301]
    - [140, 25.049]
  - - [4096, 1024, 1, 3248]
    - [140, 25.063]
  - - [1024, 4096, 1, 2977]
    - [142, 25.118]
  - - [4096, 1024, 1, 3346]
    - [140, 25.057]
  - - [1024, 4096, 1, 3451]
    - [143, 25.169]
  - - [1024, 4096, 1, 3257]
    - [142, 25.131]
  - - [1024, 1024, 1, 3640]
    - [155, 22.792]
  - - [1024, 4096, 1, 3356]
    - [143, 25.129]
  - - [4096, 1024, 1, 3348]
    - [141, 25.048]
  - - [4096, 1024, 1, 3335]
    - [140, 25.031]
  - - [4096, 1024, 1, 3505]
    - [140, 25.09]
  - - [1024, 4096, 1, 3490]
    - [143, 25.214]
  - - [4096, 1024, 1, 3447]
    - [140, 25.03]
  - - [1024, 4096, 1, 3267]
    - [141, 25.167]
  - - [4096, 1024, 1, 3230]
    - [140, 24.999]
  - - [4096, 1024, 1, 3455]
    - [140, 25.023]
  - - [1024, 4096, 1, 3925]
    - [143, 25.234]
  - - [1024, 4096, 1, 3362]
    - [142, 25.173]
  - - [4096, 1024, 1, 3969]
    - [141, 25.148]
  - - [4096, 1024, 1, 3527]
    - [140, 25.074]
  - - [1024, 4096, 1, 3585]
    - [142, 25.236]
  - - [4096, 1024, 1, 3063]
    - [140, 25.001]
  - - [4096, 1024, 1, 3435]
    - [140, 25.034]
  - - [4096, 1024, 1, 3366]
    - [141, 25.027]
  - - [4096, 1024, 1, 3581]
    - [143, 25.038]
  - - [1024, 33708, 1, 3906]
    - [143, 26.232]
  - - [1024, 4096, 1, 3464]
    - [141, 25.159]
  - - [1024, 4096, 1, 3440]
    - [140, 25.233]
  - - [4096, 1024, 1, 3143]
    - [140, 24.983]
  - - [1024, 4096, 1, 3349]
    - [142, 25.15]
  - - [4096, 1024, 1, 3416]
    - [140, 25.08]
  - - [4096, 1024, 1, 3365]
    - [140, 25.057]
  - - [1024, 4096, 1, 3470]
    - [141, 25.156]
  - - [4096, 1024, 1, 3287]
    - [140, 25.018]
  - - [1024, 4096, 1, 3441]
    - [141, 25.191]
  - - [4096, 1024, 1, 3224]
    - [140, 25.011]
  - - [1024, 4096, 1, 3387]
    - [143, 25.148]
  - - [1024, 4096, 1, 3547]
    - [143, 25.17]
  - - [4096, 1024, 1, 3478]
    - [142, 25.074]
  - - [4096, 1024, 1, 3548]
    - [141, 25.04]
  - - [1024, 33708, 1, 4020]
    - [143, 26.248]
  - - [4096, 1024, 1, 3320]
    - [140, 25.026]
  - - [1024, 4096, 1, 3906]
    - [140, 25.226]
  - - [4096, 1024, 1, 3796]
    - [140, 25.116]
  - - [1024, 4096, 1, 3306]
    - [143, 25.124]
  - - [1024, 4096, 1, 3401]
    - [141, 25.153]
  - - [64, 147, 432, 147]
    - [153, 16.813]
  - - [1024, 4096, 1, 3215]
    - [141, 25.146]
  - - [4096, 1024, 1, 4012]
    - [141, 25.113]
  - - [1024, 4096, 1, 2765]
    - [141, 25.026]
  - - [4096, 1024, 1, 3554]
    - [142, 25.076]
  - - [4096, 1024, 1, 3423]
    - [140, 25.033]
  - - [1024, 1024, 1, 3751]
    - [159, 22.851]
  - - [1024, 4096, 1, 3562]
    - [142, 25.174]
  - - [1024, 4096, 1, 3489]
    - [143, 25.211]
  - - [4096, 1024, 1, 3358]
    - [140, 25.012]
  - - [4096, 1024, 1, 3270]
    - [141, 24.993]
  - - [1024, 4096, 1, 3293]
    - [143, 25.131]
  - - [1024, 4096, 1, 3376]
    - [143, 25.207]
  - - [4096, 1024, 1, 3245]
    - [140, 24.997]
  - - [4096, 1024, 1, 3541]
    - [140, 25.085]
  - - [4096, 1024, 1, 3443]
    - [140, 25.046]
  - - [4096, 1024, 1, 3438]
    - [141, 25.026]
  - - [4096, 1024, 1, 3244]
    - [140, 25.016]
  - - [1024, 4096, 1, 3365]
    - [140, 25.174]
  - - [1024, 4096, 1, 3299]
    - [142, 25.177]
  - - [1024, 4096, 1, 3471]
    - [141, 25.165]
  - - [1024, 4096, 1, 3398]
    - [143, 25.166]
  - - [4096, 1024, 1, 3162]
    - [140, 24.976]
  - - [1024, 4096, 1, 4005]
    - [142, 25.239]
  - - [4096, 1024, 1, 3579]
    - [140, 25.037]
  - - [64, 18, 3440, 18]
    - [175, 5.225]
  - - [64, 177, 352, 177]
    - [168, 18.56]
  - - [1024, 4096, 1, 3121]
    - [141, 25.195]
  - - [4096, 1024, 1, 3441]
    - [140, 25.075]
  - - [4096, 1024, 1, 3422]
    - [140, 25.012]
  - - [4096, 1024, 1, 3444]
    - [140, 25.085]
  - - [1024, 4096, 1, 3337]
    - [142, 25.147]
  - - [4096, 1024, 1, 3550]
    - [143, 25.047]
  - - [1024, 4096, 1, 3477]
    - [143, 25.196]
  - - [4096, 1024, 1, 3490]
    - [140, 25.063]
  - - [4096, 1024, 1, 3585]
    - [140, 25.102]
  - - [1024, 4096, 1, 3143]
    - [143, 25.121]
  - - [1024, 33708, 1, 3876]
    - [142, 26.211]
  - - [1024, 4096, 1, 3320]
    - [141, 25.151]
  - - [1024, 4096, 1, 3423]
    - [141, 25.154]
  - - [1024, 4096, 1, 3894]
    - [143, 25.231]
  - - [4096, 1024, 1, 3410]
    - [140, 25.064]
  - - [1024, 4096, 1, 3561]
    - [143, 25.186]
  - - [4096, 1024, 1, 3492]
    - [142, 25.049]
  - - [64, 85, 752, 85]
    - [144, 14.549]
  - - [36548, 1024, 1, 3712]
    - [176, 26.304]
  - - [4096, 2048, 1, 128]
    - [177, 22.185]
  - - [1024, 1024, 1, 3712]
    - [178, 25.311]
  - - [1024, 1024, 1, 128]
    - [179, 14.628]
  - - [4096, 3072, 1, 128]
    - [177, 22.502]
  - - [768, 3072, 1, 4096]
    - [180, 25.445]
  - - [64, 256, 192, 256]
    - [181, 22.306]
  - - [768, 2, 1, 16]
    - [182, 0.013]
  - - [768, 30522, 1, 1280]
    - [183, 26.125]
  - - [64, 128, 384, 128]
    - [181, 19.437]
  - - [768, 30522, 1, 320]
    - [184, 25.392]
  - - [768, 30522, 1, 640]
    - [185, 25.896]
  - - [768, 2, 1, 32]
    - [186, 0.03]
  - - [256, 512, 36, 98]
    - [187, 20.284]
  - - [64, 192, 36, 25088]
    - [188, 21.855]
  - - [128, 128, 64, 25]
    - [189, 6.445]
  - - [256, 256, 64, 56]
    - [187, 17.569]
  - - [512, 486, 36, 800]
    - [190, 22.822]
  - - [512, 512, 36, 1568]
    - [191, 25.048]
  - - [64, 192, 64, 3200]
    - [192, 23.585]
  - - [256, 384, 36, 4096]
    - [192, 23.684]
  - - [128, 256, 64, 32]
    - [193, 10.859]
  - - [64, 128, 64, 23104]
    - [188, 25.633]
  - - [128, 256, 64, 9]
    - [194, 4.338]
  - - [256, 512, 36, 784]
    - [195, 24.156]
  - - [256, 324, 36, 32]
    - [196, 11.35]
  - - [512, 512, 36, 33]
    - [197, 15.033]
  - - [16, 32, 36, 5760]
    - [198, 3.676]
  - - [192, 384, 64, 128]
    - [192, 21.867]
  - - [512, 512, 64, 72]
    - [199, 20.957]
  - - [128, 128, 64, 1600]
    - [200, 22.856]
  - - [512, 512, 36, 128]
    - [192, 22.509]
  - - [192, 384, 64, 2304]
    - [200, 24.502]
  - - [384, 256, 64, 450]
    - [201, 24.202]
  - - [3, 64, 36, 6272]
    - [198, 1.293]
  - - [3, 64, 64, 2888]
    - [202, 1.798]
  - - [384, 256, 64, 2304]
    - [201, 26.101]
  - - [512, 512, 64, 144]
    - [192, 23.41]
  - - [256, 256, 36, 6272]
    - [195, 24.375]
  - - [80, 192, 64, 4608]
    - [203, 18.643]
  - - [64, 64, 36, 3136]
    - [204, 15.119]
  - - [256, 384, 64, 2304]
    - [201, 26.091]
  - - [512, 512, 36, 66]
    - [197, 19.328]
  - - [128, 256, 64, 800]
    - [205, 24.385]
  - - [64, 128, 36, 30]
    - [206, 3.153]
  - - [192, 256, 36, 512]
    - [192, 21.967]
  - - [256, 512, 64, 200]
    - [192, 23.225]
  - - [256, 512, 64, 25]
    - [196, 13.574]
  - - [3, 64, 64, 46208]
    - [207, 2.051]
  - - [128, 256, 36, 1568]
    - [208, 21.639]
  - - [64, 128, 64, 11552]
    - [188, 25.364]
  - - [128, 192, 64, 946]
    - [192, 23.338]
  - - [64, 192, 64, 12800]
    - [209, 22.836]
  - - [224, 224, 64, 128]
    - [210, 16.015]
  - - [128, 256, 64, 288]
    - [192, 22.068]
  - - [64, 64, 64, 826]
    - [211, 16.873]
  - - [256, 384, 64, 1152]
    - [205, 25.643]
  - - [3, 64, 64, 92416]
    - [207, 2.06]
  - - [32, 32, 36, 43808]
    - [212, 7.137]
  - - [160, 320, 64, 288]
    - [213, 20.528]
  - - [1, 16, 36, 23040]
    - [214, 0.108]
  - - [128, 256, 36, 128]
    - [215, 15.349]
  - - [128, 128, 64, 3360]
    - [192, 23.342]
  - - [128, 128, 64, 420]
    - [192, 20.631]
  - - [64, 128, 64, 361]
    - [187, 17.603]
  - - [512, 512, 36, 16]
    - [216, 9.635]
  - - [384, 256, 36, 800]
    - [217, 23.219]
  - - [192, 384, 36, 4096]
    - [217, 22.499]
  - - [64, 64, 64, 1600]
    - [218, 20.124]
  - - [256, 384, 64, 576]
    - [219, 24.727]
  - - [512, 512, 64, 14]
    - [197, 9.231]
  - - [512, 512, 36, 8]
    - [220, 5.784]
  - - [512, 486, 64, 128]
    - [195, 21.155]
  - - [1, 16, 64, 640]
    - [221, 0.127]
  - - [64, 96, 64, 288]
    - [222, 14.482]
  - - [96, 96, 36, 1568]
    - [223, 17.422]
  - - [256, 256, 36, 128]
    - [224, 19.546]
  - - [64, 128, 36, 53824]
    - [225, 16.064]
  - - [256, 256, 36, 32]
    - [199, 11.795]
  - - [192, 256, 64, 288]
    - [192, 22.804]
  - - [256, 256, 36, 16]
    - [226, 7.39]
  - - [128, 256, 36, 3200]
    - [208, 22.023]
  - - [160, 320, 64, 512]
    - [213, 21.438]
  - - [128, 160, 36, 512]
    - [211, 18.306]
  - - [96, 96, 36, 2592]
    - [210, 18.026]
  - - [64, 96, 64, 800]
    - [223, 18.441]
  - - [147, 64, 36, 18816]
    - [227, 18.055]
  - - [160, 320, 36, 512]
    - [210, 19.98]
  - - [256, 512, 36, 4]
    - [228, 2.625]
  - - [96, 128, 64, 946]
    - [225, 20.046]
  - - [256, 324, 64, 1568]
    - [201, 21.793]
  - - [128, 128, 64, 50]
    - [199, 10.328]
  - - [35, 96, 36, 8960]
    - [229, 10.675]
  - - [32, 64, 36, 43808]
    - [230, 11.14]
  - - [160, 224, 36, 128]
    - [210, 13.82]
  - - [64, 64, 64, 81]
    - [231, 6.067]
  - - [256, 256, 36, 3200]
    - [200, 24.254]
  - - [256, 256, 36, 210]
    - [195, 21.349]
  - - [192, 384, 64, 576]
    - [192, 24.024]
  - - [512, 512, 64, 800]
    - [205, 25.616]
  - - [512, 24, 36, 800]
    - [232, 12.081]
  - - [64, 64, 64, 13216]
    - [233, 21.544]
  - - [192, 224, 64, 1152]
    - [211, 22.249]
  - - [256, 256, 64, 1152]
    - [201, 25.342]
  - - [512, 486, 64, 512]
    - [205, 23.481]
  - - [128, 128, 36, 784]
    - [210, 18.948]
  - - [256, 512, 64, 1600]
    - [234, 25.962]
  - - [512, 512, 64, 9]
    - [199, 6.596]
  - - [96, 128, 64, 288]
    - [223, 16.744]
  - - [64, 96, 36, 512]
    - [223, 12.873]
  - - [256, 512, 36, 1568]
    - [192, 24.453]
  - - [128, 128, 64, 400]
    - [192, 20.785]
  - - [128, 128, 64, 800]
    - [192, 22.115]
  - - [96, 128, 36, 512]
    - [204, 17.144]
  - - [16, 32, 36, 360]
    - [235, 1.913]
  - - [128, 256, 64, 3200]
    - [201, 25.936]
  - - [96, 128, 64, 800]
    - [223, 20.216]
  - - [256, 512, 64, 4]
    - [194, 2.786]
  - - [256, 256, 64, 450]
    - [205, 23.716]
  - - [64, 64, 64, 3200]
    - [218, 21.612]
  - - [192, 224, 64, 128]
    - [236, 17.85]
  - - [128, 128, 64, 288]
    - [192, 19.666]
  - - [256, 256, 64, 72]
    - [199, 19.003]
  - - [96, 208, 36, 512]
    - [223, 17.606]
  - - [128, 256, 36, 3136]
    - [211, 21.996]
  - - [64, 64, 36, 3520]
    - [210, 15.242]
  - - [64, 128, 36, 1568]
    - [203, 17.501]
  - - [160, 320, 64, 242]
    - [237, 19.976]
  - - [192, 192, 36, 512]
    - [210, 19.555]
  - - [512, 512, 36, 512]
    - [192, 24.312]
  - - [1, 16, 64, 10240]
    - [238, 0.181]
  - - [128, 128, 36, 512]
    - [210, 18.139]
  - - [512, 512, 36, 256]
    - [200, 23.81]
  - - [512, 512, 36, 1024]
    - [239, 24.808]
  - - [96, 208, 64, 1152]
    - [203, 19.919]
  - - [128, 192, 64, 3200]
    - [200, 24.08]
  - - [256, 256, 36, 4096]
    - [217, 24.32]
  - - [160, 160, 64, 288]
    - [223, 18.521]
  - - [256, 256, 64, 896]
    - [201, 24.992]
  - - [128, 256, 64, 242]
    - [192, 21.29]
  - - [128, 128, 36, 440]
    - [211, 15.92]
  - - [96, 128, 36, 1568]
    - [204, 19.98]
  - - [192, 384, 36, 1024]
    - [217, 22.113]
  - - [64, 96, 36, 10368]
    - [240, 18.975]
  - - [128, 256, 64, 100]
    - [197, 17.976]
  - - [112, 224, 36, 2048]
    - [241, 19.171]
  - - [384, 256, 64, 1152]
    - [201, 25.631]
  - - [192, 384, 36, 128]
    - [192, 19.138]
  - - [128, 128, 36, 7040]
    - [208, 19.284]
  - - [128, 256, 64, 1568]
    - [201, 25.387]
  - - [128, 128, 36, 1568]
    - [242, 19.913]
  - - [128, 256, 64, 72]
    - [243, 16.628]
  - - [256, 256, 36, 12544]
    - [244, 23.761]
  - - [256, 256, 36, 105]
    - [199, 18.486]
  - - [128, 256, 36, 392]
    - [211, 19.348]
  - - [64, 64, 64, 5408]
    - [218, 22.537]
  - - [3, 64, 36, 25088]
    - [198, 1.342]
  - - [384, 256, 36, 1024]
    - [192, 23.298]
  - - [35, 96, 36, 13440]
    - [245, 10.429]
  - - [128, 256, 64, 1152]
    - [201, 24.877]
  - - [256, 324, 64, 32]
    - [196, 12.797]
  - - [160, 224, 64, 128]
    - [246, 15.34]
  - - [192, 224, 36, 2592]
    - [247, 22.527]
  - - [96, 96, 64, 1152]
    - [223, 20.387]
  - - [32, 64, 36, 90]
    - [248, 2.447]
  - - [64, 128, 64, 2888]
    - [195, 22.954]
  - - [256, 384, 36, 800]
    - [192, 23.225]
  - - [512, 512, 64, 4]
    - [249, 3.13]
  - - [192, 320, 36, 128]
    - [187, 18.745]
  - - [64, 128, 36, 480]
    - [203, 14.343]
  - - [192, 384, 64, 242]
    - [192, 23.038]
  - - [256, 486, 64, 32]
    - [216, 14.993]
  - - [147, 64, 64, 9702]
    - [250, 18.571]
  - - [512, 512, 64, 64]
    - [189, 20.752]
  - - [64, 192, 64, 3698]
    - [200, 23.565]
  - - [73, 192, 64, 10439]
    - [225, 16.918]
  - - [1, 16, 36, 1440]
    - [251, 0.085]
  - - [128, 256, 36, 512]
    - [211, 20.27]
  - - [512, 512, 64, 576]
    - [205, 25.25]
  - - [64, 64, 36, 12544]
    - [230, 14.9]
  - - [128, 128, 36, 880]
    - [204, 19.276]
  - - [192, 224, 36, 128]
    - [236, 16.368]
  - - [64, 64, 64, 800]
    - [218, 17.549]
  - - [64, 128, 36, 12544]
    - [252, 16.228]
  - - [64, 64, 36, 1568]
    - [210, 14.048]
  - - [160, 160, 36, 512]
    - [210, 18.636]
  - - [512, 24, 64, 512]
    - [253, 13.302]
  - - [3, 64, 36, 3136]
    - [198, 1.206]
  - - [256, 256, 64, 9]
    - [196, 5.345]
  - - [3, 64, 64, 11552]
    - [207, 1.992]
  - - [128, 256, 36, 12544]
    - [254, 22.307]
  - - [128, 128, 36, 3136]
    - [242, 20.547]
  - - [256, 512, 36, 3136]
    - [195, 24.596]
  - - [64, 64, 36, 196]
    - [255, 6.997]
  - - [144, 288, 36, 512]
    - [204, 17.958]
  - - [256, 24, 64, 32]
    - [256, 3.765]
  - - [384, 384, 36, 800]
    - [200, 23.46]
  - - [512, 512, 64, 1600]
    - [205, 26.075]
  - - [112, 224, 36, 512]
    - [211, 17.113]
  - - [128, 128, 36, 49]
    - [197, 6.892]
  - - [512, 512, 36, 4]
    - [228, 2.934]
  - - [35, 96, 64, 4235]
    - [210, 11.75]
  - - [192, 384, 64, 450]
    - [200, 23.779]
  - - [256, 256, 36, 1024]
    - [192, 23.714]
  - - [112, 224, 64, 1152]
    - [211, 19.09]
  - - [256, 512, 64, 400]
    - [234, 24.352]
  - - [149, 32, 36, 19072]
    - [245, 14.746]
  - - [128, 256, 36, 6272]
    - [211, 22.212]
  - - [128, 192, 36, 1568]
    - [223, 20.792]
  - - [256, 256, 36, 512]
    - [192, 23.023]
  - - [256, 256, 64, 112]
    - [192, 21.073]
  - - [512, 512, 64, 18]
    - [216, 10.971]
  - - [256, 256, 64, 18]
    - [199, 9.001]
  - - [256, 256, 64, 1568]
    - [201, 25.731]
  - - [64, 96, 36, 1568]
    - [218, 17.267]
  - - [384, 256, 36, 4096]
    - [192, 23.624]
  - - [256, 512, 64, 800]
    - [205, 25.368]
  - - [256, 384, 36, 2048]
    - [192, 23.559]
  - - [3, 64, 36, 200704]
    - [202, 1.389]
  - - [384, 384, 64, 2304]
    - [239, 25.122]
  - - [160, 320, 64, 128]
    - [257, 18.049]
  - - [512, 512, 36, 528]
    - [200, 24.275]
  - - [160, 320, 36, 128]
    - [225, 16.266]
  - - [96, 96, 64, 800]
    - [223, 19.511]
  - - [256, 512, 36, 49]
    - [199, 17.053]
  - - [384, 384, 64, 450]
    - [200, 24.163]
  - - [3, 64, 64, 23104]
    - [207, 2.034]
  - - [256, 256, 64, 3200]
    - [201, 26.134]
  - - [128, 192, 36, 512]
    - [211, 19.028]
  - - [192, 192, 64, 288]
    - [192, 22.262]
  - - [96, 208, 64, 242]
    - [225, 14.974]
  - - [256, 16, 36, 3200]
    - [258, 9.661]
  - - [512, 512, 64, 8]
    - [256, 6.038]
  - - [64, 128, 64, 5776]
    - [195, 23.679]
  - - [512, 512, 64, 288]
    - [200, 24.159]
  - - [256, 16, 36, 32]
    - [259, 1.943]
  - - [128, 192, 64, 288]
    - [192, 21.636]
  - - [32, 64, 64, 640]
    - [223, 11.824]
  - - [64, 64, 36, 392]
    - [223, 9.353]
  - - [384, 384, 36, 1024]
    - [217, 23.551]
  - - [64, 64, 36, 11552]
    - [260, 14.982]
  - - [96, 128, 36, 6272]
    - [204, 21.188]
  - - [128, 256, 36, 16]
    - [226, 5.442]
  - - [256, 256, 64, 288]
    - [192, 23.19]
  - - [64, 64, 64, 1652]
    - [218, 19.705]
  - - [256, 384, 36, 1024]
    - [217, 23.35]
  - - [96, 128, 64, 3200]
    - [261, 22.495]
  - - [256, 324, 36, 3200]
    - [241, 20.79]
  - - [128, 192, 64, 800]
    - [192, 23.337]
  - - [64, 128, 64, 10]
    - [262, 2.159]
  - - [96, 208, 64, 288]
    - [223, 16.917]
  - - [64, 96, 36, 2592]
    - [229, 18.311]
  - - [64, 128, 64, 160]
    - [263, 13.17]
  - - [192, 384, 64, 512]
    - [200, 23.966]
  - - [64, 64, 36, 6272]
    - [210, 15.761]
  - - [512, 24, 36, 288]
    - [264, 9.952]
  - - [128, 128, 64, 1568]
    - [200, 22.931]
  - - [112, 224, 64, 242]
    - [222, 16.236]
  - - [128, 256, 64, 1600]
    - [201, 25.398]
  - - [32, 32, 64, 20000]
    - [265, 11.109]
  - - [160, 192, 64, 288]
    - [225, 19.799]
  - - [512, 24, 64, 128]
    - [266, 9.473]
  - - [512, 512, 36, 32]
    - [199, 15.059]
  - - [3, 64, 36, 100352]
    - [198, 1.377]
  - - [3, 64, 64, 1444]
    - [202, 1.71]
  - - [512, 512, 36, 3136]
    - [239, 25.172]
  - - [128, 256, 64, 6400]
    - [267, 26.258]
  - - [256, 256, 36, 2048]
    - [192, 24.151]
  - - [128, 160, 64, 288]
    - [211, 19.155]
  - - [256, 256, 64, 6400]
    - [201, 26.368]
  - - [32, 64, 64, 20000]
    - [230, 16.476]
  - - [256, 256, 36, 1680]
    - [195, 24.137]
  - - [128, 128, 64, 210]
    - [192, 17.999]
  - - [192, 384, 36, 2048]
    - [200, 22.375]
  - - [256, 256, 64, 144]
    - [192, 21.842]
  - - [384, 384, 36, 4096]
    - [217, 23.74]
  - - [160, 320, 64, 1152]
    - [225, 22.199]
  - - [384, 256, 36, 2048]
    - [192, 23.544]
  - - [256, 512, 36, 392]
    - [192, 23.474]
  - - [256, 512, 64, 50]
    - [199, 19.058]
  - - [73, 192, 36, 23360]
    - [268, 14.723]
  - - [3, 64, 36, 50176]
    - [198, 1.375]
  - - [384, 384, 36, 2048]
    - [200, 23.661]
  - - [256, 384, 64, 450]
    - [205, 24.176]
  - - [192, 320, 64, 128]
    - [217, 21.312]
  - - [128, 256, 36, 32]
    - [197, 8.314]
  - - [160, 192, 36, 512]
    - [204, 19.669]
  - - [512, 512, 64, 256]
    - [195, 24.036]
  - - [256, 512, 64, 32]
    - [196, 16.216]
  - - [384, 384, 64, 576]
    - [200, 24.395]
  - - [64, 64, 64, 648]
    - [218, 15.939]
  - - [512, 486, 36, 288]
    - [192, 21.883]
  - - [32, 64, 36, 1440]
    - [210, 10.051]
  - - [144, 288, 64, 242]
    - [225, 16.104]
  - - [384, 256, 64, 576]
    - [201, 24.802]
  - - [512, 512, 36, 64]
    - [189, 19.768]
  - - [448, 384, 64, 128]
    - [200, 23.17]
  - - [64, 128, 64, 722]
    - [263, 20.417]
  - - [144, 288, 64, 288]
    - [204, 17.404]
  - - [512, 512, 64, 224]
    - [192, 23.919]
  - - [112, 224, 64, 288]
    - [222, 17.093]
  - - [384, 384, 64, 1152]
    - [239, 24.916]
  - - [448, 384, 36, 128]
    - [192, 22.229]
  - - [64, 64, 64, 100]
    - [236, 6.871]
  - - [256, 486, 36, 128]
    - [224, 19.384]
  - - [64, 96, 64, 4608]
    - [203, 21.189]
  - - [16, 32, 64, 160]
    - [248, 1.868]
  - - [64, 192, 36, 6272]
    - [203, 20.402]
  - - [64, 64, 64, 200]
    - [255, 9.957]
  - - [256, 256, 36, 800]
    - [192, 23.595]
  - - [64, 128, 36, 6272]
    - [260, 17.294]
  - - [32, 64, 64, 40]
    - [269, 2.247]
  - - [256, 16, 64, 32]
    - [270, 3.058]
  - - [192, 384, 36, 800]
    - [217, 22.007]
  - - [128, 128, 36, 3200]
    - [223, 21.665]
  - - [256, 256, 36, 256]
    - [195, 21.45]
  - - [192, 384, 64, 1152]
    - [200, 24.329]
  - - [128, 256, 64, 200]
    - [193, 20.656]
  - - [64, 96, 64, 1152]
    - [223, 19.336]
  - - [128, 128, 36, 392]
    - [211, 15.668]
  - - [80, 192, 36, 10368]
    - [230, 16.484]
  - - [224, 224, 36, 128]
    - [203, 14.784]
  - - [512, 512, 64, 28]
    - [199, 14.535]
  - - [256, 16, 64, 1568]
    - [271, 11.765]
  - - [144, 288, 64, 1152]
    - [204, 19.75]
  - - [256, 256, 64, 576]
    - [201, 24.347]
  - - [64, 128, 36, 784]
    - [203, 15.373]
  - - [256, 24, 36, 128]
    - [264, 5.683]
  - - [256, 256, 64, 2304]
    - [201, 25.944]
  - - [192, 384, 36, 512]
    - [192, 21.69]
  - - [16, 32, 64, 2560]
    - [198, 5.463]
  - - [256, 512, 36, 32]
    - [196, 14.468]
  - - [512, 512, 64, 128]
    - [192, 23.048]
  - - [128, 128, 64, 200]
    - [187, 17.689]
  - - [512, 512, 64, 32]
    - [197, 15.854]
  - - [128, 256, 36, 196]
    - [197, 16.818]
  - - [8, 384, 64, 6600]
    - [207, 6.936]
  - - [149, 32, 64, 8195]
    - [211, 15.352]
  - - [35, 96, 64, 6160]
    - [204, 11.898]
  - - [64, 64, 36, 1760]
    - [210, 14.265]
  - - [196, 528, 32, 32]
    - [272, 10.373]
  - - [5329, 64, 32, 80]
    - [273, 21.138]
  - - [64, 2880, 1, 320]
    - [274, 11.069]
  - - [49, 832, 32, 256]
    - [275, 14.256]
  - - [196, 512, 32, 24]
    - [276, 9.189]
  - - [289, 1120, 1, 160]
    - [277, 8.38]
  - - [1225, 192, 32, 32]
    - [278, 15.717]
  - - [64, 2048, 32, 384]
    - [279, 24.209]
  - - [1001, 1536, 1, 32]
    - [280, 9.072]
  - - [289, 1792, 1, 320]
    - [281, 13.042]
  - - [1001, 1024, 1, 32]
    - [282, 6.935]
  - - [196, 480, 32, 64]
    - [283, 12.865]
  - - [64, 1728, 1, 320]
    - [284, 8.133]
  - - [49, 832, 32, 160]
    - [285, 12.658]
  - - [49, 832, 32, 384]
    - [275, 14.974]
  - - [289, 896, 1, 192]
    - [286, 8.76]
  - - [289, 1024, 32, 384]
    - [287, 22.587]
  - - [784, 192, 32, 96]
    - [288, 19.926]
  - - [50176, 256, 1, 128]
    - [289, 22.941]
  - - [289, 1024, 32, 256]
    - [290, 21.974]
  - - [289, 1024, 32, 192]
    - [291, 21.397]
  - - [12544, 512, 1, 256]
    - [292, 23.31]
  - - [1225, 1728, 1, 192]
    - [293, 19.589]
  - - [196, 480, 32, 96]
    - [294, 14.367]
  - - [196, 512, 32, 144]
    - [295, 16.571]
  - - [784, 400, 1, 32]
    - [296, 3.248]
  - - [289, 768, 32, 128]
    - [297, 20.078]
  - - [5329, 576, 1, 96]
    - [298, 19.19]
  - - [49, 1200, 1, 128]
    - [299, 2.567]
  - - [64, 1536, 32, 256]
    - [300, 23.239]
  - - [289, 2592, 1, 384]
    - [301, 15.23]
  - - [196, 528, 32, 128]
    - [302, 15.19]
  - - [64, 2048, 32, 448]
    - [279, 24.534]
  - - [5329, 448, 1, 64]
    - [273, 15.733]
  - - [784, 256, 32, 64]
    - [303, 19.341]
  - - [784, 192, 32, 32]
    - [272, 14.904]
  - - [21609, 288, 1, 32]
    - [304, 13.438]
  - - [784, 256, 32, 32]
    - [305, 15.821]
  - - [5041, 720, 1, 192]
    - [306, 20.655]
  - - [289, 2016, 1, 256]
    - [307, 13.711]
  - - [196, 512, 32, 128]
    - [308, 16.154]
  - - [289, 768, 32, 160]
    - [295, 20.942]
  - - [64, 1536, 32, 384]
    - [309, 24.125]
  - - [64, 1280, 32, 320]
    - [309, 23.014]
  - - [289, 896, 1, 128]
    - [310, 7.403]
  - - [289, 3456, 1, 384]
    - [293, 18.458]
  - - [196, 800, 1, 64]
    - [311, 3.536]
  - - [64, 1280, 32, 384]
    - [312, 23.406]
  - - [64, 1344, 1, 512]
    - [313, 7.717]
  - - [1001, 4096, 1, 512]
    - [312, 23.829]
  - - [1225, 192, 32, 64]
    - [273, 19.611]
  - - [64, 1152, 1, 384]
    - [314, 6.192]
  - - [729, 1600, 1, 192]
    - [315, 17.323]
  - - [289, 1344, 1, 192]
    - [316, 11.263]
  - - [784, 192, 32, 16]
    - [317, 9.294]
  - - [3136, 1024, 1, 2048]
    - [318, 23.017]
  - - [64, 1152, 1, 448]
    - [319, 6.506]
  - - [49, 832, 32, 128]
    - [316, 12.009]
  - - [784, 256, 32, 128]
    - [320, 21.494]
  - - [49, 800, 1, 128]
    - [321, 1.607]
  - - [196, 512, 32, 32]
    - [272, 11.048]
  - - [1225, 384, 32, 96]
    - [322, 22.205]
  - - [5041, 576, 1, 96]
    - [323, 17.932]
  - - [49, 832, 32, 48]
    - [324, 8.415]
  - - [5329, 160, 32, 64]
    - [325, 20.703]
  - - [1225, 288, 32, 48]
    - [326, 16.932]
  - - [4096, 9216, 1, 512]
    - [327, 25.668]
  - - [196, 480, 32, 192]
    - [328, 16.209]
  - - [64, 1152, 1, 256]
    - [274, 5.03]
  - - [3136, 1024, 1, 512]
    - [318, 22.189]
  - - [49, 832, 32, 32]
    - [329, 6.896]
  - - [784, 192, 32, 64]
    - [303, 18.309]
  - - [289, 1024, 32, 128]
    - [330, 20.223]
  - - [289, 768, 32, 192]
    - [331, 21.128]
  - - [289, 1120, 1, 192]
    - [332, 9.43]
  - - [196, 512, 32, 112]
    - [333, 15.865]
  - - [1001, 2048, 1, 32]
    - [334, 10.149]
  - - [1225, 288, 32, 64]
    - [325, 18.288]
  - - [196, 600, 1, 64]
    - [335, 2.776]
  - - [1225, 384, 32, 192]
    - [322, 23.679]
  - - [50176, 256, 1, 512]
    - [336, 24.95]
  - - [196, 512, 32, 160]
    - [297, 16.782]
  - - [4096, 4096, 1, 512]
    - [337, 25.454]
  - - [49, 832, 32, 192]
    - [316, 13.306]
  - - [1225, 256, 32, 64]
    - [273, 20.227]
  - - [64, 2048, 32, 320]
    - [279, 23.86]
  - - [196, 480, 32, 16]
    - [338, 6.913]
  - - [1225, 256, 32, 48]
    - [303, 18.015]
  - - [64, 1280, 32, 448]
    - [312, 23.708]
  - - [1225, 1200, 1, 64]
    - [339, 13.087]
  - - [1225, 384, 32, 64]
    - [273, 20.856]
  - - [12544, 512, 1, 1024]
    - [318, 24.541]
  - - [64, 1280, 32, 192]
    - [333, 21.63]
  - - [196, 512, 32, 64]
    - [273, 13.927]
  - - [289, 1792, 1, 256]
    - [340, 12.259]
  - - [196, 528, 32, 256]
    - [341, 16.375]
  - - [64, 2048, 32, 192]
    - [320, 22.723]
  - - [196, 528, 32, 160]
    - [328, 15.632]
  - - [1225, 192, 32, 48]
    - [273, 18.361]
  - - [64, 1728, 1, 192]
    - [314, 6.294]
  - - [1001, 2048, 1, 64]
    - [342, 14.499]
  - - [5329, 64, 128, 80]
    - [343, 22.417]
  - - [64, 1280, 128, 448]
    - [344, 25.424]
  - - [289, 768, 128, 128]
    - [345, 21.674]
  - - [1225, 192, 128, 64]
    - [346, 21.426]
  - - [1225, 288, 128, 48]
    - [347, 18.381]
  - - [289, 768, 128, 192]
    - [348, 22.313]
  - - [289, 768, 128, 160]
    - [349, 22.087]
  - - [64, 2048, 128, 192]
    - [350, 24.814]
  - - [64, 1280, 128, 384]
    - [351, 25.247]
  - - [1225, 256, 128, 48]
    - [352, 20.992]
  - - [1225, 192, 128, 48]
    - [352, 20.653]
  - - [1225, 288, 128, 64]
    - [347, 20.009]
  - - [64, 1280, 128, 320]
    - [353, 25.104]
  - - [1225, 256, 128, 64]
    - [350, 21.75]
  - - [1001, 2048, 1, 128]
    - [354, 18.494]
  - - [1225, 192, 128, 32]
    - [355, 18.026]
  - - [64, 1280, 128, 192]
    - [356, 24.464]
  - - [1001, 1536, 1, 64]
    - [357, 13.058]
  - - [65, 1024, 1, 6400]
    - [358, 9.025]
  - - [256, 4096, 1, 6400]
    - [359, 25.708]
  - - [1024, 4096, 1, 64]
    - [360, 17.553]
  - - [1024, 4096, 1, 6336]
    - [361, 26.371]
  - - [64, 38, 840, 38]
    - [362, 7.718]
  - - [64, 49, 648, 49]
    - [363, 9.427]
  - - [512, 2048, 1, 3427]
    - [364, 25.309]
  - - [512, 2048, 1, 3552]
    - [364, 25.343]
  - - [512, 2048, 1, 3840]
    - [364, 25.443]
  - - [512, 33708, 1, 3780]
    - [364, 26.613]
  - - [512, 33708, 1, 3968]
    - [365, 26.652]
  - - [512, 33708, 1, 4030]
    - [366, 26.637]
  - - [2048, 512, 1, 3427]
    - [364, 25.36]
  - - [2048, 512, 1, 3452]
    - [364, 25.336]
  - - [2048, 512, 1, 3472]
    - [365, 25.354]
  - - [2048, 512, 1, 3475]
    - [365, 25.37]
  - - [64, 12, 2520, 12]
    - [362, 2.994]
  - - [64, 13, 2336, 13]
    - [367, 3.106]
  - - [64, 14, 2184, 14]
    - [368, 3.421]
  - - [64, 15, 2048, 15]
    - [369, 3.668]
  - - [64, 16, 1920, 16]
    - [370, 4.494]
  - - [64, 17, 1816, 17]
    - [371, 4.081]
  - - [64, 18, 1720, 18]
    - [362, 4.351]
  - - [64, 19, 1632, 19]
    - [372, 4.582]
  - - [64, 21, 1488, 21]
    - [362, 5.163]
  - - [64, 23, 1360, 23]
    - [362, 5.682]
  - - [64, 25, 1256, 25]
    - [362, 5.815]
  - - [64, 27, 1168, 27]
    - [373, 6.085]
  - - [64, 29, 1088, 29]
    - [373, 6.609]
  - - [64, 32, 992, 32]
    - [374, 7.608]
  - - [64, 35, 904, 35]
    - [362, 7.227]
  - - [64, 41, 776, 41]
    - [375, 8.274]
  - - [64, 45, 712, 45]
    - [362, 8.977]
  - - [64, 54, 592, 54]
    - [375, 10.275]
  - - [64, 59, 544, 59]
    - [375, 10.827]
  - - [64, 64, 496, 64]
    - [376, 12.273]
  - - [64, 64, 496, 65]
    - [377, 14.245]
  - - [64, 65, 496, 65]
    - [378, 10.634]
  - - [64, 71, 448, 71]
    - [375, 11.346]
  - - [64, 77, 408, 77]
    - [363, 11.976]
  - - [64, 77, 408, 78]
    - [379, 12.161]
  - - [64, 78, 408, 78]
    - [380, 12.319]
  - - [64, 85, 376, 85]
    - [381, 13.005]
  - - [64, 93, 344, 93]
    - [381, 14.11]
  - - [64, 112, 288, 112]
    - [382, 15.119]
  - - [64, 122, 264, 122]
    - [383, 14.908]
  - - [64, 123, 264, 122]
    - [384, 14.946]
  - - [64, 123, 264, 123]
    - [385, 15.239]
  - - [64, 134, 240, 134]
    - [381, 14.627]
  - - [64, 135, 240, 134]
    - [381, 14.494]
  - - [64, 135, 240, 135]
    - [381, 14.507]
  - - [49, 512, 64, 2048]
    - [386, 19.234]
  - - [49, 2048, 64, 512]
    - [387, 18.821]
  - - [64, 1280, 64, 192]
    - [388, 23.701]
  - - [64, 1280, 64, 320]
    - [389, 24.691]
  - - [64, 1280, 64, 384]
    - [390, 24.816]
  - - [64, 1280, 64, 448]
    - [391, 24.997]
  - - [64, 2048, 64, 192]
    - [392, 24.151]
  - - [64, 2048, 64, 320]
    - [393, 25.039]
  - - [64, 2048, 64, 384]
    - [391, 25.107]
  - - [64, 2048, 64, 448]
    - [394, 25.3]
  - - [196, 256, 64, 1024]
    - [394, 19.249]
  - - [196, 1024, 64, 256]
    - [395, 19.831]
  - - [289, 768, 64, 128]
    - [389, 21.115]
  - - [289, 768, 64, 160]
    - [396, 21.588]
  - - [289, 768, 64, 192]
    - [389, 21.942]
  - - [784, 128, 64, 512]
    - [391, 23.761]
  - - [784, 512, 64, 128]
    - [392, 23.409]
  - - [1225, 192, 64, 32]
    - [397, 17.419]
  - - [1225, 192, 64, 48]
    - [398, 20.083]
  - - [1225, 192, 64, 64]
    - [398, 21.013]
  - - [1225, 256, 64, 48]
    - [398, 20.589]
  - - [1225, 256, 64, 64]
    - [398, 21.273]
  - - [1225, 288, 64, 48]
    - [399, 18.081]
  - - [1225, 288, 64, 64]
    - [399, 19.569]
  - - [3136, 64, 64, 64]
    - [398, 21.709]
  - - [3136, 64, 64, 256]
    - [389, 24.854]
  - - [3136, 256, 64, 64]
    - [392, 23.772]
  - - [5329, 64, 64, 80]
    - [400, 22.117]
  - - [1024, 2, 1, 512]
    - [401, 0.0]
  - - [1024, 2, 1, 3072]
    - [401, 0.0]
  - - [1024, 2, 1, 6]
    - [401, 0.0]
  - - [33, 32, 1600, 33]
    - [402, 2.133]
  - - [33, 32, 200, 33]
    - [403, 1.068]
  - - [3, 64, 512, 3]
    - [402, 0.037]
  - - [256, 44505, 1, 8976]
    - [404, 51.897]
  - - [9, 64, 512, 9]
    - [405, 0.306]
  - - [1024, 1, 1, 200]
    - [406, 0.024]
  - - [257, 4096, 1, 1024]
    - [407, 19.195]
  - - [2048, 1, 1, 512]
    - [408, 0.073]
  - - [67, 2048, 1, 512]
    - [409, 5.018]
  - - [1024, 256, 1, 33536]
    - [409, 13.673]
  - - [5, 64, 512, 5]
    - [410, 0.1]
  - - [512, 2048, 1, 2790]
    - [411, 32.205]
  - - [512, 2048, 1, 2864]
    - [411, 32.674]
  - - [512, 2048, 1, 3092]
    - [411, 32.706]
  - - [512, 2048, 1, 3113]
    - [411, 32.72]
  - - [512, 2048, 1, 3137]
    - [411, 32.724]
  - - [512, 2048, 1, 3165]
    - [411, 32.769]
  - - [512, 2048, 1, 3166]
    - [411, 32.657]
  - - [512, 2048, 1, 3194]
    - [411, 32.773]
  - - [512, 2048, 1, 3219]
    - [411, 32.757]
  - - [512, 2048, 1, 3222]
    - [411, 32.647]
  - - [512, 2048, 1, 3234]
    - [411, 32.809]
  - - [512, 2048, 1, 3237]
    - [411, 32.72]
  - - [512, 2048, 1, 3242]
    - [411, 32.85]
  - - [512, 2048, 1, 3246]
    - [411, 32.672]
  - - [512, 2048, 1, 3249]
    - [411, 32.791]
  - - [512, 2048, 1, 3251]
    - [411, 32.722]
  - - [512, 2048, 1, 3257]
    - [411, 32.812]
  - - [512, 2048, 1, 3262]
    - [412, 32.655]
  - - [512, 2048, 1, 3268]
    - [411, 32.715]
  - - [512, 2048, 1, 3282]
    - [411, 32.776]
  - - [512, 2048, 1, 3286]
    - [411, 32.738]
  - - [512, 2048, 1, 3287]
    - [413, 32.816]
  - - [512, 2048, 1, 3293]
    - [411, 32.69]
  - - [512, 2048, 1, 3297]
    - [411, 32.778]
  - - [512, 2048, 1, 3307]
    - [411, 32.78]
  - - [512, 2048, 1, 3314]
    - [411, 32.781]
  - - [512, 2048, 1, 3315]
    - [411, 32.781]
  - - [512, 2048, 1, 3319]
    - [411, 32.665]
  - - [512, 2048, 1, 3322]
    - [414, 32.86]
  - - [512, 2048, 1, 3323]
    - [411, 32.733]
  - - [512, 2048, 1, 3324]
    - [411, 32.714]
  - - [512, 2048, 1, 3325]
    - [412, 32.763]
  - - [512, 2048, 1, 3327]
    - [411, 32.744]
  - - [512, 2048, 1, 3329]
    - [411, 32.734]
  - - [512, 2048, 1, 3332]
    - [411, 32.783]
  - - [512, 2048, 1, 3336]
    - [411, 32.784]
  - - [512, 2048, 1, 3339]
    - [411, 32.842]
  - - [512, 2048, 1, 3342]
    - [411, 32.833]
  - - [512, 2048, 1, 3344]
    - [414, 32.862]
  - - [512, 2048, 1, 3358]
    - [411, 32.796]
  - - [512, 2048, 1, 3360]
    - [412, 32.797]
  - - [512, 2048, 1, 3364]
    - [411, 32.73]
  - - [512, 2048, 1, 3365]
    - [411, 32.826]
  - - [512, 2048, 1, 3369]
    - [411, 32.769]
  - - [512, 2048, 1, 3371]
    - [411, 32.77]
  - - [512, 2048, 1, 3374]
    - [411, 32.732]
  - - [512, 2048, 1, 3376]
    - [411, 32.828]
  - - [512, 2048, 1, 3377]
    - [414, 32.876]
  - - [512, 2048, 1, 3378]
    - [411, 32.885]
  - - [512, 2048, 1, 3381]
    - [411, 32.761]
  - - [512, 2048, 1, 3382]
    - [411, 32.781]
  - - [512, 2048, 1, 3383]
    - [411, 32.79]
  - - [512, 2048, 1, 3384]
    - [411, 32.838]
  - - [512, 2048, 1, 3385]
    - [411, 32.81]
  - - [512, 2048, 1, 3386]
    - [411, 32.695]
  - - [512, 2048, 1, 3388]
    - [411, 32.839]
  - - [512, 2048, 1, 3390]
    - [411, 32.801]
  - - [512, 2048, 1, 3391]
    - [411, 32.82]
  - - [512, 2048, 1, 3396]
    - [411, 32.773]
  - - [512, 2048, 1, 3399]
    - [412, 32.773]
  - - [512, 2048, 1, 3402]
    - [411, 32.793]
  - - [512, 2048, 1, 3410]
    - [411, 32.765]
  - - [512, 2048, 1, 3412]
    - [411, 32.775]
  - - [512, 2048, 1, 3414]
    - [411, 32.757]
  - - [512, 2048, 1, 3415]
    - [411, 32.757]
  - - [512, 2048, 1, 3418]
    - [411, 32.738]
  - - [512, 2048, 1, 3420]
    - [411, 32.786]
  - - [512, 2048, 1, 3422]
    - [412, 32.767]
  - - [512, 2048, 1, 3425]
    - [411, 32.796]
  - - [512, 2048, 1, 3426]
    - [411, 32.824]
  - - [512, 2048, 1, 3428]
    - [411, 32.796]
  - - [512, 2048, 1, 3430]
    - [411, 32.759]
  - - [512, 2048, 1, 3431]
    - [411, 32.787]
  - - [512, 2048, 1, 3432]
    - [413, 32.863]
  - - [512, 2048, 1, 3438]
    - [411, 32.816]
  - - [512, 2048, 1, 3439]
    - [412, 32.788]
  - - [512, 2048, 1, 3440]
    - [412, 32.798]
  - - [512, 2048, 1, 3443]
    - [411, 32.723]
  - - [512, 2048, 1, 3445]
    - [411, 32.864]
  - - [512, 2048, 1, 3447]
    - [411, 32.78]
  - - [512, 2048, 1, 3448]
    - [411, 32.808]
  - - [512, 2048, 1, 3450]
    - [411, 32.78]
  - - [512, 2048, 1, 3451]
    - [411, 32.753]
  - - [512, 2048, 1, 3452]
    - [411, 32.865]
  - - [512, 2048, 1, 3453]
    - [411, 32.809]
  - - [512, 2048, 1, 3455]
    - [411, 32.744]
  - - [512, 2048, 1, 3456]
    - [411, 32.941]
  - - [512, 2048, 1, 3457]
    - [411, 32.866]
  - - [512, 2048, 1, 3458]
    - [412, 32.791]
  - - [512, 2048, 1, 3459]
    - [411, 32.866]
  - - [512, 2048, 1, 3460]
    - [411, 32.847]
  - - [512, 2048, 1, 3461]
    - [411, 32.838]
  - - [512, 2048, 1, 3462]
    - [412, 32.838]
  - - [512, 2048, 1, 3466]
    - [411, 32.848]
  - - [512, 2048, 1, 3467]
    - [412, 32.727]
  - - [512, 2048, 1, 3468]
    - [411, 32.858]
  - - [512, 2048, 1, 3470]
    - [411, 32.83]
  - - [512, 2048, 1, 3471]
    - [411, 32.7]
  - - [512, 2048, 1, 3472]
    - [411, 32.858]
  - - [512, 2048, 1, 3475]
    - [411, 32.775]
  - - [512, 2048, 1, 3476]
    - [411, 32.793]
  - - [512, 2048, 1, 3477]
    - [411, 32.84]
  - - [512, 2048, 1, 3478]
    - [412, 32.812]
  - - [512, 2048, 1, 3479]
    - [411, 32.822]
  - - [512, 2048, 1, 3480]
    - [411, 32.906]
  - - [512, 2048, 1, 3481]
    - [411, 32.747]
  - - [512, 2048, 1, 3483]
    - [411, 32.831]
  - - [512, 2048, 1, 3484]
    - [411, 32.739]
  - - [512, 2048, 1, 3487]
    - [411, 32.721]
  - - [512, 2048, 1, 3489]
    - [411, 32.74]
  - - [512, 2048, 1, 3490]
    - [411, 32.888]
  - - [512, 2048, 1, 3491]
    - [411, 32.814]
  - - [512, 2048, 1, 3493]
    - [412, 32.795]
  - - [512, 2048, 1, 3494]
    - [411, 32.814]
  - - [512, 2048, 1, 3495]
    - [412, 32.796]
  - - [512, 2048, 1, 3497]
    - [411, 32.842]
  - - [512, 2048, 1, 3498]
    - [412, 32.815]
  - - [512, 2048, 1, 3499]
    - [414, 32.889]
  - - [512, 2048, 1, 3501]
    - [411, 32.861]
  - - [512, 2048, 1, 3503]
    - [411, 32.778]
  - - [512, 2048, 1, 3507]
    - [411, 32.834]
  - - [512, 2048, 1, 3508]
    - [411, 32.761]
  - - [512, 2048, 1, 3509]
    - [412, 32.779]
  - - [512, 2048, 1, 3511]
    - [411, 32.825]
  - - [512, 2048, 1, 3514]
    - [411, 32.844]
  - - [512, 2048, 1, 3515]
    - [411, 32.872]
  - - [512, 2048, 1, 3517]
    - [411, 32.845]
  - - [512, 2048, 1, 3518]
    - [411, 32.808]
  - - [512, 2048, 1, 3519]
    - [411, 32.735]
  - - [512, 2048, 1, 3520]
    - [411, 32.873]
  - - [512, 2048, 1, 3523]
    - [411, 32.79]
  - - [512, 2048, 1, 3528]
    - [411, 32.91]
  - - [512, 2048, 1, 3529]
    - [411, 32.846]
  - - [512, 2048, 1, 3530]
    - [411, 32.755]
  - - [512, 2048, 1, 3532]
    - [413, 32.865]
  - - [512, 2048, 1, 3533]
    - [411, 32.773]
  - - [512, 2048, 1, 3534]
    - [411, 32.819]
  - - [512, 2048, 1, 3538]
    - [411, 32.847]
  - - [512, 2048, 1, 3539]
    - [411, 32.847]
  - - [512, 2048, 1, 3541]
    - [411, 32.82]
  - - [512, 2048, 1, 3547]
    - [411, 32.839]
  - - [512, 2048, 1, 3548]
    - [413, 32.885]
  - - [512, 2048, 1, 3564]
    - [411, 32.841]
  - - [512, 2048, 1, 3575]
    - [411, 32.824]
  - - [512, 2048, 1, 3598]
    - [411, 32.827]
  - - [512, 2048, 1, 3599]
    - [411, 32.827]
  - - [512, 2048, 1, 3608]
    - [411, 32.945]
  - - [512, 2048, 1, 3780]
    - [411, 32.864]
  - - [512, 2048, 1, 3796]
    - [411, 32.823]
  - - [512, 2048, 1, 3822]
    - [411, 32.911]
  - - [512, 2048, 1, 3859]
    - [411, 32.948]
  - - [512, 2048, 1, 3870]
    - [411, 32.915]
  - - [512, 2048, 1, 3876]
    - [411, 32.933]
  - - [512, 2048, 1, 3906]
    - [412, 32.977]
  - - [512, 2048, 1, 3910]
    - [411, 33.002]
  - - [512, 2048, 1, 3925]
    - [411, 32.953]
  - - [512, 2048, 1, 3942]
    - [411, 32.938]
  - - [512, 2048, 1, 3944]
    - [411, 33.004]
  - - [512, 2048, 1, 3955]
    - [412, 32.873]
  - - [512, 2048, 1, 3968]
    - [412, 32.998]
  - - [512, 2048, 1, 3969]
    - [411, 32.957]
  - - [512, 2048, 1, 3976]
    - [411, 32.982]
  - - [512, 2048, 1, 3977]
    - [411, 32.99]
  - - [512, 2048, 1, 3978]
    - [411, 32.957]
  - - [512, 2048, 1, 3990]
    - [411, 32.909]
  - - [512, 2048, 1, 3995]
    - [411, 32.983]
  - - [512, 2048, 1, 3996]
    - [411, 32.918]
  - - [512, 2048, 1, 3999]
    - [411, 32.967]
  - - [512, 2048, 1, 4005]
    - [411, 32.894]
  - - [512, 2048, 1, 4012]
    - [411, 32.944]
  - - [512, 2048, 1, 4020]
    - [411, 33.001]
  - - [512, 2048, 1, 4026]
    - [411, 32.945]
  - - [512, 2048, 1, 4030]
    - [411, 32.953]
  - - [512, 2048, 1, 4032]
    - [411, 33.067]
  - - [512, 33708, 1, 3796]
    - [415, 47.416]
  - - [512, 33708, 1, 3822]
    - [416, 47.421]
  - - [512, 33708, 1, 3840]
    - [416, 47.391]
  - - [512, 33708, 1, 3859]
    - [416, 47.382]
  - - [512, 33708, 1, 3870]
    - [415, 47.36]
  - - [512, 33708, 1, 3876]
    - [415, 47.374]
  - - [512, 33708, 1, 3906]
    - [415, 47.363]
  - - [512, 33708, 1, 3910]
    - [416, 47.35]
  - - [512, 33708, 1, 3925]
    - [415, 47.376]
  - - [512, 33708, 1, 3942]
    - [416, 47.359]
  - - [512, 33708, 1, 3944]
    - [416, 47.39]
  - - [512, 33708, 1, 3955]
    - [416, 47.374]
  - - [512, 33708, 1, 3969]
    - [416, 47.404]
  - - [512, 33708, 1, 3976]
    - [415, 47.398]
  - - [512, 33708, 1, 3977]
    - [415, 47.35]
  - - [512, 33708, 1, 3978]
    - [415, 47.398]
  - - [512, 33708, 1, 3990]
    - [416, 47.41]
  - - [512, 33708, 1, 3995]
    - [417, 47.454]
  - - [512, 33708, 1, 3996]
    - [415, 47.34]
  - - [512, 33708, 1, 3999]
    - [416, 47.362]
  - - [512, 33708, 1, 4005]
    - [415, 47.382]
  - - [512, 33708, 1, 4012]
    - [416, 47.346]
  - - [512, 33708, 1, 4020]
    - [415, 47.345]
  - - [512, 33708, 1, 4026]
    - [415, 47.336]
  - - [512, 33708, 1, 4032]
    - [415, 47.358]
  - - [2048, 512, 1, 2790]
    - [411, 32.555]
  - - [2048, 512, 1, 2864]
    - [411, 32.584]
  - - [2048, 512, 1, 3092]
    - [411, 32.685]
  - - [2048, 512, 1, 3113]
    - [411, 32.823]
  - - [2048, 512, 1, 3137]
    - [411, 32.703]
  - - [2048, 512, 1, 3165]
    - [411, 32.677]
  - - [2048, 512, 1, 3166]
    - [411, 32.576]
  - - [2048, 512, 1, 3194]
    - [411, 32.703]
  - - [2048, 512, 1, 3219]
    - [411, 32.737]
  - - [2048, 512, 1, 3222]
    - [411, 32.788]
  - - [2048, 512, 1, 3234]
    - [411, 32.709]
  - - [2048, 512, 1, 3237]
    - [411, 32.73]
  - - [2048, 512, 1, 3242]
    - [411, 32.8]
  - - [2048, 512, 1, 3246]
    - [411, 32.702]
  - - [2048, 512, 1, 3249]
    - [411, 32.811]
  - - [2048, 512, 1, 3251]
    - [411, 32.752]
  - - [2048, 512, 1, 3257]
    - [411, 32.753]
  - - [2048, 512, 1, 3262]
    - [411, 32.675]
  - - [2048, 512, 1, 3268]
    - [411, 32.735]
  - - [2048, 512, 1, 3282]
    - [411, 32.776]
  - - [2048, 512, 1, 3286]
    - [411, 32.738]
  - - [2048, 512, 1, 3287]
    - [411, 32.747]
  - - [2048, 512, 1, 3293]
    - [411, 32.719]
  - - [2048, 512, 1, 3297]
    - [411, 32.71]
  - - [2048, 512, 1, 3307]
    - [411, 32.711]
  - - [2048, 512, 1, 3314]
    - [411, 32.732]
  - - [2048, 512, 1, 3315]
    - [411, 32.713]
  - - [2048, 512, 1, 3319]
    - [411, 32.781]
  - - [2048, 512, 1, 3322]
    - [411, 32.87]
  - - [2048, 512, 1, 3323]
    - [411, 32.695]
  - - [2048, 512, 1, 3324]
    - [411, 32.831]
  - - [2048, 512, 1, 3325]
    - [411, 32.773]
  - - [2048, 512, 1, 3327]
    - [411, 32.783]
  - - [2048, 512, 1, 3329]
    - [411, 32.628]
  - - [2048, 512, 1, 3332]
    - [411, 32.774]
  - - [2048, 512, 1, 3336]
    - [411, 32.9]
  - - [2048, 512, 1, 3339]
    - [411, 32.688]
  - - [2048, 512, 1, 3342]
    - [411, 32.659]
  - - [2048, 512, 1, 3344]
    - [411, 32.843]
  - - [2048, 512, 1, 3358]
    - [411, 32.854]
  - - [2048, 512, 1, 3360]
    - [411, 32.73]
  - - [2048, 512, 1, 3364]
    - [411, 32.807]
  - - [2048, 512, 1, 3365]
    - [411, 32.778]
  - - [2048, 512, 1, 3369]
    - [418, 32.702]
  - - [2048, 512, 1, 3371]
    - [411, 32.798]
  - - [2048, 512, 1, 3374]
    - [411, 32.732]
  - - [2048, 512, 1, 3376]
    - [411, 32.866]
  - - [2048, 512, 1, 3377]
    - [411, 32.78]
  - - [2048, 512, 1, 3378]
    - [411, 32.876]
  - - [2048, 512, 1, 3381]
    - [411, 32.742]
  - - [2048, 512, 1, 3382]
    - [411, 32.8]
  - - [2048, 512, 1, 3383]
    - [411, 32.857]
  - - [2048, 512, 1, 3384]
    - [411, 32.81]
  - - [2048, 512, 1, 3385]
    - [411, 32.714]
  - - [2048, 512, 1, 3386]
    - [413, 32.829]
  - - [2048, 512, 1, 3388]
    - [411, 32.791]
  - - [2048, 512, 1, 3390]
    - [411, 32.801]
  - - [2048, 512, 1, 3391]
    - [411, 32.849]
  - - [2048, 512, 1, 3396]
    - [411, 32.782]
  - - [2048, 512, 1, 3399]
    - [411, 32.716]
  - - [2048, 512, 1, 3402]
    - [411, 32.86]
  - - [2048, 512, 1, 3410]
    - [411, 32.813]
  - - [2048, 512, 1, 3412]
    - [411, 32.785]
  - - [2048, 512, 1, 3414]
    - [411, 32.832]
  - - [2048, 512, 1, 3415]
    - [411, 32.757]
  - - [2048, 512, 1, 3418]
    - [411, 32.814]
  - - [2048, 512, 1, 3420]
    - [411, 32.767]
  - - [2048, 512, 1, 3422]
    - [411, 32.824]
  - - [2048, 512, 1, 3425]
    - [411, 32.824]
  - - [2048, 512, 1, 3426]
    - [413, 32.806]
  - - [2048, 512, 1, 3428]
    - [411, 32.787]
  - - [2048, 512, 1, 3430]
    - [411, 32.759]
  - - [2048, 512, 1, 3431]
    - [411, 32.769]
  - - [2048, 512, 1, 3432]
    - [411, 32.882]
  - - [2048, 512, 1, 3438]
    - [411, 32.883]
  - - [2048, 512, 1, 3439]
    - [411, 32.807]
  - - [2048, 512, 1, 3440]
    - [413, 32.845]
  - - [2048, 512, 1, 3443]
    - [411, 32.845]
  - - [2048, 512, 1, 3445]
    - [411, 32.836]
  - - [2048, 512, 1, 3447]
    - [418, 32.465]
  - - [2048, 512, 1, 3448]
    - [411, 32.808]
  - - [2048, 512, 1, 3450]
    - [411, 32.893]
  - - [2048, 512, 1, 3451]
    - [413, 32.79]
  - - [2048, 512, 1, 3453]
    - [413, 32.8]
  - - [2048, 512, 1, 3455]
    - [411, 32.762]
  - - [2048, 512, 1, 3456]
    - [411, 32.875]
  - - [2048, 512, 1, 3457]
    - [411, 32.875]
  - - [2048, 512, 1, 3458]
    - [411, 32.894]
  - - [2048, 512, 1, 3459]
    - [411, 32.791]
  - - [2048, 512, 1, 3460]
    - [411, 32.819]
  - - [2048, 512, 1, 3461]
    - [411, 32.754]
  - - [2048, 512, 1, 3462]
    - [411, 32.829]
  - - [2048, 512, 1, 3466]
    - [411, 32.942]
  - - [2048, 512, 1, 3467]
    - [411, 32.801]
  - - [2048, 512, 1, 3468]
    - [411, 32.82]
  - - [2048, 512, 1, 3470]
    - [411, 32.848]
  - - [2048, 512, 1, 3471]
    - [411, 32.626]
  - - [2048, 512, 1, 3476]
    - [411, 32.775]
  - - [2048, 512, 1, 3477]
    - [411, 32.84]
  - - [2048, 512, 1, 3478]
    - [411, 32.877]
  - - [2048, 512, 1, 3479]
    - [411, 32.812]
  - - [2048, 512, 1, 3480]
    - [411, 32.859]
  - - [2048, 512, 1, 3481]
    - [411, 32.674]
  - - [2048, 512, 1, 3483]
    - [411, 32.785]
  - - [2048, 512, 1, 3484]
    - [411, 32.822]
  - - [2048, 512, 1, 3487]
    - [411, 32.813]
  - - [2048, 512, 1, 3489]
    - [411, 32.795]
  - - [2048, 512, 1, 3490]
    - [411, 32.823]
  - - [2048, 512, 1, 3491]
    - [411, 32.832]
  - - [2048, 512, 1, 3493]
    - [413, 32.851]
  - - [2048, 512, 1, 3494]
    - [411, 32.805]
  - - [2048, 512, 1, 3495]
    - [411, 32.842]
  - - [2048, 512, 1, 3497]
    - [411, 32.889]
  - - [2048, 512, 1, 3498]
    - [411, 32.769]
  - - [2048, 512, 1, 3499]
    - [411, 32.824]
  - - [2048, 512, 1, 3501]
    - [411, 32.833]
  - - [2048, 512, 1, 3503]
    - [411, 32.797]
  - - [2048, 512, 1, 3507]
    - [411, 32.899]
  - - [2048, 512, 1, 3508]
    - [411, 32.752]
  - - [2048, 512, 1, 3509]
    - [411, 32.862]
  - - [2048, 512, 1, 3511]
    - [411, 32.826]
  - - [2048, 512, 1, 3514]
    - [411, 32.807]
  - - [2048, 512, 1, 3515]
    - [411, 32.771]
  - - [2048, 512, 1, 3517]
    - [411, 32.835]
  - - [2048, 512, 1, 3518]
    - [411, 32.762]
  - - [2048, 512, 1, 3519]
    - [411, 32.937]
  - - [2048, 512, 1, 3520]
    - [411, 32.799]
  - - [2048, 512, 1, 3523]
    - [411, 32.882]
  - - [2048, 512, 1, 3528]
    - [411, 32.938]
  - - [2048, 512, 1, 3529]
    - [411, 32.846]
  - - [2048, 512, 1, 3530]
    - [411, 32.892]
  - - [2048, 512, 1, 3532]
    - [411, 32.846]
  - - [2048, 512, 1, 3533]
    - [411, 32.737]
  - - [2048, 512, 1, 3534]
    - [411, 32.893]
  - - [2048, 512, 1, 3538]
    - [411, 32.865]
  - - [2048, 512, 1, 3539]
    - [411, 32.93]
  - - [2048, 512, 1, 3541]
    - [411, 32.802]
  - - [2048, 512, 1, 3547]
    - [411, 32.803]
  - - [2048, 512, 1, 3548]
    - [411, 32.793]
  - - [2048, 512, 1, 3552]
    - [411, 32.922]
  - - [2048, 512, 1, 3564]
    - [413, 32.814]
  - - [2048, 512, 1, 3575]
    - [411, 32.869]
  - - [2048, 512, 1, 3598]
    - [411, 32.809]
  - - [2048, 512, 1, 3599]
    - [411, 32.845]
  - - [2048, 512, 1, 3608]
    - [411, 32.945]
  - - [2048, 512, 1, 3780]
    - [411, 32.933]
  - - [2048, 512, 1, 3796]
    - [411, 32.857]
  - - [2048, 512, 1, 3822]
    - [411, 32.809]
  - - [2048, 512, 1, 3840]
    - [411, 32.964]
  - - [2048, 512, 1, 3859]
    - [411, 32.923]
  - - [2048, 512, 1, 3870]
    - [411, 32.974]
  - - [2048, 512, 1, 3876]
    - [411, 32.924]
  - - [2048, 512, 1, 3906]
    - [411, 32.893]
  - - [2048, 512, 1, 3910]
    - [411, 32.952]
  - - [2048, 512, 1, 3925]
    - [411, 32.928]
  - - [2048, 512, 1, 3942]
    - [413, 32.831]
  - - [2048, 512, 1, 3944]
    - [411, 32.938]
  - - [2048, 512, 1, 3955]
    - [413, 32.906]
  - - [2048, 512, 1, 3968]
    - [411, 33.056]
  - - [2048, 512, 1, 3969]
    - [411, 32.924]
  - - [2048, 512, 1, 3976]
    - [413, 33.072]
  - - [2048, 512, 1, 3977]
    - [411, 33.006]
  - - [2048, 512, 1, 3978]
    - [411, 32.9]
  - - [2048, 512, 1, 3990]
    - [411, 32.926]
  - - [2048, 512, 1, 3995]
    - [411, 33.008]
  - - [2048, 512, 1, 3996]
    - [411, 32.983]
  - - [2048, 512, 1, 3999]
    - [411, 32.992]
  - - [2048, 512, 1, 4005]
    - [411, 33.074]
  - - [2048, 512, 1, 4012]
    - [411, 32.992]
  - - [2048, 512, 1, 4020]
    - [411, 33.017]
  - - [2048, 512, 1, 4026]
    - [411, 32.977]
  - - [2048, 512, 1, 4030]
    - [411, 33.051]
  - - [2048, 512, 1, 4032]
    - [411, 33.01]
  - - [512, 512, 1, 3780]
    - [419, 24.082]
  - - [512, 512, 1, 3796]
    - [420, 24.091]
  - - [512, 512, 1, 3822]
    - [419, 24.786]
  - - [512, 512, 1, 3840]
    - [419, 23.134]
  - - [512, 512, 1, 3859]
    - [419, 23.801]
  - - [512, 512, 1, 3870]
    - [419, 23.658]
  - - [512, 512, 1, 3876]
    - [419, 23.317]
  - - [512, 512, 1, 3906]
    - [420, 23.346]
  - - [512, 512, 1, 3910]
    - [419, 23.763]
  - - [512, 512, 1, 3925]
    - [419, 24.37]
  - - [512, 512, 1, 3927]
    - [419, 23.271]
  - - [512, 512, 1, 3942]
    - [419, 24.403]
  - - [512, 512, 1, 3944]
    - [421, 23.455]
  - - [512, 512, 1, 3955]
    - [422, 23.537]
  - - [512, 512, 1, 3968]
    - [550, 36.213]
  - - [512, 512, 1, 3969]
    - [419, 23.271]
  - - [512, 512, 1, 3976]
    - [419, 23.833]
  - - [512, 512, 1, 3977]
    - [419, 24.86]
  - - [512, 512, 1, 3978]
    - [419, 25.017]
  - - [512, 512, 1, 3990]
    - [420, 24.073]
  - - [512, 512, 1, 3995]
    - [419, 23.707]
  - - [512, 512, 1, 3996]
    - [423, 23.33]
  - - [512, 512, 1, 3999]
    - [419, 25.017]
  - - [512, 512, 1, 4005]
    - [551, 36.272]
  - - [512, 512, 1, 4012]
    - [420, 24.066]
  - - [512, 512, 1, 4020]
    - [420, 24.096]
  - - [512, 512, 1, 4026]
    - [419, 23.588]
  - - [512, 512, 1, 4030]
    - [419, 24.636]
  - - [512, 512, 1, 4032]
    - [419, 25.223]
  - - [512, 512, 1, 4050]
    - [424, 23.27]
  - - [512, 512, 1, 4059]
    - [420, 23.305]
  - - [64, 102, 312, 102]
    - [425, 17.759]
  - - [64, 512, 16, 512]
    - [426, 11.056]
  - - [64, 512, 96, 512]
    - [427, 19.677]
  - - [1024, 3072, 1, 2048]
    - [428, 14.479]
  - - [1024, 3072, 1, 3072]
    - [429, 14.254]
  - - [1024, 30522, 1, 20]
    - [430, 11.935]
  - - [1024, 30522, 1, 80]
    - [431, 21.409]
  - - [1024, 30522, 1, 120]
    - [432, 21.773]
  - - [1024, 2, 1, 1]
    - [433, 0.001]
  - - [1024, 2, 1, 2048]
    - [434, 0.387]
  - - [1024, 1024, 1, 3840]
    - [435, 44.558]
  - - [1024, 1024, 1, 3968]
    - [436, 44.657]
  - - [1024, 1024, 1, 7200]
    - [435, 45.827]
  - - [1024, 1024, 1, 8160]
    - [435, 45.956]
  - - [1024, 1024, 1, 9520]
    - [435, 45.997]
  - - [1024, 1024, 1, 10200]
    - [437, 46.075]
  - - [1024, 4096, 1, 3840]
    - [437, 59.89]
  - - [1024, 4096, 1, 3968]
    - [435, 59.982]
  - - [1024, 4096, 1, 7200]
    - [436, 61.179]
  - - [1024, 4096, 1, 8160]
    - [437, 61.235]
  - - [1024, 4096, 1, 9520]
    - [435, 61.405]
  - - [1024, 4096, 1, 10200]
    - [435, 61.489]
  - - [1024, 42720, 1, 3968]
    - [438, 90.91]
  - - [1024, 42720, 1, 7200]
    - [438, 92.196]
  - - [1024, 42720, 1, 9520]
    - [547, 94.678]
  - - [4096, 1024, 1, 3840]
    - [549, 89.207]
  - - [4096, 1024, 1, 3968]
    - [548, 89.205]
  - - [4096, 1024, 1, 7200]
    - [435, 60.946]
  - - [4096, 1024, 1, 8160]
    - [437, 61.149]
  - - [4096, 1024, 1, 9520]
    - [436, 61.205]
  - - [4096, 1024, 1, 10200]
    - [436, 61.189]
  - - [17, 64, 1, 15]
    - [439, 0.005]
  - - [17, 64, 1, 17]
    - [440, 0.01]
  - - [30, 64, 1, 30]
    - [441, 0.028]
  - - [30, 64, 1, 31]
    - [442, 0.028]
  - - [31, 64, 1, 31]
    - [443, 0.028]
  - - [64, 17, 1, 15]
    - [443, 0.01]
  - - [64, 17, 1, 17]
    - [440, 0.01]
  - - [64, 30, 1, 30]
    - [443, 0.028]
  - - [64, 30, 1, 31]
    - [440, 0.025]
  - - [64, 31, 1, 31]
    - [444, 0.028]
  - - [14, 64, 1, 14]
    - [445, 0.005]
  - - [15, 64, 1, 14]
    - [439, 0.008]
  - - [15, 64, 1, 15]
    - [439, 0.008]
  - - [64, 14, 1, 14]
    - [445, 0.008]
  - - [64, 15, 1, 14]
    - [439, 0.008]
  - - [64, 15, 1, 15]
    - [439, 0.008]
  - - [5760, 5760, 1, 5760]
    - [590, 96.589]
  - - [7744, 7744, 1, 7744]
    - [446, 65.393]
  - - [384, 384, 1, 384]
    - [568, 10.87]
  - - [768, 768, 1, 384]
    - [586, 27.468]
  - - [1152, 1152, 1, 384]
    - [574, 40.049]
  - - [1536, 1536, 1, 384]
    - [583, 51.333]
  - - [1920, 1920, 1, 384]
    - [583, 63.538]
  - - [2304, 2304, 1, 384]
    - [585, 68.09]
  - - [2688, 2688, 1, 384]
    - [583, 72.664]
  - - [3072, 3072, 1, 384]
    - [587, 74.564]
  - - [3456, 3456, 1, 384]
    - [583, 77.958]
  - - [3840, 3840, 1, 384]
    - [583, 80.34]
  - - [4224, 4224, 1, 384]
    - [583, 81.645]
  - - [4608, 4608, 1, 384]
    - [588, 83.669]
  - - [4992, 4992, 1, 384]
    - [588, 84.798]
  - - [5376, 5376, 1, 384]
    - [588, 85.671]
  - - [5760, 5760, 1, 384]
    - [588, 87.044]
  - - [6144, 6144, 1, 384]
    - [587, 86.135]
  - - [6528, 6528, 1, 384]
    - [588, 87.954]
  - - [6912, 6912, 1, 384]
    - [589, 88.337]
  - - [7296, 7296, 1, 384]
    - [589, 88.642]
  - - [7680, 7680, 1, 384]
    - [588, 89.53]
  - - [384, 192, 1, 384]
    - [570, 5.718]
  - - [768, 384, 1, 384]
    - [568, 18.813]
  - - [1152, 576, 1, 384]
    - [576, 30.248]
  - - [1536, 768, 1, 384]
    - [574, 37.516]
  - - [1920, 960, 1, 384]
    - [574, 52.64]
  - - [2304, 1152, 1, 384]
    - [583, 55.78]
  - - [2688, 1344, 1, 384]
    - [584, 62.118]
  - - [3072, 1536, 1, 384]
    - [583, 66.411]
  - - [3456, 1728, 1, 384]
    - [583, 69.081]
  - - [3840, 1920, 1, 384]
    - [583, 72.99]
  - - [4224, 2112, 1, 384]
    - [583, 74.24]
  - - [4608, 2304, 1, 384]
    - [583, 77.325]
  - - [4992, 2496, 1, 384]
    - [583, 79.193]
  - - [5376, 2688, 1, 384]
    - [583, 80.826]
  - - [5760, 2880, 1, 384]
    - [583, 80.461]
  - - [6144, 3072, 1, 384]
    - [587, 81.77]
  - - [6528, 3264, 1, 384]
    - [584, 81.8]
  - - [6912, 3456, 1, 384]
    - [583, 83.86]
  - - [7296, 3648, 1, 384]
    - [589, 84.309]
  - - [7680, 3840, 1, 384]
    - [588, 86.457]
  - - [384, 768, 1, 384]
    - [569, 18.703]
  - - [768, 1536, 1, 384]
    - [574, 36.388]
  - - [1152, 2304, 1, 384]
    - [574, 52.122]
  - - [1536, 3072, 1, 384]
    - [578, 59.99]
  - - [1920, 3840, 1, 384]
    - [574, 63.247]
  - - [2304, 4608, 1, 384]
    - [578, 67.468]
  - - [2688, 5376, 1, 384]
    - [587, 71.604]
  - - [3072, 6144, 1, 384]
    - [589, 74.258]
  - - [3456, 6912, 1, 384]
    - [589, 78.254]
  - - [3840, 7680, 1, 384]
    - [588, 80.548]
  - - [4224, 8448, 1, 384]
    - [588, 81.754]
  - - [4608, 9216, 1, 384]
    - [589, 83.425]
  - - [4992, 9984, 1, 384]
    - [587, 84.003]
  - - [5376, 10752, 1, 384]
    - [588, 84.753]
  - - [5760, 11520, 1, 384]
    - [589, 86.138]
  - - [6144, 12288, 1, 384]
    - [587, 86.513]
  - - [6528, 13056, 1, 384]
    - [587, 86.972]
  - - [6912, 13824, 1, 384]
    - [588, 87.352]
  - - [7296, 14592, 1, 384]
    - [589, 88.444]
  - - [7680, 15360, 1, 384]
    - [589, 88.652]
  - - [1024, 2, 1, 32]
    - [455, 0.03]
  - - [1024, 1024, 1, 32]
    - [456, 11.202]
  - - [1024, 2, 1, 4]
    - [457, 0.005]
  - - [64, 128, 512, 128]
    - [458, 30.19]
  - - [64, 512, 64, 512]
    - [459, 45.527]
  - - [1024, 1024, 1, 1600]
    - [460, 40.067]
  - - [1024, 256, 1, 1024]
    - [461, 26.115]
  - - [1024, 256, 1, 10496]
    - [462, 29.263]
  - - [1024, 256, 1, 11520]
    - [463, 30.905]
  - - [1024, 256, 1, 12032]
    - [464, 29.413]
  - - [1024, 256, 1, 1280]
    - [465, 27.009]
  - - [1024, 256, 1, 13568]
    - [466, 28.901]
  - - [1024, 256, 1, 14336]
    - [467, 29.582]
  - - [1024, 256, 1, 14848]
    - [468, 28.522]
  - - [1024, 256, 1, 15104]
    - [469, 28.914]
  - - [1024, 256, 1, 15872]
    - [470, 28.749]
  - - [1024, 256, 1, 16128]
    - [462, 29.547]
  - - [1024, 256, 1, 17152]
    - [471, 31.632]
  - - [1024, 256, 1, 17408]
    - [472, 29.675]
  - - [1024, 256, 1, 18944]
    - [462, 29.544]
  - - [1024, 256, 1, 19712]
    - [473, 29.021]
  - - [1024, 256, 1, 19968]
    - [473, 29.079]
  - - [1024, 256, 1, 21248]
    - [474, 28.724]
  - - [1024, 256, 1, 21504]
    - [475, 29.634]
  - - [1024, 256, 1, 22016]
    - [462, 29.719]
  - - [1024, 256, 1, 2304]
    - [476, 26.903]
  - - [1024, 256, 1, 2816]
    - [462, 27.382]
  - - [1024, 256, 1, 28672]
    - [477, 29.704]
  - - [1024, 256, 1, 3072]
    - [471, 28.19]
  - - [1024, 256, 1, 3328]
    - [461, 28.613]
  - - [1024, 256, 1, 3584]
    - [478, 28.817]
  - - [1024, 256, 1, 4096]
    - [475, 28.284]
  - - [1024, 256, 1, 4352]
    - [479, 29.633]
  - - [1024, 256, 1, 4608]
    - [477, 28.399]
  - - [1024, 256, 1, 5120]
    - [479, 29.256]
  - - [1024, 256, 1, 5376]
    - [472, 29.896]
  - - [1024, 256, 1, 5632]
    - [480, 29.542]
  - - [1024, 256, 1, 6144]
    - [477, 29.072]
  - - [1024, 256, 1, 6400]
    - [472, 29.495]
  - - [1024, 256, 1, 7680]
    - [480, 30.816]
  - - [1024, 256, 1, 7936]
    - [461, 29.855]
  - - [1024, 256, 1, 8192]
    - [464, 29.093]
  - - [1024, 256, 1, 8448]
    - [479, 29.375]
  - - [1024, 256, 1, 9728]
    - [471, 30.999]
  - - [1024, 256, 1, 9984]
    - [481, 29.687]
  - - [2048, 2048, 1, 1024]
    - [482, 42.875]
  - - [2048, 256, 1, 1024]
    - [483, 28.52]
  - - [256, 10240, 1, 8976]
    - [484, 53.904]
  - - [256, 10496, 1, 8976]
    - [485, 57.361]
  - - [256, 11008, 1, 8976]
    - [484, 59.017]
  - - [256, 11264, 1, 8976]
    - [486, 49.302]
  - - [256, 11520, 1, 8976]
    - [487, 54.233]
  - - [256, 11776, 1, 8976]
    - [488, 51.25]
  - - [256, 12544, 1, 8976]
    - [489, 54.688]
  - - [256, 12800, 1, 8976]
    - [490, 55.578]
  - - [256, 1280, 1, 8976]
    - [491, 34.562]
  - - [256, 13312, 1, 8976]
    - [492, 57.39]
  - - [256, 13568, 1, 8976]
    - [493, 59.049]
  - - [256, 14336, 1, 8976]
    - [494, 61.666]
  - - [256, 14848, 1, 8976]
    - [495, 64.221]
  - - [256, 15104, 1, 8976]
    - [496, 65.379]
  - - [256, 15872, 1, 8976]
    - [497, 49.152]
  - - [256, 16128, 1, 8976]
    - [498, 52.11]
  - - [256, 17152, 1, 8976]
    - [499, 56.333]
  - - [256, 17408, 1, 8976]
    - [499, 53.535]
  - - [256, 18688, 1, 8976]
    - [484, 57.331]
  - - [256, 19968, 1, 8976]
    - [500, 57.743]
  - - [256, 20480, 1, 8976]
    - [501, 58.994]
  - - [256, 20992, 1, 8976]
    - [502, 60.412]
  - - [256, 21248, 1, 8976]
    - [503, 61.697]
  - - [256, 22016, 1, 8976]
    - [504, 63.132]
  - - [256, 2560, 1, 8976]
    - [505, 41.166]
  - - [256, 26112, 1, 8976]
    - [499, 59.125]
  - - [256, 2816, 1, 8976]
    - [506, 43.341]
  - - [256, 32512, 1, 8976]
    - [507, 60.2]
  - - [256, 3328, 1, 8976]
    - [508, 50.877]
  - - [256, 33536, 1, 8976]
    - [509, 60.075]
  - - [256, 3584, 1, 8976]
    - [508, 54.233]
  - - [256, 3840, 1, 8976]
    - [510, 55.382]
  - - [256, 4096, 1, 8976]
    - [511, 35.667]
  - - [256, 4352, 1, 8976]
    - [512, 37.878]
  - - [256, 4864, 1, 8976]
    - [513, 47.478]
  - - [256, 5120, 1, 8976]
    - [514, 47.763]
  - - [256, 5632, 1, 8976]
    - [515, 48.809]
  - - [256, 5888, 1, 8976]
    - [493, 51.052]
  - - [256, 6144, 1, 8976]
    - [516, 52.869]
  - - [256, 7168, 1, 8976]
    - [517, 61.304]
  - - [256, 8192, 1, 8976]
    - [518, 45.898]
  - - [256, 8960, 1, 8976]
    - [519, 50.166]
  - - [256, 9728, 1, 8976]
    - [519, 54.354]
  - - [256, 9984, 1, 8976]
    - [520, 55.682]
  - - [3200, 2048, 1, 1024]
    - [546, 72.665]
  - - [4096, 4096, 1, 1024]
    - [521, 48.29]
  - - [512, 2048, 1, 256]
    - [522, 22.286]
  - - [512, 3280, 1, 1600]
    - [523, 46.926]
  - - [512, 3280, 1, 200]
    - [524, 25.668]
  - - [512, 512, 1, 1600]
    - [466, 24.498]
  - - [560, 1024, 1, 1600]
    - [525, 32.047]
  - - [768, 2048, 1, 256]
    - [526, 29.977]
  - - [512, 32, 1, 1600]
    - [527, 0.925]
  - - [100, 2048, 1, 512]
    - [528, 13.356]
  - - [560, 1024, 1, 200]
    - [529, 26.745]
  - - [74, 2048, 1, 512]
    - [529, 10.384]
  - - [1024, 1024, 1, 960]
    - [530, 45.804]
  - - [1024, 64, 1, 960]
    - [531, 5.183]
  - - [1600, 1024, 1, 960]
    - [532, 67.776]
  - - [2048, 2048, 1, 960]
    - [533, 65.22]
  - - [74, 2048, 1, 960]
    - [528, 11.393]
  - - [1024, 3072, 1, 1024]
    - [534, 73.444]
  - - [1024, 3072, 1, 512]
    - [535, 67.567]
  - - [1024, 4096, 1, 2048]
    - [537, 71.447]
  - - [1024, 30528, 1, 2048]
    - [538, 95.183]
  - - [1024, 4096, 1, 4096]
    - [539, 80.959]
  - - [1024, 30528, 1, 4096]
    - [541, 96.334]
  - - [512, 64, 1, 512]
    - [544, 3.326]
  - - [384, 128, 1, 128]
    - [552, 2.25]
  - - [768, 128, 1, 128]
    - [553, 4.79]
  - - [1152, 128, 1, 128]
    - [553, 6.86]
  - - [1536, 128, 1, 128]
    - [553, 8.361]
  - - [1920, 128, 1, 128]
    - [553, 9.868]
  - - [2304, 128, 1, 128]
    - [554, 11.458]
  - - [2688, 128, 1, 128]
    - [555, 12.981]
  - - [3072, 128, 1, 128]
    - [556, 14.53]
  - - [3456, 128, 1, 128]
    - [557, 16.347]
  - - [3840, 128, 1, 128]
    - [556, 17.978]
  - - [4224, 128, 1, 128]
    - [557, 19.43]
  - - [4608, 128, 1, 128]
    - [557, 20.629]
  - - [4992, 128, 1, 128]
    - [555, 22.027]
  - - [5376, 128, 1, 128]
    - [555, 23.165]
  - - [5760, 128, 1, 128]
    - [558, 24.42]
  - - [6144, 128, 1, 128]
    - [557, 25.634]
  - - [6528, 128, 1, 128]
    - [558, 26.992]
  - - [6912, 128, 1, 128]
    - [559, 28.137]
  - - [7296, 128, 1, 128]
    - [556, 29.832]
  - - [7680, 128, 1, 128]
    - [559, 31.125]
  - - [8064, 128, 1, 128]
    - [557, 24.853]
  - - [8448, 128, 1, 128]
    - [555, 25.316]
  - - [8832, 128, 1, 128]
    - [557, 25.795]
  - - [9216, 128, 1, 128]
    - [557, 26.454]
  - - [9600, 128, 1, 128]
    - [555, 27.217]
  - - [9984, 128, 1, 128]
    - [557, 28.132]
  - - [10368, 128, 1, 128]
    - [557, 29.08]
  - - [10752, 128, 1, 128]
    - [556, 30.483]
  - - [11136, 128, 1, 128]
    - [555, 30.221]
  - - [11520, 128, 1, 128]
    - [555, 31.542]
  - - [11904, 128, 1, 128]
    - [557, 31.789]
  - - [12288, 128, 1, 128]
    - [560, 33.152]
  - - [12672, 128, 1, 128]
    - [561, 33.166]
  - - [13056, 128, 1, 128]
    - [555, 33.458]
  - - [13440, 128, 1, 128]
    - [562, 34.538]
  - - [13824, 128, 1, 128]
    - [555, 35.229]
  - - [14208, 128, 1, 128]
    - [563, 35.811]
  - - [14592, 128, 1, 128]
    - [563, 36.829]
  - - [14976, 128, 1, 128]
    - [564, 37.49]
  - - [15360, 128, 1, 128]
    - [555, 38.347]
  - - [15744, 128, 1, 128]
    - [565, 35.37]
  - - [16128, 128, 1, 128]
    - [565, 35.581]
  - - [16512, 128, 1, 128]
    - [565, 36.56]
  - - [16896, 128, 1, 128]
    - [566, 36.107]
  - - [17280, 128, 1, 128]
    - [565, 37.582]
  - - [17664, 128, 1, 128]
    - [566, 37.357]
  - - [18048, 128, 1, 128]
    - [567, 37.396]
  - - [18432, 128, 1, 128]
    - [566, 37.309]
  - - [18816, 128, 1, 128]
    - [565, 38.171]
  - - [19200, 128, 1, 128]
    - [567, 38.993]
  - - [19584, 128, 1, 128]
    - [567, 38.871]
  - - [19968, 128, 1, 128]
    - [557, 37.994]
  - - [20352, 128, 1, 128]
    - [566, 39.253]
  - - [20736, 128, 1, 128]
    - [567, 37.888]
  - - [21120, 128, 1, 128]
    - [565, 38.705]
  - - [21504, 128, 1, 128]
    - [565, 39.136]
  - - [21888, 128, 1, 128]
    - [556, 39.214]
  - - [22272, 128, 1, 128]
    - [566, 40.058]
  - - [22656, 128, 1, 128]
    - [566, 40.709]
  - - [23040, 128, 1, 128]
    - [566, 41.118]
  - - [384, 128, 1, 256]
    - [568, 2.95]
  - - [768, 128, 1, 256]
    - [569, 6.423]
  - - [1152, 128, 1, 256]
    - [569, 9.297]
  - - [1536, 128, 1, 256]
    - [568, 11.727]
  - - [1920, 128, 1, 256]
    - [570, 14.131]
  - - [2304, 128, 1, 256]
    - [569, 15.877]
  - - [2688, 128, 1, 256]
    - [570, 17.855]
  - - [3072, 128, 1, 256]
    - [569, 19.291]
  - - [3456, 128, 1, 256]
    - [569, 20.781]
  - - [3840, 128, 1, 256]
    - [569, 22.43]
  - - [4224, 128, 1, 256]
    - [571, 22.333]
  - - [4608, 128, 1, 256]
    - [572, 23.552]
  - - [4992, 128, 1, 256]
    - [573, 24.267]
  - - [5376, 128, 1, 256]
    - [574, 24.884]
  - - [5760, 128, 1, 256]
    - [575, 25.569]
  - - [6144, 128, 1, 256]
    - [576, 26.82]
  - - [6528, 128, 1, 256]
    - [576, 27.836]
  - - [6912, 128, 1, 256]
    - [575, 29.27]
  - - [7296, 128, 1, 256]
    - [574, 30.579]
  - - [7680, 128, 1, 256]
    - [575, 32.748]
  - - [8064, 128, 1, 256]
    - [574, 28.048]
  - - [8448, 128, 1, 256]
    - [577, 29.551]
  - - [8832, 128, 1, 256]
    - [578, 30.093]
  - - [9216, 128, 1, 256]
    - [574, 30.803]
  - - [9600, 128, 1, 256]
    - [574, 31.741]
  - - [9984, 128, 1, 256]
    - [577, 33.159]
  - - [10368, 128, 1, 256]
    - [574, 34.096]
  - - [10752, 128, 1, 256]
    - [574, 34.586]
  - - [11136, 128, 1, 256]
    - [578, 35.297]
  - - [11520, 128, 1, 256]
    - [579, 35.987]
  - - [11904, 128, 1, 256]
    - [574, 37.569]
  - - [12288, 128, 1, 256]
    - [580, 38.451]
  - - [12672, 128, 1, 256]
    - [581, 38.763]
  - - [13056, 128, 1, 256]
    - [577, 39.937]
  - - [13440, 128, 1, 256]
    - [574, 40.506]
  - - [13824, 128, 1, 256]
    - [579, 41.528]
  - - [14208, 128, 1, 256]
    - [582, 42.646]
  - - [14592, 128, 1, 256]
    - [580, 43.235]
  - - [14976, 128, 1, 256]
    - [574, 44.018]
  - - [15360, 128, 1, 256]
    - [580, 45.183]
  - - [15744, 128, 1, 256]
    - [574, 40.686]
  - - [16128, 128, 1, 256]
    - [577, 41.854]
  - - [16512, 128, 1, 256]
    - [578, 42.551]
  - - [16896, 128, 1, 256]
    - [578, 42.969]
  - - [17280, 128, 1, 256]
    - [583, 43.435]
  - - [17664, 128, 1, 256]
    - [577, 43.567]
  - - [18048, 128, 1, 256]
    - [577, 44.724]
  - - [18432, 128, 1, 256]
    - [584, 44.595]
  - - [18816, 128, 1, 256]
    - [577, 45.523]
  - - [19200, 128, 1, 256]
    - [577, 45.701]
  - - [19584, 128, 1, 256]
    - [584, 46.108]
  - - [19968, 128, 1, 256]
    - [584, 46.743]
  - - [20352, 128, 1, 256]
    - [574, 46.721]
  - - [20736, 128, 1, 256]
    - [585, 47.721]
  - - [21120, 128, 1, 256]
    - [585, 48.005]
  - - [21504, 128, 1, 256]
    - [583, 49.151]
  - - [21888, 128, 1, 256]
    - [583, 48.463]
  - - [22272, 128, 1, 256]
    - [585, 49.313]
  - - [22656, 128, 1, 256]
    - [585, 49.893]
  - - [23040, 128, 1, 256]
    - [583, 50.618]
  - - [8064, 8064, 1, 384]
    - [588, 89.619]
  - - [8448, 8448, 1, 384]
    - [589, 89.975]
  - - [8832, 8832, 1, 384]
    - [588, 90.375]
  - - [9216, 9216, 1, 384]
    - [588, 90.431]
  - - [9600, 9600, 1, 384]
    - [588, 90.989]
  - - [9984, 9984, 1, 384]
    - [589, 91.151]
  - - [10368, 10368, 1, 384]
    - [588, 91.233]
  - - [10752, 10752, 1, 384]
    - [589, 91.342]
  - - [11136, 11136, 1, 384]
    - [589, 91.466]
  - - [11520, 11520, 1, 384]
    - [589, 91.667]
  - - [11904, 11904, 1, 384]
    - [588, 91.652]
  - - [12288, 12288, 1, 384]
    - [588, 91.594]
  - - [12672, 12672, 1, 384]
    - [587, 91.934]
  - - [13056, 13056, 1, 384]
    - [588, 91.998]
  - - [13440, 13440, 1, 384]
    - [588, 92.152]
  - - [13824, 13824, 1, 384]
    - [587, 92.267]
  - - [14208, 14208, 1, 384]
    - [587, 92.387]
  - - [14592, 14592, 1, 384]
    - [589, 92.41]
  - - [14976, 14976, 1, 384]
    - [588, 92.389]
  - - [15360, 15360, 1, 384]
    - [589, 92.547]
  - - [15744, 15744, 1, 384]
    - [589, 92.4]
  - - [16128, 16128, 1, 384]
    - [589, 92.539]
  - - [16512, 16512, 1, 384]
    - [589, 92.506]
  - - [16896, 16896, 1, 384]
    - [588, 92.591]
  - - [17280, 17280, 1, 384]
    - [588, 92.698]
  - - [17664, 17664, 1, 384]
    - [588, 92.763]
  - - [18048, 18048, 1, 384]
    - [588, 92.841]
  - - [18432, 18432, 1, 384]
    - [588, 92.777]
  - - [18816, 18816, 1, 384]
    - [587, 92.827]
  - - [19200, 19200, 1, 384]
    - [589, 92.879]
  - - [19584, 19584, 1, 384]
    - [587, 92.941]
  - - [19968, 19968, 1, 384]
    - [589, 92.931]
  - - [20352, 20352, 1, 384]
    - [589, 92.914]
  - - [20736, 20736, 1, 384]
    - [589, 92.937]
  - - [21120, 21120, 1, 384]
    - [589, 92.974]
  - - [21504, 21504, 1, 384]
    - [588, 93.105]
  - - [21888, 21888, 1, 384]
    - [588, 93.136]
  - - [22272, 22272, 1, 384]
    - [589, 92.981]
  - - [22656, 22656, 1, 384]
    - [589, 93.005]
  - - [23040, 23040, 1, 384]
    - [589, 93.087]
  - - [768, 768, 1, 768]
    - [571, 38.249]
  - - [1152, 1152, 1, 1152]
    - [580, 51.098]
  - - [1536, 1536, 1, 1536]
    - [580, 64.866]
  - - [1920, 1920, 1, 1920]
    - [590, 79.901]
  - - [2304, 2304, 1, 2304]
    - [590, 80.625]
  - - [2688, 2688, 1, 2688]
    - [590, 84.232]
  - - [3072, 3072, 1, 3072]
    - [590, 89.255]
  - - [3456, 3456, 1, 3456]
    - [582, 86.689]
  - - [3840, 3840, 1, 3840]
    - [581, 92.602]
  - - [4224, 4224, 1, 4224]
    - [581, 89.852]
  - - [4608, 4608, 1, 4608]
    - [590, 94.578]
  - - [4992, 4992, 1, 4992]
    - [590, 94.374]
  - - [5376, 5376, 1, 5376]
    - [590, 95.075]
  - - [6144, 6144, 1, 6144]
    - [590, 93.82]
  - - [6528, 6528, 1, 6528]
    - [590, 96.322]
  - - [6912, 6912, 1, 6912]
    - [590, 95.227]
  - - [7296, 7296, 1, 7296]
    - [590, 94.737]
  - - [7680, 7680, 1, 7680]
    - [590, 97.915]
  - - [8064, 4032, 1, 384]
    - [589, 85.329]
  - - [8448, 4224, 1, 384]
    - [587, 86.798]
  - - [8832, 4416, 1, 384]
    - [589, 85.817]
  - - [9216, 4608, 1, 384]
    - [588, 87.957]
  - - [9600, 4800, 1, 384]
    - [588, 87.386]
  - - [9984, 4992, 1, 384]
    - [587, 88.198]
  - - [10368, 5184, 1, 384]
    - [588, 88.147]
  - - [10752, 5376, 1, 384]
    - [588, 88.993]
  - - [11136, 5568, 1, 384]
    - [588, 88.893]
  - - [11520, 5760, 1, 384]
    - [588, 89.908]
  - - [11904, 5952, 1, 384]
    - [589, 88.852]
  - - [12288, 6144, 1, 384]
    - [587, 89.819]
  - - [12672, 6336, 1, 384]
    - [587, 89.635]
  - - [13056, 6528, 1, 384]
    - [588, 90.526]
  - - [13440, 6720, 1, 384]
    - [589, 89.883]
  - - [13824, 6912, 1, 384]
    - [588, 91.044]
  - - [14208, 7104, 1, 384]
    - [588, 90.42]
  - - [14592, 7296, 1, 384]
    - [587, 91.218]
  - - [14976, 7488, 1, 384]
    - [587, 90.433]
  - - [15360, 7680, 1, 384]
    - [588, 91.454]
  - - [15744, 7872, 1, 384]
    - [589, 90.781]
  - - [16128, 8064, 1, 384]
    - [588, 91.563]
  - - [16512, 8256, 1, 384]
    - [588, 91.079]
  - - [16896, 8448, 1, 384]
    - [589, 91.881]
  - - [17280, 8640, 1, 384]
    - [588, 91.218]
  - - [17664, 8832, 1, 384]
    - [588, 91.952]
  - - [18048, 9024, 1, 384]
    - [587, 91.366]
  - - [18432, 9216, 1, 384]
    - [588, 91.956]
  - - [18816, 9408, 1, 384]
    - [588, 91.438]
  - - [19200, 9600, 1, 384]
    - [589, 92.146]
  - - [19584, 9792, 1, 384]
    - [589, 91.626]
  - - [19968, 9984, 1, 384]
    - [588, 92.259]
  - - [20352, 10176, 1, 384]
    - [588, 91.667]
  - - [20736, 10368, 1, 384]
    - [589, 92.339]
  - - [21120, 10560, 1, 384]
    - [588, 91.822]
  - - [21504, 10752, 1, 384]
    - [589, 92.474]
  - - [21888, 10944, 1, 384]
    - [589, 92.009]
  - - [22272, 11136, 1, 384]
    - [589, 92.445]
  - - [22656, 11328, 1, 384]
    - [588, 92.019]
  - - [23040, 11520, 1, 384]
    - [588, 92.585]
  - - [8064, 16128, 1, 384]
    - [589, 89.312]
  - - [8448, 16896, 1, 384]
    - [587, 88.567]
  - - [8832, 17664, 1, 384]
    - [589, 88.948]
  - - [9216, 18432, 1, 384]
    - [589, 89.635]
  - - [9600, 19200, 1, 384]
    - [589, 88.724]
  - - [9984, 19968, 1, 384]
    - [589, 89.39]
  - - [10368, 20736, 1, 384]
    - [589, 89.626]
  - - [10752, 21504, 1, 384]
    - [589, 89.662]
  - - [11136, 22272, 1, 384]
    - [589, 89.496]
  - - [11520, 23040, 1, 384]
    - [589, 89.832]
  - - [11904, 23808, 1, 384]
    - [589, 89.615]
  - - [12288, 24576, 1, 384]
    - [589, 89.462]
  - - [12672, 25344, 1, 384]
    - [587, 89.148]
  - - [13056, 26112, 1, 384]
    - [589, 89.72]
  - - [13440, 26880, 1, 384]
    - [588, 89.794]
  - - [13824, 27648, 1, 384]
    - [589, 91.101]
  - - [14208, 28416, 1, 384]
    - [589, 89.284]
  - - [14592, 29184, 1, 384]
    - [589, 90.565]
  - - [14976, 29952, 1, 384]
    - [589, 90.08]
  - - [15360, 30720, 1, 384]
    - [589, 90.376]
  - - [15744, 31488, 1, 384]
    - [589, 90.407]
  - - [16128, 32256, 1, 384]
    - [589, 90.526]
  - - [16512, 33024, 1, 384]
    - [589, 90.343]
  - - [16896, 33792, 1, 384]
    - [589, 91.02]
  - - [17280, 34560, 1, 384]
    - [589, 89.871]
  - - [17664, 35328, 1, 384]
    - [589, 89.885]
  - - [18048, 36096, 1, 384]
    - [589, 89.767]
  - - [18432, 36864, 1, 384]
    - [589, 89.776]
  - - [18816, 37632, 1, 384]
    - [589, 89.338]
  - - [19200, 38400, 1, 384]
    - [589, 89.422]
  - - [19584, 39168, 1, 384]
    - [589, 89.066]
  - - [19968, 39936, 1, 384]
    - [589, 89.364]
  - - [20352, 40704, 1, 384]
    - [589, 88.161]
  - - [20736, 41472, 1, 384]
    - [589, 87.898]
  - - [21120, 42240, 1, 384]
    - [589, 88.308]
  - - [21504, 43008, 1, 384]
    - [589, 89.171]
  - - [21888, 43776, 1, 384]
    - [589, 88.252]
  - - [22272, 44544, 1, 384]
    - [589, 88.291]
  - - [22656, 45312, 1, 384]
    - [589, 87.868]
  - - [23040, 46080, 1, 384]
    - [589, 89.076]
  - - [384, 1536, 1, 384]
    - [575, 26.802]
  - - [1152, 1536, 1, 384]
    - [574, 49.294]
  - - [1920, 1536, 1, 384]
    - [584, 60.331]
  - - [2304, 1536, 1, 384]
    - [583, 61.119]
  - - [2688, 1536, 1, 384]
    - [584, 62.342]
  - - [3456, 1536, 1, 384]
    - [583, 67.688]
  - - [3840, 1536, 1, 384]
    - [583, 70.381]
  - - [4224, 1536, 1, 384]
    - [585, 71.284]
  - - [4608, 1536, 1, 384]
    - [584, 70.933]
  - - [4992, 1536, 1, 384]
    - [583, 74.023]
  - - [5376, 1536, 1, 384]
    - [585, 74.064]
  - - [5760, 1536, 1, 384]
    - [583, 74.286]
  - - [6144, 1536, 1, 384]
    - [588, 74.536]
  - - [6528, 1536, 1, 384]
    - [583, 75.794]
  - - [6912, 1536, 1, 384]
    - [583, 77.758]
  - - [7296, 1536, 1, 384]
    - [585, 77.672]
  - - [7680, 1536, 1, 384]
    - [587, 79.103]
  - - [8064, 1536, 1, 384]
    - [584, 78.401]
  - - [8448, 1536, 1, 384]
    - [585, 78.406]
  - - [8832, 1536, 1, 384]
    - [588, 80.139]
  - - [9216, 1536, 1, 384]
    - [583, 78.829]
  - - [9600, 1536, 1, 384]
    - [584, 79.13]
  - - [9984, 1536, 1, 384]
    - [587, 80.807]
  - - [10368, 1536, 1, 384]
    - [583, 80.173]
  - - [10752, 1536, 1, 384]
    - [583, 81.107]
  - - [11136, 1536, 1, 384]
    - [588, 81.264]
  - - [11520, 1536, 1, 384]
    - [587, 83.123]
  - - [11904, 1536, 1, 384]
    - [583, 81.381]
  - - [12288, 1536, 1, 384]
    - [587, 82.15]
  - - [12672, 1536, 1, 384]
    - [587, 83.395]
  - - [13056, 1536, 1, 384]
    - [583, 82.167]
  - - [13440, 1536, 1, 384]
    - [588, 82.308]
  - - [13824, 1536, 1, 384]
    - [587, 83.899]
  - - [14208, 1536, 1, 384]
    - [583, 82.345]
  - - [14592, 1536, 1, 384]
    - [588, 82.696]
  - - [14976, 1536, 1, 384]
    - [588, 83.988]
  - - [15360, 1536, 1, 384]
    - [587, 85.247]
  - - [15744, 1536, 1, 384]
    - [589, 82.885]
  - - [16128, 1536, 1, 384]
    - [588, 84.363]
  - - [16512, 1536, 1, 384]
    - [587, 85.367]
  - - [16896, 1536, 1, 384]
    - [583, 83.927]
  - - [17280, 1536, 1, 384]
    - [588, 84.641]
  - - [17664, 1536, 1, 384]
    - [589, 85.616]
  - - [18048, 1536, 1, 384]
    - [588, 84.587]
  - - [18432, 1536, 1, 384]
    - [588, 84.668]
  - - [18816, 1536, 1, 384]
    - [588, 85.771]
  - - [19200, 1536, 1, 384]
    - [588, 86.451]
  - - [19584, 1536, 1, 384]
    - [587, 84.885]
  - - [19968, 1536, 1, 384]
    - [587, 85.981]
  - - [20352, 1536, 1, 384]
    - [588, 86.721]
  - - [20736, 1536, 1, 384]
    - [588, 85.674]
  - - [21120, 1536, 1, 384]
    - [588, 86.105]
  - - [21504, 1536, 1, 384]
    - [588, 86.732]
  - - [21888, 1536, 1, 384]
    - [587, 85.91]
  - - [22272, 1536, 1, 384]
    - [588, 86.041]
  - - [22656, 1536, 1, 384]
    - [587, 86.906]
  - - [23040, 1536, 1, 384]
    - [588, 87.377]
  - - [384, 1920, 1, 384]
    - [576, 32.344]
  - - [768, 1920, 1, 384]
    - [577, 42.706]
  - - [1152, 1920, 1, 384]
    - [583, 48.442]
  - - [1536, 1920, 1, 384]
    - [583, 60.763]
  - - [2304, 1920, 1, 384]
    - [583, 65.623]
  - - [2688, 1920, 1, 384]
    - [583, 66.715]
  - - [3072, 1920, 1, 384]
    - [588, 70.07]
  - - [3456, 1920, 1, 384]
    - [583, 72.608]
  - - [4224, 1920, 1, 384]
    - [583, 73.862]
  - - [4608, 1920, 1, 384]
    - [585, 74.214]
  - - [4992, 1920, 1, 384]
    - [583, 76.613]
  - - [5376, 1920, 1, 384]
    - [583, 77.037]
  - - [5760, 1920, 1, 384]
    - [583, 76.997]
  - - [6144, 1920, 1, 384]
    - [589, 78.408]
  - - [6528, 1920, 1, 384]
    - [583, 78.917]
  - - [6912, 1920, 1, 384]
    - [583, 79.785]
  - - [7296, 1920, 1, 384]
    - [583, 79.538]
  - - [7680, 1920, 1, 384]
    - [585, 79.715]
  - - [8064, 1920, 1, 384]
    - [588, 81.167]
  - - [8448, 1920, 1, 384]
    - [585, 81.052]
  - - [8832, 1920, 1, 384]
    - [583, 80.902]
  - - [9216, 1920, 1, 384]
    - [588, 83.068]
  - - [9600, 1920, 1, 384]
    - [583, 81.017]
  - - [9984, 1920, 1, 384]
    - [588, 82.566]
  - - [10368, 1920, 1, 384]
    - [583, 82.282]
  - - [10752, 1920, 1, 384]
    - [583, 82.606]
  - - [11136, 1920, 1, 384]
    - [588, 84.212]
  - - [11520, 1920, 1, 384]
    - [583, 82.676]
  - - [11904, 1920, 1, 384]
    - [587, 83.833]
  - - [12288, 1920, 1, 384]
    - [588, 84.651]
  - - [12672, 1920, 1, 384]
    - [589, 83.212]
  - - [13056, 1920, 1, 384]
    - [587, 84.838]
  - - [13440, 1920, 1, 384]
    - [583, 83.941]
  - - [13824, 1920, 1, 384]
    - [587, 84.335]
  - - [14208, 1920, 1, 384]
    - [588, 85.774]
  - - [14592, 1920, 1, 384]
    - [589, 84.247]
  - - [14976, 1920, 1, 384]
    - [587, 85.528]
  - - [15360, 1920, 1, 384]
    - [587, 86.492]
  - - [15744, 1920, 1, 384]
    - [588, 85.212]
  - - [16128, 1920, 1, 384]
    - [588, 86.292]
  - - [16512, 1920, 1, 384]
    - [589, 85.432]
  - - [16896, 1920, 1, 384]
    - [589, 85.883]
  - - [17280, 1920, 1, 384]
    - [588, 86.986]
  - - [17664, 1920, 1, 384]
    - [588, 85.83]
  - - [18048, 1920, 1, 384]
    - [587, 86.829]
  - - [18432, 1920, 1, 384]
    - [588, 87.252]
  - - [18816, 1920, 1, 384]
    - [588, 86.398]
  - - [19200, 1920, 1, 384]
    - [587, 87.304]
  - - [19584, 1920, 1, 384]
    - [587, 86.449]
  - - [19968, 1920, 1, 384]
    - [588, 86.975]
  - - [20352, 1920, 1, 384]
    - [588, 87.853]
  - - [20736, 1920, 1, 384]
    - [588, 86.764]
  - - [21120, 1920, 1, 384]
    - [588, 87.689]
  - - [21504, 1920, 1, 384]
    - [588, 88.187]
  - - [21888, 1920, 1, 384]
    - [587, 87.322]
  - - [22272, 1920, 1, 384]
    - [587, 88.111]
  - - [22656, 1920, 1, 384]
    - [589, 87.756]
  - - [23040, 1920, 1, 384]
    - [587, 87.87]
  - - [384, 2304, 1, 384]
    - [576, 36.546]
  - - [768, 2304, 1, 384]
    - [577, 48.758]
  - - [1536, 2304, 1, 384]
    - [583, 60.778]
  - - [1920, 2304, 1, 384]
    - [584, 65.13]
  - - [2688, 2304, 1, 384]
    - [585, 70.598]
  - - [3072, 2304, 1, 384]
    - [584, 70.442]
  - - [3456, 2304, 1, 384]
    - [584, 73.403]
  - - [3840, 2304, 1, 384]
    - [583, 75.283]
  - - [4224, 2304, 1, 384]
    - [585, 76.95]
  - - [4992, 2304, 1, 384]
    - [584, 78.331]
  - - [5376, 2304, 1, 384]
    - [585, 79.016]
  - - [5760, 2304, 1, 384]
    - [583, 79.255]
  - - [6144, 2304, 1, 384]
    - [587, 76.402]
  - - [6528, 2304, 1, 384]
    - [583, 80.174]
  - - [6912, 2304, 1, 384]
    - [585, 81.043]
  - - [7296, 2304, 1, 384]
    - [583, 81.378]
  - - [7680, 2304, 1, 384]
    - [588, 82.915]
  - - [8064, 2304, 1, 384]
    - [583, 81.524]
  - - [8448, 2304, 1, 384]
    - [588, 83.37]
  - - [8832, 2304, 1, 384]
    - [583, 82.058]
  - - [9216, 2304, 1, 384]
    - [588, 83.547]
  - - [9600, 2304, 1, 384]
    - [584, 82.726]
  - - [9984, 2304, 1, 384]
    - [588, 83.96]
  - - [10368, 2304, 1, 384]
    - [583, 83.493]
  - - [10752, 2304, 1, 384]
    - [588, 84.437]
  - - [11136, 2304, 1, 384]
    - [583, 83.955]
  - - [11520, 2304, 1, 384]
    - [588, 84.466]
  - - [11904, 2304, 1, 384]
    - [587, 85.912]
  - - [12288, 2304, 1, 384]
    - [588, 84.65]
  - - [12672, 2304, 1, 384]
    - [588, 86.213]
  - - [13056, 2304, 1, 384]
    - [587, 84.769]
  - - [13440, 2304, 1, 384]
    - [588, 86.387]
  - - [13824, 2304, 1, 384]
    - [589, 85.679]
  - - [14208, 2304, 1, 384]
    - [588, 86.341]
  - - [14592, 2304, 1, 384]
    - [587, 86.033]
  - - [14976, 2304, 1, 384]
    - [588, 86.49]
  - - [15360, 2304, 1, 384]
    - [587, 87.407]
  - - [15744, 2304, 1, 384]
    - [587, 86.463]
  - - [16128, 2304, 1, 384]
    - [588, 87.699]
  - - [16512, 2304, 1, 384]
    - [588, 86.666]
  - - [16896, 2304, 1, 384]
    - [588, 87.75]
  - - [17280, 2304, 1, 384]
    - [588, 87.059]
  - - [17664, 2304, 1, 384]
    - [588, 87.748]
  - - [18048, 2304, 1, 384]
    - [589, 87.576]
  - - [18432, 2304, 1, 384]
    - [588, 87.932]
  - - [18816, 2304, 1, 384]
    - [587, 87.598]
  - - [19200, 2304, 1, 384]
    - [588, 87.874]
  - - [19584, 2304, 1, 384]
    - [589, 88.446]
  - - [19968, 2304, 1, 384]
    - [588, 87.802]
  - - [20352, 2304, 1, 384]
    - [588, 88.546]
  - - [20736, 2304, 1, 384]
    - [589, 87.847]
  - - [21120, 2304, 1, 384]
    - [588, 88.56]
  - - [21504, 2304, 1, 384]
    - [589, 88.205]
  - - [21888, 2304, 1, 384]
    - [588, 88.714]
  - - [22272, 2304, 1, 384]
    - [587, 88.629]
  - - [22656, 2304, 1, 384]
    - [588, 88.707]
  - - [23040, 2304, 1, 384]
    - [588, 89.251]
- null
