library/src/blas3/Tensile/Logic/asm_full/arcturus_Cijk_Alik_Bjlk_4xi8BH.yaml
- {MinimumRequiredVersion: 4.6.0}
- arcturus
- gfx908
- [Device 7380, Device 7388, Device 738c]
    SolutionIndex: 0
    SolutionNameMin: Cijk_Alik_Bjlk_4xi8BH_MT128x016x08_GRVW04_GSU01_SNLL0_TT04_04_VW04_WG32_04_01
    SolutionIndex: 1
    SolutionNameMin: Cijk_Alik_Bjlk_4xi8BH_MT032x032x08_GRVW02_GSU01_SNLL0_TT02_02_VW02_WG16_16_01
    SolutionIndex: 2
    SolutionNameMin: Cijk_Alik_Bjlk_4xi8BH_MT032x064x08_GRVW02_GSU01_SNLL0_TT02_04_VW02_WG16_16_01
    SolutionIndex: 3
    SolutionNameMin: Cijk_Alik_Bjlk_4xi8BH_MT016x032x08_GRVW02_GSU01_SNLL0_TT02_02_VW02_WG08_16_01
    SolutionIndex: 4
    SolutionNameMin: Cijk_Alik_Bjlk_4xi8BH_MT032x032x08_GRVW02_GSU01_SNLL0_TT02_02_VW02_WG16_16_01
    SolutionIndex: 5
    SolutionNameMin: Cijk_Alik_Bjlk_4xi8BH_MT016x016x08_GRVW02_GSU02_SNLL0_TT02_02_VW02_WG08_08_02
    SolutionIndex: 6
    SolutionNameMin: Cijk_Alik_Bjlk_4xi8BH_MT016x016x08_GRVW02_GSU08_SNLL0_TT02_02_VW02_WG08_08_02
    SolutionIndex: 7
    SolutionNameMin: Cijk_Alik_Bjlk_4xi8BH_MT008x032x16_GRVW02_GSU02_SNLL0_TT02_04_VW02_WG04_08_04
    SolutionIndex: 8
    SolutionNameMin: Cijk_Alik_Bjlk_4xi8BH_MT016x032x16_GRVW04_GSU02_SNLL0_TT04_04_VW04_WG04_08_04
    SolutionIndex: 9
    SolutionNameMin: Cijk_Alik_Bjlk_4xi8BH_MT016x064x16_GRVW04_GSU02_SNLL0_TT04_08_VW04_WG04_08_04
    SolutionIndex: 10
    SolutionNameMin: Cijk_Alik_Bjlk_4xi8BH_MT032x032x16_GRVW04_GSU02_SNLL0_TT04_04_VW04_WG08_08_02
    SolutionIndex: 11
    SolutionNameMin: Cijk_Alik_Bjlk_4xi8BH_MT016x064x16_GRVW02_GSU02_SNLL0_TT02_04_VW02_WG08_16_02
    SolutionIndex: 12
    SolutionNameMin: Cijk_Alik_Bjlk_4xi8BH_MT032x064x16_GRVW04_GSU02_SNLL0_TT04_04_VW04_WG08_16_02
    SolutionIndex: 13
    SolutionNameMin: Cijk_Alik_Bjlk_4xi8BH_MT008x032x16_GRVW02_GSU02_SNLL0_TT02_04_VW02_WG04_08_04
    SolutionIndex: 14
    SolutionNameMin: Cijk_Alik_Bjlk_4xi8BH_MT016x032x16_GRVW04_GSU02_SNLL0_TT04_04_VW04_WG04_08_04
    SolutionIndex: 15
    SolutionNameMin: Cijk_Alik_Bjlk_4xi8BH_MT016x064x16_GRVW04_GSU02_SNLL0_TT04_08_VW04_WG04_08_04
    SolutionIndex: 16
    SolutionNameMin: Cijk_Alik_Bjlk_4xi8BH_MT016x032x16_GRVW02_GSU02_SNLL0_TT02_04_VW02_WG08_08_02
    SolutionIndex: 17
    SolutionNameMin: Cijk_Alik_Bjlk_4xi8BH_MT032x032x16_GRVW04_GSU02_SNLL0_TT04_04_VW04_WG08_08_02
    SolutionIndex: 18
    SolutionNameMin: Cijk_Alik_Bjlk_4xi8BH_MT032x064x16_GRVW04_GSU02_SNLL0_TT04_04_VW04_WG08_16_02
    SolutionIndex: 19
    SolutionNameMin: Cijk_Alik_Bjlk_4xi8BH_MT008x016x16_GRVW02_GSU04_SNLL0_TT02_02_VW02_WG04_08_04
    SolutionIndex: 20
    SolutionNameMin: Cijk_Alik_Bjlk_4xi8BH_MT008x032x16_GRVW02_GSU04_SNLL0_TT02_04_VW02_WG04_08_04
    SolutionIndex: 21
    SolutionNameMin: Cijk_Alik_Bjlk_4xi8BH_MT016x032x16_GRVW04_GSU04_SNLL0_TT04_04_VW04_WG04_08_04
    SolutionIndex: 22
    SolutionNameMin: Cijk_Alik_Bjlk_4xi8BH_MT016x016x16_GRVW02_GSU04_SNLL0_TT02_02_VW02_WG08_08_02
    SolutionIndex: 23
    SolutionNameMin: Cijk_Alik_Bjlk_4xi8BH_MT032x032x16_GRVW04_GSU04_SNLL0_TT04_04_VW04_WG08_08_02
    SolutionIndex: 24
    SolutionNameMin: Cijk_Alik_Bjlk_4xi8BH_MT064x032x16_GRVW04_GSU04_SNLL0_TT04_04_VW04_WG16_08_04
    SolutionIndex: 25
    SolutionNameMin: Cijk_Alik_Bjlk_4xi8BH_MT016x064x16_GRVW02_GSU04_SNLL0_TT02_04_VW02_WG08_16_02
    SolutionIndex: 26
    SolutionNameMin: Cijk_Alik_Bjlk_4xi8BH_MT032x064x16_GRVW04_GSU04_SNLL0_TT04_04_VW04_WG08_16_02
    SolutionIndex: 27
    SolutionNameMin: Cijk_Alik_Bjlk_4xi8BH_MT008x016x16_GRVW02_GSU04_SNLL0_TT02_02_VW02_WG04_08_04
    SolutionIndex: 28
    SolutionNameMin: Cijk_Alik_Bjlk_4xi8BH_MT008x032x16_GRVW02_GSU04_SNLL0_TT02_04_VW02_WG04_08_04
    SolutionIndex: 29
    SolutionNameMin: Cijk_Alik_Bjlk_4xi8BH_MT016x032x16_GRVW04_GSU04_SNLL0_TT04_04_VW04_WG04_08_04
    SolutionIndex: 30
    SolutionNameMin: Cijk_Alik_Bjlk_4xi8BH_MT016x064x16_GRVW02_GSU04_SNLL0_TT02_04_VW02_WG08_16_02
    SolutionIndex: 31
    SolutionNameMin: Cijk_Alik_Bjlk_4xi8BH_MT008x016x16_GRVW02_GSU08_SNLL0_TT02_02_VW02_WG04_08_04
    SolutionIndex: 32
    SolutionNameMin: Cijk_Alik_Bjlk_4xi8BH_MT016x032x16_GRVW02_GSU08_SNLL0_TT02_02_VW02_WG08_16_02
    SolutionIndex: 33
    SolutionNameMin: Cijk_Alik_Bjlk_4xi8BH_MT008x016x32_GRVW02_GSU02_SNLL0_TT02_02_VW02_WG04_08_04
    SolutionIndex: 34
    SolutionNameMin: Cijk_Alik_Bjlk_4xi8BH_MT032x016x32_GRVW02_GSU02_SNLL0_TT02_02_VW02_WG16_08_04
    SolutionIndex: 35
    SolutionNameMin: Cijk_Alik_Bjlk_4xi8BH_MT064x064x32_GRVW04_GSU02_SNLL0_TT04_08_VW04_WG16_08_04
    SolutionIndex: 36
    SolutionNameMin: Cijk_Alik_Bjlk_4xi8BH_MT016x032x32_GRVW04_GSU02_SNLL0_TT04_04_VW04_WG04_08_04
    SolutionIndex: 37
    SolutionNameMin: Cijk_Alik_Bjlk_4xi8BH_MT064x064x32_GRVW04_GSU02_SNLL0_TT04_08_VW04_WG16_08_04
    SolutionIndex: 38
    SolutionNameMin: Cijk_Alik_Bjlk_4xi8BH_MT008x016x32_GRVW02_GSU04_SNLL0_TT02_02_VW02_WG04_08_04
    SolutionIndex: 39
    SolutionNameMin: Cijk_Alik_Bjlk_4xi8BH_MT032x016x32_GRVW02_GSU04_SNLL0_TT02_02_VW02_WG16_08_04
    SolutionIndex: 40
    SolutionNameMin: Cijk_Alik_Bjlk_4xi8BH_MT032x032x32_GRVW02_GSU04_SNLL0_TT02_04_VW02_WG16_08_04
    SolutionIndex: 41
    SolutionNameMin: Cijk_Alik_Bjlk_4xi8BH_MT016x032x32_GRVW04_GSU04_SNLL0_TT04_04_VW04_WG04_08_04
    SolutionIndex: 42
    SolutionNameMin: Cijk_Alik_Bjlk_4xi8BH_MT008x016x32_GRVW02_GSU08_SNLL0_TT02_02_VW02_WG04_08_04
    SolutionIndex: 43
    SolutionNameMin: Cijk_Alik_Bjlk_4xi8BH_MT128x128x08_GRVW04_GSU01_SNLL0_TT08_08_VW04_WG16_16_01
    SolutionIndex: 44
    SolutionNameMin: Cijk_Alik_Bjlk_4xi8BH_MT064x128x08_GRVW04_GSU01_SNLL1_TT04_08_VW04_WG16_16_01
    SolutionIndex: 45
    SolutionNameMin: Cijk_Alik_Bjlk_4xi8BH_MT064x128x08_GRVW04_GSU01_SNLL1_TT04_08_VW04_WG16_16_01
    SolutionIndex: 46
    SolutionNameMin: Cijk_Alik_Bjlk_4xi8BH_MT064x064x16_GRVW04_GSU01_SNLL0_TT04_04_VW04_WG16_16_01
    SolutionIndex: 47
    SolutionNameMin: Cijk_Alik_Bjlk_4xi8BH_MT064x064x16_GRVW04_GSU01_SNLL1_TT04_04_VW04_WG16_16_01
    SolutionIndex: 48
    SolutionNameMin: Cijk_Alik_Bjlk_4xi8BH_MT064x128x16_GRVW04_GSU01_SNLL0_TT04_08_VW04_WG16_16_01
    SolutionIndex: 49
    SolutionNameMin: Cijk_Alik_Bjlk_4xi8BH_MT064x128x16_GRVW04_GSU01_SNLL1_TT04_08_VW04_WG16_16_01
    SolutionIndex: 50
    SolutionNameMin: Cijk_Alik_Bjlk_4xi8BH_MT128x064x16_GRVW04_GSU01_SNLL0_TT08_04_VW04_WG16_16_01
    SolutionIndex: 51
    SolutionNameMin: Cijk_Alik_Bjlk_4xi8BH_MT128x128x16_GRVW04_GSU01_SNLL1_TT08_08_VW04_WG16_16_01
    SolutionIndex: 52
    SolutionNameMin: Cijk_Alik_Bjlk_4xi8BH_MT064x064x16_GRVW04_GSU01_SNLL0_TT04_04_VW04_WG16_16_01
    SolutionIndex: 53
    SolutionNameMin: Cijk_Alik_Bjlk_4xi8BH_MT064x064x16_GRVW04_GSU01_SNLL1_TT04_04_VW04_WG16_16_01
    SolutionIndex: 54
    SolutionNameMin: Cijk_Alik_Bjlk_4xi8BH_MT064x128x16_GRVW04_GSU01_SNLL0_TT04_08_VW04_WG16_16_01
    SolutionIndex: 55
    SolutionNameMin: Cijk_Alik_Bjlk_4xi8BH_MT064x128x16_GRVW04_GSU01_SNLL1_TT04_08_VW04_WG16_16_01
    SolutionIndex: 56
    SolutionNameMin: Cijk_Alik_Bjlk_4xi8BH_MT128x064x16_GRVW04_GSU01_SNLL0_TT08_04_VW04_WG16_16_01
    SolutionIndex: 57
    SolutionNameMin: Cijk_Alik_Bjlk_4xi8BH_MT128x128x16_GRVW04_GSU01_SNLL1_TT08_08_VW04_WG16_16_01
    SolutionIndex: 58
    SolutionNameMin: Cijk_Alik_Bjlk_4xi8BH_MT064x064x32_GRVW04_GSU01_SNLL1_TT04_04_VW04_WG16_16_01
    SolutionIndex: 59
    SolutionNameMin: Cijk_Alik_Bjlk_4xi8BH_MT064x064x32_GRVW04_GSU01_SNLL1_TT04_04_VW04_WG16_16_01
    SolutionIndex: 60
    SolutionNameMin: Cijk_Alik_Bjlk_4xi8BH_MT016x016x04_GRVW02_GSU01_SNLL0_TT02_02_VW02_WG08_08_01
    SolutionIndex: 61
    SolutionNameMin: Cijk_Alik_Bjlk_4xi8BH_MT032x032x02_GRVW04_GSU01_SNLL0_TT04_04_VW04_WG08_08_01
    SolutionIndex: 62
    SolutionNameMin: Cijk_Alik_Bjlk_4xi8BH_MT016x016x08_GRVW02_GSU01_SNLL1_TT02_02_VW02_WG08_08_02
    SolutionIndex: 63
    SolutionNameMin: Cijk_Alik_Bjlk_4xi8BH_MT008x008x08_GRVW02_GSU01_SNLL1_TT02_02_VW02_WG04_04_04
    SolutionIndex: 64
    SolutionNameMin: Cijk_Alik_Bjlk_4xi8BH_MT016x016x16_GRVW02_GSU01_SNLL1_TT02_02_VW02_WG08_08_04
    SolutionIndex: 65
    SolutionNameMin: Cijk_Alik_Bjlk_4xi8BH_MT016x016x04_GRVW02_GSU04_SNLL0_TT02_02_VW02_WG08_08_01
    SolutionIndex: 66
    SolutionNameMin: Cijk_Alik_Bjlk_4xi8BH_MT016x016x16_GRVW02_GSU04_SNLL0_TT02_02_VW02_WG08_08_04
    SolutionIndex: 67
    SolutionNameMin: Cijk_Alik_Bjlk_4xi8BH_MT016x016x04_GRVW02_GSU08_SNLL0_TT02_02_VW02_WG08_08_01
    SolutionIndex: 68
    SolutionNameMin: Cijk_Alik_Bjlk_4xi8BH_MT008x008x08_GRVW02_GSU08_SNLL0_TT02_02_VW02_WG04_04_04
    SolutionIndex: 69
    SolutionNameMin: Cijk_Alik_Bjlk_4xi8BH_MT016x016x16_GRVW02_GSU08_SNLL0_TT02_02_VW02_WG08_08_04
    SolutionIndex: 70
    SolutionNameMin: Cijk_Alik_Bjlk_4xi8BH_MT008x008x08_GRVW02_GSU16_SNLL0_TT02_02_VW02_WG04_04_04
    SolutionIndex: 71
    SolutionNameMin: Cijk_Alik_Bjlk_4xi8BH_MT016x016x16_GRVW02_GSU16_SNLL0_TT02_02_VW02_WG08_08_04
- - - [1024, 128, 1, 128]
    - [1, 2403.61]
  - - [4, 704, 1, 1280]
    - [68, 606.815]
  - - [4, 1856, 1, 3328]
    - [69, 1835.59]
  - - [1856, 448, 1, 3328]
    - [49, 25092.4]
  - - [2944, 4288, 1, 1280]
    - [44, 36169.9]
  - - [2368, 64, 1, 3328]
    - [17, 18474.9]
  - - [2368, 5888, 1, 256]
    - [48, 35173.0]
  - - [128, 64, 1, 256]
    - [39, 563.751]
  - - [5888, 1024, 1, 1280]
    - [45, 35223.7]
  - - [128, 6784, 1, 3328]
    - [49, 26410.9]
  - - [64, 4, 1, 256]
    - [64, 39.4795]
  - - [5888, 1856, 1, 3328]
    - [44, 35900.0]
  - - [5056, 704, 1, 256]
    - [46, 30888.6]
  - - [5888, 2944, 1, 3328]
    - [44, 37108.2]
  - - [1856, 4288, 1, 256]
    - [44, 33010.1]
  - - [1024, 5056, 1, 128]
    - [43, 2019.69]
  - - [5056, 5056, 1, 3328]
    - [44, 37457.8]
  - - [1408, 5888, 1, 1280]
    - [45, 36599.3]
  - - [2368, 448, 1, 128]
    - [43, 532.178]
  - - [1024, 3584, 1, 3328]
    - [45, 35159.8]
  - - [4, 2944, 1, 1280]
    - [64, 1912.85]
  - - [1408, 64, 1, 128]
    - [1, 1681.39]
  - - [256, 4288, 1, 3328]
    - [53, 26308.8]
  - - [5888, 1408, 1, 1280]
    - [44, 36728.5]
  - - [704, 1856, 1, 3328]
    - [47, 31270.3]
  - - [4, 1408, 1, 128]
    - [60, 131.55]
  - - [1024, 2368, 1, 256]
    - [52, 26803.0]
  - - [1408, 1856, 1, 1280]
    - [47, 32716.7]
  - - [1408, 64, 1, 1280]
    - [8, 10410.1]
  - - [448, 1024, 1, 1280]
    - [47, 23338.7]
  - - [256, 1408, 1, 3328]
    - [53, 19193.1]
  - - [5056, 5056, 1, 1280]
    - [44, 37072.4]
  - - [448, 5056, 1, 256]
    - [47, 28677.7]
  - - [704, 1856, 1, 1280]
    - [47, 30676.4]
  - - [128, 5056, 1, 128]
    - [2, 3838.62]
  - - [2368, 128, 1, 256]
    - [52, 12238.9]
  - - [1856, 1408, 1, 128]
    - [43, 1381.42]
  - - [64, 5056, 1, 256]
    - [47, 12666.3]
  - - [6784, 256, 1, 3328]
    - [47, 30851.7]
  - - [6784, 4288, 1, 3328]
    - [44, 37429.6]
  - - [4288, 448, 1, 256]
    - [46, 27628.2]
  - - [64, 704, 1, 128]
    - [1, 994.339]
  - - [1856, 2368, 1, 3328]
    - [44, 34182.3]
  - - [4288, 2944, 1, 1280]
    - [44, 36365.3]
  - - [704, 5056, 1, 1280]
    - [45, 34318.0]
  - - [2368, 704, 1, 3328]
    - [47, 29665.4]
  - - [256, 5888, 1, 256]
    - [45, 27212.7]
  - - [1856, 4288, 1, 3328]
    - [44, 35717.5]
  - - [256, 2944, 1, 256]
    - [53, 23301.7]
  - - [5888, 1024, 1, 256]
    - [45, 32618.4]
  - - [448, 64, 1, 1280]
    - [20, 5397.08]
  - - [448, 5056, 1, 3328]
    - [47, 31657.2]
  - - [3584, 4, 1, 1280]
    - [64, 1960.48]
  - - [2944, 64, 1, 256]
    - [47, 9311.68]
  - - [128, 4, 1, 1280]
    - [69, 159.068]
  - - [1408, 2944, 1, 256]
    - [44, 32570.9]
  - - [256, 1856, 1, 1280]
    - [53, 24000.6]
  - - [6784, 5056, 1, 3328]
    - [45, 37559.0]
  - - [5056, 5056, 1, 256]
    - [48, 35473.6]
  - - [1408, 6784, 1, 128]
    - [43, 2602.58]
  - - [64, 1024, 1, 1280]
    - [16, 8830.11]
  - - [2944, 4, 1, 256]
    - [64, 1256.11]
  - - [704, 5056, 1, 128]
    - [43, 1624.03]
  - - [4, 2368, 1, 1280]
    - [64, 1554.38]
  - - [2368, 2944, 1, 1280]
    - [44, 35278.7]
  - - [128, 3584, 1, 1280]
    - [53, 23154.7]
  - - [6784, 6784, 1, 1280]
    - [45, 38011.2]
  - - [1024, 256, 1, 3328]
    - [59, 19827.6]
  - - [1408, 4288, 1, 1280]
    - [44, 35229.8]
  - - [3584, 4288, 1, 1280]
    - [45, 36276.5]
  - - [2368, 704, 1, 1280]
    - [47, 29230.9]
  - - [5056, 4288, 1, 3328]
    - [44, 37743.2]
  - - [3584, 2368, 1, 3328]
    - [45, 35550.0]
  - - [64, 704, 1, 1280]
    - [13, 7337.36]
  - - [4288, 256, 1, 256]
    - [46, 23615.0]
  - - [2944, 128, 1, 128]
    - [2, 3382.5]
  - - [6784, 448, 1, 1280]
    - [47, 32081.6]
  - - [1408, 2944, 1, 128]
    - [43, 1783.94]
  - - [4288, 2944, 1, 256]
    - [48, 34712.3]
  - - [5888, 704, 1, 1280]
    - [47, 33128.1]
  - - [1856, 64, 1, 1280]
    - [10, 11971.9]
  - - [448, 5888, 1, 128]
    - [43, 1343.15]
  - - [5888, 64, 1, 3328]
    - [18, 22243.6]
  - - [2944, 256, 1, 3328]
    - [53, 28743.9]
  - - [1024, 64, 1, 128]
    - [1, 1441.34]
  - - [5056, 2368, 1, 1280]
    - [44, 35891.5]
  - - [448, 3584, 1, 1280]
    - [47, 28207.6]
  - - [6784, 5888, 1, 256]
    - [48, 36491.7]
  - - [64, 1024, 1, 3328]
    - [23, 13364.2]
  - - [704, 128, 1, 1280]
    - [11, 10225.5]
  - - [5888, 2944, 1, 128]
    - [43, 3098.26]
  - - [4, 3584, 1, 128]
    - [60, 336.082]
  - - [1408, 448, 1, 1280]
    - [47, 23663.6]
  - - [1024, 1408, 1, 256]
    - [52, 24411.3]
  - - [2368, 2368, 1, 3328]
    - [44, 35821.4]
  - - [1856, 6784, 1, 128]
    - [43, 2754.32]
  - - [5056, 704, 1, 3328]
    - [47, 32746.6]
  - - [1408, 1856, 1, 256]
    - [47, 30271.1]
  - - [1408, 704, 1, 3328]
    - [47, 29522.3]
  - - [2368, 5056, 1, 256]
    - [48, 33889.7]
  - - [5888, 1856, 1, 256]
    - [50, 33820.1]
  - - [4288, 64, 1, 3328]
    - [26, 20286.8]
  - - [2368, 4, 1, 1280]
    - [64, 1546.45]
  - - [704, 5888, 1, 256]
    - [44, 32273.7]
  - - [4288, 64, 1, 256]
    - [46, 10943.1]
  - - [6784, 64, 1, 256]
    - [47, 16345.4]
  - - [2944, 256, 1, 256]
    - [53, 23301.7]
  - - [2944, 6784, 1, 3328]
    - [45, 37337.7]
  - - [704, 1408, 1, 3328]
    - [49, 30071.3]
  - - [3584, 704, 1, 3328]
    - [47, 31947.2]
  - - [2944, 256, 1, 128]
    - [43, 482.394]
  - - [6784, 4, 1, 1280]
    - [64, 2337.42]
  - - [1024, 64, 1, 1280]
    - [11, 8405.42]
  - - [448, 4288, 1, 256]
    - [53, 27170.3]
  - - [64, 3584, 1, 3328]
    - [17, 21370.8]
  - - [704, 2368, 1, 1280]
    - [47, 29295.1]
  - - [448, 2944, 1, 128]
    - [43, 819.36]
  - - [1856, 2368, 1, 1280]
    - [44, 33625.9]
  - - [2368, 128, 1, 3328]
    - [12, 21453.2]
  - - [2944, 128, 1, 256]
    - [47, 14979.7]
  - - [448, 1408, 1, 256]
    - [53, 20235.7]
  - - [1856, 4288, 1, 1280]
    - [44, 35285.5]
  - - [64, 5056, 1, 3328]
    - [18, 22332.8]
  - - [4, 704, 1, 256]
    - [64, 404.998]
  - - [1024, 448, 1, 128]
    - [43, 320.211]
  - - [704, 4, 1, 1280]
    - [68, 636.834]
  - - [704, 256, 1, 128]
    - [43, 83.5338]
  - - [704, 2944, 1, 128]
    - [43, 917.133]
  - - [1408, 1024, 1, 1280]
    - [45, 30224.3]
  - - [704, 6784, 1, 256]
    - [44, 30828.0]
  - - [6784, 704, 1, 256]
    - [46, 31078.8]
  - - [5056, 1408, 1, 128]
    - [43, 2164.3]
  - - [256, 3584, 1, 3328]
    - [49, 27778.9]
  - - [4, 5888, 1, 3328]
    - [67, 2682.45]
  - - [128, 1408, 1, 128]
    - [1, 2651.57]
  - - [3584, 4288, 1, 3328]
    - [45, 36990.0]
  - - [5888, 1856, 1, 1280]
    - [44, 35471.9]
  - - [5056, 1024, 1, 3328]
    - [44, 36287.9]
  - - [5056, 64, 1, 1280]
    - [47, 16449.1]
  - - [1024, 704, 1, 256]
    - [47, 21163.9]
  - - [1024, 4288, 1, 128]
    - [43, 1692.48]
  - - [4288, 64, 1, 1280]
    - [17, 14986.0]
  - - [2368, 3584, 1, 1280]
    - [44, 35568.2]
  - - [2368, 6784, 1, 1280]
    - [45, 37311.9]
  - - [1024, 256, 1, 256]
    - [47, 13107.2]
  - - [1856, 4, 1, 1280]
    - [64, 1280.69]
  - - [448, 448, 1, 256]
    - [46, 10443.1]
  - - [2944, 3584, 1, 3328]
    - [44, 36284.5]
  - - [128, 4288, 1, 128]
    - [1, 3481.42]
  - - [64, 448, 1, 256]
    - [34, 1668.19]
  - - [128, 1024, 1, 3328]
    - [35, 18420.9]
  - - [4, 1408, 1, 3328]
    - [70, 1761.59]
  - - [6784, 2944, 1, 256]
    - [48, 35550.4]
  - - [64, 1856, 1, 1280]
    - [10, 11990.8]
  - - [64, 1024, 1, 128]
    - [4, 1344.33]
  - - [4288, 2368, 1, 3328]
    - [44, 36652.9]
  - - [1856, 2368, 1, 256]
    - [46, 31569.1]
  - - [3584, 256, 1, 128]
    - [43, 454.773]
  - - [3584, 6784, 1, 3328]
    - [45, 37560.1]
  - - [256, 1024, 1, 256]
    - [47, 13210.4]
  - - [4, 6784, 1, 3328]
    - [65, 2684.56]
  - - [1024, 5888, 1, 3328]
    - [57, 34931.9]
  - - [1024, 128, 1, 1280]
    - [35, 11831.6]
  - - [4288, 128, 1, 1280]
    - [47, 20518.3]
  - - [5056, 4288, 1, 1280]
    - [44, 37379.5]
  - - [5888, 64, 1, 256]
    - [47, 14398.4]
  - - [1408, 5056, 1, 1280]
    - [45, 35719.8]
  - - [1856, 256, 1, 1280]
    - [47, 24057.5]
  - - [64, 5888, 1, 3328]
    - [12, 22547.6]
  - - [2944, 5888, 1, 128]
    - [43, 3287.68]
  - - [704, 5888, 1, 1280]
    - [44, 35400.3]
  - - [2368, 3584, 1, 128]
    - [43, 2281.91]
  - - [6784, 5888, 1, 3328]
    - [44, 38111.0]
  - - [704, 1024, 1, 1280]
    - [47, 26777.3]
  - - [448, 256, 1, 3328]
    - [37, 16843.9]
  - - [448, 1856, 1, 128]
    - [43, 531.887]
  - - [128, 1024, 1, 128]
    - [1, 2403.61]
  - - [2944, 4, 1, 128]
    - [60, 271.108]
  - - [1024, 704, 1, 1280]
    - [47, 26274.1]
  - - [128, 5888, 1, 256]
    - [47, 22968.8]
  - - [1024, 5056, 1, 1280]
    - [57, 34429.6]
  - - [4288, 1024, 1, 256]
    - [46, 31451.4]
  - - [2944, 2368, 1, 128]
    - [43, 2115.55]
  - - [704, 704, 1, 3328]
    - [47, 26057.0]
  - - [704, 1408, 1, 1280]
    - [49, 28980.7]
  - - [5888, 448, 1, 1280]
    - [47, 30429.1]
  - - [3584, 256, 1, 3328]
    - [49, 27673.1]
  - - [704, 5888, 1, 3328]
    - [45, 35926.5]
  - - [704, 1856, 1, 128]
    - [43, 650.315]
  - - [128, 3584, 1, 3328]
    - [53, 24020.2]
  - - [4, 4288, 1, 128]
    - [60, 310.971]
  - - [128, 704, 1, 1280]
    - [8, 10428.9]
  - - [3584, 2944, 1, 256]
    - [54, 33496.2]
  - - [1856, 128, 1, 3328]
    - [17, 21310.7]
  - - [4, 64, 1, 1280]
    - [69, 86.2316]
  - - [4, 5056, 1, 3328]
    - [65, 2584.7]
  - - [128, 2944, 1, 1280]
    - [47, 19263.0]
  - - [2368, 1024, 1, 3328]
    - [44, 32489.9]
  - - [128, 256, 1, 3328]
    - [29, 9719.42]
  - - [1408, 5056, 1, 3328]
    - [45, 36241.1]
  - - [1856, 1856, 1, 3328]
    - [44, 33825.3]
  - - [3584, 128, 1, 256]
    - [47, 18123.5]
  - - [448, 1408, 1, 3328]
    - [47, 24240.8]
  - - [2368, 2368, 1, 256]
    - [44, 32789.0]
  - - [4288, 4288, 1, 1280]
    - [44, 36927.4]
  - - [64, 448, 1, 1280]
    - [27, 5429.02]
  - - [1408, 4288, 1, 256]
    - [48, 32294.2]
  - - [448, 4, 1, 256]
    - [64, 276.357]
  - - [5888, 448, 1, 128]
    - [43, 1232.54]
  - - [448, 4, 1, 1280]
    - [69, 446.257]
  - - [704, 6784, 1, 3328]
    - [45, 33604.6]
  - - [5888, 5888, 1, 1280]
    - [45, 37420.7]
  - - [5056, 1024, 1, 1280]
    - [44, 35988.9]
  - - [448, 5888, 1, 3328]
    - [47, 30577.1]
  - - [128, 4, 1, 128]
    - [60, 12.5548]
  - - [1024, 2944, 1, 1280]
    - [45, 32453.8]
  - - [5056, 5888, 1, 1280]
    - [44, 37930.0]
  - - [4288, 5888, 1, 128]
    - [43, 3485.68]
  - - [256, 3584, 1, 256]
    - [53, 23027.6]
  - - [1408, 3584, 1, 128]
    - [43, 2081.34]
  - - [256, 2944, 1, 3328]
    - [53, 28796.7]
  - - [448, 3584, 1, 128]
    - [43, 722.749]
  - - [5888, 2944, 1, 1280]
    - [45, 36597.9]
  - - [4, 6784, 1, 1280]
    - [62, 2425.56]
  - - [2368, 5888, 1, 128]
    - [43, 3068.46]
  - - [64, 2944, 1, 128]
    - [1, 2759.41]
  - - [3584, 5888, 1, 256]
    - [54, 35038.7]
  - - [2368, 704, 1, 128]
    - [43, 758.784]
  - - [3584, 2944, 1, 1280]
    - [45, 35262.8]
  - - [3584, 2368, 1, 128]
    - [43, 2521.18]
  - - [5056, 704, 1, 128]
    - [43, 1521.63]
  - - [448, 2368, 1, 128]
    - [43, 469.02]
  - - [5056, 1408, 1, 3328]
    - [44, 36371.3]
  - - [1408, 704, 1, 256]
    - [47, 26052.9]
  - - [6784, 1024, 1, 3328]
    - [44, 35398.9]
  - - [6784, 2944, 1, 3328]
    - [44, 37447.1]
  - - [2944, 5056, 1, 3328]
    - [44, 37260.3]
  - - [1856, 1856, 1, 256]
    - [44, 30450.7]
  - - [1024, 5888, 1, 128]
    - [43, 1853.04]
  - - [6784, 2368, 1, 1280]
    - [44, 36233.6]
  - - [256, 4, 1, 128]
    - [60, 24.8242]
  - - [4288, 5888, 1, 1280]
    - [44, 37391.1]
  - - [4288, 4288, 1, 256]
    - [48, 35080.2]
  - - [448, 2944, 1, 3328]
    - [44, 28263.6]
  - - [4288, 1856, 1, 1280]
    - [44, 35341.8]
  - - [1856, 2944, 1, 3328]
    - [44, 35166.1]
  - - [256, 6784, 1, 3328]
    - [53, 30831.9]
  - - [64, 5888, 1, 256]
    - [53, 14660.9]
  - - [256, 5056, 1, 128]
    - [43, 625.661]
  - - [5056, 1024, 1, 256]
    - [44, 33469.7]
  - - [704, 64, 1, 3328]
    - [21, 10977.0]
  - - [5056, 1856, 1, 3328]
    - [44, 35650.4]
  - - [4, 2944, 1, 3328]
    - [6, 2214.15]
  - - [4, 5056, 1, 256]
    - [64, 1628.1]
  - - [1856, 1408, 1, 256]
    - [44, 31203.0]
  - - [3584, 4, 1, 128]
    - [60, 334.855]
  - - [448, 448, 1, 3328]
    - [10, 19738.3]
  - - [6784, 128, 1, 3328]
    - [49, 26049.0]
  - - [4288, 1408, 1, 128]
    - [43, 2380.78]
  - - [4288, 5056, 1, 256]
    - [48, 35427.8]
  - - [1408, 128, 1, 1280]
    - [18, 14066.3]
  - - [5056, 256, 1, 3328]
    - [47, 31038.7]
  - - [704, 704, 1, 256]
    - [47, 19949.3]
  - - [1024, 5888, 1, 1280]
    - [57, 33991.9]
  - - [6784, 2368, 1, 128]
    - [43, 3247.0]
  - - [4, 5056, 1, 1280]
    - [64, 2336.35]
  - - [64, 128, 1, 256]
    - [39, 635.501]
  - - [128, 1856, 1, 1280]
    - [58, 16106.3]
  - - [5056, 3584, 1, 256]
    - [48, 35601.7]
  - - [1856, 1024, 1, 1280]
    - [45, 30492.6]
  - - [6784, 4288, 1, 1280]
    - [45, 37047.5]
  - - [1856, 1856, 1, 1280]
    - [44, 33373.2]
  - - [6784, 2944, 1, 128]
    - [43, 3479.65]
  - - [128, 4288, 1, 3328]
    - [17, 23545.0]
  - - [4, 2368, 1, 3328]
    - [70, 2063.01]
  - - [5888, 1856, 1, 128]
    - [43, 2850.97]
  - - [448, 704, 1, 1280]
    - [47, 16370.7]
  - - [2368, 1024, 1, 128]
    - [43, 1089.51]
  - - [1024, 448, 1, 3328]
    - [47, 24272.3]
  - - [1856, 704, 1, 1280]
    - [47, 30732.8]
  - - [5056, 3584, 1, 128]
    - [43, 3153.06]
  - - [5888, 5888, 1, 3328]
    - [45, 37926.5]
  - - [6784, 1024, 1, 256]
    - [44, 32860.0]
  - - [2944, 2368, 1, 256]
    - [44, 32626.6]
  - - [256, 448, 1, 256]
    - [46, 6168.09]
  - - [5056, 5888, 1, 3328]
    - [44, 38334.1]
  - - [1856, 1024, 1, 256]
    - [48, 27519.2]
  - - [448, 1408, 1, 1280]
    - [47, 23677.5]
  - - [3584, 448, 1, 1280]
    - [53, 27984.9]
  - - [1024, 1024, 1, 1280]
    - [49, 29746.8]
  - - [448, 5888, 1, 256]
    - [47, 28230.9]
  - - [704, 64, 1, 128]
    - [1, 994.339]
  - - [1408, 6784, 1, 3328]
    - [45, 36221.4]
  - - [448, 1024, 1, 128]
    - [43, 215.171]
  - - [4288, 704, 1, 128]
    - [43, 1156.82]
  - - [128, 1856, 1, 128]
    - [2, 3053.08]
  - - [448, 2368, 1, 3328]
    - [47, 25609.7]
  - - [5056, 64, 1, 128]
    - [1, 3266.46]
  - - [5056, 2944, 1, 256]
    - [48, 35237.0]
  - - [6784, 5888, 1, 128]
    - [43, 3893.79]
  - - [704, 1024, 1, 256]
    - [47, 22783.9]
  - - [1024, 4, 1, 256]
    - [64, 569.878]
  - - [2368, 1856, 1, 256]
    - [47, 31445.6]
  - - [128, 6784, 1, 1280]
    - [53, 25457.9]
  - - [1408, 3584, 1, 3328]
    - [44, 35500.8]
  - - [2368, 6784, 1, 256]
    - [48, 35434.4]
  - - [5056, 1408, 1, 1280]
    - [44, 36087.6]
  - - [256, 256, 1, 128]
    - [1, 1436.41]
  - - [5056, 4288, 1, 128]
    - [43, 3224.26]
  - - [1408, 1856, 1, 128]
    - [43, 1263.68]
  - - [1408, 5888, 1, 3328]
    - [45, 37112.5]
  - - [1856, 256, 1, 256]
    - [47, 18770.8]
  - - [6784, 6784, 1, 256]
    - [48, 36598.5]
  - - [64, 256, 1, 128]
    - [1, 408.006]
  - - [4288, 2368, 1, 128]
    - [43, 2628.01]
  - - [1856, 4288, 1, 128]
    - [43, 2628.88]
  - - [256, 4288, 1, 1280]
    - [53, 25828.9]
  - - [2368, 2944, 1, 256]
    - [44, 32951.9]
  - - [4, 1856, 1, 256]
    - [64, 1000.29]
  - - [3584, 1856, 1, 1280]
    - [56, 33808.9]
  - - [6784, 6784, 1, 128]
    - [43, 4139.31]
  - - [256, 1856, 1, 128]
    - [43, 300.838]
  - - [704, 64, 1, 1280]
    - [13, 7648.76]
  - - [5888, 5056, 1, 256]
    - [54, 35519.4]
  - - [3584, 448, 1, 256]
    - [53, 25754.5]
  - - [448, 4288, 1, 128]
    - [43, 1054.06]
  - - [2944, 4288, 1, 3328]
    - [44, 36626.7]
  - - [256, 6784, 1, 256]
    - [53, 26912.6]
  - - [1408, 4288, 1, 128]
    - [43, 1999.8]
  - - [2944, 704, 1, 3328]
    - [47, 32355.5]
  - - [128, 448, 1, 256]
    - [46, 3110.18]
  - - [3584, 3584, 1, 256]
    - [54, 34210.7]
  - - [448, 1408, 1, 128]
    - [43, 452.784]
  - - [128, 256, 1, 1280]
    - [40, 5729.92]
  - - [3584, 5056, 1, 256]
    - [54, 34515.6]
  - - [6784, 128, 1, 256]
    - [47, 22409.1]
  - - [4288, 4, 1, 256]
    - [64, 1389.53]
  - - [64, 1408, 1, 3328]
    - [26, 14979.7]
  - - [704, 448, 1, 256]
    - [47, 12939.2]
  - - [2944, 2368, 1, 1280]
    - [44, 35092.8]
  - - [448, 64, 1, 3328]
    - [20, 9018.94]
  - - [1408, 3584, 1, 256]
    - [44, 32296.1]
  - - [3584, 4, 1, 3328]
    - [66, 2287.16]
  - - [6784, 3584, 1, 256]
    - [48, 35912.5]
  - - [256, 128, 1, 128]
    - [1, 771.012]
  - - [704, 1408, 1, 128]
    - [43, 531.358]
  - - [4, 2368, 1, 256]
    - [64, 1054.27]
  - - [2944, 448, 1, 128]
    - [43, 670.509]
  - - [128, 1408, 1, 256]
    - [47, 9339.54]
  - - [4, 2944, 1, 256]
    - [64, 1245.73]
  - - [64, 128, 1, 3328]
    - [31, 5011.58]
  - - [5056, 2368, 1, 128]
    - [43, 2984.53]
  - - [2944, 2944, 1, 3328]
    - [44, 36630.4]
  - - [5056, 6784, 1, 256]
    - [48, 36362.3]
  - - [1856, 3584, 1, 128]
    - [43, 2213.15]
  - - [128, 2944, 1, 128]
    - [2, 3349.62]
  - - [1024, 704, 1, 3328]
    - [47, 27294.0]
  - - [6784, 448, 1, 256]
    - [46, 30250.5]
  - - [3584, 6784, 1, 128]
    - [43, 3509.21]
  - - [128, 4288, 1, 256]
    - [53, 17093.6]
  - - [704, 448, 1, 3328]
    - [47, 16826.3]
  - - [1024, 1024, 1, 3328]
    - [55, 31275.0]
  - - [128, 128, 1, 3328]
    - [19, 6491.18]
  - - [5056, 1856, 1, 256]
    - [44, 33199.1]
  - - [256, 128, 1, 256]
    - [46, 1823.61]
  - - [1024, 1856, 1, 256]
    - [52, 25157.2]
  - - [4288, 64, 1, 128]
    - [1, 2792.31]
  - - [256, 448, 1, 3328]
    - [15, 17009.0]
  - - [1408, 6784, 1, 1280]
    - [45, 35756.0]
  - - [3584, 3584, 1, 1280]
    - [45, 36197.6]
  - - [64, 2368, 1, 1280]
    - [10, 13360.0]
  - - [448, 2368, 1, 1280]
    - [47, 25146.4]
  - - [5888, 5888, 1, 128]
    - [43, 3840.39]
  - - [64, 6784, 1, 3328]
    - [12, 22928.2]
  - - [2944, 256, 1, 1280]
    - [47, 27945.8]
  - - [5056, 5888, 1, 128]
    - [43, 3890.68]
  - - [256, 2368, 1, 128]
    - [43, 391.813]
  - - [5056, 2368, 1, 3328]
    - [44, 36206.8]
  - - [2944, 4288, 1, 256]
    - [48, 34263.3]
  - - [1408, 3584, 1, 1280]
    - [45, 35070.2]
  - - [2368, 64, 1, 256]
    - [47, 7853.71]
  - - [64, 448, 1, 3328]
    - [41, 9282.14]
  - - [256, 256, 1, 3328]
    - [24, 12982.4]
  - - [5888, 4, 1, 128]
    - [60, 406.295]
  - - [1856, 704, 1, 256]
    - [46, 27507.9]
  - - [4, 4288, 1, 1280]
    - [64, 2029.07]
  - - [1408, 448, 1, 3328]
    - [47, 24302.5]
  - - [1024, 4, 1, 3328]
    - [68, 1468.91]
  - - [2368, 256, 1, 256]
    - [47, 19065.0]
  - - [2368, 6784, 1, 3328]
    - [44, 37676.3]
  - - [1856, 1408, 1, 1280]
    - [44, 34541.1]
  - - [1856, 448, 1, 1280]
    - [47, 24511.9]
  - - [6784, 704, 1, 128]
    - [43, 2106.69]
  - - [4, 4, 1, 256]
    - [64, 1.79649]
  - - [128, 5888, 1, 128]
    - [0, 3950.41]
  - - [1408, 5888, 1, 256]
    - [54, 34033.3]
  - - [704, 2944, 1, 1280]
    - [44, 33136.4]
  - - [1856, 2368, 1, 128]
    - [43, 1758.33]
  - - [256, 64, 1, 256]
    - [33, 1048.58]
  - - [1024, 1024, 1, 256]
    - [47, 23967.5]
  - - [704, 1856, 1, 256]
    - [47, 27507.9]
  - - [64, 6784, 1, 256]
    - [47, 16840.8]
  - - [3584, 704, 1, 1280]
    - [47, 31508.4]
  - - [256, 128, 1, 1280]
    - [7, 5809.29]
  - - [2368, 4, 1, 256]
    - [64, 1092.27]
  - - [256, 2368, 1, 1280]
    - [47, 22741.7]
  - - [2944, 6784, 1, 128]
    - [43, 3369.4]
  - - [3584, 448, 1, 3328]
    - [47, 28550.7]
  - - [1408, 4, 1, 256]
    - [64, 735.608]
  - - [704, 2368, 1, 3328]
    - [47, 29640.0]
  - - [2944, 448, 1, 256]
    - [47, 24537.9]
  - - [1856, 448, 1, 128]
    - [43, 396.685]
  - - [2368, 128, 1, 1280]
    - [12, 16152.1]
  - - [256, 5888, 1, 128]
    - [43, 773.609]
  - - [2368, 256, 1, 128]
    - [43, 302.891]
  - - [64, 5056, 1, 1280]
    - [18, 16687.7]
  - - [4, 6784, 1, 128]
    - [60, 470.659]
  - - [2944, 2944, 1, 1280]
    - [44, 36235.8]
  - - [5888, 2368, 1, 256]
    - [50, 33987.4]
  - - [4, 3584, 1, 1280]
    - [64, 2094.76]
  - - [1408, 128, 1, 128]
    - [1, 2633.41]
  - - [6784, 704, 1, 3328]
    - [44, 33562.1]
  - - [128, 64, 1, 1280]
    - [38, 2105.57]
  - - [2368, 256, 1, 1280]
    - [47, 22701.8]
  - - [4, 448, 1, 3328]
    - [69, 839.968]
  - - [5888, 4288, 1, 128]
    - [43, 3528.3]
  - - [4, 5888, 1, 256]
    - [63, 1773.33]
  - - [1408, 2944, 1, 3328]
    - [44, 35949.0]
  - - [3584, 704, 1, 128]
    - [43, 1229.67]
  - - [64, 1024, 1, 256]
    - [47, 3524.63]
  - - [5056, 5056, 1, 128]
    - [43, 3727.09]
  - - [2368, 448, 1, 1280]
    - [47, 25165.0]
  - - [128, 3584, 1, 256]
    - [47, 17794.0]
  - - [704, 448, 1, 1280]
    - [47, 16317.8]
  - - [448, 5056, 1, 128]
    - [43, 1145.07]
  - - [256, 4, 1, 1280]
    - [69, 288.705]
  - - [128, 5056, 1, 256]
    - [53, 19865.1]
  - - [1408, 5056, 1, 128]
    - [43, 2521.48]
  - - [2944, 3584, 1, 128]
    - [43, 2650.04]
  - - [3584, 2368, 1, 256]
    - [54, 32283.1]
  - - [5888, 5056, 1, 1280]
    - [45, 37093.4]
  - - [2368, 5056, 1, 128]
    - [43, 2610.01]
  - - [64, 704, 1, 256]
    - [46, 2454.11]
  - - [4288, 256, 1, 1280]
    - [47, 25972.1]
  - - [3584, 3584, 1, 3328]
    - [45, 36981.5]
  - - [1024, 256, 1, 128]
    - [43, 164.418]
  - - [4, 704, 1, 128]
    - [60, 66.5033]
  - - [5888, 6784, 1, 256]
    - [54, 36220.3]
  - - [4288, 2944, 1, 3328]
    - [44, 36700.3]
  - - [2944, 64, 1, 128]
    - [1, 2778.48]
  - - [1856, 64, 1, 256]
    - [46, 6308.86]
  - - [4288, 128, 1, 3328]
    - [17, 23840.0]
  - - [4288, 704, 1, 1280]
    - [47, 31918.1]
  - - [256, 5056, 1, 1280]
    - [53, 30310.1]
  - - [1408, 256, 1, 128]
    - [43, 232.5]
  - - [2944, 5888, 1, 3328]
    - [44, 37133.6]
  - - [6784, 5888, 1, 1280]
    - [45, 37702.7]
  - - [704, 128, 1, 256]
    - [46, 4826.08]
  - - [5888, 4288, 1, 1280]
    - [45, 37141.8]
  - - [448, 256, 1, 1280]
    - [10, 11669.4]
  - - [5888, 3584, 1, 128]
    - [43, 3461.31]
  - - [1856, 1856, 1, 128]
    - [43, 1322.91]
  - - [5056, 4, 1, 1280]
    - [64, 2379.29]
  - - [256, 1408, 1, 1280]
    - [47, 18454.9]
  - - [3584, 1024, 1, 3328]
    - [45, 35828.2]
  - - [704, 3584, 1, 128]
    - [43, 1245.13]
  - - [5888, 448, 1, 3328]
    - [47, 30621.9]
  - - [2368, 4288, 1, 1280]
    - [44, 36207.7]
  - - [4288, 2944, 1, 128]
    - [43, 2874.47]
  - - [1024, 6784, 1, 3328]
    - [57, 34761.2]
  - - [128, 2368, 1, 256]
    - [47, 12355.8]
  - - [6784, 64, 1, 3328]
    - [18, 22942.8]
  - - [5056, 2944, 1, 3328]
    - [44, 37381.8]
  - - [448, 128, 1, 256]
    - [46, 3123.42]
  - - [2944, 3584, 1, 256]
    - [48, 33950.9]
  - - [1408, 1408, 1, 3328]
    - [51, 32312.9]
  - - [1856, 128, 1, 1280]
    - [58, 16401.7]
  - - [3584, 3584, 1, 128]
    - [43, 2950.56]
  - - [64, 3584, 1, 256]
    - [47, 11121.3]
  - - [1408, 4, 1, 3328]
    - [68, 1679.51]
  - - [128, 2944, 1, 3328]
    - [12, 22719.1]
  - - [3584, 704, 1, 256]
    - [46, 29121.9]
  - - [2944, 448, 1, 3328]
    - [45, 28064.8]
  - - [3584, 1408, 1, 3328]
    - [44, 35361.7]
  - - [704, 3584, 1, 1280]
    - [44, 33240.2]
  - - [2944, 6784, 1, 1280]
    - [45, 36931.9]
  - - [1856, 6784, 1, 256]
    - [48, 34363.8]
  - - [4288, 448, 1, 3328]
    - [47, 30162.1]
  - - [6784, 4288, 1, 128]
    - [43, 3515.78]
  - - [6784, 704, 1, 1280]
    - [44, 33026.5]
  - - [256, 4288, 1, 256]
    - [52, 22662.8]
  - - [3584, 64, 1, 128]
    - [2, 2959.69]
  - - [5888, 1024, 1, 3328]
    - [45, 35618.9]
  - - [448, 64, 1, 128]
    - [3, 634.951]
  - - [704, 6784, 1, 1280]
    - [44, 33198.7]
  - - [5888, 128, 1, 256]
    - [47, 22592.3]
  - - [2368, 448, 1, 3328]
    - [47, 25609.7]
  - - [1856, 5056, 1, 3328]
    - [45, 35597.6]
  - - [4, 6784, 1, 256]
    - [63, 1929.67]
  - - [1024, 3584, 1, 128]
    - [43, 1466.36]
  - - [1024, 1408, 1, 128]
    - [43, 671.773]
  - - [2368, 2944, 1, 128]
    - [43, 2225.73]
  - - [5056, 64, 1, 256]
    - [47, 12705.1]
  - - [4, 448, 1, 1280]
    - [64, 439.418]
  - - [5056, 2944, 1, 128]
    - [43, 3004.48]
  - - [5888, 5056, 1, 3328]
    - [45, 37575.5]
  - - [1024, 704, 1, 128]
    - [43, 347.211]
  - - [1408, 2368, 1, 128]
    - [43, 1601.27]
  - - [5888, 2368, 1, 128]
    - [43, 3085.97]
  - - [128, 5056, 1, 3328]
    - [53, 24847.4]
  - - [3584, 6784, 1, 1280]
    - [54, 36863.6]
  - - [1856, 5888, 1, 256]
    - [44, 34796.0]
  - - [256, 256, 1, 256]
    - [46, 3539.5]
  - - [256, 64, 1, 128]
    - [1, 361.578]
  - - [4288, 4288, 1, 3328]
    - [44, 37309.3]
  - - [4288, 1408, 1, 1280]
    - [44, 35475.6]
  - - [3584, 5056, 1, 128]
    - [43, 3093.76]
  - - [4, 1024, 1, 3328]
    - [6, 1511.25]
  - - [4288, 2368, 1, 256]
    - [44, 34006.0]
  - - [2944, 5056, 1, 1280]
    - [45, 36796.8]
  - - [448, 6784, 1, 256]
    - [44, 30631.6]
  - - [704, 1024, 1, 128]
    - [43, 338.424]
  - - [6784, 2368, 1, 3328]
    - [44, 36622.8]
  - - [256, 1024, 1, 1280]
    - [58, 17772.5]
  - - [704, 4, 1, 128]
    - [60, 66.2588]
  - - [256, 4, 1, 256]
    - [64, 161.817]
  - - [4288, 128, 1, 256]
    - [47, 17135.3]
  - - [4288, 1856, 1, 3328]
    - [44, 35697.3]
  - - [3584, 448, 1, 128]
    - [43, 736.212]
  - - [256, 4, 1, 3328]
    - [71, 606.383]
  - - [4, 1408, 1, 1280]
    - [6, 1024.0]
  - - [3584, 64, 1, 1280]
    - [58, 15667.1]
  - - [1408, 448, 1, 128]
    - [43, 405.853]
  - - [3584, 1024, 1, 1280]
    - [44, 35151.3]
  - - [1856, 5056, 1, 256]
    - [48, 33107.6]
  - - [4, 3584, 1, 256]
    - [64, 1349.27]
  - - [1024, 4288, 1, 256]
    - [52, 29349.2]
  - - [5888, 3584, 1, 3328]
    - [45, 37562.3]
  - - [4, 256, 1, 256]
    - [64, 168.041]
  - - [5056, 3584, 1, 3328]
    - [44, 37815.9]
  - - [128, 5888, 1, 1280]
    - [53, 27832.9]
  - - [704, 448, 1, 128]
    - [43, 203.787]
  - - [2368, 1408, 1, 1280]
    - [44, 32602.8]
  - - [5056, 2944, 1, 1280]
    - [44, 37029.9]
  - - [4, 4, 1, 128]
    - [61, 0.182206]
  - - [3584, 256, 1, 256]
    - [47, 23629.9]
  - - [128, 1856, 1, 3328]
    - [17, 21554.7]
  - - [1024, 6784, 1, 256]
    - [52, 30821.2]
  - - [4, 128, 1, 256]
    - [64, 89.7753]
  - - [64, 64, 1, 1280]
    - [32, 1175.53]
  - - [6784, 4, 1, 128]
    - [60, 470.659]
  - - [2944, 1408, 1, 128]
    - [43, 1572.55]
  - - [448, 128, 1, 3328]
    - [14, 12638.5]
  - - [64, 2944, 1, 3328]
    - [10, 19607.5]
  - - [64, 4288, 1, 3328]
    - [26, 20161.4]
  - - [5056, 6784, 1, 3328]
    - [44, 38145.7]
  - - [128, 2944, 1, 256]
    - [47, 15120.5]
  - - [128, 6784, 1, 128]
    - [2, 3856.66]
  - - [3584, 4288, 1, 256]
    - [54, 34004.0]
  - - [448, 1856, 1, 256]
    - [47, 22081.0]
  - - [1856, 6784, 1, 3328]
    - [45, 36493.4]
  - - [3584, 128, 1, 3328]
    - [47, 23990.0]
  - - [64, 1856, 1, 256]
    - [47, 6335.15]
  - - [1024, 448, 1, 1280]
    - [47, 23173.0]
  - - [5888, 4288, 1, 256]
    - [54, 35431.5]
  - - [4, 448, 1, 128]
    - [60, 42.3203]
  - - [5056, 1408, 1, 256]
    - [44, 33798.7]
  - - [64, 256, 1, 1280]
    - [20, 3898.05]
  - - [3584, 1024, 1, 256]
    - [44, 31869.9]
  - - [256, 704, 1, 256]
    - [46, 9377.51]
  - - [5888, 5888, 1, 256]
    - [48, 36101.3]
  - - [4288, 1024, 1, 1280]
    - [45, 33976.3]
  - - [5888, 128, 1, 3328]
    - [47, 28652.0]
  - - [448, 6784, 1, 3328]
    - [44, 34457.2]
  - - [2944, 1408, 1, 1280]
    - [44, 35533.0]
  - - [2944, 1856, 1, 3328]
    - [44, 35087.4]
  - - [2368, 64, 1, 128]
    - [1, 2229.73]
  - - [2944, 2944, 1, 128]
    - [43, 2439.94]
  - - [4, 128, 1, 3328]
    - [71, 362.54]
  - - [3584, 5888, 1, 1280]
    - [45, 36570.0]
  - - [64, 4, 1, 128]
    - [60, 3.67359]
  - - [6784, 1856, 1, 1280]
    - [44, 36196.0]
  - - [2944, 5056, 1, 256]
    - [48, 34691.6]
  - - [5888, 256, 1, 3328]
    - [45, 31878.4]
  - - [1856, 5888, 1, 3328]
    - [44, 37544.7]
  - - [3584, 1408, 1, 256]
    - [45, 31493.1]
  - - [704, 3584, 1, 3328]
    - [44, 33763.6]
  - - [5056, 448, 1, 1280]
    - [47, 31371.1]
  - - [3584, 1856, 1, 3328]
    - [50, 34108.1]
  - - [64, 1408, 1, 128]
    - [1, 1681.42]
  - - [1408, 704, 1, 1280]
    - [47, 29047.1]
  - - [2944, 1024, 1, 256]
    - [44, 30673.8]
  - - [1024, 2368, 1, 128]
    - [43, 1110.48]
  - - [2368, 4288, 1, 3328]
    - [44, 36699.8]
  - - [4, 1408, 1, 256]
    - [64, 750.933]
  - - [1024, 1408, 1, 1280]
    - [44, 29405.6]
  - - [64, 64, 1, 256]
    - [38, 286.496]
  - - [704, 256, 1, 3328]
    - [59, 13813.6]
  - - [6784, 5056, 1, 256]
    - [48, 35705.8]
  - - [4, 4288, 1, 3328]
    - [65, 2380.39]
  - - [448, 6784, 1, 128]
    - [43, 1168.73]
  - - [4, 704, 1, 3328]
    - [70, 1276.79]
  - - [448, 2944, 1, 256]
    - [47, 24645.4]
  - - [2944, 6784, 1, 256]
    - [48, 35412.5]
  - - [2368, 2368, 1, 1280]
    - [44, 35574.5]
  - - [4, 4, 1, 1280]
    - [69, 5.33333]
  - - [1856, 3584, 1, 1280]
    - [44, 35944.1]
  - - [64, 2944, 1, 256]
    - [47, 9420.8]
  - - [3584, 1408, 1, 1280]
    - [44, 34809.4]
  - - [448, 256, 1, 128]
    - [1, 2109.2]
  - - [4288, 448, 1, 128]
    - [43, 810.452]
  - - [5056, 256, 1, 1280]
    - [47, 30455.0]
  - - [1856, 1408, 1, 3328]
    - [44, 34924.5]
  - - [128, 128, 1, 128]
    - [1, 406.425]
  - - [1024, 4288, 1, 3328]
    - [45, 33407.2]
  - - [448, 2368, 1, 256]
    - [46, 22745.5]
  - - [1024, 4, 1, 128]
    - [60, 94.2964]
  - - [5056, 448, 1, 256]
    - [46, 29226.9]
  - - [2944, 2368, 1, 3328]
    - [44, 35493.7]
  - - [704, 128, 1, 3328]
    - [26, 14964.7]
  - - [64, 64, 1, 3328]
    - [42, 3002.53]
  - - [1024, 1856, 1, 1280]
    - [45, 29323.7]
  - - [6784, 1856, 1, 256]
    - [44, 34051.6]
  - - [128, 2368, 1, 3328]
    - [12, 21067.9]
  - - [1024, 5888, 1, 256]
    - [52, 30229.2]
  - - [5056, 128, 1, 1280]
    - [47, 24038.7]
  - - [5056, 64, 1, 3328]
    - [12, 22295.8]
  - - [128, 704, 1, 128]
    - [3, 1691.25]
  - - [1408, 2368, 1, 256]
    - [46, 30527.2]
  - - [1408, 1408, 1, 256]
    - [48, 28543.9]
  - - [4, 64, 1, 128]
    - [60, 6.6332]
  - - [64, 128, 1, 1280]
    - [27, 2595.49]
  - - [2368, 2368, 1, 128]
    - [43, 2124.53]
  - - [64, 5888, 1, 128]
    - [1, 3285.73]
  - - [5888, 4, 1, 3328]
    - [66, 2513.82]
  - - [6784, 1408, 1, 128]
    - [43, 2484.13]
  - - [4288, 5888, 1, 256]
    - [48, 35876.0]
  - - [1408, 5056, 1, 256]
    - [54, 33050.9]
  - - [5056, 128, 1, 3328]
    - [53, 24739.0]
  - - [128, 128, 1, 1280]
    - [28, 3731.59]
  - - [448, 704, 1, 256]
    - [47, 12939.2]
  - - [4288, 3584, 1, 128]
    - [43, 3281.83]
  - - [2944, 128, 1, 3328]
    - [17, 22860.0]
  - - [128, 5056, 1, 1280]
    - [53, 24150.9]
  - - [3584, 5056, 1, 1280]
    - [45, 36643.4]
  - - [256, 448, 1, 1280]
    - [15, 11397.6]
  - - [704, 704, 1, 128]
    - [43, 244.995]
  - - [5056, 4, 1, 128]
    - [60, 349.821]
  - - [704, 256, 1, 1280]
    - [59, 12523.7]
  - - [64, 2368, 1, 3328]
    - [10, 18961.1]
  - - [1856, 1024, 1, 128]
    - [43, 908.604]
  - - [1856, 64, 1, 128]
    - [1, 2184.53]
  - - [64, 6784, 1, 1280]
    - [47, 21845.3]
  - - [704, 4288, 1, 256]
    - [44, 30116.9]
  - - [5888, 2368, 1, 1280]
    - [44, 35697.8]
  - - [128, 256, 1, 256]
    - [46, 1897.88]
  - - [256, 64, 1, 1280]
    - [19, 3912.6]
  - - [2368, 5888, 1, 1280]
    - [44, 37097.3]
  - - [5888, 256, 1, 1280]
    - [44, 31280.5]
  - - [4, 5888, 1, 1280]
    - [63, 2308.31]
  - - [704, 128, 1, 128]
    - [3, 1686.31]
  - - [1024, 4, 1, 1280]
    - [68, 804.123]
  - - [2368, 1856, 1, 3328]
    - [44, 34206.2]
  - - [2368, 128, 1, 128]
    - [1, 3133.87]
  - - [2944, 704, 1, 256]
    - [47, 29542.3]
  - - [5056, 128, 1, 128]
    - [2, 3782.53]
  - - [256, 704, 1, 3328]
    - [58, 13781.8]
  - - [704, 3584, 1, 256]
    - [44, 29876.2]
  - - [1024, 1024, 1, 1024]
    - [55, 29209.5]
  - - [704, 2944, 1, 3328]
    - [44, 33594.1]
  - - [6784, 1024, 1, 128]
    - [43, 2319.71]
  - - [256, 448, 1, 128]
    - [1, 2121.4]
  - - [448, 1024, 1, 3328]
    - [47, 24249.2]
  - - [2944, 1024, 1, 3328]
    - [45, 34197.2]
  - - [2944, 5056, 1, 128]
    - [43, 3325.3]
  - - [1408, 6784, 1, 256]
    - [48, 33589.0]
  - - [6784, 1408, 1, 3328]
    - [44, 36254.5]
  - - [4288, 6784, 1, 128]
    - [43, 3888.93]
  - - [704, 64, 1, 256]
    - [46, 2464.6]
  - - [5888, 4, 1, 1280]
    - [64, 2290.77]
  - - [256, 2368, 1, 3328]
    - [53, 23269.4]
  - - [6784, 2944, 1, 1280]
    - [44, 37035.7]
  - - [4288, 1856, 1, 128]
    - [43, 2284.47]
  - - [1856, 2944, 1, 128]
    - [43, 1956.58]
  - - [6784, 448, 1, 128]
    - [43, 1492.56]
  - - [64, 3584, 1, 128]
    - [2, 2936.01]
  - - [448, 5056, 1, 1280]
    - [47, 31262.8]
  - - [2368, 1856, 1, 128]
    - [43, 1959.05]
  - - [128, 448, 1, 1280]
    - [14, 8398.21]
  - - [4288, 704, 1, 256]
    - [46, 30116.9]
  - - [256, 3584, 1, 128]
    - [43, 542.0]
  - - [5888, 704, 1, 256]
    - [46, 31413.8]
  - - [3584, 1024, 1, 128]
    - [43, 1389.99]
  - - [256, 5888, 1, 3328]
    - [45, 32061.8]
  - - [1408, 4288, 1, 3328]
    - [44, 35639.5]
  - - [6784, 4288, 1, 256]
    - [48, 35628.1]
  - - [4288, 256, 1, 128]
    - [43, 549.895]
  - - [5888, 256, 1, 256]
    - [46, 27174.4]
  - - [6784, 1024, 1, 1280]
    - [44, 35098.8]
  - - [5888, 1024, 1, 128]
    - [43, 2367.19]
  - - [1024, 128, 1, 256]
    - [52, 7019.76]
  - - [128, 64, 1, 3328]
    - [31, 4259.84]
  - - [448, 64, 1, 256]
    - [46, 1561.71]
  - - [2944, 704, 1, 1280]
    - [47, 31970.3]
  - - [6784, 3584, 1, 1280]
    - [44, 37525.0]
  - - [1024, 6784, 1, 1280]
    - [57, 33776.2]
  - - [2944, 64, 1, 1280]
    - [17, 14287.5]
  - - [1408, 2944, 1, 1280]
    - [44, 35409.7]
  - - [256, 1856, 1, 256]
    - [52, 18429.5]
  - - [1408, 2368, 1, 3328]
    - [47, 32867.4]
  - - [2944, 4, 1, 3328]
    - [69, 2129.92]
  - - [128, 1408, 1, 3328]
    - [18, 19781.8]
  - - [2944, 1856, 1, 128]
    - [43, 2135.31]
  - - [256, 2944, 1, 128]
    - [43, 474.983]
  - - [256, 6784, 1, 128]
    - [43, 838.861]
  - - [2368, 4, 1, 128]
    - [60, 136.533]
  - - [1408, 256, 1, 3328]
    - [47, 19138.0]
  - - [1856, 4, 1, 128]
    - [60, 170.912]
  - - [5056, 6784, 1, 128]
    - [43, 3863.62]
  - - [4288, 5056, 1, 128]
    - [43, 3520.75]
  - - [1856, 5888, 1, 128]
    - [43, 2911.5]
  - - [2944, 5888, 1, 256]
    - [48, 35230.0]
  - - [3584, 1856, 1, 256]
    - [56, 31889.3]
  - - [4288, 3584, 1, 1280]
    - [44, 36951.1]
  - - [2368, 448, 1, 256]
    - [46, 23015.4]
  - - [4288, 256, 1, 3328]
    - [47, 26438.3]
  - - [1856, 704, 1, 128]
    - [43, 699.022]
  - - [1408, 64, 1, 256]
    - [46, 4846.36]
  - - [64, 1856, 1, 128]
    - [1, 2203.53]
  - - [4, 256, 1, 128]
    - [60, 24.0941]
  - - [704, 4288, 1, 3328]
    - [44, 34229.7]
  - - [704, 5888, 1, 128]
    - [43, 1802.49]
  - - [6784, 3584, 1, 128]
    - [43, 3439.17]
  - - [1024, 64, 1, 256]
    - [46, 3554.49]
  - - [64, 2368, 1, 256]
    - [47, 7697.88]
  - - [4288, 5056, 1, 3328]
    - [45, 37751.1]
  - - [4, 1856, 1, 1280]
    - [64, 1298.19]
  - - [4288, 128, 1, 128]
    - [1, 3443.85]
  - - [1408, 1408, 1, 128]
    - [43, 943.539]
  - - [1024, 128, 1, 3328]
    - [35, 18609.5]
  - - [1856, 128, 1, 128]
    - [1, 2836.63]
  - - [5056, 2368, 1, 256]
    - [44, 33942.3]
  - - [4288, 704, 1, 3328]
    - [47, 32193.8]
  - - [448, 3584, 1, 256]
    - [47, 25884.2]
  - - [64, 128, 1, 128]
    - [1, 207.228]
  - - [2368, 64, 1, 1280]
    - [10, 13305.0]
  - - [2368, 1024, 1, 1280]
    - [44, 32037.4]
  - - [2944, 1408, 1, 3328]
    - [44, 35911.6]
  - - [1408, 448, 1, 256]
    - [47, 20084.7]
  - - [1024, 1408, 1, 3328]
    - [45, 30449.9]
  - - [2944, 5888, 1, 1280]
    - [45, 36730.0]
  - - [1408, 4, 1, 1280]
    - [68, 998.471]
  - - [5888, 3584, 1, 256]
    - [48, 35396.8]
  - - [128, 1024, 1, 1280]
    - [12, 12372.6]
  - - [1408, 1856, 1, 3328]
    - [47, 33113.4]
  - - [4, 4, 1, 3328]
    - [71, 13.312]
  - - [6784, 1408, 1, 1280]
    - [44, 36010.8]
  - - [4, 1024, 1, 1280]
    - [66, 789.59]
  - - [704, 2944, 1, 256]
    - [54, 29443.9]
  - - [704, 4288, 1, 128]
    - [43, 1449.04]
  - - [2368, 4288, 1, 128]
    - [43, 2785.37]
  - - [64, 4288, 1, 1280]
    - [18, 14859.3]
  - - [6784, 64, 1, 1280]
    - [47, 21742.8]
  - - [3584, 128, 1, 128]
    - [1, 3558.8]
  - - [1024, 6784, 1, 128]
    - [43, 1978.18]
  - - [4, 1856, 1, 128]
    - [60, 102.181]
  - - [1408, 64, 1, 3328]
    - [8, 14787.6]
  - - [6784, 4, 1, 256]
    - [63, 1908.47]
  - - [1408, 1408, 1, 1280]
    - [44, 31791.0]
  - - [256, 2368, 1, 256]
    - [53, 19112.0]
  - - [448, 4288, 1, 3328]
    - [44, 31241.1]
  - - [2368, 1408, 1, 256]
    - [47, 30858.3]
  - - [5888, 5056, 1, 128]
    - [43, 3766.53]
  - - [704, 2368, 1, 256]
    - [53, 26840.9]
  - - [2944, 448, 1, 1280]
    - [44, 27406.0]
  - - [5888, 2368, 1, 3328]
    - [44, 36138.3]
  - - [64, 2944, 1, 1280]
    - [12, 14355.5]
  - - [448, 1856, 1, 1280]
    - [47, 24478.0]
  - - [4288, 448, 1, 1280]
    - [47, 29797.8]
  - - [5888, 704, 1, 3328]
    - [50, 33502.7]
  - - [5056, 256, 1, 128]
    - [43, 629.656]
  - - [1856, 256, 1, 128]
    - [43, 284.433]
  - - [5056, 128, 1, 256]
    - [47, 20057.5]
  - - [704, 4, 1, 256]
    - [64, 400.498]
  - - [1408, 5888, 1, 128]
    - [43, 2456.5]
  - - [4288, 4, 1, 128]
    - [60, 305.774]
  - - [1408, 1024, 1, 256]
    - [45, 26746.3]
  - - [1024, 1856, 1, 128]
    - [43, 837.244]
  - - [256, 704, 1, 128]
    - [43, 105.927]
  - - [256, 1024, 1, 128]
    - [43, 183.498]
  - - [448, 1024, 1, 256]
    - [53, 18523.7]
  - - [128, 4, 1, 3328]
    - [71, 368.817]
  - - [5056, 6784, 1, 1280]
    - [44, 37818.8]
  - - [704, 5056, 1, 3328]
    - [45, 34902.1]
  - - [64, 1408, 1, 1280]
    - [8, 10100.1]
  - - [3584, 5056, 1, 3328]
    - [45, 37435.1]
  - - [1856, 4, 1, 3328]
    - [71, 1787.78]
  - - [4, 2944, 1, 128]
    - [60, 276.067]
  - - [2368, 2944, 1, 3328]
    - [44, 35588.4]
  - - [448, 448, 1, 1280]
    - [10, 14764.4]
  - - [2368, 3584, 1, 256]
    - [48, 33435.7]
  - - [1024, 256, 1, 1280]
    - [59, 18001.3]
  - - [5056, 3584, 1, 1280]
    - [44, 37384.0]
  - - [448, 4, 1, 3328]
    - [69, 869.355]
  - - [1856, 2944, 1, 1280]
    - [44, 34816.8]
  - - [3584, 2368, 1, 1280]
    - [45, 34880.7]
  - - [128, 1024, 1, 256]
    - [47, 6875.91]
  - - [2944, 1408, 1, 256]
    - [48, 32550.9]
  - - [4288, 1408, 1, 3328]
    - [44, 35791.8]
  - - [3584, 64, 1, 3328]
    - [12, 19715.0]
  - - [1408, 128, 1, 256]
    - [47, 9493.28]
  - - [2944, 1024, 1, 128]
    - [43, 1380.5]
  - - [4288, 5056, 1, 1280]
    - [44, 37343.3]
  - - [5888, 6784, 1, 1280]
    - [45, 37613.4]
  - - [6784, 5056, 1, 128]
    - [43, 3904.1]
  - - [256, 1024, 1, 3328]
    - [58, 19711.1]
  - - [3584, 4, 1, 256]
    - [64, 1329.72]
  - - [1856, 64, 1, 3328]
    - [9, 18234.0]
  - - [64, 6784, 1, 128]
    - [1, 3380.45]
  - - [5888, 1408, 1, 3328]
    - [44, 37078.5]
  - - [5888, 64, 1, 1280]
    - [47, 18975.0]
  - - [256, 5056, 1, 256]
    - [52, 26508.0]
  - - [128, 3584, 1, 128]
    - [1, 3567.45]
  - - [448, 3584, 1, 3328]
    - [47, 28562.9]
  - - [704, 2368, 1, 128]
    - [43, 831.393]
  - - [5888, 256, 1, 128]
    - [43, 839.007]
  - - [4, 5056, 1, 128]
    - [60, 352.68]
  - - [448, 256, 1, 256]
    - [46, 6220.37]
  - - [704, 4, 1, 3328]
    - [70, 1159.86]
  - - [1408, 256, 1, 256]
    - [47, 14835.2]
  - - [3584, 1856, 1, 128]
    - [43, 2202.85]
  - - [4288, 4288, 1, 128]
    - [43, 3327.48]
  - - [1856, 1024, 1, 3328]
    - [51, 31011.1]
  - - [128, 5888, 1, 3328]
    - [53, 28770.3]
  - - [1024, 5056, 1, 256]
    - [56, 30525.1]
  - - [2368, 1408, 1, 3328]
    - [47, 32908.3]
  - - [5888, 448, 1, 256]
    - [46, 28444.9]
  - - [5888, 6784, 1, 128]
    - [43, 3793.65]
  - - [2368, 4, 1, 3328]
    - [69, 1975.11]
  - - [6784, 5056, 1, 1280]
    - [45, 37203.5]
  - - [5056, 704, 1, 1280]
    - [47, 32464.5]
  - - [1408, 256, 1, 1280]
    - [53, 18425.5]
  - - [4288, 6784, 1, 1280]
    - [44, 37700.9]
  - - [128, 704, 1, 256]
    - [46, 4826.08]
  - - [1024, 1024, 1, 128]
    - [43, 710.147]
  - - [448, 128, 1, 1280]
    - [8, 8322.03]
  - - [6784, 4, 1, 3328]
    - [66, 2559.77]
  - - [4288, 4, 1, 1280]
    - [64, 2063.4]
  - - [1024, 64, 1, 3328]
    - [14, 13282.8]
  - - [1856, 4, 1, 256]
    - [64, 979.662]
  - - [64, 3584, 1, 1280]
    - [59, 15583.9]
  - - [6784, 1408, 1, 256]
    - [44, 33924.5]
  - - [3584, 5888, 1, 128]
    - [43, 3628.41]
  - - [5056, 5888, 1, 256]
    - [48, 36304.5]
  - - [2368, 1024, 1, 256]
    - [44, 29198.4]
  - - [2944, 1856, 1, 256]
    - [52, 32215.6]
  - - [1856, 6784, 1, 1280]
    - [44, 36051.8]
  - - [64, 5056, 1, 128]
    - [1, 3266.46]
  - - [5888, 64, 1, 128]
    - [2, 3321.94]
  - - [448, 704, 1, 128]
    - [43, 207.88]
  - - [4, 1024, 1, 128]
    - [60, 95.6752]
  - - [4288, 3584, 1, 256]
    - [48, 35183.8]
  - - [1408, 704, 1, 128]
    - [43, 426.451]
  - - [64, 256, 1, 3328]
    - [27, 6815.74]
  - - [5056, 1856, 1, 1280]
    - [44, 35365.2]
  - - [1408, 1024, 1, 3328]
    - [44, 30616.9]
  - - [2368, 256, 1, 3328]
    - [47, 23317.8]
  - - [5888, 3584, 1, 1280]
    - [45, 37038.3]
  - - [1856, 3584, 1, 3328]
    - [44, 36430.8]
  - - [5888, 128, 1, 1280]
    - [53, 27816.9]
  - - [1024, 2944, 1, 256]
    - [52, 28063.7]
  - - [448, 6784, 1, 1280]
    - [45, 33857.4]
  - - [256, 3584, 1, 1280]
    - [53, 26923.5]
  - - [448, 128, 1, 128]
    - [1, 1256.85]
  - - [704, 5056, 1, 256]
    - [44, 30972.6]
  - - [2944, 1856, 1, 1280]
    - [44, 34685.6]
  - - [128, 256, 1, 128]
    - [1, 797.396]
  - - [5056, 256, 1, 256]
    - [46, 27339.1]
  - - [2368, 3584, 1, 3328]
    - [44, 35905.2]
  - - [3584, 5888, 1, 3328]
    - [45, 37373.6]
  - - [128, 4, 1, 256]
    - [64, 86.2316]
  - - [2944, 3584, 1, 1280]
    - [44, 35915.5]
  - - [1856, 5888, 1, 1280]
    - [44, 37196.2]
  - - [256, 256, 1, 1280]
    - [36, 8719.97]
  - - [5056, 448, 1, 3328]
    - [47, 31828.3]
  - - [4288, 1408, 1, 256]
    - [44, 33068.1]
  - - [3584, 64, 1, 256]
    - [47, 10754.6]
  - - [64, 1856, 1, 3328]
    - [15, 17855.2]
  - - [256, 1408, 1, 128]
    - [43, 174.975]
  - - [5888, 1408, 1, 128]
    - [43, 2422.96]
  - - [4288, 2368, 1, 1280]
    - [44, 36252.1]
  - - [4, 4288, 1, 256]
    - [64, 1407.34]
  - - [256, 4288, 1, 128]
    - [43, 614.544]
  - - [256, 128, 1, 3328]
    - [30, 9449.9]
  - - [6784, 2368, 1, 256]
    - [48, 34414.4]
  - - [5888, 128, 1, 128]
    - [2, 3893.02]
  - - [4288, 1856, 1, 256]
    - [44, 33020.8]
  - - [1856, 256, 1, 3328]
    - [47, 24964.5]
  - - [1856, 2944, 1, 256]
    - [44, 32424.7]
  - - [5056, 1024, 1, 128]
    - [43, 2252.55]
  - - [64, 5888, 1, 1280]
    - [47, 19110.3]
  - - [6784, 256, 1, 128]
    - [43, 877.124]
  - - [5888, 704, 1, 128]
    - [43, 1431.91]
  - - [6784, 64, 1, 128]
    - [1, 3388.69]
  - - [1024, 4288, 1, 1280]
    - [45, 32171.6]
  - - [2368, 5056, 1, 3328]
    - [44, 36156.9]
  - - [448, 4, 1, 128]
    - [60, 42.9553]
  - - [4, 256, 1, 3328]
    - [70, 569.878]
  - - [4288, 1024, 1, 3328]
    - [45, 34209.6]
  - - [1024, 5056, 1, 3328]
    - [57, 35576.1]
  - - [1024, 1856, 1, 3328]
    - [51, 30817.6]
  - - [704, 704, 1, 1280]
    - [47, 25154.2]
  - - [128, 2368, 1, 1280]
    - [47, 15656.7]
  - - [1408, 128, 1, 3328]
    - [18, 19360.4]
  - - [3584, 256, 1, 1280]
    - [53, 26849.7]
  - - [4, 128, 1, 128]
    - [60, 12.2269]
  - - [704, 6784, 1, 128]
    - [43, 2082.44]
  - - [3584, 128, 1, 1280]
    - [47, 23063.7]
  - - [4, 256, 1, 1280]
    - [69, 287.439]
  - - [128, 704, 1, 3328]
    - [26, 14890.4]
  - - [4288, 6784, 1, 256]
    - [48, 36199.6]
  - - [3584, 2944, 1, 3328]
    - [45, 36040.2]
  - - [128, 1856, 1, 256]
    - [47, 11832.2]
  - - [64, 4288, 1, 256]
    - [47, 10943.1]
  - - [4, 3584, 1, 3328]
    - [5, 2347.94]
  - - [64, 4, 1, 3328]
    - [71, 192.753]
  - - [4, 64, 1, 3328]
    - [71, 192.753]
  - - [5888, 2944, 1, 256]
    - [48, 35269.2]
  - - [2368, 6784, 1, 128]
    - [43, 3158.52]
  - - [448, 4288, 1, 1280]
    - [45, 30698.0]
  - - [448, 1856, 1, 3328]
    - [49, 25331.3]
  - - [4, 1024, 1, 256]
    - [64, 563.751]
  - - [5056, 4288, 1, 256]
    - [48, 35573.1]
  - - [1024, 448, 1, 256]
    - [47, 17528.4]
  - - [1024, 3584, 1, 256]
    - [56, 29619.3]
  - - [2944, 128, 1, 1280]
    - [47, 19110.3]
  - - [1856, 5056, 1, 128]
    - [43, 2654.23]
  - - [64, 256, 1, 256]
    - [22, 1064.54]
  - - [1408, 4, 1, 128]
    - [60, 131.072]
  - - [128, 2368, 1, 128]
    - [1, 3054.91]
  - - [256, 704, 1, 1280]
    - [58, 12592.1]
  - - [64, 2368, 1, 128]
    - [3, 2204.39]
  - - [6784, 6784, 1, 3328]
    - [44, 38338.4]
  - - [448, 5888, 1, 1280]
    - [47, 30173.5]
  - - [5056, 448, 1, 128]
    - [43, 921.353]
  - - [3584, 2944, 1, 128]
    - [43, 2524.33]
  - - [6784, 256, 1, 1280]
    - [47, 30443.5]
  - - [256, 2944, 1, 1280]
    - [53, 27929.6]
  - - [64, 4288, 1, 128]
    - [1, 2779.06]
  - - [2368, 5888, 1, 3328]
    - [44, 37502.3]
  - - [4, 64, 1, 256]
    - [64, 45.5111]
  - - [704, 1024, 1, 3328]
    - [47, 27400.0]
  - - [2368, 1856, 1, 1280]
    - [44, 33779.3]
  - - [128, 448, 1, 128]
    - [1, 1278.75]
  - - [128, 6784, 1, 256]
    - [47, 21922.9]
  - - [3584, 4288, 1, 128]
    - [43, 3021.61]
  - - [64, 448, 1, 128]
    - [1, 653.028]
  - - [5888, 4288, 1, 3328]
    - [44, 37546.1]
  - - [2368, 704, 1, 256]
    - [47, 27113.8]
  - - [256, 1856, 1, 3328]
    - [53, 25211.3]
  - - [1856, 128, 1, 256]
    - [47, 12163.5]
  - - [6784, 128, 1, 128]
    - [2, 3949.86]
  - - [3584, 1408, 1, 128]
    - [43, 2143.08]
  - - [1856, 5056, 1, 1280]
    - [44, 35170.5]
  - - [2944, 1024, 1, 1280]
    - [45, 33718.6]
  - - [5056, 4, 1, 256]
    - [64, 1617.92]
  - - [2368, 4288, 1, 256]
    - [48, 33979.3]
  - - [1024, 2368, 1, 3328]
    - [45, 32028.3]
  - - [64, 704, 1, 3328]
    - [25, 10850.0]
  - - [704, 1408, 1, 256]
    - [47, 25893.4]
  - - [6784, 1856, 1, 3328]
    - [44, 36538.0]
  - - [1024, 2944, 1, 128]
    - [43, 1485.97]
  - - [1024, 3584, 1, 1280]
    - [45, 33684.4]
  - - [4288, 5888, 1, 3328]
    - [44, 37781.5]
  - - [4288, 4, 1, 3328]
    - [66, 2388.36]
  - - [256, 1408, 1, 256]
    - [53, 14600.4]
  - - [448, 2944, 1, 1280]
    - [44, 27675.5]
  - - [4, 5888, 1, 128]
    - [60, 410.716]
  - - [1024, 2944, 1, 3328]
    - [45, 33649.0]
  - - [3584, 6784, 1, 256]
    - [54, 35426.0]
  - - [256, 6784, 1, 1280]
    - [53, 30318.9]
  - - [1856, 3584, 1, 256]
    - [44, 33481.9]
  - - [128, 448, 1, 3328]
    - [21, 12672.0]
  - - [6784, 1856, 1, 128]
    - [43, 3034.8]
  - - [4, 448, 1, 256]
    - [64, 279.727]
  - - [2944, 704, 1, 128]
    - [43, 959.041]
  - - [256, 5888, 1, 1280]
    - [45, 31341.5]
  - - [4, 128, 1, 1280]
    - [69, 159.068]
  - - [4288, 6784, 1, 3328]
    - [44, 38085.1]
  - - [6784, 128, 1, 1280]
    - [47, 25422.9]
  - - [64, 1408, 1, 256]
    - [47, 4826.08]
  - - [2368, 1408, 1, 128]
    - [43, 1641.55]
  - - [1856, 448, 1, 256]
    - [47, 21944.4]
  - - [1408, 1024, 1, 128]
    - [43, 631.154]
  - - [128, 64, 1, 128]
    - [1, 177.124]
  - - [6784, 3584, 1, 3328]
    - [45, 37890.1]
  - - [2944, 64, 1, 3328]
    - [18, 20149.4]
  - - [64, 64, 1, 128]
    - [1, 89.1646]
  - - [2368, 5056, 1, 1280]
    - [45, 35742.5]
  - - [64, 4, 1, 1280]
    - [69, 85.3333]
  - - [1408, 2368, 1, 1280]
    - [47, 32513.4]
  - - [128, 1408, 1, 1280]
    - [12, 14117.9]
  - - [256, 64, 1, 3328]
    - [19, 6429.95]
  - - [2944, 4288, 1, 128]
    - [43, 3125.57]
  - - [2944, 2944, 1, 256]
    - [44, 33968.0]
  - - [2944, 4, 1, 1280]
    - [64, 1847.22]
  - - [5888, 4, 1, 256]
    - [63, 1732.56]
  - - [6784, 256, 1, 256]
    - [47, 27580.4]
  - - [256, 5056, 1, 3328]
    - [53, 30905.1]
  - - [128, 4288, 1, 1280]
    - [47, 20602.5]
  - - [5056, 1856, 1, 128]
    - [43, 2489.73]
  - - [5888, 1408, 1, 256]
    - [54, 34175.8]
  - - [128, 128, 1, 256]
    - [53, 979.978]
  - - [5056, 4, 1, 3328]
    - [64, 2549.45]
  - - [4288, 3584, 1, 3328]
    - [44, 37316.6]
  - - [448, 704, 1, 3328]
    - [47, 16794.0]
  - - [448, 448, 1, 128]
    - [2, 2484.54]
  - - [1024, 2368, 1, 1280]
    - [45, 30785.4]
  - - [1856, 704, 1, 3328]
    - [47, 31351.4]
  - - [4, 2368, 1, 128]
    - [60, 223.698]
  - - [5888, 6784, 1, 3328]
    - [45, 38084.2]
  - - [704, 4288, 1, 1280]
    - [44, 33600.0]
  - - [704, 256, 1, 256]
    - [52, 9493.28]
  - - [6784, 448, 1, 3328]
    - [47, 32455.9]
  - - [4288, 1024, 1, 128]
    - [43, 1518.69]
- null
