library/src/blas3/Tensile/Logic/asm_full/arcturus_Cijk_Ailk_Bljk_DB.yaml
- {MinimumRequiredVersion: 4.7.2}
- arcturus
- gfx908
- [Device 7380, Device 7388, Device 738c, Device 7390]
    SolutionIndex: 1
    SolutionNameMin: Cijk_Ailk_Bljk_DB_MT064x064x04_PK00_PLR1_SU32_TT04_04_WG16_16_01_WGM08
    SolutionIndex: 2
    SolutionNameMin: Cijk_Ailk_Bljk_DB_MT096x096x04_PK02_PLR0_SU32_TT06_06_WG16_16_01_WGM01
    SolutionIndex: 3
    SolutionNameMin: Cijk_Ailk_Bljk_DB_MT128x064x04_PK00_PLR1_SU32_TT08_04_WG16_16_01_WGM01
    SolutionIndex: 4
    SolutionNameMin: Cijk_Ailk_Bljk_DB_MT128x064x04_PK02_PLR1_SU32_TT08_04_WG16_16_01_WGM01
    SolutionIndex: 5
    SolutionNameMin: Cijk_Ailk_Bljk_DB_MT128x064x04_PK04_PLR1_SU32_TT08_04_WG16_16_01_WGM01
    SolutionIndex: 6
    SolutionNameMin: Cijk_Ailk_Bljk_DB_MT128x064x04_PK00_PLR1_SU32_TT08_04_WG16_16_01_WGM08
    SolutionIndex: 7
    SolutionNameMin: Cijk_Ailk_Bljk_DB_MT128x064x04_PK04_PLR1_SU32_TT08_04_WG16_16_01_WGM08
    SolutionIndex: 8
    SolutionNameMin: Cijk_Ailk_Bljk_DB_MT064x064x08_PK00_PLR1_SU00_TT04_04_WG16_16_01_WGM01
    SolutionIndex: 9
    SolutionNameMin: Cijk_Ailk_Bljk_DB_MT064x064x08_PK04_PLR1_SU32_TT04_04_WG16_16_01_WGM01
    SolutionIndex: 10
    SolutionNameMin: Cijk_Ailk_Bljk_DB_MT096x064x08_PK00_PLR1_SU00_TT06_04_WG16_16_01_WGM01
    SolutionIndex: 11
    SolutionNameMin: Cijk_Ailk_Bljk_DB_MT096x064x08_PK02_PLR1_SU00_TT06_04_WG16_16_01_WGM01
    SolutionIndex: 12
    SolutionNameMin: Cijk_Ailk_Bljk_DB_MT096x064x08_PK04_PLR1_SU00_TT06_04_WG16_16_01_WGM01
    SolutionIndex: 13
    SolutionNameMin: Cijk_Ailk_Bljk_DB_MT096x064x08_PK00_PLR1_SU32_TT06_04_WG16_16_01_WGM01
    SolutionIndex: 14
    SolutionNameMin: Cijk_Ailk_Bljk_DB_MT096x064x08_PK02_PLR1_SU32_TT06_04_WG16_16_01_WGM01
    SolutionIndex: 15
    SolutionNameMin: Cijk_Ailk_Bljk_DB_MT096x064x08_PK04_PLR1_SU32_TT06_04_WG16_16_01_WGM01
    SolutionIndex: 16
    SolutionNameMin: Cijk_Ailk_Bljk_DB_MT064x096x08_PK00_PLR1_SU32_TT04_06_WG16_16_01_WGM01
    SolutionIndex: 17
    SolutionNameMin: Cijk_Ailk_Bljk_DB_MT064x096x08_PK02_PLR1_SU32_TT04_06_WG16_16_01_WGM01
    SolutionIndex: 18
    SolutionNameMin: Cijk_Ailk_Bljk_DB_MT128x064x08_PK00_PLR0_SU00_TT08_04_WG16_16_01_WGM01
    SolutionIndex: 19
    SolutionNameMin: Cijk_Ailk_Bljk_DB_MT128x064x08_PK00_PLR0_SU32_TT08_04_WG16_16_01_WGM01
    SolutionIndex: 20
    SolutionNameMin: Cijk_Ailk_Bljk_DB_MT128x128x08_PK02_PLR1_SU00_TT08_04_WG16_32_01_WGM01
    SolutionIndex: 21
    SolutionNameMin: Cijk_Ailk_Bljk_DB_MT128x128x08_PK04_PLR1_SU00_TT08_04_WG16_32_01_WGM01
    SolutionIndex: 22
    SolutionNameMin: Cijk_Ailk_Bljk_DB_MT128x128x08_PK02_PLR1_SU32_TT08_04_WG16_32_01_WGM01
    SolutionIndex: 23
    SolutionNameMin: Cijk_Ailk_Bljk_DB_MT128x128x08_PK04_PLR1_SU32_TT08_04_WG16_32_01_WGM01
    SolutionIndex: 24
    SolutionNameMin: Cijk_Ailk_Bljk_DB_MT064x064x08_PK00_PLR1_SU32_TT04_04_WG16_16_01_WGM08
    SolutionIndex: 25
    SolutionNameMin: Cijk_Ailk_Bljk_DB_MT096x064x08_PK02_PLR1_SU00_TT06_04_WG16_16_01_WGM08
    SolutionIndex: 26
    SolutionNameMin: Cijk_Ailk_Bljk_DB_MT096x064x08_PK04_PLR1_SU00_TT06_04_WG16_16_01_WGM08
    SolutionIndex: 27
    SolutionNameMin: Cijk_Ailk_Bljk_DB_MT096x064x08_PK00_PLR1_SU32_TT06_04_WG16_16_01_WGM08
    SolutionIndex: 28
    SolutionNameMin: Cijk_Ailk_Bljk_DB_MT096x064x08_PK02_PLR1_SU32_TT06_04_WG16_16_01_WGM08
    SolutionIndex: 29
    SolutionNameMin: Cijk_Ailk_Bljk_DB_MT096x064x08_PK04_PLR1_SU32_TT06_04_WG16_16_01_WGM08
    SolutionIndex: 30
    SolutionNameMin: Cijk_Ailk_Bljk_DB_MT128x128x08_PK02_PLR1_SU32_TT08_04_WG16_32_01_WGM08
    SolutionIndex: 31
    SolutionNameMin: Cijk_Ailk_Bljk_DB_MT128x064x04_NLCA01_NLCB01_TT08_04_WG16_16_01
    SolutionIndex: 32
    SolutionNameMin: Cijk_Ailk_Bljk_DB_MT064x032x08_NLCA01_NLCB01_TT04_04_WG16_08_01
    SolutionIndex: 33
    SolutionNameMin: Cijk_Ailk_Bljk_DB_MT032x064x08_NLCA01_NLCB01_TT04_04_WG08_16_01
    SolutionIndex: 34
    SolutionNameMin: Cijk_Ailk_Bljk_DB_MT032x096x08_NLCA01_NLCB01_TT04_06_WG08_16_01
    SolutionIndex: 35
    SolutionNameMin: Cijk_Ailk_Bljk_DB_MT064x064x08_NLCA01_NLCB01_TT04_04_WG16_16_01
    SolutionIndex: 36
    SolutionNameMin: Cijk_Ailk_Bljk_DB_MT128x128x08_NLCA01_NLCB01_TT08_04_WG16_32_01
    SolutionIndex: 37
    SolutionNameMin: Cijk_Ailk_Bljk_DB_MT064x032x04_PK00_PLR1_SU00_SNLL1_TT04_04_WG16_08_01_WGM01
    SolutionIndex: 38
    SolutionNameMin: Cijk_Ailk_Bljk_DB_MT064x032x04_PK00_PLR0_SU00_SNLL1_TT04_04_WG16_08_01_WGM01
    SolutionIndex: 39
    SolutionNameMin: Cijk_Ailk_Bljk_DB_MT064x032x04_PK04_PLR1_SU00_SNLL1_TT04_04_WG16_08_01_WGM01
    SolutionIndex: 40
    SolutionNameMin: Cijk_Ailk_Bljk_DB_MT064x032x04_PK00_PLR1_SU00_SNLL0_TT04_04_WG16_08_01_WGM01
    SolutionIndex: 41
    SolutionNameMin: Cijk_Ailk_Bljk_DB_MT064x032x04_PK00_PLR0_SU00_SNLL0_TT04_04_WG16_08_01_WGM01
    SolutionIndex: 42
    SolutionNameMin: Cijk_Ailk_Bljk_DB_MT064x032x04_PK04_PLR1_SU00_SNLL0_TT04_04_WG16_08_01_WGM01
    SolutionIndex: 43
    SolutionNameMin: Cijk_Ailk_Bljk_DB_MT064x032x04_PK00_PLR1_SU32_SNLL1_TT04_04_WG16_08_01_WGM01
    SolutionIndex: 44
    SolutionNameMin: Cijk_Ailk_Bljk_DB_MT064x032x04_PK00_PLR0_SU32_SNLL1_TT04_04_WG16_08_01_WGM01
    SolutionIndex: 45
    SolutionNameMin: Cijk_Ailk_Bljk_DB_MT064x032x04_PK00_PLR1_SU32_SNLL0_TT04_04_WG16_08_01_WGM01
    SolutionIndex: 46
    SolutionNameMin: Cijk_Ailk_Bljk_DB_MT064x032x04_PK00_PLR0_SU32_SNLL0_TT04_04_WG16_08_01_WGM01
    SolutionIndex: 47
    SolutionNameMin: Cijk_Ailk_Bljk_DB_MT096x032x04_PK00_PLR1_SU00_SNLL1_TT06_04_WG16_08_01_WGM01
    SolutionIndex: 48
    SolutionNameMin: Cijk_Ailk_Bljk_DB_MT096x032x04_PK00_PLR1_SU00_SNLL0_TT06_04_WG16_08_01_WGM01
    SolutionIndex: 49
    SolutionNameMin: Cijk_Ailk_Bljk_DB_MT096x032x04_PK00_PLR1_SU32_SNLL1_TT06_04_WG16_08_01_WGM01
    SolutionIndex: 50
    SolutionNameMin: Cijk_Ailk_Bljk_DB_MT096x032x04_PK00_PLR1_SU32_SNLL0_TT06_04_WG16_08_01_WGM01
    SolutionIndex: 51
    SolutionNameMin: Cijk_Ailk_Bljk_DB_MT064x048x04_PK00_PLR1_SU00_SNLL1_TT04_06_WG16_08_01_WGM01
    SolutionIndex: 52
    SolutionNameMin: Cijk_Ailk_Bljk_DB_MT064x048x04_PK00_PLR0_SU00_SNLL1_TT04_06_WG16_08_01_WGM01
    SolutionIndex: 53
    SolutionNameMin: Cijk_Ailk_Bljk_DB_MT064x048x04_PK00_PLR1_SU00_SNLL0_TT04_06_WG16_08_01_WGM01
    SolutionIndex: 54
    SolutionNameMin: Cijk_Ailk_Bljk_DB_MT064x048x04_PK00_PLR0_SU00_SNLL0_TT04_06_WG16_08_01_WGM01
    SolutionIndex: 55
    SolutionNameMin: Cijk_Ailk_Bljk_DB_MT064x048x04_PK04_PLR1_SU00_SNLL0_TT04_06_WG16_08_01_WGM01
    SolutionIndex: 56
    SolutionNameMin: Cijk_Ailk_Bljk_DB_MT064x048x04_PK00_PLR1_SU32_SNLL1_TT04_06_WG16_08_01_WGM01
    SolutionIndex: 57
    SolutionNameMin: Cijk_Ailk_Bljk_DB_MT064x048x04_PK00_PLR0_SU32_SNLL1_TT04_06_WG16_08_01_WGM01
    SolutionIndex: 58
    SolutionNameMin: Cijk_Ailk_Bljk_DB_MT064x048x04_PK04_PLR1_SU32_SNLL1_TT04_06_WG16_08_01_WGM01
    SolutionIndex: 59
    SolutionNameMin: Cijk_Ailk_Bljk_DB_MT064x048x04_PK00_PLR1_SU32_SNLL0_TT04_06_WG16_08_01_WGM01
    SolutionIndex: 60
    SolutionNameMin: Cijk_Ailk_Bljk_DB_MT064x048x04_PK00_PLR0_SU32_SNLL0_TT04_06_WG16_08_01_WGM01
    SolutionIndex: 61
    SolutionNameMin: Cijk_Ailk_Bljk_DB_MT064x048x04_PK04_PLR1_SU32_SNLL0_TT04_06_WG16_08_01_WGM01
    SolutionIndex: 62
    SolutionNameMin: Cijk_Ailk_Bljk_DB_MT128x032x04_PK00_PLR0_SU32_SNLL1_TT08_04_WG16_08_01_WGM01
    SolutionIndex: 63
    SolutionNameMin: Cijk_Ailk_Bljk_DB_MT128x032x04_PK04_PLR0_SU32_SNLL1_TT08_04_WG16_08_01_WGM01
    SolutionIndex: 64
    SolutionNameMin: Cijk_Ailk_Bljk_DB_MT128x032x04_PK00_PLR0_SU32_SNLL0_TT08_04_WG16_08_01_WGM01
    SolutionIndex: 65
    SolutionNameMin: Cijk_Ailk_Bljk_DB_MT064x064x04_PK00_PLR0_SU32_SNLL1_TT04_08_WG16_08_01_WGM01
    SolutionIndex: 66
    SolutionNameMin: Cijk_Ailk_Bljk_DB_MT064x064x04_PK00_PLR1_SU32_SNLL0_TT04_08_WG16_08_01_WGM01
    SolutionIndex: 67
    SolutionNameMin: Cijk_Ailk_Bljk_DB_MT032x064x04_PK00_PLR1_SU00_SNLL1_TT04_04_WG08_16_01_WGM01
    SolutionIndex: 68
    SolutionNameMin: Cijk_Ailk_Bljk_DB_MT096x064x04_PK00_PLR1_SU32_SNLL1_TT06_04_WG16_16_01_WGM01
    SolutionIndex: 69
    SolutionNameMin: Cijk_Ailk_Bljk_DB_MT096x064x04_PK00_PLR0_SU32_SNLL1_TT06_04_WG16_16_01_WGM01
    SolutionIndex: 70
    SolutionNameMin: Cijk_Ailk_Bljk_DB_MT096x064x04_PK00_PLR0_SU32_SNLL0_TT06_04_WG16_16_01_WGM01
    SolutionIndex: 71
    SolutionNameMin: Cijk_Ailk_Bljk_DB_MT096x064x04_PK04_PLR0_SU32_SNLL0_TT06_04_WG16_16_01_WGM01
    SolutionIndex: 72
    SolutionNameMin: Cijk_Ailk_Bljk_DB_MT128x064x04_PK00_PLR1_SU32_SNLL1_TT08_04_WG16_16_01_WGM01
    SolutionIndex: 73
    SolutionNameMin: Cijk_Ailk_Bljk_DB_MT128x064x04_PK00_PLR1_SU32_SNLL0_TT08_04_WG16_16_01_WGM01
    SolutionIndex: 74
    SolutionNameMin: Cijk_Ailk_Bljk_DB_MT064x032x04_PK00_PLR1_SU00_SNLL1_TT04_04_WG16_08_01_WGM08
    SolutionIndex: 75
    SolutionNameMin: Cijk_Ailk_Bljk_DB_MT064x032x04_PK00_PLR0_SU00_SNLL1_TT04_04_WG16_08_01_WGM08
    SolutionIndex: 76
    SolutionNameMin: Cijk_Ailk_Bljk_DB_MT064x032x04_PK00_PLR1_SU00_SNLL0_TT04_04_WG16_08_01_WGM08
    SolutionIndex: 77
    SolutionNameMin: Cijk_Ailk_Bljk_DB_MT064x032x04_PK00_PLR0_SU00_SNLL0_TT04_04_WG16_08_01_WGM08
    SolutionIndex: 78
    SolutionNameMin: Cijk_Ailk_Bljk_DB_MT064x032x04_PK00_PLR1_SU32_SNLL1_TT04_04_WG16_08_01_WGM08
    SolutionIndex: 79
    SolutionNameMin: Cijk_Ailk_Bljk_DB_MT064x032x04_PK00_PLR0_SU32_SNLL1_TT04_04_WG16_08_01_WGM08
    SolutionIndex: 80
    SolutionNameMin: Cijk_Ailk_Bljk_DB_MT064x032x04_PK00_PLR1_SU32_SNLL0_TT04_04_WG16_08_01_WGM08
    SolutionIndex: 81
    SolutionNameMin: Cijk_Ailk_Bljk_DB_MT064x032x04_PK00_PLR0_SU32_SNLL0_TT04_04_WG16_08_01_WGM08
    SolutionIndex: 82
    SolutionNameMin: Cijk_Ailk_Bljk_DB_MT064x032x04_PK04_PLR1_SU32_SNLL0_TT04_04_WG16_08_01_WGM08
    SolutionIndex: 83
    SolutionNameMin: Cijk_Ailk_Bljk_DB_MT096x032x04_PK00_PLR1_SU00_SNLL1_TT06_04_WG16_08_01_WGM08
    SolutionIndex: 84
    SolutionNameMin: Cijk_Ailk_Bljk_DB_MT096x032x04_PK00_PLR1_SU00_SNLL0_TT06_04_WG16_08_01_WGM08
    SolutionIndex: 85
    SolutionNameMin: Cijk_Ailk_Bljk_DB_MT096x032x04_PK00_PLR1_SU32_SNLL1_TT06_04_WG16_08_01_WGM08
    SolutionIndex: 86
    SolutionNameMin: Cijk_Ailk_Bljk_DB_MT096x032x04_PK04_PLR1_SU32_SNLL1_TT06_04_WG16_08_01_WGM08
    SolutionIndex: 87
    SolutionNameMin: Cijk_Ailk_Bljk_DB_MT096x032x04_PK00_PLR1_SU32_SNLL0_TT06_04_WG16_08_01_WGM08
    SolutionIndex: 88
    SolutionNameMin: Cijk_Ailk_Bljk_DB_MT096x032x04_PK04_PLR1_SU32_SNLL0_TT06_04_WG16_08_01_WGM08
    SolutionIndex: 89
    SolutionNameMin: Cijk_Ailk_Bljk_DB_MT064x048x04_PK00_PLR1_SU00_SNLL1_TT04_06_WG16_08_01_WGM08
    SolutionIndex: 90
    SolutionNameMin: Cijk_Ailk_Bljk_DB_MT064x048x04_PK00_PLR0_SU00_SNLL1_TT04_06_WG16_08_01_WGM08
    SolutionIndex: 91
    SolutionNameMin: Cijk_Ailk_Bljk_DB_MT064x048x04_PK00_PLR1_SU00_SNLL0_TT04_06_WG16_08_01_WGM08
    SolutionIndex: 92
    SolutionNameMin: Cijk_Ailk_Bljk_DB_MT064x048x04_PK00_PLR0_SU00_SNLL0_TT04_06_WG16_08_01_WGM08
    SolutionIndex: 93
    SolutionNameMin: Cijk_Ailk_Bljk_DB_MT064x048x04_PK00_PLR1_SU32_SNLL1_TT04_06_WG16_08_01_WGM08
    SolutionIndex: 94
    SolutionNameMin: Cijk_Ailk_Bljk_DB_MT064x048x04_PK00_PLR0_SU32_SNLL1_TT04_06_WG16_08_01_WGM08
    SolutionIndex: 95
    SolutionNameMin: Cijk_Ailk_Bljk_DB_MT064x048x04_PK00_PLR1_SU32_SNLL0_TT04_06_WG16_08_01_WGM08
    SolutionIndex: 96
    SolutionNameMin: Cijk_Ailk_Bljk_DB_MT064x048x04_PK00_PLR0_SU32_SNLL0_TT04_06_WG16_08_01_WGM08
    SolutionIndex: 97
    SolutionNameMin: Cijk_Ailk_Bljk_DB_MT128x032x04_PK00_PLR0_SU00_SNLL1_TT08_04_WG16_08_01_WGM08
    SolutionIndex: 98
    SolutionNameMin: Cijk_Ailk_Bljk_DB_MT128x032x04_PK00_PLR0_SU32_SNLL1_TT08_04_WG16_08_01_WGM08
    SolutionIndex: 99
    SolutionNameMin: Cijk_Ailk_Bljk_DB_MT128x032x04_PK04_PLR0_SU32_SNLL1_TT08_04_WG16_08_01_WGM08
    SolutionIndex: 100
    SolutionNameMin: Cijk_Ailk_Bljk_DB_MT128x032x04_PK00_PLR0_SU32_SNLL0_TT08_04_WG16_08_01_WGM08
    SolutionIndex: 101
    SolutionNameMin: Cijk_Ailk_Bljk_DB_MT128x032x04_PK04_PLR0_SU32_SNLL0_TT08_04_WG16_08_01_WGM08
    SolutionIndex: 102
    SolutionNameMin: Cijk_Ailk_Bljk_DB_MT032x064x04_PK00_PLR1_SU00_SNLL1_TT04_04_WG08_16_01_WGM08
    SolutionIndex: 103
    SolutionNameMin: Cijk_Ailk_Bljk_DB_MT096x064x04_PK00_PLR0_SU32_SNLL1_TT06_04_WG16_16_01_WGM08
    SolutionIndex: 104
    SolutionNameMin: Cijk_Ailk_Bljk_DB_MT096x064x04_PK00_PLR0_SU32_SNLL0_TT06_04_WG16_16_01_WGM08
    SolutionIndex: 105
    SolutionNameMin: Cijk_Ailk_Bljk_DB_MT096x064x04_PK04_PLR0_SU32_SNLL0_TT06_04_WG16_16_01_WGM08
    SolutionIndex: 106
    SolutionNameMin: Cijk_Ailk_Bljk_DB_MT128x064x04_PK00_PLR1_SU32_SNLL1_TT08_04_WG16_16_01_WGM08
    SolutionIndex: 107
    SolutionNameMin: Cijk_Ailk_Bljk_DB_MT128x064x04_PK00_PLR1_SU32_SNLL0_TT08_04_WG16_16_01_WGM08
    SolutionIndex: 108
    SolutionNameMin: Cijk_Ailk_Bljk_DB_MT128x064x08_PK00_PLR0_SU00_SNLL1_TT04_04_WG32_16_01_WGM01
    SolutionIndex: 109
    SolutionNameMin: Cijk_Ailk_Bljk_DB_MT128x064x08_PK04_PLR0_SU00_SNLL1_TT04_04_WG32_16_01_WGM01
    SolutionIndex: 110
    SolutionNameMin: Cijk_Ailk_Bljk_DB_MT128x064x08_PK00_PLR0_SU00_SNLL0_TT04_04_WG32_16_01_WGM01
    SolutionIndex: 111
    SolutionNameMin: Cijk_Ailk_Bljk_DB_MT128x064x08_PK02_PLR0_SU00_SNLL0_TT04_04_WG32_16_01_WGM01
    SolutionIndex: 112
    SolutionNameMin: Cijk_Ailk_Bljk_DB_MT128x064x08_PK04_PLR0_SU00_SNLL0_TT04_04_WG32_16_01_WGM01
    SolutionIndex: 113
    SolutionNameMin: Cijk_Ailk_Bljk_DB_MT128x064x08_PK00_PLR0_SU32_SNLL1_TT04_04_WG32_16_01_WGM01
    SolutionIndex: 114
    SolutionNameMin: Cijk_Ailk_Bljk_DB_MT128x064x08_PK02_PLR0_SU32_SNLL1_TT04_04_WG32_16_01_WGM01
    SolutionIndex: 115
    SolutionNameMin: Cijk_Ailk_Bljk_DB_MT128x064x08_PK04_PLR0_SU32_SNLL1_TT04_04_WG32_16_01_WGM01
    SolutionIndex: 116
    SolutionNameMin: Cijk_Ailk_Bljk_DB_MT128x064x08_PK00_PLR0_SU32_SNLL0_TT04_04_WG32_16_01_WGM01
    SolutionIndex: 117
    SolutionNameMin: Cijk_Ailk_Bljk_DB_MT128x064x08_PK02_PLR0_SU32_SNLL0_TT04_04_WG32_16_01_WGM01
    SolutionIndex: 118
    SolutionNameMin: Cijk_Ailk_Bljk_DB_MT128x064x08_PK04_PLR0_SU32_SNLL0_TT04_04_WG32_16_01_WGM01
    SolutionIndex: 119
    SolutionNameMin: Cijk_Ailk_Bljk_DB_MT064x032x08_PK00_PLR1_SU00_SNLL1_TT04_04_WG16_08_01_WGM01
    SolutionIndex: 120
    SolutionNameMin: Cijk_Ailk_Bljk_DB_MT064x032x08_PK00_PLR0_SU00_SNLL1_TT04_04_WG16_08_01_WGM01
    SolutionIndex: 121
    SolutionNameMin: Cijk_Ailk_Bljk_DB_MT064x032x08_PK04_PLR1_SU00_SNLL1_TT04_04_WG16_08_01_WGM01
    SolutionIndex: 122
    SolutionNameMin: Cijk_Ailk_Bljk_DB_MT064x032x08_PK00_PLR1_SU00_SNLL0_TT04_04_WG16_08_01_WGM01
    SolutionIndex: 123
    SolutionNameMin: Cijk_Ailk_Bljk_DB_MT064x032x08_PK04_PLR1_SU00_SNLL0_TT04_04_WG16_08_01_WGM01
    SolutionIndex: 124
    SolutionNameMin: Cijk_Ailk_Bljk_DB_MT064x032x08_PK00_PLR1_SU32_SNLL1_TT04_04_WG16_08_01_WGM01
    SolutionIndex: 125
    SolutionNameMin: Cijk_Ailk_Bljk_DB_MT064x032x08_PK00_PLR0_SU32_SNLL1_TT04_04_WG16_08_01_WGM01
    SolutionIndex: 126
    SolutionNameMin: Cijk_Ailk_Bljk_DB_MT064x032x08_PK04_PLR1_SU32_SNLL1_TT04_04_WG16_08_01_WGM01
    SolutionIndex: 127
    SolutionNameMin: Cijk_Ailk_Bljk_DB_MT064x032x08_PK00_PLR1_SU32_SNLL0_TT04_04_WG16_08_01_WGM01
    SolutionIndex: 128
    SolutionNameMin: Cijk_Ailk_Bljk_DB_MT064x032x08_PK02_PLR1_SU32_SNLL0_TT04_04_WG16_08_01_WGM01
    SolutionIndex: 129
    SolutionNameMin: Cijk_Ailk_Bljk_DB_MT096x032x08_PK00_PLR1_SU00_SNLL1_TT06_04_WG16_08_01_WGM01
    SolutionIndex: 130
    SolutionNameMin: Cijk_Ailk_Bljk_DB_MT096x032x08_PK04_PLR1_SU00_SNLL1_TT06_04_WG16_08_01_WGM01
    SolutionIndex: 131
    SolutionNameMin: Cijk_Ailk_Bljk_DB_MT096x032x08_PK00_PLR1_SU32_SNLL1_TT06_04_WG16_08_01_WGM01
    SolutionIndex: 132
    SolutionNameMin: Cijk_Ailk_Bljk_DB_MT096x032x08_PK00_PLR0_SU32_SNLL1_TT06_04_WG16_08_01_WGM01
    SolutionIndex: 133
    SolutionNameMin: Cijk_Ailk_Bljk_DB_MT064x048x08_PK00_PLR1_SU00_SNLL1_TT04_06_WG16_08_01_WGM01
    SolutionIndex: 134
    SolutionNameMin: Cijk_Ailk_Bljk_DB_MT064x048x08_PK00_PLR1_SU00_SNLL0_TT04_06_WG16_08_01_WGM01
    SolutionIndex: 135
    SolutionNameMin: Cijk_Ailk_Bljk_DB_MT064x048x08_PK04_PLR1_SU00_SNLL0_TT04_06_WG16_08_01_WGM01
    SolutionIndex: 136
    SolutionNameMin: Cijk_Ailk_Bljk_DB_MT064x048x08_PK00_PLR1_SU32_SNLL1_TT04_06_WG16_08_01_WGM01
    SolutionIndex: 137
    SolutionNameMin: Cijk_Ailk_Bljk_DB_MT064x048x08_PK00_PLR1_SU32_SNLL0_TT04_06_WG16_08_01_WGM01
    SolutionIndex: 138
    SolutionNameMin: Cijk_Ailk_Bljk_DB_MT032x064x08_PK00_PLR1_SU00_SNLL1_TT04_04_WG08_16_01_WGM01
    SolutionIndex: 139
    SolutionNameMin: Cijk_Ailk_Bljk_DB_MT064x064x08_PK00_PLR1_SU00_SNLL1_TT04_04_WG16_16_01_WGM01
    SolutionIndex: 140
    SolutionNameMin: Cijk_Ailk_Bljk_DB_MT064x064x08_PK00_PLR1_SU00_SNLL0_TT04_04_WG16_16_01_WGM01
    SolutionIndex: 141
    SolutionNameMin: Cijk_Ailk_Bljk_DB_MT064x064x08_PK00_PLR1_SU32_SNLL1_TT04_04_WG16_16_01_WGM01
    SolutionIndex: 142
    SolutionNameMin: Cijk_Ailk_Bljk_DB_MT064x064x08_PK00_PLR0_SU32_SNLL1_TT04_04_WG16_16_01_WGM01
    SolutionIndex: 143
    SolutionNameMin: Cijk_Ailk_Bljk_DB_MT064x064x08_PK04_PLR1_SU32_SNLL1_TT04_04_WG16_16_01_WGM01
    SolutionIndex: 144
    SolutionNameMin: Cijk_Ailk_Bljk_DB_MT064x064x08_PK04_PLR0_SU32_SNLL1_TT04_04_WG16_16_01_WGM01
    SolutionIndex: 145
    SolutionNameMin: Cijk_Ailk_Bljk_DB_MT064x064x08_PK00_PLR1_SU32_SNLL0_TT04_04_WG16_16_01_WGM01
    SolutionIndex: 146
    SolutionNameMin: Cijk_Ailk_Bljk_DB_MT064x064x08_PK00_PLR0_SU32_SNLL0_TT04_04_WG16_16_01_WGM01
    SolutionIndex: 147
    SolutionNameMin: Cijk_Ailk_Bljk_DB_MT064x064x08_PK04_PLR1_SU32_SNLL0_TT04_04_WG16_16_01_WGM01
    SolutionIndex: 148
    SolutionNameMin: Cijk_Ailk_Bljk_DB_MT064x064x08_PK04_PLR0_SU32_SNLL0_TT04_04_WG16_16_01_WGM01
    SolutionIndex: 149
    SolutionNameMin: Cijk_Ailk_Bljk_DB_MT096x064x08_PK00_PLR1_SU00_SNLL1_TT06_04_WG16_16_01_WGM01
    SolutionIndex: 150
    SolutionNameMin: Cijk_Ailk_Bljk_DB_MT096x064x08_PK00_PLR1_SU00_SNLL0_TT06_04_WG16_16_01_WGM01
    SolutionIndex: 151
    SolutionNameMin: Cijk_Ailk_Bljk_DB_MT096x064x08_PK00_PLR1_SU32_SNLL1_TT06_04_WG16_16_01_WGM01
    SolutionIndex: 152
    SolutionNameMin: Cijk_Ailk_Bljk_DB_MT096x064x08_PK00_PLR1_SU32_SNLL0_TT06_04_WG16_16_01_WGM01
    SolutionIndex: 153
    SolutionNameMin: Cijk_Ailk_Bljk_DB_MT064x096x08_PK00_PLR1_SU00_SNLL1_TT04_06_WG16_16_01_WGM01
    SolutionIndex: 154
    SolutionNameMin: Cijk_Ailk_Bljk_DB_MT064x096x08_PK02_PLR1_SU00_SNLL1_TT04_06_WG16_16_01_WGM01
    SolutionIndex: 155
    SolutionNameMin: Cijk_Ailk_Bljk_DB_MT064x096x08_PK04_PLR1_SU00_SNLL1_TT04_06_WG16_16_01_WGM01
    SolutionIndex: 156
    SolutionNameMin: Cijk_Ailk_Bljk_DB_MT064x096x08_PK00_PLR1_SU00_SNLL0_TT04_06_WG16_16_01_WGM01
    SolutionIndex: 157
    SolutionNameMin: Cijk_Ailk_Bljk_DB_MT064x096x08_PK02_PLR1_SU00_SNLL0_TT04_06_WG16_16_01_WGM01
    SolutionIndex: 158
    SolutionNameMin: Cijk_Ailk_Bljk_DB_MT064x096x08_PK04_PLR1_SU00_SNLL0_TT04_06_WG16_16_01_WGM01
    SolutionIndex: 159
    SolutionNameMin: Cijk_Ailk_Bljk_DB_MT064x096x08_PK00_PLR1_SU32_SNLL1_TT04_06_WG16_16_01_WGM01
    SolutionIndex: 160
    SolutionNameMin: Cijk_Ailk_Bljk_DB_MT064x096x08_PK02_PLR1_SU32_SNLL1_TT04_06_WG16_16_01_WGM01
    SolutionIndex: 161
    SolutionNameMin: Cijk_Ailk_Bljk_DB_MT064x096x08_PK04_PLR1_SU32_SNLL1_TT04_06_WG16_16_01_WGM01
    SolutionIndex: 162
    SolutionNameMin: Cijk_Ailk_Bljk_DB_MT064x096x08_PK00_PLR1_SU32_SNLL0_TT04_06_WG16_16_01_WGM01
    SolutionIndex: 163
    SolutionNameMin: Cijk_Ailk_Bljk_DB_MT064x096x08_PK02_PLR1_SU32_SNLL0_TT04_06_WG16_16_01_WGM01
    SolutionIndex: 164
    SolutionNameMin: Cijk_Ailk_Bljk_DB_MT064x096x08_PK04_PLR1_SU32_SNLL0_TT04_06_WG16_16_01_WGM01
    SolutionIndex: 165
    SolutionNameMin: Cijk_Ailk_Bljk_DB_MT128x064x08_PK04_PLR0_SU00_SNLL1_TT04_04_WG32_16_01_WGM08
    SolutionIndex: 166
    SolutionNameMin: Cijk_Ailk_Bljk_DB_MT128x064x08_PK02_PLR0_SU00_SNLL0_TT04_04_WG32_16_01_WGM08
    SolutionIndex: 167
    SolutionNameMin: Cijk_Ailk_Bljk_DB_MT128x064x08_PK00_PLR0_SU32_SNLL1_TT04_04_WG32_16_01_WGM08
    SolutionIndex: 168
    SolutionNameMin: Cijk_Ailk_Bljk_DB_MT128x064x08_PK02_PLR0_SU32_SNLL1_TT04_04_WG32_16_01_WGM08
    SolutionIndex: 169
    SolutionNameMin: Cijk_Ailk_Bljk_DB_MT128x064x08_PK04_PLR0_SU32_SNLL1_TT04_04_WG32_16_01_WGM08
    SolutionIndex: 170
    SolutionNameMin: Cijk_Ailk_Bljk_DB_MT128x064x08_PK00_PLR0_SU32_SNLL0_TT04_04_WG32_16_01_WGM08
    SolutionIndex: 171
    SolutionNameMin: Cijk_Ailk_Bljk_DB_MT128x064x08_PK02_PLR0_SU32_SNLL0_TT04_04_WG32_16_01_WGM08
    SolutionIndex: 172
    SolutionNameMin: Cijk_Ailk_Bljk_DB_MT128x064x08_PK04_PLR0_SU32_SNLL0_TT04_04_WG32_16_01_WGM08
    SolutionIndex: 173
    SolutionNameMin: Cijk_Ailk_Bljk_DB_MT064x032x08_PK00_PLR1_SU00_SNLL1_TT04_04_WG16_08_01_WGM08
    SolutionIndex: 174
    SolutionNameMin: Cijk_Ailk_Bljk_DB_MT064x032x08_PK00_PLR0_SU00_SNLL1_TT04_04_WG16_08_01_WGM08
    SolutionIndex: 175
    SolutionNameMin: Cijk_Ailk_Bljk_DB_MT064x032x08_PK00_PLR1_SU00_SNLL0_TT04_04_WG16_08_01_WGM08
    SolutionIndex: 176
    SolutionNameMin: Cijk_Ailk_Bljk_DB_MT064x032x08_PK00_PLR1_SU32_SNLL1_TT04_04_WG16_08_01_WGM08
    SolutionIndex: 177
    SolutionNameMin: Cijk_Ailk_Bljk_DB_MT064x032x08_PK04_PLR1_SU32_SNLL1_TT04_04_WG16_08_01_WGM08
    SolutionIndex: 178
    SolutionNameMin: Cijk_Ailk_Bljk_DB_MT064x032x08_PK00_PLR1_SU32_SNLL0_TT04_04_WG16_08_01_WGM08
    SolutionIndex: 179
    SolutionNameMin: Cijk_Ailk_Bljk_DB_MT064x032x08_PK04_PLR1_SU32_SNLL0_TT04_04_WG16_08_01_WGM08
    SolutionIndex: 180
    SolutionNameMin: Cijk_Ailk_Bljk_DB_MT096x032x08_PK00_PLR1_SU00_SNLL1_TT06_04_WG16_08_01_WGM08
    SolutionIndex: 181
    SolutionNameMin: Cijk_Ailk_Bljk_DB_MT096x032x08_PK00_PLR1_SU00_SNLL0_TT06_04_WG16_08_01_WGM08
    SolutionIndex: 182
    SolutionNameMin: Cijk_Ailk_Bljk_DB_MT096x032x08_PK00_PLR1_SU32_SNLL1_TT06_04_WG16_08_01_WGM08
    SolutionIndex: 183
    SolutionNameMin: Cijk_Ailk_Bljk_DB_MT096x032x08_PK04_PLR1_SU32_SNLL1_TT06_04_WG16_08_01_WGM08
    SolutionIndex: 184
    SolutionNameMin: Cijk_Ailk_Bljk_DB_MT096x032x08_PK00_PLR1_SU32_SNLL0_TT06_04_WG16_08_01_WGM08
    SolutionIndex: 185
    SolutionNameMin: Cijk_Ailk_Bljk_DB_MT064x048x08_PK00_PLR1_SU00_SNLL1_TT04_06_WG16_08_01_WGM08
    SolutionIndex: 186
    SolutionNameMin: Cijk_Ailk_Bljk_DB_MT064x048x08_PK04_PLR1_SU00_SNLL0_TT04_06_WG16_08_01_WGM08
    SolutionIndex: 187
    SolutionNameMin: Cijk_Ailk_Bljk_DB_MT064x048x08_PK00_PLR1_SU32_SNLL1_TT04_06_WG16_08_01_WGM08
    SolutionIndex: 188
    SolutionNameMin: Cijk_Ailk_Bljk_DB_MT064x048x08_PK04_PLR1_SU32_SNLL1_TT04_06_WG16_08_01_WGM08
    SolutionIndex: 189
    SolutionNameMin: Cijk_Ailk_Bljk_DB_MT064x048x08_PK00_PLR1_SU32_SNLL0_TT04_06_WG16_08_01_WGM08
    SolutionIndex: 190
    SolutionNameMin: Cijk_Ailk_Bljk_DB_MT064x064x08_PK00_PLR1_SU00_SNLL0_TT04_04_WG16_16_01_WGM08
    SolutionIndex: 191
    SolutionNameMin: Cijk_Ailk_Bljk_DB_MT064x064x08_PK00_PLR1_SU32_SNLL1_TT04_04_WG16_16_01_WGM08
    SolutionIndex: 192
    SolutionNameMin: Cijk_Ailk_Bljk_DB_MT064x064x08_PK00_PLR0_SU32_SNLL1_TT04_04_WG16_16_01_WGM08
    SolutionIndex: 193
    SolutionNameMin: Cijk_Ailk_Bljk_DB_MT064x064x08_PK04_PLR0_SU32_SNLL1_TT04_04_WG16_16_01_WGM08
    SolutionIndex: 194
    SolutionNameMin: Cijk_Ailk_Bljk_DB_MT064x064x08_PK00_PLR1_SU32_SNLL0_TT04_04_WG16_16_01_WGM08
    SolutionIndex: 195
    SolutionNameMin: Cijk_Ailk_Bljk_DB_MT064x064x08_PK00_PLR0_SU32_SNLL0_TT04_04_WG16_16_01_WGM08
    SolutionIndex: 196
    SolutionNameMin: Cijk_Ailk_Bljk_DB_MT064x064x08_PK04_PLR1_SU32_SNLL0_TT04_04_WG16_16_01_WGM08
    SolutionIndex: 197
    SolutionNameMin: Cijk_Ailk_Bljk_DB_MT064x064x08_PK04_PLR0_SU32_SNLL0_TT04_04_WG16_16_01_WGM08
    SolutionIndex: 198
    SolutionNameMin: Cijk_Ailk_Bljk_DB_MT096x064x08_PK00_PLR1_SU00_SNLL1_TT06_04_WG16_16_01_WGM08
    SolutionIndex: 199
    SolutionNameMin: Cijk_Ailk_Bljk_DB_MT096x064x08_PK02_PLR1_SU00_SNLL1_TT06_04_WG16_16_01_WGM08
    SolutionIndex: 200
    SolutionNameMin: Cijk_Ailk_Bljk_DB_MT096x064x08_PK04_PLR1_SU00_SNLL1_TT06_04_WG16_16_01_WGM08
    SolutionIndex: 201
    SolutionNameMin: Cijk_Ailk_Bljk_DB_MT096x064x08_PK00_PLR1_SU00_SNLL0_TT06_04_WG16_16_01_WGM08
    SolutionIndex: 202
    SolutionNameMin: Cijk_Ailk_Bljk_DB_MT096x064x08_PK02_PLR1_SU00_SNLL0_TT06_04_WG16_16_01_WGM08
    SolutionIndex: 203
    SolutionNameMin: Cijk_Ailk_Bljk_DB_MT096x064x08_PK04_PLR1_SU00_SNLL0_TT06_04_WG16_16_01_WGM08
    SolutionIndex: 204
    SolutionNameMin: Cijk_Ailk_Bljk_DB_MT096x064x08_PK00_PLR1_SU32_SNLL0_TT06_04_WG16_16_01_WGM08
    SolutionIndex: 205
    SolutionNameMin: Cijk_Ailk_Bljk_DB_MT064x096x08_PK04_PLR1_SU00_SNLL1_TT04_06_WG16_16_01_WGM08
    SolutionIndex: 206
    SolutionNameMin: Cijk_Ailk_Bljk_DB_MT064x096x08_PK02_PLR1_SU00_SNLL0_TT04_06_WG16_16_01_WGM08
    SolutionIndex: 207
    SolutionNameMin: Cijk_Ailk_Bljk_DB_MT064x096x08_PK04_PLR1_SU00_SNLL0_TT04_06_WG16_16_01_WGM08
    SolutionIndex: 208
    SolutionNameMin: Cijk_Ailk_Bljk_DB_MT064x096x08_PK02_PLR1_SU32_SNLL1_TT04_06_WG16_16_01_WGM08
    SolutionIndex: 209
    SolutionNameMin: Cijk_Ailk_Bljk_DB_MT064x096x08_PK00_PLR1_SU32_SNLL0_TT04_06_WG16_16_01_WGM08
    SolutionIndex: 210
    SolutionNameMin: Cijk_Ailk_Bljk_DB_MT064x096x08_PK02_PLR1_SU32_SNLL0_TT04_06_WG16_16_01_WGM08
    SolutionIndex: 211
    SolutionNameMin: Cijk_Ailk_Bljk_DB_MT64x32x8_SE_AMAS1_GRVW1_USFGRO1_VW1
    SolutionIndex: 212
    SolutionNameMin: Cijk_Ailk_Bljk_DB_MT64x32x4_SE_PK0_PLR1_SU0_SNLL1_TT4_4_WG16_8_1_WGM1
    SolutionIndex: 213
    SolutionNameMin: Cijk_Ailk_Bljk_DB_MT64x32x4_SE_PK0_PLR0_SU0_SNLL1_TT4_4_WG16_8_1_WGM1
    SolutionIndex: 214
    SolutionNameMin: Cijk_Ailk_Bljk_DB_MT64x32x4_SE_PK2_PLR1_SU0_SNLL1_TT4_4_WG16_8_1_WGM1
    SolutionIndex: 215
    SolutionNameMin: Cijk_Ailk_Bljk_DB_MT64x32x4_SE_PK4_PLR1_SU0_SNLL1_TT4_4_WG16_8_1_WGM1
    SolutionIndex: 216
    SolutionNameMin: Cijk_Ailk_Bljk_DB_MT64x32x4_SE_PK0_PLR1_SU0_SNLL0_TT4_4_WG16_8_1_WGM1
    SolutionIndex: 217
    SolutionNameMin: Cijk_Ailk_Bljk_DB_MT64x32x4_SE_PK0_PLR0_SU0_SNLL0_TT4_4_WG16_8_1_WGM1
    SolutionIndex: 218
    SolutionNameMin: Cijk_Ailk_Bljk_DB_MT64x32x4_SE_PK4_PLR1_SU0_SNLL0_TT4_4_WG16_8_1_WGM1
    SolutionIndex: 219
    SolutionNameMin: Cijk_Ailk_Bljk_DB_MT64x32x4_SE_PK0_PLR1_SU32_SNLL1_TT4_4_WG16_8_1_WGM1
    SolutionIndex: 220
    SolutionNameMin: Cijk_Ailk_Bljk_DB_MT64x32x4_SE_PK0_PLR0_SU32_SNLL1_TT4_4_WG16_8_1_WGM1
    SolutionIndex: 221
    SolutionNameMin: Cijk_Ailk_Bljk_DB_MT64x32x4_SE_PK0_PLR1_SU32_SNLL0_TT4_4_WG16_8_1_WGM1
    SolutionIndex: 222
    SolutionNameMin: Cijk_Ailk_Bljk_DB_MT64x32x4_SE_PK0_PLR0_SU32_SNLL0_TT4_4_WG16_8_1_WGM1
    SolutionIndex: 223
    SolutionNameMin: Cijk_Ailk_Bljk_DB_MT64x48x4_SE_PK0_PLR1_SU0_SNLL1_TT4_6_WG16_8_1_WGM1
    SolutionIndex: 224
    SolutionNameMin: Cijk_Ailk_Bljk_DB_MT32x64x4_SE_PK0_PLR1_SU0_SNLL1_TT4_4_WG8_16_1_WGM1
    SolutionIndex: 225
    SolutionNameMin: Cijk_Ailk_Bljk_DB_MT32x64x4_SE_PK4_PLR1_SU0_SNLL1_TT4_4_WG8_16_1_WGM1
    SolutionIndex: 226
    SolutionNameMin: Cijk_Ailk_Bljk_DB_MT32x64x4_SE_PK2_PLR1_SU0_SNLL0_TT4_4_WG8_16_1_WGM1
    SolutionIndex: 227
    SolutionNameMin: Cijk_Ailk_Bljk_DB_MT96x64x4_SE_PK0_PLR0_SU32_SNLL1_TT6_4_WG16_16_1_WGM1
    SolutionIndex: 228
    SolutionNameMin: Cijk_Ailk_Bljk_DB_MT96x64x4_SE_PK4_PLR0_SU32_SNLL1_TT6_4_WG16_16_1_WGM1
    SolutionIndex: 229
    SolutionNameMin: Cijk_Ailk_Bljk_DB_MT96x64x4_SE_PK0_PLR0_SU32_SNLL0_TT6_4_WG16_16_1_WGM1
    SolutionIndex: 230
    SolutionNameMin: Cijk_Ailk_Bljk_DB_MT96x64x4_SE_PK4_PLR0_SU32_SNLL0_TT6_4_WG16_16_1_WGM1
    SolutionIndex: 231
    SolutionNameMin: Cijk_Ailk_Bljk_DB_MT64x32x4_SE_PK0_PLR1_SU0_SNLL1_TT4_4_WG16_8_1_WGM8
    SolutionIndex: 232
    SolutionNameMin: Cijk_Ailk_Bljk_DB_MT64x32x4_SE_PK0_PLR0_SU0_SNLL1_TT4_4_WG16_8_1_WGM8
    SolutionIndex: 233
    SolutionNameMin: Cijk_Ailk_Bljk_DB_MT64x32x4_SE_PK2_PLR1_SU0_SNLL1_TT4_4_WG16_8_1_WGM8
    SolutionIndex: 234
    SolutionNameMin: Cijk_Ailk_Bljk_DB_MT64x32x4_SE_PK4_PLR1_SU0_SNLL1_TT4_4_WG16_8_1_WGM8
    SolutionIndex: 235
    SolutionNameMin: Cijk_Ailk_Bljk_DB_MT64x32x4_SE_PK0_PLR1_SU0_SNLL0_TT4_4_WG16_8_1_WGM8
    SolutionIndex: 236
    SolutionNameMin: Cijk_Ailk_Bljk_DB_MT64x32x4_SE_PK0_PLR0_SU0_SNLL0_TT4_4_WG16_8_1_WGM8
    SolutionIndex: 237
    SolutionNameMin: Cijk_Ailk_Bljk_DB_MT64x32x4_SE_PK2_PLR1_SU0_SNLL0_TT4_4_WG16_8_1_WGM8
    SolutionIndex: 238
    SolutionNameMin: Cijk_Ailk_Bljk_DB_MT64x32x4_SE_PK4_PLR1_SU0_SNLL0_TT4_4_WG16_8_1_WGM8
    SolutionIndex: 239
    SolutionNameMin: Cijk_Ailk_Bljk_DB_MT64x32x4_SE_PK0_PLR1_SU32_SNLL1_TT4_4_WG16_8_1_WGM8
    SolutionIndex: 240
    SolutionNameMin: Cijk_Ailk_Bljk_DB_MT64x32x4_SE_PK0_PLR0_SU32_SNLL1_TT4_4_WG16_8_1_WGM8
    SolutionIndex: 241
    SolutionNameMin: Cijk_Ailk_Bljk_DB_MT64x32x4_SE_PK0_PLR1_SU32_SNLL0_TT4_4_WG16_8_1_WGM8
    SolutionIndex: 242
    SolutionNameMin: Cijk_Ailk_Bljk_DB_MT64x32x4_SE_PK0_PLR0_SU32_SNLL0_TT4_4_WG16_8_1_WGM8
    SolutionIndex: 243
    SolutionNameMin: Cijk_Ailk_Bljk_DB_MT32x64x4_SE_PK0_PLR1_SU0_SNLL1_TT4_4_WG8_16_1_WGM8
    SolutionIndex: 244
    SolutionNameMin: Cijk_Ailk_Bljk_DB_MT32x64x4_SE_PK4_PLR1_SU0_SNLL1_TT4_4_WG8_16_1_WGM8
    SolutionIndex: 245
    SolutionNameMin: Cijk_Ailk_Bljk_DB_MT96x64x4_SE_PK0_PLR0_SU32_SNLL0_TT6_4_WG16_16_1_WGM8
    SolutionIndex: 246
    SolutionNameMin: Cijk_Ailk_Bljk_DB_MT64x32x8_SE_PK0_PLR1_SU0_SNLL1_TT4_4_WG16_8_1_WGM1
    SolutionIndex: 247
    SolutionNameMin: Cijk_Ailk_Bljk_DB_MT64x32x8_SE_PK2_PLR1_SU0_SNLL1_TT4_4_WG16_8_1_WGM1
    SolutionIndex: 248
    SolutionNameMin: Cijk_Ailk_Bljk_DB_MT64x32x8_SE_PK4_PLR1_SU0_SNLL1_TT4_4_WG16_8_1_WGM1
    SolutionIndex: 249
    SolutionNameMin: Cijk_Ailk_Bljk_DB_MT64x32x8_SE_PK4_PLR1_SU0_SNLL0_TT4_4_WG16_8_1_WGM1
    SolutionIndex: 250
    SolutionNameMin: Cijk_Ailk_Bljk_DB_MT64x32x8_SE_PK0_PLR1_SU32_SNLL1_TT4_4_WG16_8_1_WGM1
    SolutionIndex: 251
    SolutionNameMin: Cijk_Ailk_Bljk_DB_MT64x32x8_SE_PK2_PLR1_SU32_SNLL1_TT4_4_WG16_8_1_WGM1
    SolutionIndex: 252
    SolutionNameMin: Cijk_Ailk_Bljk_DB_MT64x32x8_SE_PK4_PLR1_SU32_SNLL1_TT4_4_WG16_8_1_WGM1
    SolutionIndex: 253
    SolutionNameMin: Cijk_Ailk_Bljk_DB_MT32x64x8_SE_PK0_PLR1_SU0_SNLL1_TT4_4_WG8_16_1_WGM1
    SolutionIndex: 254
    SolutionNameMin: Cijk_Ailk_Bljk_DB_MT64x64x8_SE_PK0_PLR1_SU0_SNLL1_TT4_4_WG16_16_1_WGM1
    SolutionIndex: 255
    SolutionNameMin: Cijk_Ailk_Bljk_DB_MT64x64x8_SE_PK0_PLR0_SU0_SNLL1_TT4_4_WG16_16_1_WGM1
    SolutionIndex: 256
    SolutionNameMin: Cijk_Ailk_Bljk_DB_MT64x64x8_SE_PK4_PLR1_SU0_SNLL1_TT4_4_WG16_16_1_WGM1
    SolutionIndex: 257
    SolutionNameMin: Cijk_Ailk_Bljk_DB_MT64x64x8_SE_PK4_PLR0_SU0_SNLL1_TT4_4_WG16_16_1_WGM1
    SolutionIndex: 258
    SolutionNameMin: Cijk_Ailk_Bljk_DB_MT64x64x8_SE_PK0_PLR1_SU0_SNLL0_TT4_4_WG16_16_1_WGM1
    SolutionIndex: 259
    SolutionNameMin: Cijk_Ailk_Bljk_DB_MT64x64x8_SE_PK0_PLR0_SU0_SNLL0_TT4_4_WG16_16_1_WGM1
    SolutionIndex: 260
    SolutionNameMin: Cijk_Ailk_Bljk_DB_MT64x64x8_SE_PK4_PLR0_SU0_SNLL0_TT4_4_WG16_16_1_WGM1
    SolutionIndex: 261
    SolutionNameMin: Cijk_Ailk_Bljk_DB_MT64x64x8_SE_PK0_PLR1_SU32_SNLL1_TT4_4_WG16_16_1_WGM1
    SolutionIndex: 262
    SolutionNameMin: Cijk_Ailk_Bljk_DB_MT64x64x8_SE_PK0_PLR0_SU32_SNLL1_TT4_4_WG16_16_1_WGM1
    SolutionIndex: 263
    SolutionNameMin: Cijk_Ailk_Bljk_DB_MT64x64x8_SE_PK4_PLR1_SU32_SNLL1_TT4_4_WG16_16_1_WGM1
    SolutionIndex: 264
    SolutionNameMin: Cijk_Ailk_Bljk_DB_MT64x64x8_SE_PK4_PLR0_SU32_SNLL1_TT4_4_WG16_16_1_WGM1
    SolutionIndex: 265
    SolutionNameMin: Cijk_Ailk_Bljk_DB_MT64x64x8_SE_PK0_PLR1_SU32_SNLL0_TT4_4_WG16_16_1_WGM1
    SolutionIndex: 266
    SolutionNameMin: Cijk_Ailk_Bljk_DB_MT64x64x8_SE_PK0_PLR0_SU32_SNLL0_TT4_4_WG16_16_1_WGM1
    SolutionIndex: 267
    SolutionNameMin: Cijk_Ailk_Bljk_DB_MT64x64x8_SE_PK4_PLR1_SU32_SNLL0_TT4_4_WG16_16_1_WGM1
    SolutionIndex: 268
    SolutionNameMin: Cijk_Ailk_Bljk_DB_MT64x64x8_SE_PK4_PLR0_SU32_SNLL0_TT4_4_WG16_16_1_WGM1
    SolutionIndex: 269
    SolutionNameMin: Cijk_Ailk_Bljk_DB_MT128x64x8_SE_PK4_PLR0_SU32_SNLL0_TT4_4_WG32_16_1_WGM8
    SolutionIndex: 270
    SolutionNameMin: Cijk_Ailk_Bljk_DB_MT64x32x8_SE_PK0_PLR1_SU0_SNLL1_TT4_4_WG16_8_1_WGM8
    SolutionIndex: 271
    SolutionNameMin: Cijk_Ailk_Bljk_DB_MT64x32x8_SE_PK4_PLR1_SU0_SNLL1_TT4_4_WG16_8_1_WGM8
    SolutionIndex: 272
    SolutionNameMin: Cijk_Ailk_Bljk_DB_MT64x32x8_SE_PK0_PLR1_SU0_SNLL0_TT4_4_WG16_8_1_WGM8
    SolutionIndex: 273
    SolutionNameMin: Cijk_Ailk_Bljk_DB_MT64x32x8_SE_PK4_PLR1_SU0_SNLL0_TT4_4_WG16_8_1_WGM8
    SolutionIndex: 274
    SolutionNameMin: Cijk_Ailk_Bljk_DB_MT64x32x8_SE_PK0_PLR1_SU32_SNLL1_TT4_4_WG16_8_1_WGM8
    SolutionIndex: 275
    SolutionNameMin: Cijk_Ailk_Bljk_DB_MT64x64x8_SE_PK0_PLR1_SU0_SNLL1_TT4_4_WG16_16_1_WGM8
    SolutionIndex: 276
    SolutionNameMin: Cijk_Ailk_Bljk_DB_MT64x64x8_SE_PK0_PLR0_SU0_SNLL1_TT4_4_WG16_16_1_WGM8
    SolutionIndex: 277
    SolutionNameMin: Cijk_Ailk_Bljk_DB_MT64x64x8_SE_PK0_PLR1_SU32_SNLL1_TT4_4_WG16_16_1_WGM8
    SolutionIndex: 278
    SolutionNameMin: Cijk_Ailk_Bljk_DB_MT64x64x8_SE_PK0_PLR0_SU32_SNLL1_TT4_4_WG16_16_1_WGM8
    SolutionIndex: 279
    SolutionNameMin: Cijk_Ailk_Bljk_DB_MT64x64x8_SE_PK4_PLR1_SU32_SNLL1_TT4_4_WG16_16_1_WGM8
    SolutionIndex: 280
    SolutionNameMin: Cijk_Ailk_Bljk_DB_MT64x64x8_SE_PK4_PLR0_SU32_SNLL1_TT4_4_WG16_16_1_WGM8
    SolutionIndex: 281
    SolutionNameMin: Cijk_Ailk_Bljk_DB_MT64x64x8_SE_PK0_PLR1_SU32_SNLL0_TT4_4_WG16_16_1_WGM8
    SolutionIndex: 282
    SolutionNameMin: Cijk_Ailk_Bljk_DB_MT64x64x8_SE_PK0_PLR0_SU32_SNLL0_TT4_4_WG16_16_1_WGM8
    SolutionIndex: 283
    SolutionNameMin: Cijk_Ailk_Bljk_DB_MT64x64x8_SE_PK4_PLR1_SU32_SNLL0_TT4_4_WG16_16_1_WGM8
    SolutionIndex: 284
    SolutionNameMin: Cijk_Ailk_Bljk_DB_MT64x64x8_SE_PK4_PLR0_SU32_SNLL0_TT4_4_WG16_16_1_WGM8
    SolutionIndex: 285
    SolutionNameMin: Cijk_Ailk_Bljk_DB_MT96x64x8_SE_PK4_PLR1_SU0_SNLL1_TT6_4_WG16_16_1_WGM8
    SolutionIndex: 286
    SolutionNameMin: Cijk_Ailk_Bljk_DB_MT64x96x8_SE_PK4_PLR1_SU32_SNLL0_TT4_6_WG16_16_1_WGM8
    SolutionIndex: 287
    SolutionNameMin: Cijk_Ailk_Bljk_DB_MT96x64x4_SE_PLR0_SU32_SNLL1_TT6_4_WG16_16_1_WGM1
    SolutionIndex: 289
    SolutionNameMin: Cijk_Ailk_Bljk_DB_MT128x64x4_SE_PLR1_SU32_SNLL0_TT8_4_WG16_16_1_WGM1
    SolutionIndex: 297
    SolutionNameMin: Cijk_Ailk_Bljk_DB_MT64x32x8_SE_PLR1_SU32_SNLL1_TT4_4_WG16_8_1_WGM1
    SolutionIndex: 299
    SolutionNameMin: Cijk_Ailk_Bljk_DB_MT64x64x8_SE_PLR1_SU32_SNLL1_TT4_4_WG16_16_1_WGM1
    SolutionIndex: 301
    SolutionNameMin: Cijk_Ailk_Bljk_DB_MT96x64x8_SE_PLR1_SU32_SNLL1_TT6_4_WG16_16_1_WGM1
    SolutionIndex: 304
    SolutionNameMin: Cijk_Ailk_Bljk_DB_MT64x64x8_SE_PLR1_SU0_SNLL1_TT4_4_WG16_16_1_WGM8
    SolutionIndex: 305
    SolutionNameMin: Cijk_Ailk_Bljk_DB_MT64x64x8_SE_PLR1_SU32_SNLL1_TT4_4_WG16_16_1_WGM8
    SolutionIndex: 306
    SolutionNameMin: Cijk_Ailk_Bljk_DB_MT64x64x8_SE_PLR0_SU32_SNLL1_TT4_4_WG16_16_1_WGM8
    SolutionIndex: 307
    SolutionNameMin: Cijk_Ailk_Bljk_DB_MT64x64x8_SE_PLR1_SU32_SNLL0_TT4_4_WG16_16_1_WGM8
    SolutionIndex: 308
    SolutionNameMin: Cijk_Ailk_Bljk_DB_MT64x64x8_SE_PLR0_SU32_SNLL0_TT4_4_WG16_16_1_WGM8
    SolutionIndex: 309
    SolutionNameMin: Cijk_Ailk_Bljk_DB_MT96x64x8_SE_PLR1_SU32_SNLL1_TT6_4_WG16_16_1_WGM8
- - - [41728, 41728, 1, 256]
    - [10, 0.0]
  - - [12032, 12032, 1, 256]
    - [23, 0.0]
  - - [15360, 15360, 1, 256]
    - [21, 0.0]
  - - [7680, 7680, 1, 384]
    - [29, 0.0]
  - - [35328, 35328, 1, 384]
    - [10, 0.0]
  - - [41088, 41088, 1, 384]
    - [6, 0.0]
  - - [21504, 21504, 1, 384]
    - [21, 0.0]
  - - [44544, 44544, 1, 384]
    - [10, 0.0]
  - - [33280, 33280, 1, 256]
    - [22, 0.0]
  - - [1152, 1152, 1, 384]
    - [10, 0.0]
  - - [13312, 13312, 1, 256]
    - [21, 0.0]
  - - [29952, 29952, 1, 256]
    - [23, 0.0]
  - - [13824, 13824, 1, 256]
    - [21, 0.0]
  - - [24576, 24576, 1, 384]
    - [22, 0.0]
  - - [44544, 44544, 1, 256]
    - [22, 0.0]
  - - [20736, 20736, 1, 384]
    - [10, 0.0]
  - - [31488, 31488, 1, 256]
    - [10, 0.0]
  - - [17664, 17664, 1, 384]
    - [10, 0.0]
  - - [26880, 26880, 1, 384]
    - [10, 0.0]
  - - [31872, 31872, 1, 384]
    - [6, 0.0]
  - - [4864, 4864, 1, 256]
    - [28, 0.0]
  - - [10240, 10240, 1, 256]
    - [20, 0.0]
  - - [16896, 16896, 1, 384]
    - [10, 0.0]
  - - [1, 1, 1, 64]
    - [1, 0.0]
  - - [9984, 9984, 1, 384]
    - [25, 0.0]
  - - [26496, 26496, 1, 384]
    - [6, 0.0]
  - - [2816, 2816, 1, 256]
    - [14, 0.0]
  - - [24832, 24832, 1, 256]
    - [10, 0.0]
  - - [8832, 8832, 1, 384]
    - [15, 0.0]
  - - [29184, 29184, 1, 384]
    - [20, 0.0]
  - - [42624, 42624, 1, 384]
    - [6, 0.0]
  - - [22272, 22272, 1, 384]
    - [13, 0.0]
  - - [39552, 39552, 1, 384]
    - [6, 0.0]
  - - [40448, 40448, 1, 256]
    - [20, 0.0]
  - - [44800, 44800, 1, 256]
    - [10, 0.0]
  - - [39680, 39680, 1, 256]
    - [10, 0.0]
  - - [30464, 30464, 1, 256]
    - [10, 0.0]
  - - [32768, 32768, 1, 256]
    - [19, 0.0]
  - - [12672, 12672, 1, 384]
    - [6, 0.0]
  - - [41984, 41984, 1, 256]
    - [22, 0.0]
  - - [11008, 11008, 1, 256]
    - [28, 0.0]
  - - [26112, 26112, 1, 384]
    - [21, 0.0]
  - - [3072, 3072, 1, 384]
    - [3, 0.0]
  - - [9984, 9984, 1, 256]
    - [28, 0.0]
  - - [38016, 38016, 1, 384]
    - [6, 0.0]
  - - [17408, 17408, 1, 256]
    - [22, 0.0]
  - - [43008, 43008, 1, 384]
    - [10, 0.0]
  - - [36096, 36096, 1, 384]
    - [10, 0.0]
  - - [33024, 33024, 1, 256]
    - [10, 0.0]
  - - [8448, 8448, 1, 256]
    - [29, 0.0]
  - - [23552, 23552, 1, 256]
    - [20, 0.0]
  - - [24064, 24064, 1, 256]
    - [22, 0.0]
  - - [41472, 41472, 1, 384]
    - [10, 0.0]
  - - [5120, 5120, 1, 256]
    - [23, 0.0]
  - - [7680, 7680, 1, 256]
    - [28, 0.0]
  - - [6400, 6400, 1, 256]
    - [14, 0.0]
  - - [8704, 8704, 1, 256]
    - [28, 0.0]
  - - [19968, 19968, 1, 256]
    - [21, 0.0]
  - - [40320, 40320, 1, 384]
    - [6, 0.0]
  - - [18432, 18432, 1, 256]
    - [21, 0.0]
  - - [19712, 19712, 1, 256]
    - [23, 0.0]
  - - [43776, 43776, 1, 384]
    - [10, 0.0]
  - - [25344, 25344, 1, 256]
    - [10, 0.0]
  - - [12800, 12800, 1, 256]
    - [21, 0.0]
  - - [10368, 10368, 1, 384]
    - [15, 0.0]
  - - [1280, 1280, 1, 256]
    - [9, 0.0]
  - - [10496, 10496, 1, 256]
    - [22, 0.0]
  - - [24960, 24960, 1, 384]
    - [6, 0.0]
  - - [6144, 6144, 1, 256]
    - [23, 0.0]
  - - [15616, 15616, 1, 256]
    - [28, 0.0]
  - - [9600, 9600, 1, 384]
    - [7, 0.0]
  - - [30720, 30720, 1, 256]
    - [20, 0.0]
  - - [1792, 1792, 1, 256]
    - [2, 0.0]
  - - [20480, 20480, 1, 256]
    - [20, 0.0]
  - - [17920, 17920, 1, 256]
    - [21, 0.0]
  - - [10752, 10752, 1, 384]
    - [28, 0.0]
  - - [39424, 39424, 1, 256]
    - [20, 0.0]
  - - [4224, 4224, 1, 384]
    - [11, 0.0]
  - - [29568, 29568, 1, 384]
    - [6, 0.0]
  - - [33792, 33792, 1, 256]
    - [22, 0.0]
  - - [25344, 25344, 1, 384]
    - [13, 0.0]
  - - [35072, 35072, 1, 256]
    - [13, 0.0]
  - - [1536, 1536, 1, 384]
    - [16, 0.0]
  - - [15744, 15744, 1, 384]
    - [10, 0.0]
  - - [29184, 29184, 1, 256]
    - [20, 0.0]
  - - [40192, 40192, 1, 256]
    - [10, 0.0]
  - - [9728, 9728, 1, 256]
    - [21, 0.0]
  - - [17152, 17152, 1, 256]
    - [10, 0.0]
  - - [30720, 30720, 1, 384]
    - [20, 0.0]
  - - [8192, 8192, 1, 256]
    - [21, 0.0]
  - - [31744, 31744, 1, 256]
    - [20, 0.0]
  - - [16128, 16128, 1, 384]
    - [13, 0.0]
  - - [34816, 34816, 1, 256]
    - [20, 0.0]
  - - [36352, 36352, 1, 256]
    - [20, 0.0]
  - - [38656, 38656, 1, 256]
    - [13, 0.0]
  - - [44032, 44032, 1, 256]
    - [22, 0.0]
  - - [9472, 9472, 1, 256]
    - [28, 0.0]
  - - [23296, 23296, 1, 256]
    - [20, 0.0]
  - - [34304, 34304, 1, 256]
    - [20, 0.0]
  - - [43520, 43520, 1, 256]
    - [22, 0.0]
  - - [19456, 19456, 1, 256]
    - [20, 0.0]
  - - [21120, 21120, 1, 384]
    - [6, 0.0]
  - - [6528, 6528, 1, 384]
    - [11, 0.0]
  - - [9216, 9216, 1, 256]
    - [20, 0.0]
  - - [25856, 25856, 1, 256]
    - [20, 0.0]
  - - [34176, 34176, 1, 384]
    - [6, 0.0]
  - - [32256, 32256, 1, 384]
    - [20, 0.0]
  - - [39936, 39936, 1, 384]
    - [10, 0.0]
  - - [9216, 9216, 1, 384]
    - [20, 0.0]
  - - [14848, 14848, 1, 256]
    - [21, 0.0]
  - - [23040, 23040, 1, 256]
    - [21, 0.0]
  - - [19200, 19200, 1, 256]
    - [26, 0.0]
  - - [1, 64, 1, 64]
    - [1, 0.0]
  - - [14592, 14592, 1, 384]
    - [25, 0.0]
  - - [21888, 21888, 1, 384]
    - [6, 0.0]
  - - [768, 768, 1, 256]
    - [17, 0.0]
  - - [26112, 26112, 1, 256]
    - [23, 0.0]
  - - [27648, 27648, 1, 384]
    - [20, 0.0]
  - - [20992, 20992, 1, 256]
    - [21, 0.0]
  - - [15104, 15104, 1, 256]
    - [20, 0.0]
  - - [13056, 13056, 1, 384]
    - [29, 0.0]
  - - [19968, 19968, 1, 384]
    - [20, 0.0]
  - - [25728, 25728, 1, 384]
    - [6, 0.0]
  - - [44160, 44160, 1, 384]
    - [6, 0.0]
  - - [27136, 27136, 1, 256]
    - [20, 0.0]
  - - [6912, 6912, 1, 384]
    - [25, 0.0]
  - - [37632, 37632, 1, 256]
    - [10, 0.0]
  - - [10752, 10752, 1, 256]
    - [21, 0.0]
  - - [5376, 5376, 1, 384]
    - [26, 0.0]
  - - [35584, 35584, 1, 256]
    - [10, 0.0]
  - - [28800, 28800, 1, 384]
    - [6, 0.0]
  - - [24320, 24320, 1, 256]
    - [22, 0.0]
  - - [38400, 38400, 1, 384]
    - [10, 0.0]
  - - [13440, 13440, 1, 384]
    - [6, 0.0]
  - - [32640, 32640, 1, 384]
    - [6, 0.0]
  - - [11904, 11904, 1, 384]
    - [11, 0.0]
  - - [256, 256, 1, 256]
    - [8, 0.0]
  - - [36096, 36096, 1, 256]
    - [10, 0.0]
  - - [31488, 31488, 1, 384]
    - [10, 0.0]
  - - [32512, 32512, 1, 256]
    - [10, 0.0]
  - - [34560, 34560, 1, 384]
    - [10, 0.0]
  - - [18944, 18944, 1, 256]
    - [23, 0.0]
  - - [35840, 35840, 1, 256]
    - [22, 0.0]
  - - [35328, 35328, 1, 256]
    - [20, 0.0]
  - - [21504, 21504, 1, 256]
    - [22, 0.0]
  - - [21760, 21760, 1, 256]
    - [25, 0.0]
  - - [7936, 7936, 1, 256]
    - [28, 0.0]
  - - [30976, 30976, 1, 256]
    - [10, 0.0]
  - - [13824, 13824, 1, 384]
    - [25, 0.0]
  - - [43776, 43776, 1, 256]
    - [10, 0.0]
  - - [42240, 42240, 1, 384]
    - [10, 0.0]
  - - [24576, 24576, 1, 256]
    - [18, 0.0]
  - - [15360, 15360, 1, 384]
    - [20, 0.0]
  - - [22656, 22656, 1, 384]
    - [6, 0.0]
  - - [20736, 20736, 1, 256]
    - [10, 0.0]
  - - [17664, 17664, 1, 256]
    - [22, 0.0]
  - - [5632, 5632, 1, 256]
    - [4, 0.0]
  - - [26880, 26880, 1, 256]
    - [10, 0.0]
  - - [27264, 27264, 1, 384]
    - [6, 0.0]
  - - [41216, 41216, 1, 256]
    - [10, 0.0]
  - - [22528, 22528, 1, 256]
    - [20, 0.0]
  - - [7424, 7424, 1, 256]
    - [14, 0.0]
  - - [15872, 15872, 1, 256]
    - [21, 0.0]
  - - [37248, 37248, 1, 384]
    - [6, 0.0]
  - - [28672, 28672, 1, 256]
    - [22, 0.0]
  - - [42240, 42240, 1, 256]
    - [10, 0.0]
  - - [37888, 37888, 1, 256]
    - [20, 0.0]
  - - [31104, 31104, 1, 384]
    - [6, 0.0]
  - - [1024, 1024, 1, 256]
    - [3, 0.0]
  - - [36480, 36480, 1, 384]
    - [6, 0.0]
  - - [14976, 14976, 1, 384]
    - [10, 0.0]
  - - [2304, 2304, 1, 384]
    - [25, 0.0]
  - - [2048, 2048, 1, 256]
    - [3, 0.0]
  - - [11520, 11520, 1, 256]
    - [29, 0.0]
  - - [22272, 22272, 1, 256]
    - [23, 0.0]
  - - [11264, 11264, 1, 256]
    - [22, 0.0]
  - - [2688, 2688, 1, 384]
    - [4, 0.0]
  - - [12544, 12544, 1, 256]
    - [28, 0.0]
  - - [33024, 33024, 1, 384]
    - [10, 0.0]
  - - [29440, 29440, 1, 256]
    - [21, 0.0]
  - - [18816, 18816, 1, 384]
    - [6, 0.0]
  - - [25088, 25088, 1, 256]
    - [20, 0.0]
  - - [23040, 23040, 1, 384]
    - [21, 0.0]
  - - [38912, 38912, 1, 256]
    - [22, 0.0]
  - - [1536, 1536, 1, 256]
    - [27, 0.0]
  - - [18176, 18176, 1, 256]
    - [22, 0.0]
  - - [17280, 17280, 1, 384]
    - [6, 0.0]
  - - [38144, 38144, 1, 256]
    - [10, 0.0]
  - - [8960, 8960, 1, 256]
    - [14, 0.0]
  - - [12288, 12288, 1, 256]
    - [21, 0.0]
  - - [12288, 12288, 1, 384]
    - [20, 0.0]
  - - [16640, 16640, 1, 256]
    - [12, 0.0]
  - - [43008, 43008, 1, 256]
    - [20, 0.0]
  - - [28160, 28160, 1, 256]
    - [20, 0.0]
  - - [14208, 14208, 1, 384]
    - [10, 0.0]
  - - [29952, 29952, 1, 384]
    - [10, 0.0]
  - - [37120, 37120, 1, 256]
    - [10, 0.0]
  - - [29696, 29696, 1, 256]
    - [22, 0.0]
  - - [43392, 43392, 1, 384]
    - [6, 0.0]
  - - [23808, 23808, 1, 256]
    - [13, 0.0]
  - - [64, 1, 1, 64]
    - [1, 0.0]
  - - [41472, 41472, 1, 256]
    - [22, 0.0]
  - - [42496, 42496, 1, 256]
    - [30, 0.0]
  - - [34560, 34560, 1, 256]
    - [10, 0.0]
  - - [2560, 2560, 1, 256]
    - [14, 0.0]
  - - [8448, 8448, 1, 384]
    - [26, 0.0]
  - - [21248, 21248, 1, 256]
    - [21, 0.0]
  - - [3584, 3584, 1, 256]
    - [4, 0.0]
  - - [39936, 39936, 1, 256]
    - [20, 0.0]
  - - [36864, 36864, 1, 256]
    - [20, 0.0]
  - - [5760, 5760, 1, 384]
    - [11, 0.0]
  - - [6144, 6144, 1, 384]
    - [25, 0.0]
  - - [13568, 13568, 1, 256]
    - [15, 0.0]
  - - [20352, 20352, 1, 384]
    - [10, 0.0]
  - - [23808, 23808, 1, 384]
    - [10, 0.0]
  - - [35712, 35712, 1, 384]
    - [6, 0.0]
  - - [6912, 6912, 1, 256]
    - [29, 0.0]
  - - [30336, 30336, 1, 384]
    - [6, 0.0]
  - - [3072, 3072, 1, 256]
    - [5, 0.0]
  - - [11136, 11136, 1, 384]
    - [14, 0.0]
  - - [41856, 41856, 1, 384]
    - [6, 0.0]
  - - [27392, 27392, 1, 256]
    - [22, 0.0]
  - - [2304, 2304, 1, 256]
    - [28, 0.0]
  - - [28032, 28032, 1, 384]
    - [6, 0.0]
  - - [4608, 4608, 1, 384]
    - [28, 0.0]
  - - [25600, 25600, 1, 256]
    - [20, 0.0]
  - - [26368, 26368, 1, 256]
    - [10, 0.0]
  - - [28928, 28928, 1, 256]
    - [10, 0.0]
  - - [33408, 33408, 1, 384]
    - [6, 0.0]
  - - [6656, 6656, 1, 256]
    - [21, 0.0]
  - - [16128, 16128, 1, 256]
    - [25, 0.0]
  - - [33536, 33536, 1, 256]
    - [10, 0.0]
  - - [3840, 3840, 1, 256]
    - [28, 0.0]
  - - [3456, 3456, 1, 384]
    - [12, 0.0]
  - - [38784, 38784, 1, 384]
    - [6, 0.0]
  - - [33792, 33792, 1, 384]
    - [22, 0.0]
  - - [14080, 14080, 1, 256]
    - [25, 0.0]
  - - [7168, 7168, 1, 256]
    - [22, 0.0]
  - - [22784, 22784, 1, 256]
    - [23, 0.0]
  - - [3840, 3840, 1, 384]
    - [26, 0.0]
  - - [20224, 20224, 1, 256]
    - [25, 0.0]
  - - [27904, 27904, 1, 256]
    - [10, 0.0]
  - - [31232, 31232, 1, 256]
    - [21, 0.0]
  - - [36864, 36864, 1, 384]
    - [10, 0.0]
  - - [18688, 18688, 1, 256]
    - [22, 0.0]
  - - [44928, 44928, 1, 384]
    - [6, 0.0]
  - - [37376, 37376, 1, 256]
    - [20, 0.0]
  - - [32000, 32000, 1, 256]
    - [10, 0.0]
  - - [32256, 32256, 1, 256]
    - [20, 0.0]
  - - [43264, 43264, 1, 256]
    - [10, 0.0]
  - - [38400, 38400, 1, 256]
    - [20, 0.0]
  - - [1920, 1920, 1, 384]
    - [11, 0.0]
  - - [28416, 28416, 1, 256]
    - [14, 0.0]
  - - [16512, 16512, 1, 384]
    - [10, 0.0]
  - - [5376, 5376, 1, 256]
    - [29, 0.0]
  - - [14592, 14592, 1, 256]
    - [28, 0.0]
  - - [18432, 18432, 1, 384]
    - [20, 0.0]
  - - [36608, 36608, 1, 256]
    - [10, 0.0]
  - - [26624, 26624, 1, 256]
    - [20, 0.0]
  - - [3328, 3328, 1, 256]
    - [14, 0.0]
  - - [30208, 30208, 1, 256]
    - [23, 0.0]
  - - [42752, 42752, 1, 256]
    - [10, 0.0]
  - - [27648, 27648, 1, 256]
    - [20, 0.0]
  - - [39168, 39168, 1, 256]
    - [10, 0.0]
  - - [4352, 4352, 1, 256]
    - [14, 0.0]
  - - [7296, 7296, 1, 384]
    - [12, 0.0]
  - - [13056, 13056, 1, 256]
    - [25, 0.0]
  - - [19200, 19200, 1, 384]
    - [13, 0.0]
  - - [34944, 34944, 1, 384]
    - [6, 0.0]
  - - [512, 512, 1, 256]
    - [24, 0.0]
  - - [18048, 18048, 1, 384]
    - [13, 0.0]
  - - [14336, 14336, 1, 256]
    - [20, 0.0]
  - - [768, 768, 1, 384]
    - [13, 0.0]
  - - [11776, 11776, 1, 256]
    - [21, 0.0]
  - - [4608, 4608, 1, 256]
    - [28, 0.0]
  - - [28416, 28416, 1, 384]
    - [13, 0.0]
  - - [4096, 4096, 1, 256]
    - [3, 0.0]
  - - [11520, 11520, 1, 384]
    - [25, 0.0]
  - - [23424, 23424, 1, 384]
    - [6, 0.0]
  - - [19584, 19584, 1, 384]
    - [6, 0.0]
  - - [44288, 44288, 1, 256]
    - [10, 0.0]
  - - [37632, 37632, 1, 384]
    - [6, 0.0]
  - - [5888, 5888, 1, 256]
    - [4, 0.0]
  - - [40960, 40960, 1, 256]
    - [18, 0.0]
  - - [24192, 24192, 1, 384]
    - [6, 0.0]
  - - [4992, 4992, 1, 384]
    - [15, 0.0]
  - - [34048, 34048, 1, 256]
    - [10, 0.0]
  - - [39168, 39168, 1, 384]
    - [10, 0.0]
  - - [22016, 22016, 1, 256]
    - [21, 0.0]
  - - [40704, 40704, 1, 384]
    - [10, 0.0]
  - - [40704, 40704, 1, 256]
    - [10, 0.0]
  - - [16384, 16384, 1, 256]
    - [18, 0.0]
  - - [8064, 8064, 1, 384]
    - [11, 0.0]
  - - [16896, 16896, 1, 256]
    - [22, 0.0]
  - - [128, 35968, 1, 256]
    - [35, 0.0]
  - - [128, 20608, 1, 384]
    - [35, 0.0]
  - - [128, 2688, 1, 128]
    - [32, 0.0]
  - - [128, 11648, 1, 384]
    - [34, 0.0]
  - - [128, 38528, 1, 256]
    - [35, 0.0]
  - - [128, 3968, 1, 128]
    - [35, 0.0]
  - - [128, 14208, 1, 384]
    - [35, 0.0]
  - - [128, 30848, 1, 256]
    - [35, 0.0]
  - - [128, 37248, 1, 128]
    - [35, 0.0]
  - - [128, 6528, 1, 384]
    - [31, 0.0]
  - - [128, 33408, 1, 256]
    - [35, 0.0]
  - - [128, 24448, 1, 256]
    - [35, 0.0]
  - - [128, 28288, 1, 128]
    - [35, 0.0]
  - - [128, 25728, 1, 256]
    - [35, 0.0]
  - - [128, 1408, 1, 384]
    - [35, 0.0]
  - - [128, 19328, 1, 256]
    - [35, 0.0]
  - - [128, 44928, 1, 384]
    - [35, 0.0]
  - - [128, 20608, 1, 256]
    - [35, 0.0]
  - - [128, 11648, 1, 128]
    - [35, 0.0]
  - - [128, 11648, 1, 256]
    - [35, 0.0]
  - - [128, 9088, 1, 128]
    - [35, 0.0]
  - - [128, 15488, 1, 128]
    - [35, 0.0]
  - - [128, 7808, 1, 384]
    - [36, 0.0]
  - - [128, 14208, 1, 256]
    - [35, 0.0]
  - - [128, 9088, 1, 384]
    - [35, 0.0]
  - - [128, 18048, 1, 128]
    - [35, 0.0]
  - - [128, 41088, 1, 384]
    - [35, 0.0]
  - - [128, 19328, 1, 384]
    - [35, 0.0]
  - - [128, 24448, 1, 128]
    - [35, 0.0]
  - - [128, 9088, 1, 256]
    - [32, 0.0]
  - - [128, 12928, 1, 128]
    - [35, 0.0]
  - - [128, 1408, 1, 256]
    - [35, 0.0]
  - - [128, 27008, 1, 384]
    - [35, 0.0]
  - - [128, 35968, 1, 384]
    - [35, 0.0]
  - - [128, 19328, 1, 128]
    - [35, 0.0]
  - - [128, 44928, 1, 256]
    - [35, 0.0]
  - - [128, 29568, 1, 384]
    - [35, 0.0]
  - - [128, 21888, 1, 384]
    - [35, 0.0]
  - - [128, 32128, 1, 384]
    - [31, 0.0]
  - - [128, 7808, 1, 256]
    - [32, 0.0]
  - - [128, 14208, 1, 128]
    - [35, 0.0]
  - - [128, 39808, 1, 256]
    - [35, 0.0]
  - - [128, 43648, 1, 128]
    - [35, 0.0]
  - - [128, 41088, 1, 256]
    - [35, 0.0]
  - - [128, 6528, 1, 128]
    - [31, 0.0]
  - - [128, 6528, 1, 256]
    - [35, 0.0]
  - - [128, 32128, 1, 256]
    - [35, 0.0]
  - - [128, 35968, 1, 128]
    - [35, 0.0]
  - - [128, 27008, 1, 128]
    - [35, 0.0]
  - - [128, 2688, 1, 256]
    - [33, 0.0]
  - - [128, 32128, 1, 128]
    - [35, 0.0]
  - - [128, 28288, 1, 384]
    - [35, 0.0]
  - - [128, 34688, 1, 256]
    - [35, 0.0]
  - - [128, 38528, 1, 128]
    - [35, 0.0]
  - - [128, 1408, 1, 128]
    - [35, 0.0]
  - - [128, 27008, 1, 256]
    - [35, 0.0]
  - - [128, 30848, 1, 128]
    - [35, 0.0]
  - - [128, 23168, 1, 384]
    - [31, 0.0]
  - - [128, 29568, 1, 256]
    - [35, 0.0]
  - - [128, 33408, 1, 128]
    - [35, 0.0]
  - - [128, 21888, 1, 128]
    - [35, 0.0]
  - - [128, 42368, 1, 128]
    - [35, 0.0]
  - - [128, 15488, 1, 384]
    - [36, 0.0]
  - - [128, 21888, 1, 256]
    - [35, 0.0]
  - - [128, 25728, 1, 128]
    - [35, 0.0]
  - - [128, 18048, 1, 384]
    - [35, 0.0]
  - - [128, 44928, 1, 128]
    - [35, 0.0]
  - - [128, 10368, 1, 384]
    - [35, 0.0]
  - - [128, 16768, 1, 256]
    - [35, 0.0]
  - - [128, 20608, 1, 128]
    - [35, 0.0]
  - - [128, 42368, 1, 384]
    - [35, 0.0]
  - - [128, 28288, 1, 256]
    - [35, 0.0]
  - - [128, 34688, 1, 128]
    - [35, 0.0]
  - - [128, 3968, 1, 384]
    - [35, 0.0]
  - - [128, 16768, 1, 384]
    - [35, 0.0]
  - - [128, 5248, 1, 384]
    - [34, 0.0]
  - - [128, 23168, 1, 128]
    - [35, 0.0]
  - - [128, 39808, 1, 128]
    - [35, 0.0]
  - - [128, 37248, 1, 384]
    - [35, 0.0]
  - - [128, 23168, 1, 256]
    - [35, 0.0]
  - - [128, 29568, 1, 128]
    - [35, 0.0]
  - - [128, 39808, 1, 384]
    - [31, 0.0]
  - - [128, 128, 1, 384]
    - [33, 0.0]
  - - [128, 3968, 1, 256]
    - [35, 0.0]
  - - [128, 10368, 1, 128]
    - [35, 0.0]
  - - [128, 18048, 1, 256]
    - [35, 0.0]
  - - [128, 43648, 1, 384]
    - [35, 0.0]
  - - [128, 10368, 1, 256]
    - [35, 0.0]
  - - [128, 16768, 1, 128]
    - [35, 0.0]
  - - [128, 42368, 1, 256]
    - [35, 0.0]
  - - [128, 34688, 1, 384]
    - [35, 0.0]
  - - [128, 12928, 1, 256]
    - [35, 0.0]
  - - [128, 38528, 1, 384]
    - [35, 0.0]
  - - [128, 43648, 1, 256]
    - [35, 0.0]
  - - [128, 12928, 1, 384]
    - [35, 0.0]
  - - [128, 5248, 1, 128]
    - [34, 0.0]
  - - [128, 5248, 1, 256]
    - [35, 0.0]
  - - [128, 30848, 1, 384]
    - [36, 0.0]
  - - [128, 37248, 1, 256]
    - [35, 0.0]
  - - [128, 41088, 1, 128]
    - [35, 0.0]
  - - [128, 33408, 1, 384]
    - [35, 0.0]
  - - [128, 7808, 1, 128]
    - [31, 0.0]
  - - [128, 24448, 1, 384]
    - [36, 0.0]
  - - [128, 128, 1, 256]
    - [33, 0.0]
  - - [128, 25728, 1, 384]
    - [35, 0.0]
  - - [128, 15488, 1, 256]
    - [35, 0.0]
  - - [128, 128, 1, 128]
    - [33, 0.0]
  - - [128, 2688, 1, 384]
    - [33, 0.0]
  - - [256, 66, 1, 66]
    - [67, 0.0]
  - - [12544, 66, 1, 66]
    - [59, 0.0]
  - - [3872, 32, 1, 32]
    - [76, 0.0]
  - - [24832, 66, 1, 66]
    - [178, 0.0]
  - - [37200, 48, 1, 48]
    - [92, 0.0]
  - - [21472, 32, 1, 32]
    - [40, 0.0]
  - - [15068, 30, 1, 36]
    - [74, 0.0]
  - - [19200, 30, 1, 36]
    - [37, 0.0]
  - - [23040, 58, 1, 66]
    - [168, 0.0]
  - - [38784, 96, 1, 96]
    - [187, 0.0]
  - - [2160, 48, 1, 48]
    - [37, 0.0]
  - - [24064, 58, 1, 66]
    - [86, 0.0]
  - - [13824, 58, 1, 66]
    - [62, 0.0]
  - - [10656, 96, 1, 96]
    - [96, 0.0]
  - - [26522, 30, 1, 36]
    - [44, 0.0]
  - - [37120, 58, 1, 66]
    - [171, 0.0]
  - - [23998, 66, 1, 66]
    - [57, 0.0]
  - - [3672, 30, 1, 36]
    - [74, 0.0]
  - - [20448, 32, 1, 32]
    - [37, 0.0]
  - - [15520, 32, 1, 32]
    - [80, 0.0]
  - - [28768, 32, 1, 32]
    - [44, 0.0]
  - - [9664, 64, 1, 64]
    - [146, 0.0]
  - - [40672, 32, 1, 32]
    - [80, 0.0]
  - - [18000, 48, 1, 48]
    - [52, 0.0]
  - - [31232, 58, 1, 66]
    - [98, 0.0]
  - - [2528, 32, 1, 32]
    - [37, 0.0]
  - - [18240, 64, 1, 64]
    - [145, 0.0]
  - - [29184, 66, 1, 66]
    - [98, 0.0]
  - - [31104, 96, 1, 96]
    - [96, 0.0]
  - - [1248, 32, 1, 32]
    - [76, 0.0]
  - - [28416, 128, 1, 128]
    - [194, 0.0]
  - - [5340, 30, 1, 36]
    - [37, 0.0]
  - - [43264, 66, 1, 66]
    - [100, 0.0]
  - - [43008, 66, 1, 66]
    - [98, 0.0]
  - - [32768, 66, 1, 66]
    - [101, 0.0]
  - - [20544, 64, 1, 64]
    - [171, 0.0]
  - - [9264, 48, 1, 48]
    - [76, 0.0]
  - - [34944, 48, 1, 48]
    - [52, 0.0]
  - - [16800, 96, 1, 96]
    - [96, 0.0]
  - - [22880, 32, 1, 32]
    - [76, 0.0]
  - - [25088, 124, 1, 132]
    - [146, 0.0]
  - - [39168, 58, 1, 66]
    - [171, 0.0]
  - - [22752, 32, 1, 32]
    - [43, 0.0]
  - - [43488, 32, 1, 32]
    - [40, 0.0]
  - - [17664, 192, 1, 192]
    - [194, 0.0]
  - - [25600, 58, 1, 66]
    - [46, 0.0]
  - - [39936, 192, 1, 192]
    - [203, 0.0]
  - - [7680, 30, 1, 36]
    - [45, 0.0]
  - - [39008, 32, 1, 32]
    - [40, 0.0]
  - - [42752, 58, 1, 66]
    - [98, 0.0]
  - - [8208, 48, 1, 48]
    - [40, 0.0]
  - - [40448, 30, 1, 36]
    - [40, 0.0]
  - - [28320, 96, 1, 96]
    - [160, 0.0]
  - - [19648, 64, 1, 64]
    - [141, 0.0]
  - - [33470, 66, 1, 66]
    - [60, 0.0]
  - - [26736, 48, 1, 48]
    - [51, 0.0]
  - - [30464, 30, 1, 36]
    - [38, 0.0]
  - - [256, 30, 1, 36]
    - [67, 0.0]
  - - [14304, 96, 1, 96]
    - [58, 0.0]
  - - [2106, 58, 1, 66]
    - [45, 0.0]
  - - [416, 32, 1, 32]
    - [40, 0.0]
  - - [20956, 30, 1, 36]
    - [37, 0.0]
  - - [39936, 48, 1, 48]
    - [52, 0.0]
  - - [38656, 30, 1, 36]
    - [45, 0.0]
  - - [36864, 66, 1, 66]
    - [181, 0.0]
  - - [38202, 58, 1, 66]
    - [111, 0.0]
  - - [5632, 58, 1, 66]
    - [124, 0.0]
  - - [29696, 124, 1, 132]
    - [142, 0.0]
  - - [13296, 48, 1, 48]
    - [56, 0.0]
  - - [30464, 66, 1, 66]
    - [98, 0.0]
  - - [28032, 48, 1, 48]
    - [51, 0.0]
  - - [9056, 32, 1, 32]
    - [37, 0.0]
  - - [23360, 64, 1, 64]
    - [114, 0.0]
  - - [41560, 30, 1, 36]
    - [80, 0.0]
  - - [28928, 30, 1, 36]
    - [79, 0.0]
  - - [43008, 96, 1, 96]
    - [207, 0.0]
  - - [27224, 30, 1, 36]
    - [38, 0.0]
  - - [6720, 64, 1, 64]
    - [194, 0.0]
  - - [44288, 66, 1, 66]
    - [182, 0.0]
  - - [40272, 48, 1, 48]
    - [52, 0.0]
  - - [43840, 64, 1, 64]
    - [172, 0.0]
  - - [43872, 32, 1, 32]
    - [40, 0.0]
  - - [35840, 66, 1, 66]
    - [57, 0.0]
  - - [38336, 64, 1, 64]
    - [118, 0.0]
  - - [27600, 48, 1, 48]
    - [136, 0.0]
  - - [1488, 48, 1, 48]
    - [37, 0.0]
  - - [27326, 66, 1, 66]
    - [184, 0.0]
  - - [30480, 48, 1, 48]
    - [51, 0.0]
  - - [1632, 32, 1, 32]
    - [40, 0.0]
  - - [14112, 32, 1, 32]
    - [74, 0.0]
  - - [27200, 64, 1, 64]
    - [117, 0.0]
  - - [8832, 48, 1, 48]
    - [76, 0.0]
  - - [24320, 128, 1, 128]
    - [146, 0.0]
  - - [14746, 30, 1, 36]
    - [37, 0.0]
  - - [11864, 30, 1, 36]
    - [74, 0.0]
  - - [3006, 66, 1, 66]
    - [78, 0.0]
  - - [11184, 48, 1, 48]
    - [51, 0.0]
  - - [8638, 66, 1, 66]
    - [62, 0.0]
  - - [12186, 30, 1, 36]
    - [74, 0.0]
  - - [22784, 30, 1, 36]
    - [74, 0.0]
  - - [26784, 96, 1, 96]
    - [179, 0.0]
  - - [42400, 32, 1, 32]
    - [40, 0.0]
  - - [36384, 32, 1, 32]
    - [76, 0.0]
  - - [40960, 30, 1, 36]
    - [40, 0.0]
  - - [21504, 58, 1, 66]
    - [45, 0.0]
  - - [38640, 48, 1, 48]
    - [52, 0.0]
  - - [40560, 48, 1, 48]
    - [90, 0.0]
  - - [18520, 30, 1, 36]
    - [74, 0.0]
  - - [22416, 48, 1, 48]
    - [54, 0.0]
  - - [29696, 58, 1, 66]
    - [99, 0.0]
  - - [25008, 48, 1, 48]
    - [133, 0.0]
  - - [34048, 58, 1, 66]
    - [117, 0.0]
  - - [8192, 66, 1, 66]
    - [136, 0.0]
  - - [29248, 64, 1, 64]
    - [117, 0.0]
  - - [7712, 32, 1, 32]
    - [40, 0.0]
  - - [20000, 32, 1, 32]
    - [45, 0.0]
  - - [17664, 58, 1, 66]
    - [45, 0.0]
  - - [41712, 48, 1, 48]
    - [90, 0.0]
  - - [15072, 96, 1, 96]
    - [187, 0.0]
  - - [10042, 58, 1, 66]
    - [77, 0.0]
  - - [11674, 30, 1, 36]
    - [37, 0.0]
  - - [15002, 30, 1, 36]
    - [74, 0.0]
  - - [34874, 58, 1, 66]
    - [117, 0.0]
  - - [2304, 58, 1, 66]
    - [40, 0.0]
  - - [3232, 32, 1, 32]
    - [37, 0.0]
  - - [24960, 96, 1, 96]
    - [176, 0.0]
  - - [14848, 124, 1, 132]
    - [62, 0.0]
  - - [35712, 192, 1, 192]
    - [194, 0.0]
  - - [40704, 58, 1, 66]
    - [170, 0.0]
  - - [33850, 58, 1, 66]
    - [85, 0.0]
  - - [5464, 30, 1, 36]
    - [74, 0.0]
  - - [20032, 64, 1, 64]
    - [191, 0.0]
  - - [6848, 64, 1, 64]
    - [145, 0.0]
  - - [18432, 30, 1, 36]
    - [37, 0.0]
  - - [23808, 66, 1, 66]
    - [60, 0.0]
  - - [25856, 58, 1, 66]
    - [64, 0.0]
  - - [42048, 64, 1, 64]
    - [112, 0.0]
  - - [3408, 48, 1, 48]
    - [37, 0.0]
  - - [16640, 128, 1, 128]
    - [142, 0.0]
  - - [33024, 96, 1, 96]
    - [94, 0.0]
  - - [23230, 66, 1, 66]
    - [60, 0.0]
  - - [30288, 48, 1, 48]
    - [56, 0.0]
  - - [41440, 32, 1, 32]
    - [40, 0.0]
  - - [30304, 32, 1, 32]
    - [44, 0.0]
  - - [36064, 32, 1, 32]
    - [40, 0.0]
  - - [2400, 96, 1, 96]
    - [127, 0.0]
  - - [33792, 30, 1, 36]
    - [45, 0.0]
  - - [6108, 30, 1, 36]
    - [37, 0.0]
  - - [27744, 32, 1, 32]
    - [38, 0.0]
  - - [27232, 32, 1, 32]
    - [77, 0.0]
  - - [42304, 64, 1, 64]
    - [118, 0.0]
  - - [31008, 96, 1, 96]
    - [96, 0.0]
  - - [16176, 48, 1, 48]
    - [51, 0.0]
  - - [20832, 32, 1, 32]
    - [74, 0.0]
  - - [34362, 58, 1, 66]
    - [184, 0.0]
  - - [9472, 128, 1, 128]
    - [145, 0.0]
  - - [41180, 30, 1, 36]
    - [74, 0.0]
  - - [29568, 192, 1, 192]
    - [200, 0.0]
  - - [31034, 58, 1, 66]
    - [98, 0.0]
  - - [38848, 64, 1, 64]
    - [118, 0.0]
  - - [22080, 64, 1, 64]
    - [171, 0.0]
  - - [12288, 192, 1, 192]
    - [199, 0.0]
  - - [36030, 66, 1, 66]
    - [60, 0.0]
  - - [1280, 30, 1, 36]
    - [37, 0.0]
  - - [38400, 128, 1, 128]
    - [146, 0.0]
  - - [17760, 32, 1, 32]
    - [40, 0.0]
  - - [31488, 124, 1, 132]
    - [142, 0.0]
  - - [2832, 48, 1, 48]
    - [37, 0.0]
  - - [15872, 30, 1, 36]
    - [74, 0.0]
  - - [29040, 48, 1, 48]
    - [51, 0.0]
  - - [33338, 58, 1, 66]
    - [184, 0.0]
  - - [41662, 66, 1, 66]
    - [100, 0.0]
  - - [29424, 48, 1, 48]
    - [51, 0.0]
  - - [24160, 32, 1, 32]
    - [40, 0.0]
  - - [29696, 128, 1, 128]
    - [194, 0.0]
  - - [2874, 58, 1, 66]
    - [128, 0.0]
  - - [19104, 96, 1, 96]
    - [94, 0.0]
  - - [12448, 32, 1, 32]
    - [37, 0.0]
  - - [33888, 96, 1, 96]
    - [94, 0.0]
  - - [20538, 58, 1, 66]
    - [43, 0.0]
  - - [17728, 64, 1, 64]
    - [141, 0.0]
  - - [25056, 96, 1, 96]
    - [208, 0.0]
  - - [26528, 32, 1, 32]
    - [44, 0.0]
  - - [14080, 124, 1, 132]
    - [144, 0.0]
  - - [1776, 48, 1, 48]
    - [37, 0.0]
  - - [16224, 96, 1, 96]
    - [49, 0.0]
  - - [9440, 32, 1, 32]
    - [119, 0.0]
  - - [27904, 128, 1, 128]
    - [146, 0.0]
  - - [17240, 30, 1, 36]
    - [37, 0.0]
  - - [18652, 30, 1, 36]
    - [37, 0.0]
  - - [22016, 66, 1, 66]
    - [57, 0.0]
  - - [24512, 64, 1, 64]
    - [117, 0.0]
  - - [10368, 96, 1, 96]
    - [94, 0.0]
  - - [13532, 30, 1, 36]
    - [74, 0.0]
  - - [40640, 64, 1, 64]
    - [113, 0.0]
  - - [39680, 30, 1, 36]
    - [76, 0.0]
  - - [37208, 30, 1, 36]
    - [40, 0.0]
  - - [33696, 96, 1, 96]
    - [96, 0.0]
  - - [36608, 124, 1, 132]
    - [142, 0.0]
  - - [40602, 30, 1, 36]
    - [37, 0.0]
  - - [2256, 48, 1, 48]
    - [37, 0.0]
  - - [28928, 128, 1, 128]
    - [195, 0.0]
  - - [36240, 48, 1, 48]
    - [52, 0.0]
  - - [28736, 64, 1, 64]
    - [117, 0.0]
  - - [34012, 30, 1, 36]
    - [80, 0.0]
  - - [26200, 30, 1, 36]
    - [38, 0.0]
  - - [12672, 48, 1, 48]
    - [52, 0.0]
  - - [32512, 128, 1, 128]
    - [142, 0.0]
  - - [22938, 30, 1, 36]
    - [74, 0.0]
  - - [33536, 30, 1, 36]
    - [40, 0.0]
  - - [6846, 66, 1, 66]
    - [59, 0.0]
  - - [23008, 32, 1, 32]
    - [74, 0.0]
  - - [41024, 64, 1, 64]
    - [112, 0.0]
  - - [15024, 48, 1, 48]
    - [51, 0.0]
  - - [24768, 64, 1, 64]
    - [146, 0.0]
  - - [5786, 30, 1, 36]
    - [74, 0.0]
  - - [10560, 64, 1, 64]
    - [195, 0.0]
  - - [29280, 32, 1, 32]
    - [46, 0.0]
  - - [38042, 30, 1, 36]
    - [40, 0.0]
  - - [40448, 128, 1, 128]
    - [146, 0.0]
  - - [14976, 192, 1, 192]
    - [190, 0.0]
  - - [43008, 58, 1, 66]
    - [98, 0.0]
  - - [10336, 32, 1, 32]
    - [119, 0.0]
  - - [38400, 96, 1, 96]
    - [162, 0.0]
  - - [31648, 32, 1, 32]
    - [46, 0.0]
  - - [33536, 124, 1, 132]
    - [146, 0.0]
  - - [4752, 48, 1, 48]
    - [122, 0.0]
  - - [29850, 30, 1, 36]
    - [38, 0.0]
  - - [16896, 58, 1, 66]
    - [43, 0.0]
  - - [40896, 64, 1, 64]
    - [115, 0.0]
  - - [26778, 30, 1, 36]
    - [38, 0.0]
  - - [28944, 48, 1, 48]
    - [133, 0.0]
  - - [3680, 32, 1, 32]
    - [37, 0.0]
  - - [9472, 58, 1, 66]
    - [80, 0.0]
  - - [1792, 66, 1, 66]
    - [139, 0.0]
  - - [11776, 66, 1, 66]
    - [96, 0.0]
  - - [26558, 66, 1, 66]
    - [179, 0.0]
  - - [33024, 124, 1, 132]
    - [146, 0.0]
  - - [1312, 32, 1, 32]
    - [40, 0.0]
  - - [17952, 96, 1, 96]
    - [94, 0.0]
  - - [39552, 192, 1, 192]
    - [195, 0.0]
  - - [43456, 64, 1, 64]
    - [118, 0.0]
  - - [13056, 48, 1, 48]
    - [51, 0.0]
  - - [3696, 48, 1, 48]
    - [37, 0.0]
  - - [18048, 48, 1, 48]
    - [52, 0.0]
  - - [5376, 96, 1, 96]
    - [178, 0.0]
  - - [13312, 58, 1, 66]
    - [62, 0.0]
  - - [1056, 32, 1, 32]
    - [37, 0.0]
  - - [11136, 192, 1, 192]
    - [145, 0.0]
  - - [1112, 30, 1, 36]
    - [40, 0.0]
  - - [31320, 30, 1, 36]
    - [38, 0.0]
  - - [32000, 66, 1, 66]
    - [99, 0.0]
  - - [23552, 66, 1, 66]
    - [57, 0.0]
  - - [35760, 48, 1, 48]
    - [94, 0.0]
  - - [13392, 48, 1, 48]
    - [51, 0.0]
  - - [30096, 48, 1, 48]
    - [51, 0.0]
  - - [27194, 58, 1, 66]
    - [63, 0.0]
  - - [31422, 66, 1, 66]
    - [98, 0.0]
  - - [11264, 124, 1, 132]
    - [88, 0.0]
  - - [34528, 32, 1, 32]
    - [80, 0.0]
  - - [12800, 66, 1, 66]
    - [59, 0.0]
  - - [44256, 32, 1, 32]
    - [40, 0.0]
  - - [38488, 30, 1, 36]
    - [76, 0.0]
  - - [736, 32, 1, 32]
    - [37, 0.0]
  - - [732, 30, 1, 36]
    - [67, 0.0]
  - - [38400, 192, 1, 192]
    - [199, 0.0]
  - - [31104, 48, 1, 48]
    - [51, 0.0]
  - - [42480, 48, 1, 48]
    - [52, 0.0]
  - - [28416, 124, 1, 132]
    - [172, 0.0]
  - - [16944, 48, 1, 48]
    - [57, 0.0]
  - - [35328, 96, 1, 96]
    - [94, 0.0]
  - - [29952, 192, 1, 192]
    - [195, 0.0]
  - - [43578, 58, 1, 66]
    - [118, 0.0]
  - - [15192, 30, 1, 36]
    - [37, 0.0]
  - - [38912, 66, 1, 66]
    - [182, 0.0]
  - - [29472, 32, 1, 32]
    - [41, 0.0]
  - - [14272, 64, 1, 64]
    - [142, 0.0]
  - - [29280, 96, 1, 96]
    - [94, 0.0]
  - - [768, 192, 1, 192]
    - [139, 0.0]
  - - [27264, 192, 1, 192]
    - [194, 0.0]
  - - [17664, 66, 1, 66]
    - [60, 0.0]
  - - [42972, 30, 1, 36]
    - [37, 0.0]
  - - [11264, 30, 1, 36]
    - [74, 0.0]
  - - [22624, 32, 1, 32]
    - [45, 0.0]
  - - [25344, 30, 1, 36]
    - [75, 0.0]
  - - [22272, 48, 1, 48]
    - [54, 0.0]
  - - [37852, 30, 1, 36]
    - [76, 0.0]
  - - [42328, 30, 1, 36]
    - [40, 0.0]
  - - [15888, 48, 1, 48]
    - [51, 0.0]
  - - [18688, 128, 1, 128]
    - [195, 0.0]
  - - [32992, 32, 1, 32]
    - [37, 0.0]
  - - [35184, 48, 1, 48]
    - [52, 0.0]
  - - [40448, 124, 1, 132]
    - [142, 0.0]
  - - [21760, 128, 1, 128]
    - [146, 0.0]
  - - [11776, 30, 1, 36]
    - [37, 0.0]
  - - [9786, 58, 1, 66]
    - [76, 0.0]
  - - [576, 64, 1, 64]
    - [37, 0.0]
  - - [1952, 32, 1, 32]
    - [37, 0.0]
  - - [40480, 32, 1, 32]
    - [76, 0.0]
  - - [28350, 66, 1, 66]
    - [98, 0.0]
  - - [20926, 66, 1, 66]
    - [98, 0.0]
  - - [5216, 32, 1, 32]
    - [76, 0.0]
  - - [20480, 66, 1, 66]
    - [100, 0.0]
  - - [39360, 64, 1, 64]
    - [112, 0.0]
  - - [43996, 30, 1, 36]
    - [45, 0.0]
  - - [12032, 58, 1, 66]
    - [131, 0.0]
  - - [19932, 30, 1, 36]
    - [74, 0.0]
  - - [35328, 30, 1, 36]
    - [40, 0.0]
  - - [32976, 48, 1, 48]
    - [54, 0.0]
  - - [22720, 64, 1, 64]
    - [117, 0.0]
  - - [12384, 32, 1, 32]
    - [119, 0.0]
  - - [35328, 124, 1, 132]
    - [142, 0.0]
  - - [42298, 58, 1, 66]
    - [115, 0.0]
  - - [23328, 32, 1, 32]
    - [37, 0.0]
  - - [32704, 64, 1, 64]
    - [114, 0.0]
  - - [8064, 96, 1, 96]
    - [209, 0.0]
  - - [16352, 32, 1, 32]
    - [43, 0.0]
  - - [34112, 64, 1, 64]
    - [168, 0.0]
  - - [37946, 58, 1, 66]
    - [115, 0.0]
  - - [20282, 58, 1, 66]
    - [45, 0.0]
  - - [42144, 32, 1, 32]
    - [76, 0.0]
  - - [4864, 124, 1, 132]
    - [56, 0.0]
  - - [30752, 32, 1, 32]
    - [38, 0.0]
  - - [20736, 96, 1, 96]
    - [94, 0.0]
  - - [32784, 48, 1, 48]
    - [52, 0.0]
  - - [30528, 64, 1, 64]
    - [117, 0.0]
  - - [3552, 96, 1, 96]
    - [122, 0.0]
  - - [7936, 128, 1, 128]
    - [72, 0.0]
  - - [11232, 32, 1, 32]
    - [122, 0.0]
  - - [11096, 30, 1, 36]
    - [120, 0.0]
  - - [2494, 66, 1, 66]
    - [45, 0.0]
  - - [44160, 192, 1, 192]
    - [203, 0.0]
  - - [20352, 96, 1, 96]
    - [94, 0.0]
  - - [6576, 48, 1, 48]
    - [119, 0.0]
  - - [1434, 30, 1, 36]
    - [74, 0.0]
  - - [37104, 48, 1, 48]
    - [90, 0.0]
  - - [28892, 30, 1, 36]
    - [38, 0.0]
  - - [36864, 96, 1, 96]
    - [157, 0.0]
  - - [18656, 32, 1, 32]
    - [76, 0.0]
  - - [18074, 30, 1, 36]
    - [37, 0.0]
  - - [34176, 96, 1, 96]
    - [96, 0.0]
  - - [21024, 32, 1, 32]
    - [37, 0.0]
  - - [43360, 32, 1, 32]
    - [45, 0.0]
  - - [18432, 124, 1, 132]
    - [148, 0.0]
  - - [32832, 64, 1, 64]
    - [111, 0.0]
  - - [38714, 58, 1, 66]
    - [118, 0.0]
  - - [38624, 32, 1, 32]
    - [76, 0.0]
  - - [8032, 32, 1, 32]
    - [37, 0.0]
  - - [40992, 96, 1, 96]
    - [161, 0.0]
  - - [31936, 64, 1, 64]
    - [117, 0.0]
  - - [36704, 32, 1, 32]
    - [76, 0.0]
  - - [30384, 48, 1, 48]
    - [51, 0.0]
  - - [32576, 64, 1, 64]
    - [117, 0.0]
  - - [23424, 48, 1, 48]
    - [52, 0.0]
  - - [9728, 66, 1, 66]
    - [62, 0.0]
  - - [28248, 30, 1, 36]
    - [38, 0.0]
  - - [3104, 32, 1, 32]
    - [76, 0.0]
  - - [5760, 192, 1, 192]
    - [96, 0.0]
  - - [3616, 32, 1, 32]
    - [74, 0.0]
  - - [13280, 32, 1, 32]
    - [74, 0.0]
  - - [41984, 124, 1, 132]
    - [146, 0.0]
  - - [10298, 58, 1, 66]
    - [76, 0.0]
  - - [42554, 58, 1, 66]
    - [100, 0.0]
  - - [8858, 30, 1, 36]
    - [74, 0.0]
  - - [4464, 48, 1, 48]
    - [173, 0.0]
  - - [14080, 58, 1, 66]
    - [62, 0.0]
  - - [12704, 32, 1, 32]
    - [37, 0.0]
  - - [36912, 48, 1, 48]
    - [57, 0.0]
  - - [37720, 30, 1, 36]
    - [80, 0.0]
  - - [33280, 66, 1, 66]
    - [184, 0.0]
  - - [28928, 58, 1, 66]
    - [101, 0.0]
  - - [27696, 48, 1, 48]
    - [53, 0.0]
  - - [13144, 30, 1, 36]
    - [37, 0.0]
  - - [8832, 192, 1, 192]
    - [194, 0.0]
  - - [15418, 58, 1, 66]
    - [62, 0.0]
  - - [31552, 64, 1, 64]
    - [117, 0.0]
  - - [32256, 96, 1, 96]
    - [163, 0.0]
  - - [41856, 96, 1, 96]
    - [155, 0.0]
  - - [17232, 48, 1, 48]
    - [94, 0.0]
  - - [18944, 58, 1, 66]
    - [45, 0.0]
  - - [35664, 48, 1, 48]
    - [94, 0.0]
  - - [40320, 48, 1, 48]
    - [54, 0.0]
  - - [44032, 58, 1, 66]
    - [98, 0.0]
  - - [20992, 66, 1, 66]
    - [98, 0.0]
  - - [35072, 124, 1, 132]
    - [146, 0.0]
  - - [3936, 96, 1, 96]
    - [124, 0.0]
  - - [1500, 30, 1, 36]
    - [74, 0.0]
  - - [34976, 32, 1, 32]
    - [45, 0.0]
  - - [41882, 30, 1, 36]
    - [40, 0.0]
  - - [32672, 32, 1, 32]
    - [41, 0.0]
  - - [11568, 48, 1, 48]
    - [56, 0.0]
  - - [19584, 192, 1, 192]
    - [194, 0.0]
  - - [17978, 58, 1, 66]
    - [45, 0.0]
  - - [12672, 192, 1, 192]
    - [194, 0.0]
  - - [26272, 32, 1, 32]
    - [38, 0.0]
  - - [23384, 30, 1, 36]
    - [40, 0.0]
  - - [36096, 66, 1, 66]
    - [182, 0.0]
  - - [22464, 64, 1, 64]
    - [117, 0.0]
  - - [14112, 96, 1, 96]
    - [58, 0.0]
  - - [19968, 192, 1, 192]
    - [197, 0.0]
  - - [17408, 58, 1, 66]
    - [45, 0.0]
  - - [19646, 66, 1, 66]
    - [57, 0.0]
  - - [42496, 58, 1, 66]
    - [98, 0.0]
  - - [6912, 30, 1, 36]
    - [74, 0.0]
  - - [1792, 58, 1, 66]
    - [119, 0.0]
  - - [35744, 32, 1, 32]
    - [40, 0.0]
  - - [36828, 30, 1, 36]
    - [76, 0.0]
  - - [10512, 48, 1, 48]
    - [51, 0.0]
  - - [25278, 66, 1, 66]
    - [178, 0.0]
  - - [5376, 48, 1, 48]
    - [122, 0.0]
  - - [17568, 32, 1, 32]
    - [78, 0.0]
  - - [15872, 124, 1, 132]
    - [62, 0.0]
  - - [30010, 58, 1, 66]
    - [99, 0.0]
  - - [20064, 96, 1, 96]
    - [94, 0.0]
  - - [41136, 48, 1, 48]
    - [54, 0.0]
  - - [6458, 58, 1, 66]
    - [124, 0.0]
  - - [11936, 32, 1, 32]
    - [37, 0.0]
  - - [39834, 30, 1, 36]
    - [80, 0.0]
  - - [37888, 124, 1, 132]
    - [146, 0.0]
  - - [512, 128, 1, 128]
    - [119, 0.0]
  - - [23616, 64, 1, 64]
    - [117, 0.0]
  - - [15600, 48, 1, 48]
    - [51, 0.0]
  - - [17664, 128, 1, 128]
    - [148, 0.0]
  - - [27680, 32, 1, 32]
    - [41, 0.0]
  - - [30912, 64, 1, 64]
    - [117, 0.0]
  - - [10080, 96, 1, 96]
    - [96, 0.0]
  - - [36512, 32, 1, 32]
    - [37, 0.0]
  - - [41312, 32, 1, 32]
    - [76, 0.0]
  - - [28128, 96, 1, 96]
    - [154, 0.0]
  - - [41184, 32, 1, 32]
    - [40, 0.0]
  - - [13120, 64, 1, 64]
    - [192, 0.0]
  - - [3548, 30, 1, 36]
    - [74, 0.0]
  - - [31072, 32, 1, 32]
    - [46, 0.0]
  - - [11232, 96, 1, 96]
    - [92, 0.0]
  - - [20824, 30, 1, 36]
    - [78, 0.0]
  - - [26112, 192, 1, 192]
    - [202, 0.0]
  - - [43264, 30, 1, 36]
    - [40, 0.0]
  - - [768, 124, 1, 132]
    - [119, 0.0]
  - - [5632, 124, 1, 132]
    - [84, 0.0]
  - - [12544, 128, 1, 128]
    - [145, 0.0]
  - - [38944, 32, 1, 32]
    - [76, 0.0]
  - - [32400, 48, 1, 48]
    - [51, 0.0]
  - - [40192, 58, 1, 66]
    - [118, 0.0]
  - - [19008, 64, 1, 64]
    - [147, 0.0]
  - - [4320, 96, 1, 96]
    - [121, 0.0]
  - - [27992, 30, 1, 36]
    - [38, 0.0]
  - - [35328, 128, 1, 128]
    - [195, 0.0]
  - - [4286, 66, 1, 66]
    - [125, 0.0]
  - - [41408, 64, 1, 64]
    - [115, 0.0]
  - - [38364, 30, 1, 36]
    - [80, 0.0]
  - - [4272, 48, 1, 48]
    - [45, 0.0]
  - - [13466, 30, 1, 36]
    - [37, 0.0]
  - - [6528, 96, 1, 96]
    - [43, 0.0]
  - - [38144, 58, 1, 66]
    - [117, 0.0]
  - - [16992, 96, 1, 96]
    - [94, 0.0]
  - - [21760, 124, 1, 132]
    - [146, 0.0]
  - - [2048, 128, 1, 128]
    - [141, 0.0]
  - - [42394, 30, 1, 36]
    - [40, 0.0]
  - - [29754, 58, 1, 66]
    - [99, 0.0]
  - - [18912, 32, 1, 32]
    - [40, 0.0]
  - - [14048, 32, 1, 32]
    - [74, 0.0]
  - - [18576, 48, 1, 48]
    - [90, 0.0]
  - - [15840, 32, 1, 32]
    - [74, 0.0]
  - - [30000, 48, 1, 48]
    - [56, 0.0]
  - - [43930, 30, 1, 36]
    - [80, 0.0]
  - - [29632, 64, 1, 64]
    - [117, 0.0]
  - - [7424, 66, 1, 66]
    - [56, 0.0]
  - - [768, 66, 1, 66]
    - [37, 0.0]
  - - [16640, 124, 1, 132]
    - [88, 0.0]
  - - [6944, 32, 1, 32]
    - [74, 0.0]
  - - [34560, 128, 1, 128]
    - [146, 0.0]
  - - [33880, 30, 1, 36]
    - [37, 0.0]
  - - [28826, 30, 1, 36]
    - [75, 0.0]
  - - [24510, 66, 1, 66]
    - [57, 0.0]
  - - [25688, 30, 1, 36]
    - [38, 0.0]
  - - [17520, 48, 1, 48]
    - [52, 0.0]
  - - [1152, 192, 1, 192]
    - [139, 0.0]
  - - [10080, 32, 1, 32]
    - [127, 0.0]
  - - [512, 58, 1, 66]
    - [37, 0.0]
  - - [4384, 32, 1, 32]
    - [37, 0.0]
  - - [39424, 124, 1, 132]
    - [142, 0.0]
  - - [6752, 32, 1, 32]
    - [45, 0.0]
  - - [1536, 66, 1, 66]
    - [139, 0.0]
  - - [4032, 64, 1, 64]
    - [141, 0.0]
  - - [6744, 30, 1, 36]
    - [37, 0.0]
  - - [7424, 124, 1, 132]
    - [64, 0.0]
  - - [15616, 66, 1, 66]
    - [56, 0.0]
  - - [40704, 124, 1, 132]
    - [142, 0.0]
  - - [37274, 30, 1, 36]
    - [80, 0.0]
  - - [27582, 66, 1, 66]
    - [100, 0.0]
  - - [34080, 96, 1, 96]
    - [94, 0.0]
  - - [21072, 48, 1, 48]
    - [54, 0.0]
  - - [8448, 128, 1, 128]
    - [69, 0.0]
  - - [3328, 124, 1, 132]
    - [127, 0.0]
  - - [16960, 64, 1, 64]
    - [147, 0.0]
  - - [24416, 32, 1, 32]
    - [40, 0.0]
  - - [23808, 30, 1, 36]
    - [37, 0.0]
  - - [26208, 96, 1, 96]
    - [154, 0.0]
  - - [37340, 30, 1, 36]
    - [74, 0.0]
  - - [12512, 32, 1, 32]
    - [173, 0.0]
  - - [220, 30, 1, 36]
    - [40, 0.0]
  - - [37680, 48, 1, 48]
    - [57, 0.0]
  - - [36384, 96, 1, 96]
    - [163, 0.0]
  - - [23896, 30, 1, 36]
    - [78, 0.0]
  - - [33408, 48, 1, 48]
    - [57, 0.0]
  - - [19544, 30, 1, 36]
    - [78, 0.0]
  - - [12336, 48, 1, 48]
    - [53, 0.0]
  - - [20672, 64, 1, 64]
    - [117, 0.0]
  - - [18912, 96, 1, 96]
    - [96, 0.0]
  - - [34464, 32, 1, 32]
    - [81, 0.0]
  - - [43776, 48, 1, 48]
    - [52, 0.0]
  - - [21888, 96, 1, 96]
    - [94, 0.0]
  - - [20736, 192, 1, 192]
    - [194, 0.0]
  - - [30688, 32, 1, 32]
    - [41, 0.0]
  - - [2560, 30, 1, 36]
    - [37, 0.0]
  - - [39900, 30, 1, 36]
    - [45, 0.0]
  - - [39000, 30, 1, 36]
    - [74, 0.0]
  - - [23568, 48, 1, 48]
    - [54, 0.0]
  - - [22656, 192, 1, 192]
    - [194, 0.0]
  - - [26112, 48, 1, 48]
    - [133, 0.0]
  - - [31344, 48, 1, 48]
    - [133, 0.0]
  - - [28474, 58, 1, 66]
    - [99, 0.0]
  - - [24064, 124, 1, 132]
    - [142, 0.0]
  - - [38112, 96, 1, 96]
    - [187, 0.0]
  - - [8960, 30, 1, 36]
    - [44, 0.0]
  - - [16604, 30, 1, 36]
    - [37, 0.0]
  - - [1082, 58, 1, 66]
    - [37, 0.0]
  - - [36416, 64, 1, 64]
    - [168, 0.0]
  - - [7584, 32, 1, 32]
    - [37, 0.0]
  - - [24096, 32, 1, 32]
    - [37, 0.0]
  - - [28800, 96, 1, 96]
    - [96, 0.0]
  - - [15104, 30, 1, 36]
    - [45, 0.0]
  - - [29440, 58, 1, 66]
    - [99, 0.0]
  - - [4608, 96, 1, 96]
    - [178, 0.0]
  - - [13024, 32, 1, 32]
    - [37, 0.0]
  - - [12288, 58, 1, 66]
    - [45, 0.0]
  - - [38656, 124, 1, 132]
    - [146, 0.0]
  - - [4080, 48, 1, 48]
    - [45, 0.0]
  - - [18944, 30, 1, 36]
    - [78, 0.0]
  - - [17664, 96, 1, 96]
    - [96, 0.0]
  - - [7520, 32, 1, 32]
    - [124, 0.0]
  - - [41472, 48, 1, 48]
    - [57, 0.0]
  - - [27872, 32, 1, 32]
    - [75, 0.0]
  - - [13888, 64, 1, 64]
    - [142, 0.0]
  - - [41406, 66, 1, 66]
    - [98, 0.0]
  - - [20768, 32, 1, 32]
    - [37, 0.0]
  - - [4560, 48, 1, 48]
    - [74, 0.0]
  - - [16512, 192, 1, 192]
    - [194, 0.0]
  - - [16656, 48, 1, 48]
    - [52, 0.0]
  - - [33690, 30, 1, 36]
    - [43, 0.0]
  - - [15616, 58, 1, 66]
    - [62, 0.0]
  - - [33792, 96, 1, 96]
    - [94, 0.0]
  - - [40160, 32, 1, 32]
    - [45, 0.0]
  - - [22784, 124, 1, 132]
    - [142, 0.0]
  - - [10592, 32, 1, 32]
    - [119, 0.0]
  - - [38912, 58, 1, 66]
    - [117, 0.0]
  - - [12376, 30, 1, 36]
    - [37, 0.0]
  - - [10174, 66, 1, 66]
    - [62, 0.0]
  - - [1968, 48, 1, 48]
    - [37, 0.0]
  - - [7296, 192, 1, 192]
    - [149, 0.0]
  - - [7066, 30, 1, 36]
    - [45, 0.0]
  - - [37632, 128, 1, 128]
    - [146, 0.0]
  - - [18908, 30, 1, 36]
    - [76, 0.0]
  - - [34816, 128, 1, 128]
    - [194, 0.0]
  - - [7360, 64, 1, 64]
    - [145, 0.0]
  - - [29952, 124, 1, 132]
    - [142, 0.0]
  - - [2816, 128, 1, 128]
    - [124, 0.0]
  - - [34268, 30, 1, 36]
    - [40, 0.0]
  - - [22872, 30, 1, 36]
    - [74, 0.0]
  - - [22240, 32, 1, 32]
    - [37, 0.0]
  - - [35584, 124, 1, 132]
    - [142, 0.0]
  - - [912, 48, 1, 48]
    - [37, 0.0]
  - - [27392, 66, 1, 66]
    - [98, 0.0]
  - - [15552, 64, 1, 64]
    - [192, 0.0]
  - - [24032, 32, 1, 32]
    - [43, 0.0]
  - - [23472, 48, 1, 48]
    - [54, 0.0]
  - - [16416, 96, 1, 96]
    - [96, 0.0]
  - - [16192, 64, 1, 64]
    - [113, 0.0]
  - - [7168, 66, 1, 66]
    - [136, 0.0]
  - - [43104, 32, 1, 32]
    - [40, 0.0]
  - - [10784, 32, 1, 32]
    - [119, 0.0]
  - - [42752, 128, 1, 128]
    - [142, 0.0]
  - - [10430, 66, 1, 66]
    - [62, 0.0]
  - - [32928, 32, 1, 32]
    - [37, 0.0]
  - - [38208, 64, 1, 64]
    - [118, 0.0]
  - - [17504, 32, 1, 32]
    - [37, 0.0]
  - - [12602, 58, 1, 66]
    - [77, 0.0]
  - - [25402, 58, 1, 66]
    - [62, 0.0]
  - - [35264, 64, 1, 64]
    - [168, 0.0]
  - - [3994, 30, 1, 36]
    - [80, 0.0]
  - - [14208, 96, 1, 96]
    - [58, 0.0]
  - - [6000, 48, 1, 48]
    - [119, 0.0]
  - - [32256, 58, 1, 66]
    - [98, 0.0]
  - - [1280, 58, 1, 66]
    - [37, 0.0]
  - - [13344, 96, 1, 96]
    - [45, 0.0]
  - - [21336, 30, 1, 36]
    - [43, 0.0]
  - - [34714, 30, 1, 36]
    - [43, 0.0]
  - - [8536, 30, 1, 36]
    - [74, 0.0]
  - - [13056, 96, 1, 96]
    - [45, 0.0]
  - - [33248, 32, 1, 32]
    - [76, 0.0]
  - - [20480, 124, 1, 132]
    - [172, 0.0]
  - - [14688, 32, 1, 32]
    - [37, 0.0]
  - - [33632, 32, 1, 32]
    - [37, 0.0]
  - - [6480, 48, 1, 48]
    - [119, 0.0]
  - - [28800, 192, 1, 192]
    - [194, 0.0]
  - - [26656, 32, 1, 32]
    - [46, 0.0]
  - - [1504, 32, 1, 32]
    - [37, 0.0]
  - - [28752, 48, 1, 48]
    - [51, 0.0]
  - - [5472, 32, 1, 32]
    - [40, 0.0]
  - - [32000, 30, 1, 36]
    - [44, 0.0]
  - - [27904, 58, 1, 66]
    - [99, 0.0]
  - - [31680, 64, 1, 64]
    - [117, 0.0]
  - - [18688, 124, 1, 132]
    - [145, 0.0]
  - - [4064, 32, 1, 32]
    - [43, 0.0]
  - - [9180, 30, 1, 36]
    - [74, 0.0]
  - - [23872, 64, 1, 64]
    - [171, 0.0]
  - - [36768, 96, 1, 96]
    - [160, 0.0]
  - - [10752, 96, 1, 96]
    - [60, 0.0]
  - - [18366, 66, 1, 66]
    - [57, 0.0]
  - - [30672, 48, 1, 48]
    - [59, 0.0]
  - - [19248, 48, 1, 48]
    - [94, 0.0]
  - - [9888, 32, 1, 32]
    - [119, 0.0]
  - - [33280, 124, 1, 132]
    - [146, 0.0]
  - - [30944, 32, 1, 32]
    - [38, 0.0]
  - - [32864, 32, 1, 32]
    - [80, 0.0]
  - - [29856, 96, 1, 96]
    - [96, 0.0]
  - - [3072, 192, 1, 192]
    - [44, 0.0]
  - - [1024, 58, 1, 66]
    - [37, 0.0]
  - - [12544, 30, 1, 36]
    - [74, 0.0]
  - - [37248, 192, 1, 192]
    - [203, 0.0]
  - - [19360, 32, 1, 32]
    - [37, 0.0]
  - - [18192, 48, 1, 48]
    - [90, 0.0]
  - - [10496, 128, 1, 128]
    - [147, 0.0]
  - - [20992, 58, 1, 66]
    - [45, 0.0]
  - - [21744, 48, 1, 48]
    - [54, 0.0]
  - - [13536, 96, 1, 96]
    - [45, 0.0]
  - - [39424, 66, 1, 66]
    - [184, 0.0]
  - - [17664, 48, 1, 48]
    - [52, 0.0]
  - - [25248, 96, 1, 96]
    - [178, 0.0]
  - - [1850, 58, 1, 66]
    - [37, 0.0]
  - - [8736, 96, 1, 96]
    - [96, 0.0]
  - - [38656, 128, 1, 128]
    - [142, 0.0]
  - - [23296, 30, 1, 36]
    - [78, 0.0]
  - - [29504, 64, 1, 64]
    - [116, 0.0]
  - - [4848, 48, 1, 48]
    - [119, 0.0]
  - - [11296, 32, 1, 32]
    - [173, 0.0]
  - - [12000, 32, 1, 32]
    - [37, 0.0]
  - - [20128, 32, 1, 32]
    - [45, 0.0]
  - - [27136, 124, 1, 132]
    - [145, 0.0]
  - - [4352, 30, 1, 36]
    - [46, 0.0]
  - - [28094, 66, 1, 66]
    - [98, 0.0]
  - - [42208, 32, 1, 32]
    - [45, 0.0]
  - - [35416, 30, 1, 36]
    - [37, 0.0]
  - - [1152, 96, 1, 96]
    - [119, 0.0]
  - - [3804, 30, 1, 36]
    - [37, 0.0]
  - - [27706, 58, 1, 66]
    - [99, 0.0]
  - - [24064, 30, 1, 36]
    - [76, 0.0]
  - - [28960, 32, 1, 32]
    - [41, 0.0]
  - - [24664, 30, 1, 36]
    - [38, 0.0]
  - - [3072, 124, 1, 132]
    - [124, 0.0]
  - - [30176, 32, 1, 32]
    - [38, 0.0]
  - - [34704, 48, 1, 48]
    - [52, 0.0]
  - - [42496, 124, 1, 132]
    - [146, 0.0]
  - - [7392, 96, 1, 96]
    - [153, 0.0]
  - - [23808, 58, 1, 66]
    - [117, 0.0]
  - - [43616, 32, 1, 32]
    - [40, 0.0]
  - - [2624, 64, 1, 64]
    - [141, 0.0]
  - - [4192, 32, 1, 32]
    - [119, 0.0]
  - - [39168, 66, 1, 66]
    - [182, 0.0]
  - - [24766, 66, 1, 66]
    - [184, 0.0]
  - - [26588, 30, 1, 36]
    - [75, 0.0]
  - - [14014, 66, 1, 66]
    - [56, 0.0]
  - - [3036, 30, 1, 36]
    - [74, 0.0]
  - - [5808, 48, 1, 48]
    - [122, 0.0]
  - - [666, 30, 1, 36]
    - [67, 0.0]
  - - [11072, 64, 1, 64]
    - [143, 0.0]
  - - [17824, 32, 1, 32]
    - [45, 0.0]
  - - [7296, 48, 1, 48]
    - [119, 0.0]
  - - [37120, 30, 1, 36]
    - [40, 0.0]
  - - [5280, 32, 1, 32]
    - [37, 0.0]
  - - [13440, 96, 1, 96]
    - [43, 0.0]
  - - [40416, 96, 1, 96]
    - [163, 0.0]
  - - [11008, 124, 1, 132]
    - [86, 0.0]
  - - [20112, 48, 1, 48]
    - [60, 0.0]
  - - [23744, 64, 1, 64]
    - [117, 0.0]
  - - [13824, 48, 1, 48]
    - [51, 0.0]
  - - [32304, 48, 1, 48]
    - [51, 0.0]
  - - [39256, 30, 1, 36]
    - [45, 0.0]
  - - [1880, 30, 1, 36]
    - [37, 0.0]
  - - [27546, 30, 1, 36]
    - [46, 0.0]
  - - [13248, 64, 1, 64]
    - [142, 0.0]
  - - [4864, 66, 1, 66]
    - [124, 0.0]
  - - [4096, 66, 1, 66]
    - [176, 0.0]
  - - [37280, 32, 1, 32]
    - [45, 0.0]
  - - [4672, 64, 1, 64]
    - [124, 0.0]
  - - [9120, 96, 1, 96]
    - [123, 0.0]
  - - [18176, 128, 1, 128]
    - [144, 0.0]
  - - [32768, 58, 1, 66]
    - [99, 0.0]
  - - [41626, 30, 1, 36]
    - [40, 0.0]
  - - [18622, 66, 1, 66]
    - [60, 0.0]
  - - [26880, 66, 1, 66]
    - [57, 0.0]
  - - [19296, 32, 1, 32]
    - [37, 0.0]
  - - [13632, 64, 1, 64]
    - [142, 0.0]
  - - [16794, 30, 1, 36]
    - [74, 0.0]
  - - [26682, 58, 1, 66]
    - [63, 0.0]
  - - [18720, 96, 1, 96]
    - [94, 0.0]
  - - [6768, 48, 1, 48]
    - [119, 0.0]
  - - [25248, 32, 1, 32]
    - [38, 0.0]
  - - [8192, 58, 1, 66]
    - [124, 0.0]
  - - [11808, 32, 1, 32]
    - [37, 0.0]
  - - [5984, 32, 1, 32]
    - [37, 0.0]
  - - [23040, 124, 1, 132]
    - [141, 0.0]
  - - [29664, 96, 1, 96]
    - [96, 0.0]
  - - [11040, 32, 1, 32]
    - [173, 0.0]
  - - [40382, 66, 1, 66]
    - [184, 0.0]
  - - [36192, 32, 1, 32]
    - [40, 0.0]
  - - [4184, 30, 1, 36]
    - [40, 0.0]
  - - [24928, 32, 1, 32]
    - [38, 0.0]
  - - [11712, 64, 1, 64]
    - [145, 0.0]
  - - [33408, 192, 1, 192]
    - [194, 0.0]
  - - [32928, 96, 1, 96]
    - [94, 0.0]
  - - [36832, 32, 1, 32]
    - [37, 0.0]
  - - [28672, 124, 1, 132]
    - [172, 0.0]
  - - [32154, 30, 1, 36]
    - [41, 0.0]
  - - [9918, 66, 1, 66]
    - [62, 0.0]
  - - [36952, 30, 1, 36]
    - [40, 0.0]
  - - [16464, 48, 1, 48]
    - [52, 0.0]
  - - [34848, 32, 1, 32]
    - [76, 0.0]
  - - [42176, 64, 1, 64]
    - [172, 0.0]
  - - [32256, 48, 1, 48]
    - [133, 0.0]
  - - [3584, 124, 1, 132]
    - [124, 0.0]
  - - [7104, 64, 1, 64]
    - [194, 0.0]
  - - [18878, 66, 1, 66]
    - [94, 0.0]
  - - [17184, 96, 1, 96]
    - [94, 0.0]
  - - [26880, 124, 1, 132]
    - [142, 0.0]
  - - [3840, 48, 1, 48]
    - [37, 0.0]
  - - [7900, 30, 1, 36]
    - [37, 0.0]
  - - [25440, 32, 1, 32]
    - [38, 0.0]
  - - [35936, 32, 1, 32]
    - [76, 0.0]
  - - [27840, 64, 1, 64]
    - [113, 0.0]
  - - [37312, 64, 1, 64]
    - [112, 0.0]
  - - [18586, 30, 1, 36]
    - [74, 0.0]
  - - [37952, 64, 1, 64]
    - [118, 0.0]
  - - [7728, 48, 1, 48]
    - [124, 0.0]
  - - [3840, 192, 1, 192]
    - [68, 0.0]
  - - [41472, 124, 1, 132]
    - [192, 0.0]
  - - [7968, 96, 1, 96]
    - [136, 0.0]
  - - [17664, 124, 1, 132]
    - [144, 0.0]
  - - [16128, 192, 1, 192]
    - [199, 0.0]
  - - [6144, 30, 1, 36]
    - [37, 0.0]
  - - [20688, 48, 1, 48]
    - [57, 0.0]
  - - [20224, 30, 1, 36]
    - [37, 0.0]
  - - [1536, 96, 1, 96]
    - [139, 0.0]
  - - [36480, 96, 1, 96]
    - [163, 0.0]
  - - [28416, 192, 1, 192]
    - [202, 0.0]
  - - [18960, 48, 1, 48]
    - [52, 0.0]
  - - [15216, 48, 1, 48]
    - [51, 0.0]
  - - [41232, 48, 1, 48]
    - [54, 0.0]
  - - [33056, 32, 1, 32]
    - [37, 0.0]
  - - [2048, 30, 1, 36]
    - [37, 0.0]
  - - [14848, 66, 1, 66]
    - [182, 0.0]
  - - [4666, 58, 1, 66]
    - [124, 0.0]
  - - [12544, 124, 1, 132]
    - [142, 0.0]
  - - [5024, 32, 1, 32]
    - [37, 0.0]
  - - [32256, 124, 1, 132]
    - [146, 0.0]
  - - [29082, 30, 1, 36]
    - [77, 0.0]
  - - [22170, 30, 1, 36]
    - [37, 0.0]
  - - [20414, 66, 1, 66]
    - [98, 0.0]
  - - [14592, 58, 1, 66]
    - [64, 0.0]
  - - [28314, 30, 1, 36]
    - [38, 0.0]
  - - [11760, 48, 1, 48]
    - [51, 0.0]
  - - [42240, 128, 1, 128]
    - [146, 0.0]
  - - [34656, 96, 1, 96]
    - [96, 0.0]
  - - [14816, 32, 1, 32]
    - [74, 0.0]
  - - [10464, 96, 1, 96]
    - [94, 0.0]
  - - [39744, 64, 1, 64]
    - [172, 0.0]
  - - [16640, 58, 1, 66]
    - [45, 0.0]
  - - [11136, 96, 1, 96]
    - [57, 0.0]
  - - [35840, 58, 1, 66]
    - [117, 0.0]
  - - [11424, 32, 1, 32]
    - [173, 0.0]
  - - [37440, 64, 1, 64]
    - [115, 0.0]
  - - [41304, 30, 1, 36]
    - [76, 0.0]
  - - [21408, 32, 1, 32]
    - [37, 0.0]
  - - [12032, 124, 1, 132]
    - [87, 0.0]
  - - [4352, 128, 1, 128]
    - [152, 0.0]
  - - [23098, 58, 1, 66]
    - [47, 0.0]
  - - [43710, 66, 1, 66]
    - [182, 0.0]
  - - [31248, 48, 1, 48]
    - [133, 0.0]
  - - [22560, 96, 1, 96]
    - [94, 0.0]
  - - [17306, 30, 1, 36]
    - [74, 0.0]
  - - [23552, 128, 1, 128]
    - [146, 0.0]
  - - [6400, 124, 1, 132]
    - [94, 0.0]
  - - [1888, 32, 1, 32]
    - [37, 0.0]
  - - [40704, 128, 1, 128]
    - [195, 0.0]
  - - [22528, 58, 1, 66]
    - [114, 0.0]
  - - [44000, 32, 1, 32]
    - [76, 0.0]
  - - [6304, 32, 1, 32]
    - [74, 0.0]
  - - [21216, 96, 1, 96]
    - [96, 0.0]
  - - [9560, 30, 1, 36]
    - [74, 0.0]
  - - [1470, 66, 1, 66]
    - [40, 0.0]
  - - [25344, 192, 1, 192]
    - [190, 0.0]
  - - [21936, 48, 1, 48]
    - [54, 0.0]
  - - [14526, 66, 1, 66]
    - [58, 0.0]
  - - [38458, 58, 1, 66]
    - [117, 0.0]
  - - [192, 64, 1, 64]
    - [37, 0.0]
  - - [12698, 30, 1, 36]
    - [37, 0.0]
  - - [9984, 96, 1, 96]
    - [57, 0.0]
  - - [30368, 32, 1, 32]
    - [41, 0.0]
  - - [23194, 30, 1, 36]
    - [43, 0.0]
  - - [17280, 192, 1, 192]
    - [194, 0.0]
  - - [35130, 58, 1, 66]
    - [112, 0.0]
  - - [21080, 30, 1, 36]
    - [74, 0.0]
  - - [10368, 192, 1, 192]
    - [194, 0.0]
  - - [21562, 58, 1, 66]
    - [45, 0.0]
  - - [27612, 30, 1, 36]
    - [38, 0.0]
  - - [14656, 64, 1, 64]
    - [146, 0.0]
  - - [29696, 66, 1, 66]
    - [98, 0.0]
  - - [34560, 48, 1, 48]
    - [54, 0.0]
  - - [18396, 30, 1, 36]
    - [76, 0.0]
  - - [39840, 32, 1, 32]
    - [40, 0.0]
  - - [19200, 124, 1, 132]
    - [169, 0.0]
  - - [20880, 48, 1, 48]
    - [52, 0.0]
  - - [39424, 128, 1, 128]
    - [192, 0.0]
  - - [34992, 48, 1, 48]
    - [92, 0.0]
  - - [17056, 32, 1, 32]
    - [40, 0.0]
  - - [4608, 66, 1, 66]
    - [127, 0.0]
  - - [17248, 32, 1, 32]
    - [37, 0.0]
  - - [14368, 32, 1, 32]
    - [74, 0.0]
  - - [24634, 58, 1, 66]
    - [62, 0.0]
  - - [29568, 96, 1, 96]
    - [96, 0.0]
  - - [17376, 96, 1, 96]
    - [96, 0.0]
  - - [16544, 32, 1, 32]
    - [37, 0.0]
  - - [12858, 58, 1, 66]
    - [79, 0.0]
  - - [16318, 66, 1, 66]
    - [58, 0.0]
  - - [11418, 30, 1, 36]
    - [74, 0.0]
  - - [43072, 64, 1, 64]
    - [116, 0.0]
  - - [19824, 48, 1, 48]
    - [52, 0.0]
  - - [38144, 128, 1, 128]
    - [192, 0.0]
  - - [31776, 32, 1, 32]
    - [41, 0.0]
  - - [2240, 64, 1, 64]
    - [139, 0.0]
  - - [8960, 58, 1, 66]
    - [49, 0.0]
  - - [9504, 96, 1, 96]
    - [60, 0.0]
  - - [40608, 32, 1, 32]
    - [45, 0.0]
  - - [18330, 30, 1, 36]
    - [37, 0.0]
  - - [8448, 48, 1, 48]
    - [76, 0.0]
  - - [12120, 30, 1, 36]
    - [74, 0.0]
  - - [39512, 30, 1, 36]
    - [76, 0.0]
  - - [8352, 96, 1, 96]
    - [44, 0.0]
  - - [11968, 64, 1, 64]
    - [141, 0.0]
  - - [42336, 96, 1, 96]
    - [205, 0.0]
  - - [35584, 128, 1, 128]
    - [195, 0.0]
  - - [4096, 124, 1, 132]
    - [127, 0.0]
  - - [43392, 192, 1, 192]
    - [195, 0.0]
  - - [21408, 96, 1, 96]
    - [96, 0.0]
  - - [8668, 30, 1, 36]
    - [37, 0.0]
  - - [8016, 48, 1, 48]
    - [119, 0.0]
  - - [33024, 128, 1, 128]
    - [192, 0.0]
  - - [10272, 32, 1, 32]
    - [37, 0.0]
  - - [39614, 66, 1, 66]
    - [184, 0.0]
  - - [27984, 48, 1, 48]
    - [51, 0.0]
  - - [15296, 64, 1, 64]
    - [142, 0.0]
  - - [7680, 48, 1, 48]
    - [173, 0.0]
  - - [4572, 30, 1, 36]
    - [43, 0.0]
  - - [7488, 64, 1, 64]
    - [194, 0.0]
  - - [37344, 96, 1, 96]
    - [187, 0.0]
  - - [32032, 32, 1, 32]
    - [38, 0.0]
  - - [12736, 64, 1, 64]
    - [116, 0.0]
  - - [12576, 96, 1, 96]
    - [45, 0.0]
  - - [13152, 32, 1, 32]
    - [37, 0.0]
  - - [33824, 32, 1, 32]
    - [74, 0.0]
  - - [10752, 48, 1, 48]
    - [52, 0.0]
  - - [12288, 128, 1, 128]
    - [144, 0.0]
  - - [4896, 32, 1, 32]
    - [37, 0.0]
  - - [35168, 32, 1, 32]
    - [45, 0.0]
  - - [38464, 64, 1, 64]
    - [118, 0.0]
  - - [23040, 192, 1, 192]
    - [195, 0.0]
  - - [544, 32, 1, 32]
    - [67, 0.0]
  - - [33552, 48, 1, 48]
    - [54, 0.0]
  - - [5888, 30, 1, 36]
    - [40, 0.0]
  - - [43322, 58, 1, 66]
    - [98, 0.0]
  - - [28864, 64, 1, 64]
    - [117, 0.0]
  - - [2336, 32, 1, 32]
    - [37, 0.0]
  - - [19098, 30, 1, 36]
    - [74, 0.0]
  - - [1296, 48, 1, 48]
    - [37, 0.0]
  - - [13856, 32, 1, 32]
    - [37, 0.0]
  - - [4608, 58, 1, 66]
    - [125, 0.0]
  - - [29536, 32, 1, 32]
    - [38, 0.0]
  - - [36336, 48, 1, 48]
    - [52, 0.0]
  - - [40544, 32, 1, 32]
    - [40, 0.0]
  - - [9472, 30, 1, 36]
    - [74, 0.0]
  - - [23040, 66, 1, 66]
    - [57, 0.0]
  - - [39936, 96, 1, 96]
    - [163, 0.0]
  - - [7008, 32, 1, 32]
    - [127, 0.0]
  - - [5434, 58, 1, 66]
    - [124, 0.0]
  - - [20736, 124, 1, 132]
    - [145, 0.0]
  - - [6816, 32, 1, 32]
    - [37, 0.0]
  - - [35840, 30, 1, 36]
    - [80, 0.0]
  - - [20992, 128, 1, 128]
    - [195, 0.0]
  - - [28672, 30, 1, 36]
    - [38, 0.0]
  - - [25944, 30, 1, 36]
    - [44, 0.0]
  - - [34304, 30, 1, 36]
    - [76, 0.0]
  - - [33280, 128, 1, 128]
    - [146, 0.0]
  - - [39322, 30, 1, 36]
    - [76, 0.0]
  - - [6432, 96, 1, 96]
    - [46, 0.0]
  - - [38976, 64, 1, 64]
    - [115, 0.0]
  - - [18672, 48, 1, 48]
    - [54, 0.0]
  - - [11680, 32, 1, 32]
    - [74, 0.0]
  - - [5088, 32, 1, 32]
    - [43, 0.0]
  - - [26464, 32, 1, 32]
    - [77, 0.0]
  - - [43248, 48, 1, 48]
    - [90, 0.0]
  - - [40960, 128, 1, 128]
    - [192, 0.0]
  - - [31520, 32, 1, 32]
    - [44, 0.0]
  - - [36250, 30, 1, 36]
    - [74, 0.0]
  - - [40352, 32, 1, 32]
    - [76, 0.0]
  - - [19032, 30, 1, 36]
    - [37, 0.0]
  - - [3904, 64, 1, 64]
    - [141, 0.0]
  - - [2012, 30, 1, 36]
    - [37, 0.0]
  - - [43056, 48, 1, 48]
    - [52, 0.0]
  - - [39680, 128, 1, 128]
    - [146, 0.0]
  - - [16480, 32, 1, 32]
    - [78, 0.0]
  - - [37920, 96, 1, 96]
    - [187, 0.0]
  - - [18432, 58, 1, 66]
    - [45, 0.0]
  - - [8280, 30, 1, 36]
    - [37, 0.0]
  - - [512, 124, 1, 132]
    - [119, 0.0]
  - - [39168, 30, 1, 36]
    - [76, 0.0]
  - - [25344, 66, 1, 66]
    - [180, 0.0]
  - - [13792, 32, 1, 32]
    - [74, 0.0]
  - - [24720, 48, 1, 48]
    - [53, 0.0]
  - - [26208, 32, 1, 32]
    - [38, 0.0]
  - - [43968, 64, 1, 64]
    - [169, 0.0]
  - - [43424, 32, 1, 32]
    - [40, 0.0]
  - - [38256, 48, 1, 48]
    - [57, 0.0]
  - - [5728, 32, 1, 32]
    - [76, 0.0]
  - - [11454, 66, 1, 66]
    - [60, 0.0]
  - - [30654, 66, 1, 66]
    - [100, 0.0]
  - - [40024, 30, 1, 36]
    - [76, 0.0]
  - - [19632, 48, 1, 48]
    - [54, 0.0]
  - - [13882, 58, 1, 66]
    - [62, 0.0]
  - - [8346, 30, 1, 36]
    - [74, 0.0]
  - - [11328, 64, 1, 64]
    - [141, 0.0]
  - - [28928, 66, 1, 66]
    - [98, 0.0]
  - - [26624, 128, 1, 128]
    - [146, 0.0]
  - - [33568, 32, 1, 32]
    - [40, 0.0]
  - - [1984, 64, 1, 64]
    - [124, 0.0]
  - - [26848, 32, 1, 32]
    - [41, 0.0]
  - - [36672, 64, 1, 64]
    - [117, 0.0]
  - - [18432, 128, 1, 128]
    - [197, 0.0]
  - - [19200, 128, 1, 128]
    - [197, 0.0]
  - - [29216, 32, 1, 32]
    - [79, 0.0]
  - - [768, 96, 1, 96]
    - [119, 0.0]
  - - [14680, 30, 1, 36]
    - [37, 0.0]
  - - [30106, 30, 1, 36]
    - [44, 0.0]
  - - [6144, 66, 1, 66]
    - [45, 0.0]
  - - [30464, 58, 1, 66]
    - [98, 0.0]
  - - [9360, 48, 1, 48]
    - [45, 0.0]
  - - [39168, 128, 1, 128]
    - [192, 0.0]
  - - [16954, 58, 1, 66]
    - [80, 0.0]
  - - [21182, 66, 1, 66]
    - [98, 0.0]
  - - [28464, 48, 1, 48]
    - [51, 0.0]
  - - [40768, 64, 1, 64]
    - [118, 0.0]
  - - [36060, 30, 1, 36]
    - [45, 0.0]
  - - [18944, 66, 1, 66]
    - [57, 0.0]
  - - [2304, 66, 1, 66]
    - [45, 0.0]
  - - [9472, 66, 1, 66]
    - [62, 0.0]
  - - [20896, 32, 1, 32]
    - [76, 0.0]
  - - [5920, 32, 1, 32]
    - [76, 0.0]
  - - [43834, 58, 1, 66]
    - [118, 0.0]
  - - [43632, 48, 1, 48]
    - [54, 0.0]
  - - [20352, 192, 1, 192]
    - [197, 0.0]
  - - [15456, 96, 1, 96]
    - [95, 0.0]
  - - [36816, 48, 1, 48]
    - [52, 0.0]
  - - [20592, 48, 1, 48]
    - [54, 0.0]
  - - [13568, 128, 1, 128]
    - [146, 0.0]
  - - [7680, 58, 1, 66]
    - [124, 0.0]
  - - [8992, 32, 1, 32]
    - [42, 0.0]
  - - [16032, 32, 1, 32]
    - [37, 0.0]
  - - [39520, 32, 1, 32]
    - [76, 0.0]
  - - [34304, 66, 1, 66]
    - [60, 0.0]
  - - [20158, 66, 1, 66]
    - [98, 0.0]
  - - [13912, 30, 1, 36]
    - [39, 0.0]
  - - [31264, 32, 1, 32]
    - [46, 0.0]
  - - [1214, 66, 1, 66]
    - [119, 0.0]
  - - [41530, 58, 1, 66]
    - [115, 0.0]
  - - [28160, 128, 1, 128]
    - [194, 0.0]
  - - [8480, 32, 1, 32]
    - [119, 0.0]
  - - [43104, 96, 1, 96]
    - [207, 0.0]
  - - [20568, 30, 1, 36]
    - [74, 0.0]
  - - [11856, 48, 1, 48]
    - [51, 0.0]
  - - [33024, 58, 1, 66]
    - [165, 0.0]
  - - [21248, 66, 1, 66]
    - [98, 0.0]
  - - [25792, 64, 1, 64]
    - [144, 0.0]
  - - [6096, 48, 1, 48]
    - [119, 0.0]
  - - [17280, 48, 1, 48]
    - [52, 0.0]
  - - [1632, 96, 1, 96]
    - [139, 0.0]
  - - [7388, 30, 1, 36]
    - [74, 0.0]
  - - [16896, 124, 1, 132]
    - [148, 0.0]
  - - [19456, 124, 1, 132]
    - [144, 0.0]
  - - [20928, 64, 1, 64]
    - [114, 0.0]
  - - [29952, 48, 1, 48]
    - [51, 0.0]
  - - [3120, 48, 1, 48]
    - [40, 0.0]
  - - [30398, 66, 1, 66]
    - [100, 0.0]
  - - [25754, 30, 1, 36]
    - [38, 0.0]
  - - [23962, 30, 1, 36]
    - [37, 0.0]
  - - [38912, 128, 1, 128]
    - [195, 0.0]
  - - [30112, 32, 1, 32]
    - [38, 0.0]
  - - [25176, 30, 1, 36]
    - [38, 0.0]
  - - [11520, 192, 1, 192]
    - [103, 0.0]
  - - [1536, 30, 1, 36]
    - [74, 0.0]
  - - [38912, 30, 1, 36]
    - [76, 0.0]
  - - [24192, 48, 1, 48]
    - [90, 0.0]
  - - [35280, 48, 1, 48]
    - [52, 0.0]
  - - [43936, 32, 1, 32]
    - [76, 0.0]
  - - [35712, 96, 1, 96]
    - [96, 0.0]
  - - [2064, 48, 1, 48]
    - [37, 0.0]
  - - [35072, 128, 1, 128]
    - [146, 0.0]
  - - [26880, 96, 1, 96]
    - [208, 0.0]
  - - [35952, 48, 1, 48]
    - [52, 0.0]
  - - [4768, 32, 1, 32]
    - [37, 0.0]
  - - [13568, 30, 1, 36]
    - [37, 0.0]
  - - [21760, 58, 1, 66]
    - [88, 0.0]
  - - [15360, 96, 1, 96]
    - [162, 0.0]
  - - [4154, 58, 1, 66]
    - [127, 0.0]
  - - [2464, 32, 1, 32]
    - [37, 0.0]
  - - [12346, 58, 1, 66]
    - [64, 0.0]
  - - [21504, 30, 1, 36]
    - [37, 0.0]
  - - [10752, 58, 1, 66]
    - [145, 0.0]
  - - [18336, 32, 1, 32]
    - [43, 0.0]
  - - [30048, 32, 1, 32]
    - [44, 0.0]
  - - [7152, 48, 1, 48]
    - [119, 0.0]
  - - [25856, 128, 1, 128]
    - [145, 0.0]
  - - [20026, 58, 1, 66]
    - [45, 0.0]
  - - [6624, 96, 1, 96]
    - [45, 0.0]
  - - [25296, 48, 1, 48]
    - [55, 0.0]
  - - [39712, 32, 1, 32]
    - [76, 0.0]
  - - [37728, 32, 1, 32]
    - [37, 0.0]
  - - [40416, 32, 1, 32]
    - [45, 0.0]
  - - [15776, 32, 1, 32]
    - [74, 0.0]
  - - [384, 96, 1, 96]
    - [119, 0.0]
  - - [33536, 128, 1, 128]
    - [142, 0.0]
  - - [19456, 58, 1, 66]
    - [45, 0.0]
  - - [18144, 96, 1, 96]
    - [94, 0.0]
  - - [37376, 66, 1, 66]
    - [182, 0.0]
  - - [16472, 30, 1, 36]
    - [37, 0.0]
  - - [9472, 124, 1, 132]
    - [145, 0.0]
  - - [35672, 30, 1, 36]
    - [74, 0.0]
  - - [21696, 64, 1, 64]
    - [114, 0.0]
  - - [21984, 32, 1, 32]
    - [37, 0.0]
  - - [27408, 48, 1, 48]
    - [189, 0.0]
  - - [18008, 30, 1, 36]
    - [76, 0.0]
  - - [9568, 32, 1, 32]
    - [119, 0.0]
  - - [30976, 66, 1, 66]
    - [98, 0.0]
  - - [35520, 64, 1, 64]
    - [117, 0.0]
  - - [27616, 32, 1, 32]
    - [81, 0.0]
  - - [43264, 124, 1, 132]
    - [142, 0.0]
  - - [12888, 30, 1, 36]
    - [37, 0.0]
  - - [5054, 66, 1, 66]
    - [124, 0.0]
  - - [36768, 32, 1, 32]
    - [40, 0.0]
  - - [15448, 30, 1, 36]
    - [74, 0.0]
  - - [5040, 48, 1, 48]
    - [122, 0.0]
  - - [13758, 66, 1, 66]
    - [56, 0.0]
  - - [22074, 58, 1, 66]
    - [48, 0.0]
  - - [6042, 30, 1, 36]
    - [37, 0.0]
  - - [18746, 58, 1, 66]
    - [45, 0.0]
  - - [35424, 32, 1, 32]
    - [40, 0.0]
  - - [32208, 48, 1, 48]
    - [51, 0.0]
  - - [9984, 128, 1, 128]
    - [145, 0.0]
  - - [24864, 32, 1, 32]
    - [38, 0.0]
  - - [34816, 124, 1, 132]
    - [146, 0.0]
  - - [20378, 30, 1, 36]
    - [37, 0.0]
  - - [33726, 66, 1, 66]
    - [57, 0.0]
  - - [33264, 48, 1, 48]
    - [52, 0.0]
  - - [16272, 48, 1, 48]
    - [51, 0.0]
  - - [14592, 128, 1, 128]
    - [145, 0.0]
  - - [38400, 48, 1, 48]
    - [94, 0.0]
  - - [34224, 48, 1, 48]
    - [52, 0.0]
  - - [41948, 30, 1, 36]
    - [45, 0.0]
  - - [27648, 96, 1, 96]
    - [160, 0.0]
  - - [2048, 66, 1, 66]
    - [140, 0.0]
  - - [29088, 32, 1, 32]
    - [38, 0.0]
  - - [37120, 66, 1, 66]
    - [182, 0.0]
  - - [1568, 32, 1, 32]
    - [37, 0.0]
  - - [33024, 66, 1, 66]
    - [57, 0.0]
  - - [40704, 96, 1, 96]
    - [160, 0.0]
  - - [43198, 66, 1, 66]
    - [100, 0.0]
  - - [39200, 32, 1, 32]
    - [76, 0.0]
  - - [13656, 30, 1, 36]
    - [37, 0.0]
  - - [11066, 58, 1, 66]
    - [49, 0.0]
  - - [16384, 66, 1, 66]
    - [58, 0.0]
  - - [25312, 32, 1, 32]
    - [75, 0.0]
  - - [8602, 30, 1, 36]
    - [40, 0.0]
  - - [26688, 64, 1, 64]
    - [142, 0.0]
  - - [9072, 48, 1, 48]
    - [45, 0.0]
  - - [14848, 30, 1, 36]
    - [37, 0.0]
  - - [12544, 58, 1, 66]
    - [81, 0.0]
  - - [8352, 32, 1, 32]
    - [37, 0.0]
  - - [24224, 32, 1, 32]
    - [43, 0.0]
  - - [41216, 30, 1, 36]
    - [76, 0.0]
  - - [28986, 58, 1, 66]
    - [63, 0.0]
  - - [28896, 32, 1, 32]
    - [38, 0.0]
  - - [7512, 30, 1, 36]
    - [45, 0.0]
  - - [31802, 58, 1, 66]
    - [98, 0.0]
  - - [11040, 96, 1, 96]
    - [94, 0.0]
  - - [38620, 30, 1, 36]
    - [76, 0.0]
  - - [18176, 30, 1, 36]
    - [37, 0.0]
  - - [24320, 58, 1, 66]
    - [168, 0.0]
  - - [16096, 32, 1, 32]
    - [74, 0.0]
  - - [17312, 32, 1, 32]
    - [37, 0.0]
  - - [21840, 48, 1, 48]
    - [52, 0.0]
  - - [43552, 32, 1, 32]
    - [45, 0.0]
  - - [19002, 58, 1, 66]
    - [45, 0.0]
  - - [38688, 96, 1, 96]
    - [164, 0.0]
  - - [27216, 48, 1, 48]
    - [51, 0.0]
  - - [34848, 96, 1, 96]
    - [96, 0.0]
  - - [28368, 48, 1, 48]
    - [56, 0.0]
  - - [19456, 128, 1, 128]
    - [148, 0.0]
  - - [26400, 32, 1, 32]
    - [46, 0.0]
  - - [23808, 48, 1, 48]
    - [54, 0.0]
  - - [2688, 48, 1, 48]
    - [37, 0.0]
  - - [7136, 32, 1, 32]
    - [76, 0.0]
  - - [8156, 30, 1, 36]
    - [40, 0.0]
  - - [28862, 66, 1, 66]
    - [100, 0.0]
  - - [32088, 30, 1, 36]
    - [38, 0.0]
  - - [41692, 30, 1, 36]
    - [76, 0.0]
  - - [23040, 128, 1, 128]
    - [145, 0.0]
  - - [10032, 48, 1, 48]
    - [74, 0.0]
  - - [28416, 58, 1, 66]
    - [63, 0.0]
  - - [17440, 32, 1, 32]
    - [74, 0.0]
  - - [27290, 30, 1, 36]
    - [77, 0.0]
  - - [35872, 32, 1, 32]
    - [40, 0.0]
  - - [600, 30, 1, 36]
    - [102, 0.0]
  - - [6144, 192, 1, 192]
    - [69, 0.0]
  - - [20480, 30, 1, 36]
    - [74, 0.0]
  - - [33792, 58, 1, 66]
    - [115, 0.0]
  - - [3328, 30, 1, 36]
    - [37, 0.0]
  - - [26944, 64, 1, 64]
    - [117, 0.0]
  - - [21888, 48, 1, 48]
    - [60, 0.0]
  - - [16830, 66, 1, 66]
    - [60, 0.0]
  - - [21264, 48, 1, 48]
    - [60, 0.0]
  - - [43264, 128, 1, 128]
    - [146, 0.0]
  - - [26352, 48, 1, 48]
    - [58, 0.0]
  - - [43328, 64, 1, 64]
    - [169, 0.0]
  - - [17920, 128, 1, 128]
    - [193, 0.0]
  - - [42096, 48, 1, 48]
    - [54, 0.0]
  - - [4922, 58, 1, 66]
    - [127, 0.0]
  - - [14496, 32, 1, 32]
    - [37, 0.0]
  - - [19456, 30, 1, 36]
    - [37, 0.0]
  - - [17088, 64, 1, 64]
    - [145, 0.0]
  - - [15360, 48, 1, 48]
    - [51, 0.0]
  - - [16736, 32, 1, 32]
    - [45, 0.0]
  - - [11104, 32, 1, 32]
    - [37, 0.0]
  - - [20208, 48, 1, 48]
    - [52, 0.0]
  - - [2272, 32, 1, 32]
    - [37, 0.0]
  - - [33184, 32, 1, 32]
    - [76, 0.0]
  - - [24576, 128, 1, 128]
    - [146, 0.0]
  - - [15136, 32, 1, 32]
    - [74, 0.0]
  - - [39232, 64, 1, 64]
    - [118, 0.0]
  - - [37632, 124, 1, 132]
    - [146, 0.0]
  - - [23968, 32, 1, 32]
    - [74, 0.0]
  - - [32320, 64, 1, 64]
    - [117, 0.0]
  - - [9536, 64, 1, 64]
    - [146, 0.0]
  - - [6364, 30, 1, 36]
    - [43, 0.0]
  - - [8160, 32, 1, 32]
    - [173, 0.0]
  - - [19584, 48, 1, 48]
    - [57, 0.0]
  - - [28384, 32, 1, 32]
    - [38, 0.0]
  - - [17562, 30, 1, 36]
    - [74, 0.0]
  - - [30560, 32, 1, 32]
    - [44, 0.0]
  - - [6144, 124, 1, 132]
    - [49, 0.0]
  - - [42496, 30, 1, 36]
    - [76, 0.0]
  - - [14848, 58, 1, 66]
    - [62, 0.0]
  - - [19296, 96, 1, 96]
    - [94, 0.0]
  - - [33168, 48, 1, 48]
    - [52, 0.0]
  - - [22304, 32, 1, 32]
    - [74, 0.0]
  - - [27040, 32, 1, 32]
    - [41, 0.0]
  - - [35392, 64, 1, 64]
    - [111, 0.0]
  - - [3168, 32, 1, 32]
    - [76, 0.0]
  - - [11424, 96, 1, 96]
    - [57, 0.0]
  - - [8544, 96, 1, 96]
    - [92, 0.0]
  - - [37296, 48, 1, 48]
    - [52, 0.0]
  - - [37596, 30, 1, 36]
    - [40, 0.0]
  - - [702, 66, 1, 66]
    - [76, 0.0]
  - - [14270, 66, 1, 66]
    - [58, 0.0]
  - - [23640, 30, 1, 36]
    - [74, 0.0]
  - - [8880, 48, 1, 48]
    - [37, 0.0]
  - - [7834, 30, 1, 36]
    - [78, 0.0]
  - - [11584, 64, 1, 64]
    - [141, 0.0]
  - - [20700, 30, 1, 36]
    - [74, 0.0]
  - - [41856, 192, 1, 192]
    - [202, 0.0]
  - - [17184, 32, 1, 32]
    - [37, 0.0]
  - - [38144, 124, 1, 132]
    - [142, 0.0]
  - - [12800, 128, 1, 128]
    - [196, 0.0]
  - - [23392, 32, 1, 32]
    - [37, 0.0]
  - - [10240, 124, 1, 132]
    - [141, 0.0]
  - - [38240, 32, 1, 32]
    - [40, 0.0]
  - - [43776, 124, 1, 132]
    - [146, 0.0]
  - - [23184, 48, 1, 48]
    - [60, 0.0]
  - - [22784, 128, 1, 128]
    - [145, 0.0]
  - - [570, 58, 1, 66]
    - [37, 0.0]
  - - [41216, 58, 1, 66]
    - [115, 0.0]
  - - [30768, 48, 1, 48]
    - [51, 0.0]
  - - [24384, 64, 1, 64]
    - [171, 0.0]
  - - [19676, 30, 1, 36]
    - [37, 0.0]
  - - [3840, 66, 1, 66]
    - [124, 0.0]
  - - [8704, 66, 1, 66]
    - [96, 0.0]
  - - [20056, 30, 1, 36]
    - [37, 0.0]
  - - [3360, 32, 1, 32]
    - [74, 0.0]
  - - [8448, 66, 1, 66]
    - [98, 0.0]
  - - [33792, 124, 1, 132]
    - [142, 0.0]
  - - [25696, 32, 1, 32]
    - [38, 0.0]
  - - [29984, 32, 1, 32]
    - [46, 0.0]
  - - [40894, 66, 1, 66]
    - [100, 0.0]
  - - [42072, 30, 1, 36]
    - [45, 0.0]
  - - [22128, 48, 1, 48]
    - [54, 0.0]
  - - [18176, 66, 1, 66]
    - [60, 0.0]
  - - [7168, 58, 1, 66]
    - [125, 0.0]
  - - [2080, 32, 1, 32]
    - [37, 0.0]
  - - [37530, 30, 1, 36]
    - [45, 0.0]
  - - [17920, 66, 1, 66]
    - [60, 0.0]
  - - [33024, 48, 1, 48]
    - [52, 0.0]
  - - [3160, 30, 1, 36]
    - [74, 0.0]
  - - [17632, 32, 1, 32]
    - [74, 0.0]
  - - [14044, 30, 1, 36]
    - [37, 0.0]
  - - [24288, 32, 1, 32]
    - [40, 0.0]
  - - [7248, 48, 1, 48]
    - [119, 0.0]
  - - [38400, 30, 1, 36]
    - [76, 0.0]
  - - [12288, 124, 1, 132]
    - [86, 0.0]
  - - [36696, 30, 1, 36]
    - [40, 0.0]
  - - [40192, 30, 1, 36]
    - [40, 0.0]
  - - [39872, 64, 1, 64]
    - [118, 0.0]
  - - [41520, 48, 1, 48]
    - [57, 0.0]
  - - [15712, 32, 1, 32]
    - [37, 0.0]
  - - [22656, 48, 1, 48]
    - [52, 0.0]
  - - [9312, 96, 1, 96]
    - [96, 0.0]
  - - [2780, 30, 1, 36]
    - [37, 0.0]
  - - [33120, 32, 1, 32]
    - [45, 0.0]
  - - [20832, 96, 1, 96]
    - [98, 0.0]
  - - [8928, 96, 1, 96]
    - [57, 0.0]
  - - [24480, 32, 1, 32]
    - [37, 0.0]
  - - [4160, 64, 1, 64]
    - [145, 0.0]
  - - [10800, 48, 1, 48]
    - [51, 0.0]
  - - [33280, 30, 1, 36]
    - [76, 0.0]
  - - [25632, 32, 1, 32]
    - [44, 0.0]
  - - [36864, 48, 1, 48]
    - [52, 0.0]
  - - [26880, 192, 1, 192]
    - [190, 0.0]
  - - [22528, 128, 1, 128]
    - [192, 0.0]
  - - [22784, 58, 1, 66]
    - [117, 0.0]
  - - [37696, 64, 1, 64]
    - [118, 0.0]
  - - [18688, 66, 1, 66]
    - [57, 0.0]
  - - [19200, 192, 1, 192]
    - [194, 0.0]
  - - [5120, 30, 1, 36]
    - [74, 0.0]
  - - [13824, 128, 1, 128]
    - [192, 0.0]
  - - [26368, 58, 1, 66]
    - [62, 0.0]
  - - [19904, 64, 1, 64]
    - [191, 0.0]
  - - [39680, 124, 1, 132]
    - [142, 0.0]
  - - [9744, 48, 1, 48]
    - [40, 0.0]
  - - [31488, 66, 1, 66]
    - [98, 0.0]
  - - [31488, 128, 1, 128]
    - [194, 0.0]
  - - [17086, 66, 1, 66]
    - [57, 0.0]
  - - [32112, 48, 1, 48]
    - [51, 0.0]
  - - [512, 30, 1, 36]
    - [67, 0.0]
  - - [3642, 58, 1, 66]
    - [127, 0.0]
  - - [24028, 30, 1, 36]
    - [74, 0.0]
  - - [12192, 32, 1, 32]
    - [74, 0.0]
  - - [43740, 30, 1, 36]
    - [76, 0.0]
  - - [768, 58, 1, 66]
    - [37, 0.0]
  - - [14832, 48, 1, 48]
    - [51, 0.0]
  - - [19488, 32, 1, 32]
    - [45, 0.0]
  - - [384, 48, 1, 48]
    - [37, 0.0]
  - - [38810, 30, 1, 36]
    - [40, 0.0]
  - - [41088, 48, 1, 48]
    - [52, 0.0]
  - - [29024, 32, 1, 32]
    - [38, 0.0]
  - - [26400, 96, 1, 96]
    - [160, 0.0]
  - - [38298, 30, 1, 36]
    - [40, 0.0]
  - - [6208, 64, 1, 64]
    - [173, 0.0]
  - - [35898, 58, 1, 66]
    - [117, 0.0]
  - - [16348, 30, 1, 36]
    - [37, 0.0]
  - - [33312, 96, 1, 96]
    - [94, 0.0]
  - - [26332, 30, 1, 36]
    - [75, 0.0]
  - - [9692, 30, 1, 36]
    - [76, 0.0]
  - - [19456, 66, 1, 66]
    - [57, 0.0]
  - - [9168, 48, 1, 48]
    - [45, 0.0]
  - - [37120, 128, 1, 128]
    - [192, 0.0]
  - - [29712, 48, 1, 48]
    - [51, 0.0]
  - - [17920, 124, 1, 132]
    - [144, 0.0]
  - - [29568, 48, 1, 48]
    - [51, 0.0]
  - - [19712, 30, 1, 36]
    - [74, 0.0]
  - - [43520, 128, 1, 128]
    - [146, 0.0]
  - - [39168, 124, 1, 132]
    - [142, 0.0]
  - - [4960, 32, 1, 32]
    - [40, 0.0]
  - - [19136, 64, 1, 64]
    - [194, 0.0]
  - - [27968, 64, 1, 64]
    - [114, 0.0]
  - - [3928, 30, 1, 36]
    - [37, 0.0]
  - - [12734, 66, 1, 66]
    - [59, 0.0]
  - - [16448, 64, 1, 64]
    - [143, 0.0]
  - - [432, 48, 1, 48]
    - [37, 0.0]
  - - [10942, 66, 1, 66]
    - [60, 0.0]
  - - [37920, 32, 1, 32]
    - [40, 0.0]
  - - [32960, 64, 1, 64]
    - [117, 0.0]
  - - [3482, 30, 1, 36]
    - [76, 0.0]
  - - [37376, 124, 1, 132]
    - [142, 0.0]
  - - [37472, 32, 1, 32]
    - [40, 0.0]
  - - [12764, 30, 1, 36]
    - [74, 0.0]
  - - [30142, 66, 1, 66]
    - [98, 0.0]
  - - [26176, 64, 1, 64]
    - [144, 0.0]
  - - [24576, 30, 1, 36]
    - [37, 0.0]
  - - [42688, 64, 1, 64]
    - [115, 0.0]
  - - [20188, 30, 1, 36]
    - [37, 0.0]
  - - [42496, 128, 1, 128]
    - [192, 0.0]
  - - [11664, 48, 1, 48]
    - [51, 0.0]
  - - [31386, 30, 1, 36]
    - [44, 0.0]
  - - [27312, 48, 1, 48]
    - [134, 0.0]
  - - [42840, 30, 1, 36]
    - [45, 0.0]
  - - [24320, 30, 1, 36]
    - [37, 0.0]
  - - [21440, 64, 1, 64]
    - [171, 0.0]
  - - [3584, 66, 1, 66]
    - [124, 0.0]
  - - [25728, 96, 1, 96]
    - [188, 0.0]
  - - [672, 96, 1, 96]
    - [138, 0.0]
  - - [16640, 66, 1, 66]
    - [57, 0.0]
  - - [4800, 64, 1, 64]
    - [124, 0.0]
  - - [26814, 66, 1, 66]
    - [98, 0.0]
  - - [40346, 30, 1, 36]
    - [45, 0.0]
  - - [39644, 30, 1, 36]
    - [40, 0.0]
  - - [11322, 58, 1, 66]
    - [80, 0.0]
  - - [9882, 30, 1, 36]
    - [37, 0.0]
  - - [30624, 32, 1, 32]
    - [46, 0.0]
  - - [42686, 66, 1, 66]
    - [98, 0.0]
  - - [22896, 48, 1, 48]
    - [52, 0.0]
  - - [25728, 192, 1, 192]
    - [195, 0.0]
  - - [26368, 66, 1, 66]
    - [182, 0.0]
  - - [7936, 58, 1, 66]
    - [124, 0.0]
  - - [5536, 32, 1, 32]
    - [76, 0.0]
  - - [17760, 96, 1, 96]
    - [94, 0.0]
  - - [19232, 32, 1, 32]
    - [45, 0.0]
  - - [36096, 96, 1, 96]
    - [96, 0.0]
  - - [43066, 58, 1, 66]
    - [118, 0.0]
  - - [7000, 30, 1, 36]
    - [76, 0.0]
  - - [3648, 64, 1, 64]
    - [141, 0.0]
  - - [30240, 32, 1, 32]
    - [44, 0.0]
  - - [30720, 48, 1, 48]
    - [51, 0.0]
  - - [41274, 58, 1, 66]
    - [113, 0.0]
  - - [29184, 96, 1, 96]
    - [96, 0.0]
  - - [24896, 64, 1, 64]
    - [146, 0.0]
  - - [22236, 30, 1, 36]
    - [37, 0.0]
  - - [1792, 30, 1, 36]
    - [40, 0.0]
  - - [928, 32, 1, 32]
    - [37, 0.0]
  - - [11088, 48, 1, 48]
    - [51, 0.0]
  - - [43040, 32, 1, 32]
    - [40, 0.0]
  - - [41808, 48, 1, 48]
    - [52, 0.0]
  - - [32592, 48, 1, 48]
    - [51, 0.0]
  - - [36506, 30, 1, 36]
    - [74, 0.0]
  - - [3072, 128, 1, 128]
    - [127, 0.0]
  - - [41114, 30, 1, 36]
    - [40, 0.0]
  - - [19680, 32, 1, 32]
    - [45, 0.0]
  - - [4576, 32, 1, 32]
    - [37, 0.0]
  - - [11740, 30, 1, 36]
    - [37, 0.0]
  - - [39904, 32, 1, 32]
    - [76, 0.0]
  - - [40256, 64, 1, 64]
    - [172, 0.0]
  - - [6528, 48, 1, 48]
    - [122, 0.0]
  - - [32000, 124, 1, 132]
    - [142, 0.0]
  - - [32640, 96, 1, 96]
    - [160, 0.0]
  - - [5424, 48, 1, 48]
    - [119, 0.0]
  - - [20224, 66, 1, 66]
    - [98, 0.0]
  - - [24796, 30, 1, 36]
    - [46, 0.0]
  - - [23712, 96, 1, 96]
    - [96, 0.0]
  - - [14650, 58, 1, 66]
    - [62, 0.0]
  - - [21920, 32, 1, 32]
    - [37, 0.0]
  - - [13824, 192, 1, 192]
    - [199, 0.0]
  - - [2688, 192, 1, 192]
    - [140, 0.0]
  - - [768, 30, 1, 36]
    - [102, 0.0]
  - - [22016, 128, 1, 128]
    - [194, 0.0]
  - - [15104, 124, 1, 132]
    - [64, 0.0]
  - - [4368, 48, 1, 48]
    - [40, 0.0]
  - - [34800, 48, 1, 48]
    - [57, 0.0]
  - - [31642, 30, 1, 36]
    - [38, 0.0]
  - - [16128, 30, 1, 36]
    - [37, 0.0]
  - - [8506, 58, 1, 66]
    - [45, 0.0]
  - - [13984, 32, 1, 32]
    - [37, 0.0]
  - - [27360, 96, 1, 96]
    - [160, 0.0]
  - - [28032, 192, 1, 192]
    - [199, 0.0]
  - - [14784, 64, 1, 64]
    - [142, 0.0]
  - - [4832, 32, 1, 32]
    - [76, 0.0]
  - - [9456, 48, 1, 48]
    - [43, 0.0]
  - - [38016, 192, 1, 192]
    - [199, 0.0]
  - - [7008, 96, 1, 96]
    - [162, 0.0]
  - - [28800, 48, 1, 48]
    - [51, 0.0]
  - - [15168, 64, 1, 64]
    - [142, 0.0]
  - - [24832, 58, 1, 66]
    - [46, 0.0]
  - - [6976, 64, 1, 64]
    - [124, 0.0]
  - - [476, 30, 1, 36]
    - [67, 0.0]
  - - [18976, 32, 1, 32]
    - [76, 0.0]
  - - [38078, 66, 1, 66]
    - [182, 0.0]
  - - [28256, 32, 1, 32]
    - [38, 0.0]
  - - [32256, 128, 1, 128]
    - [192, 0.0]
  - - [22016, 124, 1, 132]
    - [142, 0.0]
  - - [29600, 32, 1, 32]
    - [77, 0.0]
  - - [7680, 124, 1, 132]
    - [64, 0.0]
  - - [19968, 48, 1, 48]
    - [52, 0.0]
  - - [29328, 48, 1, 48]
    - [185, 0.0]
  - - [31744, 128, 1, 128]
    - [146, 0.0]
  - - [19420, 30, 1, 36]
    - [45, 0.0]
  - - [608, 32, 1, 32]
    - [37, 0.0]
  - - [16896, 128, 1, 128]
    - [191, 0.0]
  - - [24096, 96, 1, 96]
    - [94, 0.0]
  - - [29904, 48, 1, 48]
    - [51, 0.0]
  - - [35036, 30, 1, 36]
    - [80, 0.0]
  - - [17152, 30, 1, 36]
    - [37, 0.0]
  - - [6334, 66, 1, 66]
    - [45, 0.0]
  - - [31200, 96, 1, 96]
    - [96, 0.0]
  - - [22704, 48, 1, 48]
    - [52, 0.0]
  - - [13344, 32, 1, 32]
    - [74, 0.0]
  - - [7322, 30, 1, 36]
    - [40, 0.0]
  - - [3456, 96, 1, 96]
    - [124, 0.0]
  - - [19968, 30, 1, 36]
    - [74, 0.0]
  - - [31968, 32, 1, 32]
    - [44, 0.0]
  - - [4096, 128, 1, 128]
    - [127, 0.0]
  - - [40848, 48, 1, 48]
    - [57, 0.0]
  - - [39066, 30, 1, 36]
    - [45, 0.0]
  - - [34176, 48, 1, 48]
    - [60, 0.0]
  - - [384, 192, 1, 192]
    - [119, 0.0]
  - - [31008, 32, 1, 32]
    - [77, 0.0]
  - - [36256, 32, 1, 32]
    - [45, 0.0]
  - - [15264, 32, 1, 32]
    - [37, 0.0]
  - - [12432, 48, 1, 48]
    - [56, 0.0]
  - - [40448, 66, 1, 66]
    - [98, 0.0]
  - - [23706, 30, 1, 36]
    - [43, 0.0]
  - - [14640, 48, 1, 48]
    - [51, 0.0]
  - - [1280, 66, 1, 66]
    - [37, 0.0]
  - - [14080, 66, 1, 66]
    - [58, 0.0]
  - - [800, 32, 1, 32]
    - [37, 0.0]
  - - [43824, 48, 1, 48]
    - [90, 0.0]
  - - [17408, 124, 1, 132]
    - [148, 0.0]
  - - [39648, 96, 1, 96]
    - [158, 0.0]
  - - [11376, 48, 1, 48]
    - [56, 0.0]
  - - [39424, 30, 1, 36]
    - [40, 0.0]
  - - [43200, 64, 1, 64]
    - [118, 0.0]
  - - [2560, 58, 1, 66]
    - [43, 0.0]
  - - [6048, 96, 1, 96]
    - [43, 0.0]
  - - [31776, 96, 1, 96]
    - [96, 0.0]
  - - [42624, 96, 1, 96]
    - [205, 0.0]
  - - [8792, 30, 1, 36]
    - [37, 0.0]
  - - [8128, 64, 1, 64]
    - [176, 0.0]
  - - [39936, 58, 1, 66]
    - [117, 0.0]
  - - [20160, 64, 1, 64]
    - [191, 0.0]
  - - [21468, 30, 1, 36]
    - [37, 0.0]
  - - [28416, 48, 1, 48]
    - [59, 0.0]
  - - [33856, 64, 1, 64]
    - [168, 0.0]
  - - [14928, 48, 1, 48]
    - [51, 0.0]
  - - [256, 124, 1, 132]
    - [119, 0.0]
  - - [44032, 128, 1, 128]
    - [195, 0.0]
  - - [37248, 96, 1, 96]
    - [189, 0.0]
  - - [21504, 96, 1, 96]
    - [96, 0.0]
  - - [6368, 32, 1, 32]
    - [76, 0.0]
  - - [2268, 30, 1, 36]
    - [37, 0.0]
  - - [21504, 48, 1, 48]
    - [94, 0.0]
  - - [15680, 64, 1, 64]
    - [146, 0.0]
  - - [14848, 128, 1, 128]
    - [141, 0.0]
  - - [6192, 48, 1, 48]
    - [119, 0.0]
  - - [16896, 30, 1, 36]
    - [74, 0.0]
  - - [28416, 66, 1, 66]
    - [98, 0.0]
  - - [35328, 192, 1, 192]
    - [195, 0.0]
  - - [8064, 48, 1, 48]
    - [119, 0.0]
  - - [24576, 96, 1, 96]
    - [94, 0.0]
  - - [17854, 66, 1, 66]
    - [98, 0.0]
  - - [34048, 124, 1, 132]
    - [146, 0.0]
  - - [14592, 192, 1, 192]
    - [190, 0.0]
  - - [15104, 128, 1, 128]
    - [107, 0.0]
  - - [14016, 64, 1, 64]
    - [79, 0.0]
  - - [24576, 48, 1, 48]
    - [52, 0.0]
  - - [4608, 30, 1, 36]
    - [40, 0.0]
  - - [6240, 32, 1, 32]
    - [76, 0.0]
  - - [17408, 66, 1, 66]
    - [57, 0.0]
  - - [23104, 64, 1, 64]
    - [168, 0.0]
  - - [23296, 124, 1, 132]
    - [142, 0.0]
  - - [17424, 48, 1, 48]
    - [57, 0.0]
  - - [28272, 48, 1, 48]
    - [58, 0.0]
  - - [37536, 32, 1, 32]
    - [40, 0.0]
  - - [15968, 32, 1, 32]
    - [37, 0.0]
  - - [14080, 30, 1, 36]
    - [37, 0.0]
  - - [25242, 30, 1, 36]
    - [75, 0.0]
  - - [3130, 58, 1, 66]
    - [124, 0.0]
  - - [28928, 124, 1, 132]
    - [142, 0.0]
  - - [9632, 32, 1, 32]
    - [37, 0.0]
  - - [44032, 30, 1, 36]
    - [40, 0.0]
  - - [17372, 30, 1, 36]
    - [37, 0.0]
  - - [8896, 64, 1, 64]
    - [204, 0.0]
  - - [44016, 48, 1, 48]
    - [54, 0.0]
  - - [20640, 32, 1, 32]
    - [43, 0.0]
  - - [40858, 30, 1, 36]
    - [76, 0.0]
  - - [27356, 30, 1, 36]
    - [77, 0.0]
  - - [41472, 128, 1, 128]
    - [146, 0.0]
  - - [25888, 32, 1, 32]
    - [41, 0.0]
  - - [22976, 64, 1, 64]
    - [117, 0.0]
  - - [36798, 66, 1, 66]
    - [182, 0.0]
  - - [5120, 58, 1, 66]
    - [124, 0.0]
  - - [21592, 30, 1, 36]
    - [74, 0.0]
  - - [22512, 48, 1, 48]
    - [60, 0.0]
  - - [22944, 96, 1, 96]
    - [96, 0.0]
  - - [31200, 32, 1, 32]
    - [38, 0.0]
  - - [8544, 32, 1, 32]
    - [37, 0.0]
  - - [9048, 30, 1, 36]
    - [74, 0.0]
  - - [10460, 30, 1, 36]
    - [37, 0.0]
  - - [16320, 64, 1, 64]
    - [116, 0.0]
  - - [16608, 32, 1, 32]
    - [43, 0.0]
  - - [36096, 124, 1, 132]
    - [146, 0.0]
  - - [7744, 64, 1, 64]
    - [145, 0.0]
  - - [31104, 192, 1, 192]
    - [195, 0.0]
  - - [20192, 32, 1, 32]
    - [74, 0.0]
  - - [27936, 32, 1, 32]
    - [46, 0.0]
  - - [4352, 124, 1, 132]
    - [50, 0.0]
  - - [41040, 48, 1, 48]
    - [52, 0.0]
  - - [25872, 48, 1, 48]
    - [186, 0.0]
  - - [39936, 128, 1, 128]
    - [195, 0.0]
  - - [4448, 32, 1, 32]
    - [40, 0.0]
  - - [37888, 30, 1, 36]
    - [76, 0.0]
  - - [17952, 32, 1, 32]
    - [80, 0.0]
  - - [43344, 48, 1, 48]
    - [52, 0.0]
  - - [36184, 30, 1, 36]
    - [40, 0.0]
  - - [31840, 32, 1, 32]
    - [38, 0.0]
  - - [9304, 30, 1, 36]
    - [37, 0.0]
  - - [4030, 66, 1, 66]
    - [127, 0.0]
  - - [38846, 66, 1, 66]
    - [182, 0.0]
  - - [20400, 48, 1, 48]
    - [94, 0.0]
  - - [12222, 66, 1, 66]
    - [94, 0.0]
  - - [16576, 64, 1, 64]
    - [145, 0.0]
  - - [9114, 30, 1, 36]
    - [174, 0.0]
  - - [448, 64, 1, 64]
    - [37, 0.0]
  - - [20992, 124, 1, 132]
    - [146, 0.0]
  - - [21088, 32, 1, 32]
    - [37, 0.0]
  - - [18688, 58, 1, 66]
    - [45, 0.0]
  - - [25052, 30, 1, 36]
    - [41, 0.0]
  - - [27392, 128, 1, 128]
    - [194, 0.0]
  - - [27504, 48, 1, 48]
    - [53, 0.0]
  - - [26304, 64, 1, 64]
    - [144, 0.0]
  - - [39388, 30, 1, 36]
    - [45, 0.0]
  - - [21856, 32, 1, 32]
    - [37, 0.0]
  - - [9600, 48, 1, 48]
    - [74, 0.0]
  - - [26112, 128, 1, 128]
    - [146, 0.0]
  - - [38656, 58, 1, 66]
    - [117, 0.0]
  - - [40000, 64, 1, 64]
    - [115, 0.0]
  - - [19344, 48, 1, 48]
    - [54, 0.0]
  - - [34944, 192, 1, 192]
    - [195, 0.0]
  - - [32688, 48, 1, 48]
    - [51, 0.0]
  - - [26456, 30, 1, 36]
    - [75, 0.0]
  - - [44252, 30, 1, 36]
    - [40, 0.0]
  - - [17408, 128, 1, 128]
    - [144, 0.0]
  - - [35232, 96, 1, 96]
    - [96, 0.0]
  - - [9216, 66, 1, 66]
    - [94, 0.0]
  - - [14496, 96, 1, 96]
    - [187, 0.0]
  - - [28064, 32, 1, 32]
    - [41, 0.0]
  - - [25600, 124, 1, 132]
    - [146, 0.0]
  - - [23260, 30, 1, 36]
    - [37, 0.0]
  - - [13626, 58, 1, 66]
    - [62, 0.0]
  - - [32702, 66, 1, 66]
    - [99, 0.0]
  - - [5018, 30, 1, 36]
    - [45, 0.0]
  - - [18176, 124, 1, 132]
    - [148, 0.0]
  - - [24432, 48, 1, 48]
    - [54, 0.0]
  - - [24218, 30, 1, 36]
    - [74, 0.0]
  - - [3328, 58, 1, 66]
    - [43, 0.0]
  - - [10272, 96, 1, 96]
    - [94, 0.0]
  - - [18272, 32, 1, 32]
    - [74, 0.0]
  - - [16864, 32, 1, 32]
    - [45, 0.0]
  - - [39168, 192, 1, 192]
    - [203, 0.0]
  - - [2392, 30, 1, 36]
    - [37, 0.0]
  - - [6912, 96, 1, 96]
    - [209, 0.0]
  - - [15360, 58, 1, 66]
    - [62, 0.0]
  - - [25344, 58, 1, 66]
    - [62, 0.0]
  - - [39936, 124, 1, 132]
    - [142, 0.0]
  - - [15360, 66, 1, 66]
    - [56, 0.0]
  - - [35774, 66, 1, 66]
    - [60, 0.0]
  - - [336, 48, 1, 48]
    - [37, 0.0]
  - - [34464, 96, 1, 96]
    - [206, 0.0]
  - - [25680, 48, 1, 48]
    - [134, 0.0]
  - - [30208, 124, 1, 132]
    - [142, 0.0]
  - - [38108, 30, 1, 36]
    - [76, 0.0]
  - - [29088, 96, 1, 96]
    - [94, 0.0]
  - - [6112, 32, 1, 32]
    - [37, 0.0]
  - - [11228, 30, 1, 36]
    - [45, 0.0]
  - - [39264, 32, 1, 32]
    - [45, 0.0]
  - - [43520, 124, 1, 132]
    - [146, 0.0]
  - - [33504, 96, 1, 96]
    - [94, 0.0]
  - - [20224, 124, 1, 132]
    - [172, 0.0]
  - - [13104, 48, 1, 48]
    - [51, 0.0]
  - - [1594, 58, 1, 66]
    - [37, 0.0]
  - - [34896, 48, 1, 48]
    - [52, 0.0]
  - - [5822, 66, 1, 66]
    - [46, 0.0]
  - - [4864, 128, 1, 128]
    - [146, 0.0]
  - - [21280, 32, 1, 32]
    - [43, 0.0]
  - - [26046, 66, 1, 66]
    - [98, 0.0]
  - - [38928, 48, 1, 48]
    - [54, 0.0]
  - - [33368, 30, 1, 36]
    - [45, 0.0]
  - - [21504, 192, 1, 192]
    - [194, 0.0]
  - - [23296, 128, 1, 128]
    - [145, 0.0]
  - - [22208, 64, 1, 64]
    - [114, 0.0]
  - - [38880, 32, 1, 32]
    - [45, 0.0]
  - - [6400, 30, 1, 36]
    - [76, 0.0]
  - - [5632, 128, 1, 128]
    - [182, 0.0]
  - - [24576, 58, 1, 66]
    - [86, 0.0]
  - - [18592, 32, 1, 32]
    - [43, 0.0]
  - - [12048, 48, 1, 48]
    - [90, 0.0]
  - - [30960, 48, 1, 48]
    - [133, 0.0]
  - - [43008, 30, 1, 36]
    - [45, 0.0]
  - - [14976, 96, 1, 96]
    - [162, 0.0]
  - - [29952, 58, 1, 66]
    - [99, 0.0]
  - - [12090, 58, 1, 66]
    - [132, 0.0]
  - - [2592, 96, 1, 96]
    - [127, 0.0]
  - - [28704, 32, 1, 32]
    - [46, 0.0]
  - - [19744, 32, 1, 32]
    - [37, 0.0]
  - - [24960, 48, 1, 48]
    - [51, 0.0]
  - - [30624, 96, 1, 96]
    - [94, 0.0]
  - - [3168, 96, 1, 96]
    - [124, 0.0]
  - - [23280, 48, 1, 48]
    - [57, 0.0]
  - - [1280, 128, 1, 128]
    - [141, 0.0]
  - - [38656, 66, 1, 66]
    - [182, 0.0]
  - - [41120, 32, 1, 32]
    - [45, 0.0]
  - - [8928, 32, 1, 32]
    - [74, 0.0]
  - - [1920, 48, 1, 48]
    - [37, 0.0]
  - - [39168, 48, 1, 48]
    - [52, 0.0]
  - - [31440, 48, 1, 48]
    - [51, 0.0]
  - - [44090, 58, 1, 66]
    - [98, 0.0]
  - - [4416, 64, 1, 64]
    - [126, 0.0]
  - - [8924, 30, 1, 36]
    - [44, 0.0]
  - - [19712, 66, 1, 66]
    - [98, 0.0]
  - - [40928, 32, 1, 32]
    - [80, 0.0]
  - - [4440, 30, 1, 36]
    - [80, 0.0]
  - - [15744, 48, 1, 48]
    - [51, 0.0]
  - - [21792, 96, 1, 96]
    - [96, 0.0]
  - - [11472, 48, 1, 48]
    - [51, 0.0]
  - - [22560, 32, 1, 32]
    - [74, 0.0]
  - - [29888, 64, 1, 64]
    - [116, 0.0]
  - - [31632, 48, 1, 48]
    - [134, 0.0]
  - - [42592, 32, 1, 32]
    - [76, 0.0]
  - - [15360, 128, 1, 128]
    - [195, 0.0]
  - - [9216, 96, 1, 96]
    - [57, 0.0]
  - - [15584, 32, 1, 32]
    - [37, 0.0]
  - - [32352, 96, 1, 96]
    - [160, 0.0]
  - - [14432, 32, 1, 32]
    - [37, 0.0]
  - - [10944, 64, 1, 64]
    - [146, 0.0]
  - - [35808, 32, 1, 32]
    - [80, 0.0]
  - - [30880, 32, 1, 32]
    - [38, 0.0]
  - - [7870, 66, 1, 66]
    - [131, 0.0]
  - - [25498, 30, 1, 36]
    - [46, 0.0]
  - - [41728, 128, 1, 128]
    - [142, 0.0]
  - - [32220, 30, 1, 36]
    - [44, 0.0]
  - - [32512, 124, 1, 132]
    - [142, 0.0]
  - - [24240, 48, 1, 48]
    - [52, 0.0]
  - - [37376, 30, 1, 36]
    - [76, 0.0]
  - - [10906, 30, 1, 36]
    - [45, 0.0]
  - - [12096, 64, 1, 64]
    - [145, 0.0]
  - - [19152, 48, 1, 48]
    - [60, 0.0]
  - - [7584, 96, 1, 96]
    - [56, 0.0]
  - - [43232, 32, 1, 32]
    - [76, 0.0]
  - - [43418, 30, 1, 36]
    - [80, 0.0]
  - - [11776, 128, 1, 128]
    - [197, 0.0]
  - - [21760, 66, 1, 66]
    - [98, 0.0]
  - - [7776, 96, 1, 96]
    - [56, 0.0]
  - - [43008, 124, 1, 132]
    - [142, 0.0]
  - - [30522, 58, 1, 66]
    - [98, 0.0]
  - - [7616, 64, 1, 64]
    - [145, 0.0]
  - - [36576, 96, 1, 96]
    - [160, 0.0]
  - - [13968, 48, 1, 48]
    - [51, 0.0]
  - - [32800, 32, 1, 32]
    - [40, 0.0]
  - - [15806, 66, 1, 66]
    - [56, 0.0]
  - - [29232, 48, 1, 48]
    - [51, 0.0]
  - - [8064, 192, 1, 192]
    - [198, 0.0]
  - - [6912, 66, 1, 66]
    - [136, 0.0]
  - - [1024, 66, 1, 66]
    - [37, 0.0]
  - - [27802, 30, 1, 36]
    - [38, 0.0]
  - - [2976, 96, 1, 96]
    - [173, 0.0]
  - - [30336, 192, 1, 192]
    - [202, 0.0]
  - - [16442, 58, 1, 66]
    - [45, 0.0]
  - - [16128, 96, 1, 96]
    - [162, 0.0]
  - - [37856, 32, 1, 32]
    - [45, 0.0]
  - - [24480, 96, 1, 96]
    - [96, 0.0]
  - - [22368, 32, 1, 32]
    - [43, 0.0]
  - - [16512, 96, 1, 96]
    - [94, 0.0]
  - - [22682, 30, 1, 36]
    - [37, 0.0]
  - - [41904, 48, 1, 48]
    - [52, 0.0]
  - - [29148, 30, 1, 36]
    - [38, 0.0]
  - - [33504, 32, 1, 32]
    - [76, 0.0]
  - - [37392, 48, 1, 48]
    - [52, 0.0]
  - - [26368, 124, 1, 132]
    - [142, 0.0]
  - - [624, 48, 1, 48]
    - [37, 0.0]
  - - [2048, 58, 1, 66]
    - [119, 0.0]
  - - [12832, 32, 1, 32]
    - [37, 0.0]
  - - [36288, 64, 1, 64]
    - [117, 0.0]
  - - [31488, 58, 1, 66]
    - [98, 0.0]
  - - [4320, 32, 1, 32]
    - [37, 0.0]
  - - [6232, 30, 1, 36]
    - [43, 0.0]
  - - [5568, 64, 1, 64]
    - [145, 0.0]
  - - [23552, 58, 1, 66]
    - [47, 0.0]
  - - [3776, 64, 1, 64]
    - [141, 0.0]
  - - [7296, 96, 1, 96]
    - [162, 0.0]
  - - [32512, 58, 1, 66]
    - [98, 0.0]
  - - [25504, 32, 1, 32]
    - [77, 0.0]
  - - [13056, 124, 1, 132]
    - [142, 0.0]
  - - [10320, 48, 1, 48]
    - [51, 0.0]
  - - [18110, 66, 1, 66]
    - [98, 0.0]
  - - [35006, 66, 1, 66]
    - [57, 0.0]
  - - [42464, 32, 1, 32]
    - [40, 0.0]
  - - [8704, 124, 1, 132]
    - [69, 0.0]
  - - [19680, 96, 1, 96]
    - [94, 0.0]
  - - [26496, 192, 1, 192]
    - [199, 0.0]
  - - [36096, 58, 1, 66]
    - [171, 0.0]
  - - [10720, 32, 1, 32]
    - [37, 0.0]
  - - [1760, 32, 1, 32]
    - [40, 0.0]
  - - [9948, 30, 1, 36]
    - [37, 0.0]
  - - [31712, 32, 1, 32]
    - [44, 0.0]
  - - [44288, 128, 1, 128]
    - [146, 0.0]
  - - [31708, 30, 1, 36]
    - [75, 0.0]
  - - [19258, 58, 1, 66]
    - [45, 0.0]
  - - [42460, 30, 1, 36]
    - [40, 0.0]
  - - [36928, 64, 1, 64]
    - [118, 0.0]
  - - [1584, 48, 1, 48]
    - [40, 0.0]
  - - [13056, 192, 1, 192]
    - [193, 0.0]
  - - [28570, 30, 1, 36]
    - [44, 0.0]
  - - [23520, 96, 1, 96]
    - [94, 0.0]
  - - [23040, 96, 1, 96]
    - [96, 0.0]
  - - [21050, 58, 1, 66]
    - [43, 0.0]
  - - [43808, 32, 1, 32]
    - [40, 0.0]
  - - [9984, 192, 1, 192]
    - [105, 0.0]
  - - [14304, 32, 1, 32]
    - [74, 0.0]
  - - [8192, 30, 1, 36]
    - [37, 0.0]
  - - [35136, 64, 1, 64]
    - [117, 0.0]
  - - [40668, 30, 1, 36]
    - [76, 0.0]
  - - [26912, 32, 1, 32]
    - [41, 0.0]
  - - [9952, 32, 1, 32]
    - [37, 0.0]
  - - [12816, 48, 1, 48]
    - [89, 0.0]
  - - [42336, 32, 1, 32]
    - [40, 0.0]
  - - [36720, 48, 1, 48]
    - [52, 0.0]
  - - [3072, 30, 1, 36]
    - [45, 0.0]
  - - [6714, 58, 1, 66]
    - [124, 0.0]
  - - [7072, 32, 1, 32]
    - [37, 0.0]
  - - [25088, 128, 1, 128]
    - [146, 0.0]
  - - [13056, 58, 1, 66]
    - [62, 0.0]
  - - [6592, 64, 1, 64]
    - [145, 0.0]
  - - [11520, 58, 1, 66]
    - [147, 0.0]
  - - [1920, 96, 1, 96]
    - [139, 0.0]
  - - [5616, 48, 1, 48]
    - [119, 0.0]
  - - [36410, 58, 1, 66]
    - [117, 0.0]
  - - [13920, 32, 1, 32]
    - [37, 0.0]
  - - [28192, 32, 1, 32]
    - [41, 0.0]
  - - [30720, 66, 1, 66]
    - [100, 0.0]
  - - [13376, 64, 1, 64]
    - [192, 0.0]
  - - [19584, 96, 1, 96]
    - [94, 0.0]
  - - [8288, 32, 1, 32]
    - [119, 0.0]
  - - [3808, 32, 1, 32]
    - [40, 0.0]
  - - [32856, 30, 1, 36]
    - [40, 0.0]
  - - [5888, 124, 1, 132]
    - [84, 0.0]
  - - [33280, 58, 1, 66]
    - [171, 0.0]
  - - [28176, 48, 1, 48]
    - [133, 0.0]
  - - [37728, 96, 1, 96]
    - [182, 0.0]
  - - [8832, 96, 1, 96]
    - [90, 0.0]
  - - [42204, 30, 1, 36]
    - [80, 0.0]
  - - [38784, 192, 1, 192]
    - [199, 0.0]
  - - [39132, 30, 1, 36]
    - [76, 0.0]
  - - [37632, 48, 1, 48]
    - [52, 0.0]
  - - [23776, 32, 1, 32]
    - [40, 0.0]
  - - [34392, 30, 1, 36]
    - [40, 0.0]
  - - [12128, 32, 1, 32]
    - [37, 0.0]
  - - [30778, 58, 1, 66]
    - [101, 0.0]
  - - [32958, 66, 1, 66]
    - [57, 0.0]
  - - [42768, 48, 1, 48]
    - [90, 0.0]
  - - [19800, 30, 1, 36]
    - [37, 0.0]
  - - [15456, 32, 1, 32]
    - [74, 0.0]
  - - [10584, 30, 1, 36]
    - [74, 0.0]
  - - [3518, 66, 1, 66]
    - [124, 0.0]
  - - [25088, 58, 1, 66]
    - [62, 0.0]
  - - [35904, 64, 1, 64]
    - [117, 0.0]
  - - [288, 96, 1, 96]
    - [119, 0.0]
  - - [15792, 48, 1, 48]
    - [51, 0.0]
  - - [3262, 66, 1, 66]
    - [43, 0.0]
  - - [40704, 66, 1, 66]
    - [98, 0.0]
  - - [40960, 66, 1, 66]
    - [100, 0.0]
  - - [6554, 30, 1, 36]
    - [40, 0.0]
  - - [25584, 48, 1, 48]
    - [136, 0.0]
  - - [13568, 124, 1, 132]
    - [148, 0.0]
  - - [26592, 32, 1, 32]
    - [41, 0.0]
  - - [21914, 30, 1, 36]
    - [37, 0.0]
  - - [35226, 30, 1, 36]
    - [40, 0.0]
  - - [15808, 64, 1, 64]
    - [116, 0.0]
  - - [5856, 32, 1, 32]
    - [76, 0.0]
  - - [32640, 192, 1, 192]
    - [202, 0.0]
  - - [14736, 48, 1, 48]
    - [52, 0.0]
  - - [40992, 32, 1, 32]
    - [45, 0.0]
  - - [25952, 32, 1, 32]
    - [44, 0.0]
  - - [7648, 32, 1, 32]
    - [40, 0.0]
  - - [31920, 48, 1, 48]
    - [137, 0.0]
  - - [38736, 48, 1, 48]
    - [57, 0.0]
  - - [35738, 30, 1, 36]
    - [45, 0.0]
  - - [17722, 58, 1, 66]
    - [43, 0.0]
  - - [6656, 66, 1, 66]
    - [59, 0.0]
  - - [32, 32, 1, 32]
    - [138, 0.0]
  - - [3072, 48, 1, 48]
    - [37, 0.0]
  - - [41728, 124, 1, 132]
    - [146, 0.0]
  - - [9216, 124, 1, 132]
    - [70, 0.0]
  - - [1120, 32, 1, 32]
    - [74, 0.0]
  - - [9018, 58, 1, 66]
    - [130, 0.0]
  - - [16896, 96, 1, 96]
    - [94, 0.0]
  - - [41696, 32, 1, 32]
    - [45, 0.0]
  - - [4250, 30, 1, 36]
    - [37, 0.0]
  - - [13680, 48, 1, 48]
    - [89, 0.0]
  - - [11008, 58, 1, 66]
    - [141, 0.0]
  - - [14240, 32, 1, 32]
    - [37, 0.0]
  - - [37584, 48, 1, 48]
    - [52, 0.0]
  - - [36320, 32, 1, 32]
    - [76, 0.0]
  - - [6144, 96, 1, 96]
    - [44, 0.0]
  - - [28218, 58, 1, 66]
    - [63, 0.0]
  - - [5976, 30, 1, 36]
    - [40, 0.0]
  - - [26064, 48, 1, 48]
    - [133, 0.0]
  - - [13056, 128, 1, 128]
    - [142, 0.0]
  - - [23072, 32, 1, 32]
    - [43, 0.0]
  - - [11616, 32, 1, 32]
    - [37, 0.0]
  - - [34560, 30, 1, 36]
    - [76, 0.0]
  - - [2400, 32, 1, 32]
    - [76, 0.0]
  - - [1472, 64, 1, 64]
    - [119, 0.0]
  - - [21248, 124, 1, 132]
    - [146, 0.0]
  - - [1872, 48, 1, 48]
    - [37, 0.0]
  - - [35386, 58, 1, 66]
    - [115, 0.0]
  - - [24912, 48, 1, 48]
    - [53, 0.0]
  - - [42816, 64, 1, 64]
    - [169, 0.0]
  - - [21724, 30, 1, 36]
    - [37, 0.0]
  - - [1920, 192, 1, 192]
    - [124, 0.0]
  - - [42784, 32, 1, 32]
    - [45, 0.0]
  - - [2304, 124, 1, 132]
    - [45, 0.0]
  - - [11744, 32, 1, 32]
    - [37, 0.0]
  - - [6620, 30, 1, 36]
    - [43, 0.0]
  - - [36864, 128, 1, 128]
    - [146, 0.0]
  - - [27450, 58, 1, 66]
    - [64, 0.0]
  - - [14976, 48, 1, 48]
    - [51, 0.0]
  - - [8496, 48, 1, 48]
    - [45, 0.0]
  - - [29152, 32, 1, 32]
    - [38, 0.0]
  - - [5120, 128, 1, 128]
    - [142, 0.0]
  - - [1056, 96, 1, 96]
    - [119, 0.0]
  - - [40762, 58, 1, 66]
    - [118, 0.0]
  - - [9662, 66, 1, 66]
    - [64, 0.0]
  - - [16984, 30, 1, 36]
    - [37, 0.0]
  - - [16896, 192, 1, 192]
    - [194, 0.0]
  - - [36864, 30, 1, 36]
    - [45, 0.0]
  - - [22496, 32, 1, 32]
    - [40, 0.0]
  - - [7936, 30, 1, 36]
    - [43, 0.0]
  - - [16092, 30, 1, 36]
    - [37, 0.0]
  - - [41984, 66, 1, 66]
    - [98, 0.0]
  - - [18144, 32, 1, 32]
    - [76, 0.0]
  - - [34048, 30, 1, 36]
    - [78, 0.0]
  - - [30808, 30, 1, 36]
    - [44, 0.0]
  - - [19728, 48, 1, 48]
    - [60, 0.0]
  - - [20512, 32, 1, 32]
    - [37, 0.0]
  - - [20976, 48, 1, 48]
    - [54, 0.0]
  - - [27488, 32, 1, 32]
    - [77, 0.0]
  - - [7482, 58, 1, 66]
    - [124, 0.0]
  - - [8864, 32, 1, 32]
    - [119, 0.0]
  - - [25568, 32, 1, 32]
    - [44, 0.0]
  - - [5664, 96, 1, 96]
    - [159, 0.0]
  - - [22336, 64, 1, 64]
    - [117, 0.0]
  - - [21248, 58, 1, 66]
    - [45, 0.0]
  - - [12528, 48, 1, 48]
    - [51, 0.0]
  - - [16062, 66, 1, 66]
    - [58, 0.0]
  - - [11616, 96, 1, 96]
    - [96, 0.0]
  - - [3744, 32, 1, 32]
    - [40, 0.0]
  - - [20736, 30, 1, 36]
    - [37, 0.0]
  - - [8416, 32, 1, 32]
    - [37, 0.0]
  - - [5952, 64, 1, 64]
    - [124, 0.0]
  - - [24544, 32, 1, 32]
    - [37, 0.0]
  - - [36608, 58, 1, 66]
    - [171, 0.0]
  - - [28672, 66, 1, 66]
    - [98, 0.0]
  - - [720, 48, 1, 48]
    - [37, 0.0]
  - - [21648, 48, 1, 48]
    - [60, 0.0]
  - - [26112, 124, 1, 132]
    - [146, 0.0]
  - - [14208, 192, 1, 192]
    - [199, 0.0]
  - - [35072, 58, 1, 66]
    - [117, 0.0]
  - - [7776, 32, 1, 32]
    - [76, 0.0]
  - - [36864, 192, 1, 192]
    - [199, 0.0]
  - - [10240, 58, 1, 66]
    - [60, 0.0]
  - - [23648, 32, 1, 32]
    - [43, 0.0]
  - - [13502, 66, 1, 66]
    - [56, 0.0]
  - - [42960, 48, 1, 48]
    - [52, 0.0]
  - - [13488, 48, 1, 48]
    - [51, 0.0]
  - - [31872, 192, 1, 192]
    - [200, 0.0]
  - - [38400, 58, 1, 66]
    - [117, 0.0]
  - - [10394, 30, 1, 36]
    - [74, 0.0]
  - - [12352, 64, 1, 64]
    - [81, 0.0]
  - - [41792, 64, 1, 64]
    - [116, 0.0]
  - - [37084, 30, 1, 36]
    - [80, 0.0]
  - - [22528, 66, 1, 66]
    - [57, 0.0]
  - - [10496, 58, 1, 66]
    - [83, 0.0]
  - - [38334, 66, 1, 66]
    - [182, 0.0]
  - - [40736, 32, 1, 32]
    - [40, 0.0]
  - - [11264, 128, 1, 128]
    - [197, 0.0]
  - - [27424, 32, 1, 32]
    - [79, 0.0]
  - - [31934, 66, 1, 66]
    - [100, 0.0]
  - - [27168, 96, 1, 96]
    - [163, 0.0]
  - - [28380, 30, 1, 36]
    - [75, 0.0]
  - - [37888, 66, 1, 66]
    - [98, 0.0]
  - - [23424, 96, 1, 96]
    - [96, 0.0]
  - - [9370, 30, 1, 36]
    - [74, 0.0]
  - - [25392, 48, 1, 48]
    - [189, 0.0]
  - - [21760, 30, 1, 36]
    - [37, 0.0]
  - - [4352, 66, 1, 66]
    - [124, 0.0]
  - - [14592, 66, 1, 66]
    - [58, 0.0]
  - - [36440, 30, 1, 36]
    - [43, 0.0]
  - - [7968, 32, 1, 32]
    - [40, 0.0]
  - - [35994, 30, 1, 36]
    - [45, 0.0]
  - - [40752, 48, 1, 48]
    - [54, 0.0]
  - - [17210, 58, 1, 66]
    - [45, 0.0]
  - - [21504, 128, 1, 128]
    - [145, 0.0]
  - - [17120, 32, 1, 32]
    - [74, 0.0]
  - - [38816, 32, 1, 32]
    - [76, 0.0]
  - - [14448, 48, 1, 48]
    - [51, 0.0]
  - - [34560, 66, 1, 66]
    - [57, 0.0]
  - - [1536, 58, 1, 66]
    - [37, 0.0]
  - - [4512, 96, 1, 96]
    - [124, 0.0]
  - - [41760, 32, 1, 32]
    - [45, 0.0]
  - - [28896, 96, 1, 96]
    - [96, 0.0]
  - - [20794, 58, 1, 66]
    - [45, 0.0]
  - - [34144, 32, 1, 32]
    - [45, 0.0]
  - - [7768, 30, 1, 36]
    - [76, 0.0]
  - - [21248, 128, 1, 128]
    - [145, 0.0]
  - - [40704, 192, 1, 192]
    - [200, 0.0]
  - - [33088, 64, 1, 64]
    - [117, 0.0]
  - - [15770, 30, 1, 36]
    - [37, 0.0]
  - - [39936, 66, 1, 66]
    - [98, 0.0]
  - - [15312, 48, 1, 48]
    - [51, 0.0]
  - - [5712, 48, 1, 48]
    - [124, 0.0]
  - - [18464, 32, 1, 32]
    - [37, 0.0]
  - - [3024, 48, 1, 48]
    - [37, 0.0]
  - - [19104, 32, 1, 32]
    - [76, 0.0]
  - - [37786, 30, 1, 36]
    - [45, 0.0]
  - - [19712, 58, 1, 66]
    - [45, 0.0]
  - - [31296, 64, 1, 64]
    - [117, 0.0]
  - - [5344, 32, 1, 32]
    - [37, 0.0]
  - - [37776, 48, 1, 48]
    - [52, 0.0]
  - - [1244, 30, 1, 36]
    - [74, 0.0]
  - - [33244, 30, 1, 36]
    - [74, 0.0]
  - - [19552, 32, 1, 32]
    - [45, 0.0]
  - - [40224, 32, 1, 32]
    - [45, 0.0]
  - - [2784, 32, 1, 32]
    - [74, 0.0]
  - - [21552, 48, 1, 48]
    - [54, 0.0]
  - - [42016, 32, 1, 32]
    - [40, 0.0]
  - - [32732, 30, 1, 36]
    - [38, 0.0]
  - - [37344, 32, 1, 32]
    - [80, 0.0]
  - - [33792, 192, 1, 192]
    - [195, 0.0]
  - - [31576, 30, 1, 36]
    - [44, 0.0]
  - - [22752, 96, 1, 96]
    - [94, 0.0]
  - - [22842, 58, 1, 66]
    - [45, 0.0]
  - - [5376, 192, 1, 192]
    - [107, 0.0]
  - - [41504, 32, 1, 32]
    - [40, 0.0]
  - - [3584, 30, 1, 36]
    - [74, 0.0]
  - - [26010, 30, 1, 36]
    - [44, 0.0]
  - - [42810, 58, 1, 66]
    - [98, 0.0]
  - - [27712, 64, 1, 64]
    - [116, 0.0]
  - - [20496, 48, 1, 48]
    - [52, 0.0]
  - - [32880, 48, 1, 48]
    - [90, 0.0]
  - - [23354, 58, 1, 66]
    - [168, 0.0]
  - - [10496, 30, 1, 36]
    - [37, 0.0]
  - - [39504, 48, 1, 48]
    - [90, 0.0]
  - - [38112, 32, 1, 32]
    - [76, 0.0]
  - - [37008, 48, 1, 48]
    - [52, 0.0]
  - - [14394, 58, 1, 66]
    - [64, 0.0]
  - - [4512, 32, 1, 32]
    - [40, 0.0]
  - - [30464, 128, 1, 128]
    - [146, 0.0]
  - - [41664, 64, 1, 64]
    - [115, 0.0]
  - - [992, 32, 1, 32]
    - [37, 0.0]
  - - [42672, 48, 1, 48]
    - [94, 0.0]
  - - [11776, 58, 1, 66]
    - [131, 0.0]
  - - [8448, 96, 1, 96]
    - [94, 0.0]
  - - [1008, 48, 1, 48]
    - [37, 0.0]
  - - [24254, 66, 1, 66]
    - [57, 0.0]
  - - [2912, 32, 1, 32]
    - [76, 0.0]
  - - [41816, 30, 1, 36]
    - [40, 0.0]
  - - [43228, 30, 1, 36]
    - [40, 0.0]
  - - [24128, 64, 1, 64]
    - [168, 0.0]
  - - [10816, 64, 1, 64]
    - [141, 0.0]
  - - [27168, 32, 1, 32]
    - [38, 0.0]
  - - [32736, 32, 1, 32]
    - [38, 0.0]
  - - [40960, 124, 1, 132]
    - [142, 0.0]
  - - [28058, 30, 1, 36]
    - [38, 0.0]
  - - [29184, 30, 1, 36]
    - [44, 0.0]
  - - [40704, 48, 1, 48]
    - [52, 0.0]
  - - [33624, 30, 1, 36]
    - [78, 0.0]
  - - [39408, 48, 1, 48]
    - [90, 0.0]
  - - [35160, 30, 1, 36]
    - [40, 0.0]
  - - [11520, 124, 1, 132]
    - [88, 0.0]
  - - [27392, 30, 1, 36]
    - [44, 0.0]
  - - [36624, 48, 1, 48]
    - [90, 0.0]
  - - [31392, 32, 1, 32]
    - [41, 0.0]
  - - [34304, 124, 1, 132]
    - [146, 0.0]
  - - [922, 30, 1, 36]
    - [37, 0.0]
  - - [31166, 66, 1, 66]
    - [100, 0.0]
  - - [18848, 32, 1, 32]
    - [40, 0.0]
  - - [3424, 32, 1, 32]
    - [40, 0.0]
  - - [43776, 66, 1, 66]
    - [182, 0.0]
  - - [9816, 30, 1, 36]
    - [74, 0.0]
  - - [7102, 66, 1, 66]
    - [57, 0.0]
  - - [35584, 58, 1, 66]
    - [184, 0.0]
  - - [864, 32, 1, 32]
    - [37, 0.0]
  - - [10686, 66, 1, 66]
    - [64, 0.0]
  - - [8090, 30, 1, 36]
    - [40, 0.0]
  - - [960, 64, 1, 64]
    - [119, 0.0]
  - - [20352, 48, 1, 48]
    - [90, 0.0]
  - - [42944, 64, 1, 64]
    - [118, 0.0]
  - - [14880, 96, 1, 96]
    - [162, 0.0]
  - - [3840, 128, 1, 128]
    - [127, 0.0]
  - - [43162, 30, 1, 36]
    - [40, 0.0]
  - - [36572, 30, 1, 36]
    - [40, 0.0]
  - - [13312, 66, 1, 66]
    - [56, 0.0]
  - - [96, 96, 1, 96]
    - [138, 0.0]
  - - [23456, 32, 1, 32]
    - [40, 0.0]
  - - [10128, 48, 1, 48]
    - [76, 0.0]
  - - [24608, 32, 1, 32]
    - [38, 0.0]
  - - [31152, 48, 1, 48]
    - [51, 0.0]
  - - [2688, 96, 1, 96]
    - [127, 0.0]
  - - [19354, 30, 1, 36]
    - [74, 0.0]
  - - [12288, 66, 1, 66]
    - [60, 0.0]
  - - [5280, 96, 1, 96]
    - [178, 0.0]
  - - [38448, 48, 1, 48]
    - [54, 0.0]
  - - [28032, 96, 1, 96]
    - [157, 0.0]
  - - [28416, 30, 1, 36]
    - [44, 0.0]
  - - [3898, 58, 1, 66]
    - [127, 0.0]
  - - [18336, 96, 1, 96]
    - [94, 0.0]
  - - [5530, 30, 1, 36]
    - [40, 0.0]
  - - [2928, 48, 1, 48]
    - [78, 0.0]
  - - [15392, 32, 1, 32]
    - [37, 0.0]
  - - [37566, 66, 1, 66]
    - [182, 0.0]
  - - [6400, 58, 1, 66]
    - [124, 0.0]
  - - [1184, 32, 1, 32]
    - [37, 0.0]
  - - [42576, 48, 1, 48]
    - [54, 0.0]
  - - [19264, 64, 1, 64]
    - [145, 0.0]
  - - [14944, 32, 1, 32]
    - [37, 0.0]
  - - [1368, 30, 1, 36]
    - [37, 0.0]
  - - [23128, 30, 1, 36]
    - [37, 0.0]
  - - [42174, 66, 1, 66]
    - [100, 0.0]
  - - [33344, 64, 1, 64]
    - [114, 0.0]
  - - [28636, 30, 1, 36]
    - [38, 0.0]
  - - [36352, 128, 1, 128]
    - [192, 0.0]
  - - [16672, 32, 1, 32]
    - [37, 0.0]
  - - [42496, 66, 1, 66]
    - [98, 0.0]
  - - [15696, 48, 1, 48]
    - [51, 0.0]
  - - [33984, 64, 1, 64]
    - [117, 0.0]
  - - [36432, 48, 1, 48]
    - [52, 0.0]
  - - [26432, 64, 1, 64]
    - [144, 0.0]
  - - [38876, 30, 1, 36]
    - [40, 0.0]
  - - [31968, 96, 1, 96]
    - [162, 0.0]
  - - [25760, 32, 1, 32]
    - [41, 0.0]
  - - [9184, 32, 1, 32]
    - [40, 0.0]
  - - [10204, 30, 1, 36]
    - [119, 0.0]
  - - [42000, 48, 1, 48]
    - [52, 0.0]
  - - [27034, 30, 1, 36]
    - [77, 0.0]
  - - [15648, 32, 1, 32]
    - [119, 0.0]
  - - [37216, 32, 1, 32]
    - [76, 0.0]
  - - [37632, 192, 1, 192]
    - [200, 0.0]
  - - [3888, 48, 1, 48]
    - [37, 0.0]
  - - [36608, 66, 1, 66]
    - [60, 0.0]
  - - [12768, 32, 1, 32]
    - [37, 0.0]
  - - [11520, 128, 1, 128]
    - [193, 0.0]
  - - [41952, 96, 1, 96]
    - [155, 0.0]
  - - [38304, 32, 1, 32]
    - [45, 0.0]
  - - [24576, 192, 1, 192]
    - [202, 0.0]
  - - [15840, 96, 1, 96]
    - [58, 0.0]
  - - [5376, 30, 1, 36]
    - [37, 0.0]
  - - [25600, 66, 1, 66]
    - [182, 0.0]
  - - [26112, 96, 1, 96]
    - [179, 0.0]
  - - [13246, 66, 1, 66]
    - [56, 0.0]
  - - [15120, 48, 1, 48]
    - [51, 0.0]
  - - [1536, 48, 1, 48]
    - [37, 0.0]
  - - [35568, 48, 1, 48]
    - [52, 0.0]
  - - [22360, 30, 1, 36]
    - [43, 0.0]
  - - [39424, 58, 1, 66]
    - [117, 0.0]
  - - [32736, 96, 1, 96]
    - [163, 0.0]
  - - [6970, 58, 1, 66]
    - [145, 0.0]
  - - [25152, 64, 1, 64]
    - [146, 0.0]
  - - [160, 32, 1, 32]
    - [74, 0.0]
  - - [20480, 58, 1, 66]
    - [45, 0.0]
  - - [34494, 66, 1, 66]
    - [184, 0.0]
  - - [28832, 32, 1, 32]
    - [75, 0.0]
  - - [22272, 124, 1, 132]
    - [142, 0.0]
  - - [35548, 30, 1, 36]
    - [37, 0.0]
  - - [37690, 58, 1, 66]
    - [117, 0.0]
  - - [32192, 64, 1, 64]
    - [117, 0.0]
  - - [29784, 30, 1, 36]
    - [44, 0.0]
  - - [14064, 48, 1, 48]
    - [89, 0.0]
  - - [34048, 128, 1, 128]
    - [146, 0.0]
  - - [11520, 48, 1, 48]
    - [57, 0.0]
  - - [19488, 96, 1, 96]
    - [96, 0.0]
  - - [16608, 96, 1, 96]
    - [94, 0.0]
  - - [40126, 66, 1, 66]
    - [184, 0.0]
  - - [3392, 64, 1, 64]
    - [141, 0.0]
  - - [3292, 30, 1, 36]
    - [37, 0.0]
  - - [35360, 32, 1, 32]
    - [76, 0.0]
  - - [36000, 32, 1, 32]
    - [40, 0.0]
  - - [44160, 96, 1, 96]
    - [160, 0.0]
  - - [20224, 58, 1, 66]
    - [45, 0.0]
  - - [28512, 32, 1, 32]
    - [75, 0.0]
  - - [27104, 32, 1, 32]
    - [38, 0.0]
  - - [17152, 124, 1, 132]
    - [144, 0.0]
  - - [8192, 124, 1, 132]
    - [62, 0.0]
  - - [14906, 58, 1, 66]
    - [62, 0.0]
  - - [23040, 48, 1, 48]
    - [52, 0.0]
  - - [17808, 48, 1, 48]
    - [52, 0.0]
  - - [9728, 124, 1, 132]
    - [145, 0.0]
  - - [27584, 64, 1, 64]
    - [114, 0.0]
  - - [36096, 48, 1, 48]
    - [90, 0.0]
  - - [16848, 48, 1, 48]
    - [90, 0.0]
  - - [2784, 96, 1, 96]
    - [122, 0.0]
  - - [43712, 64, 1, 64]
    - [118, 0.0]
  - - [43674, 30, 1, 36]
    - [40, 0.0]
  - - [19776, 64, 1, 64]
    - [141, 0.0]
  - - [21888, 192, 1, 192]
    - [199, 0.0]
  - - [2750, 66, 1, 66]
    - [45, 0.0]
  - - [23264, 32, 1, 32]
    - [45, 0.0]
  - - [34458, 30, 1, 36]
    - [78, 0.0]
  - - [2736, 48, 1, 48]
    - [40, 0.0]
  - - [36096, 128, 1, 128]
    - [194, 0.0]
  - - [32512, 66, 1, 66]
    - [99, 0.0]
  - - [1690, 30, 1, 36]
    - [76, 0.0]
  - - [12608, 64, 1, 64]
    - [79, 0.0]
  - - [25408, 64, 1, 64]
    - [195, 0.0]
  - - [32666, 30, 1, 36]
    - [38, 0.0]
  - - [39024, 48, 1, 48]
    - [52, 0.0]
  - - [21950, 66, 1, 66]
    - [57, 0.0]
  - - [17984, 64, 1, 64]
    - [145, 0.0]
  - - [26266, 30, 1, 36]
    - [44, 0.0]
  - - [34304, 128, 1, 128]
    - [146, 0.0]
  - - [17050, 30, 1, 36]
    - [37, 0.0]
  - - [40384, 64, 1, 64]
    - [118, 0.0]
  - - [17040, 48, 1, 48]
    - [52, 0.0]
  - - [42042, 58, 1, 66]
    - [118, 0.0]
  - - [26976, 96, 1, 96]
    - [208, 0.0]
  - - [30240, 96, 1, 96]
    - [94, 0.0]
  - - [25600, 128, 1, 128]
    - [146, 0.0]
  - - [5888, 66, 1, 66]
    - [56, 0.0]
  - - [5632, 66, 1, 66]
    - [59, 0.0]
  - - [20444, 30, 1, 36]
    - [74, 0.0]
  - - [13600, 32, 1, 32]
    - [37, 0.0]
  - - [37248, 48, 1, 48]
    - [90, 0.0]
  - - [24576, 66, 1, 66]
    - [57, 0.0]
  - - [41472, 96, 1, 96]
    - [205, 0.0]
  - - [43776, 192, 1, 192]
    - [202, 0.0]
  - - [22432, 32, 1, 32]
    - [43, 0.0]
  - - [15984, 48, 1, 48]
    - [51, 0.0]
  - - [23584, 32, 1, 32]
    - [76, 0.0]
  - - [9216, 58, 1, 66]
    - [131, 0.0]
  - - [6816, 96, 1, 96]
    - [156, 0.0]
  - - [21984, 96, 1, 96]
    - [96, 0.0]
  - - [23136, 32, 1, 32]
    - [45, 0.0]
  - - [20416, 64, 1, 64]
    - [145, 0.0]
  - - [37088, 32, 1, 32]
    - [40, 0.0]
  - - [13400, 30, 1, 36]
    - [74, 0.0]
  - - [14880, 32, 1, 32]
    - [37, 0.0]
  - - [36544, 64, 1, 64]
    - [117, 0.0]
  - - [16704, 64, 1, 64]
    - [141, 0.0]
  - - [1104, 48, 1, 48]
    - [37, 0.0]
  - - [4224, 192, 1, 192]
    - [107, 0.0]
  - - [15104, 58, 1, 66]
    - [62, 0.0]
  - - [13312, 124, 1, 132]
    - [196, 0.0]
  - - [2720, 32, 1, 32]
    - [40, 0.0]
  - - [1856, 64, 1, 64]
    - [124, 0.0]
  - - [34592, 32, 1, 32]
    - [76, 0.0]
  - - [14912, 64, 1, 64]
    - [146, 0.0]
  - - [768, 48, 1, 48]
    - [37, 0.0]
  - - [12032, 128, 1, 128]
    - [86, 0.0]
  - - [4828, 30, 1, 36]
    - [37, 0.0]
  - - [40280, 30, 1, 36]
    - [76, 0.0]
  - - [23840, 32, 1, 32]
    - [74, 0.0]
  - - [4544, 64, 1, 64]
    - [145, 0.0]
  - - [26302, 66, 1, 66]
    - [179, 0.0]
  - - [39984, 48, 1, 48]
    - [52, 0.0]
  - - [4656, 48, 1, 48]
    - [40, 0.0]
  - - [34304, 58, 1, 66]
    - [109, 0.0]
  - - [36096, 192, 1, 192]
    - [200, 0.0]
  - - [22784, 66, 1, 66]
    - [57, 0.0]
  - - [19872, 96, 1, 96]
    - [94, 0.0]
  - - [988, 30, 1, 36]
    - [67, 0.0]
  - - [25120, 32, 1, 32]
    - [77, 0.0]
  - - [30400, 64, 1, 64]
    - [117, 0.0]
  - - [7168, 30, 1, 36]
    - [40, 0.0]
  - - [42720, 32, 1, 32]
    - [40, 0.0]
  - - [3600, 48, 1, 48]
    - [37, 0.0]
  - - [29184, 58, 1, 66]
    - [98, 0.0]
  - - [3264, 64, 1, 64]
    - [127, 0.0]
  - - [16752, 48, 1, 48]
    - [57, 0.0]
  - - [40176, 48, 1, 48]
    - [52, 0.0]
  - - [30552, 30, 1, 36]
    - [38, 0.0]
  - - [30428, 30, 1, 36]
    - [44, 0.0]
  - - [9728, 30, 1, 36]
    - [40, 0.0]
  - - [43484, 30, 1, 36]
    - [76, 0.0]
  - - [21728, 32, 1, 32]
    - [37, 0.0]
  - - [5690, 58, 1, 66]
    - [124, 0.0]
  - - [6048, 32, 1, 32]
    - [37, 0.0]
  - - [28672, 58, 1, 66]
    - [63, 0.0]
  - - [30910, 66, 1, 66]
    - [98, 0.0]
  - - [40080, 48, 1, 48]
    - [57, 0.0]
  - - [17752, 30, 1, 36]
    - [37, 0.0]
  - - [25344, 48, 1, 48]
    - [137, 0.0]
  - - [5888, 58, 1, 66]
    - [124, 0.0]
  - - [37976, 30, 1, 36]
    - [76, 0.0]
  - - [8688, 48, 1, 48]
    - [37, 0.0]
  - - [36352, 58, 1, 66]
    - [117, 0.0]
  - - [12000, 96, 1, 96]
    - [96, 0.0]
  - - [33434, 30, 1, 36]
    - [76, 0.0]
  - - [26076, 30, 1, 36]
    - [38, 0.0]
  - - [30208, 66, 1, 66]
    - [98, 0.0]
  - - [36286, 66, 1, 66]
    - [57, 0.0]
  - - [35296, 32, 1, 32]
    - [40, 0.0]
  - - [64, 64, 1, 64]
    - [37, 0.0]
  - - [17152, 128, 1, 128]
    - [195, 0.0]
  - - [27904, 66, 1, 66]
    - [98, 0.0]
  - - [24576, 124, 1, 132]
    - [146, 0.0]
  - - [41056, 32, 1, 32]
    - [76, 0.0]
  - - [36576, 32, 1, 32]
    - [76, 0.0]
  - - [24064, 128, 1, 128]
    - [194, 0.0]
  - - [8960, 124, 1, 132]
    - [69, 0.0]
  - - [5312, 64, 1, 64]
    - [124, 0.0]
  - - [26640, 48, 1, 48]
    - [61, 0.0]
  - - [41824, 32, 1, 32]
    - [76, 0.0]
  - - [25088, 66, 1, 66]
    - [184, 0.0]
  - - [26880, 30, 1, 36]
    - [38, 0.0]
  - - [4224, 48, 1, 48]
    - [119, 0.0]
  - - [40192, 124, 1, 132]
    - [146, 0.0]
  - - [21504, 124, 1, 132]
    - [146, 0.0]
  - - [44112, 48, 1, 48]
    - [54, 0.0]
  - - [4952, 30, 1, 36]
    - [76, 0.0]
  - - [6590, 66, 1, 66]
    - [59, 0.0]
  - - [19200, 48, 1, 48]
    - [52, 0.0]
  - - [20384, 32, 1, 32]
    - [74, 0.0]
  - - [18864, 48, 1, 48]
    - [52, 0.0]
  - - [11966, 66, 1, 66]
    - [96, 0.0]
  - - [13722, 30, 1, 36]
    - [37, 0.0]
  - - [11520, 96, 1, 96]
    - [57, 0.0]
  - - [27480, 30, 1, 36]
    - [38, 0.0]
  - - [32608, 32, 1, 32]
    - [46, 0.0]
  - - [15872, 66, 1, 66]
    - [58, 0.0]
  - - [26560, 64, 1, 64]
    - [97, 0.0]
  - - [20256, 96, 1, 96]
    - [60, 0.0]
  - - [7424, 128, 1, 128]
    - [73, 0.0]
  - - [35680, 32, 1, 32]
    - [37, 0.0]
  - - [29952, 66, 1, 66]
    - [98, 0.0]
  - - [25344, 96, 1, 96]
    - [163, 0.0]
  - - [20448, 96, 1, 96]
    - [210, 0.0]
  - - [22816, 32, 1, 32]
    - [40, 0.0]
  - - [14336, 30, 1, 36]
    - [37, 0.0]
  - - [5520, 48, 1, 48]
    - [40, 0.0]
  - - [36528, 48, 1, 48]
    - [52, 0.0]
  - - [13824, 66, 1, 66]
    - [58, 0.0]
  - - [41216, 124, 1, 132]
    - [142, 0.0]
  - - [7200, 32, 1, 32]
    - [37, 0.0]
  - - [33888, 32, 1, 32]
    - [76, 0.0]
  - - [8250, 58, 1, 66]
    - [131, 0.0]
  - - [38176, 32, 1, 32]
    - [45, 0.0]
  - - [2714, 30, 1, 36]
    - [37, 0.0]
  - - [16512, 48, 1, 48]
    - [90, 0.0]
  - - [5376, 128, 1, 128]
    - [83, 0.0]
  - - [9984, 58, 1, 66]
    - [85, 0.0]
  - - [10656, 32, 1, 32]
    - [37, 0.0]
  - - [39968, 32, 1, 32]
    - [45, 0.0]
  - - [24832, 30, 1, 36]
    - [38, 0.0]
  - - [29472, 96, 1, 96]
    - [96, 0.0]
  - - [41280, 64, 1, 64]
    - [112, 0.0]
  - - [856, 30, 1, 36]
    - [67, 0.0]
  - - [8384, 64, 1, 64]
    - [83, 0.0]
  - - [31744, 58, 1, 66]
    - [98, 0.0]
  - - [19968, 128, 1, 128]
    - [193, 0.0]
  - - [42584, 30, 1, 36]
    - [45, 0.0]
  - - [34240, 64, 1, 64]
    - [171, 0.0]
  - - [39888, 48, 1, 48]
    - [90, 0.0]
  - - [4944, 48, 1, 48]
    - [173, 0.0]
  - - [256, 128, 1, 128]
    - [119, 0.0]
  - - [17600, 64, 1, 64]
    - [147, 0.0]
  - - [17888, 32, 1, 32]
    - [40, 0.0]
  - - [29520, 48, 1, 48]
    - [51, 0.0]
  - - [41856, 48, 1, 48]
    - [52, 0.0]
  - - [38016, 48, 1, 48]
    - [90, 0.0]
  - - [14752, 32, 1, 32]
    - [74, 0.0]
  - - [6624, 32, 1, 32]
    - [40, 0.0]
  - - [5596, 30, 1, 36]
    - [74, 0.0]
  - - [31424, 64, 1, 64]
    - [117, 0.0]
  - - [15704, 30, 1, 36]
    - [74, 0.0]
  - - [32922, 30, 1, 36]
    - [43, 0.0]
  - - [6656, 128, 1, 128]
    - [72, 0.0]
  - - [27360, 32, 1, 32]
    - [38, 0.0]
  - - [23856, 48, 1, 48]
    - [54, 0.0]
  - - [30362, 30, 1, 36]
    - [41, 0.0]
  - - [9728, 58, 1, 66]
    - [74, 0.0]
  - - [22206, 66, 1, 66]
    - [60, 0.0]
  - - [32640, 48, 1, 48]
    - [51, 0.0]
  - - [28160, 66, 1, 66]
    - [98, 0.0]
  - - [4704, 96, 1, 96]
    - [124, 0.0]
  - - [37872, 48, 1, 48]
    - [90, 0.0]
  - - [7680, 192, 1, 192]
    - [151, 0.0]
  - - [17466, 58, 1, 66]
    - [45, 0.0]
  - - [2816, 30, 1, 36]
    - [76, 0.0]
  - - [42976, 32, 1, 32]
    - [45, 0.0]
  - - [34618, 58, 1, 66]
    - [117, 0.0]
  - - [20320, 32, 1, 32]
    - [37, 0.0]
  - - [39680, 66, 1, 66]
    - [184, 0.0]
  - - [31064, 30, 1, 36]
    - [38, 0.0]
  - - [31728, 48, 1, 48]
    - [59, 0.0]
  - - [38554, 30, 1, 36]
    - [76, 0.0]
  - - [10554, 58, 1, 66]
    - [131, 0.0]
  - - [7200, 96, 1, 96]
    - [129, 0.0]
  - - [18048, 192, 1, 192]
    - [103, 0.0]
  - - [26976, 32, 1, 32]
    - [77, 0.0]
  - - [704, 64, 1, 64]
    - [119, 0.0]
  - - [33536, 66, 1, 66]
    - [57, 0.0]
  - - [22848, 64, 1, 64]
    - [114, 0.0]
  - - [3312, 48, 1, 48]
    - [37, 0.0]
  - - [42240, 96, 1, 96]
    - [158, 0.0]
  - - [4608, 48, 1, 48]
    - [74, 0.0]
  - - [41376, 32, 1, 32]
    - [45, 0.0]
  - - [8192, 128, 1, 128]
    - [62, 0.0]
  - - [38304, 96, 1, 96]
    - [207, 0.0]
  - - [15936, 64, 1, 64]
    - [116, 0.0]
  - - [832, 64, 1, 64]
    - [119, 0.0]
  - - [13788, 30, 1, 36]
    - [37, 0.0]
  - - [20640, 96, 1, 96]
    - [98, 0.0]
  - - [40320, 192, 1, 192]
    - [203, 0.0]
  - - [26624, 66, 1, 66]
    - [57, 0.0]
  - - [29660, 30, 1, 36]
    - [44, 0.0]
  - - [34524, 30, 1, 36]
    - [37, 0.0]
  - - [24540, 30, 1, 36]
    - [37, 0.0]
  - - [26832, 48, 1, 48]
    - [51, 0.0]
  - - [36480, 48, 1, 48]
    - [54, 0.0]
  - - [1536, 124, 1, 132]
    - [139, 0.0]
  - - [17884, 30, 1, 36]
    - [37, 0.0]
  - - [26256, 48, 1, 48]
    - [58, 0.0]
  - - [40656, 48, 1, 48]
    - [54, 0.0]
  - - [26368, 128, 1, 128]
    - [194, 0.0]
  - - [27904, 30, 1, 36]
    - [38, 0.0]
  - - [15674, 58, 1, 66]
    - [46, 0.0]
  - - [11200, 64, 1, 64]
    - [141, 0.0]
  - - [13920, 96, 1, 96]
    - [93, 0.0]
  - - [10848, 32, 1, 32]
    - [74, 0.0]
  - - [38970, 58, 1, 66]
    - [117, 0.0]
  - - [23552, 124, 1, 132]
    - [145, 0.0]
  - - [190, 66, 1, 66]
    - [37, 0.0]
  - - [16560, 48, 1, 48]
    - [94, 0.0]
  - - [19712, 128, 1, 128]
    - [195, 0.0]
  - - [37968, 48, 1, 48]
    - [52, 0.0]
  - - [1178, 30, 1, 36]
    - [37, 0.0]
  - - [8768, 64, 1, 64]
    - [146, 0.0]
  - - [38560, 32, 1, 32]
    - [40, 0.0]
  - - [43264, 58, 1, 66]
    - [98, 0.0]
  - - [41728, 58, 1, 66]
    - [118, 0.0]
  - - [9600, 96, 1, 96]
    - [94, 0.0]
  - - [14336, 128, 1, 128]
    - [193, 0.0]
  - - [38144, 66, 1, 66]
    - [182, 0.0]
  - - [2016, 32, 1, 32]
    - [74, 0.0]
  - - [30976, 30, 1, 36]
    - [75, 0.0]
  - - [6288, 48, 1, 48]
    - [124, 0.0]
  - - [6400, 128, 1, 128]
    - [73, 0.0]
  - - [36144, 48, 1, 48]
    - [52, 0.0]
  - - [19920, 48, 1, 48]
    - [54, 0.0]
  - - [18264, 30, 1, 36]
    - [37, 0.0]
  - - [11520, 66, 1, 66]
    - [60, 0.0]
  - - [11008, 66, 1, 66]
    - [60, 0.0]
  - - [42384, 48, 1, 48]
    - [57, 0.0]
  - - [31130, 30, 1, 36]
    - [38, 0.0]
  - - [1440, 96, 1, 96]
    - [139, 0.0]
  - - [31744, 30, 1, 36]
    - [38, 0.0]
  - - [29760, 64, 1, 64]
    - [116, 0.0]
  - - [9312, 32, 1, 32]
    - [119, 0.0]
  - - [29184, 128, 1, 128]
    - [192, 0.0]
  - - [42912, 96, 1, 96]
    - [158, 0.0]
  - - [15514, 30, 1, 36]
    - [74, 0.0]
  - - [42752, 124, 1, 132]
    - [142, 0.0]
  - - [5232, 48, 1, 48]
    - [119, 0.0]
  - - [12800, 58, 1, 66]
    - [81, 0.0]
  - - [6432, 32, 1, 32]
    - [40, 0.0]
  - - [40096, 32, 1, 32]
    - [40, 0.0]
  - - [20704, 32, 1, 32]
    - [37, 0.0]
  - - [10840, 30, 1, 36]
    - [74, 0.0]
  - - [12288, 96, 1, 96]
    - [57, 0.0]
  - - [21438, 66, 1, 66]
    - [98, 0.0]
  - - [21024, 96, 1, 96]
    - [98, 0.0]
  - - [42752, 30, 1, 36]
    - [40, 0.0]
  - - [42432, 64, 1, 64]
    - [118, 0.0]
  - - [22528, 124, 1, 132]
    - [146, 0.0]
  - - [22272, 30, 1, 36]
    - [37, 0.0]
  - - [8784, 48, 1, 48]
    - [37, 0.0]
  - - [22016, 30, 1, 36]
    - [74, 0.0]
  - - [31584, 96, 1, 96]
    - [210, 0.0]
  - - [1280, 124, 1, 132]
    - [139, 0.0]
  - - [20312, 30, 1, 36]
    - [37, 0.0]
  - - [27962, 58, 1, 66]
    - [63, 0.0]
  - - [22944, 32, 1, 32]
    - [37, 0.0]
  - - [22104, 30, 1, 36]
    - [37, 0.0]
  - - [224, 32, 1, 32]
    - [74, 0.0]
  - - [4316, 30, 1, 36]
    - [37, 0.0]
  - - [35642, 58, 1, 66]
    - [117, 0.0]
  - - [35552, 32, 1, 32]
    - [74, 0.0]
  - - [48, 48, 1, 48]
    - [67, 0.0]
  - - [32000, 128, 1, 128]
    - [146, 0.0]
  - - [17920, 58, 1, 66]
    - [43, 0.0]
  - - [32256, 192, 1, 192]
    - [199, 0.0]
  - - [28730, 58, 1, 66]
    - [99, 0.0]
  - - [6144, 128, 1, 128]
    - [85, 0.0]
  - - [20736, 58, 1, 66]
    - [45, 0.0]
  - - [8448, 192, 1, 192]
    - [194, 0.0]
  - - [25658, 58, 1, 66]
    - [64, 0.0]
  - - [6656, 30, 1, 36]
    - [37, 0.0]
  - - [36608, 30, 1, 36]
    - [45, 0.0]
  - - [43296, 32, 1, 32]
    - [40, 0.0]
  - - [3520, 64, 1, 64]
    - [141, 0.0]
  - - [26336, 32, 1, 32]
    - [75, 0.0]
  - - [24992, 32, 1, 32]
    - [38, 0.0]
  - - [11280, 48, 1, 48]
    - [53, 0.0]
  - - [2304, 128, 1, 128]
    - [124, 0.0]
  - - [15104, 66, 1, 66]
    - [58, 0.0]
  - - [25200, 48, 1, 48]
    - [91, 0.0]
  - - [27552, 96, 1, 96]
    - [158, 0.0]
  - - [22224, 48, 1, 48]
    - [54, 0.0]
  - - [31964, 30, 1, 36]
    - [38, 0.0]
  - - [11008, 30, 1, 36]
    - [119, 0.0]
  - - [20256, 32, 1, 32]
    - [37, 0.0]
  - - [24730, 30, 1, 36]
    - [38, 0.0]
  - - [13370, 58, 1, 66]
    - [62, 0.0]
  - - [22992, 48, 1, 48]
    - [54, 0.0]
  - - [3488, 32, 1, 32]
    - [37, 0.0]
  - - [27792, 48, 1, 48]
    - [133, 0.0]
  - - [17568, 96, 1, 96]
    - [96, 0.0]
  - - [33760, 32, 1, 32]
    - [45, 0.0]
  - - [31392, 96, 1, 96]
    - [96, 0.0]
  - - [37632, 58, 1, 66]
    - [117, 0.0]
  - - [14336, 58, 1, 66]
    - [62, 0.0]
  - - [16368, 48, 1, 48]
    - [51, 0.0]
  - - [13440, 192, 1, 192]
    - [193, 0.0]
  - - [19968, 58, 1, 66]
    - [45, 0.0]
  - - [2016, 96, 1, 96]
    - [139, 0.0]
  - - [44064, 96, 1, 96]
    - [206, 0.0]
  - - [19040, 32, 1, 32]
    - [74, 0.0]
  - - [18784, 32, 1, 32]
    - [37, 0.0]
  - - [19902, 66, 1, 66]
    - [60, 0.0]
  - - [21980, 30, 1, 36]
    - [37, 0.0]
  - - [1600, 64, 1, 64]
    - [119, 0.0]
  - - [768, 128, 1, 128]
    - [119, 0.0]
  - - [19514, 58, 1, 66]
    - [43, 0.0]
  - - [30048, 96, 1, 96]
    - [94, 0.0]
  - - [33952, 32, 1, 32]
    - [37, 0.0]
  - - [41436, 30, 1, 36]
    - [76, 0.0]
  - - [23486, 66, 1, 66]
    - [57, 0.0]
  - - [14592, 124, 1, 132]
    - [64, 0.0]
  - - [22176, 96, 1, 96]
    - [96, 0.0]
  - - [22800, 48, 1, 48]
    - [54, 0.0]
  - - [34400, 32, 1, 32]
    - [74, 0.0]
  - - [19392, 64, 1, 64]
    - [141, 0.0]
  - - [42240, 192, 1, 192]
    - [202, 0.0]
  - - [34048, 66, 1, 66]
    - [57, 0.0]
  - - [6496, 32, 1, 32]
    - [37, 0.0]
  - - [2752, 64, 1, 64]
    - [141, 0.0]
  - - [33120, 96, 1, 96]
    - [94, 0.0]
  - - [30172, 30, 1, 36]
    - [38, 0.0]
  - - [31744, 124, 1, 132]
    - [146, 0.0]
  - - [10752, 128, 1, 128]
    - [204, 0.0]
  - - [10328, 30, 1, 36]
    - [74, 0.0]
  - - [6078, 66, 1, 66]
    - [44, 0.0]
  - - [16832, 64, 1, 64]
    - [69, 0.0]
  - - [36542, 66, 1, 66]
    - [60, 0.0]
  - - [24320, 124, 1, 132]
    - [172, 0.0]
  - - [14256, 48, 1, 48]
    - [51, 0.0]
  - - [9150, 66, 1, 66]
    - [60, 0.0]
  - - [21536, 32, 1, 32]
    - [76, 0.0]
  - - [2970, 30, 1, 36]
    - [76, 0.0]
  - - [25856, 66, 1, 66]
    - [179, 0.0]
  - - [32160, 96, 1, 96]
    - [163, 0.0]
  - - [9792, 64, 1, 64]
    - [146, 0.0]
  - - [41952, 32, 1, 32]
    - [45, 0.0]
  - - [13568, 66, 1, 66]
    - [58, 0.0]
  - - [26496, 48, 1, 48]
    - [58, 0.0]
  - - [29856, 32, 1, 32]
    - [41, 0.0]
  - - [22330, 58, 1, 66]
    - [45, 0.0]
  - - [26144, 32, 1, 32]
    - [46, 0.0]
  - - [19808, 32, 1, 32]
    - [40, 0.0]
  - - [13200, 48, 1, 48]
    - [51, 0.0]
  - - [36352, 30, 1, 36]
    - [40, 0.0]
  - - [40608, 96, 1, 96]
    - [210, 0.0]
  - - [29616, 48, 1, 48]
    - [51, 0.0]
  - - [19968, 124, 1, 132]
    - [148, 0.0]
  - - [29952, 30, 1, 36]
    - [44, 0.0]
  - - [32544, 32, 1, 32]
    - [38, 0.0]
  - - [5056, 64, 1, 64]
    - [141, 0.0]
  - - [11264, 66, 1, 66]
    - [96, 0.0]
  - - [6688, 32, 1, 32]
    - [119, 0.0]
  - - [34648, 30, 1, 36]
    - [43, 0.0]
  - - [42528, 96, 1, 96]
    - [207, 0.0]
  - - [2362, 58, 1, 66]
    - [45, 0.0]
  - - [10138, 30, 1, 36]
    - [78, 0.0]
  - - [15162, 58, 1, 66]
    - [62, 0.0]
  - - [15836, 30, 1, 36]
    - [37, 0.0]
  - - [39312, 48, 1, 48]
    - [52, 0.0]
  - - [9984, 66, 1, 66]
    - [64, 0.0]
  - - [34560, 96, 1, 96]
    - [210, 0.0]
  - - [13568, 58, 1, 66]
    - [62, 0.0]
  - - [7840, 32, 1, 32]
    - [119, 0.0]
  - - [2848, 32, 1, 32]
    - [176, 0.0]
  - - [32190, 66, 1, 66]
    - [184, 0.0]
  - - [12632, 30, 1, 36]
    - [37, 0.0]
  - - [1728, 64, 1, 64]
    - [124, 0.0]
  - - [39456, 32, 1, 32]
    - [76, 0.0]
  - - [35040, 96, 1, 96]
    - [94, 0.0]
  - - [3456, 48, 1, 48]
    - [45, 0.0]
  - - [21658, 30, 1, 36]
    - [76, 0.0]
  - - [16026, 30, 1, 36]
    - [74, 0.0]
  - - [18768, 48, 1, 48]
    - [52, 0.0]
  - - [22608, 48, 1, 48]
    - [54, 0.0]
  - - [26624, 58, 1, 66]
    - [64, 0.0]
  - - [30432, 96, 1, 96]
    - [96, 0.0]
  - - [34970, 30, 1, 36]
    - [40, 0.0]
  - - [39488, 64, 1, 64]
    - [118, 0.0]
  - - [5472, 96, 1, 96]
    - [159, 0.0]
  - - [36608, 128, 1, 128]
    - [146, 0.0]
  - - [5084, 30, 1, 36]
    - [40, 0.0]
  - - [23520, 32, 1, 32]
    - [37, 0.0]
  - - [27648, 124, 1, 132]
    - [142, 0.0]
  - - [10976, 32, 1, 32]
    - [37, 0.0]
  - - [16288, 32, 1, 32]
    - [37, 0.0]
  - - [6960, 48, 1, 48]
    - [74, 0.0]
  - - [25088, 30, 1, 36]
    - [46, 0.0]
  - - [23808, 96, 1, 96]
    - [94, 0.0]
  - - [1792, 128, 1, 128]
    - [141, 0.0]
  - - [33376, 32, 1, 32]
    - [37, 0.0]
  - - [36666, 58, 1, 66]
    - [117, 0.0]
  - - [26880, 48, 1, 48]
    - [58, 0.0]
  - - [32544, 96, 1, 96]
    - [210, 0.0]
  - - [15360, 192, 1, 192]
    - [145, 0.0]
  - - [8448, 30, 1, 36]
    - [76, 0.0]
  - - [15264, 96, 1, 96]
    - [187, 0.0]
  - - [3136, 64, 1, 64]
    - [191, 0.0]
  - - [5904, 48, 1, 48]
    - [124, 0.0]
  - - [23296, 66, 1, 66]
    - [60, 0.0]
  - - [21120, 96, 1, 96]
    - [94, 0.0]
  - - [27888, 48, 1, 48]
    - [51, 0.0]
  - - [12960, 32, 1, 32]
    - [37, 0.0]
  - - [15258, 30, 1, 36]
    - [40, 0.0]
  - - [13978, 30, 1, 36]
    - [74, 0.0]
  - - [33728, 64, 1, 64]
    - [111, 0.0]
  - - [13536, 32, 1, 32]
    - [37, 0.0]
  - - [5946, 58, 1, 66]
    - [124, 0.0]
  - - [37120, 124, 1, 132]
    - [146, 0.0]
  - - [7328, 32, 1, 32]
    - [124, 0.0]
  - - [39104, 64, 1, 64]
    - [118, 0.0]
  - - [28512, 96, 1, 96]
    - [160, 0.0]
  - - [37568, 64, 1, 64]
    - [118, 0.0]
  - - [20890, 30, 1, 36]
    - [76, 0.0]
  - - [34080, 32, 1, 32]
    - [40, 0.0]
  - - [26496, 96, 1, 96]
    - [188, 0.0]
  - - [24528, 48, 1, 48]
    - [52, 0.0]
  - - [17136, 48, 1, 48]
    - [90, 0.0]
  - - [27136, 30, 1, 36]
    - [38, 0.0]
  - - [28160, 58, 1, 66]
    - [62, 0.0]
  - - [14528, 64, 1, 64]
    - [142, 0.0]
  - - [39392, 32, 1, 32]
    - [76, 0.0]
  - - [12384, 96, 1, 96]
    - [45, 0.0]
  - - [35584, 66, 1, 66]
    - [60, 0.0]
  - - [15744, 96, 1, 96]
    - [162, 0.0]
  - - [6464, 64, 1, 64]
    - [194, 0.0]
  - - [1756, 30, 1, 36]
    - [74, 0.0]
  - - [21694, 66, 1, 66]
    - [101, 0.0]
  - - [37184, 64, 1, 64]
    - [117, 0.0]
  - - [18140, 30, 1, 36]
    - [74, 0.0]
  - - [15872, 128, 1, 128]
    - [145, 0.0]
  - - [27136, 66, 1, 66]
    - [98, 0.0]
  - - [13760, 64, 1, 64]
    - [192, 0.0]
  - - [16128, 48, 1, 48]
    - [51, 0.0]
  - - [43440, 48, 1, 48]
    - [54, 0.0]
  - - [39680, 58, 1, 66]
    - [118, 0.0]
  - - [5328, 48, 1, 48]
    - [122, 0.0]
  - - [25022, 66, 1, 66]
    - [184, 0.0]
  - - [35518, 66, 1, 66]
    - [60, 0.0]
  - - [28560, 48, 1, 48]
    - [89, 0.0]
  - - [40792, 30, 1, 36]
    - [40, 0.0]
  - - [23516, 30, 1, 36]
    - [37, 0.0]
  - - [4896, 96, 1, 96]
    - [124, 0.0]
  - - [96, 32, 1, 32]
    - [67, 0.0]
  - - [22586, 58, 1, 66]
    - [114, 0.0]
  - - [18816, 48, 1, 48]
    - [57, 0.0]
  - - [1726, 66, 1, 66]
    - [40, 0.0]
  - - [25024, 64, 1, 64]
    - [146, 0.0]
  - - [18096, 48, 1, 48]
    - [52, 0.0]
  - - [12954, 30, 1, 36]
    - [74, 0.0]
  - - [11904, 96, 1, 96]
    - [96, 0.0]
  - - [19288, 30, 1, 36]
    - [37, 0.0]
  - - [40288, 32, 1, 32]
    - [40, 0.0]
  - - [26880, 58, 1, 66]
    - [63, 0.0]
  - - [36922, 58, 1, 66]
    - [111, 0.0]
  - - [5376, 124, 1, 132]
    - [84, 0.0]
  - - [16384, 30, 1, 36]
    - [37, 0.0]
  - - [34496, 64, 1, 64]
    - [204, 0.0]
  - - [43454, 66, 1, 66]
    - [99, 0.0]
  - - [25914, 58, 1, 66]
    - [63, 0.0]
  - - [14812, 30, 1, 36]
    - [37, 0.0]
  - - [31808, 64, 1, 64]
    - [117, 0.0]
  - - [7824, 48, 1, 48]
    - [119, 0.0]
  - - [26160, 48, 1, 48]
    - [51, 0.0]
  - - [41632, 32, 1, 32]
    - [45, 0.0]
  - - [28160, 124, 1, 132]
    - [142, 0.0]
  - - [25824, 96, 1, 96]
    - [157, 0.0]
  - - [42240, 58, 1, 66]
    - [172, 0.0]
  - - [10368, 48, 1, 48]
    - [52, 0.0]
  - - [8960, 66, 1, 66]
    - [94, 0.0]
  - - [10240, 66, 1, 66]
    - [100, 0.0]
  - - [44160, 48, 1, 48]
    - [54, 0.0]
  - - [288, 32, 1, 32]
    - [67, 0.0]
  - - [19056, 48, 1, 48]
    - [57, 0.0]
  - - [23040, 30, 1, 36]
    - [37, 0.0]
  - - [24122, 58, 1, 66]
    - [114, 0.0]
  - - [26816, 64, 1, 64]
    - [117, 0.0]
  - - [4096, 58, 1, 66]
    - [125, 0.0]
  - - [9760, 32, 1, 32]
    - [173, 0.0]
  - - [42430, 66, 1, 66]
    - [98, 0.0]
  - - [27456, 64, 1, 64]
    - [117, 0.0]
  - - [16640, 30, 1, 36]
    - [74, 0.0]
  - - [37178, 58, 1, 66]
    - [171, 0.0]
  - - [30720, 96, 1, 96]
    - [163, 0.0]
  - - [88, 30, 1, 36]
    - [67, 0.0]
  - - [30720, 30, 1, 36]
    - [38, 0.0]
  - - [36128, 32, 1, 32]
    - [40, 0.0]
  - - [17598, 66, 1, 66]
    - [57, 0.0]
  - - [41616, 48, 1, 48]
    - [90, 0.0]
  - - [24378, 58, 1, 66]
    - [47, 0.0]
  - - [26048, 64, 1, 64]
    - [142, 0.0]
  - - [11198, 66, 1, 66]
    - [60, 0.0]
  - - [17472, 64, 1, 64]
    - [145, 0.0]
  - - [4176, 48, 1, 48]
    - [37, 0.0]
  - - [5632, 30, 1, 36]
    - [37, 0.0]
  - - [8672, 32, 1, 32]
    - [124, 0.0]
  - - [3792, 48, 1, 48]
    - [37, 0.0]
  - - [35488, 32, 1, 32]
    - [76, 0.0]
  - - [34624, 64, 1, 64]
    - [118, 0.0]
  - - [27648, 128, 1, 128]
    - [146, 0.0]
  - - [26624, 124, 1, 132]
    - [146, 0.0]
  - - [20634, 30, 1, 36]
    - [45, 0.0]
  - - [6240, 96, 1, 96]
    - [46, 0.0]
  - - [11996, 30, 1, 36]
    - [74, 0.0]
  - - [37054, 66, 1, 66]
    - [184, 0.0]
  - - [32256, 66, 1, 66]
    - [100, 0.0]
  - - [37152, 96, 1, 96]
    - [182, 0.0]
  - - [20016, 48, 1, 48]
    - [60, 0.0]
  - - [15616, 128, 1, 128]
    - [145, 0.0]
  - - [28000, 32, 1, 32]
    - [77, 0.0]
  - - [4288, 64, 1, 64]
    - [175, 0.0]
  - - [34560, 192, 1, 192]
    - [199, 0.0]
  - - [25632, 96, 1, 96]
    - [177, 0.0]
  - - [8800, 32, 1, 32]
    - [37, 0.0]
  - - [4992, 192, 1, 192]
    - [107, 0.0]
  - - [39226, 58, 1, 66]
    - [117, 0.0]
  - - [39136, 32, 1, 32]
    - [40, 0.0]
  - - [26968, 30, 1, 36]
    - [41, 0.0]
  - - [12640, 32, 1, 32]
    - [37, 0.0]
  - - [41984, 58, 1, 66]
    - [115, 0.0]
  - - [44222, 66, 1, 66]
    - [182, 0.0]
  - - [10240, 30, 1, 36]
    - [45, 0.0]
  - - [6912, 124, 1, 132]
    - [66, 0.0]
  - - [6672, 48, 1, 48]
    - [122, 0.0]
  - - [29242, 58, 1, 66]
    - [98, 0.0]
  - - [36032, 64, 1, 64]
    - [117, 0.0]
  - - [28128, 32, 1, 32]
    - [38, 0.0]
  - - [33648, 48, 1, 48]
    - [52, 0.0]
  - - [21152, 32, 1, 32]
    - [76, 0.0]
  - - [20288, 64, 1, 64]
    - [196, 0.0]
  - - [23450, 30, 1, 36]
    - [43, 0.0]
  - - [12288, 30, 1, 36]
    - [37, 0.0]
  - - [9152, 64, 1, 64]
    - [146, 0.0]
  - - [8762, 58, 1, 66]
    - [49, 0.0]
  - - [32344, 30, 1, 36]
    - [38, 0.0]
  - - [9120, 32, 1, 32]
    - [119, 0.0]
  - - [20736, 66, 1, 66]
    - [98, 0.0]
  - - [39264, 96, 1, 96]
    - [187, 0.0]
  - - [4256, 32, 1, 32]
    - [122, 0.0]
  - - [25920, 64, 1, 64]
    - [144, 0.0]
  - - [37984, 32, 1, 32]
    - [40, 0.0]
  - - [8448, 58, 1, 66]
    - [45, 0.0]
  - - [24048, 48, 1, 48]
    - [57, 0.0]
  - - [37632, 30, 1, 36]
    - [40, 0.0]
  - - [14208, 48, 1, 48]
    - [52, 0.0]
  - - [28320, 32, 1, 32]
    - [38, 0.0]
  - - [2656, 32, 1, 32]
    - [37, 0.0]
  - - [35482, 30, 1, 36]
    - [40, 0.0]
  - - [35808, 96, 1, 96]
    - [94, 0.0]
  - - [19712, 124, 1, 132]
    - [171, 0.0]
  - - [7232, 64, 1, 64]
    - [191, 0.0]
  - - [30720, 58, 1, 66]
    - [98, 0.0]
  - - [42240, 124, 1, 132]
    - [142, 0.0]
  - - [19164, 30, 1, 36]
    - [37, 0.0]
  - - [22492, 30, 1, 36]
    - [45, 0.0]
  - - [7936, 124, 1, 132]
    - [64, 0.0]
  - - [42848, 32, 1, 32]
    - [45, 0.0]
  - - [38080, 64, 1, 64]
    - [118, 0.0]
  - - [25104, 48, 1, 48]
    - [133, 0.0]
  - - [16216, 30, 1, 36]
    - [37, 0.0]
  - - [18016, 32, 1, 32]
    - [37, 0.0]
  - - [3008, 64, 1, 64]
    - [191, 0.0]
  - - [35232, 32, 1, 32]
    - [76, 0.0]
  - - [43584, 64, 1, 64]
    - [115, 0.0]
  - - [14176, 32, 1, 32]
    - [37, 0.0]
  - - [36480, 192, 1, 192]
    - [199, 0.0]
  - - [33792, 48, 1, 48]
    - [54, 0.0]
  - - [32480, 32, 1, 32]
    - [41, 0.0]
  - - [15360, 124, 1, 132]
    - [63, 0.0]
  - - [3416, 30, 1, 36]
    - [37, 0.0]
  - - [5566, 66, 1, 66]
    - [45, 0.0]
  - - [43536, 48, 1, 48]
    - [57, 0.0]
  - - [38832, 48, 1, 48]
    - [52, 0.0]
  - - [9648, 48, 1, 48]
    - [45, 0.0]
  - - [12478, 66, 1, 66]
    - [59, 0.0]
  - - [5152, 32, 1, 32]
    - [40, 0.0]
  - - [38496, 96, 1, 96]
    - [182, 0.0]
  - - [410, 30, 1, 36]
    - [67, 0.0]
  - - [4704, 32, 1, 32]
    - [37, 0.0]
  - - [30816, 96, 1, 96]
    - [94, 0.0]
  - - [11008, 128, 1, 128]
    - [142, 0.0]
  - - [37888, 58, 1, 66]
    - [117, 0.0]
  - - [9920, 64, 1, 64]
    - [80, 0.0]
  - - [23742, 66, 1, 66]
    - [57, 0.0]
  - - [15744, 192, 1, 192]
    - [202, 0.0]
  - - [13472, 32, 1, 32]
    - [37, 0.0]
  - - [9728, 128, 1, 128]
    - [145, 0.0]
  - - [13824, 96, 1, 96]
    - [93, 0.0]
  - - [25824, 32, 1, 32]
    - [38, 0.0]
  - - [34904, 30, 1, 36]
    - [76, 0.0]
  - - [8592, 48, 1, 48]
    - [40, 0.0]
  - - [39168, 96, 1, 96]
    - [162, 0.0]
  - - [28848, 48, 1, 48]
    - [51, 0.0]
  - - [12768, 96, 1, 96]
    - [45, 0.0]
  - - [1024, 128, 1, 128]
    - [124, 0.0]
  - - [43520, 66, 1, 66]
    - [99, 0.0]
  - - [512, 66, 1, 66]
    - [74, 0.0]
  - - [9888, 96, 1, 96]
    - [94, 0.0]
  - - [21504, 66, 1, 66]
    - [98, 0.0]
  - - [38232, 30, 1, 36]
    - [45, 0.0]
  - - [43168, 32, 1, 32]
    - [45, 0.0]
  - - [21824, 64, 1, 64]
    - [114, 0.0]
  - - [33214, 66, 1, 66]
    - [184, 0.0]
  - - [2618, 58, 1, 66]
    - [45, 0.0]
  - - [5274, 30, 1, 36]
    - [76, 0.0]
  - - [1792, 124, 1, 132]
    - [141, 0.0]
  - - [7536, 48, 1, 48]
    - [119, 0.0]
  - - [15872, 58, 1, 66]
    - [62, 0.0]
  - - [4864, 58, 1, 66]
    - [124, 0.0]
  - - [3360, 96, 1, 96]
    - [124, 0.0]
  - - [35648, 64, 1, 64]
    - [111, 0.0]
  - - [38784, 48, 1, 48]
    - [90, 0.0]
  - - [28608, 64, 1, 64]
    - [117, 0.0]
  - - [8024, 30, 1, 36]
    - [74, 0.0]
  - - [20576, 32, 1, 32]
    - [40, 0.0]
  - - [32570, 58, 1, 66]
    - [99, 0.0]
  - - [19390, 66, 1, 66]
    - [57, 0.0]
  - - [20304, 48, 1, 48]
    - [52, 0.0]
  - - [23296, 58, 1, 66]
    - [114, 0.0]
  - - [34128, 48, 1, 48]
    - [52, 0.0]
  - - [43680, 32, 1, 32]
    - [76, 0.0]
  - - [16896, 48, 1, 48]
    - [90, 0.0]
  - - [2560, 124, 1, 132]
    - [45, 0.0]
  - - [5600, 32, 1, 32]
    - [76, 0.0]
  - - [20224, 128, 1, 128]
    - [148, 0.0]
  - - [10496, 66, 1, 66]
    - [62, 0.0]
  - - [42138, 30, 1, 36]
    - [76, 0.0]
  - - [39994, 58, 1, 66]
    - [117, 0.0]
  - - [3840, 124, 1, 132]
    - [127, 0.0]
  - - [2352, 48, 1, 48]
    - [37, 0.0]
  - - [29440, 124, 1, 132]
    - [146, 0.0]
  - - [10240, 128, 1, 128]
    - [145, 0.0]
  - - [31136, 32, 1, 32]
    - [38, 0.0]
  - - [6864, 48, 1, 48]
    - [119, 0.0]
  - - [16992, 32, 1, 32]
    - [37, 0.0]
  - - [14560, 32, 1, 32]
    - [37, 0.0]
  - - [10752, 192, 1, 192]
    - [194, 0.0]
  - - [6912, 128, 1, 128]
    - [73, 0.0]
  - - [5824, 64, 1, 64]
    - [124, 0.0]
  - - [36192, 96, 1, 96]
    - [210, 0.0]
  - - [9984, 30, 1, 36]
    - [74, 0.0]
  - - [30720, 124, 1, 132]
    - [146, 0.0]
  - - [30816, 32, 1, 32]
    - [77, 0.0]
  - - [34560, 58, 1, 66]
    - [114, 0.0]
  - - [40412, 30, 1, 36]
    - [45, 0.0]
  - - [13584, 48, 1, 48]
    - [89, 0.0]
  - - [32256, 30, 1, 36]
    - [75, 0.0]
  - - [11456, 64, 1, 64]
    - [145, 0.0]
  - - [864, 96, 1, 96]
    - [138, 0.0]
  - - [30192, 48, 1, 48]
    - [135, 0.0]
  - - [38744, 30, 1, 36]
    - [40, 0.0]
  - - [12064, 32, 1, 32]
    - [37, 0.0]
  - - [17344, 64, 1, 64]
    - [145, 0.0]
  - - [4542, 66, 1, 66]
    - [176, 0.0]
  - - [40128, 64, 1, 64]
    - [118, 0.0]
  - - [9530, 58, 1, 66]
    - [50, 0.0]
  - - [10912, 32, 1, 32]
    - [119, 0.0]
  - - [36864, 58, 1, 66]
    - [117, 0.0]
  - - [33472, 64, 1, 64]
    - [118, 0.0]
  - - [39102, 66, 1, 66]
    - [184, 0.0]
  - - [4506, 30, 1, 36]
    - [40, 0.0]
  - - [28606, 66, 1, 66]
    - [98, 0.0]
  - - [30464, 124, 1, 132]
    - [146, 0.0]
  - - [6384, 48, 1, 48]
    - [122, 0.0]
  - - [22272, 66, 1, 66]
    - [57, 0.0]
  - - [9216, 48, 1, 48]
    - [76, 0.0]
  - - [36762, 30, 1, 36]
    - [76, 0.0]
  - - [24800, 32, 1, 32]
    - [38, 0.0]
  - - [20736, 48, 1, 48]
    - [52, 0.0]
  - - [34016, 32, 1, 32]
    - [37, 0.0]
  - - [27904, 124, 1, 132]
    - [142, 0.0]
  - - [8000, 64, 1, 64]
    - [145, 0.0]
  - - [4060, 30, 1, 36]
    - [37, 0.0]
  - - [5310, 66, 1, 66]
    - [124, 0.0]
  - - [29728, 32, 1, 32]
    - [75, 0.0]
  - - [20800, 64, 1, 64]
    - [171, 0.0]
  - - [19866, 30, 1, 36]
    - [74, 0.0]
  - - [27648, 66, 1, 66]
    - [57, 0.0]
  - - [4608, 124, 1, 132]
    - [44, 0.0]
  - - [31290, 58, 1, 66]
    - [98, 0.0]
  - - [13504, 64, 1, 64]
    - [192, 0.0]
  - - [19134, 66, 1, 66]
    - [57, 0.0]
  - - [30864, 48, 1, 48]
    - [53, 0.0]
  - - [24408, 30, 1, 36]
    - [37, 0.0]
  - - [9824, 32, 1, 32]
    - [173, 0.0]
  - - [11904, 192, 1, 192]
    - [202, 0.0]
  - - [8382, 66, 1, 66]
    - [98, 0.0]
  - - [37376, 128, 1, 128]
    - [195, 0.0]
  - - [7358, 66, 1, 66]
    - [59, 0.0]
  - - [39648, 32, 1, 32]
    - [76, 0.0]
  - - [7344, 48, 1, 48]
    - [119, 0.0]
  - - [40090, 30, 1, 36]
    - [45, 0.0]
  - - [34880, 64, 1, 64]
    - [166, 0.0]
  - - [12442, 30, 1, 36]
    - [74, 0.0]
  - - [5184, 64, 1, 64]
    - [124, 0.0]
  - - [41370, 30, 1, 36]
    - [45, 0.0]
  - - [25564, 30, 1, 36]
    - [38, 0.0]
  - - [1440, 32, 1, 32]
    - [37, 0.0]
  - - [34368, 64, 1, 64]
    - [117, 0.0]
  - - [13312, 128, 1, 128]
    - [146, 0.0]
  - - [18112, 64, 1, 64]
    - [145, 0.0]
  - - [34784, 32, 1, 32]
    - [76, 0.0]
  - - [26112, 30, 1, 36]
    - [38, 0.0]
  - - [8400, 48, 1, 48]
    - [37, 0.0]
  - - [24672, 96, 1, 96]
    - [178, 0.0]
  - - [43096, 30, 1, 36]
    - [76, 0.0]
  - - [16224, 32, 1, 32]
    - [74, 0.0]
  - - [16416, 32, 1, 32]
    - [40, 0.0]
  - - [14592, 96, 1, 96]
    - [187, 0.0]
  - - [34608, 48, 1, 48]
    - [52, 0.0]
  - - [4762, 30, 1, 36]
    - [37, 0.0]
  - - [20064, 32, 1, 32]
    - [37, 0.0]
  - - [6400, 66, 1, 66]
    - [56, 0.0]
  - - [3328, 66, 1, 66]
    - [124, 0.0]
  - - [1824, 32, 1, 32]
    - [74, 0.0]
  - - [16384, 58, 1, 66]
    - [62, 0.0]
  - - [40512, 64, 1, 64]
    - [112, 0.0]
  - - [39578, 30, 1, 36]
    - [45, 0.0]
  - - [41424, 48, 1, 48]
    - [57, 0.0]
  - - [33536, 58, 1, 66]
    - [182, 0.0]
  - - [18496, 64, 1, 64]
    - [147, 0.0]
  - - [8304, 48, 1, 48]
    - [76, 0.0]
  - - [3584, 58, 1, 66]
    - [124, 0.0]
  - - [13728, 96, 1, 96]
    - [95, 0.0]
  - - [36448, 32, 1, 32]
    - [40, 0.0]
  - - [15324, 30, 1, 36]
    - [40, 0.0]
  - - [1624, 30, 1, 36]
    - [74, 0.0]
  - - [16800, 32, 1, 32]
    - [43, 0.0]
  - - [3072, 96, 1, 96]
    - [175, 0.0]
  - - [22112, 32, 1, 32]
    - [37, 0.0]
  - - [42272, 32, 1, 32]
    - [76, 0.0]
  - - [39696, 48, 1, 48]
    - [52, 0.0]
  - - [18816, 192, 1, 192]
    - [194, 0.0]
  - - [1088, 64, 1, 64]
    - [119, 0.0]
  - - [24144, 48, 1, 48]
    - [54, 0.0]
  - - [41216, 128, 1, 128]
    - [192, 0.0]
  - - [26080, 32, 1, 32]
    - [38, 0.0]
  - - [12240, 48, 1, 48]
    - [51, 0.0]
  - - [40638, 66, 1, 66]
    - [184, 0.0]
  - - [38368, 32, 1, 32]
    - [37, 0.0]
  - - [7392, 32, 1, 32]
    - [37, 0.0]
  - - [25600, 30, 1, 36]
    - [38, 0.0]
  - - [11484, 30, 1, 36]
    - [37, 0.0]
  - - [15328, 32, 1, 32]
    - [37, 0.0]
  - - [34176, 192, 1, 192]
    - [202, 0.0]
  - - [19200, 58, 1, 66]
    - [45, 0.0]
  - - [40864, 32, 1, 32]
    - [76, 0.0]
  - - [15408, 48, 1, 48]
    - [89, 0.0]
  - - [26170, 58, 1, 66]
    - [63, 0.0]
  - - [30720, 192, 1, 192]
    - [199, 0.0]
  - - [36352, 66, 1, 66]
    - [57, 0.0]
  - - [30656, 64, 1, 64]
    - [171, 0.0]
  - - [34780, 30, 1, 36]
    - [40, 0.0]
  - - [23808, 192, 1, 192]
    - [194, 0.0]
  - - [35088, 48, 1, 48]
    - [54, 0.0]
  - - [27838, 66, 1, 66]
    - [98, 0.0]
  - - [13824, 30, 1, 36]
    - [37, 0.0]
  - - [18752, 64, 1, 64]
    - [145, 0.0]
  - - [24284, 30, 1, 36]
    - [74, 0.0]
  - - [30208, 128, 1, 128]
    - [146, 0.0]
  - - [35804, 30, 1, 36]
    - [40, 0.0]
  - - [27936, 96, 1, 96]
    - [160, 0.0]
  - - [14352, 48, 1, 48]
    - [51, 0.0]
  - - [29808, 48, 1, 48]
    - [59, 0.0]
  - - [32058, 58, 1, 66]
    - [113, 0.0]
  - - [39552, 96, 1, 96]
    - [187, 0.0]
  - - [11520, 30, 1, 36]
    - [37, 0.0]
  - - [44288, 124, 1, 132]
    - [146, 0.0]
  - - [58, 58, 1, 66]
    - [37, 0.0]
  - - [15960, 30, 1, 36]
    - [37, 0.0]
  - - [6560, 32, 1, 32]
    - [43, 0.0]
  - - [34136, 30, 1, 36]
    - [74, 0.0]
  - - [21600, 32, 1, 32]
    - [43, 0.0]
  - - [3456, 192, 1, 192]
    - [150, 0.0]
  - - [27744, 96, 1, 96]
    - [160, 0.0]
  - - [8704, 58, 1, 66]
    - [43, 0.0]
  - - [19440, 48, 1, 48]
    - [54, 0.0]
  - - [3936, 32, 1, 32]
    - [76, 0.0]
  - - [41184, 96, 1, 96]
    - [205, 0.0]
  - - [16384, 128, 1, 128]
    - [193, 0.0]
  - - [314, 58, 1, 66]
    - [37, 0.0]
  - - [28504, 30, 1, 36]
    - [38, 0.0]
  - - [40320, 96, 1, 96]
    - [210, 0.0]
  - - [12672, 96, 1, 96]
    - [45, 0.0]
  - - [22528, 30, 1, 36]
    - [78, 0.0]
  - - [43008, 48, 1, 48]
    - [52, 0.0]
  - - [32448, 64, 1, 64]
    - [117, 0.0]
  - - [28992, 64, 1, 64]
    - [111, 0.0]
  - - [42716, 30, 1, 36]
    - [76, 0.0]
  - - [43872, 96, 1, 96]
    - [160, 0.0]
  - - [19968, 96, 1, 96]
    - [96, 0.0]
  - - [37152, 32, 1, 32]
    - [37, 0.0]
  - - [41048, 30, 1, 36]
    - [40, 0.0]
  - - [7632, 48, 1, 48]
    - [124, 0.0]
  - - [37536, 96, 1, 96]
    - [182, 0.0]
  - - [38880, 96, 1, 96]
    - [158, 0.0]
  - - [20736, 128, 1, 128]
    - [145, 0.0]
  - - [16080, 48, 1, 48]
    - [51, 0.0]
  - - [25820, 30, 1, 36]
    - [38, 0.0]
  - - [36096, 30, 1, 36]
    - [45, 0.0]
  - - [41472, 66, 1, 66]
    - [100, 0.0]
  - - [29952, 96, 1, 96]
    - [94, 0.0]
  - - [13664, 32, 1, 32]
    - [74, 0.0]
  - - [32512, 30, 1, 36]
    - [38, 0.0]
  - - [16574, 66, 1, 66]
    - [60, 0.0]
  - - [44096, 64, 1, 64]
    - [115, 0.0]
  - - [43392, 48, 1, 48]
    - [52, 0.0]
  - - [2648, 30, 1, 36]
    - [74, 0.0]
  - - [958, 66, 1, 66]
    - [37, 0.0]
  - - [40944, 48, 1, 48]
    - [92, 0.0]
  - - [29338, 30, 1, 36]
    - [44, 0.0]
  - - [17328, 48, 1, 48]
    - [94, 0.0]
  - - [11710, 66, 1, 66]
    - [94, 0.0]
  - - [24320, 66, 1, 66]
    - [57, 0.0]
  - - [1946, 30, 1, 36]
    - [74, 0.0]
  - - [44120, 30, 1, 36]
    - [40, 0.0]
  - - [43864, 30, 1, 36]
    - [80, 0.0]
  - - [35040, 32, 1, 32]
    - [76, 0.0]
  - - [30874, 30, 1, 36]
    - [38, 0.0]
  - - [5888, 128, 1, 128]
    - [83, 0.0]
  - - [18720, 32, 1, 32]
    - [76, 0.0]
  - - [40224, 96, 1, 96]
    - [164, 0.0]
  - - [3984, 48, 1, 48]
    - [37, 0.0]
  - - [41472, 58, 1, 66]
    - [113, 0.0]
  - - [27100, 30, 1, 36]
    - [38, 0.0]
  - - [29374, 66, 1, 66]
    - [98, 0.0]
  - - [28080, 48, 1, 48]
    - [56, 0.0]
  - - [1338, 58, 1, 66]
    - [40, 0.0]
  - - [14336, 66, 1, 66]
    - [61, 0.0]
  - - [5664, 32, 1, 32]
    - [40, 0.0]
  - - [21184, 64, 1, 64]
    - [114, 0.0]
  - - [41984, 30, 1, 36]
    - [74, 0.0]
  - - [13114, 58, 1, 66]
    - [75, 0.0]
  - - [38400, 124, 1, 132]
    - [142, 0.0]
  - - [2458, 30, 1, 36]
    - [37, 0.0]
  - - [21360, 48, 1, 48]
    - [54, 0.0]
  - - [42752, 66, 1, 66]
    - [98, 0.0]
  - - [256, 58, 1, 66]
    - [74, 0.0]
  - - [10400, 32, 1, 32]
    - [173, 0.0]
  - - [22748, 30, 1, 36]
    - [37, 0.0]
  - - [43920, 48, 1, 48]
    - [90, 0.0]
  - - [29696, 30, 1, 36]
    - [38, 0.0]
  - - [11608, 30, 1, 36]
    - [74, 0.0]
  - - [15616, 124, 1, 132]
    - [107, 0.0]
  - - [12992, 64, 1, 64]
    - [142, 0.0]
  - - [25056, 32, 1, 32]
    - [38, 0.0]
  - - [31872, 96, 1, 96]
    - [94, 0.0]
  - - [26016, 96, 1, 96]
    - [188, 0.0]
  - - [16186, 58, 1, 66]
    - [62, 0.0]
  - - [35928, 30, 1, 36]
    - [76, 0.0]
  - - [28760, 30, 1, 36]
    - [44, 0.0]
  - - [9552, 48, 1, 48]
    - [40, 0.0]
  - - [30208, 30, 1, 36]
    - [38, 0.0]
  - - [35328, 58, 1, 66]
    - [117, 0.0]
  - - [34272, 32, 1, 32]
    - [76, 0.0]
  - - [33360, 48, 1, 48]
    - [54, 0.0]
  - - [27296, 32, 1, 32]
    - [44, 0.0]
  - - [25146, 58, 1, 66]
    - [64, 0.0]
  - - [41760, 96, 1, 96]
    - [155, 0.0]
  - - [30296, 30, 1, 36]
    - [38, 0.0]
  - - [3040, 32, 1, 32]
    - [37, 0.0]
  - - [12252, 30, 1, 36]
    - [74, 0.0]
  - - [18490, 58, 1, 66]
    - [43, 0.0]
  - - [34944, 96, 1, 96]
    - [96, 0.0]
  - - [9600, 192, 1, 192]
    - [104, 0.0]
  - - [27392, 58, 1, 66]
    - [63, 0.0]
  - - [43744, 32, 1, 32]
    - [40, 0.0]
  - - [39216, 48, 1, 48]
    - [52, 0.0]
  - - [27736, 30, 1, 36]
    - [38, 0.0]
  - - [22320, 48, 1, 48]
    - [96, 0.0]
  - - [22368, 96, 1, 96]
    - [94, 0.0]
  - - [42656, 32, 1, 32]
    - [40, 0.0]
  - - [39768, 30, 1, 36]
    - [40, 0.0]
  - - [35072, 30, 1, 36]
    - [45, 0.0]
  - - [18432, 192, 1, 192]
    - [199, 0.0]
  - - [42240, 66, 1, 66]
    - [98, 0.0]
  - - [7424, 30, 1, 36]
    - [43, 0.0]
  - - [34202, 30, 1, 36]
    - [74, 0.0]
  - - [18176, 58, 1, 66]
    - [45, 0.0]
  - - [14424, 30, 1, 36]
    - [74, 0.0]
  - - [8976, 48, 1, 48]
    - [37, 0.0]
  - - [39738, 58, 1, 66]
    - [172, 0.0]
  - - [32496, 48, 1, 48]
    - [51, 0.0]
  - - [44192, 32, 1, 32]
    - [45, 0.0]
  - - [826, 58, 1, 66]
    - [37, 0.0]
  - - [24152, 30, 1, 36]
    - [74, 0.0]
  - - [2208, 32, 1, 32]
    - [74, 0.0]
  - - [22718, 66, 1, 66]
    - [57, 0.0]
  - - [29792, 32, 1, 32]
    - [38, 0.0]
  - - [31168, 64, 1, 64]
    - [168, 0.0]
  - - [21216, 32, 1, 32]
    - [76, 0.0]
  - - [35072, 66, 1, 66]
    - [57, 0.0]
  - - [22592, 64, 1, 64]
    - [117, 0.0]
  - - [7920, 48, 1, 48]
    - [119, 0.0]
  - - [44064, 32, 1, 32]
    - [40, 0.0]
  - - [29184, 48, 1, 48]
    - [51, 0.0]
  - - [10848, 96, 1, 96]
    - [96, 0.0]
  - - [30336, 96, 1, 96]
    - [96, 0.0]
  - - [37018, 30, 1, 36]
    - [45, 0.0]
  - - [18816, 96, 1, 96]
    - [92, 0.0]
  - - [43520, 30, 1, 36]
    - [76, 0.0]
  - - [5440, 64, 1, 64]
    - [124, 0.0]
  - - [12508, 30, 1, 36]
    - [37, 0.0]
  - - [31678, 66, 1, 66]
    - [98, 0.0]
  - - [21120, 192, 1, 192]
    - [194, 0.0]
  - - [2048, 124, 1, 132]
    - [141, 0.0]
  - - [154, 30, 1, 36]
    - [67, 0.0]
  - - [40368, 48, 1, 48]
    - [57, 0.0]
  - - [27024, 48, 1, 48]
    - [133, 0.0]
  - - [39584, 32, 1, 32]
    - [76, 0.0]
  - - [33408, 96, 1, 96]
    - [94, 0.0]
  - - [35616, 96, 1, 96]
    - [96, 0.0]
  - - [44288, 30, 1, 36]
    - [45, 0.0]
  - - [31898, 30, 1, 36]
    - [38, 0.0]
  - - [39358, 66, 1, 66]
    - [184, 0.0]
  - - [30976, 124, 1, 132]
    - [146, 0.0]
  - - [7264, 32, 1, 32]
    - [76, 0.0]
  - - [39600, 48, 1, 48]
    - [52, 0.0]
  - - [4798, 66, 1, 66]
    - [124, 0.0]
  - - [21168, 48, 1, 48]
    - [52, 0.0]
  - - [22016, 58, 1, 66]
    - [183, 0.0]
  - - [11930, 30, 1, 36]
    - [74, 0.0]
  - - [1344, 64, 1, 64]
    - [119, 0.0]
  - - [23610, 58, 1, 66]
    - [49, 0.0]
  - - [10464, 32, 1, 32]
    - [37, 0.0]
  - - [8704, 128, 1, 128]
    - [103, 0.0]
  - - [27264, 48, 1, 48]
    - [51, 0.0]
  - - [15550, 66, 1, 66]
    - [184, 0.0]
  - - [38048, 32, 1, 32]
    - [76, 0.0]
  - - [21344, 32, 1, 32]
    - [37, 0.0]
  - - [30432, 32, 1, 32]
    - [41, 0.0]
  - - [36048, 48, 1, 48]
    - [54, 0.0]
  - - [15648, 96, 1, 96]
    - [209, 0.0]
  - - [26712, 30, 1, 36]
    - [38, 0.0]
  - - [10896, 48, 1, 48]
    - [54, 0.0]
  - - [41328, 48, 1, 48]
    - [52, 0.0]
  - - [32224, 32, 1, 32]
    - [38, 0.0]
  - - [24624, 48, 1, 48]
    - [51, 0.0]
  - - [39456, 96, 1, 96]
    - [164, 0.0]
  - - [36800, 64, 1, 64]
    - [118, 0.0]
  - - [30940, 30, 1, 36]
    - [38, 0.0]
  - - [7936, 66, 1, 66]
    - [91, 0.0]
  - - [2560, 66, 1, 66]
    - [78, 0.0]
  - - [7456, 32, 1, 32]
    - [37, 0.0]
  - - [28224, 64, 1, 64]
    - [117, 0.0]
  - - [27648, 48, 1, 48]
    - [51, 0.0]
  - - [34512, 48, 1, 48]
    - [135, 0.0]
  - - [17152, 58, 1, 66]
    - [45, 0.0]
  - - [9840, 48, 1, 48]
    - [43, 0.0]
  - - [11264, 58, 1, 66]
    - [131, 0.0]
  - - [3744, 96, 1, 96]
    - [124, 0.0]
  - - [29528, 30, 1, 36]
    - [44, 0.0]
  - - [35616, 32, 1, 32]
    - [45, 0.0]
  - - [39776, 32, 1, 32]
    - [40, 0.0]
  - - [7256, 30, 1, 36]
    - [74, 0.0]
  - - [23808, 124, 1, 132]
    - [146, 0.0]
  - - [26624, 30, 1, 36]
    - [44, 0.0]
  - - [19200, 96, 1, 96]
    - [94, 0.0]
  - - [29916, 30, 1, 36]
    - [38, 0.0]
  - - [43966, 66, 1, 66]
    - [184, 0.0]
  - - [19536, 48, 1, 48]
    - [52, 0.0]
  - - [24832, 128, 1, 128]
    - [194, 0.0]
  - - [43520, 58, 1, 66]
    - [98, 0.0]
  - - [38544, 48, 1, 48]
    - [52, 0.0]
  - - [9696, 32, 1, 32]
    - [173, 0.0]
  - - [14336, 124, 1, 132]
    - [148, 0.0]
  - - [21402, 30, 1, 36]
    - [43, 0.0]
  - - [29498, 58, 1, 66]
    - [98, 0.0]
  - - [39328, 32, 1, 32]
    - [40, 0.0]
  - - [6880, 32, 1, 32]
    - [40, 0.0]
  - - [14300, 30, 1, 36]
    - [37, 0.0]
  - - [6876, 30, 1, 36]
    - [37, 0.0]
  - - [26784, 32, 1, 32]
    - [38, 0.0]
  - - [32064, 64, 1, 64]
    - [117, 0.0]
  - - [17116, 30, 1, 36]
    - [37, 0.0]
  - - [31232, 128, 1, 128]
    - [195, 0.0]
  - - [26426, 58, 1, 66]
    - [63, 0.0]
  - - [23088, 48, 1, 48]
    - [54, 0.0]
  - - [37056, 64, 1, 64]
    - [118, 0.0]
  - - [20960, 32, 1, 32]
    - [43, 0.0]
  - - [33024, 192, 1, 192]
    - [194, 0.0]
  - - [41568, 32, 1, 32]
    - [80, 0.0]
  - - [29920, 32, 1, 32]
    - [38, 0.0]
  - - [19968, 66, 1, 66]
    - [98, 0.0]
  - - [34238, 66, 1, 66]
    - [57, 0.0]
  - - [6912, 192, 1, 192]
    - [201, 0.0]
  - - [9216, 30, 1, 36]
    - [44, 0.0]
  - - [2368, 64, 1, 64]
    - [141, 0.0]
  - - [9626, 30, 1, 36]
    - [37, 0.0]
  - - [33792, 66, 1, 66]
    - [57, 0.0]
  - - [27552, 32, 1, 32]
    - [77, 0.0]
  - - [26592, 96, 1, 96]
    - [188, 0.0]
  - - [22032, 48, 1, 48]
    - [57, 0.0]
  - - [25440, 96, 1, 96]
    - [179, 0.0]
  - - [25968, 48, 1, 48]
    - [58, 0.0]
  - - [40032, 32, 1, 32]
    - [40, 0.0]
  - - [10752, 30, 1, 36]
    - [37, 0.0]
  - - [36640, 32, 1, 32]
    - [40, 0.0]
  - - [41920, 64, 1, 64]
    - [108, 0.0]
  - - [7738, 58, 1, 66]
    - [127, 0.0]
  - - [8096, 32, 1, 32]
    - [40, 0.0]
  - - [14080, 128, 1, 128]
    - [142, 0.0]
  - - [25280, 64, 1, 64]
    - [142, 0.0]
  - - [37024, 32, 1, 32]
    - [40, 0.0]
  - - [31872, 48, 1, 48]
    - [51, 0.0]
  - - [31488, 30, 1, 36]
    - [44, 0.0]
  - - [29408, 32, 1, 32]
    - [38, 0.0]
  - - [2816, 58, 1, 66]
    - [43, 0.0]
  - - [352, 32, 1, 32]
    - [40, 0.0]
  - - [30784, 64, 1, 64]
    - [117, 0.0]
  - - [2544, 48, 1, 48]
    - [37, 0.0]
  - - [26928, 48, 1, 48]
    - [51, 0.0]
  - - [11360, 32, 1, 32]
    - [74, 0.0]
  - - [25432, 30, 1, 36]
    - [41, 0.0]
  - - [26844, 30, 1, 36]
    - [38, 0.0]
  - - [23424, 192, 1, 192]
    - [194, 0.0]
  - - [40192, 128, 1, 128]
    - [146, 0.0]
  - - [33946, 30, 1, 36]
    - [43, 0.0]
  - - [2112, 64, 1, 64]
    - [141, 0.0]
  - - [16064, 64, 1, 64]
    - [110, 0.0]
  - - [39120, 48, 1, 48]
    - [90, 0.0]
  - - [21952, 64, 1, 64]
    - [117, 0.0]
  - - [39870, 66, 1, 66]
    - [184, 0.0]
  - - [2816, 124, 1, 132]
    - [127, 0.0]
  - - [17152, 66, 1, 66]
    - [57, 0.0]
  - - [35856, 48, 1, 48]
    - [52, 0.0]
  - - [15008, 32, 1, 32]
    - [37, 0.0]
  - - [9436, 30, 1, 36]
    - [37, 0.0]
  - - [32000, 58, 1, 66]
    - [98, 0.0]
  - - [35776, 64, 1, 64]
    - [115, 0.0]
  - - [14782, 66, 1, 66]
    - [56, 0.0]
  - - [9696, 96, 1, 96]
    - [94, 0.0]
  - - [34336, 32, 1, 32]
    - [37, 0.0]
  - - [37408, 32, 1, 32]
    - [45, 0.0]
  - - [39072, 32, 1, 32]
    - [45, 0.0]
  - - [14168, 30, 1, 36]
    - [37, 0.0]
  - - [446, 66, 1, 66]
    - [37, 0.0]
  - - [33216, 64, 1, 64]
    - [111, 0.0]
  - - [12720, 48, 1, 48]
    - [51, 0.0]
  - - [12990, 66, 1, 66]
    - [56, 0.0]
  - - [7578, 30, 1, 36]
    - [76, 0.0]
  - - [9408, 64, 1, 64]
    - [142, 0.0]
  - - [33600, 64, 1, 64]
    - [117, 0.0]
  - - [17920, 30, 1, 36]
    - [74, 0.0]
  - - [25376, 32, 1, 32]
    - [41, 0.0]
  - - [41568, 96, 1, 96]
    - [155, 0.0]
  - - [26016, 32, 1, 32]
    - [41, 0.0]
  - - [43776, 128, 1, 128]
    - [195, 0.0]
  - - [28160, 30, 1, 36]
    - [38, 0.0]
  - - [24960, 192, 1, 192]
    - [194, 0.0]
  - - [17342, 66, 1, 66]
    - [60, 0.0]
  - - [23952, 48, 1, 48]
    - [54, 0.0]
  - - [8224, 32, 1, 32]
    - [173, 0.0]
  - - [42624, 192, 1, 192]
    - [202, 0.0]
  - - [33456, 48, 1, 48]
    - [92, 0.0]
  - - [36352, 124, 1, 132]
    - [142, 0.0]
  - - [33792, 128, 1, 128]
    - [146, 0.0]
  - - [15616, 30, 1, 36]
    - [37, 0.0]
  - - [7680, 66, 1, 66]
    - [136, 0.0]
  - - [12864, 64, 1, 64]
    - [81, 0.0]
  - - [12960, 96, 1, 96]
    - [45, 0.0]
  - - [24986, 30, 1, 36]
    - [38, 0.0]
  - - [5178, 58, 1, 66]
    - [124, 0.0]
  - - [3738, 30, 1, 36]
    - [74, 0.0]
  - - [34560, 124, 1, 132]
    - [146, 0.0]
  - - [10608, 48, 1, 48]
    - [53, 0.0]
  - - [32314, 58, 1, 66]
    - [99, 0.0]
  - - [35008, 64, 1, 64]
    - [117, 0.0]
  - - [3840, 58, 1, 66]
    - [127, 0.0]
  - - [1824, 96, 1, 96]
    - [139, 0.0]
  - - [32410, 30, 1, 36]
    - [75, 0.0]
  - - [2904, 30, 1, 36]
    - [43, 0.0]
  - - [10432, 64, 1, 64]
    - [195, 0.0]
  - - [25790, 66, 1, 66]
    - [184, 0.0]
  - - [38432, 32, 1, 32]
    - [45, 0.0]
  - - [23904, 32, 1, 32]
    - [37, 0.0]
  - - [36864, 124, 1, 132]
    - [146, 0.0]
  - - [31744, 66, 1, 66]
    - [98, 0.0]
  - - [25664, 64, 1, 64]
    - [146, 0.0]
  - - [23376, 48, 1, 48]
    - [60, 0.0]
  - - [33756, 30, 1, 36]
    - [76, 0.0]
  - - [43680, 96, 1, 96]
    - [163, 0.0]
  - - [26448, 48, 1, 48]
    - [58, 0.0]
  - - [10016, 32, 1, 32]
    - [74, 0.0]
  - - [27070, 66, 1, 66]
    - [179, 0.0]
  - - [34032, 48, 1, 48]
    - [52, 0.0]
  - - [480, 32, 1, 32]
    - [37, 0.0]
  - - [17408, 30, 1, 36]
    - [37, 0.0]
  - - [7644, 30, 1, 36]
    - [37, 0.0]
  - - [44032, 124, 1, 132]
    - [142, 0.0]
  - - [21248, 30, 1, 36]
    - [74, 0.0]
  - - [34816, 66, 1, 66]
    - [57, 0.0]
  - - [42560, 64, 1, 64]
    - [172, 0.0]
  - - [17712, 48, 1, 48]
    - [52, 0.0]
  - - [41472, 30, 1, 36]
    - [78, 0.0]
  - - [4608, 128, 1, 128]
    - [83, 0.0]
  - - [41728, 66, 1, 66]
    - [98, 0.0]
  - - [18688, 30, 1, 36]
    - [37, 0.0]
  - - [30976, 58, 1, 66]
    - [98, 0.0]
  - - [1536, 192, 1, 192]
    - [122, 0.0]
  - - [33312, 32, 1, 32]
    - [37, 0.0]
  - - [37632, 96, 1, 96]
    - [187, 0.0]
  - - [4864, 30, 1, 36]
    - [37, 0.0]
  - - [17818, 30, 1, 36]
    - [74, 0.0]
  - - [35104, 32, 1, 32]
    - [80, 0.0]
  - - [28096, 64, 1, 64]
    - [117, 0.0]
  - - [21312, 64, 1, 64]
    - [117, 0.0]
  - - [41472, 192, 1, 192]
    - [202, 0.0]
  - - [19520, 64, 1, 64]
    - [145, 0.0]
  - - [1152, 48, 1, 48]
    - [37, 0.0]
  - - [26880, 128, 1, 128]
    - [195, 0.0]
  - - [37376, 58, 1, 66]
    - [117, 0.0]
  - - [44224, 64, 1, 64]
    - [172, 0.0]
  - - [28656, 48, 1, 48]
    - [58, 0.0]
  - - [28480, 64, 1, 64]
    - [114, 0.0]
  - - [43392, 96, 1, 96]
    - [210, 0.0]
  - - [42240, 30, 1, 36]
    - [37, 0.0]
  - - [37310, 66, 1, 66]
    - [182, 0.0]
  - - [4410, 58, 1, 66]
    - [122, 0.0]
  - - [1696, 32, 1, 32]
    - [37, 0.0]
  - - [13408, 32, 1, 32]
    - [74, 0.0]
  - - [21306, 58, 1, 66]
    - [45, 0.0]
  - - [10144, 32, 1, 32]
    - [122, 0.0]
  - - [15200, 32, 1, 32]
    - [37, 0.0]
  - - [35712, 48, 1, 48]
    - [52, 0.0]
  - - [3552, 32, 1, 32]
    - [37, 0.0]
  - - [41152, 64, 1, 64]
    - [172, 0.0]
  - - [25728, 48, 1, 48]
    - [133, 0.0]
  - - [38352, 48, 1, 48]
    - [52, 0.0]
  - - [2880, 64, 1, 64]
    - [119, 0.0]
  - - [2524, 30, 1, 36]
    - [43, 0.0]
  - - [32988, 30, 1, 36]
    - [74, 0.0]
  - - [24256, 64, 1, 64]
    - [117, 0.0]
  - - [19616, 32, 1, 32]
    - [74, 0.0]
  - - [32768, 124, 1, 132]
    - [142, 0.0]
  - - [30144, 64, 1, 64]
    - [114, 0.0]
  - - [15294, 66, 1, 66]
    - [56, 0.0]
  - - [35328, 48, 1, 48]
    - [52, 0.0]
  - - [21568, 64, 1, 64]
    - [114, 0.0]
  - - [9936, 48, 1, 48]
    - [45, 0.0]
  - - [41088, 192, 1, 192]
    - [199, 0.0]
  - - [41150, 66, 1, 66]
    - [98, 0.0]
  - - [35472, 48, 1, 48]
    - [90, 0.0]
  - - [23200, 32, 1, 32]
    - [37, 0.0]
  - - [17628, 30, 1, 36]
    - [37, 0.0]
  - - [31232, 30, 1, 36]
    - [44, 0.0]
  - - [22974, 66, 1, 66]
    - [57, 0.0]
  - - [35262, 66, 1, 66]
    - [57, 0.0]
  - - [12896, 32, 1, 32]
    - [37, 0.0]
  - - [16128, 128, 1, 128]
    - [145, 0.0]
  - - [42528, 32, 1, 32]
    - [76, 0.0]
  - - [27328, 64, 1, 64]
    - [113, 0.0]
  - - [21212, 30, 1, 36]
    - [74, 0.0]
  - - [2238, 66, 1, 66]
    - [43, 0.0]
  - - [21600, 96, 1, 96]
    - [94, 0.0]
  - - [41376, 96, 1, 96]
    - [158, 0.0]
  - - [24640, 64, 1, 64]
    - [146, 0.0]
  - - [10416, 48, 1, 48]
    - [53, 0.0]
  - - [16128, 66, 1, 66]
    - [56, 0.0]
  - - [3226, 30, 1, 36]
    - [76, 0.0]
  - - [5696, 64, 1, 64]
    - [145, 0.0]
  - - [9024, 64, 1, 64]
    - [192, 0.0]
  - - [16282, 30, 1, 36]
    - [37, 0.0]
  - - [33936, 48, 1, 48]
    - [52, 0.0]
  - - [34752, 64, 1, 64]
    - [112, 0.0]
  - - [34208, 32, 1, 32]
    - [43, 0.0]
  - - [29272, 30, 1, 36]
    - [75, 0.0]
  - - [32768, 30, 1, 36]
    - [75, 0.0]
  - - [21664, 32, 1, 32]
    - [37, 0.0]
  - - [24000, 64, 1, 64]
    - [171, 0.0]
  - - [27392, 124, 1, 132]
    - [170, 0.0]
  - - [144, 48, 1, 48]
    - [45, 0.0]
  - - [33072, 48, 1, 48]
    - [57, 0.0]
  - - [27264, 96, 1, 96]
    - [179, 0.0]
  - - [9216, 128, 1, 128]
    - [71, 0.0]
  - - [5376, 66, 1, 66]
    - [124, 0.0]
  - - [12032, 66, 1, 66]
    - [92, 0.0]
  - - [23328, 96, 1, 96]
    - [96, 0.0]
  - - [21056, 64, 1, 64]
    - [168, 0.0]
  - - [13088, 32, 1, 32]
    - [74, 0.0]
  - - [43608, 30, 1, 36]
    - [40, 0.0]
  - - [32826, 58, 1, 66]
    - [169, 0.0]
  - - [24736, 32, 1, 32]
    - [44, 0.0]
  - - [30016, 64, 1, 64]
    - [114, 0.0]
  - - [33178, 30, 1, 36]
    - [76, 0.0]
  - - [38592, 64, 1, 64]
    - [118, 0.0]
  - - [27072, 64, 1, 64]
    - [98, 0.0]
  - - [27136, 128, 1, 128]
    - [146, 0.0]
  - - [23664, 48, 1, 48]
    - [94, 0.0]
  - - [40506, 58, 1, 66]
    - [172, 0.0]
  - - [6656, 58, 1, 66]
    - [124, 0.0]
  - - [11552, 32, 1, 32]
    - [37, 0.0]
  - - [33024, 30, 1, 36]
    - [37, 0.0]
  - - [4352, 58, 1, 66]
    - [124, 0.0]
  - - [4696, 30, 1, 36]
    - [76, 0.0]
  - - [14936, 30, 1, 36]
    - [37, 0.0]
  - - [12224, 64, 1, 64]
    - [145, 0.0]
  - - [33982, 66, 1, 66]
    - [60, 0.0]
  - - [33112, 30, 1, 36]
    - [76, 0.0]
  - - [40704, 30, 1, 36]
    - [76, 0.0]
  - - [41248, 32, 1, 32]
    - [45, 0.0]
  - - [7904, 32, 1, 32]
    - [37, 0.0]
  - - [17280, 96, 1, 96]
    - [94, 0.0]
  - - [2640, 48, 1, 48]
    - [37, 0.0]
  - - [27136, 58, 1, 66]
    - [63, 0.0]
  - - [15038, 66, 1, 66]
    - [56, 0.0]
  - - [10496, 124, 1, 132]
    - [61, 0.0]
  - - [18208, 32, 1, 32]
    - [76, 0.0]
  - - [23488, 64, 1, 64]
    - [114, 0.0]
  - - [29136, 48, 1, 48]
    - [51, 0.0]
  - - [14592, 48, 1, 48]
    - [52, 0.0]
  - - [14556, 30, 1, 36]
    - [37, 0.0]
  - - [39616, 64, 1, 64]
    - [115, 0.0]
  - - [18842, 30, 1, 36]
    - [37, 0.0]
  - - [29440, 30, 1, 36]
    - [38, 0.0]
  - - [37488, 48, 1, 48]
    - [54, 0.0]
  - - [42942, 66, 1, 66]
    - [100, 0.0]
  - - [37822, 66, 1, 66]
    - [182, 0.0]
  - - [18480, 48, 1, 48]
    - [52, 0.0]
  - - [9248, 32, 1, 32]
    - [119, 0.0]
  - - [21848, 30, 1, 36]
    - [74, 0.0]
  - - [29184, 192, 1, 192]
    - [200, 0.0]
  - - [4928, 64, 1, 64]
    - [141, 0.0]
  - - [25184, 32, 1, 32]
    - [75, 0.0]
  - - [2304, 192, 1, 192]
    - [124, 0.0]
  - - [34816, 58, 1, 66]
    - [114, 0.0]
  - - [8704, 30, 1, 36]
    - [76, 0.0]
  - - [38912, 124, 1, 132]
    - [146, 0.0]
  - - [39840, 96, 1, 96]
    - [164, 0.0]
  - - [42906, 30, 1, 36]
    - [45, 0.0]
  - - [5136, 48, 1, 48]
    - [119, 0.0]
  - - [34416, 48, 1, 48]
    - [54, 0.0]
  - - [11136, 48, 1, 48]
    - [51, 0.0]
  - - [3840, 30, 1, 36]
    - [37, 0.0]
  - - [31232, 66, 1, 66]
    - [98, 0.0]
  - - [25536, 64, 1, 64]
    - [195, 0.0]
  - - [42240, 48, 1, 48]
    - [52, 0.0]
  - - [7226, 58, 1, 66]
    - [127, 0.0]
  - - [13728, 32, 1, 32]
    - [37, 0.0]
  - - [30576, 48, 1, 48]
    - [51, 0.0]
  - - [43008, 192, 1, 192]
    - [202, 0.0]
  - - [20122, 30, 1, 36]
    - [74, 0.0]
  - - [3072, 58, 1, 66]
    - [119, 0.0]
  - - [14400, 64, 1, 64]
    - [192, 0.0]
  - - [10224, 48, 1, 48]
    - [45, 0.0]
  - - [6336, 64, 1, 64]
    - [145, 0.0]
  - - [40800, 96, 1, 96]
    - [160, 0.0]
  - - [11904, 48, 1, 48]
    - [57, 0.0]
  - - [18944, 124, 1, 132]
    - [141, 0.0]
  - - [22426, 30, 1, 36]
    - [37, 0.0]
  - - [33082, 58, 1, 66]
    - [115, 0.0]
  - - [40960, 58, 1, 66]
    - [118, 0.0]
  - - [35424, 96, 1, 96]
    - [94, 0.0]
  - - [13776, 48, 1, 48]
    - [51, 0.0]
  - - [11840, 64, 1, 64]
    - [145, 0.0]
  - - [31488, 96, 1, 96]
    - [162, 0.0]
  - - [27808, 32, 1, 32]
    - [46, 0.0]
  - - [29016, 30, 1, 36]
    - [38, 0.0]
  - - [24672, 32, 1, 32]
    - [38, 0.0]
  - - [7680, 128, 1, 128]
    - [62, 0.0]
  - - [37792, 32, 1, 32]
    - [45, 0.0]
  - - [10704, 48, 1, 48]
    - [53, 0.0]
  - - [25308, 30, 1, 36]
    - [44, 0.0]
  - - [39482, 58, 1, 66]
    - [117, 0.0]
  - - [32352, 32, 1, 32]
    - [46, 0.0]
  - - [32016, 48, 1, 48]
    - [91, 0.0]
  - - [32600, 30, 1, 36]
    - [44, 0.0]
  - - [41888, 32, 1, 32]
    - [40, 0.0]
  - - [31546, 58, 1, 66]
    - [99, 0.0]
  - - [5760, 48, 1, 48]
    - [119, 0.0]
  - - [31196, 30, 1, 36]
    - [44, 0.0]
  - - [22688, 32, 1, 32]
    - [40, 0.0]
  - - [22656, 96, 1, 96]
    - [96, 0.0]
  - - [29404, 30, 1, 36]
    - [44, 0.0]
  - - [11352, 30, 1, 36]
    - [45, 0.0]
  - - [8126, 66, 1, 66]
    - [184, 0.0]
  - - [15072, 32, 1, 32]
    - [74, 0.0]
  - - [18384, 48, 1, 48]
    - [94, 0.0]
  - - [8112, 48, 1, 48]
    - [122, 0.0]
  - - [1982, 66, 1, 66]
    - [40, 0.0]
  - - [13210, 30, 1, 36]
    - [40, 0.0]
  - - [2496, 64, 1, 64]
    - [141, 0.0]
  - - [17216, 64, 1, 64]
    - [141, 0.0]
  - - [24474, 30, 1, 36]
    - [37, 0.0]
  - - [33500, 30, 1, 36]
    - [37, 0.0]
  - - [10176, 64, 1, 64]
    - [192, 0.0]
  - - [37464, 30, 1, 36]
    - [40, 0.0]
  - - [8960, 128, 1, 128]
    - [69, 0.0]
  - - [4640, 32, 1, 32]
    - [74, 0.0]
  - - [23904, 96, 1, 96]
    - [96, 0.0]
  - - [38016, 96, 1, 96]
    - [158, 0.0]
  - - [34912, 32, 1, 32]
    - [37, 0.0]
  - - [37664, 32, 1, 32]
    - [78, 0.0]
  - - [41918, 66, 1, 66]
    - [98, 0.0]
  - - [29118, 66, 1, 66]
    - [98, 0.0]
  - - [7056, 48, 1, 48]
    - [175, 0.0]
  - - [41786, 58, 1, 66]
    - [115, 0.0]
  - - [26544, 48, 1, 48]
    - [133, 0.0]
  - - [33440, 32, 1, 32]
    - [40, 0.0]
  - - [8608, 32, 1, 32]
    - [119, 0.0]
  - - [34106, 58, 1, 66]
    - [114, 0.0]
  - - [37888, 128, 1, 128]
    - [195, 0.0]
  - - [5120, 66, 1, 66]
    - [124, 0.0]
  - - [24832, 124, 1, 132]
    - [146, 0.0]
  - - [8736, 32, 1, 32]
    - [119, 0.0]
  - - [39936, 30, 1, 36]
    - [45, 0.0]
  - - [41018, 58, 1, 66]
    - [167, 0.0]
  - - [21120, 48, 1, 48]
    - [52, 0.0]
  - - [41088, 96, 1, 96]
    - [158, 0.0]
  - - [11578, 58, 1, 66]
    - [80, 0.0]
  - - [21792, 32, 1, 32]
    - [45, 0.0]
  - - [37434, 58, 1, 66]
    - [114, 0.0]
  - - [11162, 30, 1, 36]
    - [45, 0.0]
  - - [43296, 96, 1, 96]
    - [163, 0.0]
  - - [12144, 48, 1, 48]
    - [51, 0.0]
  - - [15930, 58, 1, 66]
    - [64, 0.0]
  - - [18624, 64, 1, 64]
    - [145, 0.0]
  - - [7424, 58, 1, 66]
    - [124, 0.0]
  - - [672, 32, 1, 32]
    - [37, 0.0]
  - - [18048, 96, 1, 96]
    - [94, 0.0]
  - - [22048, 32, 1, 32]
    - [37, 0.0]
  - - [6488, 30, 1, 36]
    - [37, 0.0]
  - - [29440, 128, 1, 128]
    - [195, 0.0]
  - - [16538, 30, 1, 36]
    - [43, 0.0]
  - - [28640, 32, 1, 32]
    - [44, 0.0]
  - - [23712, 32, 1, 32]
    - [37, 0.0]
  - - [8512, 64, 1, 64]
    - [146, 0.0]
  - - [36960, 32, 1, 32]
    - [40, 0.0]
  - - [3584, 128, 1, 128]
    - [127, 0.0]
  - - [17856, 64, 1, 64]
    - [194, 0.0]
  - - [18528, 96, 1, 96]
    - [60, 0.0]
  - - [12624, 48, 1, 48]
    - [52, 0.0]
  - - [29440, 66, 1, 66]
    - [98, 0.0]
  - - [1216, 64, 1, 64]
    - [119, 0.0]
  - - [31824, 48, 1, 48]
    - [51, 0.0]
  - - [38752, 32, 1, 32]
    - [37, 0.0]
  - - [36154, 58, 1, 66]
    - [118, 0.0]
  - - [3296, 32, 1, 32]
    - [37, 0.0]
  - - [10208, 32, 1, 32]
    - [122, 0.0]
  - - [1024, 30, 1, 36]
    - [37, 0.0]
  - - [7132, 30, 1, 36]
    - [37, 0.0]
  - - [15040, 64, 1, 64]
    - [142, 0.0]
  - - [11808, 96, 1, 96]
    - [96, 0.0]
  - - [18432, 66, 1, 66]
    - [60, 0.0]
  - - [29120, 64, 1, 64]
    - [117, 0.0]
  - - [31488, 48, 1, 48]
    - [133, 0.0]
  - - [23866, 58, 1, 66]
    - [117, 0.0]
  - - [816, 48, 1, 48]
    - [37, 0.0]
  - - [8412, 30, 1, 36]
    - [37, 0.0]
  - - [6080, 64, 1, 64]
    - [124, 0.0]
  - - [42080, 32, 1, 32]
    - [40, 0.0]
  - - [9216, 192, 1, 192]
    - [145, 0.0]
  - - [16928, 32, 1, 32]
    - [37, 0.0]
  - - [2304, 30, 1, 36]
    - [37, 0.0]
  - - [29630, 66, 1, 66]
    - [98, 0.0]
  - - [32476, 30, 1, 36]
    - [38, 0.0]
  - - [18234, 58, 1, 66]
    - [45, 0.0]
  - - [33744, 48, 1, 48]
    - [54, 0.0]
  - - [24336, 48, 1, 48]
    - [90, 0.0]
  - - [36896, 32, 1, 32]
    - [40, 0.0]
  - - [2304, 96, 1, 96]
    - [122, 0.0]
  - - [8894, 66, 1, 66]
    - [98, 0.0]
  - - [24816, 48, 1, 48]
    - [136, 0.0]
  - - [40156, 30, 1, 36]
    - [40, 0.0]
  - - [25856, 30, 1, 36]
    - [75, 0.0]
  - - [28448, 32, 1, 32]
    - [38, 0.0]
  - - [32096, 32, 1, 32]
    - [44, 0.0]
  - - [7994, 58, 1, 66]
    - [124, 0.0]
  - - [9376, 32, 1, 32]
    - [37, 0.0]
  - - [32288, 32, 1, 32]
    - [41, 0.0]
  - - [40448, 58, 1, 66]
    - [118, 0.0]
  - - [4224, 96, 1, 96]
    - [178, 0.0]
  - - [10992, 48, 1, 48]
    - [76, 0.0]
  - - [32446, 66, 1, 66]
    - [99, 0.0]
  - - [6912, 48, 1, 48]
    - [173, 0.0]
  - - [43776, 58, 1, 66]
    - [118, 0.0]
  - - [30618, 30, 1, 36]
    - [75, 0.0]
  - - [18432, 96, 1, 96]
    - [96, 0.0]
  - - [23136, 96, 1, 96]
    - [94, 0.0]
  - - [320, 64, 1, 64]
    - [37, 0.0]
  - - [10972, 30, 1, 36]
    - [78, 0.0]
  - - [27648, 58, 1, 66]
    - [44, 0.0]
  - - [7872, 64, 1, 64]
    - [124, 0.0]
  - - [19936, 32, 1, 32]
    - [76, 0.0]
  - - [21146, 30, 1, 36]
    - [37, 0.0]
  - - [16384, 124, 1, 132]
    - [63, 0.0]
  - - [36960, 96, 1, 96]
    - [155, 0.0]
  - - [44032, 66, 1, 66]
    - [182, 0.0]
  - - [28124, 30, 1, 36]
    - [38, 0.0]
  - - [40464, 48, 1, 48]
    - [133, 0.0]
  - - [13216, 32, 1, 32]
    - [119, 0.0]
  - - [4992, 96, 1, 96]
    - [124, 0.0]
  - - [1024, 124, 1, 132]
    - [119, 0.0]
  - - [42288, 48, 1, 48]
    - [52, 0.0]
  - - [25488, 48, 1, 48]
    - [133, 0.0]
  - - [16896, 66, 1, 66]
    - [60, 0.0]
  - - [2144, 32, 1, 32]
    - [37, 0.0]
  - - [22272, 96, 1, 96]
    - [94, 0.0]
  - - [7168, 124, 1, 132]
    - [65, 0.0]
  - - [18944, 128, 1, 128]
    - [193, 0.0]
  - - [3774, 66, 1, 66]
    - [124, 0.0]
  - - [24864, 96, 1, 96]
    - [178, 0.0]
  - - [8256, 64, 1, 64]
    - [78, 0.0]
  - - [11952, 48, 1, 48]
    - [52, 0.0]
  - - [3328, 128, 1, 128]
    - [127, 0.0]
  - - [30266, 58, 1, 66]
    - [98, 0.0]
  - - [36316, 30, 1, 36]
    - [40, 0.0]
  - - [6810, 30, 1, 36]
    - [40, 0.0]
  - - [14144, 64, 1, 64]
    - [142, 0.0]
  - - [22176, 32, 1, 32]
    - [40, 0.0]
  - - [29184, 124, 1, 132]
    - [142, 0.0]
  - - [42144, 96, 1, 96]
    - [154, 0.0]
  - - [43008, 128, 1, 128]
    - [146, 0.0]
  - - [26938, 58, 1, 66]
    - [63, 0.0]
  - - [18368, 64, 1, 64]
    - [141, 0.0]
  - - [6528, 192, 1, 192]
    - [145, 0.0]
  - - [38160, 48, 1, 48]
    - [90, 0.0]
  - - [39792, 48, 1, 48]
    - [57, 0.0]
  - - [12288, 48, 1, 48]
    - [52, 0.0]
  - - [27648, 192, 1, 192]
    - [202, 0.0]
  - - [1536, 128, 1, 128]
    - [141, 0.0]
  - - [14624, 32, 1, 32]
    - [37, 0.0]
  - - [1680, 48, 1, 48]
    - [37, 0.0]
  - - [16032, 96, 1, 96]
    - [95, 0.0]
  - - [23004, 30, 1, 36]
    - [37, 0.0]
  - - [35376, 48, 1, 48]
    - [52, 0.0]
  - - [38144, 30, 1, 36]
    - [80, 0.0]
  - - [35328, 66, 1, 66]
    - [60, 0.0]
  - - [1376, 32, 1, 32]
    - [37, 0.0]
  - - [2816, 66, 1, 66]
    - [43, 0.0]
  - - [3072, 66, 1, 66]
    - [43, 0.0]
  - - [38400, 66, 1, 66]
    - [182, 0.0]
  - - [10528, 32, 1, 32]
    - [37, 0.0]
  - - [15360, 30, 1, 36]
    - [74, 0.0]
  - - [41216, 66, 1, 66]
    - [98, 0.0]
  - - [29376, 64, 1, 64]
    - [117, 0.0]
  - - [23760, 48, 1, 48]
    - [60, 0.0]
  - - [31452, 30, 1, 36]
    - [44, 0.0]
  - - [35584, 30, 1, 36]
    - [37, 0.0]
  - - [10688, 64, 1, 64]
    - [142, 0.0]
  - - [42192, 48, 1, 48]
    - [52, 0.0]
  - - [12912, 48, 1, 48]
    - [89, 0.0]
  - - [29952, 128, 1, 128]
    - [194, 0.0]
  - - [6144, 58, 1, 66]
    - [124, 0.0]
  - - [2592, 32, 1, 32]
    - [37, 0.0]
  - - [32416, 32, 1, 32]
    - [44, 0.0]
  - - [20480, 128, 1, 128]
    - [193, 0.0]
  - - [35292, 30, 1, 36]
    - [45, 0.0]
  - - [2136, 30, 1, 36]
    - [76, 0.0]
  - - [7680, 96, 1, 96]
    - [49, 0.0]
  - - [29886, 66, 1, 66]
    - [98, 0.0]
  - - [31904, 32, 1, 32]
    - [41, 0.0]
  - - [16728, 30, 1, 36]
    - [43, 0.0]
  - - [5856, 96, 1, 96]
    - [46, 0.0]
  - - [26368, 30, 1, 36]
    - [44, 0.0]
  - - [43488, 96, 1, 96]
    - [206, 0.0]
  - - [19610, 30, 1, 36]
    - [37, 0.0]
  - - [37632, 66, 1, 66]
    - [184, 0.0]
  - - [480, 96, 1, 96]
    - [138, 0.0]
  - - [13008, 48, 1, 48]
    - [52, 0.0]
  - - [40250, 58, 1, 66]
    - [115, 0.0]
  - - [38496, 32, 1, 32]
    - [45, 0.0]
  - - [42624, 48, 1, 48]
    - [54, 0.0]
  - - [31040, 64, 1, 64]
    - [117, 0.0]
  - - [11488, 32, 1, 32]
    - [37, 0.0]
  - - [17664, 30, 1, 36]
    - [37, 0.0]
  - - [5720, 30, 1, 36]
    - [45, 0.0]
  - - [9984, 48, 1, 48]
    - [74, 0.0]
  - - [24192, 192, 1, 192]
    - [200, 0.0]
  - - [5852, 30, 1, 36]
    - [74, 0.0]
  - - [23232, 64, 1, 64]
    - [171, 0.0]
  - - [35840, 124, 1, 132]
    - [146, 0.0]
  - - [13056, 30, 1, 36]
    - [37, 0.0]
  - - [12192, 96, 1, 96]
    - [96, 0.0]
  - - [19168, 32, 1, 32]
    - [37, 0.0]
  - - [34656, 32, 1, 32]
    - [40, 0.0]
  - - [13872, 48, 1, 48]
    - [51, 0.0]
  - - [31488, 192, 1, 192]
    - [200, 0.0]
  - - [18080, 32, 1, 32]
    - [45, 0.0]
  - - [38064, 48, 1, 48]
    - [90, 0.0]
  - - [43728, 48, 1, 48]
    - [54, 0.0]
  - - [2304, 48, 1, 48]
    - [40, 0.0]
  - - [39072, 96, 1, 96]
    - [163, 0.0]
  - - [30272, 64, 1, 64]
    - [117, 0.0]
  - - [22272, 192, 1, 192]
    - [202, 0.0]
  - - [9274, 58, 1, 66]
    - [80, 0.0]
  - - [4096, 30, 1, 36]
    - [43, 0.0]
  - - [43352, 30, 1, 36]
    - [45, 0.0]
  - - [30336, 48, 1, 48]
    - [133, 0.0]
  - - [22616, 30, 1, 36]
    - [40, 0.0]
  - - [528, 48, 1, 48]
    - [37, 0.0]
  - - [5088, 96, 1, 96]
    - [119, 0.0]
  - - [12320, 32, 1, 32]
    - [37, 0.0]
  - - [18288, 48, 1, 48]
    - [52, 0.0]
  - - [38720, 64, 1, 64]
    - [118, 0.0]
  - - [15580, 30, 1, 36]
    - [37, 0.0]
  - - [13312, 30, 1, 36]
    - [37, 0.0]
  - - [21818, 58, 1, 66]
    - [183, 0.0]
  - - [10810, 58, 1, 66]
    - [131, 0.0]
  - - [11168, 32, 1, 32]
    - [119, 0.0]
  - - [27648, 30, 1, 36]
    - [75, 0.0]
  - - [28416, 96, 1, 96]
    - [154, 0.0]
  - - [17376, 32, 1, 32]
    - [45, 0.0]
  - - [9504, 32, 1, 32]
    - [37, 0.0]
  - - [43776, 96, 1, 96]
    - [158, 0.0]
  - - [5376, 58, 1, 66]
    - [124, 0.0]
  - - [34720, 32, 1, 32]
    - [45, 0.0]
  - - [5208, 30, 1, 36]
    - [37, 0.0]
  - - [17904, 48, 1, 48]
    - [92, 0.0]
  - - [11872, 32, 1, 32]
    - [37, 0.0]
  - - [5760, 96, 1, 96]
    - [162, 0.0]
  - - [29664, 32, 1, 32]
    - [77, 0.0]
  - - [32768, 128, 1, 128]
    - [146, 0.0]
  - - [16698, 58, 1, 66]
    - [43, 0.0]
  - - [2202, 30, 1, 36]
    - [37, 0.0]
  - - [32160, 32, 1, 32]
    - [79, 0.0]
  - - [9280, 64, 1, 64]
    - [142, 0.0]
  - - [18432, 48, 1, 48]
    - [90, 0.0]
  - - [40924, 30, 1, 36]
    - [76, 0.0]
  - - [36000, 96, 1, 96]
    - [160, 0.0]
  - - [25344, 124, 1, 132]
    - [142, 0.0]
  - - [9984, 124, 1, 132]
    - [145, 0.0]
  - - [34320, 48, 1, 48]
    - [52, 0.0]
  - - [24192, 96, 1, 96]
    - [94, 0.0]
  - - [43152, 48, 1, 48]
    - [57, 0.0]
  - - [30496, 32, 1, 32]
    - [38, 0.0]
  - - [16128, 58, 1, 66]
    - [62, 0.0]
  - - [13440, 48, 1, 48]
    - [51, 0.0]
  - - [13020, 30, 1, 36]
    - [37, 0.0]
  - - [344, 30, 1, 36]
    - [67, 0.0]
  - - [7614, 66, 1, 66]
    - [56, 0.0]
  - - [22462, 66, 1, 66]
    - [57, 0.0]
  - - [38590, 66, 1, 66]
    - [182, 0.0]
  - - [31832, 30, 1, 36]
    - [75, 0.0]
  - - [3504, 48, 1, 48]
    - [37, 0.0]
  - - [12800, 30, 1, 36]
    - [74, 0.0]
  - - [30208, 58, 1, 66]
    - [98, 0.0]
  - - [10650, 30, 1, 36]
    - [74, 0.0]
  - - [28352, 64, 1, 64]
    - [111, 0.0]
  - - [33840, 48, 1, 48]
    - [52, 0.0]
  - - [26112, 58, 1, 66]
    - [62, 0.0]
  - - [33594, 58, 1, 66]
    - [88, 0.0]
  - - [18528, 32, 1, 32]
    - [40, 0.0]
  - - [22272, 58, 1, 66]
    - [45, 0.0]
  - - [29344, 32, 1, 32]
    - [46, 0.0]
  - - [21456, 48, 1, 48]
    - [60, 0.0]
  - - [2448, 48, 1, 48]
    - [40, 0.0]
  - - [30976, 128, 1, 128]
    - [146, 0.0]
  - - [25776, 48, 1, 48]
    - [133, 0.0]
  - - [44288, 58, 1, 66]
    - [98, 0.0]
  - - [27868, 30, 1, 36]
    - [41, 0.0]
  - - [16160, 32, 1, 32]
    - [74, 0.0]
  - - [10752, 66, 1, 66]
    - [98, 0.0]
  - - [8448, 124, 1, 132]
    - [70, 0.0]
  - - [4128, 32, 1, 32]
    - [37, 0.0]
  - - [23552, 30, 1, 36]
    - [37, 0.0]
  - - [42864, 48, 1, 48]
    - [54, 0.0]
  - - [31456, 32, 1, 32]
    - [38, 0.0]
  - - [30040, 30, 1, 36]
    - [38, 0.0]
  - - [11834, 58, 1, 66]
    - [83, 0.0]
  - - [5408, 32, 1, 32]
    - [37, 0.0]
  - - [18880, 64, 1, 64]
    - [141, 0.0]
  - - [40032, 96, 1, 96]
    - [164, 0.0]
  - - [6298, 30, 1, 36]
    - [45, 0.0]
  - - [17496, 30, 1, 36]
    - [78, 0.0]
  - - [1392, 48, 1, 48]
    - [37, 0.0]
  - - [6912, 58, 1, 66]
    - [141, 0.0]
  - - [4000, 32, 1, 32]
    - [78, 0.0]
  - - [16860, 30, 1, 36]
    - [37, 0.0]
  - - [31232, 124, 1, 132]
    - [142, 0.0]
  - - [31328, 32, 1, 32]
    - [44, 0.0]
  - - [28672, 128, 1, 128]
    - [146, 0.0]
  - - [26112, 66, 1, 66]
    - [184, 0.0]
  - - [25344, 128, 1, 128]
    - [146, 0.0]
  - - [10072, 30, 1, 36]
    - [82, 0.0]
  - - [34272, 96, 1, 96]
    - [94, 0.0]
  - - [34816, 30, 1, 36]
    - [40, 0.0]
  - - [40192, 66, 1, 66]
    - [98, 0.0]
  - - [12256, 32, 1, 32]
    - [74, 0.0]
  - - [24920, 30, 1, 36]
    - [44, 0.0]
  - - [33696, 32, 1, 32]
    - [76, 0.0]
  - - [44186, 30, 1, 36]
    - [45, 0.0]
  - - [14160, 48, 1, 48]
    - [93, 0.0]
  - - [13056, 66, 1, 66]
    - [59, 0.0]
  - - [31056, 48, 1, 48]
    - [56, 0.0]
  - - [13824, 124, 1, 132]
    - [144, 0.0]
  - - [29594, 30, 1, 36]
    - [38, 0.0]
  - - [35840, 128, 1, 128]
    - [146, 0.0]
  - - [19770, 58, 1, 66]
    - [45, 0.0]
  - - [20670, 66, 1, 66]
    - [101, 0.0]
  - - [13152, 96, 1, 96]
    - [43, 0.0]
  - - [10716, 30, 1, 36]
    - [74, 0.0]
  - - [42650, 30, 1, 36]
    - [80, 0.0]
  - - [8160, 96, 1, 96]
    - [136, 0.0]
  - - [17616, 48, 1, 48]
    - [52, 0.0]
  - - [44128, 32, 1, 32]
    - [40, 0.0]
  - - [20784, 48, 1, 48]
    - [96, 0.0]
  - - [23808, 128, 1, 128]
    - [146, 0.0]
  - - [12480, 64, 1, 64]
    - [116, 0.0]
  - - [7168, 128, 1, 128]
    - [73, 0.0]
  - - [30720, 128, 1, 128]
    - [146, 0.0]
  - - [25856, 124, 1, 132]
    - [142, 0.0]
  - - [4608, 192, 1, 192]
    - [106, 0.0]
  - - [2208, 96, 1, 96]
    - [122, 0.0]
  - - [12032, 30, 1, 36]
    - [37, 0.0]
  - - [18776, 30, 1, 36]
    - [74, 0.0]
  - - [24288, 96, 1, 96]
    - [96, 0.0]
  - - [2976, 32, 1, 32]
    - [37, 0.0]
  - - [7440, 48, 1, 48]
    - [119, 0.0]
  - - [27120, 48, 1, 48]
    - [51, 0.0]
  - - [28704, 96, 1, 96]
    - [96, 0.0]
  - - [23772, 30, 1, 36]
    - [37, 0.0]
  - - [19872, 32, 1, 32]
    - [37, 0.0]
  - - [3386, 58, 1, 66]
    - [127, 0.0]
  - - [40536, 30, 1, 36]
    - [76, 0.0]
  - - [4128, 96, 1, 96]
    - [122, 0.0]
  - - [22272, 128, 1, 128]
    - [142, 0.0]
  - - [15904, 32, 1, 32]
    - [37, 0.0]
  - - [3840, 96, 1, 96]
    - [173, 0.0]
  - - [14688, 96, 1, 96]
    - [162, 0.0]
  - - [5120, 124, 1, 132]
    - [95, 0.0]
  - - [17696, 32, 1, 32]
    - [40, 0.0]
  - - [37600, 32, 1, 32]
    - [45, 0.0]
  - - [42912, 32, 1, 32]
    - [40, 0.0]
  - - [240, 48, 1, 48]
    - [67, 0.0]
  - - [6144, 48, 1, 48]
    - [124, 0.0]
  - - [10752, 124, 1, 132]
    - [88, 0.0]
  - - [14234, 30, 1, 36]
    - [37, 0.0]
  - - [24890, 58, 1, 66]
    - [46, 0.0]
  - - [37824, 64, 1, 64]
    - [112, 0.0]
  - - [10048, 64, 1, 64]
    - [142, 0.0]
  - - [13276, 30, 1, 36]
    - [37, 0.0]
  - - [43776, 30, 1, 36]
    - [40, 0.0]
  - - [14544, 48, 1, 48]
    - [51, 0.0]
  - - [42720, 96, 1, 96]
    - [206, 0.0]
  - - [12576, 32, 1, 32]
    - [37, 0.0]
  - - [41728, 30, 1, 36]
    - [40, 0.0]
  - - [41536, 64, 1, 64]
    - [116, 0.0]
  - - [6656, 124, 1, 132]
    - [79, 0.0]
  - - [30684, 30, 1, 36]
    - [38, 0.0]
  - - [6176, 32, 1, 32]
    - [40, 0.0]
  - - [34750, 66, 1, 66]
    - [57, 0.0]
  - - [3216, 48, 1, 48]
    - [40, 0.0]
  - - [4992, 48, 1, 48]
    - [119, 0.0]
  - - [38688, 32, 1, 32]
    - [76, 0.0]
  - - [31584, 32, 1, 32]
    - [38, 0.0]
  - - [1248, 96, 1, 96]
    - [119, 0.0]
  - - [6202, 58, 1, 66]
    - [127, 0.0]
  - - [40800, 32, 1, 32]
    - [76, 0.0]
  - - [36160, 64, 1, 64]
    - [168, 0.0]
  - - [39552, 48, 1, 48]
    - [52, 0.0]
  - - [2560, 128, 1, 128]
    - [127, 0.0]
  - - [9406, 66, 1, 66]
    - [60, 0.0]
  - - [8640, 64, 1, 64]
    - [78, 0.0]
  - - [28576, 32, 1, 32]
    - [44, 0.0]
  - - [16128, 124, 1, 132]
    - [62, 0.0]
  - - [1200, 48, 1, 48]
    - [37, 0.0]
  - - [20992, 30, 1, 36]
    - [74, 0.0]
  - - [14490, 30, 1, 36]
    - [45, 0.0]
  - - [10304, 64, 1, 64]
    - [146, 0.0]
  - - [5792, 32, 1, 32]
    - [37, 0.0]
  - - [12800, 124, 1, 132]
    - [144, 0.0]
  - - [14592, 30, 1, 36]
    - [74, 0.0]
  - - [24064, 66, 1, 66]
    - [57, 0.0]
  - - [18400, 32, 1, 32]
    - [37, 0.0]
  - - [26720, 32, 1, 32]
    - [38, 0.0]
  - - [14138, 58, 1, 66]
    - [79, 0.0]
  - - [25534, 66, 1, 66]
    - [179, 0.0]
  - - [15424, 64, 1, 64]
    - [142, 0.0]
  - - [15504, 48, 1, 48]
    - [89, 0.0]
  - - [19200, 66, 1, 66]
    - [60, 0.0]
  - - [19424, 32, 1, 32]
    - [40, 0.0]
  - - [31536, 48, 1, 48]
    - [136, 0.0]
  - - [11776, 124, 1, 132]
    - [88, 0.0]
  - - [41984, 128, 1, 128]
    - [142, 0.0]
  - - [24352, 32, 1, 32]
    - [37, 0.0]
  - - [128, 1, 1, 128]
    - [211, 0.0]
  - - [1408, 64, 1, 64]
    - [212, 0.0]
  - - [26240, 16, 1, 16]
    - [217, 0.0]
  - - [29952, 16, 1, 16]
    - [213, 0.0]
  - - [14208, 32, 1, 32]
    - [212, 0.0]
  - - [1152, 64, 1, 64]
    - [216, 0.0]
  - - [14720, 16, 1, 16]
    - [235, 0.0]
  - - [44544, 32, 1, 32]
    - [236, 0.0]
  - - [35072, 64, 1, 64]
    - [255, 0.0]
  - - [41472, 32, 1, 32]
    - [235, 0.0]
  - - [36992, 32, 1, 32]
    - [235, 0.0]
  - - [33792, 32, 1, 32]
    - [221, 0.0]
  - - [39296, 64, 1, 64]
    - [259, 0.0]
  - - [39552, 16, 1, 16]
    - [212, 0.0]
  - - [27136, 64, 1, 64]
    - [281, 0.0]
  - - [2944, 32, 1, 32]
    - [212, 0.0]
  - - [42752, 32, 1, 32]
    - [231, 0.0]
  - - [30848, 64, 1, 64]
    - [264, 0.0]
  - - [23936, 16, 1, 16]
    - [213, 0.0]
  - - [38272, 32, 1, 32]
    - [216, 0.0]
  - - [34816, 16, 1, 16]
    - [212, 0.0]
  - - [17920, 32, 1, 32]
    - [212, 0.0]
  - - [23424, 64, 1, 64]
    - [267, 0.0]
  - - [15488, 16, 1, 16]
    - [231, 0.0]
  - - [19456, 64, 1, 64]
    - [255, 0.0]
  - - [27392, 16, 1, 16]
    - [213, 0.0]
  - - [30976, 32, 1, 32]
    - [235, 0.0]
  - - [23168, 64, 1, 64]
    - [264, 0.0]
  - - [30592, 32, 1, 32]
    - [213, 0.0]
  - - [36608, 64, 1, 64]
    - [266, 0.0]
  - - [18944, 16, 1, 16]
    - [231, 0.0]
  - - [30720, 32, 1, 32]
    - [217, 0.0]
  - - [32384, 16, 1, 16]
    - [231, 0.0]
  - - [13952, 32, 1, 32]
    - [212, 0.0]
  - - [44544, 64, 1, 64]
    - [278, 0.0]
  - - [44288, 16, 1, 16]
    - [235, 0.0]
  - - [3840, 64, 1, 64]
    - [246, 0.0]
  - - [40064, 64, 1, 64]
    - [262, 0.0]
  - - [10624, 32, 1, 32]
    - [212, 0.0]
  - - [39424, 32, 1, 32]
    - [216, 0.0]
  - - [16256, 64, 1, 64]
    - [229, 0.0]
  - - [26752, 32, 1, 32]
    - [213, 0.0]
  - - [36608, 16, 1, 16]
    - [231, 0.0]
  - - [21376, 16, 1, 16]
    - [212, 0.0]
  - - [23552, 32, 1, 32]
    - [213, 0.0]
  - - [29056, 64, 1, 64]
    - [278, 0.0]
  - - [29312, 16, 1, 16]
    - [236, 0.0]
  - - [43648, 32, 1, 32]
    - [212, 0.0]
  - - [33280, 64, 1, 64]
    - [284, 0.0]
  - - [11520, 16, 1, 16]
    - [212, 0.0]
  - - [2560, 16, 1, 16]
    - [212, 0.0]
  - - [19840, 32, 1, 32]
    - [212, 0.0]
  - - [17664, 64, 1, 64]
    - [283, 0.0]
  - - [8192, 16, 1, 16]
    - [212, 0.0]
  - - [40448, 32, 1, 32]
    - [216, 0.0]
  - - [44800, 32, 1, 32]
    - [216, 0.0]
  - - [35968, 32, 1, 32]
    - [231, 0.0]
  - - [9216, 64, 1, 64]
    - [231, 0.0]
  - - [768, 16, 1, 16]
    - [224, 0.0]
  - - [1792, 64, 1, 64]
    - [215, 0.0]
  - - [33280, 16, 1, 16]
    - [212, 0.0]
  - - [26112, 64, 1, 64]
    - [284, 0.0]
  - - [42240, 16, 1, 16]
    - [212, 0.0]
  - - [14336, 32, 1, 32]
    - [212, 0.0]
  - - [29824, 64, 1, 64]
    - [266, 0.0]
  - - [10624, 16, 1, 16]
    - [221, 0.0]
  - - [41344, 32, 1, 32]
    - [219, 0.0]
  - - [14592, 64, 1, 64]
    - [268, 0.0]
  - - [17408, 16, 1, 16]
    - [219, 0.0]
  - - [4608, 32, 1, 32]
    - [212, 0.0]
  - - [4864, 32, 1, 32]
    - [218, 0.0]
  - - [128, 32, 1, 32]
    - [212, 0.0]
  - - [26368, 16, 1, 16]
    - [236, 0.0]
  - - [38144, 32, 1, 32]
    - [235, 0.0]
  - - [22144, 64, 1, 64]
    - [268, 0.0]
  - - [896, 32, 1, 32]
    - [233, 0.0]
  - - [31488, 64, 1, 64]
    - [259, 0.0]
  - - [1536, 16, 1, 16]
    - [233, 0.0]
  - - [2432, 64, 1, 64]
    - [248, 0.0]
  - - [35456, 16, 1, 16]
    - [212, 0.0]
  - - [8832, 32, 1, 32]
    - [212, 0.0]
  - - [6656, 64, 1, 64]
    - [275, 0.0]
  - - [4992, 64, 1, 64]
    - [271, 0.0]
  - - [22272, 32, 1, 32]
    - [231, 0.0]
  - - [26752, 64, 1, 64]
    - [284, 0.0]
  - - [3456, 16, 1, 16]
    - [216, 0.0]
  - - [14336, 16, 1, 16]
    - [235, 0.0]
  - - [30208, 32, 1, 32]
    - [213, 0.0]
  - - [19328, 64, 1, 64]
    - [267, 0.0]
  - - [27776, 16, 1, 16]
    - [213, 0.0]
  - - [15360, 64, 1, 64]
    - [264, 0.0]
  - - [6912, 16, 1, 16]
    - [212, 0.0]
  - - [26880, 32, 1, 32]
    - [236, 0.0]
  - - [2688, 64, 1, 64]
    - [271, 0.0]
  - - [20352, 16, 1, 16]
    - [212, 0.0]
  - - [26496, 32, 1, 32]
    - [213, 0.0]
  - - [31232, 16, 1, 16]
    - [212, 0.0]
  - - [43008, 32, 1, 32]
    - [212, 0.0]
  - - [11648, 64, 1, 64]
    - [232, 0.0]
  - - [11904, 16, 1, 16]
    - [212, 0.0]
  - - [38528, 16, 1, 16]
    - [212, 0.0]
  - - [13696, 64, 1, 64]
    - [255, 0.0]
  - - [19584, 64, 1, 64]
    - [283, 0.0]
  - - [33152, 16, 1, 16]
    - [212, 0.0]
  - - [39296, 32, 1, 32]
    - [216, 0.0]
  - - [2560, 32, 1, 32]
    - [233, 0.0]
  - - [28544, 64, 1, 64]
    - [265, 0.0]
  - - [24704, 16, 1, 16]
    - [213, 0.0]
  - - [6272, 32, 1, 32]
    - [212, 0.0]
  - - [4096, 64, 1, 64]
    - [270, 0.0]
  - - [32512, 16, 1, 16]
    - [231, 0.0]
  - - [36480, 64, 1, 64]
    - [268, 0.0]
  - - [896, 16, 1, 16]
    - [212, 0.0]
  - - [2304, 16, 1, 16]
    - [212, 0.0]
  - - [13056, 64, 1, 64]
    - [232, 0.0]
  - - [7680, 16, 1, 16]
    - [212, 0.0]
  - - [19456, 32, 1, 32]
    - [216, 0.0]
  - - [41344, 64, 1, 64]
    - [262, 0.0]
  - - [28416, 32, 1, 32]
    - [217, 0.0]
  - - [23168, 32, 1, 32]
    - [217, 0.0]
  - - [20736, 16, 1, 16]
    - [212, 0.0]
  - - [9856, 16, 1, 16]
    - [212, 0.0]
  - - [20224, 32, 1, 32]
    - [212, 0.0]
  - - [29952, 64, 1, 64]
    - [264, 0.0]
  - - [4096, 16, 1, 16]
    - [231, 0.0]
  - - [36352, 32, 1, 32]
    - [231, 0.0]
  - - [17280, 64, 1, 64]
    - [227, 0.0]
  - - [21504, 64, 1, 64]
    - [284, 0.0]
  - - [8832, 64, 1, 64]
    - [236, 0.0]
  - - [34688, 16, 1, 16]
    - [216, 0.0]
  - - [16384, 32, 1, 32]
    - [231, 0.0]
  - - [18048, 16, 1, 16]
    - [212, 0.0]
  - - [5632, 64, 1, 64]
    - [271, 0.0]
  - - [21760, 16, 1, 16]
    - [212, 0.0]
  - - [7808, 32, 1, 32]
    - [234, 0.0]
  - - [25728, 64, 1, 64]
    - [264, 0.0]
  - - [6528, 16, 1, 16]
    - [233, 0.0]
  - - [4480, 32, 1, 32]
    - [214, 0.0]
  - - [29696, 16, 1, 16]
    - [242, 0.0]
  - - [512, 32, 1, 32]
    - [212, 0.0]
  - - [42880, 64, 1, 64]
    - [262, 0.0]
  - - [14464, 16, 1, 16]
    - [212, 0.0]
  - - [28800, 32, 1, 32]
    - [232, 0.0]
  - - [43264, 16, 1, 16]
    - [216, 0.0]
  - - [2048, 64, 1, 64]
    - [247, 0.0]
  - - [5888, 16, 1, 16]
    - [224, 0.0]
  - - [43776, 32, 1, 32]
    - [216, 0.0]
  - - [1664, 64, 1, 64]
    - [212, 0.0]
  - - [13184, 32, 1, 32]
    - [212, 0.0]
  - - [11008, 64, 1, 64]
    - [263, 0.0]
  - - [13824, 16, 1, 16]
    - [231, 0.0]
  - - [31104, 64, 1, 64]
    - [258, 0.0]
  - - [18944, 64, 1, 64]
    - [265, 0.0]
  - - [7936, 32, 1, 32]
    - [234, 0.0]
  - - [34560, 32, 1, 32]
    - [212, 0.0]
  - - [22656, 64, 1, 64]
    - [280, 0.0]
  - - [15744, 16, 1, 16]
    - [212, 0.0]
  - - [27904, 64, 1, 64]
    - [281, 0.0]
  - - [26624, 16, 1, 16]
    - [213, 0.0]
  - - [42496, 32, 1, 32]
    - [231, 0.0]
  - - [15232, 64, 1, 64]
    - [278, 0.0]
  - - [7296, 16, 1, 16]
    - [212, 0.0]
  - - [38016, 32, 1, 32]
    - [216, 0.0]
  - - [44032, 64, 1, 64]
    - [278, 0.0]
  - - [19200, 16, 1, 16]
    - [212, 0.0]
  - - [22784, 32, 1, 32]
    - [212, 0.0]
  - - [14976, 64, 1, 64]
    - [255, 0.0]
  - - [22400, 32, 1, 32]
    - [212, 0.0]
  - - [28416, 64, 1, 64]
    - [265, 0.0]
  - - [10752, 16, 1, 16]
    - [212, 0.0]
  - - [22528, 32, 1, 32]
    - [212, 0.0]
  - - [23936, 64, 1, 64]
    - [283, 0.0]
  - - [24192, 16, 1, 16]
    - [213, 0.0]
  - - [38528, 32, 1, 32]
    - [216, 0.0]
  - - [3584, 64, 1, 64]
    - [248, 0.0]
  - - [36096, 16, 1, 16]
    - [231, 0.0]
  - - [13824, 64, 1, 64]
    - [278, 0.0]
  - - [31872, 64, 1, 64]
    - [280, 0.0]
  - - [35200, 32, 1, 32]
    - [231, 0.0]
  - - [41216, 64, 1, 64]
    - [268, 0.0]
  - - [40832, 64, 1, 64]
    - [278, 0.0]
  - - [4224, 16, 1, 16]
    - [212, 0.0]
  - - [18560, 32, 1, 32]
    - [212, 0.0]
  - - [16384, 64, 1, 64]
    - [229, 0.0]
  - - [28416, 16, 1, 16]
    - [213, 0.0]
  - - [23808, 32, 1, 32]
    - [217, 0.0]
  - - [13184, 16, 1, 16]
    - [231, 0.0]
  - - [27520, 32, 1, 32]
    - [220, 0.0]
  - - [36352, 16, 1, 16]
    - [231, 0.0]
  - - [35456, 32, 1, 32]
    - [231, 0.0]
  - - [25088, 64, 1, 64]
    - [280, 0.0]
  - - [12416, 16, 1, 16]
    - [212, 0.0]
  - - [13568, 16, 1, 16]
    - [212, 0.0]
  - - [20608, 64, 1, 64]
    - [264, 0.0]
  - - [44416, 32, 1, 32]
    - [231, 0.0]
  - - [42240, 64, 1, 64]
    - [262, 0.0]
  - - [13184, 64, 1, 64]
    - [242, 0.0]
  - - [38016, 16, 1, 16]
    - [216, 0.0]
  - - [27776, 32, 1, 32]
    - [217, 0.0]
  - - [33792, 64, 1, 64]
    - [264, 0.0]
  - - [20736, 32, 1, 32]
    - [231, 0.0]
  - - [4736, 64, 1, 64]
    - [250, 0.0]
  - - [41728, 32, 1, 32]
    - [212, 0.0]
  - - [26368, 64, 1, 64]
    - [280, 0.0]
  - - [25088, 16, 1, 16]
    - [213, 0.0]
  - - [12288, 32, 1, 32]
    - [212, 0.0]
  - - [5504, 64, 1, 64]
    - [248, 0.0]
  - - [44672, 32, 1, 32]
    - [235, 0.0]
  - - [1280, 16, 1, 16]
    - [234, 0.0]
  - - [6912, 32, 1, 32]
    - [212, 0.0]
  - - [2432, 16, 1, 16]
    - [212, 0.0]
  - - [33152, 32, 1, 32]
    - [231, 0.0]
  - - [6400, 64, 1, 64]
    - [248, 0.0]
  - - [9216, 16, 1, 16]
    - [212, 0.0]
  - - [29184, 32, 1, 32]
    - [220, 0.0]
  - - [22400, 64, 1, 64]
    - [280, 0.0]
  - - [10368, 16, 1, 16]
    - [212, 0.0]
  - - [14336, 64, 1, 64]
    - [264, 0.0]
  - - [23296, 64, 1, 64]
    - [258, 0.0]
  - - [37888, 32, 1, 32]
    - [216, 0.0]
  - - [33408, 32, 1, 32]
    - [231, 0.0]
  - - [31232, 64, 1, 64]
    - [265, 0.0]
  - - [768, 64, 1, 64]
    - [212, 0.0]
  - - [18560, 64, 1, 64]
    - [283, 0.0]
  - - [28032, 16, 1, 16]
    - [232, 0.0]
  - - [42368, 32, 1, 32]
    - [216, 0.0]
  - - [40192, 64, 1, 64]
    - [262, 0.0]
  - - [38912, 16, 1, 16]
    - [231, 0.0]
  - - [22016, 32, 1, 32]
    - [231, 0.0]
  - - [11136, 64, 1, 64]
    - [256, 0.0]
  - - [17536, 32, 1, 32]
    - [212, 0.0]
  - - [39936, 64, 1, 64]
    - [262, 0.0]
  - - [31488, 16, 1, 16]
    - [217, 0.0]
  - - [18688, 32, 1, 32]
    - [231, 0.0]
  - - [27264, 64, 1, 64]
    - [262, 0.0]
  - - [18304, 32, 1, 32]
    - [212, 0.0]
  - - [7936, 64, 1, 64]
    - [236, 0.0]
  - - [2048, 32, 1, 32]
    - [212, 0.0]
  - - [3456, 64, 1, 64]
    - [248, 0.0]
  - - [36480, 16, 1, 16]
    - [212, 0.0]
  - - [15616, 16, 1, 16]
    - [231, 0.0]
  - - [7296, 64, 1, 64]
    - [254, 0.0]
  - - [44160, 64, 1, 64]
    - [282, 0.0]
  - - [20736, 64, 1, 64]
    - [268, 0.0]
  - - [7168, 16, 1, 16]
    - [233, 0.0]
  - - [27136, 32, 1, 32]
    - [236, 0.0]
  - - [20352, 64, 1, 64]
    - [264, 0.0]
  - - [16512, 16, 1, 16]
    - [212, 0.0]
  - - [30848, 32, 1, 32]
    - [212, 0.0]
  - - [24320, 16, 1, 16]
    - [213, 0.0]
  - - [19712, 32, 1, 32]
    - [212, 0.0]
  - - [6400, 16, 1, 16]
    - [212, 0.0]
  - - [25472, 16, 1, 16]
    - [213, 0.0]
  - - [39808, 32, 1, 32]
    - [212, 0.0]
  - - [37632, 64, 1, 64]
    - [284, 0.0]
  - - [32256, 16, 1, 16]
    - [212, 0.0]
  - - [44032, 32, 1, 32]
    - [216, 0.0]
  - - [33152, 64, 1, 64]
    - [264, 0.0]
  - - [640, 16, 1, 16]
    - [212, 0.0]
  - - [4480, 16, 1, 16]
    - [243, 0.0]
  - - [16512, 64, 1, 64]
    - [229, 0.0]
  - - [9600, 16, 1, 16]
    - [218, 0.0]
  - - [21760, 64, 1, 64]
    - [264, 0.0]
  - - [44800, 128, 1, 128]
    - [282, 0.0]
  - - [41856, 64, 1, 64]
    - [264, 0.0]
  - - [13312, 64, 1, 64]
    - [232, 0.0]
  - - [16640, 32, 1, 32]
    - [212, 0.0]
  - - [33408, 64, 1, 64]
    - [264, 0.0]
  - - [38656, 64, 1, 64]
    - [264, 0.0]
  - - [4608, 16, 1, 16]
    - [231, 0.0]
  - - [40960, 32, 1, 32]
    - [212, 0.0]
  - - [44544, 128, 1, 128]
    - [282, 0.0]
  - - [40576, 32, 1, 32]
    - [212, 0.0]
  - - [384, 32, 1, 32]
    - [212, 0.0]
  - - [18688, 64, 1, 64]
    - [281, 0.0]
  - - [25088, 32, 1, 32]
    - [232, 0.0]
  - - [34688, 64, 1, 64]
    - [280, 0.0]
  - - [39040, 16, 1, 16]
    - [235, 0.0]
  - - [20608, 32, 1, 32]
    - [212, 0.0]
  - - [42240, 32, 1, 32]
    - [216, 0.0]
  - - [37760, 32, 1, 32]
    - [235, 0.0]
  - - [35584, 64, 1, 64]
    - [284, 0.0]
  - - [38400, 16, 1, 16]
    - [235, 0.0]
  - - [17408, 32, 1, 32]
    - [231, 0.0]
  - - [22912, 64, 1, 64]
    - [264, 0.0]
  - - [23168, 16, 1, 16]
    - [231, 0.0]
  - - [10368, 32, 1, 32]
    - [212, 0.0]
  - - [26368, 32, 1, 32]
    - [232, 0.0]
  - - [25344, 32, 1, 32]
    - [232, 0.0]
  - - [21888, 32, 1, 32]
    - [231, 0.0]
  - - [18432, 16, 1, 16]
    - [212, 0.0]
  - - [44544, 96, 1, 96]
    - [286, 0.0]
  - - [29824, 32, 1, 32]
    - [213, 0.0]
  - - [20224, 64, 1, 64]
    - [268, 0.0]
  - - [16000, 16, 1, 16]
    - [231, 0.0]
  - - [28160, 64, 1, 64]
    - [265, 0.0]
  - - [27904, 16, 1, 16]
    - [242, 0.0]
  - - [2304, 64, 1, 64]
    - [250, 0.0]
  - - [23680, 64, 1, 64]
    - [264, 0.0]
  - - [37248, 16, 1, 16]
    - [212, 0.0]
  - - [33024, 64, 1, 64]
    - [264, 0.0]
  - - [23040, 32, 1, 32]
    - [212, 0.0]
  - - [28800, 16, 1, 16]
    - [242, 0.0]
  - - [40960, 64, 1, 64]
    - [268, 0.0]
  - - [20224, 16, 1, 16]
    - [231, 0.0]
  - - [40576, 64, 1, 64]
    - [262, 0.0]
  - - [12928, 16, 1, 16]
    - [216, 0.0]
  - - [27264, 32, 1, 32]
    - [217, 0.0]
  - - [16896, 64, 1, 64]
    - [229, 0.0]
  - - [11776, 16, 1, 16]
    - [231, 0.0]
  - - [5120, 16, 1, 16]
    - [233, 0.0]
  - - [3456, 32, 1, 32]
    - [233, 0.0]
  - - [1280, 64, 1, 64]
    - [212, 0.0]
  - - [24064, 32, 1, 32]
    - [213, 0.0]
  - - [37760, 64, 1, 64]
    - [280, 0.0]
  - - [19584, 32, 1, 32]
    - [212, 0.0]
  - - [29312, 64, 1, 64]
    - [265, 0.0]
  - - [38784, 16, 1, 16]
    - [231, 0.0]
  - - [16896, 16, 1, 16]
    - [212, 0.0]
  - - [36864, 32, 1, 32]
    - [216, 0.0]
  - - [30080, 64, 1, 64]
    - [278, 0.0]
  - - [17152, 32, 1, 32]
    - [212, 0.0]
  - - [36480, 32, 1, 32]
    - [235, 0.0]
  - - [9728, 64, 1, 64]
    - [259, 0.0]
  - - [25856, 16, 1, 16]
    - [213, 0.0]
  - - [8704, 32, 1, 32]
    - [212, 0.0]
  - - [13440, 64, 1, 64]
    - [240, 0.0]
  - - [24960, 32, 1, 32]
    - [213, 0.0]
  - - [1024, 16, 1, 16]
    - [212, 0.0]
  - - [34944, 16, 1, 16]
    - [212, 0.0]
  - - [38912, 64, 1, 64]
    - [282, 0.0]
  - - [9984, 16, 1, 16]
    - [212, 0.0]
  - - [21760, 32, 1, 32]
    - [216, 0.0]
  - - [5760, 64, 1, 64]
    - [248, 0.0]
  - - [43904, 16, 1, 16]
    - [231, 0.0]
  - - [15104, 64, 1, 64]
    - [278, 0.0]
  - - [29696, 32, 1, 32]
    - [236, 0.0]
  - - [19072, 16, 1, 16]
    - [212, 0.0]
  - - [12416, 64, 1, 64]
    - [240, 0.0]
  - - [5888, 32, 1, 32]
    - [212, 0.0]
  - - [10368, 64, 1, 64]
    - [259, 0.0]
  - - [34176, 32, 1, 32]
    - [235, 0.0]
  - - [32000, 64, 1, 64]
    - [264, 0.0]
  - - [13824, 32, 1, 32]
    - [212, 0.0]
  - - [2944, 64, 1, 64]
    - [271, 0.0]
  - - [11392, 16, 1, 16]
    - [212, 0.0]
  - - [42112, 32, 1, 32]
    - [212, 0.0]
  - - [10496, 32, 1, 32]
    - [212, 0.0]
  - - [3968, 16, 1, 16]
    - [216, 0.0]
  - - [10112, 32, 1, 32]
    - [246, 0.0]
  - - [32512, 64, 1, 64]
    - [268, 0.0]
  - - [14848, 16, 1, 16]
    - [215, 0.0]
  - - [26624, 32, 1, 32]
    - [236, 0.0]
  - - [42624, 32, 1, 32]
    - [231, 0.0]
  - - [40448, 64, 1, 64]
    - [262, 0.0]
  - - [40192, 16, 1, 16]
    - [212, 0.0]
  - - [14208, 64, 1, 64]
    - [264, 0.0]
  - - [3200, 64, 1, 64]
    - [246, 0.0]
  - - [16768, 16, 1, 16]
    - [231, 0.0]
  - - [22912, 32, 1, 32]
    - [231, 0.0]
  - - [256, 16, 1, 16]
    - [225, 0.0]
  - - [12160, 64, 1, 64]
    - [232, 0.0]
  - - [8320, 16, 1, 16]
    - [231, 0.0]
  - - [16128, 16, 1, 16]
    - [212, 0.0]
  - - [44288, 32, 1, 32]
    - [219, 0.0]
  - - [20096, 64, 1, 64]
    - [282, 0.0]
  - - [31616, 32, 1, 32]
    - [221, 0.0]
  - - [3072, 32, 1, 32]
    - [212, 0.0]
  - - [24960, 64, 1, 64]
    - [264, 0.0]
  - - [768, 32, 1, 32]
    - [234, 0.0]
  - - [6784, 32, 1, 32]
    - [248, 0.0]
  - - [4352, 16, 1, 16]
    - [225, 0.0]
  - - [6272, 16, 1, 16]
    - [231, 0.0]
  - - [41088, 64, 1, 64]
    - [264, 0.0]
  - - [34176, 16, 1, 16]
    - [212, 0.0]
  - - [23296, 32, 1, 32]
    - [232, 0.0]
  - - [13568, 64, 1, 64]
    - [257, 0.0]
  - - [8448, 16, 1, 16]
    - [218, 0.0]
  - - [19968, 32, 1, 32]
    - [212, 0.0]
  - - [896, 64, 1, 64]
    - [233, 0.0]
  - - [42112, 16, 1, 16]
    - [221, 0.0]
  - - [5120, 64, 1, 64]
    - [271, 0.0]
  - - [41216, 32, 1, 32]
    - [212, 0.0]
  - - [18304, 16, 1, 16]
    - [231, 0.0]
  - - [40832, 32, 1, 32]
    - [219, 0.0]
  - - [30464, 64, 1, 64]
    - [280, 0.0]
  - - [29184, 16, 1, 16]
    - [236, 0.0]
  - - [42368, 64, 1, 64]
    - [262, 0.0]
  - - [1664, 16, 1, 16]
    - [234, 0.0]
  - - [32384, 32, 1, 32]
    - [212, 0.0]
  - - [44544, 64, 1, 64]
    - [269, 0.0]
  - - [5376, 16, 1, 16]
    - [231, 0.0]
  - - [4224, 32, 1, 32]
    - [212, 0.0]
  - - [9344, 64, 1, 64]
    - [235, 0.0]
  - - [43264, 64, 1, 64]
    - [262, 0.0]
  - - [13312, 16, 1, 16]
    - [212, 0.0]
  - - [26496, 64, 1, 64]
    - [280, 0.0]
  - - [12416, 32, 1, 32]
    - [212, 0.0]
  - - [34048, 32, 1, 32]
    - [216, 0.0]
  - - [39808, 16, 1, 16]
    - [216, 0.0]
  - - [41984, 32, 1, 32]
    - [212, 0.0]
  - - [14720, 64, 1, 64]
    - [262, 0.0]
  - - [37504, 32, 1, 32]
    - [216, 0.0]
  - - [33536, 32, 1, 32]
    - [212, 0.0]
  - - [2560, 64, 1, 64]
    - [251, 0.0]
  - - [4096, 32, 1, 32]
    - [212, 0.0]
  - - [18176, 32, 1, 32]
    - [212, 0.0]
  - - [6272, 64, 1, 64]
    - [275, 0.0]
  - - [11520, 64, 1, 64]
    - [259, 0.0]
  - - [10240, 16, 1, 16]
    - [212, 0.0]
  - - [26112, 32, 1, 32]
    - [240, 0.0]
  - - [21632, 32, 1, 32]
    - [212, 0.0]
  - - [27648, 64, 1, 64]
    - [276, 0.0]
  - - [2816, 16, 1, 16]
    - [234, 0.0]
  - - [6400, 32, 1, 32]
    - [212, 0.0]
  - - [11008, 32, 1, 32]
    - [212, 0.0]
  - - [6016, 32, 1, 32]
    - [212, 0.0]
  - - [12032, 64, 1, 64]
    - [220, 0.0]
  - - [6144, 32, 1, 32]
    - [234, 0.0]
  - - [7552, 64, 1, 64]
    - [249, 0.0]
  - - [7808, 16, 1, 16]
    - [212, 0.0]
  - - [22144, 32, 1, 32]
    - [221, 0.0]
  - - [19712, 16, 1, 16]
    - [216, 0.0]
  - - [10240, 64, 1, 64]
    - [254, 0.0]
  - - [15488, 64, 1, 64]
    - [229, 0.0]
  - - [29056, 16, 1, 16]
    - [236, 0.0]
  - - [18816, 32, 1, 32]
    - [212, 0.0]
  - - [24832, 64, 1, 64]
    - [264, 0.0]
  - - [44032, 16, 1, 16]
    - [212, 0.0]
  - - [24448, 64, 1, 64]
    - [283, 0.0]
  - - [2176, 32, 1, 32]
    - [212, 0.0]
  - - [15104, 32, 1, 32]
    - [231, 0.0]
  - - [12032, 16, 1, 16]
    - [212, 0.0]
  - - [7424, 32, 1, 32]
    - [212, 0.0]
  - - [32384, 64, 1, 64]
    - [284, 0.0]
  - - [11136, 32, 1, 32]
    - [231, 0.0]
  - - [41728, 64, 1, 64]
    - [284, 0.0]
  - - [19968, 16, 1, 16]
    - [212, 0.0]
  - - [31744, 32, 1, 32]
    - [221, 0.0]
  - - [37248, 64, 1, 64]
    - [268, 0.0]
  - - [37504, 16, 1, 16]
    - [231, 0.0]
  - - [19072, 32, 1, 32]
    - [212, 0.0]
  - - [8704, 64, 1, 64]
    - [232, 0.0]
  - - [5504, 16, 1, 16]
    - [212, 0.0]
  - - [14080, 16, 1, 16]
    - [231, 0.0]
  - - [4224, 64, 1, 64]
    - [274, 0.0]
  - - [28032, 32, 1, 32]
    - [213, 0.0]
  - - [25856, 64, 1, 64]
    - [264, 0.0]
  - - [21632, 16, 1, 16]
    - [231, 0.0]
  - - [11392, 32, 1, 32]
    - [231, 0.0]
  - - [17408, 64, 1, 64]
    - [265, 0.0]
  - - [41728, 16, 1, 16]
    - [212, 0.0]
  - - [4352, 32, 1, 32]
    - [212, 0.0]
  - - [30592, 16, 1, 16]
    - [232, 0.0]
  - - [36736, 32, 1, 32]
    - [212, 0.0]
  - - [9984, 64, 1, 64]
    - [279, 0.0]
  - - [8704, 16, 1, 16]
    - [218, 0.0]
  - - [30336, 16, 1, 16]
    - [232, 0.0]
  - - [28288, 32, 1, 32]
    - [217, 0.0]
  - - [31488, 32, 1, 32]
    - [221, 0.0]
  - - [34304, 64, 1, 64]
    - [264, 0.0]
  - - [9472, 32, 1, 32]
    - [246, 0.0]
  - - [38016, 64, 1, 64]
    - [268, 0.0]
  - - [16768, 32, 1, 32]
    - [231, 0.0]
  - - [12800, 32, 1, 32]
    - [212, 0.0]
  - - [6016, 64, 1, 64]
    - [275, 0.0]
  - - [41088, 32, 1, 32]
    - [216, 0.0]
  - - [34560, 16, 1, 16]
    - [231, 0.0]
  - - [30336, 64, 1, 64]
    - [264, 0.0]
  - - [35712, 16, 1, 16]
    - [216, 0.0]
  - - [41856, 32, 1, 32]
    - [221, 0.0]
  - - [6912, 64, 1, 64]
    - [248, 0.0]
  - - [42496, 16, 1, 16]
    - [216, 0.0]
  - - [21504, 32, 1, 32]
    - [216, 0.0]
  - - [43392, 64, 1, 64]
    - [278, 0.0]
  - - [43648, 16, 1, 16]
    - [221, 0.0]
  - - [17024, 32, 1, 32]
    - [231, 0.0]
  - - [14848, 64, 1, 64]
    - [262, 0.0]
  - - [8192, 64, 1, 64]
    - [232, 0.0]
  - - [30464, 32, 1, 32]
    - [213, 0.0]
  - - [2176, 64, 1, 64]
    - [247, 0.0]
  - - [11648, 16, 1, 16]
    - [221, 0.0]
  - - [25984, 32, 1, 32]
    - [213, 0.0]
  - - [23808, 64, 1, 64]
    - [261, 0.0]
  - - [22528, 16, 1, 16]
    - [212, 0.0]
  - - [5632, 32, 1, 32]
    - [212, 0.0]
  - - [35968, 16, 1, 16]
    - [212, 0.0]
  - - [1152, 32, 1, 32]
    - [214, 0.0]
  - - [10496, 16, 1, 16]
    - [212, 0.0]
  - - [23552, 64, 1, 64]
    - [264, 0.0]
  - - [15104, 16, 1, 16]
    - [231, 0.0]
  - - [2304, 32, 1, 32]
    - [212, 0.0]
  - - [10880, 64, 1, 64]
    - [263, 0.0]
  - - [8960, 32, 1, 32]
    - [270, 0.0]
  - - [1920, 32, 1, 32]
    - [234, 0.0]
  - - [39424, 16, 1, 16]
    - [212, 0.0]
  - - [35584, 32, 1, 32]
    - [216, 0.0]
  - - [20096, 16, 1, 16]
    - [212, 0.0]
  - - [34432, 32, 1, 32]
    - [239, 0.0]
  - - [32256, 64, 1, 64]
    - [284, 0.0]
  - - [9856, 64, 1, 64]
    - [254, 0.0]
  - - [27776, 64, 1, 64]
    - [275, 0.0]
  - - [41344, 16, 1, 16]
    - [212, 0.0]
  - - [4352, 64, 1, 64]
    - [271, 0.0]
  - - [10752, 32, 1, 32]
    - [212, 0.0]
  - - [3968, 64, 1, 64]
    - [250, 0.0]
  - - [128, 16, 1, 16]
    - [226, 0.0]
  - - [14464, 32, 1, 32]
    - [212, 0.0]
  - - [7936, 16, 1, 16]
    - [212, 0.0]
  - - [3328, 32, 1, 32]
    - [212, 0.0]
  - - [44672, 64, 1, 64]
    - [262, 0.0]
  - - [9088, 16, 1, 16]
    - [212, 0.0]
  - - [23424, 32, 1, 32]
    - [232, 0.0]
  - - [21248, 64, 1, 64]
    - [260, 0.0]
  - - [15872, 16, 1, 16]
    - [212, 0.0]
  - - [27648, 32, 1, 32]
    - [232, 0.0]
  - - [16768, 64, 1, 64]
    - [229, 0.0]
  - - [40704, 32, 1, 32]
    - [235, 0.0]
  - - [31360, 32, 1, 32]
    - [235, 0.0]
  - - [37376, 64, 1, 64]
    - [280, 0.0]
  - - [28928, 16, 1, 16]
    - [217, 0.0]
  - - [4992, 16, 1, 16]
    - [212, 0.0]
  - - [128, 64, 1, 64]
    - [237, 0.0]
  - - [40320, 32, 1, 32]
    - [216, 0.0]
  - - [5376, 64, 1, 64]
    - [252, 0.0]
  - - [44544, 32, 1, 32]
    - [216, 0.0]
  - - [25472, 64, 1, 64]
    - [268, 0.0]
  - - [33920, 16, 1, 16]
    - [212, 0.0]
  - - [40064, 32, 1, 32]
    - [216, 0.0]
  - - [37632, 16, 1, 16]
    - [231, 0.0]
  - - [256, 32, 1, 32]
    - [233, 0.0]
  - - [17024, 64, 1, 64]
    - [229, 0.0]
  - - [42880, 16, 1, 16]
    - [216, 0.0]
  - - [32640, 32, 1, 32]
    - [216, 0.0]
  - - [22272, 64, 1, 64]
    - [268, 0.0]
  - - [24576, 32, 1, 32]
    - [222, 0.0]
  - - [34176, 64, 1, 64]
    - [284, 0.0]
  - - [24192, 32, 1, 32]
    - [236, 0.0]
  - - [4992, 32, 1, 32]
    - [215, 0.0]
  - - [33920, 64, 1, 64]
    - [264, 0.0]
  - - [37888, 16, 1, 16]
    - [231, 0.0]
  - - [18304, 64, 1, 64]
    - [258, 0.0]
  - - [22656, 16, 1, 16]
    - [212, 0.0]
  - - [28544, 16, 1, 16]
    - [213, 0.0]
  - - [43008, 64, 1, 64]
    - [262, 0.0]
  - - [25856, 32, 1, 32]
    - [213, 0.0]
  - - [42624, 64, 1, 64]
    - [255, 0.0]
  - - [31616, 16, 1, 16]
    - [231, 0.0]
  - - [21376, 32, 1, 32]
    - [212, 0.0]
  - - [19200, 64, 1, 64]
    - [265, 0.0]
  - - [22016, 16, 1, 16]
    - [231, 0.0]
  - - [1024, 32, 1, 32]
    - [216, 0.0]
  - - [29312, 32, 1, 32]
    - [236, 0.0]
  - - [12672, 32, 1, 32]
    - [212, 0.0]
  - - [36096, 64, 1, 64]
    - [262, 0.0]
  - - [40832, 16, 1, 16]
    - [216, 0.0]
  - - [16128, 32, 1, 32]
    - [212, 0.0]
  - - [32128, 64, 1, 64]
    - [280, 0.0]
  - - [2816, 64, 1, 64]
    - [248, 0.0]
  - - [20864, 16, 1, 16]
    - [231, 0.0]
  - - [43392, 32, 1, 32]
    - [221, 0.0]
  - - [16640, 64, 1, 64]
    - [245, 0.0]
  - - [35840, 16, 1, 16]
    - [212, 0.0]
  - - [24576, 64, 1, 64]
    - [264, 0.0]
  - - [33024, 16, 1, 16]
    - [213, 0.0]
  - - [32000, 32, 1, 32]
    - [216, 0.0]
  - - [24192, 64, 1, 64]
    - [264, 0.0]
  - - [35712, 32, 1, 32]
    - [221, 0.0]
  - - [33536, 64, 1, 64]
    - [264, 0.0]
  - - [44544, 16, 1, 16]
    - [216, 0.0]
  - - [30976, 16, 1, 16]
    - [213, 0.0]
  - - [10880, 32, 1, 32]
    - [231, 0.0]
  - - [512, 64, 1, 64]
    - [212, 0.0]
  - - [3840, 16, 1, 16]
    - [224, 0.0]
  - - [5632, 16, 1, 16]
    - [212, 0.0]
  - - [28800, 64, 1, 64]
    - [262, 0.0]
  - - [38272, 16, 1, 16]
    - [231, 0.0]
  - - [40960, 16, 1, 16]
    - [212, 0.0]
  - - [7680, 32, 1, 32]
    - [219, 0.0]
  - - [21376, 64, 1, 64]
    - [268, 0.0]
  - - [3200, 32, 1, 32]
    - [212, 0.0]
  - - [41984, 64, 1, 64]
    - [262, 0.0]
  - - [33536, 16, 1, 16]
    - [235, 0.0]
  - - [28928, 32, 1, 32]
    - [213, 0.0]
  - - [12928, 64, 1, 64]
    - [236, 0.0]
  - - [22400, 16, 1, 16]
    - [212, 0.0]
  - - [28544, 32, 1, 32]
    - [217, 0.0]
  - - [34560, 64, 1, 64]
    - [268, 0.0]
  - - [512, 16, 1, 16]
    - [212, 0.0]
  - - [20480, 32, 1, 32]
    - [216, 0.0]
  - - [22144, 16, 1, 16]
    - [212, 0.0]
  - - [20096, 32, 1, 32]
    - [212, 0.0]
  - - [9472, 16, 1, 16]
    - [212, 0.0]
  - - [7168, 32, 1, 32]
    - [231, 0.0]
  - - [43392, 16, 1, 16]
    - [216, 0.0]
  - - [8576, 32, 1, 32]
    - [231, 0.0]
  - - [37376, 32, 1, 32]
    - [231, 0.0]
  - - [30592, 64, 1, 64]
    - [268, 0.0]
  - - [18560, 16, 1, 16]
    - [212, 0.0]
  - - [32896, 32, 1, 32]
    - [235, 0.0]
  - - [22528, 64, 1, 64]
    - [280, 0.0]
  - - [5376, 32, 1, 32]
    - [212, 0.0]
  - - [27520, 16, 1, 16]
    - [213, 0.0]
  - - [33664, 32, 1, 32]
    - [235, 0.0]
  - - [34304, 16, 1, 16]
    - [212, 0.0]
  - - [13312, 32, 1, 32]
    - [212, 0.0]
  - - [35200, 64, 1, 64]
    - [282, 0.0]
  - - [2688, 16, 1, 16]
    - [233, 0.0]
  - - [41600, 32, 1, 32]
    - [216, 0.0]
  - - [26880, 16, 1, 16]
    - [213, 0.0]
  - - [39424, 64, 1, 64]
    - [262, 0.0]
  - - [12672, 64, 1, 64]
    - [240, 0.0]
  - - [36224, 16, 1, 16]
    - [231, 0.0]
  - - [17792, 32, 1, 32]
    - [216, 0.0]
  - - [44800, 64, 1, 64]
    - [269, 0.0]
  - - [15616, 64, 1, 64]
    - [228, 0.0]
  - - [25728, 32, 1, 32]
    - [213, 0.0]
  - - [39680, 16, 1, 16]
    - [216, 0.0]
  - - [35456, 64, 1, 64]
    - [262, 0.0]
  - - [16128, 64, 1, 64]
    - [229, 0.0]
  - - [10240, 32, 1, 32]
    - [246, 0.0]
  - - [44416, 64, 1, 64]
    - [278, 0.0]
  - - [44672, 16, 1, 16]
    - [221, 0.0]
  - - [26240, 32, 1, 32]
    - [217, 0.0]
  - - [24064, 64, 1, 64]
    - [264, 0.0]
  - - [23808, 16, 1, 16]
    - [232, 0.0]
  - - [6528, 64, 1, 64]
    - [271, 0.0]
  - - [384, 16, 1, 16]
    - [224, 0.0]
  - - [6528, 32, 1, 32]
    - [216, 0.0]
  - - [28928, 64, 1, 64]
    - [262, 0.0]
  - - [15360, 16, 1, 16]
    - [218, 0.0]
  - - [35328, 32, 1, 32]
    - [212, 0.0]
  - - [39040, 32, 1, 32]
    - [216, 0.0]
  - - [36864, 64, 1, 64]
    - [280, 0.0]
  - - [27904, 32, 1, 32]
    - [232, 0.0]
  - - [3712, 64, 1, 64]
    - [274, 0.0]
  - - [33664, 16, 1, 16]
    - [216, 0.0]
  - - [15232, 32, 1, 32]
    - [212, 0.0]
  - - [40448, 16, 1, 16]
    - [212, 0.0]
  - - [8576, 64, 1, 64]
    - [236, 0.0]
  - - [41600, 16, 1, 16]
    - [216, 0.0]
  - - [29184, 64, 1, 64]
    - [264, 0.0]
  - - [8832, 16, 1, 16]
    - [212, 0.0]
  - - [27392, 32, 1, 32]
    - [213, 0.0]
  - - [24704, 64, 1, 64]
    - [264, 0.0]
  - - [17792, 16, 1, 16]
    - [212, 0.0]
  - - [32128, 32, 1, 32]
    - [216, 0.0]
  - - [24832, 16, 1, 16]
    - [242, 0.0]
  - - [3584, 32, 1, 32]
    - [231, 0.0]
  - - [25728, 16, 1, 16]
    - [213, 0.0]
  - - [31872, 32, 1, 32]
    - [212, 0.0]
  - - [29440, 16, 1, 16]
    - [213, 0.0]
  - - [24832, 32, 1, 32]
    - [222, 0.0]
  - - [41600, 64, 1, 64]
    - [262, 0.0]
  - - [1920, 16, 1, 16]
    - [233, 0.0]
  - - [24448, 32, 1, 32]
    - [217, 0.0]
  - - [14080, 64, 1, 64]
    - [262, 0.0]
  - - [12800, 16, 1, 16]
    - [231, 0.0]
  - - [25984, 64, 1, 64]
    - [280, 0.0]
  - - [16000, 32, 1, 32]
    - [212, 0.0]
  - - [38400, 64, 1, 64]
    - [264, 0.0]
  - - [12928, 32, 1, 32]
    - [212, 0.0]
  - - [39296, 16, 1, 16]
    - [231, 0.0]
  - - [37248, 32, 1, 32]
    - [231, 0.0]
  - - [26880, 64, 1, 64]
    - [264, 0.0]
  - - [33280, 32, 1, 32]
    - [221, 0.0]
  - - [10112, 64, 1, 64]
    - [260, 0.0]
  - - [34816, 64, 1, 64]
    - [281, 0.0]
  - - [38656, 16, 1, 16]
    - [212, 0.0]
  - - [17664, 32, 1, 32]
    - [212, 0.0]
  - - [34432, 64, 1, 64]
    - [280, 0.0]
  - - [23424, 16, 1, 16]
    - [213, 0.0]
  - - [43008, 16, 1, 16]
    - [235, 0.0]
  - - [43776, 64, 1, 64]
    - [278, 0.0]
  - - [25600, 32, 1, 32]
    - [222, 0.0]
  - - [31360, 16, 1, 16]
    - [217, 0.0]
  - - [21120, 32, 1, 32]
    - [212, 0.0]
  - - [12544, 32, 1, 32]
    - [212, 0.0]
  - - [1792, 32, 1, 32]
    - [234, 0.0]
  - - [30080, 32, 1, 32]
    - [217, 0.0]
  - - [9728, 32, 1, 32]
    - [212, 0.0]
  - - [40064, 16, 1, 16]
    - [216, 0.0]
  - - [5248, 32, 1, 32]
    - [212, 0.0]
  - - [11264, 64, 1, 64]
    - [277, 0.0]
  - - [3840, 32, 1, 32]
    - [231, 0.0]
  - - [32640, 16, 1, 16]
    - [212, 0.0]
  - - [43520, 16, 1, 16]
    - [212, 0.0]
  - - [5760, 32, 1, 32]
    - [212, 0.0]
  - - [36352, 64, 1, 64]
    - [278, 0.0]
  - - [3328, 16, 1, 16]
    - [214, 0.0]
  - - [10752, 64, 1, 64]
    - [263, 0.0]
  - - [12672, 16, 1, 16]
    - [212, 0.0]
  - - [2432, 32, 1, 32]
    - [212, 0.0]
  - - [8448, 64, 1, 64]
    - [231, 0.0]
  - - [27648, 16, 1, 16]
    - [232, 0.0]
  - - [31232, 32, 1, 32]
    - [221, 0.0]
  - - [8064, 64, 1, 64]
    - [231, 0.0]
  - - [36992, 16, 1, 16]
    - [212, 0.0]
  - - [16000, 64, 1, 64]
    - [227, 0.0]
  - - [25344, 64, 1, 64]
    - [264, 0.0]
  - - [3584, 16, 1, 16]
    - [224, 0.0]
  - - [15360, 32, 1, 32]
    - [212, 0.0]
  - - [20864, 64, 1, 64]
    - [284, 0.0]
  - - [21120, 16, 1, 16]
    - [212, 0.0]
  - - [2688, 32, 1, 32]
    - [212, 0.0]
  - - [6784, 16, 1, 16]
    - [212, 0.0]
  - - [14592, 16, 1, 16]
    - [238, 0.0]
  - - [30080, 16, 1, 16]
    - [240, 0.0]
  - - [11648, 32, 1, 32]
    - [212, 0.0]
  - - [9472, 64, 1, 64]
    - [239, 0.0]
  - - [32768, 16, 1, 16]
    - [212, 0.0]
  - - [32256, 32, 1, 32]
    - [216, 0.0]
  - - [5248, 16, 1, 16]
    - [212, 0.0]
  - - [1024, 64, 1, 64]
    - [246, 0.0]
  - - [25344, 16, 1, 16]
    - [217, 0.0]
  - - [37504, 64, 1, 64]
    - [268, 0.0]
  - - [14208, 16, 1, 16]
    - [218, 0.0]
  - - [20352, 32, 1, 32]
    - [221, 0.0]
  - - [38272, 64, 1, 64]
    - [268, 0.0]
  - - [13952, 16, 1, 16]
    - [216, 0.0]
  - - [11904, 32, 1, 32]
    - [212, 0.0]
  - - [17920, 64, 1, 64]
    - [265, 0.0]
  - - [34048, 16, 1, 16]
    - [212, 0.0]
  - - [9984, 32, 1, 32]
    - [212, 0.0]
  - - [21632, 64, 1, 64]
    - [284, 0.0]
  - - [35200, 16, 1, 16]
    - [216, 0.0]
  - - [39168, 64, 1, 64]
    - [266, 0.0]
  - - [41984, 16, 1, 16]
    - [235, 0.0]
  - - [44544, 48, 1, 48]
    - [223, 0.0]
  - - [12032, 32, 1, 32]
    - [212, 0.0]
  - - [43136, 16, 1, 16]
    - [216, 0.0]
  - - [24704, 32, 1, 32]
    - [220, 0.0]
  - - [18176, 16, 1, 16]
    - [231, 0.0]
  - - [29952, 32, 1, 32]
    - [213, 0.0]
  - - [13952, 64, 1, 64]
    - [255, 0.0]
  - - [19328, 16, 1, 16]
    - [212, 0.0]
  - - [25472, 32, 1, 32]
    - [217, 0.0]
  - - [26112, 16, 1, 16]
    - [213, 0.0]
  - - [5120, 32, 1, 32]
    - [212, 0.0]
  - - [27008, 64, 1, 64]
    - [280, 0.0]
  - - [27264, 16, 1, 16]
    - [232, 0.0]
  - - [256, 64, 1, 64]
    - [234, 0.0]
  - - [14080, 32, 1, 32]
    - [212, 0.0]
  - - [9600, 32, 1, 32]
    - [212, 0.0]
  - - [7424, 64, 1, 64]
    - [249, 0.0]
  - - [6144, 16, 1, 16]
    - [212, 0.0]
  - - [43904, 64, 1, 64]
    - [262, 0.0]
  - - [19584, 16, 1, 16]
    - [212, 0.0]
  - - [7168, 64, 1, 64]
    - [272, 0.0]
  - - [12160, 16, 1, 16]
    - [216, 0.0]
  - - [40704, 64, 1, 64]
    - [262, 0.0]
  - - [23040, 16, 1, 16]
    - [212, 0.0]
  - - [34816, 32, 1, 32]
    - [231, 0.0]
  - - [36224, 64, 1, 64]
    - [284, 0.0]
  - - [3712, 16, 1, 16]
    - [212, 0.0]
  - - [18048, 32, 1, 32]
    - [212, 0.0]
  - - [15872, 64, 1, 64]
    - [229, 0.0]
  - - [14464, 64, 1, 64]
    - [257, 0.0]
  - - [22784, 16, 1, 16]
    - [212, 0.0]
  - - [11392, 64, 1, 64]
    - [254, 0.0]
  - - [24960, 16, 1, 16]
    - [213, 0.0]
  - - [31104, 32, 1, 32]
    - [221, 0.0]
  - - [39936, 16, 1, 16]
    - [216, 0.0]
  - - [28672, 64, 1, 64]
    - [262, 0.0]
  - - [28288, 64, 1, 64]
    - [281, 0.0]
  - - [7040, 32, 1, 32]
    - [212, 0.0]
  - - [39680, 32, 1, 32]
    - [216, 0.0]
  - - [4864, 64, 1, 64]
    - [252, 0.0]
  - - [11264, 32, 1, 32]
    - [212, 0.0]
  - - [2816, 32, 1, 32]
    - [212, 0.0]
  - - [384, 64, 1, 64]
    - [253, 0.0]
  - - [33408, 16, 1, 16]
    - [216, 0.0]
  - - [14976, 32, 1, 32]
    - [212, 0.0]
  - - [20992, 64, 1, 64]
    - [268, 0.0]
  - - [12544, 16, 1, 16]
    - [212, 0.0]
  - - [7552, 16, 1, 16]
    - [212, 0.0]
  - - [42368, 16, 1, 16]
    - [216, 0.0]
  - - [23936, 32, 1, 32]
    - [217, 0.0]
  - - [28672, 16, 1, 16]
    - [232, 0.0]
  - - [28160, 32, 1, 32]
    - [240, 0.0]
  - - [9088, 64, 1, 64]
    - [219, 0.0]
  - - [17536, 16, 1, 16]
    - [231, 0.0]
  - - [23680, 32, 1, 32]
    - [217, 0.0]
  - - [21248, 16, 1, 16]
    - [231, 0.0]
  - - [640, 64, 1, 64]
    - [212, 0.0]
  - - [26496, 16, 1, 16]
    - [232, 0.0]
  - - [16256, 32, 1, 32]
    - [212, 0.0]
  - - [37632, 32, 1, 32]
    - [216, 0.0]
  - - [5888, 64, 1, 64]
    - [254, 0.0]
  - - [37376, 16, 1, 16]
    - [231, 0.0]
  - - [8192, 32, 1, 32]
    - [270, 0.0]
  - - [17792, 64, 1, 64]
    - [265, 0.0]
  - - [42624, 16, 1, 16]
    - [241, 0.0]
  - - [30208, 64, 1, 64]
    - [264, 0.0]
  - - [5504, 32, 1, 32]
    - [212, 0.0]
  - - [17536, 64, 1, 64]
    - [283, 0.0]
  - - [31104, 16, 1, 16]
    - [213, 0.0]
  - - [29056, 32, 1, 32]
    - [222, 0.0]
  - - [18688, 16, 1, 16]
    - [212, 0.0]
  - - [21504, 16, 1, 16]
    - [231, 0.0]
  - - [1920, 64, 1, 64]
    - [216, 0.0]
  - - [26624, 64, 1, 64]
    - [280, 0.0]
  - - [30464, 16, 1, 16]
    - [236, 0.0]
  - - [26240, 64, 1, 64]
    - [264, 0.0]
  - - [15232, 16, 1, 16]
    - [231, 0.0]
  - - [43520, 64, 1, 64]
    - [278, 0.0]
  - - [640, 32, 1, 32]
    - [233, 0.0]
  - - [40320, 16, 1, 16]
    - [212, 0.0]
  - - [19712, 64, 1, 64]
    - [268, 0.0]
  - - [34304, 32, 1, 32]
    - [212, 0.0]
  - - [36864, 16, 1, 16]
    - [231, 0.0]
  - - [39808, 64, 1, 64]
    - [281, 0.0]
  - - [31872, 16, 1, 16]
    - [213, 0.0]
  - - [35840, 64, 1, 64]
    - [268, 0.0]
  - - [43776, 16, 1, 16]
    - [235, 0.0]
  - - [39552, 64, 1, 64]
    - [262, 0.0]
  - - [24448, 16, 1, 16]
    - [217, 0.0]
  - - [35072, 16, 1, 16]
    - [212, 0.0]
  - - [35328, 16, 1, 16]
    - [216, 0.0]
  - - [31744, 16, 1, 16]
    - [236, 0.0]
  - - [15744, 64, 1, 64]
    - [230, 0.0]
  - - [30336, 32, 1, 32]
    - [232, 0.0]
  - - [41216, 16, 1, 16]
    - [212, 0.0]
  - - [29440, 32, 1, 32]
    - [213, 0.0]
  - - [3328, 64, 1, 64]
    - [247, 0.0]
  - - [27008, 32, 1, 32]
    - [222, 0.0]
  - - [19456, 16, 1, 16]
    - [231, 0.0]
  - - [19200, 32, 1, 32]
    - [212, 0.0]
  - - [32640, 64, 1, 64]
    - [268, 0.0]
  - - [43136, 32, 1, 32]
    - [212, 0.0]
  - - [41856, 16, 1, 16]
    - [216, 0.0]
  - - [13056, 32, 1, 32]
    - [231, 0.0]
  - - [15616, 32, 1, 32]
    - [231, 0.0]
  - - [37760, 16, 1, 16]
    - [235, 0.0]
  - - [19328, 32, 1, 32]
    - [212, 0.0]
  - - [17152, 64, 1, 64]
    - [230, 0.0]
  - - [28160, 16, 1, 16]
    - [213, 0.0]
  - - [39936, 32, 1, 32]
    - [221, 0.0]
  - - [3072, 16, 1, 16]
    - [233, 0.0]
  - - [2048, 16, 1, 16]
    - [212, 0.0]
  - - [21888, 16, 1, 16]
    - [212, 0.0]
  - - [36224, 32, 1, 32]
    - [235, 0.0]
  - - [34048, 64, 1, 64]
    - [264, 0.0]
  - - [24576, 16, 1, 16]
    - [220, 0.0]
  - - [29824, 16, 1, 16]
    - [232, 0.0]
  - - [25600, 64, 1, 64]
    - [280, 0.0]
  - - [17152, 16, 1, 16]
    - [231, 0.0]
  - - [12160, 32, 1, 32]
    - [212, 0.0]
  - - [18176, 64, 1, 64]
    - [267, 0.0]
  - - [5760, 16, 1, 16]
    - [234, 0.0]
  - - [3712, 32, 1, 32]
    - [234, 0.0]
  - - [42496, 64, 1, 64]
    - [278, 0.0]
  - - [1536, 32, 1, 32]
    - [212, 0.0]
  - - [27008, 16, 1, 16]
    - [236, 0.0]
  - - [30976, 64, 1, 64]
    - [258, 0.0]
  - - [33792, 16, 1, 16]
    - [212, 0.0]
  - - [20992, 32, 1, 32]
    - [231, 0.0]
  - - [2176, 16, 1, 16]
    - [234, 0.0]
  - - [16512, 32, 1, 32]
    - [231, 0.0]
  - - [6144, 64, 1, 64]
    - [275, 0.0]
  - - [42752, 16, 1, 16]
    - [216, 0.0]
  - - [38528, 64, 1, 64]
    - [266, 0.0]
  - - [11136, 16, 1, 16]
    - [212, 0.0]
  - - [17280, 32, 1, 32]
    - [231, 0.0]
  - - [17920, 16, 1, 16]
    - [231, 0.0]
  - - [18816, 64, 1, 64]
    - [281, 0.0]
  - - [25216, 32, 1, 32]
    - [222, 0.0]
  - - [23040, 64, 1, 64]
    - [264, 0.0]
  - - [7808, 64, 1, 64]
    - [242, 0.0]
  - - [38656, 32, 1, 32]
    - [216, 0.0]
  - - [43136, 64, 1, 64]
    - [262, 0.0]
  - - [19840, 16, 1, 16]
    - [212, 0.0]
  - - [1408, 32, 1, 32]
    - [212, 0.0]
  - - [32512, 32, 1, 32]
    - [212, 0.0]
  - - [30720, 16, 1, 16]
    - [213, 0.0]
  - - [35712, 64, 1, 64]
    - [264, 0.0]
  - - [44160, 16, 1, 16]
    - [221, 0.0]
  - - [9344, 32, 1, 32]
    - [246, 0.0]
  - - [31744, 64, 1, 64]
    - [268, 0.0]
  - - [23296, 16, 1, 16]
    - [212, 0.0]
  - - [43264, 32, 1, 32]
    - [235, 0.0]
  - - [19072, 64, 1, 64]
    - [281, 0.0]
  - - [36736, 16, 1, 16]
    - [212, 0.0]
  - - [42880, 32, 1, 32]
    - [212, 0.0]
  - - [28032, 64, 1, 64]
    - [265, 0.0]
  - - [28288, 16, 1, 16]
    - [213, 0.0]
  - - [9856, 32, 1, 32]
    - [212, 0.0]
  - - [7680, 64, 1, 64]
    - [275, 0.0]
  - - [7424, 16, 1, 16]
    - [212, 0.0]
  - - [7040, 64, 1, 64]
    - [273, 0.0]
  - - [35968, 64, 1, 64]
    - [264, 0.0]
  - - [12544, 64, 1, 64]
    - [240, 0.0]
  - - [18944, 32, 1, 32]
    - [212, 0.0]
  - - [41088, 16, 1, 16]
    - [212, 0.0]
  - - [22656, 32, 1, 32]
    - [235, 0.0]
  - - [20480, 64, 1, 64]
    - [268, 0.0]
  - - [11520, 32, 1, 32]
    - [215, 0.0]
  - - [17280, 16, 1, 16]
    - [212, 0.0]
  - - [29440, 64, 1, 64]
    - [278, 0.0]
  - - [24064, 16, 1, 16]
    - [217, 0.0]
  - - [35840, 32, 1, 32]
    - [212, 0.0]
  - - [25216, 16, 1, 16]
    - [236, 0.0]
  - - [39552, 32, 1, 32]
    - [221, 0.0]
  - - [12800, 64, 1, 64]
    - [240, 0.0]
  - - [37120, 16, 1, 16]
    - [212, 0.0]
  - - [13440, 16, 1, 16]
    - [212, 0.0]
  - - [8320, 64, 1, 64]
    - [236, 0.0]
  - - [1408, 16, 1, 16]
    - [224, 0.0]
  - - [15744, 32, 1, 32]
    - [231, 0.0]
  - - [20480, 16, 1, 16]
    - [212, 0.0]
  - - [33664, 64, 1, 64]
    - [284, 0.0]
  - - [9344, 16, 1, 16]
    - [212, 0.0]
  - - [15488, 32, 1, 32]
    - [212, 0.0]
  - - [37888, 64, 1, 64]
    - [280, 0.0]
  - - [13056, 16, 1, 16]
    - [215, 0.0]
  - - [8448, 32, 1, 32]
    - [212, 0.0]
  - - [25216, 64, 1, 64]
    - [264, 0.0]
  - - [8064, 32, 1, 32]
    - [215, 0.0]
  - - [32768, 32, 1, 32]
    - [216, 0.0]
  - - [9600, 64, 1, 64]
    - [239, 0.0]
  - - [34432, 16, 1, 16]
    - [212, 0.0]
  - - [22016, 64, 1, 64]
    - [268, 0.0]
  - - [38144, 16, 1, 16]
    - [221, 0.0]
  - - [13440, 32, 1, 32]
    - [231, 0.0]
  - - [42112, 64, 1, 64]
    - [264, 0.0]
  - - [22912, 16, 1, 16]
    - [231, 0.0]
  - - [20864, 32, 1, 32]
    - [216, 0.0]
  - - [10496, 64, 1, 64]
    - [275, 0.0]
  - - [16896, 32, 1, 32]
    - [212, 0.0]
  - - [30848, 16, 1, 16]
    - [236, 0.0]
  - - [18432, 64, 1, 64]
    - [281, 0.0]
  - - [22272, 16, 1, 16]
    - [231, 0.0]
  - - [1280, 32, 1, 32]
    - [215, 0.0]
  - - [18048, 64, 1, 64]
    - [265, 0.0]
  - - [7040, 16, 1, 16]
    - [212, 0.0]
  - - [29568, 32, 1, 32]
    - [213, 0.0]
  - - [27392, 64, 1, 64]
    - [265, 0.0]
  - - [30208, 16, 1, 16]
    - [213, 0.0]
  - - [9216, 32, 1, 32]
    - [215, 0.0]
  - - [14976, 16, 1, 16]
    - [231, 0.0]
  - - [4736, 32, 1, 32]
    - [212, 0.0]
  - - [35328, 64, 1, 64]
    - [268, 0.0]
  - - [6656, 32, 1, 32]
    - [212, 0.0]
  - - [39040, 64, 1, 64]
    - [255, 0.0]
  - - [32128, 16, 1, 16]
    - [231, 0.0]
  - - [13696, 32, 1, 32]
    - [212, 0.0]
  - - [44288, 64, 1, 64]
    - [262, 0.0]
  - - [21248, 32, 1, 32]
    - [212, 0.0]
  - - [31616, 64, 1, 64]
    - [280, 0.0]
  - - [23680, 16, 1, 16]
    - [212, 0.0]
  - - [24320, 32, 1, 32]
    - [222, 0.0]
  - - [35584, 16, 1, 16]
    - [231, 0.0]
  - - [39168, 32, 1, 32]
    - [221, 0.0]
  - - [39168, 16, 1, 16]
    - [212, 0.0]
  - - [31360, 64, 1, 64]
    - [281, 0.0]
  - - [16256, 16, 1, 16]
    - [212, 0.0]
  - - [38784, 32, 1, 32]
    - [235, 0.0]
  - - [44800, 64, 1, 64]
    - [262, 0.0]
  - - [27136, 16, 1, 16]
    - [236, 0.0]
  - - [38912, 32, 1, 32]
    - [216, 0.0]
  - - [40320, 64, 1, 64]
    - [262, 0.0]
  - - [40576, 16, 1, 16]
    - [212, 0.0]
  - - [19968, 64, 1, 64]
    - [282, 0.0]
  - - [3072, 64, 1, 64]
    - [247, 0.0]
  - - [11264, 16, 1, 16]
    - [212, 0.0]
  - - [14848, 32, 1, 32]
    - [238, 0.0]
  - - [20608, 16, 1, 16]
    - [212, 0.0]
  - - [34944, 32, 1, 32]
    - [216, 0.0]
  - - [32768, 64, 1, 64]
    - [264, 0.0]
  - - [44800, 16, 1, 16]
    - [212, 0.0]
  - - [40192, 32, 1, 32]
    - [231, 0.0]
  - - [29568, 16, 1, 16]
    - [213, 0.0]
  - - [43904, 32, 1, 32]
    - [216, 0.0]
  - - [8960, 64, 1, 64]
    - [231, 0.0]
  - - [44544, 192, 1, 192]
    - [285, 0.0]
  - - [4480, 64, 1, 64]
    - [271, 0.0]
  - - [4736, 16, 1, 16]
    - [212, 0.0]
  - - [41472, 64, 1, 64]
    - [262, 0.0]
  - - [6016, 16, 1, 16]
    - [234, 0.0]
  - - [11008, 16, 1, 16]
    - [234, 0.0]
  - - [36992, 64, 1, 64]
    - [268, 0.0]
  - - [13696, 16, 1, 16]
    - [234, 0.0]
  - - [16384, 16, 1, 16]
    - [216, 0.0]
  - - [15872, 32, 1, 32]
    - [212, 0.0]
  - - [29568, 64, 1, 64]
    - [264, 0.0]
  - - [44160, 32, 1, 32]
    - [216, 0.0]
  - - [8960, 16, 1, 16]
    - [212, 0.0]
  - - [37120, 32, 1, 32]
    - [235, 0.0]
  - - [21120, 64, 1, 64]
    - [264, 0.0]
  - - [3968, 32, 1, 32]
    - [212, 0.0]
  - - [42752, 64, 1, 64]
    - [262, 0.0]
  - - [41472, 16, 1, 16]
    - [212, 0.0]
  - - [28672, 32, 1, 32]
    - [213, 0.0]
  - - [21888, 64, 1, 64]
    - [284, 0.0]
  - - [1536, 64, 1, 64]
    - [212, 0.0]
  - - [17664, 16, 1, 16]
    - [212, 0.0]
  - - [14592, 32, 1, 32]
    - [212, 0.0]
  - - [5248, 64, 1, 64]
    - [252, 0.0]
  - - [18816, 16, 1, 16]
    - [212, 0.0]
  - - [22784, 64, 1, 64]
    - [284, 0.0]
  - - [25600, 16, 1, 16]
    - [220, 0.0]
  - - [38784, 64, 1, 64]
    - [276, 0.0]
  - - [26752, 16, 1, 16]
    - [232, 0.0]
  - - [8320, 32, 1, 32]
    - [212, 0.0]
  - - [30720, 64, 1, 64]
    - [262, 0.0]
  - - [1792, 16, 1, 16]
    - [212, 0.0]
  - - [13568, 32, 1, 32]
    - [234, 0.0]
  - - [36608, 32, 1, 32]
    - [216, 0.0]
  - - [2944, 16, 1, 16]
    - [234, 0.0]
  - - [9088, 32, 1, 32]
    - [246, 0.0]
  - - [39680, 64, 1, 64]
    - [282, 0.0]
  - - [9728, 16, 1, 16]
    - [212, 0.0]
  - - [10624, 64, 1, 64]
    - [254, 0.0]
  - - [10880, 16, 1, 16]
    - [212, 0.0]
  - - [11776, 64, 1, 64]
    - [236, 0.0]
  - - [34944, 64, 1, 64]
    - [268, 0.0]
  - - [44416, 16, 1, 16]
    - [212, 0.0]
  - - [38400, 32, 1, 32]
    - [216, 0.0]
  - - [44800, 32, 1, 32]
    - [217, 0.0]
  - - [27520, 64, 1, 64]
    - [276, 0.0]
  - - [3200, 16, 1, 16]
    - [216, 0.0]
  - - [33920, 32, 1, 32]
    - [235, 0.0]
  - - [35072, 32, 1, 32]
    - [212, 0.0]
  - - [43648, 64, 1, 64]
    - [262, 0.0]
  - - [34688, 32, 1, 32]
    - [212, 0.0]
  - - [24320, 64, 1, 64]
    - [280, 0.0]
  - - [6656, 16, 1, 16]
    - [212, 0.0]
  - - [18432, 32, 1, 32]
    - [212, 0.0]
  - - [19840, 64, 1, 64]
    - [284, 0.0]
  - - [1664, 32, 1, 32]
    - [212, 0.0]
  - - [32000, 16, 1, 16]
    - [242, 0.0]
  - - [6784, 64, 1, 64]
    - [249, 0.0]
  - - [8576, 16, 1, 16]
    - [212, 0.0]
  - - [14720, 32, 1, 32]
    - [212, 0.0]
  - - [37120, 64, 1, 64]
    - [284, 0.0]
  - - [23552, 16, 1, 16]
    - [231, 0.0]
  - - [43520, 32, 1, 32]
    - [212, 0.0]
  - - [36736, 64, 1, 64]
    - [268, 0.0]
  - - [32896, 16, 1, 16]
    - [212, 0.0]
  - - [12288, 64, 1, 64]
    - [222, 0.0]
  - - [40704, 16, 1, 16]
    - [235, 0.0]
  - - [36096, 32, 1, 32]
    - [212, 0.0]
  - - [11904, 64, 1, 64]
    - [240, 0.0]
  - - [16640, 16, 1, 16]
    - [212, 0.0]
  - - [17024, 16, 1, 16]
    - [231, 0.0]
  - - [4608, 64, 1, 64]
    - [271, 0.0]
  - - [8064, 16, 1, 16]
    - [212, 0.0]
  - - [32896, 64, 1, 64]
    - [264, 0.0]
  - - [25984, 16, 1, 16]
    - [213, 0.0]
  - - [7552, 32, 1, 32]
    - [212, 0.0]
  - - [38144, 64, 1, 64]
    - [264, 0.0]
  - - [12288, 16, 1, 16]
    - [212, 0.0]
  - - [11776, 32, 1, 32]
    - [212, 0.0]
  - - [1152, 16, 1, 16]
    - [244, 0.0]
  - - [7296, 32, 1, 32]
    - [214, 0.0]
  - - [29696, 64, 1, 64]
    - [264, 0.0]
  - - [4864, 16, 1, 16]
    - [224, 0.0]
  - - [33024, 32, 1, 32]
    - [212, 0.0]
  - - [10112, 16, 1, 16]
    - [212, 0.0]
  - - [20992, 16, 1, 16]
    - [212, 0.0]
  - - [32816, 128, 1, 128]
    - [306, 0.0]
  - - [5936, 128, 1, 128]
    - [309, 0.0]
  - - [37168, 128, 1, 128]
    - [308, 0.0]
  - - [42288, 128, 1, 128]
    - [306, 0.0]
  - - [12336, 128, 1, 128]
    - [305, 0.0]
  - - [21808, 128, 1, 128]
    - [306, 0.0]
  - - [10544, 128, 1, 128]
    - [307, 0.0]
  - - [26160, 128, 1, 128]
    - [308, 0.0]
  - - [16944, 128, 1, 128]
    - [307, 0.0]
  - - [28720, 128, 1, 128]
    - [308, 0.0]
  - - [17200, 128, 1, 128]
    - [307, 0.0]
  - - [4656, 128, 1, 128]
    - [301, 0.0]
  - - [3120, 128, 1, 128]
    - [307, 0.0]
  - - [17712, 128, 1, 128]
    - [307, 0.0]
  - - [30512, 128, 1, 128]
    - [308, 0.0]
  - - [7728, 128, 1, 128]
    - [289, 0.0]
  - - [39472, 128, 1, 128]
    - [306, 0.0]
  - - [3888, 128, 1, 128]
    - [299, 0.0]
  - - [35120, 128, 1, 128]
    - [306, 0.0]
  - - [2096, 128, 1, 128]
    - [297, 0.0]
  - - [40752, 128, 1, 128]
    - [308, 0.0]
  - - [26928, 128, 1, 128]
    - [308, 0.0]
  - - [1328, 128, 1, 128]
    - [299, 0.0]
  - - [41264, 128, 1, 128]
    - [308, 0.0]
  - - [23088, 128, 1, 128]
    - [308, 0.0]
  - - [8496, 128, 1, 128]
    - [287, 0.0]
  - - [32560, 128, 1, 128]
    - [308, 0.0]
  - - [14896, 128, 1, 128]
    - [307, 0.0]
  - - [24368, 128, 1, 128]
    - [306, 0.0]
  - - [37936, 128, 1, 128]
    - [308, 0.0]
  - - [1072, 128, 1, 128]
    - [304, 0.0]
  - - [23344, 128, 1, 128]
    - [307, 0.0]
  - - [29744, 128, 1, 128]
    - [306, 0.0]
  - - [23856, 128, 1, 128]
    - [307, 0.0]
  - - [9264, 128, 1, 128]
    - [307, 0.0]
  - - [36400, 128, 1, 128]
    - [306, 0.0]
  - - [34352, 128, 1, 128]
    - [306, 0.0]
  - - [39216, 128, 1, 128]
    - [306, 0.0]
  - - [15664, 128, 1, 128]
    - [308, 0.0]
  - - [41008, 128, 1, 128]
    - [306, 0.0]
