library/src/blas3/Tensile/Logic/asm_full/arcturus_Cijk_Ailk_Bljk_BBH.yaml
- {MinimumRequiredVersion: 4.14.0}
- arcturus
- gfx908
- [Device 7380, Device 7388, Device 738c, Device 7390]
    SolutionIndex: 0
    SolutionNameMin: Cijk_Ailk_Bljk_BBH_MT64x128x32_MI32x32x2x2_SE_GRVW2_ONLL1_SNLL1
    SolutionIndex: 1
    SolutionNameMin: Cijk_Ailk_Bljk_BBH_MT64x128x8_MI32x32x2x2_SE_AF0EM1_ASEM1_GRVW2_ONLL0_SNLL1
    SolutionIndex: 2
    SolutionNameMin: Cijk_Ailk_Bljk_BBH_MT64x256x8_MI32x32x2x2_SE_AF0EM2_ASEM1_GRVW2_ONLL0_SNLL0
    SolutionIndex: 3
    SolutionIndex: 4
    SolutionIndex: 5
    SolutionIndex: 6
    SolutionIndex: 7
    SolutionIndex: 8
    SolutionIndex: 9
    SolutionIndex: 10
    SolutionIndex: 11
    SolutionIndex: 12
    SolutionIndex: 13
    SolutionIndex: 14
    SolutionIndex: 15
    SolutionIndex: 16
    SolutionIndex: 17
    SolutionIndex: 18
    SolutionIndex: 19
    SolutionIndex: 20
    SolutionIndex: 21
    SolutionIndex: 22
    SolutionIndex: 23
    SolutionIndex: 24
    SolutionIndex: 25
    SolutionIndex: 26
    SolutionIndex: 27
    SolutionIndex: 28
    SolutionIndex: 29
    SolutionIndex: 30
    SolutionIndex: 31
    SolutionIndex: 32
    SolutionIndex: 33
    SolutionIndex: 34
    SolutionIndex: 35
    SolutionIndex: 36
    SolutionIndex: 37
    SolutionIndex: 38
    SolutionIndex: 39
    SolutionIndex: 40
    SolutionIndex: 41
    SolutionIndex: 42
    SolutionIndex: 43
    SolutionIndex: 44
    SolutionIndex: 45
    SolutionIndex: 46
    SolutionIndex: 47
    SolutionIndex: 48
    SolutionIndex: 49
    SolutionIndex: 50
    SolutionIndex: 51
    SolutionIndex: 52
    SolutionIndex: 53
    SolutionIndex: 54
    SolutionIndex: 55
    SolutionIndex: 56
    SolutionIndex: 57
    SolutionIndex: 58
    SolutionIndex: 59
    SolutionIndex: 60
    SolutionIndex: 61
    SolutionIndex: 62
    SolutionIndex: 63
    SolutionIndex: 64
    SolutionIndex: 65
    SolutionIndex: 66
    SolutionIndex: 67
    SolutionIndex: 68
    SolutionIndex: 69
    SolutionIndex: 70
    SolutionIndex: 71
    SolutionIndex: 72
    SolutionIndex: 73
    SolutionIndex: 74
    SolutionIndex: 75
    SolutionIndex: 76
    SolutionIndex: 77
    SolutionIndex: 78
    SolutionIndex: 79
    SolutionIndex: 80
    SolutionIndex: 81
    SolutionIndex: 82
    SolutionIndex: 83
    SolutionIndex: 84
    SolutionNameMin: Cijk_Ailk_Bljk_BBH_MT64x32x32_MI16x16x8x1_SE_AF0EM4_GRVW2_LBSPP128_LPB2_NLCA1_SU0_SUS256_SRVW4_TT2_16_WG32_8_1_WGM1
    SolutionIndex: 85
    SolutionNameMin: Cijk_Ailk_Bljk_BBH_MT32x64x64_MI16x16x8x1_SE_AF0EM4_GRVW8_LBSPP128_LPB8_NLCA1_SU32_SUS256_SRVW0_TT1_32_WG32_8_1_WGM1
    SolutionIndex: 86
    SolutionNameMin: Cijk_Ailk_Bljk_BBH_MT64x128x32_MI32x32x4x1_SE_AF0EM4_GRVW4_LBSPP128_LPB4_NLCA1_SU0_SUS256_SRVW4_TT1_64_WG64_4_1_WGM15
    SolutionIndex: 87
    SolutionNameMin: Cijk_Ailk_Bljk_BBH_MT128x160x32_MI32x32x4x1_SE_AF0EM4_GRVW4_LBSPP128_LPB4_NLCA1_SU0_SUS256_SRVW0_TT1_160_WG128_2_1_WGM2
    SolutionIndex: 88
    SolutionNameMin: Cijk_Ailk_Bljk_BBH_MT32x32x32_MI16x16x8x1_SE_AF0EM1_GRVW2_LBSPP128_LPB2_NLCA1_SU0_SUS256_SRVW0_TT1_16_WG32_8_1_WGM1
    SolutionIndex: 89
    SolutionNameMin: Cijk_Ailk_Bljk_BBH_MT64x128x32_MI32x32x4x1_SE_AF0EM4_GRVW8_LBSPP128_LPB8_NLCA1_SU0_SUS256_SRVW4_TT1_64_WG64_4_1_WGM1
    SolutionIndex: 90
    SolutionNameMin: Cijk_Ailk_Bljk_BBH_MT32x32x128_MI16x16x8x1_SE_AF0EM4_GRVW2_LBSPP256_LPB2_NLCA1_SU16_SUS256_SRVW0_TT1_16_WG32_8_1_WGM1
    SolutionIndex: 91
    SolutionNameMin: Cijk_Ailk_Bljk_BBH_MT32x32x64_MI16x16x8x1_SE_AF0EM4_GRVW4_LBSPP128_LPB4_NLCA1_SU16_SUS256_SRVW0_TT1_16_WG32_8_1_WGM1
    SolutionIndex: 92
    SolutionNameMin: Cijk_Ailk_Bljk_BBH_MT32x32x128_MI16x16x8x1_SE_AF0EM1_GRVW8_LBSPP256_LPB8_NLCA1_SU32_SUS256_SRVW0_TT1_16_WG32_8_1_WGM1
    SolutionIndex: 93
    SolutionNameMin: Cijk_Ailk_Bljk_BBH_MT64x80x64_MI16x16x8x1_SE_AF0EM4_GRVW4_LBSPP128_LPB4_NLCA1_SU0_SUS256_SRVW0_TT1_80_WG64_4_1_WGM2
    SolutionIndex: 94
    SolutionNameMin: Cijk_Ailk_Bljk_BBH_MT64x80x32_MI16x16x8x1_SE_AF0EM4_GRVW2_LBSPP128_LPB2_NLCA1_SU32_SUS256_SRVW0_TT1_80_WG64_4_1_WGM2
    SolutionIndex: 95
    SolutionNameMin: Cijk_Ailk_Bljk_BBH_MT64x128x32_MI32x32x4x1_SE_AF0EM4_GRVW8_LBSPP128_LPB8_NLCA1_SU0_SUS256_SRVW4_TT1_64_WG64_4_1_WGM15
    SolutionIndex: 96
    SolutionNameMin: Cijk_Ailk_Bljk_BBH_MT64x32x32_MI16x16x8x1_SE_AF0EM4_GRVW2_LBSPP128_LPB2_NLCA1_SU0_SUS256_SRVW0_TT2_16_WG32_8_1_WGM1
    SolutionIndex: 97
    SolutionNameMin: Cijk_Ailk_Bljk_BBH_MT128x96x32_MI32x32x4x1_SE_AF0EM4_GRVW4_LBSPP128_LPB4_NLCA1_SU16_SUS128_SRVW4_TT1_96_WG128_2_1_WGM2
    SolutionIndex: 98
    SolutionNameMin: Cijk_Ailk_Bljk_BBH_MT128x96x32_MI32x32x4x1_SE_AF0EM4_GRVW4_LBSPP128_LPB4_NLCA1_SU0_SUS256_SRVW4_TT1_96_WG128_2_1_WGM2
    SolutionIndex: 99
    SolutionNameMin: Cijk_Ailk_Bljk_BBH_MT64x80x32_MI16x16x8x1_SE_AF0EM4_GRVW2_LBSPP128_LPB2_NLCA1_SU32_SUS256_SRVW4_TT1_80_WG64_4_1_WGM15
    SolutionIndex: 100
    SolutionNameMin: Cijk_Ailk_Bljk_BBH_MT128x160x32_MI32x32x4x1_SE_AF0EM4_GRVW4_LBSPP128_LPB4_NLCA1_SU0_SUS256_SRVW4_TT1_160_WG128_2_1_WGM15
    SolutionIndex: 101
    SolutionNameMin: Cijk_Ailk_Bljk_BBH_MT64x128x32_MI32x32x4x1_SE_AF0EM4_GRVW8_LBSPP128_LPB8_NLCA1_SU32_SUS128_SRVW4_TT1_64_WG64_4_1_WGM1
    SolutionIndex: 102
    SolutionNameMin: Cijk_Ailk_Bljk_BBH_MT64x128x32_MI32x32x2x2_SE_AF0EM4_GRVW8_LBSPP128_LPB8_NLCA1_SU0_SUS256_SRVW4_TT1_32_WG64_4_1_WGM1
    SolutionIndex: 103
    SolutionNameMin: Cijk_Ailk_Bljk_BBH_MT128x80x32_MI16x16x8x1_SE_AF0EM4_GRVW2_LBSPP128_LPB2_NLCA1_SU16_SUS256_SRVW4_TT2_80_WG64_4_1_WGM1
    SolutionIndex: 104
    SolutionNameMin: Cijk_Ailk_Bljk_BBH_MT64x128x64_MI32x32x4x1_SE_AF0EM4_GRVW8_LBSPP128_LPB8_NLCA1_SU32_SUS128_SRVW0_TT1_64_WG64_4_1_WGM2
    SolutionIndex: 105
    SolutionNameMin: Cijk_Ailk_Bljk_BBH_MT128x80x64_MI16x16x8x1_SE_AF0EM4_GRVW2_LBSPP128_LPB2_NLCA1_SU32_SUS256_SRVW0_TT2_80_WG64_4_1_WGM2
    SolutionIndex: 106
    SolutionNameMin: Cijk_Ailk_Bljk_BBH_MT128x160x32_MI32x32x4x1_SE_AF0EM4_GRVW4_LBSPP128_LPB4_NLCA1_SU0_SUS256_SRVW0_TT1_160_WG128_2_1_WGM15
    SolutionIndex: 107
    SolutionNameMin: Cijk_Ailk_Bljk_BBH_MT128x96x64_MI32x32x4x1_SE_AF0EM4_GRVW4_LBSPP128_LPB4_NLCA1_SU16_SUS128_SRVW0_TT1_96_WG128_2_1_WGM1
    SolutionIndex: 108
    SolutionNameMin: Cijk_Ailk_Bljk_BBH_MT32x32x32_MI16x16x8x1_SE_AF0EM4_GRVW2_LBSPP128_LPB2_NLCA1_SU0_SUS256_SRVW0_TT1_16_WG32_8_1_WGM15
    SolutionIndex: 109
    SolutionNameMin: Cijk_Ailk_Bljk_BBH_MT64x128x32_MI32x32x4x1_SE_AF0EM4_GRVW8_LBSPP128_LPB8_NLCA1_SU16_SUS128_SRVW4_TT1_64_WG64_4_1_WGM1
    SolutionIndex: 110
    SolutionNameMin: Cijk_Ailk_Bljk_BBH_MT128x96x32_MI32x32x4x1_SE_AF0EM4_GRVW4_LBSPP128_LPB4_NLCA1_SU0_SUS256_SRVW4_TT1_96_WG128_2_1_WGM15
    SolutionIndex: 111
    SolutionNameMin: Cijk_Ailk_Bljk_BBH_MT32x32x32_MI16x16x8x1_SE_AF0EM4_GRVW4_LBSPP128_LPB4_NLCA1_SU0_SUS256_SRVW0_TT1_16_WG32_8_1_WGM2
    SolutionIndex: 112
    SolutionNameMin: Cijk_Ailk_Bljk_BBH_MT128x128x32_MI32x32x4x1_SE_AF0EM1_GRVW8_LBSPP128_LPB8_NLCA1_SU0_SUS256_SRVW4_TT2_64_WG64_4_1_WGM15
    SolutionIndex: 113
    SolutionNameMin: Cijk_Ailk_Bljk_BBH_MT128x96x32_MI32x32x4x1_SE_AF0EM4_GRVW4_LBSPP128_LPB4_NLCA1_SU16_SUS256_SRVW4_TT1_96_WG128_2_1_WGM2
    SolutionIndex: 114
    SolutionNameMin: Cijk_Ailk_Bljk_BBH_MT128x160x32_MI32x32x4x1_SE_AF0EM4_GRVW4_LBSPP128_LPB4_NLCA1_SU0_SUS256_SRVW0_TT1_160_WG128_2_1_WGM1
    SolutionIndex: 115
    SolutionNameMin: Cijk_Ailk_Bljk_BBH_MT32x32x128_MI16x16x8x1_SE_AF0EM4_GRVW8_LBSPP256_LPB8_NLCA1_SU16_SUS256_SRVW0_TT1_16_WG32_8_1_WGM2
    SolutionIndex: 116
    SolutionNameMin: Cijk_Ailk_Bljk_BBH_MT64x128x32_MI32x32x2x2_SE_AF0EM4_GRVW8_LBSPP128_LPB8_NLCA1_SU16_SUS256_SRVW4_TT1_32_WG64_4_1_WGM1
    SolutionIndex: 117
    SolutionNameMin: Cijk_Ailk_Bljk_BBH_MT128x96x32_MI32x32x4x1_SE_AF0EM4_GRVW4_LBSPP128_LPB4_NLCA1_SU16_SUS256_SRVW4_TT1_96_WG128_2_1_WGM15
    SolutionIndex: 118
    SolutionNameMin: Cijk_Ailk_Bljk_BBH_MT128x160x32_MI32x32x4x1_SE_AF0EM4_GRVW4_LBSPP128_LPB4_NLCA1_SU0_SUS256_SRVW4_TT1_160_WG128_2_1_WGM2
    SolutionIndex: 119
    SolutionNameMin: Cijk_Ailk_Bljk_BBH_MT128x96x32_MI32x32x4x1_SE_AF0EM4_GRVW4_LBSPP128_LPB4_NLCA1_SU16_SUS128_SRVW4_TT1_96_WG128_2_1_WGM15
    SolutionIndex: 120
    SolutionNameMin: Cijk_Ailk_Bljk_BBH_MT128x64x64_MI32x32x4x1_SE_AF0EM4_GRVW8_LBSPP128_LPB8_NLCA1_SU0_SUS256_SRVW0_TT2_32_WG64_4_1_WGM15
    SolutionIndex: 121
    SolutionNameMin: Cijk_Ailk_Bljk_BBH_MT128x96x32_MI32x32x4x1_SE_AF0EM4_GRVW4_LBSPP128_LPB4_NLCA1_SU32_SUS128_SRVW4_TT1_96_WG128_2_1_WGM2
    SolutionIndex: 122
    SolutionNameMin: Cijk_Ailk_Bljk_BBH_MT32x32x64_MI16x16x8x1_SE_AF0EM1_GRVW8_LBSPP128_LPB8_NLCA1_SU32_SUS128_SRVW0_TT1_16_WG32_8_1_WGM1
    SolutionIndex: 123
    SolutionNameMin: Cijk_Ailk_Bljk_BBH_MT128x256x32_MI32x32x4x1_SE_AF0EM1_GRVW8_LBSPP128_LPB8_NLCA1_SU0_SUS256_SRVW4_TT2_128_WG64_4_1_WGM15
    SolutionIndex: 124
    SolutionNameMin: Cijk_Ailk_Bljk_BBH_MT32x32x32_MI16x16x8x1_SE_AF0EM4_GRVW4_LBSPP128_LPB4_NLCA1_SU0_SUS256_SRVW0_TT1_16_WG32_8_1_WGM1
    SolutionIndex: 125
    SolutionNameMin: Cijk_Ailk_Bljk_BBH_MT128x96x32_MI32x32x4x1_SE_AF0EM4_GRVW4_LBSPP128_LPB4_NLCA1_SU32_SUS128_SRVW4_TT1_96_WG128_2_1_WGM15
    SolutionIndex: 126
    SolutionNameMin: Cijk_Ailk_Bljk_BBH_MT64x80x32_MI16x16x8x1_SE_AF0EM4_GRVW2_LBSPP128_LPB2_NLCA1_SU16_SUS128_SRVW0_TT1_80_WG64_4_1_WGM15
    SolutionIndex: 127
    SolutionNameMin: Cijk_Ailk_Bljk_BBH_MT32x32x128_MI16x16x8x1_SE_AF0EM1_GRVW2_LBSPP256_LPB2_NLCA1_SU16_SUS256_SRVW0_TT1_16_WG32_8_1_WGM1
    SolutionIndex: 128
    SolutionNameMin: Cijk_Ailk_Bljk_BBH_MT64x128x32_MI32x32x4x1_SE_AF0EM4_GRVW8_LBSPP128_LPB8_NLCA1_SU32_SUS256_SRVW4_TT1_64_WG64_4_1_WGM2
    SolutionIndex: 129
    SolutionNameMin: Cijk_Ailk_Bljk_BBH_MT128x80x32_MI16x16x8x1_SE_AF0EM4_GRVW2_LBSPP128_LPB2_NLCA1_SU32_SUS128_SRVW0_TT2_80_WG64_4_1_WGM1
    SolutionIndex: 130
    SolutionNameMin: Cijk_Ailk_Bljk_BBH_MT32x32x32_MI16x16x8x1_SE_AF0EM4_GRVW2_LBSPP128_LPB2_NLCA1_SU0_SUS256_SRVW0_TT1_16_WG32_8_1_WGM1
    SolutionIndex: 131
    SolutionNameMin: Cijk_Ailk_Bljk_BBH_MT64x128x32_MI32x32x4x1_SE_AF0EM4_GRVW4_LBSPP128_LPB4_NLCA1_SU0_SUS256_SRVW4_TT1_64_WG64_4_1_WGM1
    SolutionIndex: 132
    SolutionNameMin: Cijk_Ailk_Bljk_BBH_MT32x32x128_MI16x16x8x1_SE_AF0EM1_GRVW4_LBSPP256_LPB4_NLCA1_SU0_SUS256_SRVW0_TT1_16_WG32_8_1_WGM1
    SolutionIndex: 133
    SolutionNameMin: Cijk_Ailk_Bljk_BBH_MT32x32x32_MI16x16x8x1_SE_AF0EM4_GRVW4_LBSPP128_LPB4_NLCA1_SU16_SUS256_SRVW0_TT1_16_WG32_8_1_WGM1
    SolutionIndex: 134
    SolutionNameMin: Cijk_Ailk_Bljk_BBH_MT32x64x32_MI16x16x8x1_SE_AF0EM4_GRVW2_LBSPP128_LPB2_NLCA1_SU0_SUS256_SRVW0_TT1_32_WG32_8_1_WGM1
    SolutionIndex: 135
    SolutionNameMin: Cijk_Ailk_Bljk_BBH_MT64x80x64_MI16x16x8x1_SE_AF0EM4_GRVW2_LBSPP128_LPB2_NLCA1_SU0_SUS256_SRVW0_TT1_80_WG64_4_1_WGM15
    SolutionIndex: 136
    SolutionNameMin: Cijk_Ailk_Bljk_BBH_MT64x32x32_MI16x16x8x1_SE_AF0EM4_GRVW2_LBSPP128_LPB2_NLCA1_SU0_SUS256_SRVW4_TT2_16_WG32_8_1_WGM15
    SolutionIndex: 137
    SolutionNameMin: Cijk_Ailk_Bljk_BBH_MT128x288x32_MI32x32x4x1_SE_AF0EM4_GRVW2_LBSPP128_LPB2_NLCA1_SU0_SUS256_SRVW0_TT1_288_WG128_2_1_WGM2
    SolutionIndex: 138
    SolutionNameMin: Cijk_Ailk_Bljk_BBH_MT64x128x32_MI32x32x4x1_SE_AF0EM1_GRVW4_LBSPP128_LPB4_NLCA1_SU32_SUS128_SRVW4_TT1_64_WG64_4_1_WGM2
    SolutionIndex: 139
    SolutionNameMin: Cijk_Ailk_Bljk_BBH_MT64x64x32_MI32x32x4x1_SE_AF0EM4_GRVW8_LBSPP128_LPB8_NLCA1_SU16_SUS128_SRVW4_TT1_32_WG64_4_1_WGM1
    SolutionIndex: 140
    SolutionNameMin: Cijk_Ailk_Bljk_BBH_MT64x128x32_MI32x32x2x2_SE_AF0EM1_GRVW2_LBSPP128_LPB2_NLCA1_SU0_SUS256_SRVW0_TT1_32_WG64_4_1_WGM1
    SolutionIndex: 141
    SolutionNameMin: Cijk_Ailk_Bljk_BBH_MT128x80x64_MI16x16x8x1_SE_AF0EM4_GRVW2_LBSPP128_LPB2_NLCA1_SU32_SUS256_SRVW0_TT2_80_WG64_4_1_WGM15
    SolutionIndex: 142
    SolutionNameMin: Cijk_Ailk_Bljk_BBH_MT32x64x128_MI16x16x8x1_SE_AF0EM4_GRVW8_LBSPP256_LPB8_NLCA1_SU16_SUS256_SRVW0_TT1_32_WG32_8_1_WGM1
    SolutionIndex: 143
    SolutionNameMin: Cijk_Ailk_Bljk_BBH_MT128x64x32_MI32x32x4x1_SE_AF0EM4_GRVW8_LBSPP128_LPB8_NLCA1_SU0_SUS256_SRVW4_TT2_32_WG64_4_1_WGM15
    SolutionIndex: 144
    SolutionNameMin: Cijk_Ailk_Bljk_BBH_MT64x32x128_MI16x16x8x1_SE_AF0EM1_GRVW8_LBSPP256_LPB8_NLCA1_SU16_SUS256_SRVW4_TT2_16_WG32_8_1_WGM15
    SolutionIndex: 145
    SolutionNameMin: Cijk_Ailk_Bljk_BBH_MT32x32x32_MI16x16x8x1_SE_AF0EM4_GRVW2_LBSPP128_LPB2_NLCA1_SU16_SUS256_SRVW0_TT1_16_WG32_8_1_WGM2
    SolutionIndex: 146
    SolutionNameMin: Cijk_Ailk_Bljk_BBH_MT128x144x32_MI16x16x8x1_SE_AF0EM4_GRVW2_LBSPP128_LPB2_NLCA1_SU0_SUS256_SRVW0_TT2_144_WG64_4_1_WGM2
    SolutionIndex: 147
    SolutionNameMin: Cijk_Ailk_Bljk_BBH_MT64x64x32_MI32x32x4x1_SE_AF0EM4_GRVW8_LBSPP128_LPB8_NLCA1_SU32_SUS128_SRVW0_TT1_32_WG64_4_1_WGM1
    SolutionIndex: 148
    SolutionNameMin: Cijk_Ailk_Bljk_BBH_MT64x32x32_MI16x16x8x1_SE_AF0EM4_GRVW2_LBSPP128_LPB2_NLCA1_SU0_SUS256_SRVW0_TT2_16_WG32_8_1_WGM2
    SolutionIndex: 149
    SolutionNameMin: Cijk_Ailk_Bljk_BBH_MT32x32x32_MI16x16x8x1_SE_AF0EM4_GRVW8_LBSPP128_LPB8_NLCA1_SU0_SUS256_SRVW0_TT1_16_WG32_8_1_WGM15
    SolutionIndex: 150
    SolutionNameMin: Cijk_Ailk_Bljk_BBH_MT128x96x32_MI32x32x4x1_SE_AF0EM4_GRVW4_LBSPP128_LPB4_NLCA1_SU16_SUS128_SRVW4_TT1_96_WG128_2_1_WGM1
    SolutionIndex: 151
    SolutionNameMin: Cijk_Ailk_Bljk_BBH_MT128x80x64_MI16x16x8x1_SE_AF0EM4_GRVW2_LBSPP128_LPB2_NLCA1_SU0_SUS256_SRVW0_TT2_80_WG64_4_1_WGM1
    SolutionIndex: 152
    SolutionNameMin: Cijk_Ailk_Bljk_BBH_MT128x96x32_MI32x32x4x1_SE_AF0EM4_GRVW2_LBSPP128_LPB2_NLCA1_SU16_SUS256_SRVW4_TT1_96_WG128_2_1_WGM2
    SolutionIndex: 153
    SolutionNameMin: Cijk_Ailk_Bljk_BBH_MT128x96x32_MI32x32x4x1_SE_AF0EM4_GRVW4_LBSPP128_LPB4_NLCA1_SU16_SUS256_SRVW4_TT1_96_WG128_2_1_WGM1
    SolutionIndex: 154
    SolutionNameMin: Cijk_Ailk_Bljk_BBH_MT128x96x32_MI32x32x4x1_SE_AF0EM4_GRVW4_LBSPP128_LPB4_NLCA1_SU32_SUS256_SRVW4_TT1_96_WG128_2_1_WGM2
    SolutionIndex: 155
    SolutionNameMin: Cijk_Ailk_Bljk_BBH_MT64x64x32_MI32x32x4x1_SE_AF0EM4_GRVW2_LBSPP128_LPB2_NLCA1_SU0_SUS256_SRVW0_TT1_32_WG64_4_1_WGM15
    SolutionIndex: 156
    SolutionNameMin: Cijk_Ailk_Bljk_BBH_MT64x128x32_MI32x32x2x2_SE_AF0EM4_GRVW2_LBSPP128_LPB2_NLCA1_SU16_SUS256_SRVW4_TT1_32_WG64_4_1_WGM1
    SolutionIndex: 157
    SolutionNameMin: Cijk_Ailk_Bljk_BBH_MT64x80x32_MI16x16x8x1_SE_AF0EM4_GRVW2_LBSPP128_LPB2_NLCA1_SU0_SUS256_SRVW0_TT1_80_WG64_4_1_WGM2
    SolutionIndex: 158
    SolutionNameMin: Cijk_Ailk_Bljk_BBH_MT64x128x32_MI32x32x4x1_SE_AF0EM4_GRVW8_LBSPP128_LPB8_NLCA1_SU16_SUS256_SRVW4_TT1_64_WG64_4_1_WGM1
    SolutionIndex: 159
    SolutionNameMin: Cijk_Ailk_Bljk_BBH_MT128x96x32_MI32x32x4x1_SE_AF0EM4_GRVW4_LBSPP128_LPB4_NLCA1_SU32_SUS128_SRVW4_TT1_96_WG128_2_1_WGM1
    SolutionIndex: 160
    SolutionNameMin: Cijk_Ailk_Bljk_BBH_MT128x160x32_MI32x32x4x1_SE_AF0EM4_GRVW4_LBSPP128_LPB4_NLCA1_SU16_SUS128_SRVW0_TT1_160_WG128_2_1_WGM1
    SolutionIndex: 161
    SolutionNameMin: Cijk_Ailk_Bljk_BBH_MT64x64x32_MI32x32x4x1_SE_AF0EM4_GRVW8_LBSPP128_LPB8_NLCA1_SU32_SUS256_SRVW0_TT1_32_WG64_4_1_WGM15
    SolutionIndex: 162
    SolutionNameMin: Cijk_Ailk_Bljk_BBH_MT64x64x32_MI32x32x4x1_SE_AF0EM4_GRVW4_LBSPP128_LPB4_NLCA1_SU0_SUS256_SRVW4_TT1_32_WG64_4_1_WGM15
    SolutionIndex: 163
    SolutionNameMin: Cijk_Ailk_Bljk_BBH_MT64x128x32_MI32x32x4x1_SE_AF0EM4_GRVW2_LBSPP128_LPB2_NLCA1_SU16_SUS128_SRVW4_TT1_64_WG64_4_1_WGM2
    SolutionIndex: 164
    SolutionNameMin: Cijk_Ailk_Bljk_BBH_MT64x80x64_MI16x16x8x1_SE_AF0EM4_GRVW4_LBSPP128_LPB4_NLCA1_SU32_SUS256_SRVW0_TT1_80_WG64_4_1_WGM15
    SolutionIndex: 165
    SolutionNameMin: Cijk_Ailk_Bljk_BBH_MT64x128x32_MI32x32x2x2_SE_AF0EM4_GRVW8_LBSPP128_LPB8_NLCA1_SU32_SUS128_SRVW4_TT1_32_WG64_4_1_WGM2
    SolutionIndex: 166
    SolutionNameMin: Cijk_Ailk_Bljk_BBH_MT128x80x32_MI16x16x8x1_SE_AF0EM4_GRVW2_LBSPP128_LPB2_NLCA1_SU0_SUS256_SRVW0_TT2_80_WG64_4_1_WGM15
    SolutionIndex: 167
    SolutionNameMin: Cijk_Ailk_Bljk_BBH_MT64x128x32_MI32x32x2x2_SE_AF0EM1_GRVW8_LBSPP128_LPB8_NLCA1_SU0_SUS256_SRVW4_TT1_32_WG64_4_1_WGM15
    SolutionIndex: 168
    SolutionNameMin: Cijk_Ailk_Bljk_BBH_MT32x32x64_MI16x16x8x1_SE_AF0EM4_GRVW8_LBSPP128_LPB8_NLCA1_SU16_SUS128_SRVW0_TT1_16_WG32_8_1_WGM2
    SolutionIndex: 169
    SolutionNameMin: Cijk_Ailk_Bljk_BBH_MT32x32x128_MI16x16x8x1_SE_AF0EM4_GRVW8_LBSPP256_LPB8_NLCA1_SU16_SUS256_SRVW0_TT1_16_WG32_8_1_WGM15
    SolutionIndex: 170
    SolutionNameMin: Cijk_Ailk_Bljk_BBH_MT128x64x32_MI32x32x2x2_SE_AF0EM4_GRVW8_LBSPP128_LPB8_NLCA1_SU0_SUS256_SRVW4_TT1_32_WG128_2_1_WGM15
    SolutionIndex: 171
    SolutionNameMin: Cijk_Ailk_Bljk_BBH_MT128x80x32_MI16x16x8x1_SE_AF0EM4_GRVW2_LBSPP128_LPB2_NLCA1_SU0_SUS256_SRVW0_TT2_80_WG64_4_1_WGM1
    SolutionIndex: 172
    SolutionNameMin: Cijk_Ailk_Bljk_BBH_MT64x128x32_MI32x32x4x1_SE_AF0EM4_GRVW2_LBSPP128_LPB2_NLCA1_SU16_SUS256_SRVW4_TT1_64_WG64_4_1_WGM1
    SolutionIndex: 173
    SolutionNameMin: Cijk_Ailk_Bljk_BBH_MT32x32x64_MI16x16x8x1_SE_AF0EM4_GRVW8_LBSPP128_LPB8_NLCA1_SU16_SUS256_SRVW0_TT1_16_WG32_8_1_WGM15
    SolutionIndex: 174
    SolutionNameMin: Cijk_Ailk_Bljk_BBH_MT32x32x128_MI16x16x8x1_SE_AF0EM4_GRVW4_LBSPP256_LPB4_NLCA1_SU0_SUS256_SRVW0_TT1_16_WG32_8_1_WGM1
    SolutionIndex: 175
    SolutionNameMin: Cijk_Ailk_Bljk_BBH_MT64x128x32_MI32x32x4x1_SE_AF0EM4_GRVW2_LBSPP128_LPB2_NLCA1_SU32_SUS128_SRVW4_TT1_64_WG64_4_1_WGM1
    SolutionIndex: 176
    SolutionNameMin: Cijk_Ailk_Bljk_BBH_MT128x80x64_MI16x16x8x1_SE_AF0EM4_GRVW2_LBSPP128_LPB2_NLCA1_SU0_SUS256_SRVW0_TT2_80_WG64_4_1_WGM2
    SolutionIndex: 177
    SolutionNameMin: Cijk_Ailk_Bljk_BBH_MT128x96x32_MI32x32x4x1_SE_AF0EM4_GRVW4_LBSPP128_LPB4_NLCA1_SU0_SUS256_SRVW4_TT1_96_WG128_2_1_WGM1
    SolutionIndex: 178
    SolutionNameMin: Cijk_Ailk_Bljk_BBH_MT32x32x32_MI16x16x8x1_SE_AF0EM4_GRVW4_LBSPP128_LPB4_NLCA1_SU32_SUS128_SRVW0_TT1_16_WG32_8_1_WGM2
    SolutionIndex: 179
    SolutionNameMin: Cijk_Ailk_Bljk_BBH_MT64x128x32_MI32x32x4x1_SE_AF0EM4_GRVW8_LBSPP128_LPB8_NLCA1_SU0_SUS256_SRVW4_TT1_64_WG64_4_1_WGM2
    SolutionIndex: 180
    SolutionNameMin: Cijk_Ailk_Bljk_BBH_MT128x96x32_MI32x32x4x1_SE_AF0EM4_GRVW2_LBSPP128_LPB2_NLCA1_SU0_SUS256_SRVW4_TT1_96_WG128_2_1_WGM15
    SolutionIndex: 181
    SolutionNameMin: Cijk_Ailk_Bljk_BBH_MT64x32x32_MI16x16x8x1_SE_AF0EM4_GRVW8_LBSPP128_LPB8_NLCA1_SU16_SUS256_SRVW4_TT2_16_WG32_8_1_WGM1
    SolutionIndex: 182
    SolutionNameMin: Cijk_Ailk_Bljk_BBH_MT128x96x64_MI32x32x4x1_SE_AF0EM4_GRVW4_LBSPP128_LPB4_NLCA1_SU32_SUS256_SRVW0_TT1_96_WG128_2_1_WGM15
    SolutionIndex: 183
    SolutionNameMin: Cijk_Ailk_Bljk_BBH_MT32x64x64_MI16x16x8x1_SE_AF0EM4_GRVW4_LBSPP128_LPB4_NLCA1_SU16_SUS128_SRVW4_TT1_32_WG32_8_1_WGM1
    SolutionIndex: 184
    SolutionNameMin: Cijk_Ailk_Bljk_BBH_MT64x64x32_MI32x32x4x1_SE_AF0EM4_GRVW8_LBSPP128_LPB8_NLCA1_SU16_SUS256_SRVW4_TT1_32_WG64_4_1_WGM15
    SolutionIndex: 185
    SolutionNameMin: Cijk_Ailk_Bljk_BBH_MT64x128x32_MI32x32x4x1_SE_AF0EM4_GRVW2_LBSPP128_LPB2_NLCA1_SU32_SUS256_SRVW4_TT1_64_WG64_4_1_WGM2
    SolutionIndex: 186
    SolutionNameMin: Cijk_Ailk_Bljk_BBH_MT128x64x64_MI32x32x4x1_SE_AF0EM4_GRVW8_LBSPP128_LPB8_NLCA1_SU16_SUS256_SRVW4_TT2_32_WG64_4_1_WGM2
    SolutionIndex: 187
    SolutionNameMin: Cijk_Ailk_Bljk_BBH_MT64x128x32_MI32x32x4x1_SE_AF0EM4_GRVW8_LBSPP128_LPB8_NLCA1_SU16_SUS256_SRVW4_TT1_64_WG64_4_1_WGM2
    SolutionIndex: 188
    SolutionNameMin: Cijk_Ailk_Bljk_BBH_MT128x160x32_MI32x32x4x1_SE_AF0EM4_GRVW4_LBSPP128_LPB4_NLCA1_SU32_SUS128_SRVW0_TT1_160_WG128_2_1_WGM1
    SolutionIndex: 189
    SolutionNameMin: Cijk_Ailk_Bljk_BBH_MT32x32x128_MI16x16x8x1_SE_AF0EM4_GRVW8_LBSPP256_LPB8_NLCA1_SU16_SUS256_SRVW0_TT1_16_WG32_8_1_WGM1
    SolutionIndex: 190
    SolutionNameMin: Cijk_Ailk_Bljk_BBH_MT64x128x64_MI32x32x4x1_SE_AF0EM4_GRVW4_LBSPP128_LPB4_NLCA1_SU0_SUS256_SRVW4_TT1_64_WG64_4_1_WGM1
    SolutionIndex: 191
    SolutionNameMin: Cijk_Ailk_Bljk_BBH_MT128x160x32_MI32x32x4x1_SE_AF0EM1_GRVW2_LBSPP128_LPB2_NLCA1_SU32_SUS256_SRVW4_TT1_160_WG128_2_1_WGM15
    SolutionIndex: 192
    SolutionNameMin: Cijk_Ailk_Bljk_BBH_MT128x160x32_MI32x32x4x1_SE_AF0EM4_GRVW4_LBSPP128_LPB4_NLCA1_SU32_SUS256_SRVW0_TT1_160_WG128_2_1_WGM1
    SolutionIndex: 193
    SolutionNameMin: Cijk_Ailk_Bljk_BBH_MT64x128x64_MI32x32x4x1_SE_AF0EM4_GRVW4_LBSPP128_LPB4_NLCA1_SU0_SUS256_SRVW0_TT1_64_WG64_4_1_WGM1
    SolutionIndex: 194
    SolutionNameMin: Cijk_Ailk_Bljk_BBH_MT64x80x32_MI16x16x8x1_SE_AF0EM4_GRVW2_LBSPP128_LPB2_NLCA1_SU16_SUS128_SRVW0_TT1_80_WG64_4_1_WGM2
    SolutionIndex: 195
    SolutionNameMin: Cijk_Ailk_Bljk_BBH_MT32x64x128_MI16x16x8x1_SE_AF0EM4_GRVW8_LBSPP256_LPB8_NLCA1_SU0_SUS256_SRVW0_TT1_32_WG32_8_1_WGM15
    SolutionIndex: 196
    SolutionNameMin: Cijk_Ailk_Bljk_BBH_MT64x64x64_MI32x32x4x1_SE_AF0EM1_GRVW2_LBSPP128_LPB2_NLCA1_SU16_SUS256_SRVW4_TT1_32_WG64_4_1_WGM15
    SolutionIndex: 197
    SolutionNameMin: Cijk_Ailk_Bljk_BBH_MT128x80x32_MI16x16x8x1_SE_AF0EM1_GRVW2_LBSPP128_LPB2_NLCA1_SU0_SUS256_SRVW4_TT2_80_WG64_4_1_WGM15
    SolutionIndex: 198
    SolutionNameMin: Cijk_Ailk_Bljk_BBH_MT32x32x64_MI16x16x8x1_SE_AF0EM4_GRVW8_LBSPP128_LPB8_NLCA1_SU16_SUS256_SRVW0_TT1_16_WG32_8_1_WGM2
    SolutionIndex: 199
    SolutionNameMin: Cijk_Ailk_Bljk_BBH_MT64x128x32_MI32x32x4x1_SE_AF0EM4_GRVW2_LBSPP128_LPB2_NLCA1_SU32_SUS128_SRVW4_TT1_64_WG64_4_1_WGM2
    SolutionIndex: 200
    SolutionNameMin: Cijk_Ailk_Bljk_BBH_MT32x32x128_MI16x16x8x1_SE_AF0EM4_GRVW8_LBSPP256_LPB8_NLCA1_SU32_SUS256_SRVW0_TT1_16_WG32_8_1_WGM15
    SolutionIndex: 201
    SolutionNameMin: Cijk_Ailk_Bljk_BBH_MT128x64x32_MI32x32x2x2_SE_AF0EM1_GRVW8_LBSPP128_LPB8_NLCA1_SU16_SUS128_SRVW4_TT1_32_WG128_2_1_WGM15
    SolutionIndex: 202
    SolutionNameMin: Cijk_Ailk_Bljk_BBH_MT128x96x32_MI32x32x4x1_SE_AF0EM1_GRVW2_LBSPP128_LPB2_NLCA1_SU0_SUS256_SRVW4_TT1_96_WG128_2_1_WGM15
    SolutionIndex: 203
    SolutionNameMin: Cijk_Ailk_Bljk_BBH_MT64x128x32_MI32x32x4x1_SE_AF0EM1_GRVW8_LBSPP128_LPB8_NLCA1_SU16_SUS128_SRVW4_TT1_64_WG64_4_1_WGM15
    SolutionIndex: 204
    SolutionNameMin: Cijk_Ailk_Bljk_BBH_MT32x32x32_MI16x16x8x1_SE_AF0EM4_GRVW8_LBSPP128_LPB8_NLCA1_SU0_SUS256_SRVW4_TT1_16_WG32_8_1_WGM1
    SolutionIndex: 205
    SolutionNameMin: Cijk_Ailk_Bljk_BBH_MT32x64x128_MI16x16x8x1_SE_AF0EM1_GRVW8_LBSPP256_LPB8_NLCA1_SU32_SUS256_SRVW0_TT1_32_WG32_8_1_WGM15
    SolutionIndex: 206
    SolutionNameMin: Cijk_Ailk_Bljk_BBH_MT64x80x32_MI16x16x8x1_SE_AF0EM4_GRVW2_LBSPP128_LPB2_NLCA1_SU0_SUS256_SRVW0_TT1_80_WG64_4_1_WGM15
    SolutionIndex: 207
    SolutionNameMin: Cijk_Ailk_Bljk_BBH_MT64x64x64_MI32x32x4x1_SE_AF0EM4_GRVW8_LBSPP128_LPB8_NLCA1_SU0_SUS256_SRVW4_TT1_32_WG64_4_1_WGM15
    SolutionIndex: 208
    SolutionNameMin: Cijk_Ailk_Bljk_BBH_MT64x32x32_MI16x16x8x1_SE_AF0EM4_GRVW2_LBSPP128_LPB2_NLCA1_SU16_SUS128_SRVW4_TT2_16_WG32_8_1_WGM1
    SolutionIndex: 209
    SolutionNameMin: Cijk_Ailk_Bljk_BBH_MT32x32x128_MI16x16x8x1_SE_AF0EM4_GRVW2_LBSPP256_LPB2_NLCA1_SU16_SUS256_SRVW0_TT1_16_WG32_8_1_WGM2
    SolutionIndex: 210
    SolutionNameMin: Cijk_Ailk_Bljk_BBH_MT64x128x32_MI32x32x4x1_SE_AF0EM1_GRVW8_LBSPP128_LPB8_NLCA1_SU0_SUS256_SRVW4_TT1_64_WG64_4_1_WGM1
    SolutionIndex: 211
    SolutionNameMin: Cijk_Ailk_Bljk_BBH_MT64x64x32_MI32x32x4x1_SE_AF0EM4_GRVW8_LBSPP128_LPB8_NLCA1_SU0_SUS256_SRVW4_TT1_32_WG64_4_1_WGM2
    SolutionIndex: 212
    SolutionNameMin: Cijk_Ailk_Bljk_BBH_MT64x80x64_MI16x16x8x1_SE_AF0EM4_GRVW2_LBSPP128_LPB2_NLCA1_SU16_SUS256_SRVW0_TT1_80_WG64_4_1_WGM15
    SolutionIndex: 213
    SolutionNameMin: Cijk_Ailk_Bljk_BBH_MT32x32x32_MI16x16x8x1_SE_AF0EM4_GRVW2_LBSPP128_LPB2_NLCA1_SU0_SUS256_SRVW0_TT1_16_WG32_8_1_WGM2
    SolutionIndex: 214
    SolutionNameMin: Cijk_Ailk_Bljk_BBH_MT64x128x32_MI32x32x4x1_SE_AF0EM4_GRVW4_LBSPP128_LPB4_NLCA1_SU0_SUS256_SRVW4_TT1_64_WG64_4_1_WGM2
    SolutionIndex: 215
    SolutionNameMin: Cijk_Ailk_Bljk_BBH_MT32x32x128_MI16x16x8x1_SE_AF0EM1_GRVW8_LBSPP256_LPB8_NLCA1_SU32_SUS256_SRVW0_TT1_16_WG32_8_1_WGM15
    SolutionIndex: 216
    SolutionNameMin: Cijk_Ailk_Bljk_BBH_MT128x64x32_MI32x32x2x2_SE_AF0EM4_GRVW4_LBSPP128_LPB4_NLCA1_SU0_SUS256_SRVW4_TT1_32_WG128_2_1_WGM1
    SolutionIndex: 217
    SolutionNameMin: Cijk_Ailk_Bljk_BBH_MT32x32x128_MI16x16x8x1_SE_AF0EM4_GRVW8_LBSPP256_LPB8_NLCA1_SU0_SUS256_SRVW0_TT1_16_WG32_8_1_WGM1
    SolutionIndex: 218
    SolutionNameMin: Cijk_Ailk_Bljk_BBH_MT64x32x64_MI16x16x8x1_SE_AF0EM1_ASBE01_GRVW4_LPB4_PBD0_SRVW4_TT1_32_WG128_2_1_WGM10
    SolutionIndex: 219
    SolutionNameMin: Cijk_Ailk_Bljk_BBH_MT64x64x32_MI32x32x4x1_SE_AF0EM1_ASBE01_GRVW4_LPB4_PBD0_SRVW4_TT1_32_WG64_4_1_WGM1
    SolutionIndex: 220
    SolutionNameMin: Cijk_Ailk_Bljk_BBH_MT128x64x32_MI32x32x2x2_SE_AF0EM4_ASBE01_GRVW4_LPB4_PBD0_SRVW4_TT1_32_WG128_2_1_WGM1
    SolutionIndex: 221
    SolutionNameMin: Cijk_Ailk_Bljk_BBH_MT128x64x32_MI32x32x2x2_SE_AF0EM1_ASBE01_GRVW4_LPB4_PBD0_SRVW4_TT1_32_WG128_2_1_WGM1
    SolutionIndex: 222
    SolutionNameMin: Cijk_Ailk_Bljk_BBH_MT64x128x32_MI32x32x2x2_SE_AF0EM1_ASBE01_GRVW4_LPB4_PBD0_SRVW4_TT1_32_WG64_4_1_WGM1
    SolutionIndex: 223
    SolutionNameMin: Cijk_Ailk_Bljk_BBH_MT128x64x32_MI16x16x8x1_SE_AF0EM8_ASBE01_GRVW8_LPB8_PBD0_SRVW4_TT2_64_WG128_2_1_WGM1
    SolutionIndex: 224
    SolutionNameMin: Cijk_Ailk_Bljk_BBH_MT64x64x32_MI32x32x4x1_SE_AF0EM1_ASBE01_GRVW4_LPB4_PBD0_SRVW4_TT1_32_WG64_4_1_WGM10
    SolutionIndex: 225
    SolutionNameMin: Cijk_Ailk_Bljk_BBH_MT64x32x32_MI16x16x8x1_SE_AF0EM1_ASBE01_GRVW4_LPB4_PBD0_SRVW4_TT1_32_WG64_4_1_WGM1
    SolutionIndex: 226
    SolutionNameMin: Cijk_Ailk_Bljk_BBH_MT128x64x32_MI32x32x4x1_SE_AF0EM4_ASBE01_GRVW4_LPB4_PBD0_SRVW4_TT2_32_WG64_4_1_WGM10
    SolutionIndex: 227
    SolutionNameMin: Cijk_Ailk_Bljk_BBH_MT128x64x32_MI32x32x4x1_SE_AF0EM8_ASBE01_GRVW8_LPB8_PBD0_SRVW4_TT2_32_WG64_4_1_WGM1
    SolutionIndex: 228
    SolutionNameMin: Cijk_Ailk_Bljk_BBH_MT64x32x32_MI16x16x8x1_SE_AF0EM1_ASBE01_GRVW2_LPB2_PBD0_SRVW4_TT1_32_WG64_4_1_WGM1
    SolutionIndex: 229
    SolutionNameMin: Cijk_Ailk_Bljk_BBH_MT128x64x32_MI32x32x4x1_SE_AF0EM4_ASBE01_GRVW4_LPB4_PBD0_SRVW4_TT2_32_WG64_4_1_WGM1
    SolutionIndex: 230
    SolutionNameMin: Cijk_Ailk_Bljk_BBH_MT64x128x64_MI32x32x4x1_SE_AF0EM8_ASBE01_GRVW8_LPB8_PBD0_SRVW4_TT2_32_WG32_8_1_WGM10
    SolutionIndex: 231
    SolutionNameMin: Cijk_Ailk_Bljk_BBH_MT64x64x32_MI32x32x4x1_SE_AF0EM1_ASBE01_GRVW2_LPB2_PBD0_SRVW4_TT1_32_WG64_4_1_WGM1
    SolutionIndex: 232
    SolutionNameMin: Cijk_Ailk_Bljk_BBH_MT64x128x32_MI32x32x4x1_SE_AF0EM8_ASBE01_GRVW8_LPB8_PBD0_SRVW4_TT2_32_WG32_8_1_WGM1
    SolutionIndex: 233
    SolutionNameMin: Cijk_Ailk_Bljk_BBH_MT128x64x32_MI32x32x2x2_SE_AF0EM1_ASBE01_GRVW4_LPB4_PBD0_SRVW4_TT1_32_WG128_2_1_WGM10
    SolutionIndex: 234
    SolutionNameMin: Cijk_Ailk_Bljk_BBH_MT128x64x32_MI32x32x4x1_SE_AF0EM8_ASBE01_GRVW8_LPB8_PBD0_SRVW4_TT2_32_WG64_4_1_WGM4
    SolutionIndex: 235
    SolutionNameMin: Cijk_Ailk_Bljk_BBH_MT128x64x32_MI32x32x4x1_SE_AF0EM8_ASBE01_GRVW4_LPB4_PBD0_SRVW4_TT2_32_WG64_4_1_WGM1
    SolutionIndex: 236
    SolutionNameMin: Cijk_Ailk_Bljk_BBH_MT128x64x32_MI32x32x2x2_SE_AF0EM8_ASBE01_GRVW8_LPB8_PBD0_SRVW4_TT1_32_WG128_2_1_WGM1
    SolutionIndex: 237
    SolutionNameMin: Cijk_Ailk_Bljk_BBH_MT64x64x32_MI32x32x4x1_SE_AF0EM8_ASBE01_GRVW8_LPB8_PBD0_SRVW4_TT1_32_WG64_4_1_WGM10
    SolutionIndex: 238
    SolutionNameMin: Cijk_Ailk_Bljk_BBH_MT128x32x32_MI32x32x4x1_SE_AF0EM1_ASBE01_GRVW4_LPB4_PBD0_SRVW4_TT1_32_WG128_2_1_WGM1
    SolutionIndex: 239
    SolutionNameMin: Cijk_Ailk_Bljk_BBH_MT128x64x32_MI32x32x4x1_SE_AF0EM1_ASBE01_GRVW4_LPB4_PBD0_SRVW4_TT2_32_WG64_4_1_WGM4
    SolutionIndex: 240
    SolutionNameMin: Cijk_Ailk_Bljk_BBH_MT128x64x32_MI32x32x2x2_SE_AF0EM1_ASBE01_GRVW4_LPB4_PBD0_SRVW4_TT1_32_WG128_2_1_WGM4
    SolutionIndex: 241
    SolutionNameMin: Cijk_Ailk_Bljk_BBH_MT64x32x64_MI16x16x8x1_SE_AF0EM1_ASBE01_GRVW4_LPB4_PBD0_SRVW4_TT1_32_WG64_4_1_WGM1
    SolutionIndex: 242
    SolutionNameMin: Cijk_Ailk_Bljk_BBH_MT128x64x32_MI32x32x2x2_SE_AF0EM4_ASBE01_GRVW4_LPB4_PBD0_SRVW4_TT1_32_WG128_2_1_WGM4
    SolutionIndex: 243
    SolutionNameMin: Cijk_Ailk_Bljk_BBH_MT32x64x64_MI16x16x8x1_SE_AF0EM8_ASBE01_GRVW8_LPB8_PBD0_SRVW0_TT1_32_WG32_8_1_WGM1
    SolutionIndex: 244
    SolutionNameMin: Cijk_Ailk_Bljk_BBH_MT128x64x32_MI32x32x4x1_SE_AF0EM1_ASBE01_GRVW4_LPB4_PBD0_SRVW4_TT2_32_WG64_4_1_WGM1
    SolutionIndex: 245
    SolutionNameMin: Cijk_Ailk_Bljk_BBH_MT128x64x32_MI32x32x2x2_SE_AF0EM4_ASBE01_GRVW4_LPB4_PBD0_SRVW4_TT1_32_WG128_2_1_WGM10
    SolutionIndex: 246
    SolutionNameMin: Cijk_Ailk_Bljk_BBH_MT128x64x32_MI16x16x8x1_SE_AF0EM1_ASBE01_GRVW4_LPB4_PBD0_SRVW4_TT2_64_WG64_4_1_WGM1
    SolutionIndex: 247
    SolutionNameMin: Cijk_Ailk_Bljk_BBH_MT128x64x32_MI16x16x8x1_SE_AF0EM1_ASBE01_GRVW4_LPB4_PBD0_SRVW4_TT2_64_WG64_4_1_WGM4
    SolutionIndex: 248
    SolutionNameMin: Cijk_Ailk_Bljk_BBH_MT64x128x32_MI16x16x2x4_SE_AF0EM4_ASBE01_GRVW2_LPB2_PBD0_SRVW4_TT1_32_WG64_4_1_WGM4
    SolutionIndex: 249
    SolutionNameMin: Cijk_Ailk_Bljk_BBH_MT64x64x32_MI32x32x4x1_SE_AF0EM4_ASBE01_GRVW2_LPB2_PBD0_SRVW4_TT1_32_WG64_4_1_WGM10
    SolutionIndex: 250
    SolutionNameMin: Cijk_Ailk_Bljk_BBH_MT64x128x32_MI32x32x4x1_SE_AF0EM1_ASBE01_GRVW2_LPB2_PBD0_SRVW4_TT2_32_WG32_8_1_WGM10
    SolutionIndex: 251
    SolutionNameMin: Cijk_Ailk_Bljk_BBH_MT64x32x64_MI16x16x8x1_SE_AF0EM4_ASBE01_GRVW4_LPB4_PBD0_SRVW4_TT1_32_WG128_2_1_WGM4
    SolutionIndex: 252
    SolutionNameMin: Cijk_Ailk_Bljk_BBH_MT64x128x64_MI32x32x4x1_SE_AF0EM8_ASBE01_GRVW8_LPB8_PBD0_SRVW0_TT2_32_WG32_8_1_WGM4
    SolutionIndex: 253
    SolutionNameMin: Cijk_Ailk_Bljk_BBH_MT64x32x64_MI16x16x8x1_SE_AF0EM1_ASBE01_GRVW2_LPB2_PBD0_SRVW4_TT1_32_WG128_2_1_WGM10
    SolutionIndex: 254
    SolutionNameMin: Cijk_Ailk_Bljk_BBH_MT64x128x64_MI32x32x2x2_SE_AF0EM1_ASBE01_GRVW4_LPB4_PBD0_SRVW4_TT1_32_WG64_4_1_WGM1
    SolutionIndex: 255
    SolutionNameMin: Cijk_Ailk_Bljk_BBH_MT64x128x32_MI32x32x2x2_SE_AF0EM8_ASBE01_GRVW8_LPB8_PBD0_SRVW4_TT1_32_WG64_4_1_WGM1
    SolutionIndex: 256
    SolutionNameMin: Cijk_Ailk_Bljk_BBH_MT128x64x32_MI32x32x4x1_SE_AF0EM4_ASBE01_GRVW4_LPB4_PBD0_SRVW4_TT2_32_WG64_4_1_WGM4
    SolutionIndex: 257
    SolutionNameMin: Cijk_Ailk_Bljk_BBH_MT64x32x32_MI16x16x8x1_SE_AF0EM1_ASBE01_GRVW4_LPB4_PBD0_SRVW4_TT1_32_WG128_2_1_WGM1
    SolutionIndex: 258
    SolutionNameMin: Cijk_Ailk_Bljk_BBH_MT64x32x32_MI16x16x8x1_SE_AF0EM4_ASBE01_GRVW2_LPB2_PBD0_SRVW0_TT1_32_WG128_2_1_WGM1
    SolutionIndex: 259
    SolutionNameMin: Cijk_Ailk_Bljk_BBH_MT128x256x32_MI32x32x4x1_SE_GRVW8_GSU1_LPB8_PLR9_SU0_SUS256_SRVW4_WGM15
    SolutionIndex: 260
    SolutionNameMin: Cijk_Ailk_Bljk_BBH_MT128x256x32_MI32x32x4x1_SE_GRVW8_GSU1_LPB8_PLR9_SU0_SUS256_SRVW4_WGM2
    SolutionIndex: 261
    SolutionNameMin: Cijk_Ailk_Bljk_BBH_MT64x128x32_MI32x32x4x1_SE_GRVW8_GSU1_LPB8_PLR9_SU32_SUS256_SRVW4_WGM2
    SolutionIndex: 262
    SolutionNameMin: Cijk_Ailk_Bljk_BBH_MT128x256x32_MI32x32x4x1_SE_GRVW8_GSU1_LPB8_PLR9_SU32_SUS128_SRVW4_WGM15
    SolutionIndex: 263
    SolutionNameMin: Cijk_Ailk_Bljk_BBH_MT64x64x32_MI32x32x4x1_SE_GRVW8_GSU1_LPB8_PLR9_SU0_SUS256_SRVW4_WGM15
    SolutionIndex: 264
    SolutionNameMin: Cijk_Ailk_Bljk_BBH_MT128x96x32_MI32x32x4x1_SE_GRVW4_GSU1_LPB4_PLR9_SU32_SUS128_SRVW4_WGM15
    SolutionIndex: 265
    SolutionNameMin: Cijk_Ailk_Bljk_BBH_MT128x144x32_MI16x16x8x1_SE_GRVW2_GSU1_LPB4_PLR5_SU0_SUS256_SRVW4_WGM15
    SolutionIndex: 266
    SolutionNameMin: Cijk_Ailk_Bljk_BBH_MT32x32x32_MI16x16x8x1_SE_GRVW2_GSU1_LPB4_PLR5_SU0_SUS256_SRVW4_WGM1
    SolutionIndex: 267
    SolutionNameMin: Cijk_Ailk_Bljk_BBH_MT32x32x64_MI16x16x8x1_SE_GRVW2_GSU7_LPB4_PLR9_SU0_SUS256_SRVW0_WGM1
    SolutionIndex: 268
    SolutionNameMin: Cijk_Ailk_Bljk_BBH_MT128x96x32_MI32x32x4x1_SE_GRVW4_GSU15_LPB4_PLR9_SU32_SUS128_SRVW0_WGM2
    SolutionIndex: 269
    SolutionNameMin: Cijk_Ailk_Bljk_BBH_MT128x96x32_MI32x32x4x1_SE_GRVW4_GSU1_LPB4_PLR9_SU0_SUS256_SRVW4_WGM15
    SolutionIndex: 270
    SolutionNameMin: Cijk_Ailk_Bljk_BBH_MT128x128x32_MI32x32x4x1_SE_GRVW4_GSU7_LPB4_PLR9_SU32_SUS256_SRVW0_WGM1
    SolutionIndex: 271
    SolutionNameMin: Cijk_Ailk_Bljk_BBH_MT128x160x32_MI32x32x4x1_SE_GRVW2_GSU3_LPB4_PLR9_SU0_SUS256_SRVW0_WGM2
    SolutionIndex: 272
    SolutionNameMin: Cijk_Ailk_Bljk_BBH_MT128x96x32_MI32x32x4x1_SE_GRVW4_GSU1_LPB4_PLR9_SU0_SUS256_SRVW4_WGM2
    SolutionIndex: 273
    SolutionNameMin: Cijk_Ailk_Bljk_BBH_MT96x96x64_MI16x16x8x1_SE_GRVW8_GSU1_LPB8_PLR9_SU0_SUS256_SRVW0_WGM1
    SolutionIndex: 274
    SolutionNameMin: Cijk_Ailk_Bljk_BBH_MT128x96x32_MI32x32x4x1_SE_GRVW4_GSU1_LPB4_PLR9_SU32_SUS128_SRVW4_WGM2
    SolutionIndex: 275
    SolutionNameMin: Cijk_Ailk_Bljk_BBH_MT128x64x64_MI32x32x4x1_SE_GRVW2_GSU3_LPB4_PLR17_SU32_SUS128_SRVW0_WGM15
    SolutionIndex: 276
    SolutionNameMin: Cijk_Ailk_Bljk_BBH_MT128x160x32_MI32x32x4x1_SE_GRVW2_GSU3_LPB4_PLR9_SU0_SUS256_SRVW0_WGM15
    SolutionIndex: 277
    SolutionNameMin: Cijk_Ailk_Bljk_BBH_MT128x96x32_MI32x32x4x1_SE_GRVW4_GSU1_LPB4_PLR9_SU32_SUS256_SRVW4_WGM15
    SolutionIndex: 278
    SolutionNameMin: Cijk_Ailk_Bljk_BBH_MT128x144x32_MI16x16x8x1_SE_GRVW2_GSU5_LPB4_PLR5_SU0_SUS256_SRVW0_WGM1
    SolutionIndex: 279
    SolutionNameMin: Cijk_Ailk_Bljk_BBH_MT128x144x32_MI16x16x8x1_SE_GRVW2_GSU5_LPB4_PLR5_SU0_SUS256_SRVW0_WGM15
    SolutionIndex: 280
    SolutionNameMin: Cijk_Ailk_Bljk_BBH_MT128x96x64_MI32x32x4x1_SE_GRVW8_GSU3_LPB8_PLR17_SU0_SUS256_SRVW0_WGM2
    SolutionIndex: 281
    SolutionNameMin: Cijk_Ailk_Bljk_BBH_MT96x96x32_MI16x16x8x1_SE_GRVW4_GSU1_LPB4_PLR5_SU0_SUS256_SRVW0_WGM1
    SolutionIndex: 282
    SolutionNameMin: Cijk_Ailk_Bljk_BBH_MT128x96x32_MI32x32x4x1_SE_GRVW4_GSU1_LPB4_PLR9_SU0_SUS256_SRVW4_WGM1
    SolutionIndex: 283
    SolutionNameMin: Cijk_Ailk_Bljk_BBH_MT128x64x64_MI32x32x4x1_SE_GRVW8_GSU5_LPB8_PLR17_SU32_SUS128_SRVW0_WGM1
    SolutionIndex: 284
    SolutionNameMin: Cijk_Ailk_Bljk_BBH_MT96x96x64_MI16x16x8x1_SE_GRVW2_GSU5_LPB4_PLR9_SU0_SUS256_SRVW0_WGM2
    SolutionIndex: 285
    SolutionNameMin: Cijk_Ailk_Bljk_BBH_MT128x144x32_MI16x16x8x1_SE_GRVW2_GSU1_LPB4_PLR5_SU0_SUS256_SRVW4_WGM2
    SolutionIndex: 286
    SolutionNameMin: Cijk_Ailk_Bljk_BBH_MT128x160x32_MI32x32x4x1_SE_GRVW2_GSU1_LPB4_PLR9_SU32_SUS256_SRVW4_WGM15
    SolutionIndex: 287
    SolutionNameMin: Cijk_Ailk_Bljk_BBH_MT128x96x32_MI32x32x4x1_SE_GRVW2_GSU1_LPB4_PLR9_SU32_SUS256_SRVW4_WGM2
    SolutionIndex: 288
    SolutionNameMin: Cijk_Ailk_Bljk_BBH_MT128x144x32_MI16x16x8x1_SE_GRVW2_GSU1_LPB4_PLR5_SU32_SUS256_SRVW4_WGM15
    SolutionIndex: 289
    SolutionNameMin: Cijk_Ailk_Bljk_BBH_MT128x96x32_MI32x32x4x1_SE_GRVW2_GSU1_LPB4_PLR9_SU0_SUS256_SRVW4_WGM15
    SolutionIndex: 290
    SolutionNameMin: Cijk_Ailk_Bljk_BBH_MT64x128x32_MI32x32x4x1_SE_GRVW8_GSU1_LPB8_PLR9_SU0_SUS256_SRVW4_WGM1
    SolutionIndex: 291
    SolutionNameMin: Cijk_Ailk_Bljk_BBH_MT64x128x64_MI32x32x4x1_SE_GRVW8_GSU1_LPB8_PLR17_SU0_SUS256_SRVW4_WGM2
    SolutionIndex: 292
    SolutionNameMin: Cijk_Ailk_Bljk_BBH_MT128x160x32_MI32x32x4x1_SE_GRVW2_GSU1_LPB4_PLR9_SU32_SUS128_SRVW4_WGM15
    SolutionIndex: 293
    SolutionNameMin: Cijk_Ailk_Bljk_BBH_MT128x144x32_MI16x16x8x1_SE_GRVW2_GSU1_LPB4_PLR5_SU32_SUS128_SRVW4_WGM15
    SolutionIndex: 294
    SolutionNameMin: Cijk_Ailk_Bljk_BBH_MT128x144x32_MI16x16x8x1_SE_GRVW2_GSU1_LPB4_PLR5_SU0_SUS256_SRVW4_WGM1
    SolutionIndex: 295
    SolutionNameMin: Cijk_Ailk_Bljk_BBH_MT128x256x32_MI32x32x4x1_SE_GRVW8_GSU1_LPB8_PLR9_SU32_SUS256_SRVW4_WGM2
    SolutionIndex: 296
    SolutionNameMin: Cijk_Ailk_Bljk_BBH_MT128x96x32_MI32x32x4x1_SE_GRVW4_GSU1_LPB4_PLR9_SU32_SUS256_SRVW4_WGM2
    SolutionIndex: 297
    SolutionNameMin: Cijk_Ailk_Bljk_BBH_MT128x160x32_MI32x32x4x1_SE_GRVW2_GSU1_LPB4_PLR9_SU32_SUS256_SRVW4_WGM2
    SolutionIndex: 298
    SolutionNameMin: Cijk_Ailk_Bljk_BBH_MT96x96x32_MI16x16x8x1_SE_GRVW4_GSU1_LPB4_PLR5_SU0_SUS256_SRVW0_WGM2
    SolutionIndex: 299
    SolutionNameMin: Cijk_Ailk_Bljk_BBH_MT32x32x32_MI16x16x8x1_SE_GRVW4_GSU1_LPB4_PLR5_SU0_SUS256_SRVW4_WGM1
    SolutionIndex: 300
    SolutionNameMin: Cijk_Ailk_Bljk_BBH_MT32x32x64_MI16x16x8x1_SE_GRVW8_GSU7_LPB8_PLR9_SU0_SUS256_SRVW0_WGM1
    SolutionIndex: 301
    SolutionNameMin: Cijk_Ailk_Bljk_BBH_MT128x256x32_MI32x32x4x1_SE_GRVW8_GSU1_LPB8_PLR9_SU32_SUS256_SRVW4_WGM15
    SolutionIndex: 302
    SolutionNameMin: Cijk_Ailk_Bljk_BBH_MT32x32x64_MI16x16x8x1_SE_GRVW8_GSU1_LPB8_PLR9_SU0_SUS256_SRVW4_WGM15
    SolutionIndex: 303
    SolutionNameMin: Cijk_Ailk_Bljk_BBH_MT256x64x32_MI32x32x4x1_SE_GRVW8_GSU1_LPB8_PLR9_SU0_SUS256_SRVW4_WGM15
    SolutionIndex: 304
    SolutionNameMin: Cijk_Ailk_Bljk_BBH_MT144x128x32_MI16x16x8x1_SE_GRVW2_GSU1_LPB4_PLR5_SU0_SUS256_SRVW0_WGM15
    SolutionIndex: 305
    SolutionNameMin: Cijk_Ailk_Bljk_BBH_MT144x128x32_MI16x16x8x1_SE_GRVW2_GSU1_LPB4_PLR5_SU0_SUS256_SRVW0_WGM1
    SolutionIndex: 306
    SolutionNameMin: Cijk_Ailk_Bljk_BBH_MT144x128x32_MI16x16x8x1_SE_GRVW2_GSU1_LPB4_PLR5_SU0_SUS256_SRVW0_WGM2
    SolutionIndex: 307
    SolutionNameMin: Cijk_Ailk_Bljk_BBH_MT64x32x32_MI16x16x8x1_SE_GRVW8_GSU15_LPB8_PLR5_SU0_SUS256_SRVW0_WGM15
    SolutionIndex: 308
    SolutionNameMin: Cijk_Ailk_Bljk_BBH_MT128x144x32_MI16x16x8x1_SE_GRVW2_GSU1_LPB4_PLR5_SU32_SUS128_SRVW4_WGM1
    SolutionIndex: 309
    SolutionNameMin: Cijk_Ailk_Bljk_BBH_MT96x96x32_MI16x16x8x1_SE_GRVW4_GSU1_LPB4_PLR5_SU32_SUS128_SRVW0_WGM15
    SolutionIndex: 310
    SolutionNameMin: Cijk_Ailk_Bljk_BBH_MT96x96x64_MI16x16x8x1_SE_GRVW8_GSU1_LPB8_PLR9_SU0_SUS256_SRVW0_WGM15
    SolutionIndex: 311
    SolutionNameMin: Cijk_Ailk_Bljk_BBH_MT64x16x32_MI16x16x8x1_SE_GRVW2_GSU7_LPB4_PLR5_SU32_SUS128_SRVW0_WGM1
    SolutionIndex: 312
    SolutionNameMin: Cijk_Ailk_Bljk_BBH_MT128x256x32_MI32x32x4x1_SE_GRVW8_GSU1_LPB8_PLR9_SU0_SUS256_SRVW4_WGM1
    SolutionIndex: 313
    SolutionNameMin: Cijk_Ailk_Bljk_BBH_MT64x128x32_MI32x32x4x1_SE_GRVW8_GSU1_LPB8_PLR9_SU32_SUS128_SRVW4_WGM15
    SolutionIndex: 314
    SolutionNameMin: Cijk_Ailk_Bljk_BBH_MT128x64x32_MI32x32x4x1_SE_GRVW8_GSU1_LPB8_PLR9_SU0_SUS256_SRVW4_WGM15
    SolutionIndex: 315
    SolutionNameMin: Cijk_Ailk_Bljk_BBH_MT128x64x64_MI32x32x4x1_SE_GRVW8_GSU1_LPB8_PLR17_SU0_SUS256_SRVW4_WGM1
    SolutionIndex: 316
    SolutionNameMin: Cijk_Ailk_Bljk_BBH_MT96x96x64_MI16x16x8x1_SE_GRVW8_GSU1_LPB8_PLR9_SU32_SUS256_SRVW0_WGM15
    SolutionIndex: 317
    SolutionNameMin: Cijk_Ailk_Bljk_BBH_MT128x160x32_MI32x32x4x1_SE_GRVW2_GSU1_LPB4_PLR9_SU32_SUS128_SRVW4_WGM2
    SolutionIndex: 318
    SolutionNameMin: Cijk_Ailk_Bljk_BBH_MT128x256x32_MI32x32x4x1_SE_GRVW8_GSU1_LPB8_PLR9_SU32_SUS256_SRVW4_WGM1
    SolutionIndex: 319
    SolutionNameMin: Cijk_Ailk_Bljk_BBH_MT128x96x64_MI32x32x4x1_SE_GRVW2_GSU1_LPB4_PLR17_SU32_SUS256_SRVW4_WGM15
    SolutionIndex: 320
    SolutionNameMin: Cijk_Ailk_Bljk_BBH_MT128x96x64_MI32x32x4x1_SE_GRVW2_GSU1_LPB4_PLR17_SU0_SUS256_SRVW4_WGM2
    SolutionIndex: 321
    SolutionNameMin: Cijk_Ailk_Bljk_BBH_MT128x64x32_MI32x32x4x1_SE_GRVW8_GSU1_LPB8_PLR9_SU0_SUS256_SRVW4_WGM2
    SolutionIndex: 322
    SolutionNameMin: Cijk_Ailk_Bljk_BBH_MT64x32x32_MI16x16x8x1_SE_GRVW8_GSU1_LPB8_PLR5_SU32_SUS256_SRVW4_WGM1
    SolutionIndex: 323
    SolutionNameMin: Cijk_Ailk_Bljk_BBH_MT32x32x64_MI16x16x8x1_SE_GRVW8_GSU1_LPB8_PLR9_SU0_SUS256_SRVW4_WGM2
    SolutionIndex: 324
    SolutionNameMin: Cijk_Ailk_Bljk_BBH_MT32x32x64_MI16x16x8x1_SE_GRVW8_GSU1_LPB8_PLR9_SU32_SUS128_SRVW4_WGM2
    SolutionIndex: 325
    SolutionNameMin: Cijk_Ailk_Bljk_BBH_MT64x128x32_MI32x32x4x1_SE_GRVW8_GSU1_LPB8_PLR9_SU32_SUS256_SRVW4_WGM1
    SolutionIndex: 326
    SolutionNameMin: Cijk_Ailk_Bljk_BBH_MT64x128x32_MI32x32x4x1_SE_GRVW8_GSU1_LPB8_PLR9_SU32_SUS128_SRVW4_WGM2
    SolutionIndex: 327
    SolutionNameMin: Cijk_Ailk_Bljk_BBH_MT64x128x64_MI32x32x4x1_SE_GRVW8_GSU1_LPB8_PLR17_SU0_SUS256_SRVW4_WGM1
    SolutionIndex: 328
    SolutionNameMin: Cijk_Ailk_Bljk_BBH_MT64x64x32_MI32x32x4x1_SE_GRVW8_GSU1_LPB8_PLR9_SU32_SUS256_SRVW4_WGM15
    SolutionIndex: 329
    SolutionNameMin: Cijk_Ailk_Bljk_BBH_MT64x32x32_MI16x16x8x1_SE_GRVW4_GSU1_LPB4_PLR5_SU0_SUS256_SRVW4_WGM1
    SolutionIndex: 330
    SolutionNameMin: Cijk_Ailk_Bljk_BBH_MT32x64x32_MI16x16x8x1_SE_GRVW8_GSU1_LPB8_PLR5_SU0_SUS256_SRVW4_WGM1
    SolutionIndex: 331
    SolutionNameMin: Cijk_Ailk_Bljk_BBH_MT64x128x32_MI32x32x4x1_SE_GRVW8_GSU1_LPB8_PLR9_SU0_SUS256_SRVW4_WGM2
    SolutionIndex: 332
    SolutionNameMin: Cijk_Ailk_Bljk_BBH_MT32x32x64_MI16x16x8x1_SE_GRVW8_GSU1_LPB8_PLR9_SU32_SUS256_SRVW4_WGM1
    SolutionIndex: 333
    SolutionNameMin: Cijk_Ailk_Bljk_BBH_MT96x96x32_MI16x16x8x1_SE_GRVW4_GSU1_LPB4_PLR5_SU0_SUS256_SRVW0_WGM1
    SolutionIndex: 334
    SolutionNameMin: Cijk_Ailk_Bljk_BBH_MT64x32x64_MI16x16x8x1_SE_GRVW4_GSU1_LPB4_PLR9_SU0_SUS256_SRVW4_WGM1
    SolutionIndex: 335
    SolutionNameMin: Cijk_Ailk_Bljk_BBH_MT32x64x64_MI16x16x8x1_SE_GRVW8_GSU1_LPB8_PLR9_SU0_SUS256_SRVW4_WGM1
    SolutionIndex: 336
    SolutionNameMin: Cijk_Ailk_Bljk_BBH_MT256x64x32_MI32x32x4x1_SE_GRVW8_GSU3_LPB8_PLR9_SU0_SUS256_SRVW0_WGM15
    SolutionIndex: 337
    SolutionNameMin: Cijk_Ailk_Bljk_BBH_MT32x32x64_MI16x16x8x1_SE_GRVW8_GSU1_LPB8_PLR9_SU32_SUS128_SRVW4_WGM15
    SolutionIndex: 338
    SolutionNameMin: Cijk_Ailk_Bljk_BBH_MT32x32x32_MI16x16x8x1_SE_GRVW8_GSU1_LPB8_PLR5_SU0_SUS256_SRVW4_WGM1
    SolutionIndex: 339
    SolutionNameMin: Cijk_Ailk_Bljk_BBH_MT64x32x32_MI16x16x8x1_SE_GRVW8_GSU1_LPB8_PLR5_SU0_SUS256_SRVW4_WGM2
    SolutionIndex: 340
    SolutionNameMin: Cijk_Ailk_Bljk_BBH_MT128x128x32_MI32x32x4x1_SE_GRVW8_GSU1_LPB8_PLR9_SU0_SUS256_SRVW4_WGM1
    SolutionIndex: 341
    SolutionNameMin: Cijk_Ailk_Bljk_BBH_MT128x64x32_MI32x32x4x1_SE_GRVW8_GSU1_LPB8_PLR9_SU0_SUS256_SRVW4_WGM1
    SolutionIndex: 342
    SolutionNameMin: Cijk_Ailk_Bljk_BBH_MT128x64x64_MI32x32x4x1_SE_GRVW8_GSU5_LPB8_PLR17_SU0_SUS256_SRVW0_WGM15
    SolutionIndex: 343
    SolutionNameMin: Cijk_Ailk_Bljk_BBH_MT64x256x32_MI32x32x4x1_SE_GRVW4_GSU7_LPB4_PLR9_SU0_SUS256_SRVW0_WGM15
    SolutionIndex: 344
    SolutionNameMin: Cijk_Ailk_Bljk_BBH_MT64x128x32_MI32x32x4x1_SE_GRVW2_GSU1_LPB4_PLR9_SU0_SUS256_SRVW4_WGM1
    SolutionIndex: 345
    SolutionNameMin: Cijk_Ailk_Bljk_BBH_MT32x64x32_MI16x16x8x1_SE_GRVW8_GSU1_LPB8_PLR5_SU0_SUS256_SRVW4_WGM2
    SolutionIndex: 346
    SolutionNameMin: Cijk_Ailk_Bljk_BBH_MT128x96x32_MI32x32x4x1_SE_GRVW4_GSU1_LPB4_PLR9_SU0_SUS256_SRVW4_WGM15
    SolutionIndex: 347
    SolutionNameMin: Cijk_Ailk_Bljk_BBH_MT32x32x64_MI16x16x8x1_SE_GRVW4_GSU5_LPB4_PLR9_SU0_SUS256_SRVW0_WGM1
    SolutionIndex: 348
    SolutionNameMin: Cijk_Ailk_Bljk_BBH_MT32x32x64_MI16x16x8x1_SE_GRVW8_GSU5_LPB8_PLR9_SU0_SUS256_SRVW0_WGM1
    SolutionIndex: 349
    SolutionNameMin: Cijk_Ailk_Bljk_BBH_MT64x128x64_MI32x32x4x1_SE_GRVW8_GSU3_LPB8_PLR17_SU32_SUS128_SRVW0_WGM1
    SolutionIndex: 350
    SolutionNameMin: Cijk_Ailk_Bljk_BBH_MT128x144x32_MI16x16x8x1_SE_1LDSB1_GRVW2_LPB4_NLCA1_PLR5_SU32_SUS256_SRVW4_TT2_144_WG64_4_1_WGM1
    SolutionIndex: 351
    SolutionNameMin: Cijk_Ailk_Bljk_BBH_MT128x256x32_MI32x32x4x1_SE_1LDSB1_GRVW8_LPB8_NLCA1_PLR9_SU0_SUS256_SRVW4_TT2_128_WG64_4_1_WGM1
    SolutionIndex: 352
    SolutionNameMin: Cijk_Ailk_Bljk_BBH_MT64x128x32_MI32x32x4x1_SE_1LDSB0_GRVW8_LPB8_NLCA1_PLR9_SU32_SUS128_SRVW4_TT1_64_WG64_4_1_WGM1
    SolutionIndex: 353
    SolutionNameMin: Cijk_Ailk_Bljk_BBH_MT64x128x32_MI32x32x4x1_SE_1LDSB0_GRVW8_LPB8_NLCA1_PLR9_SU0_SUS256_SRVW4_TT1_64_WG64_4_1_WGM1
    SolutionIndex: 354
    SolutionNameMin: Cijk_Ailk_Bljk_BBH_MT128x64x32_MI32x32x4x1_SE_1LDSB0_GRVW8_LPB8_NLCA1_PLR9_SU0_SUS256_SRVW4_TT2_32_WG64_4_1_WGM1
    SolutionIndex: 355
    SolutionNameMin: Cijk_Ailk_Bljk_BBH_MT64x128x32_MI32x32x4x1_SE_1LDSB0_GRVW8_LPB8_NLCA1_PLR9_SU32_SUS256_SRVW4_TT1_64_WG64_4_1_WGM1
    SolutionIndex: 356
    SolutionNameMin: Cijk_Ailk_Bljk_BBH_MT128x256x32_MI32x32x4x1_SE_1LDSB1_GRVW8_LPB8_NLCA1_PLR9_SU32_SUS256_SRVW4_TT2_128_WG64_4_1_WGM15
    SolutionIndex: 357
    SolutionNameMin: Cijk_Ailk_Bljk_BBH_MT64x128x32_MI32x32x4x1_SE_1LDSB0_GRVW8_LPB8_NLCA1_PLR9_SU0_SUS256_SRVW4_TT1_64_WG64_4_1_WGM15
    SolutionIndex: 358
    SolutionNameMin: Cijk_Ailk_Bljk_BBH_MT64x128x32_MI32x32x4x1_SE_1LDSB0_GRVW8_LPB8_NLCA1_PLR9_SU0_SUS256_SRVW4_TT1_64_WG64_4_1_WGM2
    SolutionIndex: 359
    SolutionNameMin: Cijk_Ailk_Bljk_BBH_MT128x96x32_MI32x32x4x1_SE_1LDSB0_GRVW4_LPB4_NLCA1_PLR9_SU0_SUS256_SRVW4_TT1_96_WG128_2_1_WGM15
    SolutionIndex: 360
    SolutionNameMin: Cijk_Ailk_Bljk_BBH_MT64x128x32_MI32x32x4x1_SE_1LDSB0_GRVW4_LPB4_NLCA1_PLR9_SU0_SUS256_SRVW4_TT1_64_WG64_4_1_WGM1
    SolutionIndex: 361
    SolutionNameMin: Cijk_Ailk_Bljk_BBH_MT64x128x32_MI32x32x4x1_SE_1LDSB0_GRVW2_LPB4_NLCA1_PLR9_SU0_SUS256_SRVW4_TT1_64_WG64_4_1_WGM1
    SolutionIndex: 362
    SolutionNameMin: Cijk_Ailk_Bljk_BBH_MT64x128x32_MI32x32x4x1_SE_1LDSB0_GRVW2_LPB4_NLCA1_PLR9_SU32_SUS256_SRVW4_TT1_64_WG64_4_1_WGM1
    SolutionIndex: 363
    SolutionNameMin: Cijk_Ailk_Bljk_BBH_MT64x128x32_MI32x32x4x1_SE_1LDSB0_GRVW8_LPB8_NLCA1_PLR9_SU0_SUS256_SRVW4_TT1_64_WG64_4_1_WGM15
- - - [64, 35, 1, 35]
    - [5, 0.005]
  - - [64, 35, 1, 32]
    - [4, 0.005]
  - - [64, 15, 1, 15]
    - [3, 0.001]
  - - [64, 15, 1, 17]
    - [6, 0.001]
  - - [64, 17, 1, 17]
    - [4, 0.001]
  - - [64, 30, 1, 30]
    - [3, 0.004]
  - - [64, 32, 1, 32]
    - [13, 0.005]
  - - [64, 31, 1, 31]
    - [9, 0.004]
  - - [64, 24, 1, 24]
    - [6, 0.003]
  - - [64, 15, 1, 15]
    - [7, 0.001]
  - - [64, 17, 1, 17]
    - [4, 0.001]
  - - [64, 34, 1, 34]
    - [4, 0.004]
  - - [64, 14, 1, 15]
    - [3, 0.001]
  - - [64, 17, 1, 21]
    - [3, 0.001]
  - - [64, 14, 1, 14]
    - [3, 0.001]
  - - [64, 24, 1, 34]
    - [14, 0.004]
  - - [64, 21, 1, 21]
    - [5, 0.002]
  - - [64, 31, 1, 30]
    - [12, 0.004]
  - - [64, 128, 512, 128]
    - [84, 28.792]
  - - [64, 512, 1, 512]
    - [217, 3.237]
  - - [64, 512, 64, 512]
    - [126, 44.66]
  - - [128, 128, 512, 64]
    - [109, 27.606]
  - - [512, 512, 1, 64]
    - [133, 4.83]
  - - [512, 512, 64, 64]
    - [117, 38.353]
  - - [1024, 4, 1, 2]
    - [88, 0.003]
  - - [1024, 4, 1, 1024]
    - [174, 0.564]
  - - [1024, 32, 1, 2]
    - [124, 0.022]
  - - [1024, 32, 1, 1024]
    - [92, 4.759]
  - - [1024, 2048, 1, 2]
    - [171, 0.623]
  - - [1024, 2048, 1, 1024]
    - [146, 67.44]
  - - [1024, 2048, 1, 4096]
    - [146, 82.406]
  - - [1024, 2048, 1, 30528]
    - [285, 89.711]
  - - [1024, 4096, 1, 1024]
    - [110, 80.307]
  - - [1024, 4096, 1, 4096]
    - [269, 89.047]
  - - [1024, 4096, 1, 30528]
    - [272, 92.724]
  - - [4096, 2048, 1, 1024]
    - [154, 84.264]
  - - [4096, 4096, 1, 1024]
    - [264, 87.951]
  - - [32, 33, 1600, 33]
    - [134, 4.517]
  - - [32, 200, 1, 1]
    - [140, 0.001]
  - - [64, 3, 512, 3]
    - [96, 0.052]
  - - [64, 5, 512, 5]
    - [124, 0.147]
  - - [64, 5, 960, 5]
    - [96, 0.232]
  - - [64, 9, 512, 9]
    - [108, 0.443]
  - - [64, 512, 1, 1]
    - [124, 0.012]
  - - [67, 512, 1, 2048]
    - [348, 6.446]
  - - [74, 512, 1, 2048]
    - [347, 6.916]
  - - [74, 960, 1, 2048]
    - [132, 12.157]
  - - [100, 512, 1, 2048]
    - [127, 9.574]
  - - [128, 27, 32768, 27]
    - [96, 7.871]
  - - [256, 1024, 1, 1]
    - [124, 0.088]
  - - [256, 8976, 1, 1536]
    - [114, 76.37]
  - - [256, 8976, 1, 2048]
    - [114, 79.784]
  - - [256, 8976, 1, 2304]
    - [114, 81.09]
  - - [256, 8976, 1, 2560]
    - [192, 81.921]
  - - [256, 8976, 1, 2816]
    - [114, 82.557]
  - - [256, 8976, 1, 3072]
    - [114, 83.199]
  - - [256, 8976, 1, 4352]
    - [188, 85.155]
  - - [256, 8976, 1, 4864]
    - [114, 86.052]
  - - [256, 8976, 1, 5376]
    - [87, 86.694]
  - - [256, 8976, 1, 5632]
    - [87, 86.848]
  - - [256, 8976, 1, 5888]
    - [114, 87.17]
  - - [256, 8976, 1, 6144]
    - [87, 87.325]
  - - [256, 8976, 1, 6656]
    - [87, 87.462]
  - - [256, 8976, 1, 7168]
    - [87, 87.73]
  - - [256, 8976, 1, 7424]
    - [87, 87.79]
  - - [256, 8976, 1, 8192]
    - [87, 88.28]
  - - [256, 8976, 1, 8448]
    - [87, 88.359]
  - - [256, 8976, 1, 8960]
    - [87, 88.546]
  - - [256, 8976, 1, 9472]
    - [106, 88.597]
  - - [256, 8976, 1, 9728]
    - [87, 88.716]
  - - [256, 8976, 1, 9984]
    - [87, 88.864]
  - - [256, 8976, 1, 10240]
    - [87, 89.06]
  - - [256, 8976, 1, 10496]
    - [87, 88.966]
  - - [256, 8976, 1, 11008]
    - [87, 89.091]
  - - [256, 8976, 1, 11520]
    - [87, 89.142]
  - - [256, 8976, 1, 12288]
    - [87, 89.361]
  - - [256, 8976, 1, 14336]
    - [106, 89.604]
  - - [256, 8976, 1, 14848]
    - [87, 89.701]
  - - [256, 8976, 1, 15104]
    - [87, 89.834]
  - - [256, 8976, 1, 15872]
    - [106, 89.855]
  - - [256, 8976, 1, 17152]
    - [87, 89.939]
  - - [256, 8976, 1, 19712]
    - [106, 90.15]
  - - [256, 8976, 1, 19968]
    - [87, 90.191]
  - - [256, 8976, 1, 20480]
    - [286, 90.164]
  - - [256, 8976, 1, 20992]
    - [87, 90.319]
  - - [256, 8976, 1, 22016]
    - [106, 90.307]
  - - [256, 8976, 1, 26112]
    - [87, 90.515]
  - - [256, 8976, 1, 33536]
    - [292, 91.004]
  - - [256, 8976, 1, 44505]
    - [297, 90.671]
  - - [256, 32768, 1, 128]
    - [143, 49.017]
  - - [257, 1024, 1, 4096]
    - [349, 31.086]
  - - [480, 32768, 1, 1024]
    - [298, 85.688]
  - - [512, 200, 1, 1]
    - [124, 0.034]
  - - [512, 200, 1, 32]
    - [213, 1.095]
  - - [512, 215, 1, 2048]
    - [90, 19.444]
  - - [512, 256, 1, 2048]
    - [91, 20.508]
  - - [512, 1600, 1, 32]
    - [84, 7.111]
  - - [512, 1600, 1, 512]
    - [162, 42.899]
  - - [512, 32768, 1, 256]
    - [97, 72.947]
  - - [560, 200, 1, 1024]
    - [168, 13.585]
  - - [560, 1600, 1, 1024]
    - [193, 57.626]
  - - [768, 215, 1, 2048]
    - [142, 24.821]
  - - [768, 256, 1, 2048]
    - [205, 28.985]
  - - [1024, 200, 1, 1]
    - [108, 0.07]
  - - [1024, 512, 1, 1]
    - [204, 0.148]
  - - [1024, 512, 1, 64]
    - [149, 8.845]
  - - [1024, 512, 1, 1024]
    - [164, 39.561]
  - - [1024, 960, 1, 64]
    - [211, 14.361]
  - - [1024, 960, 1, 1024]
    - [263, 63.438]
  - - [1024, 1600, 1, 1]
    - [86, 0.295]
  - - [1024, 1600, 1, 1024]
    - [95, 64.084]
  - - [1024, 1792, 1, 256]
    - [201, 48.31]
  - - [1024, 2048, 1, 256]
    - [166, 43.126]
  - - [1024, 2560, 1, 256]
    - [143, 50.647]
  - - [1024, 3072, 1, 256]
    - [179, 50.921]
  - - [1024, 3328, 1, 256]
    - [167, 54.43]
  - - [1024, 3840, 1, 256]
    - [110, 59.622]
  - - [1024, 4096, 1, 256]
    - [117, 56.932]
  - - [1024, 4608, 1, 256]
    - [187, 60.614]
  - - [1024, 4864, 1, 256]
    - [128, 58.35]
  - - [1024, 5120, 1, 256]
    - [153, 60.242]
  - - [1024, 5632, 1, 256]
    - [125, 62.803]
  - - [1024, 6144, 1, 256]
    - [121, 64.414]
  - - [1024, 6400, 1, 256]
    - [101, 64.347]
  - - [1024, 7168, 1, 256]
    - [259, 68.29]
  - - [1024, 7424, 1, 256]
    - [259, 70.456]
  - - [1024, 7680, 1, 256]
    - [301, 71.639]
  - - [1024, 7936, 1, 256]
    - [121, 65.773]
  - - [1024, 8192, 1, 256]
    - [119, 68.356]
  - - [1024, 8448, 1, 256]
    - [125, 70.854]
  - - [1024, 8704, 1, 256]
    - [128, 66.727]
  - - [1024, 8960, 1, 256]
    - [109, 66.811]
  - - [1024, 9728, 1, 256]
    - [119, 70.089]
  - - [1024, 9984, 1, 256]
    - [180, 71.827]
  - - [1024, 10240, 1, 256]
    - [101, 68.636]
  - - [1024, 10496, 1, 256]
    - [260, 69.125]
  - - [1024, 11008, 1, 256]
    - [260, 72.595]
  - - [1024, 11264, 1, 256]
    - [259, 73.688]
  - - [1024, 11520, 1, 256]
    - [259, 75.464]
  - - [1024, 12288, 1, 256]
    - [121, 74.433]
  - - [1024, 13312, 1, 256]
    - [121, 72.896]
  - - [1024, 13568, 1, 256]
    - [97, 71.968]
  - - [1024, 14336, 1, 256]
    - [259, 73.118]
  - - [1024, 14592, 1, 256]
    - [259, 74.734]
  - - [1024, 14848, 1, 256]
    - [260, 76.364]
  - - [1024, 15104, 1, 256]
    - [260, 76.637]
  - - [1024, 16128, 1, 256]
    - [97, 75.006]
  - - [1024, 17152, 1, 256]
    - [119, 74.672]
  - - [1024, 18944, 1, 256]
    - [259, 79.308]
  - - [1024, 19712, 1, 256]
    - [121, 77.373]
  - - [1024, 19968, 1, 256]
    - [121, 77.266]
  - - [1024, 20480, 1, 256]
    - [150, 76.298]
  - - [1024, 20992, 1, 256]
    - [97, 77.616]
  - - [1024, 21504, 1, 256]
    - [113, 77.523]
  - - [1024, 22016, 1, 256]
    - [259, 77.938]
  - - [1024, 23552, 1, 256]
    - [121, 77.089]
  - - [1024, 28672, 1, 256]
    - [125, 78.415]
  - - [1024, 32768, 1, 512]
    - [98, 87.497]
  - - [1024, 32768, 1, 1024]
    - [269, 92.347]
  - - [1024, 33536, 1, 256]
    - [259, 81.055]
  - - [1024, 40448, 1, 256]
    - [121, 80.937]
  - - [1600, 512, 1, 1024]
    - [161, 53.043]
  - - [2048, 512, 1, 1]
    - [206, 0.22]
  - - [2048, 512, 1, 2048]
    - [151, 62.219]
  - - [2048, 960, 1, 2048]
    - [303, 80.004]
  - - [2048, 1024, 1, 1]
    - [129, 0.304]
  - - [2048, 1024, 1, 256]
    - [138, 42.759]
  - - [3200, 1024, 1, 2048]
    - [103, 76.125]
  - - [4096, 1024, 1, 1]
    - [131, 0.407]
  - - [64, 14, 10880, 14]
    - [96, 2.478]
  - - [64, 14, 10880, 15]
    - [96, 2.632]
  - - [64, 15, 7680, 15]
    - [96, 2.692]
  - - [64, 15, 10880, 15]
    - [96, 2.813]
  - - [64, 15, 7680, 17]
    - [96, 2.911]
  - - [64, 17, 6144, 17]
    - [96, 3.203]
  - - [64, 17, 7680, 17]
    - [96, 3.303]
  - - [64, 17, 6144, 21]
    - [96, 3.853]
  - - [64, 21, 6144, 21]
    - [96, 4.718]
  - - [64, 24, 4736, 24]
    - [96, 6.007]
  - - [64, 24, 4736, 34]
    - [96, 7.407]
  - - [64, 30, 2048, 30]
    - [148, 6.987]
  - - [64, 31, 2048, 30]
    - [96, 7.198]
  - - [64, 31, 2048, 31]
    - [96, 7.344]
  - - [64, 32, 4608, 32]
    - [208, 12.817]
  - - [64, 34, 4736, 34]
    - [155, 6.754]
  - - [64, 35, 4608, 32]
    - [96, 10.252]
  - - [64, 35, 4608, 35]
    - [147, 6.714]
  - - [1024, 3840, 1, 1024]
    - [112, 79.414]
  - - [1024, 3840, 1, 4096]
    - [123, 92.386]
  - - [1024, 3968, 1, 1024]
    - [110, 78.032]
  - - [1024, 3968, 1, 4096]
    - [269, 86.217]
  - - [1024, 3968, 1, 42720]
    - [269, 89.943]
  - - [1024, 6528, 1, 1024]
    - [89, 83.193]
  - - [1024, 6528, 1, 4096]
    - [272, 87.169]
  - - [1024, 6528, 1, 42720]
    - [291, 93.413]
  - - [1024, 7104, 1, 1024]
    - [269, 86.651]
  - - [1024, 7104, 1, 4096]
    - [269, 93.682]
  - - [1024, 7104, 1, 42720]
    - [292, 96.572]
  - - [1024, 7200, 1, 1024]
    - [269, 87.172]
  - - [1024, 7200, 1, 4096]
    - [100, 93.658]
  - - [1024, 7200, 1, 42720]
    - [292, 97.776]
  - - [1024, 8064, 1, 1024]
    - [269, 85.317]
  - - [1024, 8064, 1, 4096]
    - [269, 89.948]
  - - [1024, 8160, 1, 1024]
    - [269, 85.916]
  - - [1024, 8160, 1, 4096]
    - [269, 90.812]
  - - [1024, 9216, 1, 1024]
    - [290, 84.718]
  - - [1024, 9216, 1, 4096]
    - [112, 90.12]
  - - [1024, 9520, 1, 1024]
    - [98, 85.275]
  - - [1024, 9520, 1, 4096]
    - [100, 92.586]
  - - [1024, 9520, 1, 42720]
    - [286, 97.056]
  - - [1024, 10064, 1, 1024]
    - [269, 87.473]
  - - [1024, 10064, 1, 4096]
    - [289, 92.817]
  - - [1024, 10080, 1, 1024]
    - [269, 88.991]
  - - [1024, 10080, 1, 4096]
    - [202, 92.757]
  - - [1024, 10080, 1, 42720]
    - [277, 97.243]
  - - [1024, 10200, 1, 1024]
    - [290, 85.04]
  - - [1024, 10200, 1, 4096]
    - [265, 90.509]
  - - [4096, 3840, 1, 1024]
    - [295, 92.612]
  - - [4096, 3968, 1, 1024]
    - [101, 85.955]
  - - [4096, 6528, 1, 1024]
    - [264, 90.113]
  - - [4096, 7104, 1, 1024]
    - [296, 91.619]
  - - [4096, 7200, 1, 1024]
    - [152, 90.277]
  - - [4096, 8064, 1, 1024]
    - [294, 93.48]
  - - [4096, 8160, 1, 1024]
    - [296, 91.999]
  - - [4096, 9216, 1, 1024]
    - [282, 92.14]
  - - [4096, 9520, 1, 1024]
    - [293, 91.767]
  - - [4096, 10064, 1, 1024]
    - [293, 92.103]
  - - [4096, 10080, 1, 1024]
    - [294, 93.009]
  - - [4096, 10200, 1, 1024]
    - [294, 93.043]
  - - [64, 27, 1920, 27]
    - [16, 2.212]
  - - [64, 33, 1920, 27]
    - [20, 2.176]
  - - [64, 33, 1920, 33]
    - [21, 2.734]
  - - [1024, 3240, 1, 1024]
    - [23, 34.747]
  - - [1024, 3240, 1, 4096]
    - [29, 38.008]
  - - [1024, 3960, 1, 1024]
    - [25, 34.758]
  - - [1024, 3960, 1, 4096]
    - [26, 37.079]
  - - [1024, 3960, 1, 42720]
    - [24, 39.481]
  - - [4096, 3240, 1, 1024]
    - [30, 40.489]
  - - [4096, 3960, 1, 1024]
    - [19, 41.988]
  - - [64, 192, 64, 1280]
    - [219, 49.975]
  - - [64, 320, 64, 1280]
    - [232, 52.865]
  - - [64, 384, 64, 1280]
    - [232, 60.68]
  - - [64, 448, 64, 1280]
    - [237, 60.139]
  - - [64, 192, 64, 2048]
    - [231, 48.544]
  - - [64, 320, 64, 2048]
    - [248, 52.446]
  - - [64, 384, 64, 2048]
    - [358, 58.994]
  - - [64, 448, 64, 2048]
    - [249, 59.408]
  - - [1225, 32, 64, 192]
    - [228, 26.594]
  - - [1225, 48, 64, 192]
    - [238, 25.907]
  - - [1225, 64, 64, 192]
    - [244, 39.628]
  - - [1225, 48, 64, 256]
    - [247, 30.153]
  - - [1225, 64, 64, 256]
    - [240, 45.276]
  - - [1225, 48, 64, 288]
    - [246, 32.404]
  - - [1225, 64, 64, 288]
    - [233, 47.534]
  - - [5329, 80, 64, 64]
    - [257, 22.903]
  - - [289, 128, 64, 768]
    - [222, 50.869]
  - - [289, 160, 64, 768]
    - [221, 46.593]
  - - [289, 192, 64, 768]
    - [240, 55.547]
  - - [64, 192, 32, 1280]
    - [243, 40.259]
  - - [64, 320, 32, 1280]
    - [219, 44.604]
  - - [64, 384, 32, 1280]
    - [237, 51.76]
  - - [64, 448, 32, 1280]
    - [224, 58.616]
  - - [64, 192, 32, 2048]
    - [251, 41.07]
  - - [64, 320, 32, 2048]
    - [252, 47.942]
  - - [64, 384, 32, 2048]
    - [230, 53.735]
  - - [64, 448, 32, 2048]
    - [231, 58.714]
  - - [1225, 32, 32, 192]
    - [225, 22.882]
  - - [1225, 48, 32, 192]
    - [228, 22.316]
  - - [1225, 64, 32, 192]
    - [224, 33.766]
  - - [1225, 48, 32, 256]
    - [238, 25.759]
  - - [1225, 64, 32, 256]
    - [239, 36.538]
  - - [1225, 48, 32, 288]
    - [238, 26.621]
  - - [1225, 64, 32, 288]
    - [219, 40.248]
  - - [5329, 80, 32, 64]
    - [228, 21.759]
  - - [289, 128, 32, 768]
    - [363, 42.539]
  - - [289, 160, 32, 768]
    - [231, 40.982]
  - - [289, 192, 32, 768]
    - [219, 47.091]
  - - [3136, 256, 64, 64]
    - [350, 46.206]
  - - [3136, 64, 64, 64]
    - [223, 31.66]
  - - [3136, 64, 64, 256]
    - [220, 56.207]
  - - [784, 512, 64, 128]
    - [356, 53.612]
  - - [784, 128, 64, 512]
    - [357, 66.537]
  - - [196, 1024, 64, 256]
    - [226, 52.203]
  - - [196, 256, 64, 1024]
    - [242, 54.226]
  - - [49, 2048, 64, 512]
    - [362, 41.058]
  - - [49, 512, 64, 2048]
    - [218, 38.299]
  - - [3136, 256, 32, 64]
    - [255, 41.085]
  - - [3136, 64, 32, 64]
    - [258, 26.9]
  - - [3136, 64, 32, 256]
    - [235, 52.336]
  - - [784, 512, 32, 128]
    - [234, 49.002]
  - - [784, 128, 32, 512]
    - [236, 60.817]
  - - [196, 1024, 32, 256]
    - [242, 48.692]
  - - [196, 256, 32, 1024]
    - [245, 42.8]
  - - [49, 2048, 32, 512]
    - [250, 35.577]
  - - [49, 512, 32, 2048]
    - [253, 32.983]
  - - [3136, 128, 64, 64]
    - [236, 40.121]
  - - [3136, 256, 64, 128]
    - [351, 65.198]
  - - [784, 512, 64, 256]
    - [352, 69.741]
  - - [3136, 128, 64, 256]
    - [227, 73.182]
  - - [3136, 256, 64, 256]
    - [351, 78.679]
  - - [196, 1024, 64, 512]
    - [359, 60.817]
  - - [784, 256, 64, 512]
    - [353, 75.425]
  - - [784, 512, 64, 512]
    - [353, 79.543]
  - - [196, 512, 64, 1024]
    - [256, 62.231]
  - - [196, 1024, 64, 1024]
    - [359, 65.615]
  - - [49, 2048, 64, 1024]
    - [360, 47.563]
  - - [49, 1024, 64, 2048]
    - [254, 45.221]
  - - [3136, 128, 32, 64]
    - [236, 35.95]
  - - [3136, 256, 32, 128]
    - [236, 59.813]
  - - [784, 512, 32, 256]
    - [352, 66.037]
  - - [3136, 128, 32, 256]
    - [227, 68.767]
  - - [3136, 256, 32, 256]
    - [354, 74.874]
  - - [196, 1024, 32, 512]
    - [242, 57.36]
  - - [784, 256, 32, 512]
    - [353, 70.501]
  - - [784, 512, 32, 512]
    - [355, 76.172]
  - - [196, 512, 32, 1024]
    - [229, 54.178]
  - - [196, 1024, 32, 1024]
    - [359, 63.746]
  - - [49, 2048, 32, 1024]
    - [361, 41.446]
  - - [49, 1024, 32, 2048]
    - [241, 38.467]
  - - [64, 128, 624, 128]
    - [84, 30.314]
  - - [1024, 10, 1, 1024]
    - [115, 1.464]
  - - [2048, 2048, 1, 2048]
    - [265, 86.022]
  - - [1024, 10, 1, 2]
    - [178, 0.007]
  - - [1024, 5, 1, 2]
    - [88, 0.003]
  - - [1024, 5, 1, 1024]
    - [90, 0.726]
  - - [64, 512, 16, 512]
    - [93, 29.73]
  - - [1024, 1024, 1, 1024]
    - [94, 54.463]
  - - [1024, 9600, 1, 4096]
    - [100, 94.133]
  - - [1024, 8192, 1, 1024]
    - [110, 84.887]
  - - [1024, 1280, 1, 4096]
    - [182, 77.715]
  - - [512, 512, 1, 512]
    - [85, 19.937]
  - - [1024, 1152, 1, 1024]
    - [105, 57.676]
  - - [1024, 5248, 1, 2]
    - [102, 0.958]
  - - [1024, 820, 1, 1024]
    - [104, 51.746]
  - - [4096, 1152, 1, 1024]
    - [165, 79.609]
  - - [1024, 308, 1, 30522]
    - [275, 65.209]
  - - [1024, 39, 1, 1024]
    - [169, 5.546]
  - - [1024, 616, 1, 1024]
    - [184, 40.705]
  - - [64, 512, 96, 512]
    - [185, 51.531]
  - - [1024, 39, 1, 2]
    - [108, 0.028]
  - - [128, 128, 1, 64]
    - [145, 0.338]
  - - [1024, 160, 1, 30522]
    - [283, 57.883]
  - - [1024, 2560, 1, 1024]
    - [98, 71.98]
  - - [4096, 9600, 1, 1024]
    - [288, 92.595]
  - - [1024, 8, 1, 2]
    - [111, 0.006]
  - - [1024, 800, 1, 1024]
    - [186, 50.647]
  - - [64, 128, 640, 128]
    - [136, 30.487]
  - - [4096, 1024, 1, 1024]
    - [113, 80.307]
  - - [1024, 8, 1, 1024]
    - [115, 1.18]
  - - [1024, 1024, 1, 2]
    - [194, 0.431]
  - - [4096, 5248, 1, 1024]
    - [264, 90.071]
  - - [4096, 4096, 1, 4096]
    - [118, 91.721]
  - - [1024, 77, 1, 30522]
    - [268, 38.532]
  - - [1024, 9, 1, 2]
    - [130, 0.006]
  - - [1024, 1024, 1, 4096]
    - [141, 69.78]
  - - [1024, 9, 1, 1024]
    - [189, 1.309]
  - - [1024, 780, 1, 1024]
    - [190, 50.355]
  - - [64, 4, 38400, 4]
    - [96, 0.238]
  - - [1024, 4096, 1, 2]
    - [116, 0.801]
  - - [4096, 2560, 1, 1024]
    - [101, 84.37]
  - - [64, 128, 144, 128]
    - [89, 21.249]
  - - [1024, 780, 1, 30522]
    - [271, 80.022]
  - - [8192, 7680, 1, 8192]
    - [262, 98.227]
  - - [1024, 3072, 1, 2]
    - [179, 0.731]
  - - [8192, 8192, 1, 8192]
    - [264, 96.611]
  - - [1024, 180, 1, 1024]
    - [195, 21.807]
  - - [1024, 180, 1, 30522]
    - [284, 61.433]
  - - [1024, 512, 1, 2]
    - [124, 0.28]
  - - [1024, 8192, 1, 4096]
    - [269, 90.757]
  - - [1024, 385, 1, 30522]
    - [279, 70.734]
  - - [4096, 512, 1, 1024]
    - [103, 63.397]
  - - [1024, 160, 1, 1024]
    - [198, 20.524]
  - - [1024, 5120, 1, 4096]
    - [273, 85.92]
  - - [2048, 1920, 1, 2048]
    - [261, 89.505]
  - - [1024, 462, 1, 1024]
    - [135, 35.418]
  - - [1024, 462, 1, 30522]
    - [280, 76.626]
  - - [1024, 77, 1, 1024]
    - [115, 10.872]
  - - [960, 1024, 1, 1024]
    - [139, 65.648]
  - - [1024, 40, 1, 2]
    - [108, 0.028]
  - - [64, 5, 1, 5]
    - [140, 0.0]
  - - [1024, 40, 1, 1024]
    - [200, 5.859]
  - - [4096, 5120, 1, 1024]
    - [277, 88.299]
  - - [1024, 200, 1, 30522]
    - [270, 52.606]
  - - [1024, 41, 1, 2]
    - [124, 0.028]
  - - [1024, 200, 1, 1024]
    - [85, 21.686]
  - - [4096, 8192, 1, 1024]
    - [287, 90.718]
  - - [1024, 41, 1, 1024]
    - [115, 5.916]
  - - [1024, 4992, 1, 4096]
    - [273, 84.897]
  - - [4096, 1280, 1, 1024]
    - [264, 78.688]
  - - [1024, 2560, 1, 4096]
    - [110, 82.331]
  - - [1024, 4992, 1, 2]
    - [177, 0.919]
  - - [32, 33, 1, 33]
    - [130, 0.01]
  - - [7680, 8192, 1, 8192]
    - [259, 98.453]
  - - [4096, 3072, 1, 1024]
    - [282, 87.983]
  - - [1024, 9600, 1, 1024]
    - [269, 87.551]
  - - [1024, 385, 1, 1024]
    - [207, 35.641]
  - - [64, 4, 32768, 4]
    - [96, 0.235]
  - - [64, 128, 656, 128]
    - [181, 30.508]
  - - [64, 512, 128, 512]
    - [156, 51.203]
  - - [1024, 4992, 1, 1024]
    - [272, 78.191]
  - - [1024, 1152, 1, 2]
    - [157, 0.464]
  - - [1024, 5248, 1, 4096]
    - [110, 86.57]
  - - [1024, 9600, 1, 33712]
    - [286, 97.116]
  - - [1024, 3072, 1, 4096]
    - [273, 84.917]
  - - [4096, 3840, 1, 4096]
    - [259, 97.456]
  - - [1024, 6, 1, 1024]
    - [209, 0.847]
  - - [1024, 5120, 1, 1024]
    - [110, 77.775]
  - - [1024, 8192, 1, 33712]
    - [269, 92.582]
  - - [1024, 308, 1, 1024]
    - [183, 30.376]
  - - [3840, 4096, 1, 4096]
    - [260, 97.55]
  - - [1024, 2560, 1, 2]
    - [159, 0.672]
  - - [1024, 6, 1, 2]
    - [124, 0.004]
  - - [64, 128, 160, 128]
    - [210, 23.089]
  - - [1024, 512, 1, 4096]
    - [212, 54.389]
  - - [64, 128, 128, 128]
    - [158, 19.031]
  - - [1024, 5248, 1, 1024]
    - [119, 79.595]
  - - [1024, 820, 1, 30522]
    - [278, 78.469]
  - - [1024, 1280, 1, 2]
    - [214, 0.496]
  - - [1024, 1280, 1, 1024]
    - [98, 61.121]
  - - [1920, 2048, 1, 2048]
    - [261, 89.931]
  - - [1024, 3072, 1, 1024]
    - [281, 72.815]
  - - [1024, 800, 1, 30522]
    - [276, 81.007]
  - - [64, 128, 1, 128]
    - [122, 0.307]
  - - [64, 512, 80, 512]
    - [172, 49.744]
  - - [480, 512, 1, 512]
    - [122, 21.807]
  - - [512, 480, 1, 512]
    - [173, 21.607]
  - - [4096, 4992, 1, 1024]
    - [274, 90.947]
  - - [479, 32768, 1, 1024]
    - [346, 81.129]
  - - [1024, 1152, 1, 4096]
    - [176, 78.504]
  - - [1024, 5120, 1, 2]
    - [102, 0.934]
  - - [1024, 1024, 64, 64]
    - [318, 50.432]
  - - [64, 1024, 32, 1024]
    - [99, 52.133]
  - - [1024, 16384, 1, 3072]
    - [282, 91.074]
  - - [1024, 2048, 1, 30592]
    - [285, 89.946]
  - - [640, 2048, 1, 2560]
    - [107, 74.412]
  - - [1024, 1024, 64, 96]
    - [312, 65.179]
  - - [2048, 2, 1, 2048]
    - [307, 0.797]
  - - [2048, 2, 1, 2]
    - [88, 0.003]
  - - [1536, 4096, 1, 4608]
    - [265, 89.584]
  - - [512, 512, 256, 64]
    - [259, 50.304]
  - - [2048, 1024, 1, 8192]
    - [306, 85.314]
  - - [4096, 16384, 1, 1024]
    - [293, 93.047]
  - - [1024, 8192, 1, 50304]
    - [320, 92.721]
  - - [1536, 8192, 1, 50304]
    - [315, 95.659]
  - - [6144, 8192, 1, 1536]
    - [265, 95.165]
  - - [1024, 4096, 1, 30592]
    - [137, 92.103]
  - - [1536, 4096, 1, 6144]
    - [294, 90.436]
  - - [1024, 16384, 1, 4096]
    - [100, 91.903]
  - - [1024, 16384, 1, 50304]
    - [317, 95.813]
  - - [1024, 4096, 1, 3072]
    - [110, 87.951]
  - - [1536, 8192, 1, 1536]
    - [313, 90.459]
  - - [1024, 2048, 1, 3072]
    - [146, 80.657]
  - - [2560, 2048, 1, 7680]
    - [310, 88.496]
  - - [96, 1024, 64, 1024]
    - [273, 76.706]
  - - [2048, 1024, 1, 2048]
    - [160, 72.75]
  - - [2048, 1024, 1, 30592]
    - [304, 88.593]
  - - [64, 1024, 256, 1024]
    - [163, 69.21]
  - - [8192, 1024, 1, 2048]
    - [264, 88.217]
  - - [2560, 2048, 1, 2560]
    - [273, 84.725]
  - - [1536, 8192, 1, 4608]
    - [314, 93.369]
  - - [64, 512, 256, 512]
    - [175, 58.21]
  - - [1024, 2048, 1, 50304]
    - [265, 90.637]
  - - [1024, 1024, 32, 64]
    - [98, 44.462]
  - - [1536, 8192, 1, 6144]
    - [314, 93.667]
  - - [1024, 1024, 256, 64]
    - [318, 57.276]
  - - [512, 512, 40, 64]
    - [153, 34.039]
  - - [1536, 4096, 1, 50304]
    - [265, 92.186]
  - - [1024, 1024, 128, 96]
    - [312, 70.454]
  - - [1024, 8192, 1, 3072]
    - [110, 90.069]
  - - [64, 1024, 64, 1024]
    - [175, 58.72]
  - - [1024, 1024, 128, 64]
    - [260, 55.08]
  - - [64, 1024, 128, 1024]
    - [199, 66.546]
  - - [1024, 4096, 1, 50304]
    - [319, 92.544]
  - - [96, 1024, 128, 1024]
    - [316, 80.953]
  - - [6144, 4096, 1, 1536]
    - [203, 91.719]
  - - [1024, 16, 1, 2]
    - [108, 0.012]
  - - [1024, 16, 1, 1024]
    - [115, 2.379]
  - - [2560, 4, 1, 2]
    - [88, 0.006]
  - - [1024, 16384, 1, 1024]
    - [177, 87.639]
  - - [2560, 2048, 1, 1920]
    - [309, 83.292]
  - - [2048, 1024, 1, 6144]
    - [305, 83.65]
  - - [2560, 4, 1, 2560]
    - [311, 2.171]
  - - [512, 512, 128, 64]
    - [308, 43.406]
  - - [1024, 8192, 1, 30592]
    - [265, 92.799]
  - - [1536, 4096, 1, 1536]
    - [310, 83.737]
  - - [64, 512, 40, 512]
    - [89, 44.859]
  - - [1024, 1, 1, 2]
    - [266, 0.0]
  - - [1024, 1, 1, 1024]
    - [267, 0.127]
  - - [1024, 1, 1, 200]
    - [299, 0.034]
  - - [1024, 1, 1, 1600]
    - [300, 0.189]
  - - [2048, 1, 1, 512]
    - [302, 0.162]
  - - [128, 128, 1024, 64]
    - [321, 32.155]
  - - [64, 128, 1024, 128]
    - [322, 32.414]
  - - [1024, 64, 1, 2]
    - [323, 0.034]
  - - [1024, 8192, 1, 30528]
    - [269, 92.851]
  - - [1024, 64, 1, 1024]
    - [324, 8.051]
  - - [1024, 3456, 1, 1024]
    - [314, 74.948]
  - - [1024, 3456, 1, 512]
    - [325, 68.237]
  - - [1024, 4096, 1, 512]
    - [326, 67.552]
  - - [1024, 6912, 1, 1024]
    - [269, 86.57]
  - - [1024, 6912, 1, 512]
    - [269, 78.776]
  - - [1024, 864, 1, 1024]
    - [327, 50.168]
  - - [1024, 864, 1, 512]
    - [328, 40.566]
  - - [256, 3456, 1, 128]
    - [329, 20.578]
  - - [256, 4096, 1, 128]
    - [330, 18.747]
  - - [256, 55296, 1, 128]
    - [282, 55.505]
  - - [256, 6912, 1, 128]
    - [331, 29.854]
  - - [256, 864, 1, 128]
    - [332, 6.542]
  - - [480, 3456, 1, 1024]
    - [321, 66.1]
  - - [480, 4096, 1, 1024]
    - [281, 66.458]
  - - [480, 6912, 1, 1024]
    - [333, 79.188]
  - - [480, 864, 1, 1024]
    - [334, 34.409]
  - - [512, 3456, 1, 256]
    - [314, 47.632]
  - - [512, 4096, 1, 256]
    - [321, 39.251]
  - - [512, 55296, 1, 256]
    - [294, 79.655]
  - - [512, 6912, 1, 256]
    - [290, 55.054]
  - - [512, 864, 1, 256]
    - [335, 18.272]
  - - [1024, 640, 1, 30528]
    - [336, 81.993]
  - - [1024, 1280, 1, 30528]
    - [269, 85.875]
  - - [1024, 1600, 1, 30528]
    - [271, 83.644]
  - - [1024, 10240, 1, 1024]
    - [290, 85.481]
  - - [1024, 10240, 1, 4096]
    - [265, 90.659]
  - - [4096, 10240, 1, 1024]
    - [260, 92.687]
  - - [1024, 80, 1, 1024]
    - [337, 9.632]
  - - [1024, 80, 1, 2]
    - [338, 0.042]
  - - [128, 128, 1280, 64]
    - [321, 33.054]
  - - [64, 128, 1280, 128]
    - [339, 33.142]
  - - [1024, 1640, 1, 30528]
    - [340, 82.942]
  - - [1024, 10496, 1, 1024]
    - [265, 85.616]
  - - [1024, 10496, 1, 4096]
    - [265, 92.832]
  - - [4096, 10496, 1, 1024]
    - [260, 94.513]
  - - [1024, 82, 1, 1024]
    - [332, 9.754]
  - - [1024, 82, 1, 2]
    - [299, 0.04]
  - - [128, 128, 1312, 64]
    - [341, 33.483]
  - - [64, 128, 1312, 128]
    - [322, 33.397]
  - - [1024, 160, 1, 30528]
    - [342, 60.397]
  - - [1024, 240, 1, 30528]
    - [343, 66.112]
  - - [1024, 6144, 1, 4096]
    - [265, 89.237]
  - - [1024, 12, 1, 1024]
    - [300, 1.509]
  - - [4096, 6144, 1, 1024]
    - [264, 89.518]
  - - [1024, 6144, 1, 1024]
    - [313, 80.173]
  - - [1024, 12, 1, 2]
    - [266, 0.006]
  - - [512, 512, 192, 64]
    - [260, 47.774]
  - - [64, 512, 192, 512]
    - [344, 55.16]
  - - [256, 4096, 1, 1]
    - [345, 0.171]
  - - [256, 6912, 1, 1]
    - [290, 0.261]
- null
