library/src/blas3/Tensile/Logic/asm_full/arcturus_Cijk_Ailk_Bljk_SBIIc.yaml
- {MinimumRequiredVersion: 4.24.0}
- arcturus
- gfx908
- [Device 7380, Device 7388, Device 738c, Device 7390]
    SolutionIndex: 0
    SolutionNameMin: Cijk_Ailk_Bljk_SBIIc_MT64x64x16_SN_TT4_4_WG16_16_1
    SolutionIndex: 1
    SolutionNameMin: Cijk_Ailk_Bljk_SBIIc_MT128x128x16_SN_TT8_8_WG16_16_1
    SolutionIndex: 2
    SolutionNameMin: Cijk_Ailk_Bljk_SBIIc_MT32x32x16_SN_TT4_4_WG8_8_1
    SolutionIndex: 3
    SolutionNameMin: Cijk_Ailk_Bljk_SBIIc_MT64x64x16_SN_TT4_4_WG16_16_1
    SolutionIndex: 4
    SolutionNameMin: Cijk_Ailk_Bljk_SBIIc_MT128x128x16_SN_TT8_8_WG16_16_1
- - - [480, 512, 1, 512]
    - [0, 4252.0]
  - - [512, 512, 1, 512]
    - [0, 4286.0]
  - - [960, 1024, 1, 1024]
    - [0, 12459.0]
  - - [1024, 1024, 1, 1024]
    - [0, 9043.0]
  - - [1920, 2048, 1, 2048]
    - [1, 15366.0]
  - - [2048, 2048, 1, 2048]
    - [0, 12836.0]
  - - [480, 512, 1, 512]
    - [2, 3565.0]
  - - [512, 512, 1, 512]
    - [3, 3511.0]
  - - [960, 1024, 1, 1024]
    - [3, 9488.0]
  - - [1024, 1024, 1, 1024]
    - [3, 6726.0]
  - - [1920, 2048, 1, 2048]
    - [4, 13951.0]
  - - [2048, 2048, 1, 2048]
    - [3, 9626.0]
- null
