library/src/blas3/Tensile/Logic/asm_full/arcturus_Cijk_Alik_Bljk_BBH.yaml
- {MinimumRequiredVersion: 4.14.0}
- arcturus
- gfx908
- [Device 7380, Device 7388, Device 738c, Device 7390]
    SolutionIndex: 0
    SolutionNameMin: Cijk_Alik_Bljk_BBH_MT64x128x16_MI32x32x2x2_SE_GRVW4_ONLL0_SNLL1
    SolutionIndex: 1
    SolutionNameMin: Cijk_Alik_Bljk_BBH_MT64x128x16_MI32x32x2x2_SE_GRVW2_ONLL0_SNLL0
    SolutionIndex: 2
    SolutionNameMin: Cijk_Alik_Bljk_BBH_MT64x128x16_MI32x32x2x2_SE_GRVW4_ONLL0_SNLL0
    SolutionIndex: 3
    SolutionNameMin: Cijk_Alik_Bljk_BBH_MT64x128x32_MI32x32x2x2_SE_GRVW4_ONLL0_SNLL0
    SolutionIndex: 4
    SolutionNameMin: Cijk_Alik_Bljk_BBH_MT64x128x16_MI32x32x2x2_SE_GRVW4_ONLL1_SNLL1
    SolutionIndex: 5
    SolutionNameMin: Cijk_Alik_Bljk_BBH_MT64x128x16_MI32x32x2x2_SE_GRVW2_ONLL1_SNLL0
    SolutionIndex: 6
    SolutionNameMin: Cijk_Alik_Bljk_BBH_MT32x256x16_MI32x32x2x2_SE_GRVW4_ONLL1_SNLL0
    SolutionIndex: 7
    SolutionNameMin: Cijk_Alik_Bljk_BBH_MT64x128x16_MI32x32x2x2_SE_GRVW4_ONLL1_SNLL0
    SolutionIndex: 8
    SolutionNameMin: Cijk_Alik_Bljk_BBH_MT64x128x32_MI32x32x2x2_SE_GRVW4_ONLL1_SNLL0
    SolutionIndex: 9
    SolutionNameMin: Cijk_Alik_Bljk_BBH_MT64x256x16_MI32x32x2x2_SE_GRVW4_ONLL0_SNLL0
    SolutionIndex: 10
    SolutionNameMin: Cijk_Alik_Bljk_BBH_MT64x256x16_MI32x32x2x2_SE_GRVW4_ONLL1_SNLL1
    SolutionIndex: 11
    SolutionNameMin: Cijk_Alik_Bljk_BBH_MT128x32x16_SE_
    SolutionIndex: 12
    SolutionNameMin: Cijk_Alik_Bljk_BBH_MT128x64x16_SE_
    SolutionIndex: 13
    SolutionNameMin: Cijk_Alik_Bljk_BBH_MT32x128x16_SE_
    SolutionIndex: 14
    SolutionNameMin: Cijk_Alik_Bljk_BBH_MT64x128x16_SE_
    SolutionIndex: 15
    SolutionNameMin: Cijk_Alik_Bljk_BBH_MT256x128x16_SE_
    SolutionIndex: 16
    SolutionNameMin: Cijk_Alik_Bljk_BBH_MT128x256x16_SE_
    SolutionIndex: 17
    SolutionNameMin: Cijk_Alik_Bljk_BBH_MT64x16x16_SE_
    SolutionIndex: 18
    SolutionNameMin: Cijk_Alik_Bljk_BBH_MT16x64x16_SE_
    SolutionIndex: 19
    SolutionNameMin: Cijk_Alik_Bljk_BBH_MT64x128x32_SE_
    SolutionIndex: 20
    SolutionNameMin: Cijk_Alik_Bljk_BBH_MT64x128x64_SE_
    SolutionIndex: 21
    SolutionNameMin: Cijk_Alik_Bljk_BBH_MT32x32x32_SE_
    SolutionIndex: 22
    SolutionNameMin: Cijk_Alik_Bljk_BBH_MT128x64x16_SE_
    SolutionIndex: 23
    SolutionNameMin: Cijk_Alik_Bljk_BBH_MT32x128x16_SE_
    SolutionIndex: 24
    SolutionNameMin: Cijk_Alik_Bljk_BBH_MT64x128x16_SE_
    SolutionIndex: 25
    SolutionNameMin: Cijk_Alik_Bljk_BBH_MT256x128x16_SE_
    SolutionIndex: 26
    SolutionNameMin: Cijk_Alik_Bljk_BBH_MT128x256x16_SE_
    SolutionIndex: 27
    SolutionNameMin: Cijk_Alik_Bljk_BBH_MT64x16x16_SE_
    SolutionIndex: 28
    SolutionNameMin: Cijk_Alik_Bljk_BBH_MT16x64x16_SE_
    SolutionIndex: 29
    SolutionNameMin: Cijk_Alik_Bljk_BBH_MT64x128x32_SE_
    SolutionIndex: 30
    SolutionNameMin: Cijk_Alik_Bljk_BBH_MT64x128x64_SE_
    SolutionIndex: 31
    SolutionNameMin: Cijk_Alik_Bljk_BBH_MT32x32x32_SE_
    SolutionIndex: 32
    SolutionNameMin: Cijk_Alik_Bljk_BBH_MT64x128x8_MI32x32x2x2_SE_GRVW4_ONLL0_SNLL1
    SolutionIndex: 33
    SolutionNameMin: Cijk_Alik_Bljk_BBH_MT64x128x8_MI32x32x2x2_SE_GRVW4_ONLL1_SNLL0
    SolutionIndex: 34
    SolutionNameMin: Cijk_Alik_Bljk_BBH_MT64x128x16_MI32x32x2x2_SE_GRVW4_ONLL1_SNLL0
    SolutionIndex: 35
    SolutionNameMin: Cijk_Alik_Bljk_BBH_MT64x128x64_SE_
    SolutionIndex: 36
    SolutionNameMin: Cijk_Alik_Bljk_BBH_MT128x64x16_SE_AF0EM1_ASEM1_GRVW1_WGM8
    SolutionIndex: 37
    SolutionNameMin: Cijk_Alik_Bljk_BBH_MT32x128x16_SE_AF0EM1_ASEM1_GRVW1_WGM8
    SolutionIndex: 38
    SolutionNameMin: Cijk_Alik_Bljk_BBH_MT64x16x16_SE_AF0EM1_ASEM1_GRVW1_WGM8
    SolutionIndex: 39
    SolutionNameMin: Cijk_Alik_Bljk_BBH_MT64x32x16_SE_AF0EM1_ASEM1_GRVW1_WGM8
    SolutionIndex: 40
    SolutionNameMin: Cijk_Alik_Bljk_BBH_MT32x64x64_SE_AF0EM8_ASEM8_GRVW2_WGM8
    SolutionIndex: 41
    SolutionNameMin: Cijk_Alik_Bljk_BBH_MT64x32x64_SE_AF0EM8_ASEM8_GRVW2_WGM8
    SolutionIndex: 42
    SolutionNameMin: Cijk_Alik_Bljk_BBH_MT64x128x32_MI32x32x2x2_SE_AF0EM2_ASEM1_GRVW4_WGM1
    SolutionIndex: 43
    SolutionNameMin: Cijk_Alik_Bljk_BBH_MT64x128x32_MI32x32x2x2_SE_AF0EM2_ASEM2_GRVW4_WGM1
    SolutionIndex: 44
    SolutionNameMin: Cijk_Alik_Bljk_BBH_MT32x256x32_MI32x32x2x2_SE_AF0EM2_ASEM1_GRVW4_WGM8
    SolutionIndex: 45
    SolutionNameMin: Cijk_Alik_Bljk_BBH_MT64x128x32_MI32x32x2x2_SE_AF0EM2_ASEM1_GRVW4_WGM8
    SolutionIndex: 46
    SolutionNameMin: Cijk_Alik_Bljk_BBH_MT64x128x32_MI32x32x2x2_SE_AF0EM2_ASEM2_GRVW4_WGM8
    SolutionIndex: 47
    SolutionIndex: 48
    SolutionIndex: 49
    SolutionIndex: 50
    SolutionIndex: 51
    SolutionIndex: 52
    SolutionIndex: 53
    SolutionIndex: 54
    SolutionIndex: 55
    SolutionIndex: 56
    SolutionIndex: 57
    SolutionIndex: 58
    SolutionIndex: 59
    SolutionIndex: 60
    SolutionIndex: 61
    SolutionIndex: 62
    SolutionIndex: 63
    SolutionIndex: 64
    SolutionIndex: 65
    SolutionIndex: 66
    SolutionIndex: 67
    SolutionIndex: 68
    SolutionIndex: 69
    SolutionIndex: 70
    SolutionIndex: 71
    SolutionIndex: 72
    SolutionIndex: 73
    SolutionIndex: 74
    SolutionIndex: 75
    SolutionIndex: 76
    SolutionIndex: 77
    SolutionIndex: 78
    SolutionIndex: 79
    SolutionIndex: 80
    SolutionIndex: 81
    SolutionIndex: 82
    SolutionIndex: 83
    SolutionIndex: 84
    SolutionIndex: 85
    SolutionIndex: 86
    SolutionIndex: 87
    SolutionIndex: 88
    SolutionIndex: 89
    SolutionNameMin: Cijk_Alik_Bljk_BBH_MT64x128x16_MI32x32x2x2_SE_GRVW4_ONLL0_SNLL1
    SolutionIndex: 90
    SolutionNameMin: Cijk_Alik_Bljk_BBH_MT64x128x16_MI32x32x2x2_SE_GRVW2_ONLL0_SNLL0
    SolutionIndex: 91
    SolutionNameMin: Cijk_Alik_Bljk_BBH_MT64x128x16_MI32x32x2x2_SE_GRVW4_ONLL0_SNLL0
    SolutionIndex: 92
    SolutionNameMin: Cijk_Alik_Bljk_BBH_MT64x128x32_MI32x32x2x2_SE_GRVW4_ONLL0_SNLL0
    SolutionIndex: 93
    SolutionNameMin: Cijk_Alik_Bljk_BBH_MT64x128x16_MI32x32x2x2_SE_GRVW4_ONLL1_SNLL1
    SolutionIndex: 94
    SolutionNameMin: Cijk_Alik_Bljk_BBH_MT64x128x16_MI32x32x2x2_SE_GRVW2_ONLL1_SNLL0
    SolutionIndex: 95
    SolutionNameMin: Cijk_Alik_Bljk_BBH_MT32x256x16_MI32x32x2x2_SE_GRVW4_ONLL1_SNLL0
    SolutionIndex: 96
    SolutionNameMin: Cijk_Alik_Bljk_BBH_MT64x128x16_MI32x32x2x2_SE_GRVW4_ONLL1_SNLL0
    SolutionIndex: 97
    SolutionNameMin: Cijk_Alik_Bljk_BBH_MT64x128x32_MI32x32x2x2_SE_GRVW4_ONLL1_SNLL0
    SolutionIndex: 98
    SolutionNameMin: Cijk_Alik_Bljk_BBH_MT64x256x16_MI32x32x2x2_SE_GRVW4_ONLL0_SNLL0
    SolutionIndex: 99
    SolutionNameMin: Cijk_Alik_Bljk_BBH_MT64x256x16_MI32x32x2x2_SE_GRVW4_ONLL1_SNLL1
    SolutionIndex: 100
    SolutionNameMin: Cijk_Alik_Bljk_BBH_MT128x32x16_SE_
    SolutionIndex: 101
    SolutionNameMin: Cijk_Alik_Bljk_BBH_MT128x64x16_SE_
    SolutionIndex: 102
    SolutionNameMin: Cijk_Alik_Bljk_BBH_MT32x128x16_SE_
    SolutionIndex: 103
    SolutionNameMin: Cijk_Alik_Bljk_BBH_MT64x128x16_SE_
    SolutionIndex: 104
    SolutionNameMin: Cijk_Alik_Bljk_BBH_MT256x128x16_SE_
    SolutionIndex: 105
    SolutionNameMin: Cijk_Alik_Bljk_BBH_MT128x256x16_SE_
    SolutionIndex: 106
    SolutionNameMin: Cijk_Alik_Bljk_BBH_MT64x16x16_SE_
    SolutionIndex: 107
    SolutionNameMin: Cijk_Alik_Bljk_BBH_MT16x64x16_SE_
    SolutionIndex: 108
    SolutionNameMin: Cijk_Alik_Bljk_BBH_MT64x128x32_SE_
    SolutionIndex: 109
    SolutionNameMin: Cijk_Alik_Bljk_BBH_MT64x128x64_SE_
    SolutionIndex: 110
    SolutionNameMin: Cijk_Alik_Bljk_BBH_MT32x32x32_SE_
    SolutionIndex: 111
    SolutionNameMin: Cijk_Alik_Bljk_BBH_MT128x64x16_SE_
    SolutionIndex: 112
    SolutionNameMin: Cijk_Alik_Bljk_BBH_MT32x128x16_SE_
    SolutionIndex: 113
    SolutionNameMin: Cijk_Alik_Bljk_BBH_MT64x128x16_SE_
    SolutionIndex: 114
    SolutionNameMin: Cijk_Alik_Bljk_BBH_MT256x128x16_SE_
    SolutionIndex: 115
    SolutionNameMin: Cijk_Alik_Bljk_BBH_MT128x256x16_SE_
    SolutionIndex: 116
    SolutionNameMin: Cijk_Alik_Bljk_BBH_MT64x16x16_SE_
    SolutionIndex: 117
    SolutionNameMin: Cijk_Alik_Bljk_BBH_MT16x64x16_SE_
    SolutionIndex: 118
    SolutionNameMin: Cijk_Alik_Bljk_BBH_MT64x128x32_SE_
    SolutionIndex: 119
    SolutionNameMin: Cijk_Alik_Bljk_BBH_MT64x128x64_SE_
    SolutionIndex: 120
    SolutionNameMin: Cijk_Alik_Bljk_BBH_MT32x32x32_SE_
    SolutionIndex: 121
    SolutionNameMin: Cijk_Alik_Bljk_BBH_MT64x128x8_MI32x32x2x2_SE_GRVW4_ONLL0_SNLL1
    SolutionIndex: 122
    SolutionNameMin: Cijk_Alik_Bljk_BBH_MT64x128x8_MI32x32x2x2_SE_GRVW4_ONLL1_SNLL0
    SolutionIndex: 123
    SolutionNameMin: Cijk_Alik_Bljk_BBH_MT64x128x16_MI32x32x2x2_SE_GRVW4_ONLL1_SNLL0
    SolutionIndex: 124
    SolutionNameMin: Cijk_Alik_Bljk_BBH_MT64x128x64_SE_
    SolutionIndex: 125
    SolutionNameMin: Cijk_Alik_Bljk_BBH_MT128x64x16_SE_AF0EM1_ASEM1_GRVW1_WGM8
    SolutionIndex: 126
    SolutionNameMin: Cijk_Alik_Bljk_BBH_MT32x128x16_SE_AF0EM1_ASEM1_GRVW1_WGM8
    SolutionIndex: 127
    SolutionNameMin: Cijk_Alik_Bljk_BBH_MT64x16x16_SE_AF0EM1_ASEM1_GRVW1_WGM8
    SolutionIndex: 128
    SolutionNameMin: Cijk_Alik_Bljk_BBH_MT64x32x16_SE_AF0EM1_ASEM1_GRVW1_WGM8
    SolutionIndex: 129
    SolutionNameMin: Cijk_Alik_Bljk_BBH_MT32x64x64_SE_AF0EM8_ASEM8_GRVW2_WGM8
    SolutionIndex: 130
    SolutionNameMin: Cijk_Alik_Bljk_BBH_MT64x32x64_SE_AF0EM8_ASEM8_GRVW2_WGM8
    SolutionIndex: 131
    SolutionNameMin: Cijk_Alik_Bljk_BBH_MT64x128x32_MI32x32x2x2_SE_AF0EM2_ASEM1_GRVW4_WGM1
    SolutionIndex: 132
    SolutionNameMin: Cijk_Alik_Bljk_BBH_MT64x128x32_MI32x32x2x2_SE_AF0EM2_ASEM2_GRVW4_WGM1
    SolutionIndex: 133
    SolutionNameMin: Cijk_Alik_Bljk_BBH_MT32x256x32_MI32x32x2x2_SE_AF0EM2_ASEM1_GRVW4_WGM8
    SolutionIndex: 134
    SolutionNameMin: Cijk_Alik_Bljk_BBH_MT64x128x32_MI32x32x2x2_SE_AF0EM2_ASEM1_GRVW4_WGM8
    SolutionIndex: 135
    SolutionNameMin: Cijk_Alik_Bljk_BBH_MT64x128x32_MI32x32x2x2_SE_AF0EM2_ASEM2_GRVW4_WGM8
    SolutionIndex: 136
    SolutionIndex: 137
    SolutionIndex: 138
    SolutionIndex: 139
    SolutionIndex: 140
    SolutionIndex: 141
    SolutionIndex: 142
    SolutionIndex: 143
    SolutionIndex: 144
    SolutionIndex: 145
    SolutionIndex: 146
    SolutionIndex: 147
    SolutionIndex: 148
    SolutionIndex: 149
    SolutionIndex: 150
    SolutionIndex: 151
    SolutionIndex: 152
    SolutionIndex: 153
    SolutionIndex: 154
    SolutionIndex: 155
    SolutionIndex: 156
    SolutionIndex: 157
    SolutionIndex: 158
    SolutionIndex: 159
    SolutionIndex: 160
    SolutionIndex: 161
    SolutionIndex: 162
    SolutionIndex: 163
    SolutionIndex: 164
    SolutionIndex: 165
    SolutionIndex: 166
    SolutionIndex: 167
    SolutionIndex: 168
    SolutionIndex: 169
    SolutionIndex: 170
    SolutionIndex: 171
    SolutionIndex: 172
    SolutionIndex: 173
    SolutionIndex: 174
    SolutionIndex: 175
    SolutionIndex: 176
    SolutionIndex: 177
- - - [511, 4096, 1, 4096]
    - [22, 2670.57]
  - - [512, 3071, 1, 3072]
    - [22, 3189.39]
  - - [2880, 3073, 1, 3072]
    - [22, 3883.37]
  - - [511, 3072, 1, 3072]
    - [22, 3175.98]
  - - [1024, 512, 1, 1025]
    - [22, 1532.26]
  - - [511, 2048, 1, 2048]
    - [23, 2153.8]
  - - [8192, 8193, 1, 8192]
    - [25, 4374.36]
  - - [3072, 3072, 1, 3071]
    - [22, 4159.1]
  - - [8192, 8192, 1, 8193]
    - [25, 4631.22]
  - - [513, 1024, 1, 1024]
    - [22, 1511.35]
  - - [512, 1023, 1, 1024]
    - [22, 1497.51]
  - - [512, 2048, 1, 2047]
    - [23, 2191.32]
  - - [7680, 8192, 1, 8193]
    - [25, 4847.64]
  - - [513, 4096, 1, 4096]
    - [22, 2655.48]
  - - [3073, 512, 1, 3072]
    - [22, 3180.55]
  - - [4096, 4096, 1, 4097]
    - [22, 4148.5]
  - - [1025, 1024, 1, 1024]
    - [23, 2150.96]
  - - [8192, 8191, 1, 8192]
    - [25, 4411.15]
  - - [8192, 512, 1, 8193]
    - [22, 3586.69]
  - - [7681, 8192, 1, 8192]
    - [25, 4321.58]
  - - [2880, 3071, 1, 3072]
    - [24, 4177.63]
  - - [512, 1025, 1, 1024]
    - [22, 1549.23]
  - - [2048, 513, 1, 2048]
    - [23, 2184.71]
  - - [1024, 1024, 1, 1025]
    - [23, 2128.47]
  - - [960, 1024, 1, 1023]
    - [24, 2675.74]
  - - [3072, 512, 1, 3071]
    - [22, 3198.18]
  - - [960, 1025, 1, 1024]
    - [23, 2035.43]
  - - [3072, 3071, 1, 3072]
    - [22, 4139.24]
  - - [512, 2048, 1, 2049]
    - [23, 2170.06]
  - - [3072, 511, 1, 3072]
    - [22, 3187.23]
  - - [2049, 512, 1, 2048]
    - [23, 2173.05]
  - - [512, 8191, 1, 8192]
    - [22, 3417.57]
  - - [513, 3072, 1, 3072]
    - [22, 3170.54]
  - - [4096, 4095, 1, 4096]
    - [22, 4091.87]
  - - [511, 1024, 1, 1024]
    - [22, 1492.04]
  - - [513, 512, 1, 512]
    - [27, 887.07]
  - - [1024, 511, 1, 1024]
    - [22, 1538.66]
  - - [3072, 3072, 1, 3073]
    - [22, 4161.95]
  - - [960, 1024, 1, 1025]
    - [24, 2660.02]
  - - [959, 1024, 1, 1024]
    - [23, 2622.54]
  - - [7680, 8193, 1, 8192]
    - [25, 4367.72]
  - - [512, 3072, 1, 3073]
    - [22, 3183.4]
  - - [1023, 512, 1, 1024]
    - [22, 1540.52]
  - - [3072, 512, 1, 3073]
    - [22, 3205.52]
  - - [512, 2049, 1, 2048]
    - [23, 2174.63]
  - - [513, 8192, 1, 8192]
    - [24, 3315.12]
  - - [7679, 8192, 1, 8192]
    - [25, 4618.12]
  - - [1024, 513, 1, 1024]
    - [22, 1554.68]
  - - [8192, 511, 1, 8192]
    - [22, 3500.51]
  - - [4096, 4097, 1, 4096]
    - [22, 4074.92]
  - - [512, 3072, 1, 3071]
    - [22, 3179.99]
  - - [7680, 8192, 1, 8191]
    - [26, 4554.42]
  - - [2048, 2047, 1, 2048]
    - [22, 3532.88]
  - - [8193, 8192, 1, 8192]
    - [25, 4413.04]
  - - [512, 4096, 1, 4095]
    - [23, 2664.92]
  - - [1024, 1023, 1, 1024]
    - [23, 2144.36]
  - - [3073, 3072, 1, 3072]
    - [22, 4139.9]
  - - [512, 3073, 1, 3072]
    - [22, 3189.28]
  - - [4096, 4096, 1, 4095]
    - [25, 4132.33]
  - - [1920, 2048, 1, 2047]
    - [26, 4502.97]
  - - [1920, 2049, 1, 2048]
    - [22, 3332.65]
  - - [512, 8192, 1, 8191]
    - [24, 3384.44]
  - - [8191, 512, 1, 8192]
    - [22, 3504.38]
  - - [1025, 512, 1, 1024]
    - [22, 1556.4]
  - - [2881, 3072, 1, 3072]
    - [22, 3893.51]
  - - [64, 1024, 1, 1024]
    - [31, 4686.37]
  - - [1024, 512, 1, 1023]
    - [22, 1540.52]
  - - [513, 2048, 1, 2048]
    - [23, 2177.29]
  - - [3841, 4096, 1, 4096]
    - [22, 4052.65]
  - - [2880, 3072, 1, 3073]
    - [24, 4156.93]
  - - [512, 512, 1, 513]
    - [27, 872.793]
  - - [4095, 512, 1, 4096]
    - [22, 2749.41]
  - - [1919, 2048, 1, 2048]
    - [26, 4184.45]
  - - [1024, 1025, 1, 1024]
    - [23, 2137.27]
  - - [2879, 3072, 1, 3072]
    - [24, 4180.36]
  - - [512, 8192, 1, 8193]
    - [22, 3556.85]
  - - [511, 8192, 1, 8192]
    - [22, 3399.76]
  - - [8192, 513, 1, 8192]
    - [22, 3505.17]
  - - [512, 8193, 1, 8192]
    - [22, 3382.47]
  - - [7680, 8191, 1, 8192]
    - [25, 4614.26]
  - - [512, 512, 1, 511]
    - [27, 890.189]
  - - [2047, 2048, 1, 2048]
    - [22, 3533.35]
  - - [2049, 2048, 1, 2048]
    - [22, 3534.82]
  - - [3840, 4095, 1, 4096]
    - [25, 4490.73]
  - - [960, 1023, 1, 1024]
    - [24, 2637.01]
  - - [2880, 3072, 1, 3071]
    - [24, 4159.56]
  - - [64, 1025, 1, 1024]
    - [27, 268.698]
  - - [2048, 511, 1, 2048]
    - [23, 2129.32]
  - - [4096, 513, 1, 4096]
    - [22, 2757.79]
  - - [4097, 512, 1, 4096]
    - [22, 2754.78]
  - - [8192, 512, 1, 8191]
    - [24, 3401.11]
  - - [1921, 2048, 1, 2048]
    - [22, 3301.18]
  - - [2048, 2049, 1, 2048]
    - [22, 3532.15]
  - - [2048, 512, 1, 2047]
    - [23, 2168.47]
  - - [3071, 3072, 1, 3072]
    - [22, 4141.32]
  - - [3840, 4097, 1, 4096]
    - [22, 4068.63]
  - - [4096, 511, 1, 4096]
    - [22, 2748.3]
  - - [64, 1024, 1, 1025]
    - [27, 272.093]
  - - [2047, 512, 1, 2048]
    - [23, 2166.19]
  - - [63, 1024, 1, 1024]
    - [27, 266.115]
  - - [3072, 513, 1, 3072]
    - [22, 3178.7]
  - - [512, 4095, 1, 4096]
    - [22, 2689.42]
  - - [512, 1024, 1, 1025]
    - [22, 1530.87]
  - - [3071, 512, 1, 3072]
    - [22, 3184.01]
  - - [3840, 4096, 1, 4097]
    - [25, 4812.66]
  - - [512, 511, 1, 512]
    - [27, 905.105]
  - - [4097, 4096, 1, 4096]
    - [22, 4089.15]
  - - [2048, 2048, 1, 2047]
    - [22, 3513.91]
  - - [3839, 4096, 1, 4096]
    - [25, 4481.35]
  - - [512, 4096, 1, 4097]
    - [22, 2809.69]
  - - [3072, 3073, 1, 3072]
    - [22, 4137.92]
  - - [512, 2047, 1, 2048]
    - [23, 2161.31]
  - - [2048, 2048, 1, 2049]
    - [22, 3560.48]
  - - [8191, 8192, 1, 8192]
    - [25, 4413.6]
  - - [64, 1023, 1, 1024]
    - [27, 269.988]
  - - [4096, 512, 1, 4097]
    - [22, 2843.99]
  - - [3840, 4096, 1, 4095]
    - [25, 4800.53]
  - - [65, 1024, 1, 1024]
    - [28, 260.541]
  - - [1920, 2047, 1, 2048]
    - [26, 4193.31]
  - - [512, 513, 1, 512]
    - [27, 917.075]
  - - [8192, 8192, 1, 8191]
    - [25, 4634.15]
  - - [1024, 1024, 1, 1023]
    - [23, 2154.7]
  - - [512, 4097, 1, 4096]
    - [22, 2697.96]
  - - [511, 512, 1, 512]
    - [27, 901.693]
  - - [4096, 512, 1, 4095]
    - [24, 2674.08]
  - - [8193, 512, 1, 8192]
    - [22, 3510.08]
  - - [961, 1024, 1, 1024]
    - [23, 2028.35]
  - - [512, 1024, 1, 1023]
    - [22, 1539.46]
  - - [4095, 4096, 1, 4096]
    - [22, 4090.81]
  - - [64, 1024, 1, 1023]
    - [27, 264.283]
  - - [2048, 512, 1, 2049]
    - [23, 2190.95]
  - - [1023, 1024, 1, 1024]
    - [23, 2144.02]
  - - [1920, 2048, 1, 2049]
    - [26, 4475.52]
  - - [512, 512, 1, 512]
    - [35, 7294.44]
  - - [512, 1024, 1, 1024]
    - [35, 22519.8]
  - - [512, 2048, 1, 2048]
    - [35, 25687.6]
  - - [512, 3072, 1, 3072]
    - [35, 38519.1]
  - - [512, 4096, 1, 4096]
    - [35, 35899.1]
  - - [512, 8192, 1, 8192]
    - [35, 44291.7]
  - - [960, 1024, 1, 1024]
    - [35, 32514.0]
  - - [1024, 1024, 1, 1024]
    - [35, 23423.7]
  - - [1920, 2048, 1, 2048]
    - [35, 47060.9]
  - - [2048, 2048, 1, 2048]
    - [35, 41313.7]
  - - [2880, 3072, 1, 3072]
    - [35, 47582.4]
  - - [3072, 512, 1, 3072]
    - [35, 38766.4]
  - - [3072, 3072, 1, 3072]
    - [35, 47802.1]
  - - [3840, 4096, 1, 4096]
    - [35, 50483.1]
  - - [4096, 512, 1, 4096]
    - [35, 35983.3]
  - - [4096, 4096, 1, 4096]
    - [35, 48424.0]
  - - [7680, 8192, 1, 8192]
    - [35, 51412.9]
  - - [8192, 512, 1, 8192]
    - [35, 44278.0]
  - - [8192, 8192, 1, 8192]
    - [35, 51331.8]
  - - [479, 512, 1, 512]
    - [38, 976.73]
  - - [479, 1024, 1, 1024]
    - [37, 2002.69]
  - - [479, 2048, 1, 2048]
    - [37, 3071.64]
  - - [480, 511, 1, 512]
    - [38, 972.019]
  - - [480, 512, 1, 511]
    - [38, 984.207]
  - - [480, 512, 1, 513]
    - [38, 967.437]
  - - [480, 513, 1, 512]
    - [38, 985.588]
  - - [480, 1023, 1, 1024]
    - [37, 2007.47]
  - - [480, 1024, 1, 1023]
    - [37, 2035.42]
  - - [480, 1024, 1, 1025]
    - [37, 2040.73]
  - - [480, 1025, 1, 1024]
    - [36, 1683.42]
  - - [480, 2047, 1, 2048]
    - [37, 3075.04]
  - - [480, 2048, 1, 2047]
    - [37, 3079.56]
  - - [480, 2048, 1, 2049]
    - [37, 3084.84]
  - - [480, 2049, 1, 2048]
    - [37, 2420.31]
  - - [481, 512, 1, 512]
    - [38, 983.87]
  - - [481, 1024, 1, 1024]
    - [36, 1635.87]
  - - [481, 2048, 1, 2048]
    - [37, 2370.84]
  - - [511, 480, 1, 512]
    - [38, 1001.79]
  - - [512, 479, 1, 512]
    - [38, 997.208]
  - - [512, 480, 1, 511]
    - [38, 1008.88]
  - - [512, 480, 1, 513]
    - [38, 1004.43]
  - - [512, 481, 1, 512]
    - [38, 971.139]
  - - [513, 480, 1, 512]
    - [38, 948.227]
  - - [1023, 480, 1, 1024]
    - [38, 1895.48]
  - - [1024, 479, 1, 1024]
    - [38, 1887.68]
  - - [1024, 480, 1, 1023]
    - [38, 1880.73]
  - - [1024, 480, 1, 1025]
    - [38, 1883.28]
  - - [1024, 481, 1, 1024]
    - [36, 1672.32]
  - - [1025, 480, 1, 1024]
    - [36, 1679.38]
  - - [2047, 480, 1, 2048]
    - [39, 3097.77]
  - - [2048, 479, 1, 2048]
    - [39, 3092.82]
  - - [2048, 480, 1, 2047]
    - [39, 3044.53]
  - - [2048, 480, 1, 2049]
    - [39, 3040.14]
  - - [2048, 481, 1, 2048]
    - [37, 2389.03]
  - - [2049, 480, 1, 2048]
    - [37, 2384.1]
  - - [480, 512, 1, 512]
    - [40, 11316.1]
  - - [480, 1024, 1, 1024]
    - [40, 23921.9]
  - - [480, 2048, 1, 2048]
    - [40, 28533.1]
  - - [512, 480, 1, 512]
    - [41, 9955.23]
  - - [1024, 480, 1, 1024]
    - [41, 21769.7]
  - - [2048, 480, 1, 2048]
    - [41, 21770.1]
  - - [480, 3072, 1, 3072]
    - [42, 30773.7]
  - - [480, 4096, 1, 4096]
    - [44, 30130.0]
  - - [480, 8192, 1, 8192]
    - [43, 36203.7]
  - - [3072, 480, 1, 3072]
    - [45, 31249.3]
  - - [4096, 480, 1, 4096]
    - [45, 28638.5]
  - - [8192, 480, 1, 8192]
    - [46, 36164.7]
  - - [256, 44505, 1, 1024]
    - [56, 39976.0]
  - - [10240, 8976, 1, 256]
    - [84, 32184.0]
  - - [512, 1600, 1, 512]
    - [86, 23096.0]
  - - [1024, 10200, 1, 4096]
    - [52, 37517.0]
  - - [2, 32, 1, 1024]
    - [62, 4.0]
  - - [17, 15, 7680, 64]
    - [61, 1705.0]
  - - [17, 17, 1, 64]
    - [57, 4.0]
  - - [42720, 6528, 1, 1024]
    - [76, 46117.0]
  - - [256, 19200, 1, 1024]
    - [56, 36116.0]
  - - [1024, 512, 1, 1024]
    - [80, 20841.0]
  - - [5632, 8976, 1, 256]
    - [66, 35429.0]
  - - [24, 24, 1, 64]
    - [75, 8.0]
  - - [256, 14848, 1, 1024]
    - [87, 37140.0]
  - - [3840, 8976, 1, 256]
    - [66, 35477.0]
  - - [27, 33, 1920, 64]
    - [83, 4122.0]
  - - [64, 960, 1, 1024]
    - [74, 3952.0]
  - - [4096, 3968, 1, 1024]
    - [56, 38849.0]
  - - [1024, 6528, 1, 4096]
    - [52, 36356.0]
  - - [1024, 1600, 1, 1024]
    - [56, 33934.0]
  - - [1024, 2048, 1, 4096]
    - [67, 27926.0]
  - - [30, 31, 2048, 64]
    - [83, 4031.0]
  - - [5376, 8976, 1, 256]
    - [76, 36410.0]
  - - [256, 5888, 1, 1024]
    - [48, 29322.0]
  - - [64, 128, 512, 128]
    - [71, 16249.0]
  - - [1024, 9216, 1, 1024]
    - [72, 42714.0]
  - - [1024, 8160, 1, 4096]
    - [79, 35897.0]
  - - [30, 31, 1, 64]
    - [75, 13.0]
  - - [2, 4, 1, 1024]
    - [62, 0.4]
  - - [32, 32, 1, 64]
    - [65, 13.0]
  - - [256, 7424, 1, 1024]
    - [50, 36637.0]
  - - [32, 35, 1, 64]
    - [80, 15.0]
  - - [8192, 8976, 1, 256]
    - [87, 25072.0]
  - - [128, 32768, 1, 256]
    - [66, 26473.0]
  - - [256, 2560, 1, 1024]
    - [73, 21077.0]
  - - [256, 21504, 1, 1024]
    - [56, 38048.0]
  - - [2048, 512, 1, 100]
    - [85, 8797.0]
  - - [6400, 8976, 1, 256]
    - [76, 36402.0]
  - - [31, 31, 1, 64]
    - [68, 13.0]
  - - [256, 8960, 1, 1024]
    - [67, 28258.0]
  - - [34, 34, 1, 64]
    - [63, 15.0]
  - - [5, 5, 960, 64]
    - [83, 114.0]
  - - [11776, 8976, 1, 256]
    - [76, 36441.0]
  - - [256, 20992, 1, 1024]
    - [56, 37671.0]
  - - [15, 15, 10880, 64]
    - [61, 1553.0]
  - - [256, 684, 1, 1024]
    - [82, 8621.0]
  - - [1024, 200, 1, 560]
    - [80, 7062.0]
  - - [256, 10496, 1, 1024]
    - [70, 30599.0]
  - - [21248, 8976, 1, 256]
    - [76, 37128.0]
  - - [15360, 8976, 1, 256]
    - [66, 35272.0]
  - - [4096, 10080, 1, 1024]
    - [56, 38469.0]
  - - [256, 8192, 1, 1024]
    - [88, 26317.0]
  - - [4096, 8976, 1, 256]
    - [87, 26397.0]
  - - [2048, 512, 1, 2048]
    - [72, 25688.0]
  - - [1024, 8064, 1, 4096]
    - [48, 36915.0]
  - - [18944, 8976, 1, 256]
    - [76, 36632.0]
  - - [8448, 8976, 1, 256]
    - [76, 36424.0]
  - - [256, 11776, 1, 1024]
    - [56, 32291.0]
  - - [31488, 8976, 1, 256]
    - [76, 37168.0]
  - - [1024, 4096, 1, 1024]
    - [86, 34548.0]
  - - [30, 30, 1, 64]
    - [61, 12.0]
  - - [64, 512, 1, 512]
    - [80, 1427.0]
  - - [4096, 3840, 1, 1024]
    - [56, 38709.0]
  - - [64, 512, 1, 1024]
    - [78, 1832.0]
  - - [12544, 8976, 1, 256]
    - [76, 36799.0]
  - - [1024, 3240, 1, 1024]
    - [72, 37515.0]
  - - [256, 23296, 1, 1024]
    - [56, 35276.0]
  - - [17, 15, 1, 64]
    - [86, 4.0]
  - - [35, 35, 1, 64]
    - [75, 17.0]
  - - [27, 27, 32768, 128]
    - [61, 6005.0]
  - - [256, 18944, 1, 1024]
    - [56, 36537.0]
  - - [1024, 3968, 1, 4096]
    - [70, 31516.0]
  - - [16128, 8976, 1, 256]
    - [76, 37110.0]
  - - [1024, 7104, 1, 1024]
    - [56, 41550.0]
  - - [512, 512, 64, 64]
    - [66, 18798.0]
  - - [1024, 7200, 1, 1024]
    - [72, 41665.0]
  - - [256, 2816, 1, 1024]
    - [70, 25075.0]
  - - [21, 17, 1, 64]
    - [61, 5.0]
  - - [1024, 10080, 1, 4096]
    - [52, 37797.0]
  - - [256, 6144, 1, 1024]
    - [48, 30878.0]
  - - [21, 21, 1, 64]
    - [57, 6.0]
  - - [9472, 8976, 1, 256]
    - [76, 36499.0]
  - - [2048, 215, 1, 768]
    - [80, 15541.0]
  - - [1024, 32768, 1, 1024]
    - [72, 43379.0]
  - - [1024, 4, 1, 1024]
    - [82, 209.0]
  - - [684, 8976, 1, 256]
    - [59, 27478.0]
  - - [3, 3, 512, 64]
    - [83, 28.0]
  - - [30528, 2048, 1, 1024]
    - [76, 44489.0]
  - - [256, 1536, 1, 1024]
    - [80, 16341.0]
  - - [2048, 684, 1, 768]
    - [56, 26525.0]
  - - [8960, 8976, 1, 256]
    - [76, 36598.0]
  - - [1024, 7104, 1, 4096]
    - [52, 38374.0]
  - - [256, 11520, 1, 1024]
    - [56, 32181.0]
  - - [33536, 8976, 1, 256]
    - [71, 36840.0]
  - - [1024, 3840, 1, 1024]
    - [77, 40460.0]
  - - [4096, 7104, 1, 1024]
    - [56, 38441.0]
  - - [5, 5, 512, 64]
    - [61, 84.0]
  - - [28672, 8976, 1, 256]
    - [60, 23120.0]
  - - [256, 1280, 1, 1024]
    - [78, 15477.0]
  - - [256, 7168, 1, 1024]
    - [50, 33602.0]
  - - [1024, 3840, 1, 4096]
    - [53, 43055.0]
  - - [256, 13312, 1, 1024]
    - [56, 34758.0]
  - - [2304, 8976, 1, 256]
    - [66, 35352.0]
  - - [2048, 512, 1, 67]
    - [68, 6554.0]
  - - [4096, 2048, 1, 1024]
    - [56, 36547.0]
  - - [15, 14, 1, 64]
    - [57, 3.0]
  - - [1024, 960, 1, 1600]
    - [84, 37882.0]
  - - [4096, 7200, 1, 1024]
    - [56, 38130.0]
  - - [1024, 7200, 1, 4096]
    - [52, 39908.0]
  - - [4096, 9520, 1, 1024]
    - [56, 38046.0]
  - - [42720, 10080, 1, 1024]
    - [71, 46043.0]
  - - [9984, 8976, 1, 256]
    - [71, 36742.0]
  - - [1024, 10200, 1, 1024]
    - [56, 40415.0]
  - - [256, 14592, 1, 1024]
    - [87, 37268.0]
  - - [11264, 8976, 1, 256]
    - [66, 35098.0]
  - - [1024, 32768, 1, 480]
    - [66, 42269.0]
  - - [2048, 114, 1, 512]
    - [80, 7782.0]
  - - [256, 7936, 1, 1024]
    - [54, 25773.0]
  - - [2048, 256, 1, 768]
    - [80, 19738.0]
  - - [15104, 8976, 1, 256]
    - [76, 36897.0]
  - - [4096, 4096, 1, 1024]
    - [56, 38280.0]
  - - [2048, 512, 1, 74]
    - [83, 7293.0]
  - - [14, 14, 10880, 64]
    - [61, 1356.0]
  - - [42720, 7104, 1, 1024]
    - [66, 45888.0]
  - - [256, 23552, 1, 1024]
    - [56, 35746.0]
  - - [1024, 1600, 1, 560]
    - [69, 26859.0]
  - - [2048, 1536, 1, 512]
    - [56, 30504.0]
  - - [14, 14, 1, 64]
    - [55, 2.0]
  - - [1024, 8064, 1, 1024]
    - [72, 38745.0]
  - - [13824, 8976, 1, 256]
    - [76, 36448.0]
  - - [1024, 9520, 1, 1024]
    - [81, 39943.0]
  - - [4096, 10064, 1, 1024]
    - [56, 38382.0]
  - - [256, 6656, 1, 1024]
    - [48, 33298.0]
  - - [2048, 215, 1, 512]
    - [80, 13882.0]
  - - [2560, 8976, 1, 256]
    - [66, 35626.0]
  - - [4096, 10200, 1, 1024]
    - [56, 38404.0]
  - - [17, 17, 7680, 64]
    - [61, 1922.0]
  - - [1024, 960, 1, 1024]
    - [67, 33026.0]
  - - [32, 1600, 1, 512]
    - [80, 1894.0]
  - - [13568, 8976, 1, 256]
    - [76, 37066.0]
  - - [4096, 8064, 1, 1024]
    - [56, 38296.0]
  - - [4608, 8976, 1, 256]
    - [76, 35475.0]
  - - [256, 22016, 1, 1024]
    - [50, 37148.0]
  - - [42720, 3968, 1, 1024]
    - [76, 45830.0]
  - - [2048, 960, 1, 74]
    - [81, 9622.0]
  - - [4864, 8976, 1, 256]
    - [76, 36185.0]
  - - [256, 21248, 1, 1024]
    - [56, 38109.0]
  - - [1024, 6528, 1, 1024]
    - [81, 38893.0]
  - - [23552, 8976, 1, 256]
    - [66, 35418.0]
  - - [256, 12544, 1, 1024]
    - [56, 33831.0]
  - - [42720, 7200, 1, 1024]
    - [76, 45558.0]
  - - [9, 9, 512, 64]
    - [75, 274.0]
  - - [256, 33536, 1, 1024]
    - [56, 39615.0]
  - - [1792, 8976, 1, 256]
    - [84, 34499.0]
  - - [4096, 8160, 1, 1024]
    - [56, 38222.0]
  - - [4096, 9216, 1, 1024]
    - [56, 38537.0]
  - - [19968, 8976, 1, 256]
    - [76, 36613.0]
  - - [33, 33, 1600, 32]
    - [83, 2387.0]
  - - [5888, 8976, 1, 256]
    - [76, 36230.0]
  - - [256, 2304, 1, 1024]
    - [67, 20628.0]
  - - [33, 33, 1920, 64]
    - [61, 4278.0]
  - - [7168, 8976, 1, 256]
    - [66, 35104.0]
  - - [1024, 32, 1, 1024]
    - [78, 1777.0]
  - - [2, 2048, 1, 1024]
    - [82, 252.0]
  - - [4096, 3960, 1, 1024]
    - [56, 37081.0]
  - - [512, 32768, 1, 13]
    - [64, 4957.0]
  - - [19712, 8976, 1, 256]
    - [76, 36999.0]
  - - [1024, 2048, 1, 1024]
    - [80, 30297.0]
  - - [64, 512, 64, 512]
    - [71, 23713.0]
  - - [2048, 8976, 1, 256]
    - [81, 31575.0]
  - - [256, 3584, 1, 1024]
    - [54, 26156.0]
  - - [18688, 8976, 1, 256]
    - [76, 37261.0]
  - - [512, 512, 1, 64]
    - [68, 2796.0]
  - - [256, 5376, 1, 1024]
    - [48, 27227.0]
  - - [30, 30, 2048, 64]
    - [61, 3964.0]
  - - [6144, 8976, 1, 256]
    - [66, 31935.0]
  - - [30528, 4096, 1, 1024]
    - [76, 45698.0]
  - - [256, 11264, 1, 1024]
    - [56, 32068.0]
  - - [4096, 3240, 1, 1024]
    - [56, 37715.0]
  - - [4352, 8976, 1, 256]
    - [71, 36066.0]
  - - [15, 15, 1, 64]
    - [57, 3.0]
  - - [256, 15104, 1, 1024]
    - [87, 38546.0]
  - - [256, 31488, 1, 1024]
    - [56, 37657.0]
  - - [1024, 3968, 1, 1024]
    - [80, 34882.0]
  - - [9728, 8976, 1, 256]
    - [71, 36354.0]
  - - [256, 9984, 1, 1024]
    - [67, 30604.0]
  - - [7936, 8976, 1, 256]
    - [76, 36665.0]
  - - [2048, 960, 1, 2048]
    - [81, 34216.0]
  - - [5120, 8976, 1, 256]
    - [66, 34767.0]
  - - [27, 27, 1920, 64]
    - [83, 3555.0]
  - - [4096, 6528, 1, 1024]
    - [56, 38460.0]
  - - [13312, 8976, 1, 256]
    - [66, 35335.0]
  - - [1024, 10080, 1, 1024]
    - [56, 39759.0]
  - - [256, 14336, 1, 1024]
    - [56, 36219.0]
  - - [1280, 8976, 1, 256]
    - [66, 32565.0]
  - - [256, 22344, 1, 1024]
    - [56, 36444.0]
  - - [256, 18176, 1, 1024]
    - [56, 35664.0]
  - - [1024, 9520, 1, 4096]
    - [48, 37778.0]
  - - [512, 32768, 1, 1024]
    - [72, 42132.0]
  - - [128, 128, 512, 64]
    - [58, 14946.0]
  - - [20992, 8976, 1, 256]
    - [76, 36723.0]
  - - [42720, 3960, 1, 1024]
    - [76, 45361.0]
  - - [1024, 10064, 1, 1024]
    - [56, 39804.0]
  - - [2048, 684, 1, 512]
    - [77, 23226.0]
  - - [31, 31, 2048, 64]
    - [61, 3956.0]
  - - [17152, 8976, 1, 256]
    - [76, 37106.0]
  - - [256, 3328, 1, 1024]
    - [70, 28698.0]
  - - [34, 24, 1, 64]
    - [49, 11.0]
  - - [20480, 8976, 1, 256]
    - [60, 23039.0]
  - - [2048, 256, 1, 512]
    - [80, 17568.0]
  - - [2048, 1536, 1, 768]
    - [56, 33554.0]
  - - [10496, 8976, 1, 256]
    - [71, 36761.0]
  - - [3328, 8976, 1, 256]
    - [66, 35788.0]
  - - [1024, 3240, 1, 4096]
    - [47, 34498.0]
  - - [256, 4864, 1, 1024]
    - [50, 24483.0]
  - - [1024, 9216, 1, 4096]
    - [79, 37427.0]
  - - [15872, 8976, 1, 256]
    - [76, 36457.0]
  - - [15, 14, 10880, 64]
    - [61, 1448.0]
  - - [1024, 8160, 1, 1024]
    - [81, 38710.0]
  - - [256, 32768, 1, 512]
    - [56, 34794.0]
  - - [15, 15, 7680, 64]
    - [61, 1511.0]
  - - [18176, 8976, 1, 256]
    - [71, 37103.0]
  - - [1024, 512, 1, 1600]
    - [80, 22405.0]
  - - [256, 6400, 1, 1024]
    - [50, 31969.0]
  - - [3072, 8976, 1, 256]
    - [66, 35239.0]
  - - [256, 20480, 1, 1024]
    - [56, 37221.0]
  - - [44505, 8976, 1, 256]
    - [76, 35732.0]
  - - [2048, 114, 1, 768]
    - [82, 10776.0]
  - - [256, 16128, 1, 1024]
    - [56, 32663.0]
  - - [256, 4608, 1, 1024]
    - [56, 23892.0]
  - - [1024, 4, 1, 1024]
    - [82, 252.0]
  - - [1024, 4096, 1, 4096]
    - [67, 31544.0]
  - - [256, 8448, 1, 1024]
    - [51, 27220.0]
  - - [1024, 3960, 1, 4096]
    - [70, 31343.0]
  - - [42720, 9520, 1, 1024]
    - [71, 45905.0]
  - - [1024, 10064, 1, 4096]
    - [52, 38069.0]
  - - [2816, 8976, 1, 256]
    - [66, 35853.0]
  - - [1024, 3960, 1, 1024]
    - [86, 34442.0]
  - - [511, 4096, 1, 4096]
    - [111, 2670.57]
  - - [512, 3071, 1, 3072]
    - [111, 3189.39]
  - - [2880, 3073, 1, 3072]
    - [111, 3883.37]
  - - [511, 3072, 1, 3072]
    - [111, 3175.98]
  - - [1024, 512, 1, 1025]
    - [111, 1532.26]
  - - [511, 2048, 1, 2048]
    - [112, 2153.8]
  - - [8192, 8193, 1, 8192]
    - [114, 4374.36]
  - - [3072, 3072, 1, 3071]
    - [111, 4159.1]
  - - [8192, 8192, 1, 8193]
    - [114, 4631.22]
  - - [513, 1024, 1, 1024]
    - [111, 1511.35]
  - - [512, 1023, 1, 1024]
    - [111, 1497.51]
  - - [512, 2048, 1, 2047]
    - [112, 2191.32]
  - - [7680, 8192, 1, 8193]
    - [114, 4847.64]
  - - [513, 4096, 1, 4096]
    - [111, 2655.48]
  - - [3073, 512, 1, 3072]
    - [111, 3180.55]
  - - [4096, 4096, 1, 4097]
    - [111, 4148.5]
  - - [1025, 1024, 1, 1024]
    - [112, 2150.96]
  - - [8192, 8191, 1, 8192]
    - [114, 4411.15]
  - - [8192, 512, 1, 8193]
    - [111, 3586.69]
  - - [7681, 8192, 1, 8192]
    - [114, 4321.58]
  - - [2880, 3071, 1, 3072]
    - [113, 4177.63]
  - - [512, 1025, 1, 1024]
    - [111, 1549.23]
  - - [2048, 513, 1, 2048]
    - [112, 2184.71]
  - - [1024, 1024, 1, 1025]
    - [112, 2128.47]
  - - [960, 1024, 1, 1023]
    - [113, 2675.74]
  - - [3072, 512, 1, 3071]
    - [111, 3198.18]
  - - [960, 1025, 1, 1024]
    - [112, 2035.43]
  - - [3072, 3071, 1, 3072]
    - [111, 4139.24]
  - - [512, 2048, 1, 2049]
    - [112, 2170.06]
  - - [3072, 511, 1, 3072]
    - [111, 3187.23]
  - - [2049, 512, 1, 2048]
    - [112, 2173.05]
  - - [512, 8191, 1, 8192]
    - [111, 3417.57]
  - - [513, 3072, 1, 3072]
    - [111, 3170.54]
  - - [4096, 4095, 1, 4096]
    - [111, 4091.87]
  - - [511, 1024, 1, 1024]
    - [111, 1492.04]
  - - [513, 512, 1, 512]
    - [116, 887.07]
  - - [1024, 511, 1, 1024]
    - [111, 1538.66]
  - - [3072, 3072, 1, 3073]
    - [111, 4161.95]
  - - [960, 1024, 1, 1025]
    - [113, 2660.02]
  - - [959, 1024, 1, 1024]
    - [112, 2622.54]
  - - [7680, 8193, 1, 8192]
    - [114, 4367.72]
  - - [512, 3072, 1, 3073]
    - [111, 3183.4]
  - - [1023, 512, 1, 1024]
    - [111, 1540.52]
  - - [3072, 512, 1, 3073]
    - [111, 3205.52]
  - - [512, 2049, 1, 2048]
    - [112, 2174.63]
  - - [513, 8192, 1, 8192]
    - [113, 3315.12]
  - - [7679, 8192, 1, 8192]
    - [114, 4618.12]
  - - [1024, 513, 1, 1024]
    - [111, 1554.68]
  - - [8192, 511, 1, 8192]
    - [111, 3500.51]
  - - [4096, 4097, 1, 4096]
    - [111, 4074.92]
  - - [512, 3072, 1, 3071]
    - [111, 3179.99]
  - - [7680, 8192, 1, 8191]
    - [115, 4554.42]
  - - [2048, 2047, 1, 2048]
    - [111, 3532.88]
  - - [8193, 8192, 1, 8192]
    - [114, 4413.04]
  - - [512, 4096, 1, 4095]
    - [112, 2664.92]
  - - [1024, 1023, 1, 1024]
    - [112, 2144.36]
  - - [3073, 3072, 1, 3072]
    - [111, 4139.9]
  - - [512, 3073, 1, 3072]
    - [111, 3189.28]
  - - [4096, 4096, 1, 4095]
    - [114, 4132.33]
  - - [1920, 2048, 1, 2047]
    - [115, 4502.97]
  - - [1920, 2049, 1, 2048]
    - [111, 3332.65]
  - - [512, 8192, 1, 8191]
    - [113, 3384.44]
  - - [8191, 512, 1, 8192]
    - [111, 3504.38]
  - - [1025, 512, 1, 1024]
    - [111, 1556.4]
  - - [2881, 3072, 1, 3072]
    - [111, 3893.51]
  - - [64, 1024, 1, 1024]
    - [120, 4686.37]
  - - [1024, 512, 1, 1023]
    - [111, 1540.52]
  - - [513, 2048, 1, 2048]
    - [112, 2177.29]
  - - [3841, 4096, 1, 4096]
    - [111, 4052.65]
  - - [2880, 3072, 1, 3073]
    - [113, 4156.93]
  - - [512, 512, 1, 513]
    - [116, 872.793]
  - - [4095, 512, 1, 4096]
    - [111, 2749.41]
  - - [1919, 2048, 1, 2048]
    - [115, 4184.45]
  - - [1024, 1025, 1, 1024]
    - [112, 2137.27]
  - - [2879, 3072, 1, 3072]
    - [113, 4180.36]
  - - [512, 8192, 1, 8193]
    - [111, 3556.85]
  - - [511, 8192, 1, 8192]
    - [111, 3399.76]
  - - [8192, 513, 1, 8192]
    - [111, 3505.17]
  - - [512, 8193, 1, 8192]
    - [111, 3382.47]
  - - [7680, 8191, 1, 8192]
    - [114, 4614.26]
  - - [512, 512, 1, 511]
    - [116, 890.189]
  - - [2047, 2048, 1, 2048]
    - [111, 3533.35]
  - - [2049, 2048, 1, 2048]
    - [111, 3534.82]
  - - [3840, 4095, 1, 4096]
    - [114, 4490.73]
  - - [960, 1023, 1, 1024]
    - [113, 2637.01]
  - - [2880, 3072, 1, 3071]
    - [113, 4159.56]
  - - [64, 1025, 1, 1024]
    - [116, 268.698]
  - - [2048, 511, 1, 2048]
    - [112, 2129.32]
  - - [4096, 513, 1, 4096]
    - [111, 2757.79]
  - - [4097, 512, 1, 4096]
    - [111, 2754.78]
  - - [8192, 512, 1, 8191]
    - [113, 3401.11]
  - - [1921, 2048, 1, 2048]
    - [111, 3301.18]
  - - [2048, 2049, 1, 2048]
    - [111, 3532.15]
  - - [2048, 512, 1, 2047]
    - [112, 2168.47]
  - - [3071, 3072, 1, 3072]
    - [111, 4141.32]
  - - [3840, 4097, 1, 4096]
    - [111, 4068.63]
  - - [4096, 511, 1, 4096]
    - [111, 2748.3]
  - - [64, 1024, 1, 1025]
    - [116, 272.093]
  - - [2047, 512, 1, 2048]
    - [112, 2166.19]
  - - [63, 1024, 1, 1024]
    - [116, 266.115]
  - - [3072, 513, 1, 3072]
    - [111, 3178.7]
  - - [512, 4095, 1, 4096]
    - [111, 2689.42]
  - - [512, 1024, 1, 1025]
    - [111, 1530.87]
  - - [3071, 512, 1, 3072]
    - [111, 3184.01]
  - - [3840, 4096, 1, 4097]
    - [114, 4812.66]
  - - [512, 511, 1, 512]
    - [116, 905.105]
  - - [4097, 4096, 1, 4096]
    - [111, 4089.15]
  - - [2048, 2048, 1, 2047]
    - [111, 3513.91]
  - - [3839, 4096, 1, 4096]
    - [114, 4481.35]
  - - [512, 4096, 1, 4097]
    - [111, 2809.69]
  - - [3072, 3073, 1, 3072]
    - [111, 4137.92]
  - - [512, 2047, 1, 2048]
    - [112, 2161.31]
  - - [2048, 2048, 1, 2049]
    - [111, 3560.48]
  - - [8191, 8192, 1, 8192]
    - [114, 4413.6]
  - - [64, 1023, 1, 1024]
    - [116, 269.988]
  - - [4096, 512, 1, 4097]
    - [111, 2843.99]
  - - [3840, 4096, 1, 4095]
    - [114, 4800.53]
  - - [65, 1024, 1, 1024]
    - [117, 260.541]
  - - [1920, 2047, 1, 2048]
    - [115, 4193.31]
  - - [512, 513, 1, 512]
    - [116, 917.075]
  - - [8192, 8192, 1, 8191]
    - [114, 4634.15]
  - - [1024, 1024, 1, 1023]
    - [112, 2154.7]
  - - [512, 4097, 1, 4096]
    - [111, 2697.96]
  - - [511, 512, 1, 512]
    - [116, 901.693]
  - - [4096, 512, 1, 4095]
    - [113, 2674.08]
  - - [8193, 512, 1, 8192]
    - [111, 3510.08]
  - - [961, 1024, 1, 1024]
    - [112, 2028.35]
  - - [512, 1024, 1, 1023]
    - [111, 1539.46]
  - - [4095, 4096, 1, 4096]
    - [111, 4090.81]
  - - [64, 1024, 1, 1023]
    - [116, 264.283]
  - - [2048, 512, 1, 2049]
    - [112, 2190.95]
  - - [1023, 1024, 1, 1024]
    - [112, 2144.02]
  - - [1920, 2048, 1, 2049]
    - [115, 4475.52]
  - - [512, 512, 1, 512]
    - [124, 7294.44]
  - - [512, 1024, 1, 1024]
    - [124, 22519.8]
  - - [512, 2048, 1, 2048]
    - [124, 25687.6]
  - - [512, 3072, 1, 3072]
    - [124, 38519.1]
  - - [512, 4096, 1, 4096]
    - [124, 35899.1]
  - - [512, 8192, 1, 8192]
    - [124, 44291.7]
  - - [960, 1024, 1, 1024]
    - [124, 32514.0]
  - - [1024, 1024, 1, 1024]
    - [124, 23423.7]
  - - [1920, 2048, 1, 2048]
    - [124, 47060.9]
  - - [2048, 2048, 1, 2048]
    - [124, 41313.7]
  - - [2880, 3072, 1, 3072]
    - [124, 47582.4]
  - - [3072, 512, 1, 3072]
    - [124, 38766.4]
  - - [3072, 3072, 1, 3072]
    - [124, 47802.1]
  - - [3840, 4096, 1, 4096]
    - [124, 50483.1]
  - - [4096, 512, 1, 4096]
    - [124, 35983.3]
  - - [4096, 4096, 1, 4096]
    - [124, 48424.0]
  - - [7680, 8192, 1, 8192]
    - [124, 51412.9]
  - - [8192, 512, 1, 8192]
    - [124, 44278.0]
  - - [8192, 8192, 1, 8192]
    - [124, 51331.8]
  - - [479, 512, 1, 512]
    - [127, 976.73]
  - - [479, 1024, 1, 1024]
    - [126, 2002.69]
  - - [479, 2048, 1, 2048]
    - [126, 3071.64]
  - - [480, 511, 1, 512]
    - [127, 972.019]
  - - [480, 512, 1, 511]
    - [127, 984.207]
  - - [480, 512, 1, 513]
    - [127, 967.437]
  - - [480, 513, 1, 512]
    - [127, 985.588]
  - - [480, 1023, 1, 1024]
    - [126, 2007.47]
  - - [480, 1024, 1, 1023]
    - [126, 2035.42]
  - - [480, 1024, 1, 1025]
    - [126, 2040.73]
  - - [480, 1025, 1, 1024]
    - [125, 1683.42]
  - - [480, 2047, 1, 2048]
    - [126, 3075.04]
  - - [480, 2048, 1, 2047]
    - [126, 3079.56]
  - - [480, 2048, 1, 2049]
    - [126, 3084.84]
  - - [480, 2049, 1, 2048]
    - [126, 2420.31]
  - - [481, 512, 1, 512]
    - [127, 983.87]
  - - [481, 1024, 1, 1024]
    - [125, 1635.87]
  - - [481, 2048, 1, 2048]
    - [126, 2370.84]
  - - [511, 480, 1, 512]
    - [127, 1001.79]
  - - [512, 479, 1, 512]
    - [127, 997.208]
  - - [512, 480, 1, 511]
    - [127, 1008.88]
  - - [512, 480, 1, 513]
    - [127, 1004.43]
  - - [512, 481, 1, 512]
    - [127, 971.139]
  - - [513, 480, 1, 512]
    - [127, 948.227]
  - - [1023, 480, 1, 1024]
    - [127, 1895.48]
  - - [1024, 479, 1, 1024]
    - [127, 1887.68]
  - - [1024, 480, 1, 1023]
    - [127, 1880.73]
  - - [1024, 480, 1, 1025]
    - [127, 1883.28]
  - - [1024, 481, 1, 1024]
    - [125, 1672.32]
  - - [1025, 480, 1, 1024]
    - [125, 1679.38]
  - - [2047, 480, 1, 2048]
    - [128, 3097.77]
  - - [2048, 479, 1, 2048]
    - [128, 3092.82]
  - - [2048, 480, 1, 2047]
    - [128, 3044.53]
  - - [2048, 480, 1, 2049]
    - [128, 3040.14]
  - - [2048, 481, 1, 2048]
    - [126, 2389.03]
  - - [2049, 480, 1, 2048]
    - [126, 2384.1]
  - - [480, 512, 1, 512]
    - [129, 11316.1]
  - - [480, 1024, 1, 1024]
    - [129, 23921.9]
  - - [480, 2048, 1, 2048]
    - [129, 28533.1]
  - - [512, 480, 1, 512]
    - [130, 9955.23]
  - - [1024, 480, 1, 1024]
    - [130, 21769.7]
  - - [2048, 480, 1, 2048]
    - [130, 21770.1]
  - - [480, 3072, 1, 3072]
    - [131, 30773.7]
  - - [480, 4096, 1, 4096]
    - [133, 30130.0]
  - - [480, 8192, 1, 8192]
    - [132, 36203.7]
  - - [3072, 480, 1, 3072]
    - [134, 31249.3]
  - - [4096, 480, 1, 4096]
    - [134, 28638.5]
  - - [8192, 480, 1, 8192]
    - [135, 36164.7]
  - - [256, 44505, 1, 1024]
    - [145, 39976.0]
  - - [10240, 8976, 1, 256]
    - [173, 32184.0]
  - - [512, 1600, 1, 512]
    - [175, 23096.0]
  - - [1024, 10200, 1, 4096]
    - [141, 37517.0]
  - - [2, 32, 1, 1024]
    - [151, 4.0]
  - - [17, 15, 7680, 64]
    - [150, 1705.0]
  - - [17, 17, 1, 64]
    - [146, 4.0]
  - - [42720, 6528, 1, 1024]
    - [165, 46117.0]
  - - [256, 19200, 1, 1024]
    - [145, 36116.0]
  - - [1024, 512, 1, 1024]
    - [169, 20841.0]
  - - [5632, 8976, 1, 256]
    - [155, 35429.0]
  - - [24, 24, 1, 64]
    - [164, 8.0]
  - - [256, 14848, 1, 1024]
    - [176, 37140.0]
  - - [3840, 8976, 1, 256]
    - [155, 35477.0]
  - - [27, 33, 1920, 64]
    - [172, 4122.0]
  - - [64, 960, 1, 1024]
    - [163, 3952.0]
  - - [4096, 3968, 1, 1024]
    - [145, 38849.0]
  - - [1024, 6528, 1, 4096]
    - [141, 36356.0]
  - - [1024, 1600, 1, 1024]
    - [145, 33934.0]
  - - [1024, 2048, 1, 4096]
    - [156, 27926.0]
  - - [30, 31, 2048, 64]
    - [172, 4031.0]
  - - [5376, 8976, 1, 256]
    - [165, 36410.0]
  - - [256, 5888, 1, 1024]
    - [137, 29322.0]
  - - [64, 128, 512, 128]
    - [160, 16249.0]
  - - [1024, 9216, 1, 1024]
    - [161, 42714.0]
  - - [1024, 8160, 1, 4096]
    - [168, 35897.0]
  - - [30, 31, 1, 64]
    - [164, 13.0]
  - - [2, 4, 1, 1024]
    - [151, 0.4]
  - - [32, 32, 1, 64]
    - [154, 13.0]
  - - [256, 7424, 1, 1024]
    - [139, 36637.0]
  - - [32, 35, 1, 64]
    - [169, 15.0]
  - - [8192, 8976, 1, 256]
    - [176, 25072.0]
  - - [128, 32768, 1, 256]
    - [155, 26473.0]
  - - [256, 2560, 1, 1024]
    - [162, 21077.0]
  - - [256, 21504, 1, 1024]
    - [145, 38048.0]
  - - [2048, 512, 1, 100]
    - [174, 8797.0]
  - - [6400, 8976, 1, 256]
    - [165, 36402.0]
  - - [31, 31, 1, 64]
    - [157, 13.0]
  - - [256, 8960, 1, 1024]
    - [156, 28258.0]
  - - [34, 34, 1, 64]
    - [152, 15.0]
  - - [5, 5, 960, 64]
    - [172, 114.0]
  - - [11776, 8976, 1, 256]
    - [165, 36441.0]
  - - [256, 20992, 1, 1024]
    - [145, 37671.0]
  - - [15, 15, 10880, 64]
    - [150, 1553.0]
  - - [256, 684, 1, 1024]
    - [171, 8621.0]
  - - [1024, 200, 1, 560]
    - [169, 7062.0]
  - - [256, 10496, 1, 1024]
    - [159, 30599.0]
  - - [21248, 8976, 1, 256]
    - [165, 37128.0]
  - - [15360, 8976, 1, 256]
    - [155, 35272.0]
  - - [4096, 10080, 1, 1024]
    - [145, 38469.0]
  - - [256, 8192, 1, 1024]
    - [177, 26317.0]
  - - [4096, 8976, 1, 256]
    - [176, 26397.0]
  - - [2048, 512, 1, 2048]
    - [161, 25688.0]
  - - [1024, 8064, 1, 4096]
    - [137, 36915.0]
  - - [18944, 8976, 1, 256]
    - [165, 36632.0]
  - - [8448, 8976, 1, 256]
    - [165, 36424.0]
  - - [256, 11776, 1, 1024]
    - [145, 32291.0]
  - - [31488, 8976, 1, 256]
    - [165, 37168.0]
  - - [1024, 4096, 1, 1024]
    - [175, 34548.0]
  - - [30, 30, 1, 64]
    - [150, 12.0]
  - - [64, 512, 1, 512]
    - [169, 1427.0]
  - - [4096, 3840, 1, 1024]
    - [145, 38709.0]
  - - [64, 512, 1, 1024]
    - [167, 1832.0]
  - - [12544, 8976, 1, 256]
    - [165, 36799.0]
  - - [1024, 3240, 1, 1024]
    - [161, 37515.0]
  - - [256, 23296, 1, 1024]
    - [145, 35276.0]
  - - [17, 15, 1, 64]
    - [175, 4.0]
  - - [35, 35, 1, 64]
    - [164, 17.0]
  - - [27, 27, 32768, 128]
    - [150, 6005.0]
  - - [256, 18944, 1, 1024]
    - [145, 36537.0]
  - - [1024, 3968, 1, 4096]
    - [159, 31516.0]
  - - [16128, 8976, 1, 256]
    - [165, 37110.0]
  - - [1024, 7104, 1, 1024]
    - [145, 41550.0]
  - - [512, 512, 64, 64]
    - [155, 18798.0]
  - - [1024, 7200, 1, 1024]
    - [161, 41665.0]
  - - [256, 2816, 1, 1024]
    - [159, 25075.0]
  - - [21, 17, 1, 64]
    - [150, 5.0]
  - - [1024, 10080, 1, 4096]
    - [141, 37797.0]
  - - [256, 6144, 1, 1024]
    - [137, 30878.0]
  - - [21, 21, 1, 64]
    - [146, 6.0]
  - - [9472, 8976, 1, 256]
    - [165, 36499.0]
  - - [2048, 215, 1, 768]
    - [169, 15541.0]
  - - [1024, 32768, 1, 1024]
    - [161, 43379.0]
  - - [1024, 4, 1, 1024]
    - [171, 209.0]
  - - [684, 8976, 1, 256]
    - [148, 27478.0]
  - - [3, 3, 512, 64]
    - [172, 28.0]
  - - [30528, 2048, 1, 1024]
    - [165, 44489.0]
  - - [256, 1536, 1, 1024]
    - [169, 16341.0]
  - - [2048, 684, 1, 768]
    - [145, 26525.0]
  - - [8960, 8976, 1, 256]
    - [165, 36598.0]
  - - [1024, 7104, 1, 4096]
    - [141, 38374.0]
  - - [256, 11520, 1, 1024]
    - [145, 32181.0]
  - - [33536, 8976, 1, 256]
    - [160, 36840.0]
  - - [1024, 3840, 1, 1024]
    - [166, 40460.0]
  - - [4096, 7104, 1, 1024]
    - [145, 38441.0]
  - - [5, 5, 512, 64]
    - [150, 84.0]
  - - [28672, 8976, 1, 256]
    - [149, 23120.0]
  - - [256, 1280, 1, 1024]
    - [167, 15477.0]
  - - [256, 7168, 1, 1024]
    - [139, 33602.0]
  - - [1024, 3840, 1, 4096]
    - [142, 43055.0]
  - - [256, 13312, 1, 1024]
    - [145, 34758.0]
  - - [2304, 8976, 1, 256]
    - [155, 35352.0]
  - - [2048, 512, 1, 67]
    - [157, 6554.0]
  - - [4096, 2048, 1, 1024]
    - [145, 36547.0]
  - - [15, 14, 1, 64]
    - [146, 3.0]
  - - [1024, 960, 1, 1600]
    - [173, 37882.0]
  - - [4096, 7200, 1, 1024]
    - [145, 38130.0]
  - - [1024, 7200, 1, 4096]
    - [141, 39908.0]
  - - [4096, 9520, 1, 1024]
    - [145, 38046.0]
  - - [42720, 10080, 1, 1024]
    - [160, 46043.0]
  - - [9984, 8976, 1, 256]
    - [160, 36742.0]
  - - [1024, 10200, 1, 1024]
    - [145, 40415.0]
  - - [256, 14592, 1, 1024]
    - [176, 37268.0]
  - - [11264, 8976, 1, 256]
    - [155, 35098.0]
  - - [1024, 32768, 1, 480]
    - [155, 42269.0]
  - - [2048, 114, 1, 512]
    - [169, 7782.0]
  - - [256, 7936, 1, 1024]
    - [143, 25773.0]
  - - [2048, 256, 1, 768]
    - [169, 19738.0]
  - - [15104, 8976, 1, 256]
    - [165, 36897.0]
  - - [4096, 4096, 1, 1024]
    - [145, 38280.0]
  - - [2048, 512, 1, 74]
    - [172, 7293.0]
  - - [14, 14, 10880, 64]
    - [150, 1356.0]
  - - [42720, 7104, 1, 1024]
    - [155, 45888.0]
  - - [256, 23552, 1, 1024]
    - [145, 35746.0]
  - - [1024, 1600, 1, 560]
    - [158, 26859.0]
  - - [2048, 1536, 1, 512]
    - [145, 30504.0]
  - - [14, 14, 1, 64]
    - [144, 2.0]
  - - [1024, 8064, 1, 1024]
    - [161, 38745.0]
  - - [13824, 8976, 1, 256]
    - [165, 36448.0]
  - - [1024, 9520, 1, 1024]
    - [170, 39943.0]
  - - [4096, 10064, 1, 1024]
    - [145, 38382.0]
  - - [256, 6656, 1, 1024]
    - [137, 33298.0]
  - - [2048, 215, 1, 512]
    - [169, 13882.0]
  - - [2560, 8976, 1, 256]
    - [155, 35626.0]
  - - [4096, 10200, 1, 1024]
    - [145, 38404.0]
  - - [17, 17, 7680, 64]
    - [150, 1922.0]
  - - [1024, 960, 1, 1024]
    - [156, 33026.0]
  - - [32, 1600, 1, 512]
    - [169, 1894.0]
  - - [13568, 8976, 1, 256]
    - [165, 37066.0]
  - - [4096, 8064, 1, 1024]
    - [145, 38296.0]
  - - [4608, 8976, 1, 256]
    - [165, 35475.0]
  - - [256, 22016, 1, 1024]
    - [139, 37148.0]
  - - [42720, 3968, 1, 1024]
    - [165, 45830.0]
  - - [2048, 960, 1, 74]
    - [170, 9622.0]
  - - [4864, 8976, 1, 256]
    - [165, 36185.0]
  - - [256, 21248, 1, 1024]
    - [145, 38109.0]
  - - [1024, 6528, 1, 1024]
    - [170, 38893.0]
  - - [23552, 8976, 1, 256]
    - [155, 35418.0]
  - - [256, 12544, 1, 1024]
    - [145, 33831.0]
  - - [42720, 7200, 1, 1024]
    - [165, 45558.0]
  - - [9, 9, 512, 64]
    - [164, 274.0]
  - - [256, 33536, 1, 1024]
    - [145, 39615.0]
  - - [1792, 8976, 1, 256]
    - [173, 34499.0]
  - - [4096, 8160, 1, 1024]
    - [145, 38222.0]
  - - [4096, 9216, 1, 1024]
    - [145, 38537.0]
  - - [19968, 8976, 1, 256]
    - [165, 36613.0]
  - - [33, 33, 1600, 32]
    - [172, 2387.0]
  - - [5888, 8976, 1, 256]
    - [165, 36230.0]
  - - [256, 2304, 1, 1024]
    - [156, 20628.0]
  - - [33, 33, 1920, 64]
    - [150, 4278.0]
  - - [7168, 8976, 1, 256]
    - [155, 35104.0]
  - - [1024, 32, 1, 1024]
    - [167, 1777.0]
  - - [2, 2048, 1, 1024]
    - [171, 252.0]
  - - [4096, 3960, 1, 1024]
    - [145, 37081.0]
  - - [512, 32768, 1, 13]
    - [153, 4957.0]
  - - [19712, 8976, 1, 256]
    - [165, 36999.0]
  - - [1024, 2048, 1, 1024]
    - [169, 30297.0]
  - - [64, 512, 64, 512]
    - [160, 23713.0]
  - - [2048, 8976, 1, 256]
    - [170, 31575.0]
  - - [256, 3584, 1, 1024]
    - [143, 26156.0]
  - - [18688, 8976, 1, 256]
    - [165, 37261.0]
  - - [512, 512, 1, 64]
    - [157, 2796.0]
  - - [256, 5376, 1, 1024]
    - [137, 27227.0]
  - - [30, 30, 2048, 64]
    - [150, 3964.0]
  - - [6144, 8976, 1, 256]
    - [155, 31935.0]
  - - [30528, 4096, 1, 1024]
    - [165, 45698.0]
  - - [256, 11264, 1, 1024]
    - [145, 32068.0]
  - - [4096, 3240, 1, 1024]
    - [145, 37715.0]
  - - [4352, 8976, 1, 256]
    - [160, 36066.0]
  - - [15, 15, 1, 64]
    - [146, 3.0]
  - - [256, 15104, 1, 1024]
    - [176, 38546.0]
  - - [256, 31488, 1, 1024]
    - [145, 37657.0]
  - - [1024, 3968, 1, 1024]
    - [169, 34882.0]
  - - [9728, 8976, 1, 256]
    - [160, 36354.0]
  - - [256, 9984, 1, 1024]
    - [156, 30604.0]
  - - [7936, 8976, 1, 256]
    - [165, 36665.0]
  - - [2048, 960, 1, 2048]
    - [170, 34216.0]
  - - [5120, 8976, 1, 256]
    - [155, 34767.0]
  - - [27, 27, 1920, 64]
    - [172, 3555.0]
  - - [4096, 6528, 1, 1024]
    - [145, 38460.0]
  - - [13312, 8976, 1, 256]
    - [155, 35335.0]
  - - [1024, 10080, 1, 1024]
    - [145, 39759.0]
  - - [256, 14336, 1, 1024]
    - [145, 36219.0]
  - - [1280, 8976, 1, 256]
    - [155, 32565.0]
  - - [256, 22344, 1, 1024]
    - [145, 36444.0]
  - - [256, 18176, 1, 1024]
    - [145, 35664.0]
  - - [1024, 9520, 1, 4096]
    - [137, 37778.0]
  - - [512, 32768, 1, 1024]
    - [161, 42132.0]
  - - [128, 128, 512, 64]
    - [147, 14946.0]
  - - [20992, 8976, 1, 256]
    - [165, 36723.0]
  - - [42720, 3960, 1, 1024]
    - [165, 45361.0]
  - - [1024, 10064, 1, 1024]
    - [145, 39804.0]
  - - [2048, 684, 1, 512]
    - [166, 23226.0]
  - - [31, 31, 2048, 64]
    - [150, 3956.0]
  - - [17152, 8976, 1, 256]
    - [165, 37106.0]
  - - [256, 3328, 1, 1024]
    - [159, 28698.0]
  - - [34, 24, 1, 64]
    - [138, 11.0]
  - - [20480, 8976, 1, 256]
    - [149, 23039.0]
  - - [2048, 256, 1, 512]
    - [169, 17568.0]
  - - [2048, 1536, 1, 768]
    - [145, 33554.0]
  - - [10496, 8976, 1, 256]
    - [160, 36761.0]
  - - [3328, 8976, 1, 256]
    - [155, 35788.0]
  - - [1024, 3240, 1, 4096]
    - [136, 34498.0]
  - - [256, 4864, 1, 1024]
    - [139, 24483.0]
  - - [1024, 9216, 1, 4096]
    - [168, 37427.0]
  - - [15872, 8976, 1, 256]
    - [165, 36457.0]
  - - [15, 14, 10880, 64]
    - [150, 1448.0]
  - - [1024, 8160, 1, 1024]
    - [170, 38710.0]
  - - [256, 32768, 1, 512]
    - [145, 34794.0]
  - - [15, 15, 7680, 64]
    - [150, 1511.0]
  - - [18176, 8976, 1, 256]
    - [160, 37103.0]
  - - [1024, 512, 1, 1600]
    - [169, 22405.0]
  - - [256, 6400, 1, 1024]
    - [139, 31969.0]
  - - [3072, 8976, 1, 256]
    - [155, 35239.0]
  - - [256, 20480, 1, 1024]
    - [145, 37221.0]
  - - [44505, 8976, 1, 256]
    - [165, 35732.0]
  - - [2048, 114, 1, 768]
    - [171, 10776.0]
  - - [256, 16128, 1, 1024]
    - [145, 32663.0]
  - - [256, 4608, 1, 1024]
    - [145, 23892.0]
  - - [1024, 4, 1, 1024]
    - [171, 252.0]
  - - [1024, 4096, 1, 4096]
    - [156, 31544.0]
  - - [256, 8448, 1, 1024]
    - [140, 27220.0]
  - - [1024, 3960, 1, 4096]
    - [159, 31343.0]
  - - [42720, 9520, 1, 1024]
    - [160, 45905.0]
  - - [1024, 10064, 1, 4096]
    - [141, 38069.0]
  - - [2816, 8976, 1, 256]
    - [155, 35853.0]
  - - [1024, 3960, 1, 1024]
    - [175, 34442.0]
- null
