library/src/blas3/Tensile/Logic/asm_full/arcturus_Cijk_Ailk_Bjlk_HBH.yaml
- {MinimumRequiredVersion: 4.6.0}
- arcturus
- gfx908
- [Device 7380, Device 7388, Device 738c, Device 7390]
    SolutionIndex: 0
    SolutionNameMin: Cijk_Ailk_Bjlk_HBH_MT016x016x08_PGR1_PLR1_TT02_02
    SolutionIndex: 1
    SolutionNameMin: Cijk_Ailk_Bjlk_HBH_MT016x016x16_PGR1_PLR1_TT02_02
    SolutionIndex: 2
    SolutionNameMin: Cijk_Ailk_Bjlk_HBH_MT032x016x16_PGR1_PLR1_TT04_02
    SolutionIndex: 3
    SolutionNameMin: Cijk_Ailk_Bjlk_HBH_MT016x016x24_PGR1_PLR1_TT02_02
    SolutionIndex: 4
    SolutionNameMin: Cijk_Ailk_Bjlk_HBH_MT032x016x24_PGR1_PLR1_TT04_02
    SolutionIndex: 5
    SolutionNameMin: Cijk_Ailk_Bjlk_HBH_MT016x016x32_PGR1_PLR1_TT02_02
    SolutionIndex: 6
    SolutionNameMin: Cijk_Ailk_Bjlk_HBH_MT032x016x32_PGR1_PLR1_TT02_02
    SolutionIndex: 7
    SolutionNameMin: Cijk_Ailk_Bjlk_HBH_MT064x016x32_PGR1_PLR1_TT02_02
    SolutionIndex: 8
    SolutionNameMin: Cijk_Ailk_Bjlk_HBH_MT016x016x32_PGR1_PLR1_TT02_02
    SolutionIndex: 9
    SolutionNameMin: Cijk_Ailk_Bjlk_HBH_MT064x016x32_PGR1_PLR1_TT02_02
    SolutionIndex: 10
    SolutionNameMin: Cijk_Ailk_Bjlk_HBH_MT016x016x64_PGR1_PLR1_TT02_02
    SolutionIndex: 11
    SolutionNameMin: Cijk_Ailk_Bjlk_HBH_MT032x016x64_PGR1_PLR1_TT02_02
    SolutionIndex: 12
    SolutionNameMin: Cijk_Ailk_Bjlk_HBH_MT064x016x64_PGR1_PLR1_TT02_02
    SolutionIndex: 13
    SolutionNameMin: Cijk_Ailk_Bjlk_HBH_MT016x016x64_PGR1_PLR1_TT02_02
    SolutionIndex: 14
    SolutionNameMin: Cijk_Ailk_Bjlk_HBH_MT032x016x64_PGR1_PLR1_TT02_02
    SolutionIndex: 15
    SolutionNameMin: Cijk_Ailk_Bjlk_HBH_MT032x032x08_PGR1_PLR1_TT02_02
    SolutionIndex: 16
    SolutionNameMin: Cijk_Ailk_Bjlk_HBH_MT032x032x16_PGR1_PLR1_TT02_02
    SolutionIndex: 17
    SolutionNameMin: Cijk_Ailk_Bjlk_HBH_MT032x032x32_PGR1_PLR1_TT02_02
    SolutionIndex: 18
    SolutionNameMin: Cijk_Ailk_Bjlk_HBH_MT032x032x64_PGR1_PLR1_TT02_02
    SolutionIndex: 19
    SolutionNameMin: Cijk_Ailk_Bjlk_HBH_MT064x064x04_PGR0_PLR1_TT04_04
    SolutionIndex: 20
    SolutionNameMin: Cijk_Ailk_Bjlk_HBH_MT064x064x04_PGR1_PLR1_TT04_04
    SolutionIndex: 21
    SolutionNameMin: Cijk_Ailk_Bjlk_HBH_MT064x064x08_PGR0_PLR1_TT04_04
    SolutionIndex: 22
    SolutionNameMin: Cijk_Ailk_Bjlk_HBH_MT064x064x16_PGR1_PLR1_TT04_04
    SolutionIndex: 23
    SolutionNameMin: Cijk_Ailk_Bjlk_HBH_MT064x064x08_PGR1_PLR1_TT08_08
    SolutionIndex: 24
    SolutionNameMin: Cijk_Ailk_Bjlk_HBH_MT064x032x16_PGR1_PLR1_TT04_04
    SolutionIndex: 25
    SolutionNameMin: Cijk_Ailk_Bjlk_HBH_MT064x032x16_PGR1_PLR1_TT04_04
    SolutionIndex: 26
    SolutionNameMin: Cijk_Ailk_Bjlk_HBH_MT064x032x32_PGR1_PLR1_TT04_04
    SolutionIndex: 27
    SolutionNameMin: Cijk_Ailk_Bjlk_HBH_MT128x032x32_PGR1_PLR1_TT04_04
    SolutionIndex: 28
    SolutionNameMin: Cijk_Ailk_Bjlk_HBH_MT128x016x32_PGR1_PLR1_TT04_04
    SolutionIndex: 29
    SolutionNameMin: Cijk_Ailk_Bjlk_HBH_MT064x032x32_PGR1_PLR1_TT04_04
    SolutionIndex: 30
    SolutionNameMin: Cijk_Ailk_Bjlk_HBH_MT128x016x32_PGR1_PLR1_TT04_04
    SolutionIndex: 31
    SolutionNameMin: Cijk_Ailk_Bjlk_HBH_MT032x032x64_PGR1_PLR1_TT04_04
    SolutionIndex: 32
    SolutionNameMin: Cijk_Ailk_Bjlk_HBH_MT064x064x08_PGR1_PLR1_TT08_08
    SolutionIndex: 33
    SolutionNameMin: Cijk_Ailk_Bjlk_HBH_MT064x064x16_PGR1_PLR1_TT08_08
    SolutionIndex: 34
    SolutionNameMin: Cijk_Ailk_Bjlk_HBH_MT064x064x16_PGR1_PLR1_TT04_04
    SolutionIndex: 35
    SolutionNameMin: Cijk_Ailk_Bjlk_HBH_MT064x128x16_PGR1_PLR1_TT04_08
    SolutionIndex: 36
    SolutionNameMin: Cijk_Ailk_Bjlk_HBH_MT128x128x16_PGR1_PLR1_TT08_08
    SolutionIndex: 37
    SolutionNameMin: Cijk_Ailk_Bjlk_HBH_MT064x128x32_PGR1_PLR1_TT04_08
    SolutionIndex: 38
    SolutionNameMin: Cijk_Ailk_Bjlk_HBH_MT128x128x32_PGR1_PLR1_TT08_08
    SolutionIndex: 39
    SolutionNameMin: Cijk_Ailk_Bjlk_HBH_MT064x064x32_PGR1_PLR1_TT04_04
    SolutionIndex: 40
    SolutionNameMin: Cijk_Ailk_Bjlk_HBH_MT064x128x04_PGR0_PLR0_TT04_08
    SolutionIndex: 41
    SolutionNameMin: Cijk_Ailk_Bjlk_HBH_MT128x128x04_PGR1_PLR1_TT08_08
    SolutionIndex: 42
    SolutionNameMin: Cijk_Ailk_Bjlk_HBH_MT064x064x08_PGR0_PLR0_TT04_04
    SolutionIndex: 43
    SolutionNameMin: Cijk_Ailk_Bjlk_HBH_MT064x064x08_PGR1_PLR0_TT04_04
    SolutionIndex: 44
    SolutionNameMin: Cijk_Ailk_Bjlk_HBH_MT064x064x08_PGR0_PLR1_TT04_04
    SolutionIndex: 45
    SolutionNameMin: Cijk_Ailk_Bjlk_HBH_MT064x064x08_PGR1_PLR1_TT04_04
    SolutionIndex: 46
    SolutionNameMin: Cijk_Ailk_Bjlk_HBH_MT064x064x16_PGR0_PLR0_TT04_04
    SolutionIndex: 47
    SolutionNameMin: Cijk_Ailk_Bjlk_HBH_MT064x128x16_PGR0_PLR1_TT04_08
    SolutionIndex: 48
    SolutionNameMin: Cijk_Ailk_Bjlk_HBH_MT064x128x16_PGR1_PLR1_TT04_08
    SolutionIndex: 49
    SolutionNameMin: Cijk_Ailk_Bjlk_HBH_MT128x128x04_PGR0_PLR0_TT08_08
    SolutionIndex: 50
    SolutionNameMin: Cijk_Ailk_Bjlk_HBH_MT064x064x04_PGR0_PLR0_TT04_04
    SolutionIndex: 51
    SolutionNameMin: Cijk_Ailk_Bjlk_HBH_MT064x128x04_PGR1_PLR0_TT04_08
    SolutionIndex: 52
    SolutionNameMin: Cijk_Ailk_Bjlk_HBH_MT128x128x04_PGR0_PLR1_TT08_08
    SolutionIndex: 53
    SolutionNameMin: Cijk_Ailk_Bjlk_HBH_MT064x064x04_PGR0_PLR1_TT04_04
    SolutionIndex: 54
    SolutionNameMin: Cijk_Ailk_Bjlk_HBH_MT064x128x04_PGR1_PLR1_TT04_08
    SolutionIndex: 55
    SolutionNameMin: Cijk_Ailk_Bjlk_HBH_MT064x128x08_PGR0_PLR0_TT04_08
    SolutionIndex: 56
    SolutionNameMin: Cijk_Ailk_Bjlk_HBH_MT064x064x08_PGR1_PLR0_TT04_04
    SolutionIndex: 57
    SolutionNameMin: Cijk_Ailk_Bjlk_HBH_MT064x128x08_PGR0_PLR1_TT04_08
    SolutionIndex: 58
    SolutionNameMin: Cijk_Ailk_Bjlk_HBH_MT064x128x08_PGR1_PLR1_TT04_08
    SolutionIndex: 59
    SolutionNameMin: Cijk_Ailk_Bjlk_HBH_MT064x064x16_PGR0_PLR0_TT04_04
    SolutionIndex: 60
    SolutionNameMin: Cijk_Ailk_Bjlk_HBH_MT064x128x16_PGR0_PLR1_TT04_08
    SolutionIndex: 61
    SolutionNameMin: Cijk_Ailk_Bjlk_HBH_MT064x064x16_PGR1_PLR1_TT04_04
    SolutionIndex: 62
    SolutionNameMin: Cijk_Ailk_Bjlk_HBH_MT064x128x16_EPS1_GRVW04_PGR1_PLR1_SNLL1_TT08_04_VW04_WG08_32_01_WGM01
    SolutionIndex: 63
    SolutionNameMin: Cijk_Ailk_Bjlk_HBH_MT128x128x16_EPS1_GRVW04_PGR1_PLR1_SNLL1_TT08_08_VW04_WG16_16_01_WGM01
    SolutionIndex: 64
    SolutionNameMin: Cijk_Ailk_Bjlk_HBH_MT064x128x16_EPS1_GRVW04_PGR1_PLR1_SNLL1_TT08_04_VW04_WG08_32_01_WGM08
    SolutionIndex: 65
    SolutionNameMin: Cijk_Ailk_Bjlk_HBH_MT128x064x16_EPS1_GRVW04_PGR1_PLR1_SNLL1_TT08_04_VW04_WG16_16_01_WGM08
    SolutionIndex: 66
    SolutionNameMin: Cijk_Ailk_Bjlk_HBH_MT128x128x16_EPS1_GRVW04_PGR1_PLR1_SNLL1_TT08_08_VW04_WG16_16_01_WGM08
    SolutionIndex: 67
    SolutionNameMin: Cijk_Ailk_Bjlk_HBH_MT064x064x32_EPS0_GRVW04_PGR0_PLR0_SNLL0_TT04_04_VW04_WG16_16_01_WGM01
    SolutionIndex: 68
    SolutionNameMin: Cijk_Ailk_Bjlk_HBH_MT128x064x16_EPS1_GRVW08_PGR1_PLR1_SNLL1_TT08_08_VW08_WG16_08_01_WGM64
    SolutionIndex: 69
    SolutionNameMin: Cijk_Ailk_Bjlk_HBH_MT128x128x32_EPS1_GRVW08_PGR1_PLR1_SNLL1_TT08_08_VW08_WG16_16_01_WGM64
    SolutionIndex: 70
    SolutionNameMin: Cijk_Ailk_Bjlk_HBH_MT64x128x16_MI32x32x4x2_SE_AF0EM1_ASEM2_ONLL0_SNLL1
    SolutionIndex: 71
    SolutionNameMin: Cijk_Ailk_Bjlk_HBH_MT64x128x16_MI32x32x4x2_SE_AF0EM2_ASEM2_ONLL0_SNLL1
    SolutionIndex: 72
    SolutionNameMin: Cijk_Ailk_Bjlk_HBH_MT64x128x8_MI32x32x4x2_SE_AF0EM1_ASEM1_ONLL0_SNLL0
    SolutionIndex: 73
    SolutionNameMin: Cijk_Ailk_Bjlk_HBH_MT32x256x16_MI32x32x4x2_SE_AF0EM2_ASEM2_ONLL0_SNLL0
    SolutionIndex: 74
    SolutionNameMin: Cijk_Ailk_Bjlk_HBH_MT64x128x16_MI32x32x4x2_SE_AF0EM1_ASEM2_ONLL0_SNLL0
    SolutionIndex: 75
    SolutionNameMin: Cijk_Ailk_Bjlk_HBH_MT64x128x16_MI32x32x4x2_SE_AF0EM2_ASEM2_ONLL0_SNLL0
    SolutionIndex: 76
    SolutionNameMin: Cijk_Ailk_Bjlk_HBH_MT64x128x32_MI32x32x4x2_SE_AF0EM2_ASEM2_ONLL0_SNLL0
    SolutionIndex: 77
    SolutionNameMin: Cijk_Ailk_Bjlk_HBH_MT64x128x16_MI32x32x4x2_SE_AF0EM1_ASEM2_ONLL1_SNLL1
    SolutionIndex: 78
    SolutionNameMin: Cijk_Ailk_Bjlk_HBH_MT64x128x16_MI32x32x4x2_SE_AF0EM2_ASEM2_ONLL1_SNLL1
    SolutionIndex: 79
    SolutionNameMin: Cijk_Ailk_Bjlk_HBH_MT64x128x8_MI32x32x4x2_SE_AF0EM1_ASEM1_ONLL1_SNLL0
    SolutionIndex: 80
    SolutionNameMin: Cijk_Ailk_Bjlk_HBH_MT64x128x16_MI32x32x4x2_SE_AF0EM1_ASEM1_ONLL1_SNLL0
    SolutionIndex: 81
    SolutionNameMin: Cijk_Ailk_Bjlk_HBH_MT64x128x16_MI32x32x4x2_SE_AF0EM2_ASEM2_ONLL1_SNLL0
    SolutionIndex: 82
    SolutionNameMin: Cijk_Ailk_Bjlk_HBH_MT64x128x32_MI32x32x4x2_SE_AF0EM2_ASEM2_ONLL1_SNLL0
    SolutionIndex: 83
    SolutionNameMin: Cijk_Ailk_Bjlk_HBH_MT64x256x16_MI32x32x4x2_SE_AF0EM1_ASEM2_ONLL0_SNLL1
    SolutionIndex: 84
    SolutionNameMin: Cijk_Ailk_Bjlk_HBH_MT64x256x16_MI32x32x4x2_SE_AF0EM2_ASEM2_ONLL0_SNLL1
    SolutionIndex: 85
    SolutionNameMin: Cijk_Ailk_Bjlk_HBH_MT64x256x16_MI32x32x4x2_SE_AF0EM1_ASEM1_ONLL0_SNLL0
    SolutionIndex: 86
    SolutionIndex: 87
    SolutionIndex: 88
    SolutionIndex: 89
    SolutionIndex: 90
    SolutionIndex: 91
    SolutionIndex: 92
    SolutionIndex: 93
    SolutionIndex: 94
    SolutionIndex: 95
    SolutionIndex: 96
    SolutionIndex: 97
    SolutionIndex: 98
    SolutionIndex: 99
    SolutionIndex: 100
    SolutionIndex: 101
    SolutionIndex: 102
    SolutionIndex: 103
    SolutionIndex: 104
    SolutionIndex: 105
    SolutionIndex: 106
    SolutionIndex: 107
    SolutionIndex: 108
    SolutionIndex: 109
    SolutionIndex: 110
    SolutionIndex: 111
    SolutionIndex: 112
    SolutionIndex: 113
    SolutionIndex: 114
    SolutionIndex: 115
    SolutionIndex: 116
    SolutionIndex: 117
    SolutionIndex: 118
    SolutionIndex: 119
    SolutionIndex: 120
    SolutionIndex: 121
    SolutionIndex: 122
    SolutionIndex: 123
    SolutionIndex: 124
    SolutionIndex: 125
    SolutionIndex: 126
    SolutionIndex: 127
    SolutionIndex: 128
    SolutionIndex: 129
    SolutionIndex: 130
    SolutionIndex: 131
    SolutionIndex: 132
    SolutionIndex: 133
    SolutionIndex: 134
    SolutionIndex: 135
    SolutionIndex: 136
    SolutionIndex: 137
    SolutionIndex: 138
    SolutionIndex: 139
    SolutionIndex: 140
    SolutionIndex: 141
    SolutionIndex: 142
    SolutionIndex: 143
    SolutionIndex: 144
    SolutionIndex: 145
    SolutionIndex: 146
    SolutionIndex: 147
    SolutionIndex: 148
    SolutionIndex: 149
    SolutionIndex: 150
    SolutionIndex: 151
    SolutionIndex: 152
    SolutionIndex: 153
    SolutionIndex: 154
    SolutionIndex: 155
    SolutionIndex: 156
    SolutionIndex: 157
    SolutionIndex: 158
    SolutionIndex: 159
    SolutionIndex: 160
    SolutionIndex: 161
    SolutionIndex: 162
    SolutionIndex: 163
    SolutionIndex: 164
    SolutionIndex: 165
    SolutionIndex: 166
    SolutionIndex: 167
    SolutionIndex: 168
    SolutionIndex: 169
    SolutionIndex: 170
    SolutionIndex: 171
    SolutionIndex: 172
    SolutionIndex: 173
    SolutionIndex: 174
    SolutionIndex: 175
    SolutionIndex: 176
    SolutionIndex: 177
    SolutionIndex: 178
    SolutionIndex: 179
    SolutionIndex: 180
    SolutionIndex: 181
    SolutionIndex: 182
    SolutionIndex: 183
    SolutionIndex: 184
    SolutionIndex: 185
    SolutionIndex: 186
    SolutionIndex: 187
    SolutionIndex: 188
    SolutionIndex: 189
    SolutionIndex: 190
    SolutionIndex: 191
    SolutionIndex: 192
    SolutionIndex: 193
    SolutionIndex: 194
    SolutionIndex: 195
    SolutionIndex: 196
    SolutionIndex: 197
    SolutionIndex: 198
    SolutionIndex: 199
    SolutionIndex: 200
    SolutionIndex: 201
    SolutionIndex: 202
    SolutionIndex: 203
    SolutionIndex: 204
    SolutionIndex: 205
    SolutionIndex: 206
    SolutionIndex: 207
    SolutionIndex: 208
    SolutionIndex: 209
    SolutionIndex: 210
    SolutionIndex: 211
    SolutionIndex: 212
    SolutionIndex: 213
    SolutionIndex: 214
    SolutionIndex: 215
    SolutionIndex: 216
    SolutionIndex: 217
    SolutionIndex: 218
    SolutionIndex: 219
    SolutionIndex: 220
    SolutionIndex: 221
    SolutionIndex: 222
    SolutionIndex: 223
    SolutionIndex: 224
    SolutionIndex: 225
    SolutionIndex: 226
    SolutionIndex: 227
    SolutionIndex: 228
    SolutionIndex: 229
    SolutionIndex: 230
    SolutionIndex: 231
    SolutionIndex: 232
    SolutionIndex: 233
    SolutionIndex: 234
    SolutionIndex: 235
    SolutionIndex: 236
    SolutionIndex: 237
    SolutionIndex: 238
    SolutionIndex: 239
    SolutionIndex: 240
    SolutionIndex: 241
    SolutionIndex: 242
    SolutionIndex: 243
    SolutionIndex: 244
    SolutionIndex: 245
    SolutionIndex: 246
    SolutionIndex: 247
    SolutionIndex: 248
    SolutionIndex: 249
    SolutionIndex: 250
    SolutionIndex: 251
    SolutionIndex: 252
    SolutionIndex: 253
    SolutionIndex: 254
    SolutionIndex: 255
    SolutionIndex: 256
    SolutionIndex: 257
    SolutionIndex: 258
    SolutionIndex: 259
    SolutionIndex: 260
    SolutionIndex: 261
    SolutionIndex: 262
    SolutionIndex: 263
    SolutionIndex: 264
    SolutionIndex: 265
    SolutionIndex: 266
    SolutionIndex: 267
    SolutionIndex: 268
    SolutionIndex: 269
    SolutionIndex: 270
    SolutionIndex: 271
    SolutionIndex: 272
    SolutionIndex: 273
    SolutionIndex: 274
    SolutionIndex: 275
    SolutionIndex: 276
    SolutionIndex: 277
    SolutionIndex: 278
    SolutionIndex: 279
    SolutionIndex: 280
    SolutionIndex: 281
    SolutionIndex: 282
    SolutionIndex: 283
    SolutionIndex: 284
    SolutionIndex: 285
    SolutionIndex: 286
    SolutionIndex: 287
    SolutionIndex: 288
    SolutionIndex: 289
    SolutionIndex: 290
    SolutionIndex: 291
    SolutionIndex: 292
    SolutionIndex: 293
    SolutionIndex: 294
    SolutionIndex: 295
    SolutionIndex: 296
    SolutionIndex: 297
    SolutionIndex: 298
    SolutionIndex: 299
    SolutionIndex: 300
    SolutionIndex: 301
    SolutionIndex: 302
    SolutionIndex: 303
    SolutionIndex: 304
    SolutionIndex: 305
    SolutionIndex: 306
    SolutionIndex: 307
    SolutionIndex: 308
    SolutionIndex: 309
    SolutionIndex: 310
    SolutionIndex: 311
    SolutionIndex: 312
    SolutionIndex: 313
    SolutionIndex: 314
    SolutionIndex: 315
    SolutionIndex: 316
    SolutionIndex: 317
    SolutionIndex: 318
    SolutionIndex: 319
    SolutionIndex: 320
    SolutionIndex: 321
    SolutionIndex: 322
    SolutionIndex: 323
    SolutionIndex: 324
    SolutionIndex: 325
    SolutionIndex: 326
    SolutionIndex: 327
    SolutionIndex: 328
    SolutionIndex: 329
    SolutionIndex: 330
    SolutionIndex: 331
    SolutionIndex: 332
    SolutionIndex: 333
    SolutionIndex: 334
    SolutionIndex: 335
    SolutionIndex: 336
    SolutionIndex: 337
    SolutionIndex: 338
    SolutionIndex: 339
    SolutionIndex: 340
    SolutionIndex: 341
    SolutionIndex: 342
    SolutionIndex: 343
    SolutionIndex: 344
    SolutionIndex: 345
    SolutionIndex: 346
    SolutionIndex: 347
    SolutionIndex: 348
    SolutionIndex: 349
    SolutionIndex: 350
    SolutionIndex: 351
    SolutionIndex: 352
    SolutionIndex: 353
    SolutionIndex: 354
    SolutionIndex: 355
    SolutionIndex: 356
    SolutionIndex: 357
    SolutionIndex: 358
    SolutionIndex: 359
    SolutionIndex: 360
    SolutionIndex: 361
    SolutionIndex: 362
    SolutionIndex: 363
    SolutionIndex: 364
    SolutionIndex: 365
    SolutionIndex: 366
    SolutionIndex: 367
    SolutionIndex: 368
    SolutionIndex: 369
    SolutionIndex: 370
    SolutionIndex: 371
    SolutionIndex: 372
    SolutionIndex: 373
    SolutionIndex: 374
    SolutionIndex: 375
    SolutionIndex: 376
    SolutionIndex: 377
    SolutionIndex: 378
    SolutionIndex: 379
    SolutionIndex: 380
    SolutionIndex: 381
    SolutionIndex: 382
    SolutionIndex: 383
    SolutionIndex: 384
    SolutionIndex: 385
    SolutionIndex: 386
    SolutionIndex: 387
    SolutionIndex: 388
    SolutionIndex: 389
    SolutionIndex: 390
    SolutionIndex: 391
    SolutionIndex: 392
    SolutionIndex: 393
    SolutionIndex: 394
    SolutionIndex: 395
    SolutionIndex: 396
    SolutionIndex: 397
    SolutionIndex: 398
    SolutionIndex: 399
    SolutionIndex: 400
    SolutionIndex: 401
    SolutionIndex: 402
    SolutionIndex: 403
    SolutionIndex: 404
    SolutionIndex: 405
    SolutionIndex: 406
    SolutionIndex: 407
    SolutionIndex: 408
    SolutionIndex: 409
    SolutionIndex: 410
    SolutionIndex: 411
    SolutionIndex: 412
    SolutionIndex: 413
    SolutionIndex: 414
    SolutionIndex: 415
    SolutionIndex: 416
- - - [64, 448, 1, 3328]
    - [10, 1.084]
  - - [1, 64, 1, 256]
    - [20, 0.0]
  - - [3584, 64, 1, 1280]
    - [17, 4.354]
  - - [64, 128, 1, 256]
    - [1, 0.158]
  - - [64, 5888, 1, 1280]
    - [17, 5.261]
  - - [64, 4288, 1, 1280]
    - [18, 4.395]
  - - [3584, 64, 1, 3328]
    - [17, 4.663]
  - - [64, 1024, 1, 3328]
    - [18, 2.468]
  - - [1, 64, 1, 1280]
    - [22, 0.001]
  - - [704, 64, 1, 3328]
    - [10, 1.617]
  - - [64, 448, 1, 1280]
    - [6, 0.993]
  - - [64, 704, 1, 3328]
    - [11, 1.645]
  - - [64, 64, 1, 1280]
    - [9, 0.136]
  - - [64, 5056, 1, 256]
    - [0, 3.674]
  - - [64, 4288, 1, 3328]
    - [17, 4.673]
  - - [1856, 64, 1, 3328]
    - [18, 4.101]
  - - [1, 64, 1, 1]
    - [19, 0.0]
  - - [448, 64, 1, 1280]
    - [5, 0.993]
  - - [5888, 64, 1, 1280]
    - [17, 5.218]
  - - [2944, 64, 1, 256]
    - [1, 2.931]
  - - [64, 1856, 1, 256]
    - [12, 2.453]
  - - [64, 1024, 1, 1280]
    - [18, 2.295]
  - - [64, 256, 1, 1280]
    - [10, 0.582]
  - - [704, 64, 1, 1280]
    - [3, 1.405]
  - - [64, 128, 1, 1280]
    - [5, 0.264]
  - - [2368, 64, 1, 256]
    - [5, 2.593]
  - - [2368, 64, 1, 3328]
    - [18, 3.966]
  - - [64, 1408, 1, 3328]
    - [11, 3.118]
  - - [1856, 64, 1, 1280]
    - [18, 3.63]
  - - [64, 3584, 1, 1280]
    - [4, 4.504]
  - - [448, 64, 1, 3328]
    - [10, 1.085]
  - - [5888, 64, 1, 3328]
    - [17, 5.505]
  - - [128, 64, 1, 256]
    - [16, 0.158]
  - - [64, 128, 1, 3328]
    - [6, 0.295]
  - - [64, 256, 1, 3328]
    - [13, 0.619]
  - - [4288, 64, 1, 3328]
    - [17, 4.645]
  - - [64, 2944, 1, 256]
    - [16, 3.113]
  - - [6784, 64, 1, 256]
    - [17, 4.464]
  - - [1024, 64, 1, 1280]
    - [18, 2.336]
  - - [64, 2368, 1, 1280]
    - [6, 3.751]
  - - [64, 3584, 1, 3328]
    - [17, 4.657]
  - - [64, 6784, 1, 3328]
    - [17, 5.581]
  - - [3584, 64, 1, 256]
    - [17, 3.271]
  - - [64, 1856, 1, 3328]
    - [18, 4.079]
  - - [448, 64, 1, 256]
    - [5, 0.63]
  - - [64, 5056, 1, 3328]
    - [17, 5.401]
  - - [256, 64, 1, 256]
    - [1, 0.381]
  - - [4288, 64, 1, 1280]
    - [17, 4.516]
  - - [1, 1, 1, 1]
    - [21, 0.0]
  - - [5056, 64, 1, 1280]
    - [18, 5.161]
  - - [1024, 64, 1, 3328]
    - [17, 2.43]
  - - [1408, 64, 1, 256]
    - [16, 1.877]
  - - [64, 1408, 1, 256]
    - [7, 1.91]
  - - [64, 2368, 1, 3328]
    - [6, 3.973]
  - - [64, 448, 1, 256]
    - [5, 0.66]
  - - [64, 6784, 1, 1280]
    - [18, 5.345]
  - - [64, 1856, 1, 1280]
    - [14, 3.63]
  - - [64, 6784, 1, 256]
    - [17, 4.426]
  - - [64, 5056, 1, 1280]
    - [18, 5.047]
  - - [64, 4288, 1, 256]
    - [16, 3.497]
  - - [128, 64, 1, 1280]
    - [5, 0.258]
  - - [5888, 64, 1, 256]
    - [16, 3.858]
  - - [64, 5888, 1, 3328]
    - [17, 5.567]
  - - [64, 1024, 1, 256]
    - [11, 1.427]
  - - [5056, 64, 1, 3328]
    - [17, 5.504]
  - - [256, 64, 1, 1280]
    - [10, 0.574]
  - - [64, 256, 1, 256]
    - [5, 0.374]
  - - [704, 64, 1, 256]
    - [5, 0.981]
  - - [64, 1408, 1, 1280]
    - [18, 2.894]
  - - [1, 1, 1, 256]
    - [20, 0.0]
  - - [64, 704, 1, 256]
    - [8, 1.009]
  - - [64, 2944, 1, 3328]
    - [18, 4.919]
  - - [64, 64, 1, 256]
    - [1, 0.08]
  - - [1856, 64, 1, 256]
    - [17, 2.541]
  - - [128, 64, 1, 3328]
    - [17, 0.294]
  - - [2944, 64, 1, 1280]
    - [17, 4.434]
  - - [4288, 64, 1, 256]
    - [18, 3.424]
  - - [1, 1, 1, 1280]
    - [22, 0.0]
  - - [64, 2944, 1, 1280]
    - [18, 4.634]
  - - [1408, 64, 1, 1280]
    - [18, 2.902]
  - - [6784, 64, 1, 3328]
    - [17, 5.551]
  - - [1024, 64, 1, 256]
    - [18, 1.555]
  - - [64, 2368, 1, 256]
    - [7, 2.71]
  - - [64, 3584, 1, 256]
    - [2, 3.351]
  - - [2944, 64, 1, 3328]
    - [18, 4.911]
  - - [2368, 64, 1, 1280]
    - [5, 3.667]
  - - [256, 64, 1, 3328]
    - [10, 0.62]
  - - [64, 64, 1, 3328]
    - [17, 0.152]
  - - [1, 1, 1, 3328]
    - [22, 0.0]
  - - [64, 5888, 1, 256]
    - [17, 4.104]
  - - [64, 704, 1, 1280]
    - [13, 1.483]
  - - [6784, 64, 1, 1280]
    - [17, 5.269]
  - - [5056, 64, 1, 256]
    - [15, 3.461]
  - - [1408, 64, 1, 3328]
    - [18, 3.091]
  - - [4096, 7133, 1, 4096]
    - [36, 14.1]
  - - [512, 16, 1, 512]
    - [28, 0.198]
  - - [2048, 7133, 1, 2048]
    - [33, 13.977]
  - - [2560, 7133, 1, 2560]
    - [35, 13.724]
  - - [1024, 1024, 1, 1024]
    - [259, 31.799]
  - - [3072, 7435, 1, 1024]
    - [33, 13.851]
  - - [1024, 32, 1, 512]
    - [24, 0.674]
  - - [1760, 7133, 1, 1760]
    - [35, 13.094]
  - - [7680, 5481, 1, 2560]
    - [33, 13.968]
  - - [1024, 16, 1, 512]
    - [24, 0.333]
  - - [512, 32, 1, 512]
    - [27, 0.387]
  - - [3136, 256, 64, 64]
    - [234, 29.197]
  - - [784, 512, 64, 128]
    - [234, 36.591]
  - - [784, 128, 64, 512]
    - [227, 44.088]
  - - [3136, 64, 128, 64]
    - [67, 11.517]
  - - [196, 256, 128, 1024]
    - [63, 13.29]
  - - [196, 256, 64, 1024]
    - [235, 33.304]
  - - [196, 1024, 128, 256]
    - [63, 12.602]
  - - [784, 128, 256, 512]
    - [62, 16.038]
  - - [3136, 64, 64, 256]
    - [232, 30.319]
  - - [3136, 64, 256, 256]
    - [65, 15.705]
  - - [3136, 256, 256, 64]
    - [69, 14.128]
  - - [3136, 64, 128, 256]
    - [68, 15.605]
  - - [784, 128, 128, 512]
    - [62, 15.875]
  - - [784, 512, 128, 128]
    - [62, 14.414]
  - - [784, 512, 256, 128]
    - [64, 14.421]
  - - [196, 1024, 64, 256]
    - [224, 31.084]
  - - [3136, 64, 64, 64]
    - [233, 19.233]
  - - [196, 1024, 256, 256]
    - [66, 12.724]
  - - [196, 256, 256, 1024]
    - [63, 13.524]
  - - [3136, 256, 128, 64]
    - [68, 13.599]
  - - [3136, 64, 256, 64]
    - [67, 11.71]
  - - [14, 64, 1, 14]
    - [86, 0.001]
  - - [15, 64, 1, 14]
    - [86, 0.001]
  - - [15, 64, 1, 15]
    - [86, 0.001]
  - - [15, 64, 1, 15]
    - [86, 0.001]
  - - [17, 64, 1, 15]
    - [86, 0.002]
  - - [17, 64, 1, 17]
    - [86, 0.002]
  - - [17, 64, 1, 17]
    - [86, 0.002]
  - - [21, 64, 1, 17]
    - [93, 0.003]
  - - [21, 64, 1, 21]
    - [86, 0.003]
  - - [24, 64, 1, 24]
    - [86, 0.004]
  - - [30, 64, 1, 30]
    - [132, 0.007]
  - - [30, 64, 1, 31]
    - [93, 0.007]
  - - [31, 64, 1, 31]
    - [96, 0.007]
  - - [32, 64, 1, 32]
    - [93, 0.007]
  - - [32, 64, 1, 35]
    - [89, 0.007]
  - - [34, 64, 1, 24]
    - [133, 0.007]
  - - [34, 64, 1, 34]
    - [93, 0.008]
  - - [35, 64, 1, 35]
    - [108, 0.008]
  - - [64, 14, 1, 14]
    - [86, 0.001]
  - - [64, 15, 1, 14]
    - [87, 0.001]
  - - [64, 15, 1, 15]
    - [87, 0.001]
  - - [64, 15, 1, 15]
    - [87, 0.001]
  - - [64, 17, 1, 15]
    - [86, 0.001]
  - - [64, 17, 1, 17]
    - [110, 0.002]
  - - [64, 17, 1, 17]
    - [91, 0.002]
  - - [64, 21, 1, 17]
    - [87, 0.002]
  - - [64, 21, 1, 21]
    - [87, 0.003]
  - - [64, 24, 1, 24]
    - [87, 0.004]
  - - [64, 30, 1, 30]
    - [88, 0.005]
  - - [64, 30, 1, 31]
    - [87, 0.005]
  - - [64, 31, 1, 31]
    - [90, 0.006]
  - - [64, 32, 1, 32]
    - [89, 0.007]
  - - [64, 32, 1, 35]
    - [91, 0.007]
  - - [64, 34, 1, 24]
    - [87, 0.005]
  - - [64, 34, 1, 34]
    - [88, 0.007]
  - - [64, 35, 1, 35]
    - [88, 0.007]
  - - [64, 128, 512, 128]
    - [324, 16.917]
  - - [64, 512, 1, 512]
    - [364, 2.013]
  - - [64, 512, 64, 512]
    - [282, 29.468]
  - - [128, 64, 512, 128]
    - [325, 16.803]
  - - [512, 64, 1, 512]
    - [364, 1.988]
  - - [512, 64, 64, 512]
    - [328, 28.958]
  - - [1024, 2, 1, 4]
    - [283, 0.001]
  - - [1024, 2, 1, 32]
    - [326, 0.013]
  - - [1024, 2, 1, 2048]
    - [271, 0.191]
  - - [1024, 1024, 1, 4]
    - [264, 0.633]
  - - [1024, 1024, 1, 32]
    - [316, 5.148]
  - - [1024, 1024, 1, 2048]
    - [285, 36.943]
  - - [1024, 1024, 1, 4096]
    - [274, 42.0]
  - - [1024, 4096, 1, 2048]
    - [286, 53.307]
  - - [1024, 4096, 1, 4096]
    - [294, 55.98]
  - - [1024, 30528, 1, 2048]
    - [329, 80.152]
  - - [1024, 30528, 1, 4096]
    - [327, 82.35]
  - - [4096, 1024, 1, 2048]
    - [288, 54.648]
  - - [4096, 1024, 1, 4096]
    - [304, 57.256]
  - - [3, 64, 512, 3]
    - [336, 0.039]
  - - [5, 64, 512, 5]
    - [330, 0.109]
  - - [5, 64, 960, 5]
    - [330, 0.15]
  - - [9, 64, 512, 9]
    - [336, 0.345]
  - - [13, 512, 1, 32768]
    - [320, 0.755]
  - - [27, 128, 32768, 27]
    - [372, 5.317]
  - - [33, 32, 200, 33]
    - [373, 0.988]
  - - [33, 32, 1600, 33]
    - [374, 2.79]
  - - [67, 2048, 1, 512]
    - [375, 6.087]
  - - [74, 2048, 1, 512]
    - [366, 6.787]
  - - [74, 2048, 1, 960]
    - [376, 8.353]
  - - [100, 2048, 1, 512]
    - [377, 7.727]
  - - [256, 128, 1, 32768]
    - [308, 3.916]
  - - [256, 1280, 1, 8976]
    - [378, 25.869]
  - - [256, 2560, 1, 8976]
    - [379, 36.971]
  - - [256, 2816, 1, 8976]
    - [380, 39.971]
  - - [256, 3328, 1, 8976]
    - [381, 44.149]
  - - [256, 3584, 1, 8976]
    - [382, 45.685]
  - - [256, 3840, 1, 8976]
    - [383, 43.143]
  - - [256, 4096, 1, 8976]
    - [384, 43.325]
  - - [256, 4352, 1, 8976]
    - [285, 46.238]
  - - [256, 4864, 1, 8976]
    - [385, 51.525]
  - - [256, 5120, 1, 8976]
    - [385, 54.29]
  - - [256, 5632, 1, 8976]
    - [385, 59.837]
  - - [256, 5888, 1, 8976]
    - [384, 61.405]
  - - [256, 6144, 1, 8976]
    - [386, 61.595]
  - - [256, 7168, 1, 8976]
    - [385, 65.315]
  - - [256, 8192, 1, 8976]
    - [387, 48.132]
  - - [256, 8960, 1, 8976]
    - [388, 52.458]
  - - [256, 9728, 1, 8976]
    - [334, 56.846]
  - - [256, 9984, 1, 8976]
    - [388, 58.357]
  - - [256, 10240, 1, 8976]
    - [388, 59.935]
  - - [256, 10496, 1, 8976]
    - [387, 61.118]
  - - [256, 11008, 1, 8976]
    - [334, 64.378]
  - - [256, 11264, 1, 8976]
    - [334, 65.483]
  - - [256, 11520, 1, 8976]
    - [334, 67.117]
  - - [256, 11776, 1, 8976]
    - [334, 68.423]
  - - [256, 12544, 1, 8976]
    - [334, 72.885]
  - - [256, 12800, 1, 8976]
    - [389, 74.192]
  - - [256, 13312, 1, 8976]
    - [334, 77.16]
  - - [256, 13568, 1, 8976]
    - [334, 78.475]
  - - [256, 14336, 1, 8976]
    - [390, 82.694]
  - - [256, 14848, 1, 8976]
    - [391, 85.648]
  - - [256, 15104, 1, 8976]
    - [391, 86.428]
  - - [256, 15872, 1, 8976]
    - [294, 55.752]
  - - [256, 16128, 1, 8976]
    - [294, 56.329]
  - - [256, 17152, 1, 8976]
    - [294, 59.586]
  - - [256, 17408, 1, 8976]
    - [294, 60.534]
  - - [256, 18688, 1, 8976]
    - [294, 64.734]
  - - [256, 19968, 1, 8976]
    - [310, 67.739]
  - - [256, 20480, 1, 8976]
    - [303, 67.817]
  - - [256, 20992, 1, 8976]
    - [384, 69.759]
  - - [256, 21248, 1, 8976]
    - [392, 69.167]
  - - [256, 22016, 1, 8976]
    - [393, 69.983]
  - - [256, 26112, 1, 8976]
    - [394, 76.521]
  - - [256, 32512, 1, 8976]
    - [286, 69.085]
  - - [256, 32768, 1, 1]
    - [272, 0.446]
  - - [256, 33536, 1, 8976]
    - [286, 71.106]
  - - [256, 44505, 1, 8976]
    - [248, 84.836]
  - - [257, 4096, 1, 1024]
    - [395, 25.866]
  - - [480, 1024, 1, 32768]
    - [381, 30.4]
  - - [512, 32, 1, 200]
    - [396, 0.409]
  - - [512, 32, 1, 1600]
    - [370, 1.524]
  - - [512, 256, 1, 32768]
    - [322, 12.56]
  - - [512, 512, 1, 200]
    - [396, 5.772]
  - - [512, 512, 1, 1600]
    - [260, 17.368]
  - - [512, 2048, 1, 256]
    - [397, 20.591]
  - - [560, 1024, 1, 200]
    - [398, 8.87]
  - - [560, 1024, 1, 1600]
    - [371, 24.255]
  - - [768, 2048, 1, 256]
    - [399, 27.505]
  - - [1024, 64, 1, 512]
    - [367, 4.078]
  - - [1024, 64, 1, 960]
    - [400, 5.165]
  - - [1024, 256, 1, 1024]
    - [401, 14.865]
  - - [1024, 256, 1, 1280]
    - [401, 16.103]
  - - [1024, 256, 1, 2304]
    - [402, 18.904]
  - - [1024, 256, 1, 2816]
    - [402, 19.351]
  - - [1024, 256, 1, 3072]
    - [403, 19.99]
  - - [1024, 256, 1, 3328]
    - [404, 20.259]
  - - [1024, 256, 1, 3584]
    - [405, 20.688]
  - - [1024, 256, 1, 4096]
    - [406, 20.633]
  - - [1024, 256, 1, 4352]
    - [405, 20.812]
  - - [1024, 256, 1, 4608]
    - [407, 21.091]
  - - [1024, 256, 1, 5120]
    - [403, 21.471]
  - - [1024, 256, 1, 5376]
    - [403, 21.514]
  - - [1024, 256, 1, 5632]
    - [408, 21.488]
  - - [1024, 256, 1, 6144]
    - [404, 22.004]
  - - [1024, 256, 1, 6400]
    - [403, 21.898]
  - - [1024, 256, 1, 7680]
    - [407, 22.429]
  - - [1024, 256, 1, 7936]
    - [403, 22.404]
  - - [1024, 256, 1, 8192]
    - [405, 22.405]
  - - [1024, 256, 1, 8448]
    - [407, 22.725]
  - - [1024, 256, 1, 9728]
    - [404, 22.882]
  - - [1024, 256, 1, 9984]
    - [407, 22.934]
  - - [1024, 256, 1, 10496]
    - [409, 22.908]
  - - [1024, 256, 1, 11520]
    - [407, 22.995]
  - - [1024, 256, 1, 12032]
    - [404, 23.151]
  - - [1024, 256, 1, 13568]
    - [403, 23.358]
  - - [1024, 256, 1, 14336]
    - [410, 23.525]
  - - [1024, 256, 1, 14848]
    - [403, 23.638]
  - - [1024, 256, 1, 15104]
    - [407, 23.348]
  - - [1024, 256, 1, 15872]
    - [403, 23.599]
  - - [1024, 256, 1, 16128]
    - [405, 23.551]
  - - [1024, 256, 1, 17152]
    - [407, 23.586]
  - - [1024, 256, 1, 17408]
    - [404, 23.725]
  - - [1024, 256, 1, 18944]
    - [408, 23.748]
  - - [1024, 256, 1, 19712]
    - [407, 23.751]
  - - [1024, 256, 1, 19968]
    - [403, 23.826]
  - - [1024, 256, 1, 21248]
    - [407, 24.043]
  - - [1024, 256, 1, 21504]
    - [404, 24.001]
  - - [1024, 256, 1, 22016]
    - [405, 24.026]
  - - [1024, 256, 1, 28672]
    - [407, 24.381]
  - - [1024, 256, 1, 33536]
    - [409, 24.449]
  - - [1024, 512, 1, 32768]
    - [323, 31.512]
  - - [1024, 1024, 1, 200]
    - [273, 17.216]
  - - [1024, 1024, 1, 512]
    - [266, 25.765]
  - - [1024, 1024, 1, 960]
    - [292, 30.194]
  - - [1024, 1024, 1, 1600]
    - [299, 35.203]
  - - [1024, 1024, 1, 32768]
    - [279, 47.694]
  - - [1600, 1024, 1, 512]
    - [369, 32.574]
  - - [1600, 1024, 1, 960]
    - [411, 38.133]
  - - [2048, 256, 1, 1024]
    - [412, 21.656]
  - - [2048, 960, 1, 1]
    - [309, 0.275]
  - - [2048, 2048, 1, 512]
    - [257, 44.364]
  - - [2048, 2048, 1, 960]
    - [413, 49.386]
  - - [2048, 2048, 1, 1024]
    - [414, 50.305]
  - - [3200, 2048, 1, 1024]
    - [415, 62.366]
  - - [4096, 4096, 1, 1024]
    - [416, 65.622]
  - - [14, 64, 10880, 14]
    - [335, 1.784]
  - - [15, 64, 10880, 14]
    - [335, 1.867]
  - - [15, 64, 7680, 15]
    - [335, 1.927]
  - - [15, 64, 10880, 15]
    - [336, 2.0]
  - - [17, 64, 7680, 15]
    - [337, 2.087]
  - - [17, 64, 6144, 17]
    - [338, 1.962]
  - - [17, 64, 7680, 17]
    - [339, 2.064]
  - - [21, 64, 6144, 17]
    - [340, 2.292]
  - - [21, 64, 6144, 21]
    - [341, 2.784]
  - - [24, 64, 4736, 24]
    - [342, 3.476]
  - - [30, 64, 2048, 30]
    - [343, 3.887]
  - - [30, 64, 2048, 31]
    - [344, 4.031]
  - - [31, 64, 2048, 31]
    - [345, 3.916]
  - - [32, 64, 4608, 32]
    - [346, 7.284]
  - - [32, 64, 4608, 35]
    - [347, 5.651]
  - - [34, 64, 4736, 24]
    - [348, 4.335]
  - - [34, 64, 4736, 34]
    - [348, 5.045]
  - - [35, 64, 4608, 35]
    - [349, 5.122]
  - - [64, 14, 10880, 14]
    - [350, 1.595]
  - - [64, 15, 10880, 14]
    - [351, 1.693]
  - - [64, 15, 7680, 15]
    - [352, 1.76]
  - - [64, 15, 10880, 15]
    - [350, 1.817]
  - - [64, 17, 7680, 15]
    - [353, 1.965]
  - - [64, 17, 6144, 17]
    - [354, 1.973]
  - - [64, 17, 7680, 17]
    - [355, 2.061]
  - - [64, 21, 6144, 17]
    - [356, 2.376]
  - - [64, 21, 6144, 21]
    - [357, 2.903]
  - - [64, 24, 4736, 24]
    - [358, 3.462]
  - - [64, 30, 2048, 30]
    - [358, 3.971]
  - - [64, 30, 2048, 31]
    - [357, 3.989]
  - - [64, 31, 2048, 31]
    - [359, 4.051]
  - - [64, 32, 4608, 32]
    - [360, 7.457]
  - - [64, 32, 4608, 35]
    - [357, 5.651]
  - - [64, 34, 4736, 24]
    - [361, 3.97]
  - - [64, 34, 4736, 34]
    - [362, 4.664]
  - - [64, 35, 4608, 35]
    - [363, 4.742]
  - - [1024, 1024, 1, 3840]
    - [279, 40.825]
  - - [1024, 1024, 1, 3968]
    - [281, 41.645]
  - - [1024, 1024, 1, 6528]
    - [274, 43.726]
  - - [1024, 1024, 1, 7104]
    - [296, 44.065]
  - - [1024, 1024, 1, 7200]
    - [296, 42.384]
  - - [1024, 1024, 1, 8064]
    - [303, 44.531]
  - - [1024, 1024, 1, 8160]
    - [303, 42.912]
  - - [1024, 1024, 1, 9216]
    - [274, 44.904]
  - - [1024, 1024, 1, 9520]
    - [274, 43.391]
  - - [1024, 1024, 1, 10064]
    - [299, 43.814]
  - - [1024, 1024, 1, 10080]
    - [299, 43.864]
  - - [1024, 1024, 1, 10200]
    - [274, 43.996]
  - - [1024, 4096, 1, 3840]
    - [274, 55.824]
  - - [1024, 4096, 1, 3968]
    - [296, 56.37]
  - - [1024, 4096, 1, 6528]
    - [294, 57.477]
  - - [1024, 4096, 1, 7104]
    - [294, 57.84]
  - - [1024, 4096, 1, 7200]
    - [286, 55.523]
  - - [1024, 4096, 1, 8064]
    - [294, 58.163]
  - - [1024, 4096, 1, 8160]
    - [294, 55.917]
  - - [1024, 4096, 1, 9216]
    - [294, 58.478]
  - - [1024, 4096, 1, 9520]
    - [310, 55.931]
  - - [1024, 4096, 1, 10064]
    - [294, 56.97]
  - - [1024, 4096, 1, 10080]
    - [294, 56.709]
  - - [1024, 4096, 1, 10200]
    - [296, 56.87]
  - - [1024, 42720, 1, 3968]
    - [334, 83.113]
  - - [1024, 42720, 1, 6528]
    - [334, 85.013]
  - - [1024, 42720, 1, 7104]
    - [334, 85.131]
  - - [1024, 42720, 1, 7200]
    - [334, 85.219]
  - - [1024, 42720, 1, 9520]
    - [334, 84.453]
  - - [1024, 42720, 1, 10080]
    - [334, 86.118]
  - - [4096, 1024, 1, 3840]
    - [296, 57.115]
  - - [4096, 1024, 1, 3968]
    - [303, 57.473]
  - - [4096, 1024, 1, 6528]
    - [299, 58.904]
  - - [4096, 1024, 1, 7104]
    - [310, 59.027]
  - - [4096, 1024, 1, 7200]
    - [258, 56.658]
  - - [4096, 1024, 1, 8064]
    - [274, 59.186]
  - - [4096, 1024, 1, 8160]
    - [299, 56.891]
  - - [4096, 1024, 1, 9216]
    - [274, 59.439]
  - - [4096, 1024, 1, 9520]
    - [310, 57.251]
  - - [4096, 1024, 1, 10064]
    - [274, 57.863]
  - - [4096, 1024, 1, 10080]
    - [296, 57.794]
  - - [4096, 1024, 1, 10200]
    - [310, 57.69]
  - - [27, 64, 1920, 27]
    - [151, 2.881]
  - - [27, 64, 1920, 33]
    - [179, 3.326]
  - - [33, 64, 1920, 33]
    - [175, 3.901]
  - - [64, 27, 1920, 27]
    - [210, 2.563]
  - - [64, 27, 1920, 33]
    - [154, 2.987]
  - - [64, 33, 1920, 33]
    - [149, 3.488]
  - - [1024, 1024, 1, 3240]
    - [189, 33.538]
  - - [1024, 1024, 1, 3960]
    - [191, 35.455]
  - - [1024, 4096, 1, 3240]
    - [162, 48.172]
  - - [1024, 4096, 1, 3960]
    - [172, 49.597]
  - - [1024, 42720, 1, 3960]
    - [182, 76.971]
  - - [4096, 1024, 1, 3240]
    - [186, 48.503]
  - - [4096, 1024, 1, 3960]
    - [203, 49.111]
  - - [64, 1280, 64, 192]
    - [213, 25.669]
  - - [64, 1280, 64, 320]
    - [214, 30.427]
  - - [64, 1280, 64, 384]
    - [215, 32.767]
  - - [64, 1280, 64, 448]
    - [216, 34.292]
  - - [64, 2048, 64, 192]
    - [217, 26.915]
  - - [64, 2048, 64, 320]
    - [218, 31.168]
  - - [64, 2048, 64, 384]
    - [219, 32.66]
  - - [64, 2048, 64, 448]
    - [220, 34.079]
  - - [1225, 192, 64, 32]
    - [221, 11.77]
  - - [1225, 192, 64, 48]
    - [222, 10.032]
  - - [1225, 192, 64, 64]
    - [221, 18.068]
  - - [1225, 256, 64, 48]
    - [223, 11.255]
  - - [1225, 256, 64, 64]
    - [224, 20.068]
  - - [1225, 288, 64, 48]
    - [222, 9.435]
  - - [1225, 288, 64, 64]
    - [225, 16.532]
  - - [5329, 64, 64, 80]
    - [226, 14.91]
  - - [289, 768, 64, 128]
    - [227, 25.587]
  - - [289, 768, 64, 160]
    - [227, 28.743]
  - - [289, 768, 64, 192]
    - [224, 31.088]
  - - [64, 1280, 32, 192]
    - [219, 20.934]
  - - [64, 1280, 32, 320]
    - [216, 25.572]
  - - [64, 1280, 32, 384]
    - [216, 27.07]
  - - [64, 1280, 32, 448]
    - [228, 27.545]
  - - [64, 2048, 32, 192]
    - [228, 23.117]
  - - [64, 2048, 32, 320]
    - [216, 27.246]
  - - [64, 2048, 32, 384]
    - [229, 28.875]
  - - [64, 2048, 32, 448]
    - [214, 30.529]
  - - [1225, 192, 32, 32]
    - [221, 9.51]
  - - [1225, 192, 32, 48]
    - [222, 8.736]
  - - [1225, 192, 32, 64]
    - [225, 15.544]
  - - [1225, 256, 32, 48]
    - [230, 9.653]
  - - [1225, 256, 32, 64]
    - [225, 16.422]
  - - [1225, 288, 32, 48]
    - [226, 8.881]
  - - [1225, 288, 32, 64]
    - [225, 15.161]
  - - [5329, 64, 32, 80]
    - [221, 14.015]
  - - [289, 768, 32, 128]
    - [227, 21.704]
  - - [289, 768, 32, 160]
    - [227, 24.448]
  - - [289, 768, 32, 192]
    - [231, 26.422]
  - - [49, 512, 64, 2048]
    - [236, 23.138]
  - - [49, 2048, 64, 512]
    - [237, 23.653]
  - - [3136, 64, 32, 256]
    - [238, 27.925]
  - - [3136, 64, 32, 64]
    - [239, 16.027]
  - - [3136, 256, 32, 64]
    - [234, 25.816]
  - - [784, 128, 32, 512]
    - [234, 39.053]
  - - [784, 512, 32, 128]
    - [234, 31.791]
  - - [196, 256, 32, 1024]
    - [240, 26.713]
  - - [196, 1024, 32, 256]
    - [224, 26.392]
  - - [49, 512, 32, 2048]
    - [239, 23.103]
  - - [49, 2048, 32, 512]
    - [241, 20.821]
  - - [3136, 64, 64, 128]
    - [242, 24.27]
  - - [3136, 128, 64, 256]
    - [234, 47.784]
  - - [784, 256, 64, 512]
    - [234, 53.799]
  - - [3136, 256, 64, 128]
    - [234, 44.99]
  - - [3136, 256, 64, 256]
    - [234, 58.869]
  - - [196, 512, 64, 1024]
    - [224, 42.3]
  - - [784, 512, 64, 256]
    - [234, 48.272]
  - - [784, 512, 64, 512]
    - [234, 58.283]
  - - [196, 1024, 64, 512]
    - [227, 40.096]
  - - [196, 1024, 64, 1024]
    - [243, 46.051]
  - - [49, 1024, 64, 2048]
    - [244, 27.415]
  - - [49, 2048, 64, 1024]
    - [241, 28.507]
  - - [3136, 64, 32, 128]
    - [233, 21.732]
  - - [3136, 128, 32, 256]
    - [234, 43.039]
  - - [784, 256, 32, 512]
    - [234, 48.083]
  - - [3136, 256, 32, 128]
    - [245, 39.554]
  - - [3136, 256, 32, 256]
    - [234, 55.051]
  - - [196, 512, 32, 1024]
    - [235, 33.413]
  - - [784, 512, 32, 256]
    - [234, 43.282]
  - - [784, 512, 32, 512]
    - [234, 55.348]
  - - [196, 1024, 32, 512]
    - [227, 34.97]
  - - [196, 1024, 32, 1024]
    - [227, 40.814]
  - - [49, 1024, 32, 2048]
    - [246, 23.856]
  - - [49, 2048, 32, 1024]
    - [241, 25.059]
  - - [7680, 8192, 1, 8192]
    - [247, 91.427]
  - - [3840, 4096, 1, 4096]
    - [248, 87.352]
  - - [1920, 2048, 1, 2048]
    - [249, 77.059]
  - - [960, 1024, 1, 1024]
    - [250, 38.608]
  - - [480, 512, 1, 512]
    - [251, 11.323]
  - - [8192, 7680, 1, 8192]
    - [252, 91.406]
  - - [4096, 3840, 1, 4096]
    - [253, 86.216]
  - - [2048, 1920, 1, 2048]
    - [254, 78.016]
  - - [1024, 960, 1, 1024]
    - [255, 38.768]
  - - [512, 480, 1, 512]
    - [256, 11.109]
  - - [8192, 8192, 1, 8192]
    - [254, 88.201]
  - - [4096, 4096, 1, 4096]
    - [257, 78.427]
  - - [2048, 2048, 1, 2048]
    - [258, 54.279]
  - - [512, 512, 1, 512]
    - [260, 10.736]
  - - [64, 512, 16, 512]
    - [261, 18.073]
  - - [1024, 2, 1, 1]
    - [262, 0.001]
  - - [1024, 2, 1, 512]
    - [263, 0.099]
  - - [1024, 1024, 1, 1]
    - [264, 0.163]
  - - [1024, 1024, 1, 77]
    - [265, 8.685]
  - - [1024, 4096, 1, 512]
    - [267, 43.689]
  - - [1024, 30522, 1, 77]
    - [268, 24.776]
  - - [4096, 1024, 1, 512]
    - [269, 44.364]
  - - [64, 128, 160, 128]
    - [259, 14.953]
  - - [1024, 2, 1, 10]
    - [270, 0.004]
  - - [1024, 2, 1, 1280]
    - [271, 0.158]
  - - [1024, 1024, 1, 10]
    - [272, 1.487]
  - - [1024, 1024, 1, 1280]
    - [274, 32.289]
  - - [1024, 4096, 1, 1280]
    - [267, 50.343]
  - - [1024, 30522, 1, 200]
    - [275, 44.689]
  - - [4096, 1024, 1, 1280]
    - [258, 52.172]
  - - [64, 128, 624, 128]
    - [276, 17.749]
  - - [1024, 2, 1, 39]
    - [262, 0.013]
  - - [1024, 2, 1, 4992]
    - [271, 0.234]
  - - [1024, 1024, 1, 39]
    - [277, 5.036]
  - - [1024, 1024, 1, 780]
    - [278, 26.669]
  - - [1024, 1024, 1, 4992]
    - [279, 42.449]
  - - [1024, 4096, 1, 4992]
    - [274, 56.713]
  - - [1024, 30522, 1, 780]
    - [280, 61.577]
  - - [4096, 1024, 1, 4992]
    - [281, 58.213]
  - - [1024, 1024, 1, 308]
    - [284, 20.016]
  - - [1024, 30522, 1, 308]
    - [287, 52.437]
  - - [64, 128, 640, 128]
    - [289, 18.099]
  - - [1024, 2, 1, 40]
    - [262, 0.013]
  - - [1024, 2, 1, 5120]
    - [290, 0.233]
  - - [1024, 1024, 1, 40]
    - [291, 5.528]
  - - [1024, 1024, 1, 800]
    - [292, 29.184]
  - - [1024, 1024, 1, 5120]
    - [293, 43.015]
  - - [1024, 4096, 1, 5120]
    - [294, 56.675]
  - - [1024, 30522, 1, 800]
    - [295, 65.034]
  - - [4096, 1024, 1, 5120]
    - [296, 57.999]
  - - [64, 128, 656, 128]
    - [297, 18.34]
  - - [1024, 2, 1, 41]
    - [262, 0.015]
  - - [1024, 2, 1, 5248]
    - [271, 0.234]
  - - [1024, 1024, 1, 41]
    - [272, 5.092]
  - - [1024, 1024, 1, 820]
    - [298, 27.463]
  - - [1024, 1024, 1, 5248]
    - [299, 42.667]
  - - [1024, 4096, 1, 5248]
    - [296, 56.669]
  - - [1024, 30522, 1, 820]
    - [300, 62.671]
  - - [4096, 1024, 1, 5248]
    - [299, 58.338]
  - - [64, 512, 80, 512]
    - [301, 31.323]
  - - [1024, 2, 1, 5]
    - [262, 0.002]
  - - [1024, 2, 1, 2560]
    - [271, 0.206]
  - - [1024, 1024, 1, 5]
    - [264, 0.818]
  - - [1024, 1024, 1, 385]
    - [302, 22.623]
  - - [1024, 1024, 1, 2560]
    - [303, 38.648]
  - - [1024, 4096, 1, 2560]
    - [304, 53.908]
  - - [1024, 30522, 1, 385]
    - [305, 55.664]
  - - [4096, 1024, 1, 2560]
    - [306, 55.516]
  - - [64, 512, 96, 512]
    - [307, 30.327]
  - - [1024, 2, 1, 6]
    - [262, 0.002]
  - - [1024, 2, 1, 3072]
    - [308, 0.216]
  - - [1024, 1024, 1, 6]
    - [309, 0.934]
  - - [1024, 1024, 1, 462]
    - [259, 23.369]
  - - [1024, 1024, 1, 3072]
    - [293, 40.034]
  - - [1024, 4096, 1, 3072]
    - [310, 54.835]
  - - [1024, 30522, 1, 462]
    - [311, 56.73]
  - - [4096, 1024, 1, 3072]
    - [312, 56.137]
  - - [64, 128, 128, 128]
    - [313, 14.273]
  - - [1024, 2, 1, 8]
    - [262, 0.003]
  - - [1024, 2, 1, 1024]
    - [314, 0.143]
  - - [1024, 1024, 1, 8]
    - [315, 1.402]
  - - [1024, 1024, 1, 160]
    - [316, 15.859]
  - - [1024, 4096, 1, 1024]
    - [317, 49.257]
  - - [1024, 30522, 1, 160]
    - [318, 43.942]
  - - [4096, 1024, 1, 1024]
    - [258, 50.814]
  - - [64, 128, 144, 128]
    - [319, 14.419]
  - - [1024, 2, 1, 9]
    - [262, 0.004]
  - - [1024, 2, 1, 1152]
    - [308, 0.151]
  - - [1024, 1024, 1, 9]
    - [272, 1.359]
  - - [1024, 1024, 1, 180]
    - [273, 15.913]
  - - [1024, 1024, 1, 1152]
    - [285, 30.886]
  - - [1024, 4096, 1, 1152]
    - [286, 49.8]
  - - [1024, 30522, 1, 180]
    - [318, 42.838]
  - - [4096, 1024, 1, 1152]
    - [269, 51.796]
  - - [479, 1024, 1, 32768]
    - [321, 28.348]
  - - [4, 64, 32768, 4]
    - [330, 0.172]
  - - [4, 64, 38400, 4]
    - [330, 0.174]
  - - [64, 4, 32768, 4]
    - [331, 0.173]
  - - [64, 4, 38400, 4]
    - [331, 0.174]
  - - [1024, 1024, 1, 8192]
    - [293, 44.684]
  - - [1024, 1024, 1, 9600]
    - [299, 45.575]
  - - [1024, 4096, 1, 8192]
    - [294, 58.22]
  - - [1024, 4096, 1, 9600]
    - [304, 58.204]
  - - [1024, 33712, 1, 8192]
    - [332, 86.734]
  - - [1024, 33712, 1, 9600]
    - [333, 86.694]
  - - [4096, 1024, 1, 8192]
    - [296, 59.109]
  - - [4096, 1024, 1, 9600]
    - [310, 59.341]
  - - [64, 128, 1, 128]
    - [365, 0.209]
  - - [128, 64, 1, 128]
    - [326, 0.204]
  - - [5, 64, 1, 5]
    - [368, 0.0]
  - - [2048, 512, 1, 1]
    - [264, 0.166]
  - - [33, 32, 1, 33]
    - [262, 0.006]
  - - [1024, 1600, 1, 1]
    - [309, 0.229]
- null
