library/src/blas3/Tensile/Logic/asm_full/arcturus_Cijk_Ailk_Bljk_CB_GB.yaml
- {MinimumRequiredVersion: 4.25.0}
- arcturus
- gfx908
- [Device 7380, Device 7388, Device 738c, Device 7390]
    SolutionIndex: 0
    SolutionNameMin: Cijk_Ailk_Bljk_CB_GB_MT32x32x16_MI16x16x4x1_SN_1LDSB0_EPS1_GRVW2_LBSPP128_LPB4_NLCA1_PGR1_PLR5_SU0_SUS128_SRVW1_TT1_16_WG32_8_1_WGM1
    SolutionIndex: 1
    SolutionNameMin: Cijk_Ailk_Bljk_CB_GB_MT32x32x16_MI16x16x4x1_SN_1LDSB0_EPS0_GRVW2_LBSPP128_LPB4_NLCA1_PGR2_PLR5_SU0_SUS128_SRVW1_TT1_16_WG32_8_1_WGM1
    SolutionIndex: 2
    SolutionNameMin: Cijk_Ailk_Bljk_CB_GB_MT32x32x16_MI16x16x4x1_SN_1LDSB0_EPS0_GRVW2_LBSPP128_LPB4_NLCA1_PGR2_PLR5_SU0_SUS256_SRVW1_TT1_16_WG32_8_1_WGM1
    SolutionIndex: 3
    SolutionNameMin: Cijk_Ailk_Bljk_CB_GB_MT32x32x32_MI16x16x4x1_SN_1LDSB0_EPS1_GRVW2_LBSPP256_LPB4_NLCA1_PGR1_PLR9_SU0_SUS256_SRVW1_TT1_16_WG32_8_1_WGM1
    SolutionIndex: 4
    SolutionNameMin: Cijk_Ailk_Bljk_CB_GB_MT32x32x32_MI16x16x4x1_SN_1LDSB0_EPS0_GRVW2_LBSPP256_LPB4_NLCA1_PGR2_PLR9_SU0_SUS256_SRVW1_TT1_16_WG32_8_1_WGM1
    SolutionIndex: 5
    SolutionNameMin: Cijk_Ailk_Bljk_CB_GB_MT32x32x32_MI16x16x4x1_SN_1LDSB0_EPS1_GRVW2_LBSPP256_LPB4_NLCA1_PGR1_PLR9_SU32_SUS256_SRVW1_TT1_16_WG32_8_1_WGM1
    SolutionIndex: 6
    SolutionNameMin: Cijk_Ailk_Bljk_CB_GB_MT32x32x16_MI16x16x4x1_SN_1LDSB0_EPS0_GRVW2_LBSPP128_LPB4_NLCA1_PGR2_PLR5_SU0_SUS128_SRVW1_TT1_16_WG32_8_1_WGM2
    SolutionIndex: 7
    SolutionNameMin: Cijk_Ailk_Bljk_CB_GB_MT32x32x16_MI16x16x4x1_SN_1LDSB0_EPS0_GRVW2_LBSPP128_LPB4_NLCA1_PGR2_PLR5_SU0_SUS256_SRVW1_TT1_16_WG32_8_1_WGM2
    SolutionIndex: 8
    SolutionNameMin: Cijk_Ailk_Bljk_CB_GB_MT32x32x32_MI16x16x4x1_SN_1LDSB0_EPS1_GRVW2_LBSPP256_LPB4_NLCA1_PGR1_PLR9_SU0_SUS256_SRVW1_TT1_16_WG32_8_1_WGM2
    SolutionIndex: 9
    SolutionNameMin: Cijk_Ailk_Bljk_CB_GB_MT32x32x32_MI16x16x4x1_SN_1LDSB0_EPS0_GRVW2_LBSPP256_LPB4_NLCA1_PGR2_PLR9_SU0_SUS256_SRVW1_TT1_16_WG32_8_1_WGM2
    SolutionIndex: 10
    SolutionNameMin: Cijk_Ailk_Bljk_CB_GB_MT32x32x16_MI16x16x4x1_SN_1LDSB0_EPS0_GRVW2_LBSPP128_LPB4_NLCA1_PGR2_PLR5_SU0_SUS128_SRVW1_TT1_16_WG32_8_1_WGM15
    SolutionIndex: 11
    SolutionNameMin: Cijk_Ailk_Bljk_CB_GB_MT32x32x16_MI16x16x4x1_SN_1LDSB0_EPS1_GRVW2_LBSPP128_LPB4_NLCA1_PGR1_PLR5_SU0_SUS256_SRVW1_TT1_16_WG32_8_1_WGM15
    SolutionIndex: 12
    SolutionNameMin: Cijk_Ailk_Bljk_CB_GB_MT32x64x16_MI16x16x4x1_SN_1LDSB1_EPS1_GRVW2_LBSPP128_LPB4_NLCA1_PGR1_PLR5_SU0_SUS128_SRVW1_TT1_32_WG32_8_1_WGM1
    SolutionIndex: 13
    SolutionNameMin: Cijk_Ailk_Bljk_CB_GB_MT64x32x16_MI16x16x4x1_SN_1LDSB1_EPS1_GRVW2_LBSPP128_LPB4_NLCA1_PGR1_PLR5_SU0_SUS128_SRVW1_TT2_16_WG32_8_1_WGM1
    SolutionIndex: 14
    SolutionNameMin: Cijk_Ailk_Bljk_CB_GB_MT64x32x16_MI16x16x4x1_SN_1LDSB1_EPS1_GRVW2_LBSPP128_LPB4_NLCA1_PGR1_PLR5_SU0_SUS256_SRVW1_TT2_16_WG32_8_1_WGM2
    SolutionIndex: 15
    SolutionNameMin: Cijk_Ailk_Bljk_CB_GB_MT64x32x16_MI16x16x4x1_SN_1LDSB1_EPS1_GRVW2_LBSPP128_LPB4_NLCA1_PGR1_PLR5_SU0_SUS256_SRVW1_TT2_16_WG32_8_1_WGM15
- - - [32, 32, 8, 128, 32, 32, 32, 128]
    - [1, 122.0]
  - - [128, 128, 8, 128, 128, 128, 128, 128]
    - [6, 1613.0]
  - - [256, 256, 8, 128, 256, 256, 256, 128]
    - [14, 3355.0]
  - - [512, 512, 8, 128, 512, 512, 512, 128]
    - [14, 5438.0]
  - - [32, 32, 8, 512, 32, 32, 32, 512]
    - [4, 239.0]
  - - [128, 128, 8, 512, 128, 128, 128, 512]
    - [0, 2732.0]
  - - [256, 256, 8, 512, 256, 256, 256, 512]
    - [12, 4486.0]
  - - [512, 512, 8, 512, 512, 512, 512, 512]
    - [15, 6583.0]
  - - [32, 32, 8, 1024, 32, 32, 32, 1024]
    - [9, 288.0]
  - - [128, 128, 8, 1024, 128, 128, 128, 1024]
    - [11, 3067.0]
  - - [256, 256, 8, 1024, 256, 256, 256, 1024]
    - [13, 4863.0]
  - - [512, 512, 8, 1024, 512, 512, 512, 1024]
    - [15, 6857.0]
  - - [32, 128, 8, 128, 32, 32, 32, 128]
    - [1, 485.0]
  - - [32, 256, 8, 128, 32, 32, 32, 128]
    - [2, 1008.0]
  - - [32, 512, 8, 128, 32, 32, 32, 128]
    - [0, 1651.0]
  - - [32, 128, 8, 512, 32, 32, 32, 512]
    - [2, 966.0]
  - - [32, 256, 8, 512, 32, 32, 32, 512]
    - [2, 1960.0]
  - - [32, 512, 8, 512, 32, 32, 32, 512]
    - [2, 2750.0]
  - - [32, 128, 8, 1024, 32, 32, 32, 1024]
    - [4, 1152.0]
  - - [32, 256, 8, 1024, 32, 32, 32, 1024]
    - [5, 2330.0]
  - - [32, 512, 8, 1024, 32, 32, 32, 1024]
    - [2, 3095.0]
  - - [128, 32, 8, 128, 128, 128, 128, 128]
    - [10, 485.0]
  - - [256, 32, 8, 128, 256, 256, 256, 128]
    - [2, 980.0]
  - - [512, 32, 8, 128, 512, 512, 512, 128]
    - [0, 1626.0]
  - - [128, 32, 8, 512, 128, 128, 128, 512]
    - [3, 975.0]
  - - [256, 32, 8, 512, 256, 256, 256, 512]
    - [8, 1933.0]
  - - [512, 32, 8, 512, 512, 512, 512, 512]
    - [7, 2663.0]
  - - [128, 32, 8, 1024, 128, 128, 128, 1024]
    - [8, 1178.0]
  - - [256, 32, 8, 1024, 256, 256, 256, 1024]
    - [3, 2356.0]
  - - [512, 32, 8, 1024, 512, 512, 512, 1024]
    - [6, 3023.0]
- null
