library/src/blas3/Tensile/Logic/asm_full/arcturus_Cijk_Alik_Bljk_HB.yaml
- {MinimumRequiredVersion: 4.6.0}
- arcturus
- gfx908
- [Device 7380, Device 7388, Device 738c, Device 7390]
    SolutionIndex: 0
    SolutionNameMin: Cijk_Alik_Bljk_HB_MT016x016x16_GRVW02_NLCA01_NLCB01_TT02_02_USFGRO01_VW02_WG08_08_01
    SolutionIndex: 1
    SolutionNameMin: Cijk_Alik_Bljk_HB_MT64x32x16_SN_APM0_FL1_GRVW8_GSU3_LPB4_LRVW4_NLCA1_NLCB1_TT4_4_USFGRO0_VW4_WG16_8_2_WGM64
    SolutionIndex: 2
    SolutionNameMin: Cijk_Alik_Bljk_HB_MT64x32x16_SN_APM0_FL1_GRVW8_GSU1_LPB4_LRVW4_NLCA1_NLCB1_TT4_4_USFGRO0_VW4_WG16_8_2_WGM64
    SolutionIndex: 3
    SolutionNameMin: Cijk_Alik_Bljk_HB_MT128x128x16_SN_APM1_FL0_GRVW8_GSU1_LPB0_LRVW8_NLCA1_NLCB1_TT8_8_USFGRO0_VW8_WG16_16_1_WGM8
    SolutionIndex: 4
    SolutionNameMin: Cijk_Alik_Bljk_HB_MT64x16x16_SN_APM0_FL1_GRVW8_GSU5_LPB4_LRVW4_NLCA1_NLCB1_TT4_4_USFGRO0_VW4_WG16_4_4_WGM1
    SolutionIndex: 5
    SolutionNameMin: Cijk_Alik_Bljk_HB_MT128x64x16_SN_APM1_FL0_GRVW4_GSU1_LPB0_LRVW4_NLCA1_NLCB1_TT8_4_USFGRO0_VW4_WG16_16_1_WGM8
    SolutionIndex: 6
    SolutionNameMin: Cijk_Alik_Bljk_HB_MT64x128x16_SN_APM1_FL0_GRVW4_GSU1_LPB0_LRVW4_NLCA1_NLCB1_TT4_8_USFGRO0_VW4_WG16_16_1_WGM8
    SolutionIndex: 7
    SolutionNameMin: Cijk_Alik_Bljk_HB_MT64x32x16_SN_APM0_FL1_GRVW8_GSU1_LPB4_LRVW4_NLCA1_NLCB1_TT4_4_USFGRO0_VW4_WG16_8_2_WGM1
    SolutionIndex: 8
    SolutionNameMin: Cijk_Alik_Bljk_HB_MT32x32x16_SN_APM1_FL0_GRVW4_GSU1_LPB0_LRVW4_NLCA1_NLCB1_TT4_4_USFGRO0_VW4_WG8_8_1_WGM8
    SolutionIndex: 9
    SolutionNameMin: Cijk_Alik_Bljk_HB_MT64x64x16_SN_APM1_FL0_GRVW4_GSU1_LPB0_LRVW4_NLCA1_NLCB1_TT4_4_USFGRO0_VW4_WG16_16_1_WGM8
    SolutionIndex: 10
    SolutionNameMin: Cijk_Alik_Bljk_HB_MT64x16x16_SN_APM0_FL1_GRVW8_GSU5_LPB4_LRVW4_NLCA1_NLCB1_TT4_4_USFGRO0_VW4_WG16_4_4_WGM8
    SolutionIndex: 11
    SolutionNameMin: Cijk_Alik_Bljk_HB_MT16x16x24_SN_APM1_FL0_GRVW2_GSU1_LPB0_LRVW2_NLCA3_NLCB3_TT2_2_USFGRO1_VW2_WG8_8_1_WGM8
    SolutionIndex: 12
    SolutionNameMin: Cijk_Alik_Bljk_HB_MT64x32x16_SN_APM1_FL0_GRVW4_GSU1_LPB0_LRVW4_NLCA1_NLCB1_TT4_4_USFGRO0_VW4_WG16_8_1_WGM1
    SolutionIndex: 13
    SolutionNameMin: Cijk_Alik_Bljk_HB_MT64x64x16_SN_APM1_FL0_GRVW4_GSU1_LPB0_LRVW4_NLCA1_NLCB1_TT4_4_USFGRO0_VW4_WG16_16_1_WGM1
    SolutionIndex: 14
    SolutionNameMin: Cijk_Alik_Bljk_HB_MT128x128x32_SN_APM1_FL0_GRVW8_GSU1_LPB0_LRVW8_NLCA1_NLCB1_TT8_8_USFGRO0_VW8_WG16_16_1_WGM8
    SolutionIndex: 15
    SolutionNameMin: Cijk_Alik_Bljk_HB_MT32x32x32_SN_APM1_FL0_GRVW4_GSU1_LPB0_LRVW4_NLCA1_NLCB1_TT4_4_USFGRO0_VW4_WG8_8_1_WGM1
    SolutionIndex: 16
    SolutionNameMin: Cijk_Alik_Bljk_HB_MT16x16x32_SN_APM1_FL0_GRVW2_GSU1_LPB0_LRVW2_NLCA1_NLCB1_TT2_2_USFGRO1_VW2_WG8_8_1_WGM1
    SolutionIndex: 17
    SolutionNameMin: Cijk_Alik_Bljk_HB_MT128x64x8_SN_APM1_FL0_GRVW4_GSU1_LPB0_LRVW4_NLCA1_NLCB1_TT8_4_USFGRO0_VW4_WG16_16_1_WGM8
    SolutionIndex: 18
    SolutionNameMin: Cijk_Alik_Bljk_HB_MT32x16x24_SN_APM1_FL0_GRVW2_GSU1_LPB0_LRVW2_NLCA3_NLCB3_TT4_2_USFGRO1_VW2_WG8_8_1_WGM8
    SolutionIndex: 19
    SolutionNameMin: Cijk_Alik_Bljk_HB_MT32x32x16_SN_APM1_FL0_GRVW4_GSU1_LPB0_LRVW4_NLCA1_NLCB1_TT4_4_USFGRO0_VW4_WG8_8_1_WGM1
    SolutionIndex: 20
    SolutionNameMin: Cijk_Alik_Bljk_HB_MT16x16x16_SN_APM1_FL0_GRVW2_GSU1_LPB0_LRVW2_NLCA1_NLCB1_TT2_2_USFGRO1_VW2_WG8_8_1_WGM8
    SolutionIndex: 21
    SolutionNameMin: Cijk_Alik_Bljk_HB_MT16x16x16_SN_APM1_FL0_GRVW2_GSU1_LPB0_LRVW2_NLCA1_NLCB1_TT2_2_USFGRO1_VW2_WG8_8_1_WGM1
    SolutionIndex: 22
    SolutionNameMin: Cijk_Alik_Bljk_HB_MT16x16x24_SN_APM1_FL0_GRVW2_GSU1_LPB0_LRVW2_NLCA3_NLCB3_TT2_2_USFGRO1_VW2_WG8_8_1_WGM1
    SolutionIndex: 23
    SolutionNameMin: Cijk_Alik_Bljk_HB_MT64x16x16_SN_APM0_FL1_GRVW8_GSU3_LPB0_LRVW4_NLCA1_NLCB1_TT4_4_USFGRO0_VW4_WG16_4_4_WGM1
    SolutionIndex: 24
    SolutionNameMin: Cijk_Alik_Bljk_HB_MT32x32x24_SN_APM1_FL0_GRVW4_GSU1_LPB0_LRVW4_NLCA3_NLCB3_TT4_4_USFGRO0_VW4_WG8_8_1_WGM8
    SolutionIndex: 25
    SolutionNameMin: Cijk_Alik_Bljk_HB_MT32x32x8_SN_APM1_FL0_GRVW4_GSU1_LPB0_LRVW4_NLCA1_NLCB1_TT4_4_USFGRO0_VW4_WG8_8_1_WGM1
    SolutionIndex: 26
    SolutionNameMin: Cijk_Alik_Bljk_HB_MT32x32x24_SN_APM1_FL0_GRVW4_GSU1_LPB0_LRVW4_NLCA3_NLCB3_TT4_4_USFGRO0_VW4_WG8_8_1_WGM1
    SolutionIndex: 27
    SolutionNameMin: Cijk_Alik_Bljk_HB_MT32x16x16_SN_APM1_FL0_GRVW2_GSU1_LPB0_LRVW2_NLCA1_NLCB1_TT2_2_USFGRO1_VW2_WG16_8_1_WGM8
    SolutionIndex: 28
    SolutionNameMin: Cijk_Alik_Bljk_HB_MT32x32x32_SN_APM1_FL0_GRVW4_GSU1_LPB0_LRVW4_NLCA1_NLCB1_TT4_4_USFGRO0_VW4_WG8_8_1_WGM8
    SolutionIndex: 29
    SolutionNameMin: Cijk_Alik_Bljk_HB_MT64x32x16_SN_APM1_FL0_GRVW4_GSU1_LPB0_LRVW4_NLCA1_NLCB1_TT4_4_USFGRO0_VW4_WG16_8_1_WGM8
- - - [1024, 1024, 1, 3328]
    - [1, 9.687]
  - - [64, 6784, 1, 256]
    - [2, 2.76]
  - - [2944, 4288, 1, 1280]
    - [3, 19.016]
  - - [128, 256, 1, 1280]
    - [4, 0.693]
  - - [1760, 32, 1, 1760]
    - [4, 1.551]
  - - [2368, 5888, 1, 256]
    - [5, 13.111]
  - - [5888, 1856, 1, 256]
    - [5, 12.306]
  - - [704, 6784, 1, 256]
    - [6, 11.94]
  - - [512, 24000, 1, 1536]
    - [3, 18.976]
  - - [128, 6784, 1, 3328]
    - [7, 9.26]
  - - [5888, 1856, 1, 3328]
    - [3, 19.991]
  - - [5056, 704, 1, 256]
    - [2, 6.232]
  - - [2048, 400, 1, 512]
    - [8, 4.931]
  - - [5888, 2944, 1, 3328]
    - [3, 22.09]
  - - [1856, 4288, 1, 256]
    - [6, 13.127]
  - - [5056, 5056, 1, 3328]
    - [3, 21.404]
  - - [1408, 5888, 1, 1280]
    - [3, 17.044]
  - - [1024, 3584, 1, 3328]
    - [6, 16.478]
  - - [512, 48000, 1, 2048]
    - [3, 21.617]
  - - [448, 3584, 1, 3328]
    - [7, 11.68]
  - - [256, 4288, 1, 3328]
    - [2, 10.202]
  - - [5888, 1408, 1, 1280]
    - [3, 17.518]
  - - [704, 1856, 1, 3328]
    - [9, 11.519]
  - - [1024, 2368, 1, 256]
    - [5, 7.323]
  - - [5056, 6784, 1, 1280]
    - [6, 18.844]
  - - [1408, 64, 1, 1280]
    - [10, 2.086]
  - - [448, 1024, 1, 1280]
    - [7, 6.915]
  - - [4096, 32, 1, 4096]
    - [1, 4.703]
  - - [5056, 5056, 1, 1280]
    - [3, 20.819]
  - - [448, 5056, 1, 256]
    - [9, 7.126]
  - - [6784, 448, 1, 256]
    - [5, 9.049]
  - - [2368, 128, 1, 256]
    - [2, 1.57]
  - - [1760, 6400, 1, 1760]
    - [3, 19.963]
  - - [5888, 704, 1, 1280]
    - [6, 12.865]
  - - [64, 5056, 1, 256]
    - [8, 1.704]
  - - [6784, 4288, 1, 3328]
    - [3, 21.41]
  - - [1856, 2368, 1, 3328]
    - [6, 15.28]
  - - [5888, 2944, 1, 1280]
    - [3, 20.651]
  - - [5888, 1024, 1, 256]
    - [3, 11.307]
  - - [448, 64, 1, 1280]
    - [10, 0.727]
  - - [3072, 64, 1, 1024]
    - [2, 2.835]
  - - [16384, 3200, 1, 4096]
    - [3, 23.311]
  - - [2944, 64, 1, 256]
    - [11, 1.148]
  - - [1408, 2944, 1, 256]
    - [5, 9.65]
  - - [256, 1856, 1, 1280]
    - [2, 6.719]
  - - [6784, 5056, 1, 3328]
    - [3, 22.581]
  - - [5056, 5056, 1, 256]
    - [3, 17.706]
  - - [448, 704, 1, 1280]
    - [1, 5.588]
  - - [64, 1024, 1, 1280]
    - [10, 1.427]
  - - [1024, 3584, 1, 1280]
    - [3, 15.663]
  - - [2368, 2944, 1, 1280]
    - [3, 17.292]
  - - [448, 448, 1, 3328]
    - [1, 6.612]
  - - [6784, 6784, 1, 1280]
    - [3, 22.547]
  - - [1024, 256, 1, 3328]
    - [1, 6.965]
  - - [1408, 4288, 1, 1280]
    - [6, 15.411]
  - - [3584, 4288, 1, 1280]
    - [3, 20.515]
  - - [2368, 704, 1, 1280]
    - [7, 10.013]
  - - [5056, 4288, 1, 3328]
    - [3, 20.985]
  - - [3584, 2368, 1, 3328]
    - [3, 18.63]
  - - [64, 704, 1, 1280]
    - [4, 0.918]
  - - [4288, 256, 1, 256]
    - [12, 5.364]
  - - [6144, 32, 1, 2560]
    - [1, 5.626]
  - - [6784, 448, 1, 1280]
    - [6, 12.556]
  - - [128, 3584, 1, 1280]
    - [2, 7.344]
  - - [4288, 2944, 1, 256]
    - [3, 14.661]
  - - [1856, 64, 1, 1280]
    - [4, 2.582]
  - - [1760, 16, 1, 1760]
    - [10, 1.038]
  - - [6144, 24000, 1, 2560]
    - [3, 23.595]
  - - [5888, 64, 1, 3328]
    - [1, 8.174]
  - - [2944, 256, 1, 3328]
    - [1, 9.072]
  - - [5056, 2368, 1, 1280]
    - [3, 18.72]
  - - [448, 3584, 1, 1280]
    - [7, 9.197]
  - - [6784, 5888, 1, 256]
    - [3, 20.076]
  - - [256, 4288, 1, 1280]
    - [2, 9.599]
  - - [704, 128, 1, 1280]
    - [4, 1.694]
  - - [1408, 448, 1, 1280]
    - [7, 8.123]
  - - [1024, 1408, 1, 256]
    - [13, 5.807]
  - - [2368, 2368, 1, 3328]
    - [5, 16.638]
  - - [5056, 704, 1, 3328]
    - [14, 16.003]
  - - [1408, 1856, 1, 256]
    - [5, 8.597]
  - - [1408, 256, 1, 1280]
    - [15, 4.112]
  - - [3072, 128, 1, 1024]
    - [7, 2.978]
  - - [3584, 2368, 1, 1280]
    - [6, 16.791]
  - - [704, 5888, 1, 256]
    - [6, 9.409]
  - - [6784, 128, 1, 1280]
    - [9, 8.592]
  - - [2560, 1600, 1, 2560]
    - [6, 14.027]
  - - [6784, 64, 1, 256]
    - [12, 2.307]
  - - [6144, 5984, 1, 2048]
    - [3, 22.575]
  - - [3584, 704, 1, 3328]
    - [5, 14.041]
  - - [1408, 1408, 1, 256]
    - [7, 6.655]
  - - [1856, 128, 1, 256]
    - [2, 1.464]
  - - [2944, 64, 1, 1280]
    - [1, 3.312]
  - - [448, 4288, 1, 256]
    - [9, 6.924]
  - - [64, 3584, 1, 3328]
    - [1, 6.552]
  - - [704, 2368, 1, 1280]
    - [2, 10.159]
  - - [7680, 16, 1, 2560]
    - [16, 2.223]
  - - [1856, 2368, 1, 1280]
    - [3, 13.955]
  - - [2368, 128, 1, 3328]
    - [1, 8.195]
  - - [2944, 128, 1, 256]
    - [9, 2.018]
  - - [448, 1408, 1, 256]
    - [17, 2.583]
  - - [64, 5056, 1, 3328]
    - [1, 8.439]
  - - [1408, 1024, 1, 1280]
    - [13, 11.568]
  - - [2368, 256, 1, 1280]
    - [2, 7.645]
  - - [6784, 704, 1, 256]
    - [5, 11.759]
  - - [2048, 1600, 1, 512]
    - [5, 11.736]
  - - [2048, 7000, 1, 2048]
    - [3, 19.974]
  - - [256, 3584, 1, 3328]
    - [7, 9.721]
  - - [1408, 3584, 1, 256]
    - [3, 12.505]
  - - [3584, 4288, 1, 3328]
    - [3, 21.509]
  - - [5888, 1856, 1, 1280]
    - [3, 18.528]
  - - [5056, 1024, 1, 3328]
    - [3, 17.402]
  - - [5056, 64, 1, 1280]
    - [1, 5.663]
  - - [1024, 704, 1, 256]
    - [2, 4.214]
  - - [128, 448, 1, 256]
    - [18, 0.305]
  - - [2368, 3584, 1, 1280]
    - [3, 17.123]
  - - [1024, 256, 1, 256]
    - [19, 1.735]
  - - [448, 448, 1, 256]
    - [15, 1.19]
  - - [2944, 3584, 1, 3328]
    - [3, 19.853]
  - - [7680, 32, 1, 2560]
    - [1, 6.349]
  - - [256, 256, 1, 3328]
    - [10, 2.741]
  - - [128, 1024, 1, 3328]
    - [1, 5.15]
  - - [6784, 2944, 1, 256]
    - [3, 16.463]
  - - [64, 1856, 1, 1280]
    - [1, 2.439]
  - - [448, 256, 1, 256]
    - [20, 0.702]
  - - [4288, 2368, 1, 3328]
    - [3, 18.647]
  - - [1856, 2368, 1, 256]
    - [6, 10.301]
  - - [3584, 6784, 1, 3328]
    - [3, 21.838]
  - - [256, 1024, 1, 256]
    - [8, 1.449]
  - - [1024, 128, 1, 1280]
    - [1, 2.693]
  - - [3072, 32, 1, 1024]
    - [21, 1.651]
  - - [4288, 128, 1, 1280]
    - [1, 7.176]
  - - [5056, 4288, 1, 1280]
    - [3, 20.299]
  - - [5888, 64, 1, 256]
    - [7, 2.434]
  - - [6784, 1856, 1, 3328]
    - [3, 19.933]
  - - [1408, 5056, 1, 1280]
    - [3, 17.98]
  - - [1856, 256, 1, 1280]
    - [7, 6.953]
  - - [64, 5888, 1, 3328]
    - [1, 8.721]
  - - [6784, 5888, 1, 3328]
    - [3, 22.716]
  - - [8448, 12000, 1, 2816]
    - [3, 23.662]
  - - [448, 256, 1, 3328]
    - [1, 4.504]
  - - [4096, 800, 1, 1024]
    - [6, 13.083]
  - - [8192, 3200, 1, 2048]
    - [3, 21.521]
  - - [2368, 5056, 1, 1280]
    - [3, 18.194]
  - - [256, 1408, 1, 3328]
    - [1, 7.395]
  - - [6784, 128, 1, 3328]
    - [9, 9.431]
  - - [1024, 5056, 1, 1280]
    - [3, 15.817]
  - - [4288, 1024, 1, 256]
    - [13, 9.797]
  - - [2368, 1408, 1, 256]
    - [6, 8.806]
  - - [704, 704, 1, 3328]
    - [1, 7.425]
  - - [5888, 448, 1, 1280]
    - [5, 12.695]
  - - [3584, 256, 1, 3328]
    - [13, 10.502]
  - - [704, 5888, 1, 3328]
    - [6, 14.657]
  - - [1024, 6784, 1, 1280]
    - [3, 17.415]
  - - [128, 3584, 1, 3328]
    - [2, 6.99]
  - - [128, 704, 1, 1280]
    - [4, 1.597]
  - - [3584, 2944, 1, 1280]
    - [3, 19.373]
  - - [1856, 128, 1, 3328]
    - [1, 7.823]
  - - [128, 2944, 1, 1280]
    - [7, 3.107]
  - - [512, 24000, 1, 2048]
    - [3, 19.289]
  - - [448, 1856, 1, 1280]
    - [13, 7.791]
  - - [1408, 5056, 1, 3328]
    - [3, 18.967]
  - - [1856, 1856, 1, 3328]
    - [3, 16.061]
  - - [3584, 128, 1, 256]
    - [9, 2.679]
  - - [2560, 800, 1, 2560]
    - [7, 11.735]
  - - [448, 1408, 1, 3328]
    - [1, 9.907]
  - - [2368, 2368, 1, 256]
    - [7, 9.845]
  - - [4288, 4288, 1, 1280]
    - [3, 19.996]
  - - [64, 448, 1, 1280]
    - [22, 0.532]
  - - [5888, 1024, 1, 1280]
    - [3, 15.024]
  - - [512, 48000, 1, 2560]
    - [3, 21.817]
  - - [8448, 16, 1, 2816]
    - [23, 3.628]
  - - [704, 6784, 1, 3328]
    - [6, 16.382]
  - - [2560, 6400, 1, 2560]
    - [3, 20.756]
  - - [5056, 1024, 1, 1280]
    - [3, 15.608]
  - - [448, 5888, 1, 3328]
    - [6, 13.984]
  - - [1024, 2944, 1, 1280]
    - [14, 12.296]
  - - [5056, 5888, 1, 1280]
    - [3, 21.042]
  - - [448, 6784, 1, 256]
    - [6, 9.437]
  - - [256, 3584, 1, 256]
    - [7, 4.761]
  - - [256, 2944, 1, 3328]
    - [1, 9.12]
  - - [256, 448, 1, 256]
    - [20, 0.791]
  - - [6144, 16, 1, 2560]
    - [10, 2.645]
  - - [3584, 5888, 1, 256]
    - [3, 16.999]
  - - [2944, 3584, 1, 256]
    - [6, 12.273]
  - - [1408, 704, 1, 256]
    - [7, 4.19]
  - - [6784, 1024, 1, 3328]
    - [3, 18.748]
  - - [6784, 2944, 1, 3328]
    - [6, 18.607]
  - - [2944, 5056, 1, 3328]
    - [3, 21.254]
  - - [64, 64, 1, 3328]
    - [10, 0.226]
  - - [6784, 2368, 1, 1280]
    - [3, 19.562]
  - - [4288, 5888, 1, 1280]
    - [3, 20.578]
  - - [4288, 4288, 1, 256]
    - [5, 15.233]
  - - [8448, 32, 1, 2816]
    - [1, 6.107]
  - - [448, 2944, 1, 3328]
    - [13, 11.949]
  - - [4288, 1856, 1, 1280]
    - [3, 16.443]
  - - [1856, 2944, 1, 3328]
    - [3, 18.629]
  - - [256, 6784, 1, 3328]
    - [5, 12.697]
  - - [64, 5888, 1, 256]
    - [2, 2.685]
  - - [5056, 1024, 1, 256]
    - [3, 12.486]
  - - [704, 64, 1, 3328]
    - [10, 2.286]
  - - [5056, 1856, 1, 3328]
    - [3, 20.091]
  - - [1856, 1408, 1, 256]
    - [6, 4.848]
  - - [448, 2368, 1, 1280]
    - [7, 9.371]
  - - [1408, 128, 1, 1280]
    - [1, 3.252]
  - - [4096, 7000, 1, 4096]
    - [3, 22.495]
  - - [5056, 256, 1, 3328]
    - [1, 10.522]
  - - [1024, 5888, 1, 1280]
    - [6, 15.291]
  - - [6144, 24000, 1, 2048]
    - [3, 23.569]
  - - [64, 128, 1, 256]
    - [1, 0.051]
  - - [128, 1856, 1, 1280]
    - [1, 4.072]
  - - [5056, 3584, 1, 256]
    - [3, 14.797]
  - - [1856, 1024, 1, 1280]
    - [13, 11.264]
  - - [1856, 1856, 1, 1280]
    - [5, 14.064]
  - - [4096, 400, 1, 1024]
    - [5, 10.161]
  - - [3072, 24000, 1, 1024]
    - [3, 22.942]
  - - [128, 4288, 1, 3328]
    - [1, 8.143]
  - - [1856, 1024, 1, 3328]
    - [5, 13.957]
  - - [256, 2368, 1, 256]
    - [7, 3.599]
  - - [1024, 448, 1, 3328]
    - [24, 6.922]
  - - [1856, 704, 1, 1280]
    - [9, 10.797]
  - - [5888, 5888, 1, 3328]
    - [3, 22.885]
  - - [6784, 1024, 1, 256]
    - [3, 13.979]
  - - [5056, 5888, 1, 3328]
    - [3, 22.034]
  - - [1856, 1024, 1, 256]
    - [2, 7.808]
  - - [512, 48000, 1, 1536]
    - [3, 21.333]
  - - [5056, 1408, 1, 3328]
    - [3, 19.257]
  - - [8448, 5984, 1, 2816]
    - [3, 23.172]
  - - [1024, 1024, 1, 1280]
    - [2, 9.069]
  - - [4288, 1024, 1, 3328]
    - [3, 15.547]
  - - [2048, 128, 1, 2048]
    - [7, 4.679]
  - - [1024, 24000, 1, 2560]
    - [3, 21.87]
  - - [2944, 1408, 1, 3328]
    - [5, 14.204]
  - - [2944, 4288, 1, 3328]
    - [3, 20.405]
  - - [256, 2944, 1, 256]
    - [12, 3.312]
  - - [5056, 2944, 1, 256]
    - [3, 14.526]
  - - [1024, 700, 1, 512]
    - [8, 4.725]
  - - [2368, 1856, 1, 256]
    - [3, 10.751]
  - - [128, 448, 1, 1280]
    - [23, 0.951]
  - - [128, 6784, 1, 1280]
    - [13, 8.579]
  - - [1408, 3584, 1, 3328]
    - [3, 17.869]
  - - [2368, 6784, 1, 256]
    - [3, 15.37]
  - - [5056, 1408, 1, 1280]
    - [3, 17.948]
  - - [704, 3584, 1, 1280]
    - [6, 12.302]
  - - [1408, 5888, 1, 3328]
    - [3, 18.186]
  - - [1856, 5056, 1, 256]
    - [3, 14.544]
  - - [6784, 6784, 1, 256]
    - [3, 19.068]
  - - [1408, 704, 1, 3328]
    - [1, 10.669]
  - - [128, 5888, 1, 1280]
    - [13, 8.103]
  - - [2368, 4288, 1, 1280]
    - [3, 17.52]
  - - [3584, 1856, 1, 1280]
    - [6, 16.32]
  - - [704, 1408, 1, 3328]
    - [1, 10.66]
  - - [704, 64, 1, 1280]
    - [4, 0.97]
  - - [5888, 5056, 1, 256]
    - [3, 18.716]
  - - [8448, 48000, 1, 2816]
    - [3, 24.027]
  - - [3584, 448, 1, 256]
    - [5, 5.765]
  - - [3584, 3584, 1, 1280]
    - [3, 19.508]
  - - [7680, 64, 1, 2560]
    - [7, 9.309]
  - - [256, 6784, 1, 256]
    - [13, 7.338]
  - - [1856, 3584, 1, 3328]
    - [5, 17.661]
  - - [5056, 256, 1, 1280]
    - [9, 10.156]
  - - [2560, 32, 1, 2560]
    - [23, 3.108]
  - - [3584, 3584, 1, 256]
    - [3, 15.622]
  - - [6784, 4288, 1, 1280]
    - [3, 21.11]
  - - [704, 5056, 1, 256]
    - [3, 10.012]
  - - [6784, 128, 1, 256]
    - [7, 5.002]
  - - [64, 1408, 1, 3328]
    - [10, 3.524]
  - - [704, 448, 1, 256]
    - [25, 1.872]
  - - [2944, 2368, 1, 1280]
    - [3, 17.78]
  - - [448, 64, 1, 3328]
    - [10, 1.155]
  - - [6784, 3584, 1, 256]
    - [3, 16.107]
  - - [256, 1856, 1, 3328]
    - [2, 7.388]
  - - [128, 64, 1, 1280]
    - [4, 0.193]
  - - [128, 1408, 1, 256]
    - [21, 1.196]
  - - [64, 128, 1, 3328]
    - [10, 0.404]
  - - [2944, 2944, 1, 3328]
    - [3, 19.041]
  - - [5056, 6784, 1, 256]
    - [3, 18.286]
  - - [1408, 4288, 1, 3328]
    - [3, 15.923]
  - - [6784, 256, 1, 1280]
    - [17, 11.864]
  - - [2368, 704, 1, 3328]
    - [7, 12.001]
  - - [128, 4288, 1, 256]
    - [26, 3.076]
  - - [3584, 6784, 1, 256]
    - [3, 16.81]
  - - [128, 128, 1, 3328]
    - [10, 0.84]
  - - [5056, 1856, 1, 256]
    - [3, 14.7]
  - - [4608, 5984, 1, 1536]
    - [3, 20.923]
  - - [256, 128, 1, 256]
    - [21, 0.184]
  - - [1760, 3200, 1, 1760]
    - [3, 19.194]
  - - [4096, 1600, 1, 1024]
    - [3, 16.223]
  - - [704, 4288, 1, 256]
    - [7, 8.619]
  - - [256, 448, 1, 3328]
    - [4, 4.375]
  - - [1408, 6784, 1, 1280]
    - [3, 18.724]
  - - [7680, 24000, 1, 2560]
    - [3, 23.881]
  - - [64, 2368, 1, 1280]
    - [1, 2.848]
  - - [4608, 48000, 1, 1536]
    - [3, 23.728]
  - - [6144, 48000, 1, 2048]
    - [3, 23.969]
  - - [64, 6784, 1, 3328]
    - [7, 6.528]
  - - [2944, 256, 1, 1280]
    - [7, 7.592]
  - - [2048, 16, 1, 2048]
    - [4, 0.862]
  - - [1024, 24000, 1, 1536]
    - [3, 21.399]
  - - [5056, 2368, 1, 3328]
    - [3, 19.416]
  - - [2944, 4288, 1, 256]
    - [5, 13.999]
  - - [1408, 3584, 1, 1280]
    - [3, 15.579]
  - - [2368, 64, 1, 256]
    - [16, 0.861]
  - - [256, 256, 1, 256]
    - [20, 0.425]
  - - [704, 128, 1, 3328]
    - [4, 3.969]
  - - [8192, 1600, 1, 2048]
    - [3, 20.507]
  - - [1856, 704, 1, 256]
    - [9, 5.221]
  - - [1408, 448, 1, 3328]
    - [1, 9.441]
  - - [512, 24000, 1, 2560]
    - [3, 19.454]
  - - [2368, 6784, 1, 3328]
    - [3, 20.277]
  - - [5056, 704, 1, 1280]
    - [5, 14.317]
  - - [1856, 4288, 1, 3328]
    - [3, 17.414]
  - - [1408, 5888, 1, 256]
    - [3, 13.442]
  - - [4288, 64, 1, 1280]
    - [1, 4.295]
  - - [256, 64, 1, 256]
    - [7, 0.087]
  - - [704, 1856, 1, 256]
    - [9, 5.971]
  - - [2560, 64, 1, 2560]
    - [1, 4.694]
  - - [3584, 704, 1, 1280]
    - [6, 11.961]
  - - [256, 2368, 1, 1280]
    - [2, 7.567]
  - - [3584, 448, 1, 3328]
    - [6, 11.642]
  - - [704, 2368, 1, 3328]
    - [17, 12.136]
  - - [2944, 448, 1, 256]
    - [9, 5.636]
  - - [448, 5056, 1, 3328]
    - [9, 12.47]
  - - [2368, 128, 1, 1280]
    - [1, 4.747]
  - - [4288, 448, 1, 256]
    - [7, 7.426]
  - - [448, 5888, 1, 256]
    - [7, 8.627]
  - - [64, 5056, 1, 1280]
    - [1, 5.603]
  - - [2048, 3200, 1, 512]
    - [3, 15.532]
  - - [5888, 2368, 1, 256]
    - [6, 13.877]
  - - [704, 448, 1, 3328]
    - [1, 7.558]
  - - [6784, 704, 1, 3328]
    - [3, 16.621]
  - - [1408, 2944, 1, 3328]
    - [6, 14.731]
  - - [4608, 12000, 1, 1536]
    - [3, 22.697]
  - - [64, 1024, 1, 256]
    - [21, 0.369]
  - - [2368, 448, 1, 1280]
    - [7, 9.583]
  - - [128, 3584, 1, 256]
    - [2, 3.305]
  - - [1856, 448, 1, 3328]
    - [13, 10.089]
  - - [128, 5056, 1, 256]
    - [7, 3.096]
  - - [2368, 704, 1, 256]
    - [7, 7.009]
  - - [3584, 2368, 1, 256]
    - [5, 14.388]
  - - [5888, 5056, 1, 1280]
    - [3, 21.003]
  - - [128, 1024, 1, 1280]
    - [1, 2.487]
  - - [8448, 24000, 1, 2816]
    - [3, 23.825]
  - - [64, 704, 1, 256]
    - [2, 0.279]
  - - [4288, 256, 1, 1280]
    - [7, 9.25]
  - - [3584, 3584, 1, 3328]
    - [5, 17.604]
  - - [704, 704, 1, 256]
    - [7, 2.681]
  - - [5888, 6784, 1, 256]
    - [3, 19.833]
  - - [4288, 2944, 1, 3328]
    - [3, 20.112]
  - - [1856, 64, 1, 256]
    - [21, 0.761]
  - - [1024, 16, 1, 500000]
    - [0, 0.0]
  - - [4288, 128, 1, 3328]
    - [1, 8.514]
  - - [7680, 128, 1, 2560]
    - [1, 9.674]
  - - [256, 5056, 1, 1280]
    - [13, 10.327]
  - - [6784, 5888, 1, 1280]
    - [3, 22.318]
  - - [2048, 800, 1, 512]
    - [6, 8.825]
  - - [704, 128, 1, 256]
    - [20, 0.635]
  - - [5888, 4288, 1, 1280]
    - [3, 20.337]
  - - [1024, 24000, 1, 2048]
    - [3, 21.874]
  - - [448, 256, 1, 1280]
    - [1, 2.296]
  - - [1024, 256, 1, 1280]
    - [2, 3.99]
  - - [256, 1408, 1, 1280]
    - [2, 5.376]
  - - [3072, 16, 1, 1024]
    - [23, 0.876]
  - - [1408, 1856, 1, 1280]
    - [5, 12.352]
  - - [5888, 448, 1, 3328]
    - [5, 14.621]
  - - [704, 5888, 1, 1280]
    - [6, 12.724]
  - - [1024, 6784, 1, 3328]
    - [3, 18.295]
  - - [704, 2944, 1, 1280]
    - [2, 10.003]
  - - [6784, 64, 1, 3328]
    - [2, 8.723]
  - - [5056, 2944, 1, 3328]
    - [3, 21.117]
  - - [448, 128, 1, 256]
    - [20, 0.369]
  - - [1408, 1408, 1, 3328]
    - [2, 11.941]
  - - [1856, 128, 1, 1280]
    - [1, 4.328]
  - - [448, 4288, 1, 1280]
    - [7, 11.444]
  - - [64, 3584, 1, 256]
    - [12, 1.342]
  - - [128, 2944, 1, 3328]
    - [1, 8.265]
  - - [3584, 704, 1, 256]
    - [6, 7.664]
  - - [2944, 448, 1, 3328]
    - [7, 10.781]
  - - [3584, 1408, 1, 3328]
    - [3, 17.886]
  - - [2368, 1024, 1, 1280]
    - [7, 11.788]
  - - [2944, 6784, 1, 1280]
    - [3, 20.528]
  - - [1856, 6784, 1, 256]
    - [6, 14.893]
  - - [4288, 448, 1, 3328]
    - [5, 14.044]
  - - [4288, 3584, 1, 1280]
    - [3, 20.343]
  - - [6144, 12000, 1, 2048]
    - [3, 23.248]
  - - [8192, 800, 1, 2048]
    - [3, 17.545]
  - - [5888, 1024, 1, 3328]
    - [3, 16.394]
  - - [704, 6784, 1, 1280]
    - [3, 14.824]
  - - [5888, 128, 1, 256]
    - [9, 3.574]
  - - [4096, 16, 1, 4096]
    - [10, 2.646]
  - - [704, 5056, 1, 1280]
    - [5, 14.328]
  - - [64, 704, 1, 3328]
    - [4, 2.663]
  - - [2944, 1856, 1, 256]
    - [3, 12.881]
  - - [5056, 64, 1, 256]
    - [19, 1.951]
  - - [3584, 5056, 1, 256]
    - [6, 15.348]
  - - [5888, 5056, 1, 3328]
    - [3, 22.02]
  - - [128, 5056, 1, 3328]
    - [1, 9.894]
  - - [3584, 6784, 1, 1280]
    - [3, 21.345]
  - - [1856, 5888, 1, 256]
    - [9, 12.741]
  - - [64, 448, 1, 3328]
    - [10, 1.262]
  - - [4288, 4288, 1, 3328]
    - [3, 21.288]
  - - [4288, 1408, 1, 1280]
    - [3, 15.406]
  - - [64, 1856, 1, 256]
    - [22, 0.957]
  - - [4288, 2368, 1, 256]
    - [6, 11.953]
  - - [2944, 5056, 1, 1280]
    - [3, 20.393]
  - - [256, 4288, 1, 256]
    - [7, 4.656]
  - - [6784, 2368, 1, 3328]
    - [3, 20.465]
  - - [256, 1024, 1, 1280]
    - [1, 3.91]
  - - [4288, 1856, 1, 3328]
    - [3, 17.397]
  - - [1856, 2944, 1, 1280]
    - [3, 16.552]
  - - [2048, 1600, 1, 2048]
    - [5, 14.394]
  - - [3584, 64, 1, 1280]
    - [1, 4.757]
  - - [4288, 6784, 1, 3328]
    - [3, 21.496]
  - - [3584, 1024, 1, 1280]
    - [6, 15.186]
  - - [1024, 4288, 1, 256]
    - [6, 11.166]
  - - [5888, 3584, 1, 3328]
    - [3, 22.228]
  - - [5056, 3584, 1, 3328]
    - [3, 20.854]
  - - [1408, 128, 1, 3328]
    - [1, 5.556]
  - - [2368, 1408, 1, 1280]
    - [5, 13.552]
  - - [5056, 2944, 1, 1280]
    - [3, 19.433]
  - - [3584, 256, 1, 256]
    - [5, 3.961]
  - - [1024, 6784, 1, 256]
    - [3, 13.346]
  - - [3584, 2944, 1, 256]
    - [3, 12.65]
  - - [448, 128, 1, 3328]
    - [4, 3.214]
  - - [3584, 1408, 1, 1280]
    - [3, 15.672]
  - - [64, 4288, 1, 3328]
    - [1, 6.864]
  - - [5056, 6784, 1, 3328]
    - [3, 22.458]
  - - [128, 2944, 1, 256]
    - [2, 2.047]
  - - [3584, 4288, 1, 256]
    - [5, 14.739]
  - - [1856, 6784, 1, 3328]
    - [3, 20.325]
  - - [3584, 128, 1, 3328]
    - [7, 8.873]
  - - [2368, 64, 1, 3328]
    - [1, 5.878]
  - - [1024, 448, 1, 1280]
    - [2, 6.863]
  - - [5056, 1408, 1, 256]
    - [3, 13.99]
  - - [64, 256, 1, 1280]
    - [10, 0.344]
  - - [3584, 1024, 1, 256]
    - [3, 10.498]
  - - [256, 704, 1, 256]
    - [24, 0.994]
  - - [5888, 5888, 1, 256]
    - [3, 18.293]
  - - [4288, 1024, 1, 1280]
    - [13, 13.179]
  - - [5888, 128, 1, 3328]
    - [1, 9.398]
  - - [448, 6784, 1, 3328]
    - [3, 14.209]
  - - [2944, 1408, 1, 1280]
    - [6, 13.488]
  - - [2944, 1856, 1, 3328]
    - [3, 18.349]
  - - [128, 1024, 1, 256]
    - [27, 0.835]
  - - [64, 64, 1, 256]
    - [10, 0.027]
  - - [3584, 5888, 1, 1280]
    - [3, 20.889]
  - - [6784, 1856, 1, 1280]
    - [3, 19.142]
  - - [5888, 256, 1, 3328]
    - [7, 11.168]
  - - [1856, 5888, 1, 3328]
    - [3, 20.467]
  - - [3584, 1408, 1, 256]
    - [3, 12.962]
  - - [64, 448, 1, 256]
    - [11, 0.137]
  - - [704, 3584, 1, 3328]
    - [6, 13.207]
  - - [4096, 3200, 1, 1024]
    - [3, 18.85]
  - - [5056, 448, 1, 1280]
    - [2, 11.227]
  - - [3584, 1856, 1, 3328]
    - [3, 17.995]
  - - [1408, 704, 1, 1280]
    - [7, 8.621]
  - - [2944, 1024, 1, 256]
    - [3, 9.268]
  - - [448, 1408, 1, 1280]
    - [2, 7.993]
  - - [2368, 4288, 1, 3328]
    - [3, 18.642]
  - - [1024, 1408, 1, 1280]
    - [13, 11.262]
  - - [256, 128, 1, 1280]
    - [4, 0.956]
  - - [704, 1408, 1, 1280]
    - [2, 8.746]
  - - [6784, 5056, 1, 256]
    - [3, 19.177]
  - - [3584, 5056, 1, 3328]
    - [3, 20.78]
  - - [4288, 5888, 1, 256]
    - [5, 15.831]
  - - [448, 2944, 1, 256]
    - [9, 6.168]
  - - [2944, 6784, 1, 256]
    - [3, 16.338]
  - - [2368, 2368, 1, 1280]
    - [6, 15.823]
  - - [1856, 3584, 1, 1280]
    - [14, 14.759]
  - - [64, 2944, 1, 256]
    - [2, 1.201]
  - - [5056, 3584, 1, 1280]
    - [3, 19.848]
  - - [256, 5888, 1, 256]
    - [5, 5.497]
  - - [128, 256, 1, 3328]
    - [10, 1.653]
  - - [1856, 1408, 1, 3328]
    - [5, 14.868]
  - - [1024, 4288, 1, 3328]
    - [3, 15.643]
  - - [448, 2368, 1, 256]
    - [2, 5.259]
  - - [64, 1408, 1, 1280]
    - [10, 2.337]
  - - [64, 6784, 1, 1280]
    - [7, 6.875]
  - - [2944, 2368, 1, 3328]
    - [3, 18.869]
  - - [704, 4288, 1, 3328]
    - [6, 13.389]
  - - [1408, 128, 1, 256]
    - [26, 1.01]
  - - [1024, 1856, 1, 1280]
    - [6, 11.307]
  - - [2048, 6400, 1, 2048]
    - [3, 20.523]
  - - [512, 48000, 1, 2816]
    - [3, 22.18]
  - - [5124, 9124, 1, 2560]
    - [3, 22.294]
  - - [128, 2368, 1, 3328]
    - [1, 7.675]
  - - [1024, 5888, 1, 256]
    - [5, 11.175]
  - - [64, 2944, 1, 1280]
    - [1, 3.604]
  - - [5056, 64, 1, 3328]
    - [1, 8.945]
  - - [1408, 2368, 1, 256]
    - [5, 10.018]
  - - [2944, 704, 1, 3328]
    - [13, 11.466]
  - - [64, 128, 1, 1280]
    - [10, 0.185]
  - - [1024, 8, 1, 500000]
    - [0, 0.0]
  - - [2944, 2944, 1, 1280]
    - [3, 18.077]
  - - [6784, 256, 1, 3328]
    - [5, 12.672]
  - - [1408, 5056, 1, 256]
    - [3, 13.812]
  - - [5056, 128, 1, 3328]
    - [1, 9.494]
  - - [128, 128, 1, 1280]
    - [4, 0.261]
  - - [448, 704, 1, 256]
    - [7, 1.546]
  - - [1856, 256, 1, 3328]
    - [1, 8.988]
  - - [2944, 128, 1, 3328]
    - [1, 8.029]
  - - [448, 1024, 1, 3328]
    - [1, 8.473]
  - - [256, 448, 1, 1280]
    - [23, 2.383]
  - - [4608, 24000, 1, 1536]
    - [3, 23.408]
  - - [704, 256, 1, 1280]
    - [1, 2.835]
  - - [64, 2368, 1, 3328]
    - [1, 5.603]
  - - [256, 704, 1, 3328]
    - [1, 4.912]
  - - [4096, 64, 1, 4096]
    - [1, 6.32]
  - - [1408, 4288, 1, 256]
    - [5, 11.462]
  - - [5888, 2368, 1, 1280]
    - [3, 19.17]
  - - [128, 256, 1, 256]
    - [20, 0.181]
  - - [256, 64, 1, 1280]
    - [10, 0.354]
  - - [2368, 5888, 1, 1280]
    - [3, 18.443]
  - - [5888, 256, 1, 1280]
    - [7, 9.793]
  - - [1760, 128, 1, 1760]
    - [1, 4.435]
  - - [704, 1024, 1, 1280]
    - [2, 9.427]
  - - [2368, 1856, 1, 3328]
    - [6, 15.5]
  - - [2944, 704, 1, 256]
    - [9, 7.429]
  - - [2368, 6784, 1, 1280]
    - [3, 19.607]
  - - [2368, 1024, 1, 3328]
    - [5, 13.822]
  - - [1856, 4288, 1, 1280]
    - [3, 16.362]
  - - [704, 3584, 1, 256]
    - [6, 7.821]
  - - [704, 2944, 1, 3328]
    - [2, 12.224]
  - - [1856, 5056, 1, 3328]
    - [3, 20.093]
  - - [3584, 5056, 1, 1280]
    - [3, 19.533]
  - - [2944, 1024, 1, 3328]
    - [3, 13.907]
  - - [2368, 256, 1, 256]
    - [7, 3.674]
  - - [1408, 6784, 1, 256]
    - [3, 15.776]
  - - [6784, 1408, 1, 3328]
    - [3, 20.949]
  - - [1024, 2368, 1, 1280]
    - [2, 11.687]
  - - [704, 64, 1, 256]
    - [22, 0.309]
  - - [256, 2368, 1, 3328]
    - [1, 9.481]
  - - [6784, 2944, 1, 1280]
    - [3, 20.31]
  - - [3584, 448, 1, 1280]
    - [6, 9.351]
  - - [2944, 6784, 1, 3328]
    - [3, 20.971]
  - - [448, 5056, 1, 1280]
    - [9, 11.741]
  - - [64, 2944, 1, 3328]
    - [10, 4.959]
  - - [4288, 704, 1, 256]
    - [6, 7.805]
  - - [64, 64, 1, 1280]
    - [4, 0.094]
  - - [5888, 704, 1, 256]
    - [5, 10.003]
  - - [256, 5888, 1, 3328]
    - [1, 10.832]
  - - [6784, 4288, 1, 256]
    - [3, 17.572]
  - - [5888, 256, 1, 256]
    - [5, 5.567]
  - - [6784, 1024, 1, 1280]
    - [3, 17.074]
  - - [704, 448, 1, 1280]
    - [1, 4.771]
  - - [512, 16, 1, 500000]
    - [0, 0.0]
  - - [128, 64, 1, 3328]
    - [4, 0.301]
  - - [448, 64, 1, 256]
    - [20, 0.227]
  - - [2944, 704, 1, 1280]
    - [9, 10.845]
  - - [6784, 3584, 1, 1280]
    - [3, 20.914]
  - - [1024, 704, 1, 1280]
    - [7, 9.243]
  - - [1408, 2944, 1, 1280]
    - [9, 12.788]
  - - [256, 1856, 1, 256]
    - [2, 3.132]
  - - [2048, 800, 1, 2048]
    - [17, 10.553]
  - - [1408, 2368, 1, 3328]
    - [3, 14.811]
  - - [128, 1408, 1, 3328]
    - [1, 6.139]
  - - [2368, 2944, 1, 256]
    - [3, 13.023]
  - - [704, 1856, 1, 1280]
    - [9, 10.629]
  - - [1408, 256, 1, 3328]
    - [1, 7.447]
  - - [2944, 5888, 1, 256]
    - [3, 16.898]
  - - [3584, 1856, 1, 256]
    - [3, 13.48]
  - - [2368, 448, 1, 256]
    - [2, 4.858]
  - - [4288, 256, 1, 3328]
    - [7, 10.05]
  - - [1408, 64, 1, 256]
    - [20, 0.444]
  - - [2560, 16, 1, 2560]
    - [10, 1.297]
  - - [4288, 2944, 1, 1280]
    - [3, 18.567]
  - - [5056, 448, 1, 3328]
    - [9, 12.451]
  - - [1024, 64, 1, 256]
    - [20, 0.296]
  - - [64, 2368, 1, 256]
    - [22, 1.099]
  - - [4288, 5056, 1, 3328]
    - [3, 20.977]
  - - [2944, 256, 1, 256]
    - [9, 3.958]
  - - [1024, 128, 1, 3328]
    - [1, 4.349]
  - - [256, 5056, 1, 3328]
    - [9, 11.379]
  - - [5056, 2368, 1, 256]
    - [6, 14.211]
  - - [4288, 704, 1, 3328]
    - [3, 14.041]
  - - [448, 3584, 1, 256]
    - [7, 7.075]
  - - [2368, 64, 1, 1280]
    - [1, 2.616]
  - - [1408, 448, 1, 256]
    - [7, 4.132]
  - - [1024, 1408, 1, 3328]
    - [9, 11.872]
  - - [2944, 5888, 1, 1280]
    - [3, 21.469]
  - - [5888, 3584, 1, 256]
    - [3, 18.306]
  - - [1408, 1856, 1, 3328]
    - [5, 14.213]
  - - [6784, 1408, 1, 1280]
    - [3, 18.532]
  - - [704, 2944, 1, 256]
    - [9, 6.79]
  - - [4288, 64, 1, 256]
    - [2, 1.454]
  - - [2944, 5888, 1, 3328]
    - [3, 21.819]
  - - [64, 4288, 1, 1280]
    - [1, 4.444]
  - - [6784, 64, 1, 1280]
    - [2, 6.725]
  - - [1408, 6784, 1, 3328]
    - [3, 20.352]
  - - [1408, 64, 1, 3328]
    - [10, 4.111]
  - - [1408, 1408, 1, 1280]
    - [17, 9.685]
  - - [16384, 400, 1, 4096]
    - [5, 15.294]
  - - [448, 4288, 1, 3328]
    - [6, 13.892]
  - - [704, 2368, 1, 256]
    - [2, 7.223]
  - - [2944, 448, 1, 1280]
    - [9, 10.538]
  - - [5888, 2368, 1, 3328]
    - [3, 19.759]
  - - [5124, 9124, 1, 1760]
    - [3, 21.881]
  - - [4288, 5056, 1, 256]
    - [5, 15.517]
  - - [4288, 448, 1, 1280]
    - [7, 11.276]
  - - [5888, 704, 1, 3328]
    - [6, 14.471]
  - - [4288, 3584, 1, 3328]
    - [3, 21.927]
  - - [128, 2368, 1, 256]
    - [2, 1.724]
  - - [1408, 1024, 1, 256]
    - [9, 6.308]
  - - [8192, 400, 1, 2048]
    - [5, 13.17]
  - - [128, 64, 1, 256]
    - [23, 0.047]
  - - [2560, 7000, 1, 2560]
    - [3, 20.33]
  - - [448, 1024, 1, 256]
    - [7, 3.011]
  - - [6784, 6784, 1, 3328]
    - [3, 22.97]
  - - [704, 5056, 1, 3328]
    - [3, 15.909]
  - - [1024, 64, 1, 1280]
    - [10, 1.504]
  - - [64, 1024, 1, 3328]
    - [10, 3.069]
  - - [2368, 2944, 1, 3328]
    - [3, 18.92]
  - - [448, 448, 1, 1280]
    - [1, 3.325]
  - - [2368, 3584, 1, 256]
    - [3, 14.223]
  - - [1856, 448, 1, 256]
    - [7, 4.874]
  - - [128, 5056, 1, 1280]
    - [1, 7.541]
  - - [5124, 9124, 1, 4096]
    - [3, 22.406]
  - - [7680, 48000, 1, 2560]
    - [3, 23.907]
  - - [1024, 48000, 1, 2816]
    - [3, 23.544]
  - - [1856, 1856, 1, 256]
    - [5, 8.487]
  - - [4288, 1408, 1, 3328]
    - [3, 16.278]
  - - [3584, 64, 1, 3328]
    - [1, 7.096]
  - - [5124, 9124, 1, 2048]
    - [3, 22.267]
  - - [4288, 5056, 1, 1280]
    - [3, 20.216]
  - - [5888, 6784, 1, 1280]
    - [3, 22.023]
  - - [256, 1024, 1, 3328]
    - [1, 7.335]
  - - [1760, 1600, 1, 1760]
    - [5, 13.824]
  - - [1856, 64, 1, 3328]
    - [1, 4.993]
  - - [5888, 1408, 1, 3328]
    - [3, 18.334]
  - - [256, 5056, 1, 256]
    - [2, 6.271]
  - - [7680, 12000, 1, 2560]
    - [3, 23.688]
  - - [1024, 128, 1, 256]
    - [22, 0.828]
  - - [1408, 256, 1, 256]
    - [2, 2.397]
  - - [2368, 5056, 1, 256]
    - [3, 13.973]
  - - [256, 1408, 1, 256]
    - [28, 2.191]
  - - [1024, 5056, 1, 256]
    - [3, 12.318]
  - - [2368, 1408, 1, 3328]
    - [3, 15.535]
  - - [1024, 48000, 1, 1536]
    - [6, 19.483]
  - - [5888, 448, 1, 256]
    - [5, 9.271]
  - - [2560, 3200, 1, 2560]
    - [3, 17.759]
  - - [6784, 5056, 1, 1280]
    - [3, 21.919]
  - - [1024, 48000, 1, 2560]
    - [3, 23.461]
  - - [4608, 32, 1, 1536]
    - [1, 3.186]
  - - [4288, 6784, 1, 1280]
    - [3, 21.007]
  - - [128, 704, 1, 256]
    - [16, 0.587]
  - - [2368, 448, 1, 3328]
    - [1, 11.403]
  - - [128, 5888, 1, 3328]
    - [1, 10.286]
  - - [16384, 800, 1, 4096]
    - [3, 18.797]
  - - [448, 128, 1, 1280]
    - [10, 1.604]
  - - [1024, 64, 1, 3328]
    - [10, 3.46]
  - - [3072, 48000, 1, 1024]
    - [3, 23.554]
  - - [64, 3584, 1, 1280]
    - [2, 4.031]
  - - [6784, 1408, 1, 256]
    - [3, 15.996]
  - - [5888, 4288, 1, 256]
    - [3, 17.421]
  - - [5056, 5888, 1, 256]
    - [3, 18.25]
  - - [2368, 1024, 1, 256]
    - [2, 7.669]
  - - [1856, 6784, 1, 1280]
    - [3, 19.341]
  - - [3584, 128, 1, 1280]
    - [2, 7.208]
  - - [4288, 128, 1, 256]
    - [2, 2.626]
  - - [6784, 1856, 1, 256]
    - [3, 14.462]
  - - [4288, 3584, 1, 256]
    - [6, 15.157]
  - - [64, 256, 1, 3328]
    - [10, 0.857]
  - - [6784, 448, 1, 3328]
    - [14, 14.005]
  - - [5056, 1856, 1, 1280]
    - [3, 18.559]
  - - [1408, 1024, 1, 3328]
    - [13, 12.688]
  - - [2368, 256, 1, 3328]
    - [1, 9.58]
  - - [5888, 3584, 1, 1280]
    - [3, 20.818]
  - - [5888, 128, 1, 1280]
    - [1, 7.628]
  - - [1024, 2944, 1, 256]
    - [3, 8.376]
  - - [448, 6784, 1, 1280]
    - [3, 13.234]
  - - [256, 3584, 1, 1280]
    - [2, 9.577]
  - - [3584, 1024, 1, 3328]
    - [14, 16.493]
  - - [2944, 1856, 1, 1280]
    - [3, 17.086]
  - - [5056, 256, 1, 256]
    - [13, 5.529]
  - - [128, 5888, 1, 256]
    - [13, 4.212]
  - - [2368, 3584, 1, 3328]
    - [3, 18.697]
  - - [3584, 5888, 1, 3328]
    - [3, 22.368]
  - - [2944, 3584, 1, 1280]
    - [3, 19.319]
  - - [1856, 5888, 1, 1280]
    - [3, 18.902]
  - - [256, 256, 1, 1280]
    - [4, 1.435]
  - - [2048, 3200, 1, 2048]
    - [3, 17.604]
  - - [4288, 1408, 1, 256]
    - [6, 11.691]
  - - [3584, 64, 1, 256]
    - [2, 1.787]
  - - [64, 1856, 1, 3328]
    - [1, 4.595]
  - - [1024, 1024, 1, 256]
    - [7, 5.385]
  - - [4288, 2368, 1, 1280]
    - [3, 17.484]
  - - [2944, 5056, 1, 256]
    - [3, 14.269]
  - - [256, 128, 1, 3328]
    - [10, 1.923]
  - - [512, 8, 1, 500000]
    - [0, 0.0]
  - - [6784, 2368, 1, 256]
    - [5, 15.706]
  - - [1024, 1024, 1, 1024]
    - [2, 8.903]
  - - [2944, 64, 1, 3328]
    - [1, 6.092]
  - - [1024, 24000, 1, 2816]
    - [5, 19.4]
  - - [7680, 5984, 1, 2560]
    - [3, 22.706]
  - - [4288, 1856, 1, 256]
    - [5, 13.233]
  - - [1856, 2944, 1, 256]
    - [3, 13.325]
  - - [6144, 48000, 1, 2560]
    - [3, 24.028]
  - - [64, 5888, 1, 1280]
    - [2, 6.072]
  - - [1760, 800, 1, 1760]
    - [17, 9.67]
  - - [1856, 1408, 1, 1280]
    - [5, 12.945]
  - - [704, 1024, 1, 256]
    - [2, 3.466]
  - - [1024, 4288, 1, 1280]
    - [3, 13.995]
  - - [2368, 5056, 1, 3328]
    - [3, 19.319]
  - - [1024, 5056, 1, 3328]
    - [3, 16.828]
  - - [1024, 1856, 1, 3328]
    - [6, 13.942]
  - - [704, 704, 1, 1280]
    - [2, 6.164]
  - - [128, 2368, 1, 1280]
    - [1, 5.019]
  - - [3584, 256, 1, 1280]
    - [13, 9.368]
  - - [5888, 64, 1, 1280]
    - [7, 5.864]
  - - [128, 704, 1, 3328]
    - [4, 3.806]
  - - [4288, 6784, 1, 256]
    - [3, 17.454]
  - - [3584, 2944, 1, 3328]
    - [3, 19.892]
  - - [128, 1856, 1, 256]
    - [2, 1.367]
  - - [64, 4288, 1, 256]
    - [2, 1.537]
  - - [5888, 2944, 1, 256]
    - [3, 16.151]
  - - [5056, 128, 1, 1280]
    - [7, 7.581]
  - - [448, 1856, 1, 3328]
    - [1, 9.916]
  - - [5056, 4288, 1, 256]
    - [3, 15.087]
  - - [1024, 448, 1, 256]
    - [12, 2.407]
  - - [1024, 3584, 1, 256]
    - [6, 9.931]
  - - [2944, 128, 1, 1280]
    - [7, 6.275]
  - - [2048, 32, 1, 2048]
    - [1, 1.853]
  - - [64, 256, 1, 256]
    - [1, 0.067]
  - - [704, 256, 1, 3328]
    - [4, 5.283]
  - - [256, 704, 1, 1280]
    - [1, 3.163]
  - - [5888, 5888, 1, 1280]
    - [5, 18.863]
  - - [448, 5888, 1, 1280]
    - [6, 12.176]
  - - [4288, 704, 1, 1280]
    - [14, 12.415]
  - - [2944, 1408, 1, 256]
    - [5, 10.791]
  - - [256, 2944, 1, 1280]
    - [9, 7.89]
  - - [2560, 128, 1, 2560]
    - [1, 7.149]
  - - [2368, 5888, 1, 3328]
    - [3, 19.705]
  - - [704, 1024, 1, 3328]
    - [7, 9.978]
  - - [2368, 1856, 1, 1280]
    - [6, 13.663]
  - - [1856, 448, 1, 1280]
    - [13, 8.173]
  - - [128, 6784, 1, 256]
    - [9, 5.105]
  - - [5888, 4288, 1, 3328]
    - [3, 21.13]
  - - [6784, 704, 1, 1280]
    - [3, 15.111]
  - - [5056, 448, 1, 256]
    - [9, 8.14]
  - - [1856, 5056, 1, 1280]
    - [3, 18.216]
  - - [2944, 1024, 1, 1280]
    - [5, 12.363]
  - - [2368, 4288, 1, 256]
    - [6, 11.812]
  - - [1024, 2368, 1, 3328]
    - [9, 13.147]
  - - [4288, 64, 1, 3328]
    - [1, 7.241]
  - - [704, 1408, 1, 256]
    - [2, 4.438]
  - - [4096, 128, 1, 4096]
    - [2, 8.112]
  - - [4288, 5888, 1, 3328]
    - [3, 21.031]
  - - [4608, 16, 1, 1536]
    - [23, 1.976]
  - - [448, 2944, 1, 1280]
    - [13, 10.764]
  - - [1024, 2944, 1, 3328]
    - [6, 13.492]
  - - [2048, 64, 1, 2048]
    - [1, 2.884]
  - - [256, 6784, 1, 1280]
    - [6, 10.186]
  - - [1856, 3584, 1, 256]
    - [6, 13.425]
  - - [128, 448, 1, 3328]
    - [10, 2.723]
  - - [1856, 256, 1, 256]
    - [2, 2.87]
  - - [5056, 128, 1, 256]
    - [29, 3.178]
  - - [512, 24000, 1, 2816]
    - [3, 19.662]
  - - [256, 5888, 1, 1280]
    - [29, 8.984]
  - - [16384, 1600, 1, 4096]
    - [3, 22.135]
  - - [448, 2368, 1, 3328]
    - [7, 9.774]
  - - [64, 1408, 1, 256]
    - [11, 0.73]
  - - [2944, 2368, 1, 256]
    - [3, 13.332]
  - - [1024, 1856, 1, 256]
    - [9, 8.038]
  - - [6784, 3584, 1, 3328]
    - [3, 21.744]
  - - [1760, 7000, 1, 1760]
    - [3, 19.429]
  - - [1024, 704, 1, 3328]
    - [29, 8.985]
  - - [1024, 5888, 1, 3328]
    - [3, 16.576]
  - - [1408, 2368, 1, 1280]
    - [3, 13.783]
  - - [128, 1408, 1, 1280]
    - [1, 3.629]
  - - [256, 64, 1, 3328]
    - [1, 0.599]
  - - [128, 1856, 1, 3328]
    - [1, 7.238]
  - - [2944, 2944, 1, 256]
    - [3, 14.932]
  - - [6784, 256, 1, 256]
    - [13, 6.801]
  - - [128, 4288, 1, 1280]
    - [1, 6.283]
  - - [5888, 1408, 1, 256]
    - [5, 13.408]
  - - [128, 128, 1, 256]
    - [4, 0.106]
  - - [1760, 64, 1, 1760]
    - [1, 2.654]
  - - [448, 704, 1, 3328]
    - [1, 8.372]
  - - [448, 1856, 1, 256]
    - [13, 4.343]
  - - [1856, 704, 1, 3328]
    - [7, 10.624]
  - - [5888, 6784, 1, 3328]
    - [3, 22.7]
  - - [704, 4288, 1, 1280]
    - [5, 12.655]
  - - [704, 256, 1, 256]
    - [7, 1.302]
  - - [1024, 48000, 1, 2048]
    - [3, 23.244]
  - - [512, 128, 1, 784]
    - [23, 1.095]
  - - [1024, 256, 1, 196]
    - [7, 1.366]
  - - [256, 64, 1, 3136]
    - [23, 0.582]
  - - [256, 1024, 1, 196]
    - [20, 1.128]
  - - [64, 256, 1, 3136]
    - [10, 0.728]
  - - [128, 512, 1, 784]
    - [20, 0.925]
  - - [64, 64, 1, 3136]
    - [4, 0.228]
- null
