library/src/blas3/Tensile/Logic/asm_full/arcturus_Cijk_Ailk_Bjlk_HBH.yaml
- {MinimumRequiredVersion: 4.6.0}
- arcturus
- gfx908
- [Device 7380, Device 7388, Device 738c, Device 7390]
    SolutionIndex: 0
    SolutionNameMin: Cijk_Ailk_Bjlk_HBH_MT064x064x04_PGR0_PLR1_TT04_04
    SolutionIndex: 1
    SolutionNameMin: Cijk_Ailk_Bjlk_HBH_MT064x064x04_PGR1_PLR1_TT04_04
    SolutionIndex: 2
    SolutionNameMin: Cijk_Ailk_Bjlk_HBH_MT064x064x08_PGR0_PLR1_TT04_04
    SolutionIndex: 3
    SolutionNameMin: Cijk_Ailk_Bjlk_HBH_MT064x064x16_PGR1_PLR1_TT04_04
    SolutionIndex: 4
    SolutionIndex: 5
    SolutionIndex: 6
    SolutionIndex: 7
    SolutionNameMin: Cijk_Ailk_Bjlk_HBH_MT32x32x32_MI16x16x16x1_SE_AF0EM8_GRVW8_SU0_SUS256_SRVW4_TT1_16_WG32_8_1_WGM1
    SolutionIndex: 8
    SolutionNameMin: Cijk_Ailk_Bjlk_HBH_MT32x64x16_MI16x16x16x1_SE_AF0EM8_EPS0_GRVW2_GSU1_PGR2_SU32_SUS256_SRVW4_TT1_32_VAW2_WG32_8_1_WGM15
    SolutionIndex: 9
    SolutionNameMin: Cijk_Ailk_Bjlk_HBH_MT32x64x16_MI16x16x16x1_SE_AF0EM8_EPS0_GRVW8_GSU1_PGR2_SU32_SUS256_SRVW4_TT1_32_VAW2_WG32_8_1_WGM2
    SolutionIndex: 10
    SolutionNameMin: Cijk_Ailk_Bjlk_HBH_MT32x32x16_MI16x16x16x1_SE_AF0EM8_GRVW2_SU0_SUS256_SRVW4_TT1_16_WG32_8_1_WGM1
    SolutionIndex: 11
    SolutionNameMin: Cijk_Ailk_Bjlk_HBH_MT16x16x16_MI16x16x16x1_SE_AF0EM8_EPS1_GRVW2_GSU1_PGR1_SU0_SUS256_SRVW0_TT1_16_VAW2_WG16_4_1_WGM1
    SolutionIndex: 12
    SolutionNameMin: Cijk_Ailk_Bjlk_HBH_MT64x64x16_MI32x32x8x1_SE_AF0EM8_GRVW2_SU0_SUS256_SRVW4_TT1_32_WG64_4_1_WGM1
    SolutionIndex: 13
    SolutionNameMin: Cijk_Ailk_Bjlk_HBH_MT16x16x16_MI16x16x16x1_SE_AF0EM8_EPS0_GRVW2_GSU1_PGR2_SU32_SUS256_SRVW0_TT1_16_VAW2_WG16_4_1_WGM2
    SolutionIndex: 14
    SolutionNameMin: Cijk_Ailk_Bjlk_HBH_MT16x64x32_MI16x16x16x1_SE_AF0EM8_GRVW8_SU0_SUS256_SRVW0_TT1_16_WG16_16_1_WGM2
    SolutionIndex: 15
    SolutionNameMin: Cijk_Ailk_Bjlk_HBH_MT64x32x16_MI16x16x16x1_SE_AF0EM8_EPS1_GRVW2_GSU1_PGR1_SU32_SUS128_SRVW4_TT2_16_VAW2_WG32_8_1_WGM1
    SolutionIndex: 16
    SolutionNameMin: Cijk_Ailk_Bjlk_HBH_MT64x32x16_MI16x16x16x1_SE_AF0EM8_EPS0_GRVW8_GSU1_PGR2_SU32_SUS128_SRVW4_TT2_16_VAW2_WG32_8_1_WGM2
    SolutionIndex: 17
    SolutionNameMin: Cijk_Ailk_Bjlk_HBH_MT64x32x16_MI16x16x16x1_SE_AF0EM8_EPS0_GRVW8_GSU1_PGR2_SU32_SUS256_SRVW4_TT2_16_VAW2_WG32_8_1_WGM15
    SolutionIndex: 18
    SolutionNameMin: Cijk_Ailk_Bjlk_HBH_MT32x32x32_MI16x16x16x1_SE_AF0EM8_GRVW4_SU0_SUS256_SRVW4_TT1_16_WG32_8_1_WGM2
    SolutionIndex: 19
    SolutionNameMin: Cijk_Ailk_Bjlk_HBH_MT64x32x16_MI16x16x16x1_SE_AF0EM8_EPS1_GRVW8_GSU1_PGR1_SU32_SUS256_SRVW4_TT2_16_VAW2_WG32_8_1_WGM15
    SolutionIndex: 20
    SolutionNameMin: Cijk_Ailk_Bjlk_HBH_MT64x32x16_MI16x16x16x1_SE_AF0EM8_EPS1_GRVW8_GSU1_PGR1_SU32_SUS128_SRVW4_TT2_16_VAW2_WG32_8_1_WGM2
    SolutionIndex: 21
    SolutionNameMin: Cijk_Ailk_Bjlk_HBH_MT32x32x32_MI16x16x16x1_SE_AF0EM8_GRVW2_SU0_SUS256_SRVW4_TT1_16_WG32_8_1_WGM1
    SolutionIndex: 22
    SolutionNameMin: Cijk_Ailk_Bjlk_HBH_MT64x32x16_MI16x16x16x1_SE_AF0EM8_EPS0_GRVW2_GSU1_PGR2_SU32_SUS256_SRVW4_TT2_16_VAW2_WG32_8_1_WGM2
    SolutionIndex: 23
    SolutionNameMin: Cijk_Ailk_Bjlk_HBH_MT64x32x16_MI16x16x16x1_SE_AF0EM8_GRVW2_SU32_SUS128_SRVW4_TT2_16_WG32_8_1_WGM1
    SolutionIndex: 24
    SolutionNameMin: Cijk_Ailk_Bjlk_HBH_MT64x32x16_MI16x16x16x1_SE_AF0EM8_GRVW2_SU32_SUS256_SRVW4_TT2_16_WG32_8_1_WGM15
    SolutionIndex: 25
    SolutionNameMin: Cijk_Ailk_Bjlk_HBH_MT32x32x16_MI16x16x16x1_SE_AF0EM8_GRVW8_SU32_SUS128_SRVW4_TT1_16_WG32_8_1_WGM1
    SolutionIndex: 26
    SolutionNameMin: Cijk_Ailk_Bjlk_HBH_MT64x32x16_MI16x16x16x1_SE_AF0EM8_EPS0_GRVW2_GSU1_PGR2_SU32_SUS256_SRVW4_TT2_16_VAW2_WG32_8_1_WGM2
    SolutionIndex: 27
    SolutionNameMin: Cijk_Ailk_Bjlk_HBH_MT64x32x16_MI16x16x16x1_SE_AF0EM8_EPS1_GRVW2_GSU1_PGR1_SU32_SUS128_SRVW4_TT2_16_VAW2_WG32_8_1_WGM2
    SolutionIndex: 28
    SolutionNameMin: Cijk_Ailk_Bjlk_HBH_MT64x32x16_MI16x16x16x1_SE_AF0EM8_EPS0_GRVW2_GSU1_PGR2_SU32_SUS128_SRVW4_TT2_16_VAW2_WG32_8_1_WGM2
    SolutionIndex: 29
    SolutionNameMin: Cijk_Ailk_Bjlk_HBH_MT64x32x16_MI16x16x16x1_SE_AF0EM8_EPS0_GRVW4_GSU1_PGR2_SU32_SUS128_SRVW4_TT2_16_VAW2_WG32_8_1_WGM15
    SolutionIndex: 30
    SolutionNameMin: Cijk_Ailk_Bjlk_HBH_MT32x32x32_MI16x16x16x1_SE_AF0EM8_GRVW4_SU0_SUS256_SRVW4_TT1_16_WG32_8_1_WGM1
    SolutionIndex: 31
    SolutionNameMin: Cijk_Ailk_Bjlk_HBH_MT64x32x16_MI16x16x16x1_SE_AF0EM8_EPS0_GRVW2_GSU1_PGR2_SU32_SUS128_SRVW4_TT2_16_VAW2_WG32_8_1_WGM1
    SolutionIndex: 32
    SolutionNameMin: Cijk_Ailk_Bjlk_HBH_MT64x64x16_MI32x32x8x1_SE_AF0EM8_GRVW2_SU0_SUS256_SRVW4_TT1_32_WG64_4_1_WGM15
    SolutionIndex: 33
    SolutionNameMin: Cijk_Ailk_Bjlk_HBH_MT64x64x16_MI32x32x8x1_SE_AF0EM8_EPS0_GRVW2_GSU1_PGR2_SU32_SUS128_SRVW4_TT1_32_VAW2_WG64_4_1_WGM15
    SolutionIndex: 34
    SolutionNameMin: Cijk_Ailk_Bjlk_HBH_MT64x64x16_MI32x32x8x1_SE_AF0EM8_EPS0_GRVW2_GSU1_PGR2_SU32_SUS256_SRVW4_TT1_32_VAW2_WG64_4_1_WGM2
    SolutionIndex: 35
    SolutionNameMin: Cijk_Ailk_Bjlk_HBH_MT64x64x16_MI32x32x8x1_SE_AF0EM8_EPS1_GRVW2_GSU1_PGR1_SU0_SUS256_SRVW4_TT1_32_VAW2_WG64_4_1_WGM2
    SolutionIndex: 36
    SolutionNameMin: Cijk_Ailk_Bjlk_HBH_MT32x32x64_MI16x16x16x1_SE_AF0EM8_GRVW8_SU0_SUS256_SRVW4_TT1_16_WG32_8_1_WGM1
    SolutionIndex: 37
    SolutionNameMin: Cijk_Ailk_Bjlk_HBH_MT32x32x64_MI16x16x16x1_SE_AF0EM8_GRVW8_SU32_SUS256_SRVW0_TT1_16_WG32_8_1_WGM1
    SolutionIndex: 38
    SolutionNameMin: Cijk_Ailk_Bjlk_HBH_MT32x32x64_MI16x16x16x1_SE_AF0EM8_GRVW8_SU0_SUS256_SRVW0_TT1_16_WG32_8_1_WGM1
    SolutionIndex: 39
    SolutionNameMin: Cijk_Ailk_Bjlk_HBH_MT32x32x64_MI16x16x16x1_SE_AF0EM8_GRVW4_SU32_SUS256_SRVW4_TT1_16_WG32_8_1_WGM2
    SolutionIndex: 40
    SolutionNameMin: Cijk_Ailk_Bjlk_HBH_MT32x32x64_MI16x16x16x1_SE_AF0EM8_GRVW8_SU32_SUS128_SRVW0_TT1_16_WG32_8_1_WGM1
    SolutionIndex: 41
    SolutionNameMin: Cijk_Ailk_Bjlk_HBH_MT32x64x64_MI16x16x16x1_SE_AF0EM8_GRVW2_SU32_SUS256_SRVW4_TT1_32_WG32_8_1_WGM2
    SolutionIndex: 42
    SolutionNameMin: Cijk_Ailk_Bjlk_HBH_MT32x32x64_MI16x16x16x1_SE_AF0EM8_GRVW8_SU0_SUS256_SRVW0_TT1_16_WG32_8_1_WGM1
    SolutionIndex: 43
    SolutionNameMin: Cijk_Ailk_Bjlk_HBH_MT32x32x64_MI16x16x16x1_SE_AF0EM8_GRVW8_SU32_SUS128_SRVW0_TT1_16_WG32_8_1_WGM1
    SolutionIndex: 44
    SolutionNameMin: Cijk_Ailk_Bjlk_HBH_MT32x32x64_MI16x16x16x1_SE_AF0EM8_GRVW4_SU0_SUS256_SRVW4_TT1_16_WG32_8_1_WGM1
    SolutionIndex: 45
    SolutionNameMin: Cijk_Ailk_Bjlk_HBH_MT32x32x64_MI16x16x16x1_SE_AF0EM8_GRVW8_SU0_SUS256_SRVW0_TT1_16_WG32_8_1_WGM15
    SolutionIndex: 46
    SolutionNameMin: Cijk_Ailk_Bjlk_HBH_MT32x32x64_MI16x16x16x1_SE_AF0EM8_GRVW8_SU0_SUS256_SRVW4_TT1_16_WG32_8_1_WGM15
    SolutionIndex: 47
    SolutionNameMin: Cijk_Ailk_Bjlk_HBH_MT32x64x64_MI16x16x16x1_SE_AF0EM8_GRVW8_SU32_SUS128_SRVW0_TT1_32_WG32_8_1_WGM2
    SolutionIndex: 48
    SolutionNameMin: Cijk_Ailk_Bjlk_HBH_MT32x32x64_MI16x16x16x1_SE_AF0EM8_GRVW8_SU0_SUS256_SRVW0_TT1_16_WG32_8_1_WGM2
    SolutionIndex: 49
    SolutionNameMin: Cijk_Ailk_Bjlk_HBH_MT32x32x64_MI16x16x16x1_SE_AF0EM8_GRVW2_SU0_SUS256_SRVW0_TT1_16_WG32_8_1_WGM1
    SolutionIndex: 50
    SolutionNameMin: Cijk_Ailk_Bjlk_HBH_MT64x64x64_MI32x32x8x1_SE_AF0EM8_GRVW8_SU0_SUS256_SRVW0_TT1_32_WG64_4_1_WGM1
    SolutionIndex: 51
    SolutionNameMin: Cijk_Ailk_Bjlk_HBH_MT64x64x64_MI32x32x8x1_SE_AF0EM8_GRVW8_SU0_SUS256_SRVW0_TT1_32_WG64_4_1_WGM2
    SolutionIndex: 52
    SolutionNameMin: Cijk_Ailk_Bjlk_HBH_MT64x64x64_MI32x32x8x1_SE_AF0EM8_GRVW8_SU32_SUS128_SRVW0_TT1_32_WG64_4_1_WGM1
    SolutionIndex: 53
    SolutionNameMin: Cijk_Ailk_Bjlk_HBH_MT64x64x64_MI32x32x8x1_SE_AF0EM8_GRVW8_SU0_SUS256_SRVW0_TT1_32_WG64_4_1_WGM1
    SolutionIndex: 54
    SolutionNameMin: Cijk_Ailk_Bjlk_HBH_MT64x128x64_MI32x32x8x1_SE_AF0EM8_GRVW4_SU32_SUS128_SRVW0_TT1_64_WG64_4_1_WGM15
    SolutionIndex: 55
    SolutionNameMin: Cijk_Ailk_Bjlk_HBH_MT64x64x64_MI32x32x8x1_SE_AF0EM8_GRVW8_SU0_SUS256_SRVW0_TT1_32_WG64_4_1_WGM2
    SolutionIndex: 56
    SolutionNameMin: Cijk_Ailk_Bjlk_HBH_MT64x64x64_MI32x32x8x1_SE_AF0EM8_GRVW8_SU32_SUS256_SRVW0_TT1_32_WG64_4_1_WGM1
    SolutionIndex: 57
    SolutionNameMin: Cijk_Ailk_Bjlk_HBH_MT64x128x64_MI32x32x8x1_SE_AF0EM8_GRVW8_SU32_SUS128_SRVW0_TT1_64_WG64_4_1_WGM2
    SolutionIndex: 58
    SolutionNameMin: Cijk_Ailk_Bjlk_HBH_MT64x32x64_MI16x16x16x1_SE_AF0EM8_GRVW8_SU0_SUS256_SRVW4_TT2_16_WG32_8_1_WGM2
    SolutionIndex: 59
    SolutionNameMin: Cijk_Ailk_Bjlk_HBH_MT64x64x64_MI32x32x8x1_SE_AF0EM8_GRVW8_SU32_SUS128_SRVW0_TT1_32_WG64_4_1_WGM15
    SolutionIndex: 60
    SolutionNameMin: Cijk_Ailk_Bjlk_HBH_MT32x32x64_MI16x16x16x1_SE_AF0EM8_GRVW8_SU0_SUS256_SRVW4_TT1_16_WG32_8_1_WGM2
    SolutionIndex: 61
    SolutionNameMin: Cijk_Ailk_Bjlk_HBH_MT64x64x64_MI32x32x8x1_SE_AF0EM8_GRVW8_SU0_SUS256_SRVW4_TT1_32_WG64_4_1_WGM1
    SolutionIndex: 62
    SolutionNameMin: Cijk_Ailk_Bjlk_HBH_MT64x64x64_MI32x32x8x1_SE_AF0EM8_GRVW8_SU0_SUS256_SRVW0_TT1_32_WG64_4_1_WGM1
    SolutionIndex: 63
    SolutionNameMin: Cijk_Ailk_Bjlk_HBH_MT64x64x64_MI32x32x8x1_SE_AF0EM8_GRVW8_SU0_SUS256_SRVW4_TT1_32_WG64_4_1_WGM2
    SolutionIndex: 64
    SolutionNameMin: Cijk_Ailk_Bjlk_HBH_MT64x128x64_MI32x32x8x1_SE_AF0EM8_GRVW8_SU32_SUS128_SRVW0_TT1_64_WG64_4_1_WGM2
    SolutionIndex: 65
    SolutionNameMin: Cijk_Ailk_Bjlk_HBH_MT64x32x64_MI16x16x16x1_SE_AF0EM8_GRVW4_SU0_SUS256_SRVW4_TT2_16_WG32_8_1_WGM1
    SolutionIndex: 66
    SolutionNameMin: Cijk_Ailk_Bjlk_HBH_MT64x256x32_MI32x32x8x1_SE_AF0EM8_GRVW8_SU32_SUS256_SRVW0_TT1_128_WG64_4_1_WGM15
    SolutionIndex: 67
    SolutionNameMin: Cijk_Ailk_Bjlk_HBH_MT64x64x64_MI32x32x8x1_SE_AF0EM8_GRVW8_SU32_SUS256_SRVW4_TT1_32_WG64_4_1_WGM1
    SolutionIndex: 68
    SolutionNameMin: Cijk_Ailk_Bjlk_HBH_MT64x64x64_MI32x32x8x1_SE_AF0EM8_GRVW8_SU0_SUS256_SRVW4_TT1_32_WG64_4_1_WGM15
    SolutionIndex: 69
    SolutionNameMin: Cijk_Ailk_Bjlk_HBH_MT64x128x64_MI32x32x8x1_SE_AF0EM8_GRVW8_SU32_SUS128_SRVW0_TT1_64_WG64_4_1_WGM1
    SolutionIndex: 70
    SolutionNameMin: Cijk_Ailk_Bjlk_HBH_MT32x32x64_MI16x16x16x1_SE_AF0EM8_GRVW4_SU0_SUS256_SRVW4_TT1_16_WG32_8_1_WGM15
    SolutionIndex: 71
    SolutionNameMin: Cijk_Ailk_Bjlk_HBH_MT32x32x64_MI16x16x16x1_SE_AF0EM8_GRVW4_SU32_SUS128_SRVW0_TT1_16_WG32_8_1_WGM1
    SolutionIndex: 72
    SolutionNameMin: Cijk_Ailk_Bjlk_HBH_MT32x32x64_MI16x16x16x1_SE_AF0EM8_GRVW4_SU0_SUS256_SRVW0_TT1_16_WG32_8_1_WGM15
    SolutionIndex: 73
    SolutionNameMin: Cijk_Ailk_Bjlk_HBH_MT32x32x64_MI16x16x16x1_SE_AF0EM8_GRVW8_SU32_SUS128_SRVW0_TT1_16_WG32_8_1_WGM2
    SolutionIndex: 74
    SolutionNameMin: Cijk_Ailk_Bjlk_HBH_MT32x32x64_MI16x16x16x1_SE_AF0EM8_GRVW4_SU0_SUS256_SRVW0_TT1_16_WG32_8_1_WGM2
    SolutionIndex: 75
    SolutionNameMin: Cijk_Ailk_Bjlk_HBH_MT32x64x64_MI16x16x16x1_SE_AF0EM8_EPS0_GRVW8_GSU1_PGR2_SU0_SUS256_SRVW4_TT1_32_VAW2_WG32_8_1_WGM1
    SolutionIndex: 76
    SolutionNameMin: Cijk_Ailk_Bjlk_HBH_MT16x16x64_MI16x16x16x1_SE_AF0EM8_GRVW8_SU0_SUS256_SRVW0_TT1_16_WG16_4_1_WGM1
    SolutionIndex: 77
    SolutionNameMin: Cijk_Ailk_Bjlk_HBH_MT64x32x64_MI16x16x16x1_SE_AF0EM8_EPS0_GRVW4_GSU1_PGR2_SU0_SUS256_SRVW4_TT2_16_VAW2_WG32_8_1_WGM15
    SolutionIndex: 78
    SolutionNameMin: Cijk_Ailk_Bjlk_HBH_MT64x64x32_MI32x32x8x1_SE_AF0EM8_EPS0_GRVW8_GSU1_PGR2_SU0_SUS256_SRVW4_TT1_32_VAW2_WG64_4_1_WGM2
    SolutionIndex: 79
    SolutionNameMin: Cijk_Ailk_Bjlk_HBH_MT32x64x64_MI16x16x16x1_SE_AF0EM8_GRVW8_SU32_SUS128_SRVW0_TT1_32_WG32_8_1_WGM15
    SolutionIndex: 80
    SolutionNameMin: Cijk_Ailk_Bjlk_HBH_MT32x64x64_MI16x16x16x1_SE_AF0EM8_GRVW8_SU32_SUS128_SRVW0_TT1_32_WG32_8_1_WGM1
    SolutionIndex: 81
    SolutionNameMin: Cijk_Ailk_Bjlk_HBH_MT64x128x64_MI32x32x8x1_SE_AF0EM8_EPS0_GRVW8_GSU1_PGR2_SU32_SUS256_SRVW4_TT1_64_VAW2_WG64_4_1_WGM15
    SolutionIndex: 82
    SolutionNameMin: Cijk_Ailk_Bjlk_HBH_MT16x16x64_MI16x16x16x1_SE_AF0EM8_GRVW8_SU32_SUS128_SRVW0_TT1_16_WG16_4_1_WGM1
    SolutionIndex: 83
    SolutionNameMin: Cijk_Ailk_Bjlk_HBH_MT64x32x64_MI16x16x16x1_SE_AF0EM8_GRVW8_SU0_SUS256_SRVW0_TT2_16_WG32_8_1_WGM1
    SolutionIndex: 84
    SolutionNameMin: Cijk_Ailk_Bjlk_HBH_MT64x64x64_MI32x32x8x1_SE_AF0EM8_GRVW8_SU32_SUS128_SRVW0_TT1_32_WG64_4_1_WGM1
    SolutionIndex: 85
    SolutionNameMin: Cijk_Ailk_Bjlk_HBH_MT128x64x64_MI32x32x8x1_SE_AF0EM8_EPS0_GRVW2_GSU1_PGR2_SU0_SUS256_SRVW4_TT2_32_VAW2_WG64_4_1_WGM15
    SolutionIndex: 86
    SolutionNameMin: Cijk_Ailk_Bjlk_HBH_MT128x96x64_MI32x32x8x1_SE_AF0EM8_GRVW8_SU0_SUS256_SRVW4_TT1_96_WG128_2_1_WGM2
    SolutionIndex: 87
    SolutionNameMin: Cijk_Ailk_Bjlk_HBH_MT128x96x64_MI32x32x8x1_SE_AF0EM8_GRVW8_SU32_SUS256_SRVW4_TT1_96_WG128_2_1_WGM15
    SolutionIndex: 88
    SolutionNameMin: Cijk_Ailk_Bjlk_HBH_MT256x160x32_MI32x32x8x1_SE_AF0EM8_GRVW4_SU0_SUS256_SRVW4_TT2_160_WG128_2_1_WGM1
    SolutionIndex: 89
    SolutionNameMin: Cijk_Ailk_Bjlk_HBH_MT256x160x32_MI32x32x8x1_SE_AF0EM8_GRVW4_SU0_SUS256_SRVW4_TT2_160_WG128_2_1_WGM15
    SolutionIndex: 90
    SolutionNameMin: Cijk_Ailk_Bjlk_HBH_MT64x64x64_MI32x32x8x1_SE_AF0EM8_GRVW8_SU32_SUS128_SRVW0_TT1_32_WG64_4_1_WGM15
    SolutionIndex: 91
    SolutionNameMin: Cijk_Ailk_Bjlk_HBH_MT128x288x32_MI32x32x8x1_SE_AF0EM8_GRVW4_SU0_SUS256_SRVW4_TT1_288_WG128_2_1_WGM1
    SolutionIndex: 92
    SolutionNameMin: Cijk_Ailk_Bjlk_HBH_MT32x32x64_MI16x16x16x1_SE_AF0EM8_GRVW8_SU32_SUS128_SRVW4_TT1_16_WG32_8_1_WGM2
    SolutionIndex: 93
    SolutionNameMin: Cijk_Ailk_Bjlk_HBH_MT128x64x64_MI32x32x8x1_SE_AF0EM8_GRVW8_SU32_SUS256_SRVW0_TT2_32_WG64_4_1_WGM1
    SolutionIndex: 94
    SolutionNameMin: Cijk_Ailk_Bjlk_HBH_MT128x256x32_MI32x32x8x1_SE_AF0EM8_EPS0_GRVW4_GSU1_PGR2_SU0_SUS256_SRVW4_TT2_128_VAW2_WG64_4_1_WGM2
    SolutionIndex: 95
    SolutionNameMin: Cijk_Ailk_Bjlk_HBH_MT256x128x32_MI32x32x8x1_SE_AF0EM8_EPS0_GRVW4_GSU1_PGR2_SU0_SUS256_SRVW4_TT4_64_VAW2_WG64_4_1_WGM15
    SolutionIndex: 96
    SolutionNameMin: Cijk_Ailk_Bjlk_HBH_MT128x128x16_MI32x32x8x1_SE_AF0EM8_EPS0_GRVW4_GSU1_PGR2_SU32_SUS256_SRVW4_TT2_64_VAW2_WG64_4_1_WGM1
    SolutionIndex: 97
    SolutionNameMin: Cijk_Ailk_Bjlk_HBH_MT256x144x32_MI16x16x16x1_SE_AF0EM8_EPS0_GRVW2_GSU1_PGR2_SU0_SUS256_SRVW4_TT4_144_VAW2_WG64_4_1_WGM15
    SolutionIndex: 98
    SolutionNameMin: Cijk_Ailk_Bjlk_HBH_MT256x256x32_MI32x32x8x1_SE_AF0EM8_GRVW8_SU0_SUS256_SRVW4_TT4_128_WG64_4_1_WGM2
    SolutionIndex: 99
    SolutionNameMin: Cijk_Ailk_Bjlk_HBH_MT64x64x64_MI32x32x8x1_SE_AF0EM8_GRVW8_SU32_SUS256_SRVW0_TT1_32_WG64_4_1_WGM2
    SolutionIndex: 100
    SolutionNameMin: Cijk_Ailk_Bjlk_HBH_MT128x256x16_MI32x32x8x1_SE_AF0EM8_EPS0_GRVW4_GSU1_PGR2_SU0_SUS256_SRVW4_TT2_128_VAW2_WG64_4_1_WGM2
    SolutionIndex: 101
    SolutionNameMin: Cijk_Ailk_Bjlk_HBH_MT256x128x32_MI32x32x8x1_SE_AF0EM8_GRVW8_SU32_SUS256_SRVW4_TT4_64_WG64_4_1_WGM1
    SolutionIndex: 102
    SolutionNameMin: Cijk_Ailk_Bjlk_HBH_MT64x32x64_MI16x16x16x1_SE_AF0EM8_GRVW8_SU32_SUS128_SRVW4_TT2_16_WG32_8_1_WGM1
    SolutionIndex: 103
    SolutionNameMin: Cijk_Ailk_Bjlk_HBH_MT128x64x64_MI32x32x8x1_SE_AF0EM8_GRVW8_SU0_SUS256_SRVW0_TT2_32_WG64_4_1_WGM2
    SolutionIndex: 104
    SolutionNameMin: Cijk_Ailk_Bjlk_HBH_MT256x256x16_MI32x32x8x1_SE_AF0EM8_GRVW8_SU32_SUS128_SRVW4_TT4_128_WG64_4_1_WGM2
    SolutionIndex: 105
    SolutionNameMin: Cijk_Ailk_Bjlk_HBH_MT32x64x64_MI16x16x16x1_SE_AF0EM8_GRVW8_SU32_SUS128_SRVW4_TT1_32_WG32_8_1_WGM2
    SolutionIndex: 106
    SolutionNameMin: Cijk_Ailk_Bjlk_HBH_MT32x64x64_MI16x16x16x1_SE_AF0EM8_GRVW8_SU32_SUS256_SRVW4_TT1_32_WG32_8_1_WGM15
    SolutionIndex: 107
    SolutionNameMin: Cijk_Ailk_Bjlk_HBH_MT64x64x64_MI32x32x8x1_SE_AF0EM8_GRVW8_SU32_SUS128_SRVW0_TT1_32_WG64_4_1_WGM2
    SolutionIndex: 108
    SolutionNameMin: Cijk_Ailk_Bjlk_HBH_MT256x256x32_MI32x32x8x1_SE_AF0EM8_EPS1_GRVW8_GSU1_PGR1_SU0_SUS256_SRVW4_TT4_128_VAW2_WG64_4_1_WGM1
    SolutionIndex: 109
    SolutionNameMin: Cijk_Ailk_Bjlk_HBH_MT160x256x32_MI32x32x8x1_SE_AF0EM8_GRVW4_SU32_SUS128_SRVW0_TT5_64_WG32_8_1_WGM1
    SolutionIndex: 110
    SolutionNameMin: Cijk_Ailk_Bjlk_HBH_MT256x256x32_MI32x32x8x1_SE_AF0EM8_EPS1_GRVW8_GSU1_PGR1_SU0_SUS256_SRVW4_TT4_128_VAW2_WG64_4_1_WGM2
    SolutionIndex: 111
    SolutionNameMin: Cijk_Ailk_Bjlk_HBH_MT128x192x16_MI32x32x8x1_SE_AF0EM8_EPS0_GRVW4_GSU1_PGR2_SU32_SUS128_SRVW4_TT2_96_VAW2_WG64_4_1_WGM2
    SolutionIndex: 112
    SolutionNameMin: Cijk_Ailk_Bjlk_HBH_MT256x256x32_MI32x32x8x1_SE_AF0EM8_GRVW8_SU0_SUS256_SRVW4_TT4_128_WG64_4_1_WGM2
    SolutionIndex: 113
    SolutionNameMin: Cijk_Ailk_Bjlk_HBH_MT64x64x64_MI32x32x8x1_SE_AF0EM8_GRVW8_SU32_SUS256_SRVW4_TT1_32_WG64_4_1_WGM15
    SolutionIndex: 114
    SolutionNameMin: Cijk_Ailk_Bjlk_HBH_MT128x64x64_MI32x32x8x1_SE_AF0EM8_GRVW4_SU32_SUS256_SRVW0_TT2_32_WG64_4_1_WGM1
    SolutionIndex: 115
    SolutionNameMin: Cijk_Ailk_Bjlk_HBH_MT64x32x64_MI16x16x16x1_SE_AF0EM8_GRVW8_SU0_SUS256_SRVW4_TT2_16_WG32_8_1_WGM1
    SolutionIndex: 116
    SolutionNameMin: Cijk_Ailk_Bjlk_HBH_MT128x64x64_MI32x32x8x1_SE_AF0EM8_GRVW8_SU0_SUS256_SRVW0_TT2_32_WG64_4_1_WGM1
    SolutionIndex: 117
    SolutionNameMin: Cijk_Ailk_Bjlk_HBH_MT64x32x64_MI16x16x16x1_SE_AF0EM8_GRVW8_SU32_SUS256_SRVW4_TT2_16_WG32_8_1_WGM1
    SolutionIndex: 118
    SolutionNameMin: Cijk_Ailk_Bjlk_HBH_MT256x64x32_MI32x32x8x1_SE_AF0EM8_GRVW8_SU0_SUS256_SRVW0_TT4_32_WG64_4_1_WGM2
    SolutionIndex: 119
    SolutionNameMin: Cijk_Ailk_Bjlk_HBH_MT64x64x64_MI32x32x8x1_SE_AF0EM8_GRVW8_SU32_SUS128_SRVW4_TT1_32_WG64_4_1_WGM1
    SolutionIndex: 120
    SolutionNameMin: Cijk_Ailk_Bjlk_HBH_MT128x64x64_MI32x32x8x1_SE_AF0EM8_GRVW8_SU0_SUS256_SRVW0_TT2_32_WG64_4_1_WGM1
    SolutionIndex: 121
    SolutionNameMin: Cijk_Ailk_Bjlk_HBH_MT128x256x16_MI32x32x8x1_SE_AF0EM8_EPS0_GRVW8_GSU1_PGR2_SU32_SUS128_SRVW4_TT2_128_VAW2_WG64_4_1_WGM15
    SolutionIndex: 122
    SolutionNameMin: Cijk_Ailk_Bjlk_HBH_MT16x16x16_MI16x16x16x1_SE_AF0EM1_EPS1_GRVW4_GSU1_PGR1_SU0_SUS256_SRVW0_TT1_16_VAW2_WG16_4_1_WGM1
    SolutionIndex: 123
    SolutionNameMin: Cijk_Ailk_Bjlk_HBH_MT32x32x16_MI16x16x16x1_SE_AF0EM1_GRVW2_SU0_SUS256_SRVW4_TT1_16_WG32_8_1_WGM1
    SolutionIndex: 124
    SolutionNameMin: Cijk_Ailk_Bjlk_HBH_MT16x16x16_MI16x16x16x1_SE_AF0EM1_EPS1_GRVW2_GSU1_PGR1_SU32_SUS128_SRVW0_TT1_16_VAW2_WG16_4_1_WGM15
    SolutionIndex: 125
    SolutionNameMin: Cijk_Ailk_Bjlk_HBH_MT16x16x16_MI16x16x16x1_SE_AF0EM1_EPS0_GRVW2_GSU1_PGR2_SU32_SUS256_SRVW4_TT1_16_VAW2_WG16_4_1_WGM1
    SolutionIndex: 126
    SolutionNameMin: Cijk_Ailk_Bjlk_HBH_MT16x16x16_MI16x16x16x1_SE_AF0EM1_EPS1_GRVW2_GSU1_PGR1_SU0_SUS256_SRVW4_TT1_16_VAW2_WG16_4_1_WGM1
    SolutionIndex: 127
    SolutionNameMin: Cijk_Ailk_Bjlk_HBH_MT32x64x16_MI16x16x16x1_SE_AF0EM1_EPS1_GRVW2_GSU1_PGR1_SU0_SUS256_SRVW4_TT1_32_VAW2_WG32_8_1_WGM1
    SolutionIndex: 128
    SolutionNameMin: Cijk_Ailk_Bjlk_HBH_MT32x32x16_MI16x16x16x1_SE_AF0EM1_GRVW2_SU32_SUS256_SRVW4_TT1_16_WG32_8_1_WGM1
    SolutionIndex: 129
    SolutionNameMin: Cijk_Ailk_Bjlk_HBH_MT32x64x16_MI16x16x16x1_SE_AF0EM1_EPS0_GRVW8_GSU1_PGR2_SU32_SUS256_SRVW4_TT1_32_VAW2_WG32_8_1_WGM2
    SolutionIndex: 130
    SolutionNameMin: Cijk_Ailk_Bjlk_HBH_MT32x64x16_MI16x16x16x1_SE_AF0EM1_EPS0_GRVW4_GSU1_PGR2_SU32_SUS256_SRVW4_TT1_32_VAW2_WG32_8_1_WGM2
    SolutionIndex: 131
    SolutionNameMin: Cijk_Ailk_Bjlk_HBH_MT32x64x16_MI16x16x16x1_SE_AF0EM1_EPS1_GRVW2_GSU1_PGR1_SU32_SUS256_SRVW4_TT1_32_VAW2_WG32_8_1_WGM2
    SolutionIndex: 132
    SolutionNameMin: Cijk_Ailk_Bjlk_HBH_MT32x64x16_MI16x16x16x1_SE_AF0EM1_EPS1_GRVW2_GSU1_PGR1_SU32_SUS128_SRVW4_TT1_32_VAW2_WG32_8_1_WGM2
    SolutionIndex: 133
    SolutionNameMin: Cijk_Ailk_Bjlk_HBH_MT32x64x16_MI16x16x16x1_SE_AF0EM1_GRVW2_SU32_SUS256_SRVW4_TT1_32_WG32_8_1_WGM2
    SolutionIndex: 134
    SolutionNameMin: Cijk_Ailk_Bjlk_HBH_MT32x64x16_MI16x16x16x1_SE_AF0EM1_EPS1_GRVW2_GSU1_PGR1_SU0_SUS256_SRVW4_TT1_32_VAW2_WG32_8_1_WGM15
    SolutionIndex: 135
    SolutionNameMin: Cijk_Ailk_Bjlk_HBH_MT32x64x16_MI16x16x16x1_SE_AF0EM1_EPS0_GRVW2_GSU1_PGR2_SU0_SUS256_SRVW4_TT1_32_VAW2_WG32_8_1_WGM2
    SolutionIndex: 136
    SolutionNameMin: Cijk_Ailk_Bjlk_HBH_MT32x32x32_MI16x16x16x1_SE_AF0EM1_GRVW2_SU0_SUS256_SRVW4_TT1_16_WG32_8_1_WGM2
    SolutionIndex: 137
    SolutionNameMin: Cijk_Ailk_Bjlk_HBH_MT32x32x16_MI16x16x16x1_SE_AF0EM1_EPS1_GRVW2_GSU1_PGR1_SU32_SUS128_SRVW4_TT1_16_VAW2_WG32_8_1_WGM1
    SolutionIndex: 138
    SolutionNameMin: Cijk_Ailk_Bjlk_HBH_MT64x64x16_MI32x32x8x1_SE_AF0EM1_GRVW2_SU0_SUS256_SRVW4_TT1_32_WG64_4_1_WGM2
    SolutionIndex: 139
    SolutionNameMin: Cijk_Ailk_Bjlk_HBH_MT32x32x32_MI16x16x16x1_SE_AF0EM1_GRVW4_SU0_SUS256_SRVW4_TT1_16_WG32_8_1_WGM1
    SolutionIndex: 140
    SolutionNameMin: Cijk_Ailk_Bjlk_HBH_MT64x64x16_MI32x32x8x1_SE_AF0EM1_EPS0_GRVW2_GSU1_PGR2_SU32_SUS128_SRVW4_TT1_32_VAW2_WG64_4_1_WGM2
    SolutionIndex: 141
    SolutionNameMin: Cijk_Ailk_Bjlk_HBH_MT32x64x16_MI16x16x16x1_SE_AF0EM1_EPS0_GRVW8_GSU1_PGR2_SU0_SUS256_SRVW4_TT1_32_VAW2_WG32_8_1_WGM2
    SolutionIndex: 142
    SolutionNameMin: Cijk_Ailk_Bjlk_HBH_MT32x32x16_MI16x16x16x1_SE_AF0EM1_GRVW8_SU0_SUS256_SRVW4_TT1_16_WG32_8_1_WGM1
    SolutionIndex: 143
    SolutionNameMin: Cijk_Ailk_Bjlk_HBH_MT64x64x16_MI32x32x8x1_SE_AF0EM1_EPS1_GRVW2_GSU1_PGR1_SU32_SUS128_SRVW4_TT1_32_VAW2_WG64_4_1_WGM1
    SolutionIndex: 144
    SolutionNameMin: Cijk_Ailk_Bjlk_HBH_MT192x64x32_MI32x32x8x1_SE_AF0EM8_EPS0_GRVW8_GSU1_PGR2_SU0_SUS256_SRVW0_TT3_32_VAW2_WG64_4_1_WGM15
    SolutionIndex: 145
    SolutionNameMin: Cijk_Ailk_Bjlk_HBH_MT64x64x32_MI32x32x8x1_SE_AF0EM8_EPS0_GRVW8_GSU1_PGR2_SU32_SUS128_SRVW4_TT1_32_VAW2_WG64_4_1_WGM1
    SolutionIndex: 146
    SolutionNameMin: Cijk_Ailk_Bjlk_HBH_MT4x64x32_MI4x4x4x16_SE_AF0EM1_EPS1_GRVW2_GSU1_PGR1_SU0_SUS256_SRVW0_TT1_4_VAW2_WG4_16_1_WGM1
    SolutionIndex: 147
    SolutionNameMin: Cijk_Ailk_Bjlk_HBH_MT16x16x64_MI16x16x16x1_SE_AF0EM8_EPS0_GRVW2_GSU2_PGR2_SU0_SUS256_SRVW4_TT1_16_VAW1_WG16_4_1_WGM15
    SolutionIndex: 148
    SolutionNameMin: Cijk_Ailk_Bjlk_HBH_MT64x64x16_MI32x32x8x1_SE_AF0EM8_EPS1_GRVW4_GSU1_PGR1_SU0_SUS256_SRVW4_TT1_32_VAW2_WG64_4_1_WGM2
    SolutionIndex: 149
    SolutionNameMin: Cijk_Ailk_Bjlk_HBH_MT64x64x16_MI32x32x8x1_SE_AF0EM8_EPS0_GRVW8_GSU1_PGR2_SU32_SUS128_SRVW4_TT1_32_VAW2_WG64_4_1_WGM15
    SolutionIndex: 150
    SolutionNameMin: Cijk_Ailk_Bjlk_HBH_MT128x288x16_MI32x32x8x1_SE_AF0EM8_EPS0_GRVW2_GSU1_PGR2_SU0_SUS256_SRVW4_TT1_288_VAW2_WG128_2_1_WGM15
    SolutionIndex: 151
    SolutionNameMin: Cijk_Ailk_Bjlk_HBH_MT128x96x16_MI32x32x8x1_SE_AF0EM8_EPS0_GRVW2_GSU1_PGR2_SU0_SUS256_SRVW4_TT1_96_VAW2_WG128_2_1_WGM15
    SolutionIndex: 152
    SolutionNameMin: Cijk_Ailk_Bjlk_HBH_MT128x160x16_MI32x32x8x1_SE_AF0EM8_EPS0_GRVW2_GSU1_PGR2_SU32_SUS128_SRVW4_TT1_160_VAW2_WG128_2_1_WGM15
    SolutionIndex: 153
    SolutionNameMin: Cijk_Ailk_Bjlk_HBH_MT64x64x16_MI32x32x8x1_SE_AF0EM8_EPS0_GRVW4_GSU1_PGR2_SU0_SUS256_SRVW4_TT1_32_VAW2_WG64_4_1_WGM1
    SolutionIndex: 154
    SolutionNameMin: Cijk_Ailk_Bjlk_HBH_MT16x64x32_MI16x16x16x1_SE_AF0EM8_EPS1_GRVW2_GSU1_PGR1_SU0_SUS256_SRVW0_TT1_16_VAW2_WG16_16_1_WGM1
    SolutionIndex: 155
    SolutionNameMin: Cijk_Ailk_Bjlk_HBH_MT16x16x32_MI16x16x16x1_SE_AF0EM8_EPS0_GRVW2_GSU5_PGR2_SU0_SUS256_SRVW0_TT1_16_VAW1_WG16_4_1_WGM1
    SolutionIndex: 156
    SolutionNameMin: Cijk_Ailk_Bjlk_HBH_MT64x32x16_MI16x16x16x1_SE_AF0EM8_EPS0_GRVW2_GSU1_PGR2_SU0_SUS256_SRVW4_TT2_16_VAW2_WG32_8_1_WGM15
    SolutionIndex: 157
    SolutionNameMin: Cijk_Ailk_Bjlk_HBH_MT64x64x16_MI32x32x8x1_SE_AF0EM8_EPS0_GRVW4_GSU1_PGR2_SU0_SUS256_SRVW4_TT1_32_VAW2_WG64_4_1_WGM15
    SolutionIndex: 158
    SolutionNameMin: Cijk_Ailk_Bjlk_HBH_MT128x96x64_MI32x32x8x1_SE_AF0EM8_EPS0_GRVW8_GSU1_PGR2_SU0_SUS256_SRVW4_TT1_96_VAW2_WG128_2_1_WGM1
    SolutionIndex: 159
    SolutionNameMin: Cijk_Ailk_Bjlk_HBH_MT128x288x32_MI32x32x8x1_SE_AF0EM8_EPS0_GRVW4_GSU1_PGR2_SU0_SUS256_SRVW4_TT1_288_VAW2_WG128_2_1_WGM15
    SolutionIndex: 160
    SolutionNameMin: Cijk_Ailk_Bjlk_HBH_MT128x256x16_MI32x32x8x1_SE_AF0EM8_EPS0_GRVW8_GSU1_PGR2_SU0_SUS256_SRVW4_TT2_128_VAW2_WG64_4_1_WGM15
    SolutionIndex: 161
    SolutionNameMin: Cijk_Ailk_Bjlk_HBH_MT144x256x32_MI16x16x16x1_SE_AF0EM8_EPS0_GRVW2_GSU1_PGR2_SU0_SUS256_SRVW0_TT9_64_VAW2_WG16_16_1_WGM1
    SolutionIndex: 162
    SolutionNameMin: Cijk_Ailk_Bjlk_HBH_MT64x64x16_MI32x32x8x1_SE_AF0EM8_EPS0_GRVW2_GSU1_PGR2_SU32_SUS256_SRVW4_TT1_32_VAW2_WG64_4_1_WGM15
    SolutionIndex: 163
    SolutionNameMin: Cijk_Ailk_Bjlk_HBH_MT64x16x64_MI16x16x16x1_SE_AF0EM8_EPS0_GRVW2_GSU7_PGR2_SU0_SUS256_SRVW0_TT1_16_VAW1_WG64_4_1_WGM1
    SolutionIndex: 164
    SolutionNameMin: Cijk_Ailk_Bjlk_HBH_MT64x64x16_MI32x32x8x1_SE_AF0EM8_EPS0_GRVW2_GSU1_PGR2_SU0_SUS256_SRVW4_TT1_32_VAW2_WG64_4_1_WGM15
    SolutionIndex: 165
    SolutionNameMin: Cijk_Ailk_Bjlk_HBH_MT64x192x32_MI32x32x8x1_SE_AF0EM8_EPS0_GRVW8_GSU1_PGR2_SU0_SUS256_SRVW4_TT1_96_VAW2_WG64_4_1_WGM1
    SolutionIndex: 166
    SolutionNameMin: Cijk_Ailk_Bjlk_HBH_MT128x160x32_MI32x32x8x1_SE_AF0EM8_EPS0_GRVW4_GSU2_PGR2_SU0_SUS256_SRVW4_TT1_160_VAW1_WG128_2_1_WGM15
    SolutionIndex: 167
    SolutionNameMin: Cijk_Ailk_Bjlk_HBH_MT128x288x32_MI32x32x8x1_SE_AF0EM8_EPS0_GRVW2_GSU1_PGR2_SU0_SUS256_SRVW4_TT1_288_VAW2_WG128_2_1_WGM15
    SolutionIndex: 168
    SolutionNameMin: Cijk_Ailk_Bjlk_HBH_MT128x256x16_MI32x32x8x1_SE_AF0EM8_EPS0_GRVW8_GSU1_PGR2_SU0_SUS256_SRVW4_TT2_128_VAW2_WG64_4_1_WGM15
    SolutionIndex: 169
    SolutionNameMin: Cijk_Ailk_Bjlk_HBH_MT144x256x32_MI16x16x16x1_SE_AF0EM8_EPS0_GRVW2_GSU1_PGR2_SU32_SUS128_SRVW0_TT9_64_VAW2_WG16_16_1_WGM15
    SolutionIndex: 170
    SolutionNameMin: Cijk_Ailk_Bjlk_HBH_MT64x128x16_MI32x32x8x1_SE_AF0EM8_EPS0_GRVW2_GSU1_PGR2_SU0_SUS256_SRVW4_TT1_64_VAW2_WG64_4_1_WGM2
    SolutionIndex: 171
    SolutionNameMin: Cijk_Ailk_Bjlk_HBH_MT32x32x16_MI16x16x16x1_SE_AF0EM8_EPS1_GRVW2_GSU1_PGR1_SU0_SUS256_SRVW4_TT1_16_VAW2_WG32_8_1_WGM1
    SolutionIndex: 172
    SolutionNameMin: Cijk_Ailk_Bjlk_HBH_MT64x16x64_MI16x16x16x1_SE_AF0EM8_EPS0_GRVW2_GSU7_PGR2_SU32_SUS256_SRVW4_TT1_16_VAW1_WG64_4_1_WGM1
    SolutionIndex: 173
    SolutionNameMin: Cijk_Ailk_Bjlk_HBH_MT128x96x64_MI32x32x8x1_SE_AF0EM8_EPS0_GRVW8_GSU1_PGR2_SU0_SUS256_SRVW4_TT1_96_VAW2_WG128_2_1_WGM2
    SolutionIndex: 174
    SolutionNameMin: Cijk_Ailk_Bjlk_HBH_MT64x64x16_MI32x32x8x1_SE_AF0EM8_EPS0_GRVW8_GSU1_PGR2_SU0_SUS256_SRVW4_TT1_32_VAW2_WG64_4_1_WGM1
    SolutionIndex: 175
    SolutionNameMin: Cijk_Ailk_Bjlk_HBH_MT64x16x64_MI16x16x16x1_SE_AF0EM8_EPS0_GRVW2_GSU7_PGR2_SU32_SUS256_SRVW0_TT1_16_VAW1_WG64_4_1_WGM2
    SolutionIndex: 176
    SolutionNameMin: Cijk_Ailk_Bjlk_HBH_MT128x96x32_MI32x32x8x1_SE_AF0EM8_EPS0_GRVW4_GSU1_PGR2_SU0_SUS256_SRVW4_TT1_96_VAW2_WG128_2_1_WGM2
    SolutionIndex: 177
    SolutionNameMin: Cijk_Ailk_Bjlk_HBH_MT128x160x32_MI32x32x8x1_SE_AF0EM8_EPS0_GRVW4_GSU2_PGR2_SU0_SUS256_SRVW4_TT1_160_VAW1_WG128_2_1_WGM2
    SolutionIndex: 178
    SolutionNameMin: Cijk_Ailk_Bjlk_HBH_MT256x256x16_MI32x32x8x1_SE_AF0EM8_EPS0_GRVW8_GSU1_PGR2_SU0_SUS256_SRVW4_TT4_128_VAW2_WG64_4_1_WGM1
    SolutionIndex: 179
    SolutionNameMin: Cijk_Ailk_Bjlk_HBH_MT64x64x16_MI32x32x8x1_SE_AF0EM8_EPS0_GRVW8_GSU1_PGR2_SU0_SUS256_SRVW4_TT1_32_VAW2_WG64_4_1_WGM15
    SolutionIndex: 180
    SolutionNameMin: Cijk_Ailk_Bjlk_HBH_MT64x64x16_MI32x32x8x1_SE_AF0EM8_EPS1_GRVW2_GSU1_PGR1_SU0_SUS256_SRVW4_TT1_32_VAW2_WG64_4_1_WGM15
    SolutionIndex: 181
    SolutionNameMin: Cijk_Ailk_Bjlk_HBH_MT64x192x32_MI32x32x8x1_SE_AF0EM8_EPS0_GRVW4_GSU1_PGR2_SU0_SUS256_SRVW4_TT1_96_VAW2_WG64_4_1_WGM1
    SolutionIndex: 182
    SolutionNameMin: Cijk_Ailk_Bjlk_HBH_MT128x256x32_MI32x32x8x1_SE_AF0EM8_EPS0_GRVW2_GSU3_PGR2_SU0_SUS256_SRVW4_TT2_128_VAW1_WG64_4_1_WGM2
    SolutionIndex: 183
    SolutionNameMin: Cijk_Ailk_Bjlk_HBH_MT64x128x16_MI32x32x8x1_SE_AF0EM8_EPS0_GRVW2_GSU1_PGR2_SU32_SUS256_SRVW4_TT1_64_VAW2_WG64_4_1_WGM1
    SolutionIndex: 184
    SolutionNameMin: Cijk_Ailk_Bjlk_HBH_MT64x16x64_MI16x16x16x1_SE_AF0EM8_EPS0_GRVW2_GSU7_PGR2_SU32_SUS256_SRVW0_TT1_16_VAW1_WG64_4_1_WGM1
    SolutionIndex: 185
    SolutionNameMin: Cijk_Ailk_Bjlk_HBH_MT64x64x16_MI32x32x8x1_SE_AF0EM8_EPS0_GRVW4_GSU1_PGR2_SU32_SUS128_SRVW4_TT1_32_VAW2_WG64_4_1_WGM15
    SolutionIndex: 186
    SolutionNameMin: Cijk_Ailk_Bjlk_HBH_MT128x256x16_MI32x32x8x1_SE_AF0EM8_EPS0_GRVW8_GSU1_PGR2_SU32_SUS128_SRVW4_TT2_128_VAW2_WG64_4_1_WGM15
    SolutionIndex: 187
    SolutionNameMin: Cijk_Ailk_Bjlk_HBH_MT64x256x16_MI32x32x8x1_SE_AF0EM8_EPS1_GRVW8_GSU1_PGR1_SU32_SUS256_SRVW4_TT1_128_VAW2_WG64_4_1_WGM1
    SolutionIndex: 188
    SolutionNameMin: Cijk_Ailk_Bjlk_HBH_MT64x16x64_MI16x16x16x1_SE_AF0EM8_EPS0_GRVW2_GSU7_PGR2_SU32_SUS128_SRVW0_TT1_16_VAW1_WG64_4_1_WGM1
    SolutionIndex: 189
    SolutionNameMin: Cijk_Ailk_Bjlk_HBH_MT64x64x16_MI32x32x8x1_SE_AF0EM8_EPS0_GRVW2_GSU1_PGR2_SU0_SUS256_SRVW4_TT1_32_VAW2_WG64_4_1_WGM2
    SolutionIndex: 190
    SolutionNameMin: Cijk_Ailk_Bjlk_HBH_MT128x96x64_MI32x32x8x1_SE_AF0EM8_EPS0_GRVW4_GSU1_PGR2_SU32_SUS128_SRVW4_TT1_96_VAW2_WG128_2_1_WGM2
    SolutionIndex: 191
    SolutionNameMin: Cijk_Ailk_Bjlk_HBH_MT16x16x64_MI16x16x16x1_SE_AF0EM8_EPS0_GRVW2_GSU3_PGR2_SU0_SUS256_SRVW0_TT1_16_VAW1_WG16_4_1_WGM1
    SolutionIndex: 192
    SolutionNameMin: Cijk_Ailk_Bjlk_HBH_MT128x256x16_MI32x32x8x1_SE_AF0EM8_EPS0_GRVW4_GSU1_PGR2_SU32_SUS128_SRVW4_TT2_128_VAW2_WG64_4_1_WGM15
    SolutionIndex: 193
    SolutionNameMin: Cijk_Ailk_Bjlk_HBH_MT256x160x32_MI32x32x8x1_SE_AF0EM8_EPS1_GRVW4_GSU1_PGR1_SU0_SUS256_SRVW4_TT2_160_VAW2_WG128_2_1_WGM2
    SolutionIndex: 194
    SolutionNameMin: Cijk_Ailk_Bjlk_HBH_MT64x64x16_MI32x32x8x1_SE_AF0EM8_EPS0_GRVW8_GSU1_PGR2_SU32_SUS256_SRVW4_TT1_32_VAW2_WG64_4_1_WGM1
    SolutionIndex: 195
    SolutionNameMin: Cijk_Ailk_Bjlk_HBH_MT16x16x64_MI16x16x16x1_SE_AF0EM8_EPS0_GRVW2_GSU3_PGR2_SU0_SUS256_SRVW0_TT1_16_VAW1_WG16_4_1_WGM15
    SolutionIndex: 196
    SolutionNameMin: Cijk_Ailk_Bjlk_HBH_MT64x32x16_MI16x16x16x1_SE_AF0EM8_EPS1_GRVW2_GSU1_PGR1_SU0_SUS256_SRVW4_TT2_16_VAW2_WG32_8_1_WGM15
    SolutionIndex: 197
    SolutionNameMin: Cijk_Ailk_Bjlk_HBH_MT64x64x32_MI32x32x8x1_SE_AF0EM8_EPS0_GRVW8_GSU15_PGR2_SU0_SUS256_SRVW4_TT1_32_VAW1_WG64_4_1_WGM15
    SolutionIndex: 198
    SolutionNameMin: Cijk_Ailk_Bjlk_HBH_MT64x64x16_MI32x32x8x1_SE_AF0EM8_EPS1_GRVW2_GSU1_PGR1_SU0_SUS256_SRVW4_TT1_32_VAW2_WG64_4_1_WGM1
    SolutionIndex: 199
    SolutionNameMin: Cijk_Ailk_Bjlk_HBH_MT128x128x32_MI32x32x8x1_SE_AF0EM8_EPS0_GRVW2_GSU15_PGR2_SU32_SUS128_SRVW4_TT2_64_VAW1_WG64_4_1_WGM15
    SolutionIndex: 200
    SolutionNameMin: Cijk_Ailk_Bjlk_HBH_MT128x256x32_MI32x32x8x1_SE_AF0EM8_EPS0_GRVW8_GSU7_PGR2_SU0_SUS256_SRVW4_TT2_128_VAW1_WG64_4_1_WGM1
    SolutionIndex: 201
    SolutionNameMin: Cijk_Ailk_Bjlk_HBH_MT256x256x32_MI32x32x8x1_SE_AF0EM8_EPS1_GRVW8_GSU7_PGR1_SU0_SUS256_SRVW0_TT4_128_VAW1_WG64_4_1_WGM1
    SolutionIndex: 202
    SolutionNameMin: Cijk_Ailk_Bjlk_HBH_MT64x64x32_MI32x32x8x1_SE_AF0EM8_EPS0_GRVW4_GSU1_PGR2_SU32_SUS128_SRVW4_TT1_32_VAW2_WG64_4_1_WGM2
    SolutionIndex: 203
    SolutionNameMin: Cijk_Ailk_Bjlk_HBH_MT4x64x32_MI4x4x4x16_SE_AF0EM8_EPS1_GRVW2_GSU1_PGR1_SU0_SUS256_SRVW0_TT1_4_VAW2_WG4_16_1_WGM1
    SolutionIndex: 204
    SolutionNameMin: Cijk_Ailk_Bjlk_HBH_MT64x64x32_MI32x32x8x1_SE_AF0EM8_EPS0_GRVW8_GSU1_PGR2_SU32_SUS128_SRVW4_TT1_32_VAW2_WG64_4_1_WGM15
    SolutionIndex: 205
    SolutionNameMin: Cijk_Ailk_Bjlk_HBH_MT256x256x32_MI32x32x8x1_SE_AF0EM8_EPS1_GRVW8_GSU1_PGR1_SU32_SUS256_SRVW4_TT4_128_VAW2_WG64_4_1_WGM1
    SolutionIndex: 206
    SolutionNameMin: Cijk_Ailk_Bjlk_HBH_MT144x256x32_MI16x16x16x1_SE_AF0EM8_EPS0_GRVW2_GSU1_PGR2_SU32_SUS256_SRVW0_TT9_64_VAW2_WG16_16_1_WGM2
    SolutionIndex: 207
    SolutionNameMin: Cijk_Ailk_Bjlk_HBH_MT128x64x16_MI32x32x8x1_SE_AF0EM8_EPS0_GRVW8_GSU1_PGR2_SU32_SUS128_SRVW4_TT2_32_VAW2_WG64_4_1_WGM1
    SolutionIndex: 208
    SolutionNameMin: Cijk_Ailk_Bjlk_HBH_MT128x160x32_MI32x32x8x1_SE_AF0EM8_EPS0_GRVW4_GSU2_PGR2_SU32_SUS128_SRVW4_TT1_160_VAW1_WG128_2_1_WGM15
    SolutionIndex: 209
    SolutionNameMin: Cijk_Ailk_Bjlk_HBH_MT256x160x32_MI32x32x8x1_SE_AF0EM8_EPS1_GRVW4_GSU1_PGR1_SU0_SUS256_SRVW4_TT2_160_VAW2_WG128_2_1_WGM15
    SolutionIndex: 210
    SolutionNameMin: Cijk_Ailk_Bjlk_HBH_MT128x256x16_MI32x32x8x1_SE_AF0EM8_EPS0_GRVW8_GSU1_PGR2_SU0_SUS256_SRVW4_TT2_128_VAW2_WG64_4_1_WGM2
    SolutionIndex: 211
    SolutionNameMin: Cijk_Ailk_Bjlk_HBH_MT144x256x32_MI16x16x16x1_SE_AF0EM8_EPS0_GRVW2_GSU1_PGR2_SU32_SUS256_SRVW0_TT9_64_VAW2_WG16_16_1_WGM1
    SolutionIndex: 212
    SolutionNameMin: Cijk_Ailk_Bjlk_HBH_MT128x256x16_MI32x32x8x1_SE_AF0EM8_EPS0_GRVW4_GSU7_PGR2_SU0_SUS256_SRVW4_TT2_128_VAW1_WG64_4_1_WGM15
    SolutionIndex: 213
    SolutionNameMin: Cijk_Ailk_Bjlk_HBH_MT128x256x32_MI32x32x8x1_SE_AF0EM8_EPS0_GRVW8_GSU7_PGR2_SU0_SUS256_SRVW4_TT2_128_VAW1_WG64_4_1_WGM2
    SolutionIndex: 214
    SolutionNameMin: Cijk_Ailk_Bjlk_HBH_MT128x256x32_MI32x32x8x1_SE_AF0EM8_EPS0_GRVW4_GSU7_PGR2_SU0_SUS256_SRVW4_TT2_128_VAW1_WG64_4_1_WGM2
    SolutionIndex: 215
    SolutionNameMin: Cijk_Ailk_Bjlk_HBH_MT128x96x64_MI32x32x8x1_SE_AF0EM8_EPS0_GRVW4_GSU1_PGR2_SU0_SUS256_SRVW4_TT1_96_VAW2_WG128_2_1_WGM2
    SolutionIndex: 216
    SolutionNameMin: Cijk_Ailk_Bjlk_HBH_MT128x288x32_MI32x32x8x1_SE_AF0EM8_EPS0_GRVW2_GSU1_PGR2_SU32_SUS128_SRVW4_TT1_288_VAW2_WG128_2_1_WGM15
    SolutionIndex: 217
    SolutionNameMin: Cijk_Ailk_Bjlk_HBH_MT256x160x32_MI32x32x8x1_SE_AF0EM8_EPS1_GRVW4_GSU1_PGR1_SU32_SUS128_SRVW4_TT2_160_VAW2_WG128_2_1_WGM15
    SolutionIndex: 218
    SolutionNameMin: Cijk_Ailk_Bjlk_HBH_MT288x128x32_MI32x32x8x1_SE_AF0EM8_EPS0_GRVW2_GSU1_PGR2_SU0_SUS256_SRVW0_TT9_32_VAW2_WG32_8_1_WGM1
    SolutionIndex: 219
    SolutionNameMin: Cijk_Ailk_Bjlk_HBH_MT32x32x64_MI16x16x16x1_SE_AF0EM8_EPS0_GRVW8_GSU1_PGR2_SU0_SUS256_SRVW4_TT1_16_VAW2_WG32_8_1_WGM15
    SolutionIndex: 220
    SolutionNameMin: Cijk_Ailk_Bjlk_HBH_MT32x32x64_MI16x16x16x1_SE_AF0EM8_EPS0_GRVW8_GSU1_PGR2_SU0_SUS256_SRVW4_TT1_16_VAW2_WG32_8_1_WGM1
    SolutionIndex: 221
    SolutionNameMin: Cijk_Ailk_Bjlk_HBH_MT32x32x32_MI16x16x16x1_SE_AF0EM8_EPS0_GRVW4_GSU1_PGR2_SU0_SUS256_SRVW4_TT1_16_VAW2_WG32_8_1_WGM1
    SolutionIndex: 222
    SolutionNameMin: Cijk_Ailk_Bjlk_HBH_MT256x144x32_MI16x16x16x1_SE_AF0EM8_EPS0_GRVW2_GSU1_PGR2_SU32_SUS256_SRVW4_TT4_144_VAW2_WG64_4_1_WGM15
    SolutionIndex: 223
    SolutionNameMin: Cijk_Ailk_Bjlk_HBH_MT32x32x64_MI16x16x16x1_SE_AF0EM8_EPS0_GRVW4_GSU1_PGR2_SU0_SUS256_SRVW4_TT1_16_VAW2_WG32_8_1_WGM2
    SolutionIndex: 224
    SolutionNameMin: Cijk_Ailk_Bjlk_HBH_MT128x128x32_MI32x32x8x1_SE_AF0EM8_EPS0_GRVW8_GSU1_PGR2_SU0_SUS256_SRVW4_TT2_64_VAW2_WG64_4_1_WGM15
    SolutionIndex: 225
    SolutionNameMin: Cijk_Ailk_Bjlk_HBH_MT32x32x32_MI16x16x16x1_SE_AF0EM8_EPS0_GRVW8_GSU5_PGR2_SU0_SUS256_SRVW4_TT1_16_VAW1_WG32_8_1_WGM1
    SolutionIndex: 226
    SolutionNameMin: Cijk_Ailk_Bjlk_HBH_MT128x64x64_MI32x32x8x1_SE_AF0EM8_EPS0_GRVW8_GSU1_PGR2_SU0_SUS256_SRVW4_TT2_32_VAW2_WG64_4_1_WGM2
    SolutionIndex: 227
    SolutionNameMin: Cijk_Ailk_Bjlk_HBH_MT64x64x16_MI32x32x8x1_SE_AF0EM8_EPS1_GRVW4_GSU1_PGR1_SU32_SUS256_SRVW4_TT1_32_VAW2_WG64_4_1_WGM1
    SolutionIndex: 228
    SolutionNameMin: Cijk_Ailk_Bjlk_HBH_MT128x96x64_MI32x32x8x1_SE_AF0EM8_EPS1_GRVW8_GSU5_PGR1_SU0_SUS256_SRVW4_TT1_96_VAW1_WG128_2_1_WGM15
    SolutionIndex: 229
    SolutionNameMin: Cijk_Ailk_Bjlk_HBH_MT128x160x32_MI32x32x8x1_SE_AF0EM8_EPS0_GRVW4_GSU7_PGR2_SU0_SUS256_SRVW4_TT1_160_VAW1_WG128_2_1_WGM1
    SolutionIndex: 230
    SolutionNameMin: Cijk_Ailk_Bjlk_HBH_MT128x128x32_MI32x32x8x1_SE_AF0EM8_EPS0_GRVW8_GSU3_PGR2_SU32_SUS128_SRVW4_TT2_64_VAW1_WG64_4_1_WGM2
    SolutionIndex: 231
    SolutionNameMin: Cijk_Ailk_Bjlk_HBH_MT128x256x16_MI32x32x8x1_SE_AF0EM8_EPS0_GRVW4_GSU5_PGR2_SU0_SUS256_SRVW4_TT2_128_VAW1_WG64_4_1_WGM15
    SolutionIndex: 232
    SolutionNameMin: Cijk_Ailk_Bjlk_HBH_MT128x128x32_MI32x32x8x1_SE_AF0EM8_EPS0_GRVW4_GSU2_PGR2_SU0_SUS256_SRVW4_TT2_64_VAW1_WG64_4_1_WGM15
    SolutionIndex: 233
    SolutionNameMin: Cijk_Ailk_Bjlk_HBH_MT128x192x32_MI32x32x8x1_SE_AF0EM8_EPS0_GRVW4_GSU3_PGR2_SU0_SUS256_SRVW4_TT2_96_VAW1_WG64_4_1_WGM1
    SolutionIndex: 234
    SolutionNameMin: Cijk_Ailk_Bjlk_HBH_MT128x192x16_MI32x32x8x1_SE_AF0EM8_EPS0_GRVW4_GSU3_PGR2_SU0_SUS256_SRVW4_TT2_96_VAW1_WG64_4_1_WGM2
    SolutionIndex: 235
    SolutionNameMin: Cijk_Ailk_Bjlk_HBH_MT128x256x16_MI32x32x8x1_SE_AF0EM8_EPS0_GRVW4_GSU3_PGR2_SU0_SUS256_SRVW4_TT2_128_VAW1_WG64_4_1_WGM2
    SolutionIndex: 236
    SolutionNameMin: Cijk_Ailk_Bjlk_HBH_MT128x256x32_MI32x32x8x1_SE_AF0EM8_EPS1_GRVW8_GSU3_PGR1_SU0_SUS256_SRVW4_TT2_128_VAW1_WG64_4_1_WGM15
    SolutionIndex: 237
    SolutionNameMin: Cijk_Ailk_Bjlk_HBH_MT128x192x32_MI32x32x8x1_SE_AF0EM8_EPS0_GRVW4_GSU2_PGR2_SU0_SUS256_SRVW4_TT2_96_VAW1_WG64_4_1_WGM15
    SolutionIndex: 238
    SolutionNameMin: Cijk_Ailk_Bjlk_HBH_MT256x160x32_MI32x32x8x1_SE_AF0EM8_EPS1_GRVW4_GSU3_PGR1_SU32_SUS256_SRVW4_TT2_160_VAW1_WG128_2_1_WGM2
    SolutionIndex: 239
    SolutionNameMin: Cijk_Ailk_Bjlk_HBH_MT128x128x32_MI32x32x8x1_SE_AF0EM8_EPS0_GRVW4_GSU1_PGR2_SU0_SUS256_SRVW4_TT2_64_VAW2_WG64_4_1_WGM15
    SolutionIndex: 240
    SolutionNameMin: Cijk_Ailk_Bjlk_HBH_MT128x288x32_MI32x32x8x1_SE_AF0EM8_EPS0_GRVW4_GSU2_PGR2_SU0_SUS256_SRVW4_TT1_288_VAW1_WG128_2_1_WGM15
    SolutionIndex: 241
    SolutionNameMin: Cijk_Ailk_Bjlk_HBH_MT128x160x32_MI32x32x8x1_SE_AF0EM8_EPS0_GRVW4_GSU1_PGR2_SU0_SUS256_SRVW4_TT1_160_VAW2_WG128_2_1_WGM2
    SolutionIndex: 242
    SolutionNameMin: Cijk_Ailk_Bjlk_HBH_MT128x192x32_MI32x32x8x1_SE_AF0EM8_EPS0_GRVW4_GSU1_PGR2_SU0_SUS256_SRVW4_TT2_96_VAW2_WG64_4_1_WGM15
    SolutionIndex: 243
    SolutionNameMin: Cijk_Ailk_Bjlk_HBH_MT128x192x32_MI32x32x8x1_SE_AF0EM8_EPS0_GRVW4_GSU1_PGR2_SU0_SUS256_SRVW4_TT2_96_VAW2_WG64_4_1_WGM1
    SolutionIndex: 244
    SolutionNameMin: Cijk_Ailk_Bjlk_HBH_MT128x192x32_MI32x32x8x1_SE_AF0EM8_EPS0_GRVW4_GSU1_PGR2_SU0_SUS256_SRVW4_TT2_96_VAW2_WG64_4_1_WGM2
    SolutionIndex: 245
    SolutionNameMin: Cijk_Ailk_Bjlk_HBH_MT128x256x32_MI32x32x8x1_SE_AF0EM8_EPS1_GRVW4_GSU1_PGR1_SU0_SUS256_SRVW4_TT2_128_VAW2_WG64_4_1_WGM1
    SolutionIndex: 246
    SolutionNameMin: Cijk_Ailk_Bjlk_HBH_MT128x256x32_MI32x32x8x1_SE_AF0EM8_EPS1_GRVW8_GSU1_PGR1_SU0_SUS256_SRVW4_TT2_128_VAW2_WG64_4_1_WGM15
    SolutionIndex: 247
    SolutionNameMin: Cijk_Ailk_Bjlk_HBH_MT256x128x32_MI32x32x8x1_SE_AF0EM8_EPS1_GRVW8_GSU1_PGR1_SU32_SUS256_SRVW4_TT4_64_VAW2_WG64_4_1_WGM15
    SolutionIndex: 248
    SolutionNameMin: Cijk_Ailk_Bjlk_HBH_MT256x128x32_MI32x32x8x1_SE_AF0EM8_EPS1_GRVW8_GSU1_PGR1_SU32_SUS256_SRVW4_TT4_64_VAW2_WG64_4_1_WGM2
    SolutionIndex: 249
    SolutionNameMin: Cijk_Ailk_Bjlk_HBH_MT256x128x32_MI32x32x8x1_SE_AF0EM8_EPS1_GRVW8_GSU1_PGR1_SU0_SUS256_SRVW4_TT4_64_VAW2_WG64_4_1_WGM1
    SolutionIndex: 250
    SolutionNameMin: Cijk_Ailk_Bjlk_HBH_MT128x288x32_MI32x32x8x1_SE_AF0EM8_EPS1_GRVW4_GSU1_PGR1_SU0_SUS256_SRVW4_TT1_288_VAW2_WG128_2_1_WGM2
    SolutionIndex: 251
    SolutionNameMin: Cijk_Ailk_Bjlk_HBH_MT128x288x32_MI32x32x8x1_SE_AF0EM8_EPS1_GRVW4_GSU1_PGR1_SU0_SUS256_SRVW4_TT1_288_VAW2_WG128_2_1_WGM15
    SolutionIndex: 252
    SolutionNameMin: Cijk_Ailk_Bjlk_HBH_MT256x160x32_MI32x32x8x1_SE_AF0EM8_EPS1_GRVW4_GSU1_PGR1_SU32_SUS128_SRVW4_TT2_160_VAW2_WG128_2_1_WGM1
    SolutionIndex: 253
    SolutionNameMin: Cijk_Ailk_Bjlk_HBH_MT256x192x16_MI32x32x8x1_SE_AF0EM8_EPS1_GRVW4_GSU1_PGR1_SU32_SUS256_SRVW4_TT4_96_VAW2_WG64_4_1_WGM2
    SolutionIndex: 254
    SolutionNameMin: Cijk_Ailk_Bjlk_HBH_MT256x192x32_MI32x32x8x1_SE_AF0EM8_EPS1_GRVW8_GSU1_PGR1_SU32_SUS256_SRVW4_TT4_96_VAW2_WG64_4_1_WGM2
    SolutionIndex: 255
    SolutionNameMin: Cijk_Ailk_Bjlk_HBH_MT256x192x32_MI32x32x8x1_SE_AF0EM8_EPS1_GRVW8_GSU1_PGR1_SU32_SUS128_SRVW4_TT4_96_VAW2_WG64_4_1_WGM2
    SolutionIndex: 256
    SolutionNameMin: Cijk_Ailk_Bjlk_HBH_MT256x192x16_MI32x32x8x1_SE_AF0EM8_EPS1_GRVW4_GSU1_PGR1_SU32_SUS128_SRVW4_TT4_96_VAW2_WG64_4_1_WGM2
    SolutionIndex: 257
    SolutionNameMin: Cijk_Ailk_Bjlk_HBH_MT256x192x16_MI32x32x8x1_SE_AF0EM8_EPS1_GRVW4_GSU1_PGR1_SU32_SUS256_SRVW4_TT4_96_VAW2_WG64_4_1_WGM15
    SolutionIndex: 258
    SolutionNameMin: Cijk_Ailk_Bjlk_HBH_MT256x256x16_MI32x32x8x1_SE_AF0EM8_EPS1_GRVW4_GSU1_PGR1_SU32_SUS128_SRVW4_TT4_128_VAW2_WG64_4_1_WGM2
    SolutionIndex: 259
    SolutionNameMin: Cijk_Ailk_Bjlk_HBH_MT128x192x16_MI32x32x8x1_SE_AF0EM8_EPS0_GRVW4_GSU1_PGR2_SU0_SUS256_SRVW4_TT2_96_VAW2_WG64_4_1_WGM15
    SolutionIndex: 260
    SolutionNameMin: Cijk_Ailk_Bjlk_HBH_MT256x192x32_MI32x32x8x1_SE_AF0EM8_EPS1_GRVW8_GSU1_PGR1_SU32_SUS256_SRVW4_TT4_96_VAW2_WG64_4_1_WGM2
    SolutionIndex: 261
    SolutionNameMin: Cijk_Ailk_Bjlk_HBH_MT128x256x32_MI32x32x8x1_SE_AF0EM8_EPS1_GRVW8_GSU7_PGR1_SU0_SUS256_SRVW4_TT2_128_VAW1_WG64_4_1_WGM1
    SolutionIndex: 262
    SolutionNameMin: Cijk_Ailk_Bjlk_HBH_MT32x32x32_MI16x16x16x1_SE_AF0EM8_EPS0_GRVW8_GSU1_PGR2_SU0_SUS256_SRVW4_TT1_16_VAW2_WG32_8_1_WGM1
    SolutionIndex: 263
    SolutionNameMin: Cijk_Ailk_Bjlk_HBH_MT64x64x32_MI32x32x8x1_SE_AF0EM8_EPS0_GRVW8_GSU1_PGR2_SU0_SUS256_SRVW4_TT1_32_VAW2_WG64_4_1_WGM1
    SolutionIndex: 264
    SolutionNameMin: Cijk_Ailk_Bjlk_HBH_MT128x64x16_MI32x32x8x1_SE_AF0EM8_EPS0_GRVW4_GSU1_PGR2_SU0_SUS256_SRVW4_TT2_32_VAW2_WG64_4_1_WGM2
    SolutionIndex: 265
    SolutionNameMin: Cijk_Ailk_Bjlk_HBH_MT32x32x64_MI16x16x16x1_SE_AF0EM8_EPS0_GRVW4_GSU1_PGR2_SU0_SUS256_SRVW4_TT1_16_VAW2_WG32_8_1_WGM1
    SolutionIndex: 266
    SolutionNameMin: Cijk_Ailk_Bjlk_HBH_MT64x64x64_MI32x32x8x1_SE_AF0EM8_EPS0_GRVW8_GSU1_PGR2_SU32_SUS256_SRVW4_TT1_32_VAW2_WG64_4_1_WGM1
    SolutionIndex: 267
    SolutionNameMin: Cijk_Ailk_Bjlk_HBH_MT64x64x64_MI32x32x8x1_SE_AF0EM8_EPS0_GRVW8_GSU1_PGR2_SU0_SUS256_SRVW4_TT1_32_VAW2_WG64_4_1_WGM2
    SolutionIndex: 268
    SolutionNameMin: Cijk_Ailk_Bjlk_HBH_MT128x128x32_MI32x32x8x1_SE_AF0EM8_EPS0_GRVW8_GSU7_PGR2_SU32_SUS128_SRVW4_TT2_64_VAW1_WG64_4_1_WGM15
    SolutionIndex: 269
    SolutionNameMin: Cijk_Ailk_Bjlk_HBH_MT128x128x32_MI32x32x8x1_SE_AF0EM8_EPS0_GRVW8_GSU7_PGR2_SU0_SUS256_SRVW4_TT2_64_VAW1_WG64_4_1_WGM1
    SolutionIndex: 270
    SolutionNameMin: Cijk_Ailk_Bjlk_HBH_MT128x128x32_MI32x32x8x1_SE_AF0EM8_EPS0_GRVW2_GSU7_PGR2_SU0_SUS256_SRVW4_TT2_64_VAW1_WG64_4_1_WGM1
    SolutionIndex: 271
    SolutionNameMin: Cijk_Ailk_Bjlk_HBH_MT128x128x32_MI32x32x8x1_SE_AF0EM8_EPS0_GRVW8_GSU7_PGR2_SU32_SUS128_SRVW4_TT2_64_VAW1_WG64_4_1_WGM2
    SolutionIndex: 272
    SolutionNameMin: Cijk_Ailk_Bjlk_HBH_MT128x128x32_MI32x32x8x1_SE_AF0EM8_EPS0_GRVW4_GSU7_PGR2_SU32_SUS256_SRVW4_TT2_64_VAW1_WG64_4_1_WGM15
    SolutionIndex: 273
    SolutionNameMin: Cijk_Ailk_Bjlk_HBH_MT128x128x64_MI32x32x8x1_SE_AF0EM8_EPS0_GRVW8_GSU7_PGR2_SU0_SUS256_SRVW4_TT2_64_VAW1_WG64_4_1_WGM2
    SolutionIndex: 274
    SolutionNameMin: Cijk_Ailk_Bjlk_HBH_MT128x128x64_MI32x32x8x1_SE_AF0EM8_EPS0_GRVW8_GSU7_PGR2_SU32_SUS256_SRVW4_TT2_64_VAW1_WG64_4_1_WGM15
    SolutionIndex: 275
    SolutionNameMin: Cijk_Ailk_Bjlk_HBH_MT128x128x64_MI32x32x8x1_SE_AF0EM8_EPS0_GRVW8_GSU7_PGR2_SU32_SUS128_SRVW4_TT2_64_VAW1_WG64_4_1_WGM1
    SolutionIndex: 276
    SolutionNameMin: Cijk_Ailk_Bjlk_HBH_MT128x128x64_MI32x32x8x1_SE_AF0EM8_EPS0_GRVW8_GSU7_PGR2_SU32_SUS256_SRVW4_TT2_64_VAW1_WG64_4_1_WGM2
    SolutionIndex: 277
    SolutionNameMin: Cijk_Ailk_Bjlk_HBH_MT128x128x32_MI32x32x8x1_SE_AF0EM8_EPS0_GRVW2_GSU7_PGR2_SU32_SUS256_SRVW4_TT2_64_VAW1_WG64_4_1_WGM15
    SolutionIndex: 278
    SolutionNameMin: Cijk_Ailk_Bjlk_HBH_MT128x128x32_MI32x32x8x1_SE_AF0EM8_EPS0_GRVW2_GSU7_PGR2_SU32_SUS128_SRVW4_TT2_64_VAW1_WG64_4_1_WGM2
    SolutionIndex: 279
    SolutionNameMin: Cijk_Ailk_Bjlk_HBH_MT128x128x64_MI32x32x8x1_SE_AF0EM8_EPS0_GRVW4_GSU7_PGR2_SU32_SUS128_SRVW4_TT2_64_VAW1_WG64_4_1_WGM1
    SolutionIndex: 280
    SolutionNameMin: Cijk_Ailk_Bjlk_HBH_MT128x128x64_MI32x32x8x1_SE_AF0EM8_EPS0_GRVW8_GSU7_PGR2_SU32_SUS128_SRVW4_TT2_64_VAW1_WG64_4_1_WGM15
    SolutionIndex: 281
    SolutionNameMin: Cijk_Ailk_Bjlk_HBH_MT128x128x64_MI32x32x8x1_SE_AF0EM8_EPS0_GRVW8_GSU7_PGR2_SU32_SUS128_SRVW4_TT2_64_VAW1_WG64_4_1_WGM2
    SolutionIndex: 282
    SolutionNameMin: Cijk_Ailk_Bjlk_HBH_MT128x128x64_MI32x32x8x1_SE_AF0EM8_EPS0_GRVW8_GSU7_PGR2_SU0_SUS256_SRVW4_TT2_64_VAW1_WG64_4_1_WGM15
    SolutionIndex: 283
    SolutionNameMin: Cijk_Ailk_Bjlk_HBH_MT128x256x32_MI32x32x8x1_SE_AF0EM8_EPS1_GRVW8_GSU15_PGR1_SU0_SUS256_SRVW4_TT2_128_VAW1_WG64_4_1_WGM15
    SolutionIndex: 284
    SolutionNameMin: Cijk_Ailk_Bjlk_HBH_MT128x256x32_MI32x32x8x1_SE_AF0EM8_EPS1_GRVW8_GSU15_PGR1_SU0_SUS256_SRVW4_TT2_128_VAW1_WG64_4_1_WGM1
    SolutionIndex: 285
    SolutionNameMin: Cijk_Ailk_Bjlk_HBH_MT128x256x16_MI32x32x8x1_SE_AF0EM8_EPS0_GRVW8_GSU15_PGR2_SU0_SUS256_SRVW4_TT2_128_VAW1_WG64_4_1_WGM2
    SolutionIndex: 286
    SolutionNameMin: Cijk_Ailk_Bjlk_HBH_MT128x256x32_MI32x32x8x1_SE_AF0EM8_EPS0_GRVW8_GSU15_PGR2_SU0_SUS256_SRVW4_TT2_128_VAW1_WG64_4_1_WGM2
    SolutionIndex: 287
    SolutionNameMin: Cijk_Ailk_Bjlk_HBH_MT128x256x32_MI32x32x8x1_SE_AF0EM8_EPS0_GRVW4_GSU15_PGR2_SU0_SUS256_SRVW4_TT2_128_VAW1_WG64_4_1_WGM15
    SolutionIndex: 288
    SolutionNameMin: Cijk_Ailk_Bjlk_HBH_MT128x128x32_MI32x32x8x1_SE_AF0EM8_EPS0_GRVW8_GSU1_PGR2_SU0_SUS256_SRVW4_TT2_64_VAW2_WG64_4_1_WGM2
    SolutionIndex: 289
    SolutionNameMin: Cijk_Ailk_Bjlk_HBH_MT64x64x32_MI32x32x8x1_SE_AF0EM8_EPS0_GRVW8_GSU1_PGR2_SU32_SUS256_SRVW4_TT1_32_VAW2_WG64_4_1_WGM2
    SolutionIndex: 290
    SolutionNameMin: Cijk_Ailk_Bjlk_HBH_MT128x256x16_MI32x32x8x1_SE_AF0EM8_EPS0_GRVW4_GSU1_PGR2_SU32_SUS256_SRVW4_TT2_128_VAW2_WG64_4_1_WGM15
    SolutionIndex: 291
    SolutionNameMin: Cijk_Ailk_Bjlk_HBH_MT256x192x32_MI32x32x8x1_SE_AF0EM8_EPS0_GRVW8_GSU1_PGR2_SU0_SUS256_SRVW4_TT4_96_VAW2_WG64_4_1_WGM2
    SolutionIndex: 292
    SolutionNameMin: Cijk_Ailk_Bjlk_HBH_MT128x128x32_MI32x32x8x1_SE_AF0EM8_EPS0_GRVW4_GSU1_PGR2_SU0_SUS256_SRVW4_TT2_64_VAW2_WG64_4_1_WGM2
    SolutionIndex: 293
    SolutionNameMin: Cijk_Ailk_Bjlk_HBH_MT128x256x16_MI32x32x8x1_SE_AF0EM8_EPS0_GRVW4_GSU1_PGR2_SU0_SUS256_SRVW4_TT2_128_VAW2_WG64_4_1_WGM15
    SolutionIndex: 294
    SolutionNameMin: Cijk_Ailk_Bjlk_HBH_MT128x256x16_MI32x32x8x1_SE_AF0EM8_EPS0_GRVW8_GSU1_PGR2_SU32_SUS256_SRVW4_TT2_128_VAW2_WG64_4_1_WGM2
    SolutionIndex: 295
    SolutionNameMin: Cijk_Ailk_Bjlk_HBH_MT16x16x16_MI16x16x16x1_SE_AF0EM8_EPS0_GRVW2_GSU1_PGR2_SU0_SUS256_SRVW0_TT1_16_VAW2_WG16_4_1_WGM1
    SolutionIndex: 296
    SolutionNameMin: Cijk_Ailk_Bjlk_HBH_MT256x128x32_MI32x32x8x1_SE_AF0EM8_EPS1_GRVW8_GSU1_PGR1_SU0_SUS256_SRVW4_TT4_64_VAW2_WG64_4_1_WGM15
    SolutionIndex: 297
    SolutionNameMin: Cijk_Ailk_Bjlk_HBH_MT128x64x16_MI32x32x8x1_SE_AF0EM8_EPS1_GRVW2_GSU1_PGR1_SU0_SUS256_SRVW4_TT2_32_VAW2_WG64_4_1_WGM1
    SolutionIndex: 298
    SolutionNameMin: Cijk_Ailk_Bjlk_HBH_MT64x128x32_MI32x32x8x1_SE_AF0EM8_EPS1_GRVW8_GSU1_PGR1_SU0_SUS256_SRVW4_TT1_64_VAW2_WG64_4_1_WGM15
    SolutionIndex: 299
    SolutionNameMin: Cijk_Ailk_Bjlk_HBH_MT128x256x32_MI32x32x8x1_SE_AF0EM8_EPS1_GRVW8_GSU1_PGR1_SU0_SUS256_SRVW4_TT2_128_VAW2_WG64_4_1_WGM2
    SolutionIndex: 300
    SolutionNameMin: Cijk_Ailk_Bjlk_HBH_MT128x64x32_MI32x32x8x1_SE_AF0EM8_EPS0_GRVW2_GSU1_PGR2_SU0_SUS256_SRVW4_TT2_32_VAW2_WG64_4_1_WGM2
    SolutionIndex: 301
    SolutionNameMin: Cijk_Ailk_Bjlk_HBH_MT64x128x32_MI32x32x8x1_SE_AF0EM8_EPS0_GRVW2_GSU1_PGR2_SU0_SUS256_SRVW4_TT1_64_VAW2_WG64_4_1_WGM2
    SolutionIndex: 302
    SolutionNameMin: Cijk_Ailk_Bjlk_HBH_MT16x16x16_MI16x16x16x1_SE_AF0EM1_EPS1_GRVW2_GSU1_PGR1_SU0_SUS256_SRVW0_TT1_16_VAW2_WG16_4_1_WGM1
    SolutionIndex: 303
    SolutionNameMin: Cijk_Ailk_Bjlk_HBH_MT128x256x16_MI32x32x8x1_SE_AF0EM8_EPS0_GRVW4_GSU1_PGR2_SU0_SUS256_SRVW4_TT2_128_VAW2_WG64_4_1_WGM1
    SolutionIndex: 304
    SolutionNameMin: Cijk_Ailk_Bjlk_HBH_MT128x128x64_MI32x32x8x1_SE_AF0EM8_EPS0_GRVW4_GSU1_PGR2_SU32_SUS256_SRVW4_TT2_64_VAW2_WG64_4_1_WGM15
    SolutionIndex: 305
    SolutionNameMin: Cijk_Ailk_Bjlk_HBH_MT128x64x16_MI32x32x8x1_SE_AF0EM8_EPS0_GRVW4_GSU1_PGR2_SU0_SUS256_SRVW4_TT2_32_VAW2_WG64_4_1_WGM1
    SolutionIndex: 306
    SolutionNameMin: Cijk_Ailk_Bjlk_HBH_MT64x128x16_MI32x32x8x1_SE_AF0EM8_EPS0_GRVW4_GSU1_PGR2_SU0_SUS256_SRVW4_TT1_64_VAW2_WG64_4_1_WGM2
    SolutionIndex: 307
    SolutionNameMin: Cijk_Ailk_Bjlk_HBH_MT128x160x32_MI32x32x8x1_SE_AF0EM8_EPS0_GRVW4_GSU1_PGR2_SU0_SUS256_SRVW4_TT1_160_VAW2_WG128_2_1_WGM15
    SolutionIndex: 308
    SolutionNameMin: Cijk_Ailk_Bjlk_HBH_MT256x256x32_MI32x32x8x1_SE_AF0EM8_EPS1_GRVW8_GSU1_PGR1_SU32_SUS128_SRVW4_TT4_128_VAW2_WG64_4_1_WGM1
    SolutionIndex: 309
    SolutionNameMin: Cijk_Ailk_Bjlk_HBH_MT256x160x32_MI32x32x8x1_SE_AF0EM8_EPS1_GRVW4_GSU1_PGR1_SU32_SUS128_SRVW4_TT2_160_VAW2_WG128_2_1_WGM2
    SolutionIndex: 310
    SolutionNameMin: Cijk_Ailk_Bjlk_HBH_MT128x96x32_MI32x32x8x1_SE_AF0EM8_EPS0_GRVW2_GSU1_PGR2_SU0_SUS256_SRVW4_TT1_96_VAW2_WG128_2_1_WGM15
    SolutionIndex: 311
    SolutionNameMin: Cijk_Ailk_Bjlk_HBH_MT96x128x32_MI32x32x8x1_SE_AF0EM8_EPS0_GRVW4_GSU1_PGR2_SU32_SUS128_SRVW0_TT3_32_VAW2_WG32_8_1_WGM2
    SolutionIndex: 312
    SolutionNameMin: Cijk_Ailk_Bjlk_HBH_MT128x128x16_MI32x32x8x1_SE_AF0EM8_EPS0_GRVW8_GSU1_PGR2_SU0_SUS256_SRVW4_TT2_64_VAW2_WG64_4_1_WGM1
    SolutionIndex: 313
    SolutionNameMin: Cijk_Ailk_Bjlk_HBH_MT128x256x32_MI32x32x8x1_SE_AF0EM8_EPS0_GRVW8_GSU7_PGR2_SU0_SUS256_SRVW4_TT2_128_VAW1_WG64_4_1_WGM15
    SolutionIndex: 314
    SolutionNameMin: Cijk_Ailk_Bjlk_HBH_MT256x192x32_MI32x32x8x1_SE_AF0EM8_EPS1_GRVW8_GSU1_PGR1_SU32_SUS128_SRVW4_TT4_96_VAW2_WG64_4_1_WGM15
    SolutionIndex: 315
    SolutionNameMin: Cijk_Ailk_Bjlk_HBH_MT256x160x32_MI32x32x8x1_SE_AF0EM8_EPS0_GRVW2_GSU1_PGR2_SU0_SUS256_SRVW4_TT2_160_VAW2_WG128_2_1_WGM15
    SolutionIndex: 316
    SolutionNameMin: Cijk_Ailk_Bjlk_HBH_MT64x256x32_MI32x32x8x1_SE_AF0EM8_EPS0_GRVW2_GSU1_PGR2_SU0_SUS256_SRVW4_TT1_128_VAW2_WG64_4_1_WGM1
    SolutionIndex: 317
    SolutionNameMin: Cijk_Ailk_Bjlk_HBH_MT128x64x16_MI32x32x8x1_SE_AF0EM8_EPS0_GRVW2_GSU1_PGR2_SU0_SUS256_SRVW4_TT2_32_VAW2_WG64_4_1_WGM2
    SolutionIndex: 318
    SolutionNameMin: Cijk_Ailk_Bjlk_HBH_MT64x128x16_MI32x32x8x1_SE_AF0EM8_EPS0_GRVW8_GSU1_PGR2_SU32_SUS128_SRVW4_TT1_64_VAW2_WG64_4_1_WGM2
    SolutionIndex: 319
    SolutionNameMin: Cijk_Ailk_Bjlk_HBH_MT256x192x32_MI32x32x8x1_SE_AF0EM8_EPS1_GRVW8_GSU1_PGR1_SU0_SUS256_SRVW4_TT4_96_VAW2_WG64_4_1_WGM2
    SolutionIndex: 320
    SolutionNameMin: Cijk_Ailk_Bjlk_HBH_MT128x64x32_MI32x32x8x1_SE_AF0EM8_EPS0_GRVW2_GSU1_PGR2_SU0_SUS256_SRVW4_TT2_32_VAW2_WG64_4_1_WGM1
    SolutionIndex: 321
    SolutionNameMin: Cijk_Ailk_Bjlk_HBH_MT256x192x32_MI32x32x8x1_SE_AF0EM8_EPS1_GRVW8_GSU1_PGR1_SU32_SUS256_SRVW4_TT4_96_VAW2_WG64_4_1_WGM15
    SolutionIndex: 322
    SolutionNameMin: Cijk_Ailk_Bjlk_HBH_MT128x64x16_MI32x32x8x1_SE_AF0EM8_EPS0_GRVW2_GSU1_PGR2_SU0_SUS256_SRVW4_TT2_32_VAW2_WG64_4_1_WGM1
    SolutionIndex: 323
    SolutionNameMin: Cijk_Ailk_Bjlk_HBH_MT64x128x32_MI32x32x8x1_SE_AF0EM8_EPS0_GRVW2_GSU1_PGR2_SU32_SUS128_SRVW4_TT1_64_VAW2_WG64_4_1_WGM1
    SolutionIndex: 324
    SolutionNameMin: Cijk_Ailk_Bjlk_HBH_MT64x64x16_MI32x32x8x1_SE_AF0EM8_EPS0_GRVW8_GSU1_PGR2_SU32_SUS128_SRVW4_TT1_32_VAW2_WG64_4_1_WGM2
    SolutionIndex: 325
    SolutionNameMin: Cijk_Ailk_Bjlk_HBH_MT64x128x16_MI32x32x8x1_SE_AF0EM8_EPS0_GRVW2_GSU1_PGR2_SU32_SUS128_SRVW4_TT1_64_VAW2_WG64_4_1_WGM15
    SolutionIndex: 326
    SolutionNameMin: Cijk_Ailk_Bjlk_HBH_MT128x64x16_MI32x32x8x1_SE_AF0EM8_EPS1_GRVW2_GSU1_PGR1_SU32_SUS128_SRVW4_TT2_32_VAW2_WG64_4_1_WGM15
    SolutionIndex: 327
    SolutionNameMin: Cijk_Ailk_Bjlk_HBH_MT128x96x32_MI32x32x8x1_SE_AF0EM8_EPS0_GRVW4_GSU1_PGR2_SU0_SUS256_SRVW4_TT1_96_VAW2_WG128_2_1_WGM15
    SolutionIndex: 328
    SolutionNameMin: Cijk_Ailk_Bjlk_HBH_MT128x128x32_MI32x32x8x1_SE_AF0EM8_EPS0_GRVW4_GSU3_PGR2_SU0_SUS256_SRVW4_TT2_64_VAW1_WG64_4_1_WGM15
    SolutionIndex: 329
    SolutionNameMin: Cijk_Ailk_Bjlk_HBH_MT128x128x32_MI32x32x8x1_SE_AF0EM8_EPS0_GRVW8_GSU3_PGR2_SU0_SUS256_SRVW4_TT2_64_VAW1_WG64_4_1_WGM15
    SolutionIndex: 330
    SolutionNameMin: Cijk_Ailk_Bjlk_HBH_MT128x192x32_MI32x32x8x1_SE_AF0EM8_EPS0_GRVW4_GSU5_PGR2_SU0_SUS256_SRVW4_TT2_96_VAW1_WG64_4_1_WGM2
    SolutionIndex: 331
    SolutionNameMin: Cijk_Ailk_Bjlk_HBH_MT64x64x32_MI32x32x8x1_SE_AF0EM8_EPS0_GRVW8_GSU1_PGR2_SU32_SUS128_SRVW4_TT1_32_VAW2_WG64_4_1_WGM2
    SolutionIndex: 332
    SolutionNameMin: Cijk_Ailk_Bjlk_HBH_MT32x64x64_MI16x16x16x1_SE_AF0EM8_EPS0_GRVW8_GSU7_PGR2_SU0_SUS256_SRVW4_TT1_32_VAW1_WG32_8_1_WGM2
    SolutionIndex: 333
    SolutionNameMin: Cijk_Ailk_Bjlk_HBH_MT64x64x32_MI32x32x8x1_SE_AF0EM8_EPS0_GRVW4_GSU15_PGR2_SU32_SUS256_SRVW4_TT1_32_VAW1_WG64_4_1_WGM1
    SolutionIndex: 334
    SolutionNameMin: Cijk_Ailk_Bjlk_HBH_MT64x64x64_MI32x32x8x1_SE_AF0EM8_EPS0_GRVW2_GSU15_PGR2_SU32_SUS128_SRVW4_TT1_32_VAW1_WG64_4_1_WGM1
    SolutionIndex: 335
    SolutionNameMin: Cijk_Ailk_Bjlk_HBH_MT64x64x64_MI32x32x8x1_SE_AF0EM8_EPS0_GRVW8_GSU15_PGR2_SU32_SUS128_SRVW4_TT1_32_VAW1_WG64_4_1_WGM1
    SolutionIndex: 336
    SolutionNameMin: Cijk_Ailk_Bjlk_HBH_MT32x32x32_MI16x16x16x1_SE_AF0EM8_EPS0_GRVW4_GSU3_PGR2_SU32_SUS256_SRVW4_TT1_16_VAW1_WG32_8_1_WGM1
    SolutionIndex: 337
    SolutionNameMin: Cijk_Ailk_Bjlk_HBH_MT64x32x16_MI16x16x16x1_SE_AF0EM8_EPS1_GRVW2_GSU1_PGR1_SU0_SUS256_SRVW4_TT2_16_VAW2_WG32_8_1_WGM1
    SolutionIndex: 338
    SolutionNameMin: Cijk_Ailk_Bjlk_HBH_MT64x32x16_MI16x16x16x1_SE_AF0EM8_EPS0_GRVW4_GSU1_PGR2_SU0_SUS256_SRVW4_TT2_16_VAW2_WG32_8_1_WGM1
    SolutionIndex: 339
    SolutionNameMin: Cijk_Ailk_Bjlk_HBH_MT96x128x64_MI32x32x8x1_SE_AF0EM8_EPS0_GRVW2_GSU3_PGR2_SU0_SUS256_SRVW0_TT3_32_VAW1_WG32_8_1_WGM15
    SolutionIndex: 340
    SolutionNameMin: Cijk_Ailk_Bjlk_HBH_MT160x128x32_MI32x32x8x1_SE_AF0EM8_EPS0_GRVW2_GSU5_PGR2_SU32_SUS256_SRVW0_TT5_32_VAW1_WG32_8_1_WGM1
    SolutionIndex: 341
    SolutionNameMin: Cijk_Ailk_Bjlk_HBH_MT160x128x32_MI32x32x8x1_SE_AF0EM8_EPS0_GRVW2_GSU5_PGR2_SU32_SUS128_SRVW0_TT5_32_VAW1_WG32_8_1_WGM1
    SolutionIndex: 342
    SolutionNameMin: Cijk_Ailk_Bjlk_HBH_MT64x64x32_MI32x32x8x1_SE_AF0EM8_EPS0_GRVW8_GSU1_PGR2_SU0_SUS256_SRVW4_TT1_32_VAW2_WG64_4_1_WGM15
    SolutionIndex: 343
    SolutionNameMin: Cijk_Ailk_Bjlk_HBH_MT64x128x32_MI32x32x8x1_SE_AF0EM8_EPS0_GRVW4_GSU7_PGR2_SU32_SUS256_SRVW4_TT1_64_VAW1_WG64_4_1_WGM2
    SolutionIndex: 344
    SolutionNameMin: Cijk_Ailk_Bjlk_HBH_MT64x128x32_MI32x32x8x1_SE_AF0EM8_EPS0_GRVW4_GSU7_PGR2_SU0_SUS256_SRVW4_TT1_64_VAW1_WG64_4_1_WGM1
    SolutionIndex: 345
    SolutionNameMin: Cijk_Ailk_Bjlk_HBH_MT128x128x64_MI32x32x8x1_SE_AF0EM8_EPS0_GRVW8_GSU15_PGR2_SU0_SUS256_SRVW4_TT2_64_VAW1_WG64_4_1_WGM2
    SolutionIndex: 346
    SolutionNameMin: Cijk_Ailk_Bjlk_HBH_MT64x128x32_MI32x32x8x1_SE_AF0EM8_EPS0_GRVW4_GSU7_PGR2_SU32_SUS256_SRVW4_TT1_64_VAW1_WG64_4_1_WGM15
    SolutionIndex: 347
    SolutionNameMin: Cijk_Ailk_Bjlk_HBH_MT32x32x32_MI16x16x16x1_SE_AF0EM8_EPS0_GRVW4_GSU1_PGR2_SU32_SUS128_SRVW4_TT1_16_VAW2_WG32_8_1_WGM15
    SolutionIndex: 348
    SolutionNameMin: Cijk_Ailk_Bjlk_HBH_MT256x256x16_MI32x32x8x1_SE_AF0EM8_EPS1_GRVW8_GSU1_PGR1_SU0_SUS256_SRVW4_TT4_128_VAW2_WG64_4_1_WGM15
    SolutionIndex: 349
    SolutionNameMin: Cijk_Ailk_Bjlk_HBH_MT64x128x16_MI32x32x8x1_SE_AF0EM8_EPS1_GRVW2_GSU1_PGR1_SU32_SUS256_SRVW4_TT1_64_VAW2_WG64_4_1_WGM1
    SolutionIndex: 350
    SolutionNameMin: Cijk_Ailk_Bjlk_HBH_MT128x64x16_MI32x32x8x1_SE_AF0EM8_EPS0_GRVW2_GSU1_PGR2_SU32_SUS256_SRVW4_TT2_32_VAW2_WG64_4_1_WGM15
    SolutionIndex: 351
    SolutionNameMin: Cijk_Ailk_Bjlk_HBH_MT16x16x16_MI16x16x16x1_SE_AF0EM8_EPS1_GRVW2_GSU1_PGR1_SU0_SUS256_SRVW0_TT1_16_VAW2_WG16_4_1_WGM2
    SolutionIndex: 352
    SolutionNameMin: Cijk_Ailk_Bjlk_HBH_MT128x64x16_MI32x32x8x1_SE_AF0EM8_EPS0_GRVW2_GSU1_PGR2_SU32_SUS128_SRVW4_TT2_32_VAW2_WG64_4_1_WGM15
    SolutionIndex: 353
    SolutionNameMin: Cijk_Ailk_Bjlk_HBH_MT64x128x16_MI32x32x8x1_SE_AF0EM8_EPS1_GRVW2_GSU1_PGR1_SU32_SUS128_SRVW4_TT1_64_VAW2_WG64_4_1_WGM15
    SolutionIndex: 354
    SolutionNameMin: Cijk_Ailk_Bjlk_HBH_MT128x256x16_MI32x32x8x1_SE_AF0EM8_EPS0_GRVW8_GSU1_PGR2_SU32_SUS128_SRVW4_TT2_128_VAW2_WG64_4_1_WGM2
    SolutionIndex: 355
    SolutionNameMin: Cijk_Ailk_Bjlk_HBH_MT64x128x16_MI32x32x8x1_SE_AF0EM8_EPS1_GRVW2_GSU1_PGR1_SU0_SUS256_SRVW4_TT1_64_VAW2_WG64_4_1_WGM1
    SolutionIndex: 356
    SolutionNameMin: Cijk_Ailk_Bjlk_HBH_MT128x64x32_MI32x32x8x1_SE_AF0EM8_EPS1_GRVW8_GSU1_PGR1_SU0_SUS256_SRVW4_TT2_32_VAW2_WG64_4_1_WGM1
    SolutionIndex: 357
    SolutionNameMin: Cijk_Ailk_Bjlk_HBH_MT128x64x16_MI32x32x8x1_SE_AF0EM8_EPS0_GRVW8_GSU1_PGR2_SU0_SUS256_SRVW4_TT2_32_VAW2_WG64_4_1_WGM2
    SolutionIndex: 358
    SolutionNameMin: Cijk_Ailk_Bjlk_HBH_MT128x128x16_MI32x32x8x1_SE_AF0EM8_EPS0_GRVW2_GSU1_PGR2_SU0_SUS256_SRVW4_TT2_64_VAW2_WG64_4_1_WGM2
    SolutionIndex: 359
    SolutionNameMin: Cijk_Ailk_Bjlk_HBH_MT128x256x16_MI32x32x8x1_SE_AF0EM8_EPS0_GRVW8_GSU1_PGR2_SU0_SUS256_SRVW4_TT2_128_VAW2_WG64_4_1_WGM1
    SolutionIndex: 360
    SolutionNameMin: Cijk_Ailk_Bjlk_HBH_MT128x256x16_MI32x32x8x1_SE_AF0EM8_EPS0_GRVW8_GSU1_PGR2_SU0_SUS256_SRVW4_TT2_128_VAW2_WG64_4_1_WGM1
    SolutionIndex: 361
    SolutionNameMin: Cijk_Ailk_Bjlk_HBH_MT64x64x32_MI32x32x8x1_SE_AF0EM8_EPS0_GRVW4_GSU1_PGR2_SU0_SUS256_SRVW4_TT1_32_VAW2_WG64_4_1_WGM1
    SolutionIndex: 362
    SolutionNameMin: Cijk_Ailk_Bjlk_HBH_MT128x128x32_MI32x32x8x1_SE_AF0EM8_EPS0_GRVW8_GSU1_PGR2_SU0_SUS256_SRVW4_TT2_64_VAW2_WG64_4_1_WGM1
    SolutionIndex: 363
    SolutionNameMin: Cijk_Ailk_Bjlk_HBH_MT128x128x32_MI32x32x8x1_SE_AF0EM8_EPS1_GRVW8_GSU1_PGR1_SU0_SUS256_SRVW4_TT2_64_VAW2_WG64_4_1_WGM1
    SolutionIndex: 364
    SolutionNameMin: Cijk_Ailk_Bjlk_HBH_MT128x128x16_MI32x32x8x1_SE_AF0EM8_EPS0_GRVW8_GSU1_PGR2_SU32_SUS256_SRVW4_TT2_64_VAW2_WG64_4_1_WGM2
    SolutionIndex: 365
    SolutionNameMin: Cijk_Ailk_Bjlk_HBH_MT128x128x16_MI32x32x8x1_SE_AF0EM8_EPS1_GRVW8_GSU1_PGR1_SU0_SUS256_SRVW4_TT2_64_VAW2_WG64_4_1_WGM1
    SolutionIndex: 366
    SolutionNameMin: Cijk_Ailk_Bjlk_HBH_MT128x256x16_MI32x32x8x1_SE_AF0EM8_EPS0_GRVW8_GSU1_PGR2_SU32_SUS256_SRVW4_TT2_128_VAW2_WG64_4_1_WGM1
    SolutionIndex: 367
    SolutionNameMin: Cijk_Ailk_Bjlk_HBH_MT64x64x32_MI32x32x8x1_SE_AF0EM8_EPS0_GRVW2_GSU1_PGR2_SU0_SUS256_SRVW4_TT1_32_VAW2_WG64_4_1_WGM15
    SolutionIndex: 368
    SolutionNameMin: Cijk_Ailk_Bjlk_HBH_MT64x192x16_MI32x32x8x1_SE_AF0EM8_EPS1_GRVW2_GSU1_PGR1_SU0_SUS256_SRVW4_TT1_96_VAW2_WG64_4_1_WGM2
    SolutionIndex: 369
    SolutionNameMin: Cijk_Ailk_Bjlk_HBH_MT64x192x16_MI32x32x8x1_SE_AF0EM8_EPS1_GRVW2_GSU1_PGR1_SU0_SUS256_SRVW4_TT1_96_VAW2_WG64_4_1_WGM1
    SolutionIndex: 370
    SolutionNameMin: Cijk_Ailk_Bjlk_HBH_MT64x192x16_MI32x32x8x1_SE_AF0EM8_EPS1_GRVW2_GSU1_PGR1_SU32_SUS256_SRVW4_TT1_96_VAW2_WG64_4_1_WGM15
    SolutionIndex: 371
    SolutionNameMin: Cijk_Ailk_Bjlk_HBH_MT64x192x16_MI32x32x8x1_SE_AF0EM8_EPS1_GRVW4_GSU1_PGR1_SU32_SUS256_SRVW4_TT1_96_VAW2_WG64_4_1_WGM2
    SolutionIndex: 372
    SolutionNameMin: Cijk_Ailk_Bjlk_HBH_MT64x256x16_MI32x32x8x1_SE_AF0EM8_EPS0_GRVW2_GSU1_PGR2_SU0_SUS256_SRVW4_TT1_128_VAW2_WG64_4_1_WGM15
    SolutionIndex: 373
    SolutionNameMin: Cijk_Ailk_Bjlk_HBH_MT64x256x16_MI32x32x8x1_SE_AF0EM8_EPS0_GRVW2_GSU1_PGR2_SU32_SUS256_SRVW4_TT1_128_VAW2_WG64_4_1_WGM1
    SolutionIndex: 374
    SolutionNameMin: Cijk_Ailk_Bjlk_HBH_MT64x256x16_MI32x32x8x1_SE_AF0EM8_EPS0_GRVW4_GSU1_PGR2_SU32_SUS256_SRVW4_TT1_128_VAW2_WG64_4_1_WGM15
    SolutionIndex: 375
    SolutionNameMin: Cijk_Ailk_Bjlk_HBH_MT64x128x32_MI32x32x8x1_SE_AF0EM8_EPS0_GRVW2_GSU1_PGR2_SU0_SUS256_SRVW4_TT1_64_VAW2_WG64_4_1_WGM15
    SolutionIndex: 376
    SolutionNameMin: Cijk_Ailk_Bjlk_HBH_MT64x256x16_MI32x32x8x1_SE_AF0EM8_EPS0_GRVW8_GSU1_PGR2_SU32_SUS128_SRVW4_TT1_128_VAW2_WG64_4_1_WGM1
    SolutionIndex: 377
    SolutionNameMin: Cijk_Ailk_Bjlk_HBH_MT64x128x16_MI32x32x8x1_SE_AF0EM8_EPS0_GRVW8_GSU1_PGR2_SU32_SUS128_SRVW4_TT1_64_VAW2_WG64_4_1_WGM1
    SolutionIndex: 378
    SolutionNameMin: Cijk_Ailk_Bjlk_HBH_MT64x128x16_MI32x32x8x1_SE_AF0EM8_EPS0_GRVW4_GSU1_PGR2_SU32_SUS128_SRVW4_TT1_64_VAW2_WG64_4_1_WGM1
    SolutionIndex: 379
    SolutionNameMin: Cijk_Ailk_Bjlk_HBH_MT64x128x16_MI32x32x8x1_SE_AF0EM8_EPS0_GRVW4_GSU1_PGR2_SU0_SUS256_SRVW4_TT1_64_VAW2_WG64_4_1_WGM1
    SolutionIndex: 380
    SolutionNameMin: Cijk_Ailk_Bjlk_HBH_MT64x192x16_MI32x32x8x1_SE_AF0EM8_EPS1_GRVW4_GSU1_PGR1_SU0_SUS256_SRVW4_TT1_96_VAW2_WG64_4_1_WGM2
    SolutionIndex: 381
    SolutionNameMin: Cijk_Ailk_Bjlk_HBH_MT64x192x16_MI32x32x8x1_SE_AF0EM8_EPS1_GRVW4_GSU1_PGR1_SU0_SUS256_SRVW4_TT1_96_VAW2_WG64_4_1_WGM15
    SolutionIndex: 382
    SolutionNameMin: Cijk_Ailk_Bjlk_HBH_MT64x192x16_MI32x32x8x1_SE_AF0EM8_EPS1_GRVW4_GSU1_PGR1_SU32_SUS128_SRVW4_TT1_96_VAW2_WG64_4_1_WGM2
    SolutionIndex: 383
    SolutionNameMin: Cijk_Ailk_Bjlk_HBH_MT256x128x32_MI32x32x8x1_SE_AF0EM8_EPS1_GRVW8_GSU1_PGR1_SU32_SUS128_SRVW4_TT4_64_VAW2_WG64_4_1_WGM15
    SolutionIndex: 384
    SolutionNameMin: Cijk_Ailk_Bjlk_HBH_MT256x144x32_MI16x16x16x1_SE_AF0EM8_EPS0_GRVW2_GSU2_PGR2_SU0_SUS256_SRVW4_TT4_144_VAW1_WG64_4_1_WGM15
    SolutionIndex: 385
    SolutionNameMin: Cijk_Ailk_Bjlk_HBH_MT256x144x32_MI16x16x16x1_SE_AF0EM8_EPS0_GRVW2_GSU2_PGR2_SU0_SUS256_SRVW4_TT4_144_VAW1_WG64_4_1_WGM2
    SolutionIndex: 386
    SolutionNameMin: Cijk_Ailk_Bjlk_HBH_MT64x32x16_MI16x16x16x1_SE_AF0EM8_EPS1_GRVW2_GSU1_PGR1_SU32_SUS256_SRVW4_TT2_16_VAW2_WG32_8_1_WGM2
    SolutionIndex: 387
    SolutionNameMin: Cijk_Ailk_Bjlk_HBH_MT128x256x16_MI32x32x8x1_SE_AF0EM8_EPS0_GRVW8_GSU1_PGR2_SU32_SUS128_SRVW4_TT2_128_VAW2_WG64_4_1_WGM2
    SolutionIndex: 388
    SolutionNameMin: Cijk_Ailk_Bjlk_HBH_MT64x192x16_MI32x32x8x1_SE_AF0EM8_EPS0_GRVW4_GSU1_PGR2_SU0_SUS256_SRVW4_TT1_96_VAW2_WG64_4_1_WGM15
    SolutionIndex: 389
    SolutionNameMin: Cijk_Ailk_Bjlk_HBH_MT64x128x32_MI32x32x8x1_SE_AF0EM8_EPS0_GRVW4_GSU1_PGR2_SU32_SUS256_SRVW4_TT1_64_VAW2_WG64_4_1_WGM15
    SolutionIndex: 390
    SolutionNameMin: Cijk_Ailk_Bjlk_HBH_MT128x256x16_MI32x32x8x1_SE_AF0EM8_EPS0_GRVW8_GSU1_PGR2_SU32_SUS256_SRVW4_TT2_128_VAW2_WG64_4_1_WGM15
    SolutionIndex: 391
    SolutionNameMin: Cijk_Ailk_Bjlk_HBH_MT128x256x32_MI32x32x8x1_SE_AF0EM8_EPS1_GRVW2_GSU1_PGR1_SU0_SUS256_SRVW4_TT2_128_VAW2_WG64_4_1_WGM1
    SolutionIndex: 392
    SolutionNameMin: Cijk_Ailk_Bjlk_HBH_MT128x64x16_MI32x32x8x1_SE_AF0EM8_EPS0_GRVW4_GSU1_PGR2_SU0_SUS256_SRVW4_TT2_32_VAW2_WG64_4_1_WGM15
    SolutionIndex: 393
    SolutionNameMin: Cijk_Ailk_Bjlk_HBH_MT128x64x16_MI32x32x8x1_SE_AF0EM8_EPS0_GRVW8_GSU1_PGR2_SU0_SUS256_SRVW4_TT2_32_VAW2_WG64_4_1_WGM15
    SolutionIndex: 394
    SolutionNameMin: Cijk_Ailk_Bjlk_HBH_MT64x64x32_MI32x32x8x1_SE_AF0EM8_EPS0_GRVW2_GSU1_PGR2_SU32_SUS128_SRVW4_TT1_32_VAW2_WG64_4_1_WGM1
    SolutionIndex: 395
    SolutionNameMin: Cijk_Ailk_Bjlk_HBH_MT128x256x16_MI32x32x8x1_SE_AF0EM8_EPS0_GRVW8_GSU1_PGR2_SU32_SUS256_SRVW4_TT2_128_VAW2_WG64_4_1_WGM1
    SolutionIndex: 396
    SolutionNameMin: Cijk_Ailk_Bjlk_HBH_MT64x128x16_MI32x32x8x1_SE_AF0EM8_EPS0_GRVW2_GSU1_PGR2_SU32_SUS256_SRVW4_TT1_64_VAW2_WG64_4_1_WGM2
    SolutionIndex: 397
    SolutionNameMin: Cijk_Ailk_Bjlk_HBH_MT128x64x16_MI32x32x8x1_SE_AF0EM8_EPS0_GRVW2_GSU1_PGR2_SU32_SUS256_SRVW4_TT2_32_VAW2_WG64_4_1_WGM1
    SolutionIndex: 398
    SolutionNameMin: Cijk_Ailk_Bjlk_HBH_MT256x256x32_MI32x32x8x1_SE_AF0EM8_EPS1_GRVW8_GSU1_PGR1_SU0_SUS256_SRVW4_TT4_128_VAW2_WG64_4_1_WGM15
    SolutionIndex: 399
    SolutionNameMin: Cijk_Ailk_Bjlk_HBH_MT4x64x32_MI4x4x4x16_SE_AF0EM8_EPS0_GRVW2_GSU1_PGR2_SU0_SUS256_SRVW0_TT1_4_VAW2_WG4_16_1_WGM1
    SolutionIndex: 400
    SolutionNameMin: Cijk_Ailk_Bjlk_HBH_MT128x64x16_MI32x32x8x1_SE_AF0EM8_EPS0_GRVW2_GSU1_PGR2_SU32_SUS256_SRVW4_TT2_32_VAW2_WG64_4_1_WGM2
    SolutionIndex: 401
    SolutionNameMin: Cijk_Ailk_Bjlk_HBH_MT64x128x16_MI32x32x8x1_SE_AF0EM8_EPS0_GRVW2_GSU1_PGR2_SU0_SUS256_SRVW4_TT1_64_VAW2_WG64_4_1_WGM1
    SolutionIndex: 402
    SolutionNameMin: Cijk_Ailk_Bjlk_HBH_MT128x128x32_MI32x32x8x1_SE_AF0EM8_EPS0_GRVW2_GSU1_PGR2_SU32_SUS128_SRVW4_TT2_64_VAW2_WG64_4_1_WGM15
    SolutionIndex: 403
    SolutionNameMin: Cijk_Ailk_Bjlk_HBH_MT128x128x32_MI32x32x8x1_SE_AF0EM8_EPS0_GRVW2_GSU1_PGR2_SU0_SUS256_SRVW4_TT2_64_VAW2_WG64_4_1_WGM1
    SolutionIndex: 404
    SolutionNameMin: Cijk_Ailk_Bjlk_HBH_MT128x256x16_MI32x32x8x1_SE_AF0EM8_EPS0_GRVW2_GSU1_PGR2_SU0_SUS256_SRVW4_TT2_128_VAW2_WG64_4_1_WGM1
    SolutionIndex: 405
    SolutionNameMin: Cijk_Ailk_Bjlk_HBH_MT128x256x16_MI32x32x8x1_SE_AF0EM8_EPS0_GRVW2_GSU1_PGR2_SU0_SUS256_SRVW4_TT2_128_VAW2_WG64_4_1_WGM2
    SolutionIndex: 406
    SolutionNameMin: Cijk_Ailk_Bjlk_HBH_MT128x64x16_MI32x32x8x1_SE_AF0EM8_EPS0_GRVW2_GSU1_PGR2_SU0_SUS256_SRVW4_TT2_32_VAW2_WG64_4_1_WGM15
    SolutionIndex: 407
    SolutionNameMin: Cijk_Ailk_Bjlk_HBH_MT64x128x16_MI32x32x8x1_SE_AF0EM8_EPS0_GRVW8_GSU1_PGR2_SU32_SUS256_SRVW4_TT1_64_VAW2_WG64_4_1_WGM1
    SolutionIndex: 408
    SolutionNameMin: Cijk_Ailk_Bjlk_HBH_MT128x64x16_MI32x32x8x1_SE_AF0EM8_EPS0_GRVW8_GSU1_PGR2_SU32_SUS256_SRVW4_TT2_32_VAW2_WG64_4_1_WGM1
    SolutionIndex: 409
    SolutionNameMin: Cijk_Ailk_Bjlk_HBH_MT32x32x64_MI16x16x16x1_SE_AF0EM8_EPS0_GRVW2_GSU5_PGR2_SU0_SUS256_SRVW4_TT1_16_VAW1_WG32_8_1_WGM2
    SolutionIndex: 410
    SolutionNameMin: Cijk_Ailk_Bjlk_HBH_MT64x128x16_MI32x32x8x1_SE_AF0EM8_EPS1_GRVW4_GSU1_PGR1_SU32_SUS256_SRVW4_TT1_64_VAW2_WG64_4_1_WGM1
    SolutionIndex: 411
    SolutionNameMin: Cijk_Ailk_Bjlk_HBH_MT128x64x32_MI32x32x8x1_SE_AF0EM8_EPS1_GRVW8_GSU1_PGR1_SU0_SUS256_SRVW4_TT2_32_VAW2_WG64_4_1_WGM15
    SolutionIndex: 412
    SolutionNameMin: Cijk_Ailk_Bjlk_HBH_MT64x16x32_MI16x16x16x1_SE_AF0EM8_EPS0_GRVW8_GSU15_PGR2_SU32_SUS128_SRVW0_TT1_16_VAW1_WG64_4_1_WGM2
    SolutionIndex: 413
    SolutionNameMin: Cijk_Ailk_Bjlk_HBH_MT128x128x32_MI32x32x8x1_SE_AF0EM8_EPS0_GRVW8_GSU3_PGR2_SU0_SUS256_SRVW4_TT2_64_VAW1_WG64_4_1_WGM1
    SolutionIndex: 414
    SolutionNameMin: Cijk_Ailk_Bjlk_HBH_MT128x64x16_MI32x32x8x1_SE_AF0EM8_EPS0_GRVW8_GSU1_PGR2_SU32_SUS128_SRVW4_TT2_32_VAW2_WG64_4_1_WGM2
    SolutionIndex: 415
    SolutionNameMin: Cijk_Ailk_Bjlk_HBH_MT64x128x16_MI32x32x8x1_SE_AF0EM8_EPS1_GRVW4_GSU1_PGR1_SU32_SUS128_SRVW4_TT1_64_VAW2_WG64_4_1_WGM2
    SolutionIndex: 416
    SolutionNameMin: Cijk_Ailk_Bjlk_HBH_MT128x64x16_MI32x32x8x1_SE_AF0EM8_EPS1_GRVW4_GSU1_PGR1_SU0_SUS256_SRVW4_TT2_32_VAW2_WG64_4_1_WGM1
    SolutionIndex: 417
    SolutionNameMin: Cijk_Ailk_Bjlk_HBH_MT128x64x16_MI32x32x8x1_SE_AF0EM8_EPS1_GRVW8_GSU1_PGR1_SU0_SUS256_SRVW4_TT2_32_VAW2_WG64_4_1_WGM1
    SolutionIndex: 418
    SolutionNameMin: Cijk_Ailk_Bjlk_HBH_MT128x256x16_MI32x32x8x1_SE_AF0EM8_EPS0_GRVW8_GSU1_PGR2_SU0_SUS256_SRVW4_TT2_128_VAW2_WG64_4_1_WGM2
    SolutionIndex: 419
    SolutionNameMin: Cijk_Ailk_Bjlk_HBH_MT128x128x16_MI32x32x8x1_SE_AF0EM8_EPS0_GRVW8_GSU1_PGR2_SU32_SUS256_SRVW4_TT2_64_VAW2_WG64_4_1_WGM15
    SolutionIndex: 420
    SolutionNameMin: Cijk_Ailk_Bjlk_HBH_MT256x128x16_MI32x32x8x1_SE_AF0EM8_EPS0_GRVW8_GSU1_PGR2_SU0_SUS256_SRVW4_TT4_64_VAW2_WG64_4_1_WGM15
    SolutionIndex: 421
    SolutionNameMin: Cijk_Ailk_Bjlk_HBH_MT128x128x16_MI32x32x8x1_SE_AF0EM8_EPS0_GRVW8_GSU1_PGR2_SU32_SUS256_SRVW4_TT2_64_VAW2_WG64_4_1_WGM1
    SolutionIndex: 422
    SolutionNameMin: Cijk_Ailk_Bjlk_HBH_MT128x128x16_MI32x32x8x1_SE_AF0EM8_EPS0_GRVW8_GSU1_PGR2_SU0_SUS256_SRVW4_TT2_64_VAW2_WG64_4_1_WGM15
    SolutionIndex: 423
    SolutionNameMin: Cijk_Ailk_Bjlk_HBH_MT128x64x32_MI32x32x8x1_SE_AF0EM8_EPS0_GRVW8_GSU1_PGR2_SU0_SUS256_SRVW4_TT2_32_VAW2_WG64_4_1_WGM2
    SolutionIndex: 424
    SolutionNameMin: Cijk_Ailk_Bjlk_HBH_MT192x128x32_MI32x32x8x1_SE_AF0EM8_EPS0_GRVW8_GSU1_PGR2_SU0_SUS256_SRVW0_TT3_64_VAW2_WG64_4_1_WGM15
    SolutionIndex: 425
    SolutionNameMin: Cijk_Ailk_Bjlk_HBH_MT128x256x16_MI32x32x8x1_SE_AF0EM8_EPS0_GRVW2_GSU1_PGR2_SU0_SUS256_SRVW4_TT2_128_VAW2_WG64_4_1_WGM15
    SolutionIndex: 426
    SolutionNameMin: Cijk_Ailk_Bjlk_HBH_MT128x128x32_MI32x32x8x1_SE_AF0EM8_EPS0_GRVW8_GSU1_PGR2_SU32_SUS256_SRVW4_TT2_64_VAW2_WG64_4_1_WGM1
    SolutionIndex: 427
    SolutionNameMin: Cijk_Ailk_Bjlk_HBH_MT128x128x32_MI32x32x8x1_SE_AF0EM8_EPS1_GRVW8_GSU1_PGR1_SU32_SUS128_SRVW4_TT2_64_VAW2_WG64_4_1_WGM15
    SolutionIndex: 428
    SolutionNameMin: Cijk_Ailk_Bjlk_HBH_MT128x128x16_MI32x32x8x1_SE_AF0EM8_EPS0_GRVW4_GSU1_PGR2_SU0_SUS256_SRVW4_TT2_64_VAW2_WG64_4_1_WGM15
    SolutionIndex: 429
    SolutionNameMin: Cijk_Ailk_Bjlk_HBH_MT128x128x16_MI32x32x8x1_SE_AF0EM8_EPS0_GRVW2_GSU1_PGR2_SU32_SUS128_SRVW4_TT2_64_VAW2_WG64_4_1_WGM2
    SolutionIndex: 430
    SolutionNameMin: Cijk_Ailk_Bjlk_HBH_MT64x128x64_MI32x32x8x1_SE_AF0EM8_EPS0_GRVW8_GSU1_PGR2_SU0_SUS256_SRVW4_TT1_64_VAW2_WG64_4_1_WGM15
    SolutionIndex: 431
    SolutionNameMin: Cijk_Ailk_Bjlk_HBH_MT128x256x16_MI32x32x8x1_SE_AF0EM8_EPS0_GRVW4_GSU1_PGR2_SU32_SUS128_SRVW4_TT2_128_VAW2_WG64_4_1_WGM2
    SolutionIndex: 432
    SolutionNameMin: Cijk_Ailk_Bjlk_HBH_MT256x128x16_MI32x32x8x1_SE_AF0EM8_EPS0_GRVW4_GSU1_PGR2_SU0_SUS256_SRVW4_TT4_64_VAW2_WG64_4_1_WGM15
    SolutionIndex: 433
    SolutionNameMin: Cijk_Ailk_Bjlk_HBH_MT128x128x32_MI32x32x8x1_SE_AF0EM8_EPS1_GRVW4_GSU1_PGR1_SU0_SUS256_SRVW4_TT2_64_VAW2_WG64_4_1_WGM15
    SolutionIndex: 434
    SolutionNameMin: Cijk_Ailk_Bjlk_HBH_MT96x128x64_MI32x32x8x1_SE_AF0EM8_EPS0_GRVW8_GSU1_PGR2_SU0_SUS256_SRVW0_TT3_32_VAW2_WG32_8_1_WGM15
    SolutionIndex: 435
    SolutionNameMin: Cijk_Ailk_Bjlk_HBH_MT128x128x32_MI32x32x8x1_SE_AF0EM8_EPS0_GRVW8_GSU1_PGR2_SU32_SUS256_SRVW4_TT2_64_VAW2_WG64_4_1_WGM15
    SolutionIndex: 436
    SolutionNameMin: Cijk_Ailk_Bjlk_HBH_MT160x128x32_MI32x32x8x1_SE_AF0EM8_EPS0_GRVW4_GSU1_PGR2_SU0_SUS256_SRVW0_TT5_32_VAW2_WG32_8_1_WGM1
    SolutionIndex: 437
    SolutionNameMin: Cijk_Ailk_Bjlk_HBH_MT128x128x16_MI32x32x8x1_SE_AF0EM8_EPS0_GRVW4_GSU1_PGR2_SU0_SUS256_SRVW4_TT2_64_VAW2_WG64_4_1_WGM2
    SolutionIndex: 438
    SolutionNameMin: Cijk_Ailk_Bjlk_HBH_MT256x144x32_MI16x16x16x1_SE_AF0EM8_EPS0_GRVW2_GSU1_PGR2_SU0_SUS256_SRVW4_TT4_144_VAW2_WG64_4_1_WGM2
    SolutionIndex: 439
    SolutionNameMin: Cijk_Ailk_Bjlk_HBH_MT128x256x16_MI32x32x8x1_SE_AF0EM8_EPS0_GRVW8_GSU1_PGR2_SU32_SUS128_SRVW4_TT2_128_VAW2_WG64_4_1_WGM1
    SolutionIndex: 440
    SolutionNameMin: Cijk_Ailk_Bjlk_HBH_MT128x128x32_MI32x32x8x1_SE_AF0EM8_EPS0_GRVW8_GSU1_PGR2_SU32_SUS128_SRVW4_TT2_64_VAW2_WG64_4_1_WGM2
    SolutionIndex: 441
    SolutionNameMin: Cijk_Ailk_Bjlk_HBH_MT128x128x32_MI32x32x8x1_SE_AF0EM8_EPS0_GRVW8_GSU1_PGR2_SU32_SUS128_SRVW4_TT2_64_VAW2_WG64_4_1_WGM1
    SolutionIndex: 442
    SolutionNameMin: Cijk_Ailk_Bjlk_HBH_MT128x128x16_MI32x32x8x1_SE_AF0EM8_EPS0_GRVW8_GSU1_PGR2_SU0_SUS256_SRVW4_TT2_64_VAW2_WG64_4_1_WGM2
    SolutionIndex: 443
    SolutionNameMin: Cijk_Ailk_Bjlk_HBH_MT128x128x16_MI32x32x8x1_SE_AF0EM8_EPS0_GRVW8_GSU1_PGR2_SU32_SUS128_SRVW4_TT2_64_VAW2_WG64_4_1_WGM1
    SolutionIndex: 444
    SolutionNameMin: Cijk_Ailk_Bjlk_HBH_MT128x256x16_MI32x32x8x1_SE_AF0EM8_EPS0_GRVW2_GSU1_PGR2_SU32_SUS256_SRVW4_TT2_128_VAW2_WG64_4_1_WGM15
    SolutionIndex: 445
    SolutionNameMin: Cijk_Ailk_Bjlk_HBH_MT128x128x32_MI32x32x8x1_SE_AF0EM8_EPS0_GRVW4_GSU1_PGR2_SU32_SUS128_SRVW4_TT2_64_VAW2_WG64_4_1_WGM1
    SolutionIndex: 446
    SolutionNameMin: Cijk_Ailk_Bjlk_HBH_MT192x64x32_MI32x32x8x1_SE_AF0EM8_EPS0_GRVW8_GSU1_PGR2_SU0_SUS256_SRVW0_TT3_32_VAW2_WG64_4_1_WGM1
    SolutionIndex: 447
    SolutionNameMin: Cijk_Ailk_Bjlk_HBH_MT256x192x32_MI32x32x8x1_SE_AF0EM8_EPS1_GRVW8_GSU1_PGR1_SU32_SUS128_SRVW4_TT4_96_VAW2_WG64_4_1_WGM15
    SolutionIndex: 448
    SolutionNameMin: Cijk_Ailk_Bjlk_HBH_MT64x128x16_MI32x32x8x1_SE_AF0EM8_EPS0_GRVW8_GSU1_PGR2_SU32_SUS256_SRVW4_TT1_64_VAW2_WG64_4_1_WGM2
    SolutionIndex: 449
    SolutionNameMin: Cijk_Ailk_Bjlk_HBH_MT256x192x16_MI32x32x8x1_SE_AF0EM8_EPS0_GRVW4_GSU1_PGR2_SU0_SUS256_SRVW4_TT4_96_VAW2_WG64_4_1_WGM1
    SolutionIndex: 450
    SolutionNameMin: Cijk_Ailk_Bjlk_HBH_MT96x96x64_MI16x16x16x1_SE_AF0EM8_EPS0_GRVW8_GSU1_PGR2_SU0_SUS256_SRVW0_TT3_48_VAW2_WG32_8_1_WGM1
    SolutionIndex: 451
    SolutionNameMin: Cijk_Ailk_Bjlk_HBH_MT64x64x16_MI32x32x8x1_SE_AF0EM8_EPS1_GRVW2_GSU1_PGR1_SU32_SUS256_SRVW4_TT1_32_VAW2_WG64_4_1_WGM1
    SolutionIndex: 452
    SolutionNameMin: Cijk_Ailk_Bjlk_HBH_MT256x192x16_MI32x32x8x1_SE_AF0EM8_EPS0_GRVW4_GSU1_PGR2_SU32_SUS256_SRVW4_TT4_96_VAW2_WG64_4_1_WGM1
    SolutionIndex: 453
    SolutionNameMin: Cijk_Ailk_Bjlk_HBH_MT64x128x16_MI32x32x8x1_SE_AF0EM8_EPS0_GRVW2_GSU1_PGR2_SU32_SUS128_SRVW4_TT1_64_VAW2_WG64_4_1_WGM1
    SolutionIndex: 454
    SolutionNameMin: Cijk_Ailk_Bjlk_HBH_MT64x64x16_MI32x32x8x1_SE_AF0EM8_EPS0_GRVW2_GSU1_PGR2_SU0_SUS256_SRVW4_TT1_32_VAW2_WG64_4_1_WGM1
    SolutionIndex: 455
    SolutionNameMin: Cijk_Ailk_Bjlk_HBH_MT32x64x16_MI16x16x16x1_SE_AF0EM8_EPS0_GRVW2_GSU1_PGR2_SU0_SUS256_SRVW4_TT1_32_VAW2_WG32_8_1_WGM15
    SolutionIndex: 456
    SolutionNameMin: Cijk_Ailk_Bjlk_HBH_MT32x32x16_MI16x16x16x1_SE_AF0EM8_EPS1_GRVW2_GSU1_PGR1_SU0_SUS256_SRVW4_TT1_16_VAW2_WG32_8_1_WGM15
    SolutionIndex: 457
    SolutionNameMin: Cijk_Ailk_Bjlk_HBH_MT32x32x16_MI16x16x16x1_SE_AF0EM8_EPS0_GRVW4_GSU1_PGR2_SU0_SUS256_SRVW4_TT1_16_VAW2_WG32_8_1_WGM1
    SolutionIndex: 458
    SolutionNameMin: Cijk_Ailk_Bjlk_HBH_MT32x64x16_MI16x16x16x1_SE_AF0EM8_EPS1_GRVW2_GSU1_PGR1_SU0_SUS256_SRVW4_TT1_32_VAW2_WG32_8_1_WGM15
    SolutionIndex: 459
    SolutionNameMin: Cijk_Ailk_Bjlk_HBH_MT32x32x16_MI16x16x16x1_SE_AF0EM8_EPS1_GRVW8_GSU1_PGR1_SU32_SUS128_SRVW4_TT1_16_VAW2_WG32_8_1_WGM15
    SolutionIndex: 460
    SolutionNameMin: Cijk_Ailk_Bjlk_HBH_MT64x256x16_MI32x32x8x1_SE_AF0EM8_EPS0_GRVW8_GSU1_PGR2_SU32_SUS256_SRVW4_TT1_128_VAW2_WG64_4_1_WGM15
    SolutionIndex: 461
    SolutionNameMin: Cijk_Ailk_Bjlk_HBH_MT32x32x64_MI16x16x16x1_SE_AF0EM8_EPS0_GRVW4_GSU1_PGR2_SU32_SUS128_SRVW4_TT1_16_VAW2_WG32_8_1_WGM1
    SolutionIndex: 462
    SolutionNameMin: Cijk_Ailk_Bjlk_HBH_MT32x32x16_MI16x16x16x1_SE_AF0EM8_EPS0_GRVW2_GSU1_PGR2_SU32_SUS128_SRVW4_TT1_16_VAW2_WG32_8_1_WGM1
    SolutionIndex: 463
    SolutionNameMin: Cijk_Ailk_Bjlk_HBH_MT32x32x16_MI16x16x16x1_SE_AF0EM8_EPS1_GRVW4_GSU1_PGR1_SU0_SUS256_SRVW4_TT1_16_VAW2_WG32_8_1_WGM15
    SolutionIndex: 464
    SolutionNameMin: Cijk_Ailk_Bjlk_HBH_MT128x256x16_MI32x32x8x1_SE_AF0EM8_EPS1_GRVW4_GSU1_PGR1_SU0_SUS256_SRVW4_TT2_128_VAW2_WG64_4_1_WGM2
    SolutionIndex: 465
    SolutionNameMin: Cijk_Ailk_Bjlk_HBH_MT96x128x32_MI32x32x8x1_SE_AF0EM8_EPS0_GRVW4_GSU1_PGR2_SU32_SUS256_SRVW0_TT3_32_VAW2_WG32_8_1_WGM2
    SolutionIndex: 466
    SolutionNameMin: Cijk_Ailk_Bjlk_HBH_MT96x128x32_MI32x32x8x1_SE_AF0EM8_EPS0_GRVW4_GSU1_PGR2_SU0_SUS256_SRVW0_TT3_32_VAW2_WG32_8_1_WGM1
    SolutionIndex: 467
    SolutionNameMin: Cijk_Ailk_Bjlk_HBH_MT128x256x16_MI32x32x8x1_SE_AF0EM8_EPS0_GRVW4_GSU1_PGR2_SU32_SUS128_SRVW4_TT2_128_VAW2_WG64_4_1_WGM1
    SolutionIndex: 468
    SolutionNameMin: Cijk_Ailk_Bjlk_HBH_MT96x128x32_MI32x32x8x1_SE_AF0EM8_EPS0_GRVW2_GSU1_PGR2_SU0_SUS256_SRVW0_TT3_32_VAW2_WG32_8_1_WGM1
    SolutionIndex: 469
    SolutionNameMin: Cijk_Ailk_Bjlk_HBH_MT64x64x16_MI32x32x8x1_SE_AF0EM8_EPS0_GRVW2_GSU1_PGR2_SU32_SUS128_SRVW4_TT1_32_VAW2_WG64_4_1_WGM1
    SolutionIndex: 470
    SolutionNameMin: Cijk_Ailk_Bjlk_HBH_MT128x128x32_MI32x32x8x1_SE_AF0EM8_EPS0_GRVW2_GSU1_PGR2_SU32_SUS128_SRVW4_TT2_64_VAW2_WG64_4_1_WGM1
    SolutionIndex: 471
    SolutionNameMin: Cijk_Ailk_Bjlk_HBH_MT128x128x32_MI32x32x8x1_SE_AF0EM8_EPS0_GRVW4_GSU1_PGR2_SU32_SUS256_SRVW4_TT2_64_VAW2_WG64_4_1_WGM15
    SolutionIndex: 472
    SolutionNameMin: Cijk_Ailk_Bjlk_HBH_MT64x256x32_MI32x32x8x1_SE_AF0EM8_EPS0_GRVW4_GSU1_PGR2_SU32_SUS128_SRVW4_TT1_128_VAW2_WG64_4_1_WGM2
    SolutionIndex: 473
    SolutionNameMin: Cijk_Ailk_Bjlk_HBH_MT128x128x16_MI32x32x8x1_SE_AF0EM8_EPS0_GRVW2_GSU1_PGR2_SU32_SUS128_SRVW4_TT2_64_VAW2_WG64_4_1_WGM1
    SolutionIndex: 474
    SolutionNameMin: Cijk_Ailk_Bjlk_HBH_MT128x256x16_MI32x32x8x1_SE_AF0EM8_EPS1_GRVW4_GSU1_PGR1_SU32_SUS128_SRVW4_TT2_128_VAW2_WG64_4_1_WGM15
    SolutionIndex: 475
    SolutionNameMin: Cijk_Ailk_Bjlk_HBH_MT128x128x16_MI32x32x8x1_SE_AF0EM8_EPS1_GRVW2_GSU1_PGR1_SU32_SUS256_SRVW4_TT2_64_VAW2_WG64_4_1_WGM1
    SolutionIndex: 476
    SolutionNameMin: Cijk_Ailk_Bjlk_HBH_MT256x256x16_MI32x32x8x1_SE_AF0EM8_EPS0_GRVW8_GSU1_PGR2_SU0_SUS256_SRVW4_TT4_128_VAW2_WG64_4_1_WGM2
    SolutionIndex: 477
    SolutionNameMin: Cijk_Ailk_Bjlk_HBH_MT128x256x16_MI32x32x8x1_SE_AF0EM8_EPS1_GRVW8_GSU1_PGR1_SU32_SUS256_SRVW4_TT2_128_VAW2_WG64_4_1_WGM2
    SolutionIndex: 478
    SolutionNameMin: Cijk_Ailk_Bjlk_HBH_MT128x128x16_MI32x32x8x1_SE_AF0EM8_EPS0_GRVW2_GSU1_PGR2_SU0_SUS256_SRVW4_TT2_64_VAW2_WG64_4_1_WGM1
    SolutionIndex: 479
    SolutionNameMin: Cijk_Ailk_Bjlk_HBH_MT128x128x32_MI32x32x8x1_SE_AF0EM8_EPS0_GRVW4_GSU1_PGR2_SU0_SUS256_SRVW4_TT2_64_VAW2_WG64_4_1_WGM1
    SolutionIndex: 480
    SolutionNameMin: Cijk_Ailk_Bjlk_HBH_MT128x128x16_MI32x32x8x1_SE_AF0EM8_EPS0_GRVW2_GSU1_PGR2_SU32_SUS256_SRVW4_TT2_64_VAW2_WG64_4_1_WGM1
    SolutionIndex: 481
    SolutionNameMin: Cijk_Ailk_Bjlk_HBH_MT96x128x32_MI32x32x8x1_SE_AF0EM8_EPS0_GRVW4_GSU1_PGR2_SU32_SUS256_SRVW0_TT3_32_VAW2_WG32_8_1_WGM15
    SolutionIndex: 482
    SolutionNameMin: Cijk_Ailk_Bjlk_HBH_MT128x128x32_MI32x32x8x1_SE_AF0EM8_EPS0_GRVW4_GSU1_PGR2_SU32_SUS256_SRVW4_TT2_64_VAW2_WG64_4_1_WGM2
    SolutionIndex: 483
    SolutionNameMin: Cijk_Ailk_Bjlk_HBH_MT128x128x32_MI32x32x8x1_SE_AF0EM8_EPS0_GRVW8_GSU1_PGR2_SU32_SUS256_SRVW4_TT2_64_VAW2_WG64_4_1_WGM2
    SolutionIndex: 484
    SolutionNameMin: Cijk_Ailk_Bjlk_HBH_MT128x128x32_MI32x32x8x1_SE_AF0EM8_EPS0_GRVW2_GSU1_PGR2_SU32_SUS256_SRVW4_TT2_64_VAW2_WG64_4_1_WGM15
    SolutionIndex: 485
    SolutionNameMin: Cijk_Ailk_Bjlk_HBH_MT256x128x32_MI32x32x8x1_SE_AF0EM8_EPS1_GRVW4_GSU1_PGR1_SU0_SUS256_SRVW4_TT4_64_VAW2_WG64_4_1_WGM15
    SolutionIndex: 486
    SolutionNameMin: Cijk_Ailk_Bjlk_HBH_MT128x256x32_MI32x32x8x1_SE_AF0EM8_EPS1_GRVW8_GSU1_PGR1_SU32_SUS256_SRVW4_TT2_128_VAW2_WG64_4_1_WGM2
    SolutionIndex: 487
    SolutionNameMin: Cijk_Ailk_Bjlk_HBH_MT128x128x16_MI32x32x8x1_SE_AF0EM8_EPS0_GRVW4_GSU1_PGR2_SU0_SUS256_SRVW4_TT2_64_VAW2_WG64_4_1_WGM1
    SolutionIndex: 488
    SolutionNameMin: Cijk_Ailk_Bjlk_HBH_MT128x128x64_MI32x32x8x1_SE_AF0EM8_EPS0_GRVW4_GSU1_PGR2_SU0_SUS256_SRVW4_TT2_64_VAW2_WG64_4_1_WGM15
    SolutionIndex: 489
    SolutionNameMin: Cijk_Ailk_Bjlk_HBH_MT64x64x64_MI32x32x8x1_SE_AF0EM8_EPS0_GRVW8_GSU1_PGR2_SU0_SUS256_SRVW4_TT1_32_VAW2_WG64_4_1_WGM15
    SolutionIndex: 490
    SolutionNameMin: Cijk_Ailk_Bjlk_HBH_MT64x64x16_MI32x32x8x1_SE_AF0EM8_EPS0_GRVW2_GSU1_PGR2_SU32_SUS256_SRVW4_TT1_32_VAW2_WG64_4_1_WGM1
    SolutionIndex: 491
    SolutionNameMin: Cijk_Ailk_Bjlk_HBH_MT64x64x16_MI32x32x8x1_SE_AF0EM8_EPS0_GRVW4_GSU1_PGR2_SU32_SUS256_SRVW4_TT1_32_VAW2_WG64_4_1_WGM1
    SolutionIndex: 492
    SolutionNameMin: Cijk_Ailk_Bjlk_HBH_MT16x64x64_MI16x16x16x1_SE_AF0EM1_EPS0_GRVW8_GSU15_PGR2_SU32_SUS128_SRVW0_TT1_16_VAW1_WG16_16_1_WGM1
    SolutionIndex: 493
    SolutionNameMin: Cijk_Ailk_Bjlk_HBH_MT128x256x32_MI32x32x8x1_SE_AF0EM1_EPS0_GRVW8_GSU7_PGR2_SU0_SUS256_SRVW4_TT2_128_VAW1_WG64_4_1_WGM1
    SolutionIndex: 494
    SolutionNameMin: Cijk_Ailk_Bjlk_HBH_MT32x32x32_MI16x16x16x1_SE_AF0EM1_EPS0_GRVW8_GSU1_PGR2_SU0_SUS256_SRVW4_TT1_16_VAW2_WG32_8_1_WGM1
    SolutionIndex: 495
    SolutionNameMin: Cijk_Ailk_Bjlk_HBH_MT32x32x16_MI16x16x16x1_SE_AF0EM1_EPS1_GRVW2_GSU1_PGR1_SU0_SUS256_SRVW4_TT1_16_VAW2_WG32_8_1_WGM1
    SolutionIndex: 496
    SolutionNameMin: Cijk_Ailk_Bjlk_HBH_MT32x64x16_MI16x16x16x1_SE_AF0EM1_EPS0_GRVW2_GSU1_PGR2_SU32_SUS256_SRVW4_TT1_32_VAW2_WG32_8_1_WGM15
    SolutionIndex: 497
    SolutionNameMin: Cijk_Ailk_Bjlk_HBH_MT64x32x16_MI16x16x16x1_SE_AF0EM1_EPS0_GRVW2_GSU1_PGR2_SU0_SUS256_SRVW4_TT2_16_VAW2_WG32_8_1_WGM1
    SolutionIndex: 498
    SolutionNameMin: Cijk_Ailk_Bjlk_HBH_MT64x32x16_MI16x16x16x1_SE_AF0EM1_EPS1_GRVW2_GSU1_PGR1_SU0_SUS256_SRVW4_TT2_16_VAW2_WG32_8_1_WGM1
    SolutionIndex: 499
    SolutionNameMin: Cijk_Ailk_Bjlk_HBH_MT32x32x32_MI16x16x16x1_SE_AF0EM1_EPS0_GRVW4_GSU1_PGR2_SU0_SUS256_SRVW4_TT1_16_VAW2_WG32_8_1_WGM1
    SolutionIndex: 500
    SolutionNameMin: Cijk_Ailk_Bjlk_HBH_MT32x64x64_MI16x16x16x1_SE_AF0EM1_EPS0_GRVW8_GSU1_PGR2_SU0_SUS256_SRVW4_TT1_32_VAW2_WG32_8_1_WGM15
    SolutionIndex: 501
    SolutionNameMin: Cijk_Ailk_Bjlk_HBH_MT32x32x32_MI16x16x16x1_SE_AF0EM1_EPS0_GRVW8_GSU1_PGR2_SU0_SUS256_SRVW4_TT1_16_VAW2_WG32_8_1_WGM2
    SolutionIndex: 502
    SolutionNameMin: Cijk_Ailk_Bjlk_HBH_MT96x128x64_MI32x32x8x1_SE_AF0EM1_EPS0_GRVW8_GSU1_PGR2_SU32_SUS256_SRVW0_TT3_32_VAW2_WG32_8_1_WGM15
    SolutionIndex: 503
    SolutionNameMin: Cijk_Ailk_Bjlk_HBH_MT32x32x64_MI16x16x16x1_SE_AF0EM1_EPS0_GRVW8_GSU7_PGR2_SU32_SUS256_SRVW4_TT1_16_VAW1_WG32_8_1_WGM1
    SolutionIndex: 504
    SolutionNameMin: Cijk_Ailk_Bjlk_HBH_MT32x32x64_MI16x16x16x1_SE_AF0EM1_EPS0_GRVW8_GSU7_PGR2_SU0_SUS256_SRVW4_TT1_16_VAW1_WG32_8_1_WGM1
    SolutionIndex: 505
    SolutionNameMin: Cijk_Ailk_Bjlk_HBH_MT16x64x64_MI16x16x16x1_SE_AF0EM1_EPS0_GRVW8_GSU15_PGR2_SU32_SUS128_SRVW0_TT1_16_VAW1_WG16_16_1_WGM2
    SolutionIndex: 506
    SolutionNameMin: Cijk_Ailk_Bjlk_HBH_MT16x64x64_MI16x16x16x1_SE_AF0EM1_EPS0_GRVW8_GSU15_PGR2_SU32_SUS256_SRVW0_TT1_16_VAW1_WG16_16_1_WGM1
    SolutionIndex: 507
    SolutionNameMin: Cijk_Ailk_Bjlk_HBH_MT64x16x32_MI16x16x16x1_SE_AF0EM1_EPS0_GRVW8_GSU3_PGR2_SU32_SUS256_SRVW0_TT1_16_VAW1_WG64_4_1_WGM1
    SolutionIndex: 508
    SolutionNameMin: Cijk_Ailk_Bjlk_HBH_MT128x128x32_MI32x32x8x1_SE_AF0EM1_EPS0_GRVW4_GSU1_PGR2_SU0_SUS256_SRVW4_TT2_64_VAW2_WG64_4_1_WGM15
    SolutionIndex: 509
    SolutionNameMin: Cijk_Ailk_Bjlk_HBH_MT128x128x16_MI32x32x8x1_SE_AF0EM1_EPS0_GRVW8_GSU1_PGR2_SU0_SUS256_SRVW4_TT2_64_VAW2_WG64_4_1_WGM2
    SolutionIndex: 510
    SolutionNameMin: Cijk_Ailk_Bjlk_HBH_MT64x128x32_MI32x32x8x1_SE_AF0EM1_EPS0_GRVW4_GSU1_PGR2_SU0_SUS256_SRVW4_TT1_64_VAW2_WG64_4_1_WGM2
    SolutionIndex: 511
    SolutionNameMin: Cijk_Ailk_Bjlk_HBH_MT64x128x32_MI32x32x8x1_SE_AF0EM1_EPS0_GRVW2_GSU1_PGR2_SU32_SUS256_SRVW4_TT1_64_VAW2_WG64_4_1_WGM1
    SolutionIndex: 512
    SolutionNameMin: Cijk_Ailk_Bjlk_HBH_MT128x128x32_MI32x32x8x1_SE_AF0EM1_EPS0_GRVW8_GSU1_PGR2_SU0_SUS256_SRVW4_TT2_64_VAW2_WG64_4_1_WGM15
    SolutionIndex: 513
    SolutionNameMin: Cijk_Ailk_Bjlk_HBH_MT128x128x16_MI32x32x8x1_SE_AF0EM1_EPS0_GRVW4_GSU1_PGR2_SU0_SUS256_SRVW4_TT2_64_VAW2_WG64_4_1_WGM2
    SolutionIndex: 514
    SolutionNameMin: Cijk_Ailk_Bjlk_HBH_MT128x128x32_MI32x32x8x1_SE_AF0EM1_EPS0_GRVW4_GSU1_PGR2_SU0_SUS256_SRVW4_TT2_64_VAW2_WG64_4_1_WGM2
    SolutionIndex: 515
    SolutionNameMin: Cijk_Ailk_Bjlk_HBH_MT64x128x16_MI32x32x8x1_SE_AF0EM1_EPS0_GRVW8_GSU1_PGR2_SU32_SUS128_SRVW4_TT1_64_VAW2_WG64_4_1_WGM2
    SolutionIndex: 516
    SolutionNameMin: Cijk_Ailk_Bjlk_HBH_MT64x192x32_MI32x32x8x1_SE_AF0EM1_EPS0_GRVW4_GSU1_PGR2_SU0_SUS256_SRVW4_TT1_96_VAW2_WG64_4_1_WGM2
    SolutionIndex: 517
    SolutionNameMin: Cijk_Ailk_Bjlk_HBH_MT64x256x16_MI32x32x8x1_SE_AF0EM1_EPS0_GRVW8_GSU1_PGR2_SU0_SUS256_SRVW4_TT1_128_VAW2_WG64_4_1_WGM1
    SolutionIndex: 518
    SolutionNameMin: Cijk_Ailk_Bjlk_HBH_MT128x96x32_MI32x32x8x1_SE_AF0EM1_EPS0_GRVW2_GSU1_PGR2_SU0_SUS256_SRVW4_TT1_96_VAW2_WG128_2_1_WGM2
    SolutionIndex: 519
    SolutionNameMin: Cijk_Ailk_Bjlk_HBH_MT64x192x16_MI32x32x8x1_SE_AF0EM1_EPS1_GRVW4_GSU1_PGR1_SU32_SUS128_SRVW4_TT1_96_VAW2_WG64_4_1_WGM15
    SolutionIndex: 520
    SolutionNameMin: Cijk_Ailk_Bjlk_HBH_MT64x192x32_MI32x32x8x1_SE_AF0EM1_EPS0_GRVW8_GSU1_PGR2_SU0_SUS256_SRVW4_TT1_96_VAW2_WG64_4_1_WGM1
    SolutionIndex: 521
    SolutionNameMin: Cijk_Ailk_Bjlk_HBH_MT128x128x16_MI32x32x8x1_SE_AF0EM1_EPS0_GRVW8_GSU1_PGR2_SU0_SUS256_SRVW4_TT2_64_VAW2_WG64_4_1_WGM15
    SolutionIndex: 522
    SolutionNameMin: Cijk_Ailk_Bjlk_HBH_MT64x192x16_MI32x32x8x1_SE_AF0EM1_EPS0_GRVW2_GSU1_PGR2_SU0_SUS256_SRVW4_TT1_96_VAW2_WG64_4_1_WGM1
    SolutionIndex: 523
    SolutionNameMin: Cijk_Ailk_Bjlk_HBH_MT64x128x16_MI32x32x8x1_SE_AF0EM1_EPS0_GRVW4_GSU1_PGR2_SU0_SUS256_SRVW4_TT1_64_VAW2_WG64_4_1_WGM15
    SolutionIndex: 524
    SolutionNameMin: Cijk_Ailk_Bjlk_HBH_MT64x64x16_MI32x32x8x1_SE_AF0EM1_EPS0_GRVW2_GSU1_PGR2_SU32_SUS128_SRVW4_TT1_32_VAW2_WG64_4_1_WGM15
    SolutionIndex: 525
    SolutionNameMin: Cijk_Ailk_Bjlk_HBH_MT64x192x16_MI32x32x8x1_SE_AF0EM1_EPS1_GRVW2_GSU1_PGR1_SU0_SUS256_SRVW4_TT1_96_VAW2_WG64_4_1_WGM2
    SolutionIndex: 526
    SolutionNameMin: Cijk_Ailk_Bjlk_HBH_MT64x128x16_MI32x32x8x1_SE_AF0EM1_EPS0_GRVW8_GSU1_PGR2_SU0_SUS256_SRVW4_TT1_64_VAW2_WG64_4_1_WGM1
    SolutionIndex: 527
    SolutionNameMin: Cijk_Ailk_Bjlk_HBH_MT128x128x16_MI32x32x8x1_SE_AF0EM1_EPS1_GRVW2_GSU1_PGR1_SU0_SUS256_SRVW4_TT2_64_VAW2_WG64_4_1_WGM2
    SolutionIndex: 528
    SolutionNameMin: Cijk_Ailk_Bjlk_HBH_MT128x96x16_MI32x32x8x1_SE_AF0EM1_EPS1_GRVW2_GSU1_PGR1_SU32_SUS256_SRVW4_TT1_96_VAW2_WG128_2_1_WGM15
    SolutionIndex: 529
    SolutionNameMin: Cijk_Ailk_Bjlk_HBH_MT128x96x16_MI32x32x8x1_SE_AF0EM1_EPS1_GRVW2_GSU1_PGR1_SU0_SUS256_SRVW4_TT1_96_VAW2_WG128_2_1_WGM15
    SolutionIndex: 530
    SolutionNameMin: Cijk_Ailk_Bjlk_HBH_MT128x64x16_MI32x32x8x1_SE_AF0EM1_EPS0_GRVW2_GSU1_PGR2_SU32_SUS256_SRVW4_TT2_32_VAW2_WG64_4_1_WGM2
    SolutionIndex: 531
    SolutionNameMin: Cijk_Ailk_Bjlk_HBH_MT128x128x16_MI32x32x8x1_SE_AF0EM1_EPS0_GRVW8_GSU1_PGR2_SU32_SUS256_SRVW4_TT2_64_VAW2_WG64_4_1_WGM1
    SolutionIndex: 532
    SolutionNameMin: Cijk_Ailk_Bjlk_HBH_MT128x256x16_MI32x32x8x1_SE_AF0EM1_EPS0_GRVW8_GSU1_PGR2_SU32_SUS256_SRVW4_TT2_128_VAW2_WG64_4_1_WGM1
    SolutionIndex: 533
    SolutionNameMin: Cijk_Ailk_Bjlk_HBH_MT128x256x16_MI32x32x8x1_SE_AF0EM1_EPS0_GRVW8_GSU1_PGR2_SU32_SUS256_SRVW4_TT2_128_VAW2_WG64_4_1_WGM2
    SolutionIndex: 534
    SolutionNameMin: Cijk_Ailk_Bjlk_HBH_MT64x64x32_MI32x32x8x1_SE_AF0EM1_EPS0_GRVW8_GSU1_PGR2_SU0_SUS256_SRVW4_TT1_32_VAW2_WG64_4_1_WGM1
    SolutionIndex: 535
    SolutionNameMin: Cijk_Ailk_Bjlk_HBH_MT64x64x16_MI32x32x8x1_SE_AF0EM1_EPS1_GRVW8_GSU1_PGR1_SU0_SUS256_SRVW4_TT1_32_VAW2_WG64_4_1_WGM1
    SolutionIndex: 536
    SolutionNameMin: Cijk_Ailk_Bjlk_HBH_MT128x64x16_MI32x32x8x1_SE_AF0EM1_EPS0_GRVW8_GSU1_PGR2_SU0_SUS256_SRVW4_TT2_32_VAW2_WG64_4_1_WGM2
    SolutionIndex: 537
    SolutionNameMin: Cijk_Ailk_Bjlk_HBH_MT64x128x16_MI32x32x8x1_SE_AF0EM1_EPS1_GRVW8_GSU1_PGR1_SU32_SUS128_SRVW4_TT1_64_VAW2_WG64_4_1_WGM2
    SolutionIndex: 538
    SolutionNameMin: Cijk_Ailk_Bjlk_HBH_MT64x128x16_MI32x32x8x1_SE_AF0EM1_EPS0_GRVW8_GSU1_PGR2_SU32_SUS128_SRVW4_TT1_64_VAW2_WG64_4_1_WGM1
    SolutionIndex: 539
    SolutionNameMin: Cijk_Ailk_Bjlk_HBH_MT128x96x16_MI32x32x8x1_SE_AF0EM1_EPS0_GRVW2_GSU1_PGR2_SU0_SUS256_SRVW4_TT1_96_VAW2_WG128_2_1_WGM1
    SolutionIndex: 540
    SolutionNameMin: Cijk_Ailk_Bjlk_HBH_MT128x128x16_MI32x32x8x1_SE_AF0EM1_EPS0_GRVW2_GSU1_PGR2_SU0_SUS256_SRVW4_TT2_64_VAW2_WG64_4_1_WGM1
    SolutionIndex: 541
    SolutionNameMin: Cijk_Ailk_Bjlk_HBH_MT128x128x16_MI32x32x8x1_SE_AF0EM1_EPS0_GRVW8_GSU1_PGR2_SU0_SUS256_SRVW4_TT2_64_VAW2_WG64_4_1_WGM1
    SolutionIndex: 542
    SolutionNameMin: Cijk_Ailk_Bjlk_HBH_MT128x128x16_MI32x32x8x1_SE_AF0EM1_EPS0_GRVW8_GSU1_PGR2_SU32_SUS256_SRVW4_TT2_64_VAW2_WG64_4_1_WGM2
    SolutionIndex: 543
    SolutionNameMin: Cijk_Ailk_Bjlk_HBH_MT64x64x32_MI32x32x8x1_SE_AF0EM1_EPS0_GRVW4_GSU1_PGR2_SU0_SUS256_SRVW4_TT1_32_VAW2_WG64_4_1_WGM1
    SolutionIndex: 544
    SolutionNameMin: Cijk_Ailk_Bjlk_HBH_MT32x64x64_MI16x16x16x1_SE_AF0EM1_EPS0_GRVW8_GSU1_PGR2_SU32_SUS128_SRVW4_TT1_32_VAW2_WG32_8_1_WGM2
    SolutionIndex: 545
    SolutionNameMin: Cijk_Ailk_Bjlk_HBH_MT128x256x16_MI32x32x8x1_SE_AF0EM1_EPS1_GRVW8_GSU1_PGR1_SU0_SUS256_SRVW4_TT2_128_VAW2_WG64_4_1_WGM2
    SolutionIndex: 546
    SolutionNameMin: Cijk_Ailk_Bjlk_HBH_MT128x256x16_MI32x32x8x1_SE_AF0EM1_EPS1_GRVW8_GSU1_PGR1_SU0_SUS256_SRVW4_TT2_128_VAW2_WG64_4_1_WGM2
    SolutionIndex: 547
    SolutionNameMin: Cijk_Ailk_Bjlk_HBH_MT128x128x32_MI32x32x8x1_SE_AF0EM1_EPS0_GRVW8_GSU1_PGR2_SU0_SUS256_SRVW4_TT2_64_VAW2_WG64_4_1_WGM2
    SolutionIndex: 548
    SolutionNameMin: Cijk_Ailk_Bjlk_HBH_MT64x128x32_MI32x32x8x1_SE_AF0EM1_EPS0_GRVW2_GSU1_PGR2_SU0_SUS256_SRVW4_TT1_64_VAW2_WG64_4_1_WGM15
    SolutionIndex: 549
    SolutionNameMin: Cijk_Ailk_Bjlk_HBH_MT64x128x32_MI32x32x8x1_SE_AF0EM1_EPS0_GRVW2_GSU1_PGR2_SU0_SUS256_SRVW4_TT1_64_VAW2_WG64_4_1_WGM1
    SolutionIndex: 550
    SolutionNameMin: Cijk_Ailk_Bjlk_HBH_MT64x128x32_MI32x32x8x1_SE_AF0EM1_EPS0_GRVW4_GSU1_PGR2_SU0_SUS256_SRVW4_TT1_64_VAW2_WG64_4_1_WGM15
    SolutionIndex: 551
    SolutionNameMin: Cijk_Ailk_Bjlk_HBH_MT128x256x16_MI32x32x8x1_SE_AF0EM1_EPS0_GRVW8_GSU1_PGR2_SU0_SUS256_SRVW4_TT2_128_VAW2_WG64_4_1_WGM2
    SolutionIndex: 552
    SolutionNameMin: Cijk_Ailk_Bjlk_HBH_MT128x256x16_MI32x32x8x1_SE_AF0EM1_EPS0_GRVW8_GSU1_PGR2_SU0_SUS256_SRVW4_TT2_128_VAW2_WG64_4_1_WGM15
    SolutionIndex: 553
    SolutionNameMin: Cijk_Ailk_Bjlk_HBH_MT256x144x32_MI16x16x16x1_SE_AF0EM1_EPS0_GRVW2_GSU1_PGR2_SU0_SUS256_SRVW4_TT4_144_VAW2_WG64_4_1_WGM1
    SolutionIndex: 554
    SolutionNameMin: Cijk_Ailk_Bjlk_HBH_MT128x128x32_MI32x32x8x1_SE_AF0EM1_EPS0_GRVW8_GSU1_PGR2_SU32_SUS128_SRVW4_TT2_64_VAW2_WG64_4_1_WGM1
    SolutionIndex: 555
    SolutionNameMin: Cijk_Ailk_Bjlk_HBH_MT128x128x32_MI32x32x8x1_SE_AF0EM1_EPS0_GRVW8_GSU1_PGR2_SU0_SUS256_SRVW4_TT2_64_VAW2_WG64_4_1_WGM1
    SolutionIndex: 556
    SolutionNameMin: Cijk_Ailk_Bjlk_HBH_MT128x128x32_MI32x32x8x1_SE_AF0EM1_EPS0_GRVW2_GSU1_PGR2_SU32_SUS128_SRVW4_TT2_64_VAW2_WG64_4_1_WGM15
    SolutionIndex: 557
    SolutionNameMin: Cijk_Ailk_Bjlk_HBH_MT128x64x64_MI32x32x8x1_SE_AF0EM1_EPS0_GRVW8_GSU1_PGR2_SU32_SUS256_SRVW4_TT2_32_VAW2_WG64_4_1_WGM15
    SolutionIndex: 558
    SolutionNameMin: Cijk_Ailk_Bjlk_HBH_MT128x128x32_MI32x32x8x1_SE_AF0EM1_EPS1_GRVW8_GSU1_PGR1_SU0_SUS256_SRVW4_TT2_64_VAW2_WG64_4_1_WGM2
    SolutionIndex: 559
    SolutionNameMin: Cijk_Ailk_Bjlk_HBH_MT64x128x64_MI32x32x8x1_SE_AF0EM1_EPS0_GRVW4_GSU1_PGR2_SU0_SUS256_SRVW4_TT1_64_VAW2_WG64_4_1_WGM15
    SolutionIndex: 560
    SolutionNameMin: Cijk_Ailk_Bjlk_HBH_MT128x64x64_MI32x32x8x1_SE_AF0EM1_EPS0_GRVW2_GSU1_PGR2_SU0_SUS256_SRVW4_TT2_32_VAW2_WG64_4_1_WGM15
    SolutionIndex: 561
    SolutionNameMin: Cijk_Ailk_Bjlk_HBH_MT128x128x32_MI32x32x8x1_SE_AF0EM1_EPS0_GRVW2_GSU1_PGR2_SU32_SUS256_SRVW4_TT2_64_VAW2_WG64_4_1_WGM2
    SolutionIndex: 562
    SolutionNameMin: Cijk_Ailk_Bjlk_HBH_MT128x64x32_MI32x32x8x1_SE_AF0EM1_EPS0_GRVW4_GSU1_PGR2_SU0_SUS256_SRVW4_TT2_32_VAW2_WG64_4_1_WGM15
    SolutionIndex: 563
    SolutionNameMin: Cijk_Ailk_Bjlk_HBH_MT128x128x32_MI32x32x8x1_SE_AF0EM1_EPS0_GRVW4_GSU1_PGR2_SU0_SUS256_SRVW4_TT2_64_VAW2_WG64_4_1_WGM1
    SolutionIndex: 564
    SolutionNameMin: Cijk_Ailk_Bjlk_HBH_MT128x128x32_MI32x32x8x1_SE_AF0EM1_EPS0_GRVW8_GSU1_PGR2_SU32_SUS128_SRVW4_TT2_64_VAW2_WG64_4_1_WGM15
    SolutionIndex: 565
    SolutionNameMin: Cijk_Ailk_Bjlk_HBH_MT128x64x32_MI32x32x8x1_SE_AF0EM1_EPS0_GRVW8_GSU1_PGR2_SU32_SUS256_SRVW4_TT2_32_VAW2_WG64_4_1_WGM1
    SolutionIndex: 566
    SolutionNameMin: Cijk_Ailk_Bjlk_HBH_MT32x32x16_MI16x16x16x1_SE_AF0EM1_EPS0_GRVW8_GSU1_PGR2_SU32_SUS128_SRVW4_TT1_16_VAW2_WG32_8_1_WGM1
    SolutionIndex: 567
    SolutionNameMin: Cijk_Ailk_Bjlk_HBH_MT32x32x16_MI16x16x16x1_SE_AF0EM1_EPS0_GRVW4_GSU1_PGR2_SU0_SUS256_SRVW4_TT1_16_VAW2_WG32_8_1_WGM2
    SolutionIndex: 568
    SolutionNameMin: Cijk_Ailk_Bjlk_HBH_MT32x32x16_MI16x16x16x1_SE_AF0EM1_EPS0_GRVW2_GSU1_PGR2_SU0_SUS256_SRVW4_TT1_16_VAW2_WG32_8_1_WGM2
    SolutionIndex: 569
    SolutionNameMin: Cijk_Ailk_Bjlk_HBH_MT32x32x16_MI16x16x16x1_SE_AF0EM1_EPS1_GRVW8_GSU1_PGR1_SU0_SUS256_SRVW4_TT1_16_VAW2_WG32_8_1_WGM1
    SolutionIndex: 570
    SolutionNameMin: Cijk_Ailk_Bjlk_HBH_MT32x32x16_MI16x16x16x1_SE_AF0EM1_EPS1_GRVW4_GSU1_PGR1_SU0_SUS256_SRVW4_TT1_16_VAW2_WG32_8_1_WGM1
    SolutionIndex: 571
    SolutionNameMin: Cijk_Ailk_Bjlk_HBH_MT32x32x16_MI16x16x16x1_SE_AF0EM1_EPS1_GRVW2_GSU1_PGR1_SU0_SUS256_SRVW4_TT1_16_VAW2_WG32_8_1_WGM15
    SolutionIndex: 572
    SolutionNameMin: Cijk_Ailk_Bjlk_HBH_MT32x32x16_MI16x16x16x1_SE_AF0EM1_EPS0_GRVW2_GSU1_PGR2_SU0_SUS256_SRVW4_TT1_16_VAW2_WG32_8_1_WGM1
    SolutionIndex: 573
    SolutionNameMin: Cijk_Ailk_Bjlk_HBH_MT128x128x64_MI32x32x8x1_SE_AF0EM1_EPS0_GRVW4_GSU1_PGR2_SU32_SUS256_SRVW4_TT2_64_VAW2_WG64_4_1_WGM2
    SolutionIndex: 574
    SolutionNameMin: Cijk_Ailk_Bjlk_HBH_MT128x128x32_MI32x32x8x1_SE_AF0EM1_EPS0_GRVW8_GSU1_PGR2_SU32_SUS256_SRVW4_TT2_64_VAW2_WG64_4_1_WGM1
    SolutionIndex: 575
    SolutionNameMin: Cijk_Ailk_Bjlk_HBH_MT128x128x32_MI32x32x8x1_SE_AF0EM1_EPS0_GRVW4_GSU1_PGR2_SU32_SUS256_SRVW4_TT2_64_VAW2_WG64_4_1_WGM15
    SolutionIndex: 576
    SolutionNameMin: Cijk_Ailk_Bjlk_HBH_MT64x32x16_MI16x16x16x1_SE_AF0EM1_EPS1_GRVW2_GSU1_PGR1_SU32_SUS256_SRVW4_TT2_16_VAW2_WG32_8_1_WGM15
    SolutionIndex: 577
    SolutionNameMin: Cijk_Ailk_Bjlk_HBH_MT32x32x16_MI16x16x16x1_SE_AF0EM1_EPS0_GRVW4_GSU1_PGR2_SU0_SUS256_SRVW4_TT1_16_VAW2_WG32_8_1_WGM15
    SolutionIndex: 578
    SolutionNameMin: Cijk_Ailk_Bjlk_HBH_MT32x32x16_MI16x16x16x1_SE_AF0EM1_EPS0_GRVW8_GSU1_PGR2_SU0_SUS256_SRVW4_TT1_16_VAW2_WG32_8_1_WGM1
    SolutionIndex: 579
    SolutionNameMin: Cijk_Ailk_Bjlk_HBH_MT32x32x16_MI16x16x16x1_SE_AF0EM1_EPS0_GRVW4_GSU1_PGR2_SU0_SUS256_SRVW4_TT1_16_VAW2_WG32_8_1_WGM1
    SolutionIndex: 580
    SolutionNameMin: Cijk_Ailk_Bjlk_HBH_MT128x128x16_MI32x32x8x1_SE_AF0EM1_EPS0_GRVW8_GSU1_PGR2_SU32_SUS128_SRVW4_TT2_64_VAW2_WG64_4_1_WGM1
    SolutionIndex: 581
    SolutionNameMin: Cijk_Ailk_Bjlk_HBH_MT64x128x32_MI32x32x8x1_SE_AF0EM1_EPS0_GRVW8_GSU1_PGR2_SU32_SUS256_SRVW4_TT1_64_VAW2_WG64_4_1_WGM15
    SolutionIndex: 582
    SolutionNameMin: Cijk_Ailk_Bjlk_HBH_MT128x128x32_MI32x32x8x1_SE_AF0EM1_EPS1_GRVW2_GSU1_PGR1_SU0_SUS256_SRVW4_TT2_64_VAW2_WG64_4_1_WGM1
    SolutionIndex: 583
    SolutionNameMin: Cijk_Ailk_Bjlk_HBH_MT128x128x32_MI32x32x8x1_SE_AF0EM1_EPS1_GRVW8_GSU1_PGR1_SU32_SUS128_SRVW4_TT2_64_VAW2_WG64_4_1_WGM1
    SolutionIndex: 584
    SolutionNameMin: Cijk_Ailk_Bjlk_HBH_MT128x64x16_MI32x32x8x1_SE_AF0EM1_EPS0_GRVW4_GSU1_PGR2_SU32_SUS256_SRVW4_TT2_32_VAW2_WG64_4_1_WGM15
    SolutionIndex: 585
    SolutionNameMin: Cijk_Ailk_Bjlk_HBH_MT128x256x16_MI32x32x8x1_SE_AF0EM1_EPS0_GRVW8_GSU1_PGR2_SU0_SUS256_SRVW4_TT2_128_VAW2_WG64_4_1_WGM1
    SolutionIndex: 586
    SolutionNameMin: Cijk_Ailk_Bjlk_HBH_MT96x128x32_MI32x32x8x1_SE_AF0EM1_EPS0_GRVW4_GSU1_PGR2_SU0_SUS256_SRVW0_TT3_32_VAW2_WG32_8_1_WGM1
    SolutionIndex: 587
    SolutionNameMin: Cijk_Ailk_Bjlk_HBH_MT256x64x32_MI32x32x8x1_SE_AF0EM1_EPS0_GRVW8_GSU1_PGR2_SU0_SUS256_SRVW4_TT4_32_VAW2_WG64_4_1_WGM1
    SolutionIndex: 588
    SolutionNameMin: Cijk_Ailk_Bjlk_HBH_MT128x128x32_MI32x32x8x1_SE_AF0EM1_EPS0_GRVW2_GSU1_PGR2_SU0_SUS256_SRVW4_TT2_64_VAW2_WG64_4_1_WGM1
    SolutionIndex: 589
    SolutionNameMin: Cijk_Ailk_Bjlk_HBH_MT128x256x16_MI32x32x8x1_SE_AF0EM1_EPS0_GRVW8_GSU1_PGR2_SU0_SUS256_SRVW4_TT2_128_VAW2_WG64_4_1_WGM15
    SolutionIndex: 590
    SolutionNameMin: Cijk_Ailk_Bjlk_HBH_MT128x128x32_MI32x32x8x1_SE_AF0EM1_EPS0_GRVW8_GSU1_PGR2_SU32_SUS256_SRVW4_TT2_64_VAW2_WG64_4_1_WGM2
    SolutionIndex: 591
    SolutionNameMin: Cijk_Ailk_Bjlk_HBH_MT128x128x32_MI32x32x8x1_SE_AF0EM1_EPS0_GRVW4_GSU1_PGR2_SU32_SUS128_SRVW4_TT2_64_VAW2_WG64_4_1_WGM1
    SolutionIndex: 592
    SolutionNameMin: Cijk_Ailk_Bjlk_HBH_MT128x64x16_MI32x32x8x1_SE_AF0EM1_EPS0_GRVW4_GSU1_PGR2_SU0_SUS256_SRVW4_TT2_32_VAW2_WG64_4_1_WGM2
    SolutionIndex: 593
    SolutionNameMin: Cijk_Ailk_Bjlk_HBH_MT128x64x16_MI32x32x8x1_SE_AF0EM1_EPS0_GRVW4_GSU1_PGR2_SU0_SUS256_SRVW4_TT2_32_VAW2_WG64_4_1_WGM15
    SolutionIndex: 594
    SolutionNameMin: Cijk_Ailk_Bjlk_HBH_MT128x128x64_MI32x32x8x1_SE_AF0EM1_EPS0_GRVW8_GSU1_PGR2_SU32_SUS256_SRVW4_TT2_64_VAW2_WG64_4_1_WGM15
    SolutionIndex: 595
    SolutionNameMin: Cijk_Ailk_Bjlk_HBH_MT64x256x16_MI32x32x8x1_SE_AF0EM1_EPS0_GRVW8_GSU1_PGR2_SU32_SUS256_SRVW4_TT1_128_VAW2_WG64_4_1_WGM15
    SolutionIndex: 596
    SolutionNameMin: Cijk_Ailk_Bjlk_HBH_MT64x64x16_MI32x32x8x1_SE_AF0EM1_EPS0_GRVW2_GSU1_PGR2_SU32_SUS256_SRVW4_TT1_32_VAW2_WG64_4_1_WGM15
    SolutionIndex: 597
    SolutionNameMin: Cijk_Ailk_Bjlk_HBH_MT32x64x32_MI16x16x16x1_SE_AF0EM1_EPS0_GRVW2_GSU1_PGR2_SU32_SUS128_SRVW4_TT1_32_VAW2_WG32_8_1_WGM1
    SolutionIndex: 598
    SolutionNameMin: Cijk_Ailk_Bjlk_HBH_MT32x32x32_MI16x16x16x1_SE_AF0EM1_EPS0_GRVW2_GSU1_PGR2_SU0_SUS256_SRVW4_TT1_16_VAW2_WG32_8_1_WGM1
    SolutionIndex: 599
    SolutionNameMin: Cijk_Ailk_Bjlk_HBH_MT128x256x16_MI32x32x8x1_SE_AF0EM1_EPS0_GRVW8_GSU1_PGR2_SU0_SUS256_SRVW4_TT2_128_VAW2_WG64_4_1_WGM1
    SolutionIndex: 600
    SolutionNameMin: Cijk_Ailk_Bjlk_HBH_MT128x128x16_MI32x32x8x1_SE_AF0EM1_EPS0_GRVW4_GSU1_PGR2_SU0_SUS256_SRVW4_TT2_64_VAW2_WG64_4_1_WGM15
    SolutionIndex: 601
    SolutionNameMin: Cijk_Ailk_Bjlk_HBH_MT64x256x16_MI32x32x8x1_SE_AF0EM1_EPS0_GRVW8_GSU1_PGR2_SU32_SUS256_SRVW4_TT1_128_VAW2_WG64_4_1_WGM1
    SolutionIndex: 602
    SolutionNameMin: Cijk_Ailk_Bjlk_HBH_MT16x64x32_MI16x16x16x1_SE_AF0EM1_EPS1_GRVW8_GSU1_PGR1_SU0_SUS256_SRVW0_TT1_16_VAW2_WG16_16_1_WGM1
    SolutionIndex: 603
    SolutionNameMin: Cijk_Ailk_Bjlk_HBH_MT16x16x32_MI16x16x16x1_SE_AF0EM1_EPS0_GRVW4_GSU1_PGR2_SU32_SUS128_SRVW0_TT1_16_VAW2_WG16_4_1_WGM1
    SolutionIndex: 604
    SolutionNameMin: Cijk_Ailk_Bjlk_HBH_MT16x16x32_MI16x16x16x1_SE_AF0EM1_EPS0_GRVW8_GSU1_PGR2_SU0_SUS256_SRVW0_TT1_16_VAW2_WG16_4_1_WGM1
    SolutionIndex: 605
    SolutionNameMin: Cijk_Ailk_Bjlk_HBH_MT32x32x64_MI16x16x16x1_SE_AF0EM1_EPS0_GRVW8_GSU1_PGR2_SU0_SUS256_SRVW4_TT1_16_VAW2_WG32_8_1_WGM1
    SolutionIndex: 606
    SolutionNameMin: Cijk_Ailk_Bjlk_HBH_MT64x128x64_MI32x32x8x1_SE_AF0EM1_EPS0_GRVW2_GSU1_PGR2_SU32_SUS256_SRVW4_TT1_64_VAW2_WG64_4_1_WGM15
    SolutionIndex: 607
    SolutionNameMin: Cijk_Ailk_Bjlk_HBH_MT64x64x16_MI32x32x8x1_SE_AF0EM1_EPS0_GRVW4_GSU1_PGR2_SU0_SUS256_SRVW4_TT1_32_VAW2_WG64_4_1_WGM1
    SolutionIndex: 608
    SolutionNameMin: Cijk_Ailk_Bjlk_HBH_MT64x16x32_MI16x16x16x1_SE_AF0EM1_EPS0_GRVW8_GSU1_PGR2_SU0_SUS256_SRVW0_TT1_16_VAW2_WG64_4_1_WGM1
    SolutionIndex: 609
    SolutionNameMin: Cijk_Ailk_Bjlk_HBH_MT128x128x16_MI32x32x8x1_SE_AF0EM8_EPS0_GRVW8_GSU1_PGR2_SU32_SUS256_SRVW4_TT2_64_VAW2_WG64_4_1_WGM15
    SolutionIndex: 610
    SolutionNameMin: Cijk_Ailk_Bjlk_HBH_MT128x96x32_MI32x32x8x1_SE_AF0EM8_EPS0_GRVW2_GSU1_PGR2_SU0_SUS256_SRVW4_TT1_96_VAW2_WG128_2_1_WGM1
    SolutionIndex: 611
    SolutionNameMin: Cijk_Ailk_Bjlk_HBH_MT192x192x32_MI32x32x8x1_SE_AF0EM8_EPS1_GRVW8_GSU1_PGR1_SU0_SUS256_SRVW0_TT3_96_VAW2_WG64_4_1_WGM1
    SolutionIndex: 612
    SolutionNameMin: Cijk_Ailk_Bjlk_HBH_MT256x256x16_MI32x32x8x1_SE_AF0EM8_EPS1_GRVW4_GSU1_PGR1_SU32_SUS128_SRVW4_TT4_128_VAW2_WG64_4_1_WGM1
    SolutionIndex: 613
    SolutionNameMin: Cijk_Ailk_Bjlk_HBH_MT256x256x16_MI32x32x8x1_SE_AF0EM8_EPS1_GRVW4_GSU1_PGR1_SU32_SUS256_SRVW4_TT4_128_VAW2_WG64_4_1_WGM1
    SolutionIndex: 614
    SolutionNameMin: Cijk_Ailk_Bjlk_HBH_MT256x128x32_MI32x32x8x1_SE_AF0EM8_EPS1_GRVW8_GSU2_PGR1_SU32_SUS256_SRVW0_TT4_64_VAW1_WG64_4_1_WGM15
    SolutionIndex: 615
    SolutionNameMin: Cijk_Ailk_Bjlk_HBH_MT256x192x32_MI32x32x8x1_SE_AF0EM8_EPS1_GRVW8_GSU1_PGR1_SU0_SUS256_SRVW4_TT4_96_VAW2_WG64_4_1_WGM1
    SolutionIndex: 616
    SolutionNameMin: Cijk_Ailk_Bjlk_HBH_MT128x128x16_MI32x32x8x1_SE_AF0EM8_EPS0_GRVW8_GSU1_PGR2_SU32_SUS128_SRVW4_TT2_64_VAW2_WG64_4_1_WGM2
    SolutionIndex: 617
    SolutionNameMin: Cijk_Ailk_Bjlk_HBH_MT128x96x32_MI32x32x8x1_SE_AF0EM8_EPS0_GRVW4_GSU1_PGR2_SU0_SUS256_SRVW4_TT1_96_VAW2_WG128_2_1_WGM1
    SolutionIndex: 618
    SolutionNameMin: Cijk_Ailk_Bjlk_HBH_MT128x192x16_MI32x32x8x1_SE_AF0EM8_EPS0_GRVW4_GSU1_PGR2_SU0_SUS256_SRVW4_TT2_96_VAW2_WG64_4_1_WGM1
    SolutionIndex: 619
    SolutionNameMin: Cijk_Ailk_Bjlk_HBH_MT256x256x32_MI32x32x8x1_SE_AF0EM8_EPS1_GRVW8_GSU1_PGR1_SU0_SUS256_SRVW4_TT4_128_VAW2_WG64_4_1_WGM15
    SolutionIndex: 620
    SolutionNameMin: Cijk_Ailk_Bjlk_HBH_MT256x256x16_MI32x32x8x1_SE_AF0EM8_EPS1_GRVW4_GSU1_PGR1_SU0_SUS256_SRVW4_TT4_128_VAW2_WG64_4_1_WGM1
    SolutionIndex: 621
    SolutionNameMin: Cijk_Ailk_Bjlk_HBH_MT128x128x32_MI32x32x8x1_SE_AF0EM8_EPS0_GRVW2_GSU1_PGR2_SU0_SUS256_SRVW4_TT2_64_VAW2_WG64_4_1_WGM15
    SolutionIndex: 622
    SolutionNameMin: Cijk_Ailk_Bjlk_HBH_MT256x192x32_MI32x32x8x1_SE_AF0EM8_EPS1_GRVW8_GSU1_PGR1_SU32_SUS256_SRVW4_TT4_96_VAW2_WG64_4_1_WGM15
    SolutionIndex: 623
    SolutionNameMin: Cijk_Ailk_Bjlk_HBH_MT96x128x32_MI32x32x8x1_SE_AF0EM8_EPS0_GRVW4_GSU1_PGR2_SU32_SUS256_SRVW0_TT3_32_VAW2_WG32_8_1_WGM1
    SolutionIndex: 624
    SolutionNameMin: Cijk_Ailk_Bjlk_HBH_MT128x96x32_MI32x32x8x1_SE_AF0EM8_EPS0_GRVW2_GSU1_PGR2_SU0_SUS256_SRVW4_TT1_96_VAW2_WG128_2_1_WGM2
    SolutionIndex: 625
    SolutionNameMin: Cijk_Ailk_Bjlk_HBH_MT128x128x32_MI32x32x8x1_SE_AF0EM8_EPS0_GRVW8_GSU1_PGR2_SU0_SUS256_SRVW4_TT2_64_VAW2_WG64_4_1_WGM15
    SolutionIndex: 626
    SolutionNameMin: Cijk_Ailk_Bjlk_HBH_MT128x96x16_MI32x32x8x1_SE_AF0EM8_EPS0_GRVW2_GSU1_PGR2_SU0_SUS256_SRVW4_TT1_96_VAW2_WG128_2_1_WGM2
    SolutionIndex: 627
    SolutionNameMin: Cijk_Ailk_Bjlk_HBH_MT256x192x32_MI32x32x8x1_SE_AF0EM8_EPS1_GRVW8_GSU1_PGR1_SU32_SUS256_SRVW4_TT4_96_VAW2_WG64_4_1_WGM2
    SolutionIndex: 628
    SolutionNameMin: Cijk_Ailk_Bjlk_HBH_MT192x192x32_MI32x32x8x1_SE_AF0EM8_EPS1_GRVW4_GSU3_PGR1_SU0_SUS256_SRVW0_TT3_96_VAW1_WG64_4_1_WGM1
    SolutionIndex: 629
    SolutionNameMin: Cijk_Ailk_Bjlk_HBH_MT192x192x32_MI32x32x8x1_SE_AF0EM8_EPS1_GRVW8_GSU1_PGR1_SU32_SUS128_SRVW0_TT3_96_VAW2_WG64_4_1_WGM1
    SolutionIndex: 630
    SolutionNameMin: Cijk_Ailk_Bjlk_HBH_MT128x128x32_MI32x32x8x1_SE_AF0EM8_EPS0_GRVW8_GSU1_PGR2_SU32_SUS128_SRVW4_TT2_64_VAW2_WG64_4_1_WGM15
    SolutionIndex: 631
    SolutionNameMin: Cijk_Ailk_Bjlk_HBH_MT128x96x16_MI32x32x8x1_SE_AF0EM8_EPS0_GRVW2_GSU1_PGR2_SU0_SUS256_SRVW4_TT1_96_VAW2_WG128_2_1_WGM1
    SolutionIndex: 632
    SolutionNameMin: Cijk_Ailk_Bjlk_HBH_MT96x128x64_MI32x32x8x1_SE_AF0EM8_EPS0_GRVW8_GSU1_PGR2_SU0_SUS256_SRVW0_TT3_32_VAW2_WG32_8_1_WGM1
    SolutionIndex: 633
    SolutionNameMin: Cijk_Ailk_Bjlk_HBH_MT128x288x32_MI32x32x8x1_SE_AF0EM8_EPS0_GRVW4_GSU1_PGR2_SU32_SUS128_SRVW4_TT1_288_VAW2_WG128_2_1_WGM1
    SolutionIndex: 634
    SolutionNameMin: Cijk_Ailk_Bjlk_HBH_MT128x256x16_MI32x32x8x1_SE_AF0EM8_EPS0_GRVW8_GSU1_PGR2_SU0_SUS256_SRVW4_TT2_128_VAW2_WG64_4_1_WGM2
    SolutionIndex: 635
    SolutionNameMin: Cijk_Ailk_Bjlk_HBH_MT256x192x32_MI32x32x8x1_SE_AF0EM8_EPS1_GRVW8_GSU1_PGR1_SU32_SUS128_SRVW4_TT4_96_VAW2_WG64_4_1_WGM2
    SolutionIndex: 636
    SolutionNameMin: Cijk_Ailk_Bjlk_HBH_MT96x128x64_MI32x32x8x1_SE_AF0EM8_EPS0_GRVW4_GSU1_PGR2_SU0_SUS256_SRVW0_TT3_32_VAW2_WG32_8_1_WGM1
    SolutionIndex: 637
    SolutionNameMin: Cijk_Ailk_Bjlk_HBH_MT192x192x32_MI32x32x8x1_SE_AF0EM8_EPS1_GRVW8_GSU1_PGR1_SU32_SUS256_SRVW0_TT3_96_VAW2_WG64_4_1_WGM1
    SolutionIndex: 638
    SolutionNameMin: Cijk_Ailk_Bjlk_HBH_MT128x160x32_MI32x32x8x1_SE_AF0EM8_EPS0_GRVW4_GSU1_PGR2_SU0_SUS256_SRVW4_TT1_160_VAW2_WG128_2_1_WGM15
    SolutionIndex: 639
    SolutionNameMin: Cijk_Ailk_Bjlk_HBH_MT128x96x32_MI32x32x8x1_SE_AF0EM8_EPS0_GRVW4_GSU1_PGR2_SU0_SUS256_SRVW4_TT1_96_VAW2_WG128_2_1_WGM2
    SolutionIndex: 640
    SolutionNameMin: Cijk_Ailk_Bjlk_HBH_MT256x160x32_MI32x32x8x1_SE_AF0EM8_EPS1_GRVW4_GSU1_PGR1_SU0_SUS256_SRVW4_TT2_160_VAW2_WG128_2_1_WGM15
    SolutionIndex: 641
    SolutionNameMin: Cijk_Ailk_Bjlk_HBH_MT256x160x32_MI32x32x8x1_SE_AF0EM8_EPS1_GRVW4_GSU1_PGR1_SU0_SUS256_SRVW4_TT2_160_VAW2_WG128_2_1_WGM2
    SolutionIndex: 642
    SolutionNameMin: Cijk_Ailk_Bjlk_HBH_MT128x160x32_MI32x32x8x1_SE_AF0EM8_EPS0_GRVW4_GSU2_PGR2_SU32_SUS128_SRVW4_TT1_160_VAW1_WG128_2_1_WGM15
    SolutionIndex: 643
    SolutionNameMin: Cijk_Ailk_Bjlk_HBH_MT128x256x32_MI32x32x8x1_SE_AF0EM8_EPS1_GRVW8_GSU1_PGR1_SU32_SUS128_SRVW4_TT2_128_VAW2_WG64_4_1_WGM15
    SolutionIndex: 644
    SolutionNameMin: Cijk_Ailk_Bjlk_HBH_MT128x96x16_MI32x32x8x1_SE_AF0EM8_EPS0_GRVW2_GSU1_PGR2_SU32_SUS256_SRVW4_TT1_96_VAW2_WG128_2_1_WGM2
    SolutionIndex: 645
    SolutionNameMin: Cijk_Ailk_Bjlk_HBH_MT128x256x16_MI32x32x8x1_SE_AF0EM8_EPS0_GRVW4_GSU1_PGR2_SU0_SUS256_SRVW4_TT2_128_VAW2_WG64_4_1_WGM15
    SolutionIndex: 646
    SolutionNameMin: Cijk_Ailk_Bjlk_HBH_MT128x256x32_MI32x32x8x1_SE_AF0EM8_EPS1_GRVW8_GSU3_PGR1_SU32_SUS128_SRVW4_TT2_128_VAW1_WG64_4_1_WGM1
    SolutionIndex: 647
    SolutionNameMin: Cijk_Ailk_Bjlk_HBH_MT16x16x16_MI16x16x16x1_SE_AF0EM1_EPS1_GRVW2_GSU1_PGR1_SU0_SUS256_SRVW0_TT1_16_VAW2_WG16_4_1_WGM1
    SolutionIndex: 648
    SolutionNameMin: Cijk_Ailk_Bjlk_HBH_MT256x144x32_MI16x16x16x1_SE_AF0EM8_EPS0_GRVW2_GSU1_PGR2_SU0_SUS256_SRVW4_TT4_144_VAW2_WG64_4_1_WGM15
    SolutionIndex: 649
    SolutionNameMin: Cijk_Ailk_Bjlk_HBH_MT128x96x16_MI32x32x8x1_SE_AF0EM8_EPS1_GRVW2_GSU1_PGR1_SU32_SUS256_SRVW4_TT1_96_VAW2_WG128_2_1_WGM2
    SolutionIndex: 650
    SolutionNameMin: Cijk_Ailk_Bjlk_HBH_MT128x256x16_MI32x32x8x1_SE_AF0EM8_EPS0_GRVW4_GSU1_PGR2_SU32_SUS128_SRVW4_TT2_128_VAW2_WG64_4_1_WGM2
    SolutionIndex: 651
    SolutionNameMin: Cijk_Ailk_Bjlk_HBH_MT128x256x16_MI32x32x8x1_SE_AF0EM8_EPS0_GRVW8_GSU1_PGR2_SU32_SUS128_SRVW4_TT2_128_VAW2_WG64_4_1_WGM2
    SolutionIndex: 652
    SolutionNameMin: Cijk_Ailk_Bjlk_HBH_MT128x256x16_MI32x32x8x1_SE_AF0EM8_EPS0_GRVW8_GSU1_PGR2_SU0_SUS256_SRVW4_TT2_128_VAW2_WG64_4_1_WGM2
    SolutionIndex: 653
    SolutionNameMin: Cijk_Ailk_Bjlk_HBH_MT128x256x16_MI32x32x8x1_SE_AF0EM8_EPS0_GRVW8_GSU1_PGR2_SU32_SUS128_SRVW4_TT2_128_VAW2_WG64_4_1_WGM2
    SolutionIndex: 654
    SolutionNameMin: Cijk_Ailk_Bjlk_HBH_MT128x256x16_MI32x32x8x1_SE_AF0EM8_EPS0_GRVW8_GSU1_PGR2_SU32_SUS256_SRVW4_TT2_128_VAW2_WG64_4_1_WGM2
    SolutionIndex: 655
    SolutionNameMin: Cijk_Ailk_Bjlk_HBH_MT128x256x16_MI32x32x8x1_SE_AF0EM8_EPS0_GRVW4_GSU1_PGR2_SU32_SUS256_SRVW4_TT2_128_VAW2_WG64_4_1_WGM2
    SolutionIndex: 656
    SolutionNameMin: Cijk_Ailk_Bjlk_HBH_MT128x256x16_MI32x32x8x1_SE_AF0EM8_EPS0_GRVW8_GSU1_PGR2_SU32_SUS256_SRVW4_TT2_128_VAW2_WG64_4_1_WGM2
    SolutionIndex: 657
    SolutionNameMin: Cijk_Ailk_Bjlk_HBH_MT128x256x16_MI32x32x8x1_SE_AF0EM8_EPS0_GRVW4_GSU1_PGR2_SU0_SUS256_SRVW4_TT2_128_VAW2_WG64_4_1_WGM2
    SolutionIndex: 658
    SolutionNameMin: Cijk_Ailk_Bjlk_HBH_MT128x288x32_MI32x32x8x1_SE_AF0EM8_EPS0_GRVW2_GSU1_PGR2_SU32_SUS128_SRVW4_TT1_288_VAW2_WG128_2_1_WGM15
    SolutionIndex: 659
    SolutionNameMin: Cijk_Ailk_Bjlk_HBH_MT64x64x16_MI32x32x8x1_SE_AF0EM8_EPS0_GRVW4_GSU1_PGR2_SU32_SUS256_SRVW4_TT1_32_VAW2_WG64_4_1_WGM15
    SolutionIndex: 660
    SolutionNameMin: Cijk_Ailk_Bjlk_HBH_MT128x64x32_MI32x32x8x1_SE_AF0EM8_EPS1_GRVW8_GSU1_PGR1_SU0_SUS256_SRVW4_TT2_32_VAW2_WG64_4_1_WGM15
    SolutionIndex: 661
    SolutionNameMin: Cijk_Ailk_Bjlk_HBH_MT64x128x16_MI32x32x8x1_SE_AF0EM8_EPS1_GRVW2_GSU1_PGR1_SU0_SUS256_SRVW4_TT1_64_VAW2_WG64_4_1_WGM2
    SolutionIndex: 662
    SolutionNameMin: Cijk_Ailk_Bjlk_HBH_MT64x64x16_MI32x32x8x1_SE_AF0EM8_EPS0_GRVW2_GSU1_PGR2_SU0_SUS256_SRVW4_TT1_32_VAW2_WG64_4_1_WGM2
    SolutionIndex: 663
    SolutionNameMin: Cijk_Ailk_Bjlk_HBH_MT32x32x32_MI16x16x16x1_SE_AF0EM8_EPS1_GRVW2_GSU1_PGR1_SU0_SUS256_SRVW4_TT1_16_VAW2_WG32_8_1_WGM1
    SolutionIndex: 664
    SolutionNameMin: Cijk_Ailk_Bjlk_HBH_MT128x256x16_MI32x32x8x1_SE_AF0EM8_EPS0_GRVW2_GSU1_PGR2_SU0_SUS256_SRVW4_TT2_128_VAW2_WG64_4_1_WGM2
    SolutionIndex: 665
    SolutionNameMin: Cijk_Ailk_Bjlk_HBH_MT128x256x16_MI32x32x8x1_SE_AF0EM8_EPS0_GRVW8_GSU1_PGR2_SU0_SUS256_SRVW4_TT2_128_VAW2_WG64_4_1_WGM15
    SolutionIndex: 666
    SolutionNameMin: Cijk_Ailk_Bjlk_HBH_MT128x64x16_MI32x32x8x1_SE_AF0EM8_EPS0_GRVW2_GSU1_PGR2_SU0_SUS256_SRVW4_TT2_32_VAW2_WG64_4_1_WGM15
    SolutionIndex: 667
    SolutionNameMin: Cijk_Ailk_Bjlk_HBH_MT128x256x16_MI32x32x8x1_SE_AF0EM8_EPS0_GRVW4_GSU1_PGR2_SU0_SUS256_SRVW4_TT2_128_VAW2_WG64_4_1_WGM1
    SolutionIndex: 668
    SolutionNameMin: Cijk_Ailk_Bjlk_HBH_MT128x256x16_MI32x32x8x1_SE_AF0EM8_EPS1_GRVW4_GSU1_PGR1_SU32_SUS256_SRVW4_TT2_128_VAW2_WG64_4_1_WGM1
    SolutionIndex: 669
    SolutionNameMin: Cijk_Ailk_Bjlk_HBH_MT128x256x16_MI32x32x8x1_SE_AF0EM8_EPS0_GRVW4_GSU1_PGR2_SU32_SUS128_SRVW4_TT2_128_VAW2_WG64_4_1_WGM15
    SolutionIndex: 670
    SolutionNameMin: Cijk_Ailk_Bjlk_HBH_MT128x256x16_MI32x32x8x1_SE_AF0EM8_EPS0_GRVW8_GSU1_PGR2_SU32_SUS128_SRVW4_TT2_128_VAW2_WG64_4_1_WGM15
    SolutionIndex: 671
    SolutionNameMin: Cijk_Ailk_Bjlk_HBH_MT128x96x16_MI32x32x8x1_SE_AF0EM8_EPS1_GRVW2_GSU1_PGR1_SU32_SUS128_SRVW4_TT1_96_VAW2_WG128_2_1_WGM2
    SolutionIndex: 672
    SolutionNameMin: Cijk_Ailk_Bjlk_HBH_MT128x96x16_MI32x32x8x1_SE_AF0EM8_EPS0_GRVW2_GSU1_PGR2_SU32_SUS256_SRVW4_TT1_96_VAW2_WG128_2_1_WGM15
    SolutionIndex: 673
    SolutionNameMin: Cijk_Ailk_Bjlk_HBH_MT128x96x16_MI32x32x8x1_SE_AF0EM8_EPS1_GRVW2_GSU1_PGR1_SU32_SUS128_SRVW4_TT1_96_VAW2_WG128_2_1_WGM15
    SolutionIndex: 674
    SolutionNameMin: Cijk_Ailk_Bjlk_HBH_MT128x96x16_MI32x32x8x1_SE_AF0EM8_EPS0_GRVW2_GSU1_PGR2_SU32_SUS128_SRVW4_TT1_96_VAW2_WG128_2_1_WGM1
    SolutionIndex: 675
    SolutionNameMin: Cijk_Ailk_Bjlk_HBH_MT128x96x16_MI32x32x8x1_SE_AF0EM8_EPS0_GRVW2_GSU1_PGR2_SU32_SUS256_SRVW4_TT1_96_VAW2_WG128_2_1_WGM1
    SolutionIndex: 676
    SolutionNameMin: Cijk_Ailk_Bjlk_HBH_MT128x128x16_MI32x32x8x1_SE_AF0EM8_EPS0_GRVW2_GSU1_PGR2_SU0_SUS256_SRVW4_TT2_64_VAW2_WG64_4_1_WGM1
    SolutionIndex: 677
    SolutionNameMin: Cijk_Ailk_Bjlk_HBH_MT128x96x16_MI32x32x8x1_SE_AF0EM8_EPS0_GRVW2_GSU1_PGR2_SU0_SUS256_SRVW4_TT1_96_VAW2_WG128_2_1_WGM15
    SolutionIndex: 678
    SolutionNameMin: Cijk_Ailk_Bjlk_HBH_MT128x96x16_MI32x32x8x1_SE_AF0EM8_EPS0_GRVW2_GSU1_PGR2_SU32_SUS128_SRVW4_TT1_96_VAW2_WG128_2_1_WGM15
    SolutionIndex: 679
    SolutionNameMin: Cijk_Ailk_Bjlk_HBH_MT128x256x16_MI32x32x8x1_SE_AF0EM8_EPS0_GRVW8_GSU1_PGR2_SU32_SUS256_SRVW4_TT2_128_VAW2_WG64_4_1_WGM15
    SolutionIndex: 680
    SolutionNameMin: Cijk_Ailk_Bjlk_HBH_MT128x256x16_MI32x32x8x1_SE_AF0EM8_EPS0_GRVW8_GSU1_PGR2_SU32_SUS256_SRVW4_TT2_128_VAW2_WG64_4_1_WGM15
    SolutionIndex: 681
    SolutionNameMin: Cijk_Ailk_Bjlk_HBH_MT128x256x16_MI32x32x8x1_SE_AF0EM8_EPS0_GRVW8_GSU1_PGR2_SU0_SUS256_SRVW4_TT2_128_VAW2_WG64_4_1_WGM15
    SolutionIndex: 682
    SolutionNameMin: Cijk_Ailk_Bjlk_HBH_MT128x256x16_MI32x32x8x1_SE_AF0EM8_EPS0_GRVW4_GSU1_PGR2_SU32_SUS256_SRVW4_TT2_128_VAW2_WG64_4_1_WGM15
    SolutionIndex: 683
    SolutionNameMin: Cijk_Ailk_Bjlk_HBH_MT128x256x16_MI32x32x8x1_SE_AF0EM8_EPS0_GRVW8_GSU1_PGR2_SU0_SUS256_SRVW4_TT2_128_VAW2_WG64_4_1_WGM1
    SolutionIndex: 684
    SolutionNameMin: Cijk_Ailk_Bjlk_HBH_MT64x256x16_MI32x32x8x1_SE_AF0EM8_EPS0_GRVW2_GSU1_PGR2_SU32_SUS128_SRVW4_TT1_128_VAW2_WG64_4_1_WGM1
    SolutionIndex: 685
    SolutionNameMin: Cijk_Ailk_Bjlk_HBH_MT256x128x32_MI32x32x8x1_SE_AF0EM8_EPS1_GRVW8_GSU1_PGR1_SU0_SUS256_SRVW4_TT4_64_VAW2_WG64_4_1_WGM15
    SolutionIndex: 686
    SolutionNameMin: Cijk_Ailk_Bjlk_HBH_MT256x160x32_MI32x32x8x1_SE_AF0EM8_EPS0_GRVW4_GSU1_PGR2_SU0_SUS256_SRVW4_TT2_160_VAW2_WG128_2_1_WGM15
    SolutionIndex: 687
    SolutionNameMin: Cijk_Ailk_Bjlk_HBH_MT128x128x16_MI32x32x8x1_SE_AF0EM8_EPS0_GRVW8_GSU1_PGR2_SU0_SUS256_SRVW4_TT2_64_VAW2_WG64_4_1_WGM1
    SolutionIndex: 688
    SolutionNameMin: Cijk_Ailk_Bjlk_HBH_MT128x128x16_MI32x32x8x1_SE_AF0EM8_EPS0_GRVW8_GSU1_PGR2_SU0_SUS256_SRVW4_TT2_64_VAW2_WG64_4_1_WGM15
- - - [64, 448, 1, 3328]
    - [45, 5.513]
  - - [1, 64, 1, 256]
    - [1, 0.0]
  - - [3584, 64, 1, 1280]
    - [106, 12.78]
  - - [64, 128, 1, 256]
    - [39, 0.269]
  - - [64, 5888, 1, 1280]
    - [61, 18.202]
  - - [64, 4288, 1, 1280]
    - [61, 13.418]
  - - [3584, 64, 1, 3328]
    - [107, 19.36]
  - - [64, 1024, 1, 3328]
    - [50, 10.8]
  - - [1, 64, 1, 1280]
    - [3, 0.001]
  - - [704, 64, 1, 3328]
    - [80, 7.544]
  - - [64, 448, 1, 1280]
    - [42, 2.793]
  - - [64, 704, 1, 3328]
    - [48, 6.527]
  - - [64, 64, 1, 1280]
    - [37, 0.353]
  - - [64, 5056, 1, 256]
    - [36, 8.075]
  - - [64, 4288, 1, 3328]
    - [62, 22.029]
  - - [1856, 64, 1, 3328]
    - [93, 14.34]
  - - [1, 64, 1, 1]
    - [0, 0.0]
  - - [448, 64, 1, 1280]
    - [74, 2.704]
  - - [5888, 64, 1, 1280]
    - [113, 18.5]
  - - [2944, 64, 1, 256]
    - [44, 5.438]
  - - [64, 1856, 1, 256]
    - [36, 3.898]
  - - [64, 1024, 1, 1280]
    - [49, 5.34]
  - - [64, 256, 1, 1280]
    - [42, 1.636]
  - - [704, 64, 1, 1280]
    - [79, 4.217]
  - - [64, 128, 1, 1280]
    - [40, 0.749]
  - - [2368, 64, 1, 256]
    - [46, 4.539]
  - - [2368, 64, 1, 3328]
    - [90, 16.389]
  - - [64, 1408, 1, 3328]
    - [52, 13.301]
  - - [1856, 64, 1, 1280]
    - [92, 7.187]
  - - [64, 3584, 1, 1280]
    - [36, 12.49]
  - - [448, 64, 1, 3328]
    - [43, 5.479]
  - - [5888, 64, 1, 3328]
    - [118, 25.349]
  - - [128, 64, 1, 256]
    - [70, 0.234]
  - - [64, 128, 1, 3328]
    - [38, 1.636]
  - - [64, 256, 1, 3328]
    - [43, 3.424]
  - - [4288, 64, 1, 3328]
    - [114, 21.748]
  - - [64, 2944, 1, 256]
    - [46, 5.505]
  - - [6784, 64, 1, 256]
    - [119, 11.956]
  - - [1024, 64, 1, 1280]
    - [83, 5.234]
  - - [64, 2368, 1, 1280]
    - [55, 8.813]
  - - [64, 3584, 1, 3328]
    - [59, 19.9]
  - - [64, 6784, 1, 3328]
    - [69, 28.113]
  - - [3584, 64, 1, 256]
    - [105, 6.701]
  - - [64, 1856, 1, 3328]
    - [54, 15.544]
  - - [448, 64, 1, 256]
    - [36, 0.808]
  - - [64, 5056, 1, 3328]
    - [64, 26.875]
  - - [256, 64, 1, 256]
    - [36, 0.467]
  - - [4288, 64, 1, 1280]
    - [113, 13.529]
  - - [1, 1, 1, 1]
    - [2, 0.0]
  - - [5056, 64, 1, 1280]
    - [68, 15.886]
  - - [1024, 64, 1, 3328]
    - [84, 10.8]
  - - [1408, 64, 1, 256]
    - [46, 2.665]
  - - [64, 1408, 1, 256]
    - [46, 2.601]
  - - [64, 2368, 1, 3328]
    - [53, 16.22]
  - - [64, 448, 1, 256]
    - [44, 0.818]
  - - [64, 6784, 1, 1280]
    - [68, 22.912]
  - - [64, 1856, 1, 1280]
    - [53, 8.225]
  - - [64, 6784, 1, 256]
    - [67, 12.095]
  - - [64, 5056, 1, 1280]
    - [63, 15.886]
  - - [64, 4288, 1, 256]
    - [60, 6.994]
  - - [128, 64, 1, 1280]
    - [71, 0.761]
  - - [5888, 64, 1, 256]
    - [117, 9.213]
  - - [64, 5888, 1, 3328]
    - [66, 25.851]
  - - [64, 1024, 1, 256]
    - [46, 1.892]
  - - [5056, 64, 1, 3328]
    - [116, 24.641]
  - - [256, 64, 1, 1280]
    - [37, 1.454]
  - - [64, 256, 1, 256]
    - [41, 0.478]
  - - [704, 64, 1, 256]
    - [46, 1.285]
  - - [64, 1408, 1, 1280]
    - [51, 7.055]
  - - [1, 1, 1, 256]
    - [1, 0.0]
  - - [64, 704, 1, 256]
    - [46, 1.27]
  - - [64, 2944, 1, 3328]
    - [57, 19.431]
  - - [64, 64, 1, 256]
    - [36, 0.097]
  - - [1856, 64, 1, 256]
    - [36, 3.846]
  - - [128, 64, 1, 3328]
    - [72, 1.615]
  - - [2944, 64, 1, 1280]
    - [102, 10.259]
  - - [4288, 64, 1, 256]
    - [102, 6.921]
  - - [1, 1, 1, 1280]
    - [3, 0.0]
  - - [64, 2944, 1, 1280]
    - [56, 10.354]
  - - [1408, 64, 1, 1280]
    - [52, 5.931]
  - - [6784, 64, 1, 3328]
    - [120, 27.154]
  - - [1024, 64, 1, 256]
    - [46, 1.915]
  - - [64, 2368, 1, 256]
    - [44, 4.539]
  - - [64, 3584, 1, 256]
    - [58, 6.621]
  - - [2944, 64, 1, 3328]
    - [103, 20.736]
  - - [2368, 64, 1, 1280]
    - [99, 8.855]
  - - [256, 64, 1, 3328]
    - [73, 3.15]
  - - [64, 64, 1, 3328]
    - [38, 0.729]
  - - [1, 1, 1, 3328]
    - [3, 0.0]
  - - [64, 5888, 1, 256]
    - [65, 9.028]
  - - [64, 704, 1, 1280]
    - [47, 3.482]
  - - [6784, 64, 1, 1280]
    - [119, 23.116]
  - - [5056, 64, 1, 256]
    - [115, 8.075]
  - - [1408, 64, 1, 3328]
    - [90, 12.993]
  - - [4096, 7133, 1, 4096]
    - [112, 85.839]
  - - [512, 16, 1, 512]
    - [76, 0.381]
  - - [2048, 7133, 1, 2048]
    - [98, 81.297]
  - - [2560, 7133, 1, 2560]
    - [101, 82.466]
  - - [1024, 1024, 1, 1024]
    - [144, 37.079]
  - - [3072, 7435, 1, 1024]
    - [104, 78.763]
  - - [1024, 32, 1, 512]
    - [36, 1.414]
  - - [1760, 7133, 1, 1760]
    - [91, 72.401]
  - - [7680, 5481, 1, 2560]
    - [89, 85.887]
  - - [1024, 16, 1, 512]
    - [82, 0.762]
  - - [512, 32, 1, 512]
    - [46, 0.671]
  - - [3136, 256, 64, 64]
    - [365, 32.056]
  - - [784, 512, 64, 128]
    - [210, 46.346]
  - - [784, 128, 64, 512]
    - [224, 50.698]
  - - [3136, 64, 128, 64]
    - [263, 21.61]
  - - [196, 256, 128, 1024]
    - [547, 46.626]
  - - [196, 256, 64, 1024]
    - [521, 38.419]
  - - [196, 1024, 128, 256]
    - [517, 38.086]
  - - [784, 128, 256, 512]
    - [362, 55.447]
  - - [3136, 64, 64, 256]
    - [322, 31.66]
  - - [3136, 64, 256, 256]
    - [393, 33.623]
  - - [3136, 256, 256, 64]
    - [363, 34.335]
  - - [3136, 64, 128, 256]
    - [392, 33.34]
  - - [784, 128, 128, 512]
    - [312, 53.472]
  - - [784, 512, 128, 128]
    - [395, 50.823]
  - - [784, 512, 256, 128]
    - [210, 53.87]
  - - [196, 1024, 64, 256]
    - [513, 35.089]
  - - [3136, 64, 64, 64]
    - [367, 19.931]
  - - [196, 1024, 256, 256]
    - [521, 39.708]
  - - [196, 256, 256, 1024]
    - [512, 51.916]
  - - [3136, 256, 128, 64]
    - [363, 33.54]
  - - [3136, 64, 256, 64]
    - [394, 22.611]
  - - [14, 64, 1, 14]
    - [123, 0.001]
  - - [15, 64, 1, 14]
    - [123, 0.001]
  - - [15, 64, 1, 15]
    - [123, 0.001]
  - - [15, 64, 1, 15]
    - [4, 0.001]
  - - [17, 64, 1, 15]
    - [123, 0.001]
  - - [17, 64, 1, 17]
    - [128, 0.002]
  - - [17, 64, 1, 17]
    - [4, 0.002]
  - - [21, 64, 1, 17]
    - [123, 0.002]
  - - [21, 64, 1, 21]
    - [123, 0.003]
  - - [24, 64, 1, 24]
    - [7, 0.004]
  - - [30, 64, 1, 30]
    - [123, 0.006]
  - - [30, 64, 1, 31]
    - [123, 0.006]
  - - [31, 64, 1, 31]
    - [136, 0.007]
  - - [32, 64, 1, 32]
    - [7, 0.011]
  - - [32, 64, 1, 35]
    - [10, 0.008]
  - - [34, 64, 1, 24]
    - [139, 0.006]
  - - [34, 64, 1, 34]
    - [123, 0.007]
  - - [35, 64, 1, 35]
    - [142, 0.008]
  - - [64, 14, 1, 14]
    - [12, 0.001]
  - - [64, 15, 1, 14]
    - [12, 0.001]
  - - [64, 15, 1, 15]
    - [14, 0.002]
  - - [64, 15, 1, 15]
    - [5, 0.001]
  - - [64, 17, 1, 15]
    - [10, 0.002]
  - - [64, 17, 1, 17]
    - [10, 0.002]
  - - [64, 17, 1, 17]
    - [6, 0.002]
  - - [64, 21, 1, 17]
    - [18, 0.003]
  - - [64, 21, 1, 21]
    - [10, 0.003]
  - - [64, 24, 1, 24]
    - [21, 0.004]
  - - [64, 30, 1, 30]
    - [25, 0.007]
  - - [64, 30, 1, 31]
    - [21, 0.007]
  - - [64, 31, 1, 31]
    - [10, 0.007]
  - - [64, 32, 1, 32]
    - [7, 0.011]
  - - [64, 32, 1, 35]
    - [30, 0.008]
  - - [64, 34, 1, 24]
    - [21, 0.006]
  - - [64, 34, 1, 34]
    - [10, 0.008]
  - - [64, 35, 1, 35]
    - [21, 0.009]
  - - [64, 128, 512, 128]
    - [202, 18.608]
  - - [64, 512, 1, 512]
    - [220, 1.707]
  - - [64, 512, 64, 512]
    - [170, 28.958]
  - - [128, 64, 512, 128]
    - [34, 18.27]
  - - [512, 64, 1, 512]
    - [219, 1.688]
  - - [512, 64, 64, 512]
    - [207, 29.729]
  - - [1024, 2, 1, 4]
    - [171, 0.001]
  - - [1024, 2, 1, 32]
    - [203, 0.013]
  - - [1024, 2, 1, 2048]
    - [172, 0.344]
  - - [1024, 1024, 1, 4]
    - [35, 0.654]
  - - [1024, 1024, 1, 32]
    - [204, 5.414]
  - - [1024, 1024, 1, 2048]
    - [173, 43.879]
  - - [1024, 1024, 1, 4096]
    - [173, 50.117]
  - - [1024, 4096, 1, 2048]
    - [167, 76.125]
  - - [1024, 4096, 1, 4096]
    - [167, 80.227]
  - - [1024, 30528, 1, 2048]
    - [160, 87.313]
  - - [1024, 30528, 1, 4096]
    - [205, 91.346]
  - - [4096, 1024, 1, 2048]
    - [161, 70.764]
  - - [4096, 1024, 1, 4096]
    - [206, 76.487]
  - - [3, 64, 512, 3]
    - [302, 0.045]
  - - [5, 64, 512, 5]
    - [302, 0.118]
  - - [5, 64, 960, 5]
    - [122, 0.163]
  - - [9, 64, 512, 9]
    - [302, 0.355]
  - - [13, 512, 1, 32768]
    - [492, 6.521]
  - - [27, 128, 32768, 27]
    - [496, 5.307]
  - - [33, 32, 200, 33]
    - [497, 0.893]
  - - [33, 32, 1600, 33]
    - [498, 2.718]
  - - [67, 2048, 1, 512]
    - [499, 5.434]
  - - [74, 2048, 1, 512]
    - [494, 5.952]
  - - [74, 2048, 1, 960]
    - [500, 8.009]
  - - [100, 2048, 1, 512]
    - [501, 7.111]
  - - [256, 128, 1, 32768]
    - [197, 26.305]
  - - [256, 1280, 1, 8976]
    - [229, 45.952]
  - - [256, 2560, 1, 8976]
    - [230, 58.378]
  - - [256, 2816, 1, 8976]
    - [231, 59.896]
  - - [256, 3328, 1, 8976]
    - [232, 60.393]
  - - [256, 3584, 1, 8976]
    - [233, 64.549]
  - - [256, 3840, 1, 8976]
    - [234, 69.685]
  - - [256, 4096, 1, 8976]
    - [166, 58.839]
  - - [256, 4352, 1, 8976]
    - [177, 64.32]
  - - [256, 4864, 1, 8976]
    - [235, 69.361]
  - - [256, 5120, 1, 8976]
    - [236, 72.008]
  - - [256, 5632, 1, 8976]
    - [237, 71.749]
  - - [256, 5888, 1, 8976]
    - [238, 66.535]
  - - [256, 6144, 1, 8976]
    - [238, 68.885]
  - - [256, 7168, 1, 8976]
    - [239, 75.523]
  - - [256, 8192, 1, 8976]
    - [240, 70.748]
  - - [256, 8960, 1, 8976]
    - [241, 77.009]
  - - [256, 9728, 1, 8976]
    - [242, 73.894]
  - - [256, 9984, 1, 8976]
    - [243, 76.269]
  - - [256, 10240, 1, 8976]
    - [242, 77.673]
  - - [256, 10496, 1, 8976]
    - [244, 79.671]
  - - [256, 11008, 1, 8976]
    - [242, 83.322]
  - - [256, 11264, 1, 8976]
    - [242, 85.229]
  - - [256, 11520, 1, 8976]
    - [242, 89.239]
  - - [256, 11776, 1, 8976]
    - [245, 69.646]
  - - [256, 12544, 1, 8976]
    - [246, 73.863]
  - - [256, 12800, 1, 8976]
    - [246, 75.329]
  - - [256, 13312, 1, 8976]
    - [247, 80.095]
  - - [256, 13568, 1, 8976]
    - [246, 81.477]
  - - [256, 14336, 1, 8976]
    - [248, 86.136]
  - - [256, 14848, 1, 8976]
    - [249, 89.213]
  - - [256, 15104, 1, 8976]
    - [248, 90.574]
  - - [256, 15872, 1, 8976]
    - [250, 83.125]
  - - [256, 16128, 1, 8976]
    - [251, 84.672]
  - - [256, 17152, 1, 8976]
    - [251, 89.48]
  - - [256, 17408, 1, 8976]
    - [193, 82.165]
  - - [256, 18688, 1, 8976]
    - [252, 87.956]
  - - [256, 19968, 1, 8976]
    - [253, 81.463]
  - - [256, 20480, 1, 8976]
    - [254, 81.165]
  - - [256, 20992, 1, 8976]
    - [255, 83.363]
  - - [256, 21248, 1, 8976]
    - [256, 84.023]
  - - [256, 22016, 1, 8976]
    - [257, 86.917]
  - - [256, 26112, 1, 8976]
    - [258, 80.25]
  - - [256, 32512, 1, 8976]
    - [259, 86.485]
  - - [256, 32768, 1, 1]
    - [198, 0.467]
  - - [256, 33536, 1, 8976]
    - [259, 89.33]
  - - [256, 44505, 1, 8976]
    - [260, 90.176]
  - - [257, 4096, 1, 1024]
    - [502, 28.1]
  - - [480, 1024, 1, 32768]
    - [261, 71.775]
  - - [512, 32, 1, 200]
    - [221, 0.344]
  - - [512, 32, 1, 1600]
    - [225, 1.962]
  - - [512, 256, 1, 32768]
    - [199, 54.316]
  - - [512, 512, 1, 200]
    - [262, 5.392]
  - - [512, 512, 1, 1600]
    - [228, 17.761]
  - - [512, 2048, 1, 256]
    - [185, 20.424]
  - - [560, 1024, 1, 200]
    - [263, 10.031]
  - - [560, 1024, 1, 1600]
    - [226, 28.152]
  - - [768, 2048, 1, 256]
    - [264, 28.121]
  - - [1024, 64, 1, 512]
    - [223, 3.271]
  - - [1024, 64, 1, 960]
    - [265, 4.71]
  - - [1024, 256, 1, 1024]
    - [266, 13.434]
  - - [1024, 256, 1, 1280]
    - [267, 15.17]
  - - [1024, 256, 1, 2304]
    - [268, 22.609]
  - - [1024, 256, 1, 2816]
    - [269, 26.367]
  - - [1024, 256, 1, 3072]
    - [270, 27.707]
  - - [1024, 256, 1, 3328]
    - [271, 28.952]
  - - [1024, 256, 1, 3584]
    - [272, 30.215]
  - - [1024, 256, 1, 4096]
    - [272, 32.946]
  - - [1024, 256, 1, 4352]
    - [273, 33.574]
  - - [1024, 256, 1, 4608]
    - [274, 34.783]
  - - [1024, 256, 1, 5120]
    - [275, 36.513]
  - - [1024, 256, 1, 5376]
    - [276, 35.264]
  - - [1024, 256, 1, 5632]
    - [274, 36.075]
  - - [1024, 256, 1, 6144]
    - [277, 37.966]
  - - [1024, 256, 1, 6400]
    - [276, 42.093]
  - - [1024, 256, 1, 7680]
    - [278, 42.917]
  - - [1024, 256, 1, 7936]
    - [279, 44.047]
  - - [1024, 256, 1, 8192]
    - [280, 44.96]
  - - [1024, 256, 1, 8448]
    - [280, 46.364]
  - - [1024, 256, 1, 9728]
    - [275, 48.804]
  - - [1024, 256, 1, 9984]
    - [281, 47.932]
  - - [1024, 256, 1, 10496]
    - [280, 49.234]
  - - [1024, 256, 1, 11520]
    - [280, 50.02]
  - - [1024, 256, 1, 12032]
    - [280, 52.059]
  - - [1024, 256, 1, 13568]
    - [280, 52.336]
  - - [1024, 256, 1, 14336]
    - [281, 52.026]
  - - [1024, 256, 1, 14848]
    - [281, 52.487]
  - - [1024, 256, 1, 15104]
    - [282, 54.251]
  - - [1024, 256, 1, 15872]
    - [281, 55.153]
  - - [1024, 256, 1, 16128]
    - [283, 56.122]
  - - [1024, 256, 1, 17152]
    - [284, 57.093]
  - - [1024, 256, 1, 17408]
    - [285, 56.865]
  - - [1024, 256, 1, 18944]
    - [286, 58.828]
  - - [1024, 256, 1, 19712]
    - [281, 59.335]
  - - [1024, 256, 1, 19968]
    - [286, 59.377]
  - - [1024, 256, 1, 21248]
    - [287, 61.542]
  - - [1024, 256, 1, 21504]
    - [287, 61.629]
  - - [1024, 256, 1, 22016]
    - [286, 61.868]
  - - [1024, 256, 1, 28672]
    - [286, 67.895]
  - - [1024, 256, 1, 33536]
    - [286, 70.498]
  - - [1024, 512, 1, 32768]
    - [200, 74.883]
  - - [1024, 1024, 1, 200]
    - [157, 16.492]
  - - [1024, 1024, 1, 512]
    - [149, 25.765]
  - - [1024, 1024, 1, 960]
    - [158, 33.765]
  - - [1024, 1024, 1, 1600]
    - [173, 40.675]
  - - [1024, 1024, 1, 32768]
    - [201, 76.944]
  - - [1600, 1024, 1, 512]
    - [224, 33.984]
  - - [1600, 1024, 1, 960]
    - [288, 44.876]
  - - [2048, 256, 1, 1024]
    - [289, 23.699]
  - - [2048, 960, 1, 1]
    - [164, 0.307]
  - - [2048, 2048, 1, 512]
    - [222, 56.771]
  - - [2048, 2048, 1, 960]
    - [97, 67.049]
  - - [2048, 2048, 1, 1024]
    - [97, 66.989]
  - - [3200, 2048, 1, 1024]
    - [290, 68.938]
  - - [4096, 4096, 1, 1024]
    - [291, 75.694]
  - - [14, 64, 10880, 14]
    - [124, 1.875]
  - - [15, 64, 10880, 14]
    - [125, 1.941]
  - - [15, 64, 7680, 15]
    - [126, 1.986]
  - - [15, 64, 10880, 15]
    - [126, 2.068]
  - - [17, 64, 7680, 15]
    - [127, 1.939]
  - - [17, 64, 6144, 17]
    - [129, 1.843]
  - - [17, 64, 7680, 17]
    - [130, 1.975]
  - - [21, 64, 6144, 17]
    - [131, 2.227]
  - - [21, 64, 6144, 21]
    - [132, 2.669]
  - - [24, 64, 4736, 24]
    - [8, 4.095]
  - - [30, 64, 2048, 30]
    - [134, 3.929]
  - - [30, 64, 2048, 31]
    - [135, 4.002]
  - - [31, 64, 2048, 31]
    - [137, 3.982]
  - - [32, 64, 4608, 32]
    - [9, 7.577]
  - - [32, 64, 4608, 35]
    - [8, 5.693]
  - - [34, 64, 4736, 24]
    - [140, 3.534]
  - - [34, 64, 4736, 34]
    - [141, 4.242]
  - - [35, 64, 4608, 35]
    - [143, 4.301]
  - - [64, 14, 10880, 14]
    - [11, 2.143]
  - - [64, 15, 10880, 14]
    - [13, 2.221]
  - - [64, 15, 7680, 15]
    - [11, 2.24]
  - - [64, 15, 10880, 15]
    - [11, 2.342]
  - - [64, 17, 7680, 15]
    - [15, 2.444]
  - - [64, 17, 6144, 17]
    - [16, 2.157]
  - - [64, 17, 7680, 17]
    - [17, 2.426]
  - - [64, 21, 6144, 17]
    - [19, 2.612]
  - - [64, 21, 6144, 21]
    - [20, 3.103]
  - - [64, 24, 4736, 24]
    - [22, 4.211]
  - - [64, 30, 2048, 30]
    - [26, 4.842]
  - - [64, 30, 2048, 31]
    - [27, 4.96]
  - - [64, 31, 2048, 31]
    - [28, 5.081]
  - - [64, 32, 4608, 32]
    - [29, 7.597]
  - - [64, 32, 4608, 35]
    - [31, 5.693]
  - - [64, 34, 4736, 24]
    - [33, 4.592]
  - - [64, 34, 4736, 34]
    - [34, 5.221]
  - - [64, 35, 4608, 35]
    - [35, 5.349]
  - - [1024, 1024, 1, 3840]
    - [215, 49.581]
  - - [1024, 1024, 1, 3968]
    - [190, 49.226]
  - - [1024, 1024, 1, 6528]
    - [166, 55.8]
  - - [1024, 1024, 1, 7104]
    - [208, 56.953]
  - - [1024, 1024, 1, 7200]
    - [166, 56.298]
  - - [1024, 1024, 1, 8064]
    - [208, 58.616]
  - - [1024, 1024, 1, 8160]
    - [208, 58.662]
  - - [1024, 1024, 1, 9216]
    - [166, 60.051]
  - - [1024, 1024, 1, 9520]
    - [208, 58.717]
  - - [1024, 1024, 1, 10064]
    - [212, 58.995]
  - - [1024, 1024, 1, 10080]
    - [213, 59.948]
  - - [1024, 1024, 1, 10200]
    - [214, 58.705]
  - - [1024, 4096, 1, 3840]
    - [159, 78.873]
  - - [1024, 4096, 1, 3968]
    - [167, 77.219]
  - - [1024, 4096, 1, 6528]
    - [167, 79.256]
  - - [1024, 4096, 1, 7104]
    - [216, 80.059]
  - - [1024, 4096, 1, 7200]
    - [216, 81.024]
  - - [1024, 4096, 1, 8064]
    - [167, 82.023]
  - - [1024, 4096, 1, 8160]
    - [167, 81.582]
  - - [1024, 4096, 1, 9216]
    - [167, 80.352]
  - - [1024, 4096, 1, 9520]
    - [167, 80.778]
  - - [1024, 4096, 1, 10064]
    - [216, 78.864]
  - - [1024, 4096, 1, 10080]
    - [216, 81.21]
  - - [1024, 4096, 1, 10200]
    - [167, 81.227]
  - - [1024, 42720, 1, 3968]
    - [209, 91.62]
  - - [1024, 42720, 1, 6528]
    - [209, 92.836]
  - - [1024, 42720, 1, 7104]
    - [209, 93.225]
  - - [1024, 42720, 1, 7200]
    - [209, 93.461]
  - - [1024, 42720, 1, 9520]
    - [209, 92.556]
  - - [1024, 42720, 1, 10080]
    - [217, 93.473]
  - - [4096, 1024, 1, 3840]
    - [161, 76.862]
  - - [4096, 1024, 1, 3968]
    - [161, 75.791]
  - - [4096, 1024, 1, 6528]
    - [161, 78.696]
  - - [4096, 1024, 1, 7104]
    - [206, 76.965]
  - - [4096, 1024, 1, 7200]
    - [161, 79.252]
  - - [4096, 1024, 1, 8064]
    - [161, 79.689]
  - - [4096, 1024, 1, 8160]
    - [161, 80.456]
  - - [4096, 1024, 1, 9216]
    - [161, 79.312]
  - - [4096, 1024, 1, 9520]
    - [218, 76.951]
  - - [4096, 1024, 1, 10064]
    - [161, 78.88]
  - - [4096, 1024, 1, 10080]
    - [161, 78.488]
  - - [4096, 1024, 1, 10200]
    - [161, 78.968]
  - - [27, 64, 1920, 27]
    - [133, 3.552]
  - - [27, 64, 1920, 33]
    - [133, 3.686]
  - - [33, 64, 1920, 33]
    - [138, 3.63]
  - - [64, 27, 1920, 27]
    - [23, 4.436]
  - - [64, 27, 1920, 33]
    - [24, 4.595]
  - - [64, 33, 1920, 33]
    - [32, 4.621]
  - - [1024, 1024, 1, 3240]
    - [86, 40.92]
  - - [1024, 1024, 1, 3960]
    - [87, 43.37]
  - - [1024, 4096, 1, 3240]
    - [88, 68.633]
  - - [1024, 4096, 1, 3960]
    - [89, 71.466]
  - - [1024, 42720, 1, 3960]
    - [89, 88.392]
  - - [4096, 1024, 1, 3240]
    - [89, 69.269]
  - - [4096, 1024, 1, 3960]
    - [109, 68.687]
  - - [64, 1280, 64, 192]
    - [368, 30.786]
  - - [64, 1280, 64, 320]
    - [369, 34.66]
  - - [64, 1280, 64, 384]
    - [370, 35.086]
  - - [64, 1280, 64, 448]
    - [371, 36.453]
  - - [64, 2048, 64, 192]
    - [372, 29.847]
  - - [64, 2048, 64, 320]
    - [373, 34.085]
  - - [64, 2048, 64, 384]
    - [374, 35.382]
  - - [64, 2048, 64, 448]
    - [375, 36.408]
  - - [1225, 192, 64, 32]
    - [524, 13.104]
  - - [1225, 192, 64, 48]
    - [525, 17.338]
  - - [1225, 192, 64, 64]
    - [520, 20.87]
  - - [1225, 256, 64, 48]
    - [526, 19.021]
  - - [1225, 256, 64, 64]
    - [527, 23.206]
  - - [1225, 288, 64, 48]
    - [528, 19.246]
  - - [1225, 288, 64, 64]
    - [529, 24.192]
  - - [5329, 64, 64, 80]
    - [530, 21.032]
  - - [289, 768, 64, 128]
    - [531, 31.279]
  - - [289, 768, 64, 160]
    - [532, 35.041]
  - - [289, 768, 64, 192]
    - [533, 38.094]
  - - [64, 1280, 32, 192]
    - [376, 26.915]
  - - [64, 1280, 32, 320]
    - [377, 32.306]
  - - [64, 1280, 32, 384]
    - [378, 33.525]
  - - [64, 1280, 32, 448]
    - [379, 35.568]
  - - [64, 2048, 32, 192]
    - [380, 28.655]
  - - [64, 2048, 32, 320]
    - [380, 33.406]
  - - [64, 2048, 32, 384]
    - [381, 35.053]
  - - [64, 2048, 32, 448]
    - [382, 35.669]
  - - [1225, 192, 32, 32]
    - [534, 11.214]
  - - [1225, 192, 32, 48]
    - [535, 14.828]
  - - [1225, 192, 32, 64]
    - [536, 18.104]
  - - [1225, 256, 32, 48]
    - [537, 16.947]
  - - [1225, 256, 32, 64]
    - [538, 20.584]
  - - [1225, 288, 32, 48]
    - [539, 15.848]
  - - [1225, 288, 32, 64]
    - [539, 20.552]
  - - [5329, 64, 32, 80]
    - [524, 18.697]
  - - [289, 768, 32, 128]
    - [540, 26.422]
  - - [289, 768, 32, 160]
    - [541, 30.042]
  - - [289, 768, 32, 192]
    - [542, 33.147]
  - - [49, 512, 64, 2048]
    - [522, 27.501]
  - - [49, 2048, 64, 512]
    - [523, 26.552]
  - - [3136, 64, 32, 256]
    - [317, 29.647]
  - - [3136, 64, 32, 64]
    - [331, 17.564]
  - - [3136, 256, 32, 64]
    - [365, 29.877]
  - - [784, 128, 32, 512]
    - [363, 46.626]
  - - [784, 512, 32, 128]
    - [366, 40.491]
  - - [196, 256, 32, 1024]
    - [518, 32.325]
  - - [196, 1024, 32, 256]
    - [517, 30.897]
  - - [49, 512, 32, 2048]
    - [520, 23.93]
  - - [49, 2048, 32, 512]
    - [519, 25.307]
  - - [3136, 64, 64, 128]
    - [357, 25.265]
  - - [3136, 128, 64, 256]
    - [358, 50.739]
  - - [784, 256, 64, 512]
    - [359, 60.998]
  - - [3136, 256, 64, 128]
    - [288, 49.998]
  - - [3136, 256, 64, 256]
    - [168, 69.426]
  - - [196, 512, 64, 1024]
    - [508, 47.09]
  - - [784, 512, 64, 256]
    - [360, 59.465]
  - - [784, 512, 64, 512]
    - [360, 67.522]
  - - [196, 1024, 64, 512]
    - [509, 44.925]
  - - [196, 1024, 64, 1024]
    - [509, 52.048]
  - - [49, 1024, 64, 2048]
    - [510, 30.454]
  - - [49, 2048, 64, 1024]
    - [511, 30.697]
  - - [3136, 64, 32, 128]
    - [361, 23.103]
  - - [3136, 128, 32, 256]
    - [362, 48.234]
  - - [784, 256, 32, 512]
    - [363, 53.057]
  - - [3136, 256, 32, 128]
    - [364, 46.068]
  - - [3136, 256, 32, 256]
    - [168, 62.421]
  - - [196, 512, 32, 1024]
    - [512, 39.302]
  - - [784, 512, 32, 256]
    - [359, 53.612]
  - - [784, 512, 32, 512]
    - [160, 63.581]
  - - [196, 1024, 32, 512]
    - [513, 39.914]
  - - [196, 1024, 32, 1024]
    - [514, 47.526]
  - - [49, 1024, 32, 2048]
    - [515, 30.111]
  - - [49, 2048, 32, 1024]
    - [516, 28.923]
  - - [7680, 8192, 1, 8192]
    - [108, 95.574]
  - - [3840, 4096, 1, 4096]
    - [108, 93.214]
  - - [1920, 2048, 1, 2048]
    - [94, 84.964]
  - - [960, 1024, 1, 1024]
    - [81, 40.958]
  - - [480, 512, 1, 512]
    - [75, 11.659]
  - - [8192, 7680, 1, 8192]
    - [121, 95.496]
  - - [4096, 3840, 1, 4096]
    - [110, 93.17]
  - - [2048, 1920, 1, 2048]
    - [95, 84.869]
  - - [1024, 960, 1, 1024]
    - [85, 41.684]
  - - [512, 480, 1, 512]
    - [77, 11.659]
  - - [8192, 8192, 1, 8192]
    - [111, 93.09]
  - - [4096, 4096, 1, 4096]
    - [111, 86.415]
  - - [2048, 2048, 1, 2048]
    - [97, 76.926]
  - - [512, 512, 1, 512]
    - [78, 9.662]
  - - [64, 512, 16, 512]
    - [145, 18.204]
  - - [1024, 2, 1, 1]
    - [146, 0.001]
  - - [1024, 2, 1, 512]
    - [147, 0.101]
  - - [1024, 1024, 1, 1]
    - [148, 0.192]
  - - [1024, 1024, 1, 77]
    - [33, 8.89]
  - - [1024, 4096, 1, 512]
    - [150, 57.093]
  - - [1024, 30522, 1, 77]
    - [151, 28.764]
  - - [4096, 1024, 1, 512]
    - [152, 49.5]
  - - [64, 128, 160, 128]
    - [153, 14.812]
  - - [1024, 2, 1, 10]
    - [154, 0.004]
  - - [1024, 2, 1, 1280]
    - [155, 0.219]
  - - [1024, 1024, 1, 10]
    - [156, 1.558]
  - - [1024, 1024, 1, 1280]
    - [158, 37.494]
  - - [1024, 4096, 1, 1280]
    - [159, 68.544]
  - - [1024, 30522, 1, 200]
    - [160, 51.677]
  - - [4096, 1024, 1, 1280]
    - [161, 64.166]
  - - [64, 128, 624, 128]
    - [162, 18.612]
  - - [1024, 2, 1, 39]
    - [154, 0.011]
  - - [1024, 2, 1, 4992]
    - [163, 0.638]
  - - [1024, 1024, 1, 39]
    - [164, 5.242]
  - - [1024, 1024, 1, 780]
    - [165, 27.239]
  - - [1024, 1024, 1, 4992]
    - [166, 52.787]
  - - [1024, 4096, 1, 4992]
    - [167, 80.503]
  - - [1024, 30522, 1, 780]
    - [168, 73.594]
  - - [4096, 1024, 1, 4992]
    - [169, 76.871]
  - - [1024, 1024, 1, 308]
    - [157, 20.284]
  - - [1024, 30522, 1, 308]
    - [160, 61.788]
  - - [64, 128, 640, 128]
    - [174, 18.747]
  - - [1024, 2, 1, 40]
    - [154, 0.012]
  - - [1024, 2, 1, 5120]
    - [175, 0.642]
  - - [1024, 1024, 1, 40]
    - [162, 5.377]
  - - [1024, 1024, 1, 800]
    - [176, 31.152]
  - - [1024, 1024, 1, 5120]
    - [177, 51.69]
  - - [1024, 4096, 1, 5120]
    - [167, 80.259]
  - - [1024, 30522, 1, 800]
    - [178, 77.635]
  - - [4096, 1024, 1, 5120]
    - [161, 77.684]
  - - [64, 128, 656, 128]
    - [179, 18.768]
  - - [1024, 2, 1, 41]
    - [154, 0.012]
  - - [1024, 2, 1, 5248]
    - [163, 0.662]
  - - [1024, 1024, 1, 41]
    - [180, 5.225]
  - - [1024, 1024, 1, 820]
    - [181, 27.184]
  - - [1024, 1024, 1, 5248]
    - [182, 52.603]
  - - [1024, 4096, 1, 5248]
    - [167, 77.441]
  - - [1024, 30522, 1, 820]
    - [100, 74.974]
  - - [4096, 1024, 1, 5248]
    - [161, 77.88]
  - - [64, 512, 80, 512]
    - [183, 31.245]
  - - [1024, 2, 1, 5]
    - [171, 0.001]
  - - [1024, 2, 1, 2560]
    - [184, 0.413]
  - - [1024, 1024, 1, 5]
    - [35, 0.818]
  - - [1024, 1024, 1, 385]
    - [185, 21.713]
  - - [1024, 1024, 1, 2560]
    - [173, 46.009]
  - - [1024, 4096, 1, 2560]
    - [167, 76.589]
  - - [1024, 30522, 1, 385]
    - [186, 66.241]
  - - [4096, 1024, 1, 2560]
    - [161, 73.027]
  - - [64, 512, 96, 512]
    - [187, 31.533]
  - - [1024, 2, 1, 6]
    - [11, 0.002]
  - - [1024, 2, 1, 3072]
    - [188, 0.463]
  - - [1024, 1024, 1, 6]
    - [189, 0.982]
  - - [1024, 1024, 1, 462]
    - [149, 23.013]
  - - [1024, 1024, 1, 3072]
    - [190, 47.398]
  - - [1024, 4096, 1, 3072]
    - [167, 77.745]
  - - [1024, 30522, 1, 462]
    - [121, 67.769]
  - - [4096, 1024, 1, 3072]
    - [161, 75.316]
  - - [64, 128, 128, 128]
    - [153, 13.084]
  - - [1024, 2, 1, 8]
    - [154, 0.003]
  - - [1024, 2, 1, 1024]
    - [191, 0.189]
  - - [1024, 1024, 1, 8]
    - [180, 1.33]
  - - [1024, 1024, 1, 160]
    - [149, 16.527]
  - - [1024, 4096, 1, 1024]
    - [167, 68.708]
  - - [1024, 30522, 1, 160]
    - [192, 51.314]
  - - [4096, 1024, 1, 1024]
    - [193, 60.351]
  - - [64, 128, 144, 128]
    - [194, 14.13]
  - - [1024, 2, 1, 9]
    - [171, 0.003]
  - - [1024, 2, 1, 1152]
    - [195, 0.208]
  - - [1024, 1024, 1, 9]
    - [196, 1.402]
  - - [1024, 1024, 1, 180]
    - [157, 16.057]
  - - [1024, 1024, 1, 1152]
    - [158, 35.661]
  - - [1024, 4096, 1, 1152]
    - [167, 71.21]
  - - [1024, 30522, 1, 180]
    - [160, 49.482]
  - - [4096, 1024, 1, 1152]
    - [161, 62.284]
  - - [479, 1024, 1, 32768]
    - [493, 67.571]
  - - [4, 64, 32768, 4]
    - [122, 0.201]
  - - [4, 64, 38400, 4]
    - [122, 0.202]
  - - [64, 4, 32768, 4]
    - [11, 0.202]
  - - [64, 4, 38400, 4]
    - [11, 0.203]
  - - [1024, 1024, 1, 8192]
    - [208, 58.126]
  - - [1024, 1024, 1, 9600]
    - [208, 60.041]
  - - [1024, 4096, 1, 8192]
    - [167, 80.791]
  - - [1024, 4096, 1, 9600]
    - [209, 78.064]
  - - [1024, 33712, 1, 8192]
    - [210, 92.779]
  - - [1024, 33712, 1, 9600]
    - [168, 92.758]
  - - [4096, 1024, 1, 8192]
    - [211, 77.221]
  - - [4096, 1024, 1, 9600]
    - [161, 78.931]
  - - [64, 128, 1, 128]
    - [221, 0.149]
  - - [128, 64, 1, 128]
    - [221, 0.153]
  - - [5, 64, 1, 5]
    - [495, 0.0]
  - - [2048, 512, 1, 1]
    - [180, 0.185]
  - - [33, 32, 1, 33]
    - [495, 0.004]
  - - [1024, 1600, 1, 1]
    - [227, 0.264]
  - - [64, 1024, 32, 1024]
    - [318, 37.147]
  - - [2560, 1920, 1, 2048]
    - [193, 86.985]
  - - [1024, 3072, 1, 4096]
    - [249, 69.459]
  - - [2560, 2560, 1, 2048]
    - [303, 74.944]
  - - [2048, 2, 1, 2]
    - [171, 0.001]
  - - [1024, 64, 128, 1024]
    - [322, 40.951]
  - - [2048, 2048, 1, 2]
    - [96, 0.793]
  - - [1024, 64, 32, 1024]
    - [317, 35.887]
  - - [1024, 96, 64, 1024]
    - [310, 50.835]
  - - [1024, 30592, 1, 2048]
    - [108, 87.584]
  - - [1024, 3072, 1, 16384]
    - [296, 75.576]
  - - [6144, 1536, 1, 4096]
    - [309, 85.377]
  - - [1024, 1024, 1, 16]
    - [35, 3.019]
  - - [1536, 4608, 1, 8192]
    - [108, 85.898]
  - - [640, 2560, 1, 2048]
    - [304, 60.738]
  - - [1024, 4096, 1, 16384]
    - [167, 83.184]
  - - [64, 512, 40, 512]
    - [306, 27.789]
  - - [1024, 1024, 1, 16384]
    - [313, 68.24]
  - - [1536, 6144, 1, 4096]
    - [252, 85.64]
  - - [1024, 30592, 1, 4096]
    - [110, 91.824]
  - - [2560, 2560, 1, 4]
    - [100, 1.777]
  - - [1536, 1536, 1, 4096]
    - [307, 77.495]
  - - [2560, 7680, 1, 2048]
    - [293, 91.305]
  - - [64, 1024, 256, 1024]
    - [316, 41.437]
  - - [96, 1024, 64, 1024]
    - [311, 48.31]
  - - [1536, 50304, 1, 4096]
    - [303, 93.491]
  - - [2048, 8192, 1, 1024]
    - [293, 75.234]
  - - [1024, 30592, 1, 8192]
    - [205, 94.061]
  - - [512, 64, 256, 512]
    - [297, 33.919]
  - - [1024, 96, 128, 1024]
    - [176, 54.835]
  - - [64, 512, 128, 512]
    - [301, 30.496]
  - - [4096, 1024, 1, 16384]
    - [315, 79.209]
  - - [8192, 2048, 1, 1024]
    - [294, 75.304]
  - - [64, 1024, 64, 1024]
    - [301, 37.811]
  - - [1024, 50304, 1, 4096]
    - [319, 90.582]
  - - [1536, 4608, 1, 4096]
    - [308, 84.153]
  - - [512, 64, 128, 512]
    - [300, 30.221]
  - - [6144, 1536, 1, 8192]
    - [309, 89.001]
  - - [1024, 3072, 1, 8192]
    - [296, 73.257]
  - - [1536, 1536, 1, 8192]
    - [307, 80.173]
  - - [1536, 50304, 1, 8192]
    - [121, 94.267]
  - - [2560, 2, 1, 4]
    - [302, 0.004]
  - - [2048, 6144, 1, 1024]
    - [292, 71.732]
  - - [64, 1024, 128, 1024]
    - [323, 40.436]
  - - [1024, 64, 64, 1024]
    - [320, 37.355]
  - - [1024, 2, 1, 16]
    - [295, 0.006]
  - - [96, 1024, 128, 1024]
    - [312, 52.794]
  - - [2048, 30592, 1, 1024]
    - [210, 84.563]
  - - [64, 512, 256, 512]
    - [298, 33.579]
  - - [1536, 6144, 1, 8192]
    - [252, 89.176]
  - - [1024, 50304, 1, 2048]
    - [303, 87.337]
  - - [1024, 50304, 1, 8192]
    - [321, 92.308]
  - - [1024, 3072, 1, 2048]
    - [299, 63.0]
  - - [1024, 64, 256, 1024]
    - [264, 41.738]
  - - [1024, 50304, 1, 16384]
    - [314, 93.287]
  - - [512, 64, 40, 512]
    - [305, 27.305]
  - - [1024, 2, 1, 64]
    - [203, 0.022]
  - - [1024, 30528, 1, 8192]
    - [110, 93.945]
  - - [1024, 1024, 1, 64]
    - [324, 9.102]
  - - [64, 128, 1024, 128]
    - [325, 19.858]
  - - [128, 64, 1024, 128]
    - [326, 19.626]
  - - [1024, 1024, 1, 3456]
    - [190, 48.657]
  - - [1024, 1024, 1, 6912]
    - [166, 56.664]
  - - [1024, 1024, 1, 864]
    - [327, 32.115]
  - - [1024, 512, 1, 3456]
    - [328, 35.4]
  - - [1024, 512, 1, 4096]
    - [329, 39.405]
  - - [1024, 512, 1, 6912]
    - [330, 49.581]
  - - [1024, 512, 1, 864]
    - [331, 22.67]
  - - [256, 128, 1, 3456]
    - [332, 6.022]
  - - [256, 128, 1, 4096]
    - [333, 8.21]
  - - [256, 128, 1, 55296]
    - [334, 29.135]
  - - [256, 128, 1, 6912]
    - [335, 12.252]
  - - [256, 128, 1, 864]
    - [336, 2.038]
  - - [256, 3456, 1, 1]
    - [337, 0.159]
  - - [256, 4096, 1, 1]
    - [338, 0.178]
  - - [256, 6912, 1, 1]
    - [198, 0.263]
  - - [256, 864, 1, 1]
    - [171, 0.055]
  - - [480, 1024, 1, 3456]
    - [339, 36.048]
  - - [480, 1024, 1, 4096]
    - [340, 39.008]
  - - [480, 1024, 1, 6912]
    - [341, 48.764]
  - - [480, 1024, 1, 864]
    - [342, 20.917]
  - - [512, 256, 1, 3456]
    - [343, 19.996]
  - - [512, 256, 1, 4096]
    - [344, 21.94]
  - - [512, 256, 1, 55296]
    - [345, 61.271]
  - - [512, 256, 1, 6912]
    - [346, 28.547]
  - - [512, 256, 1, 864]
    - [347, 7.065]
  - - [30528, 1024, 1, 640]
    - [121, 74.952]
  - - [30528, 1024, 1, 1280]
    - [348, 84.376]
  - - [4096, 1024, 1, 10240]
    - [206, 78.472]
  - - [1024, 4096, 1, 10240]
    - [167, 80.516]
  - - [30528, 1024, 1, 1600]
    - [348, 86.488]
  - - [1024, 2, 1, 80]
    - [295, 0.025]
  - - [1024, 1024, 1, 10240]
    - [313, 60.351]
  - - [1024, 1024, 1, 80]
    - [149, 10.904]
  - - [64, 128, 1280, 128]
    - [349, 20.259]
  - - [128, 64, 1280, 128]
    - [350, 19.906]
  - - [1024, 4096, 1, 10496]
    - [167, 81.63]
  - - [30528, 1024, 1, 1640]
    - [192, 84.498]
  - - [4096, 1024, 1, 10496]
    - [206, 78.458]
  - - [1024, 1024, 1, 10496]
    - [200, 60.586]
  - - [1024, 1024, 1, 82]
    - [33, 9.467]
  - - [1024, 2, 1, 82]
    - [351, 0.022]
  - - [128, 64, 1312, 128]
    - [352, 20.148]
  - - [64, 128, 1312, 128]
    - [353, 20.403]
  - - [30528, 1024, 1, 160]
    - [168, 47.376]
  - - [1024, 4096, 1, 6144]
    - [167, 79.539]
  - - [30528, 1024, 1, 240]
    - [354, 58.122]
  - - [4096, 1024, 1, 6144]
    - [161, 79.487]
  - - [1024, 1024, 1, 12]
    - [35, 1.869]
  - - [1024, 2, 1, 12]
    - [171, 0.004]
  - - [1024, 1024, 1, 6144]
    - [177, 55.363]
  - - [64, 512, 192, 512]
    - [355, 32.982]
  - - [512, 64, 192, 512]
    - [356, 32.001]
  - - [13, 512, 1, 3456]
    - [503, 1.708]
  - - [13, 512, 1, 4096]
    - [504, 1.933]
  - - [13, 512, 1, 55296]
    - [505, 7.553]
  - - [13, 512, 1, 6912]
    - [506, 2.89]
  - - [13, 512, 1, 864]
    - [507, 0.503]
  - - [1024, 1024, 1, 10224]
    - [166, 61.664]
  - - [1024, 1024, 1, 10192]
    - [212, 59.39]
  - - [1024, 1024, 1, 10208]
    - [166, 60.673]
  - - [1024, 4096, 1, 10224]
    - [167, 81.155]
  - - [4096, 1024, 1, 10224]
    - [315, 77.042]
  - - [1024, 3072, 1, 10224]
    - [247, 72.983]
  - - [1024, 3072, 1, 10240]
    - [383, 73.795]
  - - [4096, 1024, 1, 10192]
    - [206, 77.26]
  - - [1024, 3072, 1, 10192]
    - [247, 72.825]
  - - [1024, 4096, 1, 10192]
    - [167, 81.295]
  - - [1024, 3072, 1, 10200]
    - [296, 72.688]
  - - [1024, 1024, 1, 10184]
    - [166, 60.53]
  - - [4096, 1024, 1, 10208]
    - [218, 79.705]
  - - [1024, 3072, 1, 10208]
    - [296, 74.329]
  - - [1024, 4096, 1, 10208]
    - [167, 81.142]
  - - [1024, 2048, 1, 10224]
    - [384, 68.694]
  - - [1024, 2048, 1, 10240]
    - [384, 68.217]
  - - [1024, 1024, 1, 10120]
    - [166, 61.112]
  - - [1024, 2048, 1, 10192]
    - [385, 68.904]
  - - [64, 24, 6816, 24]
    - [386, 4.184]
  - - [1024, 1024, 1, 10152]
    - [313, 59.689]
  - - [1024, 3072, 1, 10080]
    - [296, 74.334]
  - - [64, 26, 6272, 26]
    - [27, 4.494]
  - - [100352, 256, 1, 512]
    - [293, 74.063]
  - - [12544, 1024, 1, 2048]
    - [206, 75.797]
  - - [12544, 147, 1, 64]
    - [148, 11.875]
  - - [200704, 256, 1, 512]
    - [387, 77.515]
  - - [25088, 512, 1, 1024]
    - [259, 74.197]
  - - [3136, 576, 1, 64]
    - [388, 13.034]
  - - [50176, 512, 1, 1024]
    - [121, 83.595]
  - - [6272, 1024, 1, 2048]
    - [294, 73.096]
  - - [784, 1152, 1, 128]
    - [389, 12.728]
  - - [3136, 256, 128, 128]
    - [390, 52.739]
  - - [3136, 256, 256, 128]
    - [391, 53.965]
  - - [784, 512, 128, 256]
    - [359, 63.352]
  - - [784, 512, 256, 256]
    - [360, 67.264]
  - - [64, 128, 2048, 128]
    - [396, 20.424]
  - - [128, 64, 2048, 128]
    - [397, 20.57]
  - - [30528, 1024, 1, 2560]
    - [398, 89.264]
  - - [1024, 1024, 1, 128]
    - [659, 14.777]
  - - [1024, 2, 1, 128]
    - [399, 0.036]
  - - [128, 64, 1536, 128]
    - [400, 20.097]
  - - [64, 128, 1536, 128]
    - [401, 20.15]
  - - [1024, 4096, 1, 12288]
    - [167, 82.675]
  - - [30528, 1024, 1, 1920]
    - [348, 87.888]
  - - [1024, 1024, 1, 96]
    - [157, 12.56]
  - - [1024, 1024, 1, 12288]
    - [213, 63.8]
  - - [4096, 1024, 1, 12288]
    - [206, 78.708]
  - - [1024, 2, 1, 96]
    - [203, 0.03]
  - - [25600, 128, 25, 128]
    - [402, 45.262]
  - - [12544, 128, 36, 128]
    - [403, 44.385]
  - - [9216, 128, 49, 128]
    - [403, 44.728]
  - - [6400, 128, 64, 128]
    - [403, 44.228]
  - - [6400, 256, 25, 256]
    - [404, 69.056]
  - - [4096, 256, 36, 256]
    - [395, 66.351]
  - - [2304, 256, 49, 256]
    - [405, 65.014]
  - - [2304, 256, 64, 256]
    - [405, 67.997]
  - - [2304, 512, 25, 512]
    - [210, 78.504]
  - - [1024, 512, 36, 512]
    - [360, 74.988]
  - - [1024, 512, 49, 512]
    - [360, 76.266]
  - - [1024, 512, 64, 512]
    - [359, 78.198]
  - - [92416, 64, 25, 64]
    - [322, 23.423]
  - - [50176, 64, 36, 64]
    - [317, 23.567]
  - - [36864, 64, 49, 64]
    - [317, 23.696]
  - - [25600, 64, 64, 64]
    - [406, 23.789]
  - - [64, 128, 192, 128]
    - [407, 15.833]
  - - [128, 64, 192, 128]
    - [408, 15.833]
  - - [768, 2, 1, 2048]
    - [409, 0.261]
  - - [3072, 768, 1, 2048]
    - [307, 71.775]
  - - [768, 3072, 1, 2048]
    - [307, 72.581]
  - - [768, 768, 1, 2048]
    - [329, 34.049]
  - - [64, 384, 144, 384]
    - [410, 32.777]
  - - [384, 64, 144, 384]
    - [411, 29.995]
  - - [768, 2, 1, 4608]
    - [412, 0.469]
  - - [3072, 768, 1, 4608]
    - [307, 77.428]
  - - [768, 3072, 1, 4608]
    - [307, 77.962]
  - - [768, 768, 1, 4608]
    - [413, 48.172]
  - - [64, 512, 48, 512]
    - [407, 29.325]
  - - [512, 64, 48, 512]
    - [414, 29.439]
  - - [64, 128, 256, 128]
    - [415, 17.325]
  - - [128, 64, 256, 128]
    - [416, 17.089]
  - - [64, 384, 192, 384]
    - [368, 30.719]
  - - [384, 64, 192, 384]
    - [417, 31.518]
  - - [1024, 2, 1, 4608]
    - [184, 0.605]
  - - [4096, 1024, 1, 4608]
    - [161, 78.029]
  - - [1024, 4096, 1, 4608]
    - [167, 77.761]
  - - [1024, 1024, 1, 4608]
    - [166, 50.579]
  - - [196, 2304, 1, 256]
    - [543, 10.403]
  - - [49, 4608, 1, 512]
    - [544, 7.213]
  - - [196, 1024, 128, 512]
    - [545, 48.102]
  - - [196, 1024, 256, 512]
    - [546, 48.875]
  - - [49, 2048, 128, 512]
    - [548, 28.001]
  - - [49, 2048, 256, 512]
    - [549, 29.42]
  - - [49, 512, 128, 2048]
    - [550, 28.56]
  - - [49, 512, 256, 2048]
    - [550, 31.234]
  - - [4880, 256, 49, 256]
    - [160, 68.916]
  - - [3128, 256, 64, 256]
    - [160, 66.367]
  - - [4680, 256, 49, 256]
    - [160, 67.715]
  - - [5280, 256, 36, 256]
    - [168, 69.682]
  - - [2640, 256, 64, 256]
    - [168, 66.087]
  - - [5304, 256, 49, 256]
    - [418, 68.528]
  - - [2760, 256, 64, 256]
    - [210, 64.793]
  - - [6440, 256, 36, 256]
    - [160, 67.293]
  - - [5704, 256, 36, 256]
    - [168, 66.776]
  - - [2128, 256, 64, 256]
    - [360, 63.183]
  - - [1160, 256, 49, 256]
    - [100, 49.872]
  - - [4056, 256, 49, 256]
    - [360, 64.153]
  - - [6144, 256, 36, 256]
    - [168, 71.585]
  - - [6336, 256, 36, 256]
    - [168, 71.084]
  - - [13600, 512, 2, 128]
    - [419, 38.886]
  - - [15200, 512, 2, 128]
    - [259, 42.278]
  - - [15200, 128, 2, 512]
    - [420, 62.777]
  - - [13600, 128, 2, 512]
    - [421, 49.946]
  - - [5632, 256, 36, 256]
    - [168, 71.26]
  - - [12288, 128, 2, 512]
    - [422, 49.744]
  - - [12880, 128, 2, 512]
    - [363, 48.167]
  - - [768, 512, 2, 2048]
    - [423, 39.875]
  - - [11408, 128, 2, 512]
    - [424, 47.275]
  - - [13824, 512, 2, 128]
    - [425, 46.078]
  - - [13824, 128, 2, 512]
    - [383, 58.674]
  - - [10560, 128, 2, 512]
    - [424, 45.291]
  - - [10752, 128, 2, 512]
    - [426, 45.012]
  - - [13600, 512, 2, 256]
    - [364, 54.075]
  - - [15200, 512, 2, 256]
    - [364, 56.843]
  - - [768, 2048, 2, 512]
    - [427, 47.102]
  - - [12880, 512, 2, 128]
    - [428, 38.254]
  - - [11616, 128, 2, 512]
    - [288, 46.716]
  - - [14208, 512, 2, 128]
    - [422, 46.351]
  - - [11408, 512, 2, 128]
    - [429, 37.117]
  - - [6912, 256, 36, 256]
    - [168, 73.054]
  - - [672, 512, 2, 2048]
    - [430, 36.432]
  - - [13824, 512, 2, 256]
    - [387, 62.92]
  - - [11616, 512, 2, 128]
    - [259, 38.302]
  - - [12288, 512, 2, 128]
    - [431, 42.699]
  - - [14208, 128, 2, 512]
    - [432, 59.077]
  - - [11968, 128, 2, 512]
    - [403, 46.902]
  - - [864, 2048, 2, 512]
    - [433, 49.437]
  - - [1008, 512, 2, 2048]
    - [434, 42.728]
  - - [10560, 512, 2, 128]
    - [359, 38.437]
  - - [672, 2048, 2, 512]
    - [435, 41.086]
  - - [9408, 128, 2, 512]
    - [436, 41.511]
  - - [10752, 512, 2, 128]
    - [419, 44.257]
  - - [11968, 512, 2, 128]
    - [437, 38.94]
  - - [1240, 256, 49, 256]
    - [405, 52.783]
  - - [4032, 256, 2, 1024]
    - [436, 47.67]
  - - [888, 2048, 2, 512]
    - [438, 48.545]
  - - [12880, 512, 2, 256]
    - [439, 51.715]
  - - [12288, 512, 2, 256]
    - [186, 56.558]
  - - [13440, 128, 2, 512]
    - [440, 54.052]
  - - [864, 2048, 2, 256]
    - [363, 40.373]
  - - [12672, 128, 2, 512]
    - [441, 51.469]
  - - [11264, 128, 2, 512]
    - [441, 47.156]
  - - [11776, 128, 2, 512]
    - [442, 48.149]
  - - [16128, 128, 2, 512]
    - [421, 49.334]
  - - [4032, 1024, 2, 256]
    - [443, 50.725]
  - - [14000, 128, 2, 512]
    - [422, 51.109]
  - - [13440, 512, 2, 128]
    - [444, 45.415]
  - - [864, 512, 2, 2048]
    - [320, 40.278]
  - - [768, 2048, 2, 256]
    - [442, 38.648]
  - - [3264, 1024, 2, 256]
    - [445, 47.102]
  - - [888, 512, 2, 2048]
    - [446, 38.557]
  - - [4200, 256, 2, 1024]
    - [436, 53.387]
  - - [2352, 1024, 2, 256]
    - [447, 44.903]
  - - [56, 512, 64, 512]
    - [448, 26.403]
  - - [2400, 1024, 2, 256]
    - [449, 45.642]
  - - [15200, 256, 2, 12]
    - [355, 4.937]
  - - [840, 512, 2, 2048]
    - [450, 36.554]
  - - [12880, 256, 2, 12]
    - [451, 4.6]
  - - [2520, 1024, 2, 256]
    - [452, 47.013]
  - - [13600, 256, 2, 12]
    - [453, 4.6]
  - - [15200, 256, 2, 3]
    - [355, 1.278]
  - - [12880, 256, 2, 3]
    - [454, 1.194]
  - - [4200, 1024, 2, 256]
    - [443, 47.049]
  - - [12288, 256, 2, 12]
    - [33, 4.618]
  - - [768, 256, 2, 12]
    - [455, 0.818]
  - - [13824, 256, 2, 12]
    - [100, 4.907]
  - - [864, 256, 2, 3]
    - [456, 0.234]
  - - [176, 256, 2, 3]
    - [457, 0.045]
  - - [864, 256, 2, 12]
    - [458, 0.903]
  - - [13600, 256, 2, 3]
    - [401, 1.214]
  - - [768, 256, 2, 3]
    - [459, 0.216]
  - - [7600, 512, 1, 256]
    - [360, 49.587]
  - - [6144, 512, 1, 256]
    - [460, 39.048]
  - - [12544, 1024, 1, 1024]
    - [168, 72.75]
  - - [1024, 81, 1, 1024]
    - [461, 6.067]
  - - [176, 256, 2, 12]
    - [456, 0.18]
  - - [216, 256, 2, 3]
    - [462, 0.078]
  - - [192, 256, 2, 12]
    - [463, 0.201]
  - - [3800, 256, 2, 3]
    - [198, 0.748]
  - - [13824, 256, 2, 3]
    - [425, 1.361]
  - - [12288, 256, 2, 3]
    - [464, 1.289]
  - - [192, 256, 2, 3]
    - [457, 0.05]
  - - [216, 256, 2, 12]
    - [171, 0.259]
  - - [2688, 256, 2, 1024]
    - [465, 42.82]
  - - [3072, 256, 2, 12]
    - [198, 2.42]
  - - [3800, 256, 2, 12]
    - [198, 2.837]
  - - [3072, 256, 2, 3]
    - [180, 0.659]
  - - [2520, 256, 2, 1024]
    - [310, 44.798]
  - - [16128, 512, 2, 128]
    - [422, 46.879]
  - - [2400, 256, 2, 1024]
    - [144, 41.03]
  - - [2352, 256, 2, 1024]
    - [466, 41.362]
  - - [2944, 256, 2, 1024]
    - [224, 44.173]
  - - [2992, 1024, 2, 256]
    - [467, 47.355]
  - - [2816, 256, 2, 1024]
    - [468, 43.042]
  - - [2904, 1024, 2, 256]
    - [441, 42.66]
  - - [3456, 256, 2, 3]
    - [355, 0.731]
  - - [3400, 256, 2, 3]
    - [469, 0.688]
  - - [2816, 1024, 2, 256]
    - [366, 47.156]
  - - [3456, 256, 2, 12]
    - [469, 2.65]
  - - [2944, 1024, 2, 256]
    - [395, 48.8]
  - - [3168, 256, 2, 1024]
    - [224, 46.124]
  - - [2992, 256, 2, 1024]
    - [224, 44.351]
  - - [51520, 256, 2, 12]
    - [198, 5.376]
  - - [3072, 256, 2, 1024]
    - [288, 45.953]
  - - [2640, 1024, 2, 256]
    - [470, 42.609]
  - - [2688, 1024, 2, 256]
    - [471, 45.635]
  - - [2904, 256, 2, 1024]
    - [292, 42.66]
  - - [3264, 256, 2, 1024]
    - [472, 49.89]
  - - [54400, 256, 2, 12]
    - [473, 5.814]
  - - [55296, 256, 2, 3]
    - [395, 1.593]
  - - [60800, 256, 2, 12]
    - [474, 5.885]
  - - [51520, 256, 2, 3]
    - [198, 1.455]
  - - [55296, 256, 2, 12]
    - [475, 5.888]
  - - [3600, 1024, 2, 256]
    - [476, 52.413]
  - - [60800, 256, 2, 3]
    - [477, 1.649]
  - - [952, 256, 64, 256]
    - [168, 51.541]
  - - [49152, 256, 2, 12]
    - [478, 5.664]
  - - [3360, 256, 2, 1024]
    - [479, 47.924]
  - - [736, 256, 64, 256]
    - [312, 54.099]
  - - [600, 256, 64, 256]
    - [168, 48.559]
  - - [1440, 256, 49, 256]
    - [441, 56.792]
  - - [3168, 1024, 2, 256]
    - [445, 46.261]
  - - [1368, 256, 49, 256]
    - [360, 53.881]
  - - [49152, 256, 2, 3]
    - [480, 1.539]
  - - [3600, 256, 2, 1024]
    - [479, 52.413]
  - - [3360, 1024, 2, 256]
    - [441, 48.487]
  - - [54400, 256, 2, 3]
    - [210, 1.589]
  - - [3072, 1024, 2, 256]
    - [360, 50.579]
  - - [2640, 256, 2, 1024]
    - [481, 44.976]
  - - [616, 256, 64, 256]
    - [360, 47.975]
  - - [3008, 256, 64, 256]
    - [360, 69.208]
  - - [896, 256, 64, 256]
    - [478, 57.467]
  - - [768, 256, 64, 256]
    - [312, 56.878]
  - - [3552, 256, 2, 1024]
    - [445, 60.724]
  - - [3552, 1024, 2, 256]
    - [121, 52.812]
  - - [800, 256, 64, 256]
    - [312, 52.776]
  - - [1120, 256, 49, 256]
    - [312, 56.191]
  - - [2408, 256, 64, 256]
    - [160, 64.298]
  - - [3456, 256, 2, 1024]
    - [482, 58.071]
  - - [672, 256, 64, 256]
    - [478, 49.581]
  - - [3456, 1024, 2, 256]
    - [395, 56.522]
  - - [1064, 256, 49, 256]
    - [160, 50.197]
  - - [3400, 256, 2, 1024]
    - [483, 48.353]
  - - [704, 256, 64, 256]
    - [362, 51.942]
  - - [3400, 1024, 2, 256]
    - [192, 47.392]
  - - [3264, 256, 64, 256]
    - [210, 69.895]
  - - [3800, 1024, 2, 256]
    - [467, 55.325]
  - - [3800, 256, 2, 1024]
    - [484, 58.447]
  - - [6440, 512, 1, 256]
    - [478, 36.572]
  - - [6912, 512, 1, 256]
    - [359, 46.078]
  - - [6800, 512, 1, 256]
    - [473, 38.261]
  - - [6800, 512, 1, 1024]
    - [485, 56.358]
  - - [6440, 512, 1, 1024]
    - [383, 53.829]
  - - [6912, 512, 1, 1024]
    - [486, 71.097]
  - - [1728, 1024, 1, 512]
    - [487, 41.561]
  - - [1536, 1024, 1, 512]
    - [312, 33.2]
  - - [7600, 512, 1, 1024]
    - [303, 75.484]
  - - [6144, 512, 1, 1024]
    - [488, 55.11]
  - - [1728, 1024, 1, 2048]
    - [304, 61.886]
  - - [1536, 1024, 1, 2048]
    - [479, 53.927]
  - - [1024, 320, 1, 1024]
    - [489, 16.882]
  - - [173280, 64, 1, 128]
    - [490, 23.596]
  - - [25992, 64, 1, 128]
    - [491, 16.468]
  - - [4524, 256, 49, 256]
    - [551, 64.13]
  - - [2666, 256, 64, 256]
    - [552, 61.018]
  - - [950, 2048, 2, 512]
    - [553, 43.562]
  - - [3220, 1024, 2, 256]
    - [554, 41.907]
  - - [782, 128, 64, 128]
    - [555, 25.837]
  - - [850, 2048, 2, 512]
    - [556, 43.33]
  - - [713, 512, 2, 2048]
    - [557, 33.238]
  - - [805, 2048, 2, 512]
    - [558, 40.93]
  - - [713, 2048, 2, 512]
    - [531, 38.338]
  - - [660, 512, 2, 2048]
    - [559, 32.545]
  - - [726, 512, 2, 2048]
    - [560, 33.29]
  - - [660, 2048, 2, 512]
    - [561, 37.874]
  - - [726, 2048, 2, 512]
    - [547, 39.36]
  - - [748, 512, 2, 2048]
    - [562, 33.748]
  - - [805, 2048, 2, 256]
    - [563, 30.618]
  - - [1251, 256, 49, 256]
    - [564, 47.71]
  - - [805, 512, 2, 2048]
    - [549, 34.722]
  - - [850, 512, 2, 2048]
    - [565, 36.423]
  - - [850, 256, 2, 3]
    - [495, 0.21]
  - - [805, 256, 2, 12]
    - [566, 0.759]
  - - [228, 256, 2, 12]
    - [567, 0.262]
  - - [228, 256, 2, 3]
    - [568, 0.073]
  - - [805, 256, 2, 3]
    - [569, 0.203]
  - - [850, 256, 2, 12]
    - [570, 0.788]
  - - [187, 256, 2, 12]
    - [571, 0.176]
  - - [247, 256, 2, 12]
    - [572, 0.254]
  - - [950, 256, 2, 12]
    - [498, 0.895]
  - - [950, 256, 2, 3]
    - [569, 0.231]
  - - [1900, 1024, 1, 2048]
    - [573, 56.584]
  - - [1610, 1024, 1, 2048]
    - [574, 50.882]
  - - [1900, 1024, 1, 512]
    - [575, 41.804]
  - - [3220, 256, 2, 12]
    - [576, 2.128]
  - - [187, 256, 2, 3]
    - [577, 0.043]
  - - [221, 256, 2, 3]
    - [572, 0.066]
  - - [221, 256, 2, 12]
    - [578, 0.235]
  - - [247, 256, 2, 3]
    - [579, 0.074]
  - - [3220, 256, 2, 3]
    - [576, 0.564]
  - - [3036, 1024, 2, 256]
    - [580, 39.408]
  - - [3036, 256, 2, 1024]
    - [581, 37.522]
  - - [850, 2048, 2, 256]
    - [582, 32.205]
  - - [2852, 1024, 2, 256]
    - [583, 38.979]
  - - [950, 2048, 2, 256]
    - [584, 31.601]
  - - [3700, 1024, 2, 256]
    - [585, 44.604]
  - - [2852, 256, 2, 1024]
    - [586, 41.036]
  - - [3700, 256, 2, 1024]
    - [587, 47.523]
  - - [1269, 256, 49, 256]
    - [547, 46.114]
  - - [1467, 256, 49, 256]
    - [585, 49.703]
  - - [3500, 256, 2, 1024]
    - [588, 52.038]
  - - [1449, 256, 49, 256]
    - [589, 50.752]
  - - [1278, 256, 49, 256]
    - [564, 46.61]
  - - [1413, 256, 49, 256]
    - [552, 52.231]
  - - [1341, 256, 49, 256]
    - [555, 49.086]
  - - [1287, 256, 49, 256]
    - [551, 48.958]
  - - [1332, 256, 49, 256]
    - [554, 49.419]
  - - [1359, 256, 49, 256]
    - [585, 48.105]
  - - [1395, 256, 49, 256]
    - [590, 48.466]
  - - [1323, 256, 49, 256]
    - [590, 48.251]
  - - [1404, 256, 49, 256]
    - [564, 49.815]
  - - [1386, 256, 49, 256]
    - [555, 49.645]
  - - [1350, 256, 49, 256]
    - [588, 48.471]
  - - [3500, 1024, 2, 256]
    - [591, 44.374]
  - - [3220, 256, 2, 1024]
    - [590, 45.011]
  - - [690, 256, 64, 256]
    - [540, 43.403]
  - - [660, 256, 64, 256]
    - [574, 43.983]
  - - [782, 256, 64, 256]
    - [540, 46.507]
  - - [884, 256, 64, 256]
    - [590, 46.953]
  - - [1610, 1024, 1, 512]
    - [592, 29.697]
  - - [1700, 1024, 1, 512]
    - [593, 31.475]
  - - [1700, 1024, 1, 2048]
    - [594, 57.13]
  - - [100, 512, 120, 128]
    - [595, 19.216]
  - - [100, 512, 18, 128]
    - [596, 10.128]
  - - [100, 512, 19, 128]
    - [140, 10.498]
  - - [1444, 128, 120, 256]
    - [547, 45.416]
  - - [1444, 128, 18, 256]
    - [547, 36.395]
  - - [1444, 128, 19, 256]
    - [555, 38.07]
  - - [1444, 256, 120, 256]
    - [589, 59.371]
  - - [1444, 256, 18, 256]
    - [555, 43.318]
  - - [1444, 256, 19, 256]
    - [552, 44.515]
  - - [25, 256, 120, 128]
    - [597, 6.865]
  - - [25, 256, 18, 128]
    - [598, 2.0]
  - - [25, 256, 19, 128]
    - [598, 2.111]
  - - [361, 512, 120, 256]
    - [599, 45.926]
  - - [361, 512, 18, 256]
    - [600, 30.306]
  - - [361, 512, 19, 256]
    - [601, 31.749]
  - - [9, 256, 120, 128]
    - [602, 2.855]
  - - [9, 256, 18, 128]
    - [603, 0.764]
  - - [9, 256, 19, 128]
    - [604, 0.807]
  - - [100, 2304, 1, 512]
    - [605, 7.666]
  - - [1444, 576, 1, 128]
    - [606, 9.768]
  - - [25, 1152, 1, 256]
    - [494, 0.719]
  - - [27436, 64, 1, 128]
    - [607, 14.607]
  - - [361, 2304, 1, 512]
    - [534, 23.306]
  - - [9, 1152, 1, 256]
    - [608, 0.276]
  - - [96, 1024, 160, 1024]
    - [609, 53.85]
  - - [1024, 96, 160, 1024]
    - [610, 54.93]
  - - [1920, 25216, 1, 16384]
    - [611, 94.072]
  - - [3840, 1920, 1, 16384]
    - [612, 89.86]
  - - [1920, 3840, 1, 16384]
    - [613, 89.775]
  - - [960, 1920, 1, 16384]
    - [614, 79.857]
  - - [1920, 2880, 1, 16384]
    - [615, 89.823]
  - - [96, 1024, 40, 1024]
    - [616, 48.621]
  - - [1024, 96, 40, 1024]
    - [617, 50.921]
  - - [1920, 25216, 1, 4096]
    - [618, 91.056]
  - - [3840, 1920, 1, 4096]
    - [619, 86.585]
  - - [1920, 3840, 1, 4096]
    - [620, 86.452]
  - - [960, 1920, 1, 4096]
    - [621, 71.079]
  - - [1920, 2880, 1, 4096]
    - [622, 86.408]
  - - [96, 1024, 80, 1024]
    - [623, 50.376]
  - - [1024, 96, 80, 1024]
    - [624, 52.887]
  - - [1920, 25216, 1, 8192]
    - [618, 92.123]
  - - [3840, 1920, 1, 8192]
    - [619, 88.593]
  - - [1920, 3840, 1, 8192]
    - [612, 88.648]
  - - [960, 1920, 1, 8192]
    - [621, 73.751]
  - - [1920, 2880, 1, 8192]
    - [615, 88.686]
  - - [96, 1024, 96, 1024]
    - [625, 51.384]
  - - [1024, 96, 96, 1024]
    - [626, 53.767]
  - - [2304, 12672, 1, 16384]
    - [615, 95.105]
  - - [2304, 2304, 1, 16384]
    - [627, 86.458]
  - - [576, 2304, 1, 16384]
    - [628, 74.644]
  - - [2304, 1728, 1, 16384]
    - [629, 84.937]
  - - [96, 1024, 24, 1024]
    - [630, 43.986]
  - - [1024, 96, 24, 1024]
    - [631, 46.141]
  - - [2304, 12672, 1, 4096]
    - [615, 92.446]
  - - [2304, 2304, 1, 4096]
    - [615, 83.599]
  - - [576, 2304, 1, 4096]
    - [632, 64.969]
  - - [2304, 1728, 1, 4096]
    - [633, 79.032]
  - - [96, 1024, 48, 1024]
    - [634, 48.258]
  - - [1024, 96, 48, 1024]
    - [610, 48.413]
  - - [2304, 12672, 1, 8192]
    - [615, 94.272]
  - - [2304, 2304, 1, 8192]
    - [635, 85.389]
  - - [576, 2304, 1, 8192]
    - [636, 68.145]
  - - [2304, 1728, 1, 8192]
    - [637, 82.851]
  - - [96, 1024, 16, 1024]
    - [638, 40.194]
  - - [1024, 96, 16, 1024]
    - [639, 34.73]
  - - [3072, 6400, 1, 4096]
    - [640, 92.436]
  - - [1536, 3072, 1, 4096]
    - [641, 87.887]
  - - [3072, 1536, 1, 4096]
    - [640, 87.167]
  - - [384, 3072, 1, 4096]
    - [642, 55.414]
  - - [3072, 1152, 1, 4096]
    - [643, 81.572]
  - - [96, 1024, 32, 1024]
    - [644, 42.881]
  - - [1024, 96, 32, 1024]
    - [631, 47.473]
  - - [3072, 6400, 1, 8192]
    - [645, 94.493]
  - - [1536, 3072, 1, 8192]
    - [641, 89.919]
  - - [3072, 1536, 1, 8192]
    - [640, 89.83]
  - - [384, 3072, 1, 8192]
    - [646, 66.989]
  - - [3072, 1152, 1, 8192]
    - [643, 83.996]
  - - [2048, 2, 1, 8]
    - [647, 0.007]
  - - [2048, 2048, 1, 4096]
    - [648, 77.184]
  - - [2048, 2048, 1, 8]
    - [649, 3.079]
  - - [2048, 29000, 1, 199]
    - [650, 55.749]
  - - [2048, 29000, 1, 221]
    - [650, 56.605]
  - - [2048, 29000, 1, 224]
    - [651, 63.328]
  - - [2048, 29000, 1, 229]
    - [650, 59.393]
  - - [2048, 29000, 1, 234]
    - [650, 58.011]
  - - [2048, 29000, 1, 242]
    - [652, 60.918]
  - - [2048, 29000, 1, 246]
    - [653, 61.122]
  - - [2048, 29000, 1, 247]
    - [652, 61.043]
  - - [2048, 29000, 1, 256]
    - [653, 66.027]
  - - [2048, 29000, 1, 262]
    - [652, 62.472]
  - - [2048, 29000, 1, 264]
    - [654, 62.734]
  - - [2048, 29000, 1, 265]
    - [655, 61.294]
  - - [2048, 29000, 1, 274]
    - [656, 63.087]
  - - [2048, 29000, 1, 277]
    - [655, 63.41]
  - - [2048, 29000, 1, 279]
    - [657, 63.476]
  - - [2048, 29000, 1, 288]
    - [656, 68.204]
  - - [2048, 29000, 1, 296]
    - [651, 64.619]
  - - [2048, 29000, 1, 315]
    - [651, 65.426]
  - - [2048, 29000, 1, 335]
    - [657, 65.98]
  - - [2048, 4096, 1, 4096]
    - [658, 77.538]
  - - [4096, 2048, 1, 4096]
    - [641, 76.089]
  - - [1024, 29000, 1, 2283]
    - [634, 86.238]
  - - [1024, 29000, 1, 2296]
    - [645, 86.482]
  - - [1024, 29000, 1, 2306]
    - [645, 86.217]
  - - [1024, 29000, 1, 2309]
    - [657, 86.306]
  - - [1024, 29000, 1, 2318]
    - [657, 86.677]
  - - [1024, 29000, 1, 2320]
    - [657, 87.021]
  - - [1024, 29000, 1, 2324]
    - [657, 86.217]
  - - [1024, 29000, 1, 2325]
    - [634, 86.624]
  - - [1024, 29000, 1, 2329]
    - [645, 86.115]
  - - [1024, 29000, 1, 2338]
    - [645, 86.207]
  - - [1024, 29000, 1, 2345]
    - [645, 86.271]
  - - [1024, 29000, 1, 2350]
    - [634, 86.42]
  - - [1024, 29000, 1, 2362]
    - [645, 86.11]
  - - [1024, 29000, 1, 2366]
    - [634, 86.505]
  - - [1024, 29000, 1, 2368]
    - [634, 87.487]
  - - [1024, 29000, 1, 2374]
    - [645, 86.332]
  - - [1024, 29000, 1, 2390]
    - [634, 86.834]
  - - [512, 64, 320, 512]
    - [660, 34.225]
  - - [64, 512, 320, 512]
    - [661, 34.746]
  - - [1024, 1024, 1, 20]
    - [662, 2.886]
  - - [1024, 2, 1, 20]
    - [663, 0.006]
  - - [1024, 29000, 1, 561]
    - [657, 74.882]
  - - [1024, 29000, 1, 574]
    - [657, 72.18]
  - - [1024, 29000, 1, 600]
    - [664, 74.672]
  - - [1024, 29000, 1, 608]
    - [654, 75.974]
  - - [1024, 29000, 1, 615]
    - [665, 74.342]
  - - [1024, 29000, 1, 622]
    - [655, 73.839]
  - - [1024, 29000, 1, 625]
    - [665, 74.195]
  - - [1024, 29000, 1, 626]
    - [665, 74.282]
  - - [1024, 29000, 1, 628]
    - [634, 74.551]
  - - [1024, 29000, 1, 636]
    - [634, 74.015]
  - - [1024, 29000, 1, 651]
    - [664, 75.007]
  - - [1024, 29000, 1, 658]
    - [634, 75.344]
  - - [1024, 29000, 1, 669]
    - [634, 75.028]
  - - [1024, 29000, 1, 670]
    - [655, 75.079]
  - - [1024, 29000, 1, 672]
    - [634, 79.945]
  - - [1024, 29000, 1, 684]
    - [634, 75.133]
  - - [1024, 29000, 1, 716]
    - [634, 75.687]
  - - [1024, 29000, 1, 730]
    - [634, 76.038]
  - - [512, 64, 80, 512]
    - [666, 30.71]
  - - [2560, 2, 1, 2]
    - [647, 0.002]
  - - [2560, 2560, 1, 1024]
    - [667, 70.964]
  - - [2560, 2560, 1, 2]
    - [668, 0.951]
  - - [2560, 29000, 1, 109]
    - [669, 40.389]
  - - [2560, 29000, 1, 121]
    - [670, 43.378]
  - - [2560, 29000, 1, 27]
    - [671, 13.968]
  - - [2560, 29000, 1, 35]
    - [672, 18.12]
  - - [2560, 29000, 1, 36]
    - [673, 18.418]
  - - [2560, 29000, 1, 39]
    - [674, 19.721]
  - - [2560, 29000, 1, 40]
    - [626, 20.197]
  - - [2560, 29000, 1, 42]
    - [674, 20.448]
  - - [2560, 29000, 1, 43]
    - [675, 20.804]
  - - [2560, 29000, 1, 44]
    - [626, 21.199]
  - - [2560, 29000, 1, 46]
    - [674, 22.086]
  - - [2560, 29000, 1, 48]
    - [676, 28.047]
  - - [2560, 29000, 1, 49]
    - [677, 24.457]
  - - [2560, 29000, 1, 50]
    - [677, 24.672]
  - - [2560, 29000, 1, 51]
    - [677, 24.918]
  - - [2560, 29000, 1, 53]
    - [678, 25.607]
  - - [2560, 29000, 1, 54]
    - [677, 25.838]
  - - [2560, 29000, 1, 55]
    - [677, 26.03]
  - - [2560, 29000, 1, 56]
    - [677, 26.395]
  - - [2560, 29000, 1, 57]
    - [631, 26.157]
  - - [2560, 29000, 1, 58]
    - [626, 26.493]
  - - [2560, 29000, 1, 59]
    - [631, 26.933]
  - - [2560, 29000, 1, 61]
    - [626, 27.538]
  - - [2560, 29000, 1, 63]
    - [674, 28.239]
  - - [2560, 29000, 1, 65]
    - [679, 29.516]
  - - [2560, 29000, 1, 66]
    - [670, 30.029]
  - - [2560, 29000, 1, 67]
    - [677, 30.07]
  - - [2560, 29000, 1, 69]
    - [677, 30.671]
  - - [2560, 29000, 1, 70]
    - [677, 31.016]
  - - [2560, 29000, 1, 71]
    - [678, 31.142]
  - - [2560, 29000, 1, 73]
    - [678, 31.134]
  - - [2560, 29000, 1, 74]
    - [677, 31.349]
  - - [2560, 29000, 1, 75]
    - [677, 31.734]
  - - [2560, 29000, 1, 77]
    - [677, 32.501]
  - - [2560, 29000, 1, 78]
    - [677, 32.587]
  - - [2560, 29000, 1, 80]
    - [680, 40.247]
  - - [2560, 29000, 1, 81]
    - [670, 34.976]
  - - [2560, 29000, 1, 82]
    - [670, 34.865]
  - - [2560, 29000, 1, 83]
    - [681, 35.291]
  - - [2560, 29000, 1, 84]
    - [679, 35.093]
  - - [2560, 29000, 1, 88]
    - [682, 36.049]
  - - [2560, 29000, 1, 89]
    - [677, 35.073]
  - - [2560, 29000, 1, 90]
    - [677, 35.447]
  - - [2560, 29000, 1, 92]
    - [677, 35.95]
  - - [2560, 29000, 1, 95]
    - [677, 36.647]
  - - [2560, 29000, 1, 98]
    - [679, 40.122]
  - - [2560, 4096, 1, 1024]
    - [681, 74.159]
  - - [4096, 2560, 1, 1024]
    - [683, 76.125]
  - - [1024, 64, 512, 1024]
    - [666, 41.357]
  - - [64, 1024, 512, 1024]
    - [684, 41.544]
  - - [1024, 3072, 1, 32768]
    - [685, 76.137]
  - - [1024, 4096, 1, 32768]
    - [658, 81.128]
  - - [1024, 50304, 1, 32768]
    - [615, 93.707]
  - - [4096, 1024, 1, 32768]
    - [686, 80.152]
  - - [1024, 128, 24, 1024]
    - [687, 55.824]
  - - [128, 1024, 24, 1024]
    - [688, 56.558]
- null
