library/src/blas3/Tensile/Logic/asm_full/arcturus_Cijk_Alik_Bjlk_SB_GB.yaml
- {MinimumRequiredVersion: 4.25.0}
- arcturus
- gfx908
- [Device 7380, Device 7388, Device 738c, Device 7390]
    SolutionIndex: 0
    SolutionNameMin: Cijk_Alik_Bjlk_SB_GB_MT32x32x32_MI16x16x4x1_SN_1LDSB0_EPS0_GRVW2_LPA2_NLCB1_PGR2_PLR9_SU0_SUS128_SRVW2_TT1_16_WG32_8_1_WGM1
    SolutionIndex: 1
    SolutionNameMin: Cijk_Alik_Bjlk_SB_GB_MT64x64x16_MI32x32x2x1_SN_1LDSB0_EPS0_GRVW4_LPA4_NLCB1_PGR2_PLR9_SU0_SUS128_SRVW2_TT1_32_WG64_4_1_WGM1
    SolutionIndex: 2
    SolutionNameMin: Cijk_Alik_Bjlk_SB_GB_MT32x32x32_MI16x16x4x1_SN_1LDSB0_EPS0_GRVW4_LPA4_NLCB1_PGR2_PLR9_SU0_SUS128_SRVW2_TT1_16_WG32_8_1_WGM1
    SolutionIndex: 3
    SolutionNameMin: Cijk_Alik_Bjlk_SB_GB_MT32x32x32_MI16x16x4x1_SN_1LDSB0_EPS0_GRVW2_LPA2_NLCB1_PGR2_PLR9_SU0_SUS256_SRVW2_TT1_16_WG32_8_1_WGM1
    SolutionIndex: 4
    SolutionNameMin: Cijk_Alik_Bjlk_SB_GB_MT32x32x32_MI16x16x4x1_SN_1LDSB0_EPS0_GRVW4_LPA4_NLCB1_PGR2_PLR9_SU0_SUS256_SRVW2_TT1_16_WG32_8_1_WGM1
    SolutionIndex: 5
    SolutionNameMin: Cijk_Alik_Bjlk_SB_GB_MT32x64x16_MI16x16x4x1_SN_1LDSB0_EPS0_GRVW4_LPA4_NLCB1_PGR2_PLR5_SU32_SUS128_SRVW2_TT1_32_WG32_8_1_WGM1
    SolutionIndex: 6
    SolutionNameMin: Cijk_Alik_Bjlk_SB_GB_MT32x32x32_MI16x16x4x1_SN_1LDSB0_EPS0_GRVW4_LPA4_NLCB1_PGR2_PLR9_SU0_SUS128_SRVW2_TT1_16_WG32_8_1_WGM2
    SolutionIndex: 7
    SolutionNameMin: Cijk_Alik_Bjlk_SB_GB_MT32x32x32_MI16x16x4x1_SN_1LDSB0_EPS0_GRVW4_LPA4_NLCB1_PGR2_PLR9_SU0_SUS256_SRVW2_TT1_16_WG32_8_1_WGM2
    SolutionIndex: 8
    SolutionNameMin: Cijk_Alik_Bjlk_SB_GB_MT32x64x16_MI16x16x4x1_SN_1LDSB0_EPS0_GRVW4_LPA4_NLCB1_PGR2_PLR5_SU0_SUS128_SRVW2_TT1_32_WG32_8_1_WGM15
    SolutionIndex: 9
    SolutionNameMin: Cijk_Alik_Bjlk_SB_GB_MT32x32x32_MI16x16x4x1_SN_1LDSB0_EPS0_GRVW4_LPA4_NLCB1_PGR2_PLR9_SU0_SUS128_SRVW2_TT1_16_WG32_8_1_WGM15
    SolutionIndex: 10
    SolutionNameMin: Cijk_Alik_Bjlk_SB_GB_MT32x64x16_MI16x16x4x1_SN_1LDSB0_EPS0_GRVW4_LPA4_NLCB1_PGR2_PLR5_SU0_SUS256_SRVW2_TT1_32_WG32_8_1_WGM15
    SolutionIndex: 11
    SolutionNameMin: Cijk_Alik_Bjlk_SB_GB_MT32x32x32_MI16x16x4x1_SN_1LDSB0_EPS0_GRVW4_LPA4_NLCB1_PGR2_PLR9_SU0_SUS256_SRVW2_TT1_16_WG32_8_1_WGM15
    SolutionIndex: 12
    SolutionNameMin: Cijk_Alik_Bjlk_SB_GB_MT64x64x16_MI32x32x2x1_SN_1LDSB0_EPS0_GRVW4_LPA4_NLCB1_PGR2_PLR9_SU32_SUS128_SRVW2_TT1_32_WG64_4_1_WGM15
- - - [32, 32, 8, 128, 32, 32, 128, 32]
    - [4, 160.0]
  - - [128, 128, 8, 128, 128, 128, 128, 128]
    - [2, 2411.0]
  - - [256, 256, 8, 128, 256, 256, 128, 256]
    - [5, 6503.0]
  - - [512, 512, 8, 128, 512, 512, 128, 512]
    - [1, 12291.0]
  - - [32, 32, 8, 512, 32, 32, 512, 32]
    - [6, 383.0]
  - - [128, 128, 8, 512, 128, 128, 512, 128]
    - [2, 5592.0]
  - - [256, 256, 8, 512, 256, 256, 512, 256]
    - [8, 11298.0]
  - - [512, 512, 8, 512, 512, 512, 512, 512]
    - [12, 17660.0]
  - - [32, 32, 8, 1024, 32, 32, 1024, 32]
    - [2, 509.0]
  - - [128, 128, 8, 1024, 128, 128, 1024, 128]
    - [4, 7358.0]
  - - [256, 256, 8, 1024, 256, 256, 1024, 256]
    - [10, 13031.0]
  - - [512, 512, 8, 1024, 512, 512, 1024, 512]
    - [12, 19051.0]
  - - [32, 128, 8, 128, 32, 32, 128, 128]
    - [3, 617.0]
  - - [32, 256, 8, 128, 32, 32, 128, 256]
    - [4, 1263.0]
  - - [32, 512, 8, 128, 32, 32, 128, 512]
    - [0, 2356.0]
  - - [32, 128, 8, 512, 32, 32, 512, 128]
    - [2, 1638.0]
  - - [32, 256, 8, 512, 32, 32, 512, 256]
    - [9, 3303.0]
  - - [32, 512, 8, 512, 32, 32, 512, 512]
    - [11, 5412.0]
  - - [32, 128, 8, 1024, 32, 32, 1024, 128]
    - [2, 2255.0]
  - - [32, 256, 8, 1024, 32, 32, 1024, 256]
    - [4, 4392.0]
  - - [32, 512, 8, 1024, 32, 32, 1024, 512]
    - [4, 6658.0]
  - - [128, 32, 8, 128, 128, 128, 128, 32]
    - [2, 624.0]
  - - [256, 32, 8, 128, 256, 256, 128, 32]
    - [2, 1248.0]
  - - [512, 32, 8, 128, 512, 512, 128, 32]
    - [2, 2305.0]
  - - [128, 32, 8, 512, 128, 128, 512, 32]
    - [2, 1577.0]
  - - [256, 32, 8, 512, 256, 256, 512, 32]
    - [2, 3277.0]
  - - [512, 32, 8, 512, 512, 512, 512, 32]
    - [6, 5519.0]
  - - [128, 32, 8, 1024, 128, 128, 1024, 32]
    - [7, 2162.0]
  - - [256, 32, 8, 1024, 256, 256, 1024, 32]
    - [4, 4324.0]
  - - [512, 32, 8, 1024, 512, 512, 1024, 32]
    - [2, 7170.0]
- null
