library/src/blas3/Tensile/Logic/asm_full/arcturus_Cijk_Ailk_Bljk_HBH.yaml
- {MinimumRequiredVersion: 4.6.0}
- arcturus
- gfx908
- [Device 7380, Device 7388, Device 738c, Device 7390]
    SolutionIndex: 0
    SolutionNameMin: Cijk_Ailk_Bljk_HBH_MT128x96x64_MI32x32x8x1_SE_1LDSB0_AF0EM8_AMAS3_BL1_EPS0_GRVW8_GSU1_ISA908_KLA_LBSPP128_LPB8_LRVW8_MAC_NLCA1_PGR2_PLR9_SIA3_SU0_SUS256_SRVW4_TT1_96_TLDS1_USFGROn1_VAW2_VSn1_VW2_WSGRA1_WSGRB1_WG128_2_1_WGM15
    SolutionIndex: 1
    SolutionNameMin: Cijk_Ailk_Bljk_HBH_MT128x256x32_MI32x32x8x1_SN_1LDSB1_AF0EM8_AMAS3_BL1_EPS0_GRVW8_GSU1_ISA908_KLA_LBSPP128_LPB8_LRVW8_MAC_NLCA1_PGR2_PLR5_SIA3_SU0_SUS256_SRVW4_TT2_128_TLDS1_USFGROn1_VAW2_VSn1_VW2_WSGRA1_WSGRB1_WG64_4_1_WGM1
    SolutionIndex: 2
    SolutionNameMin: Cijk_Ailk_Bljk_HBH_MT32x64x64_MI16x16x16x1_SE_1LDSB0_AF0EM8_AMAS3_BL1_EPS0_GRVW8_GSU1_ISA908_KLA_LBSPP128_LPB16_LRVW8_MAC_NLCA1_PGR2_PLR5_SIA3_SU32_SUS256_SRVW4_TT1_32_TLDS1_USFGROn1_VAW2_VSn1_VW2_WSGRA1_WSGRB1_WG32_8_1_WGM15
    SolutionIndex: 3
    SolutionNameMin: Cijk_Ailk_Bljk_HBH_MT128x160x32_MI32x32x8x1_SE_1LDSB1_AF0EM8_AMAS3_BL1_EPS1_GRVW2_GSU1_ISA908_KLA_LBSPP128_LPB8_LRVW8_MAC_NLCA1_PGR1_PLR5_SIA3_SU32_SUS256_SRVW4_TT1_160_TLDS1_USFGROn1_VAW2_VSn1_VW2_WSGRA1_WSGRB1_WG128_2_1_WGM2
    SolutionIndex: 4
    SolutionNameMin: Cijk_Ailk_Bljk_HBH_MT32x64x64_MI16x16x16x1_SE_1LDSB0_AF0EM8_AMAS3_BL1_EPS0_GRVW8_GSU1_ISA908_KLA_LBSPP128_LPB16_LRVW8_MAC_NLCA1_PGR2_PLR5_SIA3_SU32_SUS256_SRVW4_TT1_32_TLDS1_USFGROn1_VAW2_VSn1_VW2_WSGRA1_WSGRB1_WG32_8_1_WGM1
    SolutionIndex: 5
    SolutionNameMin: Cijk_Ailk_Bljk_HBH_MT64x128x64_MI32x32x8x1_SE_1LDSB0_AF0EM8_AMAS3_BL1_EPS0_GRVW8_GSU1_ISA908_KLA_LBSPP128_LPB8_LRVW8_MAC_NLCA1_PGR2_PLR9_SIA3_SU0_SUS256_SRVW4_TT1_64_TLDS1_USFGROn1_VAW2_VSn1_VW2_WSGRA1_WSGRB1_WG64_4_1_WGM2
    SolutionIndex: 6
    SolutionNameMin: Cijk_Ailk_Bljk_HBH_MT256x128x32_MI32x32x8x1_SE_1LDSB1_AF0EM8_AMAS3_BL1_EPS0_GRVW8_GSU1_ISA908_KLA_LBSPP128_LPB8_LRVW8_MAC_NLCA1_PGR2_PLR5_SIA3_SU0_SUS256_SRVW4_TT4_64_TLDS1_USFGROn1_VAW2_VSn1_VW2_WSGRA1_WSGRB1_WG64_4_1_WGM15
    SolutionIndex: 7
    SolutionNameMin: Cijk_Ailk_Bljk_HBH_MT192x128x32_MI32x32x8x1_SE_1LDSB0_AF0EM8_AMAS3_BL1_EPS0_GRVW4_GSU1_ISA908_KLA_LBSPP128_LPB8_LRVW8_MAC_NLCA3_PGR2_PLR5_SIA3_SU0_SUS256_SRVW0_TT3_64_TLDS1_USFGROn1_VAW2_VSn1_VW2_WSGRA1_WSGRB1_WG64_4_1_WGM1
    SolutionIndex: 8
    SolutionNameMin: Cijk_Ailk_Bljk_HBH_MT128x96x32_MI32x32x8x1_SE_1LDSB1_AF0EM8_AMAS3_BL1_EPS1_GRVW2_GSU1_ISA908_KLA_LBSPP128_LPB8_LRVW8_MAC_NLCA1_PGR1_PLR5_SIA3_SU32_SUS128_SRVW4_TT1_96_TLDS1_USFGROn1_VAW2_VSn1_VW2_WSGRA1_WSGRB1_WG128_2_1_WGM1
    SolutionIndex: 9
    SolutionNameMin: Cijk_Ailk_Bljk_HBH_MT128x96x32_MI32x32x8x1_SE_1LDSB0_AF0EM8_AMAS3_BL1_EPS1_GRVW4_GSU1_ISA908_KLA_LBSPP128_LPB8_LRVW8_MAC_NLCA1_PGR1_PLR5_SIA3_SU0_SUS256_SRVW4_TT1_96_TLDS1_USFGROn1_VAW2_VSn1_VW2_WSGRA1_WSGRB1_WG128_2_1_WGM15
    SolutionIndex: 10
    SolutionNameMin: Cijk_Ailk_Bljk_HBH_MT128x256x32_MI32x32x8x1_SE_1LDSB1_AF0EM8_AMAS3_BL1_EPS1_GRVW8_GSU1_ISA908_KLA_LBSPP128_LPB8_LRVW8_MAC_NLCA1_PGR1_PLR5_SIA3_SU0_SUS256_SRVW4_TT2_128_TLDS1_USFGROn1_VAW2_VSn1_VW2_WSGRA1_WSGRB1_WG64_4_1_WGM15
    SolutionIndex: 11
    SolutionNameMin: Cijk_Ailk_Bljk_HBH_MT128x128x32_MI32x32x8x1_SE_1LDSB0_AF0EM8_AMAS3_BL1_EPS0_GRVW8_GSU1_ISA908_KLA_LBSPP128_LPB8_LRVW8_MAC_NLCA1_PGR2_PLR5_SIA3_SU0_SUS256_SRVW4_TT2_64_TLDS1_USFGROn1_VAW2_VSn1_VW2_WSGRA1_WSGRB1_WG64_4_1_WGM1
    SolutionIndex: 12
    SolutionNameMin: Cijk_Ailk_Bljk_HBH_MT288x128x32_MI32x32x8x1_SE_1LDSB0_AF0EM8_AMAS3_BL1_EPS1_GRVW4_GSU1_ISA908_KLA_LBSPP128_LPB8_LRVW8_MAC_NLCA9_PGR1_PLR5_SIA3_SU32_SUS128_SRVW0_TT9_32_TLDS1_USFGROn1_VAW2_VSn1_VW2_WSGRA1_WSGRB1_WG32_8_1_WGM1
    SolutionIndex: 13
    SolutionNameMin: Cijk_Ailk_Bljk_HBH_MT128x96x64_MI32x32x8x1_SE_1LDSB0_AF0EM8_AMAS3_BL1_EPS0_GRVW8_GSU1_ISA908_KLA_LBSPP128_LPB8_LRVW8_MAC_NLCA1_PGR2_PLR9_SIA3_SU0_SUS256_SRVW4_TT1_96_TLDS1_USFGROn1_VAW2_VSn1_VW2_WSGRA1_WSGRB1_WG128_2_1_WGM1
    SolutionIndex: 14
    SolutionNameMin: Cijk_Ailk_Bljk_HBH_MT128x96x32_MI32x32x8x1_SE_1LDSB0_AF0EM8_AMAS3_BL1_EPS1_GRVW4_GSU1_ISA908_KLA_LBSPP128_LPB8_LRVW8_MAC_NLCA1_PGR1_PLR5_SIA3_SU32_SUS256_SRVW4_TT1_96_TLDS1_USFGROn1_VAW2_VSn1_VW2_WSGRA1_WSGRB1_WG128_2_1_WGM15
    SolutionIndex: 15
    SolutionNameMin: Cijk_Ailk_Bljk_HBH_MT128x256x32_MI32x32x8x1_SN_1LDSB1_AF0EM8_AMAS3_BL1_EPS0_GRVW8_GSU1_ISA908_KLA_LBSPP128_LPB8_LRVW8_MAC_NLCA1_PGR2_PLR5_SIA3_SU0_SUS256_SRVW4_TT2_128_TLDS1_USFGROn1_VAW2_VSn1_VW2_WSGRA1_WSGRB1_WG64_4_1_WGM2
    SolutionIndex: 16
    SolutionNameMin: Cijk_Ailk_Bljk_HBH_MT32x32x64_MI16x16x16x1_SE_1LDSB0_AF0EM8_AMAS3_BL1_EPS0_GRVW8_GSU1_ISA908_KLA_LBSPP128_LPB16_LRVW8_MAC_NLCA1_PGR2_PLR5_SIA3_SU0_SUS256_SRVW4_TT1_16_TLDS1_USFGROn1_VAW2_VSn1_VW2_WSGRA1_WSGRB1_WG32_8_1_WGM1
    SolutionIndex: 17
    SolutionNameMin: Cijk_Ailk_Bljk_HBH_MT64x64x64_MI32x32x8x1_SN_1LDSB0_AF0EM8_AMAS3_BL1_EPS0_GRVW8_GSU1_ISA908_KLA_LBSPP128_LPB8_LRVW8_MAC_NLCA1_PGR2_PLR9_SIA3_SU0_SUS256_SRVW4_TT1_32_TLDS1_USFGROn1_VAW2_VSn1_VW2_WSGRA1_WSGRB1_WG64_4_1_WGM1
    SolutionIndex: 18
    SolutionNameMin: Cijk_Ailk_Bljk_HBH_MT128x256x32_MI32x32x8x1_SE_1LDSB1_AF0EM8_AMAS3_BL1_EPS0_GRVW8_GSU1_ISA908_KLA_LBSPP128_LPB8_LRVW8_MAC_NLCA1_PGR2_PLR5_SIA3_SU32_SUS128_SRVW4_TT2_128_TLDS1_USFGROn1_VAW2_VSn1_VW2_WSGRA1_WSGRB1_WG64_4_1_WGM1
    SolutionIndex: 19
    SolutionNameMin: Cijk_Ailk_Bljk_HBH_MT128x256x32_MI32x32x8x1_SE_1LDSB1_AF0EM8_AMAS3_BL1_EPS1_GRVW8_GSU1_ISA908_KLA_LBSPP128_LPB8_LRVW8_MAC_NLCA1_PGR1_PLR5_SIA3_SU32_SUS128_SRVW4_TT2_128_TLDS1_USFGROn1_VAW2_VSn1_VW2_WSGRA1_WSGRB1_WG64_4_1_WGM2
    SolutionIndex: 20
    SolutionNameMin: Cijk_Ailk_Bljk_HBH_MT128x64x32_MI32x32x8x1_SE_1LDSB0_AF0EM1_AMAS3_BL1_EPS0_GRVW4_GSU1_ISA908_KLA_LBSPP128_LPB8_LRVW8_MAC_NLCA1_PGR2_PLR5_SIA3_SU0_SUS256_SRVW4_TT2_32_TLDS1_USFGROn1_VAW2_VSn1_VW2_WSGRA1_WSGRB1_WG64_4_1_WGM1
    SolutionIndex: 21
    SolutionNameMin: Cijk_Ailk_Bljk_HBH_MT128x96x32_MI32x32x8x1_SE_1LDSB0_AF0EM8_AMAS3_BL1_EPS0_GRVW4_GSU1_ISA908_KLA_LBSPP128_LPB8_LRVW8_MAC_NLCA1_PGR2_PLR5_SIA3_SU32_SUS128_SRVW4_TT1_96_TLDS1_USFGROn1_VAW2_VSn1_VW2_WSGRA1_WSGRB1_WG128_2_1_WGM1
    SolutionIndex: 22
    SolutionNameMin: Cijk_Ailk_Bljk_HBH_MT256x160x32_MI32x32x8x1_SE_1LDSB0_AF0EM8_AMAS3_BL1_EPS1_GRVW4_GSU1_ISA908_KLA_LBSPP128_LPB8_LRVW8_MAC_NLCA1_PGR1_PLR5_SIA3_SU32_SUS256_SRVW4_TT2_160_TLDS1_USFGROn1_VAW2_VSn1_VW2_WSGRA1_WSGRB1_WG128_2_1_WGM15
    SolutionIndex: 23
    SolutionNameMin: Cijk_Ailk_Bljk_HBH_MT256x128x32_MI32x32x8x1_SE_1LDSB1_AF0EM8_AMAS3_BL1_EPS1_GRVW8_GSU1_ISA908_KLA_LBSPP128_LPB8_LRVW8_MAC_NLCA1_PGR1_PLR5_SIA3_SU32_SUS256_SRVW4_TT4_64_TLDS1_USFGROn1_VAW2_VSn1_VW2_WSGRA1_WSGRB1_WG64_4_1_WGM2
    SolutionIndex: 24
    SolutionNameMin: Cijk_Ailk_Bljk_HBH_MT128x256x32_MI32x32x8x1_SE_1LDSB1_AF0EM8_AMAS3_BL1_EPS0_GRVW8_GSU1_ISA908_KLA_LBSPP128_LPB8_LRVW8_MAC_NLCA1_PGR2_PLR5_SIA3_SU0_SUS256_SRVW4_TT2_128_TLDS1_USFGROn1_VAW2_VSn1_VW2_WSGRA1_WSGRB1_WG64_4_1_WGM2
    SolutionIndex: 25
    SolutionNameMin: Cijk_Ailk_Bljk_HBH_MT256x160x32_MI32x32x8x1_SE_1LDSB0_AF0EM8_AMAS3_BL1_EPS1_GRVW4_GSU1_ISA908_KLA_LBSPP128_LPB8_LRVW8_MAC_NLCA1_PGR1_PLR5_SIA3_SU0_SUS256_SRVW4_TT2_160_TLDS1_USFGROn1_VAW2_VSn1_VW2_WSGRA1_WSGRB1_WG128_2_1_WGM2
    SolutionIndex: 26
    SolutionNameMin: Cijk_Ailk_Bljk_HBH_MT128x256x32_MI32x32x8x1_SE_1LDSB1_AF0EM8_AMAS3_BL1_EPS1_GRVW8_GSU1_ISA908_KLA_LBSPP128_LPB8_LRVW8_MAC_NLCA1_PGR1_PLR5_SIA3_SU0_SUS256_SRVW4_TT2_128_TLDS1_USFGROn1_VAW2_VSn1_VW2_WSGRA1_WSGRB1_WG64_4_1_WGM2
    SolutionIndex: 27
    SolutionNameMin: Cijk_Ailk_Bljk_HBH_MT128x160x32_MI32x32x8x1_SE_1LDSB1_AF0EM8_AMAS3_BL1_EPS1_GRVW2_GSU1_ISA908_KLA_LBSPP128_LPB8_LRVW8_MAC_NLCA1_PGR1_PLR5_SIA3_SU0_SUS256_SRVW4_TT1_160_TLDS1_USFGROn1_VAW2_VSn1_VW2_WSGRA1_WSGRB1_WG128_2_1_WGM15
    SolutionIndex: 28
    SolutionNameMin: Cijk_Ailk_Bljk_HBH_MT16x16x64_MI16x16x16x1_SE_1LDSB0_AF0EM8_AMAS3_BL1_EPS0_GRVW8_GSU1_ISA908_KLA_LBSPP128_LPB16_LRVW8_MAC_NLCA1_PGR2_PLR5_SIA3_SU32_SUS256_SRVW0_TT1_16_TLDS1_USFGROn1_VAW2_VSn1_VW2_WSGRA1_WSGRB1_WG16_4_1_WGM1
    SolutionIndex: 29
    SolutionNameMin: Cijk_Ailk_Bljk_HBH_MT32x64x32_MI16x16x16x1_SE_1LDSB0_AF0EM8_AMAS3_BL1_EPS1_GRVW8_GSU1_ISA908_KLA_LBSPP128_LPB16_LRVW8_MAC_NLCA1_PGR1_PLR2_SIA3_SU0_SUS256_SRVW4_TT1_32_TLDS1_USFGROn1_VAW2_VSn1_VW2_WSGRA1_WSGRB1_WG32_8_1_WGM2
    SolutionIndex: 30
    SolutionNameMin: Cijk_Ailk_Bljk_HBH_MT128x96x32_MI32x32x8x1_SE_1LDSB1_AF0EM8_AMAS3_BL1_EPS1_GRVW2_GSU1_ISA908_KLA_LBSPP128_LPB8_LRVW8_MAC_NLCA1_PGR1_PLR5_SIA3_SU0_SUS256_SRVW4_TT1_96_TLDS1_USFGROn1_VAW2_VSn1_VW2_WSGRA1_WSGRB1_WG128_2_1_WGM1
    SolutionIndex: 31
    SolutionNameMin: Cijk_Ailk_Bljk_HBH_MT64x64x64_MI32x32x8x1_SN_1LDSB0_AF0EM1_AMAS3_BL1_EPS0_GRVW8_GSU1_ISA908_KLA_LBSPP128_LPB8_LRVW8_MAC_NLCA1_PGR2_PLR9_SIA3_SU32_SUS128_SRVW4_TT1_32_TLDS1_USFGROn1_VAW2_VSn1_VW2_WSGRA1_WSGRB1_WG64_4_1_WGM15
    SolutionIndex: 32
    SolutionNameMin: Cijk_Ailk_Bljk_HBH_MT128x160x32_MI32x32x8x1_SN_1LDSB1_AF0EM8_AMAS3_BL1_EPS1_GRVW2_GSU1_ISA908_KLA_LBSPP128_LPB8_LRVW8_MAC_NLCA1_PGR1_PLR5_SIA3_SU32_SUS256_SRVW4_TT1_160_TLDS1_USFGROn1_VAW2_VSn1_VW2_WSGRA1_WSGRB1_WG128_2_1_WGM1
    SolutionIndex: 33
    SolutionNameMin: Cijk_Ailk_Bljk_HBH_MT64x128x64_MI32x32x8x1_SE_1LDSB0_AF0EM8_AMAS3_BL1_EPS0_GRVW8_GSU1_ISA908_KLA_LBSPP128_LPB8_LRVW8_MAC_NLCA1_PGR2_PLR9_SIA3_SU0_SUS256_SRVW4_TT1_64_TLDS1_USFGROn1_VAW2_VSn1_VW2_WSGRA1_WSGRB1_WG64_4_1_WGM1
    SolutionIndex: 34
    SolutionNameMin: Cijk_Ailk_Bljk_HBH_MT32x32x64_MI16x16x16x1_SE_1LDSB0_AF0EM1_AMAS3_BL1_EPS0_GRVW4_GSU1_ISA908_KLA_LBSPP128_LPB16_LRVW8_MAC_NLCA1_PGR2_PLR5_SIA3_SU0_SUS256_SRVW4_TT1_16_TLDS1_USFGROn1_VAW2_VSn1_VW2_WSGRA1_WSGRB1_WG32_8_1_WGM2
    SolutionIndex: 35
    SolutionNameMin: Cijk_Ailk_Bljk_HBH_MT128x256x32_MI32x32x8x1_SE_1LDSB1_AF0EM8_AMAS3_BL1_EPS0_GRVW8_GSU1_ISA908_KLA_LBSPP128_LPB8_LRVW8_MAC_NLCA1_PGR2_PLR5_SIA3_SU32_SUS128_SRVW4_TT2_128_TLDS1_USFGROn1_VAW2_VSn1_VW2_WSGRA1_WSGRB1_WG64_4_1_WGM2
    SolutionIndex: 36
    SolutionNameMin: Cijk_Ailk_Bljk_HBH_MT64x64x64_MI32x32x8x1_SE_1LDSB0_AF0EM8_AMAS3_BL1_EPS1_GRVW8_GSU1_ISA908_KLA_LBSPP128_LPB8_LRVW8_MAC_NLCA1_PGR1_PLR9_SIA3_SU0_SUS256_SRVW4_TT1_32_TLDS1_USFGROn1_VAW2_VSn1_VW2_WSGRA1_WSGRB1_WG64_4_1_WGM1
    SolutionIndex: 37
    SolutionNameMin: Cijk_Ailk_Bljk_HBH_MT128x256x32_MI32x32x8x1_SE_1LDSB1_AF0EM8_AMAS3_BL1_EPS0_GRVW8_GSU1_ISA908_KLA_LBSPP128_LPB8_LRVW8_MAC_NLCA1_PGR2_PLR5_SIA3_SU0_SUS256_SRVW4_TT2_128_TLDS1_USFGROn1_VAW2_VSn1_VW2_WSGRA1_WSGRB1_WG64_4_1_WGM1
    SolutionIndex: 38
    SolutionNameMin: Cijk_Ailk_Bljk_HBH_MT64x64x64_MI32x32x8x1_SE_1LDSB0_AF0EM1_AMAS3_BL1_EPS0_GRVW8_GSU1_ISA908_KLA_LBSPP128_LPB8_LRVW8_MAC_NLCA1_PGR2_PLR9_SIA3_SU0_SUS256_SRVW4_TT1_32_TLDS1_USFGROn1_VAW2_VSn1_VW2_WSGRA1_WSGRB1_WG64_4_1_WGM1
    SolutionIndex: 39
    SolutionNameMin: Cijk_Ailk_Bljk_HBH_MT256x256x32_MI32x32x8x1_SE_1LDSB1_AF0EM8_AMAS3_BL1_EPS1_GRVW8_GSU1_ISA908_KLA_LBSPP128_LPB8_LRVW8_MAC_NLCA1_PGR1_PLR5_SIA3_SU32_SUS256_SRVW4_TT4_128_TLDS1_USFGROn1_VAW2_VSn1_VW2_WSGRA1_WSGRB1_WG64_4_1_WGM1
    SolutionIndex: 40
    SolutionNameMin: Cijk_Ailk_Bljk_HBH_MT128x128x32_MI32x32x8x1_SE_1LDSB0_AF0EM8_AMAS3_BL1_EPS0_GRVW4_GSU1_ISA908_KLA_LBSPP128_LPB8_LRVW8_MAC_NLCA1_PGR2_PLR5_SIA3_SU0_SUS256_SRVW4_TT2_64_TLDS1_USFGROn1_VAW2_VSn1_VW2_WSGRA1_WSGRB1_WG64_4_1_WGM1
    SolutionIndex: 41
    SolutionNameMin: Cijk_Ailk_Bljk_HBH_MT128x256x32_MI32x32x8x1_SE_1LDSB1_AF0EM8_AMAS3_BL1_EPS0_GRVW8_GSU1_ISA908_KLA_LBSPP128_LPB8_LRVW8_MAC_NLCA1_PGR2_PLR5_SIA3_SU0_SUS256_SRVW4_TT2_128_TLDS1_USFGROn1_VAW2_VSn1_VW2_WSGRA1_WSGRB1_WG64_4_1_WGM15
    SolutionIndex: 42
    SolutionNameMin: Cijk_Ailk_Bljk_HBH_MT256x160x32_MI32x32x8x1_SE_1LDSB0_AF0EM8_AMAS3_BL1_EPS0_GRVW4_GSU1_ISA908_KLA_LBSPP128_LPB8_LRVW8_MAC_NLCA1_PGR2_PLR5_SIA3_SU0_SUS256_SRVW4_TT2_160_TLDS1_USFGROn1_VAW2_VSn1_VW2_WSGRA1_WSGRB1_WG128_2_1_WGM2
    SolutionIndex: 43
    SolutionNameMin: Cijk_Ailk_Bljk_HBH_MT16x16x64_MI16x16x16x1_SN_1LDSB0_AF0EM8_AMAS3_BL1_EPS0_GRVW8_GSU1_ISA908_KLA_LBSPP128_LPB16_LRVW8_MAC_NLCA1_PGR2_PLR5_SIA3_SU0_SUS256_SRVW0_TT1_16_TLDS1_USFGROn1_VAW2_VSn1_VW2_WSGRA1_WSGRB1_WG16_4_1_WGM1
    SolutionIndex: 44
    SolutionNameMin: Cijk_Ailk_Bljk_HBH_MT64x128x32_MI32x32x8x1_SE_1LDSB0_AF0EM8_AMAS3_BL1_EPS0_GRVW8_GSU1_ISA908_KLA_LBSPP128_LPB8_LRVW8_MAC_NLCA1_PGR2_PLR5_SIA3_SU32_SUS128_SRVW4_TT1_64_TLDS1_USFGROn1_VAW2_VSn1_VW2_WSGRA1_WSGRB1_WG64_4_1_WGM1
    SolutionIndex: 45
    SolutionNameMin: Cijk_Ailk_Bljk_HBH_MT128x144x32_MI16x16x16x1_SE_1LDSB1_AF0EM8_AMAS3_BL1_EPS1_GRVW2_GSU1_ISA908_KLA_LBSPP128_LPB16_LRVW8_MAC_NLCA1_PGR1_PLR2_SIA3_SU32_SUS128_SRVW4_TT2_144_TLDS1_USFGROn1_VAW2_VSn1_VW2_WSGRA1_WSGRB1_WG64_4_1_WGM2
    SolutionIndex: 46
    SolutionNameMin: Cijk_Ailk_Bljk_HBH_MT16x16x64_MI16x16x16x1_SE_1LDSB0_AF0EM8_AMAS3_BL1_EPS1_GRVW8_GSU1_ISA908_KLA_LBSPP128_LPB16_LRVW8_MAC_NLCA1_PGR1_PLR5_SIA3_SU32_SUS128_SRVW0_TT1_16_TLDS1_USFGROn1_VAW2_VSn1_VW2_WSGRA1_WSGRB1_WG16_4_1_WGM1
    SolutionIndex: 47
    SolutionNameMin: Cijk_Ailk_Bljk_HBH_MT128x144x32_MI16x16x16x1_SE_1LDSB1_AF0EM8_AMAS3_BL1_EPS1_GRVW2_GSU1_ISA908_KLA_LBSPP128_LPB16_LRVW8_MAC_NLCA1_PGR1_PLR2_SIA3_SU32_SUS256_SRVW4_TT2_144_TLDS1_USFGROn1_VAW2_VSn1_VW2_WSGRA1_WSGRB1_WG64_4_1_WGM15
    SolutionIndex: 48
    SolutionNameMin: Cijk_Ailk_Bljk_HBH_MT64x64x64_MI32x32x8x1_SE_1LDSB0_AF0EM8_AMAS3_BL1_EPS0_GRVW8_GSU1_ISA908_KLA_LBSPP128_LPB8_LRVW8_MAC_NLCA1_PGR2_PLR9_SIA3_SU32_SUS256_SRVW4_TT1_32_TLDS1_USFGROn1_VAW2_VSn1_VW2_WSGRA1_WSGRB1_WG64_4_1_WGM1
    SolutionIndex: 49
    SolutionNameMin: Cijk_Ailk_Bljk_HBH_MT128x64x64_MI32x32x8x1_SE_1LDSB0_AF0EM8_AMAS3_BL1_EPS0_GRVW8_GSU1_ISA908_KLA_LBSPP128_LPB8_LRVW8_MAC_NLCA1_PGR2_PLR9_SIA3_SU0_SUS256_SRVW4_TT2_32_TLDS1_USFGROn1_VAW2_VSn1_VW2_WSGRA1_WSGRB1_WG64_4_1_WGM15
    SolutionIndex: 50
    SolutionNameMin: Cijk_Ailk_Bljk_HBH_MT128x160x32_MI32x32x8x1_SN_1LDSB1_AF0EM8_AMAS3_BL1_EPS1_GRVW2_GSU1_ISA908_KLA_LBSPP128_LPB8_LRVW8_MAC_NLCA1_PGR1_PLR5_SIA3_SU32_SUS128_SRVW4_TT1_160_TLDS1_USFGROn1_VAW2_VSn1_VW2_WSGRA1_WSGRB1_WG128_2_1_WGM2
    SolutionIndex: 51
    SolutionNameMin: Cijk_Ailk_Bljk_HBH_MT128x160x32_MI32x32x8x1_SE_1LDSB1_AF0EM8_AMAS3_BL1_EPS1_GRVW2_GSU1_ISA908_KLA_LBSPP128_LPB8_LRVW8_MAC_NLCA1_PGR1_PLR5_SIA3_SU32_SUS256_SRVW4_TT1_160_TLDS1_USFGROn1_VAW2_VSn1_VW2_WSGRA1_WSGRB1_WG128_2_1_WGM15
    SolutionIndex: 52
    SolutionNameMin: Cijk_Ailk_Bljk_HBH_MT32x32x64_MI16x16x16x1_SE_1LDSB0_AF0EM8_AMAS3_BL1_EPS0_GRVW8_GSU1_ISA908_KLA_LBSPP128_LPB16_LRVW8_MAC_NLCA1_PGR2_PLR5_SIA3_SU32_SUS128_SRVW4_TT1_16_TLDS1_USFGROn1_VAW2_VSn1_VW2_WSGRA1_WSGRB1_WG32_8_1_WGM2
    SolutionIndex: 53
    SolutionNameMin: Cijk_Ailk_Bljk_HBH_MT32x32x64_MI16x16x16x1_SE_1LDSB0_AF0EM8_AMAS3_BL1_EPS0_GRVW2_GSU1_ISA908_KLA_LBSPP128_LPB16_LRVW8_MAC_NLCA1_PGR2_PLR5_SIA3_SU0_SUS256_SRVW4_TT1_16_TLDS1_USFGROn1_VAW2_VSn1_VW2_WSGRA1_WSGRB1_WG32_8_1_WGM1
    SolutionIndex: 54
    SolutionNameMin: Cijk_Ailk_Bljk_HBH_MT64x128x64_MI32x32x8x1_SE_1LDSB0_AF0EM8_AMAS3_BL1_EPS0_GRVW8_GSU1_ISA908_KLA_LBSPP128_LPB8_LRVW8_MAC_NLCA1_PGR2_PLR9_SIA3_SU32_SUS128_SRVW4_TT1_64_TLDS1_USFGROn1_VAW2_VSn1_VW2_WSGRA1_WSGRB1_WG64_4_1_WGM2
    SolutionIndex: 55
    SolutionNameMin: Cijk_Ailk_Bljk_HBH_MT128x96x64_MI32x32x8x1_SE_1LDSB0_AF0EM8_AMAS3_BL1_EPS1_GRVW8_GSU1_ISA908_KLA_LBSPP128_LPB8_LRVW8_MAC_NLCA1_PGR1_PLR9_SIA3_SU32_SUS128_SRVW4_TT1_96_TLDS1_USFGROn1_VAW2_VSn1_VW2_WSGRA1_WSGRB1_WG128_2_1_WGM2
    SolutionIndex: 56
    SolutionNameMin: Cijk_Ailk_Bljk_HBH_MT256x128x32_MI32x32x8x1_SE_1LDSB1_AF0EM8_AMAS3_BL1_EPS1_GRVW8_GSU1_ISA908_KLA_LBSPP128_LPB8_LRVW8_MAC_NLCA1_PGR1_PLR5_SIA3_SU32_SUS128_SRVW4_TT4_64_TLDS1_USFGROn1_VAW2_VSn1_VW2_WSGRA1_WSGRB1_WG64_4_1_WGM2
    SolutionIndex: 57
    SolutionNameMin: Cijk_Ailk_Bljk_HBH_MT128x64x32_MI32x32x8x1_SE_1LDSB0_AF0EM8_AMAS3_BL1_EPS1_GRVW8_GSU1_ISA908_KLA_LBSPP128_LPB8_LRVW8_MAC_NLCA1_PGR1_PLR5_SIA3_SU0_SUS256_SRVW4_TT2_32_TLDS1_USFGROn1_VAW2_VSn1_VW2_WSGRA1_WSGRB1_WG64_4_1_WGM2
    SolutionIndex: 58
    SolutionNameMin: Cijk_Ailk_Bljk_HBH_MT64x64x64_MI32x32x8x1_SE_1LDSB0_AF0EM8_AMAS3_BL1_EPS1_GRVW8_GSU1_ISA908_KLA_LBSPP128_LPB8_LRVW8_MAC_NLCA1_PGR1_PLR9_SIA3_SU32_SUS256_SRVW4_TT1_32_TLDS1_USFGROn1_VAW2_VSn1_VW2_WSGRA1_WSGRB1_WG64_4_1_WGM2
    SolutionIndex: 59
    SolutionNameMin: Cijk_Ailk_Bljk_HBH_MT128x144x32_MI16x16x16x1_SE_1LDSB1_AF0EM8_AMAS3_BL1_EPS0_GRVW2_GSU1_ISA908_KLA_LBSPP128_LPB16_LRVW8_MAC_NLCA1_PGR2_PLR2_SIA3_SU0_SUS256_SRVW4_TT2_144_TLDS1_USFGROn1_VAW2_VSn1_VW2_WSGRA1_WSGRB1_WG64_4_1_WGM15
    SolutionIndex: 60
    SolutionNameMin: Cijk_Ailk_Bljk_HBH_MT128x160x32_MI32x32x8x1_SN_1LDSB1_AF0EM8_AMAS3_BL1_EPS1_GRVW2_GSU1_ISA908_KLA_LBSPP128_LPB8_LRVW8_MAC_NLCA1_PGR1_PLR5_SIA3_SU32_SUS256_SRVW4_TT1_160_TLDS1_USFGROn1_VAW2_VSn1_VW2_WSGRA1_WSGRB1_WG128_2_1_WGM2
    SolutionIndex: 61
    SolutionNameMin: Cijk_Ailk_Bljk_HBH_MT32x64x32_MI16x16x16x1_SE_1LDSB0_AF0EM8_AMAS3_BL1_EPS0_GRVW8_GSU1_ISA908_KLA_LBSPP128_LPB16_LRVW8_MAC_NLCA1_PGR2_PLR2_SIA3_SU32_SUS128_SRVW4_TT1_32_TLDS1_USFGROn1_VAW2_VSn1_VW2_WSGRA1_WSGRB1_WG32_8_1_WGM15
    SolutionIndex: 62
    SolutionNameMin: Cijk_Ailk_Bljk_HBH_MT128x192x32_MI32x32x8x1_SE_1LDSB0_AF0EM8_AMAS3_BL1_EPS0_GRVW8_GSU1_ISA908_KLA_LBSPP128_LPB8_LRVW8_MAC_NLCA1_PGR2_PLR5_SIA3_SU0_SUS256_SRVW4_TT2_96_TLDS1_USFGROn1_VAW2_VSn1_VW2_WSGRA1_WSGRB1_WG64_4_1_WGM15
    SolutionIndex: 63
    SolutionNameMin: Cijk_Ailk_Bljk_HBH_MT128x96x32_MI32x32x8x1_SE_1LDSB0_AF0EM8_AMAS3_BL1_EPS1_GRVW4_GSU1_ISA908_KLA_LBSPP128_LPB8_LRVW8_MAC_NLCA1_PGR1_PLR5_SIA3_SU0_SUS256_SRVW4_TT1_96_TLDS1_USFGROn1_VAW2_VSn1_VW2_WSGRA1_WSGRB1_WG128_2_1_WGM1
    SolutionIndex: 64
    SolutionNameMin: Cijk_Ailk_Bljk_HBH_MT32x32x64_MI16x16x16x1_SE_1LDSB0_AF0EM8_AMAS3_BL1_EPS0_GRVW8_GSU1_ISA908_KLA_LBSPP128_LPB16_LRVW8_MAC_NLCA1_PGR2_PLR5_SIA3_SU0_SUS256_SRVW4_TT1_16_TLDS1_USFGROn1_VAW2_VSn1_VW2_WSGRA1_WSGRB1_WG32_8_1_WGM2
    SolutionIndex: 65
    SolutionNameMin: Cijk_Ailk_Bljk_HBH_MT64x128x32_MI32x32x8x1_SE_1LDSB0_AF0EM8_AMAS3_BL1_EPS0_GRVW4_GSU1_ISA908_KLA_LBSPP128_LPB8_LRVW8_MAC_NLCA1_PGR2_PLR5_SIA3_SU0_SUS256_SRVW4_TT1_64_TLDS1_USFGROn1_VAW2_VSn1_VW2_WSGRA1_WSGRB1_WG64_4_1_WGM1
    SolutionIndex: 66
    SolutionNameMin: Cijk_Ailk_Bljk_HBH_MT128x128x32_MI32x32x8x1_SN_1LDSB0_AF0EM8_AMAS3_BL1_EPS0_GRVW8_GSU1_ISA908_KLA_LBSPP128_LPB8_LRVW8_MAC_NLCA1_PGR2_PLR5_SIA3_SU0_SUS256_SRVW4_TT2_64_TLDS1_USFGROn1_VAW2_VSn1_VW2_WSGRA1_WSGRB1_WG64_4_1_WGM2
    SolutionIndex: 67
    SolutionNameMin: Cijk_Ailk_Bljk_HBH_MT256x160x32_MI32x32x8x1_SN_1LDSB0_AF0EM8_AMAS3_BL1_EPS0_GRVW4_GSU1_ISA908_KLA_LBSPP128_LPB8_LRVW8_MAC_NLCA1_PGR2_PLR5_SIA3_SU0_SUS256_SRVW4_TT2_160_TLDS1_USFGROn1_VAW2_VSn1_VW2_WSGRA1_WSGRB1_WG128_2_1_WGM15
    SolutionIndex: 68
    SolutionNameMin: Cijk_Ailk_Bljk_HBH_MT64x64x64_MI32x32x8x1_SE_1LDSB0_AF0EM8_AMAS3_BL1_EPS0_GRVW8_GSU1_ISA908_KLA_LBSPP128_LPB8_LRVW8_MAC_NLCA1_PGR2_PLR9_SIA3_SU32_SUS128_SRVW4_TT1_32_TLDS1_USFGROn1_VAW2_VSn1_VW2_WSGRA1_WSGRB1_WG64_4_1_WGM2
    SolutionIndex: 69
    SolutionNameMin: Cijk_Ailk_Bljk_HBH_MT128x160x32_MI32x32x8x1_SE_1LDSB0_AF0EM8_AMAS3_BL1_EPS0_GRVW4_GSU1_ISA908_KLA_LBSPP128_LPB8_LRVW8_MAC_NLCA1_PGR2_PLR5_SIA3_SU0_SUS256_SRVW4_TT1_160_TLDS1_USFGROn1_VAW2_VSn1_VW2_WSGRA1_WSGRB1_WG128_2_1_WGM1
    SolutionIndex: 70
    SolutionNameMin: Cijk_Ailk_Bljk_HBH_MT64x32x64_MI16x16x16x1_SN_1LDSB0_AF0EM8_AMAS3_BL1_EPS0_GRVW8_GSU1_ISA908_KLA_LBSPP128_LPB16_LRVW8_MAC_NLCA1_PGR2_PLR5_SIA3_SU32_SUS128_SRVW4_TT2_16_TLDS1_USFGROn1_VAW2_VSn1_VW2_WSGRA1_WSGRB1_WG32_8_1_WGM2
    SolutionIndex: 71
    SolutionNameMin: Cijk_Ailk_Bljk_HBH_MT64x64x32_MI32x32x8x1_SE_1LDSB0_AF0EM8_AMAS3_BL1_EPS0_GRVW4_GSU1_ISA908_KLA_LBSPP128_LPB8_LRVW8_MAC_NLCA1_PGR2_PLR5_SIA3_SU0_SUS256_SRVW4_TT1_32_TLDS1_USFGROn1_VAW2_VSn1_VW2_WSGRA1_WSGRB1_WG64_4_1_WGM15
    SolutionIndex: 72
    SolutionNameMin: Cijk_Ailk_Bljk_HBH_MT96x128x32_MI32x32x8x1_SN_1LDSB0_AF0EM8_AMAS3_BL1_EPS0_GRVW4_GSU1_ISA908_KLA_LBSPP128_LPB8_LRVW8_MAC_NLCA3_PGR2_PLR5_SIA3_SU32_SUS128_SRVW0_TT3_32_TLDS1_USFGROn1_VAW2_VSn1_VW2_WSGRA1_WSGRB1_WG32_8_1_WGM15
    SolutionIndex: 73
    SolutionNameMin: Cijk_Ailk_Bljk_HBH_MT128x96x64_MI32x32x8x1_SE_1LDSB1_AF0EM8_AMAS3_BL1_EPS1_GRVW2_GSU1_ISA908_KLA_LBSPP128_LPB8_LRVW8_MAC_NLCA1_PGR1_PLR9_SIA3_SU32_SUS128_SRVW4_TT1_96_TLDS1_USFGROn1_VAW2_VSn1_VW2_WSGRA1_WSGRB1_WG128_2_1_WGM15
    SolutionIndex: 74
    SolutionNameMin: Cijk_Ailk_Bljk_HBH_MT256x256x32_MI32x32x8x1_SE_1LDSB1_AF0EM8_AMAS3_BL1_EPS1_GRVW8_GSU1_ISA908_KLA_LBSPP128_LPB8_LRVW8_MAC_NLCA1_PGR1_PLR5_SIA3_SU32_SUS128_SRVW4_TT4_128_TLDS1_USFGROn1_VAW2_VSn1_VW2_WSGRA1_WSGRB1_WG64_4_1_WGM1
    SolutionIndex: 75
    SolutionNameMin: Cijk_Ailk_Bljk_HBH_MT128x144x32_MI16x16x16x1_SE_1LDSB1_AF0EM8_AMAS3_BL1_EPS1_GRVW2_GSU1_ISA908_KLA_LBSPP128_LPB16_LRVW8_MAC_NLCA1_PGR1_PLR2_SIA3_SU32_SUS256_SRVW4_TT2_144_TLDS1_USFGROn1_VAW2_VSn1_VW2_WSGRA1_WSGRB1_WG64_4_1_WGM1
    SolutionIndex: 76
    SolutionNameMin: Cijk_Ailk_Bljk_HBH_MT64x16x32_MI16x16x16x1_SE_1LDSB0_AF0EM8_AMAS3_BL1_EPS0_GRVW8_GSU1_ISA908_KLA_LBSPP128_LPB16_LRVW8_MAC_NLCA1_PGR2_PLR2_SIA3_SU0_SUS256_SRVW0_TT1_16_TLDS1_USFGROn1_VAW2_VSn1_VW2_WSGRA1_WSGRB1_WG64_4_1_WGM15
    SolutionIndex: 77
    SolutionNameMin: Cijk_Ailk_Bljk_HBH_MT32x64x64_MI16x16x16x1_SE_1LDSB0_AF0EM8_AMAS3_BL1_EPS0_GRVW4_GSU1_ISA908_KLA_LBSPP128_LPB16_LRVW8_MAC_NLCA1_PGR2_PLR5_SIA3_SU32_SUS128_SRVW4_TT1_32_TLDS1_USFGROn1_VAW2_VSn1_VW2_WSGRA1_WSGRB1_WG32_8_1_WGM1
    SolutionIndex: 78
    SolutionNameMin: Cijk_Ailk_Bljk_HBH_MT128x160x32_MI32x32x8x1_SN_1LDSB0_AF0EM8_AMAS3_BL1_EPS0_GRVW4_GSU1_ISA908_KLA_LBSPP128_LPB8_LRVW8_MAC_NLCA1_PGR2_PLR5_SIA3_SU0_SUS256_SRVW4_TT1_160_TLDS1_USFGROn1_VAW2_VSn1_VW2_WSGRA1_WSGRB1_WG128_2_1_WGM15
    SolutionIndex: 79
    SolutionNameMin: Cijk_Ailk_Bljk_HBH_MT32x64x32_MI16x16x16x1_SE_1LDSB0_AF0EM8_AMAS3_BL1_EPS1_GRVW8_GSU1_ISA908_KLA_LBSPP128_LPB16_LRVW8_MAC_NLCA1_PGR1_PLR2_SIA3_SU0_SUS256_SRVW4_TT1_32_TLDS1_USFGROn1_VAW2_VSn1_VW2_WSGRA1_WSGRB1_WG32_8_1_WGM1
    SolutionIndex: 80
    SolutionNameMin: Cijk_Ailk_Bljk_HBH_MT64x16x32_MI16x16x16x1_SE_1LDSB0_AF0EM8_AMAS3_BL1_EPS0_GRVW2_GSU1_ISA908_KLA_LBSPP128_LPB16_LRVW8_MAC_NLCA1_PGR2_PLR2_SIA3_SU0_SUS256_SRVW0_TT1_16_TLDS1_USFGROn1_VAW2_VSn1_VW2_WSGRA1_WSGRB1_WG64_4_1_WGM1
    SolutionIndex: 81
    SolutionNameMin: Cijk_Ailk_Bljk_HBH_MT128x256x32_MI32x32x8x1_SE_1LDSB1_AF0EM1_AMAS3_BL1_EPS0_GRVW8_GSU1_ISA908_KLA_LBSPP128_LPB8_LRVW8_MAC_NLCA1_PGR2_PLR5_SIA3_SU0_SUS256_SRVW4_TT2_128_TLDS1_USFGROn1_VAW2_VSn1_VW2_WSGRA1_WSGRB1_WG64_4_1_WGM1
    SolutionIndex: 82
    SolutionNameMin: Cijk_Ailk_Bljk_HBH_MT32x64x64_MI16x16x16x1_SE_1LDSB0_AF0EM8_AMAS3_BL1_EPS1_GRVW8_GSU7_ISA908_KLA_LBSPP128_LPB16_LRVW8_MAC_NLCA1_PGR1_PLR5_SIA3_SU0_SUS256_SRVW0_TT1_32_TLDS1_USFGROn1_VAW1_VSn1_VW2_WSGRA1_WSGRB1_WG32_8_1_WGM1
    SolutionIndex: 83
    SolutionNameMin: Cijk_Ailk_Bljk_HBH_MT64x64x32_MI32x32x8x1_SE_1LDSB0_AF0EM1_AMAS3_BL1_EPS0_GRVW2_GSU7_ISA908_KLA_LBSPP128_LPB8_LRVW8_MAC_NLCA1_PGR2_PLR5_SIA3_SU32_SUS128_SRVW4_TT1_32_TLDS1_USFGROn1_VAW1_VSn1_VW2_WSGRA1_WSGRB1_WG64_4_1_WGM1
    SolutionIndex: 84
    SolutionNameMin: Cijk_Ailk_Bljk_HBH_MT32x32x64_MI16x16x16x1_SN_1LDSB0_AF0EM8_AMAS3_BL1_EPS0_GRVW8_GSU1_ISA908_KLA_LBSPP128_LPB16_LRVW8_MAC_NLCA1_PGR2_PLR5_SIA3_SU32_SUS128_SRVW4_TT1_16_TLDS1_USFGROn1_VAW2_VSn1_VW2_WSGRA1_WSGRB1_WG32_8_1_WGM1
    SolutionIndex: 85
    SolutionNameMin: Cijk_Ailk_Bljk_HBH_MT64x16x64_MI16x16x16x1_SE_1LDSB0_AF0EM8_AMAS3_BL1_EPS0_GRVW2_GSU1_ISA908_KLA_LBSPP128_LPB16_LRVW8_MAC_NLCA1_PGR2_PLR5_SIA3_SU0_SUS256_SRVW0_TT1_16_TLDS1_USFGROn1_VAW2_VSn1_VW2_WSGRA1_WSGRB1_WG64_4_1_WGM2
    SolutionIndex: 86
    SolutionNameMin: Cijk_Ailk_Bljk_HBH_MT256x160x32_MI32x32x8x1_SE_1LDSB0_AF0EM8_AMAS3_BL1_EPS1_GRVW4_GSU1_ISA908_KLA_LBSPP128_LPB8_LRVW8_MAC_NLCA1_PGR1_PLR5_SIA3_SU32_SUS128_SRVW4_TT2_160_TLDS1_USFGROn1_VAW2_VSn1_VW2_WSGRA1_WSGRB1_WG128_2_1_WGM1
    SolutionIndex: 87
    SolutionNameMin: Cijk_Ailk_Bljk_HBH_MT32x64x64_MI16x16x16x1_SE_1LDSB0_AF0EM8_AMAS3_BL1_EPS1_GRVW8_GSU1_ISA908_KLA_LBSPP128_LPB16_LRVW8_MAC_NLCA1_PGR1_PLR5_SIA3_SU0_SUS256_SRVW4_TT1_32_TLDS1_USFGROn1_VAW2_VSn1_VW2_WSGRA1_WSGRB1_WG32_8_1_WGM2
    SolutionIndex: 88
    SolutionNameMin: Cijk_Ailk_Bljk_HBH_MT32x64x64_MI16x16x16x1_SE_1LDSB0_AF0EM1_AMAS3_BL1_EPS1_GRVW8_GSU1_ISA908_KLA_LBSPP128_LPB16_LRVW8_MAC_NLCA1_PGR1_PLR5_SIA3_SU0_SUS256_SRVW4_TT1_32_TLDS1_USFGROn1_VAW2_VSn1_VW2_WSGRA1_WSGRB1_WG32_8_1_WGM1
    SolutionIndex: 89
    SolutionNameMin: Cijk_Ailk_Bljk_HBH_MT192x192x32_MI32x32x8x1_SE_1LDSB0_AF0EM8_AMAS3_BL1_EPS0_GRVW8_GSU1_ISA908_KLA_LBSPP128_LPB8_LRVW8_MAC_NLCA3_PGR2_PLR5_SIA3_SU0_SUS256_SRVW0_TT3_96_TLDS1_USFGROn1_VAW2_VSn1_VW2_WSGRA1_WSGRB1_WG64_4_1_WGM1
    SolutionIndex: 90
    SolutionNameMin: Cijk_Ailk_Bljk_HBH_MT256x192x32_MI32x32x8x1_SE_1LDSB0_AF0EM8_AMAS3_BL1_EPS1_GRVW8_GSU1_ISA908_KLA_LBSPP128_LPB8_LRVW8_MAC_NLCA1_PGR1_PLR5_SIA3_SU0_SUS256_SRVW4_TT4_96_TLDS1_USFGROn1_VAW2_VSn1_VW2_WSGRA1_WSGRB1_WG64_4_1_WGM1
    SolutionIndex: 91
    SolutionNameMin: Cijk_Ailk_Bljk_HBH_MT32x32x64_MI16x16x16x1_SE_1LDSB0_AF0EM8_AMAS3_BL1_EPS0_GRVW8_GSU1_ISA908_KLA_LBSPP128_LPB16_LRVW8_MAC_NLCA1_PGR2_PLR5_SIA3_SU32_SUS128_SRVW4_TT1_16_TLDS1_USFGROn1_VAW2_VSn1_VW2_WSGRA1_WSGRB1_WG32_8_1_WGM15
    SolutionIndex: 92
    SolutionNameMin: Cijk_Ailk_Bljk_HBH_MT64x64x64_MI32x32x8x1_SE_1LDSB0_AF0EM8_AMAS3_BL1_EPS0_GRVW8_GSU1_ISA908_KLA_LBSPP128_LPB8_LRVW8_MAC_NLCA1_PGR2_PLR9_SIA3_SU0_SUS256_SRVW4_TT1_32_TLDS1_USFGROn1_VAW2_VSn1_VW2_WSGRA1_WSGRB1_WG64_4_1_WGM1
    SolutionIndex: 93
    SolutionNameMin: Cijk_Ailk_Bljk_HBH_MT256x192x32_MI32x32x8x1_SE_1LDSB0_AF0EM8_AMAS3_BL1_EPS0_GRVW8_GSU1_ISA908_KLA_LBSPP128_LPB8_LRVW8_MAC_NLCA1_PGR2_PLR5_SIA3_SU32_SUS256_SRVW4_TT4_96_TLDS1_USFGROn1_VAW2_VSn1_VW2_WSGRA1_WSGRB1_WG64_4_1_WGM15
    SolutionIndex: 94
    SolutionNameMin: Cijk_Ailk_Bljk_HBH_MT128x96x32_MI32x32x8x1_SE_1LDSB1_AF0EM8_AMAS3_BL1_EPS1_GRVW2_GSU1_ISA908_KLA_LBSPP128_LPB8_LRVW8_MAC_NLCA1_PGR1_PLR5_SIA3_SU32_SUS256_SRVW4_TT1_96_TLDS1_USFGROn1_VAW2_VSn1_VW2_WSGRA1_WSGRB1_WG128_2_1_WGM2
    SolutionIndex: 95
    SolutionNameMin: Cijk_Ailk_Bljk_HBH_MT128x96x32_MI32x32x8x1_SE_1LDSB0_AF0EM8_AMAS3_BL1_EPS1_GRVW4_GSU1_ISA908_KLA_LBSPP128_LPB8_LRVW8_MAC_NLCA1_PGR1_PLR5_SIA3_SU32_SUS256_SRVW4_TT1_96_TLDS1_USFGROn1_VAW2_VSn1_VW2_WSGRA1_WSGRB1_WG128_2_1_WGM2
    SolutionIndex: 96
    SolutionNameMin: Cijk_Ailk_Bljk_HBH_MT128x64x32_MI32x32x8x1_SN_1LDSB0_AF0EM8_AMAS3_BL1_EPS0_GRVW8_GSU1_ISA908_KLA_LBSPP128_LPB8_LRVW8_MAC_NLCA1_PGR2_PLR5_SIA3_SU32_SUS128_SRVW4_TT2_32_TLDS1_USFGROn1_VAW2_VSn1_VW2_WSGRA1_WSGRB1_WG64_4_1_WGM15
    SolutionIndex: 97
    SolutionNameMin: Cijk_Ailk_Bljk_HBH_MT128x256x32_MI32x32x8x1_SN_1LDSB1_AF0EM8_AMAS3_BL1_EPS0_GRVW8_GSU1_ISA908_KLA_LBSPP128_LPB8_LRVW8_MAC_NLCA1_PGR2_PLR5_SIA3_SU0_SUS128_SRVW4_TT2_128_TLDS1_USFGROn1_VAW2_VSn1_VW2_WSGRA1_WSGRB1_WG64_4_1_WGM15
    SolutionIndex: 98
    SolutionNameMin: Cijk_Ailk_Bljk_HBH_MT64x64x64_MI32x32x8x1_SE_1LDSB0_AF0EM8_AMAS3_BL1_EPS0_GRVW8_GSU1_ISA908_KLA_LBSPP128_LPB8_LRVW8_MAC_NLCA1_PGR2_PLR9_SIA3_SU0_SUS256_SRVW4_TT1_32_TLDS1_USFGROn1_VAW2_VSn1_VW2_WSGRA1_WSGRB1_WG64_4_1_WGM2
    SolutionIndex: 99
    SolutionNameMin: Cijk_Ailk_Bljk_HBH_MT32x32x32_MI16x16x16x1_SN_1LDSB0_AF0EM8_AMAS3_BL1_EPS0_GRVW8_GSU1_ISA908_KLA_LBSPP128_LPB16_LRVW8_MAC_NLCA1_PGR2_PLR2_SIA3_SU0_SUS256_SRVW4_TT1_16_TLDS1_USFGROn1_VAW2_VSn1_VW2_WSGRA1_WSGRB1_WG32_8_1_WGM2
    SolutionIndex: 100
    SolutionNameMin: Cijk_Ailk_Bljk_HBH_MT128x256x32_MI32x32x8x1_SE_1LDSB1_AF0EM8_AMAS3_BL1_EPS1_GRVW8_GSU1_ISA908_KLA_LBSPP128_LPB8_LRVW8_MAC_NLCA1_PGR1_PLR5_SIA3_SU32_SUS128_SRVW4_TT2_128_TLDS1_USFGROn1_VAW2_VSn1_VW2_WSGRA1_WSGRB1_WG64_4_1_WGM1
    SolutionIndex: 101
    SolutionNameMin: Cijk_Ailk_Bljk_HBH_MT64x64x64_MI32x32x8x1_SE_1LDSB0_AF0EM8_AMAS3_BL1_EPS0_GRVW8_GSU1_ISA908_KLA_LBSPP128_LPB8_LRVW8_MAC_NLCA1_PGR2_PLR9_SIA3_SU32_SUS128_SRVW4_TT1_32_TLDS1_USFGROn1_VAW2_VSn1_VW2_WSGRA1_WSGRB1_WG64_4_1_WGM15
    SolutionIndex: 102
    SolutionNameMin: Cijk_Ailk_Bljk_HBH_MT256x256x32_MI32x32x8x1_SE_1LDSB1_AF0EM8_AMAS3_BL1_EPS1_GRVW2_GSU1_ISA908_KLA_LBSPP128_LPB8_LRVW8_MAC_NLCA2_PGR1_PLR5_SIA3_SU0_SUS256_SRVW4_TT4_128_TLDS1_USFGROn1_VAW2_VSn1_VW2_WSGRA1_WSGRB1_WG64_4_1_WGM2
    SolutionIndex: 103
    SolutionNameMin: Cijk_Ailk_Bljk_HBH_MT128x256x32_MI32x32x8x1_SE_1LDSB1_AF0EM8_AMAS3_BL1_EPS0_GRVW8_GSU1_ISA908_KLA_LBSPP128_LPB8_LRVW8_MAC_NLCA1_PGR2_PLR5_SIA3_SU32_SUS256_SRVW4_TT2_128_TLDS1_USFGROn1_VAW2_VSn1_VW2_WSGRA1_WSGRB1_WG64_4_1_WGM2
    SolutionIndex: 104
    SolutionNameMin: Cijk_Ailk_Bljk_HBH_MT32x64x64_MI16x16x16x1_SE_1LDSB0_AF0EM8_AMAS3_BL1_EPS1_GRVW8_GSU1_ISA908_KLA_LBSPP128_LPB16_LRVW8_MAC_NLCA1_PGR1_PLR5_SIA3_SU32_SUS256_SRVW4_TT1_32_TLDS1_USFGROn1_VAW2_VSn1_VW2_WSGRA1_WSGRB1_WG32_8_1_WGM15
    SolutionIndex: 105
    SolutionNameMin: Cijk_Ailk_Bljk_HBH_MT64x64x32_MI32x32x8x1_SN_1LDSB0_AF0EM1_AMAS3_BL1_EPS0_GRVW2_GSU1_ISA908_KLA_LBSPP128_LPB8_LRVW8_MAC_NLCA1_PGR2_PLR5_SIA3_SU0_SUS256_SRVW4_TT1_32_TLDS1_USFGROn1_VAW2_VSn1_VW2_WSGRA1_WSGRB1_WG64_4_1_WGM15
    SolutionIndex: 106
    SolutionNameMin: Cijk_Ailk_Bljk_HBH_MT256x192x32_MI32x32x8x1_SE_1LDSB0_AF0EM8_AMAS3_BL1_EPS0_GRVW2_GSU1_ISA908_KLA_LBSPP128_LPB8_LRVW8_MAC_NLCA2_PGR2_PLR5_SIA3_SU32_SUS128_SRVW4_TT4_96_TLDS1_USFGROn1_VAW2_VSn1_VW2_WSGRA1_WSGRB1_WG64_4_1_WGM2
    SolutionIndex: 107
    SolutionNameMin: Cijk_Ailk_Bljk_HBH_MT128x256x32_MI32x32x8x1_SE_1LDSB1_AF0EM1_AMAS3_BL1_EPS0_GRVW8_GSU1_ISA908_KLA_LBSPP128_LPB8_LRVW8_MAC_NLCA1_PGR2_PLR5_SIA3_SU0_SUS256_SRVW4_TT2_128_TLDS1_USFGROn1_VAW2_VSn1_VW2_WSGRA1_WSGRB1_WG64_4_1_WGM2
    SolutionIndex: 108
    SolutionNameMin: Cijk_Ailk_Bljk_HBH_MT96x128x64_MI32x32x8x1_SE_1LDSB0_AF0EM8_AMAS3_BL1_EPS0_GRVW4_GSU1_ISA908_KLA_LBSPP128_LPB8_LRVW8_MAC_NLCA3_PGR2_PLR9_SIA3_SU0_SUS256_SRVW0_TT3_32_TLDS1_USFGROn1_VAW2_VSn1_VW2_WSGRA1_WSGRB1_WG32_8_1_WGM1
    SolutionIndex: 109
    SolutionNameMin: Cijk_Ailk_Bljk_HBH_MT128x256x32_MI32x32x8x1_SN_1LDSB1_AF0EM8_AMAS3_BL1_EPS0_GRVW8_GSU1_ISA908_KLA_LBSPP128_LPB8_LRVW8_MAC_NLCA1_PGR2_PLR5_SIA3_SU32_SUS256_SRVW4_TT2_128_TLDS1_USFGROn1_VAW2_VSn1_VW2_WSGRA1_WSGRB1_WG64_4_1_WGM2
    SolutionIndex: 110
    SolutionNameMin: Cijk_Ailk_Bljk_HBH_MT128x128x32_MI32x32x8x1_SE_1LDSB1_AF0EM8_AMAS3_BL1_EPS1_GRVW2_GSU1_ISA908_KLA_LBSPP128_LPB8_LRVW8_MAC_NLCA1_PGR1_PLR5_SIA3_SU0_SUS256_SRVW4_TT2_64_TLDS1_USFGROn1_VAW2_VSn1_VW2_WSGRA1_WSGRB1_WG64_4_1_WGM1
    SolutionIndex: 111
    SolutionNameMin: Cijk_Ailk_Bljk_HBH_MT64x128x64_MI32x32x8x1_SE_1LDSB0_AF0EM8_AMAS3_BL1_EPS1_GRVW8_GSU1_ISA908_KLA_LBSPP128_LPB8_LRVW8_MAC_NLCA1_PGR1_PLR9_SIA3_SU32_SUS128_SRVW4_TT1_64_TLDS1_USFGROn1_VAW2_VSn1_VW2_WSGRA1_WSGRB1_WG64_4_1_WGM2
    SolutionIndex: 112
    SolutionNameMin: Cijk_Ailk_Bljk_HBH_MT32x32x64_MI16x16x16x1_SE_1LDSB0_AF0EM1_AMAS3_BL1_EPS0_GRVW8_GSU1_ISA908_KLA_LBSPP128_LPB16_LRVW8_MAC_NLCA1_PGR2_PLR5_SIA3_SU0_SUS256_SRVW4_TT1_16_TLDS1_USFGROn1_VAW2_VSn1_VW2_WSGRA1_WSGRB1_WG32_8_1_WGM1
    SolutionIndex: 113
    SolutionNameMin: Cijk_Ailk_Bljk_HBH_MT128x144x32_MI16x16x16x1_SN_1LDSB1_AF0EM8_AMAS3_BL1_EPS1_GRVW2_GSU1_ISA908_KLA_LBSPP128_LPB16_LRVW8_MAC_NLCA1_PGR1_PLR2_SIA3_SU0_SUS256_SRVW4_TT2_144_TLDS1_USFGROn1_VAW2_VSn1_VW2_WSGRA1_WSGRB1_WG64_4_1_WGM15
    SolutionIndex: 114
    SolutionNameMin: Cijk_Ailk_Bljk_HBH_MT96x96x64_MI16x16x16x1_SE_1LDSB0_AF0EM8_AMAS3_BL1_EPS0_GRVW8_GSU1_ISA908_KLA_LBSPP128_LPB16_LRVW8_MAC_NLCA3_PGR2_PLR5_SIA3_SU0_SUS256_SRVW0_TT3_48_TLDS1_USFGROn1_VAW2_VSn1_VW2_WSGRA1_WSGRB1_WG32_8_1_WGM1
    SolutionIndex: 115
    SolutionNameMin: Cijk_Ailk_Bljk_HBH_MT256x256x32_MI32x32x8x1_SE_1LDSB1_AF0EM8_AMAS3_BL1_EPS1_GRVW8_GSU1_ISA908_KLA_LBSPP128_LPB8_LRVW8_MAC_NLCA1_PGR1_PLR5_SIA3_SU0_SUS256_SRVW4_TT4_128_TLDS1_USFGROn1_VAW2_VSn1_VW2_WSGRA1_WSGRB1_WG64_4_1_WGM15
    SolutionIndex: 116
    SolutionNameMin: Cijk_Ailk_Bljk_HBH_MT192x128x32_MI32x32x8x1_SE_1LDSB0_AF0EM8_AMAS3_BL1_EPS0_GRVW4_GSU1_ISA908_KLA_LBSPP128_LPB8_LRVW8_MAC_NLCA3_PGR2_PLR5_SIA3_SU0_SUS256_SRVW0_TT3_64_TLDS1_USFGROn1_VAW2_VSn1_VW2_WSGRA1_WSGRB1_WG64_4_1_WGM15
    SolutionIndex: 117
    SolutionNameMin: Cijk_Ailk_Bljk_HBH_MT32x32x64_MI16x16x16x1_SE_1LDSB0_AF0EM8_AMAS3_BL1_EPS1_GRVW2_GSU7_ISA908_KLA_LBSPP128_LPB16_LRVW8_MAC_NLCA1_PGR1_PLR5_SIA3_SU32_SUS128_SRVW0_TT1_16_TLDS1_USFGROn1_VAW1_VSn1_VW2_WSGRA1_WSGRB1_WG32_8_1_WGM1
    SolutionIndex: 118
    SolutionNameMin: Cijk_Ailk_Bljk_HBH_MT128x96x32_MI32x32x8x1_SE_1LDSB0_AF0EM1_AMAS3_BL1_EPS0_GRVW4_GSU1_ISA908_KLA_LBSPP128_LPB8_LRVW8_MAC_NLCA1_PGR2_PLR5_SIA3_SU0_SUS256_SRVW4_TT1_96_TLDS1_USFGROn1_VAW2_VSn1_VW2_WSGRA1_WSGRB1_WG128_2_1_WGM15
    SolutionIndex: 119
    SolutionNameMin: Cijk_Ailk_Bljk_HBH_MT128x192x32_MI32x32x8x1_SE_1LDSB0_AF0EM8_AMAS3_BL1_EPS0_GRVW8_GSU1_ISA908_KLA_LBSPP128_LPB8_LRVW8_MAC_NLCA1_PGR2_PLR5_SIA3_SU0_SUS256_SRVW4_TT2_96_TLDS1_USFGROn1_VAW2_VSn1_VW2_WSGRA1_WSGRB1_WG64_4_1_WGM2
    SolutionIndex: 120
    SolutionNameMin: Cijk_Ailk_Bljk_HBH_MT128x128x32_MI32x32x8x1_SE_1LDSB0_AF0EM8_AMAS3_BL1_EPS0_GRVW8_GSU1_ISA908_KLA_LBSPP128_LPB8_LRVW8_MAC_NLCA1_PGR2_PLR5_SIA3_SU0_SUS256_SRVW4_TT2_64_TLDS1_USFGROn1_VAW2_VSn1_VW2_WSGRA1_WSGRB1_WG64_4_1_WGM2
    SolutionIndex: 121
    SolutionNameMin: Cijk_Ailk_Bljk_HBH_MT32x32x32_MI16x16x16x1_SE_1LDSB0_AF0EM8_AMAS3_BL1_EPS1_GRVW8_GSU1_ISA908_KLA_LBSPP128_LPB16_LRVW8_MAC_NLCA1_PGR1_PLR2_SIA3_SU0_SUS256_SRVW4_TT1_16_TLDS1_USFGROn1_VAW2_VSn1_VW2_WSGRA1_WSGRB1_WG32_8_1_WGM2
    SolutionIndex: 122
    SolutionNameMin: Cijk_Ailk_Bljk_HBH_MT32x64x64_MI16x16x16x1_SE_1LDSB0_AF0EM8_AMAS3_BL1_EPS1_GRVW4_GSU7_ISA908_KLA_LBSPP128_LPB16_LRVW8_MAC_NLCA1_PGR1_PLR5_SIA3_SU32_SUS128_SRVW0_TT1_32_TLDS1_USFGROn1_VAW1_VSn1_VW2_WSGRA1_WSGRB1_WG32_8_1_WGM2
    SolutionIndex: 123
    SolutionNameMin: Cijk_Ailk_Bljk_HBH_MT256x160x32_MI32x32x8x1_SN_1LDSB0_AF0EM8_AMAS3_BL1_EPS1_GRVW4_GSU1_ISA908_KLA_LBSPP128_LPB8_LRVW8_MAC_NLCA1_PGR1_PLR5_SIA3_SU0_SUS256_SRVW4_TT2_160_TLDS1_USFGROn1_VAW2_VSn1_VW2_WSGRA1_WSGRB1_WG128_2_1_WGM1
    SolutionIndex: 124
    SolutionNameMin: Cijk_Ailk_Bljk_HBH_MT32x64x64_MI16x16x16x1_SE_1LDSB0_AF0EM8_AMAS3_BL1_EPS0_GRVW8_GSU1_ISA908_KLA_LBSPP128_LPB16_LRVW8_MAC_NLCA1_PGR2_PLR5_SIA3_SU32_SUS128_SRVW4_TT1_32_TLDS1_USFGROn1_VAW2_VSn1_VW2_WSGRA1_WSGRB1_WG32_8_1_WGM1
    SolutionIndex: 125
    SolutionNameMin: Cijk_Ailk_Bljk_HBH_MT32x32x64_MI16x16x16x1_SE_1LDSB0_AF0EM8_AMAS3_BL1_EPS0_GRVW8_GSU1_ISA908_KLA_LBSPP128_LPB16_LRVW8_MAC_NLCA1_PGR2_PLR5_SIA3_SU0_SUS256_SRVW4_TT1_16_TLDS1_USFGROn1_VAW2_VSn1_VW2_WSGRA1_WSGRB1_WG32_8_1_WGM15
    SolutionIndex: 126
    SolutionNameMin: Cijk_Ailk_Bljk_HBH_MT96x128x64_MI32x32x8x1_SE_1LDSB0_AF0EM8_AMAS3_BL1_EPS0_GRVW4_GSU1_ISA908_KLA_LBSPP128_LPB8_LRVW8_MAC_NLCA3_PGR2_PLR9_SIA3_SU32_SUS128_SRVW0_TT3_32_TLDS1_USFGROn1_VAW2_VSn1_VW2_WSGRA1_WSGRB1_WG32_8_1_WGM2
    SolutionIndex: 127
    SolutionNameMin: Cijk_Ailk_Bljk_HBH_MT32x64x64_MI16x16x16x1_SE_1LDSB0_AF0EM8_AMAS3_BL1_EPS1_GRVW8_GSU1_ISA908_KLA_LBSPP128_LPB16_LRVW8_MAC_NLCA1_PGR1_PLR5_SIA3_SU0_SUS256_SRVW4_TT1_32_TLDS1_USFGROn1_VAW2_VSn1_VW2_WSGRA1_WSGRB1_WG32_8_1_WGM1
    SolutionIndex: 128
    SolutionNameMin: Cijk_Ailk_Bljk_HBH_MT16x16x64_MI16x16x16x1_SE_1LDSB0_AF0EM8_AMAS3_BL1_EPS1_GRVW4_GSU1_ISA908_KLA_LBSPP128_LPB16_LRVW8_MAC_NLCA1_PGR1_PLR5_SIA3_SU0_SUS256_SRVW0_TT1_16_TLDS1_USFGROn1_VAW2_VSn1_VW2_WSGRA1_WSGRB1_WG16_4_1_WGM1
    SolutionIndex: 129
    SolutionNameMin: Cijk_Ailk_Bljk_HBH_MT128x128x32_MI32x32x8x1_SE_1LDSB0_AF0EM8_AMAS3_BL1_EPS0_GRVW4_GSU1_ISA908_KLA_LBSPP128_LPB8_LRVW8_MAC_NLCA1_PGR2_PLR5_SIA3_SU32_SUS128_SRVW4_TT2_64_TLDS1_USFGROn1_VAW2_VSn1_VW2_WSGRA1_WSGRB1_WG64_4_1_WGM2
    SolutionIndex: 130
    SolutionNameMin: Cijk_Ailk_Bljk_HBH_MT256x128x32_MI32x32x8x1_SE_1LDSB0_AF0EM8_AMAS3_BL1_EPS0_GRVW8_GSU1_ISA908_KLA_LBSPP128_LPB8_LRVW8_MAC_NLCA1_PGR2_PLR5_SIA3_SU0_SUS256_SRVW4_TT4_64_TLDS1_USFGROn1_VAW2_VSn1_VW2_WSGRA1_WSGRB1_WG64_4_1_WGM1
    SolutionIndex: 131
    SolutionNameMin: Cijk_Ailk_Bljk_HBH_MT128x96x32_MI32x32x8x1_SN_1LDSB0_AF0EM8_AMAS3_BL1_EPS0_GRVW4_GSU1_ISA908_KLA_LBSPP128_LPB8_LRVW8_MAC_NLCA1_PGR2_PLR5_SIA3_SU0_SUS128_SRVW4_TT1_96_TLDS1_USFGROn1_VAW2_VSn1_VW2_WSGRA1_WSGRB1_WG128_2_1_WGM15
    SolutionIndex: 132
    SolutionNameMin: Cijk_Ailk_Bljk_HBH_MT256x128x32_MI32x32x8x1_SE_1LDSB1_AF0EM8_AMAS3_BL1_EPS1_GRVW8_GSU1_ISA908_KLA_LBSPP128_LPB8_LRVW8_MAC_NLCA1_PGR1_PLR5_SIA3_SU0_SUS256_SRVW4_TT4_64_TLDS1_USFGROn1_VAW2_VSn1_VW2_WSGRA1_WSGRB1_WG64_4_1_WGM1
    SolutionIndex: 133
    SolutionNameMin: Cijk_Ailk_Bljk_HBH_MT128x96x64_MI32x32x8x1_SE_1LDSB0_AF0EM8_AMAS3_BL1_EPS1_GRVW8_GSU1_ISA908_KLA_LBSPP128_LPB8_LRVW8_MAC_NLCA1_PGR1_PLR9_SIA3_SU0_SUS256_SRVW4_TT1_96_TLDS1_USFGROn1_VAW2_VSn1_VW2_WSGRA1_WSGRB1_WG128_2_1_WGM2
    SolutionIndex: 134
    SolutionNameMin: Cijk_Ailk_Bljk_HBH_MT64x192x32_MI32x32x8x1_SN_1LDSB1_AF0EM8_AMAS3_BL1_EPS1_GRVW4_GSU1_ISA908_KLA_LBSPP128_LPB8_LRVW8_MAC_NLCA1_PGR1_PLR5_SIA3_SU0_SUS256_SRVW4_TT1_96_TLDS1_USFGROn1_VAW2_VSn1_VW2_WSGRA1_WSGRB1_WG64_4_1_WGM15
    SolutionIndex: 135
    SolutionNameMin: Cijk_Ailk_Bljk_HBH_MT128x160x32_MI32x32x8x1_SE_1LDSB0_AF0EM8_AMAS3_BL1_EPS0_GRVW4_GSU1_ISA908_KLA_LBSPP128_LPB8_LRVW8_MAC_NLCA1_PGR2_PLR5_SIA3_SU32_SUS128_SRVW4_TT1_160_TLDS1_USFGROn1_VAW2_VSn1_VW2_WSGRA1_WSGRB1_WG128_2_1_WGM2
    SolutionIndex: 136
    SolutionNameMin: Cijk_Ailk_Bljk_HBH_MT256x144x64_MI16x16x16x1_SE_1LDSB1_AF0EM8_AMAS3_BL1_EPS1_GRVW4_GSU1_ISA908_KLA_LBSPP128_LPB16_LRVW8_MAC_NLCA1_PGR1_PLR5_SIA3_SU32_SUS128_SRVW4_TT4_144_TLDS1_USFGROn1_VAW2_VSn1_VW2_WSGRA1_WSGRB1_WG64_4_1_WGM2
    SolutionIndex: 137
    SolutionNameMin: Cijk_Ailk_Bljk_HBH_MT128x64x64_MI32x32x8x1_SE_1LDSB0_AF0EM1_AMAS3_BL1_EPS0_GRVW8_GSU1_ISA908_KLA_LBSPP128_LPB8_LRVW8_MAC_NLCA1_PGR2_PLR9_SIA3_SU32_SUS256_SRVW4_TT2_32_TLDS1_USFGROn1_VAW2_VSn1_VW2_WSGRA1_WSGRB1_WG64_4_1_WGM1
    SolutionIndex: 138
    SolutionNameMin: Cijk_Ailk_Bljk_HBH_MT256x128x32_MI32x32x8x1_SE_1LDSB0_AF0EM8_AMAS3_BL1_EPS1_GRVW8_GSU1_ISA908_KLA_LBSPP128_LPB8_LRVW8_MAC_NLCA1_PGR1_PLR5_SIA3_SU32_SUS256_SRVW4_TT4_64_TLDS1_USFGROn1_VAW2_VSn1_VW2_WSGRA1_WSGRB1_WG64_4_1_WGM1
    SolutionIndex: 139
    SolutionNameMin: Cijk_Ailk_Bljk_HBH_MT128x192x32_MI32x32x8x1_SE_1LDSB0_AF0EM8_AMAS3_BL1_EPS0_GRVW4_GSU1_ISA908_KLA_LBSPP128_LPB8_LRVW8_MAC_NLCA1_PGR2_PLR5_SIA3_SU0_SUS256_SRVW4_TT2_96_TLDS1_USFGROn1_VAW2_VSn1_VW2_WSGRA1_WSGRB1_WG64_4_1_WGM15
    SolutionIndex: 140
    SolutionNameMin: Cijk_Ailk_Bljk_HBH_MT128x128x32_MI32x32x8x1_SE_1LDSB1_AF0EM8_AMAS3_BL1_EPS1_GRVW2_GSU1_ISA908_KLA_LBSPP128_LPB8_LRVW8_MAC_NLCA1_PGR1_PLR5_SIA3_SU32_SUS256_SRVW4_TT2_64_TLDS1_USFGROn1_VAW2_VSn1_VW2_WSGRA1_WSGRB1_WG64_4_1_WGM2
    SolutionIndex: 141
    SolutionNameMin: Cijk_Ailk_Bljk_HBH_MT128x96x64_MI32x32x8x1_SE_1LDSB0_AF0EM8_AMAS3_BL1_EPS0_GRVW4_GSU1_ISA908_KLA_LBSPP128_LPB8_LRVW8_MAC_NLCA1_PGR2_PLR9_SIA3_SU32_SUS256_SRVW4_TT1_96_TLDS1_USFGROn1_VAW2_VSn1_VW2_WSGRA1_WSGRB1_WG128_2_1_WGM2
    SolutionIndex: 142
    SolutionNameMin: Cijk_Ailk_Bljk_HBH_MT64x128x64_MI32x32x8x1_SE_1LDSB0_AF0EM1_AMAS3_BL1_EPS0_GRVW8_GSU1_ISA908_KLA_LBSPP128_LPB8_LRVW8_MAC_NLCA1_PGR2_PLR9_SIA3_SU0_SUS256_SRVW4_TT1_64_TLDS1_USFGROn1_VAW2_VSn1_VW2_WSGRA1_WSGRB1_WG64_4_1_WGM2
    SolutionIndex: 143
    SolutionNameMin: Cijk_Ailk_Bljk_HBH_MT128x256x32_MI32x32x8x1_SN_1LDSB1_AF0EM8_AMAS3_BL1_EPS1_GRVW2_GSU1_ISA908_KLA_LBSPP128_LPB8_LRVW8_MAC_NLCA1_PGR1_PLR5_SIA3_SU0_SUS256_SRVW4_TT2_128_TLDS1_USFGROn1_VAW2_VSn1_VW2_WSGRA1_WSGRB1_WG64_4_1_WGM1
    SolutionIndex: 144
    SolutionNameMin: Cijk_Ailk_Bljk_HBH_MT128x128x32_MI32x32x8x1_SE_1LDSB0_AF0EM8_AMAS3_BL1_EPS0_GRVW8_GSU1_ISA908_KLA_LBSPP128_LPB8_LRVW8_MAC_NLCA1_PGR2_PLR5_SIA3_SU32_SUS256_SRVW4_TT2_64_TLDS1_USFGROn1_VAW2_VSn1_VW2_WSGRA1_WSGRB1_WG64_4_1_WGM15
    SolutionIndex: 145
    SolutionNameMin: Cijk_Ailk_Bljk_HBH_MT128x256x32_MI32x32x8x1_SN_1LDSB1_AF0EM8_AMAS3_BL1_EPS1_GRVW8_GSU1_ISA908_KLA_LBSPP128_LPB8_LRVW8_MAC_NLCA1_PGR1_PLR5_SIA3_SU0_SUS128_SRVW4_TT2_128_TLDS1_USFGROn1_VAW2_VSn1_VW2_WSGRA1_WSGRB1_WG64_4_1_WGM2
    SolutionIndex: 146
    SolutionNameMin: Cijk_Ailk_Bljk_HBH_MT128x128x32_MI32x32x8x1_SE_1LDSB0_AF0EM8_AMAS3_BL1_EPS0_GRVW8_GSU1_ISA908_KLA_LBSPP128_LPB8_LRVW8_MAC_NLCA1_PGR2_PLR5_SIA3_SU0_SUS256_SRVW4_TT2_64_TLDS1_USFGROn1_VAW2_VSn1_VW2_WSGRA1_WSGRB1_WG64_4_1_WGM15
    SolutionIndex: 147
    SolutionNameMin: Cijk_Ailk_Bljk_HBH_MT128x256x32_MI32x32x8x1_SE_1LDSB1_AF0EM8_AMAS3_BL1_EPS1_GRVW8_GSU1_ISA908_KLA_LBSPP128_LPB8_LRVW8_MAC_NLCA1_PGR1_PLR5_SIA3_SU0_SUS256_SRVW4_TT2_128_TLDS1_USFGROn1_VAW2_VSn1_VW2_WSGRA1_WSGRB1_WG64_4_1_WGM1
    SolutionIndex: 148
    SolutionNameMin: Cijk_Ailk_Bljk_HBH_MT16x16x64_MI16x16x16x1_SE_1LDSB0_AF0EM8_AMAS3_BL1_EPS0_GRVW4_GSU1_ISA908_KLA_LBSPP128_LPB16_LRVW8_MAC_NLCA1_PGR2_PLR5_SIA3_SU0_SUS256_SRVW0_TT1_16_TLDS1_USFGROn1_VAW2_VSn1_VW2_WSGRA1_WSGRB1_WG16_4_1_WGM1
    SolutionIndex: 149
    SolutionNameMin: Cijk_Ailk_Bljk_HBH_MT128x160x32_MI32x32x8x1_SE_1LDSB1_AF0EM8_AMAS3_BL1_EPS1_GRVW2_GSU1_ISA908_KLA_LBSPP128_LPB8_LRVW8_MAC_NLCA1_PGR1_PLR5_SIA3_SU0_SUS256_SRVW4_TT1_160_TLDS1_USFGROn1_VAW2_VSn1_VW2_WSGRA1_WSGRB1_WG128_2_1_WGM1
    SolutionIndex: 150
    SolutionNameMin: Cijk_Ailk_Bljk_HBH_MT64x64x32_MI32x32x8x1_SE_1LDSB0_AF0EM8_AMAS3_BL1_EPS1_GRVW8_GSU1_ISA908_KLA_LBSPP128_LPB8_LRVW8_MAC_NLCA1_PGR1_PLR5_SIA3_SU0_SUS256_SRVW4_TT1_32_TLDS1_USFGROn1_VAW2_VSn1_VW2_WSGRA1_WSGRB1_WG64_4_1_WGM1
    SolutionIndex: 151
    SolutionNameMin: Cijk_Ailk_Bljk_HBH_MT32x64x64_MI16x16x16x1_SE_1LDSB0_AF0EM8_AMAS3_BL1_EPS1_GRVW8_GSU5_ISA908_KLA_LBSPP128_LPB16_LRVW8_MAC_NLCA1_PGR1_PLR5_SIA3_SU0_SUS256_SRVW0_TT1_32_TLDS1_USFGROn1_VAW1_VSn1_VW2_WSGRA1_WSGRB1_WG32_8_1_WGM1
    SolutionIndex: 152
    SolutionNameMin: Cijk_Ailk_Bljk_HBH_MT32x32x32_MI16x16x16x1_SE_1LDSB0_AF0EM8_AMAS3_BL1_EPS0_GRVW4_GSU1_ISA908_KLA_LBSPP128_LPB16_LRVW8_MAC_NLCA1_PGR2_PLR2_SIA3_SU0_SUS256_SRVW4_TT1_16_TLDS1_USFGROn1_VAW2_VSn1_VW2_WSGRA1_WSGRB1_WG32_8_1_WGM1
    SolutionIndex: 153
    SolutionNameMin: Cijk_Ailk_Bljk_HBH_MT64x64x64_MI32x32x8x1_SE_1LDSB0_AF0EM1_AMAS3_BL1_EPS0_GRVW8_GSU7_ISA908_KLA_LBSPP128_LPB8_LRVW8_MAC_NLCA1_PGR2_PLR9_SIA3_SU32_SUS256_SRVW4_TT1_32_TLDS1_USFGROn1_VAW1_VSn1_VW2_WSGRA1_WSGRB1_WG64_4_1_WGM15
    SolutionIndex: 154
    SolutionNameMin: Cijk_Ailk_Bljk_HBH_MT256x128x32_MI32x32x8x1_SE_1LDSB0_AF0EM8_AMAS3_BL1_EPS1_GRVW8_GSU1_ISA908_KLA_LBSPP128_LPB8_LRVW8_MAC_NLCA1_PGR1_PLR5_SIA3_SU0_SUS256_SRVW4_TT4_64_TLDS1_USFGROn1_VAW2_VSn1_VW2_WSGRA1_WSGRB1_WG64_4_1_WGM1
    SolutionIndex: 155
    SolutionNameMin: Cijk_Ailk_Bljk_HBH_MT64x64x64_MI32x32x8x1_SE_1LDSB0_AF0EM8_AMAS3_BL1_EPS0_GRVW8_GSU1_ISA908_KLA_LBSPP128_LPB8_LRVW8_MAC_NLCA1_PGR2_PLR9_SIA3_SU0_SUS256_SRVW4_TT1_32_TLDS1_USFGROn1_VAW2_VSn1_VW2_WSGRA1_WSGRB1_WG64_4_1_WGM15
    SolutionIndex: 156
    SolutionNameMin: Cijk_Ailk_Bljk_HBH_MT32x32x64_MI16x16x16x1_SE_1LDSB0_AF0EM8_AMAS3_BL1_EPS1_GRVW8_GSU1_ISA908_KLA_LBSPP128_LPB16_LRVW8_MAC_NLCA1_PGR1_PLR5_SIA3_SU32_SUS256_SRVW4_TT1_16_TLDS1_USFGROn1_VAW2_VSn1_VW2_WSGRA1_WSGRB1_WG32_8_1_WGM15
    SolutionIndex: 157
    SolutionNameMin: Cijk_Ailk_Bljk_HBH_MT256x160x32_MI32x32x8x1_SN_1LDSB0_AF0EM8_AMAS3_BL1_EPS1_GRVW4_GSU1_ISA908_KLA_LBSPP128_LPB8_LRVW8_MAC_NLCA1_PGR1_PLR5_SIA3_SU0_SUS128_SRVW4_TT2_160_TLDS1_USFGROn1_VAW2_VSn1_VW2_WSGRA1_WSGRB1_WG128_2_1_WGM15
    SolutionIndex: 158
    SolutionNameMin: Cijk_Ailk_Bljk_HBH_MT128x128x32_MI32x32x8x1_SE_1LDSB0_AF0EM1_AMAS3_BL1_EPS0_GRVW8_GSU1_ISA908_KLA_LBSPP128_LPB8_LRVW8_MAC_NLCA1_PGR2_PLR5_SIA3_SU32_SUS256_SRVW4_TT2_64_TLDS1_USFGROn1_VAW2_VSn1_VW2_WSGRA1_WSGRB1_WG64_4_1_WGM2
    SolutionIndex: 159
    SolutionNameMin: Cijk_Ailk_Bljk_HBH_MT64x128x64_MI32x32x8x1_SE_1LDSB0_AF0EM8_AMAS3_BL1_EPS0_GRVW8_GSU1_ISA908_KLA_LBSPP128_LPB8_LRVW8_MAC_NLCA1_PGR2_PLR9_SIA3_SU32_SUS128_SRVW4_TT1_64_TLDS1_USFGROn1_VAW2_VSn1_VW2_WSGRA1_WSGRB1_WG64_4_1_WGM1
    SolutionIndex: 160
    SolutionNameMin: Cijk_Ailk_Bljk_HBH_MT128x128x32_MI32x32x8x1_SN_1LDSB0_AF0EM8_AMAS3_BL1_EPS0_GRVW4_GSU1_ISA908_KLA_LBSPP128_LPB8_LRVW8_MAC_NLCA1_PGR2_PLR5_SIA3_SU32_SUS128_SRVW4_TT2_64_TLDS1_USFGROn1_VAW2_VSn1_VW2_WSGRA1_WSGRB1_WG64_4_1_WGM15
    SolutionIndex: 161
    SolutionNameMin: Cijk_Ailk_Bljk_HBH_MT32x32x32_MI16x16x16x1_SE_1LDSB0_AF0EM8_AMAS3_BL1_EPS1_GRVW4_GSU1_ISA908_KLA_LBSPP128_LPB16_LRVW8_MAC_NLCA1_PGR1_PLR2_SIA3_SU0_SUS256_SRVW4_TT1_16_TLDS1_USFGROn1_VAW2_VSn1_VW2_WSGRA1_WSGRB1_WG32_8_1_WGM1
    SolutionIndex: 162
    SolutionNameMin: Cijk_Ailk_Bljk_HBH_MT32x64x64_MI16x16x16x1_SE_1LDSB0_AF0EM1_AMAS3_BL1_EPS0_GRVW8_GSU7_ISA908_KLA_LBSPP128_LPB16_LRVW8_MAC_NLCA1_PGR2_PLR5_SIA3_SU32_SUS128_SRVW4_TT1_32_TLDS1_USFGROn1_VAW1_VSn1_VW2_WSGRA1_WSGRB1_WG32_8_1_WGM15
    SolutionIndex: 163
    SolutionNameMin: Cijk_Ailk_Bljk_HBH_MT128x128x32_MI32x32x8x1_SE_1LDSB1_AF0EM8_AMAS3_BL1_EPS1_GRVW2_GSU1_ISA908_KLA_LBSPP128_LPB8_LRVW8_MAC_NLCA1_PGR1_PLR5_SIA3_SU32_SUS128_SRVW4_TT2_64_TLDS1_USFGROn1_VAW2_VSn1_VW2_WSGRA1_WSGRB1_WG64_4_1_WGM15
    SolutionIndex: 164
    SolutionNameMin: Cijk_Ailk_Bljk_HBH_MT128x96x32_MI32x32x8x1_SN_1LDSB1_AF0EM8_AMAS3_BL1_EPS1_GRVW2_GSU1_ISA908_KLA_LBSPP128_LPB8_LRVW8_MAC_NLCA1_PGR1_PLR5_SIA3_SU0_SUS256_SRVW4_TT1_96_TLDS1_USFGROn1_VAW2_VSn1_VW2_WSGRA1_WSGRB1_WG128_2_1_WGM1
    SolutionIndex: 165
    SolutionNameMin: Cijk_Ailk_Bljk_HBH_MT64x128x64_MI32x32x8x1_SE_1LDSB0_AF0EM8_AMAS3_BL1_EPS0_GRVW4_GSU1_ISA908_KLA_LBSPP128_LPB8_LRVW8_MAC_NLCA1_PGR2_PLR9_SIA3_SU0_SUS256_SRVW4_TT1_64_TLDS1_USFGROn1_VAW2_VSn1_VW2_WSGRA1_WSGRB1_WG64_4_1_WGM1
    SolutionIndex: 166
    SolutionNameMin: Cijk_Ailk_Bljk_HBH_MT256x192x32_MI32x32x8x1_SE_1LDSB1_AF0EM8_AMAS3_BL1_EPS1_GRVW8_GSU1_ISA908_KLA_LBSPP128_LPB8_LRVW8_MAC_NLCA1_PGR1_PLR5_SIA3_SU32_SUS128_SRVW4_TT4_96_TLDS1_USFGROn1_VAW2_VSn1_VW2_WSGRA1_WSGRB1_WG64_4_1_WGM15
    SolutionIndex: 167
    SolutionNameMin: Cijk_Ailk_Bljk_HBH_MT32x32x64_MI16x16x16x1_SE_1LDSB0_AF0EM8_AMAS3_BL1_EPS1_GRVW8_GSU1_ISA908_KLA_LBSPP128_LPB16_LRVW8_MAC_NLCA1_PGR1_PLR5_SIA3_SU32_SUS128_SRVW4_TT1_16_TLDS1_USFGROn1_VAW2_VSn1_VW2_WSGRA1_WSGRB1_WG32_8_1_WGM1
    SolutionIndex: 168
    SolutionNameMin: Cijk_Ailk_Bljk_HBH_MT256x192x32_MI32x32x8x1_SE_1LDSB1_AF0EM8_AMAS3_BL1_EPS1_GRVW8_GSU1_ISA908_KLA_LBSPP128_LPB8_LRVW8_MAC_NLCA1_PGR1_PLR5_SIA3_SU0_SUS256_SRVW4_TT4_96_TLDS1_USFGROn1_VAW2_VSn1_VW2_WSGRA1_WSGRB1_WG64_4_1_WGM1
    SolutionIndex: 169
    SolutionNameMin: Cijk_Ailk_Bljk_HBH_MT256x128x32_MI32x32x8x1_SE_1LDSB0_AF0EM8_AMAS3_BL1_EPS1_GRVW8_GSU1_ISA908_KLA_LBSPP128_LPB8_LRVW8_MAC_NLCA1_PGR1_PLR5_SIA3_SU32_SUS256_SRVW4_TT4_64_TLDS1_USFGROn1_VAW2_VSn1_VW2_WSGRA1_WSGRB1_WG64_4_1_WGM15
    SolutionIndex: 170
    SolutionNameMin: Cijk_Ailk_Bljk_HBH_MT288x128x32_MI32x32x8x1_SE_1LDSB0_AF0EM8_AMAS3_BL1_EPS1_GRVW4_GSU1_ISA908_KLA_LBSPP128_LPB8_LRVW8_MAC_NLCA9_PGR1_PLR5_SIA3_SU32_SUS128_SRVW0_TT9_32_TLDS1_USFGROn1_VAW2_VSn1_VW2_WSGRA1_WSGRB1_WG32_8_1_WGM2
    SolutionIndex: 171
    SolutionNameMin: Cijk_Ailk_Bljk_HBH_MT128x160x32_MI32x32x8x1_SE_1LDSB0_AF0EM8_AMAS3_BL1_EPS0_GRVW4_GSU1_ISA908_KLA_LBSPP128_LPB8_LRVW8_MAC_NLCA1_PGR2_PLR5_SIA3_SU0_SUS256_SRVW4_TT1_160_TLDS1_USFGROn1_VAW2_VSn1_VW2_WSGRA1_WSGRB1_WG128_2_1_WGM15
    SolutionIndex: 172
    SolutionNameMin: Cijk_Ailk_Bljk_HBH_MT64x64x64_MI32x32x8x1_SE_1LDSB0_AF0EM8_AMAS3_BL1_EPS0_GRVW8_GSU1_ISA908_KLA_LBSPP128_LPB8_LRVW8_MAC_NLCA1_PGR2_PLR9_SIA3_SU32_SUS256_SRVW4_TT1_32_TLDS1_USFGROn1_VAW2_VSn1_VW2_WSGRA1_WSGRB1_WG64_4_1_WGM15
    SolutionIndex: 173
    SolutionNameMin: Cijk_Ailk_Bljk_HBH_MT128x96x32_MI32x32x8x1_SE_1LDSB1_AF0EM8_AMAS3_BL1_EPS1_GRVW2_GSU1_ISA908_KLA_LBSPP128_LPB8_LRVW8_MAC_NLCA1_PGR1_PLR5_SIA3_SU0_SUS256_SRVW4_TT1_96_TLDS1_USFGROn1_VAW2_VSn1_VW2_WSGRA1_WSGRB1_WG128_2_1_WGM15
    SolutionIndex: 174
    SolutionNameMin: Cijk_Ailk_Bljk_HBH_MT128x64x32_MI32x32x8x1_SE_1LDSB0_AF0EM1_AMAS3_BL1_EPS0_GRVW2_GSU1_ISA908_KLA_LBSPP128_LPB8_LRVW8_MAC_NLCA1_PGR2_PLR5_SIA3_SU0_SUS256_SRVW4_TT2_32_TLDS1_USFGROn1_VAW2_VSn1_VW2_WSGRA1_WSGRB1_WG64_4_1_WGM1
    SolutionIndex: 175
    SolutionNameMin: Cijk_Ailk_Bljk_HBH_MT160x128x32_MI32x32x8x1_SE_1LDSB0_AF0EM8_AMAS3_BL1_EPS0_GRVW4_GSU1_ISA908_KLA_LBSPP128_LPB8_LRVW8_MAC_NLCA5_PGR2_PLR5_SIA3_SU0_SUS256_SRVW0_TT5_32_TLDS1_USFGROn1_VAW2_VSn1_VW2_WSGRA1_WSGRB1_WG32_8_1_WGM1
    SolutionIndex: 176
    SolutionNameMin: Cijk_Ailk_Bljk_HBH_MT128x64x32_MI32x32x8x1_SE_1LDSB0_AF0EM8_AMAS3_BL1_EPS0_GRVW8_GSU1_ISA908_KLA_LBSPP128_LPB8_LRVW8_MAC_NLCA1_PGR2_PLR5_SIA3_SU0_SUS256_SRVW4_TT2_32_TLDS1_USFGROn1_VAW2_VSn1_VW2_WSGRA1_WSGRB1_WG64_4_1_WGM1
    SolutionIndex: 177
    SolutionNameMin: Cijk_Ailk_Bljk_HBH_MT16x64x64_MI16x16x16x1_SE_1LDSB0_AF0EM8_AMAS3_BL1_EPS0_GRVW8_GSU1_ISA908_KLA_LBSPP128_LPB16_LRVW8_MAC_NLCA1_PGR2_PLR5_SIA3_SU0_SUS256_SRVW0_TT1_16_TLDS1_USFGROn1_VAW2_VSn1_VW2_WSGRA1_WSGRB1_WG16_16_1_WGM15
    SolutionIndex: 178
    SolutionNameMin: Cijk_Ailk_Bljk_HBH_MT128x160x32_MI32x32x8x1_SE_1LDSB0_AF0EM8_AMAS3_BL1_EPS0_GRVW2_GSU1_ISA908_KLA_LBSPP128_LPB8_LRVW8_MAC_NLCA1_PGR2_PLR5_SIA3_SU0_SUS256_SRVW4_TT1_160_TLDS1_USFGROn1_VAW2_VSn1_VW2_WSGRA1_WSGRB1_WG128_2_1_WGM15
    SolutionIndex: 179
    SolutionNameMin: Cijk_Ailk_Bljk_HBH_MT128x256x32_MI32x32x8x1_SN_1LDSB1_AF0EM8_AMAS3_BL1_EPS1_GRVW8_GSU1_ISA908_KLA_LBSPP128_LPB8_LRVW8_MAC_NLCA1_PGR1_PLR5_SIA3_SU32_SUS128_SRVW4_TT2_128_TLDS1_USFGROn1_VAW2_VSn1_VW2_WSGRA1_WSGRB1_WG64_4_1_WGM2
    SolutionIndex: 180
    SolutionNameMin: Cijk_Ailk_Bljk_HBH_MT64x128x64_MI32x32x8x1_SE_1LDSB0_AF0EM8_AMAS3_BL1_EPS1_GRVW8_GSU1_ISA908_KLA_LBSPP128_LPB8_LRVW8_MAC_NLCA1_PGR1_PLR9_SIA3_SU32_SUS128_SRVW4_TT1_64_TLDS1_USFGROn1_VAW2_VSn1_VW2_WSGRA1_WSGRB1_WG64_4_1_WGM15
    SolutionIndex: 181
    SolutionNameMin: Cijk_Ailk_Bljk_HBH_MT32x64x64_MI16x16x16x1_SE_1LDSB0_AF0EM1_AMAS3_BL1_EPS0_GRVW4_GSU1_ISA908_KLA_LBSPP128_LPB16_LRVW8_MAC_NLCA1_PGR2_PLR5_SIA3_SU32_SUS256_SRVW4_TT1_32_TLDS1_USFGROn1_VAW2_VSn1_VW2_WSGRA1_WSGRB1_WG32_8_1_WGM1
    SolutionIndex: 182
    SolutionNameMin: Cijk_Ailk_Bljk_HBH_MT256x160x32_MI32x32x8x1_SE_1LDSB0_AF0EM8_AMAS3_BL1_EPS0_GRVW4_GSU1_ISA908_KLA_LBSPP128_LPB8_LRVW8_MAC_NLCA1_PGR2_PLR5_SIA3_SU0_SUS256_SRVW4_TT2_160_TLDS1_USFGROn1_VAW2_VSn1_VW2_WSGRA1_WSGRB1_WG128_2_1_WGM15
    SolutionIndex: 183
    SolutionNameMin: Cijk_Ailk_Bljk_HBH_MT32x32x64_MI16x16x16x1_SE_1LDSB0_AF0EM8_AMAS3_BL1_EPS1_GRVW8_GSU1_ISA908_KLA_LBSPP128_LPB16_LRVW8_MAC_NLCA1_PGR1_PLR5_SIA3_SU0_SUS256_SRVW4_TT1_16_TLDS1_USFGROn1_VAW2_VSn1_VW2_WSGRA1_WSGRB1_WG32_8_1_WGM2
    SolutionIndex: 184
    SolutionNameMin: Cijk_Ailk_Bljk_HBH_MT128x160x32_MI32x32x8x1_SN_1LDSB1_AF0EM8_AMAS3_BL1_EPS1_GRVW2_GSU1_ISA908_KLA_LBSPP128_LPB8_LRVW8_MAC_NLCA1_PGR1_PLR5_SIA3_SU0_SUS128_SRVW4_TT1_160_TLDS1_USFGROn1_VAW2_VSn1_VW2_WSGRA1_WSGRB1_WG128_2_1_WGM2
    SolutionIndex: 185
    SolutionNameMin: Cijk_Ailk_Bljk_HBH_MT128x96x64_MI32x32x8x1_SE_1LDSB0_AF0EM8_AMAS3_BL1_EPS1_GRVW8_GSU1_ISA908_KLA_LBSPP128_LPB8_LRVW8_MAC_NLCA1_PGR1_PLR9_SIA3_SU0_SUS256_SRVW4_TT1_96_TLDS1_USFGROn1_VAW2_VSn1_VW2_WSGRA1_WSGRB1_WG128_2_1_WGM15
    SolutionIndex: 186
    SolutionNameMin: Cijk_Ailk_Bljk_HBH_MT128x256x32_MI32x32x8x1_SE_1LDSB1_AF0EM8_AMAS3_BL1_EPS0_GRVW8_GSU1_ISA908_KLA_LBSPP128_LPB8_LRVW8_MAC_NLCA1_PGR2_PLR5_SIA3_SU32_SUS128_SRVW4_TT2_128_TLDS1_USFGROn1_VAW2_VSn1_VW2_WSGRA1_WSGRB1_WG64_4_1_WGM15
    SolutionIndex: 187
    SolutionNameMin: Cijk_Ailk_Bljk_HBH_MT32x32x64_MI16x16x16x1_SE_1LDSB0_AF0EM8_AMAS3_BL1_EPS0_GRVW2_GSU1_ISA908_KLA_LBSPP128_LPB16_LRVW8_MAC_NLCA1_PGR2_PLR5_SIA3_SU32_SUS256_SRVW4_TT1_16_TLDS1_USFGROn1_VAW2_VSn1_VW2_WSGRA1_WSGRB1_WG32_8_1_WGM15
    SolutionIndex: 188
    SolutionNameMin: Cijk_Ailk_Bljk_HBH_MT128x96x64_MI32x32x8x1_SN_1LDSB0_AF0EM8_AMAS3_BL1_EPS0_GRVW4_GSU1_ISA908_KLA_LBSPP128_LPB8_LRVW8_MAC_NLCA1_PGR2_PLR9_SIA3_SU32_SUS256_SRVW4_TT1_96_TLDS1_USFGROn1_VAW2_VSn1_VW2_WSGRA1_WSGRB1_WG128_2_1_WGM1
    SolutionIndex: 189
    SolutionNameMin: Cijk_Ailk_Bljk_HBH_MT64x64x4_SN_1LDSB0_AF0EM1_AMAS0_BL0_EPS0_GRVW1_GSU1_ISA000_KLS_LBSPP0_LPB0_LRVW1_FMA_NLCA1_PGR1_PLR1_SIA1_SU32_SUS256_SRVW0_TT4_4_TLDS0_USFGRO0_VAW2_VS1_VW1_WSGRA0_WSGRB0_WG16_16_1_WGM8
    SolutionIndex: 190
    SolutionNameMin: Cijk_Ailk_Bljk_HBH_MT64x64x64_MI32x32x8x1_SE_1LDSB0_AF0EM1_AMAS3_BL1_EPS0_GRVW8_GSU1_ISA908_KLA_LBSPP128_LPB8_LRVW8_MAC_NLCA1_PGR2_PLR9_SIA3_SU32_SUS256_SRVW4_TT1_32_TLDS1_USFGROn1_VAW2_VSn1_VW2_WSGRA1_WSGRB1_WG64_4_1_WGM1
    SolutionIndex: 191
    SolutionNameMin: Cijk_Ailk_Bljk_HBH_MT64x64x64_MI32x32x8x1_SE_1LDSB0_AF0EM8_AMAS3_BL1_EPS0_GRVW8_GSU1_ISA908_KLA_LBSPP128_LPB8_LRVW8_MAC_NLCA1_PGR2_PLR9_SIA3_SU32_SUS128_SRVW4_TT1_32_TLDS1_USFGROn1_VAW2_VSn1_VW2_WSGRA1_WSGRB1_WG64_4_1_WGM1
    SolutionIndex: 192
    SolutionNameMin: Cijk_Ailk_Bljk_HBH_MT64x16x64_MI16x16x16x1_SE_1LDSB0_AF0EM8_AMAS3_BL1_EPS1_GRVW8_GSU1_ISA908_KLA_LBSPP128_LPB16_LRVW8_MAC_NLCA1_PGR1_PLR5_SIA3_SU0_SUS256_SRVW0_TT1_16_TLDS1_USFGROn1_VAW2_VSn1_VW2_WSGRA1_WSGRB1_WG64_4_1_WGM1
    SolutionIndex: 193
    SolutionNameMin: Cijk_Ailk_Bljk_HBH_MT128x96x64_MI32x32x8x1_SE_1LDSB0_AF0EM8_AMAS3_BL1_EPS0_GRVW2_GSU1_ISA908_KLA_LBSPP128_LPB8_LRVW8_MAC_NLCA1_PGR2_PLR9_SIA3_SU0_SUS256_SRVW4_TT1_96_TLDS1_USFGROn1_VAW2_VSn1_VW2_WSGRA1_WSGRB1_WG128_2_1_WGM15
    SolutionIndex: 194
    SolutionNameMin: Cijk_Ailk_Bljk_HBH_MT256x192x32_MI32x32x8x1_SE_1LDSB1_AF0EM8_AMAS3_BL1_EPS0_GRVW8_GSU1_ISA908_KLA_LBSPP128_LPB8_LRVW8_MAC_NLCA1_PGR2_PLR5_SIA3_SU0_SUS256_SRVW4_TT4_96_TLDS1_USFGROn1_VAW2_VSn1_VW2_WSGRA1_WSGRB1_WG64_4_1_WGM1
    SolutionIndex: 195
    SolutionNameMin: Cijk_Ailk_Bljk_HBH_MT160x128x32_MI32x32x8x1_SE_1LDSB0_AF0EM8_AMAS3_BL1_EPS0_GRVW4_GSU1_ISA908_KLA_LBSPP128_LPB8_LRVW8_MAC_NLCA5_PGR2_PLR5_SIA3_SU32_SUS256_SRVW0_TT5_32_TLDS1_USFGROn1_VAW2_VSn1_VW2_WSGRA1_WSGRB1_WG32_8_1_WGM15
    SolutionIndex: 196
    SolutionNameMin: Cijk_Ailk_Bljk_HBH_MT128x256x32_MI32x32x8x1_SE_1LDSB1_AF0EM1_AMAS3_BL1_EPS0_GRVW8_GSU1_ISA908_KLA_LBSPP128_LPB8_LRVW8_MAC_NLCA1_PGR2_PLR5_SIA3_SU0_SUS256_SRVW4_TT2_128_TLDS1_USFGROn1_VAW2_VSn1_VW2_WSGRA1_WSGRB1_WG64_4_1_WGM15
    SolutionIndex: 197
    SolutionNameMin: Cijk_Ailk_Bljk_HBH_MT32x64x64_MI16x16x16x1_SE_1LDSB0_AF0EM8_AMAS3_BL1_EPS1_GRVW8_GSU7_ISA908_KLA_LBSPP128_LPB16_LRVW8_MAC_NLCA1_PGR1_PLR5_SIA3_SU0_SUS256_SRVW0_TT1_32_TLDS1_USFGROn1_VAW1_VSn1_VW2_WSGRA1_WSGRB1_WG32_8_1_WGM15
    SolutionIndex: 198
    SolutionNameMin: Cijk_Ailk_Bljk_HBH_MT64x32x64_MI16x16x16x1_SE_1LDSB0_AF0EM8_AMAS3_BL1_EPS1_GRVW8_GSU1_ISA908_KLA_LBSPP128_LPB16_LRVW8_MAC_NLCA1_PGR1_PLR5_SIA3_SU0_SUS256_SRVW4_TT2_16_TLDS1_USFGROn1_VAW2_VSn1_VW2_WSGRA1_WSGRB1_WG32_8_1_WGM1
    SolutionIndex: 199
    SolutionNameMin: Cijk_Ailk_Bljk_HBH_MT128x160x32_MI32x32x8x1_SE_1LDSB1_AF0EM8_AMAS3_BL1_EPS1_GRVW2_GSU1_ISA908_KLA_LBSPP128_LPB8_LRVW8_MAC_NLCA1_PGR1_PLR5_SIA3_SU32_SUS128_SRVW4_TT1_160_TLDS1_USFGROn1_VAW2_VSn1_VW2_WSGRA1_WSGRB1_WG128_2_1_WGM2
    SolutionIndex: 200
    SolutionNameMin: Cijk_Ailk_Bljk_HBH_MT256x256x32_MI32x32x8x1_SE_1LDSB1_AF0EM8_AMAS3_BL1_EPS1_GRVW2_GSU1_ISA908_KLA_LBSPP128_LPB8_LRVW8_MAC_NLCA2_PGR1_PLR5_SIA3_SU0_SUS256_SRVW4_TT4_128_TLDS1_USFGROn1_VAW2_VSn1_VW2_WSGRA1_WSGRB1_WG64_4_1_WGM15
    SolutionIndex: 201
    SolutionNameMin: Cijk_Ailk_Bljk_HBH_MT256x128x32_MI32x32x8x1_SE_1LDSB0_AF0EM8_AMAS3_BL1_EPS0_GRVW2_GSU1_ISA908_KLA_LBSPP128_LPB8_LRVW8_MAC_NLCA2_PGR2_PLR5_SIA3_SU0_SUS256_SRVW4_TT4_64_TLDS1_USFGROn1_VAW2_VSn1_VW2_WSGRA1_WSGRB1_WG64_4_1_WGM15
    SolutionIndex: 202
    SolutionNameMin: Cijk_Ailk_Bljk_HBH_MT128x96x32_MI32x32x8x1_SE_1LDSB1_AF0EM8_AMAS3_BL1_EPS1_GRVW2_GSU1_ISA908_KLA_LBSPP128_LPB8_LRVW8_MAC_NLCA1_PGR1_PLR5_SIA3_SU32_SUS256_SRVW4_TT1_96_TLDS1_USFGROn1_VAW2_VSn1_VW2_WSGRA1_WSGRB1_WG128_2_1_WGM15
    SolutionIndex: 203
    SolutionNameMin: Cijk_Ailk_Bljk_HBH_MT64x128x64_MI32x32x8x1_SE_1LDSB0_AF0EM8_AMAS3_BL1_EPS1_GRVW8_GSU5_ISA908_KLA_LBSPP128_LPB8_LRVW8_MAC_NLCA1_PGR1_PLR9_SIA3_SU32_SUS256_SRVW0_TT1_64_TLDS1_USFGROn1_VAW1_VSn1_VW2_WSGRA1_WSGRB1_WG64_4_1_WGM1
    SolutionIndex: 204
    SolutionNameMin: Cijk_Ailk_Bljk_HBH_MT128x128x32_MI32x32x8x1_SE_1LDSB0_AF0EM8_AMAS3_BL1_EPS0_GRVW8_GSU1_ISA908_KLA_LBSPP128_LPB8_LRVW8_MAC_NLCA1_PGR2_PLR5_SIA3_SU32_SUS256_SRVW4_TT2_64_TLDS1_USFGROn1_VAW2_VSn1_VW2_WSGRA1_WSGRB1_WG64_4_1_WGM2
    SolutionIndex: 205
    SolutionNameMin: Cijk_Ailk_Bljk_HBH_MT128x64x32_MI32x32x8x1_SE_1LDSB0_AF0EM8_AMAS3_BL1_EPS0_GRVW2_GSU1_ISA908_KLA_LBSPP128_LPB8_LRVW8_MAC_NLCA1_PGR2_PLR5_SIA3_SU0_SUS256_SRVW4_TT2_32_TLDS1_USFGROn1_VAW2_VSn1_VW2_WSGRA1_WSGRB1_WG64_4_1_WGM1
    SolutionIndex: 206
    SolutionNameMin: Cijk_Ailk_Bljk_HBH_MT32x32x64_MI16x16x16x1_SE_1LDSB0_AF0EM8_AMAS3_BL1_EPS0_GRVW4_GSU1_ISA908_KLA_LBSPP128_LPB16_LRVW8_MAC_NLCA1_PGR2_PLR5_SIA3_SU32_SUS128_SRVW4_TT1_16_TLDS1_USFGROn1_VAW2_VSn1_VW2_WSGRA1_WSGRB1_WG32_8_1_WGM1
    SolutionIndex: 207
    SolutionNameMin: Cijk_Ailk_Bljk_HBH_MT64x64x64_MI32x32x8x1_SE_1LDSB0_AF0EM1_AMAS3_BL1_EPS0_GRVW8_GSU1_ISA908_KLA_LBSPP128_LPB8_LRVW8_MAC_NLCA1_PGR2_PLR9_SIA3_SU32_SUS128_SRVW4_TT1_32_TLDS1_USFGROn1_VAW2_VSn1_VW2_WSGRA1_WSGRB1_WG64_4_1_WGM2
    SolutionIndex: 208
    SolutionNameMin: Cijk_Ailk_Bljk_HBH_MT16x16x64_MI16x16x16x1_SE_1LDSB0_AF0EM8_AMAS3_BL1_EPS1_GRVW8_GSU1_ISA908_KLA_LBSPP128_LPB16_LRVW8_MAC_NLCA1_PGR1_PLR5_SIA3_SU32_SUS128_SRVW0_TT1_16_TLDS1_USFGROn1_VAW2_VSn1_VW2_WSGRA1_WSGRB1_WG16_4_1_WGM2
    SolutionIndex: 209
    SolutionNameMin: Cijk_Ailk_Bljk_HBH_MT288x128x32_MI32x32x8x1_SE_1LDSB0_AF0EM8_AMAS3_BL1_EPS1_GRVW4_GSU1_ISA908_KLA_LBSPP128_LPB8_LRVW8_MAC_NLCA9_PGR1_PLR5_SIA3_SU32_SUS256_SRVW0_TT9_32_TLDS1_USFGROn1_VAW2_VSn1_VW2_WSGRA1_WSGRB1_WG32_8_1_WGM1
    SolutionIndex: 210
    SolutionNameMin: Cijk_Ailk_Bljk_HBH_MT64x128x64_MI32x32x8x1_SE_1LDSB0_AF0EM8_AMAS3_BL1_EPS0_GRVW8_GSU1_ISA908_KLA_LBSPP128_LPB8_LRVW8_MAC_NLCA1_PGR2_PLR9_SIA3_SU32_SUS256_SRVW4_TT1_64_TLDS1_USFGROn1_VAW2_VSn1_VW2_WSGRA1_WSGRB1_WG64_4_1_WGM2
    SolutionIndex: 211
    SolutionNameMin: Cijk_Ailk_Bljk_HBH_MT128x256x32_MI32x32x8x1_SE_1LDSB0_AF0EM8_AMAS3_BL1_EPS1_GRVW8_GSU1_ISA908_KLA_LBSPP128_LPB8_LRVW8_MAC_NLCA1_PGR1_PLR5_SIA3_SU32_SUS128_SRVW4_TT2_128_TLDS1_USFGROn1_VAW2_VSn1_VW2_WSGRA1_WSGRB1_WG64_4_1_WGM15
    SolutionIndex: 212
    SolutionNameMin: Cijk_Ailk_Bljk_HBH_MT256x192x32_MI32x32x8x1_SE_1LDSB1_AF0EM8_AMAS3_BL1_EPS0_GRVW8_GSU1_ISA908_KLA_LBSPP128_LPB8_LRVW8_MAC_NLCA1_PGR2_PLR5_SIA3_SU32_SUS256_SRVW4_TT4_96_TLDS1_USFGROn1_VAW2_VSn1_VW2_WSGRA1_WSGRB1_WG64_4_1_WGM2
    SolutionIndex: 213
    SolutionNameMin: Cijk_Ailk_Bljk_HBH_MT16x16x64_MI16x16x16x1_SE_1LDSB0_AF0EM8_AMAS3_BL1_EPS1_GRVW8_GSU1_ISA908_KLA_LBSPP128_LPB16_LRVW8_MAC_NLCA1_PGR1_PLR5_SIA3_SU0_SUS256_SRVW0_TT1_16_TLDS1_USFGROn1_VAW2_VSn1_VW2_WSGRA1_WSGRB1_WG16_4_1_WGM1
    SolutionIndex: 214
    SolutionNameMin: Cijk_Ailk_Bljk_HBH_MT256x160x32_MI32x32x8x1_SE_1LDSB0_AF0EM8_AMAS3_BL1_EPS0_GRVW4_GSU1_ISA908_KLA_LBSPP128_LPB8_LRVW8_MAC_NLCA1_PGR2_PLR5_SIA3_SU32_SUS128_SRVW4_TT2_160_TLDS1_USFGROn1_VAW2_VSn1_VW2_WSGRA1_WSGRB1_WG128_2_1_WGM1
    SolutionIndex: 215
    SolutionNameMin: Cijk_Ailk_Bljk_HBH_MT128x128x32_MI32x32x8x1_SE_1LDSB0_AF0EM8_AMAS3_BL1_EPS0_GRVW4_GSU1_ISA908_KLA_LBSPP128_LPB8_LRVW8_MAC_NLCA1_PGR2_PLR5_SIA3_SU32_SUS128_SRVW4_TT2_64_TLDS1_USFGROn1_VAW2_VSn1_VW2_WSGRA1_WSGRB1_WG64_4_1_WGM15
    SolutionIndex: 216
    SolutionNameMin: Cijk_Ailk_Bljk_HBH_MT96x96x64_MI16x16x16x1_SE_1LDSB0_AF0EM8_AMAS3_BL1_EPS0_GRVW4_GSU1_ISA908_KLA_LBSPP128_LPB16_LRVW8_MAC_NLCA3_PGR2_PLR5_SIA3_SU0_SUS256_SRVW0_TT3_48_TLDS1_USFGROn1_VAW2_VSn1_VW2_WSGRA1_WSGRB1_WG32_8_1_WGM15
    SolutionIndex: 217
    SolutionNameMin: Cijk_Ailk_Bljk_HBH_MT64x128x32_MI32x32x8x1_SE_1LDSB0_AF0EM1_AMAS3_BL1_EPS0_GRVW8_GSU1_ISA908_KLA_LBSPP128_LPB8_LRVW8_MAC_NLCA1_PGR2_PLR5_SIA3_SU32_SUS256_SRVW4_TT1_64_TLDS1_USFGROn1_VAW2_VSn1_VW2_WSGRA1_WSGRB1_WG64_4_1_WGM2
    SolutionIndex: 218
    SolutionNameMin: Cijk_Ailk_Bljk_HBH_MT64x128x64_MI32x32x8x1_SE_1LDSB0_AF0EM8_AMAS3_BL1_EPS0_GRVW8_GSU1_ISA908_KLA_LBSPP128_LPB8_LRVW8_MAC_NLCA1_PGR2_PLR9_SIA3_SU0_SUS256_SRVW4_TT1_64_TLDS1_USFGROn1_VAW2_VSn1_VW2_WSGRA1_WSGRB1_WG64_4_1_WGM15
    SolutionIndex: 219
    SolutionNameMin: Cijk_Ailk_Bljk_HBH_MT16x16x64_MI16x16x16x1_SE_1LDSB0_AF0EM8_AMAS3_BL1_EPS0_GRVW8_GSU1_ISA908_KLA_LBSPP128_LPB16_LRVW8_MAC_NLCA1_PGR2_PLR5_SIA3_SU32_SUS128_SRVW0_TT1_16_TLDS1_USFGROn1_VAW2_VSn1_VW2_WSGRA1_WSGRB1_WG16_4_1_WGM2
    SolutionIndex: 220
    SolutionNameMin: Cijk_Ailk_Bljk_HBH_MT64x128x32_MI32x32x8x1_SE_1LDSB0_AF0EM8_AMAS3_BL1_EPS1_GRVW8_GSU1_ISA908_KLA_LBSPP128_LPB8_LRVW8_MAC_NLCA1_PGR1_PLR5_SIA3_SU0_SUS256_SRVW4_TT1_64_TLDS1_USFGROn1_VAW2_VSn1_VW2_WSGRA1_WSGRB1_WG64_4_1_WGM15
    SolutionIndex: 221
    SolutionNameMin: Cijk_Ailk_Bljk_HBH_MT128x160x32_MI32x32x8x1_SN_1LDSB1_AF0EM8_AMAS3_BL1_EPS1_GRVW2_GSU1_ISA908_KLA_LBSPP128_LPB8_LRVW8_MAC_NLCA1_PGR1_PLR5_SIA3_SU32_SUS128_SRVW4_TT1_160_TLDS1_USFGROn1_VAW2_VSn1_VW2_WSGRA1_WSGRB1_WG128_2_1_WGM15
    SolutionIndex: 222
    SolutionNameMin: Cijk_Ailk_Bljk_HBH_MT32x32x64_MI16x16x16x1_SE_1LDSB0_AF0EM1_AMAS3_BL1_EPS0_GRVW8_GSU1_ISA908_KLA_LBSPP128_LPB16_LRVW8_MAC_NLCA1_PGR2_PLR5_SIA3_SU32_SUS128_SRVW4_TT1_16_TLDS1_USFGROn1_VAW2_VSn1_VW2_WSGRA1_WSGRB1_WG32_8_1_WGM1
    SolutionIndex: 223
    SolutionNameMin: Cijk_Ailk_Bljk_HBH_MT256x192x32_MI32x32x8x1_SE_1LDSB1_AF0EM8_AMAS3_BL1_EPS1_GRVW8_GSU1_ISA908_KLA_LBSPP128_LPB8_LRVW8_MAC_NLCA1_PGR1_PLR5_SIA3_SU0_SUS256_SRVW4_TT4_96_TLDS1_USFGROn1_VAW2_VSn1_VW2_WSGRA1_WSGRB1_WG64_4_1_WGM15
    SolutionIndex: 224
    SolutionNameMin: Cijk_Ailk_Bljk_HBH_MT128x256x32_MI32x32x8x1_SE_1LDSB1_AF0EM8_AMAS3_BL1_EPS1_GRVW8_GSU1_ISA908_KLA_LBSPP128_LPB8_LRVW8_MAC_NLCA1_PGR1_PLR5_SIA3_SU32_SUS256_SRVW4_TT2_128_TLDS1_USFGROn1_VAW2_VSn1_VW2_WSGRA1_WSGRB1_WG64_4_1_WGM1
    SolutionIndex: 225
    SolutionNameMin: Cijk_Ailk_Bljk_HBH_MT64x128x32_MI32x32x8x1_SE_1LDSB0_AF0EM8_AMAS3_BL1_EPS1_GRVW4_GSU1_ISA908_KLA_LBSPP128_LPB8_LRVW8_MAC_NLCA1_PGR1_PLR5_SIA3_SU0_SUS256_SRVW4_TT1_64_TLDS1_USFGROn1_VAW2_VSn1_VW2_WSGRA1_WSGRB1_WG64_4_1_WGM1
    SolutionIndex: 226
    SolutionNameMin: Cijk_Ailk_Bljk_HBH_MT128x256x32_MI32x32x8x1_SE_1LDSB1_AF0EM8_AMAS3_BL1_EPS1_GRVW8_GSU1_ISA908_KLA_LBSPP128_LPB8_LRVW8_MAC_NLCA1_PGR1_PLR5_SIA3_SU32_SUS128_SRVW4_TT2_128_TLDS1_USFGROn1_VAW2_VSn1_VW2_WSGRA1_WSGRB1_WG64_4_1_WGM15
    SolutionIndex: 227
    SolutionNameMin: Cijk_Ailk_Bljk_HBH_MT64x32x64_MI16x16x16x1_SE_1LDSB0_AF0EM1_AMAS3_BL1_EPS0_GRVW8_GSU1_ISA908_KLA_LBSPP128_LPB16_LRVW8_MAC_NLCA1_PGR2_PLR5_SIA3_SU0_SUS256_SRVW4_TT2_16_TLDS1_USFGROn1_VAW2_VSn1_VW2_WSGRA1_WSGRB1_WG32_8_1_WGM1
    SolutionIndex: 228
    SolutionNameMin: Cijk_Ailk_Bljk_HBH_MT128x64x32_MI32x32x8x1_SE_1LDSB0_AF0EM8_AMAS3_BL1_EPS0_GRVW8_GSU1_ISA908_KLA_LBSPP128_LPB8_LRVW8_MAC_NLCA1_PGR2_PLR5_SIA3_SU0_SUS256_SRVW4_TT2_32_TLDS1_USFGROn1_VAW2_VSn1_VW2_WSGRA1_WSGRB1_WG64_4_1_WGM15
    SolutionIndex: 229
    SolutionNameMin: Cijk_Ailk_Bljk_HBH_MT128x160x32_MI32x32x8x1_SN_1LDSB1_AF0EM8_AMAS3_BL1_EPS1_GRVW2_GSU1_ISA908_KLA_LBSPP128_LPB8_LRVW8_MAC_NLCA1_PGR1_PLR5_SIA3_SU0_SUS128_SRVW4_TT1_160_TLDS1_USFGROn1_VAW2_VSn1_VW2_WSGRA1_WSGRB1_WG128_2_1_WGM15
    SolutionIndex: 230
    SolutionNameMin: Cijk_Ailk_Bljk_HBH_MT64x32x64_MI16x16x16x1_SE_1LDSB0_AF0EM8_AMAS3_BL1_EPS0_GRVW2_GSU1_ISA908_KLA_LBSPP128_LPB16_LRVW8_MAC_NLCA1_PGR2_PLR5_SIA3_SU32_SUS128_SRVW4_TT2_16_TLDS1_USFGROn1_VAW2_VSn1_VW2_WSGRA1_WSGRB1_WG32_8_1_WGM15
    SolutionIndex: 231
    SolutionNameMin: Cijk_Ailk_Bljk_HBH_MT32x32x64_MI16x16x16x1_SE_1LDSB0_AF0EM8_AMAS3_BL1_EPS0_GRVW8_GSU1_ISA908_KLA_LBSPP128_LPB16_LRVW8_MAC_NLCA1_PGR2_PLR5_SIA3_SU32_SUS256_SRVW4_TT1_16_TLDS1_USFGROn1_VAW2_VSn1_VW2_WSGRA1_WSGRB1_WG32_8_1_WGM2
    SolutionIndex: 232
    SolutionNameMin: Cijk_Ailk_Bljk_HBH_MT32x64x64_MI16x16x16x1_SE_1LDSB0_AF0EM1_AMAS3_BL1_EPS0_GRVW8_GSU1_ISA908_KLA_LBSPP128_LPB16_LRVW8_MAC_NLCA1_PGR2_PLR5_SIA3_SU32_SUS256_SRVW4_TT1_32_TLDS1_USFGROn1_VAW2_VSn1_VW2_WSGRA1_WSGRB1_WG32_8_1_WGM15
    SolutionIndex: 233
    SolutionNameMin: Cijk_Ailk_Bljk_HBH_MT128x64x64_MI32x32x8x1_SE_1LDSB0_AF0EM8_AMAS3_BL1_EPS0_GRVW8_GSU5_ISA908_KLA_LBSPP128_LPB8_LRVW8_MAC_NLCA1_PGR2_PLR9_SIA3_SU32_SUS256_SRVW4_TT2_32_TLDS1_USFGROn1_VAW1_VSn1_VW2_WSGRA1_WSGRB1_WG64_4_1_WGM15
    SolutionIndex: 234
    SolutionNameMin: Cijk_Ailk_Bljk_HBH_MT128x128x32_MI32x32x8x1_SN_1LDSB0_AF0EM1_AMAS3_BL1_EPS0_GRVW4_GSU1_ISA908_KLA_LBSPP128_LPB8_LRVW8_MAC_NLCA1_PGR2_PLR5_SIA3_SU32_SUS128_SRVW4_TT2_64_TLDS1_USFGROn1_VAW2_VSn1_VW2_WSGRA1_WSGRB1_WG64_4_1_WGM15
    SolutionIndex: 235
    SolutionNameMin: Cijk_Ailk_Bljk_HBH_MT128x96x32_MI32x32x8x1_SE_1LDSB0_AF0EM8_AMAS3_BL1_EPS1_GRVW2_GSU1_ISA908_KLA_LBSPP128_LPB8_LRVW8_MAC_NLCA1_PGR1_PLR5_SIA3_SU0_SUS256_SRVW4_TT1_96_TLDS1_USFGROn1_VAW2_VSn1_VW2_WSGRA1_WSGRB1_WG128_2_1_WGM2
    SolutionIndex: 236
    SolutionNameMin: Cijk_Ailk_Bljk_HBH_MT128x160x32_MI32x32x8x1_SE_1LDSB0_AF0EM8_AMAS3_BL1_EPS0_GRVW2_GSU1_ISA908_KLA_LBSPP128_LPB8_LRVW8_MAC_NLCA1_PGR2_PLR5_SIA3_SU0_SUS256_SRVW4_TT1_160_TLDS1_USFGROn1_VAW2_VSn1_VW2_WSGRA1_WSGRB1_WG128_2_1_WGM1
    SolutionIndex: 237
    SolutionNameMin: Cijk_Ailk_Bljk_HBH_MT128x256x32_MI32x32x8x1_SN_1LDSB1_AF0EM8_AMAS3_BL1_EPS1_GRVW8_GSU1_ISA908_KLA_LBSPP128_LPB8_LRVW8_MAC_NLCA1_PGR1_PLR5_SIA3_SU0_SUS256_SRVW4_TT2_128_TLDS1_USFGROn1_VAW2_VSn1_VW2_WSGRA1_WSGRB1_WG64_4_1_WGM1
    SolutionIndex: 238
    SolutionNameMin: Cijk_Ailk_Bljk_HBH_MT64x64x32_MI32x32x8x1_SN_1LDSB0_AF0EM1_AMAS3_BL1_EPS0_GRVW8_GSU1_ISA908_KLA_LBSPP128_LPB8_LRVW8_MAC_NLCA1_PGR2_PLR5_SIA3_SU32_SUS128_SRVW4_TT1_32_TLDS1_USFGROn1_VAW2_VSn1_VW2_WSGRA1_WSGRB1_WG64_4_1_WGM1
    SolutionIndex: 239
    SolutionNameMin: Cijk_Ailk_Bljk_HBH_MT128x160x32_MI32x32x8x1_SE_1LDSB0_AF0EM8_AMAS3_BL1_EPS0_GRVW4_GSU1_ISA908_KLA_LBSPP128_LPB8_LRVW8_MAC_NLCA1_PGR2_PLR5_SIA3_SU0_SUS256_SRVW4_TT1_160_TLDS1_USFGROn1_VAW2_VSn1_VW2_WSGRA1_WSGRB1_WG128_2_1_WGM2
    SolutionIndex: 240
    SolutionNameMin: Cijk_Ailk_Bljk_HBH_MT128x128x32_MI32x32x8x1_SE_1LDSB0_AF0EM8_AMAS3_BL1_EPS0_GRVW4_GSU1_ISA908_KLA_LBSPP128_LPB8_LRVW8_MAC_NLCA1_PGR2_PLR5_SIA3_SU32_SUS256_SRVW4_TT2_64_TLDS1_USFGROn1_VAW2_VSn1_VW2_WSGRA1_WSGRB1_WG64_4_1_WGM15
    SolutionIndex: 241
    SolutionNameMin: Cijk_Ailk_Bljk_HBH_MT64x128x32_MI32x32x8x1_SE_1LDSB0_AF0EM8_AMAS3_BL1_EPS1_GRVW8_GSU1_ISA908_KLA_LBSPP128_LPB8_LRVW8_MAC_NLCA1_PGR1_PLR5_SIA3_SU0_SUS256_SRVW4_TT1_64_TLDS1_USFGROn1_VAW2_VSn1_VW2_WSGRA1_WSGRB1_WG64_4_1_WGM1
    SolutionIndex: 242
    SolutionNameMin: Cijk_Ailk_Bljk_HBH_MT32x32x64_MI16x16x16x1_SE_1LDSB0_AF0EM8_AMAS3_BL1_EPS1_GRVW8_GSU5_ISA908_KLA_LBSPP128_LPB16_LRVW8_MAC_NLCA1_PGR1_PLR5_SIA3_SU32_SUS128_SRVW0_TT1_16_TLDS1_USFGROn1_VAW1_VSn1_VW2_WSGRA1_WSGRB1_WG32_8_1_WGM1
    SolutionIndex: 243
    SolutionNameMin: Cijk_Ailk_Bljk_HBH_MT128x128x32_MI32x32x8x1_SE_1LDSB0_AF0EM8_AMAS3_BL1_EPS0_GRVW8_GSU1_ISA908_KLA_LBSPP128_LPB8_LRVW8_MAC_NLCA1_PGR2_PLR5_SIA3_SU32_SUS128_SRVW4_TT2_64_TLDS1_USFGROn1_VAW2_VSn1_VW2_WSGRA1_WSGRB1_WG64_4_1_WGM15
    SolutionIndex: 244
    SolutionNameMin: Cijk_Ailk_Bljk_HBH_MT32x64x64_MI16x16x16x1_SE_1LDSB0_AF0EM8_AMAS3_BL1_EPS1_GRVW8_GSU1_ISA908_KLA_LBSPP128_LPB16_LRVW8_MAC_NLCA1_PGR1_PLR5_SIA3_SU32_SUS256_SRVW4_TT1_32_TLDS1_USFGROn1_VAW2_VSn1_VW2_WSGRA1_WSGRB1_WG32_8_1_WGM2
    SolutionIndex: 245
    SolutionNameMin: Cijk_Ailk_Bljk_HBH_MT256x160x32_MI32x32x8x1_SE_1LDSB0_AF0EM8_AMAS3_BL1_EPS0_GRVW4_GSU1_ISA908_KLA_LBSPP128_LPB8_LRVW8_MAC_NLCA1_PGR2_PLR5_SIA3_SU32_SUS256_SRVW4_TT2_160_TLDS1_USFGROn1_VAW2_VSn1_VW2_WSGRA1_WSGRB1_WG128_2_1_WGM15
    SolutionIndex: 246
    SolutionNameMin: Cijk_Ailk_Bljk_HBH_MT128x128x32_MI32x32x8x1_SE_1LDSB0_AF0EM8_AMAS3_BL1_EPS0_GRVW2_GSU1_ISA908_KLA_LBSPP128_LPB8_LRVW8_MAC_NLCA1_PGR2_PLR5_SIA3_SU32_SUS128_SRVW4_TT2_64_TLDS1_USFGROn1_VAW2_VSn1_VW2_WSGRA1_WSGRB1_WG64_4_1_WGM2
    SolutionIndex: 247
    SolutionNameMin: Cijk_Ailk_Bljk_HBH_MT128x64x32_MI32x32x8x1_SE_1LDSB0_AF0EM8_AMAS3_BL1_EPS1_GRVW8_GSU1_ISA908_KLA_LBSPP128_LPB8_LRVW8_MAC_NLCA1_PGR1_PLR5_SIA3_SU0_SUS256_SRVW4_TT2_32_TLDS1_USFGROn1_VAW2_VSn1_VW2_WSGRA1_WSGRB1_WG64_4_1_WGM1
    SolutionIndex: 248
    SolutionNameMin: Cijk_Ailk_Bljk_HBH_MT64x16x64_MI16x16x16x1_SE_1LDSB0_AF0EM8_AMAS3_BL1_EPS0_GRVW2_GSU1_ISA908_KLA_LBSPP128_LPB16_LRVW8_MAC_NLCA1_PGR2_PLR5_SIA3_SU0_SUS256_SRVW0_TT1_16_TLDS1_USFGROn1_VAW2_VSn1_VW2_WSGRA1_WSGRB1_WG64_4_1_WGM1
    SolutionIndex: 249
    SolutionNameMin: Cijk_Ailk_Bljk_HBH_MT64x64x32_MI32x32x8x1_SE_1LDSB0_AF0EM8_AMAS3_BL1_EPS0_GRVW8_GSU1_ISA908_KLA_LBSPP128_LPB8_LRVW8_MAC_NLCA1_PGR2_PLR5_SIA3_SU0_SUS256_SRVW4_TT1_32_TLDS1_USFGROn1_VAW2_VSn1_VW2_WSGRA1_WSGRB1_WG64_4_1_WGM2
    SolutionIndex: 250
    SolutionNameMin: Cijk_Ailk_Bljk_HBH_MT128x256x32_MI32x32x8x1_SE_1LDSB0_AF0EM8_AMAS3_BL1_EPS0_GRVW8_GSU1_ISA908_KLA_LBSPP128_LPB8_LRVW8_MAC_NLCA1_PGR2_PLR5_SIA3_SU0_SUS256_SRVW4_TT2_128_TLDS1_USFGROn1_VAW2_VSn1_VW2_WSGRA1_WSGRB1_WG64_4_1_WGM2
    SolutionIndex: 251
    SolutionNameMin: Cijk_Ailk_Bljk_HBH_MT64x64x32_MI32x32x8x1_SE_1LDSB0_AF0EM1_AMAS3_BL1_EPS0_GRVW2_GSU1_ISA908_KLA_LBSPP128_LPB8_LRVW8_MAC_NLCA1_PGR2_PLR5_SIA3_SU32_SUS256_SRVW4_TT1_32_TLDS1_USFGROn1_VAW2_VSn1_VW2_WSGRA1_WSGRB1_WG64_4_1_WGM15
    SolutionIndex: 252
    SolutionNameMin: Cijk_Ailk_Bljk_HBH_MT64x128x32_MI32x32x8x1_SE_1LDSB0_AF0EM8_AMAS3_BL1_EPS0_GRVW8_GSU1_ISA908_KLA_LBSPP128_LPB8_LRVW8_MAC_NLCA1_PGR2_PLR5_SIA3_SU32_SUS256_SRVW4_TT1_64_TLDS1_USFGROn1_VAW2_VSn1_VW2_WSGRA1_WSGRB1_WG64_4_1_WGM2
    SolutionIndex: 253
    SolutionNameMin: Cijk_Ailk_Bljk_HBH_MT256x160x32_MI32x32x8x1_SE_1LDSB0_AF0EM8_AMAS3_BL1_EPS1_GRVW4_GSU1_ISA908_KLA_LBSPP128_LPB8_LRVW8_MAC_NLCA1_PGR1_PLR5_SIA3_SU0_SUS256_SRVW4_TT2_160_TLDS1_USFGROn1_VAW2_VSn1_VW2_WSGRA1_WSGRB1_WG128_2_1_WGM1
    SolutionIndex: 254
    SolutionNameMin: Cijk_Ailk_Bljk_HBH_MT64x16x32_MI16x16x16x1_SE_1LDSB0_AF0EM8_AMAS3_BL1_EPS0_GRVW4_GSU1_ISA908_KLA_LBSPP128_LPB16_LRVW8_MAC_NLCA1_PGR2_PLR2_SIA3_SU0_SUS256_SRVW0_TT1_16_TLDS1_USFGROn1_VAW2_VSn1_VW2_WSGRA1_WSGRB1_WG64_4_1_WGM1
    SolutionIndex: 255
    SolutionNameMin: Cijk_Ailk_Bljk_HBH_MT64x64x64_MI32x32x8x1_SE_1LDSB0_AF0EM1_AMAS3_BL1_EPS0_GRVW8_GSU1_ISA908_KLA_LBSPP128_LPB8_LRVW8_MAC_NLCA1_PGR2_PLR9_SIA3_SU0_SUS256_SRVW4_TT1_32_TLDS1_USFGROn1_VAW2_VSn1_VW2_WSGRA1_WSGRB1_WG64_4_1_WGM15
    SolutionIndex: 256
    SolutionNameMin: Cijk_Ailk_Bljk_HBH_MT192x192x32_MI32x32x8x1_SE_1LDSB0_AF0EM8_AMAS3_BL1_EPS0_GRVW4_GSU1_ISA908_KLA_LBSPP128_LPB8_LRVW8_MAC_NLCA3_PGR2_PLR5_SIA3_SU0_SUS256_SRVW0_TT3_96_TLDS1_USFGROn1_VAW2_VSn1_VW2_WSGRA1_WSGRB1_WG64_4_1_WGM15
    SolutionIndex: 257
    SolutionNameMin: Cijk_Ailk_Bljk_HBH_MT256x256x32_MI32x32x8x1_SN_1LDSB1_AF0EM8_AMAS3_BL1_EPS1_GRVW8_GSU1_ISA908_KLA_LBSPP128_LPB8_LRVW8_MAC_NLCA1_PGR1_PLR5_SIA3_SU0_SUS256_SRVW4_TT4_128_TLDS1_USFGROn1_VAW2_VSn1_VW2_WSGRA1_WSGRB1_WG64_4_1_WGM1
    SolutionIndex: 258
    SolutionNameMin: Cijk_Ailk_Bljk_HBH_MT128x256x32_MI32x32x8x1_SE_1LDSB0_AF0EM8_AMAS3_BL1_EPS1_GRVW8_GSU1_ISA908_KLA_LBSPP128_LPB8_LRVW8_MAC_NLCA1_PGR1_PLR5_SIA3_SU32_SUS128_SRVW4_TT2_128_TLDS1_USFGROn1_VAW2_VSn1_VW2_WSGRA1_WSGRB1_WG64_4_1_WGM2
    SolutionIndex: 259
    SolutionNameMin: Cijk_Ailk_Bljk_HBH_MT192x128x32_MI32x32x8x1_SE_1LDSB0_AF0EM8_AMAS3_BL1_EPS0_GRVW8_GSU1_ISA908_KLA_LBSPP128_LPB8_LRVW8_MAC_NLCA3_PGR2_PLR5_SIA3_SU0_SUS256_SRVW0_TT3_64_TLDS1_USFGROn1_VAW2_VSn1_VW2_WSGRA1_WSGRB1_WG64_4_1_WGM2
    SolutionIndex: 260
    SolutionNameMin: Cijk_Ailk_Bljk_HBH_MT64x16x64_MI16x16x16x1_SE_1LDSB0_AF0EM8_AMAS3_BL1_EPS0_GRVW2_GSU1_ISA908_KLA_LBSPP128_LPB16_LRVW8_MAC_NLCA1_PGR2_PLR5_SIA3_SU0_SUS256_SRVW4_TT1_16_TLDS1_USFGROn1_VAW2_VSn1_VW2_WSGRA1_WSGRB1_WG64_4_1_WGM2
    SolutionIndex: 261
    SolutionNameMin: Cijk_Ailk_Bljk_HBH_MT64x16x64_MI16x16x16x1_SE_1LDSB0_AF0EM8_AMAS3_BL1_EPS1_GRVW8_GSU1_ISA908_KLA_LBSPP128_LPB16_LRVW8_MAC_NLCA1_PGR1_PLR5_SIA3_SU0_SUS256_SRVW0_TT1_16_TLDS1_USFGROn1_VAW2_VSn1_VW2_WSGRA1_WSGRB1_WG64_4_1_WGM15
    SolutionIndex: 262
    SolutionNameMin: Cijk_Ailk_Bljk_HBH_MT32x32x64_MI16x16x16x1_SE_1LDSB0_AF0EM8_AMAS3_BL1_EPS1_GRVW8_GSU1_ISA908_KLA_LBSPP128_LPB16_LRVW8_MAC_NLCA1_PGR1_PLR5_SIA3_SU0_SUS256_SRVW4_TT1_16_TLDS1_USFGROn1_VAW2_VSn1_VW2_WSGRA1_WSGRB1_WG32_8_1_WGM15
    SolutionIndex: 263
    SolutionNameMin: Cijk_Ailk_Bljk_HBH_MT128x160x32_MI32x32x8x1_SE_1LDSB1_AF0EM8_AMAS3_BL1_EPS1_GRVW2_GSU1_ISA908_KLA_LBSPP128_LPB8_LRVW8_MAC_NLCA1_PGR1_PLR5_SIA3_SU32_SUS128_SRVW4_TT1_160_TLDS1_USFGROn1_VAW2_VSn1_VW2_WSGRA1_WSGRB1_WG128_2_1_WGM1
    SolutionIndex: 264
    SolutionNameMin: Cijk_Ailk_Bljk_HBH_MT128x128x32_MI32x32x8x1_SE_1LDSB1_AF0EM8_AMAS3_BL1_EPS1_GRVW2_GSU1_ISA908_KLA_LBSPP128_LPB8_LRVW8_MAC_NLCA1_PGR1_PLR5_SIA3_SU32_SUS256_SRVW4_TT2_64_TLDS1_USFGROn1_VAW2_VSn1_VW2_WSGRA1_WSGRB1_WG64_4_1_WGM1
    SolutionIndex: 265
    SolutionNameMin: Cijk_Ailk_Bljk_HBH_MT64x16x32_MI16x16x16x1_SE_1LDSB0_AF0EM8_AMAS3_BL1_EPS0_GRVW8_GSU1_ISA908_KLA_LBSPP128_LPB16_LRVW8_MAC_NLCA1_PGR2_PLR2_SIA3_SU0_SUS256_SRVW0_TT1_16_TLDS1_USFGROn1_VAW2_VSn1_VW2_WSGRA1_WSGRB1_WG64_4_1_WGM1
    SolutionIndex: 266
    SolutionNameMin: Cijk_Ailk_Bljk_HBH_MT64x64x32_MI32x32x8x1_SE_1LDSB0_AF0EM8_AMAS3_BL1_EPS1_GRVW8_GSU1_ISA908_KLA_LBSPP128_LPB8_LRVW8_MAC_NLCA1_PGR1_PLR5_SIA3_SU0_SUS256_SRVW4_TT1_32_TLDS1_USFGROn1_VAW2_VSn1_VW2_WSGRA1_WSGRB1_WG64_4_1_WGM15
    SolutionIndex: 267
    SolutionNameMin: Cijk_Ailk_Bljk_HBH_MT32x64x64_MI16x16x16x1_SE_1LDSB0_AF0EM8_AMAS3_BL1_EPS1_GRVW8_GSU7_ISA908_KLA_LBSPP128_LPB16_LRVW8_MAC_NLCA1_PGR1_PLR5_SIA3_SU32_SUS256_SRVW0_TT1_32_TLDS1_USFGROn1_VAW1_VSn1_VW2_WSGRA1_WSGRB1_WG32_8_1_WGM15
    SolutionIndex: 268
    SolutionNameMin: Cijk_Ailk_Bljk_HBH_MT128x128x32_MI32x32x8x1_SE_1LDSB1_AF0EM8_AMAS3_BL1_EPS1_GRVW2_GSU1_ISA908_KLA_LBSPP128_LPB8_LRVW8_MAC_NLCA1_PGR1_PLR5_SIA3_SU0_SUS256_SRVW4_TT2_64_TLDS1_USFGROn1_VAW2_VSn1_VW2_WSGRA1_WSGRB1_WG64_4_1_WGM2
    SolutionIndex: 269
    SolutionNameMin: Cijk_Ailk_Bljk_HBH_MT64x128x64_MI32x32x8x1_SE_1LDSB0_AF0EM1_AMAS3_BL1_EPS0_GRVW8_GSU1_ISA908_KLA_LBSPP128_LPB8_LRVW8_MAC_NLCA1_PGR2_PLR9_SIA3_SU0_SUS256_SRVW4_TT1_64_TLDS1_USFGROn1_VAW2_VSn1_VW2_WSGRA1_WSGRB1_WG64_4_1_WGM15
    SolutionIndex: 270
    SolutionNameMin: Cijk_Ailk_Bljk_HBH_MT128x64x32_MI32x32x8x1_SE_1LDSB0_AF0EM8_AMAS3_BL1_EPS0_GRVW8_GSU1_ISA908_KLA_LBSPP128_LPB8_LRVW8_MAC_NLCA1_PGR2_PLR5_SIA3_SU32_SUS256_SRVW4_TT2_32_TLDS1_USFGROn1_VAW2_VSn1_VW2_WSGRA1_WSGRB1_WG64_4_1_WGM15
    SolutionIndex: 271
    SolutionNameMin: Cijk_Ailk_Bljk_HBH_MT256x128x32_MI32x32x8x1_SE_1LDSB0_AF0EM8_AMAS3_BL1_EPS0_GRVW8_GSU1_ISA908_KLA_LBSPP128_LPB8_LRVW8_MAC_NLCA1_PGR2_PLR5_SIA3_SU0_SUS256_SRVW4_TT4_64_TLDS1_USFGROn1_VAW2_VSn1_VW2_WSGRA1_WSGRB1_WG64_4_1_WGM15
    SolutionIndex: 272
    SolutionNameMin: Cijk_Ailk_Bljk_HBH_MT256x128x32_MI32x32x8x1_SE_1LDSB1_AF0EM8_AMAS3_BL1_EPS1_GRVW8_GSU1_ISA908_KLA_LBSPP128_LPB8_LRVW8_MAC_NLCA1_PGR1_PLR5_SIA3_SU32_SUS128_SRVW4_TT4_64_TLDS1_USFGROn1_VAW2_VSn1_VW2_WSGRA1_WSGRB1_WG64_4_1_WGM15
    SolutionIndex: 273
    SolutionNameMin: Cijk_Ailk_Bljk_HBH_MT64x128x32_MI32x32x8x1_SE_1LDSB0_AF0EM8_AMAS3_BL1_EPS0_GRVW8_GSU1_ISA908_KLA_LBSPP128_LPB8_LRVW8_MAC_NLCA1_PGR2_PLR5_SIA3_SU32_SUS256_SRVW4_TT1_64_TLDS1_USFGROn1_VAW2_VSn1_VW2_WSGRA1_WSGRB1_WG64_4_1_WGM15
    SolutionIndex: 274
    SolutionNameMin: Cijk_Ailk_Bljk_HBH_MT64x64x32_MI32x32x8x1_SN_1LDSB0_AF0EM8_AMAS3_BL1_EPS0_GRVW2_GSU1_ISA908_KLA_LBSPP128_LPB8_LRVW8_MAC_NLCA1_PGR2_PLR5_SIA3_SU0_SUS256_SRVW4_TT1_32_TLDS1_USFGROn1_VAW2_VSn1_VW2_WSGRA1_WSGRB1_WG64_4_1_WGM1
    SolutionIndex: 275
    SolutionNameMin: Cijk_Ailk_Bljk_HBH_MT32x32x64_MI16x16x16x1_SE_1LDSB0_AF0EM8_AMAS3_BL1_EPS1_GRVW8_GSU1_ISA908_KLA_LBSPP128_LPB16_LRVW8_MAC_NLCA1_PGR1_PLR5_SIA3_SU32_SUS128_SRVW4_TT1_16_TLDS1_USFGROn1_VAW2_VSn1_VW2_WSGRA1_WSGRB1_WG32_8_1_WGM15
    SolutionIndex: 276
    SolutionNameMin: Cijk_Ailk_Bljk_HBH_MT32x32x64_MI16x16x16x1_SE_1LDSB0_AF0EM1_AMAS3_BL1_EPS0_GRVW8_GSU1_ISA908_KLA_LBSPP128_LPB16_LRVW8_MAC_NLCA1_PGR2_PLR5_SIA3_SU0_SUS256_SRVW4_TT1_16_TLDS1_USFGROn1_VAW2_VSn1_VW2_WSGRA1_WSGRB1_WG32_8_1_WGM15
    SolutionIndex: 277
    SolutionNameMin: Cijk_Ailk_Bljk_HBH_MT64x16x32_MI16x16x16x1_SE_1LDSB0_AF0EM8_AMAS3_BL1_EPS0_GRVW4_GSU1_ISA908_KLA_LBSPP128_LPB16_LRVW8_MAC_NLCA1_PGR2_PLR2_SIA3_SU0_SUS256_SRVW0_TT1_16_TLDS1_USFGROn1_VAW2_VSn1_VW2_WSGRA1_WSGRB1_WG64_4_1_WGM2
    SolutionIndex: 278
    SolutionNameMin: Cijk_Ailk_Bljk_HBH_MT64x32x32_MI16x16x16x1_SE_1LDSB0_AF0EM8_AMAS3_BL1_EPS0_GRVW4_GSU7_ISA908_KLA_LBSPP128_LPB16_LRVW8_MAC_NLCA1_PGR2_PLR2_SIA3_SU0_SUS256_SRVW4_TT2_16_TLDS1_USFGROn1_VAW1_VSn1_VW2_WSGRA1_WSGRB1_WG32_8_1_WGM2
    SolutionIndex: 279
    SolutionNameMin: Cijk_Ailk_Bljk_HBH_MT128x96x32_MI32x32x8x1_SE_1LDSB1_AF0EM8_AMAS3_BL1_EPS1_GRVW2_GSU1_ISA908_KLA_LBSPP128_LPB8_LRVW8_MAC_NLCA1_PGR1_PLR5_SIA3_SU0_SUS256_SRVW4_TT1_96_TLDS1_USFGROn1_VAW2_VSn1_VW2_WSGRA1_WSGRB1_WG128_2_1_WGM2
    SolutionIndex: 280
    SolutionNameMin: Cijk_Ailk_Bljk_HBH_MT16x16x64_MI16x16x16x1_SN_1LDSB0_AF0EM8_AMAS3_BL1_EPS0_GRVW4_GSU1_ISA908_KLA_LBSPP128_LPB16_LRVW8_MAC_NLCA1_PGR2_PLR5_SIA3_SU0_SUS256_SRVW0_TT1_16_TLDS1_USFGROn1_VAW2_VSn1_VW2_WSGRA1_WSGRB1_WG16_4_1_WGM1
    SolutionIndex: 281
    SolutionNameMin: Cijk_Ailk_Bljk_HBH_MT128x128x32_MI32x32x8x1_SE_1LDSB0_AF0EM8_AMAS3_BL1_EPS0_GRVW4_GSU1_ISA908_KLA_LBSPP128_LPB8_LRVW8_MAC_NLCA1_PGR2_PLR5_SIA3_SU0_SUS256_SRVW4_TT2_64_TLDS1_USFGROn1_VAW2_VSn1_VW2_WSGRA1_WSGRB1_WG64_4_1_WGM15
    SolutionIndex: 282
    SolutionNameMin: Cijk_Ailk_Bljk_HBH_MT128x192x32_MI32x32x8x1_SE_1LDSB0_AF0EM8_AMAS3_BL1_EPS0_GRVW8_GSU1_ISA908_KLA_LBSPP128_LPB8_LRVW8_MAC_NLCA1_PGR2_PLR5_SIA3_SU32_SUS256_SRVW4_TT2_96_TLDS1_USFGROn1_VAW2_VSn1_VW2_WSGRA1_WSGRB1_WG64_4_1_WGM1
    SolutionIndex: 283
    SolutionNameMin: Cijk_Ailk_Bljk_HBH_MT32x32x64_MI16x16x16x1_SE_1LDSB0_AF0EM8_AMAS3_BL1_EPS1_GRVW4_GSU1_ISA908_KLA_LBSPP128_LPB16_LRVW8_MAC_NLCA1_PGR1_PLR5_SIA3_SU0_SUS256_SRVW4_TT1_16_TLDS1_USFGROn1_VAW2_VSn1_VW2_WSGRA1_WSGRB1_WG32_8_1_WGM1
    SolutionIndex: 284
    SolutionNameMin: Cijk_Ailk_Bljk_HBH_MT128x160x32_MI32x32x8x1_SN_1LDSB1_AF0EM8_AMAS3_BL1_EPS1_GRVW2_GSU1_ISA908_KLA_LBSPP128_LPB8_LRVW8_MAC_NLCA1_PGR1_PLR5_SIA3_SU0_SUS128_SRVW4_TT1_160_TLDS1_USFGROn1_VAW2_VSn1_VW2_WSGRA1_WSGRB1_WG128_2_1_WGM1
    SolutionIndex: 285
    SolutionNameMin: Cijk_Ailk_Bljk_HBH_MT128x256x32_MI32x32x8x1_SE_1LDSB1_AF0EM8_AMAS3_BL1_EPS0_GRVW8_GSU1_ISA908_KLA_LBSPP128_LPB8_LRVW8_MAC_NLCA1_PGR2_PLR5_SIA3_SU32_SUS256_SRVW4_TT2_128_TLDS1_USFGROn1_VAW2_VSn1_VW2_WSGRA1_WSGRB1_WG64_4_1_WGM15
    SolutionIndex: 286
    SolutionNameMin: Cijk_Ailk_Bljk_HBH_MT96x128x32_MI32x32x8x1_SE_1LDSB0_AF0EM8_AMAS3_BL1_EPS0_GRVW4_GSU1_ISA908_KLA_LBSPP128_LPB8_LRVW8_MAC_NLCA3_PGR2_PLR5_SIA3_SU0_SUS256_SRVW0_TT3_32_TLDS1_USFGROn1_VAW2_VSn1_VW2_WSGRA1_WSGRB1_WG32_8_1_WGM1
    SolutionIndex: 287
    SolutionNameMin: Cijk_Ailk_Bljk_HBH_MT256x128x32_MI32x32x8x1_SE_1LDSB0_AF0EM8_AMAS3_BL1_EPS1_GRVW8_GSU1_ISA908_KLA_LBSPP128_LPB8_LRVW8_MAC_NLCA1_PGR1_PLR5_SIA3_SU32_SUS256_SRVW4_TT4_64_TLDS1_USFGROn1_VAW2_VSn1_VW2_WSGRA1_WSGRB1_WG64_4_1_WGM2
    SolutionIndex: 288
    SolutionNameMin: Cijk_Ailk_Bljk_HBH_MT96x96x64_MI16x16x16x1_SE_1LDSB0_AF0EM8_AMAS3_BL1_EPS1_GRVW8_GSU1_ISA908_KLA_LBSPP128_LPB16_LRVW8_MAC_NLCA3_PGR1_PLR5_SIA3_SU0_SUS256_SRVW0_TT3_48_TLDS1_USFGROn1_VAW2_VSn1_VW2_WSGRA1_WSGRB1_WG32_8_1_WGM15
    SolutionIndex: 289
    SolutionNameMin: Cijk_Ailk_Bljk_HBH_MT128x256x32_MI32x32x8x1_SE_1LDSB0_AF0EM8_AMAS3_BL1_EPS0_GRVW8_GSU1_ISA908_KLA_LBSPP128_LPB8_LRVW8_MAC_NLCA1_PGR2_PLR5_SIA3_SU32_SUS128_SRVW4_TT2_128_TLDS1_USFGROn1_VAW2_VSn1_VW2_WSGRA1_WSGRB1_WG64_4_1_WGM2
    SolutionIndex: 290
    SolutionNameMin: Cijk_Ailk_Bljk_HBH_MT32x64x32_MI16x16x16x1_SE_1LDSB1_AF0EM8_AMAS3_BL1_EPS1_GRVW2_GSU1_ISA908_KLA_LBSPP128_LPB16_LRVW8_MAC_NLCA1_PGR1_PLR2_SIA3_SU0_SUS256_SRVW4_TT1_32_TLDS1_USFGROn1_VAW2_VSn1_VW2_WSGRA1_WSGRB1_WG32_8_1_WGM15
    SolutionIndex: 291
    SolutionNameMin: Cijk_Ailk_Bljk_HBH_MT64x128x32_MI32x32x8x1_SE_1LDSB0_AF0EM8_AMAS3_BL1_EPS0_GRVW2_GSU1_ISA908_KLA_LBSPP128_LPB8_LRVW8_MAC_NLCA1_PGR2_PLR5_SIA3_SU32_SUS256_SRVW4_TT1_64_TLDS1_USFGROn1_VAW2_VSn1_VW2_WSGRA1_WSGRB1_WG64_4_1_WGM2
    SolutionIndex: 292
    SolutionNameMin: Cijk_Ailk_Bljk_HBH_MT128x96x64_MI32x32x8x1_SE_1LDSB0_AF0EM8_AMAS3_BL1_EPS1_GRVW8_GSU5_ISA908_KLA_LBSPP128_LPB8_LRVW8_MAC_NLCA1_PGR1_PLR9_SIA3_SU0_SUS256_SRVW0_TT1_96_TLDS1_USFGROn1_VAW1_VSn1_VW2_WSGRA1_WSGRB1_WG128_2_1_WGM1
    SolutionIndex: 293
    SolutionNameMin: Cijk_Ailk_Bljk_HBH_MT128x64x32_MI32x32x8x1_SE_1LDSB0_AF0EM8_AMAS3_BL1_EPS1_GRVW8_GSU1_ISA908_KLA_LBSPP128_LPB8_LRVW8_MAC_NLCA1_PGR1_PLR5_SIA3_SU0_SUS256_SRVW4_TT2_32_TLDS1_USFGROn1_VAW2_VSn1_VW2_WSGRA1_WSGRB1_WG64_4_1_WGM15
    SolutionIndex: 294
    SolutionNameMin: Cijk_Ailk_Bljk_HBH_MT64x128x64_MI32x32x8x1_SE_1LDSB0_AF0EM8_AMAS3_BL1_EPS0_GRVW8_GSU1_ISA908_KLA_LBSPP128_LPB8_LRVW8_MAC_NLCA1_PGR2_PLR9_SIA3_SU32_SUS256_SRVW4_TT1_64_TLDS1_USFGROn1_VAW2_VSn1_VW2_WSGRA1_WSGRB1_WG64_4_1_WGM1
    SolutionIndex: 295
    SolutionNameMin: Cijk_Ailk_Bljk_HBH_MT32x32x64_MI16x16x16x1_SE_1LDSB0_AF0EM8_AMAS3_BL1_EPS1_GRVW2_GSU1_ISA908_KLA_LBSPP128_LPB16_LRVW8_MAC_NLCA1_PGR1_PLR5_SIA3_SU0_SUS256_SRVW4_TT1_16_TLDS1_USFGROn1_VAW2_VSn1_VW2_WSGRA1_WSGRB1_WG32_8_1_WGM1
    SolutionIndex: 296
    SolutionNameMin: Cijk_Ailk_Bljk_HBH_MT64x64x32_MI32x32x8x1_SE_1LDSB0_AF0EM8_AMAS3_BL1_EPS1_GRVW8_GSU1_ISA908_KLA_LBSPP128_LPB8_LRVW8_MAC_NLCA1_PGR1_PLR5_SIA3_SU0_SUS256_SRVW4_TT1_32_TLDS1_USFGROn1_VAW2_VSn1_VW2_WSGRA1_WSGRB1_WG64_4_1_WGM2
    SolutionIndex: 297
    SolutionNameMin: Cijk_Ailk_Bljk_HBH_MT32x32x64_MI16x16x16x1_SE_1LDSB0_AF0EM1_AMAS3_BL1_EPS0_GRVW4_GSU3_ISA908_KLA_LBSPP128_LPB16_LRVW8_MAC_NLCA1_PGR2_PLR5_SIA3_SU0_SUS256_SRVW4_TT1_16_TLDS1_USFGROn1_VAW1_VSn1_VW2_WSGRA1_WSGRB1_WG32_8_1_WGM2
    SolutionIndex: 298
    SolutionNameMin: Cijk_Ailk_Bljk_HBH_MT256x128x32_MI32x32x8x1_SE_1LDSB1_AF0EM8_AMAS3_BL1_EPS1_GRVW8_GSU1_ISA908_KLA_LBSPP128_LPB8_LRVW8_MAC_NLCA1_PGR1_PLR5_SIA3_SU0_SUS256_SRVW4_TT4_64_TLDS1_USFGROn1_VAW2_VSn1_VW2_WSGRA1_WSGRB1_WG64_4_1_WGM15
    SolutionIndex: 299
    SolutionNameMin: Cijk_Ailk_Bljk_HBH_MT64x32x32_MI16x16x16x1_SE_1LDSB1_AF0EM8_AMAS3_BL1_EPS1_GRVW2_GSU1_ISA908_KLA_LBSPP128_LPB16_LRVW8_MAC_NLCA1_PGR1_PLR2_SIA3_SU0_SUS256_SRVW4_TT2_16_TLDS1_USFGROn1_VAW2_VSn1_VW2_WSGRA1_WSGRB1_WG32_8_1_WGM15
    SolutionIndex: 300
    SolutionNameMin: Cijk_Ailk_Bljk_HBH_MT32x32x64_MI16x16x16x1_SE_1LDSB0_AF0EM8_AMAS3_BL1_EPS0_GRVW4_GSU1_ISA908_KLA_LBSPP128_LPB16_LRVW8_MAC_NLCA1_PGR2_PLR5_SIA3_SU0_SUS256_SRVW4_TT1_16_TLDS1_USFGROn1_VAW2_VSn1_VW2_WSGRA1_WSGRB1_WG32_8_1_WGM2
    SolutionIndex: 301
    SolutionNameMin: Cijk_Ailk_Bljk_HBH_MT256x160x32_MI32x32x8x1_SE_1LDSB0_AF0EM8_AMAS3_BL1_EPS1_GRVW4_GSU1_ISA908_KLA_LBSPP128_LPB8_LRVW8_MAC_NLCA1_PGR1_PLR5_SIA3_SU32_SUS128_SRVW4_TT2_160_TLDS1_USFGROn1_VAW2_VSn1_VW2_WSGRA1_WSGRB1_WG128_2_1_WGM15
    SolutionIndex: 302
    SolutionNameMin: Cijk_Ailk_Bljk_HBH_MT32x32x64_MI16x16x16x1_SE_1LDSB0_AF0EM8_AMAS3_BL1_EPS0_GRVW4_GSU1_ISA908_KLA_LBSPP128_LPB16_LRVW8_MAC_NLCA1_PGR2_PLR5_SIA3_SU0_SUS256_SRVW4_TT1_16_TLDS1_USFGROn1_VAW2_VSn1_VW2_WSGRA1_WSGRB1_WG32_8_1_WGM1
    SolutionIndex: 303
    SolutionNameMin: Cijk_Ailk_Bljk_HBH_MT96x128x64_MI32x32x8x1_SE_1LDSB0_AF0EM1_AMAS3_BL1_EPS0_GRVW8_GSU1_ISA908_KLA_LBSPP128_LPB8_LRVW8_MAC_NLCA3_PGR2_PLR9_SIA3_SU0_SUS256_SRVW0_TT3_32_TLDS1_USFGROn1_VAW2_VSn1_VW2_WSGRA1_WSGRB1_WG32_8_1_WGM1
    SolutionIndex: 304
    SolutionNameMin: Cijk_Ailk_Bljk_HBH_MT256x160x32_MI32x32x8x1_SE_1LDSB0_AF0EM1_AMAS3_BL1_EPS0_GRVW4_GSU1_ISA908_KLA_LBSPP128_LPB8_LRVW8_MAC_NLCA1_PGR2_PLR5_SIA3_SU0_SUS256_SRVW4_TT2_160_TLDS1_USFGROn1_VAW2_VSn1_VW2_WSGRA1_WSGRB1_WG128_2_1_WGM2
    SolutionIndex: 305
    SolutionNameMin: Cijk_Ailk_Bljk_HBH_MT128x160x64_MI32x32x8x1_SE_1LDSB1_AF0EM8_AMAS3_BL1_EPS1_GRVW2_GSU1_ISA908_KLA_LBSPP128_LPB8_LRVW8_MAC_NLCA1_PGR1_PLR9_SIA3_SU32_SUS128_SRVW4_TT1_160_TLDS1_USFGROn1_VAW2_VSn1_VW2_WSGRA1_WSGRB1_WG128_2_1_WGM15
    SolutionIndex: 306
    SolutionNameMin: Cijk_Ailk_Bljk_HBH_MT32x64x64_MI16x16x16x1_SE_1LDSB0_AF0EM8_AMAS3_BL1_EPS1_GRVW8_GSU1_ISA908_KLA_LBSPP128_LPB16_LRVW8_MAC_NLCA1_PGR1_PLR5_SIA3_SU32_SUS128_SRVW4_TT1_32_TLDS1_USFGROn1_VAW2_VSn1_VW2_WSGRA1_WSGRB1_WG32_8_1_WGM15
    SolutionIndex: 307
    SolutionNameMin: Cijk_Ailk_Bljk_HBH_MT16x16x64_MI16x16x16x1_SE_1LDSB0_AF0EM8_AMAS3_BL1_EPS0_GRVW8_GSU1_ISA908_KLA_LBSPP128_LPB16_LRVW8_MAC_NLCA1_PGR2_PLR5_SIA3_SU0_SUS256_SRVW0_TT1_16_TLDS1_USFGROn1_VAW2_VSn1_VW2_WSGRA1_WSGRB1_WG16_4_1_WGM1
    SolutionIndex: 308
    SolutionNameMin: Cijk_Ailk_Bljk_HBH_MT288x128x32_MI32x32x8x1_SE_1LDSB0_AF0EM1_AMAS3_BL1_EPS1_GRVW4_GSU1_ISA908_KLA_LBSPP128_LPB8_LRVW8_MAC_NLCA9_PGR1_PLR5_SIA3_SU32_SUS128_SRVW0_TT9_32_TLDS1_USFGROn1_VAW2_VSn1_VW2_WSGRA1_WSGRB1_WG32_8_1_WGM2
    SolutionIndex: 309
    SolutionNameMin: Cijk_Ailk_Bljk_HBH_MT64x16x32_MI16x16x16x1_SN_1LDSB0_AF0EM1_AMAS3_BL1_EPS0_GRVW8_GSU1_ISA908_KLA_LBSPP128_LPB16_LRVW8_MAC_NLCA1_PGR2_PLR2_SIA3_SU0_SUS128_SRVW4_TT1_16_TLDS1_USFGROn1_VAW2_VSn1_VW2_WSGRA1_WSGRB1_WG64_4_1_WGM1
    SolutionIndex: 310
    SolutionNameMin: Cijk_Ailk_Bljk_HBH_MT64x16x64_MI16x16x16x1_SE_1LDSB0_AF0EM8_AMAS3_BL1_EPS0_GRVW8_GSU1_ISA908_KLA_LBSPP128_LPB16_LRVW8_MAC_NLCA1_PGR2_PLR5_SIA3_SU0_SUS256_SRVW0_TT1_16_TLDS1_USFGROn1_VAW2_VSn1_VW2_WSGRA1_WSGRB1_WG64_4_1_WGM1
    SolutionIndex: 311
    SolutionNameMin: Cijk_Ailk_Bljk_HBH_MT128x256x32_MI32x32x8x1_SN_1LDSB1_AF0EM8_AMAS3_BL1_EPS1_GRVW8_GSU1_ISA908_KLA_LBSPP128_LPB8_LRVW8_MAC_NLCA1_PGR1_PLR5_SIA3_SU0_SUS128_SRVW4_TT2_128_TLDS1_USFGROn1_VAW2_VSn1_VW2_WSGRA1_WSGRB1_WG64_4_1_WGM15
    SolutionIndex: 312
    SolutionNameMin: Cijk_Ailk_Bljk_HBH_MT64x64x64_MI32x32x8x1_SE_1LDSB0_AF0EM8_AMAS3_BL1_EPS1_GRVW8_GSU15_ISA908_KLA_LBSPP128_LPB8_LRVW8_MAC_NLCA1_PGR1_PLR9_SIA3_SU0_SUS256_SRVW0_TT1_32_TLDS1_USFGROn1_VAW1_VSn1_VW2_WSGRA1_WSGRB1_WG64_4_1_WGM1
    SolutionIndex: 313
    SolutionNameMin: Cijk_Ailk_Bljk_HBH_MT128x96x64_MI32x32x8x1_SE_1LDSB0_AF0EM8_AMAS3_BL1_EPS0_GRVW8_GSU15_ISA908_KLA_LBSPP128_LPB8_LRVW8_MAC_NLCA1_PGR2_PLR9_SIA3_SU32_SUS256_SRVW4_TT1_96_TLDS1_USFGROn1_VAW1_VSn1_VW2_WSGRA1_WSGRB1_WG128_2_1_WGM15
    SolutionIndex: 314
    SolutionNameMin: Cijk_Ailk_Bljk_HBH_MT32x32x64_MI16x16x16x1_SE_1LDSB0_AF0EM8_AMAS3_BL1_EPS0_GRVW4_GSU1_ISA908_KLA_LBSPP128_LPB16_LRVW8_MAC_NLCA1_PGR2_PLR5_SIA3_SU32_SUS128_SRVW4_TT1_16_TLDS1_USFGROn1_VAW2_VSn1_VW2_WSGRA1_WSGRB1_WG32_8_1_WGM2
    SolutionIndex: 315
    SolutionNameMin: Cijk_Ailk_Bljk_HBH_MT64x16x64_MI16x16x16x1_SE_1LDSB0_AF0EM8_AMAS3_BL1_EPS1_GRVW8_GSU1_ISA908_KLA_LBSPP128_LPB16_LRVW8_MAC_NLCA1_PGR1_PLR5_SIA3_SU0_SUS256_SRVW0_TT1_16_TLDS1_USFGROn1_VAW2_VSn1_VW2_WSGRA1_WSGRB1_WG64_4_1_WGM2
    SolutionIndex: 316
    SolutionNameMin: Cijk_Ailk_Bljk_HBH_MT128x256x32_MI32x32x8x1_SE_1LDSB0_AF0EM8_AMAS3_BL1_EPS0_GRVW8_GSU1_ISA908_KLA_LBSPP128_LPB8_LRVW8_MAC_NLCA1_PGR2_PLR5_SIA3_SU0_SUS256_SRVW4_TT2_128_TLDS1_USFGROn1_VAW2_VSn1_VW2_WSGRA1_WSGRB1_WG64_4_1_WGM1
    SolutionIndex: 317
    SolutionNameMin: Cijk_Ailk_Bljk_HBH_MT16x64x64_MI16x16x16x1_SE_1LDSB0_AF0EM8_AMAS3_BL1_EPS0_GRVW8_GSU1_ISA908_KLA_LBSPP128_LPB16_LRVW8_MAC_NLCA1_PGR2_PLR5_SIA3_SU32_SUS256_SRVW0_TT1_16_TLDS1_USFGROn1_VAW2_VSn1_VW2_WSGRA1_WSGRB1_WG16_16_1_WGM1
    SolutionIndex: 318
    SolutionNameMin: Cijk_Ailk_Bljk_HBH_MT256x160x32_MI32x32x8x1_SE_1LDSB0_AF0EM8_AMAS3_BL1_EPS0_GRVW4_GSU1_ISA908_KLA_LBSPP128_LPB8_LRVW8_MAC_NLCA1_PGR2_PLR5_SIA3_SU32_SUS128_SRVW4_TT2_160_TLDS1_USFGROn1_VAW2_VSn1_VW2_WSGRA1_WSGRB1_WG128_2_1_WGM2
    SolutionIndex: 319
    SolutionNameMin: Cijk_Ailk_Bljk_HBH_MT64x32x64_MI16x16x16x1_SE_1LDSB0_AF0EM8_AMAS3_BL1_EPS0_GRVW8_GSU1_ISA908_KLA_LBSPP128_LPB16_LRVW8_MAC_NLCA1_PGR2_PLR5_SIA3_SU0_SUS256_SRVW4_TT2_16_TLDS1_USFGROn1_VAW2_VSn1_VW2_WSGRA1_WSGRB1_WG32_8_1_WGM1
    SolutionIndex: 320
    SolutionNameMin: Cijk_Ailk_Bljk_HBH_MT64x64x64_MI32x32x8x1_SE_1LDSB0_AF0EM8_AMAS3_BL1_EPS1_GRVW8_GSU15_ISA908_KLA_LBSPP128_LPB8_LRVW8_MAC_NLCA1_PGR1_PLR9_SIA3_SU0_SUS256_SRVW0_TT1_32_TLDS1_USFGROn1_VAW1_VSn1_VW2_WSGRA1_WSGRB1_WG64_4_1_WGM2
    SolutionIndex: 321
    SolutionNameMin: Cijk_Ailk_Bljk_HBH_MT288x128x32_MI32x32x8x1_SE_1LDSB0_AF0EM1_AMAS3_BL1_EPS1_GRVW4_GSU1_ISA908_KLA_LBSPP128_LPB8_LRVW8_MAC_NLCA9_PGR1_PLR5_SIA3_SU32_SUS256_SRVW0_TT9_32_TLDS1_USFGROn1_VAW2_VSn1_VW2_WSGRA1_WSGRB1_WG32_8_1_WGM2
    SolutionIndex: 322
    SolutionNameMin: Cijk_Ailk_Bljk_HBH_MT128x96x64_MI32x32x8x1_SE_1LDSB0_AF0EM8_AMAS3_BL1_EPS1_GRVW8_GSU3_ISA908_KLA_LBSPP128_LPB8_LRVW8_MAC_NLCA1_PGR1_PLR9_SIA3_SU32_SUS256_SRVW0_TT1_96_TLDS1_USFGROn1_VAW1_VSn1_VW2_WSGRA1_WSGRB1_WG128_2_1_WGM1
    SolutionIndex: 323
    SolutionNameMin: Cijk_Ailk_Bljk_HBH_MT256x128x32_MI32x32x8x1_SE_1LDSB0_AF0EM8_AMAS3_BL1_EPS0_GRVW4_GSU1_ISA908_KLA_LBSPP128_LPB8_LRVW8_MAC_NLCA1_PGR2_PLR5_SIA3_SU0_SUS256_SRVW4_TT4_64_TLDS1_USFGROn1_VAW2_VSn1_VW2_WSGRA1_WSGRB1_WG64_4_1_WGM1
    SolutionIndex: 324
    SolutionNameMin: Cijk_Ailk_Bljk_HBH_MT288x128x32_MI32x32x8x1_SE_1LDSB0_AF0EM1_AMAS3_BL1_EPS1_GRVW4_GSU1_ISA908_KLA_LBSPP128_LPB8_LRVW8_MAC_NLCA9_PGR1_PLR5_SIA3_SU32_SUS256_SRVW0_TT9_32_TLDS1_USFGROn1_VAW2_VSn1_VW2_WSGRA1_WSGRB1_WG32_8_1_WGM1
    SolutionIndex: 325
    SolutionNameMin: Cijk_Ailk_Bljk_HBH_MT16x64x64_MI16x16x16x1_SE_1LDSB0_AF0EM8_AMAS3_BL1_EPS0_GRVW8_GSU1_ISA908_KLA_LBSPP128_LPB16_LRVW8_MAC_NLCA1_PGR2_PLR5_SIA3_SU0_SUS256_SRVW0_TT1_16_TLDS1_USFGROn1_VAW2_VSn1_VW2_WSGRA1_WSGRB1_WG16_16_1_WGM1
    SolutionIndex: 326
    SolutionNameMin: Cijk_Ailk_Bljk_HBH_MT128x96x32_MI32x32x8x1_SE_1LDSB1_AF0EM1_AMAS3_BL1_EPS1_GRVW2_GSU1_ISA908_KLA_LBSPP128_LPB8_LRVW8_MAC_NLCA1_PGR1_PLR5_SIA3_SU0_SUS256_SRVW4_TT1_96_TLDS1_USFGROn1_VAW2_VSn1_VW2_WSGRA1_WSGRB1_WG128_2_1_WGM15
    SolutionIndex: 327
    SolutionNameMin: Cijk_Ailk_Bljk_HBH_MT32x32x64_MI16x16x16x1_SE_1LDSB0_AF0EM8_AMAS3_BL1_EPS1_GRVW8_GSU15_ISA908_KLA_LBSPP128_LPB16_LRVW8_MAC_NLCA1_PGR1_PLR5_SIA3_SU0_SUS256_SRVW0_TT1_16_TLDS1_USFGROn1_VAW1_VSn1_VW2_WSGRA1_WSGRB1_WG32_8_1_WGM1
    SolutionIndex: 328
    SolutionNameMin: Cijk_Ailk_Bljk_HBH_MT256x160x32_MI32x32x8x1_SE_1LDSB0_AF0EM8_AMAS3_BL1_EPS1_GRVW4_GSU1_ISA908_KLA_LBSPP128_LPB8_LRVW8_MAC_NLCA1_PGR1_PLR5_SIA3_SU0_SUS256_SRVW4_TT2_160_TLDS1_USFGROn1_VAW2_VSn1_VW2_WSGRA1_WSGRB1_WG128_2_1_WGM15
    SolutionIndex: 329
    SolutionNameMin: Cijk_Ailk_Bljk_HBH_MT128x192x32_MI32x32x8x1_SE_1LDSB0_AF0EM1_AMAS3_BL1_EPS0_GRVW4_GSU1_ISA908_KLA_LBSPP128_LPB8_LRVW8_MAC_NLCA1_PGR2_PLR5_SIA3_SU0_SUS256_SRVW4_TT2_96_TLDS1_USFGROn1_VAW2_VSn1_VW2_WSGRA1_WSGRB1_WG64_4_1_WGM15
    SolutionIndex: 330
    SolutionNameMin: Cijk_Ailk_Bljk_HBH_MT128x96x64_MI32x32x8x1_SE_1LDSB0_AF0EM8_AMAS3_BL1_EPS0_GRVW8_GSU15_ISA908_KLA_LBSPP128_LPB8_LRVW8_MAC_NLCA1_PGR2_PLR9_SIA3_SU0_SUS256_SRVW4_TT1_96_TLDS1_USFGROn1_VAW1_VSn1_VW2_WSGRA1_WSGRB1_WG128_2_1_WGM15
    SolutionIndex: 331
    SolutionNameMin: Cijk_Ailk_Bljk_HBH_MT128x64x64_MI32x32x8x1_SE_1LDSB0_AF0EM8_AMAS3_BL1_EPS1_GRVW8_GSU15_ISA908_KLA_LBSPP128_LPB8_LRVW8_MAC_NLCA1_PGR1_PLR9_SIA3_SU0_SUS256_SRVW0_TT2_32_TLDS1_USFGROn1_VAW1_VSn1_VW2_WSGRA1_WSGRB1_WG64_4_1_WGM1
    SolutionIndex: 332
    SolutionNameMin: Cijk_Ailk_Bljk_HBH_MT64x64x32_MI32x32x8x1_SE_1LDSB0_AF0EM8_AMAS3_BL1_EPS0_GRVW8_GSU1_ISA908_KLA_LBSPP128_LPB8_LRVW8_MAC_NLCA1_PGR2_PLR5_SIA3_SU0_SUS256_SRVW4_TT1_32_TLDS1_USFGROn1_VAW2_VSn1_VW2_WSGRA1_WSGRB1_WG64_4_1_WGM1
    SolutionIndex: 333
    SolutionNameMin: Cijk_Ailk_Bljk_HBH_MT128x128x32_MI32x32x8x1_SE_1LDSB1_AF0EM8_AMAS3_BL1_EPS1_GRVW2_GSU1_ISA908_KLA_LBSPP128_LPB8_LRVW8_MAC_NLCA1_PGR1_PLR5_SIA3_SU32_SUS256_SRVW4_TT2_64_TLDS1_USFGROn1_VAW2_VSn1_VW2_WSGRA1_WSGRB1_WG64_4_1_WGM15
    SolutionIndex: 334
    SolutionNameMin: Cijk_Ailk_Bljk_HBH_MT128x128x32_MI32x32x8x1_SE_1LDSB1_AF0EM8_AMAS3_BL1_EPS1_GRVW2_GSU1_ISA908_KLA_LBSPP128_LPB8_LRVW8_MAC_NLCA1_PGR1_PLR5_SIA3_SU32_SUS128_SRVW4_TT2_64_TLDS1_USFGROn1_VAW2_VSn1_VW2_WSGRA1_WSGRB1_WG64_4_1_WGM2
    SolutionIndex: 335
    SolutionNameMin: Cijk_Ailk_Bljk_HBH_MT128x128x32_MI32x32x8x1_SE_1LDSB0_AF0EM8_AMAS3_BL1_EPS0_GRVW4_GSU1_ISA908_KLA_LBSPP128_LPB8_LRVW8_MAC_NLCA1_PGR2_PLR5_SIA3_SU32_SUS256_SRVW4_TT2_64_TLDS1_USFGROn1_VAW2_VSn1_VW2_WSGRA1_WSGRB1_WG64_4_1_WGM2
    SolutionIndex: 336
    SolutionNameMin: Cijk_Ailk_Bljk_HBH_MT128x128x32_MI32x32x8x1_SE_1LDSB0_AF0EM1_AMAS3_BL1_EPS0_GRVW4_GSU1_ISA908_KLA_LBSPP128_LPB8_LRVW8_MAC_NLCA1_PGR2_PLR5_SIA3_SU32_SUS256_SRVW4_TT2_64_TLDS1_USFGROn1_VAW2_VSn1_VW2_WSGRA1_WSGRB1_WG64_4_1_WGM2
    SolutionIndex: 337
    SolutionNameMin: Cijk_Ailk_Bljk_HBH_MT128x64x32_MI32x32x8x1_SE_1LDSB0_AF0EM8_AMAS3_BL1_EPS0_GRVW4_GSU1_ISA908_KLA_LBSPP128_LPB8_LRVW8_MAC_NLCA1_PGR2_PLR5_SIA3_SU0_SUS256_SRVW4_TT2_32_TLDS1_USFGROn1_VAW2_VSn1_VW2_WSGRA1_WSGRB1_WG64_4_1_WGM15
    SolutionIndex: 338
    SolutionNameMin: Cijk_Ailk_Bljk_HBH_MT64x32x32_MI16x16x16x1_SE_1LDSB1_AF0EM8_AMAS3_BL1_EPS1_GRVW2_GSU1_ISA908_KLA_LBSPP128_LPB16_LRVW8_MAC_NLCA1_PGR1_PLR2_SIA3_SU32_SUS256_SRVW4_TT2_16_TLDS1_USFGROn1_VAW2_VSn1_VW2_WSGRA1_WSGRB1_WG32_8_1_WGM1
    SolutionIndex: 339
    SolutionNameMin: Cijk_Ailk_Bljk_HBH_MT128x64x32_MI32x32x8x1_SN_1LDSB0_AF0EM8_AMAS3_BL1_EPS1_GRVW8_GSU1_ISA908_KLA_LBSPP128_LPB8_LRVW8_MAC_NLCA1_PGR1_PLR5_SIA3_SU0_SUS256_SRVW4_TT2_32_TLDS1_USFGROn1_VAW2_VSn1_VW2_WSGRA1_WSGRB1_WG64_4_1_WGM1
    SolutionIndex: 340
    SolutionNameMin: Cijk_Ailk_Bljk_HBH_MT32x32x32_MI16x16x16x1_SN_1LDSB0_AF0EM8_AMAS3_BL1_EPS0_GRVW4_GSU1_ISA908_KLA_LBSPP128_LPB16_LRVW8_MAC_NLCA1_PGR2_PLR2_SIA3_SU0_SUS256_SRVW4_TT1_16_TLDS1_USFGROn1_VAW2_VSn1_VW2_WSGRA1_WSGRB1_WG32_8_1_WGM1
    SolutionIndex: 341
    SolutionNameMin: Cijk_Ailk_Bljk_HBH_MT16x64x32_MI16x16x16x1_SE_1LDSB0_AF0EM8_AMAS3_BL1_EPS0_GRVW8_GSU1_ISA908_KLA_LBSPP128_LPB16_LRVW8_MAC_NLCA1_PGR2_PLR2_SIA3_SU0_SUS256_SRVW0_TT1_16_TLDS1_USFGROn1_VAW2_VSn1_VW2_WSGRA1_WSGRB1_WG16_16_1_WGM1
    SolutionIndex: 342
    SolutionNameMin: Cijk_Ailk_Bljk_HBH_MT32x32x32_MI16x16x16x1_SE_1LDSB0_AF0EM8_AMAS3_BL1_EPS1_GRVW2_GSU1_ISA908_KLA_LBSPP128_LPB16_LRVW8_MAC_NLCA1_PGR1_PLR2_SIA3_SU0_SUS256_SRVW4_TT1_16_TLDS1_USFGROn1_VAW2_VSn1_VW2_WSGRA1_WSGRB1_WG32_8_1_WGM1
    SolutionIndex: 343
    SolutionNameMin: Cijk_Ailk_Bljk_HBH_MT64x4x32_MI4x4x4x16_SE_1LDSB0_AF0EM8_AMAS3_BL1_EPS1_GRVW4_GSU1_ISA908_KLA_LBSPP128_LPB8_LRVW8_MAC_NLCA1_PGR1_PLR9_SIA3_SU0_SUS256_SRVW0_TT1_4_TLDS1_USFGROn1_VAW2_VSn1_VW2_WSGRA1_WSGRB1_WG64_1_1_WGM1
    SolutionIndex: 344
    SolutionNameMin: Cijk_Ailk_Bljk_HBH_MT32x64x32_MI16x16x16x1_SE_1LDSB1_AF0EM8_AMAS3_BL1_EPS1_GRVW2_GSU1_ISA908_KLA_LBSPP128_LPB16_LRVW8_MAC_NLCA1_PGR1_PLR2_SIA3_SU0_SUS256_SRVW4_TT1_32_TLDS1_USFGROn1_VAW2_VSn1_VW2_WSGRA1_WSGRB1_WG32_8_1_WGM1
    SolutionIndex: 345
    SolutionNameMin: Cijk_Ailk_Bljk_HBH_MT64x32x32_MI16x16x16x1_SE_1LDSB1_AF0EM8_AMAS3_BL1_EPS1_GRVW2_GSU1_ISA908_KLA_LBSPP128_LPB16_LRVW8_MAC_NLCA1_PGR1_PLR2_SIA3_SU0_SUS256_SRVW4_TT2_16_TLDS1_USFGROn1_VAW2_VSn1_VW2_WSGRA1_WSGRB1_WG32_8_1_WGM2
    SolutionIndex: 346
    SolutionNameMin: Cijk_Ailk_Bljk_HBH_MT128x96x32_MI32x32x8x1_SE_1LDSB1_AF0EM8_AMAS3_BL1_EPS1_GRVW2_GSU1_ISA908_KLA_LBSPP128_LPB8_LRVW8_MAC_NLCA1_PGR1_PLR5_SIA3_SU32_SUS256_SRVW4_TT1_96_TLDS1_USFGROn1_VAW2_VSn1_VW2_WSGRA1_WSGRB1_WG128_2_1_WGM1
    SolutionIndex: 347
    SolutionNameMin: Cijk_Ailk_Bljk_HBH_MT128x160x64_MI32x32x8x1_SE_1LDSB1_AF0EM8_AMAS3_BL1_EPS1_GRVW2_GSU1_ISA908_KLA_LBSPP128_LPB8_LRVW8_MAC_NLCA1_PGR1_PLR9_SIA3_SU32_SUS128_SRVW4_TT1_160_TLDS1_USFGROn1_VAW2_VSn1_VW2_WSGRA1_WSGRB1_WG128_2_1_WGM1
    SolutionIndex: 348
    SolutionNameMin: Cijk_Ailk_Bljk_HBH_MT128x288x32_MI32x32x8x1_SE_1LDSB0_AF0EM8_AMAS3_BL1_EPS0_GRVW2_GSU1_ISA908_KLA_LBSPP128_LPB8_LRVW8_MAC_NLCA1_PGR2_PLR5_SIA3_SU0_SUS256_SRVW4_TT1_288_TLDS1_USFGROn1_VAW2_VSn1_VW2_WSGRA1_WSGRB1_WG128_2_1_WGM1
    SolutionIndex: 349
    SolutionNameMin: Cijk_Ailk_Bljk_HBH_MT128x288x32_MI32x32x8x1_SE_1LDSB0_AF0EM8_AMAS3_BL1_EPS0_GRVW4_GSU1_ISA908_KLA_LBSPP128_LPB8_LRVW8_MAC_NLCA1_PGR2_PLR5_SIA3_SU0_SUS256_SRVW4_TT1_288_TLDS1_USFGROn1_VAW2_VSn1_VW2_WSGRA1_WSGRB1_WG128_2_1_WGM15
    SolutionIndex: 350
    SolutionNameMin: Cijk_Ailk_Bljk_HBH_MT128x96x64_MI32x32x8x1_SE_1LDSB1_AF0EM8_AMAS3_BL1_EPS1_GRVW2_GSU1_ISA908_KLA_LBSPP128_LPB8_LRVW8_MAC_NLCA1_PGR1_PLR9_SIA3_SU32_SUS128_SRVW4_TT1_96_TLDS1_USFGROn1_VAW2_VSn1_VW2_WSGRA1_WSGRB1_WG128_2_1_WGM2
    SolutionIndex: 351
    SolutionNameMin: Cijk_Ailk_Bljk_HBH_MT64x16x32_MI16x16x16x1_SE_1LDSB0_AF0EM8_AMAS3_BL1_EPS1_GRVW4_GSU1_ISA908_KLA_LBSPP128_LPB16_LRVW8_MAC_NLCA1_PGR1_PLR2_SIA3_SU0_SUS256_SRVW0_TT1_16_TLDS1_USFGROn1_VAW2_VSn1_VW2_WSGRA1_WSGRB1_WG64_4_1_WGM1
    SolutionIndex: 352
    SolutionNameMin: Cijk_Ailk_Bljk_HBH_MT32x32x64_MI16x16x16x1_SE_1LDSB0_AF0EM1_AMAS3_BL1_EPS0_GRVW4_GSU1_ISA908_KLA_LBSPP128_LPB16_LRVW8_MAC_NLCA1_PGR2_PLR5_SIA3_SU0_SUS256_SRVW4_TT1_16_TLDS1_USFGROn1_VAW2_VSn1_VW2_WSGRA1_WSGRB1_WG32_8_1_WGM1
    SolutionIndex: 353
    SolutionNameMin: Cijk_Ailk_Bljk_HBH_MT32x32x64_MI16x16x16x1_SE_1LDSB0_AF0EM1_AMAS3_BL1_EPS0_GRVW8_GSU1_ISA908_KLA_LBSPP128_LPB16_LRVW8_MAC_NLCA1_PGR2_PLR5_SIA3_SU0_SUS256_SRVW4_TT1_16_TLDS1_USFGROn1_VAW2_VSn1_VW2_WSGRA1_WSGRB1_WG32_8_1_WGM2
    SolutionIndex: 354
    SolutionNameMin: Cijk_Ailk_Bljk_HBH_MT32x32x64_MI16x16x16x1_SE_1LDSB0_AF0EM8_AMAS3_BL1_EPS1_GRVW8_GSU1_ISA908_KLA_LBSPP128_LPB16_LRVW8_MAC_NLCA1_PGR1_PLR5_SIA3_SU32_SUS256_SRVW4_TT1_16_TLDS1_USFGROn1_VAW2_VSn1_VW2_WSGRA1_WSGRB1_WG32_8_1_WGM2
    SolutionIndex: 355
    SolutionNameMin: Cijk_Ailk_Bljk_HBH_MT128x160x32_MI32x32x8x1_SE_1LDSB0_AF0EM8_AMAS3_BL1_EPS0_GRVW2_GSU1_ISA908_KLA_LBSPP128_LPB8_LRVW8_MAC_NLCA1_PGR2_PLR5_SIA3_SU0_SUS256_SRVW4_TT1_160_TLDS1_USFGROn1_VAW2_VSn1_VW2_WSGRA1_WSGRB1_WG128_2_1_WGM2
    SolutionIndex: 356
    SolutionNameMin: Cijk_Ailk_Bljk_HBH_MT128x160x64_MI32x32x8x1_SE_1LDSB1_AF0EM8_AMAS3_BL1_EPS1_GRVW2_GSU1_ISA908_KLA_LBSPP128_LPB8_LRVW8_MAC_NLCA1_PGR1_PLR9_SIA3_SU32_SUS128_SRVW4_TT1_160_TLDS1_USFGROn1_VAW2_VSn1_VW2_WSGRA1_WSGRB1_WG128_2_1_WGM2
    SolutionIndex: 357
    SolutionNameMin: Cijk_Ailk_Bljk_HBH_MT128x160x32_MI32x32x8x1_SE_1LDSB0_AF0EM8_AMAS3_BL1_EPS0_GRVW4_GSU1_ISA908_KLA_LBSPP128_LPB8_LRVW8_MAC_NLCA1_PGR2_PLR5_SIA3_SU32_SUS256_SRVW4_TT1_160_TLDS1_USFGROn1_VAW2_VSn1_VW2_WSGRA1_WSGRB1_WG128_2_1_WGM1
    SolutionIndex: 358
    SolutionNameMin: Cijk_Ailk_Bljk_HBH_MT128x160x32_MI32x32x8x1_SE_1LDSB0_AF0EM8_AMAS3_BL1_EPS0_GRVW4_GSU1_ISA908_KLA_LBSPP128_LPB8_LRVW8_MAC_NLCA1_PGR2_PLR5_SIA3_SU32_SUS256_SRVW4_TT1_160_TLDS1_USFGROn1_VAW2_VSn1_VW2_WSGRA1_WSGRB1_WG128_2_1_WGM2
    SolutionIndex: 359
    SolutionNameMin: Cijk_Ailk_Bljk_HBH_MT128x160x32_MI32x32x8x1_SE_1LDSB0_AF0EM8_AMAS3_BL1_EPS0_GRVW2_GSU1_ISA908_KLA_LBSPP128_LPB8_LRVW8_MAC_NLCA1_PGR2_PLR5_SIA3_SU32_SUS128_SRVW4_TT1_160_TLDS1_USFGROn1_VAW2_VSn1_VW2_WSGRA1_WSGRB1_WG128_2_1_WGM15
    SolutionIndex: 360
    SolutionNameMin: Cijk_Ailk_Bljk_HBH_MT256x160x32_MI32x32x8x1_SE_1LDSB0_AF0EM8_AMAS3_BL1_EPS1_GRVW4_GSU2_ISA908_KLA_LBSPP128_LPB8_LRVW8_MAC_NLCA1_PGR1_PLR5_SIA3_SU32_SUS256_SRVW4_TT2_160_TLDS1_USFGROn1_VAW1_VSn1_VW2_WSGRA1_WSGRB1_WG128_2_1_WGM15
    SolutionIndex: 361
    SolutionNameMin: Cijk_Ailk_Bljk_HBH_MT256x160x32_MI32x32x8x1_SE_1LDSB0_AF0EM8_AMAS3_BL1_EPS0_GRVW4_GSU2_ISA908_KLA_LBSPP128_LPB8_LRVW8_MAC_NLCA1_PGR2_PLR5_SIA3_SU32_SUS128_SRVW4_TT2_160_TLDS1_USFGROn1_VAW1_VSn1_VW2_WSGRA1_WSGRB1_WG128_2_1_WGM2
    SolutionIndex: 362
    SolutionNameMin: Cijk_Ailk_Bljk_HBH_MT256x160x32_MI32x32x8x1_SE_1LDSB0_AF0EM8_AMAS3_BL1_EPS1_GRVW4_GSU2_ISA908_KLA_LBSPP128_LPB8_LRVW8_MAC_NLCA1_PGR1_PLR5_SIA3_SU0_SUS256_SRVW4_TT2_160_TLDS1_USFGROn1_VAW1_VSn1_VW2_WSGRA1_WSGRB1_WG128_2_1_WGM15
    SolutionIndex: 363
    SolutionNameMin: Cijk_Ailk_Bljk_HBH_MT256x160x32_MI32x32x8x1_SE_1LDSB0_AF0EM8_AMAS3_BL1_EPS1_GRVW4_GSU2_ISA908_KLA_LBSPP128_LPB8_LRVW8_MAC_NLCA1_PGR1_PLR5_SIA3_SU0_SUS256_SRVW4_TT2_160_TLDS1_USFGROn1_VAW1_VSn1_VW2_WSGRA1_WSGRB1_WG128_2_1_WGM1
    SolutionIndex: 364
    SolutionNameMin: Cijk_Ailk_Bljk_HBH_MT256x160x32_MI32x32x8x1_SE_1LDSB0_AF0EM8_AMAS3_BL1_EPS1_GRVW4_GSU2_ISA908_KLA_LBSPP128_LPB8_LRVW8_MAC_NLCA1_PGR1_PLR5_SIA3_SU32_SUS128_SRVW4_TT2_160_TLDS1_USFGROn1_VAW1_VSn1_VW2_WSGRA1_WSGRB1_WG128_2_1_WGM15
    SolutionIndex: 365
    SolutionNameMin: Cijk_Ailk_Bljk_HBH_MT32x32x64_MI16x16x16x1_SE_1LDSB0_AF0EM8_AMAS3_BL1_EPS1_GRVW4_GSU1_ISA908_KLA_LBSPP128_LPB16_LRVW8_MAC_NLCA1_PGR1_PLR5_SIA3_SU32_SUS128_SRVW4_TT1_16_TLDS1_USFGROn1_VAW2_VSn1_VW2_WSGRA1_WSGRB1_WG32_8_1_WGM1
    SolutionIndex: 366
    SolutionNameMin: Cijk_Ailk_Bljk_HBH_MT32x32x32_MI16x16x16x1_SE_1LDSB0_AF0EM8_AMAS3_BL1_EPS1_GRVW2_GSU1_ISA908_KLA_LBSPP128_LPB16_LRVW8_MAC_NLCA1_PGR1_PLR2_SIA3_SU32_SUS128_SRVW4_TT1_16_TLDS1_USFGROn1_VAW2_VSn1_VW2_WSGRA1_WSGRB1_WG32_8_1_WGM1
    SolutionIndex: 367
    SolutionNameMin: Cijk_Ailk_Bljk_HBH_MT32x64x32_MI16x16x16x1_SE_1LDSB1_AF0EM1_AMAS3_BL1_EPS1_GRVW2_GSU1_ISA908_KLA_LBSPP128_LPB16_LRVW8_MAC_NLCA1_PGR1_PLR2_SIA3_SU32_SUS128_SRVW4_TT1_32_TLDS1_USFGROn1_VAW2_VSn1_VW2_WSGRA1_WSGRB1_WG32_8_1_WGM1
    SolutionIndex: 368
    SolutionNameMin: Cijk_Ailk_Bljk_HBH_MT64x32x32_MI16x16x16x1_SE_1LDSB0_AF0EM1_AMAS3_BL1_EPS0_GRVW2_GSU1_ISA908_KLA_LBSPP128_LPB16_LRVW8_MAC_NLCA1_PGR2_PLR2_SIA3_SU32_SUS256_SRVW4_TT2_16_TLDS1_USFGROn1_VAW2_VSn1_VW2_WSGRA1_WSGRB1_WG32_8_1_WGM15
    SolutionIndex: 369
    SolutionNameMin: Cijk_Ailk_Bljk_HBH_MT64x128x64_MI32x32x8x1_SE_1LDSB0_AF0EM8_AMAS3_BL1_EPS0_GRVW8_GSU1_ISA908_KLA_LBSPP128_LPB8_LRVW8_MAC_NLCA1_PGR2_PLR9_SIA3_SU32_SUS128_SRVW4_TT1_64_TLDS1_USFGROn1_VAW2_VSn1_VW2_WSGRA1_WSGRB1_WG64_4_1_WGM15
    SolutionIndex: 370
    SolutionNameMin: Cijk_Ailk_Bljk_HBH_MT128x64x32_MI32x32x8x1_SN_1LDSB0_AF0EM1_AMAS3_BL1_EPS0_GRVW8_GSU1_ISA908_KLA_LBSPP128_LPB8_LRVW8_MAC_NLCA1_PGR2_PLR5_SIA3_SU32_SUS128_SRVW4_TT2_32_TLDS1_USFGROn1_VAW2_VSn1_VW2_WSGRA1_WSGRB1_WG64_4_1_WGM15
    SolutionIndex: 371
    SolutionNameMin: Cijk_Ailk_Bljk_HBH_MT128x96x64_MI32x32x8x1_SE_1LDSB1_AF0EM8_AMAS3_BL1_EPS1_GRVW2_GSU1_ISA908_KLA_LBSPP128_LPB8_LRVW8_MAC_NLCA1_PGR1_PLR9_SIA3_SU32_SUS256_SRVW4_TT1_96_TLDS1_USFGROn1_VAW2_VSn1_VW2_WSGRA1_WSGRB1_WG128_2_1_WGM2
    SolutionIndex: 372
    SolutionNameMin: Cijk_Ailk_Bljk_HBH_MT128x128x32_MI32x32x8x1_SE_1LDSB1_AF0EM8_AMAS3_BL1_EPS1_GRVW2_GSU1_ISA908_KLA_LBSPP128_LPB8_LRVW8_MAC_NLCA1_PGR1_PLR5_SIA3_SU0_SUS256_SRVW4_TT2_64_TLDS1_USFGROn1_VAW2_VSn1_VW2_WSGRA1_WSGRB1_WG64_4_1_WGM15
    SolutionIndex: 373
    SolutionNameMin: Cijk_Ailk_Bljk_HBH_MT256x128x32_MI32x32x8x1_SE_1LDSB0_AF0EM8_AMAS3_BL1_EPS1_GRVW8_GSU1_ISA908_KLA_LBSPP128_LPB8_LRVW8_MAC_NLCA1_PGR1_PLR5_SIA3_SU0_SUS256_SRVW4_TT4_64_TLDS1_USFGROn1_VAW2_VSn1_VW2_WSGRA1_WSGRB1_WG64_4_1_WGM15
    SolutionIndex: 374
    SolutionNameMin: Cijk_Ailk_Bljk_HBH_MT128x256x32_MI32x32x8x1_SE_1LDSB1_AF0EM8_AMAS3_BL1_EPS1_GRVW8_GSU1_ISA908_KLA_LBSPP128_LPB8_LRVW8_MAC_NLCA1_PGR1_PLR5_SIA3_SU32_SUS256_SRVW4_TT2_128_TLDS1_USFGROn1_VAW2_VSn1_VW2_WSGRA1_WSGRB1_WG64_4_1_WGM2
    SolutionIndex: 375
    SolutionNameMin: Cijk_Ailk_Bljk_HBH_MT128x256x32_MI32x32x8x1_SE_1LDSB1_AF0EM8_AMAS3_BL1_EPS1_GRVW8_GSU1_ISA908_KLA_LBSPP128_LPB8_LRVW8_MAC_NLCA1_PGR1_PLR5_SIA3_SU32_SUS256_SRVW4_TT2_128_TLDS1_USFGROn1_VAW2_VSn1_VW2_WSGRA1_WSGRB1_WG64_4_1_WGM15
    SolutionIndex: 376
    SolutionNameMin: Cijk_Ailk_Bljk_HBH_MT128x96x32_MI32x32x8x1_SE_1LDSB1_AF0EM8_AMAS3_BL1_EPS1_GRVW2_GSU1_ISA908_KLA_LBSPP128_LPB8_LRVW8_MAC_NLCA1_PGR1_PLR5_SIA3_SU32_SUS128_SRVW4_TT1_96_TLDS1_USFGROn1_VAW2_VSn1_VW2_WSGRA1_WSGRB1_WG128_2_1_WGM15
    SolutionIndex: 377
    SolutionNameMin: Cijk_Ailk_Bljk_HBH_MT128x256x32_MI32x32x8x1_SE_1LDSB1_AF0EM8_AMAS3_BL1_EPS1_GRVW2_GSU1_ISA908_KLA_LBSPP128_LPB8_LRVW8_MAC_NLCA1_PGR1_PLR5_SIA3_SU0_SUS256_SRVW4_TT2_128_TLDS1_USFGROn1_VAW2_VSn1_VW2_WSGRA1_WSGRB1_WG64_4_1_WGM15
    SolutionIndex: 378
    SolutionNameMin: Cijk_Ailk_Bljk_HBH_MT64x32x32_MI16x16x16x1_SE_1LDSB1_AF0EM8_AMAS3_BL1_EPS1_GRVW2_GSU1_ISA908_KLA_LBSPP128_LPB16_LRVW8_MAC_NLCA1_PGR1_PLR2_SIA3_SU0_SUS256_SRVW4_TT2_16_TLDS1_USFGROn1_VAW2_VSn1_VW2_WSGRA1_WSGRB1_WG32_8_1_WGM1
    SolutionIndex: 379
    SolutionNameMin: Cijk_Ailk_Bljk_HBH_MT128x256x32_MI32x32x8x1_SE_1LDSB0_AF0EM8_AMAS3_BL1_EPS0_GRVW8_GSU1_ISA908_KLA_LBSPP128_LPB8_LRVW8_MAC_NLCA1_PGR2_PLR5_SIA3_SU0_SUS256_SRVW4_TT2_128_TLDS1_USFGROn1_VAW2_VSn1_VW2_WSGRA1_WSGRB1_WG64_4_1_WGM15
    SolutionIndex: 380
    SolutionNameMin: Cijk_Ailk_Bljk_HBH_MT128x288x32_MI32x32x8x1_SE_1LDSB0_AF0EM8_AMAS3_BL1_EPS0_GRVW2_GSU1_ISA908_KLA_LBSPP128_LPB8_LRVW8_MAC_NLCA1_PGR2_PLR5_SIA3_SU32_SUS128_SRVW4_TT1_288_TLDS1_USFGROn1_VAW2_VSn1_VW2_WSGRA1_WSGRB1_WG128_2_1_WGM15
    SolutionIndex: 381
    SolutionNameMin: Cijk_Ailk_Bljk_HBH_MT256x256x32_MI32x32x8x1_SE_1LDSB1_AF0EM8_AMAS3_BL1_EPS1_GRVW8_GSU1_ISA908_KLA_LBSPP128_LPB8_LRVW8_MAC_NLCA1_PGR1_PLR5_SIA3_SU0_SUS256_SRVW4_TT4_128_TLDS1_USFGROn1_VAW2_VSn1_VW2_WSGRA1_WSGRB1_WG64_4_1_WGM1
    SolutionIndex: 382
    SolutionNameMin: Cijk_Ailk_Bljk_HBH_MT256x160x32_MI32x32x8x1_SE_1LDSB0_AF0EM8_AMAS3_BL1_EPS0_GRVW4_GSU5_ISA908_KLA_LBSPP128_LPB8_LRVW8_MAC_NLCA1_PGR2_PLR5_SIA3_SU0_SUS256_SRVW4_TT2_160_TLDS1_USFGROn1_VAW1_VSn1_VW2_WSGRA1_WSGRB1_WG128_2_1_WGM2
    SolutionIndex: 383
    SolutionNameMin: Cijk_Ailk_Bljk_HBH_MT256x160x32_MI32x32x8x1_SE_1LDSB0_AF0EM8_AMAS3_BL1_EPS0_GRVW4_GSU2_ISA908_KLA_LBSPP128_LPB8_LRVW8_MAC_NLCA1_PGR2_PLR5_SIA3_SU0_SUS256_SRVW4_TT2_160_TLDS1_USFGROn1_VAW1_VSn1_VW2_WSGRA1_WSGRB1_WG128_2_1_WGM15
    SolutionIndex: 384
    SolutionNameMin: Cijk_Ailk_Bljk_HBH_MT256x160x32_MI32x32x8x1_SE_1LDSB0_AF0EM8_AMAS3_BL1_EPS1_GRVW4_GSU2_ISA908_KLA_LBSPP128_LPB8_LRVW8_MAC_NLCA1_PGR1_PLR5_SIA3_SU32_SUS128_SRVW4_TT2_160_TLDS1_USFGROn1_VAW1_VSn1_VW2_WSGRA1_WSGRB1_WG128_2_1_WGM2
    SolutionIndex: 385
    SolutionNameMin: Cijk_Ailk_Bljk_HBH_MT128x192x32_MI32x32x8x1_SE_1LDSB0_AF0EM8_AMAS3_BL1_EPS0_GRVW2_GSU1_ISA908_KLA_LBSPP128_LPB8_LRVW8_MAC_NLCA1_PGR2_PLR5_SIA3_SU0_SUS256_SRVW4_TT2_96_TLDS1_USFGROn1_VAW2_VSn1_VW2_WSGRA1_WSGRB1_WG64_4_1_WGM15
    SolutionIndex: 386
    SolutionNameMin: Cijk_Ailk_Bljk_HBH_MT128x192x32_MI32x32x8x1_SE_1LDSB0_AF0EM1_AMAS3_BL1_EPS0_GRVW8_GSU1_ISA908_KLA_LBSPP128_LPB8_LRVW8_MAC_NLCA1_PGR2_PLR5_SIA3_SU0_SUS256_SRVW4_TT2_96_TLDS1_USFGROn1_VAW2_VSn1_VW2_WSGRA1_WSGRB1_WG64_4_1_WGM15
    SolutionIndex: 387
    SolutionNameMin: Cijk_Ailk_Bljk_HBH_MT256x128x32_MI32x32x8x1_SE_1LDSB1_AF0EM8_AMAS3_BL1_EPS1_GRVW8_GSU1_ISA908_KLA_LBSPP128_LPB8_LRVW8_MAC_NLCA1_PGR1_PLR5_SIA3_SU32_SUS128_SRVW4_TT4_64_TLDS1_USFGROn1_VAW2_VSn1_VW2_WSGRA1_WSGRB1_WG64_4_1_WGM1
    SolutionIndex: 388
    SolutionNameMin: Cijk_Ailk_Bljk_HBH_MT256x192x32_MI32x32x8x1_SE_1LDSB0_AF0EM8_AMAS3_BL1_EPS0_GRVW2_GSU1_ISA908_KLA_LBSPP128_LPB8_LRVW8_MAC_NLCA2_PGR2_PLR5_SIA3_SU0_SUS256_SRVW4_TT4_96_TLDS1_USFGROn1_VAW2_VSn1_VW2_WSGRA1_WSGRB1_WG64_4_1_WGM2
    SolutionIndex: 389
    SolutionNameMin: Cijk_Ailk_Bljk_HBH_MT256x192x32_MI32x32x8x1_SE_1LDSB0_AF0EM8_AMAS3_BL1_EPS1_GRVW8_GSU1_ISA908_KLA_LBSPP128_LPB8_LRVW8_MAC_NLCA1_PGR1_PLR5_SIA3_SU32_SUS256_SRVW4_TT4_96_TLDS1_USFGROn1_VAW2_VSn1_VW2_WSGRA1_WSGRB1_WG64_4_1_WGM15
    SolutionIndex: 390
    SolutionNameMin: Cijk_Ailk_Bljk_HBH_MT256x256x32_MI32x32x8x1_SE_1LDSB1_AF0EM8_AMAS3_BL1_EPS1_GRVW2_GSU3_ISA908_KLA_LBSPP128_LPB8_LRVW8_MAC_NLCA2_PGR1_PLR5_SIA3_SU0_SUS256_SRVW0_TT4_128_TLDS1_USFGROn1_VAW1_VSn1_VW2_WSGRA1_WSGRB1_WG64_4_1_WGM1
    SolutionIndex: 391
    SolutionNameMin: Cijk_Ailk_Bljk_HBH_MT256x192x32_MI32x32x8x1_SE_1LDSB0_AF0EM8_AMAS3_BL1_EPS0_GRVW8_GSU1_ISA908_KLA_LBSPP128_LPB8_LRVW8_MAC_NLCA1_PGR2_PLR5_SIA3_SU32_SUS256_SRVW4_TT4_96_TLDS1_USFGROn1_VAW2_VSn1_VW2_WSGRA1_WSGRB1_WG64_4_1_WGM1
    SolutionIndex: 392
    SolutionNameMin: Cijk_Ailk_Bljk_HBH_MT256x192x32_MI32x32x8x1_SE_1LDSB0_AF0EM8_AMAS3_BL1_EPS0_GRVW8_GSU1_ISA908_KLA_LBSPP128_LPB8_LRVW8_MAC_NLCA1_PGR2_PLR5_SIA3_SU0_SUS256_SRVW4_TT4_96_TLDS1_USFGROn1_VAW2_VSn1_VW2_WSGRA1_WSGRB1_WG64_4_1_WGM2
    SolutionIndex: 393
    SolutionNameMin: Cijk_Ailk_Bljk_HBH_MT128x288x32_MI32x32x8x1_SE_1LDSB0_AF0EM8_AMAS3_BL1_EPS0_GRVW2_GSU1_ISA908_KLA_LBSPP128_LPB8_LRVW8_MAC_NLCA1_PGR2_PLR5_SIA3_SU32_SUS256_SRVW4_TT1_288_TLDS1_USFGROn1_VAW2_VSn1_VW2_WSGRA1_WSGRB1_WG128_2_1_WGM15
    SolutionIndex: 394
    SolutionNameMin: Cijk_Ailk_Bljk_HBH_MT128x64x32_MI32x32x8x1_SE_1LDSB0_AF0EM1_AMAS3_BL1_EPS0_GRVW8_GSU1_ISA908_KLA_LBSPP128_LPB8_LRVW8_MAC_NLCA1_PGR2_PLR5_SIA3_SU0_SUS256_SRVW4_TT2_32_TLDS1_USFGROn1_VAW2_VSn1_VW2_WSGRA1_WSGRB1_WG64_4_1_WGM1
    SolutionIndex: 395
    SolutionNameMin: Cijk_Ailk_Bljk_HBH_MT128x64x32_MI32x32x8x1_SE_1LDSB0_AF0EM1_AMAS3_BL1_EPS0_GRVW2_GSU1_ISA908_KLA_LBSPP128_LPB8_LRVW8_MAC_NLCA1_PGR2_PLR5_SIA3_SU0_SUS256_SRVW4_TT2_32_TLDS1_USFGROn1_VAW2_VSn1_VW2_WSGRA1_WSGRB1_WG64_4_1_WGM15
    SolutionIndex: 396
    SolutionNameMin: Cijk_Ailk_Bljk_HBH_MT128x64x32_MI32x32x8x1_SE_1LDSB0_AF0EM1_AMAS3_BL1_EPS1_GRVW8_GSU1_ISA908_KLA_LBSPP128_LPB8_LRVW8_MAC_NLCA1_PGR1_PLR5_SIA3_SU0_SUS256_SRVW4_TT2_32_TLDS1_USFGROn1_VAW2_VSn1_VW2_WSGRA1_WSGRB1_WG64_4_1_WGM2
    SolutionIndex: 397
    SolutionNameMin: Cijk_Ailk_Bljk_HBH_MT64x32x32_MI16x16x16x1_SE_1LDSB1_AF0EM1_AMAS3_BL1_EPS1_GRVW2_GSU1_ISA908_KLA_LBSPP128_LPB16_LRVW8_MAC_NLCA1_PGR1_PLR2_SIA3_SU32_SUS128_SRVW4_TT2_16_TLDS1_USFGROn1_VAW2_VSn1_VW2_WSGRA1_WSGRB1_WG32_8_1_WGM2
    SolutionIndex: 398
    SolutionNameMin: Cijk_Ailk_Bljk_HBH_MT128x128x32_MI32x32x8x1_SE_1LDSB0_AF0EM1_AMAS3_BL1_EPS0_GRVW8_GSU1_ISA908_KLA_LBSPP128_LPB8_LRVW8_MAC_NLCA1_PGR2_PLR5_SIA3_SU0_SUS256_SRVW4_TT2_64_TLDS1_USFGROn1_VAW2_VSn1_VW2_WSGRA1_WSGRB1_WG64_4_1_WGM1
    SolutionIndex: 399
    SolutionNameMin: Cijk_Ailk_Bljk_HBH_MT64x64x32_MI32x32x8x1_SN_1LDSB0_AF0EM1_AMAS3_BL1_EPS0_GRVW8_GSU1_ISA908_KLA_LBSPP128_LPB8_LRVW8_MAC_NLCA1_PGR2_PLR5_SIA3_SU32_SUS256_SRVW4_TT1_32_TLDS1_USFGROn1_VAW2_VSn1_VW2_WSGRA1_WSGRB1_WG64_4_1_WGM1
    SolutionIndex: 400
    SolutionNameMin: Cijk_Ailk_Bljk_HBH_MT64x32x32_MI16x16x16x1_SE_1LDSB1_AF0EM1_AMAS3_BL1_EPS1_GRVW2_GSU1_ISA908_KLA_LBSPP128_LPB16_LRVW8_MAC_NLCA1_PGR1_PLR2_SIA3_SU0_SUS256_SRVW4_TT2_16_TLDS1_USFGROn1_VAW2_VSn1_VW2_WSGRA1_WSGRB1_WG32_8_1_WGM15
    SolutionIndex: 401
    SolutionNameMin: Cijk_Ailk_Bljk_HBH_MT128x96x32_MI32x32x8x1_SE_1LDSB0_AF0EM1_AMAS3_BL1_EPS1_GRVW4_GSU1_ISA908_KLA_LBSPP128_LPB8_LRVW8_MAC_NLCA1_PGR1_PLR5_SIA3_SU0_SUS256_SRVW4_TT1_96_TLDS1_USFGROn1_VAW2_VSn1_VW2_WSGRA1_WSGRB1_WG128_2_1_WGM1
    SolutionIndex: 402
    SolutionNameMin: Cijk_Ailk_Bljk_HBH_MT64x32x32_MI16x16x16x1_SE_1LDSB0_AF0EM1_AMAS3_BL1_EPS0_GRVW2_GSU1_ISA908_KLA_LBSPP128_LPB16_LRVW8_MAC_NLCA1_PGR2_PLR2_SIA3_SU0_SUS256_SRVW4_TT2_16_TLDS1_USFGROn1_VAW2_VSn1_VW2_WSGRA1_WSGRB1_WG32_8_1_WGM1
    SolutionIndex: 403
    SolutionNameMin: Cijk_Ailk_Bljk_HBH_MT128x64x32_MI32x32x8x1_SE_1LDSB0_AF0EM8_AMAS3_BL1_EPS1_GRVW2_GSU1_ISA908_KLA_LBSPP128_LPB8_LRVW8_MAC_NLCA1_PGR1_PLR5_SIA3_SU0_SUS256_SRVW4_TT2_32_TLDS1_USFGROn1_VAW2_VSn1_VW2_WSGRA1_WSGRB1_WG64_4_1_WGM1
    SolutionIndex: 404
    SolutionNameMin: Cijk_Ailk_Bljk_HBH_MT64x144x32_MI16x16x16x1_SE_1LDSB0_AF0EM1_AMAS3_BL1_EPS0_GRVW2_GSU1_ISA908_KLA_LBSPP128_LPB16_LRVW8_MAC_NLCA1_PGR2_PLR2_SIA3_SU32_SUS128_SRVW4_TT1_144_TLDS1_USFGROn1_VAW2_VSn1_VW2_WSGRA1_WSGRB1_WG64_4_1_WGM2
    SolutionIndex: 405
    SolutionNameMin: Cijk_Ailk_Bljk_HBH_MT64x192x32_MI32x32x8x1_SN_1LDSB0_AF0EM1_AMAS3_BL1_EPS0_GRVW8_GSU1_ISA908_KLA_LBSPP128_LPB8_LRVW8_MAC_NLCA1_PGR2_PLR5_SIA3_SU32_SUS256_SRVW4_TT1_96_TLDS1_USFGROn1_VAW2_VSn1_VW2_WSGRA1_WSGRB1_WG64_4_1_WGM1
    SolutionIndex: 406
    SolutionNameMin: Cijk_Ailk_Bljk_HBH_MT128x128x32_MI32x32x8x1_SE_1LDSB1_AF0EM1_AMAS3_BL1_EPS1_GRVW2_GSU1_ISA908_KLA_LBSPP128_LPB8_LRVW8_MAC_NLCA1_PGR1_PLR5_SIA3_SU0_SUS256_SRVW4_TT2_64_TLDS1_USFGROn1_VAW2_VSn1_VW2_WSGRA1_WSGRB1_WG64_4_1_WGM15
    SolutionIndex: 407
    SolutionNameMin: Cijk_Ailk_Bljk_HBH_MT128x128x32_MI32x32x8x1_SE_1LDSB1_AF0EM1_AMAS3_BL1_EPS1_GRVW2_GSU1_ISA908_KLA_LBSPP128_LPB8_LRVW8_MAC_NLCA1_PGR1_PLR5_SIA3_SU32_SUS256_SRVW4_TT2_64_TLDS1_USFGROn1_VAW2_VSn1_VW2_WSGRA1_WSGRB1_WG64_4_1_WGM2
    SolutionIndex: 408
    SolutionNameMin: Cijk_Ailk_Bljk_HBH_MT128x128x32_MI32x32x8x1_SE_1LDSB1_AF0EM1_AMAS3_BL1_EPS1_GRVW2_GSU1_ISA908_KLA_LBSPP128_LPB8_LRVW8_MAC_NLCA1_PGR1_PLR5_SIA3_SU0_SUS256_SRVW4_TT2_64_TLDS1_USFGROn1_VAW2_VSn1_VW2_WSGRA1_WSGRB1_WG64_4_1_WGM1
    SolutionIndex: 409
    SolutionNameMin: Cijk_Ailk_Bljk_HBH_MT64x128x32_MI32x32x8x1_SE_1LDSB0_AF0EM1_AMAS3_BL1_EPS0_GRVW2_GSU1_ISA908_KLA_LBSPP128_LPB8_LRVW8_MAC_NLCA1_PGR2_PLR5_SIA3_SU0_SUS256_SRVW4_TT1_64_TLDS1_USFGROn1_VAW2_VSn1_VW2_WSGRA1_WSGRB1_WG64_4_1_WGM15
    SolutionIndex: 410
    SolutionNameMin: Cijk_Ailk_Bljk_HBH_MT128x96x32_MI32x32x8x1_SE_1LDSB1_AF0EM1_AMAS3_BL1_EPS1_GRVW2_GSU1_ISA908_KLA_LBSPP128_LPB8_LRVW8_MAC_NLCA1_PGR1_PLR5_SIA3_SU0_SUS256_SRVW4_TT1_96_TLDS1_USFGROn1_VAW2_VSn1_VW2_WSGRA1_WSGRB1_WG128_2_1_WGM2
    SolutionIndex: 411
    SolutionNameMin: Cijk_Ailk_Bljk_HBH_MT64x128x32_MI32x32x8x1_SE_1LDSB0_AF0EM1_AMAS3_BL1_EPS1_GRVW8_GSU1_ISA908_KLA_LBSPP128_LPB8_LRVW8_MAC_NLCA1_PGR1_PLR5_SIA3_SU0_SUS256_SRVW4_TT1_64_TLDS1_USFGROn1_VAW2_VSn1_VW2_WSGRA1_WSGRB1_WG64_4_1_WGM1
    SolutionIndex: 412
    SolutionNameMin: Cijk_Ailk_Bljk_HBH_MT256x128x32_MI32x32x8x1_SE_1LDSB1_AF0EM8_AMAS3_BL1_EPS0_GRVW8_GSU1_ISA908_KLA_LBSPP128_LPB8_LRVW8_MAC_NLCA1_PGR2_PLR5_SIA3_SU32_SUS128_SRVW4_TT4_64_TLDS1_USFGROn1_VAW2_VSn1_VW2_WSGRA1_WSGRB1_WG64_4_1_WGM15
    SolutionIndex: 413
    SolutionNameMin: Cijk_Ailk_Bljk_HBH_MT128x64x64_MI32x32x8x1_SE_1LDSB0_AF0EM1_AMAS3_BL1_EPS0_GRVW8_GSU1_ISA908_KLA_LBSPP128_LPB8_LRVW8_MAC_NLCA1_PGR2_PLR9_SIA3_SU32_SUS256_SRVW4_TT2_32_TLDS1_USFGROn1_VAW2_VSn1_VW2_WSGRA1_WSGRB1_WG64_4_1_WGM15
    SolutionIndex: 414
    SolutionNameMin: Cijk_Ailk_Bljk_HBH_MT64x64x32_MI32x32x8x1_SE_1LDSB0_AF0EM8_AMAS3_BL1_EPS0_GRVW2_GSU1_ISA908_KLA_LBSPP128_LPB8_LRVW8_MAC_NLCA1_PGR2_PLR5_SIA3_SU0_SUS256_SRVW4_TT1_32_TLDS1_USFGROn1_VAW2_VSn1_VW2_WSGRA1_WSGRB1_WG64_4_1_WGM15
    SolutionIndex: 415
    SolutionNameMin: Cijk_Ailk_Bljk_HBH_MT32x32x64_MI16x16x16x1_SE_1LDSB0_AF0EM8_AMAS3_BL1_EPS1_GRVW4_GSU1_ISA908_KLA_LBSPP128_LPB16_LRVW8_MAC_NLCA1_PGR1_PLR5_SIA3_SU0_SUS256_SRVW4_TT1_16_TLDS1_USFGROn1_VAW2_VSn1_VW2_WSGRA1_WSGRB1_WG32_8_1_WGM15
    SolutionIndex: 416
    SolutionNameMin: Cijk_Ailk_Bljk_HBH_MT256x128x32_MI32x32x8x1_SE_1LDSB1_AF0EM8_AMAS3_BL1_EPS0_GRVW8_GSU15_ISA908_KLA_LBSPP128_LPB8_LRVW8_MAC_NLCA1_PGR2_PLR5_SIA3_SU32_SUS128_SRVW0_TT4_64_TLDS1_USFGROn1_VAW1_VSn1_VW2_WSGRA1_WSGRB1_WG64_4_1_WGM1
    SolutionIndex: 417
    SolutionNameMin: Cijk_Ailk_Bljk_HBH_MT128x96x64_MI32x32x8x1_SE_1LDSB0_AF0EM8_AMAS3_BL1_EPS0_GRVW2_GSU1_ISA908_KLA_LBSPP128_LPB8_LRVW8_MAC_NLCA1_PGR2_PLR9_SIA3_SU0_SUS256_SRVW4_TT1_96_TLDS1_USFGROn1_VAW2_VSn1_VW2_WSGRA1_WSGRB1_WG128_2_1_WGM1
    SolutionIndex: 418
    SolutionNameMin: Cijk_Ailk_Bljk_HBH_MT256x192x32_MI32x32x8x1_SE_1LDSB1_AF0EM8_AMAS3_BL1_EPS0_GRVW8_GSU1_ISA908_KLA_LBSPP128_LPB8_LRVW8_MAC_NLCA1_PGR2_PLR5_SIA3_SU0_SUS256_SRVW4_TT4_96_TLDS1_USFGROn1_VAW2_VSn1_VW2_WSGRA1_WSGRB1_WG64_4_1_WGM15
    SolutionIndex: 419
    SolutionNameMin: Cijk_Ailk_Bljk_HBH_MT256x160x32_MI32x32x8x1_SE_1LDSB0_AF0EM8_AMAS3_BL1_EPS0_GRVW4_GSU15_ISA908_KLA_LBSPP128_LPB8_LRVW8_MAC_NLCA1_PGR2_PLR5_SIA3_SU32_SUS128_SRVW4_TT2_160_TLDS1_USFGROn1_VAW1_VSn1_VW2_WSGRA1_WSGRB1_WG128_2_1_WGM1
    SolutionIndex: 420
    SolutionNameMin: Cijk_Ailk_Bljk_HBH_MT64x128x32_MI32x32x8x1_SE_1LDSB0_AF0EM8_AMAS3_BL1_EPS1_GRVW8_GSU1_ISA908_KLA_LBSPP128_LPB8_LRVW8_MAC_NLCA1_PGR1_PLR5_SIA3_SU32_SUS128_SRVW4_TT1_64_TLDS1_USFGROn1_VAW2_VSn1_VW2_WSGRA1_WSGRB1_WG64_4_1_WGM1
    SolutionIndex: 421
    SolutionNameMin: Cijk_Ailk_Bljk_HBH_MT256x160x32_MI32x32x8x1_SE_1LDSB0_AF0EM8_AMAS3_BL1_EPS0_GRVW4_GSU5_ISA908_KLA_LBSPP128_LPB8_LRVW8_MAC_NLCA1_PGR2_PLR5_SIA3_SU32_SUS128_SRVW4_TT2_160_TLDS1_USFGROn1_VAW1_VSn1_VW2_WSGRA1_WSGRB1_WG128_2_1_WGM1
    SolutionIndex: 422
    SolutionNameMin: Cijk_Ailk_Bljk_HBH_MT128x192x32_MI32x32x8x1_SN_1LDSB1_AF0EM8_AMAS3_BL1_EPS1_GRVW2_GSU1_ISA908_KLA_LBSPP128_LPB8_LRVW8_MAC_NLCA1_PGR1_PLR5_SIA3_SU0_SUS128_SRVW4_TT2_96_TLDS1_USFGROn1_VAW2_VSn1_VW2_WSGRA1_WSGRB1_WG64_4_1_WGM15
    SolutionIndex: 423
    SolutionNameMin: Cijk_Ailk_Bljk_HBH_MT64x128x32_MI32x32x8x1_SE_1LDSB0_AF0EM8_AMAS3_BL1_EPS1_GRVW8_GSU1_ISA908_KLA_LBSPP128_LPB8_LRVW8_MAC_NLCA1_PGR1_PLR5_SIA3_SU32_SUS128_SRVW4_TT1_64_TLDS1_USFGROn1_VAW2_VSn1_VW2_WSGRA1_WSGRB1_WG64_4_1_WGM15
    SolutionIndex: 424
    SolutionNameMin: Cijk_Ailk_Bljk_HBH_MT64x128x32_MI32x32x8x1_SE_1LDSB0_AF0EM8_AMAS3_BL1_EPS0_GRVW4_GSU1_ISA908_KLA_LBSPP128_LPB8_LRVW8_MAC_NLCA1_PGR2_PLR5_SIA3_SU0_SUS256_SRVW4_TT1_64_TLDS1_USFGROn1_VAW2_VSn1_VW2_WSGRA1_WSGRB1_WG64_4_1_WGM2
    SolutionIndex: 425
    SolutionNameMin: Cijk_Ailk_Bljk_HBH_MT256x128x32_MI32x32x8x1_SE_1LDSB1_AF0EM8_AMAS3_BL1_EPS0_GRVW8_GSU7_ISA908_KLA_LBSPP128_LPB8_LRVW8_MAC_NLCA1_PGR2_PLR5_SIA3_SU0_SUS256_SRVW0_TT4_64_TLDS1_USFGROn1_VAW1_VSn1_VW2_WSGRA1_WSGRB1_WG64_4_1_WGM1
    SolutionIndex: 426
    SolutionNameMin: Cijk_Ailk_Bljk_HBH_MT128x96x32_MI32x32x8x1_SE_1LDSB0_AF0EM8_AMAS3_BL1_EPS1_GRVW2_GSU1_ISA908_KLA_LBSPP128_LPB8_LRVW8_MAC_NLCA1_PGR1_PLR5_SIA3_SU32_SUS256_SRVW4_TT1_96_TLDS1_USFGROn1_VAW2_VSn1_VW2_WSGRA1_WSGRB1_WG128_2_1_WGM15
    SolutionIndex: 427
    SolutionNameMin: Cijk_Ailk_Bljk_HBH_MT128x192x32_MI32x32x8x1_SE_1LDSB0_AF0EM8_AMAS3_BL1_EPS0_GRVW8_GSU1_ISA908_KLA_LBSPP128_LPB8_LRVW8_MAC_NLCA1_PGR2_PLR5_SIA3_SU32_SUS128_SRVW4_TT2_96_TLDS1_USFGROn1_VAW2_VSn1_VW2_WSGRA1_WSGRB1_WG64_4_1_WGM15
    SolutionIndex: 428
    SolutionNameMin: Cijk_Ailk_Bljk_HBH_MT64x4x32_MI4x4x4x16_SE_1LDSB0_AF0EM8_AMAS3_BL1_EPS0_GRVW8_GSU1_ISA908_KLA_LBSPP128_LPB8_LRVW8_MAC_NLCA1_PGR2_PLR9_SIA3_SU0_SUS256_SRVW0_TT1_4_TLDS1_USFGROn1_VAW2_VSn1_VW2_WSGRA1_WSGRB1_WG64_1_1_WGM1
    SolutionIndex: 429
    SolutionNameMin: Cijk_Ailk_Bljk_HBH_MT256x128x32_MI32x32x8x1_SE_1LDSB0_AF0EM8_AMAS3_BL1_EPS0_GRVW4_GSU7_ISA908_KLA_LBSPP128_LPB8_LRVW8_MAC_NLCA1_PGR2_PLR5_SIA3_SU0_SUS256_SRVW0_TT4_64_TLDS1_USFGROn1_VAW1_VSn1_VW2_WSGRA1_WSGRB1_WG64_4_1_WGM1
    SolutionIndex: 430
    SolutionNameMin: Cijk_Ailk_Bljk_HBH_MT128x96x64_MI32x32x8x1_SE_1LDSB0_AF0EM8_AMAS3_BL1_EPS0_GRVW4_GSU5_ISA908_KLA_LBSPP128_LPB8_LRVW8_MAC_NLCA1_PGR2_PLR9_SIA3_SU32_SUS256_SRVW4_TT1_96_TLDS1_USFGROn1_VAW1_VSn1_VW2_WSGRA1_WSGRB1_WG128_2_1_WGM1
    SolutionIndex: 431
    SolutionNameMin: Cijk_Ailk_Bljk_HBH_MT32x64x64_MI16x16x16x1_SE_1LDSB0_AF0EM8_AMAS3_BL1_EPS1_GRVW4_GSU1_ISA908_KLA_LBSPP128_LPB16_LRVW8_MAC_NLCA1_PGR1_PLR5_SIA3_SU32_SUS128_SRVW4_TT1_32_TLDS1_USFGROn1_VAW2_VSn1_VW2_WSGRA1_WSGRB1_WG32_8_1_WGM15
    SolutionIndex: 432
    SolutionNameMin: Cijk_Ailk_Bljk_HBH_MT128x192x32_MI32x32x8x1_SE_1LDSB0_AF0EM8_AMAS3_BL1_EPS0_GRVW2_GSU15_ISA908_KLA_LBSPP128_LPB8_LRVW8_MAC_NLCA1_PGR2_PLR5_SIA3_SU0_SUS256_SRVW4_TT2_96_TLDS1_USFGROn1_VAW1_VSn1_VW2_WSGRA1_WSGRB1_WG64_4_1_WGM15
    SolutionIndex: 433
    SolutionNameMin: Cijk_Ailk_Bljk_HBH_MT64x128x32_MI32x32x8x1_SE_1LDSB0_AF0EM8_AMAS3_BL1_EPS0_GRVW2_GSU1_ISA908_KLA_LBSPP128_LPB8_LRVW8_MAC_NLCA1_PGR2_PLR5_SIA3_SU0_SUS256_SRVW4_TT1_64_TLDS1_USFGROn1_VAW2_VSn1_VW2_WSGRA1_WSGRB1_WG64_4_1_WGM1
    SolutionIndex: 434
    SolutionNameMin: Cijk_Ailk_Bljk_HBH_MT128x192x32_MI32x32x8x1_SE_1LDSB0_AF0EM1_AMAS3_BL1_EPS0_GRVW8_GSU1_ISA908_KLA_LBSPP128_LPB8_LRVW8_MAC_NLCA1_PGR2_PLR5_SIA3_SU0_SUS256_SRVW4_TT2_96_TLDS1_USFGROn1_VAW2_VSn1_VW2_WSGRA1_WSGRB1_WG64_4_1_WGM1
    SolutionIndex: 435
    SolutionNameMin: Cijk_Ailk_Bljk_HBH_MT64x64x32_MI32x32x8x1_SN_1LDSB0_AF0EM8_AMAS3_BL1_EPS0_GRVW2_GSU1_ISA908_KLA_LBSPP128_LPB8_LRVW8_MAC_NLCA1_PGR2_PLR5_SIA3_SU0_SUS256_SRVW4_TT1_32_TLDS1_USFGROn1_VAW2_VSn1_VW2_WSGRA1_WSGRB1_WG64_4_1_WGM15
    SolutionIndex: 436
    SolutionNameMin: Cijk_Ailk_Bljk_HBH_MT96x96x64_MI16x16x16x1_SE_1LDSB0_AF0EM8_AMAS3_BL1_EPS0_GRVW2_GSU1_ISA908_KLA_LBSPP128_LPB16_LRVW8_MAC_NLCA3_PGR2_PLR5_SIA3_SU0_SUS256_SRVW0_TT3_48_TLDS1_USFGROn1_VAW2_VSn1_VW2_WSGRA1_WSGRB1_WG32_8_1_WGM1
    SolutionIndex: 437
    SolutionNameMin: Cijk_Ailk_Bljk_HBH_MT128x96x64_MI32x32x8x1_SE_1LDSB0_AF0EM8_AMAS3_BL1_EPS1_GRVW8_GSU1_ISA908_KLA_LBSPP128_LPB8_LRVW8_MAC_NLCA1_PGR1_PLR9_SIA3_SU0_SUS256_SRVW4_TT1_96_TLDS1_USFGROn1_VAW2_VSn1_VW2_WSGRA1_WSGRB1_WG128_2_1_WGM1
    SolutionIndex: 438
    SolutionNameMin: Cijk_Ailk_Bljk_HBH_MT128x64x64_MI32x32x8x1_SE_1LDSB0_AF0EM8_AMAS3_BL1_EPS1_GRVW8_GSU7_ISA908_KLA_LBSPP128_LPB8_LRVW8_MAC_NLCA1_PGR1_PLR9_SIA3_SU32_SUS256_SRVW0_TT2_32_TLDS1_USFGROn1_VAW1_VSn1_VW2_WSGRA1_WSGRB1_WG64_4_1_WGM1
    SolutionIndex: 439
    SolutionNameMin: Cijk_Ailk_Bljk_HBH_MT192x192x32_MI32x32x8x1_SE_1LDSB0_AF0EM8_AMAS3_BL1_EPS0_GRVW8_GSU1_ISA908_KLA_LBSPP128_LPB8_LRVW8_MAC_NLCA3_PGR2_PLR5_SIA3_SU0_SUS256_SRVW0_TT3_96_TLDS1_USFGROn1_VAW2_VSn1_VW2_WSGRA1_WSGRB1_WG64_4_1_WGM15
    SolutionIndex: 440
    SolutionNameMin: Cijk_Ailk_Bljk_HBH_MT64x256x64_MI32x32x8x1_SE_1LDSB1_AF0EM8_AMAS3_BL1_EPS1_GRVW2_GSU1_ISA908_KLA_LBSPP128_LPB8_LRVW8_MAC_NLCA1_PGR1_PLR9_SIA3_SU0_SUS256_SRVW4_TT1_128_TLDS1_USFGROn1_VAW2_VSn1_VW2_WSGRA1_WSGRB1_WG64_4_1_WGM1
    SolutionIndex: 441
    SolutionNameMin: Cijk_Ailk_Bljk_HBH_MT256x160x32_MI32x32x8x1_SE_1LDSB0_AF0EM8_AMAS3_BL1_EPS0_GRVW4_GSU3_ISA908_KLA_LBSPP128_LPB8_LRVW8_MAC_NLCA1_PGR2_PLR5_SIA3_SU0_SUS256_SRVW4_TT2_160_TLDS1_USFGROn1_VAW1_VSn1_VW2_WSGRA1_WSGRB1_WG128_2_1_WGM15
    SolutionIndex: 442
    SolutionNameMin: Cijk_Ailk_Bljk_HBH_MT4x64x32_MI4x4x4x16_SE_1LDSB0_AF0EM8_AMAS3_BL1_EPS1_GRVW2_GSU1_ISA908_KLA_LBSPP128_LPB8_LRVW8_MAC_NLCA1_PGR1_PLR9_SIA3_SU0_SUS256_SRVW0_TT1_4_TLDS1_USFGROn1_VAW2_VSn1_VW2_WSGRA1_WSGRB1_WG4_16_1_WGM1
    SolutionIndex: 443
    SolutionNameMin: Cijk_Ailk_Bljk_HBH_MT64x32x64_MI16x16x16x1_SE_1LDSB0_AF0EM8_AMAS3_BL1_EPS0_GRVW8_GSU3_ISA908_KLA_LBSPP128_LPB16_LRVW8_MAC_NLCA1_PGR2_PLR5_SIA3_SU32_SUS256_SRVW4_TT2_16_TLDS1_USFGROn1_VAW1_VSn1_VW2_WSGRA1_WSGRB1_WG32_8_1_WGM1
    SolutionIndex: 444
    SolutionNameMin: Cijk_Ailk_Bljk_HBH_MT64x192x64_MI32x32x8x1_SE_1LDSB1_AF0EM8_AMAS3_BL1_EPS1_GRVW2_GSU1_ISA908_KLA_LBSPP128_LPB8_LRVW8_MAC_NLCA1_PGR1_PLR9_SIA3_SU0_SUS256_SRVW4_TT1_96_TLDS1_USFGROn1_VAW2_VSn1_VW2_WSGRA1_WSGRB1_WG64_4_1_WGM2
    SolutionIndex: 445
    SolutionNameMin: Cijk_Ailk_Bljk_HBH_MT32x64x64_MI16x16x16x1_SE_1LDSB0_AF0EM8_AMAS3_BL1_EPS1_GRVW8_GSU5_ISA908_KLA_LBSPP128_LPB16_LRVW8_MAC_NLCA1_PGR1_PLR5_SIA3_SU32_SUS128_SRVW0_TT1_32_TLDS1_USFGROn1_VAW1_VSn1_VW2_WSGRA1_WSGRB1_WG32_8_1_WGM1
    SolutionIndex: 446
    SolutionNameMin: Cijk_Ailk_Bljk_HBH_MT128x288x32_MI32x32x8x1_SE_1LDSB0_AF0EM8_AMAS3_BL1_EPS1_GRVW4_GSU1_ISA908_KLA_LBSPP128_LPB8_LRVW8_MAC_NLCA1_PGR1_PLR5_SIA3_SU0_SUS256_SRVW4_TT1_288_TLDS1_USFGROn1_VAW2_VSn1_VW2_WSGRA1_WSGRB1_WG128_2_1_WGM15
    SolutionIndex: 447
    SolutionNameMin: Cijk_Ailk_Bljk_HBH_MT64x128x64_MI32x32x8x1_SE_1LDSB0_AF0EM8_AMAS3_BL1_EPS1_GRVW8_GSU1_ISA908_KLA_LBSPP128_LPB8_LRVW8_MAC_NLCA1_PGR1_PLR9_SIA3_SU32_SUS256_SRVW4_TT1_64_TLDS1_USFGROn1_VAW2_VSn1_VW2_WSGRA1_WSGRB1_WG64_4_1_WGM15
    SolutionIndex: 448
    SolutionNameMin: Cijk_Ailk_Bljk_HBH_MT256x128x32_MI32x32x8x1_SE_1LDSB0_AF0EM8_AMAS3_BL1_EPS1_GRVW8_GSU1_ISA908_KLA_LBSPP128_LPB8_LRVW8_MAC_NLCA1_PGR1_PLR5_SIA3_SU32_SUS128_SRVW4_TT4_64_TLDS1_USFGROn1_VAW2_VSn1_VW2_WSGRA1_WSGRB1_WG64_4_1_WGM1
    SolutionIndex: 449
    SolutionNameMin: Cijk_Ailk_Bljk_HBH_MT128x256x32_MI32x32x8x1_SE_1LDSB1_AF0EM8_AMAS3_BL1_EPS1_GRVW8_GSU3_ISA908_KLA_LBSPP128_LPB8_LRVW8_MAC_NLCA1_PGR1_PLR5_SIA3_SU0_SUS256_SRVW4_TT2_128_TLDS1_USFGROn1_VAW1_VSn1_VW2_WSGRA1_WSGRB1_WG64_4_1_WGM15
    SolutionIndex: 450
    SolutionNameMin: Cijk_Ailk_Bljk_HBH_MT256x128x32_MI32x32x8x1_SE_1LDSB0_AF0EM8_AMAS3_BL1_EPS0_GRVW4_GSU2_ISA908_KLA_LBSPP128_LPB8_LRVW8_MAC_NLCA1_PGR2_PLR5_SIA3_SU0_SUS256_SRVW0_TT4_64_TLDS1_USFGROn1_VAW1_VSn1_VW2_WSGRA1_WSGRB1_WG64_4_1_WGM2
    SolutionIndex: 451
    SolutionNameMin: Cijk_Ailk_Bljk_HBH_MT128x256x32_MI32x32x8x1_SE_1LDSB1_AF0EM1_AMAS3_BL1_EPS1_GRVW8_GSU1_ISA908_KLA_LBSPP128_LPB8_LRVW8_MAC_NLCA1_PGR1_PLR5_SIA3_SU0_SUS256_SRVW4_TT2_128_TLDS1_USFGROn1_VAW2_VSn1_VW2_WSGRA1_WSGRB1_WG64_4_1_WGM2
    SolutionIndex: 452
    SolutionNameMin: Cijk_Ailk_Bljk_HBH_MT128x64x32_MI32x32x8x1_SE_1LDSB0_AF0EM8_AMAS3_BL1_EPS0_GRVW4_GSU1_ISA908_KLA_LBSPP128_LPB8_LRVW8_MAC_NLCA1_PGR2_PLR5_SIA3_SU32_SUS128_SRVW4_TT2_32_TLDS1_USFGROn1_VAW2_VSn1_VW2_WSGRA1_WSGRB1_WG64_4_1_WGM15
    SolutionIndex: 453
    SolutionNameMin: Cijk_Ailk_Bljk_HBH_MT256x192x32_MI32x32x8x1_SE_1LDSB0_AF0EM8_AMAS3_BL1_EPS1_GRVW4_GSU1_ISA908_KLA_LBSPP128_LPB8_LRVW8_MAC_NLCA1_PGR1_PLR5_SIA3_SU0_SUS256_SRVW4_TT4_96_TLDS1_USFGROn1_VAW2_VSn1_VW2_WSGRA1_WSGRB1_WG64_4_1_WGM15
    SolutionIndex: 454
    SolutionNameMin: Cijk_Ailk_Bljk_HBH_MT32x32x64_MI16x16x16x1_SE_1LDSB0_AF0EM8_AMAS3_BL1_EPS1_GRVW2_GSU1_ISA908_KLA_LBSPP128_LPB16_LRVW8_MAC_NLCA1_PGR1_PLR5_SIA3_SU0_SUS256_SRVW4_TT1_16_TLDS1_USFGROn1_VAW2_VSn1_VW2_WSGRA1_WSGRB1_WG32_8_1_WGM15
    SolutionIndex: 455
    SolutionNameMin: Cijk_Ailk_Bljk_HBH_MT256x128x32_MI32x32x8x1_SE_1LDSB0_AF0EM8_AMAS3_BL1_EPS0_GRVW4_GSU3_ISA908_KLA_LBSPP128_LPB8_LRVW8_MAC_NLCA1_PGR2_PLR5_SIA3_SU0_SUS256_SRVW0_TT4_64_TLDS1_USFGROn1_VAW1_VSn1_VW2_WSGRA1_WSGRB1_WG64_4_1_WGM15
    SolutionIndex: 456
    SolutionNameMin: Cijk_Ailk_Bljk_HBH_MT128x64x32_MI32x32x8x1_SE_1LDSB0_AF0EM1_AMAS3_BL1_EPS1_GRVW4_GSU1_ISA908_KLA_LBSPP128_LPB8_LRVW8_MAC_NLCA1_PGR1_PLR5_SIA3_SU0_SUS256_SRVW4_TT2_32_TLDS1_USFGROn1_VAW2_VSn1_VW2_WSGRA1_WSGRB1_WG64_4_1_WGM1
    SolutionIndex: 457
    SolutionNameMin: Cijk_Ailk_Bljk_HBH_MT64x128x32_MI32x32x8x1_SE_1LDSB0_AF0EM8_AMAS3_BL1_EPS0_GRVW2_GSU1_ISA908_KLA_LBSPP128_LPB8_LRVW8_MAC_NLCA1_PGR2_PLR5_SIA3_SU0_SUS256_SRVW4_TT1_64_TLDS1_USFGROn1_VAW2_VSn1_VW2_WSGRA1_WSGRB1_WG64_4_1_WGM15
    SolutionIndex: 458
    SolutionNameMin: Cijk_Ailk_Bljk_HBH_MT128x128x32_MI32x32x8x1_SE_1LDSB1_AF0EM8_AMAS3_BL1_EPS1_GRVW2_GSU1_ISA908_KLA_LBSPP128_LPB8_LRVW8_MAC_NLCA1_PGR1_PLR5_SIA3_SU32_SUS128_SRVW4_TT2_64_TLDS1_USFGROn1_VAW2_VSn1_VW2_WSGRA1_WSGRB1_WG64_4_1_WGM1
    SolutionIndex: 459
    SolutionNameMin: Cijk_Ailk_Bljk_HBH_MT64x64x64_MI32x32x8x1_SE_1LDSB0_AF0EM1_AMAS3_BL1_EPS0_GRVW8_GSU7_ISA908_KLA_LBSPP128_LPB8_LRVW8_MAC_NLCA1_PGR2_PLR9_SIA3_SU0_SUS256_SRVW4_TT1_32_TLDS1_USFGROn1_VAW1_VSn1_VW2_WSGRA1_WSGRB1_WG64_4_1_WGM1
    SolutionIndex: 460
    SolutionNameMin: Cijk_Ailk_Bljk_HBH_MT64x128x32_MI32x32x8x1_SE_1LDSB0_AF0EM1_AMAS3_BL1_EPS0_GRVW4_GSU1_ISA908_KLA_LBSPP128_LPB8_LRVW8_MAC_NLCA1_PGR2_PLR5_SIA3_SU0_SUS256_SRVW4_TT1_64_TLDS1_USFGROn1_VAW2_VSn1_VW2_WSGRA1_WSGRB1_WG64_4_1_WGM15
    SolutionIndex: 461
    SolutionNameMin: Cijk_Ailk_Bljk_HBH_MT128x128x32_MI32x32x8x1_SE_1LDSB0_AF0EM8_AMAS3_BL1_EPS0_GRVW8_GSU1_ISA908_KLA_LBSPP128_LPB8_LRVW8_MAC_NLCA1_PGR2_PLR5_SIA3_SU32_SUS256_SRVW4_TT2_64_TLDS1_USFGROn1_VAW2_VSn1_VW2_WSGRA1_WSGRB1_WG64_4_1_WGM1
    SolutionIndex: 462
    SolutionNameMin: Cijk_Ailk_Bljk_HBH_MT96x128x32_MI32x32x8x1_SE_1LDSB0_AF0EM8_AMAS3_BL1_EPS0_GRVW4_GSU1_ISA908_KLA_LBSPP128_LPB8_LRVW8_MAC_NLCA3_PGR2_PLR5_SIA3_SU32_SUS128_SRVW0_TT3_32_TLDS1_USFGROn1_VAW2_VSn1_VW2_WSGRA1_WSGRB1_WG32_8_1_WGM1
    SolutionIndex: 463
    SolutionNameMin: Cijk_Ailk_Bljk_HBH_MT64x128x64_MI32x32x8x1_SE_1LDSB0_AF0EM8_AMAS3_BL1_EPS1_GRVW8_GSU1_ISA908_KLA_LBSPP128_LPB8_LRVW8_MAC_NLCA1_PGR1_PLR9_SIA3_SU32_SUS128_SRVW4_TT1_64_TLDS1_USFGROn1_VAW2_VSn1_VW2_WSGRA1_WSGRB1_WG64_4_1_WGM1
    SolutionIndex: 464
    SolutionNameMin: Cijk_Ailk_Bljk_HBH_MT96x128x64_MI32x32x8x1_SE_1LDSB0_AF0EM8_AMAS3_BL1_EPS0_GRVW2_GSU1_ISA908_KLA_LBSPP128_LPB8_LRVW8_MAC_NLCA3_PGR2_PLR9_SIA3_SU0_SUS256_SRVW0_TT3_32_TLDS1_USFGROn1_VAW2_VSn1_VW2_WSGRA1_WSGRB1_WG32_8_1_WGM1
    SolutionIndex: 465
    SolutionNameMin: Cijk_Ailk_Bljk_HBH_MT128x96x32_MI32x32x8x1_SE_1LDSB1_AF0EM8_AMAS3_BL1_EPS1_GRVW2_GSU1_ISA908_KLA_LBSPP128_LPB8_LRVW8_MAC_NLCA1_PGR1_PLR5_SIA3_SU32_SUS128_SRVW4_TT1_96_TLDS1_USFGROn1_VAW2_VSn1_VW2_WSGRA1_WSGRB1_WG128_2_1_WGM2
    SolutionIndex: 466
    SolutionNameMin: Cijk_Ailk_Bljk_HBH_MT64x128x32_MI32x32x8x1_SE_1LDSB0_AF0EM8_AMAS3_BL1_EPS1_GRVW4_GSU1_ISA908_KLA_LBSPP128_LPB8_LRVW8_MAC_NLCA1_PGR1_PLR5_SIA3_SU32_SUS256_SRVW4_TT1_64_TLDS1_USFGROn1_VAW2_VSn1_VW2_WSGRA1_WSGRB1_WG64_4_1_WGM2
    SolutionIndex: 467
    SolutionNameMin: Cijk_Ailk_Bljk_HBH_MT128x128x32_MI32x32x8x1_SE_1LDSB0_AF0EM8_AMAS3_BL1_EPS1_GRVW8_GSU1_ISA908_KLA_LBSPP128_LPB8_LRVW8_MAC_NLCA1_PGR1_PLR5_SIA3_SU32_SUS128_SRVW4_TT2_64_TLDS1_USFGROn1_VAW2_VSn1_VW2_WSGRA1_WSGRB1_WG64_4_1_WGM15
    SolutionIndex: 468
    SolutionNameMin: Cijk_Ailk_Bljk_HBH_MT128x128x32_MI32x32x8x1_SE_1LDSB1_AF0EM1_AMAS3_BL1_EPS1_GRVW2_GSU1_ISA908_KLA_LBSPP128_LPB8_LRVW8_MAC_NLCA1_PGR1_PLR5_SIA3_SU0_SUS256_SRVW4_TT2_64_TLDS1_USFGROn1_VAW2_VSn1_VW2_WSGRA1_WSGRB1_WG64_4_1_WGM2
    SolutionIndex: 469
    SolutionNameMin: Cijk_Ailk_Bljk_HBH_MT128x96x64_MI32x32x8x1_SE_1LDSB0_AF0EM8_AMAS3_BL1_EPS1_GRVW8_GSU1_ISA908_KLA_LBSPP128_LPB8_LRVW8_MAC_NLCA1_PGR1_PLR9_SIA3_SU32_SUS256_SRVW4_TT1_96_TLDS1_USFGROn1_VAW2_VSn1_VW2_WSGRA1_WSGRB1_WG128_2_1_WGM1
    SolutionIndex: 470
    SolutionNameMin: Cijk_Ailk_Bljk_HBH_MT128x128x32_MI32x32x8x1_SE_1LDSB1_AF0EM1_AMAS3_BL1_EPS1_GRVW2_GSU1_ISA908_KLA_LBSPP128_LPB8_LRVW8_MAC_NLCA1_PGR1_PLR5_SIA3_SU32_SUS128_SRVW4_TT2_64_TLDS1_USFGROn1_VAW2_VSn1_VW2_WSGRA1_WSGRB1_WG64_4_1_WGM1
    SolutionIndex: 471
    SolutionNameMin: Cijk_Ailk_Bljk_HBH_MT96x96x64_MI16x16x16x1_SE_1LDSB0_AF0EM1_AMAS3_BL1_EPS0_GRVW8_GSU1_ISA908_KLA_LBSPP128_LPB16_LRVW8_MAC_NLCA3_PGR2_PLR5_SIA3_SU0_SUS256_SRVW0_TT3_48_TLDS1_USFGROn1_VAW2_VSn1_VW2_WSGRA1_WSGRB1_WG32_8_1_WGM1
    SolutionIndex: 472
    SolutionNameMin: Cijk_Ailk_Bljk_HBH_MT128x64x64_MI32x32x8x1_SE_1LDSB0_AF0EM1_AMAS3_BL1_EPS0_GRVW8_GSU1_ISA908_KLA_LBSPP128_LPB8_LRVW8_MAC_NLCA1_PGR2_PLR9_SIA3_SU0_SUS256_SRVW4_TT2_32_TLDS1_USFGROn1_VAW2_VSn1_VW2_WSGRA1_WSGRB1_WG64_4_1_WGM1
    SolutionIndex: 473
    SolutionNameMin: Cijk_Ailk_Bljk_HBH_MT128x64x64_MI32x32x8x1_SE_1LDSB0_AF0EM1_AMAS3_BL1_EPS0_GRVW4_GSU1_ISA908_KLA_LBSPP128_LPB8_LRVW8_MAC_NLCA1_PGR2_PLR9_SIA3_SU32_SUS128_SRVW4_TT2_32_TLDS1_USFGROn1_VAW2_VSn1_VW2_WSGRA1_WSGRB1_WG64_4_1_WGM15
    SolutionIndex: 474
    SolutionNameMin: Cijk_Ailk_Bljk_HBH_MT64x128x32_MI32x32x8x1_SE_1LDSB0_AF0EM1_AMAS3_BL1_EPS0_GRVW4_GSU1_ISA908_KLA_LBSPP128_LPB8_LRVW8_MAC_NLCA1_PGR2_PLR5_SIA3_SU32_SUS128_SRVW4_TT1_64_TLDS1_USFGROn1_VAW2_VSn1_VW2_WSGRA1_WSGRB1_WG64_4_1_WGM1
    SolutionIndex: 475
    SolutionNameMin: Cijk_Ailk_Bljk_HBH_MT128x64x32_MI32x32x8x1_SE_1LDSB0_AF0EM1_AMAS3_BL1_EPS0_GRVW4_GSU1_ISA908_KLA_LBSPP128_LPB8_LRVW8_MAC_NLCA1_PGR2_PLR5_SIA3_SU32_SUS128_SRVW4_TT2_32_TLDS1_USFGROn1_VAW2_VSn1_VW2_WSGRA1_WSGRB1_WG64_4_1_WGM1
    SolutionIndex: 476
    SolutionNameMin: Cijk_Ailk_Bljk_HBH_MT128x128x32_MI32x32x8x1_SE_1LDSB0_AF0EM1_AMAS3_BL1_EPS0_GRVW4_GSU1_ISA908_KLA_LBSPP128_LPB8_LRVW8_MAC_NLCA1_PGR2_PLR5_SIA3_SU32_SUS128_SRVW4_TT2_64_TLDS1_USFGROn1_VAW2_VSn1_VW2_WSGRA1_WSGRB1_WG64_4_1_WGM15
    SolutionIndex: 477
    SolutionNameMin: Cijk_Ailk_Bljk_HBH_MT256x64x32_MI32x32x8x1_SE_1LDSB0_AF0EM1_AMAS3_BL1_EPS0_GRVW8_GSU1_ISA908_KLA_LBSPP128_LPB8_LRVW8_MAC_NLCA1_PGR2_PLR5_SIA3_SU0_SUS256_SRVW4_TT4_32_TLDS1_USFGROn1_VAW2_VSn1_VW2_WSGRA1_WSGRB1_WG64_4_1_WGM1
    SolutionIndex: 478
    SolutionNameMin: Cijk_Ailk_Bljk_HBH_MT32x32x32_MI16x16x16x1_SE_1LDSB0_AF0EM1_AMAS3_BL1_EPS0_GRVW8_GSU1_ISA908_KLA_LBSPP128_LPB16_LRVW8_MAC_NLCA1_PGR2_PLR2_SIA3_SU0_SUS256_SRVW4_TT1_16_TLDS1_USFGROn1_VAW2_VSn1_VW2_WSGRA1_WSGRB1_WG32_8_1_WGM1
    SolutionIndex: 479
    SolutionNameMin: Cijk_Ailk_Bljk_HBH_MT128x64x64_MI32x32x8x1_SE_1LDSB0_AF0EM1_AMAS3_BL1_EPS0_GRVW4_GSU1_ISA908_KLA_LBSPP128_LPB8_LRVW8_MAC_NLCA1_PGR2_PLR9_SIA3_SU32_SUS256_SRVW4_TT2_32_TLDS1_USFGROn1_VAW2_VSn1_VW2_WSGRA1_WSGRB1_WG64_4_1_WGM15
    SolutionIndex: 480
    SolutionNameMin: Cijk_Ailk_Bljk_HBH_MT128x256x32_MI32x32x8x1_SE_1LDSB0_AF0EM1_AMAS3_BL1_EPS0_GRVW8_GSU1_ISA908_KLA_LBSPP128_LPB8_LRVW8_MAC_NLCA1_PGR2_PLR5_SIA3_SU32_SUS256_SRVW4_TT2_128_TLDS1_USFGROn1_VAW2_VSn1_VW2_WSGRA1_WSGRB1_WG64_4_1_WGM15
    SolutionIndex: 481
    SolutionNameMin: Cijk_Ailk_Bljk_HBH_MT32x64x64_MI16x16x16x1_SE_1LDSB0_AF0EM1_AMAS3_BL1_EPS1_GRVW4_GSU1_ISA908_KLA_LBSPP128_LPB16_LRVW8_MAC_NLCA1_PGR1_PLR5_SIA3_SU0_SUS256_SRVW4_TT1_32_TLDS1_USFGROn1_VAW2_VSn1_VW2_WSGRA1_WSGRB1_WG32_8_1_WGM1
    SolutionIndex: 482
    SolutionNameMin: Cijk_Ailk_Bljk_HBH_MT128x128x32_MI32x32x8x1_SE_1LDSB1_AF0EM1_AMAS3_BL1_EPS1_GRVW2_GSU1_ISA908_KLA_LBSPP128_LPB8_LRVW8_MAC_NLCA1_PGR1_PLR5_SIA3_SU32_SUS256_SRVW4_TT2_64_TLDS1_USFGROn1_VAW2_VSn1_VW2_WSGRA1_WSGRB1_WG64_4_1_WGM15
    SolutionIndex: 483
    SolutionNameMin: Cijk_Ailk_Bljk_HBH_MT32x64x32_MI16x16x16x1_SE_1LDSB0_AF0EM1_AMAS3_BL1_EPS0_GRVW4_GSU1_ISA908_KLA_LBSPP128_LPB16_LRVW8_MAC_NLCA1_PGR2_PLR2_SIA3_SU32_SUS128_SRVW4_TT1_32_TLDS1_USFGROn1_VAW2_VSn1_VW2_WSGRA1_WSGRB1_WG32_8_1_WGM1
    SolutionIndex: 484
    SolutionNameMin: Cijk_Ailk_Bljk_HBH_MT32x64x64_MI16x16x16x1_SE_1LDSB0_AF0EM1_AMAS3_BL1_EPS0_GRVW4_GSU1_ISA908_KLA_LBSPP128_LPB16_LRVW8_MAC_NLCA1_PGR2_PLR5_SIA3_SU0_SUS256_SRVW4_TT1_32_TLDS1_USFGROn1_VAW2_VSn1_VW2_WSGRA1_WSGRB1_WG32_8_1_WGM1
    SolutionIndex: 485
    SolutionNameMin: Cijk_Ailk_Bljk_HBH_MT256x256x32_MI32x32x8x1_SE_1LDSB1_AF0EM8_AMAS3_BL1_EPS1_GRVW8_GSU1_ISA908_KLA_LBSPP128_LPB8_LRVW8_MAC_NLCA1_PGR1_PLR5_SIA3_SU0_SUS256_SRVW4_TT4_128_TLDS1_USFGROn1_VAW2_VSn1_VW2_WSGRA1_WSGRB1_WG64_4_1_WGM2
    SolutionIndex: 486
    SolutionNameMin: Cijk_Ailk_Bljk_HBH_MT128x256x32_MI32x32x8x1_SE_1LDSB0_AF0EM1_AMAS3_BL1_EPS0_GRVW8_GSU1_ISA908_KLA_LBSPP128_LPB8_LRVW8_MAC_NLCA1_PGR2_PLR5_SIA3_SU0_SUS256_SRVW4_TT2_128_TLDS1_USFGROn1_VAW2_VSn1_VW2_WSGRA1_WSGRB1_WG64_4_1_WGM15
    SolutionIndex: 487
    SolutionNameMin: Cijk_Ailk_Bljk_HBH_MT256x160x32_MI32x32x8x1_SE_1LDSB0_AF0EM8_AMAS3_BL1_EPS1_GRVW4_GSU1_ISA908_KLA_LBSPP128_LPB8_LRVW8_MAC_NLCA1_PGR1_PLR5_SIA3_SU32_SUS256_SRVW4_TT2_160_TLDS1_USFGROn1_VAW2_VSn1_VW2_WSGRA1_WSGRB1_WG128_2_1_WGM1
    SolutionIndex: 488
    SolutionNameMin: Cijk_Ailk_Bljk_HBH_MT256x160x32_MI32x32x8x1_SE_1LDSB0_AF0EM8_AMAS3_BL1_EPS1_GRVW4_GSU1_ISA908_KLA_LBSPP128_LPB8_LRVW8_MAC_NLCA1_PGR1_PLR5_SIA3_SU32_SUS256_SRVW4_TT2_160_TLDS1_USFGROn1_VAW2_VSn1_VW2_WSGRA1_WSGRB1_WG128_2_1_WGM2
    SolutionIndex: 489
    SolutionNameMin: Cijk_Ailk_Bljk_HBH_MT128x288x32_MI32x32x8x1_SE_1LDSB0_AF0EM8_AMAS3_BL1_EPS0_GRVW2_GSU1_ISA908_KLA_LBSPP128_LPB8_LRVW8_MAC_NLCA1_PGR2_PLR5_SIA3_SU0_SUS256_SRVW4_TT1_288_TLDS1_USFGROn1_VAW2_VSn1_VW2_WSGRA1_WSGRB1_WG128_2_1_WGM15
    SolutionIndex: 490
    SolutionNameMin: Cijk_Ailk_Bljk_HBH_MT256x256x32_MI32x32x8x1_SE_1LDSB1_AF0EM8_AMAS3_BL1_EPS0_GRVW4_GSU15_ISA908_KLA_LBSPP128_LPB8_LRVW8_MAC_NLCA1_PGR2_PLR5_SIA3_SU32_SUS128_SRVW0_TT4_128_TLDS1_USFGROn1_VAW1_VSn1_VW2_WSGRA1_WSGRB1_WG64_4_1_WGM15
    SolutionIndex: 491
    SolutionNameMin: Cijk_Ailk_Bljk_HBH_MT256x256x32_MI32x32x8x1_SE_1LDSB1_AF0EM8_AMAS3_BL1_EPS1_GRVW4_GSU15_ISA908_KLA_LBSPP128_LPB8_LRVW8_MAC_NLCA1_PGR1_PLR5_SIA3_SU0_SUS256_SRVW0_TT4_128_TLDS1_USFGROn1_VAW1_VSn1_VW2_WSGRA1_WSGRB1_WG64_4_1_WGM1
    SolutionIndex: 492
    SolutionNameMin: Cijk_Ailk_Bljk_HBH_MT256x160x32_MI32x32x8x1_SE_1LDSB0_AF0EM8_AMAS3_BL1_EPS0_GRVW4_GSU7_ISA908_KLA_LBSPP128_LPB8_LRVW8_MAC_NLCA1_PGR2_PLR5_SIA3_SU32_SUS256_SRVW4_TT2_160_TLDS1_USFGROn1_VAW1_VSn1_VW2_WSGRA1_WSGRB1_WG128_2_1_WGM1
    SolutionIndex: 493
    SolutionNameMin: Cijk_Ailk_Bljk_HBH_MT256x160x32_MI32x32x8x1_SE_1LDSB0_AF0EM8_AMAS3_BL1_EPS0_GRVW2_GSU7_ISA908_KLA_LBSPP128_LPB8_LRVW8_MAC_NLCA2_PGR2_PLR5_SIA3_SU32_SUS128_SRVW4_TT2_160_TLDS1_USFGROn1_VAW1_VSn1_VW2_WSGRA1_WSGRB1_WG128_2_1_WGM2
    SolutionIndex: 494
    SolutionNameMin: Cijk_Ailk_Bljk_HBH_MT256x144x64_MI16x16x16x1_SE_1LDSB1_AF0EM8_AMAS3_BL1_EPS1_GRVW4_GSU7_ISA908_KLA_LBSPP128_LPB16_LRVW8_MAC_NLCA1_PGR1_PLR5_SIA3_SU0_SUS256_SRVW4_TT4_144_TLDS1_USFGROn1_VAW1_VSn1_VW2_WSGRA1_WSGRB1_WG64_4_1_WGM1
    SolutionIndex: 495
    SolutionNameMin: Cijk_Ailk_Bljk_HBH_MT256x160x32_MI32x32x8x1_SE_1LDSB0_AF0EM8_AMAS3_BL1_EPS0_GRVW4_GSU7_ISA908_KLA_LBSPP128_LPB8_LRVW8_MAC_NLCA1_PGR2_PLR5_SIA3_SU32_SUS128_SRVW4_TT2_160_TLDS1_USFGROn1_VAW1_VSn1_VW2_WSGRA1_WSGRB1_WG128_2_1_WGM1
    SolutionIndex: 496
    SolutionNameMin: Cijk_Ailk_Bljk_HBH_MT256x192x32_MI32x32x8x1_SE_1LDSB0_AF0EM8_AMAS3_BL1_EPS1_GRVW4_GSU7_ISA908_KLA_LBSPP128_LPB8_LRVW8_MAC_NLCA1_PGR1_PLR5_SIA3_SU32_SUS128_SRVW0_TT4_96_TLDS1_USFGROn1_VAW1_VSn1_VW2_WSGRA1_WSGRB1_WG64_4_1_WGM1
    SolutionIndex: 497
    SolutionNameMin: Cijk_Ailk_Bljk_HBH_MT256x192x32_MI32x32x8x1_SE_1LDSB0_AF0EM8_AMAS3_BL1_EPS0_GRVW8_GSU1_ISA908_KLA_LBSPP128_LPB8_LRVW8_MAC_NLCA1_PGR2_PLR5_SIA3_SU32_SUS128_SRVW4_TT4_96_TLDS1_USFGROn1_VAW2_VSn1_VW2_WSGRA1_WSGRB1_WG64_4_1_WGM2
    SolutionIndex: 498
    SolutionNameMin: Cijk_Ailk_Bljk_HBH_MT256x160x32_MI32x32x8x1_SE_1LDSB0_AF0EM8_AMAS3_BL1_EPS0_GRVW4_GSU2_ISA908_KLA_LBSPP128_LPB8_LRVW8_MAC_NLCA1_PGR2_PLR5_SIA3_SU32_SUS256_SRVW4_TT2_160_TLDS1_USFGROn1_VAW1_VSn1_VW2_WSGRA1_WSGRB1_WG128_2_1_WGM2
    SolutionIndex: 499
    SolutionNameMin: Cijk_Ailk_Bljk_HBH_MT256x160x32_MI32x32x8x1_SE_1LDSB0_AF0EM8_AMAS3_BL1_EPS0_GRVW4_GSU2_ISA908_KLA_LBSPP128_LPB8_LRVW8_MAC_NLCA1_PGR2_PLR5_SIA3_SU0_SUS256_SRVW4_TT2_160_TLDS1_USFGROn1_VAW1_VSn1_VW2_WSGRA1_WSGRB1_WG128_2_1_WGM2
    SolutionIndex: 500
    SolutionNameMin: Cijk_Ailk_Bljk_HBH_MT256x160x32_MI32x32x8x1_SE_1LDSB0_AF0EM8_AMAS3_BL1_EPS0_GRVW4_GSU2_ISA908_KLA_LBSPP128_LPB8_LRVW8_MAC_NLCA1_PGR2_PLR5_SIA3_SU32_SUS128_SRVW4_TT2_160_TLDS1_USFGROn1_VAW1_VSn1_VW2_WSGRA1_WSGRB1_WG128_2_1_WGM15
    SolutionIndex: 501
    SolutionNameMin: Cijk_Ailk_Bljk_HBH_MT64x128x64_MI32x32x8x1_SE_1LDSB0_AF0EM8_AMAS3_BL1_EPS1_GRVW8_GSU1_ISA908_KLA_LBSPP128_LPB8_LRVW8_MAC_NLCA1_PGR1_PLR9_SIA3_SU0_SUS256_SRVW4_TT1_64_TLDS1_USFGROn1_VAW2_VSn1_VW2_WSGRA1_WSGRB1_WG64_4_1_WGM15
    SolutionIndex: 502
    SolutionNameMin: Cijk_Ailk_Bljk_HBH_MT256x160x32_MI32x32x8x1_SE_1LDSB0_AF0EM8_AMAS3_BL1_EPS0_GRVW2_GSU7_ISA908_KLA_LBSPP128_LPB8_LRVW8_MAC_NLCA2_PGR2_PLR5_SIA3_SU32_SUS256_SRVW4_TT2_160_TLDS1_USFGROn1_VAW1_VSn1_VW2_WSGRA1_WSGRB1_WG128_2_1_WGM1
    SolutionIndex: 503
    SolutionNameMin: Cijk_Ailk_Bljk_HBH_MT256x160x32_MI32x32x8x1_SE_1LDSB0_AF0EM8_AMAS3_BL1_EPS0_GRVW2_GSU7_ISA908_KLA_LBSPP128_LPB8_LRVW8_MAC_NLCA2_PGR2_PLR5_SIA3_SU32_SUS128_SRVW4_TT2_160_TLDS1_USFGROn1_VAW1_VSn1_VW2_WSGRA1_WSGRB1_WG128_2_1_WGM1
    SolutionIndex: 504
    SolutionNameMin: Cijk_Ailk_Bljk_HBH_MT256x160x32_MI32x32x8x1_SE_1LDSB0_AF0EM8_AMAS3_BL1_EPS0_GRVW4_GSU7_ISA908_KLA_LBSPP128_LPB8_LRVW8_MAC_NLCA1_PGR2_PLR5_SIA3_SU32_SUS128_SRVW4_TT2_160_TLDS1_USFGROn1_VAW1_VSn1_VW2_WSGRA1_WSGRB1_WG128_2_1_WGM2
    SolutionIndex: 505
    SolutionNameMin: Cijk_Ailk_Bljk_HBH_MT256x160x32_MI32x32x8x1_SE_1LDSB0_AF0EM8_AMAS3_BL1_EPS1_GRVW4_GSU7_ISA908_KLA_LBSPP128_LPB8_LRVW8_MAC_NLCA1_PGR1_PLR5_SIA3_SU0_SUS256_SRVW4_TT2_160_TLDS1_USFGROn1_VAW1_VSn1_VW2_WSGRA1_WSGRB1_WG128_2_1_WGM1
    SolutionIndex: 506
    SolutionNameMin: Cijk_Ailk_Bljk_HBH_MT256x160x32_MI32x32x8x1_SE_1LDSB0_AF0EM8_AMAS3_BL1_EPS0_GRVW4_GSU7_ISA908_KLA_LBSPP128_LPB8_LRVW8_MAC_NLCA1_PGR2_PLR5_SIA3_SU32_SUS256_SRVW4_TT2_160_TLDS1_USFGROn1_VAW1_VSn1_VW2_WSGRA1_WSGRB1_WG128_2_1_WGM15
    SolutionIndex: 507
    SolutionNameMin: Cijk_Ailk_Bljk_HBH_MT256x192x32_MI32x32x8x1_SE_1LDSB1_AF0EM8_AMAS3_BL1_EPS1_GRVW4_GSU7_ISA908_KLA_LBSPP128_LPB8_LRVW8_MAC_NLCA1_PGR1_PLR5_SIA3_SU32_SUS256_SRVW0_TT4_96_TLDS1_USFGROn1_VAW1_VSn1_VW2_WSGRA1_WSGRB1_WG64_4_1_WGM2
    SolutionIndex: 508
    SolutionNameMin: Cijk_Ailk_Bljk_HBH_MT256x192x32_MI32x32x8x1_SE_1LDSB0_AF0EM8_AMAS3_BL1_EPS0_GRVW4_GSU7_ISA908_KLA_LBSPP128_LPB8_LRVW8_MAC_NLCA1_PGR2_PLR5_SIA3_SU32_SUS256_SRVW0_TT4_96_TLDS1_USFGROn1_VAW1_VSn1_VW2_WSGRA1_WSGRB1_WG64_4_1_WGM1
    SolutionIndex: 509
    SolutionNameMin: Cijk_Ailk_Bljk_HBH_MT256x192x32_MI32x32x8x1_SE_1LDSB0_AF0EM8_AMAS3_BL1_EPS1_GRVW4_GSU7_ISA908_KLA_LBSPP128_LPB8_LRVW8_MAC_NLCA1_PGR1_PLR5_SIA3_SU0_SUS256_SRVW0_TT4_96_TLDS1_USFGROn1_VAW1_VSn1_VW2_WSGRA1_WSGRB1_WG64_4_1_WGM1
    SolutionIndex: 510
    SolutionNameMin: Cijk_Ailk_Bljk_HBH_MT160x160x64_MI16x16x16x1_SE_1LDSB1_AF0EM8_AMAS3_BL1_EPS1_GRVW8_GSU1_ISA908_KLA_LBSPP128_LPB16_LRVW8_MAC_NLCA5_PGR1_PLR5_SIA3_SU32_SUS128_SRVW0_TT5_80_TLDS1_USFGROn1_VAW2_VSn1_VW2_WSGRA1_WSGRB1_WG32_8_1_WGM2
    SolutionIndex: 511
    SolutionNameMin: Cijk_Ailk_Bljk_HBH_MT192x128x32_MI32x32x8x1_SE_1LDSB0_AF0EM8_AMAS3_BL1_EPS0_GRVW4_GSU7_ISA908_KLA_LBSPP128_LPB8_LRVW8_MAC_NLCA3_PGR2_PLR5_SIA3_SU32_SUS128_SRVW0_TT3_64_TLDS1_USFGROn1_VAW1_VSn1_VW2_WSGRA1_WSGRB1_WG64_4_1_WGM2
    SolutionIndex: 512
    SolutionNameMin: Cijk_Ailk_Bljk_HBH_MT160x128x32_MI32x32x8x1_SE_1LDSB0_AF0EM8_AMAS3_BL1_EPS0_GRVW2_GSU7_ISA908_KLA_LBSPP128_LPB8_LRVW8_MAC_NLCA5_PGR2_PLR5_SIA3_SU32_SUS256_SRVW0_TT5_32_TLDS1_USFGROn1_VAW1_VSn1_VW2_WSGRA1_WSGRB1_WG32_8_1_WGM15
    SolutionIndex: 513
    SolutionNameMin: Cijk_Ailk_Bljk_HBH_MT32x32x64_MI16x16x16x1_SE_1LDSB0_AF0EM8_AMAS3_BL1_EPS1_GRVW2_GSU3_ISA908_KLA_LBSPP128_LPB16_LRVW8_MAC_NLCA1_PGR1_PLR5_SIA3_SU0_SUS256_SRVW0_TT1_16_TLDS1_USFGROn1_VAW1_VSn1_VW2_WSGRA1_WSGRB1_WG32_8_1_WGM1
    SolutionIndex: 514
    SolutionNameMin: Cijk_Ailk_Bljk_HBH_MT128x64x64_MI32x32x8x1_SE_1LDSB0_AF0EM8_AMAS3_BL1_EPS0_GRVW8_GSU5_ISA908_KLA_LBSPP128_LPB8_LRVW8_MAC_NLCA1_PGR2_PLR9_SIA3_SU0_SUS256_SRVW4_TT2_32_TLDS1_USFGROn1_VAW1_VSn1_VW2_WSGRA1_WSGRB1_WG64_4_1_WGM15
    SolutionIndex: 515
    SolutionNameMin: Cijk_Ailk_Bljk_HBH_MT128x64x64_MI32x32x8x1_SE_1LDSB0_AF0EM8_AMAS3_BL1_EPS1_GRVW8_GSU5_ISA908_KLA_LBSPP128_LPB8_LRVW8_MAC_NLCA1_PGR1_PLR9_SIA3_SU0_SUS256_SRVW0_TT2_32_TLDS1_USFGROn1_VAW1_VSn1_VW2_WSGRA1_WSGRB1_WG64_4_1_WGM15
    SolutionIndex: 516
    SolutionNameMin: Cijk_Ailk_Bljk_HBH_MT128x64x64_MI32x32x8x1_SE_1LDSB0_AF0EM8_AMAS3_BL1_EPS0_GRVW8_GSU5_ISA908_KLA_LBSPP128_LPB8_LRVW8_MAC_NLCA1_PGR2_PLR9_SIA3_SU0_SUS256_SRVW4_TT2_32_TLDS1_USFGROn1_VAW1_VSn1_VW2_WSGRA1_WSGRB1_WG64_4_1_WGM1
    SolutionIndex: 517
    SolutionNameMin: Cijk_Ailk_Bljk_HBH_MT128x64x64_MI32x32x8x1_SE_1LDSB0_AF0EM8_AMAS3_BL1_EPS0_GRVW4_GSU5_ISA908_KLA_LBSPP128_LPB8_LRVW8_MAC_NLCA1_PGR2_PLR9_SIA3_SU32_SUS128_SRVW4_TT2_32_TLDS1_USFGROn1_VAW1_VSn1_VW2_WSGRA1_WSGRB1_WG64_4_1_WGM1
    SolutionIndex: 518
    SolutionNameMin: Cijk_Ailk_Bljk_HBH_MT128x64x64_MI32x32x8x1_SE_1LDSB0_AF0EM8_AMAS3_BL1_EPS0_GRVW8_GSU5_ISA908_KLA_LBSPP128_LPB8_LRVW8_MAC_NLCA1_PGR2_PLR9_SIA3_SU32_SUS128_SRVW4_TT2_32_TLDS1_USFGROn1_VAW1_VSn1_VW2_WSGRA1_WSGRB1_WG64_4_1_WGM1
    SolutionIndex: 519
    SolutionNameMin: Cijk_Ailk_Bljk_HBH_MT128x96x64_MI32x32x8x1_SE_1LDSB0_AF0EM8_AMAS3_BL1_EPS0_GRVW8_GSU5_ISA908_KLA_LBSPP128_LPB8_LRVW8_MAC_NLCA1_PGR2_PLR9_SIA3_SU32_SUS256_SRVW4_TT1_96_TLDS1_USFGROn1_VAW1_VSn1_VW2_WSGRA1_WSGRB1_WG128_2_1_WGM15
    SolutionIndex: 520
    SolutionNameMin: Cijk_Ailk_Bljk_HBH_MT128x64x64_MI32x32x8x1_SE_1LDSB0_AF0EM8_AMAS3_BL1_EPS0_GRVW4_GSU5_ISA908_KLA_LBSPP128_LPB8_LRVW8_MAC_NLCA1_PGR2_PLR9_SIA3_SU32_SUS128_SRVW4_TT2_32_TLDS1_USFGROn1_VAW1_VSn1_VW2_WSGRA1_WSGRB1_WG64_4_1_WGM15
    SolutionIndex: 521
    SolutionNameMin: Cijk_Ailk_Bljk_HBH_MT128x64x64_MI32x32x8x1_SE_1LDSB0_AF0EM8_AMAS3_BL1_EPS0_GRVW4_GSU5_ISA908_KLA_LBSPP128_LPB8_LRVW8_MAC_NLCA1_PGR2_PLR9_SIA3_SU32_SUS128_SRVW4_TT2_32_TLDS1_USFGROn1_VAW1_VSn1_VW2_WSGRA1_WSGRB1_WG64_4_1_WGM2
    SolutionIndex: 522
    SolutionNameMin: Cijk_Ailk_Bljk_HBH_MT128x64x64_MI32x32x8x1_SE_1LDSB0_AF0EM8_AMAS3_BL1_EPS0_GRVW8_GSU5_ISA908_KLA_LBSPP128_LPB8_LRVW8_MAC_NLCA1_PGR2_PLR9_SIA3_SU32_SUS128_SRVW4_TT2_32_TLDS1_USFGROn1_VAW1_VSn1_VW2_WSGRA1_WSGRB1_WG64_4_1_WGM15
    SolutionIndex: 523
    SolutionNameMin: Cijk_Ailk_Bljk_HBH_MT128x96x64_MI32x32x8x1_SE_1LDSB0_AF0EM8_AMAS3_BL1_EPS0_GRVW4_GSU5_ISA908_KLA_LBSPP128_LPB8_LRVW8_MAC_NLCA1_PGR2_PLR9_SIA3_SU32_SUS128_SRVW4_TT1_96_TLDS1_USFGROn1_VAW1_VSn1_VW2_WSGRA1_WSGRB1_WG128_2_1_WGM1
    SolutionIndex: 524
    SolutionNameMin: Cijk_Ailk_Bljk_HBH_MT128x96x64_MI32x32x8x1_SE_1LDSB0_AF0EM8_AMAS3_BL1_EPS0_GRVW4_GSU5_ISA908_KLA_LBSPP128_LPB8_LRVW8_MAC_NLCA1_PGR2_PLR9_SIA3_SU32_SUS128_SRVW4_TT1_96_TLDS1_USFGROn1_VAW1_VSn1_VW2_WSGRA1_WSGRB1_WG128_2_1_WGM2
    SolutionIndex: 525
    SolutionNameMin: Cijk_Ailk_Bljk_HBH_MT128x96x64_MI32x32x8x1_SE_1LDSB0_AF0EM8_AMAS3_BL1_EPS0_GRVW2_GSU5_ISA908_KLA_LBSPP128_LPB8_LRVW8_MAC_NLCA1_PGR2_PLR9_SIA3_SU32_SUS256_SRVW4_TT1_96_TLDS1_USFGROn1_VAW1_VSn1_VW2_WSGRA1_WSGRB1_WG128_2_1_WGM1
    SolutionIndex: 526
    SolutionNameMin: Cijk_Ailk_Bljk_HBH_MT128x96x64_MI32x32x8x1_SE_1LDSB0_AF0EM8_AMAS3_BL1_EPS0_GRVW4_GSU5_ISA908_KLA_LBSPP128_LPB8_LRVW8_MAC_NLCA1_PGR2_PLR9_SIA3_SU32_SUS256_SRVW4_TT1_96_TLDS1_USFGROn1_VAW1_VSn1_VW2_WSGRA1_WSGRB1_WG128_2_1_WGM15
    SolutionIndex: 527
    SolutionNameMin: Cijk_Ailk_Bljk_HBH_MT256x192x32_MI32x32x8x1_SE_1LDSB0_AF0EM8_AMAS3_BL1_EPS1_GRVW8_GSU1_ISA908_KLA_LBSPP128_LPB8_LRVW8_MAC_NLCA1_PGR1_PLR5_SIA3_SU0_SUS256_SRVW4_TT4_96_TLDS1_USFGROn1_VAW2_VSn1_VW2_WSGRA1_WSGRB1_WG64_4_1_WGM2
    SolutionIndex: 528
    SolutionNameMin: Cijk_Ailk_Bljk_HBH_MT128x128x32_MI32x32x8x1_SN_1LDSB0_AF0EM8_AMAS3_BL1_EPS0_GRVW4_GSU7_ISA908_KLA_LBSPP128_LPB8_LRVW8_MAC_NLCA1_PGR2_PLR5_SIA3_SU32_SUS128_SRVW4_TT2_64_TLDS1_USFGROn1_VAW1_VSn1_VW2_WSGRA1_WSGRB1_WG64_4_1_WGM15
    SolutionIndex: 529
    SolutionNameMin: Cijk_Ailk_Bljk_HBH_MT256x128x32_MI32x32x8x1_SE_1LDSB1_AF0EM8_AMAS3_BL1_EPS1_GRVW8_GSU1_ISA908_KLA_LBSPP128_LPB8_LRVW8_MAC_NLCA1_PGR1_PLR5_SIA3_SU32_SUS256_SRVW4_TT4_64_TLDS1_USFGROn1_VAW2_VSn1_VW2_WSGRA1_WSGRB1_WG64_4_1_WGM15
    SolutionIndex: 530
    SolutionNameMin: Cijk_Ailk_Bljk_HBH_MT16x64x32_MI16x16x16x1_SE_1LDSB0_AF0EM8_AMAS3_BL1_EPS1_GRVW2_GSU1_ISA908_KLA_LBSPP128_LPB16_LRVW8_MAC_NLCA1_PGR1_PLR2_SIA3_SU0_SUS256_SRVW0_TT1_16_TLDS1_USFGROn1_VAW2_VSn1_VW2_WSGRA1_WSGRB1_WG16_16_1_WGM1
    SolutionIndex: 531
    SolutionNameMin: Cijk_Ailk_Bljk_HBH_MT256x256x32_MI32x32x8x1_SE_1LDSB1_AF0EM8_AMAS3_BL1_EPS0_GRVW8_GSU1_ISA908_KLA_LBSPP128_LPB8_LRVW8_MAC_NLCA1_PGR2_PLR5_SIA3_SU0_SUS256_SRVW4_TT4_128_TLDS1_USFGROn1_VAW2_VSn1_VW2_WSGRA1_WSGRB1_WG64_4_1_WGM2
    SolutionIndex: 532
    SolutionNameMin: Cijk_Ailk_Bljk_HBH_MT128x192x32_MI32x32x8x1_SN_1LDSB1_AF0EM8_AMAS3_BL1_EPS1_GRVW2_GSU1_ISA908_KLA_LBSPP128_LPB8_LRVW8_MAC_NLCA1_PGR1_PLR5_SIA3_SU0_SUS256_SRVW4_TT2_96_TLDS1_USFGROn1_VAW2_VSn1_VW2_WSGRA1_WSGRB1_WG64_4_1_WGM2
    SolutionIndex: 533
    SolutionNameMin: Cijk_Ailk_Bljk_HBH_MT128x256x32_MI32x32x8x1_SE_1LDSB1_AF0EM8_AMAS3_BL1_EPS0_GRVW8_GSU1_ISA908_KLA_LBSPP128_LPB8_LRVW8_MAC_NLCA1_PGR2_PLR5_SIA3_SU32_SUS256_SRVW4_TT2_128_TLDS1_USFGROn1_VAW2_VSn1_VW2_WSGRA1_WSGRB1_WG64_4_1_WGM1
    SolutionIndex: 534
    SolutionNameMin: Cijk_Ailk_Bljk_HBH_MT256x128x32_MI32x32x8x1_SE_1LDSB0_AF0EM8_AMAS3_BL1_EPS0_GRVW4_GSU1_ISA908_KLA_LBSPP128_LPB8_LRVW8_MAC_NLCA1_PGR2_PLR5_SIA3_SU0_SUS256_SRVW4_TT4_64_TLDS1_USFGROn1_VAW2_VSn1_VW2_WSGRA1_WSGRB1_WG64_4_1_WGM15
    SolutionIndex: 535
    SolutionNameMin: Cijk_Ailk_Bljk_HBH_MT128x256x32_MI32x32x8x1_SE_1LDSB1_AF0EM1_AMAS3_BL1_EPS0_GRVW8_GSU1_ISA908_KLA_LBSPP128_LPB8_LRVW8_MAC_NLCA1_PGR2_PLR5_SIA3_SU32_SUS128_SRVW4_TT2_128_TLDS1_USFGROn1_VAW2_VSn1_VW2_WSGRA1_WSGRB1_WG64_4_1_WGM2
    SolutionIndex: 536
    SolutionNameMin: Cijk_Ailk_Bljk_HBH_MT256x256x32_MI32x32x8x1_SE_1LDSB1_AF0EM8_AMAS3_BL1_EPS0_GRVW8_GSU1_ISA908_KLA_LBSPP128_LPB8_LRVW8_MAC_NLCA1_PGR2_PLR5_SIA3_SU0_SUS256_SRVW4_TT4_128_TLDS1_USFGROn1_VAW2_VSn1_VW2_WSGRA1_WSGRB1_WG64_4_1_WGM15
    SolutionIndex: 537
    SolutionNameMin: Cijk_Ailk_Bljk_HBH_MT128x256x32_MI32x32x8x1_SN_1LDSB1_AF0EM8_AMAS3_BL1_EPS1_GRVW8_GSU1_ISA908_KLA_LBSPP128_LPB8_LRVW8_MAC_NLCA1_PGR1_PLR5_SIA3_SU32_SUS256_SRVW4_TT2_128_TLDS1_USFGROn1_VAW2_VSn1_VW2_WSGRA1_WSGRB1_WG64_4_1_WGM2
    SolutionIndex: 538
    SolutionNameMin: Cijk_Ailk_Bljk_HBH_MT256x192x64_MI32x32x8x1_SN_1LDSB1_AF0EM8_AMAS3_BL1_EPS1_GRVW8_GSU1_ISA908_KLA_LBSPP128_LPB8_LRVW8_MAC_NLCA1_PGR1_PLR9_SIA3_SU32_SUS256_SRVW4_TT4_96_TLDS1_USFGROn1_VAW2_VSn1_VW2_WSGRA1_WSGRB1_WG64_4_1_WGM15
    SolutionIndex: 539
    SolutionNameMin: Cijk_Ailk_Bljk_HBH_MT128x256x32_MI32x32x8x1_SE_1LDSB1_AF0EM1_AMAS3_BL1_EPS1_GRVW8_GSU1_ISA908_KLA_LBSPP128_LPB8_LRVW8_MAC_NLCA1_PGR1_PLR5_SIA3_SU0_SUS256_SRVW4_TT2_128_TLDS1_USFGROn1_VAW2_VSn1_VW2_WSGRA1_WSGRB1_WG64_4_1_WGM1
    SolutionIndex: 540
    SolutionNameMin: Cijk_Ailk_Bljk_HBH_MT256x192x64_MI32x32x8x1_SN_1LDSB1_AF0EM8_AMAS3_BL1_EPS0_GRVW8_GSU1_ISA908_KLA_LBSPP128_LPB8_LRVW8_MAC_NLCA1_PGR2_PLR9_SIA3_SU32_SUS256_SRVW4_TT4_96_TLDS1_USFGROn1_VAW2_VSn1_VW2_WSGRA1_WSGRB1_WG64_4_1_WGM1
    SolutionIndex: 541
    SolutionNameMin: Cijk_Ailk_Bljk_HBH_MT256x192x64_MI32x32x8x1_SN_1LDSB1_AF0EM8_AMAS3_BL1_EPS1_GRVW8_GSU1_ISA908_KLA_LBSPP128_LPB8_LRVW8_MAC_NLCA1_PGR1_PLR9_SIA3_SU0_SUS256_SRVW4_TT4_96_TLDS1_USFGROn1_VAW2_VSn1_VW2_WSGRA1_WSGRB1_WG64_4_1_WGM1
    SolutionIndex: 542
    SolutionNameMin: Cijk_Ailk_Bljk_HBH_MT192x256x32_MI32x32x8x1_SN_1LDSB1_AF0EM8_AMAS3_BL1_EPS1_GRVW8_GSU1_ISA908_KLA_LBSPP128_LPB8_LRVW8_MAC_NLCA3_PGR1_PLR5_SIA3_SU0_SUS256_SRVW0_TT3_128_TLDS1_USFGROn1_VAW2_VSn1_VW2_WSGRA1_WSGRB1_WG64_4_1_WGM2
    SolutionIndex: 543
    SolutionNameMin: Cijk_Ailk_Bljk_HBH_MT256x192x64_MI32x32x8x1_SN_1LDSB1_AF0EM8_AMAS3_BL1_EPS1_GRVW8_GSU1_ISA908_KLA_LBSPP128_LPB8_LRVW8_MAC_NLCA1_PGR1_PLR9_SIA3_SU0_SUS256_SRVW4_TT4_96_TLDS1_USFGROn1_VAW2_VSn1_VW2_WSGRA1_WSGRB1_WG64_4_1_WGM15
    SolutionIndex: 544
    SolutionNameMin: Cijk_Ailk_Bljk_HBH_MT256x256x32_MI32x32x8x1_SE_1LDSB1_AF0EM8_AMAS3_BL1_EPS1_GRVW8_GSU1_ISA908_KLA_LBSPP128_LPB8_LRVW8_MAC_NLCA1_PGR1_PLR5_SIA3_SU32_SUS128_SRVW4_TT4_128_TLDS1_USFGROn1_VAW2_VSn1_VW2_WSGRA1_WSGRB1_WG64_4_1_WGM15
    SolutionIndex: 589
    SolutionNameMin: Cijk_Ailk_Bljk_HBH_MT32x32x64_MI16x16x16x1_SN_1LDSB0_GRVW8_LPB16_LRVW8_NLCA1_PLR5_SU0_SUS0_SRVW4_TT1_16_WG32_8_1_WGM1
- - - [1024, 1024, 1, 3328]
    - [0, 36.894]
  - - [2944, 4288, 1, 1280]
    - [1, 54.971]
  - - [2368, 64, 1, 3328]
    - [2, 9.464]
  - - [2368, 5888, 1, 256]
    - [3, 34.852]
  - - [256, 704, 1, 1280]
    - [4, 6.401]
  - - [128, 6784, 1, 3328]
    - [5, 36.347]
  - - [5888, 1856, 1, 3328]
    - [6, 72.615]
  - - [5888, 2944, 1, 3328]
    - [7, 75.418]
  - - [1856, 4288, 1, 256]
    - [8, 26.26]
  - - [5056, 5056, 1, 3328]
    - [1, 80.266]
  - - [1408, 5888, 1, 1280]
    - [9, 50.375]
  - - [1024, 3584, 1, 3328]
    - [10, 57.839]
  - - [448, 3584, 1, 3328]
    - [11, 47.445]
  - - [256, 4288, 1, 3328]
    - [0, 40.658]
  - - [5888, 1408, 1, 1280]
    - [12, 49.079]
  - - [704, 1856, 1, 3328]
    - [13, 44.197]
  - - [1024, 2368, 1, 256]
    - [14, 14.287]
  - - [5056, 6784, 1, 1280]
    - [15, 71.505]
  - - [1408, 64, 1, 1280]
    - [16, 2.883]
  - - [448, 1024, 1, 1280]
    - [17, 14.951]
  - - [5056, 5056, 1, 1280]
    - [18, 67.006]
  - - [4288, 6784, 1, 256]
    - [19, 34.292]
  - - [6784, 448, 1, 256]
    - [20, 14.326]
  - - [5056, 256, 1, 1280]
    - [21, 28.423]
  - - [5888, 704, 1, 1280]
    - [22, 43.43]
  - - [3584, 1024, 1, 256]
    - [23, 18.51]
  - - [6784, 4288, 1, 3328]
    - [24, 79.815]
  - - [1856, 2368, 1, 3328]
    - [25, 62.087]
  - - [5888, 2944, 1, 1280]
    - [26, 61.185]
  - - [5888, 1024, 1, 256]
    - [27, 22.802]
  - - [448, 64, 1, 1280]
    - [28, 1.078]
  - - [1024, 704, 1, 256]
    - [29, 5.573]
  - - [1408, 2944, 1, 256]
    - [30, 19.906]
  - - [256, 1856, 1, 1280]
    - [31, 13.507]
  - - [6784, 5056, 1, 3328]
    - [24, 83.772]
  - - [5056, 5056, 1, 256]
    - [32, 31.724]
  - - [256, 2944, 1, 3328]
    - [33, 31.103]
  - - [64, 1024, 1, 1280]
    - [34, 2.504]
  - - [1024, 3584, 1, 1280]
    - [6, 45.803]
  - - [2368, 2944, 1, 1280]
    - [35, 54.301]
  - - [128, 3584, 1, 1280]
    - [36, 11.698]
  - - [6784, 6784, 1, 1280]
    - [37, 72.527]
  - - [1024, 256, 1, 3328]
    - [38, 14.986]
  - - [1408, 4288, 1, 1280]
    - [26, 48.221]
  - - [3584, 4288, 1, 1280]
    - [39, 62.493]
  - - [2368, 704, 1, 1280]
    - [40, 30.214]
  - - [5056, 4288, 1, 3328]
    - [41, 79.145]
  - - [3584, 2368, 1, 3328]
    - [42, 67.115]
  - - [5888, 6784, 1, 1280]
    - [10, 68.906]
  - - [64, 704, 1, 1280]
    - [43, 1.81]
  - - [4288, 256, 1, 256]
    - [44, 7.015]
  - - [6784, 448, 1, 1280]
    - [35, 37.494]
  - - [2944, 5888, 1, 256]
    - [45, 29.636]
  - - [256, 128, 1, 256]
    - [46, 0.236]
  - - [4288, 2944, 1, 256]
    - [47, 29.214]
  - - [5888, 64, 1, 3328]
    - [48, 18.497]
  - - [2944, 256, 1, 3328]
    - [49, 31.18]
  - - [5056, 2368, 1, 1280]
    - [50, 58.417]
  - - [448, 3584, 1, 1280]
    - [11, 29.289]
  - - [6784, 5888, 1, 256]
    - [51, 37.395]
  - - [64, 1024, 1, 3328]
    - [52, 3.893]
  - - [704, 128, 1, 1280]
    - [53, 3.335]
  - - [1408, 448, 1, 1280]
    - [54, 14.964]
  - - [1024, 1408, 1, 256]
    - [55, 9.751]
  - - [2368, 2368, 1, 3328]
    - [13, 59.415]
  - - [5056, 704, 1, 3328]
    - [56, 56.488]
  - - [1408, 1856, 1, 256]
    - [57, 13.172]
  - - [1408, 256, 1, 1280]
    - [58, 10.983]
  - - [5888, 1856, 1, 256]
    - [59, 30.202]
  - - [704, 5888, 1, 256]
    - [60, 19.059]
  - - [6784, 64, 1, 256]
    - [61, 3.855]
  - - [3584, 704, 1, 3328]
    - [62, 57.512]
  - - [1408, 1408, 1, 256]
    - [63, 11.065]
  - - [1024, 64, 1, 1280]
    - [64, 2.218]
  - - [448, 4288, 1, 256]
    - [65, 12.65]
  - - [64, 3584, 1, 3328]
    - [2, 13.885]
  - - [704, 2368, 1, 1280]
    - [66, 33.172]
  - - [1856, 2368, 1, 1280]
    - [67, 49.518]
  - - [2368, 128, 1, 3328]
    - [68, 16.859]
  - - [1408, 1408, 1, 3328]
    - [69, 51.833]
  - - [2944, 128, 1, 256]
    - [70, 3.252]
  - - [448, 1408, 1, 256]
    - [71, 5.068]
  - - [64, 5056, 1, 3328]
    - [17, 16.23]
  - - [1408, 1024, 1, 1280]
    - [72, 29.322]
  - - [704, 6784, 1, 256]
    - [30, 21.742]
  - - [6784, 704, 1, 256]
    - [30, 20.549]
  - - [256, 3584, 1, 3328]
    - [33, 34.525]
  - - [5056, 704, 1, 256]
    - [30, 16.916]
  - - [1408, 3584, 1, 256]
    - [73, 19.854]
  - - [3584, 4288, 1, 3328]
    - [74, 78.241]
  - - [5888, 1856, 1, 1280]
    - [75, 57.766]
  - - [256, 1408, 1, 256]
    - [76, 3.026]
  - - [5056, 64, 1, 1280]
    - [68, 9.94]
  - - [2368, 128, 1, 256]
    - [77, 2.355]
  - - [2368, 3584, 1, 1280]
    - [78, 50.472]
  - - [1024, 256, 1, 256]
    - [79, 2.222]
  - - [448, 448, 1, 256]
    - [80, 1.734]
  - - [2944, 3584, 1, 3328]
    - [81, 74.884]
  - - [256, 256, 1, 3328]
    - [82, 4.217]
  - - [128, 1024, 1, 3328]
    - [83, 7.791]
  - - [6784, 2944, 1, 256]
    - [51, 32.752]
  - - [64, 1856, 1, 1280]
    - [84, 4.774]
  - - [448, 256, 1, 256]
    - [85, 1.117]
  - - [1856, 2368, 1, 256]
    - [86, 20.453]
  - - [3584, 6784, 1, 3328]
    - [15, 75.306]
  - - [256, 1024, 1, 256]
    - [87, 2.318]
  - - [1024, 128, 1, 1280]
    - [16, 4.317]
  - - [4288, 128, 1, 1280]
    - [5, 15.393]
  - - [5056, 4288, 1, 1280]
    - [24, 65.672]
  - - [5888, 64, 1, 256]
    - [88, 3.012]
  - - [6784, 1856, 1, 3328]
    - [89, 73.992]
  - - [1408, 5056, 1, 1280]
    - [26, 56.739]
  - - [1856, 256, 1, 1280]
    - [58, 13.162]
  - - [64, 5888, 1, 3328]
    - [48, 19.947]
  - - [6784, 5888, 1, 3328]
    - [90, 82.651]
  - - [448, 256, 1, 3328]
    - [91, 8.3]
  - - [2368, 5056, 1, 1280]
    - [89, 56.608]
  - - [1024, 704, 1, 1280]
    - [5, 17.271]
  - - [256, 1408, 1, 3328]
    - [92, 18.662]
  - - [6784, 128, 1, 3328]
    - [54, 32.971]
  - - [1024, 5056, 1, 1280]
    - [93, 47.925]
  - - [4288, 1024, 1, 256]
    - [94, 18.373]
  - - [2368, 1408, 1, 256]
    - [30, 16.483]
  - - [704, 704, 1, 3328]
    - [33, 23.064]
  - - [5888, 448, 1, 1280]
    - [95, 38.833]
  - - [3584, 256, 1, 3328]
    - [96, 35.202]
  - - [704, 5888, 1, 3328]
    - [3, 52.477]
  - - [1024, 6784, 1, 1280]
    - [97, 55.569]
  - - [128, 3584, 1, 3328]
    - [98, 23.563]
  - - [128, 704, 1, 1280]
    - [99, 2.912]
  - - [3584, 2944, 1, 1280]
    - [100, 51.718]
  - - [1856, 128, 1, 3328]
    - [101, 13.975]
  - - [128, 2944, 1, 1280]
    - [68, 11.79]
  - - [448, 1856, 1, 1280]
    - [33, 18.775]
  - - [1408, 5056, 1, 3328]
    - [102, 65.944]
  - - [1856, 1856, 1, 3328]
    - [103, 54.353]
  - - [3584, 128, 1, 256]
    - [104, 3.187]
  - - [448, 1408, 1, 3328]
    - [33, 30.192]
  - - [2368, 2368, 1, 256]
    - [8, 23.748]
  - - [4288, 4288, 1, 1280]
    - [35, 63.736]
  - - [64, 448, 1, 1280]
    - [52, 1.083]
  - - [5888, 1024, 1, 1280]
    - [15, 49.9]
  - - [704, 1024, 1, 256]
    - [105, 5.791]
  - - [704, 6784, 1, 3328]
    - [106, 59.571]
  - - [5888, 5888, 1, 3328]
    - [107, 84.902]
  - - [5056, 1024, 1, 1280]
    - [90, 48.585]
  - - [448, 5888, 1, 3328]
    - [108, 50.566]
  - - [1024, 2944, 1, 1280]
    - [109, 38.048]
  - - [5056, 5888, 1, 1280]
    - [100, 69.973]
  - - [448, 6784, 1, 256]
    - [110, 14.626]
  - - [256, 3584, 1, 256]
    - [111, 7.268]
  - - [256, 448, 1, 256]
    - [112, 1.131]
  - - [3584, 5888, 1, 256]
    - [3, 33.683]
  - - [2944, 3584, 1, 256]
    - [113, 30.138]
  - - [1408, 704, 1, 256]
    - [114, 7.396]
  - - [6784, 1024, 1, 3328]
    - [115, 63.472]
  - - [6784, 2944, 1, 3328]
    - [116, 73.995]
  - - [64, 64, 1, 3328]
    - [117, 0.316]
  - - [6784, 2368, 1, 1280]
    - [19, 57.62]
  - - [4288, 3584, 1, 256]
    - [109, 32.953]
  - - [4288, 5888, 1, 1280]
    - [1, 64.174]
  - - [448, 2944, 1, 3328]
    - [108, 41.409]
  - - [4288, 1856, 1, 1280]
    - [118, 46.354]
  - - [1856, 2944, 1, 3328]
    - [119, 66.202]
  - - [256, 6784, 1, 3328]
    - [120, 49.281]
  - - [64, 5888, 1, 256]
    - [121, 3.335]
  - - [5056, 1024, 1, 256]
    - [30, 21.936]
  - - [704, 64, 1, 3328]
    - [122, 3.266]
  - - [5056, 1856, 1, 3328]
    - [123, 74.685]
  - - [448, 448, 1, 3328]
    - [124, 11.319]
  - - [448, 2368, 1, 1280]
    - [21, 20.944]
  - - [1408, 128, 1, 1280]
    - [125, 6.323]
  - - [5056, 256, 1, 3328]
    - [126, 43.601]
  - - [704, 704, 1, 256]
    - [127, 3.969]
  - - [1024, 5888, 1, 1280]
    - [24, 49.613]
  - - [64, 128, 1, 256]
    - [128, 0.079]
  - - [128, 1856, 1, 1280]
    - [64, 7.905]
  - - [5056, 3584, 1, 256]
    - [100, 34.076]
  - - [1856, 1024, 1, 1280]
    - [129, 35.085]
  - - [1856, 1856, 1, 1280]
    - [130, 47.745]
  - - [128, 4288, 1, 3328]
    - [5, 27.019]
  - - [1856, 1024, 1, 3328]
    - [120, 54.571]
  - - [256, 2368, 1, 256]
    - [61, 4.276]
  - - [1024, 448, 1, 3328]
    - [31, 22.038]
  - - [1856, 704, 1, 1280]
    - [131, 27.212]
  - - [6784, 1024, 1, 256]
    - [30, 24.695]
  - - [5056, 5888, 1, 3328]
    - [15, 81.933]
  - - [1856, 1024, 1, 256]
    - [57, 12.468]
  - - [5056, 1408, 1, 3328]
    - [132, 66.458]
  - - [1024, 1024, 1, 1280]
    - [133, 22.167]
  - - [448, 5888, 1, 256]
    - [134, 13.496]
  - - [1408, 6784, 1, 3328]
    - [135, 70.993]
  - - [2944, 1408, 1, 3328]
    - [136, 53.638]
  - - [2944, 4288, 1, 3328]
    - [37, 68.48]
  - - [256, 2944, 1, 256]
    - [79, 5.717]
  - - [5056, 2944, 1, 256]
    - [26, 32.565]
  - - [2368, 1856, 1, 256]
    - [3, 20.278]
  - - [128, 6784, 1, 1280]
    - [137, 22.848]
  - - [1408, 3584, 1, 3328]
    - [106, 63.533]
  - - [2368, 6784, 1, 256]
    - [3, 35.061]
  - - [4288, 2368, 1, 3328]
    - [138, 68.156]
  - - [704, 3584, 1, 1280]
    - [116, 37.139]
  - - [1408, 5888, 1, 3328]
    - [139, 66.906]
  - - [1856, 5056, 1, 256]
    - [140, 28.117]
  - - [6784, 6784, 1, 256]
    - [30, 36.948]
  - - [1408, 704, 1, 3328]
    - [141, 37.169]
  - - [128, 5888, 1, 1280]
    - [142, 20.51]
  - - [2368, 4288, 1, 1280]
    - [143, 51.813]
  - - [3584, 1856, 1, 1280]
    - [41, 53.272]
  - - [704, 1408, 1, 3328]
    - [114, 36.44]
  - - [704, 64, 1, 1280]
    - [52, 1.647]
  - - [3584, 448, 1, 256]
    - [144, 10.907]
  - - [3584, 3584, 1, 1280]
    - [145, 53.365]
  - - [256, 6784, 1, 256]
    - [146, 9.751]
  - - [1856, 3584, 1, 3328]
    - [147, 62.718]
  - - [128, 448, 1, 256]
    - [148, 0.477]
  - - [3584, 3584, 1, 256]
    - [30, 32.158]
  - - [6784, 4288, 1, 1280]
    - [50, 66.649]
  - - [448, 704, 1, 1280]
    - [38, 10.622]
  - - [3584, 5056, 1, 256]
    - [149, 32.758]
  - - [6784, 128, 1, 256]
    - [150, 6.612]
  - - [64, 1408, 1, 3328]
    - [151, 6.354]
  - - [704, 448, 1, 256]
    - [152, 3.005]
  - - [2944, 2368, 1, 1280]
    - [97, 55.324]
  - - [448, 64, 1, 3328]
    - [153, 2.049]
  - - [6784, 3584, 1, 256]
    - [154, 28.837]
  - - [256, 1856, 1, 3328]
    - [155, 23.512]
  - - [256, 704, 1, 256]
    - [104, 1.523]
  - - [128, 1408, 1, 256]
    - [156, 1.648]
  - - [64, 128, 1, 3328]
    - [117, 0.705]
  - - [1856, 1408, 1, 256]
    - [30, 14.897]
  - - [2944, 2944, 1, 3328]
    - [157, 68.379]
  - - [5056, 6784, 1, 256]
    - [19, 36.228]
  - - [1408, 4288, 1, 3328]
    - [135, 59.128]
  - - [6784, 256, 1, 1280]
    - [158, 34.468]
  - - [1024, 704, 1, 3328]
    - [159, 29.489]
  - - [2368, 704, 1, 3328]
    - [160, 49.646]
  - - [128, 4288, 1, 256]
    - [161, 4.39]
  - - [3584, 6784, 1, 256]
    - [63, 29.689]
  - - [128, 128, 1, 3328]
    - [162, 1.273]
  - - [5056, 1856, 1, 256]
    - [163, 28.12]
  - - [704, 4288, 1, 256]
    - [164, 14.625]
  - - [256, 448, 1, 3328]
    - [125, 7.811]
  - - [1408, 6784, 1, 1280]
    - [27, 56.724]
  - - [64, 2368, 1, 1280]
    - [77, 5.303]
  - - [64, 6784, 1, 3328]
    - [101, 23.423]
  - - [2944, 256, 1, 1280]
    - [165, 20.583]
  - - [5056, 2368, 1, 3328]
    - [27, 72.382]
  - - [2944, 4288, 1, 256]
    - [113, 29.35]
  - - [1408, 3584, 1, 1280]
    - [166, 49.127]
  - - [2368, 64, 1, 256]
    - [167, 1.403]
  - - [256, 256, 1, 256]
    - [28, 0.638]
  - - [704, 128, 1, 3328]
    - [52, 6.33]
  - - [1856, 704, 1, 256]
    - [141, 9.516]
  - - [2368, 6784, 1, 3328]
    - [168, 73.633]
  - - [5056, 704, 1, 1280]
    - [169, 50.53]
  - - [1856, 4288, 1, 3328]
    - [170, 64.079]
  - - [1408, 5888, 1, 256]
    - [30, 27.636]
  - - [704, 2944, 1, 1280]
    - [171, 36.886]
  - - [4288, 64, 1, 1280]
    - [172, 8.837]
  - - [704, 1856, 1, 256]
    - [55, 8.903]
  - - [3584, 704, 1, 1280]
    - [62, 40.142]
  - - [5888, 5056, 1, 256]
    - [173, 35.795]
  - - [3584, 448, 1, 3328]
    - [11, 47.629]
  - - [704, 2368, 1, 3328]
    - [66, 49.15]
  - - [2944, 448, 1, 256]
    - [174, 9.095]
  - - [448, 5056, 1, 3328]
    - [175, 54.843]
  - - [2368, 128, 1, 1280]
    - [48, 10.149]
  - - [4288, 448, 1, 256]
    - [176, 12.764]
  - - [64, 6784, 1, 256]
    - [31, 3.907]
  - - [64, 5056, 1, 1280]
    - [92, 9.915]
  - - [5888, 2368, 1, 256]
    - [3, 31.115]
  - - [704, 448, 1, 3328]
    - [17, 19.343]
  - - [6784, 704, 1, 3328]
    - [62, 60.674]
  - - [128, 64, 1, 1280]
    - [177, 0.297]
  - - [2368, 256, 1, 1280]
    - [54, 16.61]
  - - [1408, 2944, 1, 3328]
    - [178, 54.663]
  - - [64, 1024, 1, 256]
    - [46, 0.654]
  - - [2368, 448, 1, 1280]
    - [55, 21.509]
  - - [128, 3584, 1, 256]
    - [58, 4.124]
  - - [1856, 448, 1, 3328]
    - [33, 34.778]
  - - [128, 5056, 1, 256]
    - [29, 5.441]
  - - [4288, 4288, 1, 256]
    - [179, 33.261]
  - - [2368, 704, 1, 256]
    - [180, 10.071]
  - - [3584, 2368, 1, 256]
    - [30, 27.558]
  - - [5888, 5056, 1, 1280]
    - [100, 68.53]
  - - [128, 1024, 1, 1280]
    - [181, 4.565]
  - - [64, 704, 1, 256]
    - [156, 0.373]
  - - [4288, 256, 1, 1280]
    - [13, 25.209]
  - - [3584, 3584, 1, 3328]
    - [182, 69.682]
  - - [128, 1024, 1, 256]
    - [183, 1.185]
  - - [5888, 6784, 1, 256]
    - [184, 38.403]
  - - [4288, 2944, 1, 3328]
    - [182, 69.734]
  - - [1856, 64, 1, 256]
    - [64, 1.182]
  - - [4288, 128, 1, 3328]
    - [5, 24.835]
  - - [256, 5056, 1, 1280]
    - [185, 26.646]
  - - [6784, 5888, 1, 1280]
    - [37, 68.953]
  - - [704, 128, 1, 256]
    - [104, 0.771]
  - - [5888, 4288, 1, 1280]
    - [186, 63.433]
  - - [448, 256, 1, 1280]
    - [187, 3.901]
  - - [448, 2368, 1, 3328]
    - [188, 36.793]
  - - [1, 1, 1, 1280]
    - [189, 0.0]
  - - [256, 1408, 1, 1280]
    - [190, 10.445]
  - - [1408, 1856, 1, 1280]
    - [131, 37.551]
  - - [5888, 448, 1, 3328]
    - [0, 54.488]
  - - [704, 5888, 1, 1280]
    - [69, 45.499]
  - - [256, 64, 1, 3328]
    - [162, 1.37]
  - - [128, 2368, 1, 256]
    - [76, 2.783]
  - - [6784, 64, 1, 3328]
    - [191, 22.91]
  - - [5056, 2944, 1, 3328]
    - [41, 77.502]
  - - [448, 128, 1, 256]
    - [28, 0.56]
  - - [1856, 128, 1, 1280]
    - [124, 7.505]
  - - [448, 4288, 1, 1280]
    - [69, 31.146]
  - - [64, 3584, 1, 256]
    - [192, 2.161]
  - - [128, 2944, 1, 3328]
    - [101, 21.838]
  - - [3584, 704, 1, 256]
    - [131, 14.132]
  - - [2944, 448, 1, 3328]
    - [193, 44.089]
  - - [3584, 1408, 1, 3328]
    - [194, 64.21]
  - - [2368, 1024, 1, 1280]
    - [195, 36.872]
  - - [2944, 6784, 1, 1280]
    - [149, 60.901]
  - - [1856, 6784, 1, 256]
    - [30, 31.843]
  - - [4288, 448, 1, 3328]
    - [78, 48.729]
  - - [6784, 704, 1, 1280]
    - [62, 45.775]
  - - [5888, 1024, 1, 3328]
    - [196, 61.409]
  - - [704, 6784, 1, 1280]
    - [166, 45.183]
  - - [5888, 128, 1, 256]
    - [71, 5.908]
  - - [5056, 1024, 1, 3328]
    - [62, 64.463]
  - - [704, 5056, 1, 1280]
    - [97, 48.767]
  - - [64, 704, 1, 3328]
    - [197, 3.025]
  - - [2944, 1856, 1, 256]
    - [30, 22.244]
  - - [5056, 64, 1, 256]
    - [198, 2.791]
  - - [5888, 5056, 1, 3328]
    - [15, 81.317]
  - - [128, 5056, 1, 3328]
    - [5, 28.287]
  - - [3584, 6784, 1, 1280]
    - [199, 60.968]
  - - [1856, 5888, 1, 256]
    - [3, 30.583]
  - - [64, 448, 1, 3328]
    - [197, 2.313]
  - - [4288, 4288, 1, 3328]
    - [37, 77.727]
  - - [4288, 1408, 1, 1280]
    - [145, 46.603]
  - - [64, 1856, 1, 256]
    - [91, 1.041]
  - - [4288, 2368, 1, 256]
    - [24, 28.369]
  - - [2944, 5056, 1, 1280]
    - [200, 59.719]
  - - [256, 4288, 1, 1280]
    - [131, 24.755]
  - - [6784, 2368, 1, 3328]
    - [168, 74.788]
  - - [256, 1024, 1, 1280]
    - [155, 7.966]
  - - [4288, 128, 1, 256]
    - [121, 3.873]
  - - [4288, 1856, 1, 3328]
    - [42, 63.031]
  - - [1856, 2944, 1, 1280]
    - [62, 51.152]
  - - [3584, 64, 1, 1280]
    - [167, 7.102]
  - - [4288, 6784, 1, 3328]
    - [24, 80.48]
  - - [3584, 1024, 1, 1280]
    - [201, 47.022]
  - - [1024, 4288, 1, 256]
    - [202, 18.948]
  - - [5888, 3584, 1, 3328]
    - [186, 74.975]
  - - [5056, 3584, 1, 3328]
    - [15, 78.12]
  - - [1408, 128, 1, 3328]
    - [203, 10.278]
  - - [2368, 1408, 1, 1280]
    - [204, 39.332]
  - - [5056, 2944, 1, 1280]
    - [10, 61.212]
  - - [3584, 256, 1, 256]
    - [205, 5.425]
  - - [1024, 6784, 1, 256]
    - [27, 22.855]
  - - [2944, 5056, 1, 3328]
    - [186, 76.963]
  - - [3584, 2944, 1, 256]
    - [30, 27.467]
  - - [448, 128, 1, 3328]
    - [206, 3.587]
  - - [64, 2944, 1, 3328]
    - [2, 12.159]
  - - [64, 4288, 1, 3328]
    - [207, 15.437]
  - - [5056, 6784, 1, 3328]
    - [24, 84.299]
  - - [128, 2944, 1, 256]
    - [61, 2.926]
  - - [3584, 4288, 1, 256]
    - [75, 34.677]
  - - [1856, 6784, 1, 3328]
    - [89, 73.417]
  - - [3584, 128, 1, 3328]
    - [17, 22.769]
  - - [128, 256, 1, 1280]
    - [43, 1.143]
  - - [64, 448, 1, 256]
    - [208, 0.291]
  - - [64, 256, 1, 1280]
    - [91, 0.597]
  - - [5056, 1408, 1, 1280]
    - [37, 57.993]
  - - [5888, 5888, 1, 256]
    - [35, 36.69]
  - - [4288, 1024, 1, 1280]
    - [209, 48.244]
  - - [5888, 128, 1, 3328]
    - [210, 31.771]
  - - [448, 6784, 1, 3328]
    - [211, 47.072]
  - - [2944, 1408, 1, 1280]
    - [86, 44.117]
  - - [64, 128, 1, 1280]
    - [43, 0.267]
  - - [2944, 1856, 1, 3328]
    - [212, 68.348]
  - - [448, 5056, 1, 256]
    - [9, 12.493]
  - - [64, 64, 1, 256]
    - [213, 0.039]
  - - [3584, 5888, 1, 1280]
    - [81, 61.731]
  - - [6784, 1856, 1, 1280]
    - [214, 55.574]
  - - [5888, 256, 1, 3328]
    - [215, 45.537]
  - - [1856, 5888, 1, 3328]
    - [37, 73.163]
  - - [3584, 1408, 1, 256]
    - [30, 19.888]
  - - [704, 3584, 1, 3328]
    - [7, 55.767]
  - - [5056, 448, 1, 1280]
    - [69, 41.828]
  - - [3584, 1856, 1, 3328]
    - [186, 65.078]
  - - [1408, 704, 1, 1280]
    - [216, 21.341]
  - - [2944, 1024, 1, 256]
    - [217, 13.158]
  - - [448, 1408, 1, 1280]
    - [218, 15.579]
  - - [2368, 4288, 1, 3328]
    - [103, 69.42]
  - - [1024, 1408, 1, 1280]
    - [185, 31.763]
  - - [256, 128, 1, 1280]
    - [219, 1.229]
  - - [704, 1408, 1, 1280]
    - [114, 22.526]
  - - [6784, 5056, 1, 256]
    - [109, 33.751]
  - - [4288, 5888, 1, 256]
    - [109, 30.646]
  - - [448, 2944, 1, 256]
    - [220, 9.211]
  - - [2944, 6784, 1, 256]
    - [221, 32.479]
  - - [2368, 2368, 1, 1280]
    - [173, 49.146]
  - - [1856, 3584, 1, 1280]
    - [1, 54.031]
  - - [64, 2944, 1, 256]
    - [222, 1.534]
  - - [3584, 1408, 1, 1280]
    - [223, 51.459]
  - - [5056, 3584, 1, 1280]
    - [224, 63.325]
  - - [256, 5888, 1, 256]
    - [57, 9.595]
  - - [128, 256, 1, 3328]
    - [162, 2.442]
  - - [1856, 1408, 1, 3328]
    - [116, 59.149]
  - - [1024, 4288, 1, 3328]
    - [182, 58.9]
  - - [448, 2368, 1, 256]
    - [225, 7.293]
  - - [64, 1408, 1, 1280]
    - [177, 2.854]
  - - [64, 6784, 1, 1280]
    - [190, 12.474]
  - - [2944, 2368, 1, 3328]
    - [1, 70.194]
  - - [704, 4288, 1, 3328]
    - [226, 46.584]
  - - [1024, 1856, 1, 1280]
    - [146, 32.341]
  - - [6784, 1856, 1, 256]
    - [113, 31.45]
  - - [128, 2368, 1, 3328]
    - [101, 16.717]
  - - [1024, 5888, 1, 256]
    - [59, 22.48]
  - - [64, 2944, 1, 1280]
    - [227, 5.901]
  - - [5056, 64, 1, 3328]
    - [17, 17.656]
  - - [1408, 2368, 1, 256]
    - [228, 14.925]
  - - [2944, 704, 1, 3328]
    - [171, 53.895]
  - - [256, 64, 1, 256]
    - [152, 0.167]
  - - [2944, 2944, 1, 1280]
    - [30, 52.743]
  - - [6784, 256, 1, 3328]
    - [160, 50.791]
  - - [1408, 5056, 1, 256]
    - [229, 26.378]
  - - [5056, 128, 1, 3328]
    - [159, 30.128]
  - - [128, 128, 1, 1280]
    - [43, 0.498]
  - - [448, 704, 1, 256]
    - [230, 2.111]
  - - [1856, 256, 1, 3328]
    - [172, 24.553]
  - - [2944, 128, 1, 3328]
    - [172, 21.601]
  - - [704, 256, 1, 256]
    - [91, 1.744]
  - - [256, 448, 1, 1280]
    - [231, 4.285]
  - - [704, 256, 1, 1280]
    - [232, 5.947]
  - - [64, 2368, 1, 3328]
    - [232, 9.611]
  - - [256, 704, 1, 3328]
    - [233, 11.588]
  - - [1024, 1024, 1, 256]
    - [30, 6.617]
  - - [1408, 4288, 1, 256]
    - [27, 23.178]
  - - [5888, 2368, 1, 1280]
    - [224, 57.001]
  - - [128, 256, 1, 256]
    - [213, 0.277]
  - - [256, 64, 1, 1280]
    - [28, 0.547]
  - - [2368, 5888, 1, 1280]
    - [24, 61.24]
  - - [5888, 256, 1, 1280]
    - [234, 27.64]
  - - [704, 1024, 1, 1280]
    - [159, 18.18]
  - - [2368, 1856, 1, 3328]
    - [25, 65.708]
  - - [2944, 704, 1, 256]
    - [131, 12.781]
  - - [2368, 6784, 1, 1280]
    - [229, 59.052]
  - - [2368, 1024, 1, 3328]
    - [195, 57.835]
  - - [1856, 4288, 1, 1280]
    - [235, 48.207]
  - - [704, 3584, 1, 256]
    - [30, 13.344]
  - - [704, 2944, 1, 3328]
    - [236, 50.967]
  - - [1856, 5056, 1, 3328]
    - [69, 68.234]
  - - [3584, 5056, 1, 1280]
    - [237, 62.794]
  - - [2944, 1024, 1, 3328]
    - [129, 47.641]
  - - [256, 4288, 1, 256]
    - [185, 8.003]
  - - [2368, 256, 1, 256]
    - [238, 5.085]
  - - [1408, 6784, 1, 256]
    - [27, 29.597]
  - - [6784, 1408, 1, 3328]
    - [239, 69.979]
  - - [1024, 2368, 1, 1280]
    - [171, 41.948]
  - - [704, 64, 1, 256]
    - [28, 0.43]
  - - [256, 2368, 1, 3328]
    - [33, 25.733]
  - - [6784, 2944, 1, 1280]
    - [50, 60.468]
  - - [3584, 448, 1, 1280]
    - [240, 34.166]
  - - [2944, 6784, 1, 3328]
    - [119, 74.711]
  - - [448, 5056, 1, 1280]
    - [175, 37.175]
  - - [4288, 5056, 1, 1280]
    - [24, 66.279]
  - - [128, 448, 1, 1280]
    - [53, 2.169]
  - - [4288, 704, 1, 256]
    - [241, 14.028]
  - - [64, 64, 1, 1280]
    - [242, 0.132]
  - - [5888, 704, 1, 256]
    - [45, 20.049]
  - - [256, 5888, 1, 3328]
    - [243, 45.506]
  - - [6784, 4288, 1, 256]
    - [3, 34.338]
  - - [5888, 256, 1, 256]
    - [225, 9.599]
  - - [6784, 1024, 1, 1280]
    - [24, 55.289]
  - - [704, 448, 1, 1280]
    - [31, 8.138]
  - - [128, 64, 1, 3328]
    - [117, 0.662]
  - - [448, 64, 1, 256]
    - [244, 0.227]
  - - [2944, 704, 1, 1280]
    - [239, 33.403]
  - - [6784, 3584, 1, 1280]
    - [100, 62.467]
  - - [2944, 64, 1, 1280]
    - [125, 6.483]
  - - [1408, 2944, 1, 1280]
    - [245, 45.659]
  - - [256, 1856, 1, 256]
    - [61, 3.108]
  - - [1408, 2368, 1, 3328]
    - [246, 51.895]
  - - [128, 1408, 1, 3328]
    - [2, 11.165]
  - - [2368, 2944, 1, 256]
    - [164, 25.232]
  - - [64, 5056, 1, 256]
    - [76, 2.927]
  - - [1408, 256, 1, 3328]
    - [48, 21.854]
  - - [3584, 1856, 1, 256]
    - [27, 23.518]
  - - [4288, 3584, 1, 1280]
    - [97, 62.807]
  - - [2368, 448, 1, 256]
    - [247, 6.226]
  - - [4288, 256, 1, 3328]
    - [188, 39.943]
  - - [1408, 64, 1, 256]
    - [213, 0.809]
  - - [4288, 2944, 1, 1280]
    - [94, 56.657]
  - - [5056, 448, 1, 3328]
    - [239, 55.889]
  - - [1024, 64, 1, 256]
    - [99, 0.554]
  - - [64, 2368, 1, 256]
    - [248, 1.414]
  - - [4288, 5056, 1, 3328]
    - [81, 76.599]
  - - [2944, 256, 1, 256]
    - [249, 6.068]
  - - [1024, 128, 1, 3328]
    - [232, 7.699]
  - - [256, 5056, 1, 3328]
    - [131, 43.734]
  - - [5056, 2368, 1, 256]
    - [229, 32.226]
  - - [4288, 704, 1, 3328]
    - [250, 49.405]
  - - [448, 3584, 1, 256]
    - [57, 11.094]
  - - [2368, 64, 1, 1280]
    - [183, 4.39]
  - - [1024, 1408, 1, 3328]
    - [193, 43.814]
  - - [2944, 5888, 1, 1280]
    - [97, 60.807]
  - - [5888, 3584, 1, 256]
    - [27, 33.611]
  - - [1408, 1856, 1, 3328]
    - [116, 58.197]
  - - [6784, 1408, 1, 1280]
    - [69, 56.401]
  - - [704, 2944, 1, 256]
    - [9, 11.651]
  - - [4288, 64, 1, 256]
    - [29, 2.36]
  - - [2944, 5888, 1, 3328]
    - [62, 75.627]
  - - [64, 4288, 1, 1280]
    - [48, 9.002]
  - - [6784, 64, 1, 1280]
    - [251, 12.23]
  - - [704, 1856, 1, 1280]
    - [131, 29.49]
  - - [1408, 64, 1, 3328]
    - [232, 6.155]
  - - [1408, 1408, 1, 1280]
    - [69, 34.286]
  - - [448, 1024, 1, 3328]
    - [38, 23.222]
  - - [448, 4288, 1, 3328]
    - [78, 49.243]
  - - [704, 2368, 1, 256]
    - [252, 8.791]
  - - [2944, 448, 1, 1280]
    - [55, 28.528]
  - - [5888, 2368, 1, 3328]
    - [253, 75.494]
  - - [4288, 5056, 1, 256]
    - [226, 34.585]
  - - [4288, 448, 1, 1280]
    - [239, 33.872]
  - - [5888, 704, 1, 3328]
    - [86, 61.544]
  - - [4288, 3584, 1, 3328]
    - [15, 82.98]
  - - [2944, 64, 1, 256]
    - [254, 1.799]
  - - [1024, 6784, 1, 3328]
    - [6, 67.577]
  - - [1408, 1024, 1, 256]
    - [96, 9.929]
  - - [448, 1024, 1, 256]
    - [104, 4.148]
  - - [6784, 6784, 1, 3328]
    - [41, 84.677]
  - - [1024, 448, 1, 1280]
    - [255, 13.286]
  - - [704, 5056, 1, 3328]
    - [256, 55.22]
  - - [256, 2368, 1, 1280]
    - [5, 16.919]
  - - [3584, 5056, 1, 3328]
    - [1, 76.311]
  - - [2368, 2944, 1, 3328]
    - [257, 68.224]
  - - [448, 448, 1, 1280]
    - [124, 6.757]
  - - [2368, 3584, 1, 256]
    - [45, 27.451]
  - - [1024, 256, 1, 1280]
    - [38, 8.562]
  - - [128, 5056, 1, 1280]
    - [159, 17.36]
  - - [3584, 2368, 1, 1280]
    - [135, 51.172]
  - - [1856, 1856, 1, 256]
    - [258, 17.452]
  - - [4288, 1408, 1, 3328]
    - [15, 60.968]
  - - [3584, 64, 1, 3328]
    - [172, 14.077]
  - - [1, 1, 1, 1]
    - [189, 0.0]
  - - [256, 1024, 1, 3328]
    - [155, 15.848]
  - - [1856, 64, 1, 3328]
    - [91, 8.508]
  - - [5888, 1408, 1, 3328]
    - [259, 70.781]
  - - [256, 5056, 1, 256]
    - [55, 8.399]
  - - [1856, 64, 1, 1280]
    - [260, 3.93]
  - - [1408, 256, 1, 256]
    - [61, 2.679]
  - - [2368, 5056, 1, 256]
    - [110, 30.367]
  - - [128, 5888, 1, 3328]
    - [159, 34.108]
  - - [1024, 5056, 1, 256]
    - [173, 22.135]
  - - [2368, 1408, 1, 3328]
    - [246, 52.433]
  - - [5888, 448, 1, 256]
    - [21, 14.686]
  - - [6784, 5056, 1, 1280]
    - [18, 71.061]
  - - [4288, 6784, 1, 1280]
    - [15, 66.559]
  - - [2368, 448, 1, 3328]
    - [0, 38.497]
  - - [1024, 128, 1, 256]
    - [261, 1.172]
  - - [448, 128, 1, 1280]
    - [43, 2.126]
  - - [1024, 64, 1, 3328]
    - [82, 4.559]
  - - [64, 3584, 1, 1280]
    - [262, 7.098]
  - - [6784, 1408, 1, 256]
    - [263, 28.352]
  - - [5888, 4288, 1, 256]
    - [264, 30.56]
  - - [5056, 5888, 1, 256]
    - [19, 36.124]
  - - [2368, 1024, 1, 256]
    - [94, 13.625]
  - - [1856, 6784, 1, 1280]
    - [110, 56.218]
  - - [3584, 128, 1, 1280]
    - [48, 14.414]
  - - [128, 64, 1, 256]
    - [265, 0.076]
  - - [1408, 448, 1, 256]
    - [266, 4.876]
  - - [64, 256, 1, 3328]
    - [267, 1.21]
  - - [6784, 448, 1, 3328]
    - [138, 48.376]
  - - [5056, 1856, 1, 1280]
    - [268, 56.316]
  - - [1408, 1024, 1, 3328]
    - [126, 43.965]
  - - [2368, 256, 1, 3328]
    - [54, 29.131]
  - - [5888, 3584, 1, 1280]
    - [81, 64.434]
  - - [5888, 128, 1, 1280]
    - [269, 16.962]
  - - [1024, 2944, 1, 256]
    - [270, 15.521]
  - - [448, 6784, 1, 1280]
    - [271, 38.517]
  - - [256, 3584, 1, 1280]
    - [228, 22.225]
  - - [704, 5056, 1, 256]
    - [37, 18.46]
  - - [3584, 1024, 1, 3328]
    - [272, 57.406]
  - - [2944, 1856, 1, 1280]
    - [90, 53.055]
  - - [5056, 256, 1, 256]
    - [273, 8.789]
  - - [128, 5888, 1, 256]
    - [274, 6.31]
  - - [2368, 3584, 1, 3328]
    - [42, 68.418]
  - - [3584, 5888, 1, 3328]
    - [81, 76.771]
  - - [2944, 3584, 1, 1280]
    - [24, 56.004]
  - - [1856, 5888, 1, 1280]
    - [243, 53.742]
  - - [256, 256, 1, 1280]
    - [187, 2.486]
  - - [4288, 1408, 1, 256]
    - [45, 22.711]
  - - [3584, 64, 1, 256]
    - [275, 2.165]
  - - [64, 1856, 1, 3328]
    - [276, 8.378]
  - - [1408, 128, 1, 256]
    - [277, 1.602]
  - - [4288, 2368, 1, 1280]
    - [109, 58.44]
  - - [2944, 5056, 1, 256]
    - [47, 33.119]
  - - [256, 128, 1, 3328]
    - [278, 2.447]
  - - [6784, 2368, 1, 256]
    - [3, 33.937]
  - - [1408, 448, 1, 3328]
    - [49, 28.323]
  - - [4288, 1856, 1, 256]
    - [8, 27.076]
  - - [1856, 2944, 1, 256]
    - [279, 22.171]
  - - [64, 5888, 1, 1280]
    - [92, 12.033]
  - - [1856, 1408, 1, 1280]
    - [119, 41.609]
  - - [128, 704, 1, 256]
    - [280, 0.767]
  - - [1024, 4288, 1, 1280]
    - [171, 47.168]
  - - [2368, 5056, 1, 3328]
    - [89, 71.08]
  - - [4288, 1024, 1, 3328]
    - [253, 60.404]
  - - [1024, 5056, 1, 3328]
    - [90, 63.51]
  - - [1024, 1856, 1, 3328]
    - [281, 50.885]
  - - [704, 704, 1, 1280]
    - [249, 14.083]
  - - [128, 2368, 1, 1280]
    - [172, 8.931]
  - - [3584, 256, 1, 1280]
    - [159, 23.261]
  - - [5888, 64, 1, 1280]
    - [31, 10.712]
  - - [128, 704, 1, 3328]
    - [231, 6.295]
  - - [3584, 2944, 1, 3328]
    - [282, 70.474]
  - - [128, 1856, 1, 256]
    - [283, 2.28]
  - - [64, 4288, 1, 256]
    - [61, 2.548]
  - - [5888, 2944, 1, 256]
    - [35, 30.541]
  - - [5056, 128, 1, 1280]
    - [96, 17.282]
  - - [448, 1856, 1, 3328]
    - [210, 33.466]
  - - [5056, 4288, 1, 256]
    - [284, 35.197]
  - - [1024, 448, 1, 256]
    - [207, 4.172]
  - - [1024, 3584, 1, 256]
    - [285, 18.358]
  - - [2944, 128, 1, 1280]
    - [92, 11.73]
  - - [64, 256, 1, 256]
    - [277, 0.153]
  - - [704, 256, 1, 3328]
    - [4, 10.375]
  - - [5056, 1408, 1, 256]
    - [186, 26.545]
  - - [5888, 5888, 1, 1280]
    - [81, 73.292]
  - - [448, 5888, 1, 1280]
    - [286, 36.135]
  - - [1, 1, 1, 256]
    - [189, 0.0]
  - - [4288, 704, 1, 1280]
    - [287, 39.563]
  - - [2944, 1408, 1, 256]
    - [202, 20.011]
  - - [256, 2944, 1, 1280]
    - [5, 17.588]
  - - [2368, 5888, 1, 3328]
    - [15, 75.047]
  - - [704, 1024, 1, 3328]
    - [142, 31.044]
  - - [2368, 1856, 1, 1280]
    - [25, 52.229]
  - - [1856, 448, 1, 1280]
    - [165, 21.667]
  - - [128, 6784, 1, 256]
    - [150, 6.669]
  - - [5888, 4288, 1, 3328]
    - [37, 78.999]
  - - [1856, 128, 1, 256]
    - [70, 1.928]
  - - [5056, 448, 1, 256]
    - [50, 12.662]
  - - [1856, 5056, 1, 1280]
    - [60, 56.046]
  - - [2944, 1024, 1, 1280]
    - [226, 38.483]
  - - [2368, 4288, 1, 256]
    - [47, 28.388]
  - - [1024, 2368, 1, 3328]
    - [178, 58.332]
  - - [4288, 64, 1, 3328]
    - [38, 15.579]
  - - [704, 1408, 1, 256]
    - [288, 6.985]
  - - [4288, 5888, 1, 3328]
    - [1, 79.134]
  - - [448, 2944, 1, 1280]
    - [108, 27.742]
  - - [1024, 2944, 1, 3328]
    - [289, 47.801]
  - - [256, 6784, 1, 1280]
    - [146, 34.927]
  - - [1856, 3584, 1, 256]
    - [27, 25.45]
  - - [128, 448, 1, 3328]
    - [231, 3.802]
  - - [1856, 256, 1, 256]
    - [101, 3.797]
  - - [5056, 128, 1, 256]
    - [290, 4.675]
  - - [256, 5888, 1, 1280]
    - [160, 28.774]
  - - [6784, 128, 1, 1280]
    - [49, 18.882]
  - - [64, 1408, 1, 256]
    - [208, 0.907]
  - - [2944, 2368, 1, 256]
    - [27, 26.524]
  - - [1856, 448, 1, 256]
    - [291, 6.574]
  - - [1024, 1856, 1, 256]
    - [57, 10.814]
  - - [6784, 3584, 1, 3328]
    - [37, 76.418]
  - - [2944, 64, 1, 3328]
    - [292, 10.222]
  - - [1024, 5888, 1, 3328]
    - [15, 56.525]
  - - [1408, 2368, 1, 1280]
    - [56, 43.25]
  - - [128, 1408, 1, 1280]
    - [48, 6.102]
  - - [128, 1856, 1, 3328]
    - [77, 14.348]
  - - [2944, 2944, 1, 256]
    - [202, 25.978]
  - - [6784, 256, 1, 256]
    - [293, 10.681]
  - - [128, 4288, 1, 1280]
    - [294, 15.689]
  - - [5888, 1408, 1, 256]
    - [30, 26.458]
  - - [128, 128, 1, 256]
    - [295, 0.154]
  - - [448, 704, 1, 3328]
    - [207, 17.703]
  - - [448, 1856, 1, 256]
    - [296, 6.349]
  - - [1856, 704, 1, 3328]
    - [108, 42.54]
  - - [5888, 6784, 1, 3328]
    - [166, 82.433]
  - - [704, 4288, 1, 1280]
    - [154, 37.86]
  - - [4096, 7000, 1, 4096]
    - [194, 82.811]
  - - [5124, 9124, 1, 1760]
    - [107, 75.526]
  - - [1760, 32, 1, 1760]
    - [297, 2.089]
  - - [1024, 1500, 1, 1536]
    - [243, 32.92]
  - - [512, 24000, 1, 2048]
    - [171, 62.512]
  - - [3072, 24000, 1, 1024]
    - [237, 71.836]
  - - [1024, 3000, 1, 2560]
    - [298, 52.446]
  - - [512, 3136, 1, 2048]
    - [281, 39.82]
  - - [7680, 4, 1, 2560]
    - [183, 1.412]
  - - [64, 193600, 1, 64]
    - [299, 9.642]
  - - [8448, 1500, 1, 2816]
    - [89, 69.031]
  - - [2560, 7000, 1, 2560]
    - [37, 75.182]
  - - [3072, 16, 1, 1024]
    - [300, 1.437]
  - - [512, 48000, 1, 2048]
    - [301, 72.165]
  - - [1760, 64, 1, 1760]
    - [302, 4.664]
  - - [1024, 16, 1, 512]
    - [213, 0.224]
  - - [196, 256, 64, 1024]
    - [303, 26.019]
  - - [512, 48000, 1, 1536]
    - [304, 68.542]
  - - [2560, 32, 1, 2560]
    - [248, 4.228]
  - - [4608, 1500, 1, 1536]
    - [305, 50.013]
  - - [2048, 128, 1, 2048]
    - [306, 10.001]
  - - [1024, 24000, 1, 2560]
    - [67, 77.063]
  - - [4608, 3000, 1, 1536]
    - [229, 62.108]
  - - [5124, 9124, 1, 2048]
    - [81, 74.941]
  - - [2048, 16, 1, 2048]
    - [91, 1.642]
  - - [1024, 700, 1, 512]
    - [33, 8.895]
  - - [3072, 1, 1, 128]
    - [307, 0.016]
  - - [5124, 700, 1, 2560]
    - [308, 43.405]
  - - [8448, 16, 1, 2816]
    - [309, 5.894]
  - - [6144, 6000, 1, 2560]
    - [97, 77.883]
  - - [4608, 32, 1, 1536]
    - [101, 5.505]
  - - [3072, 64, 1, 1024]
    - [77, 5.515]
  - - [512, 16, 1, 512]
    - [213, 0.143]
  - - [7680, 2, 1, 2560]
    - [295, 0.728]
  - - [4224, 1, 1, 128]
    - [213, 0.022]
  - - [7680, 1, 1, 2560]
    - [295, 0.337]
  - - [128, 1500, 1, 1280]
    - [77, 5.57]
  - - [1024, 1500, 1, 2816]
    - [146, 42.654]
  - - [6144, 2, 1, 2560]
    - [310, 0.535]
  - - [8448, 48000, 1, 2816]
    - [1, 88.0]
  - - [512, 6000, 1, 2048]
    - [250, 47.883]
  - - [4224, 1500, 1, 176]
    - [51, 16.712]
  - - [1024, 6000, 1, 2816]
    - [35, 58.96]
  - - [1024, 48000, 1, 1536]
    - [311, 74.477]
  - - [1024, 48000, 1, 2560]
    - [145, 80.253]
  - - [4096, 32, 1, 4096]
    - [48, 8.239]
  - - [512, 16, 1, 500000]
    - [312, 8.562]
  - - [2560, 128, 1, 2560]
    - [48, 16.599]
  - - [4608, 24000, 1, 1536]
    - [186, 79.457]
  - - [512, 2, 1, 500000]
    - [312, 1.097]
  - - [7680, 48000, 1, 2560]
    - [37, 87.462]
  - - [3072, 48000, 1, 1024]
    - [186, 75.18]
  - - [1760, 16, 1, 1760]
    - [302, 1.252]
  - - [1024, 1500, 1, 2048]
    - [40, 32.187]
  - - [1024, 16, 1, 500000]
    - [313, 11.033]
  - - [64, 193600, 1, 256]
    - [134, 20.808]
  - - [1024, 3000, 1, 2048]
    - [250, 47.456]
  - - [6144, 4, 1, 2560]
    - [248, 1.23]
  - - [1024, 6000, 1, 2048]
    - [143, 48.325]
  - - [512, 24000, 1, 2816]
    - [171, 69.018]
  - - [6144, 48000, 1, 2560]
    - [186, 86.565]
  - - [1760, 7000, 1, 1760]
    - [1, 62.324]
  - - [8448, 3000, 1, 2816]
    - [186, 76.378]
  - - [3072, 4, 1, 1024]
    - [28, 0.398]
  - - [4608, 48000, 1, 1536]
    - [103, 81.064]
  - - [2048, 32, 1, 2048]
    - [314, 2.635]
  - - [7680, 1500, 1, 2560]
    - [223, 74.422]
  - - [4096, 128, 1, 4096]
    - [210, 22.67]
  - - [4608, 16, 1, 1536]
    - [248, 2.54]
  - - [512, 3000, 1, 1536]
    - [120, 33.66]
  - - [3072, 2, 1, 1024]
    - [125, 0.202]
  - - [8448, 1, 1, 2816]
    - [315, 0.376]
  - - [1024, 3000, 1, 2816]
    - [316, 53.054]
  - - [128, 1, 1, 1408]
    - [317, 0.005]
  - - [64, 1, 1, 1216]
    - [148, 0.002]
  - - [1024, 2, 1, 512]
    - [177, 0.039]
  - - [1024, 4, 1, 500000]
    - [313, 2.832]
  - - [6144, 1, 1, 2560]
    - [85, 0.274]
  - - [5124, 9124, 1, 2560]
    - [107, 76.223]
  - - [512, 48000, 1, 2816]
    - [318, 77.577]
  - - [512, 3000, 1, 2816]
    - [146, 42.154]
  - - [1024, 24000, 1, 1536]
    - [182, 67.852]
  - - [7680, 6000, 1, 2560]
    - [24, 82.009]
  - - [1760, 128, 1, 1760]
    - [319, 8.402]
  - - [512, 1500, 1, 2816]
    - [33, 31.185]
  - - [512, 1, 1, 512]
    - [280, 0.008]
  - - [512, 6000, 1, 2560]
    - [41, 51.555]
  - - [512, 8, 1, 500000]
    - [320, 4.349]
  - - [512, 24000, 1, 2560]
    - [78, 67.169]
  - - [6144, 3000, 1, 2560]
    - [26, 72.51]
  - - [1024, 24000, 1, 2816]
    - [42, 77.181]
  - - [2048, 7000, 1, 2048]
    - [42, 68.428]
  - - [7680, 3000, 1, 2560]
    - [41, 77.765]
  - - [1024, 4, 1, 512]
    - [307, 0.065]
  - - [5124, 700, 1, 2048]
    - [321, 34.357]
  - - [5124, 9124, 1, 4096]
    - [107, 80.018]
  - - [4096, 64, 1, 4096]
    - [322, 14.242]
  - - [256, 193600, 1, 64]
    - [113, 13.202]
  - - [7680, 32, 1, 2560]
    - [227, 11.605]
  - - [2560, 64, 1, 2560]
    - [232, 8.803]
  - - [3072, 128, 1, 1024]
    - [191, 10.962]
  - - [8448, 6000, 1, 2816]
    - [323, 81.323]
  - - [7680, 64, 1, 2560]
    - [48, 18.824]
  - - [5124, 1500, 1, 2560]
    - [324, 53.961]
  - - [1024, 1500, 1, 2560]
    - [281, 36.693]
  - - [512, 4, 1, 512]
    - [325, 0.038]
  - - [1024, 6000, 1, 2560]
    - [24, 59.45]
  - - [3072, 32, 1, 1024]
    - [52, 2.853]
  - - [6144, 32, 1, 2560]
    - [17, 9.46]
  - - [196, 1024, 64, 256]
    - [326, 21.634]
  - - [512, 50176, 1, 128]
    - [30, 21.904]
  - - [4608, 1, 1, 1536]
    - [310, 0.186]
  - - [1024, 32, 1, 512]
    - [28, 0.642]
  - - [7680, 24000, 1, 2560]
    - [1, 86.88]
  - - [8448, 4, 1, 2816]
    - [309, 1.456]
  - - [512, 1, 1, 500000]
    - [327, 0.552]
  - - [176, 1500, 1, 1408]
    - [191, 9.301]
  - - [512, 3000, 1, 2560]
    - [281, 42.355]
  - - [8448, 24000, 1, 2816]
    - [37, 87.53]
  - - [4608, 2, 1, 1536]
    - [260, 0.325]
  - - [512, 6000, 1, 1536]
    - [10, 41.054]
  - - [7680, 128, 1, 2560]
    - [210, 32.947]
  - - [3072, 6000, 1, 1024]
    - [18, 59.656]
  - - [3072, 1500, 1, 128]
    - [263, 11.818]
  - - [2048, 3136, 1, 512]
    - [18, 35.68]
  - - [1024, 3000, 1, 1536]
    - [298, 43.063]
  - - [512, 4, 1, 500000]
    - [327, 2.016]
  - - [512, 6000, 1, 2816]
    - [97, 51.881]
  - - [128, 50176, 1, 512]
    - [224, 34.787]
  - - [256, 12544, 1, 1024]
    - [281, 37.563]
  - - [1024, 12544, 1, 256]
    - [47, 32.188]
  - - [512, 48000, 1, 2560]
    - [67, 77.133]
  - - [2560, 16, 1, 2560]
    - [52, 2.166]
  - - [2048, 64, 1, 2048]
    - [2, 5.903]
  - - [512, 2, 1, 512]
    - [307, 0.018]
  - - [1024, 1, 1, 512]
    - [64, 0.018]
  - - [512, 1500, 1, 2560]
    - [218, 27.593]
  - - [512, 24000, 1, 1536]
    - [184, 59.266]
  - - [1024, 1, 1, 500000]
    - [313, 0.712]
  - - [6144, 16, 1, 2560]
    - [310, 4.6]
  - - [1024, 24000, 1, 2048]
    - [328, 72.581]
  - - [4096, 16, 1, 4096]
    - [191, 4.008]
  - - [512, 32, 1, 512]
    - [219, 0.3]
  - - [5124, 1500, 1, 2048]
    - [329, 51.266]
  - - [3072, 1500, 1, 1024]
    - [182, 42.859]
  - - [1024, 2, 1, 500000]
    - [330, 1.439]
  - - [1024, 8, 1, 500000]
    - [331, 5.753]
  - - [7680, 16, 1, 2560]
    - [17, 5.612]
  - - [6144, 1500, 1, 2560]
    - [182, 65.768]
  - - [3072, 1, 1, 1024]
    - [206, 0.076]
  - - [1024, 48000, 1, 2816]
    - [67, 80.983]
  - - [8448, 2, 1, 2816]
    - [315, 0.71]
  - - [4608, 4, 1, 1536]
    - [85, 0.58]
  - - [1024, 6000, 1, 1536]
    - [263, 44.715]
  - - [8448, 32, 1, 2816]
    - [332, 10.458]
  - - [512, 3000, 1, 2048]
    - [281, 37.517]
  - - [6144, 24000, 1, 2560]
    - [1, 85.265]
  - - [4608, 6000, 1, 1536]
    - [90, 69.222]
  - - [1024, 1024, 1, 1024]
    - [0, 19.486]
  - - [512, 1500, 1, 2048]
    - [33, 24.924]
  - - [512, 1500, 1, 1536]
    - [218, 21.874]
  - - [128, 1, 1, 1024]
    - [43, 0.003]
  - - [3072, 3000, 1, 1024]
    - [32, 50.543]
  - - [1024, 48000, 1, 2048]
    - [145, 77.703]
  - - [3136, 64, 128, 64]
    - [299, 10.794]
  - - [784, 512, 64, 128]
    - [333, 21.894]
  - - [3136, 256, 64, 64]
    - [237, 13.309]
  - - [12544, 1024, 1, 256]
    - [229, 31.104]
  - - [784, 128, 128, 512]
    - [40, 32.446]
  - - [784, 512, 256, 128]
    - [334, 28.611]
  - - [3136, 64, 64, 256]
    - [205, 22.999]
  - - [3136, 512, 1, 2048]
    - [335, 37.31]
  - - [12544, 256, 1, 1024]
    - [336, 37.327]
  - - [3136, 2048, 1, 512]
    - [149, 36.475]
  - - [3136, 256, 256, 64]
    - [75, 17.431]
  - - [3136, 64, 128, 256]
    - [337, 22.58]
  - - [784, 128, 64, 512]
    - [268, 31.935]
  - - [3136, 64, 256, 64]
    - [202, 12.378]
  - - [784, 512, 128, 128]
    - [100, 25.047]
  - - [3136, 64, 64, 64]
    - [338, 10.132]
  - - [784, 128, 256, 512]
    - [110, 38.456]
  - - [3136, 64, 256, 256]
    - [339, 26.356]
  - - [3136, 256, 128, 64]
    - [41, 16.141]
  - - [64, 14, 1, 14]
    - [340, 0.0]
  - - [64, 14, 1, 15]
    - [340, 0.0]
  - - [64, 15, 1, 15]
    - [341, 0.001]
  - - [64, 15, 1, 17]
    - [167, 0.001]
  - - [64, 17, 1, 17]
    - [213, 0.001]
  - - [64, 17, 1, 21]
    - [213, 0.001]
  - - [64, 21, 1, 21]
    - [213, 0.001]
  - - [64, 24, 1, 24]
    - [148, 0.001]
  - - [64, 24, 1, 34]
    - [342, 0.002]
  - - [64, 30, 1, 30]
    - [156, 0.002]
  - - [64, 31, 1, 30]
    - [43, 0.002]
  - - [64, 31, 1, 31]
    - [213, 0.002]
  - - [64, 32, 1, 32]
    - [79, 0.003]
  - - [64, 34, 1, 34]
    - [342, 0.003]
  - - [64, 35, 1, 32]
    - [343, 0.003]
  - - [64, 35, 1, 35]
    - [152, 0.003]
  - - [64, 128, 512, 128]
    - [344, 8.992]
  - - [64, 512, 1, 512]
    - [28, 0.548]
  - - [64, 512, 64, 512]
    - [5, 15.462]
  - - [128, 128, 512, 64]
    - [345, 7.891]
  - - [512, 512, 1, 64]
    - [227, 0.565]
  - - [512, 512, 64, 64]
    - [113, 12.212]
  - - [1024, 4, 1, 2]
    - [213, 0.0]
  - - [1024, 4, 1, 1024]
    - [302, 0.111]
  - - [1024, 32, 1, 2]
    - [219, 0.003]
  - - [1024, 32, 1, 1024]
    - [16, 0.8]
  - - [1024, 2048, 1, 2]
    - [346, 0.114]
  - - [1024, 2048, 1, 1024]
    - [347, 29.395]
  - - [1024, 2048, 1, 4096]
    - [171, 57.216]
  - - [1024, 2048, 1, 30528]
    - [178, 74.451]
  - - [1024, 4096, 1, 1024]
    - [348, 40.493]
  - - [1024, 4096, 1, 4096]
    - [182, 59.011]
  - - [1024, 4096, 1, 30528]
    - [349, 85.042]
  - - [4096, 2048, 1, 1024]
    - [350, 40.853]
  - - [4096, 4096, 1, 1024]
    - [199, 54.65]
  - - [32, 33, 1600, 33]
    - [29, 1.11]
  - - [32, 200, 1, 1]
    - [99, 0.0]
  - - [64, 3, 512, 3]
    - [338, 0.009]
  - - [64, 5, 512, 5]
    - [161, 0.026]
  - - [64, 5, 960, 5]
    - [254, 0.047]
  - - [64, 9, 512, 9]
    - [351, 0.089]
  - - [64, 512, 1, 1]
    - [302, 0.001]
  - - [67, 512, 1, 2048]
    - [352, 1.348]
  - - [74, 512, 1, 2048]
    - [222, 1.789]
  - - [74, 960, 1, 2048]
    - [222, 3.369]
  - - [100, 512, 1, 2048]
    - [353, 2.296]
  - - [128, 27, 32768, 27]
    - [345, 4.234]
  - - [256, 1024, 1, 1]
    - [354, 0.008]
  - - [256, 8976, 1, 1536]
    - [355, 40.321]
  - - [256, 8976, 1, 2048]
    - [355, 47.942]
  - - [256, 8976, 1, 2304]
    - [239, 52.423]
  - - [256, 8976, 1, 2560]
    - [78, 54.241]
  - - [256, 8976, 1, 2816]
    - [135, 56.158]
  - - [256, 8976, 1, 3072]
    - [355, 57.875]
  - - [256, 8976, 1, 4352]
    - [78, 63.901]
  - - [256, 8976, 1, 4864]
    - [356, 52.343]
  - - [256, 8976, 1, 5376]
    - [355, 57.681]
  - - [256, 8976, 1, 5632]
    - [357, 58.464]
  - - [256, 8976, 1, 5888]
    - [69, 62.016]
  - - [256, 8976, 1, 6144]
    - [178, 65.456]
  - - [256, 8976, 1, 6656]
    - [78, 69.391]
  - - [256, 8976, 1, 7168]
    - [358, 62.613]
  - - [256, 8976, 1, 7424]
    - [239, 64.944]
  - - [256, 8976, 1, 8192]
    - [282, 60.521]
  - - [256, 8976, 1, 8448]
    - [239, 72.977]
  - - [256, 8976, 1, 8960]
    - [359, 68.453]
  - - [256, 8976, 1, 9472]
    - [78, 70.995]
  - - [256, 8976, 1, 9728]
    - [359, 70.406]
  - - [256, 8976, 1, 9984]
    - [78, 71.63]
  - - [256, 8976, 1, 10240]
    - [78, 73.594]
  - - [256, 8976, 1, 10496]
    - [239, 74.809]
  - - [256, 8976, 1, 11008]
    - [135, 68.582]
  - - [256, 8976, 1, 11520]
    - [171, 71.59]
  - - [256, 8976, 1, 12288]
    - [239, 69.953]
  - - [256, 8976, 1, 14336]
    - [360, 73.286]
  - - [256, 8976, 1, 14848]
    - [171, 77.479]
  - - [256, 8976, 1, 15104]
    - [69, 74.813]
  - - [256, 8976, 1, 15872]
    - [78, 77.292]
  - - [256, 8976, 1, 17152]
    - [171, 77.543]
  - - [256, 8976, 1, 19712]
    - [361, 76.073]
  - - [256, 8976, 1, 19968]
    - [362, 76.626]
  - - [256, 8976, 1, 20480]
    - [78, 77.551]
  - - [256, 8976, 1, 20992]
    - [135, 78.717]
  - - [256, 8976, 1, 22016]
    - [358, 78.819]
  - - [256, 8976, 1, 26112]
    - [239, 81.309]
  - - [256, 8976, 1, 33536]
    - [363, 82.647]
  - - [256, 8976, 1, 44505]
    - [364, 83.056]
  - - [256, 32768, 1, 128]
    - [346, 15.837]
  - - [257, 1024, 1, 4096]
    - [38, 13.283]
  - - [480, 32768, 1, 1024]
    - [311, 54.733]
  - - [512, 200, 1, 1]
    - [365, 0.004]
  - - [512, 200, 1, 32]
    - [161, 0.129]
  - - [512, 215, 1, 2048]
    - [112, 5.309]
  - - [512, 256, 1, 2048]
    - [306, 5.386]
  - - [512, 1600, 1, 32]
    - [266, 0.973]
  - - [512, 1600, 1, 512]
    - [306, 9.27]
  - - [512, 32768, 1, 256]
    - [27, 33.618]
  - - [560, 200, 1, 1024]
    - [17, 2.591]
  - - [560, 1600, 1, 1024]
    - [33, 19.126]
  - - [768, 215, 1, 2048]
    - [181, 8.073]
  - - [768, 256, 1, 2048]
    - [77, 9.241]
  - - [1024, 200, 1, 1]
    - [366, 0.008]
  - - [1024, 512, 1, 1]
    - [367, 0.02]
  - - [1024, 512, 1, 64]
    - [368, 1.281]
  - - [1024, 512, 1, 1024]
    - [369, 12.158]
  - - [1024, 960, 1, 64]
    - [368, 2.268]
  - - [1024, 960, 1, 1024]
    - [370, 20.616]
  - - [1024, 1600, 1, 1]
    - [176, 0.054]
  - - [1024, 1600, 1, 1024]
    - [335, 29.012]
  - - [1024, 1792, 1, 256]
    - [160, 12.658]
  - - [1024, 2048, 1, 256]
    - [9, 12.364]
  - - [1024, 2560, 1, 256]
    - [371, 15.362]
  - - [1024, 3072, 1, 256]
    - [372, 16.641]
  - - [1024, 3328, 1, 256]
    - [15, 16.679]
  - - [1024, 3840, 1, 256]
    - [373, 18.567]
  - - [1024, 4096, 1, 256]
    - [30, 18.962]
  - - [1024, 4608, 1, 256]
    - [30, 17.619]
  - - [1024, 4864, 1, 256]
    - [372, 21.23]
  - - [1024, 5120, 1, 256]
    - [30, 19.865]
  - - [1024, 5632, 1, 256]
    - [163, 23.27]
  - - [1024, 6144, 1, 256]
    - [27, 24.284]
  - - [1024, 6400, 1, 256]
    - [59, 22.454]
  - - [1024, 7168, 1, 256]
    - [374, 24.251]
  - - [1024, 7424, 1, 256]
    - [26, 26.632]
  - - [1024, 7680, 1, 256]
    - [375, 28.242]
  - - [1024, 7936, 1, 256]
    - [202, 25.489]
  - - [1024, 8192, 1, 256]
    - [376, 26.426]
  - - [1024, 8448, 1, 256]
    - [229, 25.327]
  - - [1024, 8704, 1, 256]
    - [27, 25.696]
  - - [1024, 8960, 1, 256]
    - [229, 27.977]
  - - [1024, 9728, 1, 256]
    - [97, 27.849]
  - - [1024, 9984, 1, 256]
    - [97, 28.72]
  - - [1024, 10240, 1, 256]
    - [47, 29.47]
  - - [1024, 10496, 1, 256]
    - [97, 29.727]
  - - [1024, 11008, 1, 256]
    - [30, 28.41]
  - - [1024, 11264, 1, 256]
    - [41, 31.815]
  - - [1024, 11520, 1, 256]
    - [41, 31.723]
  - - [1024, 12288, 1, 256]
    - [47, 29.643]
  - - [1024, 13312, 1, 256]
    - [27, 29.382]
  - - [1024, 13568, 1, 256]
    - [229, 31.601]
  - - [1024, 14336, 1, 256]
    - [41, 32.413]
  - - [1024, 14592, 1, 256]
    - [97, 33.756]
  - - [1024, 14848, 1, 256]
    - [41, 32.907]
  - - [1024, 15104, 1, 256]
    - [285, 31.18]
  - - [1024, 16128, 1, 256]
    - [229, 33.888]
  - - [1024, 17152, 1, 256]
    - [59, 33.565]
  - - [1024, 18944, 1, 256]
    - [285, 31.21]
  - - [1024, 19712, 1, 256]
    - [229, 30.922]
  - - [1024, 19968, 1, 256]
    - [27, 31.677]
  - - [1024, 20480, 1, 256]
    - [229, 32.124]
  - - [1024, 20992, 1, 256]
    - [229, 33.232]
  - - [1024, 21504, 1, 256]
    - [131, 26.521]
  - - [1024, 22016, 1, 256]
    - [75, 27.091]
  - - [1024, 23552, 1, 256]
    - [30, 29.04]
  - - [1024, 28672, 1, 256]
    - [27, 35.145]
  - - [1024, 32768, 1, 512]
    - [377, 47.694]
  - - [1024, 32768, 1, 1024]
    - [41, 63.743]
  - - [1024, 33536, 1, 256]
    - [45, 33.315]
  - - [1024, 40448, 1, 256]
    - [41, 35.663]
  - - [1600, 512, 1, 1024]
    - [33, 15.284]
  - - [2048, 512, 1, 1]
    - [176, 0.035]
  - - [2048, 512, 1, 2048]
    - [141, 28.433]
  - - [2048, 960, 1, 2048]
    - [78, 39.767]
  - - [2048, 1024, 1, 1]
    - [205, 0.056]
  - - [2048, 1024, 1, 256]
    - [60, 11.964]
  - - [3200, 1024, 1, 2048]
    - [316, 49.415]
  - - [4096, 1024, 1, 1]
    - [27, 0.097]
  - - [64, 14, 10880, 14]
    - [299, 1.177]
  - - [64, 14, 10880, 15]
    - [299, 1.159]
  - - [64, 15, 7680, 15]
    - [378, 1.058]
  - - [64, 15, 10880, 15]
    - [338, 1.113]
  - - [64, 15, 7680, 17]
    - [299, 1.244]
  - - [64, 17, 6144, 17]
    - [378, 1.123]
  - - [64, 17, 7680, 17]
    - [378, 1.46]
  - - [64, 17, 6144, 21]
    - [378, 1.354]
  - - [64, 21, 6144, 21]
    - [299, 1.898]
  - - [64, 24, 4736, 24]
    - [345, 2.295]
  - - [64, 24, 4736, 34]
    - [299, 2.972]
  - - [64, 30, 2048, 30]
    - [338, 2.25]
  - - [64, 31, 2048, 30]
    - [338, 2.222]
  - - [64, 31, 2048, 31]
    - [299, 2.348]
  - - [64, 32, 4608, 32]
    - [299, 4.079]
  - - [64, 34, 4736, 34]
    - [299, 2.855]
  - - [64, 35, 4608, 32]
    - [299, 4.194]
  - - [64, 35, 4608, 35]
    - [378, 2.82]
  - - [1024, 3840, 1, 1024]
    - [6, 47.774]
  - - [1024, 3840, 1, 4096]
    - [379, 75.043]
  - - [1024, 3968, 1, 1024]
    - [157, 36.691]
  - - [1024, 3968, 1, 4096]
    - [157, 56.195]
  - - [1024, 3968, 1, 42720]
    - [380, 83.798]
  - - [1024, 6528, 1, 1024]
    - [37, 49.147]
  - - [1024, 6528, 1, 4096]
    - [381, 67.287]
  - - [1024, 6528, 1, 42720]
    - [382, 85.836]
  - - [1024, 7104, 1, 1024]
    - [229, 52.675]
  - - [1024, 7104, 1, 4096]
    - [97, 71.468]
  - - [1024, 7104, 1, 42720]
    - [383, 89.972]
  - - [1024, 7200, 1, 1024]
    - [15, 52.672]
  - - [1024, 7200, 1, 4096]
    - [35, 73.673]
  - - [1024, 7200, 1, 42720]
    - [384, 91.996]
  - - [1024, 8064, 1, 1024]
    - [385, 51.316]
  - - [1024, 8064, 1, 4096]
    - [386, 72.376]
  - - [1024, 8160, 1, 1024]
    - [62, 52.344]
  - - [1024, 8160, 1, 4096]
    - [62, 70.686]
  - - [1024, 9216, 1, 1024]
    - [387, 44.978]
  - - [1024, 9216, 1, 4096]
    - [182, 73.995]
  - - [1024, 9520, 1, 1024]
    - [358, 48.088]
  - - [1024, 9520, 1, 4096]
    - [157, 77.682]
  - - [1024, 9520, 1, 42720]
    - [157, 94.282]
  - - [1024, 10064, 1, 1024]
    - [377, 49.354]
  - - [1024, 10064, 1, 4096]
    - [130, 69.175]
  - - [1024, 10080, 1, 1024]
    - [388, 49.316]
  - - [1024, 10080, 1, 4096]
    - [389, 72.101]
  - - [1024, 10080, 1, 42720]
    - [390, 88.054]
  - - [1024, 10200, 1, 1024]
    - [10, 50.14]
  - - [1024, 10200, 1, 4096]
    - [97, 73.593]
  - - [4096, 3840, 1, 1024]
    - [19, 60.081]
  - - [4096, 3968, 1, 1024]
    - [391, 53.834]
  - - [4096, 6528, 1, 1024]
    - [224, 59.194]
  - - [4096, 7104, 1, 1024]
    - [194, 63.344]
  - - [4096, 7200, 1, 1024]
    - [1, 62.194]
  - - [4096, 8064, 1, 1024]
    - [19, 60.718]
  - - [4096, 8160, 1, 1024]
    - [19, 62.313]
  - - [4096, 9216, 1, 1024]
    - [145, 64.641]
  - - [4096, 9520, 1, 1024]
    - [392, 62.028]
  - - [4096, 10064, 1, 1024]
    - [1, 65.14]
  - - [4096, 10080, 1, 1024]
    - [224, 64.68]
  - - [4096, 10200, 1, 1024]
    - [224, 65.485]
  - - [64, 27, 1920, 27]
    - [345, 1.725]
  - - [64, 33, 1920, 27]
    - [299, 1.49]
  - - [64, 33, 1920, 33]
    - [344, 2.083]
  - - [1024, 3240, 1, 1024]
    - [41, 37.159]
  - - [1024, 3240, 1, 4096]
    - [250, 61.179]
  - - [1024, 3960, 1, 1024]
    - [22, 39.003]
  - - [1024, 3960, 1, 4096]
    - [245, 56.159]
  - - [1024, 3960, 1, 42720]
    - [393, 83.712]
  - - [4096, 3240, 1, 1024]
    - [19, 52.026]
  - - [4096, 3960, 1, 1024]
    - [226, 52.949]
  - - [64, 192, 64, 1280]
    - [207, 16.723]
  - - [64, 320, 64, 1280]
    - [98, 20.537]
  - - [64, 384, 64, 1280]
    - [369, 21.066]
  - - [64, 448, 64, 1280]
    - [150, 23.058]
  - - [64, 192, 64, 2048]
    - [191, 17.273]
  - - [64, 320, 64, 2048]
    - [17, 24.029]
  - - [64, 384, 64, 2048]
    - [33, 24.506]
  - - [64, 448, 64, 2048]
    - [155, 26.384]
  - - [1225, 32, 64, 192]
    - [368, 8.353]
  - - [1225, 48, 64, 192]
    - [394, 8.266]
  - - [1225, 64, 64, 192]
    - [395, 12.285]
  - - [1225, 48, 64, 256]
    - [394, 10.461]
  - - [1225, 64, 64, 256]
    - [394, 14.964]
  - - [1225, 48, 64, 288]
    - [396, 11.565]
  - - [1225, 64, 64, 288]
    - [174, 16.991]
  - - [5329, 80, 64, 64]
    - [397, 8.096]
  - - [289, 128, 64, 768]
    - [398, 19.53]
  - - [289, 160, 64, 768]
    - [394, 19.458]
  - - [289, 192, 64, 768]
    - [386, 24.113]
  - - [64, 192, 32, 1280]
    - [68, 12.001]
  - - [64, 320, 32, 1280]
    - [294, 15.847]
  - - [64, 384, 32, 1280]
    - [218, 16.495]
  - - [64, 448, 32, 1280]
    - [92, 19.307]
  - - [64, 192, 32, 2048]
    - [98, 14.097]
  - - [64, 320, 32, 2048]
    - [369, 19.075]
  - - [64, 384, 32, 2048]
    - [180, 20.719]
  - - [64, 448, 32, 2048]
    - [92, 23.019]
  - - [1225, 32, 32, 192]
    - [368, 6.028]
  - - [1225, 48, 32, 192]
    - [395, 7.013]
  - - [1225, 64, 32, 192]
    - [399, 9.744]
  - - [1225, 48, 32, 256]
    - [174, 7.198]
  - - [1225, 64, 32, 256]
    - [20, 9.592]
  - - [1225, 48, 32, 288]
    - [394, 8.053]
  - - [1225, 64, 32, 288]
    - [395, 13.088]
  - - [5329, 80, 32, 64]
    - [400, 7.537]
  - - [289, 128, 32, 768]
    - [255, 14.559]
  - - [289, 160, 32, 768]
    - [251, 15.871]
  - - [289, 192, 32, 768]
    - [401, 19.857]
  - - [49, 2048, 64, 512]
    - [402, 15.627]
  - - [49, 512, 64, 2048]
    - [174, 15.739]
  - - [3136, 256, 32, 64]
    - [30, 12.366]
  - - [3136, 64, 32, 64]
    - [378, 9.965]
  - - [3136, 64, 32, 256]
    - [205, 19.672]
  - - [784, 512, 32, 128]
    - [264, 18.376]
  - - [784, 128, 32, 512]
    - [110, 24.651]
  - - [196, 1024, 32, 256]
    - [401, 16.469]
  - - [196, 256, 32, 1024]
    - [401, 23.173]
  - - [49, 2048, 32, 512]
    - [404, 14.976]
  - - [49, 512, 32, 2048]
    - [405, 15.492]
  - - [3136, 128, 64, 64]
    - [163, 11.375]
  - - [3136, 256, 64, 128]
    - [109, 24.469]
  - - [784, 512, 64, 256]
    - [30, 30.314]
  - - [3136, 128, 64, 256]
    - [406, 31.274]
  - - [3136, 256, 64, 256]
    - [186, 38.567]
  - - [196, 1024, 64, 512]
    - [406, 31.225]
  - - [784, 256, 64, 512]
    - [26, 42.101]
  - - [784, 512, 64, 512]
    - [377, 41.68]
  - - [196, 512, 64, 1024]
    - [407, 31.177]
  - - [196, 1024, 64, 1024]
    - [408, 37.255]
  - - [49, 2048, 64, 1024]
    - [409, 20.775]
  - - [49, 1024, 64, 2048]
    - [269, 22.311]
  - - [3136, 128, 32, 64]
    - [163, 9.568]
  - - [3136, 256, 32, 128]
    - [41, 21.322]
  - - [784, 512, 32, 256]
    - [100, 30.276]
  - - [3136, 128, 32, 256]
    - [113, 28.265]
  - - [3136, 256, 32, 256]
    - [30, 30.916]
  - - [196, 1024, 32, 512]
    - [118, 26.071]
  - - [784, 256, 32, 512]
    - [224, 30.397]
  - - [784, 512, 32, 512]
    - [41, 42.551]
  - - [196, 512, 32, 1024]
    - [303, 26.725]
  - - [196, 1024, 32, 1024]
    - [410, 31.015]
  - - [49, 2048, 32, 1024]
    - [410, 15.573]
  - - [49, 1024, 32, 2048]
    - [411, 14.765]
  - - [7680, 8192, 1, 8192]
    - [81, 93.286]
  - - [3840, 4096, 1, 4096]
    - [115, 85.047]
  - - [1920, 2048, 1, 2048]
    - [37, 59.798]
  - - [960, 1024, 1, 1024]
    - [217, 21.95]
  - - [480, 512, 1, 512]
    - [112, 3.783]
  - - [8192, 7680, 1, 8192]
    - [81, 92.637]
  - - [4096, 3840, 1, 4096]
    - [381, 84.483]
  - - [2048, 1920, 1, 2048]
    - [412, 57.086]
  - - [512, 480, 1, 512]
    - [64, 3.627]
  - - [8192, 8192, 1, 8192]
    - [42, 88.496]
  - - [4096, 4096, 1, 4096]
    - [392, 79.61]
  - - [2048, 2048, 1, 2048]
    - [328, 52.645]
  - - [512, 512, 1, 512]
    - [244, 4.135]
  - - [64, 512, 16, 512]
    - [61, 6.791]
  - - [64, 512, 128, 512]
    - [291, 21.022]
  - - [1024, 8, 1, 1024]
    - [280, 0.21]
  - - [1024, 77, 1, 1024]
    - [314, 2.597]
  - - [1024, 77, 1, 30522]
    - [313, 22.485]
  - - [1024, 512, 1, 2]
    - [299, 0.038]
  - - [1024, 512, 1, 4096]
    - [413, 22.736]
  - - [1024, 616, 1, 1024]
    - [111, 13.728]
  - - [1024, 4096, 1, 2]
    - [30, 0.198]
  - - [4096, 512, 1, 1024]
    - [62, 25.917]
  - - [64, 128, 128, 128]
    - [414, 4.12]
  - - [64, 128, 160, 128]
    - [266, 4.178]
  - - [1024, 10, 1, 2]
    - [310, 0.001]
  - - [1024, 10, 1, 1024]
    - [112, 0.296]
  - - [1024, 160, 1, 1024]
    - [4, 4.855]
  - - [1024, 200, 1, 1024]
    - [415, 5.481]
  - - [1024, 200, 1, 30522]
    - [416, 39.463]
  - - [1024, 1024, 1, 2]
    - [367, 0.064]
  - - [1024, 1024, 1, 4096]
    - [0, 38.33]
  - - [1024, 1280, 1, 2]
    - [30, 0.069]
  - - [1024, 1280, 1, 1024]
    - [185, 23.752]
  - - [1024, 1280, 1, 4096]
    - [417, 45.878]
  - - [4096, 1024, 1, 1024]
    - [214, 38.535]
  - - [4096, 1280, 1, 1024]
    - [166, 44.559]
  - - [64, 128, 624, 128]
    - [220, 9.542]
  - - [1024, 39, 1, 2]
    - [28, 0.003]
  - - [1024, 39, 1, 1024]
    - [302, 1.264]
  - - [1024, 780, 1, 1024]
    - [252, 14.307]
  - - [1024, 780, 1, 30522]
    - [382, 57.429]
  - - [1024, 4992, 1, 2]
    - [345, 0.213]
  - - [1024, 4992, 1, 1024]
    - [392, 45.865]
  - - [1024, 4992, 1, 4096]
    - [418, 66.011]
  - - [4096, 4992, 1, 1024]
    - [24, 57.678]
  - - [1024, 308, 1, 1024]
    - [48, 7.623]
  - - [1024, 308, 1, 30522]
    - [419, 44.273]
  - - [64, 128, 640, 128]
    - [420, 9.541]
  - - [1024, 40, 1, 2]
    - [28, 0.003]
  - - [1024, 40, 1, 1024]
    - [16, 1.227]
  - - [1024, 800, 1, 1024]
    - [218, 17.819]
  - - [1024, 800, 1, 30522]
    - [421, 59.444]
  - - [1024, 5120, 1, 2]
    - [268, 0.221]
  - - [1024, 5120, 1, 1024]
    - [422, 44.566]
  - - [1024, 5120, 1, 4096]
    - [223, 68.908]
  - - [4096, 5120, 1, 1024]
    - [24, 58.765]
  - - [64, 128, 656, 128]
    - [423, 10.034]
  - - [1024, 41, 1, 2]
    - [343, 0.002]
  - - [1024, 41, 1, 1024]
    - [46, 0.981]
  - - [1024, 820, 1, 1024]
    - [165, 18.528]
  - - [1024, 820, 1, 30522]
    - [382, 60.276]
  - - [1024, 5248, 1, 2]
    - [372, 0.231]
  - - [1024, 5248, 1, 1024]
    - [62, 45.774]
  - - [1024, 5248, 1, 4096]
    - [212, 70.41]
  - - [4096, 5248, 1, 1024]
    - [237, 59.544]
  - - [64, 512, 80, 512]
    - [424, 17.132]
  - - [1024, 5, 1, 2]
    - [156, 0.0]
  - - [1024, 5, 1, 1024]
    - [317, 0.138]
  - - [1024, 385, 1, 1024]
    - [48, 8.758]
  - - [1024, 385, 1, 30522]
    - [425, 44.409]
  - - [1024, 2560, 1, 2]
    - [426, 0.121]
  - - [1024, 2560, 1, 1024]
    - [427, 33.63]
  - - [1024, 2560, 1, 4096]
    - [417, 49.906]
  - - [4096, 2560, 1, 1024]
    - [45, 49.739]
  - - [64, 512, 96, 512]
    - [241, 17.952]
  - - [1024, 6, 1, 2]
    - [428, 0.0]
  - - [1024, 6, 1, 1024]
    - [112, 0.17]
  - - [1024, 462, 1, 1024]
    - [191, 9.983]
  - - [1024, 462, 1, 30522]
    - [429, 52.815]
  - - [1024, 3072, 1, 2]
    - [140, 0.144]
  - - [1024, 3072, 1, 1024]
    - [15, 37.131]
  - - [1024, 3072, 1, 4096]
    - [6, 55.224]
  - - [4096, 3072, 1, 1024]
    - [26, 50.215]
  - - [1024, 8, 1, 2]
    - [307, 0.001]
  - - [1024, 160, 1, 30522]
    - [430, 31.935]
  - - [64, 128, 144, 128]
    - [423, 4.355]
  - - [1024, 9, 1, 2]
    - [431, 0.001]
  - - [1024, 9, 1, 1024]
    - [177, 0.272]
  - - [1024, 180, 1, 1024]
    - [4, 4.535]
  - - [1024, 180, 1, 30522]
    - [432, 37.866]
  - - [1024, 1152, 1, 2]
    - [433, 0.077]
  - - [1024, 1152, 1, 1024]
    - [0, 22.927]
  - - [1024, 1152, 1, 4096]
    - [188, 42.681]
  - - [4096, 1152, 1, 1024]
    - [434, 40.127]
  - - [479, 32768, 1, 1024]
    - [386, 44.278]
  - - [64, 4, 32768, 4]
    - [299, 0.116]
  - - [64, 4, 38400, 4]
    - [345, 0.126]
  - - [1024, 8192, 1, 1024]
    - [62, 50.977]
  - - [1024, 8192, 1, 4096]
    - [62, 68.784]
  - - [1024, 8192, 1, 33712]
    - [382, 82.688]
  - - [1024, 9600, 1, 1024]
    - [333, 45.018]
  - - [1024, 9600, 1, 4096]
    - [304, 78.043]
  - - [1024, 9600, 1, 33712]
    - [157, 94.231]
  - - [4096, 8192, 1, 1024]
    - [24, 65.024]
  - - [4096, 9600, 1, 1024]
    - [26, 61.795]
  - - [128, 128, 1, 64]
    - [589, 0.093]
  - - [64, 128, 1, 128]
    - [589, 0.086]
  - - [64, 5, 1, 5]
    - [29, 0.0]
  - - [32, 33, 1, 33]
    - [435, 0.001]
  - - [1024, 1024, 64, 64]
    - [113, 14.813]
  - - [64, 1024, 32, 1024]
    - [436, 23.07]
  - - [1024, 16384, 1, 3072]
    - [392, 78.119]
  - - [1024, 2048, 1, 30592]
    - [362, 70.442]
  - - [640, 2048, 1, 2560]
    - [437, 41.348]
  - - [1024, 1024, 64, 96]
    - [26, 21.125]
  - - [2048, 2, 1, 2048]
    - [438, 0.185]
  - - [2048, 2, 1, 2]
    - [266, 0.0]
  - - [1536, 4096, 1, 4608]
    - [78, 65.137]
  - - [512, 512, 256, 64]
    - [59, 13.554]
  - - [2048, 1024, 1, 8192]
    - [171, 64.11]
  - - [4096, 16384, 1, 1024]
    - [37, 67.839]
  - - [1024, 8192, 1, 50304]
    - [425, 84.35]
  - - [1536, 8192, 1, 50304]
    - [439, 89.148]
  - - [6144, 8192, 1, 1536]
    - [107, 76.299]
  - - [1024, 4096, 1, 30592]
    - [157, 78.202]
  - - [1536, 4096, 1, 6144]
    - [24, 69.707]
  - - [1024, 16384, 1, 4096]
    - [418, 79.431]
  - - [1024, 16384, 1, 50304]
    - [389, 90.932]
  - - [1024, 4096, 1, 3072]
    - [157, 58.45]
  - - [1536, 8192, 1, 1536]
    - [439, 59.945]
  - - [1024, 2048, 1, 3072]
    - [171, 49.874]
  - - [2560, 2048, 1, 7680]
    - [90, 73.948]
  - - [96, 1024, 64, 1024]
    - [57, 30.159]
  - - [2048, 1024, 1, 2048]
    - [171, 44.651]
  - - [2048, 1024, 1, 30592]
    - [383, 73.552]
  - - [64, 1024, 256, 1024]
    - [440, 33.836]
  - - [8192, 1024, 1, 2048]
    - [25, 56.384]
  - - [2560, 2048, 1, 2560]
    - [194, 60.941]
  - - [1536, 8192, 1, 4608]
    - [89, 75.948]
  - - [64, 512, 256, 512]
    - [218, 20.654]
  - - [1024, 2048, 1, 50304]
    - [429, 77.65]
  - - [1024, 1024, 32, 64]
    - [75, 13.135]
  - - [1536, 8192, 1, 6144]
    - [439, 79.684]
  - - [1024, 1024, 256, 64]
    - [75, 17.505]
  - - [512, 512, 40, 64]
    - [30, 9.08]
  - - [1536, 4096, 1, 50304]
    - [441, 85.925]
  - - [1024, 1024, 128, 96]
    - [145, 23.15]
  - - [1024, 8192, 1, 3072]
    - [62, 69.605]
  - - [64, 1024, 64, 1024]
    - [369, 26.465]
  - - [1024, 1024, 128, 64]
    - [59, 16.548]
  - - [64, 1024, 128, 1024]
    - [191, 26.761]
  - - [1024, 4096, 1, 50304]
    - [301, 79.2]
  - - [96, 1024, 128, 1024]
    - [126, 40.178]
  - - [6144, 4096, 1, 1536]
    - [26, 68.374]
  - - [1024, 16, 1, 2]
    - [442, 0.001]
  - - [1024, 16, 1, 1024]
    - [307, 0.433]
  - - [2560, 4, 1, 2]
    - [325, 0.001]
  - - [1024, 16384, 1, 1024]
    - [311, 54.309]
  - - [2560, 2048, 1, 1920]
    - [30, 45.438]
  - - [2048, 1024, 1, 6144]
    - [171, 58.39]
  - - [2560, 4, 1, 2560]
    - [443, 0.611]
  - - [512, 512, 128, 64]
    - [59, 11.629]
  - - [1024, 8192, 1, 30592]
    - [62, 84.774]
  - - [1536, 4096, 1, 1536]
    - [272, 48.204]
  - - [64, 512, 40, 512]
    - [444, 12.033]
  - - [1024, 1, 1, 2]
    - [57, 0.0]
  - - [1024, 1, 1, 1024]
    - [43, 0.027]
  - - [1024, 1, 1, 200]
    - [112, 0.007]
  - - [1024, 1, 1, 1600]
    - [445, 0.04]
  - - [2048, 1, 1, 512]
    - [213, 0.039]
  - - [128, 128, 1024, 64]
    - [333, 10.549]
  - - [64, 128, 1024, 128]
    - [400, 12.159]
  - - [1024, 64, 1, 2]
    - [46, 0.004]
  - - [1024, 8192, 1, 30528]
    - [386, 87.263]
  - - [1024, 64, 1, 1024]
    - [85, 1.616]
  - - [1024, 3456, 1, 1024]
    - [6, 42.666]
  - - [1024, 3456, 1, 512]
    - [6, 26.305]
  - - [1024, 4096, 1, 512]
    - [446, 30.981]
  - - [1024, 6912, 1, 1024]
    - [24, 53.337]
  - - [1024, 6912, 1, 512]
    - [24, 36.129]
  - - [1024, 864, 1, 1024]
    - [210, 20.184]
  - - [1024, 864, 1, 512]
    - [447, 9.735]
  - - [256, 3456, 1, 128]
    - [291, 2.748]
  - - [256, 4096, 1, 128]
    - [247, 3.073]
  - - [256, 55296, 1, 128]
    - [326, 19.669]
  - - [256, 6912, 1, 128]
    - [335, 5.274]
  - - [256, 864, 1, 128]
    - [16, 0.955]
  - - [480, 3456, 1, 1024]
    - [66, 26.665]
  - - [480, 4096, 1, 1024]
    - [171, 27.662]
  - - [480, 6912, 1, 1024]
    - [448, 41.028]
  - - [480, 864, 1, 1024]
    - [191, 10.047]
  - - [512, 3456, 1, 256]
    - [411, 11.745]
  - - [512, 4096, 1, 256]
    - [9, 12.51]
  - - [512, 55296, 1, 256]
    - [30, 32.372]
  - - [512, 6912, 1, 256]
    - [6, 16.517]
  - - [512, 864, 1, 256]
    - [232, 3.763]
  - - [1024, 640, 1, 30528]
    - [419, 62.995]
  - - [1024, 1280, 1, 30528]
    - [449, 78.996]
  - - [1024, 1600, 1, 30528]
    - [441, 80.978]
  - - [1024, 10240, 1, 1024]
    - [26, 49.699]
  - - [1024, 10240, 1, 4096]
    - [196, 75.386]
  - - [4096, 10240, 1, 1024]
    - [18, 66.06]
  - - [1024, 80, 1, 1024]
    - [314, 2.552]
  - - [1024, 80, 1, 2]
    - [46, 0.007]
  - - [128, 128, 1280, 64]
    - [163, 10.381]
  - - [64, 128, 1280, 128]
    - [344, 11.936]
  - - [1024, 1640, 1, 30528]
    - [450, 71.651]
  - - [1024, 10496, 1, 1024]
    - [90, 51.553]
  - - [1024, 10496, 1, 4096]
    - [37, 74.19]
  - - [4096, 10496, 1, 1024]
    - [451, 67.767]
  - - [1024, 82, 1, 1024]
    - [187, 2.426]
  - - [1024, 82, 1, 2]
    - [351, 0.006]
  - - [128, 128, 1312, 64]
    - [27, 10.341]
  - - [64, 128, 1312, 128]
    - [397, 12.226]
  - - [1024, 160, 1, 30528]
    - [432, 40.245]
  - - [1024, 240, 1, 30528]
    - [416, 48.579]
  - - [1024, 6144, 1, 4096]
    - [97, 62.799]
  - - [1024, 12, 1, 1024]
    - [16, 0.307]
  - - [4096, 6144, 1, 1024]
    - [145, 58.405]
  - - [1024, 6144, 1, 1024]
    - [24, 48.49]
  - - [1024, 12, 1, 2]
    - [29, 0.001]
  - - [512, 512, 192, 64]
    - [30, 12.211]
  - - [64, 512, 192, 512]
    - [291, 22.628]
  - - [256, 4096, 1, 1]
    - [339, 0.027]
  - - [256, 6912, 1, 1]
    - [452, 0.056]
  - - [1024, 10224, 1, 1024]
    - [237, 49.574]
  - - [1024, 10192, 1, 1024]
    - [316, 49.204]
  - - [1024, 10208, 1, 1024]
    - [453, 49.734]
  - - [1024, 10224, 1, 4096]
    - [166, 71.206]
  - - [1024, 10224, 1, 3072]
    - [194, 69.11]
  - - [4096, 10224, 1, 1024]
    - [15, 66.103]
  - - [1024, 10240, 1, 3072]
    - [10, 70.071]
  - - [1024, 10192, 1, 3072]
    - [10, 69.21]
  - - [4096, 10192, 1, 1024]
    - [224, 65.695]
  - - [1024, 10192, 1, 4096]
    - [41, 74.497]
  - - [1024, 10200, 1, 3072]
    - [24, 69.792]
  - - [1024, 10184, 1, 1024]
    - [323, 50.314]
  - - [4096, 10208, 1, 1024]
    - [26, 65.804]
  - - [1024, 10208, 1, 3072]
    - [10, 70.159]
  - - [1024, 10208, 1, 4096]
    - [130, 71.027]
  - - [1024, 10224, 1, 2048]
    - [24, 64.281]
  - - [1024, 10240, 1, 2048]
    - [24, 66.904]
  - - [1024, 10120, 1, 1024]
    - [184, 48.126]
  - - [1024, 10192, 1, 2048]
    - [10, 61.02]
  - - [64, 24, 6816, 24]
    - [345, 2.274]
  - - [1024, 10152, 1, 1024]
    - [237, 49.213]
  - - [1024, 10080, 1, 3072]
    - [389, 67.973]
  - - [64, 26, 6272, 26]
    - [299, 2.642]
  - - [100352, 512, 1, 256]
    - [113, 35.821]
  - - [12544, 2048, 1, 1024]
    - [179, 62.866]
  - - [12544, 64, 1, 147]
    - [266, 2.88]
  - - [200704, 512, 1, 256]
    - [19, 41.273]
  - - [25088, 1024, 1, 512]
    - [375, 47.077]
  - - [3136, 64, 1, 576]
    - [454, 3.623]
  - - [50176, 1024, 1, 512]
    - [186, 57.275]
  - - [6272, 2048, 1, 1024]
    - [178, 50.665]
  - - [784, 128, 1, 1152]
    - [125, 3.401]
  - - [3136, 128, 128, 256]
    - [372, 34.052]
  - - [3136, 128, 256, 256]
    - [372, 37.816]
  - - [784, 256, 128, 512]
    - [250, 42.116]
  - - [784, 256, 256, 512]
    - [26, 50.959]
  - - [128, 128, 2048, 64]
    - [110, 10.093]
  - - [64, 128, 2048, 128]
    - [345, 13.927]
  - - [1024, 2560, 1, 30528]
    - [455, 84.423]
  - - [1024, 128, 1, 1024]
    - [181, 3.693]
  - - [1024, 128, 1, 2]
    - [309, 0.011]
  - - [128, 128, 1536, 64]
    - [27, 10.775]
  - - [64, 128, 1536, 128]
    - [400, 12.977]
  - - [1024, 12288, 1, 4096]
    - [42, 68.391]
  - - [1024, 12288, 1, 1024]
    - [115, 48.914]
  - - [4096, 12288, 1, 1024]
    - [26, 68.848]
  - - [1024, 1920, 1, 30528]
    - [382, 80.329]
  - - [1024, 96, 1, 1024]
    - [248, 2.252]
  - - [1024, 96, 1, 2]
    - [213, 0.007]
  - - [128, 128, 192, 64]
    - [372, 4.463]
  - - [64, 128, 192, 128]
    - [423, 4.561]
  - - [768, 2048, 1, 2]
    - [456, 0.078]
  - - [3072, 2048, 1, 768]
    - [224, 41.337]
  - - [768, 2048, 1, 3072]
    - [215, 44.046]
  - - [768, 2048, 1, 768]
    - [247, 21.937]
  - - [384, 384, 144, 64]
    - [30, 11.466]
  - - [64, 384, 144, 384]
    - [65, 17.634]
  - - [768, 4608, 1, 2]
    - [27, 0.172]
  - - [3072, 4608, 1, 768]
    - [301, 50.898]
  - - [768, 4608, 1, 3072]
    - [13, 50.608]
  - - [768, 4608, 1, 768]
    - [154, 35.565]
  - - [512, 512, 48, 64]
    - [372, 10.055]
  - - [64, 512, 48, 512]
    - [423, 14.06]
  - - [128, 128, 256, 64]
    - [338, 5.079]
  - - [64, 128, 256, 128]
    - [290, 5.813]
  - - [384, 384, 192, 64]
    - [406, 11.947]
  - - [64, 384, 192, 384]
    - [457, 18.736]
  - - [1024, 4608, 1, 2]
    - [458, 0.208]
  - - [4096, 4608, 1, 1024]
    - [147, 60.446]
  - - [1024, 4608, 1, 4096]
    - [328, 62.491]
  - - [1024, 4608, 1, 1024]
    - [22, 43.592]
  - - [8192, 1024, 1, 1024]
    - [355, 39.645]
  - - [8192, 4096, 1, 1024]
    - [374, 64.784]
  - - [196, 256, 1, 2304]
    - [459, 2.391]
  - - [49, 512, 1, 4608]
    - [162, 2.23]
  - - [196, 1024, 128, 256]
    - [217, 20.219]
  - - [196, 1024, 256, 256]
    - [406, 26.215]
  - - [196, 256, 128, 1024]
    - [326, 29.555]
  - - [196, 256, 256, 1024]
    - [406, 36.792]
  - - [196, 512, 128, 1024]
    - [406, 38.346]
  - - [196, 512, 256, 1024]
    - [406, 40.147]
  - - [49, 2048, 128, 512]
    - [404, 18.355]
  - - [49, 2048, 256, 512]
    - [460, 20.019]
  - - [49, 512, 128, 2048]
    - [190, 21.487]
  - - [49, 512, 256, 2048]
    - [269, 23.856]
  - - [3072, 256, 2, 1024]
    - [11, 24.047]
  - - [768, 2048, 2, 512]
    - [11, 25.544]
  - - [2904, 256, 2, 1024]
    - [160, 27.221]
  - - [864, 2048, 2, 512]
    - [264, 27.744]
  - - [2992, 256, 2, 1024]
    - [146, 25.498]
  - - [3400, 256, 2, 1024]
    - [461, 30.266]
  - - [4032, 256, 2, 1024]
    - [131, 29.319]
  - - [3400, 256, 1, 1024]
    - [96, 17.382]
  - - [15200, 128, 2, 512]
    - [56, 31.498]
  - - [12288, 128, 2, 512]
    - [163, 24.474]
  - - [888, 2048, 2, 512]
    - [11, 27.595]
  - - [13600, 128, 2, 512]
    - [25, 25.766]
  - - [12880, 128, 2, 512]
    - [333, 26.015]
  - - [3456, 256, 2, 1024]
    - [40, 27.841]
  - - [2944, 256, 2, 1024]
    - [335, 24.991]
  - - [2688, 256, 2, 1024]
    - [462, 23.509]
  - - [13824, 128, 2, 512]
    - [6, 25.98]
  - - [3800, 256, 1, 1024]
    - [463, 20.844]
  - - [3168, 256, 2, 1024]
    - [144, 26.012]
  - - [3360, 256, 2, 1024]
    - [129, 25.694]
  - - [3552, 256, 2, 1024]
    - [335, 31.615]
  - - [11616, 128, 2, 512]
    - [334, 24.206]
  - - [4200, 256, 2, 1024]
    - [175, 29.073]
  - - [840, 2048, 2, 512]
    - [30, 25.754]
  - - [14208, 128, 2, 512]
    - [56, 29.186]
  - - [11968, 128, 2, 512]
    - [240, 22.03]
  - - [3264, 256, 2, 1024]
    - [160, 28.914]
  - - [13600, 256, 2, 512]
    - [19, 36.384]
  - - [12880, 256, 2, 512]
    - [19, 34.376]
  - - [12288, 256, 2, 512]
    - [285, 33.814]
  - - [2816, 256, 2, 1024]
    - [464, 25.75]
  - - [672, 2048, 2, 512]
    - [433, 23.58]
  - - [13440, 128, 2, 512]
    - [301, 25.229]
  - - [13824, 256, 2, 512]
    - [100, 39.26]
  - - [15200, 256, 2, 512]
    - [163, 39.772]
  - - [864, 512, 2, 2048]
    - [33, 28.857]
  - - [3600, 256, 2, 1024]
    - [144, 30.652]
  - - [888, 512, 2, 2048]
    - [141, 24.529]
  - - [4032, 1024, 2, 256]
    - [30, 27.436]
  - - [16128, 128, 2, 512]
    - [333, 23.037]
  - - [51520, 64, 2, 256]
    - [57, 18.832]
  - - [46464, 64, 2, 256]
    - [465, 18.012]
  - - [768, 3, 2, 256]
    - [46, 0.046]
  - - [768, 12, 2, 256]
    - [125, 0.166]
  - - [49152, 64, 2, 256]
    - [337, 18.19]
  - - [864, 12, 2, 256]
    - [277, 0.179]
  - - [864, 3, 2, 256]
    - [28, 0.046]
  - - [15200, 128, 1, 512]
    - [357, 21.02]
  - - [12288, 12, 2, 256]
    - [247, 2.06]
  - - [12288, 3, 2, 256]
    - [57, 0.496]
  - - [13600, 128, 1, 512]
    - [466, 17.947]
  - - [216, 3, 2, 256]
    - [306, 0.012]
  - - [51520, 12, 2, 256]
    - [254, 4.696]
  - - [2904, 1024, 2, 256]
    - [149, 23.585]
  - - [176, 12, 2, 256]
    - [183, 0.041]
  - - [51520, 3, 2, 256]
    - [343, 1.215]
  - - [176, 3, 2, 256]
    - [307, 0.008]
  - - [2992, 1024, 2, 256]
    - [30, 23.044]
  - - [192, 12, 2, 256]
    - [310, 0.039]
  - - [15200, 12, 2, 256]
    - [261, 2.365]
  - - [1536, 512, 1, 1024]
    - [463, 17.152]
  - - [1728, 512, 1, 1024]
    - [369, 18.461]
  - - [1536, 2048, 1, 1024]
    - [37, 35.954]
  - - [24576, 128, 1, 256]
    - [163, 13.173]
  - - [24576, 512, 1, 256]
    - [140, 29.775]
  - - [25760, 128, 1, 256]
    - [57, 14.108]
  - - [25760, 512, 1, 256]
    - [333, 29.864]
  - - [6144, 256, 1, 512]
    - [467, 15.137]
  - - [6440, 256, 1, 512]
    - [461, 18.11]
  - - [1024, 1024, 1, 320]
    - [55, 8.54]
  - - [15200, 3, 2, 256]
    - [57, 0.625]
  - - [51520, 64, 2, 64]
    - [202, 7.128]
  - - [3456, 3, 2, 256]
    - [127, 0.143]
  - - [13600, 12, 2, 256]
    - [293, 2.297]
  - - [12880, 3, 2, 256]
    - [57, 0.537]
  - - [3400, 3, 2, 256]
    - [104, 0.186]
  - - [12880, 12, 2, 256]
    - [76, 2.328]
  - - [13824, 12, 2, 256]
    - [351, 2.155]
  - - [13824, 3, 2, 256]
    - [293, 0.632]
  - - [13600, 3, 2, 256]
    - [403, 0.498]
  - - [13600, 512, 1, 128]
    - [37, 14.558]
  - - [9408, 512, 2, 128]
    - [110, 16.099]
  - - [3456, 12, 2, 256]
    - [261, 0.801]
  - - [56000, 256, 2, 64]
    - [299, 12.291]
  - - [3800, 3, 2, 256]
    - [127, 0.2]
  - - [2816, 1024, 2, 256]
    - [333, 23.628]
  - - [60800, 256, 1, 64]
    - [37, 10.607]
  - - [3400, 12, 2, 256]
    - [48, 0.739]
  - - [3800, 12, 2, 256]
    - [150, 0.811]
  - - [192, 3, 2, 256]
    - [192, 0.01]
  - - [216, 12, 2, 256]
    - [104, 0.045]
  - - [2944, 1024, 2, 256]
    - [263, 23.922]
  - - [55296, 64, 2, 64]
    - [299, 7.513]
  - - [55296, 3, 2, 256]
    - [8, 1.189]
  - - [49152, 64, 2, 64]
    - [30, 7.287]
  - - [11776, 512, 2, 128]
    - [333, 16.558]
  - - [54400, 64, 2, 64]
    - [173, 6.534]
  - - [42240, 64, 2, 256]
    - [30, 17.916]
  - - [3072, 3, 2, 256]
    - [415, 0.133]
  - - [11616, 512, 2, 128]
    - [30, 18.946]
  - - [4200, 1024, 2, 256]
    - [199, 27.44]
  - - [3072, 12, 2, 256]
    - [454, 0.64]
  - - [672, 512, 2, 2048]
    - [33, 21.84]
  - - [54400, 256, 1, 64]
    - [372, 10.48]
  - - [54400, 64, 2, 256]
    - [30, 18.976]
  - - [15200, 512, 1, 128]
    - [202, 15.762]
  - - [56832, 64, 2, 256]
    - [30, 20.028]
  - - [2688, 1024, 2, 256]
    - [30, 22.742]
  - - [54400, 3, 2, 256]
    - [299, 1.224]
  - - [12672, 512, 2, 128]
    - [19, 18.314]
  - - [11968, 512, 2, 128]
    - [30, 18.307]
  - - [46464, 256, 2, 64]
    - [468, 11.653]
  - - [55296, 64, 2, 256]
    - [247, 19.895]
  - - [60800, 64, 2, 64]
    - [30, 7.67]
  - - [2400, 256, 2, 1024]
    - [469, 23.813]
  - - [2520, 256, 2, 1024]
    - [185, 24.722]
  - - [768, 512, 2, 2048]
    - [159, 24.449]
  - - [2400, 1024, 2, 256]
    - [30, 19.442]
  - - [10752, 128, 2, 512]
    - [264, 22.909]
  - - [45632, 256, 2, 64]
    - [376, 11.055]
  - - [2520, 1024, 2, 256]
    - [333, 21.68]
  - - [53760, 256, 2, 64]
    - [113, 11.823]
  - - [43008, 64, 2, 256]
    - [94, 17.261]
  - - [2352, 256, 2, 1024]
    - [462, 21.525]
  - - [47872, 256, 2, 64]
    - [100, 10.808]
  - - [47104, 256, 2, 64]
    - [311, 11.536]
  - - [50688, 256, 2, 64]
    - [47, 11.551]
  - - [45056, 256, 2, 64]
    - [113, 11.218]
  - - [13440, 512, 2, 128]
    - [285, 19.412]
  - - [2352, 1024, 2, 256]
    - [333, 19.456]
  - - [11264, 512, 2, 128]
    - [224, 18.858]
  - - [10560, 128, 2, 512]
    - [291, 22.515]
  - - [16128, 512, 2, 128]
    - [173, 20.587]
  - - [864, 256, 2, 2048]
    - [38, 15.813]
  - - [37632, 256, 2, 64]
    - [470, 11.272]
  - - [51520, 256, 2, 64]
    - [299, 11.732]
  - - [14000, 512, 2, 128]
    - [110, 19.619]
  - - [768, 256, 2, 2048]
    - [101, 15.194]
  - - [60800, 12, 2, 256]
    - [378, 4.378]
  - - [10560, 512, 2, 128]
    - [163, 17.634]
  - - [60800, 3, 2, 256]
    - [345, 1.306]
  - - [64512, 256, 2, 64]
    - [113, 12.582]
  - - [54400, 256, 2, 64]
    - [372, 11.534]
  - - [45632, 64, 2, 256]
    - [57, 17.888]
  - - [3264, 1024, 2, 256]
    - [173, 24.49]
  - - [60800, 64, 2, 256]
    - [94, 21.127]
  - - [10752, 512, 2, 128]
    - [30, 17.959]
  - - [3168, 1024, 2, 256]
    - [27, 24.483]
  - - [55296, 256, 2, 256]
    - [97, 32.266]
  - - [51520, 256, 2, 256]
    - [285, 30.603]
  - - [11408, 128, 2, 512]
    - [27, 22.216]
  - - [60800, 256, 2, 256]
    - [100, 34.851]
  - - [54400, 256, 2, 256]
    - [100, 32.086]
  - - [60800, 256, 2, 64]
    - [100, 12.159]
  - - [3800, 1024, 1, 256]
    - [465, 19.832]
  - - [3400, 1024, 1, 256]
    - [458, 14.637]
  - - [3072, 1024, 2, 256]
    - [50, 24.223]
  - - [3600, 1024, 2, 256]
    - [24, 24.38]
  - - [12288, 512, 2, 128]
    - [372, 18.575]
  - - [49152, 256, 2, 256]
    - [284, 29.083]
  - - [12880, 512, 2, 128]
    - [30, 18.354]
  - - [11408, 512, 2, 128]
    - [346, 18.857]
  - - [42240, 256, 2, 64]
    - [372, 10.691]
  - - [1008, 2048, 2, 512]
    - [30, 27.78]
  - - [3360, 1024, 2, 256]
    - [30, 24.955]
  - - [14208, 512, 2, 128]
    - [100, 20.49]
  - - [56832, 256, 2, 64]
    - [333, 11.789]
  - - [43008, 256, 2, 64]
    - [372, 11.603]
  - - [13600, 512, 2, 128]
    - [30, 18.933]
  - - [2640, 1024, 2, 256]
    - [9, 21.688]
  - - [13824, 512, 2, 128]
    - [100, 18.776]
  - - [3800, 256, 2, 1024]
    - [335, 33.083]
  - - [55296, 256, 2, 64]
    - [372, 11.797]
  - - [2640, 256, 2, 1024]
    - [204, 25.803]
  - - [15200, 512, 2, 128]
    - [458, 20.662]
  - - [3552, 1024, 2, 256]
    - [26, 27.389]
  - - [3456, 1024, 2, 256]
    - [100, 25.631]
  - - [49152, 256, 2, 64]
    - [30, 11.037]
  - - [3400, 1024, 2, 256]
    - [8, 23.698]
  - - [3800, 1024, 2, 256]
    - [19, 28.798]
  - - [6912, 256, 1, 512]
    - [467, 16.779]
  - - [6800, 256, 1, 512]
    - [129, 19.227]
  - - [27648, 128, 1, 256]
    - [57, 15.779]
  - - [27200, 128, 1, 256]
    - [293, 16.222]
  - - [30400, 128, 1, 256]
    - [30, 16.013]
  - - [7600, 256, 1, 512]
    - [247, 21.912]
  - - [6144, 1024, 1, 512]
    - [41, 36.271]
  - - [6912, 1024, 1, 512]
    - [100, 36.342]
  - - [6440, 1024, 1, 512]
    - [149, 37.533]
  - - [27648, 512, 1, 256]
    - [100, 32.009]
  - - [1728, 2048, 1, 1024]
    - [24, 41.32]
  - - [27200, 512, 1, 256]
    - [19, 31.284]
  - - [6800, 1024, 1, 512]
    - [334, 35.758]
  - - [7600, 1024, 1, 512]
    - [100, 44.009]
  - - [30400, 512, 1, 256]
    - [163, 32.66]
  - - [1024, 1024, 1, 81]
    - [293, 2.431]
  - - [12544, 1024, 1, 1024]
    - [285, 50.993]
  - - [173280, 128, 1, 64]
    - [299, 10.441]
  - - [231040, 128, 1, 64]
    - [75, 8.928]
  - - [25992, 128, 1, 64]
    - [176, 5.366]
  - - [950, 512, 2, 2048]
    - [471, 27.399]
  - - [2852, 256, 2, 1024]
    - [303, 24.474]
  - - [3220, 256, 2, 1024]
    - [174, 26.171]
  - - [850, 2048, 2, 512]
    - [410, 24.4]
  - - [805, 2048, 2, 512]
    - [118, 21.598]
  - - [3036, 256, 2, 1024]
    - [472, 21.752]
  - - [713, 2048, 2, 512]
    - [336, 21.417]
  - - [850, 512, 2, 2048]
    - [473, 26.649]
  - - [850, 2048, 1, 512]
    - [474, 17.345]
  - - [660, 2048, 2, 512]
    - [475, 19.589]
  - - [726, 2048, 2, 512]
    - [158, 18.39]
  - - [805, 512, 2, 2048]
    - [471, 22.24]
  - - [3500, 256, 2, 1024]
    - [476, 31.138]
  - - [3700, 256, 2, 1024]
    - [477, 30.75]
  - - [748, 2048, 2, 512]
    - [20, 18.959]
  - - [950, 256, 2, 2048]
    - [38, 16.621]
  - - [850, 3, 2, 256]
    - [276, 0.036]
  - - [850, 12, 2, 256]
    - [352, 0.185]
  - - [805, 12, 2, 256]
    - [112, 0.125]
  - - [805, 3, 2, 256]
    - [34, 0.039]
  - - [247, 3, 2, 256]
    - [353, 0.014]
  - - [950, 3, 2, 256]
    - [34, 0.049]
  - - [187, 12, 2, 256]
    - [353, 0.038]
  - - [247, 12, 2, 256]
    - [276, 0.055]
  - - [187, 3, 2, 256]
    - [34, 0.009]
  - - [228, 12, 2, 256]
    - [34, 0.045]
  - - [221, 12, 2, 256]
    - [478, 0.049]
  - - [950, 12, 2, 256]
    - [352, 0.138]
  - - [228, 3, 2, 256]
    - [112, 0.009]
  - - [1900, 512, 1, 1024]
    - [137, 17.162]
  - - [1700, 512, 1, 1024]
    - [479, 17.35]
  - - [1610, 512, 1, 1024]
    - [473, 16.902]
  - - [3036, 1024, 2, 256]
    - [410, 20.432]
  - - [221, 3, 2, 256]
    - [276, 0.011]
  - - [2852, 1024, 2, 256]
    - [410, 19.852]
  - - [3220, 3, 2, 256]
    - [353, 0.185]
  - - [3220, 12, 2, 256]
    - [34, 0.665]
  - - [660, 512, 2, 2048]
    - [479, 21.189]
  - - [726, 512, 2, 2048]
    - [174, 22.031]
  - - [713, 512, 2, 2048]
    - [471, 19.208]
  - - [805, 256, 2, 2048]
    - [255, 13.368]
  - - [950, 2048, 1, 512]
    - [411, 18.049]
  - - [850, 256, 2, 2048]
    - [31, 16.106]
  - - [3700, 1024, 2, 256]
    - [326, 22.357]
  - - [3500, 1024, 2, 256]
    - [20, 21.885]
  - - [3220, 1024, 2, 256]
    - [470, 19.232]
  - - [950, 2048, 2, 512]
    - [118, 26.491]
  - - [1610, 2048, 1, 1024]
    - [470, 31.427]
  - - [1700, 2048, 1, 1024]
    - [480, 33.173]
  - - [1900, 2048, 1, 1024]
    - [196, 37.718]
  - - [100, 128, 120, 512]
    - [174, 13.537]
  - - [100, 128, 139, 512]
    - [174, 12.363]
  - - [100, 128, 160, 512]
    - [370, 14.723]
  - - [100, 128, 18, 512]
    - [227, 3.099]
  - - [100, 128, 19, 512]
    - [481, 3.207]
  - - [1444, 256, 120, 128]
    - [406, 21.942]
  - - [1444, 256, 139, 128]
    - [394, 21.306]
  - - [1444, 256, 160, 128]
    - [407, 22.694]
  - - [1444, 256, 18, 128]
    - [482, 13.194]
  - - [1444, 256, 19, 128]
    - [395, 11.816]
  - - [1444, 256, 120, 256]
    - [468, 31.493]
  - - [1444, 256, 139, 256]
    - [408, 33.63]
  - - [1444, 256, 160, 256]
    - [468, 36.012]
  - - [1444, 256, 18, 256]
    - [408, 21.19]
  - - [1444, 256, 19, 256]
    - [470, 22.091]
  - - [25, 128, 120, 256]
    - [483, 2.955]
  - - [25, 128, 139, 256]
    - [478, 2.521]
  - - [25, 128, 160, 256]
    - [484, 2.882]
  - - [25, 128, 18, 256]
    - [309, 0.397]
  - - [25, 128, 19, 256]
    - [112, 0.525]
  - - [361, 256, 120, 512]
    - [395, 25.685]
  - - [361, 256, 139, 512]
    - [196, 30.545]
  - - [361, 256, 160, 512]
    - [401, 27.685]
  - - [361, 256, 18, 512]
    - [405, 11.245]
  - - [361, 256, 19, 512]
    - [394, 14.258]
  - - [9, 128, 120, 256]
    - [481, 0.887]
  - - [9, 128, 139, 256]
    - [478, 0.951]
  - - [9, 128, 160, 256]
    - [367, 0.995]
  - - [9, 128, 18, 256]
    - [112, 0.136]
  - - [9, 128, 19, 256]
    - [112, 0.198]
  - - [100, 512, 1, 2304]
    - [222, 2.753]
  - - [1444, 128, 1, 576]
    - [276, 3.349]
  - - [200716, 128, 1, 64]
    - [396, 10.131]
  - - [22500, 64, 1, 147]
    - [400, 5.119]
  - - [25, 256, 1, 1152]
    - [353, 0.194]
  - - [27436, 128, 1, 64]
    - [400, 4.336]
  - - [361, 512, 1, 2304]
    - [181, 7.89]
  - - [9, 256, 1, 1152]
    - [222, 0.075]
  - - [1024, 1024, 160, 96]
    - [100, 23.315]
  - - [96, 1024, 160, 1024]
    - [311, 40.598]
  - - [1920, 16384, 1, 25216]
    - [316, 94.1]
  - - [3840, 16384, 1, 1920]
    - [81, 82.72]
  - - [1920, 16384, 1, 3840]
    - [15, 86.136]
  - - [960, 16384, 1, 1920]
    - [391, 65.938]
  - - [1920, 16384, 1, 2880]
    - [1, 85.264]
  - - [1024, 1024, 40, 96]
    - [199, 18.513]
  - - [96, 1024, 40, 1024]
    - [119, 32.991]
  - - [1920, 4096, 1, 25216]
    - [480, 92.15]
  - - [3840, 4096, 1, 1920]
    - [485, 73.91]
  - - [1920, 4096, 1, 3840]
    - [486, 78.308]
  - - [960, 4096, 1, 1920]
    - [439, 51.387]
  - - [1920, 4096, 1, 2880]
    - [24, 75.577]
  - - [1024, 1024, 80, 96]
    - [374, 21.85]
  - - [96, 1024, 80, 1024]
    - [303, 37.294]
  - - [1920, 8192, 1, 25216]
    - [486, 92.758]
  - - [3840, 8192, 1, 1920]
    - [37, 78.895]
  - - [1920, 8192, 1, 3840]
    - [24, 84.501]
  - - [960, 8192, 1, 1920]
    - [7, 56.76]
  - - [1920, 8192, 1, 2880]
    - [226, 80.098]
  - - [1024, 1024, 96, 96]
    - [109, 22.603]
  - - [96, 1024, 96, 1024]
    - [141, 36.67]
  - - [2304, 16384, 1, 12672]
    - [107, 90.571]
  - - [2304, 16384, 1, 2304]
    - [15, 79.775]
  - - [576, 16384, 1, 2304]
    - [119, 58.546]
  - - [2304, 16384, 1, 1728]
    - [1, 77.093]
  - - [1024, 1024, 24, 96]
    - [27, 17.265]
  - - [96, 1024, 24, 1024]
    - [108, 26.707]
  - - [2304, 4096, 1, 12672]
    - [487, 85.311]
  - - [2304, 4096, 1, 2304]
    - [488, 68.608]
  - - [576, 4096, 1, 2304]
    - [62, 44.574]
  - - [2304, 4096, 1, 1728]
    - [488, 61.599]
  - - [1024, 1024, 48, 96]
    - [184, 18.474]
  - - [96, 1024, 48, 1024]
    - [114, 33.964]
  - - [2304, 8192, 1, 12672]
    - [97, 88.924]
  - - [2304, 8192, 1, 2304]
    - [37, 75.844]
  - - [576, 8192, 1, 2304]
    - [144, 49.097]
  - - [2304, 8192, 1, 1728]
    - [374, 71.364]
  - - [1024, 1024, 16, 96]
    - [47, 16.164]
  - - [96, 1024, 16, 1024]
    - [69, 25.29]
  - - [3072, 4096, 1, 6400]
    - [89, 78.856]
  - - [1536, 4096, 1, 3072]
    - [271, 62.323]
  - - [3072, 4096, 1, 1536]
    - [489, 55.697]
  - - [384, 4096, 1, 3072]
    - [281, 43.531]
  - - [3072, 4096, 1, 1152]
    - [24, 53.125]
  - - [1024, 1024, 32, 96]
    - [458, 17.788]
  - - [96, 1024, 32, 1024]
    - [73, 31.042]
  - - [3072, 8192, 1, 6400]
    - [196, 83.157]
  - - [1536, 8192, 1, 3072]
    - [89, 68.23]
  - - [3072, 8192, 1, 1536]
    - [37, 69.839]
  - - [384, 8192, 1, 3072]
    - [349, 44.114]
  - - [3072, 8192, 1, 1152]
    - [81, 62.52]
  - - [2048, 199, 1, 29000]
    - [490, 43.823]
  - - [2048, 221, 1, 29000]
    - [491, 48.388]
  - - [2048, 224, 1, 29000]
    - [425, 48.589]
  - - [2048, 229, 1, 29000]
    - [491, 49.685]
  - - [2048, 234, 1, 29000]
    - [425, 52.291]
  - - [2048, 242, 1, 29000]
    - [491, 49.924]
  - - [2048, 246, 1, 29000]
    - [429, 54.862]
  - - [2048, 247, 1, 29000]
    - [425, 52.142]
  - - [2048, 256, 1, 29000]
    - [429, 54.858]
  - - [2048, 262, 1, 29000]
    - [419, 48.749]
  - - [2048, 264, 1, 29000]
    - [492, 53.318]
  - - [2048, 265, 1, 29000]
    - [492, 53.974]
  - - [2048, 274, 1, 29000]
    - [419, 50.779]
  - - [2048, 277, 1, 29000]
    - [493, 52.922]
  - - [2048, 279, 1, 29000]
    - [494, 52.601]
  - - [2048, 288, 1, 29000]
    - [492, 54.07]
  - - [2048, 296, 1, 29000]
    - [495, 55.168]
  - - [2048, 315, 1, 29000]
    - [419, 57.036]
  - - [2048, 335, 1, 29000]
    - [496, 53.863]
  - - [2048, 4096, 1, 2048]
    - [380, 55.676]
  - - [2048, 4096, 1, 4096]
    - [328, 67.922]
  - - [2048, 8, 1, 2]
    - [29, 0.001]
  - - [2048, 8, 1, 2048]
    - [310, 0.786]
  - - [4096, 4096, 1, 2048]
    - [497, 67.411]
  - - [1024, 2283, 1, 29000]
    - [364, 79.971]
  - - [1024, 2296, 1, 29000]
    - [360, 80.629]
  - - [1024, 2306, 1, 29000]
    - [384, 80.97]
  - - [1024, 2309, 1, 29000]
    - [362, 81.465]
  - - [1024, 2318, 1, 29000]
    - [498, 80.878]
  - - [1024, 2320, 1, 29000]
    - [499, 81.379]
  - - [1024, 2324, 1, 29000]
    - [499, 81.806]
  - - [1024, 2325, 1, 29000]
    - [362, 81.784]
  - - [1024, 2329, 1, 29000]
    - [500, 81.861]
  - - [1024, 2338, 1, 29000]
    - [499, 82.231]
  - - [1024, 2345, 1, 29000]
    - [363, 80.58]
  - - [1024, 2350, 1, 29000]
    - [498, 82.282]
  - - [1024, 2362, 1, 29000]
    - [499, 84.049]
  - - [1024, 2366, 1, 29000]
    - [499, 82.073]
  - - [1024, 2368, 1, 29000]
    - [500, 82.921]
  - - [1024, 2374, 1, 29000]
    - [498, 81.793]
  - - [1024, 2390, 1, 29000]
    - [383, 82.007]
  - - [512, 512, 320, 64]
    - [145, 14.731]
  - - [64, 512, 320, 512]
    - [501, 25.51]
  - - [1024, 20, 1, 1024]
    - [219, 0.605]
  - - [1024, 20, 1, 2]
    - [213, 0.002]
  - - [1024, 561, 1, 29000]
    - [493, 51.131]
  - - [1024, 574, 1, 29000]
    - [502, 53.852]
  - - [1024, 600, 1, 29000]
    - [495, 55.892]
  - - [1024, 608, 1, 29000]
    - [503, 55.505]
  - - [1024, 615, 1, 29000]
    - [504, 55.76]
  - - [1024, 622, 1, 29000]
    - [505, 61.416]
  - - [1024, 625, 1, 29000]
    - [495, 58.749]
  - - [1024, 626, 1, 29000]
    - [505, 59.562]
  - - [1024, 628, 1, 29000]
    - [506, 63.592]
  - - [1024, 636, 1, 29000]
    - [505, 58.8]
  - - [1024, 651, 1, 29000]
    - [507, 53.42]
  - - [1024, 658, 1, 29000]
    - [508, 52.981]
  - - [1024, 669, 1, 29000]
    - [507, 53.728]
  - - [1024, 670, 1, 29000]
    - [421, 53.369]
  - - [1024, 672, 1, 29000]
    - [496, 54.009]
  - - [1024, 684, 1, 29000]
    - [507, 54.989]
  - - [1024, 716, 1, 29000]
    - [508, 56.972]
  - - [1024, 730, 1, 29000]
    - [509, 58.909]
  - - [512, 512, 80, 64]
    - [372, 11.63]
  - - [2560, 1024, 1, 2560]
    - [139, 53.262]
  - - [2560, 1024, 1, 4096]
    - [510, 50.045]
  - - [2560, 109, 1, 29000]
    - [511, 36.398]
  - - [2560, 121, 1, 29000]
    - [512, 40.175]
  - - [2560, 2, 1, 2]
    - [213, 0.0]
  - - [2560, 2, 1, 2560]
    - [513, 0.307]
  - - [2560, 27, 1, 29000]
    - [514, 13.471]
  - - [2560, 35, 1, 29000]
    - [514, 17.388]
  - - [2560, 36, 1, 29000]
    - [515, 18.055]
  - - [2560, 39, 1, 29000]
    - [516, 19.109]
  - - [2560, 40, 1, 29000]
    - [517, 18.616]
  - - [2560, 42, 1, 29000]
    - [516, 20.343]
  - - [2560, 43, 1, 29000]
    - [518, 20.958]
  - - [2560, 44, 1, 29000]
    - [514, 21.689]
  - - [2560, 46, 1, 29000]
    - [518, 21.259]
  - - [2560, 48, 1, 29000]
    - [514, 23.138]
  - - [2560, 49, 1, 29000]
    - [516, 23.303]
  - - [2560, 50, 1, 29000]
    - [233, 23.77]
  - - [2560, 51, 1, 29000]
    - [519, 23.803]
  - - [2560, 53, 1, 29000]
    - [514, 25.811]
  - - [2560, 54, 1, 29000]
    - [514, 26.467]
  - - [2560, 55, 1, 29000]
    - [520, 26.341]
  - - [2560, 56, 1, 29000]
    - [521, 25.974]
  - - [2560, 57, 1, 29000]
    - [522, 26.853]
  - - [2560, 58, 1, 29000]
    - [522, 29.108]
  - - [2560, 59, 1, 29000]
    - [520, 28.567]
  - - [2560, 61, 1, 29000]
    - [522, 28.757]
  - - [2560, 63, 1, 29000]
    - [522, 28.895]
  - - [2560, 65, 1, 29000]
    - [523, 29.05]
  - - [2560, 66, 1, 29000]
    - [519, 30.065]
  - - [2560, 67, 1, 29000]
    - [524, 31.115]
  - - [2560, 69, 1, 29000]
    - [523, 33.199]
  - - [2560, 70, 1, 29000]
    - [524, 32.88]
  - - [2560, 71, 1, 29000]
    - [523, 31.996]
  - - [2560, 73, 1, 29000]
    - [523, 34.129]
  - - [2560, 74, 1, 29000]
    - [524, 35.239]
  - - [2560, 75, 1, 29000]
    - [524, 34.705]
  - - [2560, 77, 1, 29000]
    - [524, 35.901]
  - - [2560, 78, 1, 29000]
    - [524, 35.588]
  - - [2560, 80, 1, 29000]
    - [523, 37.702]
  - - [2560, 81, 1, 29000]
    - [523, 36.668]
  - - [2560, 82, 1, 29000]
    - [523, 37.364]
  - - [2560, 83, 1, 29000]
    - [523, 37.755]
  - - [2560, 84, 1, 29000]
    - [525, 36.777]
  - - [2560, 88, 1, 29000]
    - [524, 39.132]
  - - [2560, 89, 1, 29000]
    - [526, 39.111]
  - - [2560, 90, 1, 29000]
    - [523, 39.285]
  - - [2560, 92, 1, 29000]
    - [524, 41.418]
  - - [2560, 95, 1, 29000]
    - [523, 39.646]
  - - [2560, 98, 1, 29000]
    - [512, 33.0]
  - - [4096, 1024, 1, 2560]
    - [13, 49.677]
  - - [1024, 1024, 512, 64]
    - [75, 18.165]
  - - [64, 1024, 512, 1024]
    - [440, 34.742]
  - - [1024, 32768, 1, 3072]
    - [41, 79.038]
  - - [1024, 32768, 1, 4096]
    - [41, 82.741]
  - - [1024, 32768, 1, 50304]
    - [182, 91.362]
  - - [4096, 32768, 1, 1024]
    - [237, 71.961]
  - - [1024, 1024, 24, 128]
    - [27, 20.152]
  - - [128, 1024, 24, 1024]
    - [486, 33.041]
  - - [1909283, 40, 1, 40]
    - [402, 2.298]
  - - [3818566, 40, 1, 40]
    - [397, 2.709]
  - - [1909283, 11, 1, 11]
    - [309, 0.531]
  - - [3818566, 11, 1, 11]
    - [309, 0.592]
  - - [224, 224, 384, 64]
    - [173, 10.105]
  - - [64, 224, 384, 224]
    - [378, 13.558]
  - - [768, 32, 1, 3]
    - [213, 0.002]
  - - [768, 32, 1, 768]
    - [589, 1.154]
  - - [3072, 7168, 1, 768]
    - [224, 53.309]
  - - [768, 7168, 1, 3072]
    - [527, 62.422]
  - - [768, 7168, 1, 768]
    - [62, 37.794]
  - - [1024, 4096, 1, 1]
    - [30, 0.079]
  - - [1024, 4096, 1, 50257]
    - [157, 79.987]
  - - [3072, 4096, 1, 1]
    - [30, 0.162]
  - - [3072, 4096, 1, 1024]
    - [202, 49.24]
  - - [4096, 4096, 1, 1]
    - [334, 0.184]
  - - [3072, 2048, 1, 1024]
    - [100, 47.41]
  - - [1000, 224, 1, 4000]
    - [528, 13.854]
  - - [1000, 7168, 1, 4000]
    - [529, 71.744]
  - - [224, 7168, 1, 4000]
    - [335, 51.991]
  - - [1000, 32, 1, 100]
    - [530, 0.103]
  - - [1024, 4896, 1, 3072]
    - [212, 58.849]
  - - [1024, 4896, 1, 1024]
    - [62, 42.505]
  - - [1024, 4896, 1, 4096]
    - [166, 65.044]
  - - [4096, 4896, 1, 1024]
    - [26, 55.725]
  - - [1024, 5552, 1, 3072]
    - [497, 65.158]
  - - [1024, 5552, 1, 1024]
    - [139, 45.12]
  - - [1024, 5552, 1, 4096]
    - [418, 72.176]
  - - [4096, 5552, 1, 1024]
    - [1, 60.828]
  - - [1024, 5888, 1, 3072]
    - [196, 58.163]
  - - [1024, 5888, 1, 1024]
    - [107, 43.547]
  - - [1024, 5888, 1, 4096]
    - [531, 61.113]
  - - [4096, 5888, 1, 1024]
    - [81, 58.845]
  - - [1024, 6128, 1, 3072]
    - [35, 61.073]
  - - [1024, 6128, 1, 1024]
    - [229, 46.233]
  - - [1024, 6128, 1, 4096]
    - [1, 62.153]
  - - [4096, 6128, 1, 1024]
    - [119, 55.898]
  - - [1024, 6688, 1, 3072]
    - [24, 66.331]
  - - [1024, 6688, 1, 1024]
    - [24, 50.696]
  - - [1024, 6688, 1, 4096]
    - [74, 67.793]
  - - [4096, 6688, 1, 1024]
    - [194, 60.26]
  - - [1024, 5664, 1, 3072]
    - [106, 67.825]
  - - [1024, 5664, 1, 1024]
    - [90, 51.44]
  - - [1024, 5664, 1, 4096]
    - [168, 76.21]
  - - [4096, 5664, 1, 1024]
    - [532, 57.514]
  - - [1024, 6048, 1, 3072]
    - [35, 60.6]
  - - [1024, 6048, 1, 1024]
    - [10, 46.826]
  - - [1024, 6048, 1, 4096]
    - [533, 62.025]
  - - [4096, 6048, 1, 1024]
    - [145, 59.178]
  - - [1024, 5984, 1, 3072]
    - [534, 59.011]
  - - [1024, 5984, 1, 1024]
    - [41, 43.801]
  - - [1024, 5984, 1, 4096]
    - [78, 60.317]
  - - [4096, 5984, 1, 1024]
    - [237, 58.979]
  - - [1024, 7872, 1, 3072]
    - [62, 66.483]
  - - [1024, 7872, 1, 1024]
    - [62, 51.736]
  - - [1024, 7872, 1, 4096]
    - [62, 71.427]
  - - [4096, 7872, 1, 1024]
    - [237, 61.421]
  - - [1024, 5920, 1, 3072]
    - [24, 58.729]
  - - [1024, 5920, 1, 1024]
    - [97, 43.475]
  - - [1024, 5920, 1, 4096]
    - [39, 60.2]
  - - [4096, 5920, 1, 1024]
    - [26, 58.204]
  - - [1024, 7344, 1, 3072]
    - [37, 72.71]
  - - [1024, 7344, 1, 1024]
    - [97, 53.894]
  - - [1024, 7344, 1, 4096]
    - [147, 74.231]
  - - [4096, 7344, 1, 1024]
    - [237, 62.325]
  - - [1024, 7760, 1, 3072]
    - [62, 62.295]
  - - [1024, 7760, 1, 1024]
    - [427, 46.873]
  - - [1024, 7760, 1, 4096]
    - [157, 63.269]
  - - [4096, 7760, 1, 1024]
    - [145, 62.558]
  - - [1024, 5136, 1, 3072]
    - [527, 61.049]
  - - [1024, 5136, 1, 1024]
    - [62, 43.814]
  - - [1024, 5136, 1, 4096]
    - [194, 68.224]
  - - [4096, 5136, 1, 1024]
    - [237, 57.879]
  - - [1024, 6336, 1, 3072]
    - [109, 62.857]
  - - [1024, 6336, 1, 1024]
    - [59, 47.254]
  - - [1024, 6336, 1, 4096]
    - [250, 64.518]
  - - [4096, 6336, 1, 1024]
    - [1, 59.819]
  - - [1024, 7184, 1, 3072]
    - [35, 72.11]
  - - [1024, 7184, 1, 1024]
    - [24, 53.404]
  - - [1024, 7184, 1, 4096]
    - [535, 74.072]
  - - [4096, 7184, 1, 1024]
    - [35, 61.521]
  - - [1024, 5936, 1, 3072]
    - [10, 59.58]
  - - [1024, 5936, 1, 1024]
    - [24, 44.672]
  - - [1024, 5936, 1, 4096]
    - [534, 60.133]
  - - [4096, 5936, 1, 1024]
    - [237, 56.445]
  - - [1024, 6608, 1, 3072]
    - [41, 66.286]
  - - [1024, 6608, 1, 1024]
    - [229, 48.252]
  - - [1024, 6608, 1, 4096]
    - [536, 68.062]
  - - [4096, 6608, 1, 1024]
    - [537, 60.542]
  - - [1024, 5616, 1, 3072]
    - [538, 66.17]
  - - [1024, 5616, 1, 1024]
    - [90, 49.685]
  - - [1024, 5616, 1, 4096]
    - [212, 74.242]
  - - [4096, 5616, 1, 1024]
    - [389, 57.226]
  - - [1024, 5904, 1, 3072]
    - [97, 58.309]
  - - [1024, 5904, 1, 1024]
    - [113, 42.392]
  - - [1024, 5904, 1, 4096]
    - [257, 59.702]
  - - [4096, 5904, 1, 1024]
    - [147, 57.01]
  - - [1024, 6624, 1, 3072]
    - [41, 66.911]
  - - [1024, 6624, 1, 1024]
    - [27, 46.221]
  - - [1024, 6624, 1, 4096]
    - [533, 67.098]
  - - [4096, 6624, 1, 1024]
    - [103, 62.215]
  - - [1024, 6416, 1, 3072]
    - [78, 63.358]
  - - [1024, 6416, 1, 1024]
    - [24, 48.531]
  - - [1024, 6416, 1, 4096]
    - [97, 64.987]
  - - [4096, 6416, 1, 1024]
    - [26, 60.741]
  - - [1024, 5344, 1, 3072]
    - [418, 63.033]
  - - [1024, 5344, 1, 1024]
    - [62, 44.9]
  - - [1024, 5344, 1, 4096]
    - [93, 70.84]
  - - [4096, 5344, 1, 1024]
    - [1, 59.88]
  - - [1024, 7024, 1, 3072]
    - [186, 69.431]
  - - [1024, 7024, 1, 1024]
    - [237, 49.583]
  - - [1024, 7024, 1, 4096]
    - [1, 71.775]
  - - [4096, 7024, 1, 1024]
    - [497, 62.751]
  - - [1024, 5776, 1, 3072]
    - [78, 57.736]
  - - [1024, 5776, 1, 1024]
    - [113, 44.158]
  - - [1024, 5776, 1, 4096]
    - [24, 59.649]
  - - [4096, 5776, 1, 1024]
    - [37, 56.527]
  - - [1024, 7536, 1, 3072]
    - [485, 74.397]
  - - [1024, 7536, 1, 1024]
    - [41, 53.917]
  - - [1024, 7536, 1, 4096]
    - [97, 75.732]
  - - [4096, 7536, 1, 1024]
    - [316, 61.753]
  - - [1024, 7040, 1, 3072]
    - [271, 69.693]
  - - [1024, 7040, 1, 1024]
    - [311, 52.289]
  - - [1024, 7040, 1, 4096]
    - [1, 70.554]
  - - [4096, 7040, 1, 1024]
    - [37, 59.341]
  - - [1024, 6512, 1, 3072]
    - [41, 63.74]
  - - [1024, 6512, 1, 1024]
    - [10, 48.857]
  - - [1024, 6512, 1, 4096]
    - [97, 65.943]
  - - [4096, 6512, 1, 1024]
    - [37, 61.313]
  - - [1024, 6544, 1, 3072]
    - [271, 63.334]
  - - [1024, 6544, 1, 1024]
    - [41, 49.655]
  - - [1024, 6544, 1, 4096]
    - [10, 66.596]
  - - [4096, 6544, 1, 1024]
    - [1, 62.562]
  - - [1024, 5472, 1, 3072]
    - [391, 65.31]
  - - [1024, 5472, 1, 1024]
    - [62, 47.914]
  - - [1024, 5472, 1, 4096]
    - [90, 72.601]
  - - [4096, 5472, 1, 1024]
    - [1, 59.394]
  - - [1024, 7232, 1, 3072]
    - [1, 70.514]
  - - [1024, 7232, 1, 1024]
    - [24, 53.415]
  - - [1024, 7232, 1, 4096]
    - [74, 73.991]
  - - [4096, 7232, 1, 1024]
    - [26, 62.214]
  - - [1024, 6368, 1, 3072]
    - [24, 64.281]
  - - [1024, 6368, 1, 1024]
    - [59, 45.037]
  - - [1024, 6368, 1, 4096]
    - [257, 65.111]
  - - [4096, 6368, 1, 1024]
    - [539, 58.212]
  - - [1024, 6736, 1, 3072]
    - [37, 67.435]
  - - [1024, 6736, 1, 1024]
    - [24, 51.228]
  - - [1024, 6736, 1, 4096]
    - [201, 69.753]
  - - [4096, 6736, 1, 1024]
    - [26, 60.737]
  - - [1024, 7152, 1, 3072]
    - [41, 71.635]
  - - [1024, 7152, 1, 1024]
    - [229, 51.35]
  - - [1024, 7152, 1, 4096]
    - [97, 72.936]
  - - [4096, 7152, 1, 1024]
    - [1, 60.502]
  - - [1024, 5296, 1, 3072]
    - [418, 62.089]
  - - [1024, 5296, 1, 1024]
    - [166, 43.505]
  - - [1024, 5296, 1, 4096]
    - [388, 69.17]
  - - [4096, 5296, 1, 1024]
    - [237, 59.51]
  - - [1024, 5312, 1, 3072]
    - [497, 62.636]
  - - [1024, 5312, 1, 1024]
    - [62, 45.934]
  - - [1024, 5312, 1, 4096]
    - [392, 71.184]
  - - [4096, 5312, 1, 1024]
    - [37, 58.884]
  - - [1024, 8736, 1, 3072]
    - [328, 66.739]
  - - [1024, 8736, 1, 1024]
    - [527, 42.663]
  - - [1024, 8736, 1, 4096]
    - [86, 71.129]
  - - [4096, 8736, 1, 1024]
    - [37, 62.194]
  - - [1024, 5872, 1, 3072]
    - [6, 57.841]
  - - [1024, 5872, 1, 1024]
    - [24, 44.91]
  - - [1024, 5872, 1, 4096]
    - [35, 59.913]
  - - [4096, 5872, 1, 1024]
    - [237, 57.198]
  - - [1024, 6080, 1, 3072]
    - [41, 61.524]
  - - [1024, 6080, 1, 1024]
    - [41, 45.752]
  - - [1024, 6080, 1, 4096]
    - [15, 61.418]
  - - [4096, 6080, 1, 1024]
    - [103, 58.258]
  - - [1024, 6000, 1, 3072]
    - [379, 59.204]
  - - [1024, 6000, 1, 1024]
    - [15, 44.002]
  - - [1024, 6000, 1, 4096]
    - [485, 60.784]
  - - [4096, 6000, 1, 1024]
    - [15, 58.942]
  - - [1024, 6960, 1, 3072]
    - [97, 67.818]
  - - [1024, 6960, 1, 1024]
    - [10, 50.215]
  - - [1024, 6960, 1, 4096]
    - [26, 69.953]
  - - [4096, 6960, 1, 1024]
    - [93, 60.213]
  - - [1024, 6848, 1, 3072]
    - [97, 65.832]
  - - [1024, 6848, 1, 1024]
    - [237, 48.215]
  - - [1024, 6848, 1, 4096]
    - [534, 69.56]
  - - [4096, 6848, 1, 1024]
    - [194, 61.242]
  - - [1024, 5056, 1, 3072]
    - [540, 59.441]
  - - [1024, 5056, 1, 1024]
    - [223, 44.09]
  - - [1024, 5056, 1, 4096]
    - [166, 68.159]
  - - [4096, 5056, 1, 1024]
    - [24, 57.861]
  - - [1024, 8016, 1, 3072]
    - [62, 67.085]
  - - [1024, 8016, 1, 1024]
    - [62, 49.288]
  - - [1024, 8016, 1, 4096]
    - [62, 68.004]
  - - [4096, 8016, 1, 1024]
    - [237, 63.651]
  - - [1024, 6976, 1, 3072]
    - [41, 69.341]
  - - [1024, 6976, 1, 1024]
    - [15, 50.986]
  - - [1024, 6976, 1, 4096]
    - [97, 72.685]
  - - [4096, 6976, 1, 1024]
    - [527, 62.168]
  - - [1024, 5744, 1, 3072]
    - [194, 68.39]
  - - [1024, 5744, 1, 1024]
    - [194, 47.456]
  - - [1024, 5744, 1, 4096]
    - [166, 75.599]
  - - [4096, 5744, 1, 1024]
    - [418, 58.949]
  - - [1024, 5728, 1, 3072]
    - [90, 71.291]
  - - [1024, 5728, 1, 1024]
    - [194, 50.089]
  - - [1024, 5728, 1, 4096]
    - [194, 77.709]
  - - [4096, 5728, 1, 1024]
    - [418, 58.095]
  - - [1024, 5632, 1, 3072]
    - [106, 69.163]
  - - [1024, 5632, 1, 1024]
    - [90, 52.049]
  - - [1024, 5632, 1, 4096]
    - [93, 73.737]
  - - [4096, 5632, 1, 1024]
    - [107, 63.817]
  - - [1024, 6176, 1, 3072]
    - [24, 61.384]
  - - [1024, 6176, 1, 1024]
    - [41, 47.175]
  - - [1024, 6176, 1, 4096]
    - [381, 63.822]
  - - [4096, 6176, 1, 1024]
    - [374, 58.593]
  - - [1024, 5504, 1, 3072]
    - [106, 64.65]
  - - [1024, 5504, 1, 1024]
    - [385, 45.359]
  - - [1024, 5504, 1, 4096]
    - [527, 66.027]
  - - [4096, 5504, 1, 1024]
    - [145, 58.37]
  - - [1024, 5488, 1, 3072]
    - [106, 65.149]
  - - [1024, 5488, 1, 1024]
    - [62, 47.529]
  - - [1024, 5488, 1, 4096]
    - [223, 71.275]
  - - [4096, 5488, 1, 1024]
    - [24, 59.763]
  - - [1024, 5456, 1, 3072]
    - [90, 65.524]
  - - [1024, 5456, 1, 1024]
    - [62, 47.779]
  - - [1024, 5456, 1, 4096]
    - [418, 72.15]
  - - [4096, 5456, 1, 1024]
    - [15, 60.348]
  - - [1024, 6640, 1, 3072]
    - [37, 65.32]
  - - [1024, 6640, 1, 1024]
    - [229, 48.116]
  - - [1024, 6640, 1, 4096]
    - [39, 67.923]
  - - [4096, 6640, 1, 1024]
    - [147, 62.95]
  - - [1024, 7440, 1, 3072]
    - [97, 74.125]
  - - [1024, 7440, 1, 1024]
    - [97, 56.788]
  - - [1024, 7440, 1, 4096]
    - [39, 75.609]
  - - [4096, 7440, 1, 1024]
    - [226, 61.6]
  - - [1024, 6432, 1, 3072]
    - [186, 64.239]
  - - [1024, 6432, 1, 1024]
    - [311, 49.601]
  - - [1024, 6432, 1, 4096]
    - [311, 64.988]
  - - [4096, 6432, 1, 1024]
    - [109, 59.686]
  - - [1024, 6288, 1, 3072]
    - [186, 61.945]
  - - [1024, 6288, 1, 1024]
    - [27, 46.571]
  - - [1024, 6288, 1, 4096]
    - [536, 63.638]
  - - [4096, 6288, 1, 1024]
    - [145, 59.33]
  - - [1024, 4704, 1, 3072]
    - [328, 68.585]
  - - [1024, 4704, 1, 1024]
    - [157, 48.873]
  - - [1024, 4704, 1, 4096]
    - [157, 72.977]
  - - [4096, 4704, 1, 1024]
    - [50, 54.89]
  - - [1024, 6256, 1, 3072]
    - [41, 63.298]
  - - [1024, 6256, 1, 1024]
    - [147, 45.635]
  - - [1024, 6256, 1, 4096]
    - [24, 64.663]
  - - [4096, 6256, 1, 1024]
    - [237, 60.161]
  - - [1024, 7264, 1, 3072]
    - [41, 71.525]
  - - [1024, 7264, 1, 1024]
    - [41, 54.129]
  - - [1024, 7264, 1, 4096]
    - [531, 73.256]
  - - [4096, 7264, 1, 1024]
    - [237, 61.593]
  - - [1024, 6672, 1, 3072]
    - [24, 65.884]
  - - [1024, 6672, 1, 1024]
    - [97, 50.354]
  - - [1024, 6672, 1, 4096]
    - [381, 68.944]
  - - [4096, 6672, 1, 1024]
    - [26, 59.198]
  - - [1024, 6304, 1, 3072]
    - [97, 62.643]
  - - [1024, 6304, 1, 1024]
    - [26, 45.981]
  - - [1024, 6304, 1, 4096]
    - [15, 63.867]
  - - [4096, 6304, 1, 1024]
    - [147, 59.789]
  - - [1024, 5520, 1, 3072]
    - [418, 65.658]
  - - [1024, 5520, 1, 1024]
    - [62, 47.557]
  - - [1024, 5520, 1, 4096]
    - [223, 71.475]
  - - [4096, 5520, 1, 1024]
    - [237, 61.675]
  - - [1024, 6208, 1, 3072]
    - [24, 61.728]
  - - [1024, 6208, 1, 1024]
    - [24, 45.555]
  - - [1024, 6208, 1, 4096]
    - [147, 64.083]
  - - [4096, 6208, 1, 1024]
    - [100, 59.886]
  - - [1024, 4976, 1, 3072]
    - [527, 57.956]
  - - [1024, 4976, 1, 1024]
    - [427, 41.799]
  - - [1024, 4976, 1, 4096]
    - [223, 65.663]
  - - [4096, 4976, 1, 1024]
    - [237, 55.575]
  - - [1024, 5360, 1, 3072]
    - [168, 64.62]
  - - [1024, 5360, 1, 1024]
    - [418, 46.222]
  - - [1024, 5360, 1, 4096]
    - [223, 69.952]
  - - [4096, 5360, 1, 1024]
    - [1, 58.381]
  - - [1024, 5392, 1, 3072]
    - [385, 64.303]
  - - [1024, 5392, 1, 1024]
    - [166, 45.658]
  - - [1024, 5392, 1, 4096]
    - [418, 71.036]
  - - [4096, 5392, 1, 1024]
    - [237, 60.245]
  - - [1024, 5376, 1, 3072]
    - [541, 63.608]
  - - [1024, 5376, 1, 1024]
    - [223, 48.816]
  - - [1024, 5376, 1, 4096]
    - [93, 71.168]
  - - [4096, 5376, 1, 1024]
    - [24, 61.266]
  - - [1024, 5328, 1, 3072]
    - [106, 64.662]
  - - [1024, 5328, 1, 1024]
    - [194, 44.57]
  - - [1024, 5328, 1, 4096]
    - [418, 71.33]
  - - [4096, 5328, 1, 1024]
    - [15, 56.504]
  - - [1024, 6448, 1, 3072]
    - [15, 64.938]
  - - [1024, 6448, 1, 1024]
    - [97, 48.651]
  - - [1024, 6448, 1, 4096]
    - [201, 64.605]
  - - [4096, 6448, 1, 1024]
    - [24, 60.469]
  - - [1024, 5424, 1, 3072]
    - [106, 64.638]
  - - [1024, 5424, 1, 1024]
    - [194, 45.207]
  - - [1024, 5424, 1, 4096]
    - [453, 71.305]
  - - [4096, 5424, 1, 1024]
    - [237, 62.496]
  - - [1024, 6464, 1, 3072]
    - [37, 64.231]
  - - [1024, 6464, 1, 1024]
    - [311, 48.273]
  - - [1024, 6464, 1, 4096]
    - [534, 65.663]
  - - [4096, 6464, 1, 1024]
    - [24, 61.193]
  - - [1024, 7376, 1, 3072]
    - [37, 74.028]
  - - [1024, 7376, 1, 1024]
    - [41, 50.963]
  - - [1024, 7376, 1, 4096]
    - [534, 75.092]
  - - [4096, 7376, 1, 1024]
    - [35, 62.473]
  - - [1024, 5104, 1, 3072]
    - [62, 61.253]
  - - [1024, 5104, 1, 1024]
    - [166, 43.662]
  - - [1024, 5104, 1, 4096]
    - [542, 68.258]
  - - [4096, 5104, 1, 1024]
    - [145, 57.934]
  - - [1024, 6224, 1, 3072]
    - [24, 60.299]
  - - [1024, 6224, 1, 1024]
    - [145, 46.813]
  - - [1024, 6224, 1, 4096]
    - [74, 63.305]
  - - [4096, 6224, 1, 1024]
    - [237, 61.551]
  - - [1024, 6320, 1, 3072]
    - [186, 63.124]
  - - [1024, 6320, 1, 1024]
    - [24, 46.977]
  - - [1024, 6320, 1, 4096]
    - [531, 65.736]
  - - [4096, 6320, 1, 1024]
    - [26, 59.695]
  - - [1024, 8064, 1, 3072]
    - [385, 67.898]
  - - [1024, 8304, 1, 3072]
    - [62, 70.654]
  - - [1024, 8304, 1, 1024]
    - [62, 52.811]
  - - [1024, 8304, 1, 4096]
    - [67, 68.6]
  - - [4096, 8304, 1, 1024]
    - [145, 64.041]
  - - [1024, 6560, 1, 3072]
    - [37, 66.413]
  - - [1024, 6560, 1, 1024]
    - [311, 47.904]
  - - [1024, 6560, 1, 4096]
    - [257, 66.717]
  - - [4096, 6560, 1, 1024]
    - [237, 61.881]
  - - [1024, 5856, 1, 3072]
    - [379, 56.797]
  - - [1024, 5856, 1, 1024]
    - [113, 42.567]
  - - [1024, 5856, 1, 4096]
    - [412, 59.466]
  - - [4096, 5856, 1, 1024]
    - [37, 58.168]
  - - [1024, 6496, 1, 3072]
    - [97, 66.404]
  - - [1024, 6496, 1, 1024]
    - [229, 48.144]
  - - [1024, 6496, 1, 4096]
    - [15, 67.905]
  - - [4096, 6496, 1, 1024]
    - [100, 61.371]
  - - [1024, 5696, 1, 3072]
    - [392, 65.209]
  - - [1024, 5696, 1, 1024]
    - [90, 46.833]
  - - [1024, 5696, 1, 4096]
    - [418, 74.133]
  - - [4096, 5696, 1, 1024]
    - [532, 57.909]
  - - [1024, 6144, 1, 3072]
    - [18, 61.317]
  - - [1024, 7504, 1, 3072]
    - [531, 75.098]
  - - [1024, 7504, 1, 1024]
    - [97, 56.796]
  - - [1024, 7504, 1, 4096]
    - [102, 76.885]
  - - [4096, 7504, 1, 1024]
    - [1, 65.783]
  - - [1024, 6096, 1, 3072]
    - [97, 60.632]
  - - [1024, 6096, 1, 1024]
    - [113, 46.469]
  - - [1024, 6096, 1, 4096]
    - [24, 63.651]
  - - [4096, 6096, 1, 1024]
    - [15, 58.648]
  - - [1024, 4880, 1, 3072]
    - [543, 57.44]
  - - [1024, 4880, 1, 1024]
    - [62, 43.76]
  - - [1024, 4880, 1, 4096]
    - [168, 63.939]
  - - [4096, 4880, 1, 1024]
    - [19, 52.339]
  - - [1024, 7168, 1, 3072]
    - [379, 71.224]
  - - [1024, 7168, 1, 1024]
    - [10, 53.333]
  - - [1024, 7168, 1, 4096]
    - [531, 73.577]
  - - [4096, 7168, 1, 1024]
    - [1, 63.577]
  - - [1024, 7776, 1, 3072]
    - [62, 65.507]
  - - [1024, 7776, 1, 1024]
    - [427, 49.654]
  - - [1024, 7776, 1, 4096]
    - [119, 64.473]
  - - [4096, 7776, 1, 1024]
    - [100, 60.202]
  - - [1024, 6384, 1, 3072]
    - [41, 63.41]
  - - [1024, 6384, 1, 1024]
    - [113, 47.64]
  - - [1024, 6384, 1, 4096]
    - [536, 65.871]
  - - [4096, 6384, 1, 1024]
    - [18, 57.739]
  - - [1024, 5712, 1, 3072]
    - [106, 67.892]
  - - [1024, 5712, 1, 1024]
    - [90, 49.02]
  - - [1024, 5712, 1, 4096]
    - [168, 75.008]
  - - [4096, 5712, 1, 1024]
    - [130, 58.332]
  - - [1024, 4624, 1, 3072]
    - [245, 63.685]
  - - [1024, 4624, 1, 1024]
    - [171, 42.959]
  - - [1024, 4624, 1, 4096]
    - [487, 63.342]
  - - [4096, 4624, 1, 1024]
    - [3, 54.436]
  - - [1024, 7488, 1, 3072]
    - [381, 73.373]
  - - [1024, 7488, 1, 1024]
    - [24, 55.706]
  - - [1024, 7488, 1, 4096]
    - [6, 76.154]
  - - [4096, 7488, 1, 1024]
    - [237, 61.797]
  - - [1024, 7472, 1, 3072]
    - [381, 75.249]
  - - [1024, 7472, 1, 1024]
    - [97, 55.971]
  - - [1024, 7472, 1, 4096]
    - [200, 76.956]
  - - [4096, 7472, 1, 1024]
    - [35, 62.684]
  - - [1024, 6576, 1, 3072]
    - [24, 64.895]
  - - [1024, 6576, 1, 1024]
    - [10, 47.416]
  - - [1024, 6576, 1, 4096]
    - [18, 68.239]
  - - [4096, 6576, 1, 1024]
    - [35, 62.131]
  - - [1024, 6928, 1, 3072]
    - [531, 68.185]
  - - [1024, 6928, 1, 1024]
    - [24, 51.348]
  - - [1024, 6928, 1, 4096]
    - [534, 71.011]
  - - [4096, 6928, 1, 1024]
    - [194, 63.782]
  - - [1024, 6864, 1, 3072]
    - [15, 66.713]
  - - [1024, 6864, 1, 1024]
    - [24, 50.761]
  - - [1024, 6864, 1, 4096]
    - [97, 70.905]
  - - [4096, 6864, 1, 1024]
    - [527, 61.602]
  - - [1024, 5792, 1, 3072]
    - [78, 57.846]
  - - [1024, 5792, 1, 1024]
    - [113, 43.731]
  - - [1024, 5792, 1, 4096]
    - [74, 59.571]
  - - [4096, 5792, 1, 1024]
    - [26, 58.554]
  - - [1024, 6704, 1, 3072]
    - [186, 66.744]
  - - [1024, 6704, 1, 1024]
    - [26, 51.645]
  - - [1024, 6704, 1, 4096]
    - [15, 69.984]
  - - [4096, 6704, 1, 1024]
    - [392, 60.102]
  - - [1024, 6800, 1, 3072]
    - [24, 68.626]
  - - [1024, 6800, 1, 1024]
    - [24, 49.481]
  - - [1024, 6800, 1, 4096]
    - [544, 69.841]
  - - [4096, 6800, 1, 1024]
    - [392, 60.947]
  - - [1024, 6016, 1, 3072]
    - [97, 59.415]
  - - [1024, 6016, 1, 1024]
    - [26, 45.429]
  - - [1024, 6016, 1, 4096]
    - [130, 61.249]
  - - [4096, 6016, 1, 1024]
    - [15, 57.757]
  - - [1024, 6880, 1, 3072]
    - [186, 68.101]
  - - [1024, 6880, 1, 1024]
    - [229, 50.031]
  - - [1024, 6880, 1, 4096]
    - [201, 70.987]
  - - [4096, 6880, 1, 1024]
    - [168, 59.407]
  - - [1024, 11248, 1, 3072]
    - [223, 75.877]
  - - [1024, 11248, 1, 1024]
    - [119, 55.008]
  - - [1024, 11248, 1, 4096]
    - [41, 80.755]
  - - [4096, 11248, 1, 1024]
    - [26, 66.459]
