library/src/blas3/Tensile/Logic/asm_full/arcturus_Cijk_Ailk_Bljk_SB.yaml
- {MinimumRequiredVersion: 4.20.0}
- arcturus
- gfx908
- [Device 7380, Device 7388, Device 738c, Device 7390]
    SolutionIndex: 0
    SolutionNameMin: Cijk_Ailk_Bljk_SB_MT64x64x16_MI32x32x2x1_SE_1LDSB0_AF0EM1_AMAS0_BL1_DTL0_DVO0_EPS0_FL0_GRVW4_GSU1_ISA908_IU1_KLA_LBSPP128_LPB4_LRVW2_MAC_NLCA1_NLCB1_ONLL1_PGR2_PLR9_SIA3_SU0_SUS256_SRVW2_SNLL0_TT1_32_TLDS1_USFGROn1_VSn1_VW1_WSGRA1_WSGRB1_WG64_4_1_WGM1
    SolutionIndex: 1
    SolutionNameMin: Cijk_Ailk_Bljk_SB_MT64x16x16_MI16x16x4x1_SE_1LDSB0_AF0EM1_AMAS0_BL1_DTL0_DVO0_EPS0_FL0_GRVW1_GSU1_ISA908_IU1_KLA_LBSPP128_LPB2_LRVW2_MAC_NLCA1_NLCB1_ONLL1_PGR2_PLR5_SIA3_SU0_SUS256_SRVW2_SNLL0_TT1_16_TLDS1_USFGROn1_VSn1_VW1_WSGRA1_WSGRB1_WG64_4_1_WGM2
    SolutionIndex: 2
    SolutionNameMin: Cijk_Ailk_Bljk_SB_MT64x64x16_MI16x16x4x1_SE_1LDSB0_AF0EM1_AMAS3_BL1_DTL0_DVO1_EPS1_FL1_GRVW4_GSU1_ISA908_IU1_KLA_LBSPP0_LPB0_LRVW1_MAC_NLCA1_NLCB1_ONLL1_PGR1_PLR1_SIA1_SU32_SUS256_SRVW4_SNLL0_TT4_16_TLDS1_USFGROn1_VSn1_VW4_WSGRA0_WSGRB0_WG16_16_1_WGM8
    SolutionIndex: 3
    SolutionNameMin: Cijk_Ailk_Bljk_SB_MT64x64x16_SN_1LDSB0_AF0EM1_AMAS3_BL1_DTL0_DVO0_EPS1_FL0_GRVW4_GSU1_ISA908_IU1_KLA_LBSPP0_LPB0_LRVW4_MAC_NLCA1_NLCB1_ONLL1_PGR1_PLR1_SIA1_SU32_SUS256_SRVW0_SNLL0_TT4_4_TLDS0_USFGRO0_VS1_VW4_WSGRA0_WSGRB0_WG16_16_1_WGM1
    SolutionIndex: 4
    SolutionNameMin: Cijk_Ailk_Bljk_SB_MT128x96x16_MI32x32x2x1_SE_1LDSB0_AF0EM1_AMAS0_BL1_DTL0_DVO0_EPS1_FL0_GRVW1_GSU1_ISA908_IU1_KLA_LBSPP128_LPB2_LRVW2_MAC_NLCA2_NLCB1_ONLL1_PGR1_PLR9_SIA3_SU0_SUS256_SRVW2_SNLL0_TT1_96_TLDS1_USFGROn1_VSn1_VW1_WSGRA1_WSGRB1_WG128_2_1_WGM15
    SolutionIndex: 5
    SolutionNameMin: Cijk_Ailk_Bljk_SB_MT128x144x16_MI16x16x4x1_SE_1LDSB1_AF0EM1_AMAS0_BL1_DTL0_DVO0_EPS1_FL0_GRVW1_GSU1_ISA908_IU1_KLA_LBSPP128_LPB2_LRVW2_MAC_NLCA2_NLCB1_ONLL1_PGR1_PLR5_SIA3_SU0_SUS256_SRVW2_SNLL0_TT2_144_TLDS1_USFGROn1_VSn1_VW1_WSGRA1_WSGRB1_WG64_4_1_WGM15
    SolutionIndex: 6
    SolutionNameMin: Cijk_Ailk_Bljk_SB_MT128x144x16_MI16x16x4x1_SN_1LDSB1_AF0EM1_AMAS0_BL1_DTL0_DVO0_EPS1_FL0_GRVW1_GSU1_ISA908_IU1_KLA_LBSPP128_LPB2_LRVW2_MAC_NLCA2_NLCB1_ONLL1_PGR1_PLR5_SIA3_SU32_SUS256_SRVW2_SNLL0_TT2_144_TLDS1_USFGROn1_VSn1_VW1_WSGRA1_WSGRB1_WG64_4_1_WGM15
    SolutionIndex: 7
    SolutionNameMin: Cijk_Ailk_Bljk_SB_MT64x128x16_MI32x32x2x1_SN_1LDSB0_AF0EM1_AMAS0_BL1_DTL0_DVO0_EPS0_FL0_GRVW2_GSU1_ISA908_IU1_KLA_LBSPP128_LPB2_LRVW2_MAC_NLCA1_NLCB1_ONLL1_PGR2_PLR9_SIA3_SU32_SUS256_SRVW2_SNLL0_TT1_64_TLDS1_USFGROn1_VSn1_VW1_WSGRA1_WSGRB1_WG64_4_1_WGM2
    SolutionIndex: 8
    SolutionNameMin: Cijk_Ailk_Bljk_SB_MT64x64x16_MI16x16x4x1_SE_1LDSB0_AF0EM1_AMAS3_BL1_DTL0_DVO0_EPS1_FL0_GRVW1_GSU1_ISA908_IU1_KLA_LBSPP0_LPB0_LRVW1_MAC_NLCA1_NLCB1_ONLL1_PGR1_PLR1_SIA3_SU32_SUS256_SRVW0_SNLL0_TT4_16_TLDS1_USFGROn1_VSn1_VW4_WSGRA1_WSGRB1_WG16_16_1_WGM8
    SolutionIndex: 9
    SolutionNameMin: Cijk_Ailk_Bljk_SB_MT96x96x32_MI16x16x4x1_SE_1LDSB1_AF0EM1_AMAS0_BL1_DTL0_DVO0_EPS1_FL0_GRVW4_GSU1_ISA908_IU1_KLA_LBSPP128_LPB4_LRVW2_MAC_NLCA3_NLCB1_ONLL1_PGR1_PLR9_SIA3_SU32_SUS256_SRVW0_SNLL0_TT3_48_TLDS1_USFGROn1_VSn1_VW1_WSGRA1_WSGRB1_WG32_8_1_WGM2
    SolutionIndex: 10
    SolutionNameMin: Cijk_Ailk_Bljk_SB_MT128x144x16_MI16x16x4x1_SE_1LDSB1_AF0EM1_AMAS0_BL1_DTL0_DVO0_EPS0_FL0_GRVW1_GSU1_ISA908_IU1_KLA_LBSPP128_LPB2_LRVW2_MAC_NLCA2_NLCB1_ONLL1_PGR2_PLR5_SIA3_SU0_SUS256_SRVW2_SNLL0_TT2_144_TLDS1_USFGROn1_VSn1_VW1_WSGRA1_WSGRB1_WG64_4_1_WGM15
    SolutionIndex: 11
    SolutionNameMin: Cijk_Ailk_Bljk_SB_MT64x128x32_MI32x32x2x1_SE_1LDSB0_AF0EM1_AMAS0_BL1_DTL0_DVO0_EPS0_FL0_GRVW2_GSU1_ISA908_IU1_KLA_LBSPP128_LPB2_LRVW2_MAC_NLCA1_NLCB1_ONLL1_PGR2_PLR17_SIA3_SU0_SUS256_SRVW2_SNLL0_TT1_64_TLDS1_USFGROn1_VSn1_VW1_WSGRA1_WSGRB1_WG64_4_1_WGM15
    SolutionIndex: 12
    SolutionNameMin: Cijk_Ailk_Bljk_SB_MT128x144x16_MI16x16x4x1_SE_1LDSB1_AF0EM1_AMAS0_BL1_DTL0_DVO0_EPS0_FL0_GRVW1_GSU1_ISA908_IU1_KLA_LBSPP128_LPB2_LRVW2_MAC_NLCA2_NLCB1_ONLL1_PGR2_PLR5_SIA3_SU0_SUS256_SRVW2_SNLL0_TT2_144_TLDS1_USFGROn1_VSn1_VW1_WSGRA1_WSGRB1_WG64_4_1_WGM2
    SolutionIndex: 13
    SolutionNameMin: Cijk_Ailk_Bljk_SB_MT64x64x32_MI32x32x2x1_SE_1LDSB0_AF0EM1_AMAS0_BL1_DTL0_DVO0_EPS0_FL0_GRVW2_GSU1_ISA908_IU1_KLA_LBSPP128_LPB2_LRVW2_MAC_NLCA1_NLCB1_ONLL1_PGR2_PLR17_SIA3_SU0_SUS256_SRVW2_SNLL0_TT1_32_TLDS1_USFGROn1_VSn1_VW1_WSGRA1_WSGRB1_WG64_4_1_WGM15
    SolutionIndex: 14
    SolutionNameMin: Cijk_Ailk_Bljk_SB_MT64x64x16_SN_1LDSB0_AF0EM1_AMAS3_BL1_DTL0_DVO0_EPS0_FL0_GRVW4_GSU1_ISA908_IU1_KLA_LBSPP0_LPB0_LRVW4_MAC_NLCA1_NLCB1_ONLL1_PGR0_PLR1_SIA1_SU32_SUS256_SRVW0_SNLL0_TT4_4_TLDS0_USFGRO0_VS1_VW4_WSGRA0_WSGRB0_WG16_16_1_WGM8
    SolutionIndex: 15
    SolutionNameMin: Cijk_Ailk_Bljk_SB_MT64x128x16_MI32x32x2x1_SE_1LDSB0_AF0EM1_AMAS0_BL1_DTL0_DVO0_EPS0_FL0_GRVW1_GSU1_ISA908_IU1_KLA_LBSPP128_LPB2_LRVW2_MAC_NLCA1_NLCB1_ONLL1_PGR2_PLR9_SIA3_SU0_SUS256_SRVW2_SNLL0_TT1_64_TLDS1_USFGROn1_VSn1_VW1_WSGRA1_WSGRB1_WG64_4_1_WGM15
    SolutionIndex: 16
    SolutionNameMin: Cijk_Ailk_Bljk_SB_MT96x96x16_MI16x16x4x1_SN_1LDSB1_AF0EM1_AMAS0_BL1_DTL0_DVO0_EPS0_FL0_GRVW2_GSU1_ISA908_IU1_KLA_LBSPP128_LPB2_LRVW2_MAC_NLCA3_NLCB1_ONLL1_PGR2_PLR5_SIA3_SU32_SUS256_SRVW0_SNLL0_TT3_48_TLDS1_USFGROn1_VSn1_VW1_WSGRA1_WSGRB1_WG32_8_1_WGM15
    SolutionIndex: 17
    SolutionNameMin: Cijk_Ailk_Bljk_SB_MT64x128x32_MI32x32x2x1_SE_1LDSB0_AF0EM1_AMAS0_BL1_DTL0_DVO0_EPS0_FL0_GRVW4_GSU1_ISA908_IU1_KLA_LBSPP128_LPB4_LRVW2_MAC_NLCA1_NLCB1_ONLL1_PGR2_PLR17_SIA3_SU0_SUS256_SRVW2_SNLL0_TT1_64_TLDS1_USFGROn1_VSn1_VW1_WSGRA1_WSGRB1_WG64_4_1_WGM1
    SolutionIndex: 18
    SolutionNameMin: Cijk_Ailk_Bljk_SB_MT64x32x32_MI16x16x4x1_SE_1LDSB0_AF0EM1_AMAS0_BL1_DTL0_DVO0_EPS1_FL0_GRVW4_GSU1_ISA908_IU1_KLA_LBSPP0_LPB0_LRVW1_MAC_NLCA1_NLCB1_ONLL1_PGR1_PLR1_SIA3_SU32_SUS256_SRVW0_SNLL0_TT2_16_TLDS1_USFGROn1_VSn1_VW1_WSGRA1_WSGRB1_WG32_8_1_WGM8
    SolutionIndex: 19
    SolutionNameMin: Cijk_Ailk_Bljk_SB_MT64x64x32_MI32x32x2x1_SE_1LDSB0_AF0EM1_AMAS0_BL1_DTL0_DVO0_EPS0_FL0_GRVW1_GSU1_ISA908_IU1_KLA_LBSPP128_LPB2_LRVW2_MAC_NLCA1_NLCB1_ONLL1_PGR2_PLR17_SIA3_SU32_SUS128_SRVW2_SNLL0_TT1_32_TLDS1_USFGROn1_VSn1_VW1_WSGRA1_WSGRB1_WG64_4_1_WGM1
    SolutionIndex: 20
    SolutionNameMin: Cijk_Ailk_Bljk_SB_MT64x128x16_MI32x32x2x1_SE_1LDSB0_AF0EM1_AMAS0_BL1_DTL0_DVO0_EPS0_FL0_GRVW4_GSU1_ISA908_IU1_KLA_LBSPP128_LPB4_LRVW2_MAC_NLCA1_NLCB1_ONLL1_PGR2_PLR9_SIA3_SU32_SUS128_SRVW2_SNLL0_TT1_64_TLDS1_USFGROn1_VSn1_VW1_WSGRA1_WSGRB1_WG64_4_1_WGM1
    SolutionIndex: 21
    SolutionNameMin: Cijk_Ailk_Bljk_SB_MT96x96x32_MI16x16x4x1_SE_1LDSB1_AF0EM1_AMAS0_BL1_DTL0_DVO0_EPS1_FL0_GRVW4_GSU1_ISA908_IU1_KLA_LBSPP128_LPB4_LRVW2_MAC_NLCA3_NLCB1_ONLL1_PGR1_PLR9_SIA3_SU32_SUS256_SRVW0_SNLL0_TT3_48_TLDS1_USFGROn1_VSn1_VW1_WSGRA1_WSGRB1_WG32_8_1_WGM1
    SolutionIndex: 22
    SolutionNameMin: Cijk_Ailk_Bljk_SB_MT64x128x32_MI32x32x2x1_SE_1LDSB0_AF0EM1_AMAS0_BL1_DTL0_DVO0_EPS0_FL0_GRVW4_GSU1_ISA908_IU1_KLA_LBSPP128_LPB4_LRVW2_MAC_NLCA1_NLCB1_ONLL1_PGR2_PLR17_SIA3_SU0_SUS256_SRVW2_SNLL0_TT1_64_TLDS1_USFGROn1_VSn1_VW1_WSGRA1_WSGRB1_WG64_4_1_WGM2
    SolutionIndex: 23
    SolutionNameMin: Cijk_Ailk_Bljk_SB_MT64x128x16_MI16x16x4x1_SE_1LDSB0_AF0EM1_AMAS3_BL1_DTL0_DVO0_EPS1_FL1_GRVW4_GSU1_ISA908_IU1_KLA_LBSPP0_LPB0_LRVW1_MAC_NLCA1_NLCB1_ONLL2_PGR1_PLR1_SIA3_SU32_SUS256_SRVW4_SNLL0_TT4_32_TLDS1_USFGROn1_VSn1_VW4_WSGRA0_WSGRB0_WG16_16_1_WGM1
    SolutionIndex: 24
    SolutionNameMin: Cijk_Ailk_Bljk_SB_MT96x96x16_MI16x16x4x1_SE_1LDSB1_AF0EM1_AMAS0_BL1_DTL0_DVO0_EPS0_FL0_GRVW2_GSU1_ISA908_IU1_KLA_LBSPP128_LPB2_LRVW2_MAC_NLCA3_NLCB1_ONLL1_PGR2_PLR5_SIA3_SU0_SUS256_SRVW0_SNLL0_TT3_48_TLDS1_USFGROn1_VSn1_VW1_WSGRA1_WSGRB1_WG32_8_1_WGM15
    SolutionIndex: 25
    SolutionNameMin: Cijk_Ailk_Bljk_SB_MT64x128x16_MI32x32x2x1_SE_1LDSB0_AF0EM1_AMAS0_BL1_DTL0_DVO0_EPS0_FL0_GRVW4_GSU1_ISA908_IU1_KLA_LBSPP128_LPB4_LRVW2_MAC_NLCA1_NLCB1_ONLL1_PGR2_PLR9_SIA3_SU0_SUS256_SRVW2_SNLL0_TT1_64_TLDS1_USFGROn1_VSn1_VW1_WSGRA1_WSGRB1_WG64_4_1_WGM1
    SolutionIndex: 26
    SolutionNameMin: Cijk_Ailk_Bljk_SB_MT64x128x16_MI32x32x2x1_SE_1LDSB0_AF0EM1_AMAS0_BL1_DTL0_DVO0_EPS0_FL0_GRVW2_GSU1_ISA908_IU1_KLA_LBSPP128_LPB2_LRVW2_MAC_NLCA1_NLCB1_ONLL1_PGR2_PLR9_SIA3_SU32_SUS256_SRVW2_SNLL0_TT1_64_TLDS1_USFGROn1_VSn1_VW1_WSGRA1_WSGRB1_WG64_4_1_WGM2
    SolutionIndex: 27
    SolutionNameMin: Cijk_Ailk_Bljk_SB_MT128x64x16_SN_1LDSB0_AF0EM1_AMAS3_BL1_DTL0_DVO0_EPS0_FL0_GRVW4_GSU1_ISA908_IU1_KLA_LBSPP0_LPB0_LRVW4_MAC_NLCA1_NLCB1_ONLL1_PGR0_PLR1_SIA1_SU32_SUS256_SRVW0_SNLL0_TT8_4_TLDS0_USFGRO0_VS1_VW4_WSGRA0_WSGRB0_WG16_16_1_WGM8
    SolutionIndex: 28
    SolutionNameMin: Cijk_Ailk_Bljk_SB_MT64x32x16_MI16x16x4x1_SE_1LDSB0_AF0EM1_AMAS0_BL1_DTL0_DVO0_EPS0_FL0_GRVW1_GSU1_ISA908_IU1_KLA_LBSPP128_LPB2_LRVW2_MAC_NLCA1_NLCB1_ONLL1_PGR2_PLR5_SIA3_SU0_SUS256_SRVW2_SNLL0_TT2_16_TLDS1_USFGROn1_VSn1_VW1_WSGRA1_WSGRB1_WG32_8_1_WGM1
    SolutionIndex: 29
    SolutionNameMin: Cijk_Ailk_Bljk_SB_MT64x64x8_SE_1LDSB0_AF0EM1_AMAS3_BL1_DTL0_DVO0_EPS1_FL1_GRVW2_GSU1_ISA908_IU1_KLA_LBSPP0_LPB2_LRVW2_MAC_NLCA1_NLCB1_ONLL1_PGR1_PLR1_SIA1_SU32_SUS256_SRVW0_SNLL1_TT4_4_TLDS0_USFGRO0_VS1_VW2_WSGRA0_WSGRB0_WG16_16_1_WGM16
    SolutionIndex: 30
    SolutionNameMin: Cijk_Ailk_Bljk_SB_MT64x32x8_SE_1LDSB0_AF0EM1_AMAS3_BL1_DTL0_DVO0_EPS1_FL1_GRVW4_GSU1_ISA908_IU1_KLA_LBSPP0_LPB4_LRVW4_MAC_NLCA1_NLCB1_ONLL1_PGR1_PLR0_SIA1_SU32_SUS256_SRVW0_SNLL0_TT4_4_TLDS0_USFGRO0_VS1_VW4_WSGRA0_WSGRB0_WG16_8_1_WGM1
    SolutionIndex: 31
    SolutionNameMin: Cijk_Ailk_Bljk_SB_MT16x8x32_SE_1LDSB0_AF0EM1_AMAS3_BL1_DTL0_DVO0_EPS1_FL1_GRVW2_GSU1_ISA908_IU1_KLA_LBSPP0_LPB2_LRVW2_MAC_NLCA1_NLCB1_ONLL1_PGR1_PLR1_SIA1_SU32_SUS256_SRVW0_SNLL1_TT2_2_TLDS0_USFGRO0_VS1_VW2_WSGRA0_WSGRB0_WG8_4_4_WGM1
    SolutionIndex: 32
    SolutionNameMin: Cijk_Ailk_Bljk_SB_MT16x32x32_SE_1LDSB0_AF0EM1_AMAS3_BL1_DTL0_DVO0_EPS0_FL1_GRVW2_GSU1_ISA908_IU1_KLA_LBSPP0_LPB2_LRVW2_MAC_NLCA1_NLCB1_ONLL1_PGR0_PLR1_SIA1_SU32_SUS256_SRVW0_SNLL0_TT2_4_TLDS0_USFGRO0_VS1_VW2_WSGRA0_WSGRB0_WG8_8_4_WGM1
    SolutionIndex: 33
    SolutionNameMin: Cijk_Ailk_Bljk_SB_MT64x16x16_MI16x16x4x1_SE_1LDSB0_AF0EM1_AMAS0_BL1_DTL0_DVO0_EPS0_FL0_GRVW1_GSU1_ISA908_IU1_KLA_LBSPP128_LPB2_LRVW2_MAC_NLCA1_NLCB1_ONLL1_PGR2_PLR5_SIA3_SU0_SUS256_SRVW2_SNLL0_TT1_16_TLDS1_USFGROn1_VSn1_VW1_WSGRA1_WSGRB1_WG64_4_1_WGM1
    SolutionIndex: 34
    SolutionNameMin: Cijk_Ailk_Bljk_SB_MT32x64x16_MI16x16x4x1_SE_1LDSB0_AF0EM1_AMAS0_BL1_DTL0_DVO0_EPS1_FL0_GRVW1_GSU1_ISA908_IU1_KLA_LBSPP0_LPB0_LRVW1_MAC_NLCA1_NLCB1_ONLL1_PGR1_PLR1_SIA3_SU32_SUS256_SRVW0_SNLL0_TT2_16_TLDS1_USFGROn1_VSn1_VW1_WSGRA1_WSGRB1_WG16_16_1_WGM8
    SolutionIndex: 35
    SolutionNameMin: Cijk_Ailk_Bljk_SB_MT16x16x16_SE_1LDSB0_AF0EM1_AMAS3_BL1_DTL0_DVO0_EPS0_FL1_GRVW2_GSU1_ISA908_IU1_KLA_LBSPP0_LPB2_LRVW2_MAC_NLCA1_NLCB1_ONLL1_PGR0_PLR1_SIA1_SU32_SUS256_SRVW0_SNLL0_TT2_2_TLDS0_USFGRO0_VS1_VW2_WSGRA0_WSGRB0_WG8_8_2_WGM1
    SolutionIndex: 36
    SolutionNameMin: Cijk_Ailk_Bljk_SB_MT16x16x32_MI16x16x4x1_SE_1LDSB0_AF0EM1_AMAS0_BL1_DTL0_DVO0_EPS0_FL0_GRVW4_GSU1_ISA908_IU1_KLA_LBSPP128_LPB4_LRVW2_MAC_NLCA1_NLCB1_ONLL1_PGR2_PLR9_SIA3_SU32_SUS128_SRVW0_SNLL0_TT1_16_TLDS1_USFGROn1_VSn1_VW1_WSGRA1_WSGRB1_WG16_4_1_WGM2
    SolutionIndex: 37
    SolutionNameMin: Cijk_Ailk_Bljk_SB_MT32x32x32_MI16x16x4x1_SE_1LDSB0_AF0EM1_AMAS0_BL1_DTL0_DVO0_EPS0_FL0_GRVW4_GSU1_ISA908_IU1_KLA_LBSPP128_LPB4_LRVW2_MAC_NLCA1_NLCB1_ONLL1_PGR2_PLR9_SIA3_SU0_SUS256_SRVW2_SNLL0_TT1_16_TLDS1_USFGROn1_VSn1_VW1_WSGRA1_WSGRB1_WG32_8_1_WGM1
    SolutionIndex: 38
    SolutionNameMin: Cijk_Ailk_Bljk_SB_MT32x32x32_MI16x16x4x1_SE_1LDSB0_AF0EM1_AMAS0_BL1_DTL0_DVO0_EPS0_FL0_GRVW4_GSU1_ISA908_IU2_KLA_LBSPP128_LPB4_LRVW2_MAC_NLCA1_NLCB1_ONLL1_PGR2_PLR5_SIA3_SU0_SUS256_SRVW2_SNLL0_TT1_16_TLDS1_USFGROn1_VSn1_VW1_WSGRA1_WSGRB1_WG32_8_1_WGM8
    SolutionIndex: 39
    SolutionNameMin: Cijk_Ailk_Bljk_SB_MT16x16x32_MI16x16x4x1_SE_1LDSB0_AF0EM1_AMAS0_BL1_DTL0_DVO0_EPS0_FL0_GRVW4_GSU1_ISA908_IU1_KLA_LBSPP128_LPB4_LRVW2_MAC_NLCA1_NLCB1_ONLL1_PGR2_PLR9_SIA3_SU32_SUS256_SRVW0_SNLL0_TT1_16_TLDS1_USFGROn1_VSn1_VW1_WSGRA1_WSGRB1_WG16_4_1_WGM1
    SolutionIndex: 40
    SolutionNameMin: Cijk_Ailk_Bljk_SB_MT32x32x32_MI16x16x4x1_SN_1LDSB0_AF0EM1_AMAS0_BL1_DTL0_DVO0_EPS0_FL0_GRVW4_GSU1_ISA908_IU1_KLA_LBSPP128_LPB4_LRVW2_MAC_NLCA1_NLCB1_ONLL1_PGR2_PLR9_SIA3_SU32_SUS256_SRVW2_SNLL0_TT1_16_TLDS1_USFGROn1_VSn1_VW1_WSGRA1_WSGRB1_WG32_8_1_WGM2
    SolutionIndex: 41
    SolutionNameMin: Cijk_Ailk_Bljk_SB_MT64x16x16_SE_1LDSB0_AF0EM1_AMAS0_BL1_DTL0_DVO0_EPS0_FL0_GRVW1_GSU1_ISA908_IU1_KLA_LBSPP0_LPB0_LRVW1_MAC_NLCA1_NLCB1_ONLL1_PGR0_PLR1_SIA1_SU32_SUS256_SRVW0_SNLL0_TT4_2_TLDS0_USFGRO1_VS1_VW1_WSGRA0_WSGRB0_WG16_8_1_WGM1
    SolutionIndex: 42
    SolutionNameMin: Cijk_Ailk_Bljk_SB_MT64x32x32_MI16x16x4x1_SE_1LDSB0_AF0EM1_AMAS0_BL1_DTL0_DVO0_EPS0_FL0_GRVW4_GSU1_ISA908_IU1_KLA_LBSPP128_LPB4_LRVW2_MAC_NLCA1_NLCB1_ONLL1_PGR2_PLR9_SIA3_SU32_SUS256_SRVW2_SNLL0_TT2_16_TLDS1_USFGROn1_VSn1_VW1_WSGRA1_WSGRB1_WG32_8_1_WGM2
    SolutionIndex: 43
    SolutionNameMin: Cijk_Ailk_Bljk_SB_MT32x16x16_SN_1LDSB0_AF0EM1_AMAS3_BL1_DTL0_DVO0_EPS1_FL0_GRVW2_GSU4_ISA908_IU1_KLA_LBSPP0_LPB0_LRVW2_MAC_NLCA1_NLCB1_ONLL1_PGR1_PLR1_SIA1_SU32_SUS256_SRVW0_SNLL0_TT4_2_TLDS0_USFGRO0_VS1_VW2_WSGRA0_WSGRB0_WG8_8_4_WGM1
    SolutionIndex: 44
    SolutionNameMin: Cijk_Ailk_Bljk_SB_MT32x32x32_MI16x16x4x1_SE_1LDSB0_AF0EM1_AMAS0_BL1_DTL0_DVO0_EPS0_FL0_GRVW1_GSU1_ISA908_IU1_KLA_LBSPP128_LPB2_LRVW2_MAC_NLCA1_NLCB1_ONLL1_PGR2_PLR9_SIA3_SU32_SUS128_SRVW2_SNLL0_TT1_16_TLDS1_USFGROn1_VSn1_VW1_WSGRA1_WSGRB1_WG32_8_1_WGM1
    SolutionIndex: 45
    SolutionNameMin: Cijk_Ailk_Bljk_SB_MT32x16x8_SN_1LDSB0_AF0EM1_AMAS2_BL0_DTL0_DVO0_EPS0_FL0_GRVW2_GSU1_ISA000_IU1_KLS_LBSPP0_LPB0_LRVW2_FMA_NLCA1_NLCB1_ONLL1_PGR1_PLR1_SIA1_SU32_SUS256_SRVW0_SNLL0_TT2_2_TLDS0_USFGRO0_VS1_VW2_WSGRA0_WSGRB0_WG16_8_1_WGM1
    SolutionIndex: 46
    SolutionNameMin: Cijk_Ailk_Bljk_SB_MT32x8x32_SE_1LDSB0_AF0EM1_AMAS3_BL1_DTL0_DVO0_EPS1_FL1_GRVW2_GSU4_ISA908_IU1_KLA_LBSPP0_LPB2_LRVW2_MAC_NLCA1_NLCB1_ONLL1_PGR1_PLR0_SIA1_SU32_SUS256_SRVW0_SNLL0_TT2_2_TLDS0_USFGRO0_VS1_VW2_WSGRA0_WSGRB0_WG16_4_4_WGM1
    SolutionIndex: 47
    SolutionNameMin: Cijk_Ailk_Bljk_SB_MT8x32x32_SE_1LDSB0_AF0EM1_AMAS3_BL1_DTL0_DVO0_EPS1_FL0_GRVW1_GSU1_ISA908_IU1_KLA_LBSPP0_LPB2_LRVW2_MAC_NLCA1_NLCB1_ONLL1_PGR1_PLR1_SIA1_SU32_SUS256_SRVW0_SNLL0_TT2_2_TLDS0_USFGRO1_VS1_VW2_WSGRA0_WSGRB0_WG4_16_4_WGM1
    SolutionIndex: 48
    SolutionNameMin: Cijk_Ailk_Bljk_SB_MT32x8x32_SN_1LDSB0_AF0EM1_AMAS3_BL1_DTL0_DVO0_EPS1_FL0_GRVW2_GSU8_ISA908_IU1_KLA_LBSPP0_LPB0_LRVW2_MAC_NLCA1_NLCB1_ONLL1_PGR1_PLR1_SIA1_SU32_SUS256_SRVW0_SNLL0_TT2_2_TLDS0_USFGRO0_VS1_VW2_WSGRA0_WSGRB0_WG16_4_4_WGM1
    SolutionIndex: 49
    SolutionNameMin: Cijk_Ailk_Bljk_SB_MT64x16x16_MI16x16x4x1_SE_1LDSB0_AF0EM1_AMAS0_BL1_DTL0_DVO0_EPS1_FL0_GRVW1_GSU1_ISA908_IU1_KLA_LBSPP128_LPB2_LRVW2_MAC_NLCA1_NLCB1_ONLL1_PGR1_PLR5_SIA3_SU0_SUS256_SRVW0_SNLL0_TT1_16_TLDS1_USFGROn1_VSn1_VW1_WSGRA1_WSGRB1_WG64_4_1_WGM1
    SolutionIndex: 50
    SolutionNameMin: Cijk_Ailk_Bljk_SB_MT16x16x32_MI16x16x4x1_SE_1LDSB0_AF0EM1_AMAS0_BL1_DTL0_DVO0_EPS0_FL0_GRVW1_GSU5_ISA908_IU1_KLA_LBSPP128_LPB2_LRVW2_MAC_NLCA1_NLCB1_ONLL1_PGR2_PLR9_SIA3_SU32_SUS256_SRVW0_SNLL0_TT1_16_TLDS1_USFGROn1_VSn1_VW1_WSGRA1_WSGRB1_WG16_4_1_WGM1
    SolutionIndex: 51
    SolutionNameMin: Cijk_Ailk_Bljk_SB_MT16x16x32_MI16x16x4x1_SE_1LDSB0_AF0EM1_AMAS0_BL1_DTL0_DVO0_EPS0_FL0_GRVW4_GSU5_ISA908_IU1_KLA_LBSPP128_LPB4_LRVW2_MAC_NLCA1_NLCB1_ONLL1_PGR2_PLR9_SIA3_SU0_SUS256_SRVW0_SNLL0_TT1_16_TLDS1_USFGROn1_VSn1_VW1_WSGRA1_WSGRB1_WG16_4_1_WGM1
    SolutionIndex: 52
    SolutionNameMin: Cijk_Ailk_Bljk_SB_MT64x64x16_MI16x16x4x1_SE_1LDSB0_AF0EM1_AMAS3_BL1_DTL0_DVO0_EPS1_FL0_GRVW4_GSU1_ISA908_IU1_KLA_LBSPP0_LPB0_LRVW1_MAC_NLCA1_NLCB1_ONLL1_PGR1_PLR1_SIA3_SU32_SUS256_SRVW0_SNLL0_TT2_32_TLDS0_USFGROn1_VSn1_VW2_WSGRA0_WSGRB0_WG32_8_1_WGM8
    SolutionIndex: 53
    SolutionNameMin: Cijk_Ailk_Bljk_SB_MT64x64x8_SE_1LDSB0_AF0EM1_AMAS0_BL1_DTL0_DVO0_EPS1_FL0_GRVW1_GSU1_ISA908_IU1_KLA_LBSPP0_LPB1_LRVW1_MAC_NLCA1_NLCB1_ONLL1_PGR1_PLR1_SIA1_SU32_SUS256_SRVW0_SNLL1_TT4_4_TLDS0_USFGRO1_VS1_VW1_WSGRA0_WSGRB0_WG16_16_1_WGM1
    SolutionIndex: 54
    SolutionNameMin: Cijk_Ailk_Bljk_SB_MT64x32x16_MI16x16x4x1_SE_1LDSB0_AF0EM1_AMAS0_BL1_DTL0_DVO0_EPS0_FL0_GRVW2_GSU1_ISA908_IU1_KLA_LBSPP128_LPB2_LRVW2_MAC_NLCA1_NLCB1_ONLL1_PGR2_PLR5_SIA3_SU32_SUS128_SRVW2_SNLL0_TT2_16_TLDS1_USFGROn1_VSn1_VW1_WSGRA1_WSGRB1_WG32_8_1_WGM15
    SolutionIndex: 55
    SolutionNameMin: Cijk_Ailk_Bljk_SB_MT128x96x32_MI32x32x2x1_SE_1LDSB0_AF0EM1_AMAS0_BL1_DTL0_DVO0_EPS1_FL0_GRVW4_GSU1_ISA908_IU1_KLA_LBSPP128_LPB4_LRVW2_MAC_NLCA1_NLCB1_ONLL1_PGR1_PLR17_SIA3_SU0_SUS256_SRVW2_SNLL0_TT1_96_TLDS1_USFGROn1_VSn1_VW1_WSGRA1_WSGRB1_WG128_2_1_WGM15
    SolutionIndex: 56
    SolutionNameMin: Cijk_Ailk_Bljk_SB_MT16x8x32_SE_1LDSB0_AF0EM1_AMAS3_BL1_DTL0_DVO0_EPS1_FL1_GRVW2_GSU4_ISA908_IU1_KLA_LBSPP0_LPB2_LRVW2_MAC_NLCA1_NLCB1_ONLL1_PGR1_PLR1_SIA1_SU32_SUS256_SRVW0_SNLL0_TT2_2_TLDS0_USFGRO0_VS1_VW2_WSGRA0_WSGRB0_WG8_4_4_WGM1
    SolutionIndex: 57
    SolutionNameMin: Cijk_Ailk_Bljk_SB_MT16x16x32_SE_1LDSB0_AF0EM1_AMAS3_BL1_DTL0_DVO0_EPS1_FL1_GRVW2_GSU4_ISA908_IU1_KLA_LBSPP0_LPB2_LRVW2_MAC_NLCA1_NLCB1_ONLL1_PGR1_PLR1_SIA1_SU32_SUS256_SRVW0_SNLL0_TT2_4_TLDS0_USFGRO0_VS1_VW2_WSGRA0_WSGRB0_WG8_4_8_WGM1
    SolutionIndex: 58
    SolutionNameMin: Cijk_Ailk_Bljk_SB_MT144x64x16_MI16x16x4x1_SE_1LDSB0_AF0EM1_AMAS0_BL1_DTL0_DVO0_EPS0_FL0_GRVW1_GSU1_ISA908_IU1_KLA_LBSPP128_LPB2_LRVW2_MAC_NLCA9_NLCB1_ONLL1_PGR2_PLR5_SIA3_SU32_SUS256_SRVW0_SNLL0_TT9_16_TLDS1_USFGROn1_VSn1_VW1_WSGRA1_WSGRB1_WG16_16_1_WGM15
    SolutionIndex: 59
    SolutionNameMin: Cijk_Ailk_Bljk_SB_MT128x64x16_MI32x32x2x1_SE_1LDSB0_AF0EM1_AMAS0_BL1_DTL0_DVO0_EPS0_FL0_GRVW2_GSU1_ISA908_IU1_KLA_LBSPP128_LPB2_LRVW2_MAC_NLCA1_NLCB1_ONLL1_PGR2_PLR9_SIA3_SU0_SUS256_SRVW2_SNLL0_TT2_32_TLDS1_USFGROn1_VSn1_VW1_WSGRA1_WSGRB1_WG64_4_1_WGM1
    SolutionIndex: 60
    SolutionNameMin: Cijk_Ailk_Bljk_SB_MT32x64x32_MI16x16x4x1_SE_1LDSB0_AF0EM1_AMAS0_BL1_DTL0_DVO0_EPS0_FL0_GRVW1_GSU1_ISA908_IU1_KLA_LBSPP128_LPB2_LRVW2_MAC_NLCA1_NLCB1_ONLL1_PGR2_PLR9_SIA3_SU32_SUS128_SRVW2_SNLL0_TT1_32_TLDS1_USFGROn1_VSn1_VW1_WSGRA1_WSGRB1_WG32_8_1_WGM1
    SolutionIndex: 61
    SolutionNameMin: Cijk_Ailk_Bljk_SB_MT32x32x32_MI16x16x4x1_SE_1LDSB0_AF0EM1_AMAS0_BL1_DTL0_DVO0_EPS0_FL0_GRVW1_GSU1_ISA908_IU1_KLA_LBSPP128_LPB2_LRVW2_MAC_NLCA1_NLCB1_ONLL1_PGR2_PLR9_SIA3_SU0_SUS256_SRVW2_SNLL0_TT1_16_TLDS1_USFGROn1_VSn1_VW1_WSGRA1_WSGRB1_WG32_8_1_WGM2
    SolutionIndex: 62
    SolutionNameMin: Cijk_Ailk_Bljk_SB_MT64x64x16_MI16x16x4x1_SE_1LDSB0_AF0EM1_AMAS3_BL1_DTL0_DVO0_EPS1_FL0_GRVW4_GSU1_ISA908_IU1_KLA_LBSPP0_LPB0_LRVW1_MAC_NLCA1_NLCB1_ONLL1_PGR1_PLR1_SIA3_SU32_SUS256_SRVW0_SNLL0_TT4_16_TLDS0_USFGROn1_VSn1_VW2_WSGRA1_WSGRB1_WG16_16_1_WGM8
    SolutionIndex: 63
    SolutionNameMin: Cijk_Ailk_Bljk_SB_MT128x144x16_MI16x16x4x1_SN_1LDSB1_AF0EM1_AMAS0_BL1_DTL0_DVO0_EPS1_FL0_GRVW1_GSU1_ISA908_IU1_KLA_LBSPP128_LPB2_LRVW2_MAC_NLCA2_NLCB1_ONLL1_PGR1_PLR5_SIA3_SU32_SUS256_SRVW2_SNLL0_TT2_144_TLDS1_USFGROn1_VSn1_VW1_WSGRA1_WSGRB1_WG64_4_1_WGM1
    SolutionIndex: 64
    SolutionNameMin: Cijk_Ailk_Bljk_SB_MT32x64x32_MI16x16x4x1_SE_1LDSB0_AF0EM1_AMAS0_BL1_DTL0_DVO0_EPS0_FL0_GRVW1_GSU1_ISA908_IU1_KLA_LBSPP128_LPB2_LRVW2_MAC_NLCA1_NLCB1_ONLL1_PGR2_PLR9_SIA3_SU0_SUS256_SRVW2_SNLL0_TT1_32_TLDS1_USFGROn1_VSn1_VW1_WSGRA1_WSGRB1_WG32_8_1_WGM15
    SolutionIndex: 65
    SolutionNameMin: Cijk_Ailk_Bljk_SB_MT128x160x16_MI32x32x2x1_SE_1LDSB0_AF0EM1_AMAS0_BL1_DTL0_DVO0_EPS1_FL0_GRVW2_GSU1_ISA908_IU1_KLA_LBSPP128_LPB2_LRVW2_MAC_NLCA1_NLCB1_ONLL1_PGR1_PLR9_SIA3_SU0_SUS256_SRVW2_SNLL0_TT1_160_TLDS1_USFGROn1_VSn1_VW1_WSGRA1_WSGRB1_WG128_2_1_WGM1
    SolutionIndex: 66
    SolutionNameMin: Cijk_Ailk_Bljk_SB_MT64x64x32_MI32x32x2x1_SE_1LDSB0_AF0EM1_AMAS0_BL1_DTL0_DVO0_EPS0_FL0_GRVW2_GSU1_ISA908_IU1_KLA_LBSPP128_LPB2_LRVW2_MAC_NLCA1_NLCB1_ONLL1_PGR2_PLR17_SIA3_SU0_SUS256_SRVW2_SNLL0_TT1_32_TLDS1_USFGROn1_VSn1_VW1_WSGRA1_WSGRB1_WG64_4_1_WGM2
    SolutionIndex: 67
    SolutionNameMin: Cijk_Ailk_Bljk_SB_MT128x144x16_MI16x16x4x1_SE_1LDSB1_AF0EM1_AMAS0_BL1_DTL0_DVO0_EPS1_FL0_GRVW1_GSU1_ISA908_IU1_KLA_LBSPP128_LPB2_LRVW2_MAC_NLCA2_NLCB1_ONLL1_PGR1_PLR5_SIA3_SU32_SUS256_SRVW2_SNLL0_TT2_144_TLDS1_USFGROn1_VSn1_VW1_WSGRA1_WSGRB1_WG64_4_1_WGM15
    SolutionIndex: 68
    SolutionNameMin: Cijk_Ailk_Bljk_SB_MT64x64x16_MI16x16x4x1_SE_1LDSB0_AF0EM1_AMAS3_BL1_DTL0_DVO0_EPS1_FL1_GRVW4_GSU1_ISA908_IU1_KLA_LBSPP0_LPB0_LRVW1_MAC_NLCA1_NLCB1_ONLL0_PGR1_PLR1_SIA1_SU32_SUS256_SRVW4_SNLL0_TT4_16_TLDS1_USFGROn1_VSn1_VW4_WSGRA0_WSGRB0_WG16_16_1_WGM8
    SolutionIndex: 69
    SolutionNameMin: Cijk_Ailk_Bljk_SB_MT96x96x32_MI16x16x4x1_SE_1LDSB1_AF0EM1_AMAS0_BL1_DTL0_DVO0_EPS1_FL0_GRVW4_GSU1_ISA908_IU1_KLA_LBSPP128_LPB4_LRVW2_MAC_NLCA3_NLCB1_ONLL1_PGR1_PLR9_SIA3_SU0_SUS256_SRVW0_SNLL0_TT3_48_TLDS1_USFGROn1_VSn1_VW1_WSGRA1_WSGRB1_WG32_8_1_WGM1
    SolutionIndex: 70
    SolutionNameMin: Cijk_Ailk_Bljk_SB_MT128x144x16_MI16x16x4x1_SE_1LDSB1_AF0EM1_AMAS0_BL1_DTL0_DVO0_EPS1_FL0_GRVW1_GSU1_ISA908_IU1_KLA_LBSPP128_LPB2_LRVW2_MAC_NLCA2_NLCB1_ONLL1_PGR1_PLR5_SIA3_SU0_SUS256_SRVW2_SNLL0_TT2_144_TLDS1_USFGROn1_VSn1_VW1_WSGRA1_WSGRB1_WG64_4_1_WGM1
    SolutionIndex: 71
    SolutionNameMin: Cijk_Ailk_Bljk_SB_MT128x128x16_MI32x32x2x1_SE_1LDSB1_AF0EM1_AMAS0_BL1_DTL0_DVO0_EPS0_FL0_GRVW4_GSU1_ISA908_IU1_KLA_LBSPP128_LPB4_LRVW2_MAC_NLCA1_NLCB1_ONLL1_PGR2_PLR9_SIA3_SU0_SUS256_SRVW2_SNLL0_TT2_64_TLDS1_USFGROn1_VSn1_VW1_WSGRA1_WSGRB1_WG64_4_1_WGM1
    SolutionIndex: 72
    SolutionNameMin: Cijk_Ailk_Bljk_SB_MT128x96x16_MI32x32x2x1_SN_1LDSB0_AF0EM1_AMAS0_BL1_DTL0_DVO0_EPS0_FL0_GRVW2_GSU1_ISA908_IU1_KLA_LBSPP128_LPB2_LRVW2_MAC_NLCA1_NLCB1_ONLL1_PGR2_PLR9_SIA3_SU32_SUS256_SRVW2_SNLL0_TT1_96_TLDS1_USFGROn1_VSn1_VW1_WSGRA1_WSGRB1_WG128_2_1_WGM15
    SolutionIndex: 73
    SolutionNameMin: Cijk_Ailk_Bljk_SB_MT64x144x32_MI16x16x4x1_SE_1LDSB0_AF0EM1_AMAS0_BL1_DTL0_DVO0_EPS0_FL0_GRVW1_GSU1_ISA908_IU1_KLA_LBSPP128_LPB2_LRVW2_MAC_NLCA1_NLCB1_ONLL1_PGR2_PLR9_SIA3_SU0_SUS256_SRVW2_SNLL0_TT1_144_TLDS1_USFGROn1_VSn1_VW1_WSGRA1_WSGRB1_WG64_4_1_WGM1
    SolutionIndex: 74
    SolutionNameMin: Cijk_Ailk_Bljk_SB_MT128x144x16_MI16x16x4x1_SE_1LDSB1_AF0EM1_AMAS0_BL1_DTL0_DVO0_EPS0_FL0_GRVW1_GSU1_ISA908_IU1_KLA_LBSPP128_LPB2_LRVW2_MAC_NLCA2_NLCB1_ONLL1_PGR2_PLR5_SIA3_SU0_SUS256_SRVW2_SNLL0_TT2_144_TLDS1_USFGROn1_VSn1_VW1_WSGRA1_WSGRB1_WG64_4_1_WGM1
    SolutionIndex: 75
    SolutionNameMin: Cijk_Ailk_Bljk_SB_MT32x8x32_SN_1LDSB0_AF0EM1_AMAS3_BL1_DTL0_DVO0_EPS1_FL0_GRVW2_GSU8_ISA908_IU1_KLA_LBSPP0_LPB0_LRVW2_MAC_NLCA1_NLCB1_ONLL1_PGR1_PLR1_SIA1_SU32_SUS256_SRVW0_SNLL0_TT2_2_TLDS0_USFGRO0_VS1_VW2_WSGRA0_WSGRB0_WG16_4_4_WGM8
    SolutionIndex: 76
    SolutionNameMin: Cijk_Ailk_Bljk_SB_MT128x64x16_MI32x32x2x1_SE_1LDSB0_AF0EM1_AMAS0_BL1_DTL0_DVO0_EPS0_FL0_GRVW4_GSU1_ISA908_IU1_KLA_LBSPP128_LPB4_LRVW2_MAC_NLCA1_NLCB1_ONLL1_PGR2_PLR9_SIA3_SU0_SUS256_SRVW2_SNLL0_TT2_32_TLDS1_USFGROn1_VSn1_VW1_WSGRA1_WSGRB1_WG64_4_1_WGM15
    SolutionIndex: 77
    SolutionNameMin: Cijk_Ailk_Bljk_SB_MT32x32x32_MI16x16x4x1_SE_1LDSB0_AF0EM1_AMAS0_BL1_DTL0_DVO0_EPS0_FL0_GRVW4_GSU1_ISA908_IU1_KLA_LBSPP128_LPB4_LRVW2_MAC_NLCA1_NLCB1_ONLL1_PGR2_PLR9_SIA3_SU32_SUS128_SRVW2_SNLL0_TT1_16_TLDS1_USFGROn1_VSn1_VW1_WSGRA1_WSGRB1_WG32_8_1_WGM1
    SolutionIndex: 78
    SolutionNameMin: Cijk_Ailk_Bljk_SB_MT32x64x32_MI16x16x4x1_SE_1LDSB0_AF0EM1_AMAS0_BL1_DTL0_DVO0_EPS1_FL0_GRVW4_GSU1_ISA908_IU1_KLA_LBSPP128_LPB4_LRVW2_MAC_NLCA1_NLCB1_ONLL1_PGR1_PLR9_SIA3_SU32_SUS128_SRVW2_SNLL0_TT1_32_TLDS1_USFGROn1_VSn1_VW1_WSGRA1_WSGRB1_WG32_8_1_WGM1
    SolutionIndex: 79
    SolutionNameMin: Cijk_Ailk_Bljk_SB_MT64x32x32_MI16x16x4x1_SE_1LDSB0_AF0EM1_AMAS0_BL1_DTL0_DVO0_EPS0_FL0_GRVW1_GSU1_ISA908_IU1_KLA_LBSPP128_LPB2_LRVW2_MAC_NLCA1_NLCB1_ONLL1_PGR2_PLR9_SIA3_SU32_SUS128_SRVW2_SNLL0_TT2_16_TLDS1_USFGROn1_VSn1_VW1_WSGRA1_WSGRB1_WG32_8_1_WGM1
    SolutionIndex: 80
    SolutionNameMin: Cijk_Ailk_Bljk_SB_MT64x64x32_MI32x32x2x1_SE_1LDSB0_AF0EM1_AMAS0_BL1_DTL0_DVO0_EPS0_FL0_GRVW4_GSU1_ISA908_IU2_KLA_LBSPP128_LPB4_LRVW2_MAC_NLCA1_NLCB1_ONLL1_PGR2_PLR9_SIA3_SU0_SUS128_SRVW2_SNLL0_TT1_32_TLDS1_USFGROn1_VSn1_VW1_WSGRA1_WSGRB1_WG64_4_1_WGM8
    SolutionIndex: 81
    SolutionNameMin: Cijk_Ailk_Bljk_SB_MT128x144x16_MI16x16x4x1_SE_1LDSB1_AF0EM1_AMAS0_BL1_DTL0_DVO0_EPS1_FL0_GRVW1_GSU1_ISA908_IU1_KLA_LBSPP128_LPB2_LRVW2_MAC_NLCA2_NLCB1_ONLL1_PGR1_PLR5_SIA3_SU32_SUS256_SRVW2_SNLL0_TT2_144_TLDS1_USFGROn1_VSn1_VW1_WSGRA1_WSGRB1_WG64_4_1_WGM1
    SolutionIndex: 82
    SolutionNameMin: Cijk_Ailk_Bljk_SB_MT128x96x32_MI32x32x2x1_SE_1LDSB0_AF0EM1_AMAS0_BL1_DTL0_DVO0_EPS1_FL0_GRVW1_GSU1_ISA908_IU1_KLA_LBSPP128_LPB2_LRVW2_MAC_NLCA2_NLCB1_ONLL1_PGR1_PLR17_SIA3_SU0_SUS256_SRVW2_SNLL0_TT1_96_TLDS1_USFGROn1_VSn1_VW1_WSGRA1_WSGRB1_WG128_2_1_WGM15
    SolutionIndex: 83
    SolutionNameMin: Cijk_Ailk_Bljk_SB_MT64x32x16_MI16x16x4x1_SE_1LDSB0_AF0EM1_AMAS0_BL1_DTL0_DVO0_EPS0_FL0_GRVW1_GSU1_ISA908_IU1_KLA_LBSPP128_LPB2_LRVW2_MAC_NLCA1_NLCB1_ONLL1_PGR2_PLR5_SIA3_SU32_SUS128_SRVW2_SNLL0_TT2_16_TLDS1_USFGROn1_VSn1_VW1_WSGRA1_WSGRB1_WG32_8_1_WGM2
    SolutionIndex: 84
    SolutionNameMin: Cijk_Ailk_Bljk_SB_MT64x32x32_MI16x16x4x1_SE_1LDSB0_AF0EM1_AMAS0_BL1_DTL0_DVO0_EPS0_FL0_GRVW1_GSU1_ISA908_IU1_KLA_LBSPP128_LPB2_LRVW2_MAC_NLCA1_NLCB1_ONLL1_PGR2_PLR9_SIA3_SU0_SUS256_SRVW2_SNLL0_TT2_16_TLDS1_USFGROn1_VSn1_VW1_WSGRA1_WSGRB1_WG32_8_1_WGM1
    SolutionIndex: 85
    SolutionNameMin: Cijk_Ailk_Bljk_SB_MT64x64x16_MI16x16x4x1_SE_1LDSB0_AF0EM1_AMAS3_BL1_DTL0_DVO0_EPS1_FL0_GRVW2_GSU1_ISA908_IU1_KLA_LBSPP0_LPB0_LRVW1_MAC_NLCA1_NLCB1_ONLL1_PGR1_PLR1_SIA3_SU32_SUS256_SRVW0_SNLL0_TT4_16_TLDS1_USFGROn1_VSn1_VW2_WSGRA1_WSGRB1_WG16_16_1_WGM8
    SolutionIndex: 86
    SolutionNameMin: Cijk_Ailk_Bljk_SB_MT64x32x16_MI16x16x4x1_SE_1LDSB0_AF0EM1_AMAS0_BL1_DTL0_DVO0_EPS0_FL0_GRVW4_GSU1_ISA908_IU1_KLA_LBSPP128_LPB4_LRVW2_MAC_NLCA1_NLCB1_ONLL1_PGR2_PLR5_SIA3_SU0_SUS256_SRVW2_SNLL0_TT2_16_TLDS1_USFGROn1_VSn1_VW1_WSGRA1_WSGRB1_WG32_8_1_WGM1
    SolutionIndex: 87
    SolutionNameMin: Cijk_Ailk_Bljk_SB_MT64x128x16_MI32x32x2x1_SE_1LDSB0_AF0EM1_AMAS0_BL1_DTL0_DVO0_EPS0_FL0_GRVW4_GSU1_ISA908_IU1_KLA_LBSPP128_LPB4_LRVW2_MAC_NLCA1_NLCB1_ONLL1_PGR2_PLR9_SIA3_SU32_SUS256_SRVW2_SNLL0_TT1_64_TLDS1_USFGROn1_VSn1_VW1_WSGRA1_WSGRB1_WG64_4_1_WGM1
    SolutionIndex: 88
    SolutionNameMin: Cijk_Ailk_Bljk_SB_MT64x128x16_MI32x32x2x1_SE_1LDSB0_AF0EM1_AMAS0_BL1_DTL0_DVO0_EPS0_FL0_GRVW4_GSU1_ISA908_IU1_KLA_LBSPP128_LPB4_LRVW2_MAC_NLCA1_NLCB1_ONLL1_PGR2_PLR9_SIA3_SU32_SUS128_SRVW2_SNLL0_TT1_64_TLDS1_USFGROn1_VSn1_VW1_WSGRA1_WSGRB1_WG64_4_1_WGM2
    SolutionIndex: 89
    SolutionNameMin: Cijk_Ailk_Bljk_SB_MT64x64x16_MI32x32x2x1_SE_1LDSB0_AF0EM1_AMAS0_BL1_DTL0_DVO0_EPS0_FL0_GRVW2_GSU1_ISA908_IU1_KLA_LBSPP128_LPB2_LRVW2_MAC_NLCA1_NLCB1_ONLL1_PGR2_PLR9_SIA3_SU0_SUS256_SRVW2_SNLL0_TT1_32_TLDS1_USFGROn1_VSn1_VW1_WSGRA1_WSGRB1_WG64_4_1_WGM8
    SolutionIndex: 90
    SolutionNameMin: Cijk_Ailk_Bljk_SB_MT8x32x32_SE_1LDSB0_AF0EM1_AMAS3_BL1_DTL0_DVO0_EPS1_FL1_GRVW2_GSU1_ISA908_IU1_KLA_LBSPP0_LPB2_LRVW2_MAC_NLCA1_NLCB1_ONLL1_PGR1_PLR1_SIA1_SU32_SUS256_SRVW0_SNLL1_TT2_4_TLDS0_USFGRO0_VS1_VW2_WSGRA0_WSGRB0_WG4_8_8_WGM1
    SolutionIndex: 91
    SolutionNameMin: Cijk_Ailk_Bljk_SB_MT64x128x16_MI32x32x2x1_SE_1LDSB0_AF0EM1_AMAS0_BL1_DTL0_DVO0_EPS0_FL0_GRVW1_GSU1_ISA908_IU1_KLA_LBSPP128_LPB2_LRVW2_MAC_NLCA1_NLCB1_ONLL1_PGR2_PLR9_SIA3_SU32_SUS256_SRVW2_SNLL0_TT1_64_TLDS1_USFGROn1_VSn1_VW1_WSGRA1_WSGRB1_WG64_4_1_WGM15
    SolutionIndex: 92
    SolutionNameMin: Cijk_Ailk_Bljk_SB_MT64x128x16_MI32x32x2x1_SE_1LDSB0_AF0EM1_AMAS0_BL1_DTL0_DVO0_EPS0_FL0_GRVW4_GSU1_ISA908_IU1_KLA_LBSPP128_LPB4_LRVW2_MAC_NLCA1_NLCB1_ONLL1_PGR2_PLR9_SIA3_SU32_SUS256_SRVW2_SNLL0_TT1_64_TLDS1_USFGROn1_VSn1_VW1_WSGRA1_WSGRB1_WG64_4_1_WGM2
    SolutionIndex: 93
    SolutionNameMin: Cijk_Ailk_Bljk_SB_MT128x64x16_MI16x16x1x4_SE_1LDSB0_AF0EM1_AMAS3_BL1_DTL0_DVO0_EPS1_FL0_GRVW4_GSU1_ISA908_IU1_KLA_LBSPP0_LPB0_LRVW1_MAC_NLCA1_NLCB1_ONLL1_PGR1_PLR1_SIA3_SU32_SUS256_SRVW0_SNLL0_TT2_16_TLDS0_USFGROn1_VSn1_VW2_WSGRA1_WSGRB1_WG64_4_1_WGM8
    SolutionIndex: 94
    SolutionNameMin: Cijk_Ailk_Bljk_SB_MT128x96x16_MI32x32x2x1_SE_1LDSB0_AF0EM1_AMAS0_BL1_DTL0_DVO0_EPS0_FL0_GRVW1_GSU1_ISA908_IU1_KLA_LBSPP128_LPB2_LRVW2_MAC_NLCA2_NLCB1_ONLL1_PGR2_PLR9_SIA3_SU32_SUS128_SRVW2_SNLL0_TT1_96_TLDS1_USFGROn1_VSn1_VW1_WSGRA1_WSGRB1_WG128_2_1_WGM2
    SolutionIndex: 95
    SolutionNameMin: Cijk_Ailk_Bljk_SB_MT64x64x16_MI32x32x2x1_SE_1LDSB0_AF0EM1_AMAS0_BL1_DTL0_DVO0_EPS0_FL0_GRVW1_GSU1_ISA908_IU1_KLA_LBSPP128_LPB2_LRVW2_MAC_NLCA1_NLCB1_ONLL1_PGR2_PLR9_SIA3_SU0_SUS256_SRVW2_SNLL0_TT1_32_TLDS1_USFGROn1_VSn1_VW1_WSGRA1_WSGRB1_WG64_4_1_WGM15
    SolutionIndex: 96
    SolutionNameMin: Cijk_Ailk_Bljk_SB_MT16x16x32_MI16x16x4x1_SE_1LDSB0_AF0EM1_AMAS0_BL1_DTL0_DVO0_EPS0_FL0_GRVW4_GSU1_ISA908_IU1_KLA_LBSPP128_LPB4_LRVW2_MAC_NLCA1_NLCB1_ONLL1_PGR2_PLR9_SIA3_SU32_SUS128_SRVW0_SNLL0_TT1_16_TLDS1_USFGROn1_VSn1_VW1_WSGRA1_WSGRB1_WG16_4_1_WGM1
    SolutionIndex: 97
    SolutionNameMin: Cijk_Ailk_Bljk_SB_MT64x32x32_MI16x16x4x1_SE_1LDSB0_AF0EM1_AMAS0_BL1_DTL0_DVO0_EPS0_FL0_GRVW4_GSU1_ISA908_IU1_KLA_LBSPP128_LPB4_LRVW2_MAC_NLCA1_NLCB1_ONLL1_PGR2_PLR9_SIA3_SU32_SUS128_SRVW2_SNLL0_TT2_16_TLDS1_USFGROn1_VSn1_VW1_WSGRA1_WSGRB1_WG32_8_1_WGM15
    SolutionIndex: 98
    SolutionNameMin: Cijk_Ailk_Bljk_SB_MT32x8x32_SN_1LDSB0_AF0EM1_AMAS3_BL1_DTL0_DVO0_EPS1_FL0_GRVW2_GSU2_ISA908_IU1_KLA_LBSPP0_LPB0_LRVW2_MAC_NLCA1_NLCB1_ONLL1_PGR1_PLR1_SIA1_SU32_SUS256_SRVW0_SNLL0_TT2_2_TLDS0_USFGRO0_VS1_VW2_WSGRA0_WSGRB0_WG16_4_4_WGM1
    SolutionIndex: 99
    SolutionNameMin: Cijk_Ailk_Bljk_SB_MT32x64x32_MI16x16x4x1_SE_1LDSB0_AF0EM1_AMAS0_BL1_DTL0_DVO0_EPS0_FL0_GRVW2_GSU1_ISA908_IU1_KLA_LBSPP128_LPB2_LRVW2_MAC_NLCA1_NLCB1_ONLL1_PGR2_PLR9_SIA3_SU32_SUS128_SRVW2_SNLL0_TT1_32_TLDS1_USFGROn1_VSn1_VW1_WSGRA1_WSGRB1_WG32_8_1_WGM1
    SolutionIndex: 100
    SolutionNameMin: Cijk_Ailk_Bljk_SB_MT16x16x16_SN_1LDSB0_AF0EM1_AMAS3_BL1_DTL0_DVO0_EPS1_FL0_GRVW2_GSU8_ISA908_IU1_KLA_LBSPP0_LPB0_LRVW2_MAC_NLCA1_NLCB1_ONLL1_PGR1_PLR1_SIA1_SU32_SUS256_SRVW0_SNLL0_TT2_2_TLDS0_USFGRO1_VS1_VW2_WSGRA0_WSGRB0_WG8_8_4_WGM1
    SolutionIndex: 101
    SolutionNameMin: Cijk_Ailk_Bljk_SB_MT32x8x32_SE_1LDSB0_AF0EM1_AMAS3_BL1_DTL0_DVO0_EPS1_FL1_GRVW2_GSU1_ISA908_IU1_KLA_LBSPP0_LPB0_LRVW2_MAC_NLCA1_NLCB1_ONLL1_PGR1_PLR1_SIA1_SU32_SUS256_SRVW0_SNLL1_TT2_2_TLDS0_USFGRO0_VS1_VW2_WSGRA0_WSGRB0_WG16_4_4_WGM1
    SolutionIndex: 102
    SolutionNameMin: Cijk_Ailk_Bljk_SB_MT16x16x32_MI16x16x4x1_SE_1LDSB0_AF0EM1_AMAS0_BL1_DTL0_DVO0_EPS0_FL0_GRVW2_GSU1_ISA908_IU1_KLA_LBSPP128_LPB2_LRVW2_MAC_NLCA1_NLCB1_ONLL1_PGR2_PLR9_SIA3_SU0_SUS256_SRVW0_SNLL0_TT1_16_TLDS1_USFGROn1_VSn1_VW1_WSGRA1_WSGRB1_WG16_4_1_WGM1
    SolutionIndex: 103
    SolutionNameMin: Cijk_Ailk_Bljk_SB_MT16x16x32_MI16x16x4x1_SE_1LDSB0_AF0EM1_AMAS0_BL1_DTL0_DVO0_EPS0_FL0_GRVW4_GSU1_ISA908_IU1_KLA_LBSPP128_LPB4_LRVW2_MAC_NLCA1_NLCB1_ONLL1_PGR2_PLR9_SIA3_SU0_SUS256_SRVW0_SNLL0_TT1_16_TLDS1_USFGROn1_VSn1_VW1_WSGRA1_WSGRB1_WG16_4_1_WGM2
    SolutionIndex: 104
    SolutionNameMin: Cijk_Ailk_Bljk_SB_MT64x64x16_MI32x32x2x1_SE_1LDSB0_AF0EM1_AMAS0_BL1_DTL0_DVO0_EPS0_FL0_GRVW4_GSU1_ISA908_IU1_KLA_LBSPP128_LPB4_LRVW2_MAC_NLCA1_NLCB1_ONLL1_PGR2_PLR9_SIA3_SU32_SUS256_SRVW2_SNLL0_TT1_32_TLDS1_USFGROn1_VSn1_VW1_WSGRA1_WSGRB1_WG64_4_1_WGM2
    SolutionIndex: 105
    SolutionNameMin: Cijk_Ailk_Bljk_SB_MT32x64x32_MI16x16x4x1_SE_1LDSB0_AF0EM1_AMAS0_BL1_DTL0_DVO0_EPS0_FL0_GRVW2_GSU1_ISA908_IU1_KLA_LBSPP128_LPB2_LRVW2_MAC_NLCA1_NLCB1_ONLL1_PGR2_PLR9_SIA3_SU32_SUS128_SRVW2_SNLL0_TT1_32_TLDS1_USFGROn1_VSn1_VW1_WSGRA1_WSGRB1_WG32_8_1_WGM2
    SolutionIndex: 106
    SolutionNameMin: Cijk_Ailk_Bljk_SB_MT64x128x16_MI32x32x2x1_SE_1LDSB0_AF0EM1_AMAS0_BL1_DTL0_DVO0_EPS0_FL0_GRVW4_GSU1_ISA908_IU1_KLA_LBSPP128_LPB4_LRVW2_MAC_NLCA1_NLCB1_ONLL1_PGR2_PLR9_SIA3_SU0_SUS256_SRVW2_SNLL0_TT1_64_TLDS1_USFGROn1_VSn1_VW1_WSGRA1_WSGRB1_WG64_4_1_WGM2
    SolutionIndex: 107
    SolutionNameMin: Cijk_Ailk_Bljk_SB_MT96x96x16_MI16x16x4x1_SE_1LDSB1_AF0EM1_AMAS0_BL1_DTL0_DVO0_EPS0_FL0_GRVW2_GSU1_ISA908_IU1_KLA_LBSPP128_LPB2_LRVW2_MAC_NLCA3_NLCB1_ONLL1_PGR2_PLR5_SIA3_SU0_SUS256_SRVW0_SNLL0_TT3_48_TLDS1_USFGROn1_VSn1_VW1_WSGRA1_WSGRB1_WG32_8_1_WGM1
    SolutionIndex: 108
    SolutionNameMin: Cijk_Ailk_Bljk_SB_MT128x144x16_MI16x16x4x1_SE_1LDSB1_AF0EM1_AMAS0_BL1_DTL0_DVO0_EPS1_FL0_GRVW1_GSU1_ISA908_IU1_KLA_LBSPP128_LPB2_LRVW2_MAC_NLCA2_NLCB1_ONLL1_PGR1_PLR5_SIA3_SU0_SUS256_SRVW2_SNLL0_TT2_144_TLDS1_USFGROn1_VSn1_VW1_WSGRA1_WSGRB1_WG64_4_1_WGM2
    SolutionIndex: 109
    SolutionNameMin: Cijk_Ailk_Bljk_SB_MT64x144x16_MI16x16x4x1_SE_1LDSB0_AF0EM1_AMAS0_BL1_DTL0_DVO0_EPS0_FL0_GRVW1_GSU1_ISA908_IU1_KLA_LBSPP128_LPB2_LRVW2_MAC_NLCA1_NLCB1_ONLL1_PGR2_PLR5_SIA3_SU0_SUS256_SRVW2_SNLL0_TT1_144_TLDS1_USFGROn1_VSn1_VW1_WSGRA1_WSGRB1_WG64_4_1_WGM15
    SolutionIndex: 110
    SolutionNameMin: Cijk_Ailk_Bljk_SB_MT64x128x16_MI32x32x2x1_SE_1LDSB0_AF0EM1_AMAS0_BL1_DTL0_DVO0_EPS0_FL0_GRVW4_GSU1_ISA908_IU1_KLA_LBSPP128_LPB4_LRVW2_MAC_NLCA1_NLCB1_ONLL1_PGR2_PLR9_SIA3_SU0_SUS256_SRVW2_SNLL0_TT1_64_TLDS1_USFGROn1_VSn1_VW1_WSGRA1_WSGRB1_WG64_4_1_WGM15
    SolutionIndex: 111
    SolutionNameMin: Cijk_Ailk_Bljk_SB_MT64x32x16_SN_1LDSB0_AF0EM1_AMAS3_BL1_DTL0_DVO0_EPS1_FL1_GRVW4_GSU1_ISA908_IU1_KLA_LBSPP0_LPB4_LRVW4_MAC_NLCA1_NLCB1_ONLL1_PGR1_PLR1_SIA1_SU32_SUS256_SRVW0_SNLL1_TT4_4_TLDS0_USFGRO0_VS1_VW4_WSGRA0_WSGRB0_WG16_8_2_WGM16
    SolutionIndex: 112
    SolutionNameMin: Cijk_Ailk_Bljk_SB_MT144x64x16_MI16x16x4x1_SE_1LDSB0_AF0EM1_AMAS0_BL1_DTL0_DVO0_EPS0_FL0_GRVW1_GSU1_ISA908_IU1_KLA_LBSPP128_LPB2_LRVW2_MAC_NLCA9_NLCB1_ONLL1_PGR2_PLR5_SIA3_SU32_SUS256_SRVW0_SNLL0_TT9_16_TLDS1_USFGROn1_VSn1_VW1_WSGRA1_WSGRB1_WG16_16_1_WGM2
    SolutionIndex: 113
    SolutionNameMin: Cijk_Ailk_Bljk_SB_MT128x96x16_MI32x32x2x1_SE_1LDSB0_AF0EM1_AMAS0_BL1_DTL0_DVO0_EPS1_FL0_GRVW2_GSU1_ISA908_IU1_KLA_LBSPP128_LPB2_LRVW2_MAC_NLCA1_NLCB1_ONLL1_PGR1_PLR9_SIA3_SU32_SUS128_SRVW2_SNLL0_TT1_96_TLDS1_USFGROn1_VSn1_VW1_WSGRA1_WSGRB1_WG128_2_1_WGM2
    SolutionIndex: 114
    SolutionNameMin: Cijk_Ailk_Bljk_SB_MT128x96x16_MI32x32x2x1_SE_1LDSB0_AF0EM1_AMAS0_BL1_DTL0_DVO0_EPS1_FL0_GRVW2_GSU1_ISA908_IU1_KLA_LBSPP128_LPB2_LRVW2_MAC_NLCA1_NLCB1_ONLL1_PGR1_PLR9_SIA3_SU32_SUS256_SRVW2_SNLL0_TT1_96_TLDS1_USFGROn1_VSn1_VW1_WSGRA1_WSGRB1_WG128_2_1_WGM2
    SolutionIndex: 115
    SolutionNameMin: Cijk_Ailk_Bljk_SB_MT64x144x16_MI16x16x4x1_SE_1LDSB0_AF0EM1_AMAS0_BL1_DTL0_DVO0_EPS0_FL0_GRVW1_GSU1_ISA908_IU1_KLA_LBSPP128_LPB2_LRVW2_MAC_NLCA1_NLCB1_ONLL1_PGR2_PLR5_SIA3_SU0_SUS256_SRVW2_SNLL0_TT1_144_TLDS1_USFGROn1_VSn1_VW1_WSGRA1_WSGRB1_WG64_4_1_WGM1
    SolutionIndex: 116
    SolutionNameMin: Cijk_Ailk_Bljk_SB_MT64x16x32_MI16x16x4x1_SE_1LDSB0_AF0EM1_AMAS0_BL1_DTL0_DVO0_EPS0_FL0_GRVW1_GSU1_ISA908_IU1_KLA_LBSPP128_LPB2_LRVW2_MAC_NLCA1_NLCB1_ONLL1_PGR2_PLR9_SIA3_SU0_SUS256_SRVW0_SNLL0_TT1_16_TLDS1_USFGROn1_VSn1_VW1_WSGRA1_WSGRB1_WG64_4_1_WGM2
    SolutionIndex: 117
    SolutionNameMin: Cijk_Ailk_Bljk_SB_MT64x16x32_MI16x16x4x1_SE_1LDSB0_AF0EM1_AMAS0_BL1_DTL0_DVO0_EPS0_FL0_GRVW1_GSU1_ISA908_IU1_KLA_LBSPP128_LPB2_LRVW2_MAC_NLCA1_NLCB1_ONLL1_PGR2_PLR9_SIA3_SU32_SUS256_SRVW0_SNLL0_TT1_16_TLDS1_USFGROn1_VSn1_VW1_WSGRA1_WSGRB1_WG64_4_1_WGM15
    SolutionIndex: 118
    SolutionNameMin: Cijk_Ailk_Bljk_SB_MT32x32x32_MI16x16x4x1_SE_1LDSB0_AF0EM1_AMAS0_BL1_DTL0_DVO0_EPS0_FL0_GRVW4_GSU1_ISA908_IU1_KLA_LBSPP128_LPB4_LRVW2_MAC_NLCA1_NLCB1_ONLL1_PGR2_PLR9_SIA3_SU32_SUS256_SRVW2_SNLL0_TT1_16_TLDS1_USFGROn1_VSn1_VW1_WSGRA1_WSGRB1_WG32_8_1_WGM2
    SolutionIndex: 119
    SolutionNameMin: Cijk_Ailk_Bljk_SB_MT64x64x32_MI32x32x2x1_SE_1LDSB0_AF0EM1_AMAS0_BL1_DTL0_DVO0_EPS0_FL0_GRVW4_GSU1_ISA908_IU1_KLA_LBSPP128_LPB4_LRVW2_MAC_NLCA1_NLCB1_ONLL1_PGR2_PLR17_SIA3_SU32_SUS256_SRVW2_SNLL0_TT1_32_TLDS1_USFGROn1_VSn1_VW1_WSGRA1_WSGRB1_WG64_4_1_WGM2
    SolutionIndex: 120
    SolutionNameMin: Cijk_Ailk_Bljk_SB_MT16x32x32_SE_1LDSB0_AF0EM1_AMAS3_BL1_DTL0_DVO0_EPS1_FL1_GRVW4_GSU1_ISA908_IU1_KLA_LBSPP0_LPB2_LRVW2_MAC_NLCA1_NLCB1_ONLL1_PGR1_PLR1_SIA1_SU32_SUS256_SRVW0_SNLL0_TT4_2_TLDS0_USFGRO0_VS1_VW2_WSGRA0_WSGRB0_WG4_16_4_WGM1
    SolutionIndex: 121
    SolutionNameMin: Cijk_Ailk_Bljk_SB_MT96x96x32_MI16x16x4x1_SN_1LDSB1_AF0EM1_AMAS0_BL1_DTL0_DVO0_EPS1_FL0_GRVW4_GSU1_ISA908_IU1_KLA_LBSPP128_LPB4_LRVW2_MAC_NLCA3_NLCB1_ONLL1_PGR1_PLR9_SIA3_SU32_SUS256_SRVW0_SNLL0_TT3_48_TLDS1_USFGROn1_VSn1_VW1_WSGRA1_WSGRB1_WG32_8_1_WGM15
    SolutionIndex: 122
    SolutionNameMin: Cijk_Ailk_Bljk_SB_MT64x32x32_MI16x16x4x1_SE_1LDSB0_AF0EM1_AMAS0_BL1_DTL0_DVO0_EPS0_FL0_GRVW1_GSU3_ISA908_IU1_KLA_LBSPP128_LPB2_LRVW2_MAC_NLCA1_NLCB1_ONLL1_PGR2_PLR9_SIA3_SU32_SUS256_SRVW0_SNLL0_TT2_16_TLDS1_USFGROn1_VSn1_VW1_WSGRA1_WSGRB1_WG32_8_1_WGM1
    SolutionIndex: 123
    SolutionNameMin: Cijk_Ailk_Bljk_SB_MT16x16x32_SE_1LDSB0_AF0EM1_AMAS3_BL1_DTL0_DVO0_EPS1_FL1_GRVW2_GSU1_ISA908_IU1_KLA_LBSPP0_LPB2_LRVW2_MAC_NLCA1_NLCB1_ONLL1_PGR1_PLR1_SIA1_SU32_SUS256_SRVW0_SNLL1_TT2_2_TLDS0_USFGRO0_VS1_VW2_WSGRA0_WSGRB0_WG8_8_4_WGM8
    SolutionIndex: 124
    SolutionNameMin: Cijk_Ailk_Bljk_SB_MT128x64x24_MI16x16x4x1_SE_1LDSB0_AF0EM1_AMAS3_BL1_DTL0_DVO0_EPS1_FL0_GRVW1_GSU1_ISA908_IU1_KLA_LBSPP0_LPB0_LRVW1_MAC_NLCA2_NLCB3_ONLL1_PGR1_PLR1_SIA3_SU32_SUS256_SRVW0_SNLL0_TT2_64_TLDS1_USFGROn1_VSn1_VW4_WSGRA1_WSGRB1_WG64_4_1_WGM8
    SolutionIndex: 125
    SolutionNameMin: Cijk_Ailk_Bljk_SB_MT128x64x32_MI32x32x2x1_SE_1LDSB0_AF0EM1_AMAS0_BL1_DTL0_DVO0_EPS0_FL0_GRVW4_GSU1_ISA908_IU1_KLA_LBSPP128_LPB4_LRVW2_MAC_NLCA1_NLCB1_ONLL1_PGR2_PLR17_SIA3_SU0_SUS256_SRVW2_SNLL0_TT2_32_TLDS1_USFGROn1_VSn1_VW1_WSGRA1_WSGRB1_WG64_4_1_WGM15
    SolutionIndex: 126
    SolutionNameMin: Cijk_Ailk_Bljk_SB_MT64x128x16_MI32x32x2x1_SE_1LDSB0_AF0EM1_AMAS0_BL1_DTL0_DVO0_EPS0_FL0_GRVW2_GSU1_ISA908_IU1_KLA_LBSPP128_LPB2_LRVW2_MAC_NLCA1_NLCB1_ONLL1_PGR2_PLR9_SIA3_SU32_SUS128_SRVW2_SNLL0_TT1_64_TLDS1_USFGROn1_VSn1_VW1_WSGRA1_WSGRB1_WG64_4_1_WGM1
    SolutionIndex: 127
    SolutionNameMin: Cijk_Ailk_Bljk_SB_MT64x64x32_MI32x32x2x1_SE_1LDSB0_AF0EM1_AMAS0_BL1_DTL0_DVO0_EPS0_FL0_GRVW2_GSU1_ISA908_IU1_KLA_LBSPP128_LPB2_LRVW2_MAC_NLCA1_NLCB1_ONLL1_PGR2_PLR17_SIA3_SU32_SUS256_SRVW2_SNLL0_TT1_32_TLDS1_USFGROn1_VSn1_VW1_WSGRA1_WSGRB1_WG64_4_1_WGM1
    SolutionIndex: 128
    SolutionNameMin: Cijk_Ailk_Bljk_SB_MT64x64x32_MI32x32x2x1_SE_1LDSB0_AF0EM1_AMAS0_BL1_DTL0_DVO0_EPS0_FL0_GRVW1_GSU1_ISA908_IU1_KLA_LBSPP128_LPB2_LRVW2_MAC_NLCA1_NLCB1_ONLL1_PGR2_PLR17_SIA3_SU32_SUS256_SRVW2_SNLL0_TT1_32_TLDS1_USFGROn1_VSn1_VW1_WSGRA1_WSGRB1_WG64_4_1_WGM2
    SolutionIndex: 129
    SolutionNameMin: Cijk_Ailk_Bljk_SB_MT128x96x16_MI32x32x2x1_SE_1LDSB0_AF0EM1_AMAS0_BL1_DTL0_DVO0_EPS0_FL0_GRVW1_GSU1_ISA908_IU1_KLA_LBSPP128_LPB2_LRVW2_MAC_NLCA2_NLCB1_ONLL1_PGR2_PLR9_SIA3_SU32_SUS128_SRVW2_SNLL0_TT1_96_TLDS1_USFGROn1_VSn1_VW1_WSGRA1_WSGRB1_WG128_2_1_WGM15
    SolutionIndex: 130
    SolutionNameMin: Cijk_Ailk_Bljk_SB_MT64x64x32_MI32x32x2x1_SE_1LDSB0_AF0EM1_AMAS0_BL1_DTL0_DVO0_EPS0_FL0_GRVW2_GSU1_ISA908_IU1_KLA_LBSPP128_LPB2_LRVW2_MAC_NLCA1_NLCB1_ONLL1_PGR2_PLR17_SIA3_SU0_SUS256_SRVW2_SNLL0_TT1_32_TLDS1_USFGROn1_VSn1_VW1_WSGRA1_WSGRB1_WG64_4_1_WGM1
    SolutionIndex: 131
    SolutionNameMin: Cijk_Ailk_Bljk_SB_MT32x8x32_SN_1LDSB0_AF0EM1_AMAS3_BL1_DTL0_DVO0_EPS1_FL0_GRVW2_GSU4_ISA908_IU1_KLA_LBSPP0_LPB0_LRVW2_MAC_NLCA1_NLCB1_ONLL1_PGR1_PLR1_SIA1_SU32_SUS256_SRVW0_SNLL0_TT2_2_TLDS0_USFGRO0_VS1_VW2_WSGRA0_WSGRB0_WG16_4_4_WGM1
    SolutionIndex: 132
    SolutionNameMin: Cijk_Ailk_Bljk_SB_MT128x96x16_MI32x32x2x1_SE_1LDSB0_AF0EM1_AMAS0_BL1_DTL0_DVO0_EPS1_FL0_GRVW2_GSU1_ISA908_IU1_KLA_LBSPP128_LPB2_LRVW2_MAC_NLCA1_NLCB1_ONLL1_PGR1_PLR9_SIA3_SU32_SUS128_SRVW2_SNLL0_TT1_96_TLDS1_USFGROn1_VSn1_VW1_WSGRA1_WSGRB1_WG128_2_1_WGM15
    SolutionIndex: 133
    SolutionNameMin: Cijk_Ailk_Bljk_SB_MT64x64x32_MI32x32x2x1_SE_1LDSB0_AF0EM1_AMAS0_BL1_DTL0_DVO0_EPS0_FL0_GRVW4_GSU1_ISA908_IU1_KLA_LBSPP128_LPB4_LRVW2_MAC_NLCA1_NLCB1_ONLL1_PGR2_PLR17_SIA3_SU32_SUS256_SRVW2_SNLL0_TT1_32_TLDS1_USFGROn1_VSn1_VW1_WSGRA1_WSGRB1_WG64_4_1_WGM15
    SolutionIndex: 134
    SolutionNameMin: Cijk_Ailk_Bljk_SB_MT64x64x16_MI32x32x2x1_SE_1LDSB0_AF0EM1_AMAS0_BL1_DTL0_DVO0_EPS0_FL0_GRVW1_GSU1_ISA908_IU1_KLA_LBSPP128_LPB2_LRVW2_MAC_NLCA1_NLCB1_ONLL1_PGR2_PLR9_SIA3_SU32_SUS256_SRVW2_SNLL0_TT1_32_TLDS1_USFGROn1_VSn1_VW1_WSGRA1_WSGRB1_WG64_4_1_WGM1
    SolutionIndex: 135
    SolutionNameMin: Cijk_Ailk_Bljk_SB_MT16x8x32_SE_1LDSB0_AF0EM1_AMAS3_BL1_DTL0_DVO0_EPS1_FL1_GRVW2_GSU4_ISA908_IU1_KLA_LBSPP0_LPB2_LRVW2_MAC_NLCA1_NLCB1_ONLL1_PGR1_PLR0_SIA1_SU32_SUS256_SRVW0_SNLL0_TT2_2_TLDS0_USFGRO0_VS1_VW2_WSGRA0_WSGRB0_WG8_4_4_WGM1
    SolutionIndex: 136
    SolutionNameMin: Cijk_Ailk_Bljk_SB_MT96x96x32_MI16x16x4x1_SE_1LDSB1_AF0EM1_AMAS0_BL1_DTL0_DVO0_EPS1_FL0_GRVW4_GSU1_ISA908_IU1_KLA_LBSPP128_LPB4_LRVW2_MAC_NLCA3_NLCB1_ONLL1_PGR1_PLR9_SIA3_SU32_SUS256_SRVW0_SNLL0_TT3_48_TLDS1_USFGROn1_VSn1_VW1_WSGRA1_WSGRB1_WG32_8_1_WGM15
    SolutionIndex: 137
    SolutionNameMin: Cijk_Ailk_Bljk_SB_MT128x96x32_MI32x32x2x1_SE_1LDSB0_AF0EM1_AMAS0_BL1_DTL0_DVO0_EPS1_FL0_GRVW4_GSU1_ISA908_IU1_KLA_LBSPP128_LPB4_LRVW2_MAC_NLCA1_NLCB1_ONLL1_PGR1_PLR17_SIA3_SU32_SUS256_SRVW2_SNLL0_TT1_96_TLDS1_USFGROn1_VSn1_VW1_WSGRA1_WSGRB1_WG128_2_1_WGM15
    SolutionIndex: 138
    SolutionNameMin: Cijk_Ailk_Bljk_SB_MT64x32x32_MI16x16x4x1_SN_1LDSB0_AF0EM1_AMAS0_BL1_DTL0_DVO0_EPS0_FL0_GRVW4_GSU1_ISA908_IU1_KLA_LBSPP128_LPB4_LRVW2_MAC_NLCA1_NLCB1_ONLL1_PGR2_PLR9_SIA3_SU32_SUS256_SRVW2_SNLL0_TT2_16_TLDS1_USFGROn1_VSn1_VW1_WSGRA1_WSGRB1_WG32_8_1_WGM15
    SolutionIndex: 139
    SolutionNameMin: Cijk_Ailk_Bljk_SB_MT16x64x32_MI16x16x4x1_SE_1LDSB0_AF0EM1_AMAS0_BL1_DTL0_DVO0_EPS0_FL0_GRVW4_GSU1_ISA908_IU1_KLA_LBSPP128_LPB4_LRVW2_MAC_NLCA1_NLCB1_ONLL1_PGR2_PLR9_SIA3_SU32_SUS256_SRVW0_SNLL0_TT1_16_TLDS1_USFGROn1_VSn1_VW1_WSGRA1_WSGRB1_WG16_16_1_WGM15
    SolutionIndex: 140
    SolutionNameMin: Cijk_Ailk_Bljk_SB_MT64x4x64_SN_1LDSB0_AF0EM1_AMAS3_BL1_DTL0_DVO0_EPS0_FL0_GRVW2_GSU16_ISA908_IU1_KLA_LBSPP0_LPB0_LRVW2_MAC_NLCA1_NLCB1_ONLL1_PGR0_PLR1_SIA1_SU32_SUS256_SRVW0_SNLL0_TT4_2_TLDS0_USFGRO0_VS1_VW2_WSGRA0_WSGRB0_WG16_2_8_WGM1
    SolutionIndex: 141
    SolutionNameMin: Cijk_Ailk_Bljk_SB_MT64x64x16_MI16x16x4x1_SE_1LDSB0_AF0EM1_AMAS3_BL1_DTL0_DVO0_EPS1_FL0_GRVW4_GSU1_ISA908_IU1_KLA_LBSPP0_LPB0_LRVW1_MAC_NLCA1_NLCB1_ONLL1_PGR1_PLR1_SIA3_SU32_SUS256_SRVW0_SNLL0_TT4_16_TLDS0_USFGROn1_VSn1_VW2_WSGRA1_WSGRB0_WG16_16_1_WGM16
    SolutionIndex: 142
    SolutionNameMin: Cijk_Ailk_Bljk_SB_MT64x128x16_MI32x32x2x1_SN_1LDSB0_AF0EM1_AMAS0_BL1_DTL0_DVO0_EPS0_FL0_GRVW1_GSU1_ISA908_IU1_KLA_LBSPP128_LPB2_LRVW2_MAC_NLCA1_NLCB1_ONLL1_PGR2_PLR9_SIA3_SU32_SUS256_SRVW2_SNLL0_TT1_64_TLDS1_USFGROn1_VSn1_VW1_WSGRA1_WSGRB1_WG64_4_1_WGM15
    SolutionIndex: 143
    SolutionNameMin: Cijk_Ailk_Bljk_SB_MT64x64x16_SE_1LDSB0_AF0EM1_AMAS3_BL1_DTL0_DVO0_EPS0_FL1_GRVW2_GSU1_ISA908_IU1_KLA_LBSPP0_LPB2_LRVW2_MAC_NLCA1_NLCB1_ONLL1_PGR0_PLR1_SIA1_SU32_SUS256_SRVW0_SNLL0_TT4_4_TLDS0_USFGRO0_VS1_VW2_WSGRA0_WSGRB0_WG16_16_1_WGM16
    SolutionIndex: 144
    SolutionNameMin: Cijk_Ailk_Bljk_SB_MT32x64x32_MI16x16x4x1_SE_1LDSB0_AF0EM1_AMAS0_BL1_DTL0_DVO0_EPS0_FL0_GRVW1_GSU1_ISA908_IU1_KLA_LBSPP128_LPB2_LRVW2_MAC_NLCA1_NLCB1_ONLL1_PGR2_PLR9_SIA3_SU32_SUS128_SRVW2_SNLL0_TT1_32_TLDS1_USFGROn1_VSn1_VW1_WSGRA1_WSGRB1_WG32_8_1_WGM15
    SolutionIndex: 145
    SolutionNameMin: Cijk_Ailk_Bljk_SB_MT64x32x16_MI16x16x4x1_SE_1LDSB0_AF0EM1_AMAS0_BL1_DTL0_DVO0_EPS0_FL0_GRVW1_GSU1_ISA908_IU1_KLA_LBSPP128_LPB2_LRVW2_MAC_NLCA1_NLCB1_ONLL1_PGR2_PLR5_SIA3_SU32_SUS256_SRVW2_SNLL0_TT2_16_TLDS1_USFGROn1_VSn1_VW1_WSGRA1_WSGRB1_WG32_8_1_WGM1
    SolutionIndex: 146
    SolutionNameMin: Cijk_Ailk_Bljk_SB_MT128x96x16_MI32x32x2x1_SE_1LDSB0_AF0EM1_AMAS0_BL1_DTL0_DVO0_EPS1_FL0_GRVW2_GSU1_ISA908_IU1_KLA_LBSPP128_LPB2_LRVW2_MAC_NLCA1_NLCB1_ONLL1_PGR1_PLR9_SIA3_SU0_SUS256_SRVW2_SNLL0_TT1_96_TLDS1_USFGROn1_VSn1_VW1_WSGRA1_WSGRB1_WG128_2_1_WGM15
    SolutionIndex: 147
    SolutionNameMin: Cijk_Ailk_Bljk_SB_MT16x16x32_MI16x16x4x1_SE_1LDSB0_AF0EM1_AMAS0_BL1_DTL0_DVO0_EPS0_FL0_GRVW2_GSU3_ISA908_IU1_KLA_LBSPP128_LPB2_LRVW2_MAC_NLCA1_NLCB1_ONLL1_PGR2_PLR9_SIA3_SU32_SUS256_SRVW0_SNLL0_TT1_16_TLDS1_USFGROn1_VSn1_VW1_WSGRA1_WSGRB1_WG16_4_1_WGM1
    SolutionIndex: 148
    SolutionNameMin: Cijk_Ailk_Bljk_SB_MT32x32x32_MI16x16x4x1_SE_1LDSB0_AF0EM1_AMAS0_BL1_DTL0_DVO0_EPS0_FL0_GRVW1_GSU1_ISA908_IU1_KLA_LBSPP128_LPB2_LRVW2_MAC_NLCA1_NLCB1_ONLL1_PGR2_PLR9_SIA3_SU32_SUS128_SRVW2_SNLL0_TT1_16_TLDS1_USFGROn1_VSn1_VW1_WSGRA1_WSGRB1_WG32_8_1_WGM2
    SolutionIndex: 149
    SolutionNameMin: Cijk_Ailk_Bljk_SB_MT32x64x16_MI16x16x4x1_SE_1LDSB0_AF0EM1_AMAS0_BL1_DTL0_DVO0_EPS0_FL0_GRVW1_GSU1_ISA908_IU1_KLA_LBSPP128_LPB2_LRVW2_MAC_NLCA1_NLCB1_ONLL1_PGR2_PLR5_SIA3_SU0_SUS256_SRVW2_SNLL0_TT1_32_TLDS1_USFGROn1_VSn1_VW1_WSGRA1_WSGRB1_WG32_8_1_WGM2
    SolutionIndex: 150
    SolutionNameMin: Cijk_Ailk_Bljk_SB_MT64x64x32_MI32x32x2x1_SE_1LDSB0_AF0EM1_AMAS0_BL1_DTL0_DVO0_EPS0_FL0_GRVW2_GSU1_ISA908_IU1_KLA_LBSPP128_LPB2_LRVW2_MAC_NLCA1_NLCB1_ONLL1_PGR2_PLR17_SIA3_SU32_SUS128_SRVW2_SNLL0_TT1_32_TLDS1_USFGROn1_VSn1_VW1_WSGRA1_WSGRB1_WG64_4_1_WGM2
    SolutionIndex: 151
    SolutionNameMin: Cijk_Ailk_Bljk_SB_MT64x128x16_MI32x32x2x1_SE_1LDSB0_AF0EM1_AMAS0_BL1_DTL0_DVO0_EPS0_FL0_GRVW1_GSU1_ISA908_IU1_KLA_LBSPP128_LPB2_LRVW2_MAC_NLCA1_NLCB1_ONLL1_PGR2_PLR9_SIA3_SU32_SUS128_SRVW2_SNLL0_TT1_64_TLDS1_USFGROn1_VSn1_VW1_WSGRA1_WSGRB1_WG64_4_1_WGM15
    SolutionIndex: 152
    SolutionNameMin: Cijk_Ailk_Bljk_SB_MT64x64x16_MI16x16x4x1_SE_1LDSB0_AF0EM1_AMAS3_BL1_DTL0_DVO0_EPS1_FL1_GRVW4_GSU1_ISA908_IU1_KLA_LBSPP0_LPB0_LRVW1_MAC_NLCA1_NLCB1_ONLL0_PGR1_PLR1_SIA3_SU32_SUS256_SRVW4_SNLL0_TT4_16_TLDS1_USFGROn1_VSn1_VW4_WSGRA0_WSGRB0_WG16_16_1_WGM8
    SolutionIndex: 153
    SolutionNameMin: Cijk_Ailk_Bljk_SB_MT128x96x16_MI32x32x2x1_SE_1LDSB0_AF0EM1_AMAS0_BL1_DTL0_DVO0_EPS0_FL0_GRVW2_GSU1_ISA908_IU1_KLA_LBSPP128_LPB2_LRVW2_MAC_NLCA1_NLCB1_ONLL1_PGR2_PLR9_SIA3_SU0_SUS256_SRVW2_SNLL0_TT1_96_TLDS1_USFGROn1_VSn1_VW1_WSGRA1_WSGRB1_WG128_2_1_WGM2
    SolutionIndex: 154
    SolutionNameMin: Cijk_Ailk_Bljk_SB_MT144x64x16_MI16x16x4x1_SE_1LDSB0_AF0EM1_AMAS0_BL1_DTL0_DVO0_EPS0_FL0_GRVW1_GSU1_ISA908_IU1_KLA_LBSPP128_LPB2_LRVW2_MAC_NLCA9_NLCB1_ONLL1_PGR2_PLR5_SIA3_SU32_SUS128_SRVW0_SNLL0_TT9_16_TLDS1_USFGROn1_VSn1_VW1_WSGRA1_WSGRB1_WG16_16_1_WGM2
    SolutionIndex: 155
    SolutionNameMin: Cijk_Ailk_Bljk_SB_MT32x32x32_MI16x16x4x1_SE_1LDSB0_AF0EM1_AMAS0_BL1_DTL0_DVO0_EPS1_FL0_GRVW1_GSU1_ISA908_IU1_KLA_LBSPP128_LPB2_LRVW2_MAC_NLCA1_NLCB1_ONLL1_PGR1_PLR9_SIA3_SU0_SUS256_SRVW2_SNLL0_TT1_16_TLDS1_USFGROn1_VSn1_VW1_WSGRA1_WSGRB1_WG32_8_1_WGM2
    SolutionIndex: 156
    SolutionNameMin: Cijk_Ailk_Bljk_SB_MT64x32x32_MI16x16x4x1_SE_1LDSB0_AF0EM1_AMAS0_BL1_DTL0_DVO0_EPS0_FL0_GRVW4_GSU1_ISA908_IU1_KLA_LBSPP128_LPB4_LRVW2_MAC_NLCA1_NLCB1_ONLL1_PGR2_PLR9_SIA3_SU0_SUS256_SRVW2_SNLL0_TT2_16_TLDS1_USFGROn1_VSn1_VW1_WSGRA1_WSGRB1_WG32_8_1_WGM15
    SolutionIndex: 157
    SolutionNameMin: Cijk_Ailk_Bljk_SB_MT64x64x16_MI16x16x4x1_SE_1LDSB0_AF0EM1_AMAS0_BL1_DTL0_DVO0_EPS1_FL0_GRVW4_GSU1_ISA908_IU1_KLA_LBSPP0_LPB0_LRVW1_MAC_NLCA1_NLCB1_ONLL1_PGR1_PLR1_SIA3_SU32_SUS256_SRVW0_SNLL0_TT2_32_TLDS0_USFGROn1_VSn1_VW1_WSGRA1_WSGRB1_WG32_8_1_WGM8
    SolutionIndex: 158
    SolutionNameMin: Cijk_Ailk_Bljk_SB_MT8x32x32_SE_1LDSB0_AF0EM1_AMAS3_BL1_DTL0_DVO0_EPS1_FL1_GRVW2_GSU1_ISA908_IU1_KLA_LBSPP0_LPB2_LRVW2_MAC_NLCA1_NLCB1_ONLL1_PGR1_PLR1_SIA1_SU32_SUS256_SRVW0_SNLL1_TT4_2_TLDS0_USFGRO0_VS1_VW2_WSGRA0_WSGRB0_WG2_16_8_WGM8
    SolutionIndex: 159
    SolutionNameMin: Cijk_Ailk_Bljk_SB_MT32x32x16_MI16x16x4x1_SN_1LDSB0_AF0EM1_AMAS0_BL1_DTL0_DVO0_EPS0_FL0_GRVW1_GSU1_ISA908_IU1_KLA_LBSPP128_LPB2_LRVW2_MAC_NLCA1_NLCB1_ONLL1_PGR2_PLR5_SIA3_SU32_SUS256_SRVW2_SNLL0_TT1_16_TLDS1_USFGROn1_VSn1_VW1_WSGRA1_WSGRB1_WG32_8_1_WGM2
    SolutionIndex: 160
    SolutionNameMin: Cijk_Ailk_Bljk_SB_MT16x8x32_SE_1LDSB0_AF0EM1_AMAS3_BL1_DTL0_DVO0_EPS1_FL1_GRVW2_GSU4_ISA908_IU1_KLA_LBSPP0_LPB0_LRVW2_MAC_NLCA1_NLCB1_ONLL1_PGR1_PLR1_SIA1_SU32_SUS256_SRVW0_SNLL0_TT2_2_TLDS0_USFGRO0_VS1_VW2_WSGRA0_WSGRB0_WG8_4_4_WGM1
    SolutionIndex: 161
    SolutionNameMin: Cijk_Ailk_Bljk_SB_MT64x16x32_MI16x16x4x1_SE_1LDSB0_AF0EM1_AMAS0_BL1_DTL0_DVO0_EPS0_FL0_GRVW1_GSU1_ISA908_IU1_KLA_LBSPP128_LPB2_LRVW2_MAC_NLCA1_NLCB1_ONLL1_PGR2_PLR9_SIA3_SU0_SUS256_SRVW0_SNLL0_TT1_16_TLDS1_USFGROn1_VSn1_VW1_WSGRA1_WSGRB1_WG64_4_1_WGM1
    SolutionIndex: 162
    SolutionNameMin: Cijk_Ailk_Bljk_SB_MT32x32x16_MI16x16x4x1_SE_1LDSB0_AF0EM1_AMAS0_BL1_DTL0_DVO0_EPS1_FL0_GRVW1_GSU1_ISA908_IU1_KLA_LBSPP128_LPB2_LRVW2_MAC_NLCA1_NLCB1_ONLL1_PGR1_PLR5_SIA3_SU0_SUS256_SRVW2_SNLL0_TT1_16_TLDS1_USFGROn1_VSn1_VW1_WSGRA1_WSGRB1_WG32_8_1_WGM15
    SolutionIndex: 163
    SolutionNameMin: Cijk_Ailk_Bljk_SB_MT64x32x32_MI16x16x4x1_SE_1LDSB0_AF0EM1_AMAS0_BL1_DTL0_DVO0_EPS0_FL0_GRVW1_GSU3_ISA908_IU1_KLA_LBSPP128_LPB2_LRVW2_MAC_NLCA1_NLCB1_ONLL1_PGR2_PLR9_SIA3_SU32_SUS128_SRVW0_SNLL0_TT2_16_TLDS1_USFGROn1_VSn1_VW1_WSGRA1_WSGRB1_WG32_8_1_WGM15
    SolutionIndex: 164
    SolutionNameMin: Cijk_Ailk_Bljk_SB_MT16x16x32_SE_1LDSB0_AF0EM1_AMAS3_BL1_DTL0_DVO0_EPS1_FL1_GRVW2_GSU1_ISA908_IU1_KLA_LBSPP0_LPB2_LRVW2_MAC_NLCA1_NLCB1_ONLL1_PGR1_PLR1_SIA1_SU32_SUS256_SRVW0_SNLL1_TT2_2_TLDS0_USFGRO0_VS1_VW2_WSGRA0_WSGRB0_WG8_8_4_WGM16
    SolutionIndex: 165
    SolutionNameMin: Cijk_Ailk_Bljk_SB_MT128x128x16_MI32x32x2x1_SE_1LDSB0_AF0EM1_AMAS0_BL1_DTL0_DVO0_EPS1_FL0_GRVW4_GSU1_ISA908_IU1_KLA_LBSPP128_LPB4_LRVW2_MAC_NLCA1_NLCB1_ONLL1_PGR1_PLR9_SIA3_SU32_SUS256_SRVW2_SNLL0_TT2_64_TLDS1_USFGROn1_VSn1_VW1_WSGRA1_WSGRB1_WG64_4_1_WGM1
    SolutionIndex: 166
    SolutionNameMin: Cijk_Ailk_Bljk_SB_MT64x32x16_MI16x16x4x1_SE_1LDSB0_AF0EM1_AMAS0_BL1_DTL0_DVO0_EPS0_FL0_GRVW2_GSU1_ISA908_IU1_KLA_LBSPP128_LPB2_LRVW2_MAC_NLCA1_NLCB1_ONLL1_PGR2_PLR5_SIA3_SU0_SUS256_SRVW2_SNLL0_TT2_16_TLDS1_USFGROn1_VSn1_VW1_WSGRA1_WSGRB1_WG32_8_1_WGM2
    SolutionIndex: 167
    SolutionNameMin: Cijk_Ailk_Bljk_SB_MT64x32x16_MI16x16x4x1_SE_1LDSB0_AF0EM1_AMAS0_BL1_DTL0_DVO0_EPS0_FL0_GRVW1_GSU1_ISA908_IU1_KLA_LBSPP128_LPB2_LRVW2_MAC_NLCA1_NLCB1_ONLL1_PGR2_PLR5_SIA3_SU32_SUS256_SRVW2_SNLL0_TT2_16_TLDS1_USFGROn1_VSn1_VW1_WSGRA1_WSGRB1_WG32_8_1_WGM15
    SolutionIndex: 168
    SolutionNameMin: Cijk_Ailk_Bljk_SB_MT64x64x32_MI32x32x2x1_SE_1LDSB0_AF0EM1_AMAS0_BL1_DTL0_DVO0_EPS0_FL0_GRVW4_GSU1_ISA908_IU1_KLA_LBSPP128_LPB4_LRVW2_MAC_NLCA1_NLCB1_ONLL1_PGR2_PLR17_SIA3_SU0_SUS256_SRVW2_SNLL0_TT1_32_TLDS1_USFGROn1_VSn1_VW1_WSGRA1_WSGRB1_WG64_4_1_WGM1
    SolutionIndex: 169
    SolutionNameMin: Cijk_Ailk_Bljk_SB_MT64x128x16_MI32x32x2x1_SE_1LDSB0_AF0EM1_AMAS0_BL1_DTL0_DVO0_EPS1_FL0_GRVW4_GSU1_ISA908_IU1_KLA_LBSPP128_LPB4_LRVW2_MAC_NLCA1_NLCB1_ONLL1_PGR1_PLR9_SIA3_SU32_SUS128_SRVW2_SNLL0_TT1_64_TLDS1_USFGROn1_VSn1_VW1_WSGRA1_WSGRB1_WG64_4_1_WGM15
    SolutionIndex: 170
    SolutionNameMin: Cijk_Ailk_Bljk_SB_MT64x128x16_MI32x32x2x1_SE_1LDSB0_AF0EM1_AMAS0_BL1_DTL0_DVO0_EPS0_FL0_GRVW4_GSU1_ISA908_IU1_KLA_LBSPP128_LPB4_LRVW2_MAC_NLCA1_NLCB1_ONLL1_PGR2_PLR9_SIA3_SU32_SUS128_SRVW2_SNLL0_TT1_64_TLDS1_USFGROn1_VSn1_VW1_WSGRA1_WSGRB1_WG64_4_1_WGM15
    SolutionIndex: 171
    SolutionNameMin: Cijk_Ailk_Bljk_SB_MT32x32x32_MI16x16x4x1_SE_1LDSB0_AF0EM1_AMAS0_BL1_DTL0_DVO0_EPS0_FL0_GRVW1_GSU1_ISA908_IU1_KLA_LBSPP128_LPB2_LRVW2_MAC_NLCA1_NLCB1_ONLL1_PGR2_PLR9_SIA3_SU32_SUS256_SRVW2_SNLL0_TT1_16_TLDS1_USFGROn1_VSn1_VW1_WSGRA1_WSGRB1_WG32_8_1_WGM1
    SolutionIndex: 172
    SolutionNameMin: Cijk_Ailk_Bljk_SB_MT64x64x16_SE_1LDSB0_AF0EM1_AMAS3_BL1_DTL0_DVO0_EPS1_FL1_GRVW4_GSU1_ISA908_IU1_KLA_LBSPP0_LPB0_LRVW4_MAC_NLCA1_NLCB1_ONLL1_PGR1_PLR1_SIA1_SU32_SUS256_SRVW0_SNLL1_TT4_4_TLDS0_USFGRO0_VS1_VW4_WSGRA0_WSGRB0_WG16_16_1_WGM8
    SolutionIndex: 173
    SolutionNameMin: Cijk_Ailk_Bljk_SB_MT16x16x16_SN_1LDSB0_AF0EM1_AMAS3_BL1_DTL0_DVO0_EPS1_FL0_GRVW2_GSU1_ISA908_IU1_KLA_LBSPP0_LPB0_LRVW2_MAC_NLCA1_NLCB1_ONLL1_PGR1_PLR1_SIA1_SU32_SUS256_SRVW0_SNLL0_TT2_2_TLDS0_USFGRO1_VS1_VW2_WSGRA0_WSGRB0_WG8_8_4_WGM1
    SolutionIndex: 174
    SolutionNameMin: Cijk_Ailk_Bljk_SB_MT128x64x32_MI32x32x2x1_SE_1LDSB0_AF0EM1_AMAS0_BL1_DTL0_DVO0_EPS0_FL0_GRVW4_GSU1_ISA908_IU1_KLA_LBSPP128_LPB4_LRVW2_MAC_NLCA1_NLCB1_ONLL1_PGR2_PLR17_SIA3_SU32_SUS256_SRVW2_SNLL0_TT2_32_TLDS1_USFGROn1_VSn1_VW1_WSGRA1_WSGRB1_WG64_4_1_WGM15
    SolutionIndex: 175
    SolutionNameMin: Cijk_Ailk_Bljk_SB_MT144x64x32_MI16x16x4x1_SE_1LDSB0_AF0EM1_AMAS0_BL1_DTL0_DVO0_EPS0_FL0_GRVW1_GSU2_ISA908_IU1_KLA_LBSPP128_LPB2_LRVW2_MAC_NLCA9_NLCB1_ONLL1_PGR2_PLR9_SIA3_SU32_SUS256_SRVW0_SNLL0_TT9_16_TLDS1_USFGROn1_VSn1_VW1_WSGRA1_WSGRB1_WG16_16_1_WGM2
    SolutionIndex: 176
    SolutionNameMin: Cijk_Ailk_Bljk_SB_MT128x96x16_MI32x32x2x1_SE_1LDSB0_AF0EM1_AMAS0_BL1_DTL0_DVO0_EPS0_FL0_GRVW2_GSU1_ISA908_IU1_KLA_LBSPP128_LPB2_LRVW2_MAC_NLCA1_NLCB1_ONLL1_PGR2_PLR9_SIA3_SU0_SUS256_SRVW2_SNLL0_TT1_96_TLDS1_USFGROn1_VSn1_VW1_WSGRA1_WSGRB1_WG128_2_1_WGM15
    SolutionIndex: 177
    SolutionNameMin: Cijk_Ailk_Bljk_SB_MT64x64x32_MI32x32x2x1_SE_1LDSB0_AF0EM1_AMAS0_BL1_DTL0_DVO0_EPS0_FL0_GRVW1_GSU1_ISA908_IU1_KLA_LBSPP128_LPB2_LRVW2_MAC_NLCA1_NLCB1_ONLL1_PGR2_PLR17_SIA3_SU0_SUS256_SRVW2_SNLL0_TT1_32_TLDS1_USFGROn1_VSn1_VW1_WSGRA1_WSGRB1_WG64_4_1_WGM2
    SolutionIndex: 178
    SolutionNameMin: Cijk_Ailk_Bljk_SB_MT64x32x32_MI16x16x4x1_SE_1LDSB0_AF0EM1_AMAS3_BL1_DTL0_DVO0_EPS1_FL0_GRVW4_GSU1_ISA908_IU1_KLA_LBSPP0_LPB0_LRVW1_MAC_NLCA1_NLCB1_ONLL1_PGR1_PLR1_SIA3_SU32_SUS256_SRVW0_SNLL0_TT2_16_TLDS0_USFGROn1_VSn1_VW4_WSGRA1_WSGRB1_WG32_8_1_WGM8
    SolutionIndex: 179
    SolutionNameMin: Cijk_Ailk_Bljk_SB_MT16x16x32_MI16x16x4x1_SE_1LDSB0_AF0EM1_AMAS0_BL1_DTL0_DVO0_EPS0_FL0_GRVW4_GSU1_ISA908_IU1_KLA_LBSPP128_LPB4_LRVW2_MAC_NLCA1_NLCB1_ONLL1_PGR2_PLR9_SIA3_SU0_SUS256_SRVW0_SNLL0_TT1_16_TLDS1_USFGROn1_VSn1_VW1_WSGRA1_WSGRB1_WG16_4_1_WGM1
    SolutionIndex: 180
    SolutionNameMin: Cijk_Ailk_Bljk_SB_MT64x32x32_MI16x16x4x1_SE_1LDSB0_AF0EM1_AMAS0_BL1_DTL0_DVO0_EPS0_FL0_GRVW2_GSU1_ISA908_IU1_KLA_LBSPP128_LPB2_LRVW2_MAC_NLCA1_NLCB1_ONLL1_PGR2_PLR9_SIA3_SU32_SUS256_SRVW2_SNLL0_TT2_16_TLDS1_USFGROn1_VSn1_VW1_WSGRA1_WSGRB1_WG32_8_1_WGM1
    SolutionIndex: 181
    SolutionNameMin: Cijk_Ailk_Bljk_SB_MT128x160x16_MI32x32x2x1_SE_1LDSB0_AF0EM1_AMAS0_BL1_DTL0_DVO0_EPS1_FL0_GRVW2_GSU1_ISA908_IU1_KLA_LBSPP128_LPB2_LRVW2_MAC_NLCA1_NLCB1_ONLL1_PGR1_PLR9_SIA3_SU0_SUS256_SRVW2_SNLL0_TT1_160_TLDS1_USFGROn1_VSn1_VW1_WSGRA1_WSGRB1_WG128_2_1_WGM15
    SolutionIndex: 182
    SolutionNameMin: Cijk_Ailk_Bljk_SB_MT64x64x32_MI16x16x4x1_SE_1LDSB0_AF0EM1_AMAS3_BL1_DTL0_DVO0_EPS1_FL0_GRVW4_GSU1_ISA908_IU1_KLA_LBSPP0_LPB0_LRVW1_MAC_NLCA1_NLCB1_ONLL1_PGR1_PLR1_SIA3_SU32_SUS256_SRVW0_SNLL0_TT2_32_TLDS0_USFGROn1_VSn1_VW2_WSGRA1_WSGRB1_WG32_8_1_WGM8
    SolutionIndex: 183
    SolutionNameMin: Cijk_Ailk_Bljk_SB_MT64x64x32_MI32x32x2x1_SE_1LDSB0_AF0EM1_AMAS0_BL1_DTL0_DVO0_EPS0_FL0_GRVW4_GSU1_ISA908_IU1_KLA_LBSPP128_LPB4_LRVW2_MAC_NLCA1_NLCB1_ONLL1_PGR2_PLR17_SIA3_SU0_SUS256_SRVW2_SNLL0_TT1_32_TLDS1_USFGROn1_VSn1_VW1_WSGRA1_WSGRB1_WG64_4_1_WGM15
    SolutionIndex: 184
    SolutionNameMin: Cijk_Ailk_Bljk_SB_MT128x160x16_MI32x32x2x1_SE_1LDSB0_AF0EM1_AMAS0_BL1_DTL0_DVO0_EPS1_FL0_GRVW1_GSU1_ISA908_IU1_KLA_LBSPP128_LPB2_LRVW2_MAC_NLCA2_NLCB1_ONLL1_PGR1_PLR9_SIA3_SU0_SUS256_SRVW2_SNLL0_TT1_160_TLDS1_USFGROn1_VSn1_VW1_WSGRA1_WSGRB1_WG128_2_1_WGM15
    SolutionIndex: 185
    SolutionNameMin: Cijk_Ailk_Bljk_SB_MT32x32x32_MI16x16x4x1_SE_1LDSB0_AF0EM1_AMAS0_BL1_DTL0_DVO0_EPS0_FL0_GRVW2_GSU3_ISA908_IU1_KLA_LBSPP128_LPB2_LRVW2_MAC_NLCA1_NLCB1_ONLL1_PGR2_PLR9_SIA3_SU0_SUS256_SRVW0_SNLL0_TT1_16_TLDS1_USFGROn1_VSn1_VW1_WSGRA1_WSGRB1_WG32_8_1_WGM1
    SolutionIndex: 186
    SolutionNameMin: Cijk_Ailk_Bljk_SB_MT128x96x16_MI32x32x2x1_SE_1LDSB0_AF0EM1_AMAS0_BL1_DTL0_DVO0_EPS0_FL0_GRVW2_GSU1_ISA908_IU1_KLA_LBSPP128_LPB2_LRVW2_MAC_NLCA1_NLCB1_ONLL1_PGR2_PLR9_SIA3_SU32_SUS256_SRVW2_SNLL0_TT1_96_TLDS1_USFGROn1_VSn1_VW1_WSGRA1_WSGRB1_WG128_2_1_WGM15
    SolutionIndex: 187
    SolutionNameMin: Cijk_Ailk_Bljk_SB_MT64x128x16_MI32x32x2x1_SE_1LDSB0_AF0EM1_AMAS0_BL1_DTL0_DVO0_EPS0_FL0_GRVW1_GSU1_ISA908_IU1_KLA_LBSPP128_LPB2_LRVW2_MAC_NLCA1_NLCB1_ONLL1_PGR2_PLR9_SIA3_SU32_SUS128_SRVW2_SNLL0_TT1_64_TLDS1_USFGROn1_VSn1_VW1_WSGRA1_WSGRB1_WG64_4_1_WGM2
    SolutionIndex: 188
    SolutionNameMin: Cijk_Ailk_Bljk_SB_MT144x64x16_MI16x16x4x1_SE_1LDSB0_AF0EM1_AMAS0_BL1_DTL0_DVO0_EPS0_FL0_GRVW1_GSU1_ISA908_IU1_KLA_LBSPP128_LPB2_LRVW2_MAC_NLCA9_NLCB1_ONLL1_PGR2_PLR5_SIA3_SU32_SUS128_SRVW0_SNLL0_TT9_16_TLDS1_USFGROn1_VSn1_VW1_WSGRA1_WSGRB1_WG16_16_1_WGM15
    SolutionIndex: 189
    SolutionNameMin: Cijk_Ailk_Bljk_SB_MT16x16x32_SE_1LDSB0_AF0EM1_AMAS3_BL1_DTL0_DVO0_EPS1_FL1_GRVW2_GSU1_ISA908_IU1_KLA_LBSPP0_LPB2_LRVW2_MAC_NLCA1_NLCB1_ONLL1_PGR1_PLR1_SIA1_SU32_SUS256_SRVW0_SNLL1_TT2_4_TLDS0_USFGRO0_VS1_VW2_WSGRA0_WSGRB0_WG8_4_8_WGM8
    SolutionIndex: 190
    SolutionNameMin: Cijk_Ailk_Bljk_SB_MT128x128x16_MI32x32x2x1_SE_1LDSB0_AF0EM1_AMAS0_BL1_DTL0_DVO0_EPS1_FL0_GRVW1_GSU1_ISA908_IU1_KLA_LBSPP128_LPB2_LRVW2_MAC_NLCA2_NLCB1_ONLL1_PGR1_PLR9_SIA3_SU32_SUS256_SRVW2_SNLL0_TT2_64_TLDS1_USFGROn1_VSn1_VW1_WSGRA1_WSGRB1_WG64_4_1_WGM15
    SolutionIndex: 191
    SolutionNameMin: Cijk_Ailk_Bljk_SB_MT64x64x16_MI32x32x2x1_SE_1LDSB0_AF0EM1_AMAS0_BL1_DTL0_DVO0_EPS0_FL0_GRVW4_GSU1_ISA908_IU1_KLA_LBSPP128_LPB4_LRVW2_MAC_NLCA1_NLCB1_ONLL1_PGR2_PLR9_SIA3_SU0_SUS256_SRVW2_SNLL0_TT1_32_TLDS1_USFGROn1_VSn1_VW1_WSGRA1_WSGRB1_WG64_4_1_WGM15
    SolutionIndex: 192
    SolutionNameMin: Cijk_Ailk_Bljk_SB_MT128x96x16_MI32x32x2x1_SE_1LDSB0_AF0EM1_AMAS0_BL1_DTL0_DVO0_EPS0_FL0_GRVW1_GSU1_ISA908_IU1_KLA_LBSPP128_LPB2_LRVW2_MAC_NLCA2_NLCB1_ONLL1_PGR2_PLR9_SIA3_SU0_SUS256_SRVW2_SNLL0_TT1_96_TLDS1_USFGROn1_VSn1_VW1_WSGRA1_WSGRB1_WG128_2_1_WGM2
    SolutionIndex: 193
    SolutionNameMin: Cijk_Ailk_Bljk_SB_MT64x16x32_SE_1LDSB0_AF0EM1_AMAS3_BL1_DTL0_DVO0_EPS1_FL0_GRVW4_GSU1_ISA908_IU1_KLA_LBSPP0_LPB4_LRVW4_MAC_NLCA1_NLCB1_ONLL1_PGR1_PLR1_SIA1_SU32_SUS256_SRVW0_SNLL0_TT4_4_TLDS0_USFGRO0_VS1_VW4_WSGRA0_WSGRB0_WG16_4_4_WGM1
    SolutionIndex: 194
    SolutionNameMin: Cijk_Ailk_Bljk_SB_MT16x64x32_MI16x16x4x1_SE_1LDSB0_AF0EM1_AMAS0_BL1_DTL0_DVO0_EPS0_FL0_GRVW1_GSU1_ISA908_IU1_KLA_LBSPP128_LPB2_LRVW2_MAC_NLCA1_NLCB1_ONLL1_PGR2_PLR9_SIA3_SU0_SUS256_SRVW0_SNLL0_TT1_16_TLDS1_USFGROn1_VSn1_VW1_WSGRA1_WSGRB1_WG16_16_1_WGM15
    SolutionIndex: 195
    SolutionNameMin: Cijk_Ailk_Bljk_SB_MT64x64x16_MI32x32x2x1_SE_1LDSB0_AF0EM1_AMAS0_BL1_DTL0_DVO0_EPS0_FL0_GRVW1_GSU1_ISA908_IU1_KLA_LBSPP128_LPB2_LRVW2_MAC_NLCA1_NLCB1_ONLL1_PGR2_PLR9_SIA3_SU0_SUS256_SRVW2_SNLL0_TT1_32_TLDS1_USFGROn1_VSn1_VW1_WSGRA1_WSGRB1_WG64_4_1_WGM2
    SolutionIndex: 196
    SolutionNameMin: Cijk_Ailk_Bljk_SB_MT64x8x32_SN_1LDSB0_AF0EM1_AMAS3_BL1_DTL0_DVO0_EPS0_FL0_GRVW2_GSU32_ISA908_IU1_KLA_LBSPP0_LPB0_LRVW2_MAC_NLCA1_NLCB1_ONLL1_PGR0_PLR1_SIA1_SU32_SUS256_SRVW0_SNLL0_TT2_2_TLDS0_USFGRO0_VS1_VW2_WSGRA0_WSGRB0_WG32_4_2_WGM1
    SolutionIndex: 197
    SolutionNameMin: Cijk_Ailk_Bljk_SB_MT96x96x16_MI16x16x4x1_SE_1LDSB1_AF0EM1_AMAS0_BL1_DTL0_DVO0_EPS0_FL0_GRVW2_GSU1_ISA908_IU1_KLA_LBSPP128_LPB2_LRVW2_MAC_NLCA3_NLCB1_ONLL1_PGR2_PLR5_SIA3_SU0_SUS256_SRVW0_SNLL0_TT3_48_TLDS1_USFGROn1_VSn1_VW1_WSGRA1_WSGRB1_WG32_8_1_WGM2
    SolutionIndex: 198
    SolutionNameMin: Cijk_Ailk_Bljk_SB_MT64x32x32_MI16x16x4x1_SE_1LDSB0_AF0EM1_AMAS0_BL1_DTL0_DVO0_EPS1_FL0_GRVW4_GSU1_ISA908_IU1_KLA_LBSPP128_LPB4_LRVW2_MAC_NLCA1_NLCB1_ONLL1_PGR1_PLR9_SIA3_SU0_SUS256_SRVW2_SNLL0_TT2_16_TLDS1_USFGROn1_VSn1_VW1_WSGRA1_WSGRB1_WG32_8_1_WGM15
    SolutionIndex: 199
    SolutionNameMin: Cijk_Ailk_Bljk_SB_MT96x128x16_MI32x32x2x1_SE_1LDSB0_AF0EM1_AMAS0_BL1_DTL0_DVO0_EPS0_FL0_GRVW1_GSU1_ISA908_IU1_KLA_LBSPP128_LPB2_LRVW2_MAC_NLCA3_NLCB1_ONLL1_PGR2_PLR9_SIA3_SU32_SUS256_SRVW0_SNLL0_TT3_32_TLDS1_USFGROn1_VSn1_VW1_WSGRA1_WSGRB1_WG32_8_1_WGM2
    SolutionIndex: 200
    SolutionNameMin: Cijk_Ailk_Bljk_SB_MT96x96x32_MI16x16x4x1_SE_1LDSB1_AF0EM1_AMAS0_BL1_DTL0_DVO0_EPS1_FL0_GRVW4_GSU1_ISA908_IU1_KLA_LBSPP128_LPB4_LRVW2_MAC_NLCA3_NLCB1_ONLL1_PGR1_PLR9_SIA3_SU0_SUS256_SRVW0_SNLL0_TT3_48_TLDS1_USFGROn1_VSn1_VW1_WSGRA1_WSGRB1_WG32_8_1_WGM2
    SolutionIndex: 201
    SolutionNameMin: Cijk_Ailk_Bljk_SB_MT128x128x16_MI32x32x2x1_SE_1LDSB0_AF0EM1_AMAS0_BL1_DTL0_DVO0_EPS1_FL0_GRVW2_GSU1_ISA908_IU1_KLA_LBSPP128_LPB2_LRVW2_MAC_NLCA1_NLCB1_ONLL1_PGR1_PLR9_SIA3_SU0_SUS256_SRVW2_SNLL0_TT2_64_TLDS1_USFGROn1_VSn1_VW1_WSGRA1_WSGRB1_WG64_4_1_WGM2
    SolutionIndex: 202
    SolutionNameMin: Cijk_Ailk_Bljk_SB_MT32x32x32_MI16x16x4x1_SE_1LDSB0_AF0EM1_AMAS0_BL1_DTL0_DVO0_EPS0_FL0_GRVW4_GSU3_ISA908_IU1_KLA_LBSPP128_LPB4_LRVW2_MAC_NLCA1_NLCB1_ONLL1_PGR2_PLR9_SIA3_SU32_SUS256_SRVW0_SNLL0_TT1_16_TLDS1_USFGROn1_VSn1_VW1_WSGRA1_WSGRB1_WG32_8_1_WGM2
    SolutionIndex: 203
    SolutionNameMin: Cijk_Ailk_Bljk_SB_MT16x16x32_MI16x16x4x1_SE_1LDSB0_AF0EM1_AMAS0_BL1_DTL0_DVO0_EPS0_FL0_GRVW1_GSU2_ISA908_IU1_KLA_LBSPP128_LPB2_LRVW2_MAC_NLCA1_NLCB1_ONLL1_PGR2_PLR9_SIA3_SU0_SUS256_SRVW0_SNLL0_TT1_16_TLDS1_USFGROn1_VSn1_VW1_WSGRA1_WSGRB1_WG16_4_1_WGM2
    SolutionIndex: 204
    SolutionNameMin: Cijk_Ailk_Bljk_SB_MT64x32x32_MI16x16x4x1_SE_1LDSB0_AF0EM1_AMAS0_BL1_DTL0_DVO0_EPS1_FL0_GRVW4_GSU15_ISA908_IU1_KLA_LBSPP128_LPB4_LRVW2_MAC_NLCA1_NLCB1_ONLL1_PGR1_PLR9_SIA3_SU0_SUS256_SRVW0_SNLL0_TT2_16_TLDS1_USFGROn1_VSn1_VW1_WSGRA1_WSGRB1_WG32_8_1_WGM1
    SolutionIndex: 205
    SolutionNameMin: Cijk_Ailk_Bljk_SB_MT144x128x16_MI16x16x4x1_SE_1LDSB1_AF0EM1_AMAS0_BL1_DTL0_DVO0_EPS1_FL0_GRVW1_GSU1_ISA908_IU1_KLA_LBSPP128_LPB2_LRVW2_MAC_NLCA9_NLCB1_ONLL1_PGR1_PLR5_SIA3_SU0_SUS256_SRVW0_SNLL0_TT9_32_TLDS1_USFGROn1_VSn1_VW1_WSGRA1_WSGRB1_WG16_16_1_WGM15
    SolutionIndex: 206
    SolutionNameMin: Cijk_Ailk_Bljk_SB_MT32x64x32_MI16x16x4x1_SE_1LDSB0_AF0EM1_AMAS0_BL1_DTL0_DVO0_EPS0_FL0_GRVW1_GSU1_ISA908_IU1_KLA_LBSPP128_LPB2_LRVW2_MAC_NLCA1_NLCB1_ONLL1_PGR2_PLR9_SIA3_SU32_SUS256_SRVW2_SNLL0_TT1_32_TLDS1_USFGROn1_VSn1_VW1_WSGRA1_WSGRB1_WG32_8_1_WGM15
    SolutionIndex: 207
    SolutionNameMin: Cijk_Ailk_Bljk_SB_MT128x96x16_MI32x32x2x1_SE_1LDSB0_AF0EM1_AMAS0_BL1_DTL0_DVO0_EPS0_FL0_GRVW2_GSU1_ISA908_IU1_KLA_LBSPP128_LPB2_LRVW2_MAC_NLCA1_NLCB1_ONLL1_PGR2_PLR9_SIA3_SU0_SUS256_SRVW2_SNLL0_TT1_96_TLDS1_USFGROn1_VSn1_VW1_WSGRA1_WSGRB1_WG128_2_1_WGM1
    SolutionIndex: 208
    SolutionNameMin: Cijk_Ailk_Bljk_SB_MT16x64x32_MI16x16x4x1_SE_1LDSB0_AF0EM1_AMAS0_BL1_DTL0_DVO0_EPS0_FL0_GRVW4_GSU1_ISA908_IU1_KLA_LBSPP128_LPB4_LRVW2_MAC_NLCA1_NLCB1_ONLL1_PGR2_PLR9_SIA3_SU0_SUS256_SRVW0_SNLL0_TT1_16_TLDS1_USFGROn1_VSn1_VW1_WSGRA1_WSGRB1_WG16_16_1_WGM15
    SolutionIndex: 209
    SolutionNameMin: Cijk_Ailk_Bljk_SB_MT64x128x16_MI32x32x2x1_SE_1LDSB0_AF0EM1_AMAS0_BL1_DTL0_DVO0_EPS0_FL0_GRVW2_GSU1_ISA908_IU1_KLA_LBSPP128_LPB2_LRVW2_MAC_NLCA1_NLCB1_ONLL1_PGR2_PLR9_SIA3_SU0_SUS256_SRVW2_SNLL0_TT1_64_TLDS1_USFGROn1_VSn1_VW1_WSGRA1_WSGRB1_WG64_4_1_WGM1
    SolutionIndex: 210
    SolutionNameMin: Cijk_Ailk_Bljk_SB_MT128x96x16_MI32x32x2x1_SE_1LDSB0_AF0EM1_AMAS0_BL1_DTL0_DVO0_EPS0_FL0_GRVW2_GSU1_ISA908_IU1_KLA_LBSPP128_LPB2_LRVW2_MAC_NLCA1_NLCB1_ONLL1_PGR2_PLR9_SIA3_SU32_SUS128_SRVW2_SNLL0_TT1_96_TLDS1_USFGROn1_VSn1_VW1_WSGRA1_WSGRB1_WG128_2_1_WGM15
    SolutionIndex: 211
    SolutionNameMin: Cijk_Ailk_Bljk_SB_MT64x64x32_MI32x32x2x1_SE_1LDSB0_AF0EM1_AMAS0_BL1_DTL0_DVO0_EPS0_FL0_GRVW1_GSU1_ISA908_IU1_KLA_LBSPP128_LPB2_LRVW2_MAC_NLCA1_NLCB1_ONLL1_PGR2_PLR17_SIA3_SU32_SUS128_SRVW2_SNLL0_TT1_32_TLDS1_USFGROn1_VSn1_VW1_WSGRA1_WSGRB1_WG64_4_1_WGM2
    SolutionIndex: 212
    SolutionNameMin: Cijk_Ailk_Bljk_SB_MT64x64x16_MI32x32x2x1_SE_1LDSB0_AF0EM1_AMAS0_BL1_DTL0_DVO0_EPS0_FL0_GRVW2_GSU1_ISA908_IU1_KLA_LBSPP128_LPB2_LRVW2_MAC_NLCA1_NLCB1_ONLL1_PGR2_PLR9_SIA3_SU32_SUS256_SRVW2_SNLL0_TT1_32_TLDS1_USFGROn1_VSn1_VW1_WSGRA1_WSGRB1_WG64_4_1_WGM2
    SolutionIndex: 213
    SolutionNameMin: Cijk_Ailk_Bljk_SB_MT64x32x16_SN_1LDSB0_AF0EM1_AMAS3_BL1_DTL0_DVO0_EPS1_FL1_GRVW4_GSU1_ISA908_IU1_KLA_LBSPP0_LPB4_LRVW4_MAC_NLCA1_NLCB1_ONLL1_PGR1_PLR1_SIA1_SU32_SUS256_SRVW0_SNLL1_TT4_4_TLDS0_USFGRO0_VS1_VW4_WSGRA0_WSGRB0_WG16_8_2_WGM8
    SolutionIndex: 214
    SolutionNameMin: Cijk_Ailk_Bljk_SB_MT32x16x32_SE_1LDSB0_AF0EM1_AMAS3_BL1_DTL0_DVO0_EPS1_FL1_GRVW2_GSU1_ISA908_IU1_KLA_LBSPP0_LPB2_LRVW2_MAC_NLCA1_NLCB1_ONLL1_PGR1_PLR1_SIA1_SU32_SUS256_SRVW0_SNLL1_TT2_4_TLDS0_USFGRO0_VS1_VW2_WSGRA0_WSGRB0_WG16_4_4_WGM16
    SolutionIndex: 215
    SolutionNameMin: Cijk_Ailk_Bljk_SB_MT64x128x16_MI32x32x2x1_SE_1LDSB0_AF0EM1_AMAS0_BL1_DTL0_DVO0_EPS1_FL0_GRVW4_GSU1_ISA908_IU1_KLA_LBSPP128_LPB4_LRVW2_MAC_NLCA1_NLCB1_ONLL1_PGR1_PLR9_SIA3_SU32_SUS128_SRVW2_SNLL0_TT1_64_TLDS1_USFGROn1_VSn1_VW1_WSGRA1_WSGRB1_WG64_4_1_WGM1
    SolutionIndex: 216
    SolutionNameMin: Cijk_Ailk_Bljk_SB_MT128x96x16_MI32x32x2x1_SE_1LDSB0_AF0EM1_AMAS0_BL1_DTL0_DVO0_EPS0_FL0_GRVW1_GSU1_ISA908_IU1_KLA_LBSPP128_LPB2_LRVW2_MAC_NLCA2_NLCB1_ONLL1_PGR2_PLR9_SIA3_SU0_SUS256_SRVW2_SNLL0_TT1_96_TLDS1_USFGROn1_VSn1_VW1_WSGRA1_WSGRB1_WG128_2_1_WGM15
    SolutionIndex: 217
    SolutionNameMin: Cijk_Ailk_Bljk_SB_MT128x80x16_MI16x16x4x1_SE_1LDSB0_AF0EM1_AMAS3_BL1_DTL0_DVO1_EPS1_FL1_GRVW4_GSU1_ISA908_IU1_KLA_LBSPP0_LPB0_LRVW1_MAC_NLCA1_NLCB1_ONLL1_PGR1_PLR1_SIA3_SU32_SUS256_SRVW0_SNLL0_TT2_80_TLDS0_USFGROn1_VSn1_VW4_WSGRA0_WSGRB0_WG64_4_1_WGM8
    SolutionIndex: 218
    SolutionNameMin: Cijk_Ailk_Bljk_SB_MT128x128x16_MI32x32x2x1_SE_1LDSB0_AF0EM1_AMAS0_BL1_DTL0_DVO0_EPS1_FL0_GRVW4_GSU1_ISA908_IU1_KLA_LBSPP128_LPB4_LRVW2_MAC_NLCA1_NLCB1_ONLL1_PGR1_PLR9_SIA3_SU0_SUS256_SRVW2_SNLL0_TT2_64_TLDS1_USFGROn1_VSn1_VW1_WSGRA1_WSGRB1_WG64_4_1_WGM1
    SolutionIndex: 219
    SolutionNameMin: Cijk_Ailk_Bljk_SB_MT32x64x24_MI16x16x4x1_SE_1LDSB0_AF0EM1_AMAS3_BL1_DTL0_DVO0_EPS1_FL0_GRVW1_GSU1_ISA908_IU1_KLA_LBSPP0_LPB0_LRVW1_MAC_NLCA1_NLCB3_ONLL1_PGR1_PLR1_SIA3_SU32_SUS256_SRVW0_SNLL0_TT2_16_TLDS1_USFGROn1_VSn1_VW4_WSGRA1_WSGRB1_WG16_16_1_WGM8
    SolutionIndex: 220
    SolutionNameMin: Cijk_Ailk_Bljk_SB_MT64x32x16_MI16x16x4x1_SE_1LDSB0_AF0EM1_AMAS0_BL1_DTL0_DVO0_EPS0_FL0_GRVW1_GSU1_ISA908_IU1_KLA_LBSPP128_LPB2_LRVW2_MAC_NLCA1_NLCB1_ONLL1_PGR2_PLR5_SIA3_SU32_SUS128_SRVW2_SNLL0_TT2_16_TLDS1_USFGROn1_VSn1_VW1_WSGRA1_WSGRB1_WG32_8_1_WGM1
    SolutionIndex: 221
    SolutionNameMin: Cijk_Ailk_Bljk_SB_MT64x32x16_MI16x16x4x1_SE_1LDSB0_AF0EM1_AMAS0_BL1_DTL0_DVO0_EPS0_FL0_GRVW1_GSU1_ISA908_IU1_KLA_LBSPP128_LPB2_LRVW2_MAC_NLCA1_NLCB1_ONLL1_PGR2_PLR5_SIA3_SU32_SUS128_SRVW2_SNLL0_TT2_16_TLDS1_USFGROn1_VSn1_VW1_WSGRA1_WSGRB1_WG32_8_1_WGM15
    SolutionIndex: 222
    SolutionNameMin: Cijk_Ailk_Bljk_SB_MT64x32x16_MI16x16x4x1_SE_1LDSB0_AF0EM1_AMAS0_BL1_DTL0_DVO0_EPS0_FL0_GRVW1_GSU1_ISA908_IU1_KLA_LBSPP128_LPB2_LRVW2_MAC_NLCA1_NLCB1_ONLL1_PGR2_PLR5_SIA3_SU0_SUS256_SRVW2_SNLL0_TT2_16_TLDS1_USFGROn1_VSn1_VW1_WSGRA1_WSGRB1_WG32_8_1_WGM15
    SolutionIndex: 223
    SolutionNameMin: Cijk_Ailk_Bljk_SB_MT64x128x16_MI32x32x2x1_SE_1LDSB0_AF0EM1_AMAS0_BL1_DTL0_DVO0_EPS0_FL0_GRVW4_GSU1_ISA908_IU1_KLA_LBSPP128_LPB4_LRVW2_MAC_NLCA1_NLCB1_ONLL1_PGR2_PLR9_SIA3_SU32_SUS256_SRVW2_SNLL0_TT1_64_TLDS1_USFGROn1_VSn1_VW1_WSGRA1_WSGRB1_WG64_4_1_WGM15
    SolutionIndex: 224
    SolutionNameMin: Cijk_Ailk_Bljk_SB_MT128x144x16_MI16x16x4x1_SN_1LDSB1_AF0EM1_AMAS0_BL1_DTL0_DVO0_EPS0_FL0_GRVW1_GSU1_ISA908_IU1_KLA_LBSPP128_LPB2_LRVW2_MAC_NLCA2_NLCB1_ONLL1_PGR2_PLR5_SIA3_SU32_SUS256_SRVW2_SNLL0_TT2_144_TLDS1_USFGROn1_VSn1_VW1_WSGRA1_WSGRB1_WG64_4_1_WGM2
    SolutionIndex: 225
    SolutionNameMin: Cijk_Ailk_Bljk_SB_MT64x16x32_MI16x16x4x1_SE_1LDSB0_AF0EM1_AMAS0_BL1_DTL0_DVO0_EPS0_FL0_GRVW1_GSU1_ISA908_IU1_KLA_LBSPP128_LPB2_LRVW2_MAC_NLCA1_NLCB1_ONLL1_PGR2_PLR9_SIA3_SU32_SUS128_SRVW2_SNLL0_TT1_16_TLDS1_USFGROn1_VSn1_VW1_WSGRA1_WSGRB1_WG64_4_1_WGM1
    SolutionIndex: 226
    SolutionNameMin: Cijk_Ailk_Bljk_SB_MT128x64x32_MI32x32x2x1_SE_1LDSB0_AF0EM1_AMAS0_BL1_DTL0_DVO0_EPS0_FL0_GRVW2_GSU1_ISA908_IU1_KLA_LBSPP128_LPB2_LRVW2_MAC_NLCA1_NLCB1_ONLL1_PGR2_PLR17_SIA3_SU0_SUS256_SRVW2_SNLL0_TT2_32_TLDS1_USFGROn1_VSn1_VW1_WSGRA1_WSGRB1_WG64_4_1_WGM15
    SolutionIndex: 227
    SolutionNameMin: Cijk_Ailk_Bljk_SB_MT128x144x16_MI16x16x4x1_SE_1LDSB1_AF0EM1_AMAS0_BL1_DTL0_DVO0_EPS1_FL0_GRVW1_GSU1_ISA908_IU1_KLA_LBSPP128_LPB2_LRVW2_MAC_NLCA2_NLCB1_ONLL1_PGR1_PLR5_SIA3_SU32_SUS128_SRVW2_SNLL0_TT2_144_TLDS1_USFGROn1_VSn1_VW1_WSGRA1_WSGRB1_WG64_4_1_WGM1
    SolutionIndex: 228
    SolutionNameMin: Cijk_Ailk_Bljk_SB_MT64x32x32_MI16x16x4x1_SE_1LDSB0_AF0EM1_AMAS0_BL1_DTL0_DVO0_EPS0_FL0_GRVW2_GSU1_ISA908_IU1_KLA_LBSPP128_LPB2_LRVW2_MAC_NLCA1_NLCB1_ONLL1_PGR2_PLR9_SIA3_SU0_SUS256_SRVW2_SNLL0_TT2_16_TLDS1_USFGROn1_VSn1_VW1_WSGRA1_WSGRB1_WG32_8_1_WGM2
    SolutionIndex: 229
    SolutionNameMin: Cijk_Ailk_Bljk_SB_MT128x144x16_MI16x16x4x1_SE_1LDSB1_AF0EM1_AMAS0_BL1_DTL0_DVO0_EPS0_FL0_GRVW1_GSU1_ISA908_IU1_KLA_LBSPP128_LPB2_LRVW2_MAC_NLCA2_NLCB1_ONLL1_PGR2_PLR5_SIA3_SU32_SUS256_SRVW2_SNLL0_TT2_144_TLDS1_USFGROn1_VSn1_VW1_WSGRA1_WSGRB1_WG64_4_1_WGM15
    SolutionIndex: 230
    SolutionNameMin: Cijk_Ailk_Bljk_SB_MT128x64x16_MI16x16x1x4_SE_1LDSB0_AF0EM1_AMAS3_BL1_DTL0_DVO0_EPS1_FL0_GRVW4_GSU1_ISA908_IU1_KLA_LBSPP0_LPB0_LRVW1_MAC_NLCA1_NLCB1_ONLL1_PGR1_PLR1_SIA3_SU32_SUS256_SRVW0_SNLL0_TT2_16_TLDS0_USFGROn1_VSn1_VW4_WSGRA1_WSGRB1_WG64_4_1_WGM8
    SolutionIndex: 231
    SolutionNameMin: Cijk_Ailk_Bljk_SB_MT64x64x16_MI32x32x2x1_SE_1LDSB0_AF0EM1_AMAS0_BL1_DTL0_DVO0_EPS0_FL0_GRVW4_GSU1_ISA908_IU2_KLA_LBSPP128_LPB4_LRVW2_MAC_NLCA1_NLCB1_ONLL1_PGR2_PLR5_SIA3_SU0_SUS128_SRVW2_SNLL0_TT1_32_TLDS1_USFGROn1_VSn1_VW1_WSGRA1_WSGRB1_WG64_4_1_WGM1
    SolutionIndex: 232
    SolutionNameMin: Cijk_Ailk_Bljk_SB_MT64x64x32_MI32x32x2x1_SE_1LDSB0_AF0EM1_AMAS0_BL1_DTL0_DVO0_EPS0_FL0_GRVW4_GSU1_ISA908_IU1_KLA_LBSPP128_LPB4_LRVW2_MAC_NLCA1_NLCB1_ONLL1_PGR2_PLR17_SIA3_SU32_SUS128_SRVW2_SNLL0_TT1_32_TLDS1_USFGROn1_VSn1_VW1_WSGRA1_WSGRB1_WG64_4_1_WGM15
    SolutionIndex: 233
    SolutionNameMin: Cijk_Ailk_Bljk_SB_MT64x32x16_MI16x16x4x1_SE_1LDSB0_AF0EM1_AMAS0_BL1_DTL0_DVO0_EPS0_FL0_GRVW2_GSU1_ISA908_IU1_KLA_LBSPP128_LPB2_LRVW2_MAC_NLCA1_NLCB1_ONLL1_PGR2_PLR5_SIA3_SU0_SUS256_SRVW2_SNLL0_TT2_16_TLDS1_USFGROn1_VSn1_VW1_WSGRA1_WSGRB1_WG32_8_1_WGM1
    SolutionIndex: 234
    SolutionNameMin: Cijk_Ailk_Bljk_SB_MT64x64x16_MI32x32x2x1_SE_1LDSB0_AF0EM1_AMAS0_BL1_DTL0_DVO0_EPS0_FL0_GRVW4_GSU1_ISA908_IU1_KLA_LBSPP128_LPB4_LRVW2_MAC_NLCA1_NLCB1_ONLL1_PGR2_PLR9_SIA3_SU32_SUS128_SRVW2_SNLL0_TT1_32_TLDS1_USFGROn1_VSn1_VW1_WSGRA1_WSGRB1_WG64_4_1_WGM15
    SolutionIndex: 235
    SolutionNameMin: Cijk_Ailk_Bljk_SB_MT32x32x32_MI16x16x4x1_SE_1LDSB0_AF0EM1_AMAS0_BL1_DTL0_DVO0_EPS0_FL0_GRVW4_GSU1_ISA908_IU2_KLA_LBSPP128_LPB4_LRVW2_MAC_NLCA1_NLCB1_ONLL1_PGR2_PLR5_SIA3_SU32_SUS256_SRVW2_SNLL0_TT1_16_TLDS1_USFGROn1_VSn1_VW1_WSGRA1_WSGRB1_WG32_8_1_WGM1
    SolutionIndex: 236
    SolutionNameMin: Cijk_Ailk_Bljk_SB_MT64x32x16_MI16x16x4x1_SE_1LDSB0_AF0EM1_AMAS0_BL1_DTL0_DVO0_EPS0_FL0_GRVW4_GSU1_ISA908_IU1_KLA_LBSPP128_LPB4_LRVW2_MAC_NLCA1_NLCB1_ONLL1_PGR2_PLR5_SIA3_SU0_SUS256_SRVW2_SNLL0_TT2_16_TLDS1_USFGROn1_VSn1_VW1_WSGRA1_WSGRB1_WG32_8_1_WGM2
    SolutionIndex: 237
    SolutionNameMin: Cijk_Ailk_Bljk_SB_MT64x32x32_MI16x16x4x1_SE_1LDSB0_AF0EM1_AMAS0_BL1_DTL0_DVO0_EPS1_FL0_GRVW4_GSU1_ISA908_IU1_KLA_LBSPP0_LPB0_LRVW1_MAC_NLCA1_NLCB1_ONLL1_PGR1_PLR1_SIA3_SU32_SUS256_SRVW0_SNLL0_TT2_16_TLDS0_USFGROn1_VSn1_VW1_WSGRA1_WSGRB1_WG32_8_1_WGM8
    SolutionIndex: 238
    SolutionNameMin: Cijk_Ailk_Bljk_SB_MT32x8x64_SN_1LDSB0_AF0EM1_AMAS3_BL1_DTL0_DVO0_EPS0_FL0_GRVW2_GSU16_ISA908_IU1_KLA_LBSPP0_LPB0_LRVW2_MAC_NLCA1_NLCB1_ONLL1_PGR0_PLR1_SIA1_SU32_SUS256_SRVW0_SNLL0_TT2_2_TLDS0_USFGRO0_VS1_VW2_WSGRA0_WSGRB0_WG16_4_4_WGM1
    SolutionIndex: 239
    SolutionNameMin: Cijk_Ailk_Bljk_SB_MT64x32x16_MI16x16x4x1_SE_1LDSB0_AF0EM1_AMAS0_BL1_DTL0_DVO0_EPS0_FL0_GRVW2_GSU1_ISA908_IU1_KLA_LBSPP128_LPB2_LRVW2_MAC_NLCA1_NLCB1_ONLL1_PGR2_PLR5_SIA3_SU32_SUS128_SRVW2_SNLL0_TT2_16_TLDS1_USFGROn1_VSn1_VW1_WSGRA1_WSGRB1_WG32_8_1_WGM2
    SolutionIndex: 240
    SolutionNameMin: Cijk_Ailk_Bljk_SB_MT64x64x16_MI32x32x2x1_SE_1LDSB0_AF0EM1_AMAS0_BL1_DTL0_DVO0_EPS0_FL0_GRVW4_GSU1_ISA908_IU2_KLA_LBSPP128_LPB4_LRVW2_MAC_NLCA1_NLCB1_ONLL1_PGR2_PLR5_SIA3_SU0_SUS256_SRVW2_SNLL0_TT1_32_TLDS1_USFGROn1_VSn1_VW1_WSGRA1_WSGRB1_WG64_4_1_WGM8
    SolutionIndex: 241
    SolutionNameMin: Cijk_Ailk_Bljk_SB_MT16x16x32_MI16x16x4x1_SE_1LDSB0_AF0EM1_AMAS0_BL1_DTL0_DVO0_EPS1_FL0_GRVW4_GSU5_ISA908_IU1_KLA_LBSPP128_LPB4_LRVW2_MAC_NLCA1_NLCB1_ONLL1_PGR1_PLR9_SIA3_SU0_SUS256_SRVW0_SNLL0_TT1_16_TLDS1_USFGROn1_VSn1_VW1_WSGRA1_WSGRB1_WG16_4_1_WGM1
    SolutionIndex: 242
    SolutionNameMin: Cijk_Ailk_Bljk_SB_MT32x16x32_SE_1LDSB0_AF0EM1_AMAS3_BL1_DTL0_DVO0_EPS1_FL1_GRVW2_GSU4_ISA908_IU1_KLA_LBSPP0_LPB2_LRVW2_MAC_NLCA1_NLCB1_ONLL1_PGR1_PLR0_SIA1_SU32_SUS256_SRVW0_SNLL0_TT4_2_TLDS0_USFGRO0_VS1_VW2_WSGRA0_WSGRB0_WG8_8_4_WGM8
    SolutionIndex: 243
    SolutionNameMin: Cijk_Ailk_Bljk_SB_MT128x160x16_MI32x32x2x1_SE_1LDSB0_AF0EM1_AMAS0_BL1_DTL0_DVO0_EPS1_FL0_GRVW1_GSU1_ISA908_IU1_KLA_LBSPP128_LPB2_LRVW2_MAC_NLCA2_NLCB1_ONLL1_PGR1_PLR9_SIA3_SU32_SUS128_SRVW2_SNLL0_TT1_160_TLDS1_USFGROn1_VSn1_VW1_WSGRA1_WSGRB1_WG128_2_1_WGM1
    SolutionIndex: 244
    SolutionNameMin: Cijk_Ailk_Bljk_SB_MT64x16x32_MI16x16x4x1_SE_1LDSB0_AF0EM1_AMAS0_BL1_DTL0_DVO0_EPS0_FL0_GRVW2_GSU1_ISA908_IU1_KLA_LBSPP128_LPB2_LRVW2_MAC_NLCA1_NLCB1_ONLL1_PGR2_PLR9_SIA3_SU32_SUS128_SRVW0_SNLL0_TT1_16_TLDS1_USFGROn1_VSn1_VW1_WSGRA1_WSGRB1_WG64_4_1_WGM2
    SolutionIndex: 245
    SolutionNameMin: Cijk_Ailk_Bljk_SB_MT64x32x32_MI16x16x4x1_SE_1LDSB0_AF0EM1_AMAS0_BL1_DTL0_DVO0_EPS0_FL0_GRVW2_GSU1_ISA908_IU1_KLA_LBSPP128_LPB2_LRVW2_MAC_NLCA1_NLCB1_ONLL1_PGR2_PLR9_SIA3_SU0_SUS256_SRVW2_SNLL0_TT2_16_TLDS1_USFGROn1_VSn1_VW1_WSGRA1_WSGRB1_WG32_8_1_WGM15
    SolutionIndex: 246
    SolutionNameMin: Cijk_Ailk_Bljk_SB_MT64x128x16_MI16x16x4x1_SE_1LDSB0_AF0EM1_AMAS3_BL1_DTL0_DVO0_EPS1_FL0_GRVW1_GSU1_ISA908_IU1_KLA_LBSPP0_LPB0_LRVW1_MAC_NLCA1_NLCB1_ONLL1_PGR1_PLR1_SIA3_SU32_SUS256_SRVW0_SNLL0_TT4_32_TLDS1_USFGROn1_VSn1_VW4_WSGRA1_WSGRB1_WG16_16_1_WGM8
    SolutionIndex: 247
    SolutionNameMin: Cijk_Ailk_Bljk_SB_MT32x32x32_SN_1LDSB0_AF0EM1_AMAS3_BL1_DTL0_DVO0_EPS1_FL0_GRVW4_GSU4_ISA908_IU1_KLA_LBSPP0_LPB0_LRVW4_MAC_NLCA1_NLCB1_ONLL1_PGR1_PLR1_SIA1_SU32_SUS256_SRVW0_SNLL0_TT4_4_TLDS0_USFGRO0_VS1_VW4_WSGRA0_WSGRB0_WG8_8_4_WGM8
    SolutionIndex: 248
    SolutionNameMin: Cijk_Ailk_Bljk_SB_MT128x64x16_MI32x32x2x1_SE_1LDSB0_AF0EM1_AMAS0_BL1_DTL0_DVO0_EPS0_FL0_GRVW2_GSU1_ISA908_IU1_KLA_LBSPP128_LPB2_LRVW2_MAC_NLCA1_NLCB1_ONLL1_PGR2_PLR9_SIA3_SU0_SUS256_SRVW2_SNLL0_TT2_32_TLDS1_USFGROn1_VSn1_VW1_WSGRA1_WSGRB1_WG64_4_1_WGM15
    SolutionIndex: 249
    SolutionNameMin: Cijk_Ailk_Bljk_SB_MT16x64x32_MI16x16x4x1_SE_1LDSB0_AF0EM1_AMAS0_BL1_DTL0_DVO0_EPS0_FL0_GRVW4_GSU1_ISA908_IU1_KLA_LBSPP128_LPB4_LRVW2_MAC_NLCA1_NLCB1_ONLL1_PGR2_PLR9_SIA3_SU0_SUS256_SRVW0_SNLL0_TT1_16_TLDS1_USFGROn1_VSn1_VW1_WSGRA1_WSGRB1_WG16_16_1_WGM2
    SolutionIndex: 250
    SolutionNameMin: Cijk_Ailk_Bljk_SB_MT128x96x16_MI32x32x2x1_SE_1LDSB0_AF0EM1_AMAS0_BL1_DTL0_DVO0_EPS1_FL0_GRVW1_GSU1_ISA908_IU1_KLA_LBSPP128_LPB2_LRVW2_MAC_NLCA2_NLCB1_ONLL1_PGR1_PLR9_SIA3_SU0_SUS256_SRVW2_SNLL0_TT1_96_TLDS1_USFGROn1_VSn1_VW1_WSGRA1_WSGRB1_WG128_2_1_WGM2
    SolutionIndex: 251
    SolutionNameMin: Cijk_Ailk_Bljk_SB_MT16x16x16_SN_1LDSB0_AF0EM1_AMAS3_BL1_DTL0_DVO0_EPS1_FL0_GRVW2_GSU16_ISA908_IU1_KLA_LBSPP0_LPB0_LRVW2_MAC_NLCA1_NLCB1_ONLL1_PGR1_PLR1_SIA1_SU32_SUS256_SRVW0_SNLL0_TT2_2_TLDS0_USFGRO1_VS1_VW2_WSGRA0_WSGRB0_WG8_8_4_WGM1
    SolutionIndex: 252
    SolutionNameMin: Cijk_Ailk_Bljk_SB_MT32x32x32_MI16x16x4x1_SE_1LDSB0_AF0EM1_AMAS0_BL1_DTL0_DVO0_EPS0_FL0_GRVW2_GSU1_ISA908_IU1_KLA_LBSPP128_LPB2_LRVW2_MAC_NLCA1_NLCB1_ONLL1_PGR2_PLR9_SIA3_SU32_SUS128_SRVW2_SNLL0_TT1_16_TLDS1_USFGROn1_VSn1_VW1_WSGRA1_WSGRB1_WG32_8_1_WGM1
    SolutionIndex: 253
    SolutionNameMin: Cijk_Ailk_Bljk_SB_MT32x64x32_MI16x16x4x1_SE_1LDSB0_AF0EM1_AMAS0_BL1_DTL0_DVO0_EPS1_FL0_GRVW4_GSU1_ISA908_IU1_KLA_LBSPP0_LPB0_LRVW1_MAC_NLCA1_NLCB1_ONLL1_PGR1_PLR1_SIA3_SU32_SUS256_SRVW0_SNLL0_TT2_16_TLDS1_USFGROn1_VSn1_VW1_WSGRA1_WSGRB1_WG16_16_1_WGM8
    SolutionIndex: 254
    SolutionNameMin: Cijk_Ailk_Bljk_SB_MT144x64x16_MI16x16x4x1_SE_1LDSB0_AF0EM1_AMAS0_BL1_DTL0_DVO0_EPS0_FL0_GRVW1_GSU1_ISA908_IU1_KLA_LBSPP128_LPB2_LRVW2_MAC_NLCA9_NLCB1_ONLL1_PGR2_PLR5_SIA3_SU0_SUS256_SRVW0_SNLL0_TT9_16_TLDS1_USFGROn1_VSn1_VW1_WSGRA1_WSGRB1_WG16_16_1_WGM1
    SolutionIndex: 255
    SolutionNameMin: Cijk_Ailk_Bljk_SB_MT64x16x16_MI16x16x4x1_SE_1LDSB0_AF0EM1_AMAS0_BL1_DTL0_DVO0_EPS0_FL0_GRVW2_GSU1_ISA908_IU1_KLA_LBSPP128_LPB2_LRVW2_MAC_NLCA1_NLCB1_ONLL1_PGR2_PLR5_SIA3_SU0_SUS256_SRVW2_SNLL0_TT1_16_TLDS1_USFGROn1_VSn1_VW1_WSGRA1_WSGRB1_WG64_4_1_WGM15
    SolutionIndex: 256
    SolutionNameMin: Cijk_Ailk_Bljk_SB_MT144x64x32_MI16x16x4x1_SE_1LDSB0_AF0EM1_AMAS0_BL1_DTL0_DVO0_EPS0_FL0_GRVW1_GSU1_ISA908_IU1_KLA_LBSPP128_LPB2_LRVW2_MAC_NLCA9_NLCB1_ONLL1_PGR2_PLR9_SIA3_SU0_SUS256_SRVW0_SNLL0_TT9_16_TLDS1_USFGROn1_VSn1_VW1_WSGRA1_WSGRB1_WG16_16_1_WGM1
    SolutionIndex: 257
    SolutionNameMin: Cijk_Ailk_Bljk_SB_MT128x144x16_MI16x16x4x1_SE_1LDSB1_AF0EM1_AMAS0_BL1_DTL0_DVO0_EPS1_FL0_GRVW1_GSU1_ISA908_IU1_KLA_LBSPP128_LPB2_LRVW2_MAC_NLCA2_NLCB1_ONLL1_PGR1_PLR5_SIA3_SU32_SUS256_SRVW2_SNLL0_TT2_144_TLDS1_USFGROn1_VSn1_VW1_WSGRA1_WSGRB1_WG64_4_1_WGM2
    SolutionIndex: 258
    SolutionNameMin: Cijk_Ailk_Bljk_SB_MT32x32x32_SE_1LDSB0_AF0EM1_AMAS3_BL1_DTL0_DVO0_EPS1_FL1_GRVW4_GSU1_ISA908_IU1_KLA_LBSPP0_LPB4_LRVW4_MAC_NLCA1_NLCB1_ONLL1_PGR1_PLR1_SIA1_SU32_SUS256_SRVW0_SNLL1_TT4_4_TLDS0_USFGRO0_VS1_VW4_WSGRA0_WSGRB0_WG8_8_4_WGM8
    SolutionIndex: 259
    SolutionNameMin: Cijk_Ailk_Bljk_SB_MT128x64x32_MI32x32x2x1_SE_1LDSB0_AF0EM1_AMAS0_BL1_DTL0_DVO0_EPS1_FL0_GRVW4_GSU1_ISA908_IU1_KLA_LBSPP128_LPB4_LRVW2_MAC_NLCA1_NLCB1_ONLL1_PGR1_PLR17_SIA3_SU32_SUS128_SRVW2_SNLL0_TT2_32_TLDS1_USFGROn1_VSn1_VW1_WSGRA1_WSGRB1_WG64_4_1_WGM1
    SolutionIndex: 260
    SolutionNameMin: Cijk_Ailk_Bljk_SB_MT32x32x32_MI16x16x4x1_SE_1LDSB0_AF0EM1_AMAS0_BL1_DTL0_DVO0_EPS0_FL0_GRVW4_GSU1_ISA908_IU2_KLA_LBSPP128_LPB4_LRVW2_MAC_NLCA1_NLCB1_ONLL1_PGR2_PLR5_SIA3_SU0_SUS128_SRVW2_SNLL0_TT1_16_TLDS1_USFGROn1_VSn1_VW1_WSGRA1_WSGRB1_WG32_8_1_WGM1
    SolutionIndex: 261
    SolutionNameMin: Cijk_Ailk_Bljk_SB_MT64x16x32_MI16x16x4x1_SE_1LDSB0_AF0EM1_AMAS0_BL1_DTL0_DVO0_EPS0_FL0_GRVW1_GSU1_ISA908_IU1_KLA_LBSPP128_LPB2_LRVW2_MAC_NLCA1_NLCB1_ONLL1_PGR2_PLR9_SIA3_SU32_SUS256_SRVW0_SNLL0_TT1_16_TLDS1_USFGROn1_VSn1_VW1_WSGRA1_WSGRB1_WG64_4_1_WGM2
    SolutionIndex: 262
    SolutionNameMin: Cijk_Ailk_Bljk_SB_MT64x32x16_MI16x16x4x1_SE_1LDSB0_AF0EM1_AMAS0_BL1_DTL0_DVO0_EPS1_FL0_GRVW1_GSU1_ISA908_IU1_KLA_LBSPP128_LPB2_LRVW2_MAC_NLCA1_NLCB1_ONLL1_PGR1_PLR5_SIA3_SU0_SUS256_SRVW2_SNLL0_TT2_16_TLDS1_USFGROn1_VSn1_VW1_WSGRA1_WSGRB1_WG32_8_1_WGM15
    SolutionIndex: 263
    SolutionNameMin: Cijk_Ailk_Bljk_SB_MT16x8x32_SE_1LDSB0_AF0EM1_AMAS3_BL1_DTL0_DVO0_EPS1_FL1_GRVW2_GSU4_ISA908_IU1_KLA_LBSPP0_LPB2_LRVW2_MAC_NLCA1_NLCB1_ONLL1_PGR1_PLR0_SIA1_SU32_SUS256_SRVW0_SNLL0_TT2_2_TLDS0_USFGRO0_VS1_VW2_WSGRA0_WSGRB0_WG8_4_4_WGM8
    SolutionIndex: 264
    SolutionNameMin: Cijk_Ailk_Bljk_SB_MT128x96x16_MI32x32x2x1_SE_1LDSB0_AF0EM1_AMAS0_BL1_DTL0_DVO0_EPS1_FL0_GRVW2_GSU1_ISA908_IU1_KLA_LBSPP128_LPB2_LRVW2_MAC_NLCA1_NLCB1_ONLL1_PGR1_PLR9_SIA3_SU0_SUS256_SRVW2_SNLL0_TT1_96_TLDS1_USFGROn1_VSn1_VW1_WSGRA1_WSGRB1_WG128_2_1_WGM2
    SolutionIndex: 265
    SolutionNameMin: Cijk_Ailk_Bljk_SB_MT16x16x32_MI16x16x4x1_SE_1LDSB0_AF0EM1_AMAS0_BL1_DTL0_DVO0_EPS0_FL0_GRVW1_GSU5_ISA908_IU1_KLA_LBSPP128_LPB2_LRVW2_MAC_NLCA1_NLCB1_ONLL1_PGR2_PLR9_SIA3_SU32_SUS256_SRVW0_SNLL0_TT1_16_TLDS1_USFGROn1_VSn1_VW1_WSGRA1_WSGRB1_WG16_4_1_WGM15
    SolutionIndex: 266
    SolutionNameMin: Cijk_Ailk_Bljk_SB_MT144x64x16_MI16x16x4x1_SE_1LDSB0_AF0EM1_AMAS0_BL1_DTL0_DVO0_EPS0_FL0_GRVW1_GSU1_ISA908_IU1_KLA_LBSPP128_LPB2_LRVW2_MAC_NLCA9_NLCB1_ONLL1_PGR2_PLR5_SIA3_SU0_SUS256_SRVW0_SNLL0_TT9_16_TLDS1_USFGROn1_VSn1_VW1_WSGRA1_WSGRB1_WG16_16_1_WGM2
    SolutionIndex: 267
    SolutionNameMin: Cijk_Ailk_Bljk_SB_MT32x32x32_MI16x16x4x1_SE_1LDSB0_AF0EM1_AMAS0_BL1_DTL0_DVO0_EPS0_FL0_GRVW4_GSU1_ISA908_IU1_KLA_LBSPP128_LPB4_LRVW2_MAC_NLCA1_NLCB1_ONLL1_PGR2_PLR9_SIA3_SU0_SUS256_SRVW2_SNLL0_TT1_16_TLDS1_USFGROn1_VSn1_VW1_WSGRA1_WSGRB1_WG32_8_1_WGM15
    SolutionIndex: 268
    SolutionNameMin: Cijk_Ailk_Bljk_SB_MT64x16x32_MI16x16x4x1_SE_1LDSB0_AF0EM1_AMAS0_BL1_DTL0_DVO0_EPS0_FL0_GRVW2_GSU5_ISA908_IU1_KLA_LBSPP128_LPB2_LRVW2_MAC_NLCA1_NLCB1_ONLL1_PGR2_PLR9_SIA3_SU0_SUS256_SRVW0_SNLL0_TT1_16_TLDS1_USFGROn1_VSn1_VW1_WSGRA1_WSGRB1_WG64_4_1_WGM2
    SolutionIndex: 269
    SolutionNameMin: Cijk_Ailk_Bljk_SB_MT64x8x32_SN_1LDSB0_AF0EM1_AMAS3_BL1_DTL0_DVO0_EPS0_FL0_GRVW4_GSU16_ISA908_IU1_KLA_LBSPP0_LPB0_LRVW4_MAC_NLCA1_NLCB1_ONLL1_PGR0_PLR1_SIA1_SU32_SUS256_SRVW0_SNLL0_TT4_4_TLDS0_USFGRO0_VS1_VW4_WSGRA0_WSGRB0_WG16_2_8_WGM1
    SolutionIndex: 270
    SolutionNameMin: Cijk_Ailk_Bljk_SB_MT96x96x16_MI16x16x4x1_SE_1LDSB0_AF0EM1_AMAS0_BL1_DTL0_DVO0_EPS0_FL0_GRVW1_GSU1_ISA908_IU1_KLA_LBSPP128_LPB2_LRVW2_MAC_NLCA3_NLCB1_ONLL1_PGR2_PLR5_SIA3_SU0_SUS256_SRVW0_SNLL0_TT3_48_TLDS1_USFGROn1_VSn1_VW1_WSGRA1_WSGRB1_WG32_8_1_WGM15
    SolutionIndex: 271
    SolutionNameMin: Cijk_Ailk_Bljk_SB_MT96x128x16_MI32x32x2x1_SE_1LDSB0_AF0EM1_AMAS0_BL1_DTL0_DVO0_EPS0_FL0_GRVW1_GSU1_ISA908_IU1_KLA_LBSPP128_LPB2_LRVW2_MAC_NLCA3_NLCB1_ONLL1_PGR2_PLR9_SIA3_SU32_SUS128_SRVW0_SNLL0_TT3_32_TLDS1_USFGROn1_VSn1_VW1_WSGRA1_WSGRB1_WG32_8_1_WGM2
    SolutionIndex: 272
    SolutionNameMin: Cijk_Ailk_Bljk_SB_MT144x128x16_MI16x16x4x1_SE_1LDSB1_AF0EM1_AMAS0_BL1_DTL0_DVO0_EPS0_FL0_GRVW1_GSU1_ISA908_IU1_KLA_LBSPP128_LPB2_LRVW2_MAC_NLCA9_NLCB1_ONLL1_PGR2_PLR5_SIA3_SU32_SUS256_SRVW0_SNLL0_TT9_32_TLDS1_USFGROn1_VSn1_VW1_WSGRA1_WSGRB1_WG16_16_1_WGM15
    SolutionIndex: 273
    SolutionNameMin: Cijk_Ailk_Bljk_SB_MT16x8x32_SE_1LDSB0_AF0EM1_AMAS3_BL1_DTL0_DVO0_EPS0_FL1_GRVW2_GSU1_ISA908_IU1_KLA_LBSPP0_LPB0_LRVW2_MAC_NLCA1_NLCB1_ONLL1_PGR0_PLR1_SIA1_SU32_SUS256_SRVW0_SNLL0_TT2_2_TLDS0_USFGRO0_VS1_VW2_WSGRA0_WSGRB0_WG8_4_4_WGM8
    SolutionIndex: 274
    SolutionNameMin: Cijk_Ailk_Bljk_SB_MT16x32x32_SE_1LDSB0_AF0EM1_AMAS3_BL1_DTL0_DVO0_EPS1_FL1_GRVW2_GSU1_ISA908_IU1_KLA_LBSPP0_LPB2_LRVW2_MAC_NLCA1_NLCB1_ONLL1_PGR1_PLR1_SIA1_SU32_SUS256_SRVW0_SNLL0_TT4_2_TLDS0_USFGRO0_VS1_VW2_WSGRA0_WSGRB0_WG4_16_4_WGM8
    SolutionIndex: 275
    SolutionNameMin: Cijk_Ailk_Bljk_SB_MT128x128x16_MI16x16x1x4_SE_1LDSB0_AF0EM1_AMAS3_BL1_DTL0_DVO0_EPS1_FL0_GRVW1_GSU1_ISA908_IU1_KLA_LBSPP0_LPB0_LRVW1_MAC_NLCA2_NLCB1_ONLL1_PGR1_PLR1_SIA3_SU32_SUS256_SRVW0_SNLL0_TT4_16_TLDS1_USFGROn1_VSn1_VW4_WSGRA1_WSGRB1_WG32_8_1_WGM8
    SolutionIndex: 276
    SolutionNameMin: Cijk_Ailk_Bljk_SB_MT32x32x32_MI16x16x4x1_SE_1LDSB0_AF0EM1_AMAS0_BL1_DTL0_DVO0_EPS0_FL0_GRVW4_GSU2_ISA908_IU1_KLA_LBSPP128_LPB4_LRVW2_MAC_NLCA1_NLCB1_ONLL1_PGR2_PLR9_SIA3_SU0_SUS256_SRVW0_SNLL0_TT1_16_TLDS1_USFGROn1_VSn1_VW1_WSGRA1_WSGRB1_WG32_8_1_WGM2
    SolutionIndex: 277
    SolutionNameMin: Cijk_Ailk_Bljk_SB_MT64x32x32_MI16x16x4x1_SE_1LDSB0_AF0EM1_AMAS0_BL1_DTL0_DVO0_EPS0_FL0_GRVW4_GSU15_ISA908_IU2_KLA_LBSPP128_LPB4_LRVW2_MAC_NLCA1_NLCB1_ONLL1_PGR2_PLR5_SIA3_SU32_SUS128_SRVW0_SNLL0_TT2_16_TLDS1_USFGROn1_VSn1_VW1_WSGRA1_WSGRB1_WG32_8_1_WGM1
    SolutionIndex: 278
    SolutionNameMin: Cijk_Ailk_Bljk_SB_MT64x64x16_MI16x16x4x1_SE_1LDSB0_AF0EM1_AMAS3_BL1_DTL0_DVO1_EPS1_FL1_GRVW2_GSU1_ISA908_IU1_KLA_LBSPP0_LPB0_LRVW1_MAC_NLCA1_NLCB1_ONLL0_PGR1_PLR1_SIA3_SU32_SUS256_SRVW4_SNLL0_TT4_16_TLDS0_USFGROn1_VSn1_VW2_WSGRA0_WSGRB0_WG16_16_1_WGM8
    SolutionIndex: 279
    SolutionNameMin: Cijk_Ailk_Bljk_SB_MT8x32x32_SE_1LDSB0_AF0EM1_AMAS3_BL1_DTL0_DVO0_EPS0_FL1_GRVW2_GSU1_ISA908_IU1_KLA_LBSPP0_LPB2_LRVW2_MAC_NLCA1_NLCB1_ONLL1_PGR0_PLR1_SIA1_SU32_SUS256_SRVW0_SNLL0_TT2_4_TLDS0_USFGRO0_VS1_VW2_WSGRA0_WSGRB0_WG4_8_8_WGM1
    SolutionIndex: 280
    SolutionNameMin: Cijk_Ailk_Bljk_SB_MT4x64x16_MI4x4x1x16_SE_1LDSB0_AF0EM1_AMAS0_BL1_DTL0_DVO0_EPS1_FL0_GRVW1_GSU1_ISA908_IU1_KLA_LBSPP128_LPB2_LRVW2_MAC_NLCA1_NLCB1_ONLL1_PGR1_PLR17_SIA3_SU0_SUS256_SRVW0_SNLL0_TT1_4_TLDS1_USFGROn1_VSn1_VW1_WSGRA1_WSGRB1_WG4_16_1_WGM1
    SolutionIndex: 281
    SolutionNameMin: Cijk_Ailk_Bljk_SB_MT16x16x8_SN_1LDSB0_AF0EM1_AMAS3_BL1_DTL0_DVO0_EPS1_FL0_GRVW2_GSU4_ISA908_IU1_KLA_LBSPP0_LPB0_LRVW2_MAC_NLCA1_NLCB1_ONLL1_PGR1_PLR1_SIA1_SU32_SUS256_SRVW0_SNLL0_TT2_2_TLDS0_USFGRO1_VS1_VW2_WSGRA0_WSGRB0_WG8_8_2_WGM1
    SolutionIndex: 282
    SolutionNameMin: Cijk_Ailk_Bljk_SB_MT16x16x32_MI16x16x4x1_SE_1LDSB0_AF0EM1_AMAS0_BL1_DTL0_DVO0_EPS0_FL0_GRVW1_GSU5_ISA908_IU1_KLA_LBSPP128_LPB2_LRVW2_MAC_NLCA1_NLCB1_ONLL1_PGR2_PLR9_SIA3_SU0_SUS256_SRVW0_SNLL0_TT1_16_TLDS1_USFGROn1_VSn1_VW1_WSGRA1_WSGRB1_WG16_4_1_WGM1
    SolutionIndex: 283
    SolutionNameMin: Cijk_Ailk_Bljk_SB_MT16x16x32_SE_1LDSB0_AF0EM1_AMAS3_BL1_DTL0_DVO0_EPS1_FL1_GRVW2_GSU4_ISA908_IU1_KLA_LBSPP0_LPB2_LRVW2_MAC_NLCA1_NLCB1_ONLL1_PGR1_PLR0_SIA1_SU32_SUS256_SRVW0_SNLL0_TT2_2_TLDS0_USFGRO0_VS1_VW2_WSGRA0_WSGRB0_WG8_8_4_WGM8
    SolutionIndex: 284
    SolutionNameMin: Cijk_Ailk_Bljk_SB_MT64x32x16_MI16x16x4x1_SE_1LDSB0_AF0EM1_AMAS0_BL1_DTL0_DVO0_EPS0_FL0_GRVW1_GSU1_ISA908_IU1_KLA_LBSPP128_LPB2_LRVW2_MAC_NLCA1_NLCB1_ONLL1_PGR2_PLR5_SIA3_SU0_SUS256_SRVW2_SNLL0_TT2_16_TLDS1_USFGROn1_VSn1_VW1_WSGRA1_WSGRB1_WG32_8_1_WGM2
    SolutionIndex: 285
    SolutionNameMin: Cijk_Ailk_Bljk_SB_MT32x32x32_MI16x16x4x1_SE_1LDSB0_AF0EM1_AMAS0_BL1_DTL0_DVO0_EPS0_FL0_GRVW1_GSU1_ISA908_IU1_KLA_LBSPP128_LPB2_LRVW2_MAC_NLCA1_NLCB1_ONLL1_PGR2_PLR9_SIA3_SU0_SUS256_SRVW2_SNLL0_TT1_16_TLDS1_USFGROn1_VSn1_VW1_WSGRA1_WSGRB1_WG32_8_1_WGM1
    SolutionIndex: 286
    SolutionNameMin: Cijk_Ailk_Bljk_SB_MT16x16x16_SN_1LDSB0_AF0EM1_AMAS3_BL1_DTL0_DVO0_EPS1_FL0_GRVW2_GSU4_ISA908_IU1_KLA_LBSPP0_LPB0_LRVW2_MAC_NLCA1_NLCB1_ONLL1_PGR1_PLR1_SIA1_SU32_SUS256_SRVW0_SNLL0_TT2_2_TLDS0_USFGRO1_VS1_VW2_WSGRA0_WSGRB0_WG8_8_4_WGM1
    SolutionIndex: 287
    SolutionNameMin: Cijk_Ailk_Bljk_SB_MT32x32x32_MI16x16x4x1_SE_1LDSB0_AF0EM1_AMAS0_BL1_DTL0_DVO0_EPS0_FL0_GRVW1_GSU3_ISA908_IU1_KLA_LBSPP128_LPB2_LRVW2_MAC_NLCA1_NLCB1_ONLL1_PGR2_PLR9_SIA3_SU32_SUS256_SRVW0_SNLL0_TT1_16_TLDS1_USFGROn1_VSn1_VW1_WSGRA1_WSGRB1_WG32_8_1_WGM2
    SolutionIndex: 288
    SolutionNameMin: Cijk_Ailk_Bljk_SB_MT32x64x32_MI16x16x4x1_SE_1LDSB0_AF0EM1_AMAS0_BL1_DTL0_DVO0_EPS0_FL0_GRVW4_GSU1_ISA908_IU1_KLA_LBSPP128_LPB4_LRVW2_MAC_NLCA1_NLCB1_ONLL1_PGR2_PLR9_SIA3_SU32_SUS256_SRVW2_SNLL0_TT1_32_TLDS1_USFGROn1_VSn1_VW1_WSGRA1_WSGRB1_WG32_8_1_WGM1
    SolutionIndex: 289
    SolutionNameMin: Cijk_Ailk_Bljk_SB_MT32x32x16_MI16x16x4x1_SE_1LDSB0_AF0EM1_AMAS0_BL1_DTL0_DVO0_EPS0_FL0_GRVW1_GSU1_ISA908_IU1_KLA_LBSPP128_LPB2_LRVW2_MAC_NLCA1_NLCB1_ONLL1_PGR2_PLR5_SIA3_SU32_SUS256_SRVW2_SNLL0_TT1_16_TLDS1_USFGROn1_VSn1_VW1_WSGRA1_WSGRB1_WG32_8_1_WGM1
    SolutionIndex: 290
    SolutionNameMin: Cijk_Ailk_Bljk_SB_MT128x32x32_MI16x16x4x1_SE_1LDSB0_AF0EM1_AMAS0_BL1_DTL0_DVO0_EPS1_FL0_GRVW4_GSU1_ISA908_IU1_KLA_LBSPP0_LPB0_LRVW1_MAC_NLCA1_NLCB1_ONLL1_PGR1_PLR1_SIA3_SU32_SUS256_SRVW0_SNLL0_TT4_16_TLDS0_USFGROn1_VSn1_VW1_WSGRA1_WSGRB1_WG32_8_1_WGM8
    SolutionIndex: 291
    SolutionNameMin: Cijk_Ailk_Bljk_SB_MT128x128x16_MI32x32x2x1_SE_1LDSB1_AF0EM1_AMAS0_BL1_DTL0_DVO0_EPS1_FL0_GRVW4_GSU1_ISA908_IU1_KLA_LBSPP128_LPB4_LRVW2_MAC_NLCA1_NLCB1_ONLL1_PGR1_PLR9_SIA3_SU0_SUS256_SRVW2_SNLL0_TT2_64_TLDS1_USFGROn1_VSn1_VW1_WSGRA1_WSGRB1_WG64_4_1_WGM15
    SolutionIndex: 292
    SolutionNameMin: Cijk_Ailk_Bljk_SB_MT16x16x32_SE_1LDSB0_AF0EM1_AMAS3_BL1_DTL0_DVO0_EPS0_FL1_GRVW2_GSU1_ISA908_IU1_KLA_LBSPP0_LPB2_LRVW2_MAC_NLCA1_NLCB1_ONLL1_PGR0_PLR1_SIA1_SU32_SUS256_SRVW0_SNLL0_TT2_2_TLDS0_USFGRO0_VS1_VW2_WSGRA0_WSGRB0_WG8_8_4_WGM16
    SolutionIndex: 293
    SolutionNameMin: Cijk_Ailk_Bljk_SB_MT96x96x16_MI16x16x4x1_SE_1LDSB0_AF0EM1_AMAS0_BL1_DTL0_DVO0_EPS0_FL0_GRVW1_GSU1_ISA908_IU1_KLA_LBSPP128_LPB2_LRVW2_MAC_NLCA3_NLCB1_ONLL1_PGR2_PLR5_SIA3_SU0_SUS256_SRVW0_SNLL0_TT3_48_TLDS1_USFGROn1_VSn1_VW1_WSGRA1_WSGRB1_WG32_8_1_WGM2
    SolutionIndex: 294
    SolutionNameMin: Cijk_Ailk_Bljk_SB_MT96x96x32_MI16x16x4x1_SE_1LDSB0_AF0EM1_AMAS0_BL1_DTL0_DVO0_EPS1_FL0_GRVW1_GSU1_ISA908_IU1_KLA_LBSPP128_LPB2_LRVW2_MAC_NLCA3_NLCB1_ONLL1_PGR1_PLR9_SIA3_SU0_SUS256_SRVW0_SNLL0_TT3_48_TLDS1_USFGROn1_VSn1_VW1_WSGRA1_WSGRB1_WG32_8_1_WGM2
    SolutionIndex: 295
    SolutionNameMin: Cijk_Ailk_Bljk_SB_MT16x8x32_SE_1LDSB0_AF0EM1_AMAS3_BL1_DTL0_DVO0_EPS0_FL1_GRVW2_GSU1_ISA908_IU1_KLA_LBSPP0_LPB2_LRVW2_MAC_NLCA1_NLCB1_ONLL1_PGR0_PLR1_SIA1_SU32_SUS256_SRVW0_SNLL0_TT2_2_TLDS0_USFGRO0_VS1_VW2_WSGRA0_WSGRB0_WG8_4_4_WGM8
    SolutionIndex: 296
    SolutionNameMin: Cijk_Ailk_Bljk_SB_MT16x16x32_SE_1LDSB0_AF0EM1_AMAS3_BL1_DTL0_DVO0_EPS1_FL1_GRVW2_GSU1_ISA908_IU1_KLA_LBSPP0_LPB2_LRVW2_MAC_NLCA1_NLCB1_ONLL1_PGR1_PLR1_SIA1_SU32_SUS256_SRVW0_SNLL1_TT2_2_TLDS0_USFGRO0_VS1_VW2_WSGRA0_WSGRB0_WG8_8_4_WGM1
    SolutionIndex: 297
    SolutionNameMin: Cijk_Ailk_Bljk_SB_MT16x64x32_MI16x16x4x1_SE_1LDSB0_AF0EM1_AMAS0_BL1_DTL0_DVO0_EPS0_FL0_GRVW1_GSU1_ISA908_IU1_KLA_LBSPP128_LPB2_LRVW2_MAC_NLCA1_NLCB1_ONLL1_PGR2_PLR9_SIA3_SU0_SUS256_SRVW0_SNLL0_TT1_16_TLDS1_USFGROn1_VSn1_VW1_WSGRA1_WSGRB1_WG16_16_1_WGM1
    SolutionIndex: 298
    SolutionNameMin: Cijk_Ailk_Bljk_SB_MT64x128x16_MI32x32x2x1_SE_1LDSB0_AF0EM1_AMAS0_BL1_DTL0_DVO0_EPS1_FL0_GRVW4_GSU1_ISA908_IU1_KLA_LBSPP128_LPB4_LRVW2_MAC_NLCA1_NLCB1_ONLL1_PGR1_PLR9_SIA3_SU32_SUS256_SRVW2_SNLL0_TT1_64_TLDS1_USFGROn1_VSn1_VW1_WSGRA1_WSGRB1_WG64_4_1_WGM15
    SolutionIndex: 299
    SolutionNameMin: Cijk_Ailk_Bljk_SB_MT16x64x32_MI16x16x4x1_SE_1LDSB0_AF0EM1_AMAS0_BL1_DTL0_DVO0_EPS0_FL0_GRVW4_GSU1_ISA908_IU1_KLA_LBSPP128_LPB4_LRVW2_MAC_NLCA1_NLCB1_ONLL1_PGR2_PLR9_SIA3_SU32_SUS128_SRVW2_SNLL0_TT1_16_TLDS1_USFGROn1_VSn1_VW1_WSGRA1_WSGRB1_WG16_16_1_WGM1
    SolutionIndex: 300
    SolutionNameMin: Cijk_Ailk_Bljk_SB_MT128x96x16_MI32x32x2x1_SE_1LDSB0_AF0EM1_AMAS0_BL1_DTL0_DVO0_EPS0_FL0_GRVW2_GSU1_ISA908_IU1_KLA_LBSPP128_LPB2_LRVW2_MAC_NLCA1_NLCB1_ONLL1_PGR2_PLR9_SIA3_SU32_SUS256_SRVW2_SNLL0_TT1_96_TLDS1_USFGROn1_VSn1_VW1_WSGRA1_WSGRB1_WG128_2_1_WGM1
    SolutionIndex: 301
    SolutionNameMin: Cijk_Ailk_Bljk_SB_MT64x64x32_MI32x32x2x1_SE_1LDSB0_AF0EM1_AMAS0_BL1_DTL0_DVO0_EPS0_FL0_GRVW1_GSU1_ISA908_IU1_KLA_LBSPP128_LPB2_LRVW2_MAC_NLCA1_NLCB1_ONLL1_PGR2_PLR17_SIA3_SU0_SUS256_SRVW2_SNLL0_TT1_32_TLDS1_USFGROn1_VSn1_VW1_WSGRA1_WSGRB1_WG64_4_1_WGM1
    SolutionIndex: 302
    SolutionNameMin: Cijk_Ailk_Bljk_SB_MT64x8x32_SN_1LDSB0_AF0EM1_AMAS3_BL1_DTL0_DVO0_EPS1_FL0_GRVW2_GSU2_ISA908_IU1_KLA_LBSPP0_LPB0_LRVW2_MAC_NLCA1_NLCB1_ONLL1_PGR1_PLR1_SIA1_SU32_SUS256_SRVW0_SNLL0_TT4_2_TLDS0_USFGRO0_VS1_VW2_WSGRA0_WSGRB0_WG16_4_4_WGM1
    SolutionIndex: 303
    SolutionNameMin: Cijk_Ailk_Bljk_SB_MT128x128x16_MI16x16x1x4_SE_1LDSB0_AF0EM1_AMAS3_BL1_DTL0_DVO0_EPS1_FL0_GRVW1_GSU1_ISA908_IU1_KLA_LBSPP0_LPB0_LRVW1_MAC_NLCA2_NLCB1_ONLL1_PGR1_PLR1_SIA3_SU32_SUS256_SRVW0_SNLL0_TT4_16_TLDS1_USFGROn1_VSn1_VW2_WSGRA1_WSGRB1_WG32_8_1_WGM8
    SolutionIndex: 304
    SolutionNameMin: Cijk_Ailk_Bljk_SB_MT16x16x32_SE_1LDSB0_AF0EM1_AMAS3_BL1_DTL0_DVO0_EPS0_FL1_GRVW2_GSU4_ISA908_IU1_KLA_LBSPP0_LPB2_LRVW2_MAC_NLCA1_NLCB1_ONLL1_PGR0_PLR1_SIA1_SU32_SUS256_SRVW0_SNLL0_TT2_2_TLDS0_USFGRO0_VS1_VW2_WSGRA0_WSGRB0_WG8_8_4_WGM8
    SolutionIndex: 305
    SolutionNameMin: Cijk_Ailk_Bljk_SB_MT64x32x16_MI16x16x4x1_SE_1LDSB0_AF0EM1_AMAS0_BL1_DTL0_DVO0_EPS0_FL0_GRVW4_GSU1_ISA908_IU1_KLA_LBSPP128_LPB4_LRVW2_MAC_NLCA1_NLCB1_ONLL1_PGR2_PLR5_SIA3_SU32_SUS256_SRVW2_SNLL0_TT2_16_TLDS1_USFGROn1_VSn1_VW1_WSGRA1_WSGRB1_WG32_8_1_WGM15
    SolutionIndex: 306
    SolutionNameMin: Cijk_Ailk_Bljk_SB_MT32x32x16_MI16x16x4x1_SE_1LDSB0_AF0EM1_AMAS0_BL1_DTL0_DVO0_EPS0_FL0_GRVW1_GSU1_ISA908_IU1_KLA_LBSPP128_LPB2_LRVW2_MAC_NLCA1_NLCB1_ONLL1_PGR2_PLR5_SIA3_SU0_SUS256_SRVW2_SNLL0_TT1_16_TLDS1_USFGROn1_VSn1_VW1_WSGRA1_WSGRB1_WG32_8_1_WGM15
    SolutionIndex: 307
    SolutionNameMin: Cijk_Ailk_Bljk_SB_MT128x64x32_MI32x32x2x1_SE_1LDSB0_AF0EM1_AMAS0_BL1_DTL0_DVO0_EPS0_FL0_GRVW4_GSU1_ISA908_IU1_KLA_LBSPP128_LPB4_LRVW2_MAC_NLCA1_NLCB1_ONLL1_PGR2_PLR17_SIA3_SU0_SUS256_SRVW2_SNLL0_TT2_32_TLDS1_USFGROn1_VSn1_VW1_WSGRA1_WSGRB1_WG64_4_1_WGM1
    SolutionIndex: 308
    SolutionNameMin: Cijk_Ailk_Bljk_SB_MT64x128x16_MI32x32x2x1_SE_1LDSB0_AF0EM1_AMAS0_BL1_DTL0_DVO0_EPS0_FL0_GRVW1_GSU1_ISA908_IU1_KLA_LBSPP128_LPB2_LRVW2_MAC_NLCA1_NLCB1_ONLL1_PGR2_PLR9_SIA3_SU0_SUS256_SRVW2_SNLL0_TT1_64_TLDS1_USFGROn1_VSn1_VW1_WSGRA1_WSGRB1_WG64_4_1_WGM1
    SolutionIndex: 309
    SolutionNameMin: Cijk_Ailk_Bljk_SB_MT160x128x16_MI32x32x2x1_SE_1LDSB0_AF0EM1_AMAS0_BL1_DTL0_DVO0_EPS1_FL0_GRVW1_GSU1_ISA908_IU1_KLA_LBSPP128_LPB2_LRVW2_MAC_NLCA5_NLCB1_ONLL1_PGR1_PLR9_SIA3_SU32_SUS256_SRVW0_SNLL0_TT5_32_TLDS1_USFGROn1_VSn1_VW1_WSGRA1_WSGRB1_WG32_8_1_WGM15
    SolutionIndex: 310
    SolutionNameMin: Cijk_Ailk_Bljk_SB_MT128x128x16_MI32x32x2x1_SE_1LDSB0_AF0EM1_AMAS0_BL1_DTL0_DVO0_EPS0_FL0_GRVW4_GSU1_ISA908_IU1_KLA_LBSPP128_LPB4_LRVW2_MAC_NLCA1_NLCB1_ONLL1_PGR2_PLR9_SIA3_SU0_SUS256_SRVW2_SNLL0_TT2_64_TLDS1_USFGROn1_VSn1_VW1_WSGRA1_WSGRB1_WG64_4_1_WGM1
    SolutionIndex: 311
    SolutionNameMin: Cijk_Ailk_Bljk_SB_MT16x8x32_SE_1LDSB0_AF0EM1_AMAS3_BL1_DTL0_DVO0_EPS1_FL1_GRVW2_GSU1_ISA908_IU1_KLA_LBSPP0_LPB2_LRVW2_MAC_NLCA1_NLCB1_ONLL1_PGR1_PLR1_SIA1_SU32_SUS256_SRVW0_SNLL1_TT2_2_TLDS0_USFGRO0_VS1_VW2_WSGRA0_WSGRB0_WG8_4_4_WGM8
    SolutionIndex: 312
    SolutionNameMin: Cijk_Ailk_Bljk_SB_MT64x64x16_MI32x32x2x1_SE_1LDSB0_AF0EM1_AMAS0_BL1_DTL0_DVO0_EPS0_FL0_GRVW2_GSU1_ISA908_IU1_KLA_LBSPP128_LPB2_LRVW2_MAC_NLCA1_NLCB1_ONLL1_PGR2_PLR9_SIA3_SU32_SUS128_SRVW2_SNLL0_TT1_32_TLDS1_USFGROn1_VSn1_VW1_WSGRA1_WSGRB1_WG64_4_1_WGM1
    SolutionIndex: 313
    SolutionNameMin: Cijk_Ailk_Bljk_SB_MT64x32x16_SN_1LDSB0_AF0EM1_AMAS3_BL1_DTL0_DVO0_EPS1_FL1_GRVW4_GSU1_ISA908_IU1_KLA_LBSPP0_LPB4_LRVW4_MAC_NLCA1_NLCB1_ONLL1_PGR1_PLR1_SIA1_SU32_SUS256_SRVW0_SNLL1_TT4_4_TLDS0_USFGRO0_VS1_VW4_WSGRA0_WSGRB0_WG16_8_2_WGM4
    SolutionIndex: 314
    SolutionNameMin: Cijk_Ailk_Bljk_SB_MT16x32x32_SE_1LDSB0_AF0EM1_AMAS3_BL1_DTL0_DVO0_EPS1_FL0_GRVW2_GSU1_ISA908_IU1_KLA_LBSPP0_LPB2_LRVW2_MAC_NLCA1_NLCB1_ONLL1_PGR1_PLR1_SIA1_SU32_SUS256_SRVW0_SNLL0_TT4_2_TLDS0_USFGRO0_VS1_VW2_WSGRA0_WSGRB0_WG4_16_4_WGM8
    SolutionIndex: 315
    SolutionNameMin: Cijk_Ailk_Bljk_SB_MT64x128x16_MI32x32x2x1_SE_1LDSB0_AF0EM1_AMAS0_BL1_DTL0_DVO0_EPS0_FL0_GRVW2_GSU1_ISA908_IU1_KLA_LBSPP128_LPB2_LRVW2_MAC_NLCA1_NLCB1_ONLL1_PGR2_PLR9_SIA3_SU32_SUS128_SRVW2_SNLL0_TT1_64_TLDS1_USFGROn1_VSn1_VW1_WSGRA1_WSGRB1_WG64_4_1_WGM2
    SolutionIndex: 316
    SolutionNameMin: Cijk_Ailk_Bljk_SB_MT16x64x32_MI16x16x4x1_SE_1LDSB0_AF0EM1_AMAS0_BL1_DTL0_DVO0_EPS0_FL0_GRVW4_GSU1_ISA908_IU1_KLA_LBSPP128_LPB4_LRVW2_MAC_NLCA1_NLCB1_ONLL1_PGR2_PLR9_SIA3_SU0_SUS256_SRVW0_SNLL0_TT1_16_TLDS1_USFGROn1_VSn1_VW1_WSGRA1_WSGRB1_WG16_16_1_WGM1
    SolutionIndex: 317
    SolutionNameMin: Cijk_Ailk_Bljk_SB_MT32x16x32_SE_1LDSB0_AF0EM1_AMAS3_BL1_DTL0_DVO0_EPS1_FL1_GRVW2_GSU1_ISA908_IU1_KLA_LBSPP0_LPB2_LRVW2_MAC_NLCA1_NLCB1_ONLL1_PGR1_PLR1_SIA1_SU32_SUS256_SRVW0_SNLL1_TT2_4_TLDS0_USFGRO0_VS1_VW2_WSGRA0_WSGRB0_WG16_4_4_WGM1
    SolutionIndex: 318
    SolutionNameMin: Cijk_Ailk_Bljk_SB_MT64x64x16_MI32x32x2x1_SE_1LDSB0_AF0EM1_AMAS3_BL1_DTL0_DVO0_EPS1_FL0_GRVW4_GSU1_ISA908_IU1_KLA_LBSPP0_LPB0_LRVW1_MAC_NLCA1_NLCB1_ONLL2_PGR1_PLR1_SIA1_SU32_SUS256_SRVW0_SNLL0_TT1_32_TLDS0_USFGROn1_VSn1_VW4_WSGRA1_WSGRB0_WG64_4_1_WGM120
    SolutionIndex: 319
    SolutionNameMin: Cijk_Ailk_Bljk_SB_MT128x96x16_MI32x32x2x1_SE_1LDSB0_AF0EM1_AMAS0_BL1_DTL0_DVO0_EPS0_FL0_GRVW2_GSU1_ISA908_IU1_KLA_LBSPP128_LPB2_LRVW2_MAC_NLCA1_NLCB1_ONLL1_PGR2_PLR9_SIA3_SU32_SUS256_SRVW2_SNLL0_TT1_96_TLDS1_USFGROn1_VSn1_VW1_WSGRA1_WSGRB1_WG128_2_1_WGM2
    SolutionIndex: 320
    SolutionNameMin: Cijk_Ailk_Bljk_SB_MT32x64x16_SE_1LDSB0_AF0EM1_AMAS3_BL1_DTL0_DVO0_EPS1_FL1_GRVW2_GSU1_ISA908_IU1_KLA_LBSPP0_LPB2_LRVW2_MAC_NLCA1_NLCB1_ONLL1_PGR1_PLR1_SIA1_SU32_SUS256_SRVW0_SNLL1_TT4_4_TLDS0_USFGRO0_VS1_VW2_WSGRA0_WSGRB0_WG8_16_2_WGM16
    SolutionIndex: 321
    SolutionNameMin: Cijk_Ailk_Bljk_SB_MT192x64x16_MI32x32x2x1_SE_1LDSB0_AF0EM1_AMAS0_BL1_DTL0_DVO0_EPS0_FL0_GRVW4_GSU1_ISA908_IU1_KLA_LBSPP128_LPB4_LRVW2_MAC_NLCA3_NLCB1_ONLL1_PGR2_PLR9_SIA3_SU0_SUS256_SRVW0_SNLL0_TT3_32_TLDS1_USFGROn1_VSn1_VW1_WSGRA1_WSGRB1_WG64_4_1_WGM1
    SolutionIndex: 322
    SolutionNameMin: Cijk_Ailk_Bljk_SB_MT32x8x32_SE_1LDSB0_AF0EM1_AMAS3_BL1_DTL0_DVO0_EPS1_FL1_GRVW2_GSU1_ISA908_IU1_KLA_LBSPP0_LPB2_LRVW2_MAC_NLCA1_NLCB1_ONLL1_PGR1_PLR1_SIA1_SU32_SUS256_SRVW0_SNLL0_TT2_2_TLDS0_USFGRO0_VS1_VW2_WSGRA0_WSGRB0_WG16_4_4_WGM1
    SolutionIndex: 323
    SolutionNameMin: Cijk_Ailk_Bljk_SB_MT32x64x16_SE_1LDSB0_AF0EM1_AMAS3_BL1_DTL0_DVO0_EPS1_FL1_GRVW2_GSU1_ISA908_IU1_KLA_LBSPP0_LPB2_LRVW2_MAC_NLCA1_NLCB1_ONLL1_PGR1_PLR1_SIA1_SU32_SUS256_SRVW0_SNLL1_TT4_4_TLDS0_USFGRO0_VS1_VW2_WSGRA0_WSGRB0_WG8_16_2_WGM1
    SolutionIndex: 324
    SolutionNameMin: Cijk_Ailk_Bljk_SB_MT128x96x16_MI32x32x2x1_SE_1LDSB0_AF0EM1_AMAS0_BL1_DTL0_DVO0_EPS1_FL0_GRVW2_GSU1_ISA908_IU1_KLA_LBSPP128_LPB2_LRVW2_MAC_NLCA1_NLCB1_ONLL1_PGR1_PLR9_SIA3_SU0_SUS256_SRVW2_SNLL0_TT1_96_TLDS1_USFGROn1_VSn1_VW1_WSGRA1_WSGRB1_WG128_2_1_WGM1
    SolutionIndex: 325
    SolutionNameMin: Cijk_Ailk_Bljk_SB_MT128x96x16_MI32x32x2x1_SE_1LDSB0_AF0EM1_AMAS0_BL1_DTL0_DVO0_EPS0_FL0_GRVW1_GSU1_ISA908_IU1_KLA_LBSPP128_LPB2_LRVW2_MAC_NLCA2_NLCB1_ONLL1_PGR2_PLR9_SIA3_SU0_SUS256_SRVW2_SNLL0_TT1_96_TLDS1_USFGROn1_VSn1_VW1_WSGRA1_WSGRB1_WG128_2_1_WGM1
    SolutionIndex: 326
    SolutionNameMin: Cijk_Ailk_Bljk_SB_MT128x128x16_MI32x32x2x1_SE_1LDSB0_AF0EM1_AMAS0_BL1_DTL0_DVO0_EPS1_FL0_GRVW4_GSU1_ISA908_IU1_KLA_LBSPP128_LPB4_LRVW2_MAC_NLCA1_NLCB1_ONLL1_PGR1_PLR9_SIA3_SU0_SUS256_SRVW2_SNLL0_TT2_64_TLDS1_USFGROn1_VSn1_VW1_WSGRA1_WSGRB1_WG64_4_1_WGM2
    SolutionIndex: 327
    SolutionNameMin: Cijk_Ailk_Bljk_SB_MT32x32x32_MI16x16x4x1_SE_1LDSB0_AF0EM1_AMAS0_BL1_DTL0_DVO0_EPS0_FL0_GRVW4_GSU5_ISA908_IU1_KLA_LBSPP128_LPB4_LRVW2_MAC_NLCA1_NLCB1_ONLL1_PGR2_PLR9_SIA3_SU0_SUS256_SRVW0_SNLL0_TT1_16_TLDS1_USFGROn1_VSn1_VW1_WSGRA1_WSGRB1_WG32_8_1_WGM2
    SolutionIndex: 328
    SolutionNameMin: Cijk_Ailk_Bljk_SB_MT128x64x32_MI32x32x2x1_SE_1LDSB0_AF0EM1_AMAS0_BL1_DTL0_DVO0_EPS1_FL0_GRVW4_GSU1_ISA908_IU1_KLA_LBSPP128_LPB4_LRVW2_MAC_NLCA1_NLCB1_ONLL1_PGR1_PLR17_SIA3_SU32_SUS256_SRVW2_SNLL0_TT2_32_TLDS1_USFGROn1_VSn1_VW1_WSGRA1_WSGRB1_WG64_4_1_WGM2
    SolutionIndex: 329
    SolutionNameMin: Cijk_Ailk_Bljk_SB_MT16x8x32_SE_1LDSB0_AF0EM1_AMAS3_BL1_DTL0_DVO0_EPS1_FL1_GRVW2_GSU1_ISA908_IU1_KLA_LBSPP0_LPB0_LRVW2_MAC_NLCA1_NLCB1_ONLL1_PGR1_PLR1_SIA1_SU32_SUS256_SRVW0_SNLL1_TT2_2_TLDS0_USFGRO0_VS1_VW2_WSGRA0_WSGRB0_WG8_4_4_WGM1
    SolutionIndex: 330
    SolutionNameMin: Cijk_Ailk_Bljk_SB_MT64x16x32_MI16x16x4x1_SE_1LDSB0_AF0EM1_AMAS0_BL1_DTL0_DVO0_EPS0_FL0_GRVW4_GSU5_ISA908_IU1_KLA_LBSPP128_LPB4_LRVW2_MAC_NLCA1_NLCB1_ONLL1_PGR2_PLR9_SIA3_SU0_SUS256_SRVW0_SNLL0_TT1_16_TLDS1_USFGROn1_VSn1_VW1_WSGRA1_WSGRB1_WG64_4_1_WGM1
    SolutionIndex: 331
    SolutionNameMin: Cijk_Ailk_Bljk_SB_MT128x128x16_MI32x32x2x1_SN_1LDSB0_AF0EM1_AMAS0_BL1_DTL0_DVO0_EPS1_FL0_GRVW4_GSU1_ISA908_IU1_KLA_LBSPP128_LPB4_LRVW2_MAC_NLCA1_NLCB1_ONLL1_PGR1_PLR9_SIA3_SU32_SUS256_SRVW2_SNLL0_TT2_64_TLDS1_USFGROn1_VSn1_VW1_WSGRA1_WSGRB1_WG64_4_1_WGM2
    SolutionIndex: 332
    SolutionNameMin: Cijk_Ailk_Bljk_SB_MT16x16x32_SE_1LDSB0_AF0EM1_AMAS3_BL1_DTL0_DVO0_EPS1_FL1_GRVW2_GSU1_ISA908_IU1_KLA_LBSPP0_LPB2_LRVW2_MAC_NLCA1_NLCB1_ONLL1_PGR1_PLR1_SIA1_SU32_SUS256_SRVW0_SNLL1_TT4_2_TLDS0_USFGRO0_VS1_VW2_WSGRA0_WSGRB0_WG4_8_8_WGM1
    SolutionIndex: 333
    SolutionNameMin: Cijk_Ailk_Bljk_SB_MT64x32x32_MI16x16x4x1_SE_1LDSB0_AF0EM1_AMAS0_BL1_DTL0_DVO0_EPS0_FL0_GRVW1_GSU3_ISA908_IU1_KLA_LBSPP128_LPB2_LRVW2_MAC_NLCA1_NLCB1_ONLL1_PGR2_PLR9_SIA3_SU32_SUS256_SRVW0_SNLL0_TT2_16_TLDS1_USFGROn1_VSn1_VW1_WSGRA1_WSGRB1_WG32_8_1_WGM2
    SolutionIndex: 334
    SolutionNameMin: Cijk_Ailk_Bljk_SB_MT16x8x32_SE_1LDSB0_AF0EM1_AMAS3_BL1_DTL0_DVO0_EPS0_FL1_GRVW2_GSU1_ISA908_IU1_KLA_LBSPP0_LPB0_LRVW2_MAC_NLCA1_NLCB1_ONLL1_PGR0_PLR1_SIA1_SU32_SUS256_SRVW0_SNLL0_TT2_2_TLDS0_USFGRO0_VS1_VW2_WSGRA0_WSGRB0_WG8_4_4_WGM1
    SolutionIndex: 335
    SolutionNameMin: Cijk_Ailk_Bljk_SB_MT64x128x16_MI32x32x2x1_SE_1LDSB0_AF0EM1_AMAS0_BL1_DTL0_DVO0_EPS0_FL0_GRVW1_GSU1_ISA908_IU1_KLA_LBSPP128_LPB2_LRVW2_MAC_NLCA1_NLCB1_ONLL1_PGR2_PLR9_SIA3_SU32_SUS128_SRVW2_SNLL0_TT1_64_TLDS1_USFGROn1_VSn1_VW1_WSGRA1_WSGRB1_WG64_4_1_WGM1
    SolutionIndex: 336
    SolutionNameMin: Cijk_Ailk_Bljk_SB_MT64x16x16_MI16x16x4x1_SE_1LDSB0_AF0EM1_AMAS0_BL1_DTL0_DVO0_EPS0_FL0_GRVW1_GSU1_ISA908_IU1_KLA_LBSPP128_LPB2_LRVW2_MAC_NLCA1_NLCB1_ONLL1_PGR2_PLR5_SIA3_SU0_SUS256_SRVW0_SNLL0_TT1_16_TLDS1_USFGROn1_VSn1_VW1_WSGRA1_WSGRB1_WG64_4_1_WGM1
    SolutionIndex: 337
    SolutionNameMin: Cijk_Ailk_Bljk_SB_MT64x128x16_MI32x32x2x1_SE_1LDSB0_AF0EM1_AMAS0_BL1_DTL0_DVO0_EPS0_FL0_GRVW1_GSU1_ISA908_IU1_KLA_LBSPP128_LPB2_LRVW2_MAC_NLCA1_NLCB1_ONLL1_PGR2_PLR9_SIA3_SU0_SUS256_SRVW2_SNLL0_TT1_64_TLDS1_USFGROn1_VSn1_VW1_WSGRA1_WSGRB1_WG64_4_1_WGM2
    SolutionIndex: 338
    SolutionNameMin: Cijk_Ailk_Bljk_SB_MT128x64x16_MI32x32x2x1_SE_1LDSB0_AF0EM1_AMAS0_BL1_DTL0_DVO0_EPS0_FL0_GRVW1_GSU1_ISA908_IU1_KLA_LBSPP128_LPB2_LRVW2_MAC_NLCA2_NLCB1_ONLL1_PGR2_PLR9_SIA3_SU0_SUS256_SRVW2_SNLL0_TT2_32_TLDS1_USFGROn1_VSn1_VW1_WSGRA1_WSGRB1_WG64_4_1_WGM15
    SolutionIndex: 339
    SolutionNameMin: Cijk_Ailk_Bljk_SB_MT32x8x32_SE_1LDSB0_AF0EM1_AMAS3_BL1_DTL0_DVO0_EPS1_FL0_GRVW2_GSU1_ISA908_IU1_KLA_LBSPP0_LPB2_LRVW2_MAC_NLCA1_NLCB1_ONLL1_PGR1_PLR1_SIA1_SU32_SUS256_SRVW0_SNLL0_TT2_2_TLDS0_USFGRO0_VS1_VW2_WSGRA0_WSGRB0_WG16_4_4_WGM8
    SolutionIndex: 340
    SolutionNameMin: Cijk_Ailk_Bljk_SB_MT64x64x16_MI32x32x2x1_SE_1LDSB0_AF0EM1_AMAS0_BL1_DTL0_DVO0_EPS0_FL0_GRVW1_GSU1_ISA908_IU1_KLA_LBSPP128_LPB2_LRVW2_MAC_NLCA1_NLCB1_ONLL1_PGR2_PLR9_SIA3_SU0_SUS256_SRVW2_SNLL0_TT1_32_TLDS1_USFGROn1_VSn1_VW1_WSGRA1_WSGRB1_WG64_4_1_WGM1
    SolutionIndex: 341
    SolutionNameMin: Cijk_Ailk_Bljk_SB_MT64x128x32_MI32x32x2x1_SE_1LDSB0_AF0EM1_AMAS0_BL1_DTL0_DVO0_EPS0_FL0_GRVW4_GSU1_ISA908_IU1_KLA_LBSPP128_LPB4_LRVW2_MAC_NLCA1_NLCB1_ONLL1_PGR2_PLR17_SIA3_SU32_SUS256_SRVW2_SNLL0_TT1_64_TLDS1_USFGROn1_VSn1_VW1_WSGRA1_WSGRB1_WG64_4_1_WGM1
    SolutionIndex: 342
    SolutionNameMin: Cijk_Ailk_Bljk_SB_MT144x128x16_MI16x16x4x1_SE_1LDSB1_AF0EM1_AMAS0_BL1_DTL0_DVO0_EPS1_FL0_GRVW1_GSU1_ISA908_IU1_KLA_LBSPP128_LPB2_LRVW2_MAC_NLCA9_NLCB1_ONLL1_PGR1_PLR5_SIA3_SU0_SUS256_SRVW0_SNLL0_TT9_32_TLDS1_USFGROn1_VSn1_VW1_WSGRA1_WSGRB1_WG16_16_1_WGM1
    SolutionIndex: 343
    SolutionNameMin: Cijk_Ailk_Bljk_SB_MT16x64x32_MI16x16x4x1_SE_1LDSB0_AF0EM1_AMAS0_BL1_DTL0_DVO0_EPS0_FL0_GRVW4_GSU1_ISA908_IU1_KLA_LBSPP128_LPB4_LRVW2_MAC_NLCA1_NLCB1_ONLL1_PGR2_PLR9_SIA3_SU32_SUS256_SRVW0_SNLL0_TT1_16_TLDS1_USFGROn1_VSn1_VW1_WSGRA1_WSGRB1_WG16_16_1_WGM2
    SolutionIndex: 344
    SolutionNameMin: Cijk_Ailk_Bljk_SB_MT128x64x16_MI32x32x2x1_SE_1LDSB0_AF0EM1_AMAS0_BL1_DTL0_DVO0_EPS0_FL0_GRVW2_GSU1_ISA908_IU1_KLA_LBSPP128_LPB2_LRVW2_MAC_NLCA1_NLCB1_ONLL1_PGR2_PLR9_SIA3_SU32_SUS256_SRVW2_SNLL0_TT2_32_TLDS1_USFGROn1_VSn1_VW1_WSGRA1_WSGRB1_WG64_4_1_WGM15
    SolutionIndex: 345
    SolutionNameMin: Cijk_Ailk_Bljk_SB_MT128x64x32_MI32x32x2x1_SE_1LDSB0_AF0EM1_AMAS0_BL1_DTL0_DVO0_EPS0_FL0_GRVW4_GSU1_ISA908_IU1_KLA_LBSPP128_LPB4_LRVW2_MAC_NLCA1_NLCB1_ONLL1_PGR2_PLR17_SIA3_SU32_SUS256_SRVW2_SNLL0_TT2_32_TLDS1_USFGROn1_VSn1_VW1_WSGRA1_WSGRB1_WG64_4_1_WGM2
    SolutionIndex: 346
    SolutionNameMin: Cijk_Ailk_Bljk_SB_MT8x8x8_SN_1LDSB0_AF0EM1_AMAS3_BL1_DTL0_DVO0_EPS1_FL0_GRVW2_GSU16_ISA908_IU1_KLA_LBSPP0_LPB0_LRVW2_MAC_NLCA1_NLCB1_ONLL1_PGR1_PLR1_SIA1_SU32_SUS256_SRVW0_SNLL0_TT2_2_TLDS0_USFGRO1_VS1_VW2_WSGRA0_WSGRB0_WG4_4_4_WGM1
    SolutionIndex: 347
    SolutionNameMin: Cijk_Ailk_Bljk_SB_MT96x128x16_MI32x32x2x1_SE_1LDSB0_AF0EM1_AMAS0_BL1_DTL0_DVO0_EPS0_FL0_GRVW1_GSU1_ISA908_IU1_KLA_LBSPP128_LPB2_LRVW2_MAC_NLCA3_NLCB1_ONLL1_PGR2_PLR9_SIA3_SU0_SUS256_SRVW0_SNLL0_TT3_32_TLDS1_USFGROn1_VSn1_VW1_WSGRA1_WSGRB1_WG32_8_1_WGM1
    SolutionIndex: 348
    SolutionNameMin: Cijk_Ailk_Bljk_SB_MT32x16x32_SE_1LDSB0_AF0EM1_AMAS3_BL1_DTL0_DVO0_EPS1_FL1_GRVW2_GSU1_ISA908_IU1_KLA_LBSPP0_LPB2_LRVW2_MAC_NLCA1_NLCB1_ONLL1_PGR1_PLR1_SIA1_SU32_SUS256_SRVW0_SNLL1_TT2_2_TLDS0_USFGRO0_VS1_VW2_WSGRA0_WSGRB0_WG16_8_2_WGM1
    SolutionIndex: 349
    SolutionNameMin: Cijk_Ailk_Bljk_SB_MT64x128x32_MI32x32x2x1_SE_1LDSB0_AF0EM1_AMAS0_BL1_DTL0_DVO0_EPS0_FL0_GRVW4_GSU1_ISA908_IU1_KLA_LBSPP128_LPB4_LRVW2_MAC_NLCA1_NLCB1_ONLL1_PGR2_PLR17_SIA3_SU32_SUS256_SRVW2_SNLL0_TT1_64_TLDS1_USFGROn1_VSn1_VW1_WSGRA1_WSGRB1_WG64_4_1_WGM15
    SolutionIndex: 350
    SolutionNameMin: Cijk_Ailk_Bljk_SB_MT64x32x16_MI16x16x4x1_SE_1LDSB0_AF0EM1_AMAS0_BL1_DTL0_DVO0_EPS0_FL0_GRVW4_GSU1_ISA908_IU1_KLA_LBSPP128_LPB4_LRVW2_MAC_NLCA1_NLCB1_ONLL1_PGR2_PLR5_SIA3_SU0_SUS256_SRVW2_SNLL0_TT2_16_TLDS1_USFGROn1_VSn1_VW1_WSGRA1_WSGRB1_WG32_8_1_WGM15
    SolutionIndex: 351
    SolutionNameMin: Cijk_Ailk_Bljk_SB_MT24x24x32_SN_1LDSB0_AF0EM1_AMAS0_BL1_DTL0_DVO0_EPS1_FL0_GRVW1_GSU4_ISA908_IU1_KLA_LBSPP0_LPB0_LRVW1_MAC_NLCA1_NLCB1_ONLL1_PGR1_PLR1_SIA1_SU32_SUS256_SRVW0_SNLL0_TT3_4_TLDS0_USFGRO1_VS1_VW1_WSGRA0_WSGRB0_WG8_6_4_WGM1
    SolutionIndex: 352
    SolutionNameMin: Cijk_Ailk_Bljk_SB_MT64x128x16_MI32x32x2x1_SE_1LDSB0_AF0EM1_AMAS0_BL1_DTL0_DVO0_EPS0_FL0_GRVW1_GSU1_ISA908_IU1_KLA_LBSPP128_LPB2_LRVW2_MAC_NLCA1_NLCB1_ONLL1_PGR2_PLR9_SIA3_SU32_SUS256_SRVW2_SNLL0_TT1_64_TLDS1_USFGROn1_VSn1_VW1_WSGRA1_WSGRB1_WG64_4_1_WGM2
    SolutionIndex: 353
    SolutionNameMin: Cijk_Ailk_Bljk_SB_MT64x128x16_MI16x16x4x1_SE_1LDSB0_AF0EM1_AMAS3_BL1_DTL0_DVO0_EPS1_FL1_GRVW4_GSU1_ISA908_IU1_KLA_LBSPP0_LPB0_LRVW1_MAC_NLCA1_NLCB1_ONLL0_PGR1_PLR1_SIA3_SU32_SUS256_SRVW4_SNLL0_TT4_32_TLDS1_USFGROn1_VSn1_VW4_WSGRA0_WSGRB0_WG16_16_1_WGM1
    SolutionIndex: 354
    SolutionNameMin: Cijk_Ailk_Bljk_SB_MT64x16x32_SE_1LDSB0_AF0EM1_AMAS3_BL1_DTL0_DVO0_EPS1_FL1_GRVW4_GSU1_ISA908_IU1_KLA_LBSPP0_LPB4_LRVW4_MAC_NLCA1_NLCB1_ONLL1_PGR1_PLR1_SIA1_SU32_SUS256_SRVW0_SNLL0_TT4_4_TLDS0_USFGRO0_VS1_VW4_WSGRA0_WSGRB0_WG16_4_4_WGM8
    SolutionIndex: 355
    SolutionNameMin: Cijk_Ailk_Bljk_SB_MT64x32x16_MI16x16x4x1_SE_1LDSB0_AF0EM1_AMAS3_BL1_DTL0_DVO0_EPS1_FL0_GRVW1_GSU1_ISA908_IU1_KLA_LBSPP0_LPB0_LRVW1_MAC_NLCA1_NLCB1_ONLL1_PGR1_PLR1_SIA3_SU32_SUS256_SRVW0_SNLL0_TT2_16_TLDS0_USFGROn1_VSn1_VW4_WSGRA1_WSGRB1_WG32_8_1_WGM8
    SolutionIndex: 356
    SolutionNameMin: Cijk_Ailk_Bljk_SB_MT64x16x32_SE_1LDSB0_AF0EM1_AMAS3_BL1_DTL0_DVO0_EPS1_FL1_GRVW4_GSU1_ISA908_IU1_KLA_LBSPP0_LPB4_LRVW4_MAC_NLCA1_NLCB1_ONLL1_PGR1_PLR1_SIA1_SU32_SUS256_SRVW0_SNLL1_TT4_4_TLDS0_USFGRO0_VS1_VW4_WSGRA0_WSGRB0_WG16_4_4_WGM8
    SolutionIndex: 357
    SolutionNameMin: Cijk_Ailk_Bljk_SB_MT128x160x16_MI32x32x2x1_SE_1LDSB0_AF0EM1_AMAS0_BL1_DTL0_DVO0_EPS1_FL0_GRVW1_GSU1_ISA908_IU1_KLA_LBSPP128_LPB2_LRVW2_MAC_NLCA2_NLCB1_ONLL1_PGR1_PLR9_SIA3_SU32_SUS256_SRVW2_SNLL0_TT1_160_TLDS1_USFGROn1_VSn1_VW1_WSGRA1_WSGRB1_WG128_2_1_WGM2
    SolutionIndex: 358
    SolutionNameMin: Cijk_Ailk_Bljk_SB_MT64x128x16_MI32x32x2x1_SE_1LDSB0_AF0EM1_AMAS0_BL1_DTL0_DVO0_EPS0_FL0_GRVW2_GSU1_ISA908_IU1_KLA_LBSPP128_LPB2_LRVW2_MAC_NLCA1_NLCB1_ONLL1_PGR2_PLR9_SIA3_SU32_SUS256_SRVW2_SNLL0_TT1_64_TLDS1_USFGROn1_VSn1_VW1_WSGRA1_WSGRB1_WG64_4_1_WGM1
    SolutionIndex: 359
    SolutionNameMin: Cijk_Ailk_Bljk_SB_MT32x32x32_MI16x16x4x1_SE_1LDSB0_AF0EM1_AMAS0_BL1_DTL0_DVO0_EPS1_FL0_GRVW1_GSU1_ISA908_IU1_KLA_LBSPP128_LPB2_LRVW2_MAC_NLCA1_NLCB1_ONLL1_PGR1_PLR9_SIA3_SU0_SUS256_SRVW2_SNLL0_TT1_16_TLDS1_USFGROn1_VSn1_VW1_WSGRA1_WSGRB1_WG32_8_1_WGM1
    SolutionIndex: 360
    SolutionNameMin: Cijk_Ailk_Bljk_SB_MT128x96x16_MI32x32x2x1_SE_1LDSB0_AF0EM1_AMAS0_BL1_DTL0_DVO0_EPS0_FL0_GRVW1_GSU1_ISA908_IU1_KLA_LBSPP128_LPB2_LRVW2_MAC_NLCA2_NLCB1_ONLL1_PGR2_PLR9_SIA3_SU32_SUS256_SRVW2_SNLL0_TT1_96_TLDS1_USFGROn1_VSn1_VW1_WSGRA1_WSGRB1_WG128_2_1_WGM2
    SolutionIndex: 361
    SolutionNameMin: Cijk_Ailk_Bljk_SB_MT128x64x16_MI32x32x2x1_SE_1LDSB0_AF0EM1_AMAS0_BL1_DTL0_DVO0_EPS0_FL0_GRVW4_GSU1_ISA908_IU1_KLA_LBSPP128_LPB4_LRVW2_MAC_NLCA1_NLCB1_ONLL1_PGR2_PLR9_SIA3_SU0_SUS256_SRVW2_SNLL0_TT2_32_TLDS1_USFGROn1_VSn1_VW1_WSGRA1_WSGRB1_WG64_4_1_WGM2
    SolutionIndex: 362
    SolutionNameMin: Cijk_Ailk_Bljk_SB_MT4x64x32_SE_1LDSB0_AF0EM1_AMAS3_BL1_DTL0_DVO0_EPS0_FL1_GRVW2_GSU1_ISA908_IU1_KLA_LBSPP0_LPB2_LRVW2_MAC_NLCA1_NLCB1_ONLL1_PGR0_PLR1_SIA1_SU32_SUS256_SRVW0_SNLL0_TT2_2_TLDS0_USFGRO0_VS1_VW2_WSGRA0_WSGRB0_WG2_32_4_WGM1
    SolutionIndex: 363
    SolutionNameMin: Cijk_Ailk_Bljk_SB_MT64x64x32_MI32x32x2x1_SE_1LDSB0_AF0EM1_AMAS0_BL1_DTL0_DVO0_EPS0_FL0_GRVW4_GSU1_ISA908_IU1_KLA_LBSPP128_LPB4_LRVW2_MAC_NLCA1_NLCB1_ONLL1_PGR2_PLR17_SIA3_SU0_SUS256_SRVW2_SNLL0_TT1_32_TLDS1_USFGROn1_VSn1_VW1_WSGRA1_WSGRB1_WG64_4_1_WGM2
    SolutionIndex: 364
    SolutionNameMin: Cijk_Ailk_Bljk_SB_MT128x64x32_MI32x32x2x1_SE_1LDSB0_AF0EM1_AMAS0_BL1_DTL0_DVO0_EPS1_FL0_GRVW4_GSU1_ISA908_IU1_KLA_LBSPP128_LPB4_LRVW2_MAC_NLCA1_NLCB1_ONLL1_PGR1_PLR17_SIA3_SU0_SUS256_SRVW2_SNLL0_TT2_32_TLDS1_USFGROn1_VSn1_VW1_WSGRA1_WSGRB1_WG64_4_1_WGM1
    SolutionIndex: 365
    SolutionNameMin: Cijk_Ailk_Bljk_SB_MT64x64x16_SE_1LDSB0_AF0EM1_AMAS3_BL1_DTL0_DVO0_EPS1_FL0_GRVW4_GSU1_ISA908_IU1_KLA_LBSPP0_LPB0_LRVW4_MAC_NLCA1_NLCB1_ONLL1_PGR1_PLR1_SIA1_SU32_SUS256_SRVW0_SNLL0_TT4_4_TLDS0_USFGRO0_VS1_VW4_WSGRA0_WSGRB0_WG16_16_1_WGM8
    SolutionIndex: 366
    SolutionNameMin: Cijk_Ailk_Bljk_SB_MT64x64x32_MI32x32x2x1_SE_1LDSB0_AF0EM1_AMAS0_BL1_DTL0_DVO0_EPS0_FL0_GRVW4_GSU1_ISA908_IU1_KLA_LBSPP128_LPB4_LRVW2_MAC_NLCA1_NLCB1_ONLL1_PGR2_PLR17_SIA3_SU32_SUS128_SRVW2_SNLL0_TT1_32_TLDS1_USFGROn1_VSn1_VW1_WSGRA1_WSGRB1_WG64_4_1_WGM2
    SolutionIndex: 367
    SolutionNameMin: Cijk_Ailk_Bljk_SB_MT64x128x16_MI32x32x2x1_SN_1LDSB0_AF0EM1_AMAS0_BL1_DTL0_DVO0_EPS0_FL0_GRVW1_GSU1_ISA908_IU1_KLA_LBSPP128_LPB2_LRVW2_MAC_NLCA1_NLCB1_ONLL1_PGR2_PLR9_SIA3_SU32_SUS256_SRVW2_SNLL0_TT1_64_TLDS1_USFGROn1_VSn1_VW1_WSGRA1_WSGRB1_WG64_4_1_WGM2
    SolutionIndex: 368
    SolutionNameMin: Cijk_Ailk_Bljk_SB_MT144x128x16_MI16x16x4x1_SE_1LDSB1_AF0EM1_AMAS0_BL1_DTL0_DVO0_EPS0_FL0_GRVW1_GSU1_ISA908_IU1_KLA_LBSPP128_LPB2_LRVW2_MAC_NLCA9_NLCB1_ONLL1_PGR2_PLR5_SIA3_SU0_SUS256_SRVW0_SNLL0_TT9_32_TLDS1_USFGROn1_VSn1_VW1_WSGRA1_WSGRB1_WG16_16_1_WGM2
    SolutionIndex: 369
    SolutionNameMin: Cijk_Ailk_Bljk_SB_MT96x128x16_MI32x32x2x1_SE_1LDSB0_AF0EM4_AMAS3_BL1_DTL0_DVO0_EPS1_FL1_GRVW4_GSU1_ISA908_IU1_KLA_LBSPP0_LPB0_LRVW1_MAC_NLCA1_NLCB1_ONLL0_PGR1_PLR1_SIA3_SU32_SUS256_SRVW0_SNLL0_TT3_32_TLDS0_USFGROn1_VSn1_VW4_WSGRA0_WSGRB0_WG32_8_1_WGM1
    SolutionIndex: 370
    SolutionNameMin: Cijk_Ailk_Bljk_SB_MT64x32x32_SE_1LDSB0_AF0EM1_AMAS3_BL1_DTL0_DVO0_EPS1_FL1_GRVW4_GSU1_ISA908_IU1_KLA_LBSPP0_LPB4_LRVW4_MAC_NLCA1_NLCB1_ONLL1_PGR1_PLR1_SIA1_SU32_SUS256_SRVW0_SNLL1_TT4_4_TLDS0_USFGRO0_VS1_VW4_WSGRA0_WSGRB0_WG16_8_2_WGM8
    SolutionIndex: 371
    SolutionNameMin: Cijk_Ailk_Bljk_SB_MT96x128x32_MI32x32x2x1_SE_1LDSB0_AF0EM1_AMAS0_BL1_DTL0_DVO0_EPS1_FL0_GRVW4_GSU1_ISA908_IU1_KLA_LBSPP128_LPB4_LRVW2_MAC_NLCA3_NLCB1_ONLL1_PGR1_PLR17_SIA3_SU0_SUS256_SRVW0_SNLL0_TT3_32_TLDS1_USFGROn1_VSn1_VW1_WSGRA1_WSGRB1_WG32_8_1_WGM1
    SolutionIndex: 372
    SolutionNameMin: Cijk_Ailk_Bljk_SB_MT128x64x32_MI32x32x2x1_SE_1LDSB0_AF0EM1_AMAS0_BL1_DTL0_DVO0_EPS0_FL0_GRVW1_GSU1_ISA908_IU1_KLA_LBSPP128_LPB2_LRVW2_MAC_NLCA2_NLCB1_ONLL1_PGR2_PLR17_SIA3_SU0_SUS256_SRVW2_SNLL0_TT2_32_TLDS1_USFGROn1_VSn1_VW1_WSGRA1_WSGRB1_WG64_4_1_WGM15
    SolutionIndex: 373
    SolutionNameMin: Cijk_Ailk_Bljk_SB_MT128x96x16_MI32x32x2x1_SE_1LDSB0_AF0EM1_AMAS0_BL1_DTL0_DVO0_EPS1_FL0_GRVW2_GSU1_ISA908_IU1_KLA_LBSPP128_LPB2_LRVW2_MAC_NLCA1_NLCB1_ONLL1_PGR1_PLR9_SIA3_SU32_SUS256_SRVW2_SNLL0_TT1_96_TLDS1_USFGROn1_VSn1_VW1_WSGRA1_WSGRB1_WG128_2_1_WGM15
    SolutionIndex: 374
    SolutionNameMin: Cijk_Ailk_Bljk_SB_MT32x64x16_MI16x16x4x1_SE_1LDSB0_AF0EM1_AMAS0_BL1_DTL0_DVO0_EPS0_FL0_GRVW4_GSU1_ISA908_IU1_KLA_LBSPP128_LPB4_LRVW2_MAC_NLCA1_NLCB1_ONLL1_PGR2_PLR5_SIA3_SU32_SUS128_SRVW2_SNLL0_TT1_32_TLDS1_USFGROn1_VSn1_VW1_WSGRA1_WSGRB1_WG32_8_1_WGM1
    SolutionIndex: 375
    SolutionNameMin: Cijk_Ailk_Bljk_SB_MT144x128x16_MI16x16x4x1_SE_1LDSB0_AF0EM1_AMAS0_BL1_DTL0_DVO0_EPS1_FL0_GRVW1_GSU1_ISA908_IU1_KLA_LBSPP128_LPB2_LRVW2_MAC_NLCA9_NLCB1_ONLL1_PGR1_PLR5_SIA3_SU0_SUS256_SRVW0_SNLL0_TT9_32_TLDS1_USFGROn1_VSn1_VW1_WSGRA1_WSGRB1_WG16_16_1_WGM1
    SolutionIndex: 376
    SolutionNameMin: Cijk_Ailk_Bljk_SB_MT64x128x32_MI32x32x2x1_SE_1LDSB0_AF0EM1_AMAS0_BL1_DTL0_DVO0_EPS1_FL0_GRVW4_GSU1_ISA908_IU1_KLA_LBSPP128_LPB4_LRVW2_MAC_NLCA1_NLCB1_ONLL1_PGR1_PLR17_SIA3_SU32_SUS128_SRVW2_SNLL0_TT1_64_TLDS1_USFGROn1_VSn1_VW1_WSGRA1_WSGRB1_WG64_4_1_WGM15
    SolutionIndex: 377
    SolutionNameMin: Cijk_Ailk_Bljk_SB_MT128x128x16_MI32x32x2x1_SE_1LDSB0_AF0EM1_AMAS3_BL1_DTL0_DVO0_EPS1_FL1_GRVW2_GSU1_ISA908_IU1_KLA_LBSPP0_LPB0_LRVW1_MAC_NLCA1_NLCB1_ONLL1_PGR1_PLR1_SIA3_SU32_SUS256_SRVW0_SNLL0_TT4_32_TLDS1_USFGROn1_VSn1_VW2_WSGRA0_WSGRB0_WG16_16_1_WGM8
    SolutionIndex: 378
    SolutionNameMin: Cijk_Ailk_Bljk_SB_MT128x96x16_MI32x32x2x1_SE_1LDSB0_AF0EM1_AMAS0_BL1_DTL0_DVO0_EPS0_FL0_GRVW1_GSU1_ISA908_IU1_KLA_LBSPP128_LPB2_LRVW2_MAC_NLCA2_NLCB1_ONLL1_PGR2_PLR9_SIA3_SU32_SUS256_SRVW2_SNLL0_TT1_96_TLDS1_USFGROn1_VSn1_VW1_WSGRA1_WSGRB1_WG128_2_1_WGM15
    SolutionIndex: 379
    SolutionNameMin: Cijk_Ailk_Bljk_SB_MT96x96x16_MI16x16x4x1_SE_1LDSB1_AF0EM1_AMAS0_BL1_DTL0_DVO0_EPS1_FL0_GRVW2_GSU1_ISA908_IU1_KLA_LBSPP128_LPB2_LRVW2_MAC_NLCA3_NLCB1_ONLL1_PGR1_PLR5_SIA3_SU32_SUS128_SRVW0_SNLL0_TT3_48_TLDS1_USFGROn1_VSn1_VW1_WSGRA1_WSGRB1_WG32_8_1_WGM1
    SolutionIndex: 380
    SolutionNameMin: Cijk_Ailk_Bljk_SB_MT128x128x16_MI32x32x2x1_SE_1LDSB1_AF0EM1_AMAS0_BL1_DTL0_DVO0_EPS1_FL0_GRVW4_GSU1_ISA908_IU1_KLA_LBSPP128_LPB4_LRVW2_MAC_NLCA1_NLCB1_ONLL1_PGR1_PLR9_SIA3_SU32_SUS256_SRVW2_SNLL0_TT2_64_TLDS1_USFGROn1_VSn1_VW1_WSGRA1_WSGRB1_WG64_4_1_WGM15
    SolutionIndex: 381
    SolutionNameMin: Cijk_Ailk_Bljk_SB_MT64x64x32_MI16x16x4x1_SE_1LDSB0_AF0EM4_AMAS3_BL1_DTL0_DVO1_EPS1_FL1_GRVW4_GSU1_ISA908_IU1_KLA_LBSPP0_LPB0_LRVW1_MAC_NLCA1_NLCB1_ONLL0_PGR1_PLR1_SIA3_SU32_SUS256_SRVW4_SNLL0_TT4_16_TLDS1_USFGROn1_VSn1_VW4_WSGRA0_WSGRB0_WG16_16_1_WGM1
    SolutionIndex: 382
    SolutionNameMin: Cijk_Ailk_Bljk_SB_MT64x16x8_SE_1LDSB0_AF0EM1_AMAS3_BL1_DTL0_DVO0_EPS1_FL0_GRVW2_GSU1_ISA908_IU1_KLA_LBSPP0_LPB2_LRVW2_MAC_NLCA1_NLCB1_ONLL1_PGR1_PLR1_SIA1_SU32_SUS256_SRVW0_SNLL0_TT4_2_TLDS0_USFGRO0_VS1_VW2_WSGRA0_WSGRB0_WG16_8_1_WGM1
    SolutionIndex: 383
    SolutionNameMin: Cijk_Ailk_Bljk_SB_MT64x128x32_MI32x32x2x1_SE_1LDSB0_AF0EM1_AMAS0_BL1_DTL0_DVO0_EPS0_FL0_GRVW4_GSU1_ISA908_IU1_KLA_LBSPP128_LPB4_LRVW2_MAC_NLCA1_NLCB1_ONLL1_PGR2_PLR17_SIA3_SU32_SUS128_SRVW2_SNLL0_TT1_64_TLDS1_USFGROn1_VSn1_VW1_WSGRA1_WSGRB1_WG64_4_1_WGM2
    SolutionIndex: 384
    SolutionNameMin: Cijk_Ailk_Bljk_SB_MT128x64x32_MI32x32x2x1_SE_1LDSB0_AF0EM1_AMAS0_BL1_DTL0_DVO0_EPS0_FL0_GRVW4_GSU1_ISA908_IU1_KLA_LBSPP128_LPB4_LRVW2_MAC_NLCA1_NLCB1_ONLL1_PGR2_PLR17_SIA3_SU32_SUS128_SRVW2_SNLL0_TT2_32_TLDS1_USFGROn1_VSn1_VW1_WSGRA1_WSGRB1_WG64_4_1_WGM15
    SolutionIndex: 385
    SolutionNameMin: Cijk_Ailk_Bljk_SB_MT128x128x16_MI32x32x2x1_SE_1LDSB0_AF0EM1_AMAS0_BL1_DTL0_DVO0_EPS1_FL0_GRVW4_GSU1_ISA908_IU1_KLA_LBSPP128_LPB4_LRVW2_MAC_NLCA1_NLCB1_ONLL1_PGR1_PLR9_SIA3_SU0_SUS256_SRVW2_SNLL0_TT2_64_TLDS1_USFGROn1_VSn1_VW1_WSGRA1_WSGRB1_WG64_4_1_WGM15
    SolutionIndex: 386
    SolutionNameMin: Cijk_Ailk_Bljk_SB_MT64x128x32_MI32x32x2x1_SE_1LDSB0_AF0EM1_AMAS0_BL1_DTL0_DVO0_EPS1_FL0_GRVW4_GSU1_ISA908_IU1_KLA_LBSPP128_LPB4_LRVW2_MAC_NLCA1_NLCB1_ONLL1_PGR1_PLR17_SIA3_SU32_SUS256_SRVW2_SNLL0_TT1_64_TLDS1_USFGROn1_VSn1_VW1_WSGRA1_WSGRB1_WG64_4_1_WGM2
    SolutionIndex: 387
    SolutionNameMin: Cijk_Ailk_Bljk_SB_MT64x128x32_MI32x32x2x1_SE_1LDSB0_AF0EM1_AMAS0_BL1_DTL0_DVO0_EPS0_FL0_GRVW4_GSU1_ISA908_IU1_KLA_LBSPP128_LPB4_LRVW2_MAC_NLCA1_NLCB1_ONLL1_PGR2_PLR17_SIA3_SU32_SUS256_SRVW2_SNLL0_TT1_64_TLDS1_USFGROn1_VSn1_VW1_WSGRA1_WSGRB1_WG64_4_1_WGM2
    SolutionIndex: 388
    SolutionNameMin: Cijk_Ailk_Bljk_SB_MT64x64x8_SE_1LDSB0_AF0EM1_AMAS3_BL1_DTL0_DVO0_EPS1_FL0_GRVW4_GSU1_ISA908_IU1_KLA_LBSPP0_LPB0_LRVW2_MAC_NLCA1_NLCB1_ONLL1_PGR1_PLR1_SIA1_SU32_SUS256_SRVW0_SNLL0_TT4_4_TLDS0_USFGRO0_VS1_VW2_WSGRA0_WSGRB0_WG16_16_1_WGM8
    SolutionIndex: 389
    SolutionNameMin: Cijk_Ailk_Bljk_SB_MT128x128x16_MI32x32x2x1_SE_1LDSB1_AF0EM1_AMAS0_BL1_DTL0_DVO0_EPS1_FL0_GRVW4_GSU1_ISA908_IU1_KLA_LBSPP128_LPB4_LRVW2_MAC_NLCA1_NLCB1_ONLL1_PGR1_PLR9_SIA3_SU0_SUS256_SRVW2_SNLL0_TT2_64_TLDS1_USFGROn1_VSn1_VW1_WSGRA1_WSGRB1_WG64_4_1_WGM2
    SolutionIndex: 390
    SolutionNameMin: Cijk_Ailk_Bljk_SB_MT64x32x16_MI16x16x4x1_SE_1LDSB0_AF0EM1_AMAS0_BL1_DTL0_DVO0_EPS1_FL0_GRVW1_GSU1_ISA908_IU1_KLA_LBSPP128_LPB2_LRVW2_MAC_NLCA1_NLCB1_ONLL1_PGR1_PLR5_SIA3_SU32_SUS256_SRVW2_SNLL0_TT2_16_TLDS1_USFGROn1_VSn1_VW1_WSGRA1_WSGRB1_WG32_8_1_WGM1
    SolutionIndex: 391
    SolutionNameMin: Cijk_Ailk_Bljk_SB_MT64x16x8_SE_1LDSB0_AF0EM1_AMAS3_BL1_DTL0_DVO0_EPS0_FL0_GRVW1_GSU1_ISA908_IU1_KLA_LBSPP0_LPB2_LRVW2_MAC_NLCA1_NLCB1_ONLL1_PGR0_PLR1_SIA1_SU32_SUS256_SRVW0_SNLL0_TT4_2_TLDS0_USFGRO1_VS1_VW2_WSGRA0_WSGRB0_WG16_8_1_WGM1
    SolutionIndex: 392
    SolutionNameMin: Cijk_Ailk_Bljk_SB_MT32x64x16_MI16x16x4x1_SE_1LDSB0_AF0EM1_AMAS0_BL1_DTL0_DVO0_EPS0_FL0_GRVW1_GSU1_ISA908_IU1_KLA_LBSPP128_LPB2_LRVW2_MAC_NLCA1_NLCB1_ONLL1_PGR2_PLR5_SIA3_SU0_SUS256_SRVW2_SNLL0_TT1_32_TLDS1_USFGROn1_VSn1_VW1_WSGRA1_WSGRB1_WG32_8_1_WGM1
    SolutionIndex: 393
    SolutionNameMin: Cijk_Ailk_Bljk_SB_MT128x144x16_MI16x16x4x1_SE_1LDSB0_AF0EM1_AMAS0_BL1_DTL0_DVO0_EPS1_FL0_GRVW1_GSU1_ISA908_IU1_KLA_LBSPP128_LPB2_LRVW2_MAC_NLCA2_NLCB1_ONLL1_PGR1_PLR5_SIA3_SU0_SUS256_SRVW2_SNLL0_TT2_144_TLDS1_USFGROn1_VSn1_VW1_WSGRA1_WSGRB1_WG64_4_1_WGM15
    SolutionIndex: 394
    SolutionNameMin: Cijk_Ailk_Bljk_SB_MT64x64x8_SE_1LDSB0_AF0EM1_AMAS3_BL1_DTL0_DVO0_EPS1_FL1_GRVW2_GSU1_ISA908_IU1_KLA_LBSPP0_LPB0_LRVW2_MAC_NLCA1_NLCB1_ONLL1_PGR1_PLR1_SIA1_SU32_SUS256_SRVW0_SNLL1_TT4_4_TLDS0_USFGRO0_VS1_VW2_WSGRA0_WSGRB0_WG16_16_1_WGM1
    SolutionIndex: 395
    SolutionNameMin: Cijk_Ailk_Bljk_SB_MT128x96x32_MI32x32x2x1_SE_1LDSB0_AF0EM1_AMAS0_BL1_DTL0_DVO0_EPS0_FL0_GRVW1_GSU1_ISA908_IU1_KLA_LBSPP128_LPB2_LRVW2_MAC_NLCA2_NLCB1_ONLL1_PGR2_PLR17_SIA3_SU32_SUS256_SRVW2_SNLL0_TT1_96_TLDS1_USFGROn1_VSn1_VW1_WSGRA1_WSGRB1_WG128_2_1_WGM15
    SolutionIndex: 396
    SolutionNameMin: Cijk_Ailk_Bljk_SB_MT64x128x16_MI32x32x2x1_SE_1LDSB0_AF0EM1_AMAS0_BL1_DTL0_DVO0_EPS1_FL0_GRVW4_GSU1_ISA908_IU1_KLA_LBSPP128_LPB4_LRVW2_MAC_NLCA1_NLCB1_ONLL1_PGR1_PLR9_SIA3_SU0_SUS256_SRVW2_SNLL0_TT1_64_TLDS1_USFGROn1_VSn1_VW1_WSGRA1_WSGRB1_WG64_4_1_WGM1
    SolutionIndex: 397
    SolutionNameMin: Cijk_Ailk_Bljk_SB_MT128x96x32_MI32x32x2x1_SE_1LDSB0_AF0EM1_AMAS0_BL1_DTL0_DVO0_EPS0_FL0_GRVW4_GSU1_ISA908_IU1_KLA_LBSPP128_LPB4_LRVW2_MAC_NLCA1_NLCB1_ONLL1_PGR2_PLR17_SIA3_SU0_SUS256_SRVW2_SNLL0_TT1_96_TLDS1_USFGROn1_VSn1_VW1_WSGRA1_WSGRB1_WG128_2_1_WGM15
    SolutionIndex: 398
    SolutionNameMin: Cijk_Ailk_Bljk_SB_MT128x128x16_MI32x32x2x1_SE_1LDSB0_AF0EM1_AMAS0_BL1_DTL0_DVO0_EPS0_FL0_GRVW2_GSU1_ISA908_IU1_KLA_LBSPP128_LPB2_LRVW2_MAC_NLCA1_NLCB1_ONLL1_PGR2_PLR9_SIA3_SU32_SUS256_SRVW2_SNLL0_TT2_64_TLDS1_USFGROn1_VSn1_VW1_WSGRA1_WSGRB1_WG64_4_1_WGM15
    SolutionIndex: 399
    SolutionNameMin: Cijk_Ailk_Bljk_SB_MT64x16x8_SE_1LDSB0_AF0EM1_AMAS0_BL1_DTL0_DVO0_EPS0_FL0_GRVW1_GSU1_ISA908_IU1_KLA_LBSPP0_LPB1_LRVW1_MAC_NLCA1_NLCB1_ONLL1_PGR0_PLR0_SIA1_SU32_SUS256_SRVW0_SNLL0_TT4_2_TLDS0_USFGRO1_VS1_VW1_WSGRA0_WSGRB0_WG16_8_1_WGM1
    SolutionIndex: 400
    SolutionNameMin: Cijk_Ailk_Bljk_SB_MT128x128x16_MI32x32x2x1_SE_1LDSB1_AF0EM1_AMAS0_BL1_DTL0_DVO0_EPS1_FL0_GRVW4_GSU1_ISA908_IU1_KLA_LBSPP128_LPB4_LRVW2_MAC_NLCA1_NLCB1_ONLL1_PGR1_PLR9_SIA3_SU32_SUS256_SRVW2_SNLL0_TT2_64_TLDS1_USFGROn1_VSn1_VW1_WSGRA1_WSGRB1_WG64_4_1_WGM2
    SolutionIndex: 401
    SolutionNameMin: Cijk_Ailk_Bljk_SB_MT128x128x16_MI32x32x2x1_SE_1LDSB0_AF0EM1_AMAS0_BL1_DTL0_DVO0_EPS0_FL0_GRVW4_GSU1_ISA908_IU1_KLA_LBSPP128_LPB4_LRVW2_MAC_NLCA1_NLCB1_ONLL1_PGR2_PLR9_SIA3_SU0_SUS256_SRVW2_SNLL0_TT2_64_TLDS1_USFGROn1_VSn1_VW1_WSGRA1_WSGRB1_WG64_4_1_WGM15
    SolutionIndex: 402
    SolutionNameMin: Cijk_Ailk_Bljk_SB_MT64x16x16_SE_1LDSB0_AF0EM1_AMAS0_BL1_DTL0_DVO0_EPS0_FL0_GRVW1_GSU1_ISA908_IU1_KLA_LBSPP0_LPB1_LRVW1_MAC_NLCA1_NLCB1_ONLL1_PGR0_PLR1_SIA1_SU32_SUS256_SRVW0_SNLL0_TT4_2_TLDS0_USFGRO1_VS1_VW1_WSGRA0_WSGRB0_WG16_8_1_WGM8
    SolutionIndex: 403
    SolutionNameMin: Cijk_Ailk_Bljk_SB_MT128x96x32_MI32x32x2x1_SE_1LDSB0_AF0EM1_AMAS0_BL1_DTL0_DVO0_EPS1_FL0_GRVW4_GSU1_ISA908_IU1_KLA_LBSPP128_LPB4_LRVW2_MAC_NLCA1_NLCB1_ONLL1_PGR1_PLR17_SIA3_SU0_SUS256_SRVW2_SNLL0_TT1_96_TLDS1_USFGROn1_VSn1_VW1_WSGRA1_WSGRB1_WG128_2_1_WGM2
    SolutionIndex: 404
    SolutionNameMin: Cijk_Ailk_Bljk_SB_MT96x96x16_MI16x16x4x1_SE_1LDSB0_AF0EM1_AMAS0_BL1_DTL0_DVO0_EPS0_FL0_GRVW1_GSU1_ISA908_IU1_KLA_LBSPP128_LPB2_LRVW2_MAC_NLCA3_NLCB1_ONLL1_PGR2_PLR5_SIA3_SU0_SUS256_SRVW0_SNLL0_TT3_48_TLDS1_USFGROn1_VSn1_VW1_WSGRA1_WSGRB1_WG32_8_1_WGM1
    SolutionIndex: 405
    SolutionNameMin: Cijk_Ailk_Bljk_SB_MT128x144x16_MI16x16x4x1_SE_1LDSB1_AF0EM1_AMAS0_BL1_DTL0_DVO0_EPS0_FL0_GRVW1_GSU1_ISA908_IU1_KLA_LBSPP128_LPB2_LRVW2_MAC_NLCA2_NLCB1_ONLL1_PGR2_PLR5_SIA3_SU32_SUS256_SRVW2_SNLL0_TT2_144_TLDS1_USFGROn1_VSn1_VW1_WSGRA1_WSGRB1_WG64_4_1_WGM2
    SolutionIndex: 406
    SolutionNameMin: Cijk_Ailk_Bljk_SB_MT128x64x32_MI32x32x2x1_SE_1LDSB0_AF0EM1_AMAS0_BL1_DTL0_DVO0_EPS0_FL0_GRVW1_GSU1_ISA908_IU1_KLA_LBSPP128_LPB2_LRVW2_MAC_NLCA2_NLCB1_ONLL1_PGR2_PLR17_SIA3_SU0_SUS256_SRVW2_SNLL0_TT2_32_TLDS1_USFGROn1_VSn1_VW1_WSGRA1_WSGRB1_WG64_4_1_WGM1
    SolutionIndex: 407
    SolutionNameMin: Cijk_Ailk_Bljk_SB_MT64x128x16_MI32x32x2x1_SE_1LDSB0_AF0EM1_AMAS0_BL1_DTL0_DVO0_EPS1_FL0_GRVW4_GSU1_ISA908_IU1_KLA_LBSPP128_LPB4_LRVW2_MAC_NLCA1_NLCB1_ONLL1_PGR1_PLR9_SIA3_SU32_SUS128_SRVW2_SNLL0_TT1_64_TLDS1_USFGROn1_VSn1_VW1_WSGRA1_WSGRB1_WG64_4_1_WGM2
    SolutionIndex: 408
    SolutionNameMin: Cijk_Ailk_Bljk_SB_MT64x32x16_MI16x16x4x1_SE_1LDSB0_AF0EM1_AMAS0_BL1_DTL0_DVO0_EPS1_FL0_GRVW1_GSU1_ISA908_IU1_KLA_LBSPP128_LPB2_LRVW2_MAC_NLCA1_NLCB1_ONLL1_PGR1_PLR5_SIA3_SU0_SUS256_SRVW2_SNLL0_TT2_16_TLDS1_USFGROn1_VSn1_VW1_WSGRA1_WSGRB1_WG32_8_1_WGM1
    SolutionIndex: 409
    SolutionNameMin: Cijk_Ailk_Bljk_SB_MT64x16x8_SE_1LDSB0_AF0EM1_AMAS0_BL1_DTL0_DVO0_EPS0_FL0_GRVW1_GSU1_ISA908_IU1_KLA_LBSPP0_LPB0_LRVW1_MAC_NLCA1_NLCB1_ONLL1_PGR0_PLR1_SIA1_SU32_SUS256_SRVW0_SNLL0_TT4_2_TLDS0_USFGRO1_VS1_VW1_WSGRA0_WSGRB0_WG16_8_1_WGM8
    SolutionIndex: 410
    SolutionNameMin: Cijk_Ailk_Bljk_SB_MT64x32x16_SE_1LDSB0_AF0EM1_AMAS3_BL1_DTL0_DVO0_EPS0_FL0_GRVW1_GSU1_ISA908_IU1_KLA_LBSPP0_LPB2_LRVW2_MAC_NLCA1_NLCB1_ONLL1_PGR0_PLR1_SIA1_SU32_SUS256_SRVW0_SNLL0_TT4_2_TLDS0_USFGRO1_VS1_VW2_WSGRA0_WSGRB0_WG16_16_1_WGM1
    SolutionIndex: 411
    SolutionNameMin: Cijk_Ailk_Bljk_SB_MT64x32x8_SE_1LDSB0_AF0EM1_AMAS0_BL1_DTL0_DVO0_EPS0_FL0_GRVW1_GSU1_ISA908_IU1_KLA_LBSPP0_LPB1_LRVW1_MAC_NLCA1_NLCB1_ONLL1_PGR0_PLR1_SIA1_SU32_SUS256_SRVW0_SNLL0_TT4_4_TLDS0_USFGRO1_VS1_VW1_WSGRA0_WSGRB0_WG16_8_1_WGM1
    SolutionIndex: 412
    SolutionNameMin: Cijk_Ailk_Bljk_SB_MT64x64x8_SE_1LDSB0_AF0EM1_AMAS3_BL1_DTL0_DVO0_EPS1_FL1_GRVW2_GSU1_ISA908_IU1_KLA_LBSPP0_LPB2_LRVW2_MAC_NLCA1_NLCB1_ONLL1_PGR1_PLR1_SIA1_SU32_SUS256_SRVW0_SNLL1_TT4_4_TLDS0_USFGRO0_VS1_VW2_WSGRA0_WSGRB0_WG16_16_1_WGM1
    SolutionIndex: 413
    SolutionNameMin: Cijk_Ailk_Bljk_SB_MT64x128x16_MI32x32x2x1_SE_1LDSB0_AF0EM1_AMAS0_BL1_DTL0_DVO0_EPS0_FL0_GRVW1_GSU1_ISA908_IU1_KLA_LBSPP128_LPB2_LRVW2_MAC_NLCA1_NLCB1_ONLL1_PGR2_PLR9_SIA3_SU32_SUS256_SRVW2_SNLL0_TT1_64_TLDS1_USFGROn1_VSn1_VW1_WSGRA1_WSGRB1_WG64_4_1_WGM1
    SolutionIndex: 414
    SolutionNameMin: Cijk_Ailk_Bljk_SB_MT96x96x16_MI16x16x4x1_SE_1LDSB1_AF0EM1_AMAS0_BL1_DTL0_DVO0_EPS0_FL0_GRVW2_GSU1_ISA908_IU1_KLA_LBSPP128_LPB2_LRVW2_MAC_NLCA3_NLCB1_ONLL1_PGR2_PLR5_SIA3_SU32_SUS256_SRVW0_SNLL0_TT3_48_TLDS1_USFGROn1_VSn1_VW1_WSGRA1_WSGRB1_WG32_8_1_WGM15
    SolutionIndex: 415
    SolutionNameMin: Cijk_Ailk_Bljk_SB_MT128x144x16_MI16x16x4x1_SE_1LDSB1_AF0EM1_AMAS0_BL1_DTL0_DVO0_EPS0_FL0_GRVW1_GSU1_ISA908_IU1_KLA_LBSPP128_LPB2_LRVW2_MAC_NLCA2_NLCB1_ONLL1_PGR2_PLR5_SIA3_SU32_SUS256_SRVW2_SNLL0_TT2_144_TLDS1_USFGROn1_VSn1_VW1_WSGRA1_WSGRB1_WG64_4_1_WGM1
    SolutionIndex: 416
    SolutionNameMin: Cijk_Ailk_Bljk_SB_MT64x32x16_SE_1LDSB0_AF0EM1_AMAS3_BL1_DTL0_DVO0_EPS0_FL0_GRVW1_GSU1_ISA908_IU1_KLA_LBSPP0_LPB4_LRVW4_MAC_NLCA1_NLCB1_ONLL1_PGR0_PLR1_SIA1_SU32_SUS256_SRVW0_SNLL0_TT4_4_TLDS0_USFGRO1_VS1_VW4_WSGRA0_WSGRB0_WG16_8_1_WGM1
    SolutionIndex: 417
    SolutionNameMin: Cijk_Ailk_Bljk_SB_MT64x16x8_SE_1LDSB0_AF0EM1_AMAS3_BL1_DTL0_DVO0_EPS0_FL0_GRVW2_GSU1_ISA908_IU1_KLA_LBSPP0_LPB0_LRVW2_MAC_NLCA1_NLCB1_ONLL1_PGR0_PLR1_SIA1_SU32_SUS256_SRVW0_SNLL0_TT4_2_TLDS0_USFGRO0_VS1_VW2_WSGRA0_WSGRB0_WG16_8_1_WGM1
    SolutionIndex: 418
    SolutionNameMin: Cijk_Ailk_Bljk_SB_MT64x32x16_MI16x16x4x1_SE_1LDSB0_AF0EM1_AMAS0_BL1_DTL0_DVO0_EPS0_FL0_GRVW1_GSU1_ISA908_IU1_KLA_LBSPP128_LPB2_LRVW2_MAC_NLCA1_NLCB1_ONLL1_PGR2_PLR5_SIA3_SU32_SUS256_SRVW2_SNLL0_TT2_16_TLDS1_USFGROn1_VSn1_VW1_WSGRA1_WSGRB1_WG32_8_1_WGM2
    SolutionIndex: 419
    SolutionNameMin: Cijk_Ailk_Bljk_SB_MT64x192x16_MI32x32x2x1_SE_1LDSB0_AF0EM1_AMAS0_BL1_DTL0_DVO0_EPS0_FL0_GRVW4_GSU1_ISA908_IU1_KLA_LBSPP128_LPB4_LRVW2_MAC_NLCA1_NLCB1_ONLL1_PGR2_PLR9_SIA3_SU32_SUS128_SRVW2_SNLL0_TT1_96_TLDS1_USFGROn1_VSn1_VW1_WSGRA1_WSGRB1_WG64_4_1_WGM2
    SolutionIndex: 420
    SolutionNameMin: Cijk_Ailk_Bljk_SB_MT64x16x8_SE_1LDSB0_AF0EM1_AMAS0_BL1_DTL0_DVO0_EPS0_FL0_GRVW1_GSU1_ISA908_IU1_KLA_LBSPP0_LPB1_LRVW1_MAC_NLCA1_NLCB1_ONLL1_PGR0_PLR1_SIA1_SU32_SUS256_SRVW0_SNLL0_TT4_2_TLDS0_USFGRO1_VS1_VW1_WSGRA0_WSGRB0_WG16_8_1_WGM8
    SolutionIndex: 421
    SolutionNameMin: Cijk_Ailk_Bljk_SB_MT128x144x16_MI16x16x4x1_SE_1LDSB0_AF0EM1_AMAS0_BL1_DTL0_DVO0_EPS1_FL0_GRVW1_GSU1_ISA908_IU1_KLA_LBSPP128_LPB2_LRVW2_MAC_NLCA2_NLCB1_ONLL1_PGR1_PLR5_SIA3_SU0_SUS256_SRVW2_SNLL0_TT2_144_TLDS1_USFGROn1_VSn1_VW1_WSGRA1_WSGRB1_WG64_4_1_WGM2
    SolutionIndex: 422
    SolutionNameMin: Cijk_Ailk_Bljk_SB_MT128x16x16_MI16x16x4x1_SE_1LDSB0_AF0EM1_AMAS3_BL1_DTL0_DVO0_EPS1_FL0_GRVW1_GSU1_ISA908_IU1_KLA_LBSPP0_LPB0_LRVW1_MAC_NLCA2_NLCB1_ONLL1_PGR1_PLR1_SIA3_SU32_SUS256_SRVW0_SNLL0_TT2_16_TLDS1_USFGROn1_VSn1_VW4_WSGRA1_WSGRB1_WG64_4_1_WGM8
    SolutionIndex: 423
    SolutionNameMin: Cijk_Ailk_Bljk_SB_MT64x16x16_SN_1LDSB0_AF0EM1_AMAS2_BL0_DTL0_DVO0_EPS0_FL0_GRVW2_GSU1_ISA000_IU1_KLS_LBSPP0_LPB0_LRVW2_FMA_NLCA1_NLCB1_ONLL1_PGR1_PLR1_SIA1_SU32_SUS256_SRVW0_SNLL0_TT4_2_TLDS0_USFGRO0_VS1_VW2_WSGRA0_WSGRB0_WG16_8_1_WGM1
    SolutionIndex: 424
    SolutionNameMin: Cijk_Ailk_Bljk_SB_MT32x64x32_MI16x16x4x1_SE_1LDSB0_AF0EM1_AMAS0_BL1_DTL0_DVO0_EPS0_FL0_GRVW2_GSU1_ISA908_IU1_KLA_LBSPP128_LPB2_LRVW2_MAC_NLCA1_NLCB1_ONLL1_PGR2_PLR9_SIA3_SU0_SUS256_SRVW2_SNLL0_TT1_32_TLDS1_USFGROn1_VSn1_VW1_WSGRA1_WSGRB1_WG32_8_1_WGM15
    SolutionIndex: 425
    SolutionNameMin: Cijk_Ailk_Bljk_SB_MT64x4x16_MI4x4x1x16_SE_1LDSB0_AF0EM1_AMAS0_BL1_DTL0_DVO0_EPS1_FL0_GRVW1_GSU1_ISA908_IU1_KLA_LBSPP128_LPB2_LRVW2_MAC_NLCA1_NLCB1_ONLL1_PGR1_PLR17_SIA3_SU0_SUS256_SRVW0_SNLL0_TT1_4_TLDS1_USFGROn1_VSn1_VW1_WSGRA1_WSGRB1_WG64_1_1_WGM1
    SolutionIndex: 426
    SolutionNameMin: Cijk_Ailk_Bljk_SB_MT16x16x16_SE_1LDSB0_AF0EM1_AMAS3_BL1_DTL0_DVO0_EPS0_FL1_GRVW2_GSU1_ISA908_IU1_KLA_LBSPP0_LPB0_LRVW2_MAC_NLCA1_NLCB1_ONLL1_PGR0_PLR0_SIA1_SU32_SUS256_SRVW0_SNLL0_TT2_2_TLDS0_USFGRO0_VS1_VW2_WSGRA0_WSGRB0_WG8_8_2_WGM1
    SolutionIndex: 427
    SolutionNameMin: Cijk_Ailk_Bljk_SB_MT32x16x32_SE_1LDSB0_AF0EM1_AMAS3_BL1_DTL0_DVO0_EPS1_FL1_GRVW2_GSU4_ISA908_IU1_KLA_LBSPP0_LPB2_LRVW2_MAC_NLCA1_NLCB1_ONLL1_PGR1_PLR1_SIA1_SU32_SUS256_SRVW0_SNLL0_TT4_2_TLDS0_USFGRO0_VS1_VW2_WSGRA0_WSGRB0_WG8_8_4_WGM8
    SolutionIndex: 428
    SolutionNameMin: Cijk_Ailk_Bljk_SB_MT16x16x32_SE_1LDSB0_AF0EM1_AMAS3_BL1_DTL0_DVO0_EPS1_FL1_GRVW2_GSU4_ISA908_IU1_KLA_LBSPP0_LPB2_LRVW2_MAC_NLCA1_NLCB1_ONLL1_PGR1_PLR1_SIA1_SU32_SUS256_SRVW0_SNLL0_TT2_4_TLDS0_USFGRO0_VS1_VW2_WSGRA0_WSGRB0_WG8_4_8_WGM8
    SolutionIndex: 429
    SolutionNameMin: Cijk_Ailk_Bljk_SB_MT32x16x32_SE_1LDSB0_AF0EM1_AMAS3_BL1_DTL0_DVO0_EPS1_FL0_GRVW2_GSU1_ISA908_IU1_KLA_LBSPP0_LPB2_LRVW2_MAC_NLCA1_NLCB1_ONLL1_PGR1_PLR1_SIA1_SU32_SUS256_SRVW0_SNLL0_TT2_4_TLDS0_USFGRO0_VS1_VW2_WSGRA0_WSGRB0_WG16_4_4_WGM8
    SolutionIndex: 430
    SolutionNameMin: Cijk_Ailk_Bljk_SB_MT16x64x32_MI16x16x4x1_SE_1LDSB0_AF0EM1_AMAS0_BL1_DTL0_DVO0_EPS1_FL0_GRVW1_GSU1_ISA908_IU1_KLA_LBSPP128_LPB2_LRVW2_MAC_NLCA1_NLCB1_ONLL1_PGR1_PLR9_SIA3_SU0_SUS256_SRVW0_SNLL0_TT1_16_TLDS1_USFGROn1_VSn1_VW1_WSGRA1_WSGRB1_WG16_16_1_WGM1
    SolutionIndex: 431
    SolutionNameMin: Cijk_Ailk_Bljk_SB_MT32x16x32_SE_1LDSB0_AF0EM1_AMAS3_BL1_DTL0_DVO0_EPS1_FL1_GRVW2_GSU1_ISA908_IU1_KLA_LBSPP0_LPB2_LRVW2_MAC_NLCA1_NLCB1_ONLL1_PGR1_PLR1_SIA1_SU32_SUS256_SRVW0_SNLL1_TT4_2_TLDS0_USFGRO0_VS1_VW2_WSGRA0_WSGRB0_WG8_8_4_WGM1
    SolutionIndex: 432
    SolutionNameMin: Cijk_Ailk_Bljk_SB_MT16x16x32_SE_1LDSB0_AF0EM1_AMAS3_BL1_DTL0_DVO0_EPS1_FL1_GRVW2_GSU4_ISA908_IU1_KLA_LBSPP0_LPB2_LRVW2_MAC_NLCA1_NLCB1_ONLL1_PGR1_PLR1_SIA1_SU32_SUS256_SRVW0_SNLL0_TT2_2_TLDS0_USFGRO0_VS1_VW2_WSGRA0_WSGRB0_WG8_8_4_WGM1
    SolutionIndex: 433
    SolutionNameMin: Cijk_Ailk_Bljk_SB_MT64x4x16_MI4x4x1x16_SE_1LDSB0_AF0EM1_AMAS0_BL1_DTL0_DVO0_EPS1_FL0_GRVW4_GSU1_ISA908_IU1_KLA_LBSPP128_LPB4_LRVW2_MAC_NLCA1_NLCB1_ONLL1_PGR1_PLR17_SIA3_SU0_SUS256_SRVW2_SNLL0_TT1_4_TLDS1_USFGROn1_VSn1_VW1_WSGRA1_WSGRB1_WG64_1_1_WGM1
    SolutionIndex: 434
    SolutionNameMin: Cijk_Ailk_Bljk_SB_MT16x64x32_MI16x16x4x1_SE_1LDSB0_AF0EM1_AMAS0_BL1_DTL0_DVO0_EPS1_FL0_GRVW1_GSU5_ISA908_IU1_KLA_LBSPP128_LPB2_LRVW2_MAC_NLCA1_NLCB1_ONLL1_PGR1_PLR9_SIA3_SU0_SUS256_SRVW0_SNLL0_TT1_16_TLDS1_USFGROn1_VSn1_VW1_WSGRA1_WSGRB1_WG16_16_1_WGM1
    SolutionIndex: 435
    SolutionNameMin: Cijk_Ailk_Bljk_SB_MT32x32x8_SE_1LDSB0_AF0EM1_AMAS3_BL1_DTL0_DVO0_EPS0_FL1_GRVW2_GSU1_ISA908_IU1_KLA_LBSPP0_LPB0_LRVW2_MAC_NLCA1_NLCB1_ONLL1_PGR0_PLR1_SIA1_SU32_SUS256_SRVW0_SNLL0_TT2_2_TLDS0_USFGRO0_VS1_VW2_WSGRA0_WSGRB0_WG16_16_1_WGM1
    SolutionIndex: 436
    SolutionNameMin: Cijk_Ailk_Bljk_SB_MT16x32x32_SE_1LDSB0_AF0EM1_AMAS3_BL1_DTL0_DVO0_EPS1_FL1_GRVW2_GSU4_ISA908_IU1_KLA_LBSPP0_LPB2_LRVW2_MAC_NLCA1_NLCB1_ONLL1_PGR1_PLR1_SIA1_SU32_SUS256_SRVW0_SNLL0_TT2_4_TLDS0_USFGRO0_VS1_VW2_WSGRA0_WSGRB0_WG8_8_4_WGM1
    SolutionIndex: 437
    SolutionNameMin: Cijk_Ailk_Bljk_SB_MT64x4x16_MI4x4x1x16_SE_1LDSB0_AF0EM1_AMAS0_BL1_DTL0_DVO0_EPS1_FL0_GRVW2_GSU1_ISA908_IU1_KLA_LBSPP128_LPB2_LRVW2_MAC_NLCA1_NLCB1_ONLL1_PGR1_PLR17_SIA3_SU0_SUS256_SRVW0_SNLL0_TT1_4_TLDS1_USFGROn1_VSn1_VW1_WSGRA1_WSGRB1_WG64_1_1_WGM1
    SolutionIndex: 438
    SolutionNameMin: Cijk_Ailk_Bljk_SB_MT32x8x32_SE_1LDSB0_AF0EM1_AMAS3_BL1_DTL0_DVO0_EPS1_FL0_GRVW2_GSU1_ISA908_IU1_KLA_LBSPP0_LPB2_LRVW2_MAC_NLCA1_NLCB1_ONLL1_PGR1_PLR1_SIA1_SU32_SUS256_SRVW0_SNLL0_TT2_2_TLDS0_USFGRO0_VS1_VW2_WSGRA0_WSGRB0_WG16_4_4_WGM1
    SolutionIndex: 439
    SolutionNameMin: Cijk_Ailk_Bljk_SB_MT16x64x32_MI16x16x4x1_SE_1LDSB0_AF0EM1_AMAS0_BL1_DTL0_DVO0_EPS0_FL0_GRVW1_GSU1_ISA908_IU1_KLA_LBSPP128_LPB2_LRVW2_MAC_NLCA1_NLCB1_ONLL1_PGR2_PLR9_SIA3_SU0_SUS256_SRVW2_SNLL0_TT1_16_TLDS1_USFGROn1_VSn1_VW1_WSGRA1_WSGRB1_WG16_16_1_WGM1
    SolutionIndex: 440
    SolutionNameMin: Cijk_Ailk_Bljk_SB_MT16x16x32_SE_1LDSB0_AF0EM1_AMAS3_BL1_DTL0_DVO0_EPS1_FL1_GRVW2_GSU1_ISA908_IU1_KLA_LBSPP0_LPB2_LRVW2_MAC_NLCA1_NLCB1_ONLL1_PGR1_PLR0_SIA1_SU32_SUS256_SRVW0_SNLL1_TT4_2_TLDS0_USFGRO0_VS1_VW2_WSGRA0_WSGRB0_WG4_8_8_WGM1
    SolutionIndex: 441
    SolutionNameMin: Cijk_Ailk_Bljk_SB_MT16x16x32_SE_1LDSB0_AF0EM1_AMAS3_BL1_DTL0_DVO0_EPS1_FL1_GRVW2_GSU4_ISA908_IU1_KLA_LBSPP0_LPB2_LRVW2_MAC_NLCA1_NLCB1_ONLL1_PGR1_PLR1_SIA1_SU32_SUS256_SRVW0_SNLL0_TT2_4_TLDS0_USFGRO0_VS1_VW2_WSGRA0_WSGRB0_WG8_4_4_WGM1
    SolutionIndex: 442
    SolutionNameMin: Cijk_Ailk_Bljk_SB_MT32x16x16_SE_1LDSB0_AF0EM1_AMAS3_BL1_DTL0_DVO0_EPS0_FL1_GRVW2_GSU1_ISA908_IU1_KLA_LBSPP0_LPB2_LRVW2_MAC_NLCA1_NLCB1_ONLL1_PGR0_PLR1_SIA1_SU32_SUS256_SRVW0_SNLL0_TT4_2_TLDS0_USFGRO0_VS1_VW2_WSGRA0_WSGRB0_WG8_8_4_WGM1
    SolutionIndex: 443
    SolutionNameMin: Cijk_Ailk_Bljk_SB_MT16x16x16_SE_1LDSB0_AF0EM1_AMAS3_BL1_DTL0_DVO0_EPS0_FL1_GRVW2_GSU1_ISA908_IU1_KLA_LBSPP0_LPB0_LRVW2_MAC_NLCA1_NLCB1_ONLL1_PGR0_PLR0_SIA1_SU32_SUS256_SRVW0_SNLL0_TT2_2_TLDS0_USFGRO0_VS1_VW2_WSGRA0_WSGRB0_WG8_8_4_WGM8
    SolutionIndex: 444
    SolutionNameMin: Cijk_Ailk_Bljk_SB_MT64x128x16_MI32x32x2x1_SE_1LDSB0_AF0EM1_AMAS0_BL1_DTL0_DVO0_EPS1_FL0_GRVW1_GSU1_ISA908_IU1_KLA_LBSPP128_LPB2_LRVW2_MAC_NLCA1_NLCB1_ONLL1_PGR1_PLR9_SIA3_SU32_SUS256_SRVW2_SNLL0_TT1_64_TLDS1_USFGROn1_VSn1_VW1_WSGRA1_WSGRB1_WG64_4_1_WGM1
    SolutionIndex: 445
    SolutionNameMin: Cijk_Ailk_Bljk_SB_MT32x32x16_SE_1LDSB0_AF0EM1_AMAS3_BL1_DTL0_DVO0_EPS0_FL1_GRVW2_GSU1_ISA908_IU1_KLA_LBSPP0_LPB0_LRVW2_MAC_NLCA1_NLCB1_ONLL1_PGR0_PLR0_SIA1_SU32_SUS256_SRVW0_SNLL0_TT2_2_TLDS0_USFGRO0_VS1_VW2_WSGRA0_WSGRB0_WG16_16_1_WGM16
    SolutionIndex: 446
    SolutionNameMin: Cijk_Ailk_Bljk_SB_MT16x8x32_SE_1LDSB0_AF0EM1_AMAS3_BL1_DTL0_DVO0_EPS1_FL1_GRVW2_GSU4_ISA908_IU1_KLA_LBSPP0_LPB2_LRVW2_MAC_NLCA1_NLCB1_ONLL1_PGR1_PLR1_SIA1_SU32_SUS256_SRVW0_SNLL0_TT2_2_TLDS0_USFGRO0_VS1_VW2_WSGRA0_WSGRB0_WG8_4_4_WGM8
    SolutionIndex: 447
    SolutionNameMin: Cijk_Ailk_Bljk_SB_MT32x8x32_SE_1LDSB0_AF0EM1_AMAS3_BL1_DTL0_DVO0_EPS1_FL1_GRVW2_GSU1_ISA908_IU1_KLA_LBSPP0_LPB2_LRVW2_MAC_NLCA1_NLCB1_ONLL1_PGR1_PLR1_SIA1_SU32_SUS256_SRVW0_SNLL1_TT2_2_TLDS0_USFGRO0_VS1_VW2_WSGRA0_WSGRB0_WG16_4_4_WGM16
    SolutionIndex: 448
    SolutionNameMin: Cijk_Ailk_Bljk_SB_MT4x64x16_SE_1LDSB0_AF0EM1_AMAS3_BL1_DTL0_DVO0_EPS0_FL1_GRVW2_GSU1_ISA908_IU1_KLA_LBSPP0_LPB2_LRVW2_MAC_NLCA1_NLCB1_ONLL1_PGR0_PLR0_SIA1_SU32_SUS256_SRVW0_SNLL0_TT2_2_TLDS0_USFGRO0_VS1_VW2_WSGRA0_WSGRB0_WG2_32_4_WGM1
    SolutionIndex: 449
    SolutionNameMin: Cijk_Ailk_Bljk_SB_MT32x16x16_SN_1LDSB0_AF0EM1_AMAS3_BL1_DTL0_DVO0_EPS1_FL0_GRVW2_GSU2_ISA908_IU1_KLA_LBSPP0_LPB0_LRVW2_MAC_NLCA1_NLCB1_ONLL1_PGR1_PLR1_SIA1_SU32_SUS256_SRVW0_SNLL0_TT4_2_TLDS0_USFGRO0_VS1_VW2_WSGRA0_WSGRB0_WG8_8_4_WGM8
    SolutionIndex: 450
    SolutionNameMin: Cijk_Ailk_Bljk_SB_MT64x16x16_MI16x16x4x1_SE_1LDSB0_AF0EM1_AMAS0_BL1_DTL0_DVO0_EPS1_FL0_GRVW1_GSU1_ISA908_IU1_KLA_LBSPP128_LPB2_LRVW2_MAC_NLCA1_NLCB1_ONLL1_PGR1_PLR5_SIA3_SU0_SUS256_SRVW2_SNLL0_TT1_16_TLDS1_USFGROn1_VSn1_VW1_WSGRA1_WSGRB1_WG64_4_1_WGM1
    SolutionIndex: 451
    SolutionNameMin: Cijk_Ailk_Bljk_SB_MT32x32x16_MI16x16x4x1_SE_1LDSB0_AF0EM1_AMAS0_BL1_DTL0_DVO0_EPS1_FL0_GRVW1_GSU1_ISA908_IU1_KLA_LBSPP128_LPB2_LRVW2_MAC_NLCA1_NLCB1_ONLL1_PGR1_PLR5_SIA3_SU0_SUS128_SRVW2_SNLL0_TT1_16_TLDS1_USFGROn1_VSn1_VW1_WSGRA1_WSGRB1_WG32_8_1_WGM1
    SolutionIndex: 452
    SolutionNameMin: Cijk_Ailk_Bljk_SB_MT16x16x32_MI16x16x4x1_SE_1LDSB0_AF0EM1_AMAS0_BL1_DTL0_DVO0_EPS0_FL0_GRVW1_GSU3_ISA908_IU1_KLA_LBSPP128_LPB2_LRVW2_MAC_NLCA1_NLCB1_ONLL1_PGR2_PLR9_SIA3_SU0_SUS256_SRVW0_SNLL0_TT1_16_TLDS1_USFGROn1_VSn1_VW1_WSGRA1_WSGRB1_WG16_4_1_WGM1
    SolutionIndex: 453
    SolutionNameMin: Cijk_Ailk_Bljk_SB_MT64x4x16_MI4x4x1x16_SE_1LDSB0_AF0EM1_AMAS0_BL1_DTL0_DVO0_EPS0_FL0_GRVW2_GSU1_ISA908_IU1_KLA_LBSPP128_LPB2_LRVW2_MAC_NLCA1_NLCB1_ONLL1_PGR2_PLR17_SIA3_SU0_SUS256_SRVW0_SNLL0_TT1_4_TLDS1_USFGROn1_VSn1_VW1_WSGRA1_WSGRB1_WG64_1_1_WGM1
    SolutionIndex: 454
    SolutionNameMin: Cijk_Ailk_Bljk_SB_MT16x16x32_SE_1LDSB0_AF0EM1_AMAS3_BL1_DTL0_DVO0_EPS1_FL1_GRVW2_GSU4_ISA908_IU1_KLA_LBSPP0_LPB2_LRVW2_MAC_NLCA1_NLCB1_ONLL1_PGR1_PLR0_SIA1_SU32_SUS256_SRVW0_SNLL0_TT2_4_TLDS0_USFGRO0_VS1_VW2_WSGRA0_WSGRB0_WG8_4_8_WGM1
    SolutionIndex: 455
    SolutionNameMin: Cijk_Ailk_Bljk_SB_MT64x32x8_SE_1LDSB0_AF0EM1_AMAS3_BL1_DTL0_DVO0_EPS0_FL0_GRVW1_GSU1_ISA908_IU1_KLA_LBSPP0_LPB4_LRVW4_MAC_NLCA1_NLCB1_ONLL1_PGR0_PLR1_SIA1_SU32_SUS256_SRVW0_SNLL0_TT4_4_TLDS0_USFGRO1_VS1_VW4_WSGRA0_WSGRB0_WG16_8_1_WGM8
    SolutionIndex: 456
    SolutionNameMin: Cijk_Ailk_Bljk_SB_MT16x16x32_MI16x16x4x1_SE_1LDSB0_AF0EM1_AMAS0_BL1_DTL0_DVO0_EPS0_FL0_GRVW1_GSU3_ISA908_IU1_KLA_LBSPP128_LPB2_LRVW2_MAC_NLCA1_NLCB1_ONLL1_PGR2_PLR9_SIA3_SU32_SUS256_SRVW0_SNLL0_TT1_16_TLDS1_USFGROn1_VSn1_VW1_WSGRA1_WSGRB1_WG16_4_1_WGM2
    SolutionIndex: 457
    SolutionNameMin: Cijk_Ailk_Bljk_SB_MT16x16x32_MI16x16x4x1_SE_1LDSB0_AF0EM1_AMAS0_BL1_DTL0_DVO0_EPS1_FL0_GRVW1_GSU3_ISA908_IU1_KLA_LBSPP128_LPB2_LRVW2_MAC_NLCA1_NLCB1_ONLL1_PGR1_PLR9_SIA3_SU0_SUS256_SRVW0_SNLL0_TT1_16_TLDS1_USFGROn1_VSn1_VW1_WSGRA1_WSGRB1_WG16_4_1_WGM1
    SolutionIndex: 458
    SolutionNameMin: Cijk_Ailk_Bljk_SB_MT16x16x16_SE_1LDSB0_AF0EM1_AMAS3_BL1_DTL0_DVO0_EPS0_FL1_GRVW2_GSU1_ISA908_IU1_KLA_LBSPP0_LPB0_LRVW2_MAC_NLCA1_NLCB1_ONLL1_PGR0_PLR1_SIA1_SU32_SUS256_SRVW0_SNLL0_TT2_2_TLDS0_USFGRO0_VS1_VW2_WSGRA0_WSGRB0_WG8_8_2_WGM1
    SolutionIndex: 459
    SolutionNameMin: Cijk_Ailk_Bljk_SB_MT8x32x16_SE_1LDSB0_AF0EM1_AMAS3_BL1_DTL0_DVO0_EPS0_FL1_GRVW2_GSU1_ISA908_IU1_KLA_LBSPP0_LPB2_LRVW2_MAC_NLCA1_NLCB1_ONLL1_PGR0_PLR0_SIA1_SU32_SUS256_SRVW0_SNLL0_TT2_2_TLDS0_USFGRO0_VS1_VW2_WSGRA0_WSGRB0_WG4_16_4_WGM1
    SolutionIndex: 460
    SolutionNameMin: Cijk_Ailk_Bljk_SB_MT32x32x16_MI16x16x4x1_SE_1LDSB0_AF0EM1_AMAS0_BL1_DTL0_DVO0_EPS0_FL0_GRVW1_GSU1_ISA908_IU1_KLA_LBSPP128_LPB2_LRVW2_MAC_NLCA1_NLCB1_ONLL1_PGR2_PLR5_SIA3_SU32_SUS128_SRVW2_SNLL0_TT1_16_TLDS1_USFGROn1_VSn1_VW1_WSGRA1_WSGRB1_WG32_8_1_WGM1
    SolutionIndex: 461
    SolutionNameMin: Cijk_Ailk_Bljk_SB_MT16x16x8_SN_1LDSB0_AF0EM1_AMAS3_BL1_DTL0_DVO0_EPS1_FL0_GRVW2_GSU16_ISA908_IU1_KLA_LBSPP0_LPB0_LRVW2_MAC_NLCA1_NLCB1_ONLL1_PGR1_PLR1_SIA1_SU32_SUS256_SRVW0_SNLL0_TT2_2_TLDS0_USFGRO1_VS1_VW2_WSGRA0_WSGRB0_WG8_8_2_WGM1
    SolutionIndex: 462
    SolutionNameMin: Cijk_Ailk_Bljk_SB_MT4x64x16_SE_1LDSB0_AF0EM1_AMAS3_BL1_DTL0_DVO0_EPS0_FL1_GRVW2_GSU1_ISA908_IU1_KLA_LBSPP0_LPB2_LRVW2_MAC_NLCA1_NLCB1_ONLL1_PGR0_PLR1_SIA1_SU32_SUS256_SRVW0_SNLL0_TT2_2_TLDS0_USFGRO0_VS1_VW2_WSGRA0_WSGRB0_WG2_32_4_WGM1
    SolutionIndex: 463
    SolutionNameMin: Cijk_Ailk_Bljk_SB_MT16x16x32_SE_1LDSB0_AF0EM1_AMAS3_BL1_DTL0_DVO0_EPS1_FL1_GRVW2_GSU4_ISA908_IU1_KLA_LBSPP0_LPB2_LRVW2_MAC_NLCA1_NLCB1_ONLL1_PGR1_PLR1_SIA1_SU32_SUS256_SRVW0_SNLL0_TT2_2_TLDS0_USFGRO0_VS1_VW2_WSGRA0_WSGRB0_WG8_8_2_WGM1
    SolutionIndex: 464
    SolutionNameMin: Cijk_Ailk_Bljk_SB_MT16x32x16_SE_1LDSB0_AF0EM1_AMAS3_BL1_DTL0_DVO0_EPS0_FL1_GRVW2_GSU1_ISA908_IU1_KLA_LBSPP0_LPB2_LRVW2_MAC_NLCA1_NLCB1_ONLL1_PGR0_PLR1_SIA1_SU32_SUS256_SRVW0_SNLL0_TT2_2_TLDS0_USFGRO0_VS1_VW2_WSGRA0_WSGRB0_WG8_16_2_WGM1
    SolutionIndex: 465
    SolutionNameMin: Cijk_Ailk_Bljk_SB_MT32x32x32_MI16x16x4x1_SE_1LDSB0_AF0EM1_AMAS0_BL1_DTL0_DVO0_EPS0_FL0_GRVW4_GSU3_ISA908_IU1_KLA_LBSPP128_LPB4_LRVW2_MAC_NLCA1_NLCB1_ONLL1_PGR2_PLR9_SIA3_SU32_SUS256_SRVW0_SNLL0_TT1_16_TLDS1_USFGROn1_VSn1_VW1_WSGRA1_WSGRB1_WG32_8_1_WGM15
    SolutionIndex: 466
    SolutionNameMin: Cijk_Ailk_Bljk_SB_MT32x8x32_SN_1LDSB0_AF0EM1_AMAS3_BL1_DTL0_DVO0_EPS1_FL0_GRVW2_GSU4_ISA908_IU1_KLA_LBSPP0_LPB0_LRVW2_MAC_NLCA1_NLCB1_ONLL1_PGR1_PLR1_SIA1_SU32_SUS256_SRVW0_SNLL0_TT2_2_TLDS0_USFGRO0_VS1_VW2_WSGRA0_WSGRB0_WG16_4_4_WGM8
- - - [1600, 512, 1, 1024]
    - [0, 40.934]
  - - [1024, 512, 1, 1]
    - [1, 0.073]
  - - [1024, 512, 1, 64]
    - [2, 4.47]
  - - [2048, 512, 1, 1]
    - [3, 0.135]
  - - [1024, 4096, 1, 1024]
    - [4, 65.553]
  - - [4096, 4096, 1, 1024]
    - [5, 81.284]
  - - [1024, 2048, 1, 1024]
    - [6, 61.57]
  - - [4096, 2048, 1, 1024]
    - [7, 74.504]
  - - [768, 4096, 1, 2]
    - [8, 0.548]
  - - [768, 4096, 1, 768]
    - [9, 61.524]
  - - [3072, 4096, 1, 768]
    - [10, 76.787]
  - - [768, 2048, 1, 2]
    - [8, 0.375]
  - - [768, 2048, 1, 768]
    - [11, 43.84]
  - - [3072, 2048, 1, 768]
    - [12, 72.79]
  - - [768, 640, 1, 768]
    - [13, 32.574]
  - - [768, 1024, 1, 2]
    - [14, 0.232]
  - - [768, 1024, 1, 768]
    - [15, 38.195]
  - - [3072, 1024, 1, 768]
    - [16, 60.223]
  - - [768, 1280, 1, 768]
    - [17, 47.039]
  - - [768, 512, 1, 2]
    - [18, 0.117]
  - - [768, 512, 1, 768]
    - [19, 24.017]
  - - [3072, 512, 1, 768]
    - [20, 45.745]
  - - [1024, 3072, 1, 1024]
    - [21, 60.319]
  - - [1024, 512, 1, 1024]
    - [22, 28.296]
  - - [3072, 2048, 1, 1024]
    - [23, 70.331]
  - - [3072, 3072, 1, 1024]
    - [24, 76.283]
  - - [3072, 512, 1, 1024]
    - [25, 52.748]
  - - [3072, 4096, 1, 1024]
    - [26, 79.185]
  - - [1024, 2048, 1, 2]
    - [27, 0.456]
  - - [1024, 3072, 1, 2]
    - [28, 0.574]
  - - [1024, 512, 1, 2]
    - [29, 0.158]
  - - [1024, 4096, 1, 2]
    - [30, 0.643]
  - - [64, 512, 1, 1]
    - [31, 0.005]
  - - [512, 200, 1, 32]
    - [32, 0.495]
  - - [1024, 200, 1, 1]
    - [33, 0.027]
  - - [512, 200, 1, 1]
    - [34, 0.013]
  - - [1024, 32, 1, 2]
    - [35, 0.01]
  - - [1024, 32, 1, 1024]
    - [36, 2.947]
  - - [768, 320, 1, 768]
    - [37, 18.816]
  - - [768, 160, 1, 768]
    - [38, 8.929]
  - - [768, 32, 1, 768]
    - [39, 2.023]
  - - [768, 32, 1, 2]
    - [31, 0.007]
  - - [768, 64, 1, 768]
    - [40, 4.28]
  - - [768, 64, 1, 2]
    - [41, 0.016]
  - - [1024, 120, 1, 1024]
    - [42, 10.8]
  - - [1024, 20, 1, 1024]
    - [43, 1.978]
  - - [1024, 80, 1, 1024]
    - [44, 7.297]
  - - [1024, 160, 1, 1024]
    - [40, 13.082]
  - - [32, 200, 1, 1]
    - [45, 0.001]
  - - [1024, 4, 1, 1024]
    - [46, 0.464]
  - - [1024, 4, 1, 2]
    - [47, 0.001]
  - - [768, 16, 1, 768]
    - [48, 0.854]
  - - [768, 16, 1, 2]
    - [49, 0.004]
  - - [768, 8, 1, 768]
    - [50, 0.508]
  - - [1024, 6, 1, 1024]
    - [51, 0.602]
  - - [1024, 6, 1, 2]
    - [47, 0.002]
  - - [1024, 8, 1, 1024]
    - [51, 0.819]
  - - [128, 128, 512, 64]
    - [8, 20.881]
  - - [512, 512, 64, 64]
    - [52, 23.931]
  - - [64, 64, 768, 64]
    - [53, 12.562]
  - - [64, 64, 96, 64]
    - [34, 3.298]
  - - [704, 1024, 1, 128]
    - [54, 8.754]
  - - [1024, 1024, 1, 3328]
    - [55, 53.896]
  - - [4, 704, 1, 1280]
    - [56, 0.365]
  - - [4, 1856, 1, 3328]
    - [57, 1.827]
  - - [1856, 448, 1, 3328]
    - [58, 51.704]
  - - [2944, 4288, 1, 1280]
    - [59, 80.169]
  - - [2368, 64, 1, 3328]
    - [60, 25.482]
  - - [1760, 32, 1, 1760]
    - [61, 8.2]
  - - [2368, 5888, 1, 256]
    - [62, 54.157]
  - - [5888, 1856, 1, 256]
    - [63, 50.25]
  - - [64, 3584, 1, 1280]
    - [64, 20.422]
  - - [512, 24000, 1, 1536]
    - [65, 82.566]
  - - [128, 6784, 1, 3328]
    - [66, 54.741]
  - - [5888, 1408, 1, 256]
    - [8, 51.985]
  - - [5888, 1856, 1, 3328]
    - [67, 91.098]
  - - [512, 4, 1, 512]
    - [48, 0.141]
  - - [35, 1500, 1, 2560]
    - [61, 9.075]
  - - [1856, 4288, 1, 256]
    - [8, 49.374]
  - - [1024, 5056, 1, 128]
    - [68, 29.814]
  - - [5056, 5056, 1, 3328]
    - [10, 92.122]
  - - [1408, 5888, 1, 1280]
    - [69, 77.38]
  - - [2368, 448, 1, 128]
    - [54, 12.083]
  - - [6144, 6000, 1, 2560]
    - [70, 93.36]
  - - [2368, 6784, 1, 128]
    - [8, 39.005]
  - - [1024, 3584, 1, 3328]
    - [71, 81.66]
  - - [512, 48000, 1, 2048]
    - [72, 89.654]
  - - [1408, 64, 1, 128]
    - [40, 1.421]
  - - [256, 4288, 1, 3328]
    - [73, 67.566]
  - - [5888, 1408, 1, 1280]
    - [74, 76.422]
  - - [704, 1856, 1, 3328]
    - [0, 67.943]
  - - [1408, 4288, 1, 256]
    - [62, 49.754]
  - - [1024, 2368, 1, 256]
    - [52, 32.743]
  - - [64, 4, 1, 256]
    - [75, 0.007]
  - - [1408, 1856, 1, 1280]
    - [76, 61.794]
  - - [1408, 64, 1, 1280]
    - [77, 11.325]
  - - [448, 1024, 1, 1280]
    - [78, 32.127]
  - - [4096, 32, 1, 4096]
    - [79, 22.164]
  - - [256, 1408, 1, 3328]
    - [80, 46.818]
  - - [5056, 5056, 1, 1280]
    - [81, 86.7]
  - - [448, 5056, 1, 256]
    - [8, 32.845]
  - - [704, 1856, 1, 1280]
    - [82, 54.768]
  - - [128, 5056, 1, 128]
    - [83, 8.645]
  - - [2368, 128, 1, 256]
    - [84, 8.077]
  - - [1856, 1408, 1, 128]
    - [85, 22.079]
  - - [64, 5056, 1, 256]
    - [86, 9.907]
  - - [6784, 256, 1, 3328]
    - [87, 74.433]
  - - [1408, 3584, 1, 256]
    - [88, 46.359]
  - - [4288, 448, 1, 256]
    - [89, 32.492]
  - - [64, 704, 1, 128]
    - [90, 0.839]
  - - [1024, 1856, 1, 128]
    - [85, 20.2]
  - - [4288, 2944, 1, 1280]
    - [25, 83.838]
  - - [704, 5056, 1, 1280]
    - [91, 68.026]
  - - [2368, 704, 1, 3328]
    - [92, 69.824]
  - - [256, 5888, 1, 256]
    - [93, 26.353]
  - - [1856, 4288, 1, 3328]
    - [94, 82.637]
  - - [256, 2944, 1, 256]
    - [95, 18.563]
  - - [5888, 1024, 1, 256]
    - [85, 47.508]
  - - [448, 64, 1, 1280]
    - [96, 3.542]
  - - [3072, 64, 1, 1024]
    - [97, 17.099]
  - - [3584, 4, 1, 1280]
    - [98, 1.546]
  - - [2560, 16, 1, 2560]
    - [96, 6.701]
  - - [2944, 64, 1, 256]
    - [99, 5.015]
  - - [128, 4, 1, 1280]
    - [100, 0.069]
  - - [1408, 2944, 1, 256]
    - [85, 42.929]
  - - [256, 1856, 1, 1280]
    - [80, 40.581]
  - - [6784, 5056, 1, 3328]
    - [5, 93.15]
  - - [5056, 5056, 1, 256]
    - [6, 62.009]
  - - [128, 256, 1, 256]
    - [101, 1.073]
  - - [64, 1024, 1, 1280]
    - [102, 6.26]
  - - [2944, 4, 1, 256]
    - [103, 0.308]
  - - [704, 5056, 1, 128]
    - [104, 23.202]
  - - [4, 2368, 1, 1280]
    - [102, 0.958]
  - - [2368, 2944, 1, 1280]
    - [94, 75.287]
  - - [448, 448, 1, 3328]
    - [105, 30.585]
  - - [6784, 6784, 1, 1280]
    - [106, 88.86]
  - - [1024, 256, 1, 3328]
    - [66, 35.567]
  - - [1408, 4288, 1, 1280]
    - [107, 74.043]
  - - [3584, 4288, 1, 1280]
    - [108, 86.193]
  - - [512, 6000, 1, 2560]
    - [109, 76.517]
  - - [2368, 704, 1, 1280]
    - [110, 57.183]
  - - [5056, 4288, 1, 3328]
    - [70, 93.421]
  - - [3584, 2368, 1, 3328]
    - [108, 88.075]
  - - [5888, 6784, 1, 1280]
    - [108, 88.556]
  - - [64, 704, 1, 1280]
    - [38, 5.198]
  - - [4288, 256, 1, 256]
    - [8, 21.89]
  - - [2944, 128, 1, 128]
    - [111, 5.396]
  - - [6144, 32, 1, 2560]
    - [79, 24.758]
  - - [6784, 448, 1, 1280]
    - [112, 59.319]
  - - [2944, 5888, 1, 256]
    - [113, 56.702]
  - - [64, 64, 1, 1280]
    - [51, 0.482]
  - - [4288, 2944, 1, 256]
    - [114, 49.025]
  - - [5888, 704, 1, 1280]
    - [115, 70.707]
  - - [5056, 4, 1, 3328]
    - [116, 3.504]
  - - [1856, 64, 1, 1280]
    - [117, 13.317]
  - - [1760, 16, 1, 1760]
    - [118, 4.085]
  - - [448, 5888, 1, 128]
    - [8, 22.799]
  - - [5888, 64, 1, 3328]
    - [119, 45.681]
  - - [2944, 256, 1, 3328]
    - [85, 47.583]
  - - [1024, 64, 1, 128]
    - [120, 1.091]
  - - [5056, 2368, 1, 1280]
    - [121, 77.281]
  - - [448, 3584, 1, 1280]
    - [22, 57.753]
  - - [6784, 5888, 1, 256]
    - [108, 67.261]
  - - [64, 1024, 1, 3328]
    - [122, 12.586]
  - - [704, 128, 1, 1280]
    - [44, 9.265]
  - - [4, 3584, 1, 128]
    - [123, 0.247]
  - - [1408, 448, 1, 1280]
    - [124, 33.401]
  - - [1024, 1408, 1, 256]
    - [85, 25.073]
  - - [2368, 2368, 1, 3328]
    - [106, 86.176]
  - - [1856, 6784, 1, 128]
    - [67, 38.69]
  - - [5056, 704, 1, 3328]
    - [125, 78.288]
  - - [1408, 1856, 1, 256]
    - [0, 33.194]
  - - [1408, 704, 1, 3328]
    - [115, 59.585]
  - - [2368, 5056, 1, 256]
    - [126, 48.937]
  - - [1408, 256, 1, 1280]
    - [127, 29.128]
  - - [3072, 128, 1, 1024]
    - [128, 27.043]
  - - [3584, 2368, 1, 1280]
    - [129, 78.197]
  - - [4288, 64, 1, 3328]
    - [130, 35.076]
  - - [2368, 4, 1, 1280]
    - [131, 1.178]
  - - [704, 5888, 1, 256]
    - [62, 41.065]
  - - [6784, 2944, 1, 128]
    - [132, 39.615]
  - - [6784, 64, 1, 256]
    - [133, 9.598]
  - - [2944, 256, 1, 256]
    - [134, 16.777]
  - - [2944, 6784, 1, 3328]
    - [106, 90.786]
  - - [128, 1, 1, 1408]
    - [135, 0.017]
  - - [704, 1408, 1, 3328]
    - [136, 60.949]
  - - [3584, 704, 1, 3328]
    - [137, 72.329]
  - - [2944, 256, 1, 128]
    - [138, 9.974]
  - - [6784, 4, 1, 1280]
    - [38, 2.278]
  - - [1024, 64, 1, 1280]
    - [139, 6.766]
  - - [8448, 4, 1, 2816]
    - [140, 3.91]
  - - [448, 4288, 1, 256]
    - [141, 30.195]
  - - [64, 3584, 1, 3328]
    - [84, 34.629]
  - - [704, 2368, 1, 1280]
    - [142, 54.487]
  - - [1856, 2368, 1, 1280]
    - [95, 70.323]
  - - [2368, 128, 1, 3328]
    - [133, 37.941]
  - - [64, 193600, 1, 64]
    - [143, 21.147]
  - - [1760, 128, 1, 1760]
    - [144, 28.143]
  - - [448, 1408, 1, 256]
    - [145, 15.421]
  - - [1856, 4288, 1, 1280]
    - [146, 72.972]
  - - [64, 5056, 1, 3328]
    - [127, 38.5]
  - - [512, 1500, 1, 2816]
    - [125, 56.69]
  - - [1024, 448, 1, 128]
    - [66, 7.274]
  - - [704, 4, 1, 1280]
    - [147, 0.35]
  - - [704, 256, 1, 128]
    - [148, 2.527]
  - - [256, 193600, 1, 64]
    - [85, 31.119]
  - - [704, 2944, 1, 128]
    - [149, 17.15]
  - - [1408, 1024, 1, 1280]
    - [150, 58.67]
  - - [704, 6784, 1, 256]
    - [151, 45.828]
  - - [6784, 704, 1, 256]
    - [152, 44.562]
  - - [5056, 1408, 1, 128]
    - [62, 34.444]
  - - [2048, 7000, 1, 2048]
    - [153, 85.325]
  - - [256, 3584, 1, 3328]
    - [154, 57.865]
  - - [5056, 704, 1, 256]
    - [8, 39.574]
  - - [128, 1408, 1, 128]
    - [155, 2.922]
  - - [3584, 4288, 1, 3328]
    - [5, 93.169]
  - - [5888, 1856, 1, 1280]
    - [5, 83.25]
  - - [256, 1408, 1, 256]
    - [156, 10.104]
  - - [5056, 64, 1, 1280]
    - [130, 29.536]
  - - [1024, 704, 1, 256]
    - [157, 15.865]
  - - [64, 256, 1, 128]
    - [158, 0.244]
  - - [2368, 3584, 1, 1280]
    - [81, 80.114]
  - - [1024, 256, 1, 256]
    - [159, 7.413]
  - - [1856, 4, 1, 1280]
    - [160, 0.784]
  - - [448, 448, 1, 256]
    - [161, 5.555]
  - - [2944, 3584, 1, 3328]
    - [25, 89.886]
  - - [7680, 32, 1, 2560]
    - [79, 31.349]
  - - [128, 4288, 1, 128]
    - [162, 8.575]
  - - [256, 256, 1, 3328]
    - [163, 12.499]
  - - [128, 1024, 1, 3328]
    - [64, 23.387]
  - - [4, 1408, 1, 3328]
    - [51, 1.576]
  - - [6784, 2944, 1, 256]
    - [74, 59.007]
  - - [64, 1856, 1, 1280]
    - [38, 11.813]
  - - [64, 1024, 1, 128]
    - [164, 1.135]
  - - [1024, 1500, 1, 2560]
    - [165, 58.375]
  - - [1856, 2368, 1, 256]
    - [85, 42.802]
  - - [3584, 256, 1, 128]
    - [85, 12.28]
  - - [3584, 6784, 1, 3328]
    - [110, 92.964]
  - - [256, 1024, 1, 256]
    - [166, 5.769]
  - - [4, 6784, 1, 3328]
    - [158, 3.365]
  - - [1024, 5888, 1, 3328]
    - [16, 80.41]
  - - [1024, 128, 1, 1280]
    - [105, 11.497]
  - - [3072, 32, 1, 1024]
    - [118, 7.539]
  - - [6144, 24000, 1, 2560]
    - [10, 96.414]
  - - [448, 1024, 1, 256]
    - [28, 12.059]
  - - [5056, 4288, 1, 1280]
    - [70, 87.971]
  - - [5888, 64, 1, 256]
    - [167, 11.252]
  - - [1856, 256, 1, 1280]
    - [168, 40.8]
  - - [64, 5888, 1, 3328]
    - [80, 44.892]
  - - [2368, 2368, 1, 1280]
    - [169, 74.032]
  - - [2944, 5888, 1, 128]
    - [62, 40.406]
  - - [704, 5888, 1, 1280]
    - [141, 66.34]
  - - [2368, 3584, 1, 128]
    - [170, 37.929]
  - - [1856, 5056, 1, 128]
    - [141, 29.587]
  - - [4608, 1, 1, 1536]
    - [98, 0.559]
  - - [448, 256, 1, 3328]
    - [171, 21.712]
  - - [2944, 6784, 1, 1280]
    - [88, 84.381]
  - - [448, 1856, 1, 128]
    - [172, 9.337]
  - - [128, 1024, 1, 128]
    - [173, 1.943]
  - - [7680, 4, 1, 2560]
    - [116, 4.068]
  - - [1024, 704, 1, 1280]
    - [174, 39.325]
  - - [128, 5888, 1, 256]
    - [62, 14.809]
  - - [1024, 5056, 1, 1280]
    - [107, 70.848]
  - - [4288, 1024, 1, 256]
    - [8, 43.469]
  - - [2944, 2368, 1, 128]
    - [85, 36.01]
  - - [704, 704, 1, 3328]
    - [175, 38.433]
  - - [704, 1408, 1, 1280]
    - [69, 49.574]
  - - [5888, 448, 1, 1280]
    - [176, 64.067]
  - - [3584, 256, 1, 3328]
    - [174, 62.784]
  - - [704, 5888, 1, 3328]
    - [109, 79.92]
  - - [704, 1856, 1, 128]
    - [8, 15.258]
  - - [128, 3584, 1, 3328]
    - [177, 54.824]
  - - [4, 4288, 1, 128]
    - [178, 0.295]
  - - [128, 704, 1, 1280]
    - [179, 10.017]
  - - [3584, 2944, 1, 256]
    - [107, 50.626]
  - - [1856, 128, 1, 3328]
    - [180, 35.249]
  - - [1856, 2368, 1, 3328]
    - [181, 77.852]
  - - [512, 6000, 1, 2816]
    - [109, 70.4]
  - - [2944, 448, 1, 128]
    - [85, 15.022]
  - - [64, 193600, 1, 256]
    - [182, 42.661]
  - - [128, 2944, 1, 1280]
    - [183, 30.292]
  - - [448, 2944, 1, 1280]
    - [80, 52.589]
  - - [512, 24000, 1, 2048]
    - [184, 87.698]
  - - [128, 256, 1, 3328]
    - [185, 7.106]
  - - [1408, 5056, 1, 3328]
    - [186, 86.551]
  - - [1856, 1856, 1, 3328]
    - [151, 76.752]
  - - [3584, 128, 1, 256]
    - [8, 11.969]
  - - [448, 1408, 1, 3328]
    - [124, 39.814]
  - - [2368, 2368, 1, 256]
    - [52, 48.851]
  - - [4288, 4288, 1, 1280]
    - [106, 84.895]
  - - [64, 448, 1, 1280]
    - [118, 3.521]
  - - [5888, 1024, 1, 1280]
    - [25, 73.422]
  - - [704, 1024, 1, 256]
    - [182, 16.738]
  - - [1024, 12544, 1, 256]
    - [169, 50.587]
  - - [448, 4, 1, 256]
    - [100, 0.059]
  - - [5888, 448, 1, 128]
    - [85, 20.05]
  - - [512, 48000, 1, 2560]
    - [110, 91.638]
  - - [8448, 16, 1, 2816]
    - [161, 14.844]
  - - [704, 6784, 1, 3328]
    - [187, 83.162]
  - - [5888, 5888, 1, 1280]
    - [12, 90.198]
  - - [5056, 1024, 1, 1280]
    - [188, 71.852]
  - - [448, 5888, 1, 3328]
    - [126, 76.105]
  - - [3072, 2, 1, 1024]
    - [189, 0.51]
  - - [1024, 2944, 1, 1280]
    - [190, 58.34]
  - - [5056, 5888, 1, 1280]
    - [10, 87.538]
  - - [4288, 5888, 1, 128]
    - [70, 43.744]
  - - [256, 3584, 1, 256]
    - [191, 20.965]
  - - [256, 4, 1, 1280]
    - [100, 0.121]
  - - [1408, 3584, 1, 128]
    - [52, 28.682]
  - - [256, 2944, 1, 3328]
    - [124, 47.039]
  - - [448, 3584, 1, 128]
    - [191, 15.242]
  - - [5888, 2944, 1, 1280]
    - [192, 84.437]
  - - [4, 6784, 1, 1280]
    - [64, 2.415]
  - - [2368, 5888, 1, 128]
    - [85, 32.419]
  - - [35, 8457, 1, 1760]
    - [79, 21.131]
  - - [64, 2944, 1, 128]
    - [193, 3.035]
  - - [2368, 4, 1, 256]
    - [194, 0.34]
  - - [3584, 5888, 1, 256]
    - [108, 60.93]
  - - [2368, 1024, 1, 128]
    - [8, 21.801]
  - - [2368, 704, 1, 128]
    - [95, 17.045]
  - - [512, 32, 1, 512]
    - [100, 0.865]
  - - [3584, 2368, 1, 128]
    - [62, 37.382]
  - - [5056, 704, 1, 128]
    - [85, 27.031]
  - - [448, 2368, 1, 128]
    - [95, 12.444]
  - - [4, 5056, 1, 256]
    - [96, 0.659]
  - - [5056, 1408, 1, 3328]
    - [176, 85.786]
  - - [1408, 704, 1, 256]
    - [195, 20.84]
  - - [6784, 1024, 1, 3328]
    - [4, 83.9]
  - - [6784, 2944, 1, 3328]
    - [25, 90.306]
  - - [7680, 1, 1, 2560]
    - [196, 0.979]
  - - [1856, 1856, 1, 256]
    - [85, 37.047]
  - - [64, 64, 1, 3328]
    - [75, 1.292]
  - - [512, 1, 1, 512]
    - [135, 0.025]
  - - [6784, 2368, 1, 1280]
    - [197, 82.838]
  - - [4608, 2, 1, 1536]
    - [179, 1.107]
  - - [4288, 3584, 1, 256]
    - [26, 56.034]
  - - [4288, 5888, 1, 1280]
    - [63, 86.028]
  - - [4608, 4, 1, 1536]
    - [161, 1.961]
  - - [1024, 6000, 1, 1536]
    - [121, 72.617]
  - - [8448, 32, 1, 2816]
    - [198, 29.03]
  - - [448, 2944, 1, 3328]
    - [199, 64.722]
  - - [4288, 1856, 1, 1280]
    - [200, 73.908]
  - - [1856, 2944, 1, 3328]
    - [25, 84.698]
  - - [256, 6784, 1, 3328]
    - [201, 73.024]
  - - [512, 3000, 1, 1536]
    - [20, 51.943]
  - - [64, 5888, 1, 256]
    - [178, 10.026]
  - - [256, 5056, 1, 128]
    - [8, 14.944]
  - - [5056, 1024, 1, 256]
    - [62, 45.815]
  - - [704, 64, 1, 3328]
    - [202, 10.057]
  - - [5056, 1856, 1, 3328]
    - [92, 86.257]
  - - [4, 2944, 1, 3328]
    - [203, 2.188]
  - - [512, 1500, 1, 2048]
    - [142, 46.775]
  - - [1024, 1, 1, 500000]
    - [204, 1.45]
  - - [256, 4, 1, 256]
    - [179, 0.036]
  - - [6784, 128, 1, 3328]
    - [125, 58.125]
  - - [4288, 1408, 1, 128]
    - [85, 33.012]
  - - [1856, 5888, 1, 3328]
    - [205, 89.855]
  - - [4288, 5056, 1, 256]
    - [6, 59.583]
  - - [1408, 128, 1, 1280]
    - [206, 17.465]
  - - [4096, 7000, 1, 4096]
    - [207, 92.2]
  - - [5056, 256, 1, 3328]
    - [82, 63.841]
  - - [704, 704, 1, 256]
    - [54, 11.366]
  - - [1024, 3000, 1, 2560]
    - [107, 76.327]
  - - [1024, 5888, 1, 1280]
    - [108, 73.118]
  - - [6784, 2368, 1, 128]
    - [8, 38.273]
  - - [4, 5056, 1, 1280]
    - [208, 1.934]
  - - [256, 64, 1, 1280]
    - [36, 1.683]
  - - [128, 1856, 1, 1280]
    - [156, 22.929]
  - - [1856, 1024, 1, 1280]
    - [22, 61.377]
  - - [6784, 4288, 1, 1280]
    - [192, 87.144]
  - - [1856, 1856, 1, 1280]
    - [209, 67.155]
  - - [35, 1500, 1, 2048]
    - [40, 6.585]
  - - [3072, 24000, 1, 1024]
    - [210, 90.449]
  - - [1408, 5056, 1, 1280]
    - [153, 78.306]
  - - [4, 2368, 1, 3328]
    - [202, 2.082]
  - - [5888, 1856, 1, 128]
    - [62, 37.181]
  - - [448, 704, 1, 1280]
    - [211, 23.26]
  - - [448, 6784, 1, 128]
    - [212, 23.2]
  - - [1024, 448, 1, 3328]
    - [66, 52.441]
  - - [2944, 128, 1, 256]
    - [213, 8.761]
  - - [5056, 3584, 1, 128]
    - [170, 43.012]
  - - [5888, 5888, 1, 3328]
    - [10, 94.386]
  - - [6784, 1024, 1, 256]
    - [62, 45.267]
  - - [2944, 2368, 1, 256]
    - [8, 45.505]
  - - [256, 448, 1, 256]
    - [214, 3.819]
  - - [5056, 5888, 1, 3328]
    - [109, 92.095]
  - - [1856, 1024, 1, 256]
    - [215, 33.685]
  - - [512, 48000, 1, 1536]
    - [216, 88.403]
  - - [3584, 448, 1, 1280]
    - [190, 53.596]
  - - [1024, 1024, 1, 1280]
    - [217, 42.321]
  - - [448, 5888, 1, 256]
    - [62, 36.083]
  - - [2048, 128, 1, 2048]
    - [127, 28.598]
  - - [1408, 6784, 1, 3328]
    - [218, 89.136]
  - - [448, 1024, 1, 128]
    - [219, 5.487]
  - - [4288, 704, 1, 128]
    - [220, 24.015]
  - - [128, 1856, 1, 128]
    - [1, 3.609]
  - - [448, 2368, 1, 3328]
    - [109, 63.532]
  - - [5056, 64, 1, 128]
    - [221, 5.418]
  - - [5056, 2944, 1, 256]
    - [5, 55.169]
  - - [6784, 5888, 1, 128]
    - [192, 48.3]
  - - [1024, 700, 1, 512]
    - [0, 25.903]
  - - [3072, 1, 1, 128]
    - [39, 0.06]
  - - [1024, 4, 1, 256]
    - [219, 0.114]
  - - [2944, 704, 1, 128]
    - [222, 19.626]
  - - [128, 6784, 1, 1280]
    - [125, 48.055]
  - - [1408, 3584, 1, 3328]
    - [107, 79.977]
  - - [2368, 6784, 1, 256]
    - [81, 57.922]
  - - [5056, 1408, 1, 1280]
    - [192, 79.737]
  - - [5056, 4288, 1, 128]
    - [141, 41.926]
  - - [4, 704, 1, 256]
    - [100, 0.084]
  - - [4288, 2368, 1, 3328]
    - [223, 84.994]
  - - [1408, 1856, 1, 128]
    - [85, 23.717]
  - - [1408, 5888, 1, 3328]
    - [6, 85.281]
  - - [1856, 256, 1, 256]
    - [19, 12.348]
  - - [6784, 6784, 1, 256]
    - [70, 71.163]
  - - [5888, 5056, 1, 128]
    - [224, 46.19]
  - - [4288, 2368, 1, 128]
    - [8, 36.605]
  - - [128, 5888, 1, 1280]
    - [59, 41.309]
  - - [256, 4288, 1, 1280]
    - [115, 48.586]
  - - [2368, 2944, 1, 256]
    - [62, 50.332]
  - - [4, 1856, 1, 256]
    - [225, 0.274]
  - - [3584, 1856, 1, 1280]
    - [226, 75.318]
  - - [6784, 6784, 1, 128]
    - [227, 51.401]
  - - [256, 1856, 1, 128]
    - [228, 6.003]
  - - [704, 64, 1, 1280]
    - [103, 5.044]
  - - [5888, 5056, 1, 256]
    - [229, 66.768]
  - - [8448, 48000, 1, 2816]
    - [10, 97.334]
  - - [512, 6000, 1, 2048]
    - [109, 63.951]
  - - [3584, 448, 1, 256]
    - [230, 27.64]
  - - [448, 4288, 1, 128]
    - [231, 20.221]
  - - [7680, 64, 1, 2560]
    - [232, 55.28]
  - - [256, 6784, 1, 256]
    - [230, 30.717]
  - - [1408, 4288, 1, 128]
    - [85, 34.938]
  - - [2944, 704, 1, 3328]
    - [58, 77.497]
  - - [128, 448, 1, 256]
    - [39, 1.724]
  - - [2048, 32, 1, 2048]
    - [171, 9.002]
  - - [3584, 3584, 1, 256]
    - [62, 52.739]
  - - [448, 1408, 1, 128]
    - [233, 8.975]
  - - [128, 256, 1, 1280]
    - [96, 4.048]
  - - [3584, 5056, 1, 256]
    - [108, 58.66]
  - - [6784, 128, 1, 256]
    - [234, 20.905]
  - - [4288, 4, 1, 256]
    - [219, 0.497]
  - - [64, 1408, 1, 3328]
    - [235, 16.024]
  - - [704, 448, 1, 256]
    - [83, 9.068]
  - - [2944, 2368, 1, 1280]
    - [113, 78.224]
  - - [448, 64, 1, 3328]
    - [202, 7.182]
  - - [704, 6784, 1, 128]
    - [8, 32.118]
  - - [3584, 4, 1, 3328]
    - [140, 2.938]
  - - [6784, 3584, 1, 256]
    - [63, 61.494]
  - - [704, 448, 1, 128]
    - [236, 4.001]
  - - [256, 128, 1, 128]
    - [173, 0.559]
  - - [704, 1408, 1, 128]
    - [149, 12.964]
  - - [4, 448, 1, 128]
    - [98, 0.031]
  - - [4288, 128, 1, 1280]
    - [22, 30.377]
  - - [128, 1408, 1, 256]
    - [237, 4.317]
  - - [4, 2944, 1, 256]
    - [36, 0.412]
  - - [64, 128, 1, 3328]
    - [238, 2.485]
  - - [1856, 1408, 1, 256]
    - [85, 34.524]
  - - [5056, 2368, 1, 128]
    - [227, 38.07]
  - - [2944, 2944, 1, 3328]
    - [216, 89.115]
  - - [5056, 6784, 1, 256]
    - [5, 68.576]
  - - [1856, 3584, 1, 128]
    - [85, 36.17]
  - - [5888, 4, 1, 1280]
    - [38, 2.466]
  - - [128, 2944, 1, 128]
    - [138, 5.93]
  - - [35, 8457, 1, 2560]
    - [239, 24.171]
  - - [3584, 6784, 1, 128]
    - [224, 46.395]
  - - [128, 4288, 1, 256]
    - [240, 13.058]
  - - [704, 448, 1, 3328]
    - [168, 39.444]
  - - [2368, 6784, 1, 1280]
    - [197, 83.254]
  - - [128, 128, 1, 3328]
    - [50, 4.583]
  - - [5056, 1856, 1, 256]
    - [8, 45.321]
  - - [256, 128, 1, 256]
    - [31, 0.941]
  - - [1024, 3000, 1, 2816]
    - [197, 73.937]
  - - [1024, 1856, 1, 256]
    - [125, 29.882]
  - - [64, 1, 1, 1216]
    - [241, 0.008]
  - - [4288, 64, 1, 128]
    - [159, 4.359]
  - - [256, 448, 1, 3328]
    - [61, 20.686]
  - - [1408, 6784, 1, 1280]
    - [110, 80.315]
  - - [3584, 3584, 1, 1280]
    - [146, 82.663]
  - - [7680, 24000, 1, 2560]
    - [10, 96.429]
  - - [64, 2368, 1, 1280]
    - [84, 13.494]
  - - [448, 2368, 1, 1280]
    - [157, 40.441]
  - - [4608, 48000, 1, 1536]
    - [6, 95.443]
  - - [5888, 5888, 1, 128]
    - [227, 50.759]
  - - [64, 6784, 1, 3328]
    - [168, 50.468]
  - - [2944, 256, 1, 1280]
    - [191, 43.679]
  - - [2048, 16, 1, 2048]
    - [242, 4.994]
  - - [256, 2368, 1, 128]
    - [8, 8.918]
  - - [5056, 2368, 1, 3328]
    - [243, 87.95]
  - - [2944, 4288, 1, 256]
    - [85, 48.999]
  - - [1408, 3584, 1, 1280]
    - [69, 70.491]
  - - [2368, 64, 1, 256]
    - [244, 4.609]
  - - [1024, 128, 1, 128]
    - [148, 2.277]
  - - [704, 128, 1, 3328]
    - [44, 17.462]
  - - [5888, 4, 1, 128]
    - [173, 0.385]
  - - [1856, 704, 1, 256]
    - [62, 22.28]
  - - [1024, 1500, 1, 2816]
    - [226, 58.508]
  - - [8448, 1, 1, 2816]
    - [161, 1.032]
  - - [1024, 4, 1, 3328]
    - [48, 1.352]
  - - [1024, 6000, 1, 2048]
    - [16, 77.651]
  - - [512, 24000, 1, 2560]
    - [184, 89.474]
  - - [6144, 3000, 1, 2560]
    - [186, 88.735]
  - - [2368, 6784, 1, 3328]
    - [69, 89.582]
  - - [1856, 1408, 1, 1280]
    - [55, 62.097]
  - - [1856, 448, 1, 1280]
    - [240, 46.968]
  - - [6784, 704, 1, 128]
    - [85, 29.855]
  - - [4, 4, 1, 256]
    - [238, 0.001]
  - - [128, 5888, 1, 128]
    - [62, 9.486]
  - - [5056, 2944, 1, 128]
    - [8, 35.861]
  - - [1408, 5888, 1, 256]
    - [8, 50.846]
  - - [704, 2944, 1, 1280]
    - [109, 60.016]
  - - [4288, 64, 1, 1280]
    - [133, 23.571]
  - - [256, 64, 1, 256]
    - [31, 0.528]
  - - [1024, 1024, 1, 256]
    - [191, 19.519]
  - - [704, 1856, 1, 256]
    - [85, 23.578]
  - - [2560, 64, 1, 2560]
    - [245, 23.062]
  - - [3584, 704, 1, 1280]
    - [246, 60.361]
  - - [256, 128, 1, 1280]
    - [247, 3.538]
  - - [5888, 2368, 1, 256]
    - [81, 53.986]
  - - [256, 2368, 1, 1280]
    - [248, 37.159]
  - - [2944, 6784, 1, 128]
    - [5, 42.483]
  - - [3584, 448, 1, 3328]
    - [20, 67.533]
  - - [1408, 4, 1, 256]
    - [249, 0.195]
  - - [704, 2368, 1, 3328]
    - [170, 70.957]
  - - [2944, 448, 1, 256]
    - [141, 23.213]
  - - [1856, 448, 1, 128]
    - [62, 10.69]
  - - [4608, 6000, 1, 1536]
    - [210, 89.528]
  - - [2368, 128, 1, 1280]
    - [13, 25.736]
  - - [256, 5888, 1, 128]
    - [230, 16.651]
  - - [64, 6784, 1, 256]
    - [237, 11.187]
  - - [64, 5056, 1, 1280]
    - [78, 26.712]
  - - [4, 6784, 1, 128]
    - [39, 0.477]
  - - [3025, 64, 64, 64]
    - [85, 20.415]
  - - [2944, 2944, 1, 1280]
    - [250, 79.037]
  - - [5056, 448, 1, 3328]
    - [243, 72.998]
  - - [4, 3584, 1, 1280]
    - [235, 1.651]
  - - [1408, 128, 1, 128]
    - [178, 2.917]
  - - [6784, 704, 1, 3328]
    - [125, 85.226]
  - - [128, 64, 1, 1280]
    - [48, 1.205]
  - - [2368, 256, 1, 1280]
    - [212, 36.782]
  - - [4, 448, 1, 3328]
    - [251, 0.575]
  - - [5888, 4288, 1, 128]
    - [229, 45.019]
  - - [4, 5888, 1, 256]
    - [252, 0.826]
  - - [1408, 2944, 1, 3328]
    - [216, 82.919]
  - - [3584, 704, 1, 128]
    - [145, 22.375]
  - - [64, 1024, 1, 256]
    - [253, 1.982]
  - - [2368, 448, 1, 1280]
    - [254, 44.677]
  - - [128, 3584, 1, 256]
    - [255, 13.184]
  - - [704, 448, 1, 1280]
    - [138, 27.343]
  - - [448, 5056, 1, 128]
    - [95, 21.01]
  - - [6144, 4, 1, 2560]
    - [116, 3.32]
  - - [5056, 3584, 1, 256]
    - [70, 57.718]
  - - [4288, 4288, 1, 256]
    - [227, 58.639]
  - - [1408, 5056, 1, 128]
    - [85, 36.476]
  - - [2944, 3584, 1, 128]
    - [126, 35.932]
  - - [3584, 2368, 1, 256]
    - [70, 51.536]
  - - [5888, 5056, 1, 1280]
    - [5, 88.962]
  - - [128, 1024, 1, 1280]
    - [38, 14.782]
  - - [8448, 24000, 1, 2816]
    - [5, 96.899]
  - - [64, 704, 1, 256]
    - [37, 1.489]
  - - [4288, 256, 1, 1280]
    - [256, 48.951]
  - - [3584, 3584, 1, 3328]
    - [12, 89.999]
  - - [704, 64, 1, 128]
    - [31, 0.803]
  - - [3072, 1500, 1, 128]
    - [8, 26.832]
  - - [2048, 3136, 1, 512]
    - [257, 54.555]
  - - [3025, 256, 64, 64]
    - [126, 30.265]
  - - [5888, 6784, 1, 256]
    - [10, 67.1]
  - - [4288, 2944, 1, 3328]
    - [106, 90.672]
  - - [2944, 64, 1, 128]
    - [258, 3.201]
  - - [1024, 128, 1, 3328]
    - [144, 21.637]
  - - [1024, 16, 1, 500000]
    - [204, 21.044]
  - - [4288, 128, 1, 3328]
    - [175, 40.702]
  - - [7680, 128, 1, 2560]
    - [259, 69.894]
  - - [256, 5056, 1, 1280]
    - [250, 47.821]
  - - [1408, 256, 1, 128]
    - [178, 5.284]
  - - [2944, 5888, 1, 3328]
    - [108, 92.331]
  - - [6784, 5888, 1, 1280]
    - [170, 88.652]
  - - [3072, 1, 1, 1024]
    - [140, 0.318]
  - - [704, 128, 1, 256]
    - [96, 2.918]
  - - [5888, 4288, 1, 1280]
    - [108, 86.512]
  - - [1024, 24000, 1, 2048]
    - [216, 89.637]
  - - [448, 256, 1, 1280]
    - [161, 11.182]
  - - [5888, 3584, 1, 128]
    - [81, 40.557]
  - - [64, 4288, 1, 3328]
    - [183, 33.576]
  - - [448, 4, 1, 1280]
    - [51, 0.214]
  - - [6784, 6784, 1, 3328]
    - [25, 93.741]
  - - [5056, 4, 1, 1280]
    - [260, 2.266]
  - - [4, 5888, 1, 3328]
    - [194, 3.533]
  - - [256, 1408, 1, 1280]
    - [66, 32.449]
  - - [3072, 16, 1, 1024]
    - [261, 4.152]
  - - [704, 3584, 1, 128]
    - [262, 19.02]
  - - [1024, 2, 1, 512]
    - [263, 0.134]
  - - [5888, 448, 1, 3328]
    - [264, 77.92]
  - - [2368, 4288, 1, 1280]
    - [108, 78.597]
  - - [4288, 2944, 1, 128]
    - [6, 38.944]
  - - [256, 64, 1, 3328]
    - [265, 4.694]
  - - [2944, 64, 1, 3328]
    - [144, 32.463]
  - - [6784, 64, 1, 3328]
    - [66, 52.546]
  - - [5056, 2944, 1, 3328]
    - [205, 89.684]
  - - [448, 128, 1, 256]
    - [36, 1.43]
  - - [2944, 3584, 1, 256]
    - [234, 49.771]
  - - [1408, 1408, 1, 3328]
    - [266, 72.096]
  - - [1856, 128, 1, 1280]
    - [97, 24.963]
  - - [3584, 3584, 1, 128]
    - [62, 35.895]
  - - [64, 3584, 1, 256]
    - [267, 6.538]
  - - [1408, 4, 1, 3328]
    - [268, 1.544]
  - - [128, 2944, 1, 3328]
    - [80, 51.461]
  - - [3584, 704, 1, 256]
    - [85, 34.121]
  - - [2944, 448, 1, 3328]
    - [113, 67.159]
  - - [1024, 2, 1, 500000]
    - [269, 2.879]
  - - [3584, 1408, 1, 3328]
    - [270, 81.722]
  - - [704, 3584, 1, 1280]
    - [271, 59.109]
  - - [1024, 1408, 1, 128]
    - [62, 14.571]
  - - [1856, 6784, 1, 256]
    - [63, 49.159]
  - - [4288, 448, 1, 3328]
    - [259, 75.483]
  - - [6784, 4288, 1, 128]
    - [224, 45.978]
  - - [6784, 704, 1, 1280]
    - [125, 73.18]
  - - [6144, 1, 1, 2560]
    - [37, 0.911]
  - - [3584, 6784, 1, 256]
    - [215, 61.186]
  - - [6144, 16, 1, 2560]
    - [116, 14.513]
  - - [3584, 64, 1, 128]
    - [233, 3.982]
  - - [5888, 1024, 1, 3328]
    - [272, 81.247]
  - - [448, 64, 1, 128]
    - [273, 0.558]
  - - [704, 6784, 1, 1280]
    - [15, 77.296]
  - - [4, 448, 1, 256]
    - [100, 0.055]
  - - [5888, 128, 1, 256]
    - [141, 17.549]
  - - [4096, 16, 1, 4096]
    - [117, 12.803]
  - - [1856, 5056, 1, 3328]
    - [15, 86.851]
  - - [4, 6784, 1, 256]
    - [274, 0.85]
  - - [1024, 3584, 1, 128]
    - [275, 26.409]
  - - [64, 704, 1, 3328]
    - [276, 9.849]
  - - [2368, 2944, 1, 128]
    - [85, 35.726]
  - - [5056, 64, 1, 256]
    - [145, 9.479]
  - - [512, 1500, 1, 1536]
    - [125, 47.425]
  - - [512, 1, 1, 500000]
    - [277, 1.436]
  - - [5888, 2944, 1, 3328]
    - [186, 91.478]
  - - [128, 3584, 1, 1280]
    - [13, 37.707]
  - - [1024, 704, 1, 128]
    - [85, 9.386]
  - - [1408, 2368, 1, 128]
    - [126, 22.847]
  - - [5888, 2368, 1, 128]
    - [62, 32.664]
  - - [128, 5056, 1, 3328]
    - [236, 47.516]
  - - [3584, 6784, 1, 1280]
    - [170, 87.485]
  - - [4288, 1856, 1, 256]
    - [141, 51.816]
  - - [1856, 5888, 1, 256]
    - [20, 50.853]
  - - [256, 256, 1, 256]
    - [179, 1.875]
  - - [4288, 4288, 1, 3328]
    - [25, 91.854]
  - - [1024, 1024, 1, 128]
    - [8, 12.045]
  - - [4288, 1408, 1, 1280]
    - [107, 73.168]
  - - [3584, 5056, 1, 128]
    - [6, 43.392]
  - - [4, 1024, 1, 3328]
    - [265, 1.059]
  - - [4, 704, 1, 128]
    - [90, 0.045]
  - - [4288, 2368, 1, 256]
    - [8, 46.067]
  - - [2944, 5056, 1, 1280]
    - [227, 83.824]
  - - [448, 6784, 1, 256]
    - [278, 32.395]
  - - [64, 128, 1, 128]
    - [279, 0.14]
  - - [1856, 2368, 1, 128]
    - [62, 27.99]
  - - [6784, 2368, 1, 3328]
    - [270, 89.275]
  - - [1408, 6784, 1, 128]
    - [215, 38.698]
  - - [256, 1024, 1, 1280]
    - [168, 20.64]
  - - [704, 4, 1, 128]
    - [280, 0.049]
  - - [1408, 4, 1, 128]
    - [281, 0.091]
  - - [4288, 128, 1, 256]
    - [83, 13.702]
  - - [4288, 1856, 1, 3328]
    - [15, 81.778]
  - - [3584, 448, 1, 128]
    - [8, 17.163]
  - - [64, 4288, 1, 128]
    - [34, 4.584]
  - - [64, 448, 1, 3328]
    - [202, 6.126]
  - - [448, 4, 1, 3328]
    - [140, 0.495]
  - - [256, 4, 1, 3328]
    - [282, 0.309]
  - - [4, 1408, 1, 1280]
    - [283, 0.629]
  - - [3584, 64, 1, 1280]
    - [144, 21.532]
  - - [1408, 448, 1, 128]
    - [284, 7.736]
  - - [3584, 1024, 1, 1280]
    - [275, 70.67]
  - - [1856, 5056, 1, 256]
    - [246, 45.453]
  - - [4, 3584, 1, 256]
    - [179, 0.53]
  - - [6784, 4288, 1, 3328]
    - [210, 93.068]
  - - [4, 2944, 1, 1280]
    - [103, 1.222]
  - - [1024, 4288, 1, 256]
    - [10, 42.17]
  - - [5888, 3584, 1, 3328]
    - [108, 90.975]
  - - [1856, 4, 1, 256]
    - [36, 0.282]
  - - [4, 256, 1, 256]
    - [285, 0.033]
  - - [5056, 3584, 1, 3328]
    - [106, 90.884]
  - - [1408, 128, 1, 3328]
    - [79, 30.019]
  - - [4, 64, 1, 1280]
    - [100, 0.03]
  - - [2368, 1408, 1, 1280]
    - [92, 66.218]
  - - [5056, 2944, 1, 1280]
    - [81, 83.705]
  - - [8448, 6000, 1, 2816]
    - [106, 92.648]
  - - [4, 4, 1, 128]
    - [48, 0.0]
  - - [3584, 256, 1, 256]
    - [231, 20.579]
  - - [3584, 2944, 1, 1280]
    - [25, 81.802]
  - - [1024, 6784, 1, 256]
    - [230, 47.451]
  - - [4, 128, 1, 256]
    - [286, 0.013]
  - - [6784, 448, 1, 256]
    - [0, 30.219]
  - - [5124, 9124, 1, 2048]
    - [108, 91.172]
  - - [2944, 5056, 1, 3328]
    - [227, 89.732]
  - - [6784, 4, 1, 128]
    - [77, 0.447]
  - - [2944, 1408, 1, 128]
    - [62, 28.265]
  - - [448, 128, 1, 3328]
    - [287, 11.107]
  - - [64, 2944, 1, 3328]
    - [64, 27.506]
  - - [5056, 6784, 1, 3328]
    - [110, 93.666]
  - - [704, 2368, 1, 128]
    - [8, 17.054]
  - - [3072, 1500, 1, 1024]
    - [209, 70.009]
  - - [128, 2944, 1, 256]
    - [288, 10.285]
  - - [128, 6784, 1, 128]
    - [8, 11.766]
  - - [3584, 4288, 1, 256]
    - [74, 57.505]
  - - [448, 1856, 1, 256]
    - [8, 18.916]
  - - [1856, 6784, 1, 3328]
    - [106, 89.916]
  - - [3584, 128, 1, 3328]
    - [130, 53.431]
  - - [64, 1856, 1, 256]
    - [171, 3.555]
  - - [64, 448, 1, 256]
    - [96, 0.956]
  - - [5888, 4288, 1, 256]
    - [153, 61.37]
  - - [128, 1500, 1, 1280]
    - [37, 17.675]
  - - [5056, 1408, 1, 256]
    - [170, 52.022]
  - - [35, 8457, 1, 4096]
    - [83, 22.696]
  - - [64, 256, 1, 1280]
    - [100, 1.907]
  - - [2944, 4, 1, 128]
    - [179, 0.213]
  - - [3584, 1024, 1, 256]
    - [165, 38.969]
  - - [512, 6000, 1, 1536]
    - [109, 68.766]
  - - [256, 704, 1, 256]
    - [289, 5.519]
  - - [5888, 5888, 1, 256]
    - [229, 68.558]
  - - [4288, 1024, 1, 1280]
    - [187, 70.218]
  - - [5888, 128, 1, 3328]
    - [223, 46.455]
  - - [448, 6784, 1, 3328]
    - [200, 78.241]
  - - [2944, 1408, 1, 1280]
    - [16, 68.796]
  - - [3072, 6000, 1, 1024]
    - [24, 83.034]
  - - [1024, 32, 1, 512]
    - [36, 2.002]
  - - [2944, 1856, 1, 3328]
    - [109, 86.144]
  - - [2368, 64, 1, 128]
    - [267, 2.548]
  - - [256, 1024, 1, 128]
    - [290, 3.922]
  - - [3584, 5888, 1, 1280]
    - [170, 86.432]
  - - [64, 4, 1, 128]
    - [279, 0.003]
  - - [6784, 1856, 1, 1280]
    - [6, 81.232]
  - - [2944, 5056, 1, 256]
    - [10, 58.047]
  - - [5888, 256, 1, 3328]
    - [291, 63.923]
  - - [2944, 4288, 1, 128]
    - [10, 39.135]
  - - [3584, 1408, 1, 256]
    - [141, 44.865]
  - - [704, 3584, 1, 3328]
    - [88, 72.898]
  - - [5056, 448, 1, 1280]
    - [152, 55.131]
  - - [3584, 1856, 1, 3328]
    - [106, 87.394]
  - - [64, 1408, 1, 128]
    - [292, 1.588]
  - - [4288, 6784, 1, 1280]
    - [170, 87.088]
  - - [1024, 3000, 1, 2048]
    - [293, 68.1]
  - - [1408, 704, 1, 1280]
    - [294, 42.791]
  - - [2944, 1024, 1, 256]
    - [85, 35.915]
  - - [256, 64, 1, 128]
    - [295, 0.273]
  - - [2368, 4288, 1, 3328]
    - [106, 86.317]
  - - [4, 1408, 1, 256]
    - [296, 0.176]
  - - [1024, 1408, 1, 1280]
    - [55, 59.312]
  - - [64, 64, 1, 256]
    - [96, 0.137]
  - - [704, 256, 1, 3328]
    - [105, 29.659]
  - - [6784, 5056, 1, 256]
    - [108, 67.859]
  - - [1856, 1856, 1, 128]
    - [212, 25.996]
  - - [4288, 5888, 1, 256]
    - [223, 61.981]
  - - [4, 704, 1, 3328]
    - [100, 0.839]
  - - [35, 8457, 1, 2048]
    - [86, 23.017]
  - - [448, 2944, 1, 256]
    - [141, 25.563]
  - - [4, 4288, 1, 3328]
    - [297, 3.01]
  - - [2944, 6784, 1, 256]
    - [298, 57.342]
  - - [2944, 2944, 1, 128]
    - [62, 36.988]
  - - [4, 4, 1, 1280]
    - [251, 0.002]
  - - [1856, 3584, 1, 1280]
    - [25, 76.825]
  - - [64, 2944, 1, 256]
    - [253, 5.6]
  - - [3584, 1408, 1, 1280]
    - [270, 71.666]
  - - [448, 256, 1, 128]
    - [299, 2.013]
  - - [4288, 448, 1, 128]
    - [182, 18.869]
  - - [5056, 256, 1, 1280]
    - [300, 53.223]
  - - [1856, 1408, 1, 3328]
    - [187, 77.067]
  - - [128, 128, 1, 128]
    - [235, 0.23]
  - - [1024, 4288, 1, 3328]
    - [72, 85.522]
  - - [448, 2368, 1, 256]
    - [85, 21.037]
  - - [1024, 4, 1, 128]
    - [280, 0.075]
  - - [64, 1408, 1, 1280]
    - [61, 11.168]
  - - [64, 6784, 1, 1280]
    - [301, 36.542]
  - - [5056, 448, 1, 256]
    - [8, 32.96]
  - - [2944, 2368, 1, 3328]
    - [94, 85.535]
  - - [704, 4288, 1, 3328]
    - [270, 77.74]
  - - [1408, 128, 1, 256]
    - [61, 5.855]
  - - [1024, 1856, 1, 1280]
    - [76, 64.077]
  - - [6784, 1856, 1, 256]
    - [8, 49.683]
  - - [512, 48000, 1, 2816]
    - [170, 92.349]
  - - [512, 3000, 1, 2816]
    - [88, 63.409]
  - - [128, 2368, 1, 3328]
    - [80, 39.602]
  - - [1024, 5888, 1, 256]
    - [92, 43.212]
  - - [64, 2944, 1, 1280]
    - [42, 17.959]
  - - [6784, 1408, 1, 256]
    - [192, 46.195]
  - - [5056, 64, 1, 3328]
    - [232, 39.677]
  - - [128, 704, 1, 128]
    - [219, 1.528]
  - - [1408, 2368, 1, 256]
    - [62, 37.112]
  - - [1408, 1408, 1, 256]
    - [8, 29.918]
  - - [4, 64, 1, 128]
    - [100, 0.003]
  - - [64, 128, 1, 1280]
    - [48, 1.137]
  - - [1024, 8, 1, 500000]
    - [204, 11.232]
  - - [4, 2368, 1, 128]
    - [179, 0.149]
  - - [2368, 2368, 1, 128]
    - [141, 35.208]
  - - [64, 5888, 1, 128]
    - [219, 5.973]
  - - [5888, 4, 1, 3328]
    - [302, 3.544]
  - - [6784, 1408, 1, 128]
    - [303, 36.498]
  - - [1408, 5056, 1, 256]
    - [62, 49.687]
  - - [512, 50176, 1, 128]
    - [74, 46.631]
  - - [5056, 128, 1, 3328]
    - [85, 40.053]
  - - [128, 128, 1, 1280]
    - [304, 1.898]
  - - [512, 2, 1, 512]
    - [48, 0.065]
  - - [448, 704, 1, 256]
    - [237, 7.601]
  - - [4288, 3584, 1, 128]
    - [74, 36.631]
  - - [2944, 128, 1, 3328]
    - [168, 46.455]
  - - [128, 5056, 1, 1280]
    - [305, 37.73]
  - - [3584, 5056, 1, 1280]
    - [107, 83.579]
  - - [256, 448, 1, 1280]
    - [285, 10.766]
  - - [704, 704, 1, 128]
    - [8, 7.242]
  - - [5056, 4, 1, 128]
    - [306, 0.38]
  - - [704, 256, 1, 1280]
    - [42, 19.337]
  - - [64, 2368, 1, 3328]
    - [64, 27.124]
  - - [1856, 1024, 1, 128]
    - [8, 20.296]
  - - [1856, 64, 1, 128]
    - [260, 2.212]
  - - [4096, 64, 1, 4096]
    - [66, 36.711]
  - - [1024, 24000, 1, 1536]
    - [192, 87.937]
  - - [704, 4288, 1, 256]
    - [62, 34.757]
  - - [5888, 2368, 1, 1280]
    - [192, 81.19]
  - - [6784, 1856, 1, 3328]
    - [307, 88.407]
  - - [64, 128, 1, 256]
    - [37, 0.252]
  - - [2368, 5888, 1, 1280]
    - [24, 83.0]
  - - [5888, 256, 1, 1280]
    - [303, 49.509]
  - - [4, 5888, 1, 1280]
    - [148, 2.234]
  - - [704, 128, 1, 128]
    - [36, 1.517]
  - - [1024, 4, 1, 1280]
    - [48, 0.619]
  - - [2368, 1856, 1, 3328]
    - [308, 79.896]
  - - [2368, 128, 1, 128]
    - [166, 5.017]
  - - [2944, 704, 1, 256]
    - [85, 29.139]
  - - [5056, 128, 1, 128]
    - [159, 9.965]
  - - [2368, 1024, 1, 3328]
    - [309, 77.088]
  - - [35, 700, 1, 2048]
    - [268, 3.873]
  - - [256, 704, 1, 3328]
    - [64, 29.966]
  - - [704, 3584, 1, 256]
    - [110, 35.46]
  - - [704, 2944, 1, 3328]
    - [188, 74.285]
  - - [6784, 1024, 1, 128]
    - [8, 35.9]
  - - [256, 448, 1, 128]
    - [206, 1.82]
  - - [448, 1024, 1, 3328]
    - [13, 58.25]
  - - [2944, 1024, 1, 3328]
    - [270, 78.012]
  - - [2944, 5056, 1, 128]
    - [257, 39.207]
  - - [2368, 256, 1, 256]
    - [85, 14.208]
  - - [1408, 6784, 1, 256]
    - [275, 46.399]
  - - [6784, 1408, 1, 3328]
    - [310, 87.82]
  - - [4288, 6784, 1, 128]
    - [207, 47.13]
  - - [1408, 2944, 1, 128]
    - [85, 29.308]
  - - [704, 64, 1, 256]
    - [311, 1.579]
  - - [3072, 4, 1, 1024]
    - [38, 1.294]
  - - [256, 2368, 1, 3328]
    - [136, 38.326]
  - - [6784, 2944, 1, 1280]
    - [132, 84.708]
  - - [4288, 1856, 1, 128]
    - [62, 35.268]
  - - [1856, 2944, 1, 128]
    - [85, 32.228]
  - - [6784, 448, 1, 128]
    - [8, 24.395]
  - - [64, 3584, 1, 128]
    - [289, 3.35]
  - - [448, 5056, 1, 1280]
    - [85, 54.633]
  - - [4288, 5056, 1, 1280]
    - [197, 84.784]
  - - [2368, 1856, 1, 128]
    - [85, 29.958]
  - - [128, 448, 1, 1280]
    - [103, 6.586]
  - - [4288, 704, 1, 256]
    - [85, 36.178]
  - - [256, 3584, 1, 128]
    - [0, 11.269]
  - - [5888, 704, 1, 256]
    - [8, 39.97]
  - - [3584, 1024, 1, 128]
    - [169, 24.752]
  - - [256, 5888, 1, 3328]
    - [106, 64.854]
  - - [1408, 4288, 1, 3328]
    - [10, 82.56]
  - - [6784, 4288, 1, 256]
    - [81, 64.502]
  - - [4288, 256, 1, 128]
    - [312, 13.977]
  - - [448, 1856, 1, 3328]
    - [24, 51.569]
  - - [5888, 256, 1, 256]
    - [170, 26.981]
  - - [1024, 4, 1, 500000]
    - [269, 5.78]
  - - [6784, 1024, 1, 1280]
    - [72, 76.022]
  - - [5888, 1024, 1, 128]
    - [85, 33.331]
  - - [1024, 128, 1, 256]
    - [44, 3.948]
  - - [512, 16, 1, 500000]
    - [277, 21.17]
  - - [128, 64, 1, 3328]
    - [48, 2.54]
  - - [448, 64, 1, 256]
    - [296, 1.055]
  - - [2368, 256, 1, 128]
    - [313, 6.984]
  - - [6784, 3584, 1, 1280]
    - [170, 86.193]
  - - [1024, 6784, 1, 1280]
    - [176, 76.566]
  - - [2944, 64, 1, 1280]
    - [156, 15.893]
  - - [1408, 2944, 1, 1280]
    - [192, 65.442]
  - - [256, 1856, 1, 256]
    - [168, 11.011]
  - - [1408, 2368, 1, 3328]
    - [95, 78.062]
  - - [2944, 4, 1, 3328]
    - [276, 2.569]
  - - [128, 1408, 1, 3328]
    - [99, 28.173]
  - - [2944, 1856, 1, 128]
    - [62, 33.512]
  - - [256, 2944, 1, 128]
    - [85, 9.865]
  - - [256, 6784, 1, 128]
    - [142, 15.968]
  - - [2368, 4, 1, 128]
    - [189, 0.151]
  - - [1408, 256, 1, 3328]
    - [168, 46.29]
  - - [1856, 4, 1, 128]
    - [314, 0.113]
  - - [1024, 16, 1, 512]
    - [36, 0.9]
  - - [5056, 6784, 1, 128]
    - [227, 46.876]
  - - [4288, 5056, 1, 128]
    - [85, 41.591]
  - - [1856, 5888, 1, 128]
    - [62, 36.163]
  - - [7680, 2, 1, 2560]
    - [116, 2.095]
  - - [3584, 1856, 1, 256]
    - [62, 50.945]
  - - [4288, 3584, 1, 1280]
    - [315, 82.061]
  - - [2368, 448, 1, 256]
    - [8, 21.316]
  - - [4288, 256, 1, 3328]
    - [254, 64.52]
  - - [1856, 704, 1, 128]
    - [62, 14.497]
  - - [1408, 64, 1, 256]
    - [316, 2.619]
  - - [64, 1856, 1, 128]
    - [317, 2.151]
  - - [4, 256, 1, 128]
    - [36, 0.018]
  - - [512, 16, 1, 512]
    - [100, 0.407]
  - - [704, 5888, 1, 128]
    - [85, 29.473]
  - - [6784, 3584, 1, 128]
    - [5, 43.267]
  - - [1024, 64, 1, 256]
    - [39, 1.839]
  - - [64, 2368, 1, 256]
    - [296, 4.468]
  - - [5124, 1500, 1, 2048]
    - [10, 76.466]
  - - [4288, 5056, 1, 3328]
    - [205, 92.143]
  - - [4, 1856, 1, 1280]
    - [50, 0.874]
  - - [4288, 128, 1, 128]
    - [305, 8.342]
  - - [512, 2, 1, 500000]
    - [277, 2.845]
  - - [1408, 1408, 1, 128]
    - [95, 19.098]
  - - [7680, 16, 1, 2560]
    - [225, 15.72]
  - - [1856, 128, 1, 128]
    - [166, 4.134]
  - - [5056, 2368, 1, 256]
    - [9, 50.687]
  - - [4288, 704, 1, 3328]
    - [266, 78.793]
  - - [448, 3584, 1, 256]
    - [318, 26.096]
  - - [2368, 64, 1, 1280]
    - [252, 14.314]
  - - [2368, 1024, 1, 1280]
    - [319, 58.989]
  - - [2944, 1408, 1, 3328]
    - [210, 83.385]
  - - [6144, 1500, 1, 2560]
    - [315, 82.213]
  - - [4224, 1, 1, 128]
    - [39, 0.078]
  - - [1024, 1408, 1, 3328]
    - [153, 72.439]
  - - [2944, 5888, 1, 1280]
    - [5, 86.763]
  - - [8448, 2, 1, 2816]
    - [161, 1.874]
  - - [1408, 4, 1, 1280]
    - [48, 0.83]
  - - [5888, 3584, 1, 256]
    - [319, 59.475]
  - - [2368, 5056, 1, 128]
    - [62, 39.269]
  - - [1408, 1856, 1, 3328]
    - [207, 75.78]
  - - [4, 4, 1, 3328]
    - [204, 0.004]
  - - [5888, 5056, 1, 3328]
    - [10, 92.214]
  - - [7680, 6000, 1, 2560]
    - [10, 95.012]
  - - [6784, 1408, 1, 1280]
    - [110, 82.06]
  - - [4, 1024, 1, 1280]
    - [100, 0.45]
  - - [512, 3000, 1, 2560]
    - [187, 59.851]
  - - [704, 2944, 1, 256]
    - [62, 28.298]
  - - [4288, 64, 1, 256]
    - [178, 7.463]
  - - [6784, 5888, 1, 3328]
    - [88, 93.272]
  - - [2368, 4288, 1, 128]
    - [85, 36.217]
  - - [64, 4288, 1, 1280]
    - [232, 24.711]
  - - [6784, 64, 1, 1280]
    - [237, 30.806]
  - - [3584, 128, 1, 128]
    - [320, 6.942]
  - - [1024, 6784, 1, 128]
    - [52, 31.78]
  - - [1024, 1500, 1, 1536]
    - [110, 49.236]
  - - [1408, 64, 1, 3328]
    - [235, 17.302]
  - - [6784, 4, 1, 256]
    - [260, 0.815]
  - - [1408, 1408, 1, 1280]
    - [109, 53.893]
  - - [256, 2368, 1, 256]
    - [85, 13.998]
  - - [3072, 3000, 1, 1024]
    - [110, 74.934]
  - - [448, 4288, 1, 3328]
    - [20, 77.799]
  - - [2368, 1408, 1, 256]
    - [62, 37.079]
  - - [704, 2368, 1, 256]
    - [85, 26.867]
  - - [1024, 24000, 1, 2560]
    - [181, 90.752]
  - - [2944, 448, 1, 1280]
    - [104, 51.911]
  - - [5888, 2368, 1, 3328]
    - [24, 88.546]
  - - [1024, 256, 1, 128]
    - [167, 4.15]
  - - [5124, 9124, 1, 1760]
    - [70, 91.611]
  - - [448, 1408, 1, 1280]
    - [95, 34.671]
  - - [448, 1856, 1, 1280]
    - [240, 44.746]
  - - [4288, 448, 1, 1280]
    - [62, 62.622]
  - - [5888, 704, 1, 3328]
    - [321, 79.032]
  - - [4, 1856, 1, 128]
    - [322, 0.113]
  - - [5056, 256, 1, 128]
    - [323, 13.248]
  - - [1856, 256, 1, 128]
    - [301, 7.788]
  - - [128, 2368, 1, 256]
    - [222, 7.558]
  - - [704, 4, 1, 256]
    - [238, 0.093]
  - - [1024, 6784, 1, 3328]
    - [319, 84.436]
  - - [1408, 5888, 1, 128]
    - [85, 33.37]
  - - [4288, 4, 1, 128]
    - [159, 0.309]
  - - [512, 3136, 1, 2048]
    - [170, 60.787]
  - - [1408, 1024, 1, 256]
    - [62, 28.054]
  - - [128, 64, 1, 256]
    - [103, 0.27]
  - - [8448, 1500, 1, 2816]
    - [210, 87.747]
  - - [256, 704, 1, 128]
    - [61, 3.345]
  - - [2560, 7000, 1, 2560]
    - [25, 87.864]
  - - [5888, 64, 1, 1280]
    - [66, 33.035]
  - - [128, 4, 1, 3328]
    - [238, 0.142]
  - - [5056, 6784, 1, 1280]
    - [10, 89.792]
  - - [1024, 448, 1, 1280]
    - [301, 37.878]
  - - [704, 5056, 1, 3328]
    - [92, 78.716]
  - - [128, 5056, 1, 256]
    - [8, 14.797]
  - - [3584, 5056, 1, 3328]
    - [25, 90.269]
  - - [1856, 4, 1, 3328]
    - [283, 1.863]
  - - [4, 2944, 1, 128]
    - [116, 0.222]
  - - [2368, 2944, 1, 3328]
    - [324, 85.655]
  - - [448, 448, 1, 1280]
    - [64, 21.718]
  - - [128, 4, 1, 128]
    - [279, 0.009]
  - - [2368, 3584, 1, 256]
    - [87, 55.085]
  - - [4608, 3000, 1, 1536]
    - [107, 83.662]
  - - [1024, 256, 1, 1280]
    - [80, 20.958]
  - - [5056, 3584, 1, 1280]
    - [107, 83.456]
  - - [5124, 9124, 1, 4096]
    - [10, 93.09]
  - - [7680, 48000, 1, 2560]
    - [5, 97.454]
  - - [1856, 704, 1, 1280]
    - [325, 54.924]
  - - [1856, 2944, 1, 1280]
    - [188, 76.065]
  - - [4608, 1500, 1, 1536]
    - [324, 75.06]
  - - [1024, 48000, 1, 2816]
    - [326, 93.212]
  - - [5124, 9124, 1, 2560]
    - [108, 92.02]
  - - [128, 1024, 1, 256]
    - [249, 4.348]
  - - [2944, 1408, 1, 256]
    - [8, 42.541]
  - - [4288, 1408, 1, 3328]
    - [108, 83.235]
  - - [3584, 64, 1, 3328]
    - [97, 32.257]
  - - [5888, 2944, 1, 128]
    - [157, 40.006]
  - - [2944, 1024, 1, 128]
    - [8, 23.709]
  - - [128, 1, 1, 1024]
    - [327, 0.015]
  - - [5124, 700, 1, 2048]
    - [328, 70.905]
  - - [4, 4288, 1, 1280]
    - [36, 2.014]
  - - [6784, 5056, 1, 128]
    - [67, 52.026]
  - - [256, 1024, 1, 3328]
    - [183, 35.682]
  - - [3584, 4, 1, 256]
    - [329, 0.463]
  - - [1856, 64, 1, 3328]
    - [235, 20.957]
  - - [4, 128, 1, 3328]
    - [330, 0.137]
  - - [256, 12544, 1, 1024]
    - [331, 58.765]
  - - [5888, 1408, 1, 3328]
    - [10, 85.608]
  - - [448, 2944, 1, 128]
    - [278, 15.921]
  - - [2368, 1856, 1, 256]
    - [152, 43.793]
  - - [256, 5056, 1, 256]
    - [231, 22.299]
  - - [5056, 5056, 1, 128]
    - [70, 44.807]
  - - [448, 3584, 1, 3328]
    - [7, 67.888]
  - - [4, 5056, 1, 3328]
    - [103, 3.086]
  - - [256, 256, 1, 128]
    - [118, 1.002]
  - - [5888, 256, 1, 128]
    - [230, 16.377]
  - - [4, 5056, 1, 128]
    - [332, 0.38]
  - - [448, 256, 1, 256]
    - [44, 3.719]
  - - [704, 4, 1, 3328]
    - [140, 0.928]
  - - [1408, 256, 1, 256]
    - [237, 10.135]
  - - [3584, 1856, 1, 128]
    - [8, 35.458]
  - - [4288, 4288, 1, 128]
    - [10, 38.653]
  - - [1856, 1024, 1, 3328]
    - [209, 78.68]
  - - [1856, 4288, 1, 128]
    - [8, 37.693]
  - - [1024, 6000, 1, 2560]
    - [70, 82.142]
  - - [1024, 5056, 1, 256]
    - [230, 43.663]
  - - [5056, 5888, 1, 128]
    - [70, 49.421]
  - - [2368, 1408, 1, 3328]
    - [240, 77.699]
  - - [1024, 48000, 1, 1536]
    - [10, 90.878]
  - - [5888, 448, 1, 256]
    - [230, 31.227]
  - - [5888, 6784, 1, 128]
    - [5, 55.282]
  - - [2368, 4, 1, 3328]
    - [140, 2.332]
  - - [6784, 5056, 1, 1280]
    - [5, 89.727]
  - - [5056, 704, 1, 1280]
    - [209, 67.981]
  - - [1024, 48000, 1, 2560]
    - [108, 92.519]
  - - [4608, 32, 1, 1536]
    - [97, 16.61]
  - - [1024, 2368, 1, 128]
    - [305, 21.943]
  - - [128, 704, 1, 256]
    - [179, 2.183]
  - - [2368, 448, 1, 3328]
    - [266, 57.338]
  - - [128, 5888, 1, 3328]
    - [85, 45.454]
  - - [448, 128, 1, 1280]
    - [77, 6.92]
  - - [6784, 4, 1, 3328]
    - [156, 3.676]
  - - [4288, 4, 1, 1280]
    - [116, 1.738]
  - - [1024, 64, 1, 3328]
    - [333, 12.024]
  - - [3072, 48000, 1, 1024]
    - [10, 93.261]
  - - [256, 4, 1, 128]
    - [334, 0.019]
  - - [1024, 5888, 1, 128]
    - [88, 31.649]
  - - [3584, 5888, 1, 128]
    - [62, 39.659]
  - - [5056, 5888, 1, 256]
    - [227, 64.138]
  - - [2368, 1024, 1, 256]
    - [246, 30.775]
  - - [2944, 1856, 1, 256]
    - [335, 43.236]
  - - [1856, 6784, 1, 1280]
    - [25, 83.399]
  - - [64, 5056, 1, 128]
    - [336, 4.787]
  - - [64, 6784, 1, 128]
    - [178, 6.774]
  - - [448, 704, 1, 128]
    - [79, 5.143]
  - - [4, 1024, 1, 128]
    - [297, 0.061]
  - - [1408, 448, 1, 256]
    - [89, 15.806]
  - - [1408, 704, 1, 128]
    - [54, 10.861]
  - - [64, 256, 1, 3328]
    - [265, 4.784]
  - - [8448, 3000, 1, 2816]
    - [108, 90.171]
  - - [6784, 448, 1, 3328]
    - [69, 77.79]
  - - [5056, 1856, 1, 1280]
    - [110, 77.599]
  - - [1408, 1024, 1, 3328]
    - [232, 72.341]
  - - [2368, 256, 1, 3328]
    - [124, 37.094]
  - - [7680, 1500, 1, 2560]
    - [325, 87.646]
  - - [5888, 3584, 1, 1280]
    - [5, 85.64]
  - - [1856, 3584, 1, 3328]
    - [337, 87.88]
  - - [5888, 128, 1, 1280]
    - [88, 43.567]
  - - [1024, 2944, 1, 256]
    - [195, 35.477]
  - - [448, 6784, 1, 1280]
    - [21, 56.564]
  - - [256, 3584, 1, 1280]
    - [338, 50.717]
  - - [448, 128, 1, 128]
    - [339, 1.068]
  - - [704, 5056, 1, 256]
    - [340, 38.477]
  - - [3584, 1024, 1, 3328]
    - [341, 80.815]
  - - [2944, 1856, 1, 1280]
    - [109, 75.619]
  - - [128, 256, 1, 128]
    - [173, 0.536]
  - - [5056, 256, 1, 256]
    - [85, 23.206]
  - - [2944, 4288, 1, 3328]
    - [74, 88.951]
  - - [2368, 3584, 1, 3328]
    - [108, 87.544]
  - - [2944, 704, 1, 1280]
    - [188, 61.691]
  - - [128, 4, 1, 256]
    - [249, 0.017]
  - - [2944, 3584, 1, 1280]
    - [151, 81.081]
  - - [1856, 5888, 1, 1280]
    - [342, 79.697]
  - - [256, 256, 1, 1280]
    - [343, 7.079]
  - - [4608, 24000, 1, 1536]
    - [5, 93.682]
  - - [4288, 1408, 1, 256]
    - [62, 49.682]
  - - [3584, 64, 1, 256]
    - [219, 5.742]
  - - [64, 1856, 1, 3328]
    - [37, 22.013]
  - - [256, 1408, 1, 128]
    - [245, 6.207]
  - - [5888, 1408, 1, 128]
    - [62, 35.91]
  - - [4288, 2368, 1, 1280]
    - [25, 78.663]
  - - [4, 4288, 1, 256]
    - [158, 0.55]
  - - [256, 4288, 1, 128]
    - [152, 12.184]
  - - [256, 128, 1, 3328]
    - [202, 7.747]
  - - [512, 8, 1, 500000]
    - [277, 11.386]
  - - [6784, 2368, 1, 256]
    - [8, 52.477]
  - - [5888, 128, 1, 128]
    - [338, 9.164]
  - - [1408, 448, 1, 3328]
    - [344, 43.768]
  - - [1024, 24000, 1, 2816]
    - [216, 91.528]
  - - [704, 1024, 1, 1280]
    - [209, 38.128]
  - - [1856, 256, 1, 3328]
    - [301, 55.075]
  - - [1856, 2944, 1, 256]
    - [62, 44.936]
  - - [5056, 1024, 1, 128]
    - [335, 29.364]
  - - [64, 5888, 1, 1280]
    - [80, 27.316]
  - - [7680, 3000, 1, 2560]
    - [132, 90.927]
  - - [4224, 1500, 1, 176]
    - [62, 38.161]
  - - [5124, 700, 1, 2560]
    - [345, 74.595]
  - - [6784, 256, 1, 128]
    - [25, 16.896]
  - - [5888, 704, 1, 128]
    - [141, 29.73]
  - - [6784, 64, 1, 128]
    - [284, 6.926]
  - - [4, 448, 1, 1280]
    - [282, 0.272]
  - - [1024, 4288, 1, 1280]
    - [82, 70.904]
  - - [2368, 5056, 1, 3328]
    - [209, 85.886]
  - - [448, 4, 1, 128]
    - [329, 0.029]
  - - [4, 256, 1, 3328]
    - [346, 0.309]
  - - [4288, 1024, 1, 3328]
    - [347, 84.473]
  - - [6144, 48000, 1, 2560]
    - [67, 96.815]
  - - [1024, 5056, 1, 3328]
    - [197, 82.67]
  - - [1024, 1856, 1, 3328]
    - [331, 77.059]
  - - [704, 704, 1, 1280]
    - [195, 27.553]
  - - [128, 2368, 1, 1280]
    - [19, 25.485]
  - - [3584, 4, 1, 128]
    - [348, 0.268]
  - - [3584, 256, 1, 1280]
    - [349, 52.704]
  - - [4, 128, 1, 128]
    - [36, 0.009]
  - - [128, 4288, 1, 3328]
    - [350, 37.634]
  - - [5124, 1500, 1, 2560]
    - [264, 77.398]
  - - [3584, 128, 1, 1280]
    - [127, 34.46]
  - - [4, 256, 1, 1280]
    - [48, 0.144]
  - - [128, 704, 1, 3328]
    - [102, 17.503]
  - - [4288, 6784, 1, 256]
    - [12, 65.107]
  - - [3584, 2944, 1, 3328]
    - [106, 89.63]
  - - [128, 1856, 1, 256]
    - [260, 5.949]
  - - [64, 4288, 1, 256]
    - [33, 8.461]
  - - [4, 3584, 1, 3328]
    - [103, 2.539]
  - - [64, 4, 1, 3328]
    - [346, 0.074]
  - - [4, 64, 1, 3328]
    - [238, 0.084]
  - - [35, 700, 1, 2560]
    - [351, 4.242]
  - - [5888, 2944, 1, 256]
    - [352, 56.895]
  - - [4, 2368, 1, 256]
    - [34, 0.259]
  - - [1856, 64, 1, 256]
    - [117, 4.054]
  - - [5056, 128, 1, 1280]
    - [312, 35.794]
  - - [448, 4288, 1, 1280]
    - [87, 65.986]
  - - [256, 4288, 1, 256]
    - [95, 21.743]
  - - [1024, 4288, 1, 128]
    - [85, 28.499]
  - - [4, 1024, 1, 256]
    - [101, 0.114]
  - - [5056, 4288, 1, 256]
    - [229, 60.989]
  - - [1024, 448, 1, 256]
    - [13, 13.304]
  - - [1024, 3584, 1, 256]
    - [353, 42.003]
  - - [2944, 128, 1, 1280]
    - [168, 31.165]
  - - [2560, 32, 1, 2560]
    - [61, 13.072]
  - - [64, 256, 1, 256]
    - [100, 0.491]
  - - [1024, 4, 1, 512]
    - [343, 0.256]
  - - [128, 2368, 1, 128]
    - [1, 5.303]
  - - [256, 704, 1, 1280]
    - [97, 17.269]
  - - [64, 2368, 1, 128]
    - [354, 2.519]
  - - [176, 1500, 1, 1408]
    - [245, 23.78]
  - - [448, 5888, 1, 1280]
    - [17, 63.736]
  - - [512, 3000, 1, 2048]
    - [125, 56.755]
  - - [5056, 448, 1, 128]
    - [234, 20.962]
  - - [4288, 704, 1, 1280]
    - [352, 57.334]
  - - [3584, 2944, 1, 128]
    - [62, 36.331]
  - - [6784, 256, 1, 1280]
    - [230, 59.652]
  - - [256, 2944, 1, 1280]
    - [240, 42.503]
  - - [2560, 128, 1, 2560]
    - [183, 39.765]
  - - [2368, 5888, 1, 3328]
    - [200, 89.67]
  - - [4, 64, 1, 256]
    - [140, 0.009]
  - - [704, 1024, 1, 3328]
    - [209, 45.516]
  - - [2368, 1856, 1, 1280]
    - [191, 69.912]
  - - [448, 5056, 1, 3328]
    - [19, 73.473]
  - - [128, 448, 1, 128]
    - [296, 0.772]
  - - [128, 6784, 1, 256]
    - [305, 20.333]
  - - [512, 4, 1, 500000]
    - [277, 5.659]
  - - [3584, 4288, 1, 128]
    - [91, 36.505]
  - - [64, 448, 1, 128]
    - [355, 0.487]
  - - [1024, 6000, 1, 2816]
    - [21, 81.064]
  - - [5888, 4288, 1, 3328]
    - [5, 91.447]
  - - [2368, 704, 1, 256]
    - [85, 25.025]
  - - [256, 1856, 1, 3328]
    - [80, 57.58]
  - - [1856, 128, 1, 256]
    - [356, 6.652]
  - - [6784, 128, 1, 128]
    - [141, 11.969]
  - - [3584, 1408, 1, 128]
    - [62, 32.894]
  - - [1856, 5056, 1, 1280]
    - [308, 79.853]
  - - [2944, 1024, 1, 1280]
    - [266, 65.287]
  - - [5056, 4, 1, 256]
    - [37, 0.546]
  - - [3584, 5888, 1, 3328]
    - [170, 91.29]
  - - [2368, 4288, 1, 256]
    - [112, 48.454]
  - - [1024, 2368, 1, 3328]
    - [357, 77.414]
  - - [128, 3584, 1, 128]
    - [28, 7.686]
  - - [704, 1408, 1, 256]
    - [178, 18.793]
  - - [4096, 128, 1, 4096]
    - [26, 38.818]
  - - [1024, 2944, 1, 128]
    - [85, 25.132]
  - - [1024, 3584, 1, 1280]
    - [22, 69.179]
  - - [4288, 5888, 1, 3328]
    - [25, 92.322]
  - - [4288, 4, 1, 3328]
    - [161, 3.306]
  - - [4608, 16, 1, 1536]
    - [244, 7.67]
  - - [5888, 64, 1, 128]
    - [239, 5.223]
  - - [4, 5888, 1, 128]
    - [36, 0.414]
  - - [1024, 2944, 1, 3328]
    - [121, 77.447]
  - - [2048, 64, 1, 2048]
    - [235, 16.832]
  - - [6144, 2, 1, 2560]
    - [244, 1.812]
  - - [256, 6784, 1, 1280]
    - [25, 56.584]
  - - [1856, 3584, 1, 256]
    - [88, 50.781]
  - - [128, 448, 1, 3328]
    - [185, 11.356]
  - - [6784, 1856, 1, 128]
    - [10, 39.215]
  - - [1024, 1500, 1, 2048]
    - [358, 58.157]
  - - [5056, 128, 1, 256]
    - [167, 12.491]
  - - [512, 24000, 1, 2816]
    - [181, 89.908]
  - - [256, 5888, 1, 1280]
    - [230, 48.29]
  - - [4, 128, 1, 1280]
    - [51, 0.068]
  - - [4288, 6784, 1, 3328]
    - [110, 92.266]
  - - [6784, 128, 1, 1280]
    - [337, 52.642]
  - - [64, 1408, 1, 256]
    - [219, 2.761]
  - - [2368, 1408, 1, 128]
    - [85, 24.155]
  - - [1856, 448, 1, 256]
    - [8, 19.423]
  - - [1408, 1024, 1, 128]
    - [157, 16.485]
  - - [128, 64, 1, 128]
    - [359, 0.147]
  - - [6784, 3584, 1, 3328]
    - [110, 92.589]
  - - [1760, 7000, 1, 1760]
    - [15, 85.477]
  - - [1024, 704, 1, 3328]
    - [25, 45.914]
  - - [64, 64, 1, 128]
    - [39, 0.065]
  - - [2368, 5056, 1, 1280]
    - [170, 80.062]
  - - [64, 4, 1, 1280]
    - [50, 0.029]
  - - [1408, 2368, 1, 1280]
    - [358, 64.594]
  - - [128, 1408, 1, 1280]
    - [206, 15.834]
  - - [1024, 1, 1, 512]
    - [48, 0.059]
  - - [4, 1408, 1, 128]
    - [39, 0.083]
  - - [704, 4288, 1, 128]
    - [312, 20.351]
  - - [128, 1856, 1, 3328]
    - [37, 33.47]
  - - [2944, 2944, 1, 256]
    - [92, 51.798]
  - - [2944, 4, 1, 1280]
    - [102, 1.426]
  - - [5888, 4, 1, 256]
    - [31, 0.73]
  - - [6784, 256, 1, 256]
    - [85, 30.133]
  - - [256, 5056, 1, 3328]
    - [360, 65.103]
  - - [128, 4288, 1, 1280]
    - [361, 31.678]
  - - [5056, 1856, 1, 128]
    - [85, 34.246]
  - - [1024, 3000, 1, 1536]
    - [21, 64.608]
  - - [5056, 1024, 1, 3328]
    - [254, 83.945]
  - - [128, 128, 1, 256]
    - [362, 0.542]
  - - [1760, 64, 1, 1760]
    - [171, 16.434]
  - - [4288, 3584, 1, 3328]
    - [205, 90.775]
  - - [448, 704, 1, 3328]
    - [363, 42.192]
  - - [448, 448, 1, 128]
    - [260, 2.935]
  - - [1024, 2368, 1, 1280]
    - [230, 57.521]
  - - [1856, 704, 1, 3328]
    - [127, 64.594]
  - - [512, 1500, 1, 2560]
    - [364, 52.42]
  - - [5888, 6784, 1, 3328]
    - [170, 93.436]
  - - [704, 4288, 1, 1280]
    - [125, 56.535]
  - - [128, 50176, 1, 512]
    - [93, 58.351]
  - - [704, 256, 1, 256]
    - [306, 5.728]
  - - [1024, 48000, 1, 2048]
    - [5, 92.36]
  - - [4288, 1024, 1, 128]
    - [92, 27.549]
  - - [3136, 64, 128, 64]
    - [8, 24.987]
  - - [784, 128, 128, 512]
    - [106, 63.154]
  - - [784, 512, 256, 128]
    - [20, 53.425]
  - - [3136, 256, 256, 64]
    - [3, 36.819]
  - - [3136, 64, 128, 256]
    - [230, 51.906]
  - - [3136, 64, 256, 64]
    - [365, 27.501]
  - - [784, 512, 128, 128]
    - [170, 51.596]
  - - [784, 128, 256, 512]
    - [106, 69.147]
  - - [3136, 64, 256, 256]
    - [230, 54.805]
  - - [3136, 256, 128, 64]
    - [62, 34.581]
  - - [1024, 256, 1, 1024]
    - [133, 18.448]
  - - [1024, 512, 1, 2048]
    - [76, 37.642]
  - - [512, 200, 1, 512]
    - [148, 6.11]
  - - [4096, 256, 1, 2048]
    - [188, 60.696]
  - - [4096, 512, 1, 1024]
    - [154, 51.794]
  - - [1024, 200, 1, 1024]
    - [366, 13.959]
  - - [2048, 256, 1, 4096]
    - [126, 40.452]
  - - [2048, 768, 1, 512]
    - [367, 41.423]
  - - [512, 256, 1, 1024]
    - [252, 10.198]
  - - [512, 768, 1, 2048]
    - [301, 39.099]
  - - [2048, 256, 1, 1024]
    - [151, 26.2]
  - - [1024, 256, 1, 2048]
    - [19, 27.575]
  - - [2048, 200, 1, 512]
    - [198, 17.19]
  - - [4096, 200, 1, 1024]
    - [256, 33.815]
  - - [2048, 200, 1, 4096]
    - [127, 31.804]
  - - [2048, 512, 1, 1024]
    - [154, 48.577]
  - - [1024, 1024, 1, 512]
    - [62, 28.169]
  - - [1024, 200, 1, 4096]
    - [180, 31.054]
  - - [2048, 512, 1, 4096]
    - [254, 63.636]
  - - [4096, 512, 1, 2048]
    - [368, 65.204]
  - - [4096, 1024, 1, 2048]
    - [369, 78.517]
  - - [2048, 1024, 1, 2048]
    - [243, 64.367]
  - - [1024, 200, 1, 512]
    - [370, 9.473]
  - - [1024, 1024, 1, 4096]
    - [371, 55.052]
  - - [2048, 1024, 1, 4096]
    - [205, 80.655]
  - - [4096, 200, 1, 2048]
    - [256, 49.219]
  - - [2048, 200, 1, 1024]
    - [79, 22.518]
  - - [1024, 768, 1, 512]
    - [340, 26.202]
  - - [2048, 200, 1, 2048]
    - [198, 31.707]
  - - [2048, 256, 1, 2048]
    - [372, 33.222]
  - - [512, 768, 1, 512]
    - [219, 16.815]
  - - [512, 200, 1, 1024]
    - [77, 9.659]
  - - [4096, 1024, 1, 1024]
    - [373, 63.38]
  - - [4096, 256, 1, 4096]
    - [266, 63.029]
  - - [1024, 512, 1, 512]
    - [374, 17.67]
  - - [512, 256, 1, 512]
    - [171, 6.479]
  - - [1024, 256, 1, 4096]
    - [119, 34.359]
  - - [1024, 200, 1, 2048]
    - [245, 22.856]
  - - [2048, 1024, 1, 512]
    - [375, 44.306]
  - - [1024, 1024, 1, 2048]
    - [85, 40.498]
  - - [4096, 256, 1, 1024]
    - [58, 46.659]
  - - [512, 768, 1, 1024]
    - [80, 25.375]
  - - [1024, 512, 1, 4096]
    - [376, 38.849]
  - - [1024, 256, 1, 512]
    - [150, 12.107]
  - - [4096, 200, 1, 4096]
    - [256, 53.972]
  - - [2048, 256, 1, 512]
    - [195, 20.7]
  - - [512, 200, 1, 2048]
    - [171, 12.195]
  - - [1024, 1024, 1, 1024]
    - [150, 37.022]
  - - [4096, 1024, 1, 4096]
    - [373, 84.481]
  - - [2048, 1024, 1, 1024]
    - [368, 60.351]
  - - [4096, 384, 1, 2048]
    - [377, 58.779]
  - - [4096, 192, 1, 2048]
    - [372, 53.886]
  - - [1225, 192, 64, 384]
    - [207, 63.433]
  - - [5329, 64, 64, 160]
    - [93, 38.084]
  - - [1225, 64, 64, 384]
    - [266, 47.181]
  - - [289, 128, 64, 1024]
    - [115, 44.965]
  - - [4096, 320, 1, 1280]
    - [321, 53.787]
  - - [4096, 384, 1, 1536]
    - [218, 56.823]
  - - [4096, 192, 1, 1280]
    - [76, 47.058]
  - - [289, 192, 64, 1024]
    - [301, 51.992]
  - - [1225, 96, 64, 384]
    - [250, 47.911]
  - - [4096, 320, 1, 2048]
    - [367, 50.609]
  - - [4096, 256, 1, 1536]
    - [254, 49.232]
  - - [4096, 384, 1, 1280]
    - [106, 56.93]
  - - [4096, 448, 1, 1280]
    - [328, 63.297]
  - - [289, 256, 64, 1024]
    - [209, 58.078]
  - - [4096, 448, 1, 2048]
    - [174, 68.969]
  - - [289, 384, 64, 1024]
    - [25, 69.89]
  - - [1024, 3594, 1, 4096]
    - [326, 81.444]
  - - [4096, 3103, 1, 1024]
    - [108, 78.052]
  - - [4096, 3136, 1, 1024]
    - [12, 79.117]
  - - [1024, 3141, 1, 4096]
    - [109, 79.372]
  - - [64, 147, 432, 148]
    - [95, 23.962]
  - - [4096, 3559, 1, 1024]
    - [209, 78.949]
  - - [4096, 3368, 1, 1024]
    - [192, 78.351]
  - - [1024, 3335, 1, 4096]
    - [106, 76.956]
  - - [1024, 3510, 1, 4096]
    - [275, 78.523]
  - - [4096, 3209, 1, 1024]
    - [88, 77.432]
  - - [4096, 3322, 1, 1024]
    - [88, 78.141]
  - - [1024, 3400, 1, 4096]
    - [308, 76.082]
  - - [1024, 3995, 1, 4096]
    - [264, 82.86]
  - - [1024, 3503, 1, 4096]
    - [275, 79.162]
  - - [4096, 3594, 1, 1024]
    - [108, 79.139]
  - - [4096, 3473, 1, 1024]
    - [378, 78.434]
  - - [4096, 3522, 1, 1024]
    - [70, 78.464]
  - - [1024, 3103, 1, 4096]
    - [109, 78.034]
  - - [1024, 3214, 1, 4096]
    - [275, 72.795]
  - - [4096, 3449, 1, 1024]
    - [379, 77.501]
  - - [1024, 3136, 1, 4096]
    - [109, 78.005]
  - - [1024, 3955, 1, 33708]
    - [55, 89.062]
  - - [1024, 3780, 1, 4096]
    - [71, 85.614]
  - - [1024, 3906, 1, 33708]
    - [137, 87.552]
  - - [1024, 3386, 1, 4096]
    - [349, 76.211]
  - - [4096, 3396, 1, 1024]
    - [107, 79.086]
  - - [1024, 3183, 1, 4096]
    - [380, 73.726]
  - - [1024, 3098, 1, 4096]
    - [109, 76.968]
  - - [1024, 3548, 1, 4096]
    - [190, 80.109]
  - - [1024, 3224, 1, 4096]
    - [275, 73.083]
  - - [4096, 3469, 1, 1024]
    - [325, 80.079]
  - - [1024, 3582, 1, 4096]
    - [218, 80.93]
  - - [1024, 2977, 1, 4096]
    - [69, 80.605]
  - - [1024, 3939, 1, 1024]
    - [72, 62.384]
  - - [64, 123, 528, 123]
    - [381, 18.282]
  - - [64, 12, 5040, 12]
    - [382, 2.441]
  - - [4096, 3176, 1, 1024]
    - [26, 76.372]
  - - [1024, 3559, 1, 4096]
    - [110, 80.387]
  - - [1024, 3478, 1, 4096]
    - [383, 79.349]
  - - [4096, 3343, 1, 1024]
    - [107, 77.843]
  - - [4096, 3440, 1, 1024]
    - [367, 77.591]
  - - [1024, 3996, 1, 33708]
    - [108, 89.534]
  - - [1024, 4012, 1, 4096]
    - [378, 83.037]
  - - [1024, 3322, 1, 4096]
    - [218, 74.604]
  - - [1024, 3990, 1, 33708]
    - [70, 89.526]
  - - [1024, 3314, 1, 4096]
    - [384, 75.127]
  - - [4096, 3513, 1, 1024]
    - [113, 79.387]
  - - [1024, 3562, 1, 4096]
    - [291, 82.137]
  - - [1024, 3443, 1, 4096]
    - [385, 80.005]
  - - [1024, 3554, 1, 4096]
    - [386, 78.923]
  - - [1024, 3063, 1, 4096]
    - [69, 79.503]
  - - [64, 111, 576, 112]
    - [221, 18.702]
  - - [4096, 3460, 1, 1024]
    - [87, 77.181]
  - - [1024, 3209, 1, 4096]
    - [383, 74.286]
  - - [1024, 3147, 1, 4096]
    - [109, 78.519]
  - - [4096, 3387, 1, 1024]
    - [107, 79.361]
  - - [4096, 3436, 1, 1024]
    - [153, 76.673]
  - - [1024, 3341, 1, 4096]
    - [275, 75.074]
  - - [1024, 3516, 1, 4096]
    - [337, 78.791]
  - - [4096, 3277, 1, 1024]
    - [88, 78.012]
  - - [1024, 3454, 1, 4096]
    - [218, 77.94]
  - - [1024, 3969, 1, 4096]
    - [108, 81.604]
  - - [1024, 3999, 1, 4096]
    - [200, 82.004]
  - - [1024, 4032, 1, 4096]
    - [72, 85.53]
  - - [4096, 3541, 1, 1024]
    - [10, 79.645]
  - - [4096, 3334, 1, 1024]
    - [153, 77.589]
  - - [1024, 3365, 1, 4096]
    - [275, 75.44]
  - - [1024, 3527, 1, 4096]
    - [22, 82.037]
  - - [1024, 3190, 1, 4096]
    - [349, 72.476]
  - - [4096, 3906, 1, 1024]
    - [325, 82.234]
  - - [1024, 3593, 1, 4096]
    - [275, 80.103]
  - - [1024, 3336, 1, 4096]
    - [380, 76.906]
  - - [4096, 3504, 1, 1024]
    - [264, 78.809]
  - - [4096, 3977, 1, 1024]
    - [74, 78.816]
  - - [1024, 3906, 1, 4096]
    - [176, 80.415]
  - - [4096, 3415, 1, 1024]
    - [4, 77.658]
  - - [1024, 3295, 1, 4096]
    - [125, 76.301]
  - - [4096, 3321, 1, 1024]
    - [25, 79.544]
  - - [1024, 3072, 1, 4096]
    - [107, 82.154]
  - - [1024, 3408, 1, 4096]
    - [190, 76.856]
  - - [1024, 3522, 1, 4096]
    - [303, 78.18]
  - - [4096, 3751, 1, 1024]
    - [367, 78.321]
  - - [4096, 3378, 1, 1024]
    - [107, 78.886]
  - - [64, 77, 816, 77]
    - [222, 14.756]
  - - [1024, 3925, 1, 33708]
    - [55, 88.481]
  - - [1024, 3990, 1, 1024]
    - [82, 61.835]
  - - [1024, 3290, 1, 4096]
    - [291, 76.569]
  - - [4096, 3500, 1, 1024]
    - [373, 77.558]
  - - [4096, 3565, 1, 1024]
    - [5, 79.703]
  - - [1024, 3484, 1, 4096]
    - [291, 79.064]
  - - [4096, 3395, 1, 1024]
    - [107, 78.996]
  - - [64, 92, 688, 92]
    - [262, 15.819]
  - - [1024, 3681, 1, 1024]
    - [387, 65.22]
  - - [64, 159, 400, 159]
    - [145, 24.265]
  - - [1024, 3584, 1, 1024]
    - [303, 65.942]
  - - [4096, 3093, 1, 1024]
    - [12, 79.229]
  - - [1024, 4050, 1, 1024]
    - [200, 64.008]
  - - [1024, 3301, 1, 4096]
    - [106, 74.98]
  - - [1024, 3581, 1, 4096]
    - [226, 81.178]
  - - [4096, 3374, 1, 1024]
    - [107, 78.997]
  - - [1024, 3449, 1, 4096]
    - [22, 80.064]
  - - [4096, 3215, 1, 1024]
    - [7, 77.18]
  - - [4096, 3312, 1, 1024]
    - [308, 79.242]
  - - [4096, 3479, 1, 1024]
    - [176, 79.801]
  - - [4096, 3544, 1, 1024]
    - [210, 79.485]
  - - [1024, 3263, 1, 4096]
    - [106, 73.871]
  - - [4096, 3455, 1, 1024]
    - [94, 77.272]
  - - [1024, 3379, 1, 4096]
    - [275, 76.359]
  - - [1024, 3490, 1, 4096]
    - [22, 79.656]
  - - [1024, 3368, 1, 4096]
    - [377, 76.823]
  - - [4096, 3186, 1, 1024]
    - [369, 75.195]
  - - [1024, 3428, 1, 4096]
    - [190, 76.969]
  - - [64, 85, 752, 84]
    - [8, 15.077]
  - - [4096, 3561, 1, 1024]
    - [88, 79.12]
  - - [4096, 3418, 1, 1024]
    - [24, 76.364]
  - - [1024, 3064, 1, 4096]
    - [200, 79.292]
  - - [4096, 3259, 1, 1024]
    - [92, 77.908]
  - - [4096, 3308, 1, 1024]
    - [209, 79.059]
  - - [1024, 3533, 1, 4096]
    - [17, 79.259]
  - - [1024, 3344, 1, 4096]
    - [275, 75.726]
  - - [1024, 4030, 1, 1024]
    - [70, 62.333]
  - - [4096, 3459, 1, 1024]
    - [324, 79.613]
  - - [1024, 3572, 1, 4096]
    - [22, 82.722]
  - - [1024, 3925, 1, 1024]
    - [6, 63.548]
  - - [4096, 3435, 1, 1024]
    - [7, 77.791]
  - - [1024, 3956, 1, 4096]
    - [113, 82.455]
  - - [1024, 3463, 1, 4096]
    - [190, 78.147]
  - - [4096, 3182, 1, 1024]
    - [187, 75.159]
  - - [4096, 3976, 1, 1024]
    - [115, 78.863]
  - - [1024, 3417, 1, 4096]
    - [22, 79.152]
  - - [1024, 3528, 1, 4096]
    - [106, 79.406]
  - - [4096, 3446, 1, 1024]
    - [264, 77.263]
  - - [64, 122, 528, 123]
    - [388, 18.959]
  - - [1024, 3543, 1, 4096]
    - [125, 80.538]
  - - [4096, 3287, 1, 1024]
    - [126, 77.492]
  - - [1024, 3499, 1, 4096]
    - [275, 79.393]
  - - [1024, 3231, 1, 4096]
    - [389, 73.179]
  - - [64, 17, 3632, 17]
    - [382, 3.882]
  - - [4096, 3519, 1, 1024]
    - [113, 78.533]
  - - [4096, 3552, 1, 1024]
    - [325, 82.475]
  - - [1024, 3458, 1, 4096]
    - [190, 80.048]
  - - [64, 93, 688, 92]
    - [390, 17.52]
  - - [1024, 3374, 1, 4096]
    - [275, 75.445]
  - - [1024, 3396, 1, 4096]
    - [310, 77.78]
  - - [1024, 2967, 1, 4096]
    - [9, 77.027]
  - - [64, 19, 3264, 19]
    - [391, 4.626]
  - - [4096, 3482, 1, 1024]
    - [207, 80.83]
  - - [64, 32, 1984, 32]
    - [233, 8.115]
  - - [64, 102, 624, 99]
    - [392, 16.655]
  - - [1024, 3226, 1, 4096]
    - [106, 72.558]
  - - [4096, 3377, 1, 1024]
    - [20, 75.677]
  - - [4096, 3426, 1, 1024]
    - [146, 76.553]
  - - [4096, 2935, 1, 1024]
    - [87, 74.28]
  - - [64, 133, 480, 133]
    - [28, 22.06]
  - - [1024, 3439, 1, 4096]
    - [126, 75.984]
  - - [4096, 3267, 1, 1024]
    - [367, 77.125]
  - - [4096, 3499, 1, 1024]
    - [325, 81.339]
  - - [4096, 3356, 1, 1024]
    - [227, 74.497]
  - - [64, 232, 272, 232]
    - [85, 28.318]
  - - [64, 162, 400, 159]
    - [8, 24.126]
  - - [4096, 3939, 1, 1024]
    - [264, 77.219]
  - - [1024, 3526, 1, 4096]
    - [106, 79.653]
  - - [1024, 3859, 1, 33708]
    - [176, 86.615]
  - - [1024, 3385, 1, 4096]
    - [372, 76.072]
  - - [1024, 3496, 1, 4096]
    - [22, 78.747]
  - - [4096, 3141, 1, 1024]
    - [74, 79.755]
  - - [4096, 3510, 1, 1024]
    - [92, 78.014]
  - - [1024, 3434, 1, 4096]
    - [380, 76.941]
  - - [4096, 3969, 1, 1024]
    - [72, 77.805]
  - - [1024, 3121, 1, 4096]
    - [115, 77.543]
  - - [1024, 3232, 1, 4096]
    - [106, 74.906]
  - - [1024, 4030, 1, 33708]
    - [5, 90.317]
  - - [1024, 3780, 1, 33708]
    - [291, 95.039]
  - - [1024, 3969, 1, 1024]
    - [393, 61.279]
  - - [4096, 3527, 1, 1024]
    - [186, 78.808]
  - - [4096, 3336, 1, 1024]
    - [107, 77.278]
  - - [4096, 3290, 1, 1024]
    - [88, 78.52]
  - - [64, 9, 6544, 9]
    - [45, 1.659]
  - - [1024, 3469, 1, 4096]
    - [190, 79.03]
  - - [4096, 3490, 1, 1024]
    - [132, 78.388]
  - - [4096, 3064, 1, 1024]
    - [308, 77.782]
  - - [4096, 3582, 1, 1024]
    - [209, 79.24]
  - - [1024, 3956, 1, 1024]
    - [109, 62.28]
  - - [4096, 3417, 1, 1024]
    - [176, 77.764]
  - - [1024, 2736, 1, 4096]
    - [146, 80.957]
  - - [64, 78, 816, 78]
    - [28, 15.29]
  - - [1024, 3205, 1, 4096]
    - [380, 74.348]
  - - [1024, 3143, 1, 4096]
    - [109, 79.227]
  - - [1024, 4020, 1, 4096]
    - [192, 83.176]
  - - [1024, 3318, 1, 4096]
    - [190, 74.145]
  - - [4096, 3364, 1, 1024]
    - [107, 77.987]
  - - [1024, 3353, 1, 4096]
    - [106, 77.437]
  - - [1024, 3464, 1, 4096]
    - [226, 79.671]
  - - [4096, 3205, 1, 1024]
    - [126, 77.103]
  - - [4096, 3318, 1, 1024]
    - [25, 78.427]
  - - [1024, 3402, 1, 4096]
    - [217, 76.13]
  - - [4096, 3181, 1, 1024]
    - [25, 74.424]
  - - [4096, 3550, 1, 1024]
    - [108, 79.412]
  - - [4096, 3445, 1, 1024]
    - [107, 80.269]
  - - [1024, 3138, 1, 4096]
    - [109, 78.814]
  - - [64, 99, 624, 99]
    - [8, 14.642]
  - - [4096, 3079, 1, 1024]
    - [5, 77.511]
  - - [4096, 3144, 1, 1024]
    - [264, 79.641]
  - - [4096, 3860, 1, 1024]
    - [192, 80.415]
  - - [1024, 3515, 1, 4096]
    - [201, 78.92]
  - - [4096, 3408, 1, 1024]
    - [107, 79.772]
  - - [64, 101, 624, 102]
    - [394, 16.784]
  - - [1024, 3181, 1, 4096]
    - [315, 72.231]
  - - [4096, 3298, 1, 1024]
    - [223, 77.264]
  - - [4096, 3585, 1, 1024]
    - [12, 80.705]
  - - [1024, 3550, 1, 4096]
    - [385, 81.424]
  - - [1024, 4020, 1, 1024]
    - [395, 61.956]
  - - [4096, 3481, 1, 1024]
    - [358, 78.414]
  - - [4096, 3530, 1, 1024]
    - [325, 79.927]
  - - [4096, 3425, 1, 1024]
    - [107, 79.78]
  - - [4096, 4026, 1, 1024]
    - [12, 78.268]
  - - [1024, 3860, 1, 1024]
    - [81, 60.507]
  - - [4096, 3975, 1, 1024]
    - [153, 77.885]
  - - [1024, 3286, 1, 4096]
    - [389, 74.565]
  - - [1024, 3176, 1, 4096]
    - [307, 71.895]
  - - [1024, 3894, 1, 4096]
    - [108, 81.176]
  - - [4096, 3355, 1, 1024]
    - [9, 77.831]
  - - [4096, 3404, 1, 1024]
    - [107, 78.842]
  - - [1024, 3501, 1, 4096]
    - [291, 80.614]
  - - [4096, 3245, 1, 1024]
    - [396, 76.815]
  - - [1024, 3431, 1, 4096]
    - [190, 78.314]
  - - [1024, 4000, 1, 1024]
    - [397, 63.143]
  - - [4096, 3509, 1, 1024]
    - [72, 78.916]
  - - [4096, 3558, 1, 1024]
    - [12, 79.579]
  - - [1024, 3535, 1, 4096]
    - [398, 79.547]
  - - [1024, 3414, 1, 4096]
    - [223, 75.479]
  - - [1024, 3445, 1, 4096]
    - [307, 76.82]
  - - [1024, 3436, 1, 4096]
    - [201, 76.638]
  - - [4096, 3472, 1, 1024]
    - [264, 78.354]
  - - [1024, 3211, 1, 4096]
    - [106, 74.393]
  - - [64, 7, 8192, 7]
    - [399, 1.753]
  - - [4096, 3383, 1, 1024]
    - [107, 78.598]
  - - [4096, 3448, 1, 1024]
    - [250, 76.729]
  - - [1024, 3343, 1, 4096]
    - [380, 76.751]
  - - [1024, 3518, 1, 4096]
    - [326, 79.199]
  - - [4096, 3289, 1, 1024]
    - [170, 77.445]
  - - [1024, 3440, 1, 4096]
    - [380, 79.488]
  - - [1024, 4032, 1, 33708]
    - [176, 90.578]
  - - [4096, 3489, 1, 1024]
    - [192, 78.648]
  - - [4096, 3346, 1, 1024]
    - [108, 75.216]
  - - [1024, 3534, 1, 4096]
    - [389, 79.6]
  - - [1024, 3079, 1, 4096]
    - [109, 78.285]
  - - [1024, 3955, 1, 4096]
    - [264, 82.037]
  - - [4096, 3236, 1, 1024]
    - [92, 78.097]
  - - [1024, 3545, 1, 4096]
    - [372, 79.224]
  - - [1024, 3144, 1, 4096]
    - [109, 79.437]
  - - [4096, 3780, 1, 1024]
    - [325, 79.567]
  - - [4096, 3163, 1, 1024]
    - [70, 80.417]
  - - [4096, 3468, 1, 1024]
    - [146, 78.662]
  - - [1024, 3539, 1, 4096]
    - [275, 79.249]
  - - [1024, 3541, 1, 4096]
    - [291, 80.977]
  - - [4096, 3363, 1, 1024]
    - [107, 78.328]
  - - [1024, 3475, 1, 4096]
    - [385, 80.597]
  - - [4096, 3110, 1, 1024]
    - [5, 79.405]
  - - [1024, 3509, 1, 4096]
    - [291, 81.351]
  - - [1024, 3413, 1, 4096]
    - [398, 76.636]
  - - [1024, 3975, 1, 1024]
    - [186, 61.018]
  - - [4096, 3549, 1, 1024]
    - [5, 79.551]
  - - [4096, 3342, 1, 1024]
    - [107, 78.258]
  - - [1024, 2985, 1, 4096]
    - [107, 77.288]
  - - [1024, 3876, 1, 33708]
    - [55, 87.076]
  - - [4096, 3280, 1, 1024]
    - [151, 77.115]
  - - [4096, 3191, 1, 1024]
    - [92, 75.813]
  - - [4096, 3512, 1, 1024]
    - [25, 79.293]
  - - [1024, 3560, 1, 4096]
    - [125, 81.068]
  - - [4096, 2499, 1, 1024]
    - [25, 75.498]
  - - [1024, 3248, 1, 4096]
    - [190, 73.291]
  - - [4096, 3423, 1, 1024]
    - [4, 77.105]
  - - [64, 111, 576, 111]
    - [394, 17.374]
  - - [4096, 3297, 1, 1024]
    - [92, 77.865]
  - - [4096, 3154, 1, 1024]
    - [108, 80.552]
  - - [1024, 3303, 1, 4096]
    - [400, 74.52]
  - - [1024, 3222, 1, 4096]
    - [125, 74.667]
  - - [1024, 3978, 1, 1024]
    - [250, 62.161]
  - - [4096, 3529, 1, 1024]
    - [300, 78.942]
  - - [4096, 3386, 1, 1024]
    - [107, 79.166]
  - - [64, 134, 480, 134]
    - [54, 21.47]
  - - [1024, 3451, 1, 4096]
    - [337, 77.034]
  - - [4096, 3562, 1, 1024]
    - [70, 80.137]
  - - [4096, 3276, 1, 1024]
    - [170, 78.752]
  - - [64, 135, 480, 132]
    - [239, 22.158]
  - - [1024, 3894, 1, 33708]
    - [371, 87.402]
  - - [64, 134, 480, 132]
    - [62, 21.499]
  - - [4096, 3540, 1, 1024]
    - [250, 80.204]
  - - [1024, 3416, 1, 4096]
    - [125, 78.906]
  - - [1024, 4005, 1, 33708]
    - [5, 89.992]
  - - [1024, 3942, 1, 4096]
    - [192, 82.959]
  - - [4096, 3403, 1, 1024]
    - [107, 79.107]
  - - [4096, 3381, 1, 1024]
    - [69, 78.503]
  - - [1024, 3492, 1, 4096]
    - [190, 78.402]
  - - [4096, 3101, 1, 1024]
    - [319, 77.945]
  - - [1024, 3430, 1, 4096]
    - [106, 79.36]
  - - [1024, 3977, 1, 4096]
    - [207, 82.101]
  - - [1024, 3640, 1, 4096]
    - [401, 83.829]
  - - [4096, 3557, 1, 1024]
    - [12, 78.954]
  - - [4096, 3414, 1, 1024]
    - [210, 76.231]
  - - [1024, 3391, 1, 4096]
    - [400, 77.407]
  - - [64, 134, 480, 135]
    - [8, 22.613]
  - - [64, 16, 3840, 16]
    - [402, 3.679]
  - - [1024, 3356, 1, 4096]
    - [380, 77.679]
  - - [4096, 3320, 1, 1024]
    - [126, 78.158]
  - - [4096, 2765, 1, 1024]
    - [300, 76.199]
  - - [64, 162, 400, 162]
    - [95, 24.737]
  - - [1024, 3411, 1, 4096]
    - [201, 76.302]
  - - [1024, 3978, 1, 4096]
    - [319, 82.184]
  - - [4096, 3487, 1, 1024]
    - [129, 78.799]
  - - [4096, 3520, 1, 1024]
    - [72, 79.078]
  - - [4096, 3942, 1, 1024]
    - [210, 78.518]
  - - [4096, 3431, 1, 1024]
    - [216, 77.238]
  - - [1024, 3271, 1, 4096]
    - [25, 76.166]
  - - [4096, 4020, 1, 1024]
    - [5, 79.594]
  - - [1024, 3481, 1, 4096]
    - [22, 79.417]
  - - [1024, 3419, 1, 4096]
    - [190, 78.601]
  - - [1024, 4059, 1, 4096]
    - [257, 83.88]
  - - [4096, 3345, 1, 1024]
    - [69, 75.883]
  - - [4096, 3394, 1, 1024]
    - [325, 78.306]
  - - [1024, 3298, 1, 4096]
    - [349, 74.115]
  - - [4096, 3235, 1, 1024]
    - [367, 76.265]
  - - [1024, 3681, 1, 33708]
    - [400, 93.0]
  - - [1024, 3362, 1, 4096]
    - [385, 78.09]
  - - [4096, 3467, 1, 1024]
    - [94, 78.476]
  - - [1024, 3349, 1, 4096]
    - [389, 75.01]
  - - [1024, 3460, 1, 4096]
    - [106, 78.217]
  - - [4096, 3214, 1, 1024]
    - [87, 76.025]
  - - [1024, 3398, 1, 4096]
    - [303, 76.895]
  - - [4096, 3478, 1, 1024]
    - [94, 78.699]
  - - [1024, 4050, 1, 33708]
    - [403, 90.931]
  - - [1024, 3244, 1, 4096]
    - [106, 74.948]
  - - [4096, 3341, 1, 1024]
    - [107, 77.476]
  - - [4096, 3454, 1, 1024]
    - [107, 77.4]
  - - [1024, 3166, 1, 4096]
    - [109, 78.421]
  - - [1024, 3425, 1, 4096]
    - [190, 78.082]
  - - [4096, 3295, 1, 1024]
    - [367, 77.141]
  - - [4096, 3072, 1, 1024]
    - [315, 79.117]
  - - [4096, 3822, 1, 1024]
    - [218, 79.816]
  - - [1024, 3681, 1, 4096]
    - [125, 82.32]
  - - [1024, 4050, 1, 4096]
    - [373, 83.667]
  - - [4096, 3495, 1, 1024]
    - [325, 80.116]
  - - [4096, 3560, 1, 1024]
    - [70, 78.769]
  - - [1024, 3524, 1, 4096]
    - [341, 79.718]
  - - [1024, 3942, 1, 33708]
    - [55, 88.483]
  - - [1024, 3304, 1, 4096]
    - [307, 74.583]
  - - [1024, 3387, 1, 4096]
    - [275, 76.862]
  - - [1024, 3498, 1, 4096]
    - [377, 78.465]
  - - [4096, 3458, 1, 1024]
    - [5, 77.478]
  - - [4096, 2967, 1, 1024]
    - [170, 75.797]
  - - [64, 8, 7280, 8]
    - [45, 1.61]
  - - [4096, 3385, 1, 1024]
    - [325, 78.274]
  - - [4096, 3434, 1, 1024]
    - [107, 80.328]
  - - [1024, 3519, 1, 4096]
    - [398, 80.865]
  - - [1024, 3511, 1, 4096]
    - [218, 79.447]
  - - [1024, 3288, 1, 4096]
    - [331, 74.176]
  - - [1024, 2918, 1, 4096]
    - [404, 78.866]
  - - [4096, 3573, 1, 1024]
    - [405, 78.265]
  - - [1024, 3822, 1, 33708]
    - [291, 96.229]
  - - [64, 102, 624, 102]
    - [262, 17.16]
  - - [4096, 3539, 1, 1024]
    - [10, 79.824]
  - - [4096, 3332, 1, 1024]
    - [187, 75.328]
  - - [4096, 3286, 1, 1024]
    - [170, 77.97]
  - - [1024, 4026, 1, 4096]
    - [55, 82.91]
  - - [1024, 3277, 1, 4096]
    - [341, 74.773]
  - - [1024, 3471, 1, 4096]
    - [291, 80.51]
  - - [4096, 3518, 1, 1024]
    - [186, 79.002]
  - - [1024, 3393, 1, 4096]
    - [310, 76.313]
  - - [4096, 3413, 1, 1024]
    - [207, 76.587]
  - - [4096, 3303, 1, 1024]
    - [352, 77.486]
  - - [1024, 3207, 1, 4096]
    - [406, 72.244]
  - - [1024, 3894, 1, 1024]
    - [5, 59.832]
  - - [1024, 3977, 1, 1024]
    - [20, 62.453]
  - - [64, 135, 480, 133]
    - [28, 22.25]
  - - [4096, 3535, 1, 1024]
    - [319, 79.469]
  - - [4096, 3376, 1, 1024]
    - [21, 76.238]
  - - [1024, 3355, 1, 4096]
    - [223, 75.827]
  - - [64, 27, 2336, 27]
    - [41, 6.271]
  - - [1024, 3466, 1, 4096]
    - [400, 77.548]
  - - [4096, 3266, 1, 1024]
    - [308, 78.036]
  - - [1024, 3404, 1, 4096]
    - [275, 76.517]
  - - [1024, 3999, 1, 1024]
    - [70, 62.049]
  - - [64, 148, 432, 143]
    - [85, 22.799]
  - - [4096, 3498, 1, 1024]
    - [192, 79.42]
  - - [1024, 4032, 1, 1024]
    - [70, 68.676]
  - - [1024, 3410, 1, 4096]
    - [275, 76.445]
  - - [4096, 3393, 1, 1024]
    - [69, 77.086]
  - - [1024, 3140, 1, 4096]
    - [115, 79.964]
  - - [1024, 3910, 1, 33708]
    - [108, 87.788]
  - - [1024, 3334, 1, 4096]
    - [190, 77.255]
  - - [4096, 3140, 1, 1024]
    - [216, 79.402]
  - - [1024, 4005, 1, 4096]
    - [360, 83.16]
  - - [1024, 3579, 1, 4096]
    - [310, 81.317]
  - - [4096, 3372, 1, 1024]
    - [107, 79.084]
  - - [1024, 3245, 1, 4096]
    - [22, 74.84]
  - - [64, 38, 1680, 38]
    - [41, 8.22]
  - - [4096, 3956, 1, 1024]
    - [170, 78.008]
  - - [4096, 3213, 1, 1024]
    - [26, 75.804]
  - - [1024, 3361, 1, 4096]
    - [275, 76.217]
  - - [1024, 3536, 1, 4096]
    - [401, 80.685]
  - - [4096, 3477, 1, 1024]
    - [113, 78.17]
  - - [4096, 3526, 1, 1024]
    - [325, 79.244]
  - - [1024, 4005, 1, 1024]
    - [107, 63.379]
  - - [1024, 3530, 1, 4096]
    - [331, 79.847]
  - - [1024, 3944, 1, 4096]
    - [192, 82.412]
  - - [4096, 3453, 1, 1024]
    - [325, 78.103]
  - - [4096, 3184, 1, 1024]
    - [92, 76.71]
  - - [4096, 3579, 1, 1024]
    - [10, 80.067]
  - - [4096, 3351, 1, 1024]
    - [207, 76.872]
  - - [4096, 3416, 1, 1024]
    - [207, 78.403]
  - - [64, 100, 624, 100]
    - [145, 16.627]
  - - [1024, 3822, 1, 4096]
    - [326, 85.861]
  - - [1024, 3796, 1, 4096]
    - [380, 85.266]
  - - [4096, 3257, 1, 1024]
    - [209, 76.953]
  - - [4096, 3306, 1, 1024]
    - [407, 77.66]
  - - [1024, 3505, 1, 4096]
    - [310, 78.884]
  - - [1024, 3315, 1, 4096]
    - [383, 74.28]
  - - [1024, 3486, 1, 4096]
    - [303, 78.445]
  - - [4096, 3457, 1, 1024]
    - [186, 77.325]
  - - [4096, 3870, 1, 1024]
    - [207, 79.692]
  - - [1024, 3447, 1, 4096]
    - [248, 76.943]
  - - [1024, 3558, 1, 4096]
    - [291, 81.736]
  - - [4096, 3433, 1, 1024]
    - [378, 76.885]
  - - [4096, 3180, 1, 1024]
    - [331, 74.807]
  - - [1024, 3213, 1, 4096]
    - [380, 72.491]
  - - [1024, 3900, 1, 4096]
    - [132, 80.534]
  - - [4096, 3444, 1, 1024]
    - [379, 78.245]
  - - [1024, 3504, 1, 4096]
    - [326, 80.506]
  - - [4096, 4059, 1, 1024]
    - [224, 79.547]
  - - [1024, 3442, 1, 4096]
    - [25, 76.414]
  - - [4096, 3517, 1, 1024]
    - [300, 79.001]
  - - [1024, 3566, 1, 4096]
    - [341, 80.307]
  - - [4096, 3248, 1, 1024]
    - [88, 77.395]
  - - [1024, 3547, 1, 4096]
    - [125, 79.105]
  - - [64, 59, 1088, 59]
    - [408, 11.334]
  - - [1024, 3340, 1, 4096]
    - [307, 74.623]
  - - [4096, 3480, 1, 1024]
    - [325, 79.208]
  - - [4096, 3424, 1, 1024]
    - [192, 76.301]
  - - [1024, 3906, 1, 1024]
    - [393, 60.968]
  - - [4096, 3265, 1, 1024]
    - [308, 78.689]
  - - [1024, 3384, 1, 4096]
    - [389, 75.533]
  - - [1024, 3494, 1, 4096]
    - [385, 80.694]
  - - [1024, 3236, 1, 4096]
    - [275, 72.668]
  - - [4096, 3497, 1, 1024]
    - [207, 80.376]
  - - [4096, 3354, 1, 1024]
    - [107, 78.649]
  - - [4096, 3055, 1, 1024]
    - [207, 77.171]
  - - [64, 11, 5456, 11]
    - [409, 2.932]
  - - [4096, 3244, 1, 1024]
    - [7, 78.0]
  - - [4096, 3139, 1, 1024]
    - [10, 79.329]
  - - [4096, 3508, 1, 1024]
    - [373, 78.612]
  - - [4096, 4050, 1, 1024]
    - [10, 80.018]
  - - [1024, 3472, 1, 4096]
    - [275, 78.706]
  - - [1024, 3861, 1, 1024]
    - [69, 62.266]
  - - [1024, 3910, 1, 1024]
    - [176, 63.711]
  - - [4096, 3371, 1, 1024]
    - [153, 78.216]
  - - [64, 65, 992, 65]
    - [410, 11.051]
  - - [1024, 3751, 1, 4096]
    - [275, 84.535]
  - - [4096, 3325, 1, 1024]
    - [7, 78.498]
  - - [1024, 3321, 1, 4096]
    - [248, 74.652]
  - - [1024, 3944, 1, 1024]
    - [216, 62.269]
  - - [4096, 3525, 1, 1024]
    - [5, 79.306]
  - - [4096, 3382, 1, 1024]
    - [107, 78.261]
  - - [64, 122, 528, 122]
    - [166, 19.517]
  - - [1024, 3453, 1, 4096]
    - [331, 78.194]
  - - [4096, 3564, 1, 1024]
    - [10, 79.609]
  - - [4096, 3288, 1, 1024]
    - [223, 77.31]
  - - [1024, 3925, 1, 4096]
    - [72, 81.239]
  - - [1024, 3057, 1, 4096]
    - [404, 77.865]
  - - [4096, 3488, 1, 1024]
    - [170, 78.28]
  - - [4096, 3046, 1, 1024]
    - [170, 76.753]
  - - [1024, 3189, 1, 4096]
    - [291, 74.351]
  - - [4096, 3399, 1, 1024]
    - [107, 79.445]
  - - [1024, 3383, 1, 4096]
    - [303, 76.063]
  - - [1024, 3415, 1, 4096]
    - [25, 78.796]
  - - [1024, 3388, 1, 4096]
    - [303, 76.326]
  - - [1024, 3376, 1, 4096]
    - [385, 77.283]
  - - [1024, 3473, 1, 4096]
    - [71, 78.537]
  - - [4096, 3162, 1, 1024]
    - [257, 79.594]
  - - [1024, 3448, 1, 4096]
    - [17, 78.05]
  - - [4096, 3362, 1, 1024]
    - [404, 77.828]
  - - [64, 228, 272, 228]
    - [8, 28.178]
  - - [1024, 3262, 1, 4096]
    - [303, 73.017]
  - - [1024, 3184, 1, 4096]
    - [326, 71.731]
  - - [1024, 3378, 1, 4096]
    - [275, 76.51]
  - - [4096, 3548, 1, 1024]
    - [170, 78.54]
  - - [4096, 2977, 1, 1024]
    - [70, 75.86]
  - - [64, 21, 2976, 21]
    - [411, 3.951]
  - - [64, 112, 576, 111]
    - [53, 18.29]
  - - [4096, 3443, 1, 1024]
    - [300, 77.813]
  - - [1024, 3289, 1, 4096]
    - [106, 76.942]
  - - [1024, 3483, 1, 4096]
    - [22, 80.641]
  - - [4096, 3190, 1, 1024]
    - [88, 76.448]
  - - [1024, 3421, 1, 4096]
    - [385, 79.196]
  - - [1024, 3514, 1, 4096]
    - [170, 79.461]
  - - [1024, 3532, 1, 4096]
    - [349, 79.908]
  - - [1024, 3565, 1, 4096]
    - [331, 80.535]
  - - [4096, 3422, 1, 1024]
    - [114, 77.416]
  - - [4096, 3263, 1, 1024]
    - [335, 77.612]
  - - [4096, 3296, 1, 1024]
    - [71, 77.233]
  - - [4096, 3640, 1, 1024]
    - [74, 81.48]
  - - [4096, 3463, 1, 1024]
    - [207, 79.08]
  - - [4096, 3528, 1, 1024]
    - [325, 80.69]
  - - [1024, 3351, 1, 4096]
    - [190, 76.153]
  - - [1024, 3462, 1, 4096]
    - [275, 77.923]
  - - [4096, 3226, 1, 1024]
    - [308, 76.435]
  - - [4096, 3439, 1, 1024]
    - [192, 79.016]
  - - [4096, 3121, 1, 1024]
    - [264, 78.784]
  - - [1024, 4059, 1, 33708]
    - [5, 91.156]
  - - [1024, 3311, 1, 4096]
    - [385, 74.926]
  - - [1024, 3230, 1, 4096]
    - [106, 74.502]
  - - [4096, 3353, 1, 1024]
    - [7, 75.874]
  - - [4096, 3402, 1, 1024]
    - [207, 77.05]
  - - [1024, 3427, 1, 4096]
    - [349, 76.565]
  - - [1024, 3346, 1, 4096]
    - [377, 77.036]
  - - [1024, 3126, 1, 4096]
    - [109, 78.458]
  - - [1024, 3796, 1, 1024]
    - [209, 66.144]
  - - [1024, 3990, 1, 4096]
    - [72, 82.536]
  - - [1024, 3257, 1, 4096]
    - [326, 74.726]
  - - [4096, 3996, 1, 1024]
    - [207, 78.859]
  - - [64, 143, 432, 143]
    - [85, 22.18]
  - - [1024, 3306, 1, 4096]
    - [385, 74.289]
  - - [1024, 3389, 1, 4096]
    - [380, 76.732]
  - - [1024, 3500, 1, 4096]
    - [226, 78.763]
  - - [1024, 3999, 1, 33708]
    - [137, 89.776]
  - - [4096, 3486, 1, 1024]
    - [308, 78.264]
  - - [1024, 3438, 1, 4096]
    - [17, 77.527]
  - - [4096, 3616, 1, 1024]
    - [108, 78.702]
  - - [1024, 3955, 1, 1024]
    - [82, 63.11]
  - - [4096, 3430, 1, 1024]
    - [207, 77.371]
  - - [4096, 3271, 1, 1024]
    - [87, 78.512]
  - - [1024, 3364, 1, 4096]
    - [291, 76.849]
  - - [64, 54, 1184, 54]
    - [412, 10.824]
  - - [1024, 3497, 1, 4096]
    - [331, 79.67]
  - - [4096, 3503, 1, 1024]
    - [153, 80.499]
  - - [4096, 3344, 1, 1024]
    - [69, 76.687]
  - - [1024, 3457, 1, 4096]
    - [106, 79.195]
  - - [4096, 3466, 1, 1024]
    - [325, 80.42]
  - - [1024, 3976, 1, 33708]
    - [397, 89.304]
  - - [1024, 3395, 1, 4096]
    - [401, 75.908]
  - - [4096, 3361, 1, 1024]
    - [107, 77.839]
  - - [1024, 3751, 1, 33708]
    - [291, 94.675]
  - - [1024, 3822, 1, 1024]
    - [136, 63.52]
  - - [4096, 3315, 1, 1024]
    - [218, 77.221]
  - - [1024, 3163, 1, 4096]
    - [109, 79.147]
  - - [4096, 3547, 1, 1024]
    - [129, 79.361]
  - - [4096, 3340, 1, 1024]
    - [107, 77.587]
  - - [1024, 3296, 1, 4096]
    - [380, 76.386]
  - - [1024, 3468, 1, 4096]
    - [275, 78.408]
  - - [4096, 3294, 1, 1024]
    - [20, 77.882]
  - - [1024, 3406, 1, 4096]
    - [389, 78.038]
  - - [1024, 3860, 1, 33708]
    - [207, 86.574]
  - - [1024, 3584, 1, 4096]
    - [291, 84.61]
  - - [4096, 3189, 1, 1024]
    - [7, 77.247]
  - - [4096, 3494, 1, 1024]
    - [300, 78.768]
  - - [64, 135, 480, 135]
    - [85, 22.287]
  - - [1024, 3093, 1, 4096]
    - [115, 77.914]
  - - [4096, 3421, 1, 1024]
    - [129, 77.304]
  - - [1024, 3479, 1, 4096]
    - [380, 80.42]
  - - [1024, 3433, 1, 4096]
    - [385, 78.262]
  - - [4096, 3311, 1, 1024]
    - [126, 78.671]
  - - [1024, 3381, 1, 4096]
    - [217, 76.154]
  - - [1024, 3996, 1, 4096]
    - [72, 82.948]
  - - [4096, 3384, 1, 1024]
    - [107, 78.901]
  - - [1024, 3247, 1, 4096]
    - [291, 74.127]
  - - [1024, 3169, 1, 4096]
    - [275, 71.565]
  - - [1024, 3088, 1, 4096]
    - [115, 77.596]
  - - [1024, 3363, 1, 4096]
    - [380, 76.662]
  - - [1024, 3538, 1, 4096]
    - [385, 81.0]
  - - [1024, 3996, 1, 1024]
    - [250, 63.941]
  - - [4096, 3169, 1, 1024]
    - [88, 74.741]
  - - [4096, 3538, 1, 1024]
    - [114, 78.84]
  - - [4096, 3401, 1, 1024]
    - [153, 78.765]
  - - [4096, 3581, 1, 1024]
    - [5, 80.257]
  - - [1024, 3180, 1, 4096]
    - [387, 72.817]
  - - [1024, 3870, 1, 1024]
    - [146, 63.161]
  - - [4096, 3555, 1, 1024]
    - [108, 79.842]
  - - [4096, 3412, 1, 1024]
    - [107, 79.83]
  - - [4096, 3302, 1, 1024]
    - [7, 77.887]
  - - [1024, 3561, 1, 4096]
    - [326, 80.844]
  - - [1024, 3302, 1, 4096]
    - [190, 74.167]
  - - [1024, 3976, 1, 4096]
    - [72, 83.195]
  - - [4096, 3485, 1, 1024]
    - [367, 77.739]
  - - [4096, 3534, 1, 1024]
    - [113, 78.915]
  - - [1024, 3110, 1, 4096]
    - [115, 78.691]
  - - [1024, 3401, 1, 4096]
    - [22, 78.645]
  - - [4096, 3216, 1, 1024]
    - [7, 77.372]
  - - [1024, 4020, 1, 33708]
    - [55, 90.231]
  - - [1024, 3215, 1, 4096]
    - [385, 73.808]
  - - [4096, 3566, 1, 1024]
    - [209, 78.912]
  - - [1024, 3137, 1, 4096]
    - [109, 80.981]
  - - [4096, 3359, 1, 1024]
    - [69, 77.304]
  - - [4096, 3392, 1, 1024]
    - [107, 78.458]
  - - [1024, 3506, 1, 4096]
    - [226, 80.657]
  - - [4096, 3233, 1, 1024]
    - [88, 76.931]
  - - [1024, 3444, 1, 4096]
    - [291, 79.772]
  - - [1024, 3975, 1, 4096]
    - [192, 82.467]
  - - [1024, 3870, 1, 33708]
    - [137, 86.777]
  - - [4096, 3465, 1, 1024]
    - [132, 78.918]
  - - [1024, 3523, 1, 4096]
    - [385, 80.925]
  - - [64, 10, 5952, 10]
    - [391, 2.05]
  - - [4096, 3990, 1, 1024]
    - [257, 77.919]
  - - [1024, 3549, 1, 4096]
    - [218, 79.649]
  - - [1024, 3342, 1, 4096]
    - [341, 75.592]
  - - [4096, 3476, 1, 1024]
    - [325, 80.531]
  - - [64, 232, 272, 228]
    - [62, 25.894]
  - - [1024, 3418, 1, 4096]
    - [125, 78.92]
  - - [1024, 3859, 1, 1024]
    - [216, 64.913]
  - - [4096, 3339, 1, 1024]
    - [107, 78.563]
  - - [4096, 3452, 1, 1024]
    - [69, 78.785]
  - - [4096, 3293, 1, 1024]
    - [71, 77.258]
  - - [1024, 3369, 1, 4096]
    - [226, 77.698]
  - - [64, 193, 320, 193]
    - [390, 23.585]
  - - [1024, 3544, 1, 4096]
    - [341, 79.732]
  - - [4096, 3493, 1, 1024]
    - [10, 79.406]
  - - [4096, 3350, 1, 1024]
    - [107, 77.882]
  - - [64, 71, 896, 71]
    - [355, 13.842]
  - - [4096, 3256, 1, 1024]
    - [413, 77.216]
  - - [1024, 3870, 1, 4096]
    - [132, 79.607]
  - - [4096, 4012, 1, 1024]
    - [224, 78.24]
  - - [1024, 3280, 1, 4096]
    - [125, 75.414]
  - - [4096, 3456, 1, 1024]
    - [192, 79.497]
  - - [1024, 3555, 1, 4096]
    - [385, 79.859]
  - - [4096, 3014, 1, 1024]
    - [87, 77.938]
  - - [1024, 3474, 1, 4096]
    - [190, 81.121]
  - - [4096, 3367, 1, 1024]
    - [107, 79.11]
  - - [4096, 3432, 1, 1024]
    - [414, 76.421]
  - - [64, 84, 752, 84]
    - [8, 13.867]
  - - [4096, 3273, 1, 1024]
    - [315, 77.406]
  - - [4096, 3130, 1, 1024]
    - [74, 78.801]
  - - [1024, 2984, 1, 4096]
    - [115, 77.484]
  - - [1024, 3995, 1, 1024]
    - [415, 63.272]
  - - [1024, 3517, 1, 4096]
    - [341, 79.034]
  - - [1024, 3455, 1, 4096]
    - [22, 79.704]
  - - [1024, 3939, 1, 4096]
    - [200, 81.341]
  - - [64, 49, 1296, 49]
    - [416, 9.648]
  - - [64, 14, 4368, 14]
    - [417, 3.192]
  - - [64, 25, 2512, 25]
    - [390, 5.193]
  - - [4096, 3147, 1, 1024]
    - [12, 79.856]
  - - [4096, 3516, 1, 1024]
    - [146, 78.936]
  - - [1024, 3876, 1, 4096]
    - [4, 80.427]
  - - [1024, 3191, 1, 4096]
    - [380, 72.408]
  - - [4096, 3411, 1, 1024]
    - [325, 77.576]
  - - [1024, 3337, 1, 4096]
    - [349, 77.263]
  - - [1024, 3512, 1, 4096]
    - [275, 78.369]
  - - [4096, 3301, 1, 1024]
    - [87, 78.494]
  - - [1024, 3450, 1, 4096]
    - [22, 79.396]
  - - [4096, 3533, 1, 1024]
    - [223, 78.537]
  - - [4096, 3390, 1, 1024]
    - [107, 78.234]
  - - [4096, 3231, 1, 1024]
    - [187, 77.258]
  - - [1024, 2499, 1, 4096]
    - [106, 76.632]
  - - [1024, 3186, 1, 4096]
    - [398, 72.916]
  - - [1024, 3380, 1, 4096]
    - [22, 76.654]
  - - [4096, 3496, 1, 1024]
    - [113, 78.71]
  - - [1024, 3956, 1, 33708]
    - [55, 89.211]
  - - [1024, 3976, 1, 1024]
    - [69, 62.426]
  - - [4096, 2736, 1, 1024]
    - [300, 76.27]
  - - [1024, 3291, 1, 4096]
    - [275, 73.639]
  - - [1024, 3944, 1, 33708]
    - [55, 89.005]
  - - [1024, 3485, 1, 4096]
    - [218, 78.343]
  - - [4096, 3138, 1, 1024]
    - [70, 79.65]
  - - [1024, 3423, 1, 4096]
    - [331, 77.985]
  - - [1024, 3491, 1, 4096]
    - [165, 78.741]
  - - [1024, 3860, 1, 4096]
    - [146, 80.764]
  - - [4096, 3211, 1, 1024]
    - [407, 76.014]
  - - [1024, 3221, 1, 4096]
    - [380, 75.558]
  - - [1024, 2917, 1, 4096]
    - [69, 78.776]
  - - [4096, 3475, 1, 1024]
    - [207, 80.521]
  - - [4096, 3524, 1, 1024]
    - [373, 79.503]
  - - [4096, 2985, 1, 1024]
    - [404, 75.146]
  - - [1024, 3480, 1, 4096]
    - [380, 79.108]
  - - [4096, 3222, 1, 1024]
    - [352, 77.606]
  - - [4096, 3451, 1, 1024]
    - [74, 77.4]
  - - [1024, 3969, 1, 33708]
    - [137, 89.075]
  - - [1024, 3640, 1, 1024]
    - [303, 66.166]
  - - [1024, 3297, 1, 4096]
    - [387, 74.423]
  - - [4096, 3944, 1, 1024]
    - [74, 77.63]
  - - [1024, 3216, 1, 4096]
    - [380, 74.978]
  - - [4096, 3349, 1, 1024]
    - [107, 77.713]
  - - [4096, 3398, 1, 1024]
    - [107, 79.437]
  - - [1024, 3154, 1, 4096]
    - [115, 76.877]
  - - [1024, 3978, 1, 33708]
    - [70, 89.447]
  - - [1024, 3348, 1, 4096]
    - [400, 76.557]
  - - [4096, 3304, 1, 1024]
    - [308, 78.511]
  - - [4096, 4030, 1, 1024]
    - [108, 79.457]
  - - [1024, 4026, 1, 1024]
    - [369, 64.536]
  - - [4096, 3471, 1, 1024]
    - [216, 78.574]
  - - [1024, 3259, 1, 4096]
    - [190, 75.941]
  - - [64, 132, 480, 132]
    - [62, 22.458]
  - - [1024, 3308, 1, 4096]
    - [125, 75.385]
  - - [4096, 3391, 1, 1024]
    - [404, 76.663]
  - - [1024, 3312, 1, 4096]
    - [380, 75.913]
  - - [1024, 3502, 1, 4096]
    - [291, 80.385]
  - - [1024, 3968, 1, 33708]
    - [55, 89.31]
  - - [1024, 3424, 1, 4096]
    - [331, 76.758]
  - - [64, 13, 4672, 13]
    - [45, 2.913]
  - - [4096, 4032, 1, 1024]
    - [10, 80.61]
  - - [1024, 3900, 1, 1024]
    - [24, 60.897]
  - - [4096, 3442, 1, 1024]
    - [21, 77.323]
  - - [1024, 3366, 1, 4096]
    - [170, 75.555]
  - - [4096, 3999, 1, 1024]
    - [81, 78.313]
  - - [1024, 3477, 1, 4096]
    - [303, 78.633]
  - - [1024, 2505, 1, 4096]
    - [192, 76.307]
  - - [4096, 3515, 1, 1024]
    - [5, 78.996]
  - - [1024, 3564, 1, 4096]
    - [291, 82.796]
  - - [4096, 3057, 1, 1024]
    - [227, 77.38]
  - - [1024, 3339, 1, 4096]
    - [400, 75.344]
  - - [4096, 3262, 1, 1024]
    - [308, 78.775]
  - - [1024, 4030, 1, 4096]
    - [69, 83.005]
  - - [1024, 3265, 1, 4096]
    - [190, 75.546]
  - - [1024, 3459, 1, 4096]
    - [385, 80.64]
  - - [4096, 3462, 1, 1024]
    - [186, 77.635]
  - - [64, 85, 752, 85]
    - [85, 15.034]
  - - [1024, 3513, 1, 4096]
    - [17, 79.574]
  - - [1024, 3397, 1, 4096]
    - [275, 76.776]
  - - [4096, 3572, 1, 1024]
    - [5, 79.323]
  - - [4096, 3389, 1, 1024]
    - [136, 76.936]
  - - [4096, 3438, 1, 1024]
    - [26, 77.316]
  - - [64, 102, 624, 100]
    - [418, 18.195]
  - - [1024, 3640, 1, 33708]
    - [389, 91.987]
  - - [1024, 3995, 1, 33708]
    - [70, 89.685]
  - - [1024, 3165, 1, 4096]
    - [109, 79.507]
  - - [4096, 3543, 1, 1024]
    - [264, 80.093]
  - - [4096, 3352, 1, 1024]
    - [69, 77.201]
  - - [1024, 3359, 1, 4096]
    - [383, 76.004]
  - - [1024, 3470, 1, 4096]
    - [398, 79.927]
  - - [64, 15, 4096, 15]
    - [409, 3.189]
  - - [1024, 3392, 1, 4096]
    - [303, 76.38]
  - - [64, 78, 816, 77]
    - [86, 13.359]
  - - [4096, 3137, 1, 1024]
    - [12, 80.846]
  - - [4096, 3506, 1, 1024]
    - [300, 78.904]
  - - [1024, 3095, 1, 4096]
    - [109, 80.374]
  - - [1024, 3859, 1, 4096]
    - [72, 81.039]
  - - [4096, 3369, 1, 1024]
    - [107, 79.276]
  - - [64, 45, 1424, 45]
    - [391, 8.936]
  - - [1024, 3435, 1, 4096]
    - [380, 79.786]
  - - [1024, 3354, 1, 4096]
    - [275, 75.913]
  - - [1024, 3055, 1, 4096]
    - [115, 78.339]
  - - [4096, 3523, 1, 1024]
    - [170, 78.852]
  - - [4096, 3380, 1, 1024]
    - [107, 78.625]
  - - [1024, 3233, 1, 4096]
    - [380, 75.179]
  - - [4096, 3221, 1, 1024]
    - [170, 77.115]
  - - [4096, 3270, 1, 1024]
    - [254, 76.992]
  - - [4096, 3593, 1, 1024]
    - [5, 79.249]
  - - [1024, 3358, 1, 4096]
    - [377, 77.606]
  - - [1024, 3540, 1, 4096]
    - [291, 79.251]
  - - [4096, 3502, 1, 1024]
    - [216, 78.639]
  - - [4096, 2505, 1, 1024]
    - [107, 74.258]
  - - [4096, 3397, 1, 1024]
    - [325, 77.227]
  - - [1024, 3300, 1, 4096]
    - [380, 76.263]
  - - [4096, 3095, 1, 1024]
    - [74, 80.151]
  - - [1024, 3182, 1, 4096]
    - [22, 73.942]
  - - [1024, 3299, 1, 4096]
    - [372, 74.785]
  - - [1024, 3276, 1, 4096]
    - [380, 73.265]
  - - [1024, 3360, 1, 4096]
    - [190, 77.202]
  - - [4096, 3360, 1, 1024]
    - [132, 78.697]
  - - [4096, 2918, 1, 1024]
    - [74, 74.516]
  - - [1024, 3939, 1, 33708]
    - [108, 88.452]
  - - [4096, 3314, 1, 1024]
    - [209, 79.263]
  - - [1024, 3319, 1, 4096]
    - [190, 75.745]
  - - [64, 35, 1808, 35]
    - [409, 7.854]
  - - [1024, 3942, 1, 1024]
    - [137, 60.207]
  - - [1024, 3465, 1, 4096]
    - [337, 77.556]
  - - [4096, 3546, 1, 1024]
    - [192, 79.524]
  - - [1024, 3403, 1, 4096]
    - [291, 79.332]
  - - [1024, 3948, 1, 1024]
    - [419, 61.062]
  - - [4096, 3441, 1, 1024]
    - [107, 80.193]
  - - [1024, 3139, 1, 4096]
    - [115, 79.121]
  - - [1024, 3563, 1, 4096]
    - [387, 80.567]
  - - [1024, 3508, 1, 4096]
    - [88, 80.093]
  - - [1024, 3975, 1, 33708]
    - [397, 89.442]
  - - [1024, 3446, 1, 4096]
    - [218, 77.941]
  - - [1024, 3529, 1, 4096]
    - [310, 78.715]
  - - [64, 112, 576, 112]
    - [284, 20.62]
  - - [4096, 3461, 1, 1024]
    - [108, 78.316]
  - - [1024, 3574, 1, 4096]
    - [190, 81.35]
  - - [1024, 3101, 1, 4096]
    - [109, 79.777]
  - - [1024, 3927, 1, 1024]
    - [264, 61.197]
  - - [4096, 3224, 1, 1024]
    - [26, 77.327]
  - - [4096, 3437, 1, 1024]
    - [207, 78.029]
  - - [4096, 3900, 1, 1024]
    - [192, 80.81]
  - - [1024, 3495, 1, 4096]
    - [165, 79.685]
  - - [1024, 3977, 1, 33708]
    - [55, 89.401]
  - - [1024, 3328, 1, 4096]
    - [400, 78.047]
  - - [4096, 3168, 1, 1024]
    - [63, 80.642]
  - - [1024, 4026, 1, 33708]
    - [55, 90.596]
  - - [1024, 3292, 1, 4096]
    - [310, 74.472]
  - - [1024, 3294, 1, 4096]
    - [106, 76.597]
  - - [4096, 3335, 1, 1024]
    - [107, 78.094]
  - - [4096, 3400, 1, 1024]
    - [153, 78.026]
  - - [1024, 3287, 1, 4096]
    - [165, 73.95]
  - - [1024, 3910, 1, 4096]
    - [70, 81.496]
  - - [1024, 3780, 1, 1024]
    - [230, 63.727]
  - - [4096, 3098, 1, 1024]
    - [216, 79.406]
  - - [1024, 3584, 1, 33708]
    - [385, 90.89]
  - - [64, 29, 2176, 29]
    - [420, 6.131]
  - - [1024, 3371, 1, 4096]
    - [303, 76.321]
  - - [1024, 3546, 1, 4096]
    - [125, 80.287]
  - - [1024, 4012, 1, 1024]
    - [421, 62.13]
  - - [4096, 3505, 1, 1024]
    - [94, 78.94]
  - - [4096, 3554, 1, 1024]
    - [227, 78.83]
  - - [4096, 3063, 1, 1024]
    - [108, 79.367]
  - - [1024, 3900, 1, 33708]
    - [55, 87.626]
  - - [1024, 3345, 1, 4096]
    - [275, 75.669]
  - - [1024, 3357, 1, 4096]
    - [380, 77.967]
  - - [1024, 3282, 1, 4096]
    - [106, 76.654]
  - - [4096, 3484, 1, 1024]
    - [114, 78.624]
  - - [1024, 3557, 1, 4096]
    - [337, 79.518]
  - - [1024, 3476, 1, 4096]
    - [341, 79.032]
  - - [1024, 3751, 1, 1024]
    - [226, 65.554]
  - - [4096, 3379, 1, 1024]
    - [107, 79.34]
  - - [4096, 3428, 1, 1024]
    - [270, 77.187]
  - - [4096, 3126, 1, 1024]
    - [192, 78.742]
  - - [64, 41, 1552, 41]
    - [355, 7.85]
  - - [1024, 3325, 1, 4096]
    - [310, 73.997]
  - - [4096, 3501, 1, 1024]
    - [378, 79.147]
  - - [4096, 3358, 1, 1024]
    - [70, 76.017]
  - - [1024, 3441, 1, 4096]
    - [401, 77.477]
  - - [1024, 3552, 1, 4096]
    - [22, 81.893]
  - - [4096, 3232, 1, 1024]
    - [20, 78.044]
  - - [64, 18, 3440, 18]
    - [382, 3.703]
  - - [1024, 3412, 1, 4096]
    - [331, 77.84]
  - - [1024, 3372, 1, 4096]
    - [380, 78.154]
  - - [1024, 3585, 1, 4096]
    - [22, 80.621]
  - - [4096, 3143, 1, 1024]
    - [192, 79.242]
  - - [4096, 3464, 1, 1024]
    - [7, 78.284]
  - - [1024, 3145, 1, 4096]
    - [109, 79.245]
  - - [4096, 3375, 1, 1024]
    - [207, 78.522]
  - - [4096, 2917, 1, 1024]
    - [257, 74.665]
  - - [4096, 3978, 1, 1024]
    - [12, 79.018]
  - - [1024, 2765, 1, 4096]
    - [403, 82.363]
  - - [64, 148, 432, 148]
    - [145, 24.355]
  - - [1024, 3452, 1, 4096]
    - [385, 79.559]
  - - [4096, 3584, 1, 1024]
    - [26, 79.275]
  - - [4096, 3545, 1, 1024]
    - [113, 80.054]
  - - [1024, 3352, 1, 4096]
    - [303, 75.464]
  - - [64, 159, 400, 160]
    - [167, 25.954]
  - - [4096, 3292, 1, 1024]
    - [87, 77.354]
  - - [1024, 3525, 1, 4096]
    - [165, 79.789]
  - - [1024, 3266, 1, 4096]
    - [291, 75.864]
  - - [1024, 3382, 1, 4096]
    - [125, 77.953]
  - - [4096, 3492, 1, 1024]
    - [25, 78.263]
  - - [4096, 3419, 1, 1024]
    - [69, 76.615]
  - - [1024, 3796, 1, 33708]
    - [291, 95.809]
  - - [1024, 3293, 1, 4096]
    - [398, 75.437]
  - - [4096, 3796, 1, 1024]
    - [153, 80.312]
  - - [1024, 3487, 1, 4096]
    - [400, 78.24]
  - - [4096, 3166, 1, 1024]
    - [12, 79.303]
  - - [64, 102, 624, 101]
    - [8, 15.412]
  - - [1024, 3409, 1, 4096]
    - [106, 80.085]
  - - [1024, 3520, 1, 4096]
    - [401, 79.553]
  - - [1024, 3573, 1, 4096]
    - [71, 80.394]
  - - [4096, 3366, 1, 1024]
    - [192, 77.9]
  - - [4096, 3720, 1, 1024]
    - [108, 83.456]
  - - [4096, 3207, 1, 1024]
    - [92, 76.005]
  - - [4096, 3272, 1, 1024]
    - [92, 76.85]
  - - [1024, 3390, 1, 4096]
    - [275, 76.199]
  - - [4096, 3183, 1, 1024]
    - [315, 76.801]
  - - [4096, 3536, 1, 1024]
    - [325, 81.05]
  - - [4096, 3563, 1, 1024]
    - [107, 78.432]
  - - [1024, 3482, 1, 4096]
    - [275, 78.68]
  - - [4096, 3447, 1, 1024]
    - [94, 77.887]
  - - [4096, 3955, 1, 1024]
    - [74, 78.793]
  - - [4096, 4005, 1, 1024]
    - [74, 79.362]
  - - [1024, 3493, 1, 4096]
    - [275, 79.22]
  - - [4096, 3410, 1, 1024]
    - [107, 78.305]
  - - [1024, 3422, 1, 4096]
    - [190, 79.108]
  - - [1024, 3350, 1, 4096]
    - [190, 77.515]
  - - [4096, 3300, 1, 1024]
    - [20, 78.404]
  - - [4096, 3910, 1, 1024]
    - [129, 81.158]
  - - [1024, 3489, 1, 4096]
    - [291, 80.832]
  - - [4096, 3483, 1, 1024]
    - [319, 79.896]
  - - [4096, 3532, 1, 1024]
    - [108, 79.91]
  - - [64, 101, 624, 101]
    - [355, 17.026]
  - - [4096, 3230, 1, 1024]
    - [26, 75.748]
  - - [4096, 3427, 1, 1024]
    - [360, 78.478]
  - - [1024, 3377, 1, 4096]
    - [380, 78.991]
  - - [1024, 3488, 1, 4096]
    - [190, 81.078]
  - - [1024, 3616, 1, 4096]
    - [380, 83.813]
  - - [1024, 3426, 1, 4096]
    - [398, 77.229]
  - - [4096, 3357, 1, 1024]
    - [264, 75.265]
  - - [4096, 3406, 1, 1024]
    - [107, 79.385]
  - - [1024, 3046, 1, 4096]
    - [293, 78.586]
  - - [1024, 3272, 1, 4096]
    - [76, 74.616]
  - - [1024, 3256, 1, 4096]
    - [275, 73.561]
  - - [4096, 3247, 1, 1024]
    - [87, 76.505]
  - - [4096, 3088, 1, 1024]
    - [5, 78.732]
  - - [1024, 3531, 1, 4096]
    - [341, 79.628]
  - - [64, 160, 400, 160]
    - [355, 24.234]
  - - [4096, 3511, 1, 1024]
    - [319, 79.322]
  - - [1024, 3720, 1, 33708]
    - [380, 93.733]
  - - [1024, 3267, 1, 4096]
    - [125, 74.063]
  - - [1024, 3270, 1, 4096]
    - [106, 76.384]
  - - [1024, 3461, 1, 4096]
    - [385, 80.626]
  - - [4096, 3474, 1, 1024]
    - [153, 80.187]
  - - [4096, 2984, 1, 1024]
    - [74, 76.816]
  - - [1024, 3399, 1, 4096]
    - [165, 77.372]
  - - [4096, 3574, 1, 1024]
    - [335, 79.033]
  - - [1024, 3876, 1, 1024]
    - [224, 62.873]
  - - [4096, 3337, 1, 1024]
    - [107, 78.073]
  - - [4096, 3450, 1, 1024]
    - [107, 77.652]
  - - [1024, 3720, 1, 1024]
    - [93, 65.937]
  - - [1024, 4059, 1, 1024]
    - [378, 65.775]
  - - [4096, 3291, 1, 1024]
    - [352, 77.217]
  - - [64, 93, 688, 93]
    - [8, 15.564]
  - - [4096, 3995, 1, 1024]
    - [74, 78.215]
  - - [64, 147, 432, 147]
    - [167, 22.806]
  - - [4096, 3491, 1, 1024]
    - [153, 79.114]
  - - [4096, 3348, 1, 1024]
    - [107, 77.77]
  - - [4096, 3925, 1, 1024]
    - [210, 81.263]
  - - [4096, 3894, 1, 1024]
    - [324, 81.728]
  - - [1024, 3456, 1, 4096]
    - [331, 81.413]
  - - [1024, 3394, 1, 4096]
    - [400, 77.393]
  - - [64, 100, 624, 102]
    - [83, 17.243]
  - - [4096, 3165, 1, 1024]
    - [74, 81.16]
  - - [4096, 3470, 1, 1024]
    - [186, 76.862]
  - - [1024, 3014, 1, 4096]
    - [200, 80.188]
  - - [1024, 3375, 1, 4096]
    - [398, 76.78]
  - - [4096, 3859, 1, 1024]
    - [264, 79.723]
  - - [4096, 3365, 1, 1024]
    - [69, 78.243]
  - - [1024, 3162, 1, 4096]
    - [109, 79.411]
  - - [1024, 3840, 1, 33708]
    - [385, 96.96]
  - - [1024, 3437, 1, 4096]
    - [190, 78.505]
  - - [4096, 3319, 1, 1024]
    - [7, 78.631]
  - - [1024, 3320, 1, 4096]
    - [401, 74.473]
  - - [64, 23, 2720, 23]
    - [49, 4.633]
  - - [4096, 3328, 1, 1024]
    - [92, 78.991]
  - - [1024, 3235, 1, 4096]
    - [22, 75.034]
  - - [4096, 3282, 1, 1024]
    - [358, 78.223]
  - - [1024, 3367, 1, 4096]
    - [380, 78.344]
  - - [1024, 3542, 1, 4096]
    - [291, 79.866]
  - - [64, 177, 352, 177]
    - [157, 23.554]
  - - [4096, 3145, 1, 1024]
    - [108, 79.92]
  - - [4096, 3514, 1, 1024]
    - [129, 78.231]
  - - [1024, 3432, 1, 4096]
    - [385, 79.357]
  - - [4096, 3409, 1, 1024]
    - [136, 76.427]
  - - [1024, 4012, 1, 33708]
    - [55, 90.158]
  - - [4096, 3876, 1, 1024]
    - [207, 81.658]
  - - [4096, 3299, 1, 1024]
    - [107, 77.37]
  - - [1024, 3168, 1, 4096]
    - [109, 79.401]
  - - [4096, 3681, 1, 1024]
    - [70, 81.076]
  - - [4096, 3531, 1, 1024]
    - [74, 79.128]
  - - [4096, 3388, 1, 1024]
    - [107, 78.976]
  - - [1024, 3720, 1, 4096]
    - [401, 84.985]
  - - [1024, 3332, 1, 4096]
    - [291, 77.376]
  - - [1024, 3273, 1, 4096]
    - [106, 76.233]
  - - [1024, 2935, 1, 4096]
    - [107, 73.508]
  - - [1024, 3467, 1, 4096]
    - [380, 78.634]
  - - [4096, 3542, 1, 1024]
    - [113, 79.541]
  - - [1024, 3130, 1, 4096]
    - [109, 78.904]
  - - [1024, 3405, 1, 4096]
    - [385, 78.928]
  - - [1024, 3960, 1, 1024]
    - [67, 63.864]
  - - [4096, 3405, 1, 1024]
    - [107, 79.499]
  - - [512, 512, 1, 1024]
    - [80, 19.432]
  - - [8, 500, 1, 512]
    - [286, 0.248]
  - - [512, 512, 1, 2000]
    - [128, 26.426]
  - - [32, 512, 1, 512]
    - [164, 0.932]
  - - [100, 1024, 1, 2048]
    - [297, 13.702]
  - - [8, 512, 1, 500]
    - [100, 0.247]
  - - [8, 500, 1, 1024]
    - [131, 0.395]
  - - [100, 2000, 1, 1024]
    - [236, 12.87]
  - - [64, 1024, 1, 100]
    - [36, 0.667]
  - - [64, 1024, 1, 500]
    - [235, 3.626]
  - - [64, 1024, 1, 1024]
    - [285, 6.608]
  - - [128, 2000, 1, 100]
    - [422, 3.161]
  - - [2, 500, 1, 2048]
    - [50, 0.171]
  - - [16, 512, 1, 10]
    - [423, 0.011]
  - - [64, 2000, 1, 1024]
    - [424, 11.842]
  - - [100, 1024, 1, 1024]
    - [99, 8.873]
  - - [8, 512, 1, 10]
    - [425, 0.005]
  - - [16, 500, 1, 2048]
    - [282, 1.535]
  - - [10, 100, 1, 500]
    - [140, 0.061]
  - - [16, 100, 1, 10]
    - [426, 0.002]
  - - [500, 1024, 1, 512]
    - [240, 18.306]
  - - [128, 1024, 1, 512]
    - [285, 5.851]
  - - [512, 500, 1, 2000]
    - [211, 24.994]
  - - [2, 100, 1, 2000]
    - [75, 0.036]
  - - [500, 512, 1, 100]
    - [219, 3.088]
  - - [100, 1024, 1, 500]
    - [297, 4.442]
  - - [256, 100, 1, 2048]
    - [427, 3.996]
  - - [2, 512, 1, 512]
    - [428, 0.062]
  - - [128, 2000, 1, 512]
    - [237, 10.78]
  - - [2, 100, 1, 10]
    - [429, 0.0]
  - - [16, 2000, 1, 2048]
    - [285, 4.91]
  - - [200, 100, 1, 100]
    - [430, 0.269]
  - - [256, 1024, 1, 100]
    - [219, 2.952]
  - - [200, 500, 1, 1024]
    - [37, 8.061]
  - - [500, 100, 1, 100]
    - [431, 0.582]
  - - [4, 100, 1, 10]
    - [219, 0.001]
  - - [32, 100, 1, 512]
    - [100, 0.188]
  - - [100, 2000, 1, 512]
    - [167, 10.023]
  - - [16, 1024, 1, 512]
    - [148, 0.834]
  - - [200, 512, 1, 100]
    - [38, 1.413]
  - - [4, 1024, 1, 1024]
    - [432, 0.376]
  - - [512, 1024, 1, 512]
    - [85, 18.684]
  - - [4, 512, 1, 10]
    - [433, 0.003]
  - - [2, 2048, 1, 2000]
    - [434, 0.734]
  - - [64, 2048, 1, 10]
    - [435, 0.215]
  - - [128, 100, 1, 10]
    - [255, 0.016]
  - - [4, 512, 1, 2048]
    - [51, 0.371]
  - - [64, 2048, 1, 500]
    - [37, 7.002]
  - - [512, 512, 1, 512]
    - [119, 11.06]
  - - [500, 500, 1, 2000]
    - [183, 24.122]
  - - [10, 1024, 1, 2000]
    - [51, 1.755]
  - - [256, 100, 1, 100]
    - [173, 0.332]
  - - [32, 2000, 1, 2048]
    - [44, 9.801]
  - - [64, 1024, 1, 2048]
    - [285, 9.146]
  - - [200, 2048, 1, 512]
    - [138, 16.799]
  - - [256, 500, 1, 10]
    - [422, 0.186]
  - - [16, 1024, 1, 100]
    - [31, 0.23]
  - - [32, 1024, 1, 1024]
    - [103, 3.327]
  - - [512, 500, 1, 512]
    - [255, 12.8]
  - - [128, 1024, 1, 2000]
    - [37, 17.566]
  - - [8, 100, 1, 500]
    - [37, 0.042]
  - - [100, 2000, 1, 2048]
    - [183, 21.0]
  - - [10, 512, 1, 512]
    - [36, 0.257]
  - - [8, 500, 1, 10]
    - [194, 0.006]
  - - [10, 2000, 1, 1024]
    - [436, 1.849]
  - - [16, 1024, 1, 10]
    - [437, 0.02]
  - - [16, 512, 1, 2048]
    - [265, 1.709]
  - - [256, 512, 1, 10]
    - [359, 0.188]
  - - [2, 2000, 1, 100]
    - [438, 0.06]
  - - [128, 512, 1, 2048]
    - [439, 10.056]
  - - [128, 512, 1, 100]
    - [39, 0.957]
  - - [512, 2000, 1, 1024]
    - [109, 44.005]
  - - [64, 500, 1, 2048]
    - [202, 5.452]
  - - [64, 2000, 1, 2048]
    - [64, 17.463]
  - - [64, 2048, 1, 512]
    - [18, 6.437]
  - - [10, 2000, 1, 512]
    - [351, 1.026]
  - - [32, 2000, 1, 500]
    - [102, 3.751]
  - - [64, 2000, 1, 10]
    - [289, 0.2]
  - - [500, 100, 1, 10]
    - [440, 0.078]
  - - [128, 1024, 1, 500]
    - [219, 6.297]
  - - [64, 100, 1, 2048]
    - [100, 1.158]
  - - [64, 100, 1, 10]
    - [173, 0.008]
  - - [16, 512, 1, 500]
    - [102, 0.508]
  - - [32, 2000, 1, 1024]
    - [39, 6.706]
  - - [200, 512, 1, 1024]
    - [267, 10.097]
  - - [128, 2048, 1, 10]
    - [355, 0.383]
  - - [200, 100, 1, 2000]
    - [441, 3.017]
  - - [2, 100, 1, 512]
    - [251, 0.01]
  - - [64, 2048, 1, 100]
    - [442, 1.751]
  - - [32, 512, 1, 100]
    - [208, 0.193]
  - - [16, 512, 1, 1024]
    - [241, 0.817]
  - - [4, 1024, 1, 512]
    - [283, 0.254]
  - - [64, 2000, 1, 100]
    - [430, 1.494]
  - - [512, 2048, 1, 512]
    - [62, 28.501]
  - - [2, 500, 1, 500]
    - [50, 0.055]
  - - [32, 100, 1, 100]
    - [440, 0.042]
  - - [100, 500, 1, 2000]
    - [139, 7.629]
  - - [200, 2000, 1, 100]
    - [54, 3.874]
  - - [10, 512, 1, 10]
    - [443, 0.009]
  - - [100, 500, 1, 2048]
    - [260, 7.744]
  - - [4, 2048, 1, 500]
    - [96, 0.526]
  - - [200, 500, 1, 100]
    - [117, 1.447]
  - - [500, 500, 1, 500]
    - [236, 11.366]
  - - [2, 100, 1, 1024]
    - [75, 0.025]
  - - [128, 2048, 1, 512]
    - [237, 12.377]
  - - [200, 2000, 1, 1024]
    - [236, 22.183]
  - - [32, 512, 1, 1024]
    - [202, 1.556]
  - - [100, 2048, 1, 500]
    - [239, 8.297]
  - - [256, 100, 1, 1024]
    - [39, 2.814]
  - - [16, 2000, 1, 500]
    - [39, 1.875]
  - - [128, 100, 1, 100]
    - [329, 0.169]
  - - [500, 500, 1, 2048]
    - [66, 25.772]
  - - [32, 512, 1, 10]
    - [45, 0.02]
  - - [128, 100, 1, 1024]
    - [48, 1.368]
  - - [16, 500, 1, 2000]
    - [265, 1.486]
  - - [4, 2048, 1, 100]
    - [219, 0.115]
  - - [64, 500, 1, 500]
    - [179, 1.864]
  - - [500, 1024, 1, 2048]
    - [191, 33.176]
  - - [512, 2048, 1, 100]
    - [444, 9.451]
  - - [128, 512, 1, 1024]
    - [179, 5.949]
  - - [128, 512, 1, 2000]
    - [171, 8.527]
  - - [128, 2000, 1, 2000]
    - [183, 25.388]
  - - [2, 512, 1, 10]
    - [292, 0.002]
  - - [10, 512, 1, 500]
    - [135, 0.318]
  - - [4, 1024, 1, 2000]
    - [185, 0.825]
  - - [256, 100, 1, 2000]
    - [131, 3.861]
  - - [512, 2048, 1, 2000]
    - [109, 54.019]
  - - [100, 100, 1, 10]
    - [219, 0.015]
  - - [256, 500, 1, 1024]
    - [252, 11.045]
  - - [128, 512, 1, 10]
    - [173, 0.096]
  - - [256, 100, 1, 500]
    - [103, 1.451]
  - - [64, 100, 1, 512]
    - [48, 0.313]
  - - [64, 512, 1, 500]
    - [102, 1.627]
  - - [64, 2048, 1, 2000]
    - [84, 17.109]
  - - [100, 2048, 1, 1024]
    - [366, 13.377]
  - - [200, 2000, 1, 10]
    - [355, 0.558]
  - - [128, 1024, 1, 100]
    - [62, 1.58]
  - - [16, 2000, 1, 100]
    - [348, 0.337]
  - - [8, 100, 1, 512]
    - [140, 0.039]
  - - [500, 2048, 1, 1024]
    - [109, 41.816]
  - - [500, 2000, 1, 10]
    - [445, 1.143]
  - - [32, 100, 1, 500]
    - [446, 0.189]
  - - [256, 1024, 1, 2048]
    - [130, 29.5]
  - - [32, 500, 1, 2048]
    - [56, 3.113]
  - - [4, 2000, 1, 10]
    - [447, 0.013]
  - - [128, 500, 1, 2000]
    - [148, 9.513]
  - - [8, 1024, 1, 10]
    - [31, 0.013]
  - - [2, 500, 1, 100]
    - [43, 0.012]
  - - [10, 500, 1, 512]
    - [432, 0.292]
  - - [10, 2000, 1, 10]
    - [448, 0.033]
  - - [500, 512, 1, 512]
    - [54, 11.104]
  - - [32, 500, 1, 500]
    - [446, 0.912]
  - - [256, 500, 1, 2000]
    - [60, 16.881]
  - - [100, 500, 1, 100]
    - [47, 0.604]
  - - [500, 2048, 1, 100]
    - [350, 9.359]
  - - [10, 1024, 1, 512]
    - [31, 0.627]
  - - [2, 2048, 1, 512]
    - [449, 0.198]
  - - [256, 512, 1, 100]
    - [260, 1.535]
  - - [10, 2048, 1, 100]
    - [450, 0.288]
  - - [8, 2048, 1, 100]
    - [451, 0.174]
  - - [512, 100, 1, 512]
    - [252, 2.673]
  - - [4, 500, 1, 500]
    - [135, 0.13]
  - - [64, 100, 1, 1024]
    - [51, 0.756]
  - - [2, 2048, 1, 1024]
    - [452, 0.45]
  - - [2, 500, 1, 2000]
    - [265, 0.182]
  - - [512, 1024, 1, 500]
    - [85, 18.821]
  - - [128, 2000, 1, 500]
    - [255, 12.371]
  - - [32, 512, 1, 2048]
    - [56, 3.21]
  - - [10, 100, 1, 2000]
    - [327, 0.195]
  - - [4, 100, 1, 512]
    - [161, 0.023]
  - - [2, 512, 1, 2048]
    - [50, 0.222]
  - - [200, 512, 1, 2048]
    - [44, 14.127]
  - - [200, 2000, 1, 2000]
    - [374, 29.506]
  - - [100, 100, 1, 2000]
    - [50, 1.928]
  - - [500, 2048, 1, 2000]
    - [109, 54.091]
  - - [64, 2048, 1, 2048]
    - [84, 18.419]
  - - [16, 2000, 1, 1024]
    - [103, 2.807]
  - - [512, 2048, 1, 1024]
    - [109, 43.719]
  - - [10, 500, 1, 500]
    - [441, 0.243]
  - - [200, 1024, 1, 2048]
    - [60, 21.82]
  - - [10, 2000, 1, 2000]
    - [203, 2.94]
  - - [8, 2000, 1, 500]
    - [39, 0.79]
  - - [2, 100, 1, 2048]
    - [75, 0.045]
  - - [32, 100, 1, 2048]
    - [263, 0.667]
  - - [512, 512, 1, 10]
    - [422, 0.335]
  - - [512, 500, 1, 10]
    - [422, 0.35]
  - - [16, 100, 1, 1024]
    - [48, 0.178]
  - - [2, 500, 1, 10]
    - [453, 0.002]
  - - [200, 512, 1, 10]
    - [336, 0.122]
  - - [512, 1024, 1, 100]
    - [85, 5.458]
  - - [16, 2000, 1, 2000]
    - [454, 4.841]
  - - [500, 500, 1, 1024]
    - [233, 17.618]
  - - [500, 100, 1, 2048]
    - [139, 7.668]
  - - [256, 1024, 1, 512]
    - [119, 11.433]
  - - [256, 500, 1, 512]
    - [37, 6.115]
  - - [16, 1024, 1, 2000]
    - [38, 2.447]
  - - [200, 500, 1, 2048]
    - [118, 15.618]
  - - [256, 2000, 1, 10]
    - [455, 0.688]
  - - [10, 2048, 1, 2048]
    - [452, 3.339]
  - - [512, 2000, 1, 100]
    - [8, 9.686]
  - - [10, 1024, 1, 1024]
    - [100, 0.976]
  - - [512, 2000, 1, 2048]
    - [115, 55.141]
  - - [500, 1024, 1, 500]
    - [233, 17.839]
  - - [500, 100, 1, 512]
    - [38, 2.871]
  - - [256, 2000, 1, 100]
    - [8, 5.605]
  - - [512, 1024, 1, 2048]
    - [259, 36.81]
  - - [32, 512, 1, 500]
    - [440, 0.957]
  - - [100, 2000, 1, 10]
    - [219, 0.286]
  - - [100, 500, 1, 512]
    - [179, 2.886]
  - - [8, 2000, 1, 512]
    - [102, 0.835]
  - - [100, 2048, 1, 2048]
    - [80, 21.812]
  - - [128, 1024, 1, 2048]
    - [64, 18.012]
  - - [8, 500, 1, 2000]
    - [51, 0.83]
  - - [100, 2000, 1, 500]
    - [79, 8.783]
  - - [100, 2048, 1, 100]
    - [219, 2.64]
  - - [4, 100, 1, 1024]
    - [100, 0.037]
  - - [500, 2048, 1, 2048]
    - [115, 49.49]
  - - [2, 2000, 1, 2048]
    - [456, 0.6]
  - - [200, 2048, 1, 10]
    - [3, 0.541]
  - - [2, 500, 1, 1024]
    - [282, 0.124]
  - - [100, 500, 1, 1024]
    - [61, 4.23]
  - - [16, 2048, 1, 500]
    - [179, 2.099]
  - - [100, 1024, 1, 10]
    - [253, 0.147]
  - - [8, 2048, 1, 1024]
    - [36, 1.732]
  - - [2, 2000, 1, 500]
    - [102, 0.242]
  - - [32, 100, 1, 1024]
    - [100, 0.346]
  - - [500, 2000, 1, 512]
    - [150, 24.933]
  - - [64, 100, 1, 2000]
    - [48, 1.282]
  - - [100, 1024, 1, 2000]
    - [297, 14.064]
  - - [64, 500, 1, 10]
    - [237, 0.047]
  - - [32, 2048, 1, 100]
    - [219, 0.868]
  - - [64, 500, 1, 512]
    - [39, 1.551]
  - - [10, 100, 1, 1024]
    - [446, 0.116]
  - - [16, 512, 1, 100]
    - [451, 0.102]
  - - [4, 100, 1, 2000]
    - [51, 0.083]
  - - [2, 512, 1, 1024]
    - [50, 0.09]
  - - [64, 512, 1, 1024]
    - [179, 3.391]
  - - [10, 2048, 1, 500]
    - [102, 1.203]
  - - [4, 2000, 1, 2048]
    - [457, 1.155]
  - - [512, 100, 1, 2048]
    - [139, 7.056]
  - - [32, 100, 1, 2000]
    - [75, 0.656]
  - - [256, 512, 1, 500]
    - [219, 6.462]
  - - [100, 2000, 1, 100]
    - [219, 2.481]
  - - [8, 2000, 1, 1024]
    - [102, 1.639]
  - - [4, 512, 1, 500]
    - [131, 0.128]
  - - [128, 1024, 1, 10]
    - [458, 0.202]
  - - [4, 500, 1, 1024]
    - [446, 0.235]
  - - [32, 2048, 1, 512]
    - [179, 4.028]
  - - [32, 100, 1, 10]
    - [459, 0.005]
  - - [100, 2048, 1, 10]
    - [34, 0.306]
  - - [512, 500, 1, 100]
    - [460, 3.168]
  - - [128, 2000, 1, 1024]
    - [133, 19.567]
  - - [200, 1024, 1, 500]
    - [44, 10.146]
  - - [32, 2048, 1, 1024]
    - [260, 6.716]
  - - [10, 1024, 1, 2048]
    - [147, 1.939]
  - - [8, 500, 1, 100]
    - [332, 0.049]
  - - [32, 2048, 1, 500]
    - [61, 3.828]
  - - [200, 100, 1, 1024]
    - [179, 2.027]
  - - [16, 100, 1, 100]
    - [47, 0.018]
  - - [8, 1024, 1, 2000]
    - [282, 1.373]
  - - [4, 512, 1, 100]
    - [336, 0.029]
  - - [16, 500, 1, 100]
    - [161, 0.098]
  - - [8, 1024, 1, 2048]
    - [51, 1.576]
  - - [16, 1024, 1, 2048]
    - [428, 2.548]
  - - [10, 2048, 1, 1024]
    - [39, 1.968]
  - - [64, 512, 1, 100]
    - [355, 0.362]
  - - [2, 100, 1, 500]
    - [461, 0.01]
  - - [2, 500, 1, 512]
    - [263, 0.065]
  - - [256, 512, 1, 2000]
    - [60, 17.701]
  - - [128, 500, 1, 1024]
    - [179, 6.619]
  - - [10, 100, 1, 10]
    - [462, 0.002]
  - - [8, 2048, 1, 2048]
    - [463, 2.711]
  - - [16, 2048, 1, 2048]
    - [102, 5.424]
  - - [64, 1024, 1, 10]
    - [464, 0.103]
  - - [500, 100, 1, 500]
    - [96, 2.416]
  - - [256, 1024, 1, 2000]
    - [363, 25.834]
  - - [200, 512, 1, 500]
    - [208, 5.524]
  - - [8, 2000, 1, 10]
    - [311, 0.02]
  - - [64, 2000, 1, 512]
    - [103, 5.963]
  - - [2, 512, 1, 100]
    - [98, 0.014]
  - - [4, 2000, 1, 2000]
    - [465, 1.208]
  - - [200, 1024, 1, 100]
    - [171, 2.286]
  - - [16, 100, 1, 500]
    - [38, 0.082]
  - - [128, 100, 1, 500]
    - [466, 0.789]
  - - [500, 1024, 1, 1024]
    - [350, 28.753]
  - - [200, 1024, 1, 1024]
    - [80, 15.59]
  - - [8, 2048, 1, 512]
    - [261, 1.023]
  - - [200, 2000, 1, 500]
    - [219, 16.105]
  - - [512, 100, 1, 1024]
    - [39, 4.428]
  - - [16, 100, 1, 2000]
    - [251, 0.279]
  - - [500, 512, 1, 2000]
    - [177, 23.562]
  - - [8, 2000, 1, 2048]
    - [203, 2.235]
  - - [256, 2048, 1, 100]
    - [34, 5.4]
  - - [32, 2048, 1, 2000]
    - [285, 9.976]
  - - [200, 500, 1, 512]
    - [252, 4.738]
  - - [10, 512, 1, 100]
    - [437, 0.07]
  - - [16, 2000, 1, 10]
    - [292, 0.055]
  - - [8, 512, 1, 100]
    - [433, 0.057]
  - - [256, 512, 1, 512]
    - [267, 7.538]
  - - [500, 2000, 1, 1024]
    - [109, 37.516]
  - - [512, 512, 1, 500]
    - [0, 10.559]
  - - [256, 2048, 1, 1024]
    - [233, 29.068]
  - - [8, 2048, 1, 2000]
    - [287, 2.376]
