library/src/blas3/Tensile/Logic/asm_full/arcturus_Cijk_Ailk_Bjlk_HSS_BH.yaml
- {MinimumRequiredVersion: 4.23.0}
- arcturus
- gfx908
- [Device 7380, Device 7388, Device 738c, Device 7390]
    SolutionIndex: 0
    SolutionNameMin: Cijk_Ailk_Bjlk_HSS_BH_MT32x32x64_MI16x16x16x1_SE_1LDSB0_AF0EM4_AMAS3_ASEM1_EPS1_GRVW8_GSU1_ISA908_KLA_LRVW4_MAC_NLCA1_NLCB1_PGR1_PLR1_SIA3_SU0_SUS0_SRVW0_TT1_16_VAW2_VW2_WSGRA1_WSGRB1_WG32_8_1_WGM15
    SolutionIndex: 1
    SolutionNameMin: Cijk_Ailk_Bjlk_HSS_BH_MT32x32x64_MI16x16x16x1_SE_1LDSB0_AF0EM8_AMAS3_ASEM1_EPS1_GRVW8_GSU1_ISA908_KLA_LRVW4_MAC_NLCA1_NLCB1_PGR1_PLR1_SIA3_SU0_SUS0_SRVW4_TT1_16_VAW2_VW2_WSGRA1_WSGRB1_WG32_8_1_WGM1
    SolutionIndex: 2
    SolutionNameMin: Cijk_Ailk_Bjlk_HSS_BH_MT32x32x64_MI16x16x16x1_SE_1LDSB0_AF0EM4_AMAS3_ASEM1_EPS1_GRVW4_GSU1_ISA908_KLA_LRVW4_MAC_NLCA1_NLCB1_PGR1_PLR1_SIA3_SU32_SUS128_SRVW0_TT1_16_VAW2_VW2_WSGRA1_WSGRB1_WG32_8_1_WGM15
    SolutionIndex: 3
    SolutionNameMin: Cijk_Ailk_Bjlk_HSS_BH_MT32x32x64_MI16x16x16x1_SE_1LDSB0_AF0EM4_AMAS3_ASEM1_EPS1_GRVW4_GSU1_ISA908_KLA_LRVW4_MAC_NLCA1_NLCB1_PGR1_PLR1_SIA3_SU32_SUS128_SRVW0_TT1_16_VAW2_VW2_WSGRA1_WSGRB1_WG32_8_1_WGM1
    SolutionIndex: 4
    SolutionNameMin: Cijk_Ailk_Bjlk_HSS_BH_MT32x32x32_MI16x16x16x1_SE_1LDSB0_AF0EM4_AMAS3_ASEM1_EPS1_GRVW4_GSU1_ISA908_KLA_LRVW4_MAC_NLCA1_NLCB1_PGR1_PLR1_SIA3_SU0_SUS0_SRVW0_TT1_16_VAW2_VW2_WSGRA1_WSGRB1_WG32_8_1_WGM15
    SolutionIndex: 5
    SolutionNameMin: Cijk_Ailk_Bjlk_HSS_BH_MT32x32x32_MI16x16x16x1_SE_1LDSB0_AF0EM8_AMAS3_ASEM1_EPS1_GRVW2_GSU1_ISA908_KLA_LRVW4_MAC_NLCA1_NLCB1_PGR1_PLR1_SIA3_SU0_SUS0_SRVW4_TT1_16_VAW2_VW2_WSGRA1_WSGRB1_WG32_8_1_WGM1
    SolutionIndex: 6
    SolutionNameMin: Cijk_Ailk_Bjlk_HSS_BH_MT32x64x32_MI16x16x16x1_SE_1LDSB0_AF0EM8_AMAS3_ASEM1_EPS1_GRVW8_GSU1_ISA908_KLA_LRVW4_MAC_NLCA1_NLCB1_PGR1_PLR1_SIA3_SU0_SUS0_SRVW4_TT1_32_VAW2_VW2_WSGRA1_WSGRB1_WG32_8_1_WGM15
    SolutionIndex: 7
    SolutionNameMin: Cijk_Ailk_Bjlk_HSS_BH_MT64x64x64_MI32x32x8x1_SE_1LDSB0_AF0EM8_AMAS3_ASEM1_EPS1_GRVW8_GSU1_ISA908_KLA_LRVW4_MAC_NLCA1_NLCB1_PGR1_PLR1_SIA3_SU0_SUS0_SRVW4_TT1_32_VAW2_VW2_WSGRA1_WSGRB1_WG64_4_1_WGM2
    SolutionIndex: 8
    SolutionNameMin: Cijk_Ailk_Bjlk_HSS_BH_MT64x64x64_MI32x32x8x1_SE_1LDSB0_AF0EM8_AMAS3_ASEM1_EPS1_GRVW8_GSU1_ISA908_KLA_LRVW4_MAC_NLCA1_NLCB1_PGR1_PLR1_SIA3_SU0_SUS0_SRVW4_TT1_32_VAW2_VW2_WSGRA1_WSGRB1_WG64_4_1_WGM15
    SolutionIndex: 9
    SolutionNameMin: Cijk_Ailk_Bjlk_HSS_BH_MT32x32x64_MI16x16x16x1_SE_1LDSB0_AF0EM8_AMAS3_ASEM1_EPS1_GRVW4_GSU5_ISA908_KLA_LRVW4_MAC_NLCA1_NLCB1_PGR1_PLR1_SIA3_SU0_SUS0_SRVW0_TT1_16_VAW1_VW2_WSGRA1_WSGRB1_WG32_8_1_WGM1
    SolutionIndex: 10
    SolutionNameMin: Cijk_Ailk_Bjlk_HSS_BH_MT32x32x128_MI16x16x16x1_SE_1LDSB0_AF0EM4_AMAS3_ASEM1_EPS1_GRVW2_GSU1_ISA908_KLA_LRVW4_MAC_NLCA1_NLCB1_PGR1_PLR1_SIA3_SU16_SUS256_SRVW0_TT1_16_VAW2_VW2_WSGRA1_WSGRB1_WG32_8_1_WGM1
    SolutionIndex: 11
    SolutionNameMin: Cijk_Ailk_Bjlk_HSS_BH_MT32x32x128_MI16x16x16x1_SE_1LDSB0_AF0EM4_AMAS3_ASEM1_EPS1_GRVW2_GSU1_ISA908_KLA_LRVW4_MAC_NLCA1_NLCB1_PGR1_PLR1_SIA3_SU32_SUS256_SRVW0_TT1_16_VAW2_VW2_WSGRA1_WSGRB1_WG32_8_1_WGM1
    SolutionIndex: 12
    SolutionNameMin: Cijk_Ailk_Bjlk_HSS_BH_MT32x32x128_MI16x16x16x1_SE_1LDSB0_AF0EM4_AMAS3_ASEM1_EPS1_GRVW2_GSU1_ISA908_KLA_LRVW4_MAC_NLCA1_NLCB1_PGR1_PLR1_SIA3_SU0_SUS0_SRVW0_TT1_16_VAW2_VW2_WSGRA1_WSGRB1_WG32_8_1_WGM1
    SolutionIndex: 13
    SolutionNameMin: Cijk_Ailk_Bjlk_HSS_BH_MT32x32x128_MI16x16x16x1_SE_1LDSB0_AF0EM1_AMAS3_ASEM1_EPS1_GRVW8_GSU1_ISA908_KLA_LRVW4_MAC_NLCA1_NLCB1_PGR1_PLR1_SIA3_SU0_SUS0_SRVW0_TT1_16_VAW2_VW2_WSGRA1_WSGRB1_WG32_8_1_WGM2
    SolutionIndex: 14
    SolutionNameMin: Cijk_Ailk_Bjlk_HSS_BH_MT32x32x64_MI16x16x16x1_SE_1LDSB0_AF0EM1_AMAS3_ASEM1_EPS1_GRVW8_GSU1_ISA908_KLA_LRVW4_MAC_NLCA1_NLCB1_PGR1_PLR1_SIA3_SU0_SUS0_SRVW0_TT1_16_VAW2_VW2_WSGRA1_WSGRB1_WG32_8_1_WGM2
    SolutionIndex: 15
    SolutionNameMin: Cijk_Ailk_Bjlk_HSS_BH_MT64x64x64_MI32x32x8x1_SE_1LDSB0_AF0EM8_AMAS3_ASEM1_EPS1_GRVW8_GSU1_ISA908_KLA_LRVW4_MAC_NLCA1_NLCB1_PGR1_PLR1_SIA3_SU0_SUS0_SRVW4_TT1_32_VAW2_VW2_WSGRA1_WSGRB1_WG64_4_1_WGM1
    SolutionIndex: 16
    SolutionNameMin: Cijk_Ailk_Bjlk_HSS_BH_MT32x32x64_MI16x16x16x1_SE_1LDSB0_AF0EM8_AMAS3_ASEM1_EPS1_GRVW2_GSU7_ISA908_KLA_LRVW4_MAC_NLCA1_NLCB1_PGR1_PLR1_SIA3_SU0_SUS0_SRVW0_TT1_16_VAW1_VW2_WSGRA1_WSGRB1_WG32_8_1_WGM15
    SolutionIndex: 17
    SolutionNameMin: Cijk_Ailk_Bjlk_HSS_BH_MT64x32x64_MI16x16x16x1_SE_1LDSB0_AF0EM8_AMAS3_ASEM1_EPS1_GRVW8_GSU5_ISA908_KLA_LRVW4_MAC_NLCA1_NLCB1_PGR1_PLR1_SIA3_SU32_SUS128_SRVW0_TT2_16_VAW1_VW2_WSGRA1_WSGRB1_WG32_8_1_WGM15
    SolutionIndex: 18
    SolutionNameMin: Cijk_Ailk_Bjlk_HSS_BH_MT64x64x64_MI32x32x8x1_SE_1LDSB0_AF0EM8_AMAS3_ASEM1_EPS1_GRVW4_GSU7_ISA908_KLA_LRVW4_MAC_NLCA1_NLCB1_PGR1_PLR1_SIA3_SU0_SUS0_SRVW0_TT1_32_VAW1_VW2_WSGRA1_WSGRB1_WG64_4_1_WGM1
    SolutionIndex: 19
    SolutionNameMin: Cijk_Ailk_Bjlk_HSS_BH_MT64x64x32_MI32x32x8x1_SE_1LDSB0_AF0EM8_AMAS3_ASEM1_EPS1_GRVW8_GSU7_ISA908_KLA_LRVW4_MAC_NLCA1_NLCB1_PGR1_PLR1_SIA3_SU0_SUS0_SRVW0_TT1_32_VAW1_VW2_WSGRA1_WSGRB1_WG64_4_1_WGM1
    SolutionIndex: 20
    SolutionNameMin: Cijk_Ailk_Bjlk_HSS_BH_MT128x128x32_MI32x32x8x1_SE_1LDSB0_AF0EM8_AMAS3_ASEM1_EPS1_GRVW8_GSU7_ISA908_KLA_LRVW4_MAC_NLCA1_NLCB1_PGR1_PLR1_SIA3_SU0_SUS0_SRVW0_TT2_64_VAW1_VW2_WSGRA1_WSGRB1_WG64_4_1_WGM1
    SolutionIndex: 21
    SolutionNameMin: Cijk_Ailk_Bjlk_HSS_BH_MT128x128x64_MI32x32x8x1_SE_1LDSB0_AF0EM8_AMAS3_ASEM1_EPS1_GRVW8_GSU5_ISA908_KLA_LRVW4_MAC_NLCA1_NLCB1_PGR1_PLR1_SIA3_SU0_SUS0_SRVW0_TT2_64_VAW1_VW2_WSGRA1_WSGRB1_WG64_4_1_WGM1
    SolutionIndex: 22
    SolutionNameMin: Cijk_Ailk_Bjlk_HSS_BH_MT64x32x128_MI16x16x16x1_SE_1LDSB0_AF0EM4_AMAS3_ASEM1_EPS1_GRVW8_GSU1_ISA908_KLA_LRVW4_MAC_NLCA1_NLCB1_PGR1_PLR1_SIA3_SU0_SUS0_SRVW4_TT2_16_VAW2_VW2_WSGRA1_WSGRB1_WG32_8_1_WGM1
    SolutionIndex: 23
    SolutionNameMin: Cijk_Ailk_Bjlk_HSS_BH_MT64x64x128_MI32x32x8x1_SE_1LDSB0_AF0EM4_AMAS3_ASEM1_EPS1_GRVW8_GSU1_ISA908_KLA_LRVW4_MAC_NLCA1_NLCB1_PGR1_PLR1_SIA3_SU16_SUS256_SRVW4_TT1_32_VAW2_VW2_WSGRA1_WSGRB1_WG64_4_1_WGM15
    SolutionIndex: 24
    SolutionNameMin: Cijk_Ailk_Bjlk_HSS_BH_MT64x64x128_MI32x32x8x1_SE_1LDSB0_AF0EM4_AMAS3_ASEM1_EPS1_GRVW8_GSU1_ISA908_KLA_LRVW4_MAC_NLCA1_NLCB1_PGR1_PLR1_SIA3_SU16_SUS256_SRVW4_TT1_32_VAW2_VW2_WSGRA1_WSGRB1_WG64_4_1_WGM1
    SolutionIndex: 25
    SolutionNameMin: Cijk_Ailk_Bjlk_HSS_BH_MT128x128x64_MI32x32x8x1_SE_1LDSB0_AF0EM8_AMAS3_ASEM1_EPS1_GRVW8_GSU3_ISA908_KLA_LRVW4_MAC_NLCA1_NLCB1_PGR1_PLR1_SIA3_SU32_SUS256_SRVW0_TT2_64_VAW1_VW2_WSGRA1_WSGRB1_WG64_4_1_WGM15
    SolutionIndex: 26
    SolutionNameMin: Cijk_Ailk_Bjlk_HSS_BH_MT128x128x64_MI32x32x8x1_SE_1LDSB0_AF0EM8_AMAS3_ASEM1_EPS1_GRVW8_GSU3_ISA908_KLA_LRVW4_MAC_NLCA1_NLCB1_PGR1_PLR1_SIA3_SU0_SUS0_SRVW0_TT2_64_VAW1_VW2_WSGRA1_WSGRB1_WG64_4_1_WGM2
    SolutionIndex: 27
    SolutionNameMin: Cijk_Ailk_Bjlk_HSS_BH_MT64x64x128_MI32x32x8x1_SE_1LDSB0_AF0EM4_AMAS3_ASEM1_EPS1_GRVW8_GSU1_ISA908_KLA_LRVW4_MAC_NLCA1_NLCB1_PGR1_PLR1_SIA3_SU32_SUS256_SRVW4_TT1_32_VAW2_VW2_WSGRA1_WSGRB1_WG64_4_1_WGM1
    SolutionIndex: 28
    SolutionNameMin: Cijk_Ailk_Bjlk_HSS_BH_MT128x64x64_MI32x32x8x1_SE_1LDSB0_AF0EM4_AMAS3_ASEM1_EPS1_GRVW8_GSU1_ISA908_KLA_LRVW4_MAC_NLCA1_NLCB1_PGR1_PLR1_SIA3_SU0_SUS0_SRVW4_TT2_32_VAW2_VW2_WSGRA1_WSGRB1_WG64_4_1_WGM15
    SolutionIndex: 29
    SolutionNameMin: Cijk_Ailk_Bjlk_HSS_BH_MT64x64x128_MI32x32x8x1_SE_1LDSB0_AF0EM4_AMAS3_ASEM1_EPS1_GRVW8_GSU1_ISA908_KLA_LRVW4_MAC_NLCA1_NLCB1_PGR1_PLR1_SIA3_SU32_SUS256_SRVW4_TT1_32_VAW2_VW2_WSGRA1_WSGRB1_WG64_4_1_WGM15
    SolutionIndex: 30
    SolutionNameMin: Cijk_Ailk_Bjlk_HSS_BH_MT32x32x64_MI16x16x16x1_SE_1LDSB0_AF0EM4_AMAS3_ASEM1_EPS1_GRVW8_GSU1_ISA908_KLA_LRVW4_MAC_NLCA1_NLCB1_PGR1_PLR1_SIA3_SU32_SUS128_SRVW0_TT1_16_VAW2_VW2_WSGRA1_WSGRB1_WG32_8_1_WGM1
    SolutionIndex: 31
    SolutionNameMin: Cijk_Ailk_Bjlk_HSS_BH_MT32x32x64_MI16x16x16x1_SE_1LDSB0_AF0EM4_AMAS3_ASEM1_EPS1_GRVW8_GSU1_ISA908_KLA_LRVW4_MAC_NLCA1_NLCB1_PGR1_PLR1_SIA3_SU0_SUS0_SRVW0_TT1_16_VAW2_VW2_WSGRA1_WSGRB1_WG32_8_1_WGM2
    SolutionIndex: 32
    SolutionNameMin: Cijk_Ailk_Bjlk_HSS_BH_MT64x64x64_MI32x32x8x1_SE_1LDSB0_AF0EM4_AMAS3_ASEM1_EPS1_GRVW8_GSU1_ISA908_KLA_LRVW4_MAC_NLCA1_NLCB1_PGR1_PLR1_SIA3_SU16_SUS128_SRVW4_TT1_32_VAW2_VW2_WSGRA1_WSGRB1_WG64_4_1_WGM1
    SolutionIndex: 33
    SolutionNameMin: Cijk_Ailk_Bjlk_HSS_BH_MT64x64x64_MI32x32x8x1_SE_1LDSB0_AF0EM4_AMAS3_ASEM1_EPS1_GRVW8_GSU1_ISA908_KLA_LRVW4_MAC_NLCA1_NLCB1_PGR1_PLR1_SIA3_SU16_SUS256_SRVW4_TT1_32_VAW2_VW2_WSGRA1_WSGRB1_WG64_4_1_WGM2
    SolutionIndex: 34
    SolutionNameMin: Cijk_Ailk_Bjlk_HSS_BH_MT64x64x128_MI32x32x8x1_SE_1LDSB0_AF0EM1_AMAS3_ASEM1_EPS1_GRVW8_GSU1_ISA908_KLA_LRVW4_MAC_NLCA1_NLCB1_PGR1_PLR1_SIA3_SU32_SUS256_SRVW4_TT1_32_VAW2_VW2_WSGRA1_WSGRB1_WG64_4_1_WGM1
    SolutionIndex: 35
    SolutionNameMin: Cijk_Ailk_Bjlk_HSS_BH_MT32x64x128_MI16x16x16x1_SE_1LDSB0_AF0EM1_AMAS3_ASEM1_EPS1_GRVW8_GSU1_ISA908_KLA_LRVW4_MAC_NLCA1_NLCB1_PGR1_PLR1_SIA3_SU16_SUS256_SRVW0_TT1_32_VAW2_VW2_WSGRA1_WSGRB1_WG32_8_1_WGM15
    SolutionIndex: 36
    SolutionNameMin: Cijk_Ailk_Bjlk_HSS_BH_MT64x128x64_MI32x32x8x1_SE_1LDSB0_AF0EM1_AMAS3_ASEM1_EPS1_GRVW8_GSU1_ISA908_KLA_LRVW4_MAC_NLCA1_NLCB1_PGR1_PLR1_SIA3_SU16_SUS256_SRVW4_TT1_64_VAW2_VW2_WSGRA1_WSGRB1_WG64_4_1_WGM15
    SolutionIndex: 37
    SolutionNameMin: Cijk_Ailk_Bjlk_HSS_BH_MT64x64x32_MI32x32x8x1_SE_1LDSB0_AF0EM8_AMAS3_ASEM1_EPS1_GRVW8_GSU1_ISA908_KLA_LRVW4_MAC_NLCA1_NLCB1_PGR1_PLR1_SIA3_SU32_SUS128_SRVW4_TT1_32_VAW2_VW2_WSGRA1_WSGRB1_WG64_4_1_WGM1
    SolutionIndex: 38
    SolutionNameMin: Cijk_Ailk_Bjlk_HSS_BH_MT64x128x32_MI32x32x8x1_SE_1LDSB0_AF0EM8_AMAS3_ASEM1_EPS1_GRVW8_GSU1_ISA908_KLA_LRVW4_MAC_NLCA1_NLCB1_PGR1_PLR1_SIA3_SU0_SUS0_SRVW4_TT1_64_VAW2_VW2_WSGRA1_WSGRB1_WG64_4_1_WGM15
    SolutionIndex: 39
    SolutionNameMin: Cijk_Ailk_Bjlk_HSS_BH_MT64x128x32_MI32x32x8x1_SE_1LDSB0_AF0EM4_AMAS3_ASEM1_EPS1_GRVW8_GSU1_ISA908_KLA_LRVW4_MAC_NLCA1_NLCB1_PGR1_PLR1_SIA3_SU32_SUS128_SRVW4_TT1_64_VAW2_VW2_WSGRA1_WSGRB1_WG64_4_1_WGM2
    SolutionIndex: 40
    SolutionNameMin: Cijk_Ailk_Bjlk_HSS_BH_MT64x64x32_MI32x32x8x1_SE_1LDSB0_AF0EM8_AMAS3_ASEM1_EPS1_GRVW8_GSU1_ISA908_KLA_LRVW4_MAC_NLCA1_NLCB1_PGR1_PLR1_SIA3_SU0_SUS0_SRVW4_TT1_32_VAW2_VW2_WSGRA1_WSGRB1_WG64_4_1_WGM15
    SolutionIndex: 41
    SolutionNameMin: Cijk_Ailk_Bjlk_HSS_BH_MT128x96x32_MI32x32x8x1_SE_1LDSB0_AF0EM4_AMAS3_ASEM1_EPS1_GRVW4_GSU1_ISA908_KLA_LRVW4_MAC_NLCA1_NLCB3_PGR1_PLR1_SIA3_SU0_SUS0_SRVW4_TT1_96_VAW2_VW2_WSGRA1_WSGRB1_WG128_2_1_WGM2
    SolutionIndex: 42
    SolutionNameMin: Cijk_Ailk_Bjlk_HSS_BH_MT64x128x32_MI32x32x8x1_SE_1LDSB0_AF0EM8_AMAS3_ASEM1_EPS1_GRVW8_GSU1_ISA908_KLA_LRVW4_MAC_NLCA1_NLCB1_PGR1_PLR1_SIA3_SU32_SUS256_SRVW4_TT1_64_VAW2_VW2_WSGRA1_WSGRB1_WG64_4_1_WGM1
    SolutionIndex: 43
    SolutionNameMin: Cijk_Ailk_Bjlk_HSS_BH_MT64x128x16_MI32x32x8x1_SE_1LDSB0_AF0EM8_AMAS3_ASEM1_EPS1_GRVW8_GSU1_ISA908_KLA_LRVW4_MAC_NLCA1_NLCB1_PGR1_PLR1_SIA3_SU0_SUS0_SRVW4_TT1_64_VAW2_VW2_WSGRA1_WSGRB1_WG64_4_1_WGM15
    SolutionIndex: 44
    SolutionNameMin: Cijk_Ailk_Bjlk_HSS_BH_MT64x256x16_MI32x32x8x1_SE_1LDSB0_AF0EM8_AMAS3_ASEM1_EPS1_GRVW8_GSU1_ISA908_KLA_LRVW4_MAC_NLCA1_NLCB1_PGR1_PLR1_SIA3_SU0_SUS0_SRVW4_TT1_128_VAW2_VW2_WSGRA1_WSGRB1_WG64_4_1_WGM1
    SolutionIndex: 45
    SolutionNameMin: Cijk_Ailk_Bjlk_HSS_BH_MT64x128x32_MI32x32x8x1_SE_1LDSB0_AF0EM8_AMAS3_ASEM1_EPS1_GRVW8_GSU1_ISA908_KLA_LRVW4_MAC_NLCA1_NLCB1_PGR1_PLR1_SIA3_SU0_SUS0_SRVW4_TT1_64_VAW2_VW2_WSGRA1_WSGRB1_WG64_4_1_WGM1
    SolutionIndex: 46
    SolutionNameMin: Cijk_Ailk_Bjlk_HSS_BH_MT64x64x32_MI32x32x8x1_SE_1LDSB0_AF0EM8_AMAS3_ASEM1_EPS1_GRVW8_GSU1_ISA908_KLA_LRVW4_MAC_NLCA1_NLCB1_PGR1_PLR1_SIA3_SU0_SUS0_SRVW4_TT1_32_VAW2_VW2_WSGRA1_WSGRB1_WG64_4_1_WGM2
    SolutionIndex: 47
    SolutionNameMin: Cijk_Ailk_Bjlk_HSS_BH_MT128x96x32_MI32x32x8x1_SE_1LDSB0_AF0EM8_AMAS3_ASEM1_EPS1_GRVW4_GSU1_ISA908_KLA_LRVW4_MAC_NLCA1_NLCB3_PGR1_PLR1_SIA3_SU0_SUS0_SRVW4_TT1_96_VAW2_VW2_WSGRA1_WSGRB1_WG128_2_1_WGM1
    SolutionIndex: 48
    SolutionNameMin: Cijk_Ailk_Bjlk_HSS_BH_MT64x128x32_MI32x32x8x1_SE_1LDSB0_AF0EM4_AMAS3_ASEM1_EPS1_GRVW8_GSU1_ISA908_KLA_LRVW4_MAC_NLCA1_NLCB1_PGR1_PLR1_SIA3_SU0_SUS0_SRVW4_TT1_64_VAW2_VW2_WSGRA1_WSGRB1_WG64_4_1_WGM1
    SolutionIndex: 49
    SolutionNameMin: Cijk_Ailk_Bjlk_HSS_BH_MT128x96x32_MI32x32x8x1_SE_1LDSB0_AF0EM4_AMAS3_ASEM1_EPS1_GRVW4_GSU1_ISA908_KLA_LRVW4_MAC_NLCA1_NLCB3_PGR1_PLR1_SIA3_SU0_SUS0_SRVW4_TT1_96_VAW2_VW2_WSGRA1_WSGRB1_WG128_2_1_WGM15
    SolutionIndex: 50
    SolutionNameMin: Cijk_Ailk_Bjlk_HSS_BH_MT64x256x16_MI32x32x8x1_SE_1LDSB0_AF0EM1_AMAS3_ASEM1_EPS1_GRVW8_GSU1_ISA908_KLA_LRVW4_MAC_NLCA1_NLCB1_PGR1_PLR1_SIA3_SU0_SUS0_SRVW4_TT1_128_VAW2_VW2_WSGRA1_WSGRB1_WG64_4_1_WGM1
    SolutionIndex: 51
    SolutionNameMin: Cijk_Ailk_Bjlk_HSS_BH_MT128x160x16_MI32x32x8x1_SE_1LDSB0_AF0EM4_AMAS3_ASEM1_EPS1_GRVW2_GSU1_ISA908_KLA_LRVW4_MAC_NLCA1_NLCB5_PGR1_PLR1_SIA3_SU16_SUS128_SRVW4_TT1_160_VAW2_VW2_WSGRA1_WSGRB1_WG128_2_1_WGM1
    SolutionIndex: 52
    SolutionNameMin: Cijk_Ailk_Bjlk_HSS_BH_MT128x96x32_MI32x32x8x1_SE_1LDSB0_AF0EM8_AMAS3_ASEM1_EPS1_GRVW4_GSU1_ISA908_KLA_LRVW4_MAC_NLCA1_NLCB3_PGR1_PLR1_SIA3_SU0_SUS0_SRVW4_TT1_96_VAW2_VW2_WSGRA1_WSGRB1_WG128_2_1_WGM15
    SolutionIndex: 53
    SolutionNameMin: Cijk_Ailk_Bjlk_HSS_BH_MT128x96x16_MI32x32x8x1_SE_1LDSB0_AF0EM4_AMAS3_ASEM1_EPS1_GRVW2_GSU1_ISA908_KLA_LRVW4_MAC_NLCA1_NLCB3_PGR1_PLR1_SIA3_SU16_SUS128_SRVW4_TT1_96_VAW2_VW2_WSGRA1_WSGRB1_WG128_2_1_WGM2
    SolutionIndex: 54
    SolutionNameMin: Cijk_Ailk_Bjlk_HSS_BH_MT64x32x32_MI16x16x16x1_SE_1LDSB0_AF0EM1_AMAS3_ASEM1_EPS1_GRVW8_GSU1_ISA908_KLA_LRVW4_MAC_NLCA1_NLCB1_PGR1_PLR1_SIA3_SU0_SUS0_SRVW4_TT2_16_VAW2_VW2_WSGRA1_WSGRB1_WG32_8_1_WGM2
    SolutionIndex: 55
    SolutionNameMin: Cijk_Ailk_Bjlk_HSS_BH_MT128x96x16_MI32x32x8x1_SE_1LDSB0_AF0EM4_AMAS3_ASEM1_EPS1_GRVW2_GSU1_ISA908_KLA_LRVW4_MAC_NLCA1_NLCB3_PGR1_PLR1_SIA3_SU32_SUS128_SRVW4_TT1_96_VAW2_VW2_WSGRA1_WSGRB1_WG128_2_1_WGM2
    SolutionIndex: 56
    SolutionNameMin: Cijk_Ailk_Bjlk_HSS_BH_MT64x128x32_MI32x32x8x1_SE_1LDSB0_AF0EM8_AMAS3_ASEM1_EPS1_GRVW8_GSU1_ISA908_KLA_LRVW4_MAC_NLCA1_NLCB1_PGR1_PLR1_SIA3_SU32_SUS128_SRVW4_TT1_64_VAW2_VW2_WSGRA1_WSGRB1_WG64_4_1_WGM2
    SolutionIndex: 57
    SolutionNameMin: Cijk_Ailk_Bjlk_HSS_BH_MT64x128x32_MI32x32x8x1_SE_1LDSB0_AF0EM8_AMAS3_ASEM1_EPS1_GRVW8_GSU1_ISA908_KLA_LRVW4_MAC_NLCA1_NLCB1_PGR1_PLR1_SIA3_SU0_SUS0_SRVW4_TT1_64_VAW2_VW2_WSGRA1_WSGRB1_WG64_4_1_WGM2
    SolutionIndex: 58
    SolutionNameMin: Cijk_Ailk_Bjlk_HSS_BH_MT32x32x32_MI16x16x16x1_SE_1LDSB0_AF0EM4_AMAS3_ASEM1_EPS1_GRVW8_GSU1_ISA908_KLA_LRVW4_MAC_NLCA1_NLCB1_PGR1_PLR1_SIA3_SU0_SUS0_SRVW0_TT1_16_VAW2_VW2_WSGRA1_WSGRB1_WG32_8_1_WGM1
    SolutionIndex: 59
    SolutionNameMin: Cijk_Ailk_Bjlk_HSS_BH_MT128x96x32_MI32x32x8x1_SE_1LDSB0_AF0EM8_AMAS3_ASEM1_EPS1_GRVW4_GSU1_ISA908_KLA_LRVW4_MAC_NLCA1_NLCB3_PGR1_PLR1_SIA3_SU0_SUS0_SRVW4_TT1_96_VAW2_VW2_WSGRA1_WSGRB1_WG128_2_1_WGM2
    SolutionIndex: 60
    SolutionNameMin: Cijk_Ailk_Bjlk_HSS_BH_MT128x96x16_MI32x32x8x1_SE_1LDSB0_AF0EM8_AMAS3_ASEM1_EPS1_GRVW2_GSU1_ISA908_KLA_LRVW4_MAC_NLCA1_NLCB3_PGR1_PLR1_SIA3_SU32_SUS256_SRVW4_TT1_96_VAW2_VW2_WSGRA1_WSGRB1_WG128_2_1_WGM15
    SolutionIndex: 61
    SolutionNameMin: Cijk_Ailk_Bjlk_HSS_BH_MT128x96x32_MI32x32x8x1_SE_1LDSB0_AF0EM4_AMAS3_ASEM1_EPS1_GRVW4_GSU1_ISA908_KLA_LRVW4_MAC_NLCA1_NLCB3_PGR1_PLR1_SIA3_SU0_SUS0_SRVW4_TT1_96_VAW2_VW2_WSGRA1_WSGRB1_WG128_2_1_WGM1
    SolutionIndex: 62
    SolutionNameMin: Cijk_Ailk_Bjlk_HSS_BH_MT64x64x32_MI32x32x8x1_SE_1LDSB0_AF0EM8_AMAS3_ASEM1_EPS1_GRVW8_GSU1_ISA908_KLA_LRVW4_MAC_NLCA1_NLCB1_PGR1_PLR1_SIA3_SU0_SUS0_SRVW4_TT1_32_VAW2_VW2_WSGRA1_WSGRB1_WG64_4_1_WGM1
    SolutionIndex: 63
    SolutionNameMin: Cijk_Ailk_Bjlk_HSS_BH_MT128x96x16_MI32x32x8x1_SE_1LDSB0_AF0EM8_AMAS3_ASEM1_EPS1_GRVW2_GSU1_ISA908_KLA_LRVW4_MAC_NLCA1_NLCB3_PGR1_PLR1_SIA3_SU0_SUS0_SRVW4_TT1_96_VAW2_VW2_WSGRA1_WSGRB1_WG128_2_1_WGM2
    SolutionIndex: 64
    SolutionNameMin: Cijk_Ailk_Bjlk_HSS_BH_MT128x96x16_MI32x32x8x1_SE_1LDSB0_AF0EM8_AMAS3_ASEM1_EPS1_GRVW2_GSU1_ISA908_KLA_LRVW4_MAC_NLCA1_NLCB3_PGR1_PLR1_SIA3_SU0_SUS0_SRVW4_TT1_96_VAW2_VW2_WSGRA1_WSGRB1_WG128_2_1_WGM1
    SolutionIndex: 65
    SolutionNameMin: Cijk_Ailk_Bjlk_HSS_BH_MT128x96x32_MI32x32x8x1_SE_1LDSB0_AF0EM4_AMAS3_ASEM1_EPS1_GRVW4_GSU1_ISA908_KLA_LRVW4_MAC_NLCA1_NLCB3_PGR1_PLR1_SIA3_SU32_SUS128_SRVW4_TT1_96_VAW2_VW2_WSGRA1_WSGRB1_WG128_2_1_WGM2
    SolutionIndex: 66
    SolutionNameMin: Cijk_Ailk_Bjlk_HSS_BH_MT128x96x16_MI32x32x8x1_SE_1LDSB0_AF0EM8_AMAS3_ASEM1_EPS1_GRVW2_GSU1_ISA908_KLA_LRVW4_MAC_NLCA1_NLCB3_PGR1_PLR1_SIA3_SU0_SUS0_SRVW4_TT1_96_VAW2_VW2_WSGRA1_WSGRB1_WG128_2_1_WGM15
    SolutionIndex: 67
    SolutionNameMin: Cijk_Ailk_Bjlk_HSS_BH_MT128x96x16_MI32x32x8x1_SE_1LDSB0_AF0EM4_AMAS3_ASEM1_EPS1_GRVW2_GSU1_ISA908_KLA_LRVW4_MAC_NLCA1_NLCB3_PGR1_PLR1_SIA3_SU0_SUS0_SRVW4_TT1_96_VAW2_VW2_WSGRA1_WSGRB1_WG128_2_1_WGM2
    SolutionIndex: 68
    SolutionNameMin: Cijk_Ailk_Bjlk_HSS_BH_MT64x128x16_MI32x32x8x1_SE_1LDSB0_AF0EM4_AMAS3_ASEM1_EPS1_GRVW8_GSU1_ISA908_KLA_LRVW4_MAC_NLCA1_NLCB1_PGR1_PLR1_SIA3_SU0_SUS0_SRVW4_TT1_64_VAW2_VW2_WSGRA1_WSGRB1_WG64_4_1_WGM1
    SolutionIndex: 69
    SolutionNameMin: Cijk_Ailk_Bjlk_HSS_BH_MT128x96x64_MI32x32x8x1_SE_1LDSB0_AF0EM4_AMAS3_ASEM1_EPS1_GRVW8_GSU1_ISA908_KLA_LRVW4_MAC_NLCA1_NLCB3_PGR1_PLR1_SIA3_SU0_SUS0_SRVW4_TT1_96_VAW2_VW2_WSGRA1_WSGRB1_WG128_2_1_WGM2
    SolutionIndex: 70
    SolutionNameMin: Cijk_Ailk_Bjlk_HSS_BH_MT128x96x64_MI32x32x8x1_SE_1LDSB0_AF0EM4_AMAS3_ASEM1_EPS1_GRVW8_GSU1_ISA908_KLA_LRVW4_MAC_NLCA1_NLCB3_PGR1_PLR1_SIA3_SU0_SUS0_SRVW4_TT1_96_VAW2_VW2_WSGRA1_WSGRB1_WG128_2_1_WGM1
    SolutionIndex: 71
    SolutionNameMin: Cijk_Ailk_Bjlk_HSS_BH_MT128x128x64_MI32x32x8x1_SE_1LDSB0_AF0EM8_AMAS3_ASEM1_EPS1_GRVW8_GSU1_ISA908_KLA_LRVW4_MAC_NLCA1_NLCB1_PGR1_PLR1_SIA3_SU0_SUS0_SRVW4_TT2_64_VAW2_VW2_WSGRA1_WSGRB1_WG64_4_1_WGM2
    SolutionIndex: 72
    SolutionNameMin: Cijk_Ailk_Bjlk_HSS_BH_MT128x128x64_MI32x32x8x1_SE_1LDSB0_AF0EM4_AMAS3_ASEM1_EPS1_GRVW8_GSU1_ISA908_KLA_LRVW4_MAC_NLCA1_NLCB1_PGR1_PLR1_SIA3_SU32_SUS128_SRVW4_TT2_64_VAW2_VW2_WSGRA1_WSGRB1_WG64_4_1_WGM15
    SolutionIndex: 73
    SolutionNameMin: Cijk_Ailk_Bjlk_HSS_BH_MT128x96x64_MI32x32x8x1_SE_1LDSB0_AF0EM8_AMAS3_ASEM1_EPS1_GRVW8_GSU1_ISA908_KLA_LRVW4_MAC_NLCA1_NLCB3_PGR1_PLR1_SIA3_SU32_SUS128_SRVW4_TT1_96_VAW2_VW2_WSGRA1_WSGRB1_WG128_2_1_WGM15
    SolutionIndex: 74
    SolutionNameMin: Cijk_Ailk_Bjlk_HSS_BH_MT128x128x64_MI32x32x8x1_SE_1LDSB0_AF0EM8_AMAS3_ASEM1_EPS1_GRVW8_GSU1_ISA908_KLA_LRVW4_MAC_NLCA1_NLCB1_PGR1_PLR1_SIA3_SU0_SUS0_SRVW4_TT2_64_VAW2_VW2_WSGRA1_WSGRB1_WG64_4_1_WGM1
    SolutionIndex: 75
    SolutionNameMin: Cijk_Ailk_Bjlk_HSS_BH_MT128x160x32_MI32x32x8x1_SE_1LDSB0_AF0EM4_AMAS3_ASEM1_EPS1_GRVW4_GSU1_ISA908_KLA_LRVW4_MAC_NLCA1_NLCB5_PGR1_PLR1_SIA3_SU16_SUS128_SRVW4_TT1_160_VAW2_VW2_WSGRA1_WSGRB1_WG128_2_1_WGM1
    SolutionIndex: 76
    SolutionNameMin: Cijk_Ailk_Bjlk_HSS_BH_MT128x160x32_MI32x32x8x1_SE_1LDSB0_AF0EM8_AMAS3_ASEM1_EPS1_GRVW4_GSU1_ISA908_KLA_LRVW4_MAC_NLCA1_NLCB5_PGR1_PLR1_SIA3_SU32_SUS128_SRVW4_TT1_160_VAW2_VW2_WSGRA1_WSGRB1_WG128_2_1_WGM2
    SolutionIndex: 77
    SolutionNameMin: Cijk_Ailk_Bjlk_HSS_BH_MT128x256x32_MI32x32x8x1_SE_1LDSB0_AF0EM8_AMAS3_ASEM1_EPS1_GRVW8_GSU1_ISA908_KLA_LRVW4_MAC_NLCA1_NLCB1_PGR1_PLR1_SIA3_SU0_SUS0_SRVW4_TT2_128_VAW2_VW2_WSGRA1_WSGRB1_WG64_4_1_WGM15
    SolutionIndex: 78
    SolutionNameMin: Cijk_Ailk_Bjlk_HSS_BH_MT64x64x128_MI32x32x8x1_SE_1LDSB0_AF0EM4_AMAS3_ASEM1_EPS1_GRVW8_GSU1_ISA908_KLA_LRVW4_MAC_NLCA1_NLCB1_PGR1_PLR1_SIA3_SU16_SUS256_SRVW4_TT1_32_VAW2_VW2_WSGRA1_WSGRB1_WG64_4_1_WGM2
    SolutionIndex: 79
    SolutionNameMin: Cijk_Ailk_Bjlk_HSS_BH_MT128x256x32_MI32x32x8x1_SE_1LDSB0_AF0EM8_AMAS3_ASEM1_EPS1_GRVW8_GSU1_ISA908_KLA_LRVW4_MAC_NLCA1_NLCB1_PGR1_PLR1_SIA3_SU32_SUS128_SRVW4_TT2_128_VAW2_VW2_WSGRA1_WSGRB1_WG64_4_1_WGM2
    SolutionIndex: 80
    SolutionNameMin: Cijk_Ailk_Bjlk_HSS_BH_MT256x160x32_MI32x32x8x1_SE_1LDSB0_AF0EM8_AMAS3_ASEM1_EPS1_GRVW4_GSU1_ISA908_KLA_LRVW4_MAC_NLCA1_NLCB5_PGR1_PLR1_SIA3_SU0_SUS0_SRVW4_TT2_160_VAW2_VW2_WSGRA1_WSGRB1_WG128_2_1_WGM15
    SolutionIndex: 81
    SolutionNameMin: Cijk_Ailk_Bjlk_HSS_BH_MT128x128x32_MI32x32x8x1_SE_1LDSB0_AF0EM4_AMAS3_ASEM1_EPS1_GRVW8_GSU1_ISA908_KLA_LRVW4_MAC_NLCA1_NLCB1_PGR1_PLR1_SIA3_SU0_SUS0_SRVW0_TT2_64_VAW2_VW2_WSGRA1_WSGRB1_WG64_4_1_WGM15
    SolutionIndex: 82
    SolutionNameMin: Cijk_Ailk_Bjlk_HSS_BH_MT128x128x64_MI32x32x8x1_SE_1LDSB0_AF0EM4_AMAS3_ASEM1_EPS1_GRVW8_GSU1_ISA908_KLA_LRVW4_MAC_NLCA1_NLCB1_PGR1_PLR1_SIA3_SU16_SUS256_SRVW4_TT2_64_VAW2_VW2_WSGRA1_WSGRB1_WG64_4_1_WGM2
    SolutionIndex: 83
    SolutionNameMin: Cijk_Ailk_Bjlk_HSS_BH_MT128x256x32_MI32x32x8x1_SE_1LDSB0_AF0EM8_AMAS3_ASEM1_EPS1_GRVW8_GSU1_ISA908_KLA_LRVW4_MAC_NLCA1_NLCB1_PGR1_PLR1_SIA3_SU0_SUS0_SRVW4_TT2_128_VAW2_VW2_WSGRA1_WSGRB1_WG64_4_1_WGM2
    SolutionIndex: 84
    SolutionNameMin: Cijk_Ailk_Bjlk_HSS_BH_MT128x128x64_MI32x32x8x1_SE_1LDSB0_AF0EM4_AMAS3_ASEM1_EPS1_GRVW8_GSU1_ISA908_KLA_LRVW4_MAC_NLCA1_NLCB1_PGR1_PLR1_SIA3_SU32_SUS128_SRVW4_TT2_64_VAW2_VW2_WSGRA1_WSGRB1_WG64_4_1_WGM1
    SolutionIndex: 85
    SolutionNameMin: Cijk_Ailk_Bjlk_HSS_BH_MT128x256x32_MI32x32x8x1_SE_1LDSB0_AF0EM8_AMAS3_ASEM1_EPS1_GRVW8_GSU1_ISA908_KLA_LRVW4_MAC_NLCA1_NLCB1_PGR1_PLR1_SIA3_SU32_SUS128_SRVW4_TT2_128_VAW2_VW2_WSGRA1_WSGRB1_WG64_4_1_WGM1
    SolutionIndex: 86
    SolutionNameMin: Cijk_Ailk_Bjlk_HSS_BH_MT128x256x32_MI32x32x8x1_SE_1LDSB0_AF0EM1_AMAS3_ASEM1_EPS1_GRVW8_GSU1_ISA908_KLA_LRVW4_MAC_NLCA1_NLCB1_PGR1_PLR1_SIA3_SU16_SUS128_SRVW4_TT2_128_VAW2_VW2_WSGRA1_WSGRB1_WG64_4_1_WGM1
    SolutionIndex: 87
    SolutionNameMin: Cijk_Ailk_Bjlk_HSS_BH_MT256x160x32_MI32x32x8x1_SE_1LDSB0_AF0EM8_AMAS3_ASEM1_EPS1_GRVW4_GSU1_ISA908_KLA_LRVW4_MAC_NLCA1_NLCB5_PGR1_PLR1_SIA3_SU32_SUS256_SRVW4_TT2_160_VAW2_VW2_WSGRA1_WSGRB1_WG128_2_1_WGM15
    SolutionIndex: 88
    SolutionNameMin: Cijk_Ailk_Bjlk_HSS_BH_MT128x288x32_MI32x32x8x1_SE_1LDSB0_AF0EM8_AMAS3_ASEM1_EPS1_GRVW4_GSU1_ISA908_KLA_LRVW4_MAC_NLCA1_NLCB9_PGR1_PLR1_SIA3_SU32_SUS128_SRVW4_TT1_288_VAW2_VW2_WSGRA1_WSGRB1_WG128_2_1_WGM2
    SolutionIndex: 89
    SolutionNameMin: Cijk_Ailk_Bjlk_HSS_BH_MT128x128x64_MI32x32x8x1_SE_1LDSB0_AF0EM8_AMAS3_ASEM1_EPS1_GRVW8_GSU1_ISA908_KLA_LRVW4_MAC_NLCA1_NLCB1_PGR1_PLR1_SIA3_SU0_SUS0_SRVW4_TT2_64_VAW2_VW2_WSGRA1_WSGRB1_WG64_4_1_WGM15
    SolutionIndex: 90
    SolutionNameMin: Cijk_Ailk_Bjlk_HSS_BH_MT128x256x32_MI32x32x8x1_SE_1LDSB0_AF0EM8_AMAS3_ASEM1_EPS1_GRVW8_GSU1_ISA908_KLA_LRVW4_MAC_NLCA1_NLCB1_PGR1_PLR1_SIA3_SU0_SUS0_SRVW4_TT2_128_VAW2_VW2_WSGRA1_WSGRB1_WG64_4_1_WGM1
    SolutionIndex: 91
    SolutionNameMin: Cijk_Ailk_Bjlk_HSS_BH_MT256x160x32_MI32x32x8x1_SE_1LDSB0_AF0EM8_AMAS3_ASEM1_EPS1_GRVW4_GSU1_ISA908_KLA_LRVW4_MAC_NLCA1_NLCB5_PGR1_PLR1_SIA3_SU0_SUS0_SRVW4_TT2_160_VAW2_VW2_WSGRA1_WSGRB1_WG128_2_1_WGM2
    SolutionIndex: 92
    SolutionNameMin: Cijk_Ailk_Bjlk_HSS_BH_MT128x288x32_MI32x32x8x1_SE_1LDSB0_AF0EM8_AMAS3_ASEM1_EPS1_GRVW4_GSU1_ISA908_KLA_LRVW4_MAC_NLCA1_NLCB9_PGR1_PLR1_SIA3_SU0_SUS0_SRVW4_TT1_288_VAW2_VW2_WSGRA1_WSGRB1_WG128_2_1_WGM15
    SolutionIndex: 93
    SolutionNameMin: Cijk_Ailk_Bjlk_HSS_BH_MT144x256x32_MI16x16x16x1_SE_1LDSB0_AF0EM8_AMAS3_ASEM1_EPS1_GRVW2_GSU1_ISA908_KLA_LRVW4_MAC_NLCA9_NLCB2_PGR1_PLR1_SIA3_SU0_SUS0_SRVW0_TT9_64_VAW2_VW2_WSGRA1_WSGRB1_WG16_16_1_WGM1
    SolutionIndex: 94
    SolutionNameMin: Cijk_Ailk_Bjlk_HSS_BH_MT128x128x32_MI32x32x8x1_SE_1LDSB0_AF0EM4_AMAS3_ASEM1_EPS1_GRVW8_GSU1_ISA908_KLA_LRVW4_MAC_NLCA1_NLCB1_PGR1_PLR1_SIA3_SU0_SUS0_SRVW0_TT2_64_VAW2_VW2_WSGRA1_WSGRB1_WG64_4_1_WGM2
    SolutionIndex: 95
    SolutionNameMin: Cijk_Ailk_Bjlk_HSS_BH_MT64x128x32_MI32x32x8x1_SE_1LDSB0_AF0EM1_AMAS3_ASEM1_EPS1_GRVW8_GSU1_ISA908_KLA_LRVW4_MAC_NLCA1_NLCB1_PGR1_PLR1_SIA3_SU0_SUS0_SRVW4_TT1_64_VAW2_VW2_WSGRA1_WSGRB1_WG64_4_1_WGM1
    SolutionIndex: 96
    SolutionNameMin: Cijk_Ailk_Bjlk_HSS_BH_MT128x256x32_MI32x32x8x1_SE_1LDSB0_AF0EM8_AMAS3_ASEM1_EPS1_GRVW8_GSU1_ISA908_KLA_LRVW4_MAC_NLCA1_NLCB1_PGR1_PLR1_SIA3_SU32_SUS256_SRVW4_TT2_128_VAW2_VW2_WSGRA1_WSGRB1_WG64_4_1_WGM1
    SolutionIndex: 97
    SolutionNameMin: Cijk_Ailk_Bjlk_HSS_BH_MT128x96x64_MI32x32x8x1_SE_1LDSB0_AF0EM4_AMAS3_ASEM1_EPS1_GRVW8_GSU1_ISA908_KLA_LRVW4_MAC_NLCA1_NLCB3_PGR1_PLR1_SIA3_SU32_SUS256_SRVW4_TT1_96_VAW2_VW2_WSGRA1_WSGRB1_WG128_2_1_WGM15
    SolutionIndex: 98
    SolutionNameMin: Cijk_Ailk_Bjlk_HSS_BH_MT128x288x32_MI32x32x8x1_SE_1LDSB0_AF0EM4_AMAS3_ASEM1_EPS1_GRVW4_GSU1_ISA908_KLA_LRVW4_MAC_NLCA1_NLCB9_PGR1_PLR1_SIA3_SU0_SUS0_SRVW4_TT1_288_VAW2_VW2_WSGRA1_WSGRB1_WG128_2_1_WGM2
    SolutionIndex: 99
    SolutionNameMin: Cijk_Ailk_Bjlk_HSS_BH_MT128x256x32_MI32x32x8x1_SE_1LDSB0_AF0EM4_AMAS3_ASEM1_EPS1_GRVW8_GSU1_ISA908_KLA_LRVW4_MAC_NLCA1_NLCB1_PGR1_PLR1_SIA3_SU0_SUS0_SRVW4_TT2_128_VAW2_VW2_WSGRA1_WSGRB1_WG64_4_1_WGM1
    SolutionIndex: 100
    SolutionNameMin: Cijk_Ailk_Bjlk_HSS_BH_MT96x128x32_MI32x32x8x1_SE_1LDSB0_AF0EM8_AMAS3_ASEM1_EPS1_GRVW4_GSU1_ISA908_KLA_LRVW4_MAC_NLCA3_NLCB1_PGR1_PLR1_SIA3_SU0_SUS0_SRVW0_TT3_32_VAW2_VW2_WSGRA1_WSGRB1_WG32_8_1_WGM1
    SolutionIndex: 101
    SolutionNameMin: Cijk_Ailk_Bjlk_HSS_BH_MT128x256x32_MI32x32x8x1_SE_1LDSB0_AF0EM8_AMAS3_ASEM1_EPS1_GRVW8_GSU1_ISA908_KLA_LRVW4_MAC_NLCA1_NLCB1_PGR1_PLR1_SIA3_SU32_SUS128_SRVW4_TT2_128_VAW2_VW2_WSGRA1_WSGRB1_WG64_4_1_WGM15
    SolutionIndex: 102
    SolutionNameMin: Cijk_Ailk_Bjlk_HSS_BH_MT128x128x32_MI32x32x8x1_SE_1LDSB0_AF0EM8_AMAS3_ASEM1_EPS1_GRVW8_GSU7_ISA908_KLA_LRVW4_MAC_NLCA1_NLCB1_PGR1_PLR1_SIA3_SU32_SUS128_SRVW0_TT2_64_VAW1_VW2_WSGRA1_WSGRB1_WG64_4_1_WGM2
    SolutionIndex: 103
    SolutionNameMin: Cijk_Ailk_Bjlk_HSS_BH_MT128x128x64_MI32x32x8x1_SE_1LDSB0_AF0EM8_AMAS3_ASEM1_EPS1_GRVW8_GSU3_ISA908_KLA_LRVW4_MAC_NLCA1_NLCB1_PGR1_PLR1_SIA3_SU0_SUS0_SRVW0_TT2_64_VAW1_VW2_WSGRA1_WSGRB1_WG64_4_1_WGM1
    SolutionIndex: 104
    SolutionNameMin: Cijk_Ailk_Bjlk_HSS_BH_MT64x128x64_MI32x32x8x1_SE_1LDSB0_AF0EM4_AMAS3_ASEM1_EPS1_GRVW8_GSU1_ISA908_KLA_LRVW4_MAC_NLCA1_NLCB1_PGR1_PLR1_SIA3_SU16_SUS256_SRVW4_TT1_64_VAW2_VW2_WSGRA1_WSGRB1_WG64_4_1_WGM15
    SolutionIndex: 105
    SolutionNameMin: Cijk_Ailk_Bjlk_HSS_BH_MT128x160x32_MI32x32x8x1_SE_1LDSB0_AF0EM8_AMAS3_ASEM1_EPS1_GRVW4_GSU1_ISA908_KLA_LRVW4_MAC_NLCA1_NLCB5_PGR1_PLR1_SIA3_SU32_SUS128_SRVW4_TT1_160_VAW2_VW2_WSGRA1_WSGRB1_WG128_2_1_WGM15
    SolutionIndex: 106
    SolutionNameMin: Cijk_Ailk_Bjlk_HSS_BH_MT64x128x64_MI32x32x8x1_SE_1LDSB0_AF0EM4_AMAS3_ASEM1_EPS1_GRVW8_GSU1_ISA908_KLA_LRVW4_MAC_NLCA1_NLCB1_PGR1_PLR1_SIA3_SU32_SUS128_SRVW4_TT1_64_VAW2_VW2_WSGRA1_WSGRB1_WG64_4_1_WGM15
    SolutionIndex: 107
    SolutionNameMin: Cijk_Ailk_Bjlk_HSS_BH_MT128x128x64_MI32x32x8x1_SE_1LDSB0_AF0EM8_AMAS3_ASEM1_EPS1_GRVW8_GSU7_ISA908_KLA_LRVW4_MAC_NLCA1_NLCB1_PGR1_PLR1_SIA3_SU0_SUS0_SRVW0_TT2_64_VAW1_VW2_WSGRA1_WSGRB1_WG64_4_1_WGM1
    SolutionIndex: 108
    SolutionNameMin: Cijk_Ailk_Bjlk_HSS_BH_MT128x96x64_MI32x32x8x1_SE_1LDSB0_AF0EM8_AMAS3_ASEM1_EPS1_GRVW8_GSU1_ISA908_KLA_LRVW4_MAC_NLCA1_NLCB3_PGR1_PLR1_SIA3_SU0_SUS0_SRVW4_TT1_96_VAW2_VW2_WSGRA1_WSGRB1_WG128_2_1_WGM2
    SolutionIndex: 109
    SolutionNameMin: Cijk_Ailk_Bjlk_HSS_BH_MT128x128x64_MI32x32x8x1_SE_1LDSB0_AF0EM1_AMAS3_ASEM1_EPS1_GRVW8_GSU1_ISA908_KLA_LRVW4_MAC_NLCA1_NLCB1_PGR1_PLR1_SIA3_SU32_SUS128_SRVW4_TT2_64_VAW2_VW2_WSGRA1_WSGRB1_WG64_4_1_WGM15
    SolutionIndex: 110
    SolutionNameMin: Cijk_Ailk_Bjlk_HSS_BH_MT160x128x32_MI32x32x8x1_SE_1LDSB0_AF0EM4_AMAS3_ASEM1_EPS1_GRVW4_GSU1_ISA908_KLA_LRVW4_MAC_NLCA5_NLCB1_PGR1_PLR1_SIA3_SU0_SUS0_SRVW0_TT5_32_VAW2_VW2_WSGRA1_WSGRB1_WG32_8_1_WGM1
    SolutionIndex: 111
    SolutionNameMin: Cijk_Ailk_Bjlk_HSS_BH_MT128x96x64_MI32x32x8x1_SE_1LDSB0_AF0EM4_AMAS3_ASEM1_EPS1_GRVW8_GSU1_ISA908_KLA_LRVW4_MAC_NLCA1_NLCB3_PGR1_PLR1_SIA3_SU16_SUS128_SRVW4_TT1_96_VAW2_VW2_WSGRA1_WSGRB1_WG128_2_1_WGM2
    SolutionIndex: 112
    SolutionNameMin: Cijk_Ailk_Bjlk_HSS_BH_MT128x288x32_MI32x32x8x1_SE_1LDSB0_AF0EM4_AMAS3_ASEM1_EPS1_GRVW4_GSU1_ISA908_KLA_LRVW4_MAC_NLCA1_NLCB9_PGR1_PLR1_SIA3_SU32_SUS256_SRVW4_TT1_288_VAW2_VW2_WSGRA1_WSGRB1_WG128_2_1_WGM15
    SolutionIndex: 113
    SolutionNameMin: Cijk_Ailk_Bjlk_HSS_BH_MT128x128x64_MI32x32x8x1_SE_1LDSB0_AF0EM1_AMAS3_ASEM1_EPS1_GRVW8_GSU1_ISA908_KLA_LRVW4_MAC_NLCA1_NLCB1_PGR1_PLR1_SIA3_SU16_SUS128_SRVW4_TT2_64_VAW2_VW2_WSGRA1_WSGRB1_WG64_4_1_WGM1
    SolutionIndex: 114
    SolutionNameMin: Cijk_Ailk_Bjlk_HSS_BH_MT256x256x16_MI32x32x8x1_SE_1LDSB0_AF0EM4_AMAS3_ASEM1_EPS1_GRVW8_GSU1_ISA908_KLA_LRVW4_MAC_NLCA1_NLCB1_PGR1_PLR1_SIA3_SU32_SUS256_SRVW0_TT4_128_VAW2_VW2_WSGRA1_WSGRB1_WG64_4_1_WGM15
    SolutionIndex: 115
    SolutionNameMin: Cijk_Ailk_Bjlk_HSS_BH_MT160x256x32_MI32x32x8x1_SE_1LDSB0_AF0EM8_AMAS3_ASEM1_EPS1_GRVW4_GSU1_ISA908_KLA_LRVW4_MAC_NLCA5_NLCB1_PGR1_PLR1_SIA3_SU32_SUS128_SRVW0_TT5_64_VAW2_VW2_WSGRA1_WSGRB1_WG32_8_1_WGM1
    SolutionIndex: 116
    SolutionNameMin: Cijk_Ailk_Bjlk_HSS_BH_MT64x16x64_MI16x16x16x1_SE_1LDSB0_AF0EM8_AMAS3_ASEM1_EPS1_GRVW2_GSU7_ISA908_KLA_LRVW4_MAC_NLCA1_NLCB1_PGR1_PLR1_SIA3_SU0_SUS0_SRVW4_TT1_16_VAW1_VW2_WSGRA1_WSGRB1_WG64_4_1_WGM1
    SolutionIndex: 117
    SolutionNameMin: Cijk_Ailk_Bjlk_HSS_BH_MT64x16x32_MI16x16x16x1_SE_1LDSB0_AF0EM8_AMAS3_ASEM1_EPS1_GRVW8_GSU7_ISA908_KLA_LRVW4_MAC_NLCA1_NLCB1_PGR1_PLR1_SIA3_SU0_SUS0_SRVW0_TT1_16_VAW1_VW2_WSGRA1_WSGRB1_WG64_4_1_WGM1
    SolutionIndex: 118
    SolutionNameMin: Cijk_Ailk_Bjlk_HSS_BH_MT32x64x128_MI16x16x16x1_SE_1LDSB0_AF0EM1_AMAS3_ASEM1_EPS1_GRVW8_GSU1_ISA908_KLA_LRVW4_MAC_NLCA1_NLCB1_PGR1_PLR1_SIA3_SU32_SUS256_SRVW0_TT1_32_VAW2_VW2_WSGRA1_WSGRB1_WG32_8_1_WGM15
    SolutionIndex: 119
    SolutionNameMin: Cijk_Ailk_Bjlk_HSS_BH_MT16x16x64_MI16x16x16x1_SE_1LDSB0_AF0EM1_AMAS3_ASEM1_EPS1_GRVW4_GSU7_ISA908_KLA_LRVW4_MAC_NLCA1_NLCB1_PGR1_PLR1_SIA3_SU0_SUS0_SRVW0_TT1_16_VAW1_VW2_WSGRA1_WSGRB1_WG16_4_1_WGM15
    SolutionIndex: 120
    SolutionNameMin: Cijk_Ailk_Bjlk_HSS_BH_MT32x32x32_MI16x16x16x1_SE_1LDSB0_AF0EM4_AMAS3_ASEM1_EPS1_GRVW8_GSU1_ISA908_KLA_LRVW4_MAC_NLCA1_NLCB1_PGR1_PLR1_SIA3_SU0_SUS0_SRVW0_TT1_16_VAW2_VW2_WSGRA1_WSGRB1_WG32_8_1_WGM15
    SolutionIndex: 121
    SolutionNameMin: Cijk_Ailk_Bjlk_HSS_BH_MT32x32x16_MI16x16x16x1_SE_1LDSB0_AF0EM4_AMAS3_ASEM1_EPS1_GRVW4_GSU1_ISA908_KLA_LRVW4_MAC_NLCA1_NLCB1_PGR1_PLR1_SIA3_SU0_SUS0_SRVW0_TT1_16_VAW2_VW2_WSGRA1_WSGRB1_WG32_8_1_WGM1
    SolutionIndex: 122
    SolutionNameMin: Cijk_Ailk_Bjlk_HSS_BH_MT64x16x32_MI16x16x16x1_SE_1LDSB0_AF0EM8_AMAS3_ASEM1_EPS1_GRVW8_GSU1_ISA908_KLA_LRVW4_MAC_NLCA1_NLCB1_PGR1_PLR1_SIA3_SU0_SUS0_SRVW0_TT1_16_VAW2_VW2_WSGRA1_WSGRB1_WG64_4_1_WGM2
    SolutionIndex: 123
    SolutionNameMin: Cijk_Ailk_Bjlk_HSS_BH_MT32x32x16_MI16x16x16x1_SE_1LDSB0_AF0EM4_AMAS3_ASEM1_EPS1_GRVW8_GSU1_ISA908_KLA_LRVW4_MAC_NLCA1_NLCB1_PGR1_PLR1_SIA3_SU0_SUS0_SRVW0_TT1_16_VAW2_VW2_WSGRA1_WSGRB1_WG32_8_1_WGM1
    SolutionIndex: 124
    SolutionNameMin: Cijk_Ailk_Bjlk_HSS_BH_MT32x32x16_MI16x16x16x1_SE_1LDSB0_AF0EM8_AMAS3_ASEM1_EPS1_GRVW8_GSU1_ISA908_KLA_LRVW4_MAC_NLCA1_NLCB1_PGR1_PLR1_SIA3_SU0_SUS0_SRVW4_TT1_16_VAW2_VW2_WSGRA1_WSGRB1_WG32_8_1_WGM2
    SolutionIndex: 125
    SolutionNameMin: Cijk_Ailk_Bjlk_HSS_BH_MT32x64x16_MI16x16x16x1_SE_1LDSB0_AF0EM4_AMAS3_ASEM1_EPS1_GRVW2_GSU1_ISA908_KLA_LRVW4_MAC_NLCA1_NLCB1_PGR1_PLR1_SIA3_SU0_SUS0_SRVW0_TT1_32_VAW2_VW2_WSGRA1_WSGRB1_WG32_8_1_WGM1
    SolutionIndex: 126
    SolutionNameMin: Cijk_Ailk_Bjlk_HSS_BH_MT64x32x16_MI16x16x16x1_SE_1LDSB0_AF0EM4_AMAS3_ASEM1_EPS1_GRVW4_GSU1_ISA908_KLA_LRVW4_MAC_NLCA1_NLCB1_PGR1_PLR1_SIA3_SU0_SUS0_SRVW4_TT2_16_VAW2_VW2_WSGRA1_WSGRB1_WG32_8_1_WGM1
    SolutionIndex: 127
    SolutionNameMin: Cijk_Ailk_Bjlk_HSS_BH_MT64x32x16_MI16x16x16x1_SE_1LDSB0_AF0EM4_AMAS3_ASEM1_EPS1_GRVW2_GSU1_ISA908_KLA_LRVW4_MAC_NLCA1_NLCB1_PGR1_PLR1_SIA3_SU0_SUS0_SRVW0_TT2_16_VAW2_VW2_WSGRA1_WSGRB1_WG32_8_1_WGM1
    SolutionIndex: 128
    SolutionNameMin: Cijk_Ailk_Bjlk_HSS_BH_MT64x32x16_MI16x16x16x1_SE_1LDSB1_AF0EM8_AMAS3_ASEM1_EPS1_GRVW2_GSU1_ISA908_KLA_LRVW4_MAC_NLCA1_NLCB1_PGR1_PLR1_SIA3_SU0_SUS0_SRVW4_TT2_16_VAW2_VW2_WSGRA1_WSGRB1_WG32_8_1_WGM15
    SolutionIndex: 129
    SolutionNameMin: Cijk_Ailk_Bjlk_HSS_BH_MT64x32x16_MI16x16x16x1_SE_1LDSB0_AF0EM8_AMAS3_ASEM1_EPS1_GRVW2_GSU1_ISA908_KLA_LRVW4_MAC_NLCA1_NLCB1_PGR1_PLR1_SIA3_SU0_SUS0_SRVW4_TT2_16_VAW2_VW2_WSGRA1_WSGRB1_WG32_8_1_WGM2
    SolutionIndex: 130
    SolutionNameMin: Cijk_Ailk_Bjlk_HSS_BH_MT32x64x16_MI16x16x16x1_SE_1LDSB0_AF0EM4_AMAS3_ASEM1_EPS1_GRVW2_GSU1_ISA908_KLA_LRVW4_MAC_NLCA1_NLCB1_PGR1_PLR1_SIA3_SU0_SUS0_SRVW0_TT1_32_VAW2_VW2_WSGRA1_WSGRB1_WG32_8_1_WGM15
    SolutionIndex: 131
    SolutionNameMin: Cijk_Ailk_Bjlk_HSS_BH_MT64x32x16_MI16x16x16x1_SE_1LDSB0_AF0EM8_AMAS3_ASEM1_EPS1_GRVW2_GSU1_ISA908_KLA_LRVW4_MAC_NLCA1_NLCB1_PGR1_PLR1_SIA3_SU0_SUS0_SRVW4_TT2_16_VAW2_VW2_WSGRA1_WSGRB1_WG32_8_1_WGM1
    SolutionIndex: 132
    SolutionNameMin: Cijk_Ailk_Bjlk_HSS_BH_MT64x32x16_MI16x16x16x1_SE_1LDSB1_AF0EM8_AMAS3_ASEM1_EPS1_GRVW2_GSU1_ISA908_KLA_LRVW4_MAC_NLCA1_NLCB1_PGR1_PLR1_SIA3_SU0_SUS0_SRVW4_TT2_16_VAW2_VW2_WSGRA1_WSGRB1_WG32_8_1_WGM1
    SolutionIndex: 133
    SolutionNameMin: Cijk_Ailk_Bjlk_HSS_BH_MT32x64x16_MI16x16x16x1_SE_1LDSB0_AF0EM4_AMAS3_ASEM1_EPS1_GRVW2_GSU1_ISA908_KLA_LRVW4_MAC_NLCA1_NLCB1_PGR1_PLR1_SIA3_SU0_SUS0_SRVW0_TT1_32_VAW2_VW2_WSGRA1_WSGRB1_WG32_8_1_WGM2
    SolutionIndex: 134
    SolutionNameMin: Cijk_Ailk_Bjlk_HSS_BH_MT64x32x16_MI16x16x16x1_SE_1LDSB1_AF0EM8_AMAS3_ASEM1_EPS1_GRVW4_GSU1_ISA908_KLA_LRVW4_MAC_NLCA1_NLCB1_PGR1_PLR1_SIA3_SU0_SUS0_SRVW4_TT2_16_VAW2_VW2_WSGRA1_WSGRB1_WG32_8_1_WGM2
    SolutionIndex: 135
    SolutionNameMin: Cijk_Ailk_Bjlk_HSS_BH_MT64x32x16_MI16x16x16x1_SE_1LDSB1_AF0EM8_AMAS3_ASEM1_EPS1_GRVW2_GSU1_ISA908_KLA_LRVW4_MAC_NLCA1_NLCB1_PGR1_PLR1_SIA3_SU0_SUS0_SRVW4_TT2_16_VAW2_VW2_WSGRA1_WSGRB1_WG32_8_1_WGM2
    SolutionIndex: 136
    SolutionNameMin: Cijk_Ailk_Bjlk_HSS_BH_MT64x32x16_MI16x16x16x1_SE_1LDSB0_AF0EM4_AMAS3_ASEM1_EPS1_GRVW2_GSU1_ISA908_KLA_LRVW4_MAC_NLCA1_NLCB1_PGR1_PLR1_SIA3_SU0_SUS0_SRVW4_TT2_16_VAW2_VW2_WSGRA1_WSGRB1_WG32_8_1_WGM1
    SolutionIndex: 137
    SolutionNameMin: Cijk_Ailk_Bjlk_HSS_BH_MT64x32x16_MI16x16x16x1_SE_1LDSB0_AF0EM8_AMAS3_ASEM1_EPS1_GRVW4_GSU1_ISA908_KLA_LRVW4_MAC_NLCA1_NLCB1_PGR1_PLR1_SIA3_SU0_SUS0_SRVW4_TT2_16_VAW2_VW2_WSGRA1_WSGRB1_WG32_8_1_WGM1
    SolutionIndex: 138
    SolutionNameMin: Cijk_Ailk_Bjlk_HSS_BH_MT64x32x16_MI16x16x16x1_SE_1LDSB0_AF0EM4_AMAS3_ASEM1_EPS1_GRVW4_GSU1_ISA908_KLA_LRVW4_MAC_NLCA1_NLCB1_PGR1_PLR1_SIA3_SU16_SUS128_SRVW4_TT2_16_VAW2_VW2_WSGRA1_WSGRB1_WG32_8_1_WGM1
    SolutionIndex: 139
    SolutionNameMin: Cijk_Ailk_Bjlk_HSS_BH_MT64x32x16_MI16x16x16x1_SE_1LDSB0_AF0EM4_AMAS3_ASEM1_EPS1_GRVW2_GSU1_ISA908_KLA_LRVW4_MAC_NLCA1_NLCB1_PGR1_PLR1_SIA3_SU16_SUS128_SRVW0_TT2_16_VAW2_VW2_WSGRA1_WSGRB1_WG32_8_1_WGM1
    SolutionIndex: 140
    SolutionNameMin: Cijk_Ailk_Bjlk_HSS_BH_MT16x16x32_MI16x16x16x1_SE_1LDSB0_AF0EM8_AMAS3_ASEM1_EPS1_GRVW2_GSU5_ISA908_KLA_LRVW4_MAC_NLCA1_NLCB1_PGR1_PLR1_SIA3_SU32_SUS128_SRVW0_TT1_16_VAW1_VW2_WSGRA1_WSGRB1_WG16_4_1_WGM1
    SolutionIndex: 141
    SolutionNameMin: Cijk_Ailk_Bjlk_HSS_BH_MT64x64x4_SE_1LDSB0_AF0EM1_AMAS0_ASEM1_EPS0_GRVW1_GSU1_ISA000_KLS_LRVW1_FMA_NLCA1_NLCB1_PGR0_PLR1_SIA1_SU32_SUS256_SRVW0_TT4_4_VAW2_VW1_WSGRA0_WSGRB0_WG16_16_1_WGM8
    SolutionIndex: 142
    SolutionNameMin: Cijk_Ailk_Bjlk_HSS_BH_MT64x64x4_SE_1LDSB0_AF0EM1_AMAS2_ASEM1_EPS0_GRVW2_GSU1_ISA000_KLS_LRVW2_FMA_NLCA1_NLCB1_PGR1_PLR0_SIA1_SU32_SUS256_SRVW0_TT4_4_VAW2_VW2_WSGRA0_WSGRB0_WG16_16_1_WGM8
    SolutionIndex: 143
    SolutionNameMin: Cijk_Ailk_Bjlk_HSS_BH_MT64x64x8_SE_1LDSB0_AF0EM1_AMAS0_ASEM1_EPS0_GRVW1_GSU1_ISA000_KLS_LRVW1_FMA_NLCA1_NLCB1_PGR1_PLR1_SIA1_SU32_SUS256_SRVW0_TT4_4_VAW2_VW1_WSGRA0_WSGRB0_WG16_16_1_WGM8
    SolutionIndex: 144
    SolutionNameMin: Cijk_Ailk_Bjlk_HSS_BH_MT64x64x4_SE_1LDSB0_AF0EM1_AMAS0_ASEM1_EPS0_GRVW1_GSU1_ISA000_KLS_LRVW1_FMA_NLCA1_NLCB1_PGR1_PLR0_SIA1_SU32_SUS256_SRVW0_TT4_4_VAW2_VW1_WSGRA0_WSGRB0_WG16_16_1_WGM8
    SolutionIndex: 145
    SolutionNameMin: Cijk_Ailk_Bjlk_HSS_BH_MT64x64x8_SE_1LDSB0_AF0EM1_AMAS0_ASEM1_EPS0_GRVW1_GSU1_ISA000_KLS_LRVW1_FMA_NLCA1_NLCB1_PGR1_PLR0_SIA1_SU32_SUS256_SRVW0_TT4_4_VAW2_VW1_WSGRA0_WSGRB0_WG16_16_1_WGM8
    SolutionIndex: 146
    SolutionNameMin: Cijk_Ailk_Bjlk_HSS_BH_MT64x64x16_SE_1LDSB0_AF0EM1_AMAS0_ASEM1_EPS0_GRVW1_GSU1_ISA000_KLS_LRVW1_FMA_NLCA1_NLCB1_PGR1_PLR1_SIA1_SU32_SUS256_SRVW0_TT4_4_VAW2_VW1_WSGRA0_WSGRB0_WG16_16_1_WGM8
    SolutionIndex: 147
    SolutionNameMin: Cijk_Ailk_Bjlk_HSS_BH_MT64x64x16_SE_1LDSB0_AF0EM1_AMAS0_ASEM1_EPS0_GRVW1_GSU1_ISA000_KLS_LRVW1_FMA_NLCA1_NLCB1_PGR1_PLR0_SIA1_SU32_SUS256_SRVW0_TT4_4_VAW2_VW1_WSGRA0_WSGRB0_WG16_16_1_WGM8
    SolutionIndex: 148
    SolutionNameMin: Cijk_Ailk_Bjlk_HSS_BH_MT64x128x16_MI32x32x8x1_SE_1LDSB0_AF0EM8_AMAS3_ASEM1_EPS1_GRVW8_GSU1_ISA908_KLA_LRVW4_MAC_NLCA1_NLCB1_PGR1_PLR1_SIA3_SU0_SUS0_SRVW4_TT1_64_VAW2_VW2_WSGRA1_WSGRB1_WG64_4_1_WGM2
    SolutionIndex: 149
    SolutionNameMin: Cijk_Ailk_Bjlk_HSS_BH_MT32x32x16_MI16x16x16x1_SE_1LDSB0_AF0EM4_AMAS3_ASEM1_EPS1_GRVW4_GSU1_ISA908_KLA_LRVW4_MAC_NLCA1_NLCB1_PGR1_PLR1_SIA3_SU0_SUS0_SRVW0_TT1_16_VAW2_VW2_WSGRA1_WSGRB1_WG32_8_1_WGM15
    SolutionIndex: 150
    SolutionNameMin: Cijk_Ailk_Bjlk_HSS_BH_MT32x32x16_MI16x16x16x1_SE_1LDSB0_AF0EM8_AMAS3_ASEM1_EPS1_GRVW2_GSU1_ISA908_KLA_LRVW4_MAC_NLCA1_NLCB1_PGR1_PLR1_SIA3_SU0_SUS0_SRVW4_TT1_16_VAW2_VW2_WSGRA1_WSGRB1_WG32_8_1_WGM1
    SolutionIndex: 151
    SolutionNameMin: Cijk_Ailk_Bjlk_HSS_BH_MT64x64x4_SE_1LDSB0_AF0EM1_AMAS2_ASEM1_EPS0_GRVW2_GSU1_ISA000_KLS_LRVW2_FMA_NLCA1_NLCB1_PGR0_PLR0_SIA1_SU32_SUS256_SRVW0_TT4_4_VAW2_VW2_WSGRA0_WSGRB0_WG16_16_1_WGM8
    SolutionIndex: 152
    SolutionNameMin: Cijk_Ailk_Bjlk_HSS_BH_MT64x64x4_SE_1LDSB0_AF0EM1_AMAS2_ASEM1_EPS0_GRVW2_GSU1_ISA000_KLS_LRVW2_FMA_NLCA1_NLCB1_PGR0_PLR1_SIA1_SU32_SUS256_SRVW0_TT4_4_VAW2_VW2_WSGRA0_WSGRB0_WG16_16_1_WGM8
    SolutionIndex: 153
    SolutionNameMin: Cijk_Ailk_Bjlk_HSS_BH_MT64x64x8_SE_1LDSB0_AF0EM1_AMAS0_ASEM1_EPS0_GRVW1_GSU1_ISA000_KLS_LRVW1_FMA_NLCA1_NLCB1_PGR0_PLR0_SIA1_SU32_SUS256_SRVW0_TT4_4_VAW2_VW1_WSGRA0_WSGRB0_WG16_16_1_WGM8
    SolutionIndex: 154
    SolutionNameMin: Cijk_Ailk_Bjlk_HSS_BH_MT64x64x4_SE_1LDSB0_AF0EM1_AMAS0_ASEM1_EPS0_GRVW1_GSU1_ISA000_KLS_LRVW1_FMA_NLCA1_NLCB1_PGR0_PLR0_SIA1_SU32_SUS256_SRVW0_TT4_4_VAW2_VW1_WSGRA0_WSGRB0_WG16_16_1_WGM8
    SolutionIndex: 155
    SolutionNameMin: Cijk_Ailk_Bjlk_HSS_BH_MT64x64x16_SE_1LDSB0_AF0EM1_AMAS0_ASEM1_EPS0_GRVW1_GSU1_ISA000_KLS_LRVW1_FMA_NLCA1_NLCB1_PGR0_PLR0_SIA1_SU32_SUS256_SRVW0_TT4_4_VAW2_VW1_WSGRA0_WSGRB0_WG16_16_1_WGM8
    SolutionIndex: 156
    SolutionNameMin: Cijk_Ailk_Bjlk_HSS_BH_MT64x64x8_SE_1LDSB0_AF0EM1_AMAS0_ASEM1_EPS0_GRVW1_GSU1_ISA000_KLS_LRVW1_FMA_NLCA1_NLCB1_PGR0_PLR1_SIA1_SU32_SUS256_SRVW0_TT4_4_VAW2_VW1_WSGRA0_WSGRB0_WG16_16_1_WGM8
    SolutionIndex: 157
    SolutionNameMin: Cijk_Ailk_Bjlk_HSS_BH_MT256x256x32_MI32x32x8x1_SE_1LDSB0_AF0EM4_AMAS3_ASEM1_EPS1_GRVW8_GSU1_ISA908_KLA_LRVW4_MAC_NLCA1_NLCB1_PGR1_PLR1_SIA3_SU16_SUS256_SRVW0_TT4_128_VAW2_VW2_WSGRA1_WSGRB1_WG64_4_1_WGM15
    SolutionIndex: 158
    SolutionNameMin: Cijk_Ailk_Bjlk_HSS_BH_MT256x128x32_MI32x32x8x1_SE_1LDSB0_AF0EM1_AMAS3_ASEM1_EPS1_GRVW8_GSU1_ISA908_KLA_LRVW4_MAC_NLCA1_NLCB1_PGR1_PLR1_SIA3_SU0_SUS0_SRVW0_TT4_64_VAW2_VW2_WSGRA1_WSGRB1_WG64_4_1_WGM15
    SolutionIndex: 159
    SolutionNameMin: Cijk_Ailk_Bjlk_HSS_BH_MT16x64x64_MI16x16x16x1_SE_1LDSB0_AF0EM8_AMAS3_ASEM1_EPS1_GRVW2_GSU1_ISA908_KLA_LRVW4_MAC_NLCA1_NLCB1_PGR1_PLR1_SIA3_SU0_SUS0_SRVW0_TT1_16_VAW2_VW2_WSGRA1_WSGRB1_WG16_16_1_WGM1
    SolutionIndex: 160
    SolutionNameMin: Cijk_Ailk_Bjlk_HSS_BH_MT128x96x16_MI32x32x8x1_SE_1LDSB0_AF0EM4_AMAS3_ASEM1_EPS1_GRVW2_GSU1_ISA908_KLA_LRVW4_MAC_NLCA1_NLCB3_PGR1_PLR1_SIA3_SU16_SUS256_SRVW4_TT1_96_VAW2_VW2_WSGRA1_WSGRB1_WG128_2_1_WGM15
    SolutionIndex: 161
    SolutionNameMin: Cijk_Ailk_Bjlk_HSS_BH_MT64x128x16_MI32x32x8x1_SE_1LDSB0_AF0EM8_AMAS3_ASEM1_EPS1_GRVW2_GSU1_ISA908_KLA_LRVW4_MAC_NLCA1_NLCB1_PGR1_PLR1_SIA3_SU0_SUS0_SRVW4_TT1_64_VAW2_VW2_WSGRA1_WSGRB1_WG64_4_1_WGM1
    SolutionIndex: 162
    SolutionNameMin: Cijk_Ailk_Bjlk_HSS_BH_MT128x160x16_MI32x32x8x1_SE_1LDSB0_AF0EM4_AMAS3_ASEM1_EPS1_GRVW2_GSU1_ISA908_KLA_LRVW4_MAC_NLCA1_NLCB5_PGR1_PLR1_SIA3_SU16_SUS256_SRVW4_TT1_160_VAW2_VW2_WSGRA1_WSGRB1_WG128_2_1_WGM2
    SolutionIndex: 163
    SolutionNameMin: Cijk_Ailk_Bjlk_HSS_BH_MT64x16x16_SE_1LDSB0_AF0EM2_AMAS3_ASEM2_EPS1_GRVW2_GSU1_ISA908_KLA_LRVW2_MAC_NLCA1_NLCB1_PGR1_PLR1_SIA1_SU32_SUS256_SRVW0_TT4_2_VAW2_VW2_WSGRA0_WSGRB0_WG16_8_1_WGM1
    SolutionIndex: 164
    SolutionNameMin: Cijk_Ailk_Bjlk_HSS_BH_MT128x288x32_MI32x32x8x1_SE_1LDSB0_AF0EM8_AMAS3_ASEM1_EPS1_GRVW4_GSU1_ISA908_KLA_LRVW4_MAC_NLCA1_NLCB9_PGR1_PLR1_SIA3_SU32_SUS128_SRVW4_TT1_288_VAW2_VW2_WSGRA1_WSGRB1_WG128_2_1_WGM15
    SolutionIndex: 165
    SolutionNameMin: Cijk_Ailk_Bjlk_HSS_BH_MT64x16x32_MI16x16x16x1_SE_1LDSB0_AF0EM8_AMAS3_ASEM1_EPS1_GRVW8_GSU15_ISA908_KLA_LRVW4_MAC_NLCA1_NLCB1_PGR1_PLR1_SIA3_SU0_SUS0_SRVW0_TT1_16_VAW1_VW2_WSGRA1_WSGRB1_WG64_4_1_WGM2
    SolutionIndex: 166
    SolutionNameMin: Cijk_Ailk_Bjlk_HSS_BH_MT64x64x32_MI32x32x8x1_SE_1LDSB0_AF0EM4_AMAS3_ASEM1_EPS1_GRVW8_GSU1_ISA908_KLA_LRVW4_MAC_NLCA1_NLCB1_PGR1_PLR1_SIA3_SU16_SUS256_SRVW4_TT1_32_VAW2_VW2_WSGRA1_WSGRB1_WG64_4_1_WGM15
    SolutionIndex: 167
    SolutionNameMin: Cijk_Ailk_Bjlk_HSS_BH_MT128x288x32_MI32x32x8x1_SE_1LDSB0_AF0EM4_AMAS3_ASEM1_EPS1_GRVW4_GSU1_ISA908_KLA_LRVW4_MAC_NLCA1_NLCB9_PGR1_PLR1_SIA3_SU32_SUS128_SRVW4_TT1_288_VAW2_VW2_WSGRA1_WSGRB1_WG128_2_1_WGM15
    SolutionIndex: 168
    SolutionNameMin: Cijk_Ailk_Bjlk_HSS_BH_MT32x16x16_SE_1LDSB0_AF0EM2_AMAS3_ASEM2_EPS1_GRVW2_GSU1_ISA908_KLA_LRVW2_MAC_NLCA1_NLCB1_PGR1_PLR1_SIA1_SU32_SUS256_SRVW0_TT2_2_VAW2_VW2_WSGRA0_WSGRB0_WG16_8_1_WGM1
    SolutionIndex: 169
    SolutionNameMin: Cijk_Ailk_Bjlk_HSS_BH_MT64x64x32_MI32x32x8x1_SE_1LDSB0_AF0EM4_AMAS3_ASEM1_EPS1_GRVW2_GSU1_ISA908_KLA_LRVW4_MAC_NLCA1_NLCB1_PGR1_PLR1_SIA3_SU0_SUS0_SRVW4_TT1_32_VAW2_VW2_WSGRA1_WSGRB1_WG64_4_1_WGM2
    SolutionIndex: 170
    SolutionNameMin: Cijk_Ailk_Bjlk_HSS_BH_MT64x128x16_MI32x32x8x1_SE_1LDSB0_AF0EM8_AMAS3_ASEM1_EPS1_GRVW4_GSU1_ISA908_KLA_LRVW4_MAC_NLCA1_NLCB1_PGR1_PLR1_SIA3_SU0_SUS0_SRVW4_TT1_64_VAW2_VW2_WSGRA1_WSGRB1_WG64_4_1_WGM1
    SolutionIndex: 171
    SolutionNameMin: Cijk_Ailk_Bjlk_HSS_BH_MT64x64x32_MI32x32x8x1_SE_1LDSB0_AF0EM4_AMAS3_ASEM1_EPS1_GRVW8_GSU1_ISA908_KLA_LRVW4_MAC_NLCA1_NLCB1_PGR1_PLR1_SIA3_SU16_SUS128_SRVW4_TT1_32_VAW2_VW2_WSGRA1_WSGRB1_WG64_4_1_WGM15
    SolutionIndex: 172
    SolutionNameMin: Cijk_Ailk_Bjlk_HSS_BH_MT256x256x16_MI32x32x8x1_SE_1LDSB0_AF0EM4_AMAS3_ASEM1_EPS1_GRVW4_GSU1_ISA908_KLA_LRVW4_MAC_NLCA1_NLCB1_PGR1_PLR1_SIA3_SU16_SUS256_SRVW0_TT4_128_VAW2_VW2_WSGRA1_WSGRB1_WG64_4_1_WGM1
    SolutionIndex: 173
    SolutionNameMin: Cijk_Ailk_Bjlk_HSS_BH_MT16x16x8_SE_1LDSB0_AF0EM2_AMAS3_ASEM2_EPS1_GRVW2_GSU1_ISA908_KLA_LRVW2_MAC_NLCA1_NLCB1_PGR1_PLR1_SIA1_SU32_SUS256_SRVW0_TT2_2_VAW2_VW2_WSGRA0_WSGRB0_WG8_8_1_WGM8
    SolutionIndex: 174
    SolutionNameMin: Cijk_Ailk_Bjlk_HSS_BH_MT64x64x32_MI32x32x8x1_SE_1LDSB0_AF0EM1_AMAS3_ASEM1_EPS1_GRVW4_GSU1_ISA908_KLA_LRVW4_MAC_NLCA1_NLCB1_PGR1_PLR1_SIA3_SU16_SUS128_SRVW4_TT1_32_VAW2_VW2_WSGRA1_WSGRB1_WG64_4_1_WGM15
    SolutionIndex: 175
    SolutionNameMin: Cijk_Ailk_Bjlk_HSS_BH_MT64x64x32_MI32x32x8x1_SE_1LDSB0_AF0EM4_AMAS3_ASEM1_EPS1_GRVW4_GSU1_ISA908_KLA_LRVW4_MAC_NLCA1_NLCB1_PGR1_PLR1_SIA3_SU0_SUS0_SRVW4_TT1_32_VAW2_VW2_WSGRA1_WSGRB1_WG64_4_1_WGM1
    SolutionIndex: 176
    SolutionNameMin: Cijk_Ailk_Bjlk_HSS_BH_MT64x64x32_MI32x32x8x1_SE_1LDSB0_AF0EM4_AMAS3_ASEM1_EPS1_GRVW4_GSU1_ISA908_KLA_LRVW4_MAC_NLCA1_NLCB1_PGR1_PLR1_SIA3_SU0_SUS0_SRVW4_TT1_32_VAW2_VW2_WSGRA1_WSGRB1_WG64_4_1_WGM15
    SolutionIndex: 177
    SolutionNameMin: Cijk_Ailk_Bjlk_HSS_BH_MT16x64x64_MI16x16x16x1_SE_1LDSB0_AF0EM1_AMAS3_ASEM1_EPS1_GRVW8_GSU15_ISA908_KLA_LRVW4_MAC_NLCA1_NLCB1_PGR1_PLR1_SIA3_SU0_SUS0_SRVW4_TT1_16_VAW1_VW2_WSGRA1_WSGRB1_WG16_16_1_WGM15
    SolutionIndex: 178
    SolutionNameMin: Cijk_Ailk_Bjlk_HSS_BH_MT64x64x64_MI32x32x8x1_SE_1LDSB0_AF0EM8_AMAS3_ASEM1_EPS1_GRVW8_GSU15_ISA908_KLA_LRVW4_MAC_NLCA1_NLCB1_PGR1_PLR1_SIA3_SU32_SUS256_SRVW0_TT1_32_VAW1_VW2_WSGRA1_WSGRB1_WG64_4_1_WGM1
    SolutionIndex: 179
    SolutionNameMin: Cijk_Ailk_Bjlk_HSS_BH_MT128x256x32_MI32x32x8x1_SE_1LDSB0_AF0EM1_AMAS3_ASEM1_EPS1_GRVW8_GSU7_ISA908_KLA_LRVW4_MAC_NLCA1_NLCB1_PGR1_PLR1_SIA3_SU32_SUS128_SRVW0_TT2_128_VAW1_VW2_WSGRA1_WSGRB1_WG64_4_1_WGM2
    SolutionIndex: 180
    SolutionNameMin: Cijk_Ailk_Bjlk_HSS_BH_MT128x128x32_MI32x32x8x1_SE_1LDSB0_AF0EM8_AMAS3_ASEM1_EPS1_GRVW8_GSU15_ISA908_KLA_LRVW4_MAC_NLCA1_NLCB1_PGR1_PLR1_SIA3_SU0_SUS0_SRVW0_TT2_64_VAW1_VW2_WSGRA1_WSGRB1_WG64_4_1_WGM1
    SolutionIndex: 181
    SolutionNameMin: Cijk_Ailk_Bjlk_HSS_BH_MT256x128x32_MI32x32x8x1_SE_1LDSB0_AF0EM8_AMAS3_ASEM1_EPS1_GRVW8_GSU7_ISA908_KLA_LRVW4_MAC_NLCA1_NLCB1_PGR1_PLR1_SIA3_SU0_SUS0_SRVW0_TT4_64_VAW1_VW2_WSGRA1_WSGRB1_WG64_4_1_WGM15
    SolutionIndex: 182
    SolutionNameMin: Cijk_Ailk_Bjlk_HSS_BH_MT256x256x16_MI32x32x8x1_SE_1LDSB0_AF0EM8_AMAS3_ASEM1_EPS1_GRVW8_GSU7_ISA908_KLA_LRVW4_MAC_NLCA1_NLCB1_PGR1_PLR1_SIA3_SU0_SUS0_SRVW0_TT4_128_VAW1_VW2_WSGRA1_WSGRB1_WG64_4_1_WGM2
    SolutionIndex: 183
    SolutionNameMin: Cijk_Ailk_Bjlk_HSS_BH_MT32x16x16_SE_1LDSB0_AF0EM2_AMAS3_ASEM2_EPS1_GRVW2_GSU1_ISA908_KLA_LRVW2_MAC_NLCA1_NLCB1_PGR1_PLR1_SIA1_SU32_SUS256_SRVW0_TT4_2_VAW2_VW2_WSGRA0_WSGRB0_WG8_8_1_WGM1
    SolutionIndex: 184
    SolutionNameMin: Cijk_Ailk_Bjlk_HSS_BH_MT128x256x32_MI32x32x8x1_SE_1LDSB0_AF0EM8_AMAS3_ASEM1_EPS1_GRVW8_GSU3_ISA908_KLA_LRVW4_MAC_NLCA1_NLCB1_PGR1_PLR1_SIA3_SU0_SUS0_SRVW0_TT2_128_VAW1_VW2_WSGRA1_WSGRB1_WG64_4_1_WGM2
    SolutionIndex: 185
    SolutionNameMin: Cijk_Ailk_Bjlk_HSS_BH_MT256x128x32_MI32x32x8x1_SE_1LDSB0_AF0EM8_AMAS3_ASEM1_EPS1_GRVW8_GSU3_ISA908_KLA_LRVW4_MAC_NLCA1_NLCB1_PGR1_PLR1_SIA3_SU0_SUS0_SRVW0_TT4_64_VAW1_VW2_WSGRA1_WSGRB1_WG64_4_1_WGM1
    SolutionIndex: 186
    SolutionNameMin: Cijk_Ailk_Bjlk_HSS_BH_MT128x256x32_MI32x32x8x1_SE_1LDSB0_AF0EM8_AMAS3_ASEM1_EPS1_GRVW8_GSU3_ISA908_KLA_LRVW4_MAC_NLCA1_NLCB1_PGR1_PLR1_SIA3_SU0_SUS0_SRVW0_TT2_128_VAW1_VW2_WSGRA1_WSGRB1_WG64_4_1_WGM15
    SolutionIndex: 187
    SolutionNameMin: Cijk_Ailk_Bjlk_HSS_BH_MT256x128x32_MI32x32x8x1_SE_1LDSB0_AF0EM8_AMAS3_ASEM1_EPS1_GRVW8_GSU3_ISA908_KLA_LRVW4_MAC_NLCA1_NLCB1_PGR1_PLR1_SIA3_SU32_SUS256_SRVW0_TT4_64_VAW1_VW2_WSGRA1_WSGRB1_WG64_4_1_WGM1
    SolutionIndex: 188
    SolutionNameMin: Cijk_Ailk_Bjlk_HSS_BH_MT16x16x16_SE_1LDSB0_AF0EM2_AMAS3_ASEM2_EPS1_GRVW2_GSU1_ISA908_KLA_LRVW2_MAC_NLCA1_NLCB1_PGR1_PLR1_SIA1_SU32_SUS256_SRVW0_TT2_2_VAW2_VW2_WSGRA0_WSGRB0_WG8_8_1_WGM1
    SolutionIndex: 189
    SolutionNameMin: Cijk_Ailk_Bjlk_HSS_BH_MT32x64x16_MI16x16x16x1_SE_1LDSB1_AF0EM1_AMAS3_ASEM1_EPS1_GRVW2_GSU1_ISA908_KLA_LRVW4_MAC_NLCA1_NLCB1_PGR1_PLR1_SIA3_SU32_SUS256_SRVW4_TT1_32_VAW2_VW2_WSGRA1_WSGRB1_WG32_8_1_WGM15
    SolutionIndex: 190
    SolutionNameMin: Cijk_Ailk_Bjlk_HSS_BH_MT32x64x16_MI16x16x16x1_SE_1LDSB0_AF0EM1_AMAS3_ASEM1_EPS1_GRVW2_GSU1_ISA908_KLA_LRVW4_MAC_NLCA1_NLCB1_PGR1_PLR1_SIA3_SU16_SUS128_SRVW4_TT1_32_VAW2_VW2_WSGRA1_WSGRB1_WG32_8_1_WGM15
    SolutionIndex: 191
    SolutionNameMin: Cijk_Ailk_Bjlk_HSS_BH_MT32x64x16_MI16x16x16x1_SE_1LDSB0_AF0EM1_AMAS3_ASEM1_EPS1_GRVW2_GSU1_ISA908_KLA_LRVW4_MAC_NLCA1_NLCB1_PGR1_PLR1_SIA3_SU0_SUS0_SRVW4_TT1_32_VAW2_VW2_WSGRA1_WSGRB1_WG32_8_1_WGM1
    SolutionIndex: 192
    SolutionNameMin: Cijk_Ailk_Bjlk_HSS_BH_MT32x64x16_MI16x16x16x1_SE_1LDSB0_AF0EM1_AMAS3_ASEM1_EPS1_GRVW8_GSU1_ISA908_KLA_LRVW4_MAC_NLCA1_NLCB1_PGR1_PLR1_SIA3_SU0_SUS0_SRVW4_TT1_32_VAW2_VW2_WSGRA1_WSGRB1_WG32_8_1_WGM1
    SolutionIndex: 193
    SolutionNameMin: Cijk_Ailk_Bjlk_HSS_BH_MT32x64x16_MI16x16x16x1_SE_1LDSB0_AF0EM1_AMAS3_ASEM1_EPS1_GRVW2_GSU1_ISA908_KLA_LRVW4_MAC_NLCA1_NLCB1_PGR1_PLR1_SIA3_SU32_SUS128_SRVW4_TT1_32_VAW2_VW2_WSGRA1_WSGRB1_WG32_8_1_WGM15
    SolutionIndex: 194
    SolutionNameMin: Cijk_Ailk_Bjlk_HSS_BH_MT32x64x16_MI16x16x16x1_SE_1LDSB0_AF0EM4_AMAS3_ASEM1_EPS1_GRVW2_GSU1_ISA908_KLA_LRVW4_MAC_NLCA1_NLCB1_PGR1_PLR1_SIA3_SU32_SUS128_SRVW0_TT1_32_VAW2_VW2_WSGRA1_WSGRB1_WG32_8_1_WGM1
    SolutionIndex: 195
    SolutionNameMin: Cijk_Ailk_Bjlk_HSS_BH_MT32x64x16_MI16x16x16x1_SE_1LDSB0_AF0EM1_AMAS3_ASEM1_EPS1_GRVW4_GSU1_ISA908_KLA_LRVW4_MAC_NLCA1_NLCB1_PGR1_PLR1_SIA3_SU0_SUS0_SRVW4_TT1_32_VAW2_VW2_WSGRA1_WSGRB1_WG32_8_1_WGM1
    SolutionIndex: 196
    SolutionNameMin: Cijk_Ailk_Bjlk_HSS_BH_MT64x32x16_MI16x16x16x1_SE_1LDSB0_AF0EM4_AMAS3_ASEM1_EPS1_GRVW2_GSU1_ISA908_KLA_LRVW4_MAC_NLCA1_NLCB1_PGR1_PLR1_SIA3_SU32_SUS128_SRVW0_TT2_16_VAW2_VW2_WSGRA1_WSGRB1_WG32_8_1_WGM2
    SolutionIndex: 197
    SolutionNameMin: Cijk_Ailk_Bjlk_HSS_BH_MT64x32x16_MI16x16x16x1_SE_1LDSB0_AF0EM4_AMAS3_ASEM1_EPS1_GRVW2_GSU1_ISA908_KLA_LRVW4_MAC_NLCA1_NLCB1_PGR1_PLR1_SIA3_SU16_SUS256_SRVW0_TT2_16_VAW2_VW2_WSGRA1_WSGRB1_WG32_8_1_WGM2
    SolutionIndex: 198
    SolutionNameMin: Cijk_Ailk_Bjlk_HSS_BH_MT16x16x16_MI16x16x16x1_SE_1LDSB0_AF0EM1_AMAS3_ASEM1_EPS1_GRVW4_GSU1_ISA908_KLA_LRVW4_MAC_NLCA1_NLCB1_PGR1_PLR1_SIA3_SU0_SUS0_SRVW0_TT1_16_VAW2_VW2_WSGRA1_WSGRB1_WG16_4_1_WGM2
    SolutionIndex: 199
    SolutionNameMin: Cijk_Ailk_Bjlk_HSS_BH_MT64x128x32_MI32x32x8x1_SE_1LDSB0_AF0EM8_AMAS3_ASEM1_EPS1_GRVW8_GSU1_ISA908_KLA_LRVW4_MAC_NLCA1_NLCB1_PGR1_PLR1_SIA3_SU32_SUS128_SRVW4_TT1_64_VAW2_VW2_WSGRA1_WSGRB1_WG64_4_1_WGM1
    SolutionIndex: 200
    SolutionNameMin: Cijk_Ailk_Bjlk_HSS_BH_MT32x64x16_MI16x16x16x1_SE_1LDSB0_AF0EM1_AMAS3_ASEM1_EPS1_GRVW2_GSU1_ISA908_KLA_LRVW4_MAC_NLCA1_NLCB1_PGR1_PLR1_SIA3_SU0_SUS0_SRVW0_TT1_32_VAW2_VW2_WSGRA1_WSGRB1_WG32_8_1_WGM1
    SolutionIndex: 201
    SolutionNameMin: Cijk_Ailk_Bjlk_HSS_BH_MT32x64x16_MI16x16x16x1_SE_1LDSB0_AF0EM1_AMAS3_ASEM1_EPS1_GRVW2_GSU1_ISA908_KLA_LRVW4_MAC_NLCA1_NLCB1_PGR1_PLR1_SIA3_SU16_SUS256_SRVW4_TT1_32_VAW2_VW2_WSGRA1_WSGRB1_WG32_8_1_WGM2
    SolutionIndex: 202
    SolutionNameMin: Cijk_Ailk_Bjlk_HSS_BH_MT32x32x16_MI16x16x16x1_SE_1LDSB0_AF0EM1_AMAS3_ASEM1_EPS1_GRVW2_GSU1_ISA908_KLA_LRVW4_MAC_NLCA1_NLCB1_PGR1_PLR1_SIA3_SU0_SUS0_SRVW0_TT1_16_VAW2_VW2_WSGRA1_WSGRB1_WG32_8_1_WGM1
    SolutionIndex: 203
    SolutionNameMin: Cijk_Ailk_Bjlk_HSS_BH_MT32x32x16_MI16x16x16x1_SE_1LDSB0_AF0EM1_AMAS3_ASEM1_EPS1_GRVW8_GSU1_ISA908_KLA_LRVW4_MAC_NLCA1_NLCB1_PGR1_PLR1_SIA3_SU0_SUS0_SRVW0_TT1_16_VAW2_VW2_WSGRA1_WSGRB1_WG32_8_1_WGM1
    SolutionIndex: 204
    SolutionNameMin: Cijk_Ailk_Bjlk_HSS_BH_MT32x32x64_MI16x16x16x1_SE_1LDSB0_AF0EM1_AMAS3_ASEM1_EPS1_GRVW4_GSU1_ISA908_KLA_LRVW4_MAC_NLCA1_NLCB1_PGR1_PLR1_SIA3_SU0_SUS0_SRVW0_TT1_16_VAW2_VW2_WSGRA1_WSGRB1_WG32_8_1_WGM2
    SolutionIndex: 205
    SolutionNameMin: Cijk_Ailk_Bjlk_HSS_BH_MT128x128x64_MI32x32x8x1_SE_1LDSB0_AF0EM8_AMAS3_ASEM1_EPS1_GRVW8_GSU3_ISA908_KLA_LRVW4_MAC_NLCA1_NLCB1_PGR1_PLR1_SIA3_SU32_SUS128_SRVW0_TT2_64_VAW1_VW2_WSGRA1_WSGRB1_WG64_4_1_WGM15
    SolutionIndex: 206
    SolutionNameMin: Cijk_Ailk_Bjlk_HSS_BH_MT256x128x32_MI32x32x8x1_SE_1LDSB0_AF0EM8_AMAS3_ASEM1_EPS1_GRVW8_GSU5_ISA908_KLA_LRVW4_MAC_NLCA1_NLCB1_PGR1_PLR1_SIA3_SU0_SUS0_SRVW0_TT4_64_VAW1_VW2_WSGRA1_WSGRB1_WG64_4_1_WGM1
    SolutionIndex: 207
    SolutionNameMin: Cijk_Ailk_Bjlk_HSS_BH_MT128x128x64_MI32x32x8x1_SE_1LDSB0_AF0EM8_AMAS3_ASEM1_EPS1_GRVW8_GSU2_ISA908_KLA_LRVW4_MAC_NLCA1_NLCB1_PGR1_PLR1_SIA3_SU0_SUS0_SRVW0_TT2_64_VAW1_VW2_WSGRA1_WSGRB1_WG64_4_1_WGM15
    SolutionIndex: 208
    SolutionNameMin: Cijk_Ailk_Bjlk_HSS_BH_MT256x160x32_MI32x32x8x1_SE_1LDSB0_AF0EM8_AMAS3_ASEM1_EPS1_GRVW4_GSU2_ISA908_KLA_LRVW4_MAC_NLCA1_NLCB5_PGR1_PLR1_SIA3_SU0_SUS0_SRVW0_TT2_160_VAW1_VW2_WSGRA1_WSGRB1_WG128_2_1_WGM1
    SolutionIndex: 209
    SolutionNameMin: Cijk_Ailk_Bjlk_HSS_BH_MT256x160x32_MI32x32x8x1_SE_1LDSB0_AF0EM8_AMAS3_ASEM1_EPS1_GRVW4_GSU2_ISA908_KLA_LRVW4_MAC_NLCA1_NLCB5_PGR1_PLR1_SIA3_SU0_SUS0_SRVW0_TT2_160_VAW1_VW2_WSGRA1_WSGRB1_WG128_2_1_WGM15
    SolutionIndex: 210
    SolutionNameMin: Cijk_Ailk_Bjlk_HSS_BH_MT256x256x16_MI32x32x8x1_SE_1LDSB0_AF0EM8_AMAS3_ASEM1_EPS1_GRVW8_GSU3_ISA908_KLA_LRVW4_MAC_NLCA1_NLCB1_PGR1_PLR1_SIA3_SU0_SUS0_SRVW0_TT4_128_VAW1_VW2_WSGRA1_WSGRB1_WG64_4_1_WGM1
    SolutionIndex: 211
    SolutionNameMin: Cijk_Ailk_Bjlk_HSS_BH_MT128x288x32_MI32x32x8x1_SE_1LDSB0_AF0EM8_AMAS3_ASEM1_EPS1_GRVW4_GSU1_ISA908_KLA_LRVW4_MAC_NLCA1_NLCB9_PGR1_PLR1_SIA3_SU0_SUS0_SRVW4_TT1_288_VAW2_VW2_WSGRA1_WSGRB1_WG128_2_1_WGM2
    SolutionIndex: 212
    SolutionNameMin: Cijk_Ailk_Bjlk_HSS_BH_MT128x128x64_MI32x32x8x1_SE_1LDSB0_AF0EM1_AMAS3_ASEM1_EPS1_GRVW8_GSU1_ISA908_KLA_LRVW4_MAC_NLCA1_NLCB1_PGR1_PLR1_SIA3_SU0_SUS0_SRVW4_TT2_64_VAW2_VW2_WSGRA1_WSGRB1_WG64_4_1_WGM15
    SolutionIndex: 213
    SolutionNameMin: Cijk_Ailk_Bjlk_HSS_BH_MT64x64x32_MI32x32x8x1_SE_1LDSB0_AF0EM1_AMAS3_ASEM1_EPS1_GRVW8_GSU1_ISA908_KLA_LRVW4_MAC_NLCA1_NLCB1_PGR1_PLR1_SIA3_SU0_SUS0_SRVW4_TT1_32_VAW2_VW2_WSGRA1_WSGRB1_WG64_4_1_WGM1
    SolutionIndex: 214
    SolutionNameMin: Cijk_Ailk_Bjlk_HSS_BH_MT256x128x32_MI32x32x8x1_SE_1LDSB0_AF0EM8_AMAS3_ASEM1_EPS1_GRVW8_GSU7_ISA908_KLA_LRVW4_MAC_NLCA1_NLCB1_PGR1_PLR1_SIA3_SU32_SUS128_SRVW0_TT4_64_VAW1_VW2_WSGRA1_WSGRB1_WG64_4_1_WGM15
    SolutionIndex: 215
    SolutionNameMin: Cijk_Ailk_Bjlk_HSS_BH_MT128x128x32_MI32x32x8x1_SE_1LDSB0_AF0EM8_AMAS3_ASEM1_EPS1_GRVW8_GSU7_ISA908_KLA_LRVW4_MAC_NLCA1_NLCB1_PGR1_PLR1_SIA3_SU32_SUS128_SRVW0_TT2_64_VAW1_VW2_WSGRA1_WSGRB1_WG64_4_1_WGM15
    SolutionIndex: 216
    SolutionNameMin: Cijk_Ailk_Bjlk_HSS_BH_MT96x128x64_MI32x32x8x1_SE_1LDSB0_AF0EM8_AMAS3_ASEM1_EPS1_GRVW8_GSU5_ISA908_KLA_LRVW4_MAC_NLCA3_NLCB1_PGR1_PLR1_SIA3_SU32_SUS256_SRVW0_TT3_32_VAW1_VW2_WSGRA1_WSGRB1_WG32_8_1_WGM2
    SolutionIndex: 217
    SolutionNameMin: Cijk_Ailk_Bjlk_HSS_BH_MT128x128x64_MI32x32x8x1_SE_1LDSB0_AF0EM8_AMAS3_ASEM1_EPS1_GRVW8_GSU7_ISA908_KLA_LRVW4_MAC_NLCA1_NLCB1_PGR1_PLR1_SIA3_SU0_SUS0_SRVW0_TT2_64_VAW1_VW2_WSGRA1_WSGRB1_WG64_4_1_WGM2
    SolutionIndex: 218
    SolutionNameMin: Cijk_Ailk_Bjlk_HSS_BH_MT128x128x64_MI32x32x8x1_SE_1LDSB0_AF0EM8_AMAS3_ASEM1_EPS1_GRVW8_GSU7_ISA908_KLA_LRVW4_MAC_NLCA1_NLCB1_PGR1_PLR1_SIA3_SU32_SUS128_SRVW0_TT2_64_VAW1_VW2_WSGRA1_WSGRB1_WG64_4_1_WGM1
    SolutionIndex: 219
    SolutionNameMin: Cijk_Ailk_Bjlk_HSS_BH_MT256x128x32_MI32x32x8x1_SE_1LDSB0_AF0EM8_AMAS3_ASEM1_EPS1_GRVW8_GSU15_ISA908_KLA_LRVW4_MAC_NLCA1_NLCB1_PGR1_PLR1_SIA3_SU0_SUS0_SRVW0_TT4_64_VAW1_VW2_WSGRA1_WSGRB1_WG64_4_1_WGM1
    SolutionIndex: 220
    SolutionNameMin: Cijk_Ailk_Bjlk_HSS_BH_MT256x128x32_MI32x32x8x1_SE_1LDSB0_AF0EM8_AMAS3_ASEM1_EPS1_GRVW8_GSU15_ISA908_KLA_LRVW4_MAC_NLCA1_NLCB1_PGR1_PLR1_SIA3_SU32_SUS128_SRVW0_TT4_64_VAW1_VW2_WSGRA1_WSGRB1_WG64_4_1_WGM1
    SolutionIndex: 221
    SolutionNameMin: Cijk_Ailk_Bjlk_HSS_BH_MT128x256x32_MI32x32x8x1_SE_1LDSB0_AF0EM4_AMAS3_ASEM1_EPS1_GRVW8_GSU1_ISA908_KLA_LRVW4_MAC_NLCA1_NLCB1_PGR1_PLR1_SIA3_SU32_SUS128_SRVW4_TT2_128_VAW2_VW2_WSGRA1_WSGRB1_WG64_4_1_WGM2
    SolutionIndex: 222
    SolutionNameMin: Cijk_Ailk_Bjlk_HSS_BH_MT256x256x16_MI32x32x8x1_SE_1LDSB0_AF0EM4_AMAS3_ASEM1_EPS1_GRVW8_GSU1_ISA908_KLA_LRVW4_MAC_NLCA1_NLCB1_PGR1_PLR1_SIA3_SU0_SUS0_SRVW0_TT4_128_VAW2_VW2_WSGRA1_WSGRB1_WG64_4_1_WGM1
    SolutionIndex: 223
    SolutionNameMin: Cijk_Ailk_Bjlk_HSS_BH_MT64x128x16_MI32x32x8x1_SE_1LDSB0_AF0EM8_AMAS3_ASEM1_EPS1_GRVW8_GSU1_ISA908_KLA_LRVW4_MAC_NLCA1_NLCB1_PGR1_PLR1_SIA3_SU0_SUS0_SRVW4_TT1_64_VAW2_VW2_WSGRA1_WSGRB1_WG64_4_1_WGM1
    SolutionIndex: 224
    SolutionNameMin: Cijk_Ailk_Bjlk_HSS_BH_MT64x16x32_SE_1LDSB0_AF0EM2_AMAS3_ASEM2_EPS1_GRVW2_GSU1_ISA908_KLA_LRVW2_MAC_NLCA1_NLCB1_PGR1_PLR1_SIA1_SU32_SUS256_SRVW0_TT2_2_VAW2_VW2_WSGRA0_WSGRB0_WG32_8_1_WGM1
    SolutionIndex: 225
    SolutionNameMin: Cijk_Ailk_Bjlk_HSS_BH_MT128x256x32_MI32x32x8x1_SE_1LDSB0_AF0EM1_AMAS3_ASEM1_EPS1_GRVW8_GSU1_ISA908_KLA_LRVW4_MAC_NLCA1_NLCB1_PGR1_PLR1_SIA3_SU0_SUS0_SRVW4_TT2_128_VAW2_VW2_WSGRA1_WSGRB1_WG64_4_1_WGM15
    SolutionIndex: 226
    SolutionNameMin: Cijk_Ailk_Bjlk_HSS_BH_MT96x128x32_MI32x32x8x1_SE_1LDSB0_AF0EM8_AMAS3_ASEM1_EPS1_GRVW4_GSU1_ISA908_KLA_LRVW4_MAC_NLCA3_NLCB1_PGR1_PLR1_SIA3_SU0_SUS0_SRVW0_TT3_32_VAW2_VW2_WSGRA1_WSGRB1_WG32_8_1_WGM15
    SolutionIndex: 227
    SolutionNameMin: Cijk_Ailk_Bjlk_HSS_BH_MT160x256x32_MI32x32x8x1_SE_1LDSB0_AF0EM8_AMAS3_ASEM1_EPS1_GRVW4_GSU1_ISA908_KLA_LRVW4_MAC_NLCA5_NLCB1_PGR1_PLR1_SIA3_SU0_SUS0_SRVW0_TT5_64_VAW2_VW2_WSGRA1_WSGRB1_WG32_8_1_WGM2
    SolutionIndex: 228
    SolutionNameMin: Cijk_Ailk_Bjlk_HSS_BH_MT128x96x16_MI32x32x8x1_SE_1LDSB0_AF0EM1_AMAS3_ASEM1_EPS1_GRVW2_GSU1_ISA908_KLA_LRVW4_MAC_NLCA1_NLCB3_PGR1_PLR1_SIA3_SU0_SUS0_SRVW4_TT1_96_VAW2_VW2_WSGRA1_WSGRB1_WG128_2_1_WGM2
    SolutionIndex: 229
    SolutionNameMin: Cijk_Ailk_Bjlk_HSS_BH_MT32x64x64_MI16x16x16x1_SE_1LDSB0_AF0EM8_AMAS3_ASEM1_EPS1_GRVW8_GSU15_ISA908_KLA_LRVW4_MAC_NLCA1_NLCB1_PGR1_PLR1_SIA3_SU0_SUS0_SRVW0_TT1_32_VAW1_VW2_WSGRA1_WSGRB1_WG32_8_1_WGM2
    SolutionIndex: 230
    SolutionNameMin: Cijk_Ailk_Bjlk_HSS_BH_MT32x64x64_MI16x16x16x1_SE_1LDSB0_AF0EM8_AMAS3_ASEM1_EPS1_GRVW8_GSU15_ISA908_KLA_LRVW4_MAC_NLCA1_NLCB1_PGR1_PLR1_SIA3_SU32_SUS256_SRVW0_TT1_32_VAW1_VW2_WSGRA1_WSGRB1_WG32_8_1_WGM15
    SolutionIndex: 231
    SolutionNameMin: Cijk_Ailk_Bjlk_HSS_BH_MT96x128x64_MI32x32x8x1_SE_1LDSB0_AF0EM8_AMAS3_ASEM1_EPS1_GRVW4_GSU3_ISA908_KLA_LRVW4_MAC_NLCA3_NLCB1_PGR1_PLR1_SIA3_SU0_SUS0_SRVW0_TT3_32_VAW1_VW2_WSGRA1_WSGRB1_WG32_8_1_WGM15
    SolutionIndex: 232
    SolutionNameMin: Cijk_Ailk_Bjlk_HSS_BH_MT64x64x32_MI32x32x8x1_SE_1LDSB0_AF0EM8_AMAS3_ASEM1_EPS1_GRVW2_GSU1_ISA908_KLA_LRVW4_MAC_NLCA1_NLCB1_PGR1_PLR1_SIA3_SU0_SUS0_SRVW4_TT1_32_VAW2_VW2_WSGRA1_WSGRB1_WG64_4_1_WGM1
    SolutionIndex: 233
    SolutionNameMin: Cijk_Ailk_Bjlk_HSS_BH_MT256x256x16_MI32x32x8x1_SE_1LDSB0_AF0EM4_AMAS3_ASEM1_EPS1_GRVW8_GSU1_ISA908_KLA_LRVW4_MAC_NLCA1_NLCB1_PGR1_PLR1_SIA3_SU16_SUS128_SRVW0_TT4_128_VAW2_VW2_WSGRA1_WSGRB1_WG64_4_1_WGM2
    SolutionIndex: 234
    SolutionNameMin: Cijk_Ailk_Bjlk_HSS_BH_MT64x128x16_MI32x32x8x1_SE_1LDSB0_AF0EM4_AMAS3_ASEM1_EPS1_GRVW2_GSU1_ISA908_KLA_LRVW4_MAC_NLCA1_NLCB1_PGR1_PLR1_SIA3_SU0_SUS0_SRVW4_TT1_64_VAW2_VW2_WSGRA1_WSGRB1_WG64_4_1_WGM1
    SolutionIndex: 235
    SolutionNameMin: Cijk_Ailk_Bjlk_HSS_BH_MT64x128x16_MI32x32x8x1_SE_1LDSB0_AF0EM4_AMAS3_ASEM1_EPS1_GRVW4_GSU1_ISA908_KLA_LRVW4_MAC_NLCA1_NLCB1_PGR1_PLR1_SIA3_SU0_SUS0_SRVW4_TT1_64_VAW2_VW2_WSGRA1_WSGRB1_WG64_4_1_WGM1
    SolutionIndex: 236
    SolutionNameMin: Cijk_Ailk_Bjlk_HSS_BH_MT64x128x16_MI32x32x8x1_SE_1LDSB0_AF0EM4_AMAS3_ASEM1_EPS1_GRVW8_GSU1_ISA908_KLA_LRVW4_MAC_NLCA1_NLCB1_PGR1_PLR1_SIA3_SU0_SUS0_SRVW4_TT1_64_VAW2_VW2_WSGRA1_WSGRB1_WG64_4_1_WGM2
    SolutionIndex: 237
    SolutionNameMin: Cijk_Ailk_Bjlk_HSS_BH_MT64x128x16_MI32x32x8x1_SE_1LDSB0_AF0EM1_AMAS3_ASEM1_EPS1_GRVW4_GSU1_ISA908_KLA_LRVW4_MAC_NLCA1_NLCB1_PGR1_PLR1_SIA3_SU0_SUS0_SRVW4_TT1_64_VAW2_VW2_WSGRA1_WSGRB1_WG64_4_1_WGM1
    SolutionIndex: 238
    SolutionNameMin: Cijk_Ailk_Bjlk_HSS_BH_MT128x256x32_MI32x32x8x1_SE_1LDSB0_AF0EM8_AMAS3_ASEM1_EPS1_GRVW8_GSU3_ISA908_KLA_LRVW4_MAC_NLCA1_NLCB1_PGR1_PLR1_SIA3_SU0_SUS0_SRVW0_TT2_128_VAW1_VW2_WSGRA1_WSGRB1_WG64_4_1_WGM1
    SolutionIndex: 239
    SolutionNameMin: Cijk_Ailk_Bjlk_HSS_BH_MT256x128x32_MI32x32x8x1_SE_1LDSB0_AF0EM8_AMAS3_ASEM1_EPS1_GRVW8_GSU3_ISA908_KLA_LRVW4_MAC_NLCA1_NLCB1_PGR1_PLR1_SIA3_SU0_SUS0_SRVW0_TT4_64_VAW1_VW2_WSGRA1_WSGRB1_WG64_4_1_WGM15
    SolutionIndex: 240
    SolutionNameMin: Cijk_Ailk_Bjlk_HSS_BH_MT256x128x32_MI32x32x8x1_SE_1LDSB0_AF0EM8_AMAS3_ASEM1_EPS1_GRVW8_GSU3_ISA908_KLA_LRVW4_MAC_NLCA1_NLCB1_PGR1_PLR1_SIA3_SU0_SUS0_SRVW0_TT4_64_VAW1_VW2_WSGRA1_WSGRB1_WG64_4_1_WGM2
    SolutionIndex: 241
    SolutionNameMin: Cijk_Ailk_Bjlk_HSS_BH_MT128x256x32_MI32x32x8x1_SE_1LDSB0_AF0EM4_AMAS3_ASEM1_EPS1_GRVW8_GSU1_ISA908_KLA_LRVW4_MAC_NLCA1_NLCB1_PGR1_PLR1_SIA3_SU32_SUS256_SRVW4_TT2_128_VAW2_VW2_WSGRA1_WSGRB1_WG64_4_1_WGM15
    SolutionIndex: 242
    SolutionNameMin: Cijk_Ailk_Bjlk_HSS_BH_MT64x128x16_MI32x32x8x1_SE_1LDSB0_AF0EM1_AMAS3_ASEM1_EPS1_GRVW8_GSU1_ISA908_KLA_LRVW4_MAC_NLCA1_NLCB1_PGR1_PLR1_SIA3_SU0_SUS0_SRVW4_TT1_64_VAW2_VW2_WSGRA1_WSGRB1_WG64_4_1_WGM1
    SolutionIndex: 243
    SolutionNameMin: Cijk_Ailk_Bjlk_HSS_BH_MT128x64x16_SE_1LDSB0_AF0EM2_AMAS3_ASEM2_EPS1_GRVW4_GSU1_ISA908_KLA_LRVW4_MAC_NLCA1_NLCB1_PGR1_PLR1_SIA1_SU32_SUS256_SRVW0_TT8_4_VAW2_VW4_WSGRA0_WSGRB0_WG16_16_1_WGM8
    SolutionIndex: 244
    SolutionNameMin: Cijk_Ailk_Bjlk_HSS_BH_MT64x64x32_SE_1LDSB0_AF0EM2_AMAS3_ASEM2_EPS1_GRVW4_GSU1_ISA908_KLA_LRVW4_MAC_NLCA1_NLCB1_PGR1_PLR1_SIA1_SU32_SUS256_SRVW0_TT4_4_VAW2_VW4_WSGRA0_WSGRB0_WG16_16_1_WGM8
    SolutionIndex: 245
    SolutionNameMin: Cijk_Ailk_Bjlk_HSS_BH_MT64x16x32_MI16x16x16x1_SE_1LDSB0_AF0EM8_AMAS3_ASEM1_EPS1_GRVW8_GSU15_ISA908_KLA_LRVW4_MAC_NLCA1_NLCB1_PGR1_PLR1_SIA3_SU0_SUS0_SRVW4_TT1_16_VAW1_VW2_WSGRA1_WSGRB1_WG64_4_1_WGM1
    SolutionIndex: 246
    SolutionNameMin: Cijk_Ailk_Bjlk_HSS_BH_MT128x160x32_MI32x32x8x1_SE_1LDSB0_AF0EM4_AMAS3_ASEM1_EPS1_GRVW4_GSU1_ISA908_KLA_LRVW4_MAC_NLCA1_NLCB5_PGR1_PLR1_SIA3_SU0_SUS0_SRVW4_TT1_160_VAW2_VW2_WSGRA1_WSGRB1_WG128_2_1_WGM1
    SolutionIndex: 247
    SolutionNameMin: Cijk_Ailk_Bjlk_HSS_BH_MT32x32x64_MI16x16x16x1_SE_1LDSB0_AF0EM1_AMAS3_ASEM1_EPS1_GRVW4_GSU15_ISA908_KLA_LRVW4_MAC_NLCA1_NLCB1_PGR1_PLR1_SIA3_SU32_SUS128_SRVW0_TT1_16_VAW1_VW2_WSGRA1_WSGRB1_WG32_8_1_WGM15
    SolutionIndex: 248
    SolutionNameMin: Cijk_Ailk_Bjlk_HSS_BH_MT16x16x32_MI16x16x16x1_SE_1LDSB0_AF0EM1_AMAS3_ASEM1_EPS1_GRVW4_GSU15_ISA908_KLA_LRVW4_MAC_NLCA1_NLCB1_PGR1_PLR1_SIA3_SU0_SUS0_SRVW0_TT1_16_VAW1_VW2_WSGRA1_WSGRB1_WG16_4_1_WGM1
    SolutionIndex: 249
    SolutionNameMin: Cijk_Ailk_Bjlk_HSS_BH_MT64x128x16_MI32x32x8x1_SE_1LDSB0_AF0EM1_AMAS3_ASEM1_EPS1_GRVW8_GSU1_ISA908_KLA_LRVW4_MAC_NLCA1_NLCB1_PGR1_PLR1_SIA3_SU0_SUS0_SRVW4_TT1_64_VAW2_VW2_WSGRA1_WSGRB1_WG64_4_1_WGM15
    SolutionIndex: 250
    SolutionNameMin: Cijk_Ailk_Bjlk_HSS_BH_MT64x32x16_MI16x16x16x1_SE_1LDSB0_AF0EM1_AMAS3_ASEM1_EPS1_GRVW2_GSU1_ISA908_KLA_LRVW4_MAC_NLCA1_NLCB1_PGR1_PLR1_SIA3_SU0_SUS0_SRVW4_TT2_16_VAW2_VW2_WSGRA1_WSGRB1_WG32_8_1_WGM2
    SolutionIndex: 251
    SolutionNameMin: Cijk_Ailk_Bjlk_HSS_BH_MT64x64x16_MI32x32x8x1_SE_1LDSB0_AF0EM1_AMAS3_ASEM1_EPS1_GRVW4_GSU1_ISA908_KLA_LRVW4_MAC_NLCA1_NLCB1_PGR1_PLR1_SIA3_SU0_SUS0_SRVW4_TT1_32_VAW2_VW2_WSGRA1_WSGRB1_WG64_4_1_WGM2
    SolutionIndex: 252
    SolutionNameMin: Cijk_Ailk_Bjlk_HSS_BH_MT64x64x32_MI32x32x8x1_SE_1LDSB0_AF0EM1_AMAS3_ASEM1_EPS1_GRVW2_GSU1_ISA908_KLA_LRVW4_MAC_NLCA1_NLCB1_PGR1_PLR1_SIA3_SU0_SUS0_SRVW4_TT1_32_VAW2_VW2_WSGRA1_WSGRB1_WG64_4_1_WGM1
    SolutionIndex: 253
    SolutionNameMin: Cijk_Ailk_Bjlk_HSS_BH_MT64x32x16_MI16x16x16x1_SE_1LDSB0_AF0EM1_AMAS3_ASEM1_EPS1_GRVW4_GSU1_ISA908_KLA_LRVW4_MAC_NLCA1_NLCB1_PGR1_PLR1_SIA3_SU0_SUS0_SRVW4_TT2_16_VAW2_VW2_WSGRA1_WSGRB1_WG32_8_1_WGM1
    SolutionIndex: 254
    SolutionNameMin: Cijk_Ailk_Bjlk_HSS_BH_MT64x64x32_MI32x32x8x1_SE_1LDSB0_AF0EM1_AMAS3_ASEM1_EPS1_GRVW8_GSU1_ISA908_KLA_LRVW4_MAC_NLCA1_NLCB1_PGR1_PLR1_SIA3_SU0_SUS0_SRVW4_TT1_32_VAW2_VW2_WSGRA1_WSGRB1_WG64_4_1_WGM2
    SolutionIndex: 255
    SolutionNameMin: Cijk_Ailk_Bjlk_HSS_BH_MT64x128x32_MI32x32x8x1_SE_1LDSB0_AF0EM1_AMAS3_ASEM1_EPS1_GRVW8_GSU1_ISA908_KLA_LRVW4_MAC_NLCA1_NLCB1_PGR1_PLR1_SIA3_SU0_SUS0_SRVW4_TT1_64_VAW2_VW2_WSGRA1_WSGRB1_WG64_4_1_WGM2
    SolutionIndex: 256
    SolutionNameMin: Cijk_Ailk_Bjlk_HSS_BH_MT128x256x32_MI32x32x8x1_SE_1LDSB0_AF0EM4_AMAS3_ASEM1_EPS1_GRVW4_GSU1_ISA908_KLA_LRVW4_MAC_NLCA1_NLCB1_PGR1_PLR1_SIA3_SU0_SUS0_SRVW4_TT2_128_VAW2_VW2_WSGRA1_WSGRB1_WG64_4_1_WGM15
- - - [64, 64, 1, 256]
    - [0, 0.087]
  - - [128, 64, 1, 256]
    - [1, 0.174]
  - - [64, 128, 1, 256]
    - [1, 0.175]
  - - [128, 128, 1, 256]
    - [2, 0.363]
  - - [64, 256, 1, 256]
    - [3, 0.363]
  - - [128, 256, 1, 256]
    - [4, 0.707]
  - - [64, 448, 1, 256]
    - [3, 0.613]
  - - [128, 448, 1, 256]
    - [3, 1.238]
  - - [64, 704, 1, 256]
    - [1, 0.964]
  - - [128, 704, 1, 256]
    - [3, 1.877]
  - - [64, 1024, 1, 256]
    - [3, 1.414]
  - - [128, 1024, 1, 256]
    - [3, 2.707]
  - - [64, 1408, 1, 256]
    - [3, 1.928]
  - - [128, 1408, 1, 256]
    - [3, 3.659]
  - - [64, 1856, 1, 256]
    - [3, 2.453]
  - - [128, 1856, 1, 256]
    - [1, 4.949]
  - - [64, 2368, 1, 256]
    - [1, 3.103]
  - - [128, 2368, 1, 256]
    - [1, 6.154]
  - - [64, 2944, 1, 256]
    - [3, 3.825]
  - - [128, 2944, 1, 256]
    - [1, 6.839]
  - - [64, 3584, 1, 256]
    - [2, 4.697]
  - - [128, 3584, 1, 256]
    - [1, 8.022]
  - - [64, 4288, 1, 256]
    - [5, 5.434]
  - - [128, 4288, 1, 256]
    - [4, 8.483]
  - - [64, 5056, 1, 256]
    - [1, 6.626]
  - - [128, 5056, 1, 256]
    - [6, 9.69]
  - - [64, 5888, 1, 256]
    - [0, 6.59]
  - - [128, 5888, 1, 256]
    - [7, 11.077]
  - - [64, 6784, 1, 256]
    - [1, 7.648]
  - - [128, 6784, 1, 256]
    - [8, 12.532]
  - - [64, 64, 1, 1280]
    - [9, 0.268]
  - - [128, 64, 1, 1280]
    - [9, 0.508]
  - - [64, 128, 1, 1280]
    - [9, 0.511]
  - - [128, 128, 1, 1280]
    - [9, 0.926]
  - - [64, 256, 1, 1280]
    - [9, 0.93]
  - - [128, 256, 1, 1280]
    - [10, 1.801]
  - - [64, 448, 1, 1280]
    - [10, 1.628]
  - - [128, 448, 1, 1280]
    - [10, 3.094]
  - - [64, 704, 1, 1280]
    - [11, 2.633]
  - - [128, 704, 1, 1280]
    - [10, 4.84]
  - - [64, 1024, 1, 1280]
    - [12, 3.686]
  - - [128, 1024, 1, 1280]
    - [13, 6.768]
  - - [64, 1408, 1, 1280]
    - [10, 4.862]
  - - [128, 1408, 1, 1280]
    - [13, 9.071]
  - - [64, 1856, 1, 1280]
    - [13, 6.776]
  - - [128, 1856, 1, 1280]
    - [13, 11.808]
  - - [64, 2368, 1, 1280]
    - [13, 8.068]
  - - [128, 2368, 1, 1280]
    - [14, 11.75]
  - - [64, 2944, 1, 1280]
    - [13, 9.645]
  - - [128, 2944, 1, 1280]
    - [7, 15.728]
  - - [64, 3584, 1, 1280]
    - [13, 11.545]
  - - [128, 3584, 1, 1280]
    - [15, 18.691]
  - - [64, 4288, 1, 1280]
    - [7, 11.535]
  - - [128, 4288, 1, 1280]
    - [15, 20.106]
  - - [64, 5056, 1, 1280]
    - [7, 13.943]
  - - [128, 5056, 1, 1280]
    - [15, 23.707]
  - - [64, 5888, 1, 1280]
    - [7, 14.608]
  - - [128, 5888, 1, 1280]
    - [15, 27.693]
  - - [64, 6784, 1, 1280]
    - [8, 17.57]
  - - [128, 6784, 1, 1280]
    - [7, 30.774]
  - - [64, 64, 1, 3328]
    - [16, 0.57]
  - - [128, 64, 1, 3328]
    - [16, 1.086]
  - - [64, 128, 1, 3328]
    - [16, 1.077]
  - - [128, 128, 1, 3328]
    - [16, 1.97]
  - - [64, 256, 1, 3328]
    - [16, 1.993]
  - - [128, 256, 1, 3328]
    - [16, 3.606]
  - - [64, 448, 1, 3328]
    - [16, 3.09]
  - - [128, 448, 1, 3328]
    - [9, 5.462]
  - - [64, 704, 1, 3328]
    - [9, 4.571]
  - - [128, 704, 1, 3328]
    - [17, 8.23]
  - - [64, 1024, 1, 3328]
    - [18, 6.339]
  - - [128, 1024, 1, 3328]
    - [18, 11.63]
  - - [64, 1408, 1, 3328]
    - [18, 8.042]
  - - [128, 1408, 1, 3328]
    - [19, 13.525]
  - - [64, 1856, 1, 3328]
    - [18, 10.6]
  - - [128, 1856, 1, 3328]
    - [20, 16.155]
  - - [64, 2368, 1, 3328]
    - [19, 11.683]
  - - [128, 2368, 1, 3328]
    - [21, 18.474]
  - - [64, 2944, 1, 3328]
    - [19, 13.459]
  - - [128, 2944, 1, 3328]
    - [21, 22.355]
  - - [64, 3584, 1, 3328]
    - [22, 15.232]
  - - [128, 3584, 1, 3328]
    - [23, 27.111]
  - - [64, 4288, 1, 3328]
    - [24, 17.733]
  - - [128, 4288, 1, 3328]
    - [25, 27.977]
  - - [64, 5056, 1, 3328]
    - [24, 20.865]
  - - [128, 5056, 1, 3328]
    - [26, 31.842]
  - - [64, 5888, 1, 3328]
    - [27, 22.526]
  - - [128, 5888, 1, 3328]
    - [28, 34.267]
  - - [64, 6784, 1, 3328]
    - [29, 25.466]
  - - [128, 6784, 1, 3328]
    - [28, 37.984]
  - - [256, 64, 1, 256]
    - [3, 0.35]
  - - [448, 64, 1, 256]
    - [3, 0.603]
  - - [704, 64, 1, 256]
    - [1, 0.972]
  - - [1024, 64, 1, 256]
    - [30, 1.427]
  - - [1408, 64, 1, 256]
    - [3, 1.945]
  - - [1856, 64, 1, 256]
    - [3, 2.432]
  - - [2368, 64, 1, 256]
    - [0, 3.026]
  - - [2944, 64, 1, 256]
    - [2, 3.891]
  - - [3584, 64, 1, 256]
    - [30, 4.579]
  - - [4288, 64, 1, 256]
    - [1, 5.434]
  - - [5056, 64, 1, 256]
    - [2, 6.46]
  - - [5888, 64, 1, 256]
    - [31, 6.687]
  - - [6784, 64, 1, 256]
    - [30, 7.648]
  - - [256, 128, 1, 256]
    - [3, 0.701]
  - - [448, 128, 1, 256]
    - [3, 1.195]
  - - [704, 128, 1, 256]
    - [3, 1.91]
  - - [1024, 128, 1, 256]
    - [3, 2.684]
  - - [1408, 128, 1, 256]
    - [2, 3.659]
  - - [1856, 128, 1, 256]
    - [2, 4.783]
  - - [2368, 128, 1, 256]
    - [3, 5.952]
  - - [2944, 128, 1, 256]
    - [0, 6.59]
  - - [3584, 128, 1, 256]
    - [0, 7.964]
  - - [4288, 128, 1, 256]
    - [4, 8.594]
  - - [5056, 128, 1, 256]
    - [6, 9.813]
  - - [5888, 128, 1, 256]
    - [7, 10.877]
  - - [6784, 128, 1, 256]
    - [8, 12.166]
  - - [256, 64, 1, 1280]
    - [9, 0.9]
  - - [448, 64, 1, 1280]
    - [13, 1.651]
  - - [704, 64, 1, 1280]
    - [13, 2.582]
  - - [1024, 64, 1, 1280]
    - [13, 3.552]
  - - [1408, 64, 1, 1280]
    - [10, 4.734]
  - - [1856, 64, 1, 1280]
    - [10, 6.587]
  - - [2368, 64, 1, 1280]
    - [13, 7.725]
  - - [2944, 64, 1, 1280]
    - [13, 9.687]
  - - [3584, 64, 1, 1280]
    - [13, 11.401]
  - - [4288, 64, 1, 1280]
    - [32, 11.22]
  - - [5056, 64, 1, 1280]
    - [33, 13.229]
  - - [5888, 64, 1, 1280]
    - [32, 15.25]
  - - [6784, 64, 1, 1280]
    - [32, 16.831]
  - - [256, 128, 1, 1280]
    - [11, 1.809]
  - - [448, 128, 1, 1280]
    - [11, 3.165]
  - - [704, 128, 1, 1280]
    - [10, 4.755]
  - - [1024, 128, 1, 1280]
    - [3, 6.856]
  - - [1408, 128, 1, 1280]
    - [30, 8.812]
  - - [1856, 128, 1, 1280]
    - [30, 11.808]
  - - [2368, 128, 1, 1280]
    - [33, 12.225]
  - - [2944, 128, 1, 1280]
    - [32, 15.25]
  - - [3584, 128, 1, 1280]
    - [33, 18.257]
  - - [4288, 128, 1, 1280]
    - [33, 19.923]
  - - [5056, 128, 1, 1280]
    - [7, 23.35]
  - - [5888, 128, 1, 1280]
    - [7, 26.949]
  - - [6784, 128, 1, 1280]
    - [7, 30.684]
  - - [256, 64, 1, 3328]
    - [16, 1.89]
  - - [448, 64, 1, 3328]
    - [16, 3.037]
  - - [704, 64, 1, 3328]
    - [9, 4.483]
  - - [1024, 64, 1, 3328]
    - [9, 6.111]
  - - [1408, 64, 1, 3328]
    - [18, 7.861]
  - - [1856, 64, 1, 3328]
    - [18, 10.163]
  - - [2368, 64, 1, 3328]
    - [19, 11.889]
  - - [2944, 64, 1, 3328]
    - [19, 13.615]
  - - [3584, 64, 1, 3328]
    - [19, 15.071]
  - - [4288, 64, 1, 3328]
    - [34, 18.032]
  - - [5056, 64, 1, 3328]
    - [24, 20.779]
  - - [5888, 64, 1, 3328]
    - [23, 22.526]
  - - [6784, 64, 1, 3328]
    - [27, 24.586]
  - - [256, 128, 1, 3328]
    - [16, 3.581]
  - - [448, 128, 1, 3328]
    - [9, 5.363]
  - - [704, 128, 1, 3328]
    - [17, 8.158]
  - - [1024, 128, 1, 3328]
    - [18, 10.658]
  - - [1408, 128, 1, 3328]
    - [19, 12.933]
  - - [1856, 128, 1, 3328]
    - [35, 16.778]
  - - [2368, 128, 1, 3328]
    - [27, 20.0]
  - - [2944, 128, 1, 3328]
    - [27, 23.426]
  - - [3584, 128, 1, 3328]
    - [24, 26.806]
  - - [4288, 128, 1, 3328]
    - [26, 27.048]
  - - [5056, 128, 1, 3328]
    - [36, 30.679]
  - - [5888, 128, 1, 3328]
    - [7, 33.92]
  - - [6784, 128, 1, 3328]
    - [7, 37.098]
  - - [256, 256, 1, 256]
    - [3, 1.389]
  - - [448, 256, 1, 256]
    - [3, 2.41]
  - - [256, 448, 1, 256]
    - [3, 2.348]
  - - [448, 448, 1, 256]
    - [3, 3.974]
  - - [256, 256, 1, 1280]
    - [13, 3.668]
  - - [448, 256, 1, 1280]
    - [13, 6.188]
  - - [256, 448, 1, 1280]
    - [11, 6.245]
  - - [448, 448, 1, 1280]
    - [13, 10.187]
  - - [256, 256, 1, 3328]
    - [18, 6.223]
  - - [448, 256, 1, 3328]
    - [18, 10.662]
  - - [256, 448, 1, 3328]
    - [18, 10.444]
  - - [448, 448, 1, 3328]
    - [19, 14.99]
  - - [512, 16, 1, 512]
    - [3, 0.28]
  - - [512, 32, 1, 512]
    - [3, 0.565]
  - - [1024, 16, 1, 512]
    - [3, 0.545]
  - - [1024, 32, 1, 512]
    - [1, 1.13]
  - - [704, 256, 1, 256]
    - [3, 3.69]
  - - [1024, 256, 1, 256]
    - [5, 5.234]
  - - [1408, 256, 1, 256]
    - [1, 6.964]
  - - [1856, 256, 1, 256]
    - [0, 8.131]
  - - [2368, 256, 1, 256]
    - [6, 9.37]
  - - [2944, 256, 1, 256]
    - [7, 11.077]
  - - [3584, 256, 1, 256]
    - [8, 13.084]
  - - [4288, 256, 1, 256]
    - [37, 13.697]
  - - [5056, 256, 1, 256]
    - [37, 15.741]
  - - [5888, 256, 1, 256]
    - [38, 16.718]
  - - [6784, 256, 1, 256]
    - [39, 18.492]
  - - [704, 448, 1, 256]
    - [3, 6.094]
  - - [1024, 448, 1, 256]
    - [30, 7.85]
  - - [1408, 448, 1, 256]
    - [7, 9.328]
  - - [1856, 448, 1, 256]
    - [7, 11.928]
  - - [2368, 448, 1, 256]
    - [37, 13.519]
  - - [2944, 448, 1, 256]
    - [40, 16.204]
  - - [3584, 448, 1, 256]
    - [38, 16.871]
  - - [4288, 448, 1, 256]
    - [7, 16.378]
  - - [5056, 448, 1, 256]
    - [41, 18.521]
  - - [5888, 448, 1, 256]
    - [41, 19.873]
  - - [6784, 448, 1, 256]
    - [42, 19.161]
  - - [256, 704, 1, 256]
    - [1, 3.659]
  - - [448, 704, 1, 256]
    - [1, 6.143]
  - - [704, 704, 1, 256]
    - [5, 7.563]
  - - [1024, 704, 1, 256]
    - [7, 10.531]
  - - [1408, 704, 1, 256]
    - [37, 12.767]
  - - [1856, 704, 1, 256]
    - [37, 15.971]
  - - [2368, 704, 1, 256]
    - [39, 17.068]
  - - [2944, 704, 1, 256]
    - [41, 17.181]
  - - [3584, 704, 1, 256]
    - [43, 19.884]
  - - [4288, 704, 1, 256]
    - [44, 19.133]
  - - [5056, 704, 1, 256]
    - [45, 21.213]
  - - [5888, 704, 1, 256]
    - [46, 20.863]
  - - [6784, 704, 1, 256]
    - [47, 21.267]
  - - [256, 1024, 1, 256]
    - [1, 5.065]
  - - [448, 1024, 1, 256]
    - [0, 7.85]
  - - [704, 1024, 1, 256]
    - [7, 10.727]
  - - [1024, 1024, 1, 256]
    - [40, 13.152]
  - - [1408, 1024, 1, 256]
    - [40, 16.932]
  - - [1856, 1024, 1, 256]
    - [48, 18.286]
  - - [2368, 1024, 1, 256]
    - [49, 19.172]
  - - [2944, 1024, 1, 256]
    - [50, 18.614]
  - - [3584, 1024, 1, 256]
    - [44, 21.341]
  - - [4288, 1024, 1, 256]
    - [51, 21.734]
  - - [5056, 1024, 1, 256]
    - [52, 21.837]
  - - [5888, 1024, 1, 256]
    - [53, 22.223]
  - - [6784, 1024, 1, 256]
    - [53, 23.64]
  - - [256, 1408, 1, 256]
    - [1, 7.021]
  - - [448, 1408, 1, 256]
    - [54, 9.445]
  - - [704, 1408, 1, 256]
    - [40, 12.565]
  - - [1024, 1408, 1, 256]
    - [40, 16.448]
  - - [1408, 1408, 1, 256]
    - [40, 16.549]
  - - [1856, 1408, 1, 256]
    - [41, 20.261]
  - - [2368, 1408, 1, 256]
    - [44, 19.92]
  - - [2944, 1408, 1, 256]
    - [53, 21.874]
  - - [3584, 1408, 1, 256]
    - [41, 22.021]
  - - [4288, 1408, 1, 256]
    - [55, 22.356]
  - - [5056, 1408, 1, 256]
    - [53, 24.504]
  - - [5888, 1408, 1, 256]
    - [47, 24.858]
  - - [6784, 1408, 1, 256]
    - [56, 24.955]
  - - [256, 1856, 1, 256]
    - [1, 8.131]
  - - [448, 1856, 1, 256]
    - [7, 11.928]
  - - [704, 1856, 1, 256]
    - [46, 15.73]
  - - [1024, 1856, 1, 256]
    - [57, 18.661]
  - - [1408, 1856, 1, 256]
    - [41, 20.261]
  - - [1856, 1856, 1, 256]
    - [42, 20.178]
  - - [2368, 1856, 1, 256]
    - [40, 21.358]
  - - [2944, 1856, 1, 256]
    - [52, 22.806]
  - - [3584, 1856, 1, 256]
    - [53, 23.679]
  - - [4288, 1856, 1, 256]
    - [47, 24.351]
  - - [5056, 1856, 1, 256]
    - [47, 24.705]
  - - [5888, 1856, 1, 256]
    - [53, 25.794]
  - - [6784, 1856, 1, 256]
    - [47, 26.53]
  - - [256, 2368, 1, 256]
    - [58, 9.25]
  - - [448, 2368, 1, 256]
    - [37, 13.591]
  - - [704, 2368, 1, 256]
    - [57, 17.517]
  - - [1024, 2368, 1, 256]
    - [41, 19.3]
  - - [1408, 2368, 1, 256]
    - [57, 19.578]
  - - [1856, 2368, 1, 256]
    - [37, 21.314]
  - - [2368, 2368, 1, 256]
    - [59, 23.122]
  - - [2944, 2368, 1, 256]
    - [60, 24.311]
  - - [3584, 2368, 1, 256]
    - [53, 24.826]
  - - [4288, 2368, 1, 256]
    - [61, 25.027]
  - - [5056, 2368, 1, 256]
    - [47, 25.474]
  - - [5888, 2368, 1, 256]
    - [47, 26.873]
  - - [6784, 2368, 1, 256]
    - [47, 27.589]
  - - [256, 2944, 1, 256]
    - [7, 10.812]
  - - [448, 2944, 1, 256]
    - [62, 16.204]
  - - [704, 2944, 1, 256]
    - [41, 17.925]
  - - [1024, 2944, 1, 256]
    - [44, 18.284]
  - - [1408, 2944, 1, 256]
    - [63, 22.366]
  - - [1856, 2944, 1, 256]
    - [49, 23.047]
  - - [2368, 2944, 1, 256]
    - [64, 24.066]
  - - [2944, 2944, 1, 256]
    - [55, 25.199]
  - - [3584, 2944, 1, 256]
    - [61, 25.028]
  - - [4288, 2944, 1, 256]
    - [47, 26.717]
  - - [5056, 2944, 1, 256]
    - [53, 26.493]
  - - [5888, 2944, 1, 256]
    - [41, 27.871]
  - - [6784, 2944, 1, 256]
    - [59, 28.014]
  - - [256, 3584, 1, 256]
    - [7, 13.242]
  - - [448, 3584, 1, 256]
    - [57, 17.892]
  - - [704, 3584, 1, 256]
    - [41, 20.491]
  - - [1024, 3584, 1, 256]
    - [42, 20.639]
  - - [1408, 3584, 1, 256]
    - [40, 22.021]
  - - [1856, 3584, 1, 256]
    - [63, 23.893]
  - - [2368, 3584, 1, 256]
    - [65, 24.856]
  - - [2944, 3584, 1, 256]
    - [41, 25.303]
  - - [3584, 3584, 1, 256]
    - [41, 27.018]
  - - [4288, 3584, 1, 256]
    - [61, 27.641]
  - - [5056, 3584, 1, 256]
    - [61, 27.829]
  - - [5888, 3584, 1, 256]
    - [61, 28.856]
  - - [6784, 3584, 1, 256]
    - [47, 28.865]
  - - [256, 4288, 1, 256]
    - [46, 14.063]
  - - [448, 4288, 1, 256]
    - [57, 19.337]
  - - [704, 4288, 1, 256]
    - [40, 18.497]
  - - [1024, 4288, 1, 256]
    - [66, 22.918]
  - - [1408, 4288, 1, 256]
    - [40, 22.495]
  - - [1856, 4288, 1, 256]
    - [47, 24.413]
  - - [2368, 4288, 1, 256]
    - [59, 25.235]
  - - [2944, 4288, 1, 256]
    - [67, 26.39]
  - - [3584, 4288, 1, 256]
    - [41, 27.232]
  - - [4288, 4288, 1, 256]
    - [47, 28.292]
  - - [5056, 4288, 1, 256]
    - [41, 28.728]
  - - [5888, 4288, 1, 256]
    - [41, 29.277]
  - - [6784, 4288, 1, 256]
    - [61, 29.393]
  - - [256, 5056, 1, 256]
    - [40, 16.32]
  - - [448, 5056, 1, 256]
    - [41, 18.712]
  - - [704, 5056, 1, 256]
    - [44, 20.748]
  - - [1024, 5056, 1, 256]
    - [41, 22.511]
  - - [1408, 5056, 1, 256]
    - [67, 24.61]
  - - [1856, 5056, 1, 256]
    - [49, 25.007]
  - - [2368, 5056, 1, 256]
    - [61, 26.219]
  - - [2944, 5056, 1, 256]
    - [63, 26.974]
  - - [3584, 5056, 1, 256]
    - [41, 28.044]
  - - [4288, 5056, 1, 256]
    - [47, 29.017]
  - - [5056, 5056, 1, 256]
    - [41, 28.943]
  - - [5888, 5056, 1, 256]
    - [61, 29.606]
  - - [6784, 5056, 1, 256]
    - [41, 29.644]
  - - [256, 5888, 1, 256]
    - [57, 16.489]
  - - [448, 5888, 1, 256]
    - [68, 19.935]
  - - [704, 5888, 1, 256]
    - [40, 21.265]
  - - [1024, 5888, 1, 256]
    - [67, 22.053]
  - - [1408, 5888, 1, 256]
    - [67, 24.703]
  - - [1856, 5888, 1, 256]
    - [63, 26.207]
  - - [2368, 5888, 1, 256]
    - [47, 27.402]
  - - [2944, 5888, 1, 256]
    - [41, 28.193]
  - - [3584, 5888, 1, 256]
    - [61, 28.709]
  - - [4288, 5888, 1, 256]
    - [61, 29.207]
  - - [5056, 5888, 1, 256]
    - [47, 29.326]
  - - [5888, 5888, 1, 256]
    - [41, 30.071]
  - - [6784, 5888, 1, 256]
    - [63, 29.989]
  - - [256, 6784, 1, 256]
    - [38, 18.249]
  - - [448, 6784, 1, 256]
    - [44, 19.111]
  - - [704, 6784, 1, 256]
    - [47, 21.347]
  - - [1024, 6784, 1, 256]
    - [66, 24.085]
  - - [1408, 6784, 1, 256]
    - [61, 24.982]
  - - [1856, 6784, 1, 256]
    - [67, 26.885]
  - - [2368, 6784, 1, 256]
    - [63, 27.392]
  - - [2944, 6784, 1, 256]
    - [53, 28.413]
  - - [3584, 6784, 1, 256]
    - [63, 29.052]
  - - [4288, 6784, 1, 256]
    - [65, 29.555]
  - - [5056, 6784, 1, 256]
    - [53, 29.453]
  - - [5888, 6784, 1, 256]
    - [53, 30.236]
  - - [6784, 6784, 1, 256]
    - [53, 30.266]
  - - [704, 256, 1, 1280]
    - [13, 9.427]
  - - [1024, 256, 1, 1280]
    - [29, 10.681]
  - - [1408, 256, 1, 1280]
    - [32, 14.44]
  - - [1856, 256, 1, 1280]
    - [33, 18.909]
  - - [2368, 256, 1, 1280]
    - [8, 21.741]
  - - [2944, 256, 1, 1280]
    - [8, 27.111]
  - - [3584, 256, 1, 1280]
    - [8, 31.047]
  - - [4288, 256, 1, 1280]
    - [69, 29.483]
  - - [5056, 256, 1, 1280]
    - [70, 33.853]
  - - [5888, 256, 1, 1280]
    - [71, 35.968]
  - - [6784, 256, 1, 1280]
    - [72, 40.161]
  - - [704, 448, 1, 1280]
    - [34, 12.72]
  - - [1024, 448, 1, 1280]
    - [24, 17.281]
  - - [1408, 448, 1, 1280]
    - [8, 23.178]
  - - [1856, 448, 1, 1280]
    - [7, 28.954]
  - - [2368, 448, 1, 1280]
    - [73, 29.484]
  - - [2944, 448, 1, 1280]
    - [73, 34.647]
  - - [3584, 448, 1, 1280]
    - [74, 37.639]
  - - [4288, 448, 1, 1280]
    - [75, 35.787]
  - - [5056, 448, 1, 1280]
    - [76, 40.924]
  - - [5888, 448, 1, 1280]
    - [49, 45.14]
  - - [6784, 448, 1, 1280]
    - [77, 43.135]
  - - [256, 704, 1, 1280]
    - [13, 9.386]
  - - [448, 704, 1, 1280]
    - [78, 12.551]
  - - [704, 704, 1, 1280]
    - [15, 19.028]
  - - [1024, 704, 1, 1280]
    - [33, 25.549]
  - - [1408, 704, 1, 1280]
    - [73, 27.047]
  - - [1856, 704, 1, 1280]
    - [73, 35.572]
  - - [2368, 704, 1, 1280]
    - [74, 39.232]
  - - [2944, 704, 1, 1280]
    - [75, 37.222]
  - - [3584, 704, 1, 1280]
    - [41, 43.55]
  - - [4288, 704, 1, 1280]
    - [77, 43.778]
  - - [5056, 704, 1, 1280]
    - [79, 50.518]
  - - [5888, 704, 1, 1280]
    - [80, 46.146]
  - - [6784, 704, 1, 1280]
    - [81, 45.768]
  - - [256, 1024, 1, 1280]
    - [7, 10.828]
  - - [448, 1024, 1, 1280]
    - [27, 17.39]
  - - [704, 1024, 1, 1280]
    - [8, 25.549]
  - - [1024, 1024, 1, 1280]
    - [73, 27.85]
  - - [1408, 1024, 1, 1280]
    - [71, 33.798]
  - - [1856, 1024, 1, 1280]
    - [82, 42.081]
  - - [2368, 1024, 1, 1280]
    - [49, 41.914]
  - - [2944, 1024, 1, 1280]
    - [83, 44.363]
  - - [3584, 1024, 1, 1280]
    - [79, 52.273]
  - - [4288, 1024, 1, 1280]
    - [80, 49.111]
  - - [5056, 1024, 1, 1280]
    - [84, 48.225]
  - - [5888, 1024, 1, 1280]
    - [85, 48.31]
  - - [6784, 1024, 1, 1280]
    - [86, 54.035]
  - - [256, 1408, 1, 1280]
    - [7, 14.686]
  - - [448, 1408, 1, 1280]
    - [15, 23.911]
  - - [704, 1408, 1, 1280]
    - [73, 27.485]
  - - [1024, 1408, 1, 1280]
    - [73, 35.831]
  - - [1408, 1408, 1, 1280]
    - [75, 35.338]
  - - [1856, 1408, 1, 1280]
    - [65, 45.433]
  - - [2368, 1408, 1, 1280]
    - [77, 47.66]
  - - [2944, 1408, 1, 1280]
    - [87, 46.405]
  - - [3584, 1408, 1, 1280]
    - [81, 47.484]
  - - [4288, 1408, 1, 1280]
    - [77, 47.674]
  - - [5056, 1408, 1, 1280]
    - [83, 54.909]
  - - [5888, 1408, 1, 1280]
    - [88, 52.767]
  - - [6784, 1408, 1, 1280]
    - [81, 55.195]
  - - [256, 1856, 1, 1280]
    - [33, 18.6]
  - - [448, 1856, 1, 1280]
    - [15, 29.294]
  - - [704, 1856, 1, 1280]
    - [70, 35.491]
  - - [1024, 1856, 1, 1280]
    - [89, 42.793]
  - - [1408, 1856, 1, 1280]
    - [41, 45.236]
  - - [1856, 1856, 1, 1280]
    - [83, 48.948]
  - - [2368, 1856, 1, 1280]
    - [80, 49.156]
  - - [2944, 1856, 1, 1280]
    - [81, 51.456]
  - - [3584, 1856, 1, 1280]
    - [90, 51.64]
  - - [4288, 1856, 1, 1280]
    - [88, 51.727]
  - - [5056, 1856, 1, 1280]
    - [91, 56.571]
  - - [5888, 1856, 1, 1280]
    - [81, 54.612]
  - - [6784, 1856, 1, 1280]
    - [91, 54.254]
  - - [256, 2368, 1, 1280]
    - [7, 23.274]
  - - [448, 2368, 1, 1280]
    - [73, 29.622]
  - - [704, 2368, 1, 1280]
    - [71, 38.927]
  - - [1024, 2368, 1, 1280]
    - [41, 40.624]
  - - [1408, 2368, 1, 1280]
    - [83, 47.603]
  - - [1856, 2368, 1, 1280]
    - [87, 48.477]
  - - [2368, 2368, 1, 1280]
    - [61, 51.002]
  - - [2944, 2368, 1, 1280]
    - [77, 54.016]
  - - [3584, 2368, 1, 1280]
    - [61, 52.949]
  - - [4288, 2368, 1, 1280]
    - [83, 54.74]
  - - [5056, 2368, 1, 1280]
    - [92, 54.14]
  - - [5888, 2368, 1, 1280]
    - [91, 57.891]
  - - [6784, 2368, 1, 1280]
    - [88, 55.186]
  - - [256, 2944, 1, 1280]
    - [15, 27.111]
  - - [448, 2944, 1, 1280]
    - [62, 32.243]
  - - [704, 2944, 1, 1280]
    - [76, 37.673]
  - - [1024, 2944, 1, 1280]
    - [83, 42.534]
  - - [1408, 2944, 1, 1280]
    - [93, 47.244]
  - - [1856, 2944, 1, 1280]
    - [94, 51.375]
  - - [2368, 2944, 1, 1280]
    - [90, 53.738]
  - - [2944, 2944, 1, 1280]
    - [61, 52.943]
  - - [3584, 2944, 1, 1280]
    - [83, 56.024]
  - - [4288, 2944, 1, 1280]
    - [94, 54.611]
  - - [5056, 2944, 1, 1280]
    - [90, 59.893]
  - - [5888, 2944, 1, 1280]
    - [77, 57.678]
  - - [6784, 2944, 1, 1280]
    - [77, 56.759]
  - - [256, 3584, 1, 1280]
    - [15, 32.042]
  - - [448, 3584, 1, 1280]
    - [95, 37.13]
  - - [704, 3584, 1, 1280]
    - [47, 44.058]
  - - [1024, 3584, 1, 1280]
    - [77, 51.965]
  - - [1408, 3584, 1, 1280]
    - [81, 47.447]
  - - [1856, 3584, 1, 1280]
    - [90, 51.64]
  - - [2368, 3584, 1, 1280]
    - [93, 52.108]
  - - [2944, 3584, 1, 1280]
    - [96, 56.805]
  - - [3584, 3584, 1, 1280]
    - [94, 56.694]
  - - [4288, 3584, 1, 1280]
    - [83, 61.487]
  - - [5056, 3584, 1, 1280]
    - [90, 60.161]
  - - [5888, 3584, 1, 1280]
    - [83, 60.015]
  - - [6784, 3584, 1, 1280]
    - [83, 59.731]
  - - [256, 4288, 1, 1280]
    - [97, 29.027]
  - - [448, 4288, 1, 1280]
    - [45, 41.313]
  - - [704, 4288, 1, 1280]
    - [83, 43.306]
  - - [1024, 4288, 1, 1280]
    - [92, 48.611]
  - - [1408, 4288, 1, 1280]
    - [85, 46.509]
  - - [1856, 4288, 1, 1280]
    - [98, 51.615]
  - - [2368, 4288, 1, 1280]
    - [99, 54.519]
  - - [2944, 4288, 1, 1280]
    - [98, 55.595]
  - - [3584, 4288, 1, 1280]
    - [83, 60.816]
  - - [4288, 4288, 1, 1280]
    - [90, 60.442]
  - - [5056, 4288, 1, 1280]
    - [90, 59.742]
  - - [5888, 4288, 1, 1280]
    - [83, 60.645]
  - - [6784, 4288, 1, 1280]
    - [83, 61.122]
  - - [256, 5056, 1, 1280]
    - [73, 33.632]
  - - [448, 5056, 1, 1280]
    - [47, 40.019]
  - - [704, 5056, 1, 1280]
    - [81, 50.044]
  - - [1024, 5056, 1, 1280]
    - [89, 47.451]
  - - [1408, 5056, 1, 1280]
    - [90, 53.097]
  - - [1856, 5056, 1, 1280]
    - [81, 54.487]
  - - [2368, 5056, 1, 1280]
    - [98, 54.365]
  - - [2944, 5056, 1, 1280]
    - [90, 59.752]
  - - [3584, 5056, 1, 1280]
    - [83, 59.616]
  - - [4288, 5056, 1, 1280]
    - [90, 60.088]
  - - [5056, 5056, 1, 1280]
    - [90, 61.712]
  - - [5888, 5056, 1, 1280]
    - [90, 62.234]
  - - [6784, 5056, 1, 1280]
    - [83, 63.494]
  - - [256, 5888, 1, 1280]
    - [71, 35.896]
  - - [448, 5888, 1, 1280]
    - [100, 40.719]
  - - [704, 5888, 1, 1280]
    - [80, 46.061]
  - - [1024, 5888, 1, 1280]
    - [101, 48.021]
  - - [1408, 5888, 1, 1280]
    - [61, 52.02]
  - - [1856, 5888, 1, 1280]
    - [90, 57.897]
  - - [2368, 5888, 1, 1280]
    - [90, 57.532]
  - - [2944, 5888, 1, 1280]
    - [83, 58.228]
  - - [3584, 5888, 1, 1280]
    - [83, 59.83]
  - - [4288, 5888, 1, 1280]
    - [83, 61.012]
  - - [5056, 5888, 1, 1280]
    - [90, 62.507]
  - - [5888, 5888, 1, 1280]
    - [83, 64.595]
  - - [6784, 5888, 1, 1280]
    - [90, 62.925]
  - - [256, 6784, 1, 1280]
    - [71, 39.93]
  - - [448, 6784, 1, 1280]
    - [83, 44.129]
  - - [704, 6784, 1, 1280]
    - [94, 46.855]
  - - [1024, 6784, 1, 1280]
    - [77, 52.468]
  - - [1408, 6784, 1, 1280]
    - [94, 54.956]
  - - [1856, 6784, 1, 1280]
    - [81, 55.126]
  - - [2368, 6784, 1, 1280]
    - [81, 55.923]
  - - [2944, 6784, 1, 1280]
    - [83, 56.464]
  - - [3584, 6784, 1, 1280]
    - [77, 58.696]
  - - [4288, 6784, 1, 1280]
    - [79, 60.612]
  - - [5056, 6784, 1, 1280]
    - [77, 63.454]
  - - [5888, 6784, 1, 1280]
    - [77, 62.164]
  - - [6784, 6784, 1, 1280]
    - [77, 64.26]
  - - [704, 256, 1, 3328]
    - [19, 13.364]
  - - [1024, 256, 1, 3328]
    - [102, 16.834]
  - - [1408, 256, 1, 3328]
    - [27, 22.725]
  - - [1856, 256, 1, 3328]
    - [27, 29.016]
  - - [2368, 256, 1, 3328]
    - [103, 30.16]
  - - [2944, 256, 1, 3328]
    - [8, 33.294]
  - - [3584, 256, 1, 3328]
    - [36, 38.563]
  - - [4288, 256, 1, 3328]
    - [73, 42.104]
  - - [5056, 256, 1, 3328]
    - [73, 47.65]
  - - [5888, 256, 1, 3328]
    - [82, 50.587]
  - - [6784, 256, 1, 3328]
    - [82, 57.056]
  - - [704, 448, 1, 3328]
    - [27, 21.215]
  - - [1024, 448, 1, 3328]
    - [78, 27.529]
  - - [1408, 448, 1, 3328]
    - [104, 29.856]
  - - [1856, 448, 1, 3328]
    - [28, 36.68]
  - - [2368, 448, 1, 3328]
    - [73, 42.414]
  - - [2944, 448, 1, 3328]
    - [97, 50.033]
  - - [3584, 448, 1, 3328]
    - [74, 52.917]
  - - [4288, 448, 1, 3328]
    - [75, 48.367]
  - - [5056, 448, 1, 3328]
    - [105, 55.46]
  - - [5888, 448, 1, 3328]
    - [49, 54.335]
  - - [6784, 448, 1, 3328]
    - [77, 58.107]
  - - [256, 704, 1, 3328]
    - [19, 13.757]
  - - [448, 704, 1, 3328]
    - [29, 21.4]
  - - [704, 704, 1, 3328]
    - [25, 26.03]
  - - [1024, 704, 1, 3328]
    - [106, 32.074]
  - - [1408, 704, 1, 3328]
    - [73, 39.63]
  - - [1856, 704, 1, 3328]
    - [70, 50.804]
  - - [2368, 704, 1, 3328]
    - [71, 56.009]
  - - [2944, 704, 1, 3328]
    - [75, 51.108]
  - - [3584, 704, 1, 3328]
    - [73, 52.775]
  - - [4288, 704, 1, 3328]
    - [90, 58.542]
  - - [5056, 704, 1, 3328]
    - [83, 68.178]
  - - [5888, 704, 1, 3328]
    - [80, 63.067]
  - - [6784, 704, 1, 3328]
    - [89, 58.149]
  - - [256, 1024, 1, 3328]
    - [107, 17.634]
  - - [448, 1024, 1, 3328]
    - [24, 28.292]
  - - [704, 1024, 1, 3328]
    - [28, 33.213]
  - - [1024, 1024, 1, 3328]
    - [108, 38.694]
  - - [1408, 1024, 1, 3328]
    - [109, 48.44]
  - - [1856, 1024, 1, 3328]
    - [84, 60.338]
  - - [2368, 1024, 1, 3328]
    - [110, 53.866]
  - - [2944, 1024, 1, 3328]
    - [101, 59.424]
  - - [3584, 1024, 1, 3328]
    - [96, 70.426]
  - - [4288, 1024, 1, 3328]
    - [93, 66.353]
  - - [5056, 1024, 1, 3328]
    - [82, 61.055]
  - - [5888, 1024, 1, 3328]
    - [85, 61.426]
  - - [6784, 1024, 1, 3328]
    - [85, 69.389]
  - - [256, 1408, 1, 3328]
    - [21, 21.84]
  - - [448, 1408, 1, 3328]
    - [106, 30.364]
  - - [704, 1408, 1, 3328]
    - [111, 38.686]
  - - [1024, 1408, 1, 3328]
    - [73, 50.511]
  - - [1408, 1408, 1, 3328]
    - [75, 48.617]
  - - [1856, 1408, 1, 3328]
    - [61, 54.733]
  - - [2368, 1408, 1, 3328]
    - [90, 64.377]
  - - [2944, 1408, 1, 3328]
    - [112, 65.433]
  - - [3584, 1408, 1, 3328]
    - [109, 60.751]
  - - [4288, 1408, 1, 3328]
    - [77, 61.671]
  - - [5056, 1408, 1, 3328]
    - [83, 71.108]
  - - [5888, 1408, 1, 3328]
    - [88, 69.148]
  - - [6784, 1408, 1, 3328]
    - [81, 69.8]
  - - [256, 1856, 1, 3328]
    - [29, 28.348]
  - - [448, 1856, 1, 3328]
    - [28, 38.195]
  - - [704, 1856, 1, 3328]
    - [69, 51.252]
  - - [1024, 1856, 1, 3328]
    - [72, 59.911]
  - - [1408, 1856, 1, 3328]
    - [41, 54.844]
  - - [1856, 1856, 1, 3328]
    - [83, 66.43]
  - - [2368, 1856, 1, 3328]
    - [80, 66.544]
  - - [2944, 1856, 1, 3328]
    - [89, 65.503]
  - - [3584, 1856, 1, 3328]
    - [77, 66.529]
  - - [4288, 1856, 1, 3328]
    - [92, 67.89]
  - - [5056, 1856, 1, 3328]
    - [91, 73.99]
  - - [5888, 1856, 1, 3328]
    - [81, 68.73]
  - - [6784, 1856, 1, 3328]
    - [91, 68.713]
  - - [256, 2368, 1, 3328]
    - [26, 30.8]
  - - [448, 2368, 1, 3328]
    - [73, 42.632]
  - - [704, 2368, 1, 3328]
    - [72, 55.293]
  - - [1024, 2368, 1, 3328]
    - [105, 54.765]
  - - [1408, 2368, 1, 3328]
    - [83, 64.417]
  - - [1856, 2368, 1, 3328]
    - [87, 66.479]
  - - [2368, 2368, 1, 3328]
    - [70, 61.063]
  - - [2944, 2368, 1, 3328]
    - [77, 70.13]
  - - [3584, 2368, 1, 3328]
    - [80, 67.515]
  - - [4288, 2368, 1, 3328]
    - [77, 69.657]
  - - [5056, 2368, 1, 3328]
    - [98, 69.841]
  - - [5888, 2368, 1, 3328]
    - [91, 74.689]
  - - [6784, 2368, 1, 3328]
    - [98, 70.637]
  - - [256, 2944, 1, 3328]
    - [28, 33.822]
  - - [448, 2944, 1, 3328]
    - [89, 44.169]
  - - [704, 2944, 1, 3328]
    - [105, 50.866]
  - - [1024, 2944, 1, 3328]
    - [83, 58.136]
  - - [1408, 2944, 1, 3328]
    - [93, 63.816]
  - - [1856, 2944, 1, 3328]
    - [94, 65.177]
  - - [2368, 2944, 1, 3328]
    - [90, 69.657]
  - - [2944, 2944, 1, 3328]
    - [80, 68.217]
  - - [3584, 2944, 1, 3328]
    - [77, 71.766]
  - - [4288, 2944, 1, 3328]
    - [93, 68.687]
  - - [5056, 2944, 1, 3328]
    - [90, 75.786]
  - - [5888, 2944, 1, 3328]
    - [90, 71.906]
  - - [6784, 2944, 1, 3328]
    - [92, 70.301]
  - - [256, 3584, 1, 3328]
    - [106, 39.523]
  - - [448, 3584, 1, 3328]
    - [84, 52.75]
  - - [704, 3584, 1, 3328]
    - [41, 53.204]
  - - [1024, 3584, 1, 3328]
    - [77, 69.526]
  - - [1408, 3584, 1, 3328]
    - [113, 61.058]
  - - [1856, 3584, 1, 3328]
    - [90, 66.872]
  - - [2368, 3584, 1, 3328]
    - [87, 67.24]
  - - [2944, 3584, 1, 3328]
    - [90, 72.382]
  - - [3584, 3584, 1, 3328]
    - [81, 69.83]
  - - [4288, 3584, 1, 3328]
    - [90, 78.157]
  - - [5056, 3584, 1, 3328]
    - [90, 75.208]
  - - [5888, 3584, 1, 3328]
    - [92, 73.954]
  - - [6784, 3584, 1, 3328]
    - [83, 73.369]
  - - [256, 4288, 1, 3328]
    - [73, 42.365]
  - - [448, 4288, 1, 3328]
    - [48, 49.858]
  - - [704, 4288, 1, 3328]
    - [83, 58.396]
  - - [1024, 4288, 1, 3328]
    - [92, 68.582]
  - - [1408, 4288, 1, 3328]
    - [114, 60.578]
  - - [1856, 4288, 1, 3328]
    - [98, 67.964]
  - - [2368, 4288, 1, 3328]
    - [83, 69.336]
  - - [2944, 4288, 1, 3328]
    - [98, 72.58]
  - - [3584, 4288, 1, 3328]
    - [90, 77.928]
  - - [4288, 4288, 1, 3328]
    - [90, 75.969]
  - - [5056, 4288, 1, 3328]
    - [98, 76.357]
  - - [5888, 4288, 1, 3328]
    - [83, 75.305]
  - - [6784, 4288, 1, 3328]
    - [83, 75.904]
  - - [256, 5056, 1, 3328]
    - [108, 47.65]
  - - [448, 5056, 1, 3328]
    - [110, 51.644]
  - - [704, 5056, 1, 3328]
    - [90, 67.678]
  - - [1024, 5056, 1, 3328]
    - [89, 61.264]
  - - [1408, 5056, 1, 3328]
    - [83, 70.251]
  - - [1856, 5056, 1, 3328]
    - [115, 71.72]
  - - [2368, 5056, 1, 3328]
    - [98, 69.529]
  - - [2944, 5056, 1, 3328]
    - [90, 75.86]
  - - [3584, 5056, 1, 3328]
    - [83, 74.918]
  - - [4288, 5056, 1, 3328]
    - [99, 74.9]
  - - [5056, 5056, 1, 3328]
    - [83, 75.991]
  - - [5888, 5056, 1, 3328]
    - [90, 77.457]
  - - [6784, 5056, 1, 3328]
    - [90, 79.206]
  - - [256, 5888, 1, 3328]
    - [71, 51.027]
  - - [448, 5888, 1, 3328]
    - [100, 52.394]
  - - [704, 5888, 1, 3328]
    - [93, 62.306]
  - - [1024, 5888, 1, 3328]
    - [77, 61.729]
  - - [1408, 5888, 1, 3328]
    - [98, 69.0]
  - - [1856, 5888, 1, 3328]
    - [90, 74.07]
  - - [2368, 5888, 1, 3328]
    - [115, 73.426]
  - - [2944, 5888, 1, 3328]
    - [99, 72.194]
  - - [3584, 5888, 1, 3328]
    - [83, 73.772]
  - - [4288, 5888, 1, 3328]
    - [90, 75.067]
  - - [5056, 5888, 1, 3328]
    - [90, 77.652]
  - - [5888, 5888, 1, 3328]
    - [90, 79.939]
  - - [6784, 5888, 1, 3328]
    - [83, 76.722]
  - - [256, 6784, 1, 3328]
    - [71, 57.116]
  - - [448, 6784, 1, 3328]
    - [83, 59.197]
  - - [704, 6784, 1, 3328]
    - [94, 58.909]
  - - [1024, 6784, 1, 3328]
    - [77, 68.925]
  - - [1408, 6784, 1, 3328]
    - [94, 69.621]
  - - [1856, 6784, 1, 3328]
    - [98, 71.782]
  - - [2368, 6784, 1, 3328]
    - [92, 69.46]
  - - [2944, 6784, 1, 3328]
    - [101, 69.414]
  - - [3584, 6784, 1, 3328]
    - [77, 72.63]
  - - [4288, 6784, 1, 3328]
    - [77, 75.267]
  - - [5056, 6784, 1, 3328]
    - [77, 78.763]
  - - [5888, 6784, 1, 3328]
    - [77, 76.312]
  - - [6784, 6784, 1, 3328]
    - [77, 79.41]
  - - [1024, 1024, 1, 1024]
    - [73, 24.629]
  - - [1760, 7133, 1, 1760]
    - [91, 60.284]
  - - [2048, 7133, 1, 2048]
    - [91, 68.355]
  - - [2560, 7133, 1, 2560]
    - [80, 70.447]
  - - [3072, 7435, 1, 1024]
    - [79, 56.441]
  - - [4096, 7133, 1, 4096]
    - [91, 76.734]
  - - [7680, 5481, 1, 2560]
    - [101, 74.294]
  - - [32, 32, 1, 32]
    - [58, 0.004]
  - - [32, 64, 1, 256]
    - [1, 0.043]
  - - [32, 128, 1, 256]
    - [1, 0.088]
  - - [32, 256, 1, 256]
    - [1, 0.175]
  - - [32, 448, 1, 256]
    - [3, 0.304]
  - - [32, 704, 1, 256]
    - [3, 0.473]
  - - [32, 1024, 1, 256]
    - [2, 0.72]
  - - [32, 1408, 1, 256]
    - [30, 0.964]
  - - [32, 1856, 1, 256]
    - [3, 1.237]
  - - [32, 2368, 1, 256]
    - [1, 1.607]
  - - [32, 2944, 1, 256]
    - [1, 1.98]
  - - [32, 3584, 1, 256]
    - [3, 2.41]
  - - [32, 4288, 1, 256]
    - [1, 2.859]
  - - [32, 5056, 1, 256]
    - [3, 3.371]
  - - [32, 5888, 1, 256]
    - [30, 3.825]
  - - [32, 6784, 1, 256]
    - [4, 4.408]
  - - [32, 64, 1, 1280]
    - [9, 0.135]
  - - [32, 128, 1, 1280]
    - [9, 0.264]
  - - [32, 256, 1, 1280]
    - [9, 0.506]
  - - [32, 448, 1, 1280]
    - [9, 0.838]
  - - [32, 704, 1, 1280]
    - [13, 1.232]
  - - [32, 1024, 1, 1280]
    - [13, 1.776]
  - - [32, 1408, 1, 1280]
    - [13, 2.431]
  - - [32, 1856, 1, 1280]
    - [13, 3.19]
  - - [32, 2368, 1, 1280]
    - [12, 3.981]
  - - [32, 2944, 1, 1280]
    - [13, 4.993]
  - - [32, 3584, 1, 1280]
    - [13, 6.079]
  - - [32, 4288, 1, 1280]
    - [13, 6.965]
  - - [32, 5056, 1, 1280]
    - [13, 8.177]
  - - [32, 5888, 1, 1280]
    - [13, 9.483]
  - - [32, 6784, 1, 1280]
    - [13, 10.701]
  - - [32, 64, 1, 3328]
    - [16, 0.287]
  - - [32, 128, 1, 3328]
    - [116, 0.562]
  - - [32, 256, 1, 3328]
    - [117, 1.054]
  - - [32, 448, 1, 3328]
    - [16, 1.744]
  - - [32, 704, 1, 3328]
    - [9, 2.479]
  - - [32, 1024, 1, 3328]
    - [16, 3.459]
  - - [32, 1408, 1, 3328]
    - [9, 4.586]
  - - [32, 1856, 1, 3328]
    - [18, 5.538]
  - - [32, 2368, 1, 3328]
    - [19, 6.448]
  - - [32, 2944, 1, 3328]
    - [19, 7.681]
  - - [32, 3584, 1, 3328]
    - [13, 8.755]
  - - [32, 4288, 1, 3328]
    - [19, 9.87]
  - - [32, 5056, 1, 3328]
    - [118, 11.637]
  - - [32, 5888, 1, 3328]
    - [118, 12.785]
  - - [32, 6784, 1, 3328]
    - [118, 14.634]
  - - [64, 32, 1, 256]
    - [2, 0.043]
  - - [128, 32, 1, 256]
    - [2, 0.088]
  - - [256, 32, 1, 256]
    - [2, 0.174]
  - - [448, 32, 1, 256]
    - [1, 0.315]
  - - [704, 32, 1, 256]
    - [3, 0.491]
  - - [1024, 32, 1, 256]
    - [4, 0.701]
  - - [1408, 32, 1, 256]
    - [30, 0.955]
  - - [1856, 32, 1, 256]
    - [1, 1.282]
  - - [2368, 32, 1, 256]
    - [3, 1.565]
  - - [2944, 32, 1, 256]
    - [3, 1.98]
  - - [3584, 32, 1, 256]
    - [1, 2.453]
  - - [4288, 32, 1, 256]
    - [30, 2.81]
  - - [5056, 32, 1, 256]
    - [3, 3.313]
  - - [5888, 32, 1, 256]
    - [1, 3.925]
  - - [6784, 32, 1, 256]
    - [4, 4.408]
  - - [64, 32, 1, 1280]
    - [9, 0.136]
  - - [128, 32, 1, 1280]
    - [9, 0.267]
  - - [256, 32, 1, 1280]
    - [9, 0.508]
  - - [448, 32, 1, 1280]
    - [9, 0.834]
  - - [704, 32, 1, 1280]
    - [10, 1.255]
  - - [1024, 32, 1, 1280]
    - [10, 1.776]
  - - [1408, 32, 1, 1280]
    - [11, 2.357]
  - - [1856, 32, 1, 1280]
    - [11, 3.249]
  - - [2368, 32, 1, 1280]
    - [11, 3.947]
  - - [2944, 32, 1, 1280]
    - [10, 4.762]
  - - [3584, 32, 1, 1280]
    - [10, 5.896]
  - - [4288, 32, 1, 1280]
    - [13, 6.849]
  - - [5056, 32, 1, 1280]
    - [13, 8.009]
  - - [5888, 32, 1, 1280]
    - [13, 9.288]
  - - [6784, 32, 1, 1280]
    - [13, 10.614]
  - - [64, 32, 1, 3328]
    - [119, 0.29]
  - - [128, 32, 1, 3328]
    - [9, 0.538]
  - - [256, 32, 1, 3328]
    - [16, 1.086]
  - - [448, 32, 1, 3328]
    - [117, 1.731]
  - - [704, 32, 1, 3328]
    - [16, 2.618]
  - - [1024, 32, 1, 3328]
    - [16, 3.606]
  - - [1408, 32, 1, 3328]
    - [9, 4.616]
  - - [1856, 32, 1, 3328]
    - [9, 5.522]
  - - [2368, 32, 1, 3328]
    - [17, 6.762]
  - - [2944, 32, 1, 3328]
    - [17, 8.173]
  - - [3584, 32, 1, 3328]
    - [19, 8.733]
  - - [4288, 32, 1, 3328]
    - [19, 9.497]
  - - [5056, 32, 1, 3328]
    - [24, 10.476]
  - - [5888, 32, 1, 3328]
    - [13, 11.831]
  - - [6784, 32, 1, 3328]
    - [13, 13.549]
  - - [64, 64, 1, 32]
    - [120, 0.017]
  - - [128, 64, 1, 32]
    - [120, 0.035]
  - - [256, 64, 1, 32]
    - [4, 0.071]
  - - [448, 64, 1, 32]
    - [4, 0.121]
  - - [704, 64, 1, 32]
    - [4, 0.19]
  - - [1024, 64, 1, 32]
    - [4, 0.289]
  - - [1408, 64, 1, 32]
    - [4, 0.375]
  - - [1856, 64, 1, 32]
    - [4, 0.487]
  - - [2368, 64, 1, 32]
    - [121, 0.589]
  - - [2944, 64, 1, 32]
    - [121, 0.705]
  - - [3584, 64, 1, 32]
    - [4, 0.859]
  - - [4288, 64, 1, 32]
    - [122, 1.015]
  - - [5056, 64, 1, 32]
    - [121, 1.196]
  - - [5888, 64, 1, 32]
    - [121, 1.282]
  - - [6784, 64, 1, 32]
    - [121, 1.461]
  - - [64, 128, 1, 32]
    - [4, 0.035]
  - - [128, 128, 1, 32]
    - [58, 0.068]
  - - [256, 128, 1, 32]
    - [5, 0.138]
  - - [448, 128, 1, 32]
    - [4, 0.242]
  - - [704, 128, 1, 32]
    - [123, 0.36]
  - - [1024, 128, 1, 32]
    - [58, 0.503]
  - - [1408, 128, 1, 32]
    - [121, 0.692]
  - - [1856, 128, 1, 32]
    - [4, 0.912]
  - - [2368, 128, 1, 32]
    - [121, 1.107]
  - - [2944, 128, 1, 32]
    - [122, 1.297]
  - - [3584, 128, 1, 32]
    - [5, 1.561]
  - - [4288, 128, 1, 32]
    - [124, 1.767]
  - - [5056, 128, 1, 32]
    - [125, 1.938]
  - - [5888, 128, 1, 32]
    - [126, 2.109]
  - - [6784, 128, 1, 32]
    - [121, 2.408]
  - - [64, 256, 1, 32]
    - [121, 0.069]
  - - [128, 256, 1, 32]
    - [121, 0.136]
  - - [256, 256, 1, 32]
    - [4, 0.269]
  - - [448, 256, 1, 32]
    - [4, 0.458]
  - - [704, 256, 1, 32]
    - [4, 0.71]
  - - [1024, 256, 1, 32]
    - [122, 0.969]
  - - [1408, 256, 1, 32]
    - [4, 1.316]
  - - [1856, 256, 1, 32]
    - [4, 1.674]
  - - [2368, 256, 1, 32]
    - [120, 1.931]
  - - [2944, 256, 1, 32]
    - [4, 2.28]
  - - [3584, 256, 1, 32]
    - [4, 2.592]
  - - [4288, 256, 1, 32]
    - [127, 2.762]
  - - [5056, 256, 1, 32]
    - [127, 2.982]
  - - [5888, 256, 1, 32]
    - [128, 3.179]
  - - [6784, 256, 1, 32]
    - [129, 3.292]
  - - [64, 448, 1, 32]
    - [121, 0.124]
  - - [128, 448, 1, 32]
    - [121, 0.239]
  - - [256, 448, 1, 32]
    - [4, 0.464]
  - - [448, 448, 1, 32]
    - [4, 0.761]
  - - [704, 448, 1, 32]
    - [122, 1.166]
  - - [1024, 448, 1, 32]
    - [121, 1.526]
  - - [1408, 448, 1, 32]
    - [5, 1.988]
  - - [1856, 448, 1, 32]
    - [4, 2.371]
  - - [2368, 448, 1, 32]
    - [127, 2.739]
  - - [2944, 448, 1, 32]
    - [4, 2.992]
  - - [3584, 448, 1, 32]
    - [127, 3.206]
  - - [4288, 448, 1, 32]
    - [130, 3.404]
  - - [5056, 448, 1, 32]
    - [131, 3.608]
  - - [5888, 448, 1, 32]
    - [131, 3.726]
  - - [6784, 448, 1, 32]
    - [131, 3.761]
  - - [64, 704, 1, 32]
    - [121, 0.198]
  - - [128, 704, 1, 32]
    - [121, 0.37]
  - - [256, 704, 1, 32]
    - [121, 0.692]
  - - [448, 704, 1, 32]
    - [4, 1.152]
  - - [704, 704, 1, 32]
    - [5, 1.631]
  - - [1024, 704, 1, 32]
    - [127, 2.137]
  - - [1408, 704, 1, 32]
    - [4, 2.627]
  - - [1856, 704, 1, 32]
    - [4, 2.964]
  - - [2368, 704, 1, 32]
    - [129, 3.284]
  - - [2944, 704, 1, 32]
    - [131, 3.527]
  - - [3584, 704, 1, 32]
    - [128, 3.741]
  - - [4288, 704, 1, 32]
    - [132, 3.863]
  - - [5056, 704, 1, 32]
    - [129, 4.116]
  - - [5888, 704, 1, 32]
    - [129, 4.251]
  - - [6784, 704, 1, 32]
    - [129, 4.347]
  - - [64, 1024, 1, 32]
    - [121, 0.284]
  - - [128, 1024, 1, 32]
    - [133, 0.516]
  - - [256, 1024, 1, 32]
    - [121, 0.981]
  - - [448, 1024, 1, 32]
    - [130, 1.544]
  - - [704, 1024, 1, 32]
    - [5, 2.226]
  - - [1024, 1024, 1, 32]
    - [127, 2.684]
  - - [1408, 1024, 1, 32]
    - [127, 3.106]
  - - [1856, 1024, 1, 32]
    - [131, 3.449]
  - - [2368, 1024, 1, 32]
    - [131, 3.705]
  - - [2944, 1024, 1, 32]
    - [125, 3.793]
  - - [3584, 1024, 1, 32]
    - [134, 4.041]
  - - [4288, 1024, 1, 32]
    - [131, 4.325]
  - - [5056, 1024, 1, 32]
    - [129, 4.455]
  - - [5888, 1024, 1, 32]
    - [129, 4.583]
  - - [6784, 1024, 1, 32]
    - [131, 4.739]
  - - [64, 1408, 1, 32]
    - [4, 0.386]
  - - [128, 1408, 1, 32]
    - [4, 0.683]
  - - [256, 1408, 1, 32]
    - [121, 1.285]
  - - [448, 1408, 1, 32]
    - [5, 1.988]
  - - [704, 1408, 1, 32]
    - [127, 2.604]
  - - [1024, 1408, 1, 32]
    - [127, 3.129]
  - - [1408, 1408, 1, 32]
    - [131, 3.513]
  - - [1856, 1408, 1, 32]
    - [4, 3.744]
  - - [2368, 1408, 1, 32]
    - [129, 4.059]
  - - [2944, 1408, 1, 32]
    - [132, 4.208]
  - - [3584, 1408, 1, 32]
    - [129, 4.445]
  - - [4288, 1408, 1, 32]
    - [131, 4.648]
  - - [5056, 1408, 1, 32]
    - [129, 4.812]
  - - [5888, 1408, 1, 32]
    - [135, 4.897]
  - - [6784, 1408, 1, 32]
    - [132, 4.966]
  - - [64, 1856, 1, 32]
    - [121, 0.494]
  - - [128, 1856, 1, 32]
    - [121, 0.924]
  - - [256, 1856, 1, 32]
    - [121, 1.581]
  - - [448, 1856, 1, 32]
    - [4, 2.371]
  - - [704, 1856, 1, 32]
    - [127, 2.987]
  - - [1024, 1856, 1, 32]
    - [131, 3.449]
  - - [1408, 1856, 1, 32]
    - [129, 3.744]
  - - [1856, 1856, 1, 32]
    - [126, 4.061]
  - - [2368, 1856, 1, 32]
    - [131, 4.315]
  - - [2944, 1856, 1, 32]
    - [131, 4.583]
  - - [3584, 1856, 1, 32]
    - [136, 4.732]
  - - [4288, 1856, 1, 32]
    - [129, 4.934]
  - - [5056, 1856, 1, 32]
    - [131, 5.082]
  - - [5888, 1856, 1, 32]
    - [131, 5.09]
  - - [6784, 1856, 1, 32]
    - [131, 5.172]
  - - [64, 2368, 1, 32]
    - [121, 0.597]
  - - [128, 2368, 1, 32]
    - [121, 1.107]
  - - [256, 2368, 1, 32]
    - [5, 1.973]
  - - [448, 2368, 1, 32]
    - [127, 2.739]
  - - [704, 2368, 1, 32]
    - [127, 3.328]
  - - [1024, 2368, 1, 32]
    - [128, 3.631]
  - - [1408, 2368, 1, 32]
    - [131, 4.109]
  - - [1856, 2368, 1, 32]
    - [131, 4.373]
  - - [2368, 2368, 1, 32]
    - [129, 4.601]
  - - [2944, 2368, 1, 32]
    - [137, 4.745]
  - - [3584, 2368, 1, 32]
    - [131, 4.974]
  - - [4288, 2368, 1, 32]
    - [131, 5.111]
  - - [5056, 2368, 1, 32]
    - [131, 5.234]
  - - [5888, 2368, 1, 32]
    - [131, 5.239]
  - - [6784, 2368, 1, 32]
    - [129, 5.292]
  - - [64, 2944, 1, 32]
    - [121, 0.733]
  - - [128, 2944, 1, 32]
    - [121, 1.282]
  - - [256, 2944, 1, 32]
    - [121, 2.129]
  - - [448, 2944, 1, 32]
    - [129, 2.992]
  - - [704, 2944, 1, 32]
    - [129, 3.651]
  - - [1024, 2944, 1, 32]
    - [136, 3.793]
  - - [1408, 2944, 1, 32]
    - [128, 4.295]
  - - [1856, 2944, 1, 32]
    - [128, 4.583]
  - - [2368, 2944, 1, 32]
    - [137, 4.777]
  - - [2944, 2944, 1, 32]
    - [129, 4.991]
  - - [3584, 2944, 1, 32]
    - [129, 5.163]
  - - [4288, 2944, 1, 32]
    - [129, 5.236]
  - - [5056, 2944, 1, 32]
    - [131, 5.319]
  - - [5888, 2944, 1, 32]
    - [136, 5.341]
  - - [6784, 2944, 1, 32]
    - [129, 5.379]
  - - [64, 3584, 1, 32]
    - [4, 0.87]
  - - [128, 3584, 1, 32]
    - [5, 1.544]
  - - [256, 3584, 1, 32]
    - [129, 2.544]
  - - [448, 3584, 1, 32]
    - [129, 3.227]
  - - [704, 3584, 1, 32]
    - [135, 3.704]
  - - [1024, 3584, 1, 32]
    - [138, 4.056]
  - - [1408, 3584, 1, 32]
    - [129, 4.458]
  - - [1856, 3584, 1, 32]
    - [126, 4.812]
  - - [2368, 3584, 1, 32]
    - [131, 4.974]
  - - [2944, 3584, 1, 32]
    - [131, 5.105]
  - - [3584, 3584, 1, 32]
    - [129, 5.212]
  - - [4288, 3584, 1, 32]
    - [131, 5.351]
  - - [5056, 3584, 1, 32]
    - [129, 5.394]
  - - [5888, 3584, 1, 32]
    - [131, 5.453]
  - - [6784, 3584, 1, 32]
    - [131, 5.495]
  - - [64, 4288, 1, 32]
    - [4, 1.027]
  - - [128, 4288, 1, 32]
    - [5, 1.826]
  - - [256, 4288, 1, 32]
    - [139, 2.695]
  - - [448, 4288, 1, 32]
    - [4, 3.466]
  - - [704, 4288, 1, 32]
    - [132, 3.913]
  - - [1024, 4288, 1, 32]
    - [127, 4.242]
  - - [1408, 4288, 1, 32]
    - [128, 4.648]
  - - [1856, 4288, 1, 32]
    - [136, 4.894]
  - - [2368, 4288, 1, 32]
    - [132, 5.145]
  - - [2944, 4288, 1, 32]
    - [135, 5.214]
  - - [3584, 4288, 1, 32]
    - [131, 5.339]
  - - [4288, 4288, 1, 32]
    - [131, 5.441]
  - - [5056, 4288, 1, 32]
    - [129, 5.474]
  - - [5888, 4288, 1, 32]
    - [129, 5.515]
  - - [6784, 4288, 1, 32]
    - [136, 5.556]
  - - [64, 5056, 1, 32]
    - [121, 1.154]
  - - [128, 5056, 1, 32]
    - [127, 1.978]
  - - [256, 5056, 1, 32]
    - [129, 3.028]
  - - [448, 5056, 1, 32]
    - [127, 3.627]
  - - [704, 5056, 1, 32]
    - [131, 4.148]
  - - [1024, 5056, 1, 32]
    - [131, 4.443]
  - - [1408, 5056, 1, 32]
    - [128, 4.812]
  - - [1856, 5056, 1, 32]
    - [138, 5.045]
  - - [2368, 5056, 1, 32]
    - [132, 5.227]
  - - [2944, 5056, 1, 32]
    - [131, 5.307]
  - - [3584, 5056, 1, 32]
    - [131, 5.427]
  - - [4288, 5056, 1, 32]
    - [132, 5.493]
  - - [5056, 5056, 1, 32]
    - [137, 5.543]
  - - [5888, 5056, 1, 32]
    - [131, 5.582]
  - - [6784, 5056, 1, 32]
    - [131, 5.613]
  - - [64, 5888, 1, 32]
    - [120, 1.328]
  - - [128, 5888, 1, 32]
    - [129, 2.213]
  - - [256, 5888, 1, 32]
    - [129, 3.247]
  - - [448, 5888, 1, 32]
    - [131, 3.798]
  - - [704, 5888, 1, 32]
    - [135, 4.237]
  - - [1024, 5888, 1, 32]
    - [129, 4.606]
  - - [1408, 5888, 1, 32]
    - [129, 4.926]
  - - [1856, 5888, 1, 32]
    - [129, 5.129]
  - - [2368, 5888, 1, 32]
    - [126, 5.279]
  - - [2944, 5888, 1, 32]
    - [132, 5.402]
  - - [3584, 5888, 1, 32]
    - [131, 5.49]
  - - [4288, 5888, 1, 32]
    - [132, 5.535]
  - - [5056, 5888, 1, 32]
    - [132, 5.607]
  - - [5888, 5888, 1, 32]
    - [131, 5.621]
  - - [6784, 5888, 1, 32]
    - [136, 5.64]
  - - [64, 6784, 1, 32]
    - [121, 1.53]
  - - [128, 6784, 1, 32]
    - [129, 2.43]
  - - [256, 6784, 1, 32]
    - [129, 3.422]
  - - [448, 6784, 1, 32]
    - [128, 3.906]
  - - [704, 6784, 1, 32]
    - [132, 4.456]
  - - [1024, 6784, 1, 32]
    - [131, 4.696]
  - - [1408, 6784, 1, 32]
    - [131, 5.01]
  - - [1856, 6784, 1, 32]
    - [131, 5.252]
  - - [2368, 6784, 1, 32]
    - [129, 5.369]
  - - [2944, 6784, 1, 32]
    - [129, 5.442]
  - - [3584, 6784, 1, 32]
    - [126, 5.516]
  - - [4288, 6784, 1, 32]
    - [132, 5.609]
  - - [5056, 6784, 1, 32]
    - [136, 5.622]
  - - [5888, 6784, 1, 32]
    - [137, 5.661]
  - - [6784, 6784, 1, 32]
    - [132, 5.665]
  - - [32, 32, 1, 256]
    - [31, 0.022]
  - - [32, 32, 1, 1280]
    - [140, 0.067]
  - - [32, 32, 1, 3328]
    - [119, 0.151]
  - - [32, 64, 1, 32]
    - [120, 0.009]
  - - [32, 128, 1, 32]
    - [58, 0.017]
  - - [32, 256, 1, 32]
    - [4, 0.035]
  - - [32, 448, 1, 32]
    - [4, 0.061]
  - - [32, 704, 1, 32]
    - [121, 0.095]
  - - [32, 1024, 1, 32]
    - [121, 0.146]
  - - [32, 1408, 1, 32]
    - [121, 0.187]
  - - [32, 1856, 1, 32]
    - [4, 0.258]
  - - [32, 2368, 1, 32]
    - [121, 0.315]
  - - [32, 2944, 1, 32]
    - [4, 0.386]
  - - [32, 3584, 1, 32]
    - [4, 0.458]
  - - [32, 4288, 1, 32]
    - [121, 0.563]
  - - [32, 5056, 1, 32]
    - [121, 0.629]
  - - [32, 5888, 1, 32]
    - [4, 0.733]
  - - [32, 6784, 1, 32]
    - [4, 0.813]
  - - [64, 32, 1, 32]
    - [120, 0.008]
  - - [128, 32, 1, 32]
    - [121, 0.017]
  - - [256, 32, 1, 32]
    - [121, 0.035]
  - - [448, 32, 1, 32]
    - [122, 0.061]
  - - [704, 32, 1, 32]
    - [4, 0.096]
  - - [1024, 32, 1, 32]
    - [120, 0.142]
  - - [1408, 32, 1, 32]
    - [4, 0.198]
  - - [1856, 32, 1, 32]
    - [121, 0.258]
  - - [2368, 32, 1, 32]
    - [121, 0.311]
  - - [2944, 32, 1, 32]
    - [121, 0.397]
  - - [3584, 32, 1, 32]
    - [121, 0.47]
  - - [4288, 32, 1, 32]
    - [121, 0.541]
  - - [5056, 32, 1, 32]
    - [121, 0.629]
  - - [5888, 32, 1, 32]
    - [121, 0.733]
  - - [6784, 32, 1, 32]
    - [127, 0.833]
  - - [1, 1, 1, 1]
    - [141, 0.0]
  - - [1, 64, 1, 256]
    - [142, 0.0]
  - - [1, 128, 1, 256]
    - [142, 0.001]
  - - [1, 256, 1, 256]
    - [143, 0.001]
  - - [1, 448, 1, 256]
    - [142, 0.003]
  - - [1, 704, 1, 256]
    - [144, 0.004]
  - - [1, 1024, 1, 256]
    - [144, 0.006]
  - - [1, 1408, 1, 256]
    - [143, 0.008]
  - - [1, 1856, 1, 256]
    - [143, 0.01]
  - - [1, 2368, 1, 256]
    - [145, 0.013]
  - - [1, 2944, 1, 256]
    - [144, 0.016]
  - - [1, 3584, 1, 256]
    - [142, 0.021]
  - - [1, 4288, 1, 256]
    - [144, 0.023]
  - - [1, 5056, 1, 256]
    - [142, 0.027]
  - - [1, 5888, 1, 256]
    - [142, 0.032]
  - - [1, 6784, 1, 256]
    - [142, 0.036]
  - - [1, 64, 1, 1280]
    - [146, 0.001]
  - - [1, 128, 1, 1280]
    - [146, 0.001]
  - - [1, 256, 1, 1280]
    - [146, 0.002]
  - - [1, 448, 1, 1280]
    - [146, 0.004]
  - - [1, 704, 1, 1280]
    - [146, 0.006]
  - - [1, 1024, 1, 1280]
    - [147, 0.008]
  - - [1, 1408, 1, 1280]
    - [147, 0.011]
  - - [1, 1856, 1, 1280]
    - [146, 0.015]
  - - [1, 2368, 1, 1280]
    - [146, 0.019]
  - - [1, 2944, 1, 1280]
    - [146, 0.023]
  - - [1, 3584, 1, 1280]
    - [146, 0.028]
  - - [1, 4288, 1, 1280]
    - [146, 0.034]
  - - [1, 5056, 1, 1280]
    - [146, 0.04]
  - - [1, 5888, 1, 1280]
    - [146, 0.046]
  - - [1, 6784, 1, 1280]
    - [146, 0.054]
  - - [1, 64, 1, 3328]
    - [146, 0.001]
  - - [1, 128, 1, 3328]
    - [146, 0.001]
  - - [1, 256, 1, 3328]
    - [147, 0.002]
  - - [1, 448, 1, 3328]
    - [147, 0.004]
  - - [1, 704, 1, 3328]
    - [147, 0.006]
  - - [1, 1024, 1, 3328]
    - [147, 0.009]
  - - [1, 1408, 1, 3328]
    - [147, 0.012]
  - - [1, 1856, 1, 3328]
    - [147, 0.016]
  - - [1, 2368, 1, 3328]
    - [147, 0.02]
  - - [1, 2944, 1, 3328]
    - [147, 0.025]
  - - [1, 3584, 1, 3328]
    - [147, 0.031]
  - - [1, 4288, 1, 3328]
    - [147, 0.037]
  - - [1, 5056, 1, 3328]
    - [147, 0.043]
  - - [1, 5888, 1, 3328]
    - [147, 0.051]
  - - [1, 6784, 1, 3328]
    - [147, 0.058]
  - - [64, 1, 1, 256]
    - [144, 0.0]
  - - [128, 1, 1, 256]
    - [142, 0.001]
  - - [256, 1, 1, 256]
    - [142, 0.001]
  - - [448, 1, 1, 256]
    - [143, 0.003]
  - - [704, 1, 1, 256]
    - [142, 0.004]
  - - [1024, 1, 1, 256]
    - [142, 0.006]
  - - [1408, 1, 1, 256]
    - [144, 0.008]
  - - [1856, 1, 1, 256]
    - [142, 0.011]
  - - [2368, 1, 1, 256]
    - [145, 0.014]
  - - [2944, 1, 1, 256]
    - [145, 0.017]
  - - [3584, 1, 1, 256]
    - [144, 0.02]
  - - [4288, 1, 1, 256]
    - [142, 0.024]
  - - [5056, 1, 1, 256]
    - [144, 0.027]
  - - [5888, 1, 1, 256]
    - [143, 0.032]
  - - [6784, 1, 1, 256]
    - [143, 0.037]
  - - [64, 1, 1, 1280]
    - [146, 0.001]
  - - [128, 1, 1, 1280]
    - [146, 0.001]
  - - [256, 1, 1, 1280]
    - [147, 0.002]
  - - [448, 1, 1, 1280]
    - [147, 0.004]
  - - [704, 1, 1, 1280]
    - [146, 0.006]
  - - [1024, 1, 1, 1280]
    - [146, 0.008]
  - - [1408, 1, 1, 1280]
    - [147, 0.011]
  - - [1856, 1, 1, 1280]
    - [146, 0.015]
  - - [2368, 1, 1, 1280]
    - [147, 0.019]
  - - [2944, 1, 1, 1280]
    - [146, 0.023]
  - - [3584, 1, 1, 1280]
    - [146, 0.028]
  - - [4288, 1, 1, 1280]
    - [147, 0.034]
  - - [5056, 1, 1, 1280]
    - [146, 0.04]
  - - [5888, 1, 1, 1280]
    - [146, 0.047]
  - - [6784, 1, 1, 1280]
    - [146, 0.054]
  - - [64, 1, 1, 3328]
    - [146, 0.001]
  - - [128, 1, 1, 3328]
    - [146, 0.001]
  - - [256, 1, 1, 3328]
    - [146, 0.002]
  - - [448, 1, 1, 3328]
    - [147, 0.004]
  - - [704, 1, 1, 3328]
    - [147, 0.006]
  - - [1024, 1, 1, 3328]
    - [147, 0.009]
  - - [1408, 1, 1, 3328]
    - [147, 0.012]
  - - [1856, 1, 1, 3328]
    - [147, 0.016]
  - - [2368, 1, 1, 3328]
    - [147, 0.021]
  - - [2944, 1, 1, 3328]
    - [147, 0.025]
  - - [3584, 1, 1, 3328]
    - [147, 0.031]
  - - [4288, 1, 1, 3328]
    - [147, 0.037]
  - - [5056, 1, 1, 3328]
    - [147, 0.044]
  - - [5888, 1, 1, 3328]
    - [147, 0.051]
  - - [6784, 1, 1, 3328]
    - [147, 0.059]
  - - [64, 64, 1, 1]
    - [120, 0.0]
  - - [128, 64, 1, 1]
    - [123, 0.001]
  - - [256, 64, 1, 1]
    - [4, 0.002]
  - - [448, 64, 1, 1]
    - [121, 0.003]
  - - [704, 64, 1, 1]
    - [58, 0.006]
  - - [1024, 64, 1, 1]
    - [4, 0.008]
  - - [1408, 64, 1, 1]
    - [121, 0.011]
  - - [1856, 64, 1, 1]
    - [121, 0.015]
  - - [2368, 64, 1, 1]
    - [121, 0.018]
  - - [2944, 64, 1, 1]
    - [121, 0.023]
  - - [3584, 64, 1, 1]
    - [121, 0.029]
  - - [4288, 64, 1, 1]
    - [121, 0.033]
  - - [5056, 64, 1, 1]
    - [121, 0.037]
  - - [5888, 64, 1, 1]
    - [121, 0.041]
  - - [6784, 64, 1, 1]
    - [121, 0.048]
  - - [64, 128, 1, 1]
    - [58, 0.001]
  - - [128, 128, 1, 1]
    - [4, 0.002]
  - - [256, 128, 1, 1]
    - [121, 0.004]
  - - [448, 128, 1, 1]
    - [4, 0.007]
  - - [704, 128, 1, 1]
    - [121, 0.011]
  - - [1024, 128, 1, 1]
    - [127, 0.015]
  - - [1408, 128, 1, 1]
    - [121, 0.021]
  - - [1856, 128, 1, 1]
    - [121, 0.029]
  - - [2368, 128, 1, 1]
    - [121, 0.035]
  - - [2944, 128, 1, 1]
    - [121, 0.041]
  - - [3584, 128, 1, 1]
    - [121, 0.051]
  - - [4288, 128, 1, 1]
    - [121, 0.055]
  - - [5056, 128, 1, 1]
    - [131, 0.062]
  - - [5888, 128, 1, 1]
    - [131, 0.07]
  - - [6784, 128, 1, 1]
    - [121, 0.076]
  - - [64, 256, 1, 1]
    - [4, 0.002]
  - - [128, 256, 1, 1]
    - [121, 0.004]
  - - [256, 256, 1, 1]
    - [121, 0.008]
  - - [448, 256, 1, 1]
    - [125, 0.013]
  - - [704, 256, 1, 1]
    - [4, 0.021]
  - - [1024, 256, 1, 1]
    - [121, 0.028]
  - - [1408, 256, 1, 1]
    - [121, 0.039]
  - - [1856, 256, 1, 1]
    - [121, 0.049]
  - - [2368, 256, 1, 1]
    - [121, 0.057]
  - - [2944, 256, 1, 1]
    - [131, 0.066]
  - - [3584, 256, 1, 1]
    - [121, 0.079]
  - - [4288, 256, 1, 1]
    - [127, 0.086]
  - - [5056, 256, 1, 1]
    - [127, 0.092]
  - - [5888, 256, 1, 1]
    - [121, 0.097]
  - - [6784, 256, 1, 1]
    - [148, 0.102]
  - - [64, 448, 1, 1]
    - [149, 0.003]
  - - [128, 448, 1, 1]
    - [58, 0.007]
  - - [256, 448, 1, 1]
    - [121, 0.013]
  - - [448, 448, 1, 1]
    - [125, 0.022]
  - - [704, 448, 1, 1]
    - [121, 0.034]
  - - [1024, 448, 1, 1]
    - [125, 0.045]
  - - [1408, 448, 1, 1]
    - [150, 0.057]
  - - [1856, 448, 1, 1]
    - [121, 0.073]
  - - [2368, 448, 1, 1]
    - [127, 0.079]
  - - [2944, 448, 1, 1]
    - [121, 0.091]
  - - [3584, 448, 1, 1]
    - [131, 0.101]
  - - [4288, 448, 1, 1]
    - [128, 0.105]
  - - [5056, 448, 1, 1]
    - [129, 0.11]
  - - [5888, 448, 1, 1]
    - [126, 0.116]
  - - [6784, 448, 1, 1]
    - [131, 0.117]
  - - [64, 704, 1, 1]
    - [121, 0.006]
  - - [128, 704, 1, 1]
    - [121, 0.011]
  - - [256, 704, 1, 1]
    - [125, 0.021]
  - - [448, 704, 1, 1]
    - [121, 0.032]
  - - [704, 704, 1, 1]
    - [121, 0.048]
  - - [1024, 704, 1, 1]
    - [131, 0.062]
  - - [1408, 704, 1, 1]
    - [131, 0.077]
  - - [1856, 704, 1, 1]
    - [127, 0.089]
  - - [2368, 704, 1, 1]
    - [131, 0.101]
  - - [2944, 704, 1, 1]
    - [131, 0.108]
  - - [3584, 704, 1, 1]
    - [129, 0.119]
  - - [4288, 704, 1, 1]
    - [129, 0.117]
  - - [5056, 704, 1, 1]
    - [129, 0.126]
  - - [5888, 704, 1, 1]
    - [131, 0.129]
  - - [6784, 704, 1, 1]
    - [134, 0.135]
  - - [64, 1024, 1, 1]
    - [121, 0.008]
  - - [128, 1024, 1, 1]
    - [125, 0.015]
  - - [256, 1024, 1, 1]
    - [121, 0.028]
  - - [448, 1024, 1, 1]
    - [131, 0.046]
  - - [704, 1024, 1, 1]
    - [131, 0.064]
  - - [1024, 1024, 1, 1]
    - [127, 0.076]
  - - [1408, 1024, 1, 1]
    - [131, 0.093]
  - - [1856, 1024, 1, 1]
    - [121, 0.102]
  - - [2368, 1024, 1, 1]
    - [131, 0.113]
  - - [2944, 1024, 1, 1]
    - [134, 0.115]
  - - [3584, 1024, 1, 1]
    - [131, 0.127]
  - - [4288, 1024, 1, 1]
    - [136, 0.131]
  - - [5056, 1024, 1, 1]
    - [132, 0.135]
  - - [5888, 1024, 1, 1]
    - [126, 0.143]
  - - [6784, 1024, 1, 1]
    - [137, 0.145]
  - - [64, 1408, 1, 1]
    - [121, 0.011]
  - - [128, 1408, 1, 1]
    - [125, 0.02]
  - - [256, 1408, 1, 1]
    - [121, 0.038]
  - - [448, 1408, 1, 1]
    - [127, 0.057]
  - - [704, 1408, 1, 1]
    - [121, 0.077]
  - - [1024, 1408, 1, 1]
    - [127, 0.094]
  - - [1408, 1408, 1, 1]
    - [128, 0.104]
  - - [1856, 1408, 1, 1]
    - [129, 0.117]
  - - [2368, 1408, 1, 1]
    - [131, 0.124]
  - - [2944, 1408, 1, 1]
    - [131, 0.129]
  - - [3584, 1408, 1, 1]
    - [128, 0.136]
  - - [4288, 1408, 1, 1]
    - [127, 0.141]
  - - [5056, 1408, 1, 1]
    - [134, 0.146]
  - - [5888, 1408, 1, 1]
    - [131, 0.15]
  - - [6784, 1408, 1, 1]
    - [131, 0.154]
  - - [64, 1856, 1, 1]
    - [121, 0.015]
  - - [128, 1856, 1, 1]
    - [125, 0.027]
  - - [256, 1856, 1, 1]
    - [121, 0.047]
  - - [448, 1856, 1, 1]
    - [121, 0.07]
  - - [704, 1856, 1, 1]
    - [131, 0.09]
  - - [1024, 1856, 1, 1]
    - [130, 0.1]
  - - [1408, 1856, 1, 1]
    - [129, 0.115]
  - - [1856, 1856, 1, 1]
    - [128, 0.125]
  - - [2368, 1856, 1, 1]
    - [131, 0.132]
  - - [2944, 1856, 1, 1]
    - [131, 0.14]
  - - [3584, 1856, 1, 1]
    - [129, 0.146]
  - - [4288, 1856, 1, 1]
    - [131, 0.149]
  - - [5056, 1856, 1, 1]
    - [137, 0.154]
  - - [5888, 1856, 1, 1]
    - [131, 0.158]
  - - [6784, 1856, 1, 1]
    - [137, 0.16]
  - - [64, 2368, 1, 1]
    - [121, 0.019]
  - - [128, 2368, 1, 1]
    - [121, 0.035]
  - - [256, 2368, 1, 1]
    - [121, 0.059]
  - - [448, 2368, 1, 1]
    - [127, 0.081]
  - - [704, 2368, 1, 1]
    - [129, 0.103]
  - - [1024, 2368, 1, 1]
    - [131, 0.111]
  - - [1408, 2368, 1, 1]
    - [129, 0.123]
  - - [1856, 2368, 1, 1]
    - [128, 0.131]
  - - [2368, 2368, 1, 1]
    - [136, 0.14]
  - - [2944, 2368, 1, 1]
    - [131, 0.146]
  - - [3584, 2368, 1, 1]
    - [129, 0.151]
  - - [4288, 2368, 1, 1]
    - [137, 0.156]
  - - [5056, 2368, 1, 1]
    - [131, 0.159]
  - - [5888, 2368, 1, 1]
    - [131, 0.163]
  - - [6784, 2368, 1, 1]
    - [131, 0.163]
  - - [64, 2944, 1, 1]
    - [121, 0.023]
  - - [128, 2944, 1, 1]
    - [121, 0.041]
  - - [256, 2944, 1, 1]
    - [129, 0.068]
  - - [448, 2944, 1, 1]
    - [131, 0.091]
  - - [704, 2944, 1, 1]
    - [129, 0.109]
  - - [1024, 2944, 1, 1]
    - [131, 0.116]
  - - [1408, 2944, 1, 1]
    - [121, 0.127]
  - - [1856, 2944, 1, 1]
    - [132, 0.139]
  - - [2368, 2944, 1, 1]
    - [126, 0.146]
  - - [2944, 2944, 1, 1]
    - [131, 0.152]
  - - [3584, 2944, 1, 1]
    - [137, 0.156]
  - - [4288, 2944, 1, 1]
    - [129, 0.16]
  - - [5056, 2944, 1, 1]
    - [138, 0.163]
  - - [5888, 2944, 1, 1]
    - [126, 0.166]
  - - [6784, 2944, 1, 1]
    - [131, 0.169]
  - - [64, 3584, 1, 1]
    - [121, 0.03]
  - - [128, 3584, 1, 1]
    - [121, 0.051]
  - - [256, 3584, 1, 1]
    - [131, 0.08]
  - - [448, 3584, 1, 1]
    - [132, 0.1]
  - - [704, 3584, 1, 1]
    - [131, 0.117]
  - - [1024, 3584, 1, 1]
    - [129, 0.123]
  - - [1408, 3584, 1, 1]
    - [131, 0.137]
  - - [1856, 3584, 1, 1]
    - [129, 0.144]
  - - [2368, 3584, 1, 1]
    - [136, 0.152]
  - - [2944, 3584, 1, 1]
    - [136, 0.157]
  - - [3584, 3584, 1, 1]
    - [129, 0.164]
  - - [4288, 3584, 1, 1]
    - [126, 0.164]
  - - [5056, 3584, 1, 1]
    - [131, 0.167]
  - - [5888, 3584, 1, 1]
    - [131, 0.169]
  - - [6784, 3584, 1, 1]
    - [137, 0.169]
  - - [64, 4288, 1, 1]
    - [121, 0.034]
  - - [128, 4288, 1, 1]
    - [121, 0.057]
  - - [256, 4288, 1, 1]
    - [127, 0.087]
  - - [448, 4288, 1, 1]
    - [131, 0.107]
  - - [704, 4288, 1, 1]
    - [129, 0.118]
  - - [1024, 4288, 1, 1]
    - [131, 0.13]
  - - [1408, 4288, 1, 1]
    - [137, 0.142]
  - - [1856, 4288, 1, 1]
    - [131, 0.151]
  - - [2368, 4288, 1, 1]
    - [138, 0.155]
  - - [2944, 4288, 1, 1]
    - [129, 0.16]
  - - [3584, 4288, 1, 1]
    - [131, 0.164]
  - - [4288, 4288, 1, 1]
    - [131, 0.167]
  - - [5056, 4288, 1, 1]
    - [131, 0.168]
  - - [5888, 4288, 1, 1]
    - [126, 0.17]
  - - [6784, 4288, 1, 1]
    - [136, 0.172]
  - - [64, 5056, 1, 1]
    - [121, 0.038]
  - - [128, 5056, 1, 1]
    - [127, 0.065]
  - - [256, 5056, 1, 1]
    - [131, 0.095]
  - - [448, 5056, 1, 1]
    - [131, 0.115]
  - - [704, 5056, 1, 1]
    - [128, 0.128]
  - - [1024, 5056, 1, 1]
    - [127, 0.133]
  - - [1408, 5056, 1, 1]
    - [128, 0.145]
  - - [1856, 5056, 1, 1]
    - [126, 0.154]
  - - [2368, 5056, 1, 1]
    - [137, 0.159]
  - - [2944, 5056, 1, 1]
    - [131, 0.163]
  - - [3584, 5056, 1, 1]
    - [137, 0.167]
  - - [4288, 5056, 1, 1]
    - [126, 0.169]
  - - [5056, 5056, 1, 1]
    - [131, 0.171]
  - - [5888, 5056, 1, 1]
    - [126, 0.172]
  - - [6784, 5056, 1, 1]
    - [132, 0.172]
  - - [64, 5888, 1, 1]
    - [121, 0.044]
  - - [128, 5888, 1, 1]
    - [129, 0.071]
  - - [256, 5888, 1, 1]
    - [128, 0.098]
  - - [448, 5888, 1, 1]
    - [137, 0.117]
  - - [704, 5888, 1, 1]
    - [132, 0.129]
  - - [1024, 5888, 1, 1]
    - [131, 0.14]
  - - [1408, 5888, 1, 1]
    - [128, 0.151]
  - - [1856, 5888, 1, 1]
    - [135, 0.158]
  - - [2368, 5888, 1, 1]
    - [131, 0.162]
  - - [2944, 5888, 1, 1]
    - [135, 0.166]
  - - [3584, 5888, 1, 1]
    - [129, 0.169]
  - - [4288, 5888, 1, 1]
    - [137, 0.171]
  - - [5056, 5888, 1, 1]
    - [136, 0.172]
  - - [5888, 5888, 1, 1]
    - [126, 0.173]
  - - [6784, 5888, 1, 1]
    - [138, 0.174]
  - - [64, 6784, 1, 1]
    - [121, 0.05]
  - - [128, 6784, 1, 1]
    - [121, 0.078]
  - - [256, 6784, 1, 1]
    - [137, 0.102]
  - - [448, 6784, 1, 1]
    - [131, 0.121]
  - - [704, 6784, 1, 1]
    - [129, 0.137]
  - - [1024, 6784, 1, 1]
    - [129, 0.144]
  - - [1408, 6784, 1, 1]
    - [131, 0.155]
  - - [1856, 6784, 1, 1]
    - [129, 0.16]
  - - [2368, 6784, 1, 1]
    - [136, 0.164]
  - - [2944, 6784, 1, 1]
    - [131, 0.167]
  - - [3584, 6784, 1, 1]
    - [136, 0.171]
  - - [4288, 6784, 1, 1]
    - [126, 0.172]
  - - [5056, 6784, 1, 1]
    - [129, 0.174]
  - - [5888, 6784, 1, 1]
    - [131, 0.175]
  - - [6784, 6784, 1, 1]
    - [126, 0.175]
  - - [1, 1, 1, 256]
    - [151, 0.0]
  - - [1, 1, 1, 1280]
    - [151, 0.0]
  - - [1, 1, 1, 3328]
    - [146, 0.0]
  - - [1, 64, 1, 1]
    - [151, 0.0]
  - - [1, 128, 1, 1]
    - [152, 0.0]
  - - [1, 256, 1, 1]
    - [153, 0.0]
  - - [1, 448, 1, 1]
    - [152, 0.0]
  - - [1, 704, 1, 1]
    - [152, 0.0]
  - - [1, 1024, 1, 1]
    - [154, 0.0]
  - - [1, 1408, 1, 1]
    - [152, 0.0]
  - - [1, 1856, 1, 1]
    - [152, 0.0]
  - - [1, 2368, 1, 1]
    - [152, 0.0]
  - - [1, 2944, 1, 1]
    - [151, 0.0]
  - - [1, 3584, 1, 1]
    - [151, 0.0]
  - - [1, 4288, 1, 1]
    - [152, 0.0]
  - - [1, 5056, 1, 1]
    - [152, 0.0]
  - - [1, 5888, 1, 1]
    - [151, 0.0]
  - - [1, 6784, 1, 1]
    - [152, 0.001]
  - - [64, 1, 1, 1]
    - [155, 0.0]
  - - [128, 1, 1, 1]
    - [156, 0.0]
  - - [256, 1, 1, 1]
    - [146, 0.0]
  - - [448, 1, 1, 1]
    - [155, 0.0]
  - - [704, 1, 1, 1]
    - [155, 0.0]
  - - [1024, 1, 1, 1]
    - [154, 0.0]
  - - [1408, 1, 1, 1]
    - [151, 0.0]
  - - [1856, 1, 1, 1]
    - [151, 0.0]
  - - [2368, 1, 1, 1]
    - [152, 0.0]
  - - [2944, 1, 1, 1]
    - [151, 0.0]
  - - [3584, 1, 1, 1]
    - [151, 0.0]
  - - [4288, 1, 1, 1]
    - [152, 0.0]
  - - [5056, 1, 1, 1]
    - [152, 0.0]
  - - [5888, 1, 1, 1]
    - [152, 0.001]
  - - [6784, 1, 1, 1]
    - [152, 0.001]
  - - [7680, 8192, 1, 8192]
    - [157, 89.323]
  - - [3840, 4096, 1, 4096]
    - [157, 80.71]
  - - [1920, 2048, 1, 2048]
    - [101, 64.139]
  - - [960, 1024, 1, 1024]
    - [15, 29.165]
  - - [480, 512, 1, 512]
    - [0, 7.597]
  - - [8192, 7680, 1, 8192]
    - [90, 89.049]
  - - [4096, 3840, 1, 4096]
    - [90, 80.527]
  - - [2048, 1920, 1, 2048]
    - [158, 60.484]
  - - [1024, 960, 1, 1024]
    - [7, 29.075]
  - - [512, 480, 1, 512]
    - [30, 7.903]
  - - [8192, 8192, 1, 8192]
    - [91, 87.522]
  - - [4096, 4096, 1, 4096]
    - [91, 68.973]
  - - [2048, 2048, 1, 2048]
    - [93, 55.325]
  - - [512, 512, 1, 512]
    - [120, 7.521]
  - - [64, 512, 16, 512]
    - [8, 12.752]
  - - [1024, 2, 1, 1]
    - [149, 0.0]
  - - [1024, 2, 1, 512]
    - [159, 0.065]
  - - [1024, 1024, 1, 77]
    - [127, 5.004]
  - - [1024, 1024, 1, 512]
    - [37, 18.54]
  - - [1024, 4096, 1, 512]
    - [160, 32.258]
  - - [1024, 30522, 1, 77]
    - [161, 10.786]
  - - [4096, 1024, 1, 512]
    - [162, 31.206]
  - - [64, 128, 160, 128]
    - [40, 9.402]
  - - [1024, 2, 1, 10]
    - [121, 0.003]
  - - [1024, 2, 1, 1280]
    - [140, 0.128]
  - - [1024, 1024, 1, 10]
    - [163, 0.798]
  - - [1024, 1024, 1, 200]
    - [46, 10.065]
  - - [1024, 4096, 1, 1280]
    - [164, 47.309]
  - - [1024, 30522, 1, 200]
    - [63, 23.626]
  - - [4096, 1024, 1, 1280]
    - [93, 46.868]
  - - [64, 128, 624, 128]
    - [148, 11.133]
  - - [1024, 2, 1, 39]
    - [121, 0.01]
  - - [1024, 2, 1, 4992]
    - [165, 0.407]
  - - [1024, 1024, 1, 39]
    - [127, 2.921]
  - - [1024, 1024, 1, 780]
    - [166, 21.086]
  - - [1024, 1024, 1, 4992]
    - [73, 42.895]
  - - [1024, 4096, 1, 4992]
    - [167, 67.824]
  - - [1024, 30522, 1, 780]
    - [83, 46.972]
  - - [4096, 1024, 1, 4992]
    - [80, 68.632]
  - - [64, 512, 64, 512]
    - [43, 22.036]
  - - [1024, 2, 1, 4]
    - [121, 0.001]
  - - [1024, 2, 1, 2048]
    - [16, 0.202]
  - - [1024, 1024, 1, 4]
    - [168, 0.335]
  - - [1024, 1024, 1, 308]
    - [169, 12.916]
  - - [1024, 1024, 1, 2048]
    - [73, 33.776]
  - - [1024, 4096, 1, 2048]
    - [92, 56.811]
  - - [1024, 30522, 1, 308]
    - [63, 30.6]
  - - [4096, 1024, 1, 2048]
    - [80, 54.76]
  - - [64, 128, 640, 128]
    - [148, 11.215]
  - - [1024, 2, 1, 40]
    - [121, 0.01]
  - - [1024, 2, 1, 5120]
    - [165, 0.421]
  - - [1024, 1024, 1, 40]
    - [127, 2.929]
  - - [1024, 1024, 1, 800]
    - [166, 22.43]
  - - [1024, 1024, 1, 5120]
    - [73, 42.723]
  - - [1024, 4096, 1, 5120]
    - [92, 69.133]
  - - [1024, 30522, 1, 800]
    - [83, 52.219]
  - - [4096, 1024, 1, 5120]
    - [80, 68.896]
  - - [64, 128, 656, 128]
    - [170, 11.274]
  - - [1024, 2, 1, 41]
    - [121, 0.01]
  - - [1024, 2, 1, 5248]
    - [165, 0.424]
  - - [1024, 1024, 1, 41]
    - [127, 3.095]
  - - [1024, 1024, 1, 820]
    - [171, 20.955]
  - - [1024, 1024, 1, 5248]
    - [73, 43.532]
  - - [1024, 4096, 1, 5248]
    - [92, 69.899]
  - - [1024, 30522, 1, 820]
    - [172, 48.768]
  - - [4096, 1024, 1, 5248]
    - [80, 69.381]
  - - [64, 512, 80, 512]
    - [68, 23.834]
  - - [1024, 2, 1, 5]
    - [121, 0.001]
  - - [1024, 2, 1, 2560]
    - [16, 0.235]
  - - [1024, 1024, 1, 5]
    - [127, 0.399]
  - - [1024, 1024, 1, 385]
    - [40, 15.807]
  - - [1024, 1024, 1, 2560]
    - [73, 36.46]
  - - [1024, 4096, 1, 2560]
    - [92, 60.243]
  - - [1024, 30522, 1, 385]
    - [67, 34.259]
  - - [4096, 1024, 1, 2560]
    - [87, 59.706]
  - - [64, 512, 96, 512]
    - [57, 22.872]
  - - [1024, 2, 1, 6]
    - [121, 0.002]
  - - [1024, 2, 1, 3072]
    - [16, 0.271]
  - - [1024, 1024, 1, 6]
    - [173, 0.495]
  - - [1024, 1024, 1, 462]
    - [174, 16.249]
  - - [1024, 1024, 1, 3072]
    - [73, 38.797]
  - - [1024, 4096, 1, 3072]
    - [167, 62.348]
  - - [1024, 30522, 1, 462]
    - [63, 36.78]
  - - [4096, 1024, 1, 3072]
    - [80, 62.348]
  - - [64, 128, 128, 128]
    - [131, 7.85]
  - - [1024, 2, 1, 8]
    - [168, 0.002]
  - - [1024, 2, 1, 1024]
    - [10, 0.099]
  - - [1024, 1024, 1, 8]
    - [163, 0.671]
  - - [1024, 1024, 1, 160]
    - [40, 9.692]
  - - [1024, 4096, 1, 1024]
    - [98, 42.488]
  - - [1024, 30522, 1, 160]
    - [67, 20.93]
  - - [4096, 1024, 1, 1024]
    - [93, 43.034]
  - - [64, 128, 144, 128]
    - [175, 8.669]
  - - [1024, 2, 1, 9]
    - [121, 0.002]
  - - [1024, 2, 1, 1152]
    - [12, 0.105]
  - - [1024, 1024, 1, 9]
    - [127, 0.701]
  - - [1024, 1024, 1, 180]
    - [176, 8.921]
  - - [1024, 1024, 1, 1152]
    - [73, 26.229]
  - - [1024, 4096, 1, 1152]
    - [92, 44.948]
  - - [1024, 30522, 1, 180]
    - [67, 21.738]
  - - [4096, 1024, 1, 1152]
    - [93, 44.993]
  - - [13, 512, 1, 32768]
    - [177, 4.165]
  - - [256, 128, 1, 32768]
    - [178, 17.476]
  - - [256, 32768, 1, 1]
    - [131, 0.154]
  - - [479, 1024, 1, 32768]
    - [179, 58.007]
  - - [512, 256, 1, 32768]
    - [180, 41.608]
  - - [1024, 512, 1, 32768]
    - [181, 68.737]
  - - [1024, 1024, 1, 32768]
    - [182, 73.13]
  - - [64, 128, 512, 128]
    - [62, 10.922]
  - - [128, 64, 512, 128]
    - [40, 10.851]
  - - [1024, 2, 1, 32]
    - [121, 0.009]
  - - [1024, 1024, 1, 4096]
    - [97, 40.931]
  - - [1024, 4096, 1, 4096]
    - [92, 68.299]
  - - [1024, 30528, 1, 4096]
    - [83, 82.062]
  - - [4096, 1024, 1, 4096]
    - [80, 66.546]
  - - [512, 64, 64, 512]
    - [37, 19.361]
  - - [1024, 30528, 1, 2048]
    - [83, 72.447]
  - - [4, 64, 32768, 4]
    - [125, 0.203]
  - - [4, 64, 38400, 4]
    - [125, 0.204]
  - - [64, 4, 32768, 4]
    - [183, 0.293]
  - - [64, 4, 38400, 4]
    - [183, 0.299]
  - - [1024, 1024, 1, 8192]
    - [184, 50.878]
  - - [1024, 1024, 1, 9600]
    - [185, 53.343]
  - - [1024, 4096, 1, 8192]
    - [92, 72.438]
  - - [1024, 4096, 1, 9600]
    - [92, 74.558]
  - - [1024, 33712, 1, 8192]
    - [83, 85.797]
  - - [1024, 33712, 1, 9600]
    - [83, 86.58]
  - - [4096, 1024, 1, 8192]
    - [80, 73.296]
  - - [4096, 1024, 1, 9600]
    - [80, 74.279]
  - - [1024, 1024, 1, 10064]
    - [185, 53.095]
  - - [1024, 1024, 1, 10080]
    - [185, 54.349]
  - - [1024, 1024, 1, 10200]
    - [184, 53.099]
  - - [1024, 1024, 1, 3840]
    - [73, 40.693]
  - - [1024, 1024, 1, 3968]
    - [73, 40.687]
  - - [1024, 1024, 1, 6528]
    - [184, 46.758]
  - - [1024, 1024, 1, 7104]
    - [186, 48.444]
  - - [1024, 1024, 1, 7200]
    - [186, 48.929]
  - - [1024, 1024, 1, 8064]
    - [185, 50.693]
  - - [1024, 1024, 1, 8160]
    - [185, 51.002]
  - - [1024, 1024, 1, 9216]
    - [187, 52.948]
  - - [1024, 1024, 1, 9520]
    - [184, 52.102]
  - - [1024, 4096, 1, 10064]
    - [87, 72.217]
  - - [1024, 4096, 1, 10080]
    - [92, 75.335]
  - - [1024, 4096, 1, 10200]
    - [92, 74.238]
  - - [1024, 4096, 1, 3840]
    - [92, 66.99]
  - - [1024, 4096, 1, 3968]
    - [92, 66.503]
  - - [1024, 4096, 1, 6528]
    - [92, 69.914]
  - - [1024, 4096, 1, 7104]
    - [92, 71.886]
  - - [1024, 4096, 1, 7200]
    - [80, 70.99]
  - - [1024, 4096, 1, 8064]
    - [92, 72.233]
  - - [1024, 4096, 1, 8160]
    - [164, 72.334]
  - - [1024, 4096, 1, 9216]
    - [92, 74.28]
  - - [1024, 4096, 1, 9520]
    - [80, 71.709]
  - - [1024, 42720, 1, 10080]
    - [80, 89.827]
  - - [1024, 42720, 1, 3968]
    - [80, 82.463]
  - - [1024, 42720, 1, 6528]
    - [80, 86.982]
  - - [1024, 42720, 1, 7104]
    - [80, 87.641]
  - - [1024, 42720, 1, 7200]
    - [80, 87.571]
  - - [1024, 42720, 1, 9520]
    - [80, 88.275]
  - - [4096, 1024, 1, 10064]
    - [80, 73.865]
  - - [4096, 1024, 1, 10080]
    - [80, 74.667]
  - - [4096, 1024, 1, 10200]
    - [80, 73.678]
  - - [4096, 1024, 1, 3840]
    - [80, 65.053]
  - - [4096, 1024, 1, 3968]
    - [80, 65.607]
  - - [4096, 1024, 1, 6528]
    - [80, 71.098]
  - - [4096, 1024, 1, 7104]
    - [87, 71.923]
  - - [4096, 1024, 1, 7200]
    - [80, 72.15]
  - - [4096, 1024, 1, 8064]
    - [80, 73.033]
  - - [4096, 1024, 1, 8160]
    - [80, 73.193]
  - - [4096, 1024, 1, 9216]
    - [80, 74.098]
  - - [4096, 1024, 1, 9520]
    - [80, 73.241]
  - - [14, 64, 10880, 14]
    - [188, 1.731]
  - - [15, 64, 10880, 14]
    - [189, 1.105]
  - - [15, 64, 7680, 15]
    - [190, 1.156]
  - - [15, 64, 10880, 15]
    - [191, 1.182]
  - - [17, 64, 7680, 15]
    - [189, 1.221]
  - - [17, 64, 6144, 17]
    - [191, 1.306]
  - - [17, 64, 7680, 17]
    - [192, 1.344]
  - - [21, 64, 6144, 17]
    - [193, 1.505]
  - - [21, 64, 6144, 21]
    - [190, 1.838]
  - - [24, 64, 4736, 24]
    - [194, 2.841]
  - - [30, 64, 2048, 30]
    - [168, 3.025]
  - - [30, 64, 2048, 31]
    - [195, 2.453]
  - - [31, 64, 2048, 31]
    - [191, 2.411]
  - - [32, 64, 4608, 32]
    - [120, 4.066]
  - - [32, 64, 4608, 35]
    - [130, 4.194]
  - - [34, 64, 4736, 24]
    - [191, 2.486]
  - - [34, 64, 4736, 34]
    - [191, 3.243]
  - - [35, 64, 4608, 35]
    - [191, 3.318]
  - - [64, 14, 10880, 14]
    - [168, 1.809]
  - - [64, 15, 10880, 14]
    - [163, 1.832]
  - - [64, 15, 7680, 15]
    - [127, 1.694]
  - - [64, 15, 10880, 15]
    - [127, 1.752]
  - - [64, 17, 7680, 15]
    - [127, 1.761]
  - - [64, 17, 6144, 17]
    - [137, 1.902]
  - - [64, 17, 7680, 17]
    - [126, 1.946]
  - - [64, 21, 6144, 17]
    - [131, 2.024]
  - - [64, 21, 6144, 21]
    - [196, 2.455]
  - - [64, 24, 4736, 24]
    - [197, 2.827]
  - - [64, 30, 2048, 30]
    - [136, 3.228]
  - - [64, 30, 2048, 31]
    - [127, 3.316]
  - - [64, 31, 2048, 31]
    - [129, 3.378]
  - - [64, 32, 4608, 32]
    - [137, 3.992]
  - - [64, 32, 4608, 35]
    - [131, 4.132]
  - - [64, 34, 4736, 24]
    - [125, 2.854]
  - - [64, 34, 4736, 34]
    - [130, 3.718]
  - - [64, 35, 4608, 35]
    - [130, 3.838]
  - - [512, 64, 1, 512]
    - [3, 1.172]
  - - [64, 512, 1, 512]
    - [2, 1.13]
  - - [64, 128, 1, 128]
    - [3, 0.109]
  - - [128, 64, 1, 128]
    - [3, 0.107]
  - - [74, 2048, 1, 512]
    - [13, 4.567]
  - - [2048, 2048, 1, 512]
    - [60, 31.9]
  - - [1024, 64, 1, 512]
    - [3, 2.292]
  - - [5, 64, 1, 5]
    - [198, 0.0]
  - - [2048, 512, 1, 1]
    - [121, 0.077]
  - - [1600, 1024, 1, 512]
    - [199, 24.456]
  - - [512, 32, 1, 1600]
    - [9, 1.095]
  - - [33, 32, 1, 33]
    - [198, 0.003]
  - - [560, 1024, 1, 1600]
    - [8, 21.306]
  - - [1024, 1600, 1, 1]
    - [131, 0.099]
  - - [1024, 1024, 1, 1600]
    - [73, 30.846]
  - - [512, 512, 1, 1600]
    - [7, 11.41]
  - - [3, 64, 512, 3]
    - [200, 0.024]
  - - [5, 64, 512, 5]
    - [198, 0.07]
  - - [5, 64, 960, 5]
    - [198, 0.109]
  - - [9, 64, 512, 9]
    - [200, 0.196]
  - - [27, 128, 32768, 27]
    - [201, 2.8]
  - - [33, 32, 200, 33]
    - [202, 0.652]
  - - [33, 32, 1600, 33]
    - [203, 1.925]
  - - [67, 2048, 1, 512]
    - [13, 4.188]
  - - [74, 2048, 1, 960]
    - [204, 6.051]
  - - [100, 2048, 1, 512]
    - [0, 5.739]
  - - [256, 1280, 1, 8976]
    - [21, 33.527]
  - - [256, 2560, 1, 8976]
    - [205, 49.64]
  - - [256, 2816, 1, 8976]
    - [206, 48.483]
  - - [256, 3328, 1, 8976]
    - [207, 50.541]
  - - [256, 3584, 1, 8976]
    - [207, 53.971]
  - - [256, 3840, 1, 8976]
    - [207, 55.607]
  - - [256, 4096, 1, 8976]
    - [185, 51.57]
  - - [256, 4352, 1, 8976]
    - [184, 54.697]
  - - [256, 4864, 1, 8976]
    - [187, 60.53]
  - - [256, 5120, 1, 8976]
    - [185, 63.679]
  - - [256, 5632, 1, 8976]
    - [69, 58.992]
  - - [256, 5888, 1, 8976]
    - [72, 57.869]
  - - [256, 6144, 1, 8976]
    - [71, 60.274]
  - - [256, 7168, 1, 8976]
    - [71, 69.246]
  - - [256, 8192, 1, 8976]
    - [208, 60.35]
  - - [256, 8960, 1, 8976]
    - [209, 65.359]
  - - [256, 9728, 1, 8976]
    - [210, 65.991]
  - - [256, 9984, 1, 8976]
    - [210, 67.792]
  - - [256, 10240, 1, 8976]
    - [210, 68.813]
  - - [256, 10496, 1, 8976]
    - [90, 60.269]
  - - [256, 11008, 1, 8976]
    - [90, 62.723]
  - - [256, 11264, 1, 8976]
    - [83, 64.046]
  - - [256, 11520, 1, 8976]
    - [90, 65.502]
  - - [256, 11776, 1, 8976]
    - [90, 66.781]
  - - [256, 12544, 1, 8976]
    - [83, 70.67]
  - - [256, 12800, 1, 8976]
    - [90, 72.094]
  - - [256, 13312, 1, 8976]
    - [90, 74.606]
  - - [256, 13568, 1, 8976]
    - [77, 75.843]
  - - [256, 14336, 1, 8976]
    - [83, 79.887]
  - - [256, 14848, 1, 8976]
    - [83, 82.633]
  - - [256, 15104, 1, 8976]
    - [83, 83.625]
  - - [256, 15872, 1, 8976]
    - [211, 76.357]
  - - [256, 16128, 1, 8976]
    - [92, 77.536]
  - - [256, 17152, 1, 8976]
    - [98, 80.515]
  - - [256, 17408, 1, 8976]
    - [87, 75.58]
  - - [256, 18688, 1, 8976]
    - [80, 80.486]
  - - [256, 19968, 1, 8976]
    - [81, 66.728]
  - - [256, 20480, 1, 8976]
    - [94, 67.32]
  - - [256, 20992, 1, 8976]
    - [81, 69.513]
  - - [256, 21248, 1, 8976]
    - [81, 69.546]
  - - [256, 22016, 1, 8976]
    - [212, 72.413]
  - - [256, 26112, 1, 8976]
    - [172, 75.432]
  - - [256, 32512, 1, 8976]
    - [98, 78.697]
  - - [256, 33536, 1, 8976]
    - [98, 81.7]
  - - [256, 44505, 1, 8976]
    - [101, 83.184]
  - - [257, 4096, 1, 1024]
    - [213, 20.972]
  - - [480, 1024, 1, 32768]
    - [214, 66.723]
  - - [512, 32, 1, 200]
    - [4, 0.262]
  - - [512, 512, 1, 200]
    - [5, 3.803]
  - - [512, 2048, 1, 256]
    - [40, 13.506]
  - - [560, 1024, 1, 200]
    - [4, 6.969]
  - - [768, 2048, 1, 256]
    - [42, 16.747]
  - - [1024, 64, 1, 960]
    - [3, 3.099]
  - - [1024, 256, 1, 1024]
    - [30, 9.662]
  - - [1024, 256, 1, 2304]
    - [29, 13.62]
  - - [1024, 256, 1, 2816]
    - [215, 14.761]
  - - [1024, 256, 1, 3072]
    - [29, 16.747]
  - - [1024, 256, 1, 3584]
    - [216, 17.585]
  - - [1024, 256, 1, 4096]
    - [217, 19.55]
  - - [1024, 256, 1, 4352]
    - [107, 20.691]
  - - [1024, 256, 1, 4608]
    - [218, 21.491]
  - - [1024, 256, 1, 5120]
    - [107, 23.047]
  - - [1024, 256, 1, 5376]
    - [107, 23.426]
  - - [1024, 256, 1, 5632]
    - [218, 24.071]
  - - [1024, 256, 1, 6144]
    - [107, 25.854]
  - - [1024, 256, 1, 6400]
    - [218, 26.212]
  - - [1024, 256, 1, 7680]
    - [107, 29.717]
  - - [1024, 256, 1, 7936]
    - [217, 30.278]
  - - [1024, 256, 1, 8192]
    - [107, 30.966]
  - - [1024, 256, 1, 8448]
    - [107, 31.983]
  - - [1024, 256, 1, 9728]
    - [107, 34.338]
  - - [1024, 256, 1, 9984]
    - [107, 35.497]
  - - [1024, 256, 1, 10496]
    - [107, 35.225]
  - - [1024, 256, 1, 11520]
    - [107, 37.383]
  - - [1024, 256, 1, 12032]
    - [107, 38.484]
  - - [1024, 256, 1, 13568]
    - [107, 40.151]
  - - [1024, 256, 1, 14336]
    - [107, 41.523]
  - - [1024, 256, 1, 14848]
    - [107, 42.111]
  - - [1024, 256, 1, 15104]
    - [107, 42.347]
  - - [1024, 256, 1, 15872]
    - [107, 43.312]
  - - [1024, 256, 1, 16128]
    - [107, 42.96]
  - - [1024, 256, 1, 17152]
    - [107, 45.003]
  - - [1024, 256, 1, 17408]
    - [107, 44.765]
  - - [1024, 256, 1, 18944]
    - [107, 46.802]
  - - [1024, 256, 1, 19712]
    - [107, 47.55]
  - - [1024, 256, 1, 19968]
    - [107, 47.652]
  - - [1024, 256, 1, 21248]
    - [107, 49.037]
  - - [1024, 256, 1, 21504]
    - [217, 48.983]
  - - [1024, 256, 1, 22016]
    - [219, 49.779]
  - - [1024, 256, 1, 28672]
    - [220, 55.516]
  - - [1024, 256, 1, 33536]
    - [219, 58.934]
  - - [1024, 1024, 1, 960]
    - [166, 23.789]
  - - [1600, 1024, 1, 960]
    - [82, 32.138]
  - - [2048, 256, 1, 1024]
    - [32, 17.445]
  - - [2048, 960, 1, 1]
    - [129, 0.102]
  - - [2048, 2048, 1, 960]
    - [93, 41.776]
  - - [2048, 2048, 1, 1024]
    - [93, 42.714]
  - - [3200, 2048, 1, 1024]
    - [85, 46.521]
  - - [4096, 4096, 1, 1024]
    - [91, 49.408]
  - - [2048, 2, 1, 2]
    - [121, 0.001]
  - - [2048, 2048, 1, 2]
    - [163, 0.284]
  - - [2048, 30592, 1, 1024]
    - [90, 60.22]
  - - [2048, 6144, 1, 1024]
    - [98, 49.52]
  - - [2048, 8192, 1, 1024]
    - [90, 50.416]
  - - [8192, 2048, 1, 1024]
    - [221, 49.047]
  - - [1024, 1024, 1, 16]
    - [139, 1.389]
  - - [1024, 2, 1, 16]
    - [121, 0.005]
  - - [1024, 30592, 1, 8192]
    - [222, 88.274]
  - - [1024, 3072, 1, 8192]
    - [77, 69.902]
  - - [512, 64, 256, 512]
    - [7, 25.027]
  - - [64, 512, 256, 512]
    - [223, 26.443]
  - - [1024, 30592, 1, 2048]
    - [83, 71.263]
  - - [1024, 3072, 1, 2048]
    - [79, 53.831]
  - - [1024, 30592, 1, 4096]
    - [222, 81.47]
  - - [1024, 3072, 1, 4096]
    - [77, 63.731]
  - - [512, 64, 128, 512]
    - [40, 23.26]
  - - [64, 512, 128, 512]
    - [62, 23.588]
  - - [2560, 1920, 1, 2048]
    - [80, 64.834]
  - - [2560, 2, 1, 4]
    - [224, 0.003]
  - - [2560, 2560, 1, 2048]
    - [83, 60.012]
  - - [2560, 2560, 1, 4]
    - [163, 0.624]
  - - [2560, 7680, 1, 2048]
    - [83, 73.396]
  - - [640, 2560, 1, 2048]
    - [84, 46.938]
  - - [512, 64, 40, 512]
    - [37, 21.004]
  - - [64, 512, 40, 512]
    - [40, 20.727]
  - - [1536, 1536, 1, 4096]
    - [105, 57.787]
  - - [1536, 4608, 1, 4096]
    - [225, 73.645]
  - - [1536, 50304, 1, 4096]
    - [90, 83.867]
  - - [1536, 6144, 1, 4096]
    - [87, 75.41]
  - - [6144, 1536, 1, 4096]
    - [91, 76.43]
  - - [1024, 96, 64, 1024]
    - [49, 38.549]
  - - [96, 1024, 64, 1024]
    - [226, 37.99]
  - - [1536, 1536, 1, 8192]
    - [209, 66.767]
  - - [1536, 4608, 1, 8192]
    - [90, 79.89]
  - - [1536, 50304, 1, 8192]
    - [90, 88.946]
  - - [1536, 6144, 1, 8192]
    - [227, 82.402]
  - - [6144, 1536, 1, 8192]
    - [91, 83.486]
  - - [1024, 96, 128, 1024]
    - [228, 43.08]
  - - [96, 1024, 128, 1024]
    - [100, 42.623]
  - - [1024, 1024, 1, 16384]
    - [182, 61.553]
  - - [1024, 3072, 1, 16384]
    - [77, 73.357]
  - - [1024, 4096, 1, 16384]
    - [80, 75.757]
  - - [1024, 50304, 1, 16384]
    - [157, 87.466]
  - - [4096, 1024, 1, 16384]
    - [80, 77.231]
  - - [1024, 64, 256, 1024]
    - [28, 32.705]
  - - [64, 1024, 256, 1024]
    - [223, 34.553]
  - - [1024, 50304, 1, 2048]
    - [83, 70.781]
  - - [1024, 64, 32, 1024]
    - [8, 25.898]
  - - [64, 1024, 32, 1024]
    - [223, 28.628]
  - - [1024, 50304, 1, 4096]
    - [79, 78.993]
  - - [1024, 64, 64, 1024]
    - [40, 29.641]
  - - [64, 1024, 64, 1024]
    - [57, 30.221]
  - - [1024, 50304, 1, 8192]
    - [80, 84.257]
  - - [1024, 64, 128, 1024]
    - [7, 31.812]
  - - [64, 1024, 128, 1024]
    - [223, 33.962]
  - - [1024, 2, 1, 64]
    - [121, 0.016]
  - - [1024, 30528, 1, 8192]
    - [222, 88.037]
  - - [1024, 1024, 1, 64]
    - [127, 4.868]
  - - [64, 128, 1024, 128]
    - [175, 11.766]
  - - [128, 64, 1024, 128]
    - [127, 11.63]
  - - [1024, 1024, 1, 3456]
    - [73, 39.389]
  - - [1024, 1024, 1, 6912]
    - [186, 47.631]
  - - [1024, 1024, 1, 864]
    - [171, 23.292]
  - - [1024, 512, 1, 3456]
    - [103, 27.044]
  - - [1024, 512, 1, 4096]
    - [205, 30.404]
  - - [1024, 512, 1, 6912]
    - [103, 39.206]
  - - [1024, 512, 1, 864]
    - [171, 14.178]
  - - [256, 128, 1, 3456]
    - [16, 3.533]
  - - [256, 128, 1, 4096]
    - [229, 4.423]
  - - [256, 128, 1, 55296]
    - [178, 21.965]
  - - [256, 128, 1, 6912]
    - [230, 6.562]
  - - [256, 128, 1, 864]
    - [2, 1.331]
  - - [256, 3456, 1, 1]
    - [128, 0.077]
  - - [256, 4096, 1, 1]
    - [127, 0.084]
  - - [256, 6912, 1, 1]
    - [131, 0.103]
  - - [256, 864, 1, 1]
    - [125, 0.025]
  - - [480, 1024, 1, 3456]
    - [231, 27.503]
  - - [480, 1024, 1, 4096]
    - [231, 30.536]
  - - [480, 1024, 1, 6912]
    - [231, 39.252]
  - - [480, 1024, 1, 864]
    - [6, 13.896]
  - - [512, 256, 1, 3456]
    - [18, 11.457]
  - - [512, 256, 1, 4096]
    - [18, 12.72]
  - - [512, 256, 1, 55296]
    - [180, 48.483]
  - - [512, 256, 1, 6912]
    - [18, 17.774]
  - - [512, 256, 1, 864]
    - [3, 5.221]
  - - [30528, 1024, 1, 640]
    - [101, 46.878]
  - - [30528, 1024, 1, 1280]
    - [77, 62.776]
  - - [4096, 1024, 1, 10240]
    - [80, 74.765]
  - - [1024, 4096, 1, 10240]
    - [211, 73.159]
  - - [30528, 1024, 1, 1600]
    - [77, 67.05]
  - - [1024, 2, 1, 80]
    - [121, 0.019]
  - - [1024, 1024, 1, 10240]
    - [184, 54.581]
  - - [1024, 1024, 1, 80]
    - [127, 5.568]
  - - [64, 128, 1280, 128]
    - [175, 11.974]
  - - [128, 64, 1280, 128]
    - [232, 11.827]
  - - [1024, 4096, 1, 10496]
    - [80, 73.635]
  - - [30528, 1024, 1, 1640]
    - [233, 64.322]
  - - [4096, 1024, 1, 10496]
    - [80, 74.934]
  - - [1024, 1024, 1, 10496]
    - [185, 54.99]
  - - [1024, 1024, 1, 82]
    - [127, 5.225]
  - - [1024, 2, 1, 82]
    - [121, 0.017]
  - - [128, 64, 1312, 128]
    - [175, 11.747]
  - - [64, 128, 1312, 128]
    - [232, 11.932]
  - - [30528, 1024, 1, 160]
    - [66, 20.219]
  - - [1024, 4096, 1, 6144]
    - [92, 70.619]
  - - [30528, 1024, 1, 240]
    - [66, 27.245]
  - - [4096, 1024, 1, 6144]
    - [80, 70.598]
  - - [1024, 1024, 1, 12]
    - [163, 0.927]
  - - [1024, 2, 1, 12]
    - [121, 0.003]
  - - [1024, 1024, 1, 6144]
    - [184, 45.883]
  - - [64, 512, 192, 512]
    - [38, 24.831]
  - - [512, 64, 192, 512]
    - [40, 23.868]
  - - [3136, 64, 64, 128]
    - [131, 14.09]
  - - [3136, 64, 64, 256]
    - [40, 20.934]
  - - [3136, 128, 64, 256]
    - [57, 25.925]
  - - [784, 256, 64, 512]
    - [94, 39.227]
  - - [3136, 256, 64, 128]
    - [223, 17.727]
  - - [3136, 256, 64, 256]
    - [64, 28.6]
  - - [784, 512, 64, 256]
    - [94, 29.35]
  - - [784, 512, 64, 512]
    - [81, 42.257]
  - - [3136, 64, 32, 128]
    - [127, 13.04]
  - - [3136, 64, 32, 256]
    - [40, 19.626]
  - - [3136, 128, 32, 256]
    - [45, 24.777]
  - - [784, 256, 32, 512]
    - [81, 35.535]
  - - [3136, 256, 32, 128]
    - [161, 17.049]
  - - [3136, 256, 32, 256]
    - [41, 27.354]
  - - [784, 512, 32, 256]
    - [81, 27.161]
  - - [784, 512, 32, 512]
    - [94, 39.453]
  - - [3136, 256, 32, 64]
    - [131, 10.024]
  - - [3136, 64, 32, 64]
    - [137, 7.997]
  - - [784, 512, 32, 128]
    - [234, 16.439]
  - - [784, 128, 32, 512]
    - [81, 31.022]
  - - [3136, 64, 64, 64]
    - [131, 8.742]
  - - [3136, 256, 64, 64]
    - [137, 10.299]
  - - [784, 128, 64, 512]
    - [81, 34.004]
  - - [784, 512, 64, 128]
    - [235, 17.84]
  - - [64, 1280, 64, 192]
    - [43, 16.733]
  - - [64, 1280, 64, 320]
    - [236, 22.302]
  - - [64, 1280, 64, 384]
    - [68, 24.186]
  - - [64, 1280, 64, 448]
    - [148, 26.293]
  - - [64, 2048, 64, 192]
    - [40, 17.031]
  - - [64, 2048, 64, 320]
    - [43, 22.31]
  - - [64, 2048, 64, 384]
    - [237, 24.213]
  - - [64, 2048, 64, 448]
    - [43, 25.879]
  - - [64, 1280, 32, 192]
    - [148, 15.913]
  - - [64, 1280, 32, 320]
    - [148, 21.567]
  - - [64, 1280, 32, 384]
    - [148, 23.318]
  - - [64, 1280, 32, 448]
    - [170, 25.324]
  - - [64, 2048, 32, 192]
    - [40, 16.138]
  - - [64, 2048, 32, 320]
    - [40, 20.899]
  - - [64, 2048, 32, 384]
    - [37, 22.463]
  - - [64, 2048, 32, 448]
    - [37, 23.925]
  - - [1024, 1024, 1, 10224]
    - [238, 53.281]
  - - [1024, 1024, 1, 10192]
    - [184, 53.397]
  - - [1024, 1024, 1, 10208]
    - [185, 54.41]
  - - [1024, 4096, 1, 10224]
    - [92, 73.325]
  - - [4096, 1024, 1, 10224]
    - [80, 73.797]
  - - [1024, 3072, 1, 10224]
    - [225, 70.061]
  - - [1024, 3072, 1, 10240]
    - [77, 71.502]
  - - [4096, 1024, 1, 10192]
    - [80, 73.838]
  - - [1024, 3072, 1, 10192]
    - [158, 69.923]
  - - [1024, 4096, 1, 10192]
    - [164, 72.923]
  - - [1024, 3072, 1, 10200]
    - [77, 69.783]
  - - [1024, 1024, 1, 10184]
    - [239, 53.327]
  - - [4096, 1024, 1, 10208]
    - [80, 74.978]
  - - [1024, 3072, 1, 10208]
    - [158, 71.279]
  - - [1024, 4096, 1, 10208]
    - [92, 73.144]
  - - [1024, 2048, 1, 10224]
    - [209, 62.045]
  - - [1024, 2048, 1, 10240]
    - [209, 62.627]
  - - [1024, 1024, 1, 10120]
    - [240, 53.738]
  - - [1024, 2048, 1, 10192]
    - [209, 61.813]
  - - [64, 24, 6816, 24]
    - [139, 2.95]
  - - [1024, 1024, 1, 10152]
    - [184, 53.704]
  - - [1024, 3072, 1, 10080]
    - [158, 70.771]
  - - [64, 26, 6272, 26]
    - [128, 3.178]
  - - [100352, 256, 1, 512]
    - [79, 39.554]
  - - [12544, 1024, 1, 2048]
    - [80, 62.012]
  - - [12544, 147, 1, 64]
    - [127, 5.97]
  - - [200704, 256, 1, 512]
    - [85, 39.302]
  - - [25088, 512, 1, 1024]
    - [81, 49.775]
  - - [3136, 576, 1, 64]
    - [130, 6.147]
  - - [50176, 512, 1, 1024]
    - [241, 55.236]
  - - [6272, 1024, 1, 2048]
    - [101, 58.449]
  - - [784, 1152, 1, 128]
    - [37, 7.673]
  - - [3136, 256, 128, 128]
    - [161, 18.099]
  - - [3136, 256, 256, 128]
    - [242, 18.316]
  - - [3136, 256, 128, 64]
    - [136, 10.398]
  - - [3136, 256, 256, 64]
    - [138, 10.448]
  - - [3136, 64, 128, 256]
    - [40, 21.497]
  - - [3136, 64, 256, 256]
    - [40, 21.802]
  - - [3136, 64, 128, 64]
    - [136, 9.046]
  - - [3136, 64, 256, 64]
    - [136, 9.219]
  - - [784, 128, 128, 512]
    - [81, 36.744]
  - - [784, 128, 256, 512]
    - [94, 38.192]
  - - [784, 512, 128, 128]
    - [64, 18.85]
  - - [784, 512, 256, 128]
    - [64, 19.348]
  - - [784, 512, 128, 256]
    - [94, 30.597]
  - - [784, 512, 256, 256]
    - [90, 31.729]
  - - [64, 128, 2048, 128]
    - [175, 12.406]
  - - [128, 64, 2048, 128]
    - [232, 12.322]
  - - [30528, 1024, 1, 2560]
    - [77, 74.855]
  - - [1024, 1024, 1, 128]
    - [40, 8.156]
  - - [1024, 2, 1, 128]
    - [122, 0.027]
  - - [128, 64, 1536, 128]
    - [176, 12.01]
  - - [64, 128, 1536, 128]
    - [15, 12.155]
  - - [1024, 4096, 1, 12288]
    - [80, 74.353]
  - - [30528, 1024, 1, 1920]
    - [77, 70.787]
  - - [1024, 1024, 1, 96]
    - [127, 6.28]
  - - [1024, 1024, 1, 12288]
    - [186, 56.932]
  - - [4096, 1024, 1, 12288]
    - [80, 75.73]
  - - [1024, 2, 1, 96]
    - [121, 0.022]
  - - [25600, 128, 25, 128]
    - [45, 16.016]
  - - [12544, 128, 36, 128]
    - [148, 16.265]
  - - [9216, 128, 49, 128]
    - [38, 16.6]
  - - [6400, 128, 64, 128]
    - [45, 16.712]
  - - [6400, 256, 25, 256]
    - [66, 28.41]
  - - [4096, 256, 36, 256]
    - [85, 28.368]
  - - [2304, 256, 49, 256]
    - [63, 27.942]
  - - [2304, 256, 64, 256]
    - [66, 28.377]
  - - [2304, 512, 25, 512]
    - [90, 42.081]
  - - [1024, 512, 36, 512]
    - [99, 39.286]
  - - [1024, 512, 49, 512]
    - [77, 39.978]
  - - [1024, 512, 64, 512]
    - [83, 41.426]
  - - [92416, 64, 25, 64]
    - [243, 8.77]
  - - [50176, 64, 36, 64]
    - [244, 8.744]
  - - [36864, 64, 49, 64]
    - [129, 8.726]
  - - [25600, 64, 64, 64]
    - [129, 8.818]
  - - [64, 128, 192, 128]
    - [68, 9.146]
  - - [128, 64, 192, 128]
    - [127, 9.281]
  - - [768, 2, 1, 2048]
    - [117, 0.148]
  - - [3072, 768, 1, 2048]
    - [76, 49.257]
  - - [768, 3072, 1, 2048]
    - [76, 49.257]
  - - [768, 768, 1, 2048]
    - [7, 25.29]
  - - [64, 384, 144, 384]
    - [38, 22.233]
  - - [384, 64, 144, 384]
    - [62, 20.512]
  - - [768, 2, 1, 4608]
    - [245, 0.317]
  - - [3072, 768, 1, 4608]
    - [105, 59.567]
  - - [768, 3072, 1, 4608]
    - [246, 59.014]
  - - [768, 768, 1, 4608]
    - [25, 35.875]
  - - [64, 512, 48, 512]
    - [42, 22.632]
  - - [512, 64, 48, 512]
    - [49, 18.983]
  - - [64, 128, 256, 128]
    - [62, 9.516]
  - - [128, 64, 256, 128]
    - [127, 9.625]
  - - [64, 384, 192, 384]
    - [235, 22.73]
  - - [384, 64, 192, 384]
    - [7, 21.196]
  - - [1024, 2, 1, 4608]
    - [165, 0.389]
  - - [4096, 1024, 1, 4608]
    - [80, 67.54]
  - - [1024, 4096, 1, 4608]
    - [92, 68.099]
  - - [1024, 1024, 1, 4608]
    - [73, 42.024]
  - - [13, 512, 1, 3456]
    - [119, 0.879]
  - - [13, 512, 1, 4096]
    - [247, 1.119]
  - - [13, 512, 1, 55296]
    - [177, 4.942]
  - - [13, 512, 1, 6912]
    - [248, 1.715]
  - - [13, 512, 1, 864]
    - [204, 0.251]
  - - [196, 512, 64, 1024]
    - [94, 37.968]
  - - [196, 1024, 64, 512]
    - [49, 32.274]
  - - [196, 1024, 64, 1024]
    - [81, 42.593]
  - - [49, 1024, 64, 2048]
    - [174, 24.867]
  - - [49, 2048, 64, 1024]
    - [242, 23.754]
  - - [196, 512, 32, 1024]
    - [94, 31.21]
  - - [196, 1024, 32, 512]
    - [49, 30.499]
  - - [196, 1024, 32, 1024]
    - [81, 38.782]
  - - [49, 1024, 32, 2048]
    - [242, 23.473]
  - - [49, 2048, 32, 1024]
    - [174, 20.863]
  - - [196, 1024, 32, 256]
    - [41, 21.918]
  - - [196, 256, 32, 1024]
    - [41, 28.181]
  - - [49, 2048, 32, 512]
    - [174, 15.448]
  - - [49, 512, 32, 2048]
    - [174, 19.233]
  - - [196, 256, 64, 1024]
    - [41, 30.111]
  - - [196, 1024, 64, 256]
    - [67, 23.708]
  - - [49, 512, 64, 2048]
    - [249, 22.948]
  - - [49, 2048, 64, 512]
    - [242, 18.188]
  - - [1225, 192, 64, 32]
    - [213, 4.884]
  - - [1225, 192, 64, 48]
    - [250, 6.823]
  - - [1225, 192, 64, 64]
    - [213, 8.83]
  - - [1225, 256, 64, 48]
    - [250, 7.016]
  - - [1225, 256, 64, 64]
    - [213, 9.19]
  - - [1225, 288, 64, 48]
    - [250, 7.168]
  - - [1225, 288, 64, 64]
    - [250, 8.986]
  - - [5329, 64, 64, 80]
    - [251, 9.803]
  - - [289, 768, 64, 128]
    - [242, 14.518]
  - - [289, 768, 64, 160]
    - [242, 16.854]
  - - [289, 768, 64, 192]
    - [95, 18.795]
  - - [1225, 192, 32, 32]
    - [252, 4.377]
  - - [1225, 192, 32, 48]
    - [253, 6.215]
  - - [1225, 192, 32, 64]
    - [252, 7.978]
  - - [1225, 256, 32, 48]
    - [253, 6.495]
  - - [1225, 256, 32, 64]
    - [254, 8.383]
  - - [1225, 288, 32, 48]
    - [250, 6.699]
  - - [1225, 288, 32, 64]
    - [250, 8.473]
  - - [5329, 64, 32, 80]
    - [250, 9.264]
  - - [289, 768, 32, 128]
    - [252, 12.623]
  - - [289, 768, 32, 160]
    - [255, 15.085]
  - - [289, 768, 32, 192]
    - [95, 16.903]
  - - [196, 2304, 1, 256]
    - [171, 6.72]
  - - [49, 4608, 1, 512]
    - [204, 5.944]
  - - [196, 1024, 128, 256]
    - [67, 25.752]
  - - [196, 1024, 256, 256]
    - [67, 26.935]
  - - [196, 1024, 128, 512]
    - [256, 34.326]
  - - [196, 1024, 256, 512]
    - [221, 36.926]
  - - [196, 256, 128, 1024]
    - [94, 36.098]
  - - [196, 256, 256, 1024]
    - [81, 40.096]
  - - [49, 2048, 128, 512]
    - [50, 19.09]
  - - [49, 2048, 256, 512]
    - [50, 19.733]
  - - [49, 512, 128, 2048]
    - [249, 23.957]
  - - [49, 512, 256, 2048]
    - [242, 27.575]
- null
