library/src/blas3/Tensile/Logic/asm_full/arcturus_Cijk_Ailk_Bjlk_SB.yaml
- {MinimumRequiredVersion: 4.6.0}
- arcturus
- gfx908
- [Device 7380, Device 7388, Device 738c, Device 7390]
    SolutionIndex: 0
    SolutionNameMin: Cijk_Ailk_Bjlk_SB_MT032x008x08_GRVW02_GSU01_SNLL0_TT02_02_VW02_WG16_04_01
    SolutionIndex: 1
    SolutionNameMin: Cijk_Ailk_Bjlk_SB_MT016x016x08_GRVW02_GSU01_SNLL0_TT02_02_VW02_WG08_08_01
    SolutionIndex: 2
    SolutionNameMin: Cijk_Ailk_Bjlk_SB_MT032x016x08_GRVW02_GSU01_SNLL0_TT04_02_VW02_WG08_08_01
    SolutionIndex: 3
    SolutionNameMin: Cijk_Ailk_Bjlk_SB_MT032x032x08_GRVW04_GSU01_SNLL0_TT04_04_VW04_WG08_08_01
    SolutionIndex: 4
    SolutionNameMin: Cijk_Ailk_Bjlk_SB_MT032x016x08_GRVW02_GSU01_SNLL0_TT02_02_VW02_WG16_08_01
    SolutionIndex: 5
    SolutionNameMin: Cijk_Ailk_Bjlk_SB_MT064x016x08_GRVW02_GSU01_SNLL0_TT04_02_VW02_WG16_08_01
    SolutionIndex: 6
    SolutionNameMin: Cijk_Ailk_Bjlk_SB_MT016x016x08_GRVW02_GSU01_SNLL0_TT02_02_VW02_WG08_08_01
    SolutionIndex: 7
    SolutionNameMin: Cijk_Ailk_Bjlk_SB_MT032x016x08_GRVW02_GSU01_SNLL0_TT04_02_VW02_WG08_08_01
    SolutionIndex: 8
    SolutionNameMin: Cijk_Ailk_Bjlk_SB_MT032x032x08_GRVW04_GSU01_SNLL0_TT04_04_VW04_WG08_08_01
    SolutionIndex: 9
    SolutionNameMin: Cijk_Ailk_Bjlk_SB_MT032x016x08_GRVW02_GSU01_SNLL0_TT02_02_VW02_WG16_08_01
    SolutionIndex: 10
    SolutionNameMin: Cijk_Ailk_Bjlk_SB_MT064x016x08_GRVW02_GSU01_SNLL0_TT04_02_VW02_WG16_08_01
    SolutionIndex: 11
    SolutionNameMin: Cijk_Ailk_Bjlk_SB_MT064x008x16_GRVW02_GSU01_SNLL0_TT02_02_VW02_WG32_04_01
    SolutionIndex: 12
    SolutionNameMin: Cijk_Ailk_Bjlk_SB_MT016x016x16_GRVW02_GSU01_SNLL0_TT02_02_VW02_WG08_08_01
    SolutionIndex: 13
    SolutionNameMin: Cijk_Ailk_Bjlk_SB_MT032x016x16_GRVW02_GSU01_SNLL0_TT04_02_VW02_WG08_08_01
    SolutionIndex: 14
    SolutionNameMin: Cijk_Ailk_Bjlk_SB_MT032x032x16_GRVW04_GSU01_SNLL0_TT04_04_VW04_WG08_08_01
    SolutionIndex: 15
    SolutionNameMin: Cijk_Ailk_Bjlk_SB_MT064x016x16_GRVW02_GSU01_SNLL0_TT04_02_VW02_WG16_08_01
    SolutionIndex: 16
    SolutionNameMin: Cijk_Ailk_Bjlk_SB_MT064x032x16_GRVW04_GSU01_SNLL0_TT04_04_VW04_WG16_08_01
    SolutionIndex: 17
    SolutionNameMin: Cijk_Ailk_Bjlk_SB_MT064x008x16_GRVW02_GSU01_SNLL0_TT02_02_VW02_WG32_04_01
    SolutionIndex: 18
    SolutionNameMin: Cijk_Ailk_Bjlk_SB_MT032x008x16_GRVW02_GSU01_SNLL0_TT02_02_VW02_WG16_04_01
    SolutionIndex: 19
    SolutionNameMin: Cijk_Ailk_Bjlk_SB_MT016x016x16_GRVW02_GSU01_SNLL0_TT02_02_VW02_WG08_08_01
    SolutionIndex: 20
    SolutionNameMin: Cijk_Ailk_Bjlk_SB_MT016x016x24_GRVW02_GSU01_SNLL0_TT02_02_VW02_WG08_08_01
    SolutionIndex: 21
    SolutionNameMin: Cijk_Ailk_Bjlk_SB_MT016x016x08_GRVW02_GSU02_SNLL0_TT02_02_VW02_WG08_08_02
    SolutionIndex: 22
    SolutionNameMin: Cijk_Ailk_Bjlk_SB_MT032x016x08_GRVW02_GSU02_SNLL0_TT04_02_VW02_WG08_08_02
    SolutionIndex: 23
    SolutionNameMin: Cijk_Ailk_Bjlk_SB_MT016x016x08_GRVW02_GSU04_SNLL0_TT02_02_VW02_WG08_08_02
    SolutionIndex: 24
    SolutionNameMin: Cijk_Ailk_Bjlk_SB_MT016x016x08_GRVW02_GSU08_SNLL0_TT02_02_VW02_WG08_08_02
    SolutionIndex: 25
    SolutionNameMin: Cijk_Ailk_Bjlk_SB_MT016x016x16_GRVW02_GSU02_SNLL0_TT02_02_VW02_WG08_08_02
    SolutionIndex: 26
    SolutionNameMin: Cijk_Ailk_Bjlk_SB_MT032x016x16_GRVW02_GSU02_SNLL0_TT04_02_VW02_WG08_08_02
    SolutionIndex: 27
    SolutionNameMin: Cijk_Ailk_Bjlk_SB_MT032x032x16_GRVW04_GSU02_SNLL0_TT04_04_VW04_WG08_08_02
    SolutionIndex: 28
    SolutionNameMin: Cijk_Ailk_Bjlk_SB_MT064x032x16_GRVW04_GSU02_SNLL0_TT08_04_VW04_WG08_08_02
    SolutionIndex: 29
    SolutionNameMin: Cijk_Ailk_Bjlk_SB_MT016x016x16_GRVW02_GSU02_SNLL0_TT02_02_VW02_WG08_08_04
    SolutionIndex: 30
    SolutionNameMin: Cijk_Ailk_Bjlk_SB_MT032x016x16_GRVW02_GSU02_SNLL0_TT04_02_VW02_WG08_08_04
    SolutionIndex: 31
    SolutionNameMin: Cijk_Ailk_Bjlk_SB_MT032x016x16_GRVW02_GSU02_SNLL0_TT02_02_VW02_WG16_08_02
    SolutionIndex: 32
    SolutionNameMin: Cijk_Ailk_Bjlk_SB_MT064x016x16_GRVW02_GSU02_SNLL0_TT04_02_VW02_WG16_08_02
    SolutionIndex: 33
    SolutionNameMin: Cijk_Ailk_Bjlk_SB_MT064x016x16_GRVW04_GSU02_SNLL0_TT04_04_VW04_WG16_04_04
    SolutionIndex: 34
    SolutionNameMin: Cijk_Ailk_Bjlk_SB_MT016x016x16_GRVW02_GSU02_SNLL0_TT02_02_VW02_WG08_08_02
    SolutionIndex: 35
    SolutionNameMin: Cijk_Ailk_Bjlk_SB_MT032x016x16_GRVW02_GSU02_SNLL0_TT04_02_VW02_WG08_08_02
    SolutionIndex: 36
    SolutionNameMin: Cijk_Ailk_Bjlk_SB_MT032x032x16_GRVW04_GSU02_SNLL0_TT04_04_VW04_WG08_08_02
    SolutionIndex: 37
    SolutionNameMin: Cijk_Ailk_Bjlk_SB_MT016x016x16_GRVW02_GSU02_SNLL0_TT02_02_VW02_WG08_08_04
    SolutionIndex: 38
    SolutionNameMin: Cijk_Ailk_Bjlk_SB_MT032x016x16_GRVW02_GSU02_SNLL0_TT04_02_VW02_WG08_08_04
    SolutionIndex: 39
    SolutionNameMin: Cijk_Ailk_Bjlk_SB_MT032x016x16_GRVW02_GSU02_SNLL0_TT02_02_VW02_WG16_08_02
    SolutionIndex: 40
    SolutionNameMin: Cijk_Ailk_Bjlk_SB_MT016x016x16_GRVW02_GSU04_SNLL0_TT02_02_VW02_WG08_08_04
    SolutionIndex: 41
    SolutionNameMin: Cijk_Ailk_Bjlk_SB_MT032x032x16_GRVW04_GSU04_SNLL0_TT04_04_VW04_WG08_08_02
    SolutionIndex: 42
    SolutionNameMin: Cijk_Ailk_Bjlk_SB_MT016x016x16_GRVW02_GSU04_SNLL0_TT02_02_VW02_WG08_08_04
    SolutionIndex: 43
    SolutionNameMin: Cijk_Ailk_Bjlk_SB_MT016x016x16_GRVW02_GSU08_SNLL0_TT02_02_VW02_WG08_08_04
    SolutionIndex: 44
    SolutionNameMin: Cijk_Ailk_Bjlk_SB_MT032x008x32_GRVW02_GSU02_SNLL0_TT02_02_VW02_WG16_04_04
    SolutionIndex: 45
    SolutionNameMin: Cijk_Ailk_Bjlk_SB_MT032x016x32_GRVW02_GSU02_SNLL0_TT04_02_VW02_WG08_08_02
    SolutionIndex: 46
    SolutionNameMin: Cijk_Ailk_Bjlk_SB_MT016x016x32_GRVW02_GSU02_SNLL0_TT02_02_VW02_WG08_08_04
    SolutionIndex: 47
    SolutionNameMin: Cijk_Ailk_Bjlk_SB_MT032x016x32_GRVW02_GSU02_SNLL0_TT04_02_VW02_WG08_08_04
    SolutionIndex: 48
    SolutionNameMin: Cijk_Ailk_Bjlk_SB_MT032x032x32_GRVW04_GSU02_SNLL0_TT04_04_VW04_WG08_08_04
    SolutionIndex: 49
    SolutionNameMin: Cijk_Ailk_Bjlk_SB_MT064x032x32_GRVW04_GSU02_SNLL0_TT08_04_VW04_WG08_08_04
    SolutionIndex: 50
    SolutionNameMin: Cijk_Ailk_Bjlk_SB_MT064x032x32_GRVW04_GSU02_SNLL0_TT04_04_VW04_WG16_08_02
    SolutionIndex: 51
    SolutionNameMin: Cijk_Ailk_Bjlk_SB_MT128x032x32_GRVW04_GSU02_SNLL0_TT08_08_VW04_WG16_04_04
    SolutionIndex: 52
    SolutionNameMin: Cijk_Ailk_Bjlk_SB_MT032x016x32_GRVW02_GSU02_SNLL0_TT04_02_VW02_WG08_08_02
    SolutionIndex: 53
    SolutionNameMin: Cijk_Ailk_Bjlk_SB_MT032x032x32_GRVW04_GSU02_SNLL0_TT04_04_VW04_WG08_08_02
    SolutionIndex: 54
    SolutionNameMin: Cijk_Ailk_Bjlk_SB_MT016x016x32_GRVW02_GSU02_SNLL0_TT02_02_VW02_WG08_08_04
    SolutionIndex: 55
    SolutionNameMin: Cijk_Ailk_Bjlk_SB_MT032x016x32_GRVW02_GSU02_SNLL0_TT04_02_VW02_WG08_08_04
    SolutionIndex: 56
    SolutionNameMin: Cijk_Ailk_Bjlk_SB_MT032x032x32_GRVW04_GSU02_SNLL0_TT04_04_VW04_WG08_08_04
    SolutionIndex: 57
    SolutionNameMin: Cijk_Ailk_Bjlk_SB_MT064x032x32_GRVW04_GSU02_SNLL0_TT08_04_VW04_WG08_08_04
    SolutionIndex: 58
    SolutionNameMin: Cijk_Ailk_Bjlk_SB_MT064x008x32_GRVW02_GSU04_SNLL0_TT04_02_VW02_WG16_04_04
    SolutionIndex: 59
    SolutionNameMin: Cijk_Ailk_Bjlk_SB_MT016x016x32_GRVW02_GSU04_SNLL0_TT02_02_VW02_WG08_08_04
    SolutionIndex: 60
    SolutionNameMin: Cijk_Ailk_Bjlk_SB_MT032x016x32_GRVW02_GSU04_SNLL0_TT04_02_VW02_WG08_08_04
    SolutionIndex: 61
    SolutionNameMin: Cijk_Ailk_Bjlk_SB_MT032x032x32_GRVW04_GSU04_SNLL0_TT04_04_VW04_WG08_08_04
    SolutionIndex: 62
    SolutionNameMin: Cijk_Ailk_Bjlk_SB_MT032x032x32_GRVW04_GSU04_SNLL0_TT04_04_VW04_WG08_08_04
    SolutionIndex: 63
    SolutionNameMin: Cijk_Ailk_Bjlk_SB_MT032x008x32_GRVW02_GSU08_SNLL0_TT02_02_VW02_WG16_04_04
    SolutionIndex: 64
    SolutionNameMin: Cijk_Ailk_Bjlk_SB_MT016x016x32_GRVW02_GSU08_SNLL0_TT02_02_VW02_WG08_08_04
    SolutionIndex: 65
    SolutionNameMin: Cijk_Ailk_Bjlk_SB_MT128x128x08_GRVW04_GSU01_SNLL0_TT08_08_VW04_WG16_16_01
    SolutionIndex: 66
    SolutionNameMin: Cijk_Ailk_Bjlk_SB_MT064x064x16_GRVW04_GSU01_SNLL0_TT04_04_VW04_WG16_16_01
    SolutionIndex: 67
    SolutionNameMin: Cijk_Ailk_Bjlk_SB_MT064x128x16_GRVW04_GSU01_SNLL0_TT04_08_VW04_WG16_16_01
    SolutionIndex: 68
    SolutionNameMin: Cijk_Ailk_Bjlk_SB_MT128x064x16_GRVW04_GSU01_SNLL0_TT08_04_VW04_WG16_16_01
    SolutionIndex: 69
    SolutionNameMin: Cijk_Ailk_Bjlk_SB_MT064x064x16_GRVW04_GSU01_SNLL0_TT04_04_VW04_WG16_16_01
    SolutionIndex: 70
    SolutionNameMin: Cijk_Ailk_Bjlk_SB_MT064x128x16_GRVW04_GSU01_SNLL0_TT04_08_VW04_WG16_16_01
    SolutionIndex: 71
    SolutionNameMin: Cijk_Ailk_Bjlk_SB_MT128x064x16_GRVW04_GSU01_SNLL0_TT08_04_VW04_WG16_16_01
    SolutionIndex: 72
    SolutionNameMin: Cijk_Ailk_Bjlk_SB_MT128x128x08_GRVW04_GSU01_SNLL1_TT08_08_VW04_WG16_16_01
    SolutionIndex: 73
    SolutionNameMin: Cijk_Ailk_Bjlk_SB_MT128x128x08_GRVW04_GSU01_SNLL1_TT08_08_VW04_WG16_16_01
    SolutionIndex: 74
    SolutionNameMin: Cijk_Ailk_Bjlk_SB_MT064x064x16_GRVW04_GSU01_SNLL1_TT04_04_VW04_WG16_16_01
    SolutionIndex: 75
    SolutionNameMin: Cijk_Ailk_Bjlk_SB_MT064x128x16_GRVW04_GSU01_SNLL1_TT04_08_VW04_WG16_16_01
    SolutionIndex: 76
    SolutionNameMin: Cijk_Ailk_Bjlk_SB_MT096x128x16_GRVW02_GSU01_SNLL1_TT06_08_VW02_WG16_16_01
    SolutionIndex: 77
    SolutionNameMin: Cijk_Ailk_Bjlk_SB_MT128x064x16_GRVW04_GSU01_SNLL1_TT08_04_VW04_WG16_16_01
    SolutionIndex: 78
    SolutionNameMin: Cijk_Ailk_Bjlk_SB_MT128x096x16_GRVW02_GSU01_SNLL1_TT08_06_VW02_WG16_16_01
    SolutionIndex: 79
    SolutionNameMin: Cijk_Ailk_Bjlk_SB_MT128x128x16_GRVW04_GSU01_SNLL1_TT08_08_VW04_WG16_16_01
    SolutionIndex: 80
    SolutionNameMin: Cijk_Ailk_Bjlk_SB_MT064x064x16_GRVW04_GSU01_SNLL1_TT04_04_VW04_WG16_16_01
    SolutionIndex: 81
    SolutionNameMin: Cijk_Ailk_Bjlk_SB_MT064x128x16_GRVW04_GSU01_SNLL1_TT04_08_VW04_WG16_16_01
    SolutionIndex: 82
    SolutionNameMin: Cijk_Ailk_Bjlk_SB_MT096x128x16_GRVW02_GSU01_SNLL1_TT06_08_VW02_WG16_16_01
    SolutionIndex: 83
    SolutionNameMin: Cijk_Ailk_Bjlk_SB_MT128x064x16_GRVW04_GSU01_SNLL1_TT08_04_VW04_WG16_16_01
    SolutionIndex: 84
    SolutionNameMin: Cijk_Ailk_Bjlk_SB_MT128x096x16_GRVW02_GSU01_SNLL1_TT08_06_VW02_WG16_16_01
    SolutionIndex: 85
    SolutionNameMin: Cijk_Ailk_Bjlk_SB_MT128x128x16_GRVW04_GSU01_SNLL1_TT08_08_VW04_WG16_16_01
    SolutionIndex: 86
    SolutionNameMin: Cijk_Ailk_Bjlk_SB_MT016x016x04_GRVW02_GSU01_SNLL0_TT02_02_VW02_WG08_08_01
    SolutionIndex: 87
    SolutionNameMin: Cijk_Ailk_Bjlk_SB_MT032x032x02_GRVW04_GSU01_SNLL0_TT04_04_VW04_WG08_08_01
    SolutionIndex: 88
    SolutionNameMin: Cijk_Ailk_Bjlk_SB_MT008x008x08_GRVW02_GSU01_SNLL1_TT02_02_VW02_WG04_04_04
    SolutionIndex: 89
    SolutionNameMin: Cijk_Ailk_Bjlk_SB_MT016x016x16_GRVW02_GSU01_SNLL1_TT02_02_VW02_WG08_08_04
    SolutionIndex: 90
    SolutionNameMin: Cijk_Ailk_Bjlk_SB_MT008x008x08_GRVW02_GSU02_SNLL0_TT02_02_VW02_WG04_04_04
    SolutionIndex: 91
    SolutionNameMin: Cijk_Ailk_Bjlk_SB_MT016x016x04_GRVW02_GSU04_SNLL0_TT02_02_VW02_WG08_08_01
    SolutionIndex: 92
    SolutionNameMin: Cijk_Ailk_Bjlk_SB_MT008x008x08_GRVW02_GSU04_SNLL0_TT02_02_VW02_WG04_04_04
    SolutionIndex: 93
    SolutionNameMin: Cijk_Ailk_Bjlk_SB_MT016x016x04_GRVW02_GSU08_SNLL0_TT02_02_VW02_WG08_08_01
    SolutionIndex: 94
    SolutionNameMin: Cijk_Ailk_Bjlk_SB_MT008x008x08_GRVW02_GSU08_SNLL0_TT02_02_VW02_WG04_04_04
    SolutionIndex: 95
    SolutionNameMin: Cijk_Ailk_Bjlk_SB_MT016x016x08_GRVW02_GSU16_SNLL0_TT02_02_VW02_WG08_08_02
    SolutionIndex: 96
    SolutionNameMin: Cijk_Ailk_Bjlk_SB_MT008x008x08_GRVW02_GSU16_SNLL0_TT02_02_VW02_WG04_04_04
    SolutionIndex: 97
    SolutionNameMin: Cijk_Ailk_Bjlk_SB_MT016x016x16_GRVW02_GSU16_SNLL0_TT02_02_VW02_WG08_08_04
    SolutionIndex: 98
    SolutionNameMin: Cijk_Ailk_Bjlk_SB_MT064x128x08_DTL0_GRVW01_GSU01_PGR1_PLR1_TT04_08_USFGRO01_VW02_WG16_16_01_WGM01
    SolutionIndex: 99
    SolutionNameMin: Cijk_Ailk_Bjlk_SB_MT064x064x08_DTL0_GRVW01_GSU01_PGR1_PLR1_TT04_08_USFGRO01_VW04_WG16_08_01_WGM01
    SolutionIndex: 100
    SolutionNameMin: Cijk_Ailk_Bjlk_SB_MT032x256x08_DTL1_GRVW01_GSU01_PGR0_PLR1_TT04_08_USFGRO01_VW04_WG08_32_01_WGM01
    SolutionIndex: 101
    SolutionNameMin: Cijk_Ailk_Bjlk_SB_MT032x256x08_DTL1_GRVW01_GSU01_PGR0_PLR1_TT04_08_USFGRO01_VW04_WG08_32_01_WGM08
    SolutionIndex: 102
    SolutionNameMin: Cijk_Ailk_Bjlk_SB_MT032x256x08_DTL1_GRVW01_GSU01_PGR0_PLR1_TT04_08_USFGRO01_VW04_WG08_32_01_WGM64
    SolutionIndex: 103
    SolutionNameMin: Cijk_Ailk_Bjlk_SB_MT064x064x16_DTL0_GRVW01_GSU01_PGR0_PLR1_TT04_08_USFGRO01_VW04_WG16_08_01_WGM01
    SolutionIndex: 104
    SolutionNameMin: Cijk_Ailk_Bjlk_SB_MT064x064x16_DTL0_GRVW01_GSU01_PGR1_PLR1_TT04_04_USFGRO01_VW04_WG16_16_01_WGM01
    SolutionIndex: 105
    SolutionNameMin: Cijk_Ailk_Bjlk_SB_MT064x064x08_DTL0_GRVW04_GSU01_PGR1_PLR1_TT04_08_USFGRO0_VW04_WG16_08_01_WGM01
    SolutionIndex: 106
    SolutionNameMin: Cijk_Ailk_Bjlk_SB_MT032x128x08_DTL0_GRVW04_GSU01_PGR1_PLR1_TT04_04_USFGRO0_VW04_WG08_32_01_WGM01
    SolutionIndex: 107
    SolutionNameMin: Cijk_Ailk_Bjlk_SB_MT064x128x16_DTL0_GRVW04_GSU01_PGR0_PLR1_TT08_04_USFGRO0_VW04_WG08_32_01_WGM01
    SolutionIndex: 108
    SolutionNameMin: Cijk_Ailk_Bjlk_SB_MT064x064x16_DTL0_GRVW04_GSU01_PGR1_PLR1_TT04_04_USFGRO0_VW04_WG16_16_01_WGM01
    SolutionIndex: 109
    SolutionNameMin: Cijk_Ailk_Bjlk_SB_MT064x128x16_DTL0_GRVW04_GSU01_PGR0_PLR1_TT04_08_USFGRO0_VW04_WG16_16_01_WGM01
    SolutionIndex: 110
    SolutionNameMin: Cijk_Ailk_Bjlk_SB_MT064x064x16_DTL0_GRVW04_GSU01_PGR1_PLR1_TT04_04_USFGRO0_VW04_WG16_16_01_WGM08
    SolutionIndex: 111
    SolutionNameMin: Cijk_Ailk_Bjlk_SB_MT064x128x16_DTL0_GRVW04_GSU01_PGR0_PLR1_TT04_08_USFGRO0_VW04_WG16_16_01_WGM08
    SolutionIndex: 112
    SolutionNameMin: Cijk_Ailk_Bjlk_SB_MT64x32x8_SE_EPS0_GSU1_PGR0_PLR1_SNLL0_TT8_4_VW4_WG8_8_1_WGM1
    SolutionIndex: 113
    SolutionNameMin: Cijk_Ailk_Bjlk_SB_MT64x64x8_SE_EPS1_GSU1_PGR1_PLR1_SNLL1_TT8_8_VW4_WG8_8_1_WGM8
    SolutionIndex: 114
    SolutionNameMin: Cijk_Ailk_Bjlk_SB_MT64x32x8_SE_EPS0_GSU1_PGR0_PLR1_SNLL0_TT8_4_VW4_WG8_8_1_WGM64
    SolutionIndex: 115
    SolutionNameMin: Cijk_Ailk_Bjlk_SB_MT64x64x8_SE_EPS1_GSU1_PGR1_PLR1_SNLL1_TT8_8_VW4_WG8_8_1_WGM64
    SolutionIndex: 116
    SolutionNameMin: Cijk_Ailk_Bjlk_SB_MT128x32x16_SE_EPS0_GSU1_PGR0_PLR1_SNLL0_TT8_4_VW4_WG16_8_1_WGM1
    SolutionIndex: 117
    SolutionNameMin: Cijk_Ailk_Bjlk_SB_MT64x64x16_SE_EPS1_GSU1_PGR1_PLR1_SNLL1_TT4_4_VW4_WG16_16_1_WGM1
    SolutionIndex: 118
    SolutionNameMin: Cijk_Ailk_Bjlk_SB_MT128x32x16_SE_EPS0_GSU1_PGR0_PLR1_SNLL0_TT8_4_VW4_WG16_8_1_WGM8
    SolutionIndex: 119
    SolutionNameMin: Cijk_Ailk_Bjlk_SB_MT64x64x16_SE_EPS0_GSU1_PGR0_PLR0_SNLL0_TT4_4_VW4_WG16_16_1_WGM8
    SolutionIndex: 120
    SolutionNameMin: Cijk_Ailk_Bjlk_SB_MT64x64x16_SE_EPS0_GSU1_PGR0_PLR1_SNLL0_TT4_4_VW4_WG16_16_1_WGM8
    SolutionIndex: 121
    SolutionNameMin: Cijk_Ailk_Bjlk_SB_MT64x64x16_SE_EPS1_GSU1_PGR1_PLR1_SNLL1_TT4_4_VW4_WG16_16_1_WGM8
    SolutionIndex: 122
    SolutionNameMin: Cijk_Ailk_Bjlk_SB_MT128x32x16_SE_EPS0_GSU1_PGR0_PLR1_SNLL0_TT8_4_VW4_WG16_8_1_WGM64
    SolutionIndex: 123
    SolutionNameMin: Cijk_Ailk_Bjlk_SB_MT64x64x16_SE_EPS0_GSU1_PGR0_PLR0_SNLL0_TT4_4_VW4_WG16_16_1_WGM64
    SolutionIndex: 124
    SolutionNameMin: Cijk_Ailk_Bjlk_SB_MT64x64x16_SE_EPS0_GSU1_PGR0_PLR1_SNLL0_TT4_4_VW4_WG16_16_1_WGM64
    SolutionIndex: 125
    SolutionNameMin: Cijk_Ailk_Bjlk_SB_MT64x64x16_SE_EPS1_GSU1_PGR1_PLR1_SNLL1_TT4_4_VW4_WG16_16_1_WGM64
    SolutionIndex: 126
    SolutionNameMin: Cijk_Ailk_Bjlk_SB_MT64x64x8_SE_EPS1_FL0_GRVW1_NLCA1_NLCB1_PGR1_PLR0_SNLL1_TT4_4_USFGRO1_VW1_WGM1
    SolutionIndex: 127
    SolutionNameMin: Cijk_Ailk_Bjlk_SB_MT64x64x8_SE_EPS0_FL0_GRVW1_NLCA1_NLCB1_PGR0_PLR1_SNLL0_TT4_4_USFGRO1_VW1_WGM1
    SolutionIndex: 128
    SolutionNameMin: Cijk_Ailk_Bjlk_SB_MT64x32x8_SE_EPS0_FL0_GRVW1_NLCA1_NLCB1_PGR0_PLR1_SNLL0_TT4_2_USFGRO1_VW1_WGM1
    SolutionIndex: 129
    SolutionNameMin: Cijk_Ailk_Bjlk_SB_MT64x128x8_SE_EPS1_FL0_GRVW1_NLCA1_NLCB1_PGR1_PLR0_SNLL1_TT4_8_USFGRO1_VW1_WGM1
    SolutionIndex: 130
    SolutionNameMin: Cijk_Ailk_Bjlk_SB_MT64x32x8_SE_EPS0_FL0_GRVW1_NLCA1_NLCB1_PGR0_PLR0_SNLL0_TT4_4_USFGRO1_VW1_WGM1
    SolutionIndex: 131
    SolutionNameMin: Cijk_Ailk_Bjlk_SB_MT64x32x8_SE_EPS0_FL0_GRVW1_NLCA1_NLCB1_PGR0_PLR1_SNLL0_TT4_4_USFGRO1_VW1_WGM1
    SolutionIndex: 132
    SolutionNameMin: Cijk_Ailk_Bjlk_SB_MT64x16x8_SE_EPS0_FL0_GRVW1_NLCA1_NLCB1_PGR0_PLR0_SNLL0_TT4_2_USFGRO1_VW1_WGM1
    SolutionIndex: 133
    SolutionNameMin: Cijk_Ailk_Bjlk_SB_MT64x16x8_SE_EPS0_FL0_GRVW1_NLCA1_NLCB1_PGR0_PLR1_SNLL0_TT4_2_USFGRO1_VW1_WGM1
    SolutionIndex: 134
    SolutionNameMin: Cijk_Ailk_Bjlk_SB_MT64x64x8_SE_EPS1_FL0_GRVW1_NLCA1_NLCB1_PGR1_PLR0_SNLL1_TT4_4_USFGRO1_VW1_WGM8
    SolutionIndex: 135
    SolutionNameMin: Cijk_Ailk_Bjlk_SB_MT64x128x8_SE_EPS1_FL0_GRVW1_NLCA1_NLCB1_PGR1_PLR0_SNLL1_TT4_8_USFGRO1_VW1_WGM8
    SolutionIndex: 136
    SolutionNameMin: Cijk_Ailk_Bjlk_SB_MT64x32x8_SE_EPS0_FL0_GRVW1_NLCA1_NLCB1_PGR0_PLR0_SNLL0_TT4_4_USFGRO1_VW1_WGM8
    SolutionIndex: 137
    SolutionNameMin: Cijk_Ailk_Bjlk_SB_MT64x32x8_SE_EPS0_FL0_GRVW1_NLCA1_NLCB1_PGR0_PLR1_SNLL0_TT4_4_USFGRO1_VW1_WGM8
    SolutionIndex: 138
    SolutionNameMin: Cijk_Ailk_Bjlk_SB_MT64x16x8_SE_EPS0_FL0_GRVW1_NLCA1_NLCB1_PGR0_PLR1_SNLL0_TT4_2_USFGRO1_VW1_WGM8
    SolutionIndex: 139
    SolutionNameMin: Cijk_Ailk_Bjlk_SB_MT64x64x16_SE_EPS0_FL0_GRVW1_NLCA1_NLCB1_PGR0_PLR0_SNLL0_TT4_4_USFGRO1_VW1_WGM1
    SolutionIndex: 140
    SolutionNameMin: Cijk_Ailk_Bjlk_SB_MT64x16x16_SE_EPS0_FL0_GRVW1_NLCA1_NLCB1_PGR0_PLR0_SNLL0_TT4_2_USFGRO1_VW1_WGM1
    SolutionIndex: 141
    SolutionNameMin: Cijk_Ailk_Bjlk_SB_MT64x16x16_SE_EPS0_FL0_GRVW1_NLCA1_NLCB1_PGR0_PLR1_SNLL0_TT4_2_USFGRO1_VW1_WGM1
    SolutionIndex: 142
    SolutionNameMin: Cijk_Ailk_Bjlk_SB_MT64x32x32_SE_EPS0_FL0_GRVW1_NLCA1_NLCB1_PGR0_PLR1_SNLL0_TT4_2_USFGRO1_VW1_WGM8
    SolutionIndex: 143
    SolutionNameMin: Cijk_Ailk_Bjlk_SB_MT64x32x8_SE_EPS0_FL0_GRVW1_NLCA1_NLCB1_PGR0_PLR0_SNLL0_TT4_4_USFGRO1_VW4_WGM1
    SolutionIndex: 144
    SolutionNameMin: Cijk_Ailk_Bjlk_SB_MT64x32x8_SE_EPS0_FL0_GRVW1_NLCA1_NLCB1_PGR0_PLR1_SNLL0_TT4_4_USFGRO1_VW4_WGM1
    SolutionIndex: 145
    SolutionNameMin: Cijk_Ailk_Bjlk_SB_MT64x32x8_SE_EPS0_FL0_GRVW1_NLCA1_NLCB1_PGR0_PLR0_SNLL0_TT4_4_USFGRO1_VW4_WGM8
    SolutionIndex: 146
    SolutionNameMin: Cijk_Ailk_Bjlk_SB_MT64x32x8_SE_EPS0_FL0_GRVW1_NLCA1_NLCB1_PGR0_PLR1_SNLL0_TT4_4_USFGRO1_VW4_WGM8
    SolutionIndex: 147
    SolutionNameMin: Cijk_Ailk_Bjlk_SB_MT64x64x8_SE_EPS1_FL0_GRVW4_NLCA1_NLCB1_PGR1_PLR1_SNLL1_TT8_4_USFGRO0_VW4_WGM1
    SolutionIndex: 148
    SolutionNameMin: Cijk_Ailk_Bjlk_SB_MT64x64x16_SE_EPS1_FL0_GRVW4_NLCA1_NLCB1_PGR1_PLR1_SNLL1_TT4_4_USFGRO0_VW4_WGM1
    SolutionIndex: 149
    SolutionNameMin: Cijk_Ailk_Bjlk_SB_MT64x64x16_SE_EPS1_FL1_GRVW4_NLCA1_NLCB1_PGR1_PLR1_SNLL1_TT4_4_USFGRO0_VW4_WGM1
    SolutionIndex: 150
    SolutionNameMin: Cijk_Ailk_Bjlk_SB_MT64x128x16_SE_EPS1_FL0_GRVW4_NLCA1_NLCB1_PGR1_PLR1_SNLL1_TT4_8_USFGRO0_VW4_WGM1
    SolutionIndex: 151
    SolutionNameMin: Cijk_Ailk_Bjlk_SB_MT128x64x16_SE_EPS1_FL0_GRVW4_NLCA1_NLCB1_PGR1_PLR1_SNLL1_TT8_4_USFGRO0_VW4_WGM1
    SolutionIndex: 152
    SolutionNameMin: Cijk_Ailk_Bjlk_SB_MT128x64x16_SE_EPS1_FL1_GRVW4_NLCA1_NLCB1_PGR1_PLR1_SNLL1_TT8_4_USFGRO0_VW4_WGM1
    SolutionIndex: 153
    SolutionNameMin: Cijk_Ailk_Bjlk_SB_MT128x128x16_SE_EPS1_FL0_GRVW4_NLCA1_NLCB1_PGR1_PLR1_SNLL1_TT8_8_USFGRO0_VW4_WGM1
    SolutionIndex: 154
    SolutionNameMin: Cijk_Ailk_Bjlk_SB_MT128x128x16_SE_EPS1_FL1_GRVW4_NLCA1_NLCB1_PGR1_PLR1_SNLL1_TT8_8_USFGRO0_VW4_WGM1
    SolutionIndex: 155
    SolutionNameMin: Cijk_Ailk_Bjlk_SB_MT64x64x16_SE_EPS1_FL0_GRVW4_NLCA1_NLCB1_PGR1_PLR1_SNLL1_TT4_4_USFGRO0_VW4_WGM8
    SolutionIndex: 156
    SolutionNameMin: Cijk_Ailk_Bjlk_SB_MT64x128x16_SE_EPS1_FL0_GRVW4_NLCA1_NLCB1_PGR1_PLR1_SNLL1_TT4_8_USFGRO0_VW4_WGM8
    SolutionIndex: 157
    SolutionNameMin: Cijk_Ailk_Bjlk_SB_MT64x128x16_SE_EPS1_FL1_GRVW4_NLCA1_NLCB1_PGR1_PLR1_SNLL1_TT4_8_USFGRO0_VW4_WGM8
    SolutionIndex: 158
    SolutionNameMin: Cijk_Ailk_Bjlk_SB_MT128x64x16_SE_EPS1_FL0_GRVW4_NLCA1_NLCB1_PGR1_PLR1_SNLL1_TT8_4_USFGRO0_VW4_WGM8
    SolutionIndex: 159
    SolutionNameMin: Cijk_Ailk_Bjlk_SB_MT128x64x16_SE_EPS1_FL1_GRVW4_NLCA1_NLCB1_PGR1_PLR1_SNLL1_TT8_4_USFGRO0_VW4_WGM8
    SolutionIndex: 160
    SolutionNameMin: Cijk_Ailk_Bjlk_SB_MT128x128x16_SE_EPS1_FL0_GRVW4_NLCA1_NLCB1_PGR1_PLR1_SNLL1_TT8_8_USFGRO0_VW4_WGM8
    SolutionIndex: 161
    SolutionNameMin: Cijk_Ailk_Bjlk_SB_MT128x128x16_SE_EPS1_FL1_GRVW4_NLCA1_NLCB1_PGR1_PLR1_SNLL1_TT8_8_USFGRO0_VW4_WGM8
    SolutionIndex: 162
    SolutionNameMin: Cijk_Ailk_Bjlk_SB_MT64x64x16_SE_EPS1_FL1_GRVW4_NLCA1_NLCB1_PGR1_PLR0_TT4_4_USFGRO0_VW4_WGM8
    SolutionIndex: 163
    SolutionNameMin: Cijk_Ailk_Bjlk_SB_MT64x128x8_SE_EPS1_FL0_GRVW2_NLCA1_NLCB1_PGR1_PLR1_TT4_8_USFGRO0_VW2_WGM8
    SolutionIndex: 164
    SolutionNameMin: Cijk_Ailk_Bjlk_SB_MT128x64x8_SE_EPS1_FL0_GRVW1_NLCA1_NLCB1_PGR1_PLR0_TT8_4_USFGRO1_VW4_WGM8
    SolutionIndex: 165
    SolutionNameMin: Cijk_Ailk_Bjlk_SB_MT128x64x8_SE_EPS1_FL1_GRVW2_NLCA1_NLCB1_PGR1_PLR1_TT8_4_USFGRO0_VW2_WGM8
    SolutionIndex: 166
    SolutionNameMin: Cijk_Ailk_Bjlk_SB_MT64x64x8_SE_DTL0_EPS0_FL0_GRVW1_PGR0_PLR1_TT4_4_USFGRO1_VW2_WG16_16_1_WGM1
    SolutionIndex: 167
    SolutionNameMin: Cijk_Ailk_Bjlk_SB_MT64x64x8_SE_DTL0_EPS0_FL0_GRVW1_PGR0_PLR1_TT4_4_USFGRO1_VW4_WG16_16_1_WGM1
    SolutionIndex: 168
    SolutionNameMin: Cijk_Ailk_Bjlk_SB_MT64x64x8_SE_DTL0_EPS1_FL0_GRVW1_PGR1_PLR1_TT4_4_USFGRO1_VW4_WG16_16_1_WGM1
    SolutionIndex: 169
    SolutionNameMin: Cijk_Ailk_Bjlk_SB_MT64x64x16_SE_DTL0_EPS1_FL0_GRVW1_PGR1_PLR1_TT4_4_USFGRO1_VW4_WG16_16_1_WGM1
    SolutionIndex: 170
    SolutionNameMin: Cijk_Ailk_Bjlk_SB_MT64x64x16_SE_DTL0_EPS1_FL0_GRVW4_PGR1_PLR1_TT4_4_USFGRO0_VW4_WG16_16_1_WGM1
    SolutionIndex: 171
    SolutionNameMin: Cijk_Ailk_Bjlk_SB_MT32x8x32_SE_DTL0_EPS1_FL0_GRVW1_PGR1_PLR0_TT2_2_USFGRO1_VW2_WG16_4_4_WGM1
    SolutionIndex: 172
    SolutionNameMin: Cijk_Ailk_Bjlk_SB_MT32x8x32_SE_DTL0_EPS0_FL0_GRVW1_PGR0_PLR1_TT2_2_USFGRO1_VW2_WG16_4_4_WGM8
    SolutionIndex: 173
    SolutionNameMin: Cijk_Ailk_Bjlk_SB_MT32x8x16_SE_DTL0_EPS1_FL1_GRVW2_PGR1_PLR0_TT2_2_USFGRO0_VW2_WG16_4_4_WGM1
    SolutionIndex: 174
    SolutionNameMin: Cijk_Ailk_Bjlk_SB_MT64x8x32_SE_DTL0_EPS1_FL1_GRVW2_PGR1_PLR1_TT4_2_USFGRO0_VW2_WG16_4_4_WGM1
    SolutionIndex: 175
    SolutionNameMin: Cijk_Ailk_Bjlk_SB_MT96x64x8_SE_DTL0_EPS1_FL1_GRVW2_PGR1_PLR1_TT6_4_USFGRO0_VW2_WG16_16_1_WGM1
    SolutionIndex: 176
    SolutionNameMin: Cijk_Ailk_Bjlk_SB_MT96x64x8_SE_DTL0_EPS1_FL1_GRVW2_PGR1_PLR1_TT6_4_USFGRO0_VW2_WG16_16_1_WGM8
    SolutionIndex: 177
    SolutionNameMin: Cijk_Ailk_Bjlk_SB_MT64x96x8_SE_DTL0_EPS1_FL1_GRVW2_PGR1_PLR1_TT4_6_USFGRO0_VW2_WG16_16_1_WGM1
    SolutionIndex: 178
    SolutionNameMin: Cijk_Ailk_Bjlk_SB_MT64x128x8_SE_DTL0_EPS1_FL0_GRVW1_PGR1_PLR0_TT4_8_USFGRO1_VW4_WG16_16_1_WGM1
    SolutionIndex: 179
    SolutionNameMin: Cijk_Ailk_Bjlk_SB_MT64x128x8_SE_DTL0_EPS1_FL0_GRVW2_PGR1_PLR1_TT4_8_USFGRO0_VW2_WG16_16_1_WGM1
    SolutionIndex: 180
    SolutionNameMin: Cijk_Ailk_Bjlk_SB_MT128x64x8_SE_DTL0_EPS1_FL1_GRVW2_PGR1_PLR1_TT8_4_USFGRO0_VW2_WG16_16_1_WGM1
    SolutionIndex: 181
    SolutionNameMin: Cijk_Ailk_Bjlk_SB_MT64x64x8_SE_AMAS3_EPS1_FL0_GRVW4_GSU1_PGR1_PLR1_TT4_4_USFGRO0_VW2_WG16_16_1_WGM1
    SolutionIndex: 182
    SolutionNameMin: Cijk_Ailk_Bjlk_SB_MT64x64x16_SE_AMAS3_EPS1_FL0_GRVW4_GSU1_PGR1_PLR1_TT4_4_USFGRO0_VW4_WG16_16_1_WGM8
    SolutionIndex: 183
    SolutionNameMin: Cijk_Ailk_Bjlk_SB_MT64x32x8_SE_AMAS3_EPS1_FL0_GRVW2_GSU1_PGR1_PLR1_TT4_4_USFGRO0_VW2_WG16_8_2_WGM8
    SolutionIndex: 184
    SolutionNameMin: Cijk_Ailk_Bjlk_SB_MT8x32x32_SE_AMAS3_EPS1_FL0_GRVW1_GSU1_PGR1_PLR1_TT2_2_USFGRO1_VW2_WG4_16_4_WGM1
    SolutionIndex: 185
    SolutionNameMin: Cijk_Ailk_Bjlk_SB_MT16x32x32_SE_AMAS1_EPS1_FL0_GRVW1_GSU1_PGR1_PLR1_TT4_2_USFGRO1_VW1_WG4_16_4_WGM8
    SolutionIndex: 186
    SolutionNameMin: Cijk_Ailk_Bjlk_SB_MT16x32x32_SE_AMAS3_EPS1_FL0_GRVW1_GSU1_PGR1_PLR1_TT4_2_USFGRO1_VW2_WG4_16_4_WGM8
    SolutionIndex: 187
    SolutionNameMin: Cijk_Ailk_Bjlk_SB_MT32x8x32_SE_AMAS1_EPS1_FL0_GRVW1_GSU1_PGR1_PLR1_TT2_2_USFGRO1_VW1_WG16_4_4_WGM8
    SolutionIndex: 188
    SolutionNameMin: Cijk_Ailk_Bjlk_SB_MT64x16x16_SE_AMAS3_EPS1_FL0_GRVW4_GSU1_PGR1_PLR0_TT4_4_USFGRO0_VW4_WG16_4_4_WGM1
    SolutionIndex: 189
    SolutionNameMin: Cijk_Ailk_Bjlk_SB_MT128x64x8_SE_AMAS3_EPS1_FL0_GRVW1_GSU1_PGR1_PLR1_TT8_4_USFGRO1_VW4_WG16_16_1_WGM8
    SolutionIndex: 190
    SolutionNameMin: Cijk_Ailk_Bjlk_SB_MT128x64x8_SE_AMAS3_EPS1_FL0_GRVW2_GSU1_PGR1_PLR1_TT8_4_USFGRO0_VW2_WG16_16_1_WGM8
    SolutionIndex: 191
    SolutionNameMin: Cijk_Ailk_Bjlk_SB_MT128x64x8_SE_AMAS3_EPS1_FL1_GRVW2_GSU1_PGR1_PLR0_TT8_4_USFGRO0_VW2_WG16_16_1_WGM8
    SolutionIndex: 192
    SolutionNameMin: Cijk_Ailk_Bjlk_SB_MT64x64x16_SE_EPS1_FL0_GRVW4_GSU1_PGR1_PLR0_TT4_4_USFGRO0_VW4_WG16_16_1_WGM8
    SolutionIndex: 193
    SolutionNameMin: Cijk_Ailk_Bjlk_SB_MT64x64x16_SE_EPS1_FL0_GRVW4_GSU1_PGR1_PLR1_TT4_4_USFGRO0_VW4_WG16_16_1_WGM1
    SolutionIndex: 194
    SolutionNameMin: Cijk_Ailk_Bjlk_SB_MT64x64x16_SE_EPS1_FL1_GRVW4_GSU1_PGR1_PLR1_TT4_4_USFGRO0_VW4_WG16_16_1_WGM1
    SolutionIndex: 195
    SolutionNameMin: Cijk_Ailk_Bjlk_SB_MT64x64x16_SE_EPS1_FL1_GRVW4_GSU1_PGR1_PLR1_TT4_4_USFGRO0_VW4_WG16_16_1_WGM8
    SolutionIndex: 196
    SolutionNameMin: Cijk_Ailk_Bjlk_SB_MT64x96x8_SE_EPS1_FL1_GRVW2_GSU1_PGR1_PLR0_TT4_6_USFGRO0_VW2_WG16_16_1_WGM1
    SolutionIndex: 197
    SolutionNameMin: Cijk_Ailk_Bjlk_SB_MT64x96x8_SE_EPS1_FL1_GRVW2_GSU1_PGR1_PLR1_TT4_6_USFGRO0_VW2_WG16_16_1_WGM1
    SolutionIndex: 198
    SolutionNameMin: Cijk_Ailk_Bjlk_SB_MT64x96x8_SE_EPS1_FL1_GRVW2_GSU1_PGR1_PLR1_TT4_6_USFGRO0_VW2_WG16_16_1_WGM8
    SolutionIndex: 199
    SolutionNameMin: Cijk_Ailk_Bjlk_SB_MT64x128x8_SE_EPS1_FL0_GRVW2_GSU1_PGR1_PLR1_TT4_8_USFGRO0_VW2_WG16_16_1_WGM1
    SolutionIndex: 200
    SolutionNameMin: Cijk_Ailk_Bjlk_SB_MT64x128x8_SE_EPS1_FL1_GRVW2_GSU1_PGR1_PLR1_TT4_8_USFGRO0_VW2_WG16_16_1_WGM1
    SolutionIndex: 201
    SolutionNameMin: Cijk_Ailk_Bjlk_SB_MT64x128x8_SE_EPS1_FL1_GRVW2_GSU1_PGR1_PLR1_TT4_8_USFGRO0_VW2_WG16_16_1_WGM8
    SolutionIndex: 202
    SolutionNameMin: Cijk_Ailk_Bjlk_SB_MT128x64x8_SE_EPS1_FL0_GRVW2_GSU1_PGR1_PLR1_TT8_4_USFGRO0_VW2_WG16_16_1_WGM1
    SolutionIndex: 203
    SolutionNameMin: Cijk_Ailk_Bjlk_SB_MT128x64x8_SE_EPS1_FL0_GRVW2_GSU1_PGR1_PLR1_TT8_4_USFGRO0_VW2_WG16_16_1_WGM8
    SolutionIndex: 204
    SolutionNameMin: Cijk_Ailk_Bjlk_SB_MT128x64x8_SE_EPS1_FL1_GRVW2_GSU1_PGR1_PLR1_TT8_4_USFGRO0_VW2_WG16_16_1_WGM1
    SolutionIndex: 205
    SolutionNameMin: Cijk_Ailk_Bjlk_SB_MT128x128x8_SE_EPS1_FL0_GRVW1_GSU1_PGR1_PLR1_TT8_8_USFGRO1_VW2_WG16_16_1_WGM1
    SolutionIndex: 206
    SolutionNameMin: Cijk_Ailk_Bjlk_SB_MT128x128x8_SE_EPS1_FL0_GRVW1_GSU1_PGR1_PLR0_TT8_8_USFGRO1_VW4_WG16_16_1_WGM8
    SolutionIndex: 207
    SolutionNameMin: Cijk_Ailk_Bjlk_SB_MT32x64x32_SE_EPS1_FL0_GRVW4_GSU1_PGR1_PLR1_TT4_4_USFGRO0_VW4_WG8_16_2_WGM1
    SolutionIndex: 208
    SolutionNameMin: Cijk_Ailk_Bjlk_SB_MT32x64x32_SE_EPS1_FL0_GRVW4_GSU1_PGR1_PLR1_TT4_4_USFGRO0_VW4_WG8_16_2_WGM8
    SolutionIndex: 209
    SolutionNameMin: Cijk_Ailk_Bjlk_SB_MT32x64x32_SE_EPS1_FL1_GRVW4_GSU1_PGR1_PLR1_TT4_4_USFGRO0_VW4_WG8_16_2_WGM1
    SolutionIndex: 210
    SolutionNameMin: Cijk_Ailk_Bjlk_SB_MT32x64x32_SE_EPS1_FL1_GRVW4_GSU1_PGR1_PLR1_TT4_4_USFGRO0_VW4_WG8_16_2_WGM8
    SolutionIndex: 211
    SolutionNameMin: Cijk_Ailk_Bjlk_SB_MT64x32x32_SE_EPS1_FL0_GRVW4_GSU1_PGR1_PLR1_TT4_4_USFGRO0_VW4_WG16_8_2_WGM8
    SolutionIndex: 212
    SolutionNameMin: Cijk_Ailk_Bjlk_SB_MT64x32x32_SE_EPS1_FL1_GRVW4_GSU1_PGR1_PLR1_TT4_4_USFGRO0_VW4_WG16_8_2_WGM8
    SolutionIndex: 213
    SolutionNameMin: Cijk_Ailk_Bjlk_SB_MT64x32x16_SE_AMAS1_GRVW1_TT4_4_USFGRO1_VW1_WG16_8_2_WGM8
    SolutionIndex: 214
    SolutionNameMin: Cijk_Ailk_Bjlk_SB_MT32x16x32_SE_AMAS3_GRVW2_TT4_2_USFGRO0_VW2_WG8_8_4_WGM8
    SolutionIndex: 215
    SolutionNameMin: Cijk_Ailk_Bjlk_SB_MT128x128x16_SE_AMAS3_GRVW1_TT8_8_USFGRO1_VW4_WG16_16_1_WGM1
    SolutionIndex: 216
    SolutionNameMin: Cijk_Ailk_Bjlk_SB_MT64x32x8_SE_AMAS1_GRVW1_TT4_2_USFGRO1_VW1_WG16_16_1_WGM8
    SolutionIndex: 217
    SolutionNameMin: Cijk_Ailk_Bjlk_SB_MT16x32x16_SE_AMAS3_GRVW1_TT2_4_USFGRO1_VW2_WG8_8_4_WGM1
    SolutionIndex: 218
    SolutionNameMin: Cijk_Ailk_Bjlk_SB_MT32x32x32_SE_AMAS3_GRVW2_TT4_4_USFGRO0_VW2_WG8_8_4_WGM1
    SolutionIndex: 219
    SolutionNameMin: Cijk_Ailk_Bjlk_SB_MT32x64x16_SE_AMAS3_GRVW2_TT4_4_USFGRO0_VW2_WG8_16_2_WGM1
    SolutionIndex: 220
    SolutionNameMin: Cijk_Ailk_Bjlk_SB_MT64x32x16_SE_AMAS3_GRVW1_TT4_4_USFGRO1_VW2_WG16_8_2_WGM8
    SolutionIndex: 221
    SolutionNameMin: Cijk_Ailk_Bjlk_SB_MT64x64x16_SE_AMAS3_GRVW4_TT4_4_USFGRO0_VW4_WG16_16_1_WGM8
    SolutionIndex: 222
    SolutionNameMin: Cijk_Ailk_Bjlk_SB_MT64x64x16_SE_AMAS1_GRVW1_TT4_4_USFGRO1_VW1_WG16_16_1_WGM1
    SolutionIndex: 223
    SolutionNameMin: Cijk_Ailk_Bjlk_SB_MT64x32x16_SE_AMAS3_GRVW1_TT4_4_USFGRO1_VW4_WG16_8_2_WGM8
    SolutionIndex: 224
    SolutionNameMin: Cijk_Ailk_Bjlk_SB_MT32x64x16_SE_AMAS3_GRVW2_TT4_4_USFGRO0_VW2_WG8_16_2_WGM8
    SolutionIndex: 225
    SolutionNameMin: Cijk_Ailk_Bjlk_SB_MT32x16x32_SE_AMAS3_GRVW2_TT4_2_USFGRO0_VW2_WG8_8_4_WGM1
    SolutionIndex: 226
    SolutionNameMin: Cijk_Ailk_Bjlk_SB_MT64x64x16_SE_AMAS3_GRVW4_TT4_4_USFGRO0_VW4_WG16_16_1_WGM8
    SolutionIndex: 227
    SolutionNameMin: Cijk_Ailk_Bjlk_SB_MT32x32x32_SE_AMAS3_GRVW1_TT4_4_USFGRO1_VW2_WG8_8_4_WGM1
    SolutionIndex: 228
    SolutionNameMin: Cijk_Ailk_Bjlk_SB_MT64x64x16_SE_AMAS3_GRVW1_TT4_4_USFGRO1_VW4_WG16_16_1_WGM1
    SolutionIndex: 229
    SolutionNameMin: Cijk_Ailk_Bjlk_SB_MT64x64x8_SE_AMAS3_GRVW4_TT4_4_USFGRO0_VW2_WG16_16_1_WGM1
    SolutionIndex: 230
    SolutionNameMin: Cijk_Ailk_Bjlk_SB_MT32x32x32_SE_AMAS3_GRVW4_TT4_4_USFGRO0_VW4_WG8_8_4_WGM1
    SolutionIndex: 231
    SolutionNameMin: Cijk_Ailk_Bjlk_SB_MT64x64x8_SE_AMAS3_GRVW2_TT4_4_USFGRO0_VW2_WG16_16_1_WGM1
    SolutionIndex: 232
    SolutionNameMin: Cijk_Ailk_Bjlk_SB_MT64x64x16_SE_AMAS3_GRVW4_TT4_4_USFGRO0_VW4_WG16_16_1_WGM1
    SolutionIndex: 233
    SolutionNameMin: Cijk_Ailk_Bjlk_SB_MT64x64x16_SE_AMAS3_GRVW1_TT4_4_USFGRO1_VW2_WG16_16_1_WGM1
    SolutionIndex: 234
    SolutionNameMin: Cijk_Ailk_Bjlk_SB_MT64x32x32_SE_AMAS3_GRVW4_TT4_4_USFGRO0_VW4_WG16_8_2_WGM1
    SolutionIndex: 235
    SolutionNameMin: Cijk_Ailk_Bjlk_SB_MT64x32x16_SE_AMAS3_GRVW2_TT4_4_USFGRO0_VW2_WG16_8_2_WGM1
    SolutionIndex: 236
    SolutionNameMin: Cijk_Ailk_Bjlk_SB_MT128x128x16_SE_AMAS3_GRVW2_TT8_8_USFGRO0_VW2_WG16_16_1_WGM8
    SolutionIndex: 237
    SolutionNameMin: Cijk_Ailk_Bjlk_SB_MT32x32x8_SE_AMAS3_GRVW4_TT4_2_USFGRO1_VW2_WG8_16_2_WGM8
    SolutionIndex: 238
    SolutionNameMin: Cijk_Ailk_Bjlk_SB_MT64x32x16_SE_AMAS3_GRVW1_TT4_4_USFGRO1_VW4_WG16_8_2_WGM1
    SolutionIndex: 239
    SolutionNameMin: Cijk_Ailk_Bjlk_SB_MT64x64x8_SE_AMAS3_GRVW4_TT4_4_USFGRO0_VW2_WG16_16_1_WGM8
    SolutionIndex: 240
    SolutionNameMin: Cijk_Ailk_Bjlk_SB_MT32x64x32_SE_AMAS3_GRVW4_TT4_4_USFGRO0_VW4_WG8_16_2_WGM1
    SolutionIndex: 241
    SolutionNameMin: Cijk_Ailk_Bjlk_SB_MT64x64x8_SE_AMAS3_GRVW1_TT4_4_USFGRO1_VW4_WG16_16_1_WGM8
    SolutionIndex: 242
    SolutionNameMin: Cijk_Ailk_Bjlk_SB_MT64x32x32_SE_AMAS3_GRVW4_TT4_4_USFGRO0_VW4_WG16_8_2_WGM1
    SolutionIndex: 243
    SolutionNameMin: Cijk_Ailk_Bjlk_SB_MT16x32x32_SE_AMAS3_GRVW1_TT2_4_USFGRO1_VW2_WG8_8_4_WGM8
    SolutionIndex: 244
    SolutionNameMin: Cijk_Ailk_Bjlk_SB_MT32x16x32_SE_AMAS1_GRVW1_TT4_2_USFGRO1_VW1_WG8_8_4_WGM8
    SolutionIndex: 245
    SolutionNameMin: Cijk_Ailk_Bjlk_SB_MT16x32x32_SE_AMAS3_GRVW2_TT2_4_USFGRO0_VW2_WG8_8_4_WGM1
    SolutionIndex: 246
    SolutionNameMin: Cijk_Ailk_Bjlk_SB_MT32x32x16_SE_AMAS3_GRVW2_TT4_4_USFGRO0_VW2_WG8_8_4_WGM1
    SolutionIndex: 247
    SolutionNameMin: Cijk_Ailk_Bjlk_SB_MT128x128x16_SE_AMAS3_GRVW1_TT8_8_USFGRO1_VW4_WG16_16_1_WGM8
    SolutionIndex: 248
    SolutionNameMin: Cijk_Ailk_Bjlk_SB_MT64x64x8_SE_AMAS3_GRVW1_TT4_4_USFGRO1_VW4_WG16_16_1_WGM1
    SolutionIndex: 249
    SolutionNameMin: Cijk_Ailk_Bjlk_SB_MT32x32x32_SE_AMAS3_GRVW2_TT4_4_USFGRO0_VW2_WG8_8_4_WGM8
    SolutionIndex: 250
    SolutionNameMin: Cijk_Ailk_Bjlk_SB_MT16x32x32_SE_AMAS3_GRVW2_TT2_4_USFGRO0_VW2_WG8_8_4_WGM8
    SolutionIndex: 251
    SolutionNameMin: Cijk_Ailk_Bjlk_SB_MT32x64x16_SE_AMAS3_GRVW1_TT4_4_USFGRO1_VW4_WG8_16_2_WGM8
    SolutionIndex: 252
    SolutionNameMin: Cijk_Ailk_Bjlk_SB_MT32x64x16_SE_AMAS3_GRVW2_TT4_4_USFGRO0_VW2_WG8_16_2_WGM1
    SolutionIndex: 253
    SolutionNameMin: Cijk_Ailk_Bjlk_SB_MT64x64x16_SE_AMAS3_GRVW2_TT4_4_USFGRO0_VW2_WG16_16_1_WGM8
    SolutionIndex: 254
    SolutionNameMin: Cijk_Ailk_Bjlk_SB_MT128x128x8_SE_AMAS3_GRVW1_TT8_8_USFGRO1_VW4_WG16_16_1_WGM1
    SolutionIndex: 255
    SolutionNameMin: Cijk_Ailk_Bjlk_SB_MT64x32x8_SE_AMAS3_GRVW1_TT4_4_USFGRO1_VW4_WG16_8_2_WGM1
    SolutionIndex: 256
    SolutionNameMin: Cijk_Ailk_Bjlk_SB_MT32x32x32_SE_AMAS3_GRVW1_TT4_4_USFGRO1_VW2_WG8_8_4_WGM8
    SolutionIndex: 257
    SolutionNameMin: Cijk_Ailk_Bjlk_SB_MT128x128x8_SE_AMAS3_GRVW1_TT8_8_USFGRO1_VW2_WG16_16_1_WGM8
    SolutionIndex: 258
    SolutionNameMin: Cijk_Ailk_Bjlk_SB_MT128x128x8_SE_AMAS3_GRVW1_TT8_8_USFGRO1_VW4_WG16_16_1_WGM8
    SolutionIndex: 259
    SolutionNameMin: Cijk_Ailk_Bjlk_SB_MT64x32x8_SE_AMAS1_GRVW1_TT4_2_USFGRO1_VW1_WG16_16_1_WGM1
    SolutionIndex: 260
    SolutionNameMin: Cijk_Ailk_Bjlk_SB_MT32x32x32_SE_AMAS3_GRVW4_TT4_4_USFGRO0_VW4_WG8_8_4_WGM8
    SolutionIndex: 261
    SolutionNameMin: Cijk_Ailk_Bjlk_SB_MT16x32x32_SE_AMAS1_GRVW1_TT2_4_USFGRO1_VW1_WG8_8_4_WGM8
    SolutionIndex: 262
    SolutionNameMin: Cijk_Ailk_Bjlk_SB_MT64x32x8_SE_AMAS3_GRVW1_TT4_2_USFGRO1_VW2_WG16_16_1_WGM1
    SolutionIndex: 263
    SolutionNameMin: Cijk_Ailk_Bjlk_SB_MT64x16x32_SE_AMAS3_GRVW1_TT4_2_USFGRO1_VW2_WG16_8_2_WGM8
    SolutionIndex: 264
    SolutionNameMin: Cijk_Ailk_Bjlk_SB_MT64x64x8_SE_AMAS3_GRVW2_TT4_4_USFGRO0_VW2_WG16_16_1_WGM1
    SolutionIndex: 265
    SolutionNameMin: Cijk_Ailk_Bjlk_SB_MT64x32x16_SE_AMAS3_GRVW2_TT4_4_USFGRO0_VW2_WG16_8_2_WGM1
    SolutionIndex: 266
    SolutionNameMin: Cijk_Ailk_Bjlk_SB_MT32x16x32_SE_AMAS1_GRVW1_TT4_2_USFGRO1_VW1_WG8_8_4_WGM1
    SolutionIndex: 267
    SolutionNameMin: Cijk_Ailk_Bjlk_SB_MT128x128x8_SE_AMAS3_GRVW1_TT8_8_USFGRO1_VW2_WG16_16_1_WGM1
    SolutionIndex: 268
    SolutionNameMin: Cijk_Ailk_Bjlk_SB_MT16x32x32_SE_AMAS1_GRVW1_TT2_4_USFGRO1_VW1_WG8_8_4_WGM1
    SolutionIndex: 269
    SolutionNameMin: Cijk_Ailk_Bjlk_SB_MT64x32x8_SE_AMAS3_GRVW4_TT4_2_USFGRO0_VW2_WG16_16_1_WGM1
    SolutionIndex: 270
    SolutionNameMin: Cijk_Ailk_Bjlk_SB_MT64x64x8_SE_AMAS3_GRVW1_TT4_4_USFGRO1_VW2_WG16_16_1_WGM1
    SolutionIndex: 271
    SolutionNameMin: Cijk_Ailk_Bjlk_SB_MT64x64x8_SE_AMAS3_GRVW4_TT4_4_USFGRO0_VW2_WG16_16_1_WGM8
    SolutionIndex: 272
    SolutionNameMin: Cijk_Ailk_Bjlk_SB_MT64x64x8_SE_AMAS3_GRVW4_TT4_4_USFGRO0_VW2_WG16_16_1_WGM1
    SolutionIndex: 273
    SolutionNameMin: Cijk_Ailk_Bjlk_SB_MT16x64x32_SE_AMAS3_GRVW2_TT2_4_USFGRO0_VW2_WG8_16_2_WGM1
    SolutionIndex: 274
    SolutionNameMin: Cijk_Ailk_Bjlk_SB_MT16x32x32_SE_AMAS3_GRVW2_TT2_4_USFGRO0_VW2_WG8_8_4_WGM8
    SolutionIndex: 275
    SolutionNameMin: Cijk_Ailk_Bjlk_SB_MT128x128x8_SE_AMAS3_GRVW4_TT8_8_USFGRO0_VW4_WG16_16_1_WGM1
    SolutionIndex: 276
    SolutionNameMin: Cijk_Ailk_Bjlk_SB_MT32x64x16_SE_AMAS3_GRVW2_TT4_4_USFGRO0_VW2_WG8_16_2_WGM8
    SolutionIndex: 277
    SolutionNameMin: Cijk_Ailk_Bjlk_SB_MT64x16x16_SE_AMAS3_GRVW1_TT4_2_USFGRO1_VW2_WG16_8_2_WGM1
    SolutionIndex: 278
    SolutionNameMin: Cijk_Ailk_Bjlk_SB_MT64x32x32_SE_AMAS3_GRVW4_TT4_4_USFGRO0_VW4_WG16_8_2_WGM8
    SolutionIndex: 279
    SolutionNameMin: Cijk_Ailk_Bjlk_SB_MT64x32x32_SE_AMAS3_GRVW2_TT4_4_USFGRO0_VW2_WG16_8_2_WGM1
    SolutionIndex: 280
    SolutionNameMin: Cijk_Ailk_Bjlk_SB_MT32x32x32_SE_AMAS3_GRVW4_TT4_4_USFGRO0_VW4_WG8_8_4_WGM1
    SolutionIndex: 281
    SolutionNameMin: Cijk_Ailk_Bjlk_SB_MT32x16x16_SE_AMAS3_GRVW2_TT4_2_USFGRO0_VW2_WG8_8_4_WGM1
    SolutionIndex: 282
    SolutionNameMin: Cijk_Ailk_Bjlk_SB_MT64x32x32_SE_AMAS3_GRVW4_TT4_4_USFGRO0_VW4_WG16_8_2_WGM8
    SolutionIndex: 283
    SolutionNameMin: Cijk_Ailk_Bjlk_SB_MT32x32x32_SE_AMAS3_GRVW2_TT4_4_USFGRO0_VW2_WG8_8_4_WGM1
    SolutionIndex: 284
    SolutionNameMin: Cijk_Ailk_Bjlk_SB_MT32x32x32_SE_AMAS3_GRVW1_TT4_4_USFGRO1_VW4_WG8_8_4_WGM1
    SolutionIndex: 285
    SolutionNameMin: Cijk_Ailk_Bjlk_SB_MT64x64x8_SE_AMAS1_GRVW1_TT4_4_USFGRO1_VW1_WG16_16_1_WGM1
    SolutionIndex: 286
    SolutionNameMin: Cijk_Ailk_Bjlk_SB_MT64x64x16_SE_AMAS3_GRVW2_TT4_4_USFGRO0_VW2_WG16_16_1_WGM1
    SolutionIndex: 287
    SolutionNameMin: Cijk_Ailk_Bjlk_SB_MT64x16x16_SE_AMAS3_GRVW2_TT4_2_USFGRO0_VW2_WG16_8_2_WGM8
    SolutionIndex: 288
    SolutionNameMin: Cijk_Ailk_Bjlk_SB_MT64x32x16_SE_AMAS3_GRVW2_TT4_4_USFGRO0_VW2_WG16_8_2_WGM8
    SolutionIndex: 289
    SolutionNameMin: Cijk_Ailk_Bjlk_SB_MT64x64x8_SE_AMAS3_GRVW1_TT4_4_USFGRO1_VW2_WG16_16_1_WGM8
    SolutionIndex: 290
    SolutionNameMin: Cijk_Ailk_Bjlk_SB_MT32x32x32_SE_AMAS3_GRVW2_TT4_4_USFGRO0_VW2_WG8_8_4_WGM8
    SolutionIndex: 291
    SolutionNameMin: Cijk_Ailk_Bjlk_SB_MT64x32x16_SE_AMAS3_GRVW2_TT4_4_USFGRO0_VW2_WG16_8_2_WGM8
    SolutionIndex: 292
    SolutionNameMin: Cijk_Ailk_Bjlk_SB_MT64x64x16_SE_AMAS3_GRVW4_TT4_4_USFGRO0_VW4_WG16_16_1_WGM1
    SolutionIndex: 293
    SolutionNameMin: Cijk_Ailk_Bjlk_SB_MT32x32x32_SE_AMAS3_GRVW4_TT4_4_USFGRO0_VW4_WG8_8_4_WGM8
    SolutionIndex: 294
    SolutionNameMin: Cijk_Ailk_Bjlk_SB_MT32x64x32_SE_AMAS3_GRVW2_TT4_4_USFGRO0_VW2_WG8_16_2_WGM1
    SolutionIndex: 295
    SolutionNameMin: Cijk_Ailk_Bjlk_SB_MT32x64x32_SE_AMAS3_GRVW4_TT4_4_USFGRO0_VW4_WG8_16_2_WGM1
    SolutionIndex: 296
    SolutionNameMin: Cijk_Ailk_Bjlk_SB_MT32x64x32_SE_AMAS3_GRVW2_TT4_8_USFGRO0_VW2_WG8_8_4_WGM1
    SolutionIndex: 297
    SolutionNameMin: Cijk_Ailk_Bjlk_SB_MT64x32x32_SE_AMAS3_GRVW2_TT8_4_USFGRO0_VW2_WG8_8_4_WGM1
    SolutionIndex: 298
    SolutionNameMin: Cijk_Ailk_Bjlk_SB_MT64x64x32_SE_AMAS3_GRVW2_TT8_4_USFGRO0_VW2_WG8_16_2_WGM8
    SolutionIndex: 299
    SolutionNameMin: Cijk_Ailk_Bjlk_SB_MT64x32x32_SE_AMAS3_GRVW2_TT8_4_USFGRO0_VW2_WG8_8_4_WGM8
    SolutionIndex: 300
    SolutionNameMin: Cijk_Ailk_Bjlk_SB_MT64x64x8_SE_DTL0_EPS1_FL0_GRVW1_PGR1_PLR0_TT4_4_USFGRO1_VW2_WG16_16_1_WGM8
    SolutionIndex: 301
    SolutionNameMin: Cijk_Ailk_Bjlk_SB_MT64x64x8_SE_DTL0_EPS0_FL0_GRVW1_PGR0_PLR1_TT4_4_USFGRO1_VW2_WG16_16_1_WGM1
    SolutionIndex: 302
    SolutionNameMin: Cijk_Ailk_Bjlk_SB_MT64x64x8_SE_DTL0_EPS1_FL0_GRVW1_PGR1_PLR1_TT4_4_USFGRO1_VW2_WG16_16_1_WGM1
    SolutionIndex: 303
    SolutionNameMin: Cijk_Ailk_Bjlk_SB_MT64x64x8_SE_DTL0_EPS1_FL0_GRVW1_PGR1_PLR1_TT4_4_USFGRO1_VW2_WG16_16_1_WGM8
    SolutionIndex: 304
    SolutionNameMin: Cijk_Ailk_Bjlk_SB_MT64x64x16_SE_DTL0_EPS0_FL0_GRVW1_PGR0_PLR1_TT4_4_USFGRO1_VW2_WG16_16_1_WGM1
    SolutionIndex: 305
    SolutionNameMin: Cijk_Ailk_Bjlk_SB_MT64x64x16_SE_DTL0_EPS0_FL0_GRVW1_PGR0_PLR1_TT4_4_USFGRO1_VW2_WG16_16_1_WGM8
    SolutionIndex: 306
    SolutionNameMin: Cijk_Ailk_Bjlk_SB_MT64x64x8_SE_DTL0_EPS1_FL0_GRVW1_PGR1_PLR0_TT4_4_USFGRO1_VW4_WG16_16_1_WGM1
    SolutionIndex: 307
    SolutionNameMin: Cijk_Ailk_Bjlk_SB_MT64x64x8_SE_DTL0_EPS0_FL0_GRVW1_PGR0_PLR0_TT4_4_USFGRO1_VW4_WG16_16_1_WGM8
    SolutionIndex: 308
    SolutionNameMin: Cijk_Ailk_Bjlk_SB_MT64x64x8_SE_DTL0_EPS1_FL0_GRVW1_PGR1_PLR0_TT4_4_USFGRO1_VW4_WG16_16_1_WGM8
    SolutionIndex: 309
    SolutionNameMin: Cijk_Ailk_Bjlk_SB_MT64x64x8_SE_DTL0_EPS0_FL0_GRVW1_PGR0_PLR1_TT4_4_USFGRO1_VW4_WG16_16_1_WGM1
    SolutionIndex: 310
    SolutionNameMin: Cijk_Ailk_Bjlk_SB_MT64x64x8_SE_DTL0_EPS1_FL0_GRVW1_PGR1_PLR1_TT4_4_USFGRO1_VW4_WG16_16_1_WGM8
    SolutionIndex: 311
    SolutionNameMin: Cijk_Ailk_Bjlk_SB_MT64x64x16_SE_DTL0_EPS0_FL0_GRVW1_PGR0_PLR1_TT4_4_USFGRO1_VW4_WG16_16_1_WGM1
    SolutionIndex: 312
    SolutionNameMin: Cijk_Ailk_Bjlk_SB_MT64x64x16_SE_DTL0_EPS1_FL0_GRVW1_PGR1_PLR1_TT4_4_USFGRO1_VW4_WG16_16_1_WGM1
    SolutionIndex: 313
    SolutionNameMin: Cijk_Ailk_Bjlk_SB_MT64x64x16_SE_DTL0_EPS0_FL0_GRVW1_PGR0_PLR1_TT4_4_USFGRO1_VW4_WG16_16_1_WGM8
    SolutionIndex: 314
    SolutionNameMin: Cijk_Ailk_Bjlk_SB_MT64x64x8_SE_DTL0_EPS1_FL0_GRVW2_PGR1_PLR1_TT4_4_USFGRO0_VW2_WG16_16_1_WGM1
    SolutionIndex: 315
    SolutionNameMin: Cijk_Ailk_Bjlk_SB_MT64x64x8_SE_DTL0_EPS1_FL0_GRVW2_PGR1_PLR1_TT4_4_USFGRO0_VW2_WG16_16_1_WGM8
    SolutionIndex: 316
    SolutionNameMin: Cijk_Ailk_Bjlk_SB_MT64x64x8_SE_DTL0_EPS1_FL0_GRVW4_PGR1_PLR1_TT4_4_USFGRO0_VW2_WG16_16_1_WGM1
    SolutionIndex: 317
    SolutionNameMin: Cijk_Ailk_Bjlk_SB_MT64x64x8_SE_DTL0_EPS1_FL0_GRVW4_PGR1_PLR1_TT4_4_USFGRO0_VW2_WG16_16_1_WGM8
    SolutionIndex: 318
    SolutionNameMin: Cijk_Ailk_Bjlk_SB_MT64x64x16_SE_DTL0_EPS1_FL0_GRVW4_PGR1_PLR1_TT4_4_USFGRO0_VW4_WG16_16_1_WGM1
    SolutionIndex: 319
    SolutionNameMin: Cijk_Ailk_Bjlk_SB_MT64x64x16_SE_DTL0_EPS1_FL0_GRVW4_PGR1_PLR1_TT4_4_USFGRO0_VW4_WG16_16_1_WGM8
    SolutionIndex: 320
    SolutionNameMin: Cijk_Ailk_Bjlk_SB_MT64x64x8_SE_DTL0_EPS1_FL1_GRVW2_PGR1_PLR1_TT4_4_USFGRO0_VW2_WG16_16_1_WGM8
    SolutionIndex: 321
    SolutionNameMin: Cijk_Ailk_Bjlk_SB_MT64x64x16_SE_DTL0_EPS1_FL1_GRVW4_PGR1_PLR1_TT4_4_USFGRO0_VW4_WG16_16_1_WGM8
    SolutionIndex: 322
    SolutionNameMin: Cijk_Ailk_Bjlk_SB_MT96x64x8_SE_DTL0_EPS1_FL0_GRVW1_PGR1_PLR1_TT6_4_USFGRO1_VW2_WG16_16_1_WGM1
    SolutionIndex: 323
    SolutionNameMin: Cijk_Ailk_Bjlk_SB_MT96x64x8_SE_DTL0_EPS1_FL0_GRVW1_PGR1_PLR1_TT6_4_USFGRO1_VW2_WG16_16_1_WGM8
    SolutionIndex: 324
    SolutionNameMin: Cijk_Ailk_Bjlk_SB_MT96x64x8_SE_DTL0_EPS1_FL1_GRVW2_PGR1_PLR1_TT6_4_USFGRO0_VW2_WG16_16_1_WGM1
    SolutionIndex: 325
    SolutionNameMin: Cijk_Ailk_Bjlk_SB_MT96x64x8_SE_DTL0_EPS1_FL1_GRVW2_PGR1_PLR1_TT6_4_USFGRO0_VW2_WG16_16_1_WGM8
    SolutionIndex: 326
    SolutionNameMin: Cijk_Ailk_Bjlk_SB_MT64x96x8_SE_DTL0_EPS1_FL0_GRVW1_PGR1_PLR1_TT4_6_USFGRO1_VW2_WG16_16_1_WGM8
    SolutionIndex: 327
    SolutionNameMin: Cijk_Ailk_Bjlk_SB_MT64x96x8_SE_DTL0_EPS1_FL1_GRVW2_PGR1_PLR1_TT4_6_USFGRO0_VW2_WG16_16_1_WGM1
    SolutionIndex: 328
    SolutionNameMin: Cijk_Ailk_Bjlk_SB_MT64x96x8_SE_DTL0_EPS1_FL1_GRVW2_PGR1_PLR1_TT4_6_USFGRO0_VW2_WG16_16_1_WGM8
    SolutionIndex: 329
    SolutionNameMin: Cijk_Ailk_Bjlk_SB_MT64x128x8_SE_DTL0_EPS1_FL0_GRVW1_PGR1_PLR0_TT4_8_USFGRO1_VW4_WG16_16_1_WGM1
    SolutionIndex: 330
    SolutionNameMin: Cijk_Ailk_Bjlk_SB_MT64x128x8_SE_DTL0_EPS1_FL0_GRVW1_PGR1_PLR0_TT4_8_USFGRO1_VW4_WG16_16_1_WGM8
    SolutionIndex: 331
    SolutionNameMin: Cijk_Ailk_Bjlk_SB_MT64x128x8_SE_DTL0_EPS1_FL0_GRVW2_PGR1_PLR0_TT4_8_USFGRO0_VW2_WG16_16_1_WGM1
    SolutionIndex: 332
    SolutionNameMin: Cijk_Ailk_Bjlk_SB_MT64x128x8_SE_DTL0_EPS1_FL0_GRVW2_PGR1_PLR0_TT4_8_USFGRO0_VW2_WG16_16_1_WGM8
    SolutionIndex: 333
    SolutionNameMin: Cijk_Ailk_Bjlk_SB_MT64x128x8_SE_DTL0_EPS1_FL0_GRVW2_PGR1_PLR1_TT4_8_USFGRO0_VW2_WG16_16_1_WGM1
    SolutionIndex: 334
    SolutionNameMin: Cijk_Ailk_Bjlk_SB_MT64x128x8_SE_DTL0_EPS1_FL0_GRVW2_PGR1_PLR1_TT4_8_USFGRO0_VW2_WG16_16_1_WGM8
    SolutionIndex: 335
    SolutionNameMin: Cijk_Ailk_Bjlk_SB_MT64x128x16_SE_DTL0_EPS0_FL0_GRVW4_PGR0_PLR0_TT4_8_USFGRO0_VW4_WG16_16_1_WGM8
    SolutionIndex: 336
    SolutionNameMin: Cijk_Ailk_Bjlk_SB_MT64x128x8_SE_DTL0_EPS1_FL1_GRVW2_PGR1_PLR1_TT4_8_USFGRO0_VW2_WG16_16_1_WGM1
    SolutionIndex: 337
    SolutionNameMin: Cijk_Ailk_Bjlk_SB_MT64x128x8_SE_DTL0_EPS1_FL1_GRVW2_PGR1_PLR1_TT4_8_USFGRO0_VW2_WG16_16_1_WGM8
    SolutionIndex: 338
    SolutionNameMin: Cijk_Ailk_Bjlk_SB_MT128x64x8_SE_DTL0_EPS1_FL0_GRVW1_PGR1_PLR0_TT8_4_USFGRO1_VW4_WG16_16_1_WGM1
    SolutionIndex: 339
    SolutionNameMin: Cijk_Ailk_Bjlk_SB_MT128x64x8_SE_DTL0_EPS1_FL0_GRVW1_PGR1_PLR0_TT8_4_USFGRO1_VW4_WG16_16_1_WGM8
    SolutionIndex: 340
    SolutionNameMin: Cijk_Ailk_Bjlk_SB_MT128x64x8_SE_DTL0_EPS1_FL0_GRVW1_PGR1_PLR1_TT8_4_USFGRO1_VW4_WG16_16_1_WGM8
    SolutionIndex: 341
    SolutionNameMin: Cijk_Ailk_Bjlk_SB_MT128x64x8_SE_DTL0_EPS1_FL0_GRVW2_PGR1_PLR0_TT8_4_USFGRO0_VW2_WG16_16_1_WGM1
    SolutionIndex: 342
    SolutionNameMin: Cijk_Ailk_Bjlk_SB_MT128x64x8_SE_DTL0_EPS1_FL1_GRVW2_PGR1_PLR1_TT8_4_USFGRO0_VW2_WG16_16_1_WGM8
    SolutionIndex: 343
    SolutionNameMin: Cijk_Ailk_Bjlk_SB_MT32x64x16_SE_DTL0_EPS0_FL0_GRVW1_PGR0_PLR1_TT2_4_USFGRO1_VW2_WG16_16_1_WGM1
    SolutionIndex: 344
    SolutionNameMin: Cijk_Ailk_Bjlk_SB_MT32x64x16_SE_DTL0_EPS0_FL0_GRVW1_PGR0_PLR1_TT2_4_USFGRO1_VW2_WG16_16_1_WGM8
    SolutionIndex: 345
    SolutionNameMin: Cijk_Ailk_Bjlk_SB_MT32x64x8_SE_DTL0_EPS1_FL0_GRVW4_PGR1_PLR1_TT2_4_USFGRO0_VW2_WG16_16_1_WGM8
    SolutionIndex: 346
    SolutionNameMin: Cijk_Ailk_Bjlk_SB_MT32x64x16_SE_DTL0_EPS1_FL0_GRVW1_PGR1_PLR1_TT4_4_USFGRO1_VW2_WG8_16_2_WGM1
    SolutionIndex: 347
    SolutionNameMin: Cijk_Ailk_Bjlk_SB_MT32x64x16_SE_DTL0_EPS1_FL0_GRVW1_PGR1_PLR1_TT4_4_USFGRO1_VW4_WG8_16_2_WGM1
    SolutionIndex: 348
    SolutionNameMin: Cijk_Ailk_Bjlk_SB_MT32x32x8_SE_DTL0_EPS1_FL0_GRVW4_PGR1_PLR1_TT2_4_USFGRO1_VW2_WG16_8_2_WGM1
    SolutionIndex: 349
    SolutionNameMin: Cijk_Ailk_Bjlk_SB_MT32x32x16_SE_DTL0_EPS1_FL1_GRVW4_PGR1_PLR1_TT2_4_USFGRO0_VW2_WG16_8_2_WGM1
    SolutionIndex: 350
    SolutionNameMin: Cijk_Ailk_Bjlk_SB_MT64x32x16_SE_DTL0_EPS1_FL0_GRVW1_PGR1_PLR1_TT4_4_USFGRO1_VW4_WG16_8_2_WGM1
    SolutionIndex: 351
    SolutionNameMin: Cijk_Ailk_Bjlk_SB_MT8x32x32_SE_DTL0_EPS1_FL0_GRVW1_PGR1_PLR1_TT2_2_USFGRO1_VW2_WG4_16_4_WGM1
    SolutionIndex: 352
    SolutionNameMin: Cijk_Ailk_Bjlk_SB_MT16x32x32_SE_DTL0_EPS1_FL1_GRVW2_PGR1_PLR1_TT4_2_USFGRO0_VW2_WG4_16_4_WGM1
    SolutionIndex: 353
    SolutionNameMin: Cijk_Ailk_Bjlk_SB_MT16x64x16_SE_DTL0_EPS1_FL0_GRVW4_PGR1_PLR1_TT4_4_USFGRO0_VW4_WG4_16_4_WGM8
    SolutionIndex: 354
    SolutionNameMin: Cijk_Ailk_Bjlk_SB_MT32x16x32_SE_DTL0_EPS1_FL0_GRVW1_PGR1_PLR1_TT2_4_USFGRO1_VW2_WG16_4_4_WGM1
    SolutionIndex: 355
    SolutionNameMin: Cijk_Ailk_Bjlk_SB_MT32x16x16_SE_DTL0_EPS1_FL0_GRVW2_PGR1_PLR1_TT2_4_USFGRO0_VW2_WG16_4_4_WGM1
    SolutionIndex: 356
    SolutionNameMin: Cijk_Ailk_Bjlk_SB_MT64x16x16_SE_DTL0_EPS1_FL0_GRVW4_PGR1_PLR1_TT4_4_USFGRO0_VW4_WG16_4_4_WGM1
    SolutionIndex: 357
    SolutionNameMin: Cijk_Ailk_Bjlk_SB_MT64x16x16_SE_DTL0_EPS1_FL0_GRVW4_PGR1_PLR1_TT4_4_USFGRO0_VW4_WG16_4_4_WGM8
    SolutionIndex: 358
    SolutionNameMin: Cijk_Ailk_Bjlk_SB_MT64x16x32_SE_DTL0_EPS1_FL1_GRVW2_PGR1_PLR1_TT4_4_USFGRO0_VW2_WG16_4_4_WGM1
    SolutionIndex: 359
    SolutionNameMin: Cijk_Ailk_Bjlk_SB_MT64x32x8_SE_DTL0_EPS0_FL0_GRVW1_PGR0_PLR1_TT4_4_USFGRO1_VW4_WG16_8_1_WGM1
    SolutionIndex: 360
    SolutionNameMin: Cijk_Ailk_Bjlk_SB_MT64x32x8_SE_DTL0_EPS0_FL0_GRVW1_PGR0_PLR1_TT4_4_USFGRO1_VW4_WG16_8_1_WGM8
    SolutionIndex: 361
    SolutionNameMin: Cijk_Ailk_Bjlk_SB_MT64x32x16_SE_DTL0_EPS0_FL0_GRVW2_PGR0_PLR1_TT4_4_USFGRO0_VW2_WG16_8_1_WGM8
    SolutionIndex: 362
    SolutionNameMin: Cijk_Ailk_Bjlk_SB_MT64x64x8_SE_DTL0_EPS1_FL0_GRVW1_PGR1_PLR0_TT4_8_USFGRO1_VW2_WG16_8_1_WGM1
    SolutionIndex: 363
    SolutionNameMin: Cijk_Ailk_Bjlk_SB_MT64x64x8_SE_DTL0_EPS1_FL0_GRVW1_PGR1_PLR0_TT4_8_USFGRO1_VW4_WG16_8_1_WGM1
    SolutionIndex: 364
    SolutionNameMin: Cijk_Ailk_Bjlk_SB_MT64x64x8_SE_DTL0_EPS1_FL0_GRVW1_PGR1_PLR0_TT4_8_USFGRO1_VW4_WG16_8_1_WGM8
    SolutionIndex: 365
    SolutionNameMin: Cijk_Ailk_Bjlk_SB_MT64x64x8_SE_DTL0_EPS1_FL0_GRVW4_PGR1_PLR0_TT4_8_USFGRO0_VW4_WG16_8_1_WGM1
    SolutionIndex: 366
    SolutionNameMin: Cijk_Ailk_Bjlk_SB_MT64x64x8_SE_DTL0_EPS1_FL0_GRVW4_PGR1_PLR0_TT4_8_USFGRO0_VW4_WG16_8_1_WGM8
    SolutionIndex: 367
    SolutionNameMin: Cijk_Ailk_Bjlk_SB_MT64x64x8_SE_DTL0_EPS1_FL1_GRVW4_PGR1_PLR0_TT4_8_USFGRO0_VW4_WG16_8_1_WGM8
    SolutionIndex: 368
    SolutionNameMin: Cijk_Ailk_Bjlk_SB_MT64x64x8_SE_DTL0_EPS1_FL1_GRVW4_PGR1_PLR1_TT4_8_USFGRO0_VW4_WG16_8_1_WGM8
    SolutionIndex: 369
    SolutionNameMin: Cijk_Ailk_Bjlk_SB_MT128x32x8_SE_DTL1_EPS0_FL0_GRVW1_PGR0_PLR1_TT8_4_USFGRO1_VW4_WG16_8_1_WGM8
    SolutionIndex: 370
    SolutionNameMin: Cijk_Ailk_Bjlk_SB_MT32x64x16_SE_DTL0_EPS0_FL0_GRVW2_PGR0_PLR1_TT4_4_USFGRO0_VW2_WG8_16_1_WGM8
    SolutionIndex: 371
    SolutionNameMin: Cijk_Ailk_Bjlk_SB_MT32x64x8_SE_DTL0_EPS1_FL1_GRVW2_PGR1_PLR1_TT4_4_USFGRO0_VW2_WG8_16_1_WGM1
    SolutionIndex: 372
    SolutionNameMin: Cijk_Ailk_Bjlk_SB_MT32x64x16_SE_DTL0_EPS0_FL1_GRVW2_PGR0_PLR1_TT4_4_USFGRO0_VW2_WG8_16_1_WGM1
    SolutionIndex: 373
    SolutionNameMin: Cijk_Ailk_Bjlk_SB_MT32x128x8_SE_DTL1_EPS0_FL0_GRVW1_PGR0_PLR1_TT4_8_USFGRO1_VW4_WG8_16_1_WGM1
    SolutionIndex: 374
    SolutionNameMin: Cijk_Ailk_Bjlk_SB_MT64x64x8_SE_DTL0_EPS1_FL0_GRVW4_PGR1_PLR0_TT8_4_USFGRO0_VW4_WG8_16_1_WGM1
    SolutionIndex: 375
    SolutionNameMin: Cijk_Ailk_Bjlk_SB_MT64x64x8_SE_DTL0_EPS1_FL0_GRVW4_PGR1_PLR0_TT8_4_USFGRO0_VW4_WG8_16_1_WGM8
    SolutionIndex: 376
    SolutionNameMin: Cijk_Ailk_Bjlk_SB_MT64x64x8_SE_DTL0_EPS1_FL1_GRVW4_PGR1_PLR0_TT8_4_USFGRO0_VW4_WG8_16_1_WGM1
    SolutionIndex: 377
    SolutionNameMin: Cijk_Ailk_Bjlk_SB_MT64x128x8_SE_DTL0_EPS1_FL1_GRVW2_PGR1_PLR1_TT8_8_USFGRO0_VW2_WG8_16_1_WGM8
    SolutionIndex: 378
    SolutionNameMin: Cijk_Ailk_Bjlk_SB_MT64x128x8_SE_DTL0_EPS1_FL1_GRVW4_PGR1_PLR0_TT8_8_USFGRO0_VW4_WG8_16_1_WGM8
    SolutionIndex: 379
    SolutionNameMin: Cijk_Ailk_Bjlk_SB_MT64x64x8_SE_DTL0_EPS1_FL0_GRVW1_PGR1_PLR0_TT4_4_USFGRO1_VW4_WG16_16_1_WGM1
    SolutionIndex: 380
    SolutionNameMin: Cijk_Ailk_Bjlk_SB_MT64x64x8_SE_DTL0_EPS1_FL0_GRVW1_PGR1_PLR0_TT4_4_USFGRO1_VW4_WG16_16_1_WGM8
    SolutionIndex: 381
    SolutionNameMin: Cijk_Ailk_Bjlk_SB_MT64x64x16_SE_DTL0_EPS0_FL0_GRVW1_PGR0_PLR1_TT4_4_USFGRO1_VW4_WG16_16_1_WGM1
    SolutionIndex: 382
    SolutionNameMin: Cijk_Ailk_Bjlk_SB_MT64x64x16_SE_DTL0_EPS1_FL0_GRVW1_PGR1_PLR1_TT4_4_USFGRO1_VW4_WG16_16_1_WGM8
    SolutionIndex: 383
    SolutionNameMin: Cijk_Ailk_Bjlk_SB_MT64x128x8_SE_DTL0_EPS1_FL0_GRVW1_PGR1_PLR1_TT4_8_USFGRO1_VW2_WG16_16_1_WGM8
    SolutionIndex: 384
    SolutionNameMin: Cijk_Ailk_Bjlk_SB_MT64x128x8_SE_DTL0_EPS1_FL0_GRVW1_PGR1_PLR0_TT4_8_USFGRO1_VW4_WG16_16_1_WGM1
    SolutionIndex: 385
    SolutionNameMin: Cijk_Ailk_Bjlk_SB_MT64x128x8_SE_DTL0_EPS1_FL0_GRVW1_PGR1_PLR0_TT4_8_USFGRO1_VW4_WG16_16_1_WGM8
    SolutionIndex: 386
    SolutionNameMin: Cijk_Ailk_Bjlk_SB_MT64x128x8_SE_DTL0_EPS1_FL1_GRVW2_PGR1_PLR0_TT4_8_USFGRO0_VW2_WG16_16_1_WGM8
    SolutionIndex: 387
    SolutionNameMin: Cijk_Ailk_Bjlk_SB_MT64x128x8_SE_DTL0_EPS1_FL1_GRVW2_PGR1_PLR1_TT4_8_USFGRO0_VW2_WG16_16_1_WGM1
    SolutionIndex: 388
    SolutionNameMin: Cijk_Ailk_Bjlk_SB_MT64x128x8_SE_DTL0_EPS1_FL1_GRVW2_PGR1_PLR1_TT4_8_USFGRO0_VW2_WG16_16_1_WGM8
    SolutionIndex: 389
    SolutionNameMin: Cijk_Ailk_Bjlk_SB_MT128x64x16_SE_DTL0_EPS0_FL0_GRVW1_PGR0_PLR1_TT8_4_USFGRO1_VW4_WG16_16_1_WGM1
    SolutionIndex: 390
    SolutionNameMin: Cijk_Ailk_Bjlk_SB_MT64x64x8_SE_DTL0_EPS1_FL0_GRVW4_PGR1_PLR0_TT4_8_USFGRO0_VW4_WG16_8_1_WGM1
    SolutionIndex: 391
    SolutionNameMin: Cijk_Ailk_Bjlk_SB_MT64x64x8_SE_DTL0_EPS1_FL0_GRVW4_PGR1_PLR0_TT4_8_USFGRO0_VW4_WG16_8_1_WGM8
    SolutionIndex: 392
    SolutionNameMin: Cijk_Ailk_Bjlk_SB_MT128x32x8_SE_DTL1_EPS0_FL0_GRVW1_PGR0_PLR1_TT8_4_USFGRO1_VW4_WG16_8_1_WGM8
    SolutionIndex: 393
    SolutionNameMin: Cijk_Ailk_Bjlk_SB_MT64x64x8_SE_DTL0_EPS1_FL0_GRVW4_PGR1_PLR0_TT8_4_USFGRO0_VW4_WG8_16_1_WGM1
    SolutionIndex: 394
    SolutionNameMin: Cijk_Ailk_Bjlk_SB_MT64x64x8_SE_DTL0_EPS1_FL1_GRVW4_PGR1_PLR0_TT8_4_USFGRO0_VW4_WG8_16_1_WGM1
    SolutionIndex: 395
    SolutionNameMin: Cijk_Ailk_Bjlk_SB_MT64x64x8_SE_EPS1_FL0_GRVW2_NLCA1_NLCB1_PGR1_PLR1_TT4_4_USFGRO0_VW2_WGM8
    SolutionIndex: 396
    SolutionNameMin: Cijk_Ailk_Bjlk_SB_MT96x64x8_SE_EPS1_FL1_GRVW2_NLCA1_NLCB1_PGR1_PLR1_TT6_4_USFGRO0_VW2_WGM8
    SolutionIndex: 397
    SolutionNameMin: Cijk_Ailk_Bjlk_SB_MT128x64x8_SE_EPS1_FL0_GRVW2_NLCA1_NLCB1_PGR1_PLR1_TT8_4_USFGRO0_VW2_WGM8
    SolutionIndex: 398
    SolutionNameMin: Cijk_Ailk_Bjlk_SB_MT128x64x8_SE_EPS1_FL1_GRVW2_NLCA1_NLCB1_PGR1_PLR0_TT8_4_USFGRO0_VW2_WGM8
    SolutionIndex: 399
    SolutionNameMin: Cijk_Ailk_Bjlk_SB_MT64x64x16_SE_AMAS3_DTL0_EPS1_GRVW4_GSU1_NLCA1_NLCB1_PBD0_PGR1_PLR1_TT4_4_USFGRO0_VW4_WG16_16_1_WGM8
    SolutionIndex: 400
    SolutionNameMin: Cijk_Ailk_Bjlk_SB_MT96x64x8_SE_AMAS3_DTL0_EPS1_GRVW2_GSU1_NLCA1_NLCB1_PBD1_PGR1_PLR1_TT6_4_USFGRO0_VW2_WG16_16_1_WGM8
    SolutionIndex: 401
    SolutionNameMin: Cijk_Ailk_Bjlk_SB_MT64x128x8_SE_AMAS3_DTL0_EPS1_GRVW4_GSU1_NLCA1_NLCB1_PBD0_PGR1_PLR1_TT4_8_USFGRO0_VW4_WG16_16_1_WGM1
    SolutionIndex: 402
    SolutionNameMin: Cijk_Ailk_Bjlk_SB_MT64x128x8_SE_AMAS3_DTL0_EPS1_GRVW4_GSU1_NLCA1_NLCB1_PBD1_PGR1_PLR1_TT4_8_USFGRO0_VW4_WG16_16_1_WGM1
    SolutionIndex: 403
    SolutionNameMin: Cijk_Ailk_Bjlk_SB_MT64x128x8_SE_AMAS3_DTL0_EPS1_GRVW4_GSU1_NLCA1_NLCB1_PBD0_PGR1_PLR1_TT4_8_USFGRO0_VW4_WG16_16_1_WGM8
    SolutionIndex: 404
    SolutionNameMin: Cijk_Ailk_Bjlk_SB_MT64x128x8_SE_AMAS3_DTL0_EPS1_GRVW4_GSU1_NLCA1_NLCB1_PBD1_PGR1_PLR1_TT4_8_USFGRO0_VW4_WG16_16_1_WGM8
    SolutionIndex: 405
    SolutionNameMin: Cijk_Ailk_Bjlk_SB_MT64x64x8_SE_AMAS3_DTL0_EPS1_GRVW4_GSU1_NLCA1_NLCB1_PBD0_PGR1_PLR1_TT8_4_USFGRO0_VW4_WG8_16_1_WGM1
    SolutionIndex: 406
    SolutionNameMin: Cijk_Ailk_Bjlk_SB_MT64x64x8_SE_AMAS3_DTL0_EPS1_GRVW1_GSU1_NLCA1_NLCB1_PBD0_PGR1_PLR0_TT4_4_USFGRO1_VW4_WG16_16_1_WGM1
    SolutionIndex: 407
    SolutionNameMin: Cijk_Ailk_Bjlk_SB_MT64x64x8_SE_AMAS3_DTL0_EPS1_GRVW1_GSU1_NLCA1_NLCB1_PBD0_PGR1_PLR0_TT4_4_USFGRO1_VW4_WG16_16_1_WGM8
    SolutionIndex: 408
    SolutionNameMin: Cijk_Ailk_Bjlk_SB_MT64x64x16_SE_AMAS3_DTL0_EPS0_GRVW1_GSU1_NLCA1_NLCB1_PBD0_PGR0_PLR1_TT4_4_USFGRO1_VW4_WG16_16_1_WGM1
    SolutionIndex: 409
    SolutionNameMin: Cijk_Ailk_Bjlk_SB_MT64x128x8_SE_AMAS1_DTL0_EPS1_GRVW1_GSU1_NLCA1_NLCB1_PBD1_PGR1_PLR0_TT4_8_USFGRO0_VW1_WG16_16_1_WGM8
    SolutionIndex: 410
    SolutionNameMin: Cijk_Ailk_Bjlk_SB_MT64x96x8_SE_AMAS1_DTL0_EPS1_GRVW1_GSU1_NLCA1_NLCB3_PBD1_PGR1_PLR1_TT4_6_USFGRO0_VW1_WG16_16_1_WGM8
    SolutionIndex: 411
    SolutionNameMin: Cijk_Ailk_Bjlk_SB_MT128x32x8_SE_AMAS3_DTL1_EPS0_GRVW1_GSU1_NLCA1_NLCB1_PBD0_PGR0_PLR1_TT8_4_USFGRO1_VW4_WG16_8_1_WGM8
    SolutionIndex: 412
    SolutionNameMin: Cijk_Ailk_Bjlk_SB_MT128x64x8_SE_AMAS1_DTL1_EPS1_GRVW1_GSU1_NLCA1_NLCB1_PBD1_PGR1_PLR0_TT8_8_USFGRO0_VW1_WG16_8_1_WGM1
    SolutionIndex: 413
    SolutionNameMin: Cijk_Ailk_Bjlk_SB_MT64x64x16_SE_EPS1_FL1_GRVW2_NLCA1_NLCB1_PGR1_PLR1_TT4_4_USFGRO0_VW2_WGM8
    SolutionIndex: 414
    SolutionNameMin: Cijk_Ailk_Bjlk_SB_MT64x128x8_SE_EPS1_FL1_GRVW2_NLCA1_NLCB1_PGR1_PLR1_TT4_8_USFGRO0_VW2_WGM1
    SolutionIndex: 415
    SolutionNameMin: Cijk_Ailk_Bjlk_SB_MT128x64x16_SE_EPS0_FL0_GRVW4_NLCA1_NLCB1_PGR0_PLR1_TT8_4_USFGRO0_VW4_WGM8
    SolutionIndex: 416
    SolutionNameMin: Cijk_Ailk_Bjlk_SB_MT128x128x8_SE_EPS1_FL0_GRVW1_NLCA1_NLCB1_PGR1_PLR1_TT8_8_USFGRO1_VW2_WGM1
    SolutionIndex: 417
    SolutionNameMin: Cijk_Ailk_Bjlk_SB_MT64x64x8_SE_DTL0_EPS1_FL1_GRVW4_PGR1_PLR0_TT4_4_USFGRO0_VW2_WG16_16_1_WGM1
    SolutionIndex: 418
    SolutionNameMin: Cijk_Ailk_Bjlk_SB_MT64x64x16_SE_DTL0_EPS1_FL0_GRVW1_PGR1_PLR1_TT4_4_USFGRO1_VW4_WG16_16_1_WGM1
    SolutionIndex: 419
    SolutionNameMin: Cijk_Ailk_Bjlk_SB_MT64x64x8_SE_DTL0_EPS1_FL0_GRVW4_PGR1_PLR1_TT4_4_USFGRO0_VW2_WG16_16_1_WGM8
    SolutionIndex: 420
    SolutionNameMin: Cijk_Ailk_Bjlk_SB_MT64x64x8_SE_DTL0_EPS1_FL1_GRVW2_PGR1_PLR1_TT4_4_USFGRO0_VW2_WG16_16_1_WGM1
    SolutionIndex: 421
    SolutionNameMin: Cijk_Ailk_Bjlk_SB_MT64x128x8_SE_DTL0_EPS1_FL0_GRVW2_PGR1_PLR1_TT4_8_USFGRO0_VW2_WG16_16_1_WGM8
    SolutionIndex: 422
    SolutionNameMin: Cijk_Ailk_Bjlk_SB_MT64x128x8_SE_DTL0_EPS1_FL1_GRVW2_PGR1_PLR1_TT4_8_USFGRO0_VW2_WG16_16_1_WGM8
    SolutionIndex: 423
    SolutionNameMin: Cijk_Ailk_Bjlk_SB_MT128x64x8_SE_DTL0_EPS1_FL0_GRVW2_PGR1_PLR1_TT8_4_USFGRO0_VW2_WG16_16_1_WGM1
    SolutionIndex: 424
    SolutionNameMin: Cijk_Ailk_Bjlk_SB_MT128x64x8_SE_DTL0_EPS1_FL0_GRVW2_PGR1_PLR1_TT8_4_USFGRO0_VW2_WG16_16_1_WGM8
    SolutionIndex: 425
    SolutionNameMin: Cijk_Ailk_Bjlk_SB_MT128x64x8_SE_DTL0_EPS1_FL1_GRVW2_PGR1_PLR1_TT8_4_USFGRO0_VW2_WG16_16_1_WGM1
    SolutionIndex: 426
    SolutionNameMin: Cijk_Ailk_Bjlk_SB_MT128x64x8_SE_DTL0_EPS1_FL1_GRVW2_PGR1_PLR1_TT8_4_USFGRO0_VW2_WG16_16_1_WGM8
    SolutionIndex: 427
    SolutionNameMin: Cijk_Ailk_Bjlk_SB_MT64x32x32_SE_DTL0_EPS0_FL0_GRVW1_PGR0_PLR1_TT4_2_USFGRO1_VW2_WG16_16_1_WGM8
    SolutionIndex: 428
    SolutionNameMin: Cijk_Ailk_Bjlk_SB_MT32x64x32_SE_DTL0_EPS1_FL0_GRVW4_PGR1_PLR1_TT4_4_USFGRO0_VW4_WG8_16_2_WGM1
    SolutionIndex: 429
    SolutionNameMin: Cijk_Ailk_Bjlk_SB_MT32x64x32_SE_DTL0_EPS1_FL1_GRVW4_PGR1_PLR1_TT4_4_USFGRO0_VW4_WG8_16_2_WGM1
    SolutionIndex: 430
    SolutionNameMin: Cijk_Ailk_Bjlk_SB_MT64x32x32_SE_DTL0_EPS1_FL0_GRVW4_PGR1_PLR1_TT4_4_USFGRO0_VW4_WG16_8_2_WGM1
    SolutionIndex: 431
    SolutionNameMin: Cijk_Ailk_Bjlk_SB_MT64x32x32_SE_DTL0_EPS1_FL0_GRVW4_PGR1_PLR1_TT4_4_USFGRO0_VW4_WG16_8_2_WGM8
    SolutionIndex: 432
    SolutionNameMin: Cijk_Ailk_Bjlk_SB_MT64x32x32_SE_DTL0_EPS1_FL1_GRVW4_PGR1_PLR1_TT4_4_USFGRO0_VW4_WG16_8_2_WGM1
    SolutionIndex: 433
    SolutionNameMin: Cijk_Ailk_Bjlk_SB_MT64x32x32_SE_DTL0_EPS1_FL1_GRVW4_PGR1_PLR1_TT4_4_USFGRO0_VW4_WG16_8_2_WGM8
    SolutionIndex: 434
    SolutionNameMin: Cijk_Ailk_Bjlk_SB_MT64x32x8_SE_DTL0_EPS0_FL0_GRVW1_PGR0_PLR0_TT4_4_USFGRO1_VW2_WG16_8_1_WGM1
    SolutionIndex: 435
    SolutionNameMin: Cijk_Ailk_Bjlk_SB_MT64x32x8_SE_DTL0_EPS0_FL0_GRVW1_PGR0_PLR1_TT4_4_USFGRO1_VW2_WG16_8_1_WGM1
    SolutionIndex: 436
    SolutionNameMin: Cijk_Ailk_Bjlk_SB_MT64x32x8_SE_DTL0_EPS0_FL0_GRVW1_PGR0_PLR1_TT4_4_USFGRO1_VW2_WG16_8_1_WGM8
    SolutionIndex: 437
    SolutionNameMin: Cijk_Ailk_Bjlk_SB_MT64x32x8_SE_DTL0_EPS0_FL0_GRVW1_PGR0_PLR1_TT4_4_USFGRO1_VW4_WG16_8_1_WGM1
    SolutionIndex: 438
    SolutionNameMin: Cijk_Ailk_Bjlk_SB_MT64x32x8_SE_DTL0_EPS0_FL1_GRVW2_PGR0_PLR1_TT4_4_USFGRO0_VW2_WG16_8_1_WGM8
    SolutionIndex: 439
    SolutionNameMin: Cijk_Ailk_Bjlk_SB_MT64x32x8_SE_DTL0_EPS1_FL0_GRVW2_PGR1_PLR1_TT4_4_USFGRO0_VW2_WG16_8_1_WGM1
    SolutionIndex: 440
    SolutionNameMin: Cijk_Ailk_Bjlk_SB_MT64x32x8_SE_DTL0_EPS1_FL0_GRVW2_PGR1_PLR1_TT4_4_USFGRO0_VW2_WG16_8_1_WGM8
    SolutionIndex: 441
    SolutionNameMin: Cijk_Ailk_Bjlk_SB_MT64x32x8_SE_DTL0_EPS1_FL1_GRVW2_PGR1_PLR1_TT4_4_USFGRO0_VW2_WG16_8_1_WGM1
    SolutionIndex: 442
    SolutionNameMin: Cijk_Ailk_Bjlk_SB_MT64x16x8_SE_DTL0_EPS0_FL0_GRVW1_PGR0_PLR0_TT4_2_USFGRO1_VW2_WG16_8_1_WGM1
    SolutionIndex: 443
    SolutionNameMin: Cijk_Ailk_Bjlk_SB_MT64x16x16_SE_DTL0_EPS0_FL0_GRVW1_PGR0_PLR0_TT4_2_USFGRO1_VW2_WG16_8_1_WGM8
    SolutionIndex: 444
    SolutionNameMin: Cijk_Ailk_Bjlk_SB_MT64x16x8_SE_DTL0_EPS0_FL0_GRVW1_PGR0_PLR1_TT4_2_USFGRO1_VW2_WG16_8_1_WGM1
    SolutionIndex: 445
    SolutionNameMin: Cijk_Ailk_Bjlk_SB_MT64x16x8_SE_DTL0_EPS0_FL0_GRVW1_PGR0_PLR1_TT4_2_USFGRO1_VW2_WG16_8_1_WGM8
    SolutionIndex: 446
    SolutionNameMin: Cijk_Ailk_Bjlk_SB_MT64x16x8_SE_DTL0_EPS0_FL0_GRVW2_PGR0_PLR1_TT4_2_USFGRO0_VW2_WG16_8_1_WGM1
    SolutionIndex: 447
    SolutionNameMin: Cijk_Ailk_Bjlk_SB_MT64x16x16_SE_DTL0_EPS0_FL0_GRVW2_PGR0_PLR1_TT4_2_USFGRO0_VW2_WG16_8_1_WGM1
    SolutionIndex: 448
    SolutionNameMin: Cijk_Ailk_Bjlk_SB_MT64x16x16_SE_DTL0_EPS0_FL0_GRVW2_PGR0_PLR1_TT4_2_USFGRO0_VW2_WG16_8_1_WGM8
    SolutionIndex: 449
    SolutionNameMin: Cijk_Ailk_Bjlk_SB_MT64x16x16_SE_DTL0_EPS0_FL1_GRVW2_PGR0_PLR1_TT4_2_USFGRO0_VW2_WG16_8_1_WGM1
    SolutionIndex: 450
    SolutionNameMin: Cijk_Ailk_Bjlk_SB_MT64x64x8_SE_DTL0_EPS1_FL0_GRVW4_PGR1_PLR0_TT4_8_USFGRO0_VW4_WG16_8_1_WGM1
    SolutionIndex: 451
    SolutionNameMin: Cijk_Ailk_Bjlk_SB_MT64x64x8_SE_DTL0_EPS1_FL0_GRVW1_PGR1_PLR1_TT4_4_USFGRO1_VW2_WG16_16_1_WGM8
    SolutionIndex: 452
    SolutionNameMin: Cijk_Ailk_Bjlk_SB_MT64x64x16_SE_DTL0_EPS0_FL0_GRVW1_PGR0_PLR1_TT4_4_USFGRO1_VW4_WG16_16_1_WGM1
    SolutionIndex: 453
    SolutionNameMin: Cijk_Ailk_Bjlk_SB_MT64x64x8_SE_DTL0_EPS1_FL0_GRVW1_PGR1_PLR0_TT4_4_USFGRO1_VW4_WG16_16_1_WGM1
    SolutionIndex: 454
    SolutionNameMin: Cijk_Ailk_Bjlk_SB_MT64x64x8_SE_DTL0_EPS1_FL0_GRVW1_PGR1_PLR0_TT4_4_USFGRO1_VW4_WG16_16_1_WGM8
    SolutionIndex: 455
    SolutionNameMin: Cijk_Ailk_Bjlk_SB_MT64x64x16_SE_DTL0_EPS0_FL0_GRVW1_PGR0_PLR1_TT4_4_USFGRO1_VW4_WG16_16_1_WGM8
    SolutionIndex: 456
    SolutionNameMin: Cijk_Ailk_Bjlk_SB_MT64x128x8_SE_DTL0_EPS1_FL0_GRVW1_PGR1_PLR0_TT4_8_USFGRO1_VW4_WG16_16_1_WGM1
    SolutionIndex: 457
    SolutionNameMin: Cijk_Ailk_Bjlk_SB_MT64x128x8_SE_DTL0_EPS1_FL0_GRVW1_PGR1_PLR0_TT4_8_USFGRO1_VW4_WG16_16_1_WGM8
    SolutionIndex: 458
    SolutionNameMin: Cijk_Ailk_Bjlk_SB_MT64x128x8_SE_DTL0_EPS1_FL0_GRVW2_PGR1_PLR1_TT4_8_USFGRO0_VW2_WG16_16_1_WGM1
    SolutionIndex: 459
    SolutionNameMin: Cijk_Ailk_Bjlk_SB_MT64x128x8_SE_DTL0_EPS1_FL0_GRVW2_PGR1_PLR1_TT4_8_USFGRO0_VW2_WG16_16_1_WGM8
    SolutionIndex: 460
    SolutionNameMin: Cijk_Ailk_Bjlk_SB_MT64x128x8_SE_DTL0_EPS1_FL1_GRVW2_PGR1_PLR1_TT4_8_USFGRO0_VW2_WG16_16_1_WGM1
    SolutionIndex: 461
    SolutionNameMin: Cijk_Ailk_Bjlk_SB_MT64x64x8_SE_DTL0_EPS1_FL0_GRVW4_PGR1_PLR0_TT4_8_USFGRO0_VW4_WG16_8_1_WGM1
    SolutionIndex: 462
    SolutionNameMin: Cijk_Ailk_Bjlk_SB_MT64x64x8_SE_DTL0_EPS1_FL1_GRVW4_PGR1_PLR0_TT4_8_USFGRO0_VW4_WG16_8_1_WGM1
    SolutionIndex: 463
    SolutionNameMin: Cijk_Ailk_Bjlk_SB_MT64x64x8_SE_DTL0_EPS1_FL1_GRVW4_PGR1_PLR0_TT4_8_USFGRO0_VW4_WG16_8_1_WGM8
    SolutionIndex: 464
    SolutionNameMin: Cijk_Ailk_Bjlk_SB_MT128x32x8_SE_DTL1_EPS0_FL0_GRVW1_PGR0_PLR1_TT8_4_USFGRO1_VW4_WG16_8_1_WGM8
    SolutionIndex: 465
    SolutionNameMin: Cijk_Ailk_Bjlk_SB_MT32x128x8_SE_DTL1_EPS0_FL0_GRVW1_PGR0_PLR1_TT4_8_USFGRO1_VW4_WG8_16_1_WGM1
    SolutionIndex: 466
    SolutionNameMin: Cijk_Ailk_Bjlk_SB_MT64x64x8_SE_DTL0_EPS1_FL0_GRVW2_PGR1_PLR0_TT8_4_USFGRO0_VW2_WG8_16_1_WGM8
    SolutionIndex: 467
    SolutionNameMin: Cijk_Ailk_Bjlk_SB_MT64x64x8_SE_DTL0_EPS1_FL0_GRVW4_PGR1_PLR0_TT8_4_USFGRO0_VW4_WG8_16_1_WGM8
    SolutionIndex: 468
    SolutionNameMin: Cijk_Ailk_Bjlk_SB_MT64x64x8_SE_EPS0_FL0_GRVW1_GSU1_PGR0_PLR0_TT4_4_USFGRO1_VW2_WG16_16_1_WGM1
    SolutionIndex: 469
    SolutionNameMin: Cijk_Ailk_Bjlk_SB_MT64x64x8_SE_EPS1_FL0_GRVW1_GSU1_PGR1_PLR0_TT4_4_USFGRO1_VW2_WG16_16_1_WGM8
    SolutionIndex: 470
    SolutionNameMin: Cijk_Ailk_Bjlk_SB_MT64x64x16_SE_EPS1_FL0_GRVW4_GSU1_PGR1_PLR1_TT4_4_USFGRO0_VW4_WG16_16_1_WGM1
    SolutionIndex: 471
    SolutionNameMin: Cijk_Ailk_Bjlk_SB_MT64x64x16_SE_EPS1_FL0_GRVW4_GSU1_PGR1_PLR1_TT4_4_USFGRO0_VW4_WG16_16_1_WGM8
    SolutionIndex: 472
    SolutionNameMin: Cijk_Ailk_Bjlk_SB_MT64x64x16_SE_EPS1_FL1_GRVW4_GSU1_PGR1_PLR1_TT4_4_USFGRO0_VW4_WG16_16_1_WGM1
    SolutionIndex: 473
    SolutionNameMin: Cijk_Ailk_Bjlk_SB_MT64x64x16_SE_EPS1_FL1_GRVW4_GSU1_PGR1_PLR1_TT4_4_USFGRO0_VW4_WG16_16_1_WGM8
    SolutionIndex: 474
    SolutionNameMin: Cijk_Ailk_Bjlk_SB_MT128x64x8_SE_EPS1_FL0_GRVW1_GSU1_PGR1_PLR0_TT8_4_USFGRO1_VW2_WG16_16_1_WGM1
    SolutionIndex: 475
    SolutionNameMin: Cijk_Ailk_Bjlk_SB_MT128x64x16_SE_EPS0_FL0_GRVW1_GSU1_PGR0_PLR0_TT8_4_USFGRO1_VW2_WG16_16_1_WGM1
    SolutionIndex: 476
    SolutionNameMin: Cijk_Ailk_Bjlk_SB_MT128x64x8_SE_EPS1_FL0_GRVW1_GSU1_PGR1_PLR0_TT8_4_USFGRO1_VW4_WG16_16_1_WGM1
    SolutionIndex: 477
    SolutionNameMin: Cijk_Ailk_Bjlk_SB_MT128x64x8_SE_EPS1_FL0_GRVW1_GSU1_PGR1_PLR0_TT8_4_USFGRO1_VW4_WG16_16_1_WGM8
    SolutionIndex: 478
    SolutionNameMin: Cijk_Ailk_Bjlk_SB_MT128x64x8_SE_EPS1_FL0_GRVW2_GSU1_PGR1_PLR0_TT8_4_USFGRO0_VW2_WG16_16_1_WGM8
    SolutionIndex: 479
    SolutionNameMin: Cijk_Ailk_Bjlk_SB_MT128x64x8_SE_EPS0_FL1_GRVW2_GSU1_PGR0_PLR0_TT8_4_USFGRO0_VW2_WG16_16_1_WGM1
    SolutionIndex: 480
    SolutionNameMin: Cijk_Ailk_Bjlk_SB_MT96x64x8_SE_EPS1_FL1_GRVW2_GSU1_PGR1_PLR1_TT6_4_USFGRO0_VW2_WG16_16_1_WGM1
    SolutionIndex: 481
    SolutionNameMin: Cijk_Ailk_Bjlk_SB_MT96x64x8_SE_EPS1_FL1_GRVW2_GSU1_PGR1_PLR1_TT6_4_USFGRO0_VW2_WG16_16_1_WGM8
    SolutionIndex: 482
    SolutionNameMin: Cijk_Ailk_Bjlk_SB_MT64x96x8_SE_EPS1_FL0_GRVW1_GSU1_PGR1_PLR1_TT4_6_USFGRO1_VW2_WG16_16_1_WGM1
    SolutionIndex: 483
    SolutionNameMin: Cijk_Ailk_Bjlk_SB_MT64x96x8_SE_EPS1_FL1_GRVW2_GSU1_PGR1_PLR1_TT4_6_USFGRO0_VW2_WG16_16_1_WGM8
    SolutionIndex: 484
    SolutionNameMin: Cijk_Ailk_Bjlk_SB_MT32x32x8_SE_EPS0_FL0_GRVW1_GSU1_PGR0_PLR0_TT2_2_USFGRO1_VW2_WG16_16_1_WGM1
    SolutionIndex: 485
    SolutionNameMin: Cijk_Ailk_Bjlk_SB_MT64x128x8_MI32x32x1x2_SE_ONLL0_SNLL1
    SolutionIndex: 486
    SolutionNameMin: Cijk_Ailk_Bjlk_SB_MT64x128x16_MI32x32x1x2_SE_ONLL0_SNLL1
    SolutionIndex: 487
    SolutionNameMin: Cijk_Ailk_Bjlk_SB_MT64x128x8_MI32x32x1x2_SE_ONLL0_SNLL0
    SolutionIndex: 488
    SolutionNameMin: Cijk_Ailk_Bjlk_SB_MT32x256x16_MI32x32x1x2_SE_ONLL0_SNLL0
    SolutionIndex: 489
    SolutionNameMin: Cijk_Ailk_Bjlk_SB_MT64x128x16_MI32x32x1x2_SE_ONLL0_SNLL0
    SolutionIndex: 490
    SolutionNameMin: Cijk_Ailk_Bjlk_SB_MT64x128x32_MI32x32x1x2_SE_ONLL0_SNLL0
    SolutionIndex: 491
    SolutionNameMin: Cijk_Ailk_Bjlk_SB_MT64x128x8_MI32x32x1x2_SE_ONLL1_SNLL1
    SolutionIndex: 492
    SolutionNameMin: Cijk_Ailk_Bjlk_SB_MT64x128x16_MI32x32x1x2_SE_ONLL1_SNLL1
    SolutionIndex: 493
    SolutionNameMin: Cijk_Ailk_Bjlk_SB_MT64x128x32_MI32x32x1x2_SE_ONLL1_SNLL1
    SolutionIndex: 494
    SolutionNameMin: Cijk_Ailk_Bjlk_SB_MT64x128x8_MI32x32x1x2_SE_ONLL1_SNLL0
    SolutionIndex: 495
    SolutionNameMin: Cijk_Ailk_Bjlk_SB_MT32x256x16_MI32x32x1x2_SE_ONLL1_SNLL0
    SolutionIndex: 496
    SolutionNameMin: Cijk_Ailk_Bjlk_SB_MT64x128x16_MI32x32x1x2_SE_ONLL1_SNLL0
    SolutionIndex: 497
    SolutionNameMin: Cijk_Ailk_Bjlk_SB_MT64x128x32_MI32x32x1x2_SE_ONLL1_SNLL0
    SolutionIndex: 498
    SolutionNameMin: Cijk_Ailk_Bjlk_SB_MT64x256x8_MI32x32x1x2_SE_ONLL0_SNLL1
    SolutionIndex: 499
    SolutionNameMin: Cijk_Ailk_Bjlk_SB_MT64x256x8_MI32x32x1x2_SE_ONLL0_SNLL0
    SolutionIndex: 500
    SolutionNameMin: Cijk_Ailk_Bjlk_SB_MT64x256x16_MI32x32x1x2_SE_ONLL0_SNLL0
    SolutionIndex: 501
    SolutionNameMin: Cijk_Ailk_Bjlk_SB_MT64x256x8_MI32x32x1x2_SE_ONLL1_SNLL1
    SolutionIndex: 502
    SolutionNameMin: Cijk_Ailk_Bjlk_SB_MT64x256x8_MI32x32x1x2_SE_ONLL1_SNLL0
    SolutionIndex: 503
    SolutionNameMin: Cijk_Ailk_Bjlk_SB_MT64x256x16_MI32x32x1x2_SE_ONLL1_SNLL0
    SolutionIndex: 504
    SolutionNameMin: Cijk_Ailk_Bjlk_SB_MT96x64x16_SE_EPS1_FL0_GRVW2_PGR1_PLR1_TT6_4_USFGRO0_VW2_WGM8
    SolutionIndex: 505
    SolutionNameMin: Cijk_Ailk_Bjlk_SB_MT96x64x8_SE_EPS1_FL1_GRVW2_PGR1_PLR1_TT6_4_USFGRO0_VW2_WGM1
    SolutionIndex: 506
    SolutionNameMin: Cijk_Ailk_Bjlk_SB_MT96x64x8_SE_EPS1_FL1_GRVW2_PGR1_PLR1_TT6_4_USFGRO0_VW2_WGM8
    SolutionIndex: 507
    SolutionNameMin: Cijk_Ailk_Bjlk_SB_MT64x96x8_SE_EPS1_FL1_GRVW2_PGR1_PLR1_TT4_6_USFGRO0_VW2_WGM1
    SolutionIndex: 508
    SolutionNameMin: Cijk_Ailk_Bjlk_SB_MT64x96x8_SE_EPS1_FL1_GRVW2_PGR1_PLR1_TT4_6_USFGRO0_VW2_WGM8
    SolutionIndex: 509
    SolutionNameMin: Cijk_Ailk_Bjlk_SB_MT64x128x8_SE_EPS0_FL0_GRVW1_PGR0_PLR0_TT4_8_USFGRO1_VW2_WGM8
    SolutionIndex: 510
    SolutionNameMin: Cijk_Ailk_Bjlk_SB_MT64x128x8_SE_EPS1_FL0_GRVW1_PGR1_PLR0_TT4_8_USFGRO1_VW2_WGM8
    SolutionIndex: 511
    SolutionNameMin: Cijk_Ailk_Bjlk_SB_MT64x128x16_SE_EPS0_FL0_GRVW1_PGR0_PLR0_TT4_8_USFGRO1_VW2_WGM1
    SolutionIndex: 512
    SolutionNameMin: Cijk_Ailk_Bjlk_SB_MT64x128x16_SE_EPS0_FL0_GRVW1_PGR0_PLR0_TT4_8_USFGRO1_VW2_WGM8
    SolutionIndex: 513
    SolutionNameMin: Cijk_Ailk_Bjlk_SB_MT64x128x8_SE_EPS0_FL0_GRVW1_PGR0_PLR1_TT4_8_USFGRO1_VW2_WGM1
    SolutionIndex: 514
    SolutionNameMin: Cijk_Ailk_Bjlk_SB_MT64x128x8_SE_EPS1_FL0_GRVW1_PGR1_PLR1_TT4_8_USFGRO1_VW2_WGM1
    SolutionIndex: 515
    SolutionNameMin: Cijk_Ailk_Bjlk_SB_MT64x128x8_SE_EPS0_FL0_GRVW1_PGR0_PLR1_TT4_8_USFGRO1_VW2_WGM8
    SolutionIndex: 516
    SolutionNameMin: Cijk_Ailk_Bjlk_SB_MT64x128x8_SE_EPS1_FL0_GRVW1_PGR1_PLR1_TT4_8_USFGRO1_VW2_WGM8
    SolutionIndex: 517
    SolutionNameMin: Cijk_Ailk_Bjlk_SB_MT64x128x16_SE_EPS0_FL0_GRVW1_PGR0_PLR1_TT4_8_USFGRO1_VW2_WGM8
    SolutionIndex: 518
    SolutionNameMin: Cijk_Ailk_Bjlk_SB_MT64x128x8_SE_EPS0_FL0_GRVW1_PGR0_PLR0_TT4_8_USFGRO1_VW4_WGM1
    SolutionIndex: 519
    SolutionNameMin: Cijk_Ailk_Bjlk_SB_MT64x128x8_SE_EPS1_FL0_GRVW1_PGR1_PLR0_TT4_8_USFGRO1_VW4_WGM1
    SolutionIndex: 520
    SolutionNameMin: Cijk_Ailk_Bjlk_SB_MT64x128x8_SE_EPS0_FL0_GRVW1_PGR0_PLR1_TT4_8_USFGRO1_VW4_WGM8
    SolutionIndex: 521
    SolutionNameMin: Cijk_Ailk_Bjlk_SB_MT64x128x8_SE_EPS1_FL0_GRVW2_PGR1_PLR0_TT4_8_USFGRO0_VW2_WGM1
    SolutionIndex: 522
    SolutionNameMin: Cijk_Ailk_Bjlk_SB_MT64x128x8_SE_EPS0_FL0_GRVW2_PGR0_PLR1_TT4_8_USFGRO0_VW2_WGM8
    SolutionIndex: 523
    SolutionNameMin: Cijk_Ailk_Bjlk_SB_MT64x128x8_SE_EPS0_FL1_GRVW2_PGR0_PLR1_TT4_8_USFGRO0_VW2_WGM1
    SolutionIndex: 524
    SolutionNameMin: Cijk_Ailk_Bjlk_SB_MT128x64x8_SE_EPS0_FL0_GRVW1_PGR0_PLR0_TT8_4_USFGRO1_VW2_WGM8
    SolutionIndex: 525
    SolutionNameMin: Cijk_Ailk_Bjlk_SB_MT128x64x8_SE_EPS0_FL0_GRVW1_PGR0_PLR1_TT8_4_USFGRO1_VW2_WGM1
    SolutionIndex: 526
    SolutionNameMin: Cijk_Ailk_Bjlk_SB_MT128x64x8_SE_EPS0_FL0_GRVW2_PGR0_PLR0_TT8_4_USFGRO0_VW2_WGM1
    SolutionIndex: 527
    SolutionNameMin: Cijk_Ailk_Bjlk_SB_MT128x64x8_SE_EPS1_FL0_GRVW2_PGR1_PLR1_TT8_4_USFGRO0_VW2_WGM8
    SolutionIndex: 528
    SolutionNameMin: Cijk_Ailk_Bjlk_SB_MT128x64x8_SE_EPS1_FL1_GRVW2_PGR1_PLR1_TT8_4_USFGRO0_VW2_WGM1
    SolutionIndex: 529
    SolutionNameMin: Cijk_Ailk_Bjlk_SB_MT128x64x8_SE_EPS1_FL1_GRVW2_PGR1_PLR1_TT8_4_USFGRO0_VW2_WGM8
    SolutionIndex: 530
    SolutionNameMin: Cijk_Ailk_Bjlk_SB_MT64x64x8_SE_EPS0_FL0_GRVW2_PGR0_PLR0_TT4_4_USFGRO0_VW2_WGM8
    SolutionIndex: 531
    SolutionNameMin: Cijk_Ailk_Bjlk_SB_MT64x64x8_SE_EPS0_FL1_GRVW2_PGR0_PLR0_TT4_4_USFGRO0_VW2_WGM8
    SolutionIndex: 532
    SolutionNameMin: Cijk_Ailk_Bjlk_SB_MT16x64x16_SE_EPS1_FL0_GRVW4_PGR1_PLR0_TT4_4_USFGRO0_VW4_WGM1
    SolutionIndex: 533
    SolutionNameMin: Cijk_Ailk_Bjlk_SB_MT16x64x16_SE_EPS1_FL0_GRVW4_PGR1_PLR1_TT4_4_USFGRO0_VW4_WGM1
    SolutionIndex: 534
    SolutionNameMin: Cijk_Ailk_Bjlk_SB_MT64x16x16_SE_EPS1_FL0_GRVW4_PGR1_PLR0_TT4_4_USFGRO0_VW4_WGM8
    SolutionIndex: 535
    SolutionNameMin: Cijk_Ailk_Bjlk_SB_MT64x16x16_SE_EPS1_FL0_GRVW4_PGR1_PLR1_TT4_4_USFGRO0_VW4_WGM8
    SolutionIndex: 536
    SolutionNameMin: Cijk_Ailk_Bjlk_SB_MT64x64x8_SE_EPS1_FL0_GRVW1_GSU1_PGR1_PLR0_TT4_4_USFGRO1_VW4_WG16_16_1_WGM8
    SolutionIndex: 537
    SolutionNameMin: Cijk_Ailk_Bjlk_SB_MT64x64x8_SE_EPS1_FL0_GRVW1_GSU1_PGR1_PLR1_TT4_4_USFGRO1_VW4_WG16_16_1_WGM8
    SolutionIndex: 538
    SolutionNameMin: Cijk_Ailk_Bjlk_SB_MT64x64x8_SE_EPS1_FL0_GRVW2_GSU1_PGR1_PLR1_TT4_4_USFGRO0_VW2_WG16_16_1_WGM8
    SolutionIndex: 539
    SolutionNameMin: Cijk_Ailk_Bjlk_SB_MT64x64x32_SE_EPS0_FL1_GRVW2_GSU1_PGR0_PLR0_TT4_4_USFGRO0_VW2_WG16_16_1_WGM8
    SolutionIndex: 540
    SolutionNameMin: Cijk_Ailk_Bjlk_SB_MT64x64x16_SE_EPS1_FL1_GRVW4_GSU1_PGR1_PLR0_TT4_4_USFGRO0_VW4_WG16_16_1_WGM1
    SolutionIndex: 541
    SolutionNameMin: Cijk_Ailk_Bjlk_SB_MT64x64x16_SE_EPS1_FL1_GRVW4_GSU1_PGR1_PLR1_TT4_4_USFGRO0_VW4_WG16_16_1_WGM8
    SolutionIndex: 542
    SolutionNameMin: Cijk_Ailk_Bjlk_SB_MT128x64x16_SE_EPS0_FL0_GRVW1_GSU1_PGR0_PLR0_TT8_4_USFGRO1_VW2_WG16_16_1_WGM8
    SolutionIndex: 543
    SolutionNameMin: Cijk_Ailk_Bjlk_SB_MT128x64x16_SE_EPS0_FL0_GRVW1_GSU1_PGR0_PLR0_TT8_4_USFGRO1_VW4_WG16_16_1_WGM8
    SolutionIndex: 544
    SolutionNameMin: Cijk_Ailk_Bjlk_SB_MT128x64x8_SE_EPS0_FL0_GRVW1_GSU1_PGR0_PLR1_TT8_4_USFGRO1_VW4_WG16_16_1_WGM8
    SolutionIndex: 545
    SolutionNameMin: Cijk_Ailk_Bjlk_SB_MT128x64x8_SE_EPS1_FL0_GRVW2_GSU1_PGR1_PLR0_TT8_4_USFGRO0_VW2_WG16_16_1_WGM8
    SolutionIndex: 546
    SolutionNameMin: Cijk_Ailk_Bjlk_SB_MT128x64x16_SE_EPS0_FL0_GRVW4_GSU1_PGR0_PLR0_TT8_4_USFGRO0_VW4_WG16_16_1_WGM8
    SolutionIndex: 547
    SolutionNameMin: Cijk_Ailk_Bjlk_SB_MT128x128x16_SE_EPS0_FL0_GRVW2_GSU1_PGR0_PLR1_TT8_8_USFGRO0_VW2_WG16_16_1_WGM1
    SolutionIndex: 548
    SolutionNameMin: Cijk_Ailk_Bjlk_SB_MT128x128x8_SE_EPS1_FL1_GRVW4_GSU1_PGR1_PLR1_TT8_8_USFGRO0_VW4_WG16_16_1_WGM8
    SolutionIndex: 549
    SolutionNameMin: Cijk_Ailk_Bjlk_SB_MT64x32x8_SE_EPS1_FL1_GRVW2_GSU1_PGR1_PLR1_TT4_4_USFGRO0_VW2_WG16_8_1_WGM1
    SolutionIndex: 550
    SolutionNameMin: Cijk_Ailk_Bjlk_SB_MT64x32x8_SE_EPS1_FL1_GRVW2_GSU1_PGR1_PLR1_TT4_4_USFGRO0_VW2_WG16_8_1_WGM8
    SolutionIndex: 551
    SolutionNameMin: Cijk_Ailk_Bjlk_SB_MT64x32x16_SE_EPS1_FL1_GRVW4_GSU1_PGR1_PLR1_TT4_4_USFGRO0_VW4_WG16_8_1_WGM1
    SolutionIndex: 552
    SolutionNameMin: Cijk_Ailk_Bjlk_SB_MT96x64x8_SE_EPS1_FL1_GRVW2_GSU1_PGR1_PLR1_TT6_4_USFGRO0_VW2_WG16_16_1_WGM1
    SolutionIndex: 553
    SolutionNameMin: Cijk_Ailk_Bjlk_SB_MT96x64x16_SE_EPS1_FL1_GRVW2_GSU1_PGR1_PLR1_TT6_4_USFGRO0_VW2_WG16_16_1_WGM8
    SolutionIndex: 554
    SolutionNameMin: Cijk_Ailk_Bjlk_SB_MT32x32x8_SE_EPS1_FL0_GRVW1_GSU1_PGR1_PLR0_TT2_2_USFGRO1_VW2_WG16_16_1_WGM1
    SolutionIndex: 555
    SolutionNameMin: Cijk_Ailk_Bjlk_SB_MT32x32x8_SE_EPS0_FL0_GRVW2_GSU1_PGR0_PLR1_TT2_2_USFGRO1_VW2_WG16_16_1_WGM8
    SolutionIndex: 556
    SolutionNameMin: Cijk_Ailk_Bjlk_SB_MT32x8x32_SE_EPS0_FL0_GRVW1_GSU1_PGR0_PLR0_TT2_2_USFGRO1_VW2_WG16_4_4_WGM8
    SolutionIndex: 557
    SolutionNameMin: Cijk_Ailk_Bjlk_SB_MT32x8x32_SE_EPS1_FL0_GRVW1_GSU1_PGR1_PLR1_TT2_2_USFGRO1_VW2_WG16_4_4_WGM1
    SolutionIndex: 558
    SolutionNameMin: Cijk_Ailk_Bjlk_SB_MT32x8x32_SE_EPS1_FL0_GRVW1_GSU8_PGR1_PLR1_TT2_2_USFGRO1_VW2_WG16_4_4_WGM8
    SolutionIndex: 559
    SolutionNameMin: Cijk_Ailk_Bjlk_SB_MT32x8x32_SE_EPS1_FL0_GRVW2_GSU8_PGR1_PLR1_TT2_2_USFGRO0_VW2_WG16_4_4_WGM8
    SolutionIndex: 560
    SolutionNameMin: Cijk_Ailk_Bjlk_SB_MT32x256x8_MI32x32x1x2_SE_FL0_NLCB1_ONLL0_PLR0_SNLL1_TT1_32_USFGRO0_WG16_16_1
    SolutionIndex: 561
    SolutionNameMin: Cijk_Ailk_Bjlk_SB_MT32x256x16_MI32x32x1x2_SE_FL0_NLCB1_ONLL0_PLR0_SNLL1_TT1_32_USFGRO0_WG16_16_1
    SolutionIndex: 562
    SolutionNameMin: Cijk_Ailk_Bjlk_SB_MT32x256x8_MI32x32x1x2_SE_FL0_NLCB1_ONLL0_PLR0_SNLL0_TT1_32_USFGRO0_WG16_16_1
    SolutionIndex: 563
    SolutionNameMin: Cijk_Ailk_Bjlk_SB_MT32x256x8_MI32x32x1x2_SE_FL0_NLCB1_ONLL0_PLR0_SNLL0_TT1_32_USFGRO1_WG16_16_1
    SolutionIndex: 564
    SolutionNameMin: Cijk_Ailk_Bjlk_SB_MT32x256x8_MI32x32x1x2_SE_FL1_NLCB1_ONLL0_PLR1_SNLL0_TT1_32_USFGRO1_WG16_16_1
    SolutionIndex: 565
    SolutionNameMin: Cijk_Ailk_Bjlk_SB_MT32x256x8_MI32x32x1x2_SE_FL1_NLCB1_ONLL1_PLR1_SNLL1_TT1_32_USFGRO1_WG16_16_1
    SolutionIndex: 566
    SolutionNameMin: Cijk_Ailk_Bjlk_SB_MT64x128x16_MI32x32x1x2_SE_FL0_NLCB1_ONLL0_PLR0_SNLL0_TT1_32_USFGRO1_WG64_4_1
    SolutionIndex: 567
    SolutionNameMin: Cijk_Ailk_Bjlk_SB_MT128x128x8_MI32x32x1x2_SE_FL0_NLCB1_ONLL1_PLR0_SNLL0_TT2_32_USFGRO1_WG64_4_1
    SolutionIndex: 568
    SolutionNameMin: Cijk_Ailk_Bjlk_SB_MT128x128x32_MI32x32x1x2_SE_FL0_NLCB1_ONLL0_PLR1_SNLL0_TT2_32_USFGRO0_WG64_4_1
    SolutionIndex: 569
    SolutionNameMin: Cijk_Ailk_Bjlk_SB_MT128x128x32_MI32x32x1x2_SE_FL0_NLCB1_ONLL1_PLR1_SNLL0_TT2_32_USFGRO0_WG64_4_1
    SolutionIndex: 570
    SolutionNameMin: Cijk_Ailk_Bjlk_SB_MT128x128x32_MI32x32x1x2_SE_FL1_NLCB1_ONLL0_PLR1_SNLL0_TT2_32_USFGRO0_WG64_4_1
    SolutionIndex: 571
    SolutionNameMin: Cijk_Ailk_Bjlk_SB_MT128x128x32_MI32x32x1x2_SE_FL1_NLCB1_ONLL1_PLR1_SNLL0_TT2_32_USFGRO0_WG64_4_1
    SolutionIndex: 572
    SolutionNameMin: Cijk_Ailk_Bjlk_SB_MT64x128x8_MI32x32x1x2_SE_
    SolutionIndex: 573
    SolutionNameMin: Cijk_Ailk_Bjlk_SB_MT256x128x8_MI32x32x1x2_SE_GRVW4_TT4_32_VW4_WG64_4_1_WGM16
    SolutionIndex: 574
    SolutionNameMin: Cijk_Ailk_Bjlk_SB_MT256x128x16_MI32x32x1x2_SE_GRVW4_TT4_32_VW4_WG64_4_1_WGM16
    SolutionIndex: 575
    SolutionNameMin: Cijk_Ailk_Bjlk_SB_MT32x128x16_MI32x32x2x1_SE_GRVW1_TT1_32_VW1_WG16_16_1_WGM4
    SolutionIndex: 576
    SolutionNameMin: Cijk_Ailk_Bjlk_SB_MT32x128x32_MI32x32x2x1_SE_GRVW1_TT1_32_VW1_WG16_16_1_WGM16
    SolutionIndex: 577
    SolutionNameMin: Cijk_Ailk_Bjlk_SB_MT128x64x8_MI16x16x1x4_SE_GRVW2_TT2_16_VW2_WG64_4_1_WGM4
    SolutionIndex: 578
    SolutionNameMin: Cijk_Ailk_Bjlk_SB_MT128x128x8_MI16x16x1x4_SE_GRVW2_TT2_32_VW2_WG64_4_1_WGM4
    SolutionIndex: 579
    SolutionNameMin: Cijk_Ailk_Bjlk_SB_MT128x64x8_MI16x16x1x4_SE_GRVW2_TT2_16_VW2_WG64_4_1_WGM8
    SolutionIndex: 580
    SolutionNameMin: Cijk_Ailk_Bjlk_SB_MT128x64x8_MI16x16x1x4_SE_GRVW2_TT2_16_VW2_WG64_4_1_WGM16
    SolutionIndex: 581
    SolutionNameMin: Cijk_Ailk_Bjlk_SB_MT256x64x8_MI16x16x1x4_SE_GRVW4_TT4_16_VW4_WG64_4_1_WGM16
    SolutionIndex: 582
    SolutionNameMin: Cijk_Ailk_Bjlk_SB_MT128x64x16_MI16x16x1x4_SE_GRVW2_TT2_16_VW2_WG64_4_1_WGM4
    SolutionIndex: 583
    SolutionNameMin: Cijk_Ailk_Bjlk_SB_MT128x128x16_MI16x16x1x4_SE_GRVW2_TT2_32_VW2_WG64_4_1_WGM4
    SolutionIndex: 584
    SolutionNameMin: Cijk_Ailk_Bjlk_SB_MT128x64x16_MI16x16x1x4_SE_GRVW2_TT2_16_VW2_WG64_4_1_WGM8
    SolutionIndex: 585
    SolutionNameMin: Cijk_Ailk_Bjlk_SB_MT128x128x16_MI16x16x1x4_SE_GRVW2_TT2_32_VW2_WG64_4_1_WGM8
    SolutionIndex: 586
    SolutionNameMin: Cijk_Ailk_Bjlk_SB_MT128x64x16_MI16x16x1x4_SE_GRVW2_TT2_16_VW2_WG64_4_1_WGM16
    SolutionIndex: 587
    SolutionNameMin: Cijk_Ailk_Bjlk_SB_MT128x64x32_MI16x16x1x4_SE_GRVW2_TT2_16_VW2_WG64_4_1_WGM4
    SolutionIndex: 588
    SolutionNameMin: Cijk_Ailk_Bjlk_SB_MT128x64x32_MI16x16x1x4_SE_GRVW2_TT2_16_VW2_WG64_4_1_WGM8
    SolutionIndex: 589
    SolutionNameMin: Cijk_Ailk_Bjlk_SB_MT128x64x32_MI16x16x1x4_SE_GRVW2_TT2_16_VW2_WG64_4_1_WGM16
    SolutionIndex: 590
    SolutionNameMin: Cijk_Ailk_Bjlk_SB_MT64x128x8_MI32x32x1x2_SE_FL1_ONLL0_PLR0_SNLL1_TT1_32_USFGRO0
    SolutionIndex: 591
    SolutionNameMin: Cijk_Ailk_Bjlk_SB_MT128x128x8_MI32x32x1x2_SE_FL1_ONLL0_PLR0_SNLL0_TT2_32_USFGRO1
    SolutionIndex: 592
    SolutionNameMin: Cijk_Ailk_Bjlk_SB_MT128x128x8_MI32x32x1x2_SE_FL1_ONLL1_PLR0_SNLL0_TT2_32_USFGRO1
    SolutionIndex: 593
    SolutionNameMin: Cijk_Ailk_Bjlk_SB_MT128x128x32_MI32x32x1x2_SE_FL0_ONLL0_PLR1_SNLL1_TT2_32_USFGRO0
    SolutionIndex: 594
    SolutionNameMin: Cijk_Ailk_Bjlk_SB_MT128x128x32_MI32x32x1x2_SE_FL0_ONLL0_PLR1_SNLL0_TT2_32_USFGRO0
    SolutionIndex: 595
    SolutionNameMin: Cijk_Ailk_Bjlk_SB_MT128x128x32_MI32x32x1x2_SE_FL0_ONLL1_PLR1_SNLL0_TT2_32_USFGRO0
    SolutionIndex: 596
    SolutionNameMin: Cijk_Ailk_Bjlk_SB_MT128x128x32_MI32x32x1x2_SE_FL1_ONLL1_PLR1_SNLL1_TT2_32_USFGRO0
    SolutionIndex: 597
    SolutionNameMin: Cijk_Ailk_Bjlk_SB_MT32x128x8_MI32x32x2x1_SE_FL0_ONLL0_PLR0_SNLL1_TT1_32_USFGRO0
    SolutionIndex: 598
    SolutionNameMin: Cijk_Ailk_Bjlk_SB_MT32x128x8_MI32x32x2x1_SE_FL0_ONLL0_PLR0_SNLL0_TT1_32_USFGRO0
    SolutionIndex: 599
    SolutionNameMin: Cijk_Ailk_Bjlk_SB_MT256x64x8_MI16x16x1x4_SE_FL0_ONLL0_PLR1_SNLL0_TT4_16_USFGRO0
    SolutionIndex: 600
    SolutionNameMin: Cijk_Ailk_Bjlk_SB_MT128x128x8_MI16x16x1x4_SE_FL1_ONLL1_PLR1_SNLL0_TT2_32_USFGRO1
    SolutionIndex: 601
    SolutionNameMin: Cijk_Ailk_Bjlk_SB_MT64x64x16_MI16x16x4x1_SE_FL0_ONLL1_PLR0_SNLL0_TT4_16_USFGRO1
    SolutionIndex: 602
    SolutionNameMin: Cijk_Ailk_Bjlk_SB_MT64x64x16_MI16x16x4x1_SE_FL1_ONLL1_PLR0_SNLL0_TT4_16_USFGRO1
    SolutionIndex: 603
    SolutionNameMin: Cijk_Ailk_Bjlk_SB_MT64x64x8_MI16x16x4x1_SE_FL0_ONLL0_PLR1_SNLL0_TT4_16_USFGRO0
    SolutionIndex: 604
    SolutionNameMin: Cijk_Ailk_Bjlk_SB_MT64x64x32_MI16x16x4x1_SE_FL0_ONLL1_PLR1_SNLL0_TT4_16_USFGRO1
- - - [1024, 128, 1, 128]
    - [4, 0]
  - - [4, 704, 1, 1280]
    - [43, 0]
  - - [4, 1856, 1, 3328]
    - [43, 0]
  - - [1856, 448, 1, 3328]
    - [80, 0]
  - - [2944, 4288, 1, 1280]
    - [75, 0]
  - - [2368, 64, 1, 3328]
    - [36, 0]
  - - [2368, 5888, 1, 256]
    - [80, 0]
  - - [128, 64, 1, 256]
    - [42, 0]
  - - [5888, 1024, 1, 1280]
    - [85, 0]
  - - [128, 6784, 1, 3328]
    - [48, 0]
  - - [64, 4, 1, 256]
    - [94, 0]
  - - [5888, 1856, 1, 3328]
    - [80, 0]
  - - [5056, 704, 1, 256]
    - [83, 0]
  - - [5888, 2944, 1, 3328]
    - [73, 0]
  - - [1856, 4288, 1, 256]
    - [74, 0]
  - - [1024, 5056, 1, 128]
    - [66, 0]
  - - [5056, 5056, 1, 3328]
    - [74, 0]
  - - [1408, 5888, 1, 1280]
    - [75, 0]
  - - [2368, 448, 1, 128]
    - [67, 0]
  - - [1024, 3584, 1, 3328]
    - [77, 0]
  - - [4, 2944, 1, 1280]
    - [29, 0]
  - - [1408, 64, 1, 128]
    - [0, 0]
  - - [256, 4288, 1, 3328]
    - [80, 0]
  - - [5888, 1408, 1, 1280]
    - [73, 0]
  - - [704, 1856, 1, 3328]
    - [74, 0]
  - - [4, 1408, 1, 128]
    - [87, 0]
  - - [1024, 2368, 1, 256]
    - [74, 0]
  - - [1408, 1856, 1, 1280]
    - [77, 0]
  - - [1408, 64, 1, 1280]
    - [48, 0]
  - - [448, 1024, 1, 1280]
    - [74, 0]
  - - [256, 1408, 1, 3328]
    - [80, 0]
  - - [5056, 5056, 1, 1280]
    - [83, 0]
  - - [448, 5056, 1, 256]
    - [75, 0]
  - - [704, 1856, 1, 1280]
    - [74, 0]
  - - [128, 5056, 1, 128]
    - [66, 0]
  - - [2368, 128, 1, 256]
    - [74, 0]
  - - [1856, 1408, 1, 128]
    - [69, 0]
  - - [64, 5056, 1, 256]
    - [75, 0]
  - - [6784, 256, 1, 3328]
    - [74, 0]
  - - [6784, 4288, 1, 3328]
    - [85, 0]
  - - [4288, 448, 1, 256]
    - [78, 0]
  - - [64, 704, 1, 128]
    - [11, 0]
  - - [1856, 2368, 1, 3328]
    - [74, 0]
  - - [4288, 2944, 1, 1280]
    - [80, 0]
  - - [704, 5056, 1, 1280]
    - [74, 0]
  - - [2368, 704, 1, 3328]
    - [80, 0]
  - - [256, 5888, 1, 256]
    - [74, 0]
  - - [1856, 4288, 1, 3328]
    - [80, 0]
  - - [256, 2944, 1, 256]
    - [81, 0]
  - - [5888, 1024, 1, 256]
    - [72, 0]
  - - [448, 64, 1, 1280]
    - [47, 0]
  - - [448, 5056, 1, 3328]
    - [74, 0]
  - - [3584, 4, 1, 1280]
    - [23, 0]
  - - [2944, 64, 1, 256]
    - [22, 0]
  - - [128, 4, 1, 1280]
    - [94, 0]
  - - [1408, 2944, 1, 256]
    - [74, 0]
  - - [256, 1856, 1, 1280]
    - [74, 0]
  - - [6784, 5056, 1, 3328]
    - [85, 0]
  - - [5056, 5056, 1, 256]
    - [80, 0]
  - - [1408, 6784, 1, 128]
    - [66, 0]
  - - [64, 1024, 1, 1280]
    - [38, 0]
  - - [2944, 4, 1, 256]
    - [29, 0]
  - - [704, 5056, 1, 128]
    - [66, 0]
  - - [4, 2368, 1, 1280]
    - [23, 0]
  - - [2368, 2944, 1, 1280]
    - [85, 0]
  - - [128, 3584, 1, 1280]
    - [83, 0]
  - - [6784, 6784, 1, 1280]
    - [80, 0]
  - - [1408, 4288, 1, 1280]
    - [83, 0]
  - - [3584, 4288, 1, 1280]
    - [85, 0]
  - - [2368, 704, 1, 1280]
    - [80, 0]
  - - [5056, 4288, 1, 3328]
    - [72, 0]
  - - [3584, 2368, 1, 3328]
    - [80, 0]
  - - [64, 704, 1, 1280]
    - [47, 0]
  - - [4288, 256, 1, 256]
    - [80, 0]
  - - [2944, 128, 1, 128]
    - [2, 0]
  - - [6784, 448, 1, 1280]
    - [83, 0]
  - - [1408, 2944, 1, 128]
    - [66, 0]
  - - [4288, 2944, 1, 256]
    - [85, 0]
  - - [5888, 704, 1, 1280]
    - [74, 0]
  - - [1856, 64, 1, 1280]
    - [48, 0]
  - - [448, 5888, 1, 128]
    - [69, 0]
  - - [5888, 64, 1, 3328]
    - [49, 0]
  - - [2944, 256, 1, 3328]
    - [74, 0]
  - - [1024, 64, 1, 128]
    - [19, 0]
  - - [5056, 2368, 1, 1280]
    - [74, 0]
  - - [448, 3584, 1, 1280]
    - [74, 0]
  - - [6784, 5888, 1, 256]
    - [72, 0]
  - - [704, 1024, 1, 128]
    - [66, 0]
  - - [704, 128, 1, 1280]
    - [48, 0]
  - - [5888, 2944, 1, 128]
    - [69, 0]
  - - [4, 3584, 1, 128]
    - [86, 0]
  - - [1408, 448, 1, 1280]
    - [74, 0]
  - - [1024, 1408, 1, 256]
    - [82, 0]
  - - [2368, 2368, 1, 3328]
    - [83, 0]
  - - [1856, 6784, 1, 128]
    - [69, 0]
  - - [5056, 704, 1, 3328]
    - [75, 0]
  - - [1408, 1856, 1, 256]
    - [80, 0]
  - - [1408, 704, 1, 3328]
    - [80, 0]
  - - [2368, 5056, 1, 256]
    - [80, 0]
  - - [5888, 1856, 1, 256]
    - [85, 0]
  - - [4288, 64, 1, 3328]
    - [62, 0]
  - - [2368, 4, 1, 1280]
    - [95, 0]
  - - [704, 5888, 1, 256]
    - [80, 0]
  - - [4288, 64, 1, 256]
    - [38, 0]
  - - [6784, 64, 1, 256]
    - [80, 0]
  - - [2944, 256, 1, 256]
    - [74, 0]
  - - [2944, 6784, 1, 3328]
    - [74, 0]
  - - [704, 1408, 1, 3328]
    - [74, 0]
  - - [3584, 704, 1, 3328]
    - [74, 0]
  - - [2944, 256, 1, 128]
    - [66, 0]
  - - [6784, 4, 1, 1280]
    - [23, 0]
  - - [1024, 64, 1, 1280]
    - [35, 0]
  - - [448, 4288, 1, 256]
    - [80, 0]
  - - [64, 3584, 1, 3328]
    - [28, 0]
  - - [704, 2368, 1, 1280]
    - [74, 0]
  - - [448, 2944, 1, 128]
    - [66, 0]
  - - [1856, 2368, 1, 1280]
    - [85, 0]
  - - [2368, 128, 1, 3328]
    - [36, 0]
  - - [2944, 128, 1, 256]
    - [74, 0]
  - - [448, 1408, 1, 256]
    - [75, 0]
  - - [1856, 4288, 1, 1280]
    - [73, 0]
  - - [64, 5056, 1, 3328]
    - [56, 0]
  - - [4, 704, 1, 256]
    - [40, 0]
  - - [1024, 448, 1, 128]
    - [69, 0]
  - - [704, 4, 1, 1280]
    - [43, 0]
  - - [704, 256, 1, 128]
    - [66, 0]
  - - [704, 2944, 1, 128]
    - [66, 0]
  - - [1408, 1024, 1, 1280]
    - [80, 0]
  - - [704, 6784, 1, 256]
    - [74, 0]
  - - [6784, 704, 1, 256]
    - [80, 0]
  - - [5056, 1408, 1, 128]
    - [66, 0]
  - - [256, 3584, 1, 3328]
    - [74, 0]
  - - [4, 5888, 1, 3328]
    - [91, 0]
  - - [128, 1408, 1, 128]
    - [13, 0]
  - - [3584, 4288, 1, 3328]
    - [76, 0]
  - - [5888, 1856, 1, 1280]
    - [77, 0]
  - - [5056, 1024, 1, 3328]
    - [78, 0]
  - - [5056, 64, 1, 1280]
    - [56, 0]
  - - [1024, 704, 1, 256]
    - [74, 0]
  - - [1024, 4288, 1, 128]
    - [68, 0]
  - - [4288, 64, 1, 1280]
    - [53, 0]
  - - [2368, 3584, 1, 1280]
    - [72, 0]
  - - [2368, 6784, 1, 1280]
    - [72, 0]
  - - [1024, 256, 1, 256]
    - [80, 0]
  - - [1856, 4, 1, 1280]
    - [95, 0]
  - - [448, 448, 1, 256]
    - [80, 0]
  - - [2944, 3584, 1, 3328]
    - [81, 0]
  - - [128, 4288, 1, 128]
    - [1, 0]
  - - [64, 448, 1, 256]
    - [44, 0]
  - - [128, 1024, 1, 3328]
    - [57, 0]
  - - [4, 1408, 1, 3328]
    - [40, 0]
  - - [6784, 2944, 1, 256]
    - [83, 0]
  - - [64, 1856, 1, 1280]
    - [56, 0]
  - - [64, 1024, 1, 128]
    - [0, 0]
  - - [4288, 2368, 1, 3328]
    - [76, 0]
  - - [1856, 2368, 1, 256]
    - [83, 0]
  - - [3584, 256, 1, 128]
    - [68, 0]
  - - [3584, 6784, 1, 3328]
    - [78, 0]
  - - [256, 1024, 1, 256]
    - [74, 0]
  - - [4, 6784, 1, 3328]
    - [93, 0]
  - - [1024, 5888, 1, 3328]
    - [74, 0]
  - - [1024, 128, 1, 1280]
    - [26, 0]
  - - [4288, 128, 1, 1280]
    - [80, 0]
  - - [5056, 4288, 1, 1280]
    - [72, 0]
  - - [5888, 64, 1, 256]
    - [74, 0]
  - - [1856, 256, 1, 1280]
    - [80, 0]
  - - [64, 5888, 1, 3328]
    - [48, 0]
  - - [2944, 5888, 1, 128]
    - [69, 0]
  - - [704, 5888, 1, 1280]
    - [74, 0]
  - - [2368, 3584, 1, 128]
    - [66, 0]
  - - [6784, 5888, 1, 3328]
    - [72, 0]
  - - [704, 1024, 1, 1280]
    - [73, 0]
  - - [448, 256, 1, 3328]
    - [56, 0]
  - - [448, 1856, 1, 128]
    - [67, 0]
  - - [128, 1024, 1, 128]
    - [1, 0]
  - - [2944, 4, 1, 128]
    - [86, 0]
  - - [1024, 704, 1, 1280]
    - [74, 0]
  - - [128, 5888, 1, 256]
    - [74, 0]
  - - [1024, 5056, 1, 1280]
    - [79, 0]
  - - [4288, 1024, 1, 256]
    - [81, 0]
  - - [2944, 2368, 1, 128]
    - [66, 0]
  - - [704, 704, 1, 3328]
    - [74, 0]
  - - [704, 1408, 1, 1280]
    - [74, 0]
  - - [5888, 448, 1, 1280]
    - [80, 0]
  - - [3584, 256, 1, 3328]
    - [74, 0]
  - - [704, 5888, 1, 3328]
    - [80, 0]
  - - [704, 1856, 1, 128]
    - [66, 0]
  - - [128, 3584, 1, 3328]
    - [36, 0]
  - - [6784, 2368, 1, 1280]
    - [85, 0]
  - - [4, 4288, 1, 128]
    - [86, 0]
  - - [128, 704, 1, 1280]
    - [48, 0]
  - - [3584, 2944, 1, 256]
    - [85, 0]
  - - [1856, 128, 1, 3328]
    - [27, 0]
  - - [4, 64, 1, 1280]
    - [43, 0]
  - - [4, 5056, 1, 3328]
    - [23, 0]
  - - [128, 2944, 1, 1280]
    - [27, 0]
  - - [2368, 1024, 1, 3328]
    - [80, 0]
  - - [128, 256, 1, 3328]
    - [61, 0]
  - - [1408, 5056, 1, 3328]
    - [79, 0]
  - - [1856, 1856, 1, 3328]
    - [78, 0]
  - - [3584, 128, 1, 256]
    - [74, 0]
  - - [448, 1408, 1, 3328]
    - [74, 0]
  - - [2368, 2368, 1, 256]
    - [81, 0]
  - - [4288, 4288, 1, 1280]
    - [76, 0]
  - - [64, 448, 1, 1280]
    - [47, 0]
  - - [1408, 4288, 1, 256]
    - [74, 0]
  - - [448, 4, 1, 256]
    - [92, 0]
  - - [5888, 448, 1, 128]
    - [69, 0]
  - - [448, 4, 1, 1280]
    - [43, 0]
  - - [704, 6784, 1, 3328]
    - [73, 0]
  - - [5888, 5888, 1, 1280]
    - [80, 0]
  - - [5056, 1024, 1, 1280]
    - [83, 0]
  - - [448, 5888, 1, 3328]
    - [74, 0]
  - - [128, 4, 1, 128]
    - [86, 0]
  - - [1024, 2944, 1, 1280]
    - [82, 0]
  - - [5056, 5888, 1, 1280]
    - [73, 0]
  - - [4288, 5888, 1, 128]
    - [66, 0]
  - - [256, 3584, 1, 256]
    - [74, 0]
  - - [1408, 3584, 1, 128]
    - [66, 0]
  - - [256, 2944, 1, 3328]
    - [77, 0]
  - - [448, 3584, 1, 128]
    - [69, 0]
  - - [5888, 2944, 1, 1280]
    - [79, 0]
  - - [4, 6784, 1, 1280]
    - [23, 0]
  - - [2368, 5888, 1, 128]
    - [66, 0]
  - - [64, 2944, 1, 128]
    - [10, 0]
  - - [3584, 5888, 1, 256]
    - [80, 0]
  - - [2368, 704, 1, 128]
    - [69, 0]
  - - [3584, 2944, 1, 1280]
    - [74, 0]
  - - [3584, 2368, 1, 128]
    - [66, 0]
  - - [5056, 704, 1, 128]
    - [66, 0]
  - - [448, 2368, 1, 128]
    - [69, 0]
  - - [5056, 1408, 1, 3328]
    - [85, 0]
  - - [1408, 704, 1, 256]
    - [77, 0]
  - - [6784, 1024, 1, 3328]
    - [72, 0]
  - - [6784, 2944, 1, 3328]
    - [73, 0]
  - - [2944, 5056, 1, 3328]
    - [74, 0]
  - - [1856, 1856, 1, 256]
    - [74, 0]
  - - [1024, 5888, 1, 128]
    - [66, 0]
  - - [2048, 7133, 1, 2048]
    - [72, 0]
  - - [256, 4, 1, 128]
    - [87, 0]
  - - [4288, 5888, 1, 1280]
    - [82, 0]
  - - [4288, 4288, 1, 256]
    - [77, 0]
  - - [448, 2944, 1, 3328]
    - [80, 0]
  - - [4288, 1856, 1, 1280]
    - [80, 0]
  - - [1856, 2944, 1, 3328]
    - [74, 0]
  - - [256, 6784, 1, 3328]
    - [74, 0]
  - - [64, 5888, 1, 256]
    - [74, 0]
  - - [256, 5056, 1, 128]
    - [66, 0]
  - - [5056, 1024, 1, 256]
    - [85, 0]
  - - [704, 64, 1, 3328]
    - [62, 0]
  - - [5056, 1856, 1, 3328]
    - [79, 0]
  - - [4, 2944, 1, 3328]
    - [29, 0]
  - - [4, 5056, 1, 256]
    - [89, 0]
  - - [1856, 1408, 1, 256]
    - [74, 0]
  - - [3584, 4, 1, 128]
    - [86, 0]
  - - [448, 448, 1, 3328]
    - [48, 0]
  - - [6784, 128, 1, 3328]
    - [41, 0]
  - - [4288, 1408, 1, 128]
    - [69, 0]
  - - [4288, 5056, 1, 256]
    - [74, 0]
  - - [1408, 128, 1, 1280]
    - [56, 0]
  - - [5056, 256, 1, 3328]
    - [77, 0]
  - - [704, 704, 1, 256]
    - [74, 0]
  - - [1024, 5888, 1, 1280]
    - [79, 0]
  - - [6784, 2368, 1, 128]
    - [67, 0]
  - - [4, 5056, 1, 1280]
    - [40, 0]
  - - [64, 128, 1, 256]
    - [42, 0]
  - - [128, 1856, 1, 1280]
    - [36, 0]
  - - [5056, 3584, 1, 256]
    - [80, 0]
  - - [1856, 1024, 1, 1280]
    - [72, 0]
  - - [6784, 4288, 1, 1280]
    - [73, 0]
  - - [1856, 1856, 1, 1280]
    - [75, 0]
  - - [6784, 2944, 1, 128]
    - [66, 0]
  - - [1408, 5056, 1, 1280]
    - [75, 0]
  - - [4, 2368, 1, 3328]
    - [40, 0]
  - - [5888, 1856, 1, 128]
    - [65, 0]
  - - [448, 704, 1, 1280]
    - [74, 0]
  - - [2368, 1024, 1, 128]
    - [69, 0]
  - - [1024, 448, 1, 3328]
    - [74, 0]
  - - [1856, 704, 1, 1280]
    - [74, 0]
  - - [5056, 3584, 1, 128]
    - [66, 0]
  - - [5888, 5888, 1, 3328]
    - [82, 0]
  - - [6784, 1024, 1, 256]
    - [85, 0]
  - - [2944, 2368, 1, 256]
    - [80, 0]
  - - [256, 448, 1, 256]
    - [31, 0]
  - - [5056, 5888, 1, 3328]
    - [75, 0]
  - - [1856, 1024, 1, 256]
    - [80, 0]
  - - [448, 1408, 1, 1280]
    - [74, 0]
  - - [3584, 448, 1, 1280]
    - [80, 0]
  - - [1024, 1024, 1, 1280]
    - [77, 0]
  - - [448, 5888, 1, 256]
    - [74, 0]
  - - [704, 64, 1, 128]
    - [19, 0]
  - - [1408, 6784, 1, 3328]
    - [80, 0]
  - - [448, 1024, 1, 128]
    - [69, 0]
  - - [4288, 704, 1, 128]
    - [66, 0]
  - - [128, 1856, 1, 128]
    - [5, 0]
  - - [448, 2368, 1, 3328]
    - [80, 0]
  - - [5056, 64, 1, 128]
    - [5, 0]
  - - [5056, 2944, 1, 256]
    - [74, 0]
  - - [6784, 5888, 1, 128]
    - [65, 0]
  - - [704, 1024, 1, 256]
    - [80, 0]
  - - [1024, 4, 1, 256]
    - [29, 0]
  - - [2368, 1856, 1, 256]
    - [80, 0]
  - - [128, 6784, 1, 1280]
    - [77, 0]
  - - [1408, 3584, 1, 3328]
    - [81, 0]
  - - [2368, 6784, 1, 256]
    - [74, 0]
  - - [5056, 1408, 1, 1280]
    - [79, 0]
  - - [256, 256, 1, 128]
    - [11, 0]
  - - [5056, 4288, 1, 128]
    - [69, 0]
  - - [1408, 1856, 1, 128]
    - [66, 0]
  - - [1408, 5888, 1, 3328]
    - [78, 0]
  - - [1856, 256, 1, 256]
    - [80, 0]
  - - [6784, 6784, 1, 256]
    - [73, 0]
  - - [64, 256, 1, 128]
    - [12, 0]
  - - [4288, 2368, 1, 128]
    - [65, 0]
  - - [1856, 4288, 1, 128]
    - [66, 0]
  - - [256, 4288, 1, 1280]
    - [74, 0]
  - - [2368, 2944, 1, 256]
    - [79, 0]
  - - [4, 1856, 1, 256]
    - [92, 0]
  - - [3584, 1856, 1, 1280]
    - [74, 0]
  - - [6784, 6784, 1, 128]
    - [66, 0]
  - - [256, 1856, 1, 128]
    - [69, 0]
  - - [704, 64, 1, 1280]
    - [47, 0]
  - - [5888, 5056, 1, 256]
    - [80, 0]
  - - [3584, 448, 1, 256]
    - [80, 0]
  - - [448, 4288, 1, 128]
    - [66, 0]
  - - [2944, 4288, 1, 3328]
    - [75, 0]
  - - [256, 6784, 1, 256]
    - [74, 0]
  - - [1408, 4288, 1, 128]
    - [69, 0]
  - - [2944, 704, 1, 3328]
    - [80, 0]
  - - [128, 448, 1, 256]
    - [46, 0]
  - - [512, 32, 1, 512]
    - [46, 0]
  - - [3584, 3584, 1, 256]
    - [75, 0]
  - - [448, 1408, 1, 128]
    - [66, 0]
  - - [128, 256, 1, 1280]
    - [47, 0]
  - - [3584, 5056, 1, 256]
    - [72, 0]
  - - [6784, 128, 1, 256]
    - [74, 0]
  - - [4288, 4, 1, 256]
    - [90, 0]
  - - [64, 1408, 1, 3328]
    - [48, 0]
  - - [704, 448, 1, 256]
    - [80, 0]
  - - [2944, 2368, 1, 1280]
    - [81, 0]
  - - [448, 64, 1, 3328]
    - [61, 0]
  - - [1408, 3584, 1, 256]
    - [74, 0]
  - - [3584, 4, 1, 3328]
    - [29, 0]
  - - [6784, 3584, 1, 256]
    - [79, 0]
  - - [256, 128, 1, 128]
    - [12, 0]
  - - [704, 1408, 1, 128]
    - [66, 0]
  - - [4, 2368, 1, 256]
    - [92, 0]
  - - [2944, 448, 1, 128]
    - [66, 0]
  - - [128, 1408, 1, 256]
    - [74, 0]
  - - [4, 2944, 1, 256]
    - [90, 0]
  - - [64, 128, 1, 3328]
    - [43, 0]
  - - [5056, 2368, 1, 128]
    - [66, 0]
  - - [2944, 2944, 1, 3328]
    - [83, 0]
  - - [5056, 6784, 1, 256]
    - [85, 0]
  - - [1856, 3584, 1, 128]
    - [66, 0]
  - - [128, 2944, 1, 128]
    - [4, 0]
  - - [1024, 704, 1, 3328]
    - [84, 0]
  - - [6784, 448, 1, 256]
    - [80, 0]
  - - [3584, 6784, 1, 128]
    - [66, 0]
  - - [128, 4288, 1, 256]
    - [74, 0]
  - - [704, 448, 1, 3328]
    - [75, 0]
  - - [1024, 1024, 1, 3328]
    - [77, 0]
  - - [128, 128, 1, 3328]
    - [60, 0]
  - - [5056, 1856, 1, 256]
    - [74, 0]
  - - [256, 128, 1, 256]
    - [46, 0]
  - - [1024, 1856, 1, 256]
    - [85, 0]
  - - [4288, 64, 1, 128]
    - [2, 0]
  - - [256, 448, 1, 3328]
    - [49, 0]
  - - [1408, 6784, 1, 1280]
    - [74, 0]
  - - [3584, 3584, 1, 1280]
    - [79, 0]
  - - [64, 2368, 1, 1280]
    - [48, 0]
  - - [448, 2368, 1, 1280]
    - [74, 0]
  - - [5888, 5888, 1, 128]
    - [66, 0]
  - - [64, 6784, 1, 3328]
    - [80, 0]
  - - [2944, 256, 1, 1280]
    - [83, 0]
  - - [5056, 5888, 1, 128]
    - [65, 0]
  - - [256, 2368, 1, 128]
    - [66, 0]
  - - [5056, 2368, 1, 3328]
    - [77, 0]
  - - [2944, 4288, 1, 256]
    - [85, 0]
  - - [1408, 3584, 1, 1280]
    - [74, 0]
  - - [2368, 64, 1, 256]
    - [46, 0]
  - - [64, 448, 1, 3328]
    - [61, 0]
  - - [256, 256, 1, 3328]
    - [48, 0]
  - - [5888, 4, 1, 128]
    - [87, 0]
  - - [1856, 704, 1, 256]
    - [74, 0]
  - - [4, 4288, 1, 1280]
    - [21, 0]
  - - [1408, 448, 1, 3328]
    - [82, 0]
  - - [1024, 4, 1, 3328]
    - [40, 0]
  - - [2368, 256, 1, 256]
    - [80, 0]
  - - [2368, 6784, 1, 3328]
    - [80, 0]
  - - [1856, 1408, 1, 1280]
    - [85, 0]
  - - [1856, 448, 1, 1280]
    - [72, 0]
  - - [6784, 704, 1, 128]
    - [66, 0]
  - - [4, 4, 1, 256]
    - [43, 0]
  - - [128, 5888, 1, 128]
    - [4, 0]
  - - [1408, 5888, 1, 256]
    - [79, 0]
  - - [704, 2944, 1, 1280]
    - [81, 0]
  - - [1856, 2368, 1, 128]
    - [69, 0]
  - - [4096, 7133, 1, 4096]
    - [73, 0]
  - - [256, 64, 1, 256]
    - [37, 0]
  - - [1024, 1024, 1, 256]
    - [80, 0]
  - - [704, 1856, 1, 256]
    - [80, 0]
  - - [128, 4288, 1, 3328]
    - [36, 0]
  - - [3584, 704, 1, 1280]
    - [83, 0]
  - - [256, 128, 1, 1280]
    - [34, 0]
  - - [2368, 4, 1, 256]
    - [29, 0]
  - - [256, 2368, 1, 1280]
    - [74, 0]
  - - [2944, 6784, 1, 128]
    - [65, 0]
  - - [3584, 448, 1, 3328]
    - [74, 0]
  - - [1408, 4, 1, 256]
    - [92, 0]
  - - [704, 2368, 1, 3328]
    - [74, 0]
  - - [2944, 448, 1, 256]
    - [74, 0]
  - - [1856, 448, 1, 128]
    - [69, 0]
  - - [2368, 128, 1, 1280]
    - [56, 0]
  - - [256, 5888, 1, 128]
    - [71, 0]
  - - [64, 6784, 1, 256]
    - [74, 0]
  - - [64, 5056, 1, 1280]
    - [48, 0]
  - - [4, 6784, 1, 128]
    - [86, 0]
  - - [2944, 2944, 1, 1280]
    - [83, 0]
  - - [5888, 2368, 1, 256]
    - [85, 0]
  - - [4, 3584, 1, 1280]
    - [29, 0]
  - - [1408, 128, 1, 128]
    - [15, 0]
  - - [6784, 704, 1, 3328]
    - [80, 0]
  - - [128, 64, 1, 1280]
    - [59, 0]
  - - [2368, 256, 1, 1280]
    - [80, 0]
  - - [4, 448, 1, 3328]
    - [43, 0]
  - - [5888, 4288, 1, 128]
    - [67, 0]
  - - [4, 5888, 1, 256]
    - [29, 0]
  - - [1408, 2944, 1, 3328]
    - [83, 0]
  - - [3584, 704, 1, 128]
    - [69, 0]
  - - [64, 1024, 1, 256]
    - [47, 0]
  - - [5056, 5056, 1, 128]
    - [70, 0]
  - - [2368, 448, 1, 1280]
    - [74, 0]
  - - [128, 3584, 1, 256]
    - [77, 0]
  - - [704, 448, 1, 1280]
    - [75, 0]
  - - [448, 5056, 1, 128]
    - [66, 0]
  - - [256, 4, 1, 1280]
    - [97, 0]
  - - [128, 5056, 1, 256]
    - [80, 0]
  - - [1408, 5056, 1, 128]
    - [69, 0]
  - - [2944, 3584, 1, 128]
    - [69, 0]
  - - [3584, 2368, 1, 256]
    - [74, 0]
  - - [5888, 5056, 1, 1280]
    - [85, 0]
  - - [2368, 5056, 1, 128]
    - [69, 0]
  - - [64, 704, 1, 256]
    - [29, 0]
  - - [4288, 256, 1, 1280]
    - [74, 0]
  - - [3584, 3584, 1, 3328]
    - [75, 0]
  - - [1024, 256, 1, 128]
    - [66, 0]
  - - [4, 704, 1, 128]
    - [87, 0]
  - - [5888, 6784, 1, 256]
    - [73, 0]
  - - [4288, 2944, 1, 3328]
    - [77, 0]
  - - [2944, 64, 1, 128]
    - [13, 0]
  - - [1856, 64, 1, 256]
    - [39, 0]
  - - [4288, 128, 1, 3328]
    - [33, 0]
  - - [4288, 704, 1, 1280]
    - [80, 0]
  - - [256, 5056, 1, 1280]
    - [74, 0]
  - - [1408, 256, 1, 128]
    - [69, 0]
  - - [2944, 5888, 1, 3328]
    - [74, 0]
  - - [6784, 5888, 1, 1280]
    - [85, 0]
  - - [704, 128, 1, 256]
    - [31, 0]
  - - [5888, 4288, 1, 1280]
    - [77, 0]
  - - [448, 256, 1, 1280]
    - [56, 0]
  - - [5888, 3584, 1, 128]
    - [65, 0]
  - - [1856, 1856, 1, 128]
    - [69, 0]
  - - [5056, 4, 1, 1280]
    - [89, 0]
  - - [256, 1408, 1, 1280]
    - [80, 0]
  - - [512, 16, 1, 512]
    - [40, 0]
  - - [704, 3584, 1, 128]
    - [69, 0]
  - - [5888, 448, 1, 3328]
    - [85, 0]
  - - [2368, 4288, 1, 1280]
    - [84, 0]
  - - [4288, 2944, 1, 128]
    - [66, 0]
  - - [1024, 6784, 1, 3328]
    - [80, 0]
  - - [128, 2368, 1, 256]
    - [80, 0]
  - - [6784, 64, 1, 3328]
    - [74, 0]
  - - [5056, 2944, 1, 3328]
    - [77, 0]
  - - [448, 128, 1, 256]
    - [29, 0]
  - - [2944, 3584, 1, 256]
    - [74, 0]
  - - [1408, 1408, 1, 3328]
    - [72, 0]
  - - [1856, 128, 1, 1280]
    - [74, 0]
  - - [3584, 3584, 1, 128]
    - [65, 0]
  - - [64, 3584, 1, 256]
    - [80, 0]
  - - [1408, 4, 1, 3328]
    - [24, 0]
  - - [128, 2944, 1, 3328]
    - [48, 0]
  - - [3584, 704, 1, 256]
    - [74, 0]
  - - [2944, 448, 1, 3328]
    - [80, 0]
  - - [3584, 1408, 1, 3328]
    - [72, 0]
  - - [704, 3584, 1, 1280]
    - [80, 0]
  - - [2944, 6784, 1, 1280]
    - [72, 0]
  - - [1856, 6784, 1, 256]
    - [74, 0]
  - - [4288, 448, 1, 3328]
    - [80, 0]
  - - [6784, 4288, 1, 128]
    - [70, 0]
  - - [6784, 704, 1, 1280]
    - [74, 0]
  - - [256, 4288, 1, 256]
    - [74, 0]
  - - [3584, 64, 1, 128]
    - [13, 0]
  - - [5888, 1024, 1, 3328]
    - [72, 0]
  - - [448, 64, 1, 128]
    - [4, 0]
  - - [704, 6784, 1, 1280]
    - [80, 0]
  - - [5888, 128, 1, 256]
    - [80, 0]
  - - [2368, 448, 1, 3328]
    - [80, 0]
  - - [1856, 5056, 1, 3328]
    - [79, 0]
  - - [4, 6784, 1, 256]
    - [88, 0]
  - - [1024, 3584, 1, 128]
    - [66, 0]
  - - [1024, 1408, 1, 128]
    - [69, 0]
  - - [2368, 2944, 1, 128]
    - [69, 0]
  - - [5056, 64, 1, 256]
    - [38, 0]
  - - [4, 448, 1, 1280]
    - [43, 0]
  - - [5056, 2944, 1, 128]
    - [70, 0]
  - - [5888, 5056, 1, 3328]
    - [84, 0]
  - - [1024, 704, 1, 128]
    - [69, 0]
  - - [1408, 2368, 1, 128]
    - [69, 0]
  - - [5888, 2368, 1, 128]
    - [66, 0]
  - - [128, 5056, 1, 3328]
    - [56, 0]
  - - [3584, 6784, 1, 1280]
    - [83, 0]
  - - [3072, 7435, 1, 1024]
    - [77, 0]
  - - [1856, 5888, 1, 256]
    - [74, 0]
  - - [256, 256, 1, 256]
    - [26, 0]
  - - [256, 64, 1, 128]
    - [12, 0]
  - - [4288, 4288, 1, 3328]
    - [79, 0]
  - - [4288, 1408, 1, 1280]
    - [85, 0]
  - - [3584, 5056, 1, 128]
    - [71, 0]
  - - [4, 1024, 1, 3328]
    - [40, 0]
  - - [4288, 2368, 1, 256]
    - [74, 0]
  - - [2944, 5056, 1, 1280]
    - [74, 0]
  - - [448, 6784, 1, 256]
    - [73, 0]
  - - [64, 1024, 1, 3328]
    - [56, 0]
  - - [6784, 2368, 1, 3328]
    - [83, 0]
  - - [256, 1024, 1, 1280]
    - [80, 0]
  - - [704, 4, 1, 128]
    - [86, 0]
  - - [256, 4, 1, 256]
    - [43, 0]
  - - [4288, 128, 1, 256]
    - [74, 0]
  - - [4288, 1856, 1, 3328]
    - [85, 0]
  - - [3584, 448, 1, 128]
    - [66, 0]
  - - [256, 4, 1, 3328]
    - [97, 0]
  - - [4, 1408, 1, 1280]
    - [40, 0]
  - - [3584, 64, 1, 1280]
    - [28, 0]
  - - [1408, 448, 1, 128]
    - [66, 0]
  - - [3584, 1024, 1, 1280]
    - [80, 0]
  - - [1856, 5056, 1, 256]
    - [72, 0]
  - - [4, 3584, 1, 256]
    - [90, 0]
  - - [1024, 4288, 1, 256]
    - [75, 0]
  - - [5888, 3584, 1, 3328]
    - [78, 0]
  - - [4, 256, 1, 256]
    - [94, 0]
  - - [5056, 3584, 1, 3328]
    - [79, 0]
  - - [128, 5888, 1, 1280]
    - [74, 0]
  - - [704, 448, 1, 128]
    - [66, 0]
  - - [2368, 1408, 1, 1280]
    - [74, 0]
  - - [5056, 2944, 1, 1280]
    - [85, 0]
  - - [4, 4, 1, 128]
    - [87, 0]
  - - [3584, 256, 1, 256]
    - [74, 0]
  - - [128, 1856, 1, 3328]
    - [27, 0]
  - - [1024, 6784, 1, 256]
    - [80, 0]
  - - [4, 128, 1, 256]
    - [40, 0]
  - - [64, 64, 1, 1280]
    - [59, 0]
  - - [6784, 4, 1, 128]
    - [87, 0]
  - - [2944, 1408, 1, 128]
    - [69, 0]
  - - [448, 128, 1, 3328]
    - [56, 0]
  - - [64, 2944, 1, 3328]
    - [56, 0]
  - - [64, 4288, 1, 3328]
    - [56, 0]
  - - [5056, 6784, 1, 3328]
    - [80, 0]
  - - [128, 2944, 1, 256]
    - [74, 0]
  - - [128, 6784, 1, 128]
    - [3, 0]
  - - [3584, 4288, 1, 256]
    - [80, 0]
  - - [448, 1856, 1, 256]
    - [80, 0]
  - - [1856, 6784, 1, 3328]
    - [85, 0]
  - - [3584, 128, 1, 3328]
    - [74, 0]
  - - [64, 1856, 1, 256]
    - [25, 0]
  - - [1024, 448, 1, 1280]
    - [80, 0]
  - - [5888, 4288, 1, 256]
    - [80, 0]
  - - [4, 448, 1, 128]
    - [87, 0]
  - - [5056, 1408, 1, 256]
    - [74, 0]
  - - [64, 256, 1, 1280]
    - [40, 0]
  - - [3584, 1024, 1, 256]
    - [85, 0]
  - - [256, 704, 1, 256]
    - [74, 0]
  - - [5888, 5888, 1, 256]
    - [85, 0]
  - - [4288, 1024, 1, 1280]
    - [80, 0]
  - - [5888, 128, 1, 3328]
    - [74, 0]
  - - [448, 6784, 1, 3328]
    - [74, 0]
  - - [2944, 1408, 1, 1280]
    - [85, 0]
  - - [1024, 32, 1, 512]
    - [29, 0]
  - - [2944, 1856, 1, 3328]
    - [74, 0]
  - - [2368, 64, 1, 128]
    - [13, 0]
  - - [2944, 2944, 1, 128]
    - [65, 0]
  - - [4, 128, 1, 3328]
    - [95, 0]
  - - [3584, 5888, 1, 1280]
    - [74, 0]
  - - [64, 4, 1, 128]
    - [86, 0]
  - - [6784, 1856, 1, 1280]
    - [74, 0]
  - - [2944, 5056, 1, 256]
    - [80, 0]
  - - [2944, 5888, 1, 1280]
    - [73, 0]
  - - [5888, 256, 1, 3328]
    - [80, 0]
  - - [1856, 5888, 1, 3328]
    - [80, 0]
  - - [3584, 1408, 1, 256]
    - [80, 0]
  - - [704, 3584, 1, 3328]
    - [80, 0]
  - - [5056, 448, 1, 1280]
    - [80, 0]
  - - [3584, 1856, 1, 3328]
    - [72, 0]
  - - [64, 1408, 1, 128]
    - [1, 0]
  - - [1408, 704, 1, 1280]
    - [74, 0]
  - - [2944, 1024, 1, 256]
    - [85, 0]
  - - [1024, 2368, 1, 128]
    - [69, 0]
  - - [2368, 4288, 1, 3328]
    - [80, 0]
  - - [4, 1408, 1, 256]
    - [92, 0]
  - - [1024, 1408, 1, 1280]
    - [80, 0]
  - - [64, 64, 1, 256]
    - [40, 0]
  - - [704, 256, 1, 3328]
    - [74, 0]
  - - [6784, 5056, 1, 256]
    - [73, 0]
  - - [4, 4288, 1, 3328]
    - [24, 0]
  - - [448, 6784, 1, 128]
    - [66, 0]
  - - [4, 704, 1, 3328]
    - [96, 0]
  - - [448, 2944, 1, 256]
    - [74, 0]
  - - [2944, 6784, 1, 256]
    - [80, 0]
  - - [2368, 2368, 1, 1280]
    - [85, 0]
  - - [4, 4, 1, 1280]
    - [43, 0]
  - - [1856, 3584, 1, 1280]
    - [72, 0]
  - - [64, 2944, 1, 256]
    - [46, 0]
  - - [3584, 1408, 1, 1280]
    - [85, 0]
  - - [448, 256, 1, 128]
    - [1, 0]
  - - [4288, 448, 1, 128]
    - [67, 0]
  - - [5056, 256, 1, 1280]
    - [80, 0]
  - - [1856, 1408, 1, 3328]
    - [74, 0]
  - - [128, 128, 1, 128]
    - [9, 0]
  - - [1024, 4288, 1, 3328]
    - [77, 0]
  - - [448, 2368, 1, 256]
    - [81, 0]
  - - [1024, 4, 1, 128]
    - [87, 0]
  - - [5056, 448, 1, 256]
    - [80, 0]
  - - [2944, 2368, 1, 3328]
    - [73, 0]
  - - [704, 128, 1, 3328]
    - [48, 0]
  - - [64, 64, 1, 3328]
    - [64, 0]
  - - [1024, 1856, 1, 1280]
    - [79, 0]
  - - [6784, 1856, 1, 256]
    - [80, 0]
  - - [128, 2368, 1, 3328]
    - [56, 0]
  - - [1024, 5888, 1, 256]
    - [80, 0]
  - - [5056, 128, 1, 1280]
    - [36, 0]
  - - [5056, 64, 1, 3328]
    - [41, 0]
  - - [128, 704, 1, 128]
    - [2, 0]
  - - [1408, 2368, 1, 256]
    - [74, 0]
  - - [1408, 1408, 1, 256]
    - [85, 0]
  - - [4, 64, 1, 128]
    - [87, 0]
  - - [64, 128, 1, 1280]
    - [59, 0]
  - - [2368, 2368, 1, 128]
    - [69, 0]
  - - [64, 5888, 1, 128]
    - [2, 0]
  - - [5888, 4, 1, 3328]
    - [23, 0]
  - - [6784, 1408, 1, 128]
    - [70, 0]
  - - [4288, 5888, 1, 256]
    - [85, 0]
  - - [1408, 5056, 1, 256]
    - [74, 0]
  - - [5056, 128, 1, 3328]
    - [56, 0]
  - - [128, 128, 1, 1280]
    - [44, 0]
  - - [448, 704, 1, 256]
    - [75, 0]
  - - [4288, 3584, 1, 128]
    - [66, 0]
  - - [2944, 128, 1, 3328]
    - [41, 0]
  - - [128, 5056, 1, 1280]
    - [27, 0]
  - - [3584, 5056, 1, 1280]
    - [79, 0]
  - - [256, 448, 1, 1280]
    - [35, 0]
  - - [704, 704, 1, 128]
    - [69, 0]
  - - [5056, 4, 1, 128]
    - [87, 0]
  - - [704, 256, 1, 1280]
    - [74, 0]
  - - [64, 2368, 1, 3328]
    - [48, 0]
  - - [1856, 1024, 1, 128]
    - [65, 0]
  - - [1856, 64, 1, 128]
    - [4, 0]
  - - [64, 6784, 1, 1280]
    - [27, 0]
  - - [704, 4288, 1, 256]
    - [80, 0]
  - - [5888, 2368, 1, 1280]
    - [74, 0]
  - - [128, 256, 1, 256]
    - [44, 0]
  - - [256, 64, 1, 1280]
    - [46, 0]
  - - [2368, 5888, 1, 1280]
    - [85, 0]
  - - [5888, 256, 1, 1280]
    - [74, 0]
  - - [4, 5888, 1, 1280]
    - [21, 0]
  - - [704, 128, 1, 128]
    - [9, 0]
  - - [1024, 4, 1, 1280]
    - [40, 0]
  - - [2368, 1856, 1, 3328]
    - [72, 0]
  - - [2368, 128, 1, 128]
    - [7, 0]
  - - [2944, 704, 1, 256]
    - [74, 0]
  - - [5056, 128, 1, 128]
    - [3, 0]
  - - [256, 704, 1, 3328]
    - [74, 0]
  - - [704, 3584, 1, 256]
    - [75, 0]
  - - [1024, 1024, 1, 1024]
    - [80, 0]
  - - [704, 2944, 1, 3328]
    - [80, 0]
  - - [6784, 1024, 1, 128]
    - [65, 0]
  - - [256, 448, 1, 128]
    - [12, 0]
  - - [448, 1024, 1, 3328]
    - [74, 0]
  - - [2944, 1024, 1, 3328]
    - [77, 0]
  - - [2944, 5056, 1, 128]
    - [69, 0]
  - - [1408, 6784, 1, 256]
    - [80, 0]
  - - [6784, 1408, 1, 3328]
    - [76, 0]
  - - [4288, 6784, 1, 128]
    - [65, 0]
  - - [704, 64, 1, 256]
    - [54, 0]
  - - [5888, 4, 1, 1280]
    - [91, 0]
  - - [256, 2368, 1, 3328]
    - [74, 0]
  - - [6784, 2944, 1, 1280]
    - [73, 0]
  - - [4288, 1856, 1, 128]
    - [69, 0]
  - - [1856, 2944, 1, 128]
    - [66, 0]
  - - [6784, 448, 1, 128]
    - [66, 0]
  - - [64, 3584, 1, 128]
    - [13, 0]
  - - [448, 5056, 1, 1280]
    - [74, 0]
  - - [2368, 1856, 1, 128]
    - [66, 0]
  - - [128, 448, 1, 1280]
    - [56, 0]
  - - [4288, 704, 1, 256]
    - [74, 0]
  - - [256, 3584, 1, 128]
    - [66, 0]
  - - [5888, 704, 1, 256]
    - [74, 0]
  - - [3584, 1024, 1, 128]
    - [69, 0]
  - - [256, 5888, 1, 3328]
    - [83, 0]
  - - [1408, 4288, 1, 3328]
    - [85, 0]
  - - [6784, 4288, 1, 256]
    - [73, 0]
  - - [4288, 256, 1, 128]
    - [66, 0]
  - - [5888, 256, 1, 256]
    - [74, 0]
  - - [6784, 1024, 1, 1280]
    - [85, 0]
  - - [5888, 1024, 1, 128]
    - [69, 0]
  - - [1024, 128, 1, 256]
    - [80, 0]
  - - [128, 64, 1, 3328]
    - [63, 0]
  - - [448, 64, 1, 256]
    - [46, 0]
  - - [2368, 256, 1, 128]
    - [67, 0]
  - - [6784, 3584, 1, 1280]
    - [80, 0]
  - - [1024, 6784, 1, 1280]
    - [78, 0]
  - - [2944, 64, 1, 1280]
    - [36, 0]
  - - [1408, 2944, 1, 1280]
    - [75, 0]
  - - [256, 1856, 1, 256]
    - [83, 0]
  - - [1408, 2368, 1, 3328]
    - [83, 0]
  - - [2944, 4, 1, 3328]
    - [29, 0]
  - - [128, 1408, 1, 3328]
    - [48, 0]
  - - [2944, 1856, 1, 128]
    - [66, 0]
  - - [256, 2944, 1, 128]
    - [69, 0]
  - - [256, 6784, 1, 128]
    - [69, 0]
  - - [2368, 4, 1, 128]
    - [87, 0]
  - - [1408, 256, 1, 3328]
    - [74, 0]
  - - [1856, 4, 1, 128]
    - [86, 0]
  - - [1024, 16, 1, 512]
    - [42, 0]
  - - [5056, 6784, 1, 128]
    - [70, 0]
  - - [4288, 5056, 1, 128]
    - [69, 0]
  - - [1856, 5888, 1, 128]
    - [65, 0]
  - - [2944, 5888, 1, 256]
    - [85, 0]
  - - [3584, 1856, 1, 256]
    - [80, 0]
  - - [4288, 3584, 1, 1280]
    - [73, 0]
  - - [2368, 448, 1, 256]
    - [74, 0]
  - - [4288, 256, 1, 3328]
    - [74, 0]
  - - [1856, 704, 1, 128]
    - [66, 0]
  - - [1408, 64, 1, 256]
    - [30, 0]
  - - [64, 1856, 1, 128]
    - [6, 0]
  - - [4, 256, 1, 128]
    - [87, 0]
  - - [704, 4288, 1, 3328]
    - [80, 0]
  - - [704, 5888, 1, 128]
    - [67, 0]
  - - [6784, 3584, 1, 128]
    - [65, 0]
  - - [1024, 64, 1, 256]
    - [25, 0]
  - - [64, 2368, 1, 256]
    - [80, 0]
  - - [4288, 5056, 1, 3328]
    - [79, 0]
  - - [4, 1856, 1, 1280]
    - [29, 0]
  - - [4288, 128, 1, 128]
    - [66, 0]
  - - [1408, 1408, 1, 128]
    - [69, 0]
  - - [1024, 128, 1, 3328]
    - [51, 0]
  - - [1856, 128, 1, 128]
    - [2, 0]
  - - [5056, 2368, 1, 256]
    - [85, 0]
  - - [4288, 704, 1, 3328]
    - [73, 0]
  - - [448, 3584, 1, 256]
    - [83, 0]
  - - [64, 128, 1, 128]
    - [20, 0]
  - - [2368, 64, 1, 1280]
    - [56, 0]
  - - [2368, 1024, 1, 1280]
    - [81, 0]
  - - [2944, 1408, 1, 3328]
    - [83, 0]
  - - [1408, 448, 1, 256]
    - [80, 0]
  - - [1024, 1408, 1, 3328]
    - [77, 0]
  - - [2560, 7133, 1, 2560]
    - [72, 0]
  - - [1408, 4, 1, 1280]
    - [24, 0]
  - - [5888, 3584, 1, 256]
    - [85, 0]
  - - [128, 1024, 1, 1280]
    - [27, 0]
  - - [1408, 1856, 1, 3328]
    - [77, 0]
  - - [4, 4, 1, 3328]
    - [97, 0]
  - - [6784, 1408, 1, 1280]
    - [74, 0]
  - - [4, 1024, 1, 1280]
    - [24, 0]
  - - [704, 2944, 1, 256]
    - [80, 0]
  - - [704, 4288, 1, 128]
    - [66, 0]
  - - [2368, 4288, 1, 128]
    - [66, 0]
  - - [64, 4288, 1, 1280]
    - [56, 0]
  - - [6784, 64, 1, 1280]
    - [36, 0]
  - - [3584, 128, 1, 128]
    - [2, 0]
  - - [1024, 6784, 1, 128]
    - [67, 0]
  - - [4, 1856, 1, 128]
    - [87, 0]
  - - [1408, 64, 1, 3328]
    - [56, 0]
  - - [6784, 4, 1, 256]
    - [89, 0]
  - - [1408, 1408, 1, 1280]
    - [85, 0]
  - - [256, 2368, 1, 256]
    - [77, 0]
  - - [448, 4288, 1, 3328]
    - [74, 0]
  - - [2368, 1408, 1, 256]
    - [80, 0]
  - - [5888, 5056, 1, 128]
    - [66, 0]
  - - [704, 2368, 1, 256]
    - [80, 0]
  - - [2944, 448, 1, 1280]
    - [80, 0]
  - - [5888, 2368, 1, 3328]
    - [83, 0]
  - - [64, 2944, 1, 1280]
    - [48, 0]
  - - [448, 1856, 1, 1280]
    - [74, 0]
  - - [4288, 448, 1, 1280]
    - [74, 0]
  - - [5888, 704, 1, 3328]
    - [83, 0]
  - - [5056, 256, 1, 128]
    - [69, 0]
  - - [1856, 256, 1, 128]
    - [67, 0]
  - - [5056, 128, 1, 256]
    - [80, 0]
  - - [704, 4, 1, 256]
    - [40, 0]
  - - [1408, 5888, 1, 128]
    - [66, 0]
  - - [4288, 4, 1, 128]
    - [86, 0]
  - - [1408, 1024, 1, 256]
    - [74, 0]
  - - [1024, 1856, 1, 128]
    - [66, 0]
  - - [256, 704, 1, 128]
    - [68, 0]
  - - [256, 1024, 1, 128]
    - [66, 0]
  - - [448, 1024, 1, 256]
    - [80, 0]
  - - [128, 4, 1, 3328]
    - [97, 0]
  - - [5056, 6784, 1, 1280]
    - [74, 0]
  - - [704, 5056, 1, 3328]
    - [81, 0]
  - - [64, 1408, 1, 1280]
    - [48, 0]
  - - [3584, 5056, 1, 3328]
    - [79, 0]
  - - [1856, 4, 1, 3328]
    - [97, 0]
  - - [4, 2944, 1, 128]
    - [86, 0]
  - - [2368, 2944, 1, 3328]
    - [72, 0]
  - - [448, 448, 1, 1280]
    - [56, 0]
  - - [2368, 3584, 1, 256]
    - [74, 0]
  - - [5056, 3584, 1, 1280]
    - [75, 0]
  - - [448, 4, 1, 3328]
    - [97, 0]
  - - [1856, 2944, 1, 1280]
    - [85, 0]
  - - [3584, 2368, 1, 1280]
    - [80, 0]
  - - [128, 1024, 1, 256]
    - [32, 0]
  - - [2944, 1408, 1, 256]
    - [72, 0]
  - - [4288, 1408, 1, 3328]
    - [72, 0]
  - - [3584, 64, 1, 3328]
    - [28, 0]
  - - [1408, 128, 1, 256]
    - [74, 0]
  - - [2944, 1024, 1, 128]
    - [69, 0]
  - - [4288, 5056, 1, 1280]
    - [76, 0]
  - - [5888, 6784, 1, 1280]
    - [85, 0]
  - - [6784, 5056, 1, 128]
    - [65, 0]
  - - [256, 1024, 1, 3328]
    - [74, 0]
  - - [3584, 4, 1, 256]
    - [90, 0]
  - - [1856, 64, 1, 3328]
    - [56, 0]
  - - [64, 6784, 1, 128]
    - [4, 0]
  - - [5888, 1408, 1, 3328]
    - [79, 0]
  - - [5888, 64, 1, 1280]
    - [74, 0]
  - - [256, 5056, 1, 256]
    - [77, 0]
  - - [128, 3584, 1, 128]
    - [7, 0]
  - - [448, 3584, 1, 3328]
    - [72, 0]
  - - [704, 2368, 1, 128]
    - [66, 0]
  - - [5888, 256, 1, 128]
    - [67, 0]
  - - [4, 5056, 1, 128]
    - [86, 0]
  - - [448, 256, 1, 256]
    - [38, 0]
  - - [704, 4, 1, 3328]
    - [43, 0]
  - - [1408, 256, 1, 256]
    - [74, 0]
  - - [3584, 1856, 1, 128]
    - [66, 0]
  - - [4288, 4288, 1, 128]
    - [69, 0]
  - - [1856, 1024, 1, 3328]
    - [80, 0]
  - - [128, 5888, 1, 3328]
    - [50, 0]
  - - [1024, 5056, 1, 256]
    - [85, 0]
  - - [2368, 1408, 1, 3328]
    - [80, 0]
  - - [5888, 448, 1, 256]
    - [77, 0]
  - - [5888, 6784, 1, 128]
    - [65, 0]
  - - [2368, 4, 1, 3328]
    - [43, 0]
  - - [6784, 5056, 1, 1280]
    - [81, 0]
  - - [5056, 704, 1, 1280]
    - [80, 0]
  - - [1408, 256, 1, 1280]
    - [74, 0]
  - - [4288, 6784, 1, 1280]
    - [80, 0]
  - - [128, 704, 1, 256]
    - [38, 0]
  - - [448, 128, 1, 1280]
    - [48, 0]
  - - [6784, 4, 1, 3328]
    - [91, 0]
  - - [4288, 4, 1, 1280]
    - [40, 0]
  - - [1024, 64, 1, 3328]
    - [52, 0]
  - - [1856, 4, 1, 256]
    - [90, 0]
  - - [64, 3584, 1, 1280]
    - [74, 0]
  - - [6784, 1408, 1, 256]
    - [74, 0]
  - - [3584, 5888, 1, 128]
    - [66, 0]
  - - [5056, 5888, 1, 256]
    - [85, 0]
  - - [2368, 1024, 1, 256]
    - [77, 0]
  - - [2944, 1856, 1, 256]
    - [83, 0]
  - - [1856, 6784, 1, 1280]
    - [81, 0]
  - - [64, 5056, 1, 128]
    - [4, 0]
  - - [5888, 64, 1, 128]
    - [3, 0]
  - - [448, 704, 1, 128]
    - [67, 0]
  - - [4, 1024, 1, 128]
    - [86, 0]
  - - [4288, 3584, 1, 256]
    - [80, 0]
  - - [1408, 704, 1, 128]
    - [66, 0]
  - - [64, 256, 1, 3328]
    - [60, 0]
  - - [5056, 1856, 1, 1280]
    - [77, 0]
  - - [1408, 1024, 1, 3328]
    - [83, 0]
  - - [2368, 256, 1, 3328]
    - [74, 0]
  - - [5888, 3584, 1, 1280]
    - [72, 0]
  - - [1856, 3584, 1, 3328]
    - [74, 0]
  - - [5888, 128, 1, 1280]
    - [80, 0]
  - - [1024, 2944, 1, 256]
    - [72, 0]
  - - [448, 6784, 1, 1280]
    - [80, 0]
  - - [256, 3584, 1, 1280]
    - [74, 0]
  - - [448, 128, 1, 128]
    - [4, 0]
  - - [704, 5056, 1, 256]
    - [80, 0]
  - - [3584, 1024, 1, 3328]
    - [73, 0]
  - - [2944, 1856, 1, 1280]
    - [85, 0]
  - - [128, 256, 1, 128]
    - [17, 0]
  - - [5056, 256, 1, 256]
    - [74, 0]
  - - [2368, 3584, 1, 3328]
    - [73, 0]
  - - [2944, 704, 1, 1280]
    - [83, 0]
  - - [128, 4, 1, 256]
    - [92, 0]
  - - [2944, 3584, 1, 1280]
    - [85, 0]
  - - [1856, 5888, 1, 1280]
    - [80, 0]
  - - [256, 256, 1, 1280]
    - [45, 0]
  - - [5056, 448, 1, 3328]
    - [85, 0]
  - - [4288, 1408, 1, 256]
    - [85, 0]
  - - [3584, 64, 1, 256]
    - [54, 0]
  - - [64, 1856, 1, 3328]
    - [27, 0]
  - - [256, 1408, 1, 128]
    - [66, 0]
  - - [5888, 1408, 1, 128]
    - [65, 0]
  - - [4288, 2368, 1, 1280]
    - [74, 0]
  - - [4, 4288, 1, 256]
    - [89, 0]
  - - [256, 4288, 1, 128]
    - [66, 0]
  - - [256, 128, 1, 3328]
    - [55, 0]
  - - [6784, 2368, 1, 256]
    - [74, 0]
  - - [5888, 128, 1, 128]
    - [3, 0]
  - - [4288, 1856, 1, 256]
    - [80, 0]
  - - [1856, 256, 1, 3328]
    - [74, 0]
  - - [1856, 2944, 1, 256]
    - [81, 0]
  - - [5056, 1024, 1, 128]
    - [65, 0]
  - - [64, 5888, 1, 1280]
    - [80, 0]
  - - [1760, 7133, 1, 1760]
    - [73, 0]
  - - [6784, 256, 1, 128]
    - [66, 0]
  - - [5888, 704, 1, 128]
    - [65, 0]
  - - [6784, 64, 1, 128]
    - [16, 0]
  - - [1024, 4288, 1, 1280]
    - [80, 0]
  - - [2368, 5056, 1, 3328]
    - [76, 0]
  - - [448, 4, 1, 128]
    - [87, 0]
  - - [4, 256, 1, 3328]
    - [97, 0]
  - - [4288, 1024, 1, 3328]
    - [78, 0]
  - - [1024, 5056, 1, 3328]
    - [74, 0]
  - - [1024, 1856, 1, 3328]
    - [79, 0]
  - - [704, 704, 1, 1280]
    - [74, 0]
  - - [128, 2368, 1, 1280]
    - [48, 0]
  - - [1408, 128, 1, 3328]
    - [56, 0]
  - - [3584, 256, 1, 1280]
    - [80, 0]
  - - [4, 128, 1, 128]
    - [87, 0]
  - - [704, 6784, 1, 128]
    - [69, 0]
  - - [3584, 128, 1, 1280]
    - [74, 0]
  - - [4, 256, 1, 1280]
    - [43, 0]
  - - [128, 704, 1, 3328]
    - [48, 0]
  - - [4288, 6784, 1, 256]
    - [74, 0]
  - - [3584, 2944, 1, 3328]
    - [76, 0]
  - - [128, 1856, 1, 256]
    - [80, 0]
  - - [64, 4288, 1, 256]
    - [74, 0]
  - - [4, 3584, 1, 3328]
    - [23, 0]
  - - [64, 4, 1, 3328]
    - [43, 0]
  - - [4, 64, 1, 3328]
    - [43, 0]
  - - [5888, 2944, 1, 256]
    - [73, 0]
  - - [2368, 6784, 1, 128]
    - [69, 0]
  - - [448, 4288, 1, 1280]
    - [74, 0]
  - - [448, 1856, 1, 3328]
    - [74, 0]
  - - [4, 1024, 1, 256]
    - [40, 0]
  - - [5056, 4288, 1, 256]
    - [85, 0]
  - - [1024, 448, 1, 256]
    - [80, 0]
  - - [1024, 3584, 1, 256]
    - [75, 0]
  - - [2944, 128, 1, 1280]
    - [56, 0]
  - - [1856, 5056, 1, 128]
    - [66, 0]
  - - [64, 256, 1, 256]
    - [29, 0]
  - - [1408, 4, 1, 128]
    - [86, 0]
  - - [128, 2368, 1, 128]
    - [14, 0]
  - - [256, 704, 1, 1280]
    - [74, 0]
  - - [64, 2368, 1, 128]
    - [5, 0]
  - - [6784, 6784, 1, 3328]
    - [85, 0]
  - - [448, 5888, 1, 1280]
    - [80, 0]
  - - [5056, 448, 1, 128]
    - [66, 0]
  - - [3584, 2944, 1, 128]
    - [66, 0]
  - - [6784, 256, 1, 1280]
    - [80, 0]
  - - [256, 2944, 1, 1280]
    - [80, 0]
  - - [64, 4288, 1, 128]
    - [5, 0]
  - - [2368, 5888, 1, 3328]
    - [74, 0]
  - - [4, 64, 1, 256]
    - [40, 0]
  - - [704, 1024, 1, 3328]
    - [80, 0]
  - - [2368, 1856, 1, 1280]
    - [80, 0]
  - - [128, 448, 1, 128]
    - [1, 0]
  - - [128, 6784, 1, 256]
    - [80, 0]
  - - [3584, 4288, 1, 128]
    - [66, 0]
  - - [64, 448, 1, 128]
    - [18, 0]
  - - [5888, 4288, 1, 3328]
    - [74, 0]
  - - [2368, 704, 1, 256]
    - [80, 0]
  - - [256, 1856, 1, 3328]
    - [80, 0]
  - - [1856, 128, 1, 256]
    - [74, 0]
  - - [6784, 128, 1, 128]
    - [8, 0]
  - - [3584, 1408, 1, 128]
    - [65, 0]
  - - [1856, 5056, 1, 1280]
    - [81, 0]
  - - [2944, 1024, 1, 1280]
    - [85, 0]
  - - [5056, 4, 1, 256]
    - [21, 0]
  - - [3584, 5888, 1, 3328]
    - [73, 0]
  - - [2368, 4288, 1, 256]
    - [85, 0]
  - - [1024, 2368, 1, 3328]
    - [80, 0]
  - - [64, 704, 1, 3328]
    - [62, 0]
  - - [704, 1408, 1, 256]
    - [74, 0]
  - - [6784, 1856, 1, 3328]
    - [85, 0]
  - - [1024, 2944, 1, 128]
    - [69, 0]
  - - [1024, 3584, 1, 1280]
    - [83, 0]
  - - [4288, 5888, 1, 3328]
    - [73, 0]
  - - [4288, 4, 1, 3328]
    - [40, 0]
  - - [256, 1408, 1, 256]
    - [74, 0]
  - - [448, 2944, 1, 1280]
    - [74, 0]
  - - [4, 5888, 1, 128]
    - [86, 0]
  - - [1024, 2944, 1, 3328]
    - [79, 0]
  - - [3584, 6784, 1, 256]
    - [79, 0]
  - - [256, 6784, 1, 1280]
    - [74, 0]
  - - [1856, 3584, 1, 256]
    - [80, 0]
  - - [128, 448, 1, 3328]
    - [61, 0]
  - - [6784, 1856, 1, 128]
    - [66, 0]
  - - [4, 448, 1, 256]
    - [40, 0]
  - - [2944, 704, 1, 128]
    - [69, 0]
  - - [256, 5888, 1, 1280]
    - [74, 0]
  - - [4, 128, 1, 1280]
    - [43, 0]
  - - [4288, 6784, 1, 3328]
    - [79, 0]
  - - [6784, 128, 1, 1280]
    - [56, 0]
  - - [64, 1408, 1, 256]
    - [46, 0]
  - - [7680, 5481, 1, 2560]
    - [85, 0]
  - - [2368, 1408, 1, 128]
    - [66, 0]
  - - [1856, 448, 1, 256]
    - [74, 0]
  - - [1408, 1024, 1, 128]
    - [66, 0]
  - - [128, 64, 1, 128]
    - [1, 0]
  - - [6784, 3584, 1, 3328]
    - [81, 0]
  - - [2944, 64, 1, 3328]
    - [50, 0]
  - - [64, 64, 1, 128]
    - [6, 0]
  - - [2368, 5056, 1, 1280]
    - [80, 0]
  - - [64, 4, 1, 1280]
    - [43, 0]
  - - [1408, 2368, 1, 1280]
    - [76, 0]
  - - [128, 1408, 1, 1280]
    - [48, 0]
  - - [256, 64, 1, 3328]
    - [58, 0]
  - - [2944, 4288, 1, 128]
    - [66, 0]
  - - [2944, 2944, 1, 256]
    - [74, 0]
  - - [2944, 4, 1, 1280]
    - [23, 0]
  - - [5888, 4, 1, 256]
    - [89, 0]
  - - [6784, 256, 1, 256]
    - [80, 0]
  - - [256, 5056, 1, 3328]
    - [74, 0]
  - - [128, 4288, 1, 1280]
    - [27, 0]
  - - [5056, 1856, 1, 128]
    - [68, 0]
  - - [5888, 1408, 1, 256]
    - [79, 0]
  - - [128, 128, 1, 256]
    - [29, 0]
  - - [5056, 4, 1, 3328]
    - [89, 0]
  - - [4288, 3584, 1, 3328]
    - [75, 0]
  - - [448, 704, 1, 3328]
    - [81, 0]
  - - [448, 448, 1, 128]
    - [5, 0]
  - - [1024, 2368, 1, 1280]
    - [74, 0]
  - - [1856, 704, 1, 3328]
    - [74, 0]
  - - [4, 2368, 1, 128]
    - [86, 0]
  - - [5888, 6784, 1, 3328]
    - [81, 0]
  - - [704, 4288, 1, 1280]
    - [83, 0]
  - - [704, 256, 1, 256]
    - [74, 0]
  - - [6784, 448, 1, 3328]
    - [77, 0]
  - - [4288, 1024, 1, 128]
    - [65, 0]
  - - [49, 512, 128, 2048]
    - [108, 0]
  - - [196, 256, 256, 1024]
    - [102, 0]
  - - [784, 512, 256, 128]
    - [100, 0]
  - - [49, 2048, 128, 512]
    - [98, 0]
  - - [784, 128, 128, 512]
    - [107, 0]
  - - [3136, 256, 256, 64]
    - [103, 0]
  - - [3136, 64, 128, 64]
    - [99, 0]
  - - [49, 2048, 256, 512]
    - [98, 0]
  - - [784, 128, 256, 512]
    - [109, 0]
  - - [196, 256, 128, 1024]
    - [101, 0]
  - - [3136, 64, 128, 256]
    - [105, 0]
  - - [3136, 256, 128, 64]
    - [103, 0]
  - - [784, 512, 128, 128]
    - [100, 0]
  - - [3136, 64, 256, 256]
    - [105, 0]
  - - [3136, 64, 256, 64]
    - [99, 0]
  - - [196, 1024, 128, 256]
    - [102, 0]
  - - [49, 512, 256, 2048]
    - [111, 0]
  - - [196, 1024, 256, 256]
    - [102, 0]
  - - [5329, 160, 64, 64]
    - [118, 0]
  - - [1225, 384, 64, 192]
    - [115, 0]
  - - [289, 1024, 64, 256]
    - [115, 0]
  - - [64, 1536, 64, 384]
    - [125, 0]
  - - [1225, 384, 64, 64]
    - [124, 0]
  - - [1225, 384, 64, 96]
    - [115, 0]
  - - [64, 1536, 64, 256]
    - [121, 0]
  - - [289, 1024, 64, 384]
    - [113, 0]
  - - [289, 1024, 64, 192]
    - [115, 0]
  - - [289, 1024, 64, 128]
    - [121, 0]
  - - [4096, 1024, 1, 2984]
    - [160, 0]
  - - [1024, 4096, 1, 3437]
    - [161, 0]
  - - [1024, 4096, 1, 3235]
    - [154, 0]
  - - [4096, 1024, 1, 4032]
    - [160, 0]
  - - [1024, 4096, 1, 3334]
    - [161, 0]
  - - [4096, 1024, 1, 3288]
    - [161, 0]
  - - [1024, 4096, 1, 3515]
    - [161, 0]
  - - [4096, 1024, 1, 3437]
    - [161, 0]
  - - [1024, 4096, 1, 3259]
    - [161, 0]
  - - [1024, 4096, 1, 3384]
    - [153, 0]
  - - [64, 92, 688, 92]
    - [131, 0]
  - - [4096, 1024, 1, 3458]
    - [160, 0]
  - - [1024, 4096, 1, 3412]
    - [160, 0]
  - - [1024, 4096, 1, 3529]
    - [154, 0]
  - - [1024, 4096, 1, 4032]
    - [161, 0]
  - - [4096, 1024, 1, 3999]
    - [161, 0]
  - - [1024, 4096, 1, 3079]
    - [154, 0]
  - - [1024, 4096, 1, 3876]
    - [153, 0]
  - - [1024, 4096, 1, 3450]
    - [161, 0]
  - - [1024, 4096, 1, 3256]
    - [161, 0]
  - - [4096, 1024, 1, 3403]
    - [160, 0]
  - - [1024, 1024, 1, 3975]
    - [151, 0]
  - - [1024, 4096, 1, 3359]
    - [161, 0]
  - - [4096, 1024, 1, 3549]
    - [160, 0]
  - - [4096, 1024, 1, 3176]
    - [161, 0]
  - - [1024, 4096, 1, 3504]
    - [153, 0]
  - - [4096, 1024, 1, 3314]
    - [160, 0]
  - - [4096, 1024, 1, 3183]
    - [160, 0]
  - - [1024, 4096, 1, 3209]
    - [154, 0]
  - - [1024, 4096, 1, 3720]
    - [153, 0]
  - - [1024, 4096, 1, 3859]
    - [153, 0]
  - - [1024, 33708, 1, 4059]
    - [153, 0]
  - - [64, 123, 528, 123]
    - [126, 0]
  - - [4096, 1024, 1, 3477]
    - [161, 0]
  - - [4096, 1024, 1, 3233]
    - [161, 0]
  - - [4096, 1024, 1, 3409]
    - [161, 0]
  - - [4096, 1024, 1, 3564]
    - [161, 0]
  - - [64, 102, 624, 100]
    - [126, 0]
  - - [4096, 1024, 1, 3190]
    - [160, 0]
  - - [64, 112, 576, 111]
    - [126, 0]
  - - [1024, 4096, 1, 3288]
    - [160, 0]
  - - [4096, 1024, 1, 3451]
    - [160, 0]
  - - [1024, 4096, 1, 3348]
    - [153, 0]
  - - [64, 102, 624, 102]
    - [126, 0]
  - - [1024, 4096, 1, 3465]
    - [154, 0]
  - - [1024, 33708, 1, 4032]
    - [153, 0]
  - - [1024, 33708, 1, 3840]
    - [153, 0]
  - - [4096, 1024, 1, 3391]
    - [161, 0]
  - - [1024, 4096, 1, 3530]
    - [153, 0]
  - - [4096, 1024, 1, 3209]
    - [160, 0]
  - - [1024, 4096, 1, 3457]
    - [154, 0]
  - - [1024, 4096, 1, 3386]
    - [153, 0]
  - - [4096, 1024, 1, 3350]
    - [160, 0]
  - - [1024, 4096, 1, 3184]
    - [161, 0]
  - - [1024, 4096, 1, 3093]
    - [160, 0]
  - - [64, 133, 480, 135]
    - [143, 0]
  - - [1024, 4096, 1, 3400]
    - [153, 0]
  - - [1024, 1024, 1, 4026]
    - [159, 0]
  - - [1024, 4096, 1, 3214]
    - [153, 0]
  - - [4096, 1024, 1, 3406]
    - [161, 0]
  - - [1024, 4096, 1, 3565]
    - [160, 0]
  - - [4096, 1024, 1, 3536]
    - [161, 0]
  - - [1024, 4096, 1, 3183]
    - [160, 0]
  - - [1024, 4096, 1, 3462]
    - [161, 0]
  - - [4096, 1024, 1, 3130]
    - [154, 0]
  - - [4096, 1024, 1, 3381]
    - [161, 0]
  - - [4096, 1024, 1, 3298]
    - [160, 0]
  - - [1024, 4096, 1, 3292]
    - [153, 0]
  - - [4096, 1024, 1, 3289]
    - [160, 0]
  - - [64, 160, 400, 159]
    - [146, 0]
  - - [1024, 4096, 1, 3379]
    - [153, 0]
  - - [1024, 4096, 1, 3990]
    - [154, 0]
  - - [1024, 4096, 1, 3540]
    - [161, 0]
  - - [4096, 1024, 1, 3412]
    - [161, 0]
  - - [1024, 1024, 1, 3780]
    - [156, 0]
  - - [1024, 4096, 1, 3555]
    - [160, 0]
  - - [1024, 4096, 1, 3518]
    - [154, 0]
  - - [4096, 1024, 1, 3189]
    - [160, 0]
  - - [1024, 4096, 1, 3298]
    - [154, 0]
  - - [4096, 1024, 1, 3072]
    - [160, 0]
  - - [1024, 4096, 1, 3393]
    - [161, 0]
  - - [1024, 4096, 1, 3207]
    - [153, 0]
  - - [64, 228, 272, 232]
    - [149, 0]
  - - [64, 23, 2720, 23]
    - [130, 0]
  - - [4096, 1024, 1, 3487]
    - [161, 0]
  - - [1024, 1024, 1, 3822]
    - [159, 0]
  - - [64, 77, 816, 77]
    - [131, 0]
  - - [4096, 1024, 1, 3431]
    - [161, 0]
  - - [4096, 1024, 1, 3378]
    - [160, 0]
  - - [4096, 1024, 1, 3529]
    - [154, 0]
  - - [4096, 1024, 1, 3460]
    - [161, 0]
  - - [1024, 4096, 1, 3336]
    - [153, 0]
  - - [1024, 4096, 1, 3501]
    - [154, 0]
  - - [64, 159, 400, 159]
    - [144, 0]
  - - [1024, 4096, 1, 3584]
    - [161, 0]
  - - [64, 135, 480, 134]
    - [144, 0]
  - - [64, 99, 624, 99]
    - [135, 0]
  - - [4096, 1024, 1, 2499]
    - [160, 0]
  - - [1024, 1024, 1, 3942]
    - [156, 0]
  - - [4096, 1024, 1, 3352]
    - [160, 0]
  - - [1024, 4096, 1, 3543]
    - [161, 0]
  - - [1024, 4096, 1, 3476]
    - [160, 0]
  - - [1024, 33708, 1, 3822]
    - [153, 0]
  - - [1024, 4096, 1, 3436]
    - [153, 0]
  - - [1024, 1024, 1, 3861]
    - [152, 0]
  - - [1024, 1024, 1, 4000]
    - [157, 0]
  - - [1024, 4096, 1, 3594]
    - [153, 0]
  - - [4096, 1024, 1, 3514]
    - [161, 0]
  - - [1024, 4096, 1, 3064]
    - [160, 0]
  - - [4096, 1024, 1, 3371]
    - [153, 0]
  - - [4096, 1024, 1, 3558]
    - [161, 0]
  - - [4096, 1024, 1, 3517]
    - [160, 0]
  - - [4096, 1024, 1, 3144]
    - [160, 0]
  - - [1024, 4096, 1, 3312]
    - [153, 0]
  - - [4096, 1024, 1, 3079]
    - [160, 0]
  - - [1024, 4096, 1, 3415]
    - [153, 0]
  - - [1024, 4096, 1, 3221]
    - [160, 0]
  - - [1024, 4096, 1, 3978]
    - [154, 0]
  - - [4096, 1024, 1, 3876]
    - [160, 0]
  - - [1024, 4096, 1, 3528]
    - [153, 0]
  - - [1024, 4096, 1, 3181]
    - [161, 0]
  - - [4096, 1024, 1, 3445]
    - [160, 0]
  - - [4096, 1024, 1, 3450]
    - [153, 0]
  - - [4096, 1024, 1, 3377]
    - [160, 0]
  - - [1024, 4096, 1, 3532]
    - [154, 0]
  - - [1024, 33708, 1, 3944]
    - [153, 0]
  - - [4096, 1024, 1, 3483]
    - [160, 0]
  - - [1024, 4096, 1, 3358]
    - [153, 0]
  - - [4096, 1024, 1, 3464]
    - [160, 0]
  - - [4096, 1024, 1, 3282]
    - [153, 0]
  - - [4096, 1024, 1, 3256]
    - [161, 0]
  - - [1024, 4096, 1, 3057]
    - [160, 0]
  - - [4096, 1024, 1, 3481]
    - [160, 0]
  - - [4096, 1024, 1, 3340]
    - [160, 0]
  - - [1024, 1024, 1, 3870]
    - [159, 0]
  - - [1024, 4096, 1, 3273]
    - [153, 0]
  - - [64, 65, 992, 65]
    - [144, 0]
  - - [4096, 1024, 1, 3392]
    - [154, 0]
  - - [4096, 1024, 1, 3337]
    - [160, 0]
  - - [4096, 1024, 1, 3359]
    - [160, 0]
  - - [4096, 1024, 1, 3498]
    - [161, 0]
  - - [4096, 1024, 1, 3169]
    - [160, 0]
  - - [1024, 33708, 1, 3859]
    - [154, 0]
  - - [64, 19, 3264, 19]
    - [130, 0]
  - - [1024, 4096, 1, 3103]
    - [153, 0]
  - - [4096, 1024, 1, 3900]
    - [160, 0]
  - - [1024, 4096, 1, 3442]
    - [160, 0]
  - - [1024, 4096, 1, 3248]
    - [160, 0]
  - - [1024, 4096, 1, 3351]
    - [161, 0]
  - - [4096, 1024, 1, 3593]
    - [160, 0]
  - - [1024, 4096, 1, 3780]
    - [160, 0]
  - - [64, 133, 480, 133]
    - [144, 0]
  - - [1024, 33708, 1, 3681]
    - [153, 0]
  - - [4096, 1024, 1, 3374]
    - [154, 0]
  - - [1024, 4096, 1, 3557]
    - [153, 0]
  - - [4096, 1024, 1, 3906]
    - [160, 0]
  - - [4096, 1024, 1, 3504]
    - [160, 0]
  - - [1024, 4096, 1, 3270]
    - [160, 0]
  - - [4096, 1024, 1, 3098]
    - [153, 0]
  - - [64, 232, 272, 232]
    - [149, 0]
  - - [4096, 1024, 1, 3216]
    - [161, 0]
  - - [64, 148, 432, 148]
    - [146, 0]
  - - [1024, 4096, 1, 3550]
    - [160, 0]
  - - [4096, 1024, 1, 3449]
    - [154, 0]
  - - [1024, 4096, 1, 3403]
    - [161, 0]
  - - [1024, 4096, 1, 3523]
    - [160, 0]
  - - [1024, 4096, 1, 3486]
    - [160, 0]
  - - [1024, 4096, 1, 3564]
    - [160, 0]
  - - [1024, 33708, 1, 4005]
    - [153, 0]
  - - [4096, 1024, 1, 3296]
    - [160, 0]
  - - [1024, 4096, 1, 3263]
    - [153, 0]
  - - [64, 25, 2512, 25]
    - [130, 0]
  - - [1024, 4096, 1, 3130]
    - [161, 0]
  - - [1024, 4096, 1, 3295]
    - [161, 0]
  - - [1024, 33708, 1, 3925]
    - [154, 0]
  - - [1024, 4096, 1, 3378]
    - [153, 0]
  - - [4096, 1024, 1, 3720]
    - [161, 0]
  - - [4096, 1024, 1, 3399]
    - [160, 0]
  - - [4096, 1024, 1, 3543]
    - [161, 0]
  - - [64, 9, 6544, 9]
    - [133, 0]
  - - [4096, 1024, 1, 3497]
    - [160, 0]
  - - [4096, 1024, 1, 3594]
    - [161, 0]
  - - [1024, 4096, 1, 3144]
    - [161, 0]
  - - [1024, 4096, 1, 3975]
    - [154, 0]
  - - [4096, 1024, 1, 3205]
    - [161, 0]
  - - [1024, 33708, 1, 3995]
    - [153, 0]
  - - [1024, 4096, 1, 3392]
    - [153, 0]
  - - [1024, 4096, 1, 3055]
    - [161, 0]
  - - [1024, 4096, 1, 4026]
    - [161, 0]
  - - [4096, 1024, 1, 3557]
    - [160, 0]
  - - [4096, 1024, 1, 3515]
    - [160, 0]
  - - [4096, 1024, 1, 3486]
    - [161, 0]
  - - [4096, 1024, 1, 3457]
    - [161, 0]
  - - [1024, 4096, 1, 3511]
    - [153, 0]
  - - [4096, 1024, 1, 3138]
    - [160, 0]
  - - [1024, 4096, 1, 3339]
    - [154, 0]
  - - [1024, 4096, 1, 3939]
    - [154, 0]
  - - [4096, 1024, 1, 3500]
    - [154, 0]
  - - [4096, 1024, 1, 3395]
    - [161, 0]
  - - [4096, 1024, 1, 4020]
    - [161, 0]
  - - [4096, 1024, 1, 3942]
    - [160, 0]
  - - [1024, 1024, 1, 4032]
    - [150, 0]
  - - [4096, 1024, 1, 3349]
    - [161, 0]
  - - [1024, 4096, 1, 3322]
    - [154, 0]
  - - [4096, 1024, 1, 3452]
    - [160, 0]
  - - [1024, 4096, 1, 3417]
    - [160, 0]
  - - [1024, 1024, 1, 4012]
    - [158, 0]
  - - [1024, 4096, 1, 3526]
    - [154, 0]
  - - [4096, 1024, 1, 3485]
    - [154, 0]
  - - [1024, 1024, 1, 3681]
    - [158, 0]
  - - [4096, 1024, 1, 3303]
    - [161, 0]
  - - [4096, 1024, 1, 3344]
    - [161, 0]
  - - [1024, 4096, 1, 3479]
    - [161, 0]
  - - [4096, 1024, 1, 3300]
    - [160, 0]
  - - [1024, 4096, 1, 3439]
    - [154, 0]
  - - [4096, 1024, 1, 3280]
    - [161, 0]
  - - [1024, 4096, 1, 3245]
    - [153, 0]
  - - [1024, 4096, 1, 3328]
    - [153, 0]
  - - [4096, 1024, 1, 3418]
    - [153, 0]
  - - [1024, 4096, 1, 3493]
    - [161, 0]
  - - [1024, 4096, 1, 3500]
    - [153, 0]
  - - [1024, 4096, 1, 3166]
    - [153, 0]
  - - [4096, 1024, 1, 3126]
    - [154, 0]
  - - [1024, 4096, 1, 3277]
    - [161, 0]
  - - [1024, 4096, 1, 3315]
    - [160, 0]
  - - [1024, 1024, 1, 3927]
    - [151, 0]
  - - [1024, 4096, 1, 3414]
    - [153, 0]
  - - [4096, 1024, 1, 3531]
    - [160, 0]
  - - [4096, 1024, 1, 3484]
    - [153, 0]
  - - [1024, 4096, 1, 3180]
    - [160, 0]
  - - [4096, 1024, 1, 3360]
    - [160, 0]
  - - [1024, 33708, 1, 3990]
    - [153, 0]
  - - [4096, 1024, 1, 3466]
    - [160, 0]
  - - [1024, 4096, 1, 3428]
    - [153, 0]
  - - [1024, 4096, 1, 3137]
    - [160, 0]
  - - [4096, 1024, 1, 4059]
    - [160, 0]
  - - [1024, 4096, 1, 3353]
    - [160, 0]
  - - [1024, 4096, 1, 3942]
    - [160, 0]
  - - [4096, 1024, 1, 3506]
    - [153, 0]
  - - [1024, 1024, 1, 3894]
    - [151, 0]
  - - [4096, 1024, 1, 3508]
    - [161, 0]
  - - [64, 132, 480, 135]
    - [144, 0]
  - - [4096, 1024, 1, 3956]
    - [153, 0]
  - - [64, 7, 8192, 7]
    - [132, 0]
  - - [1024, 4096, 1, 3272]
    - [154, 0]
  - - [1024, 4096, 1, 3443]
    - [161, 0]
  - - [1024, 4096, 1, 3375]
    - [161, 0]
  - - [1024, 4096, 1, 3525]
    - [161, 0]
  - - [4096, 1024, 1, 3472]
    - [160, 0]
  - - [1024, 4096, 1, 3520]
    - [153, 0]
  - - [4096, 1024, 1, 3322]
    - [160, 0]
  - - [4096, 1024, 1, 3387]
    - [160, 0]
  - - [64, 8, 7280, 8]
    - [138, 0]
  - - [1024, 33708, 1, 3939]
    - [153, 0]
  - - [4096, 1024, 1, 3345]
    - [161, 0]
  - - [4096, 1024, 1, 2967]
    - [160, 0]
  - - [1024, 4096, 1, 3453]
    - [153, 0]
  - - [1024, 4096, 1, 3640]
    - [160, 0]
  - - [4096, 1024, 1, 3291]
    - [154, 0]
  - - [1024, 4096, 1, 3350]
    - [161, 0]
  - - [4096, 1024, 1, 3417]
    - [160, 0]
  - - [64, 135, 480, 135]
    - [144, 0]
  - - [1024, 4096, 1, 3467]
    - [154, 0]
  - - [1024, 4096, 1, 3491]
    - [160, 0]
  - - [1024, 4096, 1, 3822]
    - [160, 0]
  - - [4096, 1024, 1, 3292]
    - [160, 0]
  - - [1024, 4096, 1, 3231]
    - [153, 0]
  - - [1024, 4096, 1, 3364]
    - [154, 0]
  - - [1024, 4096, 1, 3995]
    - [154, 0]
  - - [1024, 4096, 1, 3545]
    - [153, 0]
  - - [1024, 1024, 1, 3876]
    - [151, 0]
  - - [1024, 4096, 1, 3186]
    - [153, 0]
  - - [4096, 1024, 1, 3432]
    - [160, 0]
  - - [64, 84, 752, 85]
    - [131, 0]
  - - [4096, 1024, 1, 3367]
    - [154, 0]
  - - [4096, 1024, 1, 3503]
    - [161, 0]
  - - [1024, 4096, 1, 3095]
    - [154, 0]
  - - [4096, 1024, 1, 3465]
    - [161, 0]
  - - [1024, 4096, 1, 3402]
    - [160, 0]
  - - [4096, 1024, 1, 3140]
    - [160, 0]
  - - [1024, 1024, 1, 4050]
    - [157, 0]
  - - [4096, 1024, 1, 3424]
    - [154, 0]
  - - [4096, 1024, 1, 3257]
    - [153, 0]
  - - [4096, 1024, 1, 2917]
    - [160, 0]
  - - [1024, 33708, 1, 3640]
    - [153, 0]
  - - [1024, 4096, 1, 3456]
    - [153, 0]
  - - [1024, 4096, 1, 3014]
    - [153, 0]
  - - [4096, 1024, 1, 3372]
    - [161, 0]
  - - [64, 132, 480, 132]
    - [144, 0]
  - - [1024, 4096, 1, 3294]
    - [161, 0]
  - - [4096, 1024, 1, 3446]
    - [161, 0]
  - - [1024, 4096, 1, 3389]
    - [154, 0]
  - - [4096, 1024, 1, 3259]
    - [160, 0]
  - - [4096, 1024, 1, 3544]
    - [160, 0]
  - - [4096, 1024, 1, 3479]
    - [161, 0]
  - - [4096, 1024, 1, 3542]
    - [160, 0]
  - - [4096, 1024, 1, 3321]
    - [153, 0]
  - - [1024, 4096, 1, 3147]
    - [153, 0]
  - - [1024, 4096, 1, 3944]
    - [153, 0]
  - - [4096, 1024, 1, 3870]
    - [161, 0]
  - - [1024, 4096, 1, 3308]
    - [153, 0]
  - - [4096, 1024, 1, 3401]
    - [160, 0]
  - - [1024, 4096, 1, 3395]
    - [153, 0]
  - - [64, 99, 624, 102]
    - [129, 0]
  - - [1024, 4096, 1, 3563]
    - [160, 0]
  - - [1024, 33708, 1, 3870]
    - [153, 0]
  - - [4096, 1024, 1, 3494]
    - [160, 0]
  - - [1024, 4096, 1, 3271]
    - [153, 0]
  - - [1024, 33708, 1, 3910]
    - [153, 0]
  - - [1024, 4096, 1, 3287]
    - [161, 0]
  - - [1024, 33708, 1, 3860]
    - [153, 0]
  - - [64, 143, 432, 148]
    - [146, 0]
  - - [1024, 1024, 1, 3584]
    - [158, 0]
  - - [64, 162, 400, 162]
    - [148, 0]
  - - [4096, 1024, 1, 3341]
    - [160, 0]
  - - [1024, 4096, 1, 3136]
    - [153, 0]
  - - [4096, 1024, 1, 3439]
    - [160, 0]
  - - [64, 148, 432, 147]
    - [144, 0]
  - - [1024, 4096, 1, 3751]
    - [160, 0]
  - - [1024, 4096, 1, 3301]
    - [160, 0]
  - - [4096, 1024, 1, 3468]
    - [161, 0]
  - - [1024, 4096, 1, 3416]
    - [161, 0]
  - - [4096, 1024, 1, 3163]
    - [160, 0]
  - - [1024, 4096, 1, 3230]
    - [154, 0]
  - - [1024, 4096, 1, 3581]
    - [154, 0]
  - - [1024, 1024, 1, 3960]
    - [156, 0]
  - - [4096, 1024, 1, 3463]
    - [161, 0]
  - - [1024, 4096, 1, 3478]
    - [154, 0]
  - - [4096, 1024, 1, 3262]
    - [160, 0]
  - - [1024, 4096, 1, 3438]
    - [160, 0]
  - - [1024, 4096, 1, 3244]
    - [153, 0]
  - - [1024, 4096, 1, 3445]
    - [153, 0]
  - - [4096, 1024, 1, 3328]
    - [160, 0]
  - - [1024, 4096, 1, 3492]
    - [154, 0]
  - - [4096, 1024, 1, 3211]
    - [154, 0]
  - - [1024, 4096, 1, 3910]
    - [161, 0]
  - - [1024, 4096, 1, 3314]
    - [153, 0]
  - - [4096, 1024, 1, 3859]
    - [160, 0]
  - - [4096, 1024, 1, 3383]
    - [160, 0]
  - - [1024, 4096, 1, 3409]
    - [161, 0]
  - - [1024, 4096, 1, 4020]
    - [153, 0]
  - - [4096, 1024, 1, 3530]
    - [160, 0]
  - - [4096, 1024, 1, 3411]
    - [161, 0]
  - - [1024, 4096, 1, 3566]
    - [161, 0]
  - - [4096, 1024, 1, 3493]
    - [153, 0]
  - - [4096, 1024, 1, 3184]
    - [160, 0]
  - - [1024, 4096, 1, 3072]
    - [153, 0]
  - - [1024, 4096, 1, 3431]
    - [154, 0]
  - - [4096, 1024, 1, 3306]
    - [161, 0]
  - - [1024, 4096, 1, 3352]
    - [161, 0]
  - - [4096, 1024, 1, 3295]
    - [160, 0]
  - - [64, 123, 528, 122]
    - [126, 0]
  - - [1024, 4096, 1, 3517]
    - [154, 0]
  - - [64, 102, 624, 101]
    - [134, 0]
  - - [4096, 1024, 1, 3426]
    - [160, 0]
  - - [4096, 1024, 1, 3385]
    - [160, 0]
  - - [1024, 1024, 1, 3978]
    - [151, 0]
  - - [4096, 1024, 1, 3572]
    - [153, 0]
  - - [4096, 1024, 1, 3459]
    - [160, 0]
  - - [1024, 4096, 1, 3374]
    - [161, 0]
  - - [4096, 1024, 1, 3166]
    - [160, 0]
  - - [4096, 1024, 1, 3093]
    - [161, 0]
  - - [4096, 1024, 1, 3523]
    - [154, 0]
  - - [4096, 1024, 1, 3413]
    - [154, 0]
  - - [1024, 4096, 1, 3996]
    - [153, 0]
  - - [1024, 4096, 1, 3452]
    - [161, 0]
  - - [4096, 1024, 1, 3232]
    - [161, 0]
  - - [4096, 1024, 1, 3400]
    - [153, 0]
  - - [4096, 1024, 1, 3334]
    - [160, 0]
  - - [1024, 4096, 1, 3345]
    - [153, 0]
  - - [1024, 4096, 1, 3538]
    - [160, 0]
  - - [1024, 4096, 1, 3466]
    - [160, 0]
  - - [4096, 1024, 1, 3315]
    - [160, 0]
  - - [4096, 1024, 1, 3214]
    - [161, 0]
  - - [1024, 33708, 1, 3900]
    - [153, 0]
  - - [64, 160, 400, 160]
    - [146, 0]
  - - [1024, 4096, 1, 3367]
    - [160, 0]
  - - [1024, 4096, 1, 2917]
    - [161, 0]
  - - [1024, 1024, 1, 3995]
    - [152, 0]
  - - [64, 132, 480, 134]
    - [144, 0]
  - - [1024, 4096, 1, 3544]
    - [161, 0]
  - - [4096, 1024, 1, 3414]
    - [161, 0]
  - - [4096, 1024, 1, 3565]
    - [154, 0]
  - - [1024, 4096, 1, 3512]
    - [160, 0]
  - - [1024, 4096, 1, 3191]
    - [161, 0]
  - - [64, 27, 2336, 27]
    - [128, 0]
  - - [1024, 4096, 1, 3289]
    - [161, 0]
  - - [4096, 1024, 1, 3290]
    - [160, 0]
  - - [1024, 4096, 1, 3211]
    - [161, 0]
  - - [1024, 33708, 1, 3969]
    - [154, 0]
  - - [4096, 1024, 1, 3566]
    - [160, 0]
  - - [64, 111, 576, 111]
    - [134, 0]
  - - [1024, 4096, 1, 3459]
    - [160, 0]
  - - [1024, 4096, 1, 3372]
    - [153, 0]
  - - [4096, 1024, 1, 3339]
    - [160, 0]
  - - [4096, 1024, 1, 3425]
    - [160, 0]
  - - [4096, 1024, 1, 3388]
    - [160, 0]
  - - [1024, 4096, 1, 3531]
    - [153, 0]
  - - [4096, 1024, 1, 3286]
    - [161, 0]
  - - [4096, 1024, 1, 3462]
    - [160, 0]
  - - [1024, 4096, 1, 3388]
    - [153, 0]
  - - [4096, 1024, 1, 3165]
    - [153, 0]
  - - [4096, 1024, 1, 3304]
    - [160, 0]
  - - [1024, 4096, 1, 2736]
    - [160, 0]
  - - [4096, 1024, 1, 3397]
    - [160, 0]
  - - [64, 38, 1680, 38]
    - [127, 0]
  - - [1024, 4096, 1, 3311]
    - [161, 0]
  - - [1024, 4096, 1, 3394]
    - [161, 0]
  - - [4096, 1024, 1, 2736]
    - [160, 0]
  - - [1024, 4096, 1, 3559]
    - [154, 0]
  - - [4096, 1024, 1, 3180]
    - [160, 0]
  - - [1024, 4096, 1, 3480]
    - [153, 0]
  - - [4096, 1024, 1, 3318]
    - [160, 0]
  - - [4096, 1024, 1, 3213]
    - [160, 0]
  - - [1024, 4096, 1, 3286]
    - [160, 0]
  - - [4096, 1024, 1, 3471]
    - [160, 0]
  - - [1024, 4096, 1, 3381]
    - [161, 0]
  - - [64, 100, 624, 100]
    - [135, 0]
  - - [4096, 1024, 1, 3502]
    - [160, 0]
  - - [64, 16, 3840, 16]
    - [141, 0]
  - - [1024, 4096, 1, 3552]
    - [153, 0]
  - - [4096, 1024, 1, 3519]
    - [161, 0]
  - - [1024, 4096, 1, 3300]
    - [154, 0]
  - - [1024, 4096, 1, 3419]
    - [153, 0]
  - - [4096, 1024, 1, 4030]
    - [154, 0]
  - - [4096, 1024, 1, 3976]
    - [161, 0]
  - - [1024, 4096, 1, 3473]
    - [161, 0]
  - - [1024, 1024, 1, 3977]
    - [158, 0]
  - - [4096, 1024, 1, 3428]
    - [160, 0]
  - - [1024, 4096, 1, 3433]
    - [154, 0]
  - - [4096, 1024, 1, 3534]
    - [154, 0]
  - - [4096, 1024, 1, 3461]
    - [160, 0]
  - - [4096, 1024, 1, 3681]
    - [160, 0]
  - - [4096, 1024, 1, 3495]
    - [161, 0]
  - - [4096, 1024, 1, 3351]
    - [160, 0]
  - - [1024, 4096, 1, 4059]
    - [153, 0]
  - - [4096, 1024, 1, 3990]
    - [160, 0]
  - - [1024, 4096, 1, 3325]
    - [154, 0]
  - - [1024, 4096, 1, 3408]
    - [160, 0]
  - - [64, 59, 1088, 59]
    - [134, 0]
  - - [4096, 1024, 1, 3394]
    - [161, 0]
  - - [1024, 4096, 1, 3573]
    - [161, 0]
  - - [4096, 1024, 1, 3386]
    - [160, 0]
  - - [4096, 1024, 1, 3540]
    - [160, 0]
  - - [1024, 4096, 1, 3182]
    - [154, 0]
  - - [1024, 4096, 1, 3430]
    - [153, 0]
  - - [1024, 4096, 1, 3236]
    - [161, 0]
  - - [4096, 1024, 1, 2977]
    - [160, 0]
  - - [1024, 4096, 1, 3355]
    - [160, 0]
  - - [4096, 1024, 1, 3139]
    - [160, 0]
  - - [4096, 1024, 1, 3516]
    - [154, 0]
  - - [4096, 1024, 1, 3368]
    - [154, 0]
  - - [4096, 1024, 1, 3559]
    - [153, 0]
  - - [64, 11, 5456, 11]
    - [141, 0]
  - - [1024, 4096, 1, 3506]
    - [160, 0]
  - - [1024, 4096, 1, 3145]
    - [153, 0]
  - - [1024, 4096, 1, 3369]
    - [160, 0]
  - - [64, 112, 576, 112]
    - [126, 0]
  - - [4096, 1024, 1, 3522]
    - [160, 0]
  - - [1024, 33708, 1, 3894]
    - [153, 0]
  - - [64, 159, 400, 162]
    - [144, 0]
  - - [4096, 1024, 1, 3336]
    - [160, 0]
  - - [1024, 4096, 1, 3382]
    - [154, 0]
  - - [4096, 1024, 1, 3533]
    - [160, 0]
  - - [4096, 1024, 1, 4050]
    - [161, 0]
  - - [4096, 1024, 1, 3480]
    - [154, 0]
  - - [1024, 4096, 1, 3344]
    - [153, 0]
  - - [64, 122, 528, 122]
    - [126, 0]
  - - [1024, 4096, 1, 3509]
    - [154, 0]
  - - [1024, 4096, 1, 3956]
    - [153, 0]
  - - [4096, 1024, 1, 3616]
    - [160, 0]
  - - [1024, 4096, 1, 3366]
    - [153, 0]
  - - [4096, 1024, 1, 2935]
    - [153, 0]
  - - [4096, 1024, 1, 3393]
    - [160, 0]
  - - [4096, 1024, 1, 3547]
    - [154, 0]
  - - [1024, 4096, 1, 3499]
    - [161, 0]
  - - [4096, 1024, 1, 3357]
    - [160, 0]
  - - [4096, 1024, 1, 3272]
    - [160, 0]
  - - [4096, 1024, 1, 3207]
    - [160, 0]
  - - [4096, 1024, 1, 3894]
    - [160, 0]
  - - [1024, 4096, 1, 3444]
    - [160, 0]
  - - [4096, 1024, 1, 3561]
    - [160, 0]
  - - [4096, 1024, 1, 3376]
    - [160, 0]
  - - [1024, 4096, 1, 3458]
    - [160, 0]
  - - [4096, 1024, 1, 3231]
    - [154, 0]
  - - [64, 228, 272, 228]
    - [155, 0]
  - - [1024, 4096, 1, 3505]
    - [161, 0]
  - - [4096, 1024, 1, 3277]
    - [160, 0]
  - - [64, 21, 2976, 21]
    - [130, 0]
  - - [1024, 4096, 1, 3391]
    - [160, 0]
  - - [64, 32, 1984, 32]
    - [142, 0]
  - - [1024, 4096, 1, 3536]
    - [161, 0]
  - - [1024, 4096, 1, 3063]
    - [160, 0]
  - - [1024, 1024, 1, 3925]
    - [152, 0]
  - - [1024, 4096, 1, 3189]
    - [154, 0]
  - - [1024, 4096, 1, 2505]
    - [160, 0]
  - - [4096, 1024, 1, 3454]
    - [153, 0]
  - - [1024, 4096, 1, 3405]
    - [161, 0]
  - - [1024, 33708, 1, 4050]
    - [154, 0]
  - - [4096, 1024, 1, 3520]
    - [160, 0]
  - - [64, 93, 688, 93]
    - [137, 0]
  - - [1024, 4096, 1, 3487]
    - [161, 0]
  - - [1024, 4096, 1, 3558]
    - [161, 0]
  - - [4096, 1024, 1, 3297]
    - [160, 0]
  - - [1024, 4096, 1, 3483]
    - [160, 0]
  - - [1024, 1024, 1, 3956]
    - [159, 0]
  - - [1024, 33708, 1, 3751]
    - [154, 0]
  - - [4096, 1024, 1, 3380]
    - [160, 0]
  - - [1024, 4096, 1, 3380]
    - [153, 0]
  - - [1024, 4096, 1, 3396]
    - [161, 0]
  - - [1024, 4096, 1, 3497]
    - [154, 0]
  - - [1024, 4096, 1, 3502]
    - [161, 0]
  - - [1024, 1024, 1, 3976]
    - [156, 0]
  - - [1024, 4096, 1, 3138]
    - [154, 0]
  - - [4096, 1024, 1, 3939]
    - [153, 0]
  - - [1024, 4096, 1, 3303]
    - [154, 0]
  - - [64, 111, 576, 112]
    - [134, 0]
  - - [1024, 4096, 1, 3418]
    - [160, 0]
  - - [1024, 4096, 1, 3224]
    - [154, 0]
  - - [4096, 1024, 1, 3978]
    - [160, 0]
  - - [1024, 4096, 1, 3472]
    - [153, 0]
  - - [4096, 1024, 1, 3353]
    - [161, 0]
  - - [4096, 1024, 1, 3362]
    - [160, 0]
  - - [1024, 33708, 1, 3978]
    - [153, 0]
  - - [64, 100, 624, 102]
    - [129, 0]
  - - [1024, 4096, 1, 3432]
    - [161, 0]
  - - [1024, 4096, 1, 3139]
    - [160, 0]
  - - [1024, 4096, 1, 3341]
    - [161, 0]
  - - [1024, 4096, 1, 3494]
    - [154, 0]
  - - [1024, 4096, 1, 3969]
    - [153, 0]
  - - [1024, 4096, 1, 3163]
    - [161, 0]
  - - [1024, 1024, 1, 3955]
    - [151, 0]
  - - [4096, 1024, 1, 3405]
    - [160, 0]
  - - [1024, 1024, 1, 4030]
    - [151, 0]
  - - [4096, 1024, 1, 3453]
    - [160, 0]
  - - [1024, 4096, 1, 3411]
    - [161, 0]
  - - [1024, 4096, 1, 3527]
    - [154, 0]
  - - [4096, 1024, 1, 3474]
    - [160, 0]
  - - [1024, 4096, 1, 3572]
    - [160, 0]
  - - [4096, 1024, 1, 3293]
    - [160, 0]
  - - [4096, 1024, 1, 3247]
    - [160, 0]
  - - [64, 15, 4096, 15]
    - [141, 0]
  - - [1024, 4096, 1, 3425]
    - [161, 0]
  - - [1024, 4096, 1, 3354]
    - [153, 0]
  - - [4096, 1024, 1, 3382]
    - [160, 0]
  - - [4096, 1024, 1, 3236]
    - [160, 0]
  - - [1024, 4096, 1, 3519]
    - [161, 0]
  - - [4096, 1024, 1, 3354]
    - [160, 0]
  - - [4096, 1024, 1, 3501]
    - [161, 0]
  - - [1024, 1024, 1, 3906]
    - [159, 0]
  - - [4096, 1024, 1, 3266]
    - [160, 0]
  - - [64, 101, 624, 102]
    - [129, 0]
  - - [1024, 4096, 1, 3368]
    - [160, 0]
  - - [1024, 4096, 1, 4030]
    - [161, 0]
  - - [1024, 4096, 1, 3533]
    - [154, 0]
  - - [4096, 1024, 1, 3332]
    - [161, 0]
  - - [4096, 1024, 1, 3584]
    - [160, 0]
  - - [1024, 4096, 1, 3616]
    - [160, 0]
  - - [4096, 1024, 1, 3265]
    - [160, 0]
  - - [4096, 1024, 1, 3361]
    - [160, 0]
  - - [4096, 1024, 1, 3467]
    - [160, 0]
  - - [1024, 4096, 1, 3454]
    - [154, 0]
  - - [1024, 4096, 1, 3101]
    - [161, 0]
  - - [1024, 4096, 1, 3508]
    - [161, 0]
  - - [4096, 1024, 1, 3267]
    - [160, 0]
  - - [64, 54, 1184, 54]
    - [126, 0]
  - - [4096, 1024, 1, 3419]
    - [160, 0]
  - - [4096, 1024, 1, 3822]
    - [160, 0]
  - - [1024, 4096, 1, 3266]
    - [160, 0]
  - - [4096, 1024, 1, 3440]
    - [161, 0]
  - - [1024, 4096, 1, 3361]
    - [160, 0]
  - - [1024, 4096, 1, 3546]
    - [154, 0]
  - - [4096, 1024, 1, 3473]
    - [160, 0]
  - - [4096, 1024, 1, 3546]
    - [161, 0]
  - - [1024, 4096, 1, 3088]
    - [154, 0]
  - - [1024, 4096, 1, 3535]
    - [161, 0]
  - - [1024, 4096, 1, 3447]
    - [161, 0]
  - - [1024, 4096, 1, 3560]
    - [160, 0]
  - - [1024, 4096, 1, 3422]
    - [154, 0]
  - - [1024, 4096, 1, 3469]
    - [153, 0]
  - - [4096, 1024, 1, 3488]
    - [160, 0]
  - - [1024, 4096, 1, 3110]
    - [160, 0]
  - - [1024, 4096, 1, 3265]
    - [161, 0]
  - - [1024, 4096, 1, 3291]
    - [160, 0]
  - - [1024, 4096, 1, 3390]
    - [161, 0]
  - - [4096, 1024, 1, 3046]
    - [160, 0]
  - - [1024, 4096, 1, 3539]
    - [161, 0]
  - - [4096, 1024, 1, 3221]
    - [161, 0]
  - - [4096, 1024, 1, 3433]
    - [160, 0]
  - - [4096, 1024, 1, 3364]
    - [161, 0]
  - - [4096, 1024, 1, 3470]
    - [160, 0]
  - - [1024, 4096, 1, 3404]
    - [153, 0]
  - - [1024, 33708, 1, 3968]
    - [154, 0]
  - - [4096, 1024, 1, 3088]
    - [160, 0]
  - - [1024, 4096, 1, 3247]
    - [160, 0]
  - - [1024, 33708, 1, 3996]
    - [153, 0]
  - - [4096, 1024, 1, 3482]
    - [161, 0]
  - - [1024, 1024, 1, 3796]
    - [156, 0]
  - - [4096, 1024, 1, 3995]
    - [161, 0]
  - - [1024, 1024, 1, 3859]
    - [158, 0]
  - - [1024, 4096, 1, 3280]
    - [154, 0]
  - - [4096, 1024, 1, 3271]
    - [161, 0]
  - - [64, 10, 5952, 10]
    - [141, 0]
  - - [4096, 1024, 1, 3545]
    - [160, 0]
  - - [4096, 1024, 1, 3476]
    - [153, 0]
  - - [4096, 1024, 1, 3496]
    - [154, 0]
  - - [4096, 1024, 1, 3191]
    - [154, 0]
  - - [4096, 1024, 1, 3311]
    - [161, 0]
  - - [1024, 4096, 1, 3302]
    - [161, 0]
  - - [1024, 4096, 1, 3681]
    - [160, 0]
  - - [4096, 1024, 1, 3582]
    - [153, 0]
  - - [4096, 1024, 1, 3421]
    - [161, 0]
  - - [4096, 1024, 1, 3560]
    - [154, 0]
  - - [1024, 4096, 1, 3495]
    - [161, 0]
  - - [4096, 1024, 1, 3186]
    - [160, 0]
  - - [4096, 1024, 1, 3925]
    - [160, 0]
  - - [64, 71, 896, 71]
    - [145, 0]
  - - [1024, 4096, 1, 3435]
    - [161, 0]
  - - [4096, 1024, 1, 3434]
    - [160, 0]
  - - [1024, 33708, 1, 4012]
    - [153, 0]
  - - [1024, 4096, 1, 3340]
    - [153, 0]
  - - [1024, 1024, 1, 3860]
    - [151, 0]
  - - [4096, 1024, 1, 3489]
    - [160, 0]
  - - [1024, 4096, 1, 3162]
    - [161, 0]
  - - [4096, 1024, 1, 3436]
    - [160, 0]
  - - [1024, 1024, 1, 4005]
    - [157, 0]
  - - [64, 84, 752, 84]
    - [130, 0]
  - - [4096, 1024, 1, 3574]
    - [160, 0]
  - - [4096, 1024, 1, 3469]
    - [153, 0]
  - - [1024, 4096, 1, 3410]
    - [154, 0]
  - - [1024, 4096, 1, 3216]
    - [153, 0]
  - - [4096, 1024, 1, 3095]
    - [160, 0]
  - - [1024, 1024, 1, 3990]
    - [159, 0]
  - - [4096, 1024, 1, 3448]
    - [160, 0]
  - - [1024, 4096, 1, 3176]
    - [161, 0]
  - - [64, 49, 1296, 49]
    - [126, 0]
  - - [4096, 1024, 1, 2918]
    - [160, 0]
  - - [64, 14, 4368, 14]
    - [140, 0]
  - - [1024, 4096, 1, 3424]
    - [160, 0]
  - - [4096, 1024, 1, 3402]
    - [153, 0]
  - - [4096, 1024, 1, 3145]
    - [154, 0]
  - - [64, 134, 480, 134]
    - [146, 0]
  - - [1024, 33708, 1, 3976]
    - [154, 0]
  - - [4096, 1024, 1, 3518]
    - [153, 0]
  - - [4096, 1024, 1, 3110]
    - [160, 0]
  - - [4096, 1024, 1, 3325]
    - [160, 0]
  - - [1024, 33708, 1, 3999]
    - [153, 0]
  - - [4096, 1024, 1, 2985]
    - [160, 0]
  - - [1024, 4096, 1, 3371]
    - [153, 0]
  - - [4096, 1024, 1, 3342]
    - [160, 0]
  - - [4096, 1024, 1, 3141]
    - [154, 0]
  - - [4096, 1024, 1, 3532]
    - [154, 0]
  - - [64, 78, 816, 78]
    - [131, 0]
  - - [1024, 4096, 1, 3169]
    - [161, 0]
  - - [1024, 4096, 1, 3514]
    - [160, 0]
  - - [4096, 1024, 1, 3780]
    - [161, 0]
  - - [1024, 4096, 1, 3098]
    - [153, 0]
  - - [1024, 4096, 1, 3449]
    - [161, 0]
  - - [1024, 4096, 1, 3222]
    - [153, 0]
  - - [1024, 4096, 1, 3346]
    - [154, 0]
  - - [4096, 1024, 1, 3064]
    - [161, 0]
  - - [4096, 1024, 1, 3511]
    - [160, 0]
  - - [4096, 1024, 1, 3384]
    - [160, 0]
  - - [4096, 1024, 1, 3356]
    - [154, 0]
  - - [1024, 4096, 1, 3796]
    - [153, 0]
  - - [4096, 1024, 1, 3427]
    - [160, 0]
  - - [4096, 1024, 1, 3390]
    - [160, 0]
  - - [4096, 1024, 1, 3573]
    - [161, 0]
  - - [4096, 1024, 1, 3456]
    - [154, 0]
  - - [1024, 4096, 1, 3360]
    - [161, 0]
  - - [1024, 33708, 1, 3977]
    - [154, 0]
  - - [1024, 4096, 1, 2918]
    - [153, 0]
  - - [4096, 1024, 1, 3975]
    - [160, 0]
  - - [4096, 1024, 1, 3525]
    - [161, 0]
  - - [4096, 1024, 1, 3398]
    - [153, 0]
  - - [4096, 1024, 1, 3640]
    - [160, 0]
  - - [1024, 1024, 1, 3999]
    - [152, 0]
  - - [4096, 1024, 1, 3014]
    - [160, 0]
  - - [1024, 4096, 1, 3446]
    - [153, 0]
  - - [1024, 33708, 1, 3796]
    - [153, 0]
  - - [4096, 1024, 1, 3101]
    - [153, 0]
  - - [4096, 1024, 1, 3563]
    - [161, 0]
  - - [4096, 1024, 1, 3539]
    - [153, 0]
  - - [4096, 1024, 1, 3182]
    - [160, 0]
  - - [1024, 4096, 1, 3468]
    - [154, 0]
  - - [4096, 1024, 1, 3312]
    - [160, 0]
  - - [4096, 1024, 1, 3215]
    - [160, 0]
  - - [4096, 1024, 1, 3910]
    - [160, 0]
  - - [1024, 33708, 1, 3780]
    - [154, 0]
  - - [1024, 4096, 1, 3290]
    - [160, 0]
  - - [1024, 4096, 1, 4012]
    - [160, 0]
  - - [1024, 4096, 1, 3385]
    - [160, 0]
  - - [1024, 33708, 1, 3975]
    - [153, 0]
  - - [4096, 1024, 1, 3996]
    - [160, 0]
  - - [4096, 1024, 1, 2765]
    - [161, 0]
  - - [4096, 1024, 1, 3538]
    - [161, 0]
  - - [4096, 1024, 1, 3415]
    - [161, 0]
  - - [1024, 4096, 1, 3554]
    - [160, 0]
  - - [4096, 1024, 1, 3513]
    - [154, 0]
  - - [1024, 4096, 1, 3304]
    - [154, 0]
  - - [4096, 1024, 1, 3294]
    - [160, 0]
  - - [4096, 1024, 1, 3396]
    - [161, 0]
  - - [1024, 4096, 1, 3213]
    - [154, 0]
  - - [4096, 1024, 1, 3137]
    - [154, 0]
  - - [4096, 1024, 1, 3552]
    - [160, 0]
  - - [1024, 1024, 1, 4020]
    - [159, 0]
  - - [64, 13, 4672, 13]
    - [141, 0]
  - - [1024, 4096, 1, 3461]
    - [160, 0]
  - - [4096, 1024, 1, 3263]
    - [153, 0]
  - - [4096, 1024, 1, 3430]
    - [160, 0]
  - - [4096, 1024, 1, 3389]
    - [160, 0]
  - - [4096, 1024, 1, 3528]
    - [160, 0]
  - - [1024, 4096, 1, 3463]
    - [161, 0]
  - - [4096, 1024, 1, 3526]
    - [161, 0]
  - - [4096, 1024, 1, 3154]
    - [160, 0]
  - - [4096, 1024, 1, 3499]
    - [161, 0]
  - - [1024, 1024, 1, 3939]
    - [159, 0]
  - - [4096, 1024, 1, 3955]
    - [161, 0]
  - - [1024, 4096, 1, 3297]
    - [154, 0]
  - - [1024, 4096, 1, 3233]
    - [160, 0]
  - - [1024, 4096, 1, 3226]
    - [160, 0]
  - - [4096, 1024, 1, 3404]
    - [160, 0]
  - - [4096, 1024, 1, 3355]
    - [160, 0]
  - - [1024, 4096, 1, 3542]
    - [160, 0]
  - - [4096, 1024, 1, 3181]
    - [161, 0]
  - - [1024, 4096, 1, 3474]
    - [160, 0]
  - - [4096, 1024, 1, 3319]
    - [160, 0]
  - - [1024, 4096, 1, 3434]
    - [153, 0]
  - - [1024, 4096, 1, 3860]
    - [160, 0]
  - - [1024, 4096, 1, 3343]
    - [153, 0]
  - - [64, 77, 816, 78]
    - [131, 0]
  - - [1024, 4096, 1, 3488]
    - [160, 0]
  - - [1024, 4096, 1, 3046]
    - [160, 0]
  - - [1024, 4096, 1, 3141]
    - [161, 0]
  - - [1024, 4096, 1, 3516]
    - [161, 0]
  - - [4096, 1024, 1, 3147]
    - [160, 0]
  - - [1024, 1024, 1, 4059]
    - [152, 0]
  - - [1024, 1024, 1, 3944]
    - [152, 0]
  - - [1024, 4096, 1, 3421]
    - [161, 0]
  - - [4096, 1024, 1, 3944]
    - [154, 0]
  - - [64, 45, 1424, 45]
    - [139, 0]
  - - [1024, 4096, 1, 3574]
    - [154, 0]
  - - [1024, 4096, 1, 3977]
    - [153, 0]
  - - [1024, 4096, 1, 2985]
    - [160, 0]
  - - [64, 193, 320, 193]
    - [147, 0]
  - - [1024, 4096, 1, 3427]
    - [161, 0]
  - - [64, 12, 5040, 12]
    - [141, 0]
  - - [1024, 4096, 1, 3482]
    - [161, 0]
  - - [1024, 4096, 1, 3332]
    - [153, 0]
  - - [1024, 1024, 1, 3720]
    - [157, 0]
  - - [4096, 1024, 1, 3308]
    - [161, 0]
  - - [1024, 4096, 1, 3513]
    - [161, 0]
  - - [1024, 4096, 1, 3154]
    - [154, 0]
  - - [1024, 4096, 1, 3955]
    - [161, 0]
  - - [1024, 4096, 1, 2967]
    - [161, 0]
  - - [1024, 33708, 1, 3942]
    - [153, 0]
  - - [1024, 4096, 1, 3319]
    - [161, 0]
  - - [4096, 1024, 1, 3860]
    - [160, 0]
  - - [1024, 4096, 1, 3548]
    - [153, 0]
  - - [4096, 1024, 1, 3977]
    - [161, 0]
  - - [4096, 1024, 1, 3535]
    - [160, 0]
  - - [1024, 4096, 1, 3541]
    - [161, 0]
  - - [1024, 1024, 1, 3910]
    - [158, 0]
  - - [1024, 33708, 1, 3584]
    - [153, 0]
  - - [1024, 4096, 1, 3168]
    - [154, 0]
  - - [1024, 4096, 1, 3448]
    - [161, 0]
  - - [4096, 1024, 1, 3343]
    - [160, 0]
  - - [64, 35, 1808, 35]
    - [143, 0]
  - - [1024, 4096, 1, 3357]
    - [154, 0]
  - - [64, 143, 432, 143]
    - [144, 0]
  - - [4096, 1024, 1, 3510]
    - [160, 0]
  - - [4096, 1024, 1, 3369]
    - [160, 0]
  - - [64, 92, 688, 93]
    - [131, 0]
  - - [4096, 1024, 1, 3379]
    - [160, 0]
  - - [1024, 4096, 1, 3276]
    - [160, 0]
  - - [1024, 4096, 1, 3363]
    - [160, 0]
  - - [4096, 1024, 1, 3055]
    - [160, 0]
  - - [1024, 4096, 1, 3524]
    - [153, 0]
  - - [4096, 1024, 1, 3057]
    - [160, 0]
  - - [1024, 33708, 1, 3720]
    - [154, 0]
  - - [1024, 4096, 1, 3383]
    - [153, 0]
  - - [1024, 4096, 1, 3522]
    - [154, 0]
  - - [1024, 33708, 1, 3956]
    - [153, 0]
  - - [1024, 4096, 1, 3481]
    - [153, 0]
  - - [4096, 1024, 1, 3562]
    - [161, 0]
  - - [4096, 1024, 1, 3299]
    - [160, 0]
  - - [1024, 4096, 1, 3262]
    - [154, 0]
  - - [1024, 33708, 1, 4026]
    - [153, 0]
  - - [4096, 1024, 1, 3168]
    - [154, 0]
  - - [64, 101, 624, 101]
    - [134, 0]
  - - [1024, 4096, 1, 3999]
    - [153, 0]
  - - [1024, 4096, 1, 3549]
    - [153, 0]
  - - [4096, 1024, 1, 3375]
    - [160, 0]
  - - [1024, 4096, 1, 3496]
    - [161, 0]
  - - [64, 29, 2176, 29]
    - [130, 0]
  - - [1024, 4096, 1, 3190]
    - [161, 0]
  - - [4096, 1024, 1, 3273]
    - [161, 0]
  - - [1024, 4096, 1, 3406]
    - [160, 0]
  - - [4096, 1024, 1, 4005]
    - [153, 0]
  - - [4096, 1024, 1, 3555]
    - [160, 0]
  - - [4096, 1024, 1, 2505]
    - [160, 0]
  - - [1024, 4096, 1, 3460]
    - [160, 0]
  - - [64, 17, 3632, 17]
    - [131, 0]
  - - [1024, 4096, 1, 3579]
    - [154, 0]
  - - [1024, 33708, 1, 4030]
    - [154, 0]
  - - [1024, 4096, 1, 3510]
    - [154, 0]
  - - [1024, 1024, 1, 3969]
    - [151, 0]
  - - [1024, 4096, 1, 3282]
    - [161, 0]
  - - [1024, 4096, 1, 3377]
    - [153, 0]
  - - [1024, 4096, 1, 2935]
    - [161, 0]
  - - [64, 41, 1552, 41]
    - [131, 0]
  - - [1024, 4096, 1, 3498]
    - [153, 0]
  - - [1024, 4096, 1, 3593]
    - [160, 0]
  - - [1024, 1024, 1, 3948]
    - [159, 0]
  - - [4096, 1024, 1, 3226]
    - [161, 0]
  - - [1024, 4096, 1, 2499]
    - [160, 0]
  - - [1024, 4096, 1, 3296]
    - [153, 0]
  - - [1024, 4096, 1, 3455]
    - [160, 0]
  - - [1024, 4096, 1, 3399]
    - [154, 0]
  - - [1024, 4096, 1, 3205]
    - [153, 0]
  - - [4096, 1024, 1, 4026]
    - [161, 0]
  - - [1024, 4096, 1, 3484]
    - [153, 0]
  - - [4096, 1024, 1, 3302]
    - [161, 0]
  - - [1024, 4096, 1, 3485]
    - [161, 0]
  - - [1024, 1024, 1, 3996]
    - [159, 0]
  - - [1024, 4096, 1, 3126]
    - [154, 0]
  - - [1024, 4096, 1, 4050]
    - [153, 0]
  - - [4096, 1024, 1, 3235]
    - [154, 0]
  - - [1024, 33708, 1, 3955]
    - [153, 0]
  - - [1024, 4096, 1, 3342]
    - [153, 0]
  - - [1024, 1024, 1, 3900]
    - [158, 0]
  - - [1024, 4096, 1, 3397]
    - [161, 0]
  - - [4096, 1024, 1, 3491]
    - [161, 0]
  - - [1024, 4096, 1, 3503]
    - [153, 0]
  - - [1024, 4096, 1, 3140]
    - [154, 0]
  - - [4096, 1024, 1, 3121]
    - [160, 0]
  - - [4096, 1024, 1, 3276]
    - [160, 0]
  - - [1024, 4096, 1, 3321]
    - [161, 0]
  - - [1024, 4096, 1, 3870]
    - [161, 0]
  - - [4096, 1024, 1, 3475]
    - [160, 0]
  - - [1024, 4096, 1, 2984]
    - [160, 0]
  - - [4096, 1024, 1, 3363]
    - [154, 0]
  - - [1024, 4096, 1, 3582]
    - [160, 0]
  - - [4096, 1024, 1, 3509]
    - [160, 0]
  - - [1024, 4096, 1, 3426]
    - [153, 0]
  - - [4096, 1024, 1, 3136]
    - [160, 0]
  - - [1024, 4096, 1, 3232]
    - [161, 0]
  - - [4096, 1024, 1, 3103]
    - [160, 0]
  - - [1024, 4096, 1, 3335]
    - [154, 0]
  - - [1024, 4096, 1, 3900]
    - [153, 0]
  - - [4096, 1024, 1, 3512]
    - [154, 0]
  - - [4096, 1024, 1, 3222]
    - [160, 0]
  - - [1024, 4096, 1, 3165]
    - [160, 0]
  - - [4096, 1024, 1, 3408]
    - [160, 0]
  - - [4096, 1024, 1, 3751]
    - [160, 0]
  - - [1024, 4096, 1, 3318]
    - [153, 0]
  - - [4096, 1024, 1, 3442]
    - [161, 0]
  - - [1024, 4096, 1, 3413]
    - [160, 0]
  - - [4096, 1024, 1, 3524]
    - [160, 0]
  - - [1024, 4096, 1, 3976]
    - [161, 0]
  - - [1024, 4096, 1, 3475]
    - [161, 0]
  - - [1024, 4096, 1, 3534]
    - [153, 0]
  - - [4096, 1024, 1, 3301]
    - [160, 0]
  - - [4096, 1024, 1, 3248]
    - [160, 0]
  - - [1024, 4096, 1, 2977]
    - [154, 0]
  - - [4096, 1024, 1, 3346]
    - [160, 0]
  - - [1024, 4096, 1, 3451]
    - [153, 0]
  - - [1024, 4096, 1, 3257]
    - [154, 0]
  - - [1024, 1024, 1, 3640]
    - [152, 0]
  - - [1024, 4096, 1, 3356]
    - [153, 0]
  - - [4096, 1024, 1, 3348]
    - [161, 0]
  - - [4096, 1024, 1, 3335]
    - [160, 0]
  - - [4096, 1024, 1, 3505]
    - [160, 0]
  - - [1024, 4096, 1, 3490]
    - [153, 0]
  - - [4096, 1024, 1, 3447]
    - [160, 0]
  - - [1024, 4096, 1, 3267]
    - [161, 0]
  - - [4096, 1024, 1, 3230]
    - [160, 0]
  - - [4096, 1024, 1, 3455]
    - [160, 0]
  - - [1024, 4096, 1, 3925]
    - [153, 0]
  - - [1024, 4096, 1, 3362]
    - [154, 0]
  - - [4096, 1024, 1, 3969]
    - [161, 0]
  - - [4096, 1024, 1, 3527]
    - [160, 0]
  - - [1024, 4096, 1, 3585]
    - [154, 0]
  - - [4096, 1024, 1, 3063]
    - [160, 0]
  - - [4096, 1024, 1, 3435]
    - [160, 0]
  - - [4096, 1024, 1, 3366]
    - [161, 0]
  - - [4096, 1024, 1, 3581]
    - [153, 0]
  - - [1024, 33708, 1, 3906]
    - [153, 0]
  - - [1024, 4096, 1, 3464]
    - [161, 0]
  - - [1024, 4096, 1, 3440]
    - [160, 0]
  - - [4096, 1024, 1, 3143]
    - [160, 0]
  - - [1024, 4096, 1, 3349]
    - [154, 0]
  - - [4096, 1024, 1, 3416]
    - [160, 0]
  - - [4096, 1024, 1, 3365]
    - [160, 0]
  - - [1024, 4096, 1, 3470]
    - [161, 0]
  - - [4096, 1024, 1, 3287]
    - [160, 0]
  - - [1024, 4096, 1, 3441]
    - [161, 0]
  - - [4096, 1024, 1, 3224]
    - [160, 0]
  - - [1024, 4096, 1, 3387]
    - [153, 0]
  - - [1024, 4096, 1, 3547]
    - [153, 0]
  - - [4096, 1024, 1, 3478]
    - [154, 0]
  - - [4096, 1024, 1, 3548]
    - [161, 0]
  - - [1024, 33708, 1, 4020]
    - [153, 0]
  - - [4096, 1024, 1, 3320]
    - [160, 0]
  - - [1024, 4096, 1, 3906]
    - [160, 0]
  - - [4096, 1024, 1, 3796]
    - [160, 0]
  - - [1024, 4096, 1, 3306]
    - [153, 0]
  - - [1024, 4096, 1, 3401]
    - [161, 0]
  - - [64, 147, 432, 147]
    - [144, 0]
  - - [1024, 4096, 1, 3215]
    - [161, 0]
  - - [4096, 1024, 1, 4012]
    - [161, 0]
  - - [1024, 4096, 1, 2765]
    - [161, 0]
  - - [4096, 1024, 1, 3554]
    - [154, 0]
  - - [4096, 1024, 1, 3423]
    - [160, 0]
  - - [1024, 1024, 1, 3751]
    - [158, 0]
  - - [1024, 4096, 1, 3562]
    - [154, 0]
  - - [1024, 4096, 1, 3489]
    - [153, 0]
  - - [4096, 1024, 1, 3358]
    - [160, 0]
  - - [4096, 1024, 1, 3270]
    - [161, 0]
  - - [1024, 4096, 1, 3293]
    - [153, 0]
  - - [1024, 4096, 1, 3376]
    - [153, 0]
  - - [4096, 1024, 1, 3245]
    - [160, 0]
  - - [4096, 1024, 1, 3541]
    - [160, 0]
  - - [4096, 1024, 1, 3443]
    - [160, 0]
  - - [4096, 1024, 1, 3438]
    - [161, 0]
  - - [4096, 1024, 1, 3244]
    - [160, 0]
  - - [1024, 4096, 1, 3365]
    - [160, 0]
  - - [1024, 4096, 1, 3299]
    - [154, 0]
  - - [1024, 4096, 1, 3471]
    - [161, 0]
  - - [1024, 4096, 1, 3398]
    - [153, 0]
  - - [4096, 1024, 1, 3162]
    - [160, 0]
  - - [1024, 4096, 1, 4005]
    - [154, 0]
  - - [4096, 1024, 1, 3579]
    - [160, 0]
  - - [64, 18, 3440, 18]
    - [136, 0]
  - - [64, 177, 352, 177]
    - [155, 0]
  - - [1024, 4096, 1, 3121]
    - [161, 0]
  - - [4096, 1024, 1, 3441]
    - [160, 0]
  - - [4096, 1024, 1, 3422]
    - [160, 0]
  - - [4096, 1024, 1, 3444]
    - [160, 0]
  - - [1024, 4096, 1, 3337]
    - [154, 0]
  - - [4096, 1024, 1, 3550]
    - [153, 0]
  - - [1024, 4096, 1, 3477]
    - [153, 0]
  - - [4096, 1024, 1, 3490]
    - [160, 0]
  - - [4096, 1024, 1, 3585]
    - [160, 0]
  - - [1024, 4096, 1, 3143]
    - [153, 0]
  - - [1024, 33708, 1, 3876]
    - [154, 0]
  - - [1024, 4096, 1, 3320]
    - [161, 0]
  - - [1024, 4096, 1, 3423]
    - [161, 0]
  - - [1024, 4096, 1, 3894]
    - [153, 0]
  - - [4096, 1024, 1, 3410]
    - [160, 0]
  - - [1024, 4096, 1, 3561]
    - [153, 0]
  - - [4096, 1024, 1, 3492]
    - [154, 0]
  - - [64, 85, 752, 85]
    - [131, 0]
  - - [36548, 1024, 1, 3712]
    - [163, 0]
  - - [4096, 2048, 1, 128]
    - [164, 0]
  - - [1024, 1024, 1, 3712]
    - [165, 0]
  - - [1024, 1024, 1, 128]
    - [162, 0]
  - - [4096, 3072, 1, 128]
    - [164, 0]
  - - [768, 3072, 1, 4096]
    - [176, 0]
  - - [64, 256, 192, 256]
    - [170, 0]
  - - [768, 2, 1, 16]
    - [173, 0]
  - - [768, 768, 1, 64]
    - [169, 0]
  - - [768, 768, 1, 4096]
    - [177, 0]
  - - [768, 30522, 1, 1280]
    - [180, 0]
  - - [64, 128, 384, 128]
    - [170, 0]
  - - [768, 30522, 1, 320]
    - [178, 0]
  - - [768, 768, 1, 32]
    - [167, 0]
  - - [3072, 768, 1, 4096]
    - [176, 0]
  - - [768, 30522, 1, 640]
    - [179, 0]
  - - [64, 64, 768, 64]
    - [168, 0]
  - - [768, 768, 1, 640]
    - [177, 0]
  - - [768, 768, 1, 16]
    - [166, 0]
  - - [768, 768, 1, 1280]
    - [175, 0]
  - - [768, 2, 1, 32]
    - [171, 0]
  - - [256, 512, 36, 98]
    - [229, 0]
  - - [64, 192, 36, 25088]
    - [298, 0]
  - - [128, 128, 64, 25]
    - [228, 0]
  - - [256, 256, 64, 56]
    - [229, 0]
  - - [512, 486, 36, 800]
    - [236, 0]
  - - [512, 512, 36, 1568]
    - [247, 0]
  - - [64, 192, 64, 3200]
    - [292, 0]
  - - [256, 384, 36, 4096]
    - [292, 0]
  - - [128, 256, 64, 32]
    - [231, 0]
  - - [64, 128, 64, 23104]
    - [298, 0]
  - - [128, 256, 64, 9]
    - [222, 0]
  - - [256, 512, 36, 784]
    - [232, 0]
  - - [256, 324, 36, 32]
    - [270, 0]
  - - [512, 512, 36, 33]
    - [241, 0]
  - - [16, 32, 36, 5760]
    - [245, 0]
  - - [192, 384, 64, 128]
    - [292, 0]
  - - [512, 512, 64, 72]
    - [248, 0]
  - - [128, 128, 64, 1600]
    - [221, 0]
  - - [512, 512, 36, 128]
    - [292, 0]
  - - [192, 384, 64, 2304]
    - [221, 0]
  - - [384, 256, 64, 450]
    - [257, 0]
  - - [3, 64, 36, 6272]
    - [245, 0]
  - - [3, 64, 64, 2888]
    - [274, 0]
  - - [384, 256, 64, 2304]
    - [257, 0]
  - - [512, 512, 64, 144]
    - [292, 0]
  - - [256, 256, 36, 6272]
    - [232, 0]
  - - [80, 192, 64, 4608]
    - [293, 0]
  - - [64, 64, 36, 3136]
    - [280, 0]
  - - [256, 384, 64, 2304]
    - [257, 0]
  - - [512, 512, 36, 66]
    - [241, 0]
  - - [128, 256, 64, 800]
    - [267, 0]
  - - [64, 128, 36, 30]
    - [223, 0]
  - - [192, 256, 36, 512]
    - [292, 0]
  - - [256, 512, 64, 200]
    - [292, 0]
  - - [256, 512, 64, 25]
    - [270, 0]
  - - [3, 64, 64, 46208]
    - [273, 0]
  - - [128, 256, 36, 1568]
    - [265, 0]
  - - [64, 128, 64, 11552]
    - [298, 0]
  - - [128, 192, 64, 946]
    - [292, 0]
  - - [64, 192, 64, 12800]
    - [253, 0]
  - - [224, 224, 64, 128]
    - [230, 0]
  - - [128, 256, 64, 288]
    - [292, 0]
  - - [64, 64, 64, 826]
    - [235, 0]
  - - [256, 384, 64, 1152]
    - [267, 0]
  - - [3, 64, 64, 92416]
    - [273, 0]
  - - [32, 32, 36, 43808]
    - [214, 0]
  - - [160, 320, 64, 288]
    - [224, 0]
  - - [1, 16, 36, 23040]
    - [261, 0]
  - - [128, 256, 36, 128]
    - [239, 0]
  - - [128, 128, 64, 3360]
    - [292, 0]
  - - [128, 128, 64, 420]
    - [292, 0]
  - - [64, 128, 64, 361]
    - [229, 0]
  - - [512, 512, 36, 16]
    - [285, 0]
  - - [384, 256, 36, 800]
    - [226, 0]
  - - [192, 384, 36, 4096]
    - [226, 0]
  - - [64, 64, 64, 1600]
    - [278, 0]
  - - [256, 384, 64, 576]
    - [258, 0]
  - - [512, 512, 64, 14]
    - [241, 0]
  - - [512, 512, 36, 8]
    - [216, 0]
  - - [512, 486, 64, 128]
    - [232, 0]
  - - [1, 16, 64, 640]
    - [266, 0]
  - - [64, 96, 64, 288]
    - [291, 0]
  - - [96, 96, 36, 1568]
    - [260, 0]
  - - [256, 256, 36, 128]
    - [264, 0]
  - - [64, 128, 36, 53824]
    - [252, 0]
  - - [256, 256, 36, 32]
    - [248, 0]
  - - [192, 256, 64, 288]
    - [292, 0]
  - - [256, 256, 36, 16]
    - [262, 0]
  - - [128, 256, 36, 3200]
    - [265, 0]
  - - [160, 320, 64, 512]
    - [224, 0]
  - - [128, 160, 36, 512]
    - [235, 0]
  - - [96, 96, 36, 2592]
    - [230, 0]
  - - [64, 96, 64, 800]
    - [260, 0]
  - - [147, 64, 36, 18816]
    - [276, 0]
  - - [160, 320, 36, 512]
    - [230, 0]
  - - [256, 512, 36, 4]
    - [269, 0]
  - - [96, 128, 64, 946]
    - [252, 0]
  - - [256, 324, 64, 1568]
    - [257, 0]
  - - [128, 128, 64, 50]
    - [248, 0]
  - - [35, 96, 36, 8960]
    - [242, 0]
  - - [32, 64, 36, 43808]
    - [283, 0]
  - - [160, 224, 36, 128]
    - [230, 0]
  - - [64, 64, 64, 81]
    - [255, 0]
  - - [256, 256, 36, 3200]
    - [221, 0]
  - - [256, 256, 36, 210]
    - [232, 0]
  - - [192, 384, 64, 576]
    - [292, 0]
  - - [512, 512, 64, 800]
    - [267, 0]
  - - [512, 24, 36, 800]
    - [218, 0]
  - - [64, 64, 64, 13216]
    - [279, 0]
  - - [192, 224, 64, 1152]
    - [235, 0]
  - - [256, 256, 64, 1152]
    - [257, 0]
  - - [512, 486, 64, 512]
    - [267, 0]
  - - [128, 128, 36, 784]
    - [230, 0]
  - - [256, 512, 64, 1600]
    - [254, 0]
  - - [512, 512, 64, 9]
    - [248, 0]
  - - [96, 128, 64, 288]
    - [260, 0]
  - - [64, 96, 36, 512]
    - [260, 0]
  - - [256, 512, 36, 1568]
    - [292, 0]
  - - [128, 128, 64, 400]
    - [292, 0]
  - - [128, 128, 64, 800]
    - [292, 0]
  - - [96, 128, 36, 512]
    - [280, 0]
  - - [16, 32, 36, 360]
    - [243, 0]
  - - [128, 256, 64, 3200]
    - [257, 0]
  - - [96, 128, 64, 800]
    - [260, 0]
  - - [256, 512, 64, 4]
    - [222, 0]
  - - [256, 256, 64, 450]
    - [267, 0]
  - - [64, 64, 64, 3200]
    - [278, 0]
  - - [192, 224, 64, 128]
    - [238, 0]
  - - [128, 128, 64, 288]
    - [292, 0]
  - - [256, 256, 64, 72]
    - [248, 0]
  - - [96, 208, 36, 512]
    - [260, 0]
  - - [128, 256, 36, 3136]
    - [235, 0]
  - - [64, 64, 36, 3520]
    - [230, 0]
  - - [64, 128, 36, 1568]
    - [293, 0]
  - - [160, 320, 64, 242]
    - [219, 0]
  - - [192, 192, 36, 512]
    - [230, 0]
  - - [512, 512, 36, 512]
    - [292, 0]
  - - [1, 16, 64, 10240]
    - [244, 0]
  - - [128, 128, 36, 512]
    - [230, 0]
  - - [512, 512, 36, 256]
    - [221, 0]
  - - [512, 512, 36, 1024]
    - [215, 0]
  - - [96, 208, 64, 1152]
    - [293, 0]
  - - [128, 192, 64, 3200]
    - [221, 0]
  - - [256, 256, 36, 4096]
    - [226, 0]
  - - [160, 160, 64, 288]
    - [260, 0]
  - - [256, 256, 64, 896]
    - [257, 0]
  - - [128, 256, 64, 242]
    - [292, 0]
  - - [128, 128, 36, 440]
    - [235, 0]
  - - [96, 128, 36, 1568]
    - [280, 0]
  - - [192, 384, 36, 1024]
    - [226, 0]
  - - [64, 96, 36, 10368]
    - [297, 0]
  - - [128, 256, 64, 100]
    - [241, 0]
  - - [112, 224, 36, 2048]
    - [234, 0]
  - - [384, 256, 64, 1152]
    - [257, 0]
  - - [192, 384, 36, 128]
    - [292, 0]
  - - [128, 128, 36, 7040]
    - [265, 0]
  - - [128, 256, 64, 1568]
    - [257, 0]
  - - [128, 128, 36, 1568]
    - [249, 0]
  - - [128, 256, 64, 72]
    - [272, 0]
  - - [256, 256, 36, 12544]
    - [286, 0]
  - - [256, 256, 36, 105]
    - [248, 0]
  - - [128, 256, 36, 392]
    - [235, 0]
  - - [64, 64, 64, 5408]
    - [278, 0]
  - - [3, 64, 36, 25088]
    - [245, 0]
  - - [384, 256, 36, 1024]
    - [292, 0]
  - - [35, 96, 36, 13440]
    - [299, 0]
  - - [128, 256, 64, 1152]
    - [257, 0]
  - - [256, 324, 64, 32]
    - [270, 0]
  - - [160, 224, 64, 128]
    - [284, 0]
  - - [192, 224, 36, 2592]
    - [282, 0]
  - - [96, 96, 64, 1152]
    - [260, 0]
  - - [32, 64, 36, 90]
    - [217, 0]
  - - [64, 128, 64, 2888]
    - [232, 0]
  - - [256, 384, 36, 800]
    - [292, 0]
  - - [512, 512, 64, 4]
    - [289, 0]
  - - [192, 320, 36, 128]
    - [229, 0]
  - - [64, 128, 36, 480]
    - [293, 0]
  - - [192, 384, 64, 242]
    - [292, 0]
  - - [256, 486, 64, 32]
    - [285, 0]
  - - [147, 64, 64, 9702]
    - [294, 0]
  - - [512, 512, 64, 64]
    - [228, 0]
  - - [64, 192, 64, 3698]
    - [221, 0]
  - - [73, 192, 64, 10439]
    - [252, 0]
  - - [1, 16, 36, 1440]
    - [268, 0]
  - - [128, 256, 36, 512]
    - [235, 0]
  - - [512, 512, 64, 576]
    - [267, 0]
  - - [64, 64, 36, 12544]
    - [283, 0]
  - - [128, 128, 36, 880]
    - [280, 0]
  - - [192, 224, 36, 128]
    - [238, 0]
  - - [64, 64, 64, 800]
    - [278, 0]
  - - [64, 128, 36, 12544]
    - [256, 0]
  - - [64, 64, 36, 1568]
    - [230, 0]
  - - [160, 160, 36, 512]
    - [230, 0]
  - - [512, 24, 64, 512]
    - [220, 0]
  - - [3, 64, 36, 3136]
    - [245, 0]
  - - [256, 256, 64, 9]
    - [270, 0]
  - - [3, 64, 64, 11552]
    - [273, 0]
  - - [128, 256, 36, 12544]
    - [288, 0]
  - - [128, 128, 36, 3136]
    - [249, 0]
  - - [256, 512, 36, 3136]
    - [232, 0]
  - - [64, 64, 36, 196]
    - [246, 0]
  - - [144, 288, 36, 512]
    - [280, 0]
  - - [256, 24, 64, 32]
    - [259, 0]
  - - [384, 384, 36, 800]
    - [221, 0]
  - - [512, 512, 64, 1600]
    - [267, 0]
  - - [112, 224, 36, 512]
    - [235, 0]
  - - [128, 128, 36, 49]
    - [241, 0]
  - - [512, 512, 36, 4]
    - [269, 0]
  - - [35, 96, 64, 4235]
    - [230, 0]
  - - [192, 384, 64, 450]
    - [221, 0]
  - - [256, 256, 36, 1024]
    - [292, 0]
  - - [112, 224, 64, 1152]
    - [235, 0]
  - - [256, 512, 64, 400]
    - [254, 0]
  - - [149, 32, 36, 19072]
    - [299, 0]
  - - [128, 256, 36, 6272]
    - [235, 0]
  - - [128, 192, 36, 1568]
    - [260, 0]
  - - [256, 256, 36, 512]
    - [292, 0]
  - - [256, 256, 64, 112]
    - [292, 0]
  - - [512, 512, 64, 18]
    - [285, 0]
  - - [256, 256, 64, 18]
    - [248, 0]
  - - [256, 256, 64, 1568]
    - [257, 0]
  - - [64, 96, 36, 1568]
    - [278, 0]
  - - [384, 256, 36, 4096]
    - [292, 0]
  - - [256, 512, 64, 800]
    - [267, 0]
  - - [256, 384, 36, 2048]
    - [292, 0]
  - - [3, 64, 36, 200704]
    - [274, 0]
  - - [384, 384, 64, 2304]
    - [215, 0]
  - - [160, 320, 64, 128]
    - [251, 0]
  - - [512, 512, 36, 528]
    - [221, 0]
  - - [160, 320, 36, 128]
    - [252, 0]
  - - [96, 96, 64, 800]
    - [260, 0]
  - - [256, 512, 36, 49]
    - [248, 0]
  - - [384, 384, 64, 450]
    - [221, 0]
  - - [3, 64, 64, 23104]
    - [273, 0]
  - - [256, 256, 64, 3200]
    - [257, 0]
  - - [128, 192, 36, 512]
    - [235, 0]
  - - [192, 192, 64, 288]
    - [292, 0]
  - - [96, 208, 64, 242]
    - [252, 0]
  - - [256, 16, 36, 3200]
    - [281, 0]
  - - [512, 512, 64, 8]
    - [259, 0]
  - - [64, 128, 64, 5776]
    - [232, 0]
  - - [512, 512, 64, 288]
    - [221, 0]
  - - [256, 16, 36, 32]
    - [277, 0]
  - - [128, 192, 64, 288]
    - [292, 0]
  - - [32, 64, 64, 640]
    - [260, 0]
  - - [64, 64, 36, 392]
    - [260, 0]
  - - [384, 384, 36, 1024]
    - [226, 0]
  - - [64, 64, 36, 11552]
    - [290, 0]
  - - [96, 128, 36, 6272]
    - [280, 0]
  - - [128, 256, 36, 16]
    - [262, 0]
  - - [256, 256, 64, 288]
    - [292, 0]
  - - [64, 64, 64, 1652]
    - [278, 0]
  - - [256, 384, 36, 1024]
    - [226, 0]
  - - [96, 128, 64, 3200]
    - [295, 0]
  - - [256, 324, 36, 3200]
    - [234, 0]
  - - [128, 192, 64, 800]
    - [292, 0]
  - - [64, 128, 64, 10]
    - [233, 0]
  - - [96, 208, 64, 288]
    - [260, 0]
  - - [64, 96, 36, 2592]
    - [242, 0]
  - - [64, 128, 64, 160]
    - [271, 0]
  - - [192, 384, 64, 512]
    - [221, 0]
  - - [64, 64, 36, 6272]
    - [230, 0]
  - - [512, 24, 36, 288]
    - [227, 0]
  - - [128, 128, 64, 1568]
    - [221, 0]
  - - [112, 224, 64, 242]
    - [291, 0]
  - - [128, 256, 64, 1600]
    - [257, 0]
  - - [32, 32, 64, 20000]
    - [225, 0]
  - - [160, 192, 64, 288]
    - [252, 0]
  - - [512, 24, 64, 128]
    - [213, 0]
  - - [512, 512, 36, 32]
    - [248, 0]
  - - [3, 64, 36, 100352]
    - [245, 0]
  - - [3, 64, 64, 1444]
    - [274, 0]
  - - [512, 512, 36, 3136]
    - [215, 0]
  - - [128, 256, 64, 6400]
    - [275, 0]
  - - [256, 256, 36, 2048]
    - [292, 0]
  - - [128, 160, 64, 288]
    - [235, 0]
  - - [256, 256, 64, 6400]
    - [257, 0]
  - - [32, 64, 64, 20000]
    - [283, 0]
  - - [256, 256, 36, 1680]
    - [232, 0]
  - - [128, 128, 64, 210]
    - [292, 0]
  - - [192, 384, 36, 2048]
    - [221, 0]
  - - [256, 256, 64, 144]
    - [292, 0]
  - - [384, 384, 36, 4096]
    - [226, 0]
  - - [160, 320, 64, 1152]
    - [252, 0]
  - - [384, 256, 36, 2048]
    - [292, 0]
  - - [256, 512, 36, 392]
    - [292, 0]
  - - [256, 512, 64, 50]
    - [248, 0]
  - - [73, 192, 36, 23360]
    - [296, 0]
  - - [3, 64, 36, 50176]
    - [245, 0]
  - - [384, 384, 36, 2048]
    - [221, 0]
  - - [256, 384, 64, 450]
    - [267, 0]
  - - [192, 320, 64, 128]
    - [226, 0]
  - - [128, 256, 36, 32]
    - [241, 0]
  - - [160, 192, 36, 512]
    - [280, 0]
  - - [512, 512, 64, 256]
    - [232, 0]
  - - [256, 512, 64, 32]
    - [270, 0]
  - - [384, 384, 64, 576]
    - [221, 0]
  - - [64, 64, 64, 648]
    - [278, 0]
  - - [512, 486, 36, 288]
    - [292, 0]
  - - [32, 64, 36, 1440]
    - [230, 0]
  - - [144, 288, 64, 242]
    - [252, 0]
  - - [384, 256, 64, 576]
    - [257, 0]
  - - [512, 512, 36, 64]
    - [228, 0]
  - - [448, 384, 64, 128]
    - [221, 0]
  - - [64, 128, 64, 722]
    - [271, 0]
  - - [144, 288, 64, 288]
    - [280, 0]
  - - [512, 512, 64, 224]
    - [292, 0]
  - - [112, 224, 64, 288]
    - [291, 0]
  - - [384, 384, 64, 1152]
    - [215, 0]
  - - [448, 384, 36, 128]
    - [292, 0]
  - - [64, 64, 64, 100]
    - [238, 0]
  - - [256, 486, 36, 128]
    - [264, 0]
  - - [64, 96, 64, 4608]
    - [293, 0]
  - - [16, 32, 64, 160]
    - [217, 0]
  - - [64, 192, 36, 6272]
    - [293, 0]
  - - [64, 64, 64, 200]
    - [246, 0]
  - - [256, 256, 36, 800]
    - [292, 0]
  - - [64, 128, 36, 6272]
    - [290, 0]
  - - [32, 64, 64, 40]
    - [237, 0]
  - - [256, 16, 64, 32]
    - [287, 0]
  - - [192, 384, 36, 800]
    - [226, 0]
  - - [128, 128, 36, 3200]
    - [260, 0]
  - - [256, 256, 36, 256]
    - [232, 0]
  - - [192, 384, 64, 1152]
    - [221, 0]
  - - [128, 256, 64, 200]
    - [231, 0]
  - - [64, 96, 64, 1152]
    - [260, 0]
  - - [128, 128, 36, 392]
    - [235, 0]
  - - [80, 192, 36, 10368]
    - [283, 0]
  - - [224, 224, 36, 128]
    - [293, 0]
  - - [512, 512, 64, 28]
    - [248, 0]
  - - [256, 16, 64, 1568]
    - [263, 0]
  - - [144, 288, 64, 1152]
    - [280, 0]
  - - [256, 256, 64, 576]
    - [257, 0]
  - - [64, 128, 36, 784]
    - [293, 0]
  - - [256, 24, 36, 128]
    - [227, 0]
  - - [256, 256, 64, 2304]
    - [257, 0]
  - - [192, 384, 36, 512]
    - [292, 0]
  - - [16, 32, 64, 2560]
    - [245, 0]
  - - [256, 512, 36, 32]
    - [270, 0]
  - - [512, 512, 64, 128]
    - [292, 0]
  - - [128, 128, 64, 200]
    - [229, 0]
  - - [512, 512, 64, 32]
    - [241, 0]
  - - [128, 256, 36, 196]
    - [241, 0]
  - - [8, 384, 64, 6600]
    - [273, 0]
  - - [149, 32, 64, 8195]
    - [235, 0]
  - - [35, 96, 64, 6160]
    - [280, 0]
  - - [64, 64, 36, 1760]
    - [230, 0]
  - - [196, 528, 32, 32]
    - [313, 0]
  - - [5329, 64, 32, 80]
    - [306, 0]
  - - [64, 2880, 1, 320]
    - [357, 0]
  - - [49, 832, 32, 256]
    - [320, 0]
  - - [196, 512, 32, 24]
    - [307, 0]
  - - [289, 1120, 1, 160]
    - [303, 0]
  - - [1225, 192, 32, 32]
    - [311, 0]
  - - [64, 2048, 32, 384]
    - [334, 0]
  - - [1001, 1536, 1, 32]
    - [305, 0]
  - - [289, 1792, 1, 320]
    - [328, 0]
  - - [1001, 1024, 1, 32]
    - [300, 0]
  - - [196, 480, 32, 64]
    - [361, 0]
  - - [64, 1728, 1, 320]
    - [358, 0]
  - - [49, 832, 32, 160]
    - [362, 0]
  - - [49, 832, 32, 384]
    - [320, 0]
  - - [289, 896, 1, 192]
    - [346, 0]
  - - [289, 1024, 32, 384]
    - [365, 0]
  - - [784, 192, 32, 96]
    - [376, 0]
  - - [50176, 256, 1, 128]
    - [339, 0]
  - - [289, 1024, 32, 256]
    - [374, 0]
  - - [289, 1024, 32, 192]
    - [363, 0]
  - - [12544, 512, 1, 256]
    - [323, 0]
  - - [1225, 1728, 1, 192]
    - [327, 0]
  - - [196, 480, 32, 96]
    - [372, 0]
  - - [196, 512, 32, 144]
    - [366, 0]
  - - [784, 400, 1, 32]
    - [301, 0]
  - - [289, 768, 32, 128]
    - [367, 0]
  - - [5329, 576, 1, 96]
    - [310, 0]
  - - [49, 1200, 1, 128]
    - [354, 0]
  - - [64, 1536, 32, 256]
    - [368, 0]
  - - [289, 2592, 1, 384]
    - [336, 0]
  - - [196, 528, 32, 128]
    - [371, 0]
  - - [64, 2048, 32, 448]
    - [334, 0]
  - - [5329, 448, 1, 64]
    - [306, 0]
  - - [784, 256, 32, 64]
    - [308, 0]
  - - [784, 192, 32, 32]
    - [313, 0]
  - - [21609, 288, 1, 32]
    - [326, 0]
  - - [784, 256, 32, 32]
    - [304, 0]
  - - [5041, 720, 1, 192]
    - [322, 0]
  - - [289, 2016, 1, 256]
    - [319, 0]
  - - [196, 512, 32, 128]
    - [364, 0]
  - - [289, 768, 32, 160]
    - [366, 0]
  - - [64, 1536, 32, 384]
    - [337, 0]
  - - [64, 1280, 32, 320]
    - [337, 0]
  - - [289, 896, 1, 128]
    - [347, 0]
  - - [289, 3456, 1, 384]
    - [327, 0]
  - - [196, 800, 1, 64]
    - [349, 0]
  - - [64, 1280, 32, 384]
    - [333, 0]
  - - [64, 1344, 1, 512]
    - [352, 0]
  - - [1001, 4096, 1, 512]
    - [333, 0]
  - - [1225, 192, 32, 64]
    - [306, 0]
  - - [64, 1152, 1, 384]
    - [356, 0]
  - - [729, 1600, 1, 192]
    - [318, 0]
  - - [289, 1344, 1, 192]
    - [316, 0]
  - - [784, 192, 32, 16]
    - [343, 0]
  - - [3136, 1024, 1, 2048]
    - [325, 0]
  - - [64, 1152, 1, 448]
    - [353, 0]
  - - [49, 832, 32, 128]
    - [316, 0]
  - - [784, 256, 32, 128]
    - [329, 0]
  - - [49, 800, 1, 128]
    - [351, 0]
  - - [196, 512, 32, 32]
    - [313, 0]
  - - [1225, 384, 32, 96]
    - [330, 0]
  - - [5041, 576, 1, 96]
    - [312, 0]
  - - [49, 832, 32, 48]
    - [345, 0]
  - - [5329, 160, 32, 64]
    - [369, 0]
  - - [1225, 288, 32, 48]
    - [359, 0]
  - - [4096, 9216, 1, 512]
    - [341, 0]
  - - [196, 480, 32, 192]
    - [370, 0]
  - - [64, 1152, 1, 256]
    - [357, 0]
  - - [3136, 1024, 1, 512]
    - [325, 0]
  - - [49, 832, 32, 32]
    - [344, 0]
  - - [784, 192, 32, 64]
    - [308, 0]
  - - [289, 1024, 32, 128]
    - [331, 0]
  - - [289, 768, 32, 192]
    - [375, 0]
  - - [289, 1120, 1, 192]
    - [315, 0]
  - - [196, 512, 32, 112]
    - [321, 0]
  - - [1001, 2048, 1, 32]
    - [309, 0]
  - - [1225, 288, 32, 64]
    - [369, 0]
  - - [196, 600, 1, 64]
    - [348, 0]
  - - [1225, 384, 32, 192]
    - [330, 0]
  - - [50176, 256, 1, 512]
    - [340, 0]
  - - [196, 512, 32, 160]
    - [367, 0]
  - - [4096, 4096, 1, 512]
    - [338, 0]
  - - [49, 832, 32, 192]
    - [316, 0]
  - - [1225, 256, 32, 64]
    - [306, 0]
  - - [64, 2048, 32, 320]
    - [334, 0]
  - - [196, 480, 32, 16]
    - [360, 0]
  - - [1225, 256, 32, 48]
    - [308, 0]
  - - [64, 1280, 32, 448]
    - [333, 0]
  - - [1225, 1200, 1, 64]
    - [302, 0]
  - - [1225, 384, 32, 64]
    - [306, 0]
  - - [12544, 512, 1, 1024]
    - [325, 0]
  - - [64, 1280, 32, 192]
    - [321, 0]
  - - [196, 512, 32, 64]
    - [306, 0]
  - - [289, 1792, 1, 256]
    - [324, 0]
  - - [196, 528, 32, 256]
    - [342, 0]
  - - [64, 2048, 32, 192]
    - [329, 0]
  - - [196, 528, 32, 160]
    - [370, 0]
  - - [1225, 192, 32, 48]
    - [306, 0]
  - - [64, 1728, 1, 192]
    - [356, 0]
  - - [1001, 2048, 1, 64]
    - [382, 0]
  - - [5329, 64, 128, 80]
    - [389, 0]
  - - [64, 1280, 128, 448]
    - [387, 0]
  - - [289, 768, 128, 128]
    - [390, 0]
  - - [1225, 192, 128, 64]
    - [379, 0]
  - - [1225, 288, 128, 48]
    - [392, 0]
  - - [289, 768, 128, 192]
    - [394, 0]
  - - [289, 768, 128, 160]
    - [391, 0]
  - - [64, 2048, 128, 192]
    - [385, 0]
  - - [64, 1280, 128, 384]
    - [388, 0]
  - - [1225, 256, 128, 48]
    - [380, 0]
  - - [1225, 192, 128, 48]
    - [380, 0]
  - - [1225, 288, 128, 64]
    - [392, 0]
  - - [64, 1280, 128, 320]
    - [384, 0]
  - - [1225, 256, 128, 64]
    - [385, 0]
  - - [1001, 2048, 1, 128]
    - [386, 0]
  - - [1225, 192, 128, 32]
    - [381, 0]
  - - [64, 1280, 128, 192]
    - [393, 0]
  - - [1001, 1536, 1, 64]
    - [383, 0]
  - - [65, 1024, 1, 6400]
    - [413, 0]
  - - [256, 4096, 1, 6400]
    - [414, 0]
  - - [1024, 4096, 1, 64]
    - [415, 0]
  - - [1024, 4096, 1, 6336]
    - [416, 0]
  - - [64, 38, 840, 38]
    - [444, 0]
  - - [64, 49, 648, 49]
    - [435, 0]
  - - [512, 2048, 1, 3427]
    - [423, 0]
  - - [512, 2048, 1, 3552]
    - [423, 0]
  - - [512, 2048, 1, 3840]
    - [423, 0]
  - - [512, 33708, 1, 3780]
    - [423, 0]
  - - [512, 33708, 1, 3968]
    - [425, 0]
  - - [512, 33708, 1, 4030]
    - [424, 0]
  - - [2048, 512, 1, 3427]
    - [423, 0]
  - - [2048, 512, 1, 3452]
    - [423, 0]
  - - [2048, 512, 1, 3472]
    - [425, 0]
  - - [2048, 512, 1, 3475]
    - [425, 0]
  - - [64, 12, 2520, 12]
    - [444, 0]
  - - [64, 13, 2336, 13]
    - [449, 0]
  - - [64, 14, 2184, 14]
    - [448, 0]
  - - [64, 15, 2048, 15]
    - [447, 0]
  - - [64, 16, 1920, 16]
    - [443, 0]
  - - [64, 17, 1816, 17]
    - [442, 0]
  - - [64, 18, 1720, 18]
    - [444, 0]
  - - [64, 19, 1632, 19]
    - [445, 0]
  - - [64, 21, 1488, 21]
    - [444, 0]
  - - [64, 23, 1360, 23]
    - [444, 0]
  - - [64, 25, 1256, 25]
    - [444, 0]
  - - [64, 27, 1168, 27]
    - [446, 0]
  - - [64, 29, 1088, 29]
    - [446, 0]
  - - [64, 32, 992, 32]
    - [427, 0]
  - - [64, 35, 904, 35]
    - [444, 0]
  - - [64, 41, 776, 41]
    - [434, 0]
  - - [64, 45, 712, 45]
    - [444, 0]
  - - [64, 54, 592, 54]
    - [434, 0]
  - - [64, 59, 544, 59]
    - [434, 0]
  - - [64, 64, 496, 64]
    - [418, 0]
  - - [64, 64, 496, 65]
    - [450, 0]
  - - [64, 65, 496, 65]
    - [437, 0]
  - - [64, 71, 448, 71]
    - [434, 0]
  - - [64, 77, 408, 77]
    - [435, 0]
  - - [64, 77, 408, 78]
    - [436, 0]
  - - [64, 78, 408, 78]
    - [438, 0]
  - - [64, 85, 376, 85]
    - [439, 0]
  - - [64, 93, 344, 93]
    - [439, 0]
  - - [64, 112, 288, 112]
    - [417, 0]
  - - [64, 122, 264, 122]
    - [420, 0]
  - - [64, 123, 264, 122]
    - [440, 0]
  - - [64, 123, 264, 123]
    - [441, 0]
  - - [64, 134, 240, 134]
    - [439, 0]
  - - [64, 135, 240, 134]
    - [439, 0]
  - - [64, 135, 240, 135]
    - [439, 0]
  - - [49, 512, 64, 2048]
    - [466, 0]
  - - [49, 2048, 64, 512]
    - [460, 0]
  - - [64, 1280, 64, 192]
    - [463, 0]
  - - [64, 1280, 64, 320]
    - [462, 0]
  - - [64, 1280, 64, 384]
    - [467, 0]
  - - [64, 1280, 64, 448]
    - [458, 0]
  - - [64, 2048, 64, 192]
    - [456, 0]
  - - [64, 2048, 64, 320]
    - [457, 0]
  - - [64, 2048, 64, 384]
    - [458, 0]
  - - [64, 2048, 64, 448]
    - [459, 0]
  - - [196, 256, 64, 1024]
    - [459, 0]
  - - [196, 1024, 64, 256]
    - [465, 0]
  - - [289, 768, 64, 128]
    - [462, 0]
  - - [289, 768, 64, 160]
    - [461, 0]
  - - [289, 768, 64, 192]
    - [462, 0]
  - - [784, 128, 64, 512]
    - [458, 0]
  - - [784, 512, 64, 128]
    - [456, 0]
  - - [1225, 192, 64, 32]
    - [455, 0]
  - - [1225, 192, 64, 48]
    - [454, 0]
  - - [1225, 192, 64, 64]
    - [454, 0]
  - - [1225, 256, 64, 48]
    - [454, 0]
  - - [1225, 256, 64, 64]
    - [454, 0]
  - - [1225, 288, 64, 48]
    - [464, 0]
  - - [1225, 288, 64, 64]
    - [464, 0]
  - - [3136, 64, 64, 64]
    - [454, 0]
  - - [3136, 64, 64, 256]
    - [462, 0]
  - - [3136, 256, 64, 64]
    - [456, 0]
  - - [5329, 64, 64, 80]
    - [453, 0]
  - - [1024, 2, 1, 512]
    - [484, 0]
  - - [1024, 2, 1, 3072]
    - [484, 0]
  - - [1024, 1024, 1, 1]
    - [468, 0]
  - - [1024, 2, 1, 6]
    - [484, 0]
  - - [1024, 256, 1, 18944]
    - [497, 0]
  - - [33, 32, 1600, 33]
    - [487, 0]
  - - [1024, 256, 1, 15872]
    - [490, 0]
  - - [256, 3328, 1, 8976]
    - [490, 0]
  - - [512, 32, 1, 1600]
    - [490, 0]
  - - [1024, 256, 1, 4352]
    - [490, 0]
  - - [256, 9728, 1, 8976]
    - [485, 0]
  - - [1024, 256, 1, 3072]
    - [490, 0]
  - - [74, 2048, 1, 512]
    - [497, 0]
  - - [1024, 1024, 1, 512]
    - [503, 0]
  - - [2048, 256, 1, 1024]
    - [497, 0]
  - - [1024, 256, 1, 2816]
    - [490, 0]
  - - [1024, 256, 1, 10496]
    - [490, 0]
  - - [33, 32, 200, 33]
    - [486, 0]
  - - [100, 2048, 1, 512]
    - [490, 0]
  - - [2048, 2048, 1, 512]
    - [502, 0]
  - - [1024, 256, 1, 11520]
    - [490, 0]
  - - [1024, 256, 1, 19968]
    - [490, 0]
  - - [256, 12800, 1, 8976]
    - [485, 0]
  - - [1024, 256, 1, 3328]
    - [490, 0]
  - - [256, 2816, 1, 8976]
    - [497, 0]
  - - [1024, 64, 1, 512]
    - [495, 0]
  - - [256, 21248, 1, 8976]
    - [499, 0]
  - - [3, 64, 512, 3]
    - [487, 0]
  - - [1024, 1024, 1, 200]
    - [500, 0]
  - - [256, 10496, 1, 8976]
    - [491, 0]
  - - [2048, 2048, 1, 1024]
    - [501, 0]
  - - [1024, 256, 1, 4608]
    - [490, 0]
  - - [256, 15872, 1, 8976]
    - [490, 0]
  - - [1600, 1024, 1, 512]
    - [500, 0]
  - - [1024, 256, 1, 6400]
    - [490, 0]
  - - [1024, 256, 1, 13568]
    - [497, 0]
  - - [256, 44505, 1, 8976]
    - [491, 0]
  - - [256, 6144, 1, 8976]
    - [486, 0]
  - - [1024, 256, 1, 5120]
    - [490, 0]
  - - [256, 33536, 1, 8976]
    - [502, 0]
  - - [256, 3840, 1, 8976]
    - [490, 0]
  - - [1024, 256, 1, 21248]
    - [490, 0]
  - - [1024, 256, 1, 12032]
    - [490, 0]
  - - [256, 8192, 1, 8976]
    - [501, 0]
  - - [256, 13568, 1, 8976]
    - [491, 0]
  - - [1024, 256, 1, 16128]
    - [490, 0]
  - - [1024, 256, 1, 14336]
    - [497, 0]
  - - [256, 11264, 1, 8976]
    - [502, 0]
  - - [1024, 256, 1, 5376]
    - [490, 0]
  - - [256, 10240, 1, 8976]
    - [499, 0]
  - - [256, 4096, 1, 8976]
    - [503, 0]
  - - [1024, 256, 1, 4096]
    - [490, 0]
  - - [256, 2560, 1, 8976]
    - [490, 0]
  - - [256, 20992, 1, 8976]
    - [491, 0]
  - - [256, 4352, 1, 8976]
    - [489, 0]
  - - [256, 8960, 1, 8976]
    - [485, 0]
  - - [256, 3584, 1, 8976]
    - [490, 0]
  - - [9, 64, 512, 9]
    - [494, 0]
  - - [256, 26112, 1, 8976]
    - [485, 0]
  - - [512, 32, 1, 200]
    - [495, 0]
  - - [256, 14336, 1, 8976]
    - [498, 0]
  - - [1024, 256, 1, 14848]
    - [497, 0]
  - - [512, 512, 1, 1600]
    - [490, 0]
  - - [1024, 256, 1, 8448]
    - [490, 0]
  - - [560, 1024, 1, 1600]
    - [493, 0]
  - - [256, 22016, 1, 8976]
    - [502, 0]
  - - [4096, 4096, 1, 1024]
    - [498, 0]
  - - [256, 5120, 1, 8976]
    - [503, 0]
  - - [256, 11520, 1, 8976]
    - [491, 0]
  - - [256, 19968, 1, 8976]
    - [499, 0]
  - - [1024, 256, 1, 22016]
    - [490, 0]
  - - [1024, 256, 1, 5632]
    - [490, 0]
  - - [1024, 1, 1, 200]
    - [496, 0]
  - - [1024, 256, 1, 7936]
    - [497, 0]
  - - [256, 17408, 1, 8976]
    - [499, 0]
  - - [256, 5632, 1, 8976]
    - [486, 0]
  - - [257, 4096, 1, 1024]
    - [503, 0]
  - - [256, 11008, 1, 8976]
    - [485, 0]
  - - [1024, 256, 1, 6144]
    - [490, 0]
  - - [256, 4864, 1, 8976]
    - [489, 0]
  - - [256, 15104, 1, 8976]
    - [499, 0]
  - - [1024, 256, 1, 9984]
    - [490, 0]
  - - [3200, 2048, 1, 1024]
    - [503, 0]
  - - [1024, 256, 1, 9728]
    - [497, 0]
  - - [512, 2048, 1, 256]
    - [500, 0]
  - - [256, 11776, 1, 8976]
    - [487, 0]
  - - [256, 12544, 1, 8976]
    - [494, 0]
  - - [1024, 256, 1, 17152]
    - [497, 0]
  - - [2048, 1, 1, 512]
    - [489, 0]
  - - [1024, 256, 1, 1024]
    - [497, 0]
  - - [1024, 256, 1, 21504]
    - [497, 0]
  - - [256, 17152, 1, 8976]
    - [496, 0]
  - - [1024, 256, 1, 17408]
    - [490, 0]
  - - [256, 1280, 1, 8976]
    - [490, 0]
  - - [256, 18688, 1, 8976]
    - [499, 0]
  - - [67, 2048, 1, 512]
    - [497, 0]
  - - [256, 5888, 1, 8976]
    - [486, 0]
  - - [1024, 256, 1, 33536]
    - [497, 0]
  - - [768, 2048, 1, 256]
    - [492, 0]
  - - [1024, 256, 1, 7680]
    - [490, 0]
  - - [1024, 256, 1, 1280]
    - [490, 0]
  - - [256, 14848, 1, 8976]
    - [491, 0]
  - - [256, 7168, 1, 8976]
    - [500, 0]
  - - [256, 9984, 1, 8976]
    - [485, 0]
  - - [1024, 256, 1, 3584]
    - [490, 0]
  - - [256, 20480, 1, 8976]
    - [503, 0]
  - - [1024, 256, 1, 8192]
    - [490, 0]
  - - [1024, 256, 1, 19712]
    - [497, 0]
  - - [1024, 256, 1, 28672]
    - [497, 0]
  - - [1024, 256, 1, 15104]
    - [490, 0]
  - - [560, 1024, 1, 200]
    - [488, 0]
  - - [5, 64, 512, 5]
    - [485, 0]
  - - [256, 13312, 1, 8976]
    - [501, 0]
  - - [256, 32512, 1, 8976]
    - [502, 0]
  - - [1024, 1024, 1, 1600]
    - [500, 0]
  - - [1024, 256, 1, 2304]
    - [490, 0]
  - - [512, 512, 1, 200]
    - [490, 0]
  - - [256, 16128, 1, 8976]
    - [486, 0]
  - - [512, 2048, 1, 2790]
    - [505, 0]
  - - [512, 2048, 1, 2864]
    - [505, 0]
  - - [512, 2048, 1, 3092]
    - [505, 0]
  - - [512, 2048, 1, 3113]
    - [505, 0]
  - - [512, 2048, 1, 3137]
    - [505, 0]
  - - [512, 2048, 1, 3165]
    - [505, 0]
  - - [512, 2048, 1, 3166]
    - [505, 0]
  - - [512, 2048, 1, 3194]
    - [505, 0]
  - - [512, 2048, 1, 3219]
    - [505, 0]
  - - [512, 2048, 1, 3222]
    - [505, 0]
  - - [512, 2048, 1, 3234]
    - [505, 0]
  - - [512, 2048, 1, 3237]
    - [505, 0]
  - - [512, 2048, 1, 3242]
    - [505, 0]
  - - [512, 2048, 1, 3246]
    - [505, 0]
  - - [512, 2048, 1, 3249]
    - [505, 0]
  - - [512, 2048, 1, 3251]
    - [505, 0]
  - - [512, 2048, 1, 3257]
    - [505, 0]
  - - [512, 2048, 1, 3262]
    - [507, 0]
  - - [512, 2048, 1, 3268]
    - [505, 0]
  - - [512, 2048, 1, 3282]
    - [505, 0]
  - - [512, 2048, 1, 3286]
    - [505, 0]
  - - [512, 2048, 1, 3287]
    - [506, 0]
  - - [512, 2048, 1, 3293]
    - [505, 0]
  - - [512, 2048, 1, 3297]
    - [505, 0]
  - - [512, 2048, 1, 3307]
    - [505, 0]
  - - [512, 2048, 1, 3314]
    - [505, 0]
  - - [512, 2048, 1, 3315]
    - [505, 0]
  - - [512, 2048, 1, 3319]
    - [505, 0]
  - - [512, 2048, 1, 3322]
    - [508, 0]
  - - [512, 2048, 1, 3323]
    - [505, 0]
  - - [512, 2048, 1, 3324]
    - [505, 0]
  - - [512, 2048, 1, 3325]
    - [507, 0]
  - - [512, 2048, 1, 3327]
    - [505, 0]
  - - [512, 2048, 1, 3329]
    - [505, 0]
  - - [512, 2048, 1, 3332]
    - [505, 0]
  - - [512, 2048, 1, 3336]
    - [505, 0]
  - - [512, 2048, 1, 3339]
    - [505, 0]
  - - [512, 2048, 1, 3342]
    - [505, 0]
  - - [512, 2048, 1, 3344]
    - [508, 0]
  - - [512, 2048, 1, 3358]
    - [505, 0]
  - - [512, 2048, 1, 3360]
    - [507, 0]
  - - [512, 2048, 1, 3364]
    - [505, 0]
  - - [512, 2048, 1, 3365]
    - [505, 0]
  - - [512, 2048, 1, 3369]
    - [505, 0]
  - - [512, 2048, 1, 3371]
    - [505, 0]
  - - [512, 2048, 1, 3374]
    - [505, 0]
  - - [512, 2048, 1, 3376]
    - [505, 0]
  - - [512, 2048, 1, 3377]
    - [508, 0]
  - - [512, 2048, 1, 3378]
    - [505, 0]
  - - [512, 2048, 1, 3381]
    - [505, 0]
  - - [512, 2048, 1, 3382]
    - [505, 0]
  - - [512, 2048, 1, 3383]
    - [505, 0]
  - - [512, 2048, 1, 3384]
    - [505, 0]
  - - [512, 2048, 1, 3385]
    - [505, 0]
  - - [512, 2048, 1, 3386]
    - [505, 0]
  - - [512, 2048, 1, 3388]
    - [505, 0]
  - - [512, 2048, 1, 3390]
    - [505, 0]
  - - [512, 2048, 1, 3391]
    - [505, 0]
  - - [512, 2048, 1, 3396]
    - [505, 0]
  - - [512, 2048, 1, 3399]
    - [507, 0]
  - - [512, 2048, 1, 3402]
    - [505, 0]
  - - [512, 2048, 1, 3410]
    - [505, 0]
  - - [512, 2048, 1, 3412]
    - [505, 0]
  - - [512, 2048, 1, 3414]
    - [505, 0]
  - - [512, 2048, 1, 3415]
    - [505, 0]
  - - [512, 2048, 1, 3418]
    - [505, 0]
  - - [512, 2048, 1, 3420]
    - [505, 0]
  - - [512, 2048, 1, 3422]
    - [507, 0]
  - - [512, 2048, 1, 3425]
    - [505, 0]
  - - [512, 2048, 1, 3426]
    - [505, 0]
  - - [512, 2048, 1, 3428]
    - [505, 0]
  - - [512, 2048, 1, 3430]
    - [505, 0]
  - - [512, 2048, 1, 3431]
    - [505, 0]
  - - [512, 2048, 1, 3432]
    - [506, 0]
  - - [512, 2048, 1, 3438]
    - [505, 0]
  - - [512, 2048, 1, 3439]
    - [507, 0]
  - - [512, 2048, 1, 3440]
    - [507, 0]
  - - [512, 2048, 1, 3443]
    - [505, 0]
  - - [512, 2048, 1, 3445]
    - [505, 0]
  - - [512, 2048, 1, 3447]
    - [505, 0]
  - - [512, 2048, 1, 3448]
    - [505, 0]
  - - [512, 2048, 1, 3450]
    - [505, 0]
  - - [512, 2048, 1, 3451]
    - [505, 0]
  - - [512, 2048, 1, 3452]
    - [505, 0]
  - - [512, 2048, 1, 3453]
    - [505, 0]
  - - [512, 2048, 1, 3455]
    - [505, 0]
  - - [512, 2048, 1, 3456]
    - [505, 0]
  - - [512, 2048, 1, 3457]
    - [505, 0]
  - - [512, 2048, 1, 3458]
    - [507, 0]
  - - [512, 2048, 1, 3459]
    - [505, 0]
  - - [512, 2048, 1, 3460]
    - [505, 0]
  - - [512, 2048, 1, 3461]
    - [505, 0]
  - - [512, 2048, 1, 3462]
    - [507, 0]
  - - [512, 2048, 1, 3466]
    - [505, 0]
  - - [512, 2048, 1, 3467]
    - [507, 0]
  - - [512, 2048, 1, 3468]
    - [505, 0]
  - - [512, 2048, 1, 3470]
    - [505, 0]
  - - [512, 2048, 1, 3471]
    - [505, 0]
  - - [512, 2048, 1, 3472]
    - [505, 0]
  - - [512, 2048, 1, 3475]
    - [505, 0]
  - - [512, 2048, 1, 3476]
    - [505, 0]
  - - [512, 2048, 1, 3477]
    - [505, 0]
  - - [512, 2048, 1, 3478]
    - [507, 0]
  - - [512, 2048, 1, 3479]
    - [505, 0]
  - - [512, 2048, 1, 3480]
    - [505, 0]
  - - [512, 2048, 1, 3481]
    - [505, 0]
  - - [512, 2048, 1, 3483]
    - [505, 0]
  - - [512, 2048, 1, 3484]
    - [505, 0]
  - - [512, 2048, 1, 3487]
    - [505, 0]
  - - [512, 2048, 1, 3489]
    - [505, 0]
  - - [512, 2048, 1, 3490]
    - [505, 0]
  - - [512, 2048, 1, 3491]
    - [505, 0]
  - - [512, 2048, 1, 3493]
    - [507, 0]
  - - [512, 2048, 1, 3494]
    - [505, 0]
  - - [512, 2048, 1, 3495]
    - [507, 0]
  - - [512, 2048, 1, 3497]
    - [505, 0]
  - - [512, 2048, 1, 3498]
    - [507, 0]
  - - [512, 2048, 1, 3499]
    - [508, 0]
  - - [512, 2048, 1, 3501]
    - [505, 0]
  - - [512, 2048, 1, 3503]
    - [505, 0]
  - - [512, 2048, 1, 3507]
    - [505, 0]
  - - [512, 2048, 1, 3508]
    - [505, 0]
  - - [512, 2048, 1, 3509]
    - [507, 0]
  - - [512, 2048, 1, 3511]
    - [505, 0]
  - - [512, 2048, 1, 3514]
    - [505, 0]
  - - [512, 2048, 1, 3515]
    - [505, 0]
  - - [512, 2048, 1, 3517]
    - [505, 0]
  - - [512, 2048, 1, 3518]
    - [505, 0]
  - - [512, 2048, 1, 3519]
    - [505, 0]
  - - [512, 2048, 1, 3520]
    - [505, 0]
  - - [512, 2048, 1, 3523]
    - [505, 0]
  - - [512, 2048, 1, 3528]
    - [505, 0]
  - - [512, 2048, 1, 3529]
    - [505, 0]
  - - [512, 2048, 1, 3530]
    - [505, 0]
  - - [512, 2048, 1, 3532]
    - [506, 0]
  - - [512, 2048, 1, 3533]
    - [505, 0]
  - - [512, 2048, 1, 3534]
    - [505, 0]
  - - [512, 2048, 1, 3538]
    - [505, 0]
  - - [512, 2048, 1, 3539]
    - [505, 0]
  - - [512, 2048, 1, 3541]
    - [505, 0]
  - - [512, 2048, 1, 3547]
    - [505, 0]
  - - [512, 2048, 1, 3548]
    - [506, 0]
  - - [512, 2048, 1, 3564]
    - [505, 0]
  - - [512, 2048, 1, 3575]
    - [505, 0]
  - - [512, 2048, 1, 3598]
    - [505, 0]
  - - [512, 2048, 1, 3599]
    - [505, 0]
  - - [512, 2048, 1, 3608]
    - [505, 0]
  - - [512, 2048, 1, 3780]
    - [505, 0]
  - - [512, 2048, 1, 3796]
    - [505, 0]
  - - [512, 2048, 1, 3822]
    - [505, 0]
  - - [512, 2048, 1, 3859]
    - [505, 0]
  - - [512, 2048, 1, 3870]
    - [505, 0]
  - - [512, 2048, 1, 3876]
    - [505, 0]
  - - [512, 2048, 1, 3906]
    - [507, 0]
  - - [512, 2048, 1, 3910]
    - [505, 0]
  - - [512, 2048, 1, 3925]
    - [505, 0]
  - - [512, 2048, 1, 3942]
    - [505, 0]
  - - [512, 2048, 1, 3944]
    - [505, 0]
  - - [512, 2048, 1, 3955]
    - [507, 0]
  - - [512, 2048, 1, 3968]
    - [507, 0]
  - - [512, 2048, 1, 3969]
    - [505, 0]
  - - [512, 2048, 1, 3976]
    - [505, 0]
  - - [512, 2048, 1, 3977]
    - [505, 0]
  - - [512, 2048, 1, 3978]
    - [505, 0]
  - - [512, 2048, 1, 3990]
    - [505, 0]
  - - [512, 2048, 1, 3995]
    - [505, 0]
  - - [512, 2048, 1, 3996]
    - [505, 0]
  - - [512, 2048, 1, 3999]
    - [505, 0]
  - - [512, 2048, 1, 4005]
    - [505, 0]
  - - [512, 2048, 1, 4012]
    - [505, 0]
  - - [512, 2048, 1, 4020]
    - [505, 0]
  - - [512, 2048, 1, 4026]
    - [505, 0]
  - - [512, 2048, 1, 4030]
    - [505, 0]
  - - [512, 2048, 1, 4032]
    - [505, 0]
  - - [512, 33708, 1, 3796]
    - [527, 0]
  - - [512, 33708, 1, 3822]
    - [529, 0]
  - - [512, 33708, 1, 3840]
    - [529, 0]
  - - [512, 33708, 1, 3859]
    - [529, 0]
  - - [512, 33708, 1, 3870]
    - [527, 0]
  - - [512, 33708, 1, 3876]
    - [527, 0]
  - - [512, 33708, 1, 3906]
    - [527, 0]
  - - [512, 33708, 1, 3910]
    - [529, 0]
  - - [512, 33708, 1, 3925]
    - [527, 0]
  - - [512, 33708, 1, 3942]
    - [529, 0]
  - - [512, 33708, 1, 3944]
    - [529, 0]
  - - [512, 33708, 1, 3955]
    - [529, 0]
  - - [512, 33708, 1, 3969]
    - [529, 0]
  - - [512, 33708, 1, 3976]
    - [527, 0]
  - - [512, 33708, 1, 3977]
    - [527, 0]
  - - [512, 33708, 1, 3978]
    - [527, 0]
  - - [512, 33708, 1, 3990]
    - [529, 0]
  - - [512, 33708, 1, 3995]
    - [528, 0]
  - - [512, 33708, 1, 3996]
    - [527, 0]
  - - [512, 33708, 1, 3999]
    - [529, 0]
  - - [512, 33708, 1, 4005]
    - [527, 0]
  - - [512, 33708, 1, 4012]
    - [529, 0]
  - - [512, 33708, 1, 4020]
    - [527, 0]
  - - [512, 33708, 1, 4026]
    - [527, 0]
  - - [512, 33708, 1, 4032]
    - [527, 0]
  - - [2048, 512, 1, 2790]
    - [505, 0]
  - - [2048, 512, 1, 2864]
    - [505, 0]
  - - [2048, 512, 1, 3092]
    - [505, 0]
  - - [2048, 512, 1, 3113]
    - [505, 0]
  - - [2048, 512, 1, 3137]
    - [505, 0]
  - - [2048, 512, 1, 3165]
    - [505, 0]
  - - [2048, 512, 1, 3166]
    - [505, 0]
  - - [2048, 512, 1, 3194]
    - [505, 0]
  - - [2048, 512, 1, 3219]
    - [505, 0]
  - - [2048, 512, 1, 3222]
    - [505, 0]
  - - [2048, 512, 1, 3234]
    - [505, 0]
  - - [2048, 512, 1, 3237]
    - [505, 0]
  - - [2048, 512, 1, 3242]
    - [505, 0]
  - - [2048, 512, 1, 3246]
    - [505, 0]
  - - [2048, 512, 1, 3249]
    - [505, 0]
  - - [2048, 512, 1, 3251]
    - [505, 0]
  - - [2048, 512, 1, 3257]
    - [505, 0]
  - - [2048, 512, 1, 3262]
    - [505, 0]
  - - [2048, 512, 1, 3268]
    - [505, 0]
  - - [2048, 512, 1, 3282]
    - [505, 0]
  - - [2048, 512, 1, 3286]
    - [505, 0]
  - - [2048, 512, 1, 3287]
    - [505, 0]
  - - [2048, 512, 1, 3293]
    - [505, 0]
  - - [2048, 512, 1, 3297]
    - [505, 0]
  - - [2048, 512, 1, 3307]
    - [505, 0]
  - - [2048, 512, 1, 3314]
    - [505, 0]
  - - [2048, 512, 1, 3315]
    - [505, 0]
  - - [2048, 512, 1, 3319]
    - [505, 0]
  - - [2048, 512, 1, 3322]
    - [505, 0]
  - - [2048, 512, 1, 3323]
    - [505, 0]
  - - [2048, 512, 1, 3324]
    - [505, 0]
  - - [2048, 512, 1, 3325]
    - [505, 0]
  - - [2048, 512, 1, 3327]
    - [505, 0]
  - - [2048, 512, 1, 3329]
    - [505, 0]
  - - [2048, 512, 1, 3332]
    - [505, 0]
  - - [2048, 512, 1, 3336]
    - [505, 0]
  - - [2048, 512, 1, 3339]
    - [505, 0]
  - - [2048, 512, 1, 3342]
    - [505, 0]
  - - [2048, 512, 1, 3344]
    - [505, 0]
  - - [2048, 512, 1, 3358]
    - [505, 0]
  - - [2048, 512, 1, 3360]
    - [505, 0]
  - - [2048, 512, 1, 3364]
    - [505, 0]
  - - [2048, 512, 1, 3365]
    - [505, 0]
  - - [2048, 512, 1, 3369]
    - [504, 0]
  - - [2048, 512, 1, 3371]
    - [505, 0]
  - - [2048, 512, 1, 3374]
    - [505, 0]
  - - [2048, 512, 1, 3376]
    - [505, 0]
  - - [2048, 512, 1, 3377]
    - [505, 0]
  - - [2048, 512, 1, 3378]
    - [505, 0]
  - - [2048, 512, 1, 3381]
    - [505, 0]
  - - [2048, 512, 1, 3382]
    - [505, 0]
  - - [2048, 512, 1, 3383]
    - [505, 0]
  - - [2048, 512, 1, 3384]
    - [505, 0]
  - - [2048, 512, 1, 3385]
    - [505, 0]
  - - [2048, 512, 1, 3386]
    - [506, 0]
  - - [2048, 512, 1, 3388]
    - [505, 0]
  - - [2048, 512, 1, 3390]
    - [505, 0]
  - - [2048, 512, 1, 3391]
    - [505, 0]
  - - [2048, 512, 1, 3396]
    - [505, 0]
  - - [2048, 512, 1, 3399]
    - [505, 0]
  - - [2048, 512, 1, 3402]
    - [505, 0]
  - - [2048, 512, 1, 3410]
    - [505, 0]
  - - [2048, 512, 1, 3412]
    - [505, 0]
  - - [2048, 512, 1, 3414]
    - [505, 0]
  - - [2048, 512, 1, 3415]
    - [505, 0]
  - - [2048, 512, 1, 3418]
    - [505, 0]
  - - [2048, 512, 1, 3420]
    - [505, 0]
  - - [2048, 512, 1, 3422]
    - [505, 0]
  - - [2048, 512, 1, 3425]
    - [505, 0]
  - - [2048, 512, 1, 3426]
    - [506, 0]
  - - [2048, 512, 1, 3428]
    - [505, 0]
  - - [2048, 512, 1, 3430]
    - [505, 0]
  - - [2048, 512, 1, 3431]
    - [505, 0]
  - - [2048, 512, 1, 3432]
    - [505, 0]
  - - [2048, 512, 1, 3438]
    - [505, 0]
  - - [2048, 512, 1, 3439]
    - [505, 0]
  - - [2048, 512, 1, 3440]
    - [506, 0]
  - - [2048, 512, 1, 3443]
    - [505, 0]
  - - [2048, 512, 1, 3445]
    - [505, 0]
  - - [2048, 512, 1, 3447]
    - [504, 0]
  - - [2048, 512, 1, 3448]
    - [505, 0]
  - - [2048, 512, 1, 3450]
    - [505, 0]
  - - [2048, 512, 1, 3451]
    - [506, 0]
  - - [2048, 512, 1, 3453]
    - [506, 0]
  - - [2048, 512, 1, 3455]
    - [505, 0]
  - - [2048, 512, 1, 3456]
    - [505, 0]
  - - [2048, 512, 1, 3457]
    - [505, 0]
  - - [2048, 512, 1, 3458]
    - [505, 0]
  - - [2048, 512, 1, 3459]
    - [505, 0]
  - - [2048, 512, 1, 3460]
    - [505, 0]
  - - [2048, 512, 1, 3461]
    - [505, 0]
  - - [2048, 512, 1, 3462]
    - [505, 0]
  - - [2048, 512, 1, 3466]
    - [505, 0]
  - - [2048, 512, 1, 3467]
    - [505, 0]
  - - [2048, 512, 1, 3468]
    - [505, 0]
  - - [2048, 512, 1, 3470]
    - [505, 0]
  - - [2048, 512, 1, 3471]
    - [505, 0]
  - - [2048, 512, 1, 3476]
    - [505, 0]
  - - [2048, 512, 1, 3477]
    - [505, 0]
  - - [2048, 512, 1, 3478]
    - [505, 0]
  - - [2048, 512, 1, 3479]
    - [505, 0]
  - - [2048, 512, 1, 3480]
    - [505, 0]
  - - [2048, 512, 1, 3481]
    - [505, 0]
  - - [2048, 512, 1, 3483]
    - [505, 0]
  - - [2048, 512, 1, 3484]
    - [505, 0]
  - - [2048, 512, 1, 3487]
    - [505, 0]
  - - [2048, 512, 1, 3489]
    - [505, 0]
  - - [2048, 512, 1, 3490]
    - [505, 0]
  - - [2048, 512, 1, 3491]
    - [505, 0]
  - - [2048, 512, 1, 3493]
    - [506, 0]
  - - [2048, 512, 1, 3494]
    - [505, 0]
  - - [2048, 512, 1, 3495]
    - [505, 0]
  - - [2048, 512, 1, 3497]
    - [505, 0]
  - - [2048, 512, 1, 3498]
    - [505, 0]
  - - [2048, 512, 1, 3499]
    - [505, 0]
  - - [2048, 512, 1, 3501]
    - [505, 0]
  - - [2048, 512, 1, 3503]
    - [505, 0]
  - - [2048, 512, 1, 3507]
    - [505, 0]
  - - [2048, 512, 1, 3508]
    - [505, 0]
  - - [2048, 512, 1, 3509]
    - [505, 0]
  - - [2048, 512, 1, 3511]
    - [505, 0]
  - - [2048, 512, 1, 3514]
    - [505, 0]
  - - [2048, 512, 1, 3515]
    - [505, 0]
  - - [2048, 512, 1, 3517]
    - [505, 0]
  - - [2048, 512, 1, 3518]
    - [505, 0]
  - - [2048, 512, 1, 3519]
    - [505, 0]
  - - [2048, 512, 1, 3520]
    - [505, 0]
  - - [2048, 512, 1, 3523]
    - [505, 0]
  - - [2048, 512, 1, 3528]
    - [505, 0]
  - - [2048, 512, 1, 3529]
    - [505, 0]
  - - [2048, 512, 1, 3530]
    - [505, 0]
  - - [2048, 512, 1, 3532]
    - [505, 0]
  - - [2048, 512, 1, 3533]
    - [505, 0]
  - - [2048, 512, 1, 3534]
    - [505, 0]
  - - [2048, 512, 1, 3538]
    - [505, 0]
  - - [2048, 512, 1, 3539]
    - [505, 0]
  - - [2048, 512, 1, 3541]
    - [505, 0]
  - - [2048, 512, 1, 3547]
    - [505, 0]
  - - [2048, 512, 1, 3548]
    - [505, 0]
  - - [2048, 512, 1, 3552]
    - [505, 0]
  - - [2048, 512, 1, 3564]
    - [506, 0]
  - - [2048, 512, 1, 3575]
    - [505, 0]
  - - [2048, 512, 1, 3598]
    - [505, 0]
  - - [2048, 512, 1, 3599]
    - [505, 0]
  - - [2048, 512, 1, 3608]
    - [505, 0]
  - - [2048, 512, 1, 3780]
    - [505, 0]
  - - [2048, 512, 1, 3796]
    - [505, 0]
  - - [2048, 512, 1, 3822]
    - [505, 0]
  - - [2048, 512, 1, 3840]
    - [505, 0]
  - - [2048, 512, 1, 3859]
    - [505, 0]
  - - [2048, 512, 1, 3870]
    - [505, 0]
  - - [2048, 512, 1, 3876]
    - [505, 0]
  - - [2048, 512, 1, 3906]
    - [505, 0]
  - - [2048, 512, 1, 3910]
    - [505, 0]
  - - [2048, 512, 1, 3925]
    - [505, 0]
  - - [2048, 512, 1, 3942]
    - [506, 0]
  - - [2048, 512, 1, 3944]
    - [505, 0]
  - - [2048, 512, 1, 3955]
    - [506, 0]
  - - [2048, 512, 1, 3968]
    - [505, 0]
  - - [2048, 512, 1, 3969]
    - [505, 0]
  - - [2048, 512, 1, 3976]
    - [506, 0]
  - - [2048, 512, 1, 3977]
    - [505, 0]
  - - [2048, 512, 1, 3978]
    - [505, 0]
  - - [2048, 512, 1, 3990]
    - [505, 0]
  - - [2048, 512, 1, 3995]
    - [505, 0]
  - - [2048, 512, 1, 3996]
    - [505, 0]
  - - [2048, 512, 1, 3999]
    - [505, 0]
  - - [2048, 512, 1, 4005]
    - [505, 0]
  - - [2048, 512, 1, 4012]
    - [505, 0]
  - - [2048, 512, 1, 4020]
    - [505, 0]
  - - [2048, 512, 1, 4026]
    - [505, 0]
  - - [2048, 512, 1, 4030]
    - [505, 0]
  - - [2048, 512, 1, 4032]
    - [505, 0]
  - - [512, 512, 1, 3780]
    - [535, 0]
  - - [512, 512, 1, 3796]
    - [533, 0]
  - - [512, 512, 1, 3822]
    - [535, 0]
  - - [512, 512, 1, 3840]
    - [535, 0]
  - - [512, 512, 1, 3859]
    - [535, 0]
  - - [512, 512, 1, 3870]
    - [535, 0]
  - - [512, 512, 1, 3876]
    - [535, 0]
  - - [512, 512, 1, 3906]
    - [533, 0]
  - - [512, 512, 1, 3910]
    - [535, 0]
  - - [512, 512, 1, 3925]
    - [535, 0]
  - - [512, 512, 1, 3927]
    - [535, 0]
  - - [512, 512, 1, 3942]
    - [535, 0]
  - - [512, 512, 1, 3944]
    - [534, 0]
  - - [512, 512, 1, 3955]
    - [531, 0]
  - - [512, 512, 1, 3968]
    - [535, 0]
  - - [512, 512, 1, 3969]
    - [535, 0]
  - - [512, 512, 1, 3976]
    - [535, 0]
  - - [512, 512, 1, 3977]
    - [535, 0]
  - - [512, 512, 1, 3978]
    - [535, 0]
  - - [512, 512, 1, 3990]
    - [533, 0]
  - - [512, 512, 1, 3995]
    - [535, 0]
  - - [512, 512, 1, 3996]
    - [532, 0]
  - - [512, 512, 1, 3999]
    - [535, 0]
  - - [512, 512, 1, 4005]
    - [535, 0]
  - - [512, 512, 1, 4012]
    - [533, 0]
  - - [512, 512, 1, 4020]
    - [533, 0]
  - - [512, 512, 1, 4026]
    - [535, 0]
  - - [512, 512, 1, 4030]
    - [535, 0]
  - - [512, 512, 1, 4032]
    - [535, 0]
  - - [512, 512, 1, 4050]
    - [530, 0]
  - - [512, 512, 1, 4059]
    - [533, 0]
  - - [64, 102, 312, 102]
    - [516, 0]
  - - [64, 512, 16, 512]
    - [551, 0]
  - - [64, 512, 96, 512]
    - [550, 0]
  - - [1024, 1024, 1, 6]
    - [543, 0]
  - - [1024, 1024, 1, 20]
    - [539, 0]
  - - [1024, 1024, 1, 80]
    - [538, 0]
  - - [1024, 1024, 1, 120]
    - [537, 0]
  - - [1024, 1024, 1, 3072]
    - [553, 0]
  - - [1024, 3072, 1, 512]
    - [545, 0]
  - - [1024, 3072, 1, 2048]
    - [547, 0]
  - - [1024, 3072, 1, 3072]
    - [552, 0]
  - - [1024, 30522, 1, 20]
    - [542, 0]
  - - [1024, 30522, 1, 80]
    - [546, 0]
  - - [1024, 30522, 1, 120]
    - [536, 0]
  - - [3072, 1024, 1, 512]
    - [545, 0]
  - - [3072, 1024, 1, 2048]
    - [548, 0]
  - - [3072, 1024, 1, 3072]
    - [552, 0]
  - - [1024, 2, 1, 1]
    - [554, 0]
  - - [1024, 2, 1, 2048]
    - [558, 0]
  - - [1024, 1024, 1, 3840]
    - [570, 0]
  - - [1024, 1024, 1, 3968]
    - [568, 0]
  - - [1024, 1024, 1, 7200]
    - [570, 0]
  - - [1024, 1024, 1, 8160]
    - [570, 0]
  - - [1024, 1024, 1, 9520]
    - [570, 0]
  - - [1024, 1024, 1, 10200]
    - [571, 0]
  - - [1024, 4096, 1, 3840]
    - [571, 0]
  - - [1024, 4096, 1, 3968]
    - [570, 0]
  - - [1024, 4096, 1, 7200]
    - [568, 0]
  - - [1024, 4096, 1, 8160]
    - [571, 0]
  - - [1024, 4096, 1, 9520]
    - [570, 0]
  - - [1024, 4096, 1, 10200]
    - [570, 0]
  - - [1024, 42720, 1, 3968]
    - [567, 0]
  - - [1024, 42720, 1, 7200]
    - [567, 0]
  - - [1024, 42720, 1, 9520]
    - [567, 0]
  - - [4096, 1024, 1, 3840]
    - [569, 0]
  - - [4096, 1024, 1, 3968]
    - [570, 0]
  - - [4096, 1024, 1, 7200]
    - [570, 0]
  - - [4096, 1024, 1, 8160]
    - [571, 0]
  - - [4096, 1024, 1, 9520]
    - [568, 0]
  - - [4096, 1024, 1, 10200]
    - [568, 0]
  - - [17, 64, 1, 15]
    - [560, 0]
  - - [17, 64, 1, 17]
    - [562, 0]
  - - [30, 64, 1, 30]
    - [566, 0]
  - - [30, 64, 1, 31]
    - [565, 0]
  - - [31, 64, 1, 31]
    - [564, 0]
  - - [64, 17, 1, 15]
    - [564, 0]
  - - [64, 17, 1, 17]
    - [562, 0]
  - - [64, 30, 1, 30]
    - [564, 0]
  - - [64, 30, 1, 31]
    - [562, 0]
  - - [64, 31, 1, 31]
    - [563, 0]
  - - [14, 64, 1, 14]
    - [561, 0]
  - - [15, 64, 1, 14]
    - [560, 0]
  - - [15, 64, 1, 15]
    - [560, 0]
  - - [64, 14, 1, 14]
    - [561, 0]
  - - [64, 15, 1, 14]
    - [560, 0]
  - - [64, 15, 1, 15]
    - [560, 0]
  - - [5760, 5760, 1, 5760]
    - [572, 0]
  - - [7744, 7744, 1, 7744]
    - [572, 0]
  - - [384, 384, 1, 384]
    - [575, 0]
  - - [768, 768, 1, 384]
    - [589, 0]
  - - [1152, 1152, 1, 384]
    - [584, 0]
  - - [1536, 1536, 1, 384]
    - [588, 0]
  - - [1920, 1920, 1, 384]
    - [582, 0]
  - - [2304, 2304, 1, 384]
    - [579, 0]
  - - [2688, 2688, 1, 384]
    - [580, 0]
  - - [3072, 3072, 1, 384]
    - [581, 0]
  - - [3456, 3456, 1, 384]
    - [580, 0]
  - - [3840, 3840, 1, 384]
    - [579, 0]
  - - [4224, 4224, 1, 384]
    - [579, 0]
  - - [4608, 4608, 1, 384]
    - [585, 0]
  - - [4992, 4992, 1, 384]
    - [580, 0]
  - - [5376, 5376, 1, 384]
    - [585, 0]
  - - [5760, 5760, 1, 384]
    - [579, 0]
  - - [6144, 6144, 1, 384]
    - [573, 0]
  - - [6528, 6528, 1, 384]
    - [580, 0]
  - - [6912, 6912, 1, 384]
    - [585, 0]
  - - [7296, 7296, 1, 384]
    - [579, 0]
  - - [7680, 7680, 1, 384]
    - [585, 0]
  - - [384, 192, 1, 384]
    - [576, 0]
  - - [768, 384, 1, 384]
    - [587, 0]
  - - [1152, 576, 1, 384]
    - [589, 0]
  - - [1536, 768, 1, 384]
    - [584, 0]
  - - [1920, 960, 1, 384]
    - [584, 0]
  - - [2304, 1152, 1, 384]
    - [584, 0]
  - - [2688, 1344, 1, 384]
    - [586, 0]
  - - [3072, 1536, 1, 384]
    - [583, 0]
  - - [3456, 1728, 1, 384]
    - [580, 0]
  - - [3840, 1920, 1, 384]
    - [580, 0]
  - - [4224, 2112, 1, 384]
    - [579, 0]
  - - [4608, 2304, 1, 384]
    - [585, 0]
  - - [4992, 2496, 1, 384]
    - [579, 0]
  - - [5376, 2688, 1, 384]
    - [580, 0]
  - - [5760, 2880, 1, 384]
    - [580, 0]
  - - [6144, 3072, 1, 384]
    - [578, 0]
  - - [6528, 3264, 1, 384]
    - [579, 0]
  - - [6912, 3456, 1, 384]
    - [579, 0]
  - - [7296, 3648, 1, 384]
    - [580, 0]
  - - [7680, 3840, 1, 384]
    - [577, 0]
  - - [384, 768, 1, 384]
    - [587, 0]
  - - [768, 1536, 1, 384]
    - [582, 0]
  - - [1152, 2304, 1, 384]
    - [584, 0]
  - - [1536, 3072, 1, 384]
    - [582, 0]
  - - [1920, 3840, 1, 384]
    - [577, 0]
  - - [2304, 4608, 1, 384]
    - [577, 0]
  - - [2688, 5376, 1, 384]
    - [579, 0]
  - - [3072, 6144, 1, 384]
    - [574, 0]
  - - [3456, 6912, 1, 384]
    - [580, 0]
  - - [3840, 7680, 1, 384]
    - [585, 0]
  - - [4224, 8448, 1, 384]
    - [580, 0]
  - - [4608, 9216, 1, 384]
    - [581, 0]
  - - [4992, 9984, 1, 384]
    - [579, 0]
  - - [5376, 10752, 1, 384]
    - [585, 0]
  - - [5760, 11520, 1, 384]
    - [580, 0]
  - - [6144, 12288, 1, 384]
    - [573, 0]
  - - [6528, 13056, 1, 384]
    - [579, 0]
  - - [6912, 13824, 1, 384]
    - [585, 0]
  - - [7296, 14592, 1, 384]
    - [580, 0]
  - - [7680, 15360, 1, 384]
    - [581, 0]
  - - [1024, 2, 1, 32]
    - [598, 0]
  - - [1024, 30528, 1, 4096]
    - [591, 0]
  - - [1024, 1024, 1, 4096]
    - [596, 0]
  - - [1024, 1024, 1, 32]
    - [602, 0]
  - - [4096, 1024, 1, 4096]
    - [595, 0]
  - - [1024, 4096, 1, 4096]
    - [594, 0]
  - - [1024, 1024, 1, 2048]
    - [593, 0]
  - - [1024, 2, 1, 4]
    - [597, 0]
  - - [4096, 1024, 1, 2048]
    - [595, 0]
  - - [1024, 30528, 1, 2048]
    - [592, 0]
  - - [1024, 1024, 1, 4]
    - [603, 0]
  - - [1024, 4096, 1, 2048]
    - [600, 0]
  - - [128, 64, 512, 128]
    - [604, 0]
  - - [64, 128, 512, 128]
    - [601, 0]
  - - [512, 64, 64, 512]
    - [599, 0]
  - - [64, 512, 64, 512]
    - [590, 0]
- null
