library/src/blas3/Tensile/Logic/asm_full/arcturus_Cijk_Alik_Bljk_CB_GB.yaml
- {MinimumRequiredVersion: 4.25.0}
- arcturus
- gfx908
- [Device 7380, Device 7388, Device 738c, Device 7390]
    SolutionIndex: 0
    SolutionNameMin: Cijk_Alik_Bljk_CB_GB_MT32x32x16_MI16x16x4x1_SN_1LDSB0_EPS1_GRVW2_LBSPP128_LPA4_LPB4_PGR1_PLR5_SU0_SUS128_SRVW1_TT1_16_WG32_8_1_WGM1
    SolutionIndex: 1
    SolutionNameMin: Cijk_Alik_Bljk_CB_GB_MT32x32x16_MI16x16x4x1_SN_1LDSB0_EPS0_GRVW2_LBSPP128_LPA4_LPB4_PGR2_PLR5_SU0_SUS128_SRVW1_TT1_16_WG32_8_1_WGM1
    SolutionIndex: 2
    SolutionNameMin: Cijk_Alik_Bljk_CB_GB_MT32x32x32_MI16x16x4x1_SN_1LDSB0_EPS1_GRVW2_LBSPP256_LPA4_LPB4_PGR1_PLR9_SU0_SUS256_SRVW1_TT1_16_WG32_8_1_WGM1
    SolutionIndex: 3
    SolutionNameMin: Cijk_Alik_Bljk_CB_GB_MT32x32x32_MI16x16x4x1_SN_1LDSB0_EPS0_GRVW2_LBSPP256_LPA4_LPB4_PGR2_PLR9_SU0_SUS256_SRVW1_TT1_16_WG32_8_1_WGM1
    SolutionIndex: 4
    SolutionNameMin: Cijk_Alik_Bljk_CB_GB_MT32x32x32_MI16x16x4x1_SN_1LDSB0_EPS0_GRVW2_LBSPP256_LPA4_LPB4_PGR2_PLR9_SU0_SUS256_SRVW1_TT1_16_WG32_8_1_WGM2
    SolutionIndex: 5
    SolutionNameMin: Cijk_Alik_Bljk_CB_GB_MT32x32x16_MI16x16x4x1_SN_1LDSB0_EPS1_GRVW2_LBSPP128_LPA4_LPB4_PGR1_PLR5_SU0_SUS128_SRVW1_TT1_16_WG32_8_1_WGM15
    SolutionIndex: 6
    SolutionNameMin: Cijk_Alik_Bljk_CB_GB_MT32x32x16_MI16x16x4x1_SN_1LDSB1_EPS1_GRVW2_LBSPP128_LPA4_LPB4_PGR1_PLR5_SU0_SUS128_SRVW1_TT1_16_WG32_8_1_WGM1
    SolutionIndex: 7
    SolutionNameMin: Cijk_Alik_Bljk_CB_GB_MT32x32x16_MI16x16x4x1_SN_1LDSB1_EPS0_GRVW2_LBSPP128_LPA4_LPB4_PGR2_PLR5_SU0_SUS128_SRVW1_TT1_16_WG32_8_1_WGM1
    SolutionIndex: 8
    SolutionNameMin: Cijk_Alik_Bljk_CB_GB_MT32x32x32_MI16x16x4x1_SN_1LDSB1_EPS1_GRVW2_LBSPP256_LPA4_LPB4_PGR1_PLR9_SU0_SUS256_SRVW1_TT1_16_WG32_8_1_WGM1
    SolutionIndex: 9
    SolutionNameMin: Cijk_Alik_Bljk_CB_GB_MT32x32x32_MI16x16x4x1_SN_1LDSB1_EPS0_GRVW2_LBSPP256_LPA4_LPB4_PGR2_PLR9_SU0_SUS256_SRVW1_TT1_16_WG32_8_1_WGM1
    SolutionIndex: 10
    SolutionNameMin: Cijk_Alik_Bljk_CB_GB_MT32x32x16_MI16x16x4x1_SN_1LDSB1_EPS1_GRVW2_LBSPP128_LPA4_LPB4_PGR1_PLR5_SU0_SUS128_SRVW1_TT1_16_WG32_8_1_WGM2
    SolutionIndex: 11
    SolutionNameMin: Cijk_Alik_Bljk_CB_GB_MT32x32x16_MI16x16x4x1_SN_1LDSB1_EPS0_GRVW2_LBSPP128_LPA4_LPB4_PGR2_PLR5_SU0_SUS256_SRVW1_TT1_16_WG32_8_1_WGM2
    SolutionIndex: 12
    SolutionNameMin: Cijk_Alik_Bljk_CB_GB_MT32x32x32_MI16x16x4x1_SN_1LDSB1_EPS1_GRVW2_LBSPP256_LPA4_LPB4_PGR1_PLR9_SU0_SUS256_SRVW1_TT1_16_WG32_8_1_WGM2
    SolutionIndex: 13
    SolutionNameMin: Cijk_Alik_Bljk_CB_GB_MT32x32x32_MI16x16x4x1_SN_1LDSB1_EPS0_GRVW2_LBSPP256_LPA4_LPB4_PGR2_PLR9_SU0_SUS256_SRVW1_TT1_16_WG32_8_1_WGM2
    SolutionIndex: 14
    SolutionNameMin: Cijk_Alik_Bljk_CB_GB_MT32x32x16_MI16x16x4x1_SN_1LDSB1_EPS0_GRVW1_LBSPP128_LPA4_LPB4_PGR2_PLR5_SU32_SUS256_SRVW1_TT1_16_WG32_8_1_WGM2
    SolutionIndex: 15
    SolutionNameMin: Cijk_Alik_Bljk_CB_GB_MT32x32x16_MI16x16x4x1_SN_1LDSB1_EPS1_GRVW2_LBSPP128_LPA4_LPB4_PGR1_PLR5_SU32_SUS256_SRVW1_TT1_16_WG32_8_1_WGM2
    SolutionIndex: 16
    SolutionNameMin: Cijk_Alik_Bljk_CB_GB_MT32x32x32_MI16x16x4x1_SN_1LDSB1_EPS1_GRVW2_LBSPP256_LPA4_LPB4_PGR1_PLR9_SU0_SUS256_SRVW1_TT1_16_WG32_8_1_WGM15
    SolutionIndex: 17
    SolutionNameMin: Cijk_Alik_Bljk_CB_GB_MT32x64x16_MI16x16x4x1_SN_1LDSB1_EPS1_GRVW1_LBSPP128_LPA4_LPB4_PGR1_PLR5_SU32_SUS128_SRVW1_TT1_32_WG32_8_1_WGM15
    SolutionIndex: 18
    SolutionNameMin: Cijk_Alik_Bljk_CB_GB_MT32x64x16_MI16x16x4x1_SN_1LDSB1_EPS1_GRVW1_LBSPP128_LPA4_LPB4_PGR1_PLR5_SU32_SUS256_SRVW1_TT1_32_WG32_8_1_WGM15
    SolutionIndex: 19
    SolutionNameMin: Cijk_Alik_Bljk_CB_GB_MT32x64x16_MI16x16x4x1_SN_1LDSB1_EPS1_GRVW2_LBSPP128_LPA4_LPB4_PGR1_PLR5_SU32_SUS256_SRVW1_TT1_32_WG32_8_1_WGM15
- - - [32, 32, 8, 128, 32, 32, 128, 128]
    - [11, 129.0]
  - - [128, 128, 8, 128, 128, 128, 128, 128]
    - [7, 1638.0]
  - - [256, 256, 8, 128, 256, 256, 128, 128]
    - [15, 3647.0]
  - - [512, 512, 8, 128, 512, 512, 128, 128]
    - [19, 5501.0]
  - - [32, 32, 8, 512, 32, 32, 512, 512]
    - [2, 253.0]
  - - [128, 128, 8, 512, 128, 128, 512, 512]
    - [8, 2724.0]
  - - [256, 256, 8, 512, 256, 256, 512, 512]
    - [10, 4654.0]
  - - [512, 512, 8, 512, 512, 512, 512, 512]
    - [17, 6566.0]
  - - [32, 32, 8, 1024, 32, 32, 1024, 1024]
    - [2, 297.0]
  - - [128, 128, 8, 1024, 128, 128, 1024, 1024]
    - [5, 2991.0]
  - - [256, 256, 8, 1024, 256, 256, 1024, 1024]
    - [14, 4842.0]
  - - [512, 512, 8, 1024, 512, 512, 1024, 1024]
    - [18, 6767.0]
  - - [32, 128, 8, 128, 32, 32, 128, 128]
    - [1, 499.0]
  - - [32, 256, 8, 128, 32, 32, 128, 128]
    - [8, 1008.0]
  - - [32, 512, 8, 128, 32, 32, 128, 128]
    - [0, 1691.0]
  - - [32, 128, 8, 512, 32, 32, 512, 512]
    - [8, 994.0]
  - - [32, 256, 8, 512, 32, 32, 512, 512]
    - [2, 2007.0]
  - - [32, 512, 8, 512, 32, 32, 512, 512]
    - [16, 2732.0]
  - - [32, 128, 8, 1024, 32, 32, 1024, 1024]
    - [4, 1178.0]
  - - [32, 256, 8, 1024, 32, 32, 1024, 1024]
    - [13, 2370.0]
  - - [32, 512, 8, 1024, 32, 32, 1024, 1024]
    - [12, 2985.0]
  - - [128, 32, 8, 128, 128, 128, 128, 128]
    - [2, 499.0]
  - - [256, 32, 8, 128, 256, 256, 128, 128]
    - [3, 989.0]
  - - [512, 32, 8, 128, 512, 512, 128, 128]
    - [6, 1678.0]
  - - [128, 32, 8, 512, 128, 128, 512, 512]
    - [2, 1013.0]
  - - [256, 32, 8, 512, 256, 256, 512, 512]
    - [3, 1960.0]
  - - [512, 32, 8, 512, 512, 512, 512, 512]
    - [8, 2715.0]
  - - [128, 32, 8, 1024, 128, 128, 1024, 1024]
    - [9, 1185.0]
  - - [256, 32, 8, 1024, 256, 256, 1024, 1024]
    - [4, 2383.0]
  - - [512, 32, 8, 1024, 512, 512, 1024, 1024]
    - [0, 2975.0]
- null
