library/src/blas3/Tensile/Logic/asm_full/arcturus_Cijk_Alik_Bljk_SB_GB.yaml
- {MinimumRequiredVersion: 4.26.0}
- arcturus
- gfx908
- [Device 7380, Device 7388, Device 738c, Device 7390]
    SolutionIndex: 0
    SolutionNameMin: Cijk_Alik_Bljk_SB_GB_MT32x32x16_MI16x16x4x1_SN_1LDSB0_EPS0_GRVW1_LPA2_LPB2_PGR2_PLR5_SRVW2_TT1_16_WG32_8_1_WGM1
    SolutionIndex: 1
    SolutionNameMin: Cijk_Alik_Bljk_SB_GB_MT64x32x16_MI16x16x4x1_SN_1LDSB0_EPS1_GRVW2_LPA2_LPB2_PGR1_PLR5_SRVW2_TT2_16_WG32_8_1_WGM1
    SolutionIndex: 2
    SolutionNameMin: Cijk_Alik_Bljk_SB_GB_MT32x32x32_MI16x16x4x1_SN_1LDSB0_EPS1_GRVW2_LPA2_LPB2_PGR1_PLR9_SRVW2_TT1_16_WG32_8_1_WGM1
    SolutionIndex: 3
    SolutionNameMin: Cijk_Alik_Bljk_SB_GB_MT32x32x32_MI16x16x4x1_SN_1LDSB0_EPS0_GRVW2_LPA2_LPB2_PGR2_PLR9_SRVW2_TT1_16_WG32_8_1_WGM1
    SolutionIndex: 4
    SolutionNameMin: Cijk_Alik_Bljk_SB_GB_MT64x64x16_MI32x32x2x1_SN_1LDSB0_EPS0_GRVW4_LPA4_LPB4_PGR2_PLR9_SRVW2_TT1_32_WG64_4_1_WGM1
    SolutionIndex: 5
    SolutionNameMin: Cijk_Alik_Bljk_SB_GB_MT32x32x32_MI16x16x4x1_SN_1LDSB0_EPS1_GRVW4_LPA4_LPB4_PGR1_PLR9_SRVW2_TT1_16_WG32_8_1_WGM1
    SolutionIndex: 6
    SolutionNameMin: Cijk_Alik_Bljk_SB_GB_MT64x32x32_MI16x16x4x1_SN_1LDSB0_EPS1_GRVW4_LPA4_LPB4_PGR1_PLR9_SRVW2_TT2_16_WG32_8_1_WGM1
    SolutionIndex: 7
    SolutionNameMin: Cijk_Alik_Bljk_SB_GB_MT32x32x32_MI16x16x4x1_SN_1LDSB0_EPS0_GRVW4_LPA4_LPB4_PGR2_PLR9_SRVW2_TT1_16_WG32_8_1_WGM1
    SolutionIndex: 8
    SolutionNameMin: Cijk_Alik_Bljk_SB_GB_MT64x32x32_MI16x16x4x1_SN_1LDSB0_EPS0_GRVW4_LPA4_LPB4_PGR2_PLR9_SRVW2_TT2_16_WG32_8_1_WGM1
    SolutionIndex: 9
    SolutionNameMin: Cijk_Alik_Bljk_SB_GB_MT64x32x16_MI16x16x4x1_SN_1LDSB0_EPS1_GRVW1_LPA2_LPB2_PGR1_PLR5_SRVW2_TT2_16_WG32_8_1_WGM2
    SolutionIndex: 10
    SolutionNameMin: Cijk_Alik_Bljk_SB_GB_MT32x32x16_MI16x16x4x1_SN_1LDSB0_EPS0_GRVW1_LPA2_LPB2_PGR2_PLR5_SRVW2_TT1_16_WG32_8_1_WGM2
    SolutionIndex: 11
    SolutionNameMin: Cijk_Alik_Bljk_SB_GB_MT64x64x16_MI32x32x2x1_SN_1LDSB0_EPS1_GRVW1_LPA2_LPB2_PGR1_PLR9_SRVW2_TT1_32_WG64_4_1_WGM2
    SolutionIndex: 12
    SolutionNameMin: Cijk_Alik_Bljk_SB_GB_MT32x32x32_MI16x16x4x1_SN_1LDSB0_EPS0_GRVW1_LPA2_LPB2_PGR2_PLR9_SRVW2_TT1_16_WG32_8_1_WGM2
    SolutionIndex: 13
    SolutionNameMin: Cijk_Alik_Bljk_SB_GB_MT64x32x16_MI16x16x4x1_SN_1LDSB0_EPS1_GRVW2_LPA2_LPB2_PGR1_PLR5_SRVW2_TT2_16_WG32_8_1_WGM2
    SolutionIndex: 14
    SolutionNameMin: Cijk_Alik_Bljk_SB_GB_MT32x32x32_MI16x16x4x1_SN_1LDSB0_EPS1_GRVW2_LPA2_LPB2_PGR1_PLR9_SRVW2_TT1_16_WG32_8_1_WGM2
    SolutionIndex: 15
    SolutionNameMin: Cijk_Alik_Bljk_SB_GB_MT32x32x32_MI16x16x4x1_SN_1LDSB0_EPS0_GRVW2_LPA2_LPB2_PGR2_PLR9_SRVW2_TT1_16_WG32_8_1_WGM2
    SolutionIndex: 16
    SolutionNameMin: Cijk_Alik_Bljk_SB_GB_MT32x32x32_MI16x16x4x1_SN_1LDSB0_EPS1_GRVW4_LPA4_LPB4_PGR1_PLR9_SRVW2_TT1_16_WG32_8_1_WGM2
    SolutionIndex: 17
    SolutionNameMin: Cijk_Alik_Bljk_SB_GB_MT64x32x32_MI16x16x4x1_SN_1LDSB0_EPS1_GRVW4_LPA4_LPB4_PGR1_PLR9_SRVW2_TT2_16_WG32_8_1_WGM2
    SolutionIndex: 18
    SolutionNameMin: Cijk_Alik_Bljk_SB_GB_MT32x32x32_MI16x16x4x1_SN_1LDSB0_EPS0_GRVW4_LPA4_LPB4_PGR2_PLR9_SRVW2_TT1_16_WG32_8_1_WGM2
    SolutionIndex: 19
    SolutionNameMin: Cijk_Alik_Bljk_SB_GB_MT64x32x32_MI16x16x4x1_SN_1LDSB0_EPS0_GRVW4_LPA4_LPB4_PGR2_PLR9_SRVW2_TT2_16_WG32_8_1_WGM2
    SolutionIndex: 20
    SolutionNameMin: Cijk_Alik_Bljk_SB_GB_MT64x32x16_MI16x16x4x1_SN_1LDSB0_EPS0_GRVW1_LPA2_LPB2_PGR2_PLR5_SRVW2_TT2_16_WG32_8_1_WGM15
    SolutionIndex: 21
    SolutionNameMin: Cijk_Alik_Bljk_SB_GB_MT32x32x32_MI16x16x4x1_SN_1LDSB0_EPS0_GRVW1_LPA2_LPB2_PGR2_PLR9_SRVW2_TT1_16_WG32_8_1_WGM15
    SolutionIndex: 22
    SolutionNameMin: Cijk_Alik_Bljk_SB_GB_MT32x32x32_MI16x16x4x1_SN_1LDSB0_EPS1_GRVW2_LPA2_LPB2_PGR1_PLR9_SRVW2_TT1_16_WG32_8_1_WGM15
    SolutionIndex: 23
    SolutionNameMin: Cijk_Alik_Bljk_SB_GB_MT64x32x32_MI16x16x4x1_SN_1LDSB0_EPS1_GRVW2_LPA2_LPB2_PGR1_PLR9_SRVW2_TT2_16_WG32_8_1_WGM15
    SolutionIndex: 24
    SolutionNameMin: Cijk_Alik_Bljk_SB_GB_MT32x32x32_MI16x16x4x1_SN_1LDSB0_EPS0_GRVW2_LPA2_LPB2_PGR2_PLR9_SRVW2_TT1_16_WG32_8_1_WGM15
    SolutionIndex: 25
    SolutionNameMin: Cijk_Alik_Bljk_SB_GB_MT64x32x16_MI16x16x4x1_SN_1LDSB0_EPS1_GRVW4_LPA4_LPB4_PGR1_PLR5_SRVW2_TT2_16_WG32_8_1_WGM15
    SolutionIndex: 26
    SolutionNameMin: Cijk_Alik_Bljk_SB_GB_MT64x64x16_MI32x32x2x1_SN_1LDSB0_EPS0_GRVW4_LPA4_LPB4_PGR2_PLR9_SRVW2_TT1_32_WG64_4_1_WGM15
    SolutionIndex: 27
    SolutionNameMin: Cijk_Alik_Bljk_SB_GB_MT64x32x32_MI16x16x4x1_SN_1LDSB0_EPS1_GRVW4_LPA4_LPB4_PGR1_PLR9_SRVW2_TT2_16_WG32_8_1_WGM15
    SolutionIndex: 28
    SolutionNameMin: Cijk_Alik_Bljk_SB_GB_MT32x32x32_MI16x16x4x1_SN_1LDSB0_EPS0_GRVW4_LPA4_LPB4_PGR2_PLR9_SRVW2_TT1_16_WG32_8_1_WGM15
    SolutionIndex: 29
    SolutionNameMin: Cijk_Alik_Bljk_SB_GB_MT64x64x16_MI32x32x2x1_SN_1LDSB1_EPS1_GRVW1_LPA2_LPB2_PGR1_PLR9_SRVW2_TT1_32_WG64_4_1_WGM1
    SolutionIndex: 30
    SolutionNameMin: Cijk_Alik_Bljk_SB_GB_MT64x128x16_MI32x32x2x1_SN_1LDSB1_EPS1_GRVW1_LPA2_LPB2_PGR1_PLR9_SRVW2_TT1_64_WG64_4_1_WGM1
    SolutionIndex: 31
    SolutionNameMin: Cijk_Alik_Bljk_SB_GB_MT64x128x16_MI32x32x2x1_SN_1LDSB1_EPS0_GRVW1_LPA2_LPB2_PGR2_PLR9_SRVW2_TT1_64_WG64_4_1_WGM1
    SolutionIndex: 32
    SolutionNameMin: Cijk_Alik_Bljk_SB_GB_MT32x32x32_MI16x16x4x1_SN_1LDSB1_EPS1_GRVW1_LPA2_LPB2_PGR1_PLR9_SRVW2_TT1_16_WG32_8_1_WGM1
    SolutionIndex: 33
    SolutionNameMin: Cijk_Alik_Bljk_SB_GB_MT32x64x32_MI16x16x4x1_SN_1LDSB1_EPS1_GRVW1_LPA2_LPB2_PGR1_PLR9_SRVW2_TT1_32_WG32_8_1_WGM1
    SolutionIndex: 34
    SolutionNameMin: Cijk_Alik_Bljk_SB_GB_MT64x32x32_MI16x16x4x1_SN_1LDSB1_EPS1_GRVW1_LPA2_LPB2_PGR1_PLR9_SRVW2_TT2_16_WG32_8_1_WGM1
    SolutionIndex: 35
    SolutionNameMin: Cijk_Alik_Bljk_SB_GB_MT64x64x32_MI32x32x2x1_SN_1LDSB1_EPS1_GRVW1_LPA2_LPB2_PGR1_PLR17_SRVW2_TT1_32_WG64_4_1_WGM1
    SolutionIndex: 36
    SolutionNameMin: Cijk_Alik_Bljk_SB_GB_MT64x128x32_MI32x32x2x1_SN_1LDSB1_EPS1_GRVW1_LPA2_LPB2_PGR1_PLR17_SRVW2_TT1_64_WG64_4_1_WGM1
    SolutionIndex: 37
    SolutionNameMin: Cijk_Alik_Bljk_SB_GB_MT64x64x16_MI32x32x2x1_SN_1LDSB1_EPS1_GRVW2_LPA2_LPB2_PGR1_PLR9_SRVW2_TT1_32_WG64_4_1_WGM1
    SolutionIndex: 38
    SolutionNameMin: Cijk_Alik_Bljk_SB_GB_MT64x128x16_MI32x32x2x1_SN_1LDSB1_EPS0_GRVW2_LPA2_LPB2_PGR2_PLR9_SRVW2_TT1_64_WG64_4_1_WGM1
    SolutionIndex: 39
    SolutionNameMin: Cijk_Alik_Bljk_SB_GB_MT32x32x32_MI16x16x4x1_SN_1LDSB1_EPS1_GRVW2_LPA2_LPB2_PGR1_PLR9_SRVW2_TT1_16_WG32_8_1_WGM1
    SolutionIndex: 40
    SolutionNameMin: Cijk_Alik_Bljk_SB_GB_MT64x32x32_MI16x16x4x1_SN_1LDSB1_EPS1_GRVW2_LPA2_LPB2_PGR1_PLR9_SRVW2_TT2_16_WG32_8_1_WGM1
    SolutionIndex: 41
    SolutionNameMin: Cijk_Alik_Bljk_SB_GB_MT64x32x32_MI16x16x4x1_SN_1LDSB1_EPS0_GRVW2_LPA2_LPB2_PGR2_PLR9_SRVW2_TT2_16_WG32_8_1_WGM1
    SolutionIndex: 42
    SolutionNameMin: Cijk_Alik_Bljk_SB_GB_MT64x64x32_MI32x32x2x1_SN_1LDSB1_EPS1_GRVW2_LPA2_LPB2_PGR1_PLR17_SRVW2_TT1_32_WG64_4_1_WGM1
    SolutionIndex: 43
    SolutionNameMin: Cijk_Alik_Bljk_SB_GB_MT64x32x16_MI16x16x4x1_SN_1LDSB1_EPS1_GRVW4_LPA4_LPB4_PGR1_PLR5_SRVW2_TT2_16_WG32_8_1_WGM1
    SolutionIndex: 44
    SolutionNameMin: Cijk_Alik_Bljk_SB_GB_MT64x32x16_MI16x16x4x1_SN_1LDSB1_EPS0_GRVW4_LPA4_LPB4_PGR2_PLR5_SRVW2_TT2_16_WG32_8_1_WGM1
    SolutionIndex: 45
    SolutionNameMin: Cijk_Alik_Bljk_SB_GB_MT64x64x16_MI32x32x2x1_SN_1LDSB1_EPS1_GRVW4_LPA4_LPB4_PGR1_PLR9_SRVW2_TT1_32_WG64_4_1_WGM1
    SolutionIndex: 46
    SolutionNameMin: Cijk_Alik_Bljk_SB_GB_MT64x128x16_MI32x32x2x1_SN_1LDSB1_EPS1_GRVW4_LPA4_LPB4_PGR1_PLR9_SRVW2_TT1_64_WG64_4_1_WGM1
    SolutionIndex: 47
    SolutionNameMin: Cijk_Alik_Bljk_SB_GB_MT64x128x16_MI32x32x2x1_SN_1LDSB1_EPS0_GRVW4_LPA4_LPB4_PGR2_PLR9_SRVW2_TT1_64_WG64_4_1_WGM1
    SolutionIndex: 48
    SolutionNameMin: Cijk_Alik_Bljk_SB_GB_MT32x32x32_MI16x16x4x1_SN_1LDSB1_EPS1_GRVW4_LPA4_LPB4_PGR1_PLR9_SRVW2_TT1_16_WG32_8_1_WGM1
    SolutionIndex: 49
    SolutionNameMin: Cijk_Alik_Bljk_SB_GB_MT64x32x32_MI16x16x4x1_SN_1LDSB1_EPS1_GRVW4_LPA4_LPB4_PGR1_PLR9_SRVW2_TT2_16_WG32_8_1_WGM1
    SolutionIndex: 50
    SolutionNameMin: Cijk_Alik_Bljk_SB_GB_MT32x32x32_MI16x16x4x1_SN_1LDSB1_EPS0_GRVW4_LPA4_LPB4_PGR2_PLR9_SRVW2_TT1_16_WG32_8_1_WGM1
    SolutionIndex: 51
    SolutionNameMin: Cijk_Alik_Bljk_SB_GB_MT64x32x32_MI16x16x4x1_SN_1LDSB1_EPS0_GRVW4_LPA4_LPB4_PGR2_PLR9_SRVW2_TT2_16_WG32_8_1_WGM1
    SolutionIndex: 52
    SolutionNameMin: Cijk_Alik_Bljk_SB_GB_MT64x64x32_MI32x32x2x1_SN_1LDSB1_EPS1_GRVW4_LPA4_LPB4_PGR1_PLR17_SRVW2_TT1_32_WG64_4_1_WGM1
    SolutionIndex: 53
    SolutionNameMin: Cijk_Alik_Bljk_SB_GB_MT64x64x32_MI32x32x2x1_SN_1LDSB1_EPS0_GRVW4_LPA4_LPB4_PGR2_PLR17_SRVW2_TT1_32_WG64_4_1_WGM1
    SolutionIndex: 54
    SolutionNameMin: Cijk_Alik_Bljk_SB_GB_MT64x32x16_MI16x16x4x1_SN_1LDSB1_EPS1_GRVW1_LPA2_LPB2_PGR1_PLR5_SRVW2_TT2_16_WG32_8_1_WGM2
    SolutionIndex: 55
    SolutionNameMin: Cijk_Alik_Bljk_SB_GB_MT64x128x16_MI32x32x2x1_SN_1LDSB1_EPS1_GRVW1_LPA2_LPB2_PGR1_PLR9_SRVW2_TT1_64_WG64_4_1_WGM2
    SolutionIndex: 56
    SolutionNameMin: Cijk_Alik_Bljk_SB_GB_MT64x128x16_MI32x32x2x1_SN_1LDSB1_EPS0_GRVW1_LPA2_LPB2_PGR2_PLR9_SRVW2_TT1_64_WG64_4_1_WGM2
    SolutionIndex: 57
    SolutionNameMin: Cijk_Alik_Bljk_SB_GB_MT32x32x32_MI16x16x4x1_SN_1LDSB1_EPS1_GRVW1_LPA2_LPB2_PGR1_PLR9_SRVW2_TT1_16_WG32_8_1_WGM2
    SolutionIndex: 58
    SolutionNameMin: Cijk_Alik_Bljk_SB_GB_MT64x32x32_MI16x16x4x1_SN_1LDSB1_EPS1_GRVW1_LPA2_LPB2_PGR1_PLR9_SRVW2_TT2_16_WG32_8_1_WGM2
    SolutionIndex: 59
    SolutionNameMin: Cijk_Alik_Bljk_SB_GB_MT64x64x32_MI32x32x2x1_SN_1LDSB1_EPS1_GRVW1_LPA2_LPB2_PGR1_PLR17_SRVW2_TT1_32_WG64_4_1_WGM2
    SolutionIndex: 60
    SolutionNameMin: Cijk_Alik_Bljk_SB_GB_MT64x128x32_MI32x32x2x1_SN_1LDSB1_EPS1_GRVW1_LPA2_LPB2_PGR1_PLR17_SRVW2_TT1_64_WG64_4_1_WGM2
    SolutionIndex: 61
    SolutionNameMin: Cijk_Alik_Bljk_SB_GB_MT64x128x32_MI32x32x2x1_SN_1LDSB1_EPS0_GRVW1_LPA2_LPB2_PGR2_PLR17_SRVW2_TT1_64_WG64_4_1_WGM2
    SolutionIndex: 62
    SolutionNameMin: Cijk_Alik_Bljk_SB_GB_MT64x32x16_MI16x16x4x1_SN_1LDSB1_EPS1_GRVW2_LPA2_LPB2_PGR1_PLR5_SRVW2_TT2_16_WG32_8_1_WGM2
    SolutionIndex: 63
    SolutionNameMin: Cijk_Alik_Bljk_SB_GB_MT64x64x16_MI32x32x2x1_SN_1LDSB1_EPS1_GRVW2_LPA2_LPB2_PGR1_PLR9_SRVW2_TT1_32_WG64_4_1_WGM2
    SolutionIndex: 64
    SolutionNameMin: Cijk_Alik_Bljk_SB_GB_MT64x128x16_MI32x32x2x1_SN_1LDSB1_EPS0_GRVW2_LPA2_LPB2_PGR2_PLR9_SRVW2_TT1_64_WG64_4_1_WGM2
    SolutionIndex: 65
    SolutionNameMin: Cijk_Alik_Bljk_SB_GB_MT32x32x32_MI16x16x4x1_SN_1LDSB1_EPS1_GRVW2_LPA2_LPB2_PGR1_PLR9_SRVW2_TT1_16_WG32_8_1_WGM2
    SolutionIndex: 66
    SolutionNameMin: Cijk_Alik_Bljk_SB_GB_MT64x32x32_MI16x16x4x1_SN_1LDSB1_EPS1_GRVW2_LPA2_LPB2_PGR1_PLR9_SRVW2_TT2_16_WG32_8_1_WGM2
    SolutionIndex: 67
    SolutionNameMin: Cijk_Alik_Bljk_SB_GB_MT64x32x32_MI16x16x4x1_SN_1LDSB1_EPS0_GRVW2_LPA2_LPB2_PGR2_PLR9_SRVW2_TT2_16_WG32_8_1_WGM2
    SolutionIndex: 68
    SolutionNameMin: Cijk_Alik_Bljk_SB_GB_MT64x64x32_MI32x32x2x1_SN_1LDSB1_EPS1_GRVW2_LPA2_LPB2_PGR1_PLR17_SRVW2_TT1_32_WG64_4_1_WGM2
    SolutionIndex: 69
    SolutionNameMin: Cijk_Alik_Bljk_SB_GB_MT64x64x16_MI32x32x2x1_SN_1LDSB1_EPS1_GRVW4_LPA4_LPB4_PGR1_PLR9_SRVW2_TT1_32_WG64_4_1_WGM2
    SolutionIndex: 70
    SolutionNameMin: Cijk_Alik_Bljk_SB_GB_MT64x128x16_MI32x32x2x1_SN_1LDSB1_EPS1_GRVW4_LPA4_LPB4_PGR1_PLR9_SRVW2_TT1_64_WG64_4_1_WGM2
    SolutionIndex: 71
    SolutionNameMin: Cijk_Alik_Bljk_SB_GB_MT64x64x16_MI32x32x2x1_SN_1LDSB1_EPS0_GRVW4_LPA4_LPB4_PGR2_PLR9_SRVW2_TT1_32_WG64_4_1_WGM2
    SolutionIndex: 72
    SolutionNameMin: Cijk_Alik_Bljk_SB_GB_MT64x128x16_MI32x32x2x1_SN_1LDSB1_EPS0_GRVW4_LPA4_LPB4_PGR2_PLR9_SRVW2_TT1_64_WG64_4_1_WGM2
    SolutionIndex: 73
    SolutionNameMin: Cijk_Alik_Bljk_SB_GB_MT32x32x32_MI16x16x4x1_SN_1LDSB1_EPS1_GRVW4_LPA4_LPB4_PGR1_PLR9_SRVW2_TT1_16_WG32_8_1_WGM2
    SolutionIndex: 74
    SolutionNameMin: Cijk_Alik_Bljk_SB_GB_MT64x32x32_MI16x16x4x1_SN_1LDSB1_EPS1_GRVW4_LPA4_LPB4_PGR1_PLR9_SRVW2_TT2_16_WG32_8_1_WGM2
    SolutionIndex: 75
    SolutionNameMin: Cijk_Alik_Bljk_SB_GB_MT32x32x32_MI16x16x4x1_SN_1LDSB1_EPS0_GRVW4_LPA4_LPB4_PGR2_PLR9_SRVW2_TT1_16_WG32_8_1_WGM2
    SolutionIndex: 76
    SolutionNameMin: Cijk_Alik_Bljk_SB_GB_MT64x32x32_MI16x16x4x1_SN_1LDSB1_EPS0_GRVW4_LPA4_LPB4_PGR2_PLR9_SRVW2_TT2_16_WG32_8_1_WGM2
    SolutionIndex: 77
    SolutionNameMin: Cijk_Alik_Bljk_SB_GB_MT64x64x32_MI32x32x2x1_SN_1LDSB1_EPS1_GRVW4_LPA4_LPB4_PGR1_PLR17_SRVW2_TT1_32_WG64_4_1_WGM2
    SolutionIndex: 78
    SolutionNameMin: Cijk_Alik_Bljk_SB_GB_MT64x64x32_MI32x32x2x1_SN_1LDSB1_EPS0_GRVW4_LPA4_LPB4_PGR2_PLR17_SRVW2_TT1_32_WG64_4_1_WGM2
    SolutionIndex: 79
    SolutionNameMin: Cijk_Alik_Bljk_SB_GB_MT64x32x16_MI16x16x4x1_SN_1LDSB1_EPS1_GRVW1_LPA2_LPB2_PGR1_PLR5_SRVW2_TT2_16_WG32_8_1_WGM15
    SolutionIndex: 80
    SolutionNameMin: Cijk_Alik_Bljk_SB_GB_MT64x128x16_MI32x32x2x1_SN_1LDSB1_EPS1_GRVW1_LPA2_LPB2_PGR1_PLR9_SRVW2_TT1_64_WG64_4_1_WGM15
    SolutionIndex: 81
    SolutionNameMin: Cijk_Alik_Bljk_SB_GB_MT64x128x16_MI32x32x2x1_SN_1LDSB1_EPS0_GRVW1_LPA2_LPB2_PGR2_PLR9_SRVW2_TT1_64_WG64_4_1_WGM15
    SolutionIndex: 82
    SolutionNameMin: Cijk_Alik_Bljk_SB_GB_MT32x32x32_MI16x16x4x1_SN_1LDSB1_EPS1_GRVW1_LPA2_LPB2_PGR1_PLR9_SRVW2_TT1_16_WG32_8_1_WGM15
    SolutionIndex: 83
    SolutionNameMin: Cijk_Alik_Bljk_SB_GB_MT64x32x32_MI16x16x4x1_SN_1LDSB1_EPS1_GRVW1_LPA2_LPB2_PGR1_PLR9_SRVW2_TT2_16_WG32_8_1_WGM15
    SolutionIndex: 84
    SolutionNameMin: Cijk_Alik_Bljk_SB_GB_MT64x64x32_MI32x32x2x1_SN_1LDSB1_EPS1_GRVW1_LPA2_LPB2_PGR1_PLR17_SRVW2_TT1_32_WG64_4_1_WGM15
    SolutionIndex: 85
    SolutionNameMin: Cijk_Alik_Bljk_SB_GB_MT64x128x32_MI32x32x2x1_SN_1LDSB1_EPS1_GRVW1_LPA2_LPB2_PGR1_PLR17_SRVW2_TT1_64_WG64_4_1_WGM15
    SolutionIndex: 86
    SolutionNameMin: Cijk_Alik_Bljk_SB_GB_MT64x128x32_MI32x32x2x1_SN_1LDSB1_EPS0_GRVW1_LPA2_LPB2_PGR2_PLR17_SRVW2_TT1_64_WG64_4_1_WGM15
    SolutionIndex: 87
    SolutionNameMin: Cijk_Alik_Bljk_SB_GB_MT64x128x16_MI32x32x2x1_SN_1LDSB1_EPS0_GRVW2_LPA2_LPB2_PGR2_PLR9_SRVW2_TT1_64_WG64_4_1_WGM15
    SolutionIndex: 88
    SolutionNameMin: Cijk_Alik_Bljk_SB_GB_MT64x32x32_MI16x16x4x1_SN_1LDSB1_EPS1_GRVW2_LPA2_LPB2_PGR1_PLR9_SRVW2_TT2_16_WG32_8_1_WGM15
    SolutionIndex: 89
    SolutionNameMin: Cijk_Alik_Bljk_SB_GB_MT64x32x32_MI16x16x4x1_SN_1LDSB1_EPS0_GRVW2_LPA2_LPB2_PGR2_PLR9_SRVW2_TT2_16_WG32_8_1_WGM15
    SolutionIndex: 90
    SolutionNameMin: Cijk_Alik_Bljk_SB_GB_MT64x64x32_MI32x32x2x1_SN_1LDSB1_EPS1_GRVW2_LPA2_LPB2_PGR1_PLR17_SRVW2_TT1_32_WG64_4_1_WGM15
    SolutionIndex: 91
    SolutionNameMin: Cijk_Alik_Bljk_SB_GB_MT64x128x32_MI32x32x2x1_SN_1LDSB1_EPS1_GRVW2_LPA2_LPB2_PGR1_PLR17_SRVW2_TT1_64_WG64_4_1_WGM15
    SolutionIndex: 92
    SolutionNameMin: Cijk_Alik_Bljk_SB_GB_MT64x32x16_MI16x16x4x1_SN_1LDSB1_EPS0_GRVW4_LPA4_LPB4_PGR2_PLR5_SRVW2_TT2_16_WG32_8_1_WGM15
    SolutionIndex: 93
    SolutionNameMin: Cijk_Alik_Bljk_SB_GB_MT64x64x16_MI32x32x2x1_SN_1LDSB1_EPS1_GRVW4_LPA4_LPB4_PGR1_PLR9_SRVW2_TT1_32_WG64_4_1_WGM15
    SolutionIndex: 94
    SolutionNameMin: Cijk_Alik_Bljk_SB_GB_MT64x128x16_MI32x32x2x1_SN_1LDSB1_EPS1_GRVW4_LPA4_LPB4_PGR1_PLR9_SRVW2_TT1_64_WG64_4_1_WGM15
    SolutionIndex: 95
    SolutionNameMin: Cijk_Alik_Bljk_SB_GB_MT64x64x16_MI32x32x2x1_SN_1LDSB1_EPS0_GRVW4_LPA4_LPB4_PGR2_PLR9_SRVW2_TT1_32_WG64_4_1_WGM15
    SolutionIndex: 96
    SolutionNameMin: Cijk_Alik_Bljk_SB_GB_MT32x32x32_MI16x16x4x1_SN_1LDSB1_EPS1_GRVW4_LPA4_LPB4_PGR1_PLR9_SRVW2_TT1_16_WG32_8_1_WGM15
    SolutionIndex: 97
    SolutionNameMin: Cijk_Alik_Bljk_SB_GB_MT64x32x32_MI16x16x4x1_SN_1LDSB1_EPS1_GRVW4_LPA4_LPB4_PGR1_PLR9_SRVW2_TT2_16_WG32_8_1_WGM15
    SolutionIndex: 98
    SolutionNameMin: Cijk_Alik_Bljk_SB_GB_MT32x32x32_MI16x16x4x1_SN_1LDSB1_EPS0_GRVW4_LPA4_LPB4_PGR2_PLR9_SRVW2_TT1_16_WG32_8_1_WGM15
    SolutionIndex: 99
    SolutionNameMin: Cijk_Alik_Bljk_SB_GB_MT64x32x32_MI16x16x4x1_SN_1LDSB1_EPS0_GRVW4_LPA4_LPB4_PGR2_PLR9_SRVW2_TT2_16_WG32_8_1_WGM15
    SolutionIndex: 100
    SolutionNameMin: Cijk_Alik_Bljk_SB_GB_MT64x64x32_MI32x32x2x1_SN_1LDSB1_EPS1_GRVW4_LPA4_LPB4_PGR1_PLR17_SRVW2_TT1_32_WG64_4_1_WGM15
    SolutionIndex: 101
    SolutionNameMin: Cijk_Alik_Bljk_SB_GB_MT64x64x32_MI32x32x2x1_SN_1LDSB1_EPS0_GRVW4_LPA4_LPB4_PGR2_PLR17_SRVW2_TT1_32_WG64_4_1_WGM15
    SolutionIndex: 102
    SolutionNameMin: Cijk_Alik_Bljk_SB_GB_MT32x32x8_MI32x32x2x1_SN_1LDSB0_EPS1_GRVW1_LPA2_LPB2_PGR1_PLR5_SRVW2_TT1_32_WG32_2_1_WGM1
    SolutionIndex: 103
    SolutionNameMin: Cijk_Alik_Bljk_SB_GB_MT16x16x16_MI16x16x4x1_SN_1LDSB0_EPS1_GRVW1_LPA2_LPB2_PGR1_PLR5_SRVW2_TT1_16_WG16_4_1_WGM1
    SolutionIndex: 104
    SolutionNameMin: Cijk_Alik_Bljk_SB_GB_MT16x16x16_MI16x16x4x1_SN_1LDSB0_EPS0_GRVW1_LPA2_LPB2_PGR2_PLR5_SRVW2_TT1_16_WG16_4_1_WGM1
    SolutionIndex: 105
    SolutionNameMin: Cijk_Alik_Bljk_SB_GB_MT16x16x16_MI16x16x4x1_SN_1LDSB0_EPS0_GRVW2_LPA2_LPB2_PGR2_PLR5_SRVW2_TT1_16_WG16_4_1_WGM1
    SolutionIndex: 106
    SolutionNameMin: Cijk_Alik_Bljk_SB_GB_MT16x16x16_MI16x16x4x1_SN_1LDSB0_EPS1_GRVW4_LPA4_LPB4_PGR1_PLR5_SRVW2_TT1_16_WG16_4_1_WGM1
    SolutionIndex: 107
    SolutionNameMin: Cijk_Alik_Bljk_SB_GB_MT16x16x16_MI16x16x4x1_SN_1LDSB0_EPS0_GRVW4_LPA4_LPB4_PGR2_PLR5_SRVW2_TT1_16_WG16_4_1_WGM1
    SolutionIndex: 108
    SolutionNameMin: Cijk_Alik_Bljk_SB_GB_MT16x16x16_MI16x16x4x1_SN_1LDSB0_EPS1_GRVW4_LPA4_LPB4_PGR1_PLR5_SRVW2_TT1_16_WG16_4_1_WGM15
    SolutionIndex: 109
    SolutionNameMin: Cijk_Alik_Bljk_SB_GB_MT32x32x16_MI32x32x2x1_SN_1LDSB1_EPS1_GRVW1_LPA2_LPB2_PGR1_PLR9_SRVW2_TT1_32_WG32_2_1_WGM1
    SolutionIndex: 110
    SolutionNameMin: Cijk_Alik_Bljk_SB_GB_MT32x32x16_MI32x32x2x1_SN_1LDSB1_EPS1_GRVW2_LPA2_LPB2_PGR1_PLR9_SRVW2_TT1_32_WG32_2_1_WGM1
    SolutionIndex: 111
    SolutionNameMin: Cijk_Alik_Bljk_SB_GB_MT32x32x16_MI32x32x2x1_SN_1LDSB1_EPS1_GRVW1_LPA2_LPB2_PGR1_PLR9_SRVW2_TT1_32_WG32_2_1_WGM2
    SolutionIndex: 112
    SolutionNameMin: Cijk_Alik_Bljk_SB_GB_MT32x32x16_MI32x32x2x1_SN_1LDSB1_EPS1_GRVW4_LPA4_LPB4_PGR1_PLR9_SRVW2_TT1_32_WG32_2_1_WGM2
    SolutionIndex: 113
    SolutionNameMin: Cijk_Alik_Bljk_SB_GB_MT96x96x32_MI16x16x4x1_SN_1LDSB1_EPS0_GRVW1_LPA2_LPB2_PGR2_PLR9_SRVW0_TT3_48_WG32_8_1_WGM1
    SolutionIndex: 114
    SolutionNameMin: Cijk_Alik_Bljk_SB_GB_MT96x96x32_MI16x16x4x1_SN_1LDSB1_EPS0_GRVW2_LPA2_LPB2_PGR2_PLR9_SRVW0_TT3_48_WG32_8_1_WGM1
    SolutionIndex: 115
    SolutionNameMin: Cijk_Alik_Bljk_SB_GB_MT96x96x32_MI16x16x4x1_SN_1LDSB1_EPS1_GRVW4_LPA4_LPB4_PGR1_PLR9_SRVW0_TT3_48_WG32_8_1_WGM1
    SolutionIndex: 116
    SolutionNameMin: Cijk_Alik_Bljk_SB_GB_MT96x96x32_MI16x16x4x1_SN_1LDSB1_EPS0_GRVW1_LPA2_LPB2_PGR2_PLR9_SRVW0_TT3_48_WG32_8_1_WGM2
    SolutionIndex: 117
    SolutionNameMin: Cijk_Alik_Bljk_SB_GB_MT96x96x32_MI16x16x4x1_SN_1LDSB1_EPS0_GRVW1_LPA2_LPB2_PGR2_PLR9_SRVW0_TT3_48_WG32_8_1_WGM15
- - - [192, 192, 1000, 32, 192, 192, 32, 32]
    - [84, 11062.0]
  - - [1536, 1536, 168, 32, 1536, 1536, 32, 32]
    - [56, 12996.0]
  - - [1536, 32, 168, 1536, 1536, 1536, 1536, 1536]
    - [8, 12796.0]
  - - [32, 1536, 168, 32, 32, 32, 32, 32]
    - [33, 7043.0]
  - - [384, 384, 1024, 384, 384, 384, 384, 384]
    - [30, 26365.0]
  - - [1, 1, 1000, 1, 1, 1, 1, 1]
    - [102, 0.0]
  - - [2, 2, 1000, 2, 2, 2, 2, 2]
    - [103, 2.0]
  - - [3, 3, 1000, 3, 3, 3, 3, 3]
    - [104, 6.0]
  - - [4, 4, 1000, 4, 4, 4, 4, 4]
    - [103, 15.0]
  - - [5, 5, 1000, 5, 5, 5, 5, 5]
    - [103, 28.0]
  - - [6, 6, 1000, 6, 6, 6, 6, 6]
    - [107, 49.0]
  - - [7, 7, 1000, 7, 7, 7, 7, 7]
    - [106, 77.0]
  - - [8, 8, 1000, 8, 8, 8, 8, 8]
    - [104, 114.0]
  - - [9, 9, 1000, 9, 9, 9, 9, 9]
    - [103, 157.0]
  - - [10, 10, 1000, 10, 10, 10, 10, 10]
    - [104, 216.0]
  - - [11, 11, 1000, 11, 11, 11, 11, 11]
    - [105, 282.0]
  - - [12, 12, 1000, 12, 12, 12, 12, 12]
    - [106, 366.0]
  - - [13, 13, 1000, 13, 13, 13, 13, 13]
    - [103, 458.0]
  - - [14, 14, 1000, 14, 14, 14, 14, 14]
    - [103, 581.0]
  - - [15, 15, 1000, 15, 15, 15, 15, 15]
    - [103, 692.0]
  - - [16, 16, 1000, 16, 16, 16, 16, 16]
    - [108, 985.0]
  - - [17, 17, 1000, 17, 17, 17, 17, 17]
    - [112, 714.0]
  - - [18, 18, 1000, 18, 18, 18, 18, 18]
    - [109, 848.0]
  - - [19, 19, 1000, 19, 19, 19, 19, 19]
    - [111, 922.0]
  - - [20, 20, 1000, 20, 20, 20, 20, 20]
    - [110, 1053.0]
  - - [21, 21, 1000, 21, 21, 21, 21, 21]
    - [109, 1158.0]
  - - [22, 22, 1000, 22, 22, 22, 22, 22]
    - [111, 1305.0]
  - - [23, 23, 1000, 23, 23, 23, 23, 23]
    - [82, 1421.0]
  - - [24, 24, 1000, 24, 24, 24, 24, 24]
    - [32, 1630.0]
  - - [25, 25, 1000, 25, 25, 25, 25, 25]
    - [32, 1776.0]
  - - [26, 26, 1000, 26, 26, 26, 26, 26]
    - [32, 1997.0]
  - - [27, 27, 1000, 27, 27, 27, 27, 27]
    - [32, 2177.0]
  - - [28, 28, 1000, 28, 28, 28, 28, 28]
    - [57, 2450.0]
  - - [29, 29, 1000, 29, 29, 29, 29, 29]
    - [82, 2541.0]
  - - [30, 30, 1000, 30, 30, 30, 30, 30]
    - [82, 2812.0]
  - - [31, 31, 1000, 31, 31, 31, 31, 31]
    - [32, 2865.0]
  - - [32, 32, 1000, 32, 32, 32, 32, 32]
    - [112, 3864.0]
  - - [33, 33, 1000, 33, 33, 33, 33, 33]
    - [59, 1856.0]
  - - [34, 34, 1000, 34, 34, 34, 34, 34]
    - [59, 2014.0]
  - - [35, 35, 1000, 35, 35, 35, 35, 35]
    - [35, 2152.0]
  - - [36, 36, 1000, 36, 36, 36, 36, 36]
    - [35, 2296.0]
  - - [37, 37, 1000, 37, 37, 37, 37, 37]
    - [84, 2454.0]
  - - [38, 38, 1000, 38, 38, 38, 38, 38]
    - [35, 2628.0]
  - - [39, 39, 1000, 39, 39, 39, 39, 39]
    - [59, 2819.0]
  - - [40, 40, 1000, 40, 40, 40, 40, 40]
    - [54, 2996.0]
  - - [41, 41, 1000, 41, 41, 41, 41, 41]
    - [84, 3121.0]
  - - [42, 42, 1000, 42, 42, 42, 42, 42]
    - [84, 3284.0]
  - - [43, 43, 1000, 43, 43, 43, 43, 43]
    - [35, 3451.0]
  - - [44, 44, 1000, 44, 44, 44, 44, 44]
    - [59, 3597.0]
  - - [45, 45, 1000, 45, 45, 45, 45, 45]
    - [59, 3759.0]
  - - [46, 46, 1000, 46, 46, 46, 46, 46]
    - [84, 3963.0]
  - - [47, 47, 1000, 47, 47, 47, 47, 47]
    - [84, 4043.0]
  - - [48, 48, 1000, 48, 48, 48, 48, 48]
    - [62, 5158.0]
  - - [49, 49, 1000, 49, 49, 49, 49, 49]
    - [59, 4351.0]
  - - [50, 50, 1000, 50, 50, 50, 50, 50]
    - [59, 4516.0]
  - - [51, 51, 1000, 51, 51, 51, 51, 51]
    - [59, 4671.0]
  - - [52, 52, 1000, 52, 52, 52, 52, 52]
    - [58, 4909.0]
  - - [53, 53, 1000, 53, 53, 53, 53, 53]
    - [35, 5030.0]
  - - [54, 54, 1000, 54, 54, 54, 54, 54]
    - [59, 5249.0]
  - - [55, 55, 1000, 55, 55, 55, 55, 55]
    - [59, 5444.0]
  - - [56, 56, 1000, 56, 56, 56, 56, 56]
    - [34, 5917.0]
  - - [57, 57, 1000, 57, 57, 57, 57, 57]
    - [59, 5816.0]
  - - [58, 58, 1000, 58, 58, 58, 58, 58]
    - [84, 6037.0]
  - - [59, 59, 1000, 59, 59, 59, 59, 59]
    - [35, 6246.0]
  - - [60, 60, 1000, 60, 60, 60, 60, 60]
    - [58, 6634.0]
  - - [61, 61, 1000, 61, 61, 61, 61, 61]
    - [34, 6645.0]
  - - [62, 62, 1000, 62, 62, 62, 62, 62]
    - [83, 6928.0]
  - - [63, 63, 1000, 63, 63, 63, 63, 63]
    - [83, 7087.0]
  - - [64, 64, 1000, 64, 64, 64, 64, 64]
    - [42, 8601.0]
  - - [65, 65, 1000, 65, 65, 65, 65, 65]
    - [32, 3964.0]
  - - [66, 66, 1000, 66, 66, 66, 66, 66]
    - [117, 4248.0]
  - - [67, 67, 1000, 67, 67, 67, 67, 67]
    - [113, 4392.0]
  - - [68, 68, 1000, 68, 68, 68, 68, 68]
    - [20, 4549.0]
  - - [69, 69, 1000, 69, 69, 69, 69, 69]
    - [116, 4624.0]
  - - [70, 70, 1000, 70, 70, 70, 70, 70]
    - [116, 4785.0]
  - - [71, 71, 1000, 71, 71, 71, 71, 71]
    - [113, 4938.0]
  - - [72, 72, 1000, 72, 72, 72, 72, 72]
    - [79, 5774.0]
  - - [73, 73, 1000, 73, 73, 73, 73, 73]
    - [20, 5081.0]
  - - [74, 74, 1000, 74, 74, 74, 74, 74]
    - [20, 5326.0]
  - - [75, 75, 1000, 75, 75, 75, 75, 75]
    - [117, 5316.0]
  - - [76, 76, 1000, 76, 76, 76, 76, 76]
    - [20, 5844.0]
  - - [77, 77, 1000, 77, 77, 77, 77, 77]
    - [20, 5650.0]
  - - [78, 78, 1000, 78, 78, 78, 78, 78]
    - [20, 5914.0]
  - - [79, 79, 1000, 79, 79, 79, 79, 79]
    - [113, 6042.0]
  - - [80, 80, 1000, 80, 80, 80, 80, 80]
    - [92, 9343.0]
  - - [81, 81, 1000, 81, 81, 81, 81, 81]
    - [114, 6128.0]
  - - [82, 82, 1000, 82, 82, 82, 82, 82]
    - [83, 6283.0]
  - - [83, 83, 1000, 83, 83, 83, 83, 83]
    - [83, 6404.0]
  - - [84, 84, 1000, 84, 84, 84, 84, 84]
    - [83, 6854.0]
  - - [85, 85, 1000, 85, 85, 85, 85, 85]
    - [83, 6716.0]
  - - [86, 86, 1000, 86, 86, 86, 86, 86]
    - [89, 6938.0]
  - - [87, 87, 1000, 87, 87, 87, 87, 87]
    - [83, 7084.0]
  - - [88, 88, 1000, 88, 88, 88, 88, 88]
    - [82, 7887.0]
  - - [89, 89, 1000, 89, 89, 89, 89, 89]
    - [83, 7380.0]
  - - [90, 90, 1000, 90, 90, 90, 90, 90]
    - [83, 7670.0]
  - - [91, 91, 1000, 91, 91, 91, 91, 91]
    - [83, 7759.0]
  - - [92, 92, 1000, 92, 92, 92, 92, 92]
    - [83, 8312.0]
  - - [93, 93, 1000, 93, 93, 93, 93, 93]
    - [83, 7961.0]
  - - [94, 94, 1000, 94, 94, 94, 94, 94]
    - [83, 8386.0]
  - - [95, 95, 1000, 95, 95, 95, 95, 95]
    - [83, 8499.0]
  - - [96, 96, 1000, 96, 96, 96, 96, 96]
    - [115, 13357.0]
  - - [97, 97, 1000, 97, 97, 97, 97, 97]
    - [84, 7626.0]
  - - [98, 98, 1000, 98, 98, 98, 98, 98]
    - [84, 7998.0]
  - - [99, 99, 1000, 99, 99, 99, 99, 99]
    - [84, 8064.0]
  - - [100, 100, 1000, 100, 100, 100, 100, 100]
    - [84, 8675.0]
  - - [101, 101, 1000, 101, 101, 101, 101, 101]
    - [59, 8440.0]
  - - [102, 102, 1000, 102, 102, 102, 102, 102]
    - [59, 8670.0]
  - - [103, 103, 1000, 103, 103, 103, 103, 103]
    - [84, 8801.0]
  - - [104, 104, 1000, 104, 104, 104, 104, 104]
    - [95, 10339.0]
  - - [105, 105, 1000, 105, 105, 105, 105, 105]
    - [59, 9234.0]
  - - [106, 106, 1000, 106, 106, 106, 106, 106]
    - [35, 9531.0]
  - - [107, 107, 1000, 107, 107, 107, 107, 107]
    - [35, 9625.0]
  - - [108, 108, 1000, 108, 108, 108, 108, 108]
    - [71, 10238.0]
  - - [109, 109, 1000, 109, 109, 109, 109, 109]
    - [35, 10055.0]
  - - [110, 110, 1000, 110, 110, 110, 110, 110]
    - [35, 10470.0]
  - - [111, 111, 1000, 111, 111, 111, 111, 111]
    - [35, 10488.0]
  - - [112, 112, 1000, 112, 112, 112, 112, 112]
    - [95, 14562.0]
  - - [113, 113, 1000, 113, 113, 113, 113, 113]
    - [59, 10826.0]
  - - [114, 114, 1000, 114, 114, 114, 114, 114]
    - [35, 11149.0]
  - - [115, 115, 1000, 115, 115, 115, 115, 115]
    - [36, 11242.0]
  - - [116, 116, 1000, 116, 116, 116, 116, 116]
    - [35, 11875.0]
  - - [117, 117, 1000, 117, 117, 117, 117, 117]
    - [36, 11721.0]
  - - [118, 118, 1000, 118, 118, 118, 118, 118]
    - [84, 11975.0]
  - - [119, 119, 1000, 119, 119, 119, 119, 119]
    - [36, 12058.0]
  - - [120, 120, 1000, 120, 120, 120, 120, 120]
    - [84, 12789.0]
  - - [121, 121, 1000, 121, 121, 121, 121, 121]
    - [61, 12309.0]
  - - [122, 122, 1000, 122, 122, 122, 122, 122]
    - [61, 12795.0]
  - - [123, 123, 1000, 123, 123, 123, 123, 123]
    - [86, 12980.0]
  - - [124, 124, 1000, 124, 124, 124, 124, 124]
    - [36, 13285.0]
  - - [125, 125, 1000, 125, 125, 125, 125, 125]
    - [36, 13297.0]
  - - [126, 126, 1000, 126, 126, 126, 126, 126]
    - [86, 13436.0]
  - - [127, 127, 1000, 127, 127, 127, 127, 127]
    - [61, 13620.0]
  - - [128, 128, 1000, 128, 128, 128, 128, 128]
    - [100, 16192.0]
  - - [129, 129, 1000, 129, 129, 129, 129, 129]
    - [59, 8372.0]
  - - [130, 130, 1000, 130, 130, 130, 130, 130]
    - [35, 8631.0]
  - - [131, 131, 1000, 131, 131, 131, 131, 131]
    - [35, 8730.0]
  - - [132, 132, 1000, 132, 132, 132, 132, 132]
    - [95, 9162.0]
  - - [133, 133, 1000, 133, 133, 133, 133, 133]
    - [84, 9046.0]
  - - [134, 134, 1000, 134, 134, 134, 134, 134]
    - [95, 9309.0]
  - - [135, 135, 1000, 135, 135, 135, 135, 135]
    - [35, 9261.0]
  - - [136, 136, 1000, 136, 136, 136, 136, 136]
    - [95, 10398.0]
  - - [137, 137, 1000, 137, 137, 137, 137, 137]
    - [35, 9490.0]
  - - [138, 138, 1000, 138, 138, 138, 138, 138]
    - [71, 9925.0]
  - - [139, 139, 1000, 139, 139, 139, 139, 139]
    - [35, 9906.0]
  - - [140, 140, 1000, 140, 140, 140, 140, 140]
    - [71, 10709.0]
  - - [141, 141, 1000, 141, 141, 141, 141, 141]
    - [71, 10243.0]
  - - [142, 142, 1000, 142, 142, 142, 142, 142]
    - [95, 10630.0]
  - - [143, 143, 1000, 143, 143, 143, 143, 143]
    - [35, 10525.0]
  - - [144, 144, 1000, 144, 144, 144, 144, 144]
    - [44, 14523.0]
  - - [145, 145, 1000, 145, 145, 145, 145, 145]
    - [35, 10722.0]
  - - [146, 146, 1000, 146, 146, 146, 146, 146]
    - [59, 10946.0]
  - - [147, 147, 1000, 147, 147, 147, 147, 147]
    - [59, 10941.0]
  - - [148, 148, 1000, 148, 148, 148, 148, 148]
    - [59, 11470.0]
  - - [149, 149, 1000, 149, 149, 149, 149, 149]
    - [35, 11319.0]
  - - [150, 150, 1000, 150, 150, 150, 150, 150]
    - [84, 11612.0]
  - - [32, 32, 8, 32, 32, 32, 32, 32]
    - [50, 70.0]
  - - [32, 32, 8, 64, 32, 32, 64, 64]
    - [14, 115.0]
  - - [32, 32, 8, 128, 32, 32, 128, 128]
    - [2, 190.0]
  - - [32, 32, 8, 256, 32, 32, 256, 256]
    - [98, 316.0]
  - - [32, 32, 8, 512, 32, 32, 512, 512]
    - [75, 437.0]
  - - [32, 32, 8, 1024, 32, 32, 1024, 1024]
    - [7, 535.0]
  - - [32, 32, 8, 2048, 32, 32, 2048, 2048]
    - [18, 634.0]
  - - [32, 64, 8, 32, 32, 32, 32, 32]
    - [50, 115.0]
  - - [32, 64, 8, 64, 32, 32, 64, 64]
    - [16, 215.0]
  - - [32, 64, 8, 128, 32, 32, 128, 128]
    - [18, 364.0]
  - - [32, 64, 8, 256, 32, 32, 256, 256]
    - [18, 603.0]
  - - [32, 64, 8, 512, 32, 32, 512, 512]
    - [98, 853.0]
  - - [32, 64, 8, 1024, 32, 32, 1024, 1024]
    - [28, 1098.0]
  - - [32, 64, 8, 2048, 32, 32, 2048, 2048]
    - [18, 1283.0]
  - - [32, 128, 8, 32, 32, 32, 32, 32]
    - [98, 226.0]
  - - [32, 128, 8, 64, 32, 32, 64, 64]
    - [16, 416.0]
  - - [32, 128, 8, 128, 32, 32, 128, 128]
    - [98, 708.0]
  - - [32, 128, 8, 256, 32, 32, 256, 256]
    - [98, 1192.0]
  - - [32, 128, 8, 512, 32, 32, 512, 512]
    - [7, 1691.0]
  - - [32, 128, 8, 1024, 32, 32, 1024, 1024]
    - [7, 2267.0]
  - - [32, 128, 8, 2048, 32, 32, 2048, 2048]
    - [18, 2689.0]
  - - [32, 256, 8, 32, 32, 32, 32, 32]
    - [48, 460.0]
  - - [32, 256, 8, 64, 32, 32, 64, 64]
    - [16, 794.0]
  - - [32, 256, 8, 128, 32, 32, 128, 128]
    - [50, 1498.0]
  - - [32, 256, 8, 256, 32, 32, 256, 256]
    - [18, 2330.0]
  - - [32, 256, 8, 512, 32, 32, 512, 512]
    - [98, 3410.0]
  - - [32, 256, 8, 1024, 32, 32, 1024, 1024]
    - [18, 4462.0]
  - - [32, 256, 8, 2048, 32, 32, 2048, 2048]
    - [7, 5377.0]
  - - [32, 512, 8, 32, 32, 32, 32, 32]
    - [3, 989.0]
  - - [32, 512, 8, 64, 32, 32, 64, 64]
    - [15, 1719.0]
  - - [32, 512, 8, 128, 32, 32, 128, 128]
    - [28, 2873.0]
  - - [32, 512, 8, 256, 32, 32, 256, 256]
    - [15, 4072.0]
  - - [32, 512, 8, 512, 32, 32, 512, 512]
    - [7, 5949.0]
  - - [32, 512, 8, 1024, 32, 32, 1024, 1024]
    - [75, 6820.0]
  - - [32, 512, 8, 2048, 32, 32, 2048, 2048]
    - [3, 7840.0]
  - - [32, 1024, 8, 32, 32, 32, 32, 32]
    - [82, 1777.0]
  - - [32, 1024, 8, 64, 32, 32, 64, 64]
    - [73, 2913.0]
  - - [32, 1024, 8, 128, 32, 32, 128, 128]
    - [48, 4609.0]
  - - [32, 1024, 8, 256, 32, 32, 256, 256]
    - [50, 6453.0]
  - - [32, 1024, 8, 512, 32, 32, 512, 512]
    - [39, 8066.0]
  - - [32, 1024, 8, 1024, 32, 32, 1024, 1024]
    - [10, 8948.0]
  - - [32, 1024, 8, 2048, 32, 32, 2048, 2048]
    - [50, 9913.0]
  - - [32, 2048, 8, 32, 32, 32, 32, 32]
    - [50, 2996.0]
  - - [32, 2048, 8, 64, 32, 32, 64, 64]
    - [82, 4510.0]
  - - [32, 2048, 8, 128, 32, 32, 128, 128]
    - [73, 6404.0]
  - - [32, 2048, 8, 256, 32, 32, 256, 256]
    - [48, 8265.0]
  - - [32, 2048, 8, 512, 32, 32, 512, 512]
    - [0, 9020.0]
  - - [32, 2048, 8, 1024, 32, 32, 1024, 1024]
    - [73, 9913.0]
  - - [32, 2048, 8, 2048, 32, 32, 2048, 2048]
    - [65, 10130.0]
  - - [64, 32, 8, 32, 64, 64, 32, 32]
    - [48, 115.0]
  - - [64, 32, 8, 64, 64, 64, 64, 64]
    - [16, 208.0]
  - - [64, 32, 8, 128, 64, 64, 128, 128]
    - [98, 374.0]
  - - [64, 32, 8, 256, 64, 64, 256, 256]
    - [18, 576.0]
  - - [64, 32, 8, 512, 64, 64, 512, 512]
    - [7, 853.0]
  - - [64, 32, 8, 1024, 64, 64, 1024, 1024]
    - [18, 1116.0]
  - - [64, 32, 8, 2048, 64, 64, 2048, 2048]
    - [18, 1287.0]
  - - [64, 64, 8, 32, 64, 64, 32, 32]
    - [57, 222.0]
  - - [64, 64, 8, 64, 64, 64, 64, 64]
    - [50, 410.0]
  - - [64, 64, 8, 128, 64, 64, 128, 128]
    - [18, 718.0]
  - - [64, 64, 8, 256, 64, 64, 256, 256]
    - [5, 1165.0]
  - - [64, 64, 8, 512, 64, 64, 512, 512]
    - [18, 1705.0]
  - - [64, 64, 8, 1024, 64, 64, 1024, 1024]
    - [7, 2231.0]
  - - [64, 64, 8, 2048, 64, 64, 2048, 2048]
    - [7, 2589.0]
  - - [64, 128, 8, 32, 64, 64, 32, 32]
    - [96, 452.0]
  - - [64, 128, 8, 64, 64, 64, 64, 64]
    - [50, 832.0]
  - - [64, 128, 8, 128, 64, 64, 128, 128]
    - [50, 1456.0]
  - - [64, 128, 8, 256, 64, 64, 256, 256]
    - [50, 2383.0]
  - - [64, 128, 8, 512, 64, 64, 512, 512]
    - [28, 3466.0]
  - - [64, 128, 8, 1024, 64, 64, 1024, 1024]
    - [7, 4609.0]
  - - [64, 128, 8, 2048, 64, 64, 2048, 2048]
    - [18, 5483.0]
  - - [64, 256, 8, 32, 64, 64, 32, 32]
    - [2, 1008.0]
  - - [64, 256, 8, 64, 64, 64, 64, 64]
    - [50, 1808.0]
  - - [64, 256, 8, 128, 64, 64, 128, 128]
    - [73, 2834.0]
  - - [64, 256, 8, 256, 64, 64, 256, 256]
    - [28, 4415.0]
  - - [64, 256, 8, 512, 64, 64, 512, 512]
    - [18, 5992.0]
  - - [64, 256, 8, 1024, 64, 64, 1024, 1024]
    - [18, 7201.0]
  - - [64, 256, 8, 2048, 64, 64, 2048, 2048]
    - [18, 7895.0]
  - - [64, 512, 8, 32, 64, 64, 32, 32]
    - [98, 1808.0]
  - - [64, 512, 8, 64, 64, 64, 64, 64]
    - [65, 3039.0]
  - - [64, 512, 8, 128, 64, 64, 128, 128]
    - [49, 4660.0]
  - - [64, 512, 8, 256, 64, 64, 256, 256]
    - [65, 6711.0]
  - - [64, 512, 8, 512, 64, 64, 512, 512]
    - [76, 8389.0]
  - - [64, 512, 8, 1024, 64, 64, 1024, 1024]
    - [8, 9642.0]
  - - [64, 512, 8, 2048, 64, 64, 2048, 2048]
    - [10, 10437.0]
  - - [64, 1024, 8, 32, 64, 64, 32, 32]
    - [40, 3130.0]
  - - [64, 1024, 8, 64, 64, 64, 64, 64]
    - [51, 4766.0]
  - - [64, 1024, 8, 128, 64, 64, 128, 128]
    - [76, 7109.0]
  - - [64, 1024, 8, 256, 64, 64, 256, 256]
    - [34, 9479.0]
  - - [64, 1024, 8, 512, 64, 64, 512, 512]
    - [97, 11691.0]
  - - [64, 1024, 8, 1024, 64, 64, 1024, 1024]
    - [58, 12955.0]
  - - [64, 1024, 8, 2048, 64, 64, 2048, 2048]
    - [58, 13276.0]
  - - [64, 2048, 8, 32, 64, 64, 32, 32]
    - [59, 4993.0]
  - - [64, 2048, 8, 64, 64, 64, 64, 64]
    - [78, 7294.0]
  - - [64, 2048, 8, 128, 64, 64, 128, 128]
    - [69, 10552.0]
  - - [64, 2048, 8, 256, 64, 64, 256, 256]
    - [53, 13315.0]
  - - [64, 2048, 8, 512, 64, 64, 512, 512]
    - [78, 15499.0]
  - - [64, 2048, 8, 1024, 64, 64, 1024, 1024]
    - [78, 16947.0]
  - - [64, 2048, 8, 2048, 64, 64, 2048, 2048]
    - [101, 16851.0]
  - - [128, 32, 8, 32, 128, 128, 32, 32]
    - [48, 230.0]
  - - [128, 32, 8, 64, 128, 128, 64, 64]
    - [50, 403.0]
  - - [128, 32, 8, 128, 128, 128, 128, 128]
    - [18, 738.0]
  - - [128, 32, 8, 256, 128, 128, 256, 256]
    - [50, 1165.0]
  - - [128, 32, 8, 512, 128, 128, 512, 512]
    - [28, 1664.0]
  - - [128, 32, 8, 1024, 128, 128, 1024, 1024]
    - [7, 2219.0]
  - - [128, 32, 8, 2048, 128, 128, 2048, 2048]
    - [18, 2646.0]
  - - [128, 64, 8, 32, 128, 128, 32, 32]
    - [98, 452.0]
  - - [128, 64, 8, 64, 128, 128, 64, 64]
    - [50, 832.0]
  - - [128, 64, 8, 128, 128, 128, 128, 128]
    - [98, 1520.0]
  - - [128, 64, 8, 256, 128, 128, 256, 256]
    - [50, 2467.0]
  - - [128, 64, 8, 512, 128, 128, 512, 512]
    - [18, 3438.0]
  - - [128, 64, 8, 1024, 128, 128, 1024, 1024]
    - [18, 4609.0]
  - - [128, 64, 8, 2048, 128, 128, 2048, 2048]
    - [7, 5519.0]
  - - [128, 128, 8, 32, 128, 128, 32, 32]
    - [12, 1008.0]
  - - [128, 128, 8, 64, 128, 128, 64, 64]
    - [50, 1840.0]
  - - [128, 128, 8, 128, 128, 128, 128, 128]
    - [28, 2954.0]
  - - [128, 128, 8, 256, 128, 128, 256, 256]
    - [7, 4369.0]
  - - [128, 128, 8, 512, 128, 128, 512, 512]
    - [7, 6079.0]
  - - [128, 128, 8, 1024, 128, 128, 1024, 1024]
    - [28, 7232.0]
  - - [128, 128, 8, 2048, 128, 128, 2048, 2048]
    - [50, 8516.0]
  - - [128, 256, 8, 32, 128, 128, 32, 32]
    - [66, 1840.0]
  - - [128, 256, 8, 64, 128, 128, 64, 64]
    - [48, 3039.0]
  - - [128, 256, 8, 128, 128, 128, 128, 128]
    - [65, 4934.0]
  - - [128, 256, 8, 256, 128, 128, 256, 256]
    - [50, 6765.0]
  - - [128, 256, 8, 512, 128, 128, 512, 512]
    - [27, 8347.0]
  - - [128, 256, 8, 1024, 128, 128, 1024, 1024]
    - [17, 9783.0]
  - - [128, 256, 8, 2048, 128, 128, 2048, 2048]
    - [99, 10618.0]
  - - [128, 512, 8, 32, 128, 128, 32, 32]
    - [1, 3084.0]
  - - [128, 512, 8, 64, 128, 128, 64, 64]
    - [41, 4821.0]
  - - [128, 512, 8, 128, 128, 128, 128, 128]
    - [25, 6991.0]
  - - [128, 512, 8, 256, 128, 128, 256, 256]
    - [77, 9118.0]
  - - [128, 512, 8, 512, 128, 128, 512, 512]
    - [88, 11336.0]
  - - [128, 512, 8, 1024, 128, 128, 1024, 1024]
    - [84, 12520.0]
  - - [128, 512, 8, 2048, 128, 128, 2048, 2048]
    - [84, 13557.0]
  - - [128, 1024, 8, 32, 128, 128, 32, 32]
    - [71, 5115.0]
  - - [128, 1024, 8, 64, 128, 128, 64, 64]
    - [101, 7626.0]
  - - [128, 1024, 8, 128, 128, 128, 128, 128]
    - [63, 9986.0]
  - - [128, 1024, 8, 256, 128, 128, 256, 256]
    - [101, 13530.0]
  - - [128, 1024, 8, 512, 128, 128, 512, 512]
    - [101, 15463.0]
  - - [128, 1024, 8, 1024, 128, 128, 1024, 1024]
    - [101, 16388.0]
  - - [128, 1024, 8, 2048, 128, 128, 2048, 2048]
    - [69, 17011.0]
  - - [128, 2048, 8, 32, 128, 128, 32, 32]
    - [38, 7109.0]
  - - [128, 2048, 8, 64, 128, 128, 64, 64]
    - [78, 10421.0]
  - - [128, 2048, 8, 128, 128, 128, 128, 128]
    - [77, 13585.0]
  - - [128, 2048, 8, 256, 128, 128, 256, 256]
    - [101, 17163.0]
  - - [128, 2048, 8, 512, 128, 128, 512, 512]
    - [90, 19537.0]
  - - [128, 2048, 8, 1024, 128, 128, 1024, 1024]
    - [90, 21271.0]
  - - [128, 2048, 8, 2048, 128, 128, 2048, 2048]
    - [90, 21518.0]
  - - [256, 32, 8, 32, 256, 256, 32, 32]
    - [48, 452.0]
  - - [256, 32, 8, 64, 256, 256, 64, 64]
    - [98, 832.0]
  - - [256, 32, 8, 128, 256, 256, 128, 128]
    - [50, 1417.0]
  - - [256, 32, 8, 256, 256, 256, 256, 256]
    - [28, 2330.0]
  - - [256, 32, 8, 512, 256, 256, 512, 512]
    - [18, 3277.0]
  - - [256, 32, 8, 1024, 256, 256, 1024, 1024]
    - [18, 4302.0]
  - - [256, 32, 8, 2048, 256, 256, 2048, 2048]
    - [28, 5210.0]
  - - [256, 64, 8, 32, 256, 256, 32, 32]
    - [22, 1008.0]
  - - [256, 64, 8, 64, 256, 256, 64, 64]
    - [21, 1808.0]
  - - [256, 64, 8, 128, 256, 256, 128, 128]
    - [98, 2954.0]
  - - [256, 64, 8, 256, 256, 256, 256, 256]
    - [18, 4559.0]
  - - [256, 64, 8, 512, 256, 256, 512, 512]
    - [18, 5447.0]
  - - [256, 64, 8, 1024, 256, 256, 1024, 1024]
    - [24, 6848.0]
  - - [256, 64, 8, 2048, 256, 256, 2048, 2048]
    - [28, 8008.0]
  - - [256, 128, 8, 32, 256, 256, 32, 32]
    - [83, 1840.0]
  - - [256, 128, 8, 64, 256, 256, 64, 64]
    - [48, 3130.0]
  - - [256, 128, 8, 128, 256, 256, 128, 128]
    - [73, 4877.0]
  - - [256, 128, 8, 256, 256, 256, 256, 256]
    - [96, 6991.0]
  - - [256, 128, 8, 512, 256, 256, 512, 512]
    - [97, 8105.0]
  - - [256, 128, 8, 1024, 256, 256, 1024, 1024]
    - [6, 9560.0]
  - - [256, 128, 8, 2048, 256, 256, 2048, 2048]
    - [23, 10183.0]
  - - [256, 256, 8, 32, 256, 256, 32, 32]
    - [41, 3084.0]
  - - [256, 256, 8, 64, 256, 256, 64, 64]
    - [41, 5115.0]
  - - [256, 256, 8, 128, 256, 256, 128, 128]
    - [49, 7424.0]
  - - [256, 256, 8, 256, 256, 256, 256, 256]
    - [11, 9218.0]
  - - [256, 256, 8, 512, 256, 256, 512, 512]
    - [4, 11260.0]
  - - [256, 256, 8, 1024, 256, 256, 1024, 1024]
    - [4, 12662.0]
  - - [256, 256, 8, 2048, 256, 256, 2048, 2048]
    - [26, 13435.0]
  - - [256, 512, 8, 32, 256, 256, 32, 32]
    - [69, 5115.0]
  - - [256, 512, 8, 64, 256, 256, 64, 64]
    - [51, 7424.0]
  - - [256, 512, 8, 128, 256, 256, 128, 128]
    - [93, 10421.0]
  - - [256, 512, 8, 256, 256, 256, 256, 256]
    - [78, 11899.0]
  - - [256, 512, 8, 512, 256, 256, 512, 512]
    - [90, 15499.0]
  - - [256, 512, 8, 1024, 256, 256, 1024, 1024]
    - [100, 16925.0]
  - - [256, 512, 8, 2048, 256, 256, 2048, 2048]
    - [95, 16936.0]
  - - [256, 1024, 8, 32, 256, 256, 32, 32]
    - [77, 7170.0]
  - - [256, 1024, 8, 64, 256, 256, 64, 64]
    - [53, 10552.0]
  - - [256, 1024, 8, 128, 256, 256, 128, 128]
    - [77, 14099.0]
  - - [256, 1024, 8, 256, 256, 256, 256, 256]
    - [78, 16055.0]
  - - [256, 1024, 8, 512, 256, 256, 512, 512]
    - [100, 19368.0]
  - - [256, 1024, 8, 1024, 256, 256, 1024, 1024]
    - [90, 21237.0]
  - - [256, 1024, 8, 2048, 256, 256, 2048, 2048]
    - [84, 21587.0]
  - - [256, 2048, 8, 32, 256, 256, 32, 32]
    - [87, 9020.0]
  - - [256, 2048, 8, 64, 256, 256, 64, 64]
    - [78, 12710.0]
  - - [256, 2048, 8, 128, 256, 256, 128, 128]
    - [77, 16947.0]
  - - [256, 2048, 8, 256, 256, 256, 256, 256]
    - [77, 18984.0]
  - - [256, 2048, 8, 512, 256, 256, 512, 512]
    - [100, 21985.0]
  - - [256, 2048, 8, 1024, 256, 256, 1024, 1024]
    - [90, 23978.0]
  - - [256, 2048, 8, 2048, 256, 256, 2048, 2048]
    - [91, 23485.0]
  - - [512, 32, 8, 32, 512, 512, 32, 32]
    - [32, 989.0]
  - - [512, 32, 8, 64, 512, 512, 64, 64]
    - [18, 1777.0]
  - - [512, 32, 8, 128, 512, 512, 128, 128]
    - [18, 2759.0]
  - - [512, 32, 8, 256, 512, 512, 256, 256]
    - [18, 4280.0]
  - - [512, 32, 8, 512, 512, 512, 512, 512]
    - [7, 5825.0]
  - - [512, 32, 8, 1024, 512, 512, 1024, 1024]
    - [50, 7263.0]
  - - [512, 32, 8, 2048, 512, 512, 2048, 2048]
    - [18, 8184.0]
  - - [512, 64, 8, 32, 512, 512, 32, 32]
    - [19, 1777.0]
  - - [512, 64, 8, 64, 512, 512, 64, 64]
    - [48, 2996.0]
  - - [512, 64, 8, 128, 512, 512, 128, 128]
    - [73, 4877.0]
  - - [512, 64, 8, 256, 512, 512, 256, 256]
    - [73, 6453.0]
  - - [512, 64, 8, 512, 512, 512, 512, 512]
    - [49, 8473.0]
  - - [512, 64, 8, 1024, 512, 512, 1024, 1024]
    - [0, 9957.0]
  - - [512, 64, 8, 2048, 512, 512, 2048, 2048]
    - [99, 10324.0]
  - - [512, 128, 8, 32, 512, 512, 32, 32]
    - [1, 3084.0]
  - - [512, 128, 8, 64, 512, 512, 64, 64]
    - [9, 4821.0]
  - - [512, 128, 8, 128, 512, 512, 128, 128]
    - [13, 7232.0]
  - - [512, 128, 8, 256, 512, 512, 256, 256]
    - [45, 9118.0]
  - - [512, 128, 8, 512, 512, 512, 512, 512]
    - [88, 11260.0]
  - - [512, 128, 8, 1024, 512, 512, 1024, 1024]
    - [4, 12474.0]
  - - [512, 128, 8, 2048, 512, 512, 2048, 2048]
    - [26, 13382.0]
  - - [512, 256, 8, 32, 512, 512, 32, 32]
    - [42, 4993.0]
  - - [512, 256, 8, 64, 512, 512, 64, 64]
    - [100, 7294.0]
  - - [512, 256, 8, 128, 512, 512, 128, 128]
    - [45, 10552.0]
  - - [512, 256, 8, 256, 512, 512, 256, 256]
    - [71, 12567.0]
  - - [512, 256, 8, 512, 512, 512, 512, 512]
    - [100, 15499.0]
  - - [512, 256, 8, 1024, 512, 512, 1024, 1024]
    - [77, 16840.0]
  - - [512, 256, 8, 2048, 512, 512, 2048, 2048]
    - [95, 17296.0]
  - - [512, 512, 8, 32, 512, 512, 32, 32]
    - [52, 7170.0]
  - - [512, 512, 8, 64, 512, 512, 64, 64]
    - [101, 10421.0]
  - - [512, 512, 8, 128, 512, 512, 128, 128]
    - [101, 14158.0]
  - - [512, 512, 8, 256, 512, 512, 256, 256]
    - [52, 16171.0]
  - - [512, 512, 8, 512, 512, 512, 512, 512]
    - [90, 20398.0]
  - - [512, 512, 8, 1024, 512, 512, 1024, 1024]
    - [90, 21544.0]
  - - [512, 512, 8, 2048, 512, 512, 2048, 2048]
    - [90, 21631.0]
  - - [512, 1024, 8, 32, 512, 512, 32, 32]
    - [53, 8877.0]
  - - [512, 1024, 8, 64, 512, 512, 64, 64]
    - [53, 12807.0]
  - - [512, 1024, 8, 128, 512, 512, 128, 128]
    - [52, 17033.0]
  - - [512, 1024, 8, 256, 512, 512, 256, 256]
    - [94, 19284.0]
  - - [512, 1024, 8, 512, 512, 512, 512, 512]
    - [90, 22963.0]
  - - [512, 1024, 8, 1024, 512, 512, 1024, 1024]
    - [90, 24271.0]
  - - [512, 1024, 8, 2048, 512, 512, 2048, 2048]
    - [91, 23845.0]
  - - [512, 2048, 8, 32, 512, 512, 32, 32]
    - [31, 10618.0]
  - - [512, 2048, 8, 64, 512, 512, 64, 64]
    - [101, 14401.0]
  - - [512, 2048, 8, 128, 512, 512, 128, 128]
    - [46, 19229.0]
  - - [512, 2048, 8, 256, 512, 512, 256, 256]
    - [46, 22075.0]
  - - [512, 2048, 8, 512, 512, 512, 512, 512]
    - [100, 24129.0]
  - - [512, 2048, 8, 1024, 512, 512, 1024, 1024]
    - [85, 25992.0]
  - - [512, 2048, 8, 2048, 512, 512, 2048, 2048]
    - [85, 27187.0]
  - - [1024, 32, 8, 32, 1024, 1024, 32, 32]
    - [98, 1777.0]
  - - [1024, 32, 8, 64, 1024, 1024, 64, 64]
    - [75, 2913.0]
  - - [1024, 32, 8, 128, 1024, 1024, 128, 128]
    - [50, 4510.0]
  - - [1024, 32, 8, 256, 1024, 1024, 256, 256]
    - [19, 6355.0]
  - - [1024, 32, 8, 512, 1024, 1024, 512, 512]
    - [75, 7877.0]
  - - [1024, 32, 8, 1024, 1024, 1024, 1024, 1024]
    - [10, 9069.0]
  - - [1024, 32, 8, 2048, 1024, 1024, 2048, 2048]
    - [99, 9898.0]
  - - [1024, 64, 8, 32, 1024, 1024, 32, 32]
    - [51, 3178.0]
  - - [1024, 64, 8, 64, 1024, 1024, 64, 64]
    - [41, 4934.0]
  - - [1024, 64, 8, 128, 1024, 1024, 128, 128]
    - [40, 7424.0]
  - - [1024, 64, 8, 256, 1024, 1024, 256, 256]
    - [99, 9479.0]
  - - [1024, 64, 8, 512, 1024, 1024, 512, 512]
    - [66, 11857.0]
  - - [1024, 64, 8, 1024, 1024, 1024, 1024, 1024]
    - [67, 12591.0]
  - - [1024, 64, 8, 2048, 1024, 1024, 2048, 2048]
    - [35, 13172.0]
  - - [1024, 128, 8, 32, 1024, 1024, 32, 32]
    - [63, 5178.0]
  - - [1024, 128, 8, 64, 1024, 1024, 64, 64]
    - [45, 7490.0]
  - - [1024, 128, 8, 128, 1024, 1024, 128, 128]
    - [29, 10421.0]
  - - [1024, 128, 8, 256, 1024, 1024, 256, 256]
    - [101, 13263.0]
  - - [1024, 128, 8, 512, 1024, 1024, 512, 512]
    - [78, 15081.0]
  - - [1024, 128, 8, 1024, 1024, 1024, 1024, 1024]
    - [78, 16777.0]
  - - [1024, 128, 8, 2048, 1024, 1024, 2048, 2048]
    - [78, 17152.0]
  - - [1024, 256, 8, 32, 1024, 1024, 32, 32]
    - [59, 7170.0]
  - - [1024, 256, 8, 64, 1024, 1024, 64, 64]
    - [53, 10686.0]
  - - [1024, 256, 8, 128, 1024, 1024, 128, 128]
    - [78, 14158.0]
  - - [1024, 256, 8, 256, 1024, 1024, 256, 256]
    - [68, 16529.0]
  - - [1024, 256, 8, 512, 1024, 1024, 512, 512]
    - [90, 20491.0]
  - - [1024, 256, 8, 1024, 1024, 1024, 1024, 1024]
    - [90, 21753.0]
  - - [1024, 256, 8, 2048, 1024, 1024, 2048, 2048]
    - [90, 21432.0]
  - - [1024, 512, 8, 32, 1024, 1024, 32, 32]
    - [56, 9269.0]
  - - [1024, 512, 8, 64, 1024, 1024, 64, 64]
    - [53, 13006.0]
  - - [1024, 512, 8, 128, 1024, 1024, 128, 128]
    - [77, 17033.0]
  - - [1024, 512, 8, 256, 1024, 1024, 256, 256]
    - [55, 19855.0]
  - - [1024, 512, 8, 512, 1024, 1024, 512, 512]
    - [90, 23588.0]
  - - [1024, 512, 8, 1024, 1024, 1024, 1024, 1024]
    - [90, 24403.0]
  - - [1024, 512, 8, 2048, 1024, 1024, 2048, 2048]
    - [91, 23588.0]
  - - [1024, 1024, 8, 32, 1024, 1024, 32, 32]
    - [64, 10652.0]
  - - [1024, 1024, 8, 64, 1024, 1024, 64, 64]
    - [101, 14188.0]
  - - [1024, 1024, 8, 128, 1024, 1024, 128, 128]
    - [94, 19651.0]
  - - [1024, 1024, 8, 256, 1024, 1024, 256, 256]
    - [94, 22768.0]
  - - [1024, 1024, 8, 512, 1024, 1024, 512, 512]
    - [55, 25087.0]
  - - [1024, 1024, 8, 1024, 1024, 1024, 1024, 1024]
    - [85, 26081.0]
  - - [1024, 1024, 8, 2048, 1024, 1024, 2048, 2048]
    - [36, 26627.0]
  - - [1024, 2048, 8, 32, 1024, 1024, 32, 32]
    - [56, 11732.0]
  - - [1024, 2048, 8, 64, 1024, 1024, 64, 64]
    - [101, 15463.0]
  - - [1024, 2048, 8, 128, 1024, 1024, 128, 128]
    - [72, 21338.0]
  - - [1024, 2048, 8, 256, 1024, 1024, 256, 256]
    - [46, 24315.0]
  - - [1024, 2048, 8, 512, 1024, 1024, 512, 512]
    - [30, 26093.0]
  - - [1024, 2048, 8, 1024, 1024, 1024, 1024, 1024]
    - [80, 27437.0]
  - - [1024, 2048, 8, 2048, 1024, 1024, 2048, 2048]
    - [85, 28107.0]
  - - [2048, 32, 8, 32, 2048, 2048, 32, 32]
    - [50, 2996.0]
  - - [2048, 32, 8, 64, 2048, 2048, 64, 64]
    - [75, 4609.0]
  - - [2048, 32, 8, 128, 2048, 2048, 128, 128]
    - [97, 6605.0]
  - - [2048, 32, 8, 256, 2048, 2048, 256, 256]
    - [74, 8972.0]
  - - [2048, 32, 8, 512, 2048, 2048, 512, 512]
    - [74, 9670.0]
  - - [2048, 32, 8, 1024, 2048, 2048, 1024, 1024]
    - [39, 10877.0]
  - - [2048, 32, 8, 2048, 2048, 2048, 2048, 2048]
    - [98, 10746.0]
  - - [2048, 64, 8, 32, 2048, 2048, 32, 32]
    - [37, 4877.0]
  - - [2048, 64, 8, 64, 2048, 2048, 64, 64]
    - [43, 7232.0]
  - - [2048, 64, 8, 128, 2048, 2048, 128, 128]
    - [69, 9869.0]
  - - [2048, 64, 8, 256, 2048, 2048, 256, 256]
    - [100, 12758.0]
  - - [2048, 64, 8, 512, 2048, 2048, 512, 512]
    - [52, 14685.0]
  - - [2048, 64, 8, 1024, 2048, 2048, 1024, 1024]
    - [78, 16074.0]
  - - [2048, 64, 8, 2048, 2048, 2048, 2048, 2048]
    - [78, 15571.0]
  - - [2048, 128, 8, 32, 2048, 2048, 32, 32]
    - [52, 6933.0]
  - - [2048, 128, 8, 64, 2048, 2048, 64, 64]
    - [78, 10486.0]
  - - [2048, 128, 8, 128, 2048, 2048, 128, 128]
    - [35, 13585.0]
  - - [2048, 128, 8, 256, 2048, 2048, 256, 256]
    - [77, 17207.0]
  - - [2048, 128, 8, 512, 2048, 2048, 512, 512]
    - [90, 19973.0]
  - - [2048, 128, 8, 1024, 2048, 2048, 1024, 1024]
    - [90, 21665.0]
  - - [2048, 128, 8, 2048, 2048, 2048, 2048, 2048]
    - [59, 20617.0]
  - - [2048, 256, 8, 32, 2048, 2048, 32, 32]
    - [81, 9020.0]
  - - [2048, 256, 8, 64, 2048, 2048, 64, 64]
    - [53, 12906.0]
  - - [2048, 256, 8, 128, 2048, 2048, 128, 128]
    - [77, 17033.0]
  - - [2048, 256, 8, 256, 2048, 2048, 256, 256]
    - [55, 19738.0]
  - - [2048, 256, 8, 512, 2048, 2048, 512, 512]
    - [90, 23302.0]
  - - [2048, 256, 8, 1024, 2048, 2048, 1024, 1024]
    - [90, 24571.0]
  - - [2048, 256, 8, 2048, 2048, 2048, 2048, 2048]
    - [91, 23241.0]
  - - [2048, 512, 8, 32, 2048, 2048, 32, 32]
    - [47, 10552.0]
  - - [2048, 512, 8, 64, 2048, 2048, 64, 64]
    - [77, 14248.0]
  - - [2048, 512, 8, 128, 2048, 2048, 128, 128]
    - [70, 19312.0]
  - - [2048, 512, 8, 256, 2048, 2048, 256, 256]
    - [70, 22710.0]
  - - [2048, 512, 8, 512, 2048, 2048, 512, 512]
    - [80, 25614.0]
  - - [2048, 512, 8, 1024, 2048, 2048, 1024, 1024]
    - [80, 26538.0]
  - - [2048, 512, 8, 2048, 2048, 2048, 2048, 2048]
    - [60, 26830.0]
  - - [2048, 1024, 8, 32, 2048, 2048, 32, 32]
    - [31, 11691.0]
  - - [2048, 1024, 8, 64, 2048, 2048, 64, 64]
    - [72, 15252.0]
  - - [2048, 1024, 8, 128, 2048, 2048, 128, 128]
    - [70, 21220.0]
  - - [2048, 1024, 8, 256, 2048, 2048, 256, 256]
    - [70, 23978.0]
  - - [2048, 1024, 8, 512, 2048, 2048, 512, 512]
    - [80, 26877.0]
  - - [2048, 1024, 8, 1024, 2048, 2048, 1024, 1024]
    - [80, 27603.0]
  - - [2048, 1024, 8, 2048, 2048, 2048, 2048, 2048]
    - [60, 27551.0]
  - - [2048, 2048, 8, 32, 2048, 2048, 32, 32]
    - [70, 12567.0]
  - - [2048, 2048, 8, 64, 2048, 2048, 64, 64]
    - [47, 16103.0]
  - - [2048, 2048, 8, 128, 2048, 2048, 128, 128]
    - [70, 22653.0]
  - - [2048, 2048, 8, 256, 2048, 2048, 256, 256]
    - [80, 25450.0]
  - - [2048, 2048, 8, 512, 2048, 2048, 512, 512]
    - [55, 27656.0]
  - - [2048, 2048, 8, 1024, 2048, 2048, 1024, 1024]
    - [80, 29045.0]
  - - [2048, 2048, 8, 2048, 2048, 2048, 2048, 2048]
    - [80, 29240.0]
- null
