library/src/blas3/Tensile/Logic/asm_full/hip_Cijk_Alik_Bljk_4xi8BH.yaml
- {MinimumRequiredVersion: 4.6.0}
- hip
- fallback
- [Device 0000]
    SolutionIndex: 0
    SolutionNameMin: Cijk_Alik_Bljk_4xi8BH_MT064x032x08_TT04_02_WG16_16_01
    SolutionIndex: 1
    SolutionNameMin: Cijk_Alik_Bljk_4xi8BH_MT064x016x16_TT08_02_WG08_08_01
    SolutionIndex: 2
    SolutionNameMin: Cijk_Alik_Bljk_4xi8BH_MT128x032x16_TT08_02_WG16_16_01
    SolutionIndex: 3
    SolutionNameMin: Cijk_Alik_Bljk_4xi8BH_MT064x016x16_TT08_02_WG08_08_01
    SolutionIndex: 4
    SolutionNameMin: Cijk_Alik_Bljk_4xi8BH_MT016x064x16_TT02_08_WG08_08_01
    SolutionIndex: 5
    SolutionNameMin: Cijk_Alik_Bljk_4xi8BH_MT064x032x08_TT04_02_WG16_16_01
    SolutionIndex: 6
    SolutionNameMin: Cijk_Alik_Bljk_4xi8BH_MT064x016x16_TT08_02_WG08_08_01
    SolutionIndex: 7
    SolutionNameMin: Cijk_Alik_Bljk_4xi8BH_MT128x032x16_TT08_02_WG16_16_01
    SolutionIndex: 8
    SolutionNameMin: Cijk_Alik_Bljk_4xi8BH_MT064x016x16_TT08_02_WG08_08_01
    SolutionIndex: 9
    SolutionNameMin: Cijk_Alik_Bljk_4xi8BH_MT016x064x16_TT02_08_WG08_08_01
- - - [128, 128, 2, 65]
    - [0, 112.814]
  - - [128, 1, 2, 64]
    - [3, 0.506931]
  - - [127, 127, 2, 1]
    - [2, 2.67036]
  - - [129, 129, 2, 63]
    - [0, 113.461]
  - - [127, 127, 2, 65]
    - [0, 110.589]
  - - [1, 127, 2, 64]
    - [4, 0.517048]
  - - [1, 128, 2, 64]
    - [3, 0.558038]
  - - [128, 129, 2, 1]
    - [2, 3.38361]
  - - [1, 128, 2, 63]
    - [4, 0.566292]
  - - [127, 1, 2, 63]
    - [3, 0.548014]
  - - [129, 1, 2, 64]
    - [3, 0.543158]
  - - [128, 1, 2, 63]
    - [4, 0.533333]
  - - [1, 129, 2, 65]
    - [4, 0.568089]
  - - [127, 129, 2, 1]
    - [2, 3.41312]
  - - [128, 128, 2, 64]
    - [0, 112.027]
  - - [128, 1, 2, 65]
    - [4, 0.534704]
  - - [1, 129, 2, 64]
    - [4, 0.562398]
  - - [1, 129, 2, 63]
    - [3, 0.555123]
  - - [1, 128, 2, 65]
    - [3, 0.554667]
  - - [129, 129, 2, 65]
    - [0, 100.526]
  - - [128, 128, 2, 1]
    - [2, 3.33008]
  - - [1, 1, 2, 1]
    - [3, 0.00013369]
  - - [129, 1, 2, 65]
    - [4, 0.545898]
  - - [127, 1, 2, 64]
    - [4, 0.536148]
  - - [127, 128, 2, 1]
    - [2, 3.33115]
  - - [129, 127, 2, 1]
    - [2, 3.225]
  - - [127, 1, 2, 65]
    - [4, 0.536039]
  - - [128, 127, 2, 1]
    - [2, 3.15039]
  - - [127, 127, 2, 64]
    - [0, 97.0188]
  - - [1, 127, 2, 65]
    - [4, 0.530536]
  - - [129, 1, 2, 63]
    - [2, 0.534671]
  - - [129, 129, 2, 1]
    - [2, 3.05901]
  - - [129, 129, 2, 64]
    - [0, 110.48]
  - - [127, 127, 2, 63]
    - [1, 50.4038]
  - - [1, 127, 2, 63]
    - [3, 0.41499]
  - - [128, 128, 2, 63]
    - [0, 109.342]
  - - [129, 128, 2, 1]
    - [2, 3.15115]
  - - [128, 128, 2, 65]
    - [5, 112.914]
  - - [128, 1, 2, 64]
    - [8, 0.606931]
  - - [127, 127, 2, 1]
    - [7, 2.77036]
  - - [129, 129, 2, 63]
    - [5, 113.561]
  - - [127, 127, 2, 65]
    - [5, 110.689]
  - - [1, 127, 2, 64]
    - [9, 0.617048]
  - - [1, 128, 2, 64]
    - [8, 0.658038]
  - - [128, 129, 2, 1]
    - [7, 3.48361]
  - - [1, 128, 2, 63]
    - [9, 0.666292]
  - - [127, 1, 2, 63]
    - [8, 0.648014]
  - - [129, 1, 2, 64]
    - [8, 0.643158]
  - - [128, 1, 2, 63]
    - [9, 0.633333]
  - - [1, 129, 2, 65]
    - [9, 0.668089]
  - - [127, 129, 2, 1]
    - [7, 3.51312]
  - - [128, 128, 2, 64]
    - [5, 112.127]
  - - [128, 1, 2, 65]
    - [9, 0.634704]
  - - [1, 129, 2, 64]
    - [9, 0.662398]
  - - [1, 129, 2, 63]
    - [8, 0.655123]
  - - [1, 128, 2, 65]
    - [8, 0.654667]
  - - [129, 129, 2, 65]
    - [5, 100.626]
  - - [128, 128, 2, 1]
    - [7, 3.43008]
  - - [1, 1, 2, 1]
    - [8, 0.10013369]
  - - [129, 1, 2, 65]
    - [9, 0.645898]
  - - [127, 1, 2, 64]
    - [9, 0.636148]
  - - [127, 128, 2, 1]
    - [7, 3.43115]
  - - [129, 127, 2, 1]
    - [7, 3.325]
  - - [127, 1, 2, 65]
    - [9, 0.636039]
  - - [128, 127, 2, 1]
    - [7, 3.25039]
  - - [127, 127, 2, 64]
    - [5, 97.1188]
  - - [1, 127, 2, 65]
    - [9, 0.630536]
  - - [129, 1, 2, 63]
    - [7, 0.634671]
  - - [129, 129, 2, 1]
    - [7, 3.15901]
  - - [129, 129, 2, 64]
    - [5, 110.58]
  - - [127, 127, 2, 63]
    - [6, 50.5038]
  - - [1, 127, 2, 63]
    - [8, 0.51499]
  - - [128, 128, 2, 63]
    - [5, 109.442]
  - - [129, 128, 2, 1]
    - [7, 3.25115]
- null
