library/src/blas3/Tensile/Logic/asm_full/hip_Cijk_Ailk_Bjlk_BBH.yaml
- {MinimumRequiredVersion: 4.9.6}
- hip
- fallback
- [Device 0000]
    SolutionIndex: 0
    SolutionNameMin: Cijk_Ailk_Bjlk_BBH_MT64x32x8_SE_NLCA1_NLCB1_TT4_2_WG16_16_1
    SolutionIndex: 1
    SolutionNameMin: Cijk_Ailk_Bjlk_BBH_MT32x128x16_SE_NLCA1_NLCB1_TT2_8_WG16_16_1
    SolutionIndex: 2
    SolutionNameMin: Cijk_Ailk_Bjlk_BBH_MT16x64x16_SE_NLCA1_NLCB1_TT2_8_WG8_8_1
    SolutionIndex: 3
    SolutionNameMin: Cijk_Ailk_Bjlk_BBH_MT128x32x16_SE_NLCA1_NLCB1_TT8_2_WG16_16_1
    SolutionIndex: 4
    SolutionNameMin: Cijk_Ailk_Bjlk_BBH_MT32x128x16_SE_NLCA1_NLCB1_TT2_8_WG16_16_1
    SolutionIndex: 5
    SolutionNameMin: Cijk_Ailk_Bjlk_BBH_MT64x16x16_SE_NLCA1_NLCB1_TT8_2_WG8_8_1
    SolutionIndex: 6
    SolutionNameMin: Cijk_Ailk_Bjlk_BBH_MT64x32x8_SE_NLCA1_NLCB1_TT4_2_WG16_16_1
    SolutionIndex: 7
    SolutionNameMin: Cijk_Ailk_Bjlk_BBH_MT32x128x16_SE_NLCA1_NLCB1_TT2_8_WG16_16_1
    SolutionIndex: 8
    SolutionNameMin: Cijk_Ailk_Bjlk_BBH_MT16x64x16_SE_NLCA1_NLCB1_TT2_8_WG8_8_1
    SolutionIndex: 9
    SolutionNameMin: Cijk_Ailk_Bjlk_BBH_MT128x32x16_SE_NLCA1_NLCB1_TT8_2_WG16_16_1
    SolutionIndex: 10
    SolutionNameMin: Cijk_Ailk_Bjlk_BBH_MT32x128x16_SE_NLCA1_NLCB1_TT2_8_WG16_16_1
    SolutionIndex: 11
    SolutionNameMin: Cijk_Ailk_Bjlk_BBH_MT64x16x16_SE_NLCA1_NLCB1_TT8_2_WG8_8_1
- - - [1, 128, 2, 64, 1, 1, 1, 128]
    - [3, 0.831485]
  - - [129, 129, 2, 1, 129, 129, 129, 129]
    - [3, 3.16399]
  - - [128, 1, 2, 63, 128, 128, 128, 1]
    - [5, 0.86055]
  - - [129, 1, 2, 63, 129, 129, 129, 1]
    - [4, 0.860478]
  - - [128, 1, 2, 64, 128, 128, 128, 1]
    - [4, 0.837799]
  - - [127, 127, 2, 1, 127, 127, 127, 127]
    - [4, 3.27426]
  - - [129, 1, 2, 64, 129, 129, 129, 1]
    - [5, 0.891601]
  - - [127, 127, 2, 65, 127, 127, 127, 127]
    - [1, 137.403]
  - - [129, 129, 2, 64, 129, 129, 129, 129]
    - [0, 164.311]
  - - [127, 1, 2, 65, 127, 127, 127, 1]
    - [4, 0.844242]
  - - [1, 1, 2, 1, 1, 1, 1, 1]
    - [5, 0.000165638]
  - - [127, 1, 2, 63, 127, 127, 127, 1]
    - [5, 1.08554]
  - - [129, 128, 2, 1, 129, 129, 129, 128]
    - [3, 3.13946]
  - - [1, 128, 2, 63, 1, 1, 1, 128]
    - [4, 0.815452]
  - - [128, 128, 2, 64, 128, 128, 128, 128]
    - [0, 169.522]
  - - [1, 129, 2, 64, 1, 1, 1, 129]
    - [4, 0.906108]
  - - [127, 128, 2, 1, 127, 127, 127, 128]
    - [4, 3.37612]
  - - [127, 129, 2, 1, 127, 127, 127, 129]
    - [3, 3.05041]
  - - [1, 127, 2, 65, 1, 1, 1, 127]
    - [3, 0.867236]
  - - [128, 128, 2, 1, 128, 128, 128, 128]
    - [4, 3.4027]
  - - [1, 127, 2, 63, 1, 1, 1, 127]
    - [4, 0.818245]
  - - [128, 127, 2, 1, 128, 128, 128, 127]
    - [4, 3.45578]
  - - [128, 1, 2, 65, 128, 128, 128, 1]
    - [3, 0.863967]
  - - [1, 127, 2, 64, 1, 1, 1, 127]
    - [4, 0.809763]
  - - [129, 129, 2, 63, 129, 129, 129, 129]
    - [0, 161.75]
  - - [129, 1, 2, 65, 129, 129, 129, 1]
    - [5, 0.905556]
  - - [127, 127, 2, 64, 127, 127, 127, 127]
    - [1, 122.236]
  - - [128, 129, 2, 1, 128, 128, 128, 129]
    - [4, 3.01231]
  - - [1, 129, 2, 65, 1, 1, 1, 129]
    - [3, 0.867384]
  - - [128, 128, 2, 63, 128, 128, 128, 128]
    - [0, 137.282]
  - - [129, 127, 2, 1, 129, 129, 129, 127]
    - [3, 2.87232]
  - - [127, 1, 2, 64, 127, 127, 127, 1]
    - [3, 0.86738]
  - - [128, 128, 2, 65, 128, 128, 128, 128]
    - [0, 166.199]
  - - [129, 129, 2, 65, 129, 129, 129, 129]
    - [0, 163.153]
  - - [1, 128, 2, 65, 1, 1, 1, 128]
    - [3, 0.854122]
  - - [1, 129, 2, 63, 1, 1, 1, 129]
    - [5, 1.08624]
  - - [127, 127, 2, 63, 127, 127, 127, 127]
    - [2, 108.436]
  - - [1, 128, 2, 64, 1, 1, 1, 128]
    - [9, 0.931485]
  - - [129, 129, 2, 1, 129, 129, 129, 129]
    - [9, 3.26399]
  - - [128, 1, 2, 63, 128, 128, 128, 1]
    - [11, 0.96055]
  - - [129, 1, 2, 63, 129, 129, 129, 1]
    - [10, 0.960478]
  - - [128, 1, 2, 64, 128, 128, 128, 1]
    - [10, 0.937799]
  - - [127, 127, 2, 1, 127, 127, 127, 127]
    - [10, 3.37426]
  - - [129, 1, 2, 64, 129, 129, 129, 1]
    - [11, 0.991601]
  - - [127, 127, 2, 65, 127, 127, 127, 127]
    - [7, 137.503]
  - - [129, 129, 2, 64, 129, 129, 129, 129]
    - [6, 164.411]
  - - [127, 1, 2, 65, 127, 127, 127, 1]
    - [10, 0.944242]
  - - [1, 1, 2, 1, 1, 1, 1, 1]
    - [11, 0.100165638]
  - - [127, 1, 2, 63, 127, 127, 127, 1]
    - [11, 1.18554]
  - - [129, 128, 2, 1, 129, 129, 129, 128]
    - [9, 3.23946]
  - - [1, 128, 2, 63, 1, 1, 1, 128]
    - [10, 0.915452]
  - - [128, 128, 2, 64, 128, 128, 128, 128]
    - [6, 169.622]
  - - [1, 129, 2, 64, 1, 1, 1, 129]
    - [10, 1.006108]
  - - [127, 128, 2, 1, 127, 127, 127, 128]
    - [10, 3.47612]
  - - [127, 129, 2, 1, 127, 127, 127, 129]
    - [9, 3.15041]
  - - [1, 127, 2, 65, 1, 1, 1, 127]
    - [9, 0.967236]
  - - [128, 128, 2, 1, 128, 128, 128, 128]
    - [10, 3.5027]
  - - [1, 127, 2, 63, 1, 1, 1, 127]
    - [10, 0.918245]
  - - [128, 127, 2, 1, 128, 128, 128, 127]
    - [10, 3.55578]
  - - [128, 1, 2, 65, 128, 128, 128, 1]
    - [9, 0.963967]
  - - [1, 127, 2, 64, 1, 1, 1, 127]
    - [10, 0.909763]
  - - [129, 129, 2, 63, 129, 129, 129, 129]
    - [6, 161.85]
  - - [129, 1, 2, 65, 129, 129, 129, 1]
    - [11, 1.005556]
  - - [127, 127, 2, 64, 127, 127, 127, 127]
    - [7, 122.336]
  - - [128, 129, 2, 1, 128, 128, 128, 129]
    - [10, 3.11231]
  - - [1, 129, 2, 65, 1, 1, 1, 129]
    - [9, 0.967384]
  - - [128, 128, 2, 63, 128, 128, 128, 128]
    - [6, 137.382]
  - - [129, 127, 2, 1, 129, 129, 129, 127]
    - [9, 2.97232]
  - - [127, 1, 2, 64, 127, 127, 127, 1]
    - [9, 0.96738]
  - - [128, 128, 2, 65, 128, 128, 128, 128]
    - [6, 166.299]
  - - [129, 129, 2, 65, 129, 129, 129, 129]
    - [6, 163.253]
  - - [1, 128, 2, 65, 1, 1, 1, 128]
    - [9, 0.954122]
  - - [1, 129, 2, 63, 1, 1, 1, 129]
    - [11, 1.18624]
  - - [127, 127, 2, 63, 127, 127, 127, 127]
    - [8, 108.536]
- null
