library/src/blas3/Tensile/Logic/asm_full/hip_Cijk_Ailk_Bjlk_I8II_BH_GB.yaml
- {MinimumRequiredVersion: 4.27.0}
- hip
- fallback
- [Device 0000]
    SolutionIndex: 0
    SolutionNameMin: Cijk_Ailk_Bjlk_I8II_BH_GB_MT32x32x8_SN_GRVW4_LRVW4_PGR1_PLR1_TT4_4_VW4_WG8_8_1
    SolutionIndex: 1
    SolutionNameMin: Cijk_Ailk_Bjlk_I8II_BH_GB_MT32x32x8_SN_GRVW4_LRVW4_PGR1_PLR0_TT4_4_VW4_WG8_8_1
    SolutionIndex: 2
    SolutionNameMin: Cijk_Ailk_Bjlk_I8II_BH_GB_MT32x32x8_SN_GRVW4_LRVW4_PGR0_PLR1_TT4_4_VW4_WG8_8_1
    SolutionIndex: 3
    SolutionNameMin: Cijk_Ailk_Bjlk_I8II_BH_GB_MT32x32x8_SN_GRVW4_LRVW4_PGR0_PLR0_TT4_4_VW4_WG8_8_1
    SolutionIndex: 4
    SolutionNameMin: Cijk_Ailk_Bjlk_I8II_BH_GB_MT64x32x8_SN_GRVW4_LRVW4_PGR1_PLR0_TT8_4_VW4_WG8_8_1
    SolutionIndex: 5
    SolutionNameMin: Cijk_Ailk_Bjlk_I8II_BH_GB_MT32x32x16_SN_GRVW4_LRVW4_PGR1_PLR1_TT4_4_VW4_WG8_8_1
    SolutionIndex: 6
    SolutionNameMin: Cijk_Ailk_Bjlk_I8II_BH_GB_MT32x32x16_SN_GRVW4_LRVW4_PGR1_PLR0_TT4_4_VW4_WG8_8_1
    SolutionIndex: 7
    SolutionNameMin: Cijk_Ailk_Bjlk_I8II_BH_GB_MT32x32x16_SN_GRVW4_LRVW4_PGR0_PLR1_TT4_4_VW4_WG8_8_1
    SolutionIndex: 8
    SolutionNameMin: Cijk_Ailk_Bjlk_I8II_BH_GB_MT32x32x16_SN_GRVW4_LRVW4_PGR0_PLR0_TT4_4_VW4_WG8_8_1
    SolutionIndex: 9
    SolutionNameMin: Cijk_Ailk_Bjlk_I8II_BH_GB_MT32x64x16_SN_GRVW4_LRVW4_PGR1_PLR1_TT4_8_VW4_WG8_8_1
    SolutionIndex: 10
    SolutionNameMin: Cijk_Ailk_Bjlk_I8II_BH_GB_MT32x64x16_SN_GRVW4_LRVW4_PGR1_PLR0_TT4_8_VW4_WG8_8_1
    SolutionIndex: 11
    SolutionNameMin: Cijk_Ailk_Bjlk_I8II_BH_GB_MT128x64x16_SN_GRVW4_LRVW4_PGR1_PLR0_TT8_4_VW4_WG16_16_1
    SolutionIndex: 12
    SolutionNameMin: Cijk_Ailk_Bjlk_I8II_BH_GB_MT32x32x32_SN_GRVW4_LRVW4_PGR0_PLR1_TT4_4_VW4_WG8_8_1
    SolutionIndex: 13
    SolutionNameMin: Cijk_Ailk_Bjlk_I8II_BH_GB_MT32x32x32_SN_GRVW4_LRVW4_PGR0_PLR0_TT4_4_VW4_WG8_8_1
    SolutionIndex: 14
    SolutionNameMin: Cijk_Ailk_Bjlk_I8II_BH_GB_MT64x64x32_SN_GRVW4_LRVW4_PGR1_PLR1_TT4_4_VW4_WG16_16_1
    SolutionIndex: 15
    SolutionNameMin: Cijk_Ailk_Bjlk_I8II_BH_GB_MT64x128x32_SN_GRVW4_LRVW4_PGR1_PLR1_TT4_8_VW4_WG16_16_1
    SolutionIndex: 16
    SolutionNameMin: Cijk_Ailk_Bjlk_I8II_BH_GB_MT8x8x8_SN_
- - - [32, 32, 1, 32]
    - [2, 9.0]
  - - [32, 32, 1, 64]
    - [1, 14.0]
  - - [32, 32, 1, 128]
    - [1, 22.0]
  - - [32, 32, 1, 256]
    - [7, 31.0]
  - - [32, 32, 1, 512]
    - [12, 42.0]
  - - [32, 32, 1, 1024]
    - [12, 52.0]
  - - [32, 64, 1, 32]
    - [2, 18.0]
  - - [32, 64, 1, 64]
    - [2, 29.0]
  - - [32, 64, 1, 128]
    - [1, 44.0]
  - - [32, 64, 1, 256]
    - [1, 62.0]
  - - [32, 64, 1, 512]
    - [12, 84.0]
  - - [32, 64, 1, 1024]
    - [12, 104.0]
  - - [32, 128, 1, 32]
    - [2, 36.0]
  - - [32, 128, 1, 64]
    - [3, 58.0]
  - - [32, 128, 1, 128]
    - [1, 89.0]
  - - [32, 128, 1, 256]
    - [1, 123.0]
  - - [32, 128, 1, 512]
    - [12, 166.0]
  - - [32, 128, 1, 1024]
    - [12, 202.0]
  - - [32, 256, 1, 32]
    - [2, 72.0]
  - - [32, 256, 1, 64]
    - [2, 116.0]
  - - [32, 256, 1, 128]
    - [1, 177.0]
  - - [32, 256, 1, 256]
    - [1, 247.0]
  - - [32, 256, 1, 512]
    - [12, 333.0]
  - - [32, 256, 1, 1024]
    - [12, 405.0]
  - - [32, 512, 1, 32]
    - [2, 146.0]
  - - [32, 512, 1, 64]
    - [2, 234.0]
  - - [32, 512, 1, 128]
    - [1, 353.0]
  - - [32, 512, 1, 256]
    - [1, 492.0]
  - - [32, 512, 1, 512]
    - [12, 665.0]
  - - [32, 512, 1, 1024]
    - [12, 808.0]
  - - [32, 1024, 1, 32]
    - [2, 291.0]
  - - [32, 1024, 1, 64]
    - [2, 468.0]
  - - [32, 1024, 1, 128]
    - [1, 701.0]
  - - [32, 1024, 1, 256]
    - [1, 980.0]
  - - [32, 1024, 1, 512]
    - [12, 1321.0]
  - - [32, 1024, 1, 1024]
    - [12, 1604.0]
  - - [64, 32, 1, 32]
    - [2, 18.0]
  - - [64, 32, 1, 64]
    - [2, 29.0]
  - - [64, 32, 1, 128]
    - [1, 43.0]
  - - [64, 32, 1, 256]
    - [1, 61.0]
  - - [64, 32, 1, 512]
    - [12, 88.0]
  - - [64, 32, 1, 1024]
    - [12, 108.0]
  - - [64, 64, 1, 32]
    - [2, 36.0]
  - - [64, 64, 1, 64]
    - [3, 58.0]
  - - [64, 64, 1, 128]
    - [1, 88.0]
  - - [64, 64, 1, 256]
    - [1, 123.0]
  - - [64, 64, 1, 512]
    - [12, 175.0]
  - - [64, 64, 1, 1024]
    - [12, 216.0]
  - - [64, 128, 1, 32]
    - [2, 72.0]
  - - [64, 128, 1, 64]
    - [2, 115.0]
  - - [64, 128, 1, 128]
    - [1, 178.0]
  - - [64, 128, 1, 256]
    - [1, 248.0]
  - - [64, 128, 1, 512]
    - [12, 340.0]
  - - [64, 128, 1, 1024]
    - [12, 420.0]
  - - [64, 256, 1, 32]
    - [2, 146.0]
  - - [64, 256, 1, 64]
    - [2, 232.0]
  - - [64, 256, 1, 128]
    - [1, 352.0]
  - - [64, 256, 1, 256]
    - [1, 492.0]
  - - [64, 256, 1, 512]
    - [12, 679.0]
  - - [64, 256, 1, 1024]
    - [12, 839.0]
  - - [64, 512, 1, 32]
    - [2, 290.0]
  - - [64, 512, 1, 64]
    - [2, 464.0]
  - - [64, 512, 1, 128]
    - [1, 704.0]
  - - [64, 512, 1, 256]
    - [1, 985.0]
  - - [64, 512, 1, 512]
    - [12, 1349.0]
  - - [64, 512, 1, 1024]
    - [12, 1655.0]
  - - [64, 1024, 1, 32]
    - [2, 561.0]
  - - [64, 1024, 1, 64]
    - [2, 896.0]
  - - [64, 1024, 1, 128]
    - [1, 1375.0]
  - - [64, 1024, 1, 256]
    - [5, 1848.0]
  - - [64, 1024, 1, 512]
    - [5, 2308.0]
  - - [64, 1024, 1, 1024]
    - [5, 2559.0]
  - - [128, 32, 1, 32]
    - [3, 36.0]
  - - [128, 32, 1, 64]
    - [3, 58.0]
  - - [128, 32, 1, 128]
    - [1, 87.0]
  - - [128, 32, 1, 256]
    - [1, 122.0]
  - - [128, 32, 1, 512]
    - [12, 172.0]
  - - [128, 32, 1, 1024]
    - [12, 217.0]
  - - [128, 64, 1, 32]
    - [2, 72.0]
  - - [128, 64, 1, 64]
    - [2, 115.0]
  - - [128, 64, 1, 128]
    - [1, 178.0]
  - - [128, 64, 1, 256]
    - [1, 247.0]
  - - [128, 64, 1, 512]
    - [12, 340.0]
  - - [128, 64, 1, 1024]
    - [12, 422.0]
  - - [128, 128, 1, 32]
    - [2, 144.0]
  - - [128, 128, 1, 64]
    - [2, 230.0]
  - - [128, 128, 1, 128]
    - [1, 353.0]
  - - [128, 128, 1, 256]
    - [1, 492.0]
  - - [128, 128, 1, 512]
    - [12, 666.0]
  - - [128, 128, 1, 1024]
    - [12, 822.0]
  - - [128, 256, 1, 32]
    - [2, 290.0]
  - - [128, 256, 1, 64]
    - [2, 462.0]
  - - [128, 256, 1, 128]
    - [1, 706.0]
  - - [128, 256, 1, 256]
    - [1, 985.0]
  - - [128, 256, 1, 512]
    - [12, 1323.0]
  - - [128, 256, 1, 1024]
    - [12, 1638.0]
  - - [128, 512, 1, 32]
    - [2, 567.0]
  - - [128, 512, 1, 64]
    - [2, 908.0]
  - - [128, 512, 1, 128]
    - [1, 1375.0]
  - - [128, 512, 1, 256]
    - [7, 1898.0]
  - - [128, 512, 1, 512]
    - [7, 2317.0]
  - - [128, 512, 1, 1024]
    - [14, 2577.0]
  - - [128, 1024, 1, 32]
    - [2, 1018.0]
  - - [128, 1024, 1, 64]
    - [2, 1632.0]
  - - [128, 1024, 1, 128]
    - [1, 2397.0]
  - - [128, 1024, 1, 256]
    - [6, 3113.0]
  - - [128, 1024, 1, 512]
    - [12, 3566.0]
  - - [128, 1024, 1, 1024]
    - [13, 3877.0]
  - - [256, 32, 1, 32]
    - [2, 72.0]
  - - [256, 32, 1, 64]
    - [2, 115.0]
  - - [256, 32, 1, 128]
    - [1, 177.0]
  - - [256, 32, 1, 256]
    - [1, 246.0]
  - - [256, 32, 1, 512]
    - [12, 346.0]
  - - [256, 32, 1, 1024]
    - [12, 433.0]
  - - [256, 64, 1, 32]
    - [2, 145.0]
  - - [256, 64, 1, 64]
    - [3, 232.0]
  - - [256, 64, 1, 128]
    - [1, 352.0]
  - - [256, 64, 1, 256]
    - [1, 493.0]
  - - [256, 64, 1, 512]
    - [12, 691.0]
  - - [256, 64, 1, 1024]
    - [12, 864.0]
  - - [256, 128, 1, 32]
    - [2, 285.0]
  - - [256, 128, 1, 64]
    - [2, 460.0]
  - - [256, 128, 1, 128]
    - [1, 704.0]
  - - [256, 128, 1, 256]
    - [1, 982.0]
  - - [256, 128, 1, 512]
    - [12, 1319.0]
  - - [256, 128, 1, 1024]
    - [12, 1634.0]
  - - [256, 256, 1, 32]
    - [2, 567.0]
  - - [256, 256, 1, 64]
    - [2, 908.0]
  - - [256, 256, 1, 128]
    - [7, 1366.0]
  - - [256, 256, 1, 256]
    - [7, 1898.0]
  - - [256, 256, 1, 512]
    - [7, 2330.0]
  - - [256, 256, 1, 1024]
    - [14, 2567.0]
  - - [256, 512, 1, 32]
    - [3, 962.0]
  - - [256, 512, 1, 64]
    - [1, 1525.0]
  - - [256, 512, 1, 128]
    - [1, 2261.0]
  - - [256, 512, 1, 256]
    - [8, 3067.0]
  - - [256, 512, 1, 512]
    - [6, 3573.0]
  - - [256, 512, 1, 1024]
    - [13, 3899.0]
  - - [256, 1024, 1, 32]
    - [2, 1487.0]
  - - [256, 1024, 1, 64]
    - [2, 2363.0]
  - - [256, 1024, 1, 128]
    - [7, 3316.0]
  - - [256, 1024, 1, 256]
    - [14, 4173.0]
  - - [256, 1024, 1, 512]
    - [14, 4635.0]
  - - [256, 1024, 1, 1024]
    - [14, 4977.0]
  - - [512, 32, 1, 32]
    - [3, 145.0]
  - - [512, 32, 1, 64]
    - [3, 233.0]
  - - [512, 32, 1, 128]
    - [1, 350.0]
  - - [512, 32, 1, 256]
    - [1, 490.0]
  - - [512, 32, 1, 512]
    - [12, 665.0]
  - - [512, 32, 1, 1024]
    - [12, 836.0]
  - - [512, 64, 1, 32]
    - [3, 290.0]
  - - [512, 64, 1, 64]
    - [2, 462.0]
  - - [512, 64, 1, 128]
    - [1, 704.0]
  - - [512, 64, 1, 256]
    - [1, 985.0]
  - - [512, 64, 1, 512]
    - [12, 1323.0]
  - - [512, 64, 1, 1024]
    - [12, 1659.0]
  - - [512, 128, 1, 32]
    - [2, 567.0]
  - - [512, 128, 1, 64]
    - [2, 908.0]
  - - [512, 128, 1, 128]
    - [1, 1389.0]
  - - [512, 128, 1, 256]
    - [5, 1868.0]
  - - [512, 128, 1, 512]
    - [5, 2305.0]
  - - [512, 128, 1, 1024]
    - [5, 2556.0]
  - - [512, 256, 1, 32]
    - [2, 1081.0]
  - - [512, 256, 1, 64]
    - [2, 1698.0]
  - - [512, 256, 1, 128]
    - [1, 2390.0]
  - - [512, 256, 1, 256]
    - [6, 3101.0]
  - - [512, 256, 1, 512]
    - [6, 3562.0]
  - - [512, 256, 1, 1024]
    - [12, 3879.0]
  - - [512, 512, 1, 32]
    - [2, 1632.0]
  - - [512, 512, 1, 64]
    - [1, 2534.0]
  - - [512, 512, 1, 128]
    - [4, 3342.0]
  - - [512, 512, 1, 256]
    - [4, 4072.0]
  - - [512, 512, 1, 512]
    - [14, 4622.0]
  - - [512, 512, 1, 1024]
    - [14, 4938.0]
  - - [512, 1024, 1, 32]
    - [7, 2356.0]
  - - [512, 1024, 1, 64]
    - [7, 3452.0]
  - - [512, 1024, 1, 128]
    - [4, 4380.0]
  - - [512, 1024, 1, 256]
    - [4, 4927.0]
  - - [512, 1024, 1, 512]
    - [11, 5388.0]
  - - [512, 1024, 1, 1024]
    - [15, 5664.0]
  - - [1024, 32, 1, 32]
    - [2, 286.0]
  - - [1024, 32, 1, 64]
    - [2, 462.0]
  - - [1024, 32, 1, 128]
    - [1, 699.0]
  - - [1024, 32, 1, 256]
    - [1, 975.0]
  - - [1024, 32, 1, 512]
    - [12, 1317.0]
  - - [1024, 32, 1, 1024]
    - [12, 1653.0]
  - - [1024, 64, 1, 32]
    - [2, 538.0]
  - - [1024, 64, 1, 64]
    - [2, 874.0]
  - - [1024, 64, 1, 128]
    - [1, 1340.0]
  - - [1024, 64, 1, 256]
    - [7, 1832.0]
  - - [1024, 64, 1, 512]
    - [5, 2305.0]
  - - [1024, 64, 1, 1024]
    - [5, 2546.0]
  - - [1024, 128, 1, 32]
    - [2, 1023.0]
  - - [1024, 128, 1, 64]
    - [3, 1645.0]
  - - [1024, 128, 1, 128]
    - [0, 2343.0]
  - - [1024, 128, 1, 256]
    - [5, 3084.0]
  - - [1024, 128, 1, 512]
    - [5, 3536.0]
  - - [1024, 128, 1, 1024]
    - [12, 3897.0]
  - - [1024, 256, 1, 32]
    - [1, 1698.0]
  - - [1024, 256, 1, 64]
    - [1, 2527.0]
  - - [1024, 256, 1, 128]
    - [14, 3342.0]
  - - [1024, 256, 1, 256]
    - [14, 4158.0]
  - - [1024, 256, 1, 512]
    - [14, 4631.0]
  - - [1024, 256, 1, 1024]
    - [14, 4955.0]
  - - [1024, 512, 1, 32]
    - [8, 2145.0]
  - - [1024, 512, 1, 64]
    - [6, 3445.0]
  - - [1024, 512, 1, 128]
    - [4, 4264.0]
  - - [1024, 512, 1, 256]
    - [4, 4949.0]
  - - [1024, 512, 1, 512]
    - [15, 5341.0]
  - - [1024, 512, 1, 1024]
    - [15, 5703.0]
  - - [1024, 1024, 1, 32]
    - [1, 2933.0]
  - - [1024, 1024, 1, 64]
    - [1, 4173.0]
  - - [1024, 1024, 1, 128]
    - [4, 5210.0]
  - - [1024, 1024, 1, 256]
    - [9, 5785.0]
  - - [1024, 1024, 1, 512]
    - [10, 6194.0]
  - - [1024, 1024, 1, 1024]
    - [9, 6246.0]
  - - [1, 1, 1, 1]
    - [16, 0.0006493506626866736]
- null
- null
- DeviceEfficiency
