library/src/blas3/Tensile/Logic/asm_full/hip_Cijk_Alik_Bljk_BBH.yaml
- {MinimumRequiredVersion: 4.9.6}
- hip
- fallback
- [Device 0000]
    SolutionIndex: 0
    SolutionNameMin: Cijk_Alik_Bljk_BBH_MT64x32x8_SE_TT4_2_WG16_16_1
    SolutionIndex: 1
    SolutionNameMin: Cijk_Alik_Bljk_BBH_MT32x128x16_SE_TT2_8_WG16_16_1
    SolutionIndex: 2
    SolutionNameMin: Cijk_Alik_Bljk_BBH_MT16x64x16_SE_TT2_8_WG8_8_1
    SolutionIndex: 3
    SolutionNameMin: Cijk_Alik_Bljk_BBH_MT128x32x16_SE_TT8_2_WG16_16_1
    SolutionIndex: 4
    SolutionNameMin: Cijk_Alik_Bljk_BBH_MT32x128x16_SE_TT2_8_WG16_16_1
    SolutionIndex: 5
    SolutionNameMin: Cijk_Alik_Bljk_BBH_MT64x16x16_SE_TT8_2_WG8_8_1
    SolutionIndex: 6
    SolutionNameMin: Cijk_Alik_Bljk_BBH_MT16x64x16_SE_TT2_8_WG8_8_1
    SolutionIndex: 7
    SolutionNameMin: Cijk_Alik_Bljk_BBH_MT64x32x8_SE_TT4_2_WG16_16_1
    SolutionIndex: 8
    SolutionNameMin: Cijk_Alik_Bljk_BBH_MT32x128x16_SE_TT2_8_WG16_16_1
    SolutionIndex: 9
    SolutionNameMin: Cijk_Alik_Bljk_BBH_MT16x64x16_SE_TT2_8_WG8_8_1
    SolutionIndex: 10
    SolutionNameMin: Cijk_Alik_Bljk_BBH_MT128x32x16_SE_TT8_2_WG16_16_1
    SolutionIndex: 11
    SolutionNameMin: Cijk_Alik_Bljk_BBH_MT32x128x16_SE_TT2_8_WG16_16_1
    SolutionIndex: 12
    SolutionNameMin: Cijk_Alik_Bljk_BBH_MT64x16x16_SE_TT8_2_WG8_8_1
    SolutionIndex: 13
    SolutionNameMin: Cijk_Alik_Bljk_BBH_MT16x64x16_SE_TT2_8_WG8_8_1
- - - [1, 127, 2, 63, 1, 1, 63, 63]
    - [3, 0.824505]
  - - [128, 128, 2, 1, 128, 128, 1, 1]
    - [4, 3.42905]
  - - [128, 127, 2, 1, 128, 128, 1, 1]
    - [6, 2.86866]
  - - [127, 129, 2, 1, 127, 127, 1, 1]
    - [3, 3.25237]
  - - [129, 129, 2, 64, 129, 129, 64, 64]
    - [0, 169.145]
  - - [128, 1, 2, 64, 128, 128, 64, 64]
    - [6, 0.857262]
  - - [128, 1, 2, 63, 128, 128, 63, 63]
    - [5, 0.903403]
  - - [128, 129, 2, 1, 128, 128, 1, 1]
    - [3, 3.13946]
  - - [129, 129, 2, 65, 129, 129, 65, 65]
    - [0, 163.147]
  - - [1, 127, 2, 65, 1, 1, 65, 65]
    - [3, 0.810466]
  - - [129, 129, 2, 1, 129, 129, 1, 1]
    - [3, 3.03585]
  - - [1, 129, 2, 64, 1, 1, 64, 64]
    - [6, 0.924912]
  - - [128, 128, 2, 63, 128, 128, 63, 63]
    - [0, 145.144]
  - - [128, 128, 2, 64, 128, 128, 64, 64]
    - [0, 173.684]
  - - [129, 1, 2, 63, 129, 129, 63, 63]
    - [5, 0.906702]
  - - [1, 128, 2, 65, 1, 1, 65, 65]
    - [3, 0.819846]
  - - [129, 129, 2, 63, 129, 129, 63, 63]
    - [0, 162.672]
  - - [127, 1, 2, 64, 127, 127, 64, 64]
    - [6, 0.82812]
  - - [127, 127, 2, 65, 127, 127, 65, 65]
    - [1, 135.433]
  - - [1, 129, 2, 63, 1, 1, 63, 63]
    - [6, 0.937695]
  - - [128, 128, 2, 65, 128, 128, 65, 65]
    - [0, 165.245]
  - - [129, 1, 2, 64, 129, 129, 64, 64]
    - [4, 0.895202]
  - - [129, 1, 2, 65, 129, 129, 65, 65]
    - [4, 0.912852]
  - - [127, 1, 2, 63, 127, 127, 63, 63]
    - [5, 1.07475]
  - - [127, 128, 2, 1, 127, 127, 1, 1]
    - [4, 3.40244]
  - - [1, 1, 2, 1, 1, 1, 1, 1]
    - [5, 0.000170882]
  - - [129, 128, 2, 1, 129, 129, 1, 1]
    - [3, 3.2073]
  - - [127, 127, 2, 1, 127, 127, 1, 1]
    - [5, 2.84625]
  - - [128, 1, 2, 65, 128, 128, 65, 65]
    - [4, 0.844477]
  - - [129, 127, 2, 1, 129, 129, 1, 1]
    - [4, 2.89108]
  - - [1, 127, 2, 64, 1, 1, 64, 64]
    - [3, 0.797997]
  - - [1, 128, 2, 63, 1, 1, 63, 63]
    - [3, 1.00797]
  - - [127, 1, 2, 65, 127, 127, 65, 65]
    - [3, 0.807532]
  - - [1, 129, 2, 65, 1, 1, 65, 65]
    - [4, 0.870716]
  - - [1, 128, 2, 64, 1, 1, 64, 64]
    - [3, 0.804281]
  - - [127, 127, 2, 63, 127, 127, 63, 63]
    - [2, 103.137]
  - - [127, 127, 2, 64, 127, 127, 64, 64]
    - [1, 137.291]
  - - [1, 127, 2, 63, 1, 1, 63, 63]
    - [10, 0.924505]
  - - [128, 128, 2, 1, 128, 128, 1, 1]
    - [11, 3.52905]
  - - [128, 127, 2, 1, 128, 128, 1, 1]
    - [13, 2.96866]
  - - [127, 129, 2, 1, 127, 127, 1, 1]
    - [10, 3.35237]
  - - [129, 129, 2, 64, 129, 129, 64, 64]
    - [7, 169.245]
  - - [128, 1, 2, 64, 128, 128, 64, 64]
    - [13, 0.957262]
  - - [128, 1, 2, 63, 128, 128, 63, 63]
    - [12, 1.003403]
  - - [128, 129, 2, 1, 128, 128, 1, 1]
    - [10, 3.23946]
  - - [129, 129, 2, 65, 129, 129, 65, 65]
    - [7, 163.247]
  - - [1, 127, 2, 65, 1, 1, 65, 65]
    - [10, 0.910466]
  - - [129, 129, 2, 1, 129, 129, 1, 1]
    - [10, 3.13585]
  - - [1, 129, 2, 64, 1, 1, 64, 64]
    - [13, 1.024912]
  - - [128, 128, 2, 63, 128, 128, 63, 63]
    - [7, 145.244]
  - - [128, 128, 2, 64, 128, 128, 64, 64]
    - [7, 173.784]
  - - [129, 1, 2, 63, 129, 129, 63, 63]
    - [12, 1.006702]
  - - [1, 128, 2, 65, 1, 1, 65, 65]
    - [10, 0.919846]
  - - [129, 129, 2, 63, 129, 129, 63, 63]
    - [7, 162.772]
  - - [127, 1, 2, 64, 127, 127, 64, 64]
    - [13, 0.92812]
  - - [127, 127, 2, 65, 127, 127, 65, 65]
    - [8, 135.533]
  - - [1, 129, 2, 63, 1, 1, 63, 63]
    - [13, 1.037695]
  - - [128, 128, 2, 65, 128, 128, 65, 65]
    - [7, 165.345]
  - - [129, 1, 2, 64, 129, 129, 64, 64]
    - [11, 0.995202]
  - - [129, 1, 2, 65, 129, 129, 65, 65]
    - [11, 1.012852]
  - - [127, 1, 2, 63, 127, 127, 63, 63]
    - [12, 1.17475]
  - - [127, 128, 2, 1, 127, 127, 1, 1]
    - [11, 3.50244]
  - - [1, 1, 2, 1, 1, 1, 1, 1]
    - [12, 0.100170882]
  - - [129, 128, 2, 1, 129, 129, 1, 1]
    - [10, 3.3073]
  - - [127, 127, 2, 1, 127, 127, 1, 1]
    - [12, 2.94625]
  - - [128, 1, 2, 65, 128, 128, 65, 65]
    - [11, 0.944477]
  - - [129, 127, 2, 1, 129, 129, 1, 1]
    - [11, 2.99108]
  - - [1, 127, 2, 64, 1, 1, 64, 64]
    - [10, 0.897997]
  - - [1, 128, 2, 63, 1, 1, 63, 63]
    - [10, 1.10797]
  - - [127, 1, 2, 65, 127, 127, 65, 65]
    - [10, 0.907532]
  - - [1, 129, 2, 65, 1, 1, 65, 65]
    - [11, 0.970716]
  - - [1, 128, 2, 64, 1, 1, 64, 64]
    - [10, 0.904281]
  - - [127, 127, 2, 63, 127, 127, 63, 63]
    - [9, 103.237]
  - - [127, 127, 2, 64, 127, 127, 64, 64]
    - [8, 137.391]
- null
