library/src/blas3/Tensile/Logic/asm_full/hip_Cijk_Ailk_Bjlk_I8II_BH.yaml
- {MinimumRequiredVersion: 4.27.0}
- hip
- fallback
- [Device 0000]
    SolutionIndex: 0
    SolutionNameMin: Cijk_Ailk_Bjlk_I8II_BH_MT32x32x8_SN_GRVW4_LRVW4_PGR1_PLR1_TT4_4_VW4_WG8_8_1
    SolutionIndex: 1
    SolutionNameMin: Cijk_Ailk_Bjlk_I8II_BH_MT32x32x8_SN_GRVW4_LRVW4_PGR1_PLR0_TT4_4_VW4_WG8_8_1
    SolutionIndex: 2
    SolutionNameMin: Cijk_Ailk_Bjlk_I8II_BH_MT32x32x8_SN_GRVW4_LRVW4_PGR0_PLR1_TT4_4_VW4_WG8_8_1
    SolutionIndex: 3
    SolutionNameMin: Cijk_Ailk_Bjlk_I8II_BH_MT32x32x8_SN_GRVW4_LRVW4_PGR0_PLR0_TT4_4_VW4_WG8_8_1
    SolutionIndex: 4
    SolutionNameMin: Cijk_Ailk_Bjlk_I8II_BH_MT32x64x8_SN_GRVW4_LRVW4_PGR1_PLR0_TT4_8_VW4_WG8_8_1
    SolutionIndex: 5
    SolutionNameMin: Cijk_Ailk_Bjlk_I8II_BH_MT32x32x16_SN_GRVW4_LRVW4_PGR1_PLR1_TT4_4_VW4_WG8_8_1
    SolutionIndex: 6
    SolutionNameMin: Cijk_Ailk_Bjlk_I8II_BH_MT32x32x16_SN_GRVW4_LRVW4_PGR0_PLR1_TT4_4_VW4_WG8_8_1
    SolutionIndex: 7
    SolutionNameMin: Cijk_Ailk_Bjlk_I8II_BH_MT32x32x16_SN_GRVW4_LRVW4_PGR0_PLR0_TT4_4_VW4_WG8_8_1
    SolutionIndex: 8
    SolutionNameMin: Cijk_Ailk_Bjlk_I8II_BH_MT64x32x16_SN_GRVW4_LRVW4_PGR1_PLR0_TT8_4_VW4_WG8_8_1
    SolutionIndex: 9
    SolutionNameMin: Cijk_Ailk_Bjlk_I8II_BH_MT64x64x16_SN_GRVW4_LRVW4_PGR0_PLR1_TT4_4_VW4_WG16_16_1
    SolutionIndex: 10
    SolutionNameMin: Cijk_Ailk_Bjlk_I8II_BH_MT32x32x32_SN_GRVW4_LRVW4_PGR0_PLR1_TT4_4_VW4_WG8_8_1
    SolutionIndex: 11
    SolutionNameMin: Cijk_Ailk_Bjlk_I8II_BH_MT64x64x32_SN_GRVW4_LRVW4_PGR1_PLR1_TT4_4_VW4_WG16_16_1
    SolutionIndex: 12
    SolutionNameMin: Cijk_Ailk_Bjlk_I8II_BH_MT64x64x32_SN_GRVW4_LRVW4_PGR0_PLR1_TT4_4_VW4_WG16_16_1
    SolutionIndex: 13
    SolutionNameMin: Cijk_Ailk_Bjlk_I8II_BH_MT8x8x8_SN_
- - - [32, 32, 1, 32]
    - [2, 8.0]
  - - [32, 32, 1, 64]
    - [2, 14.0]
  - - [32, 32, 1, 128]
    - [6, 21.0]
  - - [32, 32, 1, 256]
    - [1, 30.0]
  - - [32, 32, 1, 512]
    - [10, 40.0]
  - - [32, 32, 1, 1024]
    - [10, 50.0]
  - - [32, 64, 1, 32]
    - [2, 16.0]
  - - [32, 64, 1, 64]
    - [2, 27.0]
  - - [32, 64, 1, 128]
    - [6, 42.0]
  - - [32, 64, 1, 256]
    - [1, 60.0]
  - - [32, 64, 1, 512]
    - [10, 81.0]
  - - [32, 64, 1, 1024]
    - [10, 100.0]
  - - [32, 128, 1, 32]
    - [2, 33.0]
  - - [32, 128, 1, 64]
    - [2, 54.0]
  - - [32, 128, 1, 128]
    - [1, 84.0]
  - - [32, 128, 1, 256]
    - [1, 120.0]
  - - [32, 128, 1, 512]
    - [10, 161.0]
  - - [32, 128, 1, 1024]
    - [10, 198.0]
  - - [32, 256, 1, 32]
    - [2, 67.0]
  - - [32, 256, 1, 64]
    - [2, 109.0]
  - - [32, 256, 1, 128]
    - [1, 170.0]
  - - [32, 256, 1, 256]
    - [1, 242.0]
  - - [32, 256, 1, 512]
    - [10, 325.0]
  - - [32, 256, 1, 1024]
    - [10, 398.0]
  - - [32, 512, 1, 32]
    - [2, 134.0]
  - - [32, 512, 1, 64]
    - [2, 221.0]
  - - [32, 512, 1, 128]
    - [1, 339.0]
  - - [32, 512, 1, 256]
    - [1, 482.0]
  - - [32, 512, 1, 512]
    - [10, 647.0]
  - - [32, 512, 1, 1024]
    - [10, 794.0]
  - - [32, 1024, 1, 32]
    - [2, 267.0]
  - - [32, 1024, 1, 64]
    - [2, 441.0]
  - - [32, 1024, 1, 128]
    - [1, 677.0]
  - - [32, 1024, 1, 256]
    - [1, 962.0]
  - - [32, 1024, 1, 512]
    - [10, 1289.0]
  - - [32, 1024, 1, 1024]
    - [10, 1577.0]
  - - [64, 32, 1, 32]
    - [2, 17.0]
  - - [64, 32, 1, 64]
    - [2, 27.0]
  - - [64, 32, 1, 128]
    - [6, 42.0]
  - - [64, 32, 1, 256]
    - [1, 59.0]
  - - [64, 32, 1, 512]
    - [10, 84.0]
  - - [64, 32, 1, 1024]
    - [10, 104.0]
  - - [64, 64, 1, 32]
    - [2, 33.0]
  - - [64, 64, 1, 64]
    - [2, 54.0]
  - - [64, 64, 1, 128]
    - [1, 84.0]
  - - [64, 64, 1, 256]
    - [1, 120.0]
  - - [64, 64, 1, 512]
    - [10, 168.0]
  - - [64, 64, 1, 1024]
    - [10, 210.0]
  - - [64, 128, 1, 32]
    - [2, 67.0]
  - - [64, 128, 1, 64]
    - [2, 109.0]
  - - [64, 128, 1, 128]
    - [1, 169.0]
  - - [64, 128, 1, 256]
    - [1, 241.0]
  - - [64, 128, 1, 512]
    - [10, 332.0]
  - - [64, 128, 1, 1024]
    - [10, 415.0]
  - - [64, 256, 1, 32]
    - [2, 134.0]
  - - [64, 256, 1, 64]
    - [2, 218.0]
  - - [64, 256, 1, 128]
    - [1, 339.0]
  - - [64, 256, 1, 256]
    - [1, 481.0]
  - - [64, 256, 1, 512]
    - [10, 664.0]
  - - [64, 256, 1, 1024]
    - [10, 831.0]
  - - [64, 512, 1, 32]
    - [2, 266.0]
  - - [64, 512, 1, 64]
    - [2, 439.0]
  - - [64, 512, 1, 128]
    - [1, 679.0]
  - - [64, 512, 1, 256]
    - [1, 962.0]
  - - [64, 512, 1, 512]
    - [10, 1323.0]
  - - [64, 512, 1, 1024]
    - [10, 1629.0]
  - - [64, 1024, 1, 32]
    - [2, 527.0]
  - - [64, 1024, 1, 64]
    - [2, 870.0]
  - - [64, 1024, 1, 128]
    - [1, 1332.0]
  - - [64, 1024, 1, 256]
    - [1, 1872.0]
  - - [64, 1024, 1, 512]
    - [10, 2240.0]
  - - [64, 1024, 1, 1024]
    - [10, 2515.0]
  - - [128, 32, 1, 32]
    - [2, 33.0]
  - - [128, 32, 1, 64]
    - [2, 55.0]
  - - [128, 32, 1, 128]
    - [1, 83.0]
  - - [128, 32, 1, 256]
    - [1, 119.0]
  - - [128, 32, 1, 512]
    - [10, 168.0]
  - - [128, 32, 1, 1024]
    - [10, 213.0]
  - - [128, 64, 1, 32]
    - [2, 67.0]
  - - [128, 64, 1, 64]
    - [2, 109.0]
  - - [128, 64, 1, 128]
    - [1, 169.0]
  - - [128, 64, 1, 256]
    - [1, 241.0]
  - - [128, 64, 1, 512]
    - [10, 332.0]
  - - [128, 64, 1, 1024]
    - [10, 415.0]
  - - [128, 128, 1, 32]
    - [2, 134.0]
  - - [128, 128, 1, 64]
    - [2, 219.0]
  - - [128, 128, 1, 128]
    - [1, 339.0]
  - - [128, 128, 1, 256]
    - [1, 481.0]
  - - [128, 128, 1, 512]
    - [10, 658.0]
  - - [128, 128, 1, 1024]
    - [10, 824.0]
  - - [128, 256, 1, 32]
    - [2, 266.0]
  - - [128, 256, 1, 64]
    - [2, 437.0]
  - - [128, 256, 1, 128]
    - [1, 677.0]
  - - [128, 256, 1, 256]
    - [1, 964.0]
  - - [128, 256, 1, 512]
    - [10, 1319.0]
  - - [128, 256, 1, 1024]
    - [10, 1646.0]
  - - [128, 512, 1, 32]
    - [2, 527.0]
  - - [128, 512, 1, 64]
    - [2, 863.0]
  - - [128, 512, 1, 128]
    - [1, 1336.0]
  - - [128, 512, 1, 256]
    - [1, 1860.0]
  - - [128, 512, 1, 512]
    - [6, 2370.0]
  - - [128, 512, 1, 1024]
    - [10, 2531.0]
  - - [128, 1024, 1, 32]
    - [2, 962.0]
  - - [128, 1024, 1, 64]
    - [2, 1595.0]
  - - [128, 1024, 1, 128]
    - [1, 2350.0]
  - - [128, 1024, 1, 256]
    - [6, 3062.0]
  - - [128, 1024, 1, 512]
    - [10, 3566.0]
  - - [128, 1024, 1, 1024]
    - [10, 3888.0]
  - - [256, 32, 1, 32]
    - [2, 67.0]
  - - [256, 32, 1, 64]
    - [2, 109.0]
  - - [256, 32, 1, 128]
    - [1, 168.0]
  - - [256, 32, 1, 256]
    - [1, 239.0]
  - - [256, 32, 1, 512]
    - [10, 337.0]
  - - [256, 32, 1, 1024]
    - [10, 428.0]
  - - [256, 64, 1, 32]
    - [2, 134.0]
  - - [256, 64, 1, 64]
    - [2, 218.0]
  - - [256, 64, 1, 128]
    - [1, 339.0]
  - - [256, 64, 1, 256]
    - [1, 482.0]
  - - [256, 64, 1, 512]
    - [10, 675.0]
  - - [256, 64, 1, 1024]
    - [10, 856.0]
  - - [256, 128, 1, 32]
    - [2, 265.0]
  - - [256, 128, 1, 64]
    - [2, 437.0]
  - - [256, 128, 1, 128]
    - [1, 679.0]
  - - [256, 128, 1, 256]
    - [1, 960.0]
  - - [256, 128, 1, 512]
    - [10, 1317.0]
  - - [256, 128, 1, 1024]
    - [10, 1645.0]
  - - [256, 256, 1, 32]
    - [2, 524.0]
  - - [256, 256, 1, 64]
    - [2, 863.0]
  - - [256, 256, 1, 128]
    - [1, 1327.0]
  - - [256, 256, 1, 256]
    - [1, 1872.0]
  - - [256, 256, 1, 512]
    - [6, 2373.0]
  - - [256, 256, 1, 1024]
    - [10, 2589.0]
  - - [256, 512, 1, 32]
    - [2, 932.0]
  - - [256, 512, 1, 64]
    - [2, 1553.0]
  - - [256, 512, 1, 128]
    - [1, 2317.0]
  - - [256, 512, 1, 256]
    - [6, 3078.0]
  - - [256, 512, 1, 512]
    - [10, 3604.0]
  - - [256, 512, 1, 1024]
    - [10, 3918.0]
  - - [256, 1024, 1, 32]
    - [2, 1384.0]
  - - [256, 1024, 1, 64]
    - [7, 2286.0]
  - - [256, 1024, 1, 128]
    - [2, 3270.0]
  - - [256, 1024, 1, 256]
    - [11, 4082.0]
  - - [256, 1024, 1, 512]
    - [11, 4641.0]
  - - [256, 1024, 1, 1024]
    - [11, 4931.0]
  - - [512, 32, 1, 32]
    - [2, 135.0]
  - - [512, 32, 1, 64]
    - [2, 221.0]
  - - [512, 32, 1, 128]
    - [1, 337.0]
  - - [512, 32, 1, 256]
    - [1, 479.0]
  - - [512, 32, 1, 512]
    - [10, 639.0]
  - - [512, 32, 1, 1024]
    - [10, 804.0]
  - - [512, 64, 1, 32]
    - [2, 266.0]
  - - [512, 64, 1, 64]
    - [2, 437.0]
  - - [512, 64, 1, 128]
    - [1, 679.0]
  - - [512, 64, 1, 256]
    - [1, 964.0]
  - - [512, 64, 1, 512]
    - [10, 1279.0]
  - - [512, 64, 1, 1024]
    - [10, 1604.0]
  - - [512, 128, 1, 32]
    - [2, 530.0]
  - - [512, 128, 1, 64]
    - [2, 867.0]
  - - [512, 128, 1, 128]
    - [1, 1336.0]
  - - [512, 128, 1, 256]
    - [1, 1872.0]
  - - [512, 128, 1, 512]
    - [10, 2243.0]
  - - [512, 128, 1, 1024]
    - [12, 2536.0]
  - - [512, 256, 1, 32]
    - [2, 1033.0]
  - - [512, 256, 1, 64]
    - [3, 1678.0]
  - - [512, 256, 1, 128]
    - [1, 2397.0]
  - - [512, 256, 1, 256]
    - [6, 2996.0]
  - - [512, 256, 1, 512]
    - [10, 3558.0]
  - - [512, 256, 1, 1024]
    - [10, 3893.0]
  - - [512, 512, 1, 32]
    - [1, 1626.0]
  - - [512, 512, 1, 64]
    - [1, 2534.0]
  - - [512, 512, 1, 128]
    - [7, 3316.0]
  - - [512, 512, 1, 256]
    - [5, 3920.0]
  - - [512, 512, 1, 512]
    - [8, 4489.0]
  - - [512, 512, 1, 1024]
    - [11, 4881.0]
  - - [512, 1024, 1, 32]
    - [6, 2213.0]
  - - [512, 1024, 1, 64]
    - [6, 3283.0]
  - - [512, 1024, 1, 128]
    - [6, 4132.0]
  - - [512, 1024, 1, 256]
    - [8, 4902.0]
  - - [512, 1024, 1, 512]
    - [8, 5375.0]
  - - [512, 1024, 1, 1024]
    - [8, 5637.0]
  - - [1024, 32, 1, 32]
    - [2, 267.0]
  - - [1024, 32, 1, 64]
    - [2, 442.0]
  - - [1024, 32, 1, 128]
    - [1, 672.0]
  - - [1024, 32, 1, 256]
    - [1, 958.0]
  - - [1024, 32, 1, 512]
    - [10, 1271.0]
  - - [1024, 32, 1, 1024]
    - [10, 1587.0]
  - - [1024, 64, 1, 32]
    - [2, 527.0]
  - - [1024, 64, 1, 64]
    - [2, 867.0]
  - - [1024, 64, 1, 128]
    - [1, 1336.0]
  - - [1024, 64, 1, 256]
    - [1, 1840.0]
  - - [1024, 64, 1, 512]
    - [10, 2216.0]
  - - [1024, 64, 1, 1024]
    - [10, 2512.0]
  - - [1024, 128, 1, 32]
    - [2, 1018.0]
  - - [1024, 128, 1, 64]
    - [2, 1664.0]
  - - [1024, 128, 1, 128]
    - [0, 2390.0]
  - - [1024, 128, 1, 256]
    - [2, 3034.0]
  - - [1024, 128, 1, 512]
    - [10, 3506.0]
  - - [1024, 128, 1, 1024]
    - [10, 3886.0]
  - - [1024, 256, 1, 32]
    - [9, 1733.0]
  - - [1024, 256, 1, 64]
    - [0, 2504.0]
  - - [1024, 256, 1, 128]
    - [12, 3322.0]
  - - [1024, 256, 1, 256]
    - [11, 4062.0]
  - - [1024, 256, 1, 512]
    - [11, 4568.0]
  - - [1024, 256, 1, 1024]
    - [11, 4879.0]
  - - [1024, 512, 1, 32]
    - [4, 2135.0]
  - - [1024, 512, 1, 64]
    - [1, 3184.0]
  - - [1024, 512, 1, 128]
    - [1, 4107.0]
  - - [1024, 512, 1, 256]
    - [8, 4920.0]
  - - [1024, 512, 1, 512]
    - [8, 5371.0]
  - - [1024, 512, 1, 1024]
    - [8, 5615.0]
  - - [1024, 1024, 1, 32]
    - [1, 2801.0]
  - - [1024, 1024, 1, 64]
    - [1, 3990.0]
  - - [1024, 1024, 1, 128]
    - [8, 5194.0]
  - - [1024, 1024, 1, 256]
    - [8, 5892.0]
  - - [1024, 1024, 1, 512]
    - [8, 6294.0]
  - - [1024, 1024, 1, 1024]
    - [8, 6500.0]
  - - [1, 1, 1, 1]
    - [13, 0.00045871558189128754]
- null
- null
- DeviceEfficiency
