library/src/blas3/Tensile/Logic/asm_full/hip_Cijk_Alik_Bjlk_I8II_BH_GB.yaml
- {MinimumRequiredVersion: 4.27.0}
- hip
- fallback
- [Device 0000]
    SolutionIndex: 0
    SolutionNameMin: Cijk_Alik_Bjlk_I8II_BH_GB_MT32x32x8_SN_GRVW4_LRVW4_PGR1_PLR1_TT4_4_VW4_WG8_8_1
    SolutionIndex: 1
    SolutionNameMin: Cijk_Alik_Bjlk_I8II_BH_GB_MT32x32x8_SN_GRVW4_LRVW4_PGR1_PLR0_TT4_4_VW4_WG8_8_1
    SolutionIndex: 2
    SolutionNameMin: Cijk_Alik_Bjlk_I8II_BH_GB_MT32x32x8_SN_GRVW4_LRVW4_PGR0_PLR1_TT4_4_VW4_WG8_8_1
    SolutionIndex: 3
    SolutionNameMin: Cijk_Alik_Bjlk_I8II_BH_GB_MT32x32x8_SN_GRVW4_LRVW4_PGR0_PLR0_TT4_4_VW4_WG8_8_1
    SolutionIndex: 4
    SolutionNameMin: Cijk_Alik_Bjlk_I8II_BH_GB_MT32x32x16_SN_GRVW4_LRVW4_PGR0_PLR1_TT4_4_VW4_WG8_8_1
    SolutionIndex: 5
    SolutionNameMin: Cijk_Alik_Bjlk_I8II_BH_GB_MT32x32x16_SN_GRVW4_LRVW4_PGR0_PLR0_TT4_4_VW4_WG8_8_1
    SolutionIndex: 6
    SolutionNameMin: Cijk_Alik_Bjlk_I8II_BH_GB_MT32x64x16_SN_GRVW4_LRVW4_PGR1_PLR0_TT4_8_VW4_WG8_8_1
    SolutionIndex: 7
    SolutionNameMin: Cijk_Alik_Bjlk_I8II_BH_GB_MT32x64x16_SN_GRVW4_LRVW4_PGR0_PLR1_TT4_8_VW4_WG8_8_1
    SolutionIndex: 8
    SolutionNameMin: Cijk_Alik_Bjlk_I8II_BH_GB_MT64x64x16_SN_GRVW4_LRVW4_PGR1_PLR1_TT4_4_VW4_WG16_16_1
    SolutionIndex: 9
    SolutionNameMin: Cijk_Alik_Bjlk_I8II_BH_GB_MT64x64x16_SN_GRVW4_LRVW4_PGR0_PLR1_TT4_4_VW4_WG16_16_1
    SolutionIndex: 10
    SolutionNameMin: Cijk_Alik_Bjlk_I8II_BH_GB_MT32x32x32_SN_GRVW4_LRVW4_PGR0_PLR1_TT4_4_VW4_WG8_8_1
    SolutionIndex: 11
    SolutionNameMin: Cijk_Alik_Bjlk_I8II_BH_GB_MT32x32x32_SN_GRVW4_LRVW4_PGR0_PLR0_TT4_4_VW4_WG8_8_1
    SolutionIndex: 12
    SolutionNameMin: Cijk_Alik_Bjlk_I8II_BH_GB_MT64x128x32_SN_GRVW4_LRVW4_PGR1_PLR1_TT4_8_VW4_WG16_16_1
    SolutionIndex: 13
    SolutionNameMin: Cijk_Alik_Bjlk_I8II_BH_GB_MT8x8x8_SN_
- - - [32, 32, 1, 32]
    - [2, 9.0]
  - - [32, 32, 1, 64]
    - [2, 14.0]
  - - [32, 32, 1, 128]
    - [4, 21.0]
  - - [32, 32, 1, 256]
    - [4, 30.0]
  - - [32, 32, 1, 512]
    - [10, 38.0]
  - - [32, 32, 1, 1024]
    - [10, 45.0]
  - - [32, 64, 1, 32]
    - [2, 18.0]
  - - [32, 64, 1, 64]
    - [2, 29.0]
  - - [32, 64, 1, 128]
    - [4, 44.0]
  - - [32, 64, 1, 256]
    - [4, 60.0]
  - - [32, 64, 1, 512]
    - [10, 76.0]
  - - [32, 64, 1, 1024]
    - [10, 91.0]
  - - [32, 128, 1, 32]
    - [2, 35.0]
  - - [32, 128, 1, 64]
    - [2, 56.0]
  - - [32, 128, 1, 128]
    - [4, 86.0]
  - - [32, 128, 1, 256]
    - [4, 119.0]
  - - [32, 128, 1, 512]
    - [10, 150.0]
  - - [32, 128, 1, 1024]
    - [10, 178.0]
  - - [32, 256, 1, 32]
    - [3, 73.0]
  - - [32, 256, 1, 64]
    - [2, 114.0]
  - - [32, 256, 1, 128]
    - [4, 174.0]
  - - [32, 256, 1, 256]
    - [4, 239.0]
  - - [32, 256, 1, 512]
    - [10, 300.0]
  - - [32, 256, 1, 1024]
    - [10, 355.0]
  - - [32, 512, 1, 32]
    - [2, 146.0]
  - - [32, 512, 1, 64]
    - [2, 231.0]
  - - [32, 512, 1, 128]
    - [4, 351.0]
  - - [32, 512, 1, 256]
    - [4, 481.0]
  - - [32, 512, 1, 512]
    - [10, 602.0]
  - - [32, 512, 1, 1024]
    - [10, 713.0]
  - - [32, 1024, 1, 32]
    - [2, 290.0]
  - - [32, 1024, 1, 64]
    - [2, 458.0]
  - - [32, 1024, 1, 128]
    - [4, 699.0]
  - - [32, 1024, 1, 256]
    - [4, 960.0]
  - - [32, 1024, 1, 512]
    - [10, 1202.0]
  - - [32, 1024, 1, 1024]
    - [10, 1422.0]
  - - [64, 32, 1, 32]
    - [2, 18.0]
  - - [64, 32, 1, 64]
    - [2, 29.0]
  - - [64, 32, 1, 128]
    - [4, 43.0]
  - - [64, 32, 1, 256]
    - [4, 60.0]
  - - [64, 32, 1, 512]
    - [10, 79.0]
  - - [64, 32, 1, 1024]
    - [10, 94.0]
  - - [64, 64, 1, 32]
    - [2, 36.0]
  - - [64, 64, 1, 64]
    - [2, 57.0]
  - - [64, 64, 1, 128]
    - [4, 88.0]
  - - [64, 64, 1, 256]
    - [4, 121.0]
  - - [64, 64, 1, 512]
    - [10, 157.0]
  - - [64, 64, 1, 1024]
    - [10, 189.0]
  - - [64, 128, 1, 32]
    - [3, 72.0]
  - - [64, 128, 1, 64]
    - [2, 113.0]
  - - [64, 128, 1, 128]
    - [4, 175.0]
  - - [64, 128, 1, 256]
    - [4, 239.0]
  - - [64, 128, 1, 512]
    - [10, 308.0]
  - - [64, 128, 1, 1024]
    - [10, 371.0]
  - - [64, 256, 1, 32]
    - [2, 145.0]
  - - [64, 256, 1, 64]
    - [2, 229.0]
  - - [64, 256, 1, 128]
    - [4, 351.0]
  - - [64, 256, 1, 256]
    - [4, 480.0]
  - - [64, 256, 1, 512]
    - [10, 615.0]
  - - [64, 256, 1, 1024]
    - [10, 739.0]
  - - [64, 512, 1, 32]
    - [2, 288.0]
  - - [64, 512, 1, 64]
    - [2, 458.0]
  - - [64, 512, 1, 128]
    - [4, 694.0]
  - - [64, 512, 1, 256]
    - [4, 958.0]
  - - [64, 512, 1, 512]
    - [10, 1228.0]
  - - [64, 512, 1, 1024]
    - [10, 1469.0]
  - - [64, 1024, 1, 32]
    - [2, 561.0]
  - - [64, 1024, 1, 64]
    - [2, 892.0]
  - - [64, 1024, 1, 128]
    - [4, 1366.0]
  - - [64, 1024, 1, 256]
    - [1, 1770.0]
  - - [64, 1024, 1, 512]
    - [10, 2079.0]
  - - [64, 1024, 1, 1024]
    - [10, 2346.0]
  - - [128, 32, 1, 32]
    - [2, 36.0]
  - - [128, 32, 1, 64]
    - [3, 58.0]
  - - [128, 32, 1, 128]
    - [4, 87.0]
  - - [128, 32, 1, 256]
    - [4, 120.0]
  - - [128, 32, 1, 512]
    - [10, 158.0]
  - - [128, 32, 1, 1024]
    - [10, 193.0]
  - - [128, 64, 1, 32]
    - [3, 73.0]
  - - [128, 64, 1, 64]
    - [2, 115.0]
  - - [128, 64, 1, 128]
    - [4, 178.0]
  - - [128, 64, 1, 256]
    - [4, 244.0]
  - - [128, 64, 1, 512]
    - [10, 314.0]
  - - [128, 64, 1, 1024]
    - [10, 379.0]
  - - [128, 128, 1, 32]
    - [3, 144.0]
  - - [128, 128, 1, 64]
    - [2, 228.0]
  - - [128, 128, 1, 128]
    - [4, 350.0]
  - - [128, 128, 1, 256]
    - [4, 479.0]
  - - [128, 128, 1, 512]
    - [10, 614.0]
  - - [128, 128, 1, 1024]
    - [10, 740.0]
  - - [128, 256, 1, 32]
    - [2, 288.0]
  - - [128, 256, 1, 64]
    - [2, 458.0]
  - - [128, 256, 1, 128]
    - [4, 697.0]
  - - [128, 256, 1, 256]
    - [4, 955.0]
  - - [128, 256, 1, 512]
    - [10, 1223.0]
  - - [128, 256, 1, 1024]
    - [10, 1476.0]
  - - [128, 512, 1, 32]
    - [2, 570.0]
  - - [128, 512, 1, 64]
    - [2, 904.0]
  - - [128, 512, 1, 128]
    - [4, 1375.0]
  - - [128, 512, 1, 256]
    - [4, 1889.0]
  - - [128, 512, 1, 512]
    - [4, 2187.0]
  - - [128, 512, 1, 1024]
    - [10, 2361.0]
  - - [128, 1024, 1, 32]
    - [2, 1028.0]
  - - [128, 1024, 1, 64]
    - [2, 1626.0]
  - - [128, 1024, 1, 128]
    - [1, 2298.0]
  - - [128, 1024, 1, 256]
    - [4, 2949.0]
  - - [128, 1024, 1, 512]
    - [4, 3359.0]
  - - [128, 1024, 1, 1024]
    - [4, 3539.0]
  - - [256, 32, 1, 32]
    - [2, 72.0]
  - - [256, 32, 1, 64]
    - [2, 115.0]
  - - [256, 32, 1, 128]
    - [4, 174.0]
  - - [256, 32, 1, 256]
    - [4, 240.0]
  - - [256, 32, 1, 512]
    - [10, 318.0]
  - - [256, 32, 1, 1024]
    - [10, 388.0]
  - - [256, 64, 1, 32]
    - [2, 146.0]
  - - [256, 64, 1, 64]
    - [2, 231.0]
  - - [256, 64, 1, 128]
    - [4, 355.0]
  - - [256, 64, 1, 256]
    - [4, 489.0]
  - - [256, 64, 1, 512]
    - [10, 632.0]
  - - [256, 64, 1, 1024]
    - [10, 767.0]
  - - [256, 128, 1, 32]
    - [2, 285.0]
  - - [256, 128, 1, 64]
    - [2, 454.0]
  - - [256, 128, 1, 128]
    - [4, 697.0]
  - - [256, 128, 1, 256]
    - [4, 953.0]
  - - [256, 128, 1, 512]
    - [10, 1225.0]
  - - [256, 128, 1, 1024]
    - [10, 1478.0]
  - - [256, 256, 1, 32]
    - [2, 570.0]
  - - [256, 256, 1, 64]
    - [2, 900.0]
  - - [256, 256, 1, 128]
    - [4, 1366.0]
  - - [256, 256, 1, 256]
    - [4, 1868.0]
  - - [256, 256, 1, 512]
    - [4, 2187.0]
  - - [256, 256, 1, 1024]
    - [4, 2397.0]
  - - [256, 512, 1, 32]
    - [3, 980.0]
  - - [256, 512, 1, 64]
    - [1, 1514.0]
  - - [256, 512, 1, 128]
    - [1, 2237.0]
  - - [256, 512, 1, 256]
    - [4, 2938.0]
  - - [256, 512, 1, 512]
    - [4, 3352.0]
  - - [256, 512, 1, 1024]
    - [5, 3539.0]
  - - [256, 1024, 1, 32]
    - [2, 1542.0]
  - - [256, 1024, 1, 64]
    - [4, 2383.0]
  - - [256, 1024, 1, 128]
    - [4, 3283.0]
  - - [256, 1024, 1, 256]
    - [4, 3844.0]
  - - [256, 1024, 1, 512]
    - [9, 4205.0]
  - - [256, 1024, 1, 1024]
    - [9, 4493.0]
  - - [512, 32, 1, 32]
    - [2, 146.0]
  - - [512, 32, 1, 64]
    - [2, 232.0]
  - - [512, 32, 1, 128]
    - [5, 350.0]
  - - [512, 32, 1, 256]
    - [4, 483.0]
  - - [512, 32, 1, 512]
    - [11, 634.0]
  - - [512, 32, 1, 1024]
    - [10, 771.0]
  - - [512, 64, 1, 32]
    - [2, 290.0]
  - - [512, 64, 1, 64]
    - [2, 460.0]
  - - [512, 64, 1, 128]
    - [4, 706.0]
  - - [512, 64, 1, 256]
    - [4, 975.0]
  - - [512, 64, 1, 512]
    - [10, 1258.0]
  - - [512, 64, 1, 1024]
    - [11, 1514.0]
  - - [512, 128, 1, 32]
    - [3, 567.0]
  - - [512, 128, 1, 64]
    - [3, 900.0]
  - - [512, 128, 1, 128]
    - [4, 1380.0]
  - - [512, 128, 1, 256]
    - [4, 1894.0]
  - - [512, 128, 1, 512]
    - [4, 2205.0]
  - - [512, 128, 1, 1024]
    - [4, 2383.0]
  - - [512, 256, 1, 32]
    - [2, 1098.0]
  - - [512, 256, 1, 64]
    - [2, 1705.0]
  - - [512, 256, 1, 128]
    - [2, 2363.0]
  - - [512, 256, 1, 256]
    - [4, 2975.0]
  - - [512, 256, 1, 512]
    - [4, 3393.0]
  - - [512, 256, 1, 1024]
    - [4, 3606.0]
  - - [512, 512, 1, 32]
    - [2, 1658.0]
  - - [512, 512, 1, 64]
    - [4, 2519.0]
  - - [512, 512, 1, 128]
    - [4, 3290.0]
  - - [512, 512, 1, 256]
    - [4, 3848.0]
  - - [512, 512, 1, 512]
    - [9, 4168.0]
  - - [512, 512, 1, 1024]
    - [9, 4456.0]
  - - [512, 1024, 1, 32]
    - [3, 2292.0]
  - - [512, 1024, 1, 64]
    - [4, 3233.0]
  - - [512, 1024, 1, 128]
    - [6, 4052.0]
  - - [512, 1024, 1, 256]
    - [6, 4600.0]
  - - [512, 1024, 1, 512]
    - [4, 5001.0]
  - - [512, 1024, 1, 1024]
    - [12, 5239.0]
  - - [1024, 32, 1, 32]
    - [2, 288.0]
  - - [1024, 32, 1, 64]
    - [2, 460.0]
  - - [1024, 32, 1, 128]
    - [4, 694.0]
  - - [1024, 32, 1, 256]
    - [4, 960.0]
  - - [1024, 32, 1, 512]
    - [4, 1243.0]
  - - [1024, 32, 1, 1024]
    - [11, 1524.0]
  - - [1024, 64, 1, 32]
    - [2, 546.0]
  - - [1024, 64, 1, 64]
    - [2, 874.0]
  - - [1024, 64, 1, 128]
    - [4, 1344.0]
  - - [1024, 64, 1, 256]
    - [4, 1860.0]
  - - [1024, 64, 1, 512]
    - [4, 2243.0]
  - - [1024, 64, 1, 1024]
    - [4, 2417.0]
  - - [1024, 128, 1, 32]
    - [3, 1028.0]
  - - [1024, 128, 1, 64]
    - [2, 1678.0]
  - - [1024, 128, 1, 128]
    - [1, 2383.0]
  - - [1024, 128, 1, 256]
    - [3, 2975.0]
  - - [1024, 128, 1, 512]
    - [4, 3403.0]
  - - [1024, 128, 1, 1024]
    - [4, 3626.0]
  - - [1024, 256, 1, 32]
    - [9, 1601.0]
  - - [1024, 256, 1, 64]
    - [9, 2417.0]
  - - [1024, 256, 1, 128]
    - [8, 3226.0]
  - - [1024, 256, 1, 256]
    - [9, 3779.0]
  - - [1024, 256, 1, 512]
    - [9, 4189.0]
  - - [1024, 256, 1, 1024]
    - [9, 4455.0]
  - - [1024, 512, 1, 32]
    - [0, 2156.0]
  - - [1024, 512, 1, 64]
    - [1, 3208.0]
  - - [1024, 512, 1, 128]
    - [1, 4052.0]
  - - [1024, 512, 1, 256]
    - [6, 4596.0]
  - - [1024, 512, 1, 512]
    - [4, 4967.0]
  - - [1024, 512, 1, 1024]
    - [12, 5241.0]
  - - [1024, 1024, 1, 32]
    - [1, 2923.0]
  - - [1024, 1024, 1, 64]
    - [2, 3948.0]
  - - [1024, 1024, 1, 128]
    - [6, 5008.0]
  - - [1024, 1024, 1, 256]
    - [6, 5392.0]
  - - [1024, 1024, 1, 512]
    - [6, 6008.0]
  - - [1024, 1024, 1, 1024]
    - [7, 5830.0]
  - - [1, 1, 1, 1]
    - [13, 0.0006756756861011823]
- null
- null
- DeviceEfficiency
