library/src/blas3/Tensile/Logic/asm_full/mi25_Cijk_Alik_Bljk_SB.yaml
- {MinimumRequiredVersion: 3.3.5}
- mi25
- gfx900
- [Device 6860]
- - - [8448, 48000, 1, 2816]
    - [42, 8925.42]
  - - [2048, 7000, 1, 2048]
    - [34, 7132.66]
  - - [7680, 64, 1, 2560]
    - [24, 4504.66]
  - - [7680, 128, 1, 2560]
    - [16, 5504.53]
  - - [4096, 64, 1, 4096]
    - [18, 3429.29]
  - - [512, 24000, 1, 2048]
    - [37, 7542.01]
  - - [5124, 9124, 1, 2560]
    - [38, 8538.33]
  - - [1024, 48000, 1, 2560]
    - [39, 8420.44]
  - - [2048, 32, 1, 2048]
    - [15, 1674.7]
  - - [3072, 48000, 1, 1024]
    - [40, 7870.51]
  - - [5124, 9124, 1, 4096]
    - [34, 8099.17]
  - - [5124, 9124, 1, 1760]
    - [42, 9820.64]
  - - [4096, 32, 1, 4096]
    - [19, 2588.13]
  - - [512, 48000, 1, 2560]
    - [39, 8428.83]
  - - [1760, 64, 1, 1760]
    - [31, 3634.66]
  - - [512, 24000, 1, 1536]
    - [37, 7886.1]
  - - [4096, 128, 1, 4096]
    - [31, 4592.2]
  - - [4608, 24000, 1, 1536]
    - [41, 8370.46]
  - - [7680, 48000, 1, 2560]
    - [41, 8361.6]
  - - [8448, 16, 1, 2816]
    - [23, 2001.7]
  - - [4608, 16, 1, 1536]
    - [14, 1368.12]
  - - [6144, 24000, 1, 2560]
    - [34, 8508.99]
  - - [3072, 24000, 1, 1024]
    - [40, 7753.46]
  - - [2560, 64, 1, 2560]
    - [18, 3421.16]
  - - [1024, 16, 1, 500000]
    - [1, 2959.92]
  - - [3072, 16, 1, 1024]
    - [15, 708.478]
  - - [3072, 128, 1, 1024]
    - [12, 2452.22]
  - - [2560, 7000, 1, 2560]
    - [38, 8302.93]
  - - [8448, 24000, 1, 2816]
    - [42, 9270.66]
  - - [512, 48000, 1, 2048]
    - [37, 7848.18]
  - - [2048, 64, 1, 2048]
    - [33, 2229.65]
  - - [512, 24000, 1, 2816]
    - [42, 8933.4]
  - - [2560, 128, 1, 2560]
    - [24, 4469.95]
  - - [2560, 16, 1, 2560]
    - [14, 1316.54]
  - - [6144, 48000, 1, 2560]
    - [41, 8259.94]
  - - [1024, 24000, 1, 2048]
    - [34, 7528.21]
  - - [1760, 7000, 1, 1760]
    - [42, 9151.32]
  - - [4096, 16, 1, 4096]
    - [18, 1384.22]
  - - [512, 48000, 1, 1536]
    - [38, 8251.02]
  - - [35, 8457, 1, 2048]
    - [3, 2979.54]
  - - [6144, 32, 1, 2560]
    - [6, 3001.58]
  - - [8448, 32, 1, 2816]
    - [6, 3671.14]
  - - [1024, 8, 1, 500000]
    - [1, 1493.86]
  - - [7680, 16, 1, 2560]
    - [19, 1729.99]
  - - [1024, 24000, 1, 2560]
    - [39, 8254.25]
  - - [1760, 16, 1, 1760]
    - [17, 1580.37]
  - - [5124, 9124, 1, 2048]
    - [35, 8020.1]
  - - [35, 8457, 1, 1760]
    - [4, 3735.7]
  - - [1024, 700, 1, 512]
    - [36, 3012.75]
  - - [2560, 32, 1, 2560]
    - [33, 2309.35]
  - - [1760, 32, 1, 1760]
    - [6, 2655.04]
  - - [6144, 16, 1, 2560]
    - [19, 1682.77]
  - - [7680, 24000, 1, 2560]
    - [42, 8578.06]
  - - [4096, 7000, 1, 4096]
    - [34, 7931.7]
  - - [3072, 32, 1, 1024]
    - [33, 1402.92]
  - - [4608, 32, 1, 1536]
    - [33, 2361.0]
  - - [35, 8457, 1, 2560]
    - [5, 3319.49]
  - - [4608, 48000, 1, 1536]
    - [41, 8684.87]
  - - [1024, 48000, 1, 2816]
    - [41, 9270.96]
  - - [3072, 64, 1, 1024]
    - [33, 2125.44]
  - - [512, 48000, 1, 2816]
    - [42, 9116.5]
  - - [2048, 16, 1, 2048]
    - [15, 894.504]
  - - [1024, 24000, 1, 1536]
    - [34, 7932.06]
  - - [1024, 48000, 1, 1536]
    - [34, 8222.13]
  - - [1760, 128, 1, 1760]
    - [16, 4951.66]
  - - [2048, 128, 1, 2048]
    - [13, 2786.85]
  - - [35, 8457, 1, 4096]
    - [5, 3515.97]
  - - [512, 8, 1, 500000]
    - [2, 1503.17]
  - - [512, 24000, 1, 2560]
    - [38, 8188.47]
  - - [7680, 32, 1, 2560]
    - [6, 3135.07]
  - - [1024, 48000, 1, 2048]
    - [34, 7821.81]
  - - [512, 16, 1, 500000]
    - [0, 2840.59]
  - - [1024, 24000, 1, 2816]
    - [41, 9049.28]
- - - -1
    - - - -1
        - - - 4
            - - [-1, 20]
          - - 64
            - - [4, 45]
              - [64, 21]
              - [128, 22]
              - [256, 27]
              - [448, 9]
              - [704, 29]
              - [1024, 31]
              - [1408, 25]
              - [1856, 30]
              - [2368, 16]
              - [2944, 28]
              - [3584, 30]
              - [4288, 25]
              - [5888, 30]
              - [-1, 35]
          - - 128
            - - [4, 45]
              - [64, 22]
              - [128, 27]
              - [256, 9]
              - [448, 29]
              - [704, 25]
              - [1024, 28]
              - [1408, 30]
              - [1856, 29]
              - [2944, 30]
              - [3584, 35]
              - [4288, 25]
              - [5056, 35]
              - [5888, 37]
              - [-1, 36]
          - - 256
            - - [4, 45]
              - [64, 26]
              - [128, 9]
              - [256, 7]
              - [448, 28]
              - [2944, 37]
              - [3584, 34]
              - [4288, 37]
              - [5056, 35]
              - [5888, 34]
              - [-1, 37]
          - - 448
            - - [4, 45]
              - [64, 10]
              - [128, 31]
              - [256, 29]
              - [448, 16]
              - [704, 37]
              - [1024, 35]
              - [1408, 37]
              - [1856, 34]
              - [2368, 37]
              - [2944, 39]
              - [3584, 37]
              - [4288, 34]
              - [5056, 37]
              - [5888, 42]
              - [-1, 34]
          - - 704
            - - [4, 43]
              - [64, 9]
              - [128, 24]
              - [448, 35]
              - [1024, 37]
              - [1408, 36]
              - [1856, 37]
              - [2368, 35]
              - [3584, 34]
              - [4288, 36]
              - [5888, 34]
              - [-1, 42]
          - - 1024
            - - [4, 20]
              - [64, 6]
              - [128, 8]
              - [256, 35]
              - [704, 37]
              - [1024, 38]
              - [1408, 39]
              - [1856, 42]
              - [2368, 34]
              - [2944, 42]
              - [3584, 34]
              - [4288, 37]
              - [-1, 42]
          - - 1408
            - - [4, 32]
              - [64, 24]
              - [128, 31]
              - [448, 35]
              - [704, 38]
              - [1024, 36]
              - [1408, 42]
              - [1856, 39]
              - [2368, 35]
              - [3584, 42]
              - [4288, 41]
              - [-1, 42]
          - - 1856
            - - [4, 32]
              - [64, 24]
              - [128, 31]
              - [256, 35]
              - [448, 36]
              - [704, 35]
              - [1024, 42]
              - [1408, 36]
              - [1856, 34]
              - [2368, 35]
              - [-1, 42]
          - - 2368
            - - [4, 20]
              - [64, 24]
              - [128, 31]
              - [448, 37]
              - [704, 35]
              - [1024, 38]
              - [1408, 37]
              - [1856, 35]
              - [-1, 42]
          - - 2944
            - - [4, 20]
              - [128, 28]
              - [256, 35]
              - [448, 36]
              - [704, 39]
              - [1408, 42]
              - [1856, 34]
              - [-1, 42]
          - - 3584
            - - [4, 11]
              - [64, 24]
              - [128, 28]
              - [256, 36]
              - [448, 35]
              - [704, 39]
              - [1024, 36]
              - [-1, 42]
          - - 4288
            - - [4, 20]
              - [64, 24]
              - [128, 31]
              - [256, 35]
              - [704, 38]
              - [1024, 35]
              - [-1, 42]
          - - 5056
            - - [4, 20]
              - [128, 28]
              - [448, 35]
              - [704, 38]
              - [-1, 42]
          - - 5888
            - - [4, 14]
              - [64, 28]
              - [128, 35]
              - [256, 36]
              - [448, 42]
              - [704, 38]
              - [-1, 42]
          - - -1
            - - [4, 20]
              - [64, 28]
              - [128, 36]
              - [256, 35]
              - [448, 38]
              - [-1, 42]
