library/src/blas3/Tensile/Logic/asm_full/mi25_Cijk_Ailk_Bljk_SB.yaml
- {MinimumRequiredVersion: 4.0.2}
- mi25
- gfx900
- [Device 6860]
- - - [4096, 7000, 1, 4096]
    - [162, 9905.03]
  - - [5124, 9124, 1, 1760]
    - [166, 9876.97]
  - - [5124, 9124, 1, 2560]
    - [162, 9770.1]
  - - [1760, 32, 1, 1760]
    - [18, 2940.68]
  - - [1024, 1500, 1, 1536]
    - [158, 7817.34]
  - - [512, 24000, 1, 1536]
    - [169, 8925.7]
  - - [3072, 24000, 1, 1024]
    - [169, 9197.01]
  - - [1024, 3000, 1, 2560]
    - [158, 8920.66]
  - - [7680, 4, 1, 2560]
    - [21, 750.778]
  - - [35, 1500, 1, 2048]
    - [115, 1841.62]
  - - [8448, 1500, 1, 2816]
    - [147, 9354.4]
  - - [2560, 7000, 1, 2560]
    - [162, 9525.07]
  - - [3072, 16, 1, 1024]
    - [106, 1669.28]
  - - [512, 48000, 1, 2048]
    - [153, 9404.61]
  - - [1760, 64, 1, 1760]
    - [33, 3954.29]
  - - [1024, 16, 1, 512]
    - [36, 617.601]
  - - [512, 48000, 1, 1536]
    - [169, 9300.55]
  - - [2560, 32, 1, 2560]
    - [18, 3649.8]
  - - [4608, 1500, 1, 1536]
    - [158, 8901.47]
  - - [2048, 128, 1, 2048]
    - [33, 4331.37]
  - - [1024, 24000, 1, 2560]
    - [162, 9572.14]
  - - [4608, 3000, 1, 1536]
    - [158, 9160.36]
  - - [5124, 9124, 1, 2048]
    - [162, 9525.8]
  - - [1024, 700, 1, 512]
    - [141, 4948.08]
  - - [3072, 1, 1, 128]
    - [78, 30.3812]
  - - [5124, 700, 1, 2560]
    - [141, 8486.47]
  - - [8448, 16, 1, 2816]
    - [20, 2814.15]
  - - [6144, 6000, 1, 2560]
    - [162, 9821.42]
  - - [4608, 32, 1, 1536]
    - [63, 3424.7]
  - - [35, 8457, 1, 2560]
    - [13, 3522.51]
  - - [3072, 64, 1, 1024]
    - [70, 2995.87]
  - - [512, 16, 1, 512]
    - [30, 364.089]
  - - [7680, 2, 1, 2560]
    - [21, 374.119]
  - - [4224, 1, 1, 128]
    - [35, 38.7905]
  - - [7680, 1, 1, 2560]
    - [21, 189.107]
  - - [128, 1500, 1, 1280]
    - [89, 4245.62]
  - - [35, 8457, 1, 4096]
    - [14, 3778.57]
  - - [1024, 1500, 1, 2816]
    - [158, 8487.88]
  - - [6144, 2, 1, 2560]
    - [123, 362.588]
  - - [8448, 48000, 1, 2816]
    - [164, 9948.47]
  - - [512, 6000, 1, 1536]
    - [153, 8328.56]
  - - [4224, 1500, 1, 176]
    - [145, 5194.17]
  - - [1024, 6000, 1, 2816]
    - [164, 9396.23]
  - - [512, 6000, 1, 2560]
    - [158, 8765.8]
  - - [512, 32, 1, 512]
    - [27, 655.352]
  - - [2560, 128, 1, 2560]
    - [86, 5754.26]
  - - [4608, 24000, 1, 1536]
    - [162, 9836.55]
  - - [512, 2, 1, 500000]
    - [8, 439.846]
  - - [7680, 48000, 1, 2560]
    - [162, 9919.94]
  - - [3072, 48000, 1, 1024]
    - [160, 9367.67]
  - - [1760, 16, 1, 1760]
    - [74, 1716.63]
  - - [512, 3000, 1, 2816]
    - [158, 8487.88]
  - - [1760, 7000, 1, 1760]
    - [158, 9504.46]
  - - [1024, 3000, 1, 2048]
    - [153, 8366.89]
  - - [6144, 4, 1, 2560]
    - [21, 708.907]
  - - [1024, 6000, 1, 2048]
    - [160, 8708.68]
  - - [512, 24000, 1, 2816]
    - [162, 9715.74]
  - - [6144, 48000, 1, 2560]
    - [162, 9967.94]
  - - [8448, 3000, 1, 2816]
    - [162, 9913.93]
  - - [35, 1500, 1, 2560]
    - [15, 2258.01]
  - - [3072, 4, 1, 1024]
    - [74, 461.993]
  - - [4608, 48000, 1, 1536]
    - [169, 10166.1]
  - - [2048, 32, 1, 2048]
    - [31, 2743.28]
  - - [7680, 1500, 1, 2560]
    - [158, 9392.77]
  - - [4096, 128, 1, 4096]
    - [141, 6576.27]
  - - [4608, 16, 1, 1536]
    - [69, 2262.07]
  - - [1024, 1500, 1, 2048]
    - [160, 7690.5]
  - - [3072, 3000, 1, 1024]
    - [160, 8155.05]
  - - [3072, 2, 1, 1024]
    - [84, 233.436]
  - - [8448, 1, 1, 2816]
    - [115, 190.291]
  - - [1024, 48000, 1, 2560]
    - [162, 9981.94]
  - - [1024, 3000, 1, 2816]
    - [158, 9014.32]
  - - [128, 1, 1, 1408]
    - [2, 18.1018]
  - - [35, 8457, 1, 1760]
    - [12, 3787.85]
  - - [1024, 2, 1, 512]
    - [23, 82.3762]
  - - [1024, 4, 1, 500000]
    - [3, 881.793]
  - - [6144, 1, 1, 2560]
    - [1, 181.742]
  - - [1024, 48000, 1, 2816]
    - [162, 10068.1]
  - - [512, 48000, 1, 2816]
    - [162, 9878.26]
  - - [2048, 16, 1, 2048]
    - [126, 1876.14]
  - - [1024, 24000, 1, 1536]
    - [169, 9319.17]
  - - [7680, 6000, 1, 2560]
    - [162, 10021.6]
  - - [1760, 128, 1, 1760]
    - [33, 5305.01]
  - - [35, 8457, 1, 2048]
    - [11, 3214.35]
  - - [512, 1500, 1, 2816]
    - [141, 7709.02]
  - - [512, 1, 1, 512]
    - [9, 27.7169]
  - - [512, 16, 1, 500000]
    - [7, 3350.9]
  - - [512, 8, 1, 500000]
    - [8, 1731.77]
  - - [512, 24000, 1, 2560]
    - [162, 9499.38]
  - - [6144, 3000, 1, 2560]
    - [169, 9601.56]
  - - [1024, 24000, 1, 2816]
    - [162, 9685.47]
  - - [2048, 7000, 1, 2048]
    - [162, 9057.08]
  - - [7680, 3000, 1, 2560]
    - [162, 9699.33]
  - - [1024, 4, 1, 512]
    - [127, 166.612]
  - - [5124, 700, 1, 2048]
    - [141, 7698.41]
  - - [5124, 9124, 1, 4096]
    - [162, 9844.49]
  - - [4096, 64, 1, 4096]
    - [17, 5551.15]
  - - [512, 6000, 1, 2048]
    - [147, 7659.87]
  - - [7680, 32, 1, 2560]
    - [17, 4792.62]
  - - [2560, 64, 1, 2560]
    - [89, 4898.77]
  - - [3072, 128, 1, 1024]
    - [141, 3590.46]
  - - [8448, 6000, 1, 2816]
    - [162, 10274.6]
  - - [7680, 64, 1, 2560]
    - [86, 5902.04]
  - - [5124, 1500, 1, 2560]
    - [162, 8828.06]
  - - [1024, 1500, 1, 2560]
    - [158, 8322.5]
  - - [512, 4, 1, 512]
    - [71, 97.6502]
  - - [1024, 6000, 1, 2560]
    - [158, 9149.45]
  - - [3072, 32, 1, 1024]
    - [26, 2403.28]
  - - [35, 700, 1, 2560]
    - [28, 1785.38]
  - - [4608, 1, 1, 1536]
    - [0, 157.984]
  - - [4096, 32, 1, 4096]
    - [21, 4491.12]
  - - [7680, 24000, 1, 2560]
    - [162, 10394.3]
  - - [8448, 4, 1, 2816]
    - [113, 746.311]
  - - [64, 1, 1, 1216]
    - [5, 6.14817]
  - - [512, 1, 1, 500000]
    - [8, 220.462]
  - - [176, 1500, 1, 1408]
    - [89, 4509.98]
  - - [512, 3000, 1, 1536]
    - [160, 7704.79]
  - - [8448, 24000, 1, 2816]
    - [162, 10338.1]
  - - [4608, 2, 1, 1536]
    - [0, 310.548]
  - - [1024, 48000, 1, 1536]
    - [169, 9498.51]
  - - [7680, 128, 1, 2560]
    - [153, 7801.71]
  - - [3072, 6000, 1, 1024]
    - [160, 8678.49]
  - - [3072, 1500, 1, 128]
    - [161, 3854.18]
  - - [1024, 3000, 1, 1536]
    - [160, 8453.77]
  - - [512, 4, 1, 500000]
    - [4, 874.456]
  - - [35, 700, 1, 2048]
    - [113, 1442.91]
  - - [1024, 16, 1, 500000]
    - [6, 3383.28]
  - - [512, 24000, 1, 2048]
    - [153, 8880.9]
  - - [1024, 32, 1, 512]
    - [35, 1039.3]
  - - [512, 48000, 1, 2560]
    - [162, 9898.13]
  - - [2560, 16, 1, 2560]
    - [35, 2146.33]
  - - [2048, 64, 1, 2048]
    - [21, 3801.41]
  - - [512, 2, 1, 512]
    - [5, 45.2303]
  - - [1024, 1, 1, 512]
    - [71, 40.2872]
  - - [512, 1500, 1, 2560]
    - [145, 7414.15]
  - - [6144, 32, 1, 2560]
    - [32, 4468.26]
  - - [1024, 1, 1, 500000]
    - [3, 221.649]
  - - [6144, 16, 1, 2560]
    - [69, 2760.41]
  - - [1024, 24000, 1, 2048]
    - [160, 9360.95]
  - - [4096, 16, 1, 4096]
    - [35, 2870.56]
  - - [5124, 1500, 1, 2048]
    - [147, 8454.97]
  - - [3072, 1500, 1, 1024]
    - [160, 7658.54]
  - - [1024, 2, 1, 500000]
    - [3, 441.572]
  - - [1024, 8, 1, 500000]
    - [3, 1750.14]
  - - [7680, 16, 1, 2560]
    - [21, 2803.28]
  - - [6144, 1500, 1, 2560]
    - [169, 9261.82]
  - - [3072, 1, 1, 1024]
    - [23, 121.862]
  - - [512, 6000, 1, 2816]
    - [153, 8985.69]
  - - [8448, 2, 1, 2816]
    - [115, 380.151]
  - - [4608, 4, 1, 1536]
    - [26, 598.678]
  - - [1024, 6000, 1, 1536]
    - [158, 8833.02]
  - - [8448, 32, 1, 2816]
    - [86, 4883.68]
  - - [512, 3000, 1, 2048]
    - [158, 7050.65]
  - - [6144, 24000, 1, 2560]
    - [162, 10335.6]
  - - [512, 3000, 1, 2560]
    - [158, 8259.1]
  - - [4608, 6000, 1, 1536]
    - [169, 9410.22]
  - - [512, 1500, 1, 2048]
    - [153, 5868.37]
  - - [512, 1500, 1, 1536]
    - [141, 6906.09]
  - - [128, 1, 1, 1024]
    - [10, 12.2063]
  - - [1024, 48000, 1, 2048]
    - [169, 9678.34]
- - - -1
    - - - -1
        - - - 4
            - - [-1, 175]
          - - 64
            - - [4, 194]
              - [64, 71]
              - [128, 39]
              - [256, 27]
              - [448, 25]
              - [704, 28]
              - [1024, 19]
              - [1408, 56]
              - [1856, 17]
              - [2368, 32]
              - [2944, 86]
              - [3584, 18]
              - [5056, 86]
              - [-1, 89]
          - - 128
            - - [4, 194]
              - [64, 38]
              - [128, 22]
              - [256, 41]
              - [448, 87]
              - [704, 56]
              - [1024, 16]
              - [1408, 89]
              - [1856, 16]
              - [2944, 89]
              - [3584, 141]
              - [5056, 89]
              - [5888, 145]
              - [-1, 153]
          - - 256
            - - [4, 194]
              - [64, 22]
              - [128, 28]
              - [256, 19]
              - [448, 89]
              - [704, 141]
              - [1024, 145]
              - [1408, 141]
              - [2368, 145]
              - [2944, 141]
              - [3584, 153]
              - [4288, 145]
              - [5056, 141]
              - [5888, 158]
              - [-1, 145]
          - - 448
            - - [4, 194]
              - [64, 25]
              - [128, 56]
              - [256, 87]
              - [448, 33]
              - [1408, 145]
              - [1856, 153]
              - [2368, 145]
              - [2944, 153]
              - [3584, 145]
              - [4288, 139]
              - [5056, 141]
              - [5888, 145]
              - [-1, 139]
          - - 704
            - - [4, 37]
              - [64, 25]
              - [128, 56]
              - [256, 145]
              - [448, 141]
              - [1024, 145]
              - [1408, 143]
              - [1856, 141]
              - [2368, 145]
              - [2944, 143]
              - [5888, 139]
              - [-1, 163]
          - - 1024
            - - [4, 37]
              - [64, 24]
              - [128, 29]
              - [256, 141]
              - [448, 145]
              - [704, 141]
              - [1408, 147]
              - [1856, 166]
              - [2944, 147]
              - [3584, 153]
              - [4288, 147]
              - [5056, 166]
              - [5888, 162]
              - [-1, 158]
          - - 1408
            - - [4, 194]
              - [64, 56]
              - [128, 86]
              - [256, 141]
              - [448, 145]
              - [1856, 153]
              - [2368, 145]
              - [5056, 163]
              - [5888, 166]
              - [-1, 147]
          - - 1856
            - - [4, 194]
              - [64, 17]
              - [128, 91]
              - [256, 145]
              - [448, 153]
              - [704, 145]
              - [1024, 153]
              - [1408, 141]
              - [1856, 153]
              - [2368, 141]
              - [2944, 145]
              - [3584, 143]
              - [4288, 163]
              - [5056, 145]
              - [5888, 166]
              - [-1, 163]
          - - 2368
            - - [4, 174]
              - [64, 33]
              - [128, 86]
              - [448, 141]
              - [704, 145]
              - [1024, 153]
              - [1856, 145]
              - [2368, 147]
              - [2944, 163]
              - [3584, 147]
              - [4288, 153]
              - [5056, 166]
              - [-1, 163]
          - - 2944
            - - [4, 174]
              - [128, 86]
              - [256, 145]
              - [704, 153]
              - [1408, 163]
              - [1856, 141]
              - [2368, 163]
              - [4288, 147]
              - [5056, 166]
              - [5888, 162]
              - [-1, 147]
          - - 3584
            - - [4, 34]
              - [64, 33]
              - [128, 86]
              - [256, 153]
              - [448, 141]
              - [1024, 153]
              - [1408, 163]
              - [1856, 153]
              - [2368, 158]
              - [3584, 147]
              - [4288, 163]
              - [5056, 147]
              - [-1, 163]
          - - 4288
            - - [4, 78]
              - [64, 53]
              - [128, 91]
              - [256, 141]
              - [448, 147]
              - [1024, 153]
              - [1408, 162]
              - [1856, 166]
              - [2944, 147]
              - [3584, 162]
              - [5056, 147]
              - [-1, 162]
          - - 5056
            - - [4, 78]
              - [128, 86]
              - [448, 141]
              - [704, 147]
              - [1408, 162]
              - [1856, 147]
              - [3584, 162]
              - [4288, 147]
              - [-1, 162]
          - - 5888
            - - [4, 191]
              - [64, 86]
              - [128, 145]
              - [256, 147]
              - [448, 141]
              - [704, 153]
              - [1024, 163]
              - [1408, 162]
              - [2368, 147]
              - [-1, 162]
          - - -1
            - - [4, 187]
              - [64, 141]
              - [128, 147]
              - [256, 141]
              - [448, 147]
              - [704, 166]
              - [1024, 162]
              - [1856, 147]
              - [3584, 162]
              - [4288, 147]
              - [-1, 162]
