library/src/blas3/Tensile/Logic/asm_full/navi21_Cijk_Alik_Bjlk_SB.yaml
- {MinimumRequiredVersion: 4.26.0}
- navi21
- gfx1030
- [Device 73a2]
    SolutionIndex: 0
    SolutionNameMin: Cijk_Alik_Bjlk_SB_MT128x64x8_SN_SU0_SUM0_TT8_8_WG16_8_1_WGM1
    SolutionIndex: 1
    SolutionNameMin: Cijk_Alik_Bjlk_SB_MT128x128x8_SN_SU0_SUM0_TT8_16_WG16_8_1_WGM1
    SolutionIndex: 2
    SolutionNameMin: Cijk_Alik_Bjlk_SB_MT128x128x8_SN_SU0_SUM0_TT8_8_WG16_16_1_WGM1
    SolutionIndex: 3
    SolutionNameMin: Cijk_Alik_Bjlk_SB_MT128x128x16_SN_SU0_SUM0_TT8_16_WG16_8_1_WGM1
    SolutionIndex: 4
    SolutionNameMin: Cijk_Alik_Bjlk_SB_MT128x128x16_SN_SU0_SUM0_TT8_8_WG16_16_1_WGM1
    SolutionIndex: 5
    SolutionNameMin: Cijk_Alik_Bjlk_SB_MT128x256x16_SN_SU0_SUM0_TT8_16_WG16_16_1_WGM1
    SolutionIndex: 6
    SolutionNameMin: Cijk_Alik_Bjlk_SB_MT128x64x8_SN_SU32_SUM3_TT8_8_WG16_8_1_WGM1
    SolutionIndex: 7
    SolutionNameMin: Cijk_Alik_Bjlk_SB_MT128x128x8_SN_SU32_SUM3_TT8_16_WG16_8_1_WGM1
    SolutionIndex: 8
    SolutionNameMin: Cijk_Alik_Bjlk_SB_MT128x128x8_SN_SU32_SUM3_TT8_8_WG16_16_1_WGM1
    SolutionIndex: 9
    SolutionNameMin: Cijk_Alik_Bjlk_SB_MT128x64x16_SN_SU32_SUM3_TT8_8_WG16_8_1_WGM1
    SolutionIndex: 10
    SolutionNameMin: Cijk_Alik_Bjlk_SB_MT128x128x16_SN_SU32_SUM3_TT8_16_WG16_8_1_WGM1
    SolutionIndex: 11
    SolutionNameMin: Cijk_Alik_Bjlk_SB_MT128x128x16_SN_SU32_SUM3_TT8_8_WG16_16_1_WGM1
    SolutionIndex: 12
    SolutionNameMin: Cijk_Alik_Bjlk_SB_MT128x64x8_SN_SU0_SUM0_TT8_8_WG16_8_1_WGM4
    SolutionIndex: 13
    SolutionNameMin: Cijk_Alik_Bjlk_SB_MT128x128x8_SN_SU0_SUM0_TT8_16_WG16_8_1_WGM4
    SolutionIndex: 14
    SolutionNameMin: Cijk_Alik_Bjlk_SB_MT128x128x8_SN_SU0_SUM0_TT8_8_WG16_16_1_WGM4
    SolutionIndex: 15
    SolutionNameMin: Cijk_Alik_Bjlk_SB_MT128x64x16_SN_SU0_SUM0_TT8_8_WG16_8_1_WGM4
    SolutionIndex: 16
    SolutionNameMin: Cijk_Alik_Bjlk_SB_MT128x128x16_SN_SU0_SUM0_TT8_16_WG16_8_1_WGM4
    SolutionIndex: 17
    SolutionNameMin: Cijk_Alik_Bjlk_SB_MT128x256x16_SN_SU0_SUM0_TT8_16_WG16_16_1_WGM4
    SolutionIndex: 18
    SolutionNameMin: Cijk_Alik_Bjlk_SB_MT128x64x8_SN_SU32_SUM3_TT8_8_WG16_8_1_WGM4
    SolutionIndex: 19
    SolutionNameMin: Cijk_Alik_Bjlk_SB_MT128x128x8_SN_SU32_SUM3_TT8_16_WG16_8_1_WGM4
    SolutionIndex: 20
    SolutionNameMin: Cijk_Alik_Bjlk_SB_MT128x128x8_SN_SU32_SUM3_TT8_8_WG16_16_1_WGM4
    SolutionIndex: 21
    SolutionNameMin: Cijk_Alik_Bjlk_SB_MT128x64x16_SN_SU32_SUM3_TT8_8_WG16_8_1_WGM4
    SolutionIndex: 22
    SolutionNameMin: Cijk_Alik_Bjlk_SB_MT128x128x16_SN_SU32_SUM3_TT8_16_WG16_8_1_WGM4
    SolutionIndex: 23
    SolutionNameMin: Cijk_Alik_Bjlk_SB_MT128x256x16_SN_SU32_SUM3_TT8_16_WG16_16_1_WGM4
    SolutionIndex: 24
    SolutionNameMin: Cijk_Alik_Bjlk_SB_MT128x64x8_SN_SU0_SUM0_TT8_8_WG16_8_1_WGM8
    SolutionIndex: 25
    SolutionNameMin: Cijk_Alik_Bjlk_SB_MT128x128x8_SN_SU0_SUM0_TT8_16_WG16_8_1_WGM8
    SolutionIndex: 26
    SolutionNameMin: Cijk_Alik_Bjlk_SB_MT128x128x8_SN_SU0_SUM0_TT8_8_WG16_16_1_WGM8
    SolutionIndex: 27
    SolutionNameMin: Cijk_Alik_Bjlk_SB_MT128x64x16_SN_SU0_SUM0_TT8_8_WG16_8_1_WGM8
    SolutionIndex: 28
    SolutionNameMin: Cijk_Alik_Bjlk_SB_MT128x128x16_SN_SU0_SUM0_TT8_16_WG16_8_1_WGM8
    SolutionIndex: 29
    SolutionNameMin: Cijk_Alik_Bjlk_SB_MT128x256x16_SN_SU0_SUM0_TT8_16_WG16_16_1_WGM8
    SolutionIndex: 30
    SolutionNameMin: Cijk_Alik_Bjlk_SB_MT128x64x8_SN_SU32_SUM3_TT8_8_WG16_8_1_WGM8
    SolutionIndex: 31
    SolutionNameMin: Cijk_Alik_Bjlk_SB_MT128x128x8_SN_SU32_SUM3_TT8_16_WG16_8_1_WGM8
    SolutionIndex: 32
    SolutionNameMin: Cijk_Alik_Bjlk_SB_MT128x128x8_SN_SU32_SUM3_TT8_8_WG16_16_1_WGM8
    SolutionIndex: 33
    SolutionNameMin: Cijk_Alik_Bjlk_SB_MT128x64x16_SN_SU32_SUM3_TT8_8_WG16_8_1_WGM8
    SolutionIndex: 34
    SolutionNameMin: Cijk_Alik_Bjlk_SB_MT128x128x16_SN_SU32_SUM3_TT8_16_WG16_8_1_WGM8
    SolutionIndex: 35
    SolutionNameMin: Cijk_Alik_Bjlk_SB_MT128x128x16_SN_SU32_SUM3_TT8_8_WG16_16_1_WGM8
    SolutionIndex: 36
    SolutionNameMin: Cijk_Alik_Bjlk_SB_MT128x256x16_SN_SU32_SUM3_TT8_16_WG16_16_1_WGM8
    SolutionIndex: 37
    SolutionNameMin: Cijk_Alik_Bjlk_SB_MT32x64x8_SN_SU0_SUM0_TT4_8_WG8_8_1_WGM1
    SolutionIndex: 38
    SolutionNameMin: Cijk_Alik_Bjlk_SB_MT64x64x8_SN_SU0_SUM0_TT8_8_WG8_8_1_WGM1
    SolutionIndex: 39
    SolutionNameMin: Cijk_Alik_Bjlk_SB_MT64x64x8_SN_SU0_SUM0_TT4_8_WG16_8_1_WGM1
    SolutionIndex: 40
    SolutionNameMin: Cijk_Alik_Bjlk_SB_MT128x64x8_SN_SU0_SUM0_TT8_8_WG16_8_1_WGM1
    SolutionIndex: 41
    SolutionNameMin: Cijk_Alik_Bjlk_SB_MT128x128x8_SN_SU0_SUM0_TT8_8_WG16_16_1_WGM1
    SolutionIndex: 42
    SolutionNameMin: Cijk_Alik_Bjlk_SB_MT64x64x16_SN_SU0_SUM0_TT8_8_WG8_8_1_WGM1
    SolutionIndex: 43
    SolutionNameMin: Cijk_Alik_Bjlk_SB_MT128x64x16_SN_SU0_SUM0_TT8_8_WG16_8_1_WGM1
    SolutionIndex: 44
    SolutionNameMin: Cijk_Alik_Bjlk_SB_MT128x128x16_SN_SU0_SUM0_TT8_8_WG16_16_1_WGM1
    SolutionIndex: 45
    SolutionNameMin: Cijk_Alik_Bjlk_SB_MT32x64x8_SN_SU32_SUM3_TT4_8_WG8_8_1_WGM1
    SolutionIndex: 46
    SolutionNameMin: Cijk_Alik_Bjlk_SB_MT64x64x8_SN_SU32_SUM3_TT8_8_WG8_8_1_WGM1
    SolutionIndex: 47
    SolutionNameMin: Cijk_Alik_Bjlk_SB_MT128x64x8_SN_SU32_SUM3_TT8_8_WG16_8_1_WGM1
    SolutionIndex: 48
    SolutionNameMin: Cijk_Alik_Bjlk_SB_MT64x128x8_SN_SU32_SUM3_TT4_8_WG16_16_1_WGM1
    SolutionIndex: 49
    SolutionNameMin: Cijk_Alik_Bjlk_SB_MT128x128x8_SN_SU32_SUM3_TT8_8_WG16_16_1_WGM1
    SolutionIndex: 50
    SolutionNameMin: Cijk_Alik_Bjlk_SB_MT64x64x16_SN_SU32_SUM3_TT8_8_WG8_8_1_WGM1
    SolutionIndex: 51
    SolutionNameMin: Cijk_Alik_Bjlk_SB_MT128x64x16_SN_SU32_SUM3_TT8_8_WG16_8_1_WGM1
    SolutionIndex: 52
    SolutionNameMin: Cijk_Alik_Bjlk_SB_MT128x128x16_SN_SU32_SUM3_TT8_8_WG16_16_1_WGM1
    SolutionIndex: 53
    SolutionNameMin: Cijk_Alik_Bjlk_SB_MT32x64x8_SN_SU0_SUM0_TT4_8_WG8_8_1_WGM4
    SolutionIndex: 54
    SolutionNameMin: Cijk_Alik_Bjlk_SB_MT64x64x8_SN_SU0_SUM0_TT8_8_WG8_8_1_WGM4
    SolutionIndex: 55
    SolutionNameMin: Cijk_Alik_Bjlk_SB_MT64x64x8_SN_SU0_SUM0_TT4_8_WG16_8_1_WGM4
    SolutionIndex: 56
    SolutionNameMin: Cijk_Alik_Bjlk_SB_MT128x64x8_SN_SU0_SUM0_TT8_8_WG16_8_1_WGM4
    SolutionIndex: 57
    SolutionNameMin: Cijk_Alik_Bjlk_SB_MT128x128x8_SN_SU0_SUM0_TT8_8_WG16_16_1_WGM4
    SolutionIndex: 58
    SolutionNameMin: Cijk_Alik_Bjlk_SB_MT64x64x16_SN_SU0_SUM0_TT8_8_WG8_8_1_WGM4
    SolutionIndex: 59
    SolutionNameMin: Cijk_Alik_Bjlk_SB_MT128x64x16_SN_SU0_SUM0_TT8_8_WG16_8_1_WGM4
    SolutionIndex: 60
    SolutionNameMin: Cijk_Alik_Bjlk_SB_MT64x128x16_SN_SU0_SUM0_TT4_8_WG16_16_1_WGM4
    SolutionIndex: 61
    SolutionNameMin: Cijk_Alik_Bjlk_SB_MT32x64x8_SN_SU32_SUM3_TT4_8_WG8_8_1_WGM4
    SolutionIndex: 62
    SolutionNameMin: Cijk_Alik_Bjlk_SB_MT64x64x8_SN_SU32_SUM3_TT8_8_WG8_8_1_WGM4
    SolutionIndex: 63
    SolutionNameMin: Cijk_Alik_Bjlk_SB_MT64x64x8_SN_SU32_SUM3_TT4_8_WG16_8_1_WGM4
    SolutionIndex: 64
    SolutionNameMin: Cijk_Alik_Bjlk_SB_MT128x64x8_SN_SU32_SUM3_TT8_8_WG16_8_1_WGM4
    SolutionIndex: 65
    SolutionNameMin: Cijk_Alik_Bjlk_SB_MT128x128x8_SN_SU32_SUM3_TT8_8_WG16_16_1_WGM4
    SolutionIndex: 66
    SolutionNameMin: Cijk_Alik_Bjlk_SB_MT64x64x16_SN_SU32_SUM3_TT8_8_WG8_8_1_WGM4
    SolutionIndex: 67
    SolutionNameMin: Cijk_Alik_Bjlk_SB_MT128x64x16_SN_SU32_SUM3_TT8_8_WG16_8_1_WGM4
    SolutionIndex: 68
    SolutionNameMin: Cijk_Alik_Bjlk_SB_MT32x64x8_SN_SU0_SUM0_TT4_8_WG8_8_1_WGM8
    SolutionIndex: 69
    SolutionNameMin: Cijk_Alik_Bjlk_SB_MT64x64x8_SN_SU0_SUM0_TT8_8_WG8_8_1_WGM8
    SolutionIndex: 70
    SolutionNameMin: Cijk_Alik_Bjlk_SB_MT64x64x8_SN_SU0_SUM0_TT4_8_WG16_8_1_WGM8
    SolutionIndex: 71
    SolutionNameMin: Cijk_Alik_Bjlk_SB_MT128x64x8_SN_SU0_SUM0_TT8_8_WG16_8_1_WGM8
    SolutionIndex: 72
    SolutionNameMin: Cijk_Alik_Bjlk_SB_MT128x128x8_SN_SU0_SUM0_TT8_8_WG16_16_1_WGM8
    SolutionIndex: 73
    SolutionNameMin: Cijk_Alik_Bjlk_SB_MT128x64x16_SN_SU0_SUM0_TT8_8_WG16_8_1_WGM8
    SolutionIndex: 74
    SolutionNameMin: Cijk_Alik_Bjlk_SB_MT32x64x8_SN_SU32_SUM3_TT4_8_WG8_8_1_WGM8
    SolutionIndex: 75
    SolutionNameMin: Cijk_Alik_Bjlk_SB_MT64x64x8_SN_SU32_SUM3_TT8_8_WG8_8_1_WGM8
    SolutionIndex: 76
    SolutionNameMin: Cijk_Alik_Bjlk_SB_MT64x64x8_SN_SU32_SUM3_TT4_8_WG16_8_1_WGM8
    SolutionIndex: 77
    SolutionNameMin: Cijk_Alik_Bjlk_SB_MT128x64x8_SN_SU32_SUM3_TT8_8_WG16_8_1_WGM8
    SolutionIndex: 78
    SolutionNameMin: Cijk_Alik_Bjlk_SB_MT128x128x8_SN_SU32_SUM3_TT8_8_WG16_16_1_WGM8
    SolutionIndex: 79
    SolutionNameMin: Cijk_Alik_Bjlk_SB_MT64x128x16_SN_SU32_SUM3_TT4_8_WG16_16_1_WGM8
    SolutionIndex: 80
    SolutionNameMin: Cijk_Alik_Bjlk_SB_MT16x16x8_SN_SU0_SUM0_TT2_2_WG8_8_1_WGM1
    SolutionIndex: 81
    SolutionNameMin: Cijk_Alik_Bjlk_SB_MT64x32x8_SN_SU0_SUM0_TT4_4_WG16_8_1_WGM1
    SolutionIndex: 82
    SolutionNameMin: Cijk_Alik_Bjlk_SB_MT32x32x8_SN_SU0_SUM0_TT2_2_WG16_16_1_WGM1
    SolutionIndex: 83
    SolutionNameMin: Cijk_Alik_Bjlk_SB_MT64x64x8_SN_SU0_SUM0_TT4_4_WG16_16_1_WGM1
    SolutionIndex: 84
    SolutionNameMin: Cijk_Alik_Bjlk_SB_MT16x16x16_SN_SU0_SUM0_TT2_2_WG8_8_1_WGM1
    SolutionIndex: 85
    SolutionNameMin: Cijk_Alik_Bjlk_SB_MT32x32x16_SN_SU0_SUM0_TT2_2_WG16_16_1_WGM1
    SolutionIndex: 86
    SolutionNameMin: Cijk_Alik_Bjlk_SB_MT16x16x32_SN_SU0_SUM0_TT2_2_WG8_8_1_WGM1
    SolutionIndex: 87
    SolutionNameMin: Cijk_Alik_Bjlk_SB_MT16x16x8_SN_SU32_SUM3_TT2_2_WG8_8_1_WGM1
    SolutionIndex: 88
    SolutionNameMin: Cijk_Alik_Bjlk_SB_MT32x32x8_SN_SU32_SUM3_TT4_4_WG8_8_1_WGM1
    SolutionIndex: 89
    SolutionNameMin: Cijk_Alik_Bjlk_SB_MT32x16x8_SN_SU32_SUM3_TT2_2_WG16_8_1_WGM1
    SolutionIndex: 90
    SolutionNameMin: Cijk_Alik_Bjlk_SB_MT64x32x8_SN_SU32_SUM3_TT4_4_WG16_8_1_WGM1
    SolutionIndex: 91
    SolutionNameMin: Cijk_Alik_Bjlk_SB_MT32x32x8_SN_SU32_SUM3_TT2_2_WG16_16_1_WGM1
    SolutionIndex: 92
    SolutionNameMin: Cijk_Alik_Bjlk_SB_MT64x64x8_SN_SU32_SUM3_TT4_4_WG16_16_1_WGM1
    SolutionIndex: 93
    SolutionNameMin: Cijk_Alik_Bjlk_SB_MT16x16x16_SN_SU32_SUM3_TT2_2_WG8_8_1_WGM1
    SolutionIndex: 94
    SolutionNameMin: Cijk_Alik_Bjlk_SB_MT16x16x32_SN_SU32_SUM3_TT2_2_WG8_8_1_WGM1
    SolutionIndex: 95
    SolutionNameMin: Cijk_Alik_Bjlk_SB_MT16x16x8_SN_SU0_SUM0_TT2_2_WG8_8_1_WGM4
    SolutionIndex: 96
    SolutionNameMin: Cijk_Alik_Bjlk_SB_MT32x32x8_SN_SU0_SUM0_TT4_4_WG8_8_1_WGM4
    SolutionIndex: 97
    SolutionNameMin: Cijk_Alik_Bjlk_SB_MT64x32x8_SN_SU0_SUM0_TT4_4_WG16_8_1_WGM4
    SolutionIndex: 98
    SolutionNameMin: Cijk_Alik_Bjlk_SB_MT32x32x8_SN_SU0_SUM0_TT2_2_WG16_16_1_WGM4
    SolutionIndex: 99
    SolutionNameMin: Cijk_Alik_Bjlk_SB_MT64x64x8_SN_SU0_SUM0_TT4_4_WG16_16_1_WGM4
    SolutionIndex: 100
    SolutionNameMin: Cijk_Alik_Bjlk_SB_MT16x16x16_SN_SU0_SUM0_TT2_2_WG8_8_1_WGM4
    SolutionIndex: 101
    SolutionNameMin: Cijk_Alik_Bjlk_SB_MT16x16x32_SN_SU0_SUM0_TT2_2_WG8_8_1_WGM4
    SolutionIndex: 102
    SolutionNameMin: Cijk_Alik_Bjlk_SB_MT16x16x8_SN_SU32_SUM3_TT2_2_WG8_8_1_WGM4
    SolutionIndex: 103
    SolutionNameMin: Cijk_Alik_Bjlk_SB_MT32x32x8_SN_SU32_SUM3_TT4_4_WG8_8_1_WGM4
    SolutionIndex: 104
    SolutionNameMin: Cijk_Alik_Bjlk_SB_MT32x16x8_SN_SU32_SUM3_TT2_2_WG16_8_1_WGM4
    SolutionIndex: 105
    SolutionNameMin: Cijk_Alik_Bjlk_SB_MT64x32x8_SN_SU32_SUM3_TT4_4_WG16_8_1_WGM4
    SolutionIndex: 106
    SolutionNameMin: Cijk_Alik_Bjlk_SB_MT32x32x8_SN_SU32_SUM3_TT2_2_WG16_16_1_WGM4
    SolutionIndex: 107
    SolutionNameMin: Cijk_Alik_Bjlk_SB_MT64x64x8_SN_SU32_SUM3_TT4_4_WG16_16_1_WGM4
    SolutionIndex: 108
    SolutionNameMin: Cijk_Alik_Bjlk_SB_MT16x16x8_SN_SU0_SUM0_TT2_2_WG8_8_1_WGM8
    SolutionIndex: 109
    SolutionNameMin: Cijk_Alik_Bjlk_SB_MT32x32x8_SN_SU0_SUM0_TT4_4_WG8_8_1_WGM8
    SolutionIndex: 110
    SolutionNameMin: Cijk_Alik_Bjlk_SB_MT64x32x8_SN_SU0_SUM0_TT4_4_WG16_8_1_WGM8
    SolutionIndex: 111
    SolutionNameMin: Cijk_Alik_Bjlk_SB_MT16x16x16_SN_SU0_SUM0_TT2_2_WG8_8_1_WGM8
    SolutionIndex: 112
    SolutionNameMin: Cijk_Alik_Bjlk_SB_MT16x16x32_SN_SU0_SUM0_TT2_2_WG8_8_1_WGM8
    SolutionIndex: 113
    SolutionNameMin: Cijk_Alik_Bjlk_SB_MT16x16x8_SN_SU32_SUM3_TT2_2_WG8_8_1_WGM8
    SolutionIndex: 114
    SolutionNameMin: Cijk_Alik_Bjlk_SB_MT32x32x8_SN_SU32_SUM3_TT4_4_WG8_8_1_WGM8
    SolutionIndex: 115
    SolutionNameMin: Cijk_Alik_Bjlk_SB_MT32x16x8_SN_SU32_SUM3_TT2_2_WG16_8_1_WGM8
    SolutionIndex: 116
    SolutionNameMin: Cijk_Alik_Bjlk_SB_MT64x32x8_SN_SU32_SUM3_TT4_4_WG16_8_1_WGM8
    SolutionIndex: 117
    SolutionNameMin: Cijk_Alik_Bjlk_SB_MT64x64x8_SN_SU32_SUM3_TT4_4_WG16_16_1_WGM8
    SolutionIndex: 118
    SolutionNameMin: Cijk_Alik_Bjlk_SB_MT16x16x16_SN_SU32_SUM3_TT2_2_WG8_8_1_WGM8
    SolutionIndex: 119
    SolutionNameMin: Cijk_Alik_Bjlk_SB_MT32x8x8_SN_SU32_SUM3_TT2_2_WG16_4_1_WGM1
    SolutionIndex: 120
    SolutionNameMin: Cijk_Alik_Bjlk_SB_MT64x8x16_SN_SU32_SUM3_TT4_1_WG16_8_1_WGM1
    SolutionIndex: 121
    SolutionNameMin: Cijk_Alik_Bjlk_SB_MT32x8x8_SN_SU32_SUM3_TT2_2_WG16_4_1_WGM4
    SolutionIndex: 122
    SolutionNameMin: Cijk_Alik_Bjlk_SB_MT32x8x8_SN_SU32_SUM3_TT2_2_WG16_4_1_WGM8
    SolutionIndex: 123
    SolutionNameMin: Cijk_Alik_Bjlk_SB_MT8x32x8_SN_SU0_SUM0_TT1_4_WG8_8_1_WGM1
    SolutionIndex: 124
    SolutionNameMin: Cijk_Alik_Bjlk_SB_MT8x32x16_SN_SU0_SUM0_TT1_4_WG8_8_1_WGM1
    SolutionIndex: 125
    SolutionNameMin: Cijk_Alik_Bjlk_SB_MT16x32x16_SN_SU0_SUM0_TT1_4_WG16_8_1_WGM1
    SolutionIndex: 126
    SolutionNameMin: Cijk_Alik_Bjlk_SB_MT8x32x32_SN_SU0_SUM0_TT1_4_WG8_8_1_WGM1
    SolutionIndex: 127
    SolutionNameMin: Cijk_Alik_Bjlk_SB_MT8x32x16_SN_SU32_SUM3_TT1_4_WG8_8_1_WGM1
    SolutionIndex: 128
    SolutionNameMin: Cijk_Alik_Bjlk_SB_MT8x32x8_SN_SU0_SUM0_TT1_4_WG8_8_1_WGM4
    SolutionIndex: 129
    SolutionNameMin: Cijk_Alik_Bjlk_SB_MT8x32x16_SN_SU0_SUM0_TT1_4_WG8_8_1_WGM4
    SolutionIndex: 130
    SolutionNameMin: Cijk_Alik_Bjlk_SB_MT8x32x32_SN_SU0_SUM0_TT1_4_WG8_8_1_WGM4
    SolutionIndex: 131
    SolutionNameMin: Cijk_Alik_Bjlk_SB_MT8x32x16_SN_SU32_SUM3_TT1_4_WG8_8_1_WGM4
    SolutionIndex: 132
    SolutionNameMin: Cijk_Alik_Bjlk_SB_MT8x32x16_SN_SU0_SUM0_TT1_4_WG8_8_1_WGM8
    SolutionIndex: 133
    SolutionNameMin: Cijk_Alik_Bjlk_SB_MT8x32x32_SN_SU0_SUM0_TT1_4_WG8_8_1_WGM8
- - - [2944, 4288, 1, 1280, 2944, 2944, 1280, 4288]
    - [16, 19791.0]
  - - [2368, 5888, 1, 256, 2368, 2368, 256, 5888]
    - [16, 18653.0]
  - - [5888, 1024, 1, 1280, 5888, 5888, 1280, 1024]
    - [16, 18714.0]
  - - [5888, 1856, 1, 3328, 5888, 5888, 3328, 1856]
    - [34, 18995.0]
  - - [5056, 704, 1, 256, 5056, 5056, 256, 704]
    - [31, 15694.0]
  - - [5888, 2944, 1, 3328, 5888, 5888, 3328, 2944]
    - [16, 20187.0]
  - - [1856, 4288, 1, 256, 1856, 1856, 256, 4288]
    - [19, 17089.0]
  - - [1024, 5056, 1, 128, 1024, 1024, 128, 5056]
    - [6, 17036.0]
  - - [5056, 5056, 1, 3328, 5056, 5056, 3328, 5056]
    - [28, 19959.0]
  - - [1408, 5888, 1, 1280, 1408, 1408, 1280, 5888]
    - [16, 19010.0]
  - - [1024, 3584, 1, 3328, 1024, 1024, 3328, 3584]
    - [16, 17763.0]
  - - [5888, 1408, 1, 1280, 5888, 5888, 1280, 1408]
    - [28, 19080.0]
  - - [1024, 2368, 1, 256, 1024, 1024, 256, 2368]
    - [6, 15327.0]
  - - [1408, 1856, 1, 1280, 1408, 1408, 1280, 1856]
    - [28, 16931.0]
  - - [5056, 5056, 1, 1280, 5056, 5056, 1280, 5056]
    - [16, 19839.0]
  - - [448, 5056, 1, 256, 448, 448, 256, 5056]
    - [6, 14226.0]
  - - [1856, 1408, 1, 128, 1856, 1856, 128, 1408]
    - [14, 14671.0]
  - - [6784, 256, 1, 3328, 6784, 6784, 3328, 256]
    - [32, 18194.0]
  - - [6784, 4288, 1, 3328, 6784, 6784, 3328, 4288]
    - [28, 20095.0]
  - - [4288, 448, 1, 256, 4288, 4288, 256, 448]
    - [30, 13955.0]
  - - [1856, 2368, 1, 3328, 1856, 1856, 3328, 2368]
    - [16, 18635.0]
  - - [4288, 2944, 1, 1280, 4288, 4288, 1280, 2944]
    - [16, 19853.0]
  - - [704, 5056, 1, 1280, 704, 704, 1280, 5056]
    - [3, 16912.0]
  - - [2368, 704, 1, 3328, 2368, 2368, 3328, 704]
    - [9, 15557.0]
  - - [256, 5888, 1, 256, 256, 256, 256, 5888]
    - [14, 14773.0]
  - - [1856, 4288, 1, 3328, 1856, 1856, 3328, 4288]
    - [3, 18344.0]
  - - [5888, 1024, 1, 256, 5888, 5888, 256, 1024]
    - [28, 17869.0]
  - - [448, 5056, 1, 3328, 448, 448, 3328, 5056]
    - [22, 15034.0]
  - - [1408, 2944, 1, 256, 1408, 1408, 256, 2944]
    - [28, 16743.0]
  - - [6784, 5056, 1, 3328, 6784, 6784, 3328, 5056]
    - [16, 20423.0]
  - - [5056, 5056, 1, 256, 5056, 5056, 256, 5056]
    - [10, 19227.0]
  - - [1408, 6784, 1, 128, 1408, 1408, 128, 6784]
    - [13, 18006.0]
  - - [704, 5056, 1, 128, 704, 704, 128, 5056]
    - [26, 14879.0]
  - - [2368, 2944, 1, 1280, 2368, 2368, 1280, 2944]
    - [28, 18319.0]
  - - [6784, 6784, 1, 1280, 6784, 6784, 1280, 6784]
    - [16, 20512.0]
  - - [1408, 4288, 1, 1280, 1408, 1408, 1280, 4288]
    - [16, 18577.0]
  - - [3584, 4288, 1, 1280, 3584, 3584, 1280, 4288]
    - [16, 19789.0]
  - - [2368, 704, 1, 1280, 2368, 2368, 1280, 704]
    - [9, 15216.0]
  - - [5056, 4288, 1, 3328, 5056, 5056, 3328, 4288]
    - [28, 19972.0]
  - - [3584, 2368, 1, 3328, 3584, 3584, 3328, 2368]
    - [16, 19530.0]
  - - [6784, 448, 1, 1280, 6784, 6784, 1280, 448]
    - [16, 16551.0]
  - - [1408, 2944, 1, 128, 1408, 1408, 128, 2944]
    - [26, 16216.0]
  - - [4288, 2944, 1, 256, 4288, 4288, 256, 2944]
    - [7, 19017.0]
  - - [5888, 704, 1, 1280, 5888, 5888, 1280, 704]
    - [16, 17324.0]
  - - [448, 5888, 1, 128, 448, 448, 128, 5888]
    - [6, 13582.0]
  - - [5056, 2368, 1, 1280, 5056, 5056, 1280, 2368]
    - [28, 18880.0]
  - - [448, 3584, 1, 1280, 448, 448, 1280, 3584]
    - [30, 13981.0]
  - - [6784, 5888, 1, 256, 6784, 6784, 256, 5888]
    - [28, 20100.0]
  - - [5888, 2944, 1, 128, 5888, 5888, 128, 2944]
    - [25, 18636.0]
  - - [1024, 1408, 1, 256, 1024, 1024, 256, 1408]
    - [6, 15290.0]
  - - [2368, 2368, 1, 3328, 2368, 2368, 3328, 2368]
    - [31, 17552.0]
  - - [1856, 6784, 1, 128, 1856, 1856, 128, 6784]
    - [13, 17683.0]
  - - [5056, 704, 1, 3328, 5056, 5056, 3328, 704]
    - [28, 17138.0]
  - - [1408, 1856, 1, 256, 1408, 1408, 256, 1856]
    - [33, 15667.0]
  - - [2368, 5056, 1, 256, 2368, 2368, 256, 5056]
    - [10, 18153.0]
  - - [5888, 1856, 1, 256, 5888, 5888, 256, 1856]
    - [10, 18256.0]
  - - [704, 5888, 1, 256, 704, 704, 256, 5888]
    - [31, 16265.0]
  - - [2944, 6784, 1, 3328, 2944, 2944, 3328, 6784]
    - [28, 20548.0]
  - - [3584, 704, 1, 3328, 3584, 3584, 3328, 704]
    - [10, 16622.0]
  - - [448, 4288, 1, 256, 448, 448, 256, 4288]
    - [32, 14131.0]
  - - [704, 2368, 1, 1280, 704, 704, 1280, 2368]
    - [30, 13776.0]
  - - [1856, 2368, 1, 1280, 1856, 1856, 1280, 2368]
    - [16, 18363.0]
  - - [1856, 4288, 1, 1280, 1856, 1856, 1280, 4288]
    - [28, 18273.0]
  - - [704, 2944, 1, 128, 704, 704, 128, 2944]
    - [2, 14171.0]
  - - [1408, 1024, 1, 1280, 1408, 1408, 1280, 1024]
    - [33, 15650.0]
  - - [704, 6784, 1, 256, 704, 704, 256, 6784]
    - [7, 16721.0]
  - - [6784, 704, 1, 256, 6784, 6784, 256, 704]
    - [10, 16558.0]
  - - [5056, 1408, 1, 128, 5056, 5056, 128, 1408]
    - [1, 17019.0]
  - - [3584, 4288, 1, 3328, 3584, 3584, 3328, 4288]
    - [16, 19862.0]
  - - [5888, 1856, 1, 1280, 5888, 5888, 1280, 1856]
    - [28, 18866.0]
  - - [5056, 1024, 1, 3328, 5056, 5056, 3328, 1024]
    - [34, 19563.0]
  - - [1024, 4288, 1, 128, 1024, 1024, 128, 4288]
    - [6, 16939.0]
  - - [2368, 3584, 1, 1280, 2368, 2368, 1280, 3584]
    - [28, 19395.0]
  - - [2368, 6784, 1, 1280, 2368, 2368, 1280, 6784]
    - [16, 19916.0]
  - - [2944, 3584, 1, 3328, 2944, 2944, 3328, 3584]
    - [16, 20316.0]
  - - [6784, 2944, 1, 256, 6784, 6784, 256, 2944]
    - [10, 19836.0]
  - - [4288, 2368, 1, 3328, 4288, 4288, 3328, 2368]
    - [16, 19535.0]
  - - [1856, 2368, 1, 256, 1856, 1856, 256, 2368]
    - [32, 16868.0]
  - - [3584, 6784, 1, 3328, 3584, 3584, 3328, 6784]
    - [17, 20348.0]
  - - [1024, 5888, 1, 3328, 1024, 1024, 3328, 5888]
    - [28, 18819.0]
  - - [5056, 4288, 1, 1280, 5056, 5056, 1280, 4288]
    - [16, 19868.0]
  - - [1408, 5056, 1, 1280, 1408, 1408, 1280, 5056]
    - [34, 18725.0]
  - - [2944, 5888, 1, 128, 2944, 2944, 128, 5888]
    - [31, 18974.0]
  - - [704, 5888, 1, 1280, 704, 704, 1280, 5888]
    - [17, 17458.0]
  - - [2368, 3584, 1, 128, 2368, 2368, 128, 3584]
    - [1, 17612.0]
  - - [6784, 5888, 1, 3328, 6784, 6784, 3328, 5888]
    - [16, 20674.0]
  - - [1024, 5056, 1, 1280, 1024, 1024, 1280, 5056]
    - [28, 19153.0]
  - - [4288, 1024, 1, 256, 4288, 4288, 256, 1024]
    - [8, 17172.0]
  - - [2944, 2368, 1, 128, 2944, 2944, 128, 2368]
    - [30, 16990.0]
  - - [5888, 448, 1, 1280, 5888, 5888, 1280, 448]
    - [15, 15138.0]
  - - [704, 5888, 1, 3328, 704, 704, 3328, 5888]
    - [5, 17792.0]
  - - [3584, 2944, 1, 256, 3584, 3584, 256, 2944]
    - [34, 19497.0]
  - - [2368, 1024, 1, 3328, 2368, 2368, 3328, 1024]
    - [34, 16059.0]
  - - [1408, 5056, 1, 3328, 1408, 1408, 3328, 5056]
    - [28, 18877.0]
  - - [1856, 1856, 1, 3328, 1856, 1856, 3328, 1856]
    - [16, 16617.0]
  - - [2368, 2368, 1, 256, 2368, 2368, 256, 2368]
    - [22, 16595.0]
  - - [4288, 4288, 1, 1280, 4288, 4288, 1280, 4288]
    - [16, 19433.0]
  - - [1408, 4288, 1, 256, 1408, 1408, 256, 4288]
    - [31, 17484.0]
  - - [5888, 448, 1, 128, 5888, 5888, 128, 448]
    - [30, 14234.0]
  - - [704, 6784, 1, 3328, 704, 704, 3328, 6784]
    - [3, 18065.0]
  - - [5888, 5888, 1, 1280, 5888, 5888, 1280, 5888]
    - [16, 20579.0]
  - - [5056, 1024, 1, 1280, 5056, 5056, 1280, 1024]
    - [16, 19173.0]
  - - [448, 5888, 1, 3328, 448, 448, 3328, 5888]
    - [5, 15019.0]
  - - [1024, 2944, 1, 1280, 1024, 1024, 1280, 2944]
    - [3, 16792.0]
  - - [5056, 5888, 1, 1280, 5056, 5056, 1280, 5888]
    - [28, 20065.0]
  - - [4288, 5888, 1, 128, 4288, 4288, 128, 5888]
    - [31, 18715.0]
  - - [1408, 3584, 1, 128, 1408, 1408, 128, 3584]
    - [26, 17133.0]
  - - [448, 3584, 1, 128, 448, 448, 128, 3584]
    - [0, 12190.0]
  - - [5888, 2944, 1, 1280, 5888, 5888, 1280, 2944]
    - [28, 20090.0]
  - - [2368, 5888, 1, 128, 2368, 2368, 128, 5888]
    - [31, 17811.0]
  - - [3584, 5888, 1, 256, 3584, 3584, 256, 5888]
    - [28, 19955.0]
  - - [2368, 704, 1, 128, 2368, 2368, 128, 704]
    - [6, 13471.0]
  - - [3584, 2944, 1, 1280, 3584, 3584, 1280, 2944]
    - [28, 20196.0]
  - - [3584, 2368, 1, 128, 3584, 3584, 128, 2368]
    - [26, 17309.0]
  - - [5056, 704, 1, 128, 5056, 5056, 128, 704]
    - [30, 15382.0]
  - - [5056, 1408, 1, 3328, 5056, 5056, 3328, 1408]
    - [10, 18869.0]
  - - [6784, 1024, 1, 3328, 6784, 6784, 3328, 1024]
    - [28, 19893.0]
  - - [6784, 2944, 1, 3328, 6784, 6784, 3328, 2944]
    - [28, 20545.0]
  - - [2944, 5056, 1, 3328, 2944, 2944, 3328, 5056]
    - [29, 20041.0]
  - - [1856, 1856, 1, 256, 1856, 1856, 256, 1856]
    - [32, 15008.0]
  - - [1024, 5888, 1, 128, 1024, 1024, 128, 5888]
    - [0, 17173.0]
  - - [6784, 2368, 1, 1280, 6784, 6784, 1280, 2368]
    - [28, 19900.0]
  - - [4288, 5888, 1, 1280, 4288, 4288, 1280, 5888]
    - [28, 20050.0]
  - - [4288, 4288, 1, 256, 4288, 4288, 256, 4288]
    - [7, 18731.0]
  - - [4288, 1856, 1, 1280, 4288, 4288, 1280, 1856]
    - [28, 18226.0]
  - - [1856, 2944, 1, 3328, 1856, 1856, 3328, 2944]
    - [3, 18676.0]
  - - [256, 6784, 1, 3328, 256, 256, 3328, 6784]
    - [2, 18403.0]
  - - [256, 5056, 1, 128, 256, 256, 128, 5056]
    - [24, 12984.0]
  - - [5056, 1024, 1, 256, 5056, 5056, 256, 1024]
    - [10, 18077.0]
  - - [5056, 1856, 1, 3328, 5056, 5056, 3328, 1856]
    - [16, 19112.0]
  - - [1856, 1408, 1, 256, 1856, 1856, 256, 1408]
    - [32, 15522.0]
  - - [4288, 1408, 1, 128, 4288, 4288, 128, 1408]
    - [8, 16662.0]
  - - [4288, 5056, 1, 256, 4288, 4288, 256, 5056]
    - [16, 19310.0]
  - - [5056, 256, 1, 3328, 5056, 5056, 3328, 256]
    - [33, 14229.0]
  - - [1024, 5888, 1, 1280, 1024, 1024, 1280, 5888]
    - [3, 18746.0]
  - - [6784, 2368, 1, 128, 6784, 6784, 128, 2368]
    - [7, 18094.0]
  - - [5056, 3584, 1, 256, 5056, 5056, 256, 3584]
    - [10, 19085.0]
  - - [1856, 1024, 1, 1280, 1856, 1856, 1280, 1024]
    - [17, 15497.0]
  - - [6784, 4288, 1, 1280, 6784, 6784, 1280, 4288]
    - [16, 20017.0]
  - - [1856, 1856, 1, 1280, 1856, 1856, 1280, 1856]
    - [16, 16312.0]
  - - [6784, 2944, 1, 128, 6784, 6784, 128, 2944]
    - [34, 19218.0]
  - - [5888, 1856, 1, 128, 5888, 5888, 128, 1856]
    - [16, 17351.0]
  - - [2368, 1024, 1, 128, 2368, 2368, 128, 1024]
    - [18, 13943.0]
  - - [5056, 3584, 1, 128, 5056, 5056, 128, 3584]
    - [3, 18485.0]
  - - [5888, 5888, 1, 3328, 5888, 5888, 3328, 5888]
    - [28, 20653.0]
  - - [6784, 1024, 1, 256, 6784, 6784, 256, 1024]
    - [28, 18467.0]
  - - [2944, 2368, 1, 256, 2944, 2944, 256, 2368]
    - [28, 17459.0]
  - - [5056, 5888, 1, 3328, 5056, 5056, 3328, 5888]
    - [16, 20122.0]
  - - [1856, 1024, 1, 256, 1856, 1856, 256, 1024]
    - [30, 14310.0]
  - - [3584, 448, 1, 1280, 3584, 3584, 1280, 448]
    - [33, 14861.0]
  - - [448, 5888, 1, 256, 448, 448, 256, 5888]
    - [18, 14222.0]
  - - [1408, 6784, 1, 3328, 1408, 1408, 3328, 6784]
    - [28, 19501.0]
  - - [4288, 704, 1, 128, 4288, 4288, 128, 704]
    - [18, 14343.0]
  - - [5056, 2944, 1, 256, 5056, 5056, 256, 2944]
    - [16, 19051.0]
  - - [6784, 5888, 1, 128, 6784, 6784, 128, 5888]
    - [28, 19221.0]
  - - [2368, 1856, 1, 256, 2368, 2368, 256, 1856]
    - [32, 16778.0]
  - - [1408, 3584, 1, 3328, 1408, 1408, 3328, 3584]
    - [16, 19155.0]
  - - [2368, 6784, 1, 256, 2368, 2368, 256, 6784]
    - [28, 19001.0]
  - - [5056, 1408, 1, 1280, 5056, 5056, 1280, 1408]
    - [10, 18707.0]
  - - [5056, 4288, 1, 128, 5056, 5056, 128, 4288]
    - [28, 18595.0]
  - - [1408, 1856, 1, 128, 1408, 1408, 128, 1856]
    - [27, 14933.0]
  - - [1408, 5888, 1, 3328, 1408, 1408, 3328, 5888]
    - [28, 19185.0]
  - - [6784, 6784, 1, 256, 6784, 6784, 256, 6784]
    - [28, 20026.0]
  - - [4288, 2368, 1, 128, 4288, 4288, 128, 2368]
    - [26, 17371.0]
  - - [1856, 4288, 1, 128, 1856, 1856, 128, 4288]
    - [31, 16548.0]
  - - [2368, 2944, 1, 256, 2368, 2368, 256, 2944]
    - [3, 17597.0]
  - - [3584, 1856, 1, 1280, 3584, 3584, 1280, 1856]
    - [28, 18868.0]
  - - [6784, 6784, 1, 128, 6784, 6784, 128, 6784]
    - [16, 19215.0]
  - - [5888, 5056, 1, 256, 5888, 5888, 256, 5056]
    - [10, 19500.0]
  - - [3584, 448, 1, 256, 3584, 3584, 256, 448]
    - [30, 14494.0]
  - - [448, 4288, 1, 128, 448, 448, 128, 4288]
    - [24, 12887.0]
  - - [2944, 4288, 1, 3328, 2944, 2944, 3328, 4288]
    - [17, 19951.0]
  - - [256, 6784, 1, 256, 256, 256, 256, 6784]
    - [35, 16602.0]
  - - [1408, 4288, 1, 128, 1408, 1408, 128, 4288]
    - [30, 16800.0]
  - - [2944, 704, 1, 3328, 2944, 2944, 3328, 704]
    - [29, 17370.0]
  - - [3584, 3584, 1, 256, 3584, 3584, 256, 3584]
    - [10, 19634.0]
  - - [3584, 5056, 1, 256, 3584, 3584, 256, 5056]
    - [16, 19209.0]
  - - [2944, 2368, 1, 1280, 2944, 2944, 1280, 2368]
    - [28, 18383.0]
  - - [1408, 3584, 1, 256, 1408, 1408, 256, 3584]
    - [28, 18108.0]
  - - [6784, 3584, 1, 256, 6784, 6784, 256, 3584]
    - [28, 19876.0]
  - - [5056, 2368, 1, 128, 5056, 5056, 128, 2368]
    - [19, 17570.0]
  - - [2944, 2944, 1, 3328, 2944, 2944, 3328, 2944]
    - [28, 19970.0]
  - - [5056, 6784, 1, 256, 5056, 5056, 256, 6784]
    - [22, 19762.0]
  - - [1856, 3584, 1, 128, 1856, 1856, 128, 3584]
    - [26, 16820.0]
  - - [6784, 448, 1, 256, 6784, 6784, 256, 448]
    - [19, 15232.0]
  - - [3584, 6784, 1, 128, 3584, 3584, 128, 6784]
    - [28, 19266.0]
  - - [5056, 1856, 1, 256, 5056, 5056, 256, 1856]
    - [19, 18183.0]
  - - [1024, 1856, 1, 256, 1024, 1024, 256, 1856]
    - [6, 15119.0]
  - - [1408, 6784, 1, 1280, 1408, 1408, 1280, 6784]
    - [3, 19386.0]
  - - [3584, 3584, 1, 1280, 3584, 3584, 1280, 3584]
    - [17, 20277.0]
  - - [5888, 5888, 1, 128, 5888, 5888, 128, 5888]
    - [34, 19339.0]
  - - [5056, 5888, 1, 128, 5056, 5056, 128, 5888]
    - [19, 18845.0]
  - - [5056, 2368, 1, 3328, 5056, 5056, 3328, 2368]
    - [28, 18969.0]
  - - [2944, 4288, 1, 256, 2944, 2944, 256, 4288]
    - [28, 18822.0]
  - - [1408, 3584, 1, 1280, 1408, 1408, 1280, 3584]
    - [16, 18990.0]
  - - [2368, 6784, 1, 3328, 2368, 2368, 3328, 6784]
    - [16, 20031.0]
  - - [1856, 1408, 1, 1280, 1856, 1856, 1280, 1408]
    - [31, 16767.0]
  - - [6784, 704, 1, 128, 6784, 6784, 128, 704]
    - [30, 15780.0]
  - - [1408, 5888, 1, 256, 1408, 1408, 256, 5888]
    - [22, 18474.0]
  - - [704, 2944, 1, 1280, 704, 704, 1280, 2944]
    - [5, 16740.0]
  - - [1856, 2368, 1, 128, 1856, 1856, 128, 2368]
    - [2, 15955.0]
  - - [3584, 704, 1, 1280, 3584, 3584, 1280, 704]
    - [16, 16265.0]
  - - [2944, 6784, 1, 128, 2944, 2944, 128, 6784]
    - [28, 19282.0]
  - - [3584, 448, 1, 3328, 3584, 3584, 3328, 448]
    - [33, 15027.0]
  - - [704, 2368, 1, 3328, 704, 704, 3328, 2368]
    - [5, 14013.0]
  - - [256, 5888, 1, 128, 256, 256, 128, 5888]
    - [26, 13492.0]
  - - [2944, 2944, 1, 1280, 2944, 2944, 1280, 2944]
    - [28, 19891.0]
  - - [5888, 2368, 1, 256, 5888, 5888, 256, 2368]
    - [34, 18760.0]
  - - [6784, 704, 1, 3328, 6784, 6784, 3328, 704]
    - [16, 18059.0]
  - - [5888, 4288, 1, 128, 5888, 5888, 128, 4288]
    - [31, 18567.0]
  - - [1408, 2944, 1, 3328, 1408, 1408, 3328, 2944]
    - [17, 17767.0]
  - - [3584, 704, 1, 128, 3584, 3584, 128, 704]
    - [30, 14966.0]
  - - [5056, 5056, 1, 128, 5056, 5056, 128, 5056]
    - [19, 18459.0]
  - - [448, 5056, 1, 128, 448, 448, 128, 5056]
    - [0, 12909.0]
  - - [1408, 5056, 1, 128, 1408, 1408, 128, 5056]
    - [31, 17173.0]
  - - [2944, 3584, 1, 128, 2944, 2944, 128, 3584]
    - [16, 18727.0]
  - - [3584, 2368, 1, 256, 3584, 3584, 256, 2368]
    - [28, 18428.0]
  - - [5888, 5056, 1, 1280, 5888, 5888, 1280, 5056]
    - [16, 20061.0]
  - - [2368, 5056, 1, 128, 2368, 2368, 128, 5056]
    - [1, 17215.0]
  - - [3584, 3584, 1, 3328, 3584, 3584, 3328, 3584]
    - [29, 20409.0]
  - - [5888, 6784, 1, 256, 5888, 5888, 256, 6784]
    - [28, 20051.0]
  - - [4288, 2944, 1, 3328, 4288, 4288, 3328, 2944]
    - [28, 19963.0]
  - - [4288, 704, 1, 1280, 4288, 4288, 1280, 704]
    - [31, 16483.0]
  - - [256, 5056, 1, 1280, 256, 256, 1280, 5056]
    - [12, 15155.0]
  - - [2944, 5888, 1, 3328, 2944, 2944, 3328, 5888]
    - [17, 20278.0]
  - - [6784, 5888, 1, 1280, 6784, 6784, 1280, 5888]
    - [16, 20601.0]
  - - [5888, 4288, 1, 1280, 5888, 5888, 1280, 4288]
    - [28, 20043.0]
  - - [5888, 3584, 1, 128, 5888, 5888, 128, 3584]
    - [31, 18900.0]
  - - [1856, 1856, 1, 128, 1856, 1856, 128, 1856]
    - [6, 14766.0]
  - - [3584, 1024, 1, 3328, 3584, 3584, 3328, 1024]
    - [34, 17760.0]
  - - [704, 3584, 1, 128, 704, 704, 128, 3584]
    - [32, 14054.0]
  - - [5888, 448, 1, 3328, 5888, 5888, 3328, 448]
    - [9, 15236.0]
  - - [2368, 4288, 1, 1280, 2368, 2368, 1280, 4288]
    - [16, 19385.0]
  - - [4288, 2944, 1, 128, 4288, 4288, 128, 2944]
    - [10, 18119.0]
  - - [1024, 6784, 1, 3328, 1024, 1024, 3328, 6784]
    - [17, 19935.0]
  - - [5056, 2944, 1, 3328, 5056, 5056, 3328, 2944]
    - [28, 19986.0]
  - - [2944, 3584, 1, 256, 2944, 2944, 256, 3584]
    - [28, 19305.0]
  - - [1408, 1408, 1, 3328, 1408, 1408, 3328, 1408]
    - [29, 16650.0]
  - - [3584, 3584, 1, 128, 3584, 3584, 128, 3584]
    - [34, 18684.0]
  - - [3584, 704, 1, 256, 3584, 3584, 256, 704]
    - [33, 15227.0]
  - - [3584, 1408, 1, 3328, 3584, 3584, 3328, 1408]
    - [16, 19138.0]
  - - [704, 3584, 1, 1280, 704, 704, 1280, 3584]
    - [13, 16452.0]
  - - [2944, 6784, 1, 1280, 2944, 2944, 1280, 6784]
    - [16, 20457.0]
  - - [1856, 6784, 1, 256, 1856, 1856, 256, 6784]
    - [31, 18287.0]
  - - [4288, 448, 1, 3328, 4288, 4288, 3328, 448]
    - [29, 15945.0]
  - - [6784, 4288, 1, 128, 6784, 6784, 128, 4288]
    - [31, 18836.0]
  - - [6784, 704, 1, 1280, 6784, 6784, 1280, 704]
    - [16, 17722.0]
  - - [5888, 1024, 1, 3328, 5888, 5888, 3328, 1024]
    - [34, 18843.0]
  - - [704, 6784, 1, 1280, 704, 704, 1280, 6784]
    - [3, 17822.0]
  - - [1856, 5056, 1, 3328, 1856, 1856, 3328, 5056]
    - [3, 19135.0]
  - - [1024, 3584, 1, 128, 1024, 1024, 128, 3584]
    - [0, 16199.0]
  - - [1024, 1408, 1, 128, 1024, 1024, 128, 1408]
    - [6, 14395.0]
  - - [2368, 2944, 1, 128, 2368, 2368, 128, 2944]
    - [1, 16723.0]
  - - [5056, 2944, 1, 128, 5056, 5056, 128, 2944]
    - [19, 18469.0]
  - - [5888, 5056, 1, 3328, 5888, 5888, 3328, 5056]
    - [16, 20147.0]
  - - [1408, 2368, 1, 128, 1408, 1408, 128, 2368]
    - [14, 15496.0]
  - - [5888, 2368, 1, 128, 5888, 5888, 128, 2368]
    - [25, 17922.0]
  - - [3584, 6784, 1, 1280, 3584, 3584, 1280, 6784]
    - [16, 20252.0]
  - - [1856, 5888, 1, 256, 1856, 1856, 256, 5888]
    - [7, 18019.0]
  - - [4288, 4288, 1, 3328, 4288, 4288, 3328, 4288]
    - [16, 19535.0]
  - - [4288, 1408, 1, 1280, 4288, 4288, 1280, 1408]
    - [28, 18545.0]
  - - [3584, 5056, 1, 128, 3584, 3584, 128, 5056]
    - [22, 18353.0]
  - - [4288, 2368, 1, 256, 4288, 4288, 256, 2368]
    - [28, 18586.0]
  - - [2944, 5056, 1, 1280, 2944, 2944, 1280, 5056]
    - [29, 19894.0]
  - - [448, 6784, 1, 256, 448, 448, 256, 6784]
    - [7, 15648.0]
  - - [6784, 2368, 1, 3328, 6784, 6784, 3328, 2368]
    - [16, 20008.0]
  - - [4288, 1856, 1, 3328, 4288, 4288, 3328, 1856]
    - [28, 18374.0]
  - - [3584, 448, 1, 128, 3584, 3584, 128, 448]
    - [30, 13665.0]
  - - [3584, 1024, 1, 1280, 3584, 3584, 1280, 1024]
    - [16, 17639.0]
  - - [1856, 5056, 1, 256, 1856, 1856, 256, 5056]
    - [28, 18125.0]
  - - [1024, 4288, 1, 256, 1024, 1024, 256, 4288]
    - [1, 16883.0]
  - - [5888, 3584, 1, 3328, 5888, 5888, 3328, 3584]
    - [17, 20517.0]
  - - [5056, 3584, 1, 3328, 5056, 5056, 3328, 3584]
    - [28, 19846.0]
  - - [2368, 1408, 1, 1280, 2368, 2368, 1280, 1408]
    - [16, 18033.0]
  - - [5056, 2944, 1, 1280, 5056, 5056, 1280, 2944]
    - [28, 19868.0]
  - - [1024, 6784, 1, 256, 1024, 1024, 256, 6784]
    - [3, 18984.0]
  - - [2944, 1408, 1, 128, 2944, 2944, 128, 1408]
    - [26, 16186.0]
  - - [5056, 6784, 1, 3328, 5056, 5056, 3328, 6784]
    - [28, 20424.0]
  - - [3584, 4288, 1, 256, 3584, 3584, 256, 4288]
    - [34, 18904.0]
  - - [1856, 6784, 1, 3328, 1856, 1856, 3328, 6784]
    - [3, 19105.0]
  - - [5888, 4288, 1, 256, 5888, 5888, 256, 4288]
    - [10, 19406.0]
  - - [5056, 1408, 1, 256, 5056, 5056, 256, 1408]
    - [10, 17742.0]
  - - [3584, 1024, 1, 256, 3584, 3584, 256, 1024]
    - [31, 16664.0]
  - - [5888, 5888, 1, 256, 5888, 5888, 256, 5888]
    - [28, 20018.0]
  - - [4288, 1024, 1, 1280, 4288, 4288, 1280, 1024]
    - [16, 18164.0]
  - - [448, 6784, 1, 3328, 448, 448, 3328, 6784]
    - [36, 17155.0]
  - - [2944, 1408, 1, 1280, 2944, 2944, 1280, 1408]
    - [28, 17519.0]
  - - [2944, 1856, 1, 3328, 2944, 2944, 3328, 1856]
    - [3, 18657.0]
  - - [2944, 2944, 1, 128, 2944, 2944, 128, 2944]
    - [16, 18259.0]
  - - [3584, 5888, 1, 1280, 3584, 3584, 1280, 5888]
    - [17, 20444.0]
  - - [6784, 1856, 1, 1280, 6784, 6784, 1280, 1856]
    - [28, 18981.0]
  - - [2944, 5056, 1, 256, 2944, 2944, 256, 5056]
    - [16, 19237.0]
  - - [5888, 256, 1, 3328, 5888, 5888, 3328, 256]
    - [34, 16072.0]
  - - [1856, 5888, 1, 3328, 1856, 1856, 3328, 5888]
    - [29, 19067.0]
  - - [3584, 1408, 1, 256, 3584, 3584, 256, 1408]
    - [34, 18012.0]
  - - [704, 3584, 1, 3328, 704, 704, 3328, 3584]
    - [28, 16692.0]
  - - [5056, 448, 1, 1280, 5056, 5056, 1280, 448]
    - [33, 15871.0]
  - - [3584, 1856, 1, 3328, 3584, 3584, 3328, 1856]
    - [28, 19055.0]
  - - [2944, 1024, 1, 256, 2944, 2944, 256, 1024]
    - [28, 15795.0]
  - - [1024, 2368, 1, 128, 1024, 1024, 128, 2368]
    - [0, 15009.0]
  - - [2368, 4288, 1, 3328, 2368, 2368, 3328, 4288]
    - [16, 19539.0]
  - - [1024, 1408, 1, 1280, 1024, 1024, 1280, 1408]
    - [0, 15771.0]
  - - [6784, 5056, 1, 256, 6784, 6784, 256, 5056]
    - [10, 19653.0]
  - - [448, 6784, 1, 128, 448, 448, 128, 6784]
    - [6, 14044.0]
  - - [2944, 6784, 1, 256, 2944, 2944, 256, 6784]
    - [16, 20008.0]
  - - [2368, 2368, 1, 1280, 2368, 2368, 1280, 2368]
    - [28, 17474.0]
  - - [1856, 3584, 1, 1280, 1856, 1856, 1280, 3584]
    - [17, 18885.0]
  - - [3584, 1408, 1, 1280, 3584, 3584, 1280, 1408]
    - [16, 18995.0]
  - - [4288, 448, 1, 128, 4288, 4288, 128, 448]
    - [6, 13752.0]
  - - [5056, 256, 1, 1280, 5056, 5056, 1280, 256]
    - [33, 13880.0]
  - - [1856, 1408, 1, 3328, 1856, 1856, 3328, 1408]
    - [10, 17282.0]
  - - [1024, 4288, 1, 3328, 1024, 1024, 3328, 4288]
    - [5, 18737.0]
  - - [5056, 448, 1, 256, 5056, 5056, 256, 448]
    - [18, 15817.0]
  - - [2944, 2368, 1, 3328, 2944, 2944, 3328, 2368]
    - [16, 18503.0]
  - - [1024, 1856, 1, 1280, 1024, 1024, 1280, 1856]
    - [5, 15487.0]
  - - [6784, 1856, 1, 256, 6784, 6784, 256, 1856]
    - [10, 18281.0]
  - - [1024, 5888, 1, 256, 1024, 1024, 256, 5888]
    - [3, 17989.0]
  - - [1408, 2368, 1, 256, 1408, 1408, 256, 2368]
    - [32, 16782.0]
  - - [1408, 1408, 1, 256, 1408, 1408, 256, 1408]
    - [30, 15492.0]
  - - [2368, 2368, 1, 128, 2368, 2368, 128, 2368]
    - [30, 16043.0]
  - - [6784, 1408, 1, 128, 6784, 6784, 128, 1408]
    - [31, 18044.0]
  - - [4288, 5888, 1, 256, 4288, 4288, 256, 5888]
    - [10, 19522.0]
  - - [1408, 5056, 1, 256, 1408, 1408, 256, 5056]
    - [31, 17994.0]
  - - [4288, 3584, 1, 128, 4288, 4288, 128, 3584]
    - [1, 18306.0]
  - - [3584, 5056, 1, 1280, 3584, 3584, 1280, 5056]
    - [28, 19702.0]
  - - [1856, 1024, 1, 128, 1856, 1856, 128, 1024]
    - [30, 13500.0]
  - - [704, 4288, 1, 256, 704, 704, 256, 4288]
    - [8, 15321.0]
  - - [5888, 2368, 1, 1280, 5888, 5888, 1280, 2368]
    - [28, 19383.0]
  - - [2368, 5888, 1, 1280, 2368, 2368, 1280, 5888]
    - [16, 19379.0]
  - - [5888, 256, 1, 1280, 5888, 5888, 1280, 256]
    - [10, 15763.0]
  - - [2368, 1856, 1, 3328, 2368, 2368, 3328, 1856]
    - [16, 18632.0]
  - - [2944, 704, 1, 256, 2944, 2944, 256, 704]
    - [32, 15125.0]
  - - [704, 3584, 1, 256, 704, 704, 256, 3584]
    - [32, 15299.0]
  - - [704, 2944, 1, 3328, 704, 704, 3328, 2944]
    - [5, 17285.0]
  - - [6784, 1024, 1, 128, 6784, 6784, 128, 1024]
    - [28, 17963.0]
  - - [2944, 1024, 1, 3328, 2944, 2944, 3328, 1024]
    - [16, 16931.0]
  - - [2944, 5056, 1, 128, 2944, 2944, 128, 5056]
    - [19, 18473.0]
  - - [1408, 6784, 1, 256, 1408, 1408, 256, 6784]
    - [16, 18836.0]
  - - [6784, 1408, 1, 3328, 6784, 6784, 3328, 1408]
    - [16, 19482.0]
  - - [4288, 6784, 1, 128, 4288, 4288, 128, 6784]
    - [25, 18734.0]
  - - [6784, 2944, 1, 1280, 6784, 6784, 1280, 2944]
    - [28, 20451.0]
  - - [4288, 1856, 1, 128, 4288, 4288, 128, 1856]
    - [31, 16446.0]
  - - [1856, 2944, 1, 128, 1856, 1856, 128, 2944]
    - [2, 16480.0]
  - - [6784, 448, 1, 128, 6784, 6784, 128, 448]
    - [30, 15196.0]
  - - [448, 5056, 1, 1280, 448, 448, 1280, 5056]
    - [28, 14768.0]
  - - [2368, 1856, 1, 128, 2368, 2368, 128, 1856]
    - [26, 15991.0]
  - - [4288, 704, 1, 256, 4288, 4288, 256, 704]
    - [32, 15213.0]
  - - [5888, 704, 1, 256, 5888, 5888, 256, 704]
    - [10, 16010.0]
  - - [3584, 1024, 1, 128, 3584, 3584, 128, 1024]
    - [32, 15860.0]
  - - [256, 5888, 1, 3328, 256, 256, 3328, 5888]
    - [3, 16124.0]
  - - [1408, 4288, 1, 3328, 1408, 1408, 3328, 4288]
    - [16, 18868.0]
  - - [6784, 4288, 1, 256, 6784, 6784, 256, 4288]
    - [16, 19485.0]
  - - [5888, 256, 1, 256, 5888, 5888, 256, 256]
    - [32, 14166.0]
  - - [6784, 1024, 1, 1280, 6784, 6784, 1280, 1024]
    - [28, 19765.0]
  - - [5888, 1024, 1, 128, 5888, 5888, 128, 1024]
    - [32, 17044.0]
  - - [2944, 704, 1, 1280, 2944, 2944, 1280, 704]
    - [29, 16962.0]
  - - [6784, 3584, 1, 1280, 6784, 6784, 1280, 3584]
    - [29, 20246.0]
  - - [1024, 6784, 1, 1280, 1024, 1024, 1280, 6784]
    - [3, 19684.0]
  - - [1408, 2944, 1, 1280, 1408, 1408, 1280, 2944]
    - [10, 17534.0]
  - - [1408, 2368, 1, 3328, 1408, 1408, 3328, 2368]
    - [16, 18589.0]
  - - [2944, 1856, 1, 128, 2944, 2944, 128, 1856]
    - [18, 16534.0]
  - - [256, 6784, 1, 128, 256, 256, 128, 6784]
    - [35, 15331.0]
  - - [5056, 6784, 1, 128, 5056, 5056, 128, 6784]
    - [13, 18888.0]
  - - [4288, 5056, 1, 128, 4288, 4288, 128, 5056]
    - [13, 18397.0]
  - - [1856, 5888, 1, 128, 1856, 1856, 128, 5888]
    - [1, 17433.0]
  - - [2944, 5888, 1, 256, 2944, 2944, 256, 5888]
    - [28, 19651.0]
  - - [3584, 1856, 1, 256, 3584, 3584, 256, 1856]
    - [28, 17828.0]
  - - [4288, 3584, 1, 1280, 4288, 4288, 1280, 3584]
    - [16, 19762.0]
  - - [704, 4288, 1, 3328, 704, 704, 3328, 4288]
    - [17, 17041.0]
  - - [704, 5888, 1, 128, 704, 704, 128, 5888]
    - [26, 15424.0]
  - - [6784, 3584, 1, 128, 6784, 6784, 128, 3584]
    - [31, 19126.0]
  - - [4288, 5056, 1, 3328, 4288, 4288, 3328, 5056]
    - [17, 20030.0]
  - - [1408, 1408, 1, 128, 1408, 1408, 128, 1408]
    - [30, 14402.0]
  - - [5056, 2368, 1, 256, 5056, 5056, 256, 2368]
    - [10, 18227.0]
  - - [4288, 704, 1, 3328, 4288, 4288, 3328, 704]
    - [28, 16832.0]
  - - [448, 3584, 1, 256, 448, 448, 256, 3584]
    - [18, 13132.0]
  - - [2368, 1024, 1, 1280, 2368, 2368, 1280, 1024]
    - [31, 15727.0]
  - - [2944, 1408, 1, 3328, 2944, 2944, 3328, 1408]
    - [29, 17800.0]
  - - [1024, 1408, 1, 3328, 1024, 1024, 3328, 1408]
    - [0, 16005.0]
  - - [2944, 5888, 1, 1280, 2944, 2944, 1280, 5888]
    - [29, 20170.0]
  - - [5888, 3584, 1, 256, 5888, 5888, 256, 3584]
    - [34, 19847.0]
  - - [1408, 1856, 1, 3328, 1408, 1408, 3328, 1856]
    - [34, 17290.0]
  - - [6784, 1408, 1, 1280, 6784, 6784, 1280, 1408]
    - [28, 19384.0]
  - - [704, 2944, 1, 256, 704, 704, 256, 2944]
    - [7, 15273.0]
  - - [704, 4288, 1, 128, 704, 704, 128, 4288]
    - [8, 14386.0]
  - - [2368, 4288, 1, 128, 2368, 2368, 128, 4288]
    - [26, 17441.0]
  - - [1024, 6784, 1, 128, 1024, 1024, 128, 6784]
    - [10, 17855.0]
  - - [1408, 1408, 1, 1280, 1408, 1408, 1280, 1408]
    - [29, 16342.0]
  - - [448, 4288, 1, 3328, 448, 448, 3328, 4288]
    - [29, 16039.0]
  - - [2368, 1408, 1, 256, 2368, 2368, 256, 1408]
    - [20, 16842.0]
  - - [5888, 5056, 1, 128, 5888, 5888, 128, 5056]
    - [25, 18718.0]
  - - [704, 2368, 1, 256, 704, 704, 256, 2368]
    - [18, 13404.0]
  - - [5888, 2368, 1, 3328, 5888, 5888, 3328, 2368]
    - [16, 19445.0]
  - - [4288, 448, 1, 1280, 4288, 4288, 1280, 448]
    - [19, 15203.0]
  - - [5888, 704, 1, 3328, 5888, 5888, 3328, 704]
    - [16, 17583.0]
  - - [5056, 256, 1, 128, 5056, 5056, 128, 256]
    - [0, 11953.0]
  - - [1408, 5888, 1, 128, 1408, 1408, 128, 5888]
    - [7, 17793.0]
  - - [1408, 1024, 1, 256, 1408, 1408, 256, 1024]
    - [30, 14612.0]
  - - [1024, 1856, 1, 128, 1024, 1024, 128, 1856]
    - [6, 14585.0]
  - - [5056, 6784, 1, 1280, 5056, 5056, 1280, 6784]
    - [28, 20346.0]
  - - [704, 5056, 1, 3328, 704, 704, 3328, 5056]
    - [28, 17137.0]
  - - [3584, 5056, 1, 3328, 3584, 3584, 3328, 5056]
    - [28, 19812.0]
  - - [2368, 2944, 1, 3328, 2368, 2368, 3328, 2944]
    - [13, 18473.0]
  - - [2368, 3584, 1, 256, 2368, 2368, 256, 3584]
    - [28, 18178.0]
  - - [5056, 3584, 1, 1280, 5056, 5056, 1280, 3584]
    - [28, 19740.0]
  - - [1856, 2944, 1, 1280, 1856, 1856, 1280, 2944]
    - [28, 18466.0]
  - - [3584, 2368, 1, 1280, 3584, 3584, 1280, 2368]
    - [16, 19401.0]
  - - [2944, 1408, 1, 256, 2944, 2944, 256, 1408]
    - [16, 16711.0]
  - - [4288, 1408, 1, 3328, 4288, 4288, 3328, 1408]
    - [16, 18832.0]
  - - [2944, 1024, 1, 128, 2944, 2944, 128, 1024]
    - [30, 15325.0]
  - - [4288, 5056, 1, 1280, 4288, 4288, 1280, 5056]
    - [16, 19876.0]
  - - [5888, 6784, 1, 1280, 5888, 5888, 1280, 6784]
    - [28, 20593.0]
  - - [6784, 5056, 1, 128, 6784, 6784, 128, 5056]
    - [25, 18882.0]
  - - [5888, 1408, 1, 3328, 5888, 5888, 3328, 1408]
    - [16, 19173.0]
  - - [256, 5056, 1, 256, 256, 256, 256, 5056]
    - [30, 13772.0]
  - - [448, 3584, 1, 3328, 448, 448, 3328, 3584]
    - [30, 13962.0]
  - - [704, 2368, 1, 128, 704, 704, 128, 2368]
    - [12, 12793.0]
  - - [5888, 256, 1, 128, 5888, 5888, 128, 256]
    - [4, 12914.0]
  - - [3584, 1856, 1, 128, 3584, 3584, 128, 1856]
    - [26, 16900.0]
  - - [4288, 4288, 1, 128, 4288, 4288, 128, 4288]
    - [31, 18347.0]
  - - [1856, 1024, 1, 3328, 1856, 1856, 3328, 1024]
    - [5, 15945.0]
  - - [1024, 5056, 1, 256, 1024, 1024, 256, 5056]
    - [28, 17901.0]
  - - [2368, 1408, 1, 3328, 2368, 2368, 3328, 1408]
    - [28, 18561.0]
  - - [5888, 448, 1, 256, 5888, 5888, 256, 448]
    - [9, 14466.0]
  - - [5888, 6784, 1, 128, 5888, 5888, 128, 6784]
    - [28, 19001.0]
  - - [6784, 5056, 1, 1280, 6784, 6784, 1280, 5056]
    - [16, 20350.0]
  - - [5056, 704, 1, 1280, 5056, 5056, 1280, 704]
    - [31, 16785.0]
  - - [4288, 6784, 1, 1280, 4288, 4288, 1280, 6784]
    - [16, 20000.0]
  - - [6784, 1408, 1, 256, 6784, 6784, 256, 1408]
    - [28, 18511.0]
  - - [3584, 5888, 1, 128, 3584, 3584, 128, 5888]
    - [34, 19253.0]
  - - [5056, 5888, 1, 256, 5056, 5056, 256, 5888]
    - [34, 19558.0]
  - - [2368, 1024, 1, 256, 2368, 2368, 256, 1024]
    - [32, 14356.0]
  - - [2944, 1856, 1, 256, 2944, 2944, 256, 1856]
    - [16, 17329.0]
  - - [1856, 6784, 1, 1280, 1856, 1856, 1280, 6784]
    - [3, 19032.0]
  - - [4288, 3584, 1, 256, 4288, 4288, 256, 3584]
    - [7, 19126.0]
  - - [5056, 1856, 1, 1280, 5056, 5056, 1280, 1856]
    - [28, 19016.0]
  - - [1408, 1024, 1, 3328, 1408, 1408, 3328, 1024]
    - [21, 15868.0]
  - - [5888, 3584, 1, 1280, 5888, 5888, 1280, 3584]
    - [16, 20428.0]
  - - [1856, 3584, 1, 3328, 1856, 1856, 3328, 3584]
    - [17, 19158.0]
  - - [1024, 2944, 1, 256, 1024, 1024, 256, 2944]
    - [6, 16092.0]
  - - [448, 6784, 1, 1280, 448, 448, 1280, 6784]
    - [17, 16813.0]
  - - [704, 5056, 1, 256, 704, 704, 256, 5056]
    - [31, 15809.0]
  - - [2944, 1856, 1, 1280, 2944, 2944, 1280, 1856]
    - [16, 18475.0]
  - - [5056, 256, 1, 256, 5056, 5056, 256, 256]
    - [18, 13470.0]
  - - [2368, 3584, 1, 3328, 2368, 2368, 3328, 3584]
    - [28, 19581.0]
  - - [3584, 5888, 1, 3328, 3584, 3584, 3328, 5888]
    - [29, 20600.0]
  - - [2944, 3584, 1, 1280, 2944, 2944, 1280, 3584]
    - [3, 20151.0]
  - - [1856, 5888, 1, 1280, 1856, 1856, 1280, 5888]
    - [16, 18914.0]
  - - [5056, 448, 1, 3328, 5056, 5056, 3328, 448]
    - [33, 16079.0]
  - - [4288, 1408, 1, 256, 4288, 4288, 256, 1408]
    - [7, 17608.0]
  - - [5888, 1408, 1, 128, 5888, 5888, 128, 1408]
    - [28, 17645.0]
  - - [4288, 2368, 1, 1280, 4288, 4288, 1280, 2368]
    - [28, 19413.0]
  - - [6784, 2368, 1, 256, 6784, 6784, 256, 2368]
    - [10, 19173.0]
  - - [4288, 1856, 1, 256, 4288, 4288, 256, 1856]
    - [31, 17428.0]
  - - [1856, 2944, 1, 256, 1856, 1856, 256, 2944]
    - [19, 17316.0]
  - - [5056, 1024, 1, 128, 5056, 5056, 128, 1024]
    - [11, 16863.0]
  - - [6784, 256, 1, 128, 6784, 6784, 128, 256]
    - [35, 15205.0]
  - - [5888, 704, 1, 128, 5888, 5888, 128, 704]
    - [30, 15688.0]
  - - [1024, 4288, 1, 1280, 1024, 1024, 1280, 4288]
    - [17, 18356.0]
  - - [2368, 5056, 1, 3328, 2368, 2368, 3328, 5056]
    - [29, 18983.0]
  - - [4288, 1024, 1, 3328, 4288, 4288, 3328, 1024]
    - [16, 18583.0]
  - - [1024, 5056, 1, 3328, 1024, 1024, 3328, 5056]
    - [28, 19505.0]
  - - [1024, 1856, 1, 3328, 1024, 1024, 3328, 1856]
    - [17, 15909.0]
  - - [704, 6784, 1, 128, 704, 704, 128, 6784]
    - [20, 15862.0]
  - - [4288, 6784, 1, 256, 4288, 4288, 256, 6784]
    - [16, 19435.0]
  - - [3584, 2944, 1, 3328, 3584, 3584, 3328, 2944]
    - [34, 20304.0]
  - - [5888, 2944, 1, 256, 5888, 5888, 256, 2944]
    - [28, 19468.0]
  - - [2368, 6784, 1, 128, 2368, 2368, 128, 6784]
    - [25, 18281.0]
  - - [448, 4288, 1, 1280, 448, 448, 1280, 4288]
    - [5, 15610.0]
  - - [5056, 4288, 1, 256, 5056, 5056, 256, 4288]
    - [22, 19349.0]
  - - [1024, 3584, 1, 256, 1024, 1024, 256, 3584]
    - [3, 16753.0]
  - - [1856, 5056, 1, 128, 1856, 1856, 128, 5056]
    - [19, 17115.0]
  - - [6784, 6784, 1, 3328, 6784, 6784, 3328, 6784]
    - [16, 20559.0]
  - - [448, 5888, 1, 1280, 448, 448, 1280, 5888]
    - [30, 14736.0]
  - - [5056, 448, 1, 128, 5056, 5056, 128, 448]
    - [6, 14808.0]
  - - [3584, 2944, 1, 128, 3584, 3584, 128, 2944]
    - [10, 18547.0]
  - - [6784, 256, 1, 1280, 6784, 6784, 1280, 256]
    - [32, 18009.0]
  - - [2368, 5888, 1, 3328, 2368, 2368, 3328, 5888]
    - [3, 19467.0]
  - - [2368, 1856, 1, 1280, 2368, 2368, 1280, 1856]
    - [28, 18200.0]
  - - [3584, 4288, 1, 128, 3584, 3584, 128, 4288]
    - [28, 18211.0]
  - - [5888, 4288, 1, 3328, 5888, 5888, 3328, 4288]
    - [29, 20162.0]
  - - [2368, 704, 1, 256, 2368, 2368, 256, 704]
    - [30, 14057.0]
  - - [3584, 1408, 1, 128, 3584, 3584, 128, 1408]
    - [31, 16971.0]
  - - [1856, 5056, 1, 1280, 1856, 1856, 1280, 5056]
    - [16, 19016.0]
  - - [2944, 1024, 1, 1280, 2944, 2944, 1280, 1024]
    - [16, 16764.0]
  - - [2368, 4288, 1, 256, 2368, 2368, 256, 4288]
    - [28, 18562.0]
  - - [1024, 2368, 1, 3328, 1024, 1024, 3328, 2368]
    - [10, 16093.0]
  - - [6784, 1856, 1, 3328, 6784, 6784, 3328, 1856]
    - [16, 19073.0]
  - - [1024, 2944, 1, 128, 1024, 1024, 128, 2944]
    - [12, 15276.0]
  - - [1024, 3584, 1, 1280, 1024, 1024, 1280, 3584]
    - [3, 17646.0]
  - - [4288, 5888, 1, 3328, 4288, 4288, 3328, 5888]
    - [17, 20188.0]
  - - [1024, 2944, 1, 3328, 1024, 1024, 3328, 2944]
    - [17, 16998.0]
  - - [3584, 6784, 1, 256, 3584, 3584, 256, 6784]
    - [28, 19706.0]
  - - [256, 6784, 1, 1280, 256, 256, 1280, 6784]
    - [2, 18085.0]
  - - [1856, 3584, 1, 256, 1856, 1856, 256, 3584]
    - [31, 17850.0]
  - - [6784, 1856, 1, 128, 6784, 6784, 128, 1856]
    - [10, 17664.0]
  - - [2944, 704, 1, 128, 2944, 2944, 128, 704]
    - [30, 14156.0]
  - - [256, 5888, 1, 1280, 256, 256, 1280, 5888]
    - [2, 15835.0]
  - - [4288, 6784, 1, 3328, 4288, 4288, 3328, 6784]
    - [16, 20070.0]
  - - [2368, 1408, 1, 128, 2368, 2368, 128, 1408]
    - [26, 15760.0]
  - - [1408, 1024, 1, 128, 1408, 1408, 128, 1024]
    - [30, 13981.0]
  - - [6784, 3584, 1, 3328, 6784, 6784, 3328, 3584]
    - [29, 20366.0]
  - - [2368, 5056, 1, 1280, 2368, 2368, 1280, 5056]
    - [28, 18833.0]
  - - [1408, 2368, 1, 1280, 1408, 1408, 1280, 2368]
    - [16, 18165.0]
  - - [2944, 4288, 1, 128, 2944, 2944, 128, 4288]
    - [31, 18139.0]
  - - [2944, 2944, 1, 256, 2944, 2944, 256, 2944]
    - [28, 19147.0]
  - - [6784, 256, 1, 256, 6784, 6784, 256, 256]
    - [32, 16614.0]
  - - [256, 5056, 1, 3328, 256, 256, 3328, 5056]
    - [12, 15285.0]
  - - [5056, 1856, 1, 128, 5056, 5056, 128, 1856]
    - [19, 17213.0]
  - - [5888, 1408, 1, 256, 5888, 5888, 256, 1408]
    - [10, 18426.0]
  - - [4288, 3584, 1, 3328, 4288, 4288, 3328, 3584]
    - [28, 19893.0]
  - - [1024, 2368, 1, 1280, 1024, 1024, 1280, 2368]
    - [16, 15652.0]
  - - [5888, 6784, 1, 3328, 5888, 5888, 3328, 6784]
    - [16, 20699.0]
  - - [704, 4288, 1, 1280, 704, 704, 1280, 4288]
    - [5, 16516.0]
  - - [6784, 448, 1, 3328, 6784, 6784, 3328, 448]
    - [34, 16930.0]
  - - [4288, 1024, 1, 128, 4288, 4288, 128, 1024]
    - [2, 16253.0]
  - - [1920, 2048, 1, 2048, 1920, 1920, 2048, 2048]
    - [34, 18886.0]
  - - [2880, 3072, 1, 3072, 2880, 2880, 3072, 3072]
    - [29, 19142.0]
  - - [3840, 4096, 1, 4096, 3840, 3840, 4096, 4096]
    - [34, 20260.0]
  - - [7680, 8192, 1, 8192, 7680, 7680, 8192, 8192]
    - [34, 20664.0]
  - - [2048, 2048, 1, 2048, 2048, 2048, 2048, 2048]
    - [23, 17850.0]
  - - [3072, 3072, 1, 3072, 3072, 3072, 3072, 3072]
    - [23, 20437.0]
  - - [4096, 4096, 1, 4096, 4096, 4096, 4096, 4096]
    - [22, 20170.0]
  - - [8192, 8192, 1, 8192, 8192, 8192, 8192, 8192]
    - [29, 20673.0]
  - - [1152, 1152, 1, 1152, 1152, 1152, 1152, 1152]
    - [12, 15534.0]
  - - [1536, 1536, 1, 1536, 1536, 1536, 1536, 1536]
    - [29, 19423.0]
  - - [1920, 1920, 1, 1920, 1920, 1920, 1920, 1920]
    - [16, 17793.0]
  - - [2304, 2304, 1, 2304, 2304, 2304, 2304, 2304]
    - [32, 19142.0]
  - - [2688, 2688, 1, 2688, 2688, 2688, 2688, 2688]
    - [25, 19228.0]
  - - [3456, 3456, 1, 3456, 3456, 3456, 3456, 3456]
    - [13, 19836.0]
  - - [3840, 3840, 1, 3840, 3840, 3840, 3840, 3840]
    - [28, 19805.0]
  - - [4224, 4224, 1, 4224, 4224, 4224, 4224, 4224]
    - [28, 20194.0]
  - - [4608, 4608, 1, 4608, 4608, 4608, 4608, 4608]
    - [17, 20723.0]
  - - [4992, 4992, 1, 4992, 4992, 4992, 4992, 4992]
    - [3, 20397.0]
  - - [5376, 5376, 1, 5376, 5376, 5376, 5376, 5376]
    - [28, 20382.0]
  - - [5760, 5760, 1, 5760, 5760, 5760, 5760, 5760]
    - [28, 20511.0]
  - - [6144, 6144, 1, 6144, 6144, 6144, 6144, 6144]
    - [34, 20680.0]
  - - [6528, 6528, 1, 6528, 6528, 6528, 6528, 6528]
    - [28, 20589.0]
  - - [6912, 6912, 1, 6912, 6912, 6912, 6912, 6912]
    - [17, 20576.0]
  - - [7296, 7296, 1, 7296, 7296, 7296, 7296, 7296]
    - [28, 20655.0]
  - - [7680, 7680, 1, 7680, 7680, 7680, 7680, 7680]
    - [28, 20756.0]
  - - [1856, 448, 1, 3328, 1856, 1856, 3328, 448]
    - [67, 14630.0]
  - - [128, 6784, 1, 3328, 128, 128, 3328, 6784]
    - [72, 13695.0]
  - - [2368, 448, 1, 128, 2368, 2368, 128, 448]
    - [69, 12146.0]
  - - [256, 4288, 1, 3328, 256, 256, 3328, 4288]
    - [41, 17035.0]
  - - [704, 1856, 1, 3328, 704, 704, 3328, 1856]
    - [59, 14428.0]
  - - [448, 1024, 1, 1280, 448, 448, 1280, 1024]
    - [72, 11896.0]
  - - [256, 1408, 1, 3328, 256, 256, 3328, 1408]
    - [37, 10379.0]
  - - [704, 1856, 1, 1280, 704, 704, 1280, 1856]
    - [51, 14043.0]
  - - [128, 5056, 1, 128, 128, 128, 128, 5056]
    - [70, 9184.0]
  - - [2368, 128, 1, 256, 2368, 2368, 256, 128]
    - [61, 7376.0]
  - - [64, 5056, 1, 256, 64, 64, 256, 5056]
    - [68, 7844.0]
  - - [256, 2944, 1, 256, 256, 256, 256, 2944]
    - [47, 12150.0]
  - - [256, 1856, 1, 1280, 256, 256, 1280, 1856]
    - [49, 12188.0]
  - - [128, 3584, 1, 1280, 128, 128, 1280, 3584]
    - [49, 11844.0]
  - - [4288, 256, 1, 256, 4288, 4288, 256, 256]
    - [65, 13722.0]
  - - [2944, 128, 1, 128, 2944, 2944, 128, 128]
    - [45, 7537.0]
  - - [5888, 64, 1, 3328, 5888, 5888, 3328, 64]
    - [63, 10266.0]
  - - [2944, 256, 1, 3328, 2944, 2944, 3328, 256]
    - [69, 13745.0]
  - - [1408, 448, 1, 1280, 1408, 1408, 1280, 448]
    - [69, 11302.0]
  - - [1408, 704, 1, 3328, 1408, 1408, 3328, 704]
    - [78, 15257.0]
  - - [6784, 64, 1, 256, 6784, 6784, 256, 64]
    - [45, 8307.0]
  - - [2944, 256, 1, 256, 2944, 2944, 256, 256]
    - [62, 11736.0]
  - - [704, 1408, 1, 3328, 704, 704, 3328, 1408]
    - [72, 15338.0]
  - - [2944, 256, 1, 128, 2944, 2944, 128, 256]
    - [46, 10285.0]
  - - [448, 2944, 1, 128, 448, 448, 128, 2944]
    - [69, 13251.0]
  - - [2368, 128, 1, 3328, 2368, 2368, 3328, 128]
    - [68, 8781.0]
  - - [2944, 128, 1, 256, 2944, 2944, 256, 128]
    - [63, 8786.0]
  - - [448, 1408, 1, 256, 448, 448, 256, 1408]
    - [75, 10285.0]
  - - [64, 5056, 1, 3328, 64, 64, 3328, 5056]
    - [61, 9261.0]
  - - [1024, 448, 1, 128, 1024, 1024, 128, 448]
    - [38, 7935.0]
  - - [256, 3584, 1, 3328, 256, 256, 3328, 3584]
    - [72, 14322.0]
  - - [5056, 64, 1, 1280, 5056, 5056, 1280, 64]
    - [45, 8903.0]
  - - [1024, 704, 1, 256, 1024, 1024, 256, 704]
    - [46, 11785.0]
  - - [128, 4288, 1, 128, 128, 128, 128, 4288]
    - [71, 9342.0]
  - - [3584, 256, 1, 128, 3584, 3584, 128, 256]
    - [64, 10834.0]
  - - [4288, 128, 1, 1280, 4288, 4288, 1280, 128]
    - [52, 13684.0]
  - - [5888, 64, 1, 256, 5888, 5888, 256, 64]
    - [45, 8537.0]
  - - [1856, 256, 1, 1280, 1856, 1856, 1280, 256]
    - [78, 12067.0]
  - - [64, 5888, 1, 3328, 64, 64, 3328, 5888]
    - [39, 10597.0]
  - - [704, 1024, 1, 1280, 704, 704, 1280, 1024]
    - [69, 12848.0]
  - - [448, 1856, 1, 128, 448, 448, 128, 1856]
    - [38, 11298.0]
  - - [1024, 704, 1, 1280, 1024, 1024, 1280, 704]
    - [54, 13048.0]
  - - [128, 5888, 1, 256, 128, 128, 256, 5888]
    - [40, 12211.0]
  - - [704, 704, 1, 3328, 704, 704, 3328, 704]
    - [44, 13349.0]
  - - [704, 1408, 1, 1280, 704, 704, 1280, 1408]
    - [41, 15015.0]
  - - [3584, 256, 1, 3328, 3584, 3584, 3328, 256]
    - [65, 14161.0]
  - - [704, 1856, 1, 128, 704, 704, 128, 1856]
    - [69, 12965.0]
  - - [128, 3584, 1, 3328, 128, 128, 3328, 3584]
    - [44, 12539.0]
  - - [128, 2944, 1, 1280, 128, 128, 1280, 2944]
    - [39, 10355.0]
  - - [3584, 128, 1, 256, 3584, 3584, 256, 128]
    - [46, 8938.0]
  - - [448, 1408, 1, 3328, 448, 448, 3328, 1408]
    - [54, 11791.0]
  - - [256, 3584, 1, 256, 256, 256, 256, 3584]
    - [57, 12669.0]
  - - [256, 2944, 1, 3328, 256, 256, 3328, 2944]
    - [64, 13978.0]
  - - [448, 2368, 1, 128, 448, 448, 128, 2368]
    - [38, 12124.0]
  - - [1408, 704, 1, 256, 1408, 1408, 256, 704]
    - [78, 12973.0]
  - - [448, 2944, 1, 3328, 448, 448, 3328, 2944]
    - [54, 14263.0]
  - - [64, 5888, 1, 256, 64, 64, 256, 5888]
    - [39, 8966.0]
  - - [6784, 128, 1, 3328, 6784, 6784, 3328, 128]
    - [49, 13415.0]
  - - [704, 704, 1, 256, 704, 704, 256, 704]
    - [62, 9775.0]
  - - [128, 4288, 1, 3328, 128, 128, 3328, 4288]
    - [49, 14724.0]
  - - [448, 704, 1, 1280, 448, 448, 1280, 704]
    - [68, 8947.0]
  - - [1024, 448, 1, 3328, 1024, 1024, 3328, 448]
    - [52, 12350.0]
  - - [1856, 704, 1, 1280, 1856, 1856, 1280, 704]
    - [50, 14054.0]
  - - [448, 1408, 1, 1280, 448, 448, 1280, 1408]
    - [54, 11577.0]
  - - [1024, 1024, 1, 1280, 1024, 1024, 1280, 1024]
    - [41, 15738.0]
  - - [448, 1024, 1, 128, 448, 448, 128, 1024]
    - [37, 7978.0]
  - - [448, 2368, 1, 3328, 448, 448, 3328, 2368]
    - [66, 14252.0]
  - - [5056, 64, 1, 128, 5056, 5056, 128, 64]
    - [45, 6595.0]
  - - [704, 1024, 1, 256, 704, 704, 256, 1024]
    - [62, 11578.0]
  - - [128, 6784, 1, 1280, 128, 128, 1280, 6784]
    - [57, 13401.0]
  - - [1856, 256, 1, 256, 1856, 1856, 256, 256]
    - [75, 9654.0]
  - - [256, 4288, 1, 1280, 256, 256, 1280, 4288]
    - [49, 16523.0]
  - - [256, 1856, 1, 128, 256, 256, 128, 1856]
    - [71, 8196.0]
  - - [448, 1408, 1, 128, 448, 448, 128, 1408]
    - [39, 8991.0]
  - - [6784, 128, 1, 256, 6784, 6784, 256, 128]
    - [65, 11700.0]
  - - [704, 448, 1, 256, 704, 704, 256, 448]
    - [53, 7660.0]
  - - [704, 1408, 1, 128, 704, 704, 128, 1408]
    - [38, 11726.0]
  - - [2944, 448, 1, 128, 2944, 2944, 128, 448]
    - [62, 12789.0]
  - - [128, 2944, 1, 128, 128, 128, 128, 2944]
    - [39, 7780.0]
  - - [1024, 704, 1, 3328, 1024, 1024, 3328, 704]
    - [43, 13027.0]
  - - [128, 4288, 1, 256, 128, 128, 256, 4288]
    - [40, 11169.0]
  - - [704, 448, 1, 3328, 704, 704, 3328, 448]
    - [68, 9063.0]
  - - [1024, 1024, 1, 3328, 1024, 1024, 3328, 1024]
    - [41, 16169.0]
  - - [448, 2368, 1, 1280, 448, 448, 1280, 2368]
    - [58, 14174.0]
  - - [64, 6784, 1, 3328, 64, 64, 3328, 6784]
    - [42, 11250.0]
  - - [2944, 256, 1, 1280, 2944, 2944, 1280, 256]
    - [73, 13222.0]
  - - [256, 2368, 1, 128, 256, 256, 128, 2368]
    - [55, 8660.0]
  - - [1856, 704, 1, 256, 1856, 1856, 256, 704]
    - [77, 12985.0]
  - - [1408, 448, 1, 3328, 1408, 1408, 3328, 448]
    - [51, 11483.0]
  - - [2368, 256, 1, 256, 2368, 2368, 256, 256]
    - [62, 9822.0]
  - - [1856, 448, 1, 1280, 1856, 1856, 1280, 448]
    - [59, 14294.0]
  - - [128, 5888, 1, 128, 128, 128, 128, 5888]
    - [40, 10509.0]
  - - [1024, 1024, 1, 256, 1024, 1024, 256, 1024]
    - [65, 13996.0]
  - - [704, 1856, 1, 256, 704, 704, 256, 1856]
    - [64, 13972.0]
  - - [64, 6784, 1, 256, 64, 64, 256, 6784]
    - [46, 8643.0]
  - - [256, 2368, 1, 1280, 256, 256, 1280, 2368]
    - [77, 11098.0]
  - - [2944, 448, 1, 256, 2944, 2944, 256, 448]
    - [64, 13335.0]
  - - [1856, 448, 1, 128, 1856, 1856, 128, 448]
    - [46, 11251.0]
  - - [2368, 128, 1, 1280, 2368, 2368, 1280, 128]
    - [74, 8527.0]
  - - [2368, 256, 1, 128, 2368, 2368, 128, 256]
    - [55, 8699.0]
  - - [64, 5056, 1, 1280, 64, 64, 1280, 5056]
    - [68, 9043.0]
  - - [2368, 256, 1, 1280, 2368, 2368, 1280, 256]
    - [54, 10972.0]
  - - [2368, 448, 1, 1280, 2368, 2368, 1280, 448]
    - [59, 14306.0]
  - - [128, 3584, 1, 256, 128, 128, 256, 3584]
    - [40, 9595.0]
  - - [704, 448, 1, 1280, 704, 704, 1280, 448]
    - [53, 8947.0]
  - - [128, 5056, 1, 256, 128, 128, 256, 5056]
    - [56, 10647.0]
  - - [4288, 256, 1, 1280, 4288, 4288, 1280, 256]
    - [65, 16527.0]
  - - [4288, 128, 1, 3328, 4288, 4288, 3328, 128]
    - [52, 14690.0]
  - - [1408, 256, 1, 128, 1408, 1408, 128, 256]
    - [45, 7442.0]
  - - [256, 1408, 1, 1280, 256, 256, 1280, 1408]
    - [53, 10225.0]
  - - [128, 2368, 1, 256, 128, 128, 256, 2368]
    - [37, 7490.0]
  - - [6784, 64, 1, 3328, 6784, 6784, 3328, 64]
    - [67, 10938.0]
  - - [128, 2944, 1, 3328, 128, 128, 3328, 2944]
    - [55, 10594.0]
  - - [2944, 448, 1, 3328, 2944, 2944, 3328, 448]
    - [59, 14604.0]
  - - [256, 4288, 1, 256, 256, 256, 256, 4288]
    - [56, 14236.0]
  - - [5888, 128, 1, 256, 5888, 5888, 256, 128]
    - [64, 11651.0]
  - - [2368, 448, 1, 3328, 2368, 2368, 3328, 448]
    - [51, 14676.0]
  - - [5056, 64, 1, 256, 5056, 5056, 256, 64]
    - [45, 7684.0]
  - - [1024, 704, 1, 128, 1024, 1024, 128, 704]
    - [46, 10207.0]
  - - [128, 5056, 1, 3328, 128, 128, 3328, 5056]
    - [71, 12156.0]
  - - [704, 1024, 1, 128, 704, 704, 128, 1024]
    - [39, 10207.0]
  - - [4288, 128, 1, 256, 4288, 4288, 256, 128]
    - [49, 10408.0]
  - - [1408, 448, 1, 128, 1408, 1408, 128, 448]
    - [70, 8951.0]
  - - [128, 5888, 1, 1280, 128, 128, 1280, 5888]
    - [71, 13821.0]
  - - [704, 448, 1, 128, 704, 704, 128, 448]
    - [37, 6706.0]
  - - [3584, 256, 1, 256, 3584, 3584, 256, 256]
    - [49, 11972.0]
  - - [128, 2944, 1, 256, 128, 128, 256, 2944]
    - [70, 8999.0]
  - - [128, 6784, 1, 128, 128, 128, 128, 6784]
    - [60, 10646.0]
  - - [448, 1856, 1, 256, 448, 448, 256, 1856]
    - [75, 12808.0]
  - - [3584, 128, 1, 3328, 3584, 3584, 3328, 128]
    - [44, 12463.0]
  - - [1024, 448, 1, 1280, 1024, 1024, 1280, 448]
    - [49, 11487.0]
  - - [5888, 128, 1, 3328, 5888, 5888, 3328, 128]
    - [51, 13531.0]
  - - [1408, 704, 1, 1280, 1408, 1408, 1280, 704]
    - [78, 14805.0]
  - - [448, 2944, 1, 256, 448, 448, 256, 2944]
    - [75, 13918.0]
  - - [448, 2368, 1, 256, 448, 448, 256, 2368]
    - [62, 13069.0]
  - - [128, 2368, 1, 3328, 128, 128, 3328, 2368]
    - [37, 8697.0]
  - - [5056, 128, 1, 1280, 5056, 5056, 1280, 128]
    - [64, 11464.0]
  - - [5056, 64, 1, 3328, 5056, 5056, 3328, 64]
    - [61, 9109.0]
  - - [64, 5888, 1, 128, 64, 64, 128, 5888]
    - [37, 7755.0]
  - - [5056, 128, 1, 3328, 5056, 5056, 3328, 128]
    - [54, 11722.0]
  - - [448, 704, 1, 256, 448, 448, 256, 704]
    - [53, 7719.0]
  - - [2944, 128, 1, 3328, 2944, 2944, 3328, 128]
    - [76, 10572.0]
  - - [128, 5056, 1, 1280, 128, 128, 1280, 5056]
    - [40, 11947.0]
  - - [704, 704, 1, 128, 704, 704, 128, 704]
    - [37, 8504.0]
  - - [64, 6784, 1, 1280, 64, 64, 1280, 6784]
    - [42, 10419.0]
  - - [2368, 128, 1, 128, 2368, 2368, 128, 128]
    - [53, 6339.0]
  - - [5056, 128, 1, 128, 5056, 5056, 128, 128]
    - [70, 9103.0]
  - - [1024, 1024, 1, 1024, 1024, 1024, 1024, 1024]
    - [78, 15584.0]
  - - [448, 1024, 1, 3328, 448, 448, 3328, 1024]
    - [72, 12378.0]
  - - [256, 2368, 1, 3328, 256, 256, 3328, 2368]
    - [71, 11239.0]
  - - [256, 3584, 1, 128, 256, 256, 128, 3584]
    - [40, 10996.0]
  - - [4288, 256, 1, 128, 4288, 4288, 128, 256]
    - [54, 12636.0]
  - - [256, 1856, 1, 256, 256, 256, 256, 1856]
    - [64, 9841.0]
  - - [256, 2944, 1, 128, 256, 256, 128, 2944]
    - [40, 10555.0]
  - - [1408, 256, 1, 3328, 1408, 1408, 3328, 256]
    - [68, 10431.0]
  - - [2368, 448, 1, 256, 2368, 2368, 256, 448]
    - [58, 12823.0]
  - - [4288, 256, 1, 3328, 4288, 4288, 3328, 256]
    - [78, 16896.0]
  - - [1856, 704, 1, 128, 1856, 1856, 128, 704]
    - [54, 12845.0]
  - - [4288, 128, 1, 128, 4288, 4288, 128, 128]
    - [48, 9172.0]
  - - [1408, 448, 1, 256, 1408, 1408, 256, 448]
    - [64, 10182.0]
  - - [6784, 64, 1, 1280, 6784, 6784, 1280, 64]
    - [51, 10518.0]
  - - [3584, 128, 1, 128, 3584, 3584, 128, 128]
    - [46, 7893.0]
  - - [256, 2368, 1, 256, 256, 256, 256, 2368]
    - [64, 9923.0]
  - - [2944, 448, 1, 1280, 2944, 2944, 1280, 448]
    - [51, 14358.0]
  - - [448, 1856, 1, 1280, 448, 448, 1280, 1856]
    - [42, 14108.0]
  - - [1856, 256, 1, 128, 1856, 1856, 128, 256]
    - [53, 8174.0]
  - - [5056, 128, 1, 256, 5056, 5056, 256, 128]
    - [63, 9909.0]
  - - [448, 1024, 1, 256, 448, 448, 256, 1024]
    - [75, 9471.0]
  - - [64, 6784, 1, 128, 64, 64, 128, 6784]
    - [61, 7740.0]
  - - [5888, 64, 1, 1280, 5888, 5888, 1280, 64]
    - [45, 9949.0]
  - - [128, 3584, 1, 128, 128, 128, 128, 3584]
    - [37, 7978.0]
  - - [1408, 256, 1, 256, 1408, 1408, 256, 256]
    - [45, 8705.0]
  - - [128, 5888, 1, 3328, 128, 128, 3328, 5888]
    - [71, 14067.0]
  - - [1408, 256, 1, 1280, 1408, 1408, 1280, 256]
    - [53, 10171.0]
  - - [1024, 1024, 1, 128, 1024, 1024, 128, 1024]
    - [47, 12405.0]
  - - [64, 5056, 1, 128, 64, 64, 128, 5056]
    - [37, 6746.0]
  - - [5888, 64, 1, 128, 5888, 5888, 128, 64]
    - [45, 7286.0]
  - - [448, 704, 1, 128, 448, 448, 128, 704]
    - [37, 6728.0]
  - - [1408, 704, 1, 128, 1408, 1408, 128, 704]
    - [71, 11705.0]
  - - [2368, 256, 1, 3328, 2368, 2368, 3328, 256]
    - [64, 11426.0]
  - - [5888, 128, 1, 1280, 5888, 5888, 1280, 128]
    - [77, 13328.0]
  - - [256, 3584, 1, 1280, 256, 256, 1280, 3584]
    - [72, 14122.0]
  - - [256, 1408, 1, 128, 256, 256, 128, 1408]
    - [37, 7418.0]
  - - [256, 4288, 1, 128, 256, 256, 128, 4288]
    - [40, 12750.0]
  - - [5888, 128, 1, 128, 5888, 5888, 128, 128]
    - [46, 10307.0]
  - - [1856, 256, 1, 3328, 1856, 1856, 3328, 256]
    - [44, 12864.0]
  - - [64, 5888, 1, 1280, 64, 64, 1280, 5888]
    - [39, 10355.0]
  - - [6784, 64, 1, 128, 6784, 6784, 128, 64]
    - [74, 7697.0]
  - - [704, 704, 1, 1280, 704, 704, 1280, 704]
    - [49, 12587.0]
  - - [128, 2368, 1, 1280, 128, 128, 1280, 2368]
    - [37, 8641.0]
  - - [3584, 256, 1, 1280, 3584, 3584, 1280, 256]
    - [65, 13829.0]
  - - [3584, 128, 1, 1280, 3584, 3584, 1280, 128]
    - [52, 11655.0]
  - - [448, 1856, 1, 3328, 448, 448, 3328, 1856]
    - [58, 14453.0]
  - - [1024, 448, 1, 256, 1024, 1024, 256, 448]
    - [46, 9674.0]
  - - [2944, 128, 1, 1280, 2944, 2944, 1280, 128]
    - [63, 10263.0]
  - - [128, 2368, 1, 128, 128, 128, 128, 2368]
    - [37, 6381.0]
  - - [256, 2944, 1, 1280, 256, 256, 1280, 2944]
    - [54, 13809.0]
  - - [704, 1024, 1, 3328, 704, 704, 3328, 1024]
    - [59, 12963.0]
  - - [128, 6784, 1, 256, 128, 128, 256, 6784]
    - [57, 11900.0]
  - - [256, 1856, 1, 3328, 256, 256, 3328, 1856]
    - [44, 12879.0]
  - - [6784, 128, 1, 128, 6784, 6784, 128, 128]
    - [79, 10368.0]
  - - [704, 1408, 1, 256, 704, 704, 256, 1408]
    - [41, 13000.0]
  - - [256, 1408, 1, 256, 256, 256, 256, 1408]
    - [37, 8722.0]
  - - [448, 2944, 1, 1280, 448, 448, 1280, 2944]
    - [75, 14290.0]
  - - [6784, 128, 1, 1280, 6784, 6784, 1280, 128]
    - [65, 13154.0]
  - - [1856, 448, 1, 256, 1856, 1856, 256, 448]
    - [75, 12916.0]
  - - [128, 4288, 1, 1280, 128, 128, 1280, 4288]
    - [49, 14096.0]
  - - [448, 704, 1, 3328, 448, 448, 3328, 704]
    - [68, 9063.0]
  - - [1856, 704, 1, 3328, 1856, 1856, 3328, 704]
    - [51, 14414.0]
  - - [960, 1024, 1, 1024, 960, 960, 1024, 1024]
    - [78, 14619.0]
  - - [768, 768, 1, 768, 768, 768, 768, 768]
    - [49, 14500.0]
  - - [1024, 128, 1, 128, 1024, 1024, 128, 128]
    - [116, 3525.0]
  - - [2368, 64, 1, 3328, 2368, 2368, 3328, 64]
    - [96, 5110.0]
  - - [1408, 64, 1, 128, 1408, 1408, 128, 64]
    - [80, 2658.0]
  - - [1408, 64, 1, 1280, 1408, 1408, 1280, 64]
    - [103, 4128.0]
  - - [2944, 64, 1, 256, 2944, 2944, 256, 64]
    - [105, 4853.0]
  - - [1024, 256, 1, 3328, 1024, 1024, 3328, 256]
    - [107, 7167.0]
  - - [1856, 64, 1, 1280, 1856, 1856, 1280, 64]
    - [117, 5095.0]
  - - [704, 128, 1, 1280, 704, 704, 1280, 128]
    - [96, 4210.0]
  - - [4288, 64, 1, 3328, 4288, 4288, 3328, 64]
    - [92, 7498.0]
  - - [4288, 64, 1, 256, 4288, 4288, 256, 64]
    - [107, 6457.0]
  - - [64, 3584, 1, 3328, 64, 64, 3328, 3584]
    - [107, 6261.0]
  - - [704, 256, 1, 128, 704, 704, 128, 256]
    - [109, 4241.0]
  - - [128, 1408, 1, 128, 128, 128, 128, 1408]
    - [109, 4119.0]
  - - [4288, 64, 1, 1280, 4288, 4288, 1280, 64]
    - [117, 7346.0]
  - - [1024, 256, 1, 256, 1024, 1024, 256, 256]
    - [107, 6168.0]
  - - [448, 448, 1, 256, 448, 448, 256, 448]
    - [105, 5254.0]
  - - [128, 1024, 1, 3328, 128, 128, 3328, 1024]
    - [83, 6017.0]
  - - [64, 1856, 1, 1280, 64, 64, 1280, 1856]
    - [81, 5161.0]
  - - [256, 1024, 1, 256, 256, 256, 256, 1024]
    - [107, 6225.0]
  - - [1024, 128, 1, 1280, 1024, 1024, 1280, 128]
    - [88, 5604.0]
  - - [448, 256, 1, 3328, 448, 448, 3328, 256]
    - [109, 5143.0]
  - - [128, 1024, 1, 128, 128, 128, 128, 1024]
    - [117, 3600.0]
  - - [128, 704, 1, 1280, 128, 128, 1280, 704]
    - [109, 4294.0]
  - - [1856, 128, 1, 3328, 1856, 1856, 3328, 128]
    - [117, 6530.0]
  - - [64, 2944, 1, 128, 64, 64, 128, 2944]
    - [81, 4246.0]
  - - [448, 448, 1, 3328, 448, 448, 3328, 448]
    - [105, 6140.0]
  - - [1408, 128, 1, 1280, 1408, 1408, 1280, 128]
    - [96, 5900.0]
  - - [128, 1856, 1, 1280, 128, 128, 1280, 1856]
    - [83, 6362.0]
  - - [256, 448, 1, 256, 256, 256, 256, 448]
    - [117, 4000.0]
  - - [128, 1856, 1, 128, 128, 128, 128, 1856]
    - [99, 4969.0]
  - - [64, 1408, 1, 3328, 64, 64, 3328, 1408]
    - [109, 4447.0]
  - - [128, 1408, 1, 256, 128, 128, 256, 1408]
    - [109, 4950.0]
  - - [4288, 64, 1, 128, 4288, 4288, 128, 64]
    - [107, 5611.0]
  - - [256, 448, 1, 3328, 256, 256, 3328, 448]
    - [114, 5166.0]
  - - [64, 2368, 1, 1280, 64, 64, 1280, 2368]
    - [109, 4951.0]
  - - [2368, 64, 1, 256, 2368, 2368, 256, 64]
    - [114, 4190.0]
  - - [1408, 128, 1, 128, 1408, 1408, 128, 128]
    - [109, 4047.0]
  - - [1024, 256, 1, 128, 1024, 1024, 128, 256]
    - [99, 5412.0]
  - - [2944, 64, 1, 128, 2944, 2944, 128, 64]
    - [116, 4102.0]
  - - [1856, 64, 1, 256, 1856, 1856, 256, 64]
    - [107, 4033.0]
  - - [704, 128, 1, 256, 704, 704, 256, 128]
    - [88, 3305.0]
  - - [448, 256, 1, 1280, 448, 448, 1280, 256]
    - [92, 5066.0]
  - - [1856, 128, 1, 1280, 1856, 1856, 1280, 128]
    - [117, 6388.0]
  - - [64, 3584, 1, 256, 64, 64, 256, 3584]
    - [99, 5457.0]
  - - [3584, 64, 1, 128, 3584, 3584, 128, 64]
    - [117, 4408.0]
  - - [256, 1024, 1, 1280, 256, 256, 1280, 1024]
    - [83, 7032.0]
  - - [3584, 64, 1, 1280, 3584, 3584, 1280, 64]
    - [92, 6129.0]
  - - [128, 1856, 1, 3328, 128, 128, 3328, 1856]
    - [83, 6484.0]
  - - [64, 2944, 1, 3328, 64, 64, 3328, 2944]
    - [90, 5810.0]
  - - [64, 4288, 1, 3328, 64, 64, 3328, 4288]
    - [83, 7474.0]
  - - [64, 1856, 1, 256, 64, 64, 256, 1856]
    - [81, 4087.0]
  - - [256, 704, 1, 256, 256, 256, 256, 704]
    - [88, 4919.0]
  - - [2368, 64, 1, 128, 2368, 2368, 128, 64]
    - [109, 3464.0]
  - - [64, 1408, 1, 128, 64, 64, 128, 1408]
    - [80, 2773.0]
  - - [704, 256, 1, 3328, 704, 704, 3328, 256]
    - [109, 6129.0]
  - - [64, 2944, 1, 256, 64, 64, 256, 2944]
    - [110, 4942.0]
  - - [448, 256, 1, 128, 448, 448, 128, 256]
    - [107, 3164.0]
  - - [704, 128, 1, 3328, 704, 704, 3328, 128]
    - [109, 4518.0]
  - - [128, 704, 1, 128, 128, 128, 128, 704]
    - [80, 2708.0]
  - - [256, 448, 1, 1280, 256, 256, 1280, 448]
    - [117, 4973.0]
  - - [704, 256, 1, 1280, 704, 704, 1280, 256]
    - [109, 5942.0]
  - - [64, 2368, 1, 3328, 64, 64, 3328, 2368]
    - [103, 5104.0]
  - - [1856, 64, 1, 128, 1856, 1856, 128, 64]
    - [109, 3208.0]
  - - [704, 128, 1, 128, 704, 704, 128, 128]
    - [80, 2720.0]
  - - [256, 704, 1, 3328, 256, 256, 3328, 704]
    - [109, 6049.0]
  - - [256, 448, 1, 128, 256, 256, 128, 448]
    - [110, 3164.0]
  - - [64, 3584, 1, 128, 64, 64, 128, 3584]
    - [83, 4782.0]
  - - [1024, 128, 1, 256, 1024, 1024, 256, 128]
    - [90, 4474.0]
  - - [2944, 64, 1, 1280, 2944, 2944, 1280, 64]
    - [105, 5603.0]
  - - [128, 1408, 1, 3328, 128, 128, 3328, 1408]
    - [96, 6016.0]
  - - [1408, 64, 1, 256, 1408, 1408, 256, 64]
    - [87, 3231.0]
  - - [64, 1856, 1, 128, 64, 64, 128, 1856]
    - [81, 3249.0]
  - - [64, 2368, 1, 256, 64, 64, 256, 2368]
    - [109, 4199.0]
  - - [1024, 128, 1, 3328, 1024, 1024, 3328, 128]
    - [109, 5798.0]
  - - [1856, 128, 1, 128, 1856, 1856, 128, 128]
    - [99, 4953.0]
  - - [2368, 64, 1, 1280, 2368, 2368, 1280, 64]
    - [103, 4984.0]
  - - [128, 1024, 1, 1280, 128, 128, 1280, 1024]
    - [83, 5734.0]
  - - [64, 4288, 1, 1280, 64, 64, 1280, 4288]
    - [83, 7330.0]
  - - [1408, 64, 1, 3328, 1408, 1408, 3328, 64]
    - [103, 4335.0]
  - - [64, 2944, 1, 1280, 64, 64, 1280, 2944]
    - [110, 5661.0]
  - - [256, 704, 1, 128, 256, 256, 128, 704]
    - [109, 4075.0]
  - - [256, 1024, 1, 128, 256, 256, 128, 1024]
    - [99, 5395.0]
  - - [64, 1408, 1, 1280, 64, 64, 1280, 1408]
    - [96, 4213.0]
  - - [448, 448, 1, 1280, 448, 448, 1280, 448]
    - [105, 6016.0]
  - - [1024, 256, 1, 1280, 1024, 1024, 1280, 256]
    - [107, 7026.0]
  - - [128, 1024, 1, 256, 128, 128, 256, 1024]
    - [107, 4498.0]
  - - [3584, 64, 1, 3328, 3584, 3584, 3328, 64]
    - [92, 6281.0]
  - - [1408, 128, 1, 256, 1408, 1408, 256, 128]
    - [88, 4857.0]
  - - [256, 1024, 1, 3328, 256, 256, 3328, 1024]
    - [83, 7160.0]
  - - [1856, 64, 1, 3328, 1856, 1856, 3328, 64]
    - [107, 5244.0]
  - - [448, 256, 1, 256, 448, 448, 256, 256]
    - [92, 4112.0]
  - - [128, 704, 1, 256, 128, 128, 256, 704]
    - [103, 3258.0]
  - - [64, 3584, 1, 1280, 64, 64, 1280, 3584]
    - [99, 6166.0]
  - - [3584, 64, 1, 256, 3584, 3584, 256, 64]
    - [92, 5271.0]
  - - [64, 1856, 1, 3328, 64, 64, 3328, 1856]
    - [97, 5380.0]
  - - [1408, 128, 1, 3328, 1408, 1408, 3328, 128]
    - [109, 6112.0]
  - - [128, 704, 1, 3328, 128, 128, 3328, 704]
    - [109, 4516.0]
  - - [128, 1856, 1, 256, 128, 128, 256, 1856]
    - [99, 5652.0]
  - - [64, 4288, 1, 256, 64, 64, 256, 4288]
    - [83, 6505.0]
  - - [256, 704, 1, 1280, 256, 256, 1280, 704]
    - [109, 5924.0]
  - - [64, 2368, 1, 128, 64, 64, 128, 2368]
    - [109, 3606.0]
  - - [64, 4288, 1, 128, 64, 64, 128, 4288]
    - [99, 5666.0]
  - - [1856, 128, 1, 256, 1856, 1856, 256, 128]
    - [107, 5642.0]
  - - [64, 1408, 1, 256, 64, 64, 256, 1408]
    - [88, 3277.0]
  - - [2944, 64, 1, 3328, 2944, 2944, 3328, 64]
    - [116, 5788.0]
  - - [128, 1408, 1, 1280, 128, 128, 1280, 1408]
    - [109, 5864.0]
  - - [448, 448, 1, 128, 448, 448, 128, 448]
    - [110, 4539.0]
  - - [704, 256, 1, 256, 704, 704, 256, 256]
    - [109, 4982.0]
  - - [512, 512, 1, 512, 512, 512, 512, 512]
    - [107, 6704.0]
  - - [384, 384, 1, 384, 384, 384, 384, 384]
    - [117, 5731.0]
  - - [3584, 4, 1, 1280, 3584, 3584, 1280, 4]
    - [121, 824.0]
  - - [2944, 4, 1, 256, 2944, 2944, 256, 4]
    - [121, 542.0]
  - - [2368, 4, 1, 1280, 2368, 2368, 1280, 4]
    - [119, 586.0]
  - - [6784, 4, 1, 1280, 6784, 6784, 1280, 4]
    - [122, 1004.0]
  - - [1856, 4, 1, 1280, 1856, 1856, 1280, 4]
    - [121, 514.0]
  - - [2944, 4, 1, 128, 2944, 2944, 128, 4]
    - [121, 421.0]
  - - [3584, 4, 1, 128, 3584, 3584, 128, 4]
    - [121, 501.0]
  - - [4288, 4, 1, 256, 4288, 4288, 256, 4]
    - [122, 734.0]
  - - [3584, 4, 1, 3328, 3584, 3584, 3328, 4]
    - [122, 842.0]
  - - [5888, 4, 1, 128, 5888, 5888, 128, 4]
    - [122, 685.0]
  - - [2368, 4, 1, 256, 2368, 2368, 256, 4]
    - [122, 452.0]
  - - [1408, 4, 1, 256, 1408, 1408, 256, 4]
    - [122, 288.0]
  - - [5056, 4, 1, 1280, 5056, 5056, 1280, 4]
    - [122, 981.0]
  - - [1408, 4, 1, 3328, 1408, 1408, 3328, 4]
    - [120, 365.0]
  - - [6784, 4, 1, 128, 6784, 6784, 128, 4]
    - [122, 718.0]
  - - [5888, 4, 1, 3328, 5888, 5888, 3328, 4]
    - [122, 1080.0]
  - - [5056, 4, 1, 128, 5056, 5056, 128, 4]
    - [119, 625.0]
  - - [5888, 4, 1, 1280, 5888, 5888, 1280, 4]
    - [122, 1037.0]
  - - [2944, 4, 1, 3328, 2944, 2944, 3328, 4]
    - [119, 710.0]
  - - [2368, 4, 1, 128, 2368, 2368, 128, 4]
    - [122, 348.0]
  - - [1856, 4, 1, 128, 1856, 1856, 128, 4]
    - [119, 278.0]
  - - [1408, 4, 1, 1280, 1408, 1408, 1280, 4]
    - [121, 400.0]
  - - [6784, 4, 1, 256, 6784, 6784, 256, 4]
    - [121, 784.0]
  - - [4288, 4, 1, 128, 4288, 4288, 128, 4]
    - [122, 581.0]
  - - [1856, 4, 1, 3328, 1856, 1856, 3328, 4]
    - [120, 480.0]
  - - [3584, 4, 1, 256, 3584, 3584, 256, 4]
    - [121, 628.0]
  - - [2368, 4, 1, 3328, 2368, 2368, 3328, 4]
    - [121, 569.0]
  - - [6784, 4, 1, 3328, 6784, 6784, 3328, 4]
    - [119, 1032.0]
  - - [4288, 4, 1, 1280, 4288, 4288, 1280, 4]
    - [119, 944.0]
  - - [1856, 4, 1, 256, 1856, 1856, 256, 4]
    - [122, 374.0]
  - - [1408, 4, 1, 128, 1408, 1408, 128, 4]
    - [104, 212.0]
  - - [5056, 4, 1, 256, 5056, 5056, 256, 4]
    - [119, 768.0]
  - - [4288, 4, 1, 3328, 4288, 4288, 3328, 4]
    - [122, 1005.0]
  - - [2944, 4, 1, 1280, 2944, 2944, 1280, 4]
    - [119, 704.0]
  - - [5888, 4, 1, 256, 5888, 5888, 256, 4]
    - [122, 826.0]
  - - [5056, 4, 1, 3328, 5056, 5056, 3328, 4]
    - [121, 1015.0]
  - - [4, 1856, 1, 3328, 4, 4, 3328, 1856]
    - [133, 741.0]
  - - [4, 2944, 1, 1280, 4, 4, 1280, 2944]
    - [126, 964.0]
  - - [4, 1408, 1, 128, 4, 4, 128, 1408]
    - [87, 215.0]
  - - [4, 2368, 1, 1280, 4, 4, 1280, 2368]
    - [126, 778.0]
  - - [4, 3584, 1, 128, 4, 4, 128, 3584]
    - [132, 501.0]
  - - [4, 5888, 1, 3328, 4, 4, 3328, 5888]
    - [129, 1492.0]
  - - [4, 1408, 1, 3328, 4, 4, 3328, 1408]
    - [130, 562.0]
  - - [4, 6784, 1, 3328, 4, 4, 3328, 6784]
    - [131, 1714.0]
  - - [4, 4288, 1, 128, 4, 4, 128, 4288]
    - [132, 597.0]
  - - [4, 5056, 1, 3328, 4, 4, 3328, 5056]
    - [132, 1374.0]
  - - [4, 6784, 1, 1280, 4, 4, 1280, 6784]
    - [127, 1614.0]
  - - [4, 2944, 1, 3328, 4, 4, 3328, 2944]
    - [133, 1059.0]
  - - [4, 5056, 1, 256, 4, 4, 256, 5056]
    - [124, 952.0]
  - - [4, 5056, 1, 1280, 4, 4, 1280, 5056]
    - [124, 1296.0]
  - - [4, 2368, 1, 3328, 4, 4, 3328, 2368]
    - [130, 858.0]
  - - [4, 1856, 1, 256, 4, 4, 256, 1856]
    - [125, 404.0]
  - - [4, 2368, 1, 256, 4, 4, 256, 2368]
    - [124, 474.0]
  - - [4, 2944, 1, 256, 4, 4, 256, 2944]
    - [129, 596.0]
  - - [4, 4288, 1, 1280, 4, 4, 1280, 4288]
    - [126, 1252.0]
  - - [4, 6784, 1, 128, 4, 4, 128, 6784]
    - [123, 886.0]
  - - [4, 3584, 1, 1280, 4, 4, 1280, 3584]
    - [133, 1058.0]
  - - [4, 5888, 1, 256, 4, 4, 256, 5888]
    - [132, 1061.0]
  - - [4, 6784, 1, 256, 4, 4, 256, 6784]
    - [128, 1106.0]
  - - [4, 1408, 1, 1280, 4, 4, 1280, 1408]
    - [126, 494.0]
  - - [4, 3584, 1, 256, 4, 4, 256, 3584]
    - [124, 708.0]
  - - [4, 1408, 1, 256, 4, 4, 256, 1408]
    - [125, 311.0]
  - - [4, 4288, 1, 3328, 4, 4, 3328, 4288]
    - [126, 1371.0]
  - - [4, 5888, 1, 1280, 4, 4, 1280, 5888]
    - [129, 1418.0]
  - - [4, 1856, 1, 1280, 4, 4, 1280, 1856]
    - [126, 649.0]
  - - [4, 1856, 1, 128, 4, 4, 128, 1856]
    - [87, 283.0]
  - - [4, 2944, 1, 128, 4, 4, 128, 2944]
    - [87, 423.0]
  - - [4, 5056, 1, 128, 4, 4, 128, 5056]
    - [132, 688.0]
  - - [4, 4288, 1, 256, 4, 4, 256, 4288]
    - [124, 832.0]
  - - [4, 3584, 1, 3328, 4, 4, 3328, 3584]
    - [126, 1167.0]
  - - [4, 5888, 1, 128, 4, 4, 128, 5888]
    - [129, 802.0]
  - - [4, 2368, 1, 128, 4, 4, 128, 2368]
    - [87, 355.0]
  - - [4, 704, 1, 1280, 4, 4, 1280, 704]
    - [86, 226.0]
  - - [128, 64, 1, 256, 128, 128, 256, 64]
    - [104, 477.0]
  - - [64, 4, 1, 256, 64, 64, 256, 4]
    - [93, 14.0]
  - - [64, 704, 1, 128, 64, 64, 128, 704]
    - [87, 1780.0]
  - - [448, 64, 1, 1280, 448, 448, 1280, 64]
    - [100, 2095.0]
  - - [128, 4, 1, 1280, 128, 128, 1280, 4]
    - [86, 43.0]
  - - [64, 1024, 1, 1280, 64, 64, 1280, 1024]
    - [82, 3495.0]
  - - [64, 704, 1, 1280, 64, 64, 1280, 704]
    - [84, 2866.0]
  - - [1024, 64, 1, 128, 1024, 1024, 128, 64]
    - [106, 2305.0]
  - - [64, 1024, 1, 3328, 64, 64, 3328, 1024]
    - [82, 3622.0]
  - - [1024, 64, 1, 1280, 1024, 1024, 1280, 64]
    - [88, 3654.0]
  - - [4, 704, 1, 256, 4, 4, 256, 704]
    - [93, 152.0]
  - - [704, 4, 1, 1280, 704, 704, 1280, 4]
    - [93, 243.0]
  - - [64, 448, 1, 256, 64, 64, 256, 448]
    - [87, 1549.0]
  - - [64, 1024, 1, 128, 64, 64, 128, 1024]
    - [82, 2383.0]
  - - [4, 64, 1, 1280, 4, 4, 1280, 64]
    - [112, 22.0]
  - - [128, 256, 1, 3328, 128, 128, 3328, 256]
    - [85, 2522.0]
  - - [64, 448, 1, 1280, 64, 64, 1280, 448]
    - [85, 2083.0]
  - - [448, 4, 1, 256, 448, 448, 256, 4]
    - [93, 100.0]
  - - [448, 4, 1, 1280, 448, 448, 1280, 4]
    - [93, 153.0]
  - - [128, 4, 1, 128, 128, 128, 128, 4]
    - [87, 20.0]
  - - [256, 4, 1, 128, 256, 256, 128, 4]
    - [87, 41.0]
  - - [704, 64, 1, 3328, 704, 704, 3328, 64]
    - [100, 3001.0]
  - - [64, 128, 1, 256, 64, 64, 256, 128]
    - [87, 481.0]
  - - [704, 64, 1, 128, 704, 704, 128, 64]
    - [87, 1848.0]
  - - [1024, 4, 1, 256, 1024, 1024, 256, 4]
    - [93, 228.0]
  - - [256, 256, 1, 128, 256, 256, 128, 256]
    - [98, 2370.0]
  - - [64, 256, 1, 128, 64, 64, 128, 256]
    - [115, 718.0]
  - - [704, 64, 1, 1280, 704, 704, 1280, 64]
    - [102, 2945.0]
  - - [128, 448, 1, 256, 128, 128, 256, 448]
    - [82, 2594.0]
  - - [128, 256, 1, 1280, 128, 128, 1280, 256]
    - [85, 2378.0]
  - - [448, 64, 1, 3328, 448, 448, 3328, 64]
    - [93, 2238.0]
  - - [256, 128, 1, 128, 256, 256, 128, 128]
    - [113, 1336.0]
  - - [64, 128, 1, 3328, 64, 64, 3328, 128]
    - [112, 780.0]
  - - [128, 128, 1, 3328, 128, 128, 3328, 128]
    - [86, 1469.0]
  - - [256, 128, 1, 256, 256, 256, 256, 128]
    - [87, 1755.0]
  - - [64, 448, 1, 3328, 64, 64, 3328, 448]
    - [84, 2220.0]
  - - [256, 256, 1, 3328, 256, 256, 3328, 256]
    - [82, 3612.0]
  - - [1024, 4, 1, 3328, 1024, 1024, 3328, 4]
    - [94, 357.0]
  - - [4, 4, 1, 256, 4, 4, 256, 4]
    - [80, 1.0]
  - - [256, 64, 1, 256, 256, 256, 256, 64]
    - [84, 958.0]
  - - [256, 128, 1, 1280, 256, 256, 1280, 128]
    - [85, 2370.0]
  - - [128, 64, 1, 1280, 128, 128, 1280, 64]
    - [86, 699.0]
  - - [4, 448, 1, 3328, 4, 4, 3328, 448]
    - [86, 169.0]
  - - [64, 1024, 1, 256, 64, 64, 256, 1024]
    - [82, 2873.0]
  - - [256, 4, 1, 1280, 256, 256, 1280, 4]
    - [101, 86.0]
  - - [64, 704, 1, 256, 64, 64, 256, 704]
    - [87, 2335.0]
  - - [4, 704, 1, 128, 4, 4, 128, 704]
    - [93, 108.0]
  - - [448, 128, 1, 256, 448, 448, 256, 128]
    - [87, 2558.0]
  - - [448, 64, 1, 128, 448, 448, 128, 64]
    - [87, 1184.0]
  - - [4, 448, 1, 1280, 4, 4, 1280, 448]
    - [86, 151.0]
  - - [256, 256, 1, 256, 256, 256, 256, 256]
    - [82, 2844.0]
  - - [256, 64, 1, 128, 256, 256, 128, 64]
    - [87, 677.0]
  - - [4, 1024, 1, 3328, 4, 4, 3328, 1024]
    - [86, 367.0]
  - - [704, 4, 1, 128, 704, 704, 128, 4]
    - [113, 111.0]
  - - [256, 4, 1, 256, 256, 256, 256, 4]
    - [113, 56.0]
  - - [256, 4, 1, 3328, 256, 256, 3328, 4]
    - [86, 96.0]
  - - [4, 256, 1, 256, 4, 4, 256, 256]
    - [93, 55.0]
  - - [4, 4, 1, 128, 4, 4, 128, 4]
    - [80, 1.0]
  - - [4, 128, 1, 256, 4, 4, 256, 128]
    - [93, 28.0]
  - - [64, 64, 1, 1280, 64, 64, 1280, 64]
    - [112, 351.0]
  - - [448, 128, 1, 3328, 448, 448, 3328, 128]
    - [108, 3321.0]
  - - [4, 448, 1, 128, 4, 4, 128, 448]
    - [104, 70.0]
  - - [64, 256, 1, 1280, 64, 64, 1280, 256]
    - [118, 1312.0]
  - - [4, 128, 1, 3328, 4, 4, 3328, 128]
    - [94, 48.0]
  - - [64, 4, 1, 128, 64, 64, 128, 4]
    - [87, 10.0]
  - - [64, 64, 1, 256, 64, 64, 256, 64]
    - [93, 240.0]
  - - [4, 704, 1, 3328, 4, 4, 3328, 704]
    - [94, 253.0]
  - - [4, 4, 1, 1280, 4, 4, 1280, 4]
    - [80, 1.0]
  - - [128, 128, 1, 128, 128, 128, 128, 128]
    - [84, 699.0]
  - - [1024, 4, 1, 128, 1024, 1024, 128, 4]
    - [89, 159.0]
  - - [64, 64, 1, 3328, 64, 64, 3328, 64]
    - [86, 390.0]
  - - [4, 64, 1, 128, 4, 4, 128, 64]
    - [87, 10.0]
  - - [64, 128, 1, 1280, 64, 64, 1280, 128]
    - [112, 703.0]
  - - [128, 128, 1, 1280, 128, 128, 1280, 128]
    - [93, 1336.0]
  - - [128, 256, 1, 256, 128, 128, 256, 256]
    - [87, 1770.0]
  - - [256, 64, 1, 1280, 256, 256, 1280, 64]
    - [93, 1372.0]
  - - [1024, 4, 1, 1280, 1024, 1024, 1280, 4]
    - [93, 342.0]
  - - [704, 64, 1, 256, 704, 704, 256, 64]
    - [87, 2316.0]
  - - [128, 448, 1, 1280, 128, 128, 1280, 448]
    - [108, 3211.0]
  - - [128, 64, 1, 3328, 128, 128, 3328, 64]
    - [86, 778.0]
  - - [448, 64, 1, 256, 448, 448, 256, 64]
    - [87, 1542.0]
  - - [4, 256, 1, 128, 4, 4, 128, 256]
    - [87, 39.0]
  - - [1024, 64, 1, 256, 1024, 1024, 256, 64]
    - [106, 2787.0]
  - - [64, 128, 1, 128, 64, 64, 128, 128]
    - [104, 354.0]
  - - [4, 4, 1, 3328, 4, 4, 3328, 4]
    - [80, 1.0]
  - - [4, 1024, 1, 1280, 4, 4, 1280, 1024]
    - [94, 326.0]
  - - [704, 4, 1, 256, 704, 704, 256, 4]
    - [93, 155.0]
  - - [128, 4, 1, 3328, 128, 128, 3328, 4]
    - [86, 48.0]
  - - [448, 4, 1, 3328, 448, 448, 3328, 4]
    - [86, 168.0]
  - - [704, 4, 1, 3328, 704, 704, 3328, 4]
    - [94, 253.0]
  - - [448, 128, 1, 1280, 448, 448, 1280, 128]
    - [108, 3189.0]
  - - [1024, 64, 1, 3328, 1024, 1024, 3328, 64]
    - [91, 3564.0]
  - - [4, 1024, 1, 128, 4, 4, 128, 1024]
    - [93, 157.0]
  - - [64, 256, 1, 3328, 64, 64, 3328, 256]
    - [101, 1470.0]
  - - [448, 128, 1, 128, 448, 448, 128, 128]
    - [82, 2050.0]
  - - [128, 256, 1, 128, 128, 128, 128, 256]
    - [87, 1344.0]
  - - [128, 4, 1, 256, 128, 128, 256, 4]
    - [87, 28.0]
  - - [256, 256, 1, 1280, 256, 256, 1280, 256]
    - [82, 3489.0]
  - - [256, 128, 1, 3328, 256, 256, 3328, 128]
    - [85, 2520.0]
  - - [448, 4, 1, 128, 448, 448, 128, 4]
    - [87, 70.0]
  - - [4, 256, 1, 3328, 4, 4, 3328, 256]
    - [101, 97.0]
  - - [4, 128, 1, 128, 4, 4, 128, 128]
    - [87, 20.0]
  - - [4, 256, 1, 1280, 4, 4, 1280, 256]
    - [86, 86.0]
  - - [64, 4, 1, 3328, 64, 64, 3328, 4]
    - [86, 24.0]
  - - [4, 64, 1, 3328, 4, 4, 3328, 64]
    - [86, 24.0]
  - - [4, 1024, 1, 256, 4, 4, 256, 1024]
    - [93, 225.0]
  - - [64, 256, 1, 256, 64, 64, 256, 256]
    - [93, 936.0]
  - - [4, 64, 1, 256, 4, 4, 256, 64]
    - [93, 14.0]
  - - [128, 448, 1, 128, 128, 128, 128, 448]
    - [82, 2097.0]
  - - [64, 448, 1, 128, 64, 64, 128, 448]
    - [87, 1176.0]
  - - [64, 704, 1, 3328, 64, 64, 3328, 704]
    - [111, 3007.0]
  - - [128, 448, 1, 3328, 128, 128, 3328, 448]
    - [95, 3352.0]
  - - [4, 448, 1, 256, 4, 4, 256, 448]
    - [93, 98.0]
  - - [4, 128, 1, 1280, 4, 4, 1280, 128]
    - [86, 43.0]
  - - [128, 64, 1, 128, 128, 128, 128, 64]
    - [87, 343.0]
  - - [64, 64, 1, 128, 64, 64, 128, 64]
    - [89, 176.0]
  - - [64, 4, 1, 1280, 64, 64, 1280, 4]
    - [86, 21.0]
  - - [256, 64, 1, 3328, 256, 256, 3328, 64]
    - [112, 1467.0]
  - - [128, 128, 1, 256, 128, 128, 256, 128]
    - [104, 949.0]
- null
