library/src/blas3/Tensile/Logic/asm_full/navi21_Cijk_Ailk_Bljk_I8II_BH_GB.yaml
---
- {MinimumRequiredVersion: 4.27.0}
- navi21
- gfx1030
    SolutionIndex: 0
    SolutionNameMin: Cijk_Ailk_Bljk_I8II_BH_GB_MT64x64x16_SN_EPS1_GRVW8_LRVW8_SU0_SUM0_SUS128_TT8_8_VW8_WG8_8_1_WGM1
    SolutionIndex: 1
    SolutionNameMin: Cijk_Ailk_Bljk_I8II_BH_GB_MT64x32x8_SN_EPS1_GRVW4_LRVW4_SU0_SUM0_SUS256_TT8_4_VW4_WG8_8_1_WGM1
    SolutionIndex: 2
    SolutionNameMin: Cijk_Ailk_Bljk_I8II_BH_GB_MT32x32x16_SN_EPS1_GRVW4_LRVW4_SU0_SUM0_SUS256_TT4_4_VW4_WG8_8_1_WGM1
    SolutionIndex: 3
    SolutionNameMin: Cijk_Ailk_Bljk_I8II_BH_GB_MT128x64x16_SN_EPS1_GRVW8_LRVW8_SU0_SUM0_SUS256_TT16_8_VW8_WG8_8_1_WGM1
    SolutionIndex: 4
    SolutionNameMin: Cijk_Ailk_Bljk_I8II_BH_GB_MT32x32x16_SN_EPS1_GRVW4_LRVW4_SU32_SUM3_SUS128_TT4_4_VW4_WG8_8_1_WGM1
    SolutionIndex: 5
    SolutionNameMin: Cijk_Ailk_Bljk_I8II_BH_GB_MT32x32x16_SN_EPS1_GRVW4_LRVW4_SU32_SUM0_SUS256_TT4_4_VW4_WG8_8_1_WGM1
    SolutionIndex: 6
    SolutionNameMin: Cijk_Ailk_Bljk_I8II_BH_GB_MT64x64x16_SN_EPS1_GRVW8_LRVW8_SU32_SUM3_SUS256_TT8_8_VW8_WG8_8_1_WGM1
    SolutionIndex: 7
    SolutionNameMin: Cijk_Ailk_Bljk_I8II_BH_GB_MT32x32x16_SN_EPS1_GRVW4_LRVW4_SU0_SUM0_SUS128_TT4_4_VW4_WG8_8_1_WGM4
    SolutionIndex: 8
    SolutionNameMin: Cijk_Ailk_Bljk_I8II_BH_GB_MT128x64x16_SN_EPS1_GRVW4_LRVW4_SU0_SUM0_SUS256_TT8_4_VW4_WG16_16_1_WGM4
    SolutionIndex: 9
    SolutionNameMin: Cijk_Ailk_Bljk_I8II_BH_GB_MT32x32x8_SN_EPS1_GRVW4_LRVW4_SU0_SUM0_SUS128_TT4_4_VW4_WG8_8_1_WGM8
    SolutionIndex: 10
    SolutionNameMin: Cijk_Ailk_Bljk_I8II_BH_GB_MT64x32x8_SN_EPS0_GRVW4_LRVW4_SU0_SUM0_SUS128_TT8_4_VW4_WG8_8_1_WGM1
    SolutionIndex: 11
    SolutionNameMin: Cijk_Ailk_Bljk_I8II_BH_GB_MT32x64x16_SN_EPS0_GRVW4_LRVW4_SU0_SUM0_SUS128_TT4_4_VW4_WG8_16_1_WGM1
    SolutionIndex: 12
    SolutionNameMin: Cijk_Ailk_Bljk_I8II_BH_GB_MT32x32x16_SN_EPS0_GRVW4_LRVW4_SU0_SUM0_SUS128_TT4_4_VW4_WG8_8_1_WGM1
    SolutionIndex: 13
    SolutionNameMin: Cijk_Ailk_Bljk_I8II_BH_GB_MT64x32x16_SN_EPS0_GRVW4_LRVW4_SU0_SUM0_SUS128_TT8_4_VW4_WG8_8_1_WGM1
    SolutionIndex: 14
    SolutionNameMin: Cijk_Ailk_Bljk_I8II_BH_GB_MT64x64x16_SN_EPS0_GRVW4_LRVW4_SU0_SUM0_SUS128_TT4_4_VW4_WG16_16_1_WGM1
    SolutionIndex: 15
    SolutionNameMin: Cijk_Ailk_Bljk_I8II_BH_GB_MT32x32x32_SN_EPS0_GRVW4_LRVW4_SU0_SUM0_SUS128_TT4_4_VW4_WG8_8_1_WGM1
    SolutionIndex: 16
    SolutionNameMin: Cijk_Ailk_Bljk_I8II_BH_GB_MT32x32x8_SN_EPS0_GRVW4_LRVW4_SU0_SUM0_SUS256_TT4_4_VW4_WG8_8_1_WGM1
    SolutionIndex: 17
    SolutionNameMin: Cijk_Ailk_Bljk_I8II_BH_GB_MT64x32x8_SN_EPS0_GRVW4_LRVW4_SU0_SUM0_SUS256_TT8_4_VW4_WG8_8_1_WGM1
    SolutionIndex: 18
    SolutionNameMin: Cijk_Ailk_Bljk_I8II_BH_GB_MT32x32x16_SN_EPS0_GRVW4_LRVW4_SU0_SUM0_SUS256_TT4_4_VW4_WG8_8_1_WGM1
    SolutionIndex: 19
    SolutionNameMin: Cijk_Ailk_Bljk_I8II_BH_GB_MT64x32x16_SN_EPS0_GRVW4_LRVW4_SU0_SUM0_SUS256_TT8_4_VW4_WG8_8_1_WGM1
    SolutionIndex: 20
    SolutionNameMin: Cijk_Ailk_Bljk_I8II_BH_GB_MT32x32x32_SN_EPS0_GRVW4_LRVW4_SU0_SUM0_SUS256_TT4_4_VW4_WG8_8_1_WGM1
    SolutionIndex: 21
    SolutionNameMin: Cijk_Ailk_Bljk_I8II_BH_GB_MT32x32x16_SN_EPS0_GRVW4_LRVW4_SU32_SUM0_SUS128_TT4_4_VW4_WG8_8_1_WGM1
    SolutionIndex: 22
    SolutionNameMin: Cijk_Ailk_Bljk_I8II_BH_GB_MT32x32x32_SN_EPS0_GRVW4_LRVW4_SU32_SUM0_SUS128_TT4_4_VW4_WG8_8_1_WGM1
    SolutionIndex: 23
    SolutionNameMin: Cijk_Ailk_Bljk_I8II_BH_GB_MT64x64x16_SN_EPS0_GRVW8_LRVW8_SU32_SUM0_SUS128_TT8_8_VW8_WG8_8_1_WGM1
    SolutionIndex: 24
    SolutionNameMin: Cijk_Ailk_Bljk_I8II_BH_GB_MT64x64x8_SN_EPS0_GRVW4_LRVW4_SU32_SUM3_SUS128_TT8_8_VW4_WG8_8_1_WGM1
    SolutionIndex: 25
    SolutionNameMin: Cijk_Ailk_Bljk_I8II_BH_GB_MT32x32x32_SN_EPS0_GRVW4_LRVW4_SU32_SUM3_SUS128_TT4_4_VW4_WG8_8_1_WGM1
    SolutionIndex: 26
    SolutionNameMin: Cijk_Ailk_Bljk_I8II_BH_GB_MT128x64x16_SN_EPS0_GRVW8_LRVW8_SU32_SUM3_SUS128_TT16_8_VW8_WG8_8_1_WGM1
    SolutionIndex: 27
    SolutionNameMin: Cijk_Ailk_Bljk_I8II_BH_GB_MT64x32x8_SN_EPS0_GRVW4_LRVW4_SU32_SUM0_SUS256_TT8_4_VW4_WG8_8_1_WGM1
    SolutionIndex: 28
    SolutionNameMin: Cijk_Ailk_Bljk_I8II_BH_GB_MT32x32x32_SN_EPS0_GRVW4_LRVW4_SU32_SUM0_SUS256_TT4_4_VW4_WG8_8_1_WGM1
    SolutionIndex: 29
    SolutionNameMin: Cijk_Ailk_Bljk_I8II_BH_GB_MT128x64x16_SN_EPS0_GRVW8_LRVW8_SU32_SUM0_SUS256_TT16_8_VW8_WG8_8_1_WGM1
    SolutionIndex: 30
    SolutionNameMin: Cijk_Ailk_Bljk_I8II_BH_GB_MT32x32x32_SN_EPS0_GRVW4_LRVW4_SU32_SUM3_SUS256_TT4_4_VW4_WG8_8_1_WGM1
    SolutionIndex: 31
    SolutionNameMin: Cijk_Ailk_Bljk_I8II_BH_GB_MT64x64x16_SN_EPS0_GRVW8_LRVW8_SU32_SUM3_SUS256_TT8_8_VW8_WG8_8_1_WGM1
    SolutionIndex: 32
    SolutionNameMin: Cijk_Ailk_Bljk_I8II_BH_GB_MT64x64x16_SN_EPS0_GRVW4_LRVW4_SU0_SUM0_SUS128_TT4_4_VW4_WG16_16_1_WGM4
    SolutionIndex: 33
    SolutionNameMin: Cijk_Ailk_Bljk_I8II_BH_GB_MT128x64x16_SN_EPS0_GRVW4_LRVW4_SU0_SUM0_SUS128_TT8_4_VW4_WG16_16_1_WGM4
    SolutionIndex: 34
    SolutionNameMin: Cijk_Ailk_Bljk_I8II_BH_GB_MT128x128x16_SN_EPS0_GRVW8_LRVW8_SU0_SUM0_SUS128_TT8_8_VW8_WG16_16_1_WGM4
    SolutionIndex: 35
    SolutionNameMin: Cijk_Ailk_Bljk_I8II_BH_GB_MT64x64x16_SN_EPS0_GRVW4_LRVW4_SU0_SUM0_SUS256_TT4_4_VW4_WG16_16_1_WGM4
    SolutionIndex: 36
    SolutionNameMin: Cijk_Ailk_Bljk_I8II_BH_GB_MT256x128x8_SN_EPS0_GRVW8_LRVW8_SU0_SUM0_SUS256_TT16_8_VW8_WG16_16_1_WGM4
    SolutionIndex: 37
    SolutionNameMin: Cijk_Ailk_Bljk_I8II_BH_GB_MT32x32x32_SN_EPS0_GRVW4_LRVW4_SU32_SUM0_SUS128_TT4_4_VW4_WG8_8_1_WGM4
    SolutionIndex: 38
    SolutionNameMin: Cijk_Ailk_Bljk_I8II_BH_GB_MT32x32x32_SN_EPS0_GRVW4_LRVW4_SU32_SUM3_SUS128_TT4_4_VW4_WG8_8_1_WGM4
    SolutionIndex: 39
    SolutionNameMin: Cijk_Ailk_Bljk_I8II_BH_GB_MT64x32x16_SN_EPS0_GRVW4_LRVW4_SU32_SUM0_SUS256_TT8_4_VW4_WG8_8_1_WGM4
    SolutionIndex: 40
    SolutionNameMin: Cijk_Ailk_Bljk_I8II_BH_GB_MT32x32x32_SN_EPS0_GRVW4_LRVW4_SU32_SUM0_SUS256_TT4_4_VW4_WG8_8_1_WGM4
    SolutionIndex: 41
    SolutionNameMin: Cijk_Ailk_Bljk_I8II_BH_GB_MT32x32x32_SN_EPS0_GRVW4_LRVW4_SU32_SUM3_SUS256_TT4_4_VW4_WG8_8_1_WGM4
    SolutionIndex: 42
    SolutionNameMin: Cijk_Ailk_Bljk_I8II_BH_GB_MT64x64x16_SN_EPS0_GRVW4_LRVW4_SU0_SUM0_SUS256_TT4_4_VW4_WG16_16_1_WGM8
    SolutionIndex: 43
    SolutionNameMin: Cijk_Ailk_Bljk_I8II_BH_GB_MT32x32x32_SN_EPS0_GRVW4_LRVW4_SU0_SUM0_SUS256_TT4_4_VW4_WG8_8_1_WGM8
    SolutionIndex: 44
    SolutionNameMin: Cijk_Ailk_Bljk_I8II_BH_GB_MT32x32x32_SN_EPS0_GRVW4_LRVW4_SU32_SUM0_SUS128_TT4_4_VW4_WG8_8_1_WGM8
    SolutionIndex: 45
    SolutionNameMin: Cijk_Ailk_Bljk_I8II_BH_GB_MT32x32x16_SN_EPS0_GRVW4_LRVW4_SU32_SUM3_SUS128_TT4_4_VW4_WG8_8_1_WGM8
    SolutionIndex: 46
    SolutionNameMin: Cijk_Ailk_Bljk_I8II_BH_GB_MT32x32x32_SN_EPS0_GRVW4_LRVW4_SU32_SUM3_SUS128_TT4_4_VW4_WG8_8_1_WGM8
    SolutionIndex: 47
    SolutionNameMin: Cijk_Ailk_Bljk_I8II_BH_GB_MT32x32x32_SN_EPS0_GRVW4_LRVW4_SU32_SUM0_SUS256_TT4_4_VW4_WG8_8_1_WGM8
    SolutionIndex: 48
    SolutionNameMin: Cijk_Ailk_Bljk_I8II_BH_GB_MT32x32x16_SN_EPS0_GRVW4_LRVW4_SU32_SUM3_SUS256_TT4_4_VW4_WG8_8_1_WGM8
    SolutionIndex: 49
    SolutionNameMin: Cijk_Ailk_Bljk_I8II_BH_GB_MT32x32x32_SN_EPS0_GRVW4_LRVW4_SU32_SUM3_SUS256_TT4_4_VW4_WG8_8_1_WGM8
- - - [768, 1024, 1, 1024, 768, 768, 768, 1024]
    - [34, 24418.0]
  - - [1536, 2048, 1, 2048, 1536, 1536, 1536, 2048]
    - [36, 33801.0]
  - - [32, 32, 1, 32, 32, 32, 32, 32]
    - [7, 19.0]
  - - [32, 32, 1, 64, 32, 32, 32, 64]
    - [12, 32.0]
  - - [32, 32, 1, 128, 32, 32, 32, 128]
    - [12, 47.0]
  - - [32, 32, 1, 256, 32, 32, 32, 256]
    - [15, 69.0]
  - - [32, 32, 1, 512, 32, 32, 32, 512]
    - [25, 91.0]
  - - [32, 32, 1, 1024, 32, 32, 32, 1024]
    - [22, 108.0]
  - - [32, 64, 1, 32, 32, 32, 32, 32]
    - [12, 38.0]
  - - [32, 64, 1, 64, 32, 32, 32, 64]
    - [12, 63.0]
  - - [32, 64, 1, 128, 32, 32, 32, 128]
    - [12, 94.0]
  - - [32, 64, 1, 256, 32, 32, 32, 256]
    - [25, 142.0]
  - - [32, 64, 1, 512, 32, 32, 32, 512]
    - [25, 189.0]
  - - [32, 64, 1, 1024, 32, 32, 32, 1024]
    - [41, 222.0]
  - - [32, 128, 1, 32, 32, 32, 32, 32]
    - [11, 75.0]
  - - [32, 128, 1, 64, 32, 32, 32, 64]
    - [12, 126.0]
  - - [32, 128, 1, 128, 32, 32, 32, 128]
    - [15, 189.0]
  - - [32, 128, 1, 256, 32, 32, 32, 256]
    - [25, 288.0]
  - - [32, 128, 1, 512, 32, 32, 32, 512]
    - [46, 387.0]
  - - [32, 128, 1, 1024, 32, 32, 32, 1024]
    - [41, 460.0]
  - - [32, 256, 1, 32, 32, 32, 32, 32]
    - [18, 151.0]
  - - [32, 256, 1, 64, 32, 32, 32, 64]
    - [12, 255.0]
  - - [32, 256, 1, 128, 32, 32, 32, 128]
    - [18, 377.0]
  - - [32, 256, 1, 256, 32, 32, 32, 256]
    - [38, 570.0]
  - - [32, 256, 1, 512, 32, 32, 32, 512]
    - [25, 774.0]
  - - [32, 256, 1, 1024, 32, 32, 32, 1024]
    - [25, 936.0]
  - - [32, 512, 1, 32, 32, 32, 32, 32]
    - [12, 301.0]
  - - [32, 512, 1, 64, 32, 32, 32, 64]
    - [12, 509.0]
  - - [32, 512, 1, 128, 32, 32, 32, 128]
    - [15, 760.0]
  - - [32, 512, 1, 256, 32, 32, 32, 256]
    - [25, 1146.0]
  - - [32, 512, 1, 512, 32, 32, 32, 512]
    - [25, 1548.0]
  - - [32, 512, 1, 1024, 32, 32, 32, 1024]
    - [25, 1868.0]
  - - [32, 1024, 1, 32, 32, 32, 32, 32]
    - [12, 603.0]
  - - [32, 1024, 1, 64, 32, 32, 32, 64]
    - [12, 1028.0]
  - - [32, 1024, 1, 128, 32, 32, 32, 128]
    - [12, 1520.0]
  - - [32, 1024, 1, 256, 32, 32, 32, 256]
    - [20, 2208.0]
  - - [32, 1024, 1, 512, 32, 32, 32, 512]
    - [25, 2787.0]
  - - [32, 1024, 1, 1024, 32, 32, 32, 1024]
    - [25, 3245.0]
  - - [64, 32, 1, 32, 64, 64, 64, 32]
    - [12, 38.0]
  - - [64, 32, 1, 64, 64, 64, 64, 64]
    - [12, 62.0]
  - - [64, 32, 1, 128, 64, 64, 64, 128]
    - [15, 94.0]
  - - [64, 32, 1, 256, 64, 64, 64, 256]
    - [22, 141.0]
  - - [64, 32, 1, 512, 64, 64, 64, 512]
    - [22, 189.0]
  - - [64, 32, 1, 1024, 64, 64, 64, 1024]
    - [47, 224.0]
  - - [64, 64, 1, 32, 64, 64, 64, 32]
    - [14, 75.0]
  - - [64, 64, 1, 64, 64, 64, 64, 64]
    - [12, 124.0]
  - - [64, 64, 1, 128, 64, 64, 64, 128]
    - [20, 186.0]
  - - [64, 64, 1, 256, 64, 64, 64, 256]
    - [22, 286.0]
  - - [64, 64, 1, 512, 64, 64, 64, 512]
    - [38, 384.0]
  - - [64, 64, 1, 1024, 64, 64, 64, 1024]
    - [30, 462.0]
  - - [64, 128, 1, 32, 64, 64, 64, 32]
    - [14, 151.0]
  - - [64, 128, 1, 64, 64, 64, 64, 64]
    - [12, 255.0]
  - - [64, 128, 1, 128, 64, 64, 64, 128]
    - [18, 374.0]
  - - [64, 128, 1, 256, 64, 64, 64, 256]
    - [22, 573.0]
  - - [64, 128, 1, 512, 64, 64, 64, 512]
    - [38, 774.0]
  - - [64, 128, 1, 1024, 64, 64, 64, 1024]
    - [25, 932.0]
  - - [64, 256, 1, 32, 64, 64, 64, 32]
    - [14, 305.0]
  - - [64, 256, 1, 64, 64, 64, 64, 64]
    - [12, 504.0]
  - - [64, 256, 1, 128, 64, 64, 64, 128]
    - [12, 749.0]
  - - [64, 256, 1, 256, 64, 64, 64, 256]
    - [22, 1152.0]
  - - [64, 256, 1, 512, 64, 64, 64, 512]
    - [25, 1559.0]
  - - [64, 256, 1, 1024, 64, 64, 64, 1024]
    - [25, 1868.0]
  - - [64, 512, 1, 32, 64, 64, 64, 32]
    - [14, 596.0]
  - - [64, 512, 1, 64, 64, 64, 64, 64]
    - [12, 999.0]
  - - [64, 512, 1, 128, 64, 64, 64, 128]
    - [15, 1498.0]
  - - [64, 512, 1, 256, 64, 64, 64, 256]
    - [20, 2185.0]
  - - [64, 512, 1, 512, 64, 64, 64, 512]
    - [20, 2778.0]
  - - [64, 512, 1, 1024, 64, 64, 64, 1024]
    - [30, 3226.0]
  - - [64, 1024, 1, 32, 64, 64, 64, 32]
    - [12, 1140.0]
  - - [64, 1024, 1, 64, 64, 64, 64, 64]
    - [12, 1942.0]
  - - [64, 1024, 1, 128, 64, 64, 64, 128]
    - [12, 2913.0]
  - - [64, 1024, 1, 256, 64, 64, 64, 256]
    - [15, 4173.0]
  - - [64, 1024, 1, 512, 64, 64, 64, 512]
    - [4, 5360.0]
  - - [64, 1024, 1, 1024, 64, 64, 64, 1024]
    - [4, 5765.0]
  - - [128, 32, 1, 32, 128, 128, 128, 32]
    - [12, 74.0]
  - - [128, 32, 1, 64, 128, 128, 128, 64]
    - [12, 125.0]
  - - [128, 32, 1, 128, 128, 128, 128, 128]
    - [15, 187.0]
  - - [128, 32, 1, 256, 128, 128, 128, 256]
    - [25, 286.0]
  - - [128, 32, 1, 512, 128, 128, 128, 512]
    - [22, 387.0]
  - - [128, 32, 1, 1024, 128, 128, 128, 1024]
    - [30, 460.0]
  - - [128, 64, 1, 32, 128, 128, 128, 32]
    - [14, 152.0]
  - - [128, 64, 1, 64, 128, 128, 128, 64]
    - [18, 250.0]
  - - [128, 64, 1, 128, 128, 128, 128, 128]
    - [20, 374.0]
  - - [128, 64, 1, 256, 128, 128, 128, 256]
    - [25, 573.0]
  - - [128, 64, 1, 512, 128, 128, 128, 512]
    - [22, 774.0]
  - - [128, 64, 1, 1024, 128, 128, 128, 1024]
    - [25, 934.0]
  - - [128, 128, 1, 32, 128, 128, 128, 32]
    - [12, 301.0]
  - - [128, 128, 1, 64, 128, 128, 128, 64]
    - [12, 504.0]
  - - [128, 128, 1, 128, 128, 128, 128, 128]
    - [15, 749.0]
  - - [128, 128, 1, 256, 128, 128, 128, 256]
    - [25, 1146.0]
  - - [128, 128, 1, 512, 128, 128, 128, 512]
    - [25, 1559.0]
  - - [128, 128, 1, 1024, 128, 128, 128, 1024]
    - [25, 1868.0]
  - - [128, 256, 1, 32, 128, 128, 128, 32]
    - [42, 596.0]
  - - [128, 256, 1, 64, 128, 128, 128, 64]
    - [12, 989.0]
  - - [128, 256, 1, 128, 128, 128, 128, 128]
    - [15, 1498.0]
  - - [128, 256, 1, 256, 128, 128, 128, 256]
    - [38, 2196.0]
  - - [128, 256, 1, 512, 128, 128, 128, 512]
    - [30, 2913.0]
  - - [128, 256, 1, 1024, 128, 128, 128, 1024]
    - [49, 3403.0]
  - - [128, 512, 1, 32, 128, 128, 128, 32]
    - [16, 1140.0]
  - - [128, 512, 1, 64, 128, 128, 128, 64]
    - [12, 1924.0]
  - - [128, 512, 1, 128, 128, 128, 128, 128]
    - [15, 2913.0]
  - - [128, 512, 1, 256, 128, 128, 128, 256]
    - [21, 4194.0]
  - - [128, 512, 1, 512, 128, 128, 128, 512]
    - [4, 5447.0]
  - - [128, 512, 1, 1024, 128, 128, 128, 1024]
    - [4, 5836.0]
  - - [128, 1024, 1, 32, 128, 128, 128, 32]
    - [32, 2162.0]
  - - [128, 1024, 1, 64, 128, 128, 128, 64]
    - [12, 3616.0]
  - - [128, 1024, 1, 128, 128, 128, 128, 128]
    - [12, 5412.0]
  - - [128, 1024, 1, 256, 128, 128, 128, 256]
    - [12, 7232.0]
  - - [128, 1024, 1, 512, 128, 128, 128, 512]
    - [12, 8604.0]
  - - [128, 1024, 1, 1024, 128, 128, 128, 1024]
    - [18, 9412.0]
  - - [256, 32, 1, 32, 256, 256, 256, 32]
    - [12, 149.0]
  - - [256, 32, 1, 64, 256, 256, 256, 64]
    - [12, 252.0]
  - - [256, 32, 1, 128, 256, 256, 256, 128]
    - [20, 374.0]
  - - [256, 32, 1, 256, 256, 256, 256, 256]
    - [25, 573.0]
  - - [256, 32, 1, 512, 256, 256, 256, 512]
    - [37, 783.0]
  - - [256, 32, 1, 1024, 256, 256, 256, 1024]
    - [30, 928.0]
  - - [256, 64, 1, 32, 256, 256, 256, 32]
    - [14, 305.0]
  - - [256, 64, 1, 64, 256, 256, 256, 64]
    - [12, 504.0]
  - - [256, 64, 1, 128, 256, 256, 256, 128]
    - [15, 754.0]
  - - [256, 64, 1, 256, 256, 256, 256, 256]
    - [22, 1146.0]
  - - [256, 64, 1, 512, 256, 256, 256, 512]
    - [25, 1571.0]
  - - [256, 64, 1, 1024, 256, 256, 256, 1024]
    - [30, 1856.0]
  - - [256, 128, 1, 32, 256, 256, 256, 32]
    - [12, 589.0]
  - - [256, 128, 1, 64, 256, 256, 256, 64]
    - [12, 989.0]
  - - [256, 128, 1, 128, 256, 256, 256, 128]
    - [44, 1487.0]
  - - [256, 128, 1, 256, 256, 256, 256, 256]
    - [25, 2243.0]
  - - [256, 128, 1, 512, 256, 256, 256, 512]
    - [28, 2943.0]
  - - [256, 128, 1, 1024, 256, 256, 256, 1024]
    - [15, 3424.0]
  - - [256, 256, 1, 32, 256, 256, 256, 32]
    - [32, 1165.0]
  - - [256, 256, 1, 64, 256, 256, 256, 64]
    - [12, 1889.0]
  - - [256, 256, 1, 128, 256, 256, 256, 128]
    - [15, 2893.0]
  - - [256, 256, 1, 256, 256, 256, 256, 256]
    - [21, 4215.0]
  - - [256, 256, 1, 512, 256, 256, 256, 512]
    - [4, 5501.0]
  - - [256, 256, 1, 1024, 256, 256, 256, 1024]
    - [22, 5649.0]
  - - [256, 512, 1, 32, 256, 256, 256, 32]
    - [32, 2162.0]
  - - [256, 512, 1, 64, 256, 256, 256, 64]
    - [12, 3554.0]
  - - [256, 512, 1, 128, 256, 256, 256, 128]
    - [12, 5377.0]
  - - [256, 512, 1, 256, 256, 256, 256, 256]
    - [45, 7201.0]
  - - [256, 512, 1, 512, 256, 256, 256, 512]
    - [12, 8626.0]
  - - [256, 512, 1, 1024, 256, 256, 256, 1024]
    - [12, 9479.0]
  - - [256, 1024, 1, 32, 256, 256, 256, 32]
    - [32, 3884.0]
  - - [256, 1024, 1, 64, 256, 256, 256, 64]
    - [9, 5866.0]
  - - [256, 1024, 1, 128, 256, 256, 256, 128]
    - [19, 8560.0]
  - - [256, 1024, 1, 256, 256, 256, 256, 256]
    - [13, 11148.0]
  - - [256, 1024, 1, 512, 256, 256, 256, 512]
    - [19, 12734.0]
  - - [256, 1024, 1, 1024, 256, 256, 256, 1024]
    - [39, 13837.0]
  - - [512, 32, 1, 32, 512, 512, 512, 32]
    - [12, 298.0]
  - - [512, 32, 1, 64, 512, 512, 512, 64]
    - [12, 504.0]
  - - [512, 32, 1, 128, 512, 512, 512, 128]
    - [20, 749.0]
  - - [512, 32, 1, 256, 512, 512, 512, 256]
    - [22, 1146.0]
  - - [512, 32, 1, 512, 512, 512, 512, 512]
    - [37, 1559.0]
  - - [512, 32, 1, 1024, 512, 512, 512, 1024]
    - [30, 1844.0]
  - - [512, 64, 1, 32, 512, 512, 512, 32]
    - [12, 596.0]
  - - [512, 64, 1, 64, 512, 512, 512, 64]
    - [12, 999.0]
  - - [512, 64, 1, 128, 512, 512, 512, 128]
    - [15, 1509.0]
  - - [512, 64, 1, 256, 512, 512, 512, 256]
    - [15, 2196.0]
  - - [512, 64, 1, 512, 512, 512, 512, 512]
    - [22, 2943.0]
  - - [512, 64, 1, 1024, 512, 512, 512, 1024]
    - [30, 3410.0]
  - - [512, 128, 1, 32, 512, 512, 512, 32]
    - [12, 1140.0]
  - - [512, 128, 1, 64, 512, 512, 512, 64]
    - [12, 1924.0]
  - - [512, 128, 1, 128, 512, 512, 512, 128]
    - [15, 2893.0]
  - - [512, 128, 1, 256, 512, 512, 512, 256]
    - [21, 4194.0]
  - - [512, 128, 1, 512, 512, 512, 512, 512]
    - [28, 5038.0]
  - - [512, 128, 1, 1024, 512, 512, 512, 1024]
    - [5, 5639.0]
  - - [512, 256, 1, 32, 512, 512, 512, 32]
    - [32, 2185.0]
  - - [512, 256, 1, 64, 512, 512, 512, 64]
    - [12, 3585.0]
  - - [512, 256, 1, 128, 512, 512, 512, 128]
    - [12, 5412.0]
  - - [512, 256, 1, 256, 512, 512, 512, 256]
    - [48, 7232.0]
  - - [512, 256, 1, 512, 512, 512, 512, 512]
    - [12, 8604.0]
  - - [512, 256, 1, 1024, 512, 512, 512, 1024]
    - [12, 9479.0]
  - - [512, 512, 1, 32, 512, 512, 512, 32]
    - [35, 3884.0]
  - - [512, 512, 1, 64, 512, 512, 512, 64]
    - [9, 5949.0]
  - - [512, 512, 1, 128, 512, 512, 512, 128]
    - [13, 8830.0]
  - - [512, 512, 1, 256, 512, 512, 512, 256]
    - [13, 11111.0]
  - - [512, 512, 1, 512, 512, 512, 512, 512]
    - [39, 12758.0]
  - - [512, 512, 1, 1024, 512, 512, 512, 1024]
    - [23, 13724.0]
  - - [512, 1024, 1, 32, 512, 512, 512, 32]
    - [9, 6168.0]
  - - [512, 1024, 1, 64, 512, 512, 512, 64]
    - [19, 9425.0]
  - - [512, 1024, 1, 128, 512, 512, 512, 128]
    - [8, 12614.0]
  - - [512, 1024, 1, 256, 512, 512, 512, 256]
    - [24, 15790.0]
  - - [512, 1024, 1, 512, 512, 512, 512, 512]
    - [0, 18040.0]
  - - [512, 1024, 1, 1024, 512, 512, 512, 1024]
    - [31, 18957.0]
  - - [1024, 32, 1, 32, 1024, 1024, 1024, 32]
    - [16, 596.0]
  - - [1024, 32, 1, 64, 1024, 1024, 1024, 64]
    - [12, 1008.0]
  - - [1024, 32, 1, 128, 1024, 1024, 1024, 128]
    - [20, 1509.0]
  - - [1024, 32, 1, 256, 1024, 1024, 1024, 256]
    - [15, 2196.0]
  - - [1024, 32, 1, 512, 1024, 1024, 1024, 512]
    - [40, 2913.0]
  - - [1024, 32, 1, 1024, 1024, 1024, 1024, 1024]
    - [43, 3362.0]
  - - [1024, 64, 1, 32, 1024, 1024, 1024, 32]
    - [12, 1152.0]
  - - [1024, 64, 1, 64, 1024, 1024, 1024, 64]
    - [12, 1924.0]
  - - [1024, 64, 1, 128, 1024, 1024, 1024, 128]
    - [20, 2954.0]
  - - [1024, 64, 1, 256, 1024, 1024, 1024, 256]
    - [20, 4173.0]
  - - [1024, 64, 1, 512, 1024, 1024, 1024, 512]
    - [15, 5053.0]
  - - [1024, 64, 1, 1024, 1024, 1024, 1024, 1024]
    - [20, 5649.0]
  - - [1024, 128, 1, 32, 1024, 1024, 1024, 32]
    - [12, 2118.0]
  - - [1024, 128, 1, 64, 1024, 1024, 1024, 64]
    - [12, 3585.0]
  - - [1024, 128, 1, 128, 1024, 1024, 1024, 128]
    - [12, 5377.0]
  - - [1024, 128, 1, 256, 1024, 1024, 1024, 256]
    - [12, 7170.0]
  - - [1024, 128, 1, 512, 1024, 1024, 1024, 512]
    - [18, 8473.0]
  - - [1024, 128, 1, 1024, 1024, 1024, 1024, 1024]
    - [2, 9386.0]
  - - [1024, 256, 1, 32, 1024, 1024, 1024, 32]
    - [12, 3779.0]
  - - [1024, 256, 1, 64, 1024, 1024, 1024, 64]
    - [19, 5866.0]
  - - [1024, 256, 1, 128, 1024, 1024, 1024, 128]
    - [19, 8877.0]
  - - [1024, 256, 1, 256, 1024, 1024, 1024, 256]
    - [13, 11111.0]
  - - [1024, 256, 1, 512, 1024, 1024, 1024, 512]
    - [39, 12638.0]
  - - [1024, 256, 1, 1024, 1024, 1024, 1024, 1024]
    - [39, 13808.0]
  - - [1024, 512, 1, 32, 1024, 1024, 1024, 32]
    - [10, 6214.0]
  - - [1024, 512, 1, 64, 1024, 1024, 1024, 64]
    - [10, 9479.0]
  - - [1024, 512, 1, 128, 1024, 1024, 1024, 128]
    - [33, 12291.0]
  - - [1024, 512, 1, 256, 1024, 1024, 1024, 256]
    - [24, 15643.0]
  - - [1024, 512, 1, 512, 1024, 1024, 1024, 512]
    - [31, 18641.0]
  - - [1024, 512, 1, 1024, 1024, 1024, 1024, 1024]
    - [6, 19855.0]
  - - [1024, 1024, 1, 32, 1024, 1024, 1024, 32]
    - [27, 9168.0]
  - - [1024, 1024, 1, 64, 1024, 1024, 1024, 64]
    - [17, 13159.0]
  - - [1024, 1024, 1, 128, 1024, 1024, 1024, 128]
    - [1, 15978.0]
  - - [1024, 1024, 1, 256, 1024, 1024, 1024, 256]
    - [29, 19594.0]
  - - [1024, 1024, 1, 512, 1024, 1024, 1024, 512]
    - [26, 23022.0]
  - - [1024, 1024, 1, 1024, 1024, 1024, 1024, 1024]
    - [3, 25076.0]
- null
- null
- DeviceEfficiency
...
