library/src/blas3/Tensile/Logic/asm_full/navi22_Cijk_Alik_Bjlk_HBH.yaml
---
- {MinimumRequiredVersion: 4.28.0}
- navi22
- gfx1031
    SolutionIndex: 0
    SolutionNameMin: Cijk_Alik_Bjlk_HBH_MT64x64x16_SN_SU0_SUM0_TT8_8_WG8_8_1_WGM1
    SolutionIndex: 1
    SolutionNameMin: Cijk_Alik_Bjlk_HBH_MT64x64x16_SN_SU32_SUM3_TT8_8_WG8_8_1_WGM1
    SolutionIndex: 2
    SolutionNameMin: Cijk_Alik_Bjlk_HBH_MT64x64x32_SN_SU32_SUM3_TT8_8_WG8_8_1_WGM1
    SolutionIndex: 3
    SolutionNameMin: Cijk_Alik_Bjlk_HBH_MT64x64x16_SN_SU0_SUM0_TT8_8_WG8_8_1_WGM4
    SolutionIndex: 4
    SolutionNameMin: Cijk_Alik_Bjlk_HBH_MT64x64x32_SN_SU0_SUM0_TT8_8_WG8_8_1_WGM4
    SolutionIndex: 5
    SolutionNameMin: Cijk_Alik_Bjlk_HBH_MT64x64x16_SN_SU32_SUM3_TT8_8_WG8_8_1_WGM4
    SolutionIndex: 6
    SolutionNameMin: Cijk_Alik_Bjlk_HBH_MT128x128x16_SN_SU32_SUM3_TT8_8_WG16_16_1_WGM4
    SolutionIndex: 7
    SolutionNameMin: Cijk_Alik_Bjlk_HBH_MT64x64x16_SN_SU0_SUM0_TT8_8_WG8_8_1_WGM8
    SolutionIndex: 8
    SolutionNameMin: Cijk_Alik_Bjlk_HBH_MT16x16x8_SN_SU0_SUM0_TT2_2_WG8_8_1_WGM1
    SolutionIndex: 9
    SolutionNameMin: Cijk_Alik_Bjlk_HBH_MT32x16x8_SN_SU0_SUM0_TT2_2_WG16_8_1_WGM1
    SolutionIndex: 10
    SolutionNameMin: Cijk_Alik_Bjlk_HBH_MT32x32x8_SN_SU0_SUM0_TT2_2_WG16_16_1_WGM1
    SolutionIndex: 11
    SolutionNameMin: Cijk_Alik_Bjlk_HBH_MT64x64x8_SN_SU0_SUM0_TT4_4_WG16_16_1_WGM1
    SolutionIndex: 12
    SolutionNameMin: Cijk_Alik_Bjlk_HBH_MT16x16x16_SN_SU0_SUM0_TT2_2_WG8_8_1_WGM1
    SolutionIndex: 13
    SolutionNameMin: Cijk_Alik_Bjlk_HBH_MT32x32x16_SN_SU0_SUM0_TT4_4_WG8_8_1_WGM1
    SolutionIndex: 14
    SolutionNameMin: Cijk_Alik_Bjlk_HBH_MT32x16x16_SN_SU0_SUM0_TT2_2_WG16_8_1_WGM1
    SolutionIndex: 15
    SolutionNameMin: Cijk_Alik_Bjlk_HBH_MT16x16x32_SN_SU0_SUM0_TT2_2_WG8_8_1_WGM1
    SolutionIndex: 16
    SolutionNameMin: Cijk_Alik_Bjlk_HBH_MT32x32x32_SN_SU0_SUM0_TT2_2_WG16_16_1_WGM1
    SolutionIndex: 17
    SolutionNameMin: Cijk_Alik_Bjlk_HBH_MT32x16x8_SN_SU32_SUM3_TT2_2_WG16_8_1_WGM1
    SolutionIndex: 18
    SolutionNameMin: Cijk_Alik_Bjlk_HBH_MT64x64x8_SN_SU32_SUM3_TT4_4_WG16_16_1_WGM1
    SolutionIndex: 19
    SolutionNameMin: Cijk_Alik_Bjlk_HBH_MT16x16x16_SN_SU32_SUM3_TT2_2_WG8_8_1_WGM1
    SolutionIndex: 20
    SolutionNameMin: Cijk_Alik_Bjlk_HBH_MT32x32x16_SN_SU32_SUM3_TT4_4_WG8_8_1_WGM1
    SolutionIndex: 21
    SolutionNameMin: Cijk_Alik_Bjlk_HBH_MT16x16x32_SN_SU32_SUM3_TT2_2_WG8_8_1_WGM1
    SolutionIndex: 22
    SolutionNameMin: Cijk_Alik_Bjlk_HBH_MT32x32x8_SN_SU0_SUM0_TT2_2_WG16_16_1_WGM4
    SolutionIndex: 23
    SolutionNameMin: Cijk_Alik_Bjlk_HBH_MT64x64x8_SN_SU0_SUM0_TT4_4_WG16_16_1_WGM4
    SolutionIndex: 24
    SolutionNameMin: Cijk_Alik_Bjlk_HBH_MT16x16x16_SN_SU0_SUM0_TT2_2_WG8_8_1_WGM4
    SolutionIndex: 25
    SolutionNameMin: Cijk_Alik_Bjlk_HBH_MT32x32x16_SN_SU0_SUM0_TT4_4_WG8_8_1_WGM4
    SolutionIndex: 26
    SolutionNameMin: Cijk_Alik_Bjlk_HBH_MT16x16x32_SN_SU0_SUM0_TT2_2_WG8_8_1_WGM4
    SolutionIndex: 27
    SolutionNameMin: Cijk_Alik_Bjlk_HBH_MT64x64x8_SN_SU32_SUM3_TT4_4_WG16_16_1_WGM4
    SolutionIndex: 28
    SolutionNameMin: Cijk_Alik_Bjlk_HBH_MT16x16x16_SN_SU32_SUM3_TT2_2_WG8_8_1_WGM4
    SolutionIndex: 29
    SolutionNameMin: Cijk_Alik_Bjlk_HBH_MT32x32x16_SN_SU32_SUM3_TT4_4_WG8_8_1_WGM4
    SolutionIndex: 30
    SolutionNameMin: Cijk_Alik_Bjlk_HBH_MT32x32x16_SN_SU32_SUM3_TT2_2_WG16_16_1_WGM4
    SolutionIndex: 31
    SolutionNameMin: Cijk_Alik_Bjlk_HBH_MT16x16x32_SN_SU32_SUM3_TT2_2_WG8_8_1_WGM4
    SolutionIndex: 32
    SolutionNameMin: Cijk_Alik_Bjlk_HBH_MT64x64x8_SN_SU0_SUM0_TT4_4_WG16_16_1_WGM8
    SolutionIndex: 33
    SolutionNameMin: Cijk_Alik_Bjlk_HBH_MT16x16x16_SN_SU0_SUM0_TT2_2_WG8_8_1_WGM8
    SolutionIndex: 34
    SolutionNameMin: Cijk_Alik_Bjlk_HBH_MT32x32x16_SN_SU0_SUM0_TT4_4_WG8_8_1_WGM8
    SolutionIndex: 35
    SolutionNameMin: Cijk_Alik_Bjlk_HBH_MT32x32x8_SN_SU32_SUM3_TT4_4_WG8_8_1_WGM8
    SolutionIndex: 36
    SolutionNameMin: Cijk_Alik_Bjlk_HBH_MT16x16x16_SN_SU32_SUM3_TT2_2_WG8_8_1_WGM8
    SolutionIndex: 37
    SolutionNameMin: Cijk_Alik_Bjlk_HBH_MT16x16x32_SN_SU32_SUM3_TT2_2_WG8_8_1_WGM8
    SolutionIndex: 38
    SolutionNameMin: Cijk_Alik_Bjlk_HBH_MT16x32x16_SN_SU0_SUM0_TT2_4_WG8_8_1_WGM1
    SolutionIndex: 39
    SolutionNameMin: Cijk_Alik_Bjlk_HBH_MT16x32x32_SN_SU0_SUM0_TT2_4_WG8_8_1_WGM1
    SolutionIndex: 40
    SolutionNameMin: Cijk_Alik_Bjlk_HBH_MT32x64x32_SN_SU0_SUM0_TT2_4_WG16_16_1_WGM1
    SolutionIndex: 41
    SolutionNameMin: Cijk_Alik_Bjlk_HBH_MT16x32x16_SN_SU0_SUM0_TT2_4_WG8_8_1_WGM4
    SolutionIndex: 42
    SolutionNameMin: Cijk_Alik_Bjlk_HBH_MT16x32x32_SN_SU0_SUM0_TT2_4_WG8_8_1_WGM4
    SolutionIndex: 43
    SolutionNameMin: Cijk_Alik_Bjlk_HBH_MT16x32x16_SN_SU32_SUM3_TT2_4_WG8_8_1_WGM4
    SolutionIndex: 44
    SolutionNameMin: Cijk_Alik_Bjlk_HBH_MT16x32x32_SN_SU32_SUM3_TT2_4_WG8_8_1_WGM8
- - - [64, 5056, 1, 256, 64, 64, 256, 5056]
    - [3, 9500.0]
  - - [64, 6784, 1, 3328, 64, 64, 3328, 6784]
    - [0, 12571.0]
  - - [64, 5056, 1, 3328, 64, 64, 3328, 5056]
    - [0, 13448.0]
  - - [64, 6784, 1, 1280, 64, 64, 1280, 6784]
    - [0, 11564.0]
  - - [64, 6784, 1, 256, 64, 64, 256, 6784]
    - [5, 8485.0]
  - - [64, 5056, 1, 1280, 64, 64, 1280, 5056]
    - [1, 11861.0]
  - - [64, 5888, 1, 3328, 64, 64, 3328, 5888]
    - [4, 11990.0]
  - - [64, 5888, 1, 1280, 64, 64, 1280, 5888]
    - [2, 11094.0]
  - - [64, 5888, 1, 256, 64, 64, 256, 5888]
    - [7, 7608.0]
  - - [1024, 1024, 1, 1024, 1024, 1024, 1024, 1024]
    - [6, 14506.0]
  - - [64, 1408, 1, 3328, 64, 64, 3328, 1408]
    - [13, 4978.0]
  - - [64, 1856, 1, 256, 64, 64, 256, 1856]
    - [35, 3479.0]
  - - [64, 2368, 1, 3328, 64, 64, 3328, 2368]
    - [32, 7062.0]
  - - [64, 3584, 1, 1280, 64, 64, 1280, 3584]
    - [27, 7217.0]
  - - [64, 2944, 1, 256, 64, 64, 256, 2944]
    - [18, 4458.0]
  - - [64, 1408, 1, 1280, 64, 64, 1280, 1408]
    - [34, 4333.0]
  - - [64, 2368, 1, 1280, 64, 64, 1280, 2368]
    - [11, 6458.0]
  - - [64, 3584, 1, 3328, 64, 64, 3328, 3584]
    - [27, 7670.0]
  - - [64, 1856, 1, 3328, 64, 64, 3328, 1856]
    - [29, 5718.0]
  - - [64, 1856, 1, 1280, 64, 64, 1280, 1856]
    - [20, 5606.0]
  - - [64, 4288, 1, 256, 64, 64, 256, 4288]
    - [23, 5128.0]
  - - [64, 2944, 1, 3328, 64, 64, 3328, 2944]
    - [11, 6379.0]
  - - [64, 4288, 1, 1280, 64, 64, 1280, 4288]
    - [23, 6704.0]
  - - [64, 2944, 1, 1280, 64, 64, 1280, 2944]
    - [11, 5984.0]
  - - [64, 1408, 1, 256, 64, 64, 256, 1408]
    - [34, 2891.0]
  - - [64, 2368, 1, 256, 64, 64, 256, 2368]
    - [32, 4330.0]
  - - [64, 3584, 1, 256, 64, 64, 256, 3584]
    - [23, 5271.0]
  - - [64, 4288, 1, 3328, 64, 64, 3328, 4288]
    - [23, 7105.0]
  - - [1, 2944, 1, 3328, 1, 1, 3328, 2944]
    - [41, 281.0]
  - - [1, 2368, 1, 1280, 1, 1, 1280, 2368]
    - [42, 222.0]
  - - [1, 1408, 1, 1280, 1, 1, 1280, 1408]
    - [39, 129.0]
  - - [1, 2368, 1, 3328, 1, 1, 3328, 2368]
    - [42, 229.0]
  - - [1, 3584, 1, 1280, 1, 1, 1280, 3584]
    - [41, 250.0]
  - - [1, 2944, 1, 1, 1, 1, 1, 2944]
    - [8, 1.0]
  - - [1, 1408, 1, 3328, 1, 1, 3328, 1408]
    - [39, 166.0]
  - - [1, 2944, 1, 256, 1, 1, 256, 2944]
    - [41, 111.0]
  - - [1, 5056, 1, 256, 1, 1, 256, 5056]
    - [41, 166.0]
  - - [1, 1856, 1, 256, 1, 1, 256, 1856]
    - [28, 76.0]
  - - [1, 1856, 1, 1280, 1, 1, 1280, 1856]
    - [44, 167.0]
  - - [1, 4288, 1, 1280, 1, 1, 1280, 4288]
    - [38, 251.0]
  - - [1, 1408, 1, 1, 1, 1, 1, 1408]
    - [9, 0.35]
  - - [1, 1408, 1, 256, 1, 1, 256, 1408]
    - [28, 60.0]
  - - [1, 2368, 1, 256, 1, 1, 256, 2368]
    - [33, 93.0]
  - - [1, 4288, 1, 1, 1, 1, 1, 4288]
    - [8, 1.0]
  - - [1, 1856, 1, 3328, 1, 1, 3328, 1856]
    - [42, 202.0]
  - - [1, 4288, 1, 3328, 1, 1, 3328, 4288]
    - [43, 300.0]
  - - [1, 2368, 1, 1, 1, 1, 1, 2368]
    - [8, 1.0]
  - - [1, 3584, 1, 3328, 1, 1, 3328, 3584]
    - [41, 301.0]
  - - [1, 5056, 1, 1, 1, 1, 1, 5056]
    - [8, 1.0]
  - - [1, 3584, 1, 256, 1, 1, 256, 3584]
    - [21, 140.0]
  - - [1, 5056, 1, 1280, 1, 1, 1280, 5056]
    - [38, 280.0]
  - - [1, 3584, 1, 1, 1, 1, 1, 3584]
    - [8, 1.0]
  - - [1, 2944, 1, 1280, 1, 1, 1280, 2944]
    - [42, 232.0]
  - - [1, 1856, 1, 1, 1, 1, 1, 1856]
    - [40, 1.0]
  - - [1, 4288, 1, 256, 1, 1, 256, 4288]
    - [12, 178.0]
  - - [64, 448, 1, 3328, 64, 64, 3328, 448]
    - [33, 3126.0]
  - - [1, 64, 1, 1280, 1, 1, 1280, 64]
    - [15, 7.0]
  - - [64, 128, 1, 256, 64, 64, 256, 128]
    - [22, 405.0]
  - - [128, 64, 1, 1280, 128, 128, 1280, 64]
    - [21, 971.0]
  - - [1, 128, 1, 1, 1, 1, 1, 128]
    - [8, 0.03]
  - - [64, 1024, 1, 3328, 64, 64, 3328, 1024]
    - [25, 4497.0]
  - - [1, 64, 1, 3328, 1, 1, 3328, 64]
    - [15, 9.0]
  - - [64, 448, 1, 1280, 64, 64, 1280, 448]
    - [36, 2603.0]
  - - [1, 256, 1, 1280, 1, 1, 1280, 256]
    - [21, 28.0]
  - - [64, 64, 1, 1280, 64, 64, 1280, 64]
    - [31, 489.0]
  - - [1, 1, 1, 3328, 1, 1, 3328, 1]
    - [9, 0.11]
  - - [1, 64, 1, 1, 1, 1, 1, 64]
    - [9, 0.02]
  - - [1, 128, 1, 1280, 1, 1, 1280, 128]
    - [15, 14.0]
  - - [64, 1024, 1, 1280, 64, 64, 1280, 1024]
    - [29, 3946.0]
  - - [64, 256, 1, 1280, 64, 64, 1280, 256]
    - [15, 1730.0]
  - - [1, 1024, 1, 256, 1, 1, 256, 1024]
    - [19, 45.0]
  - - [1, 704, 1, 3328, 1, 1, 3328, 704]
    - [26, 96.0]
  - - [1, 256, 1, 1, 1, 1, 1, 256]
    - [17, 0.07]
  - - [128, 64, 1, 256, 128, 128, 256, 64]
    - [28, 369.0]
  - - [64, 128, 1, 3328, 64, 64, 3328, 128]
    - [31, 1192.0]
  - - [64, 256, 1, 3328, 64, 64, 3328, 256]
    - [16, 1912.0]
  - - [1, 1, 1, 256, 1, 1, 256, 1]
    - [9, 0.04]
  - - [1, 704, 1, 1, 1, 1, 1, 704]
    - [10, 0.18]
  - - [1, 704, 1, 1280, 1, 1, 1280, 704]
    - [37, 74.0]
  - - [64, 448, 1, 256, 64, 64, 256, 448]
    - [14, 1215.0]
  - - [1, 448, 1, 1280, 1, 1, 1280, 448]
    - [31, 50.0]
  - - [64, 128, 1, 1280, 64, 64, 1280, 128]
    - [31, 975.0]
  - - [1, 1, 1, 1, 1, 1, 1, 1]
    - [22, 0.0002659574473513254]
  - - [256, 64, 1, 256, 256, 256, 256, 64]
    - [19, 1271.0]
  - - [1, 448, 1, 3328, 1, 1, 3328, 448]
    - [21, 63.0]
  - - [1, 128, 1, 256, 1, 1, 256, 128]
    - [19, 6.0]
  - - [1, 1024, 1, 3328, 1, 1, 3328, 1024]
    - [15, 121.0]
  - - [64, 1024, 1, 256, 64, 64, 256, 1024]
    - [25, 2237.0]
  - - [64, 256, 1, 256, 64, 64, 256, 256]
    - [30, 744.0]
  - - [1, 1024, 1, 1280, 1, 1, 1280, 1024]
    - [15, 96.0]
  - - [1, 1, 1, 1280, 1, 1, 1280, 1]
    - [9, 0.09]
  - - [64, 704, 1, 256, 64, 64, 256, 704]
    - [24, 1758.0]
  - - [64, 64, 1, 256, 64, 64, 256, 64]
    - [30, 316.0]
  - - [128, 64, 1, 3328, 128, 128, 3328, 64]
    - [37, 1363.0]
  - - [1, 448, 1, 256, 1, 1, 256, 448]
    - [28, 35.0]
  - - [1, 1024, 1, 1, 1, 1, 1, 1024]
    - [12, 1.0]
  - - [64, 704, 1, 3328, 64, 64, 3328, 704]
    - [12, 4188.0]
  - - [1, 256, 1, 256, 1, 1, 256, 256]
    - [19, 19.0]
  - - [1, 704, 1, 256, 1, 1, 256, 704]
    - [28, 54.0]
  - - [1, 128, 1, 3328, 1, 1, 3328, 128]
    - [26, 20.0]
  - - [64, 64, 1, 3328, 64, 64, 3328, 64]
    - [21, 681.0]
  - - [1, 448, 1, 1, 1, 1, 1, 448]
    - [9, 0.27]
  - - [1, 64, 1, 256, 1, 1, 256, 64]
    - [19, 5.0]
  - - [64, 704, 1, 1280, 64, 64, 1280, 704]
    - [29, 3255.0]
  - - [1, 256, 1, 3328, 1, 1, 3328, 256]
    - [21, 36.0]
- null
- null
- DeviceEfficiency
...
