library/src/blas3/Tensile/Logic/asm_full/navi21_Cijk_Alik_Bjlk_I8II_BH_GB.yaml
---
- {MinimumRequiredVersion: 4.27.0}
- navi21
- gfx1030
    SolutionIndex: 0
    SolutionNameMin: Cijk_Alik_Bjlk_I8II_BH_GB_MT32x64x32_SN_EPS1_GRVW4_LRVW4_SU0_SUM0_SUS256_TT4_4_VW4_WG8_16_1_WGM1
    SolutionIndex: 1
    SolutionNameMin: Cijk_Alik_Bjlk_I8II_BH_GB_MT32x64x16_SN_EPS1_GRVW4_LRVW4_SU32_SUM0_SUS128_TT4_4_VW4_WG8_16_1_WGM1
    SolutionIndex: 2
    SolutionNameMin: Cijk_Alik_Bjlk_I8II_BH_GB_MT32x64x16_SN_EPS1_GRVW4_LRVW4_SU32_SUM3_SUS128_TT4_4_VW4_WG8_16_1_WGM1
    SolutionIndex: 3
    SolutionNameMin: Cijk_Alik_Bjlk_I8II_BH_GB_MT32x64x16_SN_EPS1_GRVW4_LRVW4_SU32_SUM3_SUS128_TT4_4_VW4_WG8_16_1_WGM4
    SolutionIndex: 4
    SolutionNameMin: Cijk_Alik_Bjlk_I8II_BH_GB_MT32x64x16_SN_EPS1_GRVW4_LRVW4_SU0_SUM0_SUS256_TT4_4_VW4_WG8_16_1_WGM8
    SolutionIndex: 5
    SolutionNameMin: Cijk_Alik_Bjlk_I8II_BH_GB_MT32x64x16_SN_EPS1_GRVW4_LRVW4_SU32_SUM0_SUS128_TT4_4_VW4_WG8_16_1_WGM8
    SolutionIndex: 6
    SolutionNameMin: Cijk_Alik_Bjlk_I8II_BH_GB_MT32x32x8_SN_EPS0_GRVW4_LRVW4_SU0_SUM0_SUS128_TT4_4_VW4_WG8_8_1_WGM1
    SolutionIndex: 7
    SolutionNameMin: Cijk_Alik_Bjlk_I8II_BH_GB_MT64x64x8_SN_EPS0_GRVW4_LRVW4_SU0_SUM0_SUS128_TT8_8_VW4_WG8_8_1_WGM1
    SolutionIndex: 8
    SolutionNameMin: Cijk_Alik_Bjlk_I8II_BH_GB_MT32x32x16_SN_EPS0_GRVW4_LRVW4_SU0_SUM0_SUS128_TT4_4_VW4_WG8_8_1_WGM1
    SolutionIndex: 9
    SolutionNameMin: Cijk_Alik_Bjlk_I8II_BH_GB_MT32x64x16_SN_EPS0_GRVW4_LRVW4_SU0_SUM0_SUS128_TT4_8_VW4_WG8_8_1_WGM1
    SolutionIndex: 10
    SolutionNameMin: Cijk_Alik_Bjlk_I8II_BH_GB_MT64x64x16_SN_EPS0_GRVW4_LRVW4_SU0_SUM0_SUS128_TT4_4_VW4_WG16_16_1_WGM1
    SolutionIndex: 11
    SolutionNameMin: Cijk_Alik_Bjlk_I8II_BH_GB_MT32x64x32_SN_EPS0_GRVW4_LRVW4_SU0_SUM0_SUS128_TT4_4_VW4_WG8_16_1_WGM1
    SolutionIndex: 12
    SolutionNameMin: Cijk_Alik_Bjlk_I8II_BH_GB_MT32x32x32_SN_EPS0_GRVW4_LRVW4_SU0_SUM0_SUS128_TT4_4_VW4_WG8_8_1_WGM1
    SolutionIndex: 13
    SolutionNameMin: Cijk_Alik_Bjlk_I8II_BH_GB_MT64x128x16_SN_EPS0_GRVW8_LRVW8_SU0_SUM0_SUS128_TT8_8_VW8_WG8_16_1_WGM1
    SolutionIndex: 14
    SolutionNameMin: Cijk_Alik_Bjlk_I8II_BH_GB_MT64x128x16_SN_EPS0_GRVW8_LRVW8_SU0_SUM0_SUS128_TT8_16_VW8_WG8_8_1_WGM1
    SolutionIndex: 15
    SolutionNameMin: Cijk_Alik_Bjlk_I8II_BH_GB_MT64x32x8_SN_EPS0_GRVW4_LRVW4_SU0_SUM0_SUS256_TT8_4_VW4_WG8_8_1_WGM1
    SolutionIndex: 16
    SolutionNameMin: Cijk_Alik_Bjlk_I8II_BH_GB_MT32x32x16_SN_EPS0_GRVW4_LRVW4_SU0_SUM0_SUS256_TT4_4_VW4_WG8_8_1_WGM1
    SolutionIndex: 17
    SolutionNameMin: Cijk_Alik_Bjlk_I8II_BH_GB_MT64x64x16_SN_EPS0_GRVW4_LRVW4_SU0_SUM0_SUS256_TT4_4_VW4_WG16_16_1_WGM1
    SolutionIndex: 18
    SolutionNameMin: Cijk_Alik_Bjlk_I8II_BH_GB_MT32x64x32_SN_EPS0_GRVW4_LRVW4_SU0_SUM0_SUS256_TT4_4_VW4_WG8_16_1_WGM1
    SolutionIndex: 19
    SolutionNameMin: Cijk_Alik_Bjlk_I8II_BH_GB_MT32x32x32_SN_EPS0_GRVW4_LRVW4_SU0_SUM0_SUS256_TT4_4_VW4_WG8_8_1_WGM1
    SolutionIndex: 20
    SolutionNameMin: Cijk_Alik_Bjlk_I8II_BH_GB_MT64x64x8_SN_EPS0_GRVW8_LRVW8_SU0_SUM0_SUS256_TT8_8_VW8_WG8_8_1_WGM1
    SolutionIndex: 21
    SolutionNameMin: Cijk_Alik_Bjlk_I8II_BH_GB_MT64x64x16_SN_EPS0_GRVW8_LRVW8_SU0_SUM0_SUS256_TT8_8_VW8_WG8_8_1_WGM1
    SolutionIndex: 22
    SolutionNameMin: Cijk_Alik_Bjlk_I8II_BH_GB_MT64x128x8_SN_EPS0_GRVW4_LRVW4_SU32_SUM0_SUS128_TT8_8_VW4_WG8_16_1_WGM1
    SolutionIndex: 23
    SolutionNameMin: Cijk_Alik_Bjlk_I8II_BH_GB_MT32x128x16_SN_EPS0_GRVW4_LRVW4_SU32_SUM0_SUS128_TT4_8_VW4_WG8_16_1_WGM1
    SolutionIndex: 24
    SolutionNameMin: Cijk_Alik_Bjlk_I8II_BH_GB_MT32x32x16_SN_EPS0_GRVW4_LRVW4_SU32_SUM0_SUS128_TT4_4_VW4_WG8_8_1_WGM1
    SolutionIndex: 25
    SolutionNameMin: Cijk_Alik_Bjlk_I8II_BH_GB_MT32x64x32_SN_EPS0_GRVW4_LRVW4_SU32_SUM0_SUS128_TT4_4_VW4_WG8_16_1_WGM1
    SolutionIndex: 26
    SolutionNameMin: Cijk_Alik_Bjlk_I8II_BH_GB_MT32x32x32_SN_EPS0_GRVW4_LRVW4_SU32_SUM0_SUS128_TT4_4_VW4_WG8_8_1_WGM1
    SolutionIndex: 27
    SolutionNameMin: Cijk_Alik_Bjlk_I8II_BH_GB_MT64x128x16_SN_EPS0_GRVW8_LRVW8_SU32_SUM0_SUS128_TT8_8_VW8_WG8_16_1_WGM1
    SolutionIndex: 28
    SolutionNameMin: Cijk_Alik_Bjlk_I8II_BH_GB_MT64x64x8_SN_EPS0_GRVW4_LRVW4_SU32_SUM3_SUS128_TT8_8_VW4_WG8_8_1_WGM1
    SolutionIndex: 29
    SolutionNameMin: Cijk_Alik_Bjlk_I8II_BH_GB_MT32x32x16_SN_EPS0_GRVW4_LRVW4_SU32_SUM3_SUS128_TT4_4_VW4_WG8_8_1_WGM1
    SolutionIndex: 30
    SolutionNameMin: Cijk_Alik_Bjlk_I8II_BH_GB_MT32x64x32_SN_EPS0_GRVW4_LRVW4_SU32_SUM3_SUS128_TT4_4_VW4_WG8_16_1_WGM1
    SolutionIndex: 31
    SolutionNameMin: Cijk_Alik_Bjlk_I8II_BH_GB_MT32x32x32_SN_EPS0_GRVW4_LRVW4_SU32_SUM3_SUS128_TT4_4_VW4_WG8_8_1_WGM1
    SolutionIndex: 32
    SolutionNameMin: Cijk_Alik_Bjlk_I8II_BH_GB_MT64x128x16_SN_EPS0_GRVW8_LRVW8_SU32_SUM3_SUS128_TT8_8_VW8_WG8_16_1_WGM1
    SolutionIndex: 33
    SolutionNameMin: Cijk_Alik_Bjlk_I8II_BH_GB_MT64x128x16_SN_EPS0_GRVW8_LRVW8_SU32_SUM3_SUS128_TT8_16_VW8_WG8_8_1_WGM1
    SolutionIndex: 34
    SolutionNameMin: Cijk_Alik_Bjlk_I8II_BH_GB_MT32x32x32_SN_EPS0_GRVW4_LRVW4_SU32_SUM0_SUS256_TT4_4_VW4_WG8_8_1_WGM1
    SolutionIndex: 35
    SolutionNameMin: Cijk_Alik_Bjlk_I8II_BH_GB_MT64x128x16_SN_EPS0_GRVW8_LRVW8_SU32_SUM0_SUS256_TT8_8_VW8_WG8_16_1_WGM1
    SolutionIndex: 36
    SolutionNameMin: Cijk_Alik_Bjlk_I8II_BH_GB_MT64x64x16_SN_EPS0_GRVW8_LRVW8_SU32_SUM0_SUS256_TT8_8_VW8_WG8_8_1_WGM1
    SolutionIndex: 37
    SolutionNameMin: Cijk_Alik_Bjlk_I8II_BH_GB_MT32x64x32_SN_EPS0_GRVW4_LRVW4_SU32_SUM3_SUS256_TT4_4_VW4_WG8_16_1_WGM1
    SolutionIndex: 38
    SolutionNameMin: Cijk_Alik_Bjlk_I8II_BH_GB_MT32x32x32_SN_EPS0_GRVW4_LRVW4_SU32_SUM3_SUS256_TT4_4_VW4_WG8_8_1_WGM1
    SolutionIndex: 39
    SolutionNameMin: Cijk_Alik_Bjlk_I8II_BH_GB_MT64x128x16_SN_EPS0_GRVW8_LRVW8_SU32_SUM3_SUS256_TT8_8_VW8_WG8_16_1_WGM1
    SolutionIndex: 40
    SolutionNameMin: Cijk_Alik_Bjlk_I8II_BH_GB_MT64x64x16_SN_EPS0_GRVW8_LRVW8_SU32_SUM3_SUS256_TT8_8_VW8_WG8_8_1_WGM1
    SolutionIndex: 41
    SolutionNameMin: Cijk_Alik_Bjlk_I8II_BH_GB_MT64x128x16_SN_EPS0_GRVW8_LRVW8_SU32_SUM3_SUS256_TT8_16_VW8_WG8_8_1_WGM1
    SolutionIndex: 42
    SolutionNameMin: Cijk_Alik_Bjlk_I8II_BH_GB_MT32x64x16_SN_EPS0_GRVW4_LRVW4_SU0_SUM0_SUS128_TT4_4_VW4_WG8_16_1_WGM4
    SolutionIndex: 43
    SolutionNameMin: Cijk_Alik_Bjlk_I8II_BH_GB_MT32x128x16_SN_EPS0_GRVW4_LRVW4_SU0_SUM0_SUS128_TT4_8_VW4_WG8_16_1_WGM4
    SolutionIndex: 44
    SolutionNameMin: Cijk_Alik_Bjlk_I8II_BH_GB_MT32x64x32_SN_EPS0_GRVW4_LRVW4_SU0_SUM0_SUS128_TT4_4_VW4_WG8_16_1_WGM4
    SolutionIndex: 45
    SolutionNameMin: Cijk_Alik_Bjlk_I8II_BH_GB_MT32x64x16_SN_EPS0_GRVW4_LRVW4_SU0_SUM0_SUS256_TT4_4_VW4_WG8_16_1_WGM4
    SolutionIndex: 46
    SolutionNameMin: Cijk_Alik_Bjlk_I8II_BH_GB_MT64x64x16_SN_EPS0_GRVW4_LRVW4_SU0_SUM0_SUS256_TT4_4_VW4_WG16_16_1_WGM4
    SolutionIndex: 47
    SolutionNameMin: Cijk_Alik_Bjlk_I8II_BH_GB_MT32x64x32_SN_EPS0_GRVW4_LRVW4_SU0_SUM0_SUS256_TT4_4_VW4_WG8_16_1_WGM4
    SolutionIndex: 48
    SolutionNameMin: Cijk_Alik_Bjlk_I8II_BH_GB_MT32x64x16_SN_EPS0_GRVW4_LRVW4_SU32_SUM0_SUS128_TT4_4_VW4_WG8_16_1_WGM4
    SolutionIndex: 49
    SolutionNameMin: Cijk_Alik_Bjlk_I8II_BH_GB_MT32x128x16_SN_EPS0_GRVW4_LRVW4_SU32_SUM0_SUS128_TT4_8_VW4_WG8_16_1_WGM4
    SolutionIndex: 50
    SolutionNameMin: Cijk_Alik_Bjlk_I8II_BH_GB_MT32x32x16_SN_EPS0_GRVW4_LRVW4_SU32_SUM0_SUS128_TT4_4_VW4_WG8_8_1_WGM4
    SolutionIndex: 51
    SolutionNameMin: Cijk_Alik_Bjlk_I8II_BH_GB_MT32x64x32_SN_EPS0_GRVW4_LRVW4_SU32_SUM0_SUS128_TT4_4_VW4_WG8_16_1_WGM4
    SolutionIndex: 52
    SolutionNameMin: Cijk_Alik_Bjlk_I8II_BH_GB_MT32x32x32_SN_EPS0_GRVW4_LRVW4_SU32_SUM3_SUS128_TT4_4_VW4_WG8_8_1_WGM4
    SolutionIndex: 53
    SolutionNameMin: Cijk_Alik_Bjlk_I8II_BH_GB_MT128x256x16_SN_EPS0_GRVW8_LRVW8_SU32_SUM0_SUS256_TT8_16_VW8_WG16_16_1_WGM4
    SolutionIndex: 54
    SolutionNameMin: Cijk_Alik_Bjlk_I8II_BH_GB_MT32x32x32_SN_EPS0_GRVW4_LRVW4_SU32_SUM3_SUS256_TT4_4_VW4_WG8_8_1_WGM4
    SolutionIndex: 55
    SolutionNameMin: Cijk_Alik_Bjlk_I8II_BH_GB_MT32x128x16_SN_EPS0_GRVW4_LRVW4_SU0_SUM0_SUS128_TT4_8_VW4_WG8_16_1_WGM8
    SolutionIndex: 56
    SolutionNameMin: Cijk_Alik_Bjlk_I8II_BH_GB_MT32x64x32_SN_EPS0_GRVW4_LRVW4_SU0_SUM0_SUS128_TT4_4_VW4_WG8_16_1_WGM8
    SolutionIndex: 57
    SolutionNameMin: Cijk_Alik_Bjlk_I8II_BH_GB_MT32x64x8_SN_EPS0_GRVW4_LRVW4_SU0_SUM0_SUS256_TT4_8_VW4_WG8_8_1_WGM8
    SolutionIndex: 58
    SolutionNameMin: Cijk_Alik_Bjlk_I8II_BH_GB_MT32x64x16_SN_EPS0_GRVW4_LRVW4_SU0_SUM0_SUS256_TT4_4_VW4_WG8_16_1_WGM8
    SolutionIndex: 59
    SolutionNameMin: Cijk_Alik_Bjlk_I8II_BH_GB_MT32x128x16_SN_EPS0_GRVW4_LRVW4_SU0_SUM0_SUS256_TT4_8_VW4_WG8_16_1_WGM8
    SolutionIndex: 60
    SolutionNameMin: Cijk_Alik_Bjlk_I8II_BH_GB_MT32x32x16_SN_EPS0_GRVW4_LRVW4_SU0_SUM0_SUS256_TT4_4_VW4_WG8_8_1_WGM8
    SolutionIndex: 61
    SolutionNameMin: Cijk_Alik_Bjlk_I8II_BH_GB_MT32x64x32_SN_EPS0_GRVW4_LRVW4_SU0_SUM0_SUS256_TT4_4_VW4_WG8_16_1_WGM8
    SolutionIndex: 62
    SolutionNameMin: Cijk_Alik_Bjlk_I8II_BH_GB_MT32x64x16_SN_EPS0_GRVW4_LRVW4_SU32_SUM3_SUS128_TT4_4_VW4_WG8_16_1_WGM8
- - - [768, 1024, 1, 1024, 768, 768, 1024, 1024]
    - [27, 26180.0]
  - - [1536, 2048, 1, 2048, 1536, 1536, 2048, 2048]
    - [53, 33185.0]
  - - [32, 32, 1, 32, 32, 32, 32, 32]
    - [6, 19.0]
  - - [32, 32, 1, 64, 32, 32, 64, 32]
    - [8, 33.0]
  - - [32, 32, 1, 128, 32, 32, 128, 32]
    - [16, 50.0]
  - - [32, 32, 1, 256, 32, 32, 256, 32]
    - [19, 74.0]
  - - [32, 32, 1, 512, 32, 32, 512, 32]
    - [19, 99.0]
  - - [32, 32, 1, 1024, 32, 32, 1024, 32]
    - [19, 121.0]
  - - [32, 64, 1, 32, 32, 32, 32, 64]
    - [0, 39.0]
  - - [32, 64, 1, 64, 32, 32, 64, 64]
    - [16, 65.0]
  - - [32, 64, 1, 128, 32, 32, 128, 64]
    - [47, 100.0]
  - - [32, 64, 1, 256, 32, 32, 256, 64]
    - [18, 150.0]
  - - [32, 64, 1, 512, 32, 32, 512, 64]
    - [31, 202.0]
  - - [32, 64, 1, 1024, 32, 32, 1024, 64]
    - [38, 247.0]
  - - [32, 128, 1, 32, 32, 32, 32, 128]
    - [42, 77.0]
  - - [32, 128, 1, 64, 32, 32, 64, 128]
    - [8, 131.0]
  - - [32, 128, 1, 128, 32, 32, 128, 128]
    - [8, 200.0]
  - - [32, 128, 1, 256, 32, 32, 256, 128]
    - [31, 307.0]
  - - [32, 128, 1, 512, 32, 32, 512, 128]
    - [31, 425.0]
  - - [32, 128, 1, 1024, 32, 32, 1024, 128]
    - [31, 513.0]
  - - [32, 256, 1, 32, 32, 32, 32, 256]
    - [0, 156.0]
  - - [32, 256, 1, 64, 32, 32, 64, 256]
    - [16, 262.0]
  - - [32, 256, 1, 128, 32, 32, 128, 256]
    - [8, 403.0]
  - - [32, 256, 1, 256, 32, 32, 256, 256]
    - [31, 603.0]
  - - [32, 256, 1, 512, 32, 32, 512, 256]
    - [31, 839.0]
  - - [32, 256, 1, 1024, 32, 32, 1024, 256]
    - [38, 1018.0]
  - - [32, 512, 1, 32, 32, 32, 32, 512]
    - [0, 308.0]
  - - [32, 512, 1, 64, 32, 32, 64, 512]
    - [8, 524.0]
  - - [32, 512, 1, 128, 32, 32, 128, 512]
    - [56, 800.0]
  - - [32, 512, 1, 256, 32, 32, 256, 512]
    - [31, 1226.0]
  - - [32, 512, 1, 512, 32, 32, 512, 512]
    - [31, 1671.0]
  - - [32, 512, 1, 1024, 32, 32, 1024, 512]
    - [38, 2036.0]
  - - [32, 1024, 1, 32, 32, 32, 32, 1024]
    - [42, 617.0]
  - - [32, 1024, 1, 64, 32, 32, 64, 1024]
    - [8, 1049.0]
  - - [32, 1024, 1, 128, 32, 32, 128, 1024]
    - [29, 1601.0]
  - - [32, 1024, 1, 256, 32, 32, 256, 1024]
    - [56, 2397.0]
  - - [32, 1024, 1, 512, 32, 32, 512, 1024]
    - [30, 3239.0]
  - - [32, 1024, 1, 1024, 32, 32, 1024, 1024]
    - [30, 3929.0]
  - - [64, 32, 1, 32, 64, 64, 32, 32]
    - [8, 38.0]
  - - [64, 32, 1, 64, 64, 64, 64, 32]
    - [8, 66.0]
  - - [64, 32, 1, 128, 64, 64, 128, 32]
    - [8, 103.0]
  - - [64, 32, 1, 256, 64, 64, 256, 32]
    - [26, 148.0]
  - - [64, 32, 1, 512, 64, 64, 512, 32]
    - [26, 199.0]
  - - [64, 32, 1, 1024, 64, 64, 1024, 32]
    - [26, 244.0]
  - - [64, 64, 1, 32, 64, 64, 32, 64]
    - [10, 77.0]
  - - [64, 64, 1, 64, 64, 64, 64, 64]
    - [16, 131.0]
  - - [64, 64, 1, 128, 64, 64, 128, 64]
    - [44, 200.0]
  - - [64, 64, 1, 256, 64, 64, 256, 64]
    - [11, 300.0]
  - - [64, 64, 1, 512, 64, 64, 512, 64]
    - [52, 413.0]
  - - [64, 64, 1, 1024, 64, 64, 1024, 64]
    - [54, 508.0]
  - - [64, 128, 1, 32, 64, 64, 32, 128]
    - [10, 154.0]
  - - [64, 128, 1, 64, 64, 64, 64, 128]
    - [8, 262.0]
  - - [64, 128, 1, 128, 64, 64, 128, 128]
    - [8, 403.0]
  - - [64, 128, 1, 256, 64, 64, 256, 128]
    - [31, 603.0]
  - - [64, 128, 1, 512, 64, 64, 512, 128]
    - [31, 832.0]
  - - [64, 128, 1, 1024, 64, 64, 1024, 128]
    - [31, 1016.0]
  - - [64, 256, 1, 32, 64, 64, 32, 256]
    - [17, 312.0]
  - - [64, 256, 1, 64, 64, 64, 64, 256]
    - [8, 519.0]
  - - [64, 256, 1, 128, 64, 64, 128, 256]
    - [8, 800.0]
  - - [64, 256, 1, 256, 64, 64, 256, 256]
    - [12, 1198.0]
  - - [64, 256, 1, 512, 64, 64, 512, 256]
    - [31, 1658.0]
  - - [64, 256, 1, 1024, 64, 64, 1024, 256]
    - [31, 2026.0]
  - - [64, 512, 1, 32, 64, 64, 32, 512]
    - [8, 596.0]
  - - [64, 512, 1, 64, 64, 64, 64, 512]
    - [8, 1049.0]
  - - [64, 512, 1, 128, 64, 64, 128, 512]
    - [16, 1601.0]
  - - [64, 512, 1, 256, 64, 64, 256, 512]
    - [44, 2370.0]
  - - [64, 512, 1, 512, 64, 64, 512, 512]
    - [30, 3190.0]
  - - [64, 512, 1, 1024, 64, 64, 1024, 512]
    - [30, 3920.0]
  - - [64, 1024, 1, 32, 64, 64, 32, 1024]
    - [58, 1178.0]
  - - [64, 1024, 1, 64, 64, 64, 64, 1024]
    - [8, 2036.0]
  - - [64, 1024, 1, 128, 64, 64, 128, 1024]
    - [56, 3107.0]
  - - [64, 1024, 1, 256, 64, 64, 256, 1024]
    - [44, 4486.0]
  - - [64, 1024, 1, 512, 64, 64, 512, 1024]
    - [61, 5707.0]
  - - [64, 1024, 1, 1024, 64, 64, 1024, 1024]
    - [44, 6579.0]
  - - [128, 32, 1, 32, 128, 128, 32, 32]
    - [8, 75.0]
  - - [128, 32, 1, 64, 128, 128, 64, 32]
    - [8, 131.0]
  - - [128, 32, 1, 128, 128, 128, 128, 32]
    - [8, 200.0]
  - - [128, 32, 1, 256, 128, 128, 256, 32]
    - [19, 298.0]
  - - [128, 32, 1, 512, 128, 128, 512, 32]
    - [26, 410.0]
  - - [128, 32, 1, 1024, 128, 128, 1024, 32]
    - [38, 497.0]
  - - [128, 64, 1, 32, 128, 128, 32, 64]
    - [17, 154.0]
  - - [128, 64, 1, 64, 128, 128, 64, 64]
    - [8, 262.0]
  - - [128, 64, 1, 128, 128, 128, 128, 64]
    - [16, 403.0]
  - - [128, 64, 1, 256, 128, 128, 256, 64]
    - [26, 599.0]
  - - [128, 64, 1, 512, 128, 128, 512, 64]
    - [26, 822.0]
  - - [128, 64, 1, 1024, 128, 128, 1024, 64]
    - [31, 1006.0]
  - - [128, 128, 1, 32, 128, 128, 32, 128]
    - [10, 312.0]
  - - [128, 128, 1, 64, 128, 128, 64, 128]
    - [8, 519.0]
  - - [128, 128, 1, 128, 128, 128, 128, 128]
    - [8, 800.0]
  - - [128, 128, 1, 256, 128, 128, 256, 128]
    - [30, 1198.0]
  - - [128, 128, 1, 512, 128, 128, 512, 128]
    - [26, 1645.0]
  - - [128, 128, 1, 1024, 128, 128, 1024, 128]
    - [38, 2016.0]
  - - [128, 256, 1, 32, 128, 128, 32, 256]
    - [8, 603.0]
  - - [128, 256, 1, 64, 128, 128, 64, 256]
    - [8, 1038.0]
  - - [128, 256, 1, 128, 128, 128, 128, 256]
    - [8, 1589.0]
  - - [128, 256, 1, 256, 128, 128, 256, 256]
    - [44, 2383.0]
  - - [128, 256, 1, 512, 128, 128, 512, 256]
    - [25, 3166.0]
  - - [128, 256, 1, 1024, 128, 128, 1024, 256]
    - [30, 3875.0]
  - - [128, 512, 1, 32, 128, 128, 32, 512]
    - [8, 1165.0]
  - - [128, 512, 1, 64, 128, 128, 64, 512]
    - [8, 1998.0]
  - - [128, 512, 1, 128, 128, 128, 128, 512]
    - [47, 3107.0]
  - - [128, 512, 1, 256, 128, 128, 256, 512]
    - [44, 4486.0]
  - - [128, 512, 1, 512, 128, 128, 512, 512]
    - [11, 5687.0]
  - - [128, 512, 1, 1024, 128, 128, 1024, 512]
    - [37, 6541.0]
  - - [128, 1024, 1, 32, 128, 128, 32, 1024]
    - [42, 2208.0]
  - - [128, 1024, 1, 64, 128, 128, 64, 1024]
    - [8, 3779.0]
  - - [128, 1024, 1, 128, 128, 128, 128, 1024]
    - [47, 5630.0]
  - - [128, 1024, 1, 256, 128, 128, 256, 1024]
    - [62, 7877.0]
  - - [128, 1024, 1, 512, 128, 128, 512, 1024]
    - [48, 9698.0]
  - - [128, 1024, 1, 1024, 128, 128, 1024, 1024]
    - [3, 10948.0]
  - - [256, 32, 1, 32, 256, 256, 32, 32]
    - [8, 154.0]
  - - [256, 32, 1, 64, 256, 256, 64, 32]
    - [8, 267.0]
  - - [256, 32, 1, 128, 256, 256, 128, 32]
    - [8, 410.0]
  - - [256, 32, 1, 256, 256, 256, 256, 32]
    - [19, 596.0]
  - - [256, 32, 1, 512, 256, 256, 512, 32]
    - [26, 819.0]
  - - [256, 32, 1, 1024, 256, 256, 1024, 32]
    - [38, 994.0]
  - - [256, 64, 1, 32, 256, 256, 32, 64]
    - [10, 305.0]
  - - [256, 64, 1, 64, 256, 256, 64, 64]
    - [8, 524.0]
  - - [256, 64, 1, 128, 256, 256, 128, 64]
    - [8, 807.0]
  - - [256, 64, 1, 256, 256, 256, 256, 64]
    - [19, 1198.0]
  - - [256, 64, 1, 512, 256, 256, 512, 64]
    - [26, 1651.0]
  - - [256, 64, 1, 1024, 256, 256, 1024, 64]
    - [19, 1983.0]
  - - [256, 128, 1, 32, 256, 256, 32, 128]
    - [8, 603.0]
  - - [256, 128, 1, 64, 256, 256, 64, 128]
    - [8, 1028.0]
  - - [256, 128, 1, 128, 256, 256, 128, 128]
    - [8, 1577.0]
  - - [256, 128, 1, 256, 256, 256, 256, 128]
    - [44, 2370.0]
  - - [256, 128, 1, 512, 256, 256, 512, 128]
    - [44, 3166.0]
  - - [256, 128, 1, 1024, 256, 256, 1024, 128]
    - [26, 3848.0]
  - - [256, 256, 1, 32, 256, 256, 32, 256]
    - [46, 1192.0]
  - - [256, 256, 1, 64, 256, 256, 64, 256]
    - [8, 1978.0]
  - - [256, 256, 1, 128, 256, 256, 128, 256]
    - [8, 3062.0]
  - - [256, 256, 1, 256, 256, 256, 256, 256]
    - [29, 4415.0]
  - - [256, 256, 1, 512, 256, 256, 512, 256]
    - [11, 5574.0]
  - - [256, 256, 1, 1024, 256, 256, 1024, 256]
    - [11, 6465.0]
  - - [256, 512, 1, 32, 256, 256, 32, 512]
    - [42, 2185.0]
  - - [256, 512, 1, 64, 256, 256, 64, 512]
    - [8, 3712.0]
  - - [256, 512, 1, 128, 256, 256, 128, 512]
    - [45, 5668.0]
  - - [256, 512, 1, 256, 256, 256, 256, 512]
    - [62, 7914.0]
  - - [256, 512, 1, 512, 256, 256, 512, 512]
    - [48, 9670.0]
  - - [256, 512, 1, 1024, 256, 256, 1024, 512]
    - [2, 10948.0]
  - - [256, 1024, 1, 32, 256, 256, 32, 1024]
    - [60, 3813.0]
  - - [256, 1024, 1, 64, 256, 256, 64, 1024]
    - [48, 6307.0]
  - - [256, 1024, 1, 128, 256, 256, 128, 1024]
    - [43, 8877.0]
  - - [256, 1024, 1, 256, 256, 256, 256, 1024]
    - [43, 12027.0]
  - - [256, 1024, 1, 512, 256, 256, 512, 1024]
    - [43, 14494.0]
  - - [256, 1024, 1, 1024, 256, 256, 1024, 1024]
    - [43, 16036.0]
  - - [512, 32, 1, 32, 512, 512, 32, 32]
    - [8, 305.0]
  - - [512, 32, 1, 64, 512, 512, 64, 32]
    - [8, 530.0]
  - - [512, 32, 1, 128, 512, 512, 128, 32]
    - [8, 813.0]
  - - [512, 32, 1, 256, 512, 512, 256, 32]
    - [12, 1192.0]
  - - [512, 32, 1, 512, 512, 512, 512, 32]
    - [26, 1645.0]
  - - [512, 32, 1, 1024, 512, 512, 1024, 32]
    - [38, 1978.0]
  - - [512, 64, 1, 32, 512, 512, 32, 64]
    - [8, 610.0]
  - - [512, 64, 1, 64, 512, 512, 64, 64]
    - [8, 1038.0]
  - - [512, 64, 1, 128, 512, 512, 128, 64]
    - [8, 1626.0]
  - - [512, 64, 1, 256, 512, 512, 256, 64]
    - [26, 2370.0]
  - - [512, 64, 1, 512, 512, 512, 512, 64]
    - [26, 3290.0]
  - - [512, 64, 1, 1024, 512, 512, 1024, 64]
    - [26, 3948.0]
  - - [512, 128, 1, 32, 512, 512, 32, 128]
    - [8, 1152.0]
  - - [512, 128, 1, 64, 512, 512, 64, 128]
    - [8, 1978.0]
  - - [512, 128, 1, 128, 512, 512, 128, 128]
    - [8, 3084.0]
  - - [512, 128, 1, 256, 512, 512, 256, 128]
    - [24, 4438.0]
  - - [512, 128, 1, 512, 512, 512, 512, 128]
    - [11, 5592.0]
  - - [512, 128, 1, 1024, 512, 512, 1024, 128]
    - [25, 6465.0]
  - - [512, 256, 1, 32, 512, 512, 32, 256]
    - [42, 2208.0]
  - - [512, 256, 1, 64, 512, 512, 64, 256]
    - [8, 3712.0]
  - - [512, 256, 1, 128, 512, 512, 128, 256]
    - [42, 5555.0]
  - - [512, 256, 1, 256, 512, 512, 256, 256]
    - [62, 7696.0]
  - - [512, 256, 1, 512, 512, 512, 512, 256]
    - [48, 9840.0]
  - - [512, 256, 1, 1024, 512, 512, 1024, 256]
    - [1, 11020.0]
  - - [512, 512, 1, 32, 512, 512, 32, 512]
    - [42, 3920.0]
  - - [512, 512, 1, 64, 512, 512, 64, 512]
    - [45, 6168.0]
  - - [512, 512, 1, 128, 512, 512, 128, 512]
    - [59, 8877.0]
  - - [512, 512, 1, 256, 512, 512, 256, 512]
    - [55, 12027.0]
  - - [512, 512, 1, 512, 512, 512, 512, 512]
    - [43, 14401.0]
  - - [512, 512, 1, 1024, 512, 512, 1024, 512]
    - [55, 15940.0]
  - - [512, 1024, 1, 32, 512, 512, 32, 1024]
    - [48, 6168.0]
  - - [512, 1024, 1, 64, 512, 512, 64, 1024]
    - [57, 9373.0]
  - - [512, 1024, 1, 128, 512, 512, 128, 1024]
    - [21, 12710.0]
  - - [512, 1024, 1, 256, 512, 512, 256, 1024]
    - [22, 15716.0]
  - - [512, 1024, 1, 512, 512, 512, 512, 1024]
    - [13, 19709.0]
  - - [512, 1024, 1, 1024, 512, 512, 1024, 1024]
    - [35, 21985.0]
  - - [1024, 32, 1, 32, 1024, 1024, 32, 32]
    - [8, 610.0]
  - - [1024, 32, 1, 64, 1024, 1024, 64, 32]
    - [8, 1059.0]
  - - [1024, 32, 1, 128, 1024, 1024, 128, 32]
    - [8, 1626.0]
  - - [1024, 32, 1, 256, 1024, 1024, 256, 32]
    - [50, 2343.0]
  - - [1024, 32, 1, 512, 1024, 1024, 512, 32]
    - [12, 3118.0]
  - - [1024, 32, 1, 1024, 1024, 1024, 1024, 32]
    - [34, 3728.0]
  - - [1024, 64, 1, 32, 1024, 1024, 32, 64]
    - [8, 1178.0]
  - - [1024, 64, 1, 64, 1024, 1024, 64, 64]
    - [8, 2016.0]
  - - [1024, 64, 1, 128, 1024, 1024, 128, 64]
    - [16, 3154.0]
  - - [1024, 64, 1, 256, 1024, 1024, 256, 64]
    - [29, 4438.0]
  - - [1024, 64, 1, 512, 1024, 1024, 512, 64]
    - [44, 5537.0]
  - - [1024, 64, 1, 1024, 1024, 1024, 1024, 64]
    - [51, 6379.0]
  - - [1024, 128, 1, 32, 1024, 1024, 32, 128]
    - [8, 2162.0]
  - - [1024, 128, 1, 64, 1024, 1024, 64, 128]
    - [8, 3712.0]
  - - [1024, 128, 1, 128, 1024, 1024, 128, 128]
    - [8, 5592.0]
  - - [1024, 128, 1, 256, 1024, 1024, 256, 128]
    - [48, 7661.0]
  - - [1024, 128, 1, 512, 1024, 1024, 512, 128]
    - [5, 9506.0]
  - - [1024, 128, 1, 1024, 1024, 1024, 1024, 128]
    - [1, 10912.0]
  - - [1024, 256, 1, 32, 1024, 1024, 32, 256]
    - [8, 3779.0]
  - - [1024, 256, 1, 64, 1024, 1024, 64, 256]
    - [4, 6035.0]
  - - [1024, 256, 1, 128, 1024, 1024, 128, 256]
    - [9, 8648.0]
  - - [1024, 256, 1, 256, 1024, 1024, 256, 256]
    - [49, 11815.0]
  - - [1024, 256, 1, 512, 1024, 1024, 512, 256]
    - [23, 14218.0]
  - - [1024, 256, 1, 1024, 1024, 1024, 1024, 256]
    - [23, 15997.0]
  - - [1024, 512, 1, 32, 1024, 1024, 32, 512]
    - [45, 6260.0]
  - - [1024, 512, 1, 64, 1024, 1024, 64, 512]
    - [7, 8972.0]
  - - [1024, 512, 1, 128, 1024, 1024, 128, 512]
    - [36, 12520.0]
  - - [1024, 512, 1, 256, 1024, 1024, 256, 512]
    - [40, 16055.0]
  - - [1024, 512, 1, 512, 1024, 1024, 512, 512]
    - [32, 18957.0]
  - - [1024, 512, 1, 1024, 1024, 1024, 1024, 512]
    - [39, 21877.0]
  - - [1024, 1024, 1, 32, 1024, 1024, 32, 1024]
    - [15, 8738.0]
  - - [1024, 1024, 1, 64, 1024, 1024, 64, 1024]
    - [28, 12906.0]
  - - [1024, 1024, 1, 128, 1024, 1024, 128, 1024]
    - [20, 16611.0]
  - - [1024, 1024, 1, 256, 1024, 1024, 256, 1024]
    - [33, 20745.0]
  - - [1024, 1024, 1, 512, 1024, 1024, 512, 1024]
    - [14, 23967.0]
  - - [1024, 1024, 1, 1024, 1024, 1024, 1024, 1024]
    - [41, 25786.0]
- null
- null
- DeviceEfficiency
...
