library/src/blas3/Tensile/Logic/asm_full/navi22_Cijk_Ailk_Bljk_HBH_GB.yaml
---
- {MinimumRequiredVersion: 4.28.0}
- navi22
- gfx1031
    SolutionIndex: 0
    SolutionNameMin: Cijk_Ailk_Bljk_HBH_GB_MT128x64x8_SN_SU0_SUM0_TT8_8_WG16_8_1_WGM1
    SolutionIndex: 1
    SolutionNameMin: Cijk_Ailk_Bljk_HBH_GB_MT128x128x8_SN_SU0_SUM0_TT8_16_WG16_8_1_WGM1
    SolutionIndex: 2
    SolutionNameMin: Cijk_Ailk_Bljk_HBH_GB_MT128x64x16_SN_SU0_SUM0_TT8_8_WG16_8_1_WGM1
    SolutionIndex: 3
    SolutionNameMin: Cijk_Ailk_Bljk_HBH_GB_MT128x128x16_SN_SU0_SUM0_TT8_16_WG16_8_1_WGM1
    SolutionIndex: 4
    SolutionNameMin: Cijk_Ailk_Bljk_HBH_GB_MT128x128x16_SN_SU0_SUM0_TT8_8_WG16_16_1_WGM1
    SolutionIndex: 5
    SolutionNameMin: Cijk_Ailk_Bljk_HBH_GB_MT128x256x16_SN_SU0_SUM0_TT8_16_WG16_16_1_WGM1
    SolutionIndex: 6
    SolutionNameMin: Cijk_Ailk_Bljk_HBH_GB_MT128x128x32_SN_SU0_SUM0_TT8_16_WG16_8_1_WGM1
    SolutionIndex: 7
    SolutionNameMin: Cijk_Ailk_Bljk_HBH_GB_MT128x64x8_SN_SU32_SUM3_TT8_8_WG16_8_1_WGM1
    SolutionIndex: 8
    SolutionNameMin: Cijk_Ailk_Bljk_HBH_GB_MT128x128x8_SN_SU32_SUM3_TT8_16_WG16_8_1_WGM1
    SolutionIndex: 9
    SolutionNameMin: Cijk_Ailk_Bljk_HBH_GB_MT128x64x16_SN_SU32_SUM3_TT8_8_WG16_8_1_WGM1
    SolutionIndex: 10
    SolutionNameMin: Cijk_Ailk_Bljk_HBH_GB_MT128x128x16_SN_SU32_SUM3_TT8_16_WG16_8_1_WGM1
    SolutionIndex: 11
    SolutionNameMin: Cijk_Ailk_Bljk_HBH_GB_MT128x256x16_SN_SU32_SUM3_TT8_16_WG16_16_1_WGM1
    SolutionIndex: 12
    SolutionNameMin: Cijk_Ailk_Bljk_HBH_GB_MT128x128x32_SN_SU32_SUM3_TT8_16_WG16_8_1_WGM1
    SolutionIndex: 13
    SolutionNameMin: Cijk_Ailk_Bljk_HBH_GB_MT128x64x8_SN_SU0_SUM0_TT8_8_WG16_8_1_WGM4
    SolutionIndex: 14
    SolutionNameMin: Cijk_Ailk_Bljk_HBH_GB_MT128x128x8_SN_SU0_SUM0_TT8_16_WG16_8_1_WGM4
    SolutionIndex: 15
    SolutionNameMin: Cijk_Ailk_Bljk_HBH_GB_MT128x64x16_SN_SU0_SUM0_TT8_8_WG16_8_1_WGM4
    SolutionIndex: 16
    SolutionNameMin: Cijk_Ailk_Bljk_HBH_GB_MT128x128x16_SN_SU0_SUM0_TT8_16_WG16_8_1_WGM4
    SolutionIndex: 17
    SolutionNameMin: Cijk_Ailk_Bljk_HBH_GB_MT128x128x16_SN_SU0_SUM0_TT8_8_WG16_16_1_WGM4
    SolutionIndex: 18
    SolutionNameMin: Cijk_Ailk_Bljk_HBH_GB_MT128x256x16_SN_SU0_SUM0_TT8_16_WG16_16_1_WGM4
    SolutionIndex: 19
    SolutionNameMin: Cijk_Ailk_Bljk_HBH_GB_MT128x64x8_SN_SU32_SUM3_TT8_8_WG16_8_1_WGM4
    SolutionIndex: 20
    SolutionNameMin: Cijk_Ailk_Bljk_HBH_GB_MT128x128x8_SN_SU32_SUM3_TT8_16_WG16_8_1_WGM4
    SolutionIndex: 21
    SolutionNameMin: Cijk_Ailk_Bljk_HBH_GB_MT128x64x16_SN_SU32_SUM3_TT8_8_WG16_8_1_WGM4
    SolutionIndex: 22
    SolutionNameMin: Cijk_Ailk_Bljk_HBH_GB_MT128x128x16_SN_SU32_SUM3_TT8_16_WG16_8_1_WGM4
    SolutionIndex: 23
    SolutionNameMin: Cijk_Ailk_Bljk_HBH_GB_MT128x128x16_SN_SU32_SUM3_TT8_8_WG16_16_1_WGM4
    SolutionIndex: 24
    SolutionNameMin: Cijk_Ailk_Bljk_HBH_GB_MT128x256x16_SN_SU32_SUM3_TT8_16_WG16_16_1_WGM4
    SolutionIndex: 25
    SolutionNameMin: Cijk_Ailk_Bljk_HBH_GB_MT128x64x8_SN_SU0_SUM0_TT8_8_WG16_8_1_WGM8
    SolutionIndex: 26
    SolutionNameMin: Cijk_Ailk_Bljk_HBH_GB_MT128x128x8_SN_SU0_SUM0_TT8_16_WG16_8_1_WGM8
    SolutionIndex: 27
    SolutionNameMin: Cijk_Ailk_Bljk_HBH_GB_MT128x64x16_SN_SU0_SUM0_TT8_8_WG16_8_1_WGM8
    SolutionIndex: 28
    SolutionNameMin: Cijk_Ailk_Bljk_HBH_GB_MT128x128x16_SN_SU0_SUM0_TT8_16_WG16_8_1_WGM8
    SolutionIndex: 29
    SolutionNameMin: Cijk_Ailk_Bljk_HBH_GB_MT128x128x16_SN_SU0_SUM0_TT8_8_WG16_16_1_WGM8
    SolutionIndex: 30
    SolutionNameMin: Cijk_Ailk_Bljk_HBH_GB_MT128x256x16_SN_SU0_SUM0_TT8_16_WG16_16_1_WGM8
    SolutionIndex: 31
    SolutionNameMin: Cijk_Ailk_Bljk_HBH_GB_MT128x128x32_SN_SU0_SUM0_TT8_8_WG16_16_1_WGM8
    SolutionIndex: 32
    SolutionNameMin: Cijk_Ailk_Bljk_HBH_GB_MT128x64x8_SN_SU32_SUM3_TT8_8_WG16_8_1_WGM8
    SolutionIndex: 33
    SolutionNameMin: Cijk_Ailk_Bljk_HBH_GB_MT128x128x16_SN_SU32_SUM3_TT8_16_WG16_8_1_WGM8
    SolutionIndex: 34
    SolutionNameMin: Cijk_Ailk_Bljk_HBH_GB_MT128x128x16_SN_SU32_SUM3_TT8_8_WG16_16_1_WGM8
    SolutionIndex: 35
    SolutionNameMin: Cijk_Ailk_Bljk_HBH_GB_MT128x256x16_SN_SU32_SUM3_TT8_16_WG16_16_1_WGM8
    SolutionIndex: 36
    SolutionNameMin: Cijk_Ailk_Bljk_HBH_GB_MT128x128x32_SN_SU32_SUM3_TT8_8_WG16_16_1_WGM8
    SolutionIndex: 37
    SolutionNameMin: Cijk_Ailk_Bljk_HBH_GB_MT128x64x16_SN_SU0_SUM0_TT8_8_WG16_8_1_WGM1
    SolutionIndex: 38
    SolutionNameMin: Cijk_Ailk_Bljk_HBH_GB_MT128x128x16_SN_SU0_SUM0_TT8_16_WG16_8_1_WGM1
    SolutionIndex: 39
    SolutionNameMin: Cijk_Ailk_Bljk_HBH_GB_MT128x128x16_SN_SU32_SUM3_TT8_16_WG16_8_1_WGM1
    SolutionIndex: 40
    SolutionNameMin: Cijk_Ailk_Bljk_HBH_GB_MT128x256x16_SN_SU0_SUM0_TT8_16_WG16_16_1_WGM4
    SolutionIndex: 41
    SolutionNameMin: Cijk_Ailk_Bljk_HBH_GB_MT128x128x16_SN_SU32_SUM3_TT8_16_WG16_8_1_WGM4
    SolutionIndex: 42
    SolutionNameMin: Cijk_Ailk_Bljk_HBH_GB_MT128x64x16_SN_SU0_SUM0_TT8_8_WG16_8_1_WGM8
    SolutionIndex: 43
    SolutionNameMin: Cijk_Ailk_Bljk_HBH_GB_MT128x128x16_SN_SU0_SUM0_TT8_16_WG16_8_1_WGM8
    SolutionIndex: 44
    SolutionNameMin: Cijk_Ailk_Bljk_HBH_GB_MT128x64x16_SN_SU32_SUM3_TT8_8_WG16_8_1_WGM8
    SolutionIndex: 45
    SolutionNameMin: Cijk_Ailk_Bljk_HBH_GB_MT128x128x16_SN_SU32_SUM3_TT8_16_WG16_8_1_WGM8
    SolutionIndex: 46
    SolutionNameMin: Cijk_Ailk_Bljk_HBH_GB_MT64x64x8_SN_SU0_SUM0_TT8_8_WG8_8_1_WGM1
    SolutionIndex: 47
    SolutionNameMin: Cijk_Ailk_Bljk_HBH_GB_MT128x64x8_SN_SU0_SUM0_TT8_8_WG16_8_1_WGM1
    SolutionIndex: 48
    SolutionNameMin: Cijk_Ailk_Bljk_HBH_GB_MT64x64x16_SN_SU0_SUM0_TT8_8_WG8_8_1_WGM1
    SolutionIndex: 49
    SolutionNameMin: Cijk_Ailk_Bljk_HBH_GB_MT128x64x16_SN_SU0_SUM0_TT8_8_WG16_8_1_WGM1
    SolutionIndex: 50
    SolutionNameMin: Cijk_Ailk_Bljk_HBH_GB_MT128x128x16_SN_SU0_SUM0_TT8_8_WG16_16_1_WGM1
    SolutionIndex: 51
    SolutionNameMin: Cijk_Ailk_Bljk_HBH_GB_MT64x64x8_SN_SU32_SUM3_TT8_8_WG8_8_1_WGM1
    SolutionIndex: 52
    SolutionNameMin: Cijk_Ailk_Bljk_HBH_GB_MT128x64x8_SN_SU32_SUM3_TT8_8_WG16_8_1_WGM1
    SolutionIndex: 53
    SolutionNameMin: Cijk_Ailk_Bljk_HBH_GB_MT64x64x16_SN_SU32_SUM3_TT8_8_WG8_8_1_WGM1
    SolutionIndex: 54
    SolutionNameMin: Cijk_Ailk_Bljk_HBH_GB_MT128x64x16_SN_SU32_SUM3_TT8_8_WG16_8_1_WGM1
    SolutionIndex: 55
    SolutionNameMin: Cijk_Ailk_Bljk_HBH_GB_MT128x128x16_SN_SU32_SUM3_TT8_8_WG16_16_1_WGM1
    SolutionIndex: 56
    SolutionNameMin: Cijk_Ailk_Bljk_HBH_GB_MT64x64x32_SN_SU32_SUM3_TT8_8_WG8_8_1_WGM1
    SolutionIndex: 57
    SolutionNameMin: Cijk_Ailk_Bljk_HBH_GB_MT64x64x8_SN_SU0_SUM0_TT8_8_WG8_8_1_WGM4
    SolutionIndex: 58
    SolutionNameMin: Cijk_Ailk_Bljk_HBH_GB_MT128x64x8_SN_SU0_SUM0_TT8_8_WG16_8_1_WGM4
    SolutionIndex: 59
    SolutionNameMin: Cijk_Ailk_Bljk_HBH_GB_MT64x64x16_SN_SU0_SUM0_TT8_8_WG8_8_1_WGM4
    SolutionIndex: 60
    SolutionNameMin: Cijk_Ailk_Bljk_HBH_GB_MT128x64x16_SN_SU0_SUM0_TT8_8_WG16_8_1_WGM4
    SolutionIndex: 61
    SolutionNameMin: Cijk_Ailk_Bljk_HBH_GB_MT128x128x16_SN_SU0_SUM0_TT8_8_WG16_16_1_WGM4
    SolutionIndex: 62
    SolutionNameMin: Cijk_Ailk_Bljk_HBH_GB_MT128x64x32_SN_SU0_SUM0_TT8_8_WG16_8_1_WGM4
    SolutionIndex: 63
    SolutionNameMin: Cijk_Ailk_Bljk_HBH_GB_MT64x64x8_SN_SU32_SUM3_TT8_8_WG8_8_1_WGM4
    SolutionIndex: 64
    SolutionNameMin: Cijk_Ailk_Bljk_HBH_GB_MT128x64x8_SN_SU32_SUM3_TT8_8_WG16_8_1_WGM4
    SolutionIndex: 65
    SolutionNameMin: Cijk_Ailk_Bljk_HBH_GB_MT64x64x16_SN_SU32_SUM3_TT8_8_WG8_8_1_WGM4
    SolutionIndex: 66
    SolutionNameMin: Cijk_Ailk_Bljk_HBH_GB_MT128x64x16_SN_SU32_SUM3_TT8_8_WG16_8_1_WGM4
    SolutionIndex: 67
    SolutionNameMin: Cijk_Ailk_Bljk_HBH_GB_MT128x128x16_SN_SU32_SUM3_TT8_8_WG16_16_1_WGM4
    SolutionIndex: 68
    SolutionNameMin: Cijk_Ailk_Bljk_HBH_GB_MT64x64x32_SN_SU32_SUM3_TT8_8_WG8_8_1_WGM4
    SolutionIndex: 69
    SolutionNameMin: Cijk_Ailk_Bljk_HBH_GB_MT64x64x8_SN_SU0_SUM0_TT8_8_WG8_8_1_WGM8
    SolutionIndex: 70
    SolutionNameMin: Cijk_Ailk_Bljk_HBH_GB_MT128x64x8_SN_SU0_SUM0_TT8_8_WG16_8_1_WGM8
    SolutionIndex: 71
    SolutionNameMin: Cijk_Ailk_Bljk_HBH_GB_MT64x64x16_SN_SU0_SUM0_TT8_8_WG8_8_1_WGM8
    SolutionIndex: 72
    SolutionNameMin: Cijk_Ailk_Bljk_HBH_GB_MT128x64x16_SN_SU0_SUM0_TT8_8_WG16_8_1_WGM8
    SolutionIndex: 73
    SolutionNameMin: Cijk_Ailk_Bljk_HBH_GB_MT128x128x16_SN_SU0_SUM0_TT8_8_WG16_16_1_WGM8
    SolutionIndex: 74
    SolutionNameMin: Cijk_Ailk_Bljk_HBH_GB_MT64x64x32_SN_SU0_SUM0_TT8_8_WG8_8_1_WGM8
    SolutionIndex: 75
    SolutionNameMin: Cijk_Ailk_Bljk_HBH_GB_MT64x64x8_SN_SU32_SUM3_TT8_8_WG8_8_1_WGM8
    SolutionIndex: 76
    SolutionNameMin: Cijk_Ailk_Bljk_HBH_GB_MT128x64x8_SN_SU32_SUM3_TT8_8_WG16_8_1_WGM8
    SolutionIndex: 77
    SolutionNameMin: Cijk_Ailk_Bljk_HBH_GB_MT64x64x16_SN_SU32_SUM3_TT8_8_WG8_8_1_WGM8
    SolutionIndex: 78
    SolutionNameMin: Cijk_Ailk_Bljk_HBH_GB_MT128x64x16_SN_SU32_SUM3_TT8_8_WG16_8_1_WGM8
    SolutionIndex: 79
    SolutionNameMin: Cijk_Ailk_Bljk_HBH_GB_MT128x128x16_SN_SU32_SUM3_TT8_8_WG16_16_1_WGM8
    SolutionIndex: 80
    SolutionNameMin: Cijk_Ailk_Bljk_HBH_GB_MT64x64x32_SN_SU32_SUM3_TT8_8_WG8_8_1_WGM8
    SolutionIndex: 81
    SolutionNameMin: Cijk_Ailk_Bljk_HBH_GB_MT128x128x32_SN_SU32_SUM3_TT8_8_WG16_16_1_WGM8
    SolutionIndex: 82
    SolutionNameMin: Cijk_Ailk_Bljk_HBH_GB_MT128x64x16_SN_SU0_SUM0_TT8_8_WG16_8_1_WGM1
    SolutionIndex: 83
    SolutionNameMin: Cijk_Ailk_Bljk_HBH_GB_MT128x128x16_SN_SU0_SUM0_TT8_8_WG16_16_1_WGM1
    SolutionIndex: 84
    SolutionNameMin: Cijk_Ailk_Bljk_HBH_GB_MT128x128x16_SN_SU32_SUM3_TT8_8_WG16_16_1_WGM1
    SolutionIndex: 85
    SolutionNameMin: Cijk_Ailk_Bljk_HBH_GB_MT128x128x16_SN_SU0_SUM0_TT8_8_WG16_16_1_WGM4
    SolutionIndex: 86
    SolutionNameMin: Cijk_Ailk_Bljk_HBH_GB_MT128x128x16_SN_SU32_SUM3_TT8_8_WG16_16_1_WGM4
    SolutionIndex: 87
    SolutionNameMin: Cijk_Ailk_Bljk_HBH_GB_MT128x64x16_SN_SU0_SUM0_TT8_8_WG16_8_1_WGM8
    SolutionIndex: 88
    SolutionNameMin: Cijk_Ailk_Bljk_HBH_GB_MT128x128x16_SN_SU0_SUM0_TT8_8_WG16_16_1_WGM8
    SolutionIndex: 89
    SolutionNameMin: Cijk_Ailk_Bljk_HBH_GB_MT128x128x16_SN_SU32_SUM3_TT8_8_WG16_16_1_WGM8
    SolutionIndex: 90
    SolutionNameMin: Cijk_Ailk_Bljk_HBH_GB_MT16x16x8_SN_SU0_SUM0_TT2_2_WG8_8_1_WGM1
    SolutionIndex: 91
    SolutionNameMin: Cijk_Ailk_Bljk_HBH_GB_MT32x32x8_SN_SU0_SUM0_TT4_4_WG8_8_1_WGM1
    SolutionIndex: 92
    SolutionNameMin: Cijk_Ailk_Bljk_HBH_GB_MT32x16x8_SN_SU0_SUM0_TT2_2_WG16_8_1_WGM1
    SolutionIndex: 93
    SolutionNameMin: Cijk_Ailk_Bljk_HBH_GB_MT64x32x8_SN_SU0_SUM0_TT4_4_WG16_8_1_WGM1
    SolutionIndex: 94
    SolutionNameMin: Cijk_Ailk_Bljk_HBH_GB_MT32x32x8_SN_SU0_SUM0_TT2_2_WG16_16_1_WGM1
    SolutionIndex: 95
    SolutionNameMin: Cijk_Ailk_Bljk_HBH_GB_MT32x16x16_SN_SU0_SUM0_TT2_2_WG16_8_1_WGM1
    SolutionIndex: 96
    SolutionNameMin: Cijk_Ailk_Bljk_HBH_GB_MT64x32x16_SN_SU0_SUM0_TT4_4_WG16_8_1_WGM1
    SolutionIndex: 97
    SolutionNameMin: Cijk_Ailk_Bljk_HBH_GB_MT16x16x32_SN_SU0_SUM0_TT2_2_WG8_8_1_WGM1
    SolutionIndex: 98
    SolutionNameMin: Cijk_Ailk_Bljk_HBH_GB_MT32x16x32_SN_SU0_SUM0_TT2_2_WG16_8_1_WGM1
    SolutionIndex: 99
    SolutionNameMin: Cijk_Ailk_Bljk_HBH_GB_MT32x16x8_SN_SU32_SUM3_TT2_2_WG16_8_1_WGM1
    SolutionIndex: 100
    SolutionNameMin: Cijk_Ailk_Bljk_HBH_GB_MT64x32x8_SN_SU32_SUM3_TT4_4_WG16_8_1_WGM1
    SolutionIndex: 101
    SolutionNameMin: Cijk_Ailk_Bljk_HBH_GB_MT32x32x8_SN_SU32_SUM3_TT2_2_WG16_16_1_WGM1
    SolutionIndex: 102
    SolutionNameMin: Cijk_Ailk_Bljk_HBH_GB_MT16x16x16_SN_SU32_SUM3_TT2_2_WG8_8_1_WGM1
    SolutionIndex: 103
    SolutionNameMin: Cijk_Ailk_Bljk_HBH_GB_MT32x32x16_SN_SU32_SUM3_TT4_4_WG8_8_1_WGM1
    SolutionIndex: 104
    SolutionNameMin: Cijk_Ailk_Bljk_HBH_GB_MT32x16x16_SN_SU32_SUM3_TT2_2_WG16_8_1_WGM1
    SolutionIndex: 105
    SolutionNameMin: Cijk_Ailk_Bljk_HBH_GB_MT64x32x16_SN_SU32_SUM3_TT4_4_WG16_8_1_WGM1
    SolutionIndex: 106
    SolutionNameMin: Cijk_Ailk_Bljk_HBH_GB_MT32x16x32_SN_SU32_SUM3_TT2_2_WG16_8_1_WGM1
    SolutionIndex: 107
    SolutionNameMin: Cijk_Ailk_Bljk_HBH_GB_MT16x16x8_SN_SU0_SUM0_TT2_2_WG8_8_1_WGM4
    SolutionIndex: 108
    SolutionNameMin: Cijk_Ailk_Bljk_HBH_GB_MT32x32x8_SN_SU0_SUM0_TT4_4_WG8_8_1_WGM4
    SolutionIndex: 109
    SolutionNameMin: Cijk_Ailk_Bljk_HBH_GB_MT32x16x8_SN_SU0_SUM0_TT2_2_WG16_8_1_WGM4
    SolutionIndex: 110
    SolutionNameMin: Cijk_Ailk_Bljk_HBH_GB_MT64x32x8_SN_SU0_SUM0_TT4_4_WG16_8_1_WGM4
    SolutionIndex: 111
    SolutionNameMin: Cijk_Ailk_Bljk_HBH_GB_MT32x32x16_SN_SU0_SUM0_TT4_4_WG8_8_1_WGM4
    SolutionIndex: 112
    SolutionNameMin: Cijk_Ailk_Bljk_HBH_GB_MT32x16x16_SN_SU0_SUM0_TT2_2_WG16_8_1_WGM4
    SolutionIndex: 113
    SolutionNameMin: Cijk_Ailk_Bljk_HBH_GB_MT64x32x16_SN_SU0_SUM0_TT4_4_WG16_8_1_WGM4
    SolutionIndex: 114
    SolutionNameMin: Cijk_Ailk_Bljk_HBH_GB_MT16x16x32_SN_SU0_SUM0_TT2_2_WG8_8_1_WGM4
    SolutionIndex: 115
    SolutionNameMin: Cijk_Ailk_Bljk_HBH_GB_MT32x16x32_SN_SU0_SUM0_TT2_2_WG16_8_1_WGM4
    SolutionIndex: 116
    SolutionNameMin: Cijk_Ailk_Bljk_HBH_GB_MT64x32x8_SN_SU32_SUM3_TT4_4_WG16_8_1_WGM4
    SolutionIndex: 117
    SolutionNameMin: Cijk_Ailk_Bljk_HBH_GB_MT64x64x8_SN_SU32_SUM3_TT4_4_WG16_16_1_WGM4
    SolutionIndex: 118
    SolutionNameMin: Cijk_Ailk_Bljk_HBH_GB_MT16x16x16_SN_SU32_SUM3_TT2_2_WG8_8_1_WGM4
    SolutionIndex: 119
    SolutionNameMin: Cijk_Ailk_Bljk_HBH_GB_MT32x32x16_SN_SU32_SUM3_TT4_4_WG8_8_1_WGM4
    SolutionIndex: 120
    SolutionNameMin: Cijk_Ailk_Bljk_HBH_GB_MT32x16x16_SN_SU32_SUM3_TT2_2_WG16_8_1_WGM4
    SolutionIndex: 121
    SolutionNameMin: Cijk_Ailk_Bljk_HBH_GB_MT64x32x16_SN_SU32_SUM3_TT4_4_WG16_8_1_WGM4
    SolutionIndex: 122
    SolutionNameMin: Cijk_Ailk_Bljk_HBH_GB_MT32x16x32_SN_SU32_SUM3_TT2_2_WG16_8_1_WGM4
    SolutionIndex: 123
    SolutionNameMin: Cijk_Ailk_Bljk_HBH_GB_MT32x32x8_SN_SU0_SUM0_TT4_4_WG8_8_1_WGM8
    SolutionIndex: 124
    SolutionNameMin: Cijk_Ailk_Bljk_HBH_GB_MT32x16x8_SN_SU0_SUM0_TT2_2_WG16_8_1_WGM8
    SolutionIndex: 125
    SolutionNameMin: Cijk_Ailk_Bljk_HBH_GB_MT64x32x8_SN_SU0_SUM0_TT4_4_WG16_8_1_WGM8
    SolutionIndex: 126
    SolutionNameMin: Cijk_Ailk_Bljk_HBH_GB_MT32x32x8_SN_SU0_SUM0_TT2_2_WG16_16_1_WGM8
    SolutionIndex: 127
    SolutionNameMin: Cijk_Ailk_Bljk_HBH_GB_MT64x64x8_SN_SU0_SUM0_TT4_4_WG16_16_1_WGM8
    SolutionIndex: 128
    SolutionNameMin: Cijk_Ailk_Bljk_HBH_GB_MT32x32x16_SN_SU0_SUM0_TT4_4_WG8_8_1_WGM8
    SolutionIndex: 129
    SolutionNameMin: Cijk_Ailk_Bljk_HBH_GB_MT32x16x16_SN_SU0_SUM0_TT2_2_WG16_8_1_WGM8
    SolutionIndex: 130
    SolutionNameMin: Cijk_Ailk_Bljk_HBH_GB_MT64x32x16_SN_SU0_SUM0_TT4_4_WG16_8_1_WGM8
    SolutionIndex: 131
    SolutionNameMin: Cijk_Ailk_Bljk_HBH_GB_MT32x16x32_SN_SU0_SUM0_TT2_2_WG16_8_1_WGM8
    SolutionIndex: 132
    SolutionNameMin: Cijk_Ailk_Bljk_HBH_GB_MT32x32x8_SN_SU32_SUM3_TT4_4_WG8_8_1_WGM8
    SolutionIndex: 133
    SolutionNameMin: Cijk_Ailk_Bljk_HBH_GB_MT32x16x8_SN_SU32_SUM3_TT2_2_WG16_8_1_WGM8
    SolutionIndex: 134
    SolutionNameMin: Cijk_Ailk_Bljk_HBH_GB_MT64x32x8_SN_SU32_SUM3_TT4_4_WG16_8_1_WGM8
    SolutionIndex: 135
    SolutionNameMin: Cijk_Ailk_Bljk_HBH_GB_MT32x32x8_SN_SU32_SUM3_TT2_2_WG16_16_1_WGM8
    SolutionIndex: 136
    SolutionNameMin: Cijk_Ailk_Bljk_HBH_GB_MT16x16x16_SN_SU32_SUM3_TT2_2_WG8_8_1_WGM8
    SolutionIndex: 137
    SolutionNameMin: Cijk_Ailk_Bljk_HBH_GB_MT32x32x16_SN_SU32_SUM3_TT4_4_WG8_8_1_WGM8
    SolutionIndex: 138
    SolutionNameMin: Cijk_Ailk_Bljk_HBH_GB_MT32x16x16_SN_SU32_SUM3_TT2_2_WG16_8_1_WGM8
    SolutionIndex: 139
    SolutionNameMin: Cijk_Ailk_Bljk_HBH_GB_MT64x32x16_SN_SU32_SUM3_TT4_4_WG16_8_1_WGM8
    SolutionIndex: 140
    SolutionNameMin: Cijk_Ailk_Bljk_HBH_GB_MT32x32x16_SN_SU32_SUM3_TT2_2_WG16_16_1_WGM8
    SolutionIndex: 141
    SolutionNameMin: Cijk_Ailk_Bljk_HBH_GB_MT32x16x32_SN_SU32_SUM3_TT2_2_WG16_8_1_WGM8
    SolutionIndex: 142
    SolutionNameMin: Cijk_Ailk_Bljk_HBH_GB_MT64x64x32_SN_SU32_SUM3_TT4_4_WG16_16_1_WGM8
    SolutionIndex: 143
    SolutionNameMin: Cijk_Ailk_Bljk_HBH_GB_MT32x8x8_SN_SU0_SUM0_TT2_2_WG16_4_1_WGM1
    SolutionIndex: 144
    SolutionNameMin: Cijk_Ailk_Bljk_HBH_GB_MT64x8x8_SN_SU0_SUM0_TT4_2_WG16_4_1_WGM1
    SolutionIndex: 145
    SolutionNameMin: Cijk_Ailk_Bljk_HBH_GB_MT64x16x8_SN_SU0_SUM0_TT4_2_WG16_8_1_WGM1
    SolutionIndex: 146
    SolutionNameMin: Cijk_Ailk_Bljk_HBH_GB_MT64x8x16_SN_SU0_SUM0_TT4_2_WG16_4_1_WGM1
    SolutionIndex: 147
    SolutionNameMin: Cijk_Ailk_Bljk_HBH_GB_MT64x16x16_SN_SU0_SUM0_TT4_2_WG16_8_1_WGM1
    SolutionIndex: 148
    SolutionNameMin: Cijk_Ailk_Bljk_HBH_GB_MT64x8x16_SN_SU0_SUM0_TT2_2_WG32_4_1_WGM1
    SolutionIndex: 149
    SolutionNameMin: Cijk_Ailk_Bljk_HBH_GB_MT128x8x16_SN_SU0_SUM0_TT4_2_WG32_4_1_WGM1
    SolutionIndex: 150
    SolutionNameMin: Cijk_Ailk_Bljk_HBH_GB_MT64x8x32_SN_SU0_SUM0_TT2_2_WG32_4_1_WGM1
    SolutionIndex: 151
    SolutionNameMin: Cijk_Ailk_Bljk_HBH_GB_MT128x8x32_SN_SU0_SUM0_TT4_2_WG32_4_1_WGM1
    SolutionIndex: 152
    SolutionNameMin: Cijk_Ailk_Bljk_HBH_GB_MT64x16x8_SN_SU32_SUM3_TT4_2_WG16_8_1_WGM1
    SolutionIndex: 153
    SolutionNameMin: Cijk_Ailk_Bljk_HBH_GB_MT64x16x16_SN_SU32_SUM3_TT4_2_WG16_8_1_WGM1
    SolutionIndex: 154
    SolutionNameMin: Cijk_Ailk_Bljk_HBH_GB_MT128x8x16_SN_SU32_SUM3_TT4_2_WG32_4_1_WGM1
    SolutionIndex: 155
    SolutionNameMin: Cijk_Ailk_Bljk_HBH_GB_MT64x8x32_SN_SU32_SUM3_TT4_2_WG16_4_1_WGM1
    SolutionIndex: 156
    SolutionNameMin: Cijk_Ailk_Bljk_HBH_GB_MT128x8x32_SN_SU32_SUM3_TT4_2_WG32_4_1_WGM1
    SolutionIndex: 157
    SolutionNameMin: Cijk_Ailk_Bljk_HBH_GB_MT64x8x8_SN_SU0_SUM0_TT4_2_WG16_4_1_WGM4
    SolutionIndex: 158
    SolutionNameMin: Cijk_Ailk_Bljk_HBH_GB_MT64x16x8_SN_SU0_SUM0_TT4_2_WG16_8_1_WGM4
    SolutionIndex: 159
    SolutionNameMin: Cijk_Ailk_Bljk_HBH_GB_MT32x8x16_SN_SU0_SUM0_TT2_2_WG16_4_1_WGM4
    SolutionIndex: 160
    SolutionNameMin: Cijk_Ailk_Bljk_HBH_GB_MT64x16x16_SN_SU0_SUM0_TT4_2_WG16_8_1_WGM4
    SolutionIndex: 161
    SolutionNameMin: Cijk_Ailk_Bljk_HBH_GB_MT64x8x16_SN_SU0_SUM0_TT2_2_WG32_4_1_WGM4
    SolutionIndex: 162
    SolutionNameMin: Cijk_Ailk_Bljk_HBH_GB_MT64x8x32_SN_SU0_SUM0_TT4_2_WG16_4_1_WGM4
    SolutionIndex: 163
    SolutionNameMin: Cijk_Ailk_Bljk_HBH_GB_MT64x8x32_SN_SU0_SUM0_TT2_2_WG32_4_1_WGM4
    SolutionIndex: 164
    SolutionNameMin: Cijk_Ailk_Bljk_HBH_GB_MT128x8x32_SN_SU0_SUM0_TT4_2_WG32_4_1_WGM4
    SolutionIndex: 165
    SolutionNameMin: Cijk_Ailk_Bljk_HBH_GB_MT64x8x8_SN_SU32_SUM3_TT4_2_WG16_4_1_WGM4
    SolutionIndex: 166
    SolutionNameMin: Cijk_Ailk_Bljk_HBH_GB_MT64x16x16_SN_SU32_SUM3_TT4_2_WG16_8_1_WGM4
    SolutionIndex: 167
    SolutionNameMin: Cijk_Ailk_Bljk_HBH_GB_MT128x8x16_SN_SU32_SUM3_TT4_2_WG32_4_1_WGM4
    SolutionIndex: 168
    SolutionNameMin: Cijk_Ailk_Bljk_HBH_GB_MT64x8x32_SN_SU32_SUM3_TT2_2_WG32_4_1_WGM4
    SolutionIndex: 169
    SolutionNameMin: Cijk_Ailk_Bljk_HBH_GB_MT64x8x8_SN_SU0_SUM0_TT4_2_WG16_4_1_WGM8
    SolutionIndex: 170
    SolutionNameMin: Cijk_Ailk_Bljk_HBH_GB_MT64x16x16_SN_SU0_SUM0_TT4_2_WG16_8_1_WGM8
    SolutionIndex: 171
    SolutionNameMin: Cijk_Ailk_Bljk_HBH_GB_MT64x8x16_SN_SU0_SUM0_TT2_2_WG32_4_1_WGM8
    SolutionIndex: 172
    SolutionNameMin: Cijk_Ailk_Bljk_HBH_GB_MT128x8x16_SN_SU0_SUM0_TT4_2_WG32_4_1_WGM8
    SolutionIndex: 173
    SolutionNameMin: Cijk_Ailk_Bljk_HBH_GB_MT64x8x32_SN_SU0_SUM0_TT4_2_WG16_4_1_WGM8
    SolutionIndex: 174
    SolutionNameMin: Cijk_Ailk_Bljk_HBH_GB_MT128x8x32_SN_SU0_SUM0_TT4_2_WG32_4_1_WGM8
    SolutionIndex: 175
    SolutionNameMin: Cijk_Ailk_Bljk_HBH_GB_MT64x8x8_SN_SU32_SUM3_TT4_2_WG16_4_1_WGM8
    SolutionIndex: 176
    SolutionNameMin: Cijk_Ailk_Bljk_HBH_GB_MT64x16x16_SN_SU32_SUM3_TT4_2_WG16_8_1_WGM8
    SolutionIndex: 177
    SolutionNameMin: Cijk_Ailk_Bljk_HBH_GB_MT128x8x16_SN_SU32_SUM3_TT4_2_WG32_4_1_WGM8
    SolutionIndex: 178
    SolutionNameMin: Cijk_Ailk_Bljk_HBH_GB_MT64x8x32_SN_SU32_SUM3_TT4_2_WG16_4_1_WGM8
    SolutionIndex: 179
    SolutionNameMin: Cijk_Ailk_Bljk_HBH_GB_MT64x8x32_SN_SU32_SUM3_TT2_2_WG32_4_1_WGM8
    SolutionIndex: 180
    SolutionNameMin: Cijk_Ailk_Bljk_HBH_GB_MT32x16x16_SN_SU0_SUM0_TT2_2_WG16_8_1_WGM1
    SolutionIndex: 181
    SolutionNameMin: Cijk_Ailk_Bljk_HBH_GB_MT64x32x8_SN_SU32_SUM3_TT4_4_WG16_8_1_WGM1
    SolutionIndex: 182
    SolutionNameMin: Cijk_Ailk_Bljk_HBH_GB_MT32x16x16_SN_SU32_SUM3_TT2_2_WG16_8_1_WGM1
    SolutionIndex: 183
    SolutionNameMin: Cijk_Ailk_Bljk_HBH_GB_MT32x16x32_SN_SU32_SUM3_TT2_2_WG16_8_1_WGM1
    SolutionIndex: 184
    SolutionNameMin: Cijk_Ailk_Bljk_HBH_GB_MT32x16x16_SN_SU0_SUM0_TT2_2_WG16_8_1_WGM4
    SolutionIndex: 185
    SolutionNameMin: Cijk_Ailk_Bljk_HBH_GB_MT32x16x32_SN_SU0_SUM0_TT2_2_WG16_8_1_WGM4
    SolutionIndex: 186
    SolutionNameMin: Cijk_Ailk_Bljk_HBH_GB_MT32x16x16_SN_SU32_SUM3_TT2_2_WG16_8_1_WGM4
    SolutionIndex: 187
    SolutionNameMin: Cijk_Ailk_Bljk_HBH_GB_MT32x16x32_SN_SU32_SUM3_TT2_2_WG16_8_1_WGM4
    SolutionIndex: 188
    SolutionNameMin: Cijk_Ailk_Bljk_HBH_GB_MT32x16x16_SN_SU0_SUM0_TT2_2_WG16_8_1_WGM8
    SolutionIndex: 189
    SolutionNameMin: Cijk_Ailk_Bljk_HBH_GB_MT32x16x32_SN_SU0_SUM0_TT2_2_WG16_8_1_WGM8
- - - [2944, 4288, 1, 1280, 2944, 2944, 2944, 1280]
    - [10, 21955.0]
  - - [2368, 5888, 1, 256, 2368, 2368, 2368, 256]
    - [3, 20910.0]
  - - [5888, 1856, 1, 3328, 5888, 5888, 5888, 3328]
    - [3, 21650.0]
  - - [5888, 2944, 1, 3328, 5888, 5888, 5888, 3328]
    - [10, 21828.0]
  - - [1856, 4288, 1, 256, 1856, 1856, 1856, 256]
    - [16, 19134.0]
  - - [5056, 5056, 1, 3328, 5056, 5056, 5056, 3328]
    - [5, 22304.0]
  - - [1408, 5888, 1, 1280, 1408, 1408, 1408, 1280]
    - [3, 21916.0]
  - - [1024, 3584, 1, 3328, 1024, 1024, 1024, 3328]
    - [5, 21034.0]
  - - [448, 3584, 1, 3328, 448, 448, 448, 3328]
    - [30, 17388.0]
  - - [5888, 1408, 1, 1280, 5888, 5888, 5888, 1280]
    - [3, 21993.0]
  - - [1024, 2368, 1, 256, 1024, 1024, 1024, 256]
    - [16, 17388.0]
  - - [5056, 6784, 1, 1280, 5056, 5056, 5056, 1280]
    - [3, 22449.0]
  - - [5056, 5056, 1, 1280, 5056, 5056, 5056, 1280]
    - [5, 22143.0]
  - - [4288, 6784, 1, 256, 4288, 4288, 4288, 256]
    - [16, 21594.0]
  - - [6784, 448, 1, 256, 6784, 6784, 6784, 256]
    - [2, 17070.0]
  - - [5056, 256, 1, 1280, 5056, 5056, 5056, 1280]
    - [3, 20043.0]
  - - [5888, 704, 1, 1280, 5888, 5888, 5888, 1280]
    - [33, 19853.0]
  - - [3584, 1024, 1, 256, 3584, 3584, 3584, 256]
    - [3, 19573.0]
  - - [6784, 4288, 1, 3328, 6784, 6784, 6784, 3328]
    - [10, 22581.0]
  - - [1856, 2368, 1, 3328, 1856, 1856, 1856, 3328]
    - [3, 20208.0]
  - - [5888, 2944, 1, 1280, 5888, 5888, 5888, 1280]
    - [28, 22859.0]
  - - [5888, 1024, 1, 256, 5888, 5888, 5888, 256]
    - [3, 20780.0]
  - - [1408, 2944, 1, 256, 1408, 1408, 1408, 256]
    - [3, 20415.0]
  - - [6784, 5056, 1, 3328, 6784, 6784, 6784, 3328]
    - [16, 22784.0]
  - - [5056, 5056, 1, 256, 5056, 5056, 5056, 256]
    - [16, 21199.0]
  - - [1024, 3584, 1, 1280, 1024, 1024, 1024, 1280]
    - [16, 20792.0]
  - - [2368, 2944, 1, 1280, 2368, 2368, 2368, 1280]
    - [10, 21756.0]
  - - [6784, 6784, 1, 1280, 6784, 6784, 6784, 1280]
    - [3, 22990.0]
  - - [1408, 4288, 1, 1280, 1408, 1408, 1408, 1280]
    - [28, 21593.0]
  - - [3584, 4288, 1, 1280, 3584, 3584, 3584, 1280]
    - [16, 22359.0]
  - - [2368, 704, 1, 1280, 2368, 2368, 2368, 1280]
    - [22, 17887.0]
  - - [5056, 4288, 1, 3328, 5056, 5056, 5056, 3328]
    - [28, 22397.0]
  - - [3584, 2368, 1, 3328, 3584, 3584, 3584, 3328]
    - [28, 21665.0]
  - - [5888, 6784, 1, 1280, 5888, 5888, 5888, 1280]
    - [22, 22960.0]
  - - [6784, 448, 1, 1280, 6784, 6784, 6784, 1280]
    - [10, 18432.0]
  - - [2944, 5888, 1, 256, 2944, 2944, 2944, 256]
    - [3, 22080.0]
  - - [4288, 2944, 1, 256, 4288, 4288, 4288, 256]
    - [10, 20972.0]
  - - [5056, 2368, 1, 1280, 5056, 5056, 5056, 1280]
    - [16, 21899.0]
  - - [448, 3584, 1, 1280, 448, 448, 448, 1280]
    - [16, 17274.0]
  - - [6784, 5888, 1, 256, 6784, 6784, 6784, 256]
    - [10, 22399.0]
  - - [1024, 1408, 1, 256, 1024, 1024, 1024, 256]
    - [16, 16792.0]
  - - [2368, 2368, 1, 3328, 2368, 2368, 2368, 3328]
    - [3, 20590.0]
  - - [5056, 704, 1, 3328, 5056, 5056, 5056, 3328]
    - [3, 20217.0]
  - - [1408, 1856, 1, 256, 1408, 1408, 1408, 256]
    - [15, 16167.0]
  - - [5888, 1856, 1, 256, 5888, 5888, 5888, 256]
    - [28, 20610.0]
  - - [704, 5888, 1, 256, 704, 704, 704, 256]
    - [3, 18378.0]
  - - [3584, 704, 1, 3328, 3584, 3584, 3584, 3328]
    - [3, 18960.0]
  - - [1408, 1408, 1, 256, 1408, 1408, 1408, 256]
    - [28, 15950.0]
  - - [448, 4288, 1, 256, 448, 448, 448, 256]
    - [16, 14447.0]
  - - [704, 2368, 1, 1280, 704, 704, 704, 1280]
    - [16, 17360.0]
  - - [1856, 2368, 1, 1280, 1856, 1856, 1856, 1280]
    - [16, 19980.0]
  - - [1408, 1408, 1, 3328, 1408, 1408, 1408, 3328]
    - [10, 19203.0]
  - - [1408, 1024, 1, 1280, 1408, 1408, 1408, 1280]
    - [10, 18097.0]
  - - [704, 6784, 1, 256, 704, 704, 704, 256]
    - [33, 17196.0]
  - - [6784, 704, 1, 256, 6784, 6784, 6784, 256]
    - [3, 17694.0]
  - - [5056, 704, 1, 256, 5056, 5056, 5056, 256]
    - [10, 16549.0]
  - - [1408, 3584, 1, 256, 1408, 1408, 1408, 256]
    - [22, 19591.0]
  - - [3584, 4288, 1, 3328, 3584, 3584, 3584, 3328]
    - [28, 21824.0]
  - - [5888, 1856, 1, 1280, 5888, 5888, 5888, 1280]
    - [33, 21714.0]
  - - [2368, 3584, 1, 1280, 2368, 2368, 2368, 1280]
    - [16, 21749.0]
  - - [2944, 3584, 1, 3328, 2944, 2944, 2944, 3328]
    - [33, 22444.0]
  - - [6784, 2944, 1, 256, 6784, 6784, 6784, 256]
    - [28, 22094.0]
  - - [1856, 2368, 1, 256, 1856, 1856, 1856, 256]
    - [28, 18554.0]
  - - [3584, 6784, 1, 3328, 3584, 3584, 3584, 3328]
    - [16, 22890.0]
  - - [5056, 4288, 1, 1280, 5056, 5056, 5056, 1280]
    - [10, 22276.0]
  - - [6784, 1856, 1, 3328, 6784, 6784, 6784, 3328]
    - [3, 22072.0]
  - - [1408, 5056, 1, 1280, 1408, 1408, 1408, 1280]
    - [33, 22194.0]
  - - [6784, 5888, 1, 3328, 6784, 6784, 6784, 3328]
    - [16, 23079.0]
  - - [2368, 5056, 1, 1280, 2368, 2368, 2368, 1280]
    - [16, 21798.0]
  - - [1024, 5056, 1, 1280, 1024, 1024, 1024, 1280]
    - [16, 22006.0]
  - - [4288, 1024, 1, 256, 4288, 4288, 4288, 256]
    - [10, 18797.0]
  - - [2368, 1408, 1, 256, 2368, 2368, 2368, 256]
    - [28, 18246.0]
  - - [5888, 448, 1, 1280, 5888, 5888, 5888, 1280]
    - [10, 17536.0]
  - - [704, 5888, 1, 3328, 704, 704, 704, 3328]
    - [5, 20424.0]
  - - [1024, 6784, 1, 1280, 1024, 1024, 1024, 1280]
    - [22, 21841.0]
  - - [3584, 2944, 1, 1280, 3584, 3584, 3584, 1280]
    - [16, 22293.0]
  - - [1408, 5056, 1, 3328, 1408, 1408, 1408, 3328]
    - [3, 22461.0]
  - - [1856, 1856, 1, 3328, 1856, 1856, 1856, 3328]
    - [16, 19519.0]
  - - [2368, 2368, 1, 256, 2368, 2368, 2368, 256]
    - [3, 18399.0]
  - - [4288, 4288, 1, 1280, 4288, 4288, 4288, 1280]
    - [16, 22161.0]
  - - [5888, 1024, 1, 1280, 5888, 5888, 5888, 1280]
    - [3, 21905.0]
  - - [704, 6784, 1, 3328, 704, 704, 704, 3328]
    - [3, 20548.0]
  - - [5888, 5888, 1, 3328, 5888, 5888, 5888, 3328]
    - [3, 23065.0]
  - - [5056, 1024, 1, 1280, 5056, 5056, 5056, 1280]
    - [22, 21835.0]
  - - [448, 5888, 1, 3328, 448, 448, 448, 3328]
    - [3, 18030.0]
  - - [1024, 2944, 1, 1280, 1024, 1024, 1024, 1280]
    - [3, 19965.0]
  - - [5056, 5888, 1, 1280, 5056, 5056, 5056, 1280]
    - [3, 22684.0]
  - - [448, 6784, 1, 256, 448, 448, 448, 256]
    - [16, 16456.0]
  - - [3584, 5888, 1, 256, 3584, 3584, 3584, 256]
    - [16, 22029.0]
  - - [2944, 3584, 1, 256, 2944, 2944, 2944, 256]
    - [3, 21431.0]
  - - [6784, 1024, 1, 3328, 6784, 6784, 6784, 3328]
    - [5, 22088.0]
  - - [6784, 2944, 1, 3328, 6784, 6784, 6784, 3328]
    - [30, 21694.0]
  - - [6784, 2368, 1, 1280, 6784, 6784, 6784, 1280]
    - [3, 22017.0]
  - - [4288, 3584, 1, 256, 4288, 4288, 4288, 256]
    - [3, 21068.0]
  - - [4288, 5888, 1, 1280, 4288, 4288, 4288, 1280]
    - [3, 22423.0]
  - - [4288, 1856, 1, 1280, 4288, 4288, 4288, 1280]
    - [3, 21114.0]
  - - [1856, 2944, 1, 3328, 1856, 1856, 1856, 3328]
    - [3, 21078.0]
  - - [256, 6784, 1, 3328, 256, 256, 256, 3328]
    - [28, 19333.0]
  - - [5056, 1024, 1, 256, 5056, 5056, 5056, 256]
    - [5, 18522.0]
  - - [5056, 1856, 1, 3328, 5056, 5056, 5056, 3328]
    - [3, 21830.0]
  - - [5056, 256, 1, 3328, 5056, 5056, 5056, 3328]
    - [30, 20779.0]
  - - [1024, 5888, 1, 1280, 1024, 1024, 1024, 1280]
    - [16, 21854.0]
  - - [5056, 3584, 1, 256, 5056, 5056, 5056, 256]
    - [33, 21574.0]
  - - [1856, 1024, 1, 1280, 1856, 1856, 1856, 1280]
    - [10, 20470.0]
  - - [1856, 1856, 1, 1280, 1856, 1856, 1856, 1280]
    - [16, 19014.0]
  - - [1856, 1024, 1, 3328, 1856, 1856, 1856, 3328]
    - [30, 20681.0]
  - - [6784, 1024, 1, 256, 6784, 6784, 6784, 256]
    - [33, 20136.0]
  - - [5056, 5888, 1, 3328, 5056, 5056, 5056, 3328]
    - [16, 22760.0]
  - - [1856, 1024, 1, 256, 1856, 1856, 1856, 256]
    - [10, 16685.0]
  - - [5056, 1408, 1, 3328, 5056, 5056, 5056, 3328]
    - [28, 22273.0]
  - - [448, 5888, 1, 256, 448, 448, 448, 256]
    - [16, 15080.0]
  - - [1408, 6784, 1, 3328, 1408, 1408, 1408, 3328]
    - [3, 22331.0]
  - - [2944, 1408, 1, 3328, 2944, 2944, 2944, 3328]
    - [16, 21646.0]
  - - [2944, 4288, 1, 3328, 2944, 2944, 2944, 3328]
    - [16, 21982.0]
  - - [5056, 2944, 1, 256, 5056, 5056, 5056, 256]
    - [28, 21451.0]
  - - [2368, 1856, 1, 256, 2368, 2368, 2368, 256]
    - [22, 18524.0]
  - - [1408, 3584, 1, 3328, 1408, 1408, 1408, 3328]
    - [3, 21851.0]
  - - [2368, 6784, 1, 256, 2368, 2368, 2368, 256]
    - [16, 21116.0]
  - - [4288, 2368, 1, 3328, 4288, 4288, 4288, 3328]
    - [3, 21553.0]
  - - [704, 3584, 1, 1280, 704, 704, 704, 1280]
    - [3, 18181.0]
  - - [1408, 5888, 1, 3328, 1408, 1408, 1408, 3328]
    - [22, 22290.0]
  - - [1856, 5056, 1, 256, 1856, 1856, 1856, 256]
    - [16, 20310.0]
  - - [6784, 6784, 1, 256, 6784, 6784, 6784, 256]
    - [28, 22401.0]
  - - [2368, 4288, 1, 1280, 2368, 2368, 2368, 1280]
    - [3, 21417.0]
  - - [3584, 1856, 1, 1280, 3584, 3584, 3584, 1280]
    - [16, 21718.0]
  - - [3584, 448, 1, 256, 3584, 3584, 3584, 256]
    - [2, 16534.0]
  - - [3584, 3584, 1, 1280, 3584, 3584, 3584, 1280]
    - [16, 22500.0]
  - - [256, 6784, 1, 256, 256, 256, 256, 256]
    - [16, 17192.0]
  - - [1856, 3584, 1, 3328, 1856, 1856, 1856, 3328]
    - [33, 21966.0]
  - - [3584, 3584, 1, 256, 3584, 3584, 3584, 256]
    - [28, 21611.0]
  - - [6784, 4288, 1, 1280, 6784, 6784, 6784, 1280]
    - [3, 22519.0]
  - - [3584, 5056, 1, 256, 3584, 3584, 3584, 256]
    - [28, 21602.0]
  - - [2944, 2368, 1, 1280, 2944, 2944, 2944, 1280]
    - [22, 21801.0]
  - - [6784, 3584, 1, 256, 6784, 6784, 6784, 256]
    - [33, 22111.0]
  - - [1856, 1408, 1, 256, 1856, 1856, 1856, 256]
    - [3, 17332.0]
  - - [2944, 2944, 1, 3328, 2944, 2944, 2944, 3328]
    - [3, 22429.0]
  - - [5056, 6784, 1, 256, 5056, 5056, 5056, 256]
    - [22, 21926.0]
  - - [1408, 4288, 1, 3328, 1408, 1408, 1408, 3328]
    - [3, 22044.0]
  - - [6784, 256, 1, 1280, 6784, 6784, 6784, 1280]
    - [28, 18430.0]
  - - [2368, 704, 1, 3328, 2368, 2368, 2368, 3328]
    - [22, 18079.0]
  - - [3584, 6784, 1, 256, 3584, 3584, 3584, 256]
    - [16, 22111.0]
  - - [5056, 1856, 1, 256, 5056, 5056, 5056, 256]
    - [10, 20245.0]
  - - [704, 4288, 1, 256, 704, 704, 704, 256]
    - [16, 16800.0]
  - - [1408, 6784, 1, 1280, 1408, 1408, 1408, 1280]
    - [28, 22145.0]
  - - [5056, 2368, 1, 3328, 5056, 5056, 5056, 3328]
    - [3, 22027.0]
  - - [2944, 4288, 1, 256, 2944, 2944, 2944, 256]
    - [22, 21087.0]
  - - [1408, 3584, 1, 1280, 1408, 1408, 1408, 1280]
    - [16, 21643.0]
  - - [2368, 6784, 1, 3328, 2368, 2368, 2368, 3328]
    - [3, 22169.0]
  - - [5056, 704, 1, 1280, 5056, 5056, 5056, 1280]
    - [28, 19167.0]
  - - [1856, 4288, 1, 3328, 1856, 1856, 1856, 3328]
    - [5, 21216.0]
  - - [1408, 5888, 1, 256, 1408, 1408, 1408, 256]
    - [3, 20569.0]
  - - [704, 2944, 1, 1280, 704, 704, 704, 1280]
    - [16, 18836.0]
  - - [3584, 704, 1, 1280, 3584, 3584, 3584, 1280]
    - [16, 18354.0]
  - - [5888, 5056, 1, 256, 5888, 5888, 5888, 256]
    - [28, 21791.0]
  - - [3584, 448, 1, 3328, 3584, 3584, 3584, 3328]
    - [27, 17713.0]
  - - [704, 2368, 1, 3328, 704, 704, 704, 3328]
    - [5, 18364.0]
  - - [448, 5056, 1, 3328, 448, 448, 448, 3328]
    - [5, 19014.0]
  - - [4288, 448, 1, 256, 4288, 4288, 4288, 256]
    - [9, 15012.0]
  - - [5888, 2368, 1, 256, 5888, 5888, 5888, 256]
    - [22, 21113.0]
  - - [6784, 704, 1, 3328, 6784, 6784, 6784, 3328]
    - [3, 20554.0]
  - - [1408, 2944, 1, 3328, 1408, 1408, 1408, 3328]
    - [3, 21953.0]
  - - [4288, 4288, 1, 256, 4288, 4288, 4288, 256]
    - [28, 21213.0]
  - - [2368, 704, 1, 256, 2368, 2368, 2368, 256]
    - [9, 15771.0]
  - - [3584, 2368, 1, 256, 3584, 3584, 3584, 256]
    - [16, 20574.0]
  - - [5888, 5056, 1, 1280, 5888, 5888, 5888, 1280]
    - [3, 22667.0]
  - - [3584, 3584, 1, 3328, 3584, 3584, 3584, 3328]
    - [33, 22594.0]
  - - [5888, 6784, 1, 256, 5888, 5888, 5888, 256]
    - [3, 22397.0]
  - - [4288, 2944, 1, 3328, 4288, 4288, 4288, 3328]
    - [3, 22198.0]
  - - [256, 5056, 1, 1280, 256, 256, 256, 1280]
    - [33, 19052.0]
  - - [6784, 5888, 1, 1280, 6784, 6784, 6784, 1280]
    - [3, 22994.0]
  - - [5888, 4288, 1, 1280, 5888, 5888, 5888, 1280]
    - [3, 22464.0]
  - - [1408, 1856, 1, 1280, 1408, 1408, 1408, 1280]
    - [16, 19326.0]
  - - [5888, 448, 1, 3328, 5888, 5888, 5888, 3328]
    - [10, 18062.0]
  - - [704, 5888, 1, 1280, 704, 704, 704, 1280]
    - [10, 19631.0]
  - - [5056, 2944, 1, 3328, 5056, 5056, 5056, 3328]
    - [16, 22128.0]
  - - [448, 4288, 1, 1280, 448, 448, 448, 1280]
    - [16, 17541.0]
  - - [3584, 704, 1, 256, 3584, 3584, 3584, 256]
    - [15, 15731.0]
  - - [3584, 1408, 1, 3328, 3584, 3584, 3584, 3328]
    - [28, 21652.0]
  - - [2368, 1024, 1, 1280, 2368, 2368, 2368, 1280]
    - [10, 19614.0]
  - - [2944, 6784, 1, 1280, 2944, 2944, 2944, 1280]
    - [28, 22888.0]
  - - [1856, 6784, 1, 256, 1856, 1856, 1856, 256]
    - [3, 20855.0]
  - - [4288, 448, 1, 3328, 4288, 4288, 4288, 3328]
    - [10, 18252.0]
  - - [6784, 704, 1, 1280, 6784, 6784, 6784, 1280]
    - [16, 20001.0]
  - - [5888, 1024, 1, 3328, 5888, 5888, 5888, 3328]
    - [10, 21853.0]
  - - [704, 6784, 1, 1280, 704, 704, 704, 1280]
    - [22, 20306.0]
  - - [5056, 1024, 1, 3328, 5056, 5056, 5056, 3328]
    - [3, 22064.0]
  - - [704, 5056, 1, 1280, 704, 704, 704, 1280]
    - [16, 19572.0]
  - - [2944, 1856, 1, 256, 2944, 2944, 2944, 256]
    - [28, 18706.0]
  - - [5888, 5056, 1, 3328, 5888, 5888, 5888, 3328]
    - [3, 22768.0]
  - - [3584, 6784, 1, 1280, 3584, 3584, 3584, 1280]
    - [16, 22794.0]
  - - [1856, 5888, 1, 256, 1856, 1856, 1856, 256]
    - [10, 20595.0]
  - - [4288, 4288, 1, 3328, 4288, 4288, 4288, 3328]
    - [22, 22283.0]
  - - [4288, 1408, 1, 1280, 4288, 4288, 4288, 1280]
    - [16, 21404.0]
  - - [4288, 2368, 1, 256, 4288, 4288, 4288, 256]
    - [3, 20176.0]
  - - [2944, 5056, 1, 1280, 2944, 2944, 2944, 1280]
    - [16, 22333.0]
  - - [6784, 2368, 1, 3328, 6784, 6784, 6784, 3328]
    - [22, 21474.0]
  - - [4288, 1856, 1, 3328, 4288, 4288, 4288, 3328]
    - [10, 20992.0]
  - - [1856, 2944, 1, 1280, 1856, 1856, 1856, 1280]
    - [22, 20716.0]
  - - [4288, 6784, 1, 3328, 4288, 4288, 4288, 3328]
    - [33, 22506.0]
  - - [3584, 1024, 1, 1280, 3584, 3584, 3584, 1280]
    - [10, 20573.0]
  - - [1024, 4288, 1, 256, 1024, 1024, 1024, 256]
    - [27, 16843.0]
  - - [5888, 3584, 1, 3328, 5888, 5888, 5888, 3328]
    - [16, 22759.0]
  - - [5056, 3584, 1, 3328, 5056, 5056, 5056, 3328]
    - [28, 21656.0]
  - - [2368, 1408, 1, 1280, 2368, 2368, 2368, 1280]
    - [3, 19898.0]
  - - [5056, 2944, 1, 1280, 5056, 5056, 5056, 1280]
    - [10, 22332.0]
  - - [1024, 6784, 1, 256, 1024, 1024, 1024, 256]
    - [3, 20785.0]
  - - [2944, 5056, 1, 3328, 2944, 2944, 2944, 3328]
    - [33, 21996.0]
  - - [3584, 2944, 1, 256, 3584, 3584, 3584, 256]
    - [16, 21122.0]
  - - [5056, 6784, 1, 3328, 5056, 5056, 5056, 3328]
    - [33, 22554.0]
  - - [3584, 4288, 1, 256, 3584, 3584, 3584, 256]
    - [16, 20887.0]
  - - [1856, 6784, 1, 3328, 1856, 1856, 1856, 3328]
    - [3, 21856.0]
  - - [5056, 1408, 1, 1280, 5056, 5056, 5056, 1280]
    - [33, 22007.0]
  - - [5888, 5888, 1, 256, 5888, 5888, 5888, 256]
    - [10, 22176.0]
  - - [4288, 1024, 1, 1280, 4288, 4288, 4288, 1280]
    - [16, 21112.0]
  - - [448, 6784, 1, 3328, 448, 448, 448, 3328]
    - [3, 18693.0]
  - - [2944, 1408, 1, 1280, 2944, 2944, 2944, 1280]
    - [16, 21174.0]
  - - [2944, 1856, 1, 3328, 2944, 2944, 2944, 3328]
    - [3, 21020.0]
  - - [448, 5056, 1, 256, 448, 448, 448, 256]
    - [3, 14830.0]
  - - [3584, 5888, 1, 1280, 3584, 3584, 3584, 1280]
    - [3, 22669.0]
  - - [6784, 1856, 1, 1280, 6784, 6784, 6784, 1280]
    - [16, 21687.0]
  - - [5888, 256, 1, 3328, 5888, 5888, 5888, 3328]
    - [3, 19689.0]
  - - [1856, 5888, 1, 3328, 1856, 1856, 1856, 3328]
    - [3, 21687.0]
  - - [3584, 1408, 1, 256, 3584, 3584, 3584, 256]
    - [28, 19461.0]
  - - [704, 3584, 1, 3328, 704, 704, 704, 3328]
    - [3, 18691.0]
  - - [5056, 448, 1, 1280, 5056, 5056, 5056, 1280]
    - [3, 18033.0]
  - - [3584, 1856, 1, 3328, 3584, 3584, 3584, 3328]
    - [16, 21597.0]
  - - [2944, 1024, 1, 256, 2944, 2944, 2944, 256]
    - [10, 17766.0]
  - - [2368, 4288, 1, 3328, 2368, 2368, 2368, 3328]
    - [22, 21284.0]
  - - [1024, 1408, 1, 1280, 1024, 1024, 1024, 1280]
    - [3, 18330.0]
  - - [6784, 5056, 1, 256, 6784, 6784, 6784, 256]
    - [3, 21782.0]
  - - [4288, 5888, 1, 256, 4288, 4288, 4288, 256]
    - [22, 21604.0]
  - - [2944, 6784, 1, 256, 2944, 2944, 2944, 256]
    - [3, 22029.0]
  - - [2368, 2368, 1, 1280, 2368, 2368, 2368, 1280]
    - [10, 20374.0]
  - - [1856, 3584, 1, 1280, 1856, 1856, 1856, 1280]
    - [33, 21504.0]
  - - [3584, 1408, 1, 1280, 3584, 3584, 3584, 1280]
    - [3, 21537.0]
  - - [5056, 3584, 1, 1280, 5056, 5056, 5056, 1280]
    - [5, 22455.0]
  - - [256, 5888, 1, 256, 256, 256, 256, 256]
    - [28, 17196.0]
  - - [1856, 1408, 1, 3328, 1856, 1856, 1856, 3328]
    - [3, 19586.0]
  - - [1024, 4288, 1, 3328, 1024, 1024, 1024, 3328]
    - [5, 21497.0]
  - - [2944, 2368, 1, 3328, 2944, 2944, 2944, 3328]
    - [3, 21743.0]
  - - [704, 4288, 1, 3328, 704, 704, 704, 3328]
    - [16, 18587.0]
  - - [1024, 1856, 1, 1280, 1024, 1024, 1024, 1280]
    - [3, 19603.0]
  - - [6784, 1856, 1, 256, 6784, 6784, 6784, 256]
    - [28, 20633.0]
  - - [1024, 5888, 1, 256, 1024, 1024, 1024, 256]
    - [3, 20657.0]
  - - [1408, 2368, 1, 256, 1408, 1408, 1408, 256]
    - [28, 18491.0]
  - - [2944, 704, 1, 3328, 2944, 2944, 2944, 3328]
    - [10, 19588.0]
  - - [2944, 2944, 1, 1280, 2944, 2944, 2944, 1280]
    - [16, 22113.0]
  - - [6784, 256, 1, 3328, 6784, 6784, 6784, 3328]
    - [3, 19310.0]
  - - [1408, 5056, 1, 256, 1408, 1408, 1408, 256]
    - [33, 19479.0]
  - - [1408, 4288, 1, 256, 1408, 1408, 1408, 256]
    - [16, 19364.0]
  - - [5888, 2368, 1, 1280, 5888, 5888, 5888, 1280]
    - [3, 21901.0]
  - - [2368, 5888, 1, 1280, 2368, 2368, 2368, 1280]
    - [5, 21946.0]
  - - [5888, 256, 1, 1280, 5888, 5888, 5888, 1280]
    - [3, 19375.0]
  - - [2368, 1856, 1, 3328, 2368, 2368, 2368, 3328]
    - [3, 20005.0]
  - - [2944, 704, 1, 256, 2944, 2944, 2944, 256]
    - [13, 15451.0]
  - - [2368, 6784, 1, 1280, 2368, 2368, 2368, 1280]
    - [3, 21944.0]
  - - [2368, 1024, 1, 3328, 2368, 2368, 2368, 3328]
    - [5, 20426.0]
  - - [1856, 4288, 1, 1280, 1856, 1856, 1856, 1280]
    - [3, 20988.0]
  - - [704, 3584, 1, 256, 704, 704, 704, 256]
    - [10, 17252.0]
  - - [704, 2944, 1, 3328, 704, 704, 704, 3328]
    - [3, 19681.0]
  - - [1856, 5056, 1, 3328, 1856, 1856, 1856, 3328]
    - [3, 21443.0]
  - - [3584, 5056, 1, 1280, 3584, 3584, 3584, 1280]
    - [16, 22392.0]
  - - [2944, 1024, 1, 3328, 2944, 2944, 2944, 3328]
    - [3, 20432.0]
  - - [1408, 6784, 1, 256, 1408, 1408, 1408, 256]
    - [16, 20600.0]
  - - [6784, 1408, 1, 3328, 6784, 6784, 6784, 3328]
    - [3, 22324.0]
  - - [1024, 2368, 1, 1280, 1024, 1024, 1024, 1280]
    - [16, 19324.0]
  - - [6784, 2944, 1, 1280, 6784, 6784, 6784, 1280]
    - [3, 22699.0]
  - - [3584, 448, 1, 1280, 3584, 3584, 3584, 1280]
    - [2, 17506.0]
  - - [2944, 6784, 1, 3328, 2944, 2944, 2944, 3328]
    - [10, 22762.0]
  - - [448, 5056, 1, 1280, 448, 448, 448, 1280]
    - [10, 18311.0]
  - - [4288, 5056, 1, 1280, 4288, 4288, 4288, 1280]
    - [5, 22169.0]
  - - [4288, 704, 1, 256, 4288, 4288, 4288, 256]
    - [0, 16873.0]
  - - [5888, 704, 1, 256, 5888, 5888, 5888, 256]
    - [33, 18372.0]
  - - [256, 5888, 1, 3328, 256, 256, 256, 3328]
    - [10, 19681.0]
  - - [6784, 4288, 1, 256, 6784, 6784, 6784, 256]
    - [10, 21623.0]
  - - [5888, 256, 1, 256, 5888, 5888, 5888, 256]
    - [3, 17382.0]
  - - [6784, 1024, 1, 1280, 6784, 6784, 6784, 1280]
    - [3, 21757.0]
  - - [2944, 704, 1, 1280, 2944, 2944, 2944, 1280]
    - [33, 19193.0]
  - - [6784, 3584, 1, 1280, 6784, 6784, 6784, 1280]
    - [16, 22674.0]
  - - [1408, 2944, 1, 1280, 1408, 1408, 1408, 1280]
    - [3, 21509.0]
  - - [1408, 2368, 1, 3328, 1408, 1408, 1408, 3328]
    - [3, 20628.0]
  - - [2368, 2944, 1, 256, 2368, 2368, 2368, 256]
    - [10, 19699.0]
  - - [3584, 1856, 1, 256, 3584, 3584, 3584, 256]
    - [3, 19190.0]
  - - [4288, 3584, 1, 1280, 4288, 4288, 4288, 1280]
    - [28, 22265.0]
  - - [4288, 2944, 1, 1280, 4288, 4288, 4288, 1280]
    - [22, 22017.0]
  - - [5056, 448, 1, 3328, 5056, 5056, 5056, 3328]
    - [3, 18834.0]
  - - [4288, 5056, 1, 3328, 4288, 4288, 4288, 3328]
    - [16, 22324.0]
  - - [256, 5056, 1, 3328, 256, 256, 256, 3328]
    - [11, 20491.0]
  - - [5056, 2368, 1, 256, 5056, 5056, 5056, 256]
    - [16, 19848.0]
  - - [4288, 704, 1, 3328, 4288, 4288, 4288, 3328]
    - [3, 18792.0]
  - - [448, 3584, 1, 256, 448, 448, 448, 256]
    - [16, 14392.0]
  - - [1024, 1408, 1, 3328, 1024, 1024, 1024, 3328]
    - [3, 18649.0]
  - - [2944, 5888, 1, 1280, 2944, 2944, 2944, 1280]
    - [28, 22804.0]
  - - [5888, 3584, 1, 256, 5888, 5888, 5888, 256]
    - [10, 22077.0]
  - - [1408, 1856, 1, 3328, 1408, 1408, 1408, 3328]
    - [3, 19598.0]
  - - [6784, 1408, 1, 1280, 6784, 6784, 6784, 1280]
    - [16, 22195.0]
  - - [704, 2944, 1, 256, 704, 704, 704, 256]
    - [4, 16326.0]
  - - [2944, 5888, 1, 3328, 2944, 2944, 2944, 3328]
    - [5, 22644.0]
  - - [1408, 1408, 1, 1280, 1408, 1408, 1408, 1280]
    - [3, 18243.0]
  - - [448, 4288, 1, 3328, 448, 448, 448, 3328]
    - [16, 17957.0]
  - - [704, 2368, 1, 256, 704, 704, 704, 256]
    - [33, 14160.0]
  - - [5888, 2368, 1, 3328, 5888, 5888, 5888, 3328]
    - [3, 22167.0]
  - - [4288, 5056, 1, 256, 4288, 4288, 4288, 256]
    - [3, 21187.0]
  - - [4288, 448, 1, 1280, 4288, 4288, 4288, 1280]
    - [33, 17749.0]
  - - [5888, 704, 1, 3328, 5888, 5888, 5888, 3328]
    - [5, 20299.0]
  - - [4288, 3584, 1, 3328, 4288, 4288, 4288, 3328]
    - [16, 21960.0]
  - - [1024, 6784, 1, 3328, 1024, 1024, 1024, 3328]
    - [3, 22011.0]
  - - [1408, 1024, 1, 256, 1408, 1408, 1408, 256]
    - [3, 15139.0]
  - - [6784, 6784, 1, 3328, 6784, 6784, 6784, 3328]
    - [16, 23046.0]
  - - [704, 5056, 1, 3328, 704, 704, 704, 3328]
    - [5, 20185.0]
  - - [3584, 5056, 1, 3328, 3584, 3584, 3584, 3328]
    - [28, 21485.0]
  - - [2368, 2944, 1, 3328, 2368, 2368, 2368, 3328]
    - [3, 21766.0]
  - - [2368, 3584, 1, 256, 2368, 2368, 2368, 256]
    - [3, 19929.0]
  - - [3584, 2368, 1, 1280, 3584, 3584, 3584, 1280]
    - [16, 21679.0]
  - - [1856, 1856, 1, 256, 1856, 1856, 1856, 256]
    - [3, 17794.0]
  - - [4288, 1408, 1, 3328, 4288, 4288, 4288, 3328]
    - [3, 21934.0]
  - - [5888, 1408, 1, 3328, 5888, 5888, 5888, 3328]
    - [3, 22273.0]
  - - [256, 5056, 1, 256, 256, 256, 256, 256]
    - [2, 14295.0]
  - - [2368, 5056, 1, 256, 2368, 2368, 2368, 256]
    - [16, 20712.0]
  - - [1024, 5056, 1, 256, 1024, 1024, 1024, 256]
    - [22, 20015.0]
  - - [2368, 1408, 1, 3328, 2368, 2368, 2368, 3328]
    - [3, 20709.0]
  - - [5888, 448, 1, 256, 5888, 5888, 5888, 256]
    - [15, 15624.0]
  - - [6784, 5056, 1, 1280, 6784, 6784, 6784, 1280]
    - [3, 22578.0]
  - - [4288, 6784, 1, 1280, 4288, 4288, 4288, 1280]
    - [22, 22504.0]
  - - [6784, 1408, 1, 256, 6784, 6784, 6784, 256]
    - [28, 21252.0]
  - - [5888, 4288, 1, 256, 5888, 5888, 5888, 256]
    - [28, 21662.0]
  - - [5056, 5888, 1, 256, 5056, 5056, 5056, 256]
    - [16, 21782.0]
  - - [2368, 1024, 1, 256, 2368, 2368, 2368, 256]
    - [3, 17726.0]
  - - [1856, 6784, 1, 1280, 1856, 1856, 1856, 1280]
    - [16, 21868.0]
  - - [6784, 448, 1, 3328, 6784, 6784, 6784, 3328]
    - [3, 18812.0]
  - - [5056, 1856, 1, 1280, 5056, 5056, 5056, 1280]
    - [10, 21562.0]
  - - [1408, 1024, 1, 3328, 1408, 1408, 1408, 3328]
    - [10, 18784.0]
  - - [5888, 3584, 1, 1280, 5888, 5888, 5888, 1280]
    - [3, 22814.0]
  - - [1024, 2944, 1, 256, 1024, 1024, 1024, 256]
    - [10, 19009.0]
  - - [448, 6784, 1, 1280, 448, 448, 448, 1280]
    - [16, 18476.0]
  - - [704, 5056, 1, 256, 704, 704, 704, 256]
    - [24, 16383.0]
  - - [3584, 1024, 1, 3328, 3584, 3584, 3584, 3328]
    - [28, 20823.0]
  - - [2944, 1856, 1, 1280, 2944, 2944, 2944, 1280]
    - [33, 20806.0]
  - - [5056, 256, 1, 256, 5056, 5056, 5056, 256]
    - [10, 16958.0]
  - - [2368, 3584, 1, 3328, 2368, 2368, 2368, 3328]
    - [22, 21898.0]
  - - [3584, 5888, 1, 3328, 3584, 3584, 3584, 3328]
    - [3, 22901.0]
  - - [2944, 3584, 1, 1280, 2944, 2944, 2944, 1280]
    - [3, 22298.0]
  - - [1856, 5888, 1, 1280, 1856, 1856, 1856, 1280]
    - [10, 21759.0]
  - - [4288, 1408, 1, 256, 4288, 4288, 4288, 256]
    - [10, 20268.0]
  - - [4288, 2368, 1, 1280, 4288, 4288, 4288, 1280]
    - [3, 21395.0]
  - - [2944, 5056, 1, 256, 2944, 2944, 2944, 256]
    - [3, 21465.0]
  - - [6784, 2368, 1, 256, 6784, 6784, 6784, 256]
    - [16, 21116.0]
  - - [4288, 1856, 1, 256, 4288, 4288, 4288, 256]
    - [22, 19924.0]
  - - [1856, 2944, 1, 256, 1856, 1856, 1856, 256]
    - [3, 19422.0]
  - - [1856, 1408, 1, 1280, 1856, 1856, 1856, 1280]
    - [3, 19351.0]
  - - [1024, 4288, 1, 1280, 1024, 1024, 1024, 1280]
    - [16, 20779.0]
  - - [2368, 5056, 1, 3328, 2368, 2368, 2368, 3328]
    - [16, 21766.0]
  - - [4288, 1024, 1, 3328, 4288, 4288, 4288, 3328]
    - [16, 21315.0]
  - - [1024, 5056, 1, 3328, 1024, 1024, 1024, 3328]
    - [5, 22076.0]
  - - [1024, 1856, 1, 3328, 1024, 1024, 1024, 3328]
    - [3, 20450.0]
  - - [3584, 2944, 1, 3328, 3584, 3584, 3584, 3328]
    - [22, 22386.0]
  - - [5888, 2944, 1, 256, 5888, 5888, 5888, 256]
    - [28, 21975.0]
  - - [5056, 4288, 1, 256, 5056, 5056, 5056, 256]
    - [22, 21240.0]
  - - [1024, 3584, 1, 256, 1024, 1024, 1024, 256]
    - [10, 19614.0]
  - - [5056, 1408, 1, 256, 5056, 5056, 5056, 256]
    - [10, 20677.0]
  - - [5888, 5888, 1, 1280, 5888, 5888, 5888, 1280]
    - [16, 22888.0]
  - - [448, 5888, 1, 1280, 448, 448, 448, 1280]
    - [3, 17549.0]
  - - [4288, 704, 1, 1280, 4288, 4288, 4288, 1280]
    - [10, 18115.0]
  - - [2944, 1408, 1, 256, 2944, 2944, 2944, 256]
    - [16, 19329.0]
  - - [2368, 5888, 1, 3328, 2368, 2368, 2368, 3328]
    - [16, 21644.0]
  - - [2368, 1856, 1, 1280, 2368, 2368, 2368, 1280]
    - [16, 19640.0]
  - - [5888, 4288, 1, 3328, 5888, 5888, 5888, 3328]
    - [10, 22568.0]
  - - [5056, 448, 1, 256, 5056, 5056, 5056, 256]
    - [9, 16720.0]
  - - [1856, 5056, 1, 1280, 1856, 1856, 1856, 1280]
    - [16, 21510.0]
  - - [2944, 1024, 1, 1280, 2944, 2944, 2944, 1280]
    - [10, 20393.0]
  - - [2368, 4288, 1, 256, 2368, 2368, 2368, 256]
    - [33, 20054.0]
  - - [1024, 2368, 1, 3328, 1024, 1024, 1024, 3328]
    - [5, 20187.0]
  - - [4288, 5888, 1, 3328, 4288, 4288, 4288, 3328]
    - [3, 22560.0]
  - - [1024, 2944, 1, 3328, 1024, 1024, 1024, 3328]
    - [3, 20486.0]
  - - [256, 6784, 1, 1280, 256, 256, 256, 1280]
    - [16, 18436.0]
  - - [1856, 3584, 1, 256, 1856, 1856, 1856, 256]
    - [22, 18315.0]
  - - [256, 5888, 1, 1280, 256, 256, 256, 1280]
    - [3, 19050.0]
  - - [2944, 2368, 1, 256, 2944, 2944, 2944, 256]
    - [16, 19768.0]
  - - [1024, 1856, 1, 256, 1024, 1024, 1024, 256]
    - [22, 15407.0]
  - - [6784, 3584, 1, 3328, 6784, 6784, 6784, 3328]
    - [3, 22924.0]
  - - [1024, 5888, 1, 3328, 1024, 1024, 1024, 3328]
    - [3, 21924.0]
  - - [1408, 2368, 1, 1280, 1408, 1408, 1408, 1280]
    - [16, 19740.0]
  - - [2944, 2944, 1, 256, 2944, 2944, 2944, 256]
    - [22, 21310.0]
  - - [6784, 256, 1, 256, 6784, 6784, 6784, 256]
    - [16, 17435.0]
  - - [5888, 1408, 1, 256, 5888, 5888, 5888, 256]
    - [10, 21240.0]
  - - [5888, 6784, 1, 3328, 5888, 5888, 5888, 3328]
    - [3, 23087.0]
  - - [704, 4288, 1, 1280, 704, 704, 704, 1280]
    - [16, 18302.0]
  - - [4096, 7000, 1, 4096, 4096, 4096, 4096, 4096]
    - [33, 22120.0]
  - - [5124, 9124, 1, 1760, 5124, 5124, 5124, 1760]
    - [14, 22870.0]
  - - [1024, 1500, 1, 1536, 1024, 1024, 1024, 1536]
    - [16, 19184.0]
  - - [512, 24000, 1, 2048, 512, 512, 512, 2048]
    - [33, 22294.0]
  - - [3072, 24000, 1, 1024, 3072, 3072, 3072, 1024]
    - [3, 22943.0]
  - - [1024, 3000, 1, 2560, 1024, 1024, 1024, 2560]
    - [16, 20705.0]
  - - [512, 3136, 1, 2048, 512, 512, 512, 2048]
    - [33, 19978.0]
  - - [8448, 1500, 1, 2816, 8448, 8448, 8448, 2816]
    - [22, 22237.0]
  - - [2560, 7000, 1, 2560, 2560, 2560, 2560, 2560]
    - [28, 22797.0]
  - - [512, 48000, 1, 2048, 512, 512, 512, 2048]
    - [22, 22566.0]
  - - [196, 256, 64, 1024, 196, 196, 196, 1024]
    - [10, 16215.0]
  - - [512, 48000, 1, 1536, 512, 512, 512, 1536]
    - [16, 22887.0]
  - - [4608, 1500, 1, 1536, 4608, 4608, 4608, 1536]
    - [22, 21619.0]
  - - [1024, 24000, 1, 2560, 1024, 1024, 1024, 2560]
    - [10, 22715.0]
  - - [4608, 3000, 1, 1536, 4608, 4608, 4608, 1536]
    - [16, 21989.0]
  - - [5124, 9124, 1, 2048, 5124, 5124, 5124, 2048]
    - [33, 22188.0]
  - - [5124, 700, 1, 2560, 5124, 5124, 5124, 2560]
    - [3, 18816.0]
  - - [6144, 6000, 1, 2560, 6144, 6144, 6144, 2560]
    - [3, 23006.0]
  - - [1024, 1500, 1, 2816, 1024, 1024, 1024, 2816]
    - [3, 19358.0]
  - - [8448, 48000, 1, 2816, 8448, 8448, 8448, 2816]
    - [10, 23083.0]
  - - [512, 6000, 1, 2048, 512, 512, 512, 2048]
    - [22, 19630.0]
  - - [4224, 1500, 1, 176, 4224, 4224, 4224, 176]
    - [20, 18209.0]
  - - [1024, 6000, 1, 2816, 1024, 1024, 1024, 2816]
    - [3, 22337.0]
  - - [1024, 48000, 1, 1536, 1024, 1024, 1024, 1536]
    - [10, 22820.0]
  - - [1024, 48000, 1, 2560, 1024, 1024, 1024, 2560]
    - [10, 22958.0]
  - - [4608, 24000, 1, 1536, 4608, 4608, 4608, 1536]
    - [3, 22971.0]
  - - [7680, 48000, 1, 2560, 7680, 7680, 7680, 2560]
    - [22, 22988.0]
  - - [3072, 48000, 1, 1024, 3072, 3072, 3072, 1024]
    - [3, 23021.0]
  - - [1024, 1500, 1, 2048, 1024, 1024, 1024, 2048]
    - [22, 19247.0]
  - - [1024, 3000, 1, 2048, 1024, 1024, 1024, 2048]
    - [22, 20245.0]
  - - [1024, 6000, 1, 2048, 1024, 1024, 1024, 2048]
    - [22, 22220.0]
  - - [512, 24000, 1, 2816, 512, 512, 512, 2816]
    - [28, 22548.0]
  - - [6144, 48000, 1, 2560, 6144, 6144, 6144, 2560]
    - [10, 22888.0]
  - - [1760, 7000, 1, 1760, 1760, 1760, 1760, 1760]
    - [26, 22544.0]
  - - [8448, 3000, 1, 2816, 8448, 8448, 8448, 2816]
    - [22, 22337.0]
  - - [4608, 48000, 1, 1536, 4608, 4608, 4608, 1536]
    - [22, 22583.0]
  - - [7680, 1500, 1, 2560, 7680, 7680, 7680, 2560]
    - [22, 22266.0]
  - - [512, 3000, 1, 1536, 512, 512, 512, 1536]
    - [10, 19329.0]
  - - [1024, 3000, 1, 2816, 1024, 1024, 1024, 2816]
    - [16, 20579.0]
  - - [5124, 9124, 1, 2560, 5124, 5124, 5124, 2560]
    - [3, 22280.0]
  - - [512, 48000, 1, 2816, 512, 512, 512, 2816]
    - [10, 22891.0]
  - - [512, 3000, 1, 2816, 512, 512, 512, 2816]
    - [28, 19620.0]
  - - [1024, 24000, 1, 1536, 1024, 1024, 1024, 1536]
    - [10, 22655.0]
  - - [7680, 6000, 1, 2560, 7680, 7680, 7680, 2560]
    - [3, 22949.0]
  - - [512, 6000, 1, 2560, 512, 512, 512, 2560]
    - [10, 20475.0]
  - - [512, 24000, 1, 2560, 512, 512, 512, 2560]
    - [22, 22475.0]
  - - [6144, 3000, 1, 2560, 6144, 6144, 6144, 2560]
    - [22, 22337.0]
  - - [1024, 24000, 1, 2816, 1024, 1024, 1024, 2816]
    - [3, 22767.0]
  - - [2048, 7000, 1, 2048, 2048, 2048, 2048, 2048]
    - [10, 22649.0]
  - - [7680, 3000, 1, 2560, 7680, 7680, 7680, 2560]
    - [3, 22397.0]
  - - [5124, 700, 1, 2048, 5124, 5124, 5124, 2048]
    - [3, 18823.0]
  - - [5124, 9124, 1, 4096, 5124, 5124, 5124, 4096]
    - [33, 19906.0]
  - - [256, 193600, 1, 64, 256, 256, 256, 64]
    - [9, 17630.0]
  - - [8448, 6000, 1, 2816, 8448, 8448, 8448, 2816]
    - [3, 22999.0]
  - - [5124, 1500, 1, 2560, 5124, 5124, 5124, 2560]
    - [22, 21326.0]
  - - [1024, 1500, 1, 2560, 1024, 1024, 1024, 2560]
    - [10, 19803.0]
  - - [1024, 6000, 1, 2560, 1024, 1024, 1024, 2560]
    - [10, 22282.0]
  - - [196, 1024, 64, 256, 196, 196, 196, 256]
    - [16, 15920.0]
  - - [512, 50176, 1, 128, 512, 512, 512, 128]
    - [14, 21264.0]
  - - [7680, 24000, 1, 2560, 7680, 7680, 7680, 2560]
    - [5, 22934.0]
  - - [512, 3000, 1, 2560, 512, 512, 512, 2560]
    - [10, 19204.0]
  - - [8448, 24000, 1, 2816, 8448, 8448, 8448, 2816]
    - [22, 22761.0]
  - - [512, 6000, 1, 1536, 512, 512, 512, 1536]
    - [16, 20309.0]
  - - [3072, 6000, 1, 1024, 3072, 3072, 3072, 1024]
    - [16, 22512.0]
  - - [3072, 1500, 1, 128, 3072, 3072, 3072, 128]
    - [22, 17096.0]
  - - [2048, 3136, 1, 512, 2048, 2048, 2048, 512]
    - [3, 21071.0]
  - - [1024, 3000, 1, 1536, 1024, 1024, 1024, 1536]
    - [16, 20612.0]
  - - [512, 6000, 1, 2816, 512, 512, 512, 2816]
    - [5, 20814.0]
  - - [128, 50176, 1, 512, 128, 128, 128, 512]
    - [10, 21462.0]
  - - [256, 12544, 1, 1024, 256, 256, 256, 1024]
    - [10, 21311.0]
  - - [1024, 12544, 1, 256, 1024, 1024, 1024, 256]
    - [3, 21535.0]
  - - [512, 48000, 1, 2560, 512, 512, 512, 2560]
    - [10, 22749.0]
  - - [512, 24000, 1, 1536, 512, 512, 512, 1536]
    - [22, 22388.0]
  - - [1024, 24000, 1, 2048, 1024, 1024, 1024, 2048]
    - [10, 22605.0]
  - - [5124, 1500, 1, 2048, 5124, 5124, 5124, 2048]
    - [3, 21171.0]
  - - [3072, 1500, 1, 1024, 3072, 3072, 3072, 1024]
    - [22, 20707.0]
  - - [6144, 1500, 1, 2560, 6144, 6144, 6144, 2560]
    - [16, 21977.0]
  - - [1024, 48000, 1, 2816, 1024, 1024, 1024, 2816]
    - [10, 22942.0]
  - - [1024, 6000, 1, 1536, 1024, 1024, 1024, 1536]
    - [16, 21884.0]
  - - [512, 3000, 1, 2048, 512, 512, 512, 2048]
    - [10, 19413.0]
  - - [6144, 24000, 1, 2560, 6144, 6144, 6144, 2560]
    - [11, 22415.0]
  - - [4608, 6000, 1, 1536, 4608, 4608, 4608, 1536]
    - [33, 22850.0]
  - - [3072, 3000, 1, 1024, 3072, 3072, 3072, 1024]
    - [3, 21901.0]
  - - [1024, 48000, 1, 2048, 1024, 1024, 1024, 2048]
    - [10, 22461.0]
  - - [784, 512, 64, 128, 784, 784, 784, 128]
    - [14, 18154.0]
  - - [3136, 256, 64, 64, 3136, 3136, 3136, 64]
    - [0, 17334.0]
  - - [12544, 1024, 1, 256, 12544, 12544, 12544, 256]
    - [10, 21557.0]
  - - [784, 128, 128, 512, 784, 784, 784, 512]
    - [16, 18858.0]
  - - [784, 512, 256, 128, 784, 784, 784, 128]
    - [16, 18694.0]
  - - [3136, 512, 1, 2048, 3136, 3136, 3136, 2048]
    - [3, 20266.0]
  - - [12544, 256, 1, 1024, 12544, 12544, 12544, 1024]
    - [3, 21467.0]
  - - [3136, 2048, 1, 512, 3136, 3136, 3136, 512]
    - [10, 20812.0]
  - - [3136, 256, 256, 64, 3136, 3136, 3136, 64]
    - [7, 12561.0]
  - - [784, 128, 64, 512, 784, 784, 784, 512]
    - [10, 18625.0]
  - - [784, 512, 128, 128, 784, 784, 784, 128]
    - [16, 18443.0]
  - - [784, 128, 256, 512, 784, 784, 784, 512]
    - [3, 19185.0]
  - - [3136, 256, 128, 64, 3136, 3136, 3136, 64]
    - [0, 17722.0]
  - - [128, 128, 512, 64, 128, 128, 128, 64]
    - [25, 16368.0]
  - - [512, 512, 64, 64, 512, 512, 512, 64]
    - [33, 19085.0]
  - - [1024, 2048, 1, 2, 1024, 1024, 1024, 2]
    - [19, 738.0]
  - - [1024, 2048, 1, 1024, 1024, 1024, 1024, 1024]
    - [10, 19767.0]
  - - [1024, 2048, 1, 4096, 1024, 1024, 1024, 4096]
    - [10, 20048.0]
  - - [1024, 2048, 1, 30528, 1024, 1024, 1024, 30528]
    - [3, 20366.0]
  - - [1024, 4096, 1, 1024, 1024, 1024, 1024, 1024]
    - [10, 21663.0]
  - - [1024, 4096, 1, 4096, 1024, 1024, 1024, 4096]
    - [3, 21937.0]
  - - [1024, 4096, 1, 30528, 1024, 1024, 1024, 30528]
    - [33, 22313.0]
  - - [4096, 2048, 1, 1024, 4096, 4096, 4096, 1024]
    - [3, 22271.0]
  - - [4096, 4096, 1, 1024, 4096, 4096, 4096, 1024]
    - [3, 22615.0]
  - - [256, 8976, 1, 1536, 256, 256, 256, 1536]
    - [22, 19120.0]
  - - [256, 8976, 1, 2048, 256, 256, 256, 2048]
    - [22, 18921.0]
  - - [256, 8976, 1, 2304, 256, 256, 256, 2304]
    - [28, 19073.0]
  - - [256, 8976, 1, 2560, 256, 256, 256, 2560]
    - [10, 18980.0]
  - - [256, 8976, 1, 2816, 256, 256, 256, 2816]
    - [5, 19377.0]
  - - [256, 8976, 1, 3072, 256, 256, 256, 3072]
    - [22, 19133.0]
  - - [256, 8976, 1, 4352, 256, 256, 256, 4352]
    - [10, 19405.0]
  - - [256, 8976, 1, 4864, 256, 256, 256, 4864]
    - [16, 19517.0]
  - - [256, 8976, 1, 5376, 256, 256, 256, 5376]
    - [33, 19562.0]
  - - [256, 8976, 1, 5632, 256, 256, 256, 5632]
    - [22, 19484.0]
  - - [256, 8976, 1, 5888, 256, 256, 256, 5888]
    - [10, 19601.0]
  - - [256, 8976, 1, 6144, 256, 256, 256, 6144]
    - [10, 19576.0]
  - - [256, 8976, 1, 6656, 256, 256, 256, 6656]
    - [10, 19590.0]
  - - [256, 8976, 1, 7168, 256, 256, 256, 7168]
    - [33, 19592.0]
  - - [256, 8976, 1, 7424, 256, 256, 256, 7424]
    - [33, 19610.0]
  - - [256, 8976, 1, 8192, 256, 256, 256, 8192]
    - [22, 19498.0]
  - - [256, 8976, 1, 8448, 256, 256, 256, 8448]
    - [33, 19642.0]
  - - [256, 8976, 1, 8960, 256, 256, 256, 8960]
    - [28, 19619.0]
  - - [256, 8976, 1, 9472, 256, 256, 256, 9472]
    - [28, 19595.0]
  - - [256, 8976, 1, 9728, 256, 256, 256, 9728]
    - [22, 19658.0]
  - - [256, 8976, 1, 9984, 256, 256, 256, 9984]
    - [28, 19670.0]
  - - [256, 8976, 1, 10240, 256, 256, 256, 10240]
    - [10, 19481.0]
  - - [256, 8976, 1, 10496, 256, 256, 256, 10496]
    - [16, 19649.0]
  - - [256, 8976, 1, 11008, 256, 256, 256, 11008]
    - [16, 19648.0]
  - - [256, 8976, 1, 11520, 256, 256, 256, 11520]
    - [28, 19624.0]
  - - [256, 8976, 1, 12288, 256, 256, 256, 12288]
    - [10, 19463.0]
  - - [256, 8976, 1, 14336, 256, 256, 256, 14336]
    - [22, 19205.0]
  - - [256, 8976, 1, 14848, 256, 256, 256, 14848]
    - [22, 19712.0]
  - - [256, 8976, 1, 15104, 256, 256, 256, 15104]
    - [22, 19693.0]
  - - [256, 8976, 1, 15872, 256, 256, 256, 15872]
    - [22, 19633.0]
  - - [256, 8976, 1, 17152, 256, 256, 256, 17152]
    - [16, 19689.0]
  - - [256, 8976, 1, 19712, 256, 256, 256, 19712]
    - [22, 19695.0]
  - - [256, 8976, 1, 19968, 256, 256, 256, 19968]
    - [22, 19705.0]
  - - [256, 8976, 1, 20480, 256, 256, 256, 20480]
    - [22, 18912.0]
  - - [256, 8976, 1, 20992, 256, 256, 256, 20992]
    - [10, 19654.0]
  - - [256, 8976, 1, 22016, 256, 256, 256, 22016]
    - [10, 19559.0]
  - - [256, 8976, 1, 26112, 256, 256, 256, 26112]
    - [22, 19539.0]
  - - [256, 8976, 1, 33536, 256, 256, 256, 33536]
    - [10, 19700.0]
  - - [256, 8976, 1, 44505, 256, 256, 256, 44505]
    - [18, 19867.0]
  - - [256, 32768, 1, 128, 256, 256, 256, 128]
    - [1, 20351.0]
  - - [480, 32768, 1, 1024, 480, 480, 480, 1024]
    - [33, 21063.0]
  - - [512, 32768, 1, 256, 512, 512, 512, 256]
    - [28, 21837.0]
  - - [1024, 1600, 1, 1, 1024, 1024, 1024, 1]
    - [19, 353.0]
  - - [1024, 1600, 1, 1024, 1024, 1024, 1024, 1024]
    - [15, 17772.0]
  - - [1024, 1792, 1, 256, 1024, 1024, 1024, 256]
    - [3, 18152.0]
  - - [1024, 2048, 1, 256, 1024, 1024, 1024, 256]
    - [10, 18089.0]
  - - [1024, 2560, 1, 256, 1024, 1024, 1024, 256]
    - [10, 19890.0]
  - - [1024, 3072, 1, 256, 1024, 1024, 1024, 256]
    - [10, 19748.0]
  - - [1024, 3328, 1, 256, 1024, 1024, 1024, 256]
    - [10, 19694.0]
  - - [1024, 3840, 1, 256, 1024, 1024, 1024, 256]
    - [10, 20730.0]
  - - [1024, 4096, 1, 256, 1024, 1024, 1024, 256]
    - [10, 20641.0]
  - - [1024, 4608, 1, 256, 1024, 1024, 1024, 256]
    - [10, 20377.0]
  - - [1024, 4864, 1, 256, 1024, 1024, 1024, 256]
    - [22, 20278.0]
  - - [1024, 5120, 1, 256, 1024, 1024, 1024, 256]
    - [10, 21084.0]
  - - [1024, 5632, 1, 256, 1024, 1024, 1024, 256]
    - [10, 20936.0]
  - - [1024, 6144, 1, 256, 1024, 1024, 1024, 256]
    - [3, 20707.0]
  - - [1024, 6400, 1, 256, 1024, 1024, 1024, 256]
    - [10, 21361.0]
  - - [1024, 7168, 1, 256, 1024, 1024, 1024, 256]
    - [10, 21061.0]
  - - [1024, 7424, 1, 256, 1024, 1024, 1024, 256]
    - [10, 21053.0]
  - - [1024, 7680, 1, 256, 1024, 1024, 1024, 256]
    - [10, 21555.0]
  - - [1024, 7936, 1, 256, 1024, 1024, 1024, 256]
    - [3, 21478.0]
  - - [1024, 8192, 1, 256, 1024, 1024, 1024, 256]
    - [10, 21394.0]
  - - [1024, 8448, 1, 256, 1024, 1024, 1024, 256]
    - [3, 21294.0]
  - - [1024, 8704, 1, 256, 1024, 1024, 1024, 256]
    - [10, 21209.0]
  - - [1024, 8960, 1, 256, 1024, 1024, 1024, 256]
    - [3, 21716.0]
  - - [1024, 9728, 1, 256, 1024, 1024, 1024, 256]
    - [10, 21462.0]
  - - [1024, 9984, 1, 256, 1024, 1024, 1024, 256]
    - [10, 21379.0]
  - - [1024, 10240, 1, 256, 1024, 1024, 1024, 256]
    - [10, 21792.0]
  - - [1024, 10496, 1, 256, 1024, 1024, 1024, 256]
    - [3, 21775.0]
  - - [1024, 11008, 1, 256, 1024, 1024, 1024, 256]
    - [3, 21612.0]
  - - [1024, 11264, 1, 256, 1024, 1024, 1024, 256]
    - [3, 21528.0]
  - - [1024, 11520, 1, 256, 1024, 1024, 1024, 256]
    - [10, 21880.0]
  - - [1024, 12288, 1, 256, 1024, 1024, 1024, 256]
    - [10, 21686.0]
  - - [1024, 13312, 1, 256, 1024, 1024, 1024, 256]
    - [3, 21846.0]
  - - [1024, 13568, 1, 256, 1024, 1024, 1024, 256]
    - [3, 21778.0]
  - - [1024, 14336, 1, 256, 1024, 1024, 1024, 256]
    - [3, 21995.0]
  - - [1024, 14592, 1, 256, 1024, 1024, 1024, 256]
    - [10, 21941.0]
  - - [1024, 14848, 1, 256, 1024, 1024, 1024, 256]
    - [10, 21862.0]
  - - [1024, 15104, 1, 256, 1024, 1024, 1024, 256]
    - [10, 21791.0]
  - - [1024, 16128, 1, 256, 1024, 1024, 1024, 256]
    - [10, 21924.0]
  - - [1024, 17152, 1, 256, 1024, 1024, 1024, 256]
    - [3, 21993.0]
  - - [1024, 18944, 1, 256, 1024, 1024, 1024, 256]
    - [10, 21956.0]
  - - [1024, 19712, 1, 256, 1024, 1024, 1024, 256]
    - [10, 22087.0]
  - - [1024, 19968, 1, 256, 1024, 1024, 1024, 256]
    - [3, 22060.0]
  - - [1024, 20480, 1, 256, 1024, 1024, 1024, 256]
    - [3, 22212.0]
  - - [1024, 20992, 1, 256, 1024, 1024, 1024, 256]
    - [3, 22168.0]
  - - [1024, 21504, 1, 256, 1024, 1024, 1024, 256]
    - [3, 22062.0]
  - - [1024, 22016, 1, 256, 1024, 1024, 1024, 256]
    - [3, 22216.0]
  - - [1024, 23552, 1, 256, 1024, 1024, 1024, 256]
    - [10, 22178.0]
  - - [1024, 28672, 1, 256, 1024, 1024, 1024, 256]
    - [3, 22322.0]
  - - [1024, 32768, 1, 512, 1024, 1024, 1024, 512]
    - [3, 22596.0]
  - - [1024, 32768, 1, 1024, 1024, 1024, 1024, 1024]
    - [22, 22788.0]
  - - [1024, 33536, 1, 256, 1024, 1024, 1024, 256]
    - [16, 22344.0]
  - - [1024, 40448, 1, 256, 1024, 1024, 1024, 256]
    - [16, 22381.0]
  - - [2048, 960, 1, 2048, 2048, 2048, 2048, 2048]
    - [16, 18624.0]
  - - [2048, 1024, 1, 1, 2048, 2048, 2048, 1]
    - [4, 289.0]
  - - [2048, 1024, 1, 256, 2048, 2048, 2048, 256]
    - [10, 18199.0]
  - - [3200, 1024, 1, 2048, 3200, 3200, 3200, 2048]
    - [3, 22132.0]
  - - [4096, 1024, 1, 1, 4096, 4096, 4096, 1]
    - [7, 339.0]
  - - [1024, 3840, 1, 1024, 1024, 1024, 1024, 1024]
    - [3, 21620.0]
  - - [1024, 3840, 1, 4096, 1024, 1024, 1024, 4096]
    - [24, 22193.0]
  - - [1024, 3968, 1, 1024, 1024, 1024, 1024, 1024]
    - [16, 20682.0]
  - - [1024, 3968, 1, 4096, 1024, 1024, 1024, 4096]
    - [22, 21265.0]
  - - [1024, 3968, 1, 42720, 1024, 1024, 1024, 42720]
    - [3, 21719.0]
  - - [1024, 6528, 1, 1024, 1024, 1024, 1024, 1024]
    - [10, 21721.0]
  - - [1024, 6528, 1, 4096, 1024, 1024, 1024, 4096]
    - [3, 21943.0]
  - - [1024, 6528, 1, 42720, 1024, 1024, 1024, 42720]
    - [10, 22118.0]
  - - [1024, 7104, 1, 1024, 1024, 1024, 1024, 1024]
    - [16, 21577.0]
  - - [1024, 7104, 1, 4096, 1024, 1024, 1024, 4096]
    - [3, 21866.0]
  - - [1024, 7104, 1, 42720, 1024, 1024, 1024, 42720]
    - [14, 22019.0]
  - - [1024, 7200, 1, 1024, 1024, 1024, 1024, 1024]
    - [22, 21590.0]
  - - [1024, 7200, 1, 4096, 1024, 1024, 1024, 4096]
    - [3, 22102.0]
  - - [1024, 7200, 1, 42720, 1024, 1024, 1024, 42720]
    - [16, 22200.0]
  - - [1024, 8064, 1, 1024, 1024, 1024, 1024, 1024]
    - [10, 21888.0]
  - - [1024, 8064, 1, 4096, 1024, 1024, 1024, 4096]
    - [10, 22254.0]
  - - [1024, 8160, 1, 1024, 1024, 1024, 1024, 1024]
    - [16, 22099.0]
  - - [1024, 8160, 1, 4096, 1024, 1024, 1024, 4096]
    - [10, 22427.0]
  - - [1024, 9216, 1, 1024, 1024, 1024, 1024, 1024]
    - [22, 22419.0]
  - - [1024, 9216, 1, 4096, 1024, 1024, 1024, 4096]
    - [22, 22578.0]
  - - [1024, 9520, 1, 1024, 1024, 1024, 1024, 1024]
    - [16, 22279.0]
  - - [1024, 9520, 1, 4096, 1024, 1024, 1024, 4096]
    - [10, 22502.0]
  - - [1024, 9520, 1, 42720, 1024, 1024, 1024, 42720]
    - [14, 22446.0]
  - - [1024, 10064, 1, 1024, 1024, 1024, 1024, 1024]
    - [22, 22153.0]
  - - [1024, 10064, 1, 4096, 1024, 1024, 1024, 4096]
    - [22, 22344.0]
  - - [1024, 10080, 1, 1024, 1024, 1024, 1024, 1024]
    - [10, 22211.0]
  - - [1024, 10080, 1, 4096, 1024, 1024, 1024, 4096]
    - [22, 22382.0]
  - - [1024, 10080, 1, 42720, 1024, 1024, 1024, 42720]
    - [28, 22359.0]
  - - [1024, 10200, 1, 1024, 1024, 1024, 1024, 1024]
    - [22, 22382.0]
  - - [1024, 10200, 1, 4096, 1024, 1024, 1024, 4096]
    - [22, 22494.0]
  - - [4096, 3840, 1, 1024, 4096, 4096, 4096, 1024]
    - [3, 22717.0]
  - - [4096, 3968, 1, 1024, 4096, 4096, 4096, 1024]
    - [10, 22678.0]
  - - [4096, 6528, 1, 1024, 4096, 4096, 4096, 1024]
    - [3, 22835.0]
  - - [4096, 7104, 1, 1024, 4096, 4096, 4096, 1024]
    - [3, 22645.0]
  - - [4096, 7200, 1, 1024, 4096, 4096, 4096, 1024]
    - [3, 22531.0]
  - - [4096, 8064, 1, 1024, 4096, 4096, 4096, 1024]
    - [3, 22901.0]
  - - [4096, 8160, 1, 1024, 4096, 4096, 4096, 1024]
    - [3, 22765.0]
  - - [4096, 9216, 1, 1024, 4096, 4096, 4096, 1024]
    - [3, 22888.0]
  - - [4096, 9520, 1, 1024, 4096, 4096, 4096, 1024]
    - [3, 22684.0]
  - - [4096, 10064, 1, 1024, 4096, 4096, 4096, 1024]
    - [3, 22745.0]
  - - [4096, 10080, 1, 1024, 4096, 4096, 4096, 1024]
    - [3, 22792.0]
  - - [4096, 10200, 1, 1024, 4096, 4096, 4096, 1024]
    - [3, 22745.0]
  - - [1024, 3240, 1, 1024, 1024, 1024, 1024, 1024]
    - [16, 19859.0]
  - - [1024, 3240, 1, 4096, 1024, 1024, 1024, 4096]
    - [22, 20324.0]
  - - [1024, 3960, 1, 1024, 1024, 1024, 1024, 1024]
    - [22, 20331.0]
  - - [1024, 3960, 1, 4096, 1024, 1024, 1024, 4096]
    - [22, 21232.0]
  - - [1024, 3960, 1, 42720, 1024, 1024, 1024, 42720]
    - [33, 21657.0]
  - - [4096, 3240, 1, 1024, 4096, 4096, 4096, 1024]
    - [16, 21932.0]
  - - [4096, 3960, 1, 1024, 4096, 4096, 4096, 1024]
    - [3, 22536.0]
  - - [289, 128, 64, 768, 289, 289, 289, 768]
    - [28, 15443.0]
  - - [289, 160, 64, 768, 289, 289, 289, 768]
    - [2, 11289.0]
  - - [289, 192, 64, 768, 289, 289, 289, 768]
    - [15, 13294.0]
  - - [3136, 256, 32, 64, 3136, 3136, 3136, 64]
    - [26, 18838.0]
  - - [784, 512, 32, 128, 784, 784, 784, 128]
    - [14, 17969.0]
  - - [784, 128, 32, 512, 784, 784, 784, 512]
    - [16, 17517.0]
  - - [196, 1024, 32, 256, 196, 196, 196, 256]
    - [3, 15421.0]
  - - [3136, 128, 64, 64, 3136, 3136, 3136, 64]
    - [22, 18851.0]
  - - [3136, 256, 64, 128, 3136, 3136, 3136, 128]
    - [3, 20822.0]
  - - [784, 512, 64, 256, 784, 784, 784, 256]
    - [3, 19110.0]
  - - [3136, 128, 64, 256, 3136, 3136, 3136, 256]
    - [3, 20740.0]
  - - [3136, 256, 64, 256, 3136, 3136, 3136, 256]
    - [3, 21731.0]
  - - [196, 1024, 64, 512, 196, 196, 196, 512]
    - [10, 16544.0]
  - - [784, 256, 64, 512, 784, 784, 784, 512]
    - [16, 19300.0]
  - - [784, 512, 64, 512, 784, 784, 784, 512]
    - [16, 19603.0]
  - - [196, 512, 64, 1024, 196, 196, 196, 1024]
    - [22, 16628.0]
  - - [196, 1024, 64, 1024, 196, 196, 196, 1024]
    - [10, 16849.0]
  - - [3136, 128, 32, 64, 3136, 3136, 3136, 64]
    - [33, 17271.0]
  - - [3136, 256, 32, 128, 3136, 3136, 3136, 128]
    - [3, 20715.0]
  - - [784, 512, 32, 256, 784, 784, 784, 256]
    - [3, 18851.0]
  - - [3136, 128, 32, 256, 3136, 3136, 3136, 256]
    - [22, 21017.0]
  - - [3136, 256, 32, 256, 3136, 3136, 3136, 256]
    - [10, 21371.0]
  - - [196, 1024, 32, 512, 196, 196, 196, 512]
    - [3, 16321.0]
  - - [784, 256, 32, 512, 784, 784, 784, 512]
    - [3, 18726.0]
  - - [784, 512, 32, 512, 784, 784, 784, 512]
    - [16, 19374.0]
  - - [196, 512, 32, 1024, 196, 196, 196, 1024]
    - [33, 16342.0]
  - - [196, 1024, 32, 1024, 196, 196, 196, 1024]
    - [10, 16578.0]
  - - [7680, 8192, 1, 8192, 7680, 7680, 7680, 8192]
    - [33, 23011.0]
  - - [3840, 4096, 1, 4096, 3840, 3840, 3840, 4096]
    - [22, 21756.0]
  - - [1920, 2048, 1, 2048, 1920, 1920, 1920, 2048]
    - [33, 21363.0]
  - - [8192, 7680, 1, 8192, 8192, 8192, 8192, 8192]
    - [22, 22663.0]
  - - [4096, 3840, 1, 4096, 4096, 4096, 4096, 4096]
    - [16, 21676.0]
  - - [2048, 1920, 1, 2048, 2048, 2048, 2048, 2048]
    - [10, 21731.0]
  - - [8192, 8192, 1, 8192, 8192, 8192, 8192, 8192]
    - [5, 22647.0]
  - - [4096, 4096, 1, 4096, 4096, 4096, 4096, 4096]
    - [10, 21166.0]
  - - [2048, 2048, 1, 2048, 2048, 2048, 2048, 2048]
    - [10, 21335.0]
  - - [1024, 4096, 1, 2, 1024, 1024, 1024, 2]
    - [7, 536.0]
  - - [4096, 512, 1, 1024, 4096, 4096, 4096, 1024]
    - [3, 18974.0]
  - - [1024, 1280, 1, 2, 1024, 1024, 1024, 2]
    - [27, 394.0]
  - - [1024, 1280, 1, 1024, 1024, 1024, 1024, 1024]
    - [10, 19565.0]
  - - [1024, 1280, 1, 4096, 1024, 1024, 1024, 4096]
    - [24, 20988.0]
  - - [4096, 1024, 1, 1024, 4096, 4096, 4096, 1024]
    - [3, 21334.0]
  - - [4096, 1280, 1, 1024, 4096, 4096, 4096, 1024]
    - [3, 21687.0]
  - - [1024, 4992, 1, 2, 1024, 1024, 1024, 2]
    - [21, 748.0]
  - - [1024, 4992, 1, 1024, 1024, 1024, 1024, 1024]
    - [3, 21177.0]
  - - [1024, 4992, 1, 4096, 1024, 1024, 1024, 4096]
    - [10, 21797.0]
  - - [4096, 4992, 1, 1024, 4096, 4096, 4096, 1024]
    - [3, 22629.0]
  - - [1024, 5120, 1, 2, 1024, 1024, 1024, 2]
    - [7, 656.0]
  - - [1024, 5120, 1, 1024, 1024, 1024, 1024, 1024]
    - [10, 22106.0]
  - - [1024, 5120, 1, 4096, 1024, 1024, 1024, 4096]
    - [22, 22446.0]
  - - [4096, 5120, 1, 1024, 4096, 4096, 4096, 1024]
    - [22, 22859.0]
  - - [1024, 5248, 1, 2, 1024, 1024, 1024, 2]
    - [19, 640.0]
  - - [1024, 5248, 1, 1024, 1024, 1024, 1024, 1024]
    - [22, 21556.0]
  - - [1024, 5248, 1, 4096, 1024, 1024, 1024, 4096]
    - [22, 21884.0]
  - - [4096, 5248, 1, 1024, 4096, 4096, 4096, 1024]
    - [3, 22754.0]
  - - [1024, 2560, 1, 2, 1024, 1024, 1024, 2]
    - [15, 561.0]
  - - [1024, 2560, 1, 1024, 1024, 1024, 1024, 1024]
    - [10, 21400.0]
  - - [1024, 2560, 1, 4096, 1024, 1024, 1024, 4096]
    - [24, 21693.0]
  - - [4096, 2560, 1, 1024, 4096, 4096, 4096, 1024]
    - [3, 22677.0]
  - - [1024, 3072, 1, 2, 1024, 1024, 1024, 2]
    - [1, 704.0]
  - - [1024, 3072, 1, 1024, 1024, 1024, 1024, 1024]
    - [10, 20977.0]
  - - [1024, 3072, 1, 4096, 1024, 1024, 1024, 4096]
    - [10, 21195.0]
  - - [4096, 3072, 1, 1024, 4096, 4096, 4096, 1024]
    - [10, 22478.0]
  - - [1024, 1152, 1, 2, 1024, 1024, 1024, 2]
    - [32, 641.0]
  - - [1024, 1152, 1, 1024, 1024, 1024, 1024, 1024]
    - [10, 18578.0]
  - - [1024, 1152, 1, 4096, 1024, 1024, 1024, 4096]
    - [35, 18953.0]
  - - [4096, 1152, 1, 1024, 4096, 4096, 4096, 1024]
    - [3, 21015.0]
  - - [479, 32768, 1, 1024, 479, 479, 479, 1024]
    - [33, 20851.0]
  - - [1024, 8192, 1, 1024, 1024, 1024, 1024, 1024]
    - [16, 22184.0]
  - - [1024, 8192, 1, 4096, 1024, 1024, 1024, 4096]
    - [10, 22555.0]
  - - [1024, 8192, 1, 33712, 1024, 1024, 1024, 33712]
    - [30, 22473.0]
  - - [1024, 9600, 1, 1024, 1024, 1024, 1024, 1024]
    - [10, 22491.0]
  - - [1024, 9600, 1, 4096, 1024, 1024, 1024, 4096]
    - [10, 22803.0]
  - - [1024, 9600, 1, 33712, 1024, 1024, 1024, 33712]
    - [28, 22723.0]
  - - [4096, 8192, 1, 1024, 4096, 4096, 4096, 1024]
    - [3, 22871.0]
  - - [4096, 9600, 1, 1024, 4096, 4096, 4096, 1024]
    - [3, 22906.0]
  - - [1024, 1024, 64, 64, 1024, 1024, 1024, 64]
    - [2, 17851.0]
  - - [1024, 16384, 1, 3072, 1024, 1024, 1024, 3072]
    - [10, 22754.0]
  - - [1024, 2048, 1, 30592, 1024, 1024, 1024, 30592]
    - [16, 20420.0]
  - - [640, 2048, 1, 2560, 640, 640, 640, 2560]
    - [5, 21229.0]
  - - [1024, 1024, 64, 96, 1024, 1024, 1024, 96]
    - [3, 20809.0]
  - - [1536, 4096, 1, 4608, 1536, 1536, 1536, 4608]
    - [10, 21983.0]
  - - [512, 512, 256, 64, 512, 512, 512, 64]
    - [9, 16134.0]
  - - [2048, 1024, 1, 8192, 2048, 2048, 2048, 8192]
    - [10, 20121.0]
  - - [4096, 16384, 1, 1024, 4096, 4096, 4096, 1024]
    - [3, 22941.0]
  - - [1024, 8192, 1, 50304, 1024, 1024, 1024, 50304]
    - [5, 22353.0]
  - - [1536, 8192, 1, 50304, 1536, 1536, 1536, 50304]
    - [33, 22162.0]
  - - [6144, 8192, 1, 1536, 6144, 6144, 6144, 1536]
    - [10, 22998.0]
  - - [1024, 4096, 1, 30592, 1024, 1024, 1024, 30592]
    - [22, 22339.0]
  - - [1536, 4096, 1, 6144, 1536, 1536, 1536, 6144]
    - [3, 21906.0]
  - - [1024, 16384, 1, 4096, 1024, 1024, 1024, 4096]
    - [22, 22253.0]
  - - [1024, 16384, 1, 50304, 1024, 1024, 1024, 50304]
    - [22, 22384.0]
  - - [1024, 4096, 1, 3072, 1024, 1024, 1024, 3072]
    - [3, 21948.0]
  - - [1536, 8192, 1, 1536, 1536, 1536, 1536, 1536]
    - [22, 22589.0]
  - - [1024, 2048, 1, 3072, 1024, 1024, 1024, 3072]
    - [10, 20033.0]
  - - [2560, 2048, 1, 7680, 2560, 2560, 2560, 7680]
    - [5, 22563.0]
  - - [2048, 1024, 1, 2048, 2048, 2048, 2048, 2048]
    - [3, 19574.0]
  - - [2048, 1024, 1, 30592, 2048, 2048, 2048, 30592]
    - [10, 20311.0]
  - - [8192, 1024, 1, 2048, 8192, 8192, 8192, 2048]
    - [3, 22454.0]
  - - [2560, 2048, 1, 2560, 2560, 2560, 2560, 2560]
    - [5, 22587.0]
  - - [1536, 8192, 1, 4608, 1536, 1536, 1536, 4608]
    - [22, 22646.0]
  - - [1024, 2048, 1, 50304, 1024, 1024, 1024, 50304]
    - [3, 20349.0]
  - - [1024, 1024, 32, 64, 1024, 1024, 1024, 64]
    - [22, 19368.0]
  - - [1536, 8192, 1, 6144, 1536, 1536, 1536, 6144]
    - [10, 22626.0]
  - - [1024, 1024, 256, 64, 1024, 1024, 1024, 64]
    - [12, 17252.0]
  - - [512, 512, 40, 64, 512, 512, 512, 64]
    - [14, 17605.0]
  - - [1536, 4096, 1, 50304, 1536, 1536, 1536, 50304]
    - [5, 21938.0]
  - - [1024, 1024, 128, 96, 1024, 1024, 1024, 96]
    - [10, 21110.0]
  - - [1024, 8192, 1, 3072, 1024, 1024, 1024, 3072]
    - [3, 22502.0]
  - - [1024, 1024, 128, 64, 1024, 1024, 1024, 64]
    - [15, 17230.0]
  - - [1024, 4096, 1, 50304, 1024, 1024, 1024, 50304]
    - [10, 22017.0]
  - - [6144, 4096, 1, 1536, 6144, 6144, 6144, 1536]
    - [3, 22889.0]
  - - [1024, 16384, 1, 1024, 1024, 1024, 1024, 1024]
    - [3, 22537.0]
  - - [2560, 2048, 1, 1920, 2560, 2560, 2560, 1920]
    - [5, 22545.0]
  - - [2048, 1024, 1, 6144, 2048, 2048, 2048, 6144]
    - [3, 20085.0]
  - - [512, 512, 128, 64, 512, 512, 512, 64]
    - [29, 18399.0]
  - - [1024, 8192, 1, 30592, 1024, 1024, 1024, 30592]
    - [3, 22590.0]
  - - [1536, 4096, 1, 1536, 1536, 1536, 1536, 1536]
    - [3, 21673.0]
  - - [128, 128, 1024, 64, 128, 128, 128, 64]
    - [36, 15450.0]
  - - [1024, 8192, 1, 30528, 1024, 1024, 1024, 30528]
    - [30, 22435.0]
  - - [1024, 3456, 1, 1024, 1024, 1024, 1024, 1024]
    - [22, 21284.0]
  - - [1024, 3456, 1, 512, 1024, 1024, 1024, 512]
    - [3, 21059.0]
  - - [1024, 4096, 1, 512, 1024, 1024, 1024, 512]
    - [3, 20701.0]
  - - [1024, 6912, 1, 1024, 1024, 1024, 1024, 1024]
    - [3, 21642.0]
  - - [1024, 6912, 1, 512, 1024, 1024, 1024, 512]
    - [16, 21635.0]
  - - [256, 55296, 1, 128, 256, 256, 256, 128]
    - [3, 20732.0]
  - - [256, 6912, 1, 128, 256, 256, 256, 128]
    - [1, 15928.0]
  - - [480, 3456, 1, 1024, 480, 480, 480, 1024]
    - [10, 17728.0]
  - - [480, 4096, 1, 1024, 480, 480, 480, 1024]
    - [33, 17464.0]
  - - [480, 6912, 1, 1024, 480, 480, 480, 1024]
    - [22, 19405.0]
  - - [512, 3456, 1, 256, 512, 512, 512, 256]
    - [10, 15599.0]
  - - [512, 4096, 1, 256, 512, 512, 512, 256]
    - [10, 16220.0]
  - - [512, 55296, 1, 256, 512, 512, 512, 256]
    - [3, 22117.0]
  - - [512, 6912, 1, 256, 512, 512, 512, 256]
    - [3, 19991.0]
  - - [1024, 1280, 1, 30528, 1024, 1024, 1024, 30528]
    - [24, 21778.0]
  - - [1024, 1600, 1, 30528, 1024, 1024, 1024, 30528]
    - [18, 18450.0]
  - - [1024, 10240, 1, 1024, 1024, 1024, 1024, 1024]
    - [22, 22512.0]
  - - [1024, 10240, 1, 4096, 1024, 1024, 1024, 4096]
    - [10, 22726.0]
  - - [4096, 10240, 1, 1024, 4096, 4096, 4096, 1024]
    - [3, 22871.0]
  - - [128, 128, 1280, 64, 128, 128, 128, 64]
    - [22, 18631.0]
  - - [1024, 1640, 1, 30528, 1024, 1024, 1024, 30528]
    - [3, 18997.0]
  - - [1024, 10496, 1, 1024, 1024, 1024, 1024, 1024]
    - [16, 22539.0]
  - - [1024, 10496, 1, 4096, 1024, 1024, 1024, 4096]
    - [22, 22698.0]
  - - [4096, 10496, 1, 1024, 4096, 4096, 4096, 1024]
    - [3, 22887.0]
  - - [128, 128, 1312, 64, 128, 128, 128, 64]
    - [10, 18506.0]
  - - [1024, 6144, 1, 4096, 1024, 1024, 1024, 4096]
    - [10, 21887.0]
  - - [4096, 6144, 1, 1024, 4096, 4096, 4096, 1024]
    - [3, 22872.0]
  - - [1024, 6144, 1, 1024, 1024, 1024, 1024, 1024]
    - [3, 21590.0]
  - - [512, 512, 192, 64, 512, 512, 512, 64]
    - [21, 17651.0]
  - - [256, 6912, 1, 1, 256, 256, 256, 1]
    - [9, 330.0]
  - - [1024, 10224, 1, 1024, 1024, 1024, 1024, 1024]
    - [16, 22406.0]
  - - [1024, 10192, 1, 1024, 1024, 1024, 1024, 1024]
    - [22, 22408.0]
  - - [1024, 10208, 1, 1024, 1024, 1024, 1024, 1024]
    - [16, 22423.0]
  - - [1024, 10224, 1, 4096, 1024, 1024, 1024, 4096]
    - [33, 22700.0]
  - - [1024, 10224, 1, 3072, 1024, 1024, 1024, 3072]
    - [10, 22706.0]
  - - [4096, 10224, 1, 1024, 4096, 4096, 4096, 1024]
    - [3, 22739.0]
  - - [1024, 10240, 1, 3072, 1024, 1024, 1024, 3072]
    - [10, 22797.0]
  - - [1024, 10192, 1, 3072, 1024, 1024, 1024, 3072]
    - [10, 22665.0]
  - - [4096, 10192, 1, 1024, 4096, 4096, 4096, 1024]
    - [3, 22752.0]
  - - [1024, 10192, 1, 4096, 1024, 1024, 1024, 4096]
    - [22, 22494.0]
  - - [1024, 10200, 1, 3072, 1024, 1024, 1024, 3072]
    - [22, 22648.0]
  - - [1024, 10184, 1, 1024, 1024, 1024, 1024, 1024]
    - [16, 22349.0]
  - - [4096, 10208, 1, 1024, 4096, 4096, 4096, 1024]
    - [3, 22767.0]
  - - [1024, 10208, 1, 3072, 1024, 1024, 1024, 3072]
    - [22, 22704.0]
  - - [1024, 10208, 1, 4096, 1024, 1024, 1024, 4096]
    - [22, 22571.0]
  - - [1024, 10224, 1, 2048, 1024, 1024, 1024, 2048]
    - [10, 22647.0]
  - - [1024, 10240, 1, 2048, 1024, 1024, 1024, 2048]
    - [10, 22777.0]
  - - [1024, 10120, 1, 1024, 1024, 1024, 1024, 1024]
    - [16, 22300.0]
  - - [1024, 10192, 1, 2048, 1024, 1024, 1024, 2048]
    - [22, 22631.0]
  - - [1024, 10152, 1, 1024, 1024, 1024, 1024, 1024]
    - [10, 22315.0]
  - - [1024, 10080, 1, 3072, 1024, 1024, 1024, 3072]
    - [10, 22507.0]
  - - [100352, 512, 1, 256, 100352, 100352, 100352, 256]
    - [3, 22371.0]
  - - [12544, 2048, 1, 1024, 12544, 12544, 12544, 1024]
    - [3, 22812.0]
  - - [200704, 512, 1, 256, 200704, 200704, 200704, 256]
    - [28, 22448.0]
  - - [25088, 1024, 1, 512, 25088, 25088, 25088, 512]
    - [10, 22606.0]
  - - [50176, 1024, 1, 512, 50176, 50176, 50176, 512]
    - [10, 22810.0]
  - - [6272, 2048, 1, 1024, 6272, 6272, 6272, 1024]
    - [16, 22379.0]
  - - [3136, 128, 128, 256, 3136, 3136, 3136, 256]
    - [3, 21113.0]
  - - [3136, 128, 256, 256, 3136, 3136, 3136, 256]
    - [3, 21344.0]
  - - [784, 256, 128, 512, 784, 784, 784, 512]
    - [3, 19588.0]
  - - [784, 256, 256, 512, 784, 784, 784, 512]
    - [3, 19739.0]
  - - [128, 128, 2048, 64, 128, 128, 128, 64]
    - [0, 15361.0]
  - - [1024, 2560, 1, 30528, 1024, 1024, 1024, 30528]
    - [18, 22507.0]
  - - [128, 128, 1536, 64, 128, 128, 128, 64]
    - [17, 17880.0]
  - - [1024, 12288, 1, 4096, 1024, 1024, 1024, 4096]
    - [22, 22675.0]
  - - [1024, 12288, 1, 1024, 1024, 1024, 1024, 1024]
    - [10, 22478.0]
  - - [4096, 12288, 1, 1024, 4096, 4096, 4096, 1024]
    - [3, 22948.0]
  - - [1024, 1920, 1, 30528, 1024, 1024, 1024, 30528]
    - [22, 21951.0]
  - - [128, 128, 192, 64, 128, 128, 128, 64]
    - [25, 13827.0]
  - - [768, 2048, 1, 2, 768, 768, 768, 2]
    - [0, 705.0]
  - - [3072, 2048, 1, 768, 3072, 3072, 3072, 768]
    - [16, 21550.0]
  - - [768, 2048, 1, 3072, 768, 768, 768, 3072]
    - [10, 20363.0]
  - - [768, 2048, 1, 768, 768, 768, 768, 768]
    - [28, 18857.0]
  - - [384, 384, 144, 64, 384, 384, 384, 64]
    - [33, 19298.0]
  - - [768, 4608, 1, 2, 768, 768, 768, 2]
    - [9, 889.0]
  - - [3072, 4608, 1, 768, 3072, 3072, 3072, 768]
    - [22, 22422.0]
  - - [768, 4608, 1, 3072, 768, 768, 768, 3072]
    - [22, 21878.0]
  - - [768, 4608, 1, 768, 768, 768, 768, 768]
    - [16, 20920.0]
  - - [512, 512, 48, 64, 512, 512, 512, 64]
    - [23, 17575.0]
  - - [128, 128, 256, 64, 128, 128, 128, 64]
    - [19, 11732.0]
  - - [384, 384, 192, 64, 384, 384, 384, 64]
    - [26, 19695.0]
  - - [1024, 4608, 1, 2, 1024, 1024, 1024, 2]
    - [19, 867.0]
  - - [4096, 4608, 1, 1024, 4096, 4096, 4096, 1024]
    - [3, 22777.0]
  - - [1024, 4608, 1, 4096, 1024, 1024, 1024, 4096]
    - [10, 21749.0]
  - - [1024, 4608, 1, 1024, 1024, 1024, 1024, 1024]
    - [22, 20923.0]
  - - [8192, 1024, 1, 1024, 8192, 8192, 8192, 1024]
    - [10, 22262.0]
  - - [8192, 4096, 1, 1024, 8192, 8192, 8192, 1024]
    - [3, 22887.0]
  - - [196, 1024, 128, 256, 196, 196, 196, 256]
    - [16, 15800.0]
  - - [196, 1024, 256, 256, 196, 196, 196, 256]
    - [3, 16076.0]
  - - [196, 256, 128, 1024, 196, 196, 196, 1024]
    - [22, 16113.0]
  - - [196, 256, 256, 1024, 196, 196, 196, 1024]
    - [33, 16451.0]
  - - [196, 512, 128, 1024, 196, 196, 196, 1024]
    - [33, 16671.0]
  - - [196, 512, 256, 1024, 196, 196, 196, 1024]
    - [22, 17024.0]
  - - [3072, 256, 2, 1024, 3072, 3072, 3072, 1024]
    - [16, 19671.0]
  - - [768, 2048, 2, 512, 768, 768, 768, 512]
    - [10, 20460.0]
  - - [2904, 256, 2, 1024, 2904, 2904, 2904, 1024]
    - [10, 18769.0]
  - - [864, 2048, 2, 512, 864, 864, 864, 512]
    - [3, 19243.0]
  - - [2992, 256, 2, 1024, 2992, 2992, 2992, 1024]
    - [3, 18211.0]
  - - [3400, 256, 2, 1024, 3400, 3400, 3400, 1024]
    - [3, 17797.0]
  - - [4032, 256, 2, 1024, 4032, 4032, 4032, 1024]
    - [10, 18566.0]
  - - [15200, 128, 2, 512, 15200, 15200, 15200, 512]
    - [10, 20603.0]
  - - [12288, 128, 2, 512, 12288, 12288, 12288, 512]
    - [3, 20554.0]
  - - [888, 2048, 2, 512, 888, 888, 888, 512]
    - [3, 19744.0]
  - - [13600, 128, 2, 512, 13600, 13600, 13600, 512]
    - [10, 19908.0]
  - - [12880, 128, 2, 512, 12880, 12880, 12880, 512]
    - [16, 18479.0]
  - - [3456, 256, 2, 1024, 3456, 3456, 3456, 1024]
    - [28, 18546.0]
  - - [2944, 256, 2, 1024, 2944, 2944, 2944, 1024]
    - [28, 18441.0]
  - - [2688, 256, 2, 1024, 2688, 2688, 2688, 1024]
    - [33, 17229.0]
  - - [13824, 128, 2, 512, 13824, 13824, 13824, 512]
    - [22, 21118.0]
  - - [3168, 256, 2, 1024, 3168, 3168, 3168, 1024]
    - [3, 19849.0]
  - - [3360, 256, 2, 1024, 3360, 3360, 3360, 1024]
    - [3, 17719.0]
  - - [3552, 256, 2, 1024, 3552, 3552, 3552, 1024]
    - [16, 18868.0]
  - - [11616, 128, 2, 512, 11616, 11616, 11616, 512]
    - [3, 17895.0]
  - - [4200, 256, 2, 1024, 4200, 4200, 4200, 1024]
    - [28, 18944.0]
  - - [840, 2048, 2, 512, 840, 840, 840, 512]
    - [3, 18142.0]
  - - [14208, 128, 2, 512, 14208, 14208, 14208, 512]
    - [3, 19488.0]
  - - [11968, 128, 2, 512, 11968, 11968, 11968, 512]
    - [33, 18399.0]
  - - [3264, 256, 2, 1024, 3264, 3264, 3264, 1024]
    - [16, 16940.0]
  - - [13600, 256, 2, 512, 13600, 13600, 13600, 512]
    - [16, 20497.0]
  - - [12880, 256, 2, 512, 12880, 12880, 12880, 512]
    - [16, 20259.0]
  - - [12288, 256, 2, 512, 12288, 12288, 12288, 512]
    - [28, 20796.0]
  - - [2816, 256, 2, 1024, 2816, 2816, 2816, 1024]
    - [28, 17622.0]
  - - [672, 2048, 2, 512, 672, 672, 672, 512]
    - [22, 17012.0]
  - - [13440, 128, 2, 512, 13440, 13440, 13440, 512]
    - [16, 20239.0]
  - - [13824, 256, 2, 512, 13824, 13824, 13824, 512]
    - [28, 21781.0]
  - - [15200, 256, 2, 512, 15200, 15200, 15200, 512]
    - [28, 21566.0]
  - - [3600, 256, 2, 1024, 3600, 3600, 3600, 1024]
    - [3, 19366.0]
  - - [4032, 1024, 2, 256, 4032, 4032, 4032, 256]
    - [3, 20156.0]
  - - [16128, 128, 2, 512, 16128, 16128, 16128, 512]
    - [22, 20417.0]
  - - [15200, 128, 1, 512, 15200, 15200, 15200, 512]
    - [3, 17731.0]
  - - [13600, 128, 1, 512, 13600, 13600, 13600, 512]
    - [33, 16970.0]
  - - [2904, 1024, 2, 256, 2904, 2904, 2904, 256]
    - [10, 19535.0]
  - - [2992, 1024, 2, 256, 2992, 2992, 2992, 256]
    - [3, 19357.0]
  - - [1536, 2048, 1, 1024, 1536, 1536, 1536, 1024]
    - [3, 20774.0]
  - - [24576, 128, 1, 256, 24576, 24576, 24576, 256]
    - [3, 18138.0]
  - - [24576, 512, 1, 256, 24576, 24576, 24576, 256]
    - [3, 21613.0]
  - - [25760, 128, 1, 256, 25760, 25760, 25760, 256]
    - [10, 17914.0]
  - - [25760, 512, 1, 256, 25760, 25760, 25760, 256]
    - [16, 21155.0]
  - - [6144, 256, 1, 512, 6144, 6144, 6144, 512]
    - [3, 19293.0]
  - - [6440, 256, 1, 512, 6440, 6440, 6440, 512]
    - [3, 16233.0]
  - - [13600, 512, 1, 128, 13600, 13600, 13600, 128]
    - [20, 17313.0]
  - - [9408, 512, 2, 128, 9408, 9408, 9408, 128]
    - [11, 18510.0]
  - - [56000, 256, 2, 64, 56000, 56000, 56000, 64]
    - [29, 16111.0]
  - - [2816, 1024, 2, 256, 2816, 2816, 2816, 256]
    - [3, 20065.0]
  - - [60800, 256, 1, 64, 60800, 60800, 60800, 64]
    - [8, 18675.0]
  - - [2944, 1024, 2, 256, 2944, 2944, 2944, 256]
    - [3, 19947.0]
  - - [11776, 512, 2, 128, 11776, 11776, 11776, 128]
    - [28, 19824.0]
  - - [11616, 512, 2, 128, 11616, 11616, 11616, 128]
    - [22, 18764.0]
  - - [4200, 1024, 2, 256, 4200, 4200, 4200, 256]
    - [33, 19820.0]
  - - [54400, 256, 1, 64, 54400, 54400, 54400, 64]
    - [14, 18646.0]
  - - [15200, 512, 1, 128, 15200, 15200, 15200, 128]
    - [10, 18509.0]
  - - [2688, 1024, 2, 256, 2688, 2688, 2688, 256]
    - [3, 20150.0]
  - - [12672, 512, 2, 128, 12672, 12672, 12672, 128]
    - [33, 19997.0]
  - - [11968, 512, 2, 128, 11968, 11968, 11968, 128]
    - [3, 19419.0]
  - - [46464, 256, 2, 64, 46464, 46464, 46464, 64]
    - [26, 18947.0]
  - - [2400, 256, 2, 1024, 2400, 2400, 2400, 1024]
    - [24, 17737.0]
  - - [2520, 256, 2, 1024, 2520, 2520, 2520, 1024]
    - [10, 19282.0]
  - - [2400, 1024, 2, 256, 2400, 2400, 2400, 256]
    - [3, 18658.0]
  - - [10752, 128, 2, 512, 10752, 10752, 10752, 512]
    - [33, 19179.0]
  - - [45632, 256, 2, 64, 45632, 45632, 45632, 64]
    - [22, 17814.0]
  - - [2520, 1024, 2, 256, 2520, 2520, 2520, 256]
    - [33, 19407.0]
  - - [53760, 256, 2, 64, 53760, 53760, 53760, 64]
    - [34, 16965.0]
  - - [2352, 256, 2, 1024, 2352, 2352, 2352, 1024]
    - [35, 17309.0]
  - - [47872, 256, 2, 64, 47872, 47872, 47872, 64]
    - [22, 19276.0]
  - - [47104, 256, 2, 64, 47104, 47104, 47104, 64]
    - [23, 18732.0]
  - - [50688, 256, 2, 64, 50688, 50688, 50688, 64]
    - [22, 19202.0]
  - - [45056, 256, 2, 64, 45056, 45056, 45056, 64]
    - [16, 18899.0]
  - - [13440, 512, 2, 128, 13440, 13440, 13440, 128]
    - [16, 20137.0]
  - - [2352, 1024, 2, 256, 2352, 2352, 2352, 256]
    - [3, 18150.0]
  - - [11264, 512, 2, 128, 11264, 11264, 11264, 128]
    - [22, 19919.0]
  - - [10560, 128, 2, 512, 10560, 10560, 10560, 512]
    - [3, 18499.0]
  - - [16128, 512, 2, 128, 16128, 16128, 16128, 128]
    - [22, 20342.0]
  - - [37632, 256, 2, 64, 37632, 37632, 37632, 64]
    - [10, 18532.0]
  - - [51520, 256, 2, 64, 51520, 51520, 51520, 64]
    - [34, 18021.0]
  - - [14000, 512, 2, 128, 14000, 14000, 14000, 128]
    - [22, 19227.0]
  - - [10560, 512, 2, 128, 10560, 10560, 10560, 128]
    - [20, 19594.0]
  - - [64512, 256, 2, 64, 64512, 64512, 64512, 64]
    - [31, 14927.0]
  - - [54400, 256, 2, 64, 54400, 54400, 54400, 64]
    - [3, 16420.0]
  - - [3264, 1024, 2, 256, 3264, 3264, 3264, 256]
    - [3, 19341.0]
  - - [10752, 512, 2, 128, 10752, 10752, 10752, 128]
    - [28, 20377.0]
  - - [3168, 1024, 2, 256, 3168, 3168, 3168, 256]
    - [3, 19949.0]
  - - [55296, 256, 2, 256, 55296, 55296, 55296, 256]
    - [3, 22059.0]
  - - [51520, 256, 2, 256, 51520, 51520, 51520, 256]
    - [10, 21826.0]
  - - [11408, 128, 2, 512, 11408, 11408, 11408, 512]
    - [28, 19937.0]
  - - [60800, 256, 2, 256, 60800, 60800, 60800, 256]
    - [28, 22187.0]
  - - [54400, 256, 2, 256, 54400, 54400, 54400, 256]
    - [3, 22156.0]
  - - [60800, 256, 2, 64, 60800, 60800, 60800, 64]
    - [8, 19863.0]
  - - [3800, 1024, 1, 256, 3800, 3800, 3800, 256]
    - [3, 19851.0]
  - - [3400, 1024, 1, 256, 3400, 3400, 3400, 256]
    - [10, 19410.0]
  - - [3072, 1024, 2, 256, 3072, 3072, 3072, 256]
    - [3, 20713.0]
  - - [3600, 1024, 2, 256, 3600, 3600, 3600, 256]
    - [16, 19956.0]
  - - [12288, 512, 2, 128, 12288, 12288, 12288, 128]
    - [10, 20507.0]
  - - [49152, 256, 2, 256, 49152, 49152, 49152, 256]
    - [10, 21521.0]
  - - [12880, 512, 2, 128, 12880, 12880, 12880, 128]
    - [20, 19810.0]
  - - [11408, 512, 2, 128, 11408, 11408, 11408, 128]
    - [10, 20444.0]
  - - [42240, 256, 2, 64, 42240, 42240, 42240, 64]
    - [8, 19887.0]
  - - [1008, 2048, 2, 512, 1008, 1008, 1008, 512]
    - [3, 20512.0]
  - - [3360, 1024, 2, 256, 3360, 3360, 3360, 256]
    - [10, 20207.0]
  - - [14208, 512, 2, 128, 14208, 14208, 14208, 128]
    - [3, 21024.0]
  - - [56832, 256, 2, 64, 56832, 56832, 56832, 64]
    - [33, 19242.0]
  - - [43008, 256, 2, 64, 43008, 43008, 43008, 64]
    - [28, 19190.0]
  - - [13600, 512, 2, 128, 13600, 13600, 13600, 128]
    - [3, 20575.0]
  - - [2640, 1024, 2, 256, 2640, 2640, 2640, 256]
    - [10, 20248.0]
  - - [13824, 512, 2, 128, 13824, 13824, 13824, 128]
    - [3, 20885.0]
  - - [3800, 256, 2, 1024, 3800, 3800, 3800, 1024]
    - [3, 20350.0]
  - - [55296, 256, 2, 64, 55296, 55296, 55296, 64]
    - [23, 17001.0]
  - - [2640, 256, 2, 1024, 2640, 2640, 2640, 1024]
    - [3, 16369.0]
  - - [15200, 512, 2, 128, 15200, 15200, 15200, 128]
    - [16, 19464.0]
  - - [3552, 1024, 2, 256, 3552, 3552, 3552, 256]
    - [3, 19854.0]
  - - [3456, 1024, 2, 256, 3456, 3456, 3456, 256]
    - [3, 20933.0]
  - - [49152, 256, 2, 64, 49152, 49152, 49152, 64]
    - [3, 18228.0]
  - - [3400, 1024, 2, 256, 3400, 3400, 3400, 256]
    - [3, 20410.0]
  - - [3800, 1024, 2, 256, 3800, 3800, 3800, 256]
    - [3, 20792.0]
  - - [6912, 256, 1, 512, 6912, 6912, 6912, 512]
    - [10, 18711.0]
  - - [6800, 256, 1, 512, 6800, 6800, 6800, 512]
    - [3, 17107.0]
  - - [27648, 128, 1, 256, 27648, 27648, 27648, 256]
    - [10, 18945.0]
  - - [27200, 128, 1, 256, 27200, 27200, 27200, 256]
    - [3, 17559.0]
  - - [30400, 128, 1, 256, 30400, 30400, 30400, 256]
    - [10, 18945.0]
  - - [7600, 256, 1, 512, 7600, 7600, 7600, 512]
    - [3, 17846.0]
  - - [6144, 1024, 1, 512, 6144, 6144, 6144, 512]
    - [22, 20723.0]
  - - [6912, 1024, 1, 512, 6912, 6912, 6912, 512]
    - [22, 21747.0]
  - - [6440, 1024, 1, 512, 6440, 6440, 6440, 512]
    - [10, 20964.0]
  - - [27648, 512, 1, 256, 27648, 27648, 27648, 256]
    - [10, 21728.0]
  - - [1728, 2048, 1, 1024, 1728, 1728, 1728, 1024]
    - [3, 19829.0]
  - - [27200, 512, 1, 256, 27200, 27200, 27200, 256]
    - [10, 21341.0]
  - - [6800, 1024, 1, 512, 6800, 6800, 6800, 512]
    - [10, 21158.0]
  - - [7600, 1024, 1, 512, 7600, 7600, 7600, 512]
    - [3, 21738.0]
  - - [30400, 512, 1, 256, 30400, 30400, 30400, 256]
    - [10, 21508.0]
  - - [12544, 1024, 1, 1024, 12544, 12544, 12544, 1024]
    - [3, 22399.0]
  - - [173280, 128, 1, 64, 173280, 173280, 173280, 64]
    - [14, 19013.0]
  - - [231040, 128, 1, 64, 231040, 231040, 231040, 64]
    - [3, 19736.0]
  - - [25992, 128, 1, 64, 25992, 25992, 25992, 64]
    - [7, 15363.0]
  - - [2852, 256, 2, 1024, 2852, 2852, 2852, 1024]
    - [10, 18275.0]
  - - [3220, 256, 2, 1024, 3220, 3220, 3220, 1024]
    - [3, 17659.0]
  - - [850, 2048, 2, 512, 850, 850, 850, 512]
    - [3, 18988.0]
  - - [805, 2048, 2, 512, 805, 805, 805, 512]
    - [16, 17842.0]
  - - [3036, 256, 2, 1024, 3036, 3036, 3036, 1024]
    - [3, 19598.0]
  - - [713, 2048, 2, 512, 713, 713, 713, 512]
    - [3, 17972.0]
  - - [850, 2048, 1, 512, 850, 850, 850, 512]
    - [3, 16779.0]
  - - [660, 2048, 2, 512, 660, 660, 660, 512]
    - [3, 16652.0]
  - - [726, 2048, 2, 512, 726, 726, 726, 512]
    - [3, 18265.0]
  - - [3500, 256, 2, 1024, 3500, 3500, 3500, 1024]
    - [3, 18339.0]
  - - [3700, 256, 2, 1024, 3700, 3700, 3700, 1024]
    - [3, 19287.0]
  - - [748, 2048, 2, 512, 748, 748, 748, 512]
    - [16, 18863.0]
  - - [3036, 1024, 2, 256, 3036, 3036, 3036, 256]
    - [33, 19778.0]
  - - [2852, 1024, 2, 256, 2852, 2852, 2852, 256]
    - [10, 19706.0]
  - - [950, 2048, 1, 512, 950, 950, 950, 512]
    - [3, 17205.0]
  - - [3700, 1024, 2, 256, 3700, 3700, 3700, 256]
    - [10, 20554.0]
  - - [3500, 1024, 2, 256, 3500, 3500, 3500, 256]
    - [3, 20214.0]
  - - [3220, 1024, 2, 256, 3220, 3220, 3220, 256]
    - [3, 20155.0]
  - - [950, 2048, 2, 512, 950, 950, 950, 512]
    - [16, 19521.0]
  - - [1610, 2048, 1, 1024, 1610, 1610, 1610, 1024]
    - [3, 19955.0]
  - - [1700, 2048, 1, 1024, 1700, 1700, 1700, 1024]
    - [3, 19290.0]
  - - [1900, 2048, 1, 1024, 1900, 1900, 1900, 1024]
    - [16, 21390.0]
  - - [1444, 256, 120, 128, 1444, 1444, 1444, 128]
    - [16, 19413.0]
  - - [1444, 256, 139, 128, 1444, 1444, 1444, 128]
    - [16, 19514.0]
  - - [1444, 256, 160, 128, 1444, 1444, 1444, 128]
    - [16, 19598.0]
  - - [1444, 256, 18, 128, 1444, 1444, 1444, 128]
    - [8, 17818.0]
  - - [1444, 256, 19, 128, 1444, 1444, 1444, 128]
    - [28, 18400.0]
  - - [1444, 256, 120, 256, 1444, 1444, 1444, 256]
    - [3, 20557.0]
  - - [1444, 256, 139, 256, 1444, 1444, 1444, 256]
    - [3, 20652.0]
  - - [1444, 256, 160, 256, 1444, 1444, 1444, 256]
    - [3, 20633.0]
  - - [1444, 256, 18, 256, 1444, 1444, 1444, 256]
    - [22, 19309.0]
  - - [1444, 256, 19, 256, 1444, 1444, 1444, 256]
    - [3, 19707.0]
  - - [361, 256, 120, 512, 361, 361, 361, 512]
    - [10, 19355.0]
  - - [361, 256, 139, 512, 361, 361, 361, 512]
    - [33, 19580.0]
  - - [361, 256, 160, 512, 361, 361, 361, 512]
    - [33, 19394.0]
  - - [361, 256, 18, 512, 361, 361, 361, 512]
    - [10, 16674.0]
  - - [361, 256, 19, 512, 361, 361, 361, 512]
    - [33, 17831.0]
  - - [200716, 128, 1, 64, 200716, 200716, 200716, 64]
    - [34, 18225.0]
  - - [27436, 128, 1, 64, 27436, 27436, 27436, 64]
    - [21, 13507.0]
  - - [1024, 1024, 160, 96, 1024, 1024, 1024, 96]
    - [3, 21199.0]
  - - [1920, 16384, 1, 25216, 1920, 1920, 1920, 25216]
    - [3, 22646.0]
  - - [3840, 16384, 1, 1920, 3840, 3840, 3840, 1920]
    - [14, 23300.0]
  - - [1920, 16384, 1, 3840, 1920, 1920, 1920, 3840]
    - [16, 22845.0]
  - - [960, 16384, 1, 1920, 960, 960, 960, 1920]
    - [20, 21153.0]
  - - [1920, 16384, 1, 2880, 1920, 1920, 1920, 2880]
    - [14, 23546.0]
  - - [1024, 1024, 40, 96, 1024, 1024, 1024, 96]
    - [16, 20581.0]
  - - [1920, 4096, 1, 25216, 1920, 1920, 1920, 25216]
    - [10, 22410.0]
  - - [3840, 4096, 1, 1920, 3840, 3840, 3840, 1920]
    - [26, 23257.0]
  - - [1920, 4096, 1, 3840, 1920, 1920, 1920, 3840]
    - [3, 22640.0]
  - - [960, 4096, 1, 1920, 960, 960, 960, 1920]
    - [16, 20057.0]
  - - [1920, 4096, 1, 2880, 1920, 1920, 1920, 2880]
    - [14, 22948.0]
  - - [1024, 1024, 80, 96, 1024, 1024, 1024, 96]
    - [10, 20741.0]
  - - [1920, 8192, 1, 25216, 1920, 1920, 1920, 25216]
    - [3, 22504.0]
  - - [3840, 8192, 1, 1920, 3840, 3840, 3840, 1920]
    - [14, 23436.0]
  - - [1920, 8192, 1, 3840, 1920, 1920, 1920, 3840]
    - [3, 22794.0]
  - - [960, 8192, 1, 1920, 960, 960, 960, 1920]
    - [14, 21180.0]
  - - [1920, 8192, 1, 2880, 1920, 1920, 1920, 2880]
    - [14, 23525.0]
  - - [1024, 1024, 96, 96, 1024, 1024, 1024, 96]
    - [3, 21023.0]
  - - [2304, 16384, 1, 12672, 2304, 2304, 2304, 12672]
    - [3, 22809.0]
  - - [2304, 16384, 1, 2304, 2304, 2304, 2304, 2304]
    - [16, 22984.0]
  - - [576, 16384, 1, 2304, 576, 576, 576, 2304]
    - [3, 20359.0]
  - - [2304, 16384, 1, 1728, 2304, 2304, 2304, 1728]
    - [14, 23419.0]
  - - [1024, 1024, 24, 96, 1024, 1024, 1024, 96]
    - [10, 20268.0]
  - - [2304, 4096, 1, 12672, 2304, 2304, 2304, 12672]
    - [1, 22749.0]
  - - [2304, 4096, 1, 2304, 2304, 2304, 2304, 2304]
    - [16, 22626.0]
  - - [576, 4096, 1, 2304, 576, 576, 576, 2304]
    - [5, 19649.0]
  - - [2304, 4096, 1, 1728, 2304, 2304, 2304, 1728]
    - [26, 23152.0]
  - - [1024, 1024, 48, 96, 1024, 1024, 1024, 96]
    - [10, 20950.0]
  - - [2304, 8192, 1, 12672, 2304, 2304, 2304, 12672]
    - [1, 23009.0]
  - - [2304, 8192, 1, 2304, 2304, 2304, 2304, 2304]
    - [3, 22819.0]
  - - [576, 8192, 1, 2304, 576, 576, 576, 2304]
    - [5, 20156.0]
  - - [2304, 8192, 1, 1728, 2304, 2304, 2304, 1728]
    - [26, 23402.0]
  - - [1024, 1024, 16, 96, 1024, 1024, 1024, 96]
    - [3, 20108.0]
  - - [3072, 4096, 1, 6400, 3072, 3072, 3072, 6400]
    - [16, 22699.0]
  - - [1536, 4096, 1, 3072, 1536, 1536, 1536, 3072]
    - [3, 21821.0]
  - - [3072, 4096, 1, 1536, 3072, 3072, 3072, 1536]
    - [16, 22557.0]
  - - [384, 4096, 1, 3072, 384, 384, 384, 3072]
    - [10, 20457.0]
  - - [3072, 4096, 1, 1152, 3072, 3072, 3072, 1152]
    - [14, 22890.0]
  - - [1024, 1024, 32, 96, 1024, 1024, 1024, 96]
    - [3, 19818.0]
  - - [3072, 8192, 1, 6400, 3072, 3072, 3072, 6400]
    - [33, 22975.0]
  - - [1536, 8192, 1, 3072, 1536, 1536, 1536, 3072]
    - [22, 22600.0]
  - - [3072, 8192, 1, 1536, 3072, 3072, 3072, 1536]
    - [3, 22914.0]
  - - [384, 8192, 1, 3072, 384, 384, 384, 3072]
    - [3, 21142.0]
  - - [3072, 8192, 1, 1152, 3072, 3072, 3072, 1152]
    - [14, 23385.0]
  - - [2048, 4096, 1, 2048, 2048, 2048, 2048, 2048]
    - [3, 22427.0]
  - - [2048, 4096, 1, 4096, 2048, 2048, 2048, 4096]
    - [3, 22534.0]
  - - [4096, 4096, 1, 2048, 4096, 4096, 4096, 2048]
    - [3, 22709.0]
  - - [1024, 2283, 1, 29000, 1024, 1024, 1024, 29000]
    - [18, 20078.0]
  - - [1024, 2296, 1, 29000, 1024, 1024, 1024, 29000]
    - [30, 20188.0]
  - - [1024, 2306, 1, 29000, 1024, 1024, 1024, 29000]
    - [18, 20154.0]
  - - [1024, 2309, 1, 29000, 1024, 1024, 1024, 29000]
    - [30, 20174.0]
  - - [1024, 2318, 1, 29000, 1024, 1024, 1024, 29000]
    - [18, 20251.0]
  - - [1024, 2320, 1, 29000, 1024, 1024, 1024, 29000]
    - [18, 20289.0]
  - - [1024, 2324, 1, 29000, 1024, 1024, 1024, 29000]
    - [5, 20308.0]
  - - [1024, 2325, 1, 29000, 1024, 1024, 1024, 29000]
    - [18, 20316.0]
  - - [1024, 2329, 1, 29000, 1024, 1024, 1024, 29000]
    - [18, 20352.0]
  - - [1024, 2338, 1, 29000, 1024, 1024, 1024, 29000]
    - [5, 20437.0]
  - - [1024, 2345, 1, 29000, 1024, 1024, 1024, 29000]
    - [5, 20485.0]
  - - [1024, 2350, 1, 29000, 1024, 1024, 1024, 29000]
    - [5, 20533.0]
  - - [1024, 2362, 1, 29000, 1024, 1024, 1024, 29000]
    - [5, 20641.0]
  - - [1024, 2366, 1, 29000, 1024, 1024, 1024, 29000]
    - [10, 20699.0]
  - - [1024, 2368, 1, 29000, 1024, 1024, 1024, 29000]
    - [28, 20722.0]
  - - [1024, 2374, 1, 29000, 1024, 1024, 1024, 29000]
    - [18, 20742.0]
  - - [1024, 2390, 1, 29000, 1024, 1024, 1024, 29000]
    - [16, 20892.0]
  - - [512, 512, 320, 64, 512, 512, 512, 64]
    - [0, 17495.0]
  - - [512, 512, 80, 64, 512, 512, 512, 64]
    - [16, 18883.0]
  - - [2560, 1024, 1, 2560, 2560, 2560, 2560, 2560]
    - [5, 21904.0]
  - - [2560, 1024, 1, 4096, 2560, 2560, 2560, 4096]
    - [3, 22076.0]
  - - [4096, 1024, 1, 2560, 4096, 4096, 4096, 2560]
    - [22, 21953.0]
  - - [1024, 1024, 512, 64, 1024, 1024, 1024, 64]
    - [6, 17254.0]
  - - [1024, 32768, 1, 3072, 1024, 1024, 1024, 3072]
    - [10, 23020.0]
  - - [1024, 32768, 1, 4096, 1024, 1024, 1024, 4096]
    - [22, 23023.0]
  - - [1024, 32768, 1, 50304, 1024, 1024, 1024, 50304]
    - [10, 22869.0]
  - - [4096, 32768, 1, 1024, 4096, 4096, 4096, 1024]
    - [3, 22963.0]
  - - [1024, 1024, 24, 128, 1024, 1024, 1024, 128]
    - [3, 20882.0]
  - - [128, 1024, 24, 1024, 128, 128, 128, 1024]
    - [10, 20779.0]
  - - [1024, 780, 1, 30522, 1024, 1024, 1024, 30522]
    - [38, 17819.0]
  - - [1024, 308, 1, 30522, 1024, 1024, 1024, 30522]
    - [37, 16880.0]
  - - [1024, 800, 1, 30522, 1024, 1024, 1024, 30522]
    - [38, 18261.0]
  - - [1024, 820, 1, 30522, 1024, 1024, 1024, 30522]
    - [38, 18784.0]
  - - [1024, 385, 1, 30522, 1024, 1024, 1024, 30522]
    - [38, 14863.0]
  - - [1024, 462, 1, 30522, 1024, 1024, 1024, 30522]
    - [45, 17591.0]
  - - [1024, 640, 1, 30528, 1024, 1024, 1024, 30528]
    - [38, 21356.0]
  - - [2048, 199, 1, 29000, 2048, 2048, 2048, 29000]
    - [45, 15204.0]
  - - [2048, 221, 1, 29000, 2048, 2048, 2048, 29000]
    - [39, 16804.0]
  - - [2048, 224, 1, 29000, 2048, 2048, 2048, 29000]
    - [43, 17029.0]
  - - [2048, 229, 1, 29000, 2048, 2048, 2048, 29000]
    - [45, 17395.0]
  - - [2048, 234, 1, 29000, 2048, 2048, 2048, 29000]
    - [41, 17801.0]
  - - [2048, 242, 1, 29000, 2048, 2048, 2048, 29000]
    - [45, 18374.0]
  - - [2048, 246, 1, 29000, 2048, 2048, 2048, 29000]
    - [43, 18654.0]
  - - [2048, 247, 1, 29000, 2048, 2048, 2048, 29000]
    - [41, 18766.0]
  - - [2048, 256, 1, 29000, 2048, 2048, 2048, 29000]
    - [38, 19448.0]
  - - [2048, 262, 1, 29000, 2048, 2048, 2048, 29000]
    - [37, 14710.0]
  - - [2048, 264, 1, 29000, 2048, 2048, 2048, 29000]
    - [37, 14835.0]
  - - [2048, 265, 1, 29000, 2048, 2048, 2048, 29000]
    - [42, 14894.0]
  - - [2048, 274, 1, 29000, 2048, 2048, 2048, 29000]
    - [37, 15398.0]
  - - [2048, 277, 1, 29000, 2048, 2048, 2048, 29000]
    - [42, 15547.0]
  - - [2048, 279, 1, 29000, 2048, 2048, 2048, 29000]
    - [44, 15663.0]
  - - [2048, 288, 1, 29000, 2048, 2048, 2048, 29000]
    - [42, 16111.0]
  - - [2048, 296, 1, 29000, 2048, 2048, 2048, 29000]
    - [42, 16579.0]
  - - [2048, 315, 1, 29000, 2048, 2048, 2048, 29000]
    - [42, 17619.0]
  - - [2048, 335, 1, 29000, 2048, 2048, 2048, 29000]
    - [41, 18273.0]
  - - [1024, 561, 1, 29000, 1024, 1024, 1024, 29000]
    - [38, 18922.0]
  - - [1024, 574, 1, 29000, 1024, 1024, 1024, 29000]
    - [38, 19294.0]
  - - [1024, 600, 1, 29000, 1024, 1024, 1024, 29000]
    - [38, 20078.0]
  - - [1024, 608, 1, 29000, 1024, 1024, 1024, 29000]
    - [38, 20400.0]
  - - [1024, 615, 1, 29000, 1024, 1024, 1024, 29000]
    - [38, 20601.0]
  - - [1024, 622, 1, 29000, 1024, 1024, 1024, 29000]
    - [38, 20836.0]
  - - [1024, 625, 1, 29000, 1024, 1024, 1024, 29000]
    - [38, 20903.0]
  - - [1024, 626, 1, 29000, 1024, 1024, 1024, 29000]
    - [38, 20977.0]
  - - [1024, 628, 1, 29000, 1024, 1024, 1024, 29000]
    - [38, 21006.0]
  - - [1024, 636, 1, 29000, 1024, 1024, 1024, 29000]
    - [38, 21257.0]
  - - [1024, 651, 1, 29000, 1024, 1024, 1024, 29000]
    - [38, 17847.0]
  - - [1024, 658, 1, 29000, 1024, 1024, 1024, 29000]
    - [38, 18043.0]
  - - [1024, 669, 1, 29000, 1024, 1024, 1024, 29000]
    - [38, 18237.0]
  - - [1024, 670, 1, 29000, 1024, 1024, 1024, 29000]
    - [38, 18281.0]
  - - [1024, 672, 1, 29000, 1024, 1024, 1024, 29000]
    - [38, 18351.0]
  - - [1024, 684, 1, 29000, 1024, 1024, 1024, 29000]
    - [40, 18608.0]
  - - [1024, 716, 1, 29000, 1024, 1024, 1024, 29000]
    - [38, 19470.0]
  - - [1024, 730, 1, 29000, 1024, 1024, 1024, 29000]
    - [38, 19975.0]
  - - [1024, 1024, 1, 3328, 1024, 1024, 1024, 3328]
    - [60, 16339.0]
  - - [128, 6784, 1, 3328, 128, 128, 128, 3328]
    - [67, 16963.0]
  - - [256, 4288, 1, 3328, 256, 256, 256, 3328]
    - [60, 16891.0]
  - - [704, 1856, 1, 3328, 704, 704, 704, 3328]
    - [72, 15671.0]
  - - [448, 1024, 1, 1280, 448, 448, 448, 1280]
    - [59, 12957.0]
  - - [1024, 704, 1, 256, 1024, 1024, 1024, 256]
    - [60, 11937.0]
  - - [256, 1856, 1, 1280, 256, 256, 256, 1280]
    - [78, 14848.0]
  - - [256, 2944, 1, 3328, 256, 256, 256, 3328]
    - [49, 16013.0]
  - - [128, 3584, 1, 1280, 128, 128, 128, 1280]
    - [54, 14364.0]
  - - [4288, 256, 1, 256, 4288, 4288, 4288, 256]
    - [47, 13083.0]
  - - [5888, 64, 1, 3328, 5888, 5888, 5888, 3328]
    - [49, 13207.0]
  - - [2944, 256, 1, 3328, 2944, 2944, 2944, 3328]
    - [60, 16015.0]
  - - [1408, 448, 1, 1280, 1408, 1408, 1408, 1280]
    - [47, 15641.0]
  - - [1408, 256, 1, 1280, 1408, 1408, 1408, 1280]
    - [49, 11500.0]
  - - [6784, 64, 1, 256, 6784, 6784, 6784, 256]
    - [72, 9403.0]
  - - [2368, 128, 1, 3328, 2368, 2368, 2368, 3328]
    - [50, 14423.0]
  - - [2944, 128, 1, 256, 2944, 2944, 2944, 256]
    - [47, 8288.0]
  - - [448, 1408, 1, 256, 448, 448, 448, 256]
    - [59, 10527.0]
  - - [64, 5056, 1, 3328, 64, 64, 64, 3328]
    - [48, 12965.0]
  - - [256, 3584, 1, 3328, 256, 256, 256, 3328]
    - [50, 17634.0]
  - - [256, 1408, 1, 256, 256, 256, 256, 256]
    - [62, 8343.0]
  - - [5056, 64, 1, 1280, 5056, 5056, 5056, 1280]
    - [71, 13880.0]
  - - [2368, 128, 1, 256, 2368, 2368, 2368, 256]
    - [48, 7320.0]
  - - [4288, 128, 1, 1280, 4288, 4288, 4288, 1280]
    - [73, 13995.0]
  - - [5888, 64, 1, 256, 5888, 5888, 5888, 256]
    - [65, 8189.0]
  - - [1856, 256, 1, 1280, 1856, 1856, 1856, 1280]
    - [47, 14892.0]
  - - [64, 5888, 1, 3328, 64, 64, 64, 3328]
    - [53, 11296.0]
  - - [1024, 704, 1, 1280, 1024, 1024, 1024, 1280]
    - [60, 14717.0]
  - - [256, 1408, 1, 3328, 256, 256, 256, 3328]
    - [49, 12283.0]
  - - [6784, 128, 1, 3328, 6784, 6784, 6784, 3328]
    - [50, 16607.0]
  - - [704, 704, 1, 3328, 704, 704, 704, 3328]
    - [71, 14062.0]
  - - [3584, 256, 1, 3328, 3584, 3584, 3584, 3328]
    - [61, 17691.0]
  - - [128, 3584, 1, 3328, 128, 128, 128, 3328]
    - [72, 15422.0]
  - - [128, 2944, 1, 1280, 128, 128, 128, 1280]
    - [54, 11945.0]
  - - [448, 1856, 1, 1280, 448, 448, 448, 1280]
    - [50, 15398.0]
  - - [3584, 128, 1, 256, 3584, 3584, 3584, 256]
    - [47, 9886.0]
  - - [448, 1408, 1, 3328, 448, 448, 448, 3328]
    - [74, 15452.0]
  - - [704, 1024, 1, 256, 704, 704, 704, 256]
    - [49, 11171.0]
  - - [256, 3584, 1, 256, 256, 256, 256, 256]
    - [61, 13656.0]
  - - [1408, 704, 1, 256, 1408, 1408, 1408, 256]
    - [49, 12500.0]
  - - [448, 2944, 1, 3328, 448, 448, 448, 3328]
    - [61, 15524.0]
  - - [64, 5888, 1, 256, 64, 64, 64, 256]
    - [48, 7501.0]
  - - [448, 2368, 1, 1280, 448, 448, 448, 1280]
    - [61, 14757.0]
  - - [704, 704, 1, 256, 704, 704, 704, 256]
    - [48, 9715.0]
  - - [128, 4288, 1, 3328, 128, 128, 128, 3328]
    - [53, 15475.0]
  - - [256, 2368, 1, 256, 256, 256, 256, 256]
    - [58, 11411.0]
  - - [1024, 448, 1, 3328, 1024, 1024, 1024, 3328]
    - [49, 15462.0]
  - - [1856, 704, 1, 1280, 1856, 1856, 1856, 1280]
    - [54, 15260.0]
  - - [1024, 1024, 1, 1280, 1024, 1024, 1024, 1280]
    - [49, 15640.0]
  - - [256, 2944, 1, 256, 256, 256, 256, 256]
    - [70, 12120.0]
  - - [128, 6784, 1, 1280, 128, 128, 128, 1280]
    - [55, 15906.0]
  - - [1408, 704, 1, 3328, 1408, 1408, 1408, 3328]
    - [49, 15325.0]
  - - [128, 5888, 1, 1280, 128, 128, 128, 1280]
    - [78, 15274.0]
  - - [704, 1408, 1, 3328, 704, 704, 704, 3328]
    - [49, 15230.0]
  - - [448, 704, 1, 1280, 448, 448, 448, 1280]
    - [65, 11867.0]
  - - [6784, 128, 1, 256, 6784, 6784, 6784, 256]
    - [73, 12805.0]
  - - [704, 448, 1, 256, 704, 704, 704, 256]
    - [71, 7675.0]
  - - [256, 1856, 1, 3328, 256, 256, 256, 3328]
    - [60, 15992.0]
  - - [1024, 704, 1, 3328, 1024, 1024, 1024, 3328]
    - [49, 15316.0]
  - - [128, 4288, 1, 256, 128, 128, 128, 256]
    - [54, 10080.0]
  - - [64, 6784, 1, 3328, 64, 64, 64, 3328]
    - [65, 12208.0]
  - - [2944, 256, 1, 1280, 2944, 2944, 2944, 1280]
    - [49, 15391.0]
  - - [1856, 704, 1, 256, 1856, 1856, 1856, 256]
    - [71, 13664.0]
  - - [704, 1856, 1, 256, 704, 704, 704, 256]
    - [65, 16051.0]
  - - [2944, 448, 1, 256, 2944, 2944, 2944, 256]
    - [72, 13759.0]
  - - [2368, 128, 1, 1280, 2368, 2368, 2368, 1280]
    - [49, 12356.0]
  - - [64, 6784, 1, 256, 64, 64, 64, 256]
    - [65, 8307.0]
  - - [64, 5056, 1, 1280, 64, 64, 64, 1280]
    - [53, 11820.0]
  - - [704, 448, 1, 3328, 704, 704, 704, 3328]
    - [48, 13147.0]
  - - [2368, 256, 1, 1280, 2368, 2368, 2368, 1280]
    - [61, 15408.0]
  - - [2368, 448, 1, 1280, 2368, 2368, 2368, 1280]
    - [49, 15547.0]
  - - [128, 3584, 1, 256, 128, 128, 128, 256]
    - [78, 9754.0]
  - - [1856, 448, 1, 3328, 1856, 1856, 1856, 3328]
    - [55, 15911.0]
  - - [128, 5056, 1, 256, 128, 128, 128, 256]
    - [78, 11783.0]
  - - [4288, 256, 1, 1280, 4288, 4288, 4288, 1280]
    - [49, 16132.0]
  - - [4288, 128, 1, 3328, 4288, 4288, 4288, 3328]
    - [61, 15179.0]
  - - [448, 2368, 1, 3328, 448, 448, 448, 3328]
    - [50, 15447.0]
  - - [256, 1408, 1, 1280, 256, 256, 256, 1280]
    - [49, 11409.0]
  - - [128, 2368, 1, 256, 128, 128, 128, 256]
    - [78, 7652.0]
  - - [6784, 64, 1, 3328, 6784, 6784, 6784, 3328]
    - [72, 14622.0]
  - - [128, 2944, 1, 3328, 128, 128, 128, 3328]
    - [77, 13821.0]
  - - [2944, 448, 1, 3328, 2944, 2944, 2944, 3328]
    - [72, 15986.0]
  - - [5888, 128, 1, 256, 5888, 5888, 5888, 256]
    - [49, 12180.0]
  - - [5056, 64, 1, 256, 5056, 5056, 5056, 256]
    - [70, 8284.0]
  - - [128, 5056, 1, 3328, 128, 128, 128, 3328]
    - [79, 17785.0]
  - - [256, 4288, 1, 1280, 256, 256, 256, 1280]
    - [60, 16289.0]
  - - [4288, 128, 1, 256, 4288, 4288, 4288, 256]
    - [47, 9520.0]
  - - [3584, 256, 1, 256, 3584, 3584, 3584, 256]
    - [79, 15372.0]
  - - [128, 2944, 1, 256, 128, 128, 128, 256]
    - [78, 10155.0]
  - - [3584, 128, 1, 3328, 3584, 3584, 3584, 3328]
    - [49, 15782.0]
  - - [5888, 128, 1, 3328, 5888, 5888, 5888, 3328]
    - [72, 15945.0]
  - - [1408, 704, 1, 1280, 1408, 1408, 1408, 1280]
    - [59, 17244.0]
  - - [448, 1408, 1, 1280, 448, 448, 448, 1280]
    - [71, 13061.0]
  - - [704, 1408, 1, 1280, 704, 704, 704, 1280]
    - [49, 14692.0]
  - - [448, 2944, 1, 256, 448, 448, 448, 256]
    - [61, 12552.0]
  - - [448, 2368, 1, 256, 448, 448, 448, 256]
    - [76, 12006.0]
  - - [64, 6784, 1, 1280, 64, 64, 64, 1280]
    - [53, 12118.0]
  - - [128, 2368, 1, 3328, 128, 128, 128, 3328]
    - [49, 14573.0]
  - - [5056, 64, 1, 3328, 5056, 5056, 5056, 3328]
    - [54, 15074.0]
  - - [5056, 128, 1, 3328, 5056, 5056, 5056, 3328]
    - [61, 17912.0]
  - - [448, 704, 1, 256, 448, 448, 448, 256]
    - [54, 7793.0]
  - - [1856, 256, 1, 3328, 1856, 1856, 1856, 3328]
    - [47, 16089.0]
  - - [2944, 128, 1, 3328, 2944, 2944, 2944, 3328]
    - [60, 13137.0]
  - - [1024, 1024, 1, 256, 1024, 1024, 1024, 256]
    - [49, 14864.0]
  - - [704, 1024, 1, 1280, 704, 704, 704, 1280]
    - [54, 15009.0]
  - - [256, 4288, 1, 256, 256, 256, 256, 256]
    - [72, 13615.0]
  - - [2368, 256, 1, 256, 2368, 2368, 2368, 256]
    - [50, 10837.0]
  - - [256, 2368, 1, 3328, 256, 256, 256, 3328]
    - [61, 16804.0]
  - - [704, 448, 1, 1280, 704, 704, 704, 1280]
    - [71, 11846.0]
  - - [256, 1856, 1, 256, 256, 256, 256, 256]
    - [49, 10343.0]
  - - [64, 5056, 1, 256, 64, 64, 64, 256]
    - [77, 7544.0]
  - - [1408, 256, 1, 3328, 1408, 1408, 1408, 3328]
    - [49, 12248.0]
  - - [2368, 448, 1, 256, 2368, 2368, 2368, 256]
    - [50, 13007.0]
  - - [4288, 256, 1, 3328, 4288, 4288, 4288, 3328]
    - [60, 16727.0]
  - - [2944, 256, 1, 256, 2944, 2944, 2944, 256]
    - [78, 13981.0]
  - - [6784, 64, 1, 1280, 6784, 6784, 6784, 1280]
    - [49, 13515.0]
  - - [704, 1856, 1, 1280, 704, 704, 704, 1280]
    - [72, 15246.0]
  - - [448, 1024, 1, 3328, 448, 448, 448, 3328]
    - [48, 13948.0]
  - - [2944, 448, 1, 1280, 2944, 2944, 2944, 1280]
    - [72, 15537.0]
  - - [448, 1024, 1, 256, 448, 448, 448, 256]
    - [65, 9233.0]
  - - [1024, 448, 1, 1280, 1024, 1024, 1024, 1280]
    - [58, 14399.0]
  - - [256, 2368, 1, 1280, 256, 256, 256, 1280]
    - [67, 15323.0]
  - - [128, 5056, 1, 1280, 128, 128, 128, 1280]
    - [55, 16224.0]
  - - [1408, 256, 1, 256, 1408, 1408, 1408, 256]
    - [47, 7833.0]
  - - [128, 5888, 1, 3328, 128, 128, 128, 3328]
    - [78, 15925.0]
  - - [2368, 448, 1, 3328, 2368, 2368, 2368, 3328]
    - [72, 16359.0]
  - - [3584, 128, 1, 1280, 3584, 3584, 3584, 1280]
    - [72, 14280.0]
  - - [1408, 448, 1, 256, 1408, 1408, 1408, 256]
    - [52, 11702.0]
  - - [2368, 256, 1, 3328, 2368, 2368, 2368, 3328]
    - [50, 16729.0]
  - - [5888, 128, 1, 1280, 5888, 5888, 5888, 1280]
    - [54, 15352.0]
  - - [256, 3584, 1, 1280, 256, 256, 256, 1280]
    - [61, 16917.0]
  - - [128, 5888, 1, 256, 128, 128, 128, 256]
    - [54, 11954.0]
  - - [1408, 448, 1, 3328, 1408, 1408, 1408, 3328]
    - [60, 16441.0]
  - - [64, 5888, 1, 1280, 64, 64, 64, 1280]
    - [77, 12053.0]
  - - [704, 704, 1, 1280, 704, 704, 704, 1280]
    - [48, 13255.0]
  - - [128, 2368, 1, 1280, 128, 128, 128, 1280]
    - [66, 12796.0]
  - - [3584, 256, 1, 1280, 3584, 3584, 3584, 1280]
    - [67, 17492.0]
  - - [5888, 64, 1, 1280, 5888, 5888, 5888, 1280]
    - [53, 12693.0]
  - - [5056, 128, 1, 1280, 5056, 5056, 5056, 1280]
    - [79, 16940.0]
  - - [448, 1856, 1, 3328, 448, 448, 448, 3328]
    - [50, 15807.0]
  - - [1024, 448, 1, 256, 1024, 1024, 1024, 256]
    - [72, 11887.0]
  - - [2944, 128, 1, 1280, 2944, 2944, 2944, 1280]
    - [59, 12754.0]
  - - [256, 2944, 1, 1280, 256, 256, 256, 1280]
    - [76, 15509.0]
  - - [704, 1024, 1, 3328, 704, 704, 704, 3328]
    - [49, 15227.0]
  - - [1856, 448, 1, 1280, 1856, 1856, 1856, 1280]
    - [50, 14948.0]
  - - [128, 6784, 1, 256, 128, 128, 128, 256]
    - [55, 12489.0]
  - - [704, 1408, 1, 256, 704, 704, 704, 256]
    - [54, 12049.0]
  - - [448, 2944, 1, 1280, 448, 448, 448, 1280]
    - [61, 15009.0]
  - - [1856, 256, 1, 256, 1856, 1856, 1856, 256]
    - [52, 9342.0]
  - - [5056, 128, 1, 256, 5056, 5056, 5056, 256]
    - [65, 12382.0]
  - - [6784, 128, 1, 1280, 6784, 6784, 6784, 1280]
    - [55, 16674.0]
  - - [1856, 448, 1, 256, 1856, 1856, 1856, 256]
    - [71, 11481.0]
  - - [128, 4288, 1, 1280, 128, 128, 128, 1280]
    - [55, 13917.0]
  - - [448, 704, 1, 3328, 448, 448, 448, 3328]
    - [53, 13003.0]
  - - [448, 1856, 1, 256, 448, 448, 448, 256]
    - [76, 11800.0]
  - - [1856, 704, 1, 3328, 1856, 1856, 1856, 3328]
    - [60, 15677.0]
  - - [64, 193600, 1, 64, 64, 64, 64, 64]
    - [75, 12445.0]
  - - [1024, 700, 1, 512, 1024, 1024, 1024, 512]
    - [73, 12734.0]
  - - [2560, 128, 1, 2560, 2560, 2560, 2560, 2560]
    - [50, 15990.0]
  - - [64, 193600, 1, 256, 64, 64, 64, 256]
    - [68, 12422.0]
  - - [4096, 128, 1, 4096, 4096, 4096, 4096, 4096]
    - [61, 15091.0]
  - - [512, 1500, 1, 2816, 512, 512, 512, 2816]
    - [72, 16431.0]
  - - [3072, 128, 1, 1024, 3072, 3072, 3072, 1024]
    - [49, 13065.0]
  - - [7680, 64, 1, 2560, 7680, 7680, 7680, 2560]
    - [49, 16836.0]
  - - [7680, 128, 1, 2560, 7680, 7680, 7680, 2560]
    - [50, 18686.0]
  - - [512, 1500, 1, 2560, 512, 512, 512, 2560]
    - [72, 15974.0]
  - - [1024, 1024, 1, 1024, 1024, 1024, 1024, 1024]
    - [66, 15823.0]
  - - [512, 1500, 1, 2048, 512, 512, 512, 2048]
    - [78, 16106.0]
  - - [512, 1500, 1, 1536, 512, 512, 512, 1536]
    - [72, 15505.0]
  - - [3136, 64, 128, 64, 3136, 3136, 3136, 64]
    - [54, 14936.0]
  - - [3136, 64, 64, 256, 3136, 3136, 3136, 256]
    - [49, 17061.0]
  - - [3136, 64, 128, 256, 3136, 3136, 3136, 256]
    - [60, 16371.0]
  - - [3136, 64, 256, 64, 3136, 3136, 3136, 64]
    - [46, 11979.0]
  - - [3136, 64, 64, 64, 3136, 3136, 3136, 64]
    - [58, 16832.0]
  - - [3136, 64, 256, 256, 3136, 3136, 3136, 256]
    - [60, 16182.0]
  - - [64, 128, 512, 128, 64, 64, 64, 128]
    - [48, 14294.0]
  - - [64, 512, 64, 512, 64, 64, 64, 512]
    - [56, 12116.0]
  - - [512, 1600, 1, 32, 512, 512, 512, 32]
    - [57, 7123.0]
  - - [512, 1600, 1, 512, 512, 512, 512, 512]
    - [60, 16422.0]
  - - [560, 1600, 1, 1024, 560, 560, 560, 1024]
    - [54, 13601.0]
  - - [1024, 512, 1, 1, 1024, 1024, 1024, 1]
    - [63, 85.0]
  - - [1024, 512, 1, 64, 1024, 1024, 1024, 64]
    - [57, 5023.0]
  - - [1024, 512, 1, 1024, 1024, 1024, 1024, 1024]
    - [61, 13530.0]
  - - [1024, 960, 1, 64, 1024, 1024, 1024, 64]
    - [49, 9679.0]
  - - [1024, 960, 1, 1024, 1024, 1024, 1024, 1024]
    - [66, 17108.0]
  - - [1600, 512, 1, 1024, 1600, 1600, 1600, 1024]
    - [50, 14681.0]
  - - [2048, 512, 1, 1, 2048, 2048, 2048, 1]
    - [81, 244.0]
  - - [2048, 512, 1, 2048, 2048, 2048, 2048, 2048]
    - [49, 15905.0]
  - - [64, 192, 64, 1280, 64, 64, 64, 1280]
    - [53, 13193.0]
  - - [64, 320, 64, 1280, 64, 64, 64, 1280]
    - [56, 11607.0]
  - - [64, 384, 64, 1280, 64, 64, 64, 1280]
    - [80, 11313.0]
  - - [64, 448, 64, 1280, 64, 64, 64, 1280]
    - [80, 8703.0]
  - - [64, 192, 64, 2048, 64, 64, 64, 2048]
    - [68, 12550.0]
  - - [64, 320, 64, 2048, 64, 64, 64, 2048]
    - [68, 11312.0]
  - - [64, 384, 64, 2048, 64, 64, 64, 2048]
    - [68, 11556.0]
  - - [64, 448, 64, 2048, 64, 64, 64, 2048]
    - [80, 11417.0]
  - - [1225, 64, 64, 192, 1225, 1225, 1225, 192]
    - [69, 17033.0]
  - - [1225, 64, 64, 256, 1225, 1225, 1225, 256]
    - [72, 16968.0]
  - - [1225, 64, 64, 288, 1225, 1225, 1225, 288]
    - [71, 18163.0]
  - - [5329, 80, 64, 64, 5329, 5329, 5329, 64]
    - [46, 10338.0]
  - - [64, 192, 32, 1280, 64, 64, 64, 1280]
    - [65, 11367.0]
  - - [64, 320, 32, 1280, 64, 64, 64, 1280]
    - [77, 13847.0]
  - - [64, 384, 32, 1280, 64, 64, 64, 1280]
    - [53, 13006.0]
  - - [64, 448, 32, 1280, 64, 64, 64, 1280]
    - [77, 11789.0]
  - - [64, 192, 32, 2048, 64, 64, 64, 2048]
    - [65, 11371.0]
  - - [64, 320, 32, 2048, 64, 64, 64, 2048]
    - [77, 13203.0]
  - - [64, 384, 32, 2048, 64, 64, 64, 2048]
    - [77, 12468.0]
  - - [64, 448, 32, 2048, 64, 64, 64, 2048]
    - [53, 11791.0]
  - - [1225, 64, 32, 192, 1225, 1225, 1225, 192]
    - [72, 13395.0]
  - - [1225, 64, 32, 256, 1225, 1225, 1225, 256]
    - [78, 15147.0]
  - - [1225, 64, 32, 288, 1225, 1225, 1225, 288]
    - [78, 15485.0]
  - - [5329, 80, 32, 64, 5329, 5329, 5329, 64]
    - [78, 9521.0]
  - - [289, 128, 32, 768, 289, 289, 289, 768]
    - [79, 12973.0]
  - - [289, 160, 32, 768, 289, 289, 289, 768]
    - [71, 10585.0]
  - - [289, 192, 32, 768, 289, 289, 289, 768]
    - [48, 12606.0]
  - - [3136, 64, 32, 64, 3136, 3136, 3136, 64]
    - [64, 14096.0]
  - - [3136, 64, 32, 256, 3136, 3136, 3136, 256]
    - [72, 17462.0]
  - - [196, 256, 32, 1024, 196, 196, 196, 1024]
    - [66, 13361.0]
  - - [960, 1024, 1, 1024, 960, 960, 960, 1024]
    - [49, 14418.0]
  - - [64, 512, 16, 512, 64, 64, 64, 512]
    - [77, 9986.0]
  - - [64, 512, 128, 512, 64, 64, 64, 512]
    - [56, 11901.0]
  - - [1024, 512, 1, 2, 1024, 1024, 1024, 2]
    - [70, 350.0]
  - - [1024, 512, 1, 4096, 1024, 1024, 1024, 4096]
    - [53, 15076.0]
  - - [1024, 616, 1, 1024, 1024, 1024, 1024, 1024]
    - [79, 15313.0]
  - - [64, 128, 128, 128, 64, 64, 64, 128]
    - [59, 10737.0]
  - - [64, 128, 160, 128, 64, 64, 64, 128]
    - [48, 11507.0]
  - - [1024, 1024, 1, 2, 1024, 1024, 1024, 2]
    - [57, 353.0]
  - - [1024, 1024, 1, 4096, 1024, 1024, 1024, 4096]
    - [60, 16207.0]
  - - [64, 128, 624, 128, 64, 64, 64, 128]
    - [77, 14005.0]
  - - [1024, 780, 1, 1024, 1024, 1024, 1024, 1024]
    - [79, 14214.0]
  - - [64, 128, 640, 128, 64, 64, 64, 128]
    - [71, 13066.0]
  - - [1024, 800, 1, 1024, 1024, 1024, 1024, 1024]
    - [61, 15191.0]
  - - [64, 128, 656, 128, 64, 64, 64, 128]
    - [71, 13708.0]
  - - [1024, 820, 1, 1024, 1024, 1024, 1024, 1024]
    - [79, 15487.0]
  - - [64, 512, 80, 512, 64, 64, 64, 512]
    - [56, 11336.0]
  - - [1024, 385, 1, 1024, 1024, 1024, 1024, 1024]
    - [72, 12491.0]
  - - [64, 512, 96, 512, 64, 64, 64, 512]
    - [56, 11541.0]
  - - [1024, 462, 1, 1024, 1024, 1024, 1024, 1024]
    - [79, 11962.0]
  - - [64, 128, 144, 128, 64, 64, 64, 128]
    - [77, 10457.0]
  - - [64, 1024, 32, 1024, 64, 64, 64, 1024]
    - [68, 8824.0]
  - - [96, 1024, 64, 1024, 96, 96, 96, 1024]
    - [67, 14274.0]
  - - [64, 1024, 256, 1024, 64, 64, 64, 1024]
    - [68, 12775.0]
  - - [64, 512, 256, 512, 64, 64, 64, 512]
    - [68, 12517.0]
  - - [64, 1024, 64, 1024, 64, 64, 64, 1024]
    - [80, 11917.0]
  - - [64, 1024, 128, 1024, 64, 64, 64, 1024]
    - [56, 12747.0]
  - - [96, 1024, 128, 1024, 96, 96, 96, 1024]
    - [55, 14499.0]
  - - [64, 512, 40, 512, 64, 64, 64, 512]
    - [68, 11045.0]
  - - [64, 128, 1024, 128, 64, 64, 64, 128]
    - [71, 15921.0]
  - - [1024, 864, 1, 1024, 1024, 1024, 1024, 1024]
    - [79, 16365.0]
  - - [1024, 864, 1, 512, 1024, 1024, 1024, 512]
    - [67, 15460.0]
  - - [256, 3456, 1, 128, 256, 256, 256, 128]
    - [61, 13611.0]
  - - [256, 4096, 1, 128, 256, 256, 256, 128]
    - [49, 13752.0]
  - - [480, 864, 1, 1024, 480, 480, 480, 1024]
    - [78, 13164.0]
  - - [512, 864, 1, 256, 512, 512, 512, 256]
    - [76, 10889.0]
  - - [64, 128, 1280, 128, 64, 64, 64, 128]
    - [59, 14887.0]
  - - [64, 128, 1312, 128, 64, 64, 64, 128]
    - [71, 14119.0]
  - - [64, 512, 192, 512, 64, 64, 64, 512]
    - [56, 12367.0]
  - - [256, 4096, 1, 1, 256, 256, 256, 1]
    - [57, 286.0]
  - - [12544, 64, 1, 147, 12544, 12544, 12544, 147]
    - [70, 12635.0]
  - - [64, 128, 2048, 128, 64, 64, 64, 128]
    - [48, 11676.0]
  - - [64, 128, 1536, 128, 64, 64, 64, 128]
    - [48, 14347.0]
  - - [64, 128, 192, 128, 64, 64, 64, 128]
    - [71, 12520.0]
  - - [64, 384, 144, 384, 64, 64, 64, 384]
    - [59, 15613.0]
  - - [64, 512, 48, 512, 64, 64, 64, 512]
    - [80, 11564.0]
  - - [64, 128, 256, 128, 64, 64, 64, 128]
    - [48, 13503.0]
  - - [64, 384, 192, 384, 64, 64, 64, 384]
    - [48, 17240.0]
  - - [3400, 256, 1, 1024, 3400, 3400, 3400, 1024]
    - [50, 16396.0]
  - - [3800, 256, 1, 1024, 3800, 3800, 3800, 1024]
    - [50, 17878.0]
  - - [864, 512, 2, 2048, 864, 864, 864, 2048]
    - [50, 16265.0]
  - - [888, 512, 2, 2048, 888, 888, 888, 2048]
    - [79, 16613.0]
  - - [51520, 64, 2, 256, 51520, 51520, 51520, 256]
    - [65, 18029.0]
  - - [46464, 64, 2, 256, 46464, 46464, 46464, 256]
    - [78, 17675.0]
  - - [49152, 64, 2, 256, 49152, 49152, 49152, 256]
    - [48, 17892.0]
  - - [1536, 512, 1, 1024, 1536, 1536, 1536, 1024]
    - [49, 16584.0]
  - - [1728, 512, 1, 1024, 1728, 1728, 1728, 1024]
    - [50, 16508.0]
  - - [1024, 1024, 1, 320, 1024, 1024, 1024, 320]
    - [71, 15322.0]
  - - [51520, 64, 2, 64, 51520, 51520, 51520, 64]
    - [51, 14395.0]
  - - [55296, 64, 2, 64, 55296, 55296, 55296, 64]
    - [72, 16098.0]
  - - [49152, 64, 2, 64, 49152, 49152, 49152, 64]
    - [60, 14547.0]
  - - [54400, 64, 2, 64, 54400, 54400, 54400, 64]
    - [54, 15803.0]
  - - [42240, 64, 2, 256, 42240, 42240, 42240, 256]
    - [78, 17920.0]
  - - [672, 512, 2, 2048, 672, 672, 672, 2048]
    - [54, 14604.0]
  - - [54400, 64, 2, 256, 54400, 54400, 54400, 256]
    - [49, 17858.0]
  - - [56832, 64, 2, 256, 56832, 56832, 56832, 256]
    - [49, 17872.0]
  - - [55296, 64, 2, 256, 55296, 55296, 55296, 256]
    - [65, 18321.0]
  - - [60800, 64, 2, 64, 60800, 60800, 60800, 64]
    - [52, 15545.0]
  - - [768, 512, 2, 2048, 768, 768, 768, 2048]
    - [66, 16777.0]
  - - [43008, 64, 2, 256, 43008, 43008, 43008, 256]
    - [78, 17731.0]
  - - [864, 256, 2, 2048, 864, 864, 864, 2048]
    - [49, 14940.0]
  - - [768, 256, 2, 2048, 768, 768, 768, 2048]
    - [49, 13553.0]
  - - [45632, 64, 2, 256, 45632, 45632, 45632, 256]
    - [49, 16599.0]
  - - [60800, 64, 2, 256, 60800, 60800, 60800, 256]
    - [72, 17868.0]
  - - [1024, 1024, 1, 81, 1024, 1024, 1024, 81]
    - [75, 11235.0]
  - - [950, 512, 2, 2048, 950, 950, 950, 2048]
    - [54, 15007.0]
  - - [850, 512, 2, 2048, 850, 850, 850, 2048]
    - [79, 15942.0]
  - - [805, 512, 2, 2048, 805, 805, 805, 2048]
    - [67, 15130.0]
  - - [950, 256, 2, 2048, 950, 950, 950, 2048]
    - [65, 13194.0]
  - - [1900, 512, 1, 1024, 1900, 1900, 1900, 1024]
    - [55, 16907.0]
  - - [1700, 512, 1, 1024, 1700, 1700, 1700, 1024]
    - [50, 15330.0]
  - - [1610, 512, 1, 1024, 1610, 1610, 1610, 1024]
    - [50, 14726.0]
  - - [660, 512, 2, 2048, 660, 660, 660, 2048]
    - [54, 13861.0]
  - - [726, 512, 2, 2048, 726, 726, 726, 2048]
    - [54, 15235.0]
  - - [713, 512, 2, 2048, 713, 713, 713, 2048]
    - [54, 14920.0]
  - - [805, 256, 2, 2048, 805, 805, 805, 2048]
    - [60, 13743.0]
  - - [850, 256, 2, 2048, 850, 850, 850, 2048]
    - [49, 13953.0]
  - - [100, 128, 120, 512, 100, 100, 100, 512]
    - [67, 13029.0]
  - - [100, 128, 139, 512, 100, 100, 100, 512]
    - [79, 13330.0]
  - - [100, 128, 160, 512, 100, 100, 100, 512]
    - [55, 13200.0]
  - - [22500, 64, 1, 147, 22500, 22500, 22500, 147]
    - [70, 11605.0]
  - - [96, 1024, 160, 1024, 96, 96, 96, 1024]
    - [79, 14564.0]
  - - [96, 1024, 40, 1024, 96, 96, 96, 1024]
    - [55, 14571.0]
  - - [96, 1024, 80, 1024, 96, 96, 96, 1024]
    - [67, 14362.0]
  - - [96, 1024, 96, 1024, 96, 96, 96, 1024]
    - [67, 14409.0]
  - - [96, 1024, 24, 1024, 96, 96, 96, 1024]
    - [55, 13925.0]
  - - [96, 1024, 48, 1024, 96, 96, 96, 1024]
    - [67, 14090.0]
  - - [96, 1024, 16, 1024, 96, 96, 96, 1024]
    - [55, 13118.0]
  - - [96, 1024, 32, 1024, 96, 96, 96, 1024]
    - [67, 14257.0]
  - - [64, 512, 320, 512, 64, 64, 64, 512]
    - [80, 12478.0]
  - - [64, 1024, 512, 1024, 64, 64, 64, 1024]
    - [56, 12876.0]
  - - [1024, 77, 1, 30522, 1024, 1024, 1024, 30522]
    - [83, 8710.0]
  - - [1024, 200, 1, 30522, 1024, 1024, 1024, 30522]
    - [83, 11179.0]
  - - [1024, 160, 1, 30522, 1024, 1024, 1024, 30522]
    - [87, 13798.0]
  - - [1024, 180, 1, 30522, 1024, 1024, 1024, 30522]
    - [87, 15556.0]
  - - [1024, 160, 1, 30528, 1024, 1024, 1024, 30528]
    - [82, 13812.0]
  - - [1024, 240, 1, 30528, 1024, 1024, 1024, 30528]
    - [82, 15197.0]
  - - [2560, 109, 1, 29000, 2560, 2560, 2560, 29000]
    - [88, 15750.0]
  - - [2560, 121, 1, 29000, 2560, 2560, 2560, 29000]
    - [88, 17384.0]
  - - [2560, 65, 1, 29000, 2560, 2560, 2560, 29000]
    - [86, 9662.0]
  - - [2560, 66, 1, 29000, 2560, 2560, 2560, 29000]
    - [86, 9782.0]
  - - [2560, 67, 1, 29000, 2560, 2560, 2560, 29000]
    - [89, 9921.0]
  - - [2560, 69, 1, 29000, 2560, 2560, 2560, 29000]
    - [85, 10227.0]
  - - [2560, 70, 1, 29000, 2560, 2560, 2560, 29000]
    - [88, 10357.0]
  - - [2560, 71, 1, 29000, 2560, 2560, 2560, 29000]
    - [83, 10485.0]
  - - [2560, 73, 1, 29000, 2560, 2560, 2560, 29000]
    - [84, 10780.0]
  - - [2560, 74, 1, 29000, 2560, 2560, 2560, 29000]
    - [85, 10931.0]
  - - [2560, 75, 1, 29000, 2560, 2560, 2560, 29000]
    - [86, 11091.0]
  - - [2560, 77, 1, 29000, 2560, 2560, 2560, 29000]
    - [85, 11329.0]
  - - [2560, 78, 1, 29000, 2560, 2560, 2560, 29000]
    - [88, 11464.0]
  - - [2560, 80, 1, 29000, 2560, 2560, 2560, 29000]
    - [85, 11788.0]
  - - [2560, 81, 1, 29000, 2560, 2560, 2560, 29000]
    - [88, 11896.0]
  - - [2560, 82, 1, 29000, 2560, 2560, 2560, 29000]
    - [86, 12053.0]
  - - [2560, 83, 1, 29000, 2560, 2560, 2560, 29000]
    - [88, 12171.0]
  - - [2560, 84, 1, 29000, 2560, 2560, 2560, 29000]
    - [83, 12330.0]
  - - [2560, 88, 1, 29000, 2560, 2560, 2560, 29000]
    - [85, 12825.0]
  - - [2560, 89, 1, 29000, 2560, 2560, 2560, 29000]
    - [85, 13016.0]
  - - [2560, 90, 1, 29000, 2560, 2560, 2560, 29000]
    - [86, 13169.0]
  - - [2560, 92, 1, 29000, 2560, 2560, 2560, 29000]
    - [86, 13401.0]
  - - [2560, 95, 1, 29000, 2560, 2560, 2560, 29000]
    - [88, 13813.0]
  - - [2560, 98, 1, 29000, 2560, 2560, 2560, 29000]
    - [88, 14212.0]
  - - [2368, 64, 1, 3328, 2368, 2368, 2368, 3328]
    - [113, 7578.0]
  - - [256, 704, 1, 1280, 256, 256, 256, 1280]
    - [100, 7863.0]
  - - [1408, 64, 1, 1280, 1408, 1408, 1408, 1280]
    - [103, 5320.0]
  - - [1024, 256, 1, 3328, 1024, 1024, 1024, 3328]
    - [110, 8183.0]
  - - [704, 128, 1, 1280, 704, 704, 704, 1280]
    - [96, 5186.0]
  - - [64, 3584, 1, 3328, 64, 64, 64, 3328]
    - [100, 8593.0]
  - - [1024, 256, 1, 256, 1024, 1024, 1024, 256]
    - [93, 5939.0]
  - - [448, 448, 1, 256, 448, 448, 448, 256]
    - [110, 5489.0]
  - - [128, 1024, 1, 3328, 128, 128, 128, 3328]
    - [113, 6627.0]
  - - [64, 1856, 1, 1280, 64, 64, 64, 1280]
    - [137, 6943.0]
  - - [448, 256, 1, 256, 448, 448, 448, 256]
    - [113, 3735.0]
  - - [256, 1024, 1, 256, 256, 256, 256, 256]
    - [93, 5907.0]
  - - [1024, 128, 1, 1280, 1024, 1024, 1024, 1280]
    - [96, 6066.0]
  - - [448, 256, 1, 3328, 448, 448, 448, 3328]
    - [113, 7431.0]
  - - [128, 704, 1, 1280, 128, 128, 128, 1280]
    - [111, 5325.0]
  - - [1856, 128, 1, 3328, 1856, 1856, 1856, 3328]
    - [93, 9042.0]
  - - [256, 448, 1, 256, 256, 256, 256, 256]
    - [96, 3784.0]
  - - [448, 448, 1, 3328, 448, 448, 448, 3328]
    - [93, 9004.0]
  - - [1408, 128, 1, 1280, 1408, 1408, 1408, 1280]
    - [110, 7578.0]
  - - [128, 1856, 1, 1280, 128, 128, 128, 1280]
    - [110, 8327.0]
  - - [64, 1408, 1, 3328, 64, 64, 64, 3328]
    - [128, 6083.0]
  - - [256, 704, 1, 256, 256, 256, 256, 256]
    - [125, 5070.0]
  - - [128, 1408, 1, 256, 128, 128, 128, 256]
    - [134, 4786.0]
  - - [256, 448, 1, 3328, 256, 256, 256, 3328]
    - [96, 7446.0]
  - - [64, 2368, 1, 1280, 64, 64, 64, 1280]
    - [100, 6938.0]
  - - [2368, 64, 1, 256, 2368, 2368, 2368, 256]
    - [96, 4429.0]
  - - [704, 128, 1, 3328, 704, 704, 704, 3328]
    - [96, 5880.0]
  - - [4288, 64, 1, 1280, 4288, 4288, 4288, 1280]
    - [93, 8656.0]
  - - [128, 1024, 1, 1280, 128, 128, 128, 1280]
    - [116, 6265.0]
  - - [128, 1024, 1, 256, 128, 128, 128, 256]
    - [130, 3866.0]
  - - [1856, 64, 1, 256, 1856, 1856, 1856, 256]
    - [96, 3909.0]
  - - [704, 128, 1, 256, 704, 704, 704, 256]
    - [96, 2996.0]
  - - [448, 256, 1, 1280, 448, 448, 448, 1280]
    - [96, 6571.0]
  - - [1856, 128, 1, 1280, 1856, 1856, 1856, 1280]
    - [100, 8897.0]
  - - [64, 3584, 1, 256, 64, 64, 64, 256]
    - [116, 5498.0]
  - - [64, 1856, 1, 256, 64, 64, 64, 256]
    - [96, 3939.0]
  - - [256, 1024, 1, 1280, 256, 256, 256, 1280]
    - [93, 8085.0]
  - - [3584, 64, 1, 1280, 3584, 3584, 3584, 1280]
    - [110, 8178.0]
  - - [1408, 128, 1, 3328, 1408, 1408, 1408, 3328]
    - [125, 8167.0]
  - - [64, 2944, 1, 3328, 64, 64, 64, 3328]
    - [100, 7962.0]
  - - [64, 4288, 1, 3328, 64, 64, 64, 3328]
    - [100, 8690.0]
  - - [64, 2944, 1, 256, 64, 64, 64, 256]
    - [100, 4853.0]
  - - [64, 1408, 1, 1280, 64, 64, 64, 1280]
    - [130, 5682.0]
  - - [64, 2944, 1, 1280, 64, 64, 64, 1280]
    - [105, 7622.0]
  - - [704, 256, 1, 256, 704, 704, 704, 256]
    - [110, 4961.0]
  - - [256, 448, 1, 1280, 256, 256, 256, 1280]
    - [130, 6613.0]
  - - [704, 256, 1, 1280, 704, 704, 704, 1280]
    - [110, 7534.0]
  - - [64, 2368, 1, 3328, 64, 64, 64, 3328]
    - [130, 7846.0]
  - - [256, 704, 1, 3328, 256, 256, 256, 3328]
    - [125, 8391.0]
  - - [2944, 64, 1, 1280, 2944, 2944, 2944, 1280]
    - [100, 7805.0]
  - - [128, 1408, 1, 3328, 128, 128, 128, 3328]
    - [125, 8116.0]
  - - [1408, 64, 1, 256, 1408, 1408, 1408, 256]
    - [141, 3433.0]
  - - [64, 2368, 1, 256, 64, 64, 64, 256]
    - [100, 4399.0]
  - - [1024, 128, 1, 3328, 1024, 1024, 1024, 3328]
    - [130, 6544.0]
  - - [2368, 64, 1, 1280, 2368, 2368, 2368, 1280]
    - [96, 6933.0]
  - - [4288, 64, 1, 256, 4288, 4288, 4288, 256]
    - [93, 6341.0]
  - - [64, 4288, 1, 1280, 64, 64, 64, 1280]
    - [116, 8207.0]
  - - [1408, 64, 1, 3328, 1408, 1408, 1408, 3328]
    - [111, 6110.0]
  - - [2944, 64, 1, 256, 2944, 2944, 2944, 256]
    - [93, 5164.0]
  - - [448, 448, 1, 1280, 448, 448, 448, 1280]
    - [125, 8250.0]
  - - [1024, 256, 1, 1280, 1024, 1024, 1024, 1280]
    - [110, 8097.0]
  - - [3584, 64, 1, 3328, 3584, 3584, 3584, 3328]
    - [116, 8728.0]
  - - [256, 1024, 1, 3328, 256, 256, 256, 3328]
    - [93, 8536.0]
  - - [1856, 64, 1, 3328, 1856, 1856, 1856, 3328]
    - [139, 7620.0]
  - - [1856, 64, 1, 1280, 1856, 1856, 1856, 1280]
    - [96, 6757.0]
  - - [1024, 128, 1, 256, 1024, 1024, 1024, 256]
    - [125, 5008.0]
  - - [64, 3584, 1, 1280, 64, 64, 64, 1280]
    - [134, 8331.0]
  - - [3584, 64, 1, 256, 3584, 3584, 3584, 256]
    - [96, 6765.0]
  - - [64, 1856, 1, 3328, 64, 64, 64, 3328]
    - [96, 7700.0]
  - - [1408, 128, 1, 256, 1408, 1408, 1408, 256]
    - [110, 6572.0]
  - - [128, 704, 1, 256, 128, 128, 128, 256]
    - [96, 3060.0]
  - - [128, 704, 1, 3328, 128, 128, 128, 3328]
    - [105, 5920.0]
  - - [128, 1856, 1, 256, 128, 128, 128, 256]
    - [100, 5759.0]
  - - [64, 4288, 1, 256, 64, 64, 64, 256]
    - [100, 6120.0]
  - - [704, 256, 1, 3328, 704, 704, 704, 3328]
    - [93, 8232.0]
  - - [1856, 128, 1, 256, 1856, 1856, 1856, 256]
    - [116, 5928.0]
  - - [4288, 64, 1, 3328, 4288, 4288, 4288, 3328]
    - [125, 8877.0]
  - - [64, 1408, 1, 256, 64, 64, 64, 256]
    - [130, 2920.0]
  - - [2944, 64, 1, 3328, 2944, 2944, 2944, 3328]
    - [93, 8449.0]
  - - [128, 1408, 1, 1280, 128, 128, 128, 1280]
    - [110, 7384.0]
  - - [128, 1856, 1, 3328, 128, 128, 128, 3328]
    - [110, 8913.0]
  - - [1760, 64, 1, 1760, 1760, 1760, 1760, 1760]
    - [105, 6085.0]
  - - [2560, 32, 1, 2560, 2560, 2560, 2560, 2560]
    - [139, 6290.0]
  - - [2048, 128, 1, 2048, 2048, 2048, 2048, 2048]
    - [125, 8159.0]
  - - [4608, 32, 1, 1536, 4608, 4608, 4608, 1536]
    - [121, 6705.0]
  - - [3072, 64, 1, 1024, 3072, 3072, 3072, 1024]
    - [93, 7731.0]
  - - [128, 1500, 1, 1280, 128, 128, 128, 1280]
    - [134, 7753.0]
  - - [4096, 32, 1, 4096, 4096, 4096, 4096, 4096]
    - [139, 6673.0]
  - - [1760, 128, 1, 1760, 1760, 1760, 1760, 1760]
    - [125, 8436.0]
  - - [4096, 64, 1, 4096, 4096, 4096, 4096, 4096]
    - [116, 8573.0]
  - - [7680, 32, 1, 2560, 7680, 7680, 7680, 2560]
    - [110, 9521.0]
  - - [2560, 64, 1, 2560, 2560, 2560, 2560, 2560]
    - [96, 7831.0]
  - - [3072, 32, 1, 1024, 3072, 3072, 3072, 1024]
    - [96, 5227.0]
  - - [6144, 32, 1, 2560, 6144, 6144, 6144, 2560]
    - [93, 8350.0]
  - - [176, 1500, 1, 1408, 176, 176, 176, 1408]
    - [93, 7375.0]
  - - [2048, 64, 1, 2048, 2048, 2048, 2048, 2048]
    - [105, 6243.0]
  - - [8448, 32, 1, 2816, 8448, 8448, 8448, 2816]
    - [93, 8941.0]
  - - [512, 512, 1, 64, 512, 512, 512, 64]
    - [125, 2954.0]
  - - [32, 33, 1600, 33, 32, 32, 32, 33]
    - [132, 3111.0]
  - - [256, 1024, 1, 1, 256, 256, 256, 1]
    - [125, 59.0]
  - - [257, 1024, 1, 4096, 257, 257, 257, 4096]
    - [116, 7394.0]
  - - [512, 200, 1, 1, 512, 512, 512, 1]
    - [101, 55.0]
  - - [512, 200, 1, 32, 512, 512, 512, 32]
    - [142, 953.0]
  - - [512, 215, 1, 2048, 512, 512, 512, 2048]
    - [130, 7125.0]
  - - [512, 256, 1, 2048, 512, 512, 512, 2048]
    - [139, 6721.0]
  - - [560, 200, 1, 1024, 560, 560, 560, 1024]
    - [134, 5129.0]
  - - [768, 215, 1, 2048, 768, 768, 768, 2048]
    - [110, 7272.0]
  - - [768, 256, 1, 2048, 768, 768, 768, 2048]
    - [110, 8538.0]
  - - [1024, 200, 1, 1, 1024, 1024, 1024, 1]
    - [127, 93.0]
  - - [64, 32, 4608, 32, 64, 64, 64, 32]
    - [139, 8820.0]
  - - [64, 34, 4736, 34, 64, 64, 64, 34]
    - [134, 5244.0]
  - - [64, 35, 4608, 32, 64, 64, 64, 32]
    - [93, 5625.0]
  - - [64, 35, 4608, 35, 64, 64, 64, 35]
    - [93, 5344.0]
  - - [64, 33, 1920, 27, 64, 64, 64, 27]
    - [93, 4647.0]
  - - [64, 33, 1920, 33, 64, 64, 64, 33]
    - [93, 4762.0]
  - - [1225, 32, 64, 192, 1225, 1225, 1225, 192]
    - [93, 9798.0]
  - - [1225, 48, 64, 192, 1225, 1225, 1225, 192]
    - [108, 8177.0]
  - - [1225, 48, 64, 256, 1225, 1225, 1225, 256]
    - [134, 7598.0]
  - - [1225, 48, 64, 288, 1225, 1225, 1225, 288]
    - [93, 7608.0]
  - - [1225, 32, 32, 192, 1225, 1225, 1225, 192]
    - [93, 9306.0]
  - - [1225, 48, 32, 192, 1225, 1225, 1225, 192]
    - [93, 7237.0]
  - - [1225, 48, 32, 256, 1225, 1225, 1225, 256]
    - [134, 7383.0]
  - - [1225, 48, 32, 288, 1225, 1225, 1225, 288]
    - [91, 7881.0]
  - - [49, 2048, 64, 512, 49, 49, 49, 512]
    - [139, 7085.0]
  - - [49, 512, 64, 2048, 49, 49, 49, 2048]
    - [139, 6949.0]
  - - [49, 2048, 32, 512, 49, 49, 49, 512]
    - [117, 7055.0]
  - - [49, 512, 32, 2048, 49, 49, 49, 2048]
    - [121, 6571.0]
  - - [49, 2048, 64, 1024, 49, 49, 49, 1024]
    - [134, 7775.0]
  - - [49, 1024, 64, 2048, 49, 49, 49, 2048]
    - [105, 7081.0]
  - - [49, 2048, 32, 1024, 49, 49, 49, 1024]
    - [134, 7463.0]
  - - [49, 1024, 32, 2048, 49, 49, 49, 2048]
    - [139, 6944.0]
  - - [480, 512, 1, 512, 480, 480, 480, 512]
    - [93, 7571.0]
  - - [512, 480, 1, 512, 512, 512, 512, 512]
    - [128, 9014.0]
  - - [512, 512, 1, 512, 512, 512, 512, 512]
    - [125, 8194.0]
  - - [1024, 160, 1, 1024, 1024, 1024, 1024, 1024]
    - [96, 8082.0]
  - - [1024, 200, 1, 1024, 1024, 1024, 1024, 1024]
    - [110, 7066.0]
  - - [1024, 308, 1, 1024, 1024, 1024, 1024, 1024]
    - [110, 8415.0]
  - - [1024, 180, 1, 1024, 1024, 1024, 1024, 1024]
    - [134, 7419.0]
  - - [256, 864, 1, 128, 256, 256, 256, 128]
    - [125, 3988.0]
  - - [3136, 64, 1, 576, 3136, 3136, 3136, 576]
    - [134, 7084.0]
  - - [784, 128, 1, 1152, 784, 784, 784, 1152]
    - [105, 5553.0]
  - - [1024, 128, 1, 1024, 1024, 1024, 1024, 1024]
    - [96, 5795.0]
  - - [1024, 128, 1, 2, 1024, 1024, 1024, 2]
    - [99, 69.0]
  - - [1024, 96, 1, 1024, 1024, 1024, 1024, 1024]
    - [96, 5395.0]
  - - [1024, 96, 1, 2, 1024, 1024, 1024, 2]
    - [133, 51.0]
  - - [49, 2048, 128, 512, 49, 49, 49, 512]
    - [100, 7195.0]
  - - [49, 2048, 256, 512, 49, 49, 49, 512]
    - [134, 7621.0]
  - - [49, 512, 128, 2048, 49, 49, 49, 2048]
    - [121, 7079.0]
  - - [49, 512, 256, 2048, 49, 49, 49, 2048]
    - [139, 7140.0]
  - - [100, 128, 18, 512, 100, 100, 100, 512]
    - [96, 5777.0]
  - - [100, 128, 19, 512, 100, 100, 100, 512]
    - [105, 6080.0]
  - - [1444, 128, 1, 576, 1444, 1444, 1444, 576]
    - [93, 7692.0]
  - - [361, 512, 1, 2304, 361, 361, 361, 2304]
    - [134, 8275.0]
  - - [2560, 35, 1, 29000, 2560, 2560, 2560, 29000]
    - [96, 4720.0]
  - - [2560, 36, 1, 29000, 2560, 2560, 2560, 29000]
    - [105, 4846.0]
  - - [2560, 39, 1, 29000, 2560, 2560, 2560, 29000]
    - [96, 5249.0]
  - - [2560, 40, 1, 29000, 2560, 2560, 2560, 29000]
    - [96, 5413.0]
  - - [2560, 42, 1, 29000, 2560, 2560, 2560, 29000]
    - [96, 5659.0]
  - - [2560, 43, 1, 29000, 2560, 2560, 2560, 29000]
    - [105, 5797.0]
  - - [2560, 44, 1, 29000, 2560, 2560, 2560, 29000]
    - [105, 5927.0]
  - - [2560, 46, 1, 29000, 2560, 2560, 2560, 29000]
    - [96, 6202.0]
  - - [2560, 48, 1, 29000, 2560, 2560, 2560, 29000]
    - [105, 6472.0]
  - - [2560, 49, 1, 29000, 2560, 2560, 2560, 29000]
    - [96, 6632.0]
  - - [2560, 50, 1, 29000, 2560, 2560, 2560, 29000]
    - [96, 6770.0]
  - - [2560, 51, 1, 29000, 2560, 2560, 2560, 29000]
    - [96, 6891.0]
  - - [2560, 53, 1, 29000, 2560, 2560, 2560, 29000]
    - [105, 7151.0]
  - - [2560, 54, 1, 29000, 2560, 2560, 2560, 29000]
    - [105, 7259.0]
  - - [2560, 55, 1, 29000, 2560, 2560, 2560, 29000]
    - [96, 7429.0]
  - - [2560, 56, 1, 29000, 2560, 2560, 2560, 29000]
    - [96, 7568.0]
  - - [2560, 57, 1, 29000, 2560, 2560, 2560, 29000]
    - [96, 7681.0]
  - - [2560, 58, 1, 29000, 2560, 2560, 2560, 29000]
    - [96, 7831.0]
  - - [2560, 59, 1, 29000, 2560, 2560, 2560, 29000]
    - [96, 7976.0]
  - - [2560, 61, 1, 29000, 2560, 2560, 2560, 29000]
    - [96, 8259.0]
  - - [2560, 63, 1, 29000, 2560, 2560, 2560, 29000]
    - [96, 8516.0]
  - - [1909283, 40, 1, 40, 1909283, 1909283, 1909283, 40]
    - [116, 6114.0]
  - - [3818566, 40, 1, 40, 3818566, 3818566, 3818566, 40]
    - [116, 6126.0]
  - - [1760, 32, 1, 1760, 1760, 1760, 1760, 1760]
    - [151, 4775.0]
  - - [7680, 4, 1, 2560, 7680, 7680, 7680, 2560]
    - [164, 2950.0]
  - - [3072, 16, 1, 1024, 3072, 3072, 3072, 1024]
    - [163, 4377.0]
  - - [2048, 16, 1, 2048, 2048, 2048, 2048, 2048]
    - [150, 3861.0]
  - - [3072, 1, 1, 128, 3072, 3072, 3072, 128]
    - [148, 75.0]
  - - [8448, 16, 1, 2816, 8448, 8448, 8448, 2816]
    - [152, 6636.0]
  - - [7680, 2, 1, 2560, 7680, 7680, 7680, 2560]
    - [151, 1484.0]
  - - [4224, 1, 1, 128, 4224, 4224, 4224, 128]
    - [143, 166.0]
  - - [7680, 1, 1, 2560, 7680, 7680, 7680, 2560]
    - [151, 738.0]
  - - [6144, 2, 1, 2560, 6144, 6144, 6144, 2560]
    - [163, 1197.0]
  - - [1760, 16, 1, 1760, 1760, 1760, 1760, 1760]
    - [150, 3048.0]
  - - [6144, 4, 1, 2560, 6144, 6144, 6144, 2560]
    - [164, 2337.0]
  - - [3072, 4, 1, 1024, 3072, 3072, 3072, 1024]
    - [163, 1045.0]
  - - [2048, 32, 1, 2048, 2048, 2048, 2048, 2048]
    - [166, 4971.0]
  - - [4608, 16, 1, 1536, 4608, 4608, 4608, 1536]
    - [153, 5134.0]
  - - [3072, 2, 1, 1024, 3072, 3072, 3072, 1024]
    - [150, 520.0]
  - - [8448, 1, 1, 2816, 8448, 8448, 8448, 2816]
    - [156, 648.0]
  - - [6144, 1, 1, 2560, 6144, 6144, 6144, 2560]
    - [168, 593.0]
  - - [4608, 1, 1, 1536, 4608, 4608, 4608, 1536]
    - [162, 415.0]
  - - [8448, 4, 1, 2816, 8448, 8448, 8448, 2816]
    - [167, 2607.0]
  - - [4608, 2, 1, 1536, 4608, 4608, 4608, 1536]
    - [178, 824.0]
  - - [2560, 16, 1, 2560, 2560, 2560, 2560, 2560]
    - [151, 4340.0]
  - - [6144, 16, 1, 2560, 6144, 6144, 6144, 2560]
    - [164, 6105.0]
  - - [4096, 16, 1, 4096, 4096, 4096, 4096, 4096]
    - [173, 5843.0]
  - - [7680, 16, 1, 2560, 7680, 7680, 7680, 2560]
    - [158, 6785.0]
  - - [3072, 1, 1, 1024, 3072, 3072, 3072, 1024]
    - [179, 242.0]
  - - [8448, 2, 1, 2816, 8448, 8448, 8448, 2816]
    - [154, 1320.0]
  - - [4608, 4, 1, 1536, 4608, 4608, 4608, 1536]
    - [162, 1631.0]
  - - [2048, 2, 1, 2048, 2048, 2048, 2048, 2048]
    - [151, 506.0]
  - - [2048, 2, 1, 2, 2048, 2048, 2048, 2]
    - [143, 2.0]
  - - [2560, 4, 1, 2, 2560, 2560, 2560, 2]
    - [143, 5.0]
  - - [2560, 4, 1, 2560, 2560, 2560, 2560, 2560]
    - [168, 1397.0]
  - - [2048, 1, 1, 512, 2048, 2048, 2048, 512]
    - [150, 189.0]
  - - [12288, 12, 2, 256, 12288, 12288, 12288, 256]
    - [170, 4725.0]
  - - [12288, 3, 2, 256, 12288, 12288, 12288, 256]
    - [172, 1767.0]
  - - [51520, 12, 2, 256, 51520, 51520, 51520, 256]
    - [145, 5703.0]
  - - [51520, 3, 2, 256, 51520, 51520, 51520, 256]
    - [175, 2608.0]
  - - [15200, 12, 2, 256, 15200, 15200, 15200, 256]
    - [147, 4946.0]
  - - [15200, 3, 2, 256, 15200, 15200, 15200, 256]
    - [144, 1911.0]
  - - [3456, 3, 2, 256, 3456, 3456, 3456, 256]
    - [148, 1144.0]
  - - [13600, 12, 2, 256, 13600, 13600, 13600, 256]
    - [160, 4780.0]
  - - [12880, 3, 2, 256, 12880, 12880, 12880, 256]
    - [144, 1856.0]
  - - [3400, 3, 2, 256, 3400, 3400, 3400, 256]
    - [161, 1126.0]
  - - [12880, 12, 2, 256, 12880, 12880, 12880, 256]
    - [177, 4441.0]
  - - [13824, 12, 2, 256, 13824, 13824, 13824, 256]
    - [176, 4876.0]
  - - [13824, 3, 2, 256, 13824, 13824, 13824, 256]
    - [177, 1952.0]
  - - [13600, 3, 2, 256, 13600, 13600, 13600, 256]
    - [149, 1909.0]
  - - [3456, 12, 2, 256, 3456, 3456, 3456, 256]
    - [170, 3360.0]
  - - [3800, 3, 2, 256, 3800, 3800, 3800, 256]
    - [161, 1231.0]
  - - [3400, 12, 2, 256, 3400, 3400, 3400, 256]
    - [170, 3305.0]
  - - [3800, 12, 2, 256, 3800, 3800, 3800, 256]
    - [170, 2671.0]
  - - [55296, 3, 2, 256, 55296, 55296, 55296, 256]
    - [165, 2526.0]
  - - [3072, 3, 2, 256, 3072, 3072, 3072, 256]
    - [161, 1053.0]
  - - [3072, 12, 2, 256, 3072, 3072, 3072, 256]
    - [153, 3432.0]
  - - [54400, 3, 2, 256, 54400, 54400, 54400, 256]
    - [172, 2383.0]
  - - [60800, 12, 2, 256, 60800, 60800, 60800, 256]
    - [152, 5425.0]
  - - [60800, 3, 2, 256, 60800, 60800, 60800, 256]
    - [172, 2393.0]
  - - [3220, 3, 2, 256, 3220, 3220, 3220, 256]
    - [171, 1039.0]
  - - [3220, 12, 2, 256, 3220, 3220, 3220, 256]
    - [146, 3201.0]
  - - [2048, 8, 1, 2, 2048, 2048, 2048, 2]
    - [159, 20.0]
  - - [2048, 8, 1, 2048, 2048, 2048, 2048, 2048]
    - [168, 2276.0]
  - - [2560, 2, 1, 2, 2560, 2560, 2560, 2]
    - [148, 6.0]
  - - [2560, 2, 1, 2560, 2560, 2560, 2560, 2560]
    - [155, 662.0]
  - - [2560, 27, 1, 29000, 2560, 2560, 2560, 29000]
    - [174, 5571.0]
  - - [1909283, 11, 1, 11, 1909283, 1909283, 1909283, 11]
    - [157, 2361.0]
  - - [3818566, 11, 1, 11, 3818566, 3818566, 3818566, 11]
    - [169, 2159.0]
  - - [512, 16, 1, 500000, 512, 512, 512, 500000]
    - [183, 3351.0]
  - - [512, 2, 1, 500000, 512, 512, 512, 500000]
    - [185, 430.0]
  - - [1024, 16, 1, 500000, 1024, 1024, 1024, 500000]
    - [188, 4471.0]
  - - [1024, 4, 1, 500000, 1024, 1024, 1024, 500000]
    - [182, 1129.0]
  - - [512, 8, 1, 500000, 512, 512, 512, 500000]
    - [189, 1705.0]
  - - [512, 1, 1, 500000, 512, 512, 512, 500000]
    - [183, 216.0]
  - - [512, 4, 1, 500000, 512, 512, 512, 500000]
    - [187, 862.0]
  - - [1024, 1, 1, 500000, 1024, 1024, 1024, 500000]
    - [180, 285.0]
  - - [1024, 2, 1, 500000, 1024, 1024, 1024, 500000]
    - [186, 570.0]
  - - [1024, 8, 1, 500000, 1024, 1024, 1024, 500000]
    - [184, 2265.0]
  - - [49, 512, 1, 4608, 49, 49, 49, 4608]
    - [181, 3948.0]
  - - [448, 64, 1, 1280, 448, 448, 448, 1280]
    - [98, 3202.0]
  - - [64, 1024, 1, 1280, 64, 64, 64, 1280]
    - [105, 5668.0]
  - - [64, 704, 1, 1280, 64, 64, 64, 1280]
    - [120, 4161.0]
  - - [256, 128, 1, 256, 256, 256, 256, 256]
    - [138, 1432.0]
  - - [64, 1024, 1, 3328, 64, 64, 64, 3328]
    - [113, 5393.0]
  - - [1024, 64, 1, 1280, 1024, 1024, 1024, 1280]
    - [130, 5066.0]
  - - [256, 256, 1, 3328, 256, 256, 256, 3328]
    - [113, 5650.0]
  - - [64, 448, 1, 1280, 64, 64, 64, 1280]
    - [98, 3502.0]
  - - [64, 64, 1, 3328, 64, 64, 64, 3328]
    - [98, 617.0]
  - - [704, 64, 1, 3328, 704, 704, 704, 3328]
    - [112, 4233.0]
  - - [64, 128, 1, 256, 64, 64, 64, 256]
    - [138, 414.0]
  - - [704, 64, 1, 1280, 704, 704, 704, 1280]
    - [129, 3578.0]
  - - [128, 448, 1, 256, 128, 128, 128, 256]
    - [138, 2211.0]
  - - [448, 64, 1, 3328, 448, 448, 448, 3328]
    - [98, 3534.0]
  - - [64, 128, 1, 3328, 64, 64, 64, 3328]
    - [122, 1245.0]
  - - [128, 128, 1, 3328, 128, 128, 128, 3328]
    - [115, 2632.0]
  - - [256, 256, 1, 256, 256, 256, 256, 256]
    - [112, 3600.0]
  - - [128, 64, 1, 1280, 128, 128, 128, 1280]
    - [106, 1211.0]
  - - [64, 1024, 1, 256, 64, 64, 64, 256]
    - [105, 3510.0]
  - - [64, 704, 1, 256, 64, 64, 64, 256]
    - [120, 1814.0]
  - - [1, 1, 1, 1280, 1, 1, 1, 1280]
    - [94, 0.08]
  - - [256, 64, 1, 3328, 256, 256, 256, 3328]
    - [98, 2367.0]
  - - [448, 128, 1, 256, 448, 448, 448, 256]
    - [95, 2159.0]
  - - [64, 704, 1, 3328, 64, 64, 64, 3328]
    - [95, 4088.0]
  - - [64, 448, 1, 3328, 64, 64, 64, 3328]
    - [115, 3488.0]
  - - [448, 128, 1, 3328, 448, 448, 448, 3328]
    - [96, 4632.0]
  - - [128, 256, 1, 1280, 128, 128, 128, 1280]
    - [138, 3548.0]
  - - [64, 448, 1, 256, 64, 64, 64, 256]
    - [138, 2224.0]
  - - [64, 256, 1, 1280, 64, 64, 64, 1280]
    - [98, 2310.0]
  - - [64, 128, 1, 1280, 64, 64, 64, 1280]
    - [106, 1214.0]
  - - [64, 64, 1, 256, 64, 64, 64, 256]
    - [120, 193.0]
  - - [256, 128, 1, 1280, 256, 256, 256, 1280]
    - [138, 2869.0]
  - - [128, 256, 1, 3328, 128, 128, 128, 3328]
    - [120, 3518.0]
  - - [256, 64, 1, 256, 256, 256, 256, 256]
    - [118, 736.0]
  - - [128, 128, 1, 1280, 128, 128, 128, 1280]
    - [115, 1817.0]
  - - [128, 256, 1, 256, 128, 128, 128, 256]
    - [102, 2118.0]
  - - [256, 64, 1, 1280, 256, 256, 256, 1280]
    - [98, 1817.0]
  - - [704, 64, 1, 256, 704, 704, 704, 256]
    - [113, 2622.0]
  - - [128, 448, 1, 1280, 128, 128, 128, 1280]
    - [105, 4253.0]
  - - [64, 64, 1, 1280, 64, 64, 64, 1280]
    - [114, 561.0]
  - - [128, 64, 1, 3328, 128, 128, 128, 3328]
    - [141, 1374.0]
  - - [448, 64, 1, 256, 448, 448, 448, 256]
    - [138, 1301.0]
  - - [1024, 64, 1, 256, 1024, 1024, 1024, 256]
    - [115, 3073.0]
  - - [1, 1, 1, 1, 1, 1, 1, 1]
    - [135, 0.0001984126908217979]
  - - [448, 128, 1, 1280, 448, 448, 448, 1280]
    - [105, 4087.0]
  - - [1024, 64, 1, 3328, 1024, 1024, 1024, 3328]
    - [113, 5002.0]
  - - [128, 64, 1, 256, 128, 128, 128, 256]
    - [118, 384.0]
  - - [64, 256, 1, 3328, 64, 64, 64, 3328]
    - [98, 2332.0]
  - - [256, 256, 1, 1280, 256, 256, 256, 1280]
    - [121, 5357.0]
  - - [256, 128, 1, 3328, 256, 256, 256, 3328]
    - [120, 3460.0]
  - - [64, 256, 1, 256, 64, 64, 64, 256]
    - [104, 757.0]
  - - [1, 1, 1, 256, 1, 1, 1, 256]
    - [94, 0.04]
  - - [128, 448, 1, 3328, 128, 128, 128, 3328]
    - [113, 4766.0]
  - - [128, 128, 1, 256, 128, 128, 128, 256]
    - [102, 741.0]
  - - [1024, 16, 1, 512, 1024, 1024, 1024, 512]
    - [106, 1121.0]
  - - [512, 16, 1, 512, 512, 512, 512, 512]
    - [141, 579.0]
  - - [128, 1, 1, 1408, 128, 128, 128, 1408]
    - [98, 12.0]
  - - [64, 1, 1, 1216, 64, 64, 64, 1216]
    - [97, 7.0]
  - - [1024, 2, 1, 512, 1024, 1024, 1024, 512]
    - [122, 141.0]
  - - [512, 1, 1, 512, 512, 512, 512, 512]
    - [141, 53.0]
  - - [1024, 4, 1, 512, 1024, 1024, 1024, 512]
    - [98, 280.0]
  - - [512, 4, 1, 512, 512, 512, 512, 512]
    - [106, 144.0]
  - - [1024, 32, 1, 512, 1024, 1024, 1024, 512]
    - [122, 1978.0]
  - - [512, 2, 1, 512, 512, 512, 512, 512]
    - [141, 72.0]
  - - [1024, 1, 1, 512, 1024, 1024, 1024, 512]
    - [122, 70.0]
  - - [512, 32, 1, 512, 512, 512, 512, 512]
    - [141, 1159.0]
  - - [128, 1, 1, 1024, 128, 128, 128, 1024]
    - [98, 13.0]
  - - [64, 14, 1, 14, 64, 64, 64, 14]
    - [90, 3.0]
  - - [64, 14, 1, 15, 64, 64, 64, 15]
    - [90, 3.0]
  - - [64, 15, 1, 15, 64, 64, 64, 15]
    - [120, 7.0]
  - - [64, 15, 1, 17, 64, 64, 64, 17]
    - [90, 4.0]
  - - [64, 17, 1, 17, 64, 64, 64, 17]
    - [90, 4.0]
  - - [64, 17, 1, 21, 64, 64, 64, 21]
    - [90, 5.0]
  - - [64, 21, 1, 21, 64, 64, 64, 21]
    - [129, 7.0]
  - - [64, 24, 1, 24, 64, 64, 64, 24]
    - [94, 9.0]
  - - [64, 24, 1, 34, 64, 64, 64, 34]
    - [108, 16.0]
  - - [64, 30, 1, 30, 64, 64, 64, 30]
    - [94, 13.0]
  - - [64, 31, 1, 30, 64, 64, 64, 30]
    - [107, 14.0]
  - - [64, 31, 1, 31, 64, 64, 64, 31]
    - [98, 15.0]
  - - [64, 32, 1, 32, 64, 64, 64, 32]
    - [126, 17.0]
  - - [64, 34, 1, 34, 64, 64, 64, 34]
    - [95, 17.0]
  - - [64, 35, 1, 32, 64, 64, 64, 32]
    - [135, 17.0]
  - - [64, 35, 1, 35, 64, 64, 64, 35]
    - [109, 18.0]
  - - [64, 512, 1, 512, 64, 64, 64, 512]
    - [120, 2162.0]
  - - [1024, 4, 1, 2, 1024, 1024, 1024, 2]
    - [90, 2.0]
  - - [1024, 4, 1, 1024, 1024, 1024, 1024, 1024]
    - [106, 393.0]
  - - [1024, 32, 1, 2, 1024, 1024, 1024, 2]
    - [94, 17.0]
  - - [1024, 32, 1, 1024, 1024, 1024, 1024, 1024]
    - [115, 2593.0]
  - - [32, 200, 1, 1, 32, 32, 32, 1]
    - [90, 2.0]
  - - [64, 3, 512, 3, 64, 64, 64, 3]
    - [123, 53.0]
  - - [64, 5, 512, 5, 64, 64, 64, 5]
    - [110, 145.0]
  - - [64, 5, 960, 5, 64, 64, 64, 5]
    - [110, 213.0]
  - - [64, 9, 512, 9, 64, 64, 64, 9]
    - [124, 427.0]
  - - [64, 512, 1, 1, 64, 64, 64, 1]
    - [123, 9.0]
  - - [67, 512, 1, 2048, 67, 67, 67, 2048]
    - [138, 2925.0]
  - - [74, 512, 1, 2048, 74, 74, 74, 2048]
    - [138, 3239.0]
  - - [74, 960, 1, 2048, 74, 74, 74, 2048]
    - [105, 4348.0]
  - - [100, 512, 1, 2048, 100, 100, 100, 2048]
    - [139, 4211.0]
  - - [128, 27, 32768, 27, 128, 128, 128, 27]
    - [100, 4000.0]
  - - [64, 14, 10880, 14, 64, 64, 64, 14]
    - [100, 2832.0]
  - - [64, 14, 10880, 15, 64, 64, 64, 15]
    - [100, 2896.0]
  - - [64, 15, 7680, 15, 64, 64, 64, 15]
    - [100, 3052.0]
  - - [64, 15, 10880, 15, 64, 64, 64, 15]
    - [100, 3102.0]
  - - [64, 15, 7680, 17, 64, 64, 64, 17]
    - [93, 3441.0]
  - - [64, 17, 6144, 17, 64, 64, 64, 17]
    - [93, 3386.0]
  - - [64, 17, 7680, 17, 64, 64, 64, 17]
    - [93, 3439.0]
  - - [64, 17, 6144, 21, 64, 64, 64, 21]
    - [93, 3979.0]
  - - [64, 21, 6144, 21, 64, 64, 64, 21]
    - [100, 4707.0]
  - - [64, 24, 4736, 24, 64, 64, 64, 24]
    - [93, 6377.0]
  - - [64, 24, 4736, 34, 64, 64, 64, 34]
    - [125, 6999.0]
  - - [64, 30, 2048, 30, 64, 64, 64, 30]
    - [113, 6665.0]
  - - [64, 31, 2048, 30, 64, 64, 64, 30]
    - [113, 6780.0]
  - - [64, 31, 2048, 31, 64, 64, 64, 31]
    - [113, 6831.0]
  - - [64, 27, 1920, 27, 64, 64, 64, 27]
    - [93, 5684.0]
  - - [1024, 8, 1, 1024, 1024, 1024, 1024, 1024]
    - [122, 958.0]
  - - [1024, 77, 1, 1024, 1024, 1024, 1024, 1024]
    - [96, 4941.0]
  - - [1024, 10, 1, 2, 1024, 1024, 1024, 2]
    - [90, 5.0]
  - - [1024, 10, 1, 1024, 1024, 1024, 1024, 1024]
    - [122, 1012.0]
  - - [1024, 39, 1, 2, 1024, 1024, 1024, 2]
    - [94, 21.0]
  - - [1024, 39, 1, 1024, 1024, 1024, 1024, 1024]
    - [129, 3016.0]
  - - [1024, 40, 1, 2, 1024, 1024, 1024, 2]
    - [92, 21.0]
  - - [1024, 40, 1, 1024, 1024, 1024, 1024, 1024]
    - [129, 3017.0]
  - - [1024, 41, 1, 2, 1024, 1024, 1024, 2]
    - [101, 21.0]
  - - [1024, 41, 1, 1024, 1024, 1024, 1024, 1024]
    - [129, 3084.0]
  - - [1024, 5, 1, 2, 1024, 1024, 1024, 2]
    - [101, 3.0]
  - - [1024, 5, 1, 1024, 1024, 1024, 1024, 1024]
    - [122, 489.0]
  - - [1024, 6, 1, 2, 1024, 1024, 1024, 2]
    - [90, 3.0]
  - - [1024, 6, 1, 1024, 1024, 1024, 1024, 1024]
    - [106, 590.0]
  - - [1024, 8, 1, 2, 1024, 1024, 1024, 2]
    - [90, 4.0]
  - - [1024, 9, 1, 2, 1024, 1024, 1024, 2]
    - [94, 5.0]
  - - [1024, 9, 1, 1024, 1024, 1024, 1024, 1024]
    - [106, 872.0]
  - - [64, 4, 32768, 4, 64, 64, 64, 4]
    - [110, 327.0]
  - - [64, 4, 38400, 4, 64, 64, 64, 4]
    - [93, 331.0]
  - - [128, 128, 1, 64, 128, 128, 128, 64]
    - [112, 546.0]
  - - [64, 128, 1, 128, 64, 64, 64, 128]
    - [102, 437.0]
  - - [64, 5, 1, 5, 64, 64, 64, 5]
    - [140, 1.0]
  - - [32, 33, 1, 33, 32, 32, 32, 33]
    - [92, 8.0]
  - - [1024, 16, 1, 2, 1024, 1024, 1024, 2]
    - [101, 9.0]
  - - [1024, 16, 1, 1024, 1024, 1024, 1024, 1024]
    - [106, 1626.0]
  - - [1024, 1, 1, 2, 1024, 1024, 1024, 2]
    - [92, 1.0]
  - - [1024, 1, 1, 1024, 1024, 1024, 1024, 1024]
    - [98, 99.0]
  - - [1024, 1, 1, 200, 1024, 1024, 1024, 200]
    - [104, 37.0]
  - - [1024, 1, 1, 1600, 1024, 1024, 1024, 1600]
    - [98, 117.0]
  - - [1024, 64, 1, 2, 1024, 1024, 1024, 2]
    - [94, 35.0]
  - - [1024, 64, 1, 1024, 1024, 1024, 1024, 1024]
    - [130, 4231.0]
  - - [1024, 80, 1, 1024, 1024, 1024, 1024, 1024]
    - [130, 4472.0]
  - - [1024, 80, 1, 2, 1024, 1024, 1024, 2]
    - [99, 42.0]
  - - [1024, 82, 1, 1024, 1024, 1024, 1024, 1024]
    - [96, 4579.0]
  - - [1024, 82, 1, 2, 1024, 1024, 1024, 2]
    - [94, 43.0]
  - - [1024, 12, 1, 1024, 1024, 1024, 1024, 1024]
    - [131, 1208.0]
  - - [1024, 12, 1, 2, 1024, 1024, 1024, 2]
    - [99, 7.0]
  - - [64, 24, 6816, 24, 64, 64, 64, 24]
    - [116, 5119.0]
  - - [64, 26, 6272, 26, 64, 64, 64, 26]
    - [139, 5876.0]
  - - [196, 256, 1, 2304, 196, 196, 196, 2304]
    - [137, 4650.0]
  - - [768, 3, 2, 256, 768, 768, 768, 256]
    - [102, 322.0]
  - - [768, 12, 2, 256, 768, 768, 768, 256]
    - [120, 789.0]
  - - [864, 12, 2, 256, 864, 864, 864, 256]
    - [120, 870.0]
  - - [864, 3, 2, 256, 864, 864, 864, 256]
    - [102, 218.0]
  - - [216, 3, 2, 256, 216, 216, 216, 256]
    - [98, 56.0]
  - - [176, 12, 2, 256, 176, 176, 176, 256]
    - [104, 192.0]
  - - [176, 3, 2, 256, 176, 176, 176, 256]
    - [102, 47.0]
  - - [192, 12, 2, 256, 192, 192, 192, 256]
    - [136, 208.0]
  - - [192, 3, 2, 256, 192, 192, 192, 256]
    - [120, 53.0]
  - - [216, 12, 2, 256, 216, 216, 216, 256]
    - [102, 232.0]
  - - [850, 3, 2, 256, 850, 850, 850, 256]
    - [136, 220.0]
  - - [850, 12, 2, 256, 850, 850, 850, 256]
    - [138, 848.0]
  - - [805, 12, 2, 256, 805, 805, 805, 256]
    - [104, 816.0]
  - - [805, 3, 2, 256, 805, 805, 805, 256]
    - [102, 205.0]
  - - [247, 3, 2, 256, 247, 247, 247, 256]
    - [136, 65.0]
  - - [950, 3, 2, 256, 950, 950, 950, 256]
    - [102, 234.0]
  - - [187, 12, 2, 256, 187, 187, 187, 256]
    - [102, 191.0]
  - - [247, 12, 2, 256, 247, 247, 247, 256]
    - [102, 258.0]
  - - [187, 3, 2, 256, 187, 187, 187, 256]
    - [133, 58.0]
  - - [228, 12, 2, 256, 228, 228, 228, 256]
    - [136, 237.0]
  - - [221, 12, 2, 256, 221, 221, 221, 256]
    - [120, 236.0]
  - - [950, 12, 2, 256, 950, 950, 950, 256]
    - [104, 915.0]
  - - [228, 3, 2, 256, 228, 228, 228, 256]
    - [90, 63.0]
  - - [221, 3, 2, 256, 221, 221, 221, 256]
    - [102, 58.0]
  - - [25, 128, 120, 256, 25, 25, 25, 256]
    - [119, 3867.0]
  - - [25, 128, 139, 256, 25, 25, 25, 256]
    - [99, 4141.0]
  - - [25, 128, 160, 256, 25, 25, 25, 256]
    - [103, 4001.0]
  - - [25, 128, 18, 256, 25, 25, 25, 256]
    - [95, 1825.0]
  - - [25, 128, 19, 256, 25, 25, 25, 256]
    - [95, 1907.0]
  - - [9, 128, 120, 256, 9, 9, 9, 256]
    - [102, 1617.0]
  - - [9, 128, 139, 256, 9, 9, 9, 256]
    - [118, 1765.0]
  - - [9, 128, 160, 256, 9, 9, 9, 256]
    - [118, 1809.0]
  - - [9, 128, 18, 256, 9, 9, 9, 256]
    - [102, 781.0]
  - - [9, 128, 19, 256, 9, 9, 9, 256]
    - [118, 824.0]
  - - [100, 512, 1, 2304, 100, 100, 100, 2304]
    - [139, 4201.0]
  - - [25, 256, 1, 1152, 25, 25, 25, 1152]
    - [141, 678.0]
  - - [9, 256, 1, 1152, 9, 9, 9, 1152]
    - [120, 245.0]
  - - [1024, 20, 1, 1024, 1024, 1024, 1024, 1024]
    - [98, 1644.0]
  - - [1024, 20, 1, 2, 1024, 1024, 1024, 2]
    - [90, 10.0]
- null
- null
- DeviceEfficiency
...
