library/src/blas3/Tensile/Logic/asm_full/navi22_Cijk_Alik_Bjlk_HB_GB.yaml
---
- {MinimumRequiredVersion: 4.28.0}
- navi22
- gfx1031
    SolutionIndex: 0
    SolutionNameMin: Cijk_Alik_Bjlk_HB_GB_MT128x256x8_SN_SU0_SUM0_TT8_16_WG16_16_1_WGM1
    SolutionIndex: 1
    SolutionNameMin: Cijk_Alik_Bjlk_HB_GB_MT128x64x16_SN_SU0_SUM0_TT8_8_WG16_8_1_WGM1
    SolutionIndex: 2
    SolutionNameMin: Cijk_Alik_Bjlk_HB_GB_MT128x128x16_SN_SU0_SUM0_TT8_16_WG16_8_1_WGM1
    SolutionIndex: 3
    SolutionNameMin: Cijk_Alik_Bjlk_HB_GB_MT128x128x16_SN_SU0_SUM0_TT8_8_WG16_16_1_WGM1
    SolutionIndex: 4
    SolutionNameMin: Cijk_Alik_Bjlk_HB_GB_MT128x256x16_SN_SU0_SUM0_TT8_16_WG16_16_1_WGM1
    SolutionIndex: 5
    SolutionNameMin: Cijk_Alik_Bjlk_HB_GB_MT128x256x8_SN_SU32_SUM3_TT8_16_WG16_16_1_WGM1
    SolutionIndex: 6
    SolutionNameMin: Cijk_Alik_Bjlk_HB_GB_MT128x128x16_SN_SU32_SUM3_TT8_16_WG16_8_1_WGM1
    SolutionIndex: 7
    SolutionNameMin: Cijk_Alik_Bjlk_HB_GB_MT128x128x16_SN_SU32_SUM3_TT8_8_WG16_16_1_WGM1
    SolutionIndex: 8
    SolutionNameMin: Cijk_Alik_Bjlk_HB_GB_MT128x256x16_SN_SU32_SUM3_TT8_16_WG16_16_1_WGM1
    SolutionIndex: 9
    SolutionNameMin: Cijk_Alik_Bjlk_HB_GB_MT128x256x8_SN_SU0_SUM0_TT8_16_WG16_16_1_WGM4
    SolutionIndex: 10
    SolutionNameMin: Cijk_Alik_Bjlk_HB_GB_MT128x64x16_SN_SU0_SUM0_TT8_8_WG16_8_1_WGM4
    SolutionIndex: 11
    SolutionNameMin: Cijk_Alik_Bjlk_HB_GB_MT128x128x16_SN_SU0_SUM0_TT8_16_WG16_8_1_WGM4
    SolutionIndex: 12
    SolutionNameMin: Cijk_Alik_Bjlk_HB_GB_MT256x128x16_SN_SU0_SUM0_TT16_16_WG16_8_1_WGM4
    SolutionIndex: 13
    SolutionNameMin: Cijk_Alik_Bjlk_HB_GB_MT128x128x16_SN_SU0_SUM0_TT8_8_WG16_16_1_WGM4
    SolutionIndex: 14
    SolutionNameMin: Cijk_Alik_Bjlk_HB_GB_MT128x256x16_SN_SU0_SUM0_TT8_16_WG16_16_1_WGM4
    SolutionIndex: 15
    SolutionNameMin: Cijk_Alik_Bjlk_HB_GB_MT128x256x8_SN_SU32_SUM3_TT8_16_WG16_16_1_WGM4
    SolutionIndex: 16
    SolutionNameMin: Cijk_Alik_Bjlk_HB_GB_MT128x64x16_SN_SU32_SUM3_TT8_8_WG16_8_1_WGM4
    SolutionIndex: 17
    SolutionNameMin: Cijk_Alik_Bjlk_HB_GB_MT128x128x16_SN_SU32_SUM3_TT8_16_WG16_8_1_WGM4
    SolutionIndex: 18
    SolutionNameMin: Cijk_Alik_Bjlk_HB_GB_MT128x128x16_SN_SU32_SUM3_TT8_8_WG16_16_1_WGM4
    SolutionIndex: 19
    SolutionNameMin: Cijk_Alik_Bjlk_HB_GB_MT128x256x16_SN_SU32_SUM3_TT8_16_WG16_16_1_WGM4
    SolutionIndex: 20
    SolutionNameMin: Cijk_Alik_Bjlk_HB_GB_MT128x128x8_SN_SU0_SUM0_TT8_16_WG16_8_1_WGM8
    SolutionIndex: 21
    SolutionNameMin: Cijk_Alik_Bjlk_HB_GB_MT128x256x8_SN_SU0_SUM0_TT8_16_WG16_16_1_WGM8
    SolutionIndex: 22
    SolutionNameMin: Cijk_Alik_Bjlk_HB_GB_MT128x64x16_SN_SU0_SUM0_TT8_8_WG16_8_1_WGM8
    SolutionIndex: 23
    SolutionNameMin: Cijk_Alik_Bjlk_HB_GB_MT128x128x16_SN_SU0_SUM0_TT8_16_WG16_8_1_WGM8
    SolutionIndex: 24
    SolutionNameMin: Cijk_Alik_Bjlk_HB_GB_MT256x128x16_SN_SU0_SUM0_TT16_16_WG16_8_1_WGM8
    SolutionIndex: 25
    SolutionNameMin: Cijk_Alik_Bjlk_HB_GB_MT128x128x16_SN_SU0_SUM0_TT8_8_WG16_16_1_WGM8
    SolutionIndex: 26
    SolutionNameMin: Cijk_Alik_Bjlk_HB_GB_MT128x256x16_SN_SU0_SUM0_TT8_16_WG16_16_1_WGM8
    SolutionIndex: 27
    SolutionNameMin: Cijk_Alik_Bjlk_HB_GB_MT128x256x8_SN_SU32_SUM3_TT8_16_WG16_16_1_WGM8
    SolutionIndex: 28
    SolutionNameMin: Cijk_Alik_Bjlk_HB_GB_MT128x128x16_SN_SU32_SUM3_TT8_16_WG16_8_1_WGM8
    SolutionIndex: 29
    SolutionNameMin: Cijk_Alik_Bjlk_HB_GB_MT128x128x16_SN_SU32_SUM3_TT8_8_WG16_16_1_WGM8
    SolutionIndex: 30
    SolutionNameMin: Cijk_Alik_Bjlk_HB_GB_MT128x256x16_SN_SU32_SUM3_TT8_16_WG16_16_1_WGM8
    SolutionIndex: 31
    SolutionNameMin: Cijk_Alik_Bjlk_HB_GB_MT64x64x16_SN_SU0_SUM0_TT8_8_WG8_8_1_WGM1
    SolutionIndex: 32
    SolutionNameMin: Cijk_Alik_Bjlk_HB_GB_MT128x64x16_SN_SU0_SUM0_TT8_8_WG16_8_1_WGM1
    SolutionIndex: 33
    SolutionNameMin: Cijk_Alik_Bjlk_HB_GB_MT128x128x16_SN_SU0_SUM0_TT8_8_WG16_16_1_WGM1
    SolutionIndex: 34
    SolutionNameMin: Cijk_Alik_Bjlk_HB_GB_MT64x64x16_SN_SU32_SUM3_TT8_8_WG8_8_1_WGM1
    SolutionIndex: 35
    SolutionNameMin: Cijk_Alik_Bjlk_HB_GB_MT128x64x16_SN_SU32_SUM3_TT8_8_WG16_8_1_WGM1
    SolutionIndex: 36
    SolutionNameMin: Cijk_Alik_Bjlk_HB_GB_MT128x128x16_SN_SU32_SUM3_TT8_8_WG16_16_1_WGM1
    SolutionIndex: 37
    SolutionNameMin: Cijk_Alik_Bjlk_HB_GB_MT64x64x16_SN_SU0_SUM0_TT8_8_WG8_8_1_WGM4
    SolutionIndex: 38
    SolutionNameMin: Cijk_Alik_Bjlk_HB_GB_MT128x64x16_SN_SU0_SUM0_TT8_8_WG16_8_1_WGM4
    SolutionIndex: 39
    SolutionNameMin: Cijk_Alik_Bjlk_HB_GB_MT128x128x16_SN_SU0_SUM0_TT8_8_WG16_16_1_WGM4
    SolutionIndex: 40
    SolutionNameMin: Cijk_Alik_Bjlk_HB_GB_MT64x64x8_SN_SU32_SUM3_TT8_8_WG8_8_1_WGM4
    SolutionIndex: 41
    SolutionNameMin: Cijk_Alik_Bjlk_HB_GB_MT64x64x16_SN_SU32_SUM3_TT8_8_WG8_8_1_WGM4
    SolutionIndex: 42
    SolutionNameMin: Cijk_Alik_Bjlk_HB_GB_MT128x64x16_SN_SU32_SUM3_TT8_8_WG16_8_1_WGM4
    SolutionIndex: 43
    SolutionNameMin: Cijk_Alik_Bjlk_HB_GB_MT128x128x16_SN_SU32_SUM3_TT8_8_WG16_16_1_WGM4
    SolutionIndex: 44
    SolutionNameMin: Cijk_Alik_Bjlk_HB_GB_MT64x64x16_SN_SU0_SUM0_TT8_8_WG8_8_1_WGM8
    SolutionIndex: 45
    SolutionNameMin: Cijk_Alik_Bjlk_HB_GB_MT128x64x16_SN_SU0_SUM0_TT8_8_WG16_8_1_WGM8
    SolutionIndex: 46
    SolutionNameMin: Cijk_Alik_Bjlk_HB_GB_MT128x128x16_SN_SU0_SUM0_TT8_8_WG16_16_1_WGM8
    SolutionIndex: 47
    SolutionNameMin: Cijk_Alik_Bjlk_HB_GB_MT64x64x8_SN_SU32_SUM3_TT8_8_WG8_8_1_WGM8
    SolutionIndex: 48
    SolutionNameMin: Cijk_Alik_Bjlk_HB_GB_MT64x64x16_SN_SU32_SUM3_TT8_8_WG8_8_1_WGM8
    SolutionIndex: 49
    SolutionNameMin: Cijk_Alik_Bjlk_HB_GB_MT128x64x16_SN_SU32_SUM3_TT8_8_WG16_8_1_WGM8
    SolutionIndex: 50
    SolutionNameMin: Cijk_Alik_Bjlk_HB_GB_MT16x16x16_SN_SU0_SUM0_TT2_2_WG8_8_1_WGM1
    SolutionIndex: 51
    SolutionNameMin: Cijk_Alik_Bjlk_HB_GB_MT32x32x16_SN_SU0_SUM0_TT2_2_WG16_16_1_WGM1
    SolutionIndex: 52
    SolutionNameMin: Cijk_Alik_Bjlk_HB_GB_MT64x64x16_SN_SU0_SUM0_TT4_4_WG16_16_1_WGM1
    SolutionIndex: 53
    SolutionNameMin: Cijk_Alik_Bjlk_HB_GB_MT16x16x32_SN_SU0_SUM0_TT2_2_WG8_8_1_WGM1
    SolutionIndex: 54
    SolutionNameMin: Cijk_Alik_Bjlk_HB_GB_MT16x16x8_SN_SU32_SUM3_TT2_2_WG8_8_1_WGM1
    SolutionIndex: 55
    SolutionNameMin: Cijk_Alik_Bjlk_HB_GB_MT32x32x8_SN_SU32_SUM3_TT4_4_WG8_8_1_WGM1
    SolutionIndex: 56
    SolutionNameMin: Cijk_Alik_Bjlk_HB_GB_MT64x32x8_SN_SU32_SUM3_TT4_4_WG16_8_1_WGM1
    SolutionIndex: 57
    SolutionNameMin: Cijk_Alik_Bjlk_HB_GB_MT64x64x8_SN_SU32_SUM3_TT4_4_WG16_16_1_WGM1
    SolutionIndex: 58
    SolutionNameMin: Cijk_Alik_Bjlk_HB_GB_MT16x16x16_SN_SU32_SUM3_TT2_2_WG8_8_1_WGM1
    SolutionIndex: 59
    SolutionNameMin: Cijk_Alik_Bjlk_HB_GB_MT32x32x16_SN_SU32_SUM3_TT4_4_WG8_8_1_WGM1
    SolutionIndex: 60
    SolutionNameMin: Cijk_Alik_Bjlk_HB_GB_MT32x16x16_SN_SU32_SUM3_TT2_2_WG16_8_1_WGM1
    SolutionIndex: 61
    SolutionNameMin: Cijk_Alik_Bjlk_HB_GB_MT16x16x32_SN_SU32_SUM3_TT2_2_WG8_8_1_WGM1
    SolutionIndex: 62
    SolutionNameMin: Cijk_Alik_Bjlk_HB_GB_MT64x64x8_SN_SU0_SUM0_TT4_4_WG16_16_1_WGM4
    SolutionIndex: 63
    SolutionNameMin: Cijk_Alik_Bjlk_HB_GB_MT32x32x16_SN_SU0_SUM0_TT4_4_WG8_8_1_WGM4
    SolutionIndex: 64
    SolutionNameMin: Cijk_Alik_Bjlk_HB_GB_MT16x16x8_SN_SU32_SUM3_TT2_2_WG8_8_1_WGM4
    SolutionIndex: 65
    SolutionNameMin: Cijk_Alik_Bjlk_HB_GB_MT64x32x8_SN_SU32_SUM3_TT4_4_WG16_8_1_WGM4
    SolutionIndex: 66
    SolutionNameMin: Cijk_Alik_Bjlk_HB_GB_MT32x32x8_SN_SU32_SUM3_TT2_2_WG16_16_1_WGM4
    SolutionIndex: 67
    SolutionNameMin: Cijk_Alik_Bjlk_HB_GB_MT64x64x8_SN_SU32_SUM3_TT4_4_WG16_16_1_WGM4
    SolutionIndex: 68
    SolutionNameMin: Cijk_Alik_Bjlk_HB_GB_MT16x16x16_SN_SU32_SUM3_TT2_2_WG8_8_1_WGM4
    SolutionIndex: 69
    SolutionNameMin: Cijk_Alik_Bjlk_HB_GB_MT32x32x16_SN_SU32_SUM3_TT4_4_WG8_8_1_WGM4
    SolutionIndex: 70
    SolutionNameMin: Cijk_Alik_Bjlk_HB_GB_MT64x32x8_SN_SU0_SUM0_TT4_4_WG16_8_1_WGM8
    SolutionIndex: 71
    SolutionNameMin: Cijk_Alik_Bjlk_HB_GB_MT64x64x8_SN_SU0_SUM0_TT4_4_WG16_16_1_WGM8
    SolutionIndex: 72
    SolutionNameMin: Cijk_Alik_Bjlk_HB_GB_MT16x16x16_SN_SU0_SUM0_TT2_2_WG8_8_1_WGM8
    SolutionIndex: 73
    SolutionNameMin: Cijk_Alik_Bjlk_HB_GB_MT32x16x16_SN_SU0_SUM0_TT2_2_WG16_8_1_WGM8
    SolutionIndex: 74
    SolutionNameMin: Cijk_Alik_Bjlk_HB_GB_MT64x64x16_SN_SU0_SUM0_TT4_4_WG16_16_1_WGM8
    SolutionIndex: 75
    SolutionNameMin: Cijk_Alik_Bjlk_HB_GB_MT16x16x32_SN_SU0_SUM0_TT2_2_WG8_8_1_WGM8
    SolutionIndex: 76
    SolutionNameMin: Cijk_Alik_Bjlk_HB_GB_MT16x16x8_SN_SU32_SUM3_TT2_2_WG8_8_1_WGM8
    SolutionIndex: 77
    SolutionNameMin: Cijk_Alik_Bjlk_HB_GB_MT32x32x8_SN_SU32_SUM3_TT4_4_WG8_8_1_WGM8
    SolutionIndex: 78
    SolutionNameMin: Cijk_Alik_Bjlk_HB_GB_MT64x32x8_SN_SU32_SUM3_TT4_4_WG16_8_1_WGM8
    SolutionIndex: 79
    SolutionNameMin: Cijk_Alik_Bjlk_HB_GB_MT32x32x8_SN_SU32_SUM3_TT2_2_WG16_16_1_WGM8
    SolutionIndex: 80
    SolutionNameMin: Cijk_Alik_Bjlk_HB_GB_MT64x64x8_SN_SU32_SUM3_TT4_4_WG16_16_1_WGM8
    SolutionIndex: 81
    SolutionNameMin: Cijk_Alik_Bjlk_HB_GB_MT16x16x16_SN_SU32_SUM3_TT2_2_WG8_8_1_WGM8
- - - [2944, 4288, 1, 1280, 2944, 2944, 1280, 4288]
    - [26, 24113.0]
  - - [2368, 5888, 1, 256, 2368, 2368, 256, 5888]
    - [11, 23265.0]
  - - [1024, 5056, 1, 3328, 1024, 1024, 3328, 5056]
    - [4, 24511.0]
  - - [5888, 1024, 1, 1280, 5888, 5888, 1280, 1024]
    - [11, 23755.0]
  - - [5888, 1856, 1, 3328, 5888, 5888, 3328, 1856]
    - [2, 23916.0]
  - - [5056, 704, 1, 256, 5056, 5056, 256, 704]
    - [17, 17916.0]
  - - [5888, 2944, 1, 3328, 5888, 5888, 3328, 2944]
    - [2, 25144.0]
  - - [1856, 4288, 1, 256, 1856, 1856, 256, 4288]
    - [23, 21546.0]
  - - [5056, 5056, 1, 3328, 5056, 5056, 3328, 5056]
    - [26, 24844.0]
  - - [1408, 5888, 1, 1280, 1408, 1408, 1280, 5888]
    - [14, 24264.0]
  - - [448, 3584, 1, 3328, 448, 448, 3328, 3584]
    - [4, 19546.0]
  - - [5888, 1408, 1, 1280, 5888, 5888, 1280, 1408]
    - [11, 24152.0]
  - - [3584, 1856, 1, 3328, 3584, 3584, 3328, 1856]
    - [2, 23965.0]
  - - [5056, 6784, 1, 1280, 5056, 5056, 1280, 6784]
    - [11, 24926.0]
  - - [5056, 5056, 1, 1280, 5056, 5056, 1280, 5056]
    - [19, 24722.0]
  - - [448, 5056, 1, 256, 448, 448, 256, 5056]
    - [17, 17487.0]
  - - [6784, 448, 1, 256, 6784, 6784, 256, 448]
    - [22, 18958.0]
  - - [5888, 704, 1, 1280, 5888, 5888, 1280, 704]
    - [26, 21749.0]
  - - [3584, 1024, 1, 256, 3584, 3584, 256, 1024]
    - [6, 21132.0]
  - - [6784, 4288, 1, 3328, 6784, 6784, 3328, 4288]
    - [11, 24707.0]
  - - [1856, 2368, 1, 3328, 1856, 1856, 3328, 2368]
    - [2, 21897.0]
  - - [5888, 2944, 1, 1280, 5888, 5888, 1280, 2944]
    - [23, 25098.0]
  - - [5888, 1024, 1, 256, 5888, 5888, 256, 1024]
    - [6, 22908.0]
  - - [1408, 2944, 1, 256, 1408, 1408, 256, 2944]
    - [2, 22052.0]
  - - [6784, 5056, 1, 3328, 6784, 6784, 3328, 5056]
    - [14, 25202.0]
  - - [5056, 5056, 1, 256, 5056, 5056, 256, 5056]
    - [11, 23297.0]
  - - [1024, 3584, 1, 1280, 1024, 1024, 1280, 3584]
    - [14, 22824.0]
  - - [2368, 2944, 1, 1280, 2368, 2368, 1280, 2944]
    - [11, 23697.0]
  - - [1408, 4288, 1, 1280, 1408, 1408, 1280, 4288]
    - [23, 23636.0]
  - - [3584, 4288, 1, 1280, 3584, 3584, 1280, 4288]
    - [14, 24480.0]
  - - [2368, 704, 1, 1280, 2368, 2368, 1280, 704]
    - [9, 19290.0]
  - - [5056, 4288, 1, 3328, 5056, 5056, 3328, 4288]
    - [26, 24763.0]
  - - [3584, 2368, 1, 3328, 3584, 3584, 3328, 2368]
    - [23, 23910.0]
  - - [6784, 448, 1, 1280, 6784, 6784, 1280, 448]
    - [2, 19447.0]
  - - [1024, 1408, 1, 3328, 1024, 1024, 3328, 1408]
    - [2, 20051.0]
  - - [4288, 2944, 1, 256, 4288, 4288, 256, 2944]
    - [17, 22449.0]
  - - [5056, 2368, 1, 1280, 5056, 5056, 1280, 2368]
    - [23, 23927.0]
  - - [448, 3584, 1, 1280, 448, 448, 1280, 3584]
    - [4, 18914.0]
  - - [6784, 5888, 1, 256, 6784, 6784, 256, 5888]
    - [14, 24909.0]
  - - [1024, 1408, 1, 256, 1024, 1024, 256, 1408]
    - [29, 17559.0]
  - - [2368, 2368, 1, 3328, 2368, 2368, 3328, 2368]
    - [2, 22360.0]
  - - [5056, 704, 1, 3328, 5056, 5056, 3328, 704]
    - [26, 22270.0]
  - - [1408, 1856, 1, 256, 1408, 1408, 256, 1856]
    - [22, 19302.0]
  - - [5888, 1856, 1, 256, 5888, 5888, 256, 1856]
    - [17, 22374.0]
  - - [704, 5888, 1, 256, 704, 704, 256, 5888]
    - [5, 20014.0]
  - - [4288, 6784, 1, 3328, 4288, 4288, 3328, 6784]
    - [11, 24746.0]
  - - [3584, 704, 1, 3328, 3584, 3584, 3328, 704]
    - [2, 20461.0]
  - - [1408, 1408, 1, 256, 1408, 1408, 256, 1408]
    - [22, 17745.0]
  - - [448, 4288, 1, 256, 448, 448, 256, 4288]
    - [25, 15359.0]
  - - [704, 2368, 1, 1280, 704, 704, 1280, 2368]
    - [0, 18804.0]
  - - [1856, 2368, 1, 1280, 1856, 1856, 1280, 2368]
    - [2, 21361.0]
  - - [1408, 1024, 1, 1280, 1408, 1408, 1280, 1024]
    - [2, 19276.0]
  - - [6784, 704, 1, 256, 6784, 6784, 256, 704]
    - [22, 19358.0]
  - - [1408, 3584, 1, 256, 1408, 1408, 256, 3584]
    - [17, 22121.0]
  - - [3584, 4288, 1, 3328, 3584, 3584, 3328, 4288]
    - [14, 24778.0]
  - - [5888, 1856, 1, 1280, 5888, 5888, 1280, 1856]
    - [2, 23736.0]
  - - [5056, 1024, 1, 3328, 5056, 5056, 3328, 1024]
    - [14, 24630.0]
  - - [2368, 3584, 1, 1280, 2368, 2368, 1280, 3584]
    - [2, 23750.0]
  - - [2944, 3584, 1, 3328, 2944, 2944, 3328, 3584]
    - [11, 24584.0]
  - - [6784, 2944, 1, 256, 6784, 6784, 256, 2944]
    - [23, 24433.0]
  - - [1024, 2368, 1, 256, 1024, 1024, 256, 2368]
    - [1, 18879.0]
  - - [4288, 2368, 1, 3328, 4288, 4288, 3328, 2368]
    - [2, 23614.0]
  - - [1856, 2368, 1, 256, 1856, 1856, 256, 2368]
    - [23, 19878.0]
  - - [3584, 6784, 1, 3328, 3584, 3584, 3328, 6784]
    - [11, 25060.0]
  - - [6784, 1856, 1, 3328, 6784, 6784, 3328, 1856]
    - [2, 24138.0]
  - - [5056, 4288, 1, 1280, 5056, 5056, 1280, 4288]
    - [26, 24607.0]
  - - [1408, 5056, 1, 1280, 1408, 1408, 1280, 5056]
    - [14, 24332.0]
  - - [6784, 5888, 1, 3328, 6784, 6784, 3328, 5888]
    - [14, 25529.0]
  - - [2368, 5056, 1, 1280, 2368, 2368, 1280, 5056]
    - [30, 23999.0]
  - - [1024, 5056, 1, 1280, 1024, 1024, 1280, 5056]
    - [14, 23907.0]
  - - [4288, 1024, 1, 256, 4288, 4288, 256, 1024]
    - [5, 21289.0]
  - - [2368, 1408, 1, 256, 2368, 2368, 256, 1408]
    - [2, 19804.0]
  - - [5888, 448, 1, 1280, 5888, 5888, 1280, 448]
    - [22, 19405.0]
  - - [704, 5888, 1, 3328, 704, 704, 3328, 5888]
    - [14, 22506.0]
  - - [1024, 6784, 1, 1280, 1024, 1024, 1280, 6784]
    - [2, 23820.0]
  - - [3584, 2944, 1, 1280, 3584, 3584, 1280, 2944]
    - [28, 24366.0]
  - - [2368, 1024, 1, 3328, 2368, 2368, 3328, 1024]
    - [0, 22493.0]
  - - [1408, 5056, 1, 3328, 1408, 1408, 3328, 5056]
    - [30, 24791.0]
  - - [1856, 1856, 1, 3328, 1856, 1856, 3328, 1856]
    - [4, 21623.0]
  - - [2368, 2368, 1, 256, 2368, 2368, 256, 2368]
    - [28, 20554.0]
  - - [4288, 4288, 1, 1280, 4288, 4288, 1280, 4288]
    - [4, 24487.0]
  - - [704, 6784, 1, 3328, 704, 704, 3328, 6784]
    - [23, 22451.0]
  - - [5888, 5888, 1, 3328, 5888, 5888, 3328, 5888]
    - [14, 25566.0]
  - - [5056, 1024, 1, 1280, 5056, 5056, 1280, 1024]
    - [5, 24197.0]
  - - [448, 5888, 1, 3328, 448, 448, 3328, 5888]
    - [19, 19931.0]
  - - [5056, 5888, 1, 1280, 5056, 5056, 1280, 5888]
    - [14, 25165.0]
  - - [448, 6784, 1, 256, 448, 448, 256, 6784]
    - [25, 17878.0]
  - - [3584, 5888, 1, 256, 3584, 3584, 256, 5888]
    - [6, 24390.0]
  - - [2944, 3584, 1, 256, 2944, 2944, 256, 3584]
    - [6, 23661.0]
  - - [6784, 2944, 1, 3328, 6784, 6784, 3328, 2944]
    - [2, 25299.0]
  - - [2944, 5056, 1, 3328, 2944, 2944, 3328, 5056]
    - [14, 25103.0]
  - - [6784, 2368, 1, 1280, 6784, 6784, 1280, 2368]
    - [23, 24232.0]
  - - [4288, 5888, 1, 1280, 4288, 4288, 1280, 5888]
    - [23, 24649.0]
  - - [4288, 4288, 1, 256, 4288, 4288, 256, 4288]
    - [23, 23514.0]
  - - [4288, 1856, 1, 1280, 4288, 4288, 1280, 1856]
    - [2, 23223.0]
  - - [1856, 2944, 1, 3328, 1856, 1856, 3328, 2944]
    - [14, 23270.0]
  - - [256, 6784, 1, 3328, 256, 256, 3328, 6784]
    - [27, 20994.0]
  - - [5056, 1024, 1, 256, 5056, 5056, 256, 1024]
    - [21, 21915.0]
  - - [1408, 1408, 1, 1280, 1408, 1408, 1280, 1408]
    - [11, 20471.0]
  - - [5056, 1856, 1, 3328, 5056, 5056, 3328, 1856]
    - [6, 23944.0]
  - - [1856, 1408, 1, 256, 1856, 1856, 256, 1408]
    - [7, 18450.0]
  - - [5056, 256, 1, 3328, 5056, 5056, 3328, 256]
    - [27, 22609.0]
  - - [5056, 3584, 1, 256, 5056, 5056, 256, 3584]
    - [0, 23939.0]
  - - [1856, 1024, 1, 1280, 1856, 1856, 1280, 1024]
    - [5, 22144.0]
  - - [1856, 1856, 1, 1280, 1856, 1856, 1280, 1856]
    - [4, 21207.0]
  - - [6784, 6784, 1, 1280, 6784, 6784, 1280, 6784]
    - [23, 25325.0]
  - - [1856, 1024, 1, 3328, 1856, 1856, 3328, 1024]
    - [5, 22980.0]
  - - [6784, 1024, 1, 256, 6784, 6784, 256, 1024]
    - [26, 23192.0]
  - - [5056, 5888, 1, 3328, 5056, 5056, 3328, 5888]
    - [14, 25264.0]
  - - [1856, 1024, 1, 256, 1856, 1856, 256, 1024]
    - [3, 19140.0]
  - - [5056, 1408, 1, 3328, 5056, 5056, 3328, 1408]
    - [2, 24623.0]
  - - [4288, 1024, 1, 3328, 4288, 4288, 3328, 1024]
    - [4, 23884.0]
  - - [2944, 1408, 1, 3328, 2944, 2944, 3328, 1408]
    - [2, 24007.0]
  - - [2944, 4288, 1, 3328, 2944, 2944, 3328, 4288]
    - [14, 24503.0]
  - - [5056, 2944, 1, 256, 5056, 5056, 256, 2944]
    - [6, 23644.0]
  - - [2368, 1856, 1, 256, 2368, 2368, 256, 1856]
    - [23, 20084.0]
  - - [1408, 3584, 1, 3328, 1408, 1408, 3328, 3584]
    - [26, 24265.0]
  - - [2368, 6784, 1, 256, 2368, 2368, 256, 6784]
    - [17, 23423.0]
  - - [5056, 1408, 1, 1280, 5056, 5056, 1280, 1408]
    - [2, 24308.0]
  - - [1408, 5888, 1, 3328, 1408, 1408, 3328, 5888]
    - [14, 24699.0]
  - - [1856, 5056, 1, 256, 1856, 1856, 256, 5056]
    - [14, 22072.0]
  - - [6784, 6784, 1, 256, 6784, 6784, 256, 6784]
    - [23, 24845.0]
  - - [2368, 4288, 1, 1280, 2368, 2368, 1280, 4288]
    - [23, 23428.0]
  - - [3584, 1856, 1, 1280, 3584, 3584, 1280, 1856]
    - [11, 23778.0]
  - - [5888, 5056, 1, 256, 5888, 5888, 256, 5056]
    - [6, 24291.0]
  - - [3584, 448, 1, 256, 3584, 3584, 256, 448]
    - [22, 16929.0]
  - - [3584, 3584, 1, 1280, 3584, 3584, 1280, 3584]
    - [26, 24877.0]
  - - [256, 6784, 1, 256, 256, 256, 256, 6784]
    - [25, 18618.0]
  - - [1856, 3584, 1, 3328, 1856, 1856, 3328, 3584]
    - [23, 24089.0]
  - - [5056, 256, 1, 1280, 5056, 5056, 1280, 256]
    - [7, 21361.0]
  - - [3584, 3584, 1, 256, 3584, 3584, 256, 3584]
    - [6, 23905.0]
  - - [6784, 4288, 1, 1280, 6784, 6784, 1280, 4288]
    - [6, 24725.0]
  - - [704, 5056, 1, 256, 704, 704, 256, 5056]
    - [21, 19224.0]
  - - [2944, 2368, 1, 1280, 2944, 2944, 1280, 2368]
    - [11, 23876.0]
  - - [6784, 3584, 1, 256, 6784, 6784, 256, 3584]
    - [23, 24540.0]
  - - [704, 6784, 1, 256, 704, 704, 256, 6784]
    - [2, 20122.0]
  - - [1024, 3584, 1, 3328, 1024, 1024, 3328, 3584]
    - [4, 23331.0]
  - - [2944, 2944, 1, 3328, 2944, 2944, 3328, 2944]
    - [17, 24609.0]
  - - [5056, 6784, 1, 256, 5056, 5056, 256, 6784]
    - [28, 24155.0]
  - - [1408, 4288, 1, 3328, 1408, 1408, 3328, 4288]
    - [11, 24065.0]
  - - [6784, 256, 1, 1280, 6784, 6784, 1280, 256]
    - [19, 20960.0]
  - - [2368, 704, 1, 3328, 2368, 2368, 3328, 704]
    - [14, 20244.0]
  - - [3584, 6784, 1, 256, 3584, 3584, 256, 6784]
    - [6, 24492.0]
  - - [5056, 1856, 1, 256, 5056, 5056, 256, 1856]
    - [17, 22468.0]
  - - [704, 4288, 1, 256, 704, 704, 256, 4288]
    - [23, 18261.0]
  - - [1408, 6784, 1, 1280, 1408, 1408, 1280, 6784]
    - [14, 24439.0]
  - - [5056, 2368, 1, 3328, 5056, 5056, 3328, 2368]
    - [11, 24207.0]
  - - [2944, 4288, 1, 256, 2944, 2944, 256, 4288]
    - [11, 23230.0]
  - - [1408, 3584, 1, 1280, 1408, 1408, 1280, 3584]
    - [26, 24007.0]
  - - [1024, 1408, 1, 1280, 1024, 1024, 1280, 1408]
    - [11, 19982.0]
  - - [2368, 6784, 1, 3328, 2368, 2368, 3328, 6784]
    - [23, 24334.0]
  - - [5056, 704, 1, 1280, 5056, 5056, 1280, 704]
    - [26, 21683.0]
  - - [1856, 4288, 1, 3328, 1856, 1856, 3328, 4288]
    - [14, 23625.0]
  - - [1408, 5888, 1, 256, 1408, 1408, 256, 5888]
    - [14, 23602.0]
  - - [3584, 704, 1, 1280, 3584, 3584, 1280, 704]
    - [23, 20221.0]
  - - [3584, 448, 1, 3328, 3584, 3584, 3328, 448]
    - [30, 19378.0]
  - - [704, 2368, 1, 3328, 704, 704, 3328, 2368]
    - [4, 20268.0]
  - - [448, 5056, 1, 3328, 448, 448, 3328, 5056]
    - [14, 21080.0]
  - - [4288, 448, 1, 256, 4288, 4288, 256, 448]
    - [16, 17159.0]
  - - [448, 5888, 1, 256, 448, 448, 256, 5888]
    - [3, 17540.0]
  - - [5888, 2368, 1, 256, 5888, 5888, 256, 2368]
    - [23, 23253.0]
  - - [6784, 704, 1, 3328, 6784, 6784, 3328, 704]
    - [14, 22699.0]
  - - [1408, 2944, 1, 3328, 1408, 1408, 3328, 2944]
    - [2, 23942.0]
  - - [2368, 704, 1, 256, 2368, 2368, 256, 704]
    - [16, 16935.0]
  - - [3584, 2368, 1, 256, 3584, 3584, 256, 2368]
    - [17, 22380.0]
  - - [5888, 5056, 1, 1280, 5888, 5888, 1280, 5056]
    - [14, 25159.0]
  - - [3584, 3584, 1, 3328, 3584, 3584, 3328, 3584]
    - [26, 24979.0]
  - - [5888, 6784, 1, 256, 5888, 5888, 256, 6784]
    - [17, 24839.0]
  - - [4288, 2944, 1, 3328, 4288, 4288, 3328, 2944]
    - [23, 24320.0]
  - - [4288, 704, 1, 1280, 4288, 4288, 1280, 704]
    - [6, 20127.0]
  - - [256, 5056, 1, 1280, 256, 256, 1280, 5056]
    - [27, 21262.0]
  - - [6784, 5888, 1, 1280, 6784, 6784, 1280, 5888]
    - [14, 25549.0]
  - - [5888, 4288, 1, 1280, 5888, 5888, 1280, 4288]
    - [23, 24687.0]
  - - [3584, 1024, 1, 3328, 3584, 3584, 3328, 1024]
    - [4, 23290.0]
  - - [1408, 1856, 1, 1280, 1408, 1408, 1280, 1856]
    - [11, 20841.0]
  - - [5888, 448, 1, 3328, 5888, 5888, 3328, 448]
    - [19, 19754.0]
  - - [704, 5888, 1, 1280, 704, 704, 1280, 5888]
    - [0, 22180.0]
  - - [1024, 6784, 1, 3328, 1024, 1024, 3328, 6784]
    - [14, 24290.0]
  - - [704, 2944, 1, 1280, 704, 704, 1280, 2944]
    - [2, 20830.0]
  - - [5056, 2944, 1, 3328, 5056, 5056, 3328, 2944]
    - [23, 24935.0]
  - - [1408, 1408, 1, 3328, 1408, 1408, 3328, 1408]
    - [2, 20750.0]
  - - [448, 4288, 1, 1280, 448, 448, 1280, 4288]
    - [11, 19417.0]
  - - [3584, 704, 1, 256, 3584, 3584, 256, 704]
    - [22, 18810.0]
  - - [3584, 1408, 1, 3328, 3584, 3584, 3328, 1408]
    - [2, 23940.0]
  - - [2368, 1024, 1, 1280, 2368, 2368, 1280, 1024]
    - [15, 21926.0]
  - - [1856, 6784, 1, 256, 1856, 1856, 256, 6784]
    - [17, 23017.0]
  - - [4288, 448, 1, 3328, 4288, 4288, 3328, 448]
    - [2, 19866.0]
  - - [4288, 3584, 1, 1280, 4288, 4288, 1280, 3584]
    - [8, 24821.0]
  - - [5888, 1024, 1, 3328, 5888, 5888, 3328, 1024]
    - [23, 24203.0]
  - - [704, 6784, 1, 1280, 704, 704, 1280, 6784]
    - [12, 21317.0]
  - - [1024, 2944, 1, 3328, 1024, 1024, 3328, 2944]
    - [26, 22636.0]
  - - [704, 5056, 1, 1280, 704, 704, 1280, 5056]
    - [14, 21925.0]
  - - [1024, 5888, 1, 1280, 1024, 1024, 1280, 5888]
    - [2, 23975.0]
  - - [2944, 1856, 1, 256, 2944, 2944, 256, 1856]
    - [2, 21181.0]
  - - [3584, 5056, 1, 256, 3584, 3584, 256, 5056]
    - [17, 23919.0]
  - - [5888, 5056, 1, 3328, 5888, 5888, 3328, 5056]
    - [26, 25260.0]
  - - [3584, 6784, 1, 1280, 3584, 3584, 1280, 6784]
    - [23, 25053.0]
  - - [4288, 1856, 1, 256, 4288, 4288, 256, 1856]
    - [6, 21860.0]
  - - [1856, 5888, 1, 256, 1856, 1856, 256, 5888]
    - [11, 23003.0]
  - - [4288, 4288, 1, 3328, 4288, 4288, 3328, 4288]
    - [4, 24676.0]
  - - [4288, 1408, 1, 1280, 4288, 4288, 1280, 1408]
    - [23, 23649.0]
  - - [4288, 2368, 1, 256, 4288, 4288, 256, 2368]
    - [2, 22405.0]
  - - [2944, 5056, 1, 1280, 2944, 2944, 1280, 5056]
    - [14, 24973.0]
  - - [6784, 2368, 1, 3328, 6784, 6784, 3328, 2368]
    - [2, 24329.0]
  - - [4288, 1856, 1, 3328, 4288, 4288, 3328, 1856]
    - [2, 23419.0]
  - - [1856, 2944, 1, 1280, 1856, 1856, 1280, 2944]
    - [14, 22883.0]
  - - [3584, 1024, 1, 1280, 3584, 3584, 1280, 1024]
    - [26, 23016.0]
  - - [1024, 4288, 1, 256, 1024, 1024, 256, 4288]
    - [17, 21035.0]
  - - [5888, 3584, 1, 3328, 5888, 5888, 3328, 3584]
    - [23, 25142.0]
  - - [5056, 3584, 1, 3328, 5056, 5056, 3328, 3584]
    - [26, 25206.0]
  - - [2368, 1408, 1, 1280, 2368, 2368, 1280, 1408]
    - [6, 22101.0]
  - - [5056, 2944, 1, 1280, 5056, 5056, 1280, 2944]
    - [11, 24804.0]
  - - [1024, 6784, 1, 256, 1024, 1024, 256, 6784]
    - [2, 22989.0]
  - - [3584, 2944, 1, 256, 3584, 3584, 256, 2944]
    - [28, 23678.0]
  - - [3584, 1408, 1, 1280, 3584, 3584, 1280, 1408]
    - [6, 23685.0]
  - - [5056, 6784, 1, 3328, 5056, 5056, 3328, 6784]
    - [12, 25136.0]
  - - [3584, 4288, 1, 256, 3584, 3584, 256, 4288]
    - [17, 23173.0]
  - - [1856, 6784, 1, 3328, 1856, 1856, 3328, 6784]
    - [11, 24248.0]
  - - [5056, 1408, 1, 256, 5056, 5056, 256, 1408]
    - [2, 21989.0]
  - - [5888, 5888, 1, 256, 5888, 5888, 256, 5888]
    - [26, 24885.0]
  - - [4288, 1024, 1, 1280, 4288, 4288, 1280, 1024]
    - [0, 23337.0]
  - - [448, 6784, 1, 3328, 448, 448, 3328, 6784]
    - [23, 20628.0]
  - - [2944, 1408, 1, 1280, 2944, 2944, 1280, 1408]
    - [2, 23721.0]
  - - [2944, 1856, 1, 3328, 2944, 2944, 3328, 1856]
    - [2, 23081.0]
  - - [3584, 5888, 1, 1280, 3584, 3584, 1280, 5888]
    - [23, 25085.0]
  - - [6784, 1856, 1, 1280, 6784, 6784, 1280, 1856]
    - [2, 24091.0]
  - - [5888, 256, 1, 3328, 5888, 5888, 3328, 256]
    - [6, 21328.0]
  - - [1856, 5888, 1, 3328, 1856, 1856, 3328, 5888]
    - [2, 24028.0]
  - - [3584, 1408, 1, 256, 3584, 3584, 256, 1408]
    - [6, 22381.0]
  - - [704, 3584, 1, 3328, 704, 704, 3328, 3584]
    - [23, 20738.0]
  - - [5056, 448, 1, 1280, 5056, 5056, 1280, 448]
    - [2, 20051.0]
  - - [4288, 704, 1, 256, 4288, 4288, 256, 704]
    - [10, 18488.0]
  - - [2944, 1024, 1, 256, 2944, 2944, 256, 1024]
    - [21, 20994.0]
  - - [2368, 4288, 1, 3328, 2368, 2368, 3328, 4288]
    - [2, 23675.0]
  - - [6784, 5056, 1, 256, 6784, 6784, 256, 5056]
    - [2, 24219.0]
  - - [3584, 5056, 1, 3328, 3584, 3584, 3328, 5056]
    - [14, 25167.0]
  - - [4288, 5888, 1, 256, 4288, 4288, 256, 5888]
    - [6, 24037.0]
  - - [2944, 6784, 1, 256, 2944, 2944, 256, 6784]
    - [2, 24645.0]
  - - [2368, 2368, 1, 1280, 2368, 2368, 1280, 2368]
    - [2, 22275.0]
  - - [1856, 3584, 1, 1280, 1856, 1856, 1280, 3584]
    - [23, 23799.0]
  - - [5056, 3584, 1, 1280, 5056, 5056, 1280, 3584]
    - [14, 25092.0]
  - - [256, 5888, 1, 256, 256, 256, 256, 5888]
    - [13, 19028.0]
  - - [1856, 1408, 1, 3328, 1856, 1856, 3328, 1408]
    - [11, 21418.0]
  - - [1024, 4288, 1, 3328, 1024, 1024, 3328, 4288]
    - [4, 23755.0]
  - - [2944, 2368, 1, 3328, 2944, 2944, 3328, 2368]
    - [23, 24147.0]
  - - [1024, 1856, 1, 1280, 1024, 1024, 1280, 1856]
    - [23, 21842.0]
  - - [6784, 1856, 1, 256, 6784, 6784, 256, 1856]
    - [11, 22851.0]
  - - [1024, 5888, 1, 256, 1024, 1024, 256, 5888]
    - [2, 22853.0]
  - - [1408, 2368, 1, 256, 1408, 1408, 256, 2368]
    - [28, 19878.0]
  - - [2944, 704, 1, 3328, 2944, 2944, 3328, 704]
    - [23, 21461.0]
  - - [2944, 2944, 1, 1280, 2944, 2944, 1280, 2944]
    - [2, 24506.0]
  - - [6784, 256, 1, 3328, 6784, 6784, 3328, 256]
    - [19, 21410.0]
  - - [1408, 5056, 1, 256, 1408, 1408, 256, 5056]
    - [23, 22872.0]
  - - [5056, 256, 1, 256, 5056, 5056, 256, 256]
    - [7, 18956.0]
  - - [1408, 4288, 1, 256, 1408, 1408, 256, 4288]
    - [17, 22023.0]
  - - [5888, 2368, 1, 1280, 5888, 5888, 1280, 2368]
    - [23, 24316.0]
  - - [2368, 5888, 1, 1280, 2368, 2368, 1280, 5888]
    - [14, 24511.0]
  - - [5888, 256, 1, 1280, 5888, 5888, 1280, 256]
    - [6, 20809.0]
  - - [2368, 1856, 1, 3328, 2368, 2368, 3328, 1856]
    - [2, 22158.0]
  - - [2944, 704, 1, 256, 2944, 2944, 256, 704]
    - [22, 18735.0]
  - - [2368, 6784, 1, 1280, 2368, 2368, 1280, 6784]
    - [11, 24284.0]
  - - [1856, 4288, 1, 1280, 1856, 1856, 1280, 4288]
    - [4, 23358.0]
  - - [704, 3584, 1, 256, 704, 704, 256, 3584]
    - [20, 18257.0]
  - - [704, 2944, 1, 3328, 704, 704, 3328, 2944]
    - [2, 21529.0]
  - - [1856, 5056, 1, 3328, 1856, 1856, 3328, 5056]
    - [26, 24178.0]
  - - [3584, 5056, 1, 1280, 3584, 3584, 1280, 5056]
    - [26, 24990.0]
  - - [2944, 1024, 1, 3328, 2944, 2944, 3328, 1024]
    - [26, 22879.0]
  - - [1408, 6784, 1, 256, 1408, 1408, 256, 6784]
    - [2, 23499.0]
  - - [6784, 1408, 1, 3328, 6784, 6784, 3328, 1408]
    - [23, 24505.0]
  - - [1024, 2368, 1, 1280, 1024, 1024, 1280, 2368]
    - [8, 21672.0]
  - - [6784, 2944, 1, 1280, 6784, 6784, 1280, 2944]
    - [23, 25255.0]
  - - [3584, 448, 1, 1280, 3584, 3584, 1280, 448]
    - [22, 19414.0]
  - - [2944, 6784, 1, 3328, 2944, 2944, 3328, 6784]
    - [23, 25327.0]
  - - [448, 5056, 1, 1280, 448, 448, 1280, 5056]
    - [0, 20264.0]
  - - [5888, 704, 1, 256, 5888, 5888, 256, 704]
    - [29, 19608.0]
  - - [256, 5888, 1, 3328, 256, 256, 3328, 5888]
    - [2, 21372.0]
  - - [6784, 4288, 1, 256, 6784, 6784, 256, 4288]
    - [11, 24049.0]
  - - [5888, 256, 1, 256, 5888, 5888, 256, 256]
    - [13, 18768.0]
  - - [6784, 1024, 1, 1280, 6784, 6784, 1280, 1024]
    - [26, 24250.0]
  - - [2944, 704, 1, 1280, 2944, 2944, 1280, 704]
    - [23, 20912.0]
  - - [6784, 3584, 1, 1280, 6784, 6784, 1280, 3584]
    - [23, 25089.0]
  - - [1408, 2944, 1, 1280, 1408, 1408, 1280, 2944]
    - [2, 23701.0]
  - - [1408, 2368, 1, 3328, 1408, 1408, 3328, 2368]
    - [23, 22567.0]
  - - [1024, 3584, 1, 256, 1024, 1024, 256, 3584]
    - [6, 21411.0]
  - - [2368, 2944, 1, 256, 2368, 2368, 256, 2944]
    - [17, 22364.0]
  - - [2944, 5888, 1, 256, 2944, 2944, 256, 5888]
    - [6, 24574.0]
  - - [3584, 1856, 1, 256, 3584, 3584, 256, 1856]
    - [17, 21944.0]
  - - [704, 4288, 1, 3328, 704, 704, 3328, 4288]
    - [23, 20589.0]
  - - [4288, 2944, 1, 1280, 4288, 4288, 1280, 2944]
    - [11, 24176.0]
  - - [4288, 5056, 1, 3328, 4288, 4288, 3328, 5056]
    - [26, 24852.0]
  - - [256, 5056, 1, 3328, 256, 256, 3328, 5056]
    - [27, 22056.0]
  - - [5056, 2368, 1, 256, 5056, 5056, 256, 2368]
    - [28, 22907.0]
  - - [4288, 704, 1, 3328, 4288, 4288, 3328, 704]
    - [2, 20547.0]
  - - [448, 3584, 1, 256, 448, 448, 256, 3584]
    - [18, 16548.0]
  - - [2944, 5888, 1, 1280, 2944, 2944, 1280, 5888]
    - [23, 25195.0]
  - - [5888, 3584, 1, 256, 5888, 5888, 256, 3584]
    - [28, 24511.0]
  - - [1408, 1856, 1, 3328, 1408, 1408, 3328, 1856]
    - [23, 21508.0]
  - - [6784, 1408, 1, 1280, 6784, 6784, 1280, 1408]
    - [6, 24360.0]
  - - [704, 2944, 1, 256, 704, 704, 256, 2944]
    - [18, 18449.0]
  - - [2944, 5888, 1, 3328, 2944, 2944, 3328, 5888]
    - [11, 25285.0]
  - - [1408, 6784, 1, 3328, 1408, 1408, 3328, 6784]
    - [26, 24616.0]
  - - [448, 4288, 1, 3328, 448, 448, 3328, 4288]
    - [23, 20000.0]
  - - [704, 2368, 1, 256, 704, 704, 256, 2368]
    - [13, 17071.0]
  - - [5888, 2368, 1, 3328, 5888, 5888, 3328, 2368]
    - [11, 24438.0]
  - - [4288, 5056, 1, 256, 4288, 4288, 256, 5056]
    - [17, 23549.0]
  - - [4288, 448, 1, 1280, 4288, 4288, 1280, 448]
    - [22, 19337.0]
  - - [5888, 704, 1, 3328, 5888, 5888, 3328, 704]
    - [26, 22479.0]
  - - [4288, 3584, 1, 3328, 4288, 4288, 3328, 3584]
    - [4, 24917.0]
  - - [6784, 6784, 1, 3328, 6784, 6784, 3328, 6784]
    - [23, 25387.0]
  - - [704, 5056, 1, 3328, 704, 704, 3328, 5056]
    - [26, 22380.0]
  - - [2368, 2944, 1, 3328, 2368, 2368, 3328, 2944]
    - [23, 24163.0]
  - - [2368, 3584, 1, 256, 2368, 2368, 256, 3584]
    - [6, 22613.0]
  - - [3584, 2368, 1, 1280, 3584, 3584, 1280, 2368]
    - [23, 23851.0]
  - - [1856, 1856, 1, 256, 1856, 1856, 256, 1856]
    - [15, 19356.0]
  - - [4288, 1408, 1, 3328, 4288, 4288, 3328, 1408]
    - [2, 24174.0]
  - - [4288, 5056, 1, 1280, 4288, 4288, 1280, 5056]
    - [26, 24717.0]
  - - [5888, 6784, 1, 1280, 5888, 5888, 1280, 6784]
    - [24, 25384.0]
  - - [5888, 1408, 1, 3328, 5888, 5888, 3328, 1408]
    - [23, 24438.0]
  - - [256, 5056, 1, 256, 256, 256, 256, 5056]
    - [22, 17969.0]
  - - [1408, 1024, 1, 256, 1408, 1408, 256, 1024]
    - [25, 18345.0]
  - - [2368, 5056, 1, 256, 2368, 2368, 256, 5056]
    - [28, 22791.0]
  - - [1024, 5056, 1, 256, 1024, 1024, 256, 5056]
    - [17, 21907.0]
  - - [2368, 1408, 1, 3328, 2368, 2368, 3328, 1408]
    - [2, 22555.0]
  - - [5888, 448, 1, 256, 5888, 5888, 256, 448]
    - [22, 18613.0]
  - - [6784, 5056, 1, 1280, 6784, 6784, 1280, 5056]
    - [26, 25165.0]
  - - [4288, 6784, 1, 1280, 4288, 4288, 1280, 6784]
    - [23, 24717.0]
  - - [6784, 1408, 1, 256, 6784, 6784, 256, 1408]
    - [23, 23373.0]
  - - [5888, 4288, 1, 256, 5888, 5888, 256, 4288]
    - [23, 23967.0]
  - - [5056, 5888, 1, 256, 5056, 5056, 256, 5888]
    - [30, 24423.0]
  - - [2368, 1024, 1, 256, 2368, 2368, 256, 1024]
    - [5, 19472.0]
  - - [1856, 6784, 1, 1280, 1856, 1856, 1280, 6784]
    - [23, 24095.0]
  - - [4288, 3584, 1, 256, 4288, 4288, 256, 3584]
    - [8, 24004.0]
  - - [5056, 1856, 1, 1280, 5056, 5056, 1280, 1856]
    - [11, 23747.0]
  - - [1408, 1024, 1, 3328, 1408, 1408, 3328, 1024]
    - [23, 20595.0]
  - - [5888, 3584, 1, 1280, 5888, 5888, 1280, 3584]
    - [11, 25099.0]
  - - [1024, 2944, 1, 256, 1024, 1024, 256, 2944]
    - [2, 20624.0]
  - - [448, 6784, 1, 1280, 448, 448, 1280, 6784]
    - [23, 20251.0]
  - - [2944, 1856, 1, 1280, 2944, 2944, 1280, 1856]
    - [6, 22801.0]
  - - [2368, 3584, 1, 3328, 2368, 2368, 3328, 3584]
    - [23, 24115.0]
  - - [3584, 5888, 1, 3328, 3584, 3584, 3328, 5888]
    - [23, 25151.0]
  - - [2944, 3584, 1, 1280, 2944, 2944, 1280, 3584]
    - [11, 24432.0]
  - - [1856, 5888, 1, 1280, 1856, 1856, 1280, 5888]
    - [6, 23902.0]
  - - [5056, 448, 1, 3328, 5056, 5056, 3328, 448]
    - [14, 20809.0]
  - - [4288, 1408, 1, 256, 4288, 4288, 256, 1408]
    - [17, 21899.0]
  - - [4288, 2368, 1, 1280, 4288, 4288, 1280, 2368]
    - [6, 23511.0]
  - - [2944, 5056, 1, 256, 2944, 2944, 256, 5056]
    - [11, 23320.0]
  - - [6784, 2368, 1, 256, 6784, 6784, 256, 2368]
    - [23, 23372.0]
  - - [1856, 2944, 1, 256, 1856, 1856, 256, 2944]
    - [2, 21870.0]
  - - [1856, 1408, 1, 1280, 1856, 1856, 1280, 1408]
    - [2, 20787.0]
  - - [1024, 4288, 1, 1280, 1024, 1024, 1280, 4288]
    - [23, 23000.0]
  - - [2368, 5056, 1, 3328, 2368, 2368, 3328, 5056]
    - [26, 24459.0]
  - - [1024, 1856, 1, 3328, 1024, 1024, 3328, 1856]
    - [17, 22525.0]
  - - [704, 3584, 1, 1280, 704, 704, 1280, 3584]
    - [2, 20312.0]
  - - [4288, 6784, 1, 256, 4288, 4288, 256, 6784]
    - [11, 24177.0]
  - - [3584, 2944, 1, 3328, 3584, 3584, 3328, 2944]
    - [2, 24637.0]
  - - [5888, 2944, 1, 256, 5888, 5888, 256, 2944]
    - [23, 24525.0]
  - - [5056, 4288, 1, 256, 5056, 5056, 256, 4288]
    - [28, 23708.0]
  - - [6784, 1024, 1, 3328, 6784, 6784, 3328, 1024]
    - [26, 24440.0]
  - - [5888, 5888, 1, 1280, 5888, 5888, 1280, 5888]
    - [26, 25512.0]
  - - [448, 5888, 1, 1280, 448, 448, 1280, 5888]
    - [9, 19427.0]
  - - [2944, 1408, 1, 256, 2944, 2944, 256, 1408]
    - [6, 22265.0]
  - - [1024, 2944, 1, 1280, 1024, 1024, 1280, 2944]
    - [6, 22207.0]
  - - [2368, 5888, 1, 3328, 2368, 2368, 3328, 5888]
    - [14, 24650.0]
  - - [2368, 1856, 1, 1280, 2368, 2368, 1280, 1856]
    - [6, 21754.0]
  - - [5888, 4288, 1, 3328, 5888, 5888, 3328, 4288]
    - [23, 24783.0]
  - - [6784, 704, 1, 1280, 6784, 6784, 1280, 704]
    - [26, 22169.0]
  - - [5056, 448, 1, 256, 5056, 5056, 256, 448]
    - [16, 17864.0]
  - - [1856, 5056, 1, 1280, 1856, 1856, 1280, 5056]
    - [14, 23934.0]
  - - [2944, 1024, 1, 1280, 2944, 2944, 1280, 1024]
    - [14, 22534.0]
  - - [2368, 4288, 1, 256, 2368, 2368, 256, 4288]
    - [2, 22393.0]
  - - [1024, 2368, 1, 3328, 1024, 1024, 3328, 2368]
    - [26, 22519.0]
  - - [4288, 5888, 1, 3328, 4288, 4288, 3328, 5888]
    - [23, 24793.0]
  - - [2944, 6784, 1, 1280, 2944, 2944, 1280, 6784]
    - [11, 25226.0]
  - - [256, 6784, 1, 1280, 256, 256, 1280, 6784]
    - [2, 20549.0]
  - - [1856, 3584, 1, 256, 1856, 1856, 256, 3584]
    - [0, 21826.0]
  - - [256, 5888, 1, 1280, 256, 256, 1280, 5888]
    - [2, 20944.0]
  - - [2944, 2368, 1, 256, 2944, 2944, 256, 2368]
    - [2, 22203.0]
  - - [1024, 1856, 1, 256, 1024, 1024, 256, 1856]
    - [29, 18713.0]
  - - [6784, 3584, 1, 3328, 6784, 6784, 3328, 3584]
    - [23, 25152.0]
  - - [1024, 5888, 1, 3328, 1024, 1024, 3328, 5888]
    - [2, 24125.0]
  - - [1408, 2368, 1, 1280, 1408, 1408, 1280, 2368]
    - [2, 22062.0]
  - - [2944, 2944, 1, 256, 2944, 2944, 256, 2944]
    - [2, 23579.0]
  - - [6784, 256, 1, 256, 6784, 6784, 256, 256]
    - [15, 18634.0]
  - - [5888, 1408, 1, 256, 5888, 5888, 256, 1408]
    - [6, 23374.0]
  - - [5888, 6784, 1, 3328, 5888, 5888, 3328, 6784]
    - [24, 25475.0]
  - - [704, 4288, 1, 1280, 704, 704, 1280, 4288]
    - [23, 19967.0]
  - - [6784, 448, 1, 3328, 6784, 6784, 3328, 448]
    - [2, 20571.0]
  - - [1024, 1024, 1, 3328, 1024, 1024, 3328, 1024]
    - [31, 19448.0]
  - - [64, 6784, 1, 256, 64, 64, 256, 6784]
    - [31, 10876.0]
  - - [128, 6784, 1, 3328, 128, 128, 3328, 6784]
    - [33, 19312.0]
  - - [256, 4288, 1, 3328, 256, 256, 3328, 4288]
    - [45, 19163.0]
  - - [704, 1856, 1, 3328, 704, 704, 3328, 1856]
    - [37, 18777.0]
  - - [448, 1024, 1, 1280, 448, 448, 1280, 1024]
    - [41, 15870.0]
  - - [2368, 128, 1, 256, 2368, 2368, 256, 128]
    - [34, 8838.0]
  - - [256, 1856, 1, 1280, 256, 256, 1280, 1856]
    - [38, 16599.0]
  - - [448, 704, 1, 1280, 448, 448, 1280, 704]
    - [44, 14408.0]
  - - [128, 3584, 1, 1280, 128, 128, 1280, 3584]
    - [45, 16079.0]
  - - [4288, 256, 1, 256, 4288, 4288, 256, 256]
    - [37, 16058.0]
  - - [5888, 64, 1, 3328, 5888, 5888, 3328, 64]
    - [34, 14003.0]
  - - [2944, 256, 1, 3328, 2944, 2944, 3328, 256]
    - [45, 17849.0]
  - - [256, 4288, 1, 1280, 256, 256, 1280, 4288]
    - [32, 18715.0]
  - - [1408, 448, 1, 1280, 1408, 1408, 1280, 448]
    - [45, 17484.0]
  - - [6784, 128, 1, 1280, 6784, 6784, 1280, 128]
    - [43, 18655.0]
  - - [2368, 128, 1, 3328, 2368, 2368, 3328, 128]
    - [33, 15901.0]
  - - [2944, 128, 1, 256, 2944, 2944, 256, 128]
    - [38, 9608.0]
  - - [448, 1408, 1, 256, 448, 448, 256, 1408]
    - [37, 13547.0]
  - - [64, 5056, 1, 3328, 64, 64, 3328, 5056]
    - [31, 15992.0]
  - - [2368, 256, 1, 1280, 2368, 2368, 1280, 256]
    - [39, 17508.0]
  - - [256, 3584, 1, 3328, 256, 256, 3328, 3584]
    - [33, 20403.0]
  - - [5056, 64, 1, 1280, 5056, 5056, 1280, 64]
    - [34, 14564.0]
  - - [1024, 704, 1, 256, 1024, 1024, 256, 704]
    - [38, 13630.0]
  - - [4288, 128, 1, 1280, 4288, 4288, 1280, 128]
    - [46, 15852.0]
  - - [5888, 64, 1, 256, 5888, 5888, 256, 64]
    - [34, 9804.0]
  - - [1856, 256, 1, 1280, 1856, 1856, 1280, 256]
    - [44, 16296.0]
  - - [64, 5888, 1, 3328, 64, 64, 3328, 5888]
    - [48, 15052.0]
  - - [256, 1408, 1, 3328, 256, 256, 3328, 1408]
    - [37, 14470.0]
  - - [6784, 128, 1, 3328, 6784, 6784, 3328, 128]
    - [36, 19209.0]
  - - [704, 704, 1, 3328, 704, 704, 3328, 704]
    - [33, 15558.0]
  - - [3584, 256, 1, 3328, 3584, 3584, 3328, 256]
    - [39, 20308.0]
  - - [128, 3584, 1, 3328, 128, 128, 3328, 3584]
    - [45, 17047.0]
  - - [128, 2944, 1, 1280, 128, 128, 1280, 2944]
    - [31, 13317.0]
  - - [448, 1856, 1, 1280, 448, 448, 1280, 1856]
    - [37, 18125.0]
  - - [3584, 128, 1, 256, 3584, 3584, 256, 128]
    - [42, 11271.0]
  - - [448, 1408, 1, 3328, 448, 448, 3328, 1408]
    - [37, 17482.0]
  - - [256, 3584, 1, 256, 256, 256, 256, 3584]
    - [46, 16448.0]
  - - [256, 2944, 1, 3328, 256, 256, 3328, 2944]
    - [45, 17928.0]
  - - [1408, 704, 1, 256, 1408, 1408, 256, 704]
    - [31, 15980.0]
  - - [448, 2944, 1, 3328, 448, 448, 3328, 2944]
    - [31, 18998.0]
  - - [64, 5888, 1, 256, 64, 64, 256, 5888]
    - [31, 9647.0]
  - - [448, 2368, 1, 1280, 448, 448, 1280, 2368]
    - [44, 17351.0]
  - - [128, 4288, 1, 3328, 128, 128, 3328, 4288]
    - [31, 17268.0]
  - - [256, 2368, 1, 256, 256, 256, 256, 2368]
    - [32, 13219.0]
  - - [1024, 448, 1, 3328, 1024, 1024, 3328, 448]
    - [38, 16964.0]
  - - [1856, 704, 1, 1280, 1856, 1856, 1280, 704]
    - [37, 18476.0]
  - - [1024, 1024, 1, 1280, 1024, 1024, 1280, 1024]
    - [38, 17944.0]
  - - [256, 2944, 1, 256, 256, 256, 256, 2944]
    - [32, 14420.0]
  - - [128, 6784, 1, 1280, 128, 128, 1280, 6784]
    - [33, 18687.0]
  - - [1408, 704, 1, 3328, 1408, 1408, 3328, 704]
    - [37, 18593.0]
  - - [128, 5888, 1, 1280, 128, 128, 1280, 5888]
    - [32, 17363.0]
  - - [704, 1408, 1, 3328, 704, 704, 3328, 1408]
    - [37, 18780.0]
  - - [6784, 128, 1, 256, 6784, 6784, 256, 128]
    - [43, 15352.0]
  - - [704, 448, 1, 256, 704, 704, 256, 448]
    - [34, 9072.0]
  - - [256, 1856, 1, 3328, 256, 256, 3328, 1856]
    - [32, 17554.0]
  - - [128, 4288, 1, 256, 128, 128, 256, 4288]
    - [38, 12030.0]
  - - [64, 6784, 1, 3328, 64, 64, 3328, 6784]
    - [34, 16080.0]
  - - [2944, 256, 1, 1280, 2944, 2944, 1280, 256]
    - [49, 17135.0]
  - - [1856, 704, 1, 256, 1856, 1856, 256, 704]
    - [37, 17101.0]
  - - [1408, 448, 1, 3328, 1408, 1408, 3328, 448]
    - [45, 18210.0]
  - - [2368, 256, 1, 256, 2368, 2368, 256, 256]
    - [37, 13152.0]
  - - [704, 1856, 1, 256, 704, 704, 256, 1856]
    - [44, 17119.0]
  - - [5888, 64, 1, 1280, 5888, 5888, 1280, 64]
    - [49, 13186.0]
  - - [256, 2368, 1, 1280, 256, 256, 1280, 2368]
    - [39, 17437.0]
  - - [2944, 448, 1, 256, 2944, 2944, 256, 448]
    - [37, 17280.0]
  - - [2368, 128, 1, 1280, 2368, 2368, 1280, 128]
    - [37, 13846.0]
  - - [64, 5056, 1, 1280, 64, 64, 1280, 5056]
    - [37, 14803.0]
  - - [704, 448, 1, 3328, 704, 704, 3328, 448]
    - [37, 15704.0]
  - - [5056, 64, 1, 3328, 5056, 5056, 3328, 64]
    - [48, 15671.0]
  - - [2368, 448, 1, 1280, 2368, 2368, 1280, 448]
    - [32, 17681.0]
  - - [1408, 256, 1, 1280, 1408, 1408, 1280, 256]
    - [38, 12738.0]
  - - [1856, 448, 1, 3328, 1856, 1856, 3328, 448]
    - [37, 18455.0]
  - - [128, 5056, 1, 256, 128, 128, 256, 5056]
    - [32, 14016.0]
  - - [4288, 256, 1, 1280, 4288, 4288, 1280, 256]
    - [35, 18187.0]
  - - [704, 704, 1, 256, 704, 704, 256, 704]
    - [37, 11662.0]
  - - [4288, 128, 1, 3328, 4288, 4288, 3328, 128]
    - [39, 17265.0]
  - - [256, 1408, 1, 1280, 256, 256, 1280, 1408]
    - [34, 13610.0]
  - - [6784, 64, 1, 3328, 6784, 6784, 3328, 64]
    - [42, 16030.0]
  - - [128, 2944, 1, 3328, 128, 128, 3328, 2944]
    - [44, 14113.0]
  - - [2944, 448, 1, 3328, 2944, 2944, 3328, 448]
    - [37, 18409.0]
  - - [2368, 448, 1, 3328, 2368, 2368, 3328, 448]
    - [45, 18251.0]
  - - [5056, 64, 1, 256, 5056, 5056, 256, 64]
    - [41, 9184.0]
  - - [128, 5056, 1, 3328, 128, 128, 3328, 5056]
    - [46, 20088.0]
  - - [6784, 64, 1, 256, 6784, 6784, 256, 64]
    - [42, 10897.0]
  - - [128, 2368, 1, 256, 128, 128, 256, 2368]
    - [34, 8778.0]
  - - [3584, 256, 1, 256, 3584, 3584, 256, 256]
    - [46, 16334.0]
  - - [128, 2944, 1, 256, 128, 128, 256, 2944]
    - [37, 9764.0]
  - - [3584, 128, 1, 3328, 3584, 3584, 3328, 128]
    - [42, 17001.0]
  - - [1024, 448, 1, 1280, 1024, 1024, 1280, 448]
    - [38, 16018.0]
  - - [5888, 128, 1, 3328, 5888, 5888, 3328, 128]
    - [45, 17854.0]
  - - [1408, 704, 1, 1280, 1408, 1408, 1280, 704]
    - [44, 18277.0]
  - - [448, 1408, 1, 1280, 448, 448, 1280, 1408]
    - [44, 16835.0]
  - - [704, 1408, 1, 1280, 704, 704, 1280, 1408]
    - [31, 18230.0]
  - - [448, 2944, 1, 256, 448, 448, 256, 2944]
    - [31, 17333.0]
  - - [448, 2368, 1, 256, 448, 448, 256, 2368]
    - [44, 15626.0]
  - - [64, 5056, 1, 256, 64, 64, 256, 5056]
    - [48, 9043.0]
  - - [5056, 128, 1, 3328, 5056, 5056, 3328, 128]
    - [43, 20197.0]
  - - [448, 704, 1, 256, 448, 448, 256, 704]
    - [48, 9175.0]
  - - [1856, 256, 1, 3328, 1856, 1856, 3328, 256]
    - [38, 17139.0]
  - - [2944, 128, 1, 3328, 2944, 2944, 3328, 128]
    - [44, 15037.0]
  - - [64, 6784, 1, 1280, 64, 64, 1280, 6784]
    - [31, 15176.0]
  - - [704, 1024, 1, 1280, 704, 704, 1280, 1024]
    - [32, 16338.0]
  - - [256, 4288, 1, 256, 256, 256, 256, 4288]
    - [38, 16668.0]
  - - [256, 2368, 1, 3328, 256, 256, 3328, 2368]
    - [46, 19000.0]
  - - [128, 3584, 1, 256, 128, 128, 256, 3584]
    - [34, 11674.0]
  - - [704, 448, 1, 1280, 704, 704, 1280, 448]
    - [44, 14449.0]
  - - [1024, 704, 1, 1280, 1024, 1024, 1280, 704]
    - [38, 16572.0]
  - - [256, 1856, 1, 256, 256, 256, 256, 1856]
    - [40, 12163.0]
  - - [704, 1856, 1, 1280, 704, 704, 1280, 1856]
    - [37, 18497.0]
  - - [1408, 256, 1, 3328, 1408, 1408, 3328, 256]
    - [37, 14446.0]
  - - [5888, 128, 1, 256, 5888, 5888, 256, 128]
    - [45, 13941.0]
  - - [2368, 448, 1, 256, 2368, 2368, 256, 448]
    - [37, 15573.0]
  - - [4288, 256, 1, 3328, 4288, 4288, 3328, 256]
    - [33, 18497.0]
  - - [2944, 256, 1, 256, 2944, 2944, 256, 256]
    - [38, 14228.0]
  - - [1408, 448, 1, 256, 1408, 1408, 256, 448]
    - [38, 13662.0]
  - - [6784, 64, 1, 1280, 6784, 6784, 1280, 64]
    - [42, 15069.0]
  - - [448, 1024, 1, 3328, 448, 448, 3328, 1024]
    - [37, 16598.0]
  - - [2944, 448, 1, 1280, 2944, 2944, 1280, 448]
    - [44, 18630.0]
  - - [5056, 128, 1, 256, 5056, 5056, 256, 128]
    - [37, 13602.0]
  - - [448, 1024, 1, 256, 448, 448, 256, 1024]
    - [37, 11628.0]
  - - [128, 5056, 1, 1280, 128, 128, 1280, 5056]
    - [33, 18482.0]
  - - [1408, 256, 1, 256, 1408, 1408, 256, 256]
    - [47, 9858.0]
  - - [128, 5888, 1, 3328, 128, 128, 3328, 5888]
    - [38, 17952.0]
  - - [3584, 128, 1, 1280, 3584, 3584, 1280, 128]
    - [44, 15965.0]
  - - [4288, 128, 1, 256, 4288, 4288, 256, 128]
    - [37, 11867.0]
  - - [2368, 256, 1, 3328, 2368, 2368, 3328, 256]
    - [46, 18983.0]
  - - [5888, 128, 1, 1280, 5888, 5888, 1280, 128]
    - [45, 17245.0]
  - - [256, 3584, 1, 1280, 256, 256, 1280, 3584]
    - [39, 19731.0]
  - - [128, 5888, 1, 256, 128, 128, 256, 5888]
    - [38, 14398.0]
  - - [1024, 1024, 1, 256, 1024, 1024, 256, 1024]
    - [42, 15884.0]
  - - [1024, 1024, 1, 1024, 1024, 1024, 1024, 1024]
    - [35, 17625.0]
  - - [64, 5888, 1, 1280, 64, 64, 1280, 5888]
    - [37, 14212.0]
  - - [704, 1024, 1, 256, 704, 704, 256, 1024]
    - [37, 13490.0]
  - - [704, 704, 1, 1280, 704, 704, 1280, 704]
    - [37, 15040.0]
  - - [128, 2368, 1, 1280, 128, 128, 1280, 2368]
    - [32, 14047.0]
  - - [3584, 256, 1, 1280, 3584, 3584, 1280, 256]
    - [46, 19573.0]
  - - [5056, 128, 1, 1280, 5056, 5056, 1280, 128]
    - [36, 18474.0]
  - - [448, 1856, 1, 3328, 448, 448, 3328, 1856]
    - [37, 18485.0]
  - - [1024, 448, 1, 256, 1024, 1024, 256, 448]
    - [38, 11358.0]
  - - [2944, 128, 1, 1280, 2944, 2944, 1280, 128]
    - [45, 13259.0]
  - - [256, 2944, 1, 1280, 256, 256, 1280, 2944]
    - [38, 17313.0]
  - - [704, 1024, 1, 3328, 704, 704, 3328, 1024]
    - [34, 18627.0]
  - - [1856, 448, 1, 1280, 1856, 1856, 1280, 448]
    - [44, 18107.0]
  - - [128, 6784, 1, 256, 128, 128, 256, 6784]
    - [33, 15545.0]
  - - [704, 1408, 1, 256, 704, 704, 256, 1408]
    - [44, 16101.0]
  - - [256, 1408, 1, 256, 256, 256, 256, 1408]
    - [47, 9858.0]
  - - [448, 2944, 1, 1280, 448, 448, 1280, 2944]
    - [37, 18687.0]
  - - [1856, 256, 1, 256, 1856, 1856, 256, 256]
    - [37, 11972.0]
  - - [128, 2368, 1, 3328, 128, 128, 3328, 2368]
    - [39, 15610.0]
  - - [448, 2368, 1, 3328, 448, 448, 3328, 2368]
    - [46, 17828.0]
  - - [1856, 448, 1, 256, 1856, 1856, 256, 448]
    - [31, 14660.0]
  - - [1024, 704, 1, 3328, 1024, 1024, 3328, 704]
    - [45, 17159.0]
  - - [128, 4288, 1, 1280, 128, 128, 1280, 4288]
    - [46, 15830.0]
  - - [448, 704, 1, 3328, 448, 448, 3328, 704]
    - [37, 15694.0]
  - - [448, 1856, 1, 256, 448, 448, 256, 1856]
    - [37, 15139.0]
  - - [1856, 704, 1, 3328, 1856, 1856, 3328, 704]
    - [44, 18633.0]
  - - [2368, 64, 1, 3328, 2368, 2368, 3328, 64]
    - [80, 8628.0]
  - - [1408, 64, 1, 1280, 1408, 1408, 1280, 64]
    - [57, 5325.0]
  - - [2944, 64, 1, 256, 2944, 2944, 256, 64]
    - [57, 6644.0]
  - - [1024, 256, 1, 3328, 1024, 1024, 3328, 256]
    - [62, 8818.0]
  - - [1856, 64, 1, 1280, 1856, 1856, 1280, 64]
    - [57, 6812.0]
  - - [704, 128, 1, 1280, 704, 704, 1280, 128]
    - [78, 5660.0]
  - - [4288, 64, 1, 3328, 4288, 4288, 3328, 64]
    - [67, 8979.0]
  - - [1856, 128, 1, 256, 1856, 1856, 256, 128]
    - [57, 8331.0]
  - - [2944, 64, 1, 1280, 2944, 2944, 1280, 64]
    - [57, 7970.0]
  - - [64, 3584, 1, 3328, 64, 64, 3328, 3584]
    - [62, 9794.0]
  - - [1024, 256, 1, 256, 1024, 1024, 256, 256]
    - [71, 7609.0]
  - - [448, 448, 1, 256, 448, 448, 256, 448]
    - [71, 7298.0]
  - - [128, 1024, 1, 3328, 128, 128, 3328, 1024]
    - [62, 7900.0]
  - - [64, 1856, 1, 1280, 64, 64, 1280, 1856]
    - [74, 6293.0]
  - - [1024, 128, 1, 1280, 1024, 1024, 1280, 128]
    - [57, 7739.0]
  - - [448, 256, 1, 3328, 448, 448, 3328, 256]
    - [62, 7079.0]
  - - [128, 704, 1, 1280, 128, 128, 1280, 704]
    - [80, 5248.0]
  - - [1856, 128, 1, 3328, 1856, 1856, 3328, 128]
    - [57, 9960.0]
  - - [256, 448, 1, 256, 256, 256, 256, 448]
    - [78, 5281.0]
  - - [448, 448, 1, 3328, 448, 448, 3328, 448]
    - [71, 8861.0]
  - - [1408, 128, 1, 1280, 1408, 1408, 1280, 128]
    - [71, 7639.0]
  - - [128, 1856, 1, 1280, 128, 128, 1280, 1856]
    - [62, 9822.0]
  - - [64, 1408, 1, 3328, 64, 64, 3328, 1408]
    - [69, 5030.0]
  - - [256, 448, 1, 3328, 256, 256, 3328, 448]
    - [62, 6887.0]
  - - [64, 2368, 1, 1280, 64, 64, 1280, 2368]
    - [74, 7950.0]
  - - [2368, 64, 1, 256, 2368, 2368, 256, 64]
    - [57, 6666.0]
  - - [4288, 64, 1, 1280, 4288, 4288, 1280, 64]
    - [57, 8875.0]
  - - [128, 1024, 1, 1280, 128, 128, 1280, 1024]
    - [67, 7339.0]
  - - [1856, 64, 1, 256, 1856, 1856, 256, 64]
    - [78, 5279.0]
  - - [704, 128, 1, 256, 704, 704, 256, 128]
    - [78, 4225.0]
  - - [448, 256, 1, 1280, 448, 448, 1280, 256]
    - [65, 6905.0]
  - - [256, 1024, 1, 256, 256, 256, 256, 1024]
    - [71, 7592.0]
  - - [1856, 128, 1, 1280, 1856, 1856, 1280, 128]
    - [57, 9867.0]
  - - [64, 3584, 1, 256, 64, 64, 256, 3584]
    - [57, 7788.0]
  - - [64, 1856, 1, 256, 64, 64, 256, 1856]
    - [74, 4985.0]
  - - [256, 1024, 1, 1280, 256, 256, 1280, 1024]
    - [63, 9598.0]
  - - [3584, 64, 1, 1280, 3584, 3584, 1280, 64]
    - [57, 9526.0]
  - - [1408, 128, 1, 3328, 1408, 1408, 3328, 128]
    - [67, 7842.0]
  - - [64, 4288, 1, 3328, 64, 64, 3328, 4288]
    - [71, 7975.0]
  - - [256, 704, 1, 256, 256, 256, 256, 704]
    - [71, 6498.0]
  - - [128, 1024, 1, 256, 128, 128, 256, 1024]
    - [71, 5949.0]
  - - [64, 2944, 1, 256, 64, 64, 256, 2944]
    - [57, 6248.0]
  - - [64, 1408, 1, 1280, 64, 64, 1280, 1408]
    - [63, 4826.0]
  - - [704, 128, 1, 3328, 704, 704, 3328, 128]
    - [57, 5505.0]
  - - [1408, 128, 1, 256, 1408, 1408, 256, 128]
    - [78, 6480.0]
  - - [64, 2944, 1, 1280, 64, 64, 1280, 2944]
    - [71, 7730.0]
  - - [704, 256, 1, 1280, 704, 704, 1280, 256]
    - [62, 7752.0]
  - - [256, 448, 1, 1280, 256, 256, 1280, 448]
    - [80, 6685.0]
  - - [64, 2368, 1, 3328, 64, 64, 3328, 2368]
    - [52, 8306.0]
  - - [256, 704, 1, 3328, 256, 256, 3328, 704]
    - [71, 7984.0]
  - - [64, 2944, 1, 3328, 64, 64, 3328, 2944]
    - [57, 8047.0]
  - - [128, 1408, 1, 256, 128, 128, 256, 1408]
    - [71, 6535.0]
  - - [1408, 64, 1, 256, 1408, 1408, 256, 64]
    - [78, 4164.0]
  - - [64, 2368, 1, 256, 64, 64, 256, 2368]
    - [74, 6319.0]
  - - [1024, 128, 1, 3328, 1024, 1024, 3328, 128]
    - [80, 7732.0]
  - - [2368, 64, 1, 1280, 2368, 2368, 1280, 64]
    - [57, 8531.0]
  - - [4288, 64, 1, 256, 4288, 4288, 256, 64]
    - [57, 7824.0]
  - - [64, 4288, 1, 1280, 64, 64, 1280, 4288]
    - [74, 7700.0]
  - - [1408, 64, 1, 3328, 1408, 1408, 3328, 64]
    - [67, 5453.0]
  - - [448, 448, 1, 1280, 448, 448, 1280, 448]
    - [62, 8609.0]
  - - [1024, 256, 1, 1280, 1024, 1024, 1280, 256]
    - [80, 8635.0]
  - - [3584, 64, 1, 3328, 3584, 3584, 3328, 64]
    - [80, 9880.0]
  - - [256, 1024, 1, 3328, 256, 256, 3328, 1024]
    - [57, 8669.0]
  - - [1856, 64, 1, 3328, 1856, 1856, 3328, 64]
    - [57, 6923.0]
  - - [448, 256, 1, 256, 448, 448, 256, 256]
    - [65, 5319.0]
  - - [128, 704, 1, 256, 128, 128, 256, 704]
    - [56, 4179.0]
  - - [1024, 128, 1, 256, 1024, 1024, 256, 128]
    - [57, 5866.0]
  - - [64, 3584, 1, 1280, 64, 64, 1280, 3584]
    - [71, 9526.0]
  - - [3584, 64, 1, 256, 3584, 3584, 256, 64]
    - [80, 7829.0]
  - - [64, 1856, 1, 3328, 64, 64, 3328, 1856]
    - [74, 6554.0]
  - - [2944, 64, 1, 3328, 2944, 2944, 3328, 64]
    - [57, 8199.0]
  - - [128, 1408, 1, 3328, 128, 128, 3328, 1408]
    - [77, 8450.0]
  - - [128, 704, 1, 3328, 128, 128, 3328, 704]
    - [59, 5474.0]
  - - [128, 1856, 1, 256, 128, 128, 256, 1856]
    - [62, 8286.0]
  - - [64, 4288, 1, 256, 64, 64, 256, 4288]
    - [74, 7011.0]
  - - [704, 256, 1, 3328, 704, 704, 3328, 256]
    - [70, 8132.0]
  - - [256, 704, 1, 1280, 256, 256, 1280, 704]
    - [62, 7746.0]
  - - [64, 1408, 1, 256, 64, 64, 256, 1408]
    - [55, 4105.0]
  - - [128, 1408, 1, 1280, 128, 128, 1280, 1408]
    - [71, 7767.0]
  - - [128, 1856, 1, 3328, 128, 128, 3328, 1856]
    - [80, 10178.0]
  - - [704, 256, 1, 256, 704, 704, 256, 256]
    - [78, 6554.0]
  - - [704, 64, 1, 3328, 704, 704, 3328, 64]
    - [58, 4282.0]
  - - [448, 64, 1, 1280, 448, 448, 1280, 64]
    - [68, 3048.0]
  - - [64, 1024, 1, 1280, 64, 64, 1280, 1024]
    - [74, 4772.0]
  - - [64, 704, 1, 1280, 64, 64, 1280, 704]
    - [81, 3918.0]
  - - [128, 448, 1, 256, 128, 128, 256, 448]
    - [66, 3352.0]
  - - [256, 256, 1, 3328, 256, 256, 3328, 256]
    - [74, 5176.0]
  - - [64, 448, 1, 1280, 64, 64, 1280, 448]
    - [68, 3038.0]
  - - [64, 64, 1, 3328, 64, 64, 3328, 64]
    - [53, 547.0]
  - - [256, 64, 1, 1280, 256, 256, 1280, 64]
    - [68, 1836.0]
  - - [128, 448, 1, 1280, 128, 128, 1280, 448]
    - [64, 4223.0]
  - - [704, 64, 1, 1280, 704, 704, 1280, 64]
    - [72, 3614.0]
  - - [448, 64, 1, 3328, 448, 448, 3328, 64]
    - [58, 3259.0]
  - - [64, 128, 1, 3328, 64, 64, 3328, 128]
    - [53, 1055.0]
  - - [128, 128, 1, 3328, 128, 128, 3328, 128]
    - [53, 1991.0]
  - - [256, 128, 1, 256, 256, 256, 256, 128]
    - [81, 2196.0]
  - - [64, 448, 1, 3328, 64, 64, 3328, 448]
    - [50, 3145.0]
  - - [256, 64, 1, 256, 256, 256, 256, 64]
    - [51, 1165.0]
  - - [256, 128, 1, 1280, 256, 256, 1280, 128]
    - [72, 3112.0]
  - - [128, 64, 1, 1280, 128, 128, 1280, 64]
    - [53, 962.0]
  - - [64, 1024, 1, 256, 64, 64, 256, 1024]
    - [54, 3631.0]
  - - [64, 704, 1, 256, 64, 64, 256, 704]
    - [81, 2800.0]
  - - [448, 128, 1, 256, 448, 448, 256, 128]
    - [66, 3306.0]
  - - [256, 256, 1, 256, 256, 256, 256, 256]
    - [66, 3383.0]
  - - [448, 128, 1, 3328, 448, 448, 3328, 128]
    - [74, 4533.0]
  - - [128, 256, 1, 1280, 128, 128, 1280, 256]
    - [68, 3388.0]
  - - [64, 256, 1, 1280, 64, 64, 1280, 256]
    - [68, 1846.0]
  - - [64, 448, 1, 256, 64, 64, 256, 448]
    - [81, 1921.0]
  - - [64, 64, 1, 256, 64, 64, 256, 64]
    - [60, 293.0]
  - - [128, 256, 1, 3328, 128, 128, 3328, 256]
    - [68, 3613.0]
  - - [64, 128, 1, 1280, 64, 64, 1280, 128]
    - [61, 948.0]
  - - [128, 128, 1, 1280, 128, 128, 1280, 128]
    - [68, 1833.0]
  - - [128, 256, 1, 256, 128, 128, 256, 256]
    - [51, 2173.0]
  - - [64, 128, 1, 256, 64, 64, 256, 128]
    - [60, 583.0]
  - - [704, 64, 1, 256, 704, 704, 256, 64]
    - [72, 2658.0]
  - - [64, 64, 1, 1280, 64, 64, 1280, 64]
    - [53, 480.0]
  - - [128, 64, 1, 3328, 128, 128, 3328, 64]
    - [75, 1049.0]
  - - [448, 64, 1, 256, 448, 448, 256, 64]
    - [68, 1963.0]
  - - [1024, 64, 1, 256, 1024, 1024, 256, 64]
    - [76, 3554.0]
  - - [128, 64, 1, 256, 128, 128, 256, 64]
    - [73, 589.0]
  - - [1024, 64, 1, 1280, 1024, 1024, 1280, 64]
    - [74, 4702.0]
  - - [64, 1024, 1, 3328, 64, 64, 3328, 1024]
    - [74, 5173.0]
  - - [448, 128, 1, 1280, 448, 448, 1280, 128]
    - [79, 4258.0]
  - - [1024, 64, 1, 3328, 1024, 1024, 3328, 64]
    - [52, 5127.0]
  - - [64, 256, 1, 3328, 64, 64, 3328, 256]
    - [53, 1997.0]
  - - [256, 256, 1, 1280, 256, 256, 1280, 256]
    - [76, 4772.0]
  - - [256, 128, 1, 3328, 256, 256, 3328, 128]
    - [81, 3702.0]
  - - [64, 256, 1, 256, 64, 64, 256, 256]
    - [51, 1152.0]
  - - [64, 704, 1, 3328, 64, 64, 3328, 704]
    - [81, 4243.0]
  - - [128, 448, 1, 3328, 128, 128, 3328, 448]
    - [74, 4524.0]
  - - [256, 64, 1, 3328, 256, 256, 3328, 64]
    - [61, 1973.0]
  - - [128, 128, 1, 256, 128, 128, 256, 128]
    - [51, 1152.0]
- null
- null
- DeviceEfficiency
...
