library/src/blas3/Tensile/Logic/asm_full/navi22_Cijk_Alik_Bljk_HB.yaml
---
- {MinimumRequiredVersion: 4.28.0}
- navi22
- gfx1031
    SolutionIndex: 0
    SolutionNameMin: Cijk_Alik_Bljk_HB_MT128x128x16_SN_SU0_SUM0_TT8_16_WG16_8_1_WGM1
    SolutionIndex: 1
    SolutionNameMin: Cijk_Alik_Bljk_HB_MT256x128x16_SN_SU0_SUM0_TT16_16_WG16_8_1_WGM1
    SolutionIndex: 2
    SolutionNameMin: Cijk_Alik_Bljk_HB_MT128x128x16_SN_SU0_SUM0_TT8_8_WG16_16_1_WGM1
    SolutionIndex: 3
    SolutionNameMin: Cijk_Alik_Bljk_HB_MT128x256x16_SN_SU0_SUM0_TT8_16_WG16_16_1_WGM1
    SolutionIndex: 4
    SolutionNameMin: Cijk_Alik_Bljk_HB_MT128x128x16_SN_SU32_SUM3_TT8_16_WG16_8_1_WGM1
    SolutionIndex: 5
    SolutionNameMin: Cijk_Alik_Bljk_HB_MT256x128x16_SN_SU32_SUM3_TT16_16_WG16_8_1_WGM1
    SolutionIndex: 6
    SolutionNameMin: Cijk_Alik_Bljk_HB_MT128x128x16_SN_SU32_SUM3_TT8_8_WG16_16_1_WGM1
    SolutionIndex: 7
    SolutionNameMin: Cijk_Alik_Bljk_HB_MT128x256x16_SN_SU32_SUM3_TT8_16_WG16_16_1_WGM1
    SolutionIndex: 8
    SolutionNameMin: Cijk_Alik_Bljk_HB_MT256x256x16_SN_SU32_SUM3_TT16_16_WG16_16_1_WGM1
    SolutionIndex: 9
    SolutionNameMin: Cijk_Alik_Bljk_HB_MT128x128x32_SN_SU32_SUM3_TT8_16_WG16_8_1_WGM1
    SolutionIndex: 10
    SolutionNameMin: Cijk_Alik_Bljk_HB_MT128x128x16_SN_SU0_SUM0_TT8_16_WG16_8_1_WGM4
    SolutionIndex: 11
    SolutionNameMin: Cijk_Alik_Bljk_HB_MT256x128x16_SN_SU0_SUM0_TT16_16_WG16_8_1_WGM4
    SolutionIndex: 12
    SolutionNameMin: Cijk_Alik_Bljk_HB_MT128x128x16_SN_SU0_SUM0_TT8_8_WG16_16_1_WGM4
    SolutionIndex: 13
    SolutionNameMin: Cijk_Alik_Bljk_HB_MT128x256x16_SN_SU0_SUM0_TT8_16_WG16_16_1_WGM4
    SolutionIndex: 14
    SolutionNameMin: Cijk_Alik_Bljk_HB_MT256x256x16_SN_SU0_SUM0_TT16_16_WG16_16_1_WGM4
    SolutionIndex: 15
    SolutionNameMin: Cijk_Alik_Bljk_HB_MT128x64x16_SN_SU32_SUM3_TT8_8_WG16_8_1_WGM4
    SolutionIndex: 16
    SolutionNameMin: Cijk_Alik_Bljk_HB_MT128x128x16_SN_SU32_SUM3_TT8_16_WG16_8_1_WGM4
    SolutionIndex: 17
    SolutionNameMin: Cijk_Alik_Bljk_HB_MT256x128x16_SN_SU32_SUM3_TT16_16_WG16_8_1_WGM4
    SolutionIndex: 18
    SolutionNameMin: Cijk_Alik_Bljk_HB_MT128x128x16_SN_SU32_SUM3_TT8_8_WG16_16_1_WGM4
    SolutionIndex: 19
    SolutionNameMin: Cijk_Alik_Bljk_HB_MT128x256x16_SN_SU32_SUM3_TT8_16_WG16_16_1_WGM4
    SolutionIndex: 20
    SolutionNameMin: Cijk_Alik_Bljk_HB_MT256x256x16_SN_SU32_SUM3_TT16_16_WG16_16_1_WGM4
    SolutionIndex: 21
    SolutionNameMin: Cijk_Alik_Bljk_HB_MT128x128x32_SN_SU32_SUM3_TT8_16_WG16_8_1_WGM4
    SolutionIndex: 22
    SolutionNameMin: Cijk_Alik_Bljk_HB_MT128x64x16_SN_SU0_SUM0_TT8_8_WG16_8_1_WGM8
    SolutionIndex: 23
    SolutionNameMin: Cijk_Alik_Bljk_HB_MT128x128x16_SN_SU0_SUM0_TT8_16_WG16_8_1_WGM8
    SolutionIndex: 24
    SolutionNameMin: Cijk_Alik_Bljk_HB_MT256x128x16_SN_SU0_SUM0_TT16_16_WG16_8_1_WGM8
    SolutionIndex: 25
    SolutionNameMin: Cijk_Alik_Bljk_HB_MT128x128x16_SN_SU0_SUM0_TT8_8_WG16_16_1_WGM8
    SolutionIndex: 26
    SolutionNameMin: Cijk_Alik_Bljk_HB_MT128x256x16_SN_SU0_SUM0_TT8_16_WG16_16_1_WGM8
    SolutionIndex: 27
    SolutionNameMin: Cijk_Alik_Bljk_HB_MT256x256x16_SN_SU0_SUM0_TT16_16_WG16_16_1_WGM8
    SolutionIndex: 28
    SolutionNameMin: Cijk_Alik_Bljk_HB_MT128x64x16_SN_SU32_SUM3_TT8_8_WG16_8_1_WGM8
    SolutionIndex: 29
    SolutionNameMin: Cijk_Alik_Bljk_HB_MT128x128x16_SN_SU32_SUM3_TT8_16_WG16_8_1_WGM8
    SolutionIndex: 30
    SolutionNameMin: Cijk_Alik_Bljk_HB_MT256x128x16_SN_SU32_SUM3_TT16_16_WG16_8_1_WGM8
    SolutionIndex: 31
    SolutionNameMin: Cijk_Alik_Bljk_HB_MT128x128x16_SN_SU32_SUM3_TT8_8_WG16_16_1_WGM8
    SolutionIndex: 32
    SolutionNameMin: Cijk_Alik_Bljk_HB_MT128x256x16_SN_SU32_SUM3_TT8_16_WG16_16_1_WGM8
    SolutionIndex: 33
    SolutionNameMin: Cijk_Alik_Bljk_HB_MT256x256x16_SN_SU32_SUM3_TT16_16_WG16_16_1_WGM8
    SolutionIndex: 34
    SolutionNameMin: Cijk_Alik_Bljk_HB_MT128x128x32_SN_SU32_SUM3_TT8_16_WG16_8_1_WGM8
    SolutionIndex: 35
    SolutionNameMin: Cijk_Alik_Bljk_HB_MT64x64x16_SN_SU0_SUM0_TT8_8_WG8_8_1_WGM1
    SolutionIndex: 36
    SolutionNameMin: Cijk_Alik_Bljk_HB_MT128x64x16_SN_SU0_SUM0_TT8_8_WG16_8_1_WGM1
    SolutionIndex: 37
    SolutionNameMin: Cijk_Alik_Bljk_HB_MT128x128x16_SN_SU0_SUM0_TT8_8_WG16_16_1_WGM1
    SolutionIndex: 38
    SolutionNameMin: Cijk_Alik_Bljk_HB_MT128x128x8_SN_SU32_SUM3_TT8_8_WG16_16_1_WGM1
    SolutionIndex: 39
    SolutionNameMin: Cijk_Alik_Bljk_HB_MT64x64x16_SN_SU32_SUM3_TT8_8_WG8_8_1_WGM1
    SolutionIndex: 40
    SolutionNameMin: Cijk_Alik_Bljk_HB_MT128x64x16_SN_SU32_SUM3_TT8_8_WG16_8_1_WGM1
    SolutionIndex: 41
    SolutionNameMin: Cijk_Alik_Bljk_HB_MT128x128x16_SN_SU32_SUM3_TT8_8_WG16_16_1_WGM1
    SolutionIndex: 42
    SolutionNameMin: Cijk_Alik_Bljk_HB_MT128x64x32_SN_SU32_SUM3_TT8_8_WG16_8_1_WGM1
    SolutionIndex: 43
    SolutionNameMin: Cijk_Alik_Bljk_HB_MT64x64x16_SN_SU0_SUM0_TT8_8_WG8_8_1_WGM4
    SolutionIndex: 44
    SolutionNameMin: Cijk_Alik_Bljk_HB_MT128x64x16_SN_SU0_SUM0_TT8_8_WG16_8_1_WGM4
    SolutionIndex: 45
    SolutionNameMin: Cijk_Alik_Bljk_HB_MT128x128x16_SN_SU0_SUM0_TT8_8_WG16_16_1_WGM4
    SolutionIndex: 46
    SolutionNameMin: Cijk_Alik_Bljk_HB_MT128x128x8_SN_SU32_SUM3_TT8_8_WG16_16_1_WGM4
    SolutionIndex: 47
    SolutionNameMin: Cijk_Alik_Bljk_HB_MT64x64x16_SN_SU32_SUM3_TT8_8_WG8_8_1_WGM4
    SolutionIndex: 48
    SolutionNameMin: Cijk_Alik_Bljk_HB_MT128x64x16_SN_SU32_SUM3_TT8_8_WG16_8_1_WGM4
    SolutionIndex: 49
    SolutionNameMin: Cijk_Alik_Bljk_HB_MT128x128x16_SN_SU32_SUM3_TT8_8_WG16_16_1_WGM4
    SolutionIndex: 50
    SolutionNameMin: Cijk_Alik_Bljk_HB_MT64x64x32_SN_SU32_SUM3_TT8_8_WG8_8_1_WGM4
    SolutionIndex: 51
    SolutionNameMin: Cijk_Alik_Bljk_HB_MT64x64x16_SN_SU0_SUM0_TT8_8_WG8_8_1_WGM8
    SolutionIndex: 52
    SolutionNameMin: Cijk_Alik_Bljk_HB_MT128x64x16_SN_SU0_SUM0_TT8_8_WG16_8_1_WGM8
    SolutionIndex: 53
    SolutionNameMin: Cijk_Alik_Bljk_HB_MT128x128x16_SN_SU0_SUM0_TT8_8_WG16_16_1_WGM8
    SolutionIndex: 54
    SolutionNameMin: Cijk_Alik_Bljk_HB_MT64x64x16_SN_SU32_SUM3_TT8_8_WG8_8_1_WGM8
    SolutionIndex: 55
    SolutionNameMin: Cijk_Alik_Bljk_HB_MT128x64x16_SN_SU32_SUM3_TT8_8_WG16_8_1_WGM8
    SolutionIndex: 56
    SolutionNameMin: Cijk_Alik_Bljk_HB_MT128x128x16_SN_SU32_SUM3_TT8_8_WG16_16_1_WGM8
    SolutionIndex: 57
    SolutionNameMin: Cijk_Alik_Bljk_HB_MT16x16x8_SN_SU0_SUM0_TT2_2_WG8_8_1_WGM1
    SolutionIndex: 58
    SolutionNameMin: Cijk_Alik_Bljk_HB_MT64x32x8_SN_SU0_SUM0_TT4_4_WG16_8_1_WGM1
    SolutionIndex: 59
    SolutionNameMin: Cijk_Alik_Bljk_HB_MT64x64x8_SN_SU0_SUM0_TT4_4_WG16_16_1_WGM1
    SolutionIndex: 60
    SolutionNameMin: Cijk_Alik_Bljk_HB_MT16x16x16_SN_SU0_SUM0_TT2_2_WG8_8_1_WGM1
    SolutionIndex: 61
    SolutionNameMin: Cijk_Alik_Bljk_HB_MT32x16x16_SN_SU0_SUM0_TT2_2_WG16_8_1_WGM1
    SolutionIndex: 62
    SolutionNameMin: Cijk_Alik_Bljk_HB_MT16x16x32_SN_SU0_SUM0_TT2_2_WG8_8_1_WGM1
    SolutionIndex: 63
    SolutionNameMin: Cijk_Alik_Bljk_HB_MT16x16x8_SN_SU32_SUM3_TT2_2_WG8_8_1_WGM1
    SolutionIndex: 64
    SolutionNameMin: Cijk_Alik_Bljk_HB_MT64x32x8_SN_SU32_SUM3_TT4_4_WG16_8_1_WGM1
    SolutionIndex: 65
    SolutionNameMin: Cijk_Alik_Bljk_HB_MT32x32x8_SN_SU32_SUM3_TT2_2_WG16_16_1_WGM1
    SolutionIndex: 66
    SolutionNameMin: Cijk_Alik_Bljk_HB_MT64x64x8_SN_SU32_SUM3_TT4_4_WG16_16_1_WGM1
    SolutionIndex: 67
    SolutionNameMin: Cijk_Alik_Bljk_HB_MT16x16x16_SN_SU32_SUM3_TT2_2_WG8_8_1_WGM1
    SolutionIndex: 68
    SolutionNameMin: Cijk_Alik_Bljk_HB_MT32x16x16_SN_SU32_SUM3_TT2_2_WG16_8_1_WGM1
    SolutionIndex: 69
    SolutionNameMin: Cijk_Alik_Bljk_HB_MT64x32x16_SN_SU32_SUM3_TT4_4_WG16_8_1_WGM1
    SolutionIndex: 70
    SolutionNameMin: Cijk_Alik_Bljk_HB_MT64x32x8_SN_SU0_SUM0_TT4_4_WG16_8_1_WGM4
    SolutionIndex: 71
    SolutionNameMin: Cijk_Alik_Bljk_HB_MT64x64x8_SN_SU0_SUM0_TT4_4_WG16_16_1_WGM4
    SolutionIndex: 72
    SolutionNameMin: Cijk_Alik_Bljk_HB_MT16x16x16_SN_SU0_SUM0_TT2_2_WG8_8_1_WGM4
    SolutionIndex: 73
    SolutionNameMin: Cijk_Alik_Bljk_HB_MT32x32x16_SN_SU0_SUM0_TT4_4_WG8_8_1_WGM4
    SolutionIndex: 74
    SolutionNameMin: Cijk_Alik_Bljk_HB_MT16x16x8_SN_SU32_SUM3_TT2_2_WG8_8_1_WGM4
    SolutionIndex: 75
    SolutionNameMin: Cijk_Alik_Bljk_HB_MT32x32x8_SN_SU32_SUM3_TT4_4_WG8_8_1_WGM4
    SolutionIndex: 76
    SolutionNameMin: Cijk_Alik_Bljk_HB_MT32x16x8_SN_SU32_SUM3_TT2_2_WG16_8_1_WGM4
    SolutionIndex: 77
    SolutionNameMin: Cijk_Alik_Bljk_HB_MT64x32x8_SN_SU32_SUM3_TT4_4_WG16_8_1_WGM4
    SolutionIndex: 78
    SolutionNameMin: Cijk_Alik_Bljk_HB_MT32x32x8_SN_SU32_SUM3_TT2_2_WG16_16_1_WGM4
    SolutionIndex: 79
    SolutionNameMin: Cijk_Alik_Bljk_HB_MT64x64x8_SN_SU32_SUM3_TT4_4_WG16_16_1_WGM4
    SolutionIndex: 80
    SolutionNameMin: Cijk_Alik_Bljk_HB_MT16x16x16_SN_SU32_SUM3_TT2_2_WG8_8_1_WGM4
    SolutionIndex: 81
    SolutionNameMin: Cijk_Alik_Bljk_HB_MT64x64x16_SN_SU32_SUM3_TT4_4_WG16_16_1_WGM4
    SolutionIndex: 82
    SolutionNameMin: Cijk_Alik_Bljk_HB_MT16x16x32_SN_SU32_SUM3_TT2_2_WG8_8_1_WGM4
    SolutionIndex: 83
    SolutionNameMin: Cijk_Alik_Bljk_HB_MT16x16x8_SN_SU0_SUM0_TT2_2_WG8_8_1_WGM8
    SolutionIndex: 84
    SolutionNameMin: Cijk_Alik_Bljk_HB_MT64x32x8_SN_SU0_SUM0_TT4_4_WG16_8_1_WGM8
    SolutionIndex: 85
    SolutionNameMin: Cijk_Alik_Bljk_HB_MT64x64x8_SN_SU0_SUM0_TT4_4_WG16_16_1_WGM8
    SolutionIndex: 86
    SolutionNameMin: Cijk_Alik_Bljk_HB_MT16x16x16_SN_SU0_SUM0_TT2_2_WG8_8_1_WGM8
    SolutionIndex: 87
    SolutionNameMin: Cijk_Alik_Bljk_HB_MT16x16x32_SN_SU0_SUM0_TT2_2_WG8_8_1_WGM8
    SolutionIndex: 88
    SolutionNameMin: Cijk_Alik_Bljk_HB_MT16x16x8_SN_SU32_SUM3_TT2_2_WG8_8_1_WGM8
    SolutionIndex: 89
    SolutionNameMin: Cijk_Alik_Bljk_HB_MT32x16x8_SN_SU32_SUM3_TT2_2_WG16_8_1_WGM8
    SolutionIndex: 90
    SolutionNameMin: Cijk_Alik_Bljk_HB_MT64x32x8_SN_SU32_SUM3_TT4_4_WG16_8_1_WGM8
    SolutionIndex: 91
    SolutionNameMin: Cijk_Alik_Bljk_HB_MT64x64x8_SN_SU32_SUM3_TT4_4_WG16_16_1_WGM8
    SolutionIndex: 92
    SolutionNameMin: Cijk_Alik_Bljk_HB_MT16x16x16_SN_SU32_SUM3_TT2_2_WG8_8_1_WGM8
    SolutionIndex: 93
    SolutionNameMin: Cijk_Alik_Bljk_HB_MT64x32x16_SN_SU32_SUM3_TT4_4_WG16_8_1_WGM8
    SolutionIndex: 94
    SolutionNameMin: Cijk_Alik_Bljk_HB_MT64x16x8_SN_SU0_SUM0_TT4_2_WG16_8_1_WGM1
    SolutionIndex: 95
    SolutionNameMin: Cijk_Alik_Bljk_HB_MT64x16x16_SN_SU32_SUM3_TT4_2_WG16_8_1_WGM1
    SolutionIndex: 96
    SolutionNameMin: Cijk_Alik_Bljk_HB_MT64x16x16_SN_SU32_SUM3_TT4_2_WG16_8_1_WGM4
- - - [2944, 4288, 1, 1280, 2944, 2944, 1280, 1280]
    - [3, 23592.0]
  - - [2368, 5888, 1, 256, 2368, 2368, 256, 256]
    - [3, 22773.0]
  - - [5888, 1856, 1, 256, 5888, 5888, 256, 256]
    - [10, 22008.0]
  - - [704, 6784, 1, 256, 704, 704, 256, 256]
    - [4, 19376.0]
  - - [512, 24000, 1, 1536, 512, 512, 1536, 1536]
    - [17, 23369.0]
  - - [5888, 1856, 1, 3328, 5888, 5888, 3328, 3328]
    - [24, 22230.0]
  - - [5056, 704, 1, 256, 5056, 5056, 256, 256]
    - [16, 16561.0]
  - - [5888, 2944, 1, 3328, 5888, 5888, 3328, 3328]
    - [11, 24376.0]
  - - [1856, 4288, 1, 256, 1856, 1856, 256, 256]
    - [13, 18421.0]
  - - [5056, 5056, 1, 3328, 5056, 5056, 3328, 3328]
    - [3, 24373.0]
  - - [1408, 5888, 1, 1280, 1408, 1408, 1280, 1280]
    - [19, 23547.0]
  - - [1024, 3584, 1, 3328, 1024, 1024, 3328, 3328]
    - [3, 22344.0]
  - - [512, 48000, 1, 2048, 512, 512, 2048, 2048]
    - [5, 24601.0]
  - - [448, 3584, 1, 3328, 448, 448, 3328, 3328]
    - [3, 18846.0]
  - - [5888, 1408, 1, 1280, 5888, 5888, 1280, 1280]
    - [30, 23187.0]
  - - [1024, 2368, 1, 256, 1024, 1024, 256, 256]
    - [16, 17797.0]
  - - [5056, 6784, 1, 1280, 5056, 5056, 1280, 1280]
    - [11, 24342.0]
  - - [5056, 5056, 1, 1280, 5056, 5056, 1280, 1280]
    - [19, 24250.0]
  - - [448, 5056, 1, 256, 448, 448, 256, 256]
    - [16, 16615.0]
  - - [6784, 448, 1, 256, 6784, 6784, 256, 256]
    - [12, 15827.0]
  - - [1760, 6400, 1, 1760, 1760, 1760, 1760, 1760]
    - [10, 24141.0]
  - - [5888, 704, 1, 1280, 5888, 5888, 1280, 1280]
    - [26, 21288.0]
  - - [6784, 4288, 1, 3328, 6784, 6784, 3328, 3328]
    - [3, 24271.0]
  - - [1856, 2368, 1, 3328, 1856, 1856, 3328, 3328]
    - [3, 19924.0]
  - - [5888, 2944, 1, 1280, 5888, 5888, 1280, 1280]
    - [30, 24253.0]
  - - [5888, 1024, 1, 256, 5888, 5888, 256, 256]
    - [10, 22183.0]
  - - [16384, 3200, 1, 4096, 16384, 16384, 4096, 4096]
    - [24, 21245.0]
  - - [1408, 2944, 1, 256, 1408, 1408, 256, 256]
    - [12, 16073.0]
  - - [6784, 5056, 1, 3328, 6784, 6784, 3328, 3328]
    - [3, 24731.0]
  - - [5056, 5056, 1, 256, 5056, 5056, 256, 256]
    - [29, 22952.0]
  - - [1024, 3584, 1, 1280, 1024, 1024, 1280, 1280]
    - [3, 22152.0]
  - - [2368, 2944, 1, 1280, 2368, 2368, 1280, 1280]
    - [10, 22332.0]
  - - [6784, 6784, 1, 1280, 6784, 6784, 1280, 1280]
    - [10, 24577.0]
  - - [1408, 4288, 1, 1280, 1408, 1408, 1280, 1280]
    - [19, 22037.0]
  - - [3584, 4288, 1, 1280, 3584, 3584, 1280, 1280]
    - [3, 24082.0]
  - - [2368, 704, 1, 1280, 2368, 2368, 1280, 1280]
    - [7, 18307.0]
  - - [5056, 4288, 1, 3328, 5056, 5056, 3328, 3328]
    - [3, 24297.0]
  - - [3584, 2368, 1, 3328, 3584, 3584, 3328, 3328]
    - [13, 22388.0]
  - - [6784, 448, 1, 1280, 6784, 6784, 1280, 1280]
    - [23, 19230.0]
  - - [4288, 2944, 1, 256, 4288, 4288, 256, 256]
    - [29, 22711.0]
  - - [6144, 24000, 1, 2560, 6144, 6144, 2560, 2560]
    - [8, 23729.0]
  - - [5056, 2368, 1, 1280, 5056, 5056, 1280, 1280]
    - [30, 22993.0]
  - - [448, 3584, 1, 1280, 448, 448, 1280, 1280]
    - [3, 18331.0]
  - - [6784, 5888, 1, 256, 6784, 6784, 256, 256]
    - [13, 24541.0]
  - - [1024, 1408, 1, 256, 1024, 1024, 256, 256]
    - [15, 16947.0]
  - - [2368, 2368, 1, 3328, 2368, 2368, 3328, 3328]
    - [26, 20906.0]
  - - [5056, 704, 1, 3328, 5056, 5056, 3328, 3328]
    - [13, 21512.0]
  - - [1408, 1856, 1, 256, 1408, 1408, 256, 256]
    - [28, 16650.0]
  - - [3584, 2368, 1, 1280, 3584, 3584, 1280, 1280]
    - [3, 22585.0]
  - - [704, 5888, 1, 256, 704, 704, 256, 256]
    - [29, 19315.0]
  - - [2560, 1600, 1, 2560, 2560, 2560, 2560, 2560]
    - [32, 20423.0]
  - - [6144, 5984, 1, 2048, 6144, 6144, 2048, 2048]
    - [7, 23887.0]
  - - [3584, 704, 1, 3328, 3584, 3584, 3328, 3328]
    - [26, 17624.0]
  - - [1408, 1408, 1, 256, 1408, 1408, 256, 256]
    - [10, 16081.0]
  - - [448, 4288, 1, 256, 448, 448, 256, 256]
    - [29, 14610.0]
  - - [704, 2368, 1, 1280, 704, 704, 1280, 1280]
    - [29, 18219.0]
  - - [1856, 2368, 1, 1280, 1856, 1856, 1280, 1280]
    - [10, 20023.0]
  - - [1408, 1024, 1, 1280, 1408, 1408, 1280, 1280]
    - [29, 18522.0]
  - - [6784, 704, 1, 256, 6784, 6784, 256, 256]
    - [10, 18724.0]
  - - [2048, 1600, 1, 512, 2048, 2048, 512, 512]
    - [29, 18248.0]
  - - [2048, 7000, 1, 2048, 2048, 2048, 2048, 2048]
    - [7, 21874.0]
  - - [1408, 3584, 1, 256, 1408, 1408, 256, 256]
    - [26, 20486.0]
  - - [3584, 4288, 1, 3328, 3584, 3584, 3328, 3328]
    - [13, 24267.0]
  - - [5888, 1856, 1, 1280, 5888, 5888, 1280, 1280]
    - [10, 22684.0]
  - - [5056, 1024, 1, 3328, 5056, 5056, 3328, 3328]
    - [3, 23876.0]
  - - [2368, 3584, 1, 1280, 2368, 2368, 1280, 1280]
    - [3, 22790.0]
  - - [2944, 3584, 1, 3328, 2944, 2944, 3328, 3328]
    - [26, 23537.0]
  - - [6784, 2944, 1, 256, 6784, 6784, 256, 256]
    - [10, 23555.0]
  - - [4288, 2368, 1, 3328, 4288, 4288, 3328, 3328]
    - [24, 22283.0]
  - - [1856, 2368, 1, 256, 1856, 1856, 256, 256]
    - [26, 17814.0]
  - - [3584, 6784, 1, 3328, 3584, 3584, 3328, 3328]
    - [11, 24475.0]
  - - [5056, 4288, 1, 1280, 5056, 5056, 1280, 1280]
    - [3, 24131.0]
  - - [6784, 1856, 1, 3328, 6784, 6784, 3328, 3328]
    - [11, 22090.0]
  - - [1408, 5056, 1, 1280, 1408, 1408, 1280, 1280]
    - [19, 23700.0]
  - - [6784, 5888, 1, 3328, 6784, 6784, 3328, 3328]
    - [13, 25047.0]
  - - [8448, 12000, 1, 2816, 8448, 8448, 2816, 2816]
    - [11, 24523.0]
  - - [4096, 800, 1, 1024, 4096, 4096, 1024, 1024]
    - [18, 16432.0]
  - - [8192, 3200, 1, 2048, 8192, 8192, 2048, 2048]
    - [9, 21027.0]
  - - [2368, 5056, 1, 1280, 2368, 2368, 1280, 1280]
    - [3, 23496.0]
  - - [1024, 5056, 1, 1280, 1024, 1024, 1280, 1280]
    - [3, 22883.0]
  - - [4288, 1024, 1, 256, 4288, 4288, 256, 256]
    - [7, 19987.0]
  - - [2368, 1408, 1, 256, 2368, 2368, 256, 256]
    - [2, 17174.0]
  - - [5888, 448, 1, 1280, 5888, 5888, 1280, 1280]
    - [23, 18358.0]
  - - [704, 5888, 1, 3328, 704, 704, 3328, 3328]
    - [3, 21692.0]
  - - [1024, 6784, 1, 1280, 1024, 1024, 1280, 1280]
    - [7, 22603.0]
  - - [3584, 2944, 1, 1280, 3584, 3584, 1280, 1280]
    - [3, 23183.0]
  - - [512, 24000, 1, 2048, 512, 512, 2048, 2048]
    - [5, 23651.0]
  - - [1408, 5056, 1, 3328, 1408, 1408, 3328, 3328]
    - [13, 23687.0]
  - - [1856, 1856, 1, 3328, 1856, 1856, 3328, 3328]
    - [13, 20944.0]
  - - [2560, 800, 1, 2560, 2560, 2560, 2560, 2560]
    - [19, 17920.0]
  - - [2368, 2368, 1, 256, 2368, 2368, 256, 256]
    - [10, 19222.0]
  - - [4288, 4288, 1, 1280, 4288, 4288, 1280, 1280]
    - [3, 24009.0]
  - - [5888, 1024, 1, 1280, 5888, 5888, 1280, 1280]
    - [10, 22665.0]
  - - [512, 48000, 1, 2560, 512, 512, 2560, 2560]
    - [33, 24353.0]
  - - [704, 6784, 1, 3328, 704, 704, 3328, 3328]
    - [1, 21461.0]
  - - [2560, 6400, 1, 2560, 2560, 2560, 2560, 2560]
    - [20, 23995.0]
  - - [5056, 1024, 1, 1280, 5056, 5056, 1280, 1280]
    - [3, 23437.0]
  - - [448, 5888, 1, 3328, 448, 448, 3328, 3328]
    - [13, 19157.0]
  - - [1024, 2944, 1, 1280, 1024, 1024, 1280, 1280]
    - [29, 20840.0]
  - - [5056, 5888, 1, 1280, 5056, 5056, 1280, 1280]
    - [19, 24566.0]
  - - [448, 6784, 1, 256, 448, 448, 256, 256]
    - [16, 16855.0]
  - - [3584, 5888, 1, 256, 3584, 3584, 256, 256]
    - [16, 23769.0]
  - - [2944, 3584, 1, 256, 2944, 2944, 256, 256]
    - [10, 22756.0]
  - - [6784, 1024, 1, 3328, 6784, 6784, 3328, 3328]
    - [3, 23761.0]
  - - [6784, 2944, 1, 3328, 6784, 6784, 3328, 3328]
    - [13, 23723.0]
  - - [2944, 5056, 1, 3328, 2944, 2944, 3328, 3328]
    - [13, 24624.0]
  - - [6784, 2368, 1, 1280, 6784, 6784, 1280, 1280]
    - [10, 23284.0]
  - - [4288, 5888, 1, 1280, 4288, 4288, 1280, 1280]
    - [19, 24033.0]
  - - [4288, 4288, 1, 256, 4288, 4288, 256, 256]
    - [4, 22832.0]
  - - [4288, 1856, 1, 1280, 4288, 4288, 1280, 1280]
    - [17, 22297.0]
  - - [1856, 2944, 1, 3328, 1856, 1856, 3328, 3328]
    - [3, 22445.0]
  - - [256, 6784, 1, 3328, 256, 256, 3328, 3328]
    - [19, 19995.0]
  - - [5056, 1024, 1, 256, 5056, 5056, 256, 256]
    - [13, 19700.0]
  - - [5056, 1856, 1, 3328, 5056, 5056, 3328, 3328]
    - [24, 22995.0]
  - - [1856, 1408, 1, 256, 1856, 1856, 256, 256]
    - [25, 16151.0]
  - - [4096, 7000, 1, 4096, 4096, 4096, 4096, 4096]
    - [34, 20675.0]
  - - [5056, 256, 1, 3328, 5056, 5056, 3328, 3328]
    - [0, 20252.0]
  - - [1024, 5888, 1, 1280, 1024, 1024, 1280, 1280]
    - [3, 21889.0]
  - - [6144, 24000, 1, 2048, 6144, 6144, 2048, 2048]
    - [5, 21635.0]
  - - [5056, 3584, 1, 256, 5056, 5056, 256, 256]
    - [26, 22729.0]
  - - [1856, 1024, 1, 1280, 1856, 1856, 1280, 1280]
    - [7, 20968.0]
  - - [1856, 1856, 1, 1280, 1856, 1856, 1280, 1280]
    - [3, 20274.0]
  - - [4096, 400, 1, 1024, 4096, 4096, 1024, 1024]
    - [4, 15543.0]
  - - [3072, 24000, 1, 1024, 3072, 3072, 1024, 1024]
    - [7, 24421.0]
  - - [1856, 1024, 1, 3328, 1856, 1856, 3328, 3328]
    - [3, 21764.0]
  - - [5888, 5888, 1, 3328, 5888, 5888, 3328, 3328]
    - [3, 25035.0]
  - - [6784, 1024, 1, 256, 6784, 6784, 256, 256]
    - [7, 21406.0]
  - - [5056, 5888, 1, 3328, 5056, 5056, 3328, 3328]
    - [3, 24713.0]
  - - [1856, 1024, 1, 256, 1856, 1856, 256, 256]
    - [12, 16882.0]
  - - [512, 48000, 1, 1536, 512, 512, 1536, 1536]
    - [5, 24557.0]
  - - [5056, 1408, 1, 3328, 5056, 5056, 3328, 3328]
    - [1, 23702.0]
  - - [8448, 5984, 1, 2816, 8448, 8448, 2816, 2816]
    - [17, 24959.0]
  - - [4288, 1024, 1, 3328, 4288, 4288, 3328, 3328]
    - [3, 22468.0]
  - - [1024, 24000, 1, 2560, 1024, 1024, 2560, 2560]
    - [8, 24176.0]
  - - [2944, 1408, 1, 3328, 2944, 2944, 3328, 3328]
    - [13, 21275.0]
  - - [2944, 4288, 1, 3328, 2944, 2944, 3328, 3328]
    - [3, 23958.0]
  - - [5056, 2944, 1, 256, 5056, 5056, 256, 256]
    - [16, 23008.0]
  - - [2368, 1856, 1, 256, 2368, 2368, 256, 256]
    - [10, 19286.0]
  - - [1408, 3584, 1, 3328, 1408, 1408, 3328, 3328]
    - [13, 23658.0]
  - - [2368, 6784, 1, 256, 2368, 2368, 256, 256]
    - [23, 22544.0]
  - - [5056, 1408, 1, 1280, 5056, 5056, 1280, 1280]
    - [30, 22934.0]
  - - [704, 3584, 1, 1280, 704, 704, 1280, 1280]
    - [3, 18288.0]
  - - [1408, 5888, 1, 3328, 1408, 1408, 3328, 3328]
    - [3, 24019.0]
  - - [1856, 5056, 1, 256, 1856, 1856, 256, 256]
    - [3, 20133.0]
  - - [6784, 6784, 1, 256, 6784, 6784, 256, 256]
    - [10, 24292.0]
  - - [2368, 4288, 1, 1280, 2368, 2368, 1280, 1280]
    - [3, 22403.0]
  - - [3584, 1856, 1, 1280, 3584, 3584, 1280, 1280]
    - [10, 21133.0]
  - - [5888, 5056, 1, 256, 5888, 5888, 256, 256]
    - [4, 23545.0]
  - - [8448, 48000, 1, 2816, 8448, 8448, 2816, 2816]
    - [24, 25232.0]
  - - [3584, 448, 1, 256, 3584, 3584, 256, 256]
    - [28, 10915.0]
  - - [3584, 3584, 1, 1280, 3584, 3584, 1280, 1280]
    - [7, 24217.0]
  - - [256, 6784, 1, 256, 256, 256, 256, 256]
    - [4, 17518.0]
  - - [1856, 3584, 1, 3328, 1856, 1856, 3328, 3328]
    - [3, 22596.0]
  - - [5056, 256, 1, 1280, 5056, 5056, 1280, 1280]
    - [4, 19391.0]
  - - [3584, 3584, 1, 256, 3584, 3584, 256, 256]
    - [16, 23216.0]
  - - [6784, 4288, 1, 1280, 6784, 6784, 1280, 1280]
    - [3, 24182.0]
  - - [704, 5056, 1, 256, 704, 704, 256, 256]
    - [12, 17523.0]
  - - [2944, 2368, 1, 1280, 2944, 2944, 1280, 1280]
    - [10, 22111.0]
  - - [6784, 3584, 1, 256, 6784, 6784, 256, 256]
    - [26, 23861.0]
  - - [2944, 2944, 1, 3328, 2944, 2944, 3328, 3328]
    - [13, 23172.0]
  - - [5056, 6784, 1, 256, 5056, 5056, 256, 256]
    - [10, 23835.0]
  - - [1408, 4288, 1, 3328, 1408, 1408, 3328, 3328]
    - [3, 22670.0]
  - - [6784, 256, 1, 1280, 6784, 6784, 1280, 1280]
    - [32, 19676.0]
  - - [2368, 704, 1, 3328, 2368, 2368, 3328, 3328]
    - [19, 19363.0]
  - - [3584, 6784, 1, 256, 3584, 3584, 256, 256]
    - [16, 23854.0]
  - - [5056, 1856, 1, 256, 5056, 5056, 256, 256]
    - [16, 21787.0]
  - - [4608, 5984, 1, 1536, 4608, 4608, 1536, 1536]
    - [7, 23830.0]
  - - [1760, 3200, 1, 1760, 1760, 1760, 1760, 1760]
    - [23, 22939.0]
  - - [4096, 1600, 1, 1024, 4096, 4096, 1024, 1024]
    - [18, 19454.0]
  - - [704, 4288, 1, 256, 704, 704, 256, 256]
    - [29, 16591.0]
  - - [1408, 6784, 1, 1280, 1408, 1408, 1280, 1280]
    - [26, 23702.0]
  - - [7680, 24000, 1, 2560, 7680, 7680, 2560, 2560]
    - [20, 24393.0]
  - - [4608, 48000, 1, 1536, 4608, 4608, 1536, 1536]
    - [14, 24779.0]
  - - [6144, 48000, 1, 2048, 6144, 6144, 2048, 2048]
    - [11, 23963.0]
  - - [1024, 24000, 1, 1536, 1024, 1024, 1536, 1536]
    - [5, 23851.0]
  - - [5056, 2368, 1, 3328, 5056, 5056, 3328, 3328]
    - [11, 23159.0]
  - - [2944, 4288, 1, 256, 2944, 2944, 256, 256]
    - [29, 22153.0]
  - - [1408, 3584, 1, 1280, 1408, 1408, 1280, 1280]
    - [3, 23102.0]
  - - [8192, 1600, 1, 2048, 8192, 8192, 2048, 2048]
    - [7, 21000.0]
  - - [512, 24000, 1, 2560, 512, 512, 2560, 2560]
    - [20, 22930.0]
  - - [2368, 6784, 1, 3328, 2368, 2368, 3328, 3328]
    - [3, 23493.0]
  - - [5056, 704, 1, 1280, 5056, 5056, 1280, 1280]
    - [19, 20398.0]
  - - [1856, 4288, 1, 3328, 1856, 1856, 3328, 3328]
    - [13, 22859.0]
  - - [1408, 5888, 1, 256, 1408, 1408, 256, 256]
    - [26, 22865.0]
  - - [3584, 704, 1, 1280, 3584, 3584, 1280, 1280]
    - [10, 18453.0]
  - - [3584, 448, 1, 3328, 3584, 3584, 3328, 3328]
    - [19, 18368.0]
  - - [704, 2368, 1, 3328, 704, 704, 3328, 3328]
    - [7, 19330.0]
  - - [448, 5056, 1, 3328, 448, 448, 3328, 3328]
    - [13, 20206.0]
  - - [4288, 448, 1, 256, 4288, 4288, 256, 256]
    - [15, 14777.0]
  - - [448, 5888, 1, 256, 448, 448, 256, 256]
    - [13, 15552.0]
  - - [2048, 3200, 1, 512, 2048, 2048, 512, 512]
    - [5, 21345.0]
  - - [5888, 2368, 1, 256, 5888, 5888, 256, 256]
    - [10, 22591.0]
  - - [6784, 704, 1, 3328, 6784, 6784, 3328, 3328]
    - [3, 22137.0]
  - - [1408, 2944, 1, 3328, 1408, 1408, 3328, 3328]
    - [13, 21805.0]
  - - [4608, 12000, 1, 1536, 4608, 4608, 1536, 1536]
    - [7, 24603.0]
  - - [2368, 704, 1, 256, 2368, 2368, 256, 256]
    - [2, 14585.0]
  - - [3584, 2368, 1, 256, 3584, 3584, 256, 256]
    - [23, 20915.0]
  - - [5888, 5056, 1, 1280, 5888, 5888, 1280, 1280]
    - [3, 24556.0]
  - - [8448, 24000, 1, 2816, 8448, 8448, 2816, 2816]
    - [14, 25029.0]
  - - [3584, 3584, 1, 3328, 3584, 3584, 3328, 3328]
    - [27, 24238.0]
  - - [5888, 6784, 1, 256, 5888, 5888, 256, 256]
    - [10, 24327.0]
  - - [4288, 2944, 1, 3328, 4288, 4288, 3328, 3328]
    - [30, 23812.0]
  - - [256, 5056, 1, 1280, 256, 256, 1280, 1280]
    - [19, 19432.0]
  - - [6784, 5888, 1, 1280, 6784, 6784, 1280, 1280]
    - [3, 24977.0]
  - - [2048, 800, 1, 512, 2048, 2048, 512, 512]
    - [6, 15888.0]
  - - [5888, 4288, 1, 1280, 5888, 5888, 1280, 1280]
    - [3, 24020.0]
  - - [1024, 24000, 1, 2048, 1024, 1024, 2048, 2048]
    - [33, 23393.0]
  - - [1408, 1856, 1, 1280, 1408, 1408, 1280, 1280]
    - [19, 18532.0]
  - - [5888, 448, 1, 3328, 5888, 5888, 3328, 3328]
    - [19, 19058.0]
  - - [704, 5888, 1, 1280, 704, 704, 1280, 1280]
    - [26, 20519.0]
  - - [1024, 6784, 1, 3328, 1024, 1024, 3328, 3328]
    - [3, 23319.0]
  - - [704, 2944, 1, 1280, 704, 704, 1280, 1280]
    - [23, 17969.0]
  - - [5056, 2944, 1, 3328, 5056, 5056, 3328, 3328]
    - [24, 24402.0]
  - - [1408, 1408, 1, 3328, 1408, 1408, 3328, 3328]
    - [26, 17943.0]
  - - [448, 4288, 1, 1280, 448, 448, 1280, 1280]
    - [29, 18025.0]
  - - [3584, 704, 1, 256, 3584, 3584, 256, 256]
    - [28, 16084.0]
  - - [3584, 1408, 1, 3328, 3584, 3584, 3328, 3328]
    - [11, 22590.0]
  - - [2368, 1024, 1, 1280, 2368, 2368, 1280, 1280]
    - [3, 20582.0]
  - - [2944, 6784, 1, 1280, 2944, 2944, 1280, 1280]
    - [23, 23850.0]
  - - [1856, 6784, 1, 256, 1856, 1856, 256, 256]
    - [4, 22093.0]
  - - [4288, 448, 1, 3328, 4288, 4288, 3328, 3328]
    - [23, 18480.0]
  - - [4288, 3584, 1, 1280, 4288, 4288, 1280, 1280]
    - [3, 24305.0]
  - - [6144, 12000, 1, 2048, 6144, 6144, 2048, 2048]
    - [7, 24401.0]
  - - [8192, 800, 1, 2048, 8192, 8192, 2048, 2048]
    - [7, 17833.0]
  - - [5888, 1024, 1, 3328, 5888, 5888, 3328, 3328]
    - [3, 22702.0]
  - - [704, 6784, 1, 1280, 704, 704, 1280, 1280]
    - [24, 20913.0]
  - - [704, 5056, 1, 1280, 704, 704, 1280, 1280]
    - [3, 20774.0]
  - - [2944, 1856, 1, 256, 2944, 2944, 256, 256]
    - [10, 19428.0]
  - - [3584, 5056, 1, 256, 3584, 3584, 256, 256]
    - [4, 22904.0]
  - - [5888, 5056, 1, 3328, 5888, 5888, 3328, 3328]
    - [3, 24698.0]
  - - [3584, 6784, 1, 1280, 3584, 3584, 1280, 1280]
    - [17, 24254.0]
  - - [1856, 5888, 1, 256, 1856, 1856, 256, 256]
    - [29, 21597.0]
  - - [4288, 4288, 1, 3328, 4288, 4288, 3328, 3328]
    - [3, 24088.0]
  - - [4288, 1408, 1, 1280, 4288, 4288, 1280, 1280]
    - [10, 22279.0]
  - - [4288, 2368, 1, 256, 4288, 4288, 256, 256]
    - [23, 21752.0]
  - - [2944, 5056, 1, 1280, 2944, 2944, 1280, 1280]
    - [3, 24416.0]
  - - [6784, 2368, 1, 3328, 6784, 6784, 3328, 3328]
    - [13, 22714.0]
  - - [4288, 1856, 1, 3328, 4288, 4288, 3328, 3328]
    - [17, 22573.0]
  - - [1856, 2944, 1, 1280, 1856, 1856, 1280, 1280]
    - [19, 22148.0]
  - - [2048, 1600, 1, 2048, 2048, 2048, 2048, 2048]
    - [20, 19069.0]
  - - [4288, 6784, 1, 3328, 4288, 4288, 3328, 3328]
    - [11, 24265.0]
  - - [3584, 1024, 1, 1280, 3584, 3584, 1280, 1280]
    - [26, 20528.0]
  - - [1024, 4288, 1, 256, 1024, 1024, 256, 256]
    - [15, 17553.0]
  - - [5888, 3584, 1, 3328, 5888, 5888, 3328, 3328]
    - [7, 24424.0]
  - - [5056, 3584, 1, 3328, 5056, 5056, 3328, 3328]
    - [13, 24645.0]
  - - [2368, 1408, 1, 1280, 2368, 2368, 1280, 1280]
    - [3, 19831.0]
  - - [5056, 2944, 1, 1280, 5056, 5056, 1280, 1280]
    - [30, 23906.0]
  - - [1024, 6784, 1, 256, 1024, 1024, 256, 256]
    - [4, 22219.0]
  - - [3584, 2944, 1, 256, 3584, 3584, 256, 256]
    - [4, 22953.0]
  - - [3584, 1408, 1, 1280, 3584, 3584, 1280, 1280]
    - [24, 22106.0]
  - - [5056, 6784, 1, 3328, 5056, 5056, 3328, 3328]
    - [11, 24678.0]
  - - [3584, 4288, 1, 256, 3584, 3584, 256, 256]
    - [29, 22331.0]
  - - [1856, 6784, 1, 3328, 1856, 1856, 3328, 3328]
    - [3, 22742.0]
  - - [5056, 1408, 1, 256, 5056, 5056, 256, 256]
    - [16, 19192.0]
  - - [3584, 1024, 1, 256, 3584, 3584, 256, 256]
    - [16, 19356.0]
  - - [5888, 5888, 1, 256, 5888, 5888, 256, 256]
    - [26, 24386.0]
  - - [4288, 1024, 1, 1280, 4288, 4288, 1280, 1280]
    - [3, 22989.0]
  - - [448, 6784, 1, 3328, 448, 448, 3328, 3328]
    - [13, 18487.0]
  - - [2944, 1408, 1, 1280, 2944, 2944, 1280, 1280]
    - [23, 21386.0]
  - - [2944, 1856, 1, 3328, 2944, 2944, 3328, 3328]
    - [24, 21899.0]
  - - [3584, 5888, 1, 1280, 3584, 3584, 1280, 1280]
    - [3, 24327.0]
  - - [6784, 1856, 1, 1280, 6784, 6784, 1280, 1280]
    - [10, 23018.0]
  - - [5888, 256, 1, 3328, 5888, 5888, 3328, 3328]
    - [0, 19976.0]
  - - [1856, 5888, 1, 3328, 1856, 1856, 3328, 3328]
    - [3, 22855.0]
  - - [3584, 1408, 1, 256, 3584, 3584, 256, 256]
    - [16, 20103.0]
  - - [704, 3584, 1, 3328, 704, 704, 3328, 3328]
    - [32, 18350.0]
  - - [4096, 3200, 1, 1024, 4096, 4096, 1024, 1024]
    - [7, 22587.0]
  - - [5056, 448, 1, 1280, 5056, 5056, 1280, 1280]
    - [10, 18945.0]
  - - [3584, 1856, 1, 3328, 3584, 3584, 3328, 3328]
    - [11, 21975.0]
  - - [2944, 1024, 1, 256, 2944, 2944, 256, 256]
    - [13, 18769.0]
  - - [2368, 4288, 1, 3328, 2368, 2368, 3328, 3328]
    - [26, 22603.0]
  - - [1024, 1408, 1, 1280, 1024, 1024, 1280, 1280]
    - [0, 18770.0]
  - - [6784, 5056, 1, 256, 6784, 6784, 256, 256]
    - [4, 23724.0]
  - - [3584, 5056, 1, 3328, 3584, 3584, 3328, 3328]
    - [26, 24483.0]
  - - [4288, 5888, 1, 256, 4288, 4288, 256, 256]
    - [7, 23298.0]
  - - [2944, 6784, 1, 256, 2944, 2944, 256, 256]
    - [10, 23774.0]
  - - [2368, 2368, 1, 1280, 2368, 2368, 1280, 1280]
    - [10, 21186.0]
  - - [1856, 3584, 1, 1280, 1856, 1856, 1280, 1280]
    - [3, 22566.0]
  - - [5056, 3584, 1, 1280, 5056, 5056, 1280, 1280]
    - [19, 24544.0]
  - - [256, 5888, 1, 256, 256, 256, 256, 256]
    - [25, 17257.0]
  - - [1856, 1408, 1, 3328, 1856, 1856, 3328, 3328]
    - [19, 18951.0]
  - - [1024, 4288, 1, 3328, 1024, 1024, 3328, 3328]
    - [3, 22654.0]
  - - [2944, 2368, 1, 3328, 2944, 2944, 3328, 3328]
    - [3, 21764.0]
  - - [704, 4288, 1, 3328, 704, 704, 3328, 3328]
    - [3, 18504.0]
  - - [1024, 1856, 1, 1280, 1024, 1024, 1280, 1280]
    - [29, 20215.0]
  - - [2048, 6400, 1, 2048, 2048, 2048, 2048, 2048]
    - [7, 22513.0]
  - - [512, 48000, 1, 2816, 512, 512, 2816, 2816]
    - [30, 24621.0]
  - - [5124, 9124, 1, 2560, 5124, 5124, 2560, 2560]
    - [7, 23837.0]
  - - [1024, 5888, 1, 256, 1024, 1024, 256, 256]
    - [4, 20702.0]
  - - [1408, 2368, 1, 256, 1408, 1408, 256, 256]
    - [12, 18007.0]
  - - [2944, 704, 1, 3328, 2944, 2944, 3328, 3328]
    - [26, 18754.0]
  - - [2944, 2944, 1, 1280, 2944, 2944, 1280, 1280]
    - [3, 23153.0]
  - - [6784, 256, 1, 3328, 6784, 6784, 3328, 3328]
    - [3, 20467.0]
  - - [1408, 5056, 1, 256, 1408, 1408, 256, 256]
    - [26, 20928.0]
  - - [4608, 24000, 1, 1536, 4608, 4608, 1536, 1536]
    - [20, 24863.0]
  - - [1408, 4288, 1, 256, 1408, 1408, 256, 256]
    - [3, 19105.0]
  - - [5888, 2368, 1, 1280, 5888, 5888, 1280, 1280]
    - [30, 23593.0]
  - - [2368, 5888, 1, 1280, 2368, 2368, 1280, 1280]
    - [3, 23997.0]
  - - [5888, 256, 1, 1280, 5888, 5888, 1280, 1280]
    - [4, 20060.0]
  - - [2368, 1856, 1, 3328, 2368, 2368, 3328, 3328]
    - [3, 20385.0]
  - - [2944, 704, 1, 256, 2944, 2944, 256, 256]
    - [10, 16049.0]
  - - [2368, 6784, 1, 1280, 2368, 2368, 1280, 1280]
    - [3, 23435.0]
  - - [2368, 1024, 1, 3328, 2368, 2368, 3328, 3328]
    - [3, 21686.0]
  - - [1856, 4288, 1, 1280, 1856, 1856, 1280, 1280]
    - [3, 22716.0]
  - - [704, 3584, 1, 256, 704, 704, 256, 256]
    - [2, 16830.0]
  - - [704, 2944, 1, 3328, 704, 704, 3328, 3328]
    - [3, 18694.0]
  - - [1856, 5056, 1, 3328, 1856, 1856, 3328, 3328]
    - [26, 23372.0]
  - - [3584, 5056, 1, 1280, 3584, 3584, 1280, 1280]
    - [3, 24308.0]
  - - [2944, 1024, 1, 3328, 2944, 2944, 3328, 3328]
    - [13, 21826.0]
  - - [1408, 6784, 1, 256, 1408, 1408, 256, 256]
    - [26, 22413.0]
  - - [6784, 1408, 1, 3328, 6784, 6784, 3328, 3328]
    - [30, 23446.0]
  - - [1024, 2368, 1, 1280, 1024, 1024, 1280, 1280]
    - [29, 19418.0]
  - - [6784, 2944, 1, 1280, 6784, 6784, 1280, 1280]
    - [10, 24115.0]
  - - [3584, 448, 1, 1280, 3584, 3584, 1280, 1280]
    - [23, 17590.0]
  - - [2944, 6784, 1, 3328, 2944, 2944, 3328, 3328]
    - [3, 23908.0]
  - - [448, 5056, 1, 1280, 448, 448, 1280, 1280]
    - [3, 19178.0]
  - - [4288, 704, 1, 256, 4288, 4288, 256, 256]
    - [29, 16276.0]
  - - [5888, 704, 1, 256, 5888, 5888, 256, 256]
    - [16, 17859.0]
  - - [256, 5888, 1, 3328, 256, 256, 3328, 3328]
    - [10, 19714.0]
  - - [6784, 4288, 1, 256, 6784, 6784, 256, 256]
    - [10, 23295.0]
  - - [5888, 256, 1, 256, 5888, 5888, 256, 256]
    - [31, 17242.0]
  - - [6784, 1024, 1, 1280, 6784, 6784, 1280, 1280]
    - [3, 23648.0]
  - - [2944, 704, 1, 1280, 2944, 2944, 1280, 1280]
    - [10, 19210.0]
  - - [6784, 3584, 1, 1280, 6784, 6784, 1280, 1280]
    - [3, 24522.0]
  - - [1408, 2944, 1, 1280, 1408, 1408, 1280, 1280]
    - [32, 21551.0]
  - - [2048, 800, 1, 2048, 2048, 2048, 2048, 2048]
    - [16, 17364.0]
  - - [1408, 2368, 1, 3328, 1408, 1408, 3328, 3328]
    - [7, 20572.0]
  - - [2368, 2944, 1, 256, 2368, 2368, 256, 256]
    - [4, 20504.0]
  - - [2944, 5888, 1, 256, 2944, 2944, 256, 256]
    - [13, 23619.0]
  - - [3584, 1856, 1, 256, 3584, 3584, 256, 256]
    - [16, 21425.0]
  - - [4288, 2944, 1, 1280, 4288, 4288, 1280, 1280]
    - [17, 23497.0]
  - - [5056, 448, 1, 3328, 5056, 5056, 3328, 3328]
    - [3, 20365.0]
  - - [4288, 5056, 1, 3328, 4288, 4288, 3328, 3328]
    - [3, 24383.0]
  - - [256, 5056, 1, 3328, 256, 256, 3328, 3328]
    - [7, 21268.0]
  - - [5056, 2368, 1, 256, 5056, 5056, 256, 256]
    - [29, 22543.0]
  - - [4288, 704, 1, 3328, 4288, 4288, 3328, 3328]
    - [3, 18773.0]
  - - [448, 3584, 1, 256, 448, 448, 256, 256]
    - [23, 15773.0]
  - - [1024, 1408, 1, 3328, 1024, 1024, 3328, 3328]
    - [4, 19539.0]
  - - [2944, 5888, 1, 1280, 2944, 2944, 1280, 1280]
    - [7, 24434.0]
  - - [5888, 3584, 1, 256, 5888, 5888, 256, 256]
    - [10, 23946.0]
  - - [1408, 1856, 1, 3328, 1408, 1408, 3328, 3328]
    - [13, 19410.0]
  - - [6784, 1408, 1, 1280, 6784, 6784, 1280, 1280]
    - [5, 23550.0]
  - - [704, 2944, 1, 256, 704, 704, 256, 256]
    - [4, 17877.0]
  - - [2944, 5888, 1, 3328, 2944, 2944, 3328, 3328]
    - [19, 24482.0]
  - - [1408, 6784, 1, 3328, 1408, 1408, 3328, 3328]
    - [26, 24052.0]
  - - [1408, 1408, 1, 1280, 1408, 1408, 1280, 1280]
    - [23, 18883.0]
  - - [16384, 400, 1, 4096, 16384, 16384, 4096, 4096]
    - [7, 17340.0]
  - - [448, 4288, 1, 3328, 448, 448, 3328, 3328]
    - [10, 18534.0]
  - - [704, 2368, 1, 256, 704, 704, 256, 256]
    - [29, 16093.0]
  - - [5888, 2368, 1, 3328, 5888, 5888, 3328, 3328]
    - [24, 24031.0]
  - - [5124, 9124, 1, 1760, 5124, 5124, 1760, 1760]
    - [26, 24295.0]
  - - [4288, 5056, 1, 256, 4288, 4288, 256, 256]
    - [16, 23129.0]
  - - [4288, 448, 1, 1280, 4288, 4288, 1280, 1280]
    - [23, 18637.0]
  - - [5888, 704, 1, 3328, 5888, 5888, 3328, 3328]
    - [32, 21967.0]
  - - [4288, 3584, 1, 3328, 4288, 4288, 3328, 3328]
    - [3, 24419.0]
  - - [1408, 1024, 1, 256, 1408, 1408, 256, 256]
    - [12, 16419.0]
  - - [8192, 400, 1, 2048, 8192, 8192, 2048, 2048]
    - [7, 17194.0]
  - - [2560, 7000, 1, 2560, 2560, 2560, 2560, 2560]
    - [20, 24322.0]
  - - [6784, 6784, 1, 3328, 6784, 6784, 3328, 3328]
    - [11, 24694.0]
  - - [704, 5056, 1, 3328, 704, 704, 3328, 3328]
    - [32, 21901.0]
  - - [2368, 2944, 1, 3328, 2368, 2368, 3328, 3328]
    - [32, 22049.0]
  - - [2368, 3584, 1, 256, 2368, 2368, 256, 256]
    - [10, 22120.0]
  - - [5124, 9124, 1, 4096, 5124, 5124, 4096, 4096]
    - [33, 23507.0]
  - - [7680, 48000, 1, 2560, 7680, 7680, 2560, 2560]
    - [8, 25196.0]
  - - [1024, 48000, 1, 2816, 1024, 1024, 2816, 2816]
    - [24, 25264.0]
  - - [1856, 1856, 1, 256, 1856, 1856, 256, 256]
    - [13, 18138.0]
  - - [4288, 1408, 1, 3328, 4288, 4288, 3328, 3328]
    - [30, 22536.0]
  - - [5124, 9124, 1, 2048, 5124, 5124, 2048, 2048]
    - [7, 24095.0]
  - - [4288, 5056, 1, 1280, 4288, 4288, 1280, 1280]
    - [3, 24233.0]
  - - [5888, 6784, 1, 1280, 5888, 5888, 1280, 1280]
    - [30, 25041.0]
  - - [1760, 1600, 1, 1760, 1760, 1760, 1760, 1760]
    - [3, 20369.0]
  - - [5888, 1408, 1, 3328, 5888, 5888, 3328, 3328]
    - [24, 23919.0]
  - - [256, 5056, 1, 256, 256, 256, 256, 256]
    - [22, 17010.0]
  - - [7680, 12000, 1, 2560, 7680, 7680, 2560, 2560]
    - [20, 25007.0]
  - - [2368, 5056, 1, 256, 2368, 2368, 256, 256]
    - [13, 21971.0]
  - - [1024, 5056, 1, 256, 1024, 1024, 256, 256]
    - [16, 21481.0]
  - - [2368, 1408, 1, 3328, 2368, 2368, 3328, 3328]
    - [3, 20704.0]
  - - [1024, 48000, 1, 1536, 1024, 1024, 1536, 1536]
    - [5, 24904.0]
  - - [5888, 448, 1, 256, 5888, 5888, 256, 256]
    - [28, 17183.0]
  - - [2560, 3200, 1, 2560, 2560, 2560, 2560, 2560]
    - [7, 22828.0]
  - - [6784, 5056, 1, 1280, 6784, 6784, 1280, 1280]
    - [3, 24727.0]
  - - [1024, 48000, 1, 2560, 1024, 1024, 2560, 2560]
    - [5, 24769.0]
  - - [4288, 6784, 1, 1280, 4288, 4288, 1280, 1280]
    - [3, 24210.0]
  - - [16384, 800, 1, 4096, 16384, 16384, 4096, 4096]
    - [21, 18622.0]
  - - [3072, 48000, 1, 1024, 3072, 3072, 1024, 1024]
    - [17, 25151.0]
  - - [6784, 1408, 1, 256, 6784, 6784, 256, 256]
    - [10, 22646.0]
  - - [5888, 4288, 1, 256, 5888, 5888, 256, 256]
    - [16, 23526.0]
  - - [5056, 5888, 1, 256, 5056, 5056, 256, 256]
    - [19, 23887.0]
  - - [2368, 1024, 1, 256, 2368, 2368, 256, 256]
    - [7, 18586.0]
  - - [1856, 6784, 1, 1280, 1856, 1856, 1280, 1280]
    - [23, 23043.0]
  - - [6784, 1856, 1, 256, 6784, 6784, 256, 256]
    - [10, 22509.0]
  - - [4288, 3584, 1, 256, 4288, 4288, 256, 256]
    - [3, 23460.0]
  - - [6784, 448, 1, 3328, 6784, 6784, 3328, 3328]
    - [23, 20034.0]
  - - [5056, 1856, 1, 1280, 5056, 5056, 1280, 1280]
    - [30, 22992.0]
  - - [1408, 1024, 1, 3328, 1408, 1408, 3328, 3328]
    - [16, 19676.0]
  - - [5888, 3584, 1, 1280, 5888, 5888, 1280, 1280]
    - [3, 24502.0]
  - - [1024, 2944, 1, 256, 1024, 1024, 256, 256]
    - [4, 19901.0]
  - - [448, 6784, 1, 1280, 448, 448, 1280, 1280]
    - [29, 19689.0]
  - - [3584, 1024, 1, 3328, 3584, 3584, 3328, 3328]
    - [32, 22779.0]
  - - [2944, 1856, 1, 1280, 2944, 2944, 1280, 1280]
    - [30, 21690.0]
  - - [5056, 256, 1, 256, 5056, 5056, 256, 256]
    - [6, 17700.0]
  - - [2368, 3584, 1, 3328, 2368, 2368, 3328, 3328]
    - [3, 23085.0]
  - - [3584, 5888, 1, 3328, 3584, 3584, 3328, 3328]
    - [17, 24526.0]
  - - [2944, 3584, 1, 1280, 2944, 2944, 1280, 1280]
    - [3, 23545.0]
  - - [1856, 5888, 1, 1280, 1856, 1856, 1280, 1280]
    - [3, 23047.0]
  - - [2048, 3200, 1, 2048, 2048, 2048, 2048, 2048]
    - [9, 20685.0]
  - - [4288, 1408, 1, 256, 4288, 4288, 256, 256]
    - [16, 21515.0]
  - - [4288, 2368, 1, 1280, 4288, 4288, 1280, 1280]
    - [3, 22613.0]
  - - [2944, 5056, 1, 256, 2944, 2944, 256, 256]
    - [16, 23184.0]
  - - [6784, 2368, 1, 256, 6784, 6784, 256, 256]
    - [10, 22863.0]
  - - [1024, 24000, 1, 2816, 1024, 1024, 2816, 2816]
    - [24, 24747.0]
  - - [7680, 5984, 1, 2560, 7680, 7680, 2560, 2560]
    - [17, 24410.0]
  - - [4288, 1856, 1, 256, 4288, 4288, 256, 256]
    - [10, 21187.0]
  - - [1856, 2944, 1, 256, 1856, 1856, 256, 256]
    - [13, 20571.0]
  - - [6144, 48000, 1, 2560, 6144, 6144, 2560, 2560]
    - [8, 25149.0]
  - - [1760, 800, 1, 1760, 1760, 1760, 1760, 1760]
    - [10, 18565.0]
  - - [1856, 1408, 1, 1280, 1856, 1856, 1280, 1280]
    - [10, 19371.0]
  - - [1024, 4288, 1, 1280, 1024, 1024, 1280, 1280]
    - [7, 22601.0]
  - - [2368, 5056, 1, 3328, 2368, 2368, 3328, 3328]
    - [19, 23973.0]
  - - [1024, 5056, 1, 3328, 1024, 1024, 3328, 3328]
    - [7, 24042.0]
  - - [1024, 1856, 1, 3328, 1024, 1024, 3328, 3328]
    - [24, 21119.0]
  - - [4288, 6784, 1, 256, 4288, 4288, 256, 256]
    - [4, 23664.0]
  - - [3584, 2944, 1, 3328, 3584, 3584, 3328, 3328]
    - [30, 23612.0]
  - - [5888, 2944, 1, 256, 5888, 5888, 256, 256]
    - [10, 23938.0]
  - - [5056, 4288, 1, 256, 5056, 5056, 256, 256]
    - [29, 23281.0]
  - - [1024, 3584, 1, 256, 1024, 1024, 256, 256]
    - [4, 20860.0]
  - - [5888, 5888, 1, 1280, 5888, 5888, 1280, 1280]
    - [3, 25052.0]
  - - [448, 5888, 1, 1280, 448, 448, 1280, 1280]
    - [13, 18808.0]
  - - [4288, 704, 1, 1280, 4288, 4288, 1280, 1280]
    - [10, 19245.0]
  - - [2944, 1408, 1, 256, 2944, 2944, 256, 256]
    - [16, 21490.0]
  - - [2368, 5888, 1, 3328, 2368, 2368, 3328, 3328]
    - [3, 24146.0]
  - - [2368, 1856, 1, 1280, 2368, 2368, 1280, 1280]
    - [10, 20286.0]
  - - [5888, 4288, 1, 3328, 5888, 5888, 3328, 3328]
    - [30, 24262.0]
  - - [6784, 704, 1, 1280, 6784, 6784, 1280, 1280]
    - [13, 21704.0]
  - - [5056, 448, 1, 256, 5056, 5056, 256, 256]
    - [15, 17075.0]
  - - [1856, 5056, 1, 1280, 1856, 1856, 1280, 1280]
    - [3, 23395.0]
  - - [2944, 1024, 1, 1280, 2944, 2944, 1280, 1280]
    - [7, 21982.0]
  - - [2368, 4288, 1, 256, 2368, 2368, 256, 256]
    - [10, 21936.0]
  - - [1024, 2368, 1, 3328, 1024, 1024, 3328, 3328]
    - [13, 22147.0]
  - - [4288, 5888, 1, 3328, 4288, 4288, 3328, 3328]
    - [30, 24271.0]
  - - [1024, 2944, 1, 3328, 1024, 1024, 3328, 3328]
    - [19, 22081.0]
  - - [256, 6784, 1, 1280, 256, 256, 1280, 1280]
    - [29, 20030.0]
  - - [1856, 3584, 1, 256, 1856, 1856, 256, 256]
    - [3, 21164.0]
  - - [512, 24000, 1, 2816, 512, 512, 2816, 2816]
    - [30, 24311.0]
  - - [256, 5888, 1, 1280, 256, 256, 1280, 1280]
    - [4, 19965.0]
  - - [16384, 1600, 1, 4096, 16384, 16384, 4096, 4096]
    - [27, 20673.0]
  - - [2944, 2368, 1, 256, 2944, 2944, 256, 256]
    - [10, 21348.0]
  - - [1024, 1856, 1, 256, 1024, 1024, 256, 256]
    - [12, 17628.0]
  - - [6784, 3584, 1, 3328, 6784, 6784, 3328, 3328]
    - [3, 24598.0]
  - - [1760, 7000, 1, 1760, 1760, 1760, 1760, 1760]
    - [10, 23788.0]
  - - [1024, 5888, 1, 3328, 1024, 1024, 3328, 3328]
    - [7, 22825.0]
  - - [1408, 2368, 1, 1280, 1408, 1408, 1280, 1280]
    - [19, 20196.0]
  - - [2944, 2944, 1, 256, 2944, 2944, 256, 256]
    - [29, 22836.0]
  - - [6784, 256, 1, 256, 6784, 6784, 256, 256]
    - [4, 18117.0]
  - - [5888, 1408, 1, 256, 5888, 5888, 256, 256]
    - [10, 22969.0]
  - - [5888, 6784, 1, 3328, 5888, 5888, 3328, 3328]
    - [24, 25254.0]
  - - [704, 4288, 1, 1280, 704, 704, 1280, 1280]
    - [10, 18472.0]
  - - [1024, 48000, 1, 2048, 1024, 1024, 2048, 2048]
    - [33, 24614.0]
  - - [1024, 1024, 1, 3328, 1024, 1024, 3328, 3328]
    - [41, 16632.0]
  - - [64, 6784, 1, 256, 64, 64, 256, 256]
    - [54, 10050.0]
  - - [128, 6784, 1, 3328, 128, 128, 3328, 3328]
    - [49, 17890.0]
  - - [2048, 400, 1, 512, 2048, 2048, 512, 512]
    - [48, 13788.0]
  - - [256, 4288, 1, 3328, 256, 256, 3328, 3328]
    - [45, 17388.0]
  - - [704, 1856, 1, 3328, 704, 704, 3328, 3328]
    - [45, 16721.0]
  - - [448, 1024, 1, 1280, 448, 448, 1280, 1280]
    - [35, 13407.0]
  - - [2368, 128, 1, 256, 2368, 2368, 256, 256]
    - [47, 8603.0]
  - - [64, 5056, 1, 256, 64, 64, 256, 256]
    - [54, 8869.0]
  - - [256, 1856, 1, 1280, 256, 256, 1280, 1280]
    - [55, 15863.0]
  - - [448, 704, 1, 1280, 448, 448, 1280, 1280]
    - [51, 13056.0]
  - - [4288, 256, 1, 256, 4288, 4288, 256, 256]
    - [40, 14606.0]
  - - [128, 3584, 1, 1280, 128, 128, 1280, 1280]
    - [48, 15340.0]
  - - [5888, 64, 1, 3328, 5888, 5888, 3328, 3328]
    - [55, 13034.0]
  - - [2944, 256, 1, 3328, 2944, 2944, 3328, 3328]
    - [52, 15931.0]
  - - [256, 4288, 1, 1280, 256, 256, 1280, 1280]
    - [48, 17647.0]
  - - [1408, 448, 1, 1280, 1408, 1408, 1280, 1280]
    - [48, 15856.0]
  - - [1408, 256, 1, 1280, 1408, 1408, 1280, 1280]
    - [52, 12193.0]
  - - [3072, 128, 1, 1024, 3072, 3072, 1024, 1024]
    - [55, 11725.0]
  - - [6784, 128, 1, 1280, 6784, 6784, 1280, 1280]
    - [56, 17465.0]
  - - [6784, 64, 1, 256, 6784, 6784, 256, 256]
    - [40, 10545.0]
  - - [2368, 128, 1, 3328, 2368, 2368, 3328, 3328]
    - [41, 15015.0]
  - - [2944, 128, 1, 256, 2944, 2944, 256, 256]
    - [55, 9330.0]
  - - [448, 1408, 1, 256, 448, 448, 256, 256]
    - [39, 12252.0]
  - - [64, 5056, 1, 3328, 64, 64, 3328, 3328]
    - [54, 13397.0]
  - - [2368, 256, 1, 1280, 2368, 2368, 1280, 1280]
    - [45, 16594.0]
  - - [256, 3584, 1, 3328, 256, 256, 3328, 3328]
    - [41, 18935.0]
  - - [5056, 64, 1, 1280, 5056, 5056, 1280, 1280]
    - [40, 13208.0]
  - - [1024, 704, 1, 256, 1024, 1024, 256, 256]
    - [48, 13070.0]
  - - [4288, 128, 1, 1280, 4288, 4288, 1280, 1280]
    - [41, 15122.0]
  - - [5888, 64, 1, 256, 5888, 5888, 256, 256]
    - [48, 9312.0]
  - - [1856, 256, 1, 1280, 1856, 1856, 1280, 1280]
    - [44, 14980.0]
  - - [64, 5888, 1, 3328, 64, 64, 3328, 3328]
    - [50, 12774.0]
  - - [256, 1408, 1, 3328, 256, 256, 3328, 3328]
    - [48, 12860.0]
  - - [6784, 128, 1, 3328, 6784, 6784, 3328, 3328]
    - [49, 17865.0]
  - - [704, 704, 1, 3328, 704, 704, 3328, 3328]
    - [53, 14806.0]
  - - [3584, 256, 1, 3328, 3584, 3584, 3328, 3328]
    - [41, 18963.0]
  - - [128, 3584, 1, 3328, 128, 128, 3328, 3328]
    - [48, 16146.0]
  - - [128, 2944, 1, 1280, 128, 128, 1280, 1280]
    - [48, 12760.0]
  - - [448, 1856, 1, 1280, 448, 448, 1280, 1280]
    - [37, 16274.0]
  - - [3584, 128, 1, 256, 3584, 3584, 256, 256]
    - [55, 11142.0]
  - - [448, 1408, 1, 3328, 448, 448, 3328, 3328]
    - [36, 14044.0]
  - - [256, 3584, 1, 256, 256, 256, 256, 256]
    - [49, 15514.0]
  - - [256, 2944, 1, 3328, 256, 256, 3328, 3328]
    - [52, 16124.0]
  - - [1408, 704, 1, 256, 1408, 1408, 256, 256]
    - [55, 14336.0]
  - - [448, 2944, 1, 3328, 448, 448, 3328, 3328]
    - [37, 16915.0]
  - - [64, 5888, 1, 256, 64, 64, 256, 256]
    - [47, 8999.0]
  - - [448, 2368, 1, 1280, 448, 448, 1280, 1280]
    - [45, 16216.0]
  - - [128, 4288, 1, 3328, 128, 128, 3328, 3328]
    - [37, 16240.0]
  - - [256, 2368, 1, 256, 256, 256, 256, 256]
    - [40, 12679.0]
  - - [1024, 448, 1, 3328, 1024, 1024, 3328, 3328]
    - [55, 15579.0]
  - - [1856, 704, 1, 1280, 1856, 1856, 1280, 1280]
    - [45, 16326.0]
  - - [1024, 1024, 1, 1280, 1024, 1024, 1280, 1280]
    - [41, 16384.0]
  - - [256, 2944, 1, 256, 256, 256, 256, 256]
    - [40, 13743.0]
  - - [1024, 700, 1, 512, 1024, 1024, 512, 512]
    - [48, 13563.0]
  - - [128, 6784, 1, 1280, 128, 128, 1280, 1280]
    - [41, 17460.0]
  - - [1408, 704, 1, 3328, 1408, 1408, 3328, 3328]
    - [53, 15831.0]
  - - [128, 5888, 1, 1280, 128, 128, 1280, 1280]
    - [48, 16440.0]
  - - [704, 1408, 1, 3328, 704, 704, 3328, 3328]
    - [37, 15807.0]
  - - [7680, 64, 1, 2560, 7680, 7680, 2560, 2560]
    - [42, 13919.0]
  - - [6784, 128, 1, 256, 6784, 6784, 256, 256]
    - [41, 14722.0]
  - - [704, 448, 1, 256, 704, 704, 256, 256]
    - [47, 8776.0]
  - - [256, 1856, 1, 3328, 256, 256, 3328, 3328]
    - [52, 15876.0]
  - - [128, 4288, 1, 256, 128, 128, 256, 256]
    - [40, 11690.0]
  - - [64, 6784, 1, 3328, 64, 64, 3328, 3328]
    - [43, 13015.0]
  - - [2944, 256, 1, 1280, 2944, 2944, 1280, 1280]
    - [52, 15940.0]
  - - [1856, 704, 1, 256, 1856, 1856, 256, 256]
    - [47, 14840.0]
  - - [1408, 448, 1, 3328, 1408, 1408, 3328, 3328]
    - [52, 16103.0]
  - - [704, 1856, 1, 256, 704, 704, 256, 256]
    - [55, 15081.0]
  - - [256, 2368, 1, 1280, 256, 256, 1280, 1280]
    - [49, 16545.0]
  - - [2944, 448, 1, 256, 2944, 2944, 256, 256]
    - [48, 15141.0]
  - - [2368, 128, 1, 1280, 2368, 2368, 1280, 1280]
    - [41, 13232.0]
  - - [64, 5056, 1, 1280, 64, 64, 1280, 1280]
    - [54, 12968.0]
  - - [704, 448, 1, 3328, 704, 704, 3328, 3328]
    - [35, 14131.0]
  - - [2368, 448, 1, 1280, 2368, 2368, 1280, 1280]
    - [53, 16146.0]
  - - [128, 3584, 1, 256, 128, 128, 256, 256]
    - [55, 11271.0]
  - - [1856, 448, 1, 3328, 1856, 1856, 3328, 3328]
    - [41, 17094.0]
  - - [128, 5056, 1, 256, 128, 128, 256, 256]
    - [55, 13491.0]
  - - [4288, 256, 1, 1280, 4288, 4288, 1280, 1280]
    - [45, 16755.0]
  - - [704, 704, 1, 256, 704, 704, 256, 256]
    - [54, 10249.0]
  - - [4288, 128, 1, 3328, 4288, 4288, 3328, 3328]
    - [45, 16306.0]
  - - [7680, 128, 1, 2560, 7680, 7680, 2560, 2560]
    - [49, 19448.0]
  - - [256, 1408, 1, 1280, 256, 256, 1280, 1280]
    - [36, 12193.0]
  - - [6784, 64, 1, 3328, 6784, 6784, 3328, 3328]
    - [55, 14329.0]
  - - [128, 2944, 1, 3328, 128, 128, 3328, 3328]
    - [55, 13401.0]
  - - [2944, 448, 1, 3328, 2944, 2944, 3328, 3328]
    - [45, 16924.0]
  - - [5888, 128, 1, 256, 5888, 5888, 256, 256]
    - [40, 13645.0]
  - - [5056, 64, 1, 256, 5056, 5056, 256, 256]
    - [39, 8926.0]
  - - [128, 5056, 1, 3328, 128, 128, 3328, 3328]
    - [56, 18933.0]
  - - [256, 4288, 1, 256, 256, 256, 256, 256]
    - [36, 15913.0]
  - - [3584, 256, 1, 256, 3584, 3584, 256, 256]
    - [49, 15453.0]
  - - [128, 2944, 1, 256, 128, 128, 256, 256]
    - [55, 9421.0]
  - - [3584, 128, 1, 3328, 3584, 3584, 3328, 3328]
    - [48, 15759.0]
  - - [1024, 448, 1, 1280, 1024, 1024, 1280, 1280]
    - [52, 15158.0]
  - - [5888, 128, 1, 3328, 5888, 5888, 3328, 3328]
    - [44, 16234.0]
  - - [1408, 704, 1, 1280, 1408, 1408, 1280, 1280]
    - [53, 15428.0]
  - - [448, 1408, 1, 1280, 448, 448, 1280, 1280]
    - [35, 14130.0]
  - - [704, 1408, 1, 1280, 704, 704, 1280, 1280]
    - [48, 15793.0]
  - - [448, 2944, 1, 256, 448, 448, 256, 256]
    - [45, 14822.0]
  - - [448, 2368, 1, 256, 448, 448, 256, 256]
    - [47, 13634.0]
  - - [64, 6784, 1, 1280, 64, 64, 1280, 1280]
    - [54, 12081.0]
  - - [128, 2368, 1, 3328, 128, 128, 3328, 3328]
    - [56, 14773.0]
  - - [5056, 64, 1, 3328, 5056, 5056, 3328, 3328]
    - [55, 14780.0]
  - - [5056, 128, 1, 3328, 5056, 5056, 3328, 3328]
    - [49, 19090.0]
  - - [448, 704, 1, 256, 448, 448, 256, 256]
    - [47, 8757.0]
  - - [1856, 256, 1, 3328, 1856, 1856, 3328, 3328]
    - [55, 16195.0]
  - - [2944, 128, 1, 3328, 2944, 2944, 3328, 3328]
    - [48, 13276.0]
  - - [448, 1024, 1, 3328, 448, 448, 3328, 3328]
    - [35, 14108.0]
  - - [704, 1024, 1, 1280, 704, 704, 1280, 1280]
    - [48, 15152.0]
  - - [2368, 256, 1, 256, 2368, 2368, 256, 256]
    - [46, 12278.0]
  - - [256, 2368, 1, 3328, 256, 256, 3328, 3328]
    - [41, 17841.0]
  - - [704, 448, 1, 1280, 704, 704, 1280, 1280]
    - [43, 13031.0]
  - - [1024, 704, 1, 1280, 1024, 1024, 1280, 1280]
    - [36, 15550.0]
  - - [256, 1856, 1, 256, 256, 256, 256, 256]
    - [48, 11584.0]
  - - [704, 1856, 1, 1280, 704, 704, 1280, 1280]
    - [55, 16481.0]
  - - [1408, 256, 1, 3328, 1408, 1408, 3328, 3328]
    - [40, 12786.0]
  - - [2368, 448, 1, 256, 2368, 2368, 256, 256]
    - [48, 14189.0]
  - - [4288, 256, 1, 3328, 4288, 4288, 3328, 3328]
    - [45, 17426.0]
  - - [2944, 256, 1, 256, 2944, 2944, 256, 256]
    - [40, 13606.0]
  - - [1408, 448, 1, 256, 1408, 1408, 256, 256]
    - [48, 12981.0]
  - - [6784, 64, 1, 1280, 6784, 6784, 1280, 1280]
    - [40, 13866.0]
  - - [2944, 448, 1, 1280, 2944, 2944, 1280, 1280]
    - [45, 16551.0]
  - - [128, 2368, 1, 256, 128, 128, 256, 256]
    - [55, 8679.0]
  - - [448, 1024, 1, 256, 448, 448, 256, 256]
    - [47, 10599.0]
  - - [1856, 448, 1, 256, 1856, 1856, 256, 256]
    - [40, 13075.0]
  - - [128, 5056, 1, 1280, 128, 128, 1280, 1280]
    - [41, 17625.0]
  - - [1408, 256, 1, 256, 1408, 1408, 256, 256]
    - [44, 8976.0]
  - - [256, 1408, 1, 256, 256, 256, 256, 256]
    - [40, 8994.0]
  - - [2368, 448, 1, 3328, 2368, 2368, 3328, 3328]
    - [53, 16707.0]
  - - [128, 5888, 1, 3328, 128, 128, 3328, 3328]
    - [52, 16675.0]
  - - [3584, 128, 1, 1280, 3584, 3584, 1280, 1280]
    - [48, 15197.0]
  - - [4288, 128, 1, 256, 4288, 4288, 256, 256]
    - [47, 10977.0]
  - - [2368, 256, 1, 3328, 2368, 2368, 3328, 3328]
    - [45, 17882.0]
  - - [5888, 128, 1, 1280, 5888, 5888, 1280, 1280]
    - [52, 16219.0]
  - - [256, 3584, 1, 1280, 256, 256, 1280, 1280]
    - [56, 18390.0]
  - - [128, 5888, 1, 256, 128, 128, 256, 256]
    - [40, 13841.0]
  - - [1024, 1024, 1, 256, 1024, 1024, 256, 256]
    - [40, 15098.0]
  - - [1024, 1024, 1, 1024, 1024, 1024, 1024, 1024]
    - [41, 16244.0]
  - - [64, 5888, 1, 1280, 64, 64, 1280, 1280]
    - [50, 11617.0]
  - - [704, 1024, 1, 256, 704, 704, 256, 256]
    - [40, 12763.0]
  - - [704, 704, 1, 1280, 704, 704, 1280, 1280]
    - [37, 13906.0]
  - - [128, 2368, 1, 1280, 128, 128, 1280, 1280]
    - [48, 13360.0]
  - - [3584, 256, 1, 1280, 3584, 3584, 1280, 1280]
    - [41, 18333.0]
  - - [5888, 64, 1, 1280, 5888, 5888, 1280, 1280]
    - [48, 12509.0]
  - - [5056, 128, 1, 1280, 5056, 5056, 1280, 1280]
    - [49, 17610.0]
  - - [448, 1856, 1, 3328, 448, 448, 3328, 3328]
    - [41, 17130.0]
  - - [1024, 448, 1, 256, 1024, 1024, 256, 256]
    - [47, 11228.0]
  - - [2944, 128, 1, 1280, 2944, 2944, 1280, 1280]
    - [44, 12647.0]
  - - [256, 2944, 1, 1280, 256, 256, 1280, 1280]
    - [55, 16384.0]
  - - [2560, 128, 1, 2560, 2560, 2560, 2560, 2560]
    - [41, 15142.0]
  - - [704, 1024, 1, 3328, 704, 704, 3328, 3328]
    - [52, 15156.0]
  - - [1856, 448, 1, 1280, 1856, 1856, 1280, 1280]
    - [45, 16274.0]
  - - [128, 6784, 1, 256, 128, 128, 256, 256]
    - [41, 14741.0]
  - - [704, 1408, 1, 256, 704, 704, 256, 256]
    - [40, 14035.0]
  - - [4096, 128, 1, 4096, 4096, 4096, 4096, 4096]
    - [56, 15550.0]
  - - [448, 2944, 1, 1280, 448, 448, 1280, 1280]
    - [37, 16571.0]
  - - [1856, 256, 1, 256, 1856, 1856, 256, 256]
    - [54, 10998.0]
  - - [5056, 128, 1, 256, 5056, 5056, 256, 256]
    - [38, 12923.0]
  - - [448, 2368, 1, 3328, 448, 448, 3328, 3328]
    - [37, 16744.0]
  - - [1024, 704, 1, 3328, 1024, 1024, 3328, 3328]
    - [52, 15097.0]
  - - [128, 4288, 1, 1280, 128, 128, 1280, 1280]
    - [41, 15018.0]
  - - [448, 704, 1, 3328, 448, 448, 3328, 3328]
    - [51, 13818.0]
  - - [448, 1856, 1, 256, 448, 448, 256, 256]
    - [46, 12901.0]
  - - [1856, 704, 1, 3328, 1856, 1856, 3328, 3328]
    - [45, 16721.0]
  - - [1408, 64, 1, 1280, 1408, 1408, 1280, 1280]
    - [77, 4719.0]
  - - [4096, 32, 1, 4096, 4096, 4096, 4096, 4096]
    - [93, 4726.0]
  - - [3072, 64, 1, 1024, 3072, 3072, 1024, 1024]
    - [79, 5992.0]
  - - [2944, 64, 1, 256, 2944, 2944, 256, 256]
    - [91, 5999.0]
  - - [448, 448, 1, 3328, 448, 448, 3328, 3328]
    - [73, 7756.0]
  - - [1024, 256, 1, 3328, 1024, 1024, 3328, 3328]
    - [85, 7264.0]
  - - [6144, 32, 1, 2560, 6144, 6144, 2560, 2560]
    - [69, 5550.0]
  - - [1856, 64, 1, 1280, 1856, 1856, 1280, 1280]
    - [91, 6111.0]
  - - [704, 128, 1, 1280, 704, 704, 1280, 1280]
    - [77, 4938.0]
  - - [1856, 128, 1, 256, 1856, 1856, 256, 256]
    - [91, 7508.0]
  - - [2944, 64, 1, 1280, 2944, 2944, 1280, 1280]
    - [59, 6543.0]
  - - [64, 3584, 1, 3328, 64, 64, 3328, 3328]
    - [71, 8180.0]
  - - [1024, 256, 1, 256, 1024, 1024, 256, 256]
    - [66, 6644.0]
  - - [448, 448, 1, 256, 448, 448, 256, 256]
    - [79, 6281.0]
  - - [7680, 32, 1, 2560, 7680, 7680, 2560, 2560]
    - [69, 5796.0]
  - - [128, 1024, 1, 3328, 128, 128, 3328, 3328]
    - [59, 7086.0]
  - - [64, 1856, 1, 1280, 64, 64, 1280, 1280]
    - [91, 6038.0]
  - - [448, 256, 1, 256, 448, 448, 256, 256]
    - [91, 4943.0]
  - - [256, 1024, 1, 256, 256, 256, 256, 256]
    - [91, 6631.0]
  - - [1024, 128, 1, 1280, 1024, 1024, 1280, 1280]
    - [79, 6904.0]
  - - [3072, 32, 1, 1024, 3072, 3072, 1024, 1024]
    - [69, 4350.0]
  - - [448, 256, 1, 3328, 448, 448, 3328, 3328]
    - [85, 6447.0]
  - - [128, 704, 1, 1280, 128, 128, 1280, 1280]
    - [77, 5140.0]
  - - [1856, 128, 1, 3328, 1856, 1856, 3328, 3328]
    - [71, 8219.0]
  - - [256, 448, 1, 256, 256, 256, 256, 256]
    - [90, 5169.0]
  - - [8448, 32, 1, 2816, 8448, 8448, 2816, 2816]
    - [69, 5514.0]
  - - [1408, 128, 1, 1280, 1408, 1408, 1280, 1280]
    - [59, 6569.0]
  - - [128, 1856, 1, 1280, 128, 128, 1280, 1280]
    - [71, 8040.0]
  - - [2048, 128, 1, 2048, 2048, 2048, 2048, 2048]
    - [91, 6481.0]
  - - [2560, 32, 1, 2560, 2560, 2560, 2560, 2560]
    - [93, 5061.0]
  - - [64, 1408, 1, 3328, 64, 64, 3328, 3328]
    - [70, 5348.0]
  - - [128, 1408, 1, 256, 128, 128, 256, 256]
    - [77, 5885.0]
  - - [256, 448, 1, 3328, 256, 256, 3328, 3328]
    - [58, 6736.0]
  - - [64, 2368, 1, 1280, 64, 64, 1280, 1280]
    - [91, 7387.0]
  - - [2368, 64, 1, 256, 2368, 2368, 256, 256]
    - [91, 6238.0]
  - - [704, 128, 1, 3328, 704, 704, 3328, 3328]
    - [70, 5310.0]
  - - [4288, 64, 1, 1280, 4288, 4288, 1280, 1280]
    - [71, 7380.0]
  - - [2560, 64, 1, 2560, 2560, 2560, 2560, 2560]
    - [81, 6977.0]
  - - [128, 1024, 1, 1280, 128, 128, 1280, 1280]
    - [71, 6722.0]
  - - [1856, 64, 1, 256, 1856, 1856, 256, 256]
    - [90, 5189.0]
  - - [704, 128, 1, 256, 704, 704, 256, 256]
    - [90, 4149.0]
  - - [448, 256, 1, 1280, 448, 448, 1280, 1280]
    - [91, 6173.0]
  - - [1024, 256, 1, 1280, 1024, 1024, 1280, 1280]
    - [85, 7381.0]
  - - [1856, 128, 1, 1280, 1856, 1856, 1280, 1280]
    - [79, 8032.0]
  - - [64, 3584, 1, 256, 64, 64, 256, 256]
    - [91, 7179.0]
  - - [64, 1856, 1, 256, 64, 64, 256, 256]
    - [91, 5035.0]
  - - [256, 1024, 1, 1280, 256, 256, 1280, 1280]
    - [59, 7362.0]
  - - [3584, 64, 1, 1280, 3584, 3584, 1280, 1280]
    - [59, 7602.0]
  - - [1408, 128, 1, 3328, 1408, 1408, 3328, 3328]
    - [59, 6751.0]
  - - [64, 4288, 1, 3328, 64, 64, 3328, 3328]
    - [59, 7308.0]
  - - [2368, 64, 1, 3328, 2368, 2368, 3328, 3328]
    - [85, 7905.0]
  - - [256, 704, 1, 256, 256, 256, 256, 256]
    - [77, 5900.0]
  - - [128, 1024, 1, 256, 128, 128, 256, 256]
    - [66, 5412.0]
  - - [64, 2944, 1, 256, 64, 64, 256, 256]
    - [91, 5940.0]
  - - [64, 1408, 1, 1280, 64, 64, 1280, 1280]
    - [84, 4806.0]
  - - [1408, 128, 1, 256, 1408, 1408, 256, 256]
    - [91, 5796.0]
  - - [64, 2944, 1, 1280, 64, 64, 1280, 1280]
    - [59, 6543.0]
  - - [256, 448, 1, 1280, 256, 256, 1280, 1280]
    - [59, 6086.0]
  - - [704, 256, 1, 1280, 704, 704, 1280, 1280]
    - [85, 6683.0]
  - - [64, 2368, 1, 3328, 64, 64, 3328, 3328]
    - [59, 7837.0]
  - - [256, 704, 1, 3328, 256, 256, 3328, 3328]
    - [59, 6907.0]
  - - [4096, 64, 1, 4096, 4096, 4096, 4096, 4096]
    - [91, 6145.0]
  - - [1760, 128, 1, 1760, 1760, 1760, 1760, 1760]
    - [59, 8400.0]
  - - [64, 2944, 1, 3328, 64, 64, 3328, 3328]
    - [71, 6779.0]
  - - [128, 1408, 1, 3328, 128, 128, 3328, 3328]
    - [58, 6813.0]
  - - [1408, 64, 1, 256, 1408, 1408, 256, 256]
    - [77, 4005.0]
  - - [64, 2368, 1, 256, 64, 64, 256, 256]
    - [91, 6278.0]
  - - [1024, 128, 1, 3328, 1024, 1024, 3328, 3328]
    - [59, 7205.0]
  - - [2368, 64, 1, 1280, 2368, 2368, 1280, 1280]
    - [91, 7399.0]
  - - [4288, 64, 1, 256, 4288, 4288, 256, 256]
    - [91, 6755.0]
  - - [64, 4288, 1, 1280, 64, 64, 1280, 1280]
    - [59, 7380.0]
  - - [1408, 64, 1, 3328, 1408, 1408, 3328, 3328]
    - [70, 5234.0]
  - - [448, 448, 1, 1280, 448, 448, 1280, 1280]
    - [79, 6973.0]
  - - [3584, 64, 1, 3328, 3584, 3584, 3328, 3328]
    - [85, 7993.0]
  - - [256, 1024, 1, 3328, 256, 256, 3328, 3328]
    - [59, 7366.0]
  - - [1856, 64, 1, 3328, 1856, 1856, 3328, 3328]
    - [71, 6382.0]
  - - [1024, 128, 1, 256, 1024, 1024, 256, 256]
    - [66, 5649.0]
  - - [4608, 32, 1, 1536, 4608, 4608, 1536, 1536]
    - [69, 5143.0]
  - - [128, 704, 1, 256, 128, 128, 256, 256]
    - [75, 4489.0]
  - - [64, 3584, 1, 1280, 64, 64, 1280, 1280]
    - [59, 7490.0]
  - - [3584, 64, 1, 256, 3584, 3584, 256, 256]
    - [66, 6974.0]
  - - [64, 1856, 1, 3328, 64, 64, 3328, 3328]
    - [58, 6669.0]
  - - [2944, 64, 1, 3328, 2944, 2944, 3328, 3328]
    - [59, 6692.0]
  - - [128, 704, 1, 3328, 128, 128, 3328, 3328]
    - [84, 5541.0]
  - - [128, 1856, 1, 256, 128, 128, 256, 256]
    - [66, 7435.0]
  - - [64, 4288, 1, 256, 64, 64, 256, 256]
    - [91, 6794.0]
  - - [704, 256, 1, 3328, 704, 704, 3328, 3328]
    - [71, 6875.0]
  - - [256, 704, 1, 1280, 256, 256, 1280, 1280]
    - [59, 6675.0]
  - - [4288, 64, 1, 3328, 4288, 4288, 3328, 3328]
    - [59, 7291.0]
  - - [2048, 64, 1, 2048, 2048, 2048, 2048, 2048]
    - [81, 5578.0]
  - - [64, 1408, 1, 256, 64, 64, 256, 256]
    - [90, 3977.0]
  - - [128, 1408, 1, 1280, 128, 128, 1280, 1280]
    - [59, 6561.0]
  - - [128, 1856, 1, 3328, 128, 128, 3328, 3328]
    - [59, 8121.0]
  - - [1760, 64, 1, 1760, 1760, 1760, 1760, 1760]
    - [58, 6462.0]
  - - [704, 256, 1, 256, 704, 704, 256, 256]
    - [91, 5767.0]
  - - [1024, 256, 1, 196, 1024, 1024, 196, 196]
    - [59, 6359.0]
  - - [256, 1024, 1, 196, 256, 256, 196, 196]
    - [59, 6375.0]
  - - [1760, 32, 1, 1760, 1760, 1760, 1760, 1760]
    - [94, 3775.0]
  - - [1760, 16, 1, 1760, 1760, 1760, 1760, 1760]
    - [61, 2446.0]
  - - [7680, 16, 1, 2560, 7680, 7680, 2560, 2560]
    - [95, 3809.0]
  - - [8448, 16, 1, 2816, 8448, 8448, 2816, 2816]
    - [95, 3631.0]
  - - [6144, 16, 1, 2560, 6144, 6144, 2560, 2560]
    - [95, 3662.0]
  - - [2048, 16, 1, 2048, 2048, 2048, 2048, 2048]
    - [96, 2567.0]
  - - [3072, 16, 1, 1024, 3072, 3072, 1024, 1024]
    - [68, 2940.0]
  - - [4096, 16, 1, 4096, 4096, 4096, 4096, 4096]
    - [95, 3164.0]
  - - [2560, 16, 1, 2560, 2560, 2560, 2560, 2560]
    - [95, 3228.0]
  - - [2048, 32, 1, 2048, 2048, 2048, 2048, 2048]
    - [76, 3633.0]
  - - [4608, 16, 1, 1536, 4608, 4608, 1536, 1536]
    - [95, 3446.0]
  - - [1024, 16, 1, 500000, 1024, 1024, 500000, 500000]
    - [82, 1499.0]
  - - [1024, 8, 1, 500000, 1024, 1024, 500000, 500000]
    - [82, 751.0]
  - - [512, 16, 1, 500000, 512, 512, 500000, 500000]
    - [62, 968.0]
  - - [512, 8, 1, 500000, 512, 512, 500000, 500000]
    - [87, 484.0]
  - - [128, 256, 1, 1280, 128, 128, 1280, 1280]
    - [88, 2958.0]
  - - [448, 64, 1, 1280, 448, 448, 1280, 1280]
    - [80, 2637.0]
  - - [64, 1024, 1, 1280, 64, 64, 1280, 1280]
    - [84, 4401.0]
  - - [64, 704, 1, 1280, 64, 64, 1280, 1280]
    - [88, 3600.0]
  - - [128, 448, 1, 256, 128, 128, 256, 256]
    - [65, 3291.0]
  - - [256, 256, 1, 3328, 256, 256, 3328, 3328]
    - [70, 5117.0]
  - - [64, 448, 1, 1280, 64, 64, 1280, 1280]
    - [74, 2695.0]
  - - [64, 64, 1, 3328, 64, 64, 3328, 3328]
    - [62, 537.0]
  - - [704, 64, 1, 3328, 704, 704, 3328, 3328]
    - [83, 3608.0]
  - - [64, 128, 1, 256, 64, 64, 256, 256]
    - [80, 613.0]
  - - [128, 448, 1, 1280, 128, 128, 1280, 1280]
    - [78, 4073.0]
  - - [704, 64, 1, 1280, 704, 704, 1280, 1280]
    - [89, 3381.0]
  - - [448, 64, 1, 3328, 448, 448, 3328, 3328]
    - [60, 2853.0]
  - - [128, 64, 1, 1280, 128, 128, 1280, 1280]
    - [92, 940.0]
  - - [64, 128, 1, 3328, 64, 64, 3328, 3328]
    - [60, 1023.0]
  - - [128, 128, 1, 3328, 128, 128, 3328, 3328]
    - [60, 1897.0]
  - - [256, 128, 1, 256, 256, 256, 256, 256]
    - [88, 2255.0]
  - - [256, 256, 1, 256, 256, 256, 256, 256]
    - [77, 3410.0]
  - - [256, 64, 1, 256, 256, 256, 256, 256]
    - [88, 1165.0]
  - - [64, 1024, 1, 256, 64, 64, 256, 256]
    - [75, 3369.0]
  - - [64, 704, 1, 256, 64, 64, 256, 256]
    - [74, 2708.0]
  - - [448, 128, 1, 256, 448, 448, 256, 256]
    - [78, 3205.0]
  - - [64, 704, 1, 3328, 64, 64, 3328, 3328]
    - [88, 3701.0]
  - - [64, 448, 1, 3328, 64, 64, 3328, 3328]
    - [86, 2850.0]
  - - [448, 128, 1, 3328, 448, 448, 3328, 3328]
    - [70, 4345.0]
  - - [64, 256, 1, 1280, 64, 64, 1280, 1280]
    - [60, 1742.0]
  - - [64, 64, 1, 256, 64, 64, 256, 256]
    - [80, 307.0]
  - - [64, 448, 1, 256, 64, 64, 256, 256]
    - [63, 2005.0]
  - - [256, 128, 1, 1280, 256, 256, 1280, 1280]
    - [74, 2937.0]
  - - [128, 256, 1, 3328, 128, 128, 3328, 3328]
    - [88, 3172.0]
  - - [64, 128, 1, 1280, 64, 64, 1280, 1280]
    - [67, 936.0]
  - - [128, 128, 1, 1280, 128, 128, 1280, 1280]
    - [80, 1768.0]
  - - [128, 256, 1, 256, 128, 128, 256, 256]
    - [88, 2267.0]
  - - [256, 64, 1, 1280, 256, 256, 1280, 1280]
    - [80, 1748.0]
  - - [704, 64, 1, 256, 704, 704, 256, 256]
    - [76, 2695.0]
  - - [64, 64, 1, 1280, 64, 64, 1280, 1280]
    - [80, 478.0]
  - - [128, 64, 1, 3328, 128, 128, 3328, 3328]
    - [60, 1021.0]
  - - [448, 64, 1, 256, 448, 448, 256, 256]
    - [89, 1942.0]
  - - [1024, 64, 1, 256, 1024, 1024, 256, 256]
    - [64, 3355.0]
  - - [128, 64, 1, 256, 128, 128, 256, 256]
    - [80, 610.0]
  - - [1024, 64, 1, 1280, 1024, 1024, 1280, 1280]
    - [90, 4420.0]
  - - [64, 1024, 1, 3328, 64, 64, 3328, 3328]
    - [58, 4934.0]
  - - [448, 128, 1, 1280, 448, 448, 1280, 1280]
    - [65, 4051.0]
  - - [1024, 64, 1, 3328, 1024, 1024, 3328, 3328]
    - [58, 4853.0]
  - - [64, 256, 1, 3328, 64, 64, 3328, 3328]
    - [60, 1891.0]
  - - [256, 256, 1, 1280, 256, 256, 1280, 1280]
    - [58, 4415.0]
  - - [256, 128, 1, 3328, 256, 256, 3328, 3328]
    - [88, 3095.0]
  - - [64, 256, 1, 256, 64, 64, 256, 256]
    - [57, 1146.0]
  - - [128, 448, 1, 3328, 128, 128, 3328, 3328]
    - [70, 4505.0]
  - - [256, 64, 1, 3328, 256, 256, 3328, 3328]
    - [60, 1900.0]
  - - [128, 128, 1, 256, 128, 128, 256, 256]
    - [88, 1159.0]
  - - [512, 128, 1, 784, 512, 512, 784, 784]
    - [58, 4225.0]
  - - [256, 64, 1, 3136, 256, 256, 3136, 3136]
    - [86, 1885.0]
  - - [64, 256, 1, 3136, 64, 64, 3136, 3136]
    - [72, 1872.0]
  - - [128, 512, 1, 784, 128, 128, 784, 784]
    - [84, 4177.0]
  - - [64, 64, 1, 3136, 64, 64, 3136, 3136]
    - [62, 536.0]
- null
- null
- DeviceEfficiency
...
