library/src/blas3/Tensile/Logic/asm_full/navi21_Cijk_Alik_Bljk_HBH.yaml
- {MinimumRequiredVersion: 4.26.0}
- navi21
- gfx1030
- [Device 73a2]
    SolutionIndex: 0
    SolutionNameMin: Cijk_Alik_Bljk_HBH_MT128x64x8_SN_SU0_SUM0_TT8_8_WG16_8_1_WGM1
    SolutionIndex: 1
    SolutionNameMin: Cijk_Alik_Bljk_HBH_MT128x128x8_SN_SU0_SUM0_TT8_16_WG16_8_1_WGM1
    SolutionIndex: 2
    SolutionNameMin: Cijk_Alik_Bljk_HBH_MT128x128x8_SN_SU0_SUM0_TT8_8_WG16_16_1_WGM1
    SolutionIndex: 3
    SolutionNameMin: Cijk_Alik_Bljk_HBH_MT128x256x8_SN_SU0_SUM0_TT8_16_WG16_16_1_WGM1
    SolutionIndex: 4
    SolutionNameMin: Cijk_Alik_Bljk_HBH_MT128x64x16_SN_SU0_SUM0_TT8_8_WG16_8_1_WGM1
    SolutionIndex: 5
    SolutionNameMin: Cijk_Alik_Bljk_HBH_MT128x128x16_SN_SU0_SUM0_TT8_16_WG16_8_1_WGM1
    SolutionIndex: 6
    SolutionNameMin: Cijk_Alik_Bljk_HBH_MT128x128x16_SN_SU0_SUM0_TT8_8_WG16_16_1_WGM1
    SolutionIndex: 7
    SolutionNameMin: Cijk_Alik_Bljk_HBH_MT128x256x16_SN_SU0_SUM0_TT8_16_WG16_16_1_WGM1
    SolutionIndex: 8
    SolutionNameMin: Cijk_Alik_Bljk_HBH_MT128x64x8_SN_SU32_SUM3_TT8_8_WG16_8_1_WGM1
    SolutionIndex: 9
    SolutionNameMin: Cijk_Alik_Bljk_HBH_MT128x128x8_SN_SU32_SUM3_TT8_16_WG16_8_1_WGM1
    SolutionIndex: 10
    SolutionNameMin: Cijk_Alik_Bljk_HBH_MT128x256x8_SN_SU32_SUM3_TT8_16_WG16_16_1_WGM1
    SolutionIndex: 11
    SolutionNameMin: Cijk_Alik_Bljk_HBH_MT128x64x16_SN_SU32_SUM3_TT8_8_WG16_8_1_WGM1
    SolutionIndex: 12
    SolutionNameMin: Cijk_Alik_Bljk_HBH_MT128x128x16_SN_SU32_SUM3_TT8_16_WG16_8_1_WGM1
    SolutionIndex: 13
    SolutionNameMin: Cijk_Alik_Bljk_HBH_MT128x128x16_SN_SU32_SUM3_TT8_8_WG16_16_1_WGM1
    SolutionIndex: 14
    SolutionNameMin: Cijk_Alik_Bljk_HBH_MT128x256x16_SN_SU32_SUM3_TT8_16_WG16_16_1_WGM1
    SolutionIndex: 15
    SolutionNameMin: Cijk_Alik_Bljk_HBH_MT128x128x32_SN_SU32_SUM3_TT8_16_WG16_8_1_WGM1
    SolutionIndex: 16
    SolutionNameMin: Cijk_Alik_Bljk_HBH_MT128x256x32_SN_SU32_SUM3_TT8_16_WG16_16_1_WGM1
    SolutionIndex: 17
    SolutionNameMin: Cijk_Alik_Bljk_HBH_MT128x64x8_SN_SU0_SUM0_TT8_8_WG16_8_1_WGM4
    SolutionIndex: 18
    SolutionNameMin: Cijk_Alik_Bljk_HBH_MT128x128x8_SN_SU0_SUM0_TT8_8_WG16_16_1_WGM4
    SolutionIndex: 19
    SolutionNameMin: Cijk_Alik_Bljk_HBH_MT128x256x8_SN_SU0_SUM0_TT8_16_WG16_16_1_WGM4
    SolutionIndex: 20
    SolutionNameMin: Cijk_Alik_Bljk_HBH_MT128x64x16_SN_SU0_SUM0_TT8_8_WG16_8_1_WGM4
    SolutionIndex: 21
    SolutionNameMin: Cijk_Alik_Bljk_HBH_MT128x128x16_SN_SU0_SUM0_TT8_16_WG16_8_1_WGM4
    SolutionIndex: 22
    SolutionNameMin: Cijk_Alik_Bljk_HBH_MT128x128x16_SN_SU0_SUM0_TT8_8_WG16_16_1_WGM4
    SolutionIndex: 23
    SolutionNameMin: Cijk_Alik_Bljk_HBH_MT128x256x16_SN_SU0_SUM0_TT8_16_WG16_16_1_WGM4
    SolutionIndex: 24
    SolutionNameMin: Cijk_Alik_Bljk_HBH_MT128x64x8_SN_SU32_SUM3_TT8_8_WG16_8_1_WGM4
    SolutionIndex: 25
    SolutionNameMin: Cijk_Alik_Bljk_HBH_MT128x128x8_SN_SU32_SUM3_TT8_8_WG16_16_1_WGM4
    SolutionIndex: 26
    SolutionNameMin: Cijk_Alik_Bljk_HBH_MT128x256x8_SN_SU32_SUM3_TT8_16_WG16_16_1_WGM4
    SolutionIndex: 27
    SolutionNameMin: Cijk_Alik_Bljk_HBH_MT128x64x16_SN_SU32_SUM3_TT8_8_WG16_8_1_WGM4
    SolutionIndex: 28
    SolutionNameMin: Cijk_Alik_Bljk_HBH_MT128x128x16_SN_SU32_SUM3_TT8_16_WG16_8_1_WGM4
    SolutionIndex: 29
    SolutionNameMin: Cijk_Alik_Bljk_HBH_MT128x128x16_SN_SU32_SUM3_TT8_8_WG16_16_1_WGM4
    SolutionIndex: 30
    SolutionNameMin: Cijk_Alik_Bljk_HBH_MT128x256x16_SN_SU32_SUM3_TT8_16_WG16_16_1_WGM4
    SolutionIndex: 31
    SolutionNameMin: Cijk_Alik_Bljk_HBH_MT128x64x32_SN_SU32_SUM3_TT8_8_WG16_8_1_WGM4
    SolutionIndex: 32
    SolutionNameMin: Cijk_Alik_Bljk_HBH_MT128x128x32_SN_SU32_SUM3_TT8_16_WG16_8_1_WGM4
    SolutionIndex: 33
    SolutionNameMin: Cijk_Alik_Bljk_HBH_MT128x256x32_SN_SU32_SUM3_TT8_16_WG16_16_1_WGM4
    SolutionIndex: 34
    SolutionNameMin: Cijk_Alik_Bljk_HBH_MT128x64x8_SN_SU0_SUM0_TT8_8_WG16_8_1_WGM8
    SolutionIndex: 35
    SolutionNameMin: Cijk_Alik_Bljk_HBH_MT128x128x8_SN_SU0_SUM0_TT8_16_WG16_8_1_WGM8
    SolutionIndex: 36
    SolutionNameMin: Cijk_Alik_Bljk_HBH_MT128x256x8_SN_SU0_SUM0_TT8_16_WG16_16_1_WGM8
    SolutionIndex: 37
    SolutionNameMin: Cijk_Alik_Bljk_HBH_MT128x64x16_SN_SU0_SUM0_TT8_8_WG16_8_1_WGM8
    SolutionIndex: 38
    SolutionNameMin: Cijk_Alik_Bljk_HBH_MT128x128x16_SN_SU0_SUM0_TT8_16_WG16_8_1_WGM8
    SolutionIndex: 39
    SolutionNameMin: Cijk_Alik_Bljk_HBH_MT128x128x16_SN_SU0_SUM0_TT8_8_WG16_16_1_WGM8
    SolutionIndex: 40
    SolutionNameMin: Cijk_Alik_Bljk_HBH_MT128x256x16_SN_SU0_SUM0_TT8_16_WG16_16_1_WGM8
    SolutionIndex: 41
    SolutionNameMin: Cijk_Alik_Bljk_HBH_MT128x64x8_SN_SU32_SUM3_TT8_8_WG16_8_1_WGM8
    SolutionIndex: 42
    SolutionNameMin: Cijk_Alik_Bljk_HBH_MT128x128x8_SN_SU32_SUM3_TT8_16_WG16_8_1_WGM8
    SolutionIndex: 43
    SolutionNameMin: Cijk_Alik_Bljk_HBH_MT128x128x8_SN_SU32_SUM3_TT8_8_WG16_16_1_WGM8
    SolutionIndex: 44
    SolutionNameMin: Cijk_Alik_Bljk_HBH_MT128x128x16_SN_SU32_SUM3_TT8_16_WG16_8_1_WGM8
    SolutionIndex: 45
    SolutionNameMin: Cijk_Alik_Bljk_HBH_MT128x128x16_SN_SU32_SUM3_TT8_8_WG16_16_1_WGM8
    SolutionIndex: 46
    SolutionNameMin: Cijk_Alik_Bljk_HBH_MT128x256x16_SN_SU32_SUM3_TT8_16_WG16_16_1_WGM8
    SolutionIndex: 47
    SolutionNameMin: Cijk_Alik_Bljk_HBH_MT128x128x32_SN_SU32_SUM3_TT8_16_WG16_8_1_WGM8
    SolutionIndex: 48
    SolutionNameMin: Cijk_Alik_Bljk_HBH_MT128x256x32_SN_SU32_SUM3_TT8_16_WG16_16_1_WGM8
    SolutionIndex: 49
    SolutionNameMin: Cijk_Alik_Bljk_HBH_MT128x256x16_SN_SU0_SUM0_TT8_16_WG16_16_1_WGM1
    SolutionIndex: 50
    SolutionNameMin: Cijk_Alik_Bljk_HBH_MT128x128x32_SN_SU32_SUM3_TT8_16_WG16_8_1_WGM1
    SolutionIndex: 51
    SolutionNameMin: Cijk_Alik_Bljk_HBH_MT128x128x32_SN_SU32_SUM3_TT8_16_WG16_8_1_WGM4
    SolutionIndex: 52
    SolutionNameMin: Cijk_Alik_Bljk_HBH_MT128x128x32_SN_SU32_SUM3_TT8_16_WG16_8_1_WGM8
    SolutionIndex: 53
    SolutionNameMin: Cijk_Alik_Bljk_HBH_MT64x64x8_SN_SU0_SUM0_TT8_8_WG8_8_1_WGM1
    SolutionIndex: 54
    SolutionNameMin: Cijk_Alik_Bljk_HBH_MT128x64x8_SN_SU0_SUM0_TT8_8_WG16_8_1_WGM1
    SolutionIndex: 55
    SolutionNameMin: Cijk_Alik_Bljk_HBH_MT128x128x8_SN_SU0_SUM0_TT8_8_WG16_16_1_WGM1
    SolutionIndex: 56
    SolutionNameMin: Cijk_Alik_Bljk_HBH_MT64x64x16_SN_SU0_SUM0_TT8_8_WG8_8_1_WGM1
    SolutionIndex: 57
    SolutionNameMin: Cijk_Alik_Bljk_HBH_MT128x64x16_SN_SU0_SUM0_TT8_8_WG16_8_1_WGM1
    SolutionIndex: 58
    SolutionNameMin: Cijk_Alik_Bljk_HBH_MT128x128x16_SN_SU0_SUM0_TT8_8_WG16_16_1_WGM1
    SolutionIndex: 59
    SolutionNameMin: Cijk_Alik_Bljk_HBH_MT64x64x32_SN_SU0_SUM0_TT8_8_WG8_8_1_WGM1
    SolutionIndex: 60
    SolutionNameMin: Cijk_Alik_Bljk_HBH_MT128x64x32_SN_SU0_SUM0_TT8_8_WG16_8_1_WGM1
    SolutionIndex: 61
    SolutionNameMin: Cijk_Alik_Bljk_HBH_MT64x64x8_SN_SU32_SUM3_TT8_8_WG8_8_1_WGM1
    SolutionIndex: 62
    SolutionNameMin: Cijk_Alik_Bljk_HBH_MT128x64x8_SN_SU32_SUM3_TT8_8_WG16_8_1_WGM1
    SolutionIndex: 63
    SolutionNameMin: Cijk_Alik_Bljk_HBH_MT64x64x16_SN_SU32_SUM3_TT8_8_WG8_8_1_WGM1
    SolutionIndex: 64
    SolutionNameMin: Cijk_Alik_Bljk_HBH_MT128x64x16_SN_SU32_SUM3_TT8_8_WG16_8_1_WGM1
    SolutionIndex: 65
    SolutionNameMin: Cijk_Alik_Bljk_HBH_MT128x128x16_SN_SU32_SUM3_TT8_8_WG16_16_1_WGM1
    SolutionIndex: 66
    SolutionNameMin: Cijk_Alik_Bljk_HBH_MT64x64x32_SN_SU32_SUM3_TT8_8_WG8_8_1_WGM1
    SolutionIndex: 67
    SolutionNameMin: Cijk_Alik_Bljk_HBH_MT128x64x32_SN_SU32_SUM3_TT8_8_WG16_8_1_WGM1
    SolutionIndex: 68
    SolutionNameMin: Cijk_Alik_Bljk_HBH_MT64x64x8_SN_SU0_SUM0_TT8_8_WG8_8_1_WGM4
    SolutionIndex: 69
    SolutionNameMin: Cijk_Alik_Bljk_HBH_MT128x64x8_SN_SU0_SUM0_TT8_8_WG16_8_1_WGM4
    SolutionIndex: 70
    SolutionNameMin: Cijk_Alik_Bljk_HBH_MT128x128x8_SN_SU0_SUM0_TT8_8_WG16_16_1_WGM4
    SolutionIndex: 71
    SolutionNameMin: Cijk_Alik_Bljk_HBH_MT64x64x16_SN_SU0_SUM0_TT8_8_WG8_8_1_WGM4
    SolutionIndex: 72
    SolutionNameMin: Cijk_Alik_Bljk_HBH_MT128x64x16_SN_SU0_SUM0_TT8_8_WG16_8_1_WGM4
    SolutionIndex: 73
    SolutionNameMin: Cijk_Alik_Bljk_HBH_MT128x128x16_SN_SU0_SUM0_TT8_8_WG16_16_1_WGM4
    SolutionIndex: 74
    SolutionNameMin: Cijk_Alik_Bljk_HBH_MT64x64x32_SN_SU0_SUM0_TT8_8_WG8_8_1_WGM4
    SolutionIndex: 75
    SolutionNameMin: Cijk_Alik_Bljk_HBH_MT64x64x16_SN_SU32_SUM3_TT8_8_WG8_8_1_WGM4
    SolutionIndex: 76
    SolutionNameMin: Cijk_Alik_Bljk_HBH_MT128x64x16_SN_SU32_SUM3_TT8_8_WG16_8_1_WGM4
    SolutionIndex: 77
    SolutionNameMin: Cijk_Alik_Bljk_HBH_MT128x128x16_SN_SU32_SUM3_TT8_8_WG16_16_1_WGM4
    SolutionIndex: 78
    SolutionNameMin: Cijk_Alik_Bljk_HBH_MT64x64x32_SN_SU32_SUM3_TT8_8_WG8_8_1_WGM4
    SolutionIndex: 79
    SolutionNameMin: Cijk_Alik_Bljk_HBH_MT128x64x32_SN_SU32_SUM3_TT8_8_WG16_8_1_WGM4
    SolutionIndex: 80
    SolutionNameMin: Cijk_Alik_Bljk_HBH_MT64x64x8_SN_SU0_SUM0_TT8_8_WG8_8_1_WGM8
    SolutionIndex: 81
    SolutionNameMin: Cijk_Alik_Bljk_HBH_MT128x64x8_SN_SU0_SUM0_TT8_8_WG16_8_1_WGM8
    SolutionIndex: 82
    SolutionNameMin: Cijk_Alik_Bljk_HBH_MT128x128x8_SN_SU0_SUM0_TT8_8_WG16_16_1_WGM8
    SolutionIndex: 83
    SolutionNameMin: Cijk_Alik_Bljk_HBH_MT64x64x16_SN_SU0_SUM0_TT8_8_WG8_8_1_WGM8
    SolutionIndex: 84
    SolutionNameMin: Cijk_Alik_Bljk_HBH_MT128x64x16_SN_SU0_SUM0_TT8_8_WG16_8_1_WGM8
    SolutionIndex: 85
    SolutionNameMin: Cijk_Alik_Bljk_HBH_MT128x128x16_SN_SU0_SUM0_TT8_8_WG16_16_1_WGM8
    SolutionIndex: 86
    SolutionNameMin: Cijk_Alik_Bljk_HBH_MT128x64x32_SN_SU0_SUM0_TT8_8_WG16_8_1_WGM8
    SolutionIndex: 87
    SolutionNameMin: Cijk_Alik_Bljk_HBH_MT64x64x8_SN_SU32_SUM3_TT8_8_WG8_8_1_WGM8
    SolutionIndex: 88
    SolutionNameMin: Cijk_Alik_Bljk_HBH_MT128x64x8_SN_SU32_SUM3_TT8_8_WG16_8_1_WGM8
    SolutionIndex: 89
    SolutionNameMin: Cijk_Alik_Bljk_HBH_MT64x64x16_SN_SU32_SUM3_TT8_8_WG8_8_1_WGM8
    SolutionIndex: 90
    SolutionNameMin: Cijk_Alik_Bljk_HBH_MT128x64x16_SN_SU32_SUM3_TT8_8_WG16_8_1_WGM8
    SolutionIndex: 91
    SolutionNameMin: Cijk_Alik_Bljk_HBH_MT128x128x16_SN_SU32_SUM3_TT8_8_WG16_16_1_WGM8
    SolutionIndex: 92
    SolutionNameMin: Cijk_Alik_Bljk_HBH_MT64x64x32_SN_SU32_SUM3_TT8_8_WG8_8_1_WGM8
    SolutionIndex: 93
    SolutionNameMin: Cijk_Alik_Bljk_HBH_MT64x64x16_SN_SU0_SUM0_TT8_8_WG8_8_1_WGM1
    SolutionIndex: 94
    SolutionNameMin: Cijk_Alik_Bljk_HBH_MT128x64x16_SN_SU0_SUM0_TT8_8_WG16_8_1_WGM1
    SolutionIndex: 95
    SolutionNameMin: Cijk_Alik_Bljk_HBH_MT128x128x16_SN_SU0_SUM0_TT8_8_WG16_16_1_WGM1
    SolutionIndex: 96
    SolutionNameMin: Cijk_Alik_Bljk_HBH_MT128x64x16_SN_SU32_SUM3_TT8_8_WG16_8_1_WGM1
    SolutionIndex: 97
    SolutionNameMin: Cijk_Alik_Bljk_HBH_MT64x64x32_SN_SU32_SUM3_TT8_8_WG8_8_1_WGM1
    SolutionIndex: 98
    SolutionNameMin: Cijk_Alik_Bljk_HBH_MT128x64x32_SN_SU32_SUM3_TT8_8_WG16_8_1_WGM1
    SolutionIndex: 99
    SolutionNameMin: Cijk_Alik_Bljk_HBH_MT128x64x16_SN_SU0_SUM0_TT8_8_WG16_8_1_WGM4
    SolutionIndex: 100
    SolutionNameMin: Cijk_Alik_Bljk_HBH_MT128x128x16_SN_SU0_SUM0_TT8_8_WG16_16_1_WGM4
    SolutionIndex: 101
    SolutionNameMin: Cijk_Alik_Bljk_HBH_MT128x64x16_SN_SU32_SUM3_TT8_8_WG16_8_1_WGM4
    SolutionIndex: 102
    SolutionNameMin: Cijk_Alik_Bljk_HBH_MT128x64x32_SN_SU32_SUM3_TT8_8_WG16_8_1_WGM4
    SolutionIndex: 103
    SolutionNameMin: Cijk_Alik_Bljk_HBH_MT64x64x16_SN_SU0_SUM0_TT8_8_WG8_8_1_WGM8
    SolutionIndex: 104
    SolutionNameMin: Cijk_Alik_Bljk_HBH_MT128x64x16_SN_SU0_SUM0_TT8_8_WG16_8_1_WGM8
    SolutionIndex: 105
    SolutionNameMin: Cijk_Alik_Bljk_HBH_MT128x64x32_SN_SU0_SUM0_TT8_8_WG16_8_1_WGM8
    SolutionIndex: 106
    SolutionNameMin: Cijk_Alik_Bljk_HBH_MT64x64x16_SN_SU32_SUM3_TT8_8_WG8_8_1_WGM8
    SolutionIndex: 107
    SolutionNameMin: Cijk_Alik_Bljk_HBH_MT128x64x16_SN_SU32_SUM3_TT8_8_WG16_8_1_WGM8
    SolutionIndex: 108
    SolutionNameMin: Cijk_Alik_Bljk_HBH_MT64x64x32_SN_SU32_SUM3_TT8_8_WG8_8_1_WGM8
    SolutionIndex: 109
    SolutionNameMin: Cijk_Alik_Bljk_HBH_MT128x64x32_SN_SU32_SUM3_TT8_8_WG16_8_1_WGM8
    SolutionIndex: 110
    SolutionNameMin: Cijk_Alik_Bljk_HBH_MT16x16x8_SN_SU0_SUM0_TT2_2_WG8_8_1_WGM1
    SolutionIndex: 111
    SolutionNameMin: Cijk_Alik_Bljk_HBH_MT32x32x8_SN_SU0_SUM0_TT4_4_WG8_8_1_WGM1
    SolutionIndex: 112
    SolutionNameMin: Cijk_Alik_Bljk_HBH_MT32x16x8_SN_SU0_SUM0_TT2_2_WG16_8_1_WGM1
    SolutionIndex: 113
    SolutionNameMin: Cijk_Alik_Bljk_HBH_MT64x32x8_SN_SU0_SUM0_TT4_4_WG16_8_1_WGM1
    SolutionIndex: 114
    SolutionNameMin: Cijk_Alik_Bljk_HBH_MT32x32x8_SN_SU0_SUM0_TT2_2_WG16_16_1_WGM1
    SolutionIndex: 115
    SolutionNameMin: Cijk_Alik_Bljk_HBH_MT64x64x8_SN_SU0_SUM0_TT4_4_WG16_16_1_WGM1
    SolutionIndex: 116
    SolutionNameMin: Cijk_Alik_Bljk_HBH_MT16x16x16_SN_SU0_SUM0_TT2_2_WG8_8_1_WGM1
    SolutionIndex: 117
    SolutionNameMin: Cijk_Alik_Bljk_HBH_MT32x32x16_SN_SU0_SUM0_TT4_4_WG8_8_1_WGM1
    SolutionIndex: 118
    SolutionNameMin: Cijk_Alik_Bljk_HBH_MT16x16x32_SN_SU0_SUM0_TT2_2_WG8_8_1_WGM1
    SolutionIndex: 119
    SolutionNameMin: Cijk_Alik_Bljk_HBH_MT16x16x8_SN_SU32_SUM3_TT2_2_WG8_8_1_WGM1
    SolutionIndex: 120
    SolutionNameMin: Cijk_Alik_Bljk_HBH_MT32x32x8_SN_SU32_SUM3_TT4_4_WG8_8_1_WGM1
    SolutionIndex: 121
    SolutionNameMin: Cijk_Alik_Bljk_HBH_MT32x16x8_SN_SU32_SUM3_TT2_2_WG16_8_1_WGM1
    SolutionIndex: 122
    SolutionNameMin: Cijk_Alik_Bljk_HBH_MT32x32x8_SN_SU32_SUM3_TT2_2_WG16_16_1_WGM1
    SolutionIndex: 123
    SolutionNameMin: Cijk_Alik_Bljk_HBH_MT64x64x8_SN_SU32_SUM3_TT4_4_WG16_16_1_WGM1
    SolutionIndex: 124
    SolutionNameMin: Cijk_Alik_Bljk_HBH_MT16x16x16_SN_SU32_SUM3_TT2_2_WG8_8_1_WGM1
    SolutionIndex: 125
    SolutionNameMin: Cijk_Alik_Bljk_HBH_MT32x32x16_SN_SU32_SUM3_TT4_4_WG8_8_1_WGM1
    SolutionIndex: 126
    SolutionNameMin: Cijk_Alik_Bljk_HBH_MT32x16x16_SN_SU32_SUM3_TT2_2_WG16_8_1_WGM1
    SolutionIndex: 127
    SolutionNameMin: Cijk_Alik_Bljk_HBH_MT16x16x32_SN_SU32_SUM3_TT2_2_WG8_8_1_WGM1
    SolutionIndex: 128
    SolutionNameMin: Cijk_Alik_Bljk_HBH_MT16x16x8_SN_SU0_SUM0_TT2_2_WG8_8_1_WGM4
    SolutionIndex: 129
    SolutionNameMin: Cijk_Alik_Bljk_HBH_MT32x32x8_SN_SU0_SUM0_TT4_4_WG8_8_1_WGM4
    SolutionIndex: 130
    SolutionNameMin: Cijk_Alik_Bljk_HBH_MT32x16x8_SN_SU0_SUM0_TT2_2_WG16_8_1_WGM4
    SolutionIndex: 131
    SolutionNameMin: Cijk_Alik_Bljk_HBH_MT64x32x8_SN_SU0_SUM0_TT4_4_WG16_8_1_WGM4
    SolutionIndex: 132
    SolutionNameMin: Cijk_Alik_Bljk_HBH_MT32x32x8_SN_SU0_SUM0_TT2_2_WG16_16_1_WGM4
    SolutionIndex: 133
    SolutionNameMin: Cijk_Alik_Bljk_HBH_MT64x64x8_SN_SU0_SUM0_TT4_4_WG16_16_1_WGM4
    SolutionIndex: 134
    SolutionNameMin: Cijk_Alik_Bljk_HBH_MT16x16x16_SN_SU0_SUM0_TT2_2_WG8_8_1_WGM4
    SolutionIndex: 135
    SolutionNameMin: Cijk_Alik_Bljk_HBH_MT32x32x16_SN_SU0_SUM0_TT4_4_WG8_8_1_WGM4
    SolutionIndex: 136
    SolutionNameMin: Cijk_Alik_Bljk_HBH_MT16x16x32_SN_SU0_SUM0_TT2_2_WG8_8_1_WGM4
    SolutionIndex: 137
    SolutionNameMin: Cijk_Alik_Bljk_HBH_MT16x16x8_SN_SU32_SUM3_TT2_2_WG8_8_1_WGM4
    SolutionIndex: 138
    SolutionNameMin: Cijk_Alik_Bljk_HBH_MT32x32x8_SN_SU32_SUM3_TT4_4_WG8_8_1_WGM4
    SolutionIndex: 139
    SolutionNameMin: Cijk_Alik_Bljk_HBH_MT32x16x8_SN_SU32_SUM3_TT2_2_WG16_8_1_WGM4
    SolutionIndex: 140
    SolutionNameMin: Cijk_Alik_Bljk_HBH_MT64x32x8_SN_SU32_SUM3_TT4_4_WG16_8_1_WGM4
    SolutionIndex: 141
    SolutionNameMin: Cijk_Alik_Bljk_HBH_MT64x64x8_SN_SU32_SUM3_TT4_4_WG16_16_1_WGM4
    SolutionIndex: 142
    SolutionNameMin: Cijk_Alik_Bljk_HBH_MT16x16x16_SN_SU32_SUM3_TT2_2_WG8_8_1_WGM4
    SolutionIndex: 143
    SolutionNameMin: Cijk_Alik_Bljk_HBH_MT32x32x16_SN_SU32_SUM3_TT4_4_WG8_8_1_WGM4
    SolutionIndex: 144
    SolutionNameMin: Cijk_Alik_Bljk_HBH_MT32x16x16_SN_SU32_SUM3_TT2_2_WG16_8_1_WGM4
    SolutionIndex: 145
    SolutionNameMin: Cijk_Alik_Bljk_HBH_MT16x16x8_SN_SU0_SUM0_TT2_2_WG8_8_1_WGM8
    SolutionIndex: 146
    SolutionNameMin: Cijk_Alik_Bljk_HBH_MT32x32x8_SN_SU0_SUM0_TT4_4_WG8_8_1_WGM8
    SolutionIndex: 147
    SolutionNameMin: Cijk_Alik_Bljk_HBH_MT32x16x8_SN_SU0_SUM0_TT2_2_WG16_8_1_WGM8
    SolutionIndex: 148
    SolutionNameMin: Cijk_Alik_Bljk_HBH_MT64x32x8_SN_SU0_SUM0_TT4_4_WG16_8_1_WGM8
    SolutionIndex: 149
    SolutionNameMin: Cijk_Alik_Bljk_HBH_MT32x32x8_SN_SU0_SUM0_TT2_2_WG16_16_1_WGM8
    SolutionIndex: 150
    SolutionNameMin: Cijk_Alik_Bljk_HBH_MT64x64x8_SN_SU0_SUM0_TT4_4_WG16_16_1_WGM8
    SolutionIndex: 151
    SolutionNameMin: Cijk_Alik_Bljk_HBH_MT16x16x16_SN_SU0_SUM0_TT2_2_WG8_8_1_WGM8
    SolutionIndex: 152
    SolutionNameMin: Cijk_Alik_Bljk_HBH_MT32x32x16_SN_SU0_SUM0_TT4_4_WG8_8_1_WGM8
    SolutionIndex: 153
    SolutionNameMin: Cijk_Alik_Bljk_HBH_MT32x16x16_SN_SU0_SUM0_TT2_2_WG16_8_1_WGM8
    SolutionIndex: 154
    SolutionNameMin: Cijk_Alik_Bljk_HBH_MT16x16x32_SN_SU0_SUM0_TT2_2_WG8_8_1_WGM8
    SolutionIndex: 155
    SolutionNameMin: Cijk_Alik_Bljk_HBH_MT16x16x8_SN_SU32_SUM3_TT2_2_WG8_8_1_WGM8
    SolutionIndex: 156
    SolutionNameMin: Cijk_Alik_Bljk_HBH_MT32x32x8_SN_SU32_SUM3_TT4_4_WG8_8_1_WGM8
    SolutionIndex: 157
    SolutionNameMin: Cijk_Alik_Bljk_HBH_MT32x16x8_SN_SU32_SUM3_TT2_2_WG16_8_1_WGM8
    SolutionIndex: 158
    SolutionNameMin: Cijk_Alik_Bljk_HBH_MT64x32x8_SN_SU32_SUM3_TT4_4_WG16_8_1_WGM8
    SolutionIndex: 159
    SolutionNameMin: Cijk_Alik_Bljk_HBH_MT32x32x8_SN_SU32_SUM3_TT2_2_WG16_16_1_WGM8
    SolutionIndex: 160
    SolutionNameMin: Cijk_Alik_Bljk_HBH_MT64x64x8_SN_SU32_SUM3_TT4_4_WG16_16_1_WGM8
    SolutionIndex: 161
    SolutionNameMin: Cijk_Alik_Bljk_HBH_MT16x16x16_SN_SU32_SUM3_TT2_2_WG8_8_1_WGM8
    SolutionIndex: 162
    SolutionNameMin: Cijk_Alik_Bljk_HBH_MT32x32x16_SN_SU32_SUM3_TT4_4_WG8_8_1_WGM8
    SolutionIndex: 163
    SolutionNameMin: Cijk_Alik_Bljk_HBH_MT32x16x16_SN_SU32_SUM3_TT2_2_WG16_8_1_WGM8
    SolutionIndex: 164
    SolutionNameMin: Cijk_Alik_Bljk_HBH_MT32x32x32_SN_SU32_SUM3_TT2_2_WG16_16_1_WGM8
    SolutionIndex: 165
    SolutionNameMin: Cijk_Alik_Bljk_HBH_MT32x32x8_SN_SU0_SUM0_TT4_4_WG8_8_1_WGM1
    SolutionIndex: 166
    SolutionNameMin: Cijk_Alik_Bljk_HBH_MT64x64x8_SN_SU0_SUM0_TT4_4_WG16_16_1_WGM1
    SolutionIndex: 167
    SolutionNameMin: Cijk_Alik_Bljk_HBH_MT16x16x16_SN_SU0_SUM0_TT2_2_WG8_8_1_WGM1
    SolutionIndex: 168
    SolutionNameMin: Cijk_Alik_Bljk_HBH_MT16x16x32_SN_SU0_SUM0_TT2_2_WG8_8_1_WGM1
    SolutionIndex: 169
    SolutionNameMin: Cijk_Alik_Bljk_HBH_MT32x32x16_SN_SU32_SUM3_TT4_4_WG8_8_1_WGM1
    SolutionIndex: 170
    SolutionNameMin: Cijk_Alik_Bljk_HBH_MT32x32x8_SN_SU0_SUM0_TT4_4_WG8_8_1_WGM4
    SolutionIndex: 171
    SolutionNameMin: Cijk_Alik_Bljk_HBH_MT16x16x16_SN_SU0_SUM0_TT2_2_WG8_8_1_WGM4
    SolutionIndex: 172
    SolutionNameMin: Cijk_Alik_Bljk_HBH_MT32x32x16_SN_SU0_SUM0_TT4_4_WG8_8_1_WGM4
    SolutionIndex: 173
    SolutionNameMin: Cijk_Alik_Bljk_HBH_MT16x16x32_SN_SU0_SUM0_TT2_2_WG8_8_1_WGM4
    SolutionIndex: 174
    SolutionNameMin: Cijk_Alik_Bljk_HBH_MT64x64x8_SN_SU32_SUM3_TT4_4_WG16_16_1_WGM4
    SolutionIndex: 175
    SolutionNameMin: Cijk_Alik_Bljk_HBH_MT32x32x8_SN_SU0_SUM0_TT4_4_WG8_8_1_WGM8
    SolutionIndex: 176
    SolutionNameMin: Cijk_Alik_Bljk_HBH_MT64x64x8_SN_SU0_SUM0_TT4_4_WG16_16_1_WGM8
    SolutionIndex: 177
    SolutionNameMin: Cijk_Alik_Bljk_HBH_MT16x16x16_SN_SU0_SUM0_TT2_2_WG8_8_1_WGM8
    SolutionIndex: 178
    SolutionNameMin: Cijk_Alik_Bljk_HBH_MT32x32x16_SN_SU0_SUM0_TT4_4_WG8_8_1_WGM8
    SolutionIndex: 179
    SolutionNameMin: Cijk_Alik_Bljk_HBH_MT16x16x32_SN_SU0_SUM0_TT2_2_WG8_8_1_WGM8
    SolutionIndex: 180
    SolutionNameMin: Cijk_Alik_Bljk_HBH_MT64x64x8_SN_SU32_SUM3_TT4_4_WG16_16_1_WGM8
    SolutionIndex: 181
    SolutionNameMin: Cijk_Alik_Bljk_HBH_MT16x16x32_SN_SU32_SUM3_TT2_2_WG8_8_1_WGM8
    SolutionIndex: 182
    SolutionNameMin: Cijk_Alik_Bljk_HBH_MT32x8x8_SN_SU0_SUM0_TT2_2_WG16_4_1_WGM1
    SolutionIndex: 183
    SolutionNameMin: Cijk_Alik_Bljk_HBH_MT32x8x16_SN_SU0_SUM0_TT2_2_WG16_4_1_WGM1
    SolutionIndex: 184
    SolutionNameMin: Cijk_Alik_Bljk_HBH_MT32x8x8_SN_SU32_SUM3_TT2_2_WG16_4_1_WGM1
    SolutionIndex: 185
    SolutionNameMin: Cijk_Alik_Bljk_HBH_MT32x8x16_SN_SU32_SUM3_TT2_2_WG16_4_1_WGM1
    SolutionIndex: 186
    SolutionNameMin: Cijk_Alik_Bljk_HBH_MT32x8x16_SN_SU0_SUM0_TT2_2_WG16_4_1_WGM4
    SolutionIndex: 187
    SolutionNameMin: Cijk_Alik_Bljk_HBH_MT32x8x8_SN_SU32_SUM3_TT2_2_WG16_4_1_WGM4
    SolutionIndex: 188
    SolutionNameMin: Cijk_Alik_Bljk_HBH_MT32x8x16_SN_SU32_SUM3_TT2_2_WG16_4_1_WGM4
    SolutionIndex: 189
    SolutionNameMin: Cijk_Alik_Bljk_HBH_MT32x8x8_SN_SU32_SUM3_TT2_2_WG16_4_1_WGM8
    SolutionIndex: 190
    SolutionNameMin: Cijk_Alik_Bljk_HBH_MT32x8x16_SN_SU32_SUM3_TT2_2_WG16_4_1_WGM8
    SolutionIndex: 191
    SolutionNameMin: Cijk_Alik_Bljk_HBH_MT16x32x8_SN_SU32_SUM3_TT2_4_WG8_8_1_WGM1
    SolutionIndex: 192
    SolutionNameMin: Cijk_Alik_Bljk_HBH_MT32x32x8_SN_SU32_SUM3_TT2_4_WG16_8_1_WGM4
    SolutionIndex: 193
    SolutionNameMin: Cijk_Alik_Bljk_HBH_MT32x32x8_SN_SU32_SUM3_TT2_4_WG16_8_1_WGM8
- - - [2368, 1024, 1, 1, 2368, 2368, 1, 1]
    - [41, 479.0]
  - - [5056, 1408, 1, 3328, 5056, 5056, 3328, 3328]
    - [12, 30266.0]
  - - [5056, 1856, 1, 3328, 5056, 5056, 3328, 3328]
    - [23, 30628.0]
  - - [448, 3584, 1, 3328, 448, 448, 3328, 3328]
    - [23, 23150.0]
  - - [5056, 4288, 1, 32, 5056, 5056, 32, 32]
    - [17, 24956.0]
  - - [3584, 1024, 1, 256, 3584, 3584, 256, 256]
    - [38, 26905.0]
  - - [1408, 3584, 1, 3328, 1408, 1408, 3328, 3328]
    - [44, 30739.0]
  - - [1024, 2368, 1, 3328, 1024, 1024, 3328, 3328]
    - [28, 25975.0]
  - - [448, 3584, 1, 32, 448, 448, 32, 32]
    - [18, 8650.0]
  - - [4288, 6784, 1, 3328, 4288, 4288, 3328, 3328]
    - [7, 33506.0]
  - - [5888, 4288, 1, 3328, 5888, 5888, 3328, 3328]
    - [23, 34309.0]
  - - [2368, 1408, 1, 32, 2368, 2368, 32, 32]
    - [17, 15553.0]
  - - [1024, 2944, 1, 1, 1024, 1024, 1, 1]
    - [34, 658.0]
  - - [2944, 3584, 1, 3328, 2944, 2944, 3328, 3328]
    - [23, 33163.0]
  - - [2368, 2944, 1, 1280, 2368, 2368, 1280, 1280]
    - [28, 30171.0]
  - - [6784, 5888, 1, 3328, 6784, 6784, 3328, 3328]
    - [23, 34701.0]
  - - [3584, 1408, 1, 32, 3584, 3584, 32, 32]
    - [41, 17326.0]
  - - [5056, 256, 1, 256, 5056, 5056, 256, 256]
    - [11, 18246.0]
  - - [1856, 2368, 1, 256, 1856, 1856, 256, 256]
    - [28, 26263.0]
  - - [2368, 1024, 1, 3328, 2368, 2368, 3328, 3328]
    - [28, 25873.0]
  - - [3584, 4288, 1, 32, 3584, 3584, 32, 32]
    - [41, 24442.0]
  - - [3584, 3584, 1, 1, 3584, 3584, 1, 1]
    - [25, 1004.0]
  - - [1408, 2368, 1, 1, 1408, 1408, 1, 1]
    - [8, 775.0]
  - - [5056, 6784, 1, 1280, 5056, 5056, 1280, 1280]
    - [7, 33766.0]
  - - [4288, 5056, 1, 1, 4288, 4288, 1, 1]
    - [8, 1058.0]
  - - [5056, 4288, 1, 1, 5056, 5056, 1, 1]
    - [41, 1051.0]
  - - [1408, 4288, 1, 1280, 1408, 1408, 1280, 1280]
    - [28, 29753.0]
  - - [4288, 1024, 1, 3328, 4288, 4288, 3328, 3328]
    - [40, 30745.0]
  - - [1024, 5056, 1, 1, 1024, 1024, 1, 1]
    - [34, 827.0]
  - - [704, 3584, 1, 1280, 704, 704, 1280, 1280]
    - [44, 26266.0]
  - - [1856, 5056, 1, 256, 1856, 1856, 256, 256]
    - [23, 28483.0]
  - - [1408, 1024, 1, 1280, 1408, 1408, 1280, 1280]
    - [38, 24659.0]
  - - [5056, 5888, 1, 3328, 5056, 5056, 3328, 3328]
    - [23, 34130.0]
  - - [3584, 3584, 1, 1280, 3584, 3584, 1280, 1280]
    - [23, 34454.0]
  - - [2368, 3584, 1, 32, 2368, 2368, 32, 32]
    - [41, 21250.0]
  - - [2944, 2368, 1, 1, 2944, 2944, 1, 1]
    - [0, 942.0]
  - - [704, 4288, 1, 1, 704, 704, 1, 1]
    - [41, 547.0]
  - - [1024, 6784, 1, 1280, 1024, 1024, 1280, 1280]
    - [23, 33288.0]
  - - [1024, 3584, 1, 1, 1024, 1024, 1, 1]
    - [41, 758.0]
  - - [256, 5056, 1, 32, 256, 256, 32, 32]
    - [8, 11194.0]
  - - [2368, 5056, 1, 32, 2368, 2368, 32, 32]
    - [17, 22724.0]
  - - [6784, 1856, 1, 32, 6784, 6784, 32, 32]
    - [17, 24688.0]
  - - [5056, 704, 1, 1, 5056, 5056, 1, 1]
    - [17, 664.0]
  - - [2944, 4288, 1, 256, 2944, 2944, 256, 256]
    - [14, 30574.0]
  - - [5056, 704, 1, 32, 5056, 5056, 32, 32]
    - [8, 16133.0]
  - - [1856, 4288, 1, 3328, 1856, 1856, 3328, 3328]
    - [44, 30245.0]
  - - [6784, 4288, 1, 32, 6784, 6784, 32, 32]
    - [17, 26475.0]
  - - [5888, 5056, 1, 256, 5888, 5888, 256, 256]
    - [23, 31938.0]
  - - [3584, 2368, 1, 3328, 3584, 3584, 3328, 3328]
    - [23, 31506.0]
  - - [4288, 1856, 1, 1, 4288, 4288, 1, 1]
    - [41, 911.0]
  - - [1856, 2944, 1, 1, 1856, 1856, 1, 1]
    - [24, 804.0]
  - - [1856, 2368, 1, 32, 1856, 1856, 32, 32]
    - [0, 17580.0]
  - - [4288, 1856, 1, 32, 4288, 4288, 32, 32]
    - [0, 21401.0]
  - - [5056, 2368, 1, 256, 5056, 5056, 256, 256]
    - [38, 29129.0]
  - - [1408, 5888, 1, 256, 1408, 1408, 256, 256]
    - [44, 29600.0]
  - - [5056, 6784, 1, 1, 5056, 5056, 1, 1]
    - [41, 1095.0]
  - - [1024, 1408, 1, 3328, 1024, 1024, 3328, 3328]
    - [28, 25114.0]
  - - [256, 5056, 1, 1280, 256, 256, 1280, 1280]
    - [38, 21776.0]
  - - [704, 2368, 1, 1, 704, 704, 1, 1]
    - [41, 399.0]
  - - [3584, 4288, 1, 1280, 3584, 3584, 1280, 1280]
    - [23, 32034.0]
  - - [3584, 2368, 1, 1, 3584, 3584, 1, 1]
    - [41, 956.0]
  - - [4288, 448, 1, 3328, 4288, 4288, 3328, 3328]
    - [40, 27363.0]
  - - [704, 6784, 1, 1280, 704, 704, 1280, 1280]
    - [28, 28524.0]
  - - [2368, 4288, 1, 32, 2368, 2368, 32, 32]
    - [17, 22194.0]
  - - [704, 5056, 1, 1280, 704, 704, 1280, 1280]
    - [44, 27094.0]
  - - [3584, 6784, 1, 32, 3584, 3584, 32, 32]
    - [35, 25866.0]
  - - [3584, 6784, 1, 1280, 3584, 3584, 1280, 1280]
    - [23, 34173.0]
  - - [4288, 4288, 1, 3328, 4288, 4288, 3328, 3328]
    - [30, 32853.0]
  - - [1408, 3584, 1, 1, 1408, 1408, 1, 1]
    - [8, 885.0]
  - - [4288, 1856, 1, 3328, 4288, 4288, 3328, 3328]
    - [44, 30212.0]
  - - [1856, 2944, 1, 1280, 1856, 1856, 1280, 1280]
    - [30, 30343.0]
  - - [5056, 1024, 1, 3328, 5056, 5056, 3328, 3328]
    - [28, 31428.0]
  - - [3584, 704, 1, 1, 3584, 3584, 1, 1]
    - [41, 654.0]
  - - [448, 5056, 1, 1, 448, 448, 1, 1]
    - [18, 370.0]
  - - [5888, 5888, 1, 256, 5888, 5888, 256, 256]
    - [46, 33348.0]
  - - [3584, 704, 1, 32, 3584, 3584, 32, 32]
    - [34, 15350.0]
  - - [448, 6784, 1, 3328, 448, 448, 3328, 3328]
    - [30, 29092.0]
  - - [6784, 4288, 1, 1, 6784, 6784, 1, 1]
    - [8, 1121.0]
  - - [3584, 6784, 1, 1, 3584, 3584, 1, 1]
    - [34, 1076.0]
  - - [1408, 2368, 1, 32, 1408, 1408, 32, 32]
    - [17, 18083.0]
  - - [448, 5056, 1, 32, 448, 448, 32, 32]
    - [34, 10444.0]
  - - [4288, 4288, 1, 1280, 4288, 4288, 1280, 1280]
    - [7, 32554.0]
  - - [6784, 1408, 1, 1, 6784, 6784, 1, 1]
    - [8, 1008.0]
  - - [1856, 5888, 1, 3328, 1856, 1856, 3328, 3328]
    - [23, 32464.0]
  - - [3584, 1856, 1, 3328, 3584, 3584, 3328, 3328]
    - [28, 30330.0]
  - - [5056, 5888, 1, 1, 5056, 5056, 1, 1]
    - [41, 1077.0]
  - - [2944, 1024, 1, 256, 2944, 2944, 256, 256]
    - [38, 24254.0]
  - - [2368, 4288, 1, 3328, 2368, 2368, 3328, 3328]
    - [23, 31841.0]
  - - [2944, 6784, 1, 256, 2944, 2944, 256, 256]
    - [38, 31604.0]
  - - [2368, 2368, 1, 1280, 2368, 2368, 1280, 1280]
    - [12, 27798.0]
  - - [3584, 3584, 1, 32, 3584, 3584, 32, 32]
    - [34, 24038.0]
  - - [2944, 2944, 1, 1280, 2944, 2944, 1280, 1280]
    - [44, 31744.0]
  - - [1408, 5056, 1, 1, 1408, 1408, 1, 1]
    - [0, 962.0]
  - - [2368, 6784, 1, 1, 2368, 2368, 1, 1]
    - [0, 1026.0]
  - - [6784, 4288, 1, 1280, 6784, 6784, 1280, 1280]
    - [23, 33694.0]
  - - [2944, 704, 1, 256, 2944, 2944, 256, 256]
    - [44, 22909.0]
  - - [2368, 6784, 1, 1280, 2368, 2368, 1280, 1280]
    - [44, 31722.0]
  - - [704, 2944, 1, 3328, 704, 704, 3328, 3328]
    - [23, 29588.0]
  - - [5888, 256, 1, 1, 5888, 5888, 1, 1]
    - [0, 542.0]
  - - [5056, 6784, 1, 32, 5056, 5056, 32, 32]
    - [35, 26321.0]
  - - [448, 5056, 1, 1280, 448, 448, 1280, 1280]
    - [28, 23816.0]
  - - [256, 5888, 1, 3328, 256, 256, 3328, 3328]
    - [28, 26250.0]
  - - [5888, 1024, 1, 1, 5888, 5888, 1, 1]
    - [41, 930.0]
  - - [5888, 448, 1, 32, 5888, 5888, 32, 32]
    - [41, 16882.0]
  - - [6784, 2944, 1, 256, 6784, 6784, 256, 256]
    - [21, 31880.0]
  - - [4288, 2944, 1, 256, 4288, 4288, 256, 256]
    - [28, 30034.0]
  - - [448, 5888, 1, 3328, 448, 448, 3328, 3328]
    - [40, 25521.0]
  - - [1408, 4288, 1, 1, 1408, 1408, 1, 1]
    - [41, 929.0]
  - - [1408, 1856, 1, 3328, 1408, 1408, 3328, 3328]
    - [44, 27923.0]
  - - [3584, 1024, 1, 3328, 3584, 3584, 3328, 3328]
    - [12, 28505.0]
  - - [2944, 5888, 1, 3328, 2944, 2944, 3328, 3328]
    - [14, 34271.0]
  - - [448, 4288, 1, 3328, 448, 448, 3328, 3328]
    - [23, 27493.0]
  - - [704, 2368, 1, 256, 704, 704, 256, 256]
    - [14, 19703.0]
  - - [4288, 3584, 1, 3328, 4288, 4288, 3328, 3328]
    - [23, 32702.0]
  - - [1408, 1024, 1, 1, 1408, 1408, 1, 1]
    - [24, 522.0]
  - - [1408, 1024, 1, 256, 1408, 1408, 256, 256]
    - [38, 22049.0]
  - - [5056, 3584, 1, 1, 5056, 5056, 1, 1]
    - [25, 1026.0]
  - - [6784, 6784, 1, 3328, 6784, 6784, 3328, 3328]
    - [23, 34203.0]
  - - [2368, 2944, 1, 3328, 2368, 2368, 3328, 3328]
    - [28, 30478.0]
  - - [5056, 3584, 1, 32, 5056, 5056, 32, 32]
    - [17, 24364.0]
  - - [5056, 3584, 1, 1280, 5056, 5056, 1280, 1280]
    - [23, 33218.0]
  - - [1856, 1856, 1, 256, 1856, 1856, 256, 256]
    - [44, 23860.0]
  - - [5888, 4288, 1, 1, 5888, 5888, 1, 1]
    - [8, 1102.0]
  - - [5056, 704, 1, 256, 5056, 5056, 256, 256]
    - [28, 24587.0]
  - - [2368, 5056, 1, 256, 2368, 2368, 256, 256]
    - [30, 29838.0]
  - - [1024, 5056, 1, 256, 1024, 1024, 256, 256]
    - [44, 28491.0]
  - - [5888, 448, 1, 256, 5888, 5888, 256, 256]
    - [27, 21547.0]
  - - [6784, 5056, 1, 1280, 6784, 6784, 1280, 1280]
    - [23, 34013.0]
  - - [4288, 6784, 1, 1280, 4288, 4288, 1280, 1280]
    - [23, 33282.0]
  - - [704, 6784, 1, 3328, 704, 704, 3328, 3328]
    - [44, 29008.0]
  - - [2944, 1856, 1, 1, 2944, 2944, 1, 1]
    - [41, 899.0]
  - - [5888, 4288, 1, 1280, 5888, 5888, 1280, 1280]
    - [23, 33964.0]
  - - [5888, 3584, 1, 1280, 5888, 5888, 1280, 1280]
    - [23, 34465.0]
  - - [3584, 1408, 1, 1280, 3584, 3584, 1280, 1280]
    - [28, 30411.0]
  - - [1024, 2944, 1, 256, 1024, 1024, 256, 256]
    - [12, 25742.0]
  - - [2944, 1856, 1, 1280, 2944, 2944, 1280, 1280]
    - [44, 29608.0]
  - - [1024, 2368, 1, 1, 1024, 1024, 1, 1]
    - [41, 681.0]
  - - [2944, 3584, 1, 1280, 2944, 2944, 1280, 1280]
    - [23, 33047.0]
  - - [1856, 4288, 1, 256, 1856, 1856, 256, 256]
    - [44, 28102.0]
  - - [448, 3584, 1, 1, 448, 448, 1, 1]
    - [25, 317.0]
  - - [2368, 2944, 1, 32, 2368, 2368, 32, 32]
    - [24, 20504.0]
  - - [4288, 704, 1, 256, 4288, 4288, 256, 256]
    - [21, 23852.0]
  - - [1856, 1024, 1, 256, 1856, 1856, 256, 256]
    - [14, 22257.0]
  - - [704, 6784, 1, 32, 704, 704, 32, 32]
    - [34, 16398.0]
  - - [1024, 4288, 1, 1, 1024, 1024, 1, 1]
    - [34, 825.0]
  - - [1408, 5888, 1, 1280, 1408, 1408, 1280, 1280]
    - [12, 31328.0]
  - - [5056, 1856, 1, 256, 5056, 5056, 256, 256]
    - [28, 28853.0]
  - - [6784, 704, 1, 1280, 6784, 6784, 1280, 1280]
    - [28, 28500.0]
  - - [5888, 1024, 1, 256, 5888, 5888, 256, 256]
    - [38, 29046.0]
  - - [6784, 1856, 1, 3328, 6784, 6784, 3328, 3328]
    - [12, 31501.0]
  - - [2368, 5888, 1, 1280, 2368, 2368, 1280, 1280]
    - [30, 31545.0]
  - - [5888, 6784, 1, 32, 5888, 5888, 32, 32]
    - [9, 28217.0]
  - - [6784, 6784, 1, 32, 6784, 6784, 32, 32]
    - [42, 29071.0]
  - - [6784, 256, 1, 256, 6784, 6784, 256, 256]
    - [22, 24700.0]
  - - [2368, 3584, 1, 3328, 2368, 2368, 3328, 3328]
    - [23, 31390.0]
  - - [5888, 1024, 1, 1280, 5888, 5888, 1280, 1280]
    - [28, 30004.0]
  - - [5888, 6784, 1, 3328, 5888, 5888, 3328, 3328]
    - [23, 34188.0]
  - - [6784, 448, 1, 1, 6784, 6784, 1, 1]
    - [8, 601.0]
  - - [6784, 1856, 1, 1, 6784, 6784, 1, 1]
    - [8, 1046.0]
  - - [2944, 2368, 1, 1280, 2944, 2944, 1280, 1280]
    - [28, 29299.0]
  - - [6784, 448, 1, 32, 6784, 6784, 32, 32]
    - [17, 17555.0]
  - - [6784, 448, 1, 3328, 6784, 6784, 3328, 3328]
    - [28, 27331.0]
  - - [448, 3584, 1, 1280, 448, 448, 1280, 1280]
    - [40, 22383.0]
  - - [1408, 6784, 1, 1280, 1408, 1408, 1280, 1280]
    - [23, 31185.0]
  - - [5056, 5888, 1, 1280, 5056, 5056, 1280, 1280]
    - [30, 33932.0]
  - - [5888, 704, 1, 1, 5888, 5888, 1, 1]
    - [8, 810.0]
  - - [3584, 1856, 1, 1, 3584, 3584, 1, 1]
    - [41, 887.0]
  - - [5056, 2944, 1, 32, 5056, 5056, 32, 32]
    - [24, 23580.0]
  - - [4288, 6784, 1, 1, 4288, 4288, 1, 1]
    - [0, 1086.0]
  - - [1024, 6784, 1, 1, 1024, 1024, 1, 1]
    - [34, 939.0]
  - - [2368, 5888, 1, 32, 2368, 2368, 32, 32]
    - [0, 23262.0]
  - - [3584, 4288, 1, 1, 3584, 3584, 1, 1]
    - [41, 1034.0]
  - - [5888, 1024, 1, 3328, 5888, 5888, 3328, 3328]
    - [28, 30261.0]
  - - [6784, 5888, 1, 256, 6784, 6784, 256, 256]
    - [40, 33520.0]
  - - [5056, 1024, 1, 1, 5056, 5056, 1, 1]
    - [41, 759.0]
  - - [4288, 2368, 1, 32, 4288, 4288, 32, 32]
    - [34, 22164.0]
  - - [704, 3584, 1, 1, 704, 704, 1, 1]
    - [41, 499.0]
  - - [6784, 704, 1, 32, 6784, 6784, 32, 32]
    - [17, 20269.0]
  - - [704, 5888, 1, 256, 704, 704, 256, 256]
    - [23, 26253.0]
  - - [2368, 3584, 1, 1280, 2368, 2368, 1280, 1280]
    - [23, 31139.0]
  - - [3584, 5056, 1, 32, 3584, 3584, 32, 32]
    - [34, 24844.0]
  - - [6784, 1856, 1, 1280, 6784, 6784, 1280, 1280]
    - [40, 30771.0]
  - - [5056, 5056, 1, 3328, 5056, 5056, 3328, 3328]
    - [23, 33150.0]
  - - [2368, 5056, 1, 1, 2368, 2368, 1, 1]
    - [41, 955.0]
  - - [5888, 1408, 1, 256, 5888, 5888, 256, 256]
    - [21, 30215.0]
  - - [2368, 1024, 1, 32, 2368, 2368, 32, 32]
    - [17, 13661.0]
  - - [4288, 1024, 1, 256, 4288, 4288, 256, 256]
    - [14, 28328.0]
  - - [4288, 5888, 1, 1280, 4288, 4288, 1280, 1280]
    - [23, 33872.0]
  - - [1856, 2944, 1, 3328, 1856, 1856, 3328, 3328]
    - [23, 30621.0]
  - - [5056, 5888, 1, 256, 5056, 5056, 256, 256]
    - [14, 32555.0]
  - - [5056, 256, 1, 3328, 5056, 5056, 3328, 3328]
    - [5, 22365.0]
  - - [1024, 5888, 1, 1280, 1024, 1024, 1280, 1280]
    - [44, 30071.0]
  - - [5888, 5056, 1, 1280, 5888, 5888, 1280, 1280]
    - [23, 33886.0]
  - - [5888, 2944, 1, 1, 5888, 5888, 1, 1]
    - [0, 1073.0]
  - - [1408, 4288, 1, 3328, 1408, 1408, 3328, 3328]
    - [44, 30144.0]
  - - [704, 2944, 1, 32, 704, 704, 32, 32]
    - [34, 12015.0]
  - - [2944, 4288, 1, 3328, 2944, 2944, 3328, 3328]
    - [46, 33757.0]
  - - [5056, 2944, 1, 256, 5056, 5056, 256, 256]
    - [28, 30592.0]
  - - [2368, 1856, 1, 256, 2368, 2368, 256, 256]
    - [28, 25924.0]
  - - [2368, 4288, 1, 1280, 2368, 2368, 1280, 1280]
    - [14, 31402.0]
  - - [3584, 448, 1, 256, 3584, 3584, 256, 256]
    - [27, 20823.0]
  - - [256, 6784, 1, 256, 256, 256, 256, 256]
    - [22, 24700.0]
  - - [1024, 1408, 1, 1, 1024, 1024, 1, 1]
    - [22, 497.0]
  - - [256, 5888, 1, 1, 256, 256, 1, 1]
    - [1, 462.0]
  - - [2944, 2944, 1, 1, 2944, 2944, 1, 1]
    - [8, 1001.0]
  - - [6784, 3584, 1, 256, 6784, 6784, 256, 256]
    - [23, 33267.0]
  - - [1408, 1856, 1, 256, 1408, 1408, 256, 256]
    - [12, 22344.0]
  - - [2944, 2944, 1, 32, 2944, 2944, 32, 32]
    - [17, 23425.0]
  - - [2944, 2944, 1, 3328, 2944, 2944, 3328, 3328]
    - [28, 32000.0]
  - - [6784, 1408, 1, 32, 6784, 6784, 32, 32]
    - [34, 23549.0]
  - - [2368, 6784, 1, 3328, 2368, 2368, 3328, 3328]
    - [7, 31932.0]
  - - [4288, 3584, 1, 32, 4288, 4288, 32, 32]
    - [17, 23827.0]
  - - [3584, 704, 1, 1280, 3584, 3584, 1280, 1280]
    - [28, 26054.0]
  - - [448, 5056, 1, 3328, 448, 448, 3328, 3328]
    - [44, 24259.0]
  - - [4288, 448, 1, 256, 4288, 4288, 256, 256]
    - [21, 21494.0]
  - - [5056, 256, 1, 1280, 5056, 5056, 1280, 1280]
    - [5, 21578.0]
  - - [2944, 5888, 1, 32, 2944, 2944, 32, 32]
    - [17, 25609.0]
  - - [3584, 5056, 1, 256, 3584, 3584, 256, 256]
    - [44, 30721.0]
  - - [3584, 2368, 1, 256, 3584, 3584, 256, 256]
    - [28, 29289.0]
  - - [4288, 4288, 1, 256, 4288, 4288, 256, 256]
    - [7, 30890.0]
  - - [448, 5056, 1, 256, 448, 448, 256, 256]
    - [28, 20903.0]
  - - [4288, 704, 1, 1280, 4288, 4288, 1280, 1280]
    - [44, 26462.0]
  - - [2368, 704, 1, 1, 2368, 2368, 1, 1]
    - [0, 468.0]
  - - [1408, 1856, 1, 1280, 1408, 1408, 1280, 1280]
    - [28, 27006.0]
  - - [3584, 4288, 1, 3328, 3584, 3584, 3328, 3328]
    - [30, 32431.0]
  - - [448, 4288, 1, 32, 448, 448, 32, 32]
    - [41, 9758.0]
  - - [448, 4288, 1, 1280, 448, 448, 1280, 1280]
    - [23, 26762.0]
  - - [5056, 1024, 1, 256, 5056, 5056, 256, 256]
    - [12, 28826.0]
  - - [4288, 3584, 1, 1280, 4288, 4288, 1280, 1280]
    - [23, 32362.0]
  - - [1856, 3584, 1, 32, 1856, 1856, 32, 32]
    - [17, 20234.0]
  - - [5056, 3584, 1, 3328, 5056, 5056, 3328, 3328]
    - [23, 33424.0]
  - - [4288, 5056, 1, 256, 4288, 4288, 256, 256]
    - [14, 31711.0]
  - - [1856, 5888, 1, 256, 1856, 1856, 256, 256]
    - [30, 30186.0]
  - - [2368, 3584, 1, 1, 2368, 2368, 1, 1]
    - [0, 911.0]
  - - [4288, 2368, 1, 256, 4288, 4288, 256, 256]
    - [44, 29439.0]
  - - [1408, 2944, 1, 3328, 1408, 1408, 3328, 3328]
    - [40, 30312.0]
  - - [5888, 3584, 1, 1, 5888, 5888, 1, 1]
    - [0, 1105.0]
  - - [6784, 5056, 1, 3328, 6784, 6784, 3328, 3328]
    - [23, 34278.0]
  - - [6784, 5056, 1, 1, 6784, 6784, 1, 1]
    - [17, 1111.0]
  - - [5888, 3584, 1, 32, 5888, 5888, 32, 32]
    - [8, 25048.0]
  - - [5888, 3584, 1, 3328, 5888, 5888, 3328, 3328]
    - [7, 34709.0]
  - - [1024, 6784, 1, 256, 1024, 1024, 256, 256]
    - [5, 30379.0]
  - - [6784, 5888, 1, 32, 6784, 6784, 32, 32]
    - [35, 27751.0]
  - - [2368, 6784, 1, 32, 2368, 2368, 32, 32]
    - [8, 23624.0]
  - - [5056, 1408, 1, 1280, 5056, 5056, 1280, 1280]
    - [12, 29998.0]
  - - [3584, 1408, 1, 3328, 3584, 3584, 3328, 3328]
    - [12, 30664.0]
  - - [2944, 3584, 1, 1, 2944, 2944, 1, 1]
    - [0, 1011.0]
  - - [2944, 1408, 1, 1280, 2944, 2944, 1280, 1280]
    - [23, 29388.0]
  - - [3584, 1024, 1, 1, 3584, 3584, 1, 1]
    - [25, 758.0]
  - - [2944, 1856, 1, 3328, 2944, 2944, 3328, 3328]
    - [44, 29998.0]
  - - [2944, 3584, 1, 32, 2944, 2944, 32, 32]
    - [0, 24049.0]
  - - [5888, 256, 1, 32, 5888, 5888, 32, 32]
    - [0, 12305.0]
  - - [6784, 5056, 1, 256, 6784, 6784, 256, 256]
    - [14, 32380.0]
  - - [1856, 3584, 1, 1280, 1856, 1856, 1280, 1280]
    - [23, 32198.0]
  - - [256, 5888, 1, 256, 256, 256, 256, 256]
    - [5, 22941.0]
  - - [1024, 4288, 1, 3328, 1024, 1024, 3328, 3328]
    - [23, 31796.0]
  - - [2368, 1408, 1, 1, 2368, 2368, 1, 1]
    - [8, 670.0]
  - - [1024, 1856, 1, 32, 1024, 1024, 32, 32]
    - [34, 13279.0]
  - - [5888, 2368, 1, 1, 5888, 5888, 1, 1]
    - [41, 1061.0]
  - - [2368, 2368, 1, 1, 2368, 2368, 1, 1]
    - [8, 834.0]
  - - [704, 4288, 1, 256, 704, 704, 256, 256]
    - [46, 23970.0]
  - - [5888, 2368, 1, 32, 5888, 5888, 32, 32]
    - [8, 24732.0]
  - - [5888, 2368, 1, 1280, 5888, 5888, 1280, 1280]
    - [23, 31593.0]
  - - [2944, 5056, 1, 3328, 2944, 2944, 3328, 3328]
    - [23, 33813.0]
  - - [6784, 704, 1, 3328, 6784, 6784, 3328, 3328]
    - [28, 28969.0]
  - - [1856, 1856, 1, 32, 1856, 1856, 32, 32]
    - [17, 15929.0]
  - - [4288, 2944, 1, 32, 4288, 4288, 32, 32]
    - [0, 23005.0]
  - - [256, 5056, 1, 1, 256, 256, 1, 1]
    - [0, 404.0]
  - - [5056, 5056, 1, 256, 5056, 5056, 256, 256]
    - [14, 31432.0]
  - - [5888, 256, 1, 256, 5888, 5888, 256, 256]
    - [12, 22752.0]
  - - [6784, 6784, 1, 256, 6784, 6784, 256, 256]
    - [30, 32727.0]
  - - [3584, 704, 1, 3328, 3584, 3584, 3328, 3328]
    - [28, 26809.0]
  - - [4288, 704, 1, 3328, 4288, 4288, 3328, 3328]
    - [44, 27017.0]
  - - [4288, 2944, 1, 1280, 4288, 4288, 1280, 1280]
    - [12, 31680.0]
  - - [448, 3584, 1, 256, 448, 448, 256, 256]
    - [23, 18752.0]
  - - [6784, 256, 1, 32, 6784, 6784, 32, 32]
    - [41, 13963.0]
  - - [6784, 1408, 1, 1280, 6784, 6784, 1280, 1280]
    - [12, 31058.0]
  - - [2368, 5056, 1, 1280, 2368, 2368, 1280, 1280]
    - [23, 32031.0]
  - - [1408, 1408, 1, 1280, 1408, 1408, 1280, 1280]
    - [46, 27397.0]
  - - [5888, 1856, 1, 32, 5888, 5888, 32, 32]
    - [34, 24018.0]
  - - [5888, 704, 1, 3328, 5888, 5888, 3328, 3328]
    - [7, 29100.0]
  - - [448, 6784, 1, 256, 448, 448, 256, 256]
    - [40, 24513.0]
  - - [2944, 5888, 1, 256, 2944, 2944, 256, 256]
    - [30, 32716.0]
  - - [1856, 1408, 1, 32, 1856, 1856, 32, 32]
    - [0, 14418.0]
  - - [5888, 2944, 1, 1280, 5888, 5888, 1280, 1280]
    - [28, 32152.0]
  - - [448, 5888, 1, 1, 448, 448, 1, 1]
    - [41, 375.0]
  - - [3584, 1408, 1, 1, 3584, 3584, 1, 1]
    - [41, 817.0]
  - - [448, 5888, 1, 32, 448, 448, 32, 32]
    - [37, 11107.0]
  - - [5056, 704, 1, 1280, 5056, 5056, 1280, 1280]
    - [44, 27181.0]
  - - [1856, 6784, 1, 1, 1856, 1856, 1, 1]
    - [17, 975.0]
  - - [2368, 1024, 1, 256, 2368, 2368, 256, 256]
    - [22, 21028.0]
  - - [1856, 6784, 1, 32, 1856, 1856, 32, 32]
    - [17, 22687.0]
  - - [1856, 6784, 1, 1280, 1856, 1856, 1280, 1280]
    - [12, 31184.0]
  - - [5888, 5056, 1, 3328, 5888, 5888, 3328, 3328]
    - [23, 34136.0]
  - - [1408, 6784, 1, 32, 1408, 1408, 32, 32]
    - [17, 22053.0]
  - - [3584, 5888, 1, 3328, 3584, 3584, 3328, 3328]
    - [23, 34941.0]
  - - [4288, 1408, 1, 256, 4288, 4288, 256, 256]
    - [12, 27899.0]
  - - [6784, 2368, 1, 256, 6784, 6784, 256, 256]
    - [21, 30400.0]
  - - [1856, 1408, 1, 1280, 1856, 1856, 1280, 1280]
    - [28, 27115.0]
  - - [1856, 2368, 1, 1, 1856, 1856, 1, 1]
    - [8, 763.0]
  - - [1408, 5056, 1, 3328, 1408, 1408, 3328, 3328]
    - [28, 30288.0]
  - - [5056, 4288, 1, 256, 5056, 5056, 256, 256]
    - [46, 31610.0]
  - - [5056, 5056, 1, 32, 5056, 5056, 32, 32]
    - [17, 25123.0]
  - - [448, 5888, 1, 1280, 448, 448, 1280, 1280]
    - [23, 24699.0]
  - - [5056, 448, 1, 256, 5056, 5056, 256, 256]
    - [27, 21669.0]
  - - [4288, 5888, 1, 1, 4288, 4288, 1, 1]
    - [41, 1074.0]
  - - [1856, 5056, 1, 1280, 1856, 1856, 1280, 1280]
    - [30, 30601.0]
  - - [2368, 4288, 1, 1, 2368, 2368, 1, 1]
    - [0, 947.0]
  - - [3584, 1856, 1, 256, 3584, 3584, 256, 256]
    - [28, 28166.0]
  - - [4288, 5888, 1, 32, 4288, 4288, 32, 32]
    - [0, 25248.0]
  - - [4288, 5888, 1, 3328, 4288, 4288, 3328, 3328]
    - [23, 34106.0]
  - - [1024, 2944, 1, 3328, 1024, 1024, 3328, 3328]
    - [23, 29135.0]
  - - [2944, 2368, 1, 256, 2944, 2944, 256, 256]
    - [38, 28256.0]
  - - [1024, 1856, 1, 256, 1024, 1024, 256, 256]
    - [30, 22421.0]
  - - [1024, 5888, 1, 32, 1024, 1024, 32, 32]
    - [34, 20746.0]
  - - [1024, 5888, 1, 3328, 1024, 1024, 3328, 3328]
    - [28, 30296.0]
  - - [5056, 2368, 1, 32, 5056, 5056, 32, 32]
    - [24, 23304.0]
  - - [1408, 2368, 1, 1280, 1408, 1408, 1280, 1280]
    - [44, 29163.0]
  - - [5056, 6784, 1, 3328, 5056, 5056, 3328, 3328]
    - [23, 34139.0]
  - - [1408, 2944, 1, 256, 1408, 1408, 256, 256]
    - [28, 26098.0]
  - - [704, 5056, 1, 32, 704, 704, 32, 32]
    - [41, 14062.0]
  - - [5056, 4288, 1, 1280, 5056, 5056, 1280, 1280]
    - [23, 33732.0]
  - - [4288, 448, 1, 1, 4288, 4288, 1, 1]
    - [0, 498.0]
  - - [5888, 5888, 1, 1, 5888, 5888, 1, 1]
    - [34, 1131.0]
  - - [2944, 704, 1, 1280, 2944, 2944, 1280, 1280]
    - [46, 28192.0]
  - - [1024, 3584, 1, 1280, 1024, 1024, 1280, 1280]
    - [44, 28319.0]
  - - [2368, 2944, 1, 1, 2368, 2368, 1, 1]
    - [0, 882.0]
  - - [5056, 256, 1, 32, 5056, 5056, 32, 32]
    - [8, 8926.0]
  - - [5056, 1024, 1, 1280, 5056, 5056, 1280, 1280]
    - [44, 30815.0]
  - - [3584, 6784, 1, 256, 3584, 3584, 256, 256]
    - [30, 32021.0]
  - - [1856, 1408, 1, 256, 1856, 1856, 256, 256]
    - [39, 22895.0]
  - - [4288, 4288, 1, 32, 4288, 4288, 32, 32]
    - [34, 24333.0]
  - - [5888, 448, 1, 1, 5888, 5888, 1, 1]
    - [8, 729.0]
  - - [5056, 5056, 1, 1280, 5056, 5056, 1280, 1280]
    - [23, 32889.0]
  - - [6784, 1408, 1, 3328, 6784, 6784, 3328, 3328]
    - [28, 31297.0]
  - - [5888, 5888, 1, 3328, 5888, 5888, 3328, 3328]
    - [7, 34604.0]
  - - [5888, 1408, 1, 32, 5888, 5888, 32, 32]
    - [0, 21021.0]
  - - [256, 6784, 1, 3328, 256, 256, 3328, 3328]
    - [29, 27387.0]
  - - [6784, 2368, 1, 1280, 6784, 6784, 1280, 1280]
    - [28, 31695.0]
  - - [2944, 1408, 1, 1, 2944, 2944, 1, 1]
    - [25, 794.0]
  - - [6784, 1024, 1, 256, 6784, 6784, 256, 256]
    - [40, 30821.0]
  - - [5056, 1408, 1, 32, 5056, 5056, 32, 32]
    - [17, 20486.0]
  - - [1408, 6784, 1, 3328, 1408, 1408, 3328, 3328]
    - [23, 31577.0]
  - - [2944, 1408, 1, 3328, 2944, 2944, 3328, 3328]
    - [23, 30258.0]
  - - [704, 2368, 1, 32, 704, 704, 32, 32]
    - [41, 10220.0]
  - - [704, 6784, 1, 1, 704, 704, 1, 1]
    - [41, 660.0]
  - - [2368, 6784, 1, 256, 2368, 2368, 256, 256]
    - [12, 30355.0]
  - - [1856, 3584, 1, 3328, 1856, 1856, 3328, 3328]
    - [23, 32704.0]
  - - [704, 6784, 1, 256, 704, 704, 256, 256]
    - [44, 26339.0]
  - - [6784, 2944, 1, 32, 6784, 6784, 32, 32]
    - [35, 25917.0]
  - - [5888, 2368, 1, 3328, 5888, 5888, 3328, 3328]
    - [23, 31888.0]
  - - [2368, 704, 1, 1280, 2368, 2368, 1280, 1280]
    - [30, 22959.0]
  - - [1024, 1408, 1, 1280, 1024, 1024, 1280, 1280]
    - [12, 24580.0]
  - - [2944, 5056, 1, 32, 2944, 2944, 32, 32]
    - [0, 25096.0]
  - - [704, 2368, 1, 3328, 704, 704, 3328, 3328]
    - [23, 24034.0]
  - - [3584, 2944, 1, 256, 3584, 3584, 256, 256]
    - [44, 31285.0]
  - - [3584, 1024, 1, 1280, 3584, 3584, 1280, 1280]
    - [44, 28330.0]
  - - [5056, 3584, 1, 256, 5056, 5056, 256, 256]
    - [14, 31904.0]
  - - [2368, 704, 1, 256, 2368, 2368, 256, 256]
    - [27, 19961.0]
  - - [1856, 1856, 1, 1280, 1856, 1856, 1280, 1280]
    - [44, 26299.0]
  - - [4288, 704, 1, 1, 4288, 4288, 1, 1]
    - [0, 651.0]
  - - [1856, 1024, 1, 1, 1856, 1856, 1, 1]
    - [17, 516.0]
  - - [4288, 2944, 1, 3328, 4288, 4288, 3328, 3328]
    - [28, 31907.0]
  - - [4288, 704, 1, 32, 4288, 4288, 32, 32]
    - [17, 15431.0]
  - - [1856, 1024, 1, 32, 1856, 1856, 32, 32]
    - [8, 11972.0]
  - - [2944, 6784, 1, 1, 2944, 2944, 1, 1]
    - [8, 1101.0]
  - - [6784, 2368, 1, 32, 6784, 6784, 32, 32]
    - [0, 25199.0]
  - - [5888, 5056, 1, 1, 5888, 5888, 1, 1]
    - [4, 1109.0]
  - - [704, 5888, 1, 1, 704, 704, 1, 1]
    - [34, 611.0]
  - - [6784, 6784, 1, 1, 6784, 6784, 1, 1]
    - [8, 1149.0]
  - - [5888, 448, 1, 3328, 5888, 5888, 3328, 3328]
    - [44, 23882.0]
  - - [704, 5888, 1, 32, 704, 704, 32, 32]
    - [41, 15247.0]
  - - [704, 5888, 1, 1280, 704, 704, 1280, 1280]
    - [23, 29621.0]
  - - [1024, 6784, 1, 3328, 1024, 1024, 3328, 3328]
    - [23, 33941.0]
  - - [704, 2944, 1, 1280, 704, 704, 1280, 1280]
    - [23, 28643.0]
  - - [4288, 6784, 1, 256, 4288, 4288, 256, 256]
    - [46, 31833.0]
  - - [1408, 1408, 1, 32, 1408, 1408, 32, 32]
    - [17, 15104.0]
  - - [1408, 1408, 1, 3328, 1408, 1408, 3328, 3328]
    - [23, 28328.0]
  - - [2944, 1856, 1, 256, 2944, 2944, 256, 256]
    - [38, 27470.0]
  - - [4288, 2944, 1, 1, 4288, 4288, 1, 1]
    - [8, 982.0]
  - - [6784, 5056, 1, 32, 6784, 6784, 32, 32]
    - [34, 26719.0]
  - - [2944, 4288, 1, 1280, 2944, 2944, 1280, 1280]
    - [23, 33367.0]
  - - [1024, 4288, 1, 256, 1024, 1024, 256, 256]
    - [28, 26866.0]
  - - [2368, 5888, 1, 1, 2368, 2368, 1, 1]
    - [8, 994.0]
  - - [1408, 1856, 1, 32, 1408, 1408, 32, 32]
    - [17, 17568.0]
  - - [1856, 6784, 1, 3328, 1856, 1856, 3328, 3328]
    - [30, 31225.0]
  - - [1024, 2368, 1, 32, 1024, 1024, 32, 32]
    - [34, 14531.0]
  - - [2368, 2368, 1, 3328, 2368, 2368, 3328, 3328]
    - [28, 29306.0]
  - - [3584, 5888, 1, 32, 3584, 3584, 32, 32]
    - [34, 25066.0]
  - - [3584, 5888, 1, 1280, 3584, 3584, 1280, 1280]
    - [23, 34553.0]
  - - [6784, 704, 1, 256, 6784, 6784, 256, 256]
    - [21, 26384.0]
  - - [3584, 1024, 1, 32, 3584, 3584, 32, 32]
    - [34, 17687.0]
  - - [2368, 5888, 1, 256, 2368, 2368, 256, 256]
    - [14, 30096.0]
  - - [5888, 5888, 1, 32, 5888, 5888, 32, 32]
    - [35, 28214.0]
  - - [1856, 1408, 1, 3328, 1856, 1856, 3328, 3328]
    - [28, 27798.0]
  - - [4288, 1024, 1, 1, 4288, 4288, 1, 1]
    - [0, 754.0]
  - - [704, 4288, 1, 3328, 704, 704, 3328, 3328]
    - [23, 29149.0]
  - - [2944, 5056, 1, 1280, 2944, 2944, 1280, 1280]
    - [7, 33457.0]
  - - [6784, 2944, 1, 1280, 6784, 6784, 1280, 1280]
    - [7, 32855.0]
  - - [6784, 256, 1, 3328, 6784, 6784, 3328, 3328]
    - [22, 27358.0]
  - - [1408, 5056, 1, 32, 1408, 1408, 32, 32]
    - [17, 22555.0]
  - - [5888, 1856, 1, 1280, 5888, 5888, 1280, 1280]
    - [44, 30246.0]
  - - [5888, 256, 1, 1280, 5888, 5888, 1280, 1280]
    - [12, 25657.0]
  - - [1856, 5056, 1, 1, 1856, 1856, 1, 1]
    - [0, 931.0]
  - - [3584, 1856, 1, 1280, 3584, 3584, 1280, 1280]
    - [44, 30253.0]
  - - [6784, 448, 1, 256, 6784, 6784, 256, 256]
    - [12, 22618.0]
  - - [704, 3584, 1, 256, 704, 704, 256, 256]
    - [44, 23019.0]
  - - [1856, 5056, 1, 32, 1856, 1856, 32, 32]
    - [0, 21480.0]
  - - [1856, 5056, 1, 3328, 1856, 1856, 3328, 3328]
    - [23, 31074.0]
  - - [1024, 2944, 1, 32, 1024, 1024, 32, 32]
    - [18, 15264.0]
  - - [1408, 6784, 1, 256, 1408, 1408, 256, 256]
    - [28, 30129.0]
  - - [1024, 2368, 1, 1280, 1024, 1024, 1280, 1280]
    - [44, 25387.0]
  - - [1856, 3584, 1, 1, 1856, 1856, 1, 1]
    - [8, 848.0]
  - - [2944, 5888, 1, 1280, 2944, 2944, 1280, 1280]
    - [23, 33996.0]
  - - [3584, 3584, 1, 256, 3584, 3584, 256, 256]
    - [30, 32707.0]
  - - [1856, 2368, 1, 3328, 1856, 1856, 3328, 3328]
    - [44, 29872.0]
  - - [5888, 704, 1, 256, 5888, 5888, 256, 256]
    - [21, 25423.0]
  - - [6784, 4288, 1, 256, 6784, 6784, 256, 256]
    - [14, 31942.0]
  - - [1408, 2368, 1, 3328, 1408, 1408, 3328, 3328]
    - [44, 29802.0]
  - - [1024, 3584, 1, 256, 1024, 1024, 256, 256]
    - [5, 26951.0]
  - - [4288, 1024, 1, 32, 4288, 4288, 32, 32]
    - [8, 18107.0]
  - - [5888, 1856, 1, 3328, 5888, 5888, 3328, 3328]
    - [44, 30391.0]
  - - [2368, 3584, 1, 256, 2368, 2368, 256, 256]
    - [38, 29297.0]
  - - [4288, 1408, 1, 3328, 4288, 4288, 3328, 3328]
    - [44, 30163.0]
  - - [256, 5056, 1, 256, 256, 256, 256, 256]
    - [37, 19583.0]
  - - [5888, 2944, 1, 3328, 5888, 5888, 3328, 3328]
    - [30, 32328.0]
  - - [2368, 1408, 1, 3328, 2368, 2368, 3328, 3328]
    - [28, 29875.0]
  - - [5888, 704, 1, 32, 5888, 5888, 32, 32]
    - [41, 19564.0]
  - - [2944, 704, 1, 1, 2944, 2944, 1, 1]
    - [41, 652.0]
  - - [6784, 1856, 1, 256, 6784, 6784, 256, 256]
    - [21, 29255.0]
  - - [1856, 1856, 1, 1, 1856, 1856, 1, 1]
    - [41, 670.0]
  - - [2944, 704, 1, 3328, 2944, 2944, 3328, 3328]
    - [46, 29384.0]
  - - [2368, 1856, 1, 32, 2368, 2368, 32, 32]
    - [34, 17624.0]
  - - [5056, 4288, 1, 3328, 5056, 5056, 3328, 3328]
    - [23, 33990.0]
  - - [3584, 448, 1, 3328, 3584, 3584, 3328, 3328]
    - [40, 22746.0]
  - - [256, 6784, 1, 1, 256, 256, 1, 1]
    - [1, 508.0]
  - - [1024, 3584, 1, 32, 1024, 1024, 32, 32]
    - [41, 17740.0]
  - - [256, 6784, 1, 32, 256, 256, 32, 32]
    - [18, 13621.0]
  - - [2944, 1408, 1, 32, 2944, 2944, 32, 32]
    - [17, 19449.0]
  - - [4288, 3584, 1, 1, 4288, 4288, 1, 1]
    - [0, 1015.0]
  - - [5056, 448, 1, 3328, 5056, 5056, 3328, 3328]
    - [44, 24166.0]
  - - [6784, 3584, 1, 32, 6784, 6784, 32, 32]
    - [42, 27223.0]
  - - [4288, 1856, 1, 256, 4288, 4288, 256, 256]
    - [28, 28352.0]
  - - [1856, 2944, 1, 256, 1856, 1856, 256, 256]
    - [30, 27406.0]
  - - [2944, 5888, 1, 1, 2944, 2944, 1, 1]
    - [0, 1089.0]
  - - [1024, 1856, 1, 3328, 1024, 1024, 3328, 3328]
    - [23, 27282.0]
  - - [5888, 1024, 1, 32, 5888, 5888, 32, 32]
    - [34, 21390.0]
  - - [1408, 5056, 1, 1280, 1408, 1408, 1280, 1280]
    - [30, 29893.0]
  - - [5056, 6784, 1, 256, 5056, 5056, 256, 256]
    - [30, 32380.0]
  - - [2944, 5056, 1, 1, 2944, 2944, 1, 1]
    - [24, 1066.0]
  - - [5888, 5888, 1, 1280, 5888, 5888, 1280, 1280]
    - [23, 34439.0]
  - - [5056, 2944, 1, 1280, 5056, 5056, 1280, 1280]
    - [12, 31707.0]
  - - [2368, 1856, 1, 1280, 2368, 2368, 1280, 1280]
    - [44, 29392.0]
  - - [6784, 2944, 1, 1, 6784, 6784, 1, 1]
    - [0, 1101.0]
  - - [2944, 1024, 1, 32, 2944, 2944, 32, 32]
    - [17, 17351.0]
  - - [2944, 1024, 1, 1280, 2944, 2944, 1280, 1280]
    - [28, 26947.0]
  - - [5056, 5056, 1, 1, 5056, 5056, 1, 1]
    - [34, 1064.0]
  - - [2368, 4288, 1, 256, 2368, 2368, 256, 256]
    - [38, 29325.0]
  - - [2944, 6784, 1, 1280, 2944, 2944, 1280, 1280]
    - [23, 32961.0]
  - - [256, 6784, 1, 1280, 256, 256, 1280, 1280]
    - [6, 27116.0]
  - - [3584, 2368, 1, 32, 3584, 3584, 32, 32]
    - [34, 22445.0]
  - - [6784, 3584, 1, 3328, 6784, 6784, 3328, 3328]
    - [23, 34626.0]
  - - [2944, 2944, 1, 256, 2944, 2944, 256, 256]
    - [38, 30621.0]
  - - [1408, 1024, 1, 3328, 1408, 1408, 3328, 3328]
    - [28, 25001.0]
  - - [5056, 2368, 1, 1280, 5056, 5056, 1280, 1280]
    - [28, 30265.0]
  - - [2944, 1024, 1, 1, 2944, 2944, 1, 1]
    - [41, 721.0]
  - - [3584, 704, 1, 256, 3584, 3584, 256, 256]
    - [44, 22601.0]
  - - [2368, 5888, 1, 3328, 2368, 2368, 3328, 3328]
    - [40, 31813.0]
  - - [4288, 2368, 1, 1, 4288, 4288, 1, 1]
    - [0, 953.0]
  - - [1408, 3584, 1, 32, 1408, 1408, 32, 32]
    - [8, 20597.0]
  - - [2944, 4288, 1, 32, 2944, 2944, 32, 32]
    - [8, 24483.0]
  - - [5888, 1408, 1, 1280, 5888, 5888, 1280, 1280]
    - [28, 31530.0]
  - - [3584, 5056, 1, 1280, 3584, 3584, 1280, 1280]
    - [30, 33080.0]
  - - [5888, 6784, 1, 1280, 5888, 5888, 1280, 1280]
    - [23, 34001.0]
  - - [3584, 2944, 1, 1, 3584, 3584, 1, 1]
    - [41, 954.0]
  - - [1024, 1856, 1, 1, 1024, 1024, 1, 1]
    - [41, 594.0]
  - - [704, 5056, 1, 3328, 704, 704, 3328, 3328]
    - [44, 27587.0]
  - - [1024, 3584, 1, 3328, 1024, 1024, 3328, 3328]
    - [28, 28688.0]
  - - [5888, 256, 1, 3328, 5888, 5888, 3328, 3328]
    - [28, 26171.0]
  - - [1856, 1408, 1, 1, 1856, 1856, 1, 1]
    - [0, 583.0]
  - - [4288, 5056, 1, 1280, 4288, 4288, 1280, 1280]
    - [23, 33702.0]
  - - [1856, 1856, 1, 3328, 1856, 1856, 3328, 3328]
    - [44, 26789.0]
  - - [1024, 2368, 1, 256, 1024, 1024, 256, 256]
    - [44, 22297.0]
  - - [4288, 2368, 1, 3328, 4288, 4288, 3328, 3328]
    - [28, 31221.0]
  - - [5888, 3584, 1, 256, 5888, 5888, 256, 256]
    - [23, 33224.0]
  - - [1024, 5056, 1, 32, 1024, 1024, 32, 32]
    - [41, 19723.0]
  - - [5888, 448, 1, 1280, 5888, 5888, 1280, 1280]
    - [44, 23496.0]
  - - [704, 5888, 1, 3328, 704, 704, 3328, 3328]
    - [23, 30305.0]
  - - [1024, 1408, 1, 256, 1024, 1024, 256, 256]
    - [44, 21866.0]
  - - [3584, 2944, 1, 1280, 3584, 3584, 1280, 1280]
    - [44, 32287.0]
  - - [4288, 1856, 1, 1280, 4288, 4288, 1280, 1280]
    - [23, 29160.0]
  - - [3584, 5888, 1, 1, 3584, 3584, 1, 1]
    - [34, 1073.0]
  - - [5888, 4288, 1, 256, 5888, 5888, 256, 256]
    - [46, 31852.0]
  - - [1024, 2944, 1, 1280, 1024, 1024, 1280, 1280]
    - [40, 28398.0]
  - - [2944, 3584, 1, 256, 2944, 2944, 256, 256]
    - [30, 31321.0]
  - - [5888, 1856, 1, 1, 5888, 5888, 1, 1]
    - [0, 1025.0]
  - - [6784, 2368, 1, 3328, 6784, 6784, 3328, 3328]
    - [44, 31925.0]
  - - [1408, 4288, 1, 32, 1408, 1408, 32, 32]
    - [17, 21514.0]
  - - [1856, 1024, 1, 1280, 1856, 1856, 1280, 1280]
    - [40, 26558.0]
  - - [5888, 1856, 1, 256, 5888, 5888, 256, 256]
    - [28, 29069.0]
  - - [5056, 1856, 1, 1, 5056, 5056, 1, 1]
    - [41, 925.0]
  - - [5888, 2368, 1, 256, 5888, 5888, 256, 256]
    - [38, 29725.0]
  - - [1408, 1024, 1, 32, 1408, 1408, 32, 32]
    - [17, 12888.0]
  - - [5056, 1856, 1, 32, 5056, 5056, 32, 32]
    - [41, 21634.0]
  - - [5056, 1856, 1, 1280, 5056, 5056, 1280, 1280]
    - [40, 30393.0]
  - - [1408, 5888, 1, 3328, 1408, 1408, 3328, 3328]
    - [44, 31639.0]
  - - [5056, 704, 1, 3328, 5056, 5056, 3328, 3328]
    - [44, 27566.0]
  - - [5888, 6784, 1, 1, 5888, 5888, 1, 1]
    - [34, 1137.0]
  - - [5888, 4288, 1, 32, 5888, 5888, 32, 32]
    - [34, 25962.0]
  - - [1408, 3584, 1, 256, 1408, 1408, 256, 256]
    - [28, 28952.0]
  - - [6784, 256, 1, 1, 6784, 6784, 1, 1]
    - [41, 583.0]
  - - [6784, 256, 1, 1280, 6784, 6784, 1280, 1280]
    - [39, 27110.0]
  - - [2368, 704, 1, 3328, 2368, 2368, 3328, 3328]
    - [30, 23895.0]
  - - [2944, 1856, 1, 32, 2944, 2944, 32, 32]
    - [17, 21323.0]
  - - [2368, 1408, 1, 256, 2368, 2368, 256, 256]
    - [39, 24899.0]
  - - [2368, 1856, 1, 1, 2368, 2368, 1, 1]
    - [8, 760.0]
  - - [4288, 1408, 1, 1, 4288, 4288, 1, 1]
    - [0, 855.0]
  - - [3584, 2368, 1, 1280, 3584, 3584, 1280, 1280]
    - [23, 31077.0]
  - - [1408, 2944, 1, 1, 1408, 1408, 1, 1]
    - [41, 826.0]
  - - [4288, 1408, 1, 32, 4288, 4288, 32, 32]
    - [0, 19755.0]
  - - [5888, 2944, 1, 256, 5888, 5888, 256, 256]
    - [28, 31317.0]
  - - [1408, 2944, 1, 32, 1408, 1408, 32, 32]
    - [0, 19680.0]
  - - [5888, 6784, 1, 256, 5888, 5888, 256, 256]
    - [46, 32605.0]
  - - [6784, 5888, 1, 1, 6784, 6784, 1, 1]
    - [43, 1144.0]
  - - [6784, 5888, 1, 1280, 6784, 6784, 1280, 1280]
    - [23, 34569.0]
  - - [1024, 4288, 1, 32, 1024, 1024, 32, 32]
    - [34, 18391.0]
  - - [3584, 5888, 1, 256, 3584, 3584, 256, 256]
    - [30, 33200.0]
  - - [5056, 2368, 1, 1, 5056, 5056, 1, 1]
    - [41, 970.0]
  - - [5056, 448, 1, 1, 5056, 5056, 1, 1]
    - [41, 561.0]
  - - [2368, 1024, 1, 1280, 2368, 2368, 1280, 1280]
    - [28, 25201.0]
  - - [1856, 6784, 1, 256, 1856, 1856, 256, 256]
    - [28, 29474.0]
  - - [5056, 448, 1, 32, 5056, 5056, 32, 32]
    - [0, 12990.0]
  - - [3584, 2944, 1, 32, 3584, 3584, 32, 32]
    - [34, 23000.0]
  - - [3584, 1856, 1, 32, 3584, 3584, 32, 32]
    - [34, 20951.0]
  - - [4288, 1408, 1, 1280, 4288, 4288, 1280, 1280]
    - [28, 29762.0]
  - - [6784, 2368, 1, 1, 6784, 6784, 1, 1]
    - [41, 1078.0]
  - - [704, 5056, 1, 1, 704, 704, 1, 1]
    - [41, 585.0]
  - - [2368, 1408, 1, 1280, 2368, 2368, 1280, 1280]
    - [28, 29131.0]
  - - [5888, 1408, 1, 1, 5888, 5888, 1, 1]
    - [8, 987.0]
  - - [1024, 4288, 1, 1280, 1024, 1024, 1280, 1280]
    - [30, 30753.0]
  - - [1856, 4288, 1, 1, 1856, 1856, 1, 1]
    - [0, 902.0]
  - - [3584, 4288, 1, 256, 3584, 3584, 256, 256]
    - [12, 30166.0]
  - - [2368, 2944, 1, 256, 2368, 2368, 256, 256]
    - [38, 27567.0]
  - - [704, 5056, 1, 256, 704, 704, 256, 256]
    - [28, 24508.0]
  - - [1856, 4288, 1, 32, 1856, 1856, 32, 32]
    - [8, 20909.0]
  - - [4288, 1024, 1, 1280, 4288, 4288, 1280, 1280]
    - [40, 30423.0]
  - - [4288, 6784, 1, 32, 4288, 4288, 32, 32]
    - [0, 25531.0]
  - - [3584, 1408, 1, 256, 3584, 3584, 256, 256]
    - [44, 29083.0]
  - - [704, 3584, 1, 3328, 704, 704, 3328, 3328]
    - [44, 26967.0]
  - - [5056, 448, 1, 1280, 5056, 5056, 1280, 1280]
    - [28, 23641.0]
  - - [1408, 2944, 1, 1280, 1408, 1408, 1280, 1280]
    - [40, 29598.0]
  - - [5888, 704, 1, 1280, 5888, 5888, 1280, 1280]
    - [46, 28547.0]
  - - [4288, 5888, 1, 256, 4288, 4288, 256, 256]
    - [14, 32584.0]
  - - [3584, 3584, 1, 3328, 3584, 3584, 3328, 3328]
    - [23, 34865.0]
  - - [2944, 6784, 1, 32, 2944, 2944, 32, 32]
    - [9, 26150.0]
  - - [5056, 256, 1, 1, 5056, 5056, 1, 1]
    - [41, 381.0]
  - - [2944, 2368, 1, 3328, 2944, 2944, 3328, 3328]
    - [28, 29702.0]
  - - [1024, 1856, 1, 1280, 1024, 1024, 1280, 1280]
    - [23, 26500.0]
  - - [448, 5888, 1, 256, 448, 448, 256, 256]
    - [23, 21699.0]
  - - [1024, 5888, 1, 256, 1024, 1024, 256, 256]
    - [12, 28829.0]
  - - [6784, 2944, 1, 3328, 6784, 6784, 3328, 3328]
    - [23, 33142.0]
  - - [1408, 2368, 1, 256, 1408, 1408, 256, 256]
    - [28, 26007.0]
  - - [1408, 5056, 1, 256, 1408, 1408, 256, 256]
    - [28, 28246.0]
  - - [1024, 1408, 1, 32, 1024, 1024, 32, 32]
    - [18, 11830.0]
  - - [6784, 704, 1, 1, 6784, 6784, 1, 1]
    - [41, 872.0]
  - - [704, 3584, 1, 32, 704, 704, 32, 32]
    - [0, 12537.0]
  - - [4288, 4288, 1, 1, 4288, 4288, 1, 1]
    - [0, 1044.0]
  - - [5056, 2944, 1, 1, 5056, 5056, 1, 1]
    - [24, 998.0]
  - - [6784, 4288, 1, 3328, 6784, 6784, 3328, 3328]
    - [23, 33718.0]
  - - [5056, 2944, 1, 3328, 5056, 5056, 3328, 3328]
    - [28, 31895.0]
  - - [2368, 1856, 1, 3328, 2368, 2368, 3328, 3328]
    - [44, 29925.0]
  - - [1856, 4288, 1, 1280, 1856, 1856, 1280, 1280]
    - [23, 29350.0]
  - - [3584, 448, 1, 1, 3584, 3584, 1, 1]
    - [41, 546.0]
  - - [2944, 1024, 1, 3328, 2944, 2944, 3328, 3328]
    - [44, 27473.0]
  - - [5888, 5056, 1, 32, 5888, 5888, 32, 32]
    - [34, 26565.0]
  - - [704, 2944, 1, 1, 704, 704, 1, 1]
    - [41, 435.0]
  - - [3584, 448, 1, 32, 3584, 3584, 32, 32]
    - [34, 13107.0]
  - - [3584, 448, 1, 1280, 3584, 3584, 1280, 1280]
    - [27, 22128.0]
  - - [2944, 6784, 1, 3328, 2944, 2944, 3328, 3328]
    - [23, 33230.0]
  - - [1856, 2368, 1, 1280, 1856, 1856, 1280, 1280]
    - [28, 29318.0]
  - - [6784, 1024, 1, 1280, 6784, 6784, 1280, 1280]
    - [23, 32918.0]
  - - [6784, 3584, 1, 1280, 6784, 6784, 1280, 1280]
    - [7, 34442.0]
  - - [1408, 1408, 1, 1, 1408, 1408, 1, 1]
    - [8, 612.0]
  - - [1408, 4288, 1, 256, 1408, 1408, 256, 256]
    - [28, 27799.0]
  - - [256, 5056, 1, 3328, 256, 256, 3328, 3328]
    - [44, 22252.0]
  - - [448, 6784, 1, 1, 448, 448, 1, 1]
    - [25, 424.0]
  - - [704, 2944, 1, 256, 704, 704, 256, 256]
    - [23, 22949.0]
  - - [1408, 1408, 1, 256, 1408, 1408, 256, 256]
    - [44, 23894.0]
  - - [448, 6784, 1, 32, 448, 448, 32, 32]
    - [34, 12218.0]
  - - [1408, 1856, 1, 1, 1408, 1408, 1, 1]
    - [41, 718.0]
  - - [4288, 448, 1, 32, 4288, 4288, 32, 32]
    - [0, 12394.0]
  - - [4288, 448, 1, 1280, 4288, 4288, 1280, 1280]
    - [7, 26037.0]
  - - [2944, 704, 1, 32, 2944, 2944, 32, 32]
    - [17, 15716.0]
  - - [448, 4288, 1, 1, 448, 448, 1, 1]
    - [25, 342.0]
  - - [3584, 5056, 1, 1, 3584, 3584, 1, 1]
    - [34, 1052.0]
  - - [1408, 3584, 1, 1280, 1408, 1408, 1280, 1280]
    - [28, 30371.0]
  - - [6784, 448, 1, 1280, 6784, 6784, 1280, 1280]
    - [44, 26766.0]
  - - [3584, 5056, 1, 3328, 3584, 3584, 3328, 3328]
    - [23, 33610.0]
  - - [2368, 2368, 1, 32, 2368, 2368, 32, 32]
    - [8, 18968.0]
  - - [5888, 2944, 1, 32, 5888, 5888, 32, 32]
    - [41, 25306.0]
  - - [1856, 2944, 1, 32, 1856, 1856, 32, 32]
    - [8, 18842.0]
  - - [5056, 1408, 1, 1, 5056, 5056, 1, 1]
    - [41, 870.0]
  - - [5888, 1408, 1, 3328, 5888, 5888, 3328, 3328]
    - [28, 31692.0]
  - - [448, 4288, 1, 256, 448, 448, 256, 256]
    - [30, 21994.0]
  - - [6784, 1024, 1, 1, 6784, 6784, 1, 1]
    - [41, 949.0]
  - - [6784, 1024, 1, 32, 6784, 6784, 32, 32]
    - [17, 22185.0]
  - - [6784, 3584, 1, 1, 6784, 6784, 1, 1]
    - [24, 1113.0]
  - - [2944, 2368, 1, 32, 2944, 2944, 32, 32]
    - [17, 22398.0]
  - - [3584, 6784, 1, 3328, 3584, 3584, 3328, 3328]
    - [23, 34616.0]
  - - [6784, 1408, 1, 256, 6784, 6784, 256, 256]
    - [38, 30099.0]
  - - [5056, 1024, 1, 32, 5056, 5056, 32, 32]
    - [17, 18913.0]
  - - [1024, 5056, 1, 1280, 1024, 1024, 1280, 1280]
    - [44, 31034.0]
  - - [4288, 3584, 1, 256, 4288, 4288, 256, 256]
    - [14, 30983.0]
  - - [448, 6784, 1, 1280, 448, 448, 1280, 1280]
    - [30, 28454.0]
  - - [1856, 5888, 1, 1, 1856, 1856, 1, 1]
    - [41, 957.0]
  - - [256, 5888, 1, 32, 256, 256, 32, 32]
    - [8, 11999.0]
  - - [4288, 5056, 1, 32, 4288, 4288, 32, 32]
    - [0, 24866.0]
  - - [4288, 5056, 1, 3328, 4288, 4288, 3328, 3328]
    - [23, 34132.0]
  - - [1856, 5888, 1, 32, 1856, 1856, 32, 32]
    - [8, 22417.0]
  - - [1856, 5888, 1, 1280, 1856, 1856, 1280, 1280]
    - [23, 32201.0]
  - - [704, 2368, 1, 1280, 704, 704, 1280, 1280]
    - [23, 23367.0]
  - - [4288, 2368, 1, 1280, 4288, 4288, 1280, 1280]
    - [44, 30959.0]
  - - [2944, 5056, 1, 256, 2944, 2944, 256, 256]
    - [14, 31188.0]
  - - [2944, 4288, 1, 1, 2944, 2944, 1, 1]
    - [0, 1050.0]
  - - [5056, 5888, 1, 32, 5056, 5056, 32, 32]
    - [41, 25431.0]
  - - [2368, 5056, 1, 3328, 2368, 2368, 3328, 3328]
    - [23, 32249.0]
  - - [1024, 5056, 1, 3328, 1024, 1024, 3328, 3328]
    - [44, 31495.0]
  - - [1024, 6784, 1, 32, 1024, 1024, 32, 32]
    - [34, 21582.0]
  - - [3584, 2944, 1, 3328, 3584, 3584, 3328, 3328]
    - [28, 32470.0]
  - - [1408, 5888, 1, 1, 1408, 1408, 1, 1]
    - [24, 982.0]
  - - [704, 4288, 1, 32, 704, 704, 32, 32]
    - [34, 13722.0]
  - - [1408, 5888, 1, 32, 1408, 1408, 32, 32]
    - [0, 23312.0]
  - - [6784, 1024, 1, 3328, 6784, 6784, 3328, 3328]
    - [40, 33159.0]
  - - [5056, 1408, 1, 256, 5056, 5056, 256, 256]
    - [12, 28918.0]
  - - [2944, 1408, 1, 256, 2944, 2944, 256, 256]
    - [38, 26933.0]
  - - [2368, 2368, 1, 256, 2368, 2368, 256, 256]
    - [38, 26943.0]
  - - [1408, 6784, 1, 1, 1408, 1408, 1, 1]
    - [41, 1008.0]
  - - [6784, 6784, 1, 1280, 6784, 6784, 1280, 1280]
    - [23, 34032.0]
  - - [1024, 5888, 1, 1, 1024, 1024, 1, 1]
    - [41, 817.0]
  - - [1856, 3584, 1, 256, 1856, 1856, 256, 256]
    - [30, 29310.0]
  - - [2368, 704, 1, 32, 2368, 2368, 32, 32]
    - [0, 11160.0]
  - - [256, 5888, 1, 1280, 256, 256, 1280, 1280]
    - [28, 25670.0]
  - - [1856, 1024, 1, 3328, 1856, 1856, 3328, 3328]
    - [40, 27438.0]
  - - [5056, 2368, 1, 3328, 5056, 5056, 3328, 3328]
    - [28, 30577.0]
  - - [704, 4288, 1, 1280, 704, 704, 1280, 1280]
    - [23, 28433.0]
  - - [2560, 7000, 1, 2560, 2560, 2560, 2560, 2560]
    - [30, 33212.0]
  - - [7680, 12000, 1, 2560, 7680, 7680, 2560, 2560]
    - [14, 34705.0]
  - - [5124, 9124, 1, 1760, 5124, 5124, 1760, 1760]
    - [19, 35465.0]
  - - [512, 24000, 1, 1536, 512, 512, 1536, 1536]
    - [30, 32571.0]
  - - [3072, 24000, 1, 1024, 3072, 3072, 1024, 1024]
    - [14, 33875.0]
  - - [512, 48000, 1, 2816, 512, 512, 2816, 2816]
    - [7, 34389.0]
  - - [512, 48000, 1, 2048, 512, 512, 2048, 2048]
    - [28, 32234.0]
  - - [2048, 1600, 1, 2048, 2048, 2048, 2048, 2048]
    - [29, 24405.0]
  - - [512, 48000, 1, 1536, 512, 512, 1536, 1536]
    - [30, 33404.0]
  - - [8448, 5984, 1, 2816, 8448, 8448, 2816, 2816]
    - [7, 33942.0]
  - - [4096, 3200, 1, 1024, 4096, 4096, 1024, 1024]
    - [28, 31355.0]
  - - [1024, 24000, 1, 2560, 1024, 1024, 2560, 2560]
    - [14, 33892.0]
  - - [1760, 6400, 1, 1760, 1760, 1760, 1760, 1760]
    - [19, 35139.0]
  - - [5124, 9124, 1, 2048, 5124, 5124, 2048, 2048]
    - [14, 32948.0]
  - - [16384, 3200, 1, 4096, 16384, 16384, 4096, 4096]
    - [12, 30915.0]
  - - [1024, 48000, 1, 2560, 1024, 1024, 2560, 2560]
    - [14, 34280.0]
  - - [8448, 48000, 1, 2816, 8448, 8448, 2816, 2816]
    - [23, 35212.0]
  - - [2560, 3200, 1, 2560, 2560, 2560, 2560, 2560]
    - [28, 31401.0]
  - - [16384, 800, 1, 4096, 16384, 16384, 4096, 4096]
    - [12, 26585.0]
  - - [4608, 24000, 1, 1536, 4608, 4608, 1536, 1536]
    - [30, 34679.0]
  - - [7680, 48000, 1, 2560, 7680, 7680, 2560, 2560]
    - [14, 34938.0]
  - - [3072, 48000, 1, 1024, 3072, 3072, 1024, 1024]
    - [14, 34274.0]
  - - [8192, 3200, 1, 2048, 8192, 8192, 2048, 2048]
    - [14, 33001.0]
  - - [512, 24000, 1, 2816, 512, 512, 2816, 2816]
    - [40, 32770.0]
  - - [4096, 400, 1, 1024, 4096, 4096, 1024, 1024]
    - [30, 21237.0]
  - - [6144, 48000, 1, 2560, 6144, 6144, 2560, 2560]
    - [14, 34874.0]
  - - [4608, 48000, 1, 1536, 4608, 4608, 1536, 1536]
    - [30, 34474.0]
  - - [2048, 800, 1, 512, 2048, 2048, 512, 512]
    - [46, 21088.0]
  - - [4608, 5984, 1, 1536, 4608, 4608, 1536, 1536]
    - [30, 33914.0]
  - - [4096, 1600, 1, 1024, 4096, 4096, 1024, 1024]
    - [28, 28763.0]
  - - [6144, 5984, 1, 2048, 6144, 6144, 2048, 2048]
    - [14, 33816.0]
  - - [7680, 24000, 1, 2560, 7680, 7680, 2560, 2560]
    - [14, 34860.0]
  - - [6144, 48000, 1, 2048, 6144, 6144, 2048, 2048]
    - [14, 33633.0]
  - - [2048, 3200, 1, 2048, 2048, 2048, 2048, 2048]
    - [14, 31096.0]
  - - [5124, 9124, 1, 2560, 5124, 5124, 2560, 2560]
    - [14, 33227.0]
  - - [1024, 24000, 1, 1536, 1024, 1024, 1536, 1536]
    - [30, 34286.0]
  - - [2560, 6400, 1, 2560, 2560, 2560, 2560, 2560]
    - [30, 34596.0]
  - - [512, 24000, 1, 2560, 512, 512, 2560, 2560]
    - [30, 32355.0]
  - - [1024, 24000, 1, 2816, 1024, 1024, 2816, 2816]
    - [23, 34587.0]
  - - [7680, 5984, 1, 2560, 7680, 7680, 2560, 2560]
    - [14, 33924.0]
  - - [2048, 1600, 1, 512, 2048, 2048, 512, 512]
    - [44, 26108.0]
  - - [2048, 7000, 1, 2048, 2048, 2048, 2048, 2048]
    - [14, 32376.0]
  - - [1760, 800, 1, 1760, 1760, 1760, 1760, 1760]
    - [35, 25808.0]
  - - [2560, 1600, 1, 2560, 2560, 2560, 2560, 2560]
    - [46, 29678.0]
  - - [2048, 3200, 1, 512, 2048, 2048, 512, 512]
    - [28, 29647.0]
  - - [2560, 800, 1, 2560, 2560, 2560, 2560, 2560]
    - [44, 27095.0]
  - - [4608, 12000, 1, 1536, 4608, 4608, 1536, 1536]
    - [30, 34338.0]
  - - [6144, 24000, 1, 2048, 6144, 6144, 2048, 2048]
    - [14, 33513.0]
  - - [8192, 800, 1, 2048, 8192, 8192, 2048, 2048]
    - [12, 25777.0]
  - - [5124, 9124, 1, 4096, 5124, 5124, 4096, 4096]
    - [30, 30535.0]
  - - [8448, 24000, 1, 2816, 8448, 8448, 2816, 2816]
    - [23, 35160.0]
  - - [1024, 48000, 1, 1536, 1024, 1024, 1536, 1536]
    - [14, 33791.0]
  - - [8192, 1600, 1, 2048, 8192, 8192, 2048, 2048]
    - [14, 29148.0]
  - - [4096, 800, 1, 1024, 4096, 4096, 1024, 1024]
    - [28, 24851.0]
  - - [2048, 800, 1, 2048, 2048, 2048, 2048, 2048]
    - [14, 23014.0]
  - - [1760, 3200, 1, 1760, 1760, 1760, 1760, 1760]
    - [5, 30749.0]
  - - [512, 48000, 1, 2560, 512, 512, 2560, 2560]
    - [14, 33631.0]
  - - [512, 24000, 1, 2048, 512, 512, 2048, 2048]
    - [30, 32697.0]
  - - [16384, 1600, 1, 4096, 16384, 16384, 4096, 4096]
    - [12, 29189.0]
  - - [1024, 24000, 1, 2048, 1024, 1024, 2048, 2048]
    - [14, 33687.0]
  - - [8192, 400, 1, 2048, 8192, 8192, 2048, 2048]
    - [30, 22539.0]
  - - [2048, 6400, 1, 2048, 2048, 2048, 2048, 2048]
    - [14, 31401.0]
  - - [6144, 12000, 1, 2048, 6144, 6144, 2048, 2048]
    - [14, 33649.0]
  - - [1760, 7000, 1, 1760, 1760, 1760, 1760, 1760]
    - [19, 34555.0]
  - - [1024, 48000, 1, 2816, 1024, 1024, 2816, 2816]
    - [23, 34850.0]
  - - [4096, 7000, 1, 4096, 4096, 4096, 4096, 4096]
    - [14, 31723.0]
  - - [6144, 24000, 1, 2560, 6144, 6144, 2560, 2560]
    - [14, 34708.0]
  - - [8448, 12000, 1, 2816, 8448, 8448, 2816, 2816]
    - [23, 34996.0]
  - - [16384, 400, 1, 4096, 16384, 16384, 4096, 4096]
    - [14, 23851.0]
  - - [1760, 1600, 1, 1760, 1760, 1760, 1760, 1760]
    - [19, 25674.0]
  - - [1024, 48000, 1, 2048, 1024, 1024, 2048, 2048]
    - [30, 32578.0]
  - - [4096, 4096, 1, 4096, 4096, 4096, 4096, 4096]
    - [14, 32047.0]
  - - [2048, 2048, 1, 2049, 2048, 2048, 2049, 2049]
    - [23, 30528.0]
  - - [8192, 8191, 1, 8192, 8192, 8192, 8192, 8192]
    - [16, 28605.0]
  - - [8192, 8192, 1, 8192, 8192, 8192, 8192, 8192]
    - [14, 28604.0]
  - - [2047, 2048, 1, 2048, 2047, 2047, 2048, 2048]
    - [14, 29508.0]
  - - [2048, 2049, 1, 2048, 2048, 2048, 2048, 2048]
    - [14, 29995.0]
  - - [8192, 8192, 1, 8191, 8192, 8192, 8191, 8191]
    - [23, 35253.0]
  - - [3072, 513, 1, 3072, 3072, 3072, 3072, 3072]
    - [46, 22409.0]
  - - [8191, 8192, 1, 8192, 8191, 8191, 8192, 8192]
    - [14, 29083.0]
  - - [8192, 8193, 1, 8192, 8192, 8192, 8192, 8192]
    - [14, 27705.0]
  - - [4096, 4097, 1, 4096, 4096, 4096, 4096, 4096]
    - [14, 29843.0]
  - - [8192, 8192, 1, 8193, 8192, 8192, 8193, 8193]
    - [7, 35008.0]
  - - [4096, 4095, 1, 4096, 4096, 4096, 4096, 4096]
    - [14, 33145.0]
  - - [4096, 4096, 1, 4097, 4096, 4096, 4097, 4097]
    - [7, 32932.0]
  - - [2048, 2048, 1, 2048, 2048, 2048, 2048, 2048]
    - [14, 30031.0]
  - - [4095, 4096, 1, 4096, 4095, 4095, 4096, 4096]
    - [14, 32019.0]
  - - [8193, 8192, 1, 8192, 8193, 8193, 8192, 8192]
    - [16, 27941.0]
  - - [4096, 4096, 1, 4095, 4096, 4096, 4095, 4095]
    - [23, 32924.0]
  - - [3072, 511, 1, 3072, 3072, 3072, 3072, 3072]
    - [28, 26214.0]
  - - [2049, 2048, 1, 2048, 2049, 2049, 2048, 2048]
    - [30, 26648.0]
  - - [2048, 2047, 1, 2048, 2048, 2048, 2048, 2048]
    - [14, 29023.0]
  - - [2048, 2048, 1, 2047, 2048, 2048, 2047, 2047]
    - [23, 30624.0]
  - - [4097, 4096, 1, 4096, 4097, 4097, 4096, 4096]
    - [14, 28763.0]
  - - [128, 128, 512, 64, 128, 128, 64, 64]
    - [45, 20729.0]
  - - [512, 512, 64, 64, 512, 512, 64, 64]
    - [21, 27391.0]
  - - [1024, 2048, 1, 1024, 1024, 1024, 1024, 1024]
    - [30, 29249.0]
  - - [1024, 2048, 1, 4096, 1024, 1024, 4096, 4096]
    - [30, 29880.0]
  - - [1024, 4096, 1, 1024, 1024, 1024, 1024, 1024]
    - [30, 29976.0]
  - - [1024, 4096, 1, 4096, 1024, 1024, 4096, 4096]
    - [30, 27459.0]
  - - [4096, 2048, 1, 1024, 4096, 4096, 1024, 1024]
    - [28, 30654.0]
  - - [4096, 4096, 1, 1024, 4096, 4096, 1024, 1024]
    - [14, 32172.0]
  - - [30528, 2048, 1, 1024, 30528, 30528, 1024, 1024]
    - [14, 34169.0]
  - - [30528, 4096, 1, 1024, 30528, 30528, 1024, 1024]
    - [14, 34521.0]
  - - [128, 32768, 1, 256, 128, 128, 256, 256]
    - [14, 26670.0]
  - - [256, 4608, 1, 1024, 256, 256, 1024, 1024]
    - [14, 28092.0]
  - - [256, 4864, 1, 1024, 256, 256, 1024, 1024]
    - [44, 21358.0]
  - - [256, 5376, 1, 1024, 256, 256, 1024, 1024]
    - [28, 23371.0]
  - - [256, 5888, 1, 1024, 256, 256, 1024, 1024]
    - [44, 25487.0]
  - - [256, 6144, 1, 1024, 256, 256, 1024, 1024]
    - [28, 26499.0]
  - - [256, 6400, 1, 1024, 256, 256, 1024, 1024]
    - [44, 27450.0]
  - - [256, 6656, 1, 1024, 256, 256, 1024, 1024]
    - [44, 28464.0]
  - - [256, 7168, 1, 1024, 256, 256, 1024, 1024]
    - [14, 25565.0]
  - - [256, 7424, 1, 1024, 256, 256, 1024, 1024]
    - [14, 26321.0]
  - - [256, 7936, 1, 1024, 256, 256, 1024, 1024]
    - [14, 28251.0]
  - - [256, 8192, 1, 1024, 256, 256, 1024, 1024]
    - [14, 29067.0]
  - - [256, 8448, 1, 1024, 256, 256, 1024, 1024]
    - [14, 29967.0]
  - - [256, 8960, 1, 1024, 256, 256, 1024, 1024]
    - [14, 31698.0]
  - - [256, 9984, 1, 1024, 256, 256, 1024, 1024]
    - [44, 26860.0]
  - - [256, 10496, 1, 1024, 256, 256, 1024, 1024]
    - [44, 28255.0]
  - - [256, 11264, 1, 1024, 256, 256, 1024, 1024]
    - [44, 30167.0]
  - - [256, 11520, 1, 1024, 256, 256, 1024, 1024]
    - [14, 27787.0]
  - - [256, 11776, 1, 1024, 256, 256, 1024, 1024]
    - [14, 28295.0]
  - - [256, 12544, 1, 1024, 256, 256, 1024, 1024]
    - [14, 29802.0]
  - - [256, 13312, 1, 1024, 256, 256, 1024, 1024]
    - [14, 31247.0]
  - - [256, 14336, 1, 1024, 256, 256, 1024, 1024]
    - [28, 28312.0]
  - - [256, 14592, 1, 1024, 256, 256, 1024, 1024]
    - [44, 28804.0]
  - - [256, 14848, 1, 1024, 256, 256, 1024, 1024]
    - [28, 29182.0]
  - - [256, 15104, 1, 1024, 256, 256, 1024, 1024]
    - [28, 29685.0]
  - - [256, 16128, 1, 1024, 256, 256, 1024, 1024]
    - [14, 29413.0]
  - - [256, 18176, 1, 1024, 256, 256, 1024, 1024]
    - [14, 32978.0]
  - - [256, 18944, 1, 1024, 256, 256, 1024, 1024]
    - [28, 29264.0]
  - - [256, 19200, 1, 1024, 256, 256, 1024, 1024]
    - [44, 29596.0]
  - - [256, 20480, 1, 1024, 256, 256, 1024, 1024]
    - [44, 31462.0]
  - - [256, 20992, 1, 1024, 256, 256, 1024, 1024]
    - [14, 30780.0]
  - - [256, 21248, 1, 1024, 256, 256, 1024, 1024]
    - [14, 31250.0]
  - - [256, 21504, 1, 1024, 256, 256, 1024, 1024]
    - [14, 31415.0]
  - - [256, 22016, 1, 1024, 256, 256, 1024, 1024]
    - [14, 32210.0]
  - - [256, 22344, 1, 1024, 256, 256, 1024, 1024]
    - [14, 31861.0]
  - - [256, 23296, 1, 1024, 256, 256, 1024, 1024]
    - [44, 29723.0]
  - - [256, 23552, 1, 1024, 256, 256, 1024, 1024]
    - [44, 30064.0]
  - - [256, 31488, 1, 1024, 256, 256, 1024, 1024]
    - [14, 33212.0]
  - - [256, 32768, 1, 512, 256, 256, 512, 512]
    - [28, 30500.0]
  - - [256, 33536, 1, 1024, 256, 256, 1024, 1024]
    - [44, 31442.0]
  - - [256, 44505, 1, 1024, 256, 256, 1024, 1024]
    - [14, 32829.0]
  - - [512, 32768, 1, 13, 512, 512, 13, 13]
    - [45, 11918.0]
  - - [512, 32768, 1, 1024, 512, 512, 1024, 1024]
    - [30, 32888.0]
  - - [684, 8976, 1, 256, 684, 684, 256, 256]
    - [46, 26876.0]
  - - [1024, 1600, 1, 560, 1024, 1024, 560, 560]
    - [35, 27081.0]
  - - [1024, 1600, 1, 1024, 1024, 1024, 1024, 1024]
    - [44, 26421.0]
  - - [1024, 32768, 1, 480, 1024, 1024, 480, 480]
    - [19, 35850.0]
  - - [1024, 32768, 1, 1024, 1024, 1024, 1024, 1024]
    - [30, 34011.0]
  - - [1280, 8976, 1, 256, 1280, 1280, 256, 256]
    - [46, 29970.0]
  - - [1792, 8976, 1, 256, 1792, 1792, 256, 256]
    - [30, 31068.0]
  - - [2048, 684, 1, 512, 2048, 2048, 512, 512]
    - [44, 21947.0]
  - - [2048, 684, 1, 768, 2048, 2048, 768, 768]
    - [44, 22900.0]
  - - [2048, 960, 1, 74, 2048, 2048, 74, 74]
    - [4, 17487.0]
  - - [2048, 960, 1, 2048, 2048, 2048, 2048, 2048]
    - [30, 26912.0]
  - - [2048, 1536, 1, 512, 2048, 2048, 512, 512]
    - [30, 28406.0]
  - - [2048, 1536, 1, 768, 2048, 2048, 768, 768]
    - [23, 29263.0]
  - - [2048, 8976, 1, 256, 2048, 2048, 256, 256]
    - [30, 30952.0]
  - - [2304, 8976, 1, 256, 2304, 2304, 256, 256]
    - [30, 32516.0]
  - - [2560, 8976, 1, 256, 2560, 2560, 256, 256]
    - [30, 32378.0]
  - - [2816, 8976, 1, 256, 2816, 2816, 256, 256]
    - [30, 31695.0]
  - - [3072, 8976, 1, 256, 3072, 3072, 256, 256]
    - [30, 32410.0]
  - - [3328, 8976, 1, 256, 3328, 3328, 256, 256]
    - [46, 32002.0]
  - - [3840, 8976, 1, 256, 3840, 3840, 256, 256]
    - [23, 32164.0]
  - - [4096, 8976, 1, 256, 4096, 4096, 256, 256]
    - [23, 31905.0]
  - - [4352, 8976, 1, 256, 4352, 4352, 256, 256]
    - [23, 32399.0]
  - - [4608, 8976, 1, 256, 4608, 4608, 256, 256]
    - [30, 32763.0]
  - - [4864, 8976, 1, 256, 4864, 4864, 256, 256]
    - [30, 32391.0]
  - - [5120, 8976, 1, 256, 5120, 5120, 256, 256]
    - [30, 32688.0]
  - - [5376, 8976, 1, 256, 5376, 5376, 256, 256]
    - [40, 32527.0]
  - - [5632, 8976, 1, 256, 5632, 5632, 256, 256]
    - [30, 32793.0]
  - - [5888, 8976, 1, 256, 5888, 5888, 256, 256]
    - [23, 32627.0]
  - - [6144, 8976, 1, 256, 6144, 6144, 256, 256]
    - [23, 31956.0]
  - - [6400, 8976, 1, 256, 6400, 6400, 256, 256]
    - [46, 32630.0]
  - - [7168, 8976, 1, 256, 7168, 7168, 256, 256]
    - [30, 32637.0]
  - - [7936, 8976, 1, 256, 7936, 7936, 256, 256]
    - [23, 32749.0]
  - - [8192, 8976, 1, 256, 8192, 8192, 256, 256]
    - [12, 31687.0]
  - - [8448, 8976, 1, 256, 8448, 8448, 256, 256]
    - [30, 32540.0]
  - - [8960, 8976, 1, 256, 8960, 8960, 256, 256]
    - [14, 32609.0]
  - - [9472, 8976, 1, 256, 9472, 9472, 256, 256]
    - [23, 32526.0]
  - - [9728, 8976, 1, 256, 9728, 9728, 256, 256]
    - [23, 32173.0]
  - - [9984, 8976, 1, 256, 9984, 9984, 256, 256]
    - [30, 32596.0]
  - - [10240, 8976, 1, 256, 10240, 10240, 256, 256]
    - [12, 31692.0]
  - - [10496, 8976, 1, 256, 10496, 10496, 256, 256]
    - [14, 32679.0]
  - - [11264, 8976, 1, 256, 11264, 11264, 256, 256]
    - [21, 31860.0]
  - - [11776, 8976, 1, 256, 11776, 11776, 256, 256]
    - [23, 32110.0]
  - - [12544, 8976, 1, 256, 12544, 12544, 256, 256]
    - [14, 32798.0]
  - - [13312, 8976, 1, 256, 13312, 13312, 256, 256]
    - [12, 31917.0]
  - - [13568, 8976, 1, 256, 13568, 13568, 256, 256]
    - [14, 32813.0]
  - - [13824, 8976, 1, 256, 13824, 13824, 256, 256]
    - [28, 32047.0]
  - - [15104, 8976, 1, 256, 15104, 15104, 256, 256]
    - [14, 32889.0]
  - - [15360, 8976, 1, 256, 15360, 15360, 256, 256]
    - [12, 31943.0]
  - - [15872, 8976, 1, 256, 15872, 15872, 256, 256]
    - [23, 32259.0]
  - - [16128, 8976, 1, 256, 16128, 16128, 256, 256]
    - [46, 32679.0]
  - - [17152, 8976, 1, 256, 17152, 17152, 256, 256]
    - [14, 32967.0]
  - - [18176, 8976, 1, 256, 18176, 18176, 256, 256]
    - [14, 32940.0]
  - - [18688, 8976, 1, 256, 18688, 18688, 256, 256]
    - [23, 32910.0]
  - - [18944, 8976, 1, 256, 18944, 18944, 256, 256]
    - [23, 32540.0]
  - - [19712, 8976, 1, 256, 19712, 19712, 256, 256]
    - [14, 32961.0]
  - - [19968, 8976, 1, 256, 19968, 19968, 256, 256]
    - [21, 32121.0]
  - - [20480, 8976, 1, 256, 20480, 20480, 256, 256]
    - [12, 32018.0]
  - - [20992, 8976, 1, 256, 20992, 20992, 256, 256]
    - [30, 32179.0]
  - - [21248, 8976, 1, 256, 21248, 21248, 256, 256]
    - [14, 33000.0]
  - - [23552, 8976, 1, 256, 23552, 23552, 256, 256]
    - [21, 32132.0]
  - - [28672, 8976, 1, 256, 28672, 28672, 256, 256]
    - [12, 32115.0]
  - - [31488, 8976, 1, 256, 31488, 31488, 256, 256]
    - [14, 33146.0]
  - - [33536, 8976, 1, 256, 33536, 33536, 256, 256]
    - [14, 33163.0]
  - - [44505, 8976, 1, 256, 44505, 44505, 256, 256]
    - [21, 32201.0]
  - - [1024, 3840, 1, 1024, 1024, 1024, 1024, 1024]
    - [28, 29598.0]
  - - [1024, 3840, 1, 4096, 1024, 1024, 4096, 4096]
    - [30, 28194.0]
  - - [1024, 3968, 1, 1024, 1024, 1024, 1024, 1024]
    - [28, 30473.0]
  - - [1024, 3968, 1, 4096, 1024, 1024, 4096, 4096]
    - [14, 26829.0]
  - - [1024, 6528, 1, 1024, 1024, 1024, 1024, 1024]
    - [30, 31690.0]
  - - [1024, 6528, 1, 4096, 1024, 1024, 4096, 4096]
    - [30, 28192.0]
  - - [1024, 7104, 1, 1024, 1024, 1024, 1024, 1024]
    - [28, 30375.0]
  - - [1024, 7104, 1, 4096, 1024, 1024, 4096, 4096]
    - [30, 28204.0]
  - - [1024, 7200, 1, 1024, 1024, 1024, 1024, 1024]
    - [30, 30435.0]
  - - [1024, 7200, 1, 4096, 1024, 1024, 4096, 4096]
    - [14, 27779.0]
  - - [1024, 8064, 1, 1024, 1024, 1024, 1024, 1024]
    - [28, 32085.0]
  - - [1024, 8064, 1, 4096, 1024, 1024, 4096, 4096]
    - [14, 28224.0]
  - - [1024, 8160, 1, 1024, 1024, 1024, 1024, 1024]
    - [28, 30607.0]
  - - [1024, 8160, 1, 4096, 1024, 1024, 4096, 4096]
    - [30, 27412.0]
  - - [1024, 9216, 1, 1024, 1024, 1024, 1024, 1024]
    - [30, 34061.0]
  - - [1024, 9216, 1, 4096, 1024, 1024, 4096, 4096]
    - [14, 34016.0]
  - - [1024, 9520, 1, 1024, 1024, 1024, 1024, 1024]
    - [30, 31508.0]
  - - [1024, 9520, 1, 4096, 1024, 1024, 4096, 4096]
    - [46, 28919.0]
  - - [1024, 10064, 1, 1024, 1024, 1024, 1024, 1024]
    - [30, 33046.0]
  - - [1024, 10064, 1, 4096, 1024, 1024, 4096, 4096]
    - [14, 29035.0]
  - - [1024, 10080, 1, 1024, 1024, 1024, 1024, 1024]
    - [30, 33125.0]
  - - [1024, 10080, 1, 4096, 1024, 1024, 4096, 4096]
    - [14, 29525.0]
  - - [1024, 10200, 1, 1024, 1024, 1024, 1024, 1024]
    - [30, 33272.0]
  - - [1024, 10200, 1, 4096, 1024, 1024, 4096, 4096]
    - [30, 29482.0]
  - - [4096, 3840, 1, 1024, 4096, 4096, 1024, 1024]
    - [14, 32304.0]
  - - [4096, 3968, 1, 1024, 4096, 4096, 1024, 1024]
    - [28, 31719.0]
  - - [4096, 6528, 1, 1024, 4096, 4096, 1024, 1024]
    - [14, 32697.0]
  - - [4096, 7104, 1, 1024, 4096, 4096, 1024, 1024]
    - [14, 33570.0]
  - - [4096, 7200, 1, 1024, 4096, 4096, 1024, 1024]
    - [14, 32926.0]
  - - [4096, 8064, 1, 1024, 4096, 4096, 1024, 1024]
    - [14, 33054.0]
  - - [4096, 8160, 1, 1024, 4096, 4096, 1024, 1024]
    - [14, 33339.0]
  - - [4096, 9216, 1, 1024, 4096, 4096, 1024, 1024]
    - [14, 34149.0]
  - - [4096, 9520, 1, 1024, 4096, 4096, 1024, 1024]
    - [14, 33230.0]
  - - [4096, 10064, 1, 1024, 4096, 4096, 1024, 1024]
    - [14, 33531.0]
  - - [4096, 10080, 1, 1024, 4096, 4096, 1024, 1024]
    - [14, 33521.0]
  - - [4096, 10200, 1, 1024, 4096, 4096, 1024, 1024]
    - [14, 33832.0]
  - - [42720, 3968, 1, 1024, 42720, 42720, 1024, 1024]
    - [14, 33570.0]
  - - [42720, 6528, 1, 1024, 42720, 42720, 1024, 1024]
    - [14, 34060.0]
  - - [42720, 7104, 1, 1024, 42720, 42720, 1024, 1024]
    - [14, 34437.0]
  - - [42720, 7200, 1, 1024, 42720, 42720, 1024, 1024]
    - [14, 33720.0]
  - - [42720, 9520, 1, 1024, 42720, 42720, 1024, 1024]
    - [14, 34018.0]
  - - [42720, 10080, 1, 1024, 42720, 42720, 1024, 1024]
    - [14, 34226.0]
  - - [1024, 3240, 1, 1024, 1024, 1024, 1024, 1024]
    - [14, 29348.0]
  - - [1024, 3240, 1, 4096, 1024, 1024, 4096, 4096]
    - [30, 31340.0]
  - - [1024, 3960, 1, 1024, 1024, 1024, 1024, 1024]
    - [28, 30550.0]
  - - [1024, 3960, 1, 4096, 1024, 1024, 4096, 4096]
    - [30, 28352.0]
  - - [4096, 3240, 1, 1024, 4096, 4096, 1024, 1024]
    - [14, 31470.0]
  - - [4096, 3960, 1, 1024, 4096, 4096, 1024, 1024]
    - [28, 31711.0]
  - - [42720, 3960, 1, 1024, 42720, 42720, 1024, 1024]
    - [14, 33509.0]
  - - [7680, 8192, 1, 8192, 7680, 7680, 8192, 8192]
    - [16, 28597.0]
  - - [3840, 4096, 1, 4096, 3840, 3840, 4096, 4096]
    - [14, 29931.0]
  - - [1920, 2048, 1, 2048, 1920, 1920, 2048, 2048]
    - [14, 27373.0]
  - - [8192, 7680, 1, 8192, 8192, 8192, 8192, 8192]
    - [16, 28584.0]
  - - [4096, 3840, 1, 4096, 4096, 4096, 4096, 4096]
    - [14, 30861.0]
  - - [2048, 1920, 1, 2048, 2048, 2048, 2048, 2048]
    - [14, 28026.0]
  - - [512, 512, 16, 64, 512, 512, 64, 64]
    - [39, 21860.0]
  - - [512, 512, 128, 64, 512, 512, 64, 64]
    - [28, 29178.0]
  - - [4096, 512, 1, 1024, 4096, 4096, 1024, 1024]
    - [30, 29321.0]
  - - [30522, 616, 1, 1024, 30522, 30522, 1024, 1024]
    - [28, 30583.0]
  - - [128, 128, 128, 64, 128, 128, 64, 64]
    - [6, 16904.0]
  - - [128, 128, 160, 64, 128, 128, 64, 64]
    - [6, 16101.0]
  - - [1024, 1280, 1, 1024, 1024, 1024, 1024, 1024]
    - [28, 22221.0]
  - - [1024, 1280, 1, 4096, 1024, 1024, 4096, 4096]
    - [44, 22312.0]
  - - [4096, 1280, 1, 1024, 4096, 4096, 1024, 1024]
    - [14, 29086.0]
  - - [30522, 160, 1, 1024, 30522, 30522, 1024, 1024]
    - [30, 19504.0]
  - - [30522, 200, 1, 1024, 30522, 30522, 1024, 1024]
    - [46, 23961.0]
  - - [128, 128, 624, 64, 128, 128, 64, 64]
    - [6, 21327.0]
  - - [1024, 4992, 1, 1024, 1024, 1024, 1024, 1024]
    - [28, 30704.0]
  - - [1024, 4992, 1, 4096, 1024, 1024, 4096, 4096]
    - [30, 27447.0]
  - - [4096, 4992, 1, 1024, 4096, 4096, 1024, 1024]
    - [14, 32578.0]
  - - [30522, 780, 1, 1024, 30522, 30522, 1024, 1024]
    - [28, 28133.0]
  - - [30522, 308, 1, 1024, 30522, 30522, 1024, 1024]
    - [44, 25713.0]
  - - [128, 128, 640, 64, 128, 128, 64, 64]
    - [13, 21662.0]
  - - [1024, 5120, 1, 1024, 1024, 1024, 1024, 1024]
    - [28, 31392.0]
  - - [1024, 5120, 1, 4096, 1024, 1024, 4096, 4096]
    - [14, 30631.0]
  - - [4096, 5120, 1, 1024, 4096, 4096, 1024, 1024]
    - [14, 33602.0]
  - - [30522, 800, 1, 1024, 30522, 30522, 1024, 1024]
    - [28, 28824.0]
  - - [128, 128, 656, 64, 128, 128, 64, 64]
    - [13, 21577.0]
  - - [1024, 5248, 1, 1024, 1024, 1024, 1024, 1024]
    - [30, 30589.0]
  - - [1024, 5248, 1, 4096, 1024, 1024, 4096, 4096]
    - [14, 30782.0]
  - - [4096, 5248, 1, 1024, 4096, 4096, 1024, 1024]
    - [14, 32579.0]
  - - [30522, 820, 1, 1024, 30522, 30522, 1024, 1024]
    - [28, 29485.0]
  - - [512, 512, 80, 64, 512, 512, 64, 64]
    - [5, 27927.0]
  - - [1024, 2560, 1, 1024, 1024, 1024, 1024, 1024]
    - [28, 27543.0]
  - - [1024, 2560, 1, 4096, 1024, 1024, 4096, 4096]
    - [14, 25266.0]
  - - [4096, 2560, 1, 1024, 4096, 4096, 1024, 1024]
    - [14, 33462.0]
  - - [30522, 385, 1, 1024, 30522, 30522, 1024, 1024]
    - [14, 24518.0]
  - - [512, 512, 96, 64, 512, 512, 64, 64]
    - [5, 28466.0]
  - - [1024, 3072, 1, 1024, 1024, 1024, 1024, 1024]
    - [30, 29601.0]
  - - [1024, 3072, 1, 4096, 1024, 1024, 4096, 4096]
    - [30, 29357.0]
  - - [4096, 3072, 1, 1024, 4096, 4096, 1024, 1024]
    - [14, 32452.0]
  - - [30522, 462, 1, 1024, 30522, 30522, 1024, 1024]
    - [14, 29065.0]
  - - [4096, 1024, 1, 1024, 4096, 4096, 1024, 1024]
    - [14, 28413.0]
  - - [128, 128, 144, 64, 128, 128, 64, 64]
    - [37, 17198.0]
  - - [1024, 1152, 1, 1024, 1024, 1024, 1024, 1024]
    - [28, 26927.0]
  - - [1024, 1152, 1, 4096, 1024, 1024, 4096, 4096]
    - [28, 28063.0]
  - - [4096, 1152, 1, 1024, 4096, 4096, 1024, 1024]
    - [28, 30768.0]
  - - [30522, 180, 1, 1024, 30522, 30522, 1024, 1024]
    - [30, 21755.0]
  - - [1024, 32768, 1, 479, 1024, 1024, 479, 479]
    - [19, 35140.0]
  - - [1024, 8192, 1, 1024, 1024, 1024, 1024, 1024]
    - [28, 30727.0]
  - - [1024, 8192, 1, 4096, 1024, 1024, 4096, 4096]
    - [14, 28223.0]
  - - [1024, 9600, 1, 1024, 1024, 1024, 1024, 1024]
    - [28, 31723.0]
  - - [1024, 9600, 1, 4096, 1024, 1024, 4096, 4096]
    - [30, 29385.0]
  - - [4096, 8192, 1, 1024, 4096, 4096, 1024, 1024]
    - [14, 33563.0]
  - - [4096, 9600, 1, 1024, 4096, 4096, 1024, 1024]
    - [14, 33629.0]
  - - [33712, 8192, 1, 1024, 33712, 33712, 1024, 1024]
    - [14, 34797.0]
  - - [33712, 9600, 1, 1024, 33712, 33712, 1024, 1024]
    - [14, 34310.0]
  - - [1024, 1024, 128, 96, 1024, 1024, 96, 96]
    - [5, 27279.0]
  - - [30592, 4096, 1, 1024, 30592, 30592, 1024, 1024]
    - [14, 34675.0]
  - - [1536, 8192, 1, 1536, 1536, 1536, 1536, 1536]
    - [30, 33581.0]
  - - [3072, 8192, 1, 1024, 3072, 3072, 1024, 1024]
    - [30, 33571.0]
  - - [3072, 2048, 1, 1024, 3072, 3072, 1024, 1024]
    - [28, 30976.0]
  - - [50304, 8192, 1, 1024, 50304, 50304, 1024, 1024]
    - [14, 34719.0]
  - - [2048, 1024, 1, 8192, 2048, 2048, 8192, 8192]
    - [14, 29573.0]
  - - [50304, 2048, 1, 1024, 50304, 50304, 1024, 1024]
    - [14, 34470.0]
  - - [1536, 8192, 1, 6144, 1536, 1536, 6144, 6144]
    - [46, 30483.0]
  - - [50304, 4096, 1, 1536, 50304, 50304, 1536, 1536]
    - [46, 34725.0]
  - - [8192, 1024, 1, 2048, 8192, 8192, 2048, 2048]
    - [14, 30256.0]
  - - [2560, 2048, 1, 640, 2560, 2560, 640, 640]
    - [38, 31377.0]
  - - [1024, 1024, 128, 64, 1024, 1024, 64, 64]
    - [0, 25279.0]
  - - [2048, 1024, 1, 2048, 2048, 2048, 2048, 2048]
    - [46, 29434.0]
  - - [1536, 4096, 1, 1536, 1536, 1536, 1536, 1536]
    - [28, 31232.0]
  - - [1024, 1024, 64, 64, 1024, 1024, 64, 64]
    - [0, 24517.0]
  - - [30592, 8192, 1, 1024, 30592, 30592, 1024, 1024]
    - [14, 34773.0]
  - - [50304, 16384, 1, 1024, 50304, 50304, 1024, 1024]
    - [14, 34738.0]
  - - [4608, 4096, 1, 1536, 4608, 4608, 1536, 1536]
    - [30, 34682.0]
  - - [2560, 2048, 1, 2560, 2560, 2560, 2560, 2560]
    - [30, 29137.0]
  - - [7680, 2048, 1, 2560, 7680, 7680, 2560, 2560]
    - [30, 32832.0]
  - - [50304, 4096, 1, 1024, 50304, 50304, 1024, 1024]
    - [14, 34604.0]
  - - [1920, 2048, 1, 2560, 1920, 1920, 2560, 2560]
    - [44, 29640.0]
  - - [1024, 1024, 64, 96, 1024, 1024, 96, 96]
    - [1, 28776.0]
  - - [6144, 4096, 1, 1536, 6144, 6144, 1536, 1536]
    - [30, 33306.0]
  - - [1536, 4096, 1, 6144, 1536, 1536, 6144, 6144]
    - [46, 27600.0]
  - - [512, 512, 256, 64, 512, 512, 64, 64]
    - [1, 23279.0]
  - - [50304, 8192, 1, 1536, 50304, 50304, 1536, 1536]
    - [46, 34840.0]
  - - [6144, 8192, 1, 1536, 6144, 6144, 1536, 1536]
    - [14, 34347.0]
  - - [4096, 16384, 1, 1024, 4096, 4096, 1024, 1024]
    - [14, 33966.0]
  - - [30592, 1024, 1, 2048, 30592, 30592, 2048, 2048]
    - [14, 33510.0]
  - - [1024, 16384, 1, 4096, 1024, 1024, 4096, 4096]
    - [14, 31575.0]
  - - [512, 512, 40, 64, 512, 512, 64, 64]
    - [22, 25153.0]
  - - [6144, 1024, 1, 2048, 6144, 6144, 2048, 2048]
    - [14, 29865.0]
  - - [4608, 8192, 1, 1536, 4608, 4608, 1536, 1536]
    - [30, 34966.0]
  - - [30592, 2048, 1, 1024, 30592, 30592, 1024, 1024]
    - [14, 34343.0]
  - - [3072, 16384, 1, 1024, 3072, 3072, 1024, 1024]
    - [30, 34387.0]
  - - [1024, 1024, 256, 64, 1024, 1024, 64, 64]
    - [12, 22544.0]
  - - [1024, 16384, 1, 1024, 1024, 1024, 1024, 1024]
    - [30, 32941.0]
  - - [1024, 1024, 32, 64, 1024, 1024, 64, 64]
    - [19, 29450.0]
  - - [3072, 4096, 1, 1024, 3072, 3072, 1024, 1024]
    - [30, 33424.0]
  - - [30528, 8192, 1, 1024, 30528, 30528, 1024, 1024]
    - [14, 34679.0]
  - - [128, 128, 1024, 64, 128, 128, 64, 64]
    - [22, 22643.0]
  - - [1024, 3456, 1, 1024, 1024, 1024, 1024, 1024]
    - [28, 30942.0]
  - - [1024, 3456, 1, 480, 1024, 1024, 480, 480]
    - [38, 30762.0]
  - - [1024, 4096, 1, 480, 1024, 1024, 480, 480]
    - [19, 30888.0]
  - - [1024, 6912, 1, 1024, 1024, 1024, 1024, 1024]
    - [30, 33526.0]
  - - [1024, 6912, 1, 480, 1024, 1024, 480, 480]
    - [19, 34924.0]
  - - [128, 55296, 1, 256, 128, 128, 256, 256]
    - [14, 31855.0]
  - - [256, 55296, 1, 512, 256, 256, 512, 512]
    - [14, 33424.0]
  - - [256, 6912, 1, 512, 256, 256, 512, 512]
    - [13, 26305.0]
  - - [512, 3456, 1, 1024, 512, 512, 1024, 1024]
    - [29, 27214.0]
  - - [512, 3456, 1, 13, 512, 512, 13, 13]
    - [22, 5611.0]
  - - [512, 4096, 1, 1024, 512, 512, 1024, 1024]
    - [30, 29241.0]
  - - [512, 4096, 1, 13, 512, 512, 13, 13]
    - [29, 6816.0]
  - - [512, 55296, 1, 13, 512, 512, 13, 13]
    - [41, 13051.0]
  - - [512, 6912, 1, 1024, 512, 512, 1024, 1024]
    - [46, 32689.0]
  - - [512, 6912, 1, 13, 512, 512, 13, 13]
    - [29, 7932.0]
  - - [30528, 640, 1, 1024, 30528, 30528, 1024, 1024]
    - [28, 31962.0]
  - - [30528, 1280, 1, 1024, 30528, 30528, 1024, 1024]
    - [14, 33860.0]
  - - [30528, 1600, 1, 1024, 30528, 30528, 1024, 1024]
    - [28, 31383.0]
  - - [1024, 10240, 1, 1024, 1024, 1024, 1024, 1024]
    - [30, 33544.0]
  - - [4096, 10240, 1, 1024, 4096, 4096, 1024, 1024]
    - [14, 33836.0]
  - - [1024, 10240, 1, 4096, 1024, 1024, 4096, 4096]
    - [14, 29372.0]
  - - [128, 128, 1280, 64, 128, 128, 64, 64]
    - [5, 25624.0]
  - - [1024, 10496, 1, 4096, 1024, 1024, 4096, 4096]
    - [14, 31102.0]
  - - [30528, 1640, 1, 1024, 30528, 30528, 1024, 1024]
    - [12, 32139.0]
  - - [4096, 10496, 1, 1024, 4096, 4096, 1024, 1024]
    - [14, 34057.0]
  - - [1024, 10496, 1, 1024, 1024, 1024, 1024, 1024]
    - [28, 31194.0]
  - - [128, 128, 1312, 64, 128, 128, 64, 64]
    - [44, 27361.0]
  - - [30528, 160, 1, 1024, 30528, 30528, 1024, 1024]
    - [14, 19568.0]
  - - [30528, 240, 1, 1024, 30528, 30528, 1024, 1024]
    - [44, 28512.0]
  - - [1024, 6144, 1, 1024, 1024, 1024, 1024, 1024]
    - [28, 30743.0]
  - - [4096, 6144, 1, 1024, 4096, 4096, 1024, 1024]
    - [14, 33061.0]
  - - [1024, 6144, 1, 4096, 1024, 1024, 4096, 4096]
    - [14, 30866.0]
  - - [512, 512, 192, 64, 512, 512, 64, 64]
    - [44, 29455.0]
  - - [1024, 10224, 1, 1024, 1024, 1024, 1024, 1024]
    - [30, 33009.0]
  - - [1024, 10192, 1, 1024, 1024, 1024, 1024, 1024]
    - [30, 33223.0]
  - - [1024, 10208, 1, 1024, 1024, 1024, 1024, 1024]
    - [30, 33180.0]
  - - [1024, 10224, 1, 4096, 1024, 1024, 4096, 4096]
    - [30, 31933.0]
  - - [4096, 10224, 1, 1024, 4096, 4096, 1024, 1024]
    - [14, 33540.0]
  - - [3072, 10224, 1, 1024, 3072, 3072, 1024, 1024]
    - [30, 33984.0]
  - - [3072, 10240, 1, 1024, 3072, 3072, 1024, 1024]
    - [30, 34345.0]
  - - [1024, 10192, 1, 4096, 1024, 1024, 4096, 4096]
    - [14, 33678.0]
  - - [4096, 10192, 1, 1024, 4096, 4096, 1024, 1024]
    - [14, 33572.0]
  - - [3072, 10192, 1, 1024, 3072, 3072, 1024, 1024]
    - [30, 34000.0]
  - - [3072, 10200, 1, 1024, 3072, 3072, 1024, 1024]
    - [30, 33988.0]
  - - [1024, 10184, 1, 1024, 1024, 1024, 1024, 1024]
    - [30, 33317.0]
  - - [3072, 10208, 1, 1024, 3072, 3072, 1024, 1024]
    - [30, 33927.0]
  - - [1024, 10208, 1, 4096, 1024, 1024, 4096, 4096]
    - [30, 33933.0]
  - - [4096, 10208, 1, 1024, 4096, 4096, 1024, 1024]
    - [14, 33584.0]
  - - [2048, 10224, 1, 1024, 2048, 2048, 1024, 1024]
    - [14, 33226.0]
  - - [2048, 10240, 1, 1024, 2048, 2048, 1024, 1024]
    - [14, 33653.0]
  - - [1024, 10120, 1, 1024, 1024, 1024, 1024, 1024]
    - [30, 33232.0]
  - - [2048, 10192, 1, 1024, 2048, 2048, 1024, 1024]
    - [14, 33194.0]
  - - [1024, 10152, 1, 1024, 1024, 1024, 1024, 1024]
    - [30, 33154.0]
  - - [3072, 10080, 1, 1024, 3072, 3072, 1024, 1024]
    - [30, 33786.0]
  - - [1024, 2048, 1, 49, 1024, 1024, 49, 49]
    - [19, 15858.0]
  - - [4608, 512, 1, 49, 4608, 4608, 49, 49]
    - [18, 17152.0]
  - - [256, 256, 25, 12544, 256, 256, 12544, 12544]
    - [5, 25258.0]
  - - [256, 256, 49, 3200, 256, 256, 3200, 3200]
    - [46, 30573.0]
  - - [256, 256, 25, 6272, 256, 256, 6272, 6272]
    - [28, 28260.0]
  - - [256, 256, 49, 6400, 256, 256, 6400, 6400]
    - [46, 26386.0]
  - - [512, 512, 49, 1152, 512, 512, 1152, 1152]
    - [23, 34266.0]
  - - [512, 512, 25, 2048, 512, 512, 2048, 2048]
    - [33, 26127.0]
  - - [512, 512, 49, 2304, 512, 512, 2304, 2304]
    - [46, 32518.0]
  - - [512, 512, 25, 4096, 512, 512, 4096, 4096]
    - [33, 25798.0]
  - - [128, 128, 2048, 64, 128, 128, 64, 64]
    - [44, 25669.0]
  - - [30528, 2560, 1, 1024, 30528, 30528, 1024, 1024]
    - [14, 34366.0]
  - - [128, 128, 1536, 64, 128, 128, 64, 64]
    - [38, 25468.0]
  - - [1024, 12288, 1, 1024, 1024, 1024, 1024, 1024]
    - [30, 33268.0]
  - - [1024, 12288, 1, 4096, 1024, 1024, 4096, 4096]
    - [14, 29765.0]
  - - [30528, 1920, 1, 1024, 30528, 30528, 1024, 1024]
    - [12, 32646.0]
  - - [4096, 12288, 1, 1024, 4096, 4096, 1024, 1024]
    - [14, 34024.0]
  - - [128, 128, 81, 12544, 128, 128, 12544, 12544]
    - [15, 17877.0]
  - - [128, 128, 121, 9216, 128, 128, 9216, 9216]
    - [31, 16850.0]
  - - [128, 128, 169, 6400, 128, 128, 6400, 6400]
    - [47, 17315.0]
  - - [256, 256, 36, 4096, 256, 256, 4096, 4096]
    - [33, 26388.0]
  - - [256, 256, 49, 2304, 256, 256, 2304, 2304]
    - [46, 30437.0]
  - - [256, 256, 64, 2304, 256, 256, 2304, 2304]
    - [30, 28056.0]
  - - [256, 256, 81, 4096, 256, 256, 4096, 4096]
    - [32, 21322.0]
  - - [256, 256, 121, 2304, 256, 256, 2304, 2304]
    - [14, 29125.0]
  - - [256, 256, 169, 2304, 256, 256, 2304, 2304]
    - [46, 28873.0]
  - - [512, 512, 81, 1024, 512, 512, 1024, 1024]
    - [46, 30751.0]
  - - [512, 512, 121, 1024, 512, 512, 1024, 1024]
    - [14, 31336.0]
  - - [512, 512, 169, 1024, 512, 512, 1024, 1024]
    - [30, 31541.0]
  - - [512, 512, 36, 1024, 512, 512, 1024, 1024]
    - [46, 33369.0]
  - - [512, 512, 49, 1024, 512, 512, 1024, 1024]
    - [46, 32860.0]
  - - [512, 512, 64, 1024, 512, 512, 1024, 1024]
    - [46, 31041.0]
  - - [128, 128, 192, 64, 128, 128, 64, 64]
    - [20, 14760.0]
  - - [768, 2048, 1, 768, 768, 768, 768, 768]
    - [44, 26283.0]
  - - [3072, 2048, 1, 768, 3072, 3072, 768, 768]
    - [28, 31105.0]
  - - [768, 2048, 1, 3072, 768, 768, 3072, 3072]
    - [28, 27112.0]
  - - [384, 384, 144, 64, 384, 384, 64, 64]
    - [5, 28478.0]
  - - [768, 4608, 1, 768, 768, 768, 768, 768]
    - [23, 33226.0]
  - - [3072, 4608, 1, 768, 3072, 3072, 768, 768]
    - [23, 34417.0]
  - - [768, 4608, 1, 3072, 768, 768, 3072, 3072]
    - [30, 33617.0]
  - - [512, 512, 48, 64, 512, 512, 64, 64]
    - [39, 26369.0]
  - - [128, 128, 256, 64, 128, 128, 64, 64]
    - [20, 18462.0]
  - - [384, 384, 192, 64, 384, 384, 64, 64]
    - [28, 29178.0]
  - - [1024, 4608, 1, 1024, 1024, 1024, 1024, 1024]
    - [30, 33158.0]
  - - [4096, 4608, 1, 1024, 4096, 4096, 1024, 1024]
    - [14, 34019.0]
  - - [1024, 4608, 1, 4096, 1024, 1024, 4096, 4096]
    - [30, 29930.0]
  - - [2880, 3072, 1, 3072, 2880, 2880, 3072, 3072]
    - [46, 32185.0]
  - - [3072, 3072, 1, 3072, 3072, 3072, 3072, 3072]
    - [14, 34394.0]
  - - [3072, 512, 1, 3072, 3072, 3072, 3072, 3072]
    - [44, 26380.0]
  - - [4096, 512, 1, 4096, 4096, 4096, 4096, 4096]
    - [14, 29797.0]
  - - [512, 3072, 1, 3072, 512, 512, 3072, 3072]
    - [28, 27188.0]
  - - [512, 4096, 1, 4096, 512, 512, 4096, 4096]
    - [14, 29849.0]
  - - [512, 8192, 1, 8192, 512, 512, 8192, 8192]
    - [30, 26176.0]
  - - [8192, 512, 1, 8192, 8192, 8192, 8192, 8192]
    - [14, 26190.0]
  - - [256, 256, 36, 432, 256, 256, 432, 432]
    - [23, 29457.0]
  - - [256, 256, 36, 456, 256, 256, 456, 456]
    - [10, 30826.0]
  - - [256, 256, 36, 504, 256, 256, 504, 504]
    - [10, 31063.0]
  - - [256, 256, 49, 1120, 256, 256, 1120, 1120]
    - [7, 30500.0]
  - - [256, 256, 36, 442, 256, 256, 442, 442]
    - [14, 30052.0]
  - - [256, 256, 49, 950, 256, 256, 950, 950]
    - [7, 30015.0]
  - - [256, 256, 64, 616, 256, 256, 616, 616]
    - [40, 29307.0]
  - - [256, 256, 64, 660, 256, 256, 660, 660]
    - [3, 29792.0]
  - - [256, 256, 36, 408, 256, 256, 408, 408]
    - [19, 30043.0]
  - - [256, 256, 49, 1008, 256, 256, 1008, 1008]
    - [19, 31029.0]
  - - [256, 256, 36, 462, 256, 256, 462, 462]
    - [46, 30464.0]
  - - [256, 256, 36, 468, 256, 256, 468, 468]
    - [40, 30234.0]
  - - [256, 256, 36, 494, 256, 256, 494, 494]
    - [7, 30574.0]
  - - [512, 512, 64, 48, 512, 512, 48, 48]
    - [29, 26248.0]
  - - [256, 256, 64, 140, 256, 256, 140, 140]
    - [38, 24325.0]
  - - [512, 512, 64, 56, 512, 512, 56, 56]
    - [18, 25698.0]
  - - [512, 512, 49, 90, 512, 512, 90, 90]
    - [28, 26674.0]
  - - [512, 512, 49, 60, 512, 512, 60, 60]
    - [22, 24926.0]
  - - [256, 256, 49, 864, 256, 256, 864, 864]
    - [7, 30060.0]
  - - [256, 256, 64, 224, 256, 256, 224, 224]
    - [5, 27471.0]
  - - [256, 256, 64, 176, 256, 256, 176, 176]
    - [21, 26805.0]
  - - [256, 256, 64, 154, 256, 256, 154, 154]
    - [5, 24448.0]
  - - [512, 512, 49, 80, 512, 512, 80, 80]
    - [5, 28403.0]
  - - [256, 256, 49, 1200, 256, 256, 1200, 1200]
    - [23, 30632.0]
  - - [256, 256, 64, 704, 256, 256, 704, 704]
    - [19, 30842.0]
  - - [256, 256, 64, 768, 256, 256, 768, 768]
    - [46, 29428.0]
  - - [256, 256, 49, 1160, 256, 256, 1160, 1160]
    - [7, 30349.0]
  - - [256, 256, 49, 320, 256, 256, 320, 320]
    - [40, 27773.0]
  - - [512, 512, 49, 70, 512, 512, 70, 70]
    - [22, 25046.0]
  - - [256, 256, 49, 1240, 256, 256, 1240, 1240]
    - [23, 30448.0]
  - - [256, 256, 36, 384, 256, 256, 384, 384]
    - [7, 30443.0]
  - - [1024, 2048, 1, 888, 1024, 1024, 888, 888]
    - [19, 30710.0]
  - - [1024, 2048, 1, 713, 1024, 1024, 713, 713]
    - [19, 30122.0]
  - - [1024, 2048, 1, 660, 1024, 1024, 660, 660]
    - [19, 30168.0]
  - - [1024, 2048, 1, 726, 1024, 1024, 726, 726]
    - [19, 30137.0]
  - - [1024, 2048, 1, 672, 1024, 1024, 672, 672]
    - [19, 30504.0]
  - - [1024, 2048, 1, 850, 1024, 1024, 850, 850]
    - [19, 30347.0]
  - - [1024, 2048, 1, 805, 1024, 1024, 805, 805]
    - [19, 30429.0]
  - - [1024, 2048, 1, 864, 1024, 1024, 864, 864]
    - [19, 31037.0]
  - - [1024, 2048, 1, 768, 1024, 1024, 768, 768]
    - [23, 29369.0]
  - - [1024, 2048, 1, 950, 1024, 1024, 950, 950]
    - [19, 30528.0]
  - - [256, 128, 49, 1152, 256, 256, 1152, 1152]
    - [5, 27233.0]
  - - [256, 128, 121, 120, 256, 256, 120, 120]
    - [39, 23142.0]
  - - [256, 128, 169, 120, 256, 256, 120, 120]
    - [28, 23973.0]
  - - [256, 128, 36, 120, 256, 256, 120, 120]
    - [1, 18336.0]
  - - [256, 128, 49, 120, 256, 256, 120, 120]
    - [35, 19191.0]
  - - [256, 128, 64, 120, 256, 256, 120, 120]
    - [5, 20361.0]
  - - [256, 128, 36, 12000, 256, 256, 12000, 12000]
    - [12, 28846.0]
  - - [256, 128, 49, 1216, 256, 256, 1216, 1216]
    - [21, 26709.0]
  - - [256, 128, 121, 18, 256, 256, 18, 18]
    - [0, 8599.0]
  - - [256, 128, 169, 18, 256, 256, 18, 18]
    - [0, 11952.0]
  - - [256, 128, 36, 18, 256, 256, 18, 18]
    - [0, 5282.0]
  - - [256, 128, 49, 18, 256, 256, 18, 18]
    - [0, 6784.0]
  - - [256, 128, 64, 18, 256, 256, 18, 18]
    - [0, 8988.0]
  - - [256, 128, 36, 1800, 256, 256, 1800, 1800]
    - [5, 28418.0]
  - - [256, 128, 121, 19, 256, 256, 19, 19]
    - [0, 10982.0]
  - - [256, 128, 169, 19, 256, 256, 19, 19]
    - [0, 12235.0]
  - - [256, 128, 36, 19, 256, 256, 19, 19]
    - [0, 5575.0]
  - - [256, 128, 49, 19, 256, 256, 19, 19]
    - [0, 7062.0]
  - - [256, 128, 64, 19, 256, 256, 19, 19]
    - [0, 9139.0]
  - - [256, 128, 36, 1900, 256, 256, 1900, 1900]
    - [21, 28472.0]
  - - [256, 128, 49, 480, 256, 256, 480, 480]
    - [38, 25690.0]
  - - [256, 128, 81, 480, 256, 256, 480, 480]
    - [5, 26754.0]
  - - [256, 128, 64, 5880, 256, 256, 5880, 5880]
    - [38, 25529.0]
  - - [256, 128, 49, 72, 256, 256, 72, 72]
    - [1, 15053.0]
  - - [256, 128, 81, 72, 256, 256, 72, 72]
    - [9, 19907.0]
  - - [256, 128, 49, 76, 256, 256, 76, 76]
    - [6, 15725.0]
  - - [256, 128, 81, 76, 256, 256, 76, 76]
    - [9, 18643.0]
  - - [256, 128, 49, 7680, 256, 256, 7680, 7680]
    - [32, 20242.0]
  - - [256, 128, 64, 882, 256, 256, 882, 882]
    - [21, 26462.0]
  - - [256, 128, 64, 931, 256, 256, 931, 931]
    - [38, 26908.0]
  - - [256, 256, 49, 1152, 256, 256, 1152, 1152]
    - [23, 30498.0]
  - - [256, 256, 36, 12000, 256, 256, 12000, 12000]
    - [23, 34221.0]
  - - [256, 256, 49, 1216, 256, 256, 1216, 1216]
    - [40, 30341.0]
  - - [256, 256, 36, 1800, 256, 256, 1800, 1800]
    - [23, 33323.0]
  - - [256, 256, 36, 1900, 256, 256, 1900, 1900]
    - [40, 33443.0]
  - - [256, 256, 64, 5880, 256, 256, 5880, 5880]
    - [23, 30725.0]
  - - [256, 256, 49, 7680, 256, 256, 7680, 7680]
    - [48, 25165.0]
  - - [256, 256, 64, 882, 256, 256, 882, 882]
    - [19, 29383.0]
  - - [256, 256, 64, 931, 256, 256, 931, 931]
    - [7, 29786.0]
  - - [512, 256, 81, 1080, 512, 512, 1080, 1080]
    - [23, 33517.0]
  - - [512, 256, 25, 12000, 512, 512, 12000, 12000]
    - [23, 32029.0]
  - - [512, 256, 81, 162, 512, 512, 162, 162]
    - [5, 28232.0]
  - - [512, 256, 81, 171, 512, 512, 171, 171]
    - [5, 29348.0]
  - - [512, 256, 25, 1800, 512, 512, 1800, 1800]
    - [7, 31168.0]
  - - [512, 256, 25, 1900, 512, 512, 1900, 1900]
    - [7, 31198.0]
  - - [512, 256, 121, 1920, 512, 512, 1920, 1920]
    - [7, 33449.0]
  - - [512, 256, 169, 1920, 512, 512, 1920, 1920]
    - [7, 34427.0]
  - - [512, 256, 49, 1920, 512, 512, 1920, 1920]
    - [21, 31772.0]
  - - [512, 256, 121, 288, 512, 512, 288, 288]
    - [21, 31423.0]
  - - [512, 256, 169, 288, 512, 512, 288, 288]
    - [12, 31654.0]
  - - [512, 256, 49, 288, 512, 512, 288, 288]
    - [12, 30066.0]
  - - [512, 256, 25, 3000, 512, 512, 3000, 3000]
    - [40, 31467.0]
  - - [512, 256, 81, 3000, 512, 512, 3000, 3000]
    - [23, 34671.0]
  - - [512, 256, 121, 304, 512, 512, 304, 304]
    - [5, 31574.0]
  - - [512, 256, 169, 304, 512, 512, 304, 304]
    - [5, 31722.0]
  - - [512, 256, 49, 304, 512, 512, 304, 304]
    - [5, 30149.0]
  - - [512, 256, 25, 450, 512, 512, 450, 450]
    - [40, 27927.0]
  - - [512, 256, 81, 450, 512, 512, 450, 450]
    - [5, 31402.0]
  - - [512, 256, 25, 475, 512, 512, 475, 475]
    - [40, 28413.0]
  - - [512, 256, 81, 475, 512, 512, 475, 475]
    - [5, 31582.0]
  - - [512, 256, 121, 480, 512, 512, 480, 480]
    - [38, 32164.0]
  - - [512, 256, 169, 480, 512, 512, 480, 480]
    - [7, 32101.0]
  - - [512, 256, 49, 5880, 512, 512, 5880, 5880]
    - [38, 32097.0]
  - - [512, 256, 121, 72, 512, 512, 72, 72]
    - [39, 24792.0]
  - - [512, 256, 169, 72, 512, 512, 72, 72]
    - [5, 26043.0]
  - - [512, 256, 121, 76, 512, 512, 76, 76]
    - [39, 26067.0]
  - - [512, 256, 169, 76, 512, 512, 76, 76]
    - [5, 26587.0]
  - - [512, 256, 49, 882, 512, 512, 882, 882]
    - [38, 31373.0]
  - - [512, 256, 49, 931, 512, 512, 931, 931]
    - [5, 31401.0]
  - - [2304, 512, 1, 100, 2304, 2304, 100, 100]
    - [18, 18375.0]
  - - [2304, 512, 1, 361, 2304, 2304, 361, 361]
    - [1, 25169.0]
  - - [4608, 510, 1, 100, 4608, 4608, 100, 100]
    - [11, 16434.0]
  - - [4608, 510, 1, 361, 4608, 4608, 361, 361]
    - [1, 25234.0]
  - - [340, 256, 49, 1152, 340, 340, 1152, 1152]
    - [21, 25824.0]
  - - [340, 256, 36, 120, 340, 340, 120, 120]
    - [39, 18468.0]
  - - [340, 256, 49, 120, 340, 340, 120, 120]
    - [22, 20023.0]
  - - [340, 256, 64, 120, 340, 340, 120, 120]
    - [12, 21181.0]
  - - [340, 256, 36, 12000, 340, 340, 12000, 12000]
    - [23, 30548.0]
  - - [340, 256, 49, 1216, 340, 340, 1216, 1216]
    - [3, 26090.0]
  - - [340, 256, 36, 18, 340, 340, 18, 18]
    - [17, 6144.0]
  - - [340, 256, 49, 18, 340, 340, 18, 18]
    - [2, 6782.0]
  - - [340, 256, 64, 18, 340, 340, 18, 18]
    - [24, 7483.0]
  - - [340, 256, 36, 1800, 340, 340, 1800, 1800]
    - [40, 29614.0]
  - - [340, 256, 36, 19, 340, 340, 19, 19]
    - [17, 6571.0]
  - - [340, 256, 49, 19, 340, 340, 19, 19]
    - [34, 7184.0]
  - - [340, 256, 64, 19, 340, 340, 19, 19]
    - [34, 7680.0]
  - - [340, 256, 36, 1900, 340, 340, 1900, 1900]
    - [40, 29661.0]
  - - [340, 256, 64, 5880, 340, 340, 5880, 5880]
    - [5, 27846.0]
  - - [340, 256, 49, 7680, 340, 340, 7680, 7680]
    - [46, 21092.0]
  - - [340, 256, 64, 882, 340, 340, 882, 882]
    - [5, 26913.0]
  - - [340, 256, 64, 931, 340, 340, 931, 931]
    - [21, 27062.0]
  - - [510, 256, 49, 120, 510, 510, 120, 120]
    - [39, 19269.0]
  - - [510, 256, 64, 120, 510, 510, 120, 120]
    - [4, 19911.0]
  - - [510, 256, 49, 18, 510, 510, 18, 18]
    - [0, 5258.0]
  - - [510, 256, 64, 18, 510, 510, 18, 18]
    - [8, 5530.0]
  - - [510, 256, 49, 19, 510, 510, 19, 19]
    - [0, 5566.0]
  - - [510, 256, 64, 19, 510, 510, 19, 19]
    - [0, 5854.0]
  - - [510, 256, 36, 480, 510, 510, 480, 480]
    - [5, 29858.0]
  - - [510, 256, 36, 72, 510, 510, 72, 72]
    - [11, 14388.0]
  - - [510, 256, 36, 76, 510, 510, 76, 76]
    - [4, 15022.0]
  - - [510, 512, 36, 1080, 510, 510, 1080, 1080]
    - [23, 33267.0]
  - - [510, 512, 36, 162, 510, 510, 162, 162]
    - [39, 24802.0]
  - - [510, 512, 36, 171, 510, 510, 171, 171]
    - [29, 25394.0]
  - - [510, 512, 49, 1920, 510, 510, 1920, 1920]
    - [40, 33896.0]
  - - [510, 512, 64, 1920, 510, 510, 1920, 1920]
    - [23, 32824.0]
  - - [510, 512, 49, 288, 510, 510, 288, 288]
    - [21, 29968.0]
  - - [510, 512, 64, 288, 510, 510, 288, 288]
    - [38, 30597.0]
  - - [510, 512, 36, 3000, 510, 510, 3000, 3000]
    - [40, 34277.0]
  - - [510, 512, 49, 304, 510, 510, 304, 304]
    - [38, 30317.0]
  - - [510, 512, 64, 304, 510, 510, 304, 304]
    - [40, 30899.0]
  - - [510, 512, 36, 450, 510, 510, 450, 450]
    - [23, 30428.0]
  - - [510, 512, 36, 475, 510, 510, 475, 475]
    - [40, 30676.0]
  - - [510, 512, 49, 480, 510, 510, 480, 480]
    - [40, 31762.0]
  - - [510, 512, 64, 480, 510, 510, 480, 480]
    - [21, 31396.0]
  - - [510, 512, 49, 72, 510, 510, 72, 72]
    - [29, 19542.0]
  - - [510, 512, 64, 72, 510, 510, 72, 72]
    - [45, 20456.0]
  - - [510, 512, 49, 76, 510, 510, 76, 76]
    - [22, 20301.0]
  - - [510, 512, 64, 76, 510, 510, 76, 76]
    - [39, 20767.0]
  - - [1024, 1024, 160, 96, 1024, 1024, 96, 96]
    - [28, 27209.0]
  - - [2880, 16384, 1, 1920, 2880, 2880, 1920, 1920]
    - [19, 34015.0]
  - - [1920, 16384, 1, 960, 1920, 1920, 960, 960]
    - [19, 35298.0]
  - - [3840, 16384, 1, 1920, 3840, 3840, 1920, 1920]
    - [19, 35523.0]
  - - [1920, 16384, 1, 3840, 1920, 1920, 3840, 3840]
    - [40, 34782.0]
  - - [25216, 16384, 1, 1920, 25216, 25216, 1920, 1920]
    - [26, 35275.0]
  - - [1024, 1024, 40, 96, 1024, 1024, 96, 96]
    - [23, 30883.0]
  - - [2880, 4096, 1, 1920, 2880, 2880, 1920, 1920]
    - [19, 33511.0]
  - - [1920, 4096, 1, 960, 1920, 1920, 960, 960]
    - [19, 34888.0]
  - - [3840, 4096, 1, 1920, 3840, 3840, 1920, 1920]
    - [3, 35002.0]
  - - [1920, 4096, 1, 3840, 1920, 1920, 3840, 3840]
    - [23, 32224.0]
  - - [25216, 4096, 1, 1920, 25216, 25216, 1920, 1920]
    - [26, 35143.0]
  - - [1024, 1024, 80, 96, 1024, 1024, 96, 96]
    - [1, 27436.0]
  - - [2880, 8192, 1, 1920, 2880, 2880, 1920, 1920]
    - [19, 34819.0]
  - - [1920, 8192, 1, 960, 1920, 1920, 960, 960]
    - [19, 35466.0]
  - - [3840, 8192, 1, 1920, 3840, 3840, 1920, 1920]
    - [19, 36390.0]
  - - [1920, 8192, 1, 3840, 1920, 1920, 3840, 3840]
    - [23, 33685.0]
  - - [25216, 8192, 1, 1920, 25216, 25216, 1920, 1920]
    - [26, 35239.0]
  - - [1024, 1024, 96, 96, 1024, 1024, 96, 96]
    - [5, 26996.0]
  - - [1728, 16384, 1, 2304, 1728, 1728, 2304, 2304]
    - [23, 33414.0]
  - - [2304, 16384, 1, 576, 2304, 2304, 576, 576]
    - [19, 37000.0]
  - - [2304, 16384, 1, 2304, 2304, 2304, 2304, 2304]
    - [23, 35288.0]
  - - [12672, 16384, 1, 2304, 12672, 12672, 2304, 2304]
    - [23, 35168.0]
  - - [1024, 1024, 24, 96, 1024, 1024, 96, 96]
    - [36, 30343.0]
  - - [1728, 4096, 1, 2304, 1728, 1728, 2304, 2304]
    - [44, 29990.0]
  - - [2304, 4096, 1, 576, 2304, 2304, 576, 576]
    - [19, 36171.0]
  - - [2304, 4096, 1, 2304, 2304, 2304, 2304, 2304]
    - [23, 35021.0]
  - - [12672, 4096, 1, 2304, 12672, 12672, 2304, 2304]
    - [23, 34669.0]
  - - [1024, 1024, 48, 96, 1024, 1024, 96, 96]
    - [23, 31181.0]
  - - [1728, 8192, 1, 2304, 1728, 1728, 2304, 2304]
    - [46, 32229.0]
  - - [2304, 8192, 1, 576, 2304, 2304, 576, 576]
    - [19, 36743.0]
  - - [2304, 8192, 1, 2304, 2304, 2304, 2304, 2304]
    - [23, 35272.0]
  - - [12672, 8192, 1, 2304, 12672, 12672, 2304, 2304]
    - [23, 35047.0]
  - - [1024, 1024, 16, 96, 1024, 1024, 96, 96]
    - [35, 29104.0]
  - - [1152, 4096, 1, 3072, 1152, 1152, 3072, 3072]
    - [46, 34045.0]
  - - [3072, 4096, 1, 384, 3072, 3072, 384, 384]
    - [19, 33434.0]
  - - [1536, 4096, 1, 3072, 1536, 1536, 3072, 3072]
    - [30, 30908.0]
  - - [3072, 4096, 1, 1536, 3072, 3072, 1536, 1536]
    - [30, 33567.0]
  - - [6400, 4096, 1, 3072, 6400, 6400, 3072, 3072]
    - [14, 33772.0]
  - - [1024, 1024, 32, 96, 1024, 1024, 96, 96]
    - [40, 31189.0]
  - - [1152, 8192, 1, 3072, 1152, 1152, 3072, 3072]
    - [30, 34675.0]
  - - [3072, 8192, 1, 384, 3072, 3072, 384, 384]
    - [19, 33646.0]
  - - [1536, 8192, 1, 3072, 1536, 1536, 3072, 3072]
    - [30, 33855.0]
  - - [3072, 8192, 1, 1536, 3072, 3072, 1536, 1536]
    - [30, 33523.0]
  - - [6400, 8192, 1, 3072, 6400, 6400, 3072, 3072]
    - [14, 34591.0]
  - - [2048, 4096, 1, 2048, 2048, 2048, 2048, 2048]
    - [14, 29705.0]
  - - [2048, 4096, 1, 4096, 2048, 2048, 4096, 4096]
    - [14, 29742.0]
  - - [29000, 199, 1, 2048, 29000, 29000, 2048, 2048]
    - [28, 23831.0]
  - - [29000, 221, 1, 2048, 29000, 29000, 2048, 2048]
    - [44, 26099.0]
  - - [29000, 224, 1, 2048, 29000, 29000, 2048, 2048]
    - [12, 26272.0]
  - - [29000, 229, 1, 2048, 29000, 29000, 2048, 2048]
    - [44, 27039.0]
  - - [29000, 234, 1, 2048, 29000, 29000, 2048, 2048]
    - [44, 27259.0]
  - - [29000, 242, 1, 2048, 29000, 29000, 2048, 2048]
    - [12, 28409.0]
  - - [29000, 246, 1, 2048, 29000, 29000, 2048, 2048]
    - [30, 28604.0]
  - - [29000, 247, 1, 2048, 29000, 29000, 2048, 2048]
    - [46, 28713.0]
  - - [29000, 256, 1, 2048, 29000, 29000, 2048, 2048]
    - [46, 30576.0]
  - - [29000, 262, 1, 2048, 29000, 29000, 2048, 2048]
    - [12, 21397.0]
  - - [29000, 264, 1, 2048, 29000, 29000, 2048, 2048]
    - [12, 21382.0]
  - - [29000, 265, 1, 2048, 29000, 29000, 2048, 2048]
    - [12, 21457.0]
  - - [29000, 274, 1, 2048, 29000, 29000, 2048, 2048]
    - [12, 21747.0]
  - - [29000, 277, 1, 2048, 29000, 29000, 2048, 2048]
    - [12, 22067.0]
  - - [29000, 279, 1, 2048, 29000, 29000, 2048, 2048]
    - [12, 22148.0]
  - - [29000, 288, 1, 2048, 29000, 29000, 2048, 2048]
    - [12, 22845.0]
  - - [29000, 296, 1, 2048, 29000, 29000, 2048, 2048]
    - [12, 23419.0]
  - - [29000, 315, 1, 2048, 29000, 29000, 2048, 2048]
    - [12, 25542.0]
  - - [29000, 335, 1, 2048, 29000, 29000, 2048, 2048]
    - [12, 26676.0]
  - - [4096, 4096, 1, 2048, 4096, 4096, 2048, 2048]
    - [14, 32537.0]
  - - [29000, 2283, 1, 1024, 29000, 29000, 1024, 1024]
    - [14, 33813.0]
  - - [29000, 2296, 1, 1024, 29000, 29000, 1024, 1024]
    - [14, 33988.0]
  - - [29000, 2306, 1, 1024, 29000, 29000, 1024, 1024]
    - [28, 31104.0]
  - - [29000, 2309, 1, 1024, 29000, 29000, 1024, 1024]
    - [28, 31124.0]
  - - [29000, 2318, 1, 1024, 29000, 29000, 1024, 1024]
    - [28, 31279.0]
  - - [29000, 2320, 1, 1024, 29000, 29000, 1024, 1024]
    - [28, 31288.0]
  - - [29000, 2324, 1, 1024, 29000, 29000, 1024, 1024]
    - [28, 31351.0]
  - - [29000, 2325, 1, 1024, 29000, 29000, 1024, 1024]
    - [28, 31307.0]
  - - [29000, 2329, 1, 1024, 29000, 29000, 1024, 1024]
    - [28, 31398.0]
  - - [29000, 2338, 1, 1024, 29000, 29000, 1024, 1024]
    - [28, 31537.0]
  - - [29000, 2345, 1, 1024, 29000, 29000, 1024, 1024]
    - [28, 31599.0]
  - - [29000, 2350, 1, 1024, 29000, 29000, 1024, 1024]
    - [28, 31671.0]
  - - [29000, 2362, 1, 1024, 29000, 29000, 1024, 1024]
    - [28, 31821.0]
  - - [29000, 2366, 1, 1024, 29000, 29000, 1024, 1024]
    - [28, 31903.0]
  - - [29000, 2368, 1, 1024, 29000, 29000, 1024, 1024]
    - [28, 31918.0]
  - - [29000, 2374, 1, 1024, 29000, 29000, 1024, 1024]
    - [28, 31979.0]
  - - [29000, 2390, 1, 1024, 29000, 29000, 1024, 1024]
    - [28, 32179.0]
  - - [512, 512, 320, 64, 512, 512, 64, 64]
    - [1, 20593.0]
  - - [29000, 561, 1, 1024, 29000, 29000, 1024, 1024]
    - [28, 28067.0]
  - - [29000, 574, 1, 1024, 29000, 29000, 1024, 1024]
    - [44, 28766.0]
  - - [29000, 600, 1, 1024, 29000, 29000, 1024, 1024]
    - [28, 30060.0]
  - - [29000, 608, 1, 1024, 29000, 29000, 1024, 1024]
    - [28, 30259.0]
  - - [29000, 615, 1, 1024, 29000, 29000, 1024, 1024]
    - [44, 30665.0]
  - - [29000, 622, 1, 1024, 29000, 29000, 1024, 1024]
    - [44, 31046.0]
  - - [29000, 625, 1, 1024, 29000, 29000, 1024, 1024]
    - [44, 31149.0]
  - - [29000, 626, 1, 1024, 29000, 29000, 1024, 1024]
    - [44, 31181.0]
  - - [29000, 628, 1, 1024, 29000, 29000, 1024, 1024]
    - [44, 31216.0]
  - - [29000, 636, 1, 1024, 29000, 29000, 1024, 1024]
    - [28, 31618.0]
  - - [29000, 651, 1, 1024, 29000, 29000, 1024, 1024]
    - [14, 28463.0]
  - - [29000, 658, 1, 1024, 29000, 29000, 1024, 1024]
    - [14, 28645.0]
  - - [29000, 669, 1, 1024, 29000, 29000, 1024, 1024]
    - [46, 29217.0]
  - - [29000, 670, 1, 1024, 29000, 29000, 1024, 1024]
    - [14, 29232.0]
  - - [29000, 672, 1, 1024, 29000, 29000, 1024, 1024]
    - [14, 29320.0]
  - - [29000, 684, 1, 1024, 29000, 29000, 1024, 1024]
    - [14, 29847.0]
  - - [29000, 716, 1, 1024, 29000, 29000, 1024, 1024]
    - [14, 31016.0]
  - - [29000, 730, 1, 1024, 29000, 29000, 1024, 1024]
    - [14, 31579.0]
  - - [2560, 1024, 1, 2560, 2560, 2560, 2560, 2560]
    - [29, 25314.0]
  - - [2560, 1024, 1, 4096, 2560, 2560, 4096, 4096]
    - [44, 23243.0]
  - - [4096, 1024, 1, 2560, 4096, 4096, 2560, 2560]
    - [30, 29022.0]
  - - [1024, 1024, 512, 64, 1024, 1024, 64, 64]
    - [12, 22616.0]
  - - [1024, 32768, 1, 4096, 1024, 1024, 4096, 4096]
    - [14, 32198.0]
  - - [3072, 32768, 1, 1024, 3072, 3072, 1024, 1024]
    - [14, 34185.0]
  - - [4096, 32768, 1, 1024, 4096, 4096, 1024, 1024]
    - [14, 34064.0]
  - - [50304, 32768, 1, 1024, 50304, 50304, 1024, 1024]
    - [14, 34730.0]
  - - [1024, 1024, 24, 128, 1024, 1024, 128, 128]
    - [23, 31093.0]
  - - [128, 1024, 24, 1024, 128, 128, 1024, 1024]
    - [14, 28276.0]
  - - [128, 128, 49, 12800, 128, 128, 12800, 12800]
    - [51, 18288.0]
  - - [128, 128, 25, 25088, 128, 128, 25088, 25088]
    - [50, 19507.0]
  - - [128, 128, 49, 25600, 128, 128, 25600, 25600]
    - [51, 17636.0]
  - - [128, 128, 25, 50176, 128, 128, 50176, 50176]
    - [52, 17612.0]
  - - [128, 128, 36, 12544, 128, 128, 12544, 12544]
    - [50, 21099.0]
  - - [128, 128, 49, 9216, 128, 128, 9216, 9216]
    - [51, 17229.0]
  - - [1024, 1024, 1, 12544, 1024, 1024, 12544, 12544]
    - [49, 29030.0]
  - - [1024, 1000, 1, 12544, 1024, 1024, 12544, 12544]
    - [49, 27901.0]
  - - [128, 128, 36, 12000, 128, 128, 12000, 12000]
    - [6, 24847.0]
  - - [5888, 128, 1, 1, 5888, 5888, 1, 1]
    - [54, 265.0]
  - - [1856, 256, 1, 1, 1856, 1856, 1, 1]
    - [53, 222.0]
  - - [256, 1856, 1, 32, 256, 256, 32, 32]
    - [68, 3763.0]
  - - [128, 3584, 1, 1280, 128, 128, 1280, 1280]
    - [65, 18202.0]
  - - [2944, 128, 1, 32, 2944, 2944, 32, 32]
    - [53, 4102.0]
  - - [64, 6784, 1, 1, 64, 64, 1, 1]
    - [68, 187.0]
  - - [64, 5056, 1, 3328, 64, 64, 3328, 3328]
    - [63, 12616.0]
  - - [704, 1024, 1, 1, 704, 704, 1, 1]
    - [53, 311.0]
  - - [256, 1856, 1, 1280, 256, 256, 1280, 1280]
    - [85, 18542.0]
  - - [256, 1408, 1, 1, 256, 256, 1, 1]
    - [57, 167.0]
  - - [1024, 1024, 1, 1280, 1024, 1024, 1280, 1280]
    - [85, 24122.0]
  - - [704, 1408, 1, 3328, 704, 704, 3328, 3328]
    - [65, 23228.0]
  - - [1408, 704, 1, 256, 1408, 1408, 256, 256]
    - [91, 18937.0]
  - - [6784, 128, 1, 3328, 6784, 6784, 3328, 3328]
    - [91, 20481.0]
  - - [2944, 256, 1, 1, 2944, 2944, 1, 1]
    - [53, 333.0]
  - - [2944, 256, 1, 32, 2944, 2944, 32, 32]
    - [53, 7537.0]
  - - [128, 4288, 1, 3328, 128, 128, 3328, 3328]
    - [73, 23157.0]
  - - [5056, 128, 1, 256, 5056, 5056, 256, 256]
    - [63, 14382.0]
  - - [1856, 704, 1, 1280, 1856, 1856, 1280, 1280]
    - [76, 20922.0]
  - - [2368, 256, 1, 32, 2368, 2368, 32, 32]
    - [53, 6139.0]
  - - [5056, 64, 1, 32, 5056, 5056, 32, 32]
    - [68, 3452.0]
  - - [64, 6784, 1, 3328, 64, 64, 3328, 3328]
    - [63, 15346.0]
  - - [2944, 256, 1, 1280, 2944, 2944, 1280, 1280]
    - [84, 19639.0]
  - - [1024, 1024, 1, 3328, 1024, 1024, 3328, 3328]
    - [73, 24799.0]
  - - [5888, 64, 1, 256, 5888, 5888, 256, 256]
    - [63, 11217.0]
  - - [2944, 448, 1, 256, 2944, 2944, 256, 256]
    - [90, 18634.0]
  - - [5056, 64, 1, 3328, 5056, 5056, 3328, 3328]
    - [63, 12872.0]
  - - [1024, 448, 1, 32, 1024, 1024, 32, 32]
    - [80, 4861.0]
  - - [128, 2944, 1, 3328, 128, 128, 3328, 3328]
    - [91, 16017.0]
  - - [256, 1856, 1, 1, 256, 256, 1, 1]
    - [56, 212.0]
  - - [256, 3584, 1, 3328, 256, 256, 3328, 3328]
    - [58, 21745.0]
  - - [256, 4288, 1, 1280, 256, 256, 1280, 1280]
    - [85, 24539.0]
  - - [4288, 256, 1, 256, 4288, 4288, 256, 256]
    - [65, 20305.0]
  - - [128, 5888, 1, 32, 128, 128, 32, 32]
    - [55, 6662.0]
  - - [128, 5888, 1, 1280, 128, 128, 1280, 1280]
    - [64, 19671.0]
  - - [3584, 256, 1, 256, 3584, 3584, 256, 256]
    - [77, 18321.0]
  - - [1856, 256, 1, 256, 1856, 1856, 256, 256]
    - [63, 13136.0]
  - - [1024, 704, 1, 1, 1024, 1024, 1, 1]
    - [80, 303.0]
  - - [448, 1408, 1, 3328, 448, 448, 3328, 3328]
    - [64, 16805.0]
  - - [1024, 704, 1, 32, 1024, 1024, 32, 32]
    - [80, 7120.0]
  - - [448, 2944, 1, 256, 448, 448, 256, 256]
    - [89, 18075.0]
  - - [5888, 128, 1, 3328, 5888, 5888, 3328, 3328]
    - [90, 20005.0]
  - - [2944, 448, 1, 1, 2944, 2944, 1, 1]
    - [53, 500.0]
  - - [5056, 64, 1, 1280, 5056, 5056, 1280, 1280]
    - [63, 12312.0]
  - - [704, 704, 1, 32, 704, 704, 32, 32]
    - [53, 5287.0]
  - - [256, 4288, 1, 256, 256, 256, 256, 256]
    - [84, 19874.0]
  - - [5056, 128, 1, 1, 5056, 5056, 1, 1]
    - [53, 279.0]
  - - [704, 448, 1, 1280, 704, 704, 1280, 1280]
    - [73, 12406.0]
  - - [1024, 704, 1, 1280, 1024, 1024, 1280, 1280]
    - [84, 18816.0]
  - - [2368, 448, 1, 256, 2368, 2368, 256, 256]
    - [76, 17408.0]
  - - [4288, 256, 1, 3328, 4288, 4288, 3328, 3328]
    - [58, 25597.0]
  - - [128, 6784, 1, 32, 128, 128, 32, 32]
    - [82, 7312.0]
  - - [128, 6784, 1, 3328, 128, 128, 3328, 3328]
    - [85, 20557.0]
  - - [4288, 128, 1, 1, 4288, 4288, 1, 1]
    - [53, 254.0]
  - - [256, 2368, 1, 32, 256, 256, 32, 32]
    - [53, 5808.0]
  - - [448, 1024, 1, 256, 448, 448, 256, 256]
    - [63, 12821.0]
  - - [256, 1408, 1, 32, 256, 256, 32, 32]
    - [53, 3819.0]
  - - [256, 3584, 1, 32, 256, 256, 32, 32]
    - [82, 8066.0]
  - - [128, 4288, 1, 32, 128, 128, 32, 32]
    - [53, 5489.0]
  - - [448, 1856, 1, 1, 448, 448, 1, 1]
    - [53, 355.0]
  - - [448, 1856, 1, 32, 448, 448, 32, 32]
    - [53, 8263.0]
  - - [448, 1856, 1, 3328, 448, 448, 3328, 3328]
    - [63, 19485.0]
  - - [1024, 448, 1, 256, 1024, 1024, 256, 256]
    - [76, 13346.0]
  - - [704, 1856, 1, 32, 704, 704, 32, 32]
    - [53, 11424.0]
  - - [704, 1408, 1, 32, 704, 704, 32, 32]
    - [53, 9384.0]
  - - [5888, 128, 1, 32, 5888, 5888, 32, 32]
    - [53, 7221.0]
  - - [128, 4288, 1, 1280, 128, 128, 1280, 1280]
    - [65, 21251.0]
  - - [1856, 704, 1, 3328, 1856, 1856, 3328, 3328]
    - [90, 21398.0]
  - - [4288, 128, 1, 256, 4288, 4288, 256, 256]
    - [63, 15141.0]
  - - [704, 1856, 1, 3328, 704, 704, 3328, 3328]
    - [64, 21312.0]
  - - [2944, 128, 1, 1280, 2944, 2944, 1280, 1280]
    - [91, 15235.0]
  - - [1408, 448, 1, 1280, 1408, 1408, 1280, 1280]
    - [76, 16384.0]
  - - [128, 2368, 1, 1, 128, 128, 1, 1]
    - [53, 146.0]
  - - [128, 2944, 1, 1280, 128, 128, 1280, 1280]
    - [65, 15245.0]
  - - [1024, 448, 1, 1, 1024, 1024, 1, 1]
    - [87, 214.0]
  - - [256, 2944, 1, 256, 256, 256, 256, 256]
    - [64, 17135.0]
  - - [704, 448, 1, 32, 704, 704, 32, 32]
    - [53, 3504.0]
  - - [704, 1024, 1, 256, 704, 704, 256, 256]
    - [75, 15800.0]
  - - [1408, 448, 1, 3328, 1408, 1408, 3328, 3328]
    - [64, 16805.0]
  - - [256, 2368, 1, 1, 256, 256, 1, 1]
    - [81, 253.0]
  - - [5888, 64, 1, 3328, 5888, 5888, 3328, 3328]
    - [75, 14841.0]
  - - [704, 448, 1, 3328, 704, 704, 3328, 3328]
    - [85, 13582.0]
  - - [4288, 256, 1, 1, 4288, 4288, 1, 1]
    - [61, 432.0]
  - - [1856, 448, 1, 3328, 1856, 1856, 3328, 3328]
    - [76, 21792.0]
  - - [4288, 256, 1, 1280, 4288, 4288, 1280, 1280]
    - [85, 24547.0]
  - - [448, 2368, 1, 1280, 448, 448, 1280, 1280]
    - [63, 18561.0]
  - - [3584, 256, 1, 1, 3584, 3584, 1, 1]
    - [53, 340.0]
  - - [2368, 448, 1, 32, 2368, 2368, 32, 32]
    - [53, 9926.0]
  - - [1408, 704, 1, 1, 1408, 1408, 1, 1]
    - [61, 396.0]
  - - [2368, 256, 1, 256, 2368, 2368, 256, 256]
    - [83, 13424.0]
  - - [1856, 256, 1, 1280, 1856, 1856, 1280, 1280]
    - [85, 18542.0]
  - - [256, 2944, 1, 1, 256, 256, 1, 1]
    - [62, 297.0]
  - - [6784, 64, 1, 1, 6784, 6784, 1, 1]
    - [56, 209.0]
  - - [6784, 64, 1, 256, 6784, 6784, 256, 256]
    - [64, 12631.0]
  - - [448, 2368, 1, 256, 448, 448, 256, 256]
    - [63, 17189.0]
  - - [128, 2368, 1, 3328, 128, 128, 3328, 3328]
    - [91, 12992.0]
  - - [64, 5056, 1, 256, 64, 64, 256, 256]
    - [63, 9610.0]
  - - [2368, 448, 1, 3328, 2368, 2368, 3328, 3328]
    - [76, 21248.0]
  - - [256, 2368, 1, 3328, 256, 256, 3328, 3328]
    - [76, 16288.0]
  - - [5888, 64, 1, 1, 5888, 5888, 1, 1]
    - [53, 185.0]
  - - [256, 3584, 1, 1, 256, 256, 1, 1]
    - [88, 332.0]
  - - [704, 1856, 1, 1280, 704, 704, 1280, 1280]
    - [76, 21059.0]
  - - [448, 1024, 1, 3328, 448, 448, 3328, 3328]
    - [73, 19603.0]
  - - [128, 5056, 1, 32, 128, 128, 32, 32]
    - [53, 6127.0]
  - - [128, 5056, 1, 1280, 128, 128, 1280, 1280]
    - [64, 16961.0]
  - - [5888, 64, 1, 32, 5888, 5888, 32, 32]
    - [53, 4047.0]
  - - [2368, 256, 1, 1, 2368, 2368, 1, 1]
    - [53, 281.0]
  - - [5888, 64, 1, 1280, 5888, 5888, 1280, 1280]
    - [75, 14112.0]
  - - [256, 1408, 1, 256, 256, 256, 256, 256]
    - [63, 10780.0]
  - - [5056, 64, 1, 1, 5056, 5056, 1, 1]
    - [53, 160.0]
  - - [1408, 448, 1, 32, 1408, 1408, 32, 32]
    - [53, 6554.0]
  - - [5056, 128, 1, 1280, 5056, 5056, 1280, 1280]
    - [64, 16541.0]
  - - [1856, 704, 1, 256, 1856, 1856, 256, 256]
    - [76, 18359.0]
  - - [128, 6784, 1, 256, 128, 128, 256, 256]
    - [65, 17449.0]
  - - [256, 3584, 1, 256, 256, 256, 256, 256]
    - [73, 18612.0]
  - - [448, 704, 1, 1, 448, 448, 1, 1]
    - [53, 153.0]
  - - [448, 704, 1, 32, 448, 448, 32, 32]
    - [53, 3480.0]
  - - [448, 704, 1, 3328, 448, 448, 3328, 3328]
    - [73, 13586.0]
  - - [64, 5888, 1, 1, 64, 64, 1, 1]
    - [56, 170.0]
  - - [2368, 128, 1, 32, 2368, 2368, 32, 32]
    - [53, 3391.0]
  - - [2368, 256, 1, 1280, 2368, 2368, 1280, 1280]
    - [83, 15550.0]
  - - [2368, 128, 1, 3328, 2368, 2368, 3328, 3328]
    - [73, 13066.0]
  - - [4288, 256, 1, 32, 4288, 4288, 32, 32]
    - [53, 10094.0]
  - - [448, 1408, 1, 1, 448, 448, 1, 1]
    - [53, 282.0]
  - - [1408, 256, 1, 256, 1408, 1408, 256, 256]
    - [63, 10856.0]
  - - [256, 4288, 1, 32, 256, 256, 32, 32]
    - [53, 9100.0]
  - - [1408, 256, 1, 1280, 1408, 1408, 1280, 1280]
    - [91, 14665.0]
  - - [448, 1408, 1, 256, 448, 448, 256, 256]
    - [63, 14066.0]
  - - [128, 2944, 1, 32, 128, 128, 32, 32]
    - [53, 4020.0]
  - - [1856, 448, 1, 1, 1856, 1856, 1, 1]
    - [53, 362.0]
  - - [704, 704, 1, 1, 704, 704, 1, 1]
    - [53, 225.0]
  - - [1856, 448, 1, 1280, 1856, 1856, 1280, 1280]
    - [76, 20852.0]
  - - [128, 5888, 1, 256, 128, 128, 256, 256]
    - [76, 17044.0]
  - - [3584, 256, 1, 3328, 3584, 3584, 3328, 3328]
    - [73, 21671.0]
  - - [448, 2368, 1, 1, 448, 448, 1, 1]
    - [53, 424.0]
  - - [128, 6784, 1, 1, 128, 128, 1, 1]
    - [58, 331.0]
  - - [256, 2944, 1, 3328, 256, 256, 3328, 3328]
    - [76, 20107.0]
  - - [64, 5888, 1, 256, 64, 64, 256, 256]
    - [63, 11191.0]
  - - [704, 704, 1, 256, 704, 704, 256, 256]
    - [63, 13702.0]
  - - [448, 1024, 1, 32, 448, 448, 32, 32]
    - [53, 5027.0]
  - - [256, 2368, 1, 256, 256, 256, 256, 256]
    - [76, 13931.0]
  - - [448, 704, 1, 1280, 448, 448, 1280, 1280]
    - [73, 12391.0]
  - - [704, 1856, 1, 1, 704, 704, 1, 1]
    - [61, 484.0]
  - - [704, 448, 1, 256, 704, 704, 256, 256]
    - [63, 9589.0]
  - - [2368, 448, 1, 1280, 2368, 2368, 1280, 1280]
    - [76, 20568.0]
  - - [128, 5056, 1, 1, 128, 128, 1, 1]
    - [80, 267.0]
  - - [256, 2368, 1, 1280, 256, 256, 1280, 1280]
    - [57, 15933.0]
  - - [64, 6784, 1, 256, 64, 64, 256, 256]
    - [63, 11952.0]
  - - [128, 3584, 1, 256, 128, 128, 256, 256]
    - [64, 13437.0]
  - - [704, 1408, 1, 1, 704, 704, 1, 1]
    - [80, 387.0]
  - - [4288, 128, 1, 3328, 4288, 4288, 3328, 3328]
    - [91, 22861.0]
  - - [128, 6784, 1, 1280, 128, 128, 1280, 1280]
    - [65, 20099.0]
  - - [3584, 256, 1, 32, 3584, 3584, 32, 32]
    - [54, 7935.0]
  - - [1408, 256, 1, 32, 1408, 1408, 32, 32]
    - [53, 3950.0]
  - - [5888, 128, 1, 256, 5888, 5888, 256, 256]
    - [84, 16575.0]
  - - [128, 5056, 1, 3328, 128, 128, 3328, 3328]
    - [57, 17358.0]
  - - [1024, 448, 1, 3328, 1024, 1024, 3328, 3328]
    - [58, 19399.0]
  - - [3584, 128, 1, 1, 3584, 3584, 1, 1]
    - [53, 207.0]
  - - [128, 2368, 1, 256, 128, 128, 256, 256]
    - [63, 9086.0]
  - - [448, 1856, 1, 256, 448, 448, 256, 256]
    - [63, 17194.0]
  - - [3584, 128, 1, 256, 3584, 3584, 256, 256]
    - [64, 13315.0]
  - - [1024, 448, 1, 1280, 1024, 1024, 1280, 1280]
    - [85, 17772.0]
  - - [128, 5888, 1, 1, 128, 128, 1, 1]
    - [56, 292.0]
  - - [64, 5056, 1, 1, 64, 64, 1, 1]
    - [53, 151.0]
  - - [1856, 256, 1, 32, 1856, 1856, 32, 32]
    - [53, 5172.0]
  - - [64, 5056, 1, 32, 64, 64, 32, 32]
    - [53, 3384.0]
  - - [1408, 704, 1, 32, 1408, 1408, 32, 32]
    - [53, 9497.0]
  - - [1408, 704, 1, 1280, 1408, 1408, 1280, 1280]
    - [85, 22520.0]
  - - [1024, 1024, 1, 32, 1024, 1024, 32, 32]
    - [80, 9811.0]
  - - [5056, 128, 1, 3328, 5056, 5056, 3328, 3328]
    - [64, 17178.0]
  - - [128, 4288, 1, 1, 128, 128, 1, 1]
    - [53, 235.0]
  - - [2944, 128, 1, 3328, 2944, 2944, 3328, 3328]
    - [65, 16074.0]
  - - [5888, 128, 1, 1280, 5888, 5888, 1280, 1280]
    - [90, 19528.0]
  - - [2944, 128, 1, 256, 2944, 2944, 256, 256]
    - [63, 11270.0]
  - - [6784, 128, 1, 1, 6784, 6784, 1, 1]
    - [53, 371.0]
  - - [1408, 256, 1, 3328, 1408, 1408, 3328, 3328]
    - [77, 15363.0]
  - - [2944, 256, 1, 256, 2944, 2944, 256, 256]
    - [76, 16806.0]
  - - [6784, 128, 1, 256, 6784, 6784, 256, 256]
    - [65, 17504.0]
  - - [6784, 64, 1, 1280, 6784, 6784, 1280, 1280]
    - [64, 15979.0]
  - - [2944, 448, 1, 1280, 2944, 2944, 1280, 1280]
    - [90, 21124.0]
  - - [704, 448, 1, 1, 704, 704, 1, 1]
    - [53, 153.0]
  - - [256, 1408, 1, 3328, 256, 256, 3328, 3328]
    - [73, 15371.0]
  - - [2944, 128, 1, 1, 2944, 2944, 1, 1]
    - [53, 185.0]
  - - [704, 1024, 1, 32, 704, 704, 32, 32]
    - [53, 7209.0]
  - - [3584, 256, 1, 1280, 3584, 3584, 1280, 1280]
    - [85, 21145.0]
  - - [3584, 128, 1, 1280, 3584, 3584, 1280, 1280]
    - [77, 18304.0]
  - - [256, 1856, 1, 256, 256, 256, 256, 256]
    - [64, 13981.0]
  - - [256, 2944, 1, 1280, 256, 256, 1280, 1280]
    - [72, 19647.0]
  - - [2944, 256, 1, 3328, 2944, 2944, 3328, 3328]
    - [76, 20005.0]
  - - [704, 1024, 1, 3328, 704, 704, 3328, 3328]
    - [76, 19120.0]
  - - [448, 2944, 1, 1, 448, 448, 1, 1]
    - [53, 496.0]
  - - [448, 1856, 1, 1280, 448, 448, 1280, 1280]
    - [75, 19211.0]
  - - [2368, 448, 1, 1, 2368, 2368, 1, 1]
    - [53, 435.0]
  - - [448, 2944, 1, 32, 448, 448, 32, 32]
    - [53, 11595.0]
  - - [448, 2944, 1, 1280, 448, 448, 1280, 1280]
    - [65, 20414.0]
  - - [128, 2368, 1, 1280, 128, 128, 1280, 1280]
    - [65, 11916.0]
  - - [448, 2944, 1, 3328, 448, 448, 3328, 3328]
    - [58, 20986.0]
  - - [2368, 128, 1, 1280, 2368, 2368, 1280, 1280]
    - [65, 11901.0]
  - - [128, 3584, 1, 3328, 128, 128, 3328, 3328]
    - [65, 19399.0]
  - - [256, 4288, 1, 3328, 256, 256, 3328, 3328]
    - [91, 25637.0]
  - - [1856, 704, 1, 32, 1856, 1856, 32, 32]
    - [53, 11550.0]
  - - [2944, 448, 1, 32, 2944, 2944, 32, 32]
    - [80, 11595.0]
  - - [5056, 128, 1, 32, 5056, 5056, 32, 32]
    - [53, 6314.0]
  - - [6784, 128, 1, 1280, 6784, 6784, 1280, 1280]
    - [65, 20121.0]
  - - [1408, 704, 1, 3328, 1408, 1408, 3328, 3328]
    - [85, 23228.0]
  - - [1856, 704, 1, 1, 1856, 1856, 1, 1]
    - [53, 495.0]
  - - [256, 1856, 1, 3328, 256, 256, 3328, 3328]
    - [73, 20319.0]
  - - [4288, 128, 1, 1280, 4288, 4288, 1280, 1280]
    - [65, 21263.0]
  - - [128, 4288, 1, 256, 128, 128, 256, 256]
    - [64, 15967.0]
  - - [6784, 128, 1, 32, 6784, 6784, 32, 32]
    - [53, 8078.0]
  - - [1408, 448, 1, 1, 1408, 1408, 1, 1]
    - [80, 289.0]
  - - [64, 5056, 1, 1280, 64, 64, 1280, 1280]
    - [75, 12047.0]
  - - [448, 1408, 1, 32, 448, 448, 32, 32]
    - [53, 6511.0]
  - - [128, 5056, 1, 256, 128, 128, 256, 256]
    - [64, 14688.0]
  - - [1024, 1024, 1, 1, 1024, 1024, 1, 1]
    - [87, 430.0]
  - - [256, 1408, 1, 1280, 256, 256, 1280, 1280]
    - [77, 14675.0]
  - - [64, 5888, 1, 3328, 64, 64, 3328, 3328]
    - [63, 14620.0]
  - - [6784, 64, 1, 3328, 6784, 6784, 3328, 3328]
    - [64, 16716.0]
  - - [2944, 448, 1, 3328, 2944, 2944, 3328, 3328]
    - [76, 21521.0]
  - - [448, 1408, 1, 1280, 448, 448, 1280, 1280]
    - [57, 16252.0]
  - - [2368, 128, 1, 1, 2368, 2368, 1, 1]
    - [53, 155.0]
  - - [5056, 64, 1, 256, 5056, 5056, 256, 256]
    - [63, 9588.0]
  - - [2368, 128, 1, 256, 2368, 2368, 256, 256]
    - [63, 9194.0]
  - - [64, 6784, 1, 32, 64, 64, 32, 32]
    - [53, 4288.0]
  - - [256, 4288, 1, 1, 256, 256, 1, 1]
    - [53, 376.0]
  - - [128, 2944, 1, 256, 128, 128, 256, 256]
    - [63, 11217.0]
  - - [3584, 128, 1, 32, 3584, 3584, 32, 32]
    - [53, 4675.0]
  - - [3584, 128, 1, 3328, 3584, 3584, 3328, 3328]
    - [65, 19370.0]
  - - [704, 704, 1, 3328, 704, 704, 3328, 3328]
    - [85, 21103.0]
  - - [128, 2944, 1, 1, 128, 128, 1, 1]
    - [53, 176.0]
  - - [704, 1408, 1, 1280, 704, 704, 1280, 1280]
    - [58, 22632.0]
  - - [6784, 64, 1, 32, 6784, 6784, 32, 32]
    - [53, 4570.0]
  - - [64, 6784, 1, 1280, 64, 64, 1280, 1280]
    - [89, 14796.0]
  - - [704, 1408, 1, 256, 704, 704, 256, 256]
    - [65, 19051.0]
  - - [4288, 128, 1, 32, 4288, 4288, 32, 32]
    - [53, 5816.0]
  - - [448, 704, 1, 256, 448, 448, 256, 256]
    - [63, 9612.0]
  - - [1856, 256, 1, 3328, 1856, 1856, 3328, 3328]
    - [73, 20246.0]
  - - [448, 1024, 1, 1280, 448, 448, 1280, 1280]
    - [73, 17848.0]
  - - [1024, 1024, 1, 256, 1024, 1024, 256, 256]
    - [73, 20906.0]
  - - [256, 2944, 1, 32, 256, 256, 32, 32]
    - [53, 7052.0]
  - - [704, 1024, 1, 1280, 704, 704, 1280, 1280]
    - [72, 18536.0]
  - - [256, 3584, 1, 1280, 256, 256, 1280, 1280]
    - [73, 21275.0]
  - - [128, 2368, 1, 32, 128, 128, 32, 32]
    - [53, 3299.0]
  - - [704, 1856, 1, 256, 704, 704, 256, 256]
    - [76, 18855.0]
  - - [1856, 448, 1, 32, 1856, 1856, 32, 32]
    - [53, 8263.0]
  - - [1408, 448, 1, 256, 1408, 1408, 256, 256]
    - [76, 14290.0]
  - - [448, 1024, 1, 1, 448, 448, 1, 1]
    - [53, 218.0]
  - - [1024, 704, 1, 256, 1024, 1024, 256, 256]
    - [64, 16274.0]
  - - [64, 5888, 1, 32, 64, 64, 32, 32]
    - [53, 3792.0]
  - - [1856, 448, 1, 256, 1856, 1856, 256, 256]
    - [89, 17002.0]
  - - [128, 5888, 1, 3328, 128, 128, 3328, 3328]
    - [84, 20130.0]
  - - [2368, 256, 1, 3328, 2368, 2368, 3328, 3328]
    - [76, 15999.0]
  - - [64, 5888, 1, 1280, 64, 64, 1280, 1280]
    - [63, 13932.0]
  - - [1408, 256, 1, 1, 1408, 1408, 1, 1]
    - [53, 175.0]
  - - [704, 704, 1, 1280, 704, 704, 1280, 1280]
    - [73, 19212.0]
  - - [128, 3584, 1, 1, 128, 128, 1, 1]
    - [68, 205.0]
  - - [128, 3584, 1, 32, 128, 128, 32, 32]
    - [53, 4797.0]
  - - [448, 2368, 1, 32, 448, 448, 32, 32]
    - [53, 9869.0]
  - - [448, 2368, 1, 3328, 448, 448, 3328, 3328]
    - [63, 18533.0]
  - - [1024, 704, 1, 3328, 1024, 1024, 3328, 3328]
    - [76, 19199.0]
  - - [2048, 400, 1, 512, 2048, 2048, 512, 512]
    - [91, 17579.0]
  - - [2560, 128, 1, 2560, 2560, 2560, 2560, 2560]
    - [91, 13504.0]
  - - [1024, 700, 1, 512, 1024, 1024, 512, 512]
    - [76, 16576.0]
  - - [4096, 128, 1, 4096, 4096, 4096, 4096, 4096]
    - [77, 21174.0]
  - - [3072, 128, 1, 1024, 3072, 3072, 1024, 1024]
    - [65, 15149.0]
  - - [7680, 64, 1, 2560, 7680, 7680, 2560, 2560]
    - [89, 16773.0]
  - - [7680, 128, 1, 2560, 7680, 7680, 2560, 2560]
    - [65, 22717.0]
  - - [1024, 1024, 1, 1024, 1024, 1024, 1024, 1024]
    - [77, 23651.0]
  - - [2049, 512, 1, 2048, 2049, 2049, 2048, 2048]
    - [91, 23942.0]
  - - [1023, 512, 1, 1024, 1023, 1023, 1024, 1024]
    - [76, 18035.0]
  - - [1024, 512, 1, 1025, 1024, 1024, 1025, 1025]
    - [85, 20558.0]
  - - [1024, 1024, 1, 1023, 1024, 1024, 1023, 1023]
    - [73, 23785.0]
  - - [1024, 1025, 1, 1024, 1024, 1024, 1024, 1024]
    - [65, 23124.0]
  - - [1024, 1023, 1, 1024, 1024, 1024, 1024, 1024]
    - [77, 22755.0]
  - - [2048, 511, 1, 2048, 2048, 2048, 2048, 2048]
    - [77, 23206.0]
  - - [2047, 512, 1, 2048, 2047, 2047, 2048, 2048]
    - [65, 23479.0]
  - - [1025, 1024, 1, 1024, 1025, 1025, 1024, 1024]
    - [77, 23405.0]
  - - [1024, 1024, 1, 1025, 1024, 1024, 1025, 1025]
    - [73, 23726.0]
  - - [1025, 512, 1, 1024, 1025, 1025, 1024, 1024]
    - [76, 17104.0]
  - - [1024, 512, 1, 1023, 1024, 1024, 1023, 1023]
    - [85, 20518.0]
  - - [2048, 513, 1, 2048, 2048, 2048, 2048, 2048]
    - [90, 19062.0]
  - - [1024, 511, 1, 1024, 1024, 1024, 1024, 1024]
    - [90, 17707.0]
  - - [2048, 512, 1, 2047, 2048, 2048, 2047, 2047]
    - [73, 24402.0]
  - - [1024, 513, 1, 1024, 1024, 1024, 1024, 1024]
    - [76, 16831.0]
  - - [2048, 512, 1, 2049, 2048, 2048, 2049, 2049]
    - [73, 24393.0]
  - - [1023, 1024, 1, 1024, 1023, 1023, 1024, 1024]
    - [77, 22881.0]
  - - [64, 128, 512, 128, 64, 64, 128, 128]
    - [74, 14248.0]
  - - [64, 512, 64, 512, 64, 64, 512, 512]
    - [92, 13250.0]
  - - [256, 1280, 1, 1024, 256, 256, 1024, 1024]
    - [65, 13026.0]
  - - [256, 1536, 1, 1024, 256, 256, 1024, 1024]
    - [65, 15546.0]
  - - [256, 2304, 1, 1024, 256, 256, 1024, 1024]
    - [65, 22271.0]
  - - [256, 2560, 1, 1024, 256, 256, 1024, 1024]
    - [76, 16964.0]
  - - [256, 2816, 1, 1024, 256, 256, 1024, 1024]
    - [76, 18632.0]
  - - [256, 3328, 1, 1024, 256, 256, 1024, 1024]
    - [76, 21745.0]
  - - [256, 3584, 1, 1024, 256, 256, 1024, 1024]
    - [65, 20962.0]
  - - [512, 1600, 1, 512, 512, 512, 512, 512]
    - [76, 19897.0]
  - - [1024, 512, 1, 1024, 1024, 1024, 1024, 1024]
    - [90, 18462.0]
  - - [1024, 512, 1, 1600, 1024, 1024, 1600, 1600]
    - [54, 22358.0]
  - - [1024, 960, 1, 1024, 1024, 1024, 1024, 1024]
    - [65, 21418.0]
  - - [1024, 960, 1, 1600, 1024, 1024, 1600, 1600]
    - [85, 22625.0]
  - - [2048, 215, 1, 512, 2048, 2048, 512, 512]
    - [90, 13763.0]
  - - [2048, 215, 1, 768, 2048, 2048, 768, 768]
    - [91, 14884.0]
  - - [2048, 256, 1, 512, 2048, 2048, 512, 512]
    - [91, 18089.0]
  - - [2048, 256, 1, 768, 2048, 2048, 768, 768]
    - [91, 19641.0]
  - - [2048, 512, 1, 67, 2048, 2048, 67, 67]
    - [81, 13563.0]
  - - [2048, 512, 1, 74, 2048, 2048, 74, 74]
    - [82, 14006.0]
  - - [2048, 512, 1, 100, 2048, 2048, 100, 100]
    - [70, 15936.0]
  - - [2048, 512, 1, 2048, 2048, 2048, 2048, 2048]
    - [65, 24000.0]
  - - [1024, 512, 1, 4096, 1024, 1024, 4096, 4096]
    - [65, 20870.0]
  - - [30522, 77, 1, 1024, 30522, 30522, 1024, 1024]
    - [91, 16080.0]
  - - [1024, 780, 1, 1024, 1024, 1024, 1024, 1024]
    - [90, 19708.0]
  - - [1024, 800, 1, 1024, 1024, 1024, 1024, 1024]
    - [76, 20126.0]
  - - [1024, 820, 1, 1024, 1024, 1024, 1024, 1024]
    - [76, 20659.0]
  - - [1024, 385, 1, 1024, 1024, 1024, 1024, 1024]
    - [76, 13685.0]
  - - [1024, 462, 1, 1024, 1024, 1024, 1024, 1024]
    - [76, 16246.0]
  - - [1024, 1024, 1, 4096, 1024, 1024, 4096, 4096]
    - [77, 24072.0]
  - - [480, 1024, 1, 1024, 480, 480, 1024, 1024]
    - [77, 18249.0]
  - - [480, 2048, 1, 2048, 480, 480, 2048, 2048]
    - [77, 22530.0]
  - - [1024, 480, 1, 1024, 1024, 1024, 1024, 1024]
    - [76, 16947.0]
  - - [2048, 480, 1, 2048, 2048, 2048, 2048, 2048]
    - [91, 22129.0]
  - - [64, 1024, 256, 1024, 64, 64, 1024, 1024]
    - [92, 15735.0]
  - - [64, 512, 40, 512, 64, 64, 512, 512]
    - [63, 12149.0]
  - - [96, 1024, 64, 1024, 96, 96, 1024, 1024]
    - [65, 20037.0]
  - - [64, 1024, 128, 1024, 64, 64, 1024, 1024]
    - [92, 15369.0]
  - - [64, 1024, 32, 1024, 64, 64, 1024, 1024]
    - [66, 13333.0]
  - - [64, 512, 128, 512, 64, 64, 512, 512]
    - [66, 14631.0]
  - - [96, 1024, 128, 1024, 96, 96, 1024, 1024]
    - [65, 19543.0]
  - - [64, 512, 256, 512, 64, 64, 512, 512]
    - [78, 15322.0]
  - - [64, 1024, 64, 1024, 64, 64, 1024, 1024]
    - [66, 14736.0]
  - - [960, 1024, 1, 1024, 960, 960, 1024, 1024]
    - [65, 21103.0]
  - - [64, 128, 1024, 128, 64, 64, 128, 128]
    - [74, 15005.0]
  - - [1024, 864, 1, 1024, 1024, 1024, 1024, 1024]
    - [65, 19211.0]
  - - [1024, 864, 1, 480, 1024, 1024, 480, 480]
    - [69, 18561.0]
  - - [128, 3456, 1, 256, 128, 128, 256, 256]
    - [64, 12928.0]
  - - [128, 4096, 1, 256, 128, 128, 256, 256]
    - [64, 15252.0]
  - - [128, 6912, 1, 256, 128, 128, 256, 256]
    - [65, 17806.0]
  - - [256, 3456, 1, 512, 256, 256, 512, 512]
    - [65, 19325.0]
  - - [256, 4096, 1, 512, 256, 256, 512, 512]
    - [65, 22691.0]
  - - [512, 864, 1, 1024, 512, 512, 1024, 1024]
    - [77, 16532.0]
  - - [512, 864, 1, 13, 512, 512, 13, 13]
    - [56, 1571.0]
  - - [64, 128, 1280, 128, 64, 64, 128, 128]
    - [74, 15238.0]
  - - [64, 128, 1312, 128, 64, 64, 128, 128]
    - [59, 15185.0]
  - - [64, 512, 192, 512, 64, 64, 512, 512]
    - [92, 15058.0]
  - - [1024, 512, 1, 196, 1024, 1024, 196, 196]
    - [54, 13887.0]
  - - [2048, 512, 1, 49, 2048, 2048, 49, 49]
    - [87, 11784.0]
  - - [2304, 256, 1, 196, 2304, 2304, 196, 196]
    - [81, 15750.0]
  - - [512, 1024, 1, 196, 512, 512, 196, 196]
    - [81, 14893.0]
  - - [512, 2048, 1, 49, 512, 512, 49, 49]
    - [80, 11894.0]
  - - [64, 128, 2048, 128, 64, 64, 128, 128]
    - [66, 15228.0]
  - - [64, 128, 1536, 128, 64, 64, 128, 128]
    - [74, 15058.0]
  - - [128, 128, 64, 6400, 128, 128, 6400, 6400]
    - [65, 20388.0]
  - - [64, 128, 192, 128, 64, 64, 128, 128]
    - [71, 13865.0]
  - - [64, 384, 144, 384, 64, 64, 384, 384]
    - [83, 15707.0]
  - - [64, 512, 48, 512, 64, 64, 512, 512]
    - [92, 13263.0]
  - - [64, 128, 256, 128, 64, 64, 128, 128]
    - [66, 12224.0]
  - - [64, 384, 192, 384, 64, 64, 384, 384]
    - [56, 18957.0]
  - - [512, 1024, 1, 1024, 512, 512, 1024, 1024]
    - [77, 20062.0]
  - - [512, 2048, 1, 2048, 512, 512, 2048, 2048]
    - [77, 24161.0]
  - - [128, 128, 49, 1120, 128, 128, 1120, 1120]
    - [57, 20689.0]
  - - [128, 128, 49, 1064, 128, 128, 1064, 1064]
    - [69, 22503.0]
  - - [128, 128, 49, 1040, 128, 128, 1040, 1040]
    - [69, 22505.0]
  - - [128, 128, 64, 600, 128, 128, 600, 600]
    - [58, 22502.0]
  - - [128, 128, 64, 616, 128, 128, 616, 616]
    - [85, 22569.0]
  - - [128, 128, 49, 950, 128, 128, 950, 950]
    - [84, 20198.0]
  - - [128, 128, 49, 972, 128, 128, 972, 972]
    - [57, 20279.0]
  - - [128, 128, 64, 560, 128, 128, 560, 560]
    - [58, 22707.0]
  - - [128, 128, 49, 1008, 128, 128, 1008, 1008]
    - [69, 22655.0]
  - - [128, 128, 64, 532, 128, 128, 532, 532]
    - [58, 22136.0]
  - - [128, 128, 49, 1080, 128, 128, 1080, 1080]
    - [54, 20733.0]
  - - [128, 128, 64, 588, 128, 128, 588, 588]
    - [85, 22486.0]
  - - [128, 128, 49, 1160, 128, 128, 1160, 1160]
    - [57, 20522.0]
  - - [128, 128, 49, 988, 128, 128, 988, 988]
    - [81, 20862.0]
  - - [128, 128, 49, 936, 128, 128, 936, 936]
    - [84, 20276.0]
  - - [512, 1024, 1, 3800, 512, 512, 3800, 3800]
    - [81, 22842.0]
  - - [512, 1024, 1, 3400, 512, 512, 3400, 3400]
    - [81, 22830.0]
  - - [512, 1024, 1, 3456, 512, 512, 3456, 3456]
    - [73, 22901.0]
  - - [512, 1024, 1, 3072, 512, 512, 3072, 3072]
    - [65, 21366.0]
  - - [2048, 512, 1, 950, 2048, 2048, 950, 950]
    - [85, 23774.0]
  - - [512, 1024, 1, 3552, 512, 512, 3552, 3552]
    - [73, 22929.0]
  - - [512, 1024, 1, 3220, 512, 512, 3220, 3220]
    - [81, 22697.0]
  - - [2048, 512, 1, 850, 2048, 2048, 850, 850]
    - [85, 23504.0]
  - - [512, 2048, 1, 864, 512, 512, 864, 864]
    - [73, 23917.0]
  - - [512, 2048, 1, 768, 512, 512, 768, 768]
    - [73, 23506.0]
  - - [2048, 512, 1, 805, 2048, 2048, 805, 805]
    - [73, 23486.0]
  - - [512, 1024, 1, 2852, 512, 512, 2852, 2852]
    - [81, 22614.0]
  - - [512, 2048, 1, 888, 512, 512, 888, 888]
    - [73, 23741.0]
  - - [2048, 512, 1, 864, 2048, 2048, 864, 864]
    - [73, 23866.0]
  - - [2048, 512, 1, 768, 2048, 2048, 768, 768]
    - [85, 23506.0]
  - - [2048, 512, 1, 888, 2048, 2048, 888, 888]
    - [85, 23669.0]
  - - [2048, 256, 1, 950, 2048, 2048, 950, 950]
    - [73, 20084.0]
  - - [2048, 512, 1, 713, 2048, 2048, 713, 713]
    - [85, 23276.0]
  - - [512, 1024, 1, 2688, 512, 512, 2688, 2688]
    - [73, 22635.0]
  - - [512, 1024, 1, 2640, 512, 512, 2640, 2640]
    - [73, 22639.0]
  - - [512, 1024, 1, 2904, 512, 512, 2904, 2904]
    - [81, 22684.0]
  - - [1024, 512, 1, 950, 1024, 1024, 950, 950]
    - [69, 20945.0]
  - - [512, 2048, 1, 672, 512, 512, 672, 672]
    - [73, 23582.0]
  - - [512, 2048, 1, 660, 512, 512, 660, 660]
    - [73, 23208.0]
  - - [512, 2048, 1, 1008, 512, 512, 1008, 1008]
    - [73, 24099.0]
  - - [2048, 256, 1, 850, 2048, 2048, 850, 850]
    - [69, 19841.0]
  - - [2048, 512, 1, 726, 2048, 2048, 726, 726]
    - [85, 23380.0]
  - - [1024, 512, 1, 850, 1024, 1024, 850, 850]
    - [69, 20575.0]
  - - [2048, 512, 1, 660, 2048, 2048, 660, 660]
    - [85, 23192.0]
  - - [2048, 512, 1, 672, 2048, 2048, 672, 672]
    - [73, 23488.0]
  - - [512, 2048, 1, 840, 512, 512, 840, 840]
    - [70, 23665.0]
  - - [2048, 512, 1, 1008, 2048, 2048, 1008, 1008]
    - [73, 24110.0]
  - - [512, 2048, 1, 792, 512, 512, 792, 792]
    - [82, 23606.0]
  - - [1024, 512, 1, 805, 1024, 1024, 805, 805]
    - [69, 20213.0]
  - - [512, 2048, 1, 1050, 512, 512, 1050, 1050]
    - [73, 23935.0]
  - - [2048, 512, 1, 748, 2048, 2048, 748, 748]
    - [85, 23427.0]
  - - [2048, 256, 1, 864, 2048, 2048, 864, 864]
    - [54, 21049.0]
  - - [1024, 512, 1, 768, 1024, 1024, 768, 768]
    - [91, 19874.0]
  - - [1024, 512, 1, 864, 1024, 1024, 864, 864]
    - [54, 21407.0]
  - - [2048, 512, 1, 875, 2048, 2048, 875, 875]
    - [73, 23623.0]
  - - [2048, 512, 1, 840, 2048, 2048, 840, 840]
    - [85, 23614.0]
  - - [2048, 512, 1, 792, 2048, 2048, 792, 792]
    - [85, 23526.0]
  - - [512, 2048, 1, 736, 512, 512, 736, 736]
    - [73, 23688.0]
  - - [2048, 256, 1, 888, 2048, 2048, 888, 888]
    - [53, 20260.0]
  - - [512, 2048, 1, 704, 512, 512, 704, 704]
    - [85, 23675.0]
  - - [512, 2048, 1, 588, 512, 512, 588, 588]
    - [73, 23023.0]
  - - [1024, 512, 1, 888, 1024, 1024, 888, 888]
    - [54, 21124.0]
  - - [512, 2048, 1, 816, 512, 512, 816, 816]
    - [85, 23834.0]
  - - [1024, 512, 1, 713, 1024, 1024, 713, 713]
    - [69, 19884.0]
  - - [2048, 512, 1, 736, 2048, 2048, 736, 736]
    - [85, 23746.0]
  - - [2048, 512, 1, 588, 2048, 2048, 588, 588]
    - [85, 23006.0]
  - - [2048, 512, 1, 704, 2048, 2048, 704, 704]
    - [85, 23600.0]
  - - [1024, 512, 1, 660, 1024, 1024, 660, 660]
    - [69, 20002.0]
  - - [2048, 256, 1, 660, 2048, 2048, 660, 660]
    - [69, 19352.0]
  - - [2048, 256, 1, 672, 2048, 2048, 672, 672]
    - [54, 20652.0]
  - - [1024, 512, 1, 672, 1024, 1024, 672, 672]
    - [54, 20749.0]
  - - [1024, 512, 1, 726, 1024, 1024, 726, 726]
    - [69, 20161.0]
  - - [512, 2048, 1, 630, 512, 512, 630, 630]
    - [73, 23147.0]
  - - [512, 2048, 1, 600, 512, 512, 600, 600]
    - [82, 23164.0]
  - - [2048, 256, 1, 805, 2048, 2048, 805, 805]
    - [69, 19796.0]
  - - [2048, 256, 1, 713, 2048, 2048, 713, 713]
    - [69, 19429.0]
  - - [2048, 256, 1, 726, 2048, 2048, 726, 726]
    - [81, 19460.0]
  - - [320, 1024, 1, 1024, 320, 320, 1024, 1024]
    - [63, 12382.0]
  - - [1024, 1000, 1, 1024, 1024, 1024, 1024, 1024]
    - [77, 22377.0]
  - - [320, 1000, 1, 1024, 320, 320, 1024, 1024]
    - [65, 11994.0]
  - - [128, 128, 49, 1280, 128, 128, 1280, 1280]
    - [64, 20413.0]
  - - [128, 128, 49, 1360, 128, 128, 1360, 1360]
    - [69, 22183.0]
  - - [128, 128, 49, 1200, 128, 128, 1200, 1200]
    - [57, 20771.0]
  - - [128, 128, 49, 1240, 128, 128, 1240, 1240]
    - [81, 21344.0]
  - - [2304, 256, 1, 704, 2304, 2304, 704, 704]
    - [69, 22916.0]
  - - [2304, 256, 1, 736, 2304, 2304, 736, 736]
    - [81, 22993.0]
  - - [2304, 256, 1, 792, 2304, 2304, 792, 792]
    - [69, 22502.0]
  - - [2304, 256, 1, 748, 2304, 2304, 748, 748]
    - [69, 21863.0]
  - - [2304, 256, 1, 726, 2304, 2304, 726, 726]
    - [81, 21737.0]
  - - [2304, 256, 1, 713, 2304, 2304, 713, 713]
    - [69, 21566.0]
  - - [2304, 256, 1, 768, 2304, 2304, 768, 768]
    - [91, 22075.0]
  - - [512, 2048, 1, 759, 512, 512, 759, 759]
    - [73, 23367.0]
  - - [512, 2048, 1, 925, 512, 512, 925, 925]
    - [73, 23761.0]
  - - [2304, 256, 1, 805, 2304, 2304, 805, 805]
    - [69, 21962.0]
  - - [512, 2048, 1, 900, 512, 512, 900, 900]
    - [73, 23664.0]
  - - [512, 2048, 1, 875, 512, 512, 875, 875]
    - [73, 23684.0]
  - - [512, 2048, 1, 748, 512, 512, 748, 748]
    - [85, 23427.0]
  - - [512, 2048, 1, 726, 512, 512, 726, 726]
    - [73, 23366.0]
  - - [512, 2048, 1, 713, 512, 512, 713, 713]
    - [73, 23364.0]
  - - [512, 2048, 1, 805, 512, 512, 805, 805]
    - [73, 23526.0]
  - - [512, 2048, 1, 850, 512, 512, 850, 850]
    - [73, 23604.0]
  - - [512, 2048, 1, 950, 512, 512, 950, 950]
    - [73, 23763.0]
  - - [128, 128, 49, 1152, 128, 128, 1152, 1152]
    - [84, 20811.0]
  - - [128, 128, 49, 1216, 128, 128, 1216, 1216]
    - [69, 21158.0]
  - - [128, 128, 36, 1800, 128, 128, 1800, 1800]
    - [58, 24107.0]
  - - [128, 128, 36, 1900, 128, 128, 1900, 1900]
    - [73, 24236.0]
  - - [128, 128, 64, 5880, 128, 128, 5880, 5880]
    - [77, 23864.0]
  - - [128, 128, 49, 7680, 128, 128, 7680, 7680]
    - [67, 15303.0]
  - - [128, 128, 64, 882, 128, 128, 882, 882]
    - [58, 22646.0]
  - - [128, 128, 64, 931, 128, 128, 931, 931]
    - [58, 23266.0]
  - - [128, 64, 121, 1152, 128, 128, 1152, 1152]
    - [57, 19341.0]
  - - [128, 64, 81, 12000, 128, 128, 12000, 12000]
    - [63, 14538.0]
  - - [128, 64, 121, 1216, 128, 128, 1216, 1216]
    - [57, 19120.0]
  - - [128, 64, 81, 1800, 128, 128, 1800, 1800]
    - [72, 17275.0]
  - - [128, 64, 81, 1900, 128, 128, 1900, 1900]
    - [57, 17318.0]
  - - [128, 64, 49, 20280, 128, 128, 20280, 20280]
    - [72, 15364.0]
  - - [128, 64, 49, 3042, 128, 128, 3042, 3042]
    - [83, 15699.0]
  - - [128, 64, 49, 3211, 128, 128, 3211, 3211]
    - [71, 15952.0]
  - - [128, 64, 169, 5880, 128, 128, 5880, 5880]
    - [57, 14376.0]
  - - [128, 64, 121, 7680, 128, 128, 7680, 7680]
    - [79, 11580.0]
  - - [128, 64, 169, 882, 128, 128, 882, 882]
    - [60, 15418.0]
  - - [128, 64, 169, 931, 128, 128, 931, 931]
    - [86, 15574.0]
  - - [256, 128, 25, 1080, 256, 256, 1080, 1080]
    - [72, 20906.0]
  - - [256, 128, 25, 162, 256, 256, 162, 162]
    - [57, 15467.0]
  - - [256, 128, 25, 171, 256, 256, 171, 171]
    - [57, 15634.0]
  - - [1152, 256, 1, 1, 1152, 1152, 1, 1]
    - [53, 145.0]
  - - [1152, 256, 1, 1444, 1152, 1152, 1444, 1444]
    - [69, 12735.0]
  - - [1152, 256, 1, 25, 1152, 1152, 25, 25]
    - [66, 2409.0]
  - - [1152, 256, 1, 9, 1152, 1152, 9, 9]
    - [56, 1196.0]
  - - [2304, 256, 1, 1444, 2304, 2304, 1444, 1444]
    - [73, 23831.0]
  - - [2304, 340, 1, 1, 2304, 2304, 1, 1]
    - [53, 201.0]
  - - [2304, 340, 1, 1444, 2304, 2304, 1444, 1444]
    - [73, 17966.0]
  - - [2304, 340, 1, 9, 2304, 2304, 9, 9]
    - [57, 2003.0]
  - - [2304, 510, 1, 25, 2304, 2304, 25, 25]
    - [53, 6095.0]
  - - [96, 1024, 160, 1024, 96, 96, 1024, 1024]
    - [65, 19785.0]
  - - [96, 1024, 40, 1024, 96, 96, 1024, 1024]
    - [65, 20585.0]
  - - [96, 1024, 80, 1024, 96, 96, 1024, 1024]
    - [91, 19744.0]
  - - [96, 1024, 96, 1024, 96, 96, 1024, 1024]
    - [91, 19497.0]
  - - [96, 1024, 24, 1024, 96, 96, 1024, 1024]
    - [65, 18775.0]
  - - [96, 1024, 48, 1024, 96, 96, 1024, 1024]
    - [65, 20714.0]
  - - [96, 1024, 16, 1024, 96, 96, 1024, 1024]
    - [65, 17912.0]
  - - [96, 1024, 32, 1024, 96, 96, 1024, 1024]
    - [77, 19020.0]
  - - [64, 512, 320, 512, 64, 64, 512, 512]
    - [78, 15265.0]
  - - [64, 512, 80, 512, 64, 64, 512, 512]
    - [66, 14143.0]
  - - [29000, 109, 1, 2560, 29000, 29000, 2560, 2560]
    - [65, 21583.0]
  - - [29000, 121, 1, 2560, 29000, 29000, 2560, 2560]
    - [65, 23837.0]
  - - [29000, 65, 1, 2560, 29000, 29000, 2560, 2560]
    - [91, 12997.0]
  - - [29000, 66, 1, 2560, 29000, 29000, 2560, 2560]
    - [77, 13270.0]
  - - [29000, 67, 1, 2560, 29000, 29000, 2560, 2560]
    - [77, 13477.0]
  - - [29000, 69, 1, 2560, 29000, 29000, 2560, 2560]
    - [77, 13666.0]
  - - [29000, 70, 1, 2560, 29000, 29000, 2560, 2560]
    - [91, 13971.0]
  - - [29000, 71, 1, 2560, 29000, 29000, 2560, 2560]
    - [65, 14202.0]
  - - [29000, 73, 1, 2560, 29000, 29000, 2560, 2560]
    - [77, 14663.0]
  - - [29000, 74, 1, 2560, 29000, 29000, 2560, 2560]
    - [65, 14800.0]
  - - [29000, 75, 1, 2560, 29000, 29000, 2560, 2560]
    - [77, 15006.0]
  - - [29000, 77, 1, 2560, 29000, 29000, 2560, 2560]
    - [65, 15248.0]
  - - [29000, 78, 1, 2560, 29000, 29000, 2560, 2560]
    - [77, 15629.0]
  - - [29000, 80, 1, 2560, 29000, 29000, 2560, 2560]
    - [91, 16018.0]
  - - [29000, 81, 1, 2560, 29000, 29000, 2560, 2560]
    - [65, 16240.0]
  - - [29000, 82, 1, 2560, 29000, 29000, 2560, 2560]
    - [91, 16407.0]
  - - [29000, 83, 1, 2560, 29000, 29000, 2560, 2560]
    - [77, 16575.0]
  - - [29000, 84, 1, 2560, 29000, 29000, 2560, 2560]
    - [91, 16790.0]
  - - [29000, 88, 1, 2560, 29000, 29000, 2560, 2560]
    - [65, 17618.0]
  - - [29000, 89, 1, 2560, 29000, 29000, 2560, 2560]
    - [65, 17839.0]
  - - [29000, 90, 1, 2560, 29000, 29000, 2560, 2560]
    - [65, 17902.0]
  - - [29000, 92, 1, 2560, 29000, 29000, 2560, 2560]
    - [91, 18268.0]
  - - [29000, 95, 1, 2560, 29000, 29000, 2560, 2560]
    - [77, 18892.0]
  - - [29000, 98, 1, 2560, 29000, 29000, 2560, 2560]
    - [65, 19495.0]
  - - [64, 1024, 512, 1024, 64, 64, 1024, 1024]
    - [92, 15911.0]
  - - [64, 64, 36, 50176, 64, 64, 50176, 50176]
    - [108, 11824.0]
  - - [64, 64, 49, 36864, 64, 64, 36864, 36864]
    - [97, 8870.0]
  - - [64, 64, 64, 25600, 64, 64, 25600, 25600]
    - [92, 10522.0]
  - - [256, 256, 1, 60800, 256, 256, 60800, 60800]
    - [104, 15746.0]
  - - [256, 256, 1, 54400, 256, 256, 54400, 54400]
    - [94, 15802.0]
  - - [256, 256, 1, 51520, 256, 256, 51520, 51520]
    - [104, 15733.0]
  - - [256, 256, 1, 55296, 256, 256, 55296, 55296]
    - [109, 12184.0]
  - - [256, 256, 1, 56832, 256, 256, 56832, 56832]
    - [105, 12242.0]
  - - [256, 256, 1, 45632, 256, 256, 45632, 45632]
    - [104, 15643.0]
  - - [256, 256, 1, 49152, 256, 256, 49152, 49152]
    - [98, 12111.0]
  - - [256, 512, 1, 13600, 256, 256, 13600, 13600]
    - [100, 19890.0]
  - - [256, 256, 1, 43008, 256, 256, 43008, 43008]
    - [102, 12030.0]
  - - [256, 512, 1, 15200, 256, 256, 15200, 15200]
    - [100, 20280.0]
  - - [256, 512, 1, 12880, 256, 256, 12880, 12880]
    - [100, 19685.0]
  - - [256, 512, 1, 13824, 256, 256, 13824, 13824]
    - [99, 17313.0]
  - - [512, 256, 1, 13824, 512, 512, 13824, 13824]
    - [107, 17688.0]
  - - [256, 512, 1, 14208, 256, 256, 14208, 14208]
    - [100, 20042.0]
  - - [512, 256, 1, 14208, 512, 512, 14208, 14208]
    - [100, 20081.0]
  - - [512, 256, 1, 15200, 512, 512, 15200, 15200]
    - [95, 20292.0]
  - - [256, 512, 1, 12288, 256, 256, 12288, 12288]
    - [101, 17004.0]
  - - [512, 256, 1, 12288, 512, 512, 12288, 12288]
    - [96, 16972.0]
  - - [128, 64, 25, 43320, 128, 128, 43320, 43320]
    - [96, 16470.0]
  - - [64, 64, 64, 20280, 64, 64, 20280, 20280]
    - [93, 12128.0]
  - - [64, 64, 49, 27000, 64, 64, 27000, 27000]
    - [103, 12544.0]
  - - [64, 64, 36, 43320, 64, 64, 43320, 43320]
    - [106, 12359.0]
  - - [32, 5056, 1, 1280, 32, 32, 1280, 1280]
    - [156, 6616.0]
  - - [4288, 64, 1, 3328, 4288, 4288, 3328, 3328]
    - [150, 9453.0]
  - - [2368, 64, 1, 1, 2368, 2368, 1, 1]
    - [114, 92.0]
  - - [1408, 128, 1, 32, 1408, 1408, 32, 32]
    - [128, 2773.0]
  - - [32, 2944, 1, 3328, 32, 32, 3328, 3328]
    - [152, 5653.0]
  - - [2368, 32, 1, 256, 2368, 2368, 256, 256]
    - [119, 4110.0]
  - - [1024, 128, 1, 32, 1024, 1024, 32, 32]
    - [128, 2208.0]
  - - [32, 4288, 1, 1280, 32, 32, 1280, 1280]
    - [138, 7306.0]
  - - [32, 5056, 1, 32, 32, 32, 32, 32]
    - [110, 2563.0]
  - - [5888, 32, 1, 32, 5888, 5888, 32, 32]
    - [145, 2817.0]
  - - [64, 2368, 1, 1280, 64, 64, 1280, 1280]
    - [120, 6923.0]
  - - [128, 704, 1, 32, 128, 128, 32, 32]
    - [112, 1696.0]
  - - [32, 4288, 1, 3328, 32, 32, 3328, 3328]
    - [156, 7244.0]
  - - [1408, 64, 1, 1, 1408, 1408, 1, 1]
    - [114, 61.0]
  - - [1856, 64, 1, 256, 1856, 1856, 256, 256]
    - [120, 5469.0]
  - - [1024, 256, 1, 256, 1024, 1024, 256, 256]
    - [115, 7840.0]
  - - [1856, 128, 1, 32, 1856, 1856, 32, 32]
    - [150, 3424.0]
  - - [1856, 128, 1, 1280, 1856, 1856, 1280, 1280]
    - [150, 8148.0]
  - - [4288, 32, 1, 3328, 4288, 4288, 3328, 3328]
    - [138, 7049.0]
  - - [3584, 64, 1, 1280, 3584, 3584, 1280, 1280]
    - [120, 7775.0]
  - - [64, 1856, 1, 256, 64, 64, 256, 256]
    - [120, 5373.0]
  - - [3584, 64, 1, 32, 3584, 3584, 32, 32]
    - [128, 3164.0]
  - - [1408, 128, 1, 3328, 1408, 1408, 3328, 3328]
    - [129, 7871.0]
  - - [32, 6784, 1, 3328, 32, 32, 3328, 3328]
    - [138, 7465.0]
  - - [32, 3584, 1, 256, 32, 32, 256, 256]
    - [120, 5169.0]
  - - [704, 256, 1, 32, 704, 704, 32, 32]
    - [145, 2800.0]
  - - [64, 2944, 1, 3328, 64, 64, 3328, 3328]
    - [113, 7726.0]
  - - [64, 4288, 1, 3328, 64, 64, 3328, 3328]
    - [115, 9470.0]
  - - [256, 704, 1, 256, 256, 256, 256, 256]
    - [120, 7254.0]
  - - [5056, 32, 1, 3328, 5056, 5056, 3328, 3328]
    - [138, 6835.0]
  - - [2944, 32, 1, 1280, 2944, 2944, 1280, 1280]
    - [120, 5298.0]
  - - [64, 1408, 1, 3328, 64, 64, 3328, 3328]
    - [112, 5885.0]
  - - [256, 448, 1, 1280, 256, 256, 1280, 1280]
    - [113, 6300.0]
  - - [448, 448, 1, 256, 448, 448, 256, 256]
    - [138, 7216.0]
  - - [1024, 256, 1, 1, 1024, 1024, 1, 1]
    - [114, 158.0]
  - - [1856, 64, 1, 32, 1856, 1856, 32, 32]
    - [128, 2066.0]
  - - [4288, 64, 1, 256, 4288, 4288, 256, 256]
    - [123, 8002.0]
  - - [1408, 64, 1, 256, 1408, 1408, 256, 256]
    - [119, 4747.0]
  - - [6784, 32, 1, 32, 6784, 6784, 32, 32]
    - [145, 3101.0]
  - - [448, 448, 1, 1280, 448, 448, 1280, 1280]
    - [158, 7766.0]
  - - [32, 5888, 1, 256, 32, 32, 256, 256]
    - [120, 6536.0]
  - - [1024, 128, 1, 256, 1024, 1024, 256, 256]
    - [120, 5707.0]
  - - [1856, 64, 1, 1280, 1856, 1856, 1280, 1280]
    - [148, 6087.0]
  - - [128, 1408, 1, 1, 128, 128, 1, 1]
    - [114, 116.0]
  - - [32, 2368, 1, 1280, 32, 32, 1280, 1280]
    - [119, 5154.0]
  - - [448, 256, 1, 256, 448, 448, 256, 256]
    - [138, 5377.0]
  - - [2944, 32, 1, 32, 2944, 2944, 32, 32]
    - [145, 1773.0]
  - - [448, 448, 1, 32, 448, 448, 32, 32]
    - [113, 2973.0]
  - - [704, 256, 1, 3328, 704, 704, 3328, 3328]
    - [146, 7688.0]
  - - [64, 2944, 1, 1, 64, 64, 1, 1]
    - [114, 121.0]
  - - [64, 2944, 1, 32, 64, 64, 32, 32]
    - [110, 2817.0]
  - - [64, 2944, 1, 1280, 64, 64, 1280, 1280]
    - [120, 7632.0]
  - - [32, 3584, 1, 1280, 32, 32, 1280, 1280]
    - [138, 6231.0]
  - - [32, 2944, 1, 32, 32, 32, 32, 32]
    - [114, 1794.0]
  - - [32, 6784, 1, 256, 32, 32, 256, 256]
    - [138, 6523.0]
  - - [448, 448, 1, 3328, 448, 448, 3328, 3328]
    - [158, 7995.0]
  - - [704, 128, 1, 1280, 704, 704, 1280, 1280]
    - [157, 5461.0]
  - - [32, 3584, 1, 3328, 32, 32, 3328, 3328]
    - [138, 6538.0]
  - - [128, 704, 1, 1280, 128, 128, 1280, 1280]
    - [130, 5704.0]
  - - [64, 4288, 1, 1, 64, 64, 1, 1]
    - [114, 169.0]
  - - [3584, 32, 1, 32, 3584, 3584, 32, 32]
    - [145, 1995.0]
  - - [3584, 64, 1, 1, 3584, 3584, 1, 1]
    - [114, 142.0]
  - - [32, 4288, 1, 32, 32, 32, 32, 32]
    - [114, 2311.0]
  - - [64, 1408, 1, 1, 64, 64, 1, 1]
    - [114, 61.0]
  - - [256, 1024, 1, 256, 256, 256, 256, 256]
    - [123, 7822.0]
  - - [1408, 128, 1, 1280, 1408, 1408, 1280, 1280]
    - [131, 7191.0]
  - - [64, 4288, 1, 1280, 64, 64, 1280, 1280]
    - [150, 9220.0]
  - - [64, 3584, 1, 1, 64, 64, 1, 1]
    - [114, 143.0]
  - - [1024, 128, 1, 1280, 1024, 1024, 1280, 1280]
    - [158, 6876.0]
  - - [2368, 32, 1, 32, 2368, 2368, 32, 32]
    - [145, 1461.0]
  - - [128, 1408, 1, 256, 128, 128, 256, 256]
    - [120, 7164.0]
  - - [256, 448, 1, 3328, 256, 256, 3328, 3328]
    - [111, 6741.0]
  - - [2368, 64, 1, 256, 2368, 2368, 256, 256]
    - [138, 6062.0]
  - - [32, 2368, 1, 3328, 32, 32, 3328, 3328]
    - [119, 5444.0]
  - - [128, 1856, 1, 1, 128, 128, 1, 1]
    - [114, 148.0]
  - - [128, 1856, 1, 32, 128, 128, 32, 32]
    - [150, 3424.0]
  - - [3584, 32, 1, 256, 3584, 3584, 256, 256]
    - [120, 5097.0]
  - - [64, 3584, 1, 256, 64, 64, 256, 256]
    - [120, 6908.0]
  - - [32, 2944, 1, 1280, 32, 32, 1280, 1280]
    - [120, 5542.0]
  - - [4288, 32, 1, 32, 4288, 4288, 32, 32]
    - [145, 2287.0]
  - - [1856, 64, 1, 1, 1856, 1856, 1, 1]
    - [114, 79.0]
  - - [128, 1024, 1, 3328, 128, 128, 3328, 3328]
    - [148, 7637.0]
  - - [1408, 128, 1, 1, 1408, 1408, 1, 1]
    - [114, 117.0]
  - - [5056, 32, 1, 256, 5056, 5056, 256, 256]
    - [120, 6127.0]
  - - [64, 1408, 1, 1280, 64, 64, 1280, 1280]
    - [119, 5873.0]
  - - [3584, 32, 1, 1280, 3584, 3584, 1280, 1280]
    - [138, 5789.0]
  - - [1856, 128, 1, 3328, 1856, 1856, 3328, 3328]
    - [150, 8354.0]
  - - [704, 256, 1, 1280, 704, 704, 1280, 1280]
    - [148, 7282.0]
  - - [1856, 128, 1, 1, 1856, 1856, 1, 1]
    - [114, 148.0]
  - - [256, 704, 1, 1, 256, 256, 1, 1]
    - [114, 116.0]
  - - [1024, 128, 1, 1, 1024, 1024, 1, 1]
    - [114, 86.0]
  - - [1856, 128, 1, 256, 1856, 1856, 256, 256]
    - [138, 7121.0]
  - - [1024, 256, 1, 1280, 1024, 1024, 1280, 1280]
    - [115, 9025.0]
  - - [64, 2368, 1, 32, 64, 64, 32, 32]
    - [110, 2449.0]
  - - [32, 2368, 1, 256, 32, 32, 256, 256]
    - [119, 4025.0]
  - - [32, 6784, 1, 1280, 32, 32, 1280, 1280]
    - [156, 6744.0]
  - - [32, 6784, 1, 32, 32, 32, 32, 32]
    - [145, 3101.0]
  - - [64, 3584, 1, 3328, 64, 64, 3328, 3328]
    - [141, 7958.0]
  - - [32, 5888, 1, 1280, 32, 32, 1280, 1280]
    - [138, 7523.0]
  - - [448, 256, 1, 1, 448, 448, 1, 1]
    - [114, 74.0]
  - - [448, 256, 1, 3328, 448, 448, 3328, 3328]
    - [133, 6606.0]
  - - [128, 704, 1, 3328, 128, 128, 3328, 3328]
    - [112, 6020.0]
  - - [2368, 32, 1, 3328, 2368, 2368, 3328, 3328]
    - [128, 5126.0]
  - - [2944, 64, 1, 3328, 2944, 2944, 3328, 3328]
    - [148, 7497.0]
  - - [128, 1024, 1, 32, 128, 128, 32, 32]
    - [110, 2185.0]
  - - [32, 2368, 1, 32, 32, 32, 32, 32]
    - [145, 1461.0]
  - - [64, 1856, 1, 1280, 64, 64, 1280, 1280]
    - [131, 6509.0]
  - - [32, 3584, 1, 32, 32, 32, 32, 32]
    - [110, 2039.0]
  - - [704, 256, 1, 1, 704, 704, 1, 1]
    - [114, 114.0]
  - - [1024, 256, 1, 3328, 1024, 1024, 3328, 3328]
    - [150, 9271.0]
  - - [128, 1856, 1, 1280, 128, 128, 1280, 1280]
    - [133, 8166.0]
  - - [448, 256, 1, 32, 448, 448, 32, 32]
    - [110, 1995.0]
  - - [64, 4288, 1, 32, 64, 64, 32, 32]
    - [150, 3886.0]
  - - [128, 704, 1, 1, 128, 128, 1, 1]
    - [114, 58.0]
  - - [4288, 64, 1, 1280, 4288, 4288, 1280, 1280]
    - [150, 9220.0]
  - - [448, 448, 1, 1, 448, 448, 1, 1]
    - [114, 125.0]
  - - [32, 5888, 1, 32, 32, 32, 32, 32]
    - [145, 2817.0]
  - - [1024, 128, 1, 3328, 1024, 1024, 3328, 3328]
    - [120, 7860.0]
  - - [4288, 64, 1, 32, 4288, 4288, 32, 32]
    - [150, 3920.0]
  - - [2368, 64, 1, 32, 2368, 2368, 32, 32]
    - [110, 2449.0]
  - - [64, 1408, 1, 32, 64, 64, 32, 32]
    - [110, 1696.0]
  - - [32, 2944, 1, 256, 32, 32, 256, 256]
    - [120, 4385.0]
  - - [2944, 64, 1, 1, 2944, 2944, 1, 1]
    - [114, 119.0]
  - - [2944, 64, 1, 32, 2944, 2944, 32, 32]
    - [113, 2817.0]
  - - [64, 2944, 1, 256, 64, 64, 256, 256]
    - [120, 6813.0]
  - - [64, 2368, 1, 256, 64, 64, 256, 256]
    - [138, 5969.0]
  - - [1408, 64, 1, 3328, 1408, 1408, 3328, 3328]
    - [147, 5706.0]
  - - [6784, 32, 1, 1280, 6784, 6784, 1280, 1280]
    - [156, 7359.0]
  - - [2944, 64, 1, 1280, 2944, 2944, 1280, 1280]
    - [148, 7366.0]
  - - [2944, 32, 1, 256, 2944, 2944, 256, 256]
    - [119, 4417.0]
  - - [256, 1024, 1, 3328, 256, 256, 3328, 3328]
    - [115, 9291.0]
  - - [1856, 64, 1, 3328, 1856, 1856, 3328, 3328]
    - [115, 6696.0]
  - - [5888, 32, 1, 256, 5888, 5888, 256, 256]
    - [120, 6483.0]
  - - [128, 704, 1, 256, 128, 128, 256, 256]
    - [119, 4867.0]
  - - [3584, 64, 1, 256, 3584, 3584, 256, 256]
    - [120, 6957.0]
  - - [64, 1856, 1, 32, 64, 64, 32, 32]
    - [110, 2066.0]
  - - [64, 1856, 1, 3328, 64, 64, 3328, 3328]
    - [131, 6865.0]
  - - [5888, 32, 1, 1280, 5888, 5888, 1280, 1280]
    - [138, 7551.0]
  - - [256, 704, 1, 32, 256, 256, 32, 32]
    - [128, 2746.0]
  - - [256, 704, 1, 1280, 256, 256, 1280, 1280]
    - [120, 7772.0]
  - - [1408, 64, 1, 32, 1408, 1408, 32, 32]
    - [145, 1696.0]
  - - [128, 1408, 1, 1280, 128, 128, 1280, 1280]
    - [120, 7559.0]
  - - [128, 1856, 1, 3328, 128, 128, 3328, 3328]
    - [115, 8377.0]
  - - [2368, 64, 1, 3328, 2368, 2368, 3328, 3328]
    - [120, 6586.0]
  - - [32, 5056, 1, 3328, 32, 32, 3328, 3328]
    - [138, 6901.0]
  - - [64, 1856, 1, 1, 64, 64, 1, 1]
    - [112, 78.0]
  - - [704, 128, 1, 32, 704, 704, 32, 32]
    - [112, 1677.0]
  - - [4288, 64, 1, 1, 4288, 4288, 1, 1]
    - [114, 165.0]
  - - [5056, 32, 1, 1280, 5056, 5056, 1280, 1280]
    - [156, 6821.0]
  - - [128, 1024, 1, 1, 128, 128, 1, 1]
    - [114, 86.0]
  - - [256, 1024, 1, 1, 256, 256, 1, 1]
    - [114, 162.0]
  - - [1408, 64, 1, 1280, 1408, 1408, 1280, 1280]
    - [119, 5693.0]
  - - [1024, 256, 1, 32, 1024, 1024, 32, 32]
    - [150, 3679.0]
  - - [2368, 32, 1, 1280, 2368, 2368, 1280, 1280]
    - [119, 4741.0]
  - - [704, 128, 1, 1, 704, 704, 1, 1]
    - [114, 59.0]
  - - [256, 448, 1, 256, 256, 256, 256, 256]
    - [120, 5417.0]
  - - [32, 4288, 1, 256, 32, 32, 256, 256]
    - [120, 6077.0]
  - - [128, 1408, 1, 32, 128, 128, 32, 32]
    - [110, 2746.0]
  - - [704, 128, 1, 3328, 704, 704, 3328, 3328]
    - [146, 5778.0]
  - - [64, 4288, 1, 256, 64, 64, 256, 256]
    - [123, 8020.0]
  - - [4288, 32, 1, 1280, 4288, 4288, 1280, 1280]
    - [156, 6937.0]
  - - [32, 5056, 1, 256, 32, 32, 256, 256]
    - [120, 6091.0]
  - - [704, 128, 1, 256, 704, 704, 256, 256]
    - [119, 4689.0]
  - - [256, 1024, 1, 32, 256, 256, 32, 32]
    - [131, 3647.0]
  - - [256, 1024, 1, 1280, 256, 256, 1280, 1280]
    - [133, 9054.0]
  - - [6784, 32, 1, 256, 6784, 6784, 256, 256]
    - [120, 6538.0]
  - - [64, 2368, 1, 1, 64, 64, 1, 1]
    - [112, 98.0]
  - - [1408, 128, 1, 256, 1408, 1408, 256, 256]
    - [138, 6320.0]
  - - [5888, 32, 1, 3328, 5888, 5888, 3328, 3328]
    - [138, 7449.0]
  - - [64, 2368, 1, 3328, 64, 64, 3328, 3328]
    - [120, 6920.0]
  - - [256, 704, 1, 3328, 256, 256, 3328, 3328]
    - [111, 8092.0]
  - - [128, 1408, 1, 3328, 128, 128, 3328, 3328]
    - [111, 7919.0]
  - - [2944, 32, 1, 3328, 2944, 2944, 3328, 3328]
    - [138, 5721.0]
  - - [2368, 64, 1, 1280, 2368, 2368, 1280, 1280]
    - [138, 6402.0]
  - - [128, 1024, 1, 1280, 128, 128, 1280, 1280]
    - [131, 7307.0]
  - - [128, 1024, 1, 256, 128, 128, 256, 256]
    - [120, 6123.0]
  - - [3584, 64, 1, 3328, 3584, 3584, 3328, 3328]
    - [115, 7924.0]
  - - [256, 448, 1, 1, 256, 256, 1, 1]
    - [114, 74.0]
  - - [256, 448, 1, 32, 256, 256, 32, 32]
    - [112, 1973.0]
  - - [64, 3584, 1, 32, 64, 64, 32, 32]
    - [150, 3367.0]
  - - [64, 3584, 1, 1280, 64, 64, 1280, 1280]
    - [150, 7784.0]
  - - [4288, 32, 1, 256, 4288, 4288, 256, 256]
    - [120, 6015.0]
  - - [448, 256, 1, 1280, 448, 448, 1280, 1280]
    - [140, 6122.0]
  - - [128, 1856, 1, 256, 128, 128, 256, 256]
    - [150, 7121.0]
  - - [3584, 32, 1, 3328, 3584, 3584, 3328, 3328]
    - [120, 6220.0]
  - - [6784, 32, 1, 3328, 6784, 6784, 3328, 3328]
    - [138, 7556.0]
  - - [2944, 64, 1, 256, 2944, 2944, 256, 256]
    - [120, 6718.0]
  - - [64, 1408, 1, 256, 64, 64, 256, 256]
    - [119, 4708.0]
  - - [5056, 32, 1, 32, 5056, 5056, 32, 32]
    - [145, 2563.0]
  - - [32, 5888, 1, 3328, 32, 32, 3328, 3328]
    - [138, 7490.0]
  - - [704, 256, 1, 256, 704, 704, 256, 256]
    - [138, 7033.0]
  - - [1024, 256, 1, 196, 1024, 1024, 196, 196]
    - [150, 7382.0]
  - - [256, 1024, 1, 196, 256, 256, 196, 196]
    - [150, 7490.0]
  - - [1760, 64, 1, 1760, 1760, 1760, 1760, 1760]
    - [111, 7481.0]
  - - [2560, 32, 1, 2560, 2560, 2560, 2560, 2560]
    - [124, 4864.0]
  - - [4608, 32, 1, 1536, 4608, 4608, 1536, 1536]
    - [162, 6843.0]
  - - [3072, 64, 1, 1024, 3072, 3072, 1024, 1024]
    - [140, 6811.0]
  - - [2048, 128, 1, 2048, 2048, 2048, 2048, 2048]
    - [160, 8886.0]
  - - [4096, 64, 1, 4096, 4096, 4096, 4096, 4096]
    - [160, 8552.0]
  - - [7680, 32, 1, 2560, 7680, 7680, 2560, 2560]
    - [125, 6485.0]
  - - [2560, 64, 1, 2560, 2560, 2560, 2560, 2560]
    - [125, 6012.0]
  - - [1760, 128, 1, 1760, 1760, 1760, 1760, 1760]
    - [111, 8714.0]
  - - [3072, 32, 1, 1024, 3072, 3072, 1024, 1024]
    - [125, 5377.0]
  - - [6144, 32, 1, 2560, 6144, 6144, 2560, 2560]
    - [143, 6288.0]
  - - [4096, 32, 1, 4096, 4096, 4096, 4096, 4096]
    - [125, 6318.0]
  - - [2048, 64, 1, 2048, 2048, 2048, 2048, 2048]
    - [125, 6214.0]
  - - [8448, 32, 1, 2816, 8448, 8448, 2816, 2816]
    - [158, 7573.0]
  - - [512, 512, 1, 512, 512, 512, 512, 512]
    - [123, 8604.0]
  - - [511, 512, 1, 512, 511, 511, 512, 512]
    - [123, 8310.0]
  - - [512, 512, 1, 511, 512, 512, 511, 511]
    - [133, 8620.0]
  - - [512, 513, 1, 512, 512, 512, 512, 512]
    - [123, 8437.0]
  - - [512, 511, 1, 512, 512, 512, 512, 512]
    - [123, 8341.0]
  - - [513, 512, 1, 512, 513, 513, 512, 512]
    - [141, 6953.0]
  - - [512, 512, 1, 513, 512, 512, 513, 513]
    - [133, 8632.0]
  - - [512, 512, 1, 64, 512, 512, 64, 64]
    - [123, 5343.0]
  - - [33, 33, 1600, 32, 33, 33, 32, 32]
    - [145, 3150.0]
  - - [256, 684, 1, 1024, 256, 256, 1024, 1024]
    - [140, 6896.0]
  - - [1024, 200, 1, 560, 1024, 1024, 560, 560]
    - [146, 7314.0]
  - - [2048, 114, 1, 512, 2048, 2048, 512, 512]
    - [141, 7452.0]
  - - [2048, 114, 1, 768, 2048, 2048, 768, 768]
    - [141, 7796.0]
  - - [32, 32, 4608, 64, 32, 32, 64, 64]
    - [114, 6879.0]
  - - [32, 35, 4608, 64, 32, 32, 64, 64]
    - [146, 5243.0]
  - - [34, 34, 4736, 64, 34, 34, 64, 64]
    - [145, 3352.0]
  - - [35, 35, 4608, 64, 35, 35, 64, 64]
    - [137, 3463.0]
  - - [33, 33, 1920, 64, 33, 33, 64, 64]
    - [128, 3149.0]
  - - [480, 512, 1, 512, 480, 480, 512, 512]
    - [123, 7924.0]
  - - [512, 480, 1, 512, 512, 512, 512, 512]
    - [123, 7884.0]
  - - [1024, 200, 1, 1024, 1024, 1024, 1024, 1024]
    - [123, 6912.0]
  - - [1024, 308, 1, 1024, 1024, 1024, 1024, 1024]
    - [123, 7294.0]
  - - [1024, 160, 1, 1024, 1024, 1024, 1024, 1024]
    - [120, 5928.0]
  - - [1024, 180, 1, 1024, 1024, 1024, 1024, 1024]
    - [158, 6929.0]
  - - [128, 864, 1, 256, 128, 128, 256, 256]
    - [120, 5243.0]
  - - [256, 864, 1, 512, 256, 256, 512, 512]
    - [123, 7078.0]
  - - [1152, 128, 1, 784, 1152, 1152, 784, 784]
    - [120, 8269.0]
  - - [256, 512, 1, 784, 256, 256, 784, 784]
    - [146, 7856.0]
  - - [512, 256, 1, 784, 512, 512, 784, 784]
    - [129, 7726.0]
  - - [1024, 128, 1, 1024, 1024, 1024, 1024, 1024]
    - [141, 7005.0]
  - - [1024, 96, 1, 1024, 1024, 1024, 1024, 1024]
    - [156, 5949.0]
  - - [1024, 256, 1, 3800, 1024, 1024, 3800, 3800]
    - [133, 9424.0]
  - - [1024, 256, 1, 3400, 1024, 1024, 3400, 3400]
    - [133, 9416.0]
  - - [256, 1024, 1, 3400, 256, 256, 3400, 3400]
    - [115, 9584.0]
  - - [1024, 256, 1, 3220, 1024, 1024, 3220, 3220]
    - [133, 9309.0]
  - - [256, 1024, 1, 3220, 256, 256, 3220, 3220]
    - [133, 9398.0]
  - - [1024, 256, 1, 3456, 1024, 1024, 3456, 3456]
    - [115, 9390.0]
  - - [256, 1024, 1, 3456, 256, 256, 3456, 3456]
    - [133, 9406.0]
  - - [1024, 256, 1, 3072, 1024, 1024, 3072, 3072]
    - [141, 8772.0]
  - - [256, 1024, 1, 3072, 256, 256, 3072, 3072]
    - [123, 8710.0]
  - - [1024, 256, 1, 3552, 1024, 1024, 3552, 3552]
    - [115, 9386.0]
  - - [256, 1024, 1, 3552, 256, 256, 3552, 3552]
    - [133, 9385.0]
  - - [256, 1024, 1, 2852, 256, 256, 2852, 2852]
    - [133, 9392.0]
  - - [1024, 256, 1, 2852, 1024, 1024, 2852, 2852]
    - [150, 9355.0]
  - - [256, 512, 1, 10752, 256, 256, 10752, 10752]
    - [158, 6910.0]
  - - [256, 1024, 1, 3800, 256, 256, 3800, 3800]
    - [115, 9595.0]
  - - [256, 512, 1, 10560, 256, 256, 10560, 10560]
    - [129, 9379.0]
  - - [256, 1024, 1, 2992, 256, 256, 2992, 2992]
    - [150, 9369.0]
  - - [256, 1024, 1, 2688, 256, 256, 2688, 2688]
    - [150, 9360.0]
  - - [1024, 256, 1, 2688, 1024, 1024, 2688, 2688]
    - [111, 9358.0]
  - - [256, 1024, 1, 2904, 256, 256, 2904, 2904]
    - [115, 9549.0]
  - - [1024, 256, 1, 2904, 1024, 1024, 2904, 2904]
    - [150, 9405.0]
  - - [256, 1024, 1, 2640, 256, 256, 2640, 2640]
    - [133, 9340.0]
  - - [1024, 256, 1, 2640, 1024, 1024, 2640, 2640]
    - [150, 9491.0]
  - - [1024, 256, 1, 4032, 1024, 1024, 4032, 4032]
    - [111, 9420.0]
  - - [1024, 256, 1, 2992, 1024, 1024, 2992, 2992]
    - [150, 9502.0]
  - - [256, 1024, 1, 3360, 256, 256, 3360, 3360]
    - [133, 9376.0]
  - - [1024, 256, 1, 3360, 1024, 1024, 3360, 3360]
    - [115, 9390.0]
  - - [1024, 256, 1, 3500, 1024, 1024, 3500, 3500]
    - [150, 9453.0]
  - - [256, 1024, 1, 3500, 256, 256, 3500, 3500]
    - [133, 9404.0]
  - - [1024, 256, 1, 3168, 1024, 1024, 3168, 3168]
    - [115, 9375.0]
  - - [256, 1024, 1, 3168, 256, 256, 3168, 3168]
    - [133, 9371.0]
  - - [256, 1024, 1, 3036, 256, 256, 3036, 3036]
    - [115, 9534.0]
  - - [1024, 256, 1, 4200, 1024, 1024, 4200, 4200]
    - [133, 9446.0]
  - - [1024, 256, 1, 3600, 1024, 1024, 3600, 3600]
    - [133, 9527.0]
  - - [256, 1024, 1, 3600, 256, 256, 3600, 3600]
    - [150, 9396.0]
  - - [256, 1024, 1, 2944, 256, 256, 2944, 2944]
    - [133, 9377.0]
  - - [1024, 256, 1, 2944, 1024, 1024, 2944, 2944]
    - [129, 9382.0]
  - - [1024, 256, 1, 3700, 1024, 1024, 3700, 3700]
    - [133, 9422.0]
  - - [256, 1024, 1, 2352, 256, 256, 2352, 2352]
    - [133, 9325.0]
  - - [1024, 256, 1, 2352, 1024, 1024, 2352, 2352]
    - [133, 9468.0]
  - - [1024, 256, 1, 2816, 1024, 1024, 2816, 2816]
    - [133, 9253.0]
  - - [256, 1024, 1, 3700, 256, 256, 3700, 3700]
    - [115, 9552.0]
  - - [256, 1024, 1, 2816, 256, 256, 2816, 2816]
    - [115, 9258.0]
  - - [256, 512, 1, 11408, 256, 256, 11408, 11408]
    - [146, 8948.0]
  - - [1024, 256, 1, 3036, 1024, 1024, 3036, 3036]
    - [150, 9335.0]
  - - [1024, 256, 1, 3264, 1024, 1024, 3264, 3264]
    - [111, 9396.0]
  - - [256, 1024, 1, 3264, 256, 256, 3264, 3264]
    - [150, 9407.0]
  - - [1024, 256, 1, 3864, 1024, 1024, 3864, 3864]
    - [133, 9412.0]
  - - [256, 1024, 1, 4032, 256, 256, 4032, 4032]
    - [115, 9437.0]
  - - [1024, 256, 1, 3128, 1024, 1024, 3128, 3128]
    - [150, 9410.0]
  - - [256, 1024, 1, 3128, 256, 256, 3128, 3128]
    - [115, 9577.0]
  - - [256, 1024, 1, 3200, 256, 256, 3200, 3200]
    - [133, 9398.0]
  - - [256, 512, 1, 11616, 256, 256, 11616, 11616]
    - [146, 9128.0]
  - - [1024, 256, 1, 3200, 1024, 1024, 3200, 3200]
    - [129, 9396.0]
  - - [1024, 256, 1, 4000, 1024, 1024, 4000, 4000]
    - [111, 9413.0]
  - - [256, 1024, 1, 2520, 256, 256, 2520, 2520]
    - [115, 9535.0]
  - - [1024, 256, 1, 2520, 1024, 1024, 2520, 2520]
    - [150, 9360.0]
  - - [256, 1024, 1, 2976, 256, 256, 2976, 2976]
    - [150, 9368.0]
  - - [256, 1024, 1, 2400, 256, 256, 2400, 2400]
    - [150, 9334.0]
  - - [1024, 256, 1, 2400, 1024, 1024, 2400, 2400]
    - [111, 9312.0]
  - - [1024, 256, 1, 3696, 1024, 1024, 3696, 3696]
    - [150, 9521.0]
  - - [1024, 256, 1, 3900, 1024, 1024, 3900, 3900]
    - [133, 9416.0]
  - - [1024, 256, 1, 3772, 1024, 1024, 3772, 3772]
    - [150, 9405.0]
  - - [256, 1024, 1, 3696, 256, 256, 3696, 3696]
    - [123, 9388.0]
  - - [256, 1024, 1, 2728, 256, 256, 2728, 2728]
    - [115, 9540.0]
  - - [1024, 256, 1, 2728, 1024, 1024, 2728, 2728]
    - [150, 9380.0]
  - - [1024, 256, 1, 2480, 1024, 1024, 2480, 2480]
    - [133, 9447.0]
  - - [256, 1024, 1, 2480, 256, 256, 2480, 2480]
    - [150, 9330.0]
  - - [1024, 256, 1, 2880, 1024, 1024, 2880, 2880]
    - [111, 9386.0]
  - - [512, 256, 1, 3220, 512, 512, 3220, 3220]
    - [111, 7065.0]
  - - [256, 1024, 1, 2880, 256, 256, 2880, 2880]
    - [150, 9390.0]
  - - [256, 1024, 1, 4200, 256, 256, 4200, 4200]
    - [115, 9616.0]
  - - [1024, 256, 1, 3648, 1024, 1024, 3648, 3648]
    - [115, 9407.0]
  - - [1024, 256, 1, 3312, 1024, 1024, 3312, 3312]
    - [150, 9514.0]
  - - [256, 1024, 1, 3648, 256, 256, 3648, 3648]
    - [150, 9422.0]
  - - [1024, 256, 1, 3300, 1024, 1024, 3300, 3300]
    - [133, 9372.0]
  - - [1024, 256, 1, 3528, 1024, 1024, 3528, 3528]
    - [150, 9426.0]
  - - [256, 1024, 1, 2604, 256, 256, 2604, 2604]
    - [133, 9395.0]
  - - [1024, 256, 1, 2604, 1024, 1024, 2604, 2604]
    - [133, 9377.0]
  - - [512, 256, 1, 11408, 512, 512, 11408, 11408]
    - [111, 8703.0]
  - - [256, 1024, 1, 3312, 256, 256, 3312, 3312]
    - [150, 9384.0]
  - - [256, 1024, 1, 3300, 256, 256, 3300, 3300]
    - [115, 9546.0]
  - - [512, 256, 1, 3072, 512, 512, 3072, 3072]
    - [160, 6515.0]
  - - [256, 1024, 1, 3528, 256, 256, 3528, 3528]
    - [115, 9590.0]
  - - [1024, 256, 1, 2976, 1024, 1024, 2976, 2976]
    - [115, 9374.0]
  - - [1024, 256, 1, 2760, 1024, 1024, 2760, 2760]
    - [150, 9391.0]
  - - [512, 256, 1, 3800, 512, 512, 3800, 3800]
    - [111, 7087.0]
  - - [256, 1024, 1, 2760, 256, 256, 2760, 2760]
    - [115, 9550.0]
  - - [1024, 256, 1, 2160, 1024, 1024, 2160, 2160]
    - [150, 9415.0]
  - - [256, 1024, 1, 2160, 256, 256, 2160, 2160]
    - [150, 9310.0]
  - - [512, 256, 1, 11616, 512, 512, 11616, 11616]
    - [111, 9127.0]
  - - [512, 256, 1, 2852, 512, 512, 2852, 2852]
    - [111, 7024.0]
  - - [256, 1024, 1, 3864, 256, 256, 3864, 3864]
    - [115, 9603.0]
  - - [512, 256, 1, 2640, 512, 512, 2640, 2640]
    - [129, 8399.0]
  - - [256, 1024, 1, 4000, 256, 256, 4000, 4000]
    - [133, 9404.0]
  - - [512, 256, 1, 2904, 512, 512, 2904, 2904]
    - [111, 7104.0]
  - - [256, 1024, 1, 3900, 256, 256, 3900, 3900]
    - [150, 9367.0]
  - - [512, 256, 1, 2688, 512, 512, 2688, 2688]
    - [111, 8764.0]
  - - [256, 1024, 1, 3772, 256, 256, 3772, 3772]
    - [150, 9364.0]
  - - [512, 256, 1, 3400, 512, 512, 3400, 3400]
    - [111, 7105.0]
  - - [512, 256, 1, 3456, 512, 512, 3456, 3456]
    - [146, 8834.0]
  - - [512, 256, 1, 3552, 512, 512, 3552, 3552]
    - [129, 9150.0]
  - - [128, 64, 25, 6498, 128, 128, 6498, 6498]
    - [129, 9096.0]
  - - [128, 64, 25, 6859, 128, 128, 6859, 6859]
    - [129, 9002.0]
  - - [64, 64, 64, 3042, 64, 64, 3042, 3042]
    - [141, 9200.0]
  - - [64, 64, 64, 3211, 64, 64, 3211, 3211]
    - [133, 9177.0]
  - - [64, 64, 49, 4050, 64, 64, 4050, 4050]
    - [146, 9123.0]
  - - [64, 64, 49, 4275, 64, 64, 4275, 4275]
    - [111, 9087.0]
  - - [64, 64, 36, 6498, 64, 64, 6498, 6498]
    - [129, 7718.0]
  - - [64, 64, 36, 6859, 64, 64, 6859, 6859]
    - [146, 7737.0]
  - - [1152, 128, 1, 1444, 1152, 1152, 1444, 1444]
    - [111, 7519.0]
  - - [512, 256, 1, 361, 512, 512, 361, 361]
    - [129, 5756.0]
  - - [576, 128, 1, 1444, 576, 576, 1444, 1444]
    - [119, 5209.0]
  - - [29000, 35, 1, 2560, 29000, 29000, 2560, 2560]
    - [141, 5617.0]
  - - [29000, 36, 1, 2560, 29000, 29000, 2560, 2560]
    - [160, 5774.0]
  - - [29000, 39, 1, 2560, 29000, 29000, 2560, 2560]
    - [160, 6249.0]
  - - [29000, 40, 1, 2560, 29000, 29000, 2560, 2560]
    - [141, 6395.0]
  - - [29000, 42, 1, 2560, 29000, 29000, 2560, 2560]
    - [141, 6693.0]
  - - [29000, 43, 1, 2560, 29000, 29000, 2560, 2560]
    - [160, 6847.0]
  - - [29000, 44, 1, 2560, 29000, 29000, 2560, 2560]
    - [160, 7004.0]
  - - [29000, 46, 1, 2560, 29000, 29000, 2560, 2560]
    - [141, 7271.0]
  - - [29000, 48, 1, 2560, 29000, 29000, 2560, 2560]
    - [160, 7512.0]
  - - [29000, 49, 1, 2560, 29000, 29000, 2560, 2560]
    - [123, 7604.0]
  - - [29000, 50, 1, 2560, 29000, 29000, 2560, 2560]
    - [160, 7680.0]
  - - [29000, 51, 1, 2560, 29000, 29000, 2560, 2560]
    - [160, 8020.0]
  - - [29000, 53, 1, 2560, 29000, 29000, 2560, 2560]
    - [123, 8211.0]
  - - [29000, 54, 1, 2560, 29000, 29000, 2560, 2560]
    - [141, 8018.0]
  - - [29000, 55, 1, 2560, 29000, 29000, 2560, 2560]
    - [141, 8531.0]
  - - [29000, 56, 1, 2560, 29000, 29000, 2560, 2560]
    - [141, 8305.0]
  - - [29000, 57, 1, 2560, 29000, 29000, 2560, 2560]
    - [160, 8374.0]
  - - [29000, 58, 1, 2560, 29000, 29000, 2560, 2560]
    - [160, 8480.0]
  - - [29000, 59, 1, 2560, 29000, 29000, 2560, 2560]
    - [160, 8592.0]
  - - [29000, 61, 1, 2560, 29000, 29000, 2560, 2560]
    - [160, 8653.0]
  - - [29000, 63, 1, 2560, 29000, 29000, 2560, 2560]
    - [123, 8941.0]
  - - [256, 128, 1, 13600, 256, 256, 13600, 13600]
    - [165, 6012.0]
  - - [256, 128, 1, 12880, 256, 256, 12880, 12880]
    - [170, 6060.0]
  - - [128, 512, 1, 15200, 128, 128, 15200, 15200]
    - [166, 8571.0]
  - - [512, 128, 1, 15200, 512, 512, 15200, 15200]
    - [170, 8396.0]
  - - [128, 512, 1, 11408, 128, 128, 11408, 11408]
    - [166, 8265.0]
  - - [256, 128, 1, 13824, 256, 256, 13824, 13824]
    - [178, 5511.0]
  - - [128, 512, 1, 11616, 128, 128, 11616, 11616]
    - [166, 8287.0]
  - - [256, 128, 1, 14208, 256, 256, 14208, 14208]
    - [175, 7108.0]
  - - [128, 512, 1, 14208, 128, 128, 14208, 14208]
    - [176, 8514.0]
  - - [256, 128, 1, 15200, 256, 256, 15200, 15200]
    - [165, 6167.0]
  - - [512, 128, 1, 11408, 512, 512, 11408, 11408]
    - [170, 8223.0]
  - - [512, 128, 1, 16800, 512, 512, 16800, 16800]
    - [175, 8536.0]
  - - [128, 512, 1, 11264, 128, 128, 11264, 11264]
    - [180, 7642.0]
  - - [512, 128, 1, 11616, 512, 512, 11616, 11616]
    - [175, 8219.0]
  - - [512, 128, 1, 16128, 512, 512, 16128, 16128]
    - [166, 8321.0]
  - - [512, 128, 1, 11968, 512, 512, 11968, 11968]
    - [166, 8323.0]
  - - [128, 512, 1, 11968, 128, 128, 11968, 11968]
    - [176, 8340.0]
  - - [512, 128, 1, 12288, 512, 512, 12288, 12288]
    - [176, 7364.0]
  - - [128, 512, 1, 12288, 128, 128, 12288, 12288]
    - [174, 7754.0]
  - - [128, 512, 1, 12672, 128, 128, 12672, 12672]
    - [176, 8389.0]
  - - [512, 128, 1, 11776, 512, 512, 11776, 11776]
    - [166, 7938.0]
  - - [512, 128, 1, 12144, 512, 512, 12144, 12144]
    - [175, 8277.0]
  - - [512, 128, 1, 11264, 512, 512, 11264, 11264]
    - [166, 7621.0]
  - - [128, 512, 1, 12144, 128, 128, 12144, 12144]
    - [176, 8342.0]
  - - [512, 128, 1, 12672, 512, 512, 12672, 12672]
    - [170, 8367.0]
  - - [128, 512, 1, 12512, 128, 128, 12512, 12512]
    - [166, 8383.0]
  - - [128, 512, 1, 11776, 128, 128, 11776, 11776]
    - [176, 7759.0]
  - - [256, 128, 1, 12288, 256, 256, 12288, 12288]
    - [169, 5396.0]
  - - [40, 40, 1, 1909283, 40, 40, 1909283, 1909283]
    - [179, 842.0]
  - - [40, 40, 1, 3818566, 40, 40, 3818566, 3818566]
    - [179, 841.0]
  - - [5888, 1, 1, 3328, 5888, 5888, 3328, 3328]
    - [189, 386.0]
  - - [5056, 1, 1, 3328, 5056, 5056, 3328, 3328]
    - [187, 360.0]
  - - [6784, 1, 1, 1280, 6784, 6784, 1280, 1280]
    - [184, 341.0]
  - - [2944, 1, 1, 3328, 2944, 2944, 3328, 3328]
    - [186, 303.0]
  - - [3584, 1, 1, 1280, 3584, 3584, 1280, 1280]
    - [185, 302.0]
  - - [6784, 1, 1, 256, 6784, 6784, 256, 256]
    - [187, 319.0]
  - - [4288, 1, 1, 1280, 4288, 4288, 1280, 1280]
    - [185, 355.0]
  - - [5056, 1, 1, 1280, 5056, 5056, 1280, 1280]
    - [189, 344.0]
  - - [3584, 1, 1, 256, 3584, 3584, 256, 256]
    - [189, 210.0]
  - - [6784, 1, 1, 3328, 6784, 6784, 3328, 3328]
    - [184, 352.0]
  - - [1408, 1, 1, 1280, 1408, 1408, 1280, 1280]
    - [185, 147.0]
  - - [1408, 32, 1, 3328, 1408, 1408, 3328, 3328]
    - [147, 4163.0]
  - - [4288, 1, 1, 256, 4288, 4288, 256, 256]
    - [185, 246.0]
  - - [2368, 1, 1, 256, 2368, 2368, 256, 256]
    - [190, 153.0]
  - - [1856, 32, 1, 32, 1856, 1856, 32, 32]
    - [182, 1118.0]
  - - [5056, 1, 1, 256, 5056, 5056, 256, 256]
    - [187, 277.0]
  - - [5056, 1, 1, 1, 5056, 5056, 1, 1]
    - [182, 3.0]
  - - [1408, 1, 1, 256, 1408, 1408, 256, 256]
    - [121, 98.0]
  - - [1408, 1, 1, 1, 1408, 1408, 1, 1]
    - [182, 1.0]
  - - [4288, 1, 1, 3328, 4288, 4288, 3328, 3328]
    - [185, 384.0]
  - - [2368, 1, 1, 1280, 2368, 2368, 1280, 1280]
    - [186, 229.0]
  - - [1856, 1, 1, 1, 1856, 1856, 1, 1]
    - [182, 1.0]
  - - [1856, 32, 1, 256, 1856, 1856, 256, 256]
    - [130, 3364.0]
  - - [1408, 32, 1, 32, 1408, 1408, 32, 32]
    - [182, 869.0]
  - - [1856, 32, 1, 1280, 1856, 1856, 1280, 1280]
    - [130, 4281.0]
  - - [1408, 1, 1, 3328, 1408, 1408, 3328, 3328]
    - [185, 161.0]
  - - [5888, 1, 1, 256, 5888, 5888, 256, 256]
    - [189, 309.0]
  - - [5888, 1, 1, 1, 5888, 5888, 1, 1]
    - [182, 4.0]
  - - [1856, 32, 1, 3328, 1856, 1856, 3328, 3328]
    - [147, 4616.0]
  - - [2368, 1, 1, 3328, 2368, 2368, 3328, 3328]
    - [183, 248.0]
  - - [6784, 1, 1, 1, 6784, 6784, 1, 1]
    - [182, 4.0]
  - - [5888, 1, 1, 1280, 5888, 5888, 1280, 1280]
    - [187, 362.0]
  - - [2944, 1, 1, 256, 2944, 2944, 256, 256]
    - [185, 189.0]
  - - [2944, 1, 1, 1, 2944, 2944, 1, 1]
    - [182, 2.0]
  - - [1408, 32, 1, 1280, 1408, 1408, 1280, 1280]
    - [121, 3764.0]
  - - [1856, 1, 1, 1280, 1856, 1856, 1280, 1280]
    - [185, 193.0]
  - - [3584, 1, 1, 1, 3584, 3584, 1, 1]
    - [182, 2.0]
  - - [2944, 1, 1, 1280, 2944, 2944, 1280, 1280]
    - [190, 278.0]
  - - [3584, 1, 1, 3328, 3584, 3584, 3328, 3328]
    - [185, 323.0]
  - - [1856, 1, 1, 3328, 1856, 1856, 3328, 3328]
    - [185, 211.0]
  - - [4288, 1, 1, 1, 4288, 4288, 1, 1]
    - [182, 3.0]
  - - [1856, 1, 1, 256, 1856, 1856, 256, 256]
    - [121, 127.0]
  - - [1408, 32, 1, 256, 1408, 1408, 256, 256]
    - [121, 2942.0]
  - - [2368, 1, 1, 1, 2368, 2368, 1, 1]
    - [182, 1.0]
  - - [1760, 32, 1, 1760, 1760, 1760, 1760, 1760]
    - [147, 4332.0]
  - - [3072, 16, 1, 1024, 3072, 3072, 1024, 1024]
    - [163, 3701.0]
  - - [2560, 16, 1, 2560, 2560, 2560, 2560, 2560]
    - [126, 3365.0]
  - - [2048, 32, 1, 2048, 2048, 2048, 2048, 2048]
    - [139, 4137.0]
  - - [1760, 16, 1, 1760, 1760, 1760, 1760, 1760]
    - [153, 2756.0]
  - - [7680, 16, 1, 2560, 7680, 7680, 2560, 2560]
    - [163, 4340.0]
  - - [8448, 16, 1, 2816, 8448, 8448, 2816, 2816]
    - [139, 4475.0]
  - - [4608, 16, 1, 1536, 4608, 4608, 1536, 1536]
    - [144, 4417.0]
  - - [6144, 16, 1, 2560, 6144, 6144, 2560, 2560]
    - [126, 4072.0]
  - - [4096, 16, 1, 4096, 4096, 4096, 4096, 4096]
    - [126, 4135.0]
  - - [2048, 16, 1, 2048, 2048, 2048, 2048, 2048]
    - [144, 3026.0]
  - - [2048, 2, 1, 2048, 2048, 2048, 2048, 2048]
    - [188, 461.0]
  - - [2560, 4, 1, 2560, 2560, 2560, 2560, 2560]
    - [190, 1046.0]
  - - [32768, 1, 1, 256, 32768, 32768, 256, 256]
    - [188, 392.0]
  - - [1600, 1, 1, 1024, 1600, 1600, 1024, 1024]
    - [185, 161.0]
  - - [3456, 1, 1, 256, 3456, 3456, 256, 256]
    - [189, 204.0]
  - - [4096, 1, 1, 256, 4096, 4096, 256, 256]
    - [185, 238.0]
  - - [6912, 1, 1, 256, 6912, 6912, 256, 256]
    - [187, 315.0]
  - - [2048, 8, 1, 2048, 2048, 2048, 2048, 2048]
    - [185, 1877.0]
  - - [2560, 2, 1, 2560, 2560, 2560, 2560, 2560]
    - [190, 515.0]
  - - [29000, 27, 1, 2560, 29000, 29000, 2560, 2560]
    - [144, 4020.0]
  - - [1, 4288, 1, 1280, 1, 1, 1280, 1280]
    - [119, 332.0]
  - - [32, 1408, 1, 32, 32, 32, 32, 32]
    - [110, 879.0]
  - - [1, 1408, 1, 3328, 1, 1, 3328, 3328]
    - [134, 185.0]
  - - [1, 2368, 1, 1280, 1, 1, 1280, 1280]
    - [124, 228.0]
  - - [1, 5888, 1, 3328, 1, 1, 3328, 3328]
    - [119, 359.0]
  - - [1, 1856, 1, 256, 1, 1, 256, 256]
    - [119, 134.0]
  - - [1, 3584, 1, 3328, 1, 1, 3328, 3328]
    - [119, 305.0]
  - - [1, 6784, 1, 3328, 1, 1, 3328, 3328]
    - [119, 400.0]
  - - [1, 2368, 1, 256, 1, 1, 256, 256]
    - [119, 155.0]
  - - [32, 1856, 1, 3328, 32, 32, 3328, 3328]
    - [192, 5776.0]
  - - [1, 2944, 1, 1280, 1, 1, 1280, 1280]
    - [119, 271.0]
  - - [1, 1856, 1, 3328, 1, 1, 3328, 3328]
    - [124, 236.0]
  - - [1, 1408, 1, 1, 1, 1, 1, 1]
    - [110, 1.0]
  - - [1, 6784, 1, 256, 1, 1, 256, 256]
    - [119, 279.0]
  - - [1, 6784, 1, 1, 1, 1, 1, 1]
    - [110, 4.0]
  - - [1, 4288, 1, 3328, 1, 1, 3328, 3328]
    - [119, 352.0]
  - - [1, 2368, 1, 3328, 1, 1, 3328, 3328]
    - [124, 246.0]
  - - [1, 5888, 1, 1280, 1, 1, 1280, 1280]
    - [119, 349.0]
  - - [1, 2944, 1, 256, 1, 1, 256, 256]
    - [119, 189.0]
  - - [1, 6784, 1, 1280, 1, 1, 1280, 1280]
    - [119, 385.0]
  - - [1, 5056, 1, 1, 1, 1, 1, 1]
    - [110, 3.0]
  - - [32, 1856, 1, 32, 32, 32, 32, 32]
    - [145, 1159.0]
  - - [32, 1408, 1, 256, 32, 32, 256, 256]
    - [119, 3068.0]
  - - [1, 5888, 1, 1, 1, 1, 1, 1]
    - [110, 4.0]
  - - [1, 2944, 1, 3328, 1, 1, 3328, 3328]
    - [119, 287.0]
  - - [1, 3584, 1, 1, 1, 1, 1, 1]
    - [110, 2.0]
  - - [1, 1408, 1, 256, 1, 1, 256, 256]
    - [119, 105.0]
  - - [1, 1856, 1, 1, 1, 1, 1, 1]
    - [110, 1.0]
  - - [1, 5056, 1, 1280, 1, 1, 1280, 1280]
    - [119, 339.0]
  - - [1, 5888, 1, 256, 1, 1, 256, 256]
    - [191, 258.0]
  - - [32, 1856, 1, 1280, 32, 32, 1280, 1280]
    - [193, 5354.0]
  - - [1, 2368, 1, 1, 1, 1, 1, 1]
    - [110, 2.0]
  - - [1, 1408, 1, 1280, 1, 1, 1280, 1280]
    - [116, 169.0]
  - - [1, 5056, 1, 256, 1, 1, 256, 256]
    - [119, 250.0]
  - - [1, 3584, 1, 1280, 1, 1, 1280, 1280]
    - [119, 294.0]
  - - [1, 4288, 1, 256, 1, 1, 256, 256]
    - [119, 235.0]
  - - [1, 4288, 1, 1, 1, 1, 1, 1]
    - [110, 3.0]
  - - [1, 2944, 1, 1, 1, 1, 1, 1]
    - [110, 2.0]
  - - [32, 1408, 1, 3328, 32, 32, 3328, 3328]
    - [116, 4663.0]
  - - [1, 5056, 1, 3328, 1, 1, 3328, 3328]
    - [119, 358.0]
  - - [32, 1856, 1, 256, 32, 32, 256, 256]
    - [192, 3763.0]
  - - [1, 1856, 1, 1280, 1, 1, 1280, 1280]
    - [116, 214.0]
  - - [1, 3584, 1, 256, 1, 1, 256, 256]
    - [119, 209.0]
  - - [32, 1408, 1, 1280, 32, 32, 1280, 1280]
    - [124, 4304.0]
  - - [2, 2048, 1, 1024, 2, 2, 1024, 1024]
    - [124, 445.0]
  - - [32, 1600, 1, 512, 32, 32, 512, 512]
    - [119, 4096.0]
  - - [1, 4096, 1, 256, 1, 1, 256, 256]
    - [119, 226.0]
  - - [1, 6912, 1, 256, 1, 1, 256, 256]
    - [119, 286.0]
  - - [2, 2048, 1, 768, 2, 2, 768, 768]
    - [161, 425.0]
  - - [2, 4608, 1, 768, 2, 2, 768, 768]
    - [119, 665.0]
  - - [2, 4608, 1, 1024, 2, 2, 1024, 1024]
    - [124, 614.0]
  - - [512, 16, 1, 500000, 512, 512, 500000, 500000]
    - [179, 2976.0]
  - - [1024, 8, 1, 500000, 1024, 1024, 500000, 500000]
    - [177, 2085.0]
  - - [1024, 16, 1, 500000, 1024, 1024, 500000, 500000]
    - [171, 4170.0]
  - - [512, 8, 1, 500000, 512, 512, 500000, 500000]
    - [173, 1497.0]
  - - [147, 64, 1, 12544, 147, 147, 12544, 12544]
    - [167, 2956.0]
  - - [256, 128, 1, 10752, 256, 256, 10752, 10752]
    - [172, 5311.0]
  - - [256, 128, 1, 10560, 256, 256, 10560, 10560]
    - [175, 6858.0]
  - - [256, 128, 1, 11408, 256, 256, 11408, 11408]
    - [175, 5922.0]
  - - [256, 12, 1, 11408, 256, 256, 11408, 11408]
    - [173, 1156.0]
  - - [256, 128, 1, 11616, 256, 256, 11616, 11616]
    - [165, 5920.0]
  - - [256, 12, 1, 11616, 256, 256, 11616, 11616]
    - [179, 1169.0]
  - - [256, 12, 1, 12288, 256, 256, 12288, 12288]
    - [181, 1181.0]
  - - [576, 64, 1, 5625, 576, 576, 5625, 5625]
    - [175, 5425.0]
  - - [147, 64, 1, 22500, 147, 147, 22500, 22500]
    - [167, 3414.0]
  - - [11, 11, 1, 1909283, 11, 11, 1909283, 1909283]
    - [168, 84.0]
  - - [11, 11, 1, 3818566, 11, 11, 3818566, 3818566]
    - [168, 59.0]
  - - [448, 1, 1, 256, 448, 448, 256, 256]
    - [112, 27.0]
  - - [704, 64, 1, 3328, 704, 704, 3328, 3328]
    - [116, 4794.0]
  - - [256, 128, 1, 256, 256, 256, 256, 256]
    - [116, 2439.0]
  - - [448, 64, 1, 1, 448, 448, 1, 1]
    - [110, 19.0]
  - - [64, 1024, 1, 1280, 64, 64, 1280, 1280]
    - [119, 5490.0]
  - - [1024, 1, 1, 3328, 1024, 1024, 3328, 3328]
    - [116, 147.0]
  - - [1024, 64, 1, 1280, 1024, 1024, 1280, 1280]
    - [159, 5165.0]
  - - [448, 128, 1, 256, 448, 448, 256, 256]
    - [119, 3784.0]
  - - [1, 1024, 1, 3328, 1, 1, 3328, 3328]
    - [116, 151.0]
  - - [704, 64, 1, 32, 704, 704, 32, 32]
    - [112, 890.0]
  - - [32, 448, 1, 3328, 32, 32, 3328, 3328]
    - [116, 2234.0]
  - - [448, 1, 1, 1, 448, 448, 1, 1]
    - [110, 0.28]
  - - [64, 128, 1, 3328, 64, 64, 3328, 3328]
    - [116, 1303.0]
  - - [64, 128, 1, 1, 64, 64, 1, 1]
    - [110, 5.0]
  - - [256, 128, 1, 1, 256, 256, 1, 1]
    - [114, 22.0]
  - - [256, 32, 1, 3328, 256, 256, 3328, 3328]
    - [142, 1322.0]
  - - [1, 1, 1, 3328, 1, 1, 3328, 3328]
    - [154, 0.16]
  - - [32, 448, 1, 1280, 32, 32, 1280, 1280]
    - [116, 1995.0]
  - - [32, 448, 1, 32, 32, 32, 32, 32]
    - [145, 294.0]
  - - [64, 1024, 1, 32, 64, 64, 32, 32]
    - [112, 1263.0]
  - - [128, 1, 1, 1, 128, 128, 1, 1]
    - [110, 0.08]
  - - [1024, 32, 1, 3328, 1024, 1024, 3328, 3328]
    - [116, 4188.0]
  - - [448, 1, 1, 1280, 448, 448, 1280, 1280]
    - [116, 61.0]
  - - [64, 64, 1, 1280, 64, 64, 1280, 1280]
    - [142, 584.0]
  - - [448, 128, 1, 3328, 448, 448, 3328, 3328]
    - [149, 5019.0]
  - - [128, 256, 1, 1280, 128, 128, 1280, 1280]
    - [151, 3898.0]
  - - [256, 256, 1, 32, 256, 256, 32, 32]
    - [114, 1248.0]
  - - [1024, 1, 1, 256, 1024, 1024, 256, 256]
    - [116, 78.0]
  - - [128, 32, 1, 32, 128, 128, 32, 32]
    - [128, 83.0]
  - - [448, 64, 1, 256, 448, 448, 256, 256]
    - [116, 2185.0]
  - - [128, 256, 1, 3328, 128, 128, 3328, 3328]
    - [134, 4380.0]
  - - [1, 64, 1, 3328, 1, 1, 3328, 3328]
    - [116, 10.0]
  - - [64, 1024, 1, 1, 64, 64, 1, 1]
    - [114, 45.0]
  - - [64, 1024, 1, 3328, 64, 64, 3328, 3328]
    - [114, 5692.0]
  - - [32, 704, 1, 3328, 32, 32, 3328, 3328]
    - [116, 3043.0]
  - - [32, 1024, 1, 3328, 32, 32, 3328, 3328]
    - [124, 4227.0]
  - - [64, 1, 1, 256, 64, 64, 256, 256]
    - [110, 5.0]
  - - [1024, 64, 1, 32, 1024, 1024, 32, 32]
    - [112, 1362.0]
  - - [1024, 64, 1, 3328, 1024, 1024, 3328, 3328]
    - [114, 5731.0]
  - - [32, 1024, 1, 256, 32, 32, 256, 256]
    - [119, 2467.0]
  - - [64, 1, 1, 1, 64, 64, 1, 1]
    - [110, 0.04]
  - - [256, 1, 1, 256, 256, 256, 256, 256]
    - [116, 21.0]
  - - [256, 128, 1, 3328, 256, 256, 3328, 3328]
    - [116, 4429.0]
  - - [64, 64, 1, 1, 64, 64, 1, 1]
    - [110, 3.0]
  - - [32, 704, 1, 1280, 32, 32, 1280, 1280]
    - [124, 2757.0]
  - - [256, 1, 1, 1280, 256, 256, 1280, 1280]
    - [116, 35.0]
  - - [128, 32, 1, 1280, 128, 128, 1280, 1280]
    - [161, 594.0]
  - - [128, 256, 1, 1, 128, 128, 1, 1]
    - [114, 22.0]
  - - [1, 256, 1, 256, 1, 1, 256, 256]
    - [110, 19.0]
  - - [1, 256, 1, 1, 1, 1, 1, 1]
    - [110, 0.16]
  - - [1024, 1, 1, 1280, 1024, 1024, 1280, 1280]
    - [116, 132.0]
  - - [64, 448, 1, 256, 64, 64, 256, 256]
    - [116, 2146.0]
  - - [1024, 32, 1, 1280, 1024, 1024, 1280, 1280]
    - [116, 3745.0]
  - - [256, 256, 1, 3328, 256, 256, 3328, 3328]
    - [114, 5816.0]
  - - [704, 32, 1, 1280, 704, 704, 1280, 1280]
    - [116, 2936.0]
  - - [64, 64, 1, 3328, 64, 64, 3328, 3328]
    - [116, 652.0]
  - - [32, 32, 1, 32, 32, 32, 32, 32]
    - [156, 23.0]
  - - [1024, 32, 1, 32, 1024, 1024, 32, 32]
    - [116, 690.0]
  - - [128, 64, 1, 32, 128, 128, 32, 32]
    - [112, 166.0]
  - - [64, 1, 1, 1280, 64, 64, 1280, 1280]
    - [116, 9.0]
  - - [448, 32, 1, 1280, 448, 448, 1280, 1280]
    - [116, 2021.0]
  - - [704, 32, 1, 3328, 704, 704, 3328, 3328]
    - [116, 3294.0]
  - - [128, 128, 1, 256, 128, 128, 256, 256]
    - [116, 1336.0]
  - - [64, 448, 1, 1280, 64, 64, 1280, 1280]
    - [116, 3529.0]
  - - [64, 256, 1, 1, 64, 64, 1, 1]
    - [110, 11.0]
  - - [256, 256, 1, 256, 256, 256, 256, 256]
    - [119, 4173.0]
  - - [448, 1, 1, 3328, 448, 448, 3328, 3328]
    - [116, 71.0]
  - - [256, 1, 1, 1, 256, 256, 1, 1]
    - [110, 0.16]
  - - [32, 1024, 1, 1280, 32, 32, 1280, 1280]
    - [151, 3758.0]
  - - [1, 256, 1, 3328, 1, 1, 3328, 3328]
    - [116, 40.0]
  - - [256, 32, 1, 256, 256, 256, 256, 256]
    - [116, 672.0]
  - - [256, 128, 1, 1280, 256, 256, 1280, 1280]
    - [124, 3964.0]
  - - [256, 64, 1, 256, 256, 256, 256, 256]
    - [116, 1327.0]
  - - [1, 1, 1, 1, 1, 1, 1, 1]
    - [110, 0.0006097560859125182]
  - - [32, 1024, 1, 32, 32, 32, 32, 32]
    - [114, 664.0]
  - - [128, 256, 1, 256, 128, 128, 256, 256]
    - [119, 2467.0]
  - - [704, 64, 1, 256, 704, 704, 256, 256]
    - [119, 3151.0]
  - - [704, 1, 1, 1, 704, 704, 1, 1]
    - [110, 0.43]
  - - [128, 448, 1, 1280, 128, 128, 1280, 1280]
    - [119, 5155.0]
  - - [448, 32, 1, 32, 448, 448, 32, 32]
    - [112, 290.0]
  - - [704, 64, 1, 1, 704, 704, 1, 1]
    - [110, 30.0]
  - - [704, 32, 1, 256, 704, 704, 256, 256]
    - [116, 1791.0]
  - - [32, 704, 1, 32, 32, 32, 32, 32]
    - [114, 462.0]
  - - [128, 64, 1, 256, 128, 128, 256, 256]
    - [116, 672.0]
  - - [448, 32, 1, 3328, 448, 448, 3328, 3328]
    - [116, 2227.0]
  - - [64, 704, 1, 32, 64, 64, 32, 32]
    - [114, 901.0]
  - - [64, 704, 1, 3328, 64, 64, 3328, 3328]
    - [151, 4794.0]
  - - [448, 64, 1, 1280, 448, 448, 1280, 1280]
    - [116, 3495.0]
  - - [128, 448, 1, 32, 128, 128, 32, 32]
    - [112, 1105.0]
  - - [64, 256, 1, 256, 64, 64, 256, 256]
    - [116, 1344.0]
  - - [64, 704, 1, 1, 64, 64, 1, 1]
    - [110, 30.0]
  - - [1, 1024, 1, 1, 1, 1, 1, 1]
    - [110, 1.0]
  - - [256, 1, 1, 3328, 256, 256, 3328, 3328]
    - [116, 40.0]
  - - [32, 64, 1, 32, 32, 32, 32, 32]
    - [110, 41.0]
  - - [256, 256, 1, 1, 256, 256, 1, 1]
    - [110, 46.0]
  - - [32, 256, 1, 32, 32, 32, 32, 32]
    - [112, 168.0]
  - - [128, 1, 1, 256, 128, 128, 256, 256]
    - [116, 10.0]
  - - [32, 64, 1, 3328, 32, 32, 3328, 3328]
    - [134, 326.0]
  - - [1, 128, 1, 3328, 1, 1, 3328, 3328]
    - [116, 20.0]
  - - [32, 256, 1, 256, 32, 32, 256, 256]
    - [124, 690.0]
  - - [1, 448, 1, 1, 1, 1, 1, 1]
    - [110, 0.28]
  - - [1, 704, 1, 3328, 1, 1, 3328, 3328]
    - [116, 104.0]
  - - [64, 1, 1, 3328, 64, 64, 3328, 3328]
    - [116, 10.0]
  - - [448, 64, 1, 3328, 448, 448, 3328, 3328]
    - [116, 3924.0]
  - - [256, 32, 1, 1280, 256, 256, 1280, 1280]
    - [116, 1152.0]
  - - [128, 448, 1, 3328, 128, 128, 3328, 3328]
    - [119, 5301.0]
  - - [64, 1024, 1, 256, 64, 64, 256, 256]
    - [119, 4132.0]
  - - [64, 32, 1, 32, 64, 64, 32, 32]
    - [164, 42.0]
  - - [1, 448, 1, 3328, 1, 1, 3328, 3328]
    - [116, 71.0]
  - - [1024, 64, 1, 256, 1024, 1024, 256, 256]
    - [119, 4132.0]
  - - [64, 704, 1, 1280, 64, 64, 1280, 1280]
    - [151, 4450.0]
  - - [64, 32, 1, 3328, 64, 64, 3328, 3328]
    - [116, 325.0]
  - - [64, 448, 1, 1, 64, 64, 1, 1]
    - [110, 21.0]
  - - [128, 128, 1, 1280, 128, 128, 1280, 1280]
    - [124, 2280.0]
  - - [64, 128, 1, 256, 64, 64, 256, 256]
    - [116, 672.0]
  - - [64, 448, 1, 32, 64, 64, 32, 32]
    - [112, 573.0]
  - - [128, 64, 1, 3328, 128, 128, 3328, 3328]
    - [142, 1308.0]
  - - [32, 64, 1, 1280, 32, 32, 1280, 1280]
    - [142, 291.0]
  - - [448, 32, 1, 256, 448, 448, 256, 256]
    - [116, 1207.0]
  - - [1024, 32, 1, 256, 1024, 1024, 256, 256]
    - [119, 2453.0]
  - - [1, 128, 1, 256, 1, 1, 256, 256]
    - [116, 10.0]
  - - [32, 256, 1, 1280, 32, 32, 1280, 1280]
    - [151, 1160.0]
  - - [32, 128, 1, 3328, 32, 32, 3328, 3328]
    - [116, 651.0]
  - - [32, 128, 1, 32, 32, 32, 32, 32]
    - [145, 85.0]
  - - [1, 128, 1, 1, 1, 1, 1, 1]
    - [110, 0.08]
  - - [128, 64, 1, 1, 128, 128, 1, 1]
    - [110, 6.0]
  - - [32, 448, 1, 256, 32, 32, 256, 256]
    - [124, 1215.0]
  - - [1, 704, 1, 256, 1, 1, 256, 256]
    - [116, 54.0]
  - - [32, 256, 1, 3328, 32, 32, 3328, 3328]
    - [116, 1302.0]
  - - [256, 32, 1, 32, 256, 256, 32, 32]
    - [112, 166.0]
  - - [64, 256, 1, 3328, 64, 64, 3328, 3328]
    - [116, 2550.0]
  - - [1, 704, 1, 1, 1, 1, 1, 1]
    - [114, 0.45]
  - - [128, 448, 1, 1, 128, 128, 1, 1]
    - [114, 39.0]
  - - [64, 128, 1, 32, 64, 64, 32, 32]
    - [112, 168.0]
  - - [704, 1, 1, 1280, 704, 704, 1280, 1280]
    - [116, 91.0]
  - - [1024, 1, 1, 1, 1024, 1024, 1, 1]
    - [110, 1.0]
  - - [256, 128, 1, 32, 256, 256, 32, 32]
    - [112, 647.0]
  - - [448, 128, 1, 1, 448, 448, 1, 1]
    - [114, 38.0]
  - - [704, 32, 1, 32, 704, 704, 32, 32]
    - [112, 451.0]
  - - [128, 32, 1, 256, 128, 128, 256, 256]
    - [116, 336.0]
  - - [64, 32, 1, 1280, 64, 64, 1280, 1280]
    - [161, 302.0]
  - - [448, 128, 1, 32, 448, 448, 32, 32]
    - [110, 1207.0]
  - - [128, 448, 1, 256, 128, 128, 256, 256]
    - [119, 3823.0]
  - - [32, 32, 1, 256, 32, 32, 256, 256]
    - [142, 86.0]
  - - [256, 64, 1, 32, 256, 256, 32, 32]
    - [116, 364.0]
  - - [1, 1024, 1, 1280, 1, 1, 1280, 1280]
    - [116, 134.0]
  - - [32, 32, 1, 3328, 32, 32, 3328, 3328]
    - [116, 163.0]
  - - [1, 256, 1, 1280, 1, 1, 1280, 1280]
    - [116, 37.0]
  - - [1, 128, 1, 1280, 1, 1, 1280, 1280]
    - [116, 18.0]
  - - [1, 64, 1, 256, 1, 1, 256, 256]
    - [110, 5.0]
  - - [256, 64, 1, 1280, 256, 256, 1280, 1280]
    - [151, 2260.0]
  - - [32, 704, 1, 256, 32, 32, 256, 256]
    - [124, 1769.0]
  - - [1, 64, 1, 1, 1, 1, 1, 1]
    - [110, 0.04]
  - - [704, 64, 1, 1280, 704, 704, 1280, 1280]
    - [116, 4457.0]
  - - [1, 704, 1, 1280, 1, 1, 1280, 1280]
    - [124, 93.0]
  - - [128, 128, 1, 32, 128, 128, 32, 32]
    - [112, 328.0]
  - - [1024, 64, 1, 1, 1024, 1024, 1, 1]
    - [114, 44.0]
  - - [704, 1, 1, 256, 704, 704, 256, 256]
    - [161, 54.0]
  - - [128, 64, 1, 1280, 128, 128, 1280, 1280]
    - [124, 1189.0]
  - - [64, 64, 1, 32, 64, 64, 32, 32]
    - [155, 85.0]
  - - [1, 1, 1, 1280, 1, 1, 1280, 1280]
    - [151, 0.14]
  - - [64, 704, 1, 256, 64, 64, 256, 256]
    - [119, 3169.0]
  - - [1, 448, 1, 1280, 1, 1, 1280, 1280]
    - [116, 62.0]
  - - [64, 256, 1, 32, 64, 64, 32, 32]
    - [112, 332.0]
  - - [32, 128, 1, 1280, 32, 32, 1280, 1280]
    - [116, 580.0]
  - - [128, 128, 1, 3328, 128, 128, 3328, 3328]
    - [116, 2577.0]
  - - [64, 448, 1, 3328, 64, 64, 3328, 3328]
    - [116, 3914.0]
  - - [32, 64, 1, 256, 32, 32, 256, 256]
    - [142, 172.0]
  - - [128, 256, 1, 32, 128, 128, 32, 32]
    - [112, 655.0]
  - - [64, 256, 1, 1280, 64, 64, 1280, 1280]
    - [116, 2275.0]
  - - [64, 64, 1, 256, 64, 64, 256, 256]
    - [116, 334.0]
  - - [448, 64, 1, 32, 448, 448, 32, 32]
    - [145, 573.0]
  - - [64, 128, 1, 1280, 64, 64, 1280, 1280]
    - [124, 1168.0]
  - - [1, 1024, 1, 256, 1, 1, 256, 256]
    - [116, 78.0]
  - - [128, 1, 1, 3328, 128, 128, 3328, 3328]
    - [116, 20.0]
  - - [128, 128, 1, 1, 128, 128, 1, 1]
    - [112, 11.0]
  - - [32, 128, 1, 256, 32, 32, 256, 256]
    - [124, 343.0]
  - - [1, 64, 1, 1280, 1, 1, 1280, 1280]
    - [116, 9.0]
  - - [448, 128, 1, 1280, 448, 448, 1280, 1280]
    - [159, 4503.0]
  - - [256, 64, 1, 1, 256, 256, 1, 1]
    - [110, 11.0]
  - - [256, 256, 1, 1280, 256, 256, 1280, 1280]
    - [119, 5548.0]
  - - [704, 1, 1, 3328, 704, 704, 3328, 3328]
    - [116, 102.0]
  - - [128, 32, 1, 3328, 128, 128, 3328, 3328]
    - [124, 652.0]
  - - [32, 32, 1, 1280, 32, 32, 1280, 1280]
    - [161, 146.0]
  - - [1, 1, 1, 256, 1, 1, 256, 256]
    - [124, 0.09]
  - - [1, 448, 1, 256, 1, 1, 256, 256]
    - [116, 37.0]
  - - [256, 64, 1, 3328, 256, 256, 3328, 3328]
    - [116, 2541.0]
  - - [64, 32, 1, 256, 64, 64, 256, 256]
    - [116, 168.0]
  - - [128, 1, 1, 1280, 128, 128, 1280, 1280]
    - [116, 18.0]
  - - [512, 128, 1, 784, 512, 512, 784, 784]
    - [110, 4969.0]
  - - [256, 64, 1, 3136, 256, 256, 3136, 3136]
    - [116, 2541.0]
  - - [64, 256, 1, 3136, 64, 64, 3136, 3136]
    - [116, 2546.0]
  - - [128, 512, 1, 784, 128, 128, 784, 784]
    - [145, 5087.0]
  - - [64, 64, 1, 3136, 64, 64, 3136, 3136]
    - [151, 648.0]
  - - [14, 14, 1, 64, 14, 14, 64, 64]
    - [161, 7.0]
  - - [15, 14, 1, 64, 15, 15, 64, 64]
    - [116, 10.0]
  - - [15, 15, 1, 64, 15, 15, 64, 64]
    - [116, 10.0]
  - - [17, 15, 1, 64, 17, 17, 64, 64]
    - [112, 11.0]
  - - [17, 17, 1, 64, 17, 17, 64, 64]
    - [110, 11.0]
  - - [21, 17, 1, 64, 21, 21, 64, 64]
    - [139, 14.0]
  - - [21, 21, 1, 64, 21, 21, 64, 64]
    - [139, 17.0]
  - - [24, 24, 1, 64, 24, 24, 64, 64]
    - [144, 23.0]
  - - [30, 30, 1, 64, 30, 30, 64, 64]
    - [144, 36.0]
  - - [30, 31, 1, 64, 30, 30, 64, 64]
    - [144, 37.0]
  - - [31, 31, 1, 64, 31, 31, 64, 64]
    - [139, 38.0]
  - - [32, 32, 1, 64, 32, 32, 64, 64]
    - [110, 44.0]
  - - [32, 35, 1, 64, 32, 32, 64, 64]
    - [116, 39.0]
  - - [34, 24, 1, 64, 34, 34, 64, 64]
    - [128, 26.0]
  - - [34, 34, 1, 64, 34, 34, 64, 64]
    - [112, 37.0]
  - - [35, 35, 1, 64, 35, 35, 64, 64]
    - [128, 43.0]
  - - [27, 27, 1, 64, 27, 27, 64, 64]
    - [128, 25.0]
  - - [27, 33, 1, 64, 27, 27, 64, 64]
    - [145, 31.0]
  - - [33, 33, 1, 64, 33, 33, 64, 64]
    - [130, 35.0]
  - - [2, 4, 1, 1024, 2, 2, 1024, 1024]
    - [110, 1.0]
  - - [2, 32, 1, 1024, 2, 2, 1024, 1024]
    - [116, 8.0]
  - - [64, 512, 1, 512, 64, 64, 512, 512]
    - [116, 3154.0]
  - - [1024, 4, 1, 1024, 1024, 1024, 1024, 1024]
    - [161, 505.0]
  - - [1024, 32, 1, 1024, 1024, 1024, 1024, 1024]
    - [161, 3570.0]
  - - [3, 3, 512, 64, 3, 3, 64, 64]
    - [145, 110.0]
  - - [5, 5, 512, 64, 5, 5, 64, 64]
    - [145, 299.0]
  - - [5, 5, 960, 64, 5, 5, 64, 64]
    - [110, 400.0]
  - - [9, 9, 512, 64, 9, 9, 64, 64]
    - [145, 903.0]
  - - [27, 27, 32768, 128, 27, 27, 128, 128]
    - [135, 4414.0]
  - - [64, 512, 1, 1024, 64, 64, 1024, 1024]
    - [116, 3452.0]
  - - [64, 960, 1, 1024, 64, 64, 1024, 1024]
    - [119, 5140.0]
  - - [14, 14, 10880, 64, 14, 14, 64, 64]
    - [151, 3893.0]
  - - [15, 14, 10880, 64, 15, 15, 64, 64]
    - [116, 4164.0]
  - - [15, 15, 7680, 64, 15, 15, 64, 64]
    - [151, 4303.0]
  - - [15, 15, 10880, 64, 15, 15, 64, 64]
    - [116, 4433.0]
  - - [17, 15, 7680, 64, 17, 17, 64, 64]
    - [112, 3167.0]
  - - [17, 17, 7680, 64, 17, 17, 64, 64]
    - [120, 2693.0]
  - - [21, 17, 6144, 64, 21, 21, 64, 64]
    - [129, 2802.0]
  - - [21, 21, 6144, 64, 21, 21, 64, 64]
    - [162, 3220.0]
  - - [24, 24, 4736, 64, 24, 24, 64, 64]
    - [125, 4006.0]
  - - [30, 30, 2048, 64, 30, 30, 64, 64]
    - [132, 5650.0]
  - - [30, 31, 2048, 64, 30, 30, 64, 64]
    - [122, 5777.0]
  - - [31, 31, 2048, 64, 31, 31, 64, 64]
    - [159, 5930.0]
  - - [34, 24, 4736, 64, 34, 34, 64, 64]
    - [111, 3885.0]
  - - [27, 27, 1920, 64, 27, 27, 64, 64]
    - [114, 4622.0]
  - - [27, 33, 1920, 64, 27, 27, 64, 64]
    - [120, 3910.0]
  - - [2, 8, 1, 1024, 2, 2, 1024, 1024]
    - [110, 2.0]
  - - [1024, 77, 1, 1024, 1024, 1024, 1024, 1024]
    - [155, 4953.0]
  - - [2, 10, 1, 1024, 2, 2, 1024, 1024]
    - [116, 3.0]
  - - [1024, 10, 1, 1024, 1024, 1024, 1024, 1024]
    - [142, 1260.0]
  - - [2, 39, 1, 1024, 2, 2, 1024, 1024]
    - [116, 10.0]
  - - [1024, 39, 1, 1024, 1024, 1024, 1024, 1024]
    - [119, 3711.0]
  - - [2, 40, 1, 1024, 2, 2, 1024, 1024]
    - [116, 10.0]
  - - [1024, 40, 1, 1024, 1024, 1024, 1024, 1024]
    - [119, 3834.0]
  - - [2, 41, 1, 1024, 2, 2, 1024, 1024]
    - [116, 11.0]
  - - [1024, 41, 1, 1024, 1024, 1024, 1024, 1024]
    - [119, 3915.0]
  - - [2, 5, 1, 1024, 2, 2, 1024, 1024]
    - [110, 1.0]
  - - [1024, 5, 1, 1024, 1024, 1024, 1024, 1024]
    - [161, 630.0]
  - - [2, 6, 1, 1024, 2, 2, 1024, 1024]
    - [116, 2.0]
  - - [1024, 6, 1, 1024, 1024, 1024, 1024, 1024]
    - [161, 758.0]
  - - [1024, 8, 1, 1024, 1024, 1024, 1024, 1024]
    - [161, 1006.0]
  - - [2, 9, 1, 1024, 2, 2, 1024, 1024]
    - [110, 2.0]
  - - [1024, 9, 1, 1024, 1024, 1024, 1024, 1024]
    - [161, 1132.0]
  - - [4, 4, 32768, 64, 4, 4, 64, 64]
    - [110, 446.0]
  - - [4, 4, 38400, 64, 4, 4, 64, 64]
    - [128, 448.0]
  - - [17, 17, 6144, 64, 17, 17, 64, 64]
    - [138, 2637.0]
  - - [128, 128, 1, 64, 128, 128, 64, 64]
    - [112, 576.0]
  - - [64, 128, 1, 128, 64, 64, 128, 128]
    - [145, 464.0]
  - - [2, 1024, 1, 1024, 2, 2, 1024, 1024]
    - [161, 258.0]
  - - [5, 5, 1, 64, 5, 5, 64, 64]
    - [110, 1.0]
  - - [33, 33, 1, 32, 33, 33, 32, 32]
    - [110, 18.0]
  - - [1024, 16, 1, 1024, 1024, 1024, 1024, 1024]
    - [142, 2051.0]
  - - [2, 4, 1, 2560, 2, 2, 2560, 2560]
    - [110, 1.0]
  - - [2, 16, 1, 1024, 2, 2, 1024, 1024]
    - [116, 5.0]
  - - [2, 2, 1, 2048, 2, 2, 2048, 2048]
    - [110, 1.0]
  - - [1024, 1, 1, 1024, 1024, 1024, 1024, 1024]
    - [161, 126.0]
  - - [512, 1, 1, 2048, 512, 512, 2048, 2048]
    - [124, 75.0]
  - - [200, 1, 1, 1024, 200, 200, 1024, 1024]
    - [116, 26.0]
  - - [960, 1, 1, 2048, 960, 960, 2048, 2048]
    - [124, 132.0]
  - - [1024, 64, 1, 1024, 1024, 1024, 1024, 1024]
    - [159, 5016.0]
  - - [864, 1, 1, 256, 864, 864, 256, 256]
    - [116, 65.0]
  - - [1024, 80, 1, 1024, 1024, 1024, 1024, 1024]
    - [155, 5329.0]
  - - [1024, 82, 1, 1024, 1024, 1024, 1024, 1024]
    - [156, 5161.0]
  - - [1024, 12, 1, 1024, 1024, 1024, 1024, 1024]
    - [161, 1516.0]
  - - [2, 64, 1, 1024, 2, 2, 1024, 1024]
    - [116, 16.0]
  - - [2, 80, 1, 1024, 2, 2, 1024, 1024]
    - [116, 20.0]
  - - [2, 82, 1, 1024, 2, 2, 1024, 1024]
    - [116, 21.0]
  - - [2, 12, 1, 1024, 2, 2, 1024, 1024]
    - [110, 3.0]
  - - [2, 1, 1, 1024, 2, 2, 1024, 1024]
    - [116, 0.29]
  - - [24, 24, 6816, 64, 24, 24, 64, 64]
    - [117, 4127.0]
  - - [256, 128, 1, 3136, 256, 256, 3136, 3136]
    - [134, 4332.0]
  - - [576, 64, 1, 3136, 576, 576, 3136, 3136]
    - [116, 4635.0]
  - - [768, 16, 1, 768, 768, 768, 768, 768]
    - [161, 1461.0]
  - - [768, 12, 1, 768, 768, 768, 768, 768]
    - [142, 1066.0]
  - - [768, 4, 1, 768, 768, 768, 768, 768]
    - [161, 356.0]
  - - [64, 1024, 1, 1024, 64, 64, 1024, 1024]
    - [119, 5251.0]
  - - [26, 26, 6272, 64, 26, 26, 64, 64]
    - [135, 4742.0]
  - - [2, 128, 1, 1024, 2, 2, 1024, 1024]
    - [116, 33.0]
  - - [2, 96, 1, 1024, 2, 2, 1024, 1024]
    - [116, 25.0]
  - - [256, 80, 1, 784, 256, 256, 784, 784]
    - [151, 2027.0]
  - - [256, 12, 1, 3800, 256, 256, 3800, 3800]
    - [136, 484.0]
  - - [256, 3, 1, 3800, 256, 256, 3800, 3800]
    - [118, 121.0]
  - - [256, 12, 1, 950, 256, 256, 950, 950]
    - [136, 368.0]
  - - [256, 3, 1, 950, 256, 256, 950, 950]
    - [118, 93.0]
  - - [256, 12, 1, 3220, 256, 256, 3220, 3220]
    - [136, 476.0]
  - - [256, 3, 1, 3220, 256, 256, 3220, 3220]
    - [136, 120.0]
  - - [256, 12, 1, 3072, 256, 256, 3072, 3072]
    - [127, 478.0]
  - - [256, 3, 1, 3072, 256, 256, 3072, 3072]
    - [127, 119.0]
  - - [256, 12, 1, 850, 256, 256, 850, 850]
    - [136, 360.0]
  - - [256, 3, 1, 850, 256, 256, 850, 850]
    - [136, 90.0]
  - - [256, 12, 1, 2852, 256, 256, 2852, 2852]
    - [118, 471.0]
  - - [256, 3, 1, 2852, 256, 256, 2852, 2852]
    - [118, 118.0]
  - - [256, 12, 1, 805, 256, 256, 805, 805]
    - [127, 356.0]
  - - [256, 3, 1, 805, 256, 256, 805, 805]
    - [136, 90.0]
  - - [256, 3, 1, 864, 256, 256, 864, 864]
    - [118, 94.0]
  - - [256, 3, 1, 768, 256, 256, 768, 768]
    - [116, 93.0]
  - - [256, 12, 1, 864, 256, 256, 864, 864]
    - [136, 375.0]
  - - [256, 12, 1, 768, 256, 256, 768, 768]
    - [116, 371.0]
  - - [256, 12, 1, 2904, 256, 256, 2904, 2904]
    - [136, 469.0]
  - - [256, 3, 1, 2904, 256, 256, 2904, 2904]
    - [118, 118.0]
  - - [256, 3, 1, 713, 256, 256, 713, 713]
    - [136, 86.0]
  - - [256, 12, 1, 888, 256, 256, 888, 888]
    - [127, 362.0]
  - - [256, 3, 1, 888, 256, 256, 888, 888]
    - [136, 91.0]
  - - [256, 12, 1, 713, 256, 256, 713, 713]
    - [118, 339.0]
  - - [256, 3, 1, 660, 256, 256, 660, 660]
    - [136, 82.0]
  - - [256, 3, 1, 672, 256, 256, 672, 672]
    - [118, 86.0]
  - - [256, 12, 1, 660, 256, 256, 660, 660]
    - [154, 327.0]
  - - [256, 3, 1, 726, 256, 256, 726, 726]
    - [118, 84.0]
  - - [256, 12, 1, 672, 256, 256, 672, 672]
    - [136, 345.0]
  - - [256, 3, 1, 247, 256, 256, 247, 247]
    - [116, 51.0]
  - - [256, 12, 1, 726, 256, 256, 726, 726]
    - [136, 336.0]
  - - [256, 3, 1, 216, 256, 256, 216, 216]
    - [116, 48.0]
  - - [256, 3, 1, 3400, 256, 256, 3400, 3400]
    - [136, 121.0]
  - - [256, 3, 1, 221, 256, 256, 221, 221]
    - [116, 48.0]
  - - [256, 12, 1, 3552, 256, 256, 3552, 3552]
    - [136, 488.0]
  - - [256, 3, 1, 3456, 256, 256, 3456, 3456]
    - [118, 122.0]
  - - [256, 3, 1, 204, 256, 256, 204, 204]
    - [116, 46.0]
  - - [256, 12, 1, 3400, 256, 256, 3400, 3400]
    - [118, 480.0]
  - - [256, 12, 1, 3456, 256, 256, 3456, 3456]
    - [136, 486.0]
  - - [256, 12, 1, 221, 256, 256, 221, 221]
    - [116, 192.0]
  - - [256, 3, 1, 3552, 256, 256, 3552, 3552]
    - [136, 123.0]
  - - [256, 3, 1, 228, 256, 256, 228, 228]
    - [116, 49.0]
  - - [256, 3, 1, 234, 256, 256, 234, 234]
    - [116, 50.0]
  - - [256, 12, 1, 234, 256, 256, 234, 234]
    - [151, 202.0]
  - - [256, 12, 1, 228, 256, 256, 228, 228]
    - [116, 198.0]
  - - [256, 3, 1, 252, 256, 256, 252, 252]
    - [151, 52.0]
  - - [256, 12, 1, 252, 256, 256, 252, 252]
    - [116, 205.0]
  - - [256, 12, 1, 247, 256, 256, 247, 247]
    - [151, 204.0]
  - - [128, 256, 1, 1444, 128, 128, 1444, 1444]
    - [124, 3495.0]
  - - [256, 128, 1, 25, 256, 256, 25, 25]
    - [130, 482.0]
  - - [256, 128, 1, 9, 256, 256, 9, 9]
    - [130, 182.0]
  - - [256, 256, 1, 1444, 256, 256, 1444, 1444]
    - [152, 4784.0]
  - - [512, 128, 1, 100, 512, 512, 100, 100]
    - [145, 2580.0]
  - - [64, 128, 1, 1444, 64, 64, 1444, 1444]
    - [127, 1118.0]
  - - [81, 1024, 1, 1024, 81, 81, 1024, 1024]
    - [159, 4667.0]
  - - [81, 1000, 1, 1024, 81, 81, 1024, 1024]
    - [159, 4583.0]
  - - [1024, 20, 1, 1024, 1024, 1024, 1024, 1024]
    - [142, 2241.0]
  - - [2, 8, 1, 2048, 2, 2, 2048, 2048]
    - [110, 2.0]
  - - [2, 20, 1, 1024, 2, 2, 1024, 1024]
    - [110, 5.0]
  - - [2, 2, 1, 2560, 2, 2, 2560, 2560]
    - [110, 1.0]
- null
