library/src/blas3/Tensile/Logic/asm_full/navi21_Cijk_Ailk_Bjlk_HBH.yaml
- {MinimumRequiredVersion: 4.26.0}
- navi21
- gfx1030
- [Device 73a2]
    SolutionIndex: 0
    SolutionNameMin: Cijk_Ailk_Bjlk_HBH_MT128x128x8_SN_SU0_SUM0_TT8_16_WG16_8_1_WGM1
    SolutionIndex: 1
    SolutionNameMin: Cijk_Ailk_Bjlk_HBH_MT128x64x16_SN_SU0_SUM0_TT8_8_WG16_8_1_WGM1
    SolutionIndex: 2
    SolutionNameMin: Cijk_Ailk_Bjlk_HBH_MT128x128x16_SN_SU0_SUM0_TT8_16_WG16_8_1_WGM1
    SolutionIndex: 3
    SolutionNameMin: Cijk_Ailk_Bjlk_HBH_MT128x128x16_SN_SU0_SUM0_TT8_8_WG16_16_1_WGM1
    SolutionIndex: 4
    SolutionNameMin: Cijk_Ailk_Bjlk_HBH_MT128x64x32_SN_SU0_SUM0_TT8_8_WG16_8_1_WGM1
    SolutionIndex: 5
    SolutionNameMin: Cijk_Ailk_Bjlk_HBH_MT128x128x32_SN_SU0_SUM0_TT8_16_WG16_8_1_WGM1
    SolutionIndex: 6
    SolutionNameMin: Cijk_Ailk_Bjlk_HBH_MT128x128x32_SN_SU0_SUM0_TT8_8_WG16_16_1_WGM1
    SolutionIndex: 7
    SolutionNameMin: Cijk_Ailk_Bjlk_HBH_MT128x128x8_SN_SU32_SUM3_TT8_16_WG16_8_1_WGM1
    SolutionIndex: 8
    SolutionNameMin: Cijk_Ailk_Bjlk_HBH_MT128x64x16_SN_SU32_SUM3_TT8_8_WG16_8_1_WGM1
    SolutionIndex: 9
    SolutionNameMin: Cijk_Ailk_Bjlk_HBH_MT128x128x16_SN_SU32_SUM3_TT8_16_WG16_8_1_WGM1
    SolutionIndex: 10
    SolutionNameMin: Cijk_Ailk_Bjlk_HBH_MT128x128x8_SN_SU0_SUM0_TT8_16_WG16_8_1_WGM4
    SolutionIndex: 11
    SolutionNameMin: Cijk_Ailk_Bjlk_HBH_MT128x64x16_SN_SU0_SUM0_TT8_8_WG16_8_1_WGM4
    SolutionIndex: 12
    SolutionNameMin: Cijk_Ailk_Bjlk_HBH_MT128x128x16_SN_SU0_SUM0_TT8_16_WG16_8_1_WGM4
    SolutionIndex: 13
    SolutionNameMin: Cijk_Ailk_Bjlk_HBH_MT128x128x16_SN_SU0_SUM0_TT8_8_WG16_16_1_WGM4
    SolutionIndex: 14
    SolutionNameMin: Cijk_Ailk_Bjlk_HBH_MT128x64x32_SN_SU0_SUM0_TT8_8_WG16_8_1_WGM4
    SolutionIndex: 15
    SolutionNameMin: Cijk_Ailk_Bjlk_HBH_MT128x128x32_SN_SU0_SUM0_TT8_16_WG16_8_1_WGM4
    SolutionIndex: 16
    SolutionNameMin: Cijk_Ailk_Bjlk_HBH_MT128x128x32_SN_SU0_SUM0_TT8_8_WG16_16_1_WGM4
    SolutionIndex: 17
    SolutionNameMin: Cijk_Ailk_Bjlk_HBH_MT128x256x32_SN_SU0_SUM0_TT8_16_WG16_16_1_WGM4
    SolutionIndex: 18
    SolutionNameMin: Cijk_Ailk_Bjlk_HBH_MT128x128x8_SN_SU32_SUM3_TT8_16_WG16_8_1_WGM4
    SolutionIndex: 19
    SolutionNameMin: Cijk_Ailk_Bjlk_HBH_MT128x64x16_SN_SU32_SUM3_TT8_8_WG16_8_1_WGM4
    SolutionIndex: 20
    SolutionNameMin: Cijk_Ailk_Bjlk_HBH_MT128x128x16_SN_SU32_SUM3_TT8_16_WG16_8_1_WGM4
    SolutionIndex: 21
    SolutionNameMin: Cijk_Ailk_Bjlk_HBH_MT128x128x16_SN_SU32_SUM3_TT8_8_WG16_16_1_WGM4
    SolutionIndex: 22
    SolutionNameMin: Cijk_Ailk_Bjlk_HBH_MT128x128x32_SN_SU32_SUM3_TT8_16_WG16_8_1_WGM4
    SolutionIndex: 23
    SolutionNameMin: Cijk_Ailk_Bjlk_HBH_MT128x128x8_SN_SU0_SUM0_TT8_16_WG16_8_1_WGM8
    SolutionIndex: 24
    SolutionNameMin: Cijk_Ailk_Bjlk_HBH_MT128x64x16_SN_SU0_SUM0_TT8_8_WG16_8_1_WGM8
    SolutionIndex: 25
    SolutionNameMin: Cijk_Ailk_Bjlk_HBH_MT128x128x16_SN_SU0_SUM0_TT8_16_WG16_8_1_WGM8
    SolutionIndex: 26
    SolutionNameMin: Cijk_Ailk_Bjlk_HBH_MT128x128x16_SN_SU0_SUM0_TT8_8_WG16_16_1_WGM8
    SolutionIndex: 27
    SolutionNameMin: Cijk_Ailk_Bjlk_HBH_MT128x128x32_SN_SU0_SUM0_TT8_8_WG16_16_1_WGM8
    SolutionIndex: 28
    SolutionNameMin: Cijk_Ailk_Bjlk_HBH_MT128x256x32_SN_SU0_SUM0_TT8_16_WG16_16_1_WGM8
    SolutionIndex: 29
    SolutionNameMin: Cijk_Ailk_Bjlk_HBH_MT128x128x8_SN_SU32_SUM3_TT8_16_WG16_8_1_WGM8
    SolutionIndex: 30
    SolutionNameMin: Cijk_Ailk_Bjlk_HBH_MT128x64x16_SN_SU32_SUM3_TT8_8_WG16_8_1_WGM8
    SolutionIndex: 31
    SolutionNameMin: Cijk_Ailk_Bjlk_HBH_MT128x128x16_SN_SU32_SUM3_TT8_16_WG16_8_1_WGM8
    SolutionIndex: 32
    SolutionNameMin: Cijk_Ailk_Bjlk_HBH_MT128x128x16_SN_SU32_SUM3_TT8_8_WG16_16_1_WGM8
    SolutionIndex: 33
    SolutionNameMin: Cijk_Ailk_Bjlk_HBH_MT128x128x16_SN_SU0_SUM0_TT8_16_WG16_8_1_WGM1
    SolutionIndex: 34
    SolutionNameMin: Cijk_Ailk_Bjlk_HBH_MT128x256x32_SN_SU0_SUM0_TT8_16_WG16_16_1_WGM1
    SolutionIndex: 35
    SolutionNameMin: Cijk_Ailk_Bjlk_HBH_MT128x128x16_SN_SU32_SUM3_TT8_16_WG16_8_1_WGM1
    SolutionIndex: 36
    SolutionNameMin: Cijk_Ailk_Bjlk_HBH_MT128x128x16_SN_SU0_SUM0_TT8_16_WG16_8_1_WGM4
    SolutionIndex: 37
    SolutionNameMin: Cijk_Ailk_Bjlk_HBH_MT128x128x16_SN_SU0_SUM0_TT8_8_WG16_16_1_WGM4
    SolutionIndex: 38
    SolutionNameMin: Cijk_Ailk_Bjlk_HBH_MT128x128x16_SN_SU32_SUM3_TT8_16_WG16_8_1_WGM4
    SolutionIndex: 39
    SolutionNameMin: Cijk_Ailk_Bjlk_HBH_MT128x256x32_SN_SU32_SUM3_TT8_16_WG16_16_1_WGM4
    SolutionIndex: 40
    SolutionNameMin: Cijk_Ailk_Bjlk_HBH_MT128x128x16_SN_SU0_SUM0_TT8_16_WG16_8_1_WGM8
    SolutionIndex: 41
    SolutionNameMin: Cijk_Ailk_Bjlk_HBH_MT128x256x32_SN_SU0_SUM0_TT8_16_WG16_16_1_WGM8
    SolutionIndex: 42
    SolutionNameMin: Cijk_Ailk_Bjlk_HBH_MT128x128x16_SN_SU32_SUM3_TT8_16_WG16_8_1_WGM8
    SolutionIndex: 43
    SolutionNameMin: Cijk_Ailk_Bjlk_HBH_MT64x64x8_SN_SU0_SUM0_TT8_8_WG8_8_1_WGM1
    SolutionIndex: 44
    SolutionNameMin: Cijk_Ailk_Bjlk_HBH_MT64x64x16_SN_SU0_SUM0_TT8_8_WG8_8_1_WGM1
    SolutionIndex: 45
    SolutionNameMin: Cijk_Ailk_Bjlk_HBH_MT128x64x16_SN_SU0_SUM0_TT8_8_WG16_8_1_WGM1
    SolutionIndex: 46
    SolutionNameMin: Cijk_Ailk_Bjlk_HBH_MT128x128x16_SN_SU0_SUM0_TT8_8_WG16_16_1_WGM1
    SolutionIndex: 47
    SolutionNameMin: Cijk_Ailk_Bjlk_HBH_MT128x64x32_SN_SU0_SUM0_TT8_8_WG16_8_1_WGM1
    SolutionIndex: 48
    SolutionNameMin: Cijk_Ailk_Bjlk_HBH_MT128x128x32_SN_SU0_SUM0_TT8_8_WG16_16_1_WGM1
    SolutionIndex: 49
    SolutionNameMin: Cijk_Ailk_Bjlk_HBH_MT64x64x8_SN_SU32_SUM3_TT8_8_WG8_8_1_WGM1
    SolutionIndex: 50
    SolutionNameMin: Cijk_Ailk_Bjlk_HBH_MT64x64x16_SN_SU32_SUM3_TT8_8_WG8_8_1_WGM1
    SolutionIndex: 51
    SolutionNameMin: Cijk_Ailk_Bjlk_HBH_MT128x64x16_SN_SU32_SUM3_TT8_8_WG16_8_1_WGM1
    SolutionIndex: 52
    SolutionNameMin: Cijk_Ailk_Bjlk_HBH_MT128x128x32_SN_SU32_SUM3_TT8_8_WG16_16_1_WGM1
    SolutionIndex: 53
    SolutionNameMin: Cijk_Ailk_Bjlk_HBH_MT64x64x8_SN_SU0_SUM0_TT8_8_WG8_8_1_WGM4
    SolutionIndex: 54
    SolutionNameMin: Cijk_Ailk_Bjlk_HBH_MT64x64x16_SN_SU0_SUM0_TT8_8_WG8_8_1_WGM4
    SolutionIndex: 55
    SolutionNameMin: Cijk_Ailk_Bjlk_HBH_MT128x64x16_SN_SU0_SUM0_TT8_8_WG16_8_1_WGM4
    SolutionIndex: 56
    SolutionNameMin: Cijk_Ailk_Bjlk_HBH_MT128x128x16_SN_SU0_SUM0_TT8_8_WG16_16_1_WGM4
    SolutionIndex: 57
    SolutionNameMin: Cijk_Ailk_Bjlk_HBH_MT128x64x32_SN_SU0_SUM0_TT8_8_WG16_8_1_WGM4
    SolutionIndex: 58
    SolutionNameMin: Cijk_Ailk_Bjlk_HBH_MT128x128x32_SN_SU0_SUM0_TT8_8_WG16_16_1_WGM4
    SolutionIndex: 59
    SolutionNameMin: Cijk_Ailk_Bjlk_HBH_MT64x64x16_SN_SU32_SUM3_TT8_8_WG8_8_1_WGM4
    SolutionIndex: 60
    SolutionNameMin: Cijk_Ailk_Bjlk_HBH_MT128x64x16_SN_SU32_SUM3_TT8_8_WG16_8_1_WGM4
    SolutionIndex: 61
    SolutionNameMin: Cijk_Ailk_Bjlk_HBH_MT128x128x32_SN_SU32_SUM3_TT8_8_WG16_16_1_WGM4
    SolutionIndex: 62
    SolutionNameMin: Cijk_Ailk_Bjlk_HBH_MT64x64x8_SN_SU0_SUM0_TT8_8_WG8_8_1_WGM8
    SolutionIndex: 63
    SolutionNameMin: Cijk_Ailk_Bjlk_HBH_MT64x64x16_SN_SU0_SUM0_TT8_8_WG8_8_1_WGM8
    SolutionIndex: 64
    SolutionNameMin: Cijk_Ailk_Bjlk_HBH_MT128x64x16_SN_SU0_SUM0_TT8_8_WG16_8_1_WGM8
    SolutionIndex: 65
    SolutionNameMin: Cijk_Ailk_Bjlk_HBH_MT128x128x16_SN_SU0_SUM0_TT8_8_WG16_16_1_WGM8
    SolutionIndex: 66
    SolutionNameMin: Cijk_Ailk_Bjlk_HBH_MT128x64x32_SN_SU0_SUM0_TT8_8_WG16_8_1_WGM8
    SolutionIndex: 67
    SolutionNameMin: Cijk_Ailk_Bjlk_HBH_MT64x64x8_SN_SU32_SUM3_TT8_8_WG8_8_1_WGM8
    SolutionIndex: 68
    SolutionNameMin: Cijk_Ailk_Bjlk_HBH_MT64x64x16_SN_SU32_SUM3_TT8_8_WG8_8_1_WGM8
    SolutionIndex: 69
    SolutionNameMin: Cijk_Ailk_Bjlk_HBH_MT128x64x16_SN_SU32_SUM3_TT8_8_WG16_8_1_WGM8
    SolutionIndex: 70
    SolutionNameMin: Cijk_Ailk_Bjlk_HBH_MT128x64x32_SN_SU32_SUM3_TT8_8_WG16_8_1_WGM8
    SolutionIndex: 71
    SolutionNameMin: Cijk_Ailk_Bjlk_HBH_MT128x128x32_SN_SU32_SUM3_TT8_8_WG16_16_1_WGM8
    SolutionIndex: 72
    SolutionNameMin: Cijk_Ailk_Bjlk_HBH_MT128x128x16_SN_SU0_SUM0_TT8_8_WG16_16_1_WGM1
    SolutionIndex: 73
    SolutionNameMin: Cijk_Ailk_Bjlk_HBH_MT128x64x32_SN_SU0_SUM0_TT8_8_WG16_8_1_WGM1
    SolutionIndex: 74
    SolutionNameMin: Cijk_Ailk_Bjlk_HBH_MT128x128x16_SN_SU0_SUM0_TT8_8_WG16_16_1_WGM4
    SolutionIndex: 75
    SolutionNameMin: Cijk_Ailk_Bjlk_HBH_MT128x128x16_SN_SU0_SUM0_TT8_8_WG16_16_1_WGM8
    SolutionIndex: 76
    SolutionNameMin: Cijk_Ailk_Bjlk_HBH_MT128x128x32_SN_SU0_SUM0_TT8_8_WG16_16_1_WGM8
    SolutionIndex: 77
    SolutionNameMin: Cijk_Ailk_Bjlk_HBH_MT16x16x8_SN_SU0_SUM0_TT2_2_WG8_8_1_WGM1
    SolutionIndex: 78
    SolutionNameMin: Cijk_Ailk_Bjlk_HBH_MT32x32x8_SN_SU0_SUM0_TT4_4_WG8_8_1_WGM1
    SolutionIndex: 79
    SolutionNameMin: Cijk_Ailk_Bjlk_HBH_MT32x16x8_SN_SU0_SUM0_TT2_2_WG16_8_1_WGM1
    SolutionIndex: 80
    SolutionNameMin: Cijk_Ailk_Bjlk_HBH_MT64x32x8_SN_SU0_SUM0_TT4_4_WG16_8_1_WGM1
    SolutionIndex: 81
    SolutionNameMin: Cijk_Ailk_Bjlk_HBH_MT32x32x8_SN_SU0_SUM0_TT2_2_WG16_16_1_WGM1
    SolutionIndex: 82
    SolutionNameMin: Cijk_Ailk_Bjlk_HBH_MT16x16x16_SN_SU0_SUM0_TT2_2_WG8_8_1_WGM1
    SolutionIndex: 83
    SolutionNameMin: Cijk_Ailk_Bjlk_HBH_MT32x32x16_SN_SU0_SUM0_TT4_4_WG8_8_1_WGM1
    SolutionIndex: 84
    SolutionNameMin: Cijk_Ailk_Bjlk_HBH_MT32x16x16_SN_SU0_SUM0_TT2_2_WG16_8_1_WGM1
    SolutionIndex: 85
    SolutionNameMin: Cijk_Ailk_Bjlk_HBH_MT64x32x16_SN_SU0_SUM0_TT4_4_WG16_8_1_WGM1
    SolutionIndex: 86
    SolutionNameMin: Cijk_Ailk_Bjlk_HBH_MT64x64x16_SN_SU0_SUM0_TT4_4_WG16_16_1_WGM1
    SolutionIndex: 87
    SolutionNameMin: Cijk_Ailk_Bjlk_HBH_MT32x32x32_SN_SU0_SUM0_TT4_4_WG8_8_1_WGM1
    SolutionIndex: 88
    SolutionNameMin: Cijk_Ailk_Bjlk_HBH_MT64x32x32_SN_SU0_SUM0_TT4_4_WG16_8_1_WGM1
    SolutionIndex: 89
    SolutionNameMin: Cijk_Ailk_Bjlk_HBH_MT32x32x32_SN_SU0_SUM0_TT2_2_WG16_16_1_WGM1
    SolutionIndex: 90
    SolutionNameMin: Cijk_Ailk_Bjlk_HBH_MT64x64x32_SN_SU0_SUM0_TT4_4_WG16_16_1_WGM1
    SolutionIndex: 91
    SolutionNameMin: Cijk_Ailk_Bjlk_HBH_MT32x16x8_SN_SU32_SUM3_TT2_2_WG16_8_1_WGM1
    SolutionIndex: 92
    SolutionNameMin: Cijk_Ailk_Bjlk_HBH_MT64x32x8_SN_SU32_SUM3_TT4_4_WG16_8_1_WGM1
    SolutionIndex: 93
    SolutionNameMin: Cijk_Ailk_Bjlk_HBH_MT32x32x8_SN_SU32_SUM3_TT2_2_WG16_16_1_WGM1
    SolutionIndex: 94
    SolutionNameMin: Cijk_Ailk_Bjlk_HBH_MT16x16x16_SN_SU32_SUM3_TT2_2_WG8_8_1_WGM1
    SolutionIndex: 95
    SolutionNameMin: Cijk_Ailk_Bjlk_HBH_MT32x32x16_SN_SU32_SUM3_TT4_4_WG8_8_1_WGM1
    SolutionIndex: 96
    SolutionNameMin: Cijk_Ailk_Bjlk_HBH_MT32x16x16_SN_SU32_SUM3_TT2_2_WG16_8_1_WGM1
    SolutionIndex: 97
    SolutionNameMin: Cijk_Ailk_Bjlk_HBH_MT64x32x16_SN_SU32_SUM3_TT4_4_WG16_8_1_WGM1
    SolutionIndex: 98
    SolutionNameMin: Cijk_Ailk_Bjlk_HBH_MT32x32x16_SN_SU32_SUM3_TT2_2_WG16_16_1_WGM1
    SolutionIndex: 99
    SolutionNameMin: Cijk_Ailk_Bjlk_HBH_MT32x16x32_SN_SU32_SUM3_TT2_2_WG16_8_1_WGM1
    SolutionIndex: 100
    SolutionNameMin: Cijk_Ailk_Bjlk_HBH_MT32x32x32_SN_SU32_SUM3_TT2_2_WG16_16_1_WGM1
    SolutionIndex: 101
    SolutionNameMin: Cijk_Ailk_Bjlk_HBH_MT64x64x32_SN_SU32_SUM3_TT4_4_WG16_16_1_WGM1
    SolutionIndex: 102
    SolutionNameMin: Cijk_Ailk_Bjlk_HBH_MT16x16x8_SN_SU0_SUM0_TT2_2_WG8_8_1_WGM4
    SolutionIndex: 103
    SolutionNameMin: Cijk_Ailk_Bjlk_HBH_MT32x32x8_SN_SU0_SUM0_TT4_4_WG8_8_1_WGM4
    SolutionIndex: 104
    SolutionNameMin: Cijk_Ailk_Bjlk_HBH_MT32x16x8_SN_SU0_SUM0_TT2_2_WG16_8_1_WGM4
    SolutionIndex: 105
    SolutionNameMin: Cijk_Ailk_Bjlk_HBH_MT64x32x8_SN_SU0_SUM0_TT4_4_WG16_8_1_WGM4
    SolutionIndex: 106
    SolutionNameMin: Cijk_Ailk_Bjlk_HBH_MT32x32x8_SN_SU0_SUM0_TT2_2_WG16_16_1_WGM4
    SolutionIndex: 107
    SolutionNameMin: Cijk_Ailk_Bjlk_HBH_MT32x32x16_SN_SU0_SUM0_TT4_4_WG8_8_1_WGM4
    SolutionIndex: 108
    SolutionNameMin: Cijk_Ailk_Bjlk_HBH_MT32x16x16_SN_SU0_SUM0_TT2_2_WG16_8_1_WGM4
    SolutionIndex: 109
    SolutionNameMin: Cijk_Ailk_Bjlk_HBH_MT32x32x16_SN_SU0_SUM0_TT2_2_WG16_16_1_WGM4
    SolutionIndex: 110
    SolutionNameMin: Cijk_Ailk_Bjlk_HBH_MT64x64x16_SN_SU0_SUM0_TT4_4_WG16_16_1_WGM4
    SolutionIndex: 111
    SolutionNameMin: Cijk_Ailk_Bjlk_HBH_MT32x16x32_SN_SU0_SUM0_TT2_2_WG16_8_1_WGM4
    SolutionIndex: 112
    SolutionNameMin: Cijk_Ailk_Bjlk_HBH_MT64x32x32_SN_SU0_SUM0_TT4_4_WG16_8_1_WGM4
    SolutionIndex: 113
    SolutionNameMin: Cijk_Ailk_Bjlk_HBH_MT32x32x32_SN_SU0_SUM0_TT2_2_WG16_16_1_WGM4
    SolutionIndex: 114
    SolutionNameMin: Cijk_Ailk_Bjlk_HBH_MT64x64x32_SN_SU0_SUM0_TT4_4_WG16_16_1_WGM4
    SolutionIndex: 115
    SolutionNameMin: Cijk_Ailk_Bjlk_HBH_MT32x32x8_SN_SU32_SUM3_TT4_4_WG8_8_1_WGM4
    SolutionIndex: 116
    SolutionNameMin: Cijk_Ailk_Bjlk_HBH_MT64x32x8_SN_SU32_SUM3_TT4_4_WG16_8_1_WGM4
    SolutionIndex: 117
    SolutionNameMin: Cijk_Ailk_Bjlk_HBH_MT32x32x8_SN_SU32_SUM3_TT2_2_WG16_16_1_WGM4
    SolutionIndex: 118
    SolutionNameMin: Cijk_Ailk_Bjlk_HBH_MT16x16x16_SN_SU32_SUM3_TT2_2_WG8_8_1_WGM4
    SolutionIndex: 119
    SolutionNameMin: Cijk_Ailk_Bjlk_HBH_MT32x16x16_SN_SU32_SUM3_TT2_2_WG16_8_1_WGM4
    SolutionIndex: 120
    SolutionNameMin: Cijk_Ailk_Bjlk_HBH_MT32x32x16_SN_SU32_SUM3_TT2_2_WG16_16_1_WGM4
    SolutionIndex: 121
    SolutionNameMin: Cijk_Ailk_Bjlk_HBH_MT64x64x32_SN_SU32_SUM3_TT4_4_WG16_16_1_WGM4
    SolutionIndex: 122
    SolutionNameMin: Cijk_Ailk_Bjlk_HBH_MT16x16x8_SN_SU0_SUM0_TT2_2_WG8_8_1_WGM8
    SolutionIndex: 123
    SolutionNameMin: Cijk_Ailk_Bjlk_HBH_MT32x32x8_SN_SU0_SUM0_TT4_4_WG8_8_1_WGM8
    SolutionIndex: 124
    SolutionNameMin: Cijk_Ailk_Bjlk_HBH_MT32x16x8_SN_SU0_SUM0_TT2_2_WG16_8_1_WGM8
    SolutionIndex: 125
    SolutionNameMin: Cijk_Ailk_Bjlk_HBH_MT32x32x8_SN_SU0_SUM0_TT2_2_WG16_16_1_WGM8
    SolutionIndex: 126
    SolutionNameMin: Cijk_Ailk_Bjlk_HBH_MT32x32x16_SN_SU0_SUM0_TT4_4_WG8_8_1_WGM8
    SolutionIndex: 127
    SolutionNameMin: Cijk_Ailk_Bjlk_HBH_MT64x32x16_SN_SU0_SUM0_TT4_4_WG16_8_1_WGM8
    SolutionIndex: 128
    SolutionNameMin: Cijk_Ailk_Bjlk_HBH_MT32x32x16_SN_SU0_SUM0_TT2_2_WG16_16_1_WGM8
    SolutionIndex: 129
    SolutionNameMin: Cijk_Ailk_Bjlk_HBH_MT16x16x32_SN_SU0_SUM0_TT2_2_WG8_8_1_WGM8
    SolutionIndex: 130
    SolutionNameMin: Cijk_Ailk_Bjlk_HBH_MT32x16x32_SN_SU0_SUM0_TT2_2_WG16_8_1_WGM8
    SolutionIndex: 131
    SolutionNameMin: Cijk_Ailk_Bjlk_HBH_MT64x32x32_SN_SU0_SUM0_TT4_4_WG16_8_1_WGM8
    SolutionIndex: 132
    SolutionNameMin: Cijk_Ailk_Bjlk_HBH_MT32x32x32_SN_SU0_SUM0_TT2_2_WG16_16_1_WGM8
    SolutionIndex: 133
    SolutionNameMin: Cijk_Ailk_Bjlk_HBH_MT64x64x32_SN_SU0_SUM0_TT4_4_WG16_16_1_WGM8
    SolutionIndex: 134
    SolutionNameMin: Cijk_Ailk_Bjlk_HBH_MT64x32x8_SN_SU32_SUM3_TT4_4_WG16_8_1_WGM8
    SolutionIndex: 135
    SolutionNameMin: Cijk_Ailk_Bjlk_HBH_MT32x16x16_SN_SU32_SUM3_TT2_2_WG16_8_1_WGM8
    SolutionIndex: 136
    SolutionNameMin: Cijk_Ailk_Bjlk_HBH_MT64x32x16_SN_SU32_SUM3_TT4_4_WG16_8_1_WGM8
    SolutionIndex: 137
    SolutionNameMin: Cijk_Ailk_Bjlk_HBH_MT32x32x32_SN_SU32_SUM3_TT4_4_WG8_8_1_WGM8
    SolutionIndex: 138
    SolutionNameMin: Cijk_Ailk_Bjlk_HBH_MT64x32x32_SN_SU32_SUM3_TT4_4_WG16_8_1_WGM8
    SolutionIndex: 139
    SolutionNameMin: Cijk_Ailk_Bjlk_HBH_MT64x64x32_SN_SU32_SUM3_TT4_4_WG16_16_1_WGM8
    SolutionIndex: 140
    SolutionNameMin: Cijk_Ailk_Bjlk_HBH_MT16x16x32_SN_SU0_SUM0_TT2_2_WG8_8_1_WGM1
    SolutionIndex: 141
    SolutionNameMin: Cijk_Ailk_Bjlk_HBH_MT32x16x32_SN_SU0_SUM0_TT2_2_WG16_8_1_WGM1
    SolutionIndex: 142
    SolutionNameMin: Cijk_Ailk_Bjlk_HBH_MT64x32x32_SN_SU0_SUM0_TT4_4_WG16_8_1_WGM1
    SolutionIndex: 143
    SolutionNameMin: Cijk_Ailk_Bjlk_HBH_MT64x64x32_SN_SU32_SUM3_TT4_4_WG16_16_1_WGM1
    SolutionIndex: 144
    SolutionNameMin: Cijk_Ailk_Bjlk_HBH_MT16x16x32_SN_SU0_SUM0_TT2_2_WG8_8_1_WGM4
    SolutionIndex: 145
    SolutionNameMin: Cijk_Ailk_Bjlk_HBH_MT32x8x8_SN_SU0_SUM0_TT2_2_WG16_4_1_WGM1
    SolutionIndex: 146
    SolutionNameMin: Cijk_Ailk_Bjlk_HBH_MT32x8x8_SN_SU0_SUM0_TT2_2_WG16_4_1_WGM8
- - - [4096, 7133, 1, 4096, 4096, 4096, 4096, 7133]
    - [10, 38629.0]
  - - [2048, 7133, 1, 2048, 2048, 2048, 2048, 7133]
    - [23, 37910.0]
  - - [2560, 7133, 1, 2560, 2560, 2560, 2560, 7133]
    - [12, 37617.0]
  - - [3072, 7435, 1, 1024, 3072, 3072, 3072, 7435]
    - [10, 37296.0]
  - - [1760, 7133, 1, 1760, 1760, 1760, 1760, 7133]
    - [23, 36887.0]
  - - [7680, 5481, 1, 2560, 7680, 7680, 7680, 5481]
    - [23, 38728.0]
  - - [3136, 256, 64, 64, 3136, 3136, 3136, 256]
    - [23, 32480.0]
  - - [784, 512, 64, 128, 784, 784, 784, 512]
    - [18, 30324.0]
  - - [784, 128, 64, 512, 784, 784, 784, 128]
    - [10, 30069.0]
  - - [196, 256, 128, 1024, 196, 196, 196, 256]
    - [2, 26905.0]
  - - [196, 256, 64, 1024, 196, 196, 196, 256]
    - [2, 24624.0]
  - - [196, 1024, 128, 256, 196, 196, 196, 1024]
    - [23, 27492.0]
  - - [784, 128, 256, 512, 784, 784, 784, 128]
    - [0, 32272.0]
  - - [3136, 256, 256, 64, 3136, 3136, 3136, 256]
    - [0, 19893.0]
  - - [784, 128, 128, 512, 784, 784, 784, 128]
    - [9, 31833.0]
  - - [784, 512, 128, 128, 784, 784, 784, 512]
    - [0, 30772.0]
  - - [784, 512, 256, 128, 784, 784, 784, 512]
    - [0, 29760.0]
  - - [196, 1024, 64, 256, 196, 196, 196, 1024]
    - [23, 26536.0]
  - - [196, 1024, 256, 256, 196, 196, 196, 1024]
    - [2, 27041.0]
  - - [196, 256, 256, 1024, 196, 196, 196, 256]
    - [2, 28196.0]
  - - [3136, 256, 128, 64, 3136, 3136, 3136, 256]
    - [0, 24380.0]
  - - [1024, 4096, 1, 2048, 1024, 1024, 1024, 4096]
    - [25, 33000.0]
  - - [1024, 4096, 1, 4096, 1024, 1024, 1024, 4096]
    - [25, 33395.0]
  - - [1024, 30528, 1, 2048, 1024, 1024, 1024, 30528]
    - [12, 38284.0]
  - - [1024, 30528, 1, 4096, 1024, 1024, 1024, 30528]
    - [25, 38405.0]
  - - [4096, 1024, 1, 2048, 4096, 4096, 4096, 1024]
    - [31, 32995.0]
  - - [4096, 1024, 1, 4096, 4096, 4096, 4096, 1024]
    - [31, 33386.0]
  - - [256, 4864, 1, 8976, 256, 256, 256, 4864]
    - [14, 25701.0]
  - - [256, 5120, 1, 8976, 256, 256, 256, 5120]
    - [14, 27050.0]
  - - [256, 5632, 1, 8976, 256, 256, 256, 5632]
    - [14, 29684.0]
  - - [256, 5888, 1, 8976, 256, 256, 256, 5888]
    - [20, 30168.0]
  - - [256, 6144, 1, 8976, 256, 256, 256, 6144]
    - [12, 31470.0]
  - - [256, 7168, 1, 8976, 256, 256, 256, 7168]
    - [31, 28498.0]
  - - [256, 8192, 1, 8976, 256, 256, 256, 8192]
    - [20, 32273.0]
  - - [256, 8960, 1, 8976, 256, 256, 256, 8960]
    - [31, 35332.0]
  - - [256, 9728, 1, 8976, 256, 256, 256, 9728]
    - [25, 31073.0]
  - - [256, 9984, 1, 8976, 256, 256, 256, 9984]
    - [31, 31860.0]
  - - [256, 10240, 1, 8976, 256, 256, 256, 10240]
    - [20, 32476.0]
  - - [256, 10496, 1, 8976, 256, 256, 256, 10496]
    - [31, 33421.0]
  - - [256, 11008, 1, 8976, 256, 256, 256, 11008]
    - [20, 34985.0]
  - - [256, 11264, 1, 8976, 256, 256, 256, 11264]
    - [20, 35726.0]
  - - [256, 11520, 1, 8976, 256, 256, 256, 11520]
    - [6, 34246.0]
  - - [256, 11776, 1, 8976, 256, 256, 256, 11776]
    - [9, 31640.0]
  - - [256, 12544, 1, 8976, 256, 256, 256, 12544]
    - [31, 33655.0]
  - - [256, 12800, 1, 8976, 256, 256, 256, 12800]
    - [31, 34315.0]
  - - [256, 13312, 1, 8976, 256, 256, 256, 13312]
    - [20, 35588.0]
  - - [256, 13568, 1, 8976, 256, 256, 256, 13568]
    - [31, 36307.0]
  - - [256, 14336, 1, 8976, 256, 256, 256, 14336]
    - [25, 33221.0]
  - - [256, 14848, 1, 8976, 256, 256, 256, 14848]
    - [31, 34373.0]
  - - [256, 15104, 1, 8976, 256, 256, 256, 15104]
    - [9, 34921.0]
  - - [256, 15872, 1, 8976, 256, 256, 256, 15872]
    - [20, 36652.0]
  - - [256, 16128, 1, 8976, 256, 256, 256, 16128]
    - [6, 34490.0]
  - - [256, 17152, 1, 8976, 256, 256, 256, 17152]
    - [25, 34966.0]
  - - [256, 17408, 1, 8976, 256, 256, 256, 17408]
    - [20, 35430.0]
  - - [256, 18688, 1, 8976, 256, 256, 256, 18688]
    - [20, 34382.0]
  - - [256, 19968, 1, 8976, 256, 256, 256, 19968]
    - [31, 36269.0]
  - - [256, 20480, 1, 8976, 256, 256, 256, 20480]
    - [20, 37132.0]
  - - [256, 20992, 1, 8976, 256, 256, 256, 20992]
    - [2, 34460.0]
  - - [256, 21248, 1, 8976, 256, 256, 256, 21248]
    - [20, 34866.0]
  - - [256, 22016, 1, 8976, 256, 256, 256, 22016]
    - [31, 36085.0]
  - - [256, 26112, 1, 8976, 256, 256, 256, 26112]
    - [9, 35893.0]
  - - [256, 32512, 1, 8976, 256, 256, 256, 32512]
    - [9, 36346.0]
  - - [256, 32768, 1, 1, 256, 256, 256, 32768]
    - [26, 813.0]
  - - [256, 33536, 1, 8976, 256, 256, 256, 33536]
    - [12, 37005.0]
  - - [256, 44505, 1, 8976, 256, 256, 256, 44505]
    - [25, 37012.0]
  - - [768, 2048, 1, 256, 768, 768, 768, 2048]
    - [26, 25229.0]
  - - [1600, 1024, 1, 512, 1600, 1600, 1600, 1024]
    - [6, 28169.0]
  - - [1600, 1024, 1, 960, 1600, 1600, 1600, 1024]
    - [2, 29959.0]
  - - [2048, 960, 1, 1, 2048, 2048, 2048, 960]
    - [24, 517.0]
  - - [2048, 2048, 1, 512, 2048, 2048, 2048, 2048]
    - [31, 32090.0]
  - - [2048, 2048, 1, 960, 2048, 2048, 2048, 2048]
    - [12, 32768.0]
  - - [2048, 2048, 1, 1024, 2048, 2048, 2048, 2048]
    - [12, 32866.0]
  - - [3200, 2048, 1, 1024, 3200, 3200, 3200, 2048]
    - [31, 35033.0]
  - - [4096, 4096, 1, 1024, 4096, 4096, 4096, 4096]
    - [10, 37660.0]
  - - [1024, 4096, 1, 3840, 1024, 1024, 1024, 4096]
    - [25, 33350.0]
  - - [1024, 4096, 1, 3968, 1024, 1024, 1024, 4096]
    - [20, 33377.0]
  - - [1024, 4096, 1, 6528, 1024, 1024, 1024, 4096]
    - [20, 33466.0]
  - - [1024, 4096, 1, 7104, 1024, 1024, 1024, 4096]
    - [31, 33498.0]
  - - [1024, 4096, 1, 7200, 1024, 1024, 1024, 4096]
    - [9, 33468.0]
  - - [1024, 4096, 1, 8064, 1024, 1024, 1024, 4096]
    - [12, 33484.0]
  - - [1024, 4096, 1, 8160, 1024, 1024, 1024, 4096]
    - [31, 33483.0]
  - - [1024, 4096, 1, 9216, 1024, 1024, 1024, 4096]
    - [25, 33504.0]
  - - [1024, 4096, 1, 9520, 1024, 1024, 1024, 4096]
    - [25, 33501.0]
  - - [1024, 4096, 1, 10064, 1024, 1024, 1024, 4096]
    - [20, 33510.0]
  - - [1024, 4096, 1, 10080, 1024, 1024, 1024, 4096]
    - [12, 33498.0]
  - - [1024, 4096, 1, 10200, 1024, 1024, 1024, 4096]
    - [31, 33485.0]
  - - [1024, 42720, 1, 3968, 1024, 1024, 1024, 42720]
    - [23, 38692.0]
  - - [1024, 42720, 1, 6528, 1024, 1024, 1024, 42720]
    - [23, 38737.0]
  - - [1024, 42720, 1, 7104, 1024, 1024, 1024, 42720]
    - [10, 38728.0]
  - - [1024, 42720, 1, 7200, 1024, 1024, 1024, 42720]
    - [10, 38731.0]
  - - [1024, 42720, 1, 9520, 1024, 1024, 1024, 42720]
    - [23, 38713.0]
  - - [1024, 42720, 1, 10080, 1024, 1024, 1024, 42720]
    - [23, 38726.0]
  - - [4096, 1024, 1, 3840, 4096, 4096, 4096, 1024]
    - [25, 33281.0]
  - - [4096, 1024, 1, 3968, 4096, 4096, 4096, 1024]
    - [25, 33410.0]
  - - [4096, 1024, 1, 6528, 4096, 4096, 4096, 1024]
    - [25, 33457.0]
  - - [4096, 1024, 1, 7104, 4096, 4096, 4096, 1024]
    - [12, 33472.0]
  - - [4096, 1024, 1, 7200, 4096, 4096, 4096, 1024]
    - [20, 33495.0]
  - - [4096, 1024, 1, 8064, 4096, 4096, 4096, 1024]
    - [20, 33489.0]
  - - [4096, 1024, 1, 8160, 4096, 4096, 4096, 1024]
    - [2, 33506.0]
  - - [4096, 1024, 1, 9216, 4096, 4096, 4096, 1024]
    - [25, 33510.0]
  - - [4096, 1024, 1, 9520, 4096, 4096, 4096, 1024]
    - [25, 33525.0]
  - - [4096, 1024, 1, 10064, 4096, 4096, 4096, 1024]
    - [31, 33536.0]
  - - [4096, 1024, 1, 10080, 4096, 4096, 4096, 1024]
    - [9, 33513.0]
  - - [4096, 1024, 1, 10200, 4096, 4096, 4096, 1024]
    - [31, 33491.0]
  - - [1024, 4096, 1, 3240, 1024, 1024, 1024, 4096]
    - [9, 33246.0]
  - - [1024, 4096, 1, 3960, 1024, 1024, 1024, 4096]
    - [12, 33325.0]
  - - [1024, 42720, 1, 3960, 1024, 1024, 1024, 42720]
    - [10, 38694.0]
  - - [4096, 1024, 1, 3240, 4096, 4096, 4096, 1024]
    - [12, 33134.0]
  - - [4096, 1024, 1, 3960, 4096, 4096, 4096, 1024]
    - [25, 33324.0]
  - - [1225, 192, 64, 32, 1225, 1225, 1225, 192]
    - [30, 20359.0]
  - - [1225, 192, 64, 48, 1225, 1225, 1225, 192]
    - [24, 25549.0]
  - - [1225, 192, 64, 64, 1225, 1225, 1225, 192]
    - [8, 27731.0]
  - - [1225, 256, 64, 48, 1225, 1225, 1225, 256]
    - [0, 26775.0]
  - - [1225, 256, 64, 64, 1225, 1225, 1225, 256]
    - [7, 28865.0]
  - - [1225, 288, 64, 48, 1225, 1225, 1225, 288]
    - [8, 22200.0]
  - - [1225, 288, 64, 64, 1225, 1225, 1225, 288]
    - [8, 24534.0]
  - - [289, 768, 64, 128, 289, 289, 289, 768]
    - [29, 24819.0]
  - - [289, 768, 64, 160, 289, 289, 289, 768]
    - [23, 25560.0]
  - - [289, 768, 64, 192, 289, 289, 289, 768]
    - [23, 26154.0]
  - - [1225, 192, 32, 32, 1225, 1225, 1225, 192]
    - [8, 18163.0]
  - - [1225, 192, 32, 48, 1225, 1225, 1225, 192]
    - [1, 22894.0]
  - - [1225, 192, 32, 64, 1225, 1225, 1225, 192]
    - [8, 24778.0]
  - - [1225, 256, 32, 48, 1225, 1225, 1225, 256]
    - [1, 24036.0]
  - - [1225, 256, 32, 64, 1225, 1225, 1225, 256]
    - [0, 26963.0]
  - - [1225, 288, 32, 48, 1225, 1225, 1225, 288]
    - [1, 20652.0]
  - - [1225, 288, 32, 64, 1225, 1225, 1225, 288]
    - [8, 23129.0]
  - - [289, 768, 32, 128, 289, 289, 289, 768]
    - [18, 23275.0]
  - - [289, 768, 32, 160, 289, 289, 289, 768]
    - [0, 23954.0]
  - - [289, 768, 32, 192, 289, 289, 289, 768]
    - [0, 24615.0]
  - - [3136, 256, 32, 64, 3136, 3136, 3136, 256]
    - [0, 31413.0]
  - - [784, 128, 32, 512, 784, 784, 784, 128]
    - [2, 27122.0]
  - - [784, 512, 32, 128, 784, 784, 784, 512]
    - [7, 29539.0]
  - - [196, 1024, 32, 256, 196, 196, 196, 1024]
    - [23, 25225.0]
  - - [3136, 128, 64, 256, 3136, 3136, 3136, 128]
    - [0, 35603.0]
  - - [784, 256, 64, 512, 784, 784, 784, 256]
    - [31, 31991.0]
  - - [3136, 256, 64, 128, 3136, 3136, 3136, 256]
    - [0, 35094.0]
  - - [3136, 256, 64, 256, 3136, 3136, 3136, 256]
    - [12, 36068.0]
  - - [196, 512, 64, 1024, 196, 196, 196, 512]
    - [2, 26912.0]
  - - [784, 512, 64, 256, 784, 784, 784, 512]
    - [23, 32103.0]
  - - [784, 512, 64, 512, 784, 784, 784, 512]
    - [23, 33025.0]
  - - [196, 1024, 64, 512, 196, 196, 196, 1024]
    - [23, 27801.0]
  - - [196, 1024, 64, 1024, 196, 196, 196, 1024]
    - [25, 28305.0]
  - - [3136, 128, 32, 256, 3136, 3136, 3136, 128]
    - [10, 34203.0]
  - - [784, 256, 32, 512, 784, 784, 784, 256]
    - [20, 30589.0]
  - - [3136, 256, 32, 128, 3136, 3136, 3136, 256]
    - [0, 34570.0]
  - - [3136, 256, 32, 256, 3136, 3136, 3136, 256]
    - [0, 36044.0]
  - - [196, 512, 32, 1024, 196, 196, 196, 512]
    - [2, 24617.0]
  - - [784, 512, 32, 256, 784, 784, 784, 512]
    - [10, 31081.0]
  - - [784, 512, 32, 512, 784, 784, 784, 512]
    - [23, 32519.0]
  - - [196, 1024, 32, 512, 196, 196, 196, 1024]
    - [0, 26510.0]
  - - [196, 1024, 32, 1024, 196, 196, 196, 1024]
    - [25, 27071.0]
  - - [7680, 8192, 1, 8192, 7680, 7680, 7680, 8192]
    - [23, 39095.0]
  - - [3840, 4096, 1, 4096, 3840, 3840, 3840, 4096]
    - [10, 38265.0]
  - - [1920, 2048, 1, 2048, 1920, 1920, 1920, 2048]
    - [12, 35221.0]
  - - [8192, 7680, 1, 8192, 8192, 8192, 8192, 7680]
    - [23, 39075.0]
  - - [4096, 3840, 1, 4096, 4096, 4096, 4096, 3840]
    - [23, 38170.0]
  - - [2048, 1920, 1, 2048, 2048, 2048, 2048, 1920]
    - [12, 35203.0]
  - - [8192, 8192, 1, 8192, 8192, 8192, 8192, 8192]
    - [23, 39070.0]
  - - [4096, 4096, 1, 4096, 4096, 4096, 4096, 4096]
    - [23, 38023.0]
  - - [2048, 2048, 1, 2048, 2048, 2048, 2048, 2048]
    - [25, 33212.0]
  - - [1024, 4096, 1, 512, 1024, 1024, 1024, 4096]
    - [31, 32157.0]
  - - [1024, 30522, 1, 77, 1024, 1024, 1024, 30522]
    - [23, 30854.0]
  - - [4096, 1024, 1, 512, 4096, 4096, 4096, 1024]
    - [12, 32235.0]
  - - [1024, 4096, 1, 1280, 1024, 1024, 1024, 4096]
    - [12, 32977.0]
  - - [1024, 30522, 1, 200, 1024, 1024, 1024, 30522]
    - [23, 36418.0]
  - - [4096, 1024, 1, 1280, 4096, 4096, 4096, 1024]
    - [2, 33026.0]
  - - [1024, 4096, 1, 4992, 1024, 1024, 1024, 4096]
    - [31, 33405.0]
  - - [1024, 30522, 1, 780, 1024, 1024, 1024, 30522]
    - [10, 37740.0]
  - - [4096, 1024, 1, 4992, 4096, 4096, 4096, 1024]
    - [25, 33409.0]
  - - [1024, 30522, 1, 308, 1024, 1024, 1024, 30522]
    - [10, 36638.0]
  - - [1024, 4096, 1, 5120, 1024, 1024, 1024, 4096]
    - [31, 33430.0]
  - - [1024, 30522, 1, 800, 1024, 1024, 1024, 30522]
    - [0, 37968.0]
  - - [4096, 1024, 1, 5120, 4096, 4096, 4096, 1024]
    - [25, 33402.0]
  - - [1024, 4096, 1, 5248, 1024, 1024, 1024, 4096]
    - [25, 33464.0]
  - - [1024, 30522, 1, 820, 1024, 1024, 1024, 30522]
    - [0, 37760.0]
  - - [4096, 1024, 1, 5248, 4096, 4096, 4096, 1024]
    - [25, 33382.0]
  - - [1024, 4096, 1, 2560, 1024, 1024, 1024, 4096]
    - [2, 33267.0]
  - - [1024, 30522, 1, 385, 1024, 1024, 1024, 30522]
    - [0, 36900.0]
  - - [4096, 1024, 1, 2560, 4096, 4096, 4096, 1024]
    - [31, 33261.0]
  - - [1024, 4096, 1, 3072, 1024, 1024, 1024, 4096]
    - [12, 33320.0]
  - - [1024, 30522, 1, 462, 1024, 1024, 1024, 30522]
    - [0, 37283.0]
  - - [4096, 1024, 1, 3072, 4096, 4096, 4096, 1024]
    - [20, 33311.0]
  - - [1024, 4096, 1, 1024, 1024, 1024, 1024, 4096]
    - [2, 32881.0]
  - - [1024, 30522, 1, 160, 1024, 1024, 1024, 30522]
    - [23, 35868.0]
  - - [4096, 1024, 1, 1024, 4096, 4096, 4096, 1024]
    - [12, 32861.0]
  - - [1024, 4096, 1, 1152, 1024, 1024, 1024, 4096]
    - [2, 32959.0]
  - - [1024, 30522, 1, 180, 1024, 1024, 1024, 30522]
    - [0, 35454.0]
  - - [4096, 1024, 1, 1152, 4096, 4096, 4096, 1024]
    - [31, 32901.0]
  - - [1024, 4096, 1, 8192, 1024, 1024, 1024, 4096]
    - [31, 33454.0]
  - - [1024, 4096, 1, 9600, 1024, 1024, 1024, 4096]
    - [12, 33531.0]
  - - [1024, 33712, 1, 8192, 1024, 1024, 1024, 33712]
    - [10, 38764.0]
  - - [1024, 33712, 1, 9600, 1024, 1024, 1024, 33712]
    - [23, 38702.0]
  - - [4096, 1024, 1, 8192, 4096, 4096, 4096, 1024]
    - [31, 33448.0]
  - - [4096, 1024, 1, 9600, 4096, 4096, 4096, 1024]
    - [20, 33526.0]
  - - [1024, 1600, 1, 1, 1024, 1024, 1024, 1600]
    - [30, 412.0]
  - - [2560, 1920, 1, 2048, 2560, 2560, 2560, 1920]
    - [25, 34707.0]
  - - [1024, 3072, 1, 4096, 1024, 1024, 1024, 3072]
    - [12, 32933.0]
  - - [2560, 2560, 1, 2048, 2560, 2560, 2560, 2560]
    - [12, 35095.0]
  - - [2048, 2048, 1, 2, 2048, 2048, 2048, 2048]
    - [1, 1283.0]
  - - [1024, 30592, 1, 2048, 1024, 1024, 1024, 30592]
    - [10, 38431.0]
  - - [1024, 3072, 1, 16384, 1024, 1024, 1024, 3072]
    - [25, 33105.0]
  - - [6144, 1536, 1, 4096, 6144, 6144, 6144, 1536]
    - [20, 38097.0]
  - - [1536, 4608, 1, 8192, 1536, 1536, 1536, 4608]
    - [25, 37944.0]
  - - [640, 2560, 1, 2048, 640, 640, 640, 2560]
    - [2, 32017.0]
  - - [1024, 4096, 1, 16384, 1024, 1024, 1024, 4096]
    - [12, 33521.0]
  - - [1536, 6144, 1, 4096, 1536, 1536, 1536, 6144]
    - [12, 38075.0]
  - - [1024, 30592, 1, 4096, 1024, 1024, 1024, 30592]
    - [12, 38526.0]
  - - [2560, 2560, 1, 4, 2560, 2560, 2560, 2560]
    - [21, 2893.0]
  - - [1536, 1536, 1, 4096, 1536, 1536, 1536, 1536]
    - [12, 36101.0]
  - - [2560, 7680, 1, 2048, 2560, 2560, 2560, 7680]
    - [10, 38105.0]
  - - [1536, 50304, 1, 4096, 1536, 1536, 1536, 50304]
    - [0, 39147.0]
  - - [2048, 8192, 1, 1024, 2048, 2048, 2048, 8192]
    - [23, 37625.0]
  - - [1024, 30592, 1, 8192, 1024, 1024, 1024, 30592]
    - [2, 38579.0]
  - - [4096, 1024, 1, 16384, 4096, 4096, 4096, 1024]
    - [31, 33534.0]
  - - [8192, 2048, 1, 1024, 8192, 8192, 8192, 2048]
    - [10, 37624.0]
  - - [1024, 50304, 1, 4096, 1024, 1024, 1024, 50304]
    - [0, 38954.0]
  - - [1536, 4608, 1, 4096, 1536, 1536, 1536, 4608]
    - [2, 37796.0]
  - - [6144, 1536, 1, 8192, 6144, 6144, 6144, 1536]
    - [20, 38187.0]
  - - [1024, 3072, 1, 8192, 1024, 1024, 1024, 3072]
    - [31, 33006.0]
  - - [1536, 1536, 1, 8192, 1536, 1536, 1536, 1536]
    - [12, 36445.0]
  - - [1536, 50304, 1, 8192, 1536, 1536, 1536, 50304]
    - [23, 39121.0]
  - - [2048, 6144, 1, 1024, 2048, 2048, 2048, 6144]
    - [10, 36930.0]
  - - [2048, 30592, 1, 1024, 2048, 2048, 2048, 30592]
    - [10, 38787.0]
  - - [1536, 6144, 1, 8192, 1536, 1536, 1536, 6144]
    - [2, 38168.0]
  - - [1024, 50304, 1, 2048, 1024, 1024, 1024, 50304]
    - [0, 38852.0]
  - - [1024, 50304, 1, 8192, 1024, 1024, 1024, 50304]
    - [23, 38917.0]
  - - [1024, 3072, 1, 2048, 1024, 1024, 1024, 3072]
    - [2, 32465.0]
  - - [1024, 50304, 1, 16384, 1024, 1024, 1024, 50304]
    - [10, 38854.0]
  - - [1024, 30528, 1, 8192, 1024, 1024, 1024, 30528]
    - [25, 38477.0]
  - - [256, 6912, 1, 1, 256, 256, 256, 6912]
    - [23, 372.0]
  - - [30528, 1024, 1, 640, 30528, 30528, 30528, 1024]
    - [10, 37978.0]
  - - [30528, 1024, 1, 1280, 30528, 30528, 30528, 1024]
    - [10, 38295.0]
  - - [4096, 1024, 1, 10240, 4096, 4096, 4096, 1024]
    - [9, 33481.0]
  - - [1024, 4096, 1, 10240, 1024, 1024, 1024, 4096]
    - [31, 33479.0]
  - - [30528, 1024, 1, 1600, 30528, 30528, 30528, 1024]
    - [10, 38252.0]
  - - [1024, 4096, 1, 10496, 1024, 1024, 1024, 4096]
    - [25, 33481.0]
  - - [30528, 1024, 1, 1640, 30528, 30528, 30528, 1024]
    - [10, 38327.0]
  - - [4096, 1024, 1, 10496, 4096, 4096, 4096, 1024]
    - [20, 33494.0]
  - - [30528, 1024, 1, 160, 30528, 30528, 30528, 1024]
    - [10, 35599.0]
  - - [1024, 4096, 1, 6144, 1024, 1024, 1024, 4096]
    - [31, 33453.0]
  - - [30528, 1024, 1, 240, 30528, 30528, 30528, 1024]
    - [29, 36792.0]
  - - [4096, 1024, 1, 6144, 4096, 4096, 4096, 1024]
    - [25, 33473.0]
  - - [1024, 4096, 1, 10224, 1024, 1024, 1024, 4096]
    - [12, 33491.0]
  - - [4096, 1024, 1, 10224, 4096, 4096, 4096, 1024]
    - [31, 33486.0]
  - - [1024, 3072, 1, 10224, 1024, 1024, 1024, 3072]
    - [9, 33074.0]
  - - [1024, 3072, 1, 10240, 1024, 1024, 1024, 3072]
    - [12, 33104.0]
  - - [4096, 1024, 1, 10192, 4096, 4096, 4096, 1024]
    - [31, 33521.0]
  - - [1024, 3072, 1, 10192, 1024, 1024, 1024, 3072]
    - [31, 33099.0]
  - - [1024, 4096, 1, 10192, 1024, 1024, 1024, 4096]
    - [25, 33518.0]
  - - [1024, 3072, 1, 10200, 1024, 1024, 1024, 3072]
    - [12, 33020.0]
  - - [4096, 1024, 1, 10208, 4096, 4096, 4096, 1024]
    - [20, 33485.0]
  - - [1024, 3072, 1, 10208, 1024, 1024, 1024, 3072]
    - [31, 33111.0]
  - - [1024, 4096, 1, 10208, 1024, 1024, 1024, 4096]
    - [20, 33503.0]
  - - [1024, 2048, 1, 10224, 1024, 1024, 1024, 2048]
    - [25, 32544.0]
  - - [1024, 2048, 1, 10240, 1024, 1024, 1024, 2048]
    - [31, 32525.0]
  - - [1024, 2048, 1, 10192, 1024, 1024, 1024, 2048]
    - [17, 32285.0]
  - - [1024, 3072, 1, 10080, 1024, 1024, 1024, 3072]
    - [2, 33107.0]
  - - [100352, 256, 1, 512, 100352, 100352, 100352, 256]
    - [2, 37446.0]
  - - [12544, 1024, 1, 2048, 12544, 12544, 12544, 1024]
    - [23, 37971.0]
  - - [12544, 147, 1, 64, 12544, 12544, 12544, 147]
    - [24, 12997.0]
  - - [200704, 256, 1, 512, 200704, 200704, 200704, 256]
    - [12, 38017.0]
  - - [25088, 512, 1, 1024, 25088, 25088, 25088, 512]
    - [10, 37740.0]
  - - [3136, 576, 1, 64, 3136, 3136, 3136, 576]
    - [1, 14237.0]
  - - [50176, 512, 1, 1024, 50176, 50176, 50176, 512]
    - [23, 38091.0]
  - - [6272, 1024, 1, 2048, 6272, 6272, 6272, 1024]
    - [25, 37026.0]
  - - [3136, 256, 128, 128, 3136, 3136, 3136, 256]
    - [0, 33912.0]
  - - [3136, 256, 256, 128, 3136, 3136, 3136, 256]
    - [6, 27843.0]
  - - [784, 512, 128, 256, 784, 784, 784, 512]
    - [10, 32307.0]
  - - [784, 512, 256, 256, 784, 784, 784, 512]
    - [0, 32631.0]
  - - [30528, 1024, 1, 2560, 30528, 30528, 30528, 1024]
    - [2, 38334.0]
  - - [1024, 4096, 1, 12288, 1024, 1024, 1024, 4096]
    - [25, 33484.0]
  - - [30528, 1024, 1, 1920, 30528, 30528, 30528, 1024]
    - [10, 38316.0]
  - - [4096, 1024, 1, 12288, 4096, 4096, 4096, 1024]
    - [25, 33505.0]
  - - [25600, 128, 25, 128, 25600, 25600, 25600, 128]
    - [0, 29928.0]
  - - [12544, 128, 36, 128, 12544, 12544, 12544, 128]
    - [0, 27235.0]
  - - [9216, 128, 49, 128, 9216, 9216, 9216, 128]
    - [0, 26757.0]
  - - [6400, 128, 64, 128, 6400, 6400, 6400, 128]
    - [7, 26930.0]
  - - [6400, 256, 25, 256, 6400, 6400, 6400, 256]
    - [0, 36934.0]
  - - [4096, 256, 36, 256, 4096, 4096, 4096, 256]
    - [2, 36772.0]
  - - [2304, 256, 49, 256, 2304, 2304, 2304, 256]
    - [10, 36872.0]
  - - [2304, 256, 64, 256, 2304, 2304, 2304, 256]
    - [0, 37262.0]
  - - [2304, 512, 25, 512, 2304, 2304, 2304, 512]
    - [23, 38086.0]
  - - [1024, 512, 36, 512, 1024, 1024, 1024, 512]
    - [10, 37849.0]
  - - [1024, 512, 49, 512, 1024, 1024, 1024, 512]
    - [23, 37890.0]
  - - [1024, 512, 64, 512, 1024, 1024, 1024, 512]
    - [0, 38181.0]
  - - [3072, 768, 1, 2048, 3072, 3072, 3072, 768]
    - [25, 34973.0]
  - - [768, 3072, 1, 2048, 768, 768, 768, 3072]
    - [17, 35570.0]
  - - [3072, 768, 1, 4608, 3072, 3072, 3072, 768]
    - [17, 35901.0]
  - - [768, 3072, 1, 4608, 768, 768, 768, 3072]
    - [17, 35944.0]
  - - [4096, 1024, 1, 4608, 4096, 4096, 4096, 1024]
    - [20, 33379.0]
  - - [1024, 4096, 1, 4608, 1024, 1024, 1024, 4096]
    - [25, 33429.0]
  - - [196, 1024, 128, 512, 196, 196, 196, 1024]
    - [25, 28168.0]
  - - [196, 1024, 256, 512, 196, 196, 196, 1024]
    - [23, 28675.0]
  - - [4880, 256, 49, 256, 4880, 4880, 4880, 256]
    - [0, 36126.0]
  - - [3128, 256, 64, 256, 3128, 3128, 3128, 256]
    - [25, 35933.0]
  - - [4680, 256, 49, 256, 4680, 4680, 4680, 256]
    - [12, 36285.0]
  - - [5280, 256, 36, 256, 5280, 5280, 5280, 256]
    - [25, 36114.0]
  - - [2640, 256, 64, 256, 2640, 2640, 2640, 256]
    - [12, 35821.0]
  - - [5304, 256, 49, 256, 5304, 5304, 5304, 256]
    - [12, 36376.0]
  - - [2760, 256, 64, 256, 2760, 2760, 2760, 256]
    - [2, 35804.0]
  - - [6440, 256, 36, 256, 6440, 6440, 6440, 256]
    - [25, 36422.0]
  - - [5704, 256, 36, 256, 5704, 5704, 5704, 256]
    - [25, 36428.0]
  - - [2128, 256, 64, 256, 2128, 2128, 2128, 256]
    - [9, 35650.0]
  - - [1160, 256, 49, 256, 1160, 1160, 1160, 256]
    - [29, 32107.0]
  - - [4056, 256, 49, 256, 4056, 4056, 4056, 256]
    - [0, 36706.0]
  - - [6144, 256, 36, 256, 6144, 6144, 6144, 256]
    - [22, 36555.0]
  - - [6336, 256, 36, 256, 6336, 6336, 6336, 256]
    - [25, 36647.0]
  - - [13600, 512, 2, 128, 13600, 13600, 13600, 512]
    - [7, 32422.0]
  - - [15200, 512, 2, 128, 15200, 15200, 15200, 512]
    - [7, 33172.0]
  - - [15200, 128, 2, 512, 15200, 15200, 15200, 128]
    - [12, 31805.0]
  - - [13600, 128, 2, 512, 13600, 13600, 13600, 128]
    - [2, 32246.0]
  - - [5632, 256, 36, 256, 5632, 5632, 5632, 256]
    - [0, 37394.0]
  - - [12288, 128, 2, 512, 12288, 12288, 12288, 128]
    - [31, 30435.0]
  - - [12880, 128, 2, 512, 12880, 12880, 12880, 128]
    - [12, 30550.0]
  - - [11408, 128, 2, 512, 11408, 11408, 11408, 128]
    - [26, 31334.0]
  - - [13824, 512, 2, 128, 13824, 13824, 13824, 512]
    - [10, 35033.0]
  - - [13824, 128, 2, 512, 13824, 13824, 13824, 128]
    - [2, 34939.0]
  - - [10560, 128, 2, 512, 10560, 10560, 10560, 128]
    - [18, 30076.0]
  - - [10752, 128, 2, 512, 10752, 10752, 10752, 128]
    - [25, 32234.0]
  - - [13600, 512, 2, 256, 13600, 13600, 13600, 512]
    - [18, 35333.0]
  - - [15200, 512, 2, 256, 15200, 15200, 15200, 512]
    - [29, 35412.0]
  - - [768, 2048, 2, 512, 768, 768, 768, 2048]
    - [2, 31457.0]
  - - [12880, 512, 2, 128, 12880, 12880, 12880, 512]
    - [7, 32528.0]
  - - [11616, 128, 2, 512, 11616, 11616, 11616, 128]
    - [12, 27987.0]
  - - [14208, 512, 2, 128, 14208, 14208, 14208, 512]
    - [10, 34952.0]
  - - [11408, 512, 2, 128, 11408, 11408, 11408, 512]
    - [0, 33081.0]
  - - [6912, 256, 36, 256, 6912, 6912, 6912, 256]
    - [0, 37487.0]
  - - [13824, 512, 2, 256, 13824, 13824, 13824, 512]
    - [10, 36501.0]
  - - [11616, 512, 2, 128, 11616, 11616, 11616, 512]
    - [0, 33654.0]
  - - [12288, 512, 2, 128, 12288, 12288, 12288, 512]
    - [0, 33922.0]
  - - [14208, 128, 2, 512, 14208, 14208, 14208, 128]
    - [31, 31596.0]
  - - [11968, 128, 2, 512, 11968, 11968, 11968, 128]
    - [20, 28625.0]
  - - [864, 2048, 2, 512, 864, 864, 864, 2048]
    - [10, 29831.0]
  - - [10560, 512, 2, 128, 10560, 10560, 10560, 512]
    - [0, 32084.0]
  - - [672, 2048, 2, 512, 672, 672, 672, 2048]
    - [12, 26752.0]
  - - [9408, 128, 2, 512, 9408, 9408, 9408, 128]
    - [0, 27090.0]
  - - [10752, 512, 2, 128, 10752, 10752, 10752, 512]
    - [10, 34107.0]
  - - [11968, 512, 2, 128, 11968, 11968, 11968, 512]
    - [2, 33220.0]
  - - [1240, 256, 49, 256, 1240, 1240, 1240, 256]
    - [10, 34548.0]
  - - [4032, 256, 2, 1024, 4032, 4032, 4032, 256]
    - [2, 29723.0]
  - - [888, 2048, 2, 512, 888, 888, 888, 2048]
    - [0, 30599.0]
  - - [12880, 512, 2, 256, 12880, 12880, 12880, 512]
    - [0, 34823.0]
  - - [12288, 512, 2, 256, 12288, 12288, 12288, 512]
    - [29, 35672.0]
  - - [13440, 128, 2, 512, 13440, 13440, 13440, 128]
    - [25, 34246.0]
  - - [864, 2048, 2, 256, 864, 864, 864, 2048]
    - [15, 28153.0]
  - - [12672, 128, 2, 512, 12672, 12672, 12672, 128]
    - [25, 32402.0]
  - - [11264, 128, 2, 512, 11264, 11264, 11264, 128]
    - [9, 33463.0]
  - - [11776, 128, 2, 512, 11776, 11776, 11776, 128]
    - [2, 30182.0]
  - - [16128, 128, 2, 512, 16128, 16128, 16128, 128]
    - [6, 33385.0]
  - - [4032, 1024, 2, 256, 4032, 4032, 4032, 1024]
    - [0, 33997.0]
  - - [14000, 128, 2, 512, 14000, 14000, 14000, 128]
    - [20, 29285.0]
  - - [13440, 512, 2, 128, 13440, 13440, 13440, 512]
    - [23, 34514.0]
  - - [768, 2048, 2, 256, 768, 768, 768, 2048]
    - [25, 30026.0]
  - - [3264, 1024, 2, 256, 3264, 3264, 3264, 1024]
    - [0, 32733.0]
  - - [4200, 256, 2, 1024, 4200, 4200, 4200, 256]
    - [2, 31711.0]
  - - [2352, 1024, 2, 256, 2352, 2352, 2352, 1024]
    - [0, 31014.0]
  - - [2400, 1024, 2, 256, 2400, 2400, 2400, 1024]
    - [0, 31100.0]
  - - [15200, 256, 2, 12, 15200, 15200, 15200, 256]
    - [1, 8894.0]
  - - [12880, 256, 2, 12, 12880, 12880, 12880, 256]
    - [8, 8715.0]
  - - [2520, 1024, 2, 256, 2520, 2520, 2520, 1024]
    - [18, 32638.0]
  - - [13600, 256, 2, 12, 13600, 13600, 13600, 256]
    - [1, 8759.0]
  - - [15200, 256, 2, 3, 15200, 15200, 15200, 256]
    - [1, 2500.0]
  - - [12880, 256, 2, 3, 12880, 12880, 12880, 256]
    - [1, 2344.0]
  - - [4200, 1024, 2, 256, 4200, 4200, 4200, 1024]
    - [9, 34235.0]
  - - [12288, 256, 2, 12, 12288, 12288, 12288, 256]
    - [1, 7735.0]
  - - [13824, 256, 2, 12, 13824, 13824, 13824, 256]
    - [32, 8104.0]
  - - [13600, 256, 2, 3, 13600, 13600, 13600, 256]
    - [8, 2374.0]
  - - [7600, 512, 1, 256, 7600, 7600, 7600, 512]
    - [0, 30575.0]
  - - [6144, 512, 1, 256, 6144, 6144, 6144, 512]
    - [25, 30026.0]
  - - [12544, 1024, 1, 1024, 12544, 12544, 12544, 1024]
    - [23, 37912.0]
  - - [3800, 256, 2, 3, 3800, 3800, 3800, 256]
    - [1, 1431.0]
  - - [13824, 256, 2, 3, 13824, 13824, 13824, 256]
    - [1, 2235.0]
  - - [12288, 256, 2, 3, 12288, 12288, 12288, 256]
    - [1, 2121.0]
  - - [2688, 256, 2, 1024, 2688, 2688, 2688, 256]
    - [1, 27482.0]
  - - [3072, 256, 2, 12, 3072, 3072, 3072, 256]
    - [13, 4515.0]
  - - [3800, 256, 2, 12, 3800, 3800, 3800, 256]
    - [1, 5235.0]
  - - [3072, 256, 2, 3, 3072, 3072, 3072, 256]
    - [26, 1229.0]
  - - [2520, 256, 2, 1024, 2520, 2520, 2520, 256]
    - [4, 25506.0]
  - - [16128, 512, 2, 128, 16128, 16128, 16128, 512]
    - [10, 35456.0]
  - - [2400, 256, 2, 1024, 2400, 2400, 2400, 256]
    - [4, 24452.0]
  - - [2352, 256, 2, 1024, 2352, 2352, 2352, 256]
    - [1, 24151.0]
  - - [2944, 256, 2, 1024, 2944, 2944, 2944, 256]
    - [31, 28711.0]
  - - [2992, 1024, 2, 256, 2992, 2992, 2992, 1024]
    - [2, 32304.0]
  - - [2816, 256, 2, 1024, 2816, 2816, 2816, 256]
    - [1, 28701.0]
  - - [2904, 1024, 2, 256, 2904, 2904, 2904, 1024]
    - [5, 31759.0]
  - - [3456, 256, 2, 3, 3456, 3456, 3456, 256]
    - [26, 1500.0]
  - - [3400, 256, 2, 3, 3400, 3400, 3400, 256]
    - [1, 1306.0]
  - - [2816, 1024, 2, 256, 2816, 2816, 2816, 1024]
    - [0, 34788.0]
  - - [3456, 256, 2, 12, 3456, 3456, 3456, 256]
    - [13, 5647.0]
  - - [2944, 1024, 2, 256, 2944, 2944, 2944, 1024]
    - [25, 33222.0]
  - - [3168, 256, 2, 1024, 3168, 3168, 3168, 256]
    - [2, 29723.0]
  - - [2992, 256, 2, 1024, 2992, 2992, 2992, 256]
    - [2, 28583.0]
  - - [51520, 256, 2, 12, 51520, 51520, 51520, 256]
    - [13, 11741.0]
  - - [3072, 256, 2, 1024, 3072, 3072, 3072, 256]
    - [2, 30082.0]
  - - [2640, 1024, 2, 256, 2640, 2640, 2640, 1024]
    - [0, 31833.0]
  - - [2688, 1024, 2, 256, 2688, 2688, 2688, 1024]
    - [0, 33332.0]
  - - [2904, 256, 2, 1024, 2904, 2904, 2904, 256]
    - [2, 27582.0]
  - - [3264, 256, 2, 1024, 3264, 3264, 3264, 256]
    - [12, 30482.0]
  - - [54400, 256, 2, 12, 54400, 54400, 54400, 256]
    - [13, 12490.0]
  - - [55296, 256, 2, 3, 55296, 55296, 55296, 256]
    - [1, 2758.0]
  - - [60800, 256, 2, 12, 60800, 60800, 60800, 256]
    - [13, 12629.0]
  - - [51520, 256, 2, 3, 51520, 51520, 51520, 256]
    - [24, 3013.0]
  - - [55296, 256, 2, 12, 55296, 55296, 55296, 256]
    - [1, 10190.0]
  - - [3600, 1024, 2, 256, 3600, 3600, 3600, 1024]
    - [0, 33740.0]
  - - [60800, 256, 2, 3, 60800, 60800, 60800, 256]
    - [26, 3245.0]
  - - [952, 256, 64, 256, 952, 952, 952, 256]
    - [10, 32983.0]
  - - [49152, 256, 2, 12, 49152, 49152, 49152, 256]
    - [1, 9704.0]
  - - [3360, 256, 2, 1024, 3360, 3360, 3360, 256]
    - [27, 31379.0]
  - - [736, 256, 64, 256, 736, 736, 736, 256]
    - [0, 33554.0]
  - - [600, 256, 64, 256, 600, 600, 600, 256]
    - [2, 32598.0]
  - - [1440, 256, 49, 256, 1440, 1440, 1440, 256]
    - [7, 34162.0]
  - - [3168, 1024, 2, 256, 3168, 3168, 3168, 1024]
    - [15, 32377.0]
  - - [1368, 256, 49, 256, 1368, 1368, 1368, 256]
    - [31, 34898.0]
  - - [49152, 256, 2, 3, 49152, 49152, 49152, 256]
    - [8, 2614.0]
  - - [3600, 256, 2, 1024, 3600, 3600, 3600, 256]
    - [2, 27181.0]
  - - [3360, 1024, 2, 256, 3360, 3360, 3360, 1024]
    - [12, 32394.0]
  - - [54400, 256, 2, 3, 54400, 54400, 54400, 256]
    - [26, 3234.0]
  - - [3072, 1024, 2, 256, 3072, 3072, 3072, 1024]
    - [0, 34414.0]
  - - [2640, 256, 2, 1024, 2640, 2640, 2640, 256]
    - [1, 26700.0]
  - - [616, 256, 64, 256, 616, 616, 616, 256]
    - [12, 33090.0]
  - - [3008, 256, 64, 256, 3008, 3008, 3008, 256]
    - [0, 36440.0]
  - - [896, 256, 64, 256, 896, 896, 896, 256]
    - [23, 36345.0]
  - - [768, 256, 64, 256, 768, 768, 768, 256]
    - [0, 35720.0]
  - - [3552, 256, 2, 1024, 3552, 3552, 3552, 256]
    - [1, 26873.0]
  - - [3552, 1024, 2, 256, 3552, 3552, 3552, 1024]
    - [7, 33909.0]
  - - [800, 256, 64, 256, 800, 800, 800, 256]
    - [0, 32320.0]
  - - [1120, 256, 49, 256, 1120, 1120, 1120, 256]
    - [23, 34510.0]
  - - [2408, 256, 64, 256, 2408, 2408, 2408, 256]
    - [0, 36425.0]
  - - [3456, 256, 2, 1024, 3456, 3456, 3456, 256]
    - [6, 32298.0]
  - - [672, 256, 64, 256, 672, 672, 672, 256]
    - [7, 30517.0]
  - - [3456, 1024, 2, 256, 3456, 3456, 3456, 1024]
    - [0, 35795.0]
  - - [1064, 256, 49, 256, 1064, 1064, 1064, 256]
    - [0, 32847.0]
  - - [3400, 256, 2, 1024, 3400, 3400, 3400, 256]
    - [27, 31561.0]
  - - [704, 256, 64, 256, 704, 704, 704, 256]
    - [0, 31963.0]
  - - [3400, 1024, 2, 256, 3400, 3400, 3400, 1024]
    - [0, 33023.0]
  - - [3264, 256, 64, 256, 3264, 3264, 3264, 256]
    - [0, 36552.0]
  - - [3800, 1024, 2, 256, 3800, 3800, 3800, 1024]
    - [0, 32618.0]
  - - [3800, 256, 2, 1024, 3800, 3800, 3800, 256]
    - [2, 28535.0]
  - - [6440, 512, 1, 256, 6440, 6440, 6440, 512]
    - [3, 28967.0]
  - - [6912, 512, 1, 256, 6912, 6912, 6912, 512]
    - [2, 33430.0]
  - - [6800, 512, 1, 256, 6800, 6800, 6800, 512]
    - [9, 30131.0]
  - - [6800, 512, 1, 1024, 6800, 6800, 6800, 512]
    - [31, 34433.0]
  - - [6440, 512, 1, 1024, 6440, 6440, 6440, 512]
    - [12, 32966.0]
  - - [6912, 512, 1, 1024, 6912, 6912, 6912, 512]
    - [12, 35958.0]
  - - [1728, 1024, 1, 512, 1728, 1728, 1728, 1024]
    - [8, 25179.0]
  - - [1536, 1024, 1, 512, 1536, 1536, 1536, 1024]
    - [2, 28679.0]
  - - [7600, 512, 1, 1024, 7600, 7600, 7600, 512]
    - [2, 34091.0]
  - - [6144, 512, 1, 1024, 6144, 6144, 6144, 512]
    - [31, 32322.0]
  - - [1728, 1024, 1, 2048, 1728, 1728, 1728, 1024]
    - [9, 26999.0]
  - - [1536, 1024, 1, 2048, 1536, 1536, 1536, 1024]
    - [2, 30807.0]
  - - [4524, 256, 49, 256, 4524, 4524, 4524, 256]
    - [0, 36027.0]
  - - [2666, 256, 64, 256, 2666, 2666, 2666, 256]
    - [2, 36227.0]
  - - [950, 2048, 2, 512, 950, 950, 950, 2048]
    - [10, 28716.0]
  - - [3220, 1024, 2, 256, 3220, 3220, 3220, 1024]
    - [18, 32378.0]
  - - [782, 128, 64, 128, 782, 782, 782, 128]
    - [7, 26400.0]
  - - [850, 2048, 2, 512, 850, 850, 850, 2048]
    - [9, 29435.0]
  - - [805, 2048, 2, 512, 805, 805, 805, 2048]
    - [5, 28025.0]
  - - [713, 2048, 2, 512, 713, 713, 713, 2048]
    - [22, 28170.0]
  - - [660, 2048, 2, 512, 660, 660, 660, 2048]
    - [22, 26056.0]
  - - [726, 2048, 2, 512, 726, 726, 726, 2048]
    - [22, 28598.0]
  - - [805, 2048, 2, 256, 805, 805, 805, 2048]
    - [18, 26345.0]
  - - [1251, 256, 49, 256, 1251, 1251, 1251, 256]
    - [23, 34674.0]
  - - [1900, 1024, 1, 2048, 1900, 1900, 1900, 1024]
    - [9, 29647.0]
  - - [1610, 1024, 1, 2048, 1610, 1610, 1610, 1024]
    - [12, 31585.0]
  - - [1900, 1024, 1, 512, 1900, 1900, 1900, 1024]
    - [2, 27640.0]
  - - [3220, 256, 2, 12, 3220, 3220, 3220, 256]
    - [11, 4580.0]
  - - [3220, 256, 2, 3, 3220, 3220, 3220, 256]
    - [13, 1288.0]
  - - [3036, 1024, 2, 256, 3036, 3036, 3036, 1024]
    - [7, 32942.0]
  - - [3036, 256, 2, 1024, 3036, 3036, 3036, 256]
    - [2, 29174.0]
  - - [850, 2048, 2, 256, 850, 850, 850, 2048]
    - [9, 28457.0]
  - - [2852, 1024, 2, 256, 2852, 2852, 2852, 1024]
    - [0, 30805.0]
  - - [950, 2048, 2, 256, 950, 950, 950, 2048]
    - [18, 27701.0]
  - - [3700, 1024, 2, 256, 3700, 3700, 3700, 1024]
    - [7, 34529.0]
  - - [2852, 256, 2, 1024, 2852, 2852, 2852, 256]
    - [2, 27147.0]
  - - [3700, 256, 2, 1024, 3700, 3700, 3700, 256]
    - [2, 27952.0]
  - - [1269, 256, 49, 256, 1269, 1269, 1269, 256]
    - [2, 35239.0]
  - - [1467, 256, 49, 256, 1467, 1467, 1467, 256]
    - [7, 34680.0]
  - - [3500, 256, 2, 1024, 3500, 3500, 3500, 256]
    - [1, 26510.0]
  - - [1449, 256, 49, 256, 1449, 1449, 1449, 256]
    - [0, 34129.0]
  - - [1278, 256, 49, 256, 1278, 1278, 1278, 256]
    - [0, 35712.0]
  - - [1413, 256, 49, 256, 1413, 1413, 1413, 256]
    - [0, 33438.0]
  - - [1341, 256, 49, 256, 1341, 1341, 1341, 256]
    - [20, 34182.0]
  - - [1287, 256, 49, 256, 1287, 1287, 1287, 256]
    - [12, 32738.0]
  - - [1332, 256, 49, 256, 1332, 1332, 1332, 256]
    - [0, 34093.0]
  - - [1359, 256, 49, 256, 1359, 1359, 1359, 256]
    - [23, 34913.0]
  - - [1395, 256, 49, 256, 1395, 1395, 1395, 256]
    - [10, 35334.0]
  - - [1323, 256, 49, 256, 1323, 1323, 1323, 256]
    - [31, 33686.0]
  - - [1404, 256, 49, 256, 1404, 1404, 1404, 256]
    - [12, 35664.0]
  - - [1386, 256, 49, 256, 1386, 1386, 1386, 256]
    - [0, 35629.0]
  - - [1350, 256, 49, 256, 1350, 1350, 1350, 256]
    - [2, 34499.0]
  - - [3500, 1024, 2, 256, 3500, 3500, 3500, 1024]
    - [0, 32933.0]
  - - [3220, 256, 2, 1024, 3220, 3220, 3220, 256]
    - [25, 30147.0]
  - - [690, 256, 64, 256, 690, 690, 690, 256]
    - [0, 31423.0]
  - - [660, 256, 64, 256, 660, 660, 660, 256]
    - [0, 29927.0]
  - - [782, 256, 64, 256, 782, 782, 782, 256]
    - [0, 31113.0]
  - - [884, 256, 64, 256, 884, 884, 884, 256]
    - [0, 35171.0]
  - - [1610, 1024, 1, 512, 1610, 1610, 1610, 1024]
    - [6, 28401.0]
  - - [1700, 1024, 1, 512, 1700, 1700, 1700, 1024]
    - [4, 24540.0]
  - - [1700, 1024, 1, 2048, 1700, 1700, 1700, 1024]
    - [2, 26330.0]
  - - [1444, 128, 120, 256, 1444, 1444, 1444, 128]
    - [2, 33882.0]
  - - [1444, 128, 18, 256, 1444, 1444, 1444, 128]
    - [3, 28016.0]
  - - [1444, 128, 19, 256, 1444, 1444, 1444, 128]
    - [25, 29095.0]
  - - [1444, 256, 120, 256, 1444, 1444, 1444, 256]
    - [0, 34773.0]
  - - [1444, 256, 18, 256, 1444, 1444, 1444, 256]
    - [27, 30648.0]
  - - [1444, 256, 19, 256, 1444, 1444, 1444, 256]
    - [7, 31937.0]
  - - [361, 512, 120, 256, 361, 361, 361, 512]
    - [23, 33554.0]
  - - [361, 512, 18, 256, 361, 361, 361, 512]
    - [13, 27870.0]
  - - [361, 512, 19, 256, 361, 361, 361, 512]
    - [2, 27079.0]
  - - [1920, 25216, 1, 16384, 1920, 1920, 1920, 25216]
    - [25, 38908.0]
  - - [3840, 1920, 1, 16384, 3840, 3840, 3840, 1920]
    - [20, 36646.0]
  - - [1920, 3840, 1, 16384, 1920, 1920, 1920, 3840]
    - [2, 36662.0]
  - - [960, 1920, 1, 16384, 960, 960, 960, 1920]
    - [2, 28654.0]
  - - [1920, 2880, 1, 16384, 1920, 1920, 1920, 2880]
    - [31, 35443.0]
  - - [1920, 25216, 1, 4096, 1920, 1920, 1920, 25216]
    - [23, 39004.0]
  - - [3840, 1920, 1, 4096, 3840, 3840, 3840, 1920]
    - [9, 36467.0]
  - - [1920, 3840, 1, 4096, 1920, 1920, 1920, 3840]
    - [12, 36539.0]
  - - [960, 1920, 1, 4096, 960, 960, 960, 1920]
    - [9, 28353.0]
  - - [1920, 2880, 1, 4096, 1920, 1920, 1920, 2880]
    - [25, 35380.0]
  - - [1920, 25216, 1, 8192, 1920, 1920, 1920, 25216]
    - [0, 38908.0]
  - - [3840, 1920, 1, 8192, 3840, 3840, 3840, 1920]
    - [5, 36618.0]
  - - [1920, 3840, 1, 8192, 1920, 1920, 1920, 3840]
    - [12, 36621.0]
  - - [960, 1920, 1, 8192, 960, 960, 960, 1920]
    - [9, 28601.0]
  - - [1920, 2880, 1, 8192, 1920, 1920, 1920, 2880]
    - [25, 35507.0]
  - - [2304, 12672, 1, 16384, 2304, 2304, 2304, 12672]
    - [23, 38643.0]
  - - [2304, 2304, 1, 16384, 2304, 2304, 2304, 2304]
    - [16, 34729.0]
  - - [576, 2304, 1, 16384, 576, 576, 576, 2304]
    - [20, 26563.0]
  - - [2304, 1728, 1, 16384, 2304, 2304, 2304, 1728]
    - [16, 33386.0]
  - - [2304, 12672, 1, 4096, 2304, 2304, 2304, 12672]
    - [23, 38684.0]
  - - [2304, 2304, 1, 4096, 2304, 2304, 2304, 2304]
    - [6, 34613.0]
  - - [576, 2304, 1, 4096, 576, 576, 576, 2304]
    - [20, 26229.0]
  - - [2304, 1728, 1, 4096, 2304, 2304, 2304, 1728]
    - [27, 33199.0]
  - - [2304, 12672, 1, 8192, 2304, 2304, 2304, 12672]
    - [23, 38706.0]
  - - [2304, 2304, 1, 8192, 2304, 2304, 2304, 2304]
    - [16, 34697.0]
  - - [576, 2304, 1, 8192, 576, 576, 576, 2304]
    - [20, 26450.0]
  - - [2304, 1728, 1, 8192, 2304, 2304, 2304, 1728]
    - [27, 33303.0]
  - - [3072, 6400, 1, 4096, 3072, 3072, 3072, 6400]
    - [10, 38171.0]
  - - [1536, 3072, 1, 4096, 1536, 1536, 1536, 3072]
    - [25, 37385.0]
  - - [3072, 1536, 1, 4096, 3072, 3072, 3072, 1536]
    - [25, 37425.0]
  - - [384, 3072, 1, 4096, 384, 384, 384, 3072]
    - [20, 33190.0]
  - - [3072, 1152, 1, 4096, 3072, 3072, 3072, 1152]
    - [2, 36924.0]
  - - [3072, 6400, 1, 8192, 3072, 3072, 3072, 6400]
    - [10, 38098.0]
  - - [1536, 3072, 1, 8192, 1536, 1536, 1536, 3072]
    - [2, 37470.0]
  - - [3072, 1536, 1, 8192, 3072, 3072, 3072, 1536]
    - [12, 37527.0]
  - - [384, 3072, 1, 8192, 384, 384, 384, 3072]
    - [28, 33592.0]
  - - [3072, 1152, 1, 8192, 3072, 3072, 3072, 1152]
    - [25, 37094.0]
  - - [2048, 2048, 1, 4096, 2048, 2048, 2048, 2048]
    - [31, 33400.0]
  - - [2048, 2048, 1, 8, 2048, 2048, 2048, 2048]
    - [7, 4635.0]
  - - [2048, 29000, 1, 199, 2048, 2048, 2048, 29000]
    - [10, 36337.0]
  - - [2048, 29000, 1, 221, 2048, 2048, 2048, 29000]
    - [18, 36631.0]
  - - [2048, 29000, 1, 224, 2048, 2048, 2048, 29000]
    - [18, 37461.0]
  - - [2048, 29000, 1, 229, 2048, 2048, 2048, 29000]
    - [18, 36727.0]
  - - [2048, 29000, 1, 234, 2048, 2048, 2048, 29000]
    - [18, 36903.0]
  - - [2048, 29000, 1, 242, 2048, 2048, 2048, 29000]
    - [18, 36980.0]
  - - [2048, 29000, 1, 246, 2048, 2048, 2048, 29000]
    - [18, 37048.0]
  - - [2048, 29000, 1, 247, 2048, 2048, 2048, 29000]
    - [18, 36896.0]
  - - [2048, 29000, 1, 256, 2048, 2048, 2048, 29000]
    - [18, 37728.0]
  - - [2048, 29000, 1, 262, 2048, 2048, 2048, 29000]
    - [10, 37143.0]
  - - [2048, 29000, 1, 264, 2048, 2048, 2048, 29000]
    - [18, 37729.0]
  - - [2048, 29000, 1, 265, 2048, 2048, 2048, 29000]
    - [18, 37090.0]
  - - [2048, 29000, 1, 274, 2048, 2048, 2048, 29000]
    - [10, 37249.0]
  - - [2048, 29000, 1, 277, 2048, 2048, 2048, 29000]
    - [18, 37143.0]
  - - [2048, 29000, 1, 279, 2048, 2048, 2048, 29000]
    - [18, 37035.0]
  - - [2048, 29000, 1, 288, 2048, 2048, 2048, 29000]
    - [18, 37776.0]
  - - [2048, 29000, 1, 296, 2048, 2048, 2048, 29000]
    - [10, 37810.0]
  - - [2048, 29000, 1, 315, 2048, 2048, 2048, 29000]
    - [10, 37336.0]
  - - [2048, 29000, 1, 335, 2048, 2048, 2048, 29000]
    - [10, 37351.0]
  - - [2048, 4096, 1, 4096, 2048, 2048, 2048, 4096]
    - [12, 36258.0]
  - - [4096, 2048, 1, 4096, 4096, 4096, 4096, 2048]
    - [25, 36373.0]
  - - [1024, 29000, 1, 2283, 1024, 1024, 1024, 29000]
    - [23, 38399.0]
  - - [1024, 29000, 1, 2296, 1024, 1024, 1024, 29000]
    - [23, 38436.0]
  - - [1024, 29000, 1, 2306, 1024, 1024, 1024, 29000]
    - [10, 38338.0]
  - - [1024, 29000, 1, 2309, 1024, 1024, 1024, 29000]
    - [23, 38345.0]
  - - [1024, 29000, 1, 2318, 1024, 1024, 1024, 29000]
    - [23, 38356.0]
  - - [1024, 29000, 1, 2320, 1024, 1024, 1024, 29000]
    - [23, 38443.0]
  - - [1024, 29000, 1, 2324, 1024, 1024, 1024, 29000]
    - [23, 38328.0]
  - - [1024, 29000, 1, 2325, 1024, 1024, 1024, 29000]
    - [10, 38348.0]
  - - [1024, 29000, 1, 2329, 1024, 1024, 1024, 29000]
    - [23, 38310.0]
  - - [1024, 29000, 1, 2338, 1024, 1024, 1024, 29000]
    - [23, 38401.0]
  - - [1024, 29000, 1, 2345, 1024, 1024, 1024, 29000]
    - [23, 38314.0]
  - - [1024, 29000, 1, 2350, 1024, 1024, 1024, 29000]
    - [23, 38339.0]
  - - [1024, 29000, 1, 2362, 1024, 1024, 1024, 29000]
    - [23, 38334.0]
  - - [1024, 29000, 1, 2366, 1024, 1024, 1024, 29000]
    - [23, 38378.0]
  - - [1024, 29000, 1, 2368, 1024, 1024, 1024, 29000]
    - [23, 38392.0]
  - - [1024, 29000, 1, 2374, 1024, 1024, 1024, 29000]
    - [23, 38377.0]
  - - [1024, 29000, 1, 2390, 1024, 1024, 1024, 29000]
    - [23, 38383.0]
  - - [1024, 29000, 1, 561, 1024, 1024, 1024, 29000]
    - [10, 37541.0]
  - - [1024, 29000, 1, 574, 1024, 1024, 1024, 29000]
    - [0, 37658.0]
  - - [1024, 29000, 1, 600, 1024, 1024, 1024, 29000]
    - [10, 37995.0]
  - - [1024, 29000, 1, 608, 1024, 1024, 1024, 29000]
    - [10, 38014.0]
  - - [1024, 29000, 1, 615, 1024, 1024, 1024, 29000]
    - [23, 37676.0]
  - - [1024, 29000, 1, 622, 1024, 1024, 1024, 29000]
    - [0, 37754.0]
  - - [1024, 29000, 1, 625, 1024, 1024, 1024, 29000]
    - [0, 37733.0]
  - - [1024, 29000, 1, 626, 1024, 1024, 1024, 29000]
    - [10, 37825.0]
  - - [1024, 29000, 1, 628, 1024, 1024, 1024, 29000]
    - [10, 37825.0]
  - - [1024, 29000, 1, 636, 1024, 1024, 1024, 29000]
    - [10, 37837.0]
  - - [1024, 29000, 1, 651, 1024, 1024, 1024, 29000]
    - [0, 37781.0]
  - - [1024, 29000, 1, 658, 1024, 1024, 1024, 29000]
    - [10, 37846.0]
  - - [1024, 29000, 1, 669, 1024, 1024, 1024, 29000]
    - [10, 37804.0]
  - - [1024, 29000, 1, 670, 1024, 1024, 1024, 29000]
    - [0, 37840.0]
  - - [1024, 29000, 1, 672, 1024, 1024, 1024, 29000]
    - [10, 38075.0]
  - - [1024, 29000, 1, 684, 1024, 1024, 1024, 29000]
    - [0, 37857.0]
  - - [1024, 29000, 1, 716, 1024, 1024, 1024, 29000]
    - [10, 37911.0]
  - - [1024, 29000, 1, 730, 1024, 1024, 1024, 29000]
    - [0, 37934.0]
  - - [2560, 2560, 1, 1024, 2560, 2560, 2560, 2560]
    - [25, 35099.0]
  - - [2560, 2560, 1, 2, 2560, 2560, 2560, 2560]
    - [13, 1676.0]
  - - [2560, 29000, 1, 109, 2560, 2560, 2560, 29000]
    - [0, 34356.0]
  - - [2560, 29000, 1, 121, 2560, 2560, 2560, 29000]
    - [20, 32516.0]
  - - [2560, 29000, 1, 27, 2560, 2560, 2560, 29000]
    - [30, 11386.0]
  - - [2560, 29000, 1, 35, 2560, 2560, 2560, 29000]
    - [30, 14682.0]
  - - [2560, 29000, 1, 36, 2560, 2560, 2560, 29000]
    - [1, 15440.0]
  - - [2560, 29000, 1, 39, 2560, 2560, 2560, 29000]
    - [1, 16814.0]
  - - [2560, 29000, 1, 40, 2560, 2560, 2560, 29000]
    - [1, 17405.0]
  - - [2560, 29000, 1, 42, 2560, 2560, 2560, 29000]
    - [1, 18301.0]
  - - [2560, 29000, 1, 43, 2560, 2560, 2560, 29000]
    - [1, 18688.0]
  - - [2560, 29000, 1, 44, 2560, 2560, 2560, 29000]
    - [1, 19258.0]
  - - [2560, 29000, 1, 46, 2560, 2560, 2560, 29000]
    - [8, 19827.0]
  - - [2560, 29000, 1, 48, 2560, 2560, 2560, 29000]
    - [1, 21361.0]
  - - [2560, 29000, 1, 49, 2560, 2560, 2560, 29000]
    - [1, 21791.0]
  - - [2560, 29000, 1, 50, 2560, 2560, 2560, 29000]
    - [1, 22185.0]
  - - [2560, 29000, 1, 51, 2560, 2560, 2560, 29000]
    - [1, 21995.0]
  - - [2560, 29000, 1, 53, 2560, 2560, 2560, 29000]
    - [16, 22497.0]
  - - [2560, 29000, 1, 54, 2560, 2560, 2560, 29000]
    - [19, 22906.0]
  - - [2560, 29000, 1, 55, 2560, 2560, 2560, 29000]
    - [24, 23100.0]
  - - [2560, 29000, 1, 56, 2560, 2560, 2560, 29000]
    - [18, 23841.0]
  - - [2560, 29000, 1, 57, 2560, 2560, 2560, 29000]
    - [16, 23612.0]
  - - [2560, 29000, 1, 58, 2560, 2560, 2560, 29000]
    - [16, 24196.0]
  - - [2560, 29000, 1, 59, 2560, 2560, 2560, 29000]
    - [30, 23954.0]
  - - [2560, 29000, 1, 61, 2560, 2560, 2560, 29000]
    - [27, 24738.0]
  - - [2560, 29000, 1, 63, 2560, 2560, 2560, 29000]
    - [27, 25425.0]
  - - [2560, 29000, 1, 65, 2560, 2560, 2560, 29000]
    - [30, 27113.0]
  - - [2560, 29000, 1, 66, 2560, 2560, 2560, 29000]
    - [30, 27435.0]
  - - [2560, 29000, 1, 67, 2560, 2560, 2560, 29000]
    - [24, 27417.0]
  - - [2560, 29000, 1, 69, 2560, 2560, 2560, 29000]
    - [24, 27819.0]
  - - [2560, 29000, 1, 70, 2560, 2560, 2560, 29000]
    - [30, 28148.0]
  - - [2560, 29000, 1, 71, 2560, 2560, 2560, 29000]
    - [30, 27854.0]
  - - [2560, 29000, 1, 73, 2560, 2560, 2560, 29000]
    - [24, 27890.0]
  - - [2560, 29000, 1, 74, 2560, 2560, 2560, 29000]
    - [26, 28135.0]
  - - [2560, 29000, 1, 75, 2560, 2560, 2560, 29000]
    - [26, 28373.0]
  - - [2560, 29000, 1, 77, 2560, 2560, 2560, 29000]
    - [32, 28522.0]
  - - [2560, 29000, 1, 78, 2560, 2560, 2560, 29000]
    - [26, 28749.0]
  - - [2560, 29000, 1, 80, 2560, 2560, 2560, 29000]
    - [26, 31033.0]
  - - [2560, 29000, 1, 81, 2560, 2560, 2560, 29000]
    - [26, 29672.0]
  - - [2560, 29000, 1, 82, 2560, 2560, 2560, 29000]
    - [26, 29812.0]
  - - [2560, 29000, 1, 83, 2560, 2560, 2560, 29000]
    - [13, 29707.0]
  - - [2560, 29000, 1, 84, 2560, 2560, 2560, 29000]
    - [13, 30062.0]
  - - [2560, 29000, 1, 88, 2560, 2560, 2560, 29000]
    - [18, 31388.0]
  - - [2560, 29000, 1, 89, 2560, 2560, 2560, 29000]
    - [13, 30367.0]
  - - [2560, 29000, 1, 90, 2560, 2560, 2560, 29000]
    - [25, 30731.0]
  - - [2560, 29000, 1, 92, 2560, 2560, 2560, 29000]
    - [13, 30922.0]
  - - [2560, 29000, 1, 95, 2560, 2560, 2560, 29000]
    - [31, 31064.0]
  - - [2560, 29000, 1, 98, 2560, 2560, 2560, 29000]
    - [20, 31782.0]
  - - [2560, 4096, 1, 1024, 2560, 2560, 2560, 4096]
    - [23, 37319.0]
  - - [4096, 2560, 1, 1024, 4096, 4096, 4096, 2560]
    - [23, 37457.0]
  - - [1024, 3072, 1, 32768, 1024, 1024, 1024, 3072]
    - [12, 33124.0]
  - - [1024, 4096, 1, 32768, 1024, 1024, 1024, 4096]
    - [31, 33514.0]
  - - [1024, 50304, 1, 32768, 1024, 1024, 1024, 50304]
    - [0, 38789.0]
  - - [4096, 1024, 1, 32768, 4096, 4096, 4096, 1024]
    - [20, 33452.0]
  - - [1024, 128, 24, 1024, 1024, 1024, 1024, 128]
    - [25, 31811.0]
  - - [128, 1024, 24, 1024, 128, 128, 128, 1024]
    - [2, 32187.0]
  - - [256, 2560, 1, 8976, 256, 256, 256, 2560]
    - [38, 29773.0]
  - - [256, 2816, 1, 8976, 256, 256, 256, 2816]
    - [35, 32049.0]
  - - [256, 3328, 1, 8976, 256, 256, 256, 3328]
    - [40, 32681.0]
  - - [256, 3584, 1, 8976, 256, 256, 256, 3584]
    - [33, 30914.0]
  - - [256, 3840, 1, 8976, 256, 256, 256, 3840]
    - [36, 32802.0]
  - - [256, 4096, 1, 8976, 256, 256, 256, 4096]
    - [40, 31232.0]
  - - [256, 4352, 1, 8976, 256, 256, 256, 4352]
    - [35, 32926.0]
  - - [480, 1024, 1, 32768, 480, 480, 480, 1024]
    - [42, 29600.0]
  - - [1024, 256, 1, 21248, 1024, 1024, 1024, 256]
    - [38, 27583.0]
  - - [1024, 256, 1, 21504, 1024, 1024, 1024, 256]
    - [34, 27717.0]
  - - [1024, 256, 1, 22016, 1024, 1024, 1024, 256]
    - [41, 27997.0]
  - - [1024, 256, 1, 28672, 1024, 1024, 1024, 256]
    - [38, 28125.0]
  - - [1024, 256, 1, 33536, 1024, 1024, 1024, 256]
    - [34, 28656.0]
  - - [1024, 512, 1, 32768, 1024, 1024, 1024, 512]
    - [35, 31712.0]
  - - [1024, 1024, 1, 32768, 1024, 1024, 1024, 1024]
    - [42, 32839.0]
  - - [1024, 1024, 1, 9216, 1024, 1024, 1024, 1024]
    - [36, 31294.0]
  - - [1024, 1024, 1, 9520, 1024, 1024, 1024, 1024]
    - [40, 31526.0]
  - - [1024, 1024, 1, 10064, 1024, 1024, 1024, 1024]
    - [38, 31576.0]
  - - [1024, 1024, 1, 10080, 1024, 1024, 1024, 1024]
    - [38, 31697.0]
  - - [1024, 1024, 1, 10200, 1024, 1024, 1024, 1024]
    - [42, 31535.0]
  - - [479, 1024, 1, 32768, 479, 479, 479, 1024]
    - [39, 29202.0]
  - - [1024, 1024, 1, 8192, 1024, 1024, 1024, 1024]
    - [33, 30997.0]
  - - [1024, 1024, 1, 9600, 1024, 1024, 1024, 1024]
    - [40, 31576.0]
  - - [1024, 1024, 1, 16384, 1024, 1024, 1024, 1024]
    - [40, 32533.0]
  - - [512, 256, 1, 55296, 512, 512, 512, 256]
    - [37, 25987.0]
  - - [1024, 1024, 1, 10240, 1024, 1024, 1024, 1024]
    - [40, 31646.0]
  - - [1024, 1024, 1, 10496, 1024, 1024, 1024, 1024]
    - [36, 31759.0]
  - - [1024, 1024, 1, 10224, 1024, 1024, 1024, 1024]
    - [40, 31509.0]
  - - [1024, 1024, 1, 10192, 1024, 1024, 1024, 1024]
    - [40, 31466.0]
  - - [1024, 1024, 1, 10208, 1024, 1024, 1024, 1024]
    - [35, 31817.0]
  - - [1024, 1024, 1, 10184, 1024, 1024, 1024, 1024]
    - [40, 31644.0]
  - - [1024, 1024, 1, 10120, 1024, 1024, 1024, 1024]
    - [40, 31520.0]
  - - [1024, 1024, 1, 10152, 1024, 1024, 1024, 1024]
    - [40, 31558.0]
  - - [1024, 1024, 1, 12288, 1024, 1024, 1024, 1024]
    - [40, 31995.0]
  - - [64, 5888, 1, 1280, 64, 64, 64, 5888]
    - [63, 15856.0]
  - - [64, 5056, 1, 256, 64, 64, 64, 5056]
    - [44, 10486.0]
  - - [5888, 64, 1, 1280, 5888, 5888, 5888, 64]
    - [44, 16633.0]
  - - [5888, 64, 1, 3328, 5888, 5888, 5888, 64]
    - [54, 17530.0]
  - - [6784, 64, 1, 256, 6784, 6784, 6784, 64]
    - [45, 14177.0]
  - - [64, 6784, 1, 3328, 64, 64, 64, 6784]
    - [54, 19153.0]
  - - [64, 5056, 1, 3328, 64, 64, 64, 5056]
    - [63, 15184.0]
  - - [5056, 64, 1, 1280, 5056, 5056, 5056, 64]
    - [44, 14392.0]
  - - [64, 6784, 1, 1280, 64, 64, 64, 6784]
    - [63, 18197.0]
  - - [64, 6784, 1, 256, 64, 64, 64, 6784]
    - [54, 13722.0]
  - - [64, 5056, 1, 1280, 64, 64, 64, 5056]
    - [54, 14382.0]
  - - [5888, 64, 1, 256, 5888, 5888, 5888, 64]
    - [55, 12496.0]
  - - [64, 5888, 1, 3328, 64, 64, 64, 5888]
    - [54, 17510.0]
  - - [5056, 64, 1, 3328, 5056, 5056, 5056, 64]
    - [44, 15232.0]
  - - [6784, 64, 1, 3328, 6784, 6784, 6784, 64]
    - [45, 20096.0]
  - - [64, 5888, 1, 256, 64, 64, 64, 5888]
    - [50, 12180.0]
  - - [6784, 64, 1, 1280, 6784, 6784, 6784, 64]
    - [55, 19019.0]
  - - [5056, 64, 1, 256, 5056, 5056, 5056, 64]
    - [63, 10539.0]
  - - [1024, 1024, 1, 1024, 1024, 1024, 1024, 1024]
    - [56, 27688.0]
  - - [3136, 64, 128, 64, 3136, 3136, 3136, 64]
    - [44, 28764.0]
  - - [3136, 64, 64, 256, 3136, 3136, 3136, 64]
    - [45, 30442.0]
  - - [3136, 64, 256, 256, 3136, 3136, 3136, 64]
    - [43, 21086.0]
  - - [3136, 64, 128, 256, 3136, 3136, 3136, 64]
    - [45, 19112.0]
  - - [3136, 64, 64, 64, 3136, 3136, 3136, 64]
    - [62, 26622.0]
  - - [3136, 64, 256, 64, 3136, 3136, 3136, 64]
    - [43, 17643.0]
  - - [64, 128, 512, 128, 64, 64, 64, 128]
    - [44, 24053.0]
  - - [64, 512, 64, 512, 64, 64, 64, 512]
    - [44, 25040.0]
  - - [128, 64, 512, 128, 128, 128, 128, 64]
    - [60, 27033.0]
  - - [512, 64, 64, 512, 512, 512, 512, 64]
    - [45, 26843.0]
  - - [1024, 1024, 1, 4, 1024, 1024, 1024, 1024]
    - [56, 1344.0]
  - - [1024, 1024, 1, 32, 1024, 1024, 1024, 1024]
    - [62, 9698.0]
  - - [1024, 1024, 1, 2048, 1024, 1024, 1024, 1024]
    - [56, 28466.0]
  - - [1024, 1024, 1, 4096, 1024, 1024, 1024, 1024]
    - [56, 28841.0]
  - - [256, 1280, 1, 8976, 256, 256, 256, 1280]
    - [46, 16939.0]
  - - [257, 4096, 1, 1024, 257, 257, 257, 4096]
    - [44, 19592.0]
  - - [512, 2048, 1, 256, 512, 512, 512, 2048]
    - [56, 24010.0]
  - - [560, 1024, 1, 200, 560, 560, 560, 1024]
    - [49, 14336.0]
  - - [560, 1024, 1, 1600, 560, 560, 560, 1024]
    - [54, 23442.0]
  - - [1024, 1024, 1, 200, 1024, 1024, 1024, 1024]
    - [56, 21937.0]
  - - [1024, 1024, 1, 512, 1024, 1024, 1024, 1024]
    - [56, 26343.0]
  - - [1024, 1024, 1, 960, 1024, 1024, 1024, 1024]
    - [56, 27624.0]
  - - [1024, 1024, 1, 1600, 1024, 1024, 1024, 1024]
    - [56, 28273.0]
  - - [2048, 256, 1, 1024, 2048, 2048, 2048, 256]
    - [56, 23526.0]
  - - [1024, 1024, 1, 3840, 1024, 1024, 1024, 1024]
    - [56, 28814.0]
  - - [1024, 1024, 1, 3968, 1024, 1024, 1024, 1024]
    - [56, 28842.0]
  - - [1024, 1024, 1, 6528, 1024, 1024, 1024, 1024]
    - [65, 29007.0]
  - - [1024, 1024, 1, 7104, 1024, 1024, 1024, 1024]
    - [46, 29014.0]
  - - [1024, 1024, 1, 7200, 1024, 1024, 1024, 1024]
    - [46, 29029.0]
  - - [1024, 1024, 1, 8064, 1024, 1024, 1024, 1024]
    - [56, 29053.0]
  - - [1024, 1024, 1, 8160, 1024, 1024, 1024, 1024]
    - [46, 29052.0]
  - - [1024, 1024, 1, 3240, 1024, 1024, 1024, 1024]
    - [65, 28636.0]
  - - [1024, 1024, 1, 3960, 1024, 1024, 1024, 1024]
    - [56, 28800.0]
  - - [64, 1280, 64, 192, 64, 64, 64, 1280]
    - [63, 27869.0]
  - - [64, 1280, 64, 320, 64, 64, 64, 1280]
    - [63, 28475.0]
  - - [64, 1280, 64, 384, 64, 64, 64, 1280]
    - [44, 28517.0]
  - - [64, 1280, 64, 448, 64, 64, 64, 1280]
    - [54, 28665.0]
  - - [64, 2048, 64, 192, 64, 64, 64, 2048]
    - [44, 28466.0]
  - - [64, 2048, 64, 320, 64, 64, 64, 2048]
    - [54, 28796.0]
  - - [64, 2048, 64, 384, 64, 64, 64, 2048]
    - [44, 28848.0]
  - - [64, 2048, 64, 448, 64, 64, 64, 2048]
    - [44, 28899.0]
  - - [5329, 64, 64, 80, 5329, 5329, 5329, 64]
    - [55, 29220.0]
  - - [64, 1280, 32, 192, 64, 64, 64, 1280]
    - [63, 25318.0]
  - - [64, 1280, 32, 320, 64, 64, 64, 1280]
    - [54, 26462.0]
  - - [64, 1280, 32, 384, 64, 64, 64, 1280]
    - [63, 26744.0]
  - - [64, 1280, 32, 448, 64, 64, 64, 1280]
    - [63, 27148.0]
  - - [64, 2048, 32, 192, 64, 64, 64, 2048]
    - [44, 26719.0]
  - - [64, 2048, 32, 320, 64, 64, 64, 2048]
    - [63, 27380.0]
  - - [64, 2048, 32, 384, 64, 64, 64, 2048]
    - [44, 27457.0]
  - - [64, 2048, 32, 448, 64, 64, 64, 2048]
    - [68, 27625.0]
  - - [5329, 64, 32, 80, 5329, 5329, 5329, 64]
    - [64, 28663.0]
  - - [3136, 64, 32, 256, 3136, 3136, 3136, 64]
    - [45, 29276.0]
  - - [3136, 64, 32, 64, 3136, 3136, 3136, 64]
    - [67, 25279.0]
  - - [196, 256, 32, 1024, 196, 196, 196, 256]
    - [58, 22394.0]
  - - [3136, 64, 64, 128, 3136, 3136, 3136, 64]
    - [55, 30003.0]
  - - [3136, 64, 32, 128, 3136, 3136, 3136, 64]
    - [69, 28231.0]
  - - [960, 1024, 1, 1024, 960, 960, 960, 1024]
    - [56, 25191.0]
  - - [1024, 960, 1, 1024, 1024, 1024, 1024, 960]
    - [65, 25128.0]
  - - [64, 512, 16, 512, 64, 64, 64, 512]
    - [44, 19312.0]
  - - [1024, 1024, 1, 1, 1024, 1024, 1024, 1024]
    - [56, 347.0]
  - - [1024, 1024, 1, 77, 1024, 1024, 1024, 1024]
    - [62, 15008.0]
  - - [64, 128, 160, 128, 64, 64, 64, 128]
    - [54, 18979.0]
  - - [1024, 1024, 1, 10, 1024, 1024, 1024, 1024]
    - [56, 3427.0]
  - - [1024, 1024, 1, 1280, 1024, 1024, 1024, 1024]
    - [56, 27974.0]
  - - [64, 128, 624, 128, 64, 64, 64, 128]
    - [44, 26089.0]
  - - [1024, 1024, 1, 39, 1024, 1024, 1024, 1024]
    - [62, 9294.0]
  - - [1024, 1024, 1, 780, 1024, 1024, 1024, 1024]
    - [56, 26851.0]
  - - [1024, 1024, 1, 4992, 1024, 1024, 1024, 1024]
    - [56, 28945.0]
  - - [1024, 1024, 1, 308, 1024, 1024, 1024, 1024]
    - [56, 23923.0]
  - - [64, 128, 640, 128, 64, 64, 64, 128]
    - [54, 25752.0]
  - - [1024, 1024, 1, 40, 1024, 1024, 1024, 1024]
    - [62, 11523.0]
  - - [1024, 1024, 1, 800, 1024, 1024, 1024, 1024]
    - [56, 27342.0]
  - - [1024, 1024, 1, 5120, 1024, 1024, 1024, 1024]
    - [56, 28948.0]
  - - [64, 128, 656, 128, 64, 64, 64, 128]
    - [54, 26295.0]
  - - [1024, 1024, 1, 41, 1024, 1024, 1024, 1024]
    - [62, 9771.0]
  - - [1024, 1024, 1, 820, 1024, 1024, 1024, 1024]
    - [56, 27124.0]
  - - [1024, 1024, 1, 5248, 1024, 1024, 1024, 1024]
    - [56, 28941.0]
  - - [64, 512, 80, 512, 64, 64, 64, 512]
    - [44, 27170.0]
  - - [1024, 1024, 1, 5, 1024, 1024, 1024, 1024]
    - [62, 1771.0]
  - - [1024, 1024, 1, 385, 1024, 1024, 1024, 1024]
    - [56, 24797.0]
  - - [1024, 1024, 1, 2560, 1024, 1024, 1024, 1024]
    - [56, 28599.0]
  - - [64, 512, 96, 512, 64, 64, 64, 512]
    - [44, 27060.0]
  - - [1024, 1024, 1, 6, 1024, 1024, 1024, 1024]
    - [62, 2169.0]
  - - [1024, 1024, 1, 462, 1024, 1024, 1024, 1024]
    - [56, 25470.0]
  - - [1024, 1024, 1, 3072, 1024, 1024, 1024, 1024]
    - [56, 28730.0]
  - - [64, 128, 128, 128, 64, 64, 64, 128]
    - [62, 17568.0]
  - - [1024, 1024, 1, 8, 1024, 1024, 1024, 1024]
    - [62, 3438.0]
  - - [1024, 1024, 1, 160, 1024, 1024, 1024, 1024]
    - [56, 21291.0]
  - - [64, 128, 144, 128, 64, 64, 64, 128]
    - [62, 19309.0]
  - - [1024, 1024, 1, 9, 1024, 1024, 1024, 1024]
    - [56, 3064.0]
  - - [1024, 1024, 1, 180, 1024, 1024, 1024, 1024]
    - [56, 21207.0]
  - - [1024, 1024, 1, 1152, 1024, 1024, 1024, 1024]
    - [56, 27962.0]
  - - [2048, 512, 1, 1, 2048, 2048, 2048, 512]
    - [62, 386.0]
  - - [64, 1024, 32, 1024, 64, 64, 64, 1024]
    - [54, 25462.0]
  - - [1024, 64, 128, 1024, 1024, 1024, 1024, 64]
    - [43, 24793.0]
  - - [1024, 64, 32, 1024, 1024, 1024, 1024, 64]
    - [60, 27135.0]
  - - [1024, 96, 64, 1024, 1024, 1024, 1024, 96]
    - [48, 23813.0]
  - - [1024, 1024, 1, 16, 1024, 1024, 1024, 1024]
    - [62, 4486.0]
  - - [64, 512, 40, 512, 64, 64, 64, 512]
    - [63, 22904.0]
  - - [64, 1024, 256, 1024, 64, 64, 64, 1024]
    - [43, 23453.0]
  - - [96, 1024, 64, 1024, 96, 96, 96, 1024]
    - [58, 24431.0]
  - - [512, 64, 256, 512, 512, 512, 512, 64]
    - [70, 24425.0]
  - - [1024, 96, 128, 1024, 1024, 1024, 1024, 96]
    - [48, 25023.0]
  - - [64, 512, 128, 512, 64, 64, 64, 512]
    - [54, 27447.0]
  - - [64, 1024, 64, 1024, 64, 64, 64, 1024]
    - [63, 27659.0]
  - - [512, 64, 128, 512, 512, 512, 512, 64]
    - [51, 29442.0]
  - - [64, 1024, 128, 1024, 64, 64, 64, 1024]
    - [43, 24803.0]
  - - [1024, 64, 64, 1024, 1024, 1024, 1024, 64]
    - [55, 29633.0]
  - - [96, 1024, 128, 1024, 96, 96, 96, 1024]
    - [48, 25513.0]
  - - [64, 512, 256, 512, 64, 64, 64, 512]
    - [62, 22574.0]
  - - [1024, 64, 256, 1024, 1024, 1024, 1024, 64]
    - [57, 24439.0]
  - - [512, 64, 40, 512, 512, 512, 512, 64]
    - [69, 23882.0]
  - - [1024, 1024, 1, 64, 1024, 1024, 1024, 1024]
    - [67, 14526.0]
  - - [64, 128, 1024, 128, 64, 64, 64, 128]
    - [44, 27645.0]
  - - [128, 64, 1024, 128, 128, 128, 128, 64]
    - [69, 29661.0]
  - - [1024, 1024, 1, 3456, 1024, 1024, 1024, 1024]
    - [56, 28770.0]
  - - [1024, 1024, 1, 6912, 1024, 1024, 1024, 1024]
    - [56, 29023.0]
  - - [1024, 1024, 1, 864, 1024, 1024, 1024, 1024]
    - [56, 27404.0]
  - - [1024, 512, 1, 3456, 1024, 1024, 1024, 512]
    - [56, 26230.0]
  - - [1024, 512, 1, 4096, 1024, 1024, 1024, 512]
    - [46, 26447.0]
  - - [1024, 512, 1, 6912, 1024, 1024, 1024, 512]
    - [46, 26788.0]
  - - [1024, 512, 1, 864, 1024, 1024, 1024, 512]
    - [56, 23135.0]
  - - [256, 3456, 1, 1, 256, 256, 256, 3456]
    - [65, 285.0]
  - - [256, 4096, 1, 1, 256, 256, 256, 4096]
    - [43, 324.0]
  - - [480, 1024, 1, 3456, 480, 480, 480, 1024]
    - [56, 24218.0]
  - - [480, 1024, 1, 4096, 480, 480, 480, 1024]
    - [56, 24474.0]
  - - [480, 1024, 1, 6912, 480, 480, 480, 1024]
    - [56, 25058.0]
  - - [480, 1024, 1, 864, 480, 480, 480, 1024]
    - [56, 20089.0]
  - - [1024, 1024, 1, 80, 1024, 1024, 1024, 1024]
    - [62, 16384.0]
  - - [64, 128, 1280, 128, 64, 64, 64, 128]
    - [54, 28149.0]
  - - [128, 64, 1280, 128, 128, 128, 128, 64]
    - [69, 30216.0]
  - - [1024, 1024, 1, 82, 1024, 1024, 1024, 1024]
    - [62, 15245.0]
  - - [128, 64, 1312, 128, 128, 128, 128, 64]
    - [69, 30262.0]
  - - [64, 128, 1312, 128, 64, 64, 64, 128]
    - [63, 28168.0]
  - - [1024, 1024, 1, 12, 1024, 1024, 1024, 1024]
    - [56, 4007.0]
  - - [1024, 1024, 1, 6144, 1024, 1024, 1024, 1024]
    - [56, 28999.0]
  - - [64, 512, 192, 512, 64, 64, 64, 512]
    - [54, 28321.0]
  - - [512, 64, 192, 512, 512, 512, 512, 64]
    - [45, 30487.0]
  - - [784, 1152, 1, 128, 784, 784, 784, 1152]
    - [46, 13474.0]
  - - [64, 128, 2048, 128, 64, 64, 64, 128]
    - [44, 28534.0]
  - - [128, 64, 2048, 128, 128, 128, 128, 64]
    - [60, 30565.0]
  - - [1024, 1024, 1, 128, 1024, 1024, 1024, 1024]
    - [56, 16529.0]
  - - [128, 64, 1536, 128, 128, 128, 128, 64]
    - [60, 30725.0]
  - - [64, 128, 1536, 128, 64, 64, 64, 128]
    - [44, 28396.0]
  - - [1024, 1024, 1, 96, 1024, 1024, 1024, 1024]
    - [62, 17237.0]
  - - [92416, 64, 25, 64, 92416, 92416, 92416, 64]
    - [43, 12425.0]
  - - [50176, 64, 36, 64, 50176, 50176, 50176, 64]
    - [55, 11990.0]
  - - [36864, 64, 49, 64, 36864, 36864, 36864, 64]
    - [69, 12074.0]
  - - [25600, 64, 64, 64, 25600, 25600, 25600, 64]
    - [51, 12106.0]
  - - [64, 128, 192, 128, 64, 64, 64, 128]
    - [62, 18504.0]
  - - [128, 64, 192, 128, 128, 128, 128, 64]
    - [69, 21372.0]
  - - [768, 768, 1, 2048, 768, 768, 768, 768]
    - [46, 28356.0]
  - - [64, 384, 144, 384, 64, 64, 64, 384]
    - [63, 27332.0]
  - - [384, 64, 144, 384, 384, 384, 384, 64]
    - [55, 30186.0]
  - - [768, 768, 1, 4608, 768, 768, 768, 768]
    - [46, 29775.0]
  - - [64, 512, 48, 512, 64, 64, 64, 512]
    - [59, 23939.0]
  - - [512, 64, 48, 512, 512, 512, 512, 64]
    - [55, 25861.0]
  - - [64, 128, 256, 128, 64, 64, 64, 128]
    - [44, 21441.0]
  - - [128, 64, 256, 128, 128, 128, 128, 64]
    - [69, 23022.0]
  - - [64, 384, 192, 384, 64, 64, 64, 384]
    - [63, 27953.0]
  - - [384, 64, 192, 384, 384, 384, 384, 64]
    - [64, 30659.0]
  - - [1024, 1024, 1, 4608, 1024, 1024, 1024, 1024]
    - [56, 28871.0]
  - - [196, 2304, 1, 256, 196, 196, 196, 2304]
    - [56, 11492.0]
  - - [768, 512, 2, 2048, 768, 768, 768, 512]
    - [47, 25452.0]
  - - [672, 512, 2, 2048, 672, 672, 672, 512]
    - [47, 22068.0]
  - - [1008, 512, 2, 2048, 1008, 1008, 1008, 512]
    - [56, 27518.0]
  - - [864, 512, 2, 2048, 864, 864, 864, 512]
    - [56, 23747.0]
  - - [888, 512, 2, 2048, 888, 888, 888, 512]
    - [56, 24394.0]
  - - [840, 512, 2, 2048, 840, 840, 840, 512]
    - [46, 23082.0]
  - - [768, 256, 2, 12, 768, 768, 768, 256]
    - [45, 1605.0]
  - - [864, 256, 2, 3, 864, 864, 864, 256]
    - [53, 384.0]
  - - [864, 256, 2, 12, 864, 864, 864, 256]
    - [45, 1419.0]
  - - [768, 256, 2, 3, 768, 768, 768, 256]
    - [45, 472.0]
  - - [1024, 320, 1, 1024, 1024, 1024, 1024, 320]
    - [63, 14426.0]
  - - [173280, 64, 1, 128, 173280, 173280, 173280, 64]
    - [55, 29475.0]
  - - [25992, 64, 1, 128, 25992, 25992, 25992, 64]
    - [49, 18977.0]
  - - [713, 512, 2, 2048, 713, 713, 713, 512]
    - [47, 23334.0]
  - - [660, 512, 2, 2048, 660, 660, 660, 512]
    - [47, 21661.0]
  - - [726, 512, 2, 2048, 726, 726, 726, 512]
    - [57, 23797.0]
  - - [748, 512, 2, 2048, 748, 748, 748, 512]
    - [47, 24526.0]
  - - [805, 512, 2, 2048, 805, 805, 805, 512]
    - [44, 24333.0]
  - - [850, 512, 2, 2048, 850, 850, 850, 512]
    - [46, 23332.0]
  - - [850, 256, 2, 3, 850, 850, 850, 256]
    - [53, 377.0]
  - - [805, 256, 2, 12, 805, 805, 805, 256]
    - [55, 1330.0]
  - - [805, 256, 2, 3, 805, 805, 805, 256]
    - [53, 353.0]
  - - [850, 256, 2, 12, 850, 850, 850, 256]
    - [45, 1396.0]
  - - [950, 256, 2, 12, 950, 950, 950, 256]
    - [55, 1552.0]
  - - [950, 256, 2, 3, 950, 950, 950, 256]
    - [53, 412.0]
  - - [100, 512, 120, 128, 100, 100, 100, 512]
    - [44, 20448.0]
  - - [100, 512, 18, 128, 100, 100, 100, 512]
    - [43, 12417.0]
  - - [100, 512, 19, 128, 100, 100, 100, 512]
    - [44, 11996.0]
  - - [1444, 576, 1, 128, 1444, 1444, 1444, 576]
    - [43, 14544.0]
  - - [27436, 64, 1, 128, 27436, 27436, 27436, 64]
    - [44, 19646.0]
  - - [361, 2304, 1, 512, 361, 361, 361, 2304]
    - [46, 19900.0]
  - - [96, 1024, 160, 1024, 96, 96, 96, 1024]
    - [58, 25728.0]
  - - [1024, 96, 160, 1024, 1024, 1024, 1024, 96]
    - [58, 25228.0]
  - - [96, 1024, 40, 1024, 96, 96, 96, 1024]
    - [48, 25019.0]
  - - [1024, 96, 40, 1024, 1024, 1024, 1024, 96]
    - [45, 23323.0]
  - - [96, 1024, 80, 1024, 96, 96, 96, 1024]
    - [48, 25404.0]
  - - [1024, 96, 80, 1024, 1024, 1024, 1024, 96]
    - [52, 24035.0]
  - - [96, 1024, 96, 1024, 96, 96, 96, 1024]
    - [58, 25119.0]
  - - [1024, 96, 96, 1024, 1024, 1024, 1024, 96]
    - [58, 24485.0]
  - - [96, 1024, 24, 1024, 96, 96, 96, 1024]
    - [64, 22403.0]
  - - [1024, 96, 24, 1024, 1024, 1024, 1024, 96]
    - [45, 22511.0]
  - - [96, 1024, 48, 1024, 96, 96, 96, 1024]
    - [48, 24842.0]
  - - [1024, 96, 48, 1024, 1024, 1024, 1024, 96]
    - [71, 23403.0]
  - - [96, 1024, 16, 1024, 96, 96, 96, 1024]
    - [58, 21578.0]
  - - [1024, 96, 16, 1024, 1024, 1024, 1024, 96]
    - [64, 20357.0]
  - - [96, 1024, 32, 1024, 96, 96, 96, 1024]
    - [48, 22794.0]
  - - [1024, 96, 32, 1024, 1024, 1024, 1024, 96]
    - [55, 22451.0]
  - - [512, 64, 320, 512, 512, 512, 512, 64]
    - [43, 24670.0]
  - - [64, 512, 320, 512, 64, 64, 64, 512]
    - [43, 21083.0]
  - - [1024, 1024, 1, 20, 1024, 1024, 1024, 1024]
    - [61, 4900.0]
  - - [512, 64, 80, 512, 512, 512, 512, 64]
    - [45, 29267.0]
  - - [1024, 64, 512, 1024, 1024, 1024, 1024, 64]
    - [66, 24622.0]
  - - [64, 1024, 512, 1024, 64, 64, 64, 1024]
    - [43, 23379.0]
  - - [512, 256, 1, 32768, 512, 512, 512, 256]
    - [75, 25131.0]
  - - [1024, 256, 1, 8192, 1024, 1024, 1024, 256]
    - [76, 24265.0]
  - - [1024, 256, 1, 8448, 1024, 1024, 1024, 256]
    - [75, 24438.0]
  - - [1024, 256, 1, 9728, 1024, 1024, 1024, 256]
    - [72, 25036.0]
  - - [1024, 256, 1, 9984, 1024, 1024, 1024, 256]
    - [75, 25060.0]
  - - [1024, 256, 1, 10496, 1024, 1024, 1024, 256]
    - [72, 25303.0]
  - - [1024, 256, 1, 11520, 1024, 1024, 1024, 256]
    - [74, 25545.0]
  - - [1024, 256, 1, 12032, 1024, 1024, 1024, 256]
    - [74, 25710.0]
  - - [1024, 256, 1, 13568, 1024, 1024, 1024, 256]
    - [72, 26107.0]
  - - [1024, 256, 1, 14336, 1024, 1024, 1024, 256]
    - [75, 26251.0]
  - - [1024, 256, 1, 14848, 1024, 1024, 1024, 256]
    - [72, 26364.0]
  - - [1024, 256, 1, 15104, 1024, 1024, 1024, 256]
    - [72, 26403.0]
  - - [1024, 256, 1, 15872, 1024, 1024, 1024, 256]
    - [74, 26461.0]
  - - [1024, 256, 1, 16128, 1024, 1024, 1024, 256]
    - [72, 26530.0]
  - - [1024, 256, 1, 17152, 1024, 1024, 1024, 256]
    - [75, 26773.0]
  - - [1024, 256, 1, 17408, 1024, 1024, 1024, 256]
    - [74, 26825.0]
  - - [1024, 256, 1, 18944, 1024, 1024, 1024, 256]
    - [72, 26972.0]
  - - [1024, 256, 1, 19712, 1024, 1024, 1024, 256]
    - [75, 27066.0]
  - - [1024, 256, 1, 19968, 1024, 1024, 1024, 256]
    - [72, 27015.0]
  - - [256, 128, 1, 55296, 256, 256, 256, 128]
    - [73, 9440.0]
  - - [3584, 64, 1, 1280, 3584, 3584, 3584, 64]
    - [86, 12472.0]
  - - [64, 4288, 1, 1280, 64, 64, 64, 4288]
    - [139, 15866.0]
  - - [3584, 64, 1, 3328, 3584, 3584, 3584, 64]
    - [114, 14100.0]
  - - [64, 4288, 1, 3328, 64, 64, 64, 4288]
    - [101, 16807.0]
  - - [1856, 64, 1, 3328, 1856, 1856, 1856, 64]
    - [139, 12777.0]
  - - [2944, 64, 1, 256, 2944, 2944, 2944, 64]
    - [127, 9570.0]
  - - [64, 1856, 1, 256, 64, 64, 64, 1856]
    - [95, 6757.0]
  - - [2368, 64, 1, 256, 2368, 2368, 2368, 64]
    - [85, 7791.0]
  - - [2368, 64, 1, 3328, 2368, 2368, 2368, 64]
    - [83, 11867.0]
  - - [64, 1408, 1, 3328, 64, 64, 64, 1408]
    - [101, 9756.0]
  - - [1856, 64, 1, 1280, 1856, 1856, 1856, 64]
    - [101, 11147.0]
  - - [64, 3584, 1, 1280, 64, 64, 64, 3584]
    - [101, 13321.0]
  - - [4288, 64, 1, 3328, 4288, 4288, 4288, 64]
    - [101, 16801.0]
  - - [64, 2944, 1, 256, 64, 64, 64, 2944]
    - [85, 9570.0]
  - - [64, 2368, 1, 1280, 64, 64, 64, 2368]
    - [83, 11136.0]
  - - [64, 3584, 1, 3328, 64, 64, 64, 3584]
    - [101, 14121.0]
  - - [3584, 64, 1, 256, 3584, 3584, 3584, 64]
    - [86, 10021.0]
  - - [64, 1856, 1, 3328, 64, 64, 64, 1856]
    - [139, 12810.0]
  - - [4288, 64, 1, 1280, 4288, 4288, 4288, 64]
    - [90, 15880.0]
  - - [1408, 64, 1, 256, 1408, 1408, 1408, 64]
    - [84, 5796.0]
  - - [64, 1408, 1, 256, 64, 64, 64, 1408]
    - [84, 5767.0]
  - - [64, 2368, 1, 3328, 64, 64, 64, 2368]
    - [83, 11980.0]
  - - [64, 1856, 1, 1280, 64, 64, 64, 1856]
    - [101, 11196.0]
  - - [64, 4288, 1, 256, 64, 64, 64, 4288]
    - [86, 12112.0]
  - - [64, 1408, 1, 1280, 64, 64, 64, 1408]
    - [101, 8494.0]
  - - [64, 2944, 1, 3328, 64, 64, 64, 2944]
    - [88, 14129.0]
  - - [1856, 64, 1, 256, 1856, 1856, 1856, 64]
    - [97, 6698.0]
  - - [2944, 64, 1, 1280, 2944, 2944, 2944, 64]
    - [85, 13428.0]
  - - [4288, 64, 1, 256, 4288, 4288, 4288, 64]
    - [86, 12239.0]
  - - [64, 2944, 1, 1280, 64, 64, 64, 2944]
    - [85, 13295.0]
  - - [1408, 64, 1, 1280, 1408, 1408, 1408, 64]
    - [101, 8506.0]
  - - [64, 2368, 1, 256, 64, 64, 64, 2368]
    - [85, 7854.0]
  - - [64, 3584, 1, 256, 64, 64, 64, 3584]
    - [86, 10159.0]
  - - [2944, 64, 1, 3328, 2944, 2944, 2944, 64]
    - [85, 14174.0]
  - - [2368, 64, 1, 1280, 2368, 2368, 2368, 64]
    - [88, 11278.0]
  - - [1408, 64, 1, 3328, 1408, 1408, 1408, 64]
    - [121, 9768.0]
  - - [33, 32, 200, 33, 33, 33, 33, 32]
    - [82, 2112.0]
  - - [33, 32, 1600, 33, 33, 33, 33, 32]
    - [103, 6350.0]
  - - [67, 2048, 1, 512, 67, 67, 67, 2048]
    - [126, 7983.0]
  - - [74, 2048, 1, 512, 74, 74, 74, 2048]
    - [126, 8838.0]
  - - [74, 2048, 1, 960, 74, 74, 74, 2048]
    - [83, 9924.0]
  - - [100, 2048, 1, 512, 100, 100, 100, 2048]
    - [86, 10341.0]
  - - [512, 512, 1, 200, 512, 512, 512, 512]
    - [86, 10321.0]
  - - [512, 512, 1, 1600, 512, 512, 512, 512]
    - [114, 15546.0]
  - - [1024, 256, 1, 1024, 1024, 1024, 1024, 256]
    - [86, 14996.0]
  - - [1024, 256, 1, 1280, 1024, 1024, 1024, 256]
    - [114, 15280.0]
  - - [1024, 256, 1, 2304, 1024, 1024, 1024, 256]
    - [114, 15886.0]
  - - [1024, 256, 1, 2816, 1024, 1024, 1024, 256]
    - [133, 16048.0]
  - - [1024, 256, 1, 3072, 1024, 1024, 1024, 256]
    - [133, 16093.0]
  - - [1024, 256, 1, 3328, 1024, 1024, 1024, 256]
    - [114, 16126.0]
  - - [1024, 256, 1, 3584, 1024, 1024, 1024, 256]
    - [133, 16176.0]
  - - [1024, 256, 1, 4096, 1024, 1024, 1024, 256]
    - [114, 16254.0]
  - - [1024, 256, 1, 4352, 1024, 1024, 1024, 256]
    - [90, 16251.0]
  - - [1024, 256, 1, 4608, 1024, 1024, 1024, 256]
    - [101, 16275.0]
  - - [1024, 256, 1, 5120, 1024, 1024, 1024, 256]
    - [101, 16316.0]
  - - [1024, 256, 1, 5376, 1024, 1024, 1024, 256]
    - [101, 16326.0]
  - - [1024, 256, 1, 5632, 1024, 1024, 1024, 256]
    - [133, 16339.0]
  - - [1024, 256, 1, 6144, 1024, 1024, 1024, 256]
    - [114, 16375.0]
  - - [1024, 256, 1, 6400, 1024, 1024, 1024, 256]
    - [101, 16410.0]
  - - [1024, 256, 1, 7680, 1024, 1024, 1024, 256]
    - [121, 16462.0]
  - - [1024, 256, 1, 7936, 1024, 1024, 1024, 256]
    - [101, 16474.0]
  - - [32, 64, 4608, 32, 32, 32, 32, 64]
    - [87, 14408.0]
  - - [32, 64, 4608, 35, 32, 32, 32, 64]
    - [115, 14538.0]
  - - [34, 64, 4736, 24, 34, 34, 34, 64]
    - [78, 7862.0]
  - - [34, 64, 4736, 34, 34, 34, 34, 64]
    - [85, 8790.0]
  - - [35, 64, 4608, 35, 35, 35, 35, 64]
    - [85, 8855.0]
  - - [64, 32, 4608, 32, 64, 64, 64, 32]
    - [131, 14674.0]
  - - [64, 32, 4608, 35, 64, 64, 64, 32]
    - [92, 15055.0]
  - - [64, 34, 4736, 24, 64, 64, 64, 34]
    - [80, 8923.0]
  - - [64, 34, 4736, 34, 64, 64, 64, 34]
    - [85, 9294.0]
  - - [64, 35, 4608, 35, 64, 64, 64, 35]
    - [97, 9437.0]
  - - [33, 64, 1920, 33, 33, 33, 33, 64]
    - [85, 7526.0]
  - - [64, 33, 1920, 33, 64, 64, 64, 33]
    - [85, 8052.0]
  - - [49, 512, 64, 2048, 49, 49, 49, 512]
    - [112, 14667.0]
  - - [49, 2048, 64, 512, 49, 49, 49, 2048]
    - [139, 15402.0]
  - - [49, 512, 32, 2048, 49, 49, 49, 512]
    - [88, 13823.0]
  - - [49, 2048, 32, 512, 49, 49, 49, 2048]
    - [112, 15056.0]
  - - [49, 1024, 64, 2048, 49, 49, 49, 1024]
    - [90, 15173.0]
  - - [49, 2048, 64, 1024, 49, 49, 49, 2048]
    - [90, 15502.0]
  - - [49, 1024, 32, 2048, 49, 49, 49, 1024]
    - [131, 14668.0]
  - - [49, 2048, 32, 1024, 49, 49, 49, 2048]
    - [131, 15102.0]
  - - [480, 512, 1, 512, 480, 480, 480, 512]
    - [110, 11377.0]
  - - [512, 480, 1, 512, 512, 512, 512, 480]
    - [110, 12193.0]
  - - [512, 512, 1, 512, 512, 512, 512, 512]
    - [110, 13612.0]
  - - [256, 864, 1, 1, 256, 256, 256, 864]
    - [81, 126.0]
  - - [512, 256, 1, 3456, 512, 512, 512, 256]
    - [101, 14094.0]
  - - [512, 256, 1, 4096, 512, 512, 512, 256]
    - [101, 14324.0]
  - - [512, 256, 1, 6912, 512, 512, 512, 256]
    - [139, 14736.0]
  - - [512, 256, 1, 864, 512, 512, 512, 256]
    - [101, 11038.0]
  - - [49, 4608, 1, 512, 49, 49, 49, 4608]
    - [110, 11116.0]
  - - [49, 2048, 128, 512, 49, 49, 49, 2048]
    - [114, 15549.0]
  - - [49, 2048, 256, 512, 49, 49, 49, 2048]
    - [101, 15614.0]
  - - [49, 512, 128, 2048, 49, 49, 49, 512]
    - [133, 15184.0]
  - - [49, 512, 256, 2048, 49, 49, 49, 512]
    - [133, 15569.0]
  - - [56, 512, 64, 512, 56, 56, 56, 512]
    - [131, 16317.0]
  - - [176, 256, 2, 3, 176, 176, 176, 256]
    - [106, 159.0]
  - - [176, 256, 2, 12, 176, 176, 176, 256]
    - [125, 607.0]
  - - [216, 256, 2, 3, 216, 216, 216, 256]
    - [117, 195.0]
  - - [192, 256, 2, 12, 192, 192, 192, 256]
    - [125, 655.0]
  - - [192, 256, 2, 3, 192, 192, 192, 256]
    - [91, 178.0]
  - - [216, 256, 2, 12, 216, 216, 216, 256]
    - [93, 746.0]
  - - [228, 256, 2, 12, 228, 228, 228, 256]
    - [93, 778.0]
  - - [228, 256, 2, 3, 228, 228, 228, 256]
    - [125, 204.0]
  - - [187, 256, 2, 12, 187, 187, 187, 256]
    - [106, 638.0]
  - - [247, 256, 2, 12, 247, 247, 247, 256]
    - [125, 834.0]
  - - [187, 256, 2, 3, 187, 187, 187, 256]
    - [125, 171.0]
  - - [221, 256, 2, 3, 221, 221, 221, 256]
    - [117, 200.0]
  - - [221, 256, 2, 12, 221, 221, 221, 256]
    - [93, 754.0]
  - - [247, 256, 2, 3, 247, 247, 247, 256]
    - [125, 221.0]
  - - [100, 2304, 1, 512, 100, 100, 100, 2304]
    - [86, 11498.0]
  - - [256, 128, 1, 32768, 256, 256, 256, 128]
    - [143, 13002.0]
  - - [2048, 2, 1, 2, 2048, 2048, 2048, 2]
    - [79, 5.0]
  - - [2560, 2, 1, 4, 2560, 2560, 2560, 2]
    - [79, 12.0]
  - - [2048, 2, 1, 8, 2048, 2048, 2048, 2]
    - [146, 19.0]
  - - [2560, 2, 1, 2, 2560, 2560, 2560, 2]
    - [145, 6.0]
  - - [25, 1152, 1, 256, 25, 25, 25, 1152]
    - [119, 2131.0]
  - - [9, 1152, 1, 256, 9, 9, 9, 1152]
    - [135, 785.0]
  - - [13, 512, 1, 32768, 13, 13, 13, 512]
    - [144, 3439.0]
  - - [1024, 2, 1, 4992, 1024, 1024, 1024, 2]
    - [141, 557.0]
  - - [1024, 2, 1, 5120, 1024, 1024, 1024, 2]
    - [141, 563.0]
  - - [1024, 2, 1, 5248, 1024, 1024, 1024, 2]
    - [141, 571.0]
  - - [256, 128, 1, 6912, 256, 256, 256, 128]
    - [142, 8015.0]
  - - [13, 512, 1, 55296, 13, 13, 13, 512]
    - [144, 3698.0]
  - - [13, 512, 1, 6912, 13, 13, 13, 512]
    - [140, 2124.0]
  - - [768, 2, 1, 4608, 768, 768, 768, 2]
    - [141, 442.0]
  - - [1024, 2, 1, 4608, 1024, 1024, 1024, 2]
    - [141, 536.0]
  - - [64, 448, 1, 3328, 64, 64, 64, 448]
    - [89, 5012.0]
  - - [1, 64, 1, 256, 1, 1, 1, 64]
    - [81, 3.0]
  - - [64, 128, 1, 256, 64, 64, 64, 128]
    - [96, 690.0]
  - - [64, 1024, 1, 3328, 64, 64, 64, 1024]
    - [89, 7925.0]
  - - [1, 64, 1, 1280, 1, 1, 1, 64]
    - [81, 4.0]
  - - [704, 64, 1, 3328, 704, 704, 704, 64]
    - [111, 6548.0]
  - - [64, 448, 1, 1280, 64, 64, 64, 448]
    - [89, 4509.0]
  - - [64, 704, 1, 3328, 64, 64, 64, 704]
    - [129, 6629.0]
  - - [64, 64, 1, 1280, 64, 64, 64, 64]
    - [89, 652.0]
  - - [1, 64, 1, 1, 1, 1, 1, 64]
    - [81, 0.04]
  - - [448, 64, 1, 1280, 448, 448, 448, 64]
    - [89, 4520.0]
  - - [64, 1024, 1, 1280, 64, 64, 64, 1024]
    - [89, 7232.0]
  - - [64, 256, 1, 1280, 64, 64, 64, 256]
    - [89, 2589.0]
  - - [704, 64, 1, 1280, 704, 704, 704, 64]
    - [111, 5849.0]
  - - [64, 128, 1, 1280, 64, 64, 64, 128]
    - [89, 1298.0]
  - - [448, 64, 1, 3328, 448, 448, 448, 64]
    - [89, 5278.0]
  - - [128, 64, 1, 256, 128, 128, 128, 64]
    - [94, 677.0]
  - - [64, 128, 1, 3328, 64, 64, 64, 128]
    - [89, 1516.0]
  - - [64, 256, 1, 3328, 64, 64, 64, 256]
    - [89, 3026.0]
  - - [1024, 64, 1, 1280, 1024, 1024, 1024, 64]
    - [89, 7269.0]
  - - [448, 64, 1, 256, 448, 448, 448, 64]
    - [98, 2353.0]
  - - [256, 64, 1, 256, 256, 256, 256, 64]
    - [94, 1344.0]
  - - [1, 1, 1, 1, 1, 1, 1, 1]
    - [81, 0.0005882352863190291]
  - - [1024, 64, 1, 3328, 1024, 1024, 1024, 64]
    - [89, 7925.0]
  - - [64, 448, 1, 256, 64, 64, 64, 448]
    - [120, 2368.0]
  - - [128, 64, 1, 1280, 128, 128, 128, 64]
    - [99, 1301.0]
  - - [64, 1024, 1, 256, 64, 64, 64, 1024]
    - [128, 4849.0]
  - - [256, 64, 1, 1280, 256, 256, 256, 64]
    - [89, 2583.0]
  - - [64, 256, 1, 256, 64, 64, 64, 256]
    - [135, 1371.0]
  - - [704, 64, 1, 256, 704, 704, 704, 64]
    - [118, 3453.0]
  - - [1, 1, 1, 256, 1, 1, 1, 1]
    - [81, 0.07]
  - - [64, 704, 1, 256, 64, 64, 64, 704]
    - [96, 3517.0]
  - - [64, 64, 1, 256, 64, 64, 64, 64]
    - [96, 343.0]
  - - [128, 64, 1, 3328, 128, 128, 128, 64]
    - [89, 1523.0]
  - - [1, 1, 1, 1280, 1, 1, 1, 1]
    - [81, 0.11]
  - - [1024, 64, 1, 256, 1024, 1024, 1024, 64]
    - [128, 4766.0]
  - - [256, 64, 1, 3328, 256, 256, 256, 64]
    - [89, 3029.0]
  - - [64, 64, 1, 3328, 64, 64, 64, 64]
    - [132, 760.0]
  - - [1, 1, 1, 3328, 1, 1, 1, 1]
    - [125, 0.13]
  - - [64, 704, 1, 1280, 64, 64, 64, 704]
    - [129, 5861.0]
  - - [512, 16, 1, 512, 512, 512, 512, 16]
    - [99, 932.0]
  - - [1024, 32, 1, 512, 1024, 1024, 1024, 32]
    - [89, 3796.0]
  - - [1024, 16, 1, 512, 1024, 1024, 1024, 16]
    - [99, 1898.0]
  - - [512, 32, 1, 512, 512, 512, 512, 32]
    - [89, 1942.0]
  - - [14, 64, 1, 14, 14, 14, 14, 64]
    - [79, 6.0]
  - - [15, 64, 1, 14, 15, 15, 15, 64]
    - [104, 10.0]
  - - [15, 64, 1, 15, 15, 15, 15, 64]
    - [79, 10.0]
  - - [17, 64, 1, 15, 17, 17, 17, 64]
    - [77, 9.0]
  - - [17, 64, 1, 17, 17, 17, 17, 64]
    - [84, 10.0]
  - - [21, 64, 1, 17, 21, 21, 21, 64]
    - [84, 12.0]
  - - [21, 64, 1, 21, 21, 21, 21, 64]
    - [84, 15.0]
  - - [24, 64, 1, 24, 24, 24, 24, 64]
    - [77, 19.0]
  - - [30, 64, 1, 30, 30, 30, 30, 64]
    - [84, 27.0]
  - - [30, 64, 1, 31, 30, 30, 30, 64]
    - [124, 29.0]
  - - [31, 64, 1, 31, 31, 31, 31, 64]
    - [124, 30.0]
  - - [32, 64, 1, 32, 32, 32, 32, 64]
    - [100, 38.0]
  - - [32, 64, 1, 35, 32, 32, 32, 64]
    - [81, 35.0]
  - - [34, 64, 1, 24, 34, 34, 34, 64]
    - [106, 27.0]
  - - [34, 64, 1, 34, 34, 34, 34, 64]
    - [81, 37.0]
  - - [35, 64, 1, 35, 35, 35, 35, 64]
    - [81, 37.0]
  - - [64, 14, 1, 14, 64, 64, 64, 14]
    - [130, 8.0]
  - - [64, 15, 1, 14, 64, 64, 64, 15]
    - [82, 7.0]
  - - [64, 15, 1, 15, 64, 64, 64, 15]
    - [82, 8.0]
  - - [64, 17, 1, 15, 64, 64, 64, 17]
    - [119, 9.0]
  - - [64, 17, 1, 17, 64, 64, 64, 17]
    - [84, 10.0]
  - - [64, 21, 1, 17, 64, 64, 64, 21]
    - [84, 13.0]
  - - [64, 21, 1, 21, 64, 64, 64, 21]
    - [84, 15.0]
  - - [64, 24, 1, 24, 64, 64, 64, 24]
    - [106, 20.0]
  - - [64, 30, 1, 30, 64, 64, 64, 30]
    - [106, 29.0]
  - - [64, 30, 1, 31, 64, 64, 64, 30]
    - [84, 29.0]
  - - [64, 31, 1, 31, 64, 64, 64, 31]
    - [79, 28.0]
  - - [64, 32, 1, 32, 64, 64, 64, 32]
    - [106, 39.0]
  - - [64, 32, 1, 35, 64, 64, 64, 32]
    - [109, 34.0]
  - - [64, 34, 1, 24, 64, 64, 64, 34]
    - [91, 29.0]
  - - [64, 34, 1, 34, 64, 64, 64, 34]
    - [81, 35.0]
  - - [64, 35, 1, 35, 64, 64, 64, 35]
    - [108, 36.0]
  - - [64, 512, 1, 512, 64, 64, 64, 512]
    - [89, 3745.0]
  - - [512, 64, 1, 512, 512, 512, 512, 64]
    - [89, 3779.0]
  - - [1024, 2, 1, 4, 1024, 1024, 1024, 2]
    - [77, 5.0]
  - - [1024, 2, 1, 32, 1024, 1024, 1024, 2]
    - [81, 33.0]
  - - [1024, 2, 1, 2048, 1024, 1024, 1024, 2]
    - [113, 342.0]
  - - [3, 64, 512, 3, 3, 3, 3, 64]
    - [78, 109.0]
  - - [5, 64, 512, 5, 5, 5, 5, 64]
    - [102, 275.0]
  - - [5, 64, 960, 5, 5, 5, 5, 64]
    - [122, 362.0]
  - - [9, 64, 512, 9, 9, 9, 9, 64]
    - [122, 829.0]
  - - [27, 128, 32768, 27, 27, 27, 27, 128]
    - [137, 4547.0]
  - - [512, 32, 1, 200, 512, 512, 512, 32]
    - [119, 795.0]
  - - [512, 32, 1, 1600, 512, 512, 512, 32]
    - [89, 2669.0]
  - - [1024, 64, 1, 512, 1024, 1024, 1024, 64]
    - [89, 6035.0]
  - - [1024, 64, 1, 960, 1024, 1024, 1024, 64]
    - [89, 6914.0]
  - - [14, 64, 10880, 14, 14, 14, 14, 64]
    - [115, 3725.0]
  - - [15, 64, 10880, 14, 15, 15, 15, 64]
    - [115, 3976.0]
  - - [15, 64, 7680, 15, 15, 15, 15, 64]
    - [115, 4022.0]
  - - [15, 64, 10880, 15, 15, 15, 15, 64]
    - [78, 4151.0]
  - - [17, 64, 7680, 15, 17, 17, 17, 64]
    - [126, 3673.0]
  - - [17, 64, 6144, 17, 17, 17, 17, 64]
    - [107, 3959.0]
  - - [17, 64, 7680, 17, 17, 17, 17, 64]
    - [83, 4042.0]
  - - [21, 64, 6144, 17, 21, 21, 21, 64]
    - [81, 3819.0]
  - - [21, 64, 6144, 21, 21, 21, 21, 64]
    - [83, 4474.0]
  - - [24, 64, 4736, 24, 24, 24, 24, 64]
    - [115, 6075.0]
  - - [30, 64, 2048, 30, 30, 30, 30, 64]
    - [79, 6718.0]
  - - [30, 64, 2048, 31, 30, 30, 30, 64]
    - [78, 6765.0]
  - - [31, 64, 2048, 31, 31, 31, 31, 64]
    - [81, 6772.0]
  - - [64, 14, 10880, 14, 64, 64, 64, 14]
    - [80, 4383.0]
  - - [64, 15, 10880, 14, 64, 64, 64, 15]
    - [80, 4636.0]
  - - [64, 15, 7680, 15, 64, 64, 64, 15]
    - [80, 4585.0]
  - - [64, 15, 10880, 15, 64, 64, 64, 15]
    - [80, 4696.0]
  - - [64, 17, 7680, 15, 64, 64, 64, 17]
    - [80, 5141.0]
  - - [64, 17, 6144, 17, 64, 64, 64, 17]
    - [116, 5642.0]
  - - [64, 17, 7680, 17, 64, 64, 64, 17]
    - [92, 5793.0]
  - - [64, 21, 6144, 17, 64, 64, 64, 21]
    - [116, 6881.0]
  - - [64, 21, 6144, 21, 64, 64, 64, 21]
    - [134, 7619.0]
  - - [64, 24, 4736, 24, 64, 64, 64, 24]
    - [116, 9582.0]
  - - [64, 30, 2048, 30, 64, 64, 64, 30]
    - [92, 10065.0]
  - - [64, 30, 2048, 31, 64, 64, 64, 30]
    - [92, 10261.0]
  - - [64, 31, 2048, 31, 64, 64, 64, 31]
    - [92, 10427.0]
  - - [27, 64, 1920, 27, 27, 27, 27, 64]
    - [81, 5677.0]
  - - [27, 64, 1920, 33, 27, 27, 27, 64]
    - [123, 6767.0]
  - - [64, 27, 1920, 27, 64, 64, 64, 27]
    - [136, 8483.0]
  - - [64, 27, 1920, 33, 64, 64, 64, 27]
    - [92, 10063.0]
  - - [1024, 2, 1, 1, 1024, 1024, 1024, 2]
    - [77, 1.0]
  - - [1024, 2, 1, 512, 1024, 1024, 1024, 2]
    - [89, 219.0]
  - - [1024, 2, 1, 10, 1024, 1024, 1024, 2]
    - [93, 12.0]
  - - [1024, 2, 1, 1280, 1024, 1024, 1024, 2]
    - [99, 308.0]
  - - [1024, 2, 1, 39, 1024, 1024, 1024, 2]
    - [77, 36.0]
  - - [1024, 2, 1, 40, 1024, 1024, 1024, 2]
    - [81, 39.0]
  - - [1024, 2, 1, 41, 1024, 1024, 1024, 2]
    - [81, 39.0]
  - - [1024, 2, 1, 5, 1024, 1024, 1024, 2]
    - [77, 6.0]
  - - [1024, 2, 1, 2560, 1024, 1024, 1024, 2]
    - [89, 355.0]
  - - [1024, 2, 1, 6, 1024, 1024, 1024, 2]
    - [77, 7.0]
  - - [1024, 2, 1, 3072, 1024, 1024, 1024, 2]
    - [89, 364.0]
  - - [1024, 2, 1, 8, 1024, 1024, 1024, 2]
    - [93, 10.0]
  - - [1024, 2, 1, 1024, 1024, 1024, 1024, 2]
    - [99, 290.0]
  - - [1024, 2, 1, 9, 1024, 1024, 1024, 2]
    - [77, 10.0]
  - - [1024, 2, 1, 1152, 1024, 1024, 1024, 2]
    - [99, 300.0]
  - - [4, 64, 32768, 4, 4, 4, 4, 64]
    - [78, 478.0]
  - - [4, 64, 38400, 4, 4, 4, 4, 64]
    - [78, 479.0]
  - - [64, 4, 32768, 4, 64, 64, 64, 4]
    - [80, 489.0]
  - - [64, 4, 38400, 4, 64, 64, 64, 4]
    - [80, 491.0]
  - - [64, 128, 1, 128, 64, 64, 64, 128]
    - [98, 441.0]
  - - [128, 64, 1, 128, 128, 128, 128, 64]
    - [96, 441.0]
  - - [5, 64, 1, 5, 5, 5, 5, 64]
    - [77, 1.0]
  - - [33, 32, 1, 33, 33, 33, 33, 32]
    - [79, 18.0]
  - - [1024, 2, 1, 16, 1024, 1024, 1024, 2]
    - [77, 19.0]
  - - [1024, 2, 1, 64, 1024, 1024, 1024, 2]
    - [84, 57.0]
  - - [256, 128, 1, 3456, 256, 256, 256, 128]
    - [89, 6062.0]
  - - [256, 128, 1, 4096, 256, 256, 256, 128]
    - [89, 6151.0]
  - - [256, 128, 1, 864, 256, 256, 256, 128]
    - [89, 4626.0]
  - - [1024, 2, 1, 80, 1024, 1024, 1024, 2]
    - [84, 68.0]
  - - [1024, 2, 1, 82, 1024, 1024, 1024, 2]
    - [84, 69.0]
  - - [1024, 2, 1, 12, 1024, 1024, 1024, 2]
    - [77, 13.0]
  - - [13, 512, 1, 3456, 13, 13, 13, 512]
    - [89, 1212.0]
  - - [13, 512, 1, 4096, 13, 13, 13, 512]
    - [89, 1237.0]
  - - [13, 512, 1, 864, 13, 13, 13, 512]
    - [89, 893.0]
  - - [64, 24, 6816, 24, 64, 64, 64, 24]
    - [116, 9971.0]
  - - [64, 26, 6272, 26, 64, 64, 64, 26]
    - [105, 10485.0]
  - - [1024, 2, 1, 128, 1024, 1024, 1024, 2]
    - [98, 96.0]
  - - [1024, 2, 1, 96, 1024, 1024, 1024, 2]
    - [84, 77.0]
  - - [768, 2, 1, 2048, 768, 768, 768, 2]
    - [89, 258.0]
  - - [1024, 81, 1, 1024, 1024, 1024, 1024, 81]
    - [138, 7102.0]
  - - [25, 256, 120, 128, 25, 25, 25, 256]
    - [107, 10326.0]
  - - [25, 256, 18, 128, 25, 25, 25, 256]
    - [132, 4189.0]
  - - [25, 256, 19, 128, 25, 25, 25, 256]
    - [84, 4012.0]
  - - [9, 256, 120, 128, 9, 9, 9, 256]
    - [126, 3789.0]
  - - [9, 256, 18, 128, 9, 9, 9, 256]
    - [94, 1724.0]
  - - [9, 256, 19, 128, 9, 9, 9, 256]
    - [94, 1843.0]
  - - [1024, 2, 1, 20, 1024, 1024, 1024, 2]
    - [84, 22.0]
- null
