library/src/blas3/Tensile/Logic/asm_full/navi21_Cijk_Alik_Bljk_HB_GB.yaml
- {MinimumRequiredVersion: 4.26.0}
- navi21
- gfx1030
- [Device 73a2]
    SolutionIndex: 0
    SolutionNameMin: Cijk_Alik_Bljk_HB_MT128x128x8_SN_SU0_SUM0_TT8_16_WG16_8_1_WGM1
    SolutionIndex: 1
    SolutionNameMin: Cijk_Alik_Bljk_HB_MT128x64x16_SN_SU0_SUM0_TT8_8_WG16_8_1_WGM1
    SolutionIndex: 2
    SolutionNameMin: Cijk_Alik_Bljk_HB_MT128x128x16_SN_SU0_SUM0_TT8_16_WG16_8_1_WGM1
    SolutionIndex: 3
    SolutionNameMin: Cijk_Alik_Bljk_HB_MT128x256x16_SN_SU0_SUM0_TT8_16_WG16_16_1_WGM1
    SolutionIndex: 4
    SolutionNameMin: Cijk_Alik_Bljk_HB_MT256x256x16_SN_SU0_SUM0_TT16_16_WG16_16_1_WGM1
    SolutionIndex: 5
    SolutionNameMin: Cijk_Alik_Bljk_HB_MT128x128x32_SN_SU0_SUM0_TT8_16_WG16_8_1_WGM1
    SolutionIndex: 6
    SolutionNameMin: Cijk_Alik_Bljk_HB_MT128x64x16_SN_SU32_SUM3_TT8_8_WG16_8_1_WGM1
    SolutionIndex: 7
    SolutionNameMin: Cijk_Alik_Bljk_HB_MT128x128x16_SN_SU32_SUM3_TT8_16_WG16_8_1_WGM1
    SolutionIndex: 8
    SolutionNameMin: Cijk_Alik_Bljk_HB_MT256x128x16_SN_SU32_SUM3_TT16_16_WG16_8_1_WGM1
    SolutionIndex: 9
    SolutionNameMin: Cijk_Alik_Bljk_HB_MT128x128x16_SN_SU32_SUM3_TT8_8_WG16_16_1_WGM1
    SolutionIndex: 10
    SolutionNameMin: Cijk_Alik_Bljk_HB_MT128x256x16_SN_SU32_SUM3_TT8_16_WG16_16_1_WGM1
    SolutionIndex: 11
    SolutionNameMin: Cijk_Alik_Bljk_HB_MT256x256x16_SN_SU32_SUM3_TT16_16_WG16_16_1_WGM1
    SolutionIndex: 12
    SolutionNameMin: Cijk_Alik_Bljk_HB_MT128x128x32_SN_SU32_SUM3_TT8_16_WG16_8_1_WGM1
    SolutionIndex: 13
    SolutionNameMin: Cijk_Alik_Bljk_HB_MT128x256x8_SN_SU0_SUM0_TT8_16_WG16_16_1_WGM4
    SolutionIndex: 14
    SolutionNameMin: Cijk_Alik_Bljk_HB_MT128x64x16_SN_SU0_SUM0_TT8_8_WG16_8_1_WGM4
    SolutionIndex: 15
    SolutionNameMin: Cijk_Alik_Bljk_HB_MT128x128x16_SN_SU0_SUM0_TT8_16_WG16_8_1_WGM4
    SolutionIndex: 16
    SolutionNameMin: Cijk_Alik_Bljk_HB_MT256x128x16_SN_SU0_SUM0_TT16_16_WG16_8_1_WGM4
    SolutionIndex: 17
    SolutionNameMin: Cijk_Alik_Bljk_HB_MT128x128x16_SN_SU0_SUM0_TT8_8_WG16_16_1_WGM4
    SolutionIndex: 18
    SolutionNameMin: Cijk_Alik_Bljk_HB_MT128x256x16_SN_SU0_SUM0_TT8_16_WG16_16_1_WGM4
    SolutionIndex: 19
    SolutionNameMin: Cijk_Alik_Bljk_HB_MT256x256x16_SN_SU0_SUM0_TT16_16_WG16_16_1_WGM4
    SolutionIndex: 20
    SolutionNameMin: Cijk_Alik_Bljk_HB_MT128x64x16_SN_SU32_SUM3_TT8_8_WG16_8_1_WGM4
    SolutionIndex: 21
    SolutionNameMin: Cijk_Alik_Bljk_HB_MT128x128x16_SN_SU32_SUM3_TT8_16_WG16_8_1_WGM4
    SolutionIndex: 22
    SolutionNameMin: Cijk_Alik_Bljk_HB_MT256x128x16_SN_SU32_SUM3_TT16_16_WG16_8_1_WGM4
    SolutionIndex: 23
    SolutionNameMin: Cijk_Alik_Bljk_HB_MT128x128x16_SN_SU32_SUM3_TT8_8_WG16_16_1_WGM4
    SolutionIndex: 24
    SolutionNameMin: Cijk_Alik_Bljk_HB_MT128x256x16_SN_SU32_SUM3_TT8_16_WG16_16_1_WGM4
    SolutionIndex: 25
    SolutionNameMin: Cijk_Alik_Bljk_HB_MT256x256x16_SN_SU32_SUM3_TT16_16_WG16_16_1_WGM4
    SolutionIndex: 26
    SolutionNameMin: Cijk_Alik_Bljk_HB_MT128x128x32_SN_SU32_SUM3_TT8_16_WG16_8_1_WGM4
    SolutionIndex: 27
    SolutionNameMin: Cijk_Alik_Bljk_HB_MT128x128x16_SN_SU0_SUM0_TT8_16_WG16_8_1_WGM8
    SolutionIndex: 28
    SolutionNameMin: Cijk_Alik_Bljk_HB_MT256x128x16_SN_SU0_SUM0_TT16_16_WG16_8_1_WGM8
    SolutionIndex: 29
    SolutionNameMin: Cijk_Alik_Bljk_HB_MT128x256x16_SN_SU0_SUM0_TT8_16_WG16_16_1_WGM8
    SolutionIndex: 30
    SolutionNameMin: Cijk_Alik_Bljk_HB_MT256x256x16_SN_SU0_SUM0_TT16_16_WG16_16_1_WGM8
    SolutionIndex: 31
    SolutionNameMin: Cijk_Alik_Bljk_HB_MT128x128x32_SN_SU0_SUM0_TT8_16_WG16_8_1_WGM8
    SolutionIndex: 32
    SolutionNameMin: Cijk_Alik_Bljk_HB_MT128x64x16_SN_SU32_SUM3_TT8_8_WG16_8_1_WGM8
    SolutionIndex: 33
    SolutionNameMin: Cijk_Alik_Bljk_HB_MT128x128x16_SN_SU32_SUM3_TT8_16_WG16_8_1_WGM8
    SolutionIndex: 34
    SolutionNameMin: Cijk_Alik_Bljk_HB_MT256x128x16_SN_SU32_SUM3_TT16_16_WG16_8_1_WGM8
    SolutionIndex: 35
    SolutionNameMin: Cijk_Alik_Bljk_HB_MT128x128x16_SN_SU32_SUM3_TT8_8_WG16_16_1_WGM8
    SolutionIndex: 36
    SolutionNameMin: Cijk_Alik_Bljk_HB_MT128x256x16_SN_SU32_SUM3_TT8_16_WG16_16_1_WGM8
    SolutionIndex: 37
    SolutionNameMin: Cijk_Alik_Bljk_HB_MT256x256x16_SN_SU32_SUM3_TT16_16_WG16_16_1_WGM8
    SolutionIndex: 38
    SolutionNameMin: Cijk_Alik_Bljk_HB_MT128x128x32_SN_SU32_SUM3_TT8_16_WG16_8_1_WGM8
    SolutionIndex: 39
    SolutionNameMin: Cijk_Alik_Bljk_HB_MT64x64x16_SN_SU0_SUM0_TT8_8_WG8_8_1_WGM1
    SolutionIndex: 40
    SolutionNameMin: Cijk_Alik_Bljk_HB_MT128x64x16_SN_SU0_SUM0_TT8_8_WG16_8_1_WGM1
    SolutionIndex: 41
    SolutionNameMin: Cijk_Alik_Bljk_HB_MT128x128x16_SN_SU0_SUM0_TT8_8_WG16_16_1_WGM1
    SolutionIndex: 42
    SolutionNameMin: Cijk_Alik_Bljk_HB_MT64x64x16_SN_SU32_SUM3_TT8_8_WG8_8_1_WGM1
    SolutionIndex: 43
    SolutionNameMin: Cijk_Alik_Bljk_HB_MT128x64x16_SN_SU32_SUM3_TT8_8_WG16_8_1_WGM1
    SolutionIndex: 44
    SolutionNameMin: Cijk_Alik_Bljk_HB_MT128x128x16_SN_SU32_SUM3_TT8_8_WG16_16_1_WGM1
    SolutionIndex: 45
    SolutionNameMin: Cijk_Alik_Bljk_HB_MT128x64x32_SN_SU32_SUM3_TT8_8_WG16_8_1_WGM1
    SolutionIndex: 46
    SolutionNameMin: Cijk_Alik_Bljk_HB_MT64x64x16_SN_SU0_SUM0_TT8_8_WG8_8_1_WGM4
    SolutionIndex: 47
    SolutionNameMin: Cijk_Alik_Bljk_HB_MT128x64x16_SN_SU0_SUM0_TT8_8_WG16_8_1_WGM4
    SolutionIndex: 48
    SolutionNameMin: Cijk_Alik_Bljk_HB_MT128x128x16_SN_SU0_SUM0_TT8_8_WG16_16_1_WGM4
    SolutionIndex: 49
    SolutionNameMin: Cijk_Alik_Bljk_HB_MT128x64x8_SN_SU32_SUM3_TT8_8_WG16_8_1_WGM4
    SolutionIndex: 50
    SolutionNameMin: Cijk_Alik_Bljk_HB_MT128x128x8_SN_SU32_SUM3_TT8_8_WG16_16_1_WGM4
    SolutionIndex: 51
    SolutionNameMin: Cijk_Alik_Bljk_HB_MT64x64x16_SN_SU32_SUM3_TT8_8_WG8_8_1_WGM4
    SolutionIndex: 52
    SolutionNameMin: Cijk_Alik_Bljk_HB_MT128x64x16_SN_SU32_SUM3_TT8_8_WG16_8_1_WGM4
    SolutionIndex: 53
    SolutionNameMin: Cijk_Alik_Bljk_HB_MT128x128x16_SN_SU32_SUM3_TT8_8_WG16_16_1_WGM4
    SolutionIndex: 54
    SolutionNameMin: Cijk_Alik_Bljk_HB_MT64x64x16_SN_SU0_SUM0_TT8_8_WG8_8_1_WGM8
    SolutionIndex: 55
    SolutionNameMin: Cijk_Alik_Bljk_HB_MT128x64x16_SN_SU0_SUM0_TT8_8_WG16_8_1_WGM8
    SolutionIndex: 56
    SolutionNameMin: Cijk_Alik_Bljk_HB_MT64x64x32_SN_SU0_SUM0_TT8_8_WG8_8_1_WGM8
    SolutionIndex: 57
    SolutionNameMin: Cijk_Alik_Bljk_HB_MT128x128x8_SN_SU32_SUM3_TT8_8_WG16_16_1_WGM8
    SolutionIndex: 58
    SolutionNameMin: Cijk_Alik_Bljk_HB_MT64x64x16_SN_SU32_SUM3_TT8_8_WG8_8_1_WGM8
    SolutionIndex: 59
    SolutionNameMin: Cijk_Alik_Bljk_HB_MT128x64x16_SN_SU32_SUM3_TT8_8_WG16_8_1_WGM8
    SolutionIndex: 60
    SolutionNameMin: Cijk_Alik_Bljk_HB_MT128x128x16_SN_SU32_SUM3_TT8_8_WG16_16_1_WGM8
    SolutionIndex: 61
    SolutionNameMin: Cijk_Alik_Bljk_HB_MT16x16x8_SN_SU0_SUM0_TT2_2_WG8_8_1_WGM1
    SolutionIndex: 62
    SolutionNameMin: Cijk_Alik_Bljk_HB_MT32x16x8_SN_SU0_SUM0_TT2_2_WG16_8_1_WGM1
    SolutionIndex: 63
    SolutionNameMin: Cijk_Alik_Bljk_HB_MT64x32x8_SN_SU0_SUM0_TT4_4_WG16_8_1_WGM1
    SolutionIndex: 64
    SolutionNameMin: Cijk_Alik_Bljk_HB_MT64x64x8_SN_SU0_SUM0_TT4_4_WG16_16_1_WGM1
    SolutionIndex: 65
    SolutionNameMin: Cijk_Alik_Bljk_HB_MT16x16x16_SN_SU0_SUM0_TT2_2_WG8_8_1_WGM1
    SolutionIndex: 66
    SolutionNameMin: Cijk_Alik_Bljk_HB_MT16x16x32_SN_SU0_SUM0_TT2_2_WG8_8_1_WGM1
    SolutionIndex: 67
    SolutionNameMin: Cijk_Alik_Bljk_HB_MT16x16x8_SN_SU32_SUM3_TT2_2_WG8_8_1_WGM1
    SolutionIndex: 68
    SolutionNameMin: Cijk_Alik_Bljk_HB_MT32x32x8_SN_SU32_SUM3_TT4_4_WG8_8_1_WGM1
    SolutionIndex: 69
    SolutionNameMin: Cijk_Alik_Bljk_HB_MT32x16x8_SN_SU32_SUM3_TT2_2_WG16_8_1_WGM1
    SolutionIndex: 70
    SolutionNameMin: Cijk_Alik_Bljk_HB_MT64x32x8_SN_SU32_SUM3_TT4_4_WG16_8_1_WGM1
    SolutionIndex: 71
    SolutionNameMin: Cijk_Alik_Bljk_HB_MT64x64x8_SN_SU32_SUM3_TT4_4_WG16_16_1_WGM1
    SolutionIndex: 72
    SolutionNameMin: Cijk_Alik_Bljk_HB_MT16x16x16_SN_SU32_SUM3_TT2_2_WG8_8_1_WGM1
    SolutionIndex: 73
    SolutionNameMin: Cijk_Alik_Bljk_HB_MT32x16x16_SN_SU32_SUM3_TT2_2_WG16_8_1_WGM1
    SolutionIndex: 74
    SolutionNameMin: Cijk_Alik_Bljk_HB_MT64x32x16_SN_SU32_SUM3_TT4_4_WG16_8_1_WGM1
    SolutionIndex: 75
    SolutionNameMin: Cijk_Alik_Bljk_HB_MT64x32x8_SN_SU0_SUM0_TT4_4_WG16_8_1_WGM4
    SolutionIndex: 76
    SolutionNameMin: Cijk_Alik_Bljk_HB_MT64x64x8_SN_SU0_SUM0_TT4_4_WG16_16_1_WGM4
    SolutionIndex: 77
    SolutionNameMin: Cijk_Alik_Bljk_HB_MT16x16x16_SN_SU0_SUM0_TT2_2_WG8_8_1_WGM4
    SolutionIndex: 78
    SolutionNameMin: Cijk_Alik_Bljk_HB_MT16x16x32_SN_SU0_SUM0_TT2_2_WG8_8_1_WGM4
    SolutionIndex: 79
    SolutionNameMin: Cijk_Alik_Bljk_HB_MT32x32x8_SN_SU32_SUM3_TT4_4_WG8_8_1_WGM4
    SolutionIndex: 80
    SolutionNameMin: Cijk_Alik_Bljk_HB_MT64x32x8_SN_SU32_SUM3_TT4_4_WG16_8_1_WGM4
    SolutionIndex: 81
    SolutionNameMin: Cijk_Alik_Bljk_HB_MT64x64x8_SN_SU32_SUM3_TT4_4_WG16_16_1_WGM4
    SolutionIndex: 82
    SolutionNameMin: Cijk_Alik_Bljk_HB_MT16x16x16_SN_SU32_SUM3_TT2_2_WG8_8_1_WGM4
    SolutionIndex: 83
    SolutionNameMin: Cijk_Alik_Bljk_HB_MT32x32x16_SN_SU32_SUM3_TT4_4_WG8_8_1_WGM4
    SolutionIndex: 84
    SolutionNameMin: Cijk_Alik_Bljk_HB_MT16x16x8_SN_SU0_SUM0_TT2_2_WG8_8_1_WGM8
    SolutionIndex: 85
    SolutionNameMin: Cijk_Alik_Bljk_HB_MT64x32x8_SN_SU0_SUM0_TT4_4_WG16_8_1_WGM8
    SolutionIndex: 86
    SolutionNameMin: Cijk_Alik_Bljk_HB_MT64x64x8_SN_SU0_SUM0_TT4_4_WG16_16_1_WGM8
    SolutionIndex: 87
    SolutionNameMin: Cijk_Alik_Bljk_HB_MT16x16x16_SN_SU0_SUM0_TT2_2_WG8_8_1_WGM8
    SolutionIndex: 88
    SolutionNameMin: Cijk_Alik_Bljk_HB_MT16x16x8_SN_SU32_SUM3_TT2_2_WG8_8_1_WGM8
    SolutionIndex: 89
    SolutionNameMin: Cijk_Alik_Bljk_HB_MT32x32x8_SN_SU32_SUM3_TT4_4_WG8_8_1_WGM8
    SolutionIndex: 90
    SolutionNameMin: Cijk_Alik_Bljk_HB_MT64x32x8_SN_SU32_SUM3_TT4_4_WG16_8_1_WGM8
    SolutionIndex: 91
    SolutionNameMin: Cijk_Alik_Bljk_HB_MT32x32x8_SN_SU32_SUM3_TT2_2_WG16_16_1_WGM8
    SolutionIndex: 92
    SolutionNameMin: Cijk_Alik_Bljk_HB_MT64x64x8_SN_SU32_SUM3_TT4_4_WG16_16_1_WGM8
    SolutionIndex: 93
    SolutionNameMin: Cijk_Alik_Bljk_HB_MT32x16x16_SN_SU32_SUM3_TT2_2_WG16_8_1_WGM8
    SolutionIndex: 94
    SolutionNameMin: Cijk_Alik_Bljk_HB_MT64x32x16_SN_SU32_SUM3_TT4_4_WG16_8_1_WGM8
    SolutionIndex: 95
    SolutionNameMin: Cijk_Alik_Bljk_HB_MT64x64x16_SN_SU32_SUM3_TT4_4_WG16_16_1_WGM8
    SolutionIndex: 96
    SolutionNameMin: Cijk_Alik_Bljk_HB_MT16x16x32_SN_SU32_SUM3_TT2_2_WG8_8_1_WGM8
    SolutionIndex: 97
    SolutionNameMin: Cijk_Alik_Bljk_HB_MT64x16x16_SN_SU32_SUM3_TT4_2_WG16_8_1_WGM1
    SolutionIndex: 98
    SolutionNameMin: Cijk_Alik_Bljk_HB_MT64x16x16_SN_SU32_SUM3_TT4_2_WG16_8_1_WGM4
- - - [2944, 4288, 1, 1280, 2944, 2944, 1280, 1280]
    - [10, 38323.0]
  - - [2368, 5888, 1, 256, 2368, 2368, 256, 256]
    - [10, 34447.0]
  - - [5888, 1856, 1, 256, 5888, 5888, 256, 256]
    - [33, 34632.0]
  - - [704, 6784, 1, 256, 704, 704, 256, 256]
    - [33, 29504.0]
  - - [512, 24000, 1, 1536, 512, 512, 1536, 1536]
    - [24, 37464.0]
  - - [5888, 1856, 1, 3328, 5888, 5888, 3328, 3328]
    - [16, 35972.0]
  - - [5056, 704, 1, 256, 5056, 5056, 256, 256]
    - [21, 27463.0]
  - - [5888, 2944, 1, 3328, 5888, 5888, 3328, 3328]
    - [16, 39025.0]
  - - [1856, 4288, 1, 256, 1856, 1856, 256, 256]
    - [36, 30646.0]
  - - [5056, 5056, 1, 3328, 5056, 5056, 3328, 3328]
    - [36, 38710.0]
  - - [1408, 5888, 1, 1280, 1408, 1408, 1280, 1280]
    - [18, 34845.0]
  - - [1024, 3584, 1, 3328, 1024, 1024, 3328, 3328]
    - [24, 31034.0]
  - - [512, 48000, 1, 2048, 512, 512, 2048, 2048]
    - [34, 39932.0]
  - - [448, 3584, 1, 3328, 448, 448, 3328, 3328]
    - [10, 24912.0]
  - - [5888, 1408, 1, 1280, 5888, 5888, 1280, 1280]
    - [36, 34861.0]
  - - [1024, 2368, 1, 256, 1024, 1024, 256, 256]
    - [20, 26438.0]
  - - [5056, 6784, 1, 1280, 5056, 5056, 1280, 1280]
    - [36, 39681.0]
  - - [5056, 5056, 1, 1280, 5056, 5056, 1280, 1280]
    - [36, 38509.0]
  - - [448, 5056, 1, 256, 448, 448, 256, 256]
    - [6, 24221.0]
  - - [6784, 448, 1, 256, 6784, 6784, 256, 256]
    - [9, 24778.0]
  - - [1760, 6400, 1, 1760, 1760, 1760, 1760, 1760]
    - [29, 38661.0]
  - - [5888, 704, 1, 1280, 5888, 5888, 1280, 1280]
    - [36, 32943.0]
  - - [6784, 4288, 1, 3328, 6784, 6784, 3328, 3328]
    - [18, 39066.0]
  - - [1856, 2368, 1, 3328, 1856, 1856, 3328, 3328]
    - [38, 30127.0]
  - - [5888, 2944, 1, 1280, 5888, 5888, 1280, 1280]
    - [16, 37897.0]
  - - [5888, 1024, 1, 256, 5888, 5888, 256, 256]
    - [21, 34058.0]
  - - [16384, 3200, 1, 4096, 16384, 16384, 4096, 4096]
    - [11, 34880.0]
  - - [1408, 2944, 1, 256, 1408, 1408, 256, 256]
    - [35, 28133.0]
  - - [6784, 5056, 1, 3328, 6784, 6784, 3328, 3328]
    - [3, 39818.0]
  - - [5056, 5056, 1, 256, 5056, 5056, 256, 256]
    - [7, 37149.0]
  - - [1024, 3584, 1, 1280, 1024, 1024, 1280, 1280]
    - [7, 32864.0]
  - - [2368, 2944, 1, 1280, 2368, 2368, 1280, 1280]
    - [27, 33244.0]
  - - [6784, 6784, 1, 1280, 6784, 6784, 1280, 1280]
    - [10, 40014.0]
  - - [1408, 4288, 1, 1280, 1408, 1408, 1280, 1280]
    - [18, 32635.0]
  - - [3584, 4288, 1, 1280, 3584, 3584, 1280, 1280]
    - [10, 37263.0]
  - - [2368, 704, 1, 1280, 2368, 2368, 1280, 1280]
    - [18, 24595.0]
  - - [5056, 4288, 1, 3328, 5056, 5056, 3328, 3328]
    - [36, 39578.0]
  - - [3584, 2368, 1, 3328, 3584, 3584, 3328, 3328]
    - [18, 35738.0]
  - - [6784, 448, 1, 1280, 6784, 6784, 1280, 1280]
    - [21, 30948.0]
  - - [4288, 2944, 1, 256, 4288, 4288, 256, 256]
    - [21, 36084.0]
  - - [6144, 24000, 1, 2560, 6144, 6144, 2560, 2560]
    - [4, 40384.0]
  - - [5056, 2368, 1, 1280, 5056, 5056, 1280, 1280]
    - [34, 35940.0]
  - - [448, 3584, 1, 1280, 448, 448, 1280, 1280]
    - [10, 24066.0]
  - - [6784, 5888, 1, 256, 6784, 6784, 256, 256]
    - [10, 40013.0]
  - - [1024, 1408, 1, 256, 1024, 1024, 256, 256]
    - [32, 24805.0]
  - - [2368, 2368, 1, 3328, 2368, 2368, 3328, 3328]
    - [18, 31353.0]
  - - [5056, 704, 1, 3328, 5056, 5056, 3328, 3328]
    - [36, 29853.0]
  - - [1408, 1856, 1, 256, 1408, 1408, 256, 256]
    - [35, 25990.0]
  - - [3584, 2368, 1, 1280, 3584, 3584, 1280, 1280]
    - [36, 35519.0]
  - - [704, 5888, 1, 256, 704, 704, 256, 256]
    - [36, 29298.0]
  - - [2560, 1600, 1, 2560, 2560, 2560, 2560, 2560]
    - [37, 33240.0]
  - - [6144, 5984, 1, 2048, 6144, 6144, 2048, 2048]
    - [25, 39766.0]
  - - [3584, 704, 1, 3328, 3584, 3584, 3328, 3328]
    - [15, 29071.0]
  - - [1408, 1408, 1, 256, 1408, 1408, 256, 256]
    - [23, 25174.0]
  - - [448, 4288, 1, 256, 448, 448, 256, 256]
    - [6, 22621.0]
  - - [704, 2368, 1, 1280, 704, 704, 1280, 1280]
    - [3, 24893.0]
  - - [1856, 2368, 1, 1280, 1856, 1856, 1280, 1280]
    - [5, 29285.0]
  - - [1408, 1024, 1, 1280, 1408, 1408, 1280, 1280]
    - [21, 26894.0]
  - - [6784, 704, 1, 256, 6784, 6784, 256, 256]
    - [23, 27352.0]
  - - [2048, 1600, 1, 512, 2048, 2048, 512, 512]
    - [21, 29970.0]
  - - [2048, 7000, 1, 2048, 2048, 2048, 2048, 2048]
    - [25, 35025.0]
  - - [1408, 3584, 1, 256, 1408, 1408, 256, 256]
    - [18, 31913.0]
  - - [3584, 4288, 1, 3328, 3584, 3584, 3328, 3328]
    - [19, 37887.0]
  - - [5888, 1856, 1, 1280, 5888, 5888, 1280, 1280]
    - [16, 35197.0]
  - - [5056, 1024, 1, 3328, 5056, 5056, 3328, 3328]
    - [10, 34830.0]
  - - [2368, 3584, 1, 1280, 2368, 2368, 1280, 1280]
    - [18, 35413.0]
  - - [2944, 3584, 1, 3328, 2944, 2944, 3328, 3328]
    - [18, 39935.0]
  - - [6784, 2944, 1, 256, 6784, 6784, 256, 256]
    - [33, 38425.0]
  - - [4288, 2368, 1, 3328, 4288, 4288, 3328, 3328]
    - [19, 34866.0]
  - - [1856, 2368, 1, 256, 1856, 1856, 256, 256]
    - [33, 29702.0]
  - - [3584, 6784, 1, 3328, 3584, 3584, 3328, 3328]
    - [18, 40027.0]
  - - [5056, 4288, 1, 1280, 5056, 5056, 1280, 1280]
    - [24, 39193.0]
  - - [6784, 1856, 1, 3328, 6784, 6784, 3328, 3328]
    - [36, 36196.0]
  - - [1408, 5056, 1, 1280, 1408, 1408, 1280, 1280]
    - [18, 33759.0]
  - - [6784, 5888, 1, 3328, 6784, 6784, 3328, 3328]
    - [3, 40902.0]
  - - [8448, 12000, 1, 2816, 8448, 8448, 2816, 2816]
    - [16, 41119.0]
  - - [4096, 800, 1, 1024, 4096, 4096, 1024, 1024]
    - [21, 28640.0]
  - - [8192, 3200, 1, 2048, 8192, 8192, 2048, 2048]
    - [11, 37093.0]
  - - [2368, 5056, 1, 1280, 2368, 2368, 1280, 1280]
    - [18, 36598.0]
  - - [1024, 5056, 1, 1280, 1024, 1024, 1280, 1280]
    - [24, 33846.0]
  - - [4288, 1024, 1, 256, 4288, 4288, 256, 256]
    - [10, 30966.0]
  - - [2368, 1408, 1, 256, 2368, 2368, 256, 256]
    - [9, 28527.0]
  - - [5888, 448, 1, 1280, 5888, 5888, 1280, 1280]
    - [7, 27424.0]
  - - [704, 5888, 1, 3328, 704, 704, 3328, 3328]
    - [36, 34304.0]
  - - [1024, 6784, 1, 1280, 1024, 1024, 1280, 1280]
    - [10, 37906.0]
  - - [3584, 2944, 1, 1280, 3584, 3584, 1280, 1280]
    - [36, 35733.0]
  - - [512, 24000, 1, 2048, 512, 512, 2048, 2048]
    - [34, 37498.0]
  - - [1408, 5056, 1, 3328, 1408, 1408, 3328, 3328]
    - [22, 33970.0]
  - - [1856, 1856, 1, 3328, 1856, 1856, 3328, 3328]
    - [10, 28906.0]
  - - [2560, 800, 1, 2560, 2560, 2560, 2560, 2560]
    - [34, 28813.0]
  - - [2368, 2368, 1, 256, 2368, 2368, 256, 256]
    - [35, 28191.0]
  - - [4288, 4288, 1, 1280, 4288, 4288, 1280, 1280]
    - [27, 37448.0]
  - - [5888, 1024, 1, 1280, 5888, 5888, 1280, 1280]
    - [27, 34191.0]
  - - [512, 48000, 1, 2560, 512, 512, 2560, 2560]
    - [22, 39891.0]
  - - [704, 6784, 1, 3328, 704, 704, 3328, 3328]
    - [24, 31516.0]
  - - [2560, 6400, 1, 2560, 2560, 2560, 2560, 2560]
    - [25, 40191.0]
  - - [5056, 1024, 1, 1280, 5056, 5056, 1280, 1280]
    - [18, 34002.0]
  - - [448, 5888, 1, 3328, 448, 448, 3328, 3328]
    - [10, 28896.0]
  - - [1024, 2944, 1, 1280, 1024, 1024, 1280, 1280]
    - [7, 31433.0]
  - - [5056, 5888, 1, 1280, 5056, 5056, 1280, 1280]
    - [24, 39726.0]
  - - [448, 6784, 1, 256, 448, 448, 256, 256]
    - [7, 26573.0]
  - - [3584, 5888, 1, 256, 3584, 3584, 256, 256]
    - [36, 38765.0]
  - - [2944, 3584, 1, 256, 2944, 2944, 256, 256]
    - [18, 38184.0]
  - - [6784, 1024, 1, 3328, 6784, 6784, 3328, 3328]
    - [10, 39068.0]
  - - [6784, 2944, 1, 3328, 6784, 6784, 3328, 3328]
    - [10, 38440.0]
  - - [2944, 5056, 1, 3328, 2944, 2944, 3328, 3328]
    - [18, 39213.0]
  - - [6784, 2368, 1, 1280, 6784, 6784, 1280, 1280]
    - [24, 36839.0]
  - - [4288, 5888, 1, 1280, 4288, 4288, 1280, 1280]
    - [10, 39696.0]
  - - [4288, 4288, 1, 256, 4288, 4288, 256, 256]
    - [33, 36153.0]
  - - [4288, 1856, 1, 1280, 4288, 4288, 1280, 1280]
    - [27, 34360.0]
  - - [1856, 2944, 1, 3328, 1856, 1856, 3328, 3328]
    - [29, 36317.0]
  - - [256, 6784, 1, 3328, 256, 256, 3328, 3328]
    - [35, 32120.0]
  - - [5056, 1024, 1, 256, 5056, 5056, 256, 256]
    - [10, 31274.0]
  - - [5056, 1856, 1, 3328, 5056, 5056, 3328, 3328]
    - [36, 35790.0]
  - - [1856, 1408, 1, 256, 1856, 1856, 256, 256]
    - [23, 25910.0]
  - - [4096, 7000, 1, 4096, 4096, 4096, 4096, 4096]
    - [11, 38360.0]
  - - [5056, 256, 1, 3328, 5056, 5056, 3328, 3328]
    - [7, 24536.0]
  - - [1024, 5888, 1, 1280, 1024, 1024, 1280, 1280]
    - [2, 34364.0]
  - - [6144, 24000, 1, 2048, 6144, 6144, 2048, 2048]
    - [11, 38820.0]
  - - [5056, 3584, 1, 256, 5056, 5056, 256, 256]
    - [7, 36578.0]
  - - [1856, 1024, 1, 1280, 1856, 1856, 1280, 1280]
    - [3, 27968.0]
  - - [1856, 1856, 1, 1280, 1856, 1856, 1280, 1280]
    - [18, 28261.0]
  - - [4096, 400, 1, 1024, 4096, 4096, 1024, 1024]
    - [21, 23039.0]
  - - [3072, 24000, 1, 1024, 3072, 3072, 1024, 1024]
    - [34, 40458.0]
  - - [1856, 1024, 1, 3328, 1856, 1856, 3328, 3328]
    - [10, 29299.0]
  - - [5888, 5888, 1, 3328, 5888, 5888, 3328, 3328]
    - [30, 40427.0]
  - - [6784, 1024, 1, 256, 6784, 6784, 256, 256]
    - [29, 34857.0]
  - - [5056, 5888, 1, 3328, 5056, 5056, 3328, 3328]
    - [36, 39911.0]
  - - [1856, 1024, 1, 256, 1856, 1856, 256, 256]
    - [23, 22401.0]
  - - [512, 48000, 1, 1536, 512, 512, 1536, 1536]
    - [22, 39883.0]
  - - [5056, 1408, 1, 3328, 5056, 5056, 3328, 3328]
    - [36, 34554.0]
  - - [8448, 5984, 1, 2816, 8448, 8448, 2816, 2816]
    - [34, 40331.0]
  - - [4288, 1024, 1, 3328, 4288, 4288, 3328, 3328]
    - [18, 36103.0]
  - - [1024, 24000, 1, 2560, 1024, 1024, 2560, 2560]
    - [22, 38618.0]
  - - [2944, 1408, 1, 3328, 2944, 2944, 3328, 3328]
    - [36, 34347.0]
  - - [2944, 4288, 1, 3328, 2944, 2944, 3328, 3328]
    - [18, 39161.0]
  - - [5056, 2944, 1, 256, 5056, 5056, 256, 256]
    - [21, 36845.0]
  - - [2368, 1856, 1, 256, 2368, 2368, 256, 256]
    - [23, 28717.0]
  - - [1408, 3584, 1, 3328, 1408, 1408, 3328, 3328]
    - [18, 33705.0]
  - - [2368, 6784, 1, 256, 2368, 2368, 256, 256]
    - [18, 34964.0]
  - - [5056, 1408, 1, 1280, 5056, 5056, 1280, 1280]
    - [24, 34138.0]
  - - [704, 3584, 1, 1280, 704, 704, 1280, 1280]
    - [7, 30274.0]
  - - [1408, 5888, 1, 3328, 1408, 1408, 3328, 3328]
    - [18, 35316.0]
  - - [1856, 5056, 1, 256, 1856, 1856, 256, 256]
    - [21, 32791.0]
  - - [6784, 6784, 1, 256, 6784, 6784, 256, 256]
    - [21, 39147.0]
  - - [2368, 4288, 1, 1280, 2368, 2368, 1280, 1280]
    - [10, 37453.0]
  - - [3584, 1856, 1, 1280, 3584, 3584, 1280, 1280]
    - [16, 33806.0]
  - - [5888, 5056, 1, 256, 5888, 5888, 256, 256]
    - [21, 37829.0]
  - - [8448, 48000, 1, 2816, 8448, 8448, 2816, 2816]
    - [34, 41741.0]
  - - [3584, 448, 1, 256, 3584, 3584, 256, 256]
    - [20, 22388.0]
  - - [3584, 3584, 1, 1280, 3584, 3584, 1280, 1280]
    - [36, 39743.0]
  - - [256, 6784, 1, 256, 256, 256, 256, 256]
    - [23, 27892.0]
  - - [1856, 3584, 1, 3328, 1856, 1856, 3328, 3328]
    - [18, 37065.0]
  - - [5056, 256, 1, 1280, 5056, 5056, 1280, 1280]
    - [14, 23879.0]
  - - [3584, 3584, 1, 256, 3584, 3584, 256, 256]
    - [18, 37893.0]
  - - [6784, 4288, 1, 1280, 6784, 6784, 1280, 1280]
    - [10, 38907.0]
  - - [704, 5056, 1, 256, 704, 704, 256, 256]
    - [33, 27496.0]
  - - [2944, 2368, 1, 1280, 2944, 2944, 1280, 1280]
    - [24, 33366.0]
  - - [6784, 3584, 1, 256, 6784, 6784, 256, 256]
    - [18, 38990.0]
  - - [2944, 2944, 1, 3328, 2944, 2944, 3328, 3328]
    - [18, 36841.0]
  - - [5056, 6784, 1, 256, 5056, 5056, 256, 256]
    - [21, 38723.0]
  - - [1408, 4288, 1, 3328, 1408, 1408, 3328, 3328]
    - [19, 33724.0]
  - - [6784, 256, 1, 1280, 6784, 6784, 1280, 1280]
    - [9, 31398.0]
  - - [2368, 704, 1, 3328, 2368, 2368, 3328, 3328]
    - [24, 25984.0]
  - - [3584, 6784, 1, 256, 3584, 3584, 256, 256]
    - [33, 38603.0]
  - - [5056, 1856, 1, 256, 5056, 5056, 256, 256]
    - [21, 34201.0]
  - - [4608, 5984, 1, 1536, 4608, 4608, 1536, 1536]
    - [37, 39406.0]
  - - [1760, 3200, 1, 1760, 1760, 1760, 1760, 1760]
    - [2, 36767.0]
  - - [4096, 1600, 1, 1024, 4096, 4096, 1024, 1024]
    - [22, 33551.0]
  - - [704, 4288, 1, 256, 704, 704, 256, 256]
    - [33, 25968.0]
  - - [1408, 6784, 1, 1280, 1408, 1408, 1280, 1280]
    - [18, 35802.0]
  - - [7680, 24000, 1, 2560, 7680, 7680, 2560, 2560]
    - [25, 41038.0]
  - - [4608, 48000, 1, 1536, 4608, 4608, 1536, 1536]
    - [10, 40995.0]
  - - [6144, 48000, 1, 2048, 6144, 6144, 2048, 2048]
    - [11, 39529.0]
  - - [1024, 24000, 1, 1536, 1024, 1024, 1536, 1536]
    - [22, 39761.0]
  - - [5056, 2368, 1, 3328, 5056, 5056, 3328, 3328]
    - [16, 36277.0]
  - - [2944, 4288, 1, 256, 2944, 2944, 256, 256]
    - [18, 35051.0]
  - - [1408, 3584, 1, 1280, 1408, 1408, 1280, 1280]
    - [18, 33485.0]
  - - [8192, 1600, 1, 2048, 8192, 8192, 2048, 2048]
    - [10, 31989.0]
  - - [512, 24000, 1, 2560, 512, 512, 2560, 2560]
    - [22, 37210.0]
  - - [2368, 6784, 1, 3328, 2368, 2368, 3328, 3328]
    - [36, 36744.0]
  - - [5056, 704, 1, 1280, 5056, 5056, 1280, 1280]
    - [21, 30504.0]
  - - [1856, 4288, 1, 3328, 1856, 1856, 3328, 3328]
    - [25, 33890.0]
  - - [1408, 5888, 1, 256, 1408, 1408, 256, 256]
    - [10, 33549.0]
  - - [3584, 704, 1, 1280, 3584, 3584, 1280, 1280]
    - [33, 30099.0]
  - - [3584, 448, 1, 3328, 3584, 3584, 3328, 3328]
    - [29, 24700.0]
  - - [704, 2368, 1, 3328, 704, 704, 3328, 3328]
    - [10, 26150.0]
  - - [448, 5056, 1, 3328, 448, 448, 3328, 3328]
    - [7, 28111.0]
  - - [4288, 448, 1, 256, 4288, 4288, 256, 256]
    - [17, 22232.0]
  - - [448, 5888, 1, 256, 448, 448, 256, 256]
    - [7, 23878.0]
  - - [2048, 3200, 1, 512, 2048, 2048, 512, 512]
    - [22, 33622.0]
  - - [5888, 2368, 1, 256, 5888, 5888, 256, 256]
    - [33, 35537.0]
  - - [6784, 704, 1, 3328, 6784, 6784, 3328, 3328]
    - [24, 32093.0]
  - - [1408, 2944, 1, 3328, 1408, 1408, 3328, 3328]
    - [36, 34553.0]
  - - [4608, 12000, 1, 1536, 4608, 4608, 1536, 1536]
    - [10, 40481.0]
  - - [2368, 704, 1, 256, 2368, 2368, 256, 256]
    - [9, 18884.0]
  - - [3584, 2368, 1, 256, 3584, 3584, 256, 256]
    - [33, 34443.0]
  - - [5888, 5056, 1, 1280, 5888, 5888, 1280, 1280]
    - [10, 39493.0]
  - - [8448, 24000, 1, 2816, 8448, 8448, 2816, 2816]
    - [16, 41443.0]
  - - [3584, 3584, 1, 3328, 3584, 3584, 3328, 3328]
    - [18, 39719.0]
  - - [5888, 6784, 1, 256, 5888, 5888, 256, 256]
    - [21, 39366.0]
  - - [4288, 2944, 1, 3328, 4288, 4288, 3328, 3328]
    - [16, 38009.0]
  - - [256, 5056, 1, 1280, 256, 256, 1280, 1280]
    - [14, 25567.0]
  - - [6784, 5888, 1, 1280, 6784, 6784, 1280, 1280]
    - [10, 40878.0]
  - - [2048, 800, 1, 512, 2048, 2048, 512, 512]
    - [36, 23160.0]
  - - [5888, 4288, 1, 1280, 5888, 5888, 1280, 1280]
    - [10, 39443.0]
  - - [1024, 24000, 1, 2048, 1024, 1024, 2048, 2048]
    - [37, 38286.0]
  - - [1408, 1856, 1, 1280, 1408, 1408, 1280, 1280]
    - [33, 29554.0]
  - - [5888, 448, 1, 3328, 5888, 5888, 3328, 3328]
    - [10, 28318.0]
  - - [704, 5888, 1, 1280, 704, 704, 1280, 1280]
    - [10, 33990.0]
  - - [1024, 6784, 1, 3328, 1024, 1024, 3328, 3328]
    - [25, 38716.0]
  - - [704, 2944, 1, 1280, 704, 704, 1280, 1280]
    - [10, 30326.0]
  - - [5056, 2944, 1, 3328, 5056, 5056, 3328, 3328]
    - [16, 38283.0]
  - - [1408, 1408, 1, 3328, 1408, 1408, 3328, 3328]
    - [36, 31027.0]
  - - [448, 4288, 1, 1280, 448, 448, 1280, 1280]
    - [36, 28166.0]
  - - [3584, 704, 1, 256, 3584, 3584, 256, 256]
    - [32, 27300.0]
  - - [3584, 1408, 1, 3328, 3584, 3584, 3328, 3328]
    - [18, 33474.0]
  - - [2368, 1024, 1, 1280, 2368, 2368, 1280, 1280]
    - [21, 28554.0]
  - - [2944, 6784, 1, 1280, 2944, 2944, 1280, 1280]
    - [24, 38206.0]
  - - [1856, 6784, 1, 256, 1856, 1856, 256, 256]
    - [18, 33745.0]
  - - [4288, 448, 1, 3328, 4288, 4288, 3328, 3328]
    - [18, 29783.0]
  - - [4288, 3584, 1, 1280, 4288, 4288, 1280, 1280]
    - [10, 37651.0]
  - - [6144, 12000, 1, 2048, 6144, 6144, 2048, 2048]
    - [11, 37862.0]
  - - [8192, 800, 1, 2048, 8192, 8192, 2048, 2048]
    - [12, 27873.0]
  - - [5888, 1024, 1, 3328, 5888, 5888, 3328, 3328]
    - [10, 34129.0]
  - - [704, 6784, 1, 1280, 704, 704, 1280, 1280]
    - [36, 31427.0]
  - - [704, 5056, 1, 1280, 704, 704, 1280, 1280]
    - [33, 31408.0]
  - - [2944, 1856, 1, 256, 2944, 2944, 256, 256]
    - [35, 29325.0]
  - - [3584, 5056, 1, 256, 3584, 3584, 256, 256]
    - [21, 36292.0]
  - - [5888, 5056, 1, 3328, 5888, 5888, 3328, 3328]
    - [4, 39867.0]
  - - [3584, 6784, 1, 1280, 3584, 3584, 1280, 1280]
    - [36, 39692.0]
  - - [1856, 5888, 1, 256, 1856, 1856, 256, 256]
    - [18, 34284.0]
  - - [4288, 4288, 1, 3328, 4288, 4288, 3328, 3328]
    - [29, 37533.0]
  - - [4288, 1408, 1, 1280, 4288, 4288, 1280, 1280]
    - [10, 33379.0]
  - - [4288, 2368, 1, 256, 4288, 4288, 256, 256]
    - [21, 34131.0]
  - - [2944, 5056, 1, 1280, 2944, 2944, 1280, 1280]
    - [10, 38854.0]
  - - [6784, 2368, 1, 3328, 6784, 6784, 3328, 3328]
    - [10, 37136.0]
  - - [4288, 1856, 1, 3328, 4288, 4288, 3328, 3328]
    - [18, 33873.0]
  - - [1856, 2944, 1, 1280, 1856, 1856, 1280, 1280]
    - [18, 35753.0]
  - - [2048, 1600, 1, 2048, 2048, 2048, 2048, 2048]
    - [26, 28862.0]
  - - [4288, 6784, 1, 3328, 4288, 4288, 3328, 3328]
    - [19, 39027.0]
  - - [3584, 1024, 1, 1280, 3584, 3584, 1280, 1280]
    - [33, 31160.0]
  - - [1024, 4288, 1, 256, 1024, 1024, 256, 256]
    - [20, 29722.0]
  - - [5888, 3584, 1, 3328, 5888, 5888, 3328, 3328]
    - [10, 40586.0]
  - - [5056, 3584, 1, 3328, 5056, 5056, 3328, 3328]
    - [36, 39253.0]
  - - [2368, 1408, 1, 1280, 2368, 2368, 1280, 1280]
    - [27, 31110.0]
  - - [5056, 2944, 1, 1280, 5056, 5056, 1280, 1280]
    - [16, 37297.0]
  - - [1024, 6784, 1, 256, 1024, 1024, 256, 256]
    - [7, 35941.0]
  - - [3584, 2944, 1, 256, 3584, 3584, 256, 256]
    - [33, 37339.0]
  - - [3584, 1408, 1, 1280, 3584, 3584, 1280, 1280]
    - [36, 32765.0]
  - - [5056, 6784, 1, 3328, 5056, 5056, 3328, 3328]
    - [19, 39928.0]
  - - [3584, 4288, 1, 256, 3584, 3584, 256, 256]
    - [33, 34934.0]
  - - [1856, 6784, 1, 3328, 1856, 1856, 3328, 3328]
    - [18, 36228.0]
  - - [5056, 1408, 1, 256, 5056, 5056, 256, 256]
    - [7, 33451.0]
  - - [3584, 1024, 1, 256, 3584, 3584, 256, 256]
    - [33, 30784.0]
  - - [5888, 5888, 1, 256, 5888, 5888, 256, 256]
    - [36, 39243.0]
  - - [4288, 1024, 1, 1280, 4288, 4288, 1280, 1280]
    - [18, 35622.0]
  - - [448, 6784, 1, 3328, 448, 448, 3328, 3328]
    - [36, 32927.0]
  - - [2944, 1408, 1, 1280, 2944, 2944, 1280, 1280]
    - [36, 33786.0]
  - - [2944, 1856, 1, 3328, 2944, 2944, 3328, 3328]
    - [29, 30876.0]
  - - [3584, 5888, 1, 1280, 3584, 3584, 1280, 1280]
    - [36, 40366.0]
  - - [6784, 1856, 1, 1280, 6784, 6784, 1280, 1280]
    - [24, 35901.0]
  - - [5888, 256, 1, 3328, 5888, 5888, 3328, 3328]
    - [21, 29158.0]
  - - [1856, 5888, 1, 3328, 1856, 1856, 3328, 3328]
    - [18, 37138.0]
  - - [3584, 1408, 1, 256, 3584, 3584, 256, 256]
    - [33, 33907.0]
  - - [704, 3584, 1, 3328, 704, 704, 3328, 3328]
    - [33, 30537.0]
  - - [4096, 3200, 1, 1024, 4096, 4096, 1024, 1024]
    - [22, 36548.0]
  - - [5056, 448, 1, 1280, 5056, 5056, 1280, 1280]
    - [33, 26880.0]
  - - [3584, 1856, 1, 3328, 3584, 3584, 3328, 3328]
    - [28, 35832.0]
  - - [2944, 1024, 1, 256, 2944, 2944, 256, 256]
    - [29, 29167.0]
  - - [2368, 4288, 1, 3328, 2368, 2368, 3328, 3328]
    - [18, 38115.0]
  - - [1024, 1408, 1, 1280, 1024, 1024, 1280, 1280]
    - [1, 27446.0]
  - - [6784, 5056, 1, 256, 6784, 6784, 256, 256]
    - [21, 38207.0]
  - - [3584, 5056, 1, 3328, 3584, 3584, 3328, 3328]
    - [30, 39132.0]
  - - [4288, 5888, 1, 256, 4288, 4288, 256, 256]
    - [10, 38290.0]
  - - [2944, 6784, 1, 256, 2944, 2944, 256, 256]
    - [33, 38345.0]
  - - [2368, 2368, 1, 1280, 2368, 2368, 1280, 1280]
    - [18, 30935.0]
  - - [1856, 3584, 1, 1280, 1856, 1856, 1280, 1280]
    - [18, 36297.0]
  - - [5056, 3584, 1, 1280, 5056, 5056, 1280, 1280]
    - [10, 38978.0]
  - - [256, 5888, 1, 256, 256, 256, 256, 256]
    - [23, 24330.0]
  - - [1856, 1408, 1, 3328, 1856, 1856, 3328, 3328]
    - [33, 29796.0]
  - - [1024, 4288, 1, 3328, 1024, 1024, 3328, 3328]
    - [10, 36354.0]
  - - [2944, 2368, 1, 3328, 2944, 2944, 3328, 3328]
    - [18, 33800.0]
  - - [704, 4288, 1, 3328, 704, 704, 3328, 3328]
    - [24, 32793.0]
  - - [1024, 1856, 1, 1280, 1024, 1024, 1280, 1280]
    - [29, 28124.0]
  - - [2048, 6400, 1, 2048, 2048, 2048, 2048, 2048]
    - [25, 37402.0]
  - - [512, 48000, 1, 2816, 512, 512, 2816, 2816]
    - [34, 40473.0]
  - - [5124, 9124, 1, 2560, 5124, 5124, 2560, 2560]
    - [10, 38219.0]
  - - [1024, 5888, 1, 256, 1024, 1024, 256, 256]
    - [7, 32210.0]
  - - [1408, 2368, 1, 256, 1408, 1408, 256, 256]
    - [35, 27857.0]
  - - [2944, 704, 1, 3328, 2944, 2944, 3328, 3328]
    - [24, 32037.0]
  - - [2944, 2944, 1, 1280, 2944, 2944, 1280, 1280]
    - [24, 36338.0]
  - - [6784, 256, 1, 3328, 6784, 6784, 3328, 3328]
    - [9, 31876.0]
  - - [1408, 5056, 1, 256, 1408, 1408, 256, 256]
    - [18, 30516.0]
  - - [4608, 24000, 1, 1536, 4608, 4608, 1536, 1536]
    - [10, 40764.0]
  - - [1408, 4288, 1, 256, 1408, 1408, 256, 256]
    - [35, 29306.0]
  - - [5888, 2368, 1, 1280, 5888, 5888, 1280, 1280]
    - [24, 36707.0]
  - - [2368, 5888, 1, 1280, 2368, 2368, 1280, 1280]
    - [10, 36391.0]
  - - [5888, 256, 1, 1280, 5888, 5888, 1280, 1280]
    - [33, 28183.0]
  - - [2368, 1856, 1, 3328, 2368, 2368, 3328, 3328]
    - [31, 30309.0]
  - - [2944, 704, 1, 256, 2944, 2944, 256, 256]
    - [35, 24724.0]
  - - [2368, 6784, 1, 1280, 2368, 2368, 1280, 1280]
    - [18, 36716.0]
  - - [2368, 1024, 1, 3328, 2368, 2368, 3328, 3328]
    - [33, 29649.0]
  - - [1856, 4288, 1, 1280, 1856, 1856, 1280, 1280]
    - [29, 33070.0]
  - - [704, 3584, 1, 256, 704, 704, 256, 256]
    - [9, 26236.0]
  - - [704, 2944, 1, 3328, 704, 704, 3328, 3328]
    - [10, 32177.0]
  - - [1856, 5056, 1, 3328, 1856, 1856, 3328, 3328]
    - [29, 35417.0]
  - - [3584, 5056, 1, 1280, 3584, 3584, 1280, 1280]
    - [36, 38538.0]
  - - [2944, 1024, 1, 3328, 2944, 2944, 3328, 3328]
    - [10, 33206.0]
  - - [1408, 6784, 1, 256, 1408, 1408, 256, 256]
    - [21, 35194.0]
  - - [6784, 1408, 1, 3328, 6784, 6784, 3328, 3328]
    - [10, 36307.0]
  - - [1024, 2368, 1, 1280, 1024, 1024, 1280, 1280]
    - [21, 29045.0]
  - - [6784, 2944, 1, 1280, 6784, 6784, 1280, 1280]
    - [10, 38178.0]
  - - [3584, 448, 1, 1280, 3584, 3584, 1280, 1280]
    - [33, 23408.0]
  - - [2944, 6784, 1, 3328, 2944, 2944, 3328, 3328]
    - [25, 38431.0]
  - - [448, 5056, 1, 1280, 448, 448, 1280, 1280]
    - [7, 26965.0]
  - - [4288, 704, 1, 256, 4288, 4288, 256, 256]
    - [21, 25916.0]
  - - [5888, 704, 1, 256, 5888, 5888, 256, 256]
    - [33, 29411.0]
  - - [256, 5888, 1, 3328, 256, 256, 3328, 3328]
    - [7, 29291.0]
  - - [6784, 4288, 1, 256, 6784, 6784, 256, 256]
    - [33, 37569.0]
  - - [5888, 256, 1, 256, 5888, 5888, 256, 256]
    - [35, 24117.0]
  - - [6784, 1024, 1, 1280, 6784, 6784, 1280, 1280]
    - [10, 38799.0]
  - - [2944, 704, 1, 1280, 2944, 2944, 1280, 1280]
    - [24, 30340.0]
  - - [6784, 3584, 1, 1280, 6784, 6784, 1280, 1280]
    - [10, 40042.0]
  - - [1408, 2944, 1, 1280, 1408, 1408, 1280, 1280]
    - [29, 33700.0]
  - - [2048, 800, 1, 2048, 2048, 2048, 2048, 2048]
    - [24, 25149.0]
  - - [1408, 2368, 1, 3328, 1408, 1408, 3328, 3328]
    - [33, 31902.0]
  - - [2368, 2944, 1, 256, 2368, 2368, 256, 256]
    - [33, 30476.0]
  - - [2944, 5888, 1, 256, 2944, 2944, 256, 256]
    - [10, 38275.0]
  - - [3584, 1856, 1, 256, 3584, 3584, 256, 256]
    - [21, 32710.0]
  - - [4288, 2944, 1, 1280, 4288, 4288, 1280, 1280]
    - [28, 37306.0]
  - - [5056, 448, 1, 3328, 5056, 5056, 3328, 3328]
    - [33, 28082.0]
  - - [4288, 5056, 1, 3328, 4288, 4288, 3328, 3328]
    - [18, 39431.0]
  - - [256, 5056, 1, 3328, 256, 256, 3328, 3328]
    - [14, 24908.0]
  - - [5056, 2368, 1, 256, 5056, 5056, 256, 256]
    - [21, 34917.0]
  - - [4288, 704, 1, 3328, 4288, 4288, 3328, 3328]
    - [36, 32756.0]
  - - [448, 3584, 1, 256, 448, 448, 256, 256]
    - [1, 21166.0]
  - - [1024, 1408, 1, 3328, 1024, 1024, 3328, 3328]
    - [7, 28063.0]
  - - [2944, 5888, 1, 1280, 2944, 2944, 1280, 1280]
    - [10, 39745.0]
  - - [5888, 3584, 1, 256, 5888, 5888, 256, 256]
    - [29, 39295.0]
  - - [1408, 1856, 1, 3328, 1408, 1408, 3328, 3328]
    - [33, 30114.0]
  - - [6784, 1408, 1, 1280, 6784, 6784, 1280, 1280]
    - [10, 35808.0]
  - - [704, 2944, 1, 256, 704, 704, 256, 256]
    - [9, 25606.0]
  - - [2944, 5888, 1, 3328, 2944, 2944, 3328, 3328]
    - [18, 39748.0]
  - - [1408, 6784, 1, 3328, 1408, 1408, 3328, 3328]
    - [18, 36086.0]
  - - [1408, 1408, 1, 1280, 1408, 1408, 1280, 1280]
    - [36, 29458.0]
  - - [16384, 400, 1, 4096, 16384, 16384, 4096, 4096]
    - [11, 26717.0]
  - - [448, 4288, 1, 3328, 448, 448, 3328, 3328]
    - [36, 29584.0]
  - - [704, 2368, 1, 256, 704, 704, 256, 256]
    - [20, 22044.0]
  - - [5888, 2368, 1, 3328, 5888, 5888, 3328, 3328]
    - [10, 36994.0]
  - - [5124, 9124, 1, 1760, 5124, 5124, 1760, 1760]
    - [18, 39823.0]
  - - [4288, 5056, 1, 256, 4288, 4288, 256, 256]
    - [33, 36683.0]
  - - [4288, 448, 1, 1280, 4288, 4288, 1280, 1280]
    - [29, 27678.0]
  - - [5888, 704, 1, 3328, 5888, 5888, 3328, 3328]
    - [36, 34248.0]
  - - [4288, 3584, 1, 3328, 4288, 4288, 3328, 3328]
    - [25, 37903.0]
  - - [1408, 1024, 1, 256, 1408, 1408, 256, 256]
    - [35, 23390.0]
  - - [8192, 400, 1, 2048, 8192, 8192, 2048, 2048]
    - [24, 26728.0]
  - - [2560, 7000, 1, 2560, 2560, 2560, 2560, 2560]
    - [25, 38605.0]
  - - [6784, 6784, 1, 3328, 6784, 6784, 3328, 3328]
    - [3, 40151.0]
  - - [704, 5056, 1, 3328, 704, 704, 3328, 3328]
    - [36, 29647.0]
  - - [2368, 2944, 1, 3328, 2368, 2368, 3328, 3328]
    - [18, 33908.0]
  - - [2368, 3584, 1, 256, 2368, 2368, 256, 256]
    - [18, 32939.0]
  - - [5124, 9124, 1, 4096, 5124, 5124, 4096, 4096]
    - [37, 35455.0]
  - - [7680, 48000, 1, 2560, 7680, 7680, 2560, 2560]
    - [25, 41228.0]
  - - [1024, 48000, 1, 2816, 1024, 1024, 2816, 2816]
    - [22, 40860.0]
  - - [1856, 1856, 1, 256, 1856, 1856, 256, 256]
    - [35, 25196.0]
  - - [4288, 1408, 1, 3328, 4288, 4288, 3328, 3328]
    - [18, 33887.0]
  - - [5124, 9124, 1, 2048, 5124, 5124, 2048, 2048]
    - [11, 36476.0]
  - - [4288, 5056, 1, 1280, 4288, 4288, 1280, 1280]
    - [10, 39107.0]
  - - [5888, 6784, 1, 1280, 5888, 5888, 1280, 1280]
    - [28, 40271.0]
  - - [1760, 1600, 1, 1760, 1760, 1760, 1760, 1760]
    - [13, 30451.0]
  - - [5888, 1408, 1, 3328, 5888, 5888, 3328, 3328]
    - [10, 35347.0]
  - - [256, 5056, 1, 256, 256, 256, 256, 256]
    - [6, 22664.0]
  - - [7680, 12000, 1, 2560, 7680, 7680, 2560, 2560]
    - [25, 40451.0]
  - - [2368, 5056, 1, 256, 2368, 2368, 256, 256]
    - [10, 33035.0]
  - - [1024, 5056, 1, 256, 1024, 1024, 256, 256]
    - [33, 31663.0]
  - - [2368, 1408, 1, 3328, 2368, 2368, 3328, 3328]
    - [17, 30623.0]
  - - [1024, 48000, 1, 1536, 1024, 1024, 1536, 1536]
    - [22, 40802.0]
  - - [5888, 448, 1, 256, 5888, 5888, 256, 256]
    - [23, 22097.0]
  - - [2560, 3200, 1, 2560, 2560, 2560, 2560, 2560]
    - [37, 34564.0]
  - - [6784, 5056, 1, 1280, 6784, 6784, 1280, 1280]
    - [10, 39617.0]
  - - [1024, 48000, 1, 2560, 1024, 1024, 2560, 2560]
    - [25, 40620.0]
  - - [4288, 6784, 1, 1280, 4288, 4288, 1280, 1280]
    - [10, 38697.0]
  - - [16384, 800, 1, 4096, 16384, 16384, 4096, 4096]
    - [12, 29967.0]
  - - [3072, 48000, 1, 1024, 3072, 3072, 1024, 1024]
    - [34, 40960.0]
  - - [6784, 1408, 1, 256, 6784, 6784, 256, 256]
    - [33, 33943.0]
  - - [5888, 4288, 1, 256, 5888, 5888, 256, 256]
    - [21, 37452.0]
  - - [5056, 5888, 1, 256, 5056, 5056, 256, 256]
    - [21, 38231.0]
  - - [2368, 1024, 1, 256, 2368, 2368, 256, 256]
    - [23, 23802.0]
  - - [1856, 6784, 1, 1280, 1856, 1856, 1280, 1280]
    - [18, 35578.0]
  - - [6784, 1856, 1, 256, 6784, 6784, 256, 256]
    - [21, 34757.0]
  - - [4288, 3584, 1, 256, 4288, 4288, 256, 256]
    - [21, 36482.0]
  - - [6784, 448, 1, 3328, 6784, 6784, 3328, 3328]
    - [10, 32573.0]
  - - [5056, 1856, 1, 1280, 5056, 5056, 1280, 1280]
    - [10, 35280.0]
  - - [1408, 1024, 1, 3328, 1408, 1408, 3328, 3328]
    - [7, 27900.0]
  - - [5888, 3584, 1, 1280, 5888, 5888, 1280, 1280]
    - [10, 40445.0]
  - - [1024, 2944, 1, 256, 1024, 1024, 256, 256]
    - [7, 28775.0]
  - - [448, 6784, 1, 1280, 448, 448, 1280, 1280]
    - [36, 31741.0]
  - - [3584, 1024, 1, 3328, 3584, 3584, 3328, 3328]
    - [18, 30979.0]
  - - [2944, 1856, 1, 1280, 2944, 2944, 1280, 1280]
    - [24, 30409.0]
  - - [5056, 256, 1, 256, 5056, 5056, 256, 256]
    - [6, 20131.0]
  - - [2368, 3584, 1, 3328, 2368, 2368, 3328, 3328]
    - [18, 36145.0]
  - - [3584, 5888, 1, 3328, 3584, 3584, 3328, 3328]
    - [3, 40439.0]
  - - [2944, 3584, 1, 1280, 2944, 2944, 1280, 1280]
    - [10, 39727.0]
  - - [1856, 5888, 1, 1280, 1856, 1856, 1280, 1280]
    - [18, 36348.0]
  - - [2048, 3200, 1, 2048, 2048, 2048, 2048, 2048]
    - [25, 35782.0]
  - - [4288, 1408, 1, 256, 4288, 4288, 256, 256]
    - [21, 32013.0]
  - - [4288, 2368, 1, 1280, 4288, 4288, 1280, 1280]
    - [10, 34640.0]
  - - [2944, 5056, 1, 256, 2944, 2944, 256, 256]
    - [29, 35407.0]
  - - [6784, 2368, 1, 256, 6784, 6784, 256, 256]
    - [33, 36420.0]
  - - [1024, 24000, 1, 2816, 1024, 1024, 2816, 2816]
    - [8, 40219.0]
  - - [7680, 5984, 1, 2560, 7680, 7680, 2560, 2560]
    - [10, 39143.0]
  - - [4288, 1856, 1, 256, 4288, 4288, 256, 256]
    - [21, 31219.0]
  - - [1856, 2944, 1, 256, 1856, 1856, 256, 256]
    - [23, 29227.0]
  - - [6144, 48000, 1, 2560, 6144, 6144, 2560, 2560]
    - [4, 40887.0]
  - - [1760, 800, 1, 1760, 1760, 1760, 1760, 1760]
    - [0, 26515.0]
  - - [1856, 1408, 1, 1280, 1856, 1856, 1280, 1280]
    - [21, 30447.0]
  - - [1024, 4288, 1, 1280, 1024, 1024, 1280, 1280]
    - [10, 34905.0]
  - - [2368, 5056, 1, 3328, 2368, 2368, 3328, 3328]
    - [18, 37248.0]
  - - [1024, 5056, 1, 3328, 1024, 1024, 3328, 3328]
    - [24, 34593.0]
  - - [1024, 1856, 1, 3328, 1024, 1024, 3328, 3328]
    - [24, 29675.0]
  - - [4288, 6784, 1, 256, 4288, 4288, 256, 256]
    - [21, 37871.0]
  - - [3584, 2944, 1, 3328, 3584, 3584, 3328, 3328]
    - [19, 36115.0]
  - - [5888, 2944, 1, 256, 5888, 5888, 256, 256]
    - [21, 38058.0]
  - - [5056, 4288, 1, 256, 5056, 5056, 256, 256]
    - [33, 37400.0]
  - - [1024, 3584, 1, 256, 1024, 1024, 256, 256]
    - [7, 30946.0]
  - - [5888, 5888, 1, 1280, 5888, 5888, 1280, 1280]
    - [10, 40177.0]
  - - [448, 5888, 1, 1280, 448, 448, 1280, 1280]
    - [10, 28113.0]
  - - [4288, 704, 1, 1280, 4288, 4288, 1280, 1280]
    - [36, 31471.0]
  - - [2944, 1408, 1, 256, 2944, 2944, 256, 256]
    - [21, 30493.0]
  - - [2368, 5888, 1, 3328, 2368, 2368, 3328, 3328]
    - [18, 36975.0]
  - - [2368, 1856, 1, 1280, 2368, 2368, 1280, 1280]
    - [31, 29395.0]
  - - [5888, 4288, 1, 3328, 5888, 5888, 3328, 3328]
    - [10, 39789.0]
  - - [6784, 704, 1, 1280, 6784, 6784, 1280, 1280]
    - [36, 31282.0]
  - - [5056, 448, 1, 256, 5056, 5056, 256, 256]
    - [20, 25703.0]
  - - [1856, 5056, 1, 1280, 1856, 1856, 1280, 1280]
    - [18, 34966.0]
  - - [2944, 1024, 1, 1280, 2944, 2944, 1280, 1280]
    - [18, 32640.0]
  - - [2368, 4288, 1, 256, 2368, 2368, 256, 256]
    - [33, 33173.0]
  - - [1024, 2368, 1, 3328, 1024, 1024, 3328, 3328]
    - [7, 29948.0]
  - - [4288, 5888, 1, 3328, 4288, 4288, 3328, 3328]
    - [18, 39807.0]
  - - [1024, 2944, 1, 3328, 1024, 1024, 3328, 3328]
    - [24, 32761.0]
  - - [256, 6784, 1, 1280, 256, 256, 1280, 1280]
    - [35, 31425.0]
  - - [1856, 3584, 1, 256, 1856, 1856, 256, 256]
    - [18, 33130.0]
  - - [512, 24000, 1, 2816, 512, 512, 2816, 2816]
    - [8, 37578.0]
  - - [256, 5888, 1, 1280, 256, 256, 1280, 1280]
    - [7, 27383.0]
  - - [16384, 1600, 1, 4096, 16384, 16384, 4096, 4096]
    - [12, 32423.0]
  - - [2944, 2368, 1, 256, 2944, 2944, 256, 256]
    - [18, 29705.0]
  - - [1024, 1856, 1, 256, 1024, 1024, 256, 256]
    - [6, 25661.0]
  - - [6784, 3584, 1, 3328, 6784, 6784, 3328, 3328]
    - [10, 40246.0]
  - - [1760, 7000, 1, 1760, 1760, 1760, 1760, 1760]
    - [3, 38486.0]
  - - [1024, 5888, 1, 3328, 1024, 1024, 3328, 3328]
    - [24, 34243.0]
  - - [1408, 2368, 1, 1280, 1408, 1408, 1280, 1280]
    - [33, 30610.0]
  - - [2944, 2944, 1, 256, 2944, 2944, 256, 256]
    - [21, 33771.0]
  - - [6784, 256, 1, 256, 6784, 6784, 256, 256]
    - [23, 27718.0]
  - - [5888, 1408, 1, 256, 5888, 5888, 256, 256]
    - [21, 35161.0]
  - - [5888, 6784, 1, 3328, 5888, 5888, 3328, 3328]
    - [28, 40794.0]
  - - [704, 4288, 1, 1280, 704, 704, 1280, 1280]
    - [18, 30848.0]
  - - [1024, 48000, 1, 2048, 1024, 1024, 2048, 2048]
    - [11, 39987.0]
  - - [1024, 1024, 1, 3328, 1024, 1024, 3328, 3328]
    - [53, 28047.0]
  - - [64, 6784, 1, 256, 64, 64, 256, 256]
    - [51, 11435.0]
  - - [128, 6784, 1, 3328, 128, 128, 3328, 3328]
    - [60, 23514.0]
  - - [2048, 400, 1, 512, 2048, 2048, 512, 512]
    - [60, 18725.0]
  - - [256, 4288, 1, 3328, 256, 256, 3328, 3328]
    - [44, 29221.0]
  - - [704, 1856, 1, 3328, 704, 704, 3328, 3328]
    - [60, 24064.0]
  - - [448, 1024, 1, 1280, 448, 448, 1280, 1280]
    - [53, 18408.0]
  - - [2368, 128, 1, 256, 2368, 2368, 256, 256]
    - [51, 8361.0]
  - - [64, 5056, 1, 256, 64, 64, 256, 256]
    - [51, 8647.0]
  - - [256, 1856, 1, 1280, 256, 256, 1280, 1280]
    - [53, 19295.0]
  - - [448, 704, 1, 1280, 448, 448, 1280, 1280]
    - [39, 13039.0]
  - - [4288, 256, 1, 256, 4288, 4288, 256, 256]
    - [44, 19930.0]
  - - [128, 3584, 1, 1280, 128, 128, 1280, 1280]
    - [53, 19240.0]
  - - [5888, 64, 1, 3328, 5888, 5888, 3328, 3328]
    - [52, 16291.0]
  - - [2944, 256, 1, 3328, 2944, 2944, 3328, 3328]
    - [47, 22307.0]
  - - [256, 4288, 1, 1280, 256, 256, 1280, 1280]
    - [44, 27241.0]
  - - [1408, 448, 1, 1280, 1408, 1408, 1280, 1280]
    - [47, 18900.0]
  - - [1408, 256, 1, 1280, 1408, 1408, 1280, 1280]
    - [53, 15328.0]
  - - [3072, 128, 1, 1024, 3072, 3072, 1024, 1024]
    - [53, 15583.0]
  - - [6784, 128, 1, 1280, 6784, 6784, 1280, 1280]
    - [44, 22509.0]
  - - [6784, 64, 1, 256, 6784, 6784, 256, 256]
    - [42, 11342.0]
  - - [2368, 128, 1, 3328, 2368, 2368, 3328, 3328]
    - [41, 14195.0]
  - - [2944, 128, 1, 256, 2944, 2944, 256, 256]
    - [42, 10198.0]
  - - [448, 1408, 1, 256, 448, 448, 256, 256]
    - [43, 13570.0]
  - - [64, 5056, 1, 3328, 64, 64, 3328, 3328]
    - [51, 14359.0]
  - - [2368, 256, 1, 1280, 2368, 2368, 1280, 1280]
    - [52, 17667.0]
  - - [256, 3584, 1, 3328, 256, 256, 3328, 3328]
    - [60, 24785.0]
  - - [5056, 64, 1, 1280, 5056, 5056, 1280, 1280]
    - [42, 13233.0]
  - - [1024, 704, 1, 256, 1024, 1024, 256, 256]
    - [43, 16160.0]
  - - [4288, 128, 1, 1280, 4288, 4288, 1280, 1280]
    - [44, 22162.0]
  - - [5888, 64, 1, 256, 5888, 5888, 256, 256]
    - [51, 10219.0]
  - - [1856, 256, 1, 1280, 1856, 1856, 1280, 1280]
    - [44, 19369.0]
  - - [64, 5888, 1, 3328, 64, 64, 3328, 3328]
    - [58, 16270.0]
  - - [256, 1408, 1, 3328, 256, 256, 3328, 3328]
    - [44, 16628.0]
  - - [6784, 128, 1, 3328, 6784, 6784, 3328, 3328]
    - [44, 23548.0]
  - - [704, 704, 1, 3328, 704, 704, 3328, 3328]
    - [41, 22972.0]
  - - [3584, 256, 1, 3328, 3584, 3584, 3328, 3328]
    - [53, 24732.0]
  - - [128, 3584, 1, 3328, 128, 128, 3328, 3328]
    - [44, 20943.0]
  - - [128, 2944, 1, 1280, 128, 128, 1280, 1280]
    - [44, 15951.0]
  - - [448, 1856, 1, 1280, 448, 448, 1280, 1280]
    - [53, 20984.0]
  - - [3584, 128, 1, 256, 3584, 3584, 256, 256]
    - [42, 11721.0]
  - - [448, 1408, 1, 3328, 448, 448, 3328, 3328]
    - [43, 19978.0]
  - - [256, 3584, 1, 256, 256, 256, 256, 256]
    - [60, 18465.0]
  - - [256, 2944, 1, 3328, 256, 256, 3328, 3328]
    - [47, 23738.0]
  - - [1408, 704, 1, 256, 1408, 1408, 256, 256]
    - [57, 18415.0]
  - - [448, 2944, 1, 3328, 448, 448, 3328, 3328]
    - [60, 24272.0]
  - - [64, 5888, 1, 256, 64, 64, 256, 256]
    - [51, 10049.0]
  - - [448, 2368, 1, 1280, 448, 448, 1280, 1280]
    - [40, 20637.0]
  - - [128, 4288, 1, 3328, 128, 128, 3328, 3328]
    - [53, 24738.0]
  - - [256, 2368, 1, 256, 256, 256, 256, 256]
    - [43, 13931.0]
  - - [1024, 448, 1, 3328, 1024, 1024, 3328, 3328]
    - [48, 21076.0]
  - - [1856, 704, 1, 1280, 1856, 1856, 1280, 1280]
    - [44, 23049.0]
  - - [1024, 1024, 1, 1280, 1024, 1024, 1280, 1280]
    - [48, 26951.0]
  - - [256, 2944, 1, 256, 256, 256, 256, 256]
    - [43, 17196.0]
  - - [1024, 700, 1, 512, 1024, 1024, 512, 512]
    - [59, 17102.0]
  - - [128, 6784, 1, 1280, 128, 128, 1280, 1280]
    - [44, 22564.0]
  - - [1408, 704, 1, 3328, 1408, 1408, 3328, 3328]
    - [60, 26526.0]
  - - [128, 5888, 1, 1280, 128, 128, 1280, 1280]
    - [52, 22784.0]
  - - [704, 1408, 1, 3328, 704, 704, 3328, 3328]
    - [44, 26399.0]
  - - [7680, 64, 1, 2560, 7680, 7680, 2560, 2560]
    - [45, 17134.0]
  - - [6784, 128, 1, 256, 6784, 6784, 256, 256]
    - [60, 17476.0]
  - - [704, 448, 1, 256, 704, 704, 256, 256]
    - [51, 8663.0]
  - - [256, 1856, 1, 3328, 256, 256, 3328, 3328]
    - [44, 22017.0]
  - - [128, 4288, 1, 256, 128, 128, 256, 256]
    - [43, 14698.0]
  - - [64, 6784, 1, 3328, 64, 64, 3328, 3328]
    - [42, 18102.0]
  - - [2944, 256, 1, 1280, 2944, 2944, 1280, 1280]
    - [52, 22300.0]
  - - [1856, 704, 1, 256, 1856, 1856, 256, 256]
    - [60, 18750.0]
  - - [1408, 448, 1, 3328, 1408, 1408, 3328, 3328]
    - [47, 19789.0]
  - - [704, 1856, 1, 256, 704, 704, 256, 256]
    - [52, 20750.0]
  - - [256, 2368, 1, 1280, 256, 256, 1280, 1280]
    - [52, 18475.0]
  - - [2944, 448, 1, 256, 2944, 2944, 256, 256]
    - [51, 21024.0]
  - - [2368, 128, 1, 1280, 2368, 2368, 1280, 1280]
    - [46, 12548.0]
  - - [64, 5056, 1, 1280, 64, 64, 1280, 1280]
    - [51, 13284.0]
  - - [704, 448, 1, 3328, 704, 704, 3328, 3328]
    - [48, 14808.0]
  - - [2368, 448, 1, 1280, 2368, 2368, 1280, 1280]
    - [55, 20681.0]
  - - [128, 3584, 1, 256, 128, 128, 256, 256]
    - [43, 12414.0]
  - - [1856, 448, 1, 3328, 1856, 1856, 3328, 3328]
    - [48, 22345.0]
  - - [128, 5056, 1, 256, 128, 128, 256, 256]
    - [52, 14766.0]
  - - [4288, 256, 1, 1280, 4288, 4288, 1280, 1280]
    - [44, 27209.0]
  - - [704, 704, 1, 256, 704, 704, 256, 256]
    - [51, 12816.0]
  - - [4288, 128, 1, 3328, 4288, 4288, 3328, 3328]
    - [60, 24551.0]
  - - [7680, 128, 1, 2560, 7680, 7680, 2560, 2560]
    - [44, 23630.0]
  - - [256, 1408, 1, 1280, 256, 256, 1280, 1280]
    - [53, 15308.0]
  - - [6784, 64, 1, 3328, 6784, 6784, 3328, 3328]
    - [52, 18668.0]
  - - [128, 2944, 1, 3328, 128, 128, 3328, 3328]
    - [44, 17137.0]
  - - [2944, 448, 1, 3328, 2944, 2944, 3328, 3328]
    - [60, 24328.0]
  - - [5888, 128, 1, 256, 5888, 5888, 256, 256]
    - [51, 16378.0]
  - - [5056, 64, 1, 256, 5056, 5056, 256, 256]
    - [51, 8794.0]
  - - [128, 5056, 1, 3328, 128, 128, 3328, 3328]
    - [40, 20598.0]
  - - [256, 4288, 1, 256, 256, 256, 256, 256]
    - [43, 20972.0]
  - - [3584, 256, 1, 256, 3584, 3584, 256, 256]
    - [57, 18236.0]
  - - [128, 2944, 1, 256, 128, 128, 256, 256]
    - [52, 10198.0]
  - - [3584, 128, 1, 3328, 3584, 3584, 3328, 3328]
    - [53, 20937.0]
  - - [1024, 448, 1, 1280, 1024, 1024, 1280, 1280]
    - [43, 18465.0]
  - - [5888, 128, 1, 3328, 5888, 5888, 3328, 3328]
    - [47, 22690.0]
  - - [1408, 704, 1, 1280, 1408, 1408, 1280, 1280]
    - [60, 25075.0]
  - - [448, 1408, 1, 1280, 448, 448, 1280, 1280]
    - [43, 18962.0]
  - - [704, 1408, 1, 1280, 704, 704, 1280, 1280]
    - [41, 25234.0]
  - - [448, 2944, 1, 256, 448, 448, 256, 256]
    - [43, 18926.0]
  - - [448, 2368, 1, 256, 448, 448, 256, 256]
    - [43, 16974.0]
  - - [64, 6784, 1, 1280, 64, 64, 1280, 1280]
    - [42, 16892.0]
  - - [128, 2368, 1, 3328, 128, 128, 3328, 3328]
    - [44, 14156.0]
  - - [5056, 64, 1, 3328, 5056, 5056, 3328, 3328]
    - [58, 14397.0]
  - - [5056, 128, 1, 3328, 5056, 5056, 3328, 3328]
    - [43, 19788.0]
  - - [448, 704, 1, 256, 448, 448, 256, 256]
    - [58, 8719.0]
  - - [1856, 256, 1, 3328, 1856, 1856, 3328, 3328]
    - [41, 22048.0]
  - - [2944, 128, 1, 3328, 2944, 2944, 3328, 3328]
    - [53, 17312.0]
  - - [448, 1024, 1, 3328, 448, 448, 3328, 3328]
    - [53, 21240.0]
  - - [704, 1024, 1, 1280, 704, 704, 1280, 1280]
    - [47, 21539.0]
  - - [2368, 256, 1, 256, 2368, 2368, 256, 256]
    - [54, 13758.0]
  - - [256, 2368, 1, 3328, 256, 256, 3328, 3328]
    - [52, 19425.0]
  - - [704, 448, 1, 1280, 704, 704, 1280, 1280]
    - [39, 13133.0]
  - - [1024, 704, 1, 1280, 1024, 1024, 1280, 1280]
    - [40, 21620.0]
  - - [256, 1856, 1, 256, 256, 256, 256, 256]
    - [49, 13515.0]
  - - [704, 1856, 1, 1280, 704, 704, 1280, 1280]
    - [55, 23804.0]
  - - [1408, 256, 1, 3328, 1408, 1408, 3328, 3328]
    - [44, 16555.0]
  - - [2368, 448, 1, 256, 2368, 2368, 256, 256]
    - [52, 16953.0]
  - - [4288, 256, 1, 3328, 4288, 4288, 3328, 3328]
    - [60, 29184.0]
  - - [2944, 256, 1, 256, 2944, 2944, 256, 256]
    - [59, 16777.0]
  - - [1408, 448, 1, 256, 1408, 1408, 256, 256]
    - [51, 14190.0]
  - - [6784, 64, 1, 1280, 6784, 6784, 1280, 1280]
    - [59, 17248.0]
  - - [2944, 448, 1, 1280, 2944, 2944, 1280, 1280]
    - [53, 23292.0]
  - - [128, 2368, 1, 256, 128, 128, 256, 256]
    - [49, 8471.0]
  - - [448, 1024, 1, 256, 448, 448, 256, 256]
    - [58, 12008.0]
  - - [1856, 448, 1, 256, 1856, 1856, 256, 256]
    - [51, 16604.0]
  - - [128, 5056, 1, 1280, 128, 128, 1280, 1280]
    - [43, 19667.0]
  - - [1408, 256, 1, 256, 1408, 1408, 256, 256]
    - [50, 10534.0]
  - - [256, 1408, 1, 256, 256, 256, 256, 256]
    - [49, 10462.0]
  - - [2368, 448, 1, 3328, 2368, 2368, 3328, 3328]
    - [59, 22202.0]
  - - [128, 5888, 1, 3328, 128, 128, 3328, 3328]
    - [43, 23765.0]
  - - [3584, 128, 1, 1280, 3584, 3584, 1280, 1280]
    - [44, 19077.0]
  - - [4288, 128, 1, 256, 4288, 4288, 256, 256]
    - [51, 13966.0]
  - - [2368, 256, 1, 3328, 2368, 2368, 3328, 3328]
    - [47, 18865.0]
  - - [5888, 128, 1, 1280, 5888, 5888, 1280, 1280]
    - [59, 22603.0]
  - - [256, 3584, 1, 1280, 256, 256, 1280, 1280]
    - [53, 23831.0]
  - - [128, 5888, 1, 256, 128, 128, 256, 256]
    - [52, 17044.0]
  - - [1024, 1024, 1, 256, 1024, 1024, 256, 256]
    - [53, 20745.0]
  - - [1024, 1024, 1, 1024, 1024, 1024, 1024, 1024]
    - [53, 26138.0]
  - - [64, 5888, 1, 1280, 64, 64, 1280, 1280]
    - [51, 15283.0]
  - - [704, 1024, 1, 256, 704, 704, 256, 256]
    - [52, 15127.0]
  - - [704, 704, 1, 1280, 704, 704, 1280, 1280]
    - [48, 20101.0]
  - - [128, 2368, 1, 1280, 128, 128, 1280, 1280]
    - [58, 12654.0]
  - - [3584, 256, 1, 1280, 3584, 3584, 1280, 1280]
    - [53, 23639.0]
  - - [5888, 64, 1, 1280, 5888, 5888, 1280, 1280]
    - [51, 15235.0]
  - - [5056, 128, 1, 1280, 5056, 5056, 1280, 1280]
    - [42, 19158.0]
  - - [448, 1856, 1, 3328, 448, 448, 3328, 3328]
    - [41, 22305.0]
  - - [1024, 448, 1, 256, 1024, 1024, 256, 256]
    - [52, 12336.0]
  - - [2944, 128, 1, 1280, 2944, 2944, 1280, 1280]
    - [44, 15993.0]
  - - [256, 2944, 1, 1280, 256, 256, 1280, 1280]
    - [52, 22741.0]
  - - [2560, 128, 1, 2560, 2560, 2560, 2560, 2560]
    - [44, 13852.0]
  - - [704, 1024, 1, 3328, 704, 704, 3328, 3328]
    - [52, 22430.0]
  - - [1856, 448, 1, 1280, 1856, 1856, 1280, 1280]
    - [53, 20992.0]
  - - [128, 6784, 1, 256, 128, 128, 256, 256]
    - [44, 17504.0]
  - - [704, 1408, 1, 256, 704, 704, 256, 256]
    - [44, 18658.0]
  - - [4096, 128, 1, 4096, 4096, 4096, 4096, 4096]
    - [53, 21709.0]
  - - [448, 2944, 1, 1280, 448, 448, 1280, 1280]
    - [44, 23486.0]
  - - [1856, 256, 1, 256, 1856, 1856, 256, 256]
    - [51, 12311.0]
  - - [5056, 128, 1, 256, 5056, 5056, 256, 256]
    - [51, 14282.0]
  - - [448, 2368, 1, 3328, 448, 448, 3328, 3328]
    - [56, 20078.0]
  - - [1024, 704, 1, 3328, 1024, 1024, 3328, 3328]
    - [43, 22015.0]
  - - [128, 4288, 1, 1280, 128, 128, 1280, 1280]
    - [53, 22190.0]
  - - [448, 704, 1, 3328, 448, 448, 3328, 3328]
    - [53, 14779.0]
  - - [448, 1856, 1, 256, 448, 448, 256, 256]
    - [51, 17709.0]
  - - [1856, 704, 1, 3328, 1856, 1856, 3328, 3328]
    - [53, 24072.0]
  - - [1408, 64, 1, 1280, 1408, 1408, 1280, 1280]
    - [67, 5621.0]
  - - [4096, 32, 1, 4096, 4096, 4096, 4096, 4096]
    - [74, 7016.0]
  - - [3072, 64, 1, 1024, 3072, 3072, 1024, 1024]
    - [71, 7310.0]
  - - [2944, 64, 1, 256, 2944, 2944, 256, 256]
    - [80, 7308.0]
  - - [448, 448, 1, 3328, 448, 448, 3328, 3328]
    - [81, 9203.0]
  - - [1024, 256, 1, 3328, 1024, 1024, 3328, 3328]
    - [86, 12319.0]
  - - [6144, 32, 1, 2560, 6144, 6144, 2560, 2560]
    - [74, 7459.0]
  - - [1856, 64, 1, 1280, 1856, 1856, 1280, 1280]
    - [85, 7165.0]
  - - [704, 128, 1, 1280, 704, 704, 1280, 1280]
    - [75, 5519.0]
  - - [1856, 128, 1, 256, 1856, 1856, 256, 256]
    - [81, 8663.0]
  - - [2944, 64, 1, 1280, 2944, 2944, 1280, 1280]
    - [80, 9012.0]
  - - [64, 3584, 1, 3328, 64, 64, 3328, 3328]
    - [64, 10620.0]
  - - [1024, 256, 1, 256, 1024, 1024, 256, 256]
    - [92, 9506.0]
  - - [448, 448, 1, 256, 448, 448, 256, 256]
    - [79, 7237.0]
  - - [7680, 32, 1, 2560, 7680, 7680, 2560, 2560]
    - [94, 7045.0]
  - - [128, 1024, 1, 3328, 128, 128, 3328, 3328]
    - [63, 8953.0]
  - - [64, 1856, 1, 1280, 64, 64, 1280, 1280]
    - [85, 7268.0]
  - - [448, 256, 1, 256, 448, 448, 256, 256]
    - [79, 5338.0]
  - - [256, 1024, 1, 256, 256, 256, 256, 256]
    - [92, 9506.0]
  - - [1024, 128, 1, 1280, 1024, 1024, 1280, 1280]
    - [70, 7989.0]
  - - [3072, 32, 1, 1024, 3072, 3072, 1024, 1024]
    - [83, 5168.0]
  - - [448, 256, 1, 3328, 448, 448, 3328, 3328]
    - [85, 7925.0]
  - - [128, 704, 1, 1280, 128, 128, 1280, 1280]
    - [67, 6007.0]
  - - [1856, 128, 1, 3328, 1856, 1856, 3328, 3328]
    - [76, 11129.0]
  - - [256, 448, 1, 256, 256, 256, 256, 256]
    - [85, 5377.0]
  - - [8448, 32, 1, 2816, 8448, 8448, 2816, 2816]
    - [74, 7817.0]
  - - [1408, 128, 1, 1280, 1408, 1408, 1280, 1280]
    - [80, 8538.0]
  - - [128, 1856, 1, 1280, 128, 128, 1280, 1280]
    - [76, 10715.0]
  - - [2048, 128, 1, 2048, 2048, 2048, 2048, 2048]
    - [92, 11015.0]
  - - [2560, 32, 1, 2560, 2560, 2560, 2560, 2560]
    - [72, 5058.0]
  - - [64, 1408, 1, 3328, 64, 64, 3328, 3328]
    - [75, 6148.0]
  - - [128, 1408, 1, 256, 128, 128, 256, 256]
    - [80, 7142.0]
  - - [256, 448, 1, 3328, 256, 256, 3328, 3328]
    - [63, 7965.0]
  - - [64, 2368, 1, 1280, 64, 64, 1280, 1280]
    - [63, 7578.0]
  - - [2368, 64, 1, 256, 2368, 2368, 256, 256]
    - [68, 5969.0]
  - - [704, 128, 1, 3328, 704, 704, 3328, 3328]
    - [75, 6266.0]
  - - [4288, 64, 1, 1280, 4288, 4288, 1280, 1280]
    - [86, 11563.0]
  - - [2560, 64, 1, 2560, 2560, 2560, 2560, 2560]
    - [92, 6883.0]
  - - [128, 1024, 1, 1280, 128, 128, 1280, 1280]
    - [80, 8066.0]
  - - [1856, 64, 1, 256, 1856, 1856, 256, 256]
    - [79, 5411.0]
  - - [704, 128, 1, 256, 704, 704, 256, 256]
    - [88, 4689.0]
  - - [448, 256, 1, 1280, 448, 448, 1280, 1280]
    - [81, 6866.0]
  - - [1024, 256, 1, 1280, 1024, 1024, 1280, 1280]
    - [92, 11773.0]
  - - [1856, 128, 1, 1280, 1856, 1856, 1280, 1280]
    - [92, 10618.0]
  - - [64, 3584, 1, 256, 64, 64, 256, 256]
    - [92, 8317.0]
  - - [64, 1856, 1, 256, 64, 64, 256, 256]
    - [68, 5373.0]
  - - [256, 1024, 1, 1280, 256, 256, 1280, 1280]
    - [81, 11798.0]
  - - [3584, 64, 1, 1280, 3584, 3584, 1280, 1280]
    - [64, 9986.0]
  - - [1408, 128, 1, 3328, 1408, 1408, 3328, 3328]
    - [75, 9099.0]
  - - [64, 4288, 1, 3328, 64, 64, 3328, 3328]
    - [86, 12419.0]
  - - [2368, 64, 1, 3328, 2368, 2368, 3328, 3328]
    - [75, 7612.0]
  - - [256, 704, 1, 256, 256, 256, 256, 256]
    - [80, 7254.0]
  - - [128, 1024, 1, 256, 128, 128, 256, 256]
    - [85, 6079.0]
  - - [64, 2944, 1, 256, 64, 64, 256, 256]
    - [80, 7286.0]
  - - [64, 1408, 1, 1280, 64, 64, 1280, 1280]
    - [67, 5970.0]
  - - [1408, 128, 1, 256, 1408, 1408, 256, 256]
    - [90, 7033.0]
  - - [64, 2944, 1, 1280, 64, 64, 1280, 1280]
    - [85, 9019.0]
  - - [256, 448, 1, 1280, 256, 256, 1280, 1280]
    - [70, 7017.0]
  - - [704, 256, 1, 1280, 704, 704, 1280, 1280]
    - [92, 8186.0]
  - - [64, 2368, 1, 3328, 64, 64, 3328, 3328]
    - [63, 7908.0]
  - - [256, 704, 1, 3328, 256, 256, 3328, 3328]
    - [63, 9463.0]
  - - [4096, 64, 1, 4096, 4096, 4096, 4096, 4096]
    - [95, 9485.0]
  - - [1760, 128, 1, 1760, 1760, 1760, 1760, 1760]
    - [64, 10506.0]
  - - [64, 2944, 1, 3328, 64, 64, 3328, 3328]
    - [85, 9559.0]
  - - [128, 1408, 1, 3328, 128, 128, 3328, 3328]
    - [85, 9442.0]
  - - [1408, 64, 1, 256, 1408, 1408, 256, 256]
    - [67, 4670.0]
  - - [64, 2368, 1, 256, 64, 64, 256, 256]
    - [80, 6043.0]
  - - [1024, 128, 1, 3328, 1024, 1024, 3328, 3328]
    - [75, 8710.0]
  - - [2368, 64, 1, 1280, 2368, 2368, 1280, 1280]
    - [85, 7309.0]
  - - [4288, 64, 1, 256, 4288, 4288, 256, 256]
    - [92, 9731.0]
  - - [64, 4288, 1, 1280, 64, 64, 1280, 1280]
    - [86, 11639.0]
  - - [1408, 64, 1, 3328, 1408, 1408, 3328, 3328]
    - [75, 6148.0]
  - - [448, 448, 1, 1280, 448, 448, 1280, 1280]
    - [64, 8798.0]
  - - [3584, 64, 1, 3328, 3584, 3584, 3328, 3328]
    - [76, 10582.0]
  - - [256, 1024, 1, 3328, 256, 256, 3328, 3328]
    - [81, 12037.0]
  - - [1856, 64, 1, 3328, 1856, 1856, 3328, 3328]
    - [75, 7813.0]
  - - [1024, 128, 1, 256, 1024, 1024, 256, 256]
    - [85, 5971.0]
  - - [4608, 32, 1, 1536, 4608, 4608, 1536, 1536]
    - [74, 7109.0]
  - - [128, 704, 1, 256, 128, 128, 256, 256]
    - [67, 4806.0]
  - - [64, 3584, 1, 1280, 64, 64, 1280, 1280]
    - [86, 10062.0]
  - - [3584, 64, 1, 256, 3584, 3584, 256, 256]
    - [71, 8156.0]
  - - [64, 1856, 1, 3328, 64, 64, 3328, 3328]
    - [75, 7868.0]
  - - [2944, 64, 1, 3328, 2944, 2944, 3328, 3328]
    - [85, 9014.0]
  - - [128, 704, 1, 3328, 128, 128, 3328, 3328]
    - [63, 6295.0]
  - - [128, 1856, 1, 256, 128, 128, 256, 256]
    - [92, 8663.0]
  - - [64, 4288, 1, 256, 64, 64, 256, 256]
    - [92, 9785.0]
  - - [704, 256, 1, 3328, 704, 704, 3328, 3328]
    - [85, 9202.0]
  - - [256, 704, 1, 1280, 256, 256, 1280, 1280]
    - [70, 8672.0]
  - - [4288, 64, 1, 3328, 4288, 4288, 3328, 3328]
    - [64, 12539.0]
  - - [2048, 64, 1, 2048, 2048, 2048, 2048, 2048]
    - [95, 7444.0]
  - - [64, 1408, 1, 256, 64, 64, 256, 256]
    - [67, 4747.0]
  - - [128, 1408, 1, 1280, 128, 128, 1280, 1280]
    - [80, 8907.0]
  - - [128, 1856, 1, 3328, 128, 128, 3328, 3328]
    - [76, 11164.0]
  - - [1760, 64, 1, 1760, 1760, 1760, 1760, 1760]
    - [86, 6981.0]
  - - [704, 256, 1, 256, 704, 704, 256, 256]
    - [89, 7076.0]
  - - [1024, 256, 1, 196, 1024, 1024, 196, 196]
    - [92, 8621.0]
  - - [256, 1024, 1, 196, 256, 256, 196, 196]
    - [76, 8679.0]
  - - [1760, 32, 1, 1760, 1760, 1760, 1760, 1760]
    - [62, 4069.0]
  - - [1760, 16, 1, 1760, 1760, 1760, 1760, 1760]
    - [93, 2383.0]
  - - [7680, 16, 1, 2560, 7680, 7680, 2560, 2560]
    - [97, 4571.0]
  - - [8448, 16, 1, 2816, 8448, 8448, 2816, 2816]
    - [97, 5214.0]
  - - [6144, 16, 1, 2560, 6144, 6144, 2560, 2560]
    - [98, 4792.0]
  - - [2048, 16, 1, 2048, 2048, 2048, 2048, 2048]
    - [73, 2858.0]
  - - [3072, 16, 1, 1024, 3072, 3072, 1024, 1024]
    - [73, 3495.0]
  - - [4096, 16, 1, 4096, 4096, 4096, 4096, 4096]
    - [98, 4447.0]
  - - [2560, 16, 1, 2560, 2560, 2560, 2560, 2560]
    - [73, 3153.0]
  - - [2048, 32, 1, 2048, 2048, 2048, 2048, 2048]
    - [98, 4456.0]
  - - [4608, 16, 1, 1536, 4608, 4608, 1536, 1536]
    - [97, 4336.0]
  - - [1024, 16, 1, 500000, 1024, 1024, 500000, 500000]
    - [66, 1726.0]
  - - [1024, 8, 1, 500000, 1024, 1024, 500000, 500000]
    - [78, 863.0]
  - - [512, 16, 1, 500000, 512, 512, 500000, 500000]
    - [66, 1043.0]
  - - [512, 8, 1, 500000, 512, 512, 500000, 500000]
    - [66, 522.0]
  - - [128, 256, 1, 1280, 128, 128, 1280, 1280]
    - [65, 3135.0]
  - - [448, 64, 1, 1280, 448, 448, 1280, 1280]
    - [77, 2785.0]
  - - [64, 1024, 1, 1280, 64, 64, 1280, 1280]
    - [67, 5276.0]
  - - [64, 704, 1, 1280, 64, 64, 1280, 1280]
    - [77, 4061.0]
  - - [128, 448, 1, 256, 128, 128, 256, 256]
    - [88, 3462.0]
  - - [256, 256, 1, 3328, 256, 256, 3328, 3328]
    - [67, 5538.0]
  - - [64, 448, 1, 1280, 64, 64, 1280, 1280]
    - [77, 2751.0]
  - - [64, 64, 1, 3328, 64, 64, 3328, 3328]
    - [96, 485.0]
  - - [704, 64, 1, 3328, 704, 704, 3328, 3328]
    - [87, 4423.0]
  - - [64, 128, 1, 256, 64, 64, 256, 256]
    - [82, 552.0]
  - - [128, 448, 1, 1280, 128, 128, 1280, 1280]
    - [67, 4772.0]
  - - [704, 64, 1, 1280, 704, 704, 1280, 1280]
    - [77, 4050.0]
  - - [448, 64, 1, 3328, 448, 448, 3328, 3328]
    - [87, 3006.0]
  - - [128, 64, 1, 1280, 128, 128, 1280, 1280]
    - [72, 869.0]
  - - [64, 128, 1, 3328, 64, 64, 3328, 3328]
    - [96, 968.0]
  - - [128, 128, 1, 3328, 128, 128, 3328, 3328]
    - [65, 1832.0]
  - - [256, 128, 1, 256, 256, 256, 256, 256]
    - [61, 2108.0]
  - - [256, 256, 1, 256, 256, 256, 256, 256]
    - [67, 3957.0]
  - - [256, 64, 1, 256, 256, 256, 256, 256]
    - [77, 1087.0]
  - - [64, 1024, 1, 256, 64, 64, 256, 256]
    - [67, 3902.0]
  - - [64, 704, 1, 256, 64, 64, 256, 256]
    - [67, 2813.0]
  - - [448, 128, 1, 256, 448, 448, 256, 256]
    - [67, 3462.0]
  - - [64, 704, 1, 3328, 64, 64, 3328, 3328]
    - [65, 4428.0]
  - - [64, 448, 1, 3328, 64, 64, 3328, 3328]
    - [65, 3012.0]
  - - [448, 128, 1, 3328, 448, 448, 3328, 3328]
    - [84, 4883.0]
  - - [64, 256, 1, 1280, 64, 64, 1280, 1280]
    - [65, 1678.0]
  - - [64, 64, 1, 256, 64, 64, 256, 256]
    - [72, 277.0]
  - - [64, 448, 1, 256, 64, 64, 256, 256]
    - [61, 1844.0]
  - - [256, 128, 1, 1280, 256, 256, 1280, 1280]
    - [65, 3125.0]
  - - [128, 256, 1, 3328, 128, 128, 3328, 3328]
    - [65, 3404.0]
  - - [64, 128, 1, 1280, 64, 64, 1280, 1280]
    - [72, 868.0]
  - - [128, 128, 1, 1280, 128, 128, 1280, 1280]
    - [87, 1683.0]
  - - [128, 256, 1, 256, 128, 128, 256, 256]
    - [61, 2118.0]
  - - [256, 64, 1, 1280, 256, 256, 1280, 1280]
    - [77, 1686.0]
  - - [704, 64, 1, 256, 704, 704, 256, 256]
    - [67, 2773.0]
  - - [64, 64, 1, 1280, 64, 64, 1280, 1280]
    - [72, 435.0]
  - - [128, 64, 1, 3328, 128, 128, 3328, 3328]
    - [78, 968.0]
  - - [448, 64, 1, 256, 448, 448, 256, 256]
    - [77, 1854.0]
  - - [1024, 64, 1, 256, 1024, 1024, 256, 256]
    - [67, 3848.0]
  - - [128, 64, 1, 256, 128, 128, 256, 256]
    - [72, 552.0]
  - - [1024, 64, 1, 1280, 1024, 1024, 1280, 1280]
    - [67, 5172.0]
  - - [64, 1024, 1, 3328, 64, 64, 3328, 3328]
    - [67, 5633.0]
  - - [448, 128, 1, 1280, 448, 448, 1280, 1280]
    - [91, 4313.0]
  - - [1024, 64, 1, 3328, 1024, 1024, 3328, 3328]
    - [67, 5636.0]
  - - [64, 256, 1, 3328, 64, 64, 3328, 3328]
    - [65, 1835.0]
  - - [256, 256, 1, 1280, 256, 256, 1280, 1280]
    - [67, 5377.0]
  - - [256, 128, 1, 3328, 256, 256, 3328, 3328]
    - [65, 3408.0]
  - - [64, 256, 1, 256, 64, 64, 256, 256]
    - [69, 1087.0]
  - - [128, 448, 1, 3328, 128, 128, 3328, 3328]
    - [67, 5114.0]
  - - [256, 64, 1, 3328, 256, 256, 3328, 3328]
    - [77, 1833.0]
  - - [128, 128, 1, 256, 128, 128, 256, 256]
    - [77, 1092.0]
  - - [512, 128, 1, 784, 512, 512, 784, 784]
    - [61, 4688.0]
  - - [256, 64, 1, 3136, 256, 256, 3136, 3136]
    - [65, 1835.0]
  - - [64, 256, 1, 3136, 64, 64, 3136, 3136]
    - [65, 1834.0]
  - - [128, 512, 1, 784, 128, 128, 784, 784]
    - [61, 4688.0]
  - - [64, 64, 1, 3136, 64, 64, 3136, 3136]
    - [66, 485.0]
- null
