library/src/blas3/Tensile/Logic/asm_full/navi21_Cijk_Ailk_Bljk_HB.yaml
- {MinimumRequiredVersion: 4.26.0}
- navi21
- gfx1030
- [Device 73a2]
    SolutionIndex: 0
    SolutionNameMin: Cijk_Ailk_Bljk_HB_MT128x64x8_SN_SU0_SUM0_TT8_8_WG16_8_1_WGM1
    SolutionIndex: 1
    SolutionNameMin: Cijk_Ailk_Bljk_HB_MT128x128x8_SN_SU0_SUM0_TT8_16_WG16_8_1_WGM1
    SolutionIndex: 2
    SolutionNameMin: Cijk_Ailk_Bljk_HB_MT256x128x8_SN_SU0_SUM0_TT16_16_WG16_8_1_WGM1
    SolutionIndex: 3
    SolutionNameMin: Cijk_Ailk_Bljk_HB_MT128x64x16_SN_SU0_SUM0_TT8_8_WG16_8_1_WGM1
    SolutionIndex: 4
    SolutionNameMin: Cijk_Ailk_Bljk_HB_MT128x128x16_SN_SU0_SUM0_TT8_16_WG16_8_1_WGM1
    SolutionIndex: 5
    SolutionNameMin: Cijk_Ailk_Bljk_HB_MT256x128x16_SN_SU0_SUM0_TT16_16_WG16_8_1_WGM1
    SolutionIndex: 6
    SolutionNameMin: Cijk_Ailk_Bljk_HB_MT128x128x16_SN_SU0_SUM0_TT8_8_WG16_16_1_WGM1
    SolutionIndex: 7
    SolutionNameMin: Cijk_Ailk_Bljk_HB_MT128x256x16_SN_SU0_SUM0_TT8_16_WG16_16_1_WGM1
    SolutionIndex: 8
    SolutionNameMin: Cijk_Ailk_Bljk_HB_MT128x64x16_SN_SU32_SUM3_TT8_8_WG16_8_1_WGM1
    SolutionIndex: 9
    SolutionNameMin: Cijk_Ailk_Bljk_HB_MT128x128x16_SN_SU32_SUM3_TT8_16_WG16_8_1_WGM1
    SolutionIndex: 10
    SolutionNameMin: Cijk_Ailk_Bljk_HB_MT256x128x16_SN_SU32_SUM3_TT16_16_WG16_8_1_WGM1
    SolutionIndex: 11
    SolutionNameMin: Cijk_Ailk_Bljk_HB_MT128x128x16_SN_SU32_SUM3_TT8_8_WG16_16_1_WGM1
    SolutionIndex: 12
    SolutionNameMin: Cijk_Ailk_Bljk_HB_MT128x256x16_SN_SU32_SUM3_TT8_16_WG16_16_1_WGM1
    SolutionIndex: 13
    SolutionNameMin: Cijk_Ailk_Bljk_HB_MT128x64x8_SN_SU0_SUM0_TT8_8_WG16_8_1_WGM4
    SolutionIndex: 14
    SolutionNameMin: Cijk_Ailk_Bljk_HB_MT256x128x8_SN_SU0_SUM0_TT16_16_WG16_8_1_WGM4
    SolutionIndex: 15
    SolutionNameMin: Cijk_Ailk_Bljk_HB_MT128x64x16_SN_SU0_SUM0_TT8_8_WG16_8_1_WGM4
    SolutionIndex: 16
    SolutionNameMin: Cijk_Ailk_Bljk_HB_MT128x128x16_SN_SU0_SUM0_TT8_16_WG16_8_1_WGM4
    SolutionIndex: 17
    SolutionNameMin: Cijk_Ailk_Bljk_HB_MT256x128x16_SN_SU0_SUM0_TT16_16_WG16_8_1_WGM4
    SolutionIndex: 18
    SolutionNameMin: Cijk_Ailk_Bljk_HB_MT128x128x16_SN_SU0_SUM0_TT8_8_WG16_16_1_WGM4
    SolutionIndex: 19
    SolutionNameMin: Cijk_Ailk_Bljk_HB_MT128x256x16_SN_SU0_SUM0_TT8_16_WG16_16_1_WGM4
    SolutionIndex: 20
    SolutionNameMin: Cijk_Ailk_Bljk_HB_MT128x128x32_SN_SU0_SUM0_TT8_16_WG16_8_1_WGM4
    SolutionIndex: 21
    SolutionNameMin: Cijk_Ailk_Bljk_HB_MT128x64x8_SN_SU32_SUM3_TT8_8_WG16_8_1_WGM4
    SolutionIndex: 22
    SolutionNameMin: Cijk_Ailk_Bljk_HB_MT128x64x16_SN_SU32_SUM3_TT8_8_WG16_8_1_WGM4
    SolutionIndex: 23
    SolutionNameMin: Cijk_Ailk_Bljk_HB_MT128x128x16_SN_SU32_SUM3_TT8_16_WG16_8_1_WGM4
    SolutionIndex: 24
    SolutionNameMin: Cijk_Ailk_Bljk_HB_MT256x128x16_SN_SU32_SUM3_TT16_16_WG16_8_1_WGM4
    SolutionIndex: 25
    SolutionNameMin: Cijk_Ailk_Bljk_HB_MT128x128x16_SN_SU32_SUM3_TT8_8_WG16_16_1_WGM4
    SolutionIndex: 26
    SolutionNameMin: Cijk_Ailk_Bljk_HB_MT128x256x16_SN_SU32_SUM3_TT8_16_WG16_16_1_WGM4
    SolutionIndex: 27
    SolutionNameMin: Cijk_Ailk_Bljk_HB_MT128x64x8_SN_SU0_SUM0_TT8_8_WG16_8_1_WGM8
    SolutionIndex: 28
    SolutionNameMin: Cijk_Ailk_Bljk_HB_MT128x128x8_SN_SU0_SUM0_TT8_16_WG16_8_1_WGM8
    SolutionIndex: 29
    SolutionNameMin: Cijk_Ailk_Bljk_HB_MT256x128x8_SN_SU0_SUM0_TT16_16_WG16_8_1_WGM8
    SolutionIndex: 30
    SolutionNameMin: Cijk_Ailk_Bljk_HB_MT128x64x16_SN_SU0_SUM0_TT8_8_WG16_8_1_WGM8
    SolutionIndex: 31
    SolutionNameMin: Cijk_Ailk_Bljk_HB_MT128x128x16_SN_SU0_SUM0_TT8_16_WG16_8_1_WGM8
    SolutionIndex: 32
    SolutionNameMin: Cijk_Ailk_Bljk_HB_MT256x128x16_SN_SU0_SUM0_TT16_16_WG16_8_1_WGM8
    SolutionIndex: 33
    SolutionNameMin: Cijk_Ailk_Bljk_HB_MT128x128x16_SN_SU0_SUM0_TT8_8_WG16_16_1_WGM8
    SolutionIndex: 34
    SolutionNameMin: Cijk_Ailk_Bljk_HB_MT128x256x16_SN_SU0_SUM0_TT8_16_WG16_16_1_WGM8
    SolutionIndex: 35
    SolutionNameMin: Cijk_Ailk_Bljk_HB_MT128x128x32_SN_SU0_SUM0_TT8_8_WG16_16_1_WGM8
    SolutionIndex: 36
    SolutionNameMin: Cijk_Ailk_Bljk_HB_MT128x64x8_SN_SU32_SUM3_TT8_8_WG16_8_1_WGM8
    SolutionIndex: 37
    SolutionNameMin: Cijk_Ailk_Bljk_HB_MT128x128x8_SN_SU32_SUM3_TT8_16_WG16_8_1_WGM8
    SolutionIndex: 38
    SolutionNameMin: Cijk_Ailk_Bljk_HB_MT128x64x16_SN_SU32_SUM3_TT8_8_WG16_8_1_WGM8
    SolutionIndex: 39
    SolutionNameMin: Cijk_Ailk_Bljk_HB_MT128x128x16_SN_SU32_SUM3_TT8_16_WG16_8_1_WGM8
    SolutionIndex: 40
    SolutionNameMin: Cijk_Ailk_Bljk_HB_MT256x128x16_SN_SU32_SUM3_TT16_16_WG16_8_1_WGM8
    SolutionIndex: 41
    SolutionNameMin: Cijk_Ailk_Bljk_HB_MT128x128x16_SN_SU32_SUM3_TT8_8_WG16_16_1_WGM8
    SolutionIndex: 42
    SolutionNameMin: Cijk_Ailk_Bljk_HB_MT128x256x16_SN_SU32_SUM3_TT8_16_WG16_16_1_WGM8
    SolutionIndex: 43
    SolutionNameMin: Cijk_Ailk_Bljk_HB_MT64x64x8_SN_SU0_SUM0_TT8_8_WG8_8_1_WGM1
    SolutionIndex: 44
    SolutionNameMin: Cijk_Ailk_Bljk_HB_MT128x64x8_SN_SU0_SUM0_TT8_8_WG16_8_1_WGM1
    SolutionIndex: 45
    SolutionNameMin: Cijk_Ailk_Bljk_HB_MT64x64x16_SN_SU0_SUM0_TT8_8_WG8_8_1_WGM1
    SolutionIndex: 46
    SolutionNameMin: Cijk_Ailk_Bljk_HB_MT128x64x16_SN_SU0_SUM0_TT8_8_WG16_8_1_WGM1
    SolutionIndex: 47
    SolutionNameMin: Cijk_Ailk_Bljk_HB_MT128x128x16_SN_SU0_SUM0_TT8_8_WG16_16_1_WGM1
    SolutionIndex: 48
    SolutionNameMin: Cijk_Ailk_Bljk_HB_MT128x64x32_SN_SU0_SUM0_TT8_8_WG16_8_1_WGM1
    SolutionIndex: 49
    SolutionNameMin: Cijk_Ailk_Bljk_HB_MT64x64x8_SN_SU32_SUM3_TT8_8_WG8_8_1_WGM1
    SolutionIndex: 50
    SolutionNameMin: Cijk_Ailk_Bljk_HB_MT128x64x8_SN_SU32_SUM3_TT8_8_WG16_8_1_WGM1
    SolutionIndex: 51
    SolutionNameMin: Cijk_Ailk_Bljk_HB_MT64x64x16_SN_SU32_SUM3_TT8_8_WG8_8_1_WGM1
    SolutionIndex: 52
    SolutionNameMin: Cijk_Ailk_Bljk_HB_MT128x64x16_SN_SU32_SUM3_TT8_8_WG16_8_1_WGM1
    SolutionIndex: 53
    SolutionNameMin: Cijk_Ailk_Bljk_HB_MT128x128x16_SN_SU32_SUM3_TT8_8_WG16_16_1_WGM1
    SolutionIndex: 54
    SolutionNameMin: Cijk_Ailk_Bljk_HB_MT64x64x32_SN_SU32_SUM3_TT8_8_WG8_8_1_WGM1
    SolutionIndex: 55
    SolutionNameMin: Cijk_Ailk_Bljk_HB_MT64x64x8_SN_SU0_SUM0_TT8_8_WG8_8_1_WGM4
    SolutionIndex: 56
    SolutionNameMin: Cijk_Ailk_Bljk_HB_MT128x64x8_SN_SU0_SUM0_TT8_8_WG16_8_1_WGM4
    SolutionIndex: 57
    SolutionNameMin: Cijk_Ailk_Bljk_HB_MT64x64x16_SN_SU0_SUM0_TT8_8_WG8_8_1_WGM4
    SolutionIndex: 58
    SolutionNameMin: Cijk_Ailk_Bljk_HB_MT128x64x16_SN_SU0_SUM0_TT8_8_WG16_8_1_WGM4
    SolutionIndex: 59
    SolutionNameMin: Cijk_Ailk_Bljk_HB_MT128x128x16_SN_SU0_SUM0_TT8_8_WG16_16_1_WGM4
    SolutionIndex: 60
    SolutionNameMin: Cijk_Ailk_Bljk_HB_MT64x64x8_SN_SU32_SUM3_TT8_8_WG8_8_1_WGM4
    SolutionIndex: 61
    SolutionNameMin: Cijk_Ailk_Bljk_HB_MT128x64x8_SN_SU32_SUM3_TT8_8_WG16_8_1_WGM4
    SolutionIndex: 62
    SolutionNameMin: Cijk_Ailk_Bljk_HB_MT64x64x16_SN_SU32_SUM3_TT8_8_WG8_8_1_WGM4
    SolutionIndex: 63
    SolutionNameMin: Cijk_Ailk_Bljk_HB_MT128x64x16_SN_SU32_SUM3_TT8_8_WG16_8_1_WGM4
    SolutionIndex: 64
    SolutionNameMin: Cijk_Ailk_Bljk_HB_MT128x128x16_SN_SU32_SUM3_TT8_8_WG16_16_1_WGM4
    SolutionIndex: 65
    SolutionNameMin: Cijk_Ailk_Bljk_HB_MT128x64x8_SN_SU0_SUM0_TT8_8_WG16_8_1_WGM8
    SolutionIndex: 66
    SolutionNameMin: Cijk_Ailk_Bljk_HB_MT128x64x16_SN_SU0_SUM0_TT8_8_WG16_8_1_WGM8
    SolutionIndex: 67
    SolutionNameMin: Cijk_Ailk_Bljk_HB_MT128x128x16_SN_SU0_SUM0_TT8_8_WG16_16_1_WGM8
    SolutionIndex: 68
    SolutionNameMin: Cijk_Ailk_Bljk_HB_MT128x64x8_SN_SU32_SUM3_TT8_8_WG16_8_1_WGM8
    SolutionIndex: 69
    SolutionNameMin: Cijk_Ailk_Bljk_HB_MT64x64x16_SN_SU32_SUM3_TT8_8_WG8_8_1_WGM8
    SolutionIndex: 70
    SolutionNameMin: Cijk_Ailk_Bljk_HB_MT128x64x16_SN_SU32_SUM3_TT8_8_WG16_8_1_WGM8
    SolutionIndex: 71
    SolutionNameMin: Cijk_Ailk_Bljk_HB_MT128x128x16_SN_SU32_SUM3_TT8_8_WG16_16_1_WGM8
    SolutionIndex: 72
    SolutionNameMin: Cijk_Ailk_Bljk_HB_MT32x16x8_SN_SU0_SUM0_TT2_2_WG16_8_1_WGM1
    SolutionIndex: 73
    SolutionNameMin: Cijk_Ailk_Bljk_HB_MT64x32x8_SN_SU0_SUM0_TT4_4_WG16_8_1_WGM1
    SolutionIndex: 74
    SolutionNameMin: Cijk_Ailk_Bljk_HB_MT64x64x8_SN_SU0_SUM0_TT4_4_WG16_16_1_WGM1
    SolutionIndex: 75
    SolutionNameMin: Cijk_Ailk_Bljk_HB_MT16x16x16_SN_SU0_SUM0_TT2_2_WG8_8_1_WGM1
    SolutionIndex: 76
    SolutionNameMin: Cijk_Ailk_Bljk_HB_MT32x16x16_SN_SU0_SUM0_TT2_2_WG16_8_1_WGM1
    SolutionIndex: 77
    SolutionNameMin: Cijk_Ailk_Bljk_HB_MT64x32x16_SN_SU0_SUM0_TT4_4_WG16_8_1_WGM1
    SolutionIndex: 78
    SolutionNameMin: Cijk_Ailk_Bljk_HB_MT16x16x32_SN_SU0_SUM0_TT2_2_WG8_8_1_WGM1
    SolutionIndex: 79
    SolutionNameMin: Cijk_Ailk_Bljk_HB_MT32x16x32_SN_SU0_SUM0_TT2_2_WG16_8_1_WGM1
    SolutionIndex: 80
    SolutionNameMin: Cijk_Ailk_Bljk_HB_MT32x16x8_SN_SU32_SUM3_TT2_2_WG16_8_1_WGM1
    SolutionIndex: 81
    SolutionNameMin: Cijk_Ailk_Bljk_HB_MT64x32x8_SN_SU32_SUM3_TT4_4_WG16_8_1_WGM1
    SolutionIndex: 82
    SolutionNameMin: Cijk_Ailk_Bljk_HB_MT64x64x8_SN_SU32_SUM3_TT4_4_WG16_16_1_WGM1
    SolutionIndex: 83
    SolutionNameMin: Cijk_Ailk_Bljk_HB_MT32x16x16_SN_SU32_SUM3_TT2_2_WG16_8_1_WGM1
    SolutionIndex: 84
    SolutionNameMin: Cijk_Ailk_Bljk_HB_MT64x32x8_SN_SU0_SUM0_TT4_4_WG16_8_1_WGM4
    SolutionIndex: 85
    SolutionNameMin: Cijk_Ailk_Bljk_HB_MT64x64x8_SN_SU0_SUM0_TT4_4_WG16_16_1_WGM4
    SolutionIndex: 86
    SolutionNameMin: Cijk_Ailk_Bljk_HB_MT32x16x16_SN_SU0_SUM0_TT2_2_WG16_8_1_WGM4
    SolutionIndex: 87
    SolutionNameMin: Cijk_Ailk_Bljk_HB_MT64x32x16_SN_SU0_SUM0_TT4_4_WG16_8_1_WGM4
    SolutionIndex: 88
    SolutionNameMin: Cijk_Ailk_Bljk_HB_MT32x16x32_SN_SU0_SUM0_TT2_2_WG16_8_1_WGM4
    SolutionIndex: 89
    SolutionNameMin: Cijk_Ailk_Bljk_HB_MT32x16x8_SN_SU32_SUM3_TT2_2_WG16_8_1_WGM4
    SolutionIndex: 90
    SolutionNameMin: Cijk_Ailk_Bljk_HB_MT64x32x8_SN_SU32_SUM3_TT4_4_WG16_8_1_WGM4
    SolutionIndex: 91
    SolutionNameMin: Cijk_Ailk_Bljk_HB_MT64x64x8_SN_SU32_SUM3_TT4_4_WG16_16_1_WGM4
    SolutionIndex: 92
    SolutionNameMin: Cijk_Ailk_Bljk_HB_MT64x32x8_SN_SU0_SUM0_TT4_4_WG16_8_1_WGM8
    SolutionIndex: 93
    SolutionNameMin: Cijk_Ailk_Bljk_HB_MT64x64x8_SN_SU0_SUM0_TT4_4_WG16_16_1_WGM8
    SolutionIndex: 94
    SolutionNameMin: Cijk_Ailk_Bljk_HB_MT32x16x16_SN_SU0_SUM0_TT2_2_WG16_8_1_WGM8
    SolutionIndex: 95
    SolutionNameMin: Cijk_Ailk_Bljk_HB_MT64x32x16_SN_SU0_SUM0_TT4_4_WG16_8_1_WGM8
    SolutionIndex: 96
    SolutionNameMin: Cijk_Ailk_Bljk_HB_MT64x32x8_SN_SU32_SUM3_TT4_4_WG16_8_1_WGM8
    SolutionIndex: 97
    SolutionNameMin: Cijk_Ailk_Bljk_HB_MT64x64x8_SN_SU32_SUM3_TT4_4_WG16_16_1_WGM8
    SolutionIndex: 98
    SolutionNameMin: Cijk_Ailk_Bljk_HB_MT32x16x16_SN_SU32_SUM3_TT2_2_WG16_8_1_WGM8
    SolutionIndex: 99
    SolutionNameMin: Cijk_Ailk_Bljk_HB_MT64x8x32_SN_SU0_SUM0_TT2_2_WG32_4_1_WGM1
    SolutionIndex: 100
    SolutionNameMin: Cijk_Ailk_Bljk_HB_MT128x8x32_SN_SU0_SUM0_TT4_2_WG32_4_1_WGM1
    SolutionIndex: 101
    SolutionNameMin: Cijk_Ailk_Bljk_HB_MT64x8x32_SN_SU0_SUM0_TT2_2_WG32_4_1_WGM4
    SolutionIndex: 102
    SolutionNameMin: Cijk_Ailk_Bljk_HB_MT64x8x32_SN_SU0_SUM0_TT2_2_WG32_4_1_WGM8
    SolutionIndex: 103
    SolutionNameMin: Cijk_Ailk_Bljk_HB_MT128x8x32_SN_SU0_SUM0_TT4_2_WG32_4_1_WGM8
- - - [2944, 4288, 1, 1280, 2944, 2944, 2944, 1280]
    - [16, 39369.0]
  - - [2368, 5888, 1, 256, 2368, 2368, 2368, 256]
    - [9, 37383.0]
  - - [512, 24000, 1, 1536, 512, 512, 512, 1536]
    - [23, 40158.0]
  - - [5888, 1856, 1, 3328, 5888, 5888, 5888, 3328]
    - [4, 38104.0]
  - - [5888, 2944, 1, 3328, 5888, 5888, 5888, 3328]
    - [31, 40622.0]
  - - [1856, 4288, 1, 256, 1856, 1856, 1856, 256]
    - [30, 33911.0]
  - - [5056, 5056, 1, 3328, 5056, 5056, 5056, 3328]
    - [4, 40119.0]
  - - [1408, 5888, 1, 1280, 1408, 1408, 1408, 1280]
    - [31, 37993.0]
  - - [6144, 6000, 1, 2560, 6144, 6144, 6144, 2560]
    - [23, 41349.0]
  - - [1024, 3584, 1, 3328, 1024, 1024, 1024, 3328]
    - [31, 34952.0]
  - - [512, 48000, 1, 2048, 512, 512, 512, 2048]
    - [10, 40809.0]
  - - [448, 3584, 1, 3328, 448, 448, 448, 3328]
    - [3, 27028.0]
  - - [5888, 1408, 1, 1280, 5888, 5888, 5888, 1280]
    - [4, 38051.0]
  - - [1024, 2368, 1, 256, 1024, 1024, 1024, 256]
    - [30, 30192.0]
  - - [5056, 6784, 1, 1280, 5056, 5056, 5056, 1280]
    - [16, 40994.0]
  - - [5056, 5056, 1, 1280, 5056, 5056, 5056, 1280]
    - [16, 39915.0]
  - - [4288, 6784, 1, 256, 4288, 4288, 4288, 256]
    - [4, 39377.0]
  - - [6784, 448, 1, 256, 6784, 6784, 6784, 256]
    - [3, 31347.0]
  - - [5056, 256, 1, 1280, 5056, 5056, 5056, 1280]
    - [3, 28195.0]
  - - [5888, 704, 1, 1280, 5888, 5888, 5888, 1280]
    - [31, 34165.0]
  - - [3584, 1024, 1, 256, 3584, 3584, 3584, 256]
    - [3, 32442.0]
  - - [6784, 4288, 1, 3328, 6784, 6784, 6784, 3328]
    - [4, 40363.0]
  - - [1856, 2368, 1, 3328, 1856, 1856, 1856, 3328]
    - [4, 36609.0]
  - - [5888, 2944, 1, 1280, 5888, 5888, 5888, 1280]
    - [4, 40427.0]
  - - [5888, 1024, 1, 256, 5888, 5888, 5888, 256]
    - [4, 35434.0]
  - - [1408, 2944, 1, 256, 1408, 1408, 1408, 256]
    - [4, 32792.0]
  - - [6784, 5056, 1, 3328, 6784, 6784, 6784, 3328]
    - [31, 41130.0]
  - - [5056, 5056, 1, 256, 5056, 5056, 5056, 256]
    - [23, 38109.0]
  - - [1024, 3584, 1, 1280, 1024, 1024, 1024, 1280]
    - [31, 34628.0]
  - - [2368, 2944, 1, 1280, 2368, 2368, 2368, 1280]
    - [31, 36256.0]
  - - [6784, 6784, 1, 1280, 6784, 6784, 6784, 1280]
    - [4, 41282.0]
  - - [1408, 4288, 1, 1280, 1408, 1408, 1408, 1280]
    - [31, 36713.0]
  - - [3584, 4288, 1, 1280, 3584, 3584, 3584, 1280]
    - [31, 39539.0]
  - - [512, 6000, 1, 2560, 512, 512, 512, 2560]
    - [42, 33718.0]
  - - [2368, 704, 1, 1280, 2368, 2368, 2368, 1280]
    - [3, 31188.0]
  - - [5056, 4288, 1, 3328, 5056, 5056, 5056, 3328]
    - [19, 40201.0]
  - - [3584, 2368, 1, 3328, 3584, 3584, 3584, 3328]
    - [31, 38990.0]
  - - [5888, 6784, 1, 1280, 5888, 5888, 5888, 1280]
    - [2, 41654.0]
  - - [6784, 448, 1, 1280, 6784, 6784, 6784, 1280]
    - [3, 33024.0]
  - - [2944, 5888, 1, 256, 2944, 2944, 2944, 256]
    - [4, 39438.0]
  - - [4288, 2944, 1, 256, 4288, 4288, 4288, 256]
    - [4, 37754.0]
  - - [6144, 24000, 1, 2560, 6144, 6144, 6144, 2560]
    - [17, 41960.0]
  - - [5056, 2368, 1, 1280, 5056, 5056, 5056, 1280]
    - [4, 37587.0]
  - - [448, 3584, 1, 1280, 448, 448, 448, 1280]
    - [3, 26719.0]
  - - [6784, 5888, 1, 256, 6784, 6784, 6784, 256]
    - [4, 40857.0]
  - - [1024, 1408, 1, 256, 1024, 1024, 1024, 256]
    - [27, 27669.0]
  - - [2368, 2368, 1, 3328, 2368, 2368, 2368, 3328]
    - [4, 34870.0]
  - - [5056, 704, 1, 3328, 5056, 5056, 5056, 3328]
    - [16, 33739.0]
  - - [1408, 1856, 1, 256, 1408, 1408, 1408, 256]
    - [30, 32381.0]
  - - [5888, 1856, 1, 256, 5888, 5888, 5888, 256]
    - [4, 36070.0]
  - - [704, 5888, 1, 256, 704, 704, 704, 256]
    - [4, 30669.0]
  - - [3584, 704, 1, 3328, 3584, 3584, 3584, 3328]
    - [30, 33731.0]
  - - [1408, 1408, 1, 256, 1408, 1408, 1408, 256]
    - [3, 30209.0]
  - - [448, 4288, 1, 256, 448, 448, 448, 256]
    - [3, 25323.0]
  - - [704, 2368, 1, 1280, 704, 704, 704, 1280]
    - [3, 27698.0]
  - - [1856, 2368, 1, 1280, 1856, 1856, 1856, 1280]
    - [4, 36075.0]
  - - [1408, 1408, 1, 3328, 1408, 1408, 1408, 3328]
    - [30, 33559.0]
  - - [256, 193600, 1, 64, 256, 256, 256, 64]
    - [27, 35003.0]
  - - [1408, 1024, 1, 1280, 1408, 1408, 1408, 1280]
    - [27, 31841.0]
  - - [704, 6784, 1, 256, 704, 704, 704, 256]
    - [3, 30750.0]
  - - [6784, 704, 1, 256, 6784, 6784, 6784, 256]
    - [30, 33134.0]
  - - [2048, 7000, 1, 2048, 2048, 2048, 2048, 2048]
    - [23, 39822.0]
  - - [5056, 704, 1, 256, 5056, 5056, 5056, 256]
    - [3, 31142.0]
  - - [1408, 3584, 1, 256, 1408, 1408, 1408, 256]
    - [39, 35028.0]
  - - [3584, 4288, 1, 3328, 3584, 3584, 3584, 3328]
    - [31, 39869.0]
  - - [5888, 1856, 1, 1280, 5888, 5888, 5888, 1280]
    - [4, 37793.0]
  - - [2368, 3584, 1, 1280, 2368, 2368, 2368, 1280]
    - [4, 38563.0]
  - - [2944, 3584, 1, 3328, 2944, 2944, 2944, 3328]
    - [19, 40958.0]
  - - [6784, 2944, 1, 256, 6784, 6784, 6784, 256]
    - [4, 40202.0]
  - - [1024, 1500, 1, 2560, 1024, 1024, 1024, 2560]
    - [39, 29925.0]
  - - [1856, 2368, 1, 256, 1856, 1856, 1856, 256]
    - [4, 31801.0]
  - - [3584, 6784, 1, 3328, 3584, 3584, 3584, 3328]
    - [2, 40932.0]
  - - [5056, 4288, 1, 1280, 5056, 5056, 5056, 1280]
    - [31, 39944.0]
  - - [6784, 1856, 1, 3328, 6784, 6784, 6784, 3328]
    - [4, 38304.0]
  - - [1408, 5056, 1, 1280, 1408, 1408, 1408, 1280]
    - [31, 37247.0]
  - - [196, 1024, 64, 256, 196, 196, 196, 256]
    - [4, 27759.0]
  - - [6784, 5888, 1, 3328, 6784, 6784, 6784, 3328]
    - [7, 41690.0]
  - - [2368, 5056, 1, 1280, 2368, 2368, 2368, 1280]
    - [34, 37528.0]
  - - [1024, 5056, 1, 1280, 1024, 1024, 1024, 1280]
    - [39, 37555.0]
  - - [4288, 1024, 1, 256, 4288, 4288, 4288, 256]
    - [9, 32080.0]
  - - [2368, 1408, 1, 256, 2368, 2368, 2368, 256]
    - [3, 31173.0]
  - - [5888, 448, 1, 1280, 5888, 5888, 5888, 1280]
    - [27, 31602.0]
  - - [704, 5888, 1, 3328, 704, 704, 704, 3328]
    - [7, 35350.0]
  - - [1024, 6784, 1, 1280, 1024, 1024, 1024, 1280]
    - [4, 39380.0]
  - - [3584, 2944, 1, 1280, 3584, 3584, 3584, 1280]
    - [4, 40487.0]
  - - [512, 6000, 1, 2816, 512, 512, 512, 2816]
    - [19, 33932.0]
  - - [512, 24000, 1, 2048, 512, 512, 512, 2048]
    - [39, 40107.0]
  - - [1408, 5056, 1, 3328, 1408, 1408, 1408, 3328]
    - [23, 37566.0]
  - - [1856, 1856, 1, 3328, 1856, 1856, 1856, 3328]
    - [16, 32751.0]
  - - [2368, 2368, 1, 256, 2368, 2368, 2368, 256]
    - [15, 32909.0]
  - - [4288, 4288, 1, 1280, 4288, 4288, 4288, 1280]
    - [4, 38977.0]
  - - [5888, 1024, 1, 1280, 5888, 5888, 5888, 1280]
    - [4, 37293.0]
  - - [1024, 12544, 1, 256, 1024, 1024, 1024, 256]
    - [4, 39017.0]
  - - [512, 48000, 1, 2560, 512, 512, 512, 2560]
    - [40, 41072.0]
  - - [704, 6784, 1, 3328, 704, 704, 704, 3328]
    - [4, 35515.0]
  - - [5888, 5888, 1, 3328, 5888, 5888, 5888, 3328]
    - [31, 41607.0]
  - - [5056, 1024, 1, 1280, 5056, 5056, 5056, 1280]
    - [4, 37415.0]
  - - [448, 5888, 1, 3328, 448, 448, 448, 3328]
    - [12, 29405.0]
  - - [1024, 2944, 1, 1280, 1024, 1024, 1024, 1280]
    - [15, 32863.0]
  - - [5056, 5888, 1, 1280, 5056, 5056, 5056, 1280]
    - [4, 40326.0]
  - - [448, 6784, 1, 256, 448, 448, 448, 256]
    - [18, 28230.0]
  - - [3584, 5888, 1, 256, 3584, 3584, 3584, 256]
    - [4, 40005.0]
  - - [2944, 3584, 1, 256, 2944, 2944, 2944, 256]
    - [4, 39033.0]
  - - [3072, 1500, 1, 1024, 3072, 3072, 3072, 1024]
    - [39, 37154.0]
  - - [6784, 1024, 1, 3328, 6784, 6784, 6784, 3328]
    - [7, 39990.0]
  - - [6784, 2944, 1, 3328, 6784, 6784, 6784, 3328]
    - [4, 41371.0]
  - - [6784, 2368, 1, 1280, 6784, 6784, 6784, 1280]
    - [16, 39855.0]
  - - [4288, 3584, 1, 256, 4288, 4288, 4288, 256]
    - [4, 38064.0]
  - - [4288, 5888, 1, 1280, 4288, 4288, 4288, 1280]
    - [19, 40326.0]
  - - [1024, 6000, 1, 1536, 1024, 1024, 1024, 1536]
    - [23, 37384.0]
  - - [4288, 1856, 1, 1280, 4288, 4288, 4288, 1280]
    - [4, 36209.0]
  - - [1856, 2944, 1, 3328, 1856, 1856, 1856, 3328]
    - [19, 37344.0]
  - - [256, 6784, 1, 3328, 256, 256, 256, 3328]
    - [41, 34420.0]
  - - [512, 3000, 1, 1536, 512, 512, 512, 1536]
    - [33, 29286.0]
  - - [5056, 1024, 1, 256, 5056, 5056, 5056, 256]
    - [6, 33691.0]
  - - [5056, 1856, 1, 3328, 5056, 5056, 5056, 3328]
    - [4, 38214.0]
  - - [4096, 7000, 1, 4096, 4096, 4096, 4096, 4096]
    - [9, 41221.0]
  - - [5056, 256, 1, 3328, 5056, 5056, 5056, 3328]
    - [8, 29089.0]
  - - [1024, 5888, 1, 1280, 1024, 1024, 1024, 1280]
    - [31, 37118.0]
  - - [5056, 3584, 1, 256, 5056, 5056, 5056, 256]
    - [7, 38408.0]
  - - [1856, 1024, 1, 1280, 1856, 1856, 1856, 1280]
    - [3, 31164.0]
  - - [1856, 1856, 1, 1280, 1856, 1856, 1856, 1280]
    - [4, 31993.0]
  - - [3072, 24000, 1, 1024, 3072, 3072, 3072, 1024]
    - [40, 41315.0]
  - - [1856, 1024, 1, 3328, 1856, 1856, 1856, 3328]
    - [3, 31883.0]
  - - [6784, 1024, 1, 256, 6784, 6784, 6784, 256]
    - [39, 37361.0]
  - - [5056, 5888, 1, 3328, 5056, 5056, 5056, 3328]
    - [19, 40557.0]
  - - [1856, 1024, 1, 256, 1856, 1856, 1856, 256]
    - [3, 25990.0]
  - - [512, 48000, 1, 1536, 512, 512, 512, 1536]
    - [39, 40900.0]
  - - [5056, 1408, 1, 3328, 5056, 5056, 5056, 3328]
    - [4, 37501.0]
  - - [448, 5888, 1, 256, 448, 448, 448, 256]
    - [15, 26255.0]
  - - [1408, 6784, 1, 3328, 1408, 1408, 1408, 3328]
    - [4, 39054.0]
  - - [1024, 24000, 1, 2560, 1024, 1024, 1024, 2560]
    - [23, 40882.0]
  - - [2944, 1408, 1, 3328, 2944, 2944, 2944, 3328]
    - [34, 35097.0]
  - - [2944, 4288, 1, 3328, 2944, 2944, 2944, 3328]
    - [19, 40055.0]
  - - [5056, 2944, 1, 256, 5056, 5056, 5056, 256]
    - [9, 38182.0]
  - - [2368, 1856, 1, 256, 2368, 2368, 2368, 256]
    - [15, 31891.0]
  - - [1408, 3584, 1, 3328, 1408, 1408, 1408, 3328]
    - [4, 38014.0]
  - - [2368, 6784, 1, 256, 2368, 2368, 2368, 256]
    - [4, 37557.0]
  - - [4288, 2368, 1, 3328, 4288, 4288, 4288, 3328]
    - [4, 39093.0]
  - - [704, 3584, 1, 1280, 704, 704, 704, 1280]
    - [31, 31472.0]
  - - [1408, 5888, 1, 3328, 1408, 1408, 1408, 3328]
    - [4, 38331.0]
  - - [1856, 5056, 1, 256, 1856, 1856, 1856, 256]
    - [23, 35234.0]
  - - [6784, 6784, 1, 256, 6784, 6784, 6784, 256]
    - [4, 40490.0]
  - - [2368, 4288, 1, 1280, 2368, 2368, 2368, 1280]
    - [16, 38597.0]
  - - [3584, 1856, 1, 1280, 3584, 3584, 3584, 1280]
    - [31, 37288.0]
  - - [8448, 48000, 1, 2816, 8448, 8448, 8448, 2816]
    - [5, 42314.0]
  - - [512, 6000, 1, 2048, 512, 512, 512, 2048]
    - [42, 33040.0]
  - - [3584, 448, 1, 256, 3584, 3584, 3584, 256]
    - [30, 27403.0]
  - - [3584, 3584, 1, 1280, 3584, 3584, 3584, 1280]
    - [19, 40665.0]
  - - [256, 6784, 1, 256, 256, 256, 256, 256]
    - [3, 29443.0]
  - - [1856, 3584, 1, 3328, 1856, 1856, 1856, 3328]
    - [34, 38188.0]
  - - [3584, 3584, 1, 256, 3584, 3584, 3584, 256]
    - [4, 39072.0]
  - - [6784, 4288, 1, 1280, 6784, 6784, 6784, 1280]
    - [4, 40220.0]
  - - [3584, 5056, 1, 256, 3584, 3584, 3584, 256]
    - [31, 38018.0]
  - - [2944, 2368, 1, 1280, 2944, 2944, 2944, 1280]
    - [31, 36357.0]
  - - [6784, 3584, 1, 256, 6784, 6784, 6784, 256]
    - [4, 39915.0]
  - - [1856, 1408, 1, 256, 1856, 1856, 1856, 256]
    - [0, 28492.0]
  - - [2944, 2944, 1, 3328, 2944, 2944, 2944, 3328]
    - [4, 40003.0]
  - - [5056, 6784, 1, 256, 5056, 5056, 5056, 256]
    - [31, 39750.0]
  - - [1408, 4288, 1, 3328, 1408, 1408, 1408, 3328]
    - [16, 37364.0]
  - - [6784, 256, 1, 1280, 6784, 6784, 6784, 1280]
    - [6, 33907.0]
  - - [2368, 704, 1, 3328, 2368, 2368, 2368, 3328]
    - [30, 32147.0]
  - - [3584, 6784, 1, 256, 3584, 3584, 3584, 256]
    - [4, 39895.0]
  - - [5056, 1856, 1, 256, 5056, 5056, 5056, 256]
    - [39, 35121.0]
  - - [1024, 3000, 1, 2816, 1024, 1024, 1024, 2816]
    - [34, 33885.0]
  - - [704, 4288, 1, 256, 704, 704, 704, 256]
    - [30, 28287.0]
  - - [1408, 6784, 1, 1280, 1408, 1408, 1408, 1280]
    - [4, 38843.0]
  - - [7680, 24000, 1, 2560, 7680, 7680, 7680, 2560]
    - [17, 42082.0]
  - - [4608, 48000, 1, 1536, 4608, 4608, 4608, 1536]
    - [5, 42173.0]
  - - [1024, 24000, 1, 1536, 1024, 1024, 1024, 1536]
    - [39, 40756.0]
  - - [5056, 2368, 1, 3328, 5056, 5056, 5056, 3328]
    - [4, 37918.0]
  - - [2944, 4288, 1, 256, 2944, 2944, 2944, 256]
    - [16, 37180.0]
  - - [1408, 3584, 1, 1280, 1408, 1408, 1408, 1280]
    - [4, 37645.0]
  - - [1024, 1500, 1, 2816, 1024, 1024, 1024, 2816]
    - [4, 30171.0]
  - - [1024, 6000, 1, 2048, 1024, 1024, 1024, 2048]
    - [39, 37590.0]
  - - [512, 24000, 1, 2560, 512, 512, 512, 2560]
    - [39, 40252.0]
  - - [6144, 3000, 1, 2560, 6144, 6144, 6144, 2560]
    - [16, 40261.0]
  - - [2368, 6784, 1, 3328, 2368, 2368, 2368, 3328]
    - [39, 40092.0]
  - - [5056, 704, 1, 1280, 5056, 5056, 5056, 1280]
    - [3, 32939.0]
  - - [1856, 4288, 1, 3328, 1856, 1856, 1856, 3328]
    - [4, 36657.0]
  - - [1408, 5888, 1, 256, 1408, 1408, 1408, 256]
    - [4, 36630.0]
  - - [704, 2944, 1, 1280, 704, 704, 704, 1280]
    - [4, 31211.0]
  - - [3584, 704, 1, 1280, 3584, 3584, 3584, 1280]
    - [30, 33384.0]
  - - [5888, 5056, 1, 256, 5888, 5888, 5888, 256]
    - [4, 39183.0]
  - - [3584, 448, 1, 3328, 3584, 3584, 3584, 3328]
    - [15, 31249.0]
  - - [704, 2368, 1, 3328, 704, 704, 704, 3328]
    - [15, 28326.0]
  - - [448, 5056, 1, 3328, 448, 448, 448, 3328]
    - [30, 30196.0]
  - - [4288, 448, 1, 256, 4288, 4288, 4288, 256]
    - [21, 27110.0]
  - - [5888, 2368, 1, 256, 5888, 5888, 5888, 256]
    - [4, 37158.0]
  - - [6784, 704, 1, 3328, 6784, 6784, 6784, 3328]
    - [16, 35698.0]
  - - [1408, 2944, 1, 3328, 1408, 1408, 1408, 3328]
    - [19, 35226.0]
  - - [4288, 4288, 1, 256, 4288, 4288, 4288, 256]
    - [23, 37608.0]
  - - [2368, 704, 1, 256, 2368, 2368, 2368, 256]
    - [13, 26442.0]
  - - [3584, 2368, 1, 256, 3584, 3584, 3584, 256]
    - [23, 35594.0]
  - - [5888, 5056, 1, 1280, 5888, 5888, 5888, 1280]
    - [4, 40371.0]
  - - [8448, 24000, 1, 2816, 8448, 8448, 8448, 2816]
    - [32, 42044.0]
  - - [3584, 3584, 1, 3328, 3584, 3584, 3584, 3328]
    - [7, 40855.0]
  - - [3072, 1500, 1, 128, 3072, 3072, 3072, 128]
    - [30, 28384.0]
  - - [2048, 3136, 1, 512, 2048, 2048, 2048, 512]
    - [15, 35343.0]
  - - [5888, 6784, 1, 256, 5888, 5888, 5888, 256]
    - [4, 40870.0]
  - - [4288, 2944, 1, 3328, 4288, 4288, 4288, 3328]
    - [16, 39962.0]
  - - [256, 5056, 1, 1280, 256, 256, 256, 1280]
    - [30, 28843.0]
  - - [6784, 5888, 1, 1280, 6784, 6784, 6784, 1280]
    - [4, 41581.0]
  - - [5888, 4288, 1, 1280, 5888, 5888, 5888, 1280]
    - [16, 40285.0]
  - - [1024, 24000, 1, 2048, 1024, 1024, 1024, 2048]
    - [39, 40874.0]
  - - [1408, 1856, 1, 1280, 1408, 1408, 1408, 1280]
    - [30, 34104.0]
  - - [5888, 448, 1, 3328, 5888, 5888, 5888, 3328]
    - [3, 31503.0]
  - - [704, 5888, 1, 1280, 704, 704, 704, 1280]
    - [7, 34507.0]
  - - [5056, 2944, 1, 3328, 5056, 5056, 5056, 3328]
    - [4, 40095.0]
  - - [448, 4288, 1, 1280, 448, 448, 448, 1280]
    - [16, 28632.0]
  - - [3584, 704, 1, 256, 3584, 3584, 3584, 256]
    - [3, 31295.0]
  - - [3584, 1408, 1, 3328, 3584, 3584, 3584, 3328]
    - [4, 38020.0]
  - - [2368, 1024, 1, 1280, 2368, 2368, 2368, 1280]
    - [3, 31613.0]
  - - [2944, 6784, 1, 1280, 2944, 2944, 2944, 1280]
    - [4, 41213.0]
  - - [1856, 6784, 1, 256, 1856, 1856, 1856, 256]
    - [4, 36973.0]
  - - [4288, 448, 1, 3328, 4288, 4288, 4288, 3328]
    - [15, 32305.0]
  - - [6784, 704, 1, 1280, 6784, 6784, 6784, 1280]
    - [16, 35077.0]
  - - [5888, 1024, 1, 3328, 5888, 5888, 5888, 3328]
    - [4, 37597.0]
  - - [704, 6784, 1, 1280, 704, 704, 704, 1280]
    - [31, 34734.0]
  - - [512, 3000, 1, 2048, 512, 512, 512, 2048]
    - [11, 29716.0]
  - - [5056, 1024, 1, 3328, 5056, 5056, 5056, 3328]
    - [4, 38917.0]
  - - [704, 5056, 1, 1280, 704, 704, 704, 1280]
    - [31, 32924.0]
  - - [2944, 1856, 1, 256, 2944, 2944, 2944, 256]
    - [15, 34018.0]
  - - [5888, 5056, 1, 3328, 5888, 5888, 5888, 3328]
    - [19, 40544.0]
  - - [3584, 6784, 1, 1280, 3584, 3584, 3584, 1280]
    - [4, 40779.0]
  - - [1856, 5888, 1, 256, 1856, 1856, 1856, 256]
    - [4, 35684.0]
  - - [4288, 4288, 1, 3328, 4288, 4288, 4288, 3328]
    - [31, 39212.0]
  - - [4288, 1408, 1, 1280, 4288, 4288, 4288, 1280]
    - [4, 36832.0]
  - - [4288, 2368, 1, 256, 4288, 4288, 4288, 256]
    - [4, 35280.0]
  - - [2944, 5056, 1, 1280, 2944, 2944, 2944, 1280]
    - [4, 39756.0]
  - - [6784, 2368, 1, 3328, 6784, 6784, 6784, 3328]
    - [16, 40190.0]
  - - [4288, 1856, 1, 3328, 4288, 4288, 4288, 3328]
    - [4, 36652.0]
  - - [1856, 2944, 1, 1280, 1856, 1856, 1856, 1280]
    - [34, 36420.0]
  - - [4288, 6784, 1, 3328, 4288, 4288, 4288, 3328]
    - [4, 40335.0]
  - - [3584, 1024, 1, 1280, 3584, 3584, 3584, 1280]
    - [39, 34375.0]
  - - [1024, 4288, 1, 256, 1024, 1024, 1024, 256]
    - [30, 33939.0]
  - - [5888, 3584, 1, 3328, 5888, 5888, 5888, 3328]
    - [19, 41364.0]
  - - [5056, 3584, 1, 3328, 5056, 5056, 5056, 3328]
    - [7, 39965.0]
  - - [2368, 1408, 1, 1280, 2368, 2368, 2368, 1280]
    - [4, 35358.0]
  - - [5056, 2944, 1, 1280, 5056, 5056, 5056, 1280]
    - [4, 39782.0]
  - - [8448, 6000, 1, 2816, 8448, 8448, 8448, 2816]
    - [4, 41356.0]
  - - [1024, 6784, 1, 256, 1024, 1024, 1024, 256]
    - [31, 35370.0]
  - - [2944, 5056, 1, 3328, 2944, 2944, 2944, 3328]
    - [34, 40147.0]
  - - [3584, 2944, 1, 256, 3584, 3584, 3584, 256]
    - [23, 38754.0]
  - - [5056, 6784, 1, 3328, 5056, 5056, 5056, 3328]
    - [4, 41157.0]
  - - [3584, 4288, 1, 256, 3584, 3584, 3584, 256]
    - [28, 36734.0]
  - - [1856, 6784, 1, 3328, 1856, 1856, 1856, 3328]
    - [4, 38206.0]
  - - [512, 6000, 1, 1536, 512, 512, 512, 1536]
    - [38, 33002.0]
  - - [5056, 1408, 1, 1280, 5056, 5056, 5056, 1280]
    - [4, 37192.0]
  - - [5888, 5888, 1, 256, 5888, 5888, 5888, 256]
    - [39, 40700.0]
  - - [4288, 1024, 1, 1280, 4288, 4288, 4288, 1280]
    - [7, 36074.0]
  - - [448, 6784, 1, 3328, 448, 448, 448, 3328]
    - [34, 33579.0]
  - - [2944, 1408, 1, 1280, 2944, 2944, 2944, 1280]
    - [4, 34792.0]
  - - [3072, 6000, 1, 1024, 3072, 3072, 3072, 1024]
    - [39, 40012.0]
  - - [2944, 1856, 1, 3328, 2944, 2944, 2944, 3328]
    - [31, 37066.0]
  - - [448, 5056, 1, 256, 448, 448, 448, 256]
    - [30, 27326.0]
  - - [3584, 5888, 1, 1280, 3584, 3584, 3584, 1280]
    - [19, 41186.0]
  - - [6784, 1856, 1, 1280, 6784, 6784, 6784, 1280]
    - [4, 38081.0]
  - - [5888, 256, 1, 3328, 5888, 5888, 5888, 3328]
    - [4, 30629.0]
  - - [1856, 5888, 1, 3328, 1856, 1856, 1856, 3328]
    - [7, 38235.0]
  - - [3584, 1408, 1, 256, 3584, 3584, 3584, 256]
    - [39, 35066.0]
  - - [704, 3584, 1, 3328, 704, 704, 704, 3328]
    - [4, 32506.0]
  - - [5056, 448, 1, 1280, 5056, 5056, 5056, 1280]
    - [3, 32954.0]
  - - [3584, 1856, 1, 3328, 3584, 3584, 3584, 3328]
    - [16, 37825.0]
  - - [1024, 3000, 1, 2048, 1024, 1024, 1024, 2048]
    - [26, 33299.0]
  - - [2944, 1024, 1, 256, 2944, 2944, 2944, 256]
    - [3, 31019.0]
  - - [2368, 4288, 1, 3328, 2368, 2368, 2368, 3328]
    - [7, 39235.0]
  - - [1024, 1408, 1, 1280, 1024, 1024, 1024, 1280]
    - [3, 31984.0]
  - - [6784, 5056, 1, 256, 6784, 6784, 6784, 256]
    - [23, 39739.0]
  - - [4288, 5888, 1, 256, 4288, 4288, 4288, 256]
    - [4, 39296.0]
  - - [2944, 6784, 1, 256, 2944, 2944, 2944, 256]
    - [4, 40189.0]
  - - [2368, 2368, 1, 1280, 2368, 2368, 2368, 1280]
    - [16, 34477.0]
  - - [1856, 3584, 1, 1280, 1856, 1856, 1856, 1280]
    - [19, 37489.0]
  - - [3584, 1408, 1, 1280, 3584, 3584, 3584, 1280]
    - [4, 37549.0]
  - - [5056, 3584, 1, 1280, 5056, 5056, 5056, 1280]
    - [4, 39712.0]
  - - [256, 5888, 1, 256, 256, 256, 256, 256]
    - [18, 25794.0]
  - - [1856, 1408, 1, 3328, 1856, 1856, 1856, 3328]
    - [16, 33550.0]
  - - [1024, 4288, 1, 3328, 1024, 1024, 1024, 3328]
    - [19, 36955.0]
  - - [2944, 2368, 1, 3328, 2944, 2944, 2944, 3328]
    - [16, 36897.0]
  - - [704, 4288, 1, 3328, 704, 704, 704, 3328]
    - [19, 33412.0]
  - - [1024, 48000, 1, 2816, 1024, 1024, 1024, 2816]
    - [2, 41617.0]
  - - [1024, 1856, 1, 1280, 1024, 1024, 1024, 1280]
    - [3, 31244.0]
  - - [6784, 1856, 1, 256, 6784, 6784, 6784, 256]
    - [16, 36446.0]
  - - [512, 48000, 1, 2816, 512, 512, 512, 2816]
    - [4, 41193.0]
  - - [512, 3000, 1, 2816, 512, 512, 512, 2816]
    - [41, 29900.0]
  - - [1024, 5888, 1, 256, 1024, 1024, 1024, 256]
    - [4, 35337.0]
  - - [1408, 2368, 1, 256, 1408, 1408, 1408, 256]
    - [30, 31849.0]
  - - [2944, 704, 1, 3328, 2944, 2944, 2944, 3328]
    - [34, 33018.0]
  - - [2944, 2944, 1, 1280, 2944, 2944, 2944, 1280]
    - [4, 39723.0]
  - - [6784, 256, 1, 3328, 6784, 6784, 6784, 3328]
    - [6, 34642.0]
  - - [1408, 5056, 1, 256, 1408, 1408, 1408, 256]
    - [39, 35006.0]
  - - [512, 50176, 1, 128, 512, 512, 512, 128]
    - [31, 39008.0]
  - - [1408, 4288, 1, 256, 1408, 1408, 1408, 256]
    - [3, 34180.0]
  - - [5888, 2368, 1, 1280, 5888, 5888, 5888, 1280]
    - [9, 38780.0]
  - - [2368, 5888, 1, 1280, 2368, 2368, 2368, 1280]
    - [4, 38748.0]
  - - [5888, 256, 1, 1280, 5888, 5888, 5888, 1280]
    - [4, 29555.0]
  - - [2368, 1856, 1, 3328, 2368, 2368, 2368, 3328]
    - [4, 36796.0]
  - - [2944, 704, 1, 256, 2944, 2944, 2944, 256]
    - [30, 28773.0]
  - - [2368, 6784, 1, 1280, 2368, 2368, 2368, 1280]
    - [31, 39782.0]
  - - [2368, 1024, 1, 3328, 2368, 2368, 2368, 3328]
    - [15, 32243.0]
  - - [1856, 4288, 1, 1280, 1856, 1856, 1856, 1280]
    - [4, 36172.0]
  - - [704, 3584, 1, 256, 704, 704, 704, 256]
    - [6, 27580.0]
  - - [704, 2944, 1, 3328, 704, 704, 704, 3328]
    - [19, 32849.0]
  - - [1856, 5056, 1, 3328, 1856, 1856, 1856, 3328]
    - [4, 38205.0]
  - - [196, 256, 64, 1024, 196, 196, 196, 1024]
    - [26, 26065.0]
  - - [3584, 5056, 1, 1280, 3584, 3584, 3584, 1280]
    - [9, 39592.0]
  - - [2944, 1024, 1, 3328, 2944, 2944, 2944, 3328]
    - [7, 33959.0]
  - - [1408, 6784, 1, 256, 1408, 1408, 1408, 256]
    - [4, 37424.0]
  - - [6784, 1408, 1, 3328, 6784, 6784, 6784, 3328]
    - [31, 39034.0]
  - - [1024, 2368, 1, 1280, 1024, 1024, 1024, 1280]
    - [30, 32130.0]
  - - [6784, 2944, 1, 1280, 6784, 6784, 6784, 1280]
    - [4, 41198.0]
  - - [3584, 448, 1, 1280, 3584, 3584, 3584, 1280]
    - [15, 30656.0]
  - - [2944, 6784, 1, 3328, 2944, 2944, 2944, 3328]
    - [4, 41342.0]
  - - [448, 5056, 1, 1280, 448, 448, 448, 1280]
    - [3, 29736.0]
  - - [4288, 5056, 1, 1280, 4288, 4288, 4288, 1280]
    - [4, 39946.0]
  - - [4288, 704, 1, 256, 4288, 4288, 4288, 256]
    - [3, 30618.0]
  - - [5888, 704, 1, 256, 5888, 5888, 5888, 256]
    - [3, 32392.0]
  - - [256, 5888, 1, 3328, 256, 256, 256, 3328]
    - [4, 30550.0]
  - - [6784, 4288, 1, 256, 6784, 6784, 6784, 256]
    - [4, 39282.0]
  - - [5888, 256, 1, 256, 5888, 5888, 5888, 256]
    - [0, 25933.0]
  - - [6784, 1024, 1, 1280, 6784, 6784, 6784, 1280]
    - [7, 39608.0]
  - - [2944, 704, 1, 1280, 2944, 2944, 2944, 1280]
    - [31, 31188.0]
  - - [6784, 3584, 1, 1280, 6784, 6784, 6784, 1280]
    - [19, 40790.0]
  - - [1408, 2944, 1, 1280, 1408, 1408, 1408, 1280]
    - [4, 34788.0]
  - - [1408, 2368, 1, 3328, 1408, 1408, 1408, 3328]
    - [4, 36307.0]
  - - [2368, 2944, 1, 256, 2368, 2368, 2368, 256]
    - [4, 35062.0]
  - - [3584, 1856, 1, 256, 3584, 3584, 3584, 256]
    - [3, 34555.0]
  - - [4288, 3584, 1, 1280, 4288, 4288, 4288, 1280]
    - [31, 39550.0]
  - - [4288, 2944, 1, 1280, 4288, 4288, 4288, 1280]
    - [4, 39647.0]
  - - [5056, 448, 1, 3328, 5056, 5056, 5056, 3328]
    - [15, 33644.0]
  - - [5124, 1500, 1, 2048, 5124, 5124, 5124, 2048]
    - [12, 37255.0]
  - - [4288, 5056, 1, 3328, 4288, 4288, 4288, 3328]
    - [7, 40262.0]
  - - [256, 5056, 1, 3328, 256, 256, 256, 3328]
    - [30, 29508.0]
  - - [5056, 2368, 1, 256, 5056, 5056, 5056, 256]
    - [9, 35648.0]
  - - [4288, 704, 1, 3328, 4288, 4288, 4288, 3328]
    - [19, 33428.0]
  - - [448, 3584, 1, 256, 448, 448, 448, 256]
    - [3, 23650.0]
  - - [6144, 1500, 1, 2560, 6144, 6144, 6144, 2560]
    - [39, 39560.0]
  - - [1024, 1408, 1, 3328, 1024, 1024, 1024, 3328]
    - [3, 32757.0]
  - - [2944, 5888, 1, 1280, 2944, 2944, 2944, 1280]
    - [7, 40554.0]
  - - [5888, 3584, 1, 256, 5888, 5888, 5888, 256]
    - [4, 40201.0]
  - - [1408, 1856, 1, 3328, 1408, 1408, 1408, 3328]
    - [30, 34891.0]
  - - [7680, 6000, 1, 2560, 7680, 7680, 7680, 2560]
    - [4, 41329.0]
  - - [6784, 1408, 1, 1280, 6784, 6784, 6784, 1280]
    - [4, 38569.0]
  - - [512, 3000, 1, 2560, 512, 512, 512, 2560]
    - [41, 29889.0]
  - - [704, 2944, 1, 256, 704, 704, 704, 256]
    - [3, 27463.0]
  - - [2944, 5888, 1, 3328, 2944, 2944, 2944, 3328]
    - [34, 40740.0]
  - - [1024, 1500, 1, 1536, 1024, 1024, 1024, 1536]
    - [18, 29272.0]
  - - [1408, 1408, 1, 1280, 1408, 1408, 1408, 1280]
    - [30, 33076.0]
  - - [3072, 3000, 1, 1024, 3072, 3072, 3072, 1024]
    - [23, 38974.0]
  - - [448, 4288, 1, 3328, 448, 448, 448, 3328]
    - [34, 30490.0]
  - - [704, 2368, 1, 256, 704, 704, 704, 256]
    - [3, 24755.0]
  - - [5888, 2368, 1, 3328, 5888, 5888, 5888, 3328]
    - [16, 39034.0]
  - - [5124, 9124, 1, 1760, 5124, 5124, 5124, 1760]
    - [9, 40268.0]
  - - [4288, 5056, 1, 256, 4288, 4288, 4288, 256]
    - [4, 37880.0]
  - - [4288, 448, 1, 1280, 4288, 4288, 4288, 1280]
    - [3, 31292.0]
  - - [5888, 704, 1, 3328, 5888, 5888, 5888, 3328]
    - [34, 35045.0]
  - - [4288, 3584, 1, 3328, 4288, 4288, 4288, 3328]
    - [16, 39840.0]
  - - [1024, 6784, 1, 3328, 1024, 1024, 1024, 3328]
    - [31, 39676.0]
  - - [512, 3136, 1, 2048, 512, 512, 512, 2048]
    - [22, 30940.0]
  - - [1408, 1024, 1, 256, 1408, 1408, 1408, 256]
    - [27, 28175.0]
  - - [8448, 1500, 1, 2816, 8448, 8448, 8448, 2816]
    - [4, 40058.0]
  - - [2560, 7000, 1, 2560, 2560, 2560, 2560, 2560]
    - [31, 40483.0]
  - - [6784, 6784, 1, 3328, 6784, 6784, 6784, 3328]
    - [16, 41357.0]
  - - [704, 5056, 1, 3328, 704, 704, 704, 3328]
    - [16, 33495.0]
  - - [3584, 5056, 1, 3328, 3584, 3584, 3584, 3328]
    - [19, 39891.0]
  - - [2368, 2944, 1, 3328, 2368, 2368, 2368, 3328]
    - [4, 36845.0]
  - - [2368, 3584, 1, 256, 2368, 2368, 2368, 256]
    - [9, 34064.0]
  - - [4608, 3000, 1, 1536, 4608, 4608, 4608, 1536]
    - [39, 39896.0]
  - - [5124, 9124, 1, 4096, 5124, 5124, 5124, 4096]
    - [12, 40261.0]
  - - [7680, 48000, 1, 2560, 7680, 7680, 7680, 2560]
    - [5, 42266.0]
  - - [4608, 1500, 1, 1536, 4608, 4608, 4608, 1536]
    - [39, 38389.0]
  - - [3584, 2368, 1, 1280, 3584, 3584, 3584, 1280]
    - [31, 38465.0]
  - - [5124, 9124, 1, 2560, 5124, 5124, 5124, 2560]
    - [16, 40270.0]
  - - [1856, 1856, 1, 256, 1856, 1856, 1856, 256]
    - [3, 29375.0]
  - - [4288, 1408, 1, 3328, 4288, 4288, 4288, 3328]
    - [4, 37321.0]
  - - [5124, 9124, 1, 2048, 5124, 5124, 5124, 2048]
    - [12, 40201.0]
  - - [5124, 700, 1, 2048, 5124, 5124, 5124, 2048]
    - [23, 33116.0]
  - - [256, 12544, 1, 1024, 256, 256, 256, 1024]
    - [12, 34651.0]
  - - [5888, 1408, 1, 3328, 5888, 5888, 5888, 3328]
    - [4, 38349.0]
  - - [256, 5056, 1, 256, 256, 256, 256, 256]
    - [36, 25294.0]
  - - [2368, 5056, 1, 256, 2368, 2368, 2368, 256]
    - [4, 35548.0]
  - - [1024, 6000, 1, 2560, 1024, 1024, 1024, 2560]
    - [9, 37706.0]
  - - [1024, 5056, 1, 256, 1024, 1024, 1024, 256]
    - [30, 33880.0]
  - - [4224, 1500, 1, 176, 4224, 4224, 4224, 176]
    - [30, 32914.0]
  - - [2368, 1408, 1, 3328, 2368, 2368, 2368, 3328]
    - [4, 36179.0]
  - - [1024, 48000, 1, 1536, 1024, 1024, 1024, 1536]
    - [32, 41300.0]
  - - [5888, 448, 1, 256, 5888, 5888, 5888, 256]
    - [27, 28735.0]
  - - [6784, 5056, 1, 1280, 6784, 6784, 6784, 1280]
    - [4, 40861.0]
  - - [1024, 48000, 1, 2560, 1024, 1024, 1024, 2560]
    - [5, 41449.0]
  - - [4288, 6784, 1, 1280, 4288, 4288, 4288, 1280]
    - [4, 40071.0]
  - - [3072, 48000, 1, 1024, 3072, 3072, 3072, 1024]
    - [23, 41791.0]
  - - [6784, 1408, 1, 256, 6784, 6784, 6784, 256]
    - [4, 36194.0]
  - - [5888, 4288, 1, 256, 5888, 5888, 5888, 256]
    - [31, 38624.0]
  - - [5056, 5888, 1, 256, 5056, 5056, 5056, 256]
    - [23, 39479.0]
  - - [2368, 1024, 1, 256, 2368, 2368, 2368, 256]
    - [30, 28165.0]
  - - [1856, 6784, 1, 1280, 1856, 1856, 1856, 1280]
    - [4, 38072.0]
  - - [8448, 3000, 1, 2816, 8448, 8448, 8448, 2816]
    - [29, 40628.0]
  - - [6784, 448, 1, 3328, 6784, 6784, 6784, 3328]
    - [7, 33296.0]
  - - [5056, 1856, 1, 1280, 5056, 5056, 5056, 1280]
    - [4, 37769.0]
  - - [1408, 1024, 1, 3328, 1408, 1408, 1408, 3328]
    - [30, 32788.0]
  - - [7680, 1500, 1, 2560, 7680, 7680, 7680, 2560]
    - [31, 39798.0]
  - - [5888, 3584, 1, 1280, 5888, 5888, 5888, 1280]
    - [16, 41126.0]
  - - [1024, 2944, 1, 256, 1024, 1024, 1024, 256]
    - [30, 31094.0]
  - - [448, 6784, 1, 1280, 448, 448, 448, 1280]
    - [34, 32386.0]
  - - [704, 5056, 1, 256, 704, 704, 704, 256]
    - [3, 28909.0]
  - - [3584, 1024, 1, 3328, 3584, 3584, 3584, 3328]
    - [4, 35180.0]
  - - [2944, 1856, 1, 1280, 2944, 2944, 2944, 1280]
    - [31, 36351.0]
  - - [5056, 256, 1, 256, 5056, 5056, 5056, 256]
    - [0, 23600.0]
  - - [2368, 3584, 1, 3328, 2368, 2368, 2368, 3328]
    - [4, 39021.0]
  - - [3584, 5888, 1, 3328, 3584, 3584, 3584, 3328]
    - [19, 41314.0]
  - - [2944, 3584, 1, 1280, 2944, 2944, 2944, 1280]
    - [19, 40579.0]
  - - [1856, 5888, 1, 1280, 1856, 1856, 1856, 1280]
    - [19, 37812.0]
  - - [4608, 24000, 1, 1536, 4608, 4608, 4608, 1536]
    - [24, 41826.0]
  - - [4288, 1408, 1, 256, 4288, 4288, 4288, 256]
    - [28, 32871.0]
  - - [4288, 2368, 1, 1280, 4288, 4288, 4288, 1280]
    - [16, 38615.0]
  - - [2944, 5056, 1, 256, 2944, 2944, 2944, 256]
    - [39, 38067.0]
  - - [6784, 2368, 1, 256, 6784, 6784, 6784, 256]
    - [23, 38037.0]
  - - [1024, 24000, 1, 2816, 1024, 1024, 1024, 2816]
    - [34, 41102.0]
  - - [4288, 1856, 1, 256, 4288, 4288, 4288, 256]
    - [8, 33258.0]
  - - [1856, 2944, 1, 256, 1856, 1856, 1856, 256]
    - [9, 34134.0]
  - - [4608, 6000, 1, 1536, 4608, 4608, 4608, 1536]
    - [16, 40516.0]
  - - [7680, 3000, 1, 2560, 7680, 7680, 7680, 2560]
    - [4, 40465.0]
  - - [5124, 700, 1, 2560, 5124, 5124, 5124, 2560]
    - [4, 33748.0]
  - - [1856, 1408, 1, 1280, 1856, 1856, 1856, 1280]
    - [4, 32456.0]
  - - [1024, 4288, 1, 1280, 1024, 1024, 1024, 1280]
    - [4, 35712.0]
  - - [2368, 5056, 1, 3328, 2368, 2368, 2368, 3328]
    - [19, 38077.0]
  - - [4288, 1024, 1, 3328, 4288, 4288, 4288, 3328]
    - [19, 37284.0]
  - - [6144, 48000, 1, 2560, 6144, 6144, 6144, 2560]
    - [17, 42252.0]
  - - [1024, 5056, 1, 3328, 1024, 1024, 1024, 3328]
    - [31, 38366.0]
  - - [1024, 1856, 1, 3328, 1024, 1024, 1024, 3328]
    - [15, 32215.0]
  - - [5124, 1500, 1, 2560, 5124, 5124, 5124, 2560]
    - [42, 37717.0]
  - - [3584, 2944, 1, 3328, 3584, 3584, 3584, 3328]
    - [4, 40781.0]
  - - [5888, 2944, 1, 256, 5888, 5888, 5888, 256]
    - [4, 39480.0]
  - - [5056, 4288, 1, 256, 5056, 5056, 5056, 256]
    - [23, 38404.0]
  - - [1024, 3584, 1, 256, 1024, 1024, 1024, 256]
    - [15, 32375.0]
  - - [5056, 1408, 1, 256, 5056, 5056, 5056, 256]
    - [9, 35790.0]
  - - [5888, 5888, 1, 1280, 5888, 5888, 5888, 1280]
    - [4, 41511.0]
  - - [448, 5888, 1, 1280, 448, 448, 448, 1280]
    - [30, 28609.0]
  - - [1024, 3000, 1, 2560, 1024, 1024, 1024, 2560]
    - [26, 33608.0]
  - - [4288, 704, 1, 1280, 4288, 4288, 4288, 1280]
    - [3, 32801.0]
  - - [2944, 1408, 1, 256, 2944, 2944, 2944, 256]
    - [4, 32772.0]
  - - [2368, 5888, 1, 3328, 2368, 2368, 2368, 3328]
    - [4, 39009.0]
  - - [2368, 1856, 1, 1280, 2368, 2368, 2368, 1280]
    - [4, 35937.0]
  - - [1024, 6000, 1, 2816, 1024, 1024, 1024, 2816]
    - [31, 37877.0]
  - - [5888, 4288, 1, 3328, 5888, 5888, 5888, 3328]
    - [31, 40456.0]
  - - [5056, 448, 1, 256, 5056, 5056, 5056, 256]
    - [3, 28706.0]
  - - [1856, 5056, 1, 1280, 1856, 1856, 1856, 1280]
    - [4, 37769.0]
  - - [2944, 1024, 1, 1280, 2944, 2944, 2944, 1280]
    - [34, 33328.0]
  - - [2368, 4288, 1, 256, 2368, 2368, 2368, 256]
    - [39, 35309.0]
  - - [1024, 2368, 1, 3328, 1024, 1024, 1024, 3328]
    - [15, 32482.0]
  - - [4288, 5888, 1, 3328, 4288, 4288, 4288, 3328]
    - [7, 40513.0]
  - - [1024, 2944, 1, 3328, 1024, 1024, 1024, 3328]
    - [34, 33425.0]
  - - [256, 6784, 1, 1280, 256, 256, 256, 1280]
    - [33, 33682.0]
  - - [1856, 3584, 1, 256, 1856, 1856, 1856, 256]
    - [19, 34112.0]
  - - [1024, 1500, 1, 2048, 1024, 1024, 1024, 2048]
    - [25, 29604.0]
  - - [512, 24000, 1, 2816, 512, 512, 512, 2816]
    - [4, 40309.0]
  - - [256, 5888, 1, 1280, 256, 256, 256, 1280]
    - [18, 28909.0]
  - - [2944, 2368, 1, 256, 2944, 2944, 2944, 256]
    - [30, 34802.0]
  - - [1024, 1856, 1, 256, 1024, 1024, 1024, 256]
    - [3, 28995.0]
  - - [6784, 3584, 1, 3328, 6784, 6784, 6784, 3328]
    - [7, 40976.0]
  - - [1760, 7000, 1, 1760, 1760, 1760, 1760, 1760]
    - [7, 38989.0]
  - - [1024, 5888, 1, 3328, 1024, 1024, 1024, 3328]
    - [4, 37503.0]
  - - [1408, 2368, 1, 1280, 1408, 1408, 1408, 1280]
    - [16, 35224.0]
  - - [2944, 2944, 1, 256, 2944, 2944, 2944, 256]
    - [4, 38084.0]
  - - [6784, 256, 1, 256, 6784, 6784, 6784, 256]
    - [18, 29719.0]
  - - [1024, 3000, 1, 1536, 1024, 1024, 1024, 1536]
    - [30, 33062.0]
  - - [5888, 1408, 1, 256, 5888, 5888, 5888, 256]
    - [4, 36655.0]
  - - [5888, 6784, 1, 3328, 5888, 5888, 5888, 3328]
    - [14, 41754.0]
  - - [704, 4288, 1, 1280, 704, 704, 704, 1280]
    - [19, 31476.0]
  - - [128, 50176, 1, 512, 128, 128, 128, 512]
    - [26, 35534.0]
  - - [1024, 48000, 1, 2048, 1024, 1024, 1024, 2048]
    - [23, 41358.0]
  - - [784, 512, 64, 128, 784, 784, 784, 128]
    - [1, 33082.0]
  - - [3136, 256, 64, 64, 3136, 3136, 3136, 64]
    - [37, 36758.0]
  - - [12544, 1024, 1, 256, 12544, 12544, 12544, 256]
    - [9, 38980.0]
  - - [784, 128, 128, 512, 784, 784, 784, 512]
    - [20, 30335.0]
  - - [784, 512, 256, 128, 784, 784, 784, 128]
    - [0, 31274.0]
  - - [3136, 512, 1, 2048, 3136, 3136, 3136, 2048]
    - [11, 30504.0]
  - - [12544, 256, 1, 1024, 12544, 12544, 12544, 1024]
    - [7, 34901.0]
  - - [3136, 2048, 1, 512, 3136, 3136, 3136, 512]
    - [39, 34990.0]
  - - [3136, 256, 256, 64, 3136, 3136, 3136, 64]
    - [0, 18764.0]
  - - [784, 128, 64, 512, 784, 784, 784, 512]
    - [38, 30459.0]
  - - [784, 512, 128, 128, 784, 784, 784, 128]
    - [31, 33596.0]
  - - [784, 128, 256, 512, 784, 784, 784, 512]
    - [35, 29498.0]
  - - [3136, 256, 128, 64, 3136, 3136, 3136, 64]
    - [0, 24512.0]
  - - [1024, 1024, 1, 3328, 1024, 1024, 1024, 3328]
    - [59, 29816.0]
  - - [128, 6784, 1, 3328, 128, 128, 128, 3328]
    - [59, 25301.0]
  - - [256, 4288, 1, 3328, 256, 256, 256, 3328]
    - [53, 31028.0]
  - - [704, 1856, 1, 3328, 704, 704, 704, 3328]
    - [46, 29449.0]
  - - [448, 1024, 1, 1280, 448, 448, 448, 1280]
    - [65, 19865.0]
  - - [1024, 704, 1, 256, 1024, 1024, 1024, 256]
    - [44, 18948.0]
  - - [256, 1856, 1, 1280, 256, 256, 256, 1280]
    - [44, 21490.0]
  - - [256, 2944, 1, 3328, 256, 256, 256, 3328]
    - [44, 26976.0]
  - - [128, 3584, 1, 1280, 128, 128, 128, 1280]
    - [61, 20474.0]
  - - [4288, 256, 1, 256, 4288, 4288, 4288, 256]
    - [44, 22481.0]
  - - [5888, 64, 1, 3328, 5888, 5888, 5888, 3328]
    - [45, 18405.0]
  - - [2944, 256, 1, 3328, 2944, 2944, 2944, 3328]
    - [58, 26774.0]
  - - [1408, 448, 1, 1280, 1408, 1408, 1408, 1280]
    - [56, 21940.0]
  - - [1408, 256, 1, 1280, 1408, 1408, 1408, 1280]
    - [44, 16384.0]
  - - [3072, 128, 1, 1024, 3072, 3072, 3072, 1024]
    - [44, 17326.0]
  - - [6784, 64, 1, 256, 6784, 6784, 6784, 256]
    - [44, 13391.0]
  - - [2368, 128, 1, 3328, 2368, 2368, 2368, 3328]
    - [57, 14804.0]
  - - [2944, 128, 1, 256, 2944, 2944, 2944, 256]
    - [61, 12180.0]
  - - [448, 1408, 1, 256, 448, 448, 448, 256]
    - [45, 15205.0]
  - - [64, 5056, 1, 3328, 64, 64, 64, 3328]
    - [51, 15540.0]
  - - [512, 1500, 1, 2816, 512, 512, 512, 2816]
    - [65, 27020.0]
  - - [256, 3584, 1, 3328, 256, 256, 256, 3328]
    - [59, 26700.0]
  - - [256, 1408, 1, 256, 256, 256, 256, 256]
    - [68, 11680.0]
  - - [5056, 64, 1, 1280, 5056, 5056, 5056, 1280]
    - [45, 14543.0]
  - - [2368, 128, 1, 256, 2368, 2368, 2368, 256]
    - [43, 8603.0]
  - - [4288, 128, 1, 1280, 4288, 4288, 4288, 1280]
    - [65, 23356.0]
  - - [5888, 64, 1, 256, 5888, 5888, 5888, 256]
    - [44, 11969.0]
  - - [1856, 256, 1, 1280, 1856, 1856, 1856, 1280]
    - [44, 20602.0]
  - - [64, 5888, 1, 3328, 64, 64, 64, 3328]
    - [51, 18003.0]
  - - [1024, 704, 1, 1280, 1024, 1024, 1024, 1280]
    - [56, 24912.0]
  - - [256, 1408, 1, 3328, 256, 256, 256, 3328]
    - [59, 17925.0]
  - - [6784, 128, 1, 3328, 6784, 6784, 6784, 3328]
    - [67, 25301.0]
  - - [704, 704, 1, 3328, 704, 704, 704, 3328]
    - [59, 23801.0]
  - - [3584, 256, 1, 3328, 3584, 3584, 3584, 3328]
    - [67, 26724.0]
  - - [128, 3584, 1, 3328, 128, 128, 128, 3328]
    - [59, 22386.0]
  - - [128, 2944, 1, 1280, 128, 128, 128, 1280]
    - [50, 16901.0]
  - - [448, 1856, 1, 1280, 448, 448, 448, 1280]
    - [45, 26331.0]
  - - [3584, 128, 1, 256, 3584, 3584, 3584, 256]
    - [44, 14571.0]
  - - [448, 1408, 1, 3328, 448, 448, 448, 3328]
    - [44, 22418.0]
  - - [704, 1024, 1, 256, 704, 704, 704, 256]
    - [44, 18272.0]
  - - [256, 3584, 1, 256, 256, 256, 256, 256]
    - [44, 20354.0]
  - - [1408, 704, 1, 256, 1408, 1408, 1408, 256]
    - [56, 22259.0]
  - - [448, 2944, 1, 3328, 448, 448, 448, 3328]
    - [45, 27904.0]
  - - [64, 5888, 1, 256, 64, 64, 64, 256]
    - [49, 10198.0]
  - - [512, 1500, 1, 2048, 512, 512, 512, 2048]
    - [68, 26364.0]
  - - [448, 2368, 1, 1280, 448, 448, 448, 1280]
    - [45, 26194.0]
  - - [704, 704, 1, 256, 704, 704, 704, 256]
    - [50, 13791.0]
  - - [64, 193600, 1, 64, 64, 64, 64, 64]
    - [51, 21607.0]
  - - [128, 4288, 1, 3328, 128, 128, 128, 3328]
    - [70, 26366.0]
  - - [256, 2368, 1, 256, 256, 256, 256, 256]
    - [44, 16440.0]
  - - [1024, 448, 1, 3328, 1024, 1024, 1024, 3328]
    - [58, 22204.0]
  - - [1856, 704, 1, 1280, 1856, 1856, 1856, 1280]
    - [46, 28424.0]
  - - [1024, 1024, 1, 1280, 1024, 1024, 1024, 1280]
    - [59, 28988.0]
  - - [256, 2944, 1, 256, 256, 256, 256, 256]
    - [44, 20098.0]
  - - [1024, 700, 1, 512, 1024, 1024, 1024, 512]
    - [68, 20321.0]
  - - [128, 6784, 1, 1280, 128, 128, 128, 1280]
    - [53, 24006.0]
  - - [1408, 704, 1, 3328, 1408, 1408, 1408, 3328]
    - [67, 28404.0]
  - - [128, 5888, 1, 1280, 128, 128, 128, 1280]
    - [68, 25521.0]
  - - [704, 1408, 1, 3328, 704, 704, 704, 3328]
    - [47, 28423.0]
  - - [7680, 64, 1, 2560, 7680, 7680, 7680, 2560]
    - [66, 23284.0]
  - - [448, 704, 1, 1280, 448, 448, 448, 1280]
    - [45, 14195.0]
  - - [6784, 128, 1, 256, 6784, 6784, 6784, 256]
    - [44, 19955.0]
  - - [704, 448, 1, 256, 704, 704, 704, 256]
    - [60, 9432.0]
  - - [256, 1856, 1, 3328, 256, 256, 256, 3328]
    - [46, 22997.0]
  - - [1024, 704, 1, 3328, 1024, 1024, 1024, 3328]
    - [58, 25610.0]
  - - [128, 4288, 1, 256, 128, 128, 128, 256]
    - [50, 17304.0]
  - - [64, 6784, 1, 3328, 64, 64, 64, 3328]
    - [69, 19886.0]
  - - [2944, 256, 1, 1280, 2944, 2944, 2944, 1280]
    - [56, 25711.0]
  - - [1856, 704, 1, 256, 1856, 1856, 1856, 256]
    - [44, 23165.0]
  - - [704, 1856, 1, 256, 704, 704, 704, 256]
    - [45, 22879.0]
  - - [2944, 448, 1, 256, 2944, 2944, 2944, 256]
    - [44, 25387.0]
  - - [2368, 128, 1, 1280, 2368, 2368, 2368, 1280]
    - [45, 13700.0]
  - - [64, 6784, 1, 256, 64, 64, 64, 256]
    - [51, 11700.0]
  - - [64, 5056, 1, 1280, 64, 64, 64, 1280]
    - [51, 14262.0]
  - - [704, 448, 1, 3328, 704, 704, 704, 3328]
    - [51, 15404.0]
  - - [2368, 256, 1, 1280, 2368, 2368, 2368, 1280]
    - [44, 20387.0]
  - - [2368, 448, 1, 1280, 2368, 2368, 2368, 1280]
    - [56, 28056.0]
  - - [128, 3584, 1, 256, 128, 128, 128, 256]
    - [50, 14680.0]
  - - [1856, 448, 1, 3328, 1856, 1856, 1856, 3328]
    - [56, 29165.0]
  - - [128, 5056, 1, 256, 128, 128, 128, 256]
    - [61, 17294.0]
  - - [4288, 256, 1, 1280, 4288, 4288, 4288, 1280]
    - [59, 28828.0]
  - - [4288, 128, 1, 3328, 4288, 4288, 4288, 3328]
    - [59, 26442.0]
  - - [7680, 128, 1, 2560, 7680, 7680, 7680, 2560]
    - [67, 28018.0]
  - - [448, 2368, 1, 3328, 448, 448, 448, 3328]
    - [45, 27137.0]
  - - [256, 1408, 1, 1280, 256, 256, 256, 1280]
    - [50, 16349.0]
  - - [128, 2368, 1, 256, 128, 128, 128, 256]
    - [50, 10025.0]
  - - [6784, 64, 1, 3328, 6784, 6784, 6784, 3328]
    - [66, 21026.0]
  - - [128, 2944, 1, 3328, 128, 128, 128, 3328]
    - [53, 18513.0]
  - - [2944, 448, 1, 3328, 2944, 2944, 2944, 3328]
    - [58, 29896.0]
  - - [5888, 128, 1, 256, 5888, 5888, 5888, 256]
    - [44, 20482.0]
  - - [5056, 64, 1, 256, 5056, 5056, 5056, 256]
    - [51, 9103.0]
  - - [512, 1500, 1, 1536, 512, 512, 512, 1536]
    - [68, 26052.0]
  - - [128, 5056, 1, 3328, 128, 128, 128, 3328]
    - [61, 23109.0]
  - - [256, 4288, 1, 1280, 256, 256, 256, 1280]
    - [44, 29519.0]
  - - [4288, 128, 1, 256, 4288, 4288, 4288, 256]
    - [45, 15240.0]
  - - [3584, 256, 1, 256, 3584, 3584, 3584, 256]
    - [44, 20318.0]
  - - [128, 2944, 1, 256, 128, 128, 128, 256]
    - [50, 12273.0]
  - - [3584, 128, 1, 3328, 3584, 3584, 3584, 3328]
    - [67, 22452.0]
  - - [5888, 128, 1, 3328, 5888, 5888, 5888, 3328]
    - [46, 26740.0]
  - - [64, 193600, 1, 256, 64, 64, 64, 256]
    - [54, 24646.0]
  - - [1408, 704, 1, 1280, 1408, 1408, 1408, 1280]
    - [71, 26290.0]
  - - [448, 1408, 1, 1280, 448, 448, 448, 1280]
    - [44, 21225.0]
  - - [704, 1408, 1, 1280, 704, 704, 704, 1280]
    - [47, 26779.0]
  - - [448, 2944, 1, 256, 448, 448, 448, 256]
    - [45, 23063.0]
  - - [448, 2368, 1, 256, 448, 448, 448, 256]
    - [45, 21085.0]
  - - [64, 6784, 1, 1280, 64, 64, 64, 1280]
    - [62, 18341.0]
  - - [128, 2368, 1, 3328, 128, 128, 128, 3328]
    - [45, 14795.0]
  - - [5056, 64, 1, 3328, 5056, 5056, 5056, 3328]
    - [45, 15758.0]
  - - [5056, 128, 1, 3328, 5056, 5056, 5056, 3328]
    - [52, 22991.0]
  - - [448, 704, 1, 256, 448, 448, 448, 256]
    - [49, 9238.0]
  - - [1856, 256, 1, 3328, 1856, 1856, 1856, 3328]
    - [59, 23003.0]
  - - [2944, 128, 1, 3328, 2944, 2944, 2944, 3328]
    - [59, 18723.0]
  - - [1024, 1024, 1, 256, 1024, 1024, 1024, 256]
    - [44, 22826.0]
  - - [704, 1024, 1, 1280, 704, 704, 704, 1280]
    - [44, 24411.0]
  - - [256, 4288, 1, 256, 256, 256, 256, 256]
    - [44, 24522.0]
  - - [2368, 256, 1, 256, 2368, 2368, 2368, 256]
    - [44, 14752.0]
  - - [256, 2368, 1, 3328, 256, 256, 256, 3328]
    - [68, 21853.0]
  - - [704, 448, 1, 1280, 704, 704, 704, 1280]
    - [45, 14235.0]
  - - [256, 1856, 1, 256, 256, 256, 256, 256]
    - [44, 15358.0]
  - - [64, 5056, 1, 256, 64, 64, 64, 256]
    - [49, 9225.0]
  - - [1408, 256, 1, 3328, 1408, 1408, 1408, 3328]
    - [59, 17931.0]
  - - [2368, 448, 1, 256, 2368, 2368, 2368, 256]
    - [44, 21452.0]
  - - [4288, 256, 1, 3328, 4288, 4288, 4288, 3328]
    - [59, 31171.0]
  - - [2944, 256, 1, 256, 2944, 2944, 2944, 256]
    - [44, 20224.0]
  - - [6784, 64, 1, 1280, 6784, 6784, 6784, 1280]
    - [46, 19391.0]
  - - [704, 1856, 1, 1280, 704, 704, 704, 1280]
    - [44, 28521.0]
  - - [448, 1024, 1, 3328, 448, 448, 448, 3328]
    - [59, 22031.0]
  - - [2944, 448, 1, 1280, 2944, 2944, 2944, 1280]
    - [56, 29047.0]
  - - [448, 1024, 1, 256, 448, 448, 448, 256]
    - [45, 12655.0]
  - - [1024, 448, 1, 1280, 1024, 1024, 1024, 1280]
    - [56, 20764.0]
  - - [256, 2368, 1, 1280, 256, 256, 256, 1280]
    - [65, 21120.0]
  - - [128, 5056, 1, 1280, 128, 128, 128, 1280]
    - [50, 22102.0]
  - - [1408, 256, 1, 256, 1408, 1408, 1408, 256]
    - [61, 11770.0]
  - - [128, 5888, 1, 3328, 128, 128, 128, 3328]
    - [61, 26751.0]
  - - [2368, 448, 1, 3328, 2368, 2368, 2368, 3328]
    - [56, 29096.0]
  - - [3584, 128, 1, 1280, 3584, 3584, 3584, 1280]
    - [44, 20604.0]
  - - [1408, 448, 1, 256, 1408, 1408, 1408, 256]
    - [44, 17179.0]
  - - [2368, 256, 1, 3328, 2368, 2368, 2368, 3328]
    - [65, 21326.0]
  - - [5888, 128, 1, 1280, 5888, 5888, 5888, 1280]
    - [44, 25657.0]
  - - [256, 3584, 1, 1280, 256, 256, 256, 1280]
    - [59, 25442.0]
  - - [128, 5888, 1, 256, 128, 128, 128, 256]
    - [68, 19688.0]
  - - [1024, 1024, 1, 1024, 1024, 1024, 1024, 1024]
    - [64, 28256.0]
  - - [1408, 448, 1, 3328, 1408, 1408, 1408, 3328]
    - [56, 22724.0]
  - - [64, 5888, 1, 1280, 64, 64, 64, 1280]
    - [51, 16519.0]
  - - [704, 704, 1, 1280, 704, 704, 704, 1280]
    - [44, 21418.0]
  - - [128, 2368, 1, 1280, 128, 128, 128, 1280]
    - [50, 13709.0]
  - - [3584, 256, 1, 1280, 3584, 3584, 3584, 1280]
    - [67, 25420.0]
  - - [5888, 64, 1, 1280, 5888, 5888, 5888, 1280]
    - [45, 16960.0]
  - - [5056, 128, 1, 1280, 5056, 5056, 5056, 1280]
    - [44, 21765.0]
  - - [448, 1856, 1, 3328, 448, 448, 448, 3328]
    - [45, 27589.0]
  - - [1024, 448, 1, 256, 1024, 1024, 1024, 256]
    - [56, 14754.0]
  - - [2944, 128, 1, 1280, 2944, 2944, 2944, 1280]
    - [44, 17068.0]
  - - [256, 2944, 1, 1280, 256, 256, 256, 1280]
    - [44, 25891.0]
  - - [2560, 128, 1, 2560, 2560, 2560, 2560, 2560]
    - [59, 15822.0]
  - - [704, 1024, 1, 3328, 704, 704, 704, 3328]
    - [56, 25572.0]
  - - [1856, 448, 1, 1280, 1856, 1856, 1856, 1280]
    - [56, 27847.0]
  - - [128, 6784, 1, 256, 128, 128, 128, 256]
    - [50, 19297.0]
  - - [704, 1408, 1, 256, 704, 704, 704, 256]
    - [44, 21182.0]
  - - [4096, 128, 1, 4096, 4096, 4096, 4096, 4096]
    - [53, 25688.0]
  - - [448, 2944, 1, 1280, 448, 448, 448, 1280]
    - [45, 27159.0]
  - - [1856, 256, 1, 256, 1856, 1856, 1856, 256]
    - [50, 13455.0]
  - - [5056, 128, 1, 256, 5056, 5056, 5056, 256]
    - [44, 15809.0]
  - - [6784, 128, 1, 1280, 6784, 6784, 6784, 1280]
    - [59, 24194.0]
  - - [1856, 448, 1, 256, 1856, 1856, 1856, 256]
    - [56, 19746.0]
  - - [128, 4288, 1, 1280, 128, 128, 128, 1280]
    - [52, 24293.0]
  - - [448, 704, 1, 3328, 448, 448, 448, 3328]
    - [51, 15390.0]
  - - [448, 1856, 1, 256, 448, 448, 448, 256]
    - [45, 19457.0]
  - - [1856, 704, 1, 3328, 1856, 1856, 1856, 3328]
    - [58, 29290.0]
  - - [512, 1500, 1, 2560, 512, 512, 512, 2560]
    - [61, 26525.0]
  - - [3136, 64, 128, 64, 3136, 3136, 3136, 64]
    - [55, 33582.0]
  - - [3136, 64, 64, 256, 3136, 3136, 3136, 256]
    - [66, 33935.0]
  - - [3136, 64, 128, 256, 3136, 3136, 3136, 256]
    - [63, 18686.0]
  - - [3136, 64, 256, 64, 3136, 3136, 3136, 64]
    - [43, 14874.0]
  - - [3136, 64, 64, 64, 3136, 3136, 3136, 64]
    - [55, 30403.0]
  - - [3136, 64, 256, 256, 3136, 3136, 3136, 256]
    - [48, 19123.0]
  - - [2368, 64, 1, 3328, 2368, 2368, 2368, 3328]
    - [87, 9111.0]
  - - [256, 704, 1, 1280, 256, 256, 256, 1280]
    - [81, 10985.0]
  - - [1408, 64, 1, 1280, 1408, 1408, 1408, 1280]
    - [76, 7365.0]
  - - [4096, 32, 1, 4096, 4096, 4096, 4096, 4096]
    - [95, 9642.0]
  - - [3072, 64, 1, 1024, 3072, 3072, 3072, 1024]
    - [87, 10836.0]
  - - [1024, 256, 1, 3328, 1024, 1024, 1024, 3328]
    - [74, 14195.0]
  - - [6144, 32, 1, 2560, 6144, 6144, 6144, 2560]
    - [77, 11592.0]
  - - [704, 128, 1, 1280, 704, 704, 704, 1280]
    - [94, 7337.0]
  - - [64, 3584, 1, 3328, 64, 64, 64, 3328]
    - [85, 12364.0]
  - - [1024, 256, 1, 256, 1024, 1024, 1024, 256]
    - [82, 10552.0]
  - - [448, 448, 1, 256, 448, 448, 448, 256]
    - [81, 9241.0]
  - - [7680, 32, 1, 2560, 7680, 7680, 7680, 2560]
    - [84, 12892.0]
  - - [128, 1024, 1, 3328, 128, 128, 128, 3328]
    - [77, 9583.0]
  - - [64, 1856, 1, 1280, 64, 64, 64, 1280]
    - [96, 8096.0]
  - - [448, 256, 1, 256, 448, 448, 448, 256]
    - [89, 5757.0]
  - - [256, 1024, 1, 256, 256, 256, 256, 256]
    - [85, 10720.0]
  - - [1024, 128, 1, 1280, 1024, 1024, 1024, 1280]
    - [95, 8924.0]
  - - [3072, 32, 1, 1024, 3072, 3072, 3072, 1024]
    - [76, 6658.0]
  - - [448, 256, 1, 3328, 448, 448, 448, 3328]
    - [77, 8433.0]
  - - [128, 704, 1, 1280, 128, 128, 128, 1280]
    - [94, 7337.0]
  - - [1856, 128, 1, 3328, 1856, 1856, 1856, 3328]
    - [73, 12814.0]
  - - [256, 448, 1, 256, 256, 256, 256, 256]
    - [89, 5802.0]
  - - [8448, 32, 1, 2816, 8448, 8448, 8448, 2816]
    - [92, 14261.0]
  - - [448, 448, 1, 3328, 448, 448, 448, 3328]
    - [77, 11962.0]
  - - [1408, 128, 1, 1280, 1408, 1408, 1408, 1280]
    - [81, 10448.0]
  - - [128, 1856, 1, 1280, 128, 128, 128, 1280]
    - [74, 12391.0]
  - - [2048, 128, 1, 2048, 2048, 2048, 2048, 2048]
    - [74, 13731.0]
  - - [64, 1408, 1, 3328, 64, 64, 64, 3328]
    - [76, 7781.0]
  - - [256, 704, 1, 256, 256, 256, 256, 256]
    - [84, 7613.0]
  - - [128, 1408, 1, 256, 128, 128, 128, 256]
    - [96, 8038.0]
  - - [256, 448, 1, 3328, 256, 256, 256, 3328]
    - [77, 8422.0]
  - - [64, 2368, 1, 1280, 64, 64, 64, 1280]
    - [90, 9537.0]
  - - [2368, 64, 1, 256, 2368, 2368, 2368, 256]
    - [81, 6466.0]
  - - [704, 128, 1, 3328, 704, 704, 704, 3328]
    - [94, 7789.0]
  - - [4288, 64, 1, 1280, 4288, 4288, 4288, 1280]
    - [73, 13626.0]
  - - [2560, 64, 1, 2560, 2560, 2560, 2560, 2560]
    - [77, 9714.0]
  - - [128, 1024, 1, 1280, 128, 128, 128, 1280]
    - [77, 8896.0]
  - - [128, 1024, 1, 256, 128, 128, 128, 256]
    - [96, 6101.0]
  - - [1856, 64, 1, 256, 1856, 1856, 1856, 256]
    - [80, 5870.0]
  - - [704, 128, 1, 256, 704, 704, 704, 256]
    - [94, 5315.0]
  - - [448, 256, 1, 1280, 448, 448, 448, 1280]
    - [77, 7850.0]
  - - [1856, 128, 1, 1280, 1856, 1856, 1856, 1280]
    - [73, 12262.0]
  - - [64, 3584, 1, 256, 64, 64, 64, 256]
    - [82, 9262.0]
  - - [64, 1856, 1, 256, 64, 64, 64, 256]
    - [80, 5803.0]
  - - [256, 1024, 1, 1280, 256, 256, 256, 1280]
    - [93, 13831.0]
  - - [3584, 64, 1, 1280, 3584, 3584, 3584, 1280]
    - [73, 11801.0]
  - - [1408, 128, 1, 3328, 1408, 1408, 1408, 3328]
    - [77, 10776.0]
  - - [64, 2944, 1, 3328, 64, 64, 64, 3328]
    - [87, 11225.0]
  - - [64, 4288, 1, 3328, 64, 64, 64, 3328]
    - [82, 14798.0]
  - - [128, 1500, 1, 1280, 128, 128, 128, 1280]
    - [96, 11636.0]
  - - [64, 2944, 1, 256, 64, 64, 64, 256]
    - [81, 8492.0]
  - - [64, 1408, 1, 1280, 64, 64, 64, 1280]
    - [94, 7319.0]
  - - [64, 2944, 1, 1280, 64, 64, 64, 1280]
    - [81, 11506.0]
  - - [704, 256, 1, 256, 704, 704, 704, 256]
    - [81, 8419.0]
  - - [256, 448, 1, 1280, 256, 256, 256, 1280]
    - [77, 7842.0]
  - - [704, 256, 1, 1280, 704, 704, 704, 1280]
    - [81, 10770.0]
  - - [64, 2368, 1, 3328, 64, 64, 64, 3328]
    - [87, 9084.0]
  - - [256, 704, 1, 3328, 256, 256, 256, 3328]
    - [73, 10795.0]
  - - [4096, 64, 1, 4096, 4096, 4096, 4096, 4096]
    - [81, 13595.0]
  - - [1760, 128, 1, 1760, 1760, 1760, 1760, 1760]
    - [82, 11821.0]
  - - [2944, 64, 1, 1280, 2944, 2944, 2944, 1280]
    - [95, 10652.0]
  - - [128, 1408, 1, 3328, 128, 128, 128, 3328]
    - [77, 10772.0]
  - - [1408, 64, 1, 256, 1408, 1408, 1408, 256]
    - [94, 5315.0]
  - - [64, 2368, 1, 256, 64, 64, 64, 256]
    - [81, 6903.0]
  - - [1024, 128, 1, 3328, 1024, 1024, 1024, 3328]
    - [77, 9642.0]
  - - [2368, 64, 1, 1280, 2368, 2368, 2368, 1280]
    - [77, 8629.0]
  - - [4288, 64, 1, 256, 4288, 4288, 4288, 256]
    - [81, 10775.0]
  - - [64, 4288, 1, 1280, 64, 64, 64, 1280]
    - [82, 14119.0]
  - - [1408, 64, 1, 3328, 1408, 1408, 1408, 3328]
    - [94, 7785.0]
  - - [2944, 64, 1, 256, 2944, 2944, 2944, 256]
    - [81, 8316.0]
  - - [448, 448, 1, 1280, 448, 448, 448, 1280]
    - [81, 12304.0]
  - - [1024, 256, 1, 1280, 1024, 1024, 1024, 1280]
    - [74, 13497.0]
  - - [3584, 64, 1, 3328, 3584, 3584, 3584, 3328]
    - [84, 12340.0]
  - - [256, 1024, 1, 3328, 256, 256, 256, 3328]
    - [93, 14478.0]
  - - [1856, 64, 1, 3328, 1856, 1856, 1856, 3328]
    - [77, 8738.0]
  - - [1856, 64, 1, 1280, 1856, 1856, 1856, 1280]
    - [77, 8122.0]
  - - [4608, 32, 1, 1536, 4608, 4608, 4608, 1536]
    - [77, 10138.0]
  - - [1024, 128, 1, 256, 1024, 1024, 1024, 256]
    - [72, 6079.0]
  - - [64, 3584, 1, 1280, 64, 64, 64, 1280]
    - [97, 11839.0]
  - - [3584, 64, 1, 256, 3584, 3584, 3584, 256]
    - [84, 9262.0]
  - - [64, 1856, 1, 3328, 64, 64, 64, 3328]
    - [77, 8665.0]
  - - [1408, 128, 1, 256, 1408, 1408, 1408, 256]
    - [81, 8038.0]
  - - [128, 704, 1, 256, 128, 128, 128, 256]
    - [94, 5315.0]
  - - [128, 704, 1, 3328, 128, 128, 128, 3328]
    - [94, 7789.0]
  - - [128, 1856, 1, 256, 128, 128, 128, 256]
    - [85, 9623.0]
  - - [64, 4288, 1, 256, 64, 64, 64, 256]
    - [82, 10742.0]
  - - [2560, 32, 1, 2560, 2560, 2560, 2560, 2560]
    - [76, 7014.0]
  - - [704, 256, 1, 3328, 704, 704, 704, 3328]
    - [77, 10780.0]
  - - [176, 1500, 1, 1408, 176, 176, 176, 1408]
    - [91, 13636.0]
  - - [1856, 128, 1, 256, 1856, 1856, 1856, 256]
    - [73, 9623.0]
  - - [4288, 64, 1, 3328, 4288, 4288, 4288, 3328]
    - [73, 14293.0]
  - - [2048, 64, 1, 2048, 2048, 2048, 2048, 2048]
    - [77, 9327.0]
  - - [64, 1408, 1, 256, 64, 64, 64, 256]
    - [94, 5315.0]
  - - [2944, 64, 1, 3328, 2944, 2944, 2944, 3328]
    - [87, 11254.0]
  - - [128, 1408, 1, 1280, 128, 128, 128, 1280]
    - [90, 11017.0]
  - - [128, 1856, 1, 3328, 128, 128, 128, 3328]
    - [85, 12957.0]
  - - [1760, 64, 1, 1760, 1760, 1760, 1760, 1760]
    - [77, 7854.0]
  - - [1760, 32, 1, 1760, 1760, 1760, 1760, 1760]
    - [101, 5569.0]
  - - [2560, 16, 1, 2560, 2560, 2560, 2560, 2560]
    - [102, 4539.0]
  - - [1760, 16, 1, 1760, 1760, 1760, 1760, 1760]
    - [99, 3056.0]
  - - [8448, 4, 1, 2816, 8448, 8448, 8448, 2816]
    - [102, 3475.0]
  - - [7680, 16, 1, 2560, 7680, 7680, 7680, 2560]
    - [100, 9757.0]
  - - [4608, 1, 1, 1536, 4608, 4608, 4608, 1536]
    - [102, 486.0]
  - - [7680, 4, 1, 2560, 7680, 7680, 7680, 2560]
    - [100, 3046.0]
  - - [8448, 16, 1, 2816, 8448, 8448, 8448, 2816]
    - [103, 10844.0]
  - - [3072, 2, 1, 1024, 3072, 3072, 3072, 1024]
    - [102, 604.0]
  - - [6144, 16, 1, 2560, 6144, 6144, 6144, 2560]
    - [100, 8988.0]
  - - [7680, 1, 1, 2560, 7680, 7680, 7680, 2560]
    - [100, 767.0]
  - - [4608, 4, 1, 1536, 4608, 4608, 4608, 1536]
    - [102, 1939.0]
  - - [3072, 1, 1, 128, 3072, 3072, 3072, 128]
    - [86, 131.0]
  - - [2048, 32, 1, 2048, 2048, 2048, 2048, 2048]
    - [99, 6631.0]
  - - [2048, 16, 1, 2048, 2048, 2048, 2048, 2048]
    - [99, 3671.0]
  - - [8448, 1, 1, 2816, 8448, 8448, 8448, 2816]
    - [102, 870.0]
  - - [6144, 4, 1, 2560, 6144, 6144, 6144, 2560]
    - [102, 2693.0]
  - - [3072, 1, 1, 1024, 3072, 3072, 3072, 1024]
    - [102, 302.0]
  - - [3072, 16, 1, 1024, 3072, 3072, 3072, 1024]
    - [99, 4793.0]
  - - [4096, 16, 1, 4096, 4096, 4096, 4096, 4096]
    - [102, 6954.0]
  - - [6144, 1, 1, 2560, 6144, 6144, 6144, 2560]
    - [102, 674.0]
  - - [3072, 4, 1, 1024, 3072, 3072, 3072, 1024]
    - [102, 1205.0]
  - - [7680, 2, 1, 2560, 7680, 7680, 7680, 2560]
    - [100, 1528.0]
  - - [4224, 1, 1, 128, 4224, 4224, 4224, 128]
    - [86, 178.0]
  - - [8448, 2, 1, 2816, 8448, 8448, 8448, 2816]
    - [101, 1739.0]
  - - [4608, 2, 1, 1536, 4608, 4608, 4608, 1536]
    - [102, 972.0]
  - - [4608, 16, 1, 1536, 4608, 4608, 4608, 1536]
    - [99, 7158.0]
  - - [6144, 2, 1, 2560, 6144, 6144, 6144, 2560]
    - [102, 1344.0]
  - - [1024, 1, 1, 500000, 1024, 1024, 1024, 500000]
    - [79, 131.0]
  - - [1024, 16, 1, 500000, 1024, 1024, 1024, 500000]
    - [79, 2100.0]
  - - [1024, 2, 1, 500000, 1024, 1024, 1024, 500000]
    - [79, 263.0]
  - - [512, 1, 1, 500000, 512, 512, 512, 500000]
    - [78, 67.0]
  - - [1024, 8, 1, 500000, 1024, 1024, 1024, 500000]
    - [88, 1051.0]
  - - [1024, 4, 1, 500000, 1024, 1024, 1024, 500000]
    - [79, 525.0]
  - - [512, 16, 1, 500000, 512, 512, 512, 500000]
    - [79, 1055.0]
  - - [512, 2, 1, 500000, 512, 512, 512, 500000]
    - [78, 133.0]
  - - [512, 8, 1, 500000, 512, 512, 512, 500000]
    - [79, 528.0]
  - - [512, 4, 1, 500000, 512, 512, 512, 500000]
    - [78, 265.0]
  - - [512, 4, 1, 512, 512, 512, 512, 512]
    - [94, 175.0]
  - - [448, 64, 1, 1280, 448, 448, 448, 1280]
    - [76, 3043.0]
  - - [64, 1024, 1, 1280, 64, 64, 64, 1280]
    - [94, 6205.0]
  - - [64, 704, 1, 1280, 64, 64, 64, 1280]
    - [94, 4621.0]
  - - [256, 128, 1, 256, 256, 256, 256, 256]
    - [94, 2255.0]
  - - [64, 1024, 1, 3328, 64, 64, 64, 3328]
    - [94, 6703.0]
  - - [128, 1, 1, 1408, 128, 128, 128, 1408]
    - [83, 14.0]
  - - [1024, 64, 1, 1280, 1024, 1024, 1024, 1280]
    - [94, 6232.0]
  - - [256, 256, 1, 3328, 256, 256, 256, 3328]
    - [94, 6707.0]
  - - [64, 448, 1, 1280, 64, 64, 64, 1280]
    - [76, 3048.0]
  - - [512, 32, 1, 512, 512, 512, 512, 512]
    - [94, 1451.0]
  - - [64, 64, 1, 3328, 64, 64, 64, 3328]
    - [78, 492.0]
  - - [512, 1, 1, 512, 512, 512, 512, 512]
    - [94, 44.0]
  - - [512, 2, 1, 512, 512, 512, 512, 512]
    - [75, 87.0]
  - - [704, 64, 1, 3328, 704, 704, 704, 3328]
    - [86, 5008.0]
  - - [64, 128, 1, 256, 64, 64, 64, 256]
    - [94, 573.0]
  - - [704, 64, 1, 1280, 704, 704, 704, 1280]
    - [94, 4621.0]
  - - [128, 448, 1, 256, 128, 128, 128, 256]
    - [94, 3745.0]
  - - [448, 64, 1, 3328, 448, 448, 448, 3328]
    - [76, 3329.0]
  - - [64, 128, 1, 3328, 64, 64, 64, 3328]
    - [78, 983.0]
  - - [128, 128, 1, 3328, 128, 128, 128, 3328]
    - [79, 1953.0]
  - - [64, 1, 1, 1216, 64, 64, 64, 1216]
    - [76, 7.0]
  - - [256, 256, 1, 256, 256, 256, 256, 256]
    - [94, 4324.0]
  - - [128, 64, 1, 1280, 128, 128, 128, 1280]
    - [83, 883.0]
  - - [64, 1024, 1, 256, 64, 64, 64, 256]
    - [94, 4215.0]
  - - [64, 704, 1, 256, 64, 64, 64, 256]
    - [94, 3051.0]
  - - [1024, 2, 1, 512, 1024, 1024, 1024, 512]
    - [76, 176.0]
  - - [256, 64, 1, 3328, 256, 256, 256, 3328]
    - [79, 1957.0]
  - - [448, 128, 1, 256, 448, 448, 448, 256]
    - [94, 3745.0]
  - - [64, 704, 1, 3328, 64, 64, 64, 3328]
    - [94, 5015.0]
  - - [64, 448, 1, 3328, 64, 64, 64, 3328]
    - [76, 3318.0]
  - - [448, 128, 1, 3328, 448, 448, 448, 3328]
    - [94, 5887.0]
  - - [128, 256, 1, 1280, 128, 128, 128, 1280]
    - [76, 3478.0]
  - - [64, 448, 1, 256, 64, 64, 64, 256]
    - [94, 1973.0]
  - - [64, 256, 1, 1280, 64, 64, 64, 1280]
    - [98, 1759.0]
  - - [64, 128, 1, 1280, 64, 64, 64, 1280]
    - [83, 881.0]
  - - [1024, 32, 1, 512, 1024, 1024, 1024, 512]
    - [94, 2903.0]
  - - [64, 64, 1, 256, 64, 64, 64, 256]
    - [94, 286.0]
  - - [256, 128, 1, 1280, 256, 256, 256, 1280]
    - [94, 3525.0]
  - - [128, 256, 1, 3328, 128, 128, 128, 3328]
    - [76, 3792.0]
  - - [256, 64, 1, 256, 256, 256, 256, 256]
    - [94, 1140.0]
  - - [128, 128, 1, 1280, 128, 128, 128, 1280]
    - [98, 1762.0]
  - - [128, 256, 1, 256, 128, 128, 128, 256]
    - [94, 2255.0]
  - - [256, 64, 1, 1280, 256, 256, 256, 1280]
    - [94, 1780.0]
  - - [704, 64, 1, 256, 704, 704, 704, 256]
    - [94, 3051.0]
  - - [128, 448, 1, 1280, 128, 128, 128, 1280]
    - [94, 5469.0]
  - - [64, 64, 1, 1280, 64, 64, 64, 1280]
    - [94, 444.0]
  - - [128, 64, 1, 3328, 128, 128, 128, 3328]
    - [78, 984.0]
  - - [448, 64, 1, 256, 448, 448, 448, 256]
    - [94, 1973.0]
  - - [1024, 16, 1, 512, 1024, 1024, 1024, 512]
    - [76, 1451.0]
  - - [512, 16, 1, 512, 512, 512, 512, 512]
    - [94, 728.0]
  - - [1024, 64, 1, 256, 1024, 1024, 1024, 256]
    - [94, 4302.0]
  - - [128, 1, 1, 1024, 128, 128, 128, 1024]
    - [76, 13.0]
  - - [448, 128, 1, 1280, 448, 448, 448, 1280]
    - [94, 5502.0]
  - - [1024, 64, 1, 3328, 1024, 1024, 1024, 3328]
    - [94, 6711.0]
  - - [128, 64, 1, 256, 128, 128, 128, 256]
    - [94, 576.0]
  - - [64, 256, 1, 3328, 64, 64, 64, 3328]
    - [79, 1954.0]
  - - [256, 256, 1, 1280, 256, 256, 256, 1280]
    - [94, 6232.0]
  - - [256, 128, 1, 3328, 256, 256, 256, 3328]
    - [94, 3810.0]
  - - [64, 256, 1, 256, 64, 64, 64, 256]
    - [94, 1134.0]
  - - [1024, 4, 1, 512, 1024, 1024, 1024, 512]
    - [94, 350.0]
  - - [128, 448, 1, 3328, 128, 128, 128, 3328]
    - [94, 5890.0]
  - - [1024, 1, 1, 512, 1024, 1024, 1024, 512]
    - [94, 88.0]
  - - [128, 128, 1, 256, 128, 128, 128, 256]
    - [94, 1134.0]
- null
