library/src/blas3/Tensile/Logic/asm_full/navi21_Cijk_Alik_Bljk_HB_GB.yaml
- {MinimumRequiredVersion: 4.26.0}
- navi21
- gfx1030
- [Device 73a2]
    SolutionIndex: 0
    SolutionNameMin: Cijk_Alik_Bljk_HB_MT128x128x8_SN_SU0_SUM0_TT8_16_WG16_8_1_WGM1
    SolutionIndex: 1
    SolutionNameMin: Cijk_Alik_Bljk_HB_MT128x64x16_SN_SU0_SUM0_TT8_8_WG16_8_1_WGM1
    SolutionIndex: 2
    SolutionNameMin: Cijk_Alik_Bljk_HB_MT128x128x16_SN_SU0_SUM0_TT8_16_WG16_8_1_WGM1
    SolutionIndex: 3
    SolutionNameMin: Cijk_Alik_Bljk_HB_MT128x256x16_SN_SU0_SUM0_TT8_16_WG16_16_1_WGM1
    SolutionIndex: 4
    SolutionNameMin: Cijk_Alik_Bljk_HB_MT256x256x16_SN_SU0_SUM0_TT16_16_WG16_16_1_WGM1
    SolutionIndex: 5
    SolutionNameMin: Cijk_Alik_Bljk_HB_MT128x128x32_SN_SU0_SUM0_TT8_16_WG16_8_1_WGM1
    SolutionIndex: 6
    SolutionNameMin: Cijk_Alik_Bljk_HB_MT128x64x16_SN_SU32_SUM3_TT8_8_WG16_8_1_WGM1
    SolutionIndex: 7
    SolutionNameMin: Cijk_Alik_Bljk_HB_MT128x128x16_SN_SU32_SUM3_TT8_16_WG16_8_1_WGM1
    SolutionIndex: 8
    SolutionNameMin: Cijk_Alik_Bljk_HB_MT256x128x16_SN_SU32_SUM3_TT16_16_WG16_8_1_WGM1
    SolutionIndex: 9
    SolutionNameMin: Cijk_Alik_Bljk_HB_MT128x128x16_SN_SU32_SUM3_TT8_8_WG16_16_1_WGM1
    SolutionIndex: 10
    SolutionNameMin: Cijk_Alik_Bljk_HB_MT128x256x16_SN_SU32_SUM3_TT8_16_WG16_16_1_WGM1
    SolutionIndex: 11
    SolutionNameMin: Cijk_Alik_Bljk_HB_MT256x256x16_SN_SU32_SUM3_TT16_16_WG16_16_1_WGM1
    SolutionIndex: 12
    SolutionNameMin: Cijk_Alik_Bljk_HB_MT128x128x32_SN_SU32_SUM3_TT8_16_WG16_8_1_WGM1
    SolutionIndex: 13
    SolutionNameMin: Cijk_Alik_Bljk_HB_MT128x256x8_SN_SU0_SUM0_TT8_16_WG16_16_1_WGM4
    SolutionIndex: 14
    SolutionNameMin: Cijk_Alik_Bljk_HB_MT128x64x16_SN_SU0_SUM0_TT8_8_WG16_8_1_WGM4
    SolutionIndex: 15
    SolutionNameMin: Cijk_Alik_Bljk_HB_MT128x128x16_SN_SU0_SUM0_TT8_16_WG16_8_1_WGM4
    SolutionIndex: 16
    SolutionNameMin: Cijk_Alik_Bljk_HB_MT256x128x16_SN_SU0_SUM0_TT16_16_WG16_8_1_WGM4
    SolutionIndex: 17
    SolutionNameMin: Cijk_Alik_Bljk_HB_MT128x128x16_SN_SU0_SUM0_TT8_8_WG16_16_1_WGM4
    SolutionIndex: 18
    SolutionNameMin: Cijk_Alik_Bljk_HB_MT128x256x16_SN_SU0_SUM0_TT8_16_WG16_16_1_WGM4
    SolutionIndex: 19
    SolutionNameMin: Cijk_Alik_Bljk_HB_MT256x256x16_SN_SU0_SUM0_TT16_16_WG16_16_1_WGM4
    SolutionIndex: 20
    SolutionNameMin: Cijk_Alik_Bljk_HB_MT128x64x16_SN_SU32_SUM3_TT8_8_WG16_8_1_WGM4
    SolutionIndex: 21
    SolutionNameMin: Cijk_Alik_Bljk_HB_MT128x128x16_SN_SU32_SUM3_TT8_16_WG16_8_1_WGM4
    SolutionIndex: 22
    SolutionNameMin: Cijk_Alik_Bljk_HB_MT256x128x16_SN_SU32_SUM3_TT16_16_WG16_8_1_WGM4
    SolutionIndex: 23
    SolutionNameMin: Cijk_Alik_Bljk_HB_MT128x128x16_SN_SU32_SUM3_TT8_8_WG16_16_1_WGM4
    SolutionIndex: 24
    SolutionNameMin: Cijk_Alik_Bljk_HB_MT128x256x16_SN_SU32_SUM3_TT8_16_WG16_16_1_WGM4
    SolutionIndex: 25
    SolutionNameMin: Cijk_Alik_Bljk_HB_MT256x256x16_SN_SU32_SUM3_TT16_16_WG16_16_1_WGM4
    SolutionIndex: 26
    SolutionNameMin: Cijk_Alik_Bljk_HB_MT128x128x32_SN_SU32_SUM3_TT8_16_WG16_8_1_WGM4
    SolutionIndex: 27
    SolutionNameMin: Cijk_Alik_Bljk_HB_MT128x128x16_SN_SU0_SUM0_TT8_16_WG16_8_1_WGM8
    SolutionIndex: 28
    SolutionNameMin: Cijk_Alik_Bljk_HB_MT256x128x16_SN_SU0_SUM0_TT16_16_WG16_8_1_WGM8
    SolutionIndex: 29
    SolutionNameMin: Cijk_Alik_Bljk_HB_MT128x256x16_SN_SU0_SUM0_TT8_16_WG16_16_1_WGM8
    SolutionIndex: 30
    SolutionNameMin: Cijk_Alik_Bljk_HB_MT256x256x16_SN_SU0_SUM0_TT16_16_WG16_16_1_WGM8
    SolutionIndex: 31
    SolutionNameMin: Cijk_Alik_Bljk_HB_MT128x128x32_SN_SU0_SUM0_TT8_16_WG16_8_1_WGM8
    SolutionIndex: 32
    SolutionNameMin: Cijk_Alik_Bljk_HB_MT128x64x16_SN_SU32_SUM3_TT8_8_WG16_8_1_WGM8
    SolutionIndex: 33
    SolutionNameMin: Cijk_Alik_Bljk_HB_MT128x128x16_SN_SU32_SUM3_TT8_16_WG16_8_1_WGM8
    SolutionIndex: 34
    SolutionNameMin: Cijk_Alik_Bljk_HB_MT256x128x16_SN_SU32_SUM3_TT16_16_WG16_8_1_WGM8
    SolutionIndex: 35
    SolutionNameMin: Cijk_Alik_Bljk_HB_MT128x128x16_SN_SU32_SUM3_TT8_8_WG16_16_1_WGM8
    SolutionIndex: 36
    SolutionNameMin: Cijk_Alik_Bljk_HB_MT128x256x16_SN_SU32_SUM3_TT8_16_WG16_16_1_WGM8
    SolutionIndex: 37
    SolutionNameMin: Cijk_Alik_Bljk_HB_MT256x256x16_SN_SU32_SUM3_TT16_16_WG16_16_1_WGM8
    SolutionIndex: 38
    SolutionNameMin: Cijk_Alik_Bljk_HB_MT128x128x32_SN_SU32_SUM3_TT8_16_WG16_8_1_WGM8
    SolutionIndex: 39
    SolutionNameMin: Cijk_Alik_Bljk_HB_MT64x64x16_SN_SU0_SUM0_TT8_8_WG8_8_1_WGM1
    SolutionIndex: 40
    SolutionNameMin: Cijk_Alik_Bljk_HB_MT128x64x16_SN_SU0_SUM0_TT8_8_WG16_8_1_WGM1
    SolutionIndex: 41
    SolutionNameMin: Cijk_Alik_Bljk_HB_MT128x128x16_SN_SU0_SUM0_TT8_8_WG16_16_1_WGM1
    SolutionIndex: 42
    SolutionNameMin: Cijk_Alik_Bljk_HB_MT64x64x16_SN_SU32_SUM3_TT8_8_WG8_8_1_WGM1
    SolutionIndex: 43
    SolutionNameMin: Cijk_Alik_Bljk_HB_MT128x64x16_SN_SU32_SUM3_TT8_8_WG16_8_1_WGM1
    SolutionIndex: 44
    SolutionNameMin: Cijk_Alik_Bljk_HB_MT128x128x16_SN_SU32_SUM3_TT8_8_WG16_16_1_WGM1
    SolutionIndex: 45
    SolutionNameMin: Cijk_Alik_Bljk_HB_MT128x64x32_SN_SU32_SUM3_TT8_8_WG16_8_1_WGM1
    SolutionIndex: 46
    SolutionNameMin: Cijk_Alik_Bljk_HB_MT64x64x16_SN_SU0_SUM0_TT8_8_WG8_8_1_WGM4
    SolutionIndex: 47
    SolutionNameMin: Cijk_Alik_Bljk_HB_MT128x64x16_SN_SU0_SUM0_TT8_8_WG16_8_1_WGM4
    SolutionIndex: 48
    SolutionNameMin: Cijk_Alik_Bljk_HB_MT128x128x16_SN_SU0_SUM0_TT8_8_WG16_16_1_WGM4
    SolutionIndex: 49
    SolutionNameMin: Cijk_Alik_Bljk_HB_MT128x64x8_SN_SU32_SUM3_TT8_8_WG16_8_1_WGM4
    SolutionIndex: 50
    SolutionNameMin: Cijk_Alik_Bljk_HB_MT128x128x8_SN_SU32_SUM3_TT8_8_WG16_16_1_WGM4
    SolutionIndex: 51
    SolutionNameMin: Cijk_Alik_Bljk_HB_MT64x64x16_SN_SU32_SUM3_TT8_8_WG8_8_1_WGM4
    SolutionIndex: 52
    SolutionNameMin: Cijk_Alik_Bljk_HB_MT128x64x16_SN_SU32_SUM3_TT8_8_WG16_8_1_WGM4
    SolutionIndex: 53
    SolutionNameMin: Cijk_Alik_Bljk_HB_MT128x128x16_SN_SU32_SUM3_TT8_8_WG16_16_1_WGM4
    SolutionIndex: 54
    SolutionNameMin: Cijk_Alik_Bljk_HB_MT64x64x16_SN_SU0_SUM0_TT8_8_WG8_8_1_WGM8
    SolutionIndex: 55
    SolutionNameMin: Cijk_Alik_Bljk_HB_MT128x64x16_SN_SU0_SUM0_TT8_8_WG16_8_1_WGM8
    SolutionIndex: 56
    SolutionNameMin: Cijk_Alik_Bljk_HB_MT64x64x32_SN_SU0_SUM0_TT8_8_WG8_8_1_WGM8
    SolutionIndex: 57
    SolutionNameMin: Cijk_Alik_Bljk_HB_MT128x128x8_SN_SU32_SUM3_TT8_8_WG16_16_1_WGM8
    SolutionIndex: 58
    SolutionNameMin: Cijk_Alik_Bljk_HB_MT64x64x16_SN_SU32_SUM3_TT8_8_WG8_8_1_WGM8
    SolutionIndex: 59
    SolutionNameMin: Cijk_Alik_Bljk_HB_MT128x64x16_SN_SU32_SUM3_TT8_8_WG16_8_1_WGM8
    SolutionIndex: 60
    SolutionNameMin: Cijk_Alik_Bljk_HB_MT128x128x16_SN_SU32_SUM3_TT8_8_WG16_16_1_WGM8
    SolutionIndex: 61
    SolutionNameMin: Cijk_Alik_Bljk_HB_MT16x16x8_SN_SU0_SUM0_TT2_2_WG8_8_1_WGM1
    SolutionIndex: 62
    SolutionNameMin: Cijk_Alik_Bljk_HB_MT32x16x8_SN_SU0_SUM0_TT2_2_WG16_8_1_WGM1
    SolutionIndex: 63
    SolutionNameMin: Cijk_Alik_Bljk_HB_MT64x32x8_SN_SU0_SUM0_TT4_4_WG16_8_1_WGM1
    SolutionIndex: 64
    SolutionNameMin: Cijk_Alik_Bljk_HB_MT64x64x8_SN_SU0_SUM0_TT4_4_WG16_16_1_WGM1
    SolutionIndex: 65
    SolutionNameMin: Cijk_Alik_Bljk_HB_MT16x16x16_SN_SU0_SUM0_TT2_2_WG8_8_1_WGM1
    SolutionIndex: 66
    SolutionNameMin: Cijk_Alik_Bljk_HB_MT16x16x32_SN_SU0_SUM0_TT2_2_WG8_8_1_WGM1
    SolutionIndex: 67
    SolutionNameMin: Cijk_Alik_Bljk_HB_MT16x16x8_SN_SU32_SUM3_TT2_2_WG8_8_1_WGM1
    SolutionIndex: 68
    SolutionNameMin: Cijk_Alik_Bljk_HB_MT32x32x8_SN_SU32_SUM3_TT4_4_WG8_8_1_WGM1
    SolutionIndex: 69
    SolutionNameMin: Cijk_Alik_Bljk_HB_MT32x16x8_SN_SU32_SUM3_TT2_2_WG16_8_1_WGM1
    SolutionIndex: 70
    SolutionNameMin: Cijk_Alik_Bljk_HB_MT64x32x8_SN_SU32_SUM3_TT4_4_WG16_8_1_WGM1
    SolutionIndex: 71
    SolutionNameMin: Cijk_Alik_Bljk_HB_MT64x64x8_SN_SU32_SUM3_TT4_4_WG16_16_1_WGM1
    SolutionIndex: 72
    SolutionNameMin: Cijk_Alik_Bljk_HB_MT16x16x16_SN_SU32_SUM3_TT2_2_WG8_8_1_WGM1
    SolutionIndex: 73
    SolutionNameMin: Cijk_Alik_Bljk_HB_MT32x16x16_SN_SU32_SUM3_TT2_2_WG16_8_1_WGM1
    SolutionIndex: 74
    SolutionNameMin: Cijk_Alik_Bljk_HB_MT64x32x16_SN_SU32_SUM3_TT4_4_WG16_8_1_WGM1
    SolutionIndex: 75
    SolutionNameMin: Cijk_Alik_Bljk_HB_MT64x32x8_SN_SU0_SUM0_TT4_4_WG16_8_1_WGM4
    SolutionIndex: 76
    SolutionNameMin: Cijk_Alik_Bljk_HB_MT64x64x8_SN_SU0_SUM0_TT4_4_WG16_16_1_WGM4
    SolutionIndex: 77
    SolutionNameMin: Cijk_Alik_Bljk_HB_MT16x16x16_SN_SU0_SUM0_TT2_2_WG8_8_1_WGM4
    SolutionIndex: 78
    SolutionNameMin: Cijk_Alik_Bljk_HB_MT16x16x32_SN_SU0_SUM0_TT2_2_WG8_8_1_WGM4
    SolutionIndex: 79
    SolutionNameMin: Cijk_Alik_Bljk_HB_MT32x32x8_SN_SU32_SUM3_TT4_4_WG8_8_1_WGM4
    SolutionIndex: 80
    SolutionNameMin: Cijk_Alik_Bljk_HB_MT64x32x8_SN_SU32_SUM3_TT4_4_WG16_8_1_WGM4
    SolutionIndex: 81
    SolutionNameMin: Cijk_Alik_Bljk_HB_MT64x64x8_SN_SU32_SUM3_TT4_4_WG16_16_1_WGM4
    SolutionIndex: 82
    SolutionNameMin: Cijk_Alik_Bljk_HB_MT16x16x16_SN_SU32_SUM3_TT2_2_WG8_8_1_WGM4
    SolutionIndex: 83
    SolutionNameMin: Cijk_Alik_Bljk_HB_MT32x32x16_SN_SU32_SUM3_TT4_4_WG8_8_1_WGM4
    SolutionIndex: 84
    SolutionNameMin: Cijk_Alik_Bljk_HB_MT16x16x8_SN_SU0_SUM0_TT2_2_WG8_8_1_WGM8
    SolutionIndex: 85
    SolutionNameMin: Cijk_Alik_Bljk_HB_MT64x32x8_SN_SU0_SUM0_TT4_4_WG16_8_1_WGM8
    SolutionIndex: 86
    SolutionNameMin: Cijk_Alik_Bljk_HB_MT64x64x8_SN_SU0_SUM0_TT4_4_WG16_16_1_WGM8
    SolutionIndex: 87
    SolutionNameMin: Cijk_Alik_Bljk_HB_MT16x16x16_SN_SU0_SUM0_TT2_2_WG8_8_1_WGM8
    SolutionIndex: 88
    SolutionNameMin: Cijk_Alik_Bljk_HB_MT16x16x8_SN_SU32_SUM3_TT2_2_WG8_8_1_WGM8
    SolutionIndex: 89
    SolutionNameMin: Cijk_Alik_Bljk_HB_MT32x32x8_SN_SU32_SUM3_TT4_4_WG8_8_1_WGM8
    SolutionIndex: 90
    SolutionNameMin: Cijk_Alik_Bljk_HB_MT64x32x8_SN_SU32_SUM3_TT4_4_WG16_8_1_WGM8
    SolutionIndex: 91
    SolutionNameMin: Cijk_Alik_Bljk_HB_MT32x32x8_SN_SU32_SUM3_TT2_2_WG16_16_1_WGM8
    SolutionIndex: 92
    SolutionNameMin: Cijk_Alik_Bljk_HB_MT64x64x8_SN_SU32_SUM3_TT4_4_WG16_16_1_WGM8
    SolutionIndex: 93
    SolutionNameMin: Cijk_Alik_Bljk_HB_MT32x16x16_SN_SU32_SUM3_TT2_2_WG16_8_1_WGM8
    SolutionIndex: 94
    SolutionNameMin: Cijk_Alik_Bljk_HB_MT64x32x16_SN_SU32_SUM3_TT4_4_WG16_8_1_WGM8
    SolutionIndex: 95
    SolutionNameMin: Cijk_Alik_Bljk_HB_MT64x64x16_SN_SU32_SUM3_TT4_4_WG16_16_1_WGM8
    SolutionIndex: 96
    SolutionNameMin: Cijk_Alik_Bljk_HB_MT16x16x32_SN_SU32_SUM3_TT2_2_WG8_8_1_WGM8
    SolutionIndex: 97
    SolutionNameMin: Cijk_Alik_Bljk_HB_MT64x16x16_SN_SU32_SUM3_TT4_2_WG16_8_1_WGM1
    SolutionIndex: 98
    SolutionNameMin: Cijk_Alik_Bljk_HB_MT64x16x16_SN_SU32_SUM3_TT4_2_WG16_8_1_WGM4
    SolutionIndex: 99
    SolutionNameMin: Cijk_Alik_Bljk_HB_GB_MT128x64x16_SN_SU0_SUM0_SUS0_TT8_8_WG16_8_1_WGM8
    SolutionIndex: 100
    SolutionNameMin: Cijk_Alik_Bljk_HB_GB_MT128x64x16_SN_SU32_SUM3_SUS128_TT8_8_WG16_8_1_WGM1
    SolutionIndex: 101
    SolutionNameMin: Cijk_Alik_Bljk_HB_GB_MT128x64x16_SN_SU32_SUM3_SUS128_TT8_8_WG16_8_1_WGM4
    SolutionIndex: 102
    SolutionNameMin: Cijk_Alik_Bljk_HB_GB_MT128x64x16_SN_SU32_SUM3_SUS128_TT8_8_WG16_8_1_WGM8
- - - [2944, 4288, 1, 1280]
    - [10, 92.407]
  - - [2368, 5888, 1, 256]
    - [10, 83.061]
  - - [5888, 1856, 1, 256]
    - [33, 83.507]
  - - [704, 6784, 1, 256]
    - [33, 71.142]
  - - [512, 24000, 1, 1536]
    - [24, 90.336]
  - - [5888, 1856, 1, 3328]
    - [16, 86.738]
  - - [5056, 704, 1, 256]
    - [21, 66.221]
  - - [5888, 2944, 1, 3328]
    - [16, 94.1]
  - - [1856, 4288, 1, 256]
    - [36, 73.896]
  - - [5056, 5056, 1, 3328]
    - [36, 93.34]
  - - [1408, 5888, 1, 1280]
    - [18, 84.021]
  - - [1024, 3584, 1, 3328]
    - [24, 74.831]
  - - [512, 48000, 1, 2048]
    - [34, 96.287]
  - - [448, 3584, 1, 3328]
    - [10, 60.069]
  - - [5888, 1408, 1, 1280]
    - [36, 84.059]
  - - [1024, 2368, 1, 256]
    - [20, 63.749]
  - - [5056, 6784, 1, 1280]
    - [36, 95.681]
  - - [5056, 5056, 1, 1280]
    - [36, 92.855]
  - - [448, 5056, 1, 256]
    - [6, 58.403]
  - - [6784, 448, 1, 256]
    - [9, 59.746]
  - - [1760, 6400, 1, 1760]
    - [29, 93.222]
  - - [5888, 704, 1, 1280]
    - [36, 79.434]
  - - [6784, 4288, 1, 3328]
    - [18, 94.198]
  - - [1856, 2368, 1, 3328]
    - [38, 72.644]
  - - [5888, 2944, 1, 1280]
    - [16, 91.38]
  - - [5888, 1024, 1, 256]
    - [21, 82.123]
  - - [16384, 3200, 1, 4096]
    - [11, 84.105]
  - - [1408, 2944, 1, 256]
    - [35, 67.836]
  - - [6784, 5056, 1, 3328]
    - [3, 96.012]
  - - [5056, 5056, 1, 256]
    - [7, 89.576]
  - - [1024, 3584, 1, 1280]
    - [7, 79.244]
  - - [2368, 2944, 1, 1280]
    - [27, 80.16]
  - - [6784, 6784, 1, 1280]
    - [10, 96.484]
  - - [1408, 4288, 1, 1280]
    - [18, 78.692]
  - - [3584, 4288, 1, 1280]
    - [10, 89.851]
  - - [2368, 704, 1, 1280]
    - [18, 59.305]
  - - [5056, 4288, 1, 3328]
    - [36, 95.433]
  - - [3584, 2368, 1, 3328]
    - [18, 86.174]
  - - [6784, 448, 1, 1280]
    - [21, 74.624]
  - - [4288, 2944, 1, 256]
    - [21, 87.008]
  - - [6144, 24000, 1, 2560]
    - [4, 97.377]
  - - [5056, 2368, 1, 1280]
    - [34, 86.661]
  - - [448, 3584, 1, 1280]
    - [10, 58.03]
  - - [6784, 5888, 1, 256]
    - [10, 96.482]
  - - [1024, 1408, 1, 256]
    - [32, 59.811]
  - - [2368, 2368, 1, 3328]
    - [18, 75.6]
  - - [5056, 704, 1, 3328]
    - [36, 71.984]
  - - [1408, 1856, 1, 256]
    - [35, 62.669]
  - - [3584, 2368, 1, 1280]
    - [36, 85.646]
  - - [704, 5888, 1, 256]
    - [36, 70.645]
  - - [2560, 1600, 1, 2560]
    - [37, 80.15]
  - - [6144, 5984, 1, 2048]
    - [25, 95.886]
  - - [3584, 704, 1, 3328]
    - [15, 70.098]
  - - [1408, 1408, 1, 256]
    - [23, 60.701]
  - - [448, 4288, 1, 256]
    - [6, 54.545]
  - - [704, 2368, 1, 1280]
    - [3, 60.024]
  - - [1856, 2368, 1, 1280]
    - [5, 70.614]
  - - [1408, 1024, 1, 1280]
    - [21, 64.849]
  - - [6784, 704, 1, 256]
    - [23, 65.953]
  - - [2048, 1600, 1, 512]
    - [21, 72.266]
  - - [2048, 7000, 1, 2048]
    - [25, 84.455]
  - - [1408, 3584, 1, 256]
    - [18, 76.951]
  - - [3584, 4288, 1, 3328]
    - [19, 91.356]
  - - [5888, 1856, 1, 1280]
    - [16, 84.869]
  - - [5056, 1024, 1, 3328]
    - [10, 83.984]
  - - [2368, 3584, 1, 1280]
    - [18, 85.39]
  - - [2944, 3584, 1, 3328]
    - [18, 96.294]
  - - [6784, 2944, 1, 256]
    - [33, 92.653]
  - - [4288, 2368, 1, 3328]
    - [19, 84.071]
  - - [1856, 2368, 1, 256]
    - [33, 71.619]
  - - [3584, 6784, 1, 3328]
    - [18, 96.516]
  - - [5056, 4288, 1, 1280]
    - [24, 94.505]
  - - [6784, 1856, 1, 3328]
    - [36, 87.278]
  - - [1408, 5056, 1, 1280]
    - [18, 81.402]
  - - [6784, 5888, 1, 3328]
    - [3, 98.626]
  - - [8448, 12000, 1, 2816]
    - [16, 99.149]
  - - [4096, 800, 1, 1024]
    - [21, 69.059]
  - - [8192, 3200, 1, 2048]
    - [11, 89.441]
  - - [2368, 5056, 1, 1280]
    - [18, 88.247]
  - - [1024, 5056, 1, 1280]
    - [24, 81.612]
  - - [4288, 1024, 1, 256]
    - [10, 74.667]
  - - [2368, 1408, 1, 256]
    - [9, 68.786]
  - - [5888, 448, 1, 1280]
    - [7, 66.127]
  - - [704, 5888, 1, 3328]
    - [36, 82.716]
  - - [1024, 6784, 1, 1280]
    - [10, 91.401]
  - - [3584, 2944, 1, 1280]
    - [36, 86.162]
  - - [512, 24000, 1, 2048]
    - [34, 90.418]
  - - [1408, 5056, 1, 3328]
    - [22, 81.911]
  - - [1856, 1856, 1, 3328]
    - [10, 69.7]
  - - [2560, 800, 1, 2560]
    - [34, 69.476]
  - - [2368, 2368, 1, 256]
    - [35, 67.976]
  - - [4288, 4288, 1, 1280]
    - [27, 90.297]
  - - [5888, 1024, 1, 1280]
    - [27, 82.444]
  - - [512, 48000, 1, 2560]
    - [22, 96.188]
  - - [704, 6784, 1, 3328]
    - [24, 75.993]
  - - [2560, 6400, 1, 2560]
    - [25, 96.911]
  - - [5056, 1024, 1, 1280]
    - [18, 81.988]
  - - [448, 5888, 1, 3328]
    - [10, 69.676]
  - - [1024, 2944, 1, 1280]
    - [7, 75.793]
  - - [5056, 5888, 1, 1280]
    - [24, 95.79]
  - - [448, 6784, 1, 256]
    - [7, 64.075]
  - - [3584, 5888, 1, 256]
    - [36, 93.473]
  - - [2944, 3584, 1, 256]
    - [18, 92.072]
  - - [6784, 1024, 1, 3328]
    - [10, 94.203]
  - - [6784, 2944, 1, 3328]
    - [10, 92.689]
  - - [2944, 5056, 1, 3328]
    - [18, 94.553]
  - - [6784, 2368, 1, 1280]
    - [24, 88.829]
  - - [4288, 5888, 1, 1280]
    - [10, 95.718]
  - - [4288, 4288, 1, 256]
    - [33, 87.174]
  - - [4288, 1856, 1, 1280]
    - [27, 82.851]
  - - [1856, 2944, 1, 3328]
    - [29, 87.57]
  - - [256, 6784, 1, 3328]
    - [35, 77.45]
  - - [5056, 1024, 1, 256]
    - [10, 75.41]
  - - [5056, 1856, 1, 3328]
    - [36, 86.299]
  - - [1856, 1408, 1, 256]
    - [23, 62.476]
  - - [4096, 7000, 1, 4096]
    - [11, 92.496]
  - - [5056, 256, 1, 3328]
    - [7, 59.163]
  - - [1024, 5888, 1, 1280]
    - [2, 82.861]
  - - [6144, 24000, 1, 2048]
    - [11, 93.605]
  - - [5056, 3584, 1, 256]
    - [7, 88.199]
  - - [1856, 1024, 1, 1280]
    - [3, 67.438]
  - - [1856, 1856, 1, 1280]
    - [18, 68.145]
  - - [4096, 400, 1, 1024]
    - [21, 55.553]
  - - [3072, 24000, 1, 1024]
    - [34, 97.555]
  - - [1856, 1024, 1, 3328]
    - [10, 70.648]
  - - [5888, 5888, 1, 3328]
    - [30, 97.48]
  - - [6784, 1024, 1, 256]
    - [29, 84.049]
  - - [5056, 5888, 1, 3328]
    - [36, 96.236]
  - - [1856, 1024, 1, 256]
    - [23, 54.015]
  - - [512, 48000, 1, 1536]
    - [22, 96.168]
  - - [5056, 1408, 1, 3328]
    - [36, 83.319]
  - - [8448, 5984, 1, 2816]
    - [34, 97.249]
  - - [4288, 1024, 1, 3328]
    - [18, 87.054]
  - - [1024, 24000, 1, 2560]
    - [22, 93.118]
  - - [2944, 1408, 1, 3328]
    - [36, 82.82]
  - - [2944, 4288, 1, 3328]
    - [18, 94.428]
  - - [5056, 2944, 1, 256]
    - [21, 88.843]
  - - [2368, 1856, 1, 256]
    - [23, 69.244]
  - - [1408, 3584, 1, 3328]
    - [18, 81.272]
  - - [2368, 6784, 1, 256]
    - [18, 84.307]
  - - [5056, 1408, 1, 1280]
    - [24, 82.316]
  - - [704, 3584, 1, 1280]
    - [7, 72.999]
  - - [1408, 5888, 1, 3328]
    - [18, 85.156]
  - - [1856, 5056, 1, 256]
    - [21, 79.068]
  - - [6784, 6784, 1, 256]
    - [21, 94.394]
  - - [2368, 4288, 1, 1280]
    - [10, 90.309]
  - - [3584, 1856, 1, 1280]
    - [16, 81.515]
  - - [5888, 5056, 1, 256]
    - [21, 91.216]
  - - [8448, 48000, 1, 2816]
    - [34, 100.649]
  - - [3584, 448, 1, 256]
    - [20, 53.983]
  - - [3584, 3584, 1, 1280]
    - [36, 95.831]
  - - [256, 6784, 1, 256]
    - [23, 67.255]
  - - [1856, 3584, 1, 3328]
    - [18, 89.374]
  - - [5056, 256, 1, 1280]
    - [14, 57.579]
  - - [3584, 3584, 1, 256]
    - [18, 91.37]
  - - [6784, 4288, 1, 1280]
    - [10, 93.815]
  - - [704, 5056, 1, 256]
    - [33, 66.3]
  - - [2944, 2368, 1, 1280]
    - [24, 80.454]
  - - [6784, 3584, 1, 256]
    - [18, 94.015]
  - - [2944, 2944, 1, 3328]
    - [18, 88.833]
  - - [5056, 6784, 1, 256]
    - [21, 93.371]
  - - [1408, 4288, 1, 3328]
    - [19, 81.318]
  - - [6784, 256, 1, 1280]
    - [9, 75.709]
  - - [2368, 704, 1, 3328]
    - [24, 62.654]
  - - [3584, 6784, 1, 256]
    - [33, 93.082]
  - - [5056, 1856, 1, 256]
    - [21, 82.468]
  - - [4608, 5984, 1, 1536]
    - [37, 95.018]
  - - [1760, 3200, 1, 1760]
    - [2, 88.655]
  - - [4096, 1600, 1, 1024]
    - [22, 80.9]
  - - [704, 4288, 1, 256]
    - [33, 62.616]
  - - [1408, 6784, 1, 1280]
    - [18, 86.328]
  - - [7680, 24000, 1, 2560]
    - [25, 98.954]
  - - [4608, 48000, 1, 1536]
    - [10, 98.85]
  - - [6144, 48000, 1, 2048]
    - [11, 95.315]
  - - [1024, 24000, 1, 1536]
    - [22, 95.874]
  - - [5056, 2368, 1, 3328]
    - [16, 87.473]
  - - [2944, 4288, 1, 256]
    - [18, 84.517]
  - - [1408, 3584, 1, 1280]
    - [18, 80.741]
  - - [8192, 1600, 1, 2048]
    - [10, 77.134]
  - - [512, 24000, 1, 2560]
    - [22, 89.723]
  - - [2368, 6784, 1, 3328]
    - [36, 88.6]
  - - [5056, 704, 1, 1280]
    - [21, 73.553]
  - - [1856, 4288, 1, 3328]
    - [25, 81.718]
  - - [1408, 5888, 1, 256]
    - [10, 80.896]
  - - [3584, 704, 1, 1280]
    - [33, 72.577]
  - - [3584, 448, 1, 3328]
    - [29, 59.558]
  - - [704, 2368, 1, 3328]
    - [10, 63.055]
  - - [448, 5056, 1, 3328]
    - [7, 67.783]
  - - [4288, 448, 1, 256]
    - [17, 53.607]
  - - [448, 5888, 1, 256]
    - [7, 57.576]
  - - [2048, 3200, 1, 512]
    - [22, 81.072]
  - - [5888, 2368, 1, 256]
    - [33, 85.689]
  - - [6784, 704, 1, 3328]
    - [24, 77.385]
  - - [1408, 2944, 1, 3328]
    - [36, 83.316]
  - - [4608, 12000, 1, 1536]
    - [10, 97.61]
  - - [2368, 704, 1, 256]
    - [9, 45.534]
  - - [3584, 2368, 1, 256]
    - [33, 83.051]
  - - [5888, 5056, 1, 1280]
    - [10, 95.228]
  - - [8448, 24000, 1, 2816]
    - [16, 99.93]
  - - [3584, 3584, 1, 3328]
    - [18, 95.773]
  - - [5888, 6784, 1, 256]
    - [21, 94.922]
  - - [4288, 2944, 1, 3328]
    - [16, 91.65]
  - - [256, 5056, 1, 1280]
    - [14, 61.649]
  - - [6784, 5888, 1, 1280]
    - [10, 98.568]
  - - [2048, 800, 1, 512]
    - [36, 55.845]
  - - [5888, 4288, 1, 1280]
    - [10, 95.108]
  - - [1024, 24000, 1, 2048]
    - [37, 92.318]
  - - [1408, 1856, 1, 1280]
    - [33, 71.263]
  - - [5888, 448, 1, 3328]
    - [10, 68.282]
  - - [704, 5888, 1, 1280]
    - [10, 81.959]
  - - [1024, 6784, 1, 3328]
    - [25, 93.355]
  - - [704, 2944, 1, 1280]
    - [10, 73.124]
  - - [5056, 2944, 1, 3328]
    - [16, 92.31]
  - - [1408, 1408, 1, 3328]
    - [36, 74.814]
  - - [448, 4288, 1, 1280]
    - [36, 67.916]
  - - [3584, 704, 1, 256]
    - [32, 65.828]
  - - [3584, 1408, 1, 3328]
    - [18, 80.715]
  - - [2368, 1024, 1, 1280]
    - [21, 68.851]
  - - [2944, 6784, 1, 1280]
    - [24, 92.125]
  - - [1856, 6784, 1, 256]
    - [18, 81.368]
  - - [4288, 448, 1, 3328]
    - [18, 71.815]
  - - [4288, 3584, 1, 1280]
    - [10, 90.787]
  - - [6144, 12000, 1, 2048]
    - [11, 91.295]
  - - [8192, 800, 1, 2048]
    - [12, 67.209]
  - - [5888, 1024, 1, 3328]
    - [10, 82.294]
  - - [704, 6784, 1, 1280]
    - [36, 75.779]
  - - [704, 5056, 1, 1280]
    - [33, 75.733]
  - - [2944, 1856, 1, 256]
    - [35, 70.71]
  - - [3584, 5056, 1, 256]
    - [21, 87.51]
  - - [5888, 5056, 1, 3328]
    - [4, 96.13]
  - - [3584, 6784, 1, 1280]
    - [36, 95.708]
  - - [1856, 5888, 1, 256]
    - [18, 82.668]
  - - [4288, 4288, 1, 3328]
    - [29, 90.502]
  - - [4288, 1408, 1, 1280]
    - [10, 80.486]
  - - [4288, 2368, 1, 256]
    - [21, 82.299]
  - - [2944, 5056, 1, 1280]
    - [10, 93.687]
  - - [6784, 2368, 1, 3328]
    - [10, 89.545]
  - - [4288, 1856, 1, 3328]
    - [18, 81.677]
  - - [1856, 2944, 1, 1280]
    - [18, 86.21]
  - - [2048, 1600, 1, 2048]
    - [26, 69.594]
  - - [4288, 6784, 1, 3328]
    - [19, 94.104]
  - - [3584, 1024, 1, 1280]
    - [33, 75.135]
  - - [1024, 4288, 1, 256]
    - [20, 71.668]
  - - [5888, 3584, 1, 3328]
    - [10, 97.864]
  - - [5056, 3584, 1, 3328]
    - [36, 94.649]
  - - [2368, 1408, 1, 1280]
    - [27, 75.014]
  - - [5056, 2944, 1, 1280]
    - [16, 89.933]
  - - [1024, 6784, 1, 256]
    - [7, 86.663]
  - - [3584, 2944, 1, 256]
    - [33, 90.034]
  - - [3584, 1408, 1, 1280]
    - [36, 79.005]
  - - [5056, 6784, 1, 3328]
    - [19, 96.277]
  - - [3584, 4288, 1, 256]
    - [33, 84.235]
  - - [1856, 6784, 1, 3328]
    - [18, 87.355]
  - - [5056, 1408, 1, 256]
    - [7, 80.659]
  - - [3584, 1024, 1, 256]
    - [33, 74.228]
  - - [5888, 5888, 1, 256]
    - [36, 94.625]
  - - [4288, 1024, 1, 1280]
    - [18, 85.894]
  - - [448, 6784, 1, 3328]
    - [36, 79.396]
  - - [2944, 1408, 1, 1280]
    - [36, 81.467]
  - - [2944, 1856, 1, 3328]
    - [29, 74.45]
  - - [3584, 5888, 1, 1280]
    - [36, 97.333]
  - - [6784, 1856, 1, 1280]
    - [24, 86.567]
  - - [5888, 256, 1, 3328]
    - [21, 70.308]
  - - [1856, 5888, 1, 3328]
    - [18, 89.55]
  - - [3584, 1408, 1, 256]
    - [33, 81.759]
  - - [704, 3584, 1, 3328]
    - [33, 73.633]
  - - [4096, 3200, 1, 1024]
    - [22, 88.127]
  - - [5056, 448, 1, 1280]
    - [33, 64.815]
  - - [3584, 1856, 1, 3328]
    - [28, 86.4]
  - - [2944, 1024, 1, 256]
    - [29, 70.329]
  - - [2368, 4288, 1, 3328]
    - [18, 91.905]
  - - [1024, 1408, 1, 1280]
    - [1, 66.18]
  - - [6784, 5056, 1, 256]
    - [21, 92.127]
  - - [3584, 5056, 1, 3328]
    - [30, 94.358]
  - - [4288, 5888, 1, 256]
    - [10, 92.327]
  - - [2944, 6784, 1, 256]
    - [33, 92.46]
  - - [2368, 2368, 1, 1280]
    - [18, 74.592]
  - - [1856, 3584, 1, 1280]
    - [18, 87.522]
  - - [5056, 3584, 1, 1280]
    - [10, 93.986]
  - - [256, 5888, 1, 256]
    - [23, 58.666]
  - - [1856, 1408, 1, 3328]
    - [33, 71.846]
  - - [1024, 4288, 1, 3328]
    - [10, 87.659]
  - - [2944, 2368, 1, 3328]
    - [18, 81.501]
  - - [704, 4288, 1, 3328]
    - [24, 79.073]
  - - [1024, 1856, 1, 1280]
    - [29, 67.814]
  - - [2048, 6400, 1, 2048]
    - [25, 90.186]
  - - [512, 48000, 1, 2816]
    - [34, 97.591]
  - - [5124, 9124, 1, 2560]
    - [10, 92.156]
  - - [1024, 5888, 1, 256]
    - [7, 77.667]
  - - [1408, 2368, 1, 256]
    - [35, 67.171]
  - - [2944, 704, 1, 3328]
    - [24, 77.25]
  - - [2944, 2944, 1, 1280]
    - [24, 87.621]
  - - [6784, 256, 1, 3328]
    - [9, 76.861]
  - - [1408, 5056, 1, 256]
    - [18, 73.582]
  - - [4608, 24000, 1, 1536]
    - [10, 98.293]
  - - [1408, 4288, 1, 256]
    - [35, 70.665]
  - - [5888, 2368, 1, 1280]
    - [24, 88.51]
  - - [2368, 5888, 1, 1280]
    - [10, 87.748]
  - - [5888, 256, 1, 1280]
    - [33, 67.957]
  - - [2368, 1856, 1, 3328]
    - [31, 73.083]
  - - [2944, 704, 1, 256]
    - [35, 59.616]
  - - [2368, 6784, 1, 1280]
    - [18, 88.532]
  - - [2368, 1024, 1, 3328]
    - [33, 71.492]
  - - [1856, 4288, 1, 1280]
    - [29, 79.741]
  - - [704, 3584, 1, 256]
    - [9, 63.262]
  - - [704, 2944, 1, 3328]
    - [10, 77.587]
  - - [1856, 5056, 1, 3328]
    - [29, 85.4]
  - - [3584, 5056, 1, 1280]
    - [36, 92.925]
  - - [2944, 1024, 1, 3328]
    - [10, 80.068]
  - - [1408, 6784, 1, 256]
    - [21, 84.862]
  - - [6784, 1408, 1, 3328]
    - [10, 87.546]
  - - [1024, 2368, 1, 1280]
    - [21, 70.035]
  - - [6784, 2944, 1, 1280]
    - [10, 92.057]
  - - [3584, 448, 1, 1280]
    - [33, 56.443]
  - - [2944, 6784, 1, 3328]
    - [25, 92.667]
  - - [448, 5056, 1, 1280]
    - [7, 65.02]
  - - [4288, 704, 1, 256]
    - [21, 62.49]
  - - [5888, 704, 1, 256]
    - [33, 70.918]
  - - [256, 5888, 1, 3328]
    - [7, 70.628]
  - - [6784, 4288, 1, 256]
    - [33, 90.589]
  - - [5888, 256, 1, 256]
    - [35, 58.152]
  - - [6784, 1024, 1, 1280]
    - [10, 93.555]
  - - [2944, 704, 1, 1280]
    - [24, 73.158]
  - - [6784, 3584, 1, 1280]
    - [10, 96.552]
  - - [1408, 2944, 1, 1280]
    - [29, 81.26]
  - - [2048, 800, 1, 2048]
    - [24, 60.641]
  - - [1408, 2368, 1, 3328]
    - [33, 76.924]
  - - [2368, 2944, 1, 256]
    - [33, 73.486]
  - - [2944, 5888, 1, 256]
    - [10, 92.291]
  - - [3584, 1856, 1, 256]
    - [21, 78.872]
  - - [4288, 2944, 1, 1280]
    - [28, 89.955]
  - - [5056, 448, 1, 3328]
    - [33, 67.713]
  - - [4288, 5056, 1, 3328]
    - [18, 95.079]
  - - [256, 5056, 1, 3328]
    - [14, 60.06]
  - - [5056, 2368, 1, 256]
    - [21, 84.194]
  - - [4288, 704, 1, 3328]
    - [36, 78.983]
  - - [448, 3584, 1, 256]
    - [1, 51.037]
  - - [1024, 1408, 1, 3328]
    - [7, 67.667]
  - - [2944, 5888, 1, 1280]
    - [10, 95.836]
  - - [5888, 3584, 1, 256]
    - [29, 94.751]
  - - [1408, 1856, 1, 3328]
    - [33, 72.613]
  - - [6784, 1408, 1, 1280]
    - [10, 86.343]
  - - [704, 2944, 1, 256]
    - [9, 61.743]
  - - [2944, 5888, 1, 3328]
    - [18, 95.843]
  - - [1408, 6784, 1, 3328]
    - [18, 87.013]
  - - [1408, 1408, 1, 1280]
    - [36, 71.031]
  - - [16384, 400, 1, 4096]
    - [11, 64.422]
  - - [448, 4288, 1, 3328]
    - [36, 71.335]
  - - [704, 2368, 1, 256]
    - [20, 53.154]
  - - [5888, 2368, 1, 3328]
    - [10, 89.202]
  - - [5124, 9124, 1, 1760]
    - [18, 96.024]
  - - [4288, 5056, 1, 256]
    - [33, 88.452]
  - - [4288, 448, 1, 1280]
    - [29, 66.739]
  - - [5888, 704, 1, 3328]
    - [36, 82.581]
  - - [4288, 3584, 1, 3328]
    - [25, 91.394]
  - - [1408, 1024, 1, 256]
    - [35, 56.399]
  - - [8192, 400, 1, 2048]
    - [24, 64.448]
  - - [2560, 7000, 1, 2560]
    - [25, 93.087]
  - - [6784, 6784, 1, 3328]
    - [3, 96.815]
  - - [704, 5056, 1, 3328]
    - [36, 71.487]
  - - [2368, 2944, 1, 3328]
    - [18, 81.761]
  - - [2368, 3584, 1, 256]
    - [18, 79.425]
  - - [5124, 9124, 1, 4096]
    - [37, 85.491]
  - - [7680, 48000, 1, 2560]
    - [25, 99.412]
  - - [1024, 48000, 1, 2816]
    - [22, 98.524]
  - - [1856, 1856, 1, 256]
    - [35, 60.754]
  - - [4288, 1408, 1, 3328]
    - [18, 81.711]
  - - [5124, 9124, 1, 2048]
    - [11, 87.953]
  - - [4288, 5056, 1, 1280]
    - [10, 94.297]
  - - [5888, 6784, 1, 1280]
    - [28, 97.104]
  - - [1760, 1600, 1, 1760]
    - [13, 73.425]
  - - [5888, 1408, 1, 3328]
    - [10, 85.231]
  - - [256, 5056, 1, 256]
    - [6, 54.649]
  - - [7680, 12000, 1, 2560]
    - [25, 97.538]
  - - [2368, 5056, 1, 256]
    - [10, 79.656]
  - - [1024, 5056, 1, 256]
    - [33, 76.348]
  - - [2368, 1408, 1, 3328]
    - [17, 73.84]
  - - [1024, 48000, 1, 1536]
    - [22, 98.384]
  - - [5888, 448, 1, 256]
    - [23, 53.282]
  - - [2560, 3200, 1, 2560]
    - [37, 83.343]
  - - [6784, 5056, 1, 1280]
    - [10, 95.527]
  - - [1024, 48000, 1, 2560]
    - [25, 97.946]
  - - [4288, 6784, 1, 1280]
    - [10, 93.309]
  - - [16384, 800, 1, 4096]
    - [12, 72.258]
  - - [3072, 48000, 1, 1024]
    - [34, 98.765]
  - - [6784, 1408, 1, 256]
    - [33, 81.846]
  - - [5888, 4288, 1, 256]
    - [21, 90.307]
  - - [5056, 5888, 1, 256]
    - [21, 92.185]
  - - [2368, 1024, 1, 256]
    - [23, 57.393]
  - - [1856, 6784, 1, 1280]
    - [18, 85.788]
  - - [6784, 1856, 1, 256]
    - [21, 83.808]
  - - [4288, 3584, 1, 256]
    - [21, 87.968]
  - - [6784, 448, 1, 3328]
    - [10, 78.542]
  - - [5056, 1856, 1, 1280]
    - [10, 85.069]
  - - [1408, 1024, 1, 3328]
    - [7, 67.274]
  - - [5888, 3584, 1, 1280]
    - [10, 97.524]
  - - [1024, 2944, 1, 256]
    - [7, 69.384]
  - - [448, 6784, 1, 1280]
    - [36, 76.536]
  - - [3584, 1024, 1, 3328]
    - [18, 74.699]
  - - [2944, 1856, 1, 1280]
    - [24, 73.324]
  - - [5056, 256, 1, 256]
    - [6, 48.541]
  - - [2368, 3584, 1, 3328]
    - [18, 87.155]
  - - [3584, 5888, 1, 3328]
    - [3, 97.509]
  - - [2944, 3584, 1, 1280]
    - [10, 95.792]
  - - [1856, 5888, 1, 1280]
    - [18, 87.645]
  - - [2048, 3200, 1, 2048]
    - [25, 86.28]
  - - [4288, 1408, 1, 256]
    - [21, 77.192]
  - - [4288, 2368, 1, 1280]
    - [10, 83.526]
  - - [2944, 5056, 1, 256]
    - [29, 85.376]
  - - [6784, 2368, 1, 256]
    - [33, 87.818]
  - - [1024, 24000, 1, 2816]
    - [8, 96.979]
  - - [7680, 5984, 1, 2560]
    - [10, 94.384]
  - - [4288, 1856, 1, 256]
    - [21, 75.277]
  - - [1856, 2944, 1, 256]
    - [23, 70.474]
  - - [6144, 48000, 1, 2560]
    - [4, 98.589]
  - - [1760, 800, 1, 1760]
    - [0, 63.935]
  - - [1856, 1408, 1, 1280]
    - [21, 73.416]
  - - [1024, 4288, 1, 1280]
    - [10, 84.165]
  - - [2368, 5056, 1, 3328]
    - [18, 89.815]
  - - [1024, 5056, 1, 3328]
    - [24, 83.413]
  - - [1024, 1856, 1, 3328]
    - [24, 71.554]
  - - [4288, 6784, 1, 256]
    - [21, 91.317]
  - - [3584, 2944, 1, 3328]
    - [19, 87.083]
  - - [5888, 2944, 1, 256]
    - [21, 91.768]
  - - [5056, 4288, 1, 256]
    - [33, 90.181]
  - - [1024, 3584, 1, 256]
    - [7, 74.619]
  - - [5888, 5888, 1, 1280]
    - [10, 96.877]
  - - [448, 5888, 1, 1280]
    - [10, 67.788]
  - - [4288, 704, 1, 1280]
    - [36, 75.885]
  - - [2944, 1408, 1, 256]
    - [21, 73.527]
  - - [2368, 5888, 1, 3328]
    - [18, 89.157]
  - - [2368, 1856, 1, 1280]
    - [31, 70.879]
  - - [5888, 4288, 1, 3328]
    - [10, 95.942]
  - - [6784, 704, 1, 1280]
    - [36, 75.429]
  - - [5056, 448, 1, 256]
    - [20, 61.977]
  - - [1856, 5056, 1, 1280]
    - [18, 84.312]
  - - [2944, 1024, 1, 1280]
    - [18, 78.704]
  - - [2368, 4288, 1, 256]
    - [33, 79.989]
  - - [1024, 2368, 1, 3328]
    - [7, 72.213]
  - - [4288, 5888, 1, 3328]
    - [18, 95.985]
  - - [1024, 2944, 1, 3328]
    - [24, 78.995]
  - - [256, 6784, 1, 1280]
    - [35, 75.774]
  - - [1856, 3584, 1, 256]
    - [18, 79.885]
  - - [512, 24000, 1, 2816]
    - [8, 90.611]
  - - [256, 5888, 1, 1280]
    - [7, 66.028]
  - - [16384, 1600, 1, 4096]
    - [12, 78.18]
  - - [2944, 2368, 1, 256]
    - [18, 71.627]
  - - [1024, 1856, 1, 256]
    - [6, 61.875]
  - - [6784, 3584, 1, 3328]
    - [10, 97.044]
  - - [1760, 7000, 1, 1760]
    - [3, 92.8]
  - - [1024, 5888, 1, 3328]
    - [24, 82.569]
  - - [1408, 2368, 1, 1280]
    - [33, 73.809]
  - - [2944, 2944, 1, 256]
    - [21, 81.431]
  - - [6784, 256, 1, 256]
    - [23, 66.835]
  - - [5888, 1408, 1, 256]
    - [21, 84.783]
  - - [5888, 6784, 1, 3328]
    - [28, 98.365]
  - - [704, 4288, 1, 1280]
    - [18, 74.383]
  - - [1024, 48000, 1, 2048]
    - [11, 96.419]
  - - [1024, 1024, 1, 3328]
    - [53, 67.629]
  - - [64, 6784, 1, 256]
    - [51, 27.573]
  - - [128, 6784, 1, 3328]
    - [60, 56.698]
  - - [2048, 400, 1, 512]
    - [60, 45.151]
  - - [256, 4288, 1, 3328]
    - [44, 70.46]
  - - [704, 1856, 1, 3328]
    - [60, 58.025]
  - - [448, 1024, 1, 1280]
    - [53, 44.387]
  - - [2368, 128, 1, 256]
    - [51, 20.161]
  - - [64, 5056, 1, 256]
    - [51, 20.85]
  - - [256, 1856, 1, 1280]
    - [53, 46.525]
  - - [448, 704, 1, 1280]
    - [39, 31.44]
  - - [4288, 256, 1, 256]
    - [44, 48.057]
  - - [128, 3584, 1, 1280]
    - [53, 46.393]
  - - [5888, 64, 1, 3328]
    - [52, 39.282]
  - - [2944, 256, 1, 3328]
    - [47, 53.788]
  - - [256, 4288, 1, 1280]
    - [44, 65.685]
  - - [1408, 448, 1, 1280]
    - [47, 45.573]
  - - [1408, 256, 1, 1280]
    - [53, 36.96]
  - - [3072, 128, 1, 1024]
    - [53, 37.575]
  - - [6784, 128, 1, 1280]
    - [44, 54.275]
  - - [6784, 64, 1, 256]
    - [42, 27.349]
  - - [2368, 128, 1, 3328]
    - [41, 34.228]
  - - [2944, 128, 1, 256]
    - [42, 24.59]
  - - [448, 1408, 1, 256]
    - [43, 32.721]
  - - [64, 5056, 1, 3328]
    - [51, 34.623]
  - - [2368, 256, 1, 1280]
    - [52, 42.6]
  - - [256, 3584, 1, 3328]
    - [60, 59.763]
  - - [5056, 64, 1, 1280]
    - [42, 31.908]
  - - [1024, 704, 1, 256]
    - [43, 38.966]
  - - [4288, 128, 1, 1280]
    - [44, 53.438]
  - - [5888, 64, 1, 256]
    - [51, 24.641]
  - - [1856, 256, 1, 1280]
    - [44, 46.704]
  - - [64, 5888, 1, 3328]
    - [58, 39.231]
  - - [256, 1408, 1, 3328]
    - [44, 40.095]
  - - [6784, 128, 1, 3328]
    - [44, 56.78]
  - - [704, 704, 1, 3328]
    - [41, 55.392]
  - - [3584, 256, 1, 3328]
    - [53, 59.635]
  - - [128, 3584, 1, 3328]
    - [44, 50.499]
  - - [128, 2944, 1, 1280]
    - [44, 38.462]
  - - [448, 1856, 1, 1280]
    - [53, 50.598]
  - - [3584, 128, 1, 256]
    - [42, 28.262]
  - - [448, 1408, 1, 3328]
    - [43, 48.172]
  - - [256, 3584, 1, 256]
    - [60, 44.524]
  - - [256, 2944, 1, 3328]
    - [47, 57.239]
  - - [1408, 704, 1, 256]
    - [57, 44.403]
  - - [448, 2944, 1, 3328]
    - [60, 58.526]
  - - [64, 5888, 1, 256]
    - [51, 24.231]
  - - [448, 2368, 1, 1280]
    - [40, 49.761]
  - - [128, 4288, 1, 3328]
    - [53, 59.65]
  - - [256, 2368, 1, 256]
    - [43, 33.591]
  - - [1024, 448, 1, 3328]
    - [48, 50.82]
  - - [1856, 704, 1, 1280]
    - [44, 55.577]
  - - [1024, 1024, 1, 1280]
    - [48, 64.986]
  - - [256, 2944, 1, 256]
    - [43, 41.464]
  - - [1024, 700, 1, 512]
    - [59, 41.237]
  - - [128, 6784, 1, 1280]
    - [44, 54.408]
  - - [1408, 704, 1, 3328]
    - [60, 63.961]
  - - [128, 5888, 1, 1280]
    - [52, 54.938]
  - - [704, 1408, 1, 3328]
    - [44, 63.655]
  - - [7680, 64, 1, 2560]
    - [45, 41.315]
  - - [6784, 128, 1, 256]
    - [60, 42.139]
  - - [704, 448, 1, 256]
    - [51, 20.889]
  - - [256, 1856, 1, 3328]
    - [44, 53.089]
  - - [128, 4288, 1, 256]
    - [43, 35.441]
  - - [64, 6784, 1, 3328]
    - [42, 43.649]
  - - [2944, 256, 1, 1280]
    - [52, 53.771]
  - - [1856, 704, 1, 256]
    - [60, 45.211]
  - - [1408, 448, 1, 3328]
    - [47, 47.717]
  - - [704, 1856, 1, 256]
    - [52, 50.034]
  - - [256, 2368, 1, 1280]
    - [52, 44.548]
  - - [2944, 448, 1, 256]
    - [51, 50.694]
  - - [2368, 128, 1, 1280]
    - [46, 30.257]
  - - [64, 5056, 1, 1280]
    - [51, 32.031]
  - - [704, 448, 1, 3328]
    - [48, 35.706]
  - - [2368, 448, 1, 1280]
    - [55, 49.867]
  - - [128, 3584, 1, 256]
    - [43, 29.933]
  - - [1856, 448, 1, 3328]
    - [48, 53.88]
  - - [128, 5056, 1, 256]
    - [52, 35.605]
  - - [4288, 256, 1, 1280]
    - [44, 65.608]
  - - [704, 704, 1, 256]
    - [51, 30.903]
  - - [4288, 128, 1, 3328]
    - [60, 59.199]
  - - [7680, 128, 1, 2560]
    - [44, 56.978]
  - - [256, 1408, 1, 1280]
    - [53, 36.912]
  - - [6784, 64, 1, 3328]
    - [52, 45.014]
  - - [128, 2944, 1, 3328]
    - [44, 41.322]
  - - [2944, 448, 1, 3328]
    - [60, 58.661]
  - - [5888, 128, 1, 256]
    - [51, 39.492]
  - - [5056, 64, 1, 256]
    - [51, 21.205]
  - - [128, 5056, 1, 3328]
    - [40, 49.667]
  - - [256, 4288, 1, 256]
    - [43, 50.569]
  - - [3584, 256, 1, 256]
    - [57, 43.972]
  - - [128, 2944, 1, 256]
    - [52, 24.59]
  - - [3584, 128, 1, 3328]
    - [53, 50.485]
  - - [1024, 448, 1, 1280]
    - [43, 44.524]
  - - [5888, 128, 1, 3328]
    - [47, 54.712]
  - - [1408, 704, 1, 1280]
    - [60, 60.462]
  - - [448, 1408, 1, 1280]
    - [43, 45.722]
  - - [704, 1408, 1, 1280]
    - [41, 60.846]
  - - [448, 2944, 1, 256]
    - [43, 45.636]
  - - [448, 2368, 1, 256]
    - [43, 40.929]
  - - [64, 6784, 1, 1280]
    - [42, 40.731]
  - - [128, 2368, 1, 3328]
    - [44, 34.134]
  - - [5056, 64, 1, 3328]
    - [58, 34.715]
  - - [5056, 128, 1, 3328]
    - [43, 47.714]
  - - [448, 704, 1, 256]
    - [58, 21.024]
  - - [1856, 256, 1, 3328]
    - [41, 53.164]
  - - [2944, 128, 1, 3328]
    - [53, 41.744]
  - - [448, 1024, 1, 3328]
    - [53, 51.215]
  - - [704, 1024, 1, 1280]
    - [47, 51.936]
  - - [2368, 256, 1, 256]
    - [54, 33.174]
  - - [256, 2368, 1, 3328]
    - [52, 46.839]
  - - [704, 448, 1, 1280]
    - [39, 31.667]
  - - [1024, 704, 1, 1280]
    - [40, 52.132]
  - - [256, 1856, 1, 256]
    - [49, 32.588]
  - - [704, 1856, 1, 1280]
    - [55, 57.398]
  - - [1408, 256, 1, 3328]
    - [44, 39.918]
  - - [2368, 448, 1, 256]
    - [52, 40.878]
  - - [4288, 256, 1, 3328]
    - [60, 70.37]
  - - [2944, 256, 1, 256]
    - [59, 40.454]
  - - [1408, 448, 1, 256]
    - [51, 34.216]
  - - [6784, 64, 1, 1280]
    - [59, 41.59]
  - - [2944, 448, 1, 1280]
    - [53, 56.163]
  - - [128, 2368, 1, 256]
    - [49, 20.426]
  - - [448, 1024, 1, 256]
    - [58, 28.954]
  - - [1856, 448, 1, 256]
    - [51, 40.037]
  - - [128, 5056, 1, 1280]
    - [43, 47.422]
  - - [1408, 256, 1, 256]
    - [50, 25.4]
  - - [256, 1408, 1, 256]
    - [49, 25.227]
  - - [2368, 448, 1, 3328]
    - [59, 53.535]
  - - [128, 5888, 1, 3328]
    - [43, 57.304]
  - - [3584, 128, 1, 1280]
    - [44, 46.0]
  - - [4288, 128, 1, 256]
    - [51, 33.676]
  - - [2368, 256, 1, 3328]
    - [47, 45.489]
  - - [5888, 128, 1, 1280]
    - [59, 54.502]
  - - [256, 3584, 1, 1280]
    - [53, 57.463]
  - - [128, 5888, 1, 256]
    - [52, 41.098]
  - - [1024, 1024, 1, 256]
    - [53, 50.022]
  - - [1024, 1024, 1, 1024]
    - [53, 63.026]
  - - [64, 5888, 1, 1280]
    - [51, 36.851]
  - - [704, 1024, 1, 256]
    - [52, 36.475]
  - - [704, 704, 1, 1280]
    - [48, 48.469]
  - - [128, 2368, 1, 1280]
    - [58, 30.512]
  - - [3584, 256, 1, 1280]
    - [53, 57.0]
  - - [5888, 64, 1, 1280]
    - [51, 36.736]
  - - [5056, 128, 1, 1280]
    - [42, 46.195]
  - - [448, 1856, 1, 3328]
    - [41, 53.783]
  - - [1024, 448, 1, 256]
    - [52, 29.745]
  - - [2944, 128, 1, 1280]
    - [44, 38.563]
  - - [256, 2944, 1, 1280]
    - [52, 54.835]
  - - [2560, 128, 1, 2560]
    - [44, 33.401]
  - - [704, 1024, 1, 3328]
    - [52, 54.085]
  - - [1856, 448, 1, 1280]
    - [53, 50.617]
  - - [128, 6784, 1, 256]
    - [44, 42.207]
  - - [704, 1408, 1, 256]
    - [44, 44.989]
  - - [4096, 128, 1, 4096]
    - [53, 52.346]
  - - [448, 2944, 1, 1280]
    - [44, 56.631]
  - - [1856, 256, 1, 256]
    - [51, 29.685]
  - - [5056, 128, 1, 256]
    - [51, 34.438]
  - - [448, 2368, 1, 3328]
    - [56, 48.413]
  - - [1024, 704, 1, 3328]
    - [43, 53.084]
  - - [128, 4288, 1, 1280]
    - [53, 53.506]
  - - [448, 704, 1, 3328]
    - [53, 35.636]
  - - [448, 1856, 1, 256]
    - [51, 42.701]
  - - [1856, 704, 1, 3328]
    - [53, 58.044]
  - - [1408, 64, 1, 1280]
    - [67, 13.554]
  - - [4096, 32, 1, 4096]
    - [74, 16.917]
  - - [3072, 64, 1, 1024]
    - [71, 17.626]
  - - [2944, 64, 1, 256]
    - [80, 17.622]
  - - [448, 448, 1, 3328]
    - [81, 22.191]
  - - [1024, 256, 1, 3328]
    - [86, 29.704]
  - - [6144, 32, 1, 2560]
    - [74, 17.986]
  - - [1856, 64, 1, 1280]
    - [85, 17.277]
  - - [704, 128, 1, 1280]
    - [75, 13.308]
  - - [1856, 128, 1, 256]
    - [81, 20.889]
  - - [2944, 64, 1, 1280]
    - [80, 21.73]
  - - [64, 3584, 1, 3328]
    - [64, 25.608]
  - - [1024, 256, 1, 256]
    - [92, 22.921]
  - - [448, 448, 1, 256]
    - [79, 17.45]
  - - [7680, 32, 1, 2560]
    - [94, 16.987]
  - - [128, 1024, 1, 3328]
    - [63, 21.588]
  - - [64, 1856, 1, 1280]
    - [85, 17.525]
  - - [448, 256, 1, 256]
    - [79, 12.871]
  - - [256, 1024, 1, 256]
    - [92, 22.921]
  - - [1024, 128, 1, 1280]
    - [70, 19.264]
  - - [3072, 32, 1, 1024]
    - [83, 12.461]
  - - [448, 256, 1, 3328]
    - [85, 19.109]
  - - [128, 704, 1, 1280]
    - [67, 14.484]
  - - [1856, 128, 1, 3328]
    - [76, 26.835]
  - - [256, 448, 1, 256]
    - [85, 12.965]
  - - [8448, 32, 1, 2816]
    - [74, 18.849]
  - - [1408, 128, 1, 1280]
    - [80, 20.587]
  - - [128, 1856, 1, 1280]
    - [76, 25.837]
  - - [2048, 128, 1, 2048]
    - [92, 26.56]
  - - [2560, 32, 1, 2560]
    - [72, 12.196]
  - - [64, 1408, 1, 3328]
    - [75, 14.824]
  - - [128, 1408, 1, 256]
    - [80, 17.221]
  - - [256, 448, 1, 3328]
    - [63, 19.206]
  - - [64, 2368, 1, 1280]
    - [63, 18.273]
  - - [2368, 64, 1, 256]
    - [68, 14.393]
  - - [704, 128, 1, 3328]
    - [75, 15.109]
  - - [4288, 64, 1, 1280]
    - [86, 27.881]
  - - [2560, 64, 1, 2560]
    - [92, 16.597]
  - - [128, 1024, 1, 1280]
    - [80, 19.449]
  - - [1856, 64, 1, 256]
    - [79, 13.047]
  - - [704, 128, 1, 256]
    - [88, 11.306]
  - - [448, 256, 1, 1280]
    - [81, 16.556]
  - - [1024, 256, 1, 1280]
    - [92, 28.388]
  - - [1856, 128, 1, 1280]
    - [92, 25.603]
  - - [64, 3584, 1, 256]
    - [92, 20.054]
  - - [64, 1856, 1, 256]
    - [68, 12.956]
  - - [256, 1024, 1, 1280]
    - [81, 28.448]
  - - [3584, 64, 1, 1280]
    - [64, 24.079]
  - - [1408, 128, 1, 3328]
    - [75, 21.94]
  - - [64, 4288, 1, 3328]
    - [86, 29.946]
  - - [2368, 64, 1, 3328]
    - [75, 18.355]
  - - [256, 704, 1, 256]
    - [80, 17.491]
  - - [128, 1024, 1, 256]
    - [85, 14.658]
  - - [64, 2944, 1, 256]
    - [80, 17.568]
  - - [64, 1408, 1, 1280]
    - [67, 14.395]
  - - [1408, 128, 1, 256]
    - [90, 16.958]
  - - [64, 2944, 1, 1280]
    - [85, 21.747]
  - - [256, 448, 1, 1280]
    - [70, 16.92]
  - - [704, 256, 1, 1280]
    - [92, 19.739]
  - - [64, 2368, 1, 3328]
    - [63, 19.068]
  - - [256, 704, 1, 3328]
    - [63, 22.818]
  - - [4096, 64, 1, 4096]
    - [95, 22.871]
  - - [1760, 128, 1, 1760]
    - [64, 25.333]
  - - [64, 2944, 1, 3328]
    - [85, 23.049]
  - - [128, 1408, 1, 3328]
    - [85, 22.767]
  - - [1408, 64, 1, 256]
    - [67, 11.261]
  - - [64, 2368, 1, 256]
    - [80, 14.571]
  - - [1024, 128, 1, 3328]
    - [75, 21.002]
  - - [2368, 64, 1, 1280]
    - [85, 17.624]
  - - [4288, 64, 1, 256]
    - [92, 23.464]
  - - [64, 4288, 1, 1280]
    - [86, 28.065]
  - - [1408, 64, 1, 3328]
    - [75, 14.824]
  - - [448, 448, 1, 1280]
    - [64, 21.214]
  - - [3584, 64, 1, 3328]
    - [76, 25.516]
  - - [256, 1024, 1, 3328]
    - [81, 29.024]
  - - [1856, 64, 1, 3328]
    - [75, 18.839]
  - - [1024, 128, 1, 256]
    - [85, 14.398]
  - - [4608, 32, 1, 1536]
    - [74, 17.142]
  - - [128, 704, 1, 256]
    - [67, 11.589]
  - - [64, 3584, 1, 1280]
    - [86, 24.262]
  - - [3584, 64, 1, 256]
    - [71, 19.666]
  - - [64, 1856, 1, 3328]
    - [75, 18.972]
  - - [2944, 64, 1, 3328]
    - [85, 21.735]
  - - [128, 704, 1, 3328]
    - [63, 15.179]
  - - [128, 1856, 1, 256]
    - [92, 20.889]
  - - [64, 4288, 1, 256]
    - [92, 23.594]
  - - [704, 256, 1, 3328]
    - [85, 22.188]
  - - [256, 704, 1, 1280]
    - [70, 20.91]
  - - [4288, 64, 1, 3328]
    - [64, 30.235]
  - - [2048, 64, 1, 2048]
    - [95, 17.949]
  - - [64, 1408, 1, 256]
    - [67, 11.446]
  - - [128, 1408, 1, 1280]
    - [80, 21.477]
  - - [128, 1856, 1, 3328]
    - [76, 26.919]
  - - [1760, 64, 1, 1760]
    - [86, 16.833]
  - - [704, 256, 1, 256]
    - [89, 17.062]
  - - [1024, 256, 1, 196]
    - [92, 20.788]
  - - [256, 1024, 1, 196]
    - [76, 20.927]
  - - [1760, 32, 1, 1760]
    - [62, 9.811]
  - - [1760, 16, 1, 1760]
    - [93, 5.746]
  - - [7680, 16, 1, 2560]
    - [97, 11.022]
  - - [8448, 16, 1, 2816]
    - [97, 12.572]
  - - [6144, 16, 1, 2560]
    - [98, 11.555]
  - - [2048, 16, 1, 2048]
    - [73, 6.891]
  - - [3072, 16, 1, 1024]
    - [73, 8.427]
  - - [4096, 16, 1, 4096]
    - [98, 10.723]
  - - [2560, 16, 1, 2560]
    - [73, 7.603]
  - - [2048, 32, 1, 2048]
    - [98, 10.745]
  - - [4608, 16, 1, 1536]
    - [97, 10.455]
  - - [1024, 16, 1, 500000]
    - [66, 4.162]
  - - [1024, 8, 1, 500000]
    - [78, 2.081]
  - - [512, 16, 1, 500000]
    - [66, 2.515]
  - - [512, 8, 1, 500000]
    - [66, 1.259]
  - - [128, 256, 1, 1280]
    - [65, 7.559]
  - - [448, 64, 1, 1280]
    - [77, 6.715]
  - - [64, 1024, 1, 1280]
    - [67, 12.722]
  - - [64, 704, 1, 1280]
    - [77, 9.792]
  - - [128, 448, 1, 256]
    - [88, 8.348]
  - - [256, 256, 1, 3328]
    - [67, 13.354]
  - - [64, 448, 1, 1280]
    - [77, 6.633]
  - - [64, 64, 1, 3328]
    - [96, 1.169]
  - - [704, 64, 1, 3328]
    - [87, 10.665]
  - - [64, 128, 1, 256]
    - [82, 1.331]
  - - [128, 448, 1, 1280]
    - [67, 11.507]
  - - [704, 64, 1, 1280]
    - [77, 9.766]
  - - [448, 64, 1, 3328]
    - [87, 7.248]
  - - [128, 64, 1, 1280]
    - [72, 2.095]
  - - [64, 128, 1, 3328]
    - [96, 2.334]
  - - [128, 128, 1, 3328]
    - [65, 4.417]
  - - [256, 128, 1, 256]
    - [61, 5.083]
  - - [256, 256, 1, 256]
    - [67, 9.541]
  - - [256, 64, 1, 256]
    - [77, 2.621]
  - - [64, 1024, 1, 256]
    - [67, 9.409]
  - - [64, 704, 1, 256]
    - [67, 6.783]
  - - [448, 128, 1, 256]
    - [67, 8.348]
  - - [64, 704, 1, 3328]
    - [65, 10.677]
  - - [64, 448, 1, 3328]
    - [65, 7.263]
  - - [448, 128, 1, 3328]
    - [84, 11.774]
  - - [64, 256, 1, 1280]
    - [65, 4.046]
  - - [64, 64, 1, 256]
    - [72, 0.668]
  - - [64, 448, 1, 256]
    - [61, 4.446]
  - - [256, 128, 1, 1280]
    - [65, 7.535]
  - - [128, 256, 1, 3328]
    - [65, 8.208]
  - - [64, 128, 1, 1280]
    - [72, 2.093]
  - - [128, 128, 1, 1280]
    - [87, 4.058]
  - - [128, 256, 1, 256]
    - [61, 5.107]
  - - [256, 64, 1, 1280]
    - [77, 4.065]
  - - [704, 64, 1, 256]
    - [67, 6.686]
  - - [64, 64, 1, 1280]
    - [72, 1.049]
  - - [128, 64, 1, 3328]
    - [78, 2.334]
  - - [448, 64, 1, 256]
    - [77, 4.47]
  - - [1024, 64, 1, 256]
    - [67, 9.279]
  - - [128, 64, 1, 256]
    - [72, 1.331]
  - - [1024, 64, 1, 1280]
    - [67, 12.471]
  - - [64, 1024, 1, 3328]
    - [67, 13.583]
  - - [448, 128, 1, 1280]
    - [91, 10.4]
  - - [1024, 64, 1, 3328]
    - [67, 13.59]
  - - [64, 256, 1, 3328]
    - [65, 4.425]
  - - [256, 256, 1, 1280]
    - [67, 12.965]
  - - [256, 128, 1, 3328]
    - [65, 8.218]
  - - [64, 256, 1, 256]
    - [69, 2.621]
  - - [128, 448, 1, 3328]
    - [67, 12.331]
  - - [256, 64, 1, 3328]
    - [77, 4.42]
  - - [128, 128, 1, 256]
    - [77, 2.633]
  - - [512, 128, 1, 784]
    - [61, 11.304]
  - - [256, 64, 1, 3136]
    - [65, 4.425]
  - - [64, 256, 1, 3136]
    - [65, 4.422]
  - - [128, 512, 1, 784]
    - [61, 11.304]
  - - [64, 64, 1, 3136]
    - [66, 1.169]
  - - [768, 1, 1, 768]
    - [99, 0.062]
  - - [768, 2, 1, 768]
    - [100, 0.126]
  - - [768, 4, 1, 768]
    - [101, 0.25]
  - - [768, 8, 1, 768]
    - [100, 0.502]
  - - [768, 16, 1, 768]
    - [100, 0.995]
  - - [768, 32, 1, 768]
    - [100, 2.005]
  - - [768, 64, 1, 768]
    - [100, 4.635]
  - - [768, 128, 1, 768]
    - [101, 8.297]
  - - [768, 256, 1, 768]
    - [101, 16.61]
  - - [1024, 1, 1, 1024]
    - [102, 0.093]
  - - [1024, 2, 1, 1024]
    - [102, 0.187]
  - - [1024, 4, 1, 1024]
    - [101, 0.373]
  - - [1024, 8, 1, 1024]
    - [102, 0.746]
  - - [1024, 16, 1, 1024]
    - [102, 1.496]
  - - [1024, 32, 1, 1024]
    - [102, 2.977]
  - - [1024, 64, 1, 1024]
    - [102, 6.224]
  - - [1024, 128, 1, 1024]
    - [101, 12.343]
- null
