library/src/blas3/Tensile/Logic/asm_full/navi21_Cijk_Ailk_Bljk_HBH_GB.yaml
- {MinimumRequiredVersion: 4.26.0}
- navi21
- gfx1030
- [Device 73a2]
    SolutionIndex: 0
    SolutionNameMin: Cijk_Ailk_Bljk_HBH_MT128x64x8_SN_SU0_SUM0_TT8_8_WG16_8_1_WGM1
    SolutionIndex: 1
    SolutionNameMin: Cijk_Ailk_Bljk_HBH_MT128x128x8_SN_SU0_SUM0_TT8_16_WG16_8_1_WGM1
    SolutionIndex: 2
    SolutionNameMin: Cijk_Ailk_Bljk_HBH_MT128x64x16_SN_SU0_SUM0_TT8_8_WG16_8_1_WGM1
    SolutionIndex: 3
    SolutionNameMin: Cijk_Ailk_Bljk_HBH_MT128x128x16_SN_SU0_SUM0_TT8_16_WG16_8_1_WGM1
    SolutionIndex: 4
    SolutionNameMin: Cijk_Ailk_Bljk_HBH_MT128x128x16_SN_SU0_SUM0_TT8_8_WG16_16_1_WGM1
    SolutionIndex: 5
    SolutionNameMin: Cijk_Ailk_Bljk_HBH_MT128x256x16_SN_SU0_SUM0_TT8_16_WG16_16_1_WGM1
    SolutionIndex: 6
    SolutionNameMin: Cijk_Ailk_Bljk_HBH_MT128x128x32_SN_SU0_SUM0_TT8_16_WG16_8_1_WGM1
    SolutionIndex: 7
    SolutionNameMin: Cijk_Ailk_Bljk_HBH_MT128x64x8_SN_SU32_SUM3_TT8_8_WG16_8_1_WGM1
    SolutionIndex: 8
    SolutionNameMin: Cijk_Ailk_Bljk_HBH_MT128x128x8_SN_SU32_SUM3_TT8_16_WG16_8_1_WGM1
    SolutionIndex: 9
    SolutionNameMin: Cijk_Ailk_Bljk_HBH_MT128x64x16_SN_SU32_SUM3_TT8_8_WG16_8_1_WGM1
    SolutionIndex: 10
    SolutionNameMin: Cijk_Ailk_Bljk_HBH_MT128x128x16_SN_SU32_SUM3_TT8_16_WG16_8_1_WGM1
    SolutionIndex: 11
    SolutionNameMin: Cijk_Ailk_Bljk_HBH_MT128x256x16_SN_SU32_SUM3_TT8_16_WG16_16_1_WGM1
    SolutionIndex: 12
    SolutionNameMin: Cijk_Ailk_Bljk_HBH_MT128x128x32_SN_SU32_SUM3_TT8_16_WG16_8_1_WGM1
    SolutionIndex: 13
    SolutionNameMin: Cijk_Ailk_Bljk_HBH_MT128x128x8_SN_SU0_SUM0_TT8_16_WG16_8_1_WGM4
    SolutionIndex: 14
    SolutionNameMin: Cijk_Ailk_Bljk_HBH_MT128x64x16_SN_SU0_SUM0_TT8_8_WG16_8_1_WGM4
    SolutionIndex: 15
    SolutionNameMin: Cijk_Ailk_Bljk_HBH_MT128x128x16_SN_SU0_SUM0_TT8_16_WG16_8_1_WGM4
    SolutionIndex: 16
    SolutionNameMin: Cijk_Ailk_Bljk_HBH_MT128x128x16_SN_SU0_SUM0_TT8_8_WG16_16_1_WGM4
    SolutionIndex: 17
    SolutionNameMin: Cijk_Ailk_Bljk_HBH_MT128x256x16_SN_SU0_SUM0_TT8_16_WG16_16_1_WGM4
    SolutionIndex: 18
    SolutionNameMin: Cijk_Ailk_Bljk_HBH_MT128x128x8_SN_SU32_SUM3_TT8_16_WG16_8_1_WGM4
    SolutionIndex: 19
    SolutionNameMin: Cijk_Ailk_Bljk_HBH_MT128x64x16_SN_SU32_SUM3_TT8_8_WG16_8_1_WGM4
    SolutionIndex: 20
    SolutionNameMin: Cijk_Ailk_Bljk_HBH_MT128x128x16_SN_SU32_SUM3_TT8_16_WG16_8_1_WGM4
    SolutionIndex: 21
    SolutionNameMin: Cijk_Ailk_Bljk_HBH_MT128x256x16_SN_SU32_SUM3_TT8_16_WG16_16_1_WGM4
    SolutionIndex: 22
    SolutionNameMin: Cijk_Ailk_Bljk_HBH_MT128x64x8_SN_SU0_SUM0_TT8_8_WG16_8_1_WGM8
    SolutionIndex: 23
    SolutionNameMin: Cijk_Ailk_Bljk_HBH_MT128x128x8_SN_SU0_SUM0_TT8_16_WG16_8_1_WGM8
    SolutionIndex: 24
    SolutionNameMin: Cijk_Ailk_Bljk_HBH_MT128x64x16_SN_SU0_SUM0_TT8_8_WG16_8_1_WGM8
    SolutionIndex: 25
    SolutionNameMin: Cijk_Ailk_Bljk_HBH_MT128x128x16_SN_SU0_SUM0_TT8_16_WG16_8_1_WGM8
    SolutionIndex: 26
    SolutionNameMin: Cijk_Ailk_Bljk_HBH_MT128x128x16_SN_SU0_SUM0_TT8_8_WG16_16_1_WGM8
    SolutionIndex: 27
    SolutionNameMin: Cijk_Ailk_Bljk_HBH_MT128x256x16_SN_SU0_SUM0_TT8_16_WG16_16_1_WGM8
    SolutionIndex: 28
    SolutionNameMin: Cijk_Ailk_Bljk_HBH_MT128x64x8_SN_SU32_SUM3_TT8_8_WG16_8_1_WGM8
    SolutionIndex: 29
    SolutionNameMin: Cijk_Ailk_Bljk_HBH_MT128x128x8_SN_SU32_SUM3_TT8_16_WG16_8_1_WGM8
    SolutionIndex: 30
    SolutionNameMin: Cijk_Ailk_Bljk_HBH_MT128x128x16_SN_SU32_SUM3_TT8_16_WG16_8_1_WGM8
    SolutionIndex: 31
    SolutionNameMin: Cijk_Ailk_Bljk_HBH_MT128x128x16_SN_SU32_SUM3_TT8_8_WG16_16_1_WGM8
    SolutionIndex: 32
    SolutionNameMin: Cijk_Ailk_Bljk_HBH_MT128x256x16_SN_SU32_SUM3_TT8_16_WG16_16_1_WGM8
    SolutionIndex: 33
    SolutionNameMin: Cijk_Ailk_Bljk_HBH_MT128x128x8_SN_SU0_SUM0_TT8_16_WG16_8_1_WGM1
    SolutionIndex: 34
    SolutionNameMin: Cijk_Ailk_Bljk_HBH_MT128x64x16_SN_SU0_SUM0_TT8_8_WG16_8_1_WGM1
    SolutionIndex: 35
    SolutionNameMin: Cijk_Ailk_Bljk_HBH_MT128x128x16_SN_SU0_SUM0_TT8_16_WG16_8_1_WGM1
    SolutionIndex: 36
    SolutionNameMin: Cijk_Ailk_Bljk_HBH_MT128x256x16_SN_SU0_SUM0_TT8_16_WG16_16_1_WGM1
    SolutionIndex: 37
    SolutionNameMin: Cijk_Ailk_Bljk_HBH_MT128x128x16_SN_SU32_SUM3_TT8_16_WG16_8_1_WGM1
    SolutionIndex: 38
    SolutionNameMin: Cijk_Ailk_Bljk_HBH_MT128x128x8_SN_SU0_SUM0_TT8_16_WG16_8_1_WGM4
    SolutionIndex: 39
    SolutionNameMin: Cijk_Ailk_Bljk_HBH_MT128x64x16_SN_SU0_SUM0_TT8_8_WG16_8_1_WGM4
    SolutionIndex: 40
    SolutionNameMin: Cijk_Ailk_Bljk_HBH_MT128x256x16_SN_SU0_SUM0_TT8_16_WG16_16_1_WGM4
    SolutionIndex: 41
    SolutionNameMin: Cijk_Ailk_Bljk_HBH_MT128x128x8_SN_SU0_SUM0_TT8_16_WG16_8_1_WGM8
    SolutionIndex: 42
    SolutionNameMin: Cijk_Ailk_Bljk_HBH_MT128x256x16_SN_SU0_SUM0_TT8_16_WG16_16_1_WGM8
    SolutionIndex: 43
    SolutionNameMin: Cijk_Ailk_Bljk_HBH_MT128x128x8_SN_SU32_SUM3_TT8_16_WG16_8_1_WGM8
    SolutionIndex: 44
    SolutionNameMin: Cijk_Ailk_Bljk_HBH_MT64x64x8_SN_SU0_SUM0_TT8_8_WG8_8_1_WGM1
    SolutionIndex: 45
    SolutionNameMin: Cijk_Ailk_Bljk_HBH_MT128x64x8_SN_SU0_SUM0_TT8_8_WG16_8_1_WGM1
    SolutionIndex: 46
    SolutionNameMin: Cijk_Ailk_Bljk_HBH_MT64x64x16_SN_SU0_SUM0_TT8_8_WG8_8_1_WGM1
    SolutionIndex: 47
    SolutionNameMin: Cijk_Ailk_Bljk_HBH_MT128x64x16_SN_SU0_SUM0_TT8_8_WG16_8_1_WGM1
    SolutionIndex: 48
    SolutionNameMin: Cijk_Ailk_Bljk_HBH_MT128x128x16_SN_SU0_SUM0_TT8_8_WG16_16_1_WGM1
    SolutionIndex: 49
    SolutionNameMin: Cijk_Ailk_Bljk_HBH_MT64x64x32_SN_SU0_SUM0_TT8_8_WG8_8_1_WGM1
    SolutionIndex: 50
    SolutionNameMin: Cijk_Ailk_Bljk_HBH_MT128x64x32_SN_SU0_SUM0_TT8_8_WG16_8_1_WGM1
    SolutionIndex: 51
    SolutionNameMin: Cijk_Ailk_Bljk_HBH_MT64x64x8_SN_SU32_SUM3_TT8_8_WG8_8_1_WGM1
    SolutionIndex: 52
    SolutionNameMin: Cijk_Ailk_Bljk_HBH_MT128x64x8_SN_SU32_SUM3_TT8_8_WG16_8_1_WGM1
    SolutionIndex: 53
    SolutionNameMin: Cijk_Ailk_Bljk_HBH_MT64x64x16_SN_SU32_SUM3_TT8_8_WG8_8_1_WGM1
    SolutionIndex: 54
    SolutionNameMin: Cijk_Ailk_Bljk_HBH_MT128x64x16_SN_SU32_SUM3_TT8_8_WG16_8_1_WGM1
    SolutionIndex: 55
    SolutionNameMin: Cijk_Ailk_Bljk_HBH_MT128x128x16_SN_SU32_SUM3_TT8_8_WG16_16_1_WGM1
    SolutionIndex: 56
    SolutionNameMin: Cijk_Ailk_Bljk_HBH_MT64x64x32_SN_SU32_SUM3_TT8_8_WG8_8_1_WGM1
    SolutionIndex: 57
    SolutionNameMin: Cijk_Ailk_Bljk_HBH_MT128x64x8_SN_SU0_SUM0_TT8_8_WG16_8_1_WGM4
    SolutionIndex: 58
    SolutionNameMin: Cijk_Ailk_Bljk_HBH_MT64x64x16_SN_SU0_SUM0_TT8_8_WG8_8_1_WGM4
    SolutionIndex: 59
    SolutionNameMin: Cijk_Ailk_Bljk_HBH_MT128x64x16_SN_SU0_SUM0_TT8_8_WG16_8_1_WGM4
    SolutionIndex: 60
    SolutionNameMin: Cijk_Ailk_Bljk_HBH_MT128x128x16_SN_SU0_SUM0_TT8_8_WG16_16_1_WGM4
    SolutionIndex: 61
    SolutionNameMin: Cijk_Ailk_Bljk_HBH_MT64x64x32_SN_SU0_SUM0_TT8_8_WG8_8_1_WGM4
    SolutionIndex: 62
    SolutionNameMin: Cijk_Ailk_Bljk_HBH_MT128x64x8_SN_SU32_SUM3_TT8_8_WG16_8_1_WGM4
    SolutionIndex: 63
    SolutionNameMin: Cijk_Ailk_Bljk_HBH_MT64x64x16_SN_SU32_SUM3_TT8_8_WG8_8_1_WGM4
    SolutionIndex: 64
    SolutionNameMin: Cijk_Ailk_Bljk_HBH_MT128x64x16_SN_SU32_SUM3_TT8_8_WG16_8_1_WGM4
    SolutionIndex: 65
    SolutionNameMin: Cijk_Ailk_Bljk_HBH_MT128x128x16_SN_SU32_SUM3_TT8_8_WG16_16_1_WGM4
    SolutionIndex: 66
    SolutionNameMin: Cijk_Ailk_Bljk_HBH_MT64x64x32_SN_SU32_SUM3_TT8_8_WG8_8_1_WGM4
    SolutionIndex: 67
    SolutionNameMin: Cijk_Ailk_Bljk_HBH_MT64x64x8_SN_SU0_SUM0_TT8_8_WG8_8_1_WGM8
    SolutionIndex: 68
    SolutionNameMin: Cijk_Ailk_Bljk_HBH_MT128x64x8_SN_SU0_SUM0_TT8_8_WG16_8_1_WGM8
    SolutionIndex: 69
    SolutionNameMin: Cijk_Ailk_Bljk_HBH_MT64x64x16_SN_SU0_SUM0_TT8_8_WG8_8_1_WGM8
    SolutionIndex: 70
    SolutionNameMin: Cijk_Ailk_Bljk_HBH_MT128x64x16_SN_SU0_SUM0_TT8_8_WG16_8_1_WGM8
    SolutionIndex: 71
    SolutionNameMin: Cijk_Ailk_Bljk_HBH_MT128x128x16_SN_SU0_SUM0_TT8_8_WG16_16_1_WGM8
    SolutionIndex: 72
    SolutionNameMin: Cijk_Ailk_Bljk_HBH_MT64x64x32_SN_SU0_SUM0_TT8_8_WG8_8_1_WGM8
    SolutionIndex: 73
    SolutionNameMin: Cijk_Ailk_Bljk_HBH_MT128x64x32_SN_SU0_SUM0_TT8_8_WG16_8_1_WGM8
    SolutionIndex: 74
    SolutionNameMin: Cijk_Ailk_Bljk_HBH_MT64x64x8_SN_SU32_SUM3_TT8_8_WG8_8_1_WGM8
    SolutionIndex: 75
    SolutionNameMin: Cijk_Ailk_Bljk_HBH_MT128x64x8_SN_SU32_SUM3_TT8_8_WG16_8_1_WGM8
    SolutionIndex: 76
    SolutionNameMin: Cijk_Ailk_Bljk_HBH_MT64x64x16_SN_SU32_SUM3_TT8_8_WG8_8_1_WGM8
    SolutionIndex: 77
    SolutionNameMin: Cijk_Ailk_Bljk_HBH_MT128x64x16_SN_SU32_SUM3_TT8_8_WG16_8_1_WGM8
    SolutionIndex: 78
    SolutionNameMin: Cijk_Ailk_Bljk_HBH_MT128x128x16_SN_SU32_SUM3_TT8_8_WG16_16_1_WGM8
    SolutionIndex: 79
    SolutionNameMin: Cijk_Ailk_Bljk_HBH_MT64x64x32_SN_SU32_SUM3_TT8_8_WG8_8_1_WGM8
    SolutionIndex: 80
    SolutionNameMin: Cijk_Ailk_Bljk_HBH_MT128x64x16_SN_SU0_SUM0_TT8_8_WG16_8_1_WGM1
    SolutionIndex: 81
    SolutionNameMin: Cijk_Ailk_Bljk_HBH_MT128x128x16_SN_SU0_SUM0_TT8_8_WG16_16_1_WGM1
    SolutionIndex: 82
    SolutionNameMin: Cijk_Ailk_Bljk_HBH_MT128x64x16_SN_SU32_SUM3_TT8_8_WG16_8_1_WGM1
    SolutionIndex: 83
    SolutionNameMin: Cijk_Ailk_Bljk_HBH_MT16x16x8_SN_SU0_SUM0_TT2_2_WG8_8_1_WGM1
    SolutionIndex: 84
    SolutionNameMin: Cijk_Ailk_Bljk_HBH_MT32x16x8_SN_SU0_SUM0_TT2_2_WG16_8_1_WGM1
    SolutionIndex: 85
    SolutionNameMin: Cijk_Ailk_Bljk_HBH_MT64x32x8_SN_SU0_SUM0_TT4_4_WG16_8_1_WGM1
    SolutionIndex: 86
    SolutionNameMin: Cijk_Ailk_Bljk_HBH_MT32x32x8_SN_SU0_SUM0_TT2_2_WG16_16_1_WGM1
    SolutionIndex: 87
    SolutionNameMin: Cijk_Ailk_Bljk_HBH_MT64x64x8_SN_SU0_SUM0_TT4_4_WG16_16_1_WGM1
    SolutionIndex: 88
    SolutionNameMin: Cijk_Ailk_Bljk_HBH_MT16x16x16_SN_SU0_SUM0_TT2_2_WG8_8_1_WGM1
    SolutionIndex: 89
    SolutionNameMin: Cijk_Ailk_Bljk_HBH_MT32x16x16_SN_SU0_SUM0_TT2_2_WG16_8_1_WGM1
    SolutionIndex: 90
    SolutionNameMin: Cijk_Ailk_Bljk_HBH_MT64x32x16_SN_SU0_SUM0_TT4_4_WG16_8_1_WGM1
    SolutionIndex: 91
    SolutionNameMin: Cijk_Ailk_Bljk_HBH_MT32x32x16_SN_SU0_SUM0_TT2_2_WG16_16_1_WGM1
    SolutionIndex: 92
    SolutionNameMin: Cijk_Ailk_Bljk_HBH_MT16x16x32_SN_SU0_SUM0_TT2_2_WG8_8_1_WGM1
    SolutionIndex: 93
    SolutionNameMin: Cijk_Ailk_Bljk_HBH_MT32x16x32_SN_SU0_SUM0_TT2_2_WG16_8_1_WGM1
    SolutionIndex: 94
    SolutionNameMin: Cijk_Ailk_Bljk_HBH_MT64x32x32_SN_SU0_SUM0_TT4_4_WG16_8_1_WGM1
    SolutionIndex: 95
    SolutionNameMin: Cijk_Ailk_Bljk_HBH_MT32x32x8_SN_SU32_SUM3_TT4_4_WG8_8_1_WGM1
    SolutionIndex: 96
    SolutionNameMin: Cijk_Ailk_Bljk_HBH_MT32x16x8_SN_SU32_SUM3_TT2_2_WG16_8_1_WGM1
    SolutionIndex: 97
    SolutionNameMin: Cijk_Ailk_Bljk_HBH_MT64x32x8_SN_SU32_SUM3_TT4_4_WG16_8_1_WGM1
    SolutionIndex: 98
    SolutionNameMin: Cijk_Ailk_Bljk_HBH_MT64x64x8_SN_SU32_SUM3_TT4_4_WG16_16_1_WGM1
    SolutionIndex: 99
    SolutionNameMin: Cijk_Ailk_Bljk_HBH_MT16x16x16_SN_SU32_SUM3_TT2_2_WG8_8_1_WGM1
    SolutionIndex: 100
    SolutionNameMin: Cijk_Ailk_Bljk_HBH_MT32x32x16_SN_SU32_SUM3_TT4_4_WG8_8_1_WGM1
    SolutionIndex: 101
    SolutionNameMin: Cijk_Ailk_Bljk_HBH_MT32x16x16_SN_SU32_SUM3_TT2_2_WG16_8_1_WGM1
    SolutionIndex: 102
    SolutionNameMin: Cijk_Ailk_Bljk_HBH_MT64x32x16_SN_SU32_SUM3_TT4_4_WG16_8_1_WGM1
    SolutionIndex: 103
    SolutionNameMin: Cijk_Ailk_Bljk_HBH_MT32x16x32_SN_SU32_SUM3_TT2_2_WG16_8_1_WGM1
    SolutionIndex: 104
    SolutionNameMin: Cijk_Ailk_Bljk_HBH_MT64x32x8_SN_SU0_SUM0_TT4_4_WG16_8_1_WGM4
    SolutionIndex: 105
    SolutionNameMin: Cijk_Ailk_Bljk_HBH_MT32x32x8_SN_SU0_SUM0_TT2_2_WG16_16_1_WGM4
    SolutionIndex: 106
    SolutionNameMin: Cijk_Ailk_Bljk_HBH_MT32x16x16_SN_SU0_SUM0_TT2_2_WG16_8_1_WGM4
    SolutionIndex: 107
    SolutionNameMin: Cijk_Ailk_Bljk_HBH_MT64x32x16_SN_SU0_SUM0_TT4_4_WG16_8_1_WGM4
    SolutionIndex: 108
    SolutionNameMin: Cijk_Ailk_Bljk_HBH_MT32x16x32_SN_SU0_SUM0_TT2_2_WG16_8_1_WGM4
    SolutionIndex: 109
    SolutionNameMin: Cijk_Ailk_Bljk_HBH_MT64x32x8_SN_SU32_SUM3_TT4_4_WG16_8_1_WGM4
    SolutionIndex: 110
    SolutionNameMin: Cijk_Ailk_Bljk_HBH_MT32x32x8_SN_SU32_SUM3_TT2_2_WG16_16_1_WGM4
    SolutionIndex: 111
    SolutionNameMin: Cijk_Ailk_Bljk_HBH_MT16x16x16_SN_SU32_SUM3_TT2_2_WG8_8_1_WGM4
    SolutionIndex: 112
    SolutionNameMin: Cijk_Ailk_Bljk_HBH_MT32x16x16_SN_SU32_SUM3_TT2_2_WG16_8_1_WGM4
    SolutionIndex: 113
    SolutionNameMin: Cijk_Ailk_Bljk_HBH_MT64x32x16_SN_SU32_SUM3_TT4_4_WG16_8_1_WGM4
    SolutionIndex: 114
    SolutionNameMin: Cijk_Ailk_Bljk_HBH_MT32x16x32_SN_SU32_SUM3_TT2_2_WG16_8_1_WGM4
    SolutionIndex: 115
    SolutionNameMin: Cijk_Ailk_Bljk_HBH_MT32x32x8_SN_SU0_SUM0_TT4_4_WG8_8_1_WGM8
    SolutionIndex: 116
    SolutionNameMin: Cijk_Ailk_Bljk_HBH_MT64x32x8_SN_SU0_SUM0_TT4_4_WG16_8_1_WGM8
    SolutionIndex: 117
    SolutionNameMin: Cijk_Ailk_Bljk_HBH_MT32x32x8_SN_SU0_SUM0_TT2_2_WG16_16_1_WGM8
    SolutionIndex: 118
    SolutionNameMin: Cijk_Ailk_Bljk_HBH_MT16x16x16_SN_SU0_SUM0_TT2_2_WG8_8_1_WGM8
    SolutionIndex: 119
    SolutionNameMin: Cijk_Ailk_Bljk_HBH_MT32x16x16_SN_SU0_SUM0_TT2_2_WG16_8_1_WGM8
    SolutionIndex: 120
    SolutionNameMin: Cijk_Ailk_Bljk_HBH_MT64x32x16_SN_SU0_SUM0_TT4_4_WG16_8_1_WGM8
    SolutionIndex: 121
    SolutionNameMin: Cijk_Ailk_Bljk_HBH_MT32x32x16_SN_SU0_SUM0_TT2_2_WG16_16_1_WGM8
    SolutionIndex: 122
    SolutionNameMin: Cijk_Ailk_Bljk_HBH_MT32x16x32_SN_SU0_SUM0_TT2_2_WG16_8_1_WGM8
    SolutionIndex: 123
    SolutionNameMin: Cijk_Ailk_Bljk_HBH_MT64x32x8_SN_SU32_SUM3_TT4_4_WG16_8_1_WGM8
    SolutionIndex: 124
    SolutionNameMin: Cijk_Ailk_Bljk_HBH_MT32x32x8_SN_SU32_SUM3_TT2_2_WG16_16_1_WGM8
    SolutionIndex: 125
    SolutionNameMin: Cijk_Ailk_Bljk_HBH_MT16x16x16_SN_SU32_SUM3_TT2_2_WG8_8_1_WGM8
    SolutionIndex: 126
    SolutionNameMin: Cijk_Ailk_Bljk_HBH_MT32x16x16_SN_SU32_SUM3_TT2_2_WG16_8_1_WGM8
    SolutionIndex: 127
    SolutionNameMin: Cijk_Ailk_Bljk_HBH_MT64x32x16_SN_SU32_SUM3_TT4_4_WG16_8_1_WGM8
    SolutionIndex: 128
    SolutionNameMin: Cijk_Ailk_Bljk_HBH_MT32x16x32_SN_SU32_SUM3_TT2_2_WG16_8_1_WGM8
    SolutionIndex: 129
    SolutionNameMin: Cijk_Ailk_Bljk_HBH_MT32x8x8_SN_SU0_SUM0_TT2_2_WG16_4_1_WGM1
    SolutionIndex: 130
    SolutionNameMin: Cijk_Ailk_Bljk_HBH_MT64x8x8_SN_SU0_SUM0_TT4_2_WG16_4_1_WGM1
    SolutionIndex: 131
    SolutionNameMin: Cijk_Ailk_Bljk_HBH_MT32x8x16_SN_SU0_SUM0_TT2_2_WG16_4_1_WGM1
    SolutionIndex: 132
    SolutionNameMin: Cijk_Ailk_Bljk_HBH_MT64x16x16_SN_SU0_SUM0_TT4_2_WG16_8_1_WGM1
    SolutionIndex: 133
    SolutionNameMin: Cijk_Ailk_Bljk_HBH_MT64x8x16_SN_SU0_SUM0_TT2_2_WG32_4_1_WGM1
    SolutionIndex: 134
    SolutionNameMin: Cijk_Ailk_Bljk_HBH_MT128x8x16_SN_SU0_SUM0_TT4_2_WG32_4_1_WGM1
    SolutionIndex: 135
    SolutionNameMin: Cijk_Ailk_Bljk_HBH_MT32x8x32_SN_SU0_SUM0_TT2_2_WG16_4_1_WGM1
    SolutionIndex: 136
    SolutionNameMin: Cijk_Ailk_Bljk_HBH_MT64x8x32_SN_SU0_SUM0_TT4_2_WG16_4_1_WGM1
    SolutionIndex: 137
    SolutionNameMin: Cijk_Ailk_Bljk_HBH_MT64x16x32_SN_SU0_SUM0_TT4_2_WG16_8_1_WGM1
    SolutionIndex: 138
    SolutionNameMin: Cijk_Ailk_Bljk_HBH_MT64x8x32_SN_SU0_SUM0_TT2_2_WG32_4_1_WGM1
    SolutionIndex: 139
    SolutionNameMin: Cijk_Ailk_Bljk_HBH_MT128x8x32_SN_SU0_SUM0_TT4_2_WG32_4_1_WGM1
    SolutionIndex: 140
    SolutionNameMin: Cijk_Ailk_Bljk_HBH_MT64x8x8_SN_SU32_SUM3_TT4_2_WG16_4_1_WGM1
    SolutionIndex: 141
    SolutionNameMin: Cijk_Ailk_Bljk_HBH_MT64x8x16_SN_SU32_SUM3_TT4_2_WG16_4_1_WGM1
    SolutionIndex: 142
    SolutionNameMin: Cijk_Ailk_Bljk_HBH_MT64x16x16_SN_SU32_SUM3_TT4_2_WG16_8_1_WGM1
    SolutionIndex: 143
    SolutionNameMin: Cijk_Ailk_Bljk_HBH_MT128x8x16_SN_SU32_SUM3_TT4_2_WG32_4_1_WGM1
    SolutionIndex: 144
    SolutionNameMin: Cijk_Ailk_Bljk_HBH_MT64x8x32_SN_SU32_SUM3_TT2_2_WG32_4_1_WGM1
    SolutionIndex: 145
    SolutionNameMin: Cijk_Ailk_Bljk_HBH_MT64x8x16_SN_SU0_SUM0_TT2_2_WG32_4_1_WGM4
    SolutionIndex: 146
    SolutionNameMin: Cijk_Ailk_Bljk_HBH_MT128x8x16_SN_SU0_SUM0_TT4_2_WG32_4_1_WGM4
    SolutionIndex: 147
    SolutionNameMin: Cijk_Ailk_Bljk_HBH_MT64x8x32_SN_SU0_SUM0_TT4_2_WG16_4_1_WGM4
    SolutionIndex: 148
    SolutionNameMin: Cijk_Ailk_Bljk_HBH_MT64x8x32_SN_SU0_SUM0_TT2_2_WG32_4_1_WGM4
    SolutionIndex: 149
    SolutionNameMin: Cijk_Ailk_Bljk_HBH_MT64x8x16_SN_SU32_SUM3_TT4_2_WG16_4_1_WGM4
    SolutionIndex: 150
    SolutionNameMin: Cijk_Ailk_Bljk_HBH_MT64x8x8_SN_SU0_SUM0_TT4_2_WG16_4_1_WGM8
    SolutionIndex: 151
    SolutionNameMin: Cijk_Ailk_Bljk_HBH_MT32x8x16_SN_SU0_SUM0_TT2_2_WG16_4_1_WGM8
    SolutionIndex: 152
    SolutionNameMin: Cijk_Ailk_Bljk_HBH_MT64x8x32_SN_SU0_SUM0_TT4_2_WG16_4_1_WGM8
    SolutionIndex: 153
    SolutionNameMin: Cijk_Ailk_Bljk_HBH_MT64x16x32_SN_SU0_SUM0_TT4_2_WG16_8_1_WGM8
    SolutionIndex: 154
    SolutionNameMin: Cijk_Ailk_Bljk_HBH_MT64x8x32_SN_SU0_SUM0_TT2_2_WG32_4_1_WGM8
    SolutionIndex: 155
    SolutionNameMin: Cijk_Ailk_Bljk_HBH_MT32x16x32_SN_SU32_SUM3_TT2_2_WG16_8_1_WGM1
    SolutionIndex: 156
    SolutionNameMin: Cijk_Ailk_Bljk_HBH_MT32x16x32_SN_SU0_SUM0_TT2_2_WG16_8_1_WGM4
    SolutionIndex: 157
    SolutionNameMin: Cijk_Ailk_Bljk_HBH_MT32x16x32_SN_SU32_SUM3_TT2_2_WG16_8_1_WGM4
    SolutionIndex: 158
    SolutionNameMin: Cijk_Ailk_Bljk_HBH_MT32x16x32_SN_SU0_SUM0_TT2_2_WG16_8_1_WGM8
    SolutionIndex: 159
    SolutionNameMin: Cijk_Ailk_Bljk_HBH_MT64x32x16_SN_SU32_SUM3_TT4_4_WG16_8_1_WGM8
    SolutionIndex: 160
    SolutionNameMin: Cijk_Ailk_Bljk_HBH_MT32x16x32_SN_SU32_SUM3_TT2_2_WG16_8_1_WGM8
- - - [2944, 4288, 1, 1280, 2944, 2944, 2944, 1280]
    - [5, 34892.0]
  - - [2368, 5888, 1, 256, 2368, 2368, 2368, 256]
    - [20, 32940.0]
  - - [5888, 1856, 1, 3328, 5888, 5888, 5888, 3328]
    - [25, 34008.0]
  - - [5888, 2944, 1, 3328, 5888, 5888, 5888, 3328]
    - [25, 36144.0]
  - - [1856, 4288, 1, 256, 1856, 1856, 1856, 256]
    - [25, 30336.0]
  - - [5056, 5056, 1, 3328, 5056, 5056, 5056, 3328]
    - [15, 34997.0]
  - - [1408, 5888, 1, 1280, 1408, 1408, 1408, 1280]
    - [10, 34295.0]
  - - [1024, 3584, 1, 3328, 1024, 1024, 1024, 3328]
    - [20, 31737.0]
  - - [448, 3584, 1, 3328, 448, 448, 448, 3328]
    - [11, 23936.0]
  - - [5888, 1408, 1, 1280, 5888, 5888, 5888, 1280]
    - [10, 34337.0]
  - - [1024, 2368, 1, 256, 1024, 1024, 1024, 256]
    - [2, 25091.0]
  - - [5056, 6784, 1, 1280, 5056, 5056, 5056, 1280]
    - [3, 35681.0]
  - - [5056, 5056, 1, 1280, 5056, 5056, 5056, 1280]
    - [15, 34789.0]
  - - [4288, 6784, 1, 256, 4288, 4288, 4288, 256]
    - [3, 34531.0]
  - - [6784, 448, 1, 256, 6784, 6784, 6784, 256]
    - [2, 26197.0]
  - - [5056, 256, 1, 1280, 5056, 5056, 5056, 1280]
    - [2, 23976.0]
  - - [5888, 704, 1, 1280, 5888, 5888, 5888, 1280]
    - [25, 30385.0]
  - - [3584, 1024, 1, 256, 3584, 3584, 3584, 256]
    - [25, 29378.0]
  - - [6784, 4288, 1, 3328, 6784, 6784, 6784, 3328]
    - [25, 35758.0]
  - - [1856, 2368, 1, 3328, 1856, 1856, 1856, 3328]
    - [3, 32570.0]
  - - [5888, 2944, 1, 1280, 5888, 5888, 5888, 1280]
    - [15, 35907.0]
  - - [5888, 1024, 1, 256, 5888, 5888, 5888, 256]
    - [3, 31864.0]
  - - [1408, 2944, 1, 256, 1408, 1408, 1408, 256]
    - [25, 29641.0]
  - - [6784, 5056, 1, 3328, 6784, 6784, 6784, 3328]
    - [5, 35989.0]
  - - [5056, 5056, 1, 256, 5056, 5056, 5056, 256]
    - [3, 33341.0]
  - - [1024, 3584, 1, 1280, 1024, 1024, 1024, 1280]
    - [25, 31389.0]
  - - [2368, 2944, 1, 1280, 2368, 2368, 2368, 1280]
    - [25, 32670.0]
  - - [6784, 6784, 1, 1280, 6784, 6784, 6784, 1280]
    - [25, 36251.0]
  - - [1408, 4288, 1, 1280, 1408, 1408, 1408, 1280]
    - [15, 32610.0]
  - - [3584, 4288, 1, 1280, 3584, 3584, 3584, 1280]
    - [15, 34628.0]
  - - [2368, 704, 1, 1280, 2368, 2368, 2368, 1280]
    - [2, 26514.0]
  - - [5056, 4288, 1, 3328, 5056, 5056, 5056, 3328]
    - [17, 35609.0]
  - - [3584, 2368, 1, 3328, 3584, 3584, 3584, 3328]
    - [15, 34236.0]
  - - [5888, 6784, 1, 1280, 5888, 5888, 5888, 1280]
    - [20, 36316.0]
  - - [6784, 448, 1, 1280, 6784, 6784, 6784, 1280]
    - [20, 29131.0]
  - - [2944, 5888, 1, 256, 2944, 2944, 2944, 256]
    - [15, 34712.0]
  - - [4288, 2944, 1, 256, 4288, 4288, 4288, 256]
    - [10, 33186.0]
  - - [5056, 2368, 1, 1280, 5056, 5056, 5056, 1280]
    - [3, 33610.0]
  - - [448, 3584, 1, 1280, 448, 448, 448, 1280]
    - [5, 23233.0]
  - - [6784, 5888, 1, 256, 6784, 6784, 6784, 256]
    - [20, 35329.0]
  - - [1024, 1408, 1, 256, 1024, 1024, 1024, 256]
    - [2, 24672.0]
  - - [2368, 2368, 1, 3328, 2368, 2368, 2368, 3328]
    - [30, 31607.0]
  - - [5056, 704, 1, 3328, 5056, 5056, 5056, 3328]
    - [15, 30070.0]
  - - [1408, 1856, 1, 256, 1408, 1408, 1408, 256]
    - [2, 26867.0]
  - - [5888, 1856, 1, 256, 5888, 5888, 5888, 256]
    - [20, 32090.0]
  - - [704, 5888, 1, 256, 704, 704, 704, 256]
    - [20, 27335.0]
  - - [3584, 704, 1, 3328, 3584, 3584, 3584, 3328]
    - [15, 29290.0]
  - - [1408, 1408, 1, 256, 1408, 1408, 1408, 256]
    - [10, 26133.0]
  - - [448, 4288, 1, 256, 448, 448, 448, 256]
    - [27, 22747.0]
  - - [704, 2368, 1, 1280, 704, 704, 704, 1280]
    - [5, 24079.0]
  - - [1856, 2368, 1, 1280, 1856, 1856, 1856, 1280]
    - [3, 32062.0]
  - - [1408, 1408, 1, 3328, 1408, 1408, 1408, 3328]
    - [27, 29420.0]
  - - [1408, 1024, 1, 1280, 1408, 1408, 1408, 1280]
    - [24, 27076.0]
  - - [704, 6784, 1, 256, 704, 704, 704, 256]
    - [30, 28420.0]
  - - [6784, 704, 1, 256, 6784, 6784, 6784, 256]
    - [15, 28367.0]
  - - [5056, 704, 1, 256, 5056, 5056, 5056, 256]
    - [15, 26366.0]
  - - [1408, 3584, 1, 256, 1408, 1408, 1408, 256]
    - [3, 31570.0]
  - - [3584, 4288, 1, 3328, 3584, 3584, 3584, 3328]
    - [3, 34855.0]
  - - [5888, 1856, 1, 1280, 5888, 5888, 5888, 1280]
    - [25, 33771.0]
  - - [2368, 3584, 1, 1280, 2368, 2368, 2368, 1280]
    - [3, 33979.0]
  - - [2944, 3584, 1, 3328, 2944, 2944, 2944, 3328]
    - [3, 35584.0]
  - - [6784, 2944, 1, 256, 6784, 6784, 6784, 256]
    - [10, 34795.0]
  - - [1856, 2368, 1, 256, 1856, 1856, 1856, 256]
    - [3, 28864.0]
  - - [3584, 6784, 1, 3328, 3584, 3584, 3584, 3328]
    - [17, 36373.0]
  - - [5056, 4288, 1, 1280, 5056, 5056, 5056, 1280]
    - [17, 35332.0]
  - - [6784, 1856, 1, 3328, 6784, 6784, 6784, 3328]
    - [3, 34248.0]
  - - [1408, 5056, 1, 1280, 1408, 1408, 1408, 1280]
    - [30, 33498.0]
  - - [6784, 5888, 1, 3328, 6784, 6784, 6784, 3328]
    - [11, 36448.0]
  - - [2368, 5056, 1, 1280, 2368, 2368, 2368, 1280]
    - [15, 33497.0]
  - - [1024, 5056, 1, 1280, 1024, 1024, 1024, 1280]
    - [15, 33698.0]
  - - [4288, 1024, 1, 256, 4288, 4288, 4288, 256]
    - [5, 29380.0]
  - - [2368, 1408, 1, 256, 2368, 2368, 2368, 256]
    - [3, 28151.0]
  - - [5888, 448, 1, 1280, 5888, 5888, 5888, 1280]
    - [9, 26358.0]
  - - [704, 5888, 1, 3328, 704, 704, 704, 3328]
    - [5, 31586.0]
  - - [1024, 6784, 1, 1280, 1024, 1024, 1024, 1280]
    - [27, 34906.0]
  - - [3584, 2944, 1, 1280, 3584, 3584, 3584, 1280]
    - [25, 35351.0]
  - - [1408, 5056, 1, 3328, 1408, 1408, 1408, 3328]
    - [15, 33802.0]
  - - [1856, 1856, 1, 3328, 1856, 1856, 1856, 3328]
    - [20, 29658.0]
  - - [2368, 2368, 1, 256, 2368, 2368, 2368, 256]
    - [20, 28790.0]
  - - [4288, 4288, 1, 1280, 4288, 4288, 4288, 1280]
    - [30, 34754.0]
  - - [5888, 1024, 1, 1280, 5888, 5888, 5888, 1280]
    - [3, 33482.0]
  - - [704, 6784, 1, 3328, 704, 704, 704, 3328]
    - [10, 31658.0]
  - - [5888, 5888, 1, 3328, 5888, 5888, 5888, 3328]
    - [11, 36363.0]
  - - [5056, 1024, 1, 1280, 5056, 5056, 5056, 1280]
    - [10, 33636.0]
  - - [448, 5888, 1, 3328, 448, 448, 448, 3328]
    - [5, 26501.0]
  - - [1024, 2944, 1, 1280, 1024, 1024, 1024, 1280]
    - [3, 29375.0]
  - - [5056, 5888, 1, 1280, 5056, 5056, 5056, 1280]
    - [17, 35716.0]
  - - [448, 6784, 1, 256, 448, 448, 448, 256]
    - [3, 25849.0]
  - - [3584, 5888, 1, 256, 3584, 3584, 3584, 256]
    - [23, 35098.0]
  - - [2944, 3584, 1, 256, 2944, 2944, 2944, 256]
    - [3, 34114.0]
  - - [6784, 1024, 1, 3328, 6784, 6784, 6784, 3328]
    - [3, 34902.0]
  - - [6784, 2944, 1, 3328, 6784, 6784, 6784, 3328]
    - [3, 36027.0]
  - - [6784, 2368, 1, 1280, 6784, 6784, 6784, 1280]
    - [25, 34763.0]
  - - [4288, 3584, 1, 256, 4288, 4288, 4288, 256]
    - [3, 33724.0]
  - - [4288, 5888, 1, 1280, 4288, 4288, 4288, 1280]
    - [17, 35768.0]
  - - [4288, 1856, 1, 1280, 4288, 4288, 4288, 1280]
    - [15, 32506.0]
  - - [1856, 2944, 1, 3328, 1856, 1856, 1856, 3328]
    - [10, 32730.0]
  - - [256, 6784, 1, 3328, 256, 256, 256, 3328]
    - [16, 29879.0]
  - - [5056, 1024, 1, 256, 5056, 5056, 5056, 256]
    - [3, 31497.0]
  - - [5056, 1856, 1, 3328, 5056, 5056, 5056, 3328]
    - [15, 33492.0]
  - - [5056, 256, 1, 3328, 5056, 5056, 5056, 3328]
    - [14, 24600.0]
  - - [1024, 5888, 1, 1280, 1024, 1024, 1024, 1280]
    - [3, 33455.0]
  - - [5056, 3584, 1, 256, 5056, 5056, 5056, 256]
    - [3, 33890.0]
  - - [1856, 1024, 1, 1280, 1856, 1856, 1856, 1280]
    - [3, 27303.0]
  - - [1856, 1856, 1, 1280, 1856, 1856, 1856, 1280]
    - [20, 29023.0]
  - - [1856, 1024, 1, 3328, 1856, 1856, 1856, 3328]
    - [17, 28330.0]
  - - [6784, 1024, 1, 256, 6784, 6784, 6784, 256]
    - [3, 33104.0]
  - - [5056, 5888, 1, 3328, 5056, 5056, 5056, 3328]
    - [17, 35935.0]
  - - [1856, 1024, 1, 256, 1856, 1856, 1856, 256]
    - [2, 23391.0]
  - - [5056, 1408, 1, 3328, 5056, 5056, 5056, 3328]
    - [3, 33779.0]
  - - [448, 5888, 1, 256, 448, 448, 448, 256]
    - [15, 22783.0]
  - - [1408, 6784, 1, 3328, 1408, 1408, 1408, 3328]
    - [15, 34938.0]
  - - [2944, 1408, 1, 3328, 2944, 2944, 2944, 3328]
    - [25, 31694.0]
  - - [2944, 4288, 1, 3328, 2944, 2944, 2944, 3328]
    - [17, 35321.0]
  - - [5056, 2944, 1, 256, 5056, 5056, 5056, 256]
    - [10, 33692.0]
  - - [2368, 1856, 1, 256, 2368, 2368, 2368, 256]
    - [25, 28923.0]
  - - [1408, 3584, 1, 3328, 1408, 1408, 1408, 3328]
    - [3, 33572.0]
  - - [2368, 6784, 1, 256, 2368, 2368, 2368, 256]
    - [3, 33381.0]
  - - [4288, 2368, 1, 3328, 4288, 4288, 4288, 3328]
    - [25, 34217.0]
  - - [704, 3584, 1, 1280, 704, 704, 704, 1280]
    - [25, 28748.0]
  - - [1408, 5888, 1, 3328, 1408, 1408, 1408, 3328]
    - [20, 34590.0]
  - - [1856, 5056, 1, 256, 1856, 1856, 1856, 256]
    - [20, 31337.0]
  - - [6784, 6784, 1, 256, 6784, 6784, 6784, 256]
    - [25, 35319.0]
  - - [2368, 4288, 1, 1280, 2368, 2368, 2368, 1280]
    - [15, 33829.0]
  - - [3584, 1856, 1, 1280, 3584, 3584, 3584, 1280]
    - [25, 33117.0]
  - - [3584, 448, 1, 256, 3584, 3584, 3584, 256]
    - [24, 23732.0]
  - - [3584, 3584, 1, 1280, 3584, 3584, 3584, 1280]
    - [17, 36202.0]
  - - [256, 6784, 1, 256, 256, 256, 256, 256]
    - [16, 26623.0]
  - - [1856, 3584, 1, 3328, 1856, 1856, 1856, 3328]
    - [17, 34257.0]
  - - [3584, 3584, 1, 256, 3584, 3584, 3584, 256]
    - [23, 34731.0]
  - - [6784, 4288, 1, 1280, 6784, 6784, 6784, 1280]
    - [10, 35552.0]
  - - [3584, 5056, 1, 256, 3584, 3584, 3584, 256]
    - [23, 34155.0]
  - - [2944, 2368, 1, 1280, 2944, 2944, 2944, 1280]
    - [15, 32785.0]
  - - [6784, 3584, 1, 256, 6784, 6784, 6784, 256]
    - [25, 35130.0]
  - - [1856, 1408, 1, 256, 1856, 1856, 1856, 256]
    - [23, 26112.0]
  - - [2944, 2944, 1, 3328, 2944, 2944, 2944, 3328]
    - [3, 35012.0]
  - - [5056, 6784, 1, 256, 5056, 5056, 5056, 256]
    - [3, 34594.0]
  - - [1408, 4288, 1, 3328, 1408, 1408, 1408, 3328]
    - [3, 33068.0]
  - - [6784, 256, 1, 1280, 6784, 6784, 6784, 1280]
    - [16, 29537.0]
  - - [2368, 704, 1, 3328, 2368, 2368, 2368, 3328]
    - [14, 26833.0]
  - - [3584, 6784, 1, 256, 3584, 3584, 3584, 256]
    - [23, 35217.0]
  - - [5056, 1856, 1, 256, 5056, 5056, 5056, 256]
    - [20, 31444.0]
  - - [704, 4288, 1, 256, 704, 704, 704, 256]
    - [3, 25371.0]
  - - [1408, 6784, 1, 1280, 1408, 1408, 1408, 1280]
    - [25, 34742.0]
  - - [5056, 2368, 1, 3328, 5056, 5056, 5056, 3328]
    - [3, 33961.0]
  - - [2944, 4288, 1, 256, 2944, 2944, 2944, 256]
    - [20, 32842.0]
  - - [1408, 3584, 1, 1280, 1408, 1408, 1408, 1280]
    - [25, 33346.0]
  - - [2368, 6784, 1, 3328, 2368, 2368, 2368, 3328]
    - [15, 35021.0]
  - - [5056, 704, 1, 1280, 5056, 5056, 5056, 1280]
    - [20, 29493.0]
  - - [1856, 4288, 1, 3328, 1856, 1856, 1856, 3328]
    - [15, 32834.0]
  - - [1408, 5888, 1, 256, 1408, 1408, 1408, 256]
    - [30, 32772.0]
  - - [704, 2944, 1, 1280, 704, 704, 704, 1280]
    - [17, 29503.0]
  - - [3584, 704, 1, 1280, 3584, 3584, 3584, 1280]
    - [30, 28540.0]
  - - [5888, 5056, 1, 256, 5888, 5888, 5888, 256]
    - [23, 35450.0]
  - - [3584, 448, 1, 3328, 3584, 3584, 3584, 3328]
    - [2, 26023.0]
  - - [704, 2368, 1, 3328, 704, 704, 704, 3328]
    - [17, 24852.0]
  - - [448, 5056, 1, 3328, 448, 448, 448, 3328]
    - [3, 26409.0]
  - - [4288, 448, 1, 256, 4288, 4288, 4288, 256]
    - [2, 23666.0]
  - - [5888, 2368, 1, 256, 5888, 5888, 5888, 256]
    - [23, 33178.0]
  - - [6784, 704, 1, 3328, 6784, 6784, 6784, 3328]
    - [25, 31608.0]
  - - [1408, 2944, 1, 3328, 1408, 1408, 1408, 3328]
    - [15, 31681.0]
  - - [4288, 4288, 1, 256, 4288, 4288, 4288, 256]
    - [20, 33279.0]
  - - [2368, 704, 1, 256, 2368, 2368, 2368, 256]
    - [9, 23245.0]
  - - [3584, 2368, 1, 256, 3584, 3584, 3584, 256]
    - [23, 32016.0]
  - - [5888, 5056, 1, 1280, 5888, 5888, 5888, 1280]
    - [5, 35726.0]
  - - [3584, 3584, 1, 3328, 3584, 3584, 3584, 3328]
    - [17, 36558.0]
  - - [5888, 6784, 1, 256, 5888, 5888, 5888, 256]
    - [23, 36069.0]
  - - [4288, 2944, 1, 3328, 4288, 4288, 4288, 3328]
    - [3, 34931.0]
  - - [256, 5056, 1, 1280, 256, 256, 256, 1280]
    - [2, 24378.0]
  - - [6784, 5888, 1, 1280, 6784, 6784, 6784, 1280]
    - [17, 36293.0]
  - - [5888, 4288, 1, 1280, 5888, 5888, 5888, 1280]
    - [17, 35692.0]
  - - [1408, 1856, 1, 1280, 1408, 1408, 1408, 1280]
    - [30, 29844.0]
  - - [5888, 448, 1, 3328, 5888, 5888, 5888, 3328]
    - [19, 26502.0]
  - - [704, 5888, 1, 1280, 704, 704, 704, 1280]
    - [17, 30923.0]
  - - [5056, 2944, 1, 3328, 5056, 5056, 5056, 3328]
    - [10, 35046.0]
  - - [448, 4288, 1, 1280, 448, 448, 448, 1280]
    - [27, 27370.0]
  - - [3584, 704, 1, 256, 3584, 3584, 3584, 256]
    - [2, 25962.0]
  - - [3584, 1408, 1, 3328, 3584, 3584, 3584, 3328]
    - [20, 33593.0]
  - - [2368, 1024, 1, 1280, 2368, 2368, 2368, 1280]
    - [10, 27807.0]
  - - [2944, 6784, 1, 1280, 2944, 2944, 2944, 1280]
    - [25, 35826.0]
  - - [1856, 6784, 1, 256, 1856, 1856, 1856, 256]
    - [20, 32408.0]
  - - [4288, 448, 1, 3328, 4288, 4288, 4288, 3328]
    - [27, 28338.0]
  - - [6784, 704, 1, 1280, 6784, 6784, 6784, 1280]
    - [25, 31225.0]
  - - [5888, 1024, 1, 3328, 5888, 5888, 5888, 3328]
    - [25, 33777.0]
  - - [704, 6784, 1, 1280, 704, 704, 704, 1280]
    - [25, 31273.0]
  - - [5056, 1024, 1, 3328, 5056, 5056, 5056, 3328]
    - [3, 34423.0]
  - - [704, 5056, 1, 1280, 704, 704, 704, 1280]
    - [25, 29497.0]
  - - [2944, 1856, 1, 256, 2944, 2944, 2944, 256]
    - [25, 30030.0]
  - - [5888, 5056, 1, 3328, 5888, 5888, 5888, 3328]
    - [5, 36016.0]
  - - [3584, 6784, 1, 1280, 3584, 3584, 3584, 1280]
    - [3, 36116.0]
  - - [1856, 5888, 1, 256, 1856, 1856, 1856, 256]
    - [3, 32171.0]
  - - [4288, 4288, 1, 3328, 4288, 4288, 4288, 3328]
    - [20, 34963.0]
  - - [4288, 1408, 1, 1280, 4288, 4288, 4288, 1280]
    - [10, 33388.0]
  - - [4288, 2368, 1, 256, 4288, 4288, 4288, 256]
    - [30, 31942.0]
  - - [2944, 5056, 1, 1280, 2944, 2944, 2944, 1280]
    - [5, 35334.0]
  - - [6784, 2368, 1, 3328, 6784, 6784, 6784, 3328]
    - [25, 35030.0]
  - - [4288, 1856, 1, 3328, 4288, 4288, 4288, 3328]
    - [3, 32845.0]
  - - [1856, 2944, 1, 1280, 1856, 1856, 1856, 1280]
    - [3, 32425.0]
  - - [4288, 6784, 1, 3328, 4288, 4288, 4288, 3328]
    - [3, 35791.0]
  - - [3584, 1024, 1, 1280, 3584, 3584, 3584, 1280]
    - [15, 31301.0]
  - - [1024, 4288, 1, 256, 1024, 1024, 1024, 256]
    - [2, 28186.0]
  - - [5888, 3584, 1, 3328, 5888, 5888, 5888, 3328]
    - [17, 36602.0]
  - - [5056, 3584, 1, 3328, 5056, 5056, 5056, 3328]
    - [3, 35508.0]
  - - [2368, 1408, 1, 1280, 2368, 2368, 2368, 1280]
    - [15, 31939.0]
  - - [5056, 2944, 1, 1280, 5056, 5056, 5056, 1280]
    - [30, 34727.0]
  - - [1024, 6784, 1, 256, 1024, 1024, 1024, 256]
    - [3, 33129.0]
  - - [2944, 5056, 1, 3328, 2944, 2944, 2944, 3328]
    - [5, 35728.0]
  - - [3584, 2944, 1, 256, 3584, 3584, 3584, 256]
    - [10, 34054.0]
  - - [5056, 6784, 1, 3328, 5056, 5056, 5056, 3328]
    - [27, 35893.0]
  - - [3584, 4288, 1, 256, 3584, 3584, 3584, 256]
    - [23, 33206.0]
  - - [1856, 6784, 1, 3328, 1856, 1856, 1856, 3328]
    - [3, 34221.0]
  - - [5056, 1408, 1, 1280, 5056, 5056, 5056, 1280]
    - [3, 33441.0]
  - - [5888, 5888, 1, 256, 5888, 5888, 5888, 256]
    - [23, 35827.0]
  - - [4288, 1024, 1, 1280, 4288, 4288, 4288, 1280]
    - [25, 32021.0]
  - - [448, 6784, 1, 3328, 448, 448, 448, 3328]
    - [17, 30247.0]
  - - [2944, 1408, 1, 1280, 2944, 2944, 2944, 1280]
    - [3, 31414.0]
  - - [2944, 1856, 1, 3328, 2944, 2944, 2944, 3328]
    - [25, 32779.0]
  - - [448, 5056, 1, 256, 448, 448, 448, 256]
    - [2, 22458.0]
  - - [3584, 5888, 1, 1280, 3584, 3584, 3584, 1280]
    - [17, 36601.0]
  - - [6784, 1856, 1, 1280, 6784, 6784, 6784, 1280]
    - [10, 33914.0]
  - - [5888, 256, 1, 3328, 5888, 5888, 5888, 3328]
    - [3, 28373.0]
  - - [1856, 5888, 1, 3328, 1856, 1856, 1856, 3328]
    - [17, 34099.0]
  - - [3584, 1408, 1, 256, 3584, 3584, 3584, 256]
    - [3, 31539.0]
  - - [704, 3584, 1, 3328, 704, 704, 704, 3328]
    - [15, 29385.0]
  - - [5056, 448, 1, 1280, 5056, 5056, 5056, 1280]
    - [2, 27597.0]
  - - [3584, 1856, 1, 3328, 3584, 3584, 3584, 3328]
    - [30, 33378.0]
  - - [2944, 1024, 1, 256, 2944, 2944, 2944, 256]
    - [15, 27901.0]
  - - [2368, 4288, 1, 3328, 2368, 2368, 2368, 3328]
    - [15, 34194.0]
  - - [1024, 1408, 1, 1280, 1024, 1024, 1024, 1280]
    - [2, 27060.0]
  - - [6784, 5056, 1, 256, 6784, 6784, 6784, 256]
    - [10, 34434.0]
  - - [4288, 5888, 1, 256, 4288, 4288, 4288, 256]
    - [3, 34191.0]
  - - [2944, 6784, 1, 256, 2944, 2944, 2944, 256]
    - [25, 34781.0]
  - - [2368, 2368, 1, 1280, 2368, 2368, 2368, 1280]
    - [10, 31123.0]
  - - [1856, 3584, 1, 1280, 1856, 1856, 1856, 1280]
    - [17, 33742.0]
  - - [3584, 1408, 1, 1280, 3584, 3584, 3584, 1280]
    - [15, 33288.0]
  - - [5056, 3584, 1, 1280, 5056, 5056, 5056, 1280]
    - [15, 35205.0]
  - - [256, 5888, 1, 256, 256, 256, 256, 256]
    - [3, 24299.0]
  - - [1856, 1408, 1, 3328, 1856, 1856, 1856, 3328]
    - [3, 30580.0]
  - - [1024, 4288, 1, 3328, 1024, 1024, 1024, 3328]
    - [17, 33263.0]
  - - [2944, 2368, 1, 3328, 2944, 2944, 2944, 3328]
    - [3, 33131.0]
  - - [704, 4288, 1, 3328, 704, 704, 704, 3328]
    - [27, 30178.0]
  - - [1024, 1856, 1, 1280, 1024, 1024, 1024, 1280]
    - [17, 27334.0]
  - - [6784, 1856, 1, 256, 6784, 6784, 6784, 256]
    - [3, 32500.0]
  - - [1024, 5888, 1, 256, 1024, 1024, 1024, 256]
    - [15, 31838.0]
  - - [1408, 2368, 1, 256, 1408, 1408, 1408, 256]
    - [20, 27984.0]
  - - [2944, 704, 1, 3328, 2944, 2944, 2944, 3328]
    - [27, 30653.0]
  - - [2944, 2944, 1, 1280, 2944, 2944, 2944, 1280]
    - [15, 34779.0]
  - - [6784, 256, 1, 3328, 6784, 6784, 6784, 3328]
    - [16, 29938.0]
  - - [1408, 5056, 1, 256, 1408, 1408, 1408, 256]
    - [25, 31356.0]
  - - [1408, 4288, 1, 256, 1408, 1408, 1408, 256]
    - [25, 30117.0]
  - - [5888, 2368, 1, 1280, 5888, 5888, 5888, 1280]
    - [15, 34603.0]
  - - [2368, 5888, 1, 1280, 2368, 2368, 2368, 1280]
    - [15, 34520.0]
  - - [5888, 256, 1, 1280, 5888, 5888, 5888, 1280]
    - [15, 27713.0]
  - - [2368, 1856, 1, 3328, 2368, 2368, 2368, 3328]
    - [15, 32608.0]
  - - [2944, 704, 1, 256, 2944, 2944, 2944, 256]
    - [30, 25266.0]
  - - [2368, 6784, 1, 1280, 2368, 2368, 2368, 1280]
    - [15, 34806.0]
  - - [2368, 1024, 1, 3328, 2368, 2368, 2368, 3328]
    - [15, 28620.0]
  - - [1856, 4288, 1, 1280, 1856, 1856, 1856, 1280]
    - [25, 32494.0]
  - - [704, 3584, 1, 256, 704, 704, 704, 256]
    - [29, 24901.0]
  - - [704, 2944, 1, 3328, 704, 704, 704, 3328]
    - [5, 30680.0]
  - - [1856, 5056, 1, 3328, 1856, 1856, 1856, 3328]
    - [25, 33462.0]
  - - [3584, 5056, 1, 1280, 3584, 3584, 3584, 1280]
    - [25, 35284.0]
  - - [2944, 1024, 1, 3328, 2944, 2944, 2944, 3328]
    - [25, 30226.0]
  - - [1408, 6784, 1, 256, 1408, 1408, 1408, 256]
    - [25, 33314.0]
  - - [6784, 1408, 1, 3328, 6784, 6784, 6784, 3328]
    - [3, 34967.0]
  - - [1024, 2368, 1, 1280, 1024, 1024, 1024, 1280]
    - [25, 27922.0]
  - - [6784, 2944, 1, 1280, 6784, 6784, 6784, 1280]
    - [3, 35828.0]
  - - [3584, 448, 1, 1280, 3584, 3584, 3584, 1280]
    - [14, 25729.0]
  - - [2944, 6784, 1, 3328, 2944, 2944, 2944, 3328]
    - [3, 36035.0]
  - - [448, 5056, 1, 1280, 448, 448, 448, 1280]
    - [3, 25781.0]
  - - [4288, 5056, 1, 1280, 4288, 4288, 4288, 1280]
    - [27, 35411.0]
  - - [4288, 704, 1, 256, 4288, 4288, 4288, 256]
    - [9, 25539.0]
  - - [5888, 704, 1, 256, 5888, 5888, 5888, 256]
    - [30, 27822.0]
  - - [256, 5888, 1, 3328, 256, 256, 256, 3328]
    - [10, 28303.0]
  - - [6784, 4288, 1, 256, 6784, 6784, 6784, 256]
    - [15, 34426.0]
  - - [5888, 256, 1, 256, 5888, 5888, 5888, 256]
    - [10, 24330.0]
  - - [6784, 1024, 1, 1280, 6784, 6784, 6784, 1280]
    - [3, 34645.0]
  - - [2944, 704, 1, 1280, 2944, 2944, 2944, 1280]
    - [17, 29575.0]
  - - [6784, 3584, 1, 1280, 6784, 6784, 6784, 1280]
    - [10, 36153.0]
  - - [1408, 2944, 1, 1280, 1408, 1408, 1408, 1280]
    - [3, 31447.0]
  - - [1408, 2368, 1, 3328, 1408, 1408, 1408, 3328]
    - [3, 32591.0]
  - - [2368, 2944, 1, 256, 2368, 2368, 2368, 256]
    - [3, 31244.0]
  - - [3584, 1856, 1, 256, 3584, 3584, 3584, 256]
    - [15, 30973.0]
  - - [4288, 3584, 1, 1280, 4288, 4288, 4288, 1280]
    - [3, 34716.0]
  - - [4288, 2944, 1, 1280, 4288, 4288, 4288, 1280]
    - [3, 34767.0]
  - - [5056, 448, 1, 3328, 5056, 5056, 5056, 3328]
    - [14, 27829.0]
  - - [4288, 5056, 1, 3328, 4288, 4288, 4288, 3328]
    - [27, 35811.0]
  - - [256, 5056, 1, 3328, 256, 256, 256, 3328]
    - [2, 24708.0]
  - - [5056, 2368, 1, 256, 5056, 5056, 5056, 256]
    - [20, 32074.0]
  - - [4288, 704, 1, 3328, 4288, 4288, 4288, 3328]
    - [3, 29564.0]
  - - [448, 3584, 1, 256, 448, 448, 448, 256]
    - [2, 20169.0]
  - - [1024, 1408, 1, 3328, 1024, 1024, 1024, 3328]
    - [24, 27450.0]
  - - [2944, 5888, 1, 1280, 2944, 2944, 2944, 1280]
    - [15, 35937.0]
  - - [5888, 3584, 1, 256, 5888, 5888, 5888, 256]
    - [23, 35805.0]
  - - [1408, 1856, 1, 3328, 1408, 1408, 1408, 3328]
    - [25, 30528.0]
  - - [6784, 1408, 1, 1280, 6784, 6784, 6784, 1280]
    - [25, 34750.0]
  - - [704, 2944, 1, 256, 704, 704, 704, 256]
    - [3, 25411.0]
  - - [2944, 5888, 1, 3328, 2944, 2944, 2944, 3328]
    - [5, 36283.0]
  - - [1408, 1408, 1, 1280, 1408, 1408, 1408, 1280]
    - [3, 28499.0]
  - - [448, 4288, 1, 3328, 448, 448, 448, 3328]
    - [17, 28505.0]
  - - [704, 2368, 1, 256, 704, 704, 704, 256]
    - [19, 21232.0]
  - - [5888, 2368, 1, 3328, 5888, 5888, 5888, 3328]
    - [15, 34845.0]
  - - [4288, 5056, 1, 256, 4288, 4288, 4288, 256]
    - [15, 33511.0]
  - - [4288, 448, 1, 1280, 4288, 4288, 4288, 1280]
    - [17, 27021.0]
  - - [5888, 704, 1, 3328, 5888, 5888, 5888, 3328]
    - [25, 30892.0]
  - - [4288, 3584, 1, 3328, 4288, 4288, 4288, 3328]
    - [3, 35528.0]
  - - [1024, 6784, 1, 3328, 1024, 1024, 1024, 3328]
    - [17, 35603.0]
  - - [1408, 1024, 1, 256, 1408, 1408, 1408, 256]
    - [2, 24705.0]
  - - [6784, 6784, 1, 3328, 6784, 6784, 6784, 3328]
    - [3, 36398.0]
  - - [704, 5056, 1, 3328, 704, 704, 704, 3328]
    - [15, 30003.0]
  - - [3584, 5056, 1, 3328, 3584, 3584, 3584, 3328]
    - [25, 35439.0]
  - - [2368, 2944, 1, 3328, 2368, 2368, 2368, 3328]
    - [25, 33053.0]
  - - [2368, 3584, 1, 256, 2368, 2368, 2368, 256]
    - [10, 32064.0]
  - - [3584, 2368, 1, 1280, 3584, 3584, 3584, 1280]
    - [25, 33888.0]
  - - [1856, 1856, 1, 256, 1856, 1856, 1856, 256]
    - [3, 25845.0]
  - - [4288, 1408, 1, 3328, 4288, 4288, 4288, 3328]
    - [30, 33554.0]
  - - [5888, 1408, 1, 3328, 5888, 5888, 5888, 3328]
    - [10, 34590.0]
  - - [256, 5056, 1, 256, 256, 256, 256, 256]
    - [2, 22389.0]
  - - [2368, 5056, 1, 256, 2368, 2368, 2368, 256]
    - [10, 31867.0]
  - - [1024, 5056, 1, 256, 1024, 1024, 1024, 256]
    - [25, 30681.0]
  - - [2368, 1408, 1, 3328, 2368, 2368, 2368, 3328]
    - [3, 32599.0]
  - - [5888, 448, 1, 256, 5888, 5888, 5888, 256]
    - [14, 25010.0]
  - - [6784, 5056, 1, 1280, 6784, 6784, 6784, 1280]
    - [25, 35749.0]
  - - [4288, 6784, 1, 1280, 4288, 4288, 4288, 1280]
    - [25, 35600.0]
  - - [6784, 1408, 1, 256, 6784, 6784, 6784, 256]
    - [10, 33341.0]
  - - [5888, 4288, 1, 256, 5888, 5888, 5888, 256]
    - [23, 34694.0]
  - - [5056, 5888, 1, 256, 5056, 5056, 5056, 256]
    - [3, 34559.0]
  - - [2368, 1024, 1, 256, 2368, 2368, 2368, 256]
    - [1, 24555.0]
  - - [1856, 6784, 1, 1280, 1856, 1856, 1856, 1280]
    - [3, 34010.0]
  - - [6784, 448, 1, 3328, 6784, 6784, 6784, 3328]
    - [30, 29717.0]
  - - [5056, 1856, 1, 1280, 5056, 5056, 5056, 1280]
    - [15, 33177.0]
  - - [1408, 1024, 1, 3328, 1408, 1408, 1408, 3328]
    - [2, 27447.0]
  - - [5888, 3584, 1, 1280, 5888, 5888, 5888, 1280]
    - [5, 36359.0]
  - - [1024, 2944, 1, 256, 1024, 1024, 1024, 256]
    - [25, 27881.0]
  - - [448, 6784, 1, 1280, 448, 448, 448, 1280]
    - [17, 29565.0]
  - - [704, 5056, 1, 256, 704, 704, 704, 256]
    - [25, 26199.0]
  - - [3584, 1024, 1, 3328, 3584, 3584, 3584, 3328]
    - [3, 31807.0]
  - - [2944, 1856, 1, 1280, 2944, 2944, 2944, 1280]
    - [30, 32356.0]
  - - [5056, 256, 1, 256, 5056, 5056, 5056, 256]
    - [2, 21240.0]
  - - [2368, 3584, 1, 3328, 2368, 2368, 2368, 3328]
    - [3, 34237.0]
  - - [3584, 5888, 1, 3328, 3584, 3584, 3584, 3328]
    - [17, 36870.0]
  - - [2944, 3584, 1, 1280, 2944, 2944, 2944, 1280]
    - [15, 35388.0]
  - - [1856, 5888, 1, 1280, 1856, 1856, 1856, 1280]
    - [3, 33766.0]
  - - [4288, 1408, 1, 256, 4288, 4288, 4288, 256]
    - [10, 30509.0]
  - - [4288, 2368, 1, 1280, 4288, 4288, 4288, 1280]
    - [3, 33891.0]
  - - [2944, 5056, 1, 256, 2944, 2944, 2944, 256]
    - [20, 33414.0]
  - - [6784, 2368, 1, 256, 6784, 6784, 6784, 256]
    - [15, 33251.0]
  - - [4288, 1856, 1, 256, 4288, 4288, 4288, 256]
    - [15, 30711.0]
  - - [1856, 2944, 1, 256, 1856, 1856, 1856, 256]
    - [10, 29749.0]
  - - [1856, 1408, 1, 1280, 1856, 1856, 1856, 1280]
    - [3, 29957.0]
  - - [1024, 4288, 1, 1280, 1024, 1024, 1024, 1280]
    - [17, 32160.0]
  - - [2368, 5056, 1, 3328, 2368, 2368, 2368, 3328]
    - [3, 33954.0]
  - - [4288, 1024, 1, 3328, 4288, 4288, 4288, 3328]
    - [3, 32801.0]
  - - [1024, 5056, 1, 3328, 1024, 1024, 1024, 3328]
    - [30, 34349.0]
  - - [1024, 1856, 1, 3328, 1024, 1024, 1024, 3328]
    - [17, 28297.0]
  - - [3584, 2944, 1, 3328, 3584, 3584, 3584, 3328]
    - [3, 35602.0]
  - - [5888, 2944, 1, 256, 5888, 5888, 5888, 256]
    - [20, 34739.0]
  - - [5056, 4288, 1, 256, 5056, 5056, 5056, 256]
    - [15, 33450.0]
  - - [1024, 3584, 1, 256, 1024, 1024, 1024, 256]
    - [3, 29287.0]
  - - [5056, 1408, 1, 256, 5056, 5056, 5056, 256]
    - [10, 32006.0]
  - - [5888, 5888, 1, 1280, 5888, 5888, 5888, 1280]
    - [15, 36239.0]
  - - [448, 5888, 1, 1280, 448, 448, 448, 1280]
    - [17, 25700.0]
  - - [4288, 704, 1, 1280, 4288, 4288, 4288, 1280]
    - [3, 28965.0]
  - - [2944, 1408, 1, 256, 2944, 2944, 2944, 256]
    - [25, 29608.0]
  - - [2368, 5888, 1, 3328, 2368, 2368, 2368, 3328]
    - [20, 34793.0]
  - - [2368, 1856, 1, 1280, 2368, 2368, 2368, 1280]
    - [15, 32025.0]
  - - [5888, 4288, 1, 3328, 5888, 5888, 5888, 3328]
    - [17, 35983.0]
  - - [5056, 448, 1, 256, 5056, 5056, 5056, 256]
    - [2, 24738.0]
  - - [1856, 5056, 1, 1280, 1856, 1856, 1856, 1280]
    - [15, 33195.0]
  - - [2944, 1024, 1, 1280, 2944, 2944, 2944, 1280]
    - [3, 29853.0]
  - - [2368, 4288, 1, 256, 2368, 2368, 2368, 256]
    - [25, 31934.0]
  - - [1024, 2368, 1, 3328, 1024, 1024, 1024, 3328]
    - [15, 28741.0]
  - - [4288, 5888, 1, 3328, 4288, 4288, 4288, 3328]
    - [17, 36066.0]
  - - [1024, 2944, 1, 3328, 1024, 1024, 1024, 3328]
    - [17, 30263.0]
  - - [256, 6784, 1, 1280, 256, 256, 256, 1280]
    - [26, 29405.0]
  - - [1856, 3584, 1, 256, 1856, 1856, 1856, 256]
    - [3, 30917.0]
  - - [256, 5888, 1, 1280, 256, 256, 256, 1280]
    - [3, 27713.0]
  - - [2944, 2368, 1, 256, 2944, 2944, 2944, 256]
    - [25, 30341.0]
  - - [1024, 1856, 1, 256, 1024, 1024, 1024, 256]
    - [2, 24723.0]
  - - [6784, 3584, 1, 3328, 6784, 6784, 6784, 3328]
    - [5, 36376.0]
  - - [1024, 5888, 1, 3328, 1024, 1024, 1024, 3328]
    - [3, 33773.0]
  - - [1408, 2368, 1, 1280, 1408, 1408, 1408, 1280]
    - [3, 31825.0]
  - - [2944, 2944, 1, 256, 2944, 2944, 2944, 256]
    - [25, 33486.0]
  - - [6784, 256, 1, 256, 6784, 6784, 6784, 256]
    - [16, 26913.0]
  - - [5888, 1408, 1, 256, 5888, 5888, 5888, 256]
    - [23, 33017.0]
  - - [5888, 6784, 1, 3328, 5888, 5888, 5888, 3328]
    - [20, 36492.0]
  - - [704, 4288, 1, 1280, 704, 704, 704, 1280]
    - [27, 29101.0]
  - - [4096, 7000, 1, 4096, 4096, 4096, 4096, 4096]
    - [10, 35978.0]
  - - [5124, 9124, 1, 1760, 5124, 5124, 5124, 1760]
    - [23, 37429.0]
  - - [1024, 1500, 1, 1536, 1024, 1024, 1024, 1536]
    - [15, 27150.0]
  - - [512, 24000, 1, 2048, 512, 512, 512, 2048]
    - [30, 35309.0]
  - - [3072, 24000, 1, 1024, 3072, 3072, 3072, 1024]
    - [10, 36282.0]
  - - [1024, 3000, 1, 2560, 1024, 1024, 1024, 2560]
    - [17, 30425.0]
  - - [512, 3136, 1, 2048, 512, 512, 512, 2048]
    - [20, 29152.0]
  - - [8448, 1500, 1, 2816, 8448, 8448, 8448, 2816]
    - [15, 35042.0]
  - - [2560, 7000, 1, 2560, 2560, 2560, 2560, 2560]
    - [15, 35385.0]
  - - [512, 48000, 1, 2048, 512, 512, 512, 2048]
    - [20, 35693.0]
  - - [196, 256, 64, 1024, 196, 196, 196, 1024]
    - [10, 23157.0]
  - - [512, 48000, 1, 1536, 512, 512, 512, 1536]
    - [21, 35743.0]
  - - [4608, 1500, 1, 1536, 4608, 4608, 4608, 1536]
    - [30, 34092.0]
  - - [1024, 24000, 1, 2560, 1024, 1024, 1024, 2560]
    - [17, 36307.0]
  - - [4608, 3000, 1, 1536, 4608, 4608, 4608, 1536]
    - [17, 35197.0]
  - - [5124, 9124, 1, 2048, 5124, 5124, 5124, 2048]
    - [21, 35216.0]
  - - [5124, 700, 1, 2560, 5124, 5124, 5124, 2560]
    - [15, 29968.0]
  - - [6144, 6000, 1, 2560, 6144, 6144, 6144, 2560]
    - [25, 36274.0]
  - - [1024, 1500, 1, 2816, 1024, 1024, 1024, 2816]
    - [30, 28083.0]
  - - [8448, 48000, 1, 2816, 8448, 8448, 8448, 2816]
    - [21, 37032.0]
  - - [512, 6000, 1, 2048, 512, 512, 512, 2048]
    - [32, 30105.0]
  - - [4224, 1500, 1, 176, 4224, 4224, 4224, 176]
    - [23, 29993.0]
  - - [1024, 6000, 1, 2816, 1024, 1024, 1024, 2816]
    - [25, 33518.0]
  - - [1024, 48000, 1, 1536, 1024, 1024, 1024, 1536]
    - [15, 36315.0]
  - - [1024, 48000, 1, 2560, 1024, 1024, 1024, 2560]
    - [17, 36575.0]
  - - [4608, 24000, 1, 1536, 4608, 4608, 4608, 1536]
    - [17, 36910.0]
  - - [7680, 48000, 1, 2560, 7680, 7680, 7680, 2560]
    - [5, 37121.0]
  - - [3072, 48000, 1, 1024, 3072, 3072, 3072, 1024]
    - [15, 36492.0]
  - - [1024, 1500, 1, 2048, 1024, 1024, 1024, 2048]
    - [30, 27546.0]
  - - [1024, 3000, 1, 2048, 1024, 1024, 1024, 2048]
    - [32, 30201.0]
  - - [1024, 6000, 1, 2048, 1024, 1024, 1024, 2048]
    - [30, 33320.0]
  - - [512, 24000, 1, 2816, 512, 512, 512, 2816]
    - [20, 35405.0]
  - - [6144, 48000, 1, 2560, 6144, 6144, 6144, 2560]
    - [5, 37004.0]
  - - [1760, 7000, 1, 1760, 1760, 1760, 1760, 1760]
    - [23, 36104.0]
  - - [8448, 3000, 1, 2816, 8448, 8448, 8448, 2816]
    - [15, 35339.0]
  - - [4608, 48000, 1, 1536, 4608, 4608, 4608, 1536]
    - [21, 36921.0]
  - - [7680, 1500, 1, 2560, 7680, 7680, 7680, 2560]
    - [21, 34978.0]
  - - [512, 3000, 1, 1536, 512, 512, 512, 1536]
    - [30, 27587.0]
  - - [1024, 3000, 1, 2816, 1024, 1024, 1024, 2816]
    - [27, 30692.0]
  - - [5124, 9124, 1, 2560, 5124, 5124, 5124, 2560]
    - [17, 35143.0]
  - - [512, 48000, 1, 2816, 512, 512, 512, 2816]
    - [17, 36456.0]
  - - [512, 3000, 1, 2816, 512, 512, 512, 2816]
    - [30, 28054.0]
  - - [1024, 24000, 1, 1536, 1024, 1024, 1024, 1536]
    - [21, 36123.0]
  - - [7680, 6000, 1, 2560, 7680, 7680, 7680, 2560]
    - [3, 36255.0]
  - - [512, 6000, 1, 2560, 512, 512, 512, 2560]
    - [32, 30289.0]
  - - [512, 24000, 1, 2560, 512, 512, 512, 2560]
    - [30, 35336.0]
  - - [6144, 3000, 1, 2560, 6144, 6144, 6144, 2560]
    - [17, 35582.0]
  - - [1024, 24000, 1, 2816, 1024, 1024, 1024, 2816]
    - [17, 36458.0]
  - - [2048, 7000, 1, 2048, 2048, 2048, 2048, 2048]
    - [20, 34872.0]
  - - [7680, 3000, 1, 2560, 7680, 7680, 7680, 2560]
    - [17, 35769.0]
  - - [5124, 700, 1, 2048, 5124, 5124, 5124, 2048]
    - [20, 29912.0]
  - - [5124, 9124, 1, 4096, 5124, 5124, 5124, 4096]
    - [32, 35148.0]
  - - [256, 193600, 1, 64, 256, 256, 256, 64]
    - [8, 31764.0]
  - - [8448, 6000, 1, 2816, 8448, 8448, 8448, 2816]
    - [20, 36239.0]
  - - [5124, 1500, 1, 2560, 5124, 5124, 5124, 2560]
    - [17, 33371.0]
  - - [1024, 1500, 1, 2560, 1024, 1024, 1024, 2560]
    - [20, 28171.0]
  - - [1024, 6000, 1, 2560, 1024, 1024, 1024, 2560]
    - [25, 33437.0]
  - - [196, 1024, 64, 256, 196, 196, 196, 256]
    - [3, 25237.0]
  - - [512, 50176, 1, 128, 512, 512, 512, 128]
    - [23, 35588.0]
  - - [7680, 24000, 1, 2560, 7680, 7680, 7680, 2560]
    - [17, 37015.0]
  - - [512, 3000, 1, 2560, 512, 512, 512, 2560]
    - [25, 27754.0]
  - - [8448, 24000, 1, 2816, 8448, 8448, 8448, 2816]
    - [5, 36922.0]
  - - [512, 6000, 1, 1536, 512, 512, 512, 1536]
    - [32, 29695.0]
  - - [3072, 6000, 1, 1024, 3072, 3072, 3072, 1024]
    - [21, 35333.0]
  - - [3072, 1500, 1, 128, 3072, 3072, 3072, 128]
    - [24, 25847.0]
  - - [2048, 3136, 1, 512, 2048, 2048, 2048, 512]
    - [20, 31497.0]
  - - [1024, 3000, 1, 1536, 1024, 1024, 1024, 1536]
    - [17, 30147.0]
  - - [512, 6000, 1, 2816, 512, 512, 512, 2816]
    - [17, 30676.0]
  - - [128, 50176, 1, 512, 128, 128, 128, 512]
    - [20, 33942.0]
  - - [256, 12544, 1, 1024, 256, 256, 256, 1024]
    - [21, 31431.0]
  - - [1024, 12544, 1, 256, 1024, 1024, 1024, 256]
    - [23, 34397.0]
  - - [512, 48000, 1, 2560, 512, 512, 512, 2560]
    - [21, 36139.0]
  - - [512, 24000, 1, 1536, 512, 512, 512, 1536]
    - [10, 35081.0]
  - - [1024, 24000, 1, 2048, 1024, 1024, 1024, 2048]
    - [21, 36056.0]
  - - [5124, 1500, 1, 2048, 5124, 5124, 5124, 2048]
    - [21, 33147.0]
  - - [3072, 1500, 1, 1024, 3072, 3072, 3072, 1024]
    - [25, 33206.0]
  - - [6144, 1500, 1, 2560, 6144, 6144, 6144, 2560]
    - [25, 34722.0]
  - - [1024, 48000, 1, 2816, 1024, 1024, 1024, 2816]
    - [17, 36805.0]
  - - [1024, 6000, 1, 1536, 1024, 1024, 1024, 1536]
    - [20, 32962.0]
  - - [512, 3000, 1, 2048, 512, 512, 512, 2048]
    - [10, 27932.0]
  - - [6144, 24000, 1, 2560, 6144, 6144, 6144, 2560]
    - [5, 36895.0]
  - - [4608, 6000, 1, 1536, 4608, 4608, 4608, 1536]
    - [3, 35879.0]
  - - [3072, 3000, 1, 1024, 3072, 3072, 3072, 1024]
    - [20, 34319.0]
  - - [1024, 48000, 1, 2048, 1024, 1024, 1024, 2048]
    - [20, 35925.0]
  - - [784, 512, 64, 128, 784, 784, 784, 128]
    - [1, 30268.0]
  - - [3136, 256, 64, 64, 3136, 3136, 3136, 64]
    - [8, 31963.0]
  - - [12544, 1024, 1, 256, 12544, 12544, 12544, 256]
    - [23, 35034.0]
  - - [784, 128, 128, 512, 784, 784, 784, 512]
    - [10, 29436.0]
  - - [784, 512, 256, 128, 784, 784, 784, 128]
    - [3, 28209.0]
  - - [3136, 512, 1, 2048, 3136, 3136, 3136, 2048]
    - [10, 28460.0]
  - - [12544, 256, 1, 1024, 12544, 12544, 12544, 1024]
    - [3, 31139.0]
  - - [3136, 2048, 1, 512, 3136, 3136, 3136, 512]
    - [3, 31546.0]
  - - [3136, 256, 256, 64, 3136, 3136, 3136, 64]
    - [0, 19027.0]
  - - [784, 128, 64, 512, 784, 784, 784, 512]
    - [20, 28265.0]
  - - [784, 512, 128, 128, 784, 784, 784, 128]
    - [1, 29305.0]
  - - [784, 128, 256, 512, 784, 784, 784, 512]
    - [10, 27923.0]
  - - [3136, 256, 128, 64, 3136, 3136, 3136, 64]
    - [0, 23967.0]
  - - [128, 128, 512, 64, 128, 128, 128, 64]
    - [7, 24161.0]
  - - [512, 512, 64, 64, 512, 512, 512, 64]
    - [8, 29876.0]
  - - [1024, 2048, 1, 2, 1024, 1024, 1024, 2]
    - [22, 1121.0]
  - - [1024, 2048, 1, 1024, 1024, 1024, 1024, 1024]
    - [21, 30400.0]
  - - [1024, 2048, 1, 4096, 1024, 1024, 1024, 4096]
    - [21, 31302.0]
  - - [1024, 2048, 1, 30528, 1024, 1024, 1024, 30528]
    - [5, 31774.0]
  - - [1024, 4096, 1, 1024, 1024, 1024, 1024, 1024]
    - [30, 31051.0]
  - - [1024, 4096, 1, 4096, 1024, 1024, 1024, 4096]
    - [32, 32088.0]
  - - [1024, 4096, 1, 30528, 1024, 1024, 1024, 30528]
    - [5, 32449.0]
  - - [4096, 2048, 1, 1024, 4096, 4096, 4096, 1024]
    - [20, 33489.0]
  - - [4096, 4096, 1, 1024, 4096, 4096, 4096, 1024]
    - [10, 35180.0]
  - - [256, 8976, 1, 1536, 256, 256, 256, 1536]
    - [11, 31930.0]
  - - [256, 8976, 1, 2048, 256, 256, 256, 2048]
    - [11, 33514.0]
  - - [256, 8976, 1, 2304, 256, 256, 256, 2304]
    - [17, 33666.0]
  - - [256, 8976, 1, 2560, 256, 256, 256, 2560]
    - [32, 33480.0]
  - - [256, 8976, 1, 2816, 256, 256, 256, 2816]
    - [32, 33761.0]
  - - [256, 8976, 1, 3072, 256, 256, 256, 3072]
    - [21, 33833.0]
  - - [256, 8976, 1, 4352, 256, 256, 256, 4352]
    - [5, 34212.0]
  - - [256, 8976, 1, 4864, 256, 256, 256, 4864]
    - [27, 34276.0]
  - - [256, 8976, 1, 5376, 256, 256, 256, 5376]
    - [11, 34187.0]
  - - [256, 8976, 1, 5632, 256, 256, 256, 5632]
    - [11, 34175.0]
  - - [256, 8976, 1, 5888, 256, 256, 256, 5888]
    - [21, 34230.0]
  - - [256, 8976, 1, 6144, 256, 256, 256, 6144]
    - [32, 34113.0]
  - - [256, 8976, 1, 6656, 256, 256, 256, 6656]
    - [21, 34181.0]
  - - [256, 8976, 1, 7168, 256, 256, 256, 7168]
    - [32, 33594.0]
  - - [256, 8976, 1, 7424, 256, 256, 256, 7424]
    - [11, 33914.0]
  - - [256, 8976, 1, 8192, 256, 256, 256, 8192]
    - [10, 32310.0]
  - - [256, 8976, 1, 8448, 256, 256, 256, 8448]
    - [32, 33704.0]
  - - [256, 8976, 1, 8960, 256, 256, 256, 8960]
    - [21, 33590.0]
  - - [256, 8976, 1, 9472, 256, 256, 256, 9472]
    - [32, 33693.0]
  - - [256, 8976, 1, 9728, 256, 256, 256, 9728]
    - [32, 33319.0]
  - - [256, 8976, 1, 9984, 256, 256, 256, 9984]
    - [32, 33627.0]
  - - [256, 8976, 1, 10240, 256, 256, 256, 10240]
    - [20, 31608.0]
  - - [256, 8976, 1, 10496, 256, 256, 256, 10496]
    - [21, 33623.0]
  - - [256, 8976, 1, 11008, 256, 256, 256, 11008]
    - [32, 33402.0]
  - - [256, 8976, 1, 11520, 256, 256, 256, 11520]
    - [11, 33450.0]
  - - [256, 8976, 1, 12288, 256, 256, 256, 12288]
    - [30, 30418.0]
  - - [256, 8976, 1, 14336, 256, 256, 256, 14336]
    - [30, 30511.0]
  - - [256, 8976, 1, 14848, 256, 256, 256, 14848]
    - [30, 33171.0]
  - - [256, 8976, 1, 15104, 256, 256, 256, 15104]
    - [5, 33580.0]
  - - [256, 8976, 1, 15872, 256, 256, 256, 15872]
    - [20, 33113.0]
  - - [256, 8976, 1, 17152, 256, 256, 256, 17152]
    - [21, 33447.0]
  - - [256, 8976, 1, 19712, 256, 256, 256, 19712]
    - [11, 33508.0]
  - - [256, 8976, 1, 19968, 256, 256, 256, 19968]
    - [10, 33251.0]
  - - [256, 8976, 1, 20480, 256, 256, 256, 20480]
    - [20, 30382.0]
  - - [256, 8976, 1, 20992, 256, 256, 256, 20992]
    - [10, 33160.0]
  - - [256, 8976, 1, 22016, 256, 256, 256, 22016]
    - [10, 33222.0]
  - - [256, 8976, 1, 26112, 256, 256, 256, 26112]
    - [30, 32919.0]
  - - [256, 8976, 1, 33536, 256, 256, 256, 33536]
    - [20, 33170.0]
  - - [256, 8976, 1, 44505, 256, 256, 256, 44505]
    - [27, 34625.0]
  - - [256, 32768, 1, 128, 256, 256, 256, 128]
    - [23, 31692.0]
  - - [480, 32768, 1, 1024, 480, 480, 480, 1024]
    - [30, 32735.0]
  - - [512, 32768, 1, 256, 512, 512, 512, 256]
    - [25, 34190.0]
  - - [1024, 1600, 1, 1, 1024, 1024, 1024, 1]
    - [22, 493.0]
  - - [1024, 1600, 1, 1024, 1024, 1024, 1024, 1024]
    - [30, 28446.0]
  - - [1024, 1792, 1, 256, 1024, 1024, 1024, 256]
    - [17, 24365.0]
  - - [1024, 2048, 1, 256, 1024, 1024, 1024, 256]
    - [17, 27504.0]
  - - [1024, 2560, 1, 256, 1024, 1024, 1024, 256]
    - [25, 27846.0]
  - - [1024, 3072, 1, 256, 1024, 1024, 1024, 256]
    - [3, 28760.0]
  - - [1024, 3328, 1, 256, 1024, 1024, 1024, 256]
    - [15, 30590.0]
  - - [1024, 3840, 1, 256, 1024, 1024, 1024, 256]
    - [25, 30954.0]
  - - [1024, 4096, 1, 256, 1024, 1024, 1024, 256]
    - [25, 29450.0]
  - - [1024, 4608, 1, 256, 1024, 1024, 1024, 256]
    - [17, 32789.0]
  - - [1024, 4864, 1, 256, 1024, 1024, 1024, 256]
    - [3, 31175.0]
  - - [1024, 5120, 1, 256, 1024, 1024, 1024, 256]
    - [3, 32530.0]
  - - [1024, 5632, 1, 256, 1024, 1024, 1024, 256]
    - [25, 32591.0]
  - - [1024, 6144, 1, 256, 1024, 1024, 1024, 256]
    - [25, 32524.0]
  - - [1024, 6400, 1, 256, 1024, 1024, 1024, 256]
    - [3, 31932.0]
  - - [1024, 7168, 1, 256, 1024, 1024, 1024, 256]
    - [3, 32476.0]
  - - [1024, 7424, 1, 256, 1024, 1024, 1024, 256]
    - [3, 33473.0]
  - - [1024, 7680, 1, 256, 1024, 1024, 1024, 256]
    - [23, 32875.0]
  - - [1024, 7936, 1, 256, 1024, 1024, 1024, 256]
    - [3, 33382.0]
  - - [1024, 8192, 1, 256, 1024, 1024, 1024, 256]
    - [23, 32617.0]
  - - [1024, 8448, 1, 256, 1024, 1024, 1024, 256]
    - [3, 33252.0]
  - - [1024, 8704, 1, 256, 1024, 1024, 1024, 256]
    - [15, 33001.0]
  - - [1024, 8960, 1, 256, 1024, 1024, 1024, 256]
    - [23, 33335.0]
  - - [1024, 9728, 1, 256, 1024, 1024, 1024, 256]
    - [3, 34020.0]
  - - [1024, 9984, 1, 256, 1024, 1024, 1024, 256]
    - [23, 33290.0]
  - - [1024, 10240, 1, 256, 1024, 1024, 1024, 256]
    - [23, 33851.0]
  - - [1024, 10496, 1, 256, 1024, 1024, 1024, 256]
    - [23, 33612.0]
  - - [1024, 11008, 1, 256, 1024, 1024, 1024, 256]
    - [15, 33672.0]
  - - [1024, 11264, 1, 256, 1024, 1024, 1024, 256]
    - [23, 34042.0]
  - - [1024, 11520, 1, 256, 1024, 1024, 1024, 256]
    - [17, 34450.0]
  - - [1024, 12288, 1, 256, 1024, 1024, 1024, 256]
    - [23, 34167.0]
  - - [1024, 13312, 1, 256, 1024, 1024, 1024, 256]
    - [23, 34252.0]
  - - [1024, 13568, 1, 256, 1024, 1024, 1024, 256]
    - [23, 34134.0]
  - - [1024, 14336, 1, 256, 1024, 1024, 1024, 256]
    - [15, 34471.0]
  - - [1024, 14592, 1, 256, 1024, 1024, 1024, 256]
    - [23, 34498.0]
  - - [1024, 14848, 1, 256, 1024, 1024, 1024, 256]
    - [23, 34759.0]
  - - [1024, 15104, 1, 256, 1024, 1024, 1024, 256]
    - [23, 34328.0]
  - - [1024, 16128, 1, 256, 1024, 1024, 1024, 256]
    - [17, 34895.0]
  - - [1024, 17152, 1, 256, 1024, 1024, 1024, 256]
    - [17, 34661.0]
  - - [1024, 18944, 1, 256, 1024, 1024, 1024, 256]
    - [23, 35026.0]
  - - [1024, 19712, 1, 256, 1024, 1024, 1024, 256]
    - [23, 35214.0]
  - - [1024, 19968, 1, 256, 1024, 1024, 1024, 256]
    - [23, 35159.0]
  - - [1024, 20480, 1, 256, 1024, 1024, 1024, 256]
    - [23, 35283.0]
  - - [1024, 20992, 1, 256, 1024, 1024, 1024, 256]
    - [23, 35055.0]
  - - [1024, 21504, 1, 256, 1024, 1024, 1024, 256]
    - [23, 35342.0]
  - - [1024, 22016, 1, 256, 1024, 1024, 1024, 256]
    - [23, 35230.0]
  - - [1024, 23552, 1, 256, 1024, 1024, 1024, 256]
    - [23, 35341.0]
  - - [1024, 28672, 1, 256, 1024, 1024, 1024, 256]
    - [23, 35494.0]
  - - [1024, 32768, 1, 512, 1024, 1024, 1024, 512]
    - [25, 35695.0]
  - - [1024, 32768, 1, 1024, 1024, 1024, 1024, 1024]
    - [20, 35931.0]
  - - [1024, 33536, 1, 256, 1024, 1024, 1024, 256]
    - [23, 35609.0]
  - - [1024, 40448, 1, 256, 1024, 1024, 1024, 256]
    - [23, 35933.0]
  - - [2048, 960, 1, 2048, 2048, 2048, 2048, 2048]
    - [27, 28589.0]
  - - [2048, 1024, 1, 1, 2048, 2048, 2048, 1]
    - [16, 570.0]
  - - [2048, 1024, 1, 256, 2048, 2048, 2048, 256]
    - [3, 27336.0]
  - - [3200, 1024, 1, 2048, 3200, 3200, 3200, 2048]
    - [30, 31966.0]
  - - [4096, 1024, 1, 1, 4096, 4096, 4096, 1]
    - [22, 647.0]
  - - [1024, 3840, 1, 1024, 1024, 1024, 1024, 1024]
    - [20, 32699.0]
  - - [1024, 3840, 1, 4096, 1024, 1024, 1024, 4096]
    - [20, 33303.0]
  - - [1024, 3968, 1, 1024, 1024, 1024, 1024, 1024]
    - [30, 33767.0]
  - - [1024, 3968, 1, 4096, 1024, 1024, 1024, 4096]
    - [20, 34400.0]
  - - [1024, 3968, 1, 42720, 1024, 1024, 1024, 42720]
    - [8, 35112.0]
  - - [1024, 6528, 1, 1024, 1024, 1024, 1024, 1024]
    - [10, 33023.0]
  - - [1024, 6528, 1, 4096, 1024, 1024, 1024, 4096]
    - [21, 34296.0]
  - - [1024, 6528, 1, 42720, 1024, 1024, 1024, 42720]
    - [23, 35211.0]
  - - [1024, 7104, 1, 1024, 1024, 1024, 1024, 1024]
    - [10, 32873.0]
  - - [1024, 7104, 1, 4096, 1024, 1024, 1024, 4096]
    - [20, 33714.0]
  - - [1024, 7104, 1, 42720, 1024, 1024, 1024, 42720]
    - [13, 35488.0]
  - - [1024, 7200, 1, 1024, 1024, 1024, 1024, 1024]
    - [30, 32833.0]
  - - [1024, 7200, 1, 4096, 1024, 1024, 1024, 4096]
    - [20, 34237.0]
  - - [1024, 7200, 1, 42720, 1024, 1024, 1024, 42720]
    - [13, 35775.0]
  - - [1024, 8064, 1, 1024, 1024, 1024, 1024, 1024]
    - [10, 34955.0]
  - - [1024, 8064, 1, 4096, 1024, 1024, 1024, 4096]
    - [20, 35632.0]
  - - [1024, 8160, 1, 1024, 1024, 1024, 1024, 1024]
    - [30, 33342.0]
  - - [1024, 8160, 1, 4096, 1024, 1024, 1024, 4096]
    - [10, 33689.0]
  - - [1024, 9216, 1, 1024, 1024, 1024, 1024, 1024]
    - [21, 35767.0]
  - - [1024, 9216, 1, 4096, 1024, 1024, 1024, 4096]
    - [21, 36608.0]
  - - [1024, 9520, 1, 1024, 1024, 1024, 1024, 1024]
    - [30, 34231.0]
  - - [1024, 9520, 1, 4096, 1024, 1024, 1024, 4096]
    - [20, 34824.0]
  - - [1024, 9520, 1, 42720, 1024, 1024, 1024, 42720]
    - [23, 36493.0]
  - - [1024, 10064, 1, 1024, 1024, 1024, 1024, 1024]
    - [21, 34570.0]
  - - [1024, 10064, 1, 4096, 1024, 1024, 1024, 4096]
    - [21, 35596.0]
  - - [1024, 10080, 1, 1024, 1024, 1024, 1024, 1024]
    - [21, 34698.0]
  - - [1024, 10080, 1, 4096, 1024, 1024, 1024, 4096]
    - [21, 35626.0]
  - - [1024, 10080, 1, 42720, 1024, 1024, 1024, 42720]
    - [13, 36699.0]
  - - [1024, 10200, 1, 1024, 1024, 1024, 1024, 1024]
    - [21, 34710.0]
  - - [1024, 10200, 1, 4096, 1024, 1024, 1024, 4096]
    - [21, 35978.0]
  - - [4096, 3840, 1, 1024, 4096, 4096, 4096, 1024]
    - [25, 35185.0]
  - - [4096, 3968, 1, 1024, 4096, 4096, 4096, 1024]
    - [20, 35208.0]
  - - [4096, 6528, 1, 1024, 4096, 4096, 4096, 1024]
    - [10, 35531.0]
  - - [4096, 7104, 1, 1024, 4096, 4096, 4096, 1024]
    - [15, 35469.0]
  - - [4096, 7200, 1, 1024, 4096, 4096, 4096, 1024]
    - [20, 35256.0]
  - - [4096, 8064, 1, 1024, 4096, 4096, 4096, 1024]
    - [10, 36001.0]
  - - [4096, 8160, 1, 1024, 4096, 4096, 4096, 1024]
    - [20, 35732.0]
  - - [4096, 9216, 1, 1024, 4096, 4096, 4096, 1024]
    - [17, 36233.0]
  - - [4096, 9520, 1, 1024, 4096, 4096, 4096, 1024]
    - [15, 35596.0]
  - - [4096, 10064, 1, 1024, 4096, 4096, 4096, 1024]
    - [15, 35898.0]
  - - [4096, 10080, 1, 1024, 4096, 4096, 4096, 1024]
    - [20, 35880.0]
  - - [4096, 10200, 1, 1024, 4096, 4096, 4096, 1024]
    - [20, 35937.0]
  - - [1024, 3240, 1, 1024, 1024, 1024, 1024, 1024]
    - [20, 31358.0]
  - - [1024, 3240, 1, 4096, 1024, 1024, 1024, 4096]
    - [21, 32962.0]
  - - [1024, 3960, 1, 1024, 1024, 1024, 1024, 1024]
    - [30, 33081.0]
  - - [1024, 3960, 1, 4096, 1024, 1024, 1024, 4096]
    - [20, 34209.0]
  - - [1024, 3960, 1, 42720, 1024, 1024, 1024, 42720]
    - [1, 35122.0]
  - - [4096, 3240, 1, 1024, 4096, 4096, 4096, 1024]
    - [20, 33970.0]
  - - [4096, 3960, 1, 1024, 4096, 4096, 4096, 1024]
    - [20, 35066.0]
  - - [289, 128, 64, 768, 289, 289, 289, 768]
    - [15, 22179.0]
  - - [289, 160, 64, 768, 289, 289, 289, 768]
    - [2, 18176.0]
  - - [289, 192, 64, 768, 289, 289, 289, 768]
    - [2, 21798.0]
  - - [3136, 256, 32, 64, 3136, 3136, 3136, 64]
    - [8, 31606.0]
  - - [784, 512, 32, 128, 784, 784, 784, 128]
    - [1, 28604.0]
  - - [784, 128, 32, 512, 784, 784, 784, 512]
    - [30, 25642.0]
  - - [196, 1024, 32, 256, 196, 196, 196, 256]
    - [3, 23780.0]
  - - [3136, 128, 64, 64, 3136, 3136, 3136, 64]
    - [29, 31389.0]
  - - [3136, 256, 64, 128, 3136, 3136, 3136, 128]
    - [1, 31534.0]
  - - [784, 512, 64, 256, 784, 784, 784, 256]
    - [15, 29965.0]
  - - [3136, 128, 64, 256, 3136, 3136, 3136, 256]
    - [10, 31667.0]
  - - [3136, 256, 64, 256, 3136, 3136, 3136, 256]
    - [3, 33872.0]
  - - [196, 1024, 64, 512, 196, 196, 196, 512]
    - [30, 25999.0]
  - - [784, 256, 64, 512, 784, 784, 784, 512]
    - [30, 29967.0]
  - - [784, 512, 64, 512, 784, 784, 784, 512]
    - [27, 30811.0]
  - - [196, 512, 64, 1024, 196, 196, 196, 1024]
    - [10, 25279.0]
  - - [196, 1024, 64, 1024, 196, 196, 196, 1024]
    - [30, 25935.0]
  - - [3136, 128, 32, 64, 3136, 3136, 3136, 64]
    - [29, 27660.0]
  - - [3136, 256, 32, 128, 3136, 3136, 3136, 128]
    - [1, 34182.0]
  - - [784, 512, 32, 256, 784, 784, 784, 256]
    - [15, 29598.0]
  - - [3136, 128, 32, 256, 3136, 3136, 3136, 256]
    - [10, 32289.0]
  - - [3136, 256, 32, 256, 3136, 3136, 3136, 256]
    - [3, 33692.0]
  - - [196, 1024, 32, 512, 196, 196, 196, 512]
    - [10, 24806.0]
  - - [784, 256, 32, 512, 784, 784, 784, 512]
    - [20, 28594.0]
  - - [784, 512, 32, 512, 784, 784, 784, 512]
    - [20, 30408.0]
  - - [196, 512, 32, 1024, 196, 196, 196, 1024]
    - [10, 23579.0]
  - - [196, 1024, 32, 1024, 196, 196, 196, 1024]
    - [20, 25416.0]
  - - [7680, 8192, 1, 8192, 7680, 7680, 7680, 8192]
    - [21, 36630.0]
  - - [3840, 4096, 1, 4096, 3840, 3840, 3840, 4096]
    - [30, 35645.0]
  - - [1920, 2048, 1, 2048, 1920, 1920, 1920, 2048]
    - [30, 33077.0]
  - - [8192, 7680, 1, 8192, 8192, 8192, 8192, 8192]
    - [5, 36428.0]
  - - [4096, 3840, 1, 4096, 4096, 4096, 4096, 4096]
    - [10, 35637.0]
  - - [2048, 1920, 1, 2048, 2048, 2048, 2048, 2048]
    - [20, 33097.0]
  - - [8192, 8192, 1, 8192, 8192, 8192, 8192, 8192]
    - [11, 36548.0]
  - - [4096, 4096, 1, 4096, 4096, 4096, 4096, 4096]
    - [10, 35469.0]
  - - [2048, 2048, 1, 2048, 2048, 2048, 2048, 2048]
    - [11, 31697.0]
  - - [1024, 4096, 1, 2, 1024, 1024, 1024, 2]
    - [22, 1393.0]
  - - [4096, 512, 1, 1024, 4096, 4096, 4096, 1024]
    - [17, 30600.0]
  - - [1024, 1280, 1, 2, 1024, 1024, 1024, 2]
    - [16, 846.0]
  - - [1024, 1280, 1, 1024, 1024, 1024, 1024, 1024]
    - [24, 24457.0]
  - - [1024, 1280, 1, 4096, 1024, 1024, 1024, 4096]
    - [9, 25017.0]
  - - [4096, 1024, 1, 1024, 4096, 4096, 4096, 1024]
    - [10, 31373.0]
  - - [4096, 1280, 1, 1024, 4096, 4096, 4096, 1024]
    - [10, 34152.0]
  - - [1024, 4992, 1, 2, 1024, 1024, 1024, 2]
    - [28, 1644.0]
  - - [1024, 4992, 1, 1024, 1024, 1024, 1024, 1024]
    - [20, 33430.0]
  - - [1024, 4992, 1, 4096, 1024, 1024, 1024, 4096]
    - [20, 34023.0]
  - - [4096, 4992, 1, 1024, 4096, 4096, 4096, 1024]
    - [20, 35555.0]
  - - [1024, 5120, 1, 2, 1024, 1024, 1024, 2]
    - [22, 1628.0]
  - - [1024, 5120, 1, 1024, 1024, 1024, 1024, 1024]
    - [20, 34305.0]
  - - [1024, 5120, 1, 4096, 1024, 1024, 1024, 4096]
    - [30, 34832.0]
  - - [4096, 5120, 1, 1024, 4096, 4096, 4096, 1024]
    - [10, 35447.0]
  - - [1024, 5248, 1, 2, 1024, 1024, 1024, 2]
    - [22, 1664.0]
  - - [1024, 5248, 1, 1024, 1024, 1024, 1024, 1024]
    - [30, 32489.0]
  - - [1024, 5248, 1, 4096, 1024, 1024, 1024, 4096]
    - [30, 32969.0]
  - - [4096, 5248, 1, 1024, 4096, 4096, 4096, 1024]
    - [3, 35434.0]
  - - [1024, 2560, 1, 2, 1024, 1024, 1024, 2]
    - [22, 1358.0]
  - - [1024, 2560, 1, 1024, 1024, 1024, 1024, 1024]
    - [20, 29966.0]
  - - [1024, 2560, 1, 4096, 1024, 1024, 1024, 4096]
    - [10, 30680.0]
  - - [4096, 2560, 1, 1024, 4096, 4096, 4096, 1024]
    - [17, 35193.0]
  - - [1024, 3072, 1, 2, 1024, 1024, 1024, 2]
    - [22, 1380.0]
  - - [1024, 3072, 1, 1024, 1024, 1024, 1024, 1024]
    - [21, 30819.0]
  - - [1024, 3072, 1, 4096, 1024, 1024, 1024, 4096]
    - [32, 31605.0]
  - - [4096, 3072, 1, 1024, 4096, 4096, 4096, 1024]
    - [10, 34654.0]
  - - [1024, 1152, 1, 2, 1024, 1024, 1024, 2]
    - [16, 792.0]
  - - [1024, 1152, 1, 1024, 1024, 1024, 1024, 1024]
    - [20, 29592.0]
  - - [1024, 1152, 1, 4096, 1024, 1024, 1024, 4096]
    - [20, 31335.0]
  - - [4096, 1152, 1, 1024, 4096, 4096, 4096, 1024]
    - [20, 34488.0]
  - - [479, 32768, 1, 1024, 479, 479, 479, 1024]
    - [30, 32583.0]
  - - [1024, 8192, 1, 1024, 1024, 1024, 1024, 1024]
    - [30, 33599.0]
  - - [1024, 8192, 1, 4096, 1024, 1024, 1024, 4096]
    - [30, 34040.0]
  - - [1024, 8192, 1, 33712, 1024, 1024, 1024, 33712]
    - [13, 35803.0]
  - - [1024, 9600, 1, 1024, 1024, 1024, 1024, 1024]
    - [10, 34568.0]
  - - [1024, 9600, 1, 4096, 1024, 1024, 1024, 4096]
    - [10, 35111.0]
  - - [1024, 9600, 1, 33712, 1024, 1024, 1024, 33712]
    - [13, 36978.0]
  - - [4096, 8192, 1, 1024, 4096, 4096, 4096, 1024]
    - [10, 35949.0]
  - - [4096, 9600, 1, 1024, 4096, 4096, 4096, 1024]
    - [10, 35952.0]
  - - [1024, 1024, 64, 64, 1024, 1024, 1024, 64]
    - [1, 29913.0]
  - - [1024, 16384, 1, 3072, 1024, 1024, 1024, 3072]
    - [20, 35409.0]
  - - [1024, 2048, 1, 30592, 1024, 1024, 1024, 30592]
    - [17, 31783.0]
  - - [640, 2048, 1, 2560, 640, 640, 640, 2560]
    - [24, 24818.0]
  - - [1024, 1024, 64, 96, 1024, 1024, 1024, 96]
    - [1, 32870.0]
  - - [1536, 4096, 1, 4608, 1536, 1536, 1536, 4608]
    - [30, 34417.0]
  - - [512, 512, 256, 64, 512, 512, 512, 64]
    - [0, 24607.0]
  - - [2048, 1024, 1, 8192, 2048, 2048, 2048, 8192]
    - [11, 31399.0]
  - - [4096, 16384, 1, 1024, 4096, 4096, 4096, 1024]
    - [5, 36172.0]
  - - [1024, 8192, 1, 50304, 1024, 1024, 1024, 50304]
    - [25, 34103.0]
  - - [1536, 8192, 1, 50304, 1536, 1536, 1536, 50304]
    - [17, 35967.0]
  - - [6144, 8192, 1, 1536, 6144, 6144, 6144, 1536]
    - [11, 36422.0]
  - - [1024, 4096, 1, 30592, 1024, 1024, 1024, 30592]
    - [17, 32371.0]
  - - [1536, 4096, 1, 6144, 1536, 1536, 1536, 6144]
    - [30, 34416.0]
  - - [1024, 16384, 1, 4096, 1024, 1024, 1024, 4096]
    - [20, 35416.0]
  - - [1024, 16384, 1, 50304, 1024, 1024, 1024, 50304]
    - [25, 35517.0]
  - - [1024, 4096, 1, 3072, 1024, 1024, 1024, 3072]
    - [21, 31873.0]
  - - [1536, 8192, 1, 1536, 1536, 1536, 1536, 1536]
    - [21, 35398.0]
  - - [1024, 2048, 1, 3072, 1024, 1024, 1024, 3072]
    - [21, 31232.0]
  - - [2560, 2048, 1, 7680, 2560, 2560, 2560, 7680]
    - [30, 34946.0]
  - - [2048, 1024, 1, 2048, 2048, 2048, 2048, 2048]
    - [11, 30749.0]
  - - [2048, 1024, 1, 30592, 2048, 2048, 2048, 30592]
    - [17, 31769.0]
  - - [8192, 1024, 1, 2048, 8192, 8192, 8192, 2048]
    - [3, 33730.0]
  - - [2560, 2048, 1, 2560, 2560, 2560, 2560, 2560]
    - [3, 34741.0]
  - - [1536, 8192, 1, 4608, 1536, 1536, 1536, 4608]
    - [32, 35789.0]
  - - [1024, 2048, 1, 50304, 1024, 1024, 1024, 50304]
    - [5, 31785.0]
  - - [1024, 1024, 32, 64, 1024, 1024, 1024, 64]
    - [23, 32927.0]
  - - [1536, 8192, 1, 6144, 1536, 1536, 1536, 6144]
    - [32, 35746.0]
  - - [1024, 1024, 256, 64, 1024, 1024, 1024, 64]
    - [0, 23933.0]
  - - [512, 512, 40, 64, 512, 512, 512, 64]
    - [31, 26715.0]
  - - [1536, 4096, 1, 50304, 1536, 1536, 1536, 50304]
    - [3, 34566.0]
  - - [1024, 1024, 128, 96, 1024, 1024, 1024, 96]
    - [6, 28538.0]
  - - [1024, 8192, 1, 3072, 1024, 1024, 1024, 3072]
    - [10, 33819.0]
  - - [1024, 1024, 128, 64, 1024, 1024, 1024, 64]
    - [0, 24985.0]
  - - [1024, 4096, 1, 50304, 1024, 1024, 1024, 50304]
    - [27, 32463.0]
  - - [6144, 4096, 1, 1536, 6144, 6144, 6144, 1536]
    - [3, 35803.0]
  - - [1024, 16384, 1, 1024, 1024, 1024, 1024, 1024]
    - [30, 35133.0]
  - - [2560, 2048, 1, 1920, 2560, 2560, 2560, 1920]
    - [23, 36158.0]
  - - [2048, 1024, 1, 6144, 2048, 2048, 2048, 6144]
    - [11, 31339.0]
  - - [512, 512, 128, 64, 512, 512, 512, 64]
    - [1, 31442.0]
  - - [1024, 8192, 1, 30592, 1024, 1024, 1024, 30592]
    - [3, 34024.0]
  - - [1536, 4096, 1, 1536, 1536, 1536, 1536, 1536]
    - [10, 33982.0]
  - - [128, 128, 1024, 64, 128, 128, 128, 64]
    - [29, 27846.0]
  - - [1024, 8192, 1, 30528, 1024, 1024, 1024, 30528]
    - [13, 35778.0]
  - - [1024, 3456, 1, 1024, 1024, 1024, 1024, 1024]
    - [30, 33517.0]
  - - [1024, 3456, 1, 512, 1024, 1024, 1024, 512]
    - [30, 32932.0]
  - - [1024, 4096, 1, 512, 1024, 1024, 1024, 512]
    - [21, 30600.0]
  - - [1024, 6912, 1, 1024, 1024, 1024, 1024, 1024]
    - [21, 35535.0]
  - - [1024, 6912, 1, 512, 1024, 1024, 1024, 512]
    - [30, 34487.0]
  - - [256, 55296, 1, 128, 256, 256, 256, 128]
    - [1, 34791.0]
  - - [256, 6912, 1, 128, 256, 256, 256, 128]
    - [16, 24512.0]
  - - [480, 3456, 1, 1024, 480, 480, 480, 1024]
    - [31, 27214.0]
  - - [480, 4096, 1, 1024, 480, 480, 480, 1024]
    - [21, 27414.0]
  - - [480, 6912, 1, 1024, 480, 480, 480, 1024]
    - [21, 31504.0]
  - - [512, 3456, 1, 256, 512, 512, 512, 256]
    - [16, 27223.0]
  - - [512, 4096, 1, 256, 512, 512, 512, 256]
    - [17, 27588.0]
  - - [512, 55296, 1, 256, 512, 512, 512, 256]
    - [17, 35197.0]
  - - [512, 6912, 1, 256, 512, 512, 512, 256]
    - [25, 31699.0]
  - - [1024, 1280, 1, 30528, 1024, 1024, 1024, 30528]
    - [14, 25237.0]
  - - [1024, 1600, 1, 30528, 1024, 1024, 1024, 30528]
    - [20, 31018.0]
  - - [1024, 10240, 1, 1024, 1024, 1024, 1024, 1024]
    - [21, 35276.0]
  - - [1024, 10240, 1, 4096, 1024, 1024, 1024, 4096]
    - [21, 36263.0]
  - - [4096, 10240, 1, 1024, 4096, 4096, 4096, 1024]
    - [11, 36014.0]
  - - [128, 128, 1280, 64, 128, 128, 128, 64]
    - [20, 28496.0]
  - - [1024, 1640, 1, 30528, 1024, 1024, 1024, 30528]
    - [20, 31776.0]
  - - [1024, 10496, 1, 1024, 1024, 1024, 1024, 1024]
    - [10, 34008.0]
  - - [1024, 10496, 1, 4096, 1024, 1024, 1024, 4096]
    - [20, 34528.0]
  - - [4096, 10496, 1, 1024, 4096, 4096, 4096, 1024]
    - [3, 36014.0]
  - - [128, 128, 1312, 64, 128, 128, 128, 64]
    - [13, 28829.0]
  - - [1024, 6144, 1, 4096, 1024, 1024, 1024, 4096]
    - [20, 34373.0]
  - - [4096, 6144, 1, 1024, 4096, 4096, 4096, 1024]
    - [15, 35652.0]
  - - [1024, 6144, 1, 1024, 1024, 1024, 1024, 1024]
    - [20, 33911.0]
  - - [512, 512, 192, 64, 512, 512, 512, 64]
    - [18, 31544.0]
  - - [256, 6912, 1, 1, 256, 256, 256, 1]
    - [29, 402.0]
  - - [1024, 10224, 1, 1024, 1024, 1024, 1024, 1024]
    - [17, 34701.0]
  - - [1024, 10192, 1, 1024, 1024, 1024, 1024, 1024]
    - [21, 34920.0]
  - - [1024, 10208, 1, 1024, 1024, 1024, 1024, 1024]
    - [21, 35003.0]
  - - [1024, 10224, 1, 4096, 1024, 1024, 1024, 4096]
    - [21, 36019.0]
  - - [1024, 10224, 1, 3072, 1024, 1024, 1024, 3072]
    - [21, 35920.0]
  - - [4096, 10224, 1, 1024, 4096, 4096, 4096, 1024]
    - [11, 35702.0]
  - - [1024, 10240, 1, 3072, 1024, 1024, 1024, 3072]
    - [21, 36099.0]
  - - [1024, 10192, 1, 3072, 1024, 1024, 1024, 3072]
    - [32, 35831.0]
  - - [4096, 10192, 1, 1024, 4096, 4096, 4096, 1024]
    - [11, 35590.0]
  - - [1024, 10192, 1, 4096, 1024, 1024, 1024, 4096]
    - [21, 35901.0]
  - - [1024, 10200, 1, 3072, 1024, 1024, 1024, 3072]
    - [32, 35827.0]
  - - [1024, 10184, 1, 1024, 1024, 1024, 1024, 1024]
    - [21, 35037.0]
  - - [4096, 10208, 1, 1024, 4096, 4096, 4096, 1024]
    - [11, 35687.0]
  - - [1024, 10208, 1, 3072, 1024, 1024, 1024, 3072]
    - [21, 35799.0]
  - - [1024, 10208, 1, 4096, 1024, 1024, 1024, 4096]
    - [21, 36034.0]
  - - [1024, 10224, 1, 2048, 1024, 1024, 1024, 2048]
    - [21, 35693.0]
  - - [1024, 10240, 1, 2048, 1024, 1024, 1024, 2048]
    - [21, 35876.0]
  - - [1024, 10120, 1, 1024, 1024, 1024, 1024, 1024]
    - [21, 34751.0]
  - - [1024, 10192, 1, 2048, 1024, 1024, 1024, 2048]
    - [21, 35516.0]
  - - [1024, 10152, 1, 1024, 1024, 1024, 1024, 1024]
    - [21, 34718.0]
  - - [1024, 10080, 1, 3072, 1024, 1024, 1024, 3072]
    - [21, 35517.0]
  - - [100352, 512, 1, 256, 100352, 100352, 100352, 256]
    - [15, 34977.0]
  - - [12544, 2048, 1, 1024, 12544, 12544, 12544, 1024]
    - [17, 35944.0]
  - - [200704, 512, 1, 256, 200704, 200704, 200704, 256]
    - [15, 35111.0]
  - - [25088, 1024, 1, 512, 25088, 25088, 25088, 512]
    - [17, 35578.0]
  - - [50176, 1024, 1, 512, 50176, 50176, 50176, 512]
    - [17, 36003.0]
  - - [6272, 2048, 1, 1024, 6272, 6272, 6272, 1024]
    - [3, 35175.0]
  - - [3136, 128, 128, 256, 3136, 3136, 3136, 256]
    - [30, 29069.0]
  - - [3136, 128, 256, 256, 3136, 3136, 3136, 256]
    - [25, 29055.0]
  - - [784, 256, 128, 512, 784, 784, 784, 512]
    - [10, 29965.0]
  - - [784, 256, 256, 512, 784, 784, 784, 512]
    - [3, 30595.0]
  - - [128, 128, 2048, 64, 128, 128, 128, 64]
    - [23, 30229.0]
  - - [1024, 2560, 1, 30528, 1024, 1024, 1024, 30528]
    - [13, 31577.0]
  - - [128, 128, 1536, 64, 128, 128, 128, 64]
    - [13, 29749.0]
  - - [1024, 12288, 1, 4096, 1024, 1024, 1024, 4096]
    - [21, 35585.0]
  - - [1024, 12288, 1, 1024, 1024, 1024, 1024, 1024]
    - [21, 35002.0]
  - - [4096, 12288, 1, 1024, 4096, 4096, 4096, 1024]
    - [11, 36221.0]
  - - [1024, 1920, 1, 30528, 1024, 1024, 1024, 30528]
    - [17, 29794.0]
  - - [128, 128, 192, 64, 128, 128, 128, 64]
    - [7, 19101.0]
  - - [768, 2048, 1, 2, 768, 768, 768, 2]
    - [22, 936.0]
  - - [3072, 2048, 1, 768, 3072, 3072, 3072, 768]
    - [3, 33884.0]
  - - [768, 2048, 1, 3072, 768, 768, 768, 3072]
    - [20, 29409.0]
  - - [768, 2048, 1, 768, 768, 768, 768, 768]
    - [3, 28223.0]
  - - [384, 384, 144, 64, 384, 384, 384, 64]
    - [8, 32187.0]
  - - [768, 4608, 1, 2, 768, 768, 768, 2]
    - [7, 1416.0]
  - - [3072, 4608, 1, 768, 3072, 3072, 3072, 768]
    - [17, 36227.0]
  - - [768, 4608, 1, 3072, 768, 768, 768, 3072]
    - [21, 35336.0]
  - - [768, 4608, 1, 768, 768, 768, 768, 768]
    - [17, 34509.0]
  - - [512, 512, 48, 64, 512, 512, 512, 64]
    - [8, 29136.0]
  - - [128, 128, 256, 64, 128, 128, 128, 64]
    - [0, 21895.0]
  - - [384, 384, 192, 64, 384, 384, 384, 64]
    - [8, 32956.0]
  - - [1024, 4608, 1, 2, 1024, 1024, 1024, 2]
    - [22, 1627.0]
  - - [4096, 4608, 1, 1024, 4096, 4096, 4096, 1024]
    - [17, 35866.0]
  - - [1024, 4608, 1, 4096, 1024, 1024, 1024, 4096]
    - [21, 35954.0]
  - - [1024, 4608, 1, 1024, 1024, 1024, 1024, 1024]
    - [21, 34983.0]
  - - [8192, 1024, 1, 1024, 8192, 8192, 8192, 1024]
    - [10, 33662.0]
  - - [8192, 4096, 1, 1024, 8192, 8192, 8192, 1024]
    - [3, 36021.0]
  - - [196, 1024, 128, 256, 196, 196, 196, 256]
    - [3, 25558.0]
  - - [196, 1024, 256, 256, 196, 196, 196, 256]
    - [3, 24190.0]
  - - [196, 256, 128, 1024, 196, 196, 196, 1024]
    - [10, 25346.0]
  - - [196, 256, 256, 1024, 196, 196, 196, 1024]
    - [20, 24127.0]
  - - [196, 512, 128, 1024, 196, 196, 196, 1024]
    - [20, 25248.0]
  - - [196, 512, 256, 1024, 196, 196, 196, 1024]
    - [30, 25845.0]
  - - [3072, 256, 2, 1024, 3072, 3072, 3072, 1024]
    - [10, 27836.0]
  - - [768, 2048, 2, 512, 768, 768, 768, 512]
    - [32, 29959.0]
  - - [2904, 256, 2, 1024, 2904, 2904, 2904, 1024]
    - [3, 26178.0]
  - - [864, 2048, 2, 512, 864, 864, 864, 512]
    - [25, 28258.0]
  - - [2992, 256, 2, 1024, 2992, 2992, 2992, 1024]
    - [3, 27367.0]
  - - [3400, 256, 2, 1024, 3400, 3400, 3400, 1024]
    - [26, 28835.0]
  - - [4032, 256, 2, 1024, 4032, 4032, 4032, 1024]
    - [5, 28769.0]
  - - [15200, 128, 2, 512, 15200, 15200, 15200, 512]
    - [3, 30131.0]
  - - [12288, 128, 2, 512, 12288, 12288, 12288, 512]
    - [3, 29826.0]
  - - [888, 2048, 2, 512, 888, 888, 888, 512]
    - [25, 29080.0]
  - - [13600, 128, 2, 512, 13600, 13600, 13600, 512]
    - [3, 30926.0]
  - - [12880, 128, 2, 512, 12880, 12880, 12880, 512]
    - [3, 29177.0]
  - - [3456, 256, 2, 1024, 3456, 3456, 3456, 1024]
    - [16, 29772.0]
  - - [2944, 256, 2, 1024, 2944, 2944, 2944, 1024]
    - [3, 27396.0]
  - - [2688, 256, 2, 1024, 2688, 2688, 2688, 1024]
    - [2, 25670.0]
  - - [13824, 128, 2, 512, 13824, 13824, 13824, 512]
    - [20, 33308.0]
  - - [3168, 256, 2, 1024, 3168, 3168, 3168, 1024]
    - [10, 28257.0]
  - - [3360, 256, 2, 1024, 3360, 3360, 3360, 1024]
    - [26, 28570.0]
  - - [3552, 256, 2, 1024, 3552, 3552, 3552, 1024]
    - [17, 25532.0]
  - - [11616, 128, 2, 512, 11616, 11616, 11616, 512]
    - [20, 26674.0]
  - - [4200, 256, 2, 1024, 4200, 4200, 4200, 1024]
    - [10, 30289.0]
  - - [840, 2048, 2, 512, 840, 840, 840, 512]
    - [25, 27346.0]
  - - [14208, 128, 2, 512, 14208, 14208, 14208, 512]
    - [3, 29959.0]
  - - [11968, 128, 2, 512, 11968, 11968, 11968, 512]
    - [15, 27569.0]
  - - [3264, 256, 2, 1024, 3264, 3264, 3264, 1024]
    - [25, 29163.0]
  - - [13600, 256, 2, 512, 13600, 13600, 13600, 512]
    - [25, 33084.0]
  - - [12880, 256, 2, 512, 12880, 12880, 12880, 512]
    - [17, 31889.0]
  - - [12288, 256, 2, 512, 12288, 12288, 12288, 512]
    - [3, 33485.0]
  - - [2816, 256, 2, 1024, 2816, 2816, 2816, 1024]
    - [24, 26853.0]
  - - [672, 2048, 2, 512, 672, 672, 672, 512]
    - [17, 25447.0]
  - - [13440, 128, 2, 512, 13440, 13440, 13440, 512]
    - [3, 32514.0]
  - - [13824, 256, 2, 512, 13824, 13824, 13824, 512]
    - [3, 34645.0]
  - - [15200, 256, 2, 512, 15200, 15200, 15200, 512]
    - [17, 32666.0]
  - - [3600, 256, 2, 1024, 3600, 3600, 3600, 1024]
    - [17, 25962.0]
  - - [4032, 1024, 2, 256, 4032, 4032, 4032, 256]
    - [3, 31299.0]
  - - [16128, 128, 2, 512, 16128, 16128, 16128, 512]
    - [10, 30583.0]
  - - [15200, 128, 1, 512, 15200, 15200, 15200, 512]
    - [24, 25193.0]
  - - [13600, 128, 1, 512, 13600, 13600, 13600, 512]
    - [16, 26992.0]
  - - [2904, 1024, 2, 256, 2904, 2904, 2904, 256]
    - [3, 29563.0]
  - - [2992, 1024, 2, 256, 2992, 2992, 2992, 256]
    - [3, 30952.0]
  - - [1536, 2048, 1, 1024, 1536, 1536, 1536, 1024]
    - [21, 30896.0]
  - - [24576, 128, 1, 256, 24576, 24576, 24576, 256]
    - [3, 28618.0]
  - - [24576, 512, 1, 256, 24576, 24576, 24576, 256]
    - [13, 33737.0]
  - - [25760, 128, 1, 256, 25760, 25760, 25760, 256]
    - [15, 26444.0]
  - - [25760, 512, 1, 256, 25760, 25760, 25760, 256]
    - [25, 32999.0]
  - - [6144, 256, 1, 512, 6144, 6144, 6144, 512]
    - [3, 27391.0]
  - - [6440, 256, 1, 512, 6440, 6440, 6440, 512]
    - [4, 26985.0]
  - - [13600, 512, 1, 128, 13600, 13600, 13600, 128]
    - [1, 30091.0]
  - - [9408, 512, 2, 128, 9408, 9408, 9408, 128]
    - [1, 31619.0]
  - - [56000, 256, 2, 64, 56000, 56000, 56000, 64]
    - [1, 31693.0]
  - - [2816, 1024, 2, 256, 2816, 2816, 2816, 256]
    - [23, 32751.0]
  - - [60800, 256, 1, 64, 60800, 60800, 60800, 64]
    - [13, 32030.0]
  - - [2944, 1024, 2, 256, 2944, 2944, 2944, 256]
    - [15, 31359.0]
  - - [11776, 512, 2, 128, 11776, 11776, 11776, 128]
    - [13, 33613.0]
  - - [11616, 512, 2, 128, 11616, 11616, 11616, 128]
    - [1, 31945.0]
  - - [4200, 1024, 2, 256, 4200, 4200, 4200, 256]
    - [10, 32536.0]
  - - [54400, 256, 1, 64, 54400, 54400, 54400, 64]
    - [1, 31628.0]
  - - [15200, 512, 1, 128, 15200, 15200, 15200, 128]
    - [8, 29629.0]
  - - [2688, 1024, 2, 256, 2688, 2688, 2688, 256]
    - [3, 31234.0]
  - - [12672, 512, 2, 128, 12672, 12672, 12672, 128]
    - [23, 34923.0]
  - - [11968, 512, 2, 128, 11968, 11968, 11968, 128]
    - [1, 32900.0]
  - - [46464, 256, 2, 64, 46464, 46464, 46464, 64]
    - [23, 33070.0]
  - - [2400, 256, 2, 1024, 2400, 2400, 2400, 1024]
    - [2, 22886.0]
  - - [2520, 256, 2, 1024, 2520, 2520, 2520, 1024]
    - [2, 23669.0]
  - - [2400, 1024, 2, 256, 2400, 2400, 2400, 256]
    - [10, 29803.0]
  - - [10752, 128, 2, 512, 10752, 10752, 10752, 512]
    - [3, 30717.0]
  - - [45632, 256, 2, 64, 45632, 45632, 45632, 64]
    - [1, 31022.0]
  - - [2520, 1024, 2, 256, 2520, 2520, 2520, 256]
    - [3, 30668.0]
  - - [53760, 256, 2, 64, 53760, 53760, 53760, 64]
    - [1, 32347.0]
  - - [2352, 256, 2, 1024, 2352, 2352, 2352, 1024]
    - [2, 22083.0]
  - - [47872, 256, 2, 64, 47872, 47872, 47872, 64]
    - [8, 32900.0]
  - - [47104, 256, 2, 64, 47104, 47104, 47104, 64]
    - [1, 32063.0]
  - - [50688, 256, 2, 64, 50688, 50688, 50688, 64]
    - [8, 32327.0]
  - - [45056, 256, 2, 64, 45056, 45056, 45056, 64]
    - [1, 31874.0]
  - - [13440, 512, 2, 128, 13440, 13440, 13440, 128]
    - [23, 34326.0]
  - - [2352, 1024, 2, 256, 2352, 2352, 2352, 256]
    - [10, 28704.0]
  - - [11264, 512, 2, 128, 11264, 11264, 11264, 128]
    - [18, 33847.0]
  - - [10560, 128, 2, 512, 10560, 10560, 10560, 512]
    - [10, 28468.0]
  - - [16128, 512, 2, 128, 16128, 16128, 16128, 128]
    - [23, 35256.0]
  - - [37632, 256, 2, 64, 37632, 37632, 37632, 64]
    - [1, 32622.0]
  - - [51520, 256, 2, 64, 51520, 51520, 51520, 64]
    - [1, 32354.0]
  - - [14000, 512, 2, 128, 14000, 14000, 14000, 128]
    - [1, 32768.0]
  - - [10560, 512, 2, 128, 10560, 10560, 10560, 128]
    - [1, 33128.0]
  - - [64512, 256, 2, 64, 64512, 64512, 64512, 64]
    - [8, 32733.0]
  - - [54400, 256, 2, 64, 54400, 54400, 54400, 64]
    - [1, 33369.0]
  - - [3264, 1024, 2, 256, 3264, 3264, 3264, 256]
    - [3, 31228.0]
  - - [10752, 512, 2, 128, 10752, 10752, 10752, 128]
    - [13, 33699.0]
  - - [3168, 1024, 2, 256, 3168, 3168, 3168, 256]
    - [10, 30599.0]
  - - [55296, 256, 2, 256, 55296, 55296, 55296, 256]
    - [3, 34865.0]
  - - [51520, 256, 2, 256, 51520, 51520, 51520, 256]
    - [15, 34296.0]
  - - [11408, 128, 2, 512, 11408, 11408, 11408, 512]
    - [4, 28634.0]
  - - [60800, 256, 2, 256, 60800, 60800, 60800, 256]
    - [25, 34971.0]
  - - [54400, 256, 2, 256, 54400, 54400, 54400, 256]
    - [5, 34935.0]
  - - [60800, 256, 2, 64, 60800, 60800, 60800, 64]
    - [23, 33733.0]
  - - [3800, 1024, 1, 256, 3800, 3800, 3800, 256]
    - [3, 29230.0]
  - - [3400, 1024, 1, 256, 3400, 3400, 3400, 256]
    - [20, 29280.0]
  - - [3072, 1024, 2, 256, 3072, 3072, 3072, 256]
    - [3, 32524.0]
  - - [3600, 1024, 2, 256, 3600, 3600, 3600, 256]
    - [3, 31457.0]
  - - [12288, 512, 2, 128, 12288, 12288, 12288, 128]
    - [13, 33554.0]
  - - [49152, 256, 2, 256, 49152, 49152, 49152, 256]
    - [3, 34805.0]
  - - [12880, 512, 2, 128, 12880, 12880, 12880, 128]
    - [8, 32553.0]
  - - [11408, 512, 2, 128, 11408, 11408, 11408, 128]
    - [1, 32820.0]
  - - [42240, 256, 2, 64, 42240, 42240, 42240, 64]
    - [1, 32799.0]
  - - [1008, 2048, 2, 512, 1008, 1008, 1008, 512]
    - [10, 29599.0]
  - - [3360, 1024, 2, 256, 3360, 3360, 3360, 256]
    - [10, 31368.0]
  - - [14208, 512, 2, 128, 14208, 14208, 14208, 128]
    - [13, 34835.0]
  - - [56832, 256, 2, 64, 56832, 56832, 56832, 64]
    - [8, 32591.0]
  - - [43008, 256, 2, 64, 43008, 43008, 43008, 64]
    - [8, 31726.0]
  - - [13600, 512, 2, 128, 13600, 13600, 13600, 128]
    - [1, 32949.0]
  - - [2640, 1024, 2, 256, 2640, 2640, 2640, 256]
    - [3, 29715.0]
  - - [13824, 512, 2, 128, 13824, 13824, 13824, 128]
    - [18, 34579.0]
  - - [3800, 256, 2, 1024, 3800, 3800, 3800, 1024]
    - [17, 27269.0]
  - - [55296, 256, 2, 64, 55296, 55296, 55296, 64]
    - [8, 32402.0]
  - - [2640, 256, 2, 1024, 2640, 2640, 2640, 1024]
    - [2, 24823.0]
  - - [15200, 512, 2, 128, 15200, 15200, 15200, 128]
    - [1, 33062.0]
  - - [3552, 1024, 2, 256, 3552, 3552, 3552, 256]
    - [10, 32075.0]
  - - [3456, 1024, 2, 256, 3456, 3456, 3456, 256]
    - [25, 33629.0]
  - - [49152, 256, 2, 64, 49152, 49152, 49152, 64]
    - [8, 31855.0]
  - - [3400, 1024, 2, 256, 3400, 3400, 3400, 256]
    - [10, 31651.0]
  - - [3800, 1024, 2, 256, 3800, 3800, 3800, 256]
    - [3, 31474.0]
  - - [6912, 256, 1, 512, 6912, 6912, 6912, 512]
    - [16, 28724.0]
  - - [6800, 256, 1, 512, 6800, 6800, 6800, 512]
    - [4, 27731.0]
  - - [27648, 128, 1, 256, 27648, 27648, 27648, 256]
    - [15, 31744.0]
  - - [27200, 128, 1, 256, 27200, 27200, 27200, 256]
    - [25, 28028.0]
  - - [30400, 128, 1, 256, 30400, 30400, 30400, 256]
    - [10, 27671.0]
  - - [7600, 256, 1, 512, 7600, 7600, 7600, 512]
    - [2, 25542.0]
  - - [6144, 1024, 1, 512, 6144, 6144, 6144, 512]
    - [3, 33610.0]
  - - [6912, 1024, 1, 512, 6912, 6912, 6912, 512]
    - [3, 34645.0]
  - - [6440, 1024, 1, 512, 6440, 6440, 6440, 512]
    - [5, 31992.0]
  - - [27648, 512, 1, 256, 27648, 27648, 27648, 256]
    - [30, 34539.0]
  - - [1728, 2048, 1, 1024, 1728, 1728, 1728, 1024]
    - [25, 29103.0]
  - - [27200, 512, 1, 256, 27200, 27200, 27200, 256]
    - [27, 33146.0]
  - - [6800, 1024, 1, 512, 6800, 6800, 6800, 512]
    - [10, 33152.0]
  - - [7600, 1024, 1, 512, 7600, 7600, 7600, 512]
    - [15, 32416.0]
  - - [30400, 512, 1, 256, 30400, 30400, 30400, 256]
    - [25, 33111.0]
  - - [12544, 1024, 1, 1024, 12544, 12544, 12544, 1024]
    - [3, 35326.0]
  - - [173280, 128, 1, 64, 173280, 173280, 173280, 64]
    - [23, 30739.0]
  - - [231040, 128, 1, 64, 231040, 231040, 231040, 64]
    - [8, 33369.0]
  - - [25992, 128, 1, 64, 25992, 25992, 25992, 64]
    - [7, 20513.0]
  - - [2852, 256, 2, 1024, 2852, 2852, 2852, 1024]
    - [3, 25621.0]
  - - [3220, 256, 2, 1024, 3220, 3220, 3220, 1024]
    - [3, 28431.0]
  - - [850, 2048, 2, 512, 850, 850, 850, 512]
    - [10, 27809.0]
  - - [805, 2048, 2, 512, 805, 805, 805, 512]
    - [20, 26280.0]
  - - [3036, 256, 2, 1024, 3036, 3036, 3036, 1024]
    - [10, 27750.0]
  - - [713, 2048, 2, 512, 713, 713, 713, 512]
    - [17, 26932.0]
  - - [850, 2048, 1, 512, 850, 850, 850, 512]
    - [10, 23654.0]
  - - [660, 2048, 2, 512, 660, 660, 660, 512]
    - [17, 24885.0]
  - - [726, 2048, 2, 512, 726, 726, 726, 512]
    - [17, 27246.0]
  - - [3500, 256, 2, 1024, 3500, 3500, 3500, 1024]
    - [10, 25165.0]
  - - [3700, 256, 2, 1024, 3700, 3700, 3700, 1024]
    - [5, 26393.0]
  - - [748, 2048, 2, 512, 748, 748, 748, 512]
    - [30, 28112.0]
  - - [3036, 1024, 2, 256, 3036, 3036, 3036, 256]
    - [3, 31296.0]
  - - [2852, 1024, 2, 256, 2852, 2852, 2852, 256]
    - [3, 30404.0]
  - - [950, 2048, 1, 512, 950, 950, 950, 512]
    - [11, 25714.0]
  - - [3700, 1024, 2, 256, 3700, 3700, 3700, 256]
    - [3, 32223.0]
  - - [3500, 1024, 2, 256, 3500, 3500, 3500, 256]
    - [3, 31018.0]
  - - [3220, 1024, 2, 256, 3220, 3220, 3220, 256]
    - [10, 30462.0]
  - - [950, 2048, 2, 512, 950, 950, 950, 512]
    - [10, 27849.0]
  - - [1610, 2048, 1, 1024, 1610, 1610, 1610, 1024]
    - [20, 31067.0]
  - - [1700, 2048, 1, 1024, 1700, 1700, 1700, 1024]
    - [10, 28521.0]
  - - [1900, 2048, 1, 1024, 1900, 1900, 1900, 1024]
    - [10, 31800.0]
  - - [1444, 256, 120, 128, 1444, 1444, 1444, 128]
    - [3, 30987.0]
  - - [1444, 256, 139, 128, 1444, 1444, 1444, 128]
    - [3, 28723.0]
  - - [1444, 256, 160, 128, 1444, 1444, 1444, 128]
    - [2, 26233.0]
  - - [1444, 256, 18, 128, 1444, 1444, 1444, 128]
    - [8, 27834.0]
  - - [1444, 256, 19, 128, 1444, 1444, 1444, 128]
    - [13, 29265.0]
  - - [1444, 256, 120, 256, 1444, 1444, 1444, 256]
    - [3, 31955.0]
  - - [1444, 256, 139, 256, 1444, 1444, 1444, 256]
    - [3, 31944.0]
  - - [1444, 256, 160, 256, 1444, 1444, 1444, 256]
    - [3, 32132.0]
  - - [1444, 256, 18, 256, 1444, 1444, 1444, 256]
    - [25, 29228.0]
  - - [1444, 256, 19, 256, 1444, 1444, 1444, 256]
    - [15, 30088.0]
  - - [361, 256, 120, 512, 361, 361, 361, 512]
    - [20, 32225.0]
  - - [361, 256, 139, 512, 361, 361, 361, 512]
    - [30, 31545.0]
  - - [361, 256, 160, 512, 361, 361, 361, 512]
    - [10, 31955.0]
  - - [361, 256, 18, 512, 361, 361, 361, 512]
    - [31, 25363.0]
  - - [361, 256, 19, 512, 361, 361, 361, 512]
    - [10, 23255.0]
  - - [200716, 128, 1, 64, 200716, 200716, 200716, 64]
    - [18, 30780.0]
  - - [27436, 128, 1, 64, 27436, 27436, 27436, 64]
    - [2, 20248.0]
  - - [1024, 1024, 160, 96, 1024, 1024, 1024, 96]
    - [12, 28667.0]
  - - [1920, 16384, 1, 25216, 1920, 1920, 1920, 25216]
    - [1, 37979.0]
  - - [3840, 16384, 1, 1920, 3840, 3840, 3840, 1920]
    - [23, 38740.0]
  - - [1920, 16384, 1, 3840, 1920, 1920, 1920, 3840]
    - [27, 36567.0]
  - - [960, 16384, 1, 1920, 960, 960, 960, 1920]
    - [23, 35153.0]
  - - [1920, 16384, 1, 2880, 1920, 1920, 1920, 2880]
    - [23, 38367.0]
  - - [1024, 1024, 40, 96, 1024, 1024, 1024, 96]
    - [23, 35129.0]
  - - [1920, 4096, 1, 25216, 1920, 1920, 1920, 25216]
    - [13, 35672.0]
  - - [3840, 4096, 1, 1920, 3840, 3840, 3840, 1920]
    - [23, 37682.0]
  - - [1920, 4096, 1, 3840, 1920, 1920, 1920, 3840]
    - [5, 34846.0]
  - - [960, 4096, 1, 1920, 960, 960, 960, 1920]
    - [13, 30252.0]
  - - [1920, 4096, 1, 2880, 1920, 1920, 1920, 2880]
    - [23, 35952.0]
  - - [1024, 1024, 80, 96, 1024, 1024, 1024, 96]
    - [1, 31462.0]
  - - [1920, 8192, 1, 25216, 1920, 1920, 1920, 25216]
    - [1, 37589.0]
  - - [3840, 8192, 1, 1920, 3840, 3840, 3840, 1920]
    - [23, 38270.0]
  - - [1920, 8192, 1, 3840, 1920, 1920, 1920, 3840]
    - [25, 35675.0]
  - - [960, 8192, 1, 1920, 960, 960, 960, 1920]
    - [13, 33385.0]
  - - [1920, 8192, 1, 2880, 1920, 1920, 1920, 2880]
    - [23, 37961.0]
  - - [1024, 1024, 96, 96, 1024, 1024, 1024, 96]
    - [1, 29220.0]
  - - [2304, 16384, 1, 12672, 2304, 2304, 2304, 12672]
    - [23, 38476.0]
  - - [2304, 16384, 1, 2304, 2304, 2304, 2304, 2304]
    - [27, 37107.0]
  - - [576, 16384, 1, 2304, 576, 576, 576, 2304]
    - [11, 31772.0]
  - - [2304, 16384, 1, 1728, 2304, 2304, 2304, 1728]
    - [23, 38761.0]
  - - [1024, 1024, 24, 96, 1024, 1024, 1024, 96]
    - [23, 34327.0]
  - - [2304, 4096, 1, 12672, 2304, 2304, 2304, 12672]
    - [23, 37427.0]
  - - [2304, 4096, 1, 2304, 2304, 2304, 2304, 2304]
    - [17, 36591.0]
  - - [576, 4096, 1, 2304, 576, 576, 576, 2304]
    - [3, 27307.0]
  - - [2304, 4096, 1, 1728, 2304, 2304, 2304, 1728]
    - [23, 37784.0]
  - - [1024, 1024, 48, 96, 1024, 1024, 1024, 96]
    - [23, 35549.0]
  - - [2304, 8192, 1, 12672, 2304, 2304, 2304, 12672]
    - [23, 38154.0]
  - - [2304, 8192, 1, 2304, 2304, 2304, 2304, 2304]
    - [17, 36975.0]
  - - [576, 8192, 1, 2304, 576, 576, 576, 2304]
    - [10, 31133.0]
  - - [2304, 8192, 1, 1728, 2304, 2304, 2304, 1728]
    - [1, 38422.0]
  - - [1024, 1024, 16, 96, 1024, 1024, 1024, 96]
    - [23, 33709.0]
  - - [3072, 4096, 1, 6400, 3072, 3072, 3072, 6400]
    - [17, 35944.0]
  - - [1536, 4096, 1, 3072, 1536, 1536, 1536, 3072]
    - [20, 34344.0]
  - - [3072, 4096, 1, 1536, 3072, 3072, 3072, 1536]
    - [21, 35417.0]
  - - [384, 4096, 1, 3072, 384, 384, 384, 3072]
    - [30, 29405.0]
  - - [3072, 4096, 1, 1152, 3072, 3072, 3072, 1152]
    - [23, 36847.0]
  - - [1024, 1024, 32, 96, 1024, 1024, 1024, 96]
    - [23, 35059.0]
  - - [3072, 8192, 1, 6400, 3072, 3072, 3072, 6400]
    - [15, 36036.0]
  - - [1536, 8192, 1, 3072, 1536, 1536, 1536, 3072]
    - [21, 35579.0]
  - - [3072, 8192, 1, 1536, 3072, 3072, 3072, 1536]
    - [25, 35844.0]
  - - [384, 8192, 1, 3072, 384, 384, 384, 3072]
    - [21, 31513.0]
  - - [3072, 8192, 1, 1152, 3072, 3072, 3072, 1152]
    - [23, 38138.0]
  - - [2048, 4096, 1, 2048, 2048, 2048, 2048, 2048]
    - [20, 33841.0]
  - - [2048, 4096, 1, 4096, 2048, 2048, 2048, 4096]
    - [10, 33915.0]
  - - [4096, 4096, 1, 2048, 4096, 4096, 4096, 2048]
    - [10, 35363.0]
  - - [1024, 2283, 1, 29000, 1024, 1024, 1024, 29000]
    - [5, 35168.0]
  - - [1024, 2296, 1, 29000, 1024, 1024, 1024, 29000]
    - [17, 35385.0]
  - - [1024, 2306, 1, 29000, 1024, 1024, 1024, 29000]
    - [1, 28583.0]
  - - [1024, 2309, 1, 29000, 1024, 1024, 1024, 29000]
    - [1, 28596.0]
  - - [1024, 2318, 1, 29000, 1024, 1024, 1024, 29000]
    - [1, 28667.0]
  - - [1024, 2320, 1, 29000, 1024, 1024, 1024, 29000]
    - [1, 28683.0]
  - - [1024, 2324, 1, 29000, 1024, 1024, 1024, 29000]
    - [1, 28740.0]
  - - [1024, 2325, 1, 29000, 1024, 1024, 1024, 29000]
    - [1, 28769.0]
  - - [1024, 2329, 1, 29000, 1024, 1024, 1024, 29000]
    - [1, 28765.0]
  - - [1024, 2338, 1, 29000, 1024, 1024, 1024, 29000]
    - [8, 28867.0]
  - - [1024, 2345, 1, 29000, 1024, 1024, 1024, 29000]
    - [18, 28921.0]
  - - [1024, 2350, 1, 29000, 1024, 1024, 1024, 29000]
    - [13, 28957.0]
  - - [1024, 2362, 1, 29000, 1024, 1024, 1024, 29000]
    - [13, 29194.0]
  - - [1024, 2366, 1, 29000, 1024, 1024, 1024, 29000]
    - [18, 29192.0]
  - - [1024, 2368, 1, 29000, 1024, 1024, 1024, 29000]
    - [23, 29212.0]
  - - [1024, 2374, 1, 29000, 1024, 1024, 1024, 29000]
    - [23, 29423.0]
  - - [1024, 2390, 1, 29000, 1024, 1024, 1024, 29000]
    - [23, 29606.0]
  - - [512, 512, 320, 64, 512, 512, 512, 64]
    - [0, 27699.0]
  - - [512, 512, 80, 64, 512, 512, 512, 64]
    - [8, 29642.0]
  - - [2560, 1024, 1, 2560, 2560, 2560, 2560, 2560]
    - [15, 30560.0]
  - - [2560, 1024, 1, 4096, 2560, 2560, 2560, 4096]
    - [20, 30612.0]
  - - [4096, 1024, 1, 2560, 4096, 4096, 4096, 2560]
    - [3, 31330.0]
  - - [1024, 1024, 512, 64, 1024, 1024, 1024, 64]
    - [2, 22675.0]
  - - [1024, 32768, 1, 3072, 1024, 1024, 1024, 3072]
    - [20, 36149.0]
  - - [1024, 32768, 1, 4096, 1024, 1024, 1024, 4096]
    - [20, 36125.0]
  - - [1024, 32768, 1, 50304, 1024, 1024, 1024, 50304]
    - [17, 36579.0]
  - - [4096, 32768, 1, 1024, 4096, 4096, 4096, 1024]
    - [3, 36240.0]
  - - [1024, 1024, 24, 128, 1024, 1024, 1024, 128]
    - [23, 35243.0]
  - - [128, 1024, 24, 1024, 128, 128, 128, 1024]
    - [21, 30626.0]
  - - [1024, 780, 1, 30522, 1024, 1024, 1024, 30522]
    - [38, 27078.0]
  - - [1024, 308, 1, 30522, 1024, 1024, 1024, 30522]
    - [39, 23500.0]
  - - [1024, 800, 1, 30522, 1024, 1024, 1024, 30522]
    - [38, 27830.0]
  - - [1024, 820, 1, 30522, 1024, 1024, 1024, 30522]
    - [33, 28529.0]
  - - [1024, 385, 1, 30522, 1024, 1024, 1024, 30522]
    - [36, 22836.0]
  - - [1024, 462, 1, 30522, 1024, 1024, 1024, 30522]
    - [36, 27058.0]
  - - [1024, 640, 1, 30528, 1024, 1024, 1024, 30528]
    - [33, 30945.0]
  - - [2048, 199, 1, 29000, 2048, 2048, 2048, 29000]
    - [35, 23018.0]
  - - [2048, 221, 1, 29000, 2048, 2048, 2048, 29000]
    - [35, 25522.0]
  - - [2048, 224, 1, 29000, 2048, 2048, 2048, 29000]
    - [36, 25871.0]
  - - [2048, 229, 1, 29000, 2048, 2048, 2048, 29000]
    - [35, 26345.0]
  - - [2048, 234, 1, 29000, 2048, 2048, 2048, 29000]
    - [40, 26884.0]
  - - [2048, 242, 1, 29000, 2048, 2048, 2048, 29000]
    - [35, 27773.0]
  - - [2048, 246, 1, 29000, 2048, 2048, 2048, 29000]
    - [37, 28207.0]
  - - [2048, 247, 1, 29000, 2048, 2048, 2048, 29000]
    - [40, 28298.0]
  - - [2048, 256, 1, 29000, 2048, 2048, 2048, 29000]
    - [36, 30343.0]
  - - [2048, 262, 1, 29000, 2048, 2048, 2048, 29000]
    - [34, 22854.0]
  - - [2048, 264, 1, 29000, 2048, 2048, 2048, 29000]
    - [34, 23046.0]
  - - [2048, 265, 1, 29000, 2048, 2048, 2048, 29000]
    - [34, 23122.0]
  - - [2048, 274, 1, 29000, 2048, 2048, 2048, 29000]
    - [34, 23891.0]
  - - [2048, 277, 1, 29000, 2048, 2048, 2048, 29000]
    - [34, 24128.0]
  - - [2048, 279, 1, 29000, 2048, 2048, 2048, 29000]
    - [34, 24325.0]
  - - [2048, 288, 1, 29000, 2048, 2048, 2048, 29000]
    - [34, 25060.0]
  - - [2048, 296, 1, 29000, 2048, 2048, 2048, 29000]
    - [34, 25742.0]
  - - [2048, 315, 1, 29000, 2048, 2048, 2048, 29000]
    - [34, 27316.0]
  - - [2048, 335, 1, 29000, 2048, 2048, 2048, 29000]
    - [35, 26354.0]
  - - [1024, 561, 1, 29000, 1024, 1024, 1024, 29000]
    - [34, 27638.0]
  - - [1024, 574, 1, 29000, 1024, 1024, 1024, 29000]
    - [39, 28265.0]
  - - [1024, 600, 1, 29000, 1024, 1024, 1024, 29000]
    - [41, 28993.0]
  - - [1024, 608, 1, 29000, 1024, 1024, 1024, 29000]
    - [33, 29322.0]
  - - [1024, 615, 1, 29000, 1024, 1024, 1024, 29000]
    - [33, 29699.0]
  - - [1024, 622, 1, 29000, 1024, 1024, 1024, 29000]
    - [43, 29924.0]
  - - [1024, 625, 1, 29000, 1024, 1024, 1024, 29000]
    - [41, 30048.0]
  - - [1024, 626, 1, 29000, 1024, 1024, 1024, 29000]
    - [33, 30192.0]
  - - [1024, 628, 1, 29000, 1024, 1024, 1024, 29000]
    - [33, 30173.0]
  - - [1024, 636, 1, 29000, 1024, 1024, 1024, 29000]
    - [33, 30602.0]
  - - [1024, 651, 1, 29000, 1024, 1024, 1024, 29000]
    - [36, 26231.0]
  - - [1024, 658, 1, 29000, 1024, 1024, 1024, 29000]
    - [41, 26523.0]
  - - [1024, 669, 1, 29000, 1024, 1024, 1024, 29000]
    - [36, 26933.0]
  - - [1024, 670, 1, 29000, 1024, 1024, 1024, 29000]
    - [41, 26980.0]
  - - [1024, 672, 1, 29000, 1024, 1024, 1024, 29000]
    - [41, 27070.0]
  - - [1024, 684, 1, 29000, 1024, 1024, 1024, 29000]
    - [41, 27520.0]
  - - [1024, 716, 1, 29000, 1024, 1024, 1024, 29000]
    - [40, 28739.0]
  - - [1024, 730, 1, 29000, 1024, 1024, 1024, 29000]
    - [42, 29198.0]
  - - [1024, 1024, 1, 3328, 1024, 1024, 1024, 3328]
    - [71, 26469.0]
  - - [128, 6784, 1, 3328, 128, 128, 128, 3328]
    - [71, 22209.0]
  - - [256, 4288, 1, 3328, 256, 256, 256, 3328]
    - [48, 27234.0]
  - - [704, 1856, 1, 3328, 704, 704, 704, 3328]
    - [47, 24775.0]
  - - [448, 1024, 1, 1280, 448, 448, 448, 1280]
    - [60, 19177.0]
  - - [1024, 704, 1, 256, 1024, 1024, 1024, 256]
    - [70, 18022.0]
  - - [256, 1856, 1, 1280, 256, 256, 256, 1280]
    - [70, 19901.0]
  - - [256, 2944, 1, 3328, 256, 256, 256, 3328]
    - [47, 23113.0]
  - - [128, 3584, 1, 1280, 128, 128, 128, 1280]
    - [78, 19771.0]
  - - [4288, 256, 1, 256, 4288, 4288, 4288, 256]
    - [55, 21784.0]
  - - [5888, 64, 1, 3328, 5888, 5888, 5888, 3328]
    - [58, 16650.0]
  - - [2944, 256, 1, 3328, 2944, 2944, 2944, 3328]
    - [62, 23306.0]
  - - [1408, 448, 1, 1280, 1408, 1408, 1408, 1280]
    - [70, 18900.0]
  - - [1408, 256, 1, 1280, 1408, 1408, 1408, 1280]
    - [71, 15920.0]
  - - [6784, 64, 1, 256, 6784, 6784, 6784, 256]
    - [70, 13928.0]
  - - [2368, 128, 1, 3328, 2368, 2368, 2368, 3328]
    - [71, 14065.0]
  - - [2944, 128, 1, 256, 2944, 2944, 2944, 256]
    - [52, 12305.0]
  - - [448, 1408, 1, 256, 448, 448, 448, 256]
    - [69, 15092.0]
  - - [64, 5056, 1, 3328, 64, 64, 64, 3328]
    - [53, 14040.0]
  - - [256, 3584, 1, 3328, 256, 256, 256, 3328]
    - [71, 23477.0]
  - - [256, 1408, 1, 256, 256, 256, 256, 256]
    - [75, 12015.0]
  - - [5056, 64, 1, 1280, 5056, 5056, 5056, 1280]
    - [46, 13788.0]
  - - [2368, 128, 1, 256, 2368, 2368, 2368, 256]
    - [46, 9773.0]
  - - [4288, 128, 1, 1280, 4288, 4288, 4288, 1280]
    - [71, 22869.0]
  - - [5888, 64, 1, 256, 5888, 5888, 5888, 256]
    - [45, 12119.0]
  - - [1856, 256, 1, 1280, 1856, 1856, 1856, 1280]
    - [71, 19836.0]
  - - [64, 5888, 1, 3328, 64, 64, 64, 3328]
    - [53, 16257.0]
  - - [1024, 704, 1, 1280, 1024, 1024, 1024, 1280]
    - [70, 21509.0]
  - - [256, 1408, 1, 3328, 256, 256, 256, 3328]
    - [71, 17064.0]
  - - [6784, 128, 1, 3328, 6784, 6784, 6784, 3328]
    - [48, 22240.0]
  - - [704, 704, 1, 3328, 704, 704, 704, 3328]
    - [71, 22700.0]
  - - [3584, 256, 1, 3328, 3584, 3584, 3584, 3328]
    - [60, 23481.0]
  - - [128, 3584, 1, 3328, 128, 128, 128, 3328]
    - [78, 21347.0]
  - - [128, 2944, 1, 1280, 128, 128, 128, 1280]
    - [65, 16306.0]
  - - [448, 1856, 1, 1280, 448, 448, 448, 1280]
    - [46, 21827.0]
  - - [3584, 128, 1, 256, 3584, 3584, 3584, 256]
    - [45, 14428.0]
  - - [448, 1408, 1, 3328, 448, 448, 448, 3328]
    - [47, 19224.0]
  - - [704, 1024, 1, 256, 704, 704, 704, 256]
    - [58, 17215.0]
  - - [256, 3584, 1, 256, 256, 256, 256, 256]
    - [60, 19871.0]
  - - [1408, 704, 1, 256, 1408, 1408, 1408, 256]
    - [47, 20366.0]
  - - [448, 2944, 1, 3328, 448, 448, 448, 3328]
    - [60, 22616.0]
  - - [64, 5888, 1, 256, 64, 64, 64, 256]
    - [53, 11793.0]
  - - [448, 2368, 1, 1280, 448, 448, 448, 1280]
    - [46, 21237.0]
  - - [704, 704, 1, 256, 704, 704, 704, 256]
    - [58, 14788.0]
  - - [128, 4288, 1, 3328, 128, 128, 128, 3328]
    - [71, 25118.0]
  - - [256, 2368, 1, 256, 256, 256, 256, 256]
    - [68, 15426.0]
  - - [1024, 448, 1, 3328, 1024, 1024, 1024, 3328]
    - [60, 21093.0]
  - - [1856, 704, 1, 1280, 1856, 1856, 1856, 1280]
    - [59, 24148.0]
  - - [1024, 1024, 1, 1280, 1024, 1024, 1024, 1280]
    - [60, 26174.0]
  - - [256, 2944, 1, 256, 256, 256, 256, 256]
    - [45, 18915.0]
  - - [128, 6784, 1, 1280, 128, 128, 128, 1280]
    - [60, 21633.0]
  - - [1408, 704, 1, 3328, 1408, 1408, 1408, 3328]
    - [71, 25132.0]
  - - [128, 5888, 1, 1280, 128, 128, 128, 1280]
    - [70, 22414.0]
  - - [704, 1408, 1, 3328, 704, 704, 704, 3328]
    - [48, 25132.0]
  - - [448, 704, 1, 1280, 448, 448, 448, 1280]
    - [53, 13262.0]
  - - [6784, 128, 1, 256, 6784, 6784, 6784, 256]
    - [48, 18807.0]
  - - [704, 448, 1, 256, 704, 704, 704, 256]
    - [58, 10143.0]
  - - [256, 1856, 1, 3328, 256, 256, 256, 3328]
    - [48, 21913.0]
  - - [1024, 704, 1, 3328, 1024, 1024, 1024, 3328]
    - [70, 22140.0]
  - - [128, 4288, 1, 256, 128, 128, 128, 256]
    - [52, 17135.0]
  - - [64, 6784, 1, 3328, 64, 64, 64, 3328]
    - [53, 17100.0]
  - - [2944, 256, 1, 1280, 2944, 2944, 2944, 1280]
    - [70, 22487.0]
  - - [1856, 704, 1, 256, 1856, 1856, 1856, 256]
    - [70, 20802.0]
  - - [704, 1856, 1, 256, 704, 704, 704, 256]
    - [47, 21333.0]
  - - [2944, 448, 1, 256, 2944, 2944, 2944, 256]
    - [70, 22630.0]
  - - [2368, 128, 1, 1280, 2368, 2368, 2368, 1280]
    - [63, 12821.0]
  - - [64, 6784, 1, 256, 64, 64, 64, 256]
    - [53, 12954.0]
  - - [64, 5056, 1, 1280, 64, 64, 64, 1280]
    - [63, 13344.0]
  - - [704, 448, 1, 3328, 704, 704, 704, 3328]
    - [60, 14627.0]
  - - [2368, 256, 1, 1280, 2368, 2368, 2368, 1280]
    - [75, 17854.0]
  - - [2368, 448, 1, 1280, 2368, 2368, 2368, 1280]
    - [47, 23831.0]
  - - [128, 3584, 1, 256, 128, 128, 128, 256]
    - [62, 14535.0]
  - - [1856, 448, 1, 3328, 1856, 1856, 1856, 3328]
    - [59, 25147.0]
  - - [128, 5056, 1, 256, 128, 128, 128, 256]
    - [64, 16115.0]
  - - [4288, 256, 1, 1280, 4288, 4288, 4288, 1280]
    - [48, 26372.0]
  - - [4288, 128, 1, 3328, 4288, 4288, 4288, 3328]
    - [60, 25216.0]
  - - [448, 2368, 1, 3328, 448, 448, 448, 3328]
    - [46, 21594.0]
  - - [256, 1408, 1, 1280, 256, 256, 256, 1280]
    - [60, 15942.0]
  - - [128, 2368, 1, 256, 128, 128, 128, 256]
    - [70, 9773.0]
  - - [6784, 64, 1, 3328, 6784, 6784, 6784, 3328]
    - [47, 19073.0]
  - - [128, 2944, 1, 3328, 128, 128, 128, 3328]
    - [78, 17609.0]
  - - [2944, 448, 1, 3328, 2944, 2944, 2944, 3328]
    - [70, 25139.0]
  - - [5888, 128, 1, 256, 5888, 5888, 5888, 256]
    - [45, 19179.0]
  - - [5056, 64, 1, 256, 5056, 5056, 5056, 256]
    - [58, 10407.0]
  - - [128, 5056, 1, 3328, 128, 128, 128, 3328]
    - [47, 19880.0]
  - - [256, 4288, 1, 1280, 256, 256, 256, 1280]
    - [48, 26342.0]
  - - [4288, 128, 1, 256, 4288, 4288, 4288, 256]
    - [58, 16376.0]
  - - [3584, 256, 1, 256, 3584, 3584, 3584, 256]
    - [60, 19672.0]
  - - [128, 2944, 1, 256, 128, 128, 128, 256]
    - [70, 12089.0]
  - - [3584, 128, 1, 3328, 3584, 3584, 3584, 3328]
    - [60, 21467.0]
  - - [5888, 128, 1, 3328, 5888, 5888, 5888, 3328]
    - [47, 23079.0]
  - - [1408, 704, 1, 1280, 1408, 1408, 1408, 1280]
    - [71, 24306.0]
  - - [448, 1408, 1, 1280, 448, 448, 448, 1280]
    - [47, 18442.0]
  - - [704, 1408, 1, 1280, 704, 704, 704, 1280]
    - [48, 24343.0]
  - - [448, 2944, 1, 256, 448, 448, 448, 256]
    - [46, 20340.0]
  - - [448, 2368, 1, 256, 448, 448, 448, 256]
    - [69, 19371.0]
  - - [64, 6784, 1, 1280, 64, 64, 64, 1280]
    - [53, 16413.0]
  - - [128, 2368, 1, 3328, 128, 128, 128, 3328]
    - [71, 14041.0]
  - - [5056, 64, 1, 3328, 5056, 5056, 5056, 3328]
    - [69, 14525.0]
  - - [5056, 128, 1, 3328, 5056, 5056, 5056, 3328]
    - [62, 19953.0]
  - - [448, 704, 1, 256, 448, 448, 448, 256]
    - [46, 10067.0]
  - - [1856, 256, 1, 3328, 1856, 1856, 1856, 3328]
    - [71, 21901.0]
  - - [2944, 128, 1, 3328, 2944, 2944, 2944, 3328]
    - [48, 17733.0]
  - - [1024, 1024, 1, 256, 1024, 1024, 1024, 256]
    - [60, 22672.0]
  - - [704, 1024, 1, 1280, 704, 704, 704, 1280]
    - [59, 21067.0]
  - - [256, 4288, 1, 256, 256, 256, 256, 256]
    - [47, 22446.0]
  - - [2368, 256, 1, 256, 2368, 2368, 2368, 256]
    - [58, 14640.0]
  - - [256, 2368, 1, 3328, 256, 256, 256, 3328]
    - [47, 18663.0]
  - - [704, 448, 1, 1280, 704, 704, 704, 1280]
    - [76, 13288.0]
  - - [256, 1856, 1, 256, 256, 256, 256, 256]
    - [75, 15594.0]
  - - [64, 5056, 1, 256, 64, 64, 64, 256]
    - [53, 10127.0]
  - - [1408, 256, 1, 3328, 1408, 1408, 1408, 3328]
    - [60, 17035.0]
  - - [2368, 448, 1, 256, 2368, 2368, 2368, 256]
    - [47, 19881.0]
  - - [4288, 256, 1, 3328, 4288, 4288, 4288, 3328]
    - [71, 27655.0]
  - - [2944, 256, 1, 256, 2944, 2944, 2944, 256]
    - [45, 18990.0]
  - - [6784, 64, 1, 1280, 6784, 6784, 6784, 1280]
    - [70, 18162.0]
  - - [704, 1856, 1, 1280, 704, 704, 704, 1280]
    - [47, 24267.0]
  - - [448, 1024, 1, 3328, 448, 448, 448, 3328]
    - [60, 21093.0]
  - - [2944, 448, 1, 1280, 2944, 2944, 2944, 1280]
    - [70, 24805.0]
  - - [448, 1024, 1, 256, 448, 448, 448, 256]
    - [69, 13817.0]
  - - [1024, 448, 1, 1280, 1024, 1024, 1024, 1280]
    - [57, 19392.0]
  - - [256, 2368, 1, 1280, 256, 256, 256, 1280]
    - [47, 18155.0]
  - - [128, 5056, 1, 1280, 128, 128, 128, 1280]
    - [47, 19282.0]
  - - [1408, 256, 1, 256, 1408, 1408, 1408, 256]
    - [75, 11891.0]
  - - [128, 5888, 1, 3328, 128, 128, 128, 3328]
    - [70, 23087.0]
  - - [2368, 448, 1, 3328, 2368, 2368, 2368, 3328]
    - [59, 24518.0]
  - - [3584, 128, 1, 1280, 3584, 3584, 3584, 1280]
    - [48, 19784.0]
  - - [1408, 448, 1, 256, 1408, 1408, 1408, 256]
    - [68, 16052.0]
  - - [2368, 256, 1, 3328, 2368, 2368, 2368, 3328]
    - [62, 18573.0]
  - - [5888, 128, 1, 1280, 5888, 5888, 5888, 1280]
    - [47, 22445.0]
  - - [256, 3584, 1, 1280, 256, 256, 256, 1280]
    - [60, 22955.0]
  - - [128, 5888, 1, 256, 128, 128, 128, 256]
    - [75, 18623.0]
  - - [1408, 448, 1, 3328, 1408, 1408, 1408, 3328]
    - [70, 19423.0]
  - - [64, 5888, 1, 1280, 64, 64, 64, 1280]
    - [63, 15440.0]
  - - [704, 704, 1, 1280, 704, 704, 704, 1280]
    - [71, 20637.0]
  - - [128, 2368, 1, 1280, 128, 128, 128, 1280]
    - [46, 12762.0]
  - - [3584, 256, 1, 1280, 3584, 3584, 3584, 1280]
    - [71, 22947.0]
  - - [5888, 64, 1, 1280, 5888, 5888, 5888, 1280]
    - [58, 15856.0]
  - - [5056, 128, 1, 1280, 5056, 5056, 5056, 1280]
    - [52, 19202.0]
  - - [448, 1856, 1, 3328, 448, 448, 448, 3328]
    - [69, 22305.0]
  - - [1024, 448, 1, 256, 1024, 1024, 1024, 256]
    - [57, 14754.0]
  - - [2944, 128, 1, 1280, 2944, 2944, 2944, 1280]
    - [48, 16451.0]
  - - [256, 2944, 1, 1280, 256, 256, 256, 1280]
    - [70, 22476.0]
  - - [704, 1024, 1, 3328, 704, 704, 704, 3328]
    - [59, 21930.0]
  - - [1856, 448, 1, 1280, 1856, 1856, 1856, 1280]
    - [45, 24090.0]
  - - [128, 6784, 1, 256, 128, 128, 128, 256]
    - [55, 18587.0]
  - - [704, 1408, 1, 256, 704, 704, 704, 256]
    - [55, 19949.0]
  - - [448, 2944, 1, 1280, 448, 448, 448, 1280]
    - [60, 22039.0]
  - - [1856, 256, 1, 256, 1856, 1856, 1856, 256]
    - [46, 14243.0]
  - - [5056, 128, 1, 256, 5056, 5056, 5056, 256]
    - [46, 15455.0]
  - - [6784, 128, 1, 1280, 6784, 6784, 6784, 1280]
    - [48, 21768.0]
  - - [1856, 448, 1, 256, 1856, 1856, 1856, 256]
    - [58, 19005.0]
  - - [128, 4288, 1, 1280, 128, 128, 128, 1280]
    - [47, 22766.0]
  - - [448, 704, 1, 3328, 448, 448, 448, 3328]
    - [71, 14570.0]
  - - [448, 1856, 1, 256, 448, 448, 448, 256]
    - [46, 18837.0]
  - - [1856, 704, 1, 3328, 1856, 1856, 1856, 3328]
    - [59, 24800.0]
  - - [64, 193600, 1, 64, 64, 64, 64, 64]
    - [53, 21821.0]
  - - [1024, 700, 1, 512, 1024, 1024, 1024, 512]
    - [70, 18630.0]
  - - [2560, 128, 1, 2560, 2560, 2560, 2560, 2560]
    - [60, 15219.0]
  - - [64, 193600, 1, 256, 64, 64, 64, 256]
    - [76, 21438.0]
  - - [4096, 128, 1, 4096, 4096, 4096, 4096, 4096]
    - [78, 23989.0]
  - - [512, 1500, 1, 2816, 512, 512, 512, 2816]
    - [70, 23032.0]
  - - [3072, 128, 1, 1024, 3072, 3072, 3072, 1024]
    - [60, 16448.0]
  - - [7680, 64, 1, 2560, 7680, 7680, 7680, 2560]
    - [59, 21341.0]
  - - [7680, 128, 1, 2560, 7680, 7680, 7680, 2560]
    - [48, 24828.0]
  - - [512, 1500, 1, 2560, 512, 512, 512, 2560]
    - [70, 22947.0]
  - - [1024, 1024, 1, 1024, 1024, 1024, 1024, 1024]
    - [60, 25886.0]
  - - [512, 1500, 1, 2048, 512, 512, 512, 2048]
    - [54, 22547.0]
  - - [512, 1500, 1, 1536, 512, 512, 512, 1536]
    - [70, 22521.0]
  - - [3136, 64, 128, 64, 3136, 3136, 3136, 64]
    - [74, 28182.0]
  - - [3136, 64, 64, 256, 3136, 3136, 3136, 256]
    - [59, 28475.0]
  - - [3136, 64, 128, 256, 3136, 3136, 3136, 256]
    - [50, 19100.0]
  - - [3136, 64, 256, 64, 3136, 3136, 3136, 64]
    - [44, 15388.0]
  - - [3136, 64, 64, 64, 3136, 3136, 3136, 64]
    - [67, 26726.0]
  - - [3136, 64, 256, 256, 3136, 3136, 3136, 256]
    - [73, 19355.0]
  - - [64, 128, 512, 128, 64, 64, 64, 128]
    - [58, 16269.0]
  - - [64, 512, 64, 512, 64, 64, 64, 512]
    - [79, 16867.0]
  - - [512, 1600, 1, 32, 512, 512, 512, 32]
    - [67, 7756.0]
  - - [512, 1600, 1, 512, 512, 512, 512, 512]
    - [70, 22502.0]
  - - [560, 1600, 1, 1024, 560, 560, 560, 1024]
    - [55, 21437.0]
  - - [1024, 512, 1, 1, 1024, 1024, 1024, 1]
    - [67, 206.0]
  - - [1024, 512, 1, 64, 1024, 1024, 1024, 64]
    - [67, 8648.0]
  - - [1024, 512, 1, 1024, 1024, 1024, 1024, 1024]
    - [60, 22313.0]
  - - [1024, 960, 1, 64, 1024, 1024, 1024, 64]
    - [67, 13329.0]
  - - [1024, 960, 1, 1024, 1024, 1024, 1024, 1024]
    - [71, 23530.0]
  - - [1600, 512, 1, 1024, 1600, 1600, 1600, 1024]
    - [59, 23199.0]
  - - [2048, 512, 1, 1, 2048, 2048, 2048, 1]
    - [67, 397.0]
  - - [2048, 512, 1, 2048, 2048, 2048, 2048, 2048]
    - [60, 26369.0]
  - - [64, 192, 64, 1280, 64, 64, 64, 1280]
    - [53, 20435.0]
  - - [64, 320, 64, 1280, 64, 64, 64, 1280]
    - [63, 21531.0]
  - - [64, 384, 64, 1280, 64, 64, 64, 1280]
    - [63, 20623.0]
  - - [64, 448, 64, 1280, 64, 64, 64, 1280]
    - [53, 18250.0]
  - - [64, 192, 64, 2048, 64, 64, 64, 2048]
    - [53, 20718.0]
  - - [64, 320, 64, 2048, 64, 64, 64, 2048]
    - [76, 20831.0]
  - - [64, 384, 64, 2048, 64, 64, 64, 2048]
    - [76, 18991.0]
  - - [64, 448, 64, 2048, 64, 64, 64, 2048]
    - [79, 17533.0]
  - - [1225, 64, 64, 192, 1225, 1225, 1225, 192]
    - [47, 26150.0]
  - - [1225, 64, 64, 256, 1225, 1225, 1225, 256]
    - [47, 26760.0]
  - - [1225, 64, 64, 288, 1225, 1225, 1225, 288]
    - [70, 26790.0]
  - - [5329, 80, 64, 64, 5329, 5329, 5329, 64]
    - [59, 17303.0]
  - - [64, 192, 32, 1280, 64, 64, 64, 1280]
    - [53, 15978.0]
  - - [64, 320, 32, 1280, 64, 64, 64, 1280]
    - [76, 18056.0]
  - - [64, 384, 32, 1280, 64, 64, 64, 1280]
    - [53, 20419.0]
  - - [64, 448, 32, 1280, 64, 64, 64, 1280]
    - [76, 18924.0]
  - - [64, 192, 32, 2048, 64, 64, 64, 2048]
    - [76, 16375.0]
  - - [64, 320, 32, 2048, 64, 64, 64, 2048]
    - [53, 18431.0]
  - - [64, 384, 32, 2048, 64, 64, 64, 2048]
    - [63, 20707.0]
  - - [64, 448, 32, 2048, 64, 64, 64, 2048]
    - [63, 19225.0]
  - - [1225, 64, 32, 192, 1225, 1225, 1225, 192]
    - [59, 23612.0]
  - - [1225, 64, 32, 256, 1225, 1225, 1225, 256]
    - [70, 24759.0]
  - - [1225, 64, 32, 288, 1225, 1225, 1225, 288]
    - [47, 24812.0]
  - - [5329, 80, 32, 64, 5329, 5329, 5329, 64]
    - [54, 16688.0]
  - - [289, 128, 32, 768, 289, 289, 289, 768]
    - [48, 19492.0]
  - - [289, 160, 32, 768, 289, 289, 289, 768]
    - [47, 17597.0]
  - - [289, 192, 32, 768, 289, 289, 289, 768]
    - [47, 21096.0]
  - - [3136, 64, 32, 64, 3136, 3136, 3136, 64]
    - [44, 25373.0]
  - - [3136, 64, 32, 256, 3136, 3136, 3136, 256]
    - [64, 27248.0]
  - - [196, 256, 32, 1024, 196, 196, 196, 1024]
    - [55, 20036.0]
  - - [960, 1024, 1, 1024, 960, 960, 960, 1024]
    - [60, 23487.0]
  - - [64, 512, 16, 512, 64, 64, 64, 512]
    - [76, 17614.0]
  - - [64, 512, 128, 512, 64, 64, 64, 512]
    - [79, 18811.0]
  - - [1024, 512, 1, 2, 1024, 1024, 1024, 2]
    - [71, 413.0]
  - - [1024, 512, 1, 4096, 1024, 1024, 1024, 4096]
    - [65, 24576.0]
  - - [1024, 616, 1, 1024, 1024, 1024, 1024, 1024]
    - [70, 17952.0]
  - - [64, 128, 128, 128, 64, 64, 64, 128]
    - [69, 16210.0]
  - - [64, 128, 160, 128, 64, 64, 64, 128]
    - [69, 17296.0]
  - - [1024, 1024, 1, 2, 1024, 1024, 1024, 2]
    - [67, 807.0]
  - - [1024, 1024, 1, 4096, 1024, 1024, 1024, 4096]
    - [65, 26733.0]
  - - [64, 128, 624, 128, 64, 64, 64, 128]
    - [61, 17761.0]
  - - [1024, 780, 1, 1024, 1024, 1024, 1024, 1024]
    - [77, 22494.0]
  - - [64, 128, 640, 128, 64, 64, 64, 128]
    - [56, 17395.0]
  - - [1024, 800, 1, 1024, 1024, 1024, 1024, 1024]
    - [77, 23058.0]
  - - [64, 128, 656, 128, 64, 64, 64, 128]
    - [61, 17674.0]
  - - [1024, 820, 1, 1024, 1024, 1024, 1024, 1024]
    - [70, 23609.0]
  - - [64, 512, 80, 512, 64, 64, 64, 512]
    - [66, 17577.0]
  - - [1024, 385, 1, 1024, 1024, 1024, 1024, 1024]
    - [48, 16007.0]
  - - [64, 512, 96, 512, 64, 64, 64, 512]
    - [56, 18398.0]
  - - [1024, 462, 1, 1024, 1024, 1024, 1024, 1024]
    - [71, 19028.0]
  - - [64, 128, 144, 128, 64, 64, 64, 128]
    - [69, 17681.0]
  - - [64, 1024, 32, 1024, 64, 64, 64, 1024]
    - [79, 18004.0]
  - - [96, 1024, 64, 1024, 96, 96, 96, 1024]
    - [65, 21962.0]
  - - [64, 1024, 256, 1024, 64, 64, 64, 1024]
    - [79, 18900.0]
  - - [64, 512, 256, 512, 64, 64, 64, 512]
    - [56, 19133.0]
  - - [64, 1024, 64, 1024, 64, 64, 64, 1024]
    - [66, 18457.0]
  - - [64, 1024, 128, 1024, 64, 64, 64, 1024]
    - [66, 18596.0]
  - - [96, 1024, 128, 1024, 96, 96, 96, 1024]
    - [54, 21625.0]
  - - [64, 512, 40, 512, 64, 64, 64, 512]
    - [53, 18098.0]
  - - [64, 128, 1024, 128, 64, 64, 64, 128]
    - [49, 18494.0]
  - - [1024, 864, 1, 1024, 1024, 1024, 1024, 1024]
    - [78, 21069.0]
  - - [1024, 864, 1, 512, 1024, 1024, 1024, 512]
    - [78, 19391.0]
  - - [256, 3456, 1, 128, 256, 256, 256, 128]
    - [60, 16556.0]
  - - [256, 4096, 1, 128, 256, 256, 256, 128]
    - [60, 19174.0]
  - - [480, 864, 1, 1024, 480, 480, 480, 1024]
    - [65, 16576.0]
  - - [512, 864, 1, 256, 512, 512, 512, 256]
    - [52, 12125.0]
  - - [64, 128, 1280, 128, 64, 64, 64, 128]
    - [66, 18995.0]
  - - [64, 128, 1312, 128, 64, 64, 64, 128]
    - [56, 19033.0]
  - - [64, 512, 192, 512, 64, 64, 64, 512]
    - [66, 19328.0]
  - - [256, 4096, 1, 1, 256, 256, 256, 1]
    - [71, 310.0]
  - - [12544, 64, 1, 147, 12544, 12544, 12544, 147]
    - [68, 16575.0]
  - - [64, 128, 2048, 128, 64, 64, 64, 128]
    - [49, 19092.0]
  - - [64, 128, 1536, 128, 64, 64, 64, 128]
    - [49, 18620.0]
  - - [64, 128, 192, 128, 64, 64, 64, 128]
    - [69, 17976.0]
  - - [64, 384, 144, 384, 64, 64, 64, 384]
    - [72, 18454.0]
  - - [64, 512, 48, 512, 64, 64, 64, 512]
    - [53, 16556.0]
  - - [64, 128, 256, 128, 64, 64, 64, 128]
    - [46, 16468.0]
  - - [64, 384, 192, 384, 64, 64, 64, 384]
    - [69, 22243.0]
  - - [3400, 256, 1, 1024, 3400, 3400, 3400, 1024]
    - [71, 20708.0]
  - - [3800, 256, 1, 1024, 3800, 3800, 3800, 1024]
    - [71, 23070.0]
  - - [864, 512, 2, 2048, 864, 864, 864, 2048]
    - [55, 21889.0]
  - - [888, 512, 2, 2048, 888, 888, 888, 2048]
    - [78, 22426.0]
  - - [51520, 64, 2, 256, 51520, 51520, 51520, 256]
    - [54, 27477.0]
  - - [46464, 64, 2, 256, 46464, 46464, 46464, 256]
    - [47, 27885.0]
  - - [49152, 64, 2, 256, 49152, 49152, 49152, 256]
    - [77, 28177.0]
  - - [1536, 512, 1, 1024, 1536, 1536, 1536, 1024]
    - [70, 23088.0]
  - - [1728, 512, 1, 1024, 1728, 1728, 1728, 1024]
    - [48, 21267.0]
  - - [1024, 1024, 1, 320, 1024, 1024, 1024, 320]
    - [60, 23431.0]
  - - [51520, 64, 2, 64, 51520, 51520, 51520, 64]
    - [51, 25152.0]
  - - [55296, 64, 2, 64, 55296, 55296, 55296, 64]
    - [44, 25592.0]
  - - [49152, 64, 2, 64, 49152, 49152, 49152, 64]
    - [44, 24948.0]
  - - [54400, 64, 2, 64, 54400, 54400, 54400, 64]
    - [51, 25465.0]
  - - [42240, 64, 2, 256, 42240, 42240, 42240, 256]
    - [77, 27850.0]
  - - [672, 512, 2, 2048, 672, 672, 672, 2048]
    - [54, 20496.0]
  - - [54400, 64, 2, 256, 54400, 54400, 54400, 256]
    - [54, 28640.0]
  - - [56832, 64, 2, 256, 56832, 56832, 56832, 256]
    - [47, 28721.0]
  - - [55296, 64, 2, 256, 55296, 55296, 55296, 256]
    - [70, 29010.0]
  - - [60800, 64, 2, 64, 60800, 60800, 60800, 64]
    - [67, 25834.0]
  - - [768, 512, 2, 2048, 768, 768, 768, 2048]
    - [77, 23665.0]
  - - [43008, 64, 2, 256, 43008, 43008, 43008, 256]
    - [47, 28333.0]
  - - [864, 256, 2, 2048, 864, 864, 864, 2048]
    - [65, 19458.0]
  - - [768, 256, 2, 2048, 768, 768, 768, 2048]
    - [55, 17880.0]
  - - [45632, 64, 2, 256, 45632, 45632, 45632, 256]
    - [47, 27557.0]
  - - [60800, 64, 2, 256, 60800, 60800, 60800, 256]
    - [47, 28641.0]
  - - [1024, 1024, 1, 81, 1024, 1024, 1024, 81]
    - [67, 15443.0]
  - - [950, 512, 2, 2048, 950, 950, 950, 2048]
    - [55, 23934.0]
  - - [850, 512, 2, 2048, 850, 850, 850, 2048]
    - [55, 21487.0]
  - - [805, 512, 2, 2048, 805, 805, 805, 2048]
    - [63, 21316.0]
  - - [950, 256, 2, 2048, 950, 950, 950, 2048]
    - [78, 21213.0]
  - - [1900, 512, 1, 1024, 1900, 1900, 1900, 1024]
    - [48, 23340.0]
  - - [1700, 512, 1, 1024, 1700, 1700, 1700, 1024]
    - [48, 20922.0]
  - - [1610, 512, 1, 1024, 1610, 1610, 1610, 1024]
    - [47, 23305.0]
  - - [660, 512, 2, 2048, 660, 660, 660, 2048]
    - [54, 20100.0]
  - - [726, 512, 2, 2048, 726, 726, 726, 2048]
    - [54, 22136.0]
  - - [713, 512, 2, 2048, 713, 713, 713, 2048]
    - [54, 21715.0]
  - - [805, 256, 2, 2048, 805, 805, 805, 2048]
    - [55, 18137.0]
  - - [850, 256, 2, 2048, 850, 850, 850, 2048]
    - [55, 19126.0]
  - - [100, 128, 120, 512, 100, 100, 100, 512]
    - [77, 19661.0]
  - - [100, 128, 139, 512, 100, 100, 100, 512]
    - [77, 20154.0]
  - - [100, 128, 160, 512, 100, 100, 100, 512]
    - [77, 20780.0]
  - - [22500, 64, 1, 147, 22500, 22500, 22500, 147]
    - [45, 19002.0]
  - - [96, 1024, 160, 1024, 96, 96, 96, 1024]
    - [77, 21902.0]
  - - [96, 1024, 40, 1024, 96, 96, 96, 1024]
    - [55, 22603.0]
  - - [96, 1024, 80, 1024, 96, 96, 96, 1024]
    - [64, 21696.0]
  - - [96, 1024, 96, 1024, 96, 96, 96, 1024]
    - [54, 21469.0]
  - - [96, 1024, 24, 1024, 96, 96, 96, 1024]
    - [64, 20752.0]
  - - [96, 1024, 48, 1024, 96, 96, 96, 1024]
    - [55, 22608.0]
  - - [96, 1024, 16, 1024, 96, 96, 96, 1024]
    - [65, 19599.0]
  - - [96, 1024, 32, 1024, 96, 96, 96, 1024]
    - [54, 20699.0]
  - - [64, 512, 320, 512, 64, 64, 64, 512]
    - [66, 18306.0]
  - - [64, 1024, 512, 1024, 64, 64, 64, 1024]
    - [79, 19249.0]
  - - [1024, 77, 1, 30522, 1024, 1024, 1024, 30522]
    - [81, 13807.0]
  - - [1024, 200, 1, 30522, 1024, 1024, 1024, 30522]
    - [81, 20094.0]
  - - [1024, 160, 1, 30522, 1024, 1024, 1024, 30522]
    - [80, 19354.0]
  - - [1024, 180, 1, 30522, 1024, 1024, 1024, 30522]
    - [80, 21743.0]
  - - [1024, 160, 1, 30528, 1024, 1024, 1024, 30528]
    - [80, 19395.0]
  - - [1024, 240, 1, 30528, 1024, 1024, 1024, 30528]
    - [81, 23842.0]
  - - [2560, 109, 1, 29000, 2560, 2560, 2560, 29000]
    - [80, 20381.0]
  - - [2560, 121, 1, 29000, 2560, 2560, 2560, 29000]
    - [80, 22628.0]
  - - [2560, 65, 1, 29000, 2560, 2560, 2560, 29000]
    - [82, 12285.0]
  - - [2560, 66, 1, 29000, 2560, 2560, 2560, 29000]
    - [80, 12496.0]
  - - [2560, 67, 1, 29000, 2560, 2560, 2560, 29000]
    - [80, 12692.0]
  - - [2560, 69, 1, 29000, 2560, 2560, 2560, 29000]
    - [80, 13044.0]
  - - [2560, 70, 1, 29000, 2560, 2560, 2560, 29000]
    - [80, 13267.0]
  - - [2560, 71, 1, 29000, 2560, 2560, 2560, 29000]
    - [80, 13423.0]
  - - [2560, 73, 1, 29000, 2560, 2560, 2560, 29000]
    - [80, 13806.0]
  - - [2560, 74, 1, 29000, 2560, 2560, 2560, 29000]
    - [80, 13986.0]
  - - [2560, 75, 1, 29000, 2560, 2560, 2560, 29000]
    - [80, 14206.0]
  - - [2560, 77, 1, 29000, 2560, 2560, 2560, 29000]
    - [80, 14622.0]
  - - [2560, 78, 1, 29000, 2560, 2560, 2560, 29000]
    - [80, 14808.0]
  - - [2560, 80, 1, 29000, 2560, 2560, 2560, 29000]
    - [80, 15156.0]
  - - [2560, 81, 1, 29000, 2560, 2560, 2560, 29000]
    - [80, 15308.0]
  - - [2560, 82, 1, 29000, 2560, 2560, 2560, 29000]
    - [80, 15535.0]
  - - [2560, 83, 1, 29000, 2560, 2560, 2560, 29000]
    - [80, 15688.0]
  - - [2560, 84, 1, 29000, 2560, 2560, 2560, 29000]
    - [80, 15879.0]
  - - [2560, 88, 1, 29000, 2560, 2560, 2560, 29000]
    - [80, 16623.0]
  - - [2560, 89, 1, 29000, 2560, 2560, 2560, 29000]
    - [82, 16742.0]
  - - [2560, 90, 1, 29000, 2560, 2560, 2560, 29000]
    - [80, 16969.0]
  - - [2560, 92, 1, 29000, 2560, 2560, 2560, 29000]
    - [80, 17354.0]
  - - [2560, 95, 1, 29000, 2560, 2560, 2560, 29000]
    - [80, 17934.0]
  - - [2560, 98, 1, 29000, 2560, 2560, 2560, 29000]
    - [80, 18464.0]
  - - [2368, 64, 1, 3328, 2368, 2368, 2368, 3328]
    - [90, 8660.0]
  - - [256, 704, 1, 1280, 256, 256, 256, 1280]
    - [97, 10074.0]
  - - [1408, 64, 1, 1280, 1408, 1408, 1408, 1280]
    - [90, 7102.0]
  - - [1024, 256, 1, 3328, 1024, 1024, 1024, 3328]
    - [123, 12963.0]
  - - [704, 128, 1, 1280, 704, 704, 704, 1280]
    - [90, 7155.0]
  - - [64, 3584, 1, 3328, 64, 64, 64, 3328]
    - [97, 10893.0]
  - - [1024, 256, 1, 256, 1024, 1024, 1024, 256]
    - [123, 10107.0]
  - - [448, 448, 1, 256, 448, 448, 448, 256]
    - [90, 8621.0]
  - - [128, 1024, 1, 3328, 128, 128, 128, 3328]
    - [107, 11122.0]
  - - [64, 1856, 1, 1280, 64, 64, 64, 1280]
    - [90, 9305.0]
  - - [448, 256, 1, 256, 448, 448, 448, 256]
    - [102, 6117.0]
  - - [256, 1024, 1, 256, 256, 256, 256, 256]
    - [109, 9986.0]
  - - [1024, 128, 1, 1280, 1024, 1024, 1024, 1280]
    - [127, 9800.0]
  - - [448, 256, 1, 3328, 448, 448, 448, 3328]
    - [90, 9722.0]
  - - [128, 704, 1, 1280, 128, 128, 128, 1280]
    - [120, 7094.0]
  - - [1856, 128, 1, 3328, 1856, 1856, 1856, 3328]
    - [85, 11839.0]
  - - [256, 448, 1, 256, 256, 256, 256, 256]
    - [107, 6066.0]
  - - [448, 448, 1, 3328, 448, 448, 448, 3328]
    - [90, 11596.0]
  - - [1408, 128, 1, 1280, 1408, 1408, 1408, 1280]
    - [90, 9961.0]
  - - [128, 1856, 1, 1280, 128, 128, 128, 1280]
    - [97, 11074.0]
  - - [64, 1408, 1, 3328, 64, 64, 64, 3328]
    - [127, 7654.0]
  - - [256, 704, 1, 256, 256, 256, 256, 256]
    - [107, 7793.0]
  - - [128, 1408, 1, 256, 128, 128, 128, 256]
    - [107, 7767.0]
  - - [256, 448, 1, 3328, 256, 256, 256, 3328]
    - [90, 9722.0]
  - - [64, 2368, 1, 1280, 64, 64, 64, 1280]
    - [97, 8501.0]
  - - [2368, 64, 1, 256, 2368, 2368, 2368, 256]
    - [90, 6598.0]
  - - [704, 128, 1, 3328, 704, 704, 704, 3328]
    - [90, 7658.0]
  - - [4288, 64, 1, 1280, 4288, 4288, 4288, 1280]
    - [116, 12774.0]
  - - [128, 1024, 1, 1280, 128, 128, 128, 1280]
    - [90, 10255.0]
  - - [128, 1024, 1, 256, 128, 128, 128, 256]
    - [102, 6848.0]
  - - [1856, 64, 1, 256, 1856, 1856, 1856, 256]
    - [102, 6033.0]
  - - [704, 128, 1, 256, 704, 704, 704, 256]
    - [89, 5340.0]
  - - [448, 256, 1, 1280, 448, 448, 448, 1280]
    - [90, 9028.0]
  - - [1856, 128, 1, 1280, 1856, 1856, 1856, 1280]
    - [104, 11363.0]
  - - [64, 3584, 1, 256, 64, 64, 64, 256]
    - [109, 8510.0]
  - - [64, 1856, 1, 256, 64, 64, 64, 256]
    - [102, 6181.0]
  - - [256, 1024, 1, 1280, 256, 256, 256, 1280]
    - [104, 12437.0]
  - - [3584, 64, 1, 1280, 3584, 3584, 3584, 1280]
    - [85, 10972.0]
  - - [1408, 128, 1, 3328, 1408, 1408, 1408, 3328]
    - [90, 10359.0]
  - - [64, 2944, 1, 3328, 64, 64, 64, 3328]
    - [107, 10860.0]
  - - [64, 4288, 1, 3328, 64, 64, 64, 3328]
    - [97, 12940.0]
  - - [64, 2944, 1, 256, 64, 64, 64, 256]
    - [97, 8039.0]
  - - [64, 1408, 1, 1280, 64, 64, 64, 1280]
    - [102, 7042.0]
  - - [64, 2944, 1, 1280, 64, 64, 64, 1280]
    - [109, 10458.0]
  - - [704, 256, 1, 256, 704, 704, 704, 256]
    - [90, 7793.0]
  - - [256, 448, 1, 1280, 256, 256, 256, 1280]
    - [107, 9039.0]
  - - [704, 256, 1, 1280, 704, 704, 704, 1280]
    - [90, 9995.0]
  - - [64, 2368, 1, 3328, 64, 64, 64, 3328]
    - [107, 8762.0]
  - - [256, 704, 1, 3328, 256, 256, 256, 3328]
    - [107, 10442.0]
  - - [2944, 64, 1, 1280, 2944, 2944, 2944, 1280]
    - [90, 10404.0]
  - - [128, 1408, 1, 3328, 128, 128, 128, 3328]
    - [107, 10431.0]
  - - [1408, 64, 1, 256, 1408, 1408, 1408, 256]
    - [89, 5291.0]
  - - [64, 2368, 1, 256, 64, 64, 64, 256]
    - [109, 6689.0]
  - - [1024, 128, 1, 3328, 1024, 1024, 1024, 3328]
    - [113, 10593.0]
  - - [2368, 64, 1, 1280, 2368, 2368, 2368, 1280]
    - [90, 8427.0]
  - - [4288, 64, 1, 256, 4288, 4288, 4288, 256]
    - [104, 10455.0]
  - - [64, 4288, 1, 1280, 64, 64, 64, 1280]
    - [123, 12386.0]
  - - [1408, 64, 1, 3328, 1408, 1408, 1408, 3328]
    - [90, 7646.0]
  - - [2944, 64, 1, 256, 2944, 2944, 2944, 256]
    - [90, 8093.0]
  - - [448, 448, 1, 1280, 448, 448, 448, 1280]
    - [97, 11170.0]
  - - [1024, 256, 1, 1280, 1024, 1024, 1024, 1280]
    - [123, 12511.0]
  - - [3584, 64, 1, 3328, 3584, 3584, 3584, 3328]
    - [85, 11333.0]
  - - [256, 1024, 1, 3328, 256, 256, 256, 3328]
    - [97, 12651.0]
  - - [1856, 64, 1, 3328, 1856, 1856, 1856, 3328]
    - [90, 8972.0]
  - - [1856, 64, 1, 1280, 1856, 1856, 1856, 1280]
    - [90, 8428.0]
  - - [1024, 128, 1, 256, 1024, 1024, 1024, 256]
    - [120, 6765.0]
  - - [64, 3584, 1, 1280, 64, 64, 64, 1280]
    - [109, 10471.0]
  - - [3584, 64, 1, 256, 3584, 3584, 3584, 256]
    - [104, 8790.0]
  - - [64, 1856, 1, 3328, 64, 64, 64, 3328]
    - [102, 10059.0]
  - - [1408, 128, 1, 256, 1408, 1408, 1408, 256]
    - [107, 7793.0]
  - - [128, 704, 1, 256, 128, 128, 128, 256]
    - [89, 5315.0]
  - - [128, 704, 1, 3328, 128, 128, 128, 3328]
    - [120, 7627.0]
  - - [128, 1856, 1, 256, 128, 128, 128, 256]
    - [123, 8918.0]
  - - [64, 4288, 1, 256, 64, 64, 64, 256]
    - [109, 10036.0]
  - - [704, 256, 1, 3328, 704, 704, 704, 3328]
    - [90, 10427.0]
  - - [1856, 128, 1, 256, 1856, 1856, 1856, 256]
    - [104, 9271.0]
  - - [4288, 64, 1, 3328, 4288, 4288, 4288, 3328]
    - [104, 13198.0]
  - - [64, 1408, 1, 256, 64, 64, 64, 256]
    - [89, 5219.0]
  - - [2944, 64, 1, 3328, 2944, 2944, 2944, 3328]
    - [90, 10785.0]
  - - [128, 1408, 1, 1280, 128, 128, 128, 1280]
    - [97, 10082.0]
  - - [128, 1856, 1, 3328, 128, 128, 128, 3328]
    - [123, 11492.0]
  - - [1760, 64, 1, 1760, 1760, 1760, 1760, 1760]
    - [90, 8330.0]
  - - [2560, 32, 1, 2560, 2560, 2560, 2560, 2560]
    - [89, 6570.0]
  - - [2048, 128, 1, 2048, 2048, 2048, 2048, 2048]
    - [116, 12597.0]
  - - [4608, 32, 1, 1536, 4608, 4608, 4608, 1536]
    - [90, 11027.0]
  - - [3072, 64, 1, 1024, 3072, 3072, 3072, 1024]
    - [90, 10630.0]
  - - [128, 1500, 1, 1280, 128, 128, 128, 1280]
    - [97, 10723.0]
  - - [4096, 32, 1, 4096, 4096, 4096, 4096, 4096]
    - [107, 10207.0]
  - - [1760, 128, 1, 1760, 1760, 1760, 1760, 1760]
    - [85, 10935.0]
  - - [4096, 64, 1, 4096, 4096, 4096, 4096, 4096]
    - [85, 12807.0]
  - - [7680, 32, 1, 2560, 7680, 7680, 7680, 2560]
    - [116, 11742.0]
  - - [2560, 64, 1, 2560, 2560, 2560, 2560, 2560]
    - [90, 9421.0]
  - - [3072, 32, 1, 1024, 3072, 3072, 3072, 1024]
    - [90, 7039.0]
  - - [6144, 32, 1, 2560, 6144, 6144, 6144, 2560]
    - [107, 11062.0]
  - - [176, 1500, 1, 1408, 176, 176, 176, 1408]
    - [104, 12341.0]
  - - [2048, 64, 1, 2048, 2048, 2048, 2048, 2048]
    - [102, 9406.0]
  - - [8448, 32, 1, 2816, 8448, 8448, 8448, 2816]
    - [104, 12825.0]
  - - [512, 512, 1, 64, 512, 512, 512, 64]
    - [116, 5707.0]
  - - [32, 33, 1600, 33, 32, 32, 32, 33]
    - [95, 5163.0]
  - - [256, 1024, 1, 1, 256, 256, 256, 1]
    - [105, 149.0]
  - - [257, 1024, 1, 4096, 257, 257, 257, 4096]
    - [109, 10355.0]
  - - [512, 200, 1, 1, 512, 512, 512, 1]
    - [96, 62.0]
  - - [512, 200, 1, 32, 512, 512, 512, 32]
    - [124, 1606.0]
  - - [512, 215, 1, 2048, 512, 512, 512, 2048]
    - [90, 8792.0]
  - - [512, 256, 1, 2048, 512, 512, 512, 2048]
    - [90, 10627.0]
  - - [560, 200, 1, 1024, 560, 560, 560, 1024]
    - [90, 8192.0]
  - - [768, 215, 1, 2048, 768, 768, 768, 2048]
    - [107, 9260.0]
  - - [768, 256, 1, 2048, 768, 768, 768, 2048]
    - [97, 11179.0]
  - - [1024, 200, 1, 1, 1024, 1024, 1024, 1]
    - [117, 118.0]
  - - [64, 32, 4608, 32, 64, 64, 64, 32]
    - [116, 13351.0]
  - - [64, 34, 4736, 34, 64, 64, 64, 34]
    - [109, 7681.0]
  - - [64, 35, 4608, 32, 64, 64, 64, 32]
    - [85, 8208.0]
  - - [64, 35, 4608, 35, 64, 64, 64, 35]
    - [97, 7813.0]
  - - [64, 33, 1920, 27, 64, 64, 64, 27]
    - [85, 6717.0]
  - - [64, 33, 1920, 33, 64, 64, 64, 33]
    - [97, 6820.0]
  - - [1225, 32, 64, 192, 1225, 1225, 1225, 192]
    - [104, 13938.0]
  - - [1225, 48, 64, 192, 1225, 1225, 1225, 192]
    - [123, 10862.0]
  - - [1225, 48, 64, 256, 1225, 1225, 1225, 256]
    - [104, 10928.0]
  - - [1225, 48, 64, 288, 1225, 1225, 1225, 288]
    - [109, 10974.0]
  - - [1225, 32, 32, 192, 1225, 1225, 1225, 192]
    - [104, 13047.0]
  - - [1225, 48, 32, 192, 1225, 1225, 1225, 192]
    - [109, 10502.0]
  - - [1225, 48, 32, 256, 1225, 1225, 1225, 256]
    - [85, 10587.0]
  - - [1225, 48, 32, 288, 1225, 1225, 1225, 288]
    - [85, 10672.0]
  - - [49, 2048, 64, 512, 49, 49, 49, 512]
    - [102, 10709.0]
  - - [49, 512, 64, 2048, 49, 49, 49, 2048]
    - [102, 10370.0]
  - - [49, 2048, 32, 512, 49, 49, 49, 512]
    - [102, 10554.0]
  - - [49, 512, 32, 2048, 49, 49, 49, 2048]
    - [127, 9779.0]
  - - [49, 2048, 64, 1024, 49, 49, 49, 1024]
    - [127, 10767.0]
  - - [49, 1024, 64, 2048, 49, 49, 49, 2048]
    - [102, 10701.0]
  - - [49, 2048, 32, 1024, 49, 49, 49, 1024]
    - [102, 10622.0]
  - - [49, 1024, 32, 2048, 49, 49, 49, 2048]
    - [127, 10377.0]
  - - [480, 512, 1, 512, 480, 480, 480, 512]
    - [116, 9518.0]
  - - [512, 480, 1, 512, 512, 512, 512, 512]
    - [116, 10663.0]
  - - [512, 512, 1, 512, 512, 512, 512, 512]
    - [116, 11394.0]
  - - [1024, 160, 1, 1024, 1024, 1024, 1024, 1024]
    - [107, 8905.0]
  - - [1024, 200, 1, 1024, 1024, 1024, 1024, 1024]
    - [109, 9611.0]
  - - [1024, 308, 1, 1024, 1024, 1024, 1024, 1024]
    - [116, 11830.0]
  - - [1024, 180, 1, 1024, 1024, 1024, 1024, 1024]
    - [127, 9779.0]
  - - [256, 864, 1, 128, 256, 256, 256, 128]
    - [109, 6939.0]
  - - [3136, 64, 1, 576, 3136, 3136, 3136, 576]
    - [90, 10177.0]
  - - [784, 128, 1, 1152, 784, 784, 784, 1152]
    - [90, 7646.0]
  - - [1024, 128, 1, 1024, 1024, 1024, 1024, 1024]
    - [102, 9334.0]
  - - [1024, 128, 1, 2, 1024, 1024, 1024, 2]
    - [86, 166.0]
  - - [1024, 96, 1, 1024, 1024, 1024, 1024, 1024]
    - [90, 7435.0]
  - - [1024, 96, 1, 2, 1024, 1024, 1024, 2]
    - [86, 124.0]
  - - [49, 2048, 128, 512, 49, 49, 49, 512]
    - [102, 10829.0]
  - - [49, 2048, 256, 512, 49, 49, 49, 512]
    - [97, 11067.0]
  - - [49, 512, 128, 2048, 49, 49, 49, 2048]
    - [127, 10597.0]
  - - [49, 512, 256, 2048, 49, 49, 49, 2048]
    - [113, 10863.0]
  - - [100, 128, 18, 512, 100, 100, 100, 512]
    - [109, 8950.0]
  - - [100, 128, 19, 512, 100, 100, 100, 512]
    - [109, 8494.0]
  - - [1444, 128, 1, 576, 1444, 1444, 1444, 576]
    - [90, 9146.0]
  - - [361, 512, 1, 2304, 361, 361, 361, 2304]
    - [123, 10599.0]
  - - [2560, 35, 1, 29000, 2560, 2560, 2560, 29000]
    - [120, 5177.0]
  - - [2560, 36, 1, 29000, 2560, 2560, 2560, 29000]
    - [120, 5303.0]
  - - [2560, 39, 1, 29000, 2560, 2560, 2560, 29000]
    - [120, 5758.0]
  - - [2560, 40, 1, 29000, 2560, 2560, 2560, 29000]
    - [120, 5896.0]
  - - [2560, 42, 1, 29000, 2560, 2560, 2560, 29000]
    - [120, 6214.0]
  - - [2560, 43, 1, 29000, 2560, 2560, 2560, 29000]
    - [120, 6353.0]
  - - [2560, 44, 1, 29000, 2560, 2560, 2560, 29000]
    - [120, 6500.0]
  - - [2560, 46, 1, 29000, 2560, 2560, 2560, 29000]
    - [120, 6801.0]
  - - [2560, 48, 1, 29000, 2560, 2560, 2560, 29000]
    - [120, 7097.0]
  - - [2560, 49, 1, 29000, 2560, 2560, 2560, 29000]
    - [107, 7217.0]
  - - [2560, 50, 1, 29000, 2560, 2560, 2560, 29000]
    - [120, 7358.0]
  - - [2560, 51, 1, 29000, 2560, 2560, 2560, 29000]
    - [107, 7505.0]
  - - [2560, 53, 1, 29000, 2560, 2560, 2560, 29000]
    - [127, 7795.0]
  - - [2560, 54, 1, 29000, 2560, 2560, 2560, 29000]
    - [107, 7959.0]
  - - [2560, 55, 1, 29000, 2560, 2560, 2560, 29000]
    - [120, 8104.0]
  - - [2560, 56, 1, 29000, 2560, 2560, 2560, 29000]
    - [120, 8262.0]
  - - [2560, 57, 1, 29000, 2560, 2560, 2560, 29000]
    - [120, 8397.0]
  - - [2560, 58, 1, 29000, 2560, 2560, 2560, 29000]
    - [107, 8539.0]
  - - [2560, 59, 1, 29000, 2560, 2560, 2560, 29000]
    - [120, 8713.0]
  - - [2560, 61, 1, 29000, 2560, 2560, 2560, 29000]
    - [113, 8976.0]
  - - [2560, 63, 1, 29000, 2560, 2560, 2560, 29000]
    - [127, 9296.0]
  - - [1909283, 40, 1, 40, 1909283, 1909283, 1909283, 40]
    - [98, 7615.0]
  - - [3818566, 40, 1, 40, 3818566, 3818566, 3818566, 40]
    - [87, 7186.0]
  - - [1760, 32, 1, 1760, 1760, 1760, 1760, 1760]
    - [131, 5645.0]
  - - [7680, 4, 1, 2560, 7680, 7680, 7680, 2560]
    - [136, 2977.0]
  - - [3072, 16, 1, 1024, 3072, 3072, 3072, 1024]
    - [148, 5435.0]
  - - [2048, 16, 1, 2048, 2048, 2048, 2048, 2048]
    - [154, 4516.0]
  - - [3072, 1, 1, 128, 3072, 3072, 3072, 128]
    - [101, 139.0]
  - - [8448, 16, 1, 2816, 8448, 8448, 8448, 2816]
    - [139, 9394.0]
  - - [7680, 2, 1, 2560, 7680, 7680, 7680, 2560]
    - [147, 1495.0]
  - - [4224, 1, 1, 128, 4224, 4224, 4224, 128]
    - [133, 188.0]
  - - [7680, 1, 1, 2560, 7680, 7680, 7680, 2560]
    - [152, 742.0]
  - - [6144, 2, 1, 2560, 6144, 6144, 6144, 2560]
    - [138, 1408.0]
  - - [1760, 16, 1, 1760, 1760, 1760, 1760, 1760]
    - [93, 3884.0]
  - - [6144, 4, 1, 2560, 6144, 6144, 6144, 2560]
    - [138, 2821.0]
  - - [3072, 4, 1, 1024, 3072, 3072, 3072, 1024]
    - [135, 1453.0]
  - - [2048, 32, 1, 2048, 2048, 2048, 2048, 2048]
    - [137, 6998.0]
  - - [4608, 16, 1, 1536, 4608, 4608, 4608, 1536]
    - [139, 7421.0]
  - - [3072, 2, 1, 1024, 3072, 3072, 3072, 1024]
    - [135, 732.0]
  - - [8448, 1, 1, 2816, 8448, 8448, 8448, 2816]
    - [136, 879.0]
  - - [6144, 1, 1, 2560, 6144, 6144, 6144, 2560]
    - [144, 712.0]
  - - [4608, 1, 1, 1536, 4608, 4608, 4608, 1536]
    - [148, 557.0]
  - - [8448, 4, 1, 2816, 8448, 8448, 8448, 2816]
    - [147, 3514.0]
  - - [4608, 2, 1, 1536, 4608, 4608, 4608, 1536]
    - [148, 1116.0]
  - - [2560, 16, 1, 2560, 2560, 2560, 2560, 2560]
    - [138, 5150.0]
  - - [6144, 16, 1, 2560, 6144, 6144, 6144, 2560]
    - [139, 8377.0]
  - - [4096, 16, 1, 4096, 4096, 4096, 4096, 4096]
    - [153, 7342.0]
  - - [7680, 16, 1, 2560, 7680, 7680, 7680, 2560]
    - [139, 8340.0]
  - - [3072, 1, 1, 1024, 3072, 3072, 3072, 1024]
    - [154, 365.0]
  - - [8448, 2, 1, 2816, 8448, 8448, 8448, 2816]
    - [152, 1758.0]
  - - [4608, 4, 1, 1536, 4608, 4608, 4608, 1536]
    - [148, 2226.0]
  - - [2048, 2, 1, 2048, 2048, 2048, 2048, 2048]
    - [138, 577.0]
  - - [2048, 2, 1, 2, 2048, 2048, 2048, 2]
    - [129, 5.0]
  - - [2560, 4, 1, 2, 2560, 2560, 2560, 2]
    - [129, 12.0]
  - - [2560, 4, 1, 2560, 2560, 2560, 2560, 2560]
    - [138, 1447.0]
  - - [2048, 1, 1, 512, 2048, 2048, 2048, 512]
    - [93, 199.0]
  - - [12288, 12, 2, 256, 12288, 12288, 12288, 256]
    - [134, 6789.0]
  - - [12288, 3, 2, 256, 12288, 12288, 12288, 256]
    - [134, 2593.0]
  - - [51520, 12, 2, 256, 51520, 51520, 51520, 256]
    - [142, 8188.0]
  - - [51520, 3, 2, 256, 51520, 51520, 51520, 256]
    - [149, 3325.0]
  - - [15200, 12, 2, 256, 15200, 15200, 15200, 256]
    - [132, 6877.0]
  - - [15200, 3, 2, 256, 15200, 15200, 15200, 256]
    - [130, 2799.0]
  - - [3456, 3, 2, 256, 3456, 3456, 3456, 256]
    - [138, 1282.0]
  - - [13600, 12, 2, 256, 13600, 13600, 13600, 256]
    - [132, 6952.0]
  - - [12880, 3, 2, 256, 12880, 12880, 12880, 256]
    - [130, 2659.0]
  - - [3400, 3, 2, 256, 3400, 3400, 3400, 256]
    - [151, 1249.0]
  - - [12880, 12, 2, 256, 12880, 12880, 12880, 256]
    - [132, 6661.0]
  - - [13824, 12, 2, 256, 13824, 13824, 13824, 256]
    - [132, 7113.0]
  - - [13824, 3, 2, 256, 13824, 13824, 13824, 256]
    - [130, 2839.0]
  - - [13600, 3, 2, 256, 13600, 13600, 13600, 256]
    - [130, 2823.0]
  - - [3456, 12, 2, 256, 3456, 3456, 3456, 256]
    - [148, 4247.0]
  - - [3800, 3, 2, 256, 3800, 3800, 3800, 256]
    - [145, 1383.0]
  - - [3400, 12, 2, 256, 3400, 3400, 3400, 256]
    - [133, 4145.0]
  - - [3800, 12, 2, 256, 3800, 3800, 3800, 256]
    - [132, 4405.0]
  - - [55296, 3, 2, 256, 55296, 55296, 55296, 256]
    - [134, 3254.0]
  - - [3072, 3, 2, 256, 3072, 3072, 3072, 256]
    - [131, 1168.0]
  - - [3072, 12, 2, 256, 3072, 3072, 3072, 256]
    - [132, 3949.0]
  - - [54400, 3, 2, 256, 54400, 54400, 54400, 256]
    - [143, 3377.0]
  - - [60800, 12, 2, 256, 60800, 60800, 60800, 256]
    - [146, 8217.0]
  - - [60800, 3, 2, 256, 60800, 60800, 60800, 256]
    - [141, 3454.0]
  - - [3220, 3, 2, 256, 3220, 3220, 3220, 256]
    - [131, 1200.0]
  - - [3220, 12, 2, 256, 3220, 3220, 3220, 256]
    - [132, 4139.0]
  - - [2048, 8, 1, 2, 2048, 2048, 2048, 2]
    - [129, 20.0]
  - - [2048, 8, 1, 2048, 2048, 2048, 2048, 2048]
    - [138, 2321.0]
  - - [2560, 2, 1, 2, 2560, 2560, 2560, 2]
    - [129, 6.0]
  - - [2560, 2, 1, 2560, 2560, 2560, 2560, 2560]
    - [148, 723.0]
  - - [2560, 27, 1, 29000, 2560, 2560, 2560, 29000]
    - [139, 6258.0]
  - - [1909283, 11, 1, 11, 1909283, 1909283, 1909283, 11]
    - [150, 4021.0]
  - - [3818566, 11, 1, 11, 3818566, 3818566, 3818566, 11]
    - [140, 3169.0]
  - - [512, 16, 1, 500000, 512, 512, 512, 500000]
    - [160, 3924.0]
  - - [512, 2, 1, 500000, 512, 512, 512, 500000]
    - [157, 490.0]
  - - [1024, 16, 1, 500000, 1024, 1024, 1024, 500000]
    - [158, 4912.0]
  - - [1024, 4, 1, 500000, 1024, 1024, 1024, 500000]
    - [158, 1209.0]
  - - [512, 8, 1, 500000, 512, 512, 512, 500000]
    - [157, 1966.0]
  - - [512, 1, 1, 500000, 512, 512, 512, 500000]
    - [155, 244.0]
  - - [512, 4, 1, 500000, 512, 512, 512, 500000]
    - [157, 980.0]
  - - [1024, 1, 1, 500000, 1024, 1024, 1024, 500000]
    - [155, 299.0]
  - - [1024, 2, 1, 500000, 1024, 1024, 1024, 500000]
    - [156, 601.0]
  - - [1024, 8, 1, 500000, 1024, 1024, 1024, 500000]
    - [160, 2410.0]
  - - [49, 512, 1, 4608, 49, 49, 49, 4608]
    - [159, 4392.0]
  - - [448, 64, 1, 1280, 448, 448, 448, 1280]
    - [93, 3482.0]
  - - [64, 1024, 1, 1280, 64, 64, 64, 1280]
    - [89, 6214.0]
  - - [64, 704, 1, 1280, 64, 64, 64, 1280]
    - [101, 5158.0]
  - - [256, 128, 1, 256, 256, 256, 256, 256]
    - [99, 2542.0]
  - - [64, 1024, 1, 3328, 64, 64, 64, 3328]
    - [89, 6649.0]
  - - [1024, 64, 1, 1280, 1024, 1024, 1024, 1280]
    - [106, 6195.0]
  - - [256, 256, 1, 3328, 256, 256, 256, 3328]
    - [89, 6633.0]
  - - [64, 448, 1, 1280, 64, 64, 64, 1280]
    - [93, 3784.0]
  - - [64, 64, 1, 3328, 64, 64, 64, 3328]
    - [103, 677.0]
  - - [704, 64, 1, 3328, 704, 704, 704, 3328]
    - [108, 5153.0]
  - - [64, 128, 1, 256, 64, 64, 64, 256]
    - [101, 677.0]
  - - [704, 64, 1, 1280, 704, 704, 704, 1280]
    - [101, 4946.0]
  - - [128, 448, 1, 256, 128, 128, 128, 256]
    - [89, 3904.0]
  - - [448, 64, 1, 3328, 448, 448, 448, 3328]
    - [93, 4248.0]
  - - [64, 128, 1, 3328, 64, 64, 64, 3328]
    - [114, 1348.0]
  - - [128, 128, 1, 3328, 128, 128, 128, 3328]
    - [103, 2697.0]
  - - [256, 256, 1, 256, 256, 256, 256, 256]
    - [89, 4438.0]
  - - [128, 64, 1, 1280, 128, 128, 128, 1280]
    - [103, 1178.0]
  - - [64, 1024, 1, 256, 64, 64, 64, 256]
    - [89, 4392.0]
  - - [64, 704, 1, 256, 64, 64, 64, 256]
    - [101, 3392.0]
  - - [1, 1, 1, 1280, 1, 1, 1, 1280]
    - [86, 0.09]
  - - [256, 64, 1, 3328, 256, 256, 256, 3328]
    - [108, 2705.0]
  - - [448, 128, 1, 256, 448, 448, 448, 256]
    - [89, 3946.0]
  - - [64, 704, 1, 3328, 64, 64, 64, 3328]
    - [112, 5767.0]
  - - [64, 448, 1, 3328, 64, 64, 64, 3328]
    - [108, 4226.0]
  - - [448, 128, 1, 3328, 448, 448, 448, 3328]
    - [89, 5833.0]
  - - [128, 256, 1, 1280, 128, 128, 128, 1280]
    - [108, 4297.0]
  - - [64, 448, 1, 256, 64, 64, 64, 256]
    - [112, 2308.0]
  - - [64, 256, 1, 1280, 64, 64, 64, 1280]
    - [103, 2346.0]
  - - [64, 128, 1, 1280, 64, 64, 64, 1280]
    - [103, 1181.0]
  - - [64, 64, 1, 256, 64, 64, 64, 256]
    - [101, 338.0]
  - - [256, 128, 1, 1280, 256, 256, 256, 1280]
    - [108, 4306.0]
  - - [128, 256, 1, 3328, 128, 128, 128, 3328]
    - [93, 4855.0]
  - - [256, 64, 1, 256, 256, 256, 256, 256]
    - [99, 1344.0]
  - - [128, 128, 1, 1280, 128, 128, 128, 1280]
    - [103, 2341.0]
  - - [128, 256, 1, 256, 128, 128, 128, 256]
    - [99, 2558.0]
  - - [256, 64, 1, 1280, 256, 256, 256, 1280]
    - [122, 2356.0]
  - - [704, 64, 1, 256, 704, 704, 704, 256]
    - [101, 3373.0]
  - - [128, 448, 1, 1280, 128, 128, 128, 1280]
    - [89, 5478.0]
  - - [64, 64, 1, 1280, 64, 64, 64, 1280]
    - [103, 584.0]
  - - [128, 64, 1, 3328, 128, 128, 128, 3328]
    - [93, 1343.0]
  - - [448, 64, 1, 256, 448, 448, 448, 256]
    - [101, 2252.0]
  - - [1024, 64, 1, 256, 1024, 1024, 1024, 256]
    - [89, 4415.0]
  - - [1, 1, 1, 1, 1, 1, 1, 1]
    - [110, 0.0005952380999633429]
  - - [448, 128, 1, 1280, 448, 448, 448, 1280]
    - [89, 5494.0]
  - - [1024, 64, 1, 3328, 1024, 1024, 1024, 3328]
    - [119, 6605.0]
  - - [128, 64, 1, 256, 128, 128, 128, 256]
    - [99, 677.0]
  - - [64, 256, 1, 3328, 64, 64, 64, 3328]
    - [114, 2694.0]
  - - [256, 256, 1, 1280, 256, 256, 256, 1280]
    - [89, 6186.0]
  - - [256, 128, 1, 3328, 256, 256, 256, 3328]
    - [93, 4860.0]
  - - [64, 256, 1, 256, 64, 64, 64, 256]
    - [101, 1344.0]
  - - [1, 1, 1, 256, 1, 1, 1, 256]
    - [86, 0.06]
  - - [128, 448, 1, 3328, 128, 128, 128, 3328]
    - [106, 5840.0]
  - - [128, 128, 1, 256, 128, 128, 128, 256]
    - [99, 1344.0]
  - - [1024, 16, 1, 512, 1024, 1024, 1024, 512]
    - [93, 1777.0]
  - - [512, 16, 1, 512, 512, 512, 512, 512]
    - [108, 889.0]
  - - [128, 1, 1, 1408, 128, 128, 128, 1408]
    - [92, 17.0]
  - - [64, 1, 1, 1216, 64, 64, 64, 1216]
    - [92, 9.0]
  - - [1024, 2, 1, 512, 1024, 1024, 1024, 512]
    - [93, 210.0]
  - - [512, 1, 1, 512, 512, 512, 512, 512]
    - [92, 52.0]
  - - [1024, 4, 1, 512, 1024, 1024, 1024, 512]
    - [93, 421.0]
  - - [512, 4, 1, 512, 512, 512, 512, 512]
    - [92, 206.0]
  - - [1024, 32, 1, 512, 1024, 1024, 1024, 512]
    - [108, 3355.0]
  - - [512, 2, 1, 512, 512, 512, 512, 512]
    - [92, 104.0]
  - - [1024, 1, 1, 512, 1024, 1024, 1024, 512]
    - [93, 104.0]
  - - [512, 32, 1, 512, 512, 512, 512, 512]
    - [108, 1770.0]
  - - [128, 1, 1, 1024, 128, 128, 128, 1024]
    - [103, 17.0]
  - - [64, 14, 1, 14, 64, 64, 64, 14]
    - [121, 8.0]
  - - [64, 14, 1, 15, 64, 64, 64, 15]
    - [88, 7.0]
  - - [64, 15, 1, 15, 64, 64, 64, 15]
    - [91, 9.0]
  - - [64, 15, 1, 17, 64, 64, 64, 17]
    - [83, 9.0]
  - - [64, 17, 1, 17, 64, 64, 64, 17]
    - [86, 12.0]
  - - [64, 17, 1, 21, 64, 64, 64, 21]
    - [83, 12.0]
  - - [64, 21, 1, 21, 64, 64, 64, 21]
    - [83, 15.0]
  - - [64, 24, 1, 24, 64, 64, 64, 24]
    - [86, 19.0]
  - - [64, 24, 1, 34, 64, 64, 64, 34]
    - [88, 25.0]
  - - [64, 30, 1, 30, 64, 64, 64, 30]
    - [83, 28.0]
  - - [64, 31, 1, 30, 64, 64, 64, 30]
    - [83, 29.0]
  - - [64, 31, 1, 31, 64, 64, 64, 31]
    - [83, 30.0]
  - - [64, 32, 1, 32, 64, 64, 64, 32]
    - [88, 39.0]
  - - [64, 34, 1, 34, 64, 64, 64, 34]
    - [92, 39.0]
  - - [64, 35, 1, 32, 64, 64, 64, 32]
    - [91, 35.0]
  - - [64, 35, 1, 35, 64, 64, 64, 35]
    - [88, 37.0]
  - - [64, 512, 1, 512, 64, 64, 64, 512]
    - [112, 3369.0]
  - - [1024, 4, 1, 2, 1024, 1024, 1024, 2]
    - [83, 5.0]
  - - [1024, 4, 1, 1024, 1024, 1024, 1024, 1024]
    - [93, 541.0]
  - - [1024, 32, 1, 2, 1024, 1024, 1024, 2]
    - [86, 42.0]
  - - [1024, 32, 1, 1024, 1024, 1024, 1024, 1024]
    - [108, 4092.0]
  - - [32, 200, 1, 1, 32, 32, 32, 1]
    - [83, 4.0]
  - - [64, 3, 512, 3, 64, 64, 64, 3]
    - [115, 121.0]
  - - [64, 5, 512, 5, 64, 64, 64, 5]
    - [115, 318.0]
  - - [64, 5, 960, 5, 64, 64, 64, 5]
    - [115, 413.0]
  - - [64, 9, 512, 9, 64, 64, 64, 9]
    - [104, 969.0]
  - - [64, 512, 1, 1, 64, 64, 64, 1]
    - [118, 21.0]
  - - [67, 512, 1, 2048, 67, 67, 67, 2048]
    - [126, 4187.0]
  - - [74, 512, 1, 2048, 74, 74, 74, 2048]
    - [126, 4635.0]
  - - [74, 960, 1, 2048, 74, 74, 74, 2048]
    - [102, 5674.0]
  - - [100, 512, 1, 2048, 100, 100, 100, 2048]
    - [101, 5022.0]
  - - [128, 27, 32768, 27, 128, 128, 128, 27]
    - [94, 4539.0]
  - - [64, 14, 10880, 14, 64, 64, 64, 14]
    - [97, 4360.0]
  - - [64, 14, 10880, 15, 64, 64, 64, 15]
    - [97, 4561.0]
  - - [64, 15, 7680, 15, 64, 64, 64, 15]
    - [97, 4742.0]
  - - [64, 15, 10880, 15, 64, 64, 64, 15]
    - [97, 4884.0]
  - - [64, 15, 7680, 17, 64, 64, 64, 17]
    - [109, 5222.0]
  - - [64, 17, 6144, 17, 64, 64, 64, 17]
    - [109, 5780.0]
  - - [64, 17, 7680, 17, 64, 64, 64, 17]
    - [109, 5943.0]
  - - [64, 17, 6144, 21, 64, 64, 64, 21]
    - [85, 6256.0]
  - - [64, 21, 6144, 21, 64, 64, 64, 21]
    - [109, 7592.0]
  - - [64, 24, 4736, 24, 64, 64, 64, 24]
    - [109, 9646.0]
  - - [64, 24, 4736, 34, 64, 64, 64, 34]
    - [85, 10128.0]
  - - [64, 30, 2048, 30, 64, 64, 64, 30]
    - [85, 10134.0]
  - - [64, 31, 2048, 30, 64, 64, 64, 30]
    - [85, 10365.0]
  - - [64, 31, 2048, 31, 64, 64, 64, 31]
    - [104, 10497.0]
  - - [64, 27, 1920, 27, 64, 64, 64, 27]
    - [109, 8613.0]
  - - [1024, 8, 1, 1024, 1024, 1024, 1024, 1024]
    - [103, 1006.0]
  - - [1024, 77, 1, 1024, 1024, 1024, 1024, 1024]
    - [89, 5928.0]
  - - [1024, 10, 1, 2, 1024, 1024, 1024, 2]
    - [84, 12.0]
  - - [1024, 10, 1, 1024, 1024, 1024, 1024, 1024]
    - [103, 1337.0]
  - - [1024, 39, 1, 2, 1024, 1024, 1024, 2]
    - [86, 49.0]
  - - [1024, 39, 1, 1024, 1024, 1024, 1024, 1024]
    - [108, 4033.0]
  - - [1024, 40, 1, 2, 1024, 1024, 1024, 2]
    - [86, 51.0]
  - - [1024, 40, 1, 1024, 1024, 1024, 1024, 1024]
    - [108, 4136.0]
  - - [1024, 41, 1, 2, 1024, 1024, 1024, 2]
    - [96, 52.0]
  - - [1024, 41, 1, 1024, 1024, 1024, 1024, 1024]
    - [122, 4231.0]
  - - [1024, 5, 1, 2, 1024, 1024, 1024, 2]
    - [83, 6.0]
  - - [1024, 5, 1, 1024, 1024, 1024, 1024, 1024]
    - [93, 672.0]
  - - [1024, 6, 1, 2, 1024, 1024, 1024, 2]
    - [86, 8.0]
  - - [1024, 6, 1, 1024, 1024, 1024, 1024, 1024]
    - [93, 807.0]
  - - [1024, 8, 1, 2, 1024, 1024, 1024, 2]
    - [86, 10.0]
  - - [1024, 9, 1, 2, 1024, 1024, 1024, 2]
    - [84, 11.0]
  - - [1024, 9, 1, 1024, 1024, 1024, 1024, 1024]
    - [93, 1204.0]
  - - [64, 4, 32768, 4, 64, 64, 64, 4]
    - [85, 531.0]
  - - [64, 4, 38400, 4, 64, 64, 64, 4]
    - [85, 532.0]
  - - [128, 128, 1, 64, 128, 128, 128, 64]
    - [89, 541.0]
  - - [64, 128, 1, 128, 64, 64, 64, 128]
    - [101, 441.0]
  - - [64, 5, 1, 5, 64, 64, 64, 5]
    - [83, 1.0]
  - - [32, 33, 1, 33, 32, 32, 32, 33]
    - [86, 19.0]
  - - [1024, 16, 1, 2, 1024, 1024, 1024, 2]
    - [86, 23.0]
  - - [1024, 16, 1, 1024, 1024, 1024, 1024, 1024]
    - [93, 2213.0]
  - - [1024, 1, 1, 2, 1024, 1024, 1024, 2]
    - [83, 1.0]
  - - [1024, 1, 1, 1024, 1024, 1024, 1024, 1024]
    - [93, 135.0]
  - - [1024, 1, 1, 200, 1024, 1024, 1024, 200]
    - [101, 63.0]
  - - [1024, 1, 1, 1600, 1024, 1024, 1024, 1600]
    - [93, 148.0]
  - - [1024, 64, 1, 2, 1024, 1024, 1024, 2]
    - [124, 83.0]
  - - [1024, 64, 1, 1024, 1024, 1024, 1024, 1024]
    - [89, 6035.0]
  - - [1024, 80, 1, 1024, 1024, 1024, 1024, 1024]
    - [89, 6223.0]
  - - [1024, 80, 1, 2, 1024, 1024, 1024, 2]
    - [124, 102.0]
  - - [1024, 82, 1, 1024, 1024, 1024, 1024, 1024]
    - [90, 6168.0]
  - - [1024, 82, 1, 2, 1024, 1024, 1024, 2]
    - [110, 105.0]
  - - [1024, 12, 1, 1024, 1024, 1024, 1024, 1024]
    - [93, 1605.0]
  - - [1024, 12, 1, 2, 1024, 1024, 1024, 2]
    - [86, 15.0]
  - - [64, 24, 6816, 24, 64, 64, 64, 24]
    - [97, 10298.0]
  - - [64, 26, 6272, 26, 64, 64, 64, 26]
    - [116, 10583.0]
  - - [196, 256, 1, 2304, 196, 196, 196, 2304]
    - [125, 5422.0]
  - - [768, 3, 2, 256, 768, 768, 768, 256]
    - [99, 330.0]
  - - [768, 12, 2, 256, 768, 768, 768, 256]
    - [99, 1311.0]
  - - [864, 12, 2, 256, 864, 864, 864, 256]
    - [93, 1450.0]
  - - [864, 3, 2, 256, 864, 864, 864, 256]
    - [93, 365.0]
  - - [216, 3, 2, 256, 216, 216, 216, 256]
    - [101, 94.0]
  - - [176, 12, 2, 256, 176, 176, 176, 256]
    - [111, 302.0]
  - - [176, 3, 2, 256, 176, 176, 176, 256]
    - [99, 76.0]
  - - [192, 12, 2, 256, 192, 192, 192, 256]
    - [125, 341.0]
  - - [192, 3, 2, 256, 192, 192, 192, 256]
    - [99, 85.0]
  - - [216, 12, 2, 256, 216, 216, 216, 256]
    - [101, 375.0]
  - - [850, 3, 2, 256, 850, 850, 850, 256]
    - [101, 361.0]
  - - [850, 12, 2, 256, 850, 850, 850, 256]
    - [101, 1435.0]
  - - [805, 12, 2, 256, 805, 805, 805, 256]
    - [93, 1359.0]
  - - [805, 3, 2, 256, 805, 805, 805, 256]
    - [93, 340.0]
  - - [247, 3, 2, 256, 247, 247, 247, 256]
    - [99, 108.0]
  - - [950, 3, 2, 256, 950, 950, 950, 256]
    - [93, 399.0]
  - - [187, 12, 2, 256, 187, 187, 187, 256]
    - [99, 325.0]
  - - [247, 12, 2, 256, 247, 247, 247, 256]
    - [125, 436.0]
  - - [187, 3, 2, 256, 187, 187, 187, 256]
    - [99, 81.0]
  - - [228, 12, 2, 256, 228, 228, 228, 256]
    - [125, 398.0]
  - - [221, 12, 2, 256, 221, 221, 221, 256]
    - [101, 388.0]
  - - [950, 12, 2, 256, 950, 950, 950, 256]
    - [93, 1586.0]
  - - [228, 3, 2, 256, 228, 228, 228, 256]
    - [99, 99.0]
  - - [221, 3, 2, 256, 221, 221, 221, 256]
    - [101, 96.0]
  - - [25, 128, 120, 256, 25, 25, 25, 256]
    - [100, 6502.0]
  - - [25, 128, 139, 256, 25, 25, 25, 256]
    - [100, 6605.0]
  - - [25, 128, 160, 256, 25, 25, 25, 256]
    - [100, 6620.0]
  - - [25, 128, 18, 256, 25, 25, 25, 256]
    - [101, 3461.0]
  - - [25, 128, 19, 256, 25, 25, 25, 256]
    - [89, 3369.0]
  - - [9, 128, 120, 256, 9, 9, 9, 256]
    - [111, 2873.0]
  - - [9, 128, 139, 256, 9, 9, 9, 256]
    - [99, 2655.0]
  - - [9, 128, 160, 256, 9, 9, 9, 256]
    - [111, 2737.0]
  - - [9, 128, 18, 256, 9, 9, 9, 256]
    - [99, 1382.0]
  - - [9, 128, 19, 256, 9, 9, 9, 256]
    - [125, 1467.0]
  - - [100, 512, 1, 2304, 100, 100, 100, 2304]
    - [89, 5120.0]
  - - [25, 256, 1, 1152, 25, 25, 25, 1152]
    - [128, 853.0]
  - - [9, 256, 1, 1152, 9, 9, 9, 1152]
    - [93, 307.0]
  - - [1024, 20, 1, 1024, 1024, 1024, 1024, 1024]
    - [108, 2497.0]
  - - [1024, 20, 1, 2, 1024, 1024, 1024, 2]
    - [86, 25.0]
- null
