library/src/blas3/Tensile/Logic/asm_full/navi22_Cijk_Alik_Bljk_HBH_GB.yaml
---
- {MinimumRequiredVersion: 4.28.0}
- navi22
- gfx1031
    SolutionIndex: 0
    SolutionNameMin: Cijk_Alik_Bljk_HBH_GB_MT128x64x8_SN_SU0_SUM0_TT8_8_WG16_8_1_WGM1
    SolutionIndex: 1
    SolutionNameMin: Cijk_Alik_Bljk_HBH_GB_MT128x128x8_SN_SU0_SUM0_TT8_16_WG16_8_1_WGM1
    SolutionIndex: 2
    SolutionNameMin: Cijk_Alik_Bljk_HBH_GB_MT128x128x8_SN_SU0_SUM0_TT8_8_WG16_16_1_WGM1
    SolutionIndex: 3
    SolutionNameMin: Cijk_Alik_Bljk_HBH_GB_MT128x256x8_SN_SU0_SUM0_TT8_16_WG16_16_1_WGM1
    SolutionIndex: 4
    SolutionNameMin: Cijk_Alik_Bljk_HBH_GB_MT128x64x16_SN_SU0_SUM0_TT8_8_WG16_8_1_WGM1
    SolutionIndex: 5
    SolutionNameMin: Cijk_Alik_Bljk_HBH_GB_MT128x128x16_SN_SU0_SUM0_TT8_16_WG16_8_1_WGM1
    SolutionIndex: 6
    SolutionNameMin: Cijk_Alik_Bljk_HBH_GB_MT128x128x16_SN_SU0_SUM0_TT8_8_WG16_16_1_WGM1
    SolutionIndex: 7
    SolutionNameMin: Cijk_Alik_Bljk_HBH_GB_MT128x256x16_SN_SU0_SUM0_TT8_16_WG16_16_1_WGM1
    SolutionIndex: 8
    SolutionNameMin: Cijk_Alik_Bljk_HBH_GB_MT128x64x8_SN_SU32_SUM3_TT8_8_WG16_8_1_WGM1
    SolutionIndex: 9
    SolutionNameMin: Cijk_Alik_Bljk_HBH_GB_MT128x128x8_SN_SU32_SUM3_TT8_16_WG16_8_1_WGM1
    SolutionIndex: 10
    SolutionNameMin: Cijk_Alik_Bljk_HBH_GB_MT128x128x8_SN_SU32_SUM3_TT8_8_WG16_16_1_WGM1
    SolutionIndex: 11
    SolutionNameMin: Cijk_Alik_Bljk_HBH_GB_MT128x64x16_SN_SU32_SUM3_TT8_8_WG16_8_1_WGM1
    SolutionIndex: 12
    SolutionNameMin: Cijk_Alik_Bljk_HBH_GB_MT128x128x16_SN_SU32_SUM3_TT8_16_WG16_8_1_WGM1
    SolutionIndex: 13
    SolutionNameMin: Cijk_Alik_Bljk_HBH_GB_MT128x128x16_SN_SU32_SUM3_TT8_8_WG16_16_1_WGM1
    SolutionIndex: 14
    SolutionNameMin: Cijk_Alik_Bljk_HBH_GB_MT128x256x16_SN_SU32_SUM3_TT8_16_WG16_16_1_WGM1
    SolutionIndex: 15
    SolutionNameMin: Cijk_Alik_Bljk_HBH_GB_MT128x128x32_SN_SU32_SUM3_TT8_16_WG16_8_1_WGM1
    SolutionIndex: 16
    SolutionNameMin: Cijk_Alik_Bljk_HBH_GB_MT128x256x32_SN_SU32_SUM3_TT8_16_WG16_16_1_WGM1
    SolutionIndex: 17
    SolutionNameMin: Cijk_Alik_Bljk_HBH_GB_MT128x64x8_SN_SU0_SUM0_TT8_8_WG16_8_1_WGM4
    SolutionIndex: 18
    SolutionNameMin: Cijk_Alik_Bljk_HBH_GB_MT128x128x8_SN_SU0_SUM0_TT8_16_WG16_8_1_WGM4
    SolutionIndex: 19
    SolutionNameMin: Cijk_Alik_Bljk_HBH_GB_MT128x128x8_SN_SU0_SUM0_TT8_8_WG16_16_1_WGM4
    SolutionIndex: 20
    SolutionNameMin: Cijk_Alik_Bljk_HBH_GB_MT128x256x8_SN_SU0_SUM0_TT8_16_WG16_16_1_WGM4
    SolutionIndex: 21
    SolutionNameMin: Cijk_Alik_Bljk_HBH_GB_MT128x64x16_SN_SU0_SUM0_TT8_8_WG16_8_1_WGM4
    SolutionIndex: 22
    SolutionNameMin: Cijk_Alik_Bljk_HBH_GB_MT128x128x16_SN_SU0_SUM0_TT8_16_WG16_8_1_WGM4
    SolutionIndex: 23
    SolutionNameMin: Cijk_Alik_Bljk_HBH_GB_MT128x128x16_SN_SU0_SUM0_TT8_8_WG16_16_1_WGM4
    SolutionIndex: 24
    SolutionNameMin: Cijk_Alik_Bljk_HBH_GB_MT128x256x16_SN_SU0_SUM0_TT8_16_WG16_16_1_WGM4
    SolutionIndex: 25
    SolutionNameMin: Cijk_Alik_Bljk_HBH_GB_MT128x128x32_SN_SU0_SUM0_TT8_8_WG16_16_1_WGM4
    SolutionIndex: 26
    SolutionNameMin: Cijk_Alik_Bljk_HBH_GB_MT128x64x8_SN_SU32_SUM3_TT8_8_WG16_8_1_WGM4
    SolutionIndex: 27
    SolutionNameMin: Cijk_Alik_Bljk_HBH_GB_MT128x128x8_SN_SU32_SUM3_TT8_8_WG16_16_1_WGM4
    SolutionIndex: 28
    SolutionNameMin: Cijk_Alik_Bljk_HBH_GB_MT128x256x8_SN_SU32_SUM3_TT8_16_WG16_16_1_WGM4
    SolutionIndex: 29
    SolutionNameMin: Cijk_Alik_Bljk_HBH_GB_MT128x64x16_SN_SU32_SUM3_TT8_8_WG16_8_1_WGM4
    SolutionIndex: 30
    SolutionNameMin: Cijk_Alik_Bljk_HBH_GB_MT128x128x16_SN_SU32_SUM3_TT8_16_WG16_8_1_WGM4
    SolutionIndex: 31
    SolutionNameMin: Cijk_Alik_Bljk_HBH_GB_MT128x128x16_SN_SU32_SUM3_TT8_8_WG16_16_1_WGM4
    SolutionIndex: 32
    SolutionNameMin: Cijk_Alik_Bljk_HBH_GB_MT128x256x16_SN_SU32_SUM3_TT8_16_WG16_16_1_WGM4
    SolutionIndex: 33
    SolutionNameMin: Cijk_Alik_Bljk_HBH_GB_MT128x256x32_SN_SU32_SUM3_TT8_16_WG16_16_1_WGM4
    SolutionIndex: 34
    SolutionNameMin: Cijk_Alik_Bljk_HBH_GB_MT128x64x8_SN_SU0_SUM0_TT8_8_WG16_8_1_WGM8
    SolutionIndex: 35
    SolutionNameMin: Cijk_Alik_Bljk_HBH_GB_MT128x128x8_SN_SU0_SUM0_TT8_16_WG16_8_1_WGM8
    SolutionIndex: 36
    SolutionNameMin: Cijk_Alik_Bljk_HBH_GB_MT128x128x8_SN_SU0_SUM0_TT8_8_WG16_16_1_WGM8
    SolutionIndex: 37
    SolutionNameMin: Cijk_Alik_Bljk_HBH_GB_MT128x64x16_SN_SU0_SUM0_TT8_8_WG16_8_1_WGM8
    SolutionIndex: 38
    SolutionNameMin: Cijk_Alik_Bljk_HBH_GB_MT128x128x16_SN_SU0_SUM0_TT8_16_WG16_8_1_WGM8
    SolutionIndex: 39
    SolutionNameMin: Cijk_Alik_Bljk_HBH_GB_MT128x128x16_SN_SU0_SUM0_TT8_8_WG16_16_1_WGM8
    SolutionIndex: 40
    SolutionNameMin: Cijk_Alik_Bljk_HBH_GB_MT128x256x16_SN_SU0_SUM0_TT8_16_WG16_16_1_WGM8
    SolutionIndex: 41
    SolutionNameMin: Cijk_Alik_Bljk_HBH_GB_MT128x64x8_SN_SU32_SUM3_TT8_8_WG16_8_1_WGM8
    SolutionIndex: 42
    SolutionNameMin: Cijk_Alik_Bljk_HBH_GB_MT128x128x8_SN_SU32_SUM3_TT8_16_WG16_8_1_WGM8
    SolutionIndex: 43
    SolutionNameMin: Cijk_Alik_Bljk_HBH_GB_MT128x128x8_SN_SU32_SUM3_TT8_8_WG16_16_1_WGM8
    SolutionIndex: 44
    SolutionNameMin: Cijk_Alik_Bljk_HBH_GB_MT128x256x8_SN_SU32_SUM3_TT8_16_WG16_16_1_WGM8
    SolutionIndex: 45
    SolutionNameMin: Cijk_Alik_Bljk_HBH_GB_MT128x64x16_SN_SU32_SUM3_TT8_8_WG16_8_1_WGM8
    SolutionIndex: 46
    SolutionNameMin: Cijk_Alik_Bljk_HBH_GB_MT128x128x16_SN_SU32_SUM3_TT8_16_WG16_8_1_WGM8
    SolutionIndex: 47
    SolutionNameMin: Cijk_Alik_Bljk_HBH_GB_MT128x128x16_SN_SU32_SUM3_TT8_8_WG16_16_1_WGM8
    SolutionIndex: 48
    SolutionNameMin: Cijk_Alik_Bljk_HBH_GB_MT128x256x16_SN_SU32_SUM3_TT8_16_WG16_16_1_WGM8
    SolutionIndex: 49
    SolutionNameMin: Cijk_Alik_Bljk_HBH_GB_MT128x128x32_SN_SU32_SUM3_TT8_16_WG16_8_1_WGM8
    SolutionIndex: 50
    SolutionNameMin: Cijk_Alik_Bljk_HBH_GB_MT128x128x32_SN_SU32_SUM3_TT8_8_WG16_16_1_WGM8
    SolutionIndex: 51
    SolutionNameMin: Cijk_Alik_Bljk_HBH_GB_MT128x256x32_SN_SU32_SUM3_TT8_16_WG16_16_1_WGM8
    SolutionIndex: 52
    SolutionNameMin: Cijk_Alik_Bljk_HBH_GB_MT128x256x16_SN_SU0_SUM0_TT8_16_WG16_16_1_WGM1
    SolutionIndex: 53
    SolutionNameMin: Cijk_Alik_Bljk_HBH_GB_MT128x256x16_SN_SU32_SUM3_TT8_16_WG16_16_1_WGM1
    SolutionIndex: 54
    SolutionNameMin: Cijk_Alik_Bljk_HBH_GB_MT128x128x32_SN_SU32_SUM3_TT8_8_WG16_16_1_WGM1
    SolutionIndex: 55
    SolutionNameMin: Cijk_Alik_Bljk_HBH_GB_MT128x128x16_SN_SU0_SUM0_TT8_16_WG16_8_1_WGM4
    SolutionIndex: 56
    SolutionNameMin: Cijk_Alik_Bljk_HBH_GB_MT128x128x32_SN_SU32_SUM3_TT8_16_WG16_8_1_WGM4
    SolutionIndex: 57
    SolutionNameMin: Cijk_Alik_Bljk_HBH_GB_MT128x128x32_SN_SU32_SUM3_TT8_16_WG16_8_1_WGM8
    SolutionIndex: 58
    SolutionNameMin: Cijk_Alik_Bljk_HBH_GB_MT64x64x8_SN_SU0_SUM0_TT8_8_WG8_8_1_WGM1
    SolutionIndex: 59
    SolutionNameMin: Cijk_Alik_Bljk_HBH_GB_MT128x64x8_SN_SU0_SUM0_TT8_8_WG16_8_1_WGM1
    SolutionIndex: 60
    SolutionNameMin: Cijk_Alik_Bljk_HBH_GB_MT128x128x8_SN_SU0_SUM0_TT8_8_WG16_16_1_WGM1
    SolutionIndex: 61
    SolutionNameMin: Cijk_Alik_Bljk_HBH_GB_MT64x64x16_SN_SU0_SUM0_TT8_8_WG8_8_1_WGM1
    SolutionIndex: 62
    SolutionNameMin: Cijk_Alik_Bljk_HBH_GB_MT128x64x16_SN_SU0_SUM0_TT8_8_WG16_8_1_WGM1
    SolutionIndex: 63
    SolutionNameMin: Cijk_Alik_Bljk_HBH_GB_MT128x128x16_SN_SU0_SUM0_TT8_8_WG16_16_1_WGM1
    SolutionIndex: 64
    SolutionNameMin: Cijk_Alik_Bljk_HBH_GB_MT64x64x32_SN_SU0_SUM0_TT8_8_WG8_8_1_WGM1
    SolutionIndex: 65
    SolutionNameMin: Cijk_Alik_Bljk_HBH_GB_MT64x64x8_SN_SU32_SUM3_TT8_8_WG8_8_1_WGM1
    SolutionIndex: 66
    SolutionNameMin: Cijk_Alik_Bljk_HBH_GB_MT128x64x8_SN_SU32_SUM3_TT8_8_WG16_8_1_WGM1
    SolutionIndex: 67
    SolutionNameMin: Cijk_Alik_Bljk_HBH_GB_MT64x64x16_SN_SU32_SUM3_TT8_8_WG8_8_1_WGM1
    SolutionIndex: 68
    SolutionNameMin: Cijk_Alik_Bljk_HBH_GB_MT128x64x16_SN_SU32_SUM3_TT8_8_WG16_8_1_WGM1
    SolutionIndex: 69
    SolutionNameMin: Cijk_Alik_Bljk_HBH_GB_MT128x128x16_SN_SU32_SUM3_TT8_8_WG16_16_1_WGM1
    SolutionIndex: 70
    SolutionNameMin: Cijk_Alik_Bljk_HBH_GB_MT64x64x32_SN_SU32_SUM3_TT8_8_WG8_8_1_WGM1
    SolutionIndex: 71
    SolutionNameMin: Cijk_Alik_Bljk_HBH_GB_MT128x64x32_SN_SU32_SUM3_TT8_8_WG16_8_1_WGM1
    SolutionIndex: 72
    SolutionNameMin: Cijk_Alik_Bljk_HBH_GB_MT64x64x8_SN_SU0_SUM0_TT8_8_WG8_8_1_WGM4
    SolutionIndex: 73
    SolutionNameMin: Cijk_Alik_Bljk_HBH_GB_MT128x64x8_SN_SU0_SUM0_TT8_8_WG16_8_1_WGM4
    SolutionIndex: 74
    SolutionNameMin: Cijk_Alik_Bljk_HBH_GB_MT128x128x8_SN_SU0_SUM0_TT8_8_WG16_16_1_WGM4
    SolutionIndex: 75
    SolutionNameMin: Cijk_Alik_Bljk_HBH_GB_MT64x64x16_SN_SU0_SUM0_TT8_8_WG8_8_1_WGM4
    SolutionIndex: 76
    SolutionNameMin: Cijk_Alik_Bljk_HBH_GB_MT128x64x16_SN_SU0_SUM0_TT8_8_WG16_8_1_WGM4
    SolutionIndex: 77
    SolutionNameMin: Cijk_Alik_Bljk_HBH_GB_MT128x128x16_SN_SU0_SUM0_TT8_8_WG16_16_1_WGM4
    SolutionIndex: 78
    SolutionNameMin: Cijk_Alik_Bljk_HBH_GB_MT64x64x32_SN_SU0_SUM0_TT8_8_WG8_8_1_WGM4
    SolutionIndex: 79
    SolutionNameMin: Cijk_Alik_Bljk_HBH_GB_MT64x64x8_SN_SU32_SUM3_TT8_8_WG8_8_1_WGM4
    SolutionIndex: 80
    SolutionNameMin: Cijk_Alik_Bljk_HBH_GB_MT128x64x8_SN_SU32_SUM3_TT8_8_WG16_8_1_WGM4
    SolutionIndex: 81
    SolutionNameMin: Cijk_Alik_Bljk_HBH_GB_MT64x64x16_SN_SU32_SUM3_TT8_8_WG8_8_1_WGM4
    SolutionIndex: 82
    SolutionNameMin: Cijk_Alik_Bljk_HBH_GB_MT128x64x16_SN_SU32_SUM3_TT8_8_WG16_8_1_WGM4
    SolutionIndex: 83
    SolutionNameMin: Cijk_Alik_Bljk_HBH_GB_MT128x128x16_SN_SU32_SUM3_TT8_8_WG16_16_1_WGM4
    SolutionIndex: 84
    SolutionNameMin: Cijk_Alik_Bljk_HBH_GB_MT64x64x32_SN_SU32_SUM3_TT8_8_WG8_8_1_WGM4
    SolutionIndex: 85
    SolutionNameMin: Cijk_Alik_Bljk_HBH_GB_MT128x128x32_SN_SU32_SUM3_TT8_8_WG16_16_1_WGM4
    SolutionIndex: 86
    SolutionNameMin: Cijk_Alik_Bljk_HBH_GB_MT64x64x8_SN_SU0_SUM0_TT8_8_WG8_8_1_WGM8
    SolutionIndex: 87
    SolutionNameMin: Cijk_Alik_Bljk_HBH_GB_MT128x64x8_SN_SU0_SUM0_TT8_8_WG16_8_1_WGM8
    SolutionIndex: 88
    SolutionNameMin: Cijk_Alik_Bljk_HBH_GB_MT128x128x8_SN_SU0_SUM0_TT8_8_WG16_16_1_WGM8
    SolutionIndex: 89
    SolutionNameMin: Cijk_Alik_Bljk_HBH_GB_MT64x64x16_SN_SU0_SUM0_TT8_8_WG8_8_1_WGM8
    SolutionIndex: 90
    SolutionNameMin: Cijk_Alik_Bljk_HBH_GB_MT128x64x16_SN_SU0_SUM0_TT8_8_WG16_8_1_WGM8
    SolutionIndex: 91
    SolutionNameMin: Cijk_Alik_Bljk_HBH_GB_MT128x128x16_SN_SU0_SUM0_TT8_8_WG16_16_1_WGM8
    SolutionIndex: 92
    SolutionNameMin: Cijk_Alik_Bljk_HBH_GB_MT64x64x32_SN_SU0_SUM0_TT8_8_WG8_8_1_WGM8
    SolutionIndex: 93
    SolutionNameMin: Cijk_Alik_Bljk_HBH_GB_MT128x64x32_SN_SU0_SUM0_TT8_8_WG16_8_1_WGM8
    SolutionIndex: 94
    SolutionNameMin: Cijk_Alik_Bljk_HBH_GB_MT64x64x8_SN_SU32_SUM3_TT8_8_WG8_8_1_WGM8
    SolutionIndex: 95
    SolutionNameMin: Cijk_Alik_Bljk_HBH_GB_MT128x64x8_SN_SU32_SUM3_TT8_8_WG16_8_1_WGM8
    SolutionIndex: 96
    SolutionNameMin: Cijk_Alik_Bljk_HBH_GB_MT128x128x8_SN_SU32_SUM3_TT8_8_WG16_16_1_WGM8
    SolutionIndex: 97
    SolutionNameMin: Cijk_Alik_Bljk_HBH_GB_MT64x64x16_SN_SU32_SUM3_TT8_8_WG8_8_1_WGM8
    SolutionIndex: 98
    SolutionNameMin: Cijk_Alik_Bljk_HBH_GB_MT128x64x16_SN_SU32_SUM3_TT8_8_WG16_8_1_WGM8
    SolutionIndex: 99
    SolutionNameMin: Cijk_Alik_Bljk_HBH_GB_MT128x128x16_SN_SU32_SUM3_TT8_8_WG16_16_1_WGM8
    SolutionIndex: 100
    SolutionNameMin: Cijk_Alik_Bljk_HBH_GB_MT64x64x32_SN_SU32_SUM3_TT8_8_WG8_8_1_WGM8
    SolutionIndex: 101
    SolutionNameMin: Cijk_Alik_Bljk_HBH_GB_MT128x64x32_SN_SU32_SUM3_TT8_8_WG16_8_1_WGM8
    SolutionIndex: 102
    SolutionNameMin: Cijk_Alik_Bljk_HBH_GB_MT128x128x32_SN_SU32_SUM3_TT8_8_WG16_16_1_WGM8
    SolutionIndex: 103
    SolutionNameMin: Cijk_Alik_Bljk_HBH_GB_MT128x128x16_SN_SU0_SUM0_TT8_8_WG16_16_1_WGM1
    SolutionIndex: 104
    SolutionNameMin: Cijk_Alik_Bljk_HBH_GB_MT64x64x16_SN_SU32_SUM3_TT8_8_WG8_8_1_WGM1
    SolutionIndex: 105
    SolutionNameMin: Cijk_Alik_Bljk_HBH_GB_MT128x128x16_SN_SU32_SUM3_TT8_8_WG16_16_1_WGM1
    SolutionIndex: 106
    SolutionNameMin: Cijk_Alik_Bljk_HBH_GB_MT128x64x16_SN_SU0_SUM0_TT8_8_WG16_8_1_WGM4
    SolutionIndex: 107
    SolutionNameMin: Cijk_Alik_Bljk_HBH_GB_MT128x128x16_SN_SU0_SUM0_TT8_8_WG16_16_1_WGM4
    SolutionIndex: 108
    SolutionNameMin: Cijk_Alik_Bljk_HBH_GB_MT128x128x16_SN_SU32_SUM3_TT8_8_WG16_16_1_WGM4
    SolutionIndex: 109
    SolutionNameMin: Cijk_Alik_Bljk_HBH_GB_MT64x64x16_SN_SU0_SUM0_TT8_8_WG8_8_1_WGM8
    SolutionIndex: 110
    SolutionNameMin: Cijk_Alik_Bljk_HBH_GB_MT128x128x16_SN_SU0_SUM0_TT8_8_WG16_16_1_WGM8
    SolutionIndex: 111
    SolutionNameMin: Cijk_Alik_Bljk_HBH_GB_MT128x128x16_SN_SU32_SUM3_TT8_8_WG16_16_1_WGM8
    SolutionIndex: 112
    SolutionNameMin: Cijk_Alik_Bljk_HBH_GB_MT64x64x32_SN_SU32_SUM3_TT8_8_WG8_8_1_WGM8
    SolutionIndex: 113
    SolutionNameMin: Cijk_Alik_Bljk_HBH_GB_MT128x128x32_SN_SU32_SUM3_TT8_8_WG16_16_1_WGM8
    SolutionIndex: 114
    SolutionNameMin: Cijk_Alik_Bljk_HBH_GB_MT16x16x8_SN_SU0_SUM0_TT2_2_WG8_8_1_WGM1
    SolutionIndex: 115
    SolutionNameMin: Cijk_Alik_Bljk_HBH_GB_MT32x32x8_SN_SU0_SUM0_TT4_4_WG8_8_1_WGM1
    SolutionIndex: 116
    SolutionNameMin: Cijk_Alik_Bljk_HBH_GB_MT32x16x8_SN_SU0_SUM0_TT2_2_WG16_8_1_WGM1
    SolutionIndex: 117
    SolutionNameMin: Cijk_Alik_Bljk_HBH_GB_MT64x32x8_SN_SU0_SUM0_TT4_4_WG16_8_1_WGM1
    SolutionIndex: 118
    SolutionNameMin: Cijk_Alik_Bljk_HBH_GB_MT32x32x8_SN_SU0_SUM0_TT2_2_WG16_16_1_WGM1
    SolutionIndex: 119
    SolutionNameMin: Cijk_Alik_Bljk_HBH_GB_MT64x64x8_SN_SU0_SUM0_TT4_4_WG16_16_1_WGM1
    SolutionIndex: 120
    SolutionNameMin: Cijk_Alik_Bljk_HBH_GB_MT16x16x16_SN_SU0_SUM0_TT2_2_WG8_8_1_WGM1
    SolutionIndex: 121
    SolutionNameMin: Cijk_Alik_Bljk_HBH_GB_MT32x32x16_SN_SU0_SUM0_TT4_4_WG8_8_1_WGM1
    SolutionIndex: 122
    SolutionNameMin: Cijk_Alik_Bljk_HBH_GB_MT32x16x16_SN_SU0_SUM0_TT2_2_WG16_8_1_WGM1
    SolutionIndex: 123
    SolutionNameMin: Cijk_Alik_Bljk_HBH_GB_MT32x32x16_SN_SU0_SUM0_TT2_2_WG16_16_1_WGM1
    SolutionIndex: 124
    SolutionNameMin: Cijk_Alik_Bljk_HBH_GB_MT16x16x32_SN_SU0_SUM0_TT2_2_WG8_8_1_WGM1
    SolutionIndex: 125
    SolutionNameMin: Cijk_Alik_Bljk_HBH_GB_MT64x32x32_SN_SU0_SUM0_TT4_4_WG16_8_1_WGM1
    SolutionIndex: 126
    SolutionNameMin: Cijk_Alik_Bljk_HBH_GB_MT32x32x32_SN_SU0_SUM0_TT2_2_WG16_16_1_WGM1
    SolutionIndex: 127
    SolutionNameMin: Cijk_Alik_Bljk_HBH_GB_MT16x16x8_SN_SU32_SUM3_TT2_2_WG8_8_1_WGM1
    SolutionIndex: 128
    SolutionNameMin: Cijk_Alik_Bljk_HBH_GB_MT32x32x8_SN_SU32_SUM3_TT4_4_WG8_8_1_WGM1
    SolutionIndex: 129
    SolutionNameMin: Cijk_Alik_Bljk_HBH_GB_MT32x16x8_SN_SU32_SUM3_TT2_2_WG16_8_1_WGM1
    SolutionIndex: 130
    SolutionNameMin: Cijk_Alik_Bljk_HBH_GB_MT64x32x8_SN_SU32_SUM3_TT4_4_WG16_8_1_WGM1
    SolutionIndex: 131
    SolutionNameMin: Cijk_Alik_Bljk_HBH_GB_MT32x32x8_SN_SU32_SUM3_TT2_2_WG16_16_1_WGM1
    SolutionIndex: 132
    SolutionNameMin: Cijk_Alik_Bljk_HBH_GB_MT64x64x8_SN_SU32_SUM3_TT4_4_WG16_16_1_WGM1
    SolutionIndex: 133
    SolutionNameMin: Cijk_Alik_Bljk_HBH_GB_MT16x16x16_SN_SU32_SUM3_TT2_2_WG8_8_1_WGM1
    SolutionIndex: 134
    SolutionNameMin: Cijk_Alik_Bljk_HBH_GB_MT32x32x16_SN_SU32_SUM3_TT4_4_WG8_8_1_WGM1
    SolutionIndex: 135
    SolutionNameMin: Cijk_Alik_Bljk_HBH_GB_MT32x16x16_SN_SU32_SUM3_TT2_2_WG16_8_1_WGM1
    SolutionIndex: 136
    SolutionNameMin: Cijk_Alik_Bljk_HBH_GB_MT64x32x16_SN_SU32_SUM3_TT4_4_WG16_8_1_WGM1
    SolutionIndex: 137
    SolutionNameMin: Cijk_Alik_Bljk_HBH_GB_MT16x16x32_SN_SU32_SUM3_TT2_2_WG8_8_1_WGM1
    SolutionIndex: 138
    SolutionNameMin: Cijk_Alik_Bljk_HBH_GB_MT32x32x32_SN_SU32_SUM3_TT4_4_WG8_8_1_WGM1
    SolutionIndex: 139
    SolutionNameMin: Cijk_Alik_Bljk_HBH_GB_MT32x32x32_SN_SU32_SUM3_TT2_2_WG16_16_1_WGM1
    SolutionIndex: 140
    SolutionNameMin: Cijk_Alik_Bljk_HBH_GB_MT16x16x8_SN_SU0_SUM0_TT2_2_WG8_8_1_WGM4
    SolutionIndex: 141
    SolutionNameMin: Cijk_Alik_Bljk_HBH_GB_MT32x32x8_SN_SU0_SUM0_TT4_4_WG8_8_1_WGM4
    SolutionIndex: 142
    SolutionNameMin: Cijk_Alik_Bljk_HBH_GB_MT32x16x8_SN_SU0_SUM0_TT2_2_WG16_8_1_WGM4
    SolutionIndex: 143
    SolutionNameMin: Cijk_Alik_Bljk_HBH_GB_MT64x32x8_SN_SU0_SUM0_TT4_4_WG16_8_1_WGM4
    SolutionIndex: 144
    SolutionNameMin: Cijk_Alik_Bljk_HBH_GB_MT32x32x8_SN_SU0_SUM0_TT2_2_WG16_16_1_WGM4
    SolutionIndex: 145
    SolutionNameMin: Cijk_Alik_Bljk_HBH_GB_MT64x64x8_SN_SU0_SUM0_TT4_4_WG16_16_1_WGM4
    SolutionIndex: 146
    SolutionNameMin: Cijk_Alik_Bljk_HBH_GB_MT16x16x16_SN_SU0_SUM0_TT2_2_WG8_8_1_WGM4
    SolutionIndex: 147
    SolutionNameMin: Cijk_Alik_Bljk_HBH_GB_MT32x32x16_SN_SU0_SUM0_TT4_4_WG8_8_1_WGM4
    SolutionIndex: 148
    SolutionNameMin: Cijk_Alik_Bljk_HBH_GB_MT32x16x16_SN_SU0_SUM0_TT2_2_WG16_8_1_WGM4
    SolutionIndex: 149
    SolutionNameMin: Cijk_Alik_Bljk_HBH_GB_MT32x32x16_SN_SU0_SUM0_TT2_2_WG16_16_1_WGM4
    SolutionIndex: 150
    SolutionNameMin: Cijk_Alik_Bljk_HBH_GB_MT16x16x32_SN_SU0_SUM0_TT2_2_WG8_8_1_WGM4
    SolutionIndex: 151
    SolutionNameMin: Cijk_Alik_Bljk_HBH_GB_MT64x64x32_SN_SU0_SUM0_TT4_4_WG16_16_1_WGM4
    SolutionIndex: 152
    SolutionNameMin: Cijk_Alik_Bljk_HBH_GB_MT16x16x8_SN_SU32_SUM3_TT2_2_WG8_8_1_WGM4
    SolutionIndex: 153
    SolutionNameMin: Cijk_Alik_Bljk_HBH_GB_MT32x32x8_SN_SU32_SUM3_TT4_4_WG8_8_1_WGM4
    SolutionIndex: 154
    SolutionNameMin: Cijk_Alik_Bljk_HBH_GB_MT32x16x8_SN_SU32_SUM3_TT2_2_WG16_8_1_WGM4
    SolutionIndex: 155
    SolutionNameMin: Cijk_Alik_Bljk_HBH_GB_MT64x32x8_SN_SU32_SUM3_TT4_4_WG16_8_1_WGM4
    SolutionIndex: 156
    SolutionNameMin: Cijk_Alik_Bljk_HBH_GB_MT32x32x8_SN_SU32_SUM3_TT2_2_WG16_16_1_WGM4
    SolutionIndex: 157
    SolutionNameMin: Cijk_Alik_Bljk_HBH_GB_MT64x64x8_SN_SU32_SUM3_TT4_4_WG16_16_1_WGM4
    SolutionIndex: 158
    SolutionNameMin: Cijk_Alik_Bljk_HBH_GB_MT16x16x16_SN_SU32_SUM3_TT2_2_WG8_8_1_WGM4
    SolutionIndex: 159
    SolutionNameMin: Cijk_Alik_Bljk_HBH_GB_MT32x32x16_SN_SU32_SUM3_TT4_4_WG8_8_1_WGM4
    SolutionIndex: 160
    SolutionNameMin: Cijk_Alik_Bljk_HBH_GB_MT32x16x16_SN_SU32_SUM3_TT2_2_WG16_8_1_WGM4
    SolutionIndex: 161
    SolutionNameMin: Cijk_Alik_Bljk_HBH_GB_MT32x32x16_SN_SU32_SUM3_TT2_2_WG16_16_1_WGM4
    SolutionIndex: 162
    SolutionNameMin: Cijk_Alik_Bljk_HBH_GB_MT64x64x16_SN_SU32_SUM3_TT4_4_WG16_16_1_WGM4
    SolutionIndex: 163
    SolutionNameMin: Cijk_Alik_Bljk_HBH_GB_MT16x16x32_SN_SU32_SUM3_TT2_2_WG8_8_1_WGM4
    SolutionIndex: 164
    SolutionNameMin: Cijk_Alik_Bljk_HBH_GB_MT16x16x8_SN_SU0_SUM0_TT2_2_WG8_8_1_WGM8
    SolutionIndex: 165
    SolutionNameMin: Cijk_Alik_Bljk_HBH_GB_MT32x32x8_SN_SU0_SUM0_TT4_4_WG8_8_1_WGM8
    SolutionIndex: 166
    SolutionNameMin: Cijk_Alik_Bljk_HBH_GB_MT32x16x8_SN_SU0_SUM0_TT2_2_WG16_8_1_WGM8
    SolutionIndex: 167
    SolutionNameMin: Cijk_Alik_Bljk_HBH_GB_MT64x32x8_SN_SU0_SUM0_TT4_4_WG16_8_1_WGM8
    SolutionIndex: 168
    SolutionNameMin: Cijk_Alik_Bljk_HBH_GB_MT32x32x8_SN_SU0_SUM0_TT2_2_WG16_16_1_WGM8
    SolutionIndex: 169
    SolutionNameMin: Cijk_Alik_Bljk_HBH_GB_MT64x64x8_SN_SU0_SUM0_TT4_4_WG16_16_1_WGM8
    SolutionIndex: 170
    SolutionNameMin: Cijk_Alik_Bljk_HBH_GB_MT16x16x16_SN_SU0_SUM0_TT2_2_WG8_8_1_WGM8
    SolutionIndex: 171
    SolutionNameMin: Cijk_Alik_Bljk_HBH_GB_MT32x32x16_SN_SU0_SUM0_TT4_4_WG8_8_1_WGM8
    SolutionIndex: 172
    SolutionNameMin: Cijk_Alik_Bljk_HBH_GB_MT32x16x16_SN_SU0_SUM0_TT2_2_WG16_8_1_WGM8
    SolutionIndex: 173
    SolutionNameMin: Cijk_Alik_Bljk_HBH_GB_MT64x64x16_SN_SU0_SUM0_TT4_4_WG16_16_1_WGM8
    SolutionIndex: 174
    SolutionNameMin: Cijk_Alik_Bljk_HBH_GB_MT16x16x32_SN_SU0_SUM0_TT2_2_WG8_8_1_WGM8
    SolutionIndex: 175
    SolutionNameMin: Cijk_Alik_Bljk_HBH_GB_MT32x16x32_SN_SU0_SUM0_TT2_2_WG16_8_1_WGM8
    SolutionIndex: 176
    SolutionNameMin: Cijk_Alik_Bljk_HBH_GB_MT16x16x8_SN_SU32_SUM3_TT2_2_WG8_8_1_WGM8
    SolutionIndex: 177
    SolutionNameMin: Cijk_Alik_Bljk_HBH_GB_MT32x32x8_SN_SU32_SUM3_TT4_4_WG8_8_1_WGM8
    SolutionIndex: 178
    SolutionNameMin: Cijk_Alik_Bljk_HBH_GB_MT32x16x8_SN_SU32_SUM3_TT2_2_WG16_8_1_WGM8
    SolutionIndex: 179
    SolutionNameMin: Cijk_Alik_Bljk_HBH_GB_MT64x32x8_SN_SU32_SUM3_TT4_4_WG16_8_1_WGM8
    SolutionIndex: 180
    SolutionNameMin: Cijk_Alik_Bljk_HBH_GB_MT32x32x8_SN_SU32_SUM3_TT2_2_WG16_16_1_WGM8
    SolutionIndex: 181
    SolutionNameMin: Cijk_Alik_Bljk_HBH_GB_MT64x64x8_SN_SU32_SUM3_TT4_4_WG16_16_1_WGM8
    SolutionIndex: 182
    SolutionNameMin: Cijk_Alik_Bljk_HBH_GB_MT16x16x16_SN_SU32_SUM3_TT2_2_WG8_8_1_WGM8
    SolutionIndex: 183
    SolutionNameMin: Cijk_Alik_Bljk_HBH_GB_MT32x32x16_SN_SU32_SUM3_TT4_4_WG8_8_1_WGM8
    SolutionIndex: 184
    SolutionNameMin: Cijk_Alik_Bljk_HBH_GB_MT32x16x16_SN_SU32_SUM3_TT2_2_WG16_8_1_WGM8
    SolutionIndex: 185
    SolutionNameMin: Cijk_Alik_Bljk_HBH_GB_MT32x32x16_SN_SU32_SUM3_TT2_2_WG16_16_1_WGM8
    SolutionIndex: 186
    SolutionNameMin: Cijk_Alik_Bljk_HBH_GB_MT16x16x32_SN_SU32_SUM3_TT2_2_WG8_8_1_WGM8
    SolutionIndex: 187
    SolutionNameMin: Cijk_Alik_Bljk_HBH_GB_MT32x32x8_SN_SU0_SUM0_TT4_4_WG8_8_1_WGM1
    SolutionIndex: 188
    SolutionNameMin: Cijk_Alik_Bljk_HBH_GB_MT32x16x8_SN_SU0_SUM0_TT2_2_WG16_8_1_WGM1
    SolutionIndex: 189
    SolutionNameMin: Cijk_Alik_Bljk_HBH_GB_MT64x32x8_SN_SU0_SUM0_TT4_4_WG16_8_1_WGM1
    SolutionIndex: 190
    SolutionNameMin: Cijk_Alik_Bljk_HBH_GB_MT16x16x32_SN_SU0_SUM0_TT2_2_WG8_8_1_WGM1
    SolutionIndex: 191
    SolutionNameMin: Cijk_Alik_Bljk_HBH_GB_MT32x32x8_SN_SU32_SUM3_TT4_4_WG8_8_1_WGM1
    SolutionIndex: 192
    SolutionNameMin: Cijk_Alik_Bljk_HBH_GB_MT64x32x8_SN_SU32_SUM3_TT4_4_WG16_8_1_WGM1
    SolutionIndex: 193
    SolutionNameMin: Cijk_Alik_Bljk_HBH_GB_MT32x32x16_SN_SU32_SUM3_TT4_4_WG8_8_1_WGM1
    SolutionIndex: 194
    SolutionNameMin: Cijk_Alik_Bljk_HBH_GB_MT16x16x32_SN_SU32_SUM3_TT2_2_WG8_8_1_WGM1
    SolutionIndex: 195
    SolutionNameMin: Cijk_Alik_Bljk_HBH_GB_MT32x32x8_SN_SU0_SUM0_TT4_4_WG8_8_1_WGM4
    SolutionIndex: 196
    SolutionNameMin: Cijk_Alik_Bljk_HBH_GB_MT64x32x8_SN_SU0_SUM0_TT4_4_WG16_8_1_WGM4
    SolutionIndex: 197
    SolutionNameMin: Cijk_Alik_Bljk_HBH_GB_MT64x64x8_SN_SU0_SUM0_TT4_4_WG16_16_1_WGM4
    SolutionIndex: 198
    SolutionNameMin: Cijk_Alik_Bljk_HBH_GB_MT16x16x16_SN_SU0_SUM0_TT2_2_WG8_8_1_WGM4
    SolutionIndex: 199
    SolutionNameMin: Cijk_Alik_Bljk_HBH_GB_MT32x32x16_SN_SU0_SUM0_TT4_4_WG8_8_1_WGM4
    SolutionIndex: 200
    SolutionNameMin: Cijk_Alik_Bljk_HBH_GB_MT32x32x8_SN_SU32_SUM3_TT4_4_WG8_8_1_WGM4
    SolutionIndex: 201
    SolutionNameMin: Cijk_Alik_Bljk_HBH_GB_MT64x64x8_SN_SU32_SUM3_TT4_4_WG16_16_1_WGM4
    SolutionIndex: 202
    SolutionNameMin: Cijk_Alik_Bljk_HBH_GB_MT16x16x32_SN_SU32_SUM3_TT2_2_WG8_8_1_WGM4
    SolutionIndex: 203
    SolutionNameMin: Cijk_Alik_Bljk_HBH_GB_MT32x32x8_SN_SU0_SUM0_TT4_4_WG8_8_1_WGM8
    SolutionIndex: 204
    SolutionNameMin: Cijk_Alik_Bljk_HBH_GB_MT64x32x8_SN_SU0_SUM0_TT4_4_WG16_8_1_WGM8
    SolutionIndex: 205
    SolutionNameMin: Cijk_Alik_Bljk_HBH_GB_MT64x64x8_SN_SU0_SUM0_TT4_4_WG16_16_1_WGM8
    SolutionIndex: 206
    SolutionNameMin: Cijk_Alik_Bljk_HBH_GB_MT16x16x16_SN_SU0_SUM0_TT2_2_WG8_8_1_WGM8
    SolutionIndex: 207
    SolutionNameMin: Cijk_Alik_Bljk_HBH_GB_MT64x64x8_SN_SU32_SUM3_TT4_4_WG16_16_1_WGM8
    SolutionIndex: 208
    SolutionNameMin: Cijk_Alik_Bljk_HBH_GB_MT32x16x16_SN_SU32_SUM3_TT2_2_WG16_8_1_WGM8
    SolutionIndex: 209
    SolutionNameMin: Cijk_Alik_Bljk_HBH_GB_MT16x16x32_SN_SU32_SUM3_TT2_2_WG8_8_1_WGM8
    SolutionIndex: 210
    SolutionNameMin: Cijk_Alik_Bljk_HBH_GB_MT32x8x8_SN_SU0_SUM0_TT2_2_WG16_4_1_WGM1
    SolutionIndex: 211
    SolutionNameMin: Cijk_Alik_Bljk_HBH_GB_MT32x8x16_SN_SU0_SUM0_TT2_2_WG16_4_1_WGM1
    SolutionIndex: 212
    SolutionNameMin: Cijk_Alik_Bljk_HBH_GB_MT64x16x16_SN_SU0_SUM0_TT4_2_WG16_8_1_WGM1
    SolutionIndex: 213
    SolutionNameMin: Cijk_Alik_Bljk_HBH_GB_MT32x8x8_SN_SU32_SUM3_TT2_2_WG16_4_1_WGM1
    SolutionIndex: 214
    SolutionNameMin: Cijk_Alik_Bljk_HBH_GB_MT32x8x16_SN_SU32_SUM3_TT2_2_WG16_4_1_WGM1
    SolutionIndex: 215
    SolutionNameMin: Cijk_Alik_Bljk_HBH_GB_MT128x8x16_SN_SU32_SUM3_TT4_2_WG32_4_1_WGM1
    SolutionIndex: 216
    SolutionNameMin: Cijk_Alik_Bljk_HBH_GB_MT32x8x32_SN_SU32_SUM3_TT2_2_WG16_4_1_WGM1
    SolutionIndex: 217
    SolutionNameMin: Cijk_Alik_Bljk_HBH_GB_MT32x8x16_SN_SU0_SUM0_TT2_2_WG16_4_1_WGM4
    SolutionIndex: 218
    SolutionNameMin: Cijk_Alik_Bljk_HBH_GB_MT64x16x8_SN_SU32_SUM3_TT4_2_WG16_8_1_WGM4
    SolutionIndex: 219
    SolutionNameMin: Cijk_Alik_Bljk_HBH_GB_MT32x8x16_SN_SU32_SUM3_TT2_2_WG16_4_1_WGM4
    SolutionIndex: 220
    SolutionNameMin: Cijk_Alik_Bljk_HBH_GB_MT32x8x16_SN_SU0_SUM0_TT2_2_WG16_4_1_WGM8
    SolutionIndex: 221
    SolutionNameMin: Cijk_Alik_Bljk_HBH_GB_MT32x8x16_SN_SU32_SUM3_TT2_2_WG16_4_1_WGM8
    SolutionIndex: 222
    SolutionNameMin: Cijk_Alik_Bljk_HBH_GB_MT16x32x8_SN_SU0_SUM0_TT2_4_WG8_8_1_WGM1
    SolutionIndex: 223
    SolutionNameMin: Cijk_Alik_Bljk_HBH_GB_MT32x32x8_SN_SU0_SUM0_TT2_4_WG16_8_1_WGM1
    SolutionIndex: 224
    SolutionNameMin: Cijk_Alik_Bljk_HBH_GB_MT16x32x16_SN_SU0_SUM0_TT2_4_WG8_8_1_WGM1
    SolutionIndex: 225
    SolutionNameMin: Cijk_Alik_Bljk_HBH_GB_MT16x32x8_SN_SU32_SUM3_TT2_4_WG8_8_1_WGM1
    SolutionIndex: 226
    SolutionNameMin: Cijk_Alik_Bljk_HBH_GB_MT32x32x8_SN_SU32_SUM3_TT2_4_WG16_8_1_WGM1
    SolutionIndex: 227
    SolutionNameMin: Cijk_Alik_Bljk_HBH_GB_MT32x32x8_SN_SU0_SUM0_TT2_4_WG16_8_1_WGM4
    SolutionIndex: 228
    SolutionNameMin: Cijk_Alik_Bljk_HBH_GB_MT32x32x16_SN_SU0_SUM0_TT2_4_WG16_8_1_WGM4
    SolutionIndex: 229
    SolutionNameMin: Cijk_Alik_Bljk_HBH_GB_MT16x32x8_SN_SU32_SUM3_TT2_4_WG8_8_1_WGM4
    SolutionIndex: 230
    SolutionNameMin: Cijk_Alik_Bljk_HBH_GB_MT32x32x8_SN_SU0_SUM0_TT2_4_WG16_8_1_WGM8
    SolutionIndex: 231
    SolutionNameMin: Cijk_Alik_Bljk_HBH_GB_MT16x32x8_SN_SU32_SUM3_TT2_4_WG8_8_1_WGM8
- - - [2368, 1024, 1, 1, 2368, 2368, 1, 1]
    - [34, 324.0]
  - - [5056, 1408, 1, 3328, 5056, 5056, 3328, 3328]
    - [5, 20505.0]
  - - [5056, 1856, 1, 3328, 5056, 5056, 3328, 3328]
    - [5, 19815.0]
  - - [448, 3584, 1, 3328, 448, 448, 3328, 3328]
    - [24, 16927.0]
  - - [5056, 4288, 1, 32, 5056, 5056, 32, 32]
    - [17, 14913.0]
  - - [3584, 1024, 1, 256, 3584, 3584, 256, 256]
    - [22, 17794.0]
  - - [1408, 3584, 1, 3328, 1408, 1408, 3328, 3328]
    - [7, 20550.0]
  - - [1024, 2368, 1, 3328, 1024, 1024, 3328, 3328]
    - [7, 19388.0]
  - - [448, 3584, 1, 32, 448, 448, 32, 32]
    - [34, 6328.0]
  - - [4288, 6784, 1, 3328, 4288, 4288, 3328, 3328]
    - [32, 21108.0]
  - - [5888, 4288, 1, 3328, 5888, 5888, 3328, 3328]
    - [7, 21463.0]
  - - [2368, 1408, 1, 32, 2368, 2368, 32, 32]
    - [41, 7765.0]
  - - [1024, 2944, 1, 1, 1024, 1024, 1, 1]
    - [21, 306.0]
  - - [2944, 3584, 1, 3328, 2944, 2944, 3328, 3328]
    - [32, 20916.0]
  - - [2368, 2944, 1, 1280, 2368, 2368, 1280, 1280]
    - [30, 20065.0]
  - - [6784, 5888, 1, 3328, 6784, 6784, 3328, 3328]
    - [7, 21894.0]
  - - [3584, 1408, 1, 32, 3584, 3584, 32, 32]
    - [2, 8307.0]
  - - [5056, 256, 1, 256, 5056, 5056, 256, 256]
    - [6, 15527.0]
  - - [1856, 2368, 1, 256, 1856, 1856, 256, 256]
    - [5, 17368.0]
  - - [2368, 1024, 1, 3328, 2368, 2368, 3328, 3328]
    - [24, 19853.0]
  - - [3584, 4288, 1, 32, 3584, 3584, 32, 32]
    - [34, 14948.0]
  - - [3584, 3584, 1, 1, 3584, 3584, 1, 1]
    - [26, 535.0]
  - - [1408, 2368, 1, 1, 1408, 1408, 1, 1]
    - [41, 426.0]
  - - [5056, 6784, 1, 1280, 5056, 5056, 1280, 1280]
    - [32, 21272.0]
  - - [4288, 5056, 1, 1, 4288, 4288, 1, 1]
    - [21, 641.0]
  - - [5056, 4288, 1, 1, 5056, 5056, 1, 1]
    - [34, 646.0]
  - - [1408, 4288, 1, 1280, 1408, 1408, 1280, 1280]
    - [46, 20321.0]
  - - [4288, 1024, 1, 3328, 4288, 4288, 3328, 3328]
    - [7, 20140.0]
  - - [1024, 5056, 1, 1, 1024, 1024, 1, 1]
    - [26, 375.0]
  - - [704, 3584, 1, 1280, 704, 704, 1280, 1280]
    - [12, 16986.0]
  - - [1856, 5056, 1, 256, 1856, 1856, 256, 256]
    - [14, 18967.0]
  - - [1408, 1024, 1, 1280, 1408, 1408, 1280, 1280]
    - [12, 17123.0]
  - - [5056, 5888, 1, 3328, 5056, 5056, 3328, 3328]
    - [14, 21758.0]
  - - [3584, 3584, 1, 1280, 3584, 3584, 1280, 1280]
    - [24, 21606.0]
  - - [2368, 3584, 1, 32, 2368, 2368, 32, 32]
    - [10, 10726.0]
  - - [2944, 2368, 1, 1, 2944, 2944, 1, 1]
    - [29, 329.0]
  - - [704, 4288, 1, 1, 704, 704, 1, 1]
    - [45, 306.0]
  - - [1024, 6784, 1, 1280, 1024, 1024, 1280, 1280]
    - [7, 20627.0]
  - - [1024, 3584, 1, 1, 1024, 1024, 1, 1]
    - [26, 328.0]
  - - [256, 5056, 1, 32, 256, 256, 32, 32]
    - [0, 8218.0]
  - - [2368, 5056, 1, 32, 2368, 2368, 32, 32]
    - [34, 11759.0]
  - - [6784, 1856, 1, 32, 6784, 6784, 32, 32]
    - [17, 10854.0]
  - - [5056, 704, 1, 1, 5056, 5056, 1, 1]
    - [26, 311.0]
  - - [2944, 4288, 1, 256, 2944, 2944, 256, 256]
    - [14, 19834.0]
  - - [5056, 704, 1, 32, 5056, 5056, 32, 32]
    - [17, 8940.0]
  - - [1856, 4288, 1, 3328, 1856, 1856, 3328, 3328]
    - [24, 20422.0]
  - - [6784, 4288, 1, 32, 6784, 6784, 32, 32]
    - [17, 15116.0]
  - - [5888, 5056, 1, 256, 5888, 5888, 256, 256]
    - [24, 20624.0]
  - - [3584, 2368, 1, 3328, 3584, 3584, 3328, 3328]
    - [5, 20481.0]
  - - [4288, 1856, 1, 1, 4288, 4288, 1, 1]
    - [0, 410.0]
  - - [1856, 2944, 1, 1, 1856, 1856, 1, 1]
    - [8, 394.0]
  - - [1856, 2368, 1, 32, 1856, 1856, 32, 32]
    - [41, 9314.0]
  - - [4288, 1856, 1, 32, 4288, 4288, 32, 32]
    - [34, 12150.0]
  - - [5056, 2368, 1, 256, 5056, 5056, 256, 256]
    - [38, 19282.0]
  - - [1408, 5888, 1, 256, 1408, 1408, 256, 256]
    - [14, 20090.0]
  - - [5056, 6784, 1, 1, 5056, 5056, 1, 1]
    - [21, 693.0]
  - - [1024, 1408, 1, 3328, 1024, 1024, 3328, 3328]
    - [12, 17431.0]
  - - [256, 5056, 1, 1280, 256, 256, 1280, 1280]
    - [48, 18645.0]
  - - [704, 2368, 1, 1, 704, 704, 1, 1]
    - [45, 194.0]
  - - [3584, 4288, 1, 1280, 3584, 3584, 1280, 1280]
    - [7, 21459.0]
  - - [3584, 2368, 1, 1, 3584, 3584, 1, 1]
    - [26, 389.0]
  - - [4288, 448, 1, 3328, 4288, 4288, 3328, 3328]
    - [30, 16889.0]
  - - [704, 6784, 1, 1280, 704, 704, 1280, 1280]
    - [30, 18561.0]
  - - [2368, 4288, 1, 32, 2368, 2368, 32, 32]
    - [34, 12925.0]
  - - [704, 5056, 1, 1280, 704, 704, 1280, 1280]
    - [32, 18645.0]
  - - [3584, 6784, 1, 32, 3584, 3584, 32, 32]
    - [41, 15334.0]
  - - [3584, 6784, 1, 1280, 3584, 3584, 1280, 1280]
    - [7, 21573.0]
  - - [4288, 4288, 1, 3328, 4288, 4288, 3328, 3328]
    - [14, 19766.0]
  - - [1408, 3584, 1, 1, 1408, 1408, 1, 1]
    - [41, 353.0]
  - - [4288, 1856, 1, 3328, 4288, 4288, 3328, 3328]
    - [46, 19709.0]
  - - [1856, 2944, 1, 1280, 1856, 1856, 1280, 1280]
    - [46, 19452.0]
  - - [5056, 1024, 1, 3328, 5056, 5056, 3328, 3328]
    - [7, 21013.0]
  - - [3584, 704, 1, 1, 3584, 3584, 1, 1]
    - [26, 394.0]
  - - [448, 5056, 1, 1, 448, 448, 1, 1]
    - [21, 216.0]
  - - [5888, 5888, 1, 256, 5888, 5888, 256, 256]
    - [24, 21314.0]
  - - [3584, 704, 1, 32, 3584, 3584, 32, 32]
    - [34, 11030.0]
  - - [448, 6784, 1, 3328, 448, 448, 3328, 3328]
    - [12, 17726.0]
  - - [6784, 4288, 1, 1, 6784, 6784, 1, 1]
    - [30, 672.0]
  - - [3584, 6784, 1, 1, 3584, 3584, 1, 1]
    - [35, 575.0]
  - - [1408, 2368, 1, 32, 1408, 1408, 32, 32]
    - [41, 10142.0]
  - - [448, 5056, 1, 32, 448, 448, 32, 32]
    - [19, 6437.0]
  - - [4288, 4288, 1, 1280, 4288, 4288, 1280, 1280]
    - [24, 21351.0]
  - - [6784, 1408, 1, 1, 6784, 6784, 1, 1]
    - [34, 386.0]
  - - [1856, 5888, 1, 3328, 1856, 1856, 3328, 3328]
    - [14, 19951.0]
  - - [3584, 1856, 1, 3328, 3584, 3584, 3328, 3328]
    - [12, 20101.0]
  - - [5056, 5888, 1, 1, 5056, 5056, 1, 1]
    - [36, 769.0]
  - - [2944, 1024, 1, 256, 2944, 2944, 256, 256]
    - [5, 17007.0]
  - - [2368, 4288, 1, 3328, 2368, 2368, 3328, 3328]
    - [14, 20276.0]
  - - [2944, 6784, 1, 256, 2944, 2944, 256, 256]
    - [22, 20722.0]
  - - [2368, 2368, 1, 1280, 2368, 2368, 1280, 1280]
    - [12, 19066.0]
  - - [3584, 3584, 1, 32, 3584, 3584, 32, 32]
    - [25, 10755.0]
  - - [2944, 2944, 1, 1280, 2944, 2944, 1280, 1280]
    - [12, 20835.0]
  - - [1408, 5056, 1, 1, 1408, 1408, 1, 1]
    - [41, 377.0]
  - - [2368, 6784, 1, 1, 2368, 2368, 1, 1]
    - [23, 409.0]
  - - [6784, 4288, 1, 1280, 6784, 6784, 1280, 1280]
    - [32, 21620.0]
  - - [2944, 704, 1, 256, 2944, 2944, 256, 256]
    - [22, 15838.0]
  - - [2368, 6784, 1, 1280, 2368, 2368, 1280, 1280]
    - [7, 20932.0]
  - - [704, 2944, 1, 3328, 704, 704, 3328, 3328]
    - [12, 18297.0]
  - - [5888, 256, 1, 1, 5888, 5888, 1, 1]
    - [19, 331.0]
  - - [5056, 6784, 1, 32, 5056, 5056, 32, 32]
    - [26, 14623.0]
  - - [448, 5056, 1, 1280, 448, 448, 1280, 1280]
    - [7, 17405.0]
  - - [256, 5888, 1, 3328, 256, 256, 3328, 3328]
    - [30, 17954.0]
  - - [5888, 1024, 1, 1, 5888, 5888, 1, 1]
    - [13, 406.0]
  - - [5888, 448, 1, 32, 5888, 5888, 32, 32]
    - [17, 8116.0]
  - - [6784, 2944, 1, 256, 6784, 6784, 256, 256]
    - [38, 20633.0]
  - - [4288, 2944, 1, 256, 4288, 4288, 256, 256]
    - [46, 19805.0]
  - - [448, 5888, 1, 3328, 448, 448, 3328, 3328]
    - [7, 17586.0]
  - - [1408, 4288, 1, 1, 1408, 1408, 1, 1]
    - [0, 403.0]
  - - [1408, 1856, 1, 3328, 1408, 1408, 3328, 3328]
    - [46, 18229.0]
  - - [3584, 1024, 1, 3328, 3584, 3584, 3328, 3328]
    - [7, 19529.0]
  - - [2944, 5888, 1, 3328, 2944, 2944, 3328, 3328]
    - [14, 19913.0]
  - - [448, 4288, 1, 3328, 448, 448, 3328, 3328]
    - [5, 16596.0]
  - - [704, 2368, 1, 256, 704, 704, 256, 256]
    - [32, 14283.0]
  - - [4288, 3584, 1, 3328, 4288, 4288, 3328, 3328]
    - [32, 21716.0]
  - - [1408, 1024, 1, 1, 1408, 1408, 1, 1]
    - [45, 162.0]
  - - [1408, 1024, 1, 256, 1408, 1408, 256, 256]
    - [6, 10612.0]
  - - [5056, 3584, 1, 1, 5056, 5056, 1, 1]
    - [23, 576.0]
  - - [6784, 6784, 1, 3328, 6784, 6784, 3328, 3328]
    - [14, 21720.0]
  - - [2368, 2944, 1, 3328, 2368, 2368, 3328, 3328]
    - [12, 20129.0]
  - - [5056, 3584, 1, 32, 5056, 5056, 32, 32]
    - [8, 15308.0]
  - - [5056, 3584, 1, 1280, 5056, 5056, 1280, 1280]
    - [24, 21651.0]
  - - [1856, 1856, 1, 256, 1856, 1856, 256, 256]
    - [38, 16836.0]
  - - [5888, 4288, 1, 1, 5888, 5888, 1, 1]
    - [34, 628.0]
  - - [5056, 704, 1, 256, 5056, 5056, 256, 256]
    - [32, 16448.0]
  - - [2368, 5056, 1, 256, 2368, 2368, 256, 256]
    - [22, 19490.0]
  - - [1024, 5056, 1, 256, 1024, 1024, 256, 256]
    - [30, 18891.0]
  - - [5888, 448, 1, 256, 5888, 5888, 256, 256]
    - [22, 15196.0]
  - - [6784, 5056, 1, 1280, 6784, 6784, 1280, 1280]
    - [32, 21617.0]
  - - [4288, 6784, 1, 1280, 4288, 4288, 1280, 1280]
    - [7, 21254.0]
  - - [704, 6784, 1, 3328, 704, 704, 3328, 3328]
    - [5, 18795.0]
  - - [2944, 1856, 1, 1, 2944, 2944, 1, 1]
    - [34, 353.0]
  - - [5888, 4288, 1, 1280, 5888, 5888, 1280, 1280]
    - [7, 21545.0]
  - - [5888, 3584, 1, 1280, 5888, 5888, 1280, 1280]
    - [7, 21828.0]
  - - [3584, 1408, 1, 1280, 3584, 3584, 1280, 1280]
    - [12, 20147.0]
  - - [1024, 2944, 1, 256, 1024, 1024, 256, 256]
    - [12, 18006.0]
  - - [2944, 1856, 1, 1280, 2944, 2944, 1280, 1280]
    - [12, 19454.0]
  - - [1024, 2368, 1, 1, 1024, 1024, 1, 1]
    - [26, 315.0]
  - - [2944, 3584, 1, 1280, 2944, 2944, 1280, 1280]
    - [7, 21134.0]
  - - [1856, 4288, 1, 256, 1856, 1856, 256, 256]
    - [38, 18812.0]
  - - [448, 3584, 1, 1, 448, 448, 1, 1]
    - [21, 244.0]
  - - [2368, 2944, 1, 32, 2368, 2368, 32, 32]
    - [0, 10405.0]
  - - [4288, 704, 1, 256, 4288, 4288, 256, 256]
    - [30, 16127.0]
  - - [1856, 1024, 1, 256, 1856, 1856, 256, 256]
    - [22, 16526.0]
  - - [704, 6784, 1, 32, 704, 704, 32, 32]
    - [43, 9481.0]
  - - [1024, 4288, 1, 1, 1024, 1024, 1, 1]
    - [26, 335.0]
  - - [1408, 5888, 1, 1280, 1408, 1408, 1280, 1280]
    - [24, 21333.0]
  - - [5056, 1856, 1, 256, 5056, 5056, 256, 256]
    - [38, 18765.0]
  - - [6784, 704, 1, 1280, 6784, 6784, 1280, 1280]
    - [40, 19335.0]
  - - [5888, 1024, 1, 256, 5888, 5888, 256, 256]
    - [22, 19583.0]
  - - [6784, 1856, 1, 3328, 6784, 6784, 3328, 3328]
    - [12, 19769.0]
  - - [2368, 5888, 1, 1280, 2368, 2368, 1280, 1280]
    - [24, 21222.0]
  - - [5888, 6784, 1, 32, 5888, 5888, 32, 32]
    - [39, 12369.0]
  - - [6784, 6784, 1, 32, 6784, 6784, 32, 32]
    - [37, 14976.0]
  - - [6784, 256, 1, 256, 6784, 6784, 256, 256]
    - [38, 16238.0]
  - - [2368, 3584, 1, 3328, 2368, 2368, 3328, 3328]
    - [7, 20465.0]
  - - [5888, 1024, 1, 1280, 5888, 5888, 1280, 1280]
    - [46, 20450.0]
  - - [5888, 6784, 1, 3328, 5888, 5888, 3328, 3328]
    - [7, 21739.0]
  - - [6784, 448, 1, 1, 6784, 6784, 1, 1]
    - [4, 292.0]
  - - [6784, 1856, 1, 1, 6784, 6784, 1, 1]
    - [37, 422.0]
  - - [2944, 2368, 1, 1280, 2944, 2944, 1280, 1280]
    - [12, 20269.0]
  - - [6784, 448, 1, 32, 6784, 6784, 32, 32]
    - [34, 8955.0]
  - - [6784, 448, 1, 3328, 6784, 6784, 3328, 3328]
    - [30, 17498.0]
  - - [448, 3584, 1, 1280, 448, 448, 1280, 1280]
    - [40, 15954.0]
  - - [1408, 6784, 1, 1280, 1408, 1408, 1280, 1280]
    - [24, 21117.0]
  - - [5056, 5888, 1, 1280, 5056, 5056, 1280, 1280]
    - [32, 21739.0]
  - - [5888, 704, 1, 1, 5888, 5888, 1, 1]
    - [26, 314.0]
  - - [3584, 1856, 1, 1, 3584, 3584, 1, 1]
    - [17, 322.0]
  - - [5056, 2944, 1, 32, 5056, 5056, 32, 32]
    - [4, 11715.0]
  - - [4288, 6784, 1, 1, 4288, 4288, 1, 1]
    - [19, 831.0]
  - - [1024, 6784, 1, 1, 1024, 1024, 1, 1]
    - [22, 352.0]
  - - [2368, 5888, 1, 32, 2368, 2368, 32, 32]
    - [41, 12654.0]
  - - [3584, 4288, 1, 1, 3584, 3584, 1, 1]
    - [45, 379.0]
  - - [5888, 1024, 1, 3328, 5888, 5888, 3328, 3328]
    - [7, 20586.0]
  - - [6784, 5888, 1, 256, 6784, 6784, 256, 256]
    - [24, 21276.0]
  - - [5056, 1024, 1, 1, 5056, 5056, 1, 1]
    - [26, 584.0]
  - - [4288, 2368, 1, 32, 4288, 4288, 32, 32]
    - [17, 15141.0]
  - - [704, 3584, 1, 1, 704, 704, 1, 1]
    - [34, 389.0]
  - - [6784, 704, 1, 32, 6784, 6784, 32, 32]
    - [34, 13152.0]
  - - [704, 5888, 1, 256, 704, 704, 256, 256]
    - [22, 17385.0]
  - - [2368, 3584, 1, 1280, 2368, 2368, 1280, 1280]
    - [7, 20364.0]
  - - [3584, 5056, 1, 32, 3584, 3584, 32, 32]
    - [26, 12106.0]
  - - [6784, 1856, 1, 1280, 6784, 6784, 1280, 1280]
    - [12, 20452.0]
  - - [5056, 5056, 1, 3328, 5056, 5056, 3328, 3328]
    - [14, 21492.0]
  - - [2368, 5056, 1, 1, 2368, 2368, 1, 1]
    - [11, 370.0]
  - - [5888, 1408, 1, 256, 5888, 5888, 256, 256]
    - [30, 19611.0]
  - - [2368, 1024, 1, 32, 2368, 2368, 32, 32]
    - [0, 8398.0]
  - - [4288, 1024, 1, 256, 4288, 4288, 256, 256]
    - [14, 18066.0]
  - - [4288, 5888, 1, 1280, 4288, 4288, 1280, 1280]
    - [14, 21616.0]
  - - [1856, 2944, 1, 3328, 1856, 1856, 3328, 3328]
    - [30, 19542.0]
  - - [5056, 5888, 1, 256, 5056, 5056, 256, 256]
    - [14, 20709.0]
  - - [5056, 256, 1, 3328, 5056, 5056, 3328, 3328]
    - [24, 20563.0]
  - - [1024, 5888, 1, 1280, 1024, 1024, 1280, 1280]
    - [30, 20353.0]
  - - [5888, 5056, 1, 1280, 5888, 5888, 1280, 1280]
    - [24, 21660.0]
  - - [5888, 2944, 1, 1, 5888, 5888, 1, 1]
    - [29, 417.0]
  - - [1408, 4288, 1, 3328, 1408, 1408, 3328, 3328]
    - [7, 20312.0]
  - - [704, 2944, 1, 32, 704, 704, 32, 32]
    - [19, 8010.0]
  - - [2944, 4288, 1, 3328, 2944, 2944, 3328, 3328]
    - [24, 20841.0]
  - - [5056, 2944, 1, 256, 5056, 5056, 256, 256]
    - [12, 20032.0]
  - - [2368, 1856, 1, 256, 2368, 2368, 256, 256]
    - [22, 17411.0]
  - - [2368, 4288, 1, 1280, 2368, 2368, 1280, 1280]
    - [32, 20260.0]
  - - [3584, 448, 1, 256, 3584, 3584, 256, 256]
    - [29, 14504.0]
  - - [256, 6784, 1, 256, 256, 256, 256, 256]
    - [12, 16345.0]
  - - [1024, 1408, 1, 1, 1024, 1024, 1, 1]
    - [41, 196.0]
  - - [256, 5888, 1, 1, 256, 256, 1, 1]
    - [28, 277.0]
  - - [2944, 2944, 1, 1, 2944, 2944, 1, 1]
    - [0, 475.0]
  - - [6784, 3584, 1, 256, 6784, 6784, 256, 256]
    - [14, 21041.0]
  - - [1408, 1856, 1, 256, 1408, 1408, 256, 256]
    - [38, 16470.0]
  - - [2944, 2944, 1, 32, 2944, 2944, 32, 32]
    - [34, 10750.0]
  - - [2944, 2944, 1, 3328, 2944, 2944, 3328, 3328]
    - [5, 20716.0]
  - - [6784, 1408, 1, 32, 6784, 6784, 32, 32]
    - [26, 12746.0]
  - - [2368, 6784, 1, 3328, 2368, 2368, 3328, 3328]
    - [14, 19265.0]
  - - [4288, 3584, 1, 32, 4288, 4288, 32, 32]
    - [34, 13327.0]
  - - [3584, 704, 1, 1280, 3584, 3584, 1280, 1280]
    - [46, 16927.0]
  - - [448, 5056, 1, 3328, 448, 448, 3328, 3328]
    - [24, 18252.0]
  - - [4288, 448, 1, 256, 4288, 4288, 256, 256]
    - [30, 13451.0]
  - - [5056, 256, 1, 1280, 5056, 5056, 1280, 1280]
    - [24, 19056.0]
  - - [2944, 5888, 1, 32, 2944, 2944, 32, 32]
    - [41, 15803.0]
  - - [3584, 5056, 1, 256, 3584, 3584, 256, 256]
    - [38, 20182.0]
  - - [3584, 2368, 1, 256, 3584, 3584, 256, 256]
    - [30, 19237.0]
  - - [4288, 4288, 1, 256, 4288, 4288, 256, 256]
    - [14, 19947.0]
  - - [448, 5056, 1, 256, 448, 448, 256, 256]
    - [12, 15471.0]
  - - [4288, 704, 1, 1280, 4288, 4288, 1280, 1280]
    - [12, 17286.0]
  - - [2368, 704, 1, 1, 2368, 2368, 1, 1]
    - [34, 190.0]
  - - [1408, 1856, 1, 1280, 1408, 1408, 1280, 1280]
    - [46, 17672.0]
  - - [3584, 4288, 1, 3328, 3584, 3584, 3328, 3328]
    - [14, 19794.0]
  - - [448, 4288, 1, 32, 448, 448, 32, 32]
    - [41, 5799.0]
  - - [448, 4288, 1, 1280, 448, 448, 1280, 1280]
    - [12, 16286.0]
  - - [5056, 1024, 1, 256, 5056, 5056, 256, 256]
    - [30, 18327.0]
  - - [4288, 3584, 1, 1280, 4288, 4288, 1280, 1280]
    - [7, 21407.0]
  - - [1856, 3584, 1, 32, 1856, 1856, 32, 32]
    - [0, 11262.0]
  - - [5056, 3584, 1, 3328, 5056, 5056, 3328, 3328]
    - [14, 20063.0]
  - - [4288, 5056, 1, 256, 4288, 4288, 256, 256]
    - [24, 20147.0]
  - - [1856, 5888, 1, 256, 1856, 1856, 256, 256]
    - [5, 19265.0]
  - - [2368, 3584, 1, 1, 2368, 2368, 1, 1]
    - [47, 456.0]
  - - [4288, 2368, 1, 256, 4288, 4288, 256, 256]
    - [38, 19173.0]
  - - [1408, 2944, 1, 3328, 1408, 1408, 3328, 3328]
    - [30, 20119.0]
  - - [5888, 3584, 1, 1, 5888, 5888, 1, 1]
    - [26, 833.0]
  - - [6784, 5056, 1, 3328, 6784, 6784, 3328, 3328]
    - [14, 21749.0]
  - - [6784, 5056, 1, 1, 6784, 6784, 1, 1]
    - [36, 791.0]
  - - [5888, 3584, 1, 32, 5888, 5888, 32, 32]
    - [0, 15595.0]
  - - [5888, 3584, 1, 3328, 5888, 5888, 3328, 3328]
    - [14, 19555.0]
  - - [1024, 6784, 1, 256, 1024, 1024, 256, 256]
    - [30, 16815.0]
  - - [6784, 5888, 1, 32, 6784, 6784, 32, 32]
    - [13, 11667.0]
  - - [2368, 6784, 1, 32, 2368, 2368, 32, 32]
    - [8, 13154.0]
  - - [5056, 1408, 1, 1280, 5056, 5056, 1280, 1280]
    - [5, 20533.0]
  - - [3584, 1408, 1, 3328, 3584, 3584, 3328, 3328]
    - [12, 20100.0]
  - - [2944, 3584, 1, 1, 2944, 2944, 1, 1]
    - [27, 454.0]
  - - [2944, 1408, 1, 1280, 2944, 2944, 1280, 1280]
    - [12, 19755.0]
  - - [3584, 1024, 1, 1, 3584, 3584, 1, 1]
    - [27, 344.0]
  - - [2944, 1856, 1, 3328, 2944, 2944, 3328, 3328]
    - [30, 19523.0]
  - - [2944, 3584, 1, 32, 2944, 2944, 32, 32]
    - [34, 13087.0]
  - - [5888, 256, 1, 32, 5888, 5888, 32, 32]
    - [2, 5648.0]
  - - [6784, 5056, 1, 256, 6784, 6784, 256, 256]
    - [14, 20727.0]
  - - [1856, 3584, 1, 1280, 1856, 1856, 1280, 1280]
    - [7, 20155.0]
  - - [256, 5888, 1, 256, 256, 256, 256, 256]
    - [30, 16365.0]
  - - [1024, 4288, 1, 3328, 1024, 1024, 3328, 3328]
    - [40, 20391.0]
  - - [2368, 1408, 1, 1, 2368, 2368, 1, 1]
    - [43, 276.0]
  - - [1024, 1856, 1, 32, 1024, 1024, 32, 32]
    - [8, 6470.0]
  - - [5888, 2368, 1, 1, 5888, 5888, 1, 1]
    - [17, 584.0]
  - - [2368, 2368, 1, 1, 2368, 2368, 1, 1]
    - [41, 391.0]
  - - [704, 4288, 1, 256, 704, 704, 256, 256]
    - [30, 14988.0]
  - - [5888, 2368, 1, 32, 5888, 5888, 32, 32]
    - [26, 15406.0]
  - - [5888, 2368, 1, 1280, 5888, 5888, 1280, 1280]
    - [30, 20536.0]
  - - [2944, 5056, 1, 3328, 2944, 2944, 3328, 3328]
    - [14, 20772.0]
  - - [6784, 704, 1, 3328, 6784, 6784, 3328, 3328]
    - [40, 18958.0]
  - - [1856, 1856, 1, 32, 1856, 1856, 32, 32]
    - [17, 10341.0]
  - - [4288, 2944, 1, 32, 4288, 4288, 32, 32]
    - [34, 15442.0]
  - - [256, 5056, 1, 1, 256, 256, 1, 1]
    - [4, 360.0]
  - - [5056, 5056, 1, 256, 5056, 5056, 256, 256]
    - [40, 20383.0]
  - - [5888, 256, 1, 256, 5888, 5888, 256, 256]
    - [30, 16676.0]
  - - [6784, 6784, 1, 256, 6784, 6784, 256, 256]
    - [22, 21040.0]
  - - [3584, 704, 1, 3328, 3584, 3584, 3328, 3328]
    - [12, 17606.0]
  - - [4288, 704, 1, 3328, 4288, 4288, 3328, 3328]
    - [46, 17427.0]
  - - [4288, 2944, 1, 1280, 4288, 4288, 1280, 1280]
    - [12, 20627.0]
  - - [448, 3584, 1, 256, 448, 448, 256, 256]
    - [22, 15156.0]
  - - [6784, 256, 1, 32, 6784, 6784, 32, 32]
    - [17, 8472.0]
  - - [6784, 1408, 1, 1280, 6784, 6784, 1280, 1280]
    - [12, 20751.0]
  - - [2368, 5056, 1, 1280, 2368, 2368, 1280, 1280]
    - [24, 20636.0]
  - - [1408, 1408, 1, 1280, 1408, 1408, 1280, 1280]
    - [12, 17607.0]
  - - [5888, 1856, 1, 32, 5888, 5888, 32, 32]
    - [34, 13216.0]
  - - [5888, 704, 1, 3328, 5888, 5888, 3328, 3328]
    - [24, 19426.0]
  - - [448, 6784, 1, 256, 448, 448, 256, 256]
    - [22, 15084.0]
  - - [2944, 5888, 1, 256, 2944, 2944, 256, 256]
    - [38, 20801.0]
  - - [1856, 1408, 1, 32, 1856, 1856, 32, 32]
    - [34, 8516.0]
  - - [5888, 2944, 1, 1280, 5888, 5888, 1280, 1280]
    - [12, 21384.0]
  - - [448, 5888, 1, 1, 448, 448, 1, 1]
    - [41, 262.0]
  - - [3584, 1408, 1, 1, 3584, 3584, 1, 1]
    - [26, 371.0]
  - - [448, 5888, 1, 32, 448, 448, 32, 32]
    - [26, 7845.0]
  - - [5056, 704, 1, 1280, 5056, 5056, 1280, 1280]
    - [7, 18470.0]
  - - [1856, 6784, 1, 1, 1856, 1856, 1, 1]
    - [22, 482.0]
  - - [2368, 1024, 1, 256, 2368, 2368, 256, 256]
    - [5, 15404.0]
  - - [1856, 6784, 1, 32, 1856, 1856, 32, 32]
    - [34, 14127.0]
  - - [1856, 6784, 1, 1280, 1856, 1856, 1280, 1280]
    - [30, 20504.0]
  - - [5888, 5056, 1, 3328, 5888, 5888, 3328, 3328]
    - [14, 21766.0]
  - - [1408, 6784, 1, 32, 1408, 1408, 32, 32]
    - [0, 9552.0]
  - - [3584, 5888, 1, 3328, 3584, 3584, 3328, 3328]
    - [40, 21710.0]
  - - [4288, 1408, 1, 256, 4288, 4288, 256, 256]
    - [13, 15672.0]
  - - [6784, 2368, 1, 256, 6784, 6784, 256, 256]
    - [38, 19865.0]
  - - [1856, 1408, 1, 1280, 1856, 1856, 1280, 1280]
    - [12, 17836.0]
  - - [1856, 2368, 1, 1, 1856, 1856, 1, 1]
    - [26, 318.0]
  - - [1408, 5056, 1, 3328, 1408, 1408, 3328, 3328]
    - [14, 20792.0]
  - - [5056, 4288, 1, 256, 5056, 5056, 256, 256]
    - [48, 20074.0]
  - - [5056, 5056, 1, 32, 5056, 5056, 32, 32]
    - [41, 16192.0]
  - - [448, 5888, 1, 1280, 448, 448, 1280, 1280]
    - [7, 17106.0]
  - - [5056, 448, 1, 256, 5056, 5056, 256, 256]
    - [12, 14922.0]
  - - [4288, 5888, 1, 1, 4288, 4288, 1, 1]
    - [8, 801.0]
  - - [1856, 5056, 1, 1280, 1856, 1856, 1280, 1280]
    - [14, 20210.0]
  - - [2368, 4288, 1, 1, 2368, 2368, 1, 1]
    - [31, 386.0]
  - - [3584, 1856, 1, 256, 3584, 3584, 256, 256]
    - [22, 19091.0]
  - - [4288, 5888, 1, 32, 4288, 4288, 32, 32]
    - [34, 16309.0]
  - - [4288, 5888, 1, 3328, 4288, 4288, 3328, 3328]
    - [14, 21649.0]
  - - [1024, 2944, 1, 3328, 1024, 1024, 3328, 3328]
    - [24, 19174.0]
  - - [2944, 2368, 1, 256, 2944, 2944, 256, 256]
    - [7, 17243.0]
  - - [1024, 1856, 1, 256, 1024, 1024, 256, 256]
    - [31, 15436.0]
  - - [1024, 5888, 1, 32, 1024, 1024, 32, 32]
    - [17, 10486.0]
  - - [1024, 5888, 1, 3328, 1024, 1024, 3328, 3328]
    - [12, 20303.0]
  - - [5056, 2368, 1, 32, 5056, 5056, 32, 32]
    - [8, 11666.0]
  - - [1408, 2368, 1, 1280, 1408, 1408, 1280, 1280]
    - [30, 18741.0]
  - - [5056, 6784, 1, 3328, 5056, 5056, 3328, 3328]
    - [14, 21378.0]
  - - [1408, 2944, 1, 256, 1408, 1408, 256, 256]
    - [38, 18462.0]
  - - [704, 5056, 1, 32, 704, 704, 32, 32]
    - [8, 8450.0]
  - - [5056, 4288, 1, 1280, 5056, 5056, 1280, 1280]
    - [24, 21300.0]
  - - [4288, 448, 1, 1, 4288, 4288, 1, 1]
    - [4, 299.0]
  - - [5888, 5888, 1, 1, 5888, 5888, 1, 1]
    - [5, 631.0]
  - - [2944, 704, 1, 1280, 2944, 2944, 1280, 1280]
    - [12, 17857.0]
  - - [1024, 3584, 1, 1280, 1024, 1024, 1280, 1280]
    - [24, 19731.0]
  - - [2368, 2944, 1, 1, 2368, 2368, 1, 1]
    - [41, 423.0]
  - - [5056, 256, 1, 32, 5056, 5056, 32, 32]
    - [6, 4360.0]
  - - [5056, 1024, 1, 1280, 5056, 5056, 1280, 1280]
    - [24, 20838.0]
  - - [3584, 6784, 1, 256, 3584, 3584, 256, 256]
    - [30, 20720.0]
  - - [1856, 1408, 1, 256, 1856, 1856, 256, 256]
    - [38, 16478.0]
  - - [4288, 4288, 1, 32, 4288, 4288, 32, 32]
    - [41, 14828.0]
  - - [5888, 448, 1, 1, 5888, 5888, 1, 1]
    - [0, 374.0]
  - - [5056, 5056, 1, 1280, 5056, 5056, 1280, 1280]
    - [24, 21355.0]
  - - [6784, 1408, 1, 3328, 6784, 6784, 3328, 3328]
    - [12, 20117.0]
  - - [5888, 5888, 1, 3328, 5888, 5888, 3328, 3328]
    - [7, 22099.0]
  - - [5888, 1408, 1, 32, 5888, 5888, 32, 32]
    - [43, 8951.0]
  - - [256, 6784, 1, 3328, 256, 256, 3328, 3328]
    - [7, 18436.0]
  - - [6784, 2368, 1, 1280, 6784, 6784, 1280, 1280]
    - [46, 20595.0]
  - - [2944, 1408, 1, 1, 2944, 2944, 1, 1]
    - [43, 339.0]
  - - [6784, 1024, 1, 256, 6784, 6784, 256, 256]
    - [32, 19440.0]
  - - [5056, 1408, 1, 32, 5056, 5056, 32, 32]
    - [26, 11470.0]
  - - [1408, 6784, 1, 3328, 1408, 1408, 3328, 3328]
    - [12, 19484.0]
  - - [2944, 1408, 1, 3328, 2944, 2944, 3328, 3328]
    - [30, 20074.0]
  - - [704, 2368, 1, 32, 704, 704, 32, 32]
    - [28, 4746.0]
  - - [704, 6784, 1, 1, 704, 704, 1, 1]
    - [0, 309.0]
  - - [2368, 6784, 1, 256, 2368, 2368, 256, 256]
    - [22, 19944.0]
  - - [1856, 3584, 1, 3328, 1856, 1856, 3328, 3328]
    - [7, 20256.0]
  - - [704, 6784, 1, 256, 704, 704, 256, 256]
    - [22, 16958.0]
  - - [6784, 2944, 1, 32, 6784, 6784, 32, 32]
    - [26, 15812.0]
  - - [5888, 2368, 1, 3328, 5888, 5888, 3328, 3328]
    - [38, 20060.0]
  - - [2368, 704, 1, 1280, 2368, 2368, 1280, 1280]
    - [30, 16151.0]
  - - [1024, 1408, 1, 1280, 1024, 1024, 1280, 1280]
    - [30, 16638.0]
  - - [2944, 5056, 1, 32, 2944, 2944, 32, 32]
    - [17, 15637.0]
  - - [704, 2368, 1, 3328, 704, 704, 3328, 3328]
    - [24, 17579.0]
  - - [3584, 2944, 1, 256, 3584, 3584, 256, 256]
    - [30, 20110.0]
  - - [3584, 1024, 1, 1280, 3584, 3584, 1280, 1280]
    - [12, 19405.0]
  - - [5056, 3584, 1, 256, 5056, 5056, 256, 256]
    - [48, 20411.0]
  - - [2368, 704, 1, 256, 2368, 2368, 256, 256]
    - [30, 14788.0]
  - - [1856, 1856, 1, 1280, 1856, 1856, 1280, 1280]
    - [30, 17851.0]
  - - [4288, 704, 1, 1, 4288, 4288, 1, 1]
    - [0, 285.0]
  - - [1856, 1024, 1, 1, 1856, 1856, 1, 1]
    - [41, 228.0]
  - - [4288, 2944, 1, 3328, 4288, 4288, 3328, 3328]
    - [30, 20462.0]
  - - [4288, 704, 1, 32, 4288, 4288, 32, 32]
    - [17, 7828.0]
  - - [1856, 1024, 1, 32, 1856, 1856, 32, 32]
    - [2, 6070.0]
  - - [2944, 6784, 1, 1, 2944, 2944, 1, 1]
    - [34, 871.0]
  - - [6784, 2368, 1, 32, 6784, 6784, 32, 32]
    - [26, 16278.0]
  - - [5888, 5056, 1, 1, 5888, 5888, 1, 1]
    - [17, 864.0]
  - - [704, 5888, 1, 1, 704, 704, 1, 1]
    - [23, 318.0]
  - - [6784, 6784, 1, 1, 6784, 6784, 1, 1]
    - [43, 950.0]
  - - [5888, 448, 1, 3328, 5888, 5888, 3328, 3328]
    - [7, 17282.0]
  - - [704, 5888, 1, 32, 704, 704, 32, 32]
    - [19, 8396.0]
  - - [704, 5888, 1, 1280, 704, 704, 1280, 1280]
    - [14, 19181.0]
  - - [1024, 6784, 1, 3328, 1024, 1024, 3328, 3328]
    - [7, 20148.0]
  - - [704, 2944, 1, 1280, 704, 704, 1280, 1280]
    - [30, 17382.0]
  - - [4288, 6784, 1, 256, 4288, 4288, 256, 256]
    - [30, 20384.0]
  - - [1408, 1408, 1, 32, 1408, 1408, 32, 32]
    - [41, 9248.0]
  - - [1408, 1408, 1, 3328, 1408, 1408, 3328, 3328]
    - [46, 17795.0]
  - - [2944, 1856, 1, 256, 2944, 2944, 256, 256]
    - [38, 17626.0]
  - - [4288, 2944, 1, 1, 4288, 4288, 1, 1]
    - [2, 501.0]
  - - [6784, 5056, 1, 32, 6784, 6784, 32, 32]
    - [34, 16630.0]
  - - [2944, 4288, 1, 1280, 2944, 2944, 1280, 1280]
    - [32, 21178.0]
  - - [1024, 4288, 1, 256, 1024, 1024, 256, 256]
    - [30, 18160.0]
  - - [2368, 5888, 1, 1, 2368, 2368, 1, 1]
    - [50, 402.0]
  - - [1408, 1856, 1, 32, 1408, 1408, 32, 32]
    - [41, 8896.0]
  - - [1856, 6784, 1, 3328, 1856, 1856, 3328, 3328]
    - [38, 19396.0]
  - - [1024, 2368, 1, 32, 1024, 1024, 32, 32]
    - [4, 7080.0]
  - - [2368, 2368, 1, 3328, 2368, 2368, 3328, 3328]
    - [30, 19039.0]
  - - [3584, 5888, 1, 32, 3584, 3584, 32, 32]
    - [34, 14423.0]
  - - [3584, 5888, 1, 1280, 3584, 3584, 1280, 1280]
    - [32, 21797.0]
  - - [6784, 704, 1, 256, 6784, 6784, 256, 256]
    - [12, 17235.0]
  - - [3584, 1024, 1, 32, 3584, 3584, 32, 32]
    - [17, 9291.0]
  - - [2368, 5888, 1, 256, 2368, 2368, 256, 256]
    - [22, 19810.0]
  - - [5888, 5888, 1, 32, 5888, 5888, 32, 32]
    - [45, 12267.0]
  - - [1856, 1408, 1, 3328, 1856, 1856, 3328, 3328]
    - [5, 18096.0]
  - - [4288, 1024, 1, 1, 4288, 4288, 1, 1]
    - [4, 321.0]
  - - [704, 4288, 1, 3328, 704, 704, 3328, 3328]
    - [12, 17430.0]
  - - [2944, 5056, 1, 1280, 2944, 2944, 1280, 1280]
    - [32, 21184.0]
  - - [6784, 2944, 1, 1280, 6784, 6784, 1280, 1280]
    - [12, 21247.0]
  - - [6784, 256, 1, 3328, 6784, 6784, 3328, 3328]
    - [30, 17851.0]
  - - [1408, 5056, 1, 32, 1408, 1408, 32, 32]
    - [41, 11682.0]
  - - [5888, 1856, 1, 1280, 5888, 5888, 1280, 1280]
    - [12, 20310.0]
  - - [5888, 256, 1, 1280, 5888, 5888, 1280, 1280]
    - [12, 17991.0]
  - - [1856, 5056, 1, 1, 1856, 1856, 1, 1]
    - [26, 413.0]
  - - [3584, 1856, 1, 1280, 3584, 3584, 1280, 1280]
    - [30, 20156.0]
  - - [6784, 448, 1, 256, 6784, 6784, 256, 256]
    - [38, 15743.0]
  - - [704, 3584, 1, 256, 704, 704, 256, 256]
    - [12, 15988.0]
  - - [1856, 5056, 1, 32, 1856, 1856, 32, 32]
    - [34, 11954.0]
  - - [1856, 5056, 1, 3328, 1856, 1856, 3328, 3328]
    - [14, 20209.0]
  - - [1024, 2944, 1, 32, 1024, 1024, 32, 32]
    - [26, 7986.0]
  - - [1408, 6784, 1, 256, 1408, 1408, 256, 256]
    - [22, 20043.0]
  - - [1024, 2368, 1, 1280, 1024, 1024, 1280, 1280]
    - [7, 19009.0]
  - - [1856, 3584, 1, 1, 1856, 1856, 1, 1]
    - [41, 416.0]
  - - [2944, 5888, 1, 1280, 2944, 2944, 1280, 1280]
    - [24, 21720.0]
  - - [3584, 3584, 1, 256, 3584, 3584, 256, 256]
    - [22, 20306.0]
  - - [1856, 2368, 1, 3328, 1856, 1856, 3328, 3328]
    - [5, 18782.0]
  - - [5888, 704, 1, 256, 5888, 5888, 256, 256]
    - [46, 17204.0]
  - - [6784, 4288, 1, 256, 6784, 6784, 256, 256]
    - [24, 20528.0]
  - - [1408, 2368, 1, 3328, 1408, 1408, 3328, 3328]
    - [30, 19139.0]
  - - [1024, 3584, 1, 256, 1024, 1024, 256, 256]
    - [5, 17201.0]
  - - [4288, 1024, 1, 32, 4288, 4288, 32, 32]
    - [26, 9418.0]
  - - [5888, 1856, 1, 3328, 5888, 5888, 3328, 3328]
    - [38, 19850.0]
  - - [2368, 3584, 1, 256, 2368, 2368, 256, 256]
    - [30, 18720.0]
  - - [4288, 1408, 1, 3328, 4288, 4288, 3328, 3328]
    - [30, 20356.0]
  - - [256, 5056, 1, 256, 256, 256, 256, 256]
    - [13, 12953.0]
  - - [5888, 2944, 1, 3328, 5888, 5888, 3328, 3328]
    - [22, 20042.0]
  - - [2368, 1408, 1, 3328, 2368, 2368, 3328, 3328]
    - [12, 18959.0]
  - - [5888, 704, 1, 32, 5888, 5888, 32, 32]
    - [8, 9943.0]
  - - [2944, 704, 1, 1, 2944, 2944, 1, 1]
    - [0, 250.0]
  - - [6784, 1856, 1, 256, 6784, 6784, 256, 256]
    - [22, 19543.0]
  - - [1856, 1856, 1, 1, 1856, 1856, 1, 1]
    - [8, 340.0]
  - - [2944, 704, 1, 3328, 2944, 2944, 3328, 3328]
    - [5, 18173.0]
  - - [2368, 1856, 1, 32, 2368, 2368, 32, 32]
    - [0, 11092.0]
  - - [5056, 4288, 1, 3328, 5056, 5056, 3328, 3328]
    - [14, 18961.0]
  - - [3584, 448, 1, 3328, 3584, 3584, 3328, 3328]
    - [5, 16215.0]
  - - [256, 6784, 1, 1, 256, 256, 1, 1]
    - [0, 204.0]
  - - [1024, 3584, 1, 32, 1024, 1024, 32, 32]
    - [34, 8610.0]
  - - [256, 6784, 1, 32, 256, 256, 32, 32]
    - [0, 6134.0]
  - - [2944, 1408, 1, 32, 2944, 2944, 32, 32]
    - [34, 9516.0]
  - - [4288, 3584, 1, 1, 4288, 4288, 1, 1]
    - [21, 580.0]
  - - [5056, 448, 1, 3328, 5056, 5056, 3328, 3328]
    - [24, 17675.0]
  - - [6784, 3584, 1, 32, 6784, 6784, 32, 32]
    - [8, 15437.0]
  - - [4288, 1856, 1, 256, 4288, 4288, 256, 256]
    - [30, 18705.0]
  - - [1856, 2944, 1, 256, 1856, 1856, 256, 256]
    - [5, 18271.0]
  - - [2944, 5888, 1, 1, 2944, 2944, 1, 1]
    - [10, 421.0]
  - - [1024, 1856, 1, 3328, 1024, 1024, 3328, 3328]
    - [46, 18596.0]
  - - [5888, 1024, 1, 32, 5888, 5888, 32, 32]
    - [41, 12432.0]
  - - [1408, 5056, 1, 1280, 1408, 1408, 1280, 1280]
    - [30, 20687.0]
  - - [5056, 6784, 1, 256, 5056, 5056, 256, 256]
    - [22, 20644.0]
  - - [2944, 5056, 1, 1, 2944, 2944, 1, 1]
    - [34, 524.0]
  - - [5888, 5888, 1, 1280, 5888, 5888, 1280, 1280]
    - [7, 22002.0]
  - - [5056, 2944, 1, 1280, 5056, 5056, 1280, 1280]
    - [30, 20728.0]
  - - [2368, 1856, 1, 1280, 2368, 2368, 1280, 1280]
    - [12, 18593.0]
  - - [6784, 2944, 1, 1, 6784, 6784, 1, 1]
    - [22, 530.0]
  - - [2944, 1024, 1, 32, 2944, 2944, 32, 32]
    - [0, 11114.0]
  - - [2944, 1024, 1, 1280, 2944, 2944, 1280, 1280]
    - [7, 19103.0]
  - - [5056, 5056, 1, 1, 5056, 5056, 1, 1]
    - [21, 813.0]
  - - [2368, 4288, 1, 256, 2368, 2368, 256, 256]
    - [30, 18952.0]
  - - [2944, 6784, 1, 1280, 2944, 2944, 1280, 1280]
    - [7, 21327.0]
  - - [256, 6784, 1, 1280, 256, 256, 1280, 1280]
    - [7, 17830.0]
  - - [3584, 2368, 1, 32, 3584, 3584, 32, 32]
    - [17, 12071.0]
  - - [6784, 3584, 1, 3328, 6784, 6784, 3328, 3328]
    - [14, 21839.0]
  - - [2944, 2944, 1, 256, 2944, 2944, 256, 256]
    - [38, 19439.0]
  - - [1408, 1024, 1, 3328, 1408, 1408, 3328, 3328]
    - [30, 17138.0]
  - - [5056, 2368, 1, 1280, 5056, 5056, 1280, 1280]
    - [30, 20128.0]
  - - [2944, 1024, 1, 1, 2944, 2944, 1, 1]
    - [2, 322.0]
  - - [3584, 704, 1, 256, 3584, 3584, 256, 256]
    - [46, 15731.0]
  - - [2368, 5888, 1, 3328, 2368, 2368, 3328, 3328]
    - [14, 20358.0]
  - - [4288, 2368, 1, 1, 4288, 4288, 1, 1]
    - [34, 527.0]
  - - [1408, 3584, 1, 32, 1408, 1408, 32, 32]
    - [34, 10391.0]
  - - [2944, 4288, 1, 32, 2944, 2944, 32, 32]
    - [34, 13722.0]
  - - [5888, 1408, 1, 1280, 5888, 5888, 1280, 1280]
    - [46, 20573.0]
  - - [3584, 5056, 1, 1280, 3584, 3584, 1280, 1280]
    - [7, 21438.0]
  - - [5888, 6784, 1, 1280, 5888, 5888, 1280, 1280]
    - [32, 21478.0]
  - - [3584, 2944, 1, 1, 3584, 3584, 1, 1]
    - [13, 336.0]
  - - [1024, 1856, 1, 1, 1024, 1024, 1, 1]
    - [26, 321.0]
  - - [704, 5056, 1, 3328, 704, 704, 3328, 3328]
    - [7, 19401.0]
  - - [1024, 3584, 1, 3328, 1024, 1024, 3328, 3328]
    - [7, 20000.0]
  - - [5888, 256, 1, 3328, 5888, 5888, 3328, 3328]
    - [30, 17946.0]
  - - [1856, 1408, 1, 1, 1856, 1856, 1, 1]
    - [0, 279.0]
  - - [4288, 5056, 1, 1280, 4288, 4288, 1280, 1280]
    - [7, 21254.0]
  - - [1856, 1856, 1, 3328, 1856, 1856, 3328, 3328]
    - [5, 18250.0]
  - - [1024, 2368, 1, 256, 1024, 1024, 256, 256]
    - [30, 15155.0]
  - - [4288, 2368, 1, 3328, 4288, 4288, 3328, 3328]
    - [30, 19819.0]
  - - [5888, 3584, 1, 256, 5888, 5888, 256, 256]
    - [24, 20767.0]
  - - [1024, 5056, 1, 32, 1024, 1024, 32, 32]
    - [4, 9769.0]
  - - [5888, 448, 1, 1280, 5888, 5888, 1280, 1280]
    - [24, 16620.0]
  - - [704, 5888, 1, 3328, 704, 704, 3328, 3328]
    - [7, 19431.0]
  - - [1024, 1408, 1, 256, 1024, 1024, 256, 256]
    - [30, 13783.0]
  - - [3584, 2944, 1, 1280, 3584, 3584, 1280, 1280]
    - [12, 20709.0]
  - - [4288, 1856, 1, 1280, 4288, 4288, 1280, 1280]
    - [30, 19659.0]
  - - [3584, 5888, 1, 1, 3584, 3584, 1, 1]
    - [34, 494.0]
  - - [5888, 4288, 1, 256, 5888, 5888, 256, 256]
    - [14, 20210.0]
  - - [1024, 2944, 1, 1280, 1024, 1024, 1280, 1280]
    - [24, 18945.0]
  - - [2944, 3584, 1, 256, 2944, 2944, 256, 256]
    - [22, 20011.0]
  - - [5888, 1856, 1, 1, 5888, 5888, 1, 1]
    - [11, 382.0]
  - - [6784, 2368, 1, 3328, 6784, 6784, 3328, 3328]
    - [12, 19571.0]
  - - [1408, 4288, 1, 32, 1408, 1408, 32, 32]
    - [26, 10523.0]
  - - [1856, 1024, 1, 1280, 1856, 1856, 1280, 1280]
    - [40, 19005.0]
  - - [5888, 1856, 1, 256, 5888, 5888, 256, 256]
    - [46, 18741.0]
  - - [5056, 1856, 1, 1, 5056, 5056, 1, 1]
    - [34, 427.0]
  - - [5888, 2368, 1, 256, 5888, 5888, 256, 256]
    - [38, 19683.0]
  - - [1408, 1024, 1, 32, 1408, 1408, 32, 32]
    - [19, 8389.0]
  - - [5056, 1856, 1, 32, 5056, 5056, 32, 32]
    - [4, 11392.0]
  - - [5056, 1856, 1, 1280, 5056, 5056, 1280, 1280]
    - [12, 19924.0]
  - - [1408, 5888, 1, 3328, 1408, 1408, 3328, 3328]
    - [38, 20108.0]
  - - [5056, 704, 1, 3328, 5056, 5056, 3328, 3328]
    - [7, 18871.0]
  - - [5888, 6784, 1, 1, 5888, 5888, 1, 1]
    - [39, 750.0]
  - - [5888, 4288, 1, 32, 5888, 5888, 32, 32]
    - [26, 14290.0]
  - - [1408, 3584, 1, 256, 1408, 1408, 256, 256]
    - [12, 18771.0]
  - - [6784, 256, 1, 1, 6784, 6784, 1, 1]
    - [10, 220.0]
  - - [6784, 256, 1, 1280, 6784, 6784, 1280, 1280]
    - [30, 17187.0]
  - - [2368, 704, 1, 3328, 2368, 2368, 3328, 3328]
    - [46, 16776.0]
  - - [2944, 1856, 1, 32, 2944, 2944, 32, 32]
    - [26, 10688.0]
  - - [2368, 1408, 1, 256, 2368, 2368, 256, 256]
    - [30, 16452.0]
  - - [2368, 1856, 1, 1, 2368, 2368, 1, 1]
    - [11, 439.0]
  - - [4288, 1408, 1, 1, 4288, 4288, 1, 1]
    - [26, 398.0]
  - - [3584, 2368, 1, 1280, 3584, 3584, 1280, 1280]
    - [12, 20094.0]
  - - [1408, 2944, 1, 1, 1408, 1408, 1, 1]
    - [45, 367.0]
  - - [4288, 1408, 1, 32, 4288, 4288, 32, 32]
    - [8, 10052.0]
  - - [5888, 2944, 1, 256, 5888, 5888, 256, 256]
    - [38, 20512.0]
  - - [1408, 2944, 1, 32, 1408, 1408, 32, 32]
    - [34, 9668.0]
  - - [5888, 6784, 1, 256, 5888, 5888, 256, 256]
    - [30, 20863.0]
  - - [6784, 5888, 1, 1, 6784, 6784, 1, 1]
    - [35, 943.0]
  - - [6784, 5888, 1, 1280, 6784, 6784, 1280, 1280]
    - [24, 21841.0]
  - - [1024, 4288, 1, 32, 1024, 1024, 32, 32]
    - [8, 8394.0]
  - - [3584, 5888, 1, 256, 3584, 3584, 256, 256]
    - [22, 20514.0]
  - - [5056, 2368, 1, 1, 5056, 5056, 1, 1]
    - [34, 512.0]
  - - [5056, 448, 1, 1, 5056, 5056, 1, 1]
    - [26, 332.0]
  - - [2368, 1024, 1, 1280, 2368, 2368, 1280, 1280]
    - [24, 19197.0]
  - - [1856, 6784, 1, 256, 1856, 1856, 256, 256]
    - [22, 19500.0]
  - - [5056, 448, 1, 32, 5056, 5056, 32, 32]
    - [26, 7965.0]
  - - [3584, 2944, 1, 32, 3584, 3584, 32, 32]
    - [17, 10281.0]
  - - [3584, 1856, 1, 32, 3584, 3584, 32, 32]
    - [0, 9641.0]
  - - [4288, 1408, 1, 1280, 4288, 4288, 1280, 1280]
    - [12, 20079.0]
  - - [6784, 2368, 1, 1, 6784, 6784, 1, 1]
    - [0, 395.0]
  - - [704, 5056, 1, 1, 704, 704, 1, 1]
    - [34, 322.0]
  - - [2368, 1408, 1, 1280, 2368, 2368, 1280, 1280]
    - [12, 18922.0]
  - - [5888, 1408, 1, 1, 5888, 5888, 1, 1]
    - [19, 455.0]
  - - [1024, 4288, 1, 1280, 1024, 1024, 1280, 1280]
    - [7, 19461.0]
  - - [1856, 4288, 1, 1, 1856, 1856, 1, 1]
    - [0, 491.0]
  - - [3584, 4288, 1, 256, 3584, 3584, 256, 256]
    - [38, 19848.0]
  - - [2368, 2944, 1, 256, 2368, 2368, 256, 256]
    - [5, 19030.0]
  - - [704, 5056, 1, 256, 704, 704, 256, 256]
    - [38, 17038.0]
  - - [1856, 4288, 1, 32, 1856, 1856, 32, 32]
    - [17, 10585.0]
  - - [4288, 1024, 1, 1280, 4288, 4288, 1280, 1280]
    - [32, 20044.0]
  - - [4288, 6784, 1, 32, 4288, 4288, 32, 32]
    - [26, 15494.0]
  - - [3584, 1408, 1, 256, 3584, 3584, 256, 256]
    - [46, 18205.0]
  - - [704, 3584, 1, 3328, 704, 704, 3328, 3328]
    - [5, 17293.0]
  - - [5056, 448, 1, 1280, 5056, 5056, 1280, 1280]
    - [40, 16957.0]
  - - [1408, 2944, 1, 1280, 1408, 1408, 1280, 1280]
    - [46, 19701.0]
  - - [5888, 704, 1, 1280, 5888, 5888, 1280, 1280]
    - [40, 18635.0]
  - - [4288, 5888, 1, 256, 4288, 4288, 256, 256]
    - [48, 20537.0]
  - - [3584, 3584, 1, 3328, 3584, 3584, 3328, 3328]
    - [14, 20767.0]
  - - [2944, 6784, 1, 32, 2944, 2944, 32, 32]
    - [41, 14939.0]
  - - [5056, 256, 1, 1, 5056, 5056, 1, 1]
    - [41, 285.0]
  - - [2944, 2368, 1, 3328, 2944, 2944, 3328, 3328]
    - [5, 20460.0]
  - - [1024, 1856, 1, 1280, 1024, 1024, 1280, 1280]
    - [46, 18231.0]
  - - [448, 5888, 1, 256, 448, 448, 256, 256]
    - [22, 14234.0]
  - - [1024, 5888, 1, 256, 1024, 1024, 256, 256]
    - [12, 18410.0]
  - - [6784, 2944, 1, 3328, 6784, 6784, 3328, 3328]
    - [22, 19681.0]
  - - [1408, 2368, 1, 256, 1408, 1408, 256, 256]
    - [21, 13459.0]
  - - [1408, 5056, 1, 256, 1408, 1408, 256, 256]
    - [22, 18800.0]
  - - [1024, 1408, 1, 32, 1024, 1024, 32, 32]
    - [50, 6373.0]
  - - [6784, 704, 1, 1, 6784, 6784, 1, 1]
    - [34, 393.0]
  - - [704, 3584, 1, 32, 704, 704, 32, 32]
    - [47, 8026.0]
  - - [4288, 4288, 1, 1, 4288, 4288, 1, 1]
    - [35, 672.0]
  - - [5056, 2944, 1, 1, 5056, 5056, 1, 1]
    - [34, 626.0]
  - - [6784, 4288, 1, 3328, 6784, 6784, 3328, 3328]
    - [14, 21662.0]
  - - [5056, 2944, 1, 3328, 5056, 5056, 3328, 3328]
    - [22, 20343.0]
  - - [2368, 1856, 1, 3328, 2368, 2368, 3328, 3328]
    - [12, 18702.0]
  - - [1856, 4288, 1, 1280, 1856, 1856, 1280, 1280]
    - [24, 20355.0]
  - - [3584, 448, 1, 1, 3584, 3584, 1, 1]
    - [29, 302.0]
  - - [2944, 1024, 1, 3328, 2944, 2944, 3328, 3328]
    - [24, 19418.0]
  - - [5888, 5056, 1, 32, 5888, 5888, 32, 32]
    - [17, 14960.0]
  - - [704, 2944, 1, 1, 704, 704, 1, 1]
    - [9, 260.0]
  - - [3584, 448, 1, 32, 3584, 3584, 32, 32]
    - [4, 7019.0]
  - - [3584, 448, 1, 1280, 3584, 3584, 1280, 1280]
    - [12, 15763.0]
  - - [2944, 6784, 1, 3328, 2944, 2944, 3328, 3328]
    - [40, 21456.0]
  - - [1856, 2368, 1, 1280, 1856, 1856, 1280, 1280]
    - [46, 18009.0]
  - - [6784, 1024, 1, 1280, 6784, 6784, 1280, 1280]
    - [48, 21030.0]
  - - [6784, 3584, 1, 1280, 6784, 6784, 1280, 1280]
    - [7, 21898.0]
  - - [1408, 1408, 1, 1, 1408, 1408, 1, 1]
    - [10, 324.0]
  - - [1408, 4288, 1, 256, 1408, 1408, 256, 256]
    - [22, 19086.0]
  - - [256, 5056, 1, 3328, 256, 256, 3328, 3328]
    - [7, 20005.0]
  - - [448, 6784, 1, 1, 448, 448, 1, 1]
    - [27, 252.0]
  - - [704, 2944, 1, 256, 704, 704, 256, 256]
    - [12, 14689.0]
  - - [1408, 1408, 1, 256, 1408, 1408, 256, 256]
    - [22, 15069.0]
  - - [448, 6784, 1, 32, 448, 448, 32, 32]
    - [41, 8531.0]
  - - [1408, 1856, 1, 1, 1408, 1408, 1, 1]
    - [11, 417.0]
  - - [4288, 448, 1, 32, 4288, 4288, 32, 32]
    - [17, 5980.0]
  - - [4288, 448, 1, 1280, 4288, 4288, 1280, 1280]
    - [46, 16289.0]
  - - [2944, 704, 1, 32, 2944, 2944, 32, 32]
    - [17, 6810.0]
  - - [448, 4288, 1, 1, 448, 448, 1, 1]
    - [43, 195.0]
  - - [3584, 5056, 1, 1, 3584, 3584, 1, 1]
    - [29, 798.0]
  - - [1408, 3584, 1, 1280, 1408, 1408, 1280, 1280]
    - [24, 20299.0]
  - - [6784, 448, 1, 1280, 6784, 6784, 1280, 1280]
    - [46, 16961.0]
  - - [3584, 5056, 1, 3328, 3584, 3584, 3328, 3328]
    - [14, 19576.0]
  - - [2368, 2368, 1, 32, 2368, 2368, 32, 32]
    - [45, 9892.0]
  - - [5888, 2944, 1, 32, 5888, 5888, 32, 32]
    - [9, 15794.0]
  - - [1856, 2944, 1, 32, 1856, 1856, 32, 32]
    - [0, 10358.0]
  - - [5056, 1408, 1, 1, 5056, 5056, 1, 1]
    - [41, 417.0]
  - - [5888, 1408, 1, 3328, 5888, 5888, 3328, 3328]
    - [12, 20155.0]
  - - [448, 4288, 1, 256, 448, 448, 256, 256]
    - [38, 13555.0]
  - - [6784, 1024, 1, 1, 6784, 6784, 1, 1]
    - [42, 487.0]
  - - [6784, 1024, 1, 32, 6784, 6784, 32, 32]
    - [43, 12674.0]
  - - [6784, 3584, 1, 1, 6784, 6784, 1, 1]
    - [34, 859.0]
  - - [2944, 2368, 1, 32, 2944, 2944, 32, 32]
    - [26, 11571.0]
  - - [3584, 6784, 1, 3328, 3584, 3584, 3328, 3328]
    - [7, 21521.0]
  - - [6784, 1408, 1, 256, 6784, 6784, 256, 256]
    - [38, 19628.0]
  - - [5056, 1024, 1, 32, 5056, 5056, 32, 32]
    - [41, 9655.0]
  - - [1024, 5056, 1, 1280, 1024, 1024, 1280, 1280]
    - [7, 20663.0]
  - - [4288, 3584, 1, 256, 4288, 4288, 256, 256]
    - [14, 20332.0]
  - - [448, 6784, 1, 1280, 448, 448, 1280, 1280]
    - [12, 17367.0]
  - - [1856, 5888, 1, 1, 1856, 1856, 1, 1]
    - [4, 453.0]
  - - [256, 5888, 1, 32, 256, 256, 32, 32]
    - [8, 5688.0]
  - - [4288, 5056, 1, 32, 4288, 4288, 32, 32]
    - [17, 15949.0]
  - - [4288, 5056, 1, 3328, 4288, 4288, 3328, 3328]
    - [32, 19736.0]
  - - [1856, 5888, 1, 32, 1856, 1856, 32, 32]
    - [27, 10316.0]
  - - [1856, 5888, 1, 1280, 1856, 1856, 1280, 1280]
    - [7, 20562.0]
  - - [704, 2368, 1, 1280, 704, 704, 1280, 1280]
    - [24, 17261.0]
  - - [4288, 2368, 1, 1280, 4288, 4288, 1280, 1280]
    - [30, 20018.0]
  - - [2944, 5056, 1, 256, 2944, 2944, 256, 256]
    - [5, 20136.0]
  - - [2944, 4288, 1, 1, 2944, 2944, 1, 1]
    - [34, 378.0]
  - - [5056, 5888, 1, 32, 5056, 5056, 32, 32]
    - [34, 16295.0]
  - - [2368, 5056, 1, 3328, 2368, 2368, 3328, 3328]
    - [7, 20832.0]
  - - [1024, 5056, 1, 3328, 1024, 1024, 3328, 3328]
    - [7, 21239.0]
  - - [1024, 6784, 1, 32, 1024, 1024, 32, 32]
    - [17, 11027.0]
  - - [3584, 2944, 1, 3328, 3584, 3584, 3328, 3328]
    - [38, 20407.0]
  - - [1408, 5888, 1, 1, 1408, 1408, 1, 1]
    - [2, 437.0]
  - - [704, 4288, 1, 32, 704, 704, 32, 32]
    - [41, 7318.0]
  - - [1408, 5888, 1, 32, 1408, 1408, 32, 32]
    - [41, 12259.0]
  - - [6784, 1024, 1, 3328, 6784, 6784, 3328, 3328]
    - [48, 21329.0]
  - - [5056, 1408, 1, 256, 5056, 5056, 256, 256]
    - [46, 19634.0]
  - - [2944, 1408, 1, 256, 2944, 2944, 256, 256]
    - [38, 19231.0]
  - - [2368, 2368, 1, 256, 2368, 2368, 256, 256]
    - [30, 18043.0]
  - - [1408, 6784, 1, 1, 1408, 1408, 1, 1]
    - [8, 353.0]
  - - [6784, 6784, 1, 1280, 6784, 6784, 1280, 1280]
    - [7, 21466.0]
  - - [1024, 5888, 1, 1, 1024, 1024, 1, 1]
    - [9, 300.0]
  - - [1856, 3584, 1, 256, 1856, 1856, 256, 256]
    - [38, 18514.0]
  - - [2368, 704, 1, 32, 2368, 2368, 32, 32]
    - [26, 7578.0]
  - - [256, 5888, 1, 1280, 256, 256, 1280, 1280]
    - [30, 17363.0]
  - - [1856, 1024, 1, 3328, 1856, 1856, 3328, 3328]
    - [24, 19949.0]
  - - [5056, 2368, 1, 3328, 5056, 5056, 3328, 3328]
    - [22, 20019.0]
  - - [704, 4288, 1, 1280, 704, 704, 1280, 1280]
    - [12, 16940.0]
  - - [2560, 7000, 1, 2560, 2560, 2560, 2560, 2560]
    - [7, 20163.0]
  - - [7680, 12000, 1, 2560, 7680, 7680, 2560, 2560]
    - [14, 20994.0]
  - - [5124, 9124, 1, 1760, 5124, 5124, 1760, 1760]
    - [20, 21637.0]
  - - [512, 24000, 1, 1536, 512, 512, 1536, 1536]
    - [14, 20471.0]
  - - [3072, 24000, 1, 1024, 3072, 3072, 1024, 1024]
    - [14, 21144.0]
  - - [512, 48000, 1, 2816, 512, 512, 2816, 2816]
    - [14, 21251.0]
  - - [512, 48000, 1, 2048, 512, 512, 2048, 2048]
    - [12, 20188.0]
  - - [2048, 1600, 1, 2048, 2048, 2048, 2048, 2048]
    - [12, 17075.0]
  - - [512, 48000, 1, 1536, 512, 512, 1536, 1536]
    - [14, 20784.0]
  - - [8448, 5984, 1, 2816, 8448, 8448, 2816, 2816]
    - [32, 21584.0]
  - - [4096, 3200, 1, 1024, 4096, 4096, 1024, 1024]
    - [12, 20505.0]
  - - [1024, 24000, 1, 2560, 1024, 1024, 2560, 2560]
    - [14, 20457.0]
  - - [1760, 6400, 1, 1760, 1760, 1760, 1760, 1760]
    - [20, 21517.0]
  - - [5124, 9124, 1, 2048, 5124, 5124, 2048, 2048]
    - [48, 20678.0]
  - - [16384, 3200, 1, 4096, 16384, 16384, 4096, 4096]
    - [14, 19126.0]
  - - [1024, 48000, 1, 2560, 1024, 1024, 2560, 2560]
    - [14, 20457.0]
  - - [8448, 48000, 1, 2816, 8448, 8448, 2816, 2816]
    - [14, 22113.0]
  - - [2560, 3200, 1, 2560, 2560, 2560, 2560, 2560]
    - [14, 20580.0]
  - - [16384, 800, 1, 4096, 16384, 16384, 4096, 4096]
    - [22, 16684.0]
  - - [4608, 24000, 1, 1536, 4608, 4608, 1536, 1536]
    - [14, 21770.0]
  - - [7680, 48000, 1, 2560, 7680, 7680, 2560, 2560]
    - [14, 21803.0]
  - - [3072, 48000, 1, 1024, 3072, 3072, 1024, 1024]
    - [14, 21401.0]
  - - [8192, 3200, 1, 2048, 8192, 8192, 2048, 2048]
    - [12, 17808.0]
  - - [512, 24000, 1, 2816, 512, 512, 2816, 2816]
    - [40, 21451.0]
  - - [4096, 400, 1, 1024, 4096, 4096, 1024, 1024]
    - [12, 14189.0]
  - - [6144, 48000, 1, 2560, 6144, 6144, 2560, 2560]
    - [14, 21137.0]
  - - [4608, 48000, 1, 1536, 4608, 4608, 1536, 1536]
    - [14, 21261.0]
  - - [2048, 800, 1, 512, 2048, 2048, 512, 512]
    - [31, 12505.0]
  - - [4608, 5984, 1, 1536, 4608, 4608, 1536, 1536]
    - [14, 21211.0]
  - - [4096, 1600, 1, 1024, 4096, 4096, 1024, 1024]
    - [12, 19140.0]
  - - [6144, 5984, 1, 2048, 6144, 6144, 2048, 2048]
    - [12, 21005.0]
  - - [7680, 24000, 1, 2560, 7680, 7680, 2560, 2560]
    - [14, 21546.0]
  - - [6144, 48000, 1, 2048, 6144, 6144, 2048, 2048]
    - [12, 20151.0]
  - - [2048, 3200, 1, 2048, 2048, 2048, 2048, 2048]
    - [12, 19650.0]
  - - [5124, 9124, 1, 2560, 5124, 5124, 2560, 2560]
    - [14, 21176.0]
  - - [1024, 24000, 1, 1536, 1024, 1024, 1536, 1536]
    - [14, 20576.0]
  - - [2560, 6400, 1, 2560, 2560, 2560, 2560, 2560]
    - [14, 21058.0]
  - - [512, 24000, 1, 2560, 512, 512, 2560, 2560]
    - [14, 20450.0]
  - - [1024, 24000, 1, 2816, 1024, 1024, 2816, 2816]
    - [14, 21399.0]
  - - [7680, 5984, 1, 2560, 7680, 7680, 2560, 2560]
    - [14, 21391.0]
  - - [2048, 1600, 1, 512, 2048, 2048, 512, 512]
    - [46, 14985.0]
  - - [2048, 7000, 1, 2048, 2048, 2048, 2048, 2048]
    - [12, 19754.0]
  - - [1760, 800, 1, 1760, 1760, 1760, 1760, 1760]
    - [22, 16674.0]
  - - [2560, 1600, 1, 2560, 2560, 2560, 2560, 2560]
    - [48, 18922.0]
  - - [2048, 3200, 1, 512, 2048, 2048, 512, 512]
    - [12, 19944.0]
  - - [2560, 800, 1, 2560, 2560, 2560, 2560, 2560]
    - [30, 16877.0]
  - - [4608, 12000, 1, 1536, 4608, 4608, 1536, 1536]
    - [14, 21674.0]
  - - [6144, 24000, 1, 2048, 6144, 6144, 2048, 2048]
    - [12, 19072.0]
  - - [8192, 800, 1, 2048, 8192, 8192, 2048, 2048]
    - [12, 17826.0]
  - - [5124, 9124, 1, 4096, 5124, 5124, 4096, 4096]
    - [48, 18374.0]
  - - [8448, 24000, 1, 2816, 8448, 8448, 2816, 2816]
    - [32, 21879.0]
  - - [1024, 48000, 1, 1536, 1024, 1024, 1536, 1536]
    - [14, 21016.0]
  - - [8192, 1600, 1, 2048, 8192, 8192, 2048, 2048]
    - [12, 19709.0]
  - - [4096, 800, 1, 1024, 4096, 4096, 1024, 1024]
    - [12, 16422.0]
  - - [2048, 800, 1, 2048, 2048, 2048, 2048, 2048]
    - [12, 15604.0]
  - - [1760, 3200, 1, 1760, 1760, 1760, 1760, 1760]
    - [38, 20038.0]
  - - [512, 48000, 1, 2560, 512, 512, 2560, 2560]
    - [14, 21015.0]
  - - [512, 24000, 1, 2048, 512, 512, 2048, 2048]
    - [12, 20235.0]
  - - [16384, 1600, 1, 4096, 16384, 16384, 4096, 4096]
    - [14, 18272.0]
  - - [1024, 24000, 1, 2048, 1024, 1024, 2048, 2048]
    - [12, 19949.0]
  - - [8192, 400, 1, 2048, 8192, 8192, 2048, 2048]
    - [12, 14926.0]
  - - [2048, 6400, 1, 2048, 2048, 2048, 2048, 2048]
    - [12, 20055.0]
  - - [6144, 12000, 1, 2048, 6144, 6144, 2048, 2048]
    - [14, 20261.0]
  - - [1760, 7000, 1, 1760, 1760, 1760, 1760, 1760]
    - [20, 21327.0]
  - - [1024, 48000, 1, 2816, 1024, 1024, 2816, 2816]
    - [14, 21547.0]
  - - [4096, 7000, 1, 4096, 4096, 4096, 4096, 4096]
    - [15, 12961.0]
  - - [6144, 24000, 1, 2560, 6144, 6144, 2560, 2560]
    - [14, 20830.0]
  - - [8448, 12000, 1, 2816, 8448, 8448, 2816, 2816]
    - [14, 21578.0]
  - - [16384, 400, 1, 4096, 16384, 16384, 4096, 4096]
    - [14, 15899.0]
  - - [1760, 1600, 1, 1760, 1760, 1760, 1760, 1760]
    - [3, 18970.0]
  - - [1024, 48000, 1, 2048, 1024, 1024, 2048, 2048]
    - [12, 20153.0]
  - - [4096, 4096, 1, 4096, 4096, 4096, 4096, 4096]
    - [16, 16082.0]
  - - [2048, 2048, 1, 2049, 2048, 2048, 2049, 2049]
    - [22, 19802.0]
  - - [8192, 8191, 1, 8192, 8192, 8192, 8192, 8192]
    - [14, 18346.0]
  - - [8192, 8192, 1, 8192, 8192, 8192, 8192, 8192]
    - [14, 18444.0]
  - - [2047, 2048, 1, 2048, 2047, 2047, 2048, 2048]
    - [14, 18086.0]
  - - [2048, 2049, 1, 2048, 2048, 2048, 2048, 2048]
    - [12, 17489.0]
  - - [8192, 8192, 1, 8191, 8192, 8192, 8191, 8191]
    - [7, 21993.0]
  - - [3072, 513, 1, 3072, 3072, 3072, 3072, 3072]
    - [30, 14516.0]
  - - [8191, 8192, 1, 8192, 8191, 8191, 8192, 8192]
    - [14, 18180.0]
  - - [8192, 8193, 1, 8192, 8192, 8192, 8192, 8192]
    - [14, 17986.0]
  - - [4096, 4097, 1, 4096, 4096, 4096, 4096, 4096]
    - [16, 15468.0]
  - - [8192, 8192, 1, 8193, 8192, 8192, 8193, 8193]
    - [14, 21941.0]
  - - [4096, 4095, 1, 4096, 4096, 4096, 4096, 4096]
    - [16, 16317.0]
  - - [4096, 4096, 1, 4097, 4096, 4096, 4097, 4097]
    - [32, 20336.0]
  - - [2048, 2048, 1, 2048, 2048, 2048, 2048, 2048]
    - [14, 18274.0]
  - - [4095, 4096, 1, 4096, 4095, 4095, 4096, 4096]
    - [16, 16260.0]
  - - [8193, 8192, 1, 8192, 8193, 8193, 8192, 8192]
    - [14, 18198.0]
  - - [4096, 4096, 1, 4095, 4096, 4096, 4095, 4095]
    - [24, 20160.0]
  - - [3072, 511, 1, 3072, 3072, 3072, 3072, 3072]
    - [13, 16595.0]
  - - [2049, 2048, 1, 2048, 2049, 2049, 2048, 2048]
    - [14, 18739.0]
  - - [2048, 2047, 1, 2048, 2048, 2048, 2048, 2048]
    - [14, 18228.0]
  - - [2048, 2048, 1, 2047, 2048, 2048, 2047, 2047]
    - [5, 20172.0]
  - - [4097, 4096, 1, 4096, 4097, 4097, 4096, 4096]
    - [48, 19036.0]
  - - [128, 128, 512, 64, 128, 128, 64, 64]
    - [39, 11360.0]
  - - [512, 512, 64, 64, 512, 512, 64, 64]
    - [31, 16973.0]
  - - [1024, 2048, 1, 1024, 1024, 1024, 1024, 1024]
    - [12, 17462.0]
  - - [1024, 2048, 1, 4096, 1024, 1024, 4096, 4096]
    - [30, 16872.0]
  - - [1024, 4096, 1, 1024, 1024, 1024, 1024, 1024]
    - [12, 19731.0]
  - - [1024, 4096, 1, 4096, 1024, 1024, 4096, 4096]
    - [14, 19104.0]
  - - [4096, 2048, 1, 1024, 4096, 4096, 1024, 1024]
    - [14, 20696.0]
  - - [4096, 4096, 1, 1024, 4096, 4096, 1024, 1024]
    - [14, 21315.0]
  - - [30528, 2048, 1, 1024, 30528, 30528, 1024, 1024]
    - [14, 21379.0]
  - - [30528, 4096, 1, 1024, 30528, 30528, 1024, 1024]
    - [14, 21452.0]
  - - [128, 32768, 1, 256, 128, 128, 256, 256]
    - [46, 18392.0]
  - - [256, 4608, 1, 1024, 256, 256, 1024, 1024]
    - [14, 17859.0]
  - - [256, 4864, 1, 1024, 256, 256, 1024, 1024]
    - [48, 17828.0]
  - - [256, 5376, 1, 1024, 256, 256, 1024, 1024]
    - [12, 15655.0]
  - - [256, 5888, 1, 1024, 256, 256, 1024, 1024]
    - [12, 16847.0]
  - - [256, 6144, 1, 1024, 256, 256, 1024, 1024]
    - [12, 17549.0]
  - - [256, 6400, 1, 1024, 256, 256, 1024, 1024]
    - [12, 18102.0]
  - - [256, 6656, 1, 1024, 256, 256, 1024, 1024]
    - [12, 16739.0]
  - - [256, 7168, 1, 1024, 256, 256, 1024, 1024]
    - [14, 17896.0]
  - - [256, 7424, 1, 1024, 256, 256, 1024, 1024]
    - [14, 18496.0]
  - - [256, 7936, 1, 1024, 256, 256, 1024, 1024]
    - [12, 17188.0]
  - - [256, 8192, 1, 1024, 256, 256, 1024, 1024]
    - [12, 17637.0]
  - - [256, 8448, 1, 1024, 256, 256, 1024, 1024]
    - [12, 18248.0]
  - - [256, 8960, 1, 1024, 256, 256, 1024, 1024]
    - [12, 18594.0]
  - - [256, 9984, 1, 1024, 256, 256, 1024, 1024]
    - [14, 19093.0]
  - - [256, 10496, 1, 1024, 256, 256, 1024, 1024]
    - [12, 17871.0]
  - - [256, 11264, 1, 1024, 256, 256, 1024, 1024]
    - [12, 18786.0]
  - - [256, 11520, 1, 1024, 256, 256, 1024, 1024]
    - [12, 19101.0]
  - - [256, 11776, 1, 1024, 256, 256, 1024, 1024]
    - [14, 18621.0]
  - - [256, 12544, 1, 1024, 256, 256, 1024, 1024]
    - [32, 19495.0]
  - - [256, 13312, 1, 1024, 256, 256, 1024, 1024]
    - [12, 18814.0]
  - - [256, 14336, 1, 1024, 256, 256, 1024, 1024]
    - [32, 18940.0]
  - - [256, 14592, 1, 1024, 256, 256, 1024, 1024]
    - [48, 19078.0]
  - - [256, 14848, 1, 1024, 256, 256, 1024, 1024]
    - [32, 19481.0]
  - - [256, 15104, 1, 1024, 256, 256, 1024, 1024]
    - [48, 19758.0]
  - - [256, 16128, 1, 1024, 256, 256, 1024, 1024]
    - [12, 19207.0]
  - - [256, 18176, 1, 1024, 256, 256, 1024, 1024]
    - [46, 19512.0]
  - - [256, 18944, 1, 1024, 256, 256, 1024, 1024]
    - [12, 20018.0]
  - - [256, 19200, 1, 1024, 256, 256, 1024, 1024]
    - [12, 20256.0]
  - - [256, 20480, 1, 1024, 256, 256, 1024, 1024]
    - [32, 20846.0]
  - - [256, 20992, 1, 1024, 256, 256, 1024, 1024]
    - [46, 19873.0]
  - - [256, 21248, 1, 1024, 256, 256, 1024, 1024]
    - [12, 20077.0]
  - - [256, 21504, 1, 1024, 256, 256, 1024, 1024]
    - [46, 20218.0]
  - - [256, 22016, 1, 1024, 256, 256, 1024, 1024]
    - [32, 20236.0]
  - - [256, 22344, 1, 1024, 256, 256, 1024, 1024]
    - [14, 20009.0]
  - - [256, 23296, 1, 1024, 256, 256, 1024, 1024]
    - [30, 19682.0]
  - - [256, 23552, 1, 1024, 256, 256, 1024, 1024]
    - [12, 20159.0]
  - - [256, 31488, 1, 1024, 256, 256, 1024, 1024]
    - [12, 20330.0]
  - - [256, 32768, 1, 512, 256, 256, 512, 512]
    - [32, 20417.0]
  - - [256, 33536, 1, 1024, 256, 256, 1024, 1024]
    - [32, 20297.0]
  - - [256, 44505, 1, 1024, 256, 256, 1024, 1024]
    - [46, 20359.0]
  - - [512, 32768, 1, 13, 512, 512, 13, 13]
    - [0, 6242.0]
  - - [512, 32768, 1, 1024, 512, 512, 1024, 1024]
    - [14, 21101.0]
  - - [684, 8976, 1, 256, 684, 684, 256, 256]
    - [32, 16678.0]
  - - [1024, 1600, 1, 560, 1024, 1024, 560, 560]
    - [20, 16361.0]
  - - [1024, 1600, 1, 1024, 1024, 1024, 1024, 1024]
    - [14, 16529.0]
  - - [1024, 32768, 1, 480, 1024, 1024, 480, 480]
    - [7, 21522.0]
  - - [1024, 32768, 1, 1024, 1024, 1024, 1024, 1024]
    - [14, 20921.0]
  - - [1280, 8976, 1, 256, 1280, 1280, 256, 256]
    - [38, 19510.0]
  - - [1792, 8976, 1, 256, 1792, 1792, 256, 256]
    - [5, 19937.0]
  - - [2048, 684, 1, 512, 2048, 2048, 512, 512]
    - [30, 15208.0]
  - - [2048, 684, 1, 768, 2048, 2048, 768, 768]
    - [46, 15971.0]
  - - [2048, 960, 1, 74, 2048, 2048, 74, 74]
    - [4, 9185.0]
  - - [2048, 960, 1, 2048, 2048, 2048, 2048, 2048]
    - [12, 16368.0]
  - - [2048, 1536, 1, 512, 2048, 2048, 512, 512]
    - [14, 18134.0]
  - - [2048, 1536, 1, 768, 2048, 2048, 768, 768]
    - [7, 18845.0]
  - - [2048, 8976, 1, 256, 2048, 2048, 256, 256]
    - [5, 19988.0]
  - - [2304, 8976, 1, 256, 2304, 2304, 256, 256]
    - [30, 20150.0]
  - - [2560, 8976, 1, 256, 2560, 2560, 256, 256]
    - [30, 20227.0]
  - - [2816, 8976, 1, 256, 2816, 2816, 256, 256]
    - [22, 20260.0]
  - - [3072, 8976, 1, 256, 3072, 3072, 256, 256]
    - [12, 20281.0]
  - - [3328, 8976, 1, 256, 3328, 3328, 256, 256]
    - [14, 20330.0]
  - - [3840, 8976, 1, 256, 3840, 3840, 256, 256]
    - [32, 20582.0]
  - - [4096, 8976, 1, 256, 4096, 4096, 256, 256]
    - [5, 20467.0]
  - - [4352, 8976, 1, 256, 4352, 4352, 256, 256]
    - [14, 20606.0]
  - - [4608, 8976, 1, 256, 4608, 4608, 256, 256]
    - [38, 20511.0]
  - - [4864, 8976, 1, 256, 4864, 4864, 256, 256]
    - [14, 20607.0]
  - - [5120, 8976, 1, 256, 5120, 5120, 256, 256]
    - [38, 20462.0]
  - - [5376, 8976, 1, 256, 5376, 5376, 256, 256]
    - [24, 20578.0]
  - - [5632, 8976, 1, 256, 5632, 5632, 256, 256]
    - [38, 20541.0]
  - - [5888, 8976, 1, 256, 5888, 5888, 256, 256]
    - [24, 20582.0]
  - - [6144, 8976, 1, 256, 6144, 6144, 256, 256]
    - [22, 20562.0]
  - - [6400, 8976, 1, 256, 6400, 6400, 256, 256]
    - [40, 20612.0]
  - - [7168, 8976, 1, 256, 7168, 7168, 256, 256]
    - [14, 20570.0]
  - - [7936, 8976, 1, 256, 7936, 7936, 256, 256]
    - [24, 20814.0]
  - - [8192, 8976, 1, 256, 8192, 8192, 256, 256]
    - [14, 20642.0]
  - - [8448, 8976, 1, 256, 8448, 8448, 256, 256]
    - [24, 20711.0]
  - - [8960, 8976, 1, 256, 8960, 8960, 256, 256]
    - [40, 20735.0]
  - - [9472, 8976, 1, 256, 9472, 9472, 256, 256]
    - [14, 20778.0]
  - - [9728, 8976, 1, 256, 9728, 9728, 256, 256]
    - [24, 20928.0]
  - - [9984, 8976, 1, 256, 9984, 9984, 256, 256]
    - [14, 20929.0]
  - - [10240, 8976, 1, 256, 10240, 10240, 256, 256]
    - [12, 20861.0]
  - - [10496, 8976, 1, 256, 10496, 10496, 256, 256]
    - [38, 20899.0]
  - - [11264, 8976, 1, 256, 11264, 11264, 256, 256]
    - [22, 20900.0]
  - - [11776, 8976, 1, 256, 11776, 11776, 256, 256]
    - [12, 20882.0]
  - - [12544, 8976, 1, 256, 12544, 12544, 256, 256]
    - [14, 20953.0]
  - - [13312, 8976, 1, 256, 13312, 13312, 256, 256]
    - [22, 20937.0]
  - - [13568, 8976, 1, 256, 13568, 13568, 256, 256]
    - [24, 20950.0]
  - - [13824, 8976, 1, 256, 13824, 13824, 256, 256]
    - [38, 20932.0]
  - - [15104, 8976, 1, 256, 15104, 15104, 256, 256]
    - [24, 21001.0]
  - - [15360, 8976, 1, 256, 15360, 15360, 256, 256]
    - [22, 20951.0]
  - - [15872, 8976, 1, 256, 15872, 15872, 256, 256]
    - [22, 20973.0]
  - - [16128, 8976, 1, 256, 16128, 16128, 256, 256]
    - [14, 20990.0]
  - - [17152, 8976, 1, 256, 17152, 17152, 256, 256]
    - [24, 20998.0]
  - - [18176, 8976, 1, 256, 18176, 18176, 256, 256]
    - [24, 21016.0]
  - - [18688, 8976, 1, 256, 18688, 18688, 256, 256]
    - [7, 21009.0]
  - - [18944, 8976, 1, 256, 18944, 18944, 256, 256]
    - [38, 20962.0]
  - - [19712, 8976, 1, 256, 19712, 19712, 256, 256]
    - [7, 21028.0]
  - - [19968, 8976, 1, 256, 19968, 19968, 256, 256]
    - [22, 20971.0]
  - - [20480, 8976, 1, 256, 20480, 20480, 256, 256]
    - [30, 20971.0]
  - - [20992, 8976, 1, 256, 20992, 20992, 256, 256]
    - [30, 20974.0]
  - - [21248, 8976, 1, 256, 21248, 21248, 256, 256]
    - [14, 21024.0]
  - - [23552, 8976, 1, 256, 23552, 23552, 256, 256]
    - [5, 20980.0]
  - - [28672, 8976, 1, 256, 28672, 28672, 256, 256]
    - [5, 20984.0]
  - - [31488, 8976, 1, 256, 31488, 31488, 256, 256]
    - [7, 21064.0]
  - - [33536, 8976, 1, 256, 33536, 33536, 256, 256]
    - [14, 21113.0]
  - - [44505, 8976, 1, 256, 44505, 44505, 256, 256]
    - [7, 21039.0]
  - - [1024, 3840, 1, 1024, 1024, 1024, 1024, 1024]
    - [14, 20396.0]
  - - [1024, 3840, 1, 4096, 1024, 1024, 4096, 4096]
    - [14, 20486.0]
  - - [1024, 3968, 1, 1024, 1024, 1024, 1024, 1024]
    - [12, 18842.0]
  - - [1024, 3968, 1, 4096, 1024, 1024, 4096, 4096]
    - [14, 19195.0]
  - - [1024, 6528, 1, 1024, 1024, 1024, 1024, 1024]
    - [12, 19522.0]
  - - [1024, 6528, 1, 4096, 1024, 1024, 4096, 4096]
    - [32, 17944.0]
  - - [1024, 7104, 1, 1024, 1024, 1024, 1024, 1024]
    - [14, 18790.0]
  - - [1024, 7104, 1, 4096, 1024, 1024, 4096, 4096]
    - [32, 16610.0]
  - - [1024, 7200, 1, 1024, 1024, 1024, 1024, 1024]
    - [12, 19542.0]
  - - [1024, 7200, 1, 4096, 1024, 1024, 4096, 4096]
    - [33, 16119.0]
  - - [1024, 8064, 1, 1024, 1024, 1024, 1024, 1024]
    - [14, 19602.0]
  - - [1024, 8064, 1, 4096, 1024, 1024, 4096, 4096]
    - [51, 15677.0]
  - - [1024, 8160, 1, 1024, 1024, 1024, 1024, 1024]
    - [14, 19683.0]
  - - [1024, 8160, 1, 4096, 1024, 1024, 4096, 4096]
    - [33, 15517.0]
  - - [1024, 9216, 1, 1024, 1024, 1024, 1024, 1024]
    - [14, 19964.0]
  - - [1024, 9216, 1, 4096, 1024, 1024, 4096, 4096]
    - [49, 13778.0]
  - - [1024, 9520, 1, 1024, 1024, 1024, 1024, 1024]
    - [32, 19699.0]
  - - [1024, 9520, 1, 4096, 1024, 1024, 4096, 4096]
    - [33, 16529.0]
  - - [1024, 10064, 1, 1024, 1024, 1024, 1024, 1024]
    - [14, 20686.0]
  - - [1024, 10064, 1, 4096, 1024, 1024, 4096, 4096]
    - [33, 17509.0]
  - - [1024, 10080, 1, 1024, 1024, 1024, 1024, 1024]
    - [14, 20725.0]
  - - [1024, 10080, 1, 4096, 1024, 1024, 4096, 4096]
    - [33, 17517.0]
  - - [1024, 10200, 1, 1024, 1024, 1024, 1024, 1024]
    - [14, 20935.0]
  - - [1024, 10200, 1, 4096, 1024, 1024, 4096, 4096]
    - [32, 19699.0]
  - - [4096, 3840, 1, 1024, 4096, 4096, 1024, 1024]
    - [14, 21513.0]
  - - [4096, 3968, 1, 1024, 4096, 4096, 1024, 1024]
    - [12, 20677.0]
  - - [4096, 6528, 1, 1024, 4096, 4096, 1024, 1024]
    - [14, 21023.0]
  - - [4096, 7104, 1, 1024, 4096, 4096, 1024, 1024]
    - [14, 21198.0]
  - - [4096, 7200, 1, 1024, 4096, 4096, 1024, 1024]
    - [14, 20822.0]
  - - [4096, 8064, 1, 1024, 4096, 4096, 1024, 1024]
    - [14, 21198.0]
  - - [4096, 8160, 1, 1024, 4096, 4096, 1024, 1024]
    - [14, 21379.0]
  - - [4096, 9216, 1, 1024, 4096, 4096, 1024, 1024]
    - [14, 21501.0]
  - - [4096, 9520, 1, 1024, 4096, 4096, 1024, 1024]
    - [14, 20931.0]
  - - [4096, 10064, 1, 1024, 4096, 4096, 1024, 1024]
    - [14, 21059.0]
  - - [4096, 10080, 1, 1024, 4096, 4096, 1024, 1024]
    - [14, 21082.0]
  - - [4096, 10200, 1, 1024, 4096, 4096, 1024, 1024]
    - [14, 21263.0]
  - - [42720, 3968, 1, 1024, 42720, 42720, 1024, 1024]
    - [32, 21151.0]
  - - [42720, 6528, 1, 1024, 42720, 42720, 1024, 1024]
    - [48, 21296.0]
  - - [42720, 7104, 1, 1024, 42720, 42720, 1024, 1024]
    - [14, 21351.0]
  - - [42720, 7200, 1, 1024, 42720, 42720, 1024, 1024]
    - [48, 21229.0]
  - - [42720, 9520, 1, 1024, 42720, 42720, 1024, 1024]
    - [48, 21103.0]
  - - [42720, 10080, 1, 1024, 42720, 42720, 1024, 1024]
    - [48, 21228.0]
  - - [1024, 3240, 1, 1024, 1024, 1024, 1024, 1024]
    - [14, 16455.0]
  - - [1024, 3240, 1, 4096, 1024, 1024, 4096, 4096]
    - [14, 17520.0]
  - - [1024, 3960, 1, 1024, 1024, 1024, 1024, 1024]
    - [12, 18600.0]
  - - [1024, 3960, 1, 4096, 1024, 1024, 4096, 4096]
    - [14, 19022.0]
  - - [4096, 3240, 1, 1024, 4096, 4096, 1024, 1024]
    - [14, 20693.0]
  - - [4096, 3960, 1, 1024, 4096, 4096, 1024, 1024]
    - [14, 20725.0]
  - - [42720, 3960, 1, 1024, 42720, 42720, 1024, 1024]
    - [32, 21314.0]
  - - [7680, 8192, 1, 8192, 7680, 7680, 8192, 8192]
    - [14, 18198.0]
  - - [3840, 4096, 1, 4096, 3840, 3840, 4096, 4096]
    - [51, 17046.0]
  - - [1920, 2048, 1, 2048, 1920, 1920, 2048, 2048]
    - [14, 19176.0]
  - - [8192, 7680, 1, 8192, 8192, 8192, 8192, 8192]
    - [14, 18254.0]
  - - [4096, 3840, 1, 4096, 4096, 4096, 4096, 4096]
    - [16, 16678.0]
  - - [2048, 1920, 1, 2048, 2048, 2048, 2048, 2048]
    - [13, 17834.0]
  - - [512, 512, 16, 64, 512, 512, 64, 64]
    - [21, 12567.0]
  - - [512, 512, 128, 64, 512, 512, 64, 64]
    - [46, 18742.0]
  - - [4096, 512, 1, 1024, 4096, 4096, 1024, 1024]
    - [12, 18308.0]
  - - [30522, 616, 1, 1024, 30522, 30522, 1024, 1024]
    - [12, 19858.0]
  - - [128, 128, 128, 64, 128, 128, 64, 64]
    - [45, 9656.0]
  - - [128, 128, 160, 64, 128, 128, 64, 64]
    - [21, 10966.0]
  - - [1024, 1280, 1, 1024, 1024, 1024, 1024, 1024]
    - [14, 19503.0]
  - - [1024, 1280, 1, 4096, 1024, 1024, 4096, 4096]
    - [32, 19376.0]
  - - [4096, 1280, 1, 1024, 4096, 4096, 1024, 1024]
    - [14, 20147.0]
  - - [30522, 160, 1, 1024, 30522, 30522, 1024, 1024]
    - [46, 12966.0]
  - - [30522, 200, 1, 1024, 30522, 30522, 1024, 1024]
    - [46, 16178.0]
  - - [128, 128, 624, 64, 128, 128, 64, 64]
    - [4, 13107.0]
  - - [1024, 4992, 1, 1024, 1024, 1024, 1024, 1024]
    - [14, 20059.0]
  - - [1024, 4992, 1, 4096, 1024, 1024, 4096, 4096]
    - [14, 20341.0]
  - - [4096, 4992, 1, 1024, 4096, 4096, 1024, 1024]
    - [12, 21029.0]
  - - [30522, 780, 1, 1024, 30522, 30522, 1024, 1024]
    - [12, 18320.0]
  - - [30522, 308, 1, 1024, 30522, 30522, 1024, 1024]
    - [30, 16577.0]
  - - [128, 128, 640, 64, 128, 128, 64, 64]
    - [39, 14128.0]
  - - [1024, 5120, 1, 1024, 1024, 1024, 1024, 1024]
    - [14, 20262.0]
  - - [1024, 5120, 1, 4096, 1024, 1024, 4096, 4096]
    - [32, 18601.0]
  - - [4096, 5120, 1, 1024, 4096, 4096, 1024, 1024]
    - [14, 21683.0]
  - - [30522, 800, 1, 1024, 30522, 30522, 1024, 1024]
    - [12, 18651.0]
  - - [128, 128, 656, 64, 128, 128, 64, 64]
    - [31, 15025.0]
  - - [1024, 5248, 1, 1024, 1024, 1024, 1024, 1024]
    - [12, 19826.0]
  - - [1024, 5248, 1, 4096, 1024, 1024, 4096, 4096]
    - [48, 18204.0]
  - - [4096, 5248, 1, 1024, 4096, 4096, 1024, 1024]
    - [14, 21037.0]
  - - [30522, 820, 1, 1024, 30522, 30522, 1024, 1024]
    - [12, 19168.0]
  - - [512, 512, 80, 64, 512, 512, 64, 64]
    - [46, 18123.0]
  - - [1024, 2560, 1, 1024, 1024, 1024, 1024, 1024]
    - [14, 20671.0]
  - - [1024, 2560, 1, 4096, 1024, 1024, 4096, 4096]
    - [14, 20139.0]
  - - [4096, 2560, 1, 1024, 4096, 4096, 1024, 1024]
    - [14, 21287.0]
  - - [30522, 385, 1, 1024, 30522, 30522, 1024, 1024]
    - [14, 15960.0]
  - - [512, 512, 96, 64, 512, 512, 64, 64]
    - [22, 18641.0]
  - - [1024, 3072, 1, 1024, 1024, 1024, 1024, 1024]
    - [14, 20113.0]
  - - [1024, 3072, 1, 4096, 1024, 1024, 4096, 4096]
    - [14, 20179.0]
  - - [4096, 3072, 1, 1024, 4096, 4096, 1024, 1024]
    - [14, 20675.0]
  - - [30522, 462, 1, 1024, 30522, 30522, 1024, 1024]
    - [14, 18790.0]
  - - [4096, 1024, 1, 1024, 4096, 4096, 1024, 1024]
    - [12, 19512.0]
  - - [128, 128, 144, 64, 128, 128, 64, 64]
    - [11, 8977.0]
  - - [1024, 1152, 1, 1024, 1024, 1024, 1024, 1024]
    - [48, 16703.0]
  - - [1024, 1152, 1, 4096, 1024, 1024, 4096, 4096]
    - [48, 17745.0]
  - - [4096, 1152, 1, 1024, 4096, 4096, 1024, 1024]
    - [12, 18945.0]
  - - [30522, 180, 1, 1024, 30522, 30522, 1024, 1024]
    - [46, 14575.0]
  - - [1024, 32768, 1, 479, 1024, 1024, 479, 479]
    - [7, 21165.0]
  - - [1024, 8192, 1, 1024, 1024, 1024, 1024, 1024]
    - [14, 20867.0]
  - - [1024, 8192, 1, 4096, 1024, 1024, 4096, 4096]
    - [33, 15668.0]
  - - [1024, 9600, 1, 1024, 1024, 1024, 1024, 1024]
    - [12, 20442.0]
  - - [1024, 9600, 1, 4096, 1024, 1024, 4096, 4096]
    - [51, 16643.0]
  - - [4096, 8192, 1, 1024, 4096, 4096, 1024, 1024]
    - [14, 21702.0]
  - - [4096, 9600, 1, 1024, 4096, 4096, 1024, 1024]
    - [14, 21313.0]
  - - [33712, 8192, 1, 1024, 33712, 33712, 1024, 1024]
    - [14, 20679.0]
  - - [33712, 9600, 1, 1024, 33712, 33712, 1024, 1024]
    - [14, 20779.0]
  - - [1024, 1024, 128, 96, 1024, 1024, 96, 96]
    - [5, 19928.0]
  - - [30592, 4096, 1, 1024, 30592, 30592, 1024, 1024]
    - [14, 21645.0]
  - - [1536, 8192, 1, 1536, 1536, 1536, 1536, 1536]
    - [14, 21301.0]
  - - [3072, 8192, 1, 1024, 3072, 3072, 1024, 1024]
    - [14, 21651.0]
  - - [3072, 2048, 1, 1024, 3072, 3072, 1024, 1024]
    - [14, 20145.0]
  - - [50304, 8192, 1, 1024, 50304, 50304, 1024, 1024]
    - [48, 20983.0]
  - - [2048, 1024, 1, 8192, 2048, 2048, 8192, 8192]
    - [12, 16725.0]
  - - [50304, 2048, 1, 1024, 50304, 50304, 1024, 1024]
    - [32, 21829.0]
  - - [1536, 8192, 1, 6144, 1536, 1536, 6144, 6144]
    - [32, 18604.0]
  - - [50304, 4096, 1, 1536, 50304, 50304, 1536, 1536]
    - [40, 21397.0]
  - - [8192, 1024, 1, 2048, 8192, 8192, 2048, 2048]
    - [14, 20495.0]
  - - [2560, 2048, 1, 640, 2560, 2560, 640, 640]
    - [24, 20575.0]
  - - [1024, 1024, 128, 64, 1024, 1024, 64, 64]
    - [5, 17692.0]
  - - [2048, 1024, 1, 2048, 2048, 2048, 2048, 2048]
    - [12, 17133.0]
  - - [1536, 4096, 1, 1536, 1536, 1536, 1536, 1536]
    - [14, 20523.0]
  - - [1024, 1024, 64, 64, 1024, 1024, 64, 64]
    - [5, 17559.0]
  - - [30592, 8192, 1, 1024, 30592, 30592, 1024, 1024]
    - [14, 20764.0]
  - - [50304, 16384, 1, 1024, 50304, 50304, 1024, 1024]
    - [48, 21712.0]
  - - [4608, 4096, 1, 1536, 4608, 4608, 1536, 1536]
    - [14, 21992.0]
  - - [2560, 2048, 1, 2560, 2560, 2560, 2560, 2560]
    - [14, 21138.0]
  - - [7680, 2048, 1, 2560, 7680, 7680, 2560, 2560]
    - [14, 20034.0]
  - - [50304, 4096, 1, 1024, 50304, 50304, 1024, 1024]
    - [32, 21241.0]
  - - [1920, 2048, 1, 2560, 1920, 1920, 2560, 2560]
    - [14, 19977.0]
  - - [1024, 1024, 64, 96, 1024, 1024, 96, 96]
    - [12, 19582.0]
  - - [6144, 4096, 1, 1536, 6144, 6144, 1536, 1536]
    - [14, 21625.0]
  - - [1536, 4096, 1, 6144, 1536, 1536, 6144, 6144]
    - [32, 18975.0]
  - - [512, 512, 256, 64, 512, 512, 64, 64]
    - [5, 15936.0]
  - - [50304, 8192, 1, 1536, 50304, 50304, 1536, 1536]
    - [48, 21242.0]
  - - [6144, 8192, 1, 1536, 6144, 6144, 1536, 1536]
    - [14, 21681.0]
  - - [4096, 16384, 1, 1024, 4096, 4096, 1024, 1024]
    - [14, 21358.0]
  - - [30592, 1024, 1, 2048, 30592, 30592, 2048, 2048]
    - [32, 20540.0]
  - - [1024, 16384, 1, 4096, 1024, 1024, 4096, 4096]
    - [32, 18748.0]
  - - [512, 512, 40, 64, 512, 512, 64, 64]
    - [6, 14841.0]
  - - [6144, 1024, 1, 2048, 6144, 6144, 2048, 2048]
    - [14, 20108.0]
  - - [4608, 8192, 1, 1536, 4608, 4608, 1536, 1536]
    - [14, 21642.0]
  - - [30592, 2048, 1, 1024, 30592, 30592, 1024, 1024]
    - [14, 21556.0]
  - - [3072, 16384, 1, 1024, 3072, 3072, 1024, 1024]
    - [14, 21337.0]
  - - [1024, 1024, 256, 64, 1024, 1024, 64, 64]
    - [5, 17756.0]
  - - [1024, 16384, 1, 1024, 1024, 1024, 1024, 1024]
    - [14, 21355.0]
  - - [1024, 1024, 32, 64, 1024, 1024, 64, 64]
    - [22, 18697.0]
  - - [3072, 4096, 1, 1024, 3072, 3072, 1024, 1024]
    - [14, 21086.0]
  - - [30528, 8192, 1, 1024, 30528, 30528, 1024, 1024]
    - [14, 20828.0]
  - - [128, 128, 1024, 64, 128, 128, 64, 64]
    - [6, 15851.0]
  - - [1024, 3456, 1, 1024, 1024, 1024, 1024, 1024]
    - [12, 18961.0]
  - - [1024, 3456, 1, 480, 1024, 1024, 480, 480]
    - [12, 19575.0]
  - - [1024, 4096, 1, 480, 1024, 1024, 480, 480]
    - [12, 19317.0]
  - - [1024, 6912, 1, 1024, 1024, 1024, 1024, 1024]
    - [14, 20261.0]
  - - [1024, 6912, 1, 480, 1024, 1024, 480, 480]
    - [7, 20741.0]
  - - [128, 55296, 1, 256, 128, 128, 256, 256]
    - [30, 19734.0]
  - - [256, 55296, 1, 512, 256, 256, 512, 512]
    - [12, 20476.0]
  - - [256, 6912, 1, 512, 256, 256, 512, 512]
    - [12, 17443.0]
  - - [512, 3456, 1, 1024, 512, 512, 1024, 1024]
    - [30, 17250.0]
  - - [512, 3456, 1, 13, 512, 512, 13, 13]
    - [23, 1973.0]
  - - [512, 4096, 1, 1024, 512, 512, 1024, 1024]
    - [12, 17704.0]
  - - [512, 4096, 1, 13, 512, 512, 13, 13]
    - [26, 3141.0]
  - - [512, 55296, 1, 13, 512, 512, 13, 13]
    - [47, 7719.0]
  - - [512, 6912, 1, 1024, 512, 512, 1024, 1024]
    - [30, 19129.0]
  - - [512, 6912, 1, 13, 512, 512, 13, 13]
    - [21, 3753.0]
  - - [30528, 640, 1, 1024, 30528, 30528, 1024, 1024]
    - [12, 20583.0]
  - - [30528, 1280, 1, 1024, 30528, 30528, 1024, 1024]
    - [48, 21396.0]
  - - [30528, 1600, 1, 1024, 30528, 30528, 1024, 1024]
    - [12, 20200.0]
  - - [1024, 10240, 1, 1024, 1024, 1024, 1024, 1024]
    - [14, 21169.0]
  - - [4096, 10240, 1, 1024, 4096, 4096, 1024, 1024]
    - [14, 21546.0]
  - - [1024, 10240, 1, 4096, 1024, 1024, 4096, 4096]
    - [32, 19138.0]
  - - [128, 128, 1280, 64, 128, 128, 64, 64]
    - [6, 13615.0]
  - - [1024, 10496, 1, 4096, 1024, 1024, 4096, 4096]
    - [32, 19480.0]
  - - [30528, 1640, 1, 1024, 30528, 30528, 1024, 1024]
    - [12, 20752.0]
  - - [4096, 10496, 1, 1024, 4096, 4096, 1024, 1024]
    - [14, 21499.0]
  - - [1024, 10496, 1, 1024, 1024, 1024, 1024, 1024]
    - [14, 20773.0]
  - - [128, 128, 1312, 64, 128, 128, 64, 64]
    - [22, 17574.0]
  - - [30528, 160, 1, 1024, 30528, 30528, 1024, 1024]
    - [14, 12957.0]
  - - [30528, 240, 1, 1024, 30528, 30528, 1024, 1024]
    - [12, 18884.0]
  - - [1024, 6144, 1, 1024, 1024, 1024, 1024, 1024]
    - [14, 19892.0]
  - - [4096, 6144, 1, 1024, 4096, 4096, 1024, 1024]
    - [14, 21547.0]
  - - [1024, 6144, 1, 4096, 1024, 1024, 4096, 4096]
    - [14, 18865.0]
  - - [512, 512, 192, 64, 512, 512, 64, 64]
    - [12, 17583.0]
  - - [1024, 10224, 1, 1024, 1024, 1024, 1024, 1024]
    - [14, 21003.0]
  - - [1024, 10192, 1, 1024, 1024, 1024, 1024, 1024]
    - [14, 20990.0]
  - - [1024, 10208, 1, 1024, 1024, 1024, 1024, 1024]
    - [14, 21008.0]
  - - [1024, 10224, 1, 4096, 1024, 1024, 4096, 4096]
    - [32, 19170.0]
  - - [4096, 10224, 1, 1024, 4096, 4096, 1024, 1024]
    - [14, 21315.0]
  - - [3072, 10224, 1, 1024, 3072, 3072, 1024, 1024]
    - [14, 21549.0]
  - - [3072, 10240, 1, 1024, 3072, 3072, 1024, 1024]
    - [14, 21674.0]
  - - [1024, 10192, 1, 4096, 1024, 1024, 4096, 4096]
    - [32, 19410.0]
  - - [4096, 10192, 1, 1024, 4096, 4096, 1024, 1024]
    - [14, 21426.0]
  - - [3072, 10192, 1, 1024, 3072, 3072, 1024, 1024]
    - [14, 21538.0]
  - - [3072, 10200, 1, 1024, 3072, 3072, 1024, 1024]
    - [14, 21533.0]
  - - [1024, 10184, 1, 1024, 1024, 1024, 1024, 1024]
    - [14, 21014.0]
  - - [3072, 10208, 1, 1024, 3072, 3072, 1024, 1024]
    - [14, 21502.0]
  - - [1024, 10208, 1, 4096, 1024, 1024, 4096, 4096]
    - [32, 18734.0]
  - - [4096, 10208, 1, 1024, 4096, 4096, 1024, 1024]
    - [14, 21409.0]
  - - [2048, 10224, 1, 1024, 2048, 2048, 1024, 1024]
    - [14, 21405.0]
  - - [2048, 10240, 1, 1024, 2048, 2048, 1024, 1024]
    - [14, 21610.0]
  - - [1024, 10120, 1, 1024, 1024, 1024, 1024, 1024]
    - [14, 20897.0]
  - - [2048, 10192, 1, 1024, 2048, 2048, 1024, 1024]
    - [14, 21508.0]
  - - [1024, 10152, 1, 1024, 1024, 1024, 1024, 1024]
    - [14, 20940.0]
  - - [3072, 10080, 1, 1024, 3072, 3072, 1024, 1024]
    - [14, 21379.0]
  - - [1024, 2048, 1, 49, 1024, 1024, 49, 49]
    - [26, 9938.0]
  - - [4608, 512, 1, 49, 4608, 4608, 49, 49]
    - [17, 11137.0]
  - - [256, 256, 25, 12544, 256, 256, 12544, 12544]
    - [49, 15440.0]
  - - [256, 256, 49, 3200, 256, 256, 3200, 3200]
    - [24, 20960.0]
  - - [256, 256, 25, 6272, 256, 256, 6272, 6272]
    - [38, 19949.0]
  - - [256, 256, 49, 6400, 256, 256, 6400, 6400]
    - [32, 18601.0]
  - - [512, 512, 49, 1152, 512, 512, 1152, 1152]
    - [40, 21572.0]
  - - [512, 512, 25, 2048, 512, 512, 2048, 2048]
    - [14, 18831.0]
  - - [512, 512, 49, 2304, 512, 512, 2304, 2304]
    - [14, 20831.0]
  - - [512, 512, 25, 4096, 512, 512, 4096, 4096]
    - [51, 17908.0]
  - - [128, 128, 2048, 64, 128, 128, 64, 64]
    - [29, 12101.0]
  - - [30528, 2560, 1, 1024, 30528, 30528, 1024, 1024]
    - [14, 21455.0]
  - - [128, 128, 1536, 64, 128, 128, 64, 64]
    - [5, 17000.0]
  - - [1024, 12288, 1, 1024, 1024, 1024, 1024, 1024]
    - [14, 20931.0]
  - - [1024, 12288, 1, 4096, 1024, 1024, 4096, 4096]
    - [32, 19400.0]
  - - [30528, 1920, 1, 1024, 30528, 30528, 1024, 1024]
    - [12, 21118.0]
  - - [4096, 12288, 1, 1024, 4096, 4096, 1024, 1024]
    - [14, 21453.0]
  - - [128, 128, 81, 12544, 128, 128, 12544, 12544]
    - [15, 12598.0]
  - - [128, 128, 121, 9216, 128, 128, 9216, 9216]
    - [49, 12608.0]
  - - [128, 128, 169, 6400, 128, 128, 6400, 6400]
    - [49, 14826.0]
  - - [256, 256, 36, 4096, 256, 256, 4096, 4096]
    - [16, 15752.0]
  - - [256, 256, 49, 2304, 256, 256, 2304, 2304]
    - [14, 18906.0]
  - - [256, 256, 64, 2304, 256, 256, 2304, 2304]
    - [14, 17764.0]
  - - [256, 256, 81, 4096, 256, 256, 4096, 4096]
    - [33, 15831.0]
  - - [256, 256, 121, 2304, 256, 256, 2304, 2304]
    - [48, 18523.0]
  - - [256, 256, 169, 2304, 256, 256, 2304, 2304]
    - [32, 19708.0]
  - - [512, 512, 81, 1024, 512, 512, 1024, 1024]
    - [14, 20241.0]
  - - [512, 512, 121, 1024, 512, 512, 1024, 1024]
    - [14, 20526.0]
  - - [512, 512, 169, 1024, 512, 512, 1024, 1024]
    - [14, 20627.0]
  - - [512, 512, 36, 1024, 512, 512, 1024, 1024]
    - [14, 20365.0]
  - - [512, 512, 49, 1024, 512, 512, 1024, 1024]
    - [14, 20196.0]
  - - [512, 512, 64, 1024, 512, 512, 1024, 1024]
    - [14, 20086.0]
  - - [128, 128, 192, 64, 128, 128, 64, 64]
    - [4, 12157.0]
  - - [768, 2048, 1, 768, 768, 768, 768, 768]
    - [46, 18636.0]
  - - [3072, 2048, 1, 768, 3072, 3072, 768, 768]
    - [30, 20203.0]
  - - [768, 2048, 1, 3072, 768, 768, 3072, 3072]
    - [47, 16902.0]
  - - [384, 384, 144, 64, 384, 384, 64, 64]
    - [46, 17736.0]
  - - [768, 4608, 1, 768, 768, 768, 768, 768]
    - [30, 19347.0]
  - - [3072, 4608, 1, 768, 3072, 3072, 768, 768]
    - [14, 21072.0]
  - - [768, 4608, 1, 3072, 768, 768, 3072, 3072]
    - [14, 19489.0]
  - - [512, 512, 48, 64, 512, 512, 64, 64]
    - [6, 16004.0]
  - - [128, 128, 256, 64, 128, 128, 64, 64]
    - [4, 11056.0]
  - - [384, 384, 192, 64, 384, 384, 64, 64]
    - [46, 18033.0]
  - - [1024, 4608, 1, 1024, 1024, 1024, 1024, 1024]
    - [12, 19653.0]
  - - [4096, 4608, 1, 1024, 4096, 4096, 1024, 1024]
    - [14, 21563.0]
  - - [1024, 4608, 1, 4096, 1024, 1024, 4096, 4096]
    - [14, 19114.0]
  - - [2880, 3072, 1, 3072, 2880, 2880, 3072, 3072]
    - [14, 21012.0]
  - - [3072, 3072, 1, 3072, 3072, 3072, 3072, 3072]
    - [14, 21097.0]
  - - [3072, 512, 1, 3072, 3072, 3072, 3072, 3072]
    - [13, 16870.0]
  - - [4096, 512, 1, 4096, 4096, 4096, 4096, 4096]
    - [12, 16903.0]
  - - [512, 3072, 1, 3072, 512, 512, 3072, 3072]
    - [13, 16655.0]
  - - [512, 4096, 1, 4096, 512, 512, 4096, 4096]
    - [46, 17413.0]
  - - [512, 8192, 1, 8192, 512, 512, 8192, 8192]
    - [48, 16540.0]
  - - [8192, 512, 1, 8192, 8192, 8192, 8192, 8192]
    - [14, 17805.0]
  - - [256, 256, 36, 432, 256, 256, 432, 432]
    - [14, 17621.0]
  - - [256, 256, 36, 456, 256, 256, 456, 456]
    - [44, 17788.0]
  - - [256, 256, 36, 504, 256, 256, 504, 504]
    - [5, 17748.0]
  - - [256, 256, 49, 1120, 256, 256, 1120, 1120]
    - [7, 20569.0]
  - - [256, 256, 36, 442, 256, 256, 442, 442]
    - [14, 17056.0]
  - - [256, 256, 49, 950, 256, 256, 950, 950]
    - [24, 19511.0]
  - - [256, 256, 64, 616, 256, 256, 616, 616]
    - [22, 18758.0]
  - - [256, 256, 64, 660, 256, 256, 660, 660]
    - [22, 18842.0]
  - - [256, 256, 36, 408, 256, 256, 408, 408]
    - [48, 17001.0]
  - - [256, 256, 49, 1008, 256, 256, 1008, 1008]
    - [48, 17452.0]
  - - [256, 256, 36, 462, 256, 256, 462, 462]
    - [32, 17069.0]
  - - [256, 256, 36, 468, 256, 256, 468, 468]
    - [24, 16940.0]
  - - [256, 256, 36, 494, 256, 256, 494, 494]
    - [14, 17627.0]
  - - [512, 512, 64, 48, 512, 512, 48, 48]
    - [39, 15451.0]
  - - [256, 256, 64, 140, 256, 256, 140, 140]
    - [39, 14477.0]
  - - [512, 512, 64, 56, 512, 512, 56, 56]
    - [20, 15844.0]
  - - [512, 512, 49, 90, 512, 512, 90, 90]
    - [12, 16896.0]
  - - [512, 512, 49, 60, 512, 512, 60, 60]
    - [31, 15304.0]
  - - [256, 256, 49, 864, 256, 256, 864, 864]
    - [24, 19514.0]
  - - [256, 256, 64, 224, 256, 256, 224, 224]
    - [5, 18568.0]
  - - [256, 256, 64, 176, 256, 256, 176, 176]
    - [22, 16986.0]
  - - [256, 256, 64, 154, 256, 256, 154, 154]
    - [22, 14815.0]
  - - [512, 512, 49, 80, 512, 512, 80, 80]
    - [32, 17364.0]
  - - [256, 256, 49, 1200, 256, 256, 1200, 1200]
    - [7, 20687.0]
  - - [256, 256, 64, 704, 256, 256, 704, 704]
    - [22, 19483.0]
  - - [256, 256, 64, 768, 256, 256, 768, 768]
    - [5, 18453.0]
  - - [256, 256, 49, 1160, 256, 256, 1160, 1160]
    - [7, 15351.0]
  - - [256, 256, 49, 320, 256, 256, 320, 320]
    - [12, 18079.0]
  - - [512, 512, 49, 70, 512, 512, 70, 70]
    - [47, 15086.0]
  - - [256, 256, 49, 1240, 256, 256, 1240, 1240]
    - [14, 16150.0]
  - - [256, 256, 36, 384, 256, 256, 384, 384]
    - [32, 17303.0]
  - - [1024, 2048, 1, 888, 1024, 1024, 888, 888]
    - [1, 18218.0]
  - - [1024, 2048, 1, 713, 1024, 1024, 713, 713]
    - [5, 17448.0]
  - - [1024, 2048, 1, 660, 1024, 1024, 660, 660]
    - [1, 17686.0]
  - - [1024, 2048, 1, 726, 1024, 1024, 726, 726]
    - [1, 17704.0]
  - - [1024, 2048, 1, 672, 1024, 1024, 672, 672]
    - [1, 18495.0]
  - - [1024, 2048, 1, 850, 1024, 1024, 850, 850]
    - [5, 17854.0]
  - - [1024, 2048, 1, 805, 1024, 1024, 805, 805]
    - [1, 17767.0]
  - - [1024, 2048, 1, 864, 1024, 1024, 864, 864]
    - [12, 17993.0]
  - - [1024, 2048, 1, 768, 1024, 1024, 768, 768]
    - [30, 17480.0]
  - - [1024, 2048, 1, 950, 1024, 1024, 950, 950]
    - [22, 18211.0]
  - - [256, 128, 49, 1152, 256, 256, 1152, 1152]
    - [22, 18575.0]
  - - [256, 128, 121, 120, 256, 256, 120, 120]
    - [47, 12993.0]
  - - [256, 128, 169, 120, 256, 256, 120, 120]
    - [39, 15383.0]
  - - [256, 128, 36, 120, 256, 256, 120, 120]
    - [1, 12776.0]
  - - [256, 128, 49, 120, 256, 256, 120, 120]
    - [6, 12966.0]
  - - [256, 128, 64, 120, 256, 256, 120, 120]
    - [47, 11481.0]
  - - [256, 128, 36, 12000, 256, 256, 12000, 12000]
    - [30, 18308.0]
  - - [256, 128, 49, 1216, 256, 256, 1216, 1216]
    - [5, 19067.0]
  - - [256, 128, 121, 18, 256, 256, 18, 18]
    - [11, 5047.0]
  - - [256, 128, 169, 18, 256, 256, 18, 18]
    - [4, 5313.0]
  - - [256, 128, 36, 18, 256, 256, 18, 18]
    - [0, 4537.0]
  - - [256, 128, 49, 18, 256, 256, 18, 18]
    - [0, 4722.0]
  - - [256, 128, 64, 18, 256, 256, 18, 18]
    - [11, 3798.0]
  - - [256, 128, 36, 1800, 256, 256, 1800, 1800]
    - [38, 17230.0]
  - - [256, 128, 121, 19, 256, 256, 19, 19]
    - [4, 5451.0]
  - - [256, 128, 169, 19, 256, 256, 19, 19]
    - [11, 6316.0]
  - - [256, 128, 36, 19, 256, 256, 19, 19]
    - [8, 3096.0]
  - - [256, 128, 49, 19, 256, 256, 19, 19]
    - [8, 3405.0]
  - - [256, 128, 64, 19, 256, 256, 19, 19]
    - [8, 3817.0]
  - - [256, 128, 36, 1900, 256, 256, 1900, 1900]
    - [38, 17262.0]
  - - [256, 128, 49, 480, 256, 256, 480, 480]
    - [5, 16581.0]
  - - [256, 128, 81, 480, 256, 256, 480, 480]
    - [5, 16477.0]
  - - [256, 128, 64, 5880, 256, 256, 5880, 5880]
    - [38, 17717.0]
  - - [256, 128, 49, 72, 256, 256, 72, 72]
    - [27, 10141.0]
  - - [256, 128, 81, 72, 256, 256, 72, 72]
    - [4, 12442.0]
  - - [256, 128, 49, 76, 256, 256, 76, 76]
    - [11, 10857.0]
  - - [256, 128, 81, 76, 256, 256, 76, 76]
    - [4, 11487.0]
  - - [256, 128, 49, 7680, 256, 256, 7680, 7680]
    - [15, 14356.0]
  - - [256, 128, 64, 882, 256, 256, 882, 882]
    - [22, 18102.0]
  - - [256, 128, 64, 931, 256, 256, 931, 931]
    - [22, 18082.0]
  - - [256, 256, 49, 1152, 256, 256, 1152, 1152]
    - [7, 20591.0]
  - - [256, 256, 36, 12000, 256, 256, 12000, 12000]
    - [7, 19816.0]
  - - [256, 256, 49, 1216, 256, 256, 1216, 1216]
    - [20, 20817.0]
  - - [256, 256, 36, 1800, 256, 256, 1800, 1800]
    - [7, 19150.0]
  - - [256, 256, 36, 1900, 256, 256, 1900, 1900]
    - [24, 15360.0]
  - - [256, 256, 64, 5880, 256, 256, 5880, 5880]
    - [22, 20675.0]
  - - [256, 256, 49, 7680, 256, 256, 7680, 7680]
    - [16, 17458.0]
  - - [256, 256, 64, 882, 256, 256, 882, 882]
    - [22, 20094.0]
  - - [256, 256, 64, 931, 256, 256, 931, 931]
    - [38, 20060.0]
  - - [512, 256, 81, 1080, 512, 512, 1080, 1080]
    - [40, 21050.0]
  - - [512, 256, 25, 12000, 512, 512, 12000, 12000]
    - [40, 21855.0]
  - - [512, 256, 81, 162, 512, 512, 162, 162]
    - [22, 18442.0]
  - - [512, 256, 81, 171, 512, 512, 171, 171]
    - [5, 19042.0]
  - - [512, 256, 25, 1800, 512, 512, 1800, 1800]
    - [7, 21264.0]
  - - [512, 256, 25, 1900, 512, 512, 1900, 1900]
    - [24, 21266.0]
  - - [512, 256, 121, 1920, 512, 512, 1920, 1920]
    - [40, 21713.0]
  - - [512, 256, 169, 1920, 512, 512, 1920, 1920]
    - [40, 22079.0]
  - - [512, 256, 49, 1920, 512, 512, 1920, 1920]
    - [24, 21303.0]
  - - [512, 256, 121, 288, 512, 512, 288, 288]
    - [24, 20623.0]
  - - [512, 256, 169, 288, 512, 512, 288, 288]
    - [5, 20707.0]
  - - [512, 256, 49, 288, 512, 512, 288, 288]
    - [7, 19774.0]
  - - [512, 256, 25, 3000, 512, 512, 3000, 3000]
    - [40, 21554.0]
  - - [512, 256, 81, 3000, 512, 512, 3000, 3000]
    - [7, 21445.0]
  - - [512, 256, 121, 304, 512, 512, 304, 304]
    - [22, 20616.0]
  - - [512, 256, 169, 304, 512, 512, 304, 304]
    - [40, 20783.0]
  - - [512, 256, 49, 304, 512, 512, 304, 304]
    - [5, 19798.0]
  - - [512, 256, 25, 450, 512, 512, 450, 450]
    - [38, 19433.0]
  - - [512, 256, 81, 450, 512, 512, 450, 450]
    - [38, 20223.0]
  - - [512, 256, 25, 475, 512, 512, 475, 475]
    - [40, 19559.0]
  - - [512, 256, 81, 475, 512, 512, 475, 475]
    - [5, 19996.0]
  - - [512, 256, 121, 480, 512, 512, 480, 480]
    - [24, 20988.0]
  - - [512, 256, 169, 480, 512, 512, 480, 480]
    - [24, 21351.0]
  - - [512, 256, 49, 5880, 512, 512, 5880, 5880]
    - [40, 21693.0]
  - - [512, 256, 121, 72, 512, 512, 72, 72]
    - [23, 16156.0]
  - - [512, 256, 169, 72, 512, 512, 72, 72]
    - [5, 16795.0]
  - - [512, 256, 121, 76, 512, 512, 76, 76]
    - [47, 16681.0]
  - - [512, 256, 169, 76, 512, 512, 76, 76]
    - [22, 17002.0]
  - - [512, 256, 49, 882, 512, 512, 882, 882]
    - [7, 20867.0]
  - - [512, 256, 49, 931, 512, 512, 931, 931]
    - [24, 20775.0]
  - - [2304, 512, 1, 100, 2304, 2304, 100, 100]
    - [18, 13781.0]
  - - [2304, 512, 1, 361, 2304, 2304, 361, 361]
    - [1, 17144.0]
  - - [4608, 510, 1, 100, 4608, 4608, 100, 100]
    - [45, 9891.0]
  - - [4608, 510, 1, 361, 4608, 4608, 361, 361]
    - [30, 16001.0]
  - - [340, 256, 49, 1152, 340, 340, 1152, 1152]
    - [22, 18034.0]
  - - [340, 256, 36, 120, 340, 340, 120, 120]
    - [23, 13287.0]
  - - [340, 256, 49, 120, 340, 340, 120, 120]
    - [6, 13877.0]
  - - [340, 256, 64, 120, 340, 340, 120, 120]
    - [38, 14205.0]
  - - [340, 256, 36, 12000, 340, 340, 12000, 12000]
    - [38, 18374.0]
  - - [340, 256, 49, 1216, 340, 340, 1216, 1216]
    - [12, 18010.0]
  - - [340, 256, 36, 18, 340, 340, 18, 18]
    - [47, 3989.0]
  - - [340, 256, 49, 18, 340, 340, 18, 18]
    - [4, 4377.0]
  - - [340, 256, 64, 18, 340, 340, 18, 18]
    - [21, 4500.0]
  - - [340, 256, 36, 1800, 340, 340, 1800, 1800]
    - [5, 17897.0]
  - - [340, 256, 36, 19, 340, 340, 19, 19]
    - [17, 4140.0]
  - - [340, 256, 49, 19, 340, 340, 19, 19]
    - [11, 4502.0]
  - - [340, 256, 64, 19, 340, 340, 19, 19]
    - [4, 4794.0]
  - - [340, 256, 36, 1900, 340, 340, 1900, 1900]
    - [22, 17963.0]
  - - [340, 256, 64, 5880, 340, 340, 5880, 5880]
    - [24, 18847.0]
  - - [340, 256, 49, 7680, 340, 340, 7680, 7680]
    - [51, 14535.0]
  - - [340, 256, 64, 882, 340, 340, 882, 882]
    - [7, 18006.0]
  - - [340, 256, 64, 931, 340, 340, 931, 931]
    - [24, 18014.0]
  - - [510, 256, 49, 120, 510, 510, 120, 120]
    - [39, 14780.0]
  - - [510, 256, 64, 120, 510, 510, 120, 120]
    - [31, 15248.0]
  - - [510, 256, 49, 18, 510, 510, 18, 18]
    - [23, 3763.0]
  - - [510, 256, 64, 18, 510, 510, 18, 18]
    - [36, 3931.0]
  - - [510, 256, 49, 19, 510, 510, 19, 19]
    - [39, 3980.0]
  - - [510, 256, 64, 19, 510, 510, 19, 19]
    - [19, 4094.0]
  - - [510, 256, 36, 480, 510, 510, 480, 480]
    - [38, 19237.0]
  - - [510, 256, 36, 72, 510, 510, 72, 72]
    - [31, 10840.0]
  - - [510, 256, 36, 76, 510, 510, 76, 76]
    - [39, 11121.0]
  - - [510, 512, 36, 1080, 510, 510, 1080, 1080]
    - [38, 20658.0]
  - - [510, 512, 36, 162, 510, 510, 162, 162]
    - [40, 17169.0]
  - - [510, 512, 36, 171, 510, 510, 171, 171]
    - [38, 17833.0]
  - - [510, 512, 49, 1920, 510, 510, 1920, 1920]
    - [40, 21473.0]
  - - [510, 512, 64, 1920, 510, 510, 1920, 1920]
    - [24, 21662.0]
  - - [510, 512, 49, 288, 510, 510, 288, 288]
    - [40, 19957.0]
  - - [510, 512, 64, 288, 510, 510, 288, 288]
    - [40, 20318.0]
  - - [510, 512, 36, 3000, 510, 510, 3000, 3000]
    - [24, 21216.0]
  - - [510, 512, 49, 304, 510, 510, 304, 304]
    - [40, 19929.0]
  - - [510, 512, 64, 304, 510, 510, 304, 304]
    - [48, 20369.0]
  - - [510, 512, 36, 450, 510, 510, 450, 450]
    - [22, 20101.0]
  - - [510, 512, 36, 475, 510, 510, 475, 475]
    - [30, 20137.0]
  - - [510, 512, 49, 480, 510, 510, 480, 480]
    - [40, 20723.0]
  - - [510, 512, 64, 480, 510, 510, 480, 480]
    - [40, 20881.0]
  - - [510, 512, 49, 72, 510, 510, 72, 72]
    - [38, 13142.0]
  - - [510, 512, 64, 72, 510, 510, 72, 72]
    - [22, 13676.0]
  - - [510, 512, 49, 76, 510, 510, 76, 76]
    - [22, 13777.0]
  - - [510, 512, 64, 76, 510, 510, 76, 76]
    - [30, 14068.0]
  - - [1024, 1024, 160, 96, 1024, 1024, 96, 96]
    - [5, 19969.0]
  - - [2880, 16384, 1, 1920, 2880, 2880, 1920, 1920]
    - [24, 21711.0]
  - - [1920, 16384, 1, 960, 1920, 1920, 960, 960]
    - [20, 22011.0]
  - - [3840, 16384, 1, 1920, 3840, 3840, 1920, 1920]
    - [24, 22271.0]
  - - [1920, 16384, 1, 3840, 1920, 1920, 3840, 3840]
    - [14, 21847.0]
  - - [25216, 16384, 1, 1920, 25216, 25216, 1920, 1920]
    - [7, 21915.0]
  - - [1024, 1024, 40, 96, 1024, 1024, 96, 96]
    - [30, 19491.0]
  - - [2880, 4096, 1, 1920, 2880, 2880, 1920, 1920]
    - [3, 21281.0]
  - - [1920, 4096, 1, 960, 1920, 1920, 960, 960]
    - [20, 21623.0]
  - - [3840, 4096, 1, 1920, 3840, 3840, 1920, 1920]
    - [3, 22187.0]
  - - [1920, 4096, 1, 3840, 1920, 1920, 3840, 3840]
    - [14, 21043.0]
  - - [25216, 4096, 1, 1920, 25216, 25216, 1920, 1920]
    - [24, 22087.0]
  - - [1024, 1024, 80, 96, 1024, 1024, 96, 96]
    - [12, 19627.0]
  - - [2880, 8192, 1, 1920, 2880, 2880, 1920, 1920]
    - [24, 21383.0]
  - - [1920, 8192, 1, 960, 1920, 1920, 960, 960]
    - [20, 21976.0]
  - - [3840, 8192, 1, 1920, 3840, 3840, 1920, 1920]
    - [40, 22059.0]
  - - [1920, 8192, 1, 3840, 1920, 1920, 3840, 3840]
    - [32, 21438.0]
  - - [25216, 8192, 1, 1920, 25216, 25216, 1920, 1920]
    - [7, 21813.0]
  - - [1024, 1024, 96, 96, 1024, 1024, 96, 96]
    - [5, 19714.0]
  - - [1728, 16384, 1, 2304, 1728, 1728, 2304, 2304]
    - [7, 21031.0]
  - - [2304, 16384, 1, 576, 2304, 2304, 576, 576]
    - [20, 22215.0]
  - - [2304, 16384, 1, 2304, 2304, 2304, 2304, 2304]
    - [7, 21752.0]
  - - [12672, 16384, 1, 2304, 12672, 12672, 2304, 2304]
    - [14, 21684.0]
  - - [1024, 1024, 24, 96, 1024, 1024, 96, 96]
    - [5, 18795.0]
  - - [1728, 4096, 1, 2304, 1728, 1728, 2304, 2304]
    - [7, 19908.0]
  - - [2304, 4096, 1, 576, 2304, 2304, 576, 576]
    - [18, 21943.0]
  - - [2304, 4096, 1, 2304, 2304, 2304, 2304, 2304]
    - [32, 21240.0]
  - - [12672, 4096, 1, 2304, 12672, 12672, 2304, 2304]
    - [7, 21927.0]
  - - [1024, 1024, 48, 96, 1024, 1024, 96, 96]
    - [5, 19595.0]
  - - [1728, 8192, 1, 2304, 1728, 1728, 2304, 2304]
    - [14, 20821.0]
  - - [2304, 8192, 1, 576, 2304, 2304, 576, 576]
    - [18, 22127.0]
  - - [2304, 8192, 1, 2304, 2304, 2304, 2304, 2304]
    - [48, 21781.0]
  - - [12672, 8192, 1, 2304, 12672, 12672, 2304, 2304]
    - [14, 21421.0]
  - - [1024, 1024, 16, 96, 1024, 1024, 96, 96]
    - [12, 18162.0]
  - - [1152, 4096, 1, 3072, 1152, 1152, 3072, 3072]
    - [14, 19510.0]
  - - [3072, 4096, 1, 384, 3072, 3072, 384, 384]
    - [7, 20549.0]
  - - [1536, 4096, 1, 3072, 1536, 1536, 3072, 3072]
    - [14, 20623.0]
  - - [3072, 4096, 1, 1536, 3072, 3072, 1536, 1536]
    - [14, 21137.0]
  - - [6400, 4096, 1, 3072, 6400, 6400, 3072, 3072]
    - [48, 21246.0]
  - - [1024, 1024, 32, 96, 1024, 1024, 96, 96]
    - [12, 18891.0]
  - - [1152, 8192, 1, 3072, 1152, 1152, 3072, 3072]
    - [14, 18577.0]
  - - [3072, 8192, 1, 384, 3072, 3072, 384, 384]
    - [7, 21234.0]
  - - [1536, 8192, 1, 3072, 1536, 1536, 3072, 3072]
    - [40, 19223.0]
  - - [3072, 8192, 1, 1536, 3072, 3072, 1536, 1536]
    - [14, 21719.0]
  - - [6400, 8192, 1, 3072, 6400, 6400, 3072, 3072]
    - [48, 21446.0]
  - - [2048, 4096, 1, 2048, 2048, 2048, 2048, 2048]
    - [14, 20733.0]
  - - [2048, 4096, 1, 4096, 2048, 2048, 4096, 4096]
    - [14, 20515.0]
  - - [29000, 199, 1, 2048, 29000, 29000, 2048, 2048]
    - [12, 15157.0]
  - - [29000, 221, 1, 2048, 29000, 29000, 2048, 2048]
    - [12, 16701.0]
  - - [29000, 224, 1, 2048, 29000, 29000, 2048, 2048]
    - [12, 16824.0]
  - - [29000, 229, 1, 2048, 29000, 29000, 2048, 2048]
    - [32, 16981.0]
  - - [29000, 234, 1, 2048, 29000, 29000, 2048, 2048]
    - [12, 17472.0]
  - - [29000, 242, 1, 2048, 29000, 29000, 2048, 2048]
    - [12, 17907.0]
  - - [29000, 246, 1, 2048, 29000, 29000, 2048, 2048]
    - [48, 18142.0]
  - - [29000, 247, 1, 2048, 29000, 29000, 2048, 2048]
    - [48, 18261.0]
  - - [29000, 256, 1, 2048, 29000, 29000, 2048, 2048]
    - [48, 19492.0]
  - - [29000, 262, 1, 2048, 29000, 29000, 2048, 2048]
    - [12, 13399.0]
  - - [29000, 264, 1, 2048, 29000, 29000, 2048, 2048]
    - [12, 13491.0]
  - - [29000, 265, 1, 2048, 29000, 29000, 2048, 2048]
    - [12, 13523.0]
  - - [29000, 274, 1, 2048, 29000, 29000, 2048, 2048]
    - [12, 13830.0]
  - - [29000, 277, 1, 2048, 29000, 29000, 2048, 2048]
    - [12, 14148.0]
  - - [29000, 279, 1, 2048, 29000, 29000, 2048, 2048]
    - [12, 14241.0]
  - - [29000, 288, 1, 2048, 29000, 29000, 2048, 2048]
    - [12, 14576.0]
  - - [29000, 296, 1, 2048, 29000, 29000, 2048, 2048]
    - [12, 14863.0]
  - - [29000, 315, 1, 2048, 29000, 29000, 2048, 2048]
    - [12, 15671.0]
  - - [29000, 335, 1, 2048, 29000, 29000, 2048, 2048]
    - [12, 16673.0]
  - - [4096, 4096, 1, 2048, 4096, 4096, 2048, 2048]
    - [14, 21120.0]
  - - [29000, 2283, 1, 1024, 29000, 29000, 1024, 1024]
    - [48, 21348.0]
  - - [29000, 2296, 1, 1024, 29000, 29000, 1024, 1024]
    - [48, 21434.0]
  - - [29000, 2306, 1, 1024, 29000, 29000, 1024, 1024]
    - [12, 20063.0]
  - - [29000, 2309, 1, 1024, 29000, 29000, 1024, 1024]
    - [12, 20142.0]
  - - [29000, 2318, 1, 1024, 29000, 29000, 1024, 1024]
    - [12, 20187.0]
  - - [29000, 2320, 1, 1024, 29000, 29000, 1024, 1024]
    - [12, 20211.0]
  - - [29000, 2324, 1, 1024, 29000, 29000, 1024, 1024]
    - [12, 20263.0]
  - - [29000, 2325, 1, 1024, 29000, 29000, 1024, 1024]
    - [12, 20265.0]
  - - [29000, 2329, 1, 1024, 29000, 29000, 1024, 1024]
    - [12, 20312.0]
  - - [29000, 2338, 1, 1024, 29000, 29000, 1024, 1024]
    - [12, 20344.0]
  - - [29000, 2345, 1, 1024, 29000, 29000, 1024, 1024]
    - [12, 20470.0]
  - - [29000, 2350, 1, 1024, 29000, 29000, 1024, 1024]
    - [12, 20468.0]
  - - [29000, 2362, 1, 1024, 29000, 29000, 1024, 1024]
    - [46, 20706.0]
  - - [29000, 2366, 1, 1024, 29000, 29000, 1024, 1024]
    - [12, 20570.0]
  - - [29000, 2368, 1, 1024, 29000, 29000, 1024, 1024]
    - [12, 20626.0]
  - - [29000, 2374, 1, 1024, 29000, 29000, 1024, 1024]
    - [12, 20593.0]
  - - [29000, 2390, 1, 1024, 29000, 29000, 1024, 1024]
    - [12, 20740.0]
  - - [512, 512, 320, 64, 512, 512, 64, 64]
    - [5, 15869.0]
  - - [29000, 561, 1, 1024, 29000, 29000, 1024, 1024]
    - [46, 18436.0]
  - - [29000, 574, 1, 1024, 29000, 29000, 1024, 1024]
    - [46, 18835.0]
  - - [29000, 600, 1, 1024, 29000, 29000, 1024, 1024]
    - [12, 19563.0]
  - - [29000, 608, 1, 1024, 29000, 29000, 1024, 1024]
    - [30, 19807.0]
  - - [29000, 615, 1, 1024, 29000, 29000, 1024, 1024]
    - [12, 20019.0]
  - - [29000, 622, 1, 1024, 29000, 29000, 1024, 1024]
    - [30, 20137.0]
  - - [29000, 625, 1, 1024, 29000, 29000, 1024, 1024]
    - [46, 20159.0]
  - - [29000, 626, 1, 1024, 29000, 29000, 1024, 1024]
    - [46, 20178.0]
  - - [29000, 628, 1, 1024, 29000, 29000, 1024, 1024]
    - [12, 20324.0]
  - - [29000, 636, 1, 1024, 29000, 29000, 1024, 1024]
    - [46, 20537.0]
  - - [29000, 651, 1, 1024, 29000, 29000, 1024, 1024]
    - [32, 18066.0]
  - - [29000, 658, 1, 1024, 29000, 29000, 1024, 1024]
    - [32, 18307.0]
  - - [29000, 669, 1, 1024, 29000, 29000, 1024, 1024]
    - [32, 18459.0]
  - - [29000, 670, 1, 1024, 29000, 29000, 1024, 1024]
    - [32, 18581.0]
  - - [29000, 672, 1, 1024, 29000, 29000, 1024, 1024]
    - [32, 18531.0]
  - - [29000, 684, 1, 1024, 29000, 29000, 1024, 1024]
    - [32, 18911.0]
  - - [29000, 716, 1, 1024, 29000, 29000, 1024, 1024]
    - [32, 19733.0]
  - - [29000, 730, 1, 1024, 29000, 29000, 1024, 1024]
    - [32, 20050.0]
  - - [2560, 1024, 1, 2560, 2560, 2560, 2560, 2560]
    - [14, 20324.0]
  - - [2560, 1024, 1, 4096, 2560, 2560, 4096, 4096]
    - [14, 20925.0]
  - - [4096, 1024, 1, 2560, 4096, 4096, 2560, 2560]
    - [14, 19204.0]
  - - [1024, 1024, 512, 64, 1024, 1024, 64, 64]
    - [12, 17661.0]
  - - [1024, 32768, 1, 4096, 1024, 1024, 4096, 4096]
    - [48, 18872.0]
  - - [3072, 32768, 1, 1024, 3072, 3072, 1024, 1024]
    - [14, 21391.0]
  - - [4096, 32768, 1, 1024, 4096, 4096, 1024, 1024]
    - [14, 21315.0]
  - - [50304, 32768, 1, 1024, 50304, 50304, 1024, 1024]
    - [48, 21688.0]
  - - [1024, 1024, 24, 128, 1024, 1024, 128, 128]
    - [5, 19520.0]
  - - [128, 1024, 24, 1024, 128, 128, 1024, 1024]
    - [48, 18466.0]
  - - [128, 128, 49, 12800, 128, 128, 12800, 12800]
    - [56, 13731.0]
  - - [128, 128, 25, 25088, 128, 128, 25088, 25088]
    - [54, 13363.0]
  - - [128, 128, 49, 25600, 128, 128, 25600, 25600]
    - [57, 12513.0]
  - - [128, 128, 25, 50176, 128, 128, 50176, 50176]
    - [54, 12548.0]
  - - [128, 128, 36, 12544, 128, 128, 12544, 12544]
    - [57, 13527.0]
  - - [128, 128, 49, 9216, 128, 128, 9216, 9216]
    - [57, 12430.0]
  - - [1024, 1024, 1, 12544, 1024, 1024, 12544, 12544]
    - [52, 18711.0]
  - - [1024, 1000, 1, 12544, 1024, 1024, 12544, 12544]
    - [53, 17637.0]
  - - [128, 128, 36, 12000, 128, 128, 12000, 12000]
    - [55, 16608.0]
  - - [5888, 128, 1, 1, 5888, 5888, 1, 1]
    - [67, 209.0]
  - - [1856, 256, 1, 1, 1856, 1856, 1, 1]
    - [67, 208.0]
  - - [256, 1856, 1, 32, 256, 256, 32, 32]
    - [73, 3263.0]
  - - [128, 3584, 1, 1280, 128, 128, 1280, 1280]
    - [68, 13219.0]
  - - [2944, 128, 1, 32, 2944, 2944, 32, 32]
    - [58, 3745.0]
  - - [64, 6784, 1, 1, 64, 64, 1, 1]
    - [67, 158.0]
  - - [64, 5056, 1, 3328, 64, 64, 3328, 3328]
    - [97, 11936.0]
  - - [704, 1024, 1, 1, 704, 704, 1, 1]
    - [58, 282.0]
  - - [256, 1856, 1, 1280, 256, 256, 1280, 1280]
    - [68, 13885.0]
  - - [256, 1408, 1, 1, 256, 256, 1, 1]
    - [73, 81.0]
  - - [1024, 1024, 1, 1280, 1024, 1024, 1280, 1280]
    - [63, 13718.0]
  - - [704, 1408, 1, 3328, 704, 704, 3328, 3328]
    - [77, 13397.0]
  - - [1408, 704, 1, 256, 1408, 1408, 256, 256]
    - [90, 11278.0]
  - - [6784, 128, 1, 3328, 6784, 6784, 3328, 3328]
    - [63, 15570.0]
  - - [2944, 256, 1, 1, 2944, 2944, 1, 1]
    - [86, 154.0]
  - - [2944, 256, 1, 32, 2944, 2944, 32, 32]
    - [88, 4074.0]
  - - [128, 4288, 1, 3328, 128, 128, 3328, 3328]
    - [83, 13878.0]
  - - [5056, 128, 1, 256, 5056, 5056, 256, 256]
    - [99, 10152.0]
  - - [1856, 704, 1, 1280, 1856, 1856, 1280, 1280]
    - [99, 13937.0]
  - - [2368, 256, 1, 32, 2368, 2368, 32, 32]
    - [94, 3288.0]
  - - [5056, 64, 1, 32, 5056, 5056, 32, 32]
    - [61, 1817.0]
  - - [64, 6784, 1, 3328, 64, 64, 3328, 3328]
    - [61, 11135.0]
  - - [2944, 256, 1, 1280, 2944, 2944, 1280, 1280]
    - [76, 13339.0]
  - - [1024, 1024, 1, 3328, 1024, 1024, 3328, 3328]
    - [77, 14132.0]
  - - [5888, 64, 1, 256, 5888, 5888, 256, 256]
    - [98, 7364.0]
  - - [2944, 448, 1, 256, 2944, 2944, 256, 256]
    - [90, 11732.0]
  - - [5056, 64, 1, 3328, 5056, 5056, 3328, 3328]
    - [82, 12946.0]
  - - [1024, 448, 1, 32, 1024, 1024, 32, 32]
    - [65, 2594.0]
  - - [128, 2944, 1, 3328, 128, 128, 3328, 3328]
    - [75, 11980.0]
  - - [256, 1856, 1, 1, 256, 256, 1, 1]
    - [90, 123.0]
  - - [256, 3584, 1, 3328, 256, 256, 3328, 3328]
    - [63, 16093.0]
  - - [256, 4288, 1, 1280, 256, 256, 1280, 1280]
    - [98, 14515.0]
  - - [4288, 256, 1, 256, 4288, 4288, 256, 256]
    - [63, 11527.0]
  - - [128, 5888, 1, 32, 128, 128, 32, 32]
    - [72, 3733.0]
  - - [128, 5888, 1, 1280, 128, 128, 1280, 1280]
    - [68, 13325.0]
  - - [3584, 256, 1, 256, 3584, 3584, 256, 256]
    - [91, 12388.0]
  - - [1856, 256, 1, 256, 1856, 1856, 256, 256]
    - [89, 10343.0]
  - - [1024, 704, 1, 1, 1024, 1024, 1, 1]
    - [97, 146.0]
  - - [448, 1408, 1, 3328, 448, 448, 3328, 3328]
    - [97, 11659.0]
  - - [1024, 704, 1, 32, 1024, 1024, 32, 32]
    - [84, 4453.0]
  - - [448, 2944, 1, 256, 448, 448, 256, 256]
    - [83, 11732.0]
  - - [5888, 128, 1, 3328, 5888, 5888, 3328, 3328]
    - [90, 13661.0]
  - - [2944, 448, 1, 1, 2944, 2944, 1, 1]
    - [58, 217.0]
  - - [5056, 64, 1, 1280, 5056, 5056, 1280, 1280]
    - [97, 10814.0]
  - - [704, 704, 1, 32, 704, 704, 32, 32]
    - [72, 2773.0]
  - - [256, 4288, 1, 256, 256, 256, 256, 256]
    - [76, 12009.0]
  - - [5056, 128, 1, 1, 5056, 5056, 1, 1]
    - [79, 127.0]
  - - [704, 448, 1, 1280, 704, 704, 1280, 1280]
    - [75, 10748.0]
  - - [1024, 704, 1, 1280, 1024, 1024, 1280, 1280]
    - [62, 12805.0]
  - - [2368, 448, 1, 256, 2368, 2368, 256, 256]
    - [91, 11085.0]
  - - [4288, 256, 1, 3328, 4288, 4288, 3328, 3328]
    - [77, 14759.0]
  - - [128, 6784, 1, 32, 128, 128, 32, 32]
    - [58, 4383.0]
  - - [128, 6784, 1, 3328, 128, 128, 3328, 3328]
    - [91, 15176.0]
  - - [4288, 128, 1, 1, 4288, 4288, 1, 1]
    - [94, 111.0]
  - - [256, 2368, 1, 32, 256, 256, 32, 32]
    - [87, 3299.0]
  - - [448, 1024, 1, 256, 448, 448, 256, 256]
    - [75, 8317.0]
  - - [256, 1408, 1, 32, 256, 256, 32, 32]
    - [59, 2031.0]
  - - [256, 3584, 1, 32, 256, 256, 32, 32]
    - [58, 4720.0]
  - - [128, 4288, 1, 32, 128, 128, 32, 32]
    - [86, 2744.0]
  - - [448, 1856, 1, 1, 448, 448, 1, 1]
    - [58, 160.0]
  - - [448, 1856, 1, 32, 448, 448, 32, 32]
    - [58, 4264.0]
  - - [448, 1856, 1, 3328, 448, 448, 3328, 3328]
    - [77, 14547.0]
  - - [1024, 448, 1, 256, 1024, 1024, 256, 256]
    - [82, 9020.0]
  - - [704, 1856, 1, 32, 704, 704, 32, 32]
    - [97, 5333.0]
  - - [704, 1408, 1, 32, 704, 704, 32, 32]
    - [94, 4748.0]
  - - [5888, 128, 1, 32, 5888, 5888, 32, 32]
    - [66, 4047.0]
  - - [128, 4288, 1, 1280, 128, 128, 1280, 1280]
    - [69, 13049.0]
  - - [1856, 704, 1, 3328, 1856, 1856, 3328, 3328]
    - [83, 14044.0]
  - - [4288, 128, 1, 256, 4288, 4288, 256, 256]
    - [83, 8620.0]
  - - [704, 1856, 1, 3328, 704, 704, 3328, 3328]
    - [99, 14092.0]
  - - [2944, 128, 1, 1280, 2944, 2944, 1280, 1280]
    - [76, 10454.0]
  - - [1408, 448, 1, 1280, 1408, 1408, 1280, 1280]
    - [98, 13461.0]
  - - [128, 2368, 1, 1, 128, 128, 1, 1]
    - [58, 66.0]
  - - [128, 2944, 1, 1280, 128, 128, 1280, 1280]
    - [98, 10541.0]
  - - [1024, 448, 1, 1, 1024, 1024, 1, 1]
    - [94, 93.0]
  - - [256, 2944, 1, 256, 256, 256, 256, 256]
    - [90, 10925.0]
  - - [704, 448, 1, 32, 704, 704, 32, 32]
    - [72, 1815.0]
  - - [704, 1024, 1, 256, 704, 704, 256, 256]
    - [62, 9954.0]
  - - [1408, 448, 1, 3328, 1408, 1408, 3328, 3328]
    - [98, 14163.0]
  - - [256, 2368, 1, 1, 256, 256, 1, 1]
    - [73, 223.0]
  - - [5888, 64, 1, 3328, 5888, 5888, 3328, 3328]
    - [82, 11161.0]
  - - [704, 448, 1, 3328, 704, 704, 3328, 3328]
    - [61, 11722.0]
  - - [4288, 256, 1, 1, 4288, 4288, 1, 1]
    - [72, 181.0]
  - - [1856, 448, 1, 3328, 1856, 1856, 3328, 3328]
    - [91, 14524.0]
  - - [4288, 256, 1, 1280, 4288, 4288, 1280, 1280]
    - [83, 14361.0]
  - - [448, 2368, 1, 1280, 448, 448, 1280, 1280]
    - [63, 13985.0]
  - - [3584, 256, 1, 1, 3584, 3584, 1, 1]
    - [88, 310.0]
  - - [2368, 448, 1, 32, 2368, 2368, 32, 32]
    - [79, 4992.0]
  - - [1408, 704, 1, 1, 1408, 1408, 1, 1]
    - [58, 180.0]
  - - [2368, 256, 1, 256, 2368, 2368, 256, 256]
    - [69, 10130.0]
  - - [1856, 256, 1, 1280, 1856, 1856, 1280, 1280]
    - [68, 12777.0]
  - - [256, 2944, 1, 1, 256, 256, 1, 1]
    - [100, 188.0]
  - - [6784, 64, 1, 1, 6784, 6784, 1, 1]
    - [82, 163.0]
  - - [6784, 64, 1, 256, 6784, 6784, 256, 256]
    - [98, 8459.0]
  - - [448, 2368, 1, 256, 448, 448, 256, 256]
    - [69, 11094.0]
  - - [128, 2368, 1, 3328, 128, 128, 3328, 3328]
    - [77, 13238.0]
  - - [64, 5056, 1, 256, 64, 64, 256, 256]
    - [67, 7104.0]
  - - [2368, 448, 1, 3328, 2368, 2368, 3328, 3328]
    - [77, 14195.0]
  - - [256, 2368, 1, 3328, 256, 256, 3328, 3328]
    - [77, 15417.0]
  - - [5888, 64, 1, 1, 5888, 5888, 1, 1]
    - [71, 134.0]
  - - [256, 3584, 1, 1, 256, 256, 1, 1]
    - [95, 172.0]
  - - [704, 1856, 1, 1280, 704, 704, 1280, 1280]
    - [77, 13700.0]
  - - [448, 1024, 1, 3328, 448, 448, 3328, 3328]
    - [61, 12255.0]
  - - [128, 5056, 1, 32, 128, 128, 32, 32]
    - [90, 4125.0]
  - - [128, 5056, 1, 1280, 128, 128, 1280, 1280]
    - [99, 15155.0]
  - - [5888, 64, 1, 32, 5888, 5888, 32, 32]
    - [79, 2169.0]
  - - [2368, 256, 1, 1, 2368, 2368, 1, 1]
    - [91, 167.0]
  - - [5888, 64, 1, 1280, 5888, 5888, 1280, 1280]
    - [68, 10472.0]
  - - [256, 1408, 1, 256, 256, 256, 256, 256]
    - [67, 7780.0]
  - - [5056, 64, 1, 1, 5056, 5056, 1, 1]
    - [71, 87.0]
  - - [1408, 448, 1, 32, 1408, 1408, 32, 32]
    - [86, 5734.0]
  - - [5056, 128, 1, 1280, 5056, 5056, 1280, 1280]
    - [69, 15992.0]
  - - [1856, 704, 1, 256, 1856, 1856, 256, 256]
    - [63, 11518.0]
  - - [128, 6784, 1, 256, 128, 128, 256, 256]
    - [76, 12174.0]
  - - [256, 3584, 1, 256, 256, 256, 256, 256]
    - [69, 12494.0]
  - - [448, 704, 1, 1, 448, 448, 1, 1]
    - [79, 69.0]
  - - [448, 704, 1, 32, 448, 448, 32, 32]
    - [58, 1862.0]
  - - [448, 704, 1, 3328, 448, 448, 3328, 3328]
    - [61, 11783.0]
  - - [64, 5888, 1, 1, 64, 64, 1, 1]
    - [72, 76.0]
  - - [2368, 128, 1, 32, 2368, 2368, 32, 32]
    - [58, 1738.0]
  - - [2368, 256, 1, 1280, 2368, 2368, 1280, 1280]
    - [69, 14248.0]
  - - [2368, 128, 1, 3328, 2368, 2368, 3328, 3328]
    - [83, 13410.0]
  - - [4288, 256, 1, 32, 4288, 4288, 32, 32]
    - [86, 5004.0]
  - - [448, 1408, 1, 1, 448, 448, 1, 1]
    - [79, 127.0]
  - - [1408, 256, 1, 256, 1408, 1408, 256, 256]
    - [97, 7690.0]
  - - [256, 4288, 1, 32, 256, 256, 32, 32]
    - [86, 5322.0]
  - - [1408, 256, 1, 1280, 1408, 1408, 1280, 1280]
    - [89, 11242.0]
  - - [448, 1408, 1, 256, 448, 448, 256, 256]
    - [89, 9443.0]
  - - [128, 2944, 1, 32, 128, 128, 32, 32]
    - [94, 3224.0]
  - - [1856, 448, 1, 1, 1856, 1856, 1, 1]
    - [82, 208.0]
  - - [704, 704, 1, 1, 704, 704, 1, 1]
    - [96, 112.0]
  - - [1856, 448, 1, 1280, 1856, 1856, 1280, 1280]
    - [77, 13891.0]
  - - [128, 5888, 1, 256, 128, 128, 256, 256]
    - [68, 10864.0]
  - - [3584, 256, 1, 3328, 3584, 3584, 3328, 3328]
    - [91, 16120.0]
  - - [448, 2368, 1, 1, 448, 448, 1, 1]
    - [94, 185.0]
  - - [128, 6784, 1, 1, 128, 128, 1, 1]
    - [61, 172.0]
  - - [256, 2944, 1, 3328, 256, 256, 3328, 3328]
    - [62, 13888.0]
  - - [64, 5888, 1, 256, 64, 64, 256, 256]
    - [67, 8660.0]
  - - [704, 704, 1, 256, 704, 704, 256, 256]
    - [89, 8860.0]
  - - [448, 1024, 1, 32, 448, 448, 32, 32]
    - [86, 2594.0]
  - - [256, 2368, 1, 256, 256, 256, 256, 256]
    - [62, 10183.0]
  - - [448, 704, 1, 1280, 448, 448, 1280, 1280]
    - [89, 10742.0]
  - - [704, 1856, 1, 1, 704, 704, 1, 1]
    - [58, 192.0]
  - - [704, 448, 1, 256, 704, 704, 256, 256]
    - [67, 7070.0]
  - - [2368, 448, 1, 1280, 2368, 2368, 1280, 1280]
    - [91, 13678.0]
  - - [128, 5056, 1, 1, 128, 128, 1, 1]
    - [61, 121.0]
  - - [256, 2368, 1, 1280, 256, 256, 1280, 1280]
    - [91, 14859.0]
  - - [64, 6784, 1, 256, 64, 64, 256, 256]
    - [67, 7794.0]
  - - [128, 3584, 1, 256, 128, 128, 256, 256]
    - [90, 9034.0]
  - - [704, 1408, 1, 1, 704, 704, 1, 1]
    - [58, 182.0]
  - - [4288, 128, 1, 3328, 4288, 4288, 3328, 3328]
    - [63, 14101.0]
  - - [128, 6784, 1, 1280, 128, 128, 1280, 1280]
    - [69, 14594.0]
  - - [3584, 256, 1, 32, 3584, 3584, 32, 32]
    - [72, 4661.0]
  - - [1408, 256, 1, 32, 1408, 1408, 32, 32]
    - [72, 2082.0]
  - - [5888, 128, 1, 256, 5888, 5888, 256, 256]
    - [76, 10876.0]
  - - [128, 5056, 1, 3328, 128, 128, 3328, 3328]
    - [69, 16324.0]
  - - [1024, 448, 1, 3328, 1024, 1024, 3328, 3328]
    - [68, 13399.0]
  - - [3584, 128, 1, 1, 3584, 3584, 1, 1]
    - [67, 93.0]
  - - [128, 2368, 1, 256, 128, 128, 256, 256]
    - [68, 7211.0]
  - - [448, 1856, 1, 256, 448, 448, 256, 256]
    - [69, 10455.0]
  - - [3584, 128, 1, 256, 3584, 3584, 256, 256]
    - [68, 8857.0]
  - - [1024, 448, 1, 1280, 1024, 1024, 1280, 1280]
    - [82, 12552.0]
  - - [128, 5888, 1, 1, 128, 128, 1, 1]
    - [102, 209.0]
  - - [64, 5056, 1, 1, 64, 64, 1, 1]
    - [58, 63.0]
  - - [1856, 256, 1, 32, 1856, 1856, 32, 32]
    - [94, 2677.0]
  - - [64, 5056, 1, 32, 64, 64, 32, 32]
    - [94, 1692.0]
  - - [1408, 704, 1, 32, 1408, 1408, 32, 32]
    - [66, 5003.0]
  - - [1408, 704, 1, 1280, 1408, 1408, 1280, 1280]
    - [91, 13280.0]
  - - [1024, 1024, 1, 32, 1024, 1024, 32, 32]
    - [98, 6848.0]
  - - [5056, 128, 1, 3328, 5056, 5056, 3328, 3328]
    - [91, 16647.0]
  - - [128, 4288, 1, 1, 128, 128, 1, 1]
    - [80, 178.0]
  - - [2944, 128, 1, 3328, 2944, 2944, 3328, 3328]
    - [82, 11150.0]
  - - [5888, 128, 1, 1280, 5888, 5888, 1280, 1280]
    - [82, 13365.0]
  - - [2944, 128, 1, 256, 2944, 2944, 256, 256]
    - [89, 7596.0]
  - - [6784, 128, 1, 1, 6784, 6784, 1, 1]
    - [74, 275.0]
  - - [1408, 256, 1, 3328, 1408, 1408, 3328, 3328]
    - [76, 10915.0]
  - - [2944, 256, 1, 256, 2944, 2944, 256, 256]
    - [82, 10743.0]
  - - [6784, 128, 1, 256, 6784, 6784, 256, 256]
    - [83, 11952.0]
  - - [6784, 64, 1, 1280, 6784, 6784, 1280, 1280]
    - [98, 11988.0]
  - - [2944, 448, 1, 1280, 2944, 2944, 1280, 1280]
    - [77, 13838.0]
  - - [704, 448, 1, 1, 704, 704, 1, 1]
    - [58, 67.0]
  - - [256, 1408, 1, 3328, 256, 256, 3328, 3328]
    - [61, 11977.0]
  - - [2944, 128, 1, 1, 2944, 2944, 1, 1]
    - [66, 83.0]
  - - [704, 1024, 1, 32, 704, 704, 32, 32]
    - [86, 3832.0]
  - - [3584, 256, 1, 1280, 3584, 3584, 1280, 1280]
    - [91, 15449.0]
  - - [3584, 128, 1, 1280, 3584, 3584, 1280, 1280]
    - [98, 12563.0]
  - - [256, 1856, 1, 256, 256, 256, 256, 256]
    - [62, 9400.0]
  - - [256, 2944, 1, 1280, 256, 256, 1280, 1280]
    - [62, 13813.0]
  - - [2944, 256, 1, 3328, 2944, 2944, 3328, 3328]
    - [90, 13682.0]
  - - [704, 1024, 1, 3328, 704, 704, 3328, 3328]
    - [82, 13163.0]
  - - [448, 2944, 1, 1, 448, 448, 1, 1]
    - [94, 220.0]
  - - [448, 1856, 1, 1280, 448, 448, 1280, 1280]
    - [63, 13808.0]
  - - [2368, 448, 1, 1, 2368, 2368, 1, 1]
    - [75, 308.0]
  - - [448, 2944, 1, 32, 448, 448, 32, 32]
    - [94, 8179.0]
  - - [448, 2944, 1, 1280, 448, 448, 1280, 1280]
    - [91, 13813.0]
  - - [128, 2368, 1, 1280, 128, 128, 1280, 1280]
    - [99, 11581.0]
  - - [448, 2944, 1, 3328, 448, 448, 3328, 3328]
    - [77, 14247.0]
  - - [2368, 128, 1, 1280, 2368, 2368, 1280, 1280]
    - [69, 11547.0]
  - - [128, 3584, 1, 3328, 128, 128, 3328, 3328]
    - [90, 13516.0]
  - - [256, 4288, 1, 3328, 256, 256, 3328, 3328]
    - [77, 14835.0]
  - - [1856, 704, 1, 32, 1856, 1856, 32, 32]
    - [58, 5333.0]
  - - [2944, 448, 1, 32, 2944, 2944, 32, 32]
    - [66, 5658.0]
  - - [5056, 128, 1, 32, 5056, 5056, 32, 32]
    - [86, 3522.0]
  - - [6784, 128, 1, 1280, 6784, 6784, 1280, 1280]
    - [77, 14972.0]
  - - [1408, 704, 1, 3328, 1408, 1408, 3328, 3328]
    - [91, 13323.0]
  - - [1856, 704, 1, 1, 1856, 1856, 1, 1]
    - [94, 216.0]
  - - [256, 1856, 1, 3328, 256, 256, 3328, 3328]
    - [62, 14001.0]
  - - [4288, 128, 1, 1280, 4288, 4288, 1280, 1280]
    - [83, 13020.0]
  - - [128, 4288, 1, 256, 128, 128, 256, 256]
    - [68, 9418.0]
  - - [6784, 128, 1, 32, 6784, 6784, 32, 32]
    - [87, 4369.0]
  - - [1408, 448, 1, 1, 1408, 1408, 1, 1]
    - [88, 132.0]
  - - [64, 5056, 1, 1280, 64, 64, 1280, 1280]
    - [67, 10697.0]
  - - [448, 1408, 1, 32, 448, 448, 32, 32]
    - [100, 5097.0]
  - - [128, 5056, 1, 256, 128, 128, 256, 256]
    - [68, 10772.0]
  - - [1024, 1024, 1, 1, 1024, 1024, 1, 1]
    - [79, 186.0]
  - - [256, 1408, 1, 1280, 256, 256, 1280, 1280]
    - [75, 10996.0]
  - - [64, 5888, 1, 3328, 64, 64, 3328, 3328]
    - [75, 10191.0]
  - - [6784, 64, 1, 3328, 6784, 6784, 3328, 3328]
    - [82, 12631.0]
  - - [2944, 448, 1, 3328, 2944, 2944, 3328, 3328]
    - [91, 14304.0]
  - - [448, 1408, 1, 1280, 448, 448, 1280, 1280]
    - [61, 11654.0]
  - - [2368, 128, 1, 1, 2368, 2368, 1, 1]
    - [61, 55.0]
  - - [5056, 64, 1, 256, 5056, 5056, 256, 256]
    - [67, 7370.0]
  - - [2368, 128, 1, 256, 2368, 2368, 256, 256]
    - [67, 6724.0]
  - - [64, 6784, 1, 32, 64, 64, 32, 32]
    - [72, 2157.0]
  - - [256, 4288, 1, 1, 256, 256, 1, 1]
    - [66, 195.0]
  - - [128, 2944, 1, 256, 128, 128, 256, 256]
    - [81, 7780.0]
  - - [3584, 128, 1, 32, 3584, 3584, 32, 32]
    - [73, 2488.0]
  - - [3584, 128, 1, 3328, 3584, 3584, 3328, 3328]
    - [68, 13449.0]
  - - [704, 704, 1, 3328, 704, 704, 3328, 3328]
    - [99, 12668.0]
  - - [128, 2944, 1, 1, 128, 128, 1, 1]
    - [77, 76.0]
  - - [704, 1408, 1, 1280, 704, 704, 1280, 1280]
    - [99, 13170.0]
  - - [6784, 64, 1, 32, 6784, 6784, 32, 32]
    - [94, 2363.0]
  - - [64, 6784, 1, 1280, 64, 64, 1280, 1280]
    - [67, 10349.0]
  - - [704, 1408, 1, 256, 704, 704, 256, 256]
    - [63, 10789.0]
  - - [4288, 128, 1, 32, 4288, 4288, 32, 32]
    - [58, 3114.0]
  - - [448, 704, 1, 256, 448, 448, 256, 256]
    - [67, 6984.0]
  - - [1856, 256, 1, 3328, 1856, 1856, 3328, 3328]
    - [98, 13788.0]
  - - [448, 1024, 1, 1280, 448, 448, 1280, 1280]
    - [61, 11660.0]
  - - [1024, 1024, 1, 256, 1024, 1024, 256, 256]
    - [63, 11712.0]
  - - [256, 2944, 1, 32, 256, 256, 32, 32]
    - [58, 3980.0]
  - - [704, 1024, 1, 1280, 704, 704, 1280, 1280]
    - [68, 12637.0]
  - - [256, 3584, 1, 1280, 256, 256, 1280, 1280]
    - [63, 15449.0]
  - - [128, 2368, 1, 32, 128, 128, 32, 32]
    - [87, 1690.0]
  - - [704, 1856, 1, 256, 704, 704, 256, 256]
    - [77, 11574.0]
  - - [1856, 448, 1, 32, 1856, 1856, 32, 32]
    - [67, 6554.0]
  - - [1408, 448, 1, 256, 1408, 1408, 256, 256]
    - [90, 10568.0]
  - - [448, 1024, 1, 1, 448, 448, 1, 1]
    - [79, 96.0]
  - - [1024, 704, 1, 256, 1024, 1024, 256, 256]
    - [82, 10522.0]
  - - [64, 5888, 1, 32, 64, 64, 32, 32]
    - [65, 1926.0]
  - - [1856, 448, 1, 256, 1856, 1856, 256, 256]
    - [91, 10643.0]
  - - [128, 5888, 1, 3328, 128, 128, 3328, 3328]
    - [90, 13870.0]
  - - [2368, 256, 1, 3328, 2368, 2368, 3328, 3328]
    - [63, 15707.0]
  - - [64, 5888, 1, 1280, 64, 64, 1280, 1280]
    - [97, 9925.0]
  - - [1408, 256, 1, 1, 1408, 1408, 1, 1]
    - [61, 77.0]
  - - [704, 704, 1, 1280, 704, 704, 1280, 1280]
    - [89, 11862.0]
  - - [128, 3584, 1, 1, 128, 128, 1, 1]
    - [66, 88.0]
  - - [128, 3584, 1, 32, 128, 128, 32, 32]
    - [58, 2353.0]
  - - [448, 2368, 1, 32, 448, 448, 32, 32]
    - [58, 4906.0]
  - - [448, 2368, 1, 3328, 448, 448, 3328, 3328]
    - [77, 14192.0]
  - - [1024, 704, 1, 3328, 1024, 1024, 3328, 3328]
    - [76, 13208.0]
  - - [2048, 400, 1, 512, 2048, 2048, 512, 512]
    - [82, 11038.0]
  - - [2560, 128, 1, 2560, 2560, 2560, 2560, 2560]
    - [69, 13689.0]
  - - [1024, 700, 1, 512, 1024, 1024, 512, 512]
    - [98, 11135.0]
  - - [4096, 128, 1, 4096, 4096, 4096, 4096, 4096]
    - [69, 13201.0]
  - - [3072, 128, 1, 1024, 3072, 3072, 1024, 1024]
    - [82, 10298.0]
  - - [7680, 64, 1, 2560, 7680, 7680, 2560, 2560]
    - [68, 13423.0]
  - - [7680, 128, 1, 2560, 7680, 7680, 2560, 2560]
    - [83, 16730.0]
  - - [1024, 1024, 1, 1024, 1024, 1024, 1024, 1024]
    - [83, 13469.0]
  - - [2049, 512, 1, 2048, 2049, 2049, 2048, 2048]
    - [69, 13725.0]
  - - [1023, 512, 1, 1024, 1023, 1023, 1024, 1024]
    - [99, 11829.0]
  - - [1024, 512, 1, 1025, 1024, 1024, 1025, 1025]
    - [99, 12918.0]
  - - [1024, 1024, 1, 1023, 1024, 1024, 1023, 1023]
    - [83, 13888.0]
  - - [1024, 1025, 1, 1024, 1024, 1024, 1024, 1024]
    - [69, 13375.0]
  - - [1024, 1023, 1, 1024, 1024, 1024, 1024, 1024]
    - [69, 13110.0]
  - - [2048, 511, 1, 2048, 2048, 2048, 2048, 2048]
    - [69, 13660.0]
  - - [2047, 512, 1, 2048, 2047, 2047, 2048, 2048]
    - [69, 13712.0]
  - - [1025, 1024, 1, 1024, 1025, 1025, 1024, 1024]
    - [99, 13207.0]
  - - [1024, 1024, 1, 1025, 1024, 1024, 1025, 1025]
    - [63, 13496.0]
  - - [1025, 512, 1, 1024, 1025, 1025, 1024, 1024]
    - [99, 12735.0]
  - - [1024, 512, 1, 1023, 1024, 1024, 1023, 1023]
    - [77, 13217.0]
  - - [2048, 513, 1, 2048, 2048, 2048, 2048, 2048]
    - [69, 13641.0]
  - - [1024, 511, 1, 1024, 1024, 1024, 1024, 1024]
    - [83, 11608.0]
  - - [2048, 512, 1, 2047, 2048, 2048, 2047, 2047]
    - [77, 13972.0]
  - - [1024, 513, 1, 1024, 1024, 1024, 1024, 1024]
    - [99, 12083.0]
  - - [2048, 512, 1, 2049, 2048, 2048, 2049, 2049]
    - [91, 13935.0]
  - - [1023, 1024, 1, 1024, 1023, 1023, 1024, 1024]
    - [68, 13220.0]
  - - [64, 128, 512, 128, 64, 64, 128, 128]
    - [100, 8918.0]
  - - [64, 512, 64, 512, 64, 64, 512, 512]
    - [70, 9020.0]
  - - [256, 1280, 1, 1024, 256, 256, 1024, 1024]
    - [83, 11865.0]
  - - [256, 1536, 1, 1024, 256, 256, 1024, 1024]
    - [68, 10663.0]
  - - [256, 2304, 1, 1024, 256, 256, 1024, 1024]
    - [69, 13827.0]
  - - [256, 2560, 1, 1024, 256, 256, 1024, 1024]
    - [69, 15128.0]
  - - [256, 2816, 1, 1024, 256, 256, 1024, 1024]
    - [68, 12470.0]
  - - [256, 3328, 1, 1024, 256, 256, 1024, 1024]
    - [69, 14062.0]
  - - [256, 3584, 1, 1024, 256, 256, 1024, 1024]
    - [69, 15105.0]
  - - [512, 1600, 1, 512, 512, 512, 512, 512]
    - [82, 13010.0]
  - - [1024, 512, 1, 1024, 1024, 1024, 1024, 1024]
    - [69, 12319.0]
  - - [1024, 512, 1, 1600, 1024, 1024, 1600, 1600]
    - [77, 13111.0]
  - - [1024, 960, 1, 1024, 1024, 1024, 1024, 1024]
    - [68, 14122.0]
  - - [1024, 960, 1, 1600, 1024, 1024, 1600, 1600]
    - [90, 14903.0]
  - - [2048, 215, 1, 512, 2048, 2048, 512, 512]
    - [97, 9187.0]
  - - [2048, 215, 1, 768, 2048, 2048, 768, 768]
    - [89, 9813.0]
  - - [2048, 256, 1, 512, 2048, 2048, 512, 512]
    - [69, 11355.0]
  - - [2048, 256, 1, 768, 2048, 2048, 768, 768]
    - [99, 12056.0]
  - - [2048, 512, 1, 67, 2048, 2048, 67, 67]
    - [72, 7364.0]
  - - [2048, 512, 1, 74, 2048, 2048, 74, 74]
    - [86, 8117.0]
  - - [2048, 512, 1, 100, 2048, 2048, 100, 100]
    - [86, 8887.0]
  - - [2048, 512, 1, 2048, 2048, 2048, 2048, 2048]
    - [83, 13661.0]
  - - [1024, 512, 1, 4096, 1024, 1024, 4096, 4096]
    - [83, 13115.0]
  - - [30522, 77, 1, 1024, 30522, 30522, 1024, 1024]
    - [83, 10247.0]
  - - [1024, 780, 1, 1024, 1024, 1024, 1024, 1024]
    - [83, 12991.0]
  - - [1024, 800, 1, 1024, 1024, 1024, 1024, 1024]
    - [69, 13307.0]
  - - [1024, 820, 1, 1024, 1024, 1024, 1024, 1024]
    - [83, 13486.0]
  - - [1024, 385, 1, 1024, 1024, 1024, 1024, 1024]
    - [82, 10272.0]
  - - [1024, 462, 1, 1024, 1024, 1024, 1024, 1024]
    - [99, 11005.0]
  - - [1024, 1024, 1, 4096, 1024, 1024, 4096, 4096]
    - [69, 14009.0]
  - - [480, 1024, 1, 1024, 480, 480, 1024, 1024]
    - [69, 11455.0]
  - - [480, 2048, 1, 2048, 480, 480, 2048, 2048]
    - [98, 12912.0]
  - - [1024, 480, 1, 1024, 1024, 1024, 1024, 1024]
    - [99, 11225.0]
  - - [2048, 480, 1, 2048, 2048, 2048, 2048, 2048]
    - [99, 12884.0]
  - - [64, 1024, 256, 1024, 64, 64, 1024, 1024]
    - [84, 9934.0]
  - - [64, 512, 40, 512, 64, 64, 512, 512]
    - [84, 8879.0]
  - - [96, 1024, 64, 1024, 96, 96, 1024, 1024]
    - [69, 13061.0]
  - - [64, 1024, 128, 1024, 64, 64, 1024, 1024]
    - [70, 9859.0]
  - - [64, 1024, 32, 1024, 64, 64, 1024, 1024]
    - [84, 9088.0]
  - - [64, 512, 128, 512, 64, 64, 512, 512]
    - [100, 9521.0]
  - - [96, 1024, 128, 1024, 96, 96, 1024, 1024]
    - [69, 13389.0]
  - - [64, 512, 256, 512, 64, 64, 512, 512]
    - [100, 9700.0]
  - - [64, 1024, 64, 1024, 64, 64, 1024, 1024]
    - [84, 9666.0]
  - - [960, 1024, 1, 1024, 960, 960, 1024, 1024]
    - [69, 13228.0]
  - - [64, 128, 1024, 128, 64, 64, 128, 128]
    - [89, 9788.0]
  - - [1024, 864, 1, 1024, 1024, 1024, 1024, 1024]
    - [83, 14985.0]
  - - [1024, 864, 1, 480, 1024, 1024, 480, 480]
    - [91, 14514.0]
  - - [128, 3456, 1, 256, 128, 128, 256, 256]
    - [68, 10889.0]
  - - [128, 4096, 1, 256, 128, 128, 256, 256]
    - [69, 11355.0]
  - - [128, 6912, 1, 256, 128, 128, 256, 256]
    - [69, 11833.0]
  - - [256, 3456, 1, 512, 256, 256, 512, 512]
    - [99, 13743.0]
  - - [256, 4096, 1, 512, 256, 256, 512, 512]
    - [69, 12887.0]
  - - [512, 864, 1, 1024, 512, 512, 1024, 1024]
    - [98, 11651.0]
  - - [512, 864, 1, 13, 512, 512, 13, 13]
    - [82, 786.0]
  - - [64, 128, 1280, 128, 64, 64, 128, 128]
    - [78, 8643.0]
  - - [64, 128, 1312, 128, 64, 64, 128, 128]
    - [78, 8739.0]
  - - [64, 512, 192, 512, 64, 64, 512, 512]
    - [100, 9712.0]
  - - [1024, 512, 1, 196, 1024, 1024, 196, 196]
    - [86, 10317.0]
  - - [2048, 512, 1, 49, 2048, 2048, 49, 49]
    - [72, 9768.0]
  - - [2304, 256, 1, 196, 2304, 2304, 196, 196]
    - [88, 12621.0]
  - - [512, 1024, 1, 196, 512, 512, 196, 196]
    - [59, 10772.0]
  - - [512, 2048, 1, 49, 512, 512, 49, 49]
    - [79, 9410.0]
  - - [64, 128, 2048, 128, 64, 64, 128, 128]
    - [64, 9449.0]
  - - [64, 128, 1536, 128, 64, 64, 128, 128]
    - [75, 10168.0]
  - - [128, 128, 64, 6400, 128, 128, 6400, 6400]
    - [102, 11282.0]
  - - [64, 128, 192, 128, 64, 64, 128, 128]
    - [92, 7580.0]
  - - [64, 384, 144, 384, 64, 64, 384, 384]
    - [75, 13410.0]
  - - [64, 512, 48, 512, 64, 64, 512, 512]
    - [84, 8589.0]
  - - [64, 128, 256, 128, 64, 64, 128, 128]
    - [92, 7709.0]
  - - [64, 384, 192, 384, 64, 64, 384, 384]
    - [75, 10789.0]
  - - [512, 1024, 1, 1024, 512, 512, 1024, 1024]
    - [69, 12981.0]
  - - [512, 2048, 1, 2048, 512, 512, 2048, 2048]
    - [98, 13690.0]
  - - [128, 128, 49, 1120, 128, 128, 1120, 1120]
    - [90, 14304.0]
  - - [128, 128, 49, 1064, 128, 128, 1064, 1064]
    - [87, 14347.0]
  - - [128, 128, 49, 1040, 128, 128, 1040, 1040]
    - [90, 14297.0]
  - - [128, 128, 64, 600, 128, 128, 600, 600]
    - [90, 13113.0]
  - - [128, 128, 64, 616, 128, 128, 616, 616]
    - [90, 13150.0]
  - - [128, 128, 49, 950, 128, 128, 950, 950]
    - [76, 14588.0]
  - - [128, 128, 49, 972, 128, 128, 972, 972]
    - [90, 14070.0]
  - - [128, 128, 64, 560, 128, 128, 560, 560]
    - [68, 13612.0]
  - - [128, 128, 49, 1008, 128, 128, 1008, 1008]
    - [63, 14232.0]
  - - [128, 128, 64, 532, 128, 128, 532, 532]
    - [82, 13282.0]
  - - [128, 128, 49, 1080, 128, 128, 1080, 1080]
    - [62, 14275.0]
  - - [128, 128, 64, 588, 128, 128, 588, 588]
    - [91, 12958.0]
  - - [128, 128, 49, 1160, 128, 128, 1160, 1160]
    - [76, 14305.0]
  - - [128, 128, 49, 988, 128, 128, 988, 988]
    - [98, 14276.0]
  - - [128, 128, 49, 936, 128, 128, 936, 936]
    - [82, 14390.0]
  - - [512, 1024, 1, 3800, 512, 512, 3800, 3800]
    - [63, 13763.0]
  - - [512, 1024, 1, 3400, 512, 512, 3400, 3400]
    - [77, 13935.0]
  - - [512, 1024, 1, 3456, 512, 512, 3456, 3456]
    - [63, 13754.0]
  - - [512, 1024, 1, 3072, 512, 512, 3072, 3072]
    - [69, 13337.0]
  - - [2048, 512, 1, 950, 2048, 2048, 950, 950]
    - [73, 14166.0]
  - - [512, 1024, 1, 3552, 512, 512, 3552, 3552]
    - [63, 13811.0]
  - - [512, 1024, 1, 3220, 512, 512, 3220, 3220]
    - [77, 13674.0]
  - - [2048, 512, 1, 850, 2048, 2048, 850, 850]
    - [73, 13866.0]
  - - [512, 2048, 1, 864, 512, 512, 864, 864]
    - [91, 13748.0]
  - - [512, 2048, 1, 768, 512, 512, 768, 768]
    - [77, 13462.0]
  - - [2048, 512, 1, 805, 2048, 2048, 805, 805]
    - [73, 13716.0]
  - - [512, 1024, 1, 2852, 512, 512, 2852, 2852]
    - [77, 13603.0]
  - - [512, 2048, 1, 888, 512, 512, 888, 888]
    - [87, 14761.0]
  - - [2048, 512, 1, 864, 2048, 2048, 864, 864]
    - [63, 13698.0]
  - - [2048, 512, 1, 768, 2048, 2048, 768, 768]
    - [63, 13467.0]
  - - [2048, 512, 1, 888, 2048, 2048, 888, 888]
    - [59, 14338.0]
  - - [2048, 256, 1, 950, 2048, 2048, 950, 950]
    - [58, 13052.0]
  - - [2048, 512, 1, 713, 2048, 2048, 713, 713]
    - [73, 13713.0]
  - - [512, 1024, 1, 2688, 512, 512, 2688, 2688]
    - [77, 13611.0]
  - - [512, 1024, 1, 2640, 512, 512, 2640, 2640]
    - [77, 13605.0]
  - - [512, 1024, 1, 2904, 512, 512, 2904, 2904]
    - [77, 13609.0]
  - - [1024, 512, 1, 950, 1024, 1024, 950, 950]
    - [77, 12496.0]
  - - [512, 2048, 1, 672, 512, 512, 672, 672]
    - [87, 14595.0]
  - - [512, 2048, 1, 660, 512, 512, 660, 660]
    - [87, 14044.0]
  - - [512, 2048, 1, 1008, 512, 512, 1008, 1008]
    - [59, 14849.0]
  - - [2048, 256, 1, 850, 2048, 2048, 850, 850]
    - [91, 12290.0]
  - - [2048, 512, 1, 726, 2048, 2048, 726, 726]
    - [87, 13766.0]
  - - [1024, 512, 1, 850, 1024, 1024, 850, 850]
    - [91, 12345.0]
  - - [2048, 512, 1, 660, 2048, 2048, 660, 660]
    - [73, 13914.0]
  - - [2048, 512, 1, 672, 2048, 2048, 672, 672]
    - [87, 14121.0]
  - - [512, 2048, 1, 840, 512, 512, 840, 840]
    - [87, 14612.0]
  - - [2048, 512, 1, 1008, 2048, 2048, 1008, 1008]
    - [87, 14527.0]
  - - [512, 2048, 1, 792, 512, 512, 792, 792]
    - [69, 13451.0]
  - - [1024, 512, 1, 805, 1024, 1024, 805, 805]
    - [91, 12226.0]
  - - [512, 2048, 1, 1050, 512, 512, 1050, 1050]
    - [73, 14112.0]
  - - [2048, 512, 1, 748, 2048, 2048, 748, 748]
    - [77, 13454.0]
  - - [2048, 256, 1, 864, 2048, 2048, 864, 864]
    - [72, 12847.0]
  - - [1024, 512, 1, 768, 1024, 1024, 768, 768]
    - [63, 12194.0]
  - - [1024, 512, 1, 864, 1024, 1024, 864, 864]
    - [77, 12548.0]
  - - [2048, 512, 1, 875, 2048, 2048, 875, 875]
    - [87, 13927.0]
  - - [2048, 512, 1, 840, 2048, 2048, 840, 840]
    - [59, 14327.0]
  - - [2048, 512, 1, 792, 2048, 2048, 792, 792]
    - [91, 13469.0]
  - - [512, 2048, 1, 736, 512, 512, 736, 736]
    - [63, 13544.0]
  - - [2048, 256, 1, 888, 2048, 2048, 888, 888]
    - [60, 12569.0]
  - - [512, 2048, 1, 704, 512, 512, 704, 704]
    - [59, 14629.0]
  - - [512, 2048, 1, 588, 512, 512, 588, 588]
    - [87, 14045.0]
  - - [1024, 512, 1, 888, 1024, 1024, 888, 888]
    - [77, 12442.0]
  - - [512, 2048, 1, 816, 512, 512, 816, 816]
    - [59, 14444.0]
  - - [1024, 512, 1, 713, 1024, 1024, 713, 713]
    - [73, 12074.0]
  - - [2048, 512, 1, 736, 2048, 2048, 736, 736]
    - [63, 13587.0]
  - - [2048, 512, 1, 588, 2048, 2048, 588, 588]
    - [59, 13605.0]
  - - [2048, 512, 1, 704, 2048, 2048, 704, 704]
    - [73, 14497.0]
  - - [1024, 512, 1, 660, 1024, 1024, 660, 660]
    - [91, 11891.0]
  - - [2048, 256, 1, 660, 2048, 2048, 660, 660]
    - [58, 12501.0]
  - - [2048, 256, 1, 672, 2048, 2048, 672, 672]
    - [86, 12719.0]
  - - [1024, 512, 1, 672, 1024, 1024, 672, 672]
    - [91, 12225.0]
  - - [1024, 512, 1, 726, 1024, 1024, 726, 726]
    - [72, 12799.0]
  - - [512, 2048, 1, 630, 512, 512, 630, 630]
    - [59, 13814.0]
  - - [512, 2048, 1, 600, 512, 512, 600, 600]
    - [59, 13542.0]
  - - [2048, 256, 1, 805, 2048, 2048, 805, 805]
    - [60, 12326.0]
  - - [2048, 256, 1, 713, 2048, 2048, 713, 713]
    - [58, 12419.0]
  - - [2048, 256, 1, 726, 2048, 2048, 726, 726]
    - [60, 12169.0]
  - - [320, 1024, 1, 1024, 320, 320, 1024, 1024]
    - [97, 10389.0]
  - - [1024, 1000, 1, 1024, 1024, 1024, 1024, 1024]
    - [83, 13026.0]
  - - [320, 1000, 1, 1024, 320, 320, 1024, 1024]
    - [81, 9918.0]
  - - [128, 128, 49, 1280, 128, 128, 1280, 1280]
    - [83, 13560.0]
  - - [128, 128, 49, 1360, 128, 128, 1360, 1360]
    - [90, 14169.0]
  - - [128, 128, 49, 1200, 128, 128, 1200, 1200]
    - [90, 14163.0]
  - - [128, 128, 49, 1240, 128, 128, 1240, 1240]
    - [76, 14009.0]
  - - [2304, 256, 1, 704, 2304, 2304, 704, 704]
    - [74, 13614.0]
  - - [2304, 256, 1, 736, 2304, 2304, 736, 736]
    - [73, 13755.0]
  - - [2304, 256, 1, 792, 2304, 2304, 792, 792]
    - [60, 13870.0]
  - - [2304, 256, 1, 748, 2304, 2304, 748, 748]
    - [77, 13575.0]
  - - [2304, 256, 1, 726, 2304, 2304, 726, 726]
    - [60, 13585.0]
  - - [2304, 256, 1, 713, 2304, 2304, 713, 713]
    - [60, 13479.0]
  - - [2304, 256, 1, 768, 2304, 2304, 768, 768]
    - [83, 13522.0]
  - - [512, 2048, 1, 759, 512, 512, 759, 759]
    - [73, 14116.0]
  - - [512, 2048, 1, 925, 512, 512, 925, 925]
    - [87, 14314.0]
  - - [2304, 256, 1, 805, 2304, 2304, 805, 805]
    - [60, 13644.0]
  - - [512, 2048, 1, 900, 512, 512, 900, 900]
    - [86, 13809.0]
  - - [512, 2048, 1, 875, 512, 512, 875, 875]
    - [73, 14435.0]
  - - [512, 2048, 1, 748, 512, 512, 748, 748]
    - [77, 13417.0]
  - - [512, 2048, 1, 726, 512, 512, 726, 726]
    - [73, 14391.0]
  - - [512, 2048, 1, 713, 512, 512, 713, 713]
    - [87, 13938.0]
  - - [512, 2048, 1, 805, 512, 512, 805, 805]
    - [87, 14139.0]
  - - [512, 2048, 1, 850, 512, 512, 850, 850]
    - [87, 14329.0]
  - - [512, 2048, 1, 950, 512, 512, 950, 950]
    - [97, 15842.0]
  - - [128, 128, 49, 1152, 128, 128, 1152, 1152]
    - [90, 14193.0]
  - - [128, 128, 49, 1216, 128, 128, 1216, 1216]
    - [62, 14214.0]
  - - [128, 128, 36, 1800, 128, 128, 1800, 1800]
    - [63, 14941.0]
  - - [128, 128, 36, 1900, 128, 128, 1900, 1900]
    - [91, 14615.0]
  - - [128, 128, 64, 5880, 128, 128, 5880, 5880]
    - [91, 14033.0]
  - - [128, 128, 49, 7680, 128, 128, 7680, 7680]
    - [85, 11112.0]
  - - [128, 128, 64, 882, 128, 128, 882, 882]
    - [63, 14009.0]
  - - [128, 128, 64, 931, 128, 128, 931, 931]
    - [63, 14006.0]
  - - [128, 64, 121, 1152, 128, 128, 1152, 1152]
    - [98, 11631.0]
  - - [128, 64, 81, 12000, 128, 128, 12000, 12000]
    - [68, 11096.0]
  - - [128, 64, 121, 1216, 128, 128, 1216, 1216]
    - [62, 13363.0]
  - - [128, 64, 81, 1800, 128, 128, 1800, 1800]
    - [61, 12594.0]
  - - [128, 64, 81, 1900, 128, 128, 1900, 1900]
    - [76, 12358.0]
  - - [128, 64, 49, 20280, 128, 128, 20280, 20280]
    - [62, 10963.0]
  - - [128, 64, 49, 3042, 128, 128, 3042, 3042]
    - [62, 12138.0]
  - - [128, 64, 49, 3211, 128, 128, 3211, 3211]
    - [90, 12183.0]
  - - [128, 64, 169, 5880, 128, 128, 5880, 5880]
    - [101, 10652.0]
  - - [128, 64, 121, 7680, 128, 128, 7680, 7680]
    - [101, 9047.0]
  - - [128, 64, 169, 882, 128, 128, 882, 882]
    - [71, 10196.0]
  - - [128, 64, 169, 931, 128, 128, 931, 931]
    - [93, 10168.0]
  - - [256, 128, 25, 1080, 256, 256, 1080, 1080]
    - [62, 15113.0]
  - - [256, 128, 25, 162, 256, 256, 162, 162]
    - [98, 9203.0]
  - - [256, 128, 25, 171, 256, 256, 171, 171]
    - [74, 10548.0]
  - - [1152, 256, 1, 1, 1152, 1152, 1, 1]
    - [62, 134.0]
  - - [1152, 256, 1, 1444, 1152, 1152, 1444, 1444]
    - [63, 11882.0]
  - - [1152, 256, 1, 25, 1152, 1152, 25, 25]
    - [101, 2333.0]
  - - [1152, 256, 1, 9, 1152, 1152, 9, 9]
    - [63, 1097.0]
  - - [2304, 256, 1, 1444, 2304, 2304, 1444, 1444]
    - [77, 14624.0]
  - - [2304, 340, 1, 1, 2304, 2304, 1, 1]
    - [77, 98.0]
  - - [2304, 340, 1, 1444, 2304, 2304, 1444, 1444]
    - [77, 13368.0]
  - - [2304, 340, 1, 9, 2304, 2304, 9, 9]
    - [93, 1330.0]
  - - [2304, 510, 1, 25, 2304, 2304, 25, 25]
    - [79, 4663.0]
  - - [96, 1024, 160, 1024, 96, 96, 1024, 1024]
    - [69, 13430.0]
  - - [96, 1024, 40, 1024, 96, 96, 1024, 1024]
    - [69, 13306.0]
  - - [96, 1024, 80, 1024, 96, 96, 1024, 1024]
    - [83, 13091.0]
  - - [96, 1024, 96, 1024, 96, 96, 1024, 1024]
    - [69, 13298.0]
  - - [96, 1024, 24, 1024, 96, 96, 1024, 1024]
    - [83, 12819.0]
  - - [96, 1024, 48, 1024, 96, 96, 1024, 1024]
    - [69, 12997.0]
  - - [96, 1024, 16, 1024, 96, 96, 1024, 1024]
    - [69, 12196.0]
  - - [96, 1024, 32, 1024, 96, 96, 1024, 1024]
    - [99, 13033.0]
  - - [64, 512, 320, 512, 64, 64, 512, 512]
    - [100, 9912.0]
  - - [64, 512, 80, 512, 64, 64, 512, 512]
    - [84, 9287.0]
  - - [29000, 109, 1, 2560, 29000, 29000, 2560, 2560]
    - [69, 14477.0]
  - - [29000, 121, 1, 2560, 29000, 29000, 2560, 2560]
    - [69, 15960.0]
  - - [29000, 65, 1, 2560, 29000, 29000, 2560, 2560]
    - [69, 8780.0]
  - - [29000, 66, 1, 2560, 29000, 29000, 2560, 2560]
    - [99, 8922.0]
  - - [29000, 67, 1, 2560, 29000, 29000, 2560, 2560]
    - [69, 9056.0]
  - - [29000, 69, 1, 2560, 29000, 29000, 2560, 2560]
    - [83, 9317.0]
  - - [29000, 70, 1, 2560, 29000, 29000, 2560, 2560]
    - [69, 9455.0]
  - - [29000, 71, 1, 2560, 29000, 29000, 2560, 2560]
    - [99, 9602.0]
  - - [29000, 73, 1, 2560, 29000, 29000, 2560, 2560]
    - [69, 9860.0]
  - - [29000, 74, 1, 2560, 29000, 29000, 2560, 2560]
    - [69, 9986.0]
  - - [29000, 75, 1, 2560, 29000, 29000, 2560, 2560]
    - [83, 10110.0]
  - - [29000, 77, 1, 2560, 29000, 29000, 2560, 2560]
    - [99, 10393.0]
  - - [29000, 78, 1, 2560, 29000, 29000, 2560, 2560]
    - [99, 10517.0]
  - - [29000, 80, 1, 2560, 29000, 29000, 2560, 2560]
    - [69, 10805.0]
  - - [29000, 81, 1, 2560, 29000, 29000, 2560, 2560]
    - [99, 10911.0]
  - - [29000, 82, 1, 2560, 29000, 29000, 2560, 2560]
    - [69, 11037.0]
  - - [29000, 83, 1, 2560, 29000, 29000, 2560, 2560]
    - [69, 11158.0]
  - - [29000, 84, 1, 2560, 29000, 29000, 2560, 2560]
    - [83, 11296.0]
  - - [29000, 88, 1, 2560, 29000, 29000, 2560, 2560]
    - [69, 11816.0]
  - - [29000, 89, 1, 2560, 29000, 29000, 2560, 2560]
    - [83, 11933.0]
  - - [29000, 90, 1, 2560, 29000, 29000, 2560, 2560]
    - [69, 12067.0]
  - - [29000, 92, 1, 2560, 29000, 29000, 2560, 2560]
    - [99, 12302.0]
  - - [29000, 95, 1, 2560, 29000, 29000, 2560, 2560]
    - [69, 12695.0]
  - - [29000, 98, 1, 2560, 29000, 29000, 2560, 2560]
    - [69, 13091.0]
  - - [64, 1024, 512, 1024, 64, 64, 1024, 1024]
    - [70, 9951.0]
  - - [64, 64, 36, 50176, 64, 64, 50176, 50176]
    - [84, 7183.0]
  - - [64, 64, 49, 36864, 64, 64, 36864, 36864]
    - [112, 6154.0]
  - - [64, 64, 64, 25600, 64, 64, 25600, 25600]
    - [84, 7715.0]
  - - [256, 256, 1, 60800, 256, 256, 60800, 60800]
    - [103, 12472.0]
  - - [256, 256, 1, 54400, 256, 256, 54400, 54400]
    - [107, 12357.0]
  - - [256, 256, 1, 51520, 256, 256, 51520, 51520]
    - [107, 12350.0]
  - - [256, 256, 1, 55296, 256, 256, 55296, 55296]
    - [113, 9756.0]
  - - [256, 256, 1, 56832, 256, 256, 56832, 56832]
    - [106, 11006.0]
  - - [256, 256, 1, 45632, 256, 256, 45632, 45632]
    - [110, 12244.0]
  - - [256, 256, 1, 49152, 256, 256, 49152, 49152]
    - [113, 9700.0]
  - - [256, 512, 1, 13600, 256, 256, 13600, 13600]
    - [107, 12644.0]
  - - [256, 256, 1, 43008, 256, 256, 43008, 43008]
    - [113, 9634.0]
  - - [256, 512, 1, 15200, 256, 256, 15200, 15200]
    - [103, 13052.0]
  - - [256, 512, 1, 12880, 256, 256, 12880, 12880]
    - [107, 12585.0]
  - - [256, 512, 1, 13824, 256, 256, 13824, 13824]
    - [111, 12104.0]
  - - [512, 256, 1, 13824, 512, 512, 13824, 13824]
    - [105, 12060.0]
  - - [256, 512, 1, 14208, 256, 256, 14208, 14208]
    - [108, 12783.0]
  - - [512, 256, 1, 14208, 512, 512, 14208, 14208]
    - [103, 12722.0]
  - - [512, 256, 1, 15200, 512, 512, 15200, 15200]
    - [110, 12816.0]
  - - [256, 512, 1, 12288, 256, 256, 12288, 12288]
    - [108, 11197.0]
  - - [512, 256, 1, 12288, 512, 512, 12288, 12288]
    - [108, 10626.0]
  - - [128, 64, 25, 43320, 128, 128, 43320, 43320]
    - [106, 12458.0]
  - - [64, 64, 64, 20280, 64, 64, 20280, 20280]
    - [104, 9332.0]
  - - [64, 64, 49, 27000, 64, 64, 27000, 27000]
    - [104, 9253.0]
  - - [64, 64, 36, 43320, 64, 64, 43320, 43320]
    - [109, 9274.0]
  - - [32, 5056, 1, 1280, 32, 32, 1280, 1280]
    - [134, 4170.0]
  - - [4288, 64, 1, 3328, 4288, 4288, 3328, 3328]
    - [119, 5797.0]
  - - [2368, 64, 1, 1, 2368, 2368, 1, 1]
    - [144, 52.0]
  - - [1408, 128, 1, 32, 1408, 1408, 32, 32]
    - [143, 1254.0]
  - - [32, 2944, 1, 3328, 32, 32, 3328, 3328]
    - [118, 3832.0]
  - - [2368, 32, 1, 256, 2368, 2368, 256, 256]
    - [155, 2395.0]
  - - [1024, 128, 1, 32, 1024, 1024, 32, 32]
    - [167, 958.0]
  - - [32, 4288, 1, 1280, 32, 32, 1280, 1280]
    - [118, 3858.0]
  - - [32, 5056, 1, 32, 32, 32, 32, 32]
    - [180, 1171.0]
  - - [5888, 32, 1, 32, 5888, 5888, 32, 32]
    - [170, 1256.0]
  - - [64, 2368, 1, 1280, 64, 64, 1280, 1280]
    - [169, 5416.0]
  - - [128, 704, 1, 32, 128, 128, 32, 32]
    - [118, 680.0]
  - - [32, 4288, 1, 3328, 32, 32, 3328, 3328]
    - [144, 4129.0]
  - - [1408, 64, 1, 1, 1408, 1408, 1, 1]
    - [118, 24.0]
  - - [1856, 64, 1, 256, 1856, 1856, 256, 256]
    - [179, 4154.0]
  - - [1024, 256, 1, 256, 1024, 1024, 256, 256]
    - [119, 5115.0]
  - - [1856, 128, 1, 32, 1856, 1856, 32, 32]
    - [145, 1590.0]
  - - [1856, 128, 1, 1280, 1856, 1856, 1280, 1280]
    - [145, 6354.0]
  - - [4288, 32, 1, 3328, 4288, 4288, 3328, 3328]
    - [118, 4224.0]
  - - [3584, 64, 1, 1280, 3584, 3584, 1280, 1280]
    - [181, 6024.0]
  - - [64, 1856, 1, 256, 64, 64, 256, 256]
    - [143, 3386.0]
  - - [3584, 64, 1, 32, 3584, 3584, 32, 32]
    - [151, 1739.0]
  - - [1408, 128, 1, 3328, 1408, 1408, 3328, 3328]
    - [143, 5193.0]
  - - [32, 6784, 1, 3328, 32, 32, 3328, 3328]
    - [144, 4324.0]
  - - [32, 3584, 1, 256, 32, 32, 256, 256]
    - [128, 2984.0]
  - - [704, 256, 1, 32, 704, 704, 32, 32]
    - [117, 1232.0]
  - - [64, 2944, 1, 3328, 64, 64, 3328, 3328]
    - [167, 5476.0]
  - - [64, 4288, 1, 3328, 64, 64, 3328, 3328]
    - [181, 5699.0]
  - - [256, 704, 1, 256, 256, 256, 256, 256]
    - [117, 3800.0]
  - - [5056, 32, 1, 3328, 5056, 5056, 3328, 3328]
    - [143, 4553.0]
  - - [2944, 32, 1, 1280, 2944, 2944, 1280, 1280]
    - [180, 3516.0]
  - - [64, 1408, 1, 3328, 64, 64, 3328, 3328]
    - [167, 4053.0]
  - - [256, 448, 1, 1280, 256, 256, 1280, 1280]
    - [143, 4913.0]
  - - [448, 448, 1, 256, 448, 448, 256, 256]
    - [155, 4150.0]
  - - [1024, 256, 1, 1, 1024, 1024, 1, 1]
    - [167, 61.0]
  - - [1856, 64, 1, 32, 1856, 1856, 32, 32]
    - [140, 841.0]
  - - [4288, 64, 1, 256, 4288, 4288, 256, 256]
    - [119, 4375.0]
  - - [1408, 64, 1, 256, 1408, 1408, 256, 256]
    - [179, 2518.0]
  - - [6784, 32, 1, 32, 6784, 6784, 32, 32]
    - [128, 1384.0]
  - - [448, 448, 1, 1280, 448, 448, 1280, 1280]
    - [157, 5269.0]
  - - [32, 5888, 1, 256, 32, 32, 256, 256]
    - [134, 3203.0]
  - - [1024, 128, 1, 256, 1024, 1024, 256, 256]
    - [153, 3562.0]
  - - [1856, 64, 1, 1280, 1856, 1856, 1280, 1280]
    - [143, 4737.0]
  - - [128, 1408, 1, 1, 128, 128, 1, 1]
    - [138, 49.0]
  - - [32, 2368, 1, 1280, 32, 32, 1280, 1280]
    - [159, 4079.0]
  - - [448, 256, 1, 256, 448, 448, 256, 256]
    - [177, 3234.0]
  - - [2944, 32, 1, 32, 2944, 2944, 32, 32]
    - [170, 1370.0]
  - - [448, 448, 1, 32, 448, 448, 32, 32]
    - [121, 2261.0]
  - - [704, 256, 1, 3328, 704, 704, 3328, 3328]
    - [143, 5156.0]
  - - [64, 2944, 1, 1, 64, 64, 1, 1]
    - [179, 46.0]
  - - [64, 2944, 1, 32, 64, 64, 32, 32]
    - [130, 1299.0]
  - - [64, 2944, 1, 1280, 64, 64, 1280, 1280]
    - [117, 5200.0]
  - - [32, 3584, 1, 1280, 32, 32, 1280, 1280]
    - [134, 3700.0]
  - - [32, 2944, 1, 32, 32, 32, 32, 32]
    - [114, 704.0]
  - - [32, 6784, 1, 256, 32, 32, 256, 256]
    - [131, 3224.0]
  - - [448, 448, 1, 3328, 448, 448, 3328, 3328]
    - [145, 5552.0]
  - - [704, 128, 1, 1280, 704, 704, 1280, 1280]
    - [165, 3840.0]
  - - [32, 3584, 1, 3328, 32, 32, 3328, 3328]
    - [144, 3996.0]
  - - [128, 704, 1, 1280, 128, 128, 1280, 1280]
    - [167, 3972.0]
  - - [64, 4288, 1, 1, 64, 64, 1, 1]
    - [119, 67.0]
  - - [3584, 32, 1, 32, 3584, 3584, 32, 32]
    - [116, 842.0]
  - - [3584, 64, 1, 1, 3584, 3584, 1, 1]
    - [145, 54.0]
  - - [32, 4288, 1, 32, 32, 32, 32, 32]
    - [115, 1012.0]
  - - [64, 1408, 1, 1, 64, 64, 1, 1]
    - [114, 23.0]
  - - [256, 1024, 1, 256, 256, 256, 256, 256]
    - [177, 4444.0]
  - - [1408, 128, 1, 1280, 1408, 1408, 1280, 1280]
    - [143, 4894.0]
  - - [64, 4288, 1, 1280, 64, 64, 1280, 1280]
    - [167, 5626.0]
  - - [64, 3584, 1, 1, 64, 64, 1, 1]
    - [155, 56.0]
  - - [1024, 128, 1, 1280, 1024, 1024, 1280, 1280]
    - [157, 5124.0]
  - - [2368, 32, 1, 32, 2368, 2368, 32, 32]
    - [168, 1276.0]
  - - [128, 1408, 1, 256, 128, 128, 256, 256]
    - [167, 3776.0]
  - - [256, 448, 1, 3328, 256, 256, 3328, 3328]
    - [167, 5511.0]
  - - [2368, 64, 1, 256, 2368, 2368, 256, 256]
    - [145, 3781.0]
  - - [32, 2368, 1, 3328, 32, 32, 3328, 3328]
    - [159, 3823.0]
  - - [128, 1856, 1, 1, 128, 128, 1, 1]
    - [145, 59.0]
  - - [128, 1856, 1, 32, 128, 128, 32, 32]
    - [157, 1571.0]
  - - [3584, 32, 1, 256, 3584, 3584, 256, 256]
    - [177, 2890.0]
  - - [64, 3584, 1, 256, 64, 64, 256, 256]
    - [181, 4415.0]
  - - [32, 2944, 1, 1280, 32, 32, 1280, 1280]
    - [171, 4261.0]
  - - [4288, 32, 1, 32, 4288, 4288, 32, 32]
    - [117, 967.0]
  - - [1856, 64, 1, 1, 1856, 1856, 1, 1]
    - [166, 30.0]
  - - [128, 1024, 1, 3328, 128, 128, 3328, 3328]
    - [157, 5202.0]
  - - [1408, 128, 1, 1, 1408, 1408, 1, 1]
    - [179, 46.0]
  - - [5056, 32, 1, 256, 5056, 5056, 256, 256]
    - [130, 3406.0]
  - - [64, 1408, 1, 1280, 64, 64, 1280, 1280]
    - [143, 3752.0]
  - - [3584, 32, 1, 1280, 3584, 3584, 1280, 1280]
    - [130, 3886.0]
  - - [1856, 128, 1, 3328, 1856, 1856, 3328, 3328]
    - [145, 6386.0]
  - - [704, 256, 1, 1280, 704, 704, 1280, 1280]
    - [167, 5015.0]
  - - [1856, 128, 1, 1, 1856, 1856, 1, 1]
    - [119, 61.0]
  - - [256, 704, 1, 1, 256, 256, 1, 1]
    - [118, 43.0]
  - - [1024, 128, 1, 1, 1024, 1024, 1, 1]
    - [116, 32.0]
  - - [1856, 128, 1, 256, 1856, 1856, 256, 256]
    - [181, 4643.0]
  - - [1024, 256, 1, 1280, 1024, 1024, 1280, 1280]
    - [179, 5410.0]
  - - [64, 2368, 1, 32, 64, 64, 32, 32]
    - [118, 1107.0]
  - - [32, 2368, 1, 256, 32, 32, 256, 256]
    - [147, 2895.0]
  - - [32, 6784, 1, 1280, 32, 32, 1280, 1280]
    - [147, 3914.0]
  - - [32, 6784, 1, 32, 32, 32, 32, 32]
    - [141, 1352.0]
  - - [64, 3584, 1, 3328, 64, 64, 3328, 3328]
    - [181, 6113.0]
  - - [32, 5888, 1, 1280, 32, 32, 1280, 1280]
    - [159, 4047.0]
  - - [448, 256, 1, 1, 448, 448, 1, 1]
    - [173, 58.0]
  - - [448, 256, 1, 3328, 448, 448, 3328, 3328]
    - [143, 5326.0]
  - - [128, 704, 1, 3328, 128, 128, 3328, 3328]
    - [115, 4410.0]
  - - [2368, 32, 1, 3328, 2368, 2368, 3328, 3328]
    - [117, 3986.0]
  - - [2944, 64, 1, 3328, 2944, 2944, 3328, 3328]
    - [167, 5253.0]
  - - [128, 1024, 1, 32, 128, 128, 32, 32]
    - [131, 975.0]
  - - [32, 2368, 1, 32, 32, 32, 32, 32]
    - [176, 1144.0]
  - - [64, 1856, 1, 1280, 64, 64, 1280, 1280]
    - [167, 5354.0]
  - - [32, 3584, 1, 32, 32, 32, 32, 32]
    - [154, 823.0]
  - - [704, 256, 1, 1, 704, 704, 1, 1]
    - [174, 54.0]
  - - [1024, 256, 1, 3328, 1024, 1024, 3328, 3328]
    - [157, 5575.0]
  - - [128, 1856, 1, 1280, 128, 128, 1280, 1280]
    - [132, 6126.0]
  - - [448, 256, 1, 32, 448, 448, 32, 32]
    - [168, 878.0]
  - - [64, 4288, 1, 32, 64, 64, 32, 32]
    - [181, 2987.0]
  - - [128, 704, 1, 1, 128, 128, 1, 1]
    - [172, 54.0]
  - - [4288, 64, 1, 1280, 4288, 4288, 1280, 1280]
    - [119, 5738.0]
  - - [448, 448, 1, 1, 448, 448, 1, 1]
    - [119, 115.0]
  - - [32, 5888, 1, 32, 32, 32, 32, 32]
    - [141, 1261.0]
  - - [1024, 128, 1, 3328, 1024, 1024, 3328, 3328]
    - [145, 5219.0]
  - - [4288, 64, 1, 32, 4288, 4288, 32, 32]
    - [145, 1756.0]
  - - [2368, 64, 1, 32, 2368, 2368, 32, 32]
    - [117, 1128.0]
  - - [64, 1408, 1, 32, 64, 64, 32, 32]
    - [118, 693.0]
  - - [32, 2944, 1, 256, 32, 32, 256, 256]
    - [153, 2633.0]
  - - [2944, 64, 1, 1, 2944, 2944, 1, 1]
    - [181, 94.0]
  - - [2944, 64, 1, 32, 2944, 2944, 32, 32]
    - [181, 2301.0]
  - - [64, 2944, 1, 256, 64, 64, 256, 256]
    - [117, 4963.0]
  - - [64, 2368, 1, 256, 64, 64, 256, 256]
    - [145, 4911.0]
  - - [1408, 64, 1, 3328, 1408, 1408, 3328, 3328]
    - [141, 4157.0]
  - - [6784, 32, 1, 1280, 6784, 6784, 1280, 1280]
    - [130, 4118.0]
  - - [2944, 64, 1, 1280, 2944, 2944, 1280, 1280]
    - [143, 4878.0]
  - - [2944, 32, 1, 256, 2944, 2944, 256, 256]
    - [128, 2560.0]
  - - [256, 1024, 1, 3328, 256, 256, 3328, 3328]
    - [132, 5522.0]
  - - [1856, 64, 1, 3328, 1856, 1856, 3328, 3328]
    - [171, 6696.0]
  - - [5888, 32, 1, 256, 5888, 5888, 256, 256]
    - [155, 3480.0]
  - - [128, 704, 1, 256, 128, 128, 256, 256]
    - [128, 2701.0]
  - - [3584, 64, 1, 256, 3584, 3584, 256, 256]
    - [132, 4382.0]
  - - [64, 1856, 1, 32, 64, 64, 32, 32]
    - [114, 1744.0]
  - - [64, 1856, 1, 3328, 64, 64, 3328, 3328]
    - [167, 5378.0]
  - - [5888, 32, 1, 1280, 5888, 5888, 1280, 1280]
    - [130, 4212.0]
  - - [256, 704, 1, 32, 256, 256, 32, 32]
    - [136, 1897.0]
  - - [256, 704, 1, 1280, 256, 256, 1280, 1280]
    - [117, 5081.0]
  - - [1408, 64, 1, 32, 1408, 1408, 32, 32]
    - [176, 690.0]
  - - [128, 1408, 1, 1280, 128, 128, 1280, 1280]
    - [143, 5054.0]
  - - [128, 1856, 1, 3328, 128, 128, 3328, 3328]
    - [132, 6363.0]
  - - [2368, 64, 1, 3328, 2368, 2368, 3328, 3328]
    - [119, 5827.0]
  - - [32, 5056, 1, 3328, 32, 32, 3328, 3328]
    - [118, 4437.0]
  - - [64, 1856, 1, 1, 64, 64, 1, 1]
    - [119, 29.0]
  - - [704, 128, 1, 32, 704, 704, 32, 32]
    - [114, 717.0]
  - - [4288, 64, 1, 1, 4288, 4288, 1, 1]
    - [179, 66.0]
  - - [5056, 32, 1, 1280, 5056, 5056, 1280, 1280]
    - [179, 4233.0]
  - - [128, 1024, 1, 1, 128, 128, 1, 1]
    - [180, 34.0]
  - - [256, 1024, 1, 1, 256, 256, 1, 1]
    - [167, 62.0]
  - - [1408, 64, 1, 1280, 1408, 1408, 1280, 1280]
    - [147, 4073.0]
  - - [1024, 256, 1, 32, 1024, 1024, 32, 32]
    - [165, 2954.0]
  - - [2368, 32, 1, 1280, 2368, 2368, 1280, 1280]
    - [167, 3870.0]
  - - [704, 128, 1, 1, 704, 704, 1, 1]
    - [180, 52.0]
  - - [256, 448, 1, 256, 256, 256, 256, 256]
    - [143, 4330.0]
  - - [32, 4288, 1, 256, 32, 32, 256, 256]
    - [177, 2922.0]
  - - [128, 1408, 1, 32, 128, 128, 32, 32]
    - [167, 1232.0]
  - - [704, 128, 1, 3328, 704, 704, 3328, 3328]
    - [141, 4393.0]
  - - [64, 4288, 1, 256, 64, 64, 256, 256]
    - [155, 4475.0]
  - - [4288, 32, 1, 1280, 4288, 4288, 1280, 1280]
    - [168, 3855.0]
  - - [32, 5056, 1, 256, 32, 32, 256, 256]
    - [159, 3114.0]
  - - [704, 128, 1, 256, 704, 704, 256, 256]
    - [144, 3258.0]
  - - [256, 1024, 1, 32, 256, 256, 32, 32]
    - [143, 2975.0]
  - - [256, 1024, 1, 1280, 256, 256, 1280, 1280]
    - [119, 5619.0]
  - - [6784, 32, 1, 256, 6784, 6784, 256, 256]
    - [130, 3517.0]
  - - [64, 2368, 1, 1, 64, 64, 1, 1]
    - [118, 90.0]
  - - [1408, 128, 1, 256, 1408, 1408, 256, 256]
    - [181, 4369.0]
  - - [5888, 32, 1, 3328, 5888, 5888, 3328, 3328]
    - [117, 4446.0]
  - - [64, 2368, 1, 3328, 64, 64, 3328, 3328]
    - [169, 5972.0]
  - - [256, 704, 1, 3328, 256, 256, 3328, 3328]
    - [117, 5284.0]
  - - [128, 1408, 1, 3328, 128, 128, 3328, 3328]
    - [167, 5339.0]
  - - [2944, 32, 1, 3328, 2944, 2944, 3328, 3328]
    - [171, 4648.0]
  - - [2368, 64, 1, 1280, 2368, 2368, 1280, 1280]
    - [132, 5431.0]
  - - [128, 1024, 1, 1280, 128, 128, 1280, 1280]
    - [169, 4869.0]
  - - [128, 1024, 1, 256, 128, 128, 256, 256]
    - [181, 3342.0]
  - - [3584, 64, 1, 3328, 3584, 3584, 3328, 3328]
    - [157, 6098.0]
  - - [256, 448, 1, 1, 256, 256, 1, 1]
    - [119, 29.0]
  - - [256, 448, 1, 32, 256, 256, 32, 32]
    - [168, 838.0]
  - - [64, 3584, 1, 32, 64, 64, 32, 32]
    - [119, 1562.0]
  - - [64, 3584, 1, 1280, 64, 64, 1280, 1280]
    - [132, 5793.0]
  - - [4288, 32, 1, 256, 4288, 4288, 256, 256]
    - [130, 3044.0]
  - - [448, 256, 1, 1280, 448, 448, 1280, 1280]
    - [155, 4845.0]
  - - [128, 1856, 1, 256, 128, 128, 256, 256]
    - [157, 4700.0]
  - - [3584, 32, 1, 3328, 3584, 3584, 3328, 3328]
    - [117, 4347.0]
  - - [6784, 32, 1, 3328, 6784, 6784, 3328, 3328]
    - [143, 4418.0]
  - - [2944, 64, 1, 256, 2944, 2944, 256, 256]
    - [155, 3822.0]
  - - [64, 1408, 1, 256, 64, 64, 256, 256]
    - [177, 2827.0]
  - - [5056, 32, 1, 32, 5056, 5056, 32, 32]
    - [117, 1092.0]
  - - [32, 5888, 1, 3328, 32, 32, 3328, 3328]
    - [147, 4199.0]
  - - [704, 256, 1, 256, 704, 704, 256, 256]
    - [177, 3813.0]
  - - [1024, 256, 1, 196, 1024, 1024, 196, 196]
    - [165, 4110.0]
  - - [256, 1024, 1, 196, 256, 256, 196, 196]
    - [165, 4137.0]
  - - [1760, 64, 1, 1760, 1760, 1760, 1760, 1760]
    - [141, 5123.0]
  - - [2560, 32, 1, 2560, 2560, 2560, 2560, 2560]
    - [183, 4019.0]
  - - [4608, 32, 1, 1536, 4608, 4608, 1536, 1536]
    - [130, 3969.0]
  - - [3072, 64, 1, 1024, 3072, 3072, 1024, 1024]
    - [181, 4898.0]
  - - [2048, 128, 1, 2048, 2048, 2048, 2048, 2048]
    - [157, 5341.0]
  - - [4096, 64, 1, 4096, 4096, 4096, 4096, 4096]
    - [132, 5432.0]
  - - [7680, 32, 1, 2560, 7680, 7680, 2560, 2560]
    - [159, 4271.0]
  - - [2560, 64, 1, 2560, 2560, 2560, 2560, 2560]
    - [181, 5944.0]
  - - [1760, 128, 1, 1760, 1760, 1760, 1760, 1760]
    - [145, 6024.0]
  - - [3072, 32, 1, 1024, 3072, 3072, 1024, 1024]
    - [183, 4295.0]
  - - [6144, 32, 1, 2560, 6144, 6144, 2560, 2560]
    - [134, 4073.0]
  - - [4096, 32, 1, 4096, 4096, 4096, 4096, 4096]
    - [183, 3715.0]
  - - [2048, 64, 1, 2048, 2048, 2048, 2048, 2048]
    - [132, 4644.0]
  - - [8448, 32, 1, 2816, 8448, 8448, 2816, 2816]
    - [143, 4562.0]
  - - [512, 512, 1, 512, 512, 512, 512, 512]
    - [130, 4863.0]
  - - [511, 512, 1, 512, 511, 511, 512, 512]
    - [132, 4836.0]
  - - [512, 512, 1, 511, 512, 512, 511, 511]
    - [143, 5002.0]
  - - [512, 513, 1, 512, 512, 512, 512, 512]
    - [130, 4776.0]
  - - [512, 511, 1, 512, 512, 512, 512, 512]
    - [132, 4819.0]
  - - [513, 512, 1, 512, 513, 513, 512, 512]
    - [132, 4275.0]
  - - [512, 512, 1, 513, 512, 512, 513, 513]
    - [169, 4919.0]
  - - [512, 512, 1, 64, 512, 512, 64, 64]
    - [167, 2605.0]
  - - [33, 33, 1600, 32, 33, 33, 32, 32]
    - [164, 1917.0]
  - - [256, 684, 1, 1024, 256, 256, 1024, 1024]
    - [181, 4458.0]
  - - [1024, 200, 1, 560, 1024, 1024, 560, 560]
    - [115, 4625.0]
  - - [2048, 114, 1, 512, 2048, 2048, 512, 512]
    - [132, 4363.0]
  - - [2048, 114, 1, 768, 2048, 2048, 768, 768]
    - [132, 4558.0]
  - - [32, 32, 4608, 64, 32, 32, 64, 64]
    - [144, 4669.0]
  - - [32, 35, 4608, 64, 32, 32, 64, 64]
    - [177, 3478.0]
  - - [34, 34, 4736, 64, 34, 34, 64, 64]
    - [177, 2249.0]
  - - [35, 35, 4608, 64, 35, 35, 64, 64]
    - [177, 2292.0]
  - - [33, 33, 1920, 64, 33, 33, 64, 64]
    - [115, 2164.0]
  - - [480, 512, 1, 512, 480, 480, 512, 512]
    - [132, 4556.0]
  - - [512, 480, 1, 512, 512, 512, 512, 512]
    - [130, 5070.0]
  - - [1024, 200, 1, 1024, 1024, 1024, 1024, 1024]
    - [179, 4603.0]
  - - [1024, 308, 1, 1024, 1024, 1024, 1024, 1024]
    - [132, 6254.0]
  - - [1024, 160, 1, 1024, 1024, 1024, 1024, 1024]
    - [155, 5075.0]
  - - [1024, 180, 1, 1024, 1024, 1024, 1024, 1024]
    - [132, 4805.0]
  - - [128, 864, 1, 256, 128, 128, 256, 256]
    - [177, 3104.0]
  - - [256, 864, 1, 512, 256, 256, 512, 512]
    - [132, 5111.0]
  - - [1152, 128, 1, 784, 1152, 1152, 784, 784]
    - [119, 5120.0]
  - - [256, 512, 1, 784, 256, 256, 784, 784]
    - [145, 4658.0]
  - - [512, 256, 1, 784, 512, 512, 784, 784]
    - [141, 4679.0]
  - - [1024, 128, 1, 1024, 1024, 1024, 1024, 1024]
    - [132, 4587.0]
  - - [1024, 96, 1, 1024, 1024, 1024, 1024, 1024]
    - [177, 4004.0]
  - - [1024, 256, 1, 3800, 1024, 1024, 3800, 3800]
    - [165, 5598.0]
  - - [1024, 256, 1, 3400, 1024, 1024, 3400, 3400]
    - [115, 5742.0]
  - - [256, 1024, 1, 3400, 256, 256, 3400, 3400]
    - [165, 5809.0]
  - - [1024, 256, 1, 3220, 1024, 1024, 3220, 3220]
    - [147, 7073.0]
  - - [256, 1024, 1, 3220, 256, 256, 3220, 3220]
    - [141, 5765.0]
  - - [1024, 256, 1, 3456, 1024, 1024, 3456, 3456]
    - [165, 5801.0]
  - - [256, 1024, 1, 3456, 256, 256, 3456, 3456]
    - [141, 5843.0]
  - - [1024, 256, 1, 3072, 1024, 1024, 3072, 3072]
    - [132, 5374.0]
  - - [256, 1024, 1, 3072, 256, 256, 3072, 3072]
    - [132, 5449.0]
  - - [1024, 256, 1, 3552, 1024, 1024, 3552, 3552]
    - [169, 5569.0]
  - - [256, 1024, 1, 3552, 256, 256, 3552, 3552]
    - [117, 5722.0]
  - - [256, 1024, 1, 2852, 256, 256, 2852, 2852]
    - [143, 5622.0]
  - - [1024, 256, 1, 2852, 1024, 1024, 2852, 2852]
    - [115, 5541.0]
  - - [256, 512, 1, 10752, 256, 256, 10752, 10752]
    - [132, 4965.0]
  - - [256, 1024, 1, 3800, 256, 256, 3800, 3800]
    - [141, 5845.0]
  - - [256, 512, 1, 10560, 256, 256, 10560, 10560]
    - [141, 6661.0]
  - - [256, 1024, 1, 2992, 256, 256, 2992, 2992]
    - [143, 5619.0]
  - - [256, 1024, 1, 2688, 256, 256, 2688, 2688]
    - [141, 5897.0]
  - - [1024, 256, 1, 2688, 1024, 1024, 2688, 2688]
    - [165, 5897.0]
  - - [256, 1024, 1, 2904, 256, 256, 2904, 2904]
    - [141, 5830.0]
  - - [1024, 256, 1, 2904, 1024, 1024, 2904, 2904]
    - [115, 5655.0]
  - - [256, 1024, 1, 2640, 256, 256, 2640, 2640]
    - [165, 5814.0]
  - - [1024, 256, 1, 2640, 1024, 1024, 2640, 2640]
    - [115, 5791.0]
  - - [1024, 256, 1, 4032, 1024, 1024, 4032, 4032]
    - [153, 5939.0]
  - - [1024, 256, 1, 2992, 1024, 1024, 2992, 2992]
    - [115, 5832.0]
  - - [256, 1024, 1, 3360, 256, 256, 3360, 3360]
    - [117, 5719.0]
  - - [1024, 256, 1, 3360, 1024, 1024, 3360, 3360]
    - [115, 5737.0]
  - - [1024, 256, 1, 3500, 1024, 1024, 3500, 3500]
    - [177, 5630.0]
  - - [256, 1024, 1, 3500, 256, 256, 3500, 3500]
    - [165, 5786.0]
  - - [1024, 256, 1, 3168, 1024, 1024, 3168, 3168]
    - [167, 5676.0]
  - - [256, 1024, 1, 3168, 256, 256, 3168, 3168]
    - [165, 5768.0]
  - - [256, 1024, 1, 3036, 256, 256, 3036, 3036]
    - [141, 5843.0]
  - - [1024, 256, 1, 4200, 1024, 1024, 4200, 4200]
    - [177, 5684.0]
  - - [1024, 256, 1, 3600, 1024, 1024, 3600, 3600]
    - [167, 5612.0]
  - - [256, 1024, 1, 3600, 256, 256, 3600, 3600]
    - [143, 5663.0]
  - - [256, 1024, 1, 2944, 256, 256, 2944, 2944]
    - [134, 7198.0]
  - - [1024, 256, 1, 2944, 1024, 1024, 2944, 2944]
    - [165, 5821.0]
  - - [1024, 256, 1, 3700, 1024, 1024, 3700, 3700]
    - [177, 5771.0]
  - - [256, 1024, 1, 2352, 256, 256, 2352, 2352]
    - [165, 5707.0]
  - - [1024, 256, 1, 2352, 1024, 1024, 2352, 2352]
    - [165, 5550.0]
  - - [1024, 256, 1, 2816, 1024, 1024, 2816, 2816]
    - [169, 5525.0]
  - - [256, 1024, 1, 3700, 256, 256, 3700, 3700]
    - [141, 5877.0]
  - - [256, 1024, 1, 2816, 256, 256, 2816, 2816]
    - [119, 5511.0]
  - - [256, 512, 1, 11408, 256, 256, 11408, 11408]
    - [119, 5543.0]
  - - [1024, 256, 1, 3036, 1024, 1024, 3036, 3036]
    - [177, 5686.0]
  - - [1024, 256, 1, 3264, 1024, 1024, 3264, 3264]
    - [167, 5731.0]
  - - [256, 1024, 1, 3264, 256, 256, 3264, 3264]
    - [117, 5823.0]
  - - [1024, 256, 1, 3864, 1024, 1024, 3864, 3864]
    - [115, 5741.0]
  - - [256, 1024, 1, 4032, 256, 256, 4032, 4032]
    - [165, 5927.0]
  - - [1024, 256, 1, 3128, 1024, 1024, 3128, 3128]
    - [115, 5696.0]
  - - [256, 1024, 1, 3128, 256, 256, 3128, 3128]
    - [141, 5637.0]
  - - [256, 1024, 1, 3200, 256, 256, 3200, 3200]
    - [141, 5825.0]
  - - [256, 512, 1, 11616, 256, 256, 11616, 11616]
    - [128, 5493.0]
  - - [1024, 256, 1, 3200, 1024, 1024, 3200, 3200]
    - [167, 5725.0]
  - - [1024, 256, 1, 4000, 1024, 1024, 4000, 4000]
    - [141, 5920.0]
  - - [256, 1024, 1, 2520, 256, 256, 2520, 2520]
    - [141, 5824.0]
  - - [1024, 256, 1, 2520, 1024, 1024, 2520, 2520]
    - [115, 5565.0]
  - - [256, 1024, 1, 2976, 256, 256, 2976, 2976]
    - [143, 5693.0]
  - - [256, 1024, 1, 2400, 256, 256, 2400, 2400]
    - [141, 5841.0]
  - - [1024, 256, 1, 2400, 1024, 1024, 2400, 2400]
    - [143, 5630.0]
  - - [1024, 256, 1, 3696, 1024, 1024, 3696, 3696]
    - [115, 5881.0]
  - - [1024, 256, 1, 3900, 1024, 1024, 3900, 3900]
    - [141, 5672.0]
  - - [1024, 256, 1, 3772, 1024, 1024, 3772, 3772]
    - [153, 5823.0]
  - - [256, 1024, 1, 3696, 256, 256, 3696, 3696]
    - [143, 5669.0]
  - - [256, 1024, 1, 2728, 256, 256, 2728, 2728]
    - [141, 5859.0]
  - - [1024, 256, 1, 2728, 1024, 1024, 2728, 2728]
    - [177, 5649.0]
  - - [1024, 256, 1, 2480, 1024, 1024, 2480, 2480]
    - [115, 5806.0]
  - - [256, 1024, 1, 2480, 256, 256, 2480, 2480]
    - [165, 5812.0]
  - - [1024, 256, 1, 2880, 1024, 1024, 2880, 2880]
    - [167, 5719.0]
  - - [512, 256, 1, 3220, 512, 512, 3220, 3220]
    - [165, 6479.0]
  - - [256, 1024, 1, 2880, 256, 256, 2880, 2880]
    - [117, 5721.0]
  - - [256, 1024, 1, 4200, 256, 256, 4200, 4200]
    - [128, 5785.0]
  - - [1024, 256, 1, 3648, 1024, 1024, 3648, 3648]
    - [167, 5740.0]
  - - [1024, 256, 1, 3312, 1024, 1024, 3312, 3312]
    - [167, 5587.0]
  - - [256, 1024, 1, 3648, 256, 256, 3648, 3648]
    - [117, 5749.0]
  - - [1024, 256, 1, 3300, 1024, 1024, 3300, 3300]
    - [165, 5564.0]
  - - [1024, 256, 1, 3528, 1024, 1024, 3528, 3528]
    - [165, 5653.0]
  - - [256, 1024, 1, 2604, 256, 256, 2604, 2604]
    - [141, 5815.0]
  - - [1024, 256, 1, 2604, 1024, 1024, 2604, 2604]
    - [177, 5837.0]
  - - [512, 256, 1, 11408, 512, 512, 11408, 11408]
    - [145, 5416.0]
  - - [256, 1024, 1, 3312, 256, 256, 3312, 3312]
    - [141, 5735.0]
  - - [256, 1024, 1, 3300, 256, 256, 3300, 3300]
    - [165, 5632.0]
  - - [512, 256, 1, 3072, 512, 512, 3072, 3072]
    - [181, 4921.0]
  - - [256, 1024, 1, 3528, 256, 256, 3528, 3528]
    - [115, 5594.0]
  - - [1024, 256, 1, 2976, 1024, 1024, 2976, 2976]
    - [143, 5751.0]
  - - [1024, 256, 1, 2760, 1024, 1024, 2760, 2760]
    - [165, 5561.0]
  - - [512, 256, 1, 3800, 512, 512, 3800, 3800]
    - [119, 5353.0]
  - - [256, 1024, 1, 2760, 256, 256, 2760, 2760]
    - [141, 6289.0]
  - - [1024, 256, 1, 2160, 1024, 1024, 2160, 2160]
    - [115, 5780.0]
  - - [256, 1024, 1, 2160, 256, 256, 2160, 2160]
    - [141, 5848.0]
  - - [512, 256, 1, 11616, 512, 512, 11616, 11616]
    - [141, 5499.0]
  - - [512, 256, 1, 2852, 512, 512, 2852, 2852]
    - [119, 5274.0]
  - - [256, 1024, 1, 3864, 256, 256, 3864, 3864]
    - [141, 5855.0]
  - - [512, 256, 1, 2640, 512, 512, 2640, 2640]
    - [119, 5291.0]
  - - [256, 1024, 1, 4000, 256, 256, 4000, 4000]
    - [165, 5891.0]
  - - [512, 256, 1, 2904, 512, 512, 2904, 2904]
    - [119, 5266.0]
  - - [256, 1024, 1, 3900, 256, 256, 3900, 3900]
    - [141, 5720.0]
  - - [512, 256, 1, 2688, 512, 512, 2688, 2688]
    - [141, 5335.0]
  - - [256, 1024, 1, 3772, 256, 256, 3772, 3772]
    - [128, 5871.0]
  - - [512, 256, 1, 3400, 512, 512, 3400, 3400]
    - [153, 5280.0]
  - - [512, 256, 1, 3456, 512, 512, 3456, 3456]
    - [141, 5557.0]
  - - [512, 256, 1, 3552, 512, 512, 3552, 3552]
    - [115, 5439.0]
  - - [128, 64, 25, 6498, 128, 128, 6498, 6498]
    - [167, 5877.0]
  - - [128, 64, 25, 6859, 128, 128, 6859, 6859]
    - [143, 4396.0]
  - - [64, 64, 64, 3042, 64, 64, 3042, 3042]
    - [141, 5872.0]
  - - [64, 64, 64, 3211, 64, 64, 3211, 3211]
    - [155, 5427.0]
  - - [64, 64, 49, 4050, 64, 64, 4050, 4050]
    - [179, 5871.0]
  - - [64, 64, 49, 4275, 64, 64, 4275, 4275]
    - [143, 5856.0]
  - - [64, 64, 36, 6498, 64, 64, 6498, 6498]
    - [145, 5736.0]
  - - [64, 64, 36, 6859, 64, 64, 6859, 6859]
    - [132, 5950.0]
  - - [1152, 128, 1, 1444, 1152, 1152, 1444, 1444]
    - [169, 5342.0]
  - - [512, 256, 1, 361, 512, 512, 361, 361]
    - [119, 3834.0]
  - - [576, 128, 1, 1444, 576, 576, 1444, 1444]
    - [171, 3746.0]
  - - [29000, 35, 1, 2560, 29000, 29000, 2560, 2560]
    - [132, 3916.0]
  - - [29000, 36, 1, 2560, 29000, 29000, 2560, 2560]
    - [181, 4020.0]
  - - [29000, 39, 1, 2560, 29000, 29000, 2560, 2560]
    - [157, 4345.0]
  - - [29000, 40, 1, 2560, 29000, 29000, 2560, 2560]
    - [132, 4420.0]
  - - [29000, 42, 1, 2560, 29000, 29000, 2560, 2560]
    - [132, 4570.0]
  - - [29000, 43, 1, 2560, 29000, 29000, 2560, 2560]
    - [181, 4713.0]
  - - [29000, 44, 1, 2560, 29000, 29000, 2560, 2560]
    - [181, 4755.0]
  - - [29000, 46, 1, 2560, 29000, 29000, 2560, 2560]
    - [132, 4911.0]
  - - [29000, 48, 1, 2560, 29000, 29000, 2560, 2560]
    - [132, 5118.0]
  - - [29000, 49, 1, 2560, 29000, 29000, 2560, 2560]
    - [132, 5084.0]
  - - [29000, 50, 1, 2560, 29000, 29000, 2560, 2560]
    - [132, 5176.0]
  - - [29000, 51, 1, 2560, 29000, 29000, 2560, 2560]
    - [132, 5322.0]
  - - [29000, 53, 1, 2560, 29000, 29000, 2560, 2560]
    - [132, 5459.0]
  - - [29000, 54, 1, 2560, 29000, 29000, 2560, 2560]
    - [132, 5568.0]
  - - [29000, 55, 1, 2560, 29000, 29000, 2560, 2560]
    - [132, 5545.0]
  - - [29000, 56, 1, 2560, 29000, 29000, 2560, 2560]
    - [132, 5728.0]
  - - [29000, 57, 1, 2560, 29000, 29000, 2560, 2560]
    - [181, 5686.0]
  - - [29000, 58, 1, 2560, 29000, 29000, 2560, 2560]
    - [132, 5851.0]
  - - [29000, 59, 1, 2560, 29000, 29000, 2560, 2560]
    - [157, 5971.0]
  - - [29000, 61, 1, 2560, 29000, 29000, 2560, 2560]
    - [157, 5990.0]
  - - [29000, 63, 1, 2560, 29000, 29000, 2560, 2560]
    - [181, 6140.0]
  - - [256, 128, 1, 13600, 256, 256, 13600, 13600]
    - [191, 5733.0]
  - - [256, 128, 1, 12880, 256, 256, 12880, 12880]
    - [187, 5761.0]
  - - [128, 512, 1, 15200, 128, 128, 15200, 15200]
    - [141, 5487.0]
  - - [512, 128, 1, 15200, 512, 512, 15200, 15200]
    - [196, 5201.0]
  - - [128, 512, 1, 11408, 128, 128, 11408, 11408]
    - [187, 5256.0]
  - - [256, 128, 1, 13824, 256, 256, 13824, 13824]
    - [207, 4888.0]
  - - [128, 512, 1, 11616, 128, 128, 11616, 11616]
    - [192, 5269.0]
  - - [256, 128, 1, 14208, 256, 256, 14208, 14208]
    - [197, 4983.0]
  - - [128, 512, 1, 14208, 128, 128, 14208, 14208]
    - [196, 5287.0]
  - - [256, 128, 1, 15200, 256, 256, 15200, 15200]
    - [205, 5077.0]
  - - [512, 128, 1, 11408, 512, 512, 11408, 11408]
    - [203, 5205.0]
  - - [512, 128, 1, 16800, 512, 512, 16800, 16800]
    - [203, 5813.0]
  - - [128, 512, 1, 11264, 128, 128, 11264, 11264]
    - [205, 5031.0]
  - - [512, 128, 1, 11616, 512, 512, 11616, 11616]
    - [195, 5234.0]
  - - [512, 128, 1, 16128, 512, 512, 16128, 16128]
    - [193, 5164.0]
  - - [512, 128, 1, 11968, 512, 512, 11968, 11968]
    - [128, 5464.0]
  - - [128, 512, 1, 11968, 128, 128, 11968, 11968]
    - [204, 5277.0]
  - - [512, 128, 1, 12288, 512, 512, 12288, 12288]
    - [207, 4698.0]
  - - [128, 512, 1, 12288, 128, 128, 12288, 12288]
    - [201, 4977.0]
  - - [128, 512, 1, 12672, 128, 128, 12672, 12672]
    - [177, 5478.0]
  - - [512, 128, 1, 11776, 512, 512, 11776, 11776]
    - [197, 4841.0]
  - - [512, 128, 1, 12144, 512, 512, 12144, 12144]
    - [203, 5237.0]
  - - [512, 128, 1, 11264, 512, 512, 11264, 11264]
    - [197, 4663.0]
  - - [128, 512, 1, 12144, 128, 128, 12144, 12144]
    - [187, 5390.0]
  - - [512, 128, 1, 12672, 512, 512, 12672, 12672]
    - [141, 5243.0]
  - - [128, 512, 1, 12512, 128, 128, 12512, 12512]
    - [165, 5601.0]
  - - [128, 512, 1, 11776, 128, 128, 11776, 11776]
    - [197, 5067.0]
  - - [256, 128, 1, 12288, 256, 256, 12288, 12288]
    - [201, 4854.0]
  - - [40, 40, 1, 1909283, 40, 40, 1909283, 1909283]
    - [209, 778.0]
  - - [40, 40, 1, 3818566, 40, 40, 3818566, 3818566]
    - [202, 751.0]
  - - [5888, 1, 1, 3328, 5888, 5888, 3328, 3328]
    - [214, 251.0]
  - - [5056, 1, 1, 3328, 5056, 5056, 3328, 3328]
    - [214, 245.0]
  - - [6784, 1, 1, 1280, 6784, 6784, 1280, 1280]
    - [221, 247.0]
  - - [2944, 1, 1, 3328, 2944, 2944, 3328, 3328]
    - [217, 254.0]
  - - [3584, 1, 1, 1280, 3584, 3584, 1280, 1280]
    - [221, 223.0]
  - - [6784, 1, 1, 256, 6784, 6784, 256, 256]
    - [219, 198.0]
  - - [4288, 1, 1, 1280, 4288, 4288, 1280, 1280]
    - [214, 226.0]
  - - [5056, 1, 1, 1280, 5056, 5056, 1280, 1280]
    - [219, 225.0]
  - - [3584, 1, 1, 256, 3584, 3584, 256, 256]
    - [219, 177.0]
  - - [6784, 1, 1, 3328, 6784, 6784, 3328, 3328]
    - [217, 236.0]
  - - [1408, 1, 1, 1280, 1408, 1408, 1280, 1280]
    - [219, 151.0]
  - - [1408, 32, 1, 3328, 1408, 1408, 3328, 3328]
    - [178, 3030.0]
  - - [4288, 1, 1, 256, 4288, 4288, 256, 256]
    - [213, 182.0]
  - - [2368, 1, 1, 256, 2368, 2368, 256, 256]
    - [214, 142.0]
  - - [1856, 32, 1, 32, 1856, 1856, 32, 32]
    - [166, 1056.0]
  - - [5056, 1, 1, 256, 5056, 5056, 256, 256]
    - [221, 198.0]
  - - [5056, 1, 1, 1, 5056, 5056, 1, 1]
    - [116, 3.0]
  - - [1408, 1, 1, 256, 1408, 1408, 256, 256]
    - [184, 86.0]
  - - [1408, 1, 1, 1, 1408, 1408, 1, 1]
    - [116, 1.0]
  - - [4288, 1, 1, 3328, 4288, 4288, 3328, 3328]
    - [219, 331.0]
  - - [2368, 1, 1, 1280, 2368, 2368, 1280, 1280]
    - [214, 210.0]
  - - [1856, 1, 1, 1, 1856, 1856, 1, 1]
    - [212, 1.0]
  - - [1856, 32, 1, 256, 1856, 1856, 256, 256]
    - [218, 2501.0]
  - - [1408, 32, 1, 32, 1408, 1408, 32, 32]
    - [184, 775.0]
  - - [1856, 32, 1, 1280, 1856, 1856, 1280, 1280]
    - [154, 3260.0]
  - - [1408, 1, 1, 3328, 1408, 1408, 3328, 3328]
    - [211, 167.0]
  - - [5888, 1, 1, 256, 5888, 5888, 256, 256]
    - [220, 193.0]
  - - [5888, 1, 1, 1, 5888, 5888, 1, 1]
    - [116, 4.0]
  - - [1856, 32, 1, 3328, 1856, 1856, 3328, 3328]
    - [142, 3332.0]
  - - [2368, 1, 1, 3328, 2368, 2368, 3328, 3328]
    - [219, 212.0]
  - - [6784, 1, 1, 1, 6784, 6784, 1, 1]
    - [210, 2.0]
  - - [5888, 1, 1, 1280, 5888, 5888, 1280, 1280]
    - [220, 221.0]
  - - [2944, 1, 1, 256, 2944, 2944, 256, 256]
    - [213, 112.0]
  - - [2944, 1, 1, 1, 2944, 2944, 1, 1]
    - [210, 1.0]
  - - [1408, 32, 1, 1280, 1408, 1408, 1280, 1280]
    - [178, 2715.0]
  - - [1856, 1, 1, 1280, 1856, 1856, 1280, 1280]
    - [214, 155.0]
  - - [3584, 1, 1, 1, 3584, 3584, 1, 1]
    - [215, 2.0]
  - - [2944, 1, 1, 1280, 2944, 2944, 1280, 1280]
    - [221, 221.0]
  - - [3584, 1, 1, 3328, 3584, 3584, 3328, 3328]
    - [219, 230.0]
  - - [1856, 1, 1, 3328, 1856, 1856, 3328, 3328]
    - [211, 183.0]
  - - [4288, 1, 1, 1, 4288, 4288, 1, 1]
    - [210, 1.0]
  - - [1856, 1, 1, 256, 1856, 1856, 256, 256]
    - [221, 74.0]
  - - [1408, 32, 1, 256, 1408, 1408, 256, 256]
    - [178, 1611.0]
  - - [2368, 1, 1, 1, 2368, 2368, 1, 1]
    - [210, 1.0]
  - - [1760, 32, 1, 1760, 1760, 1760, 1760, 1760]
    - [116, 3056.0]
  - - [3072, 16, 1, 1024, 3072, 3072, 1024, 1024]
    - [160, 2497.0]
  - - [2560, 16, 1, 2560, 2560, 2560, 2560, 2560]
    - [184, 2892.0]
  - - [2048, 32, 1, 2048, 2048, 2048, 2048, 2048]
    - [154, 3214.0]
  - - [1760, 16, 1, 1760, 1760, 1760, 1760, 1760]
    - [148, 2067.0]
  - - [7680, 16, 1, 2560, 7680, 7680, 2560, 2560]
    - [184, 3143.0]
  - - [8448, 16, 1, 2816, 8448, 8448, 2816, 2816]
    - [184, 3012.0]
  - - [4608, 16, 1, 1536, 4608, 4608, 1536, 1536]
    - [160, 2757.0]
  - - [6144, 16, 1, 2560, 6144, 6144, 2560, 2560]
    - [135, 2967.0]
  - - [4096, 16, 1, 4096, 4096, 4096, 4096, 4096]
    - [135, 2825.0]
  - - [2048, 16, 1, 2048, 2048, 2048, 2048, 2048]
    - [135, 2240.0]
  - - [2048, 2, 1, 2048, 2048, 2048, 2048, 2048]
    - [214, 343.0]
  - - [2560, 4, 1, 2560, 2560, 2560, 2560, 2560]
    - [219, 884.0]
  - - [32768, 1, 1, 256, 32768, 32768, 256, 256]
    - [214, 248.0]
  - - [1600, 1, 1, 1024, 1600, 1600, 1024, 1024]
    - [219, 124.0]
  - - [3456, 1, 1, 256, 3456, 3456, 256, 256]
    - [216, 130.0]
  - - [4096, 1, 1, 256, 4096, 4096, 256, 256]
    - [219, 135.0]
  - - [6912, 1, 1, 256, 6912, 6912, 256, 256]
    - [219, 159.0]
  - - [2048, 8, 1, 2048, 2048, 2048, 2048, 2048]
    - [214, 1627.0]
  - - [2560, 2, 1, 2560, 2560, 2560, 2560, 2560]
    - [219, 479.0]
  - - [29000, 27, 1, 2560, 29000, 29000, 2560, 2560]
    - [184, 2845.0]
  - - [1, 4288, 1, 1280, 1, 1, 1280, 1280]
    - [231, 199.0]
  - - [32, 1408, 1, 32, 32, 32, 32, 32]
    - [114, 890.0]
  - - [1, 1408, 1, 3328, 1, 1, 3328, 3328]
    - [158, 159.0]
  - - [1, 2368, 1, 1280, 1, 1, 1280, 1280]
    - [146, 172.0]
  - - [1, 5888, 1, 3328, 1, 1, 3328, 3328]
    - [225, 200.0]
  - - [1, 1856, 1, 256, 1, 1, 256, 256]
    - [228, 86.0]
  - - [1, 3584, 1, 3328, 1, 1, 3328, 3328]
    - [231, 212.0]
  - - [1, 6784, 1, 3328, 1, 1, 3328, 3328]
    - [133, 194.0]
  - - [1, 2368, 1, 256, 1, 1, 256, 256]
    - [127, 89.0]
  - - [32, 1856, 1, 3328, 32, 32, 3328, 3328]
    - [227, 4079.0]
  - - [1, 2944, 1, 1280, 1, 1, 1280, 1280]
    - [127, 170.0]
  - - [1, 1856, 1, 3328, 1, 1, 3328, 3328]
    - [170, 185.0]
  - - [1, 1408, 1, 1, 1, 1, 1, 1]
    - [116, 0.36]
  - - [1, 6784, 1, 256, 1, 1, 256, 256]
    - [176, 160.0]
  - - [1, 6784, 1, 1, 1, 1, 1, 1]
    - [114, 2.0]
  - - [1, 4288, 1, 3328, 1, 1, 3328, 3328]
    - [127, 196.0]
  - - [1, 2368, 1, 3328, 1, 1, 3328, 3328]
    - [176, 187.0]
  - - [1, 5888, 1, 1280, 1, 1, 1280, 1280]
    - [224, 189.0]
  - - [1, 2944, 1, 256, 1, 1, 256, 256]
    - [231, 101.0]
  - - [1, 6784, 1, 1280, 1, 1, 1280, 1280]
    - [231, 185.0]
  - - [1, 5056, 1, 1, 1, 1, 1, 1]
    - [114, 3.0]
  - - [32, 1856, 1, 32, 32, 32, 32, 32]
    - [127, 1068.0]
  - - [32, 1408, 1, 256, 32, 32, 256, 256]
    - [223, 2383.0]
  - - [1, 5888, 1, 1, 1, 1, 1, 1]
    - [116, 3.0]
  - - [1, 2944, 1, 3328, 1, 1, 3328, 3328]
    - [176, 199.0]
  - - [1, 3584, 1, 1, 1, 1, 1, 1]
    - [222, 2.0]
  - - [1, 1408, 1, 256, 1, 1, 256, 256]
    - [170, 93.0]
  - - [1, 1856, 1, 1, 1, 1, 1, 1]
    - [161, 1.0]
  - - [1, 5056, 1, 1280, 1, 1, 1280, 1280]
    - [127, 197.0]
  - - [1, 5888, 1, 256, 1, 1, 256, 256]
    - [225, 174.0]
  - - [32, 1856, 1, 1280, 32, 32, 1280, 1280]
    - [227, 3756.0]
  - - [1, 2368, 1, 1, 1, 1, 1, 1]
    - [114, 1.0]
  - - [1, 1408, 1, 1280, 1, 1, 1280, 1280]
    - [146, 139.0]
  - - [1, 5056, 1, 256, 1, 1, 256, 256]
    - [231, 177.0]
  - - [1, 3584, 1, 1280, 1, 1, 1280, 1280]
    - [229, 205.0]
  - - [1, 4288, 1, 256, 1, 1, 256, 256]
    - [127, 160.0]
  - - [1, 4288, 1, 1, 1, 1, 1, 1]
    - [116, 2.0]
  - - [1, 2944, 1, 1, 1, 1, 1, 1]
    - [222, 2.0]
  - - [32, 1408, 1, 3328, 32, 32, 3328, 3328]
    - [223, 3400.0]
  - - [1, 5056, 1, 3328, 1, 1, 3328, 3328]
    - [231, 209.0]
  - - [32, 1856, 1, 256, 32, 32, 256, 256]
    - [230, 3154.0]
  - - [1, 1856, 1, 1280, 1, 1, 1280, 1280]
    - [133, 172.0]
  - - [1, 3584, 1, 256, 1, 1, 256, 256]
    - [225, 165.0]
  - - [32, 1408, 1, 1280, 32, 32, 1280, 1280]
    - [224, 3258.0]
  - - [2, 2048, 1, 1024, 2, 2, 1024, 1024]
    - [133, 371.0]
  - - [32, 1600, 1, 512, 32, 32, 512, 512]
    - [226, 2401.0]
  - - [1, 4096, 1, 256, 1, 1, 256, 256]
    - [225, 118.0]
  - - [1, 6912, 1, 256, 1, 1, 256, 256]
    - [229, 177.0]
  - - [2, 2048, 1, 768, 2, 2, 768, 768]
    - [225, 291.0]
  - - [2, 4608, 1, 768, 2, 2, 768, 768]
    - [225, 346.0]
  - - [2, 4608, 1, 1024, 2, 2, 1024, 1024]
    - [133, 325.0]
  - - [512, 16, 1, 500000, 512, 512, 500000, 500000]
    - [206, 2469.0]
  - - [1024, 8, 1, 500000, 1024, 1024, 500000, 500000]
    - [198, 1435.0]
  - - [1024, 16, 1, 500000, 1024, 1024, 500000, 500000]
    - [208, 2679.0]
  - - [512, 8, 1, 500000, 512, 512, 500000, 500000]
    - [198, 1233.0]
  - - [147, 64, 1, 12544, 147, 147, 12544, 12544]
    - [188, 2552.0]
  - - [256, 128, 1, 10752, 256, 256, 10752, 10752]
    - [189, 4125.0]
  - - [256, 128, 1, 10560, 256, 256, 10560, 10560]
    - [200, 5248.0]
  - - [256, 128, 1, 11408, 256, 256, 11408, 11408]
    - [195, 5716.0]
  - - [256, 12, 1, 11408, 256, 256, 11408, 11408]
    - [190, 1110.0]
  - - [256, 128, 1, 11616, 256, 256, 11616, 11616]
    - [195, 5603.0]
  - - [256, 12, 1, 11616, 256, 256, 11616, 11616]
    - [190, 1117.0]
  - - [256, 12, 1, 12288, 256, 256, 12288, 12288]
    - [209, 1114.0]
  - - [576, 64, 1, 5625, 576, 576, 5625, 5625]
    - [195, 4488.0]
  - - [147, 64, 1, 22500, 147, 147, 22500, 22500]
    - [199, 2856.0]
  - - [11, 11, 1, 1909283, 11, 11, 1909283, 1909283]
    - [194, 41.0]
  - - [11, 11, 1, 3818566, 11, 11, 3818566, 3818566]
    - [190, 33.0]
  - - [448, 1, 1, 256, 448, 448, 256, 256]
    - [164, 27.0]
  - - [704, 64, 1, 3328, 704, 704, 3328, 3328]
    - [147, 3584.0]
  - - [256, 128, 1, 256, 256, 256, 256, 256]
    - [131, 2255.0]
  - - [448, 64, 1, 1, 448, 448, 1, 1]
    - [116, 8.0]
  - - [64, 1024, 1, 1280, 64, 64, 1280, 1280]
    - [143, 3570.0]
  - - [1024, 1, 1, 3328, 1024, 1024, 3328, 3328]
    - [160, 114.0]
  - - [1024, 64, 1, 1280, 1024, 1024, 1280, 1280]
    - [117, 3305.0]
  - - [448, 128, 1, 256, 448, 448, 256, 256]
    - [156, 2079.0]
  - - [1, 1024, 1, 3328, 1, 1, 3328, 3328]
    - [133, 122.0]
  - - [704, 64, 1, 32, 704, 704, 32, 32]
    - [122, 364.0]
  - - [32, 448, 1, 3328, 32, 32, 3328, 3328]
    - [182, 1904.0]
  - - [448, 1, 1, 1, 448, 448, 1, 1]
    - [122, 0.12]
  - - [64, 128, 1, 3328, 64, 64, 3328, 3328]
    - [120, 1211.0]
  - - [64, 128, 1, 1, 64, 64, 1, 1]
    - [114, 2.0]
  - - [256, 128, 1, 1, 256, 256, 1, 1]
    - [114, 8.0]
  - - [256, 32, 1, 3328, 256, 256, 3328, 3328]
    - [120, 1193.0]
  - - [1, 1, 1, 3328, 1, 1, 3328, 3328]
    - [163, 0.16]
  - - [32, 448, 1, 1280, 32, 32, 1280, 1280]
    - [170, 1475.0]
  - - [32, 448, 1, 32, 32, 32, 32, 32]
    - [122, 119.0]
  - - [64, 1024, 1, 32, 64, 64, 32, 32]
    - [156, 530.0]
  - - [128, 1, 1, 1, 128, 128, 1, 1]
    - [114, 0.03]
  - - [1024, 32, 1, 3328, 1024, 1024, 3328, 3328]
    - [180, 2790.0]
  - - [448, 1, 1, 1280, 448, 448, 1280, 1280]
    - [133, 49.0]
  - - [64, 64, 1, 1280, 64, 64, 1280, 1280]
    - [182, 478.0]
  - - [448, 128, 1, 3328, 448, 448, 3328, 3328]
    - [118, 3877.0]
  - - [128, 256, 1, 1280, 128, 128, 1280, 1280]
    - [176, 2576.0]
  - - [256, 256, 1, 32, 256, 256, 32, 32]
    - [168, 502.0]
  - - [1024, 1, 1, 256, 1024, 1024, 256, 256]
    - [127, 44.0]
  - - [128, 32, 1, 32, 128, 128, 32, 32]
    - [122, 33.0]
  - - [448, 64, 1, 256, 448, 448, 256, 256]
    - [178, 1211.0]
  - - [128, 256, 1, 3328, 128, 128, 3328, 3328]
    - [176, 3055.0]
  - - [1, 64, 1, 3328, 1, 1, 3328, 3328]
    - [120, 9.0]
  - - [64, 1024, 1, 1, 64, 64, 1, 1]
    - [114, 16.0]
  - - [64, 1024, 1, 3328, 64, 64, 3328, 3328]
    - [117, 4023.0]
  - - [32, 704, 1, 3328, 32, 32, 3328, 3328]
    - [170, 2738.0]
  - - [32, 1024, 1, 3328, 32, 32, 3328, 3328]
    - [118, 2862.0]
  - - [64, 1, 1, 256, 64, 64, 256, 256]
    - [185, 4.0]
  - - [1024, 64, 1, 32, 1024, 1024, 32, 32]
    - [123, 1070.0]
  - - [1024, 64, 1, 3328, 1024, 1024, 3328, 3328]
    - [143, 3755.0]
  - - [32, 1024, 1, 256, 32, 32, 256, 256]
    - [168, 1307.0]
  - - [64, 1, 1, 1, 64, 64, 1, 1]
    - [116, 0.02]
  - - [256, 1, 1, 256, 256, 256, 256, 256]
    - [114, 12.0]
  - - [256, 128, 1, 3328, 256, 256, 3328, 3328]
    - [176, 3004.0]
  - - [64, 64, 1, 1, 64, 64, 1, 1]
    - [114, 1.0]
  - - [32, 704, 1, 1280, 32, 32, 1280, 1280]
    - [182, 2158.0]
  - - [256, 1, 1, 1280, 256, 256, 1280, 1280]
    - [182, 29.0]
  - - [128, 32, 1, 1280, 128, 128, 1280, 1280]
    - [133, 488.0]
  - - [128, 256, 1, 1, 128, 128, 1, 1]
    - [147, 17.0]
  - - [1, 256, 1, 256, 1, 1, 256, 256]
    - [114, 11.0]
  - - [1, 256, 1, 1, 1, 1, 1, 1]
    - [114, 0.06]
  - - [1024, 1, 1, 1280, 1024, 1024, 1280, 1280]
    - [182, 116.0]
  - - [64, 448, 1, 256, 64, 64, 256, 256]
    - [127, 2005.0]
  - - [1024, 32, 1, 1280, 1024, 1024, 1280, 1280]
    - [120, 3048.0]
  - - [256, 256, 1, 3328, 256, 256, 3328, 3328]
    - [165, 4309.0]
  - - [704, 32, 1, 1280, 704, 704, 1280, 1280]
    - [158, 2072.0]
  - - [64, 64, 1, 3328, 64, 64, 3328, 3328]
    - [182, 609.0]
  - - [32, 32, 1, 32, 32, 32, 32, 32]
    - [114, 8.0]
  - - [1024, 32, 1, 32, 1024, 1024, 32, 32]
    - [114, 672.0]
  - - [128, 64, 1, 32, 128, 128, 32, 32]
    - [114, 158.0]
  - - [64, 1, 1, 1280, 64, 64, 1280, 1280]
    - [120, 7.0]
  - - [448, 32, 1, 1280, 448, 448, 1280, 1280]
    - [120, 1477.0]
  - - [704, 32, 1, 3328, 704, 704, 3328, 3328]
    - [170, 2844.0]
  - - [128, 128, 1, 256, 128, 128, 256, 256]
    - [146, 1263.0]
  - - [64, 448, 1, 1280, 64, 64, 1280, 1280]
    - [120, 3053.0]
  - - [64, 256, 1, 1, 64, 64, 1, 1]
    - [118, 10.0]
  - - [256, 256, 1, 256, 256, 256, 256, 256]
    - [128, 3251.0]
  - - [448, 1, 1, 3328, 448, 448, 3328, 3328]
    - [158, 63.0]
  - - [256, 1, 1, 1, 256, 256, 1, 1]
    - [129, 0.07]
  - - [32, 1024, 1, 1280, 32, 32, 1280, 1280]
    - [133, 2545.0]
  - - [1, 256, 1, 3328, 1, 1, 3328, 3328]
    - [120, 38.0]
  - - [256, 32, 1, 256, 256, 256, 256, 256]
    - [182, 380.0]
  - - [256, 128, 1, 1280, 256, 256, 1280, 1280]
    - [159, 2605.0]
  - - [256, 64, 1, 256, 256, 256, 256, 256]
    - [170, 1128.0]
  - - [1, 1, 1, 1, 1, 1, 1, 1]
    - [164, 0.0005494505479547652]
  - - [32, 1024, 1, 32, 32, 32, 32, 32]
    - [164, 632.0]
  - - [128, 256, 1, 256, 128, 128, 256, 256]
    - [131, 2231.0]
  - - [704, 64, 1, 256, 704, 704, 256, 256]
    - [154, 2541.0]
  - - [704, 1, 1, 1, 704, 704, 1, 1]
    - [114, 0.41]
  - - [128, 448, 1, 1280, 128, 128, 1280, 1280]
    - [144, 3466.0]
  - - [448, 32, 1, 32, 448, 448, 32, 32]
    - [118, 115.0]
  - - [704, 64, 1, 1, 704, 704, 1, 1]
    - [168, 12.0]
  - - [704, 32, 1, 256, 704, 704, 256, 256]
    - [129, 949.0]
  - - [32, 704, 1, 32, 32, 32, 32, 32]
    - [127, 180.0]
  - - [128, 64, 1, 256, 128, 128, 256, 256]
    - [120, 390.0]
  - - [448, 32, 1, 3328, 448, 448, 3328, 3328]
    - [120, 1947.0]
  - - [64, 704, 1, 32, 64, 64, 32, 32]
    - [120, 366.0]
  - - [64, 704, 1, 3328, 64, 64, 3328, 3328]
    - [171, 3567.0]
  - - [448, 64, 1, 1280, 448, 448, 1280, 1280]
    - [158, 2483.0]
  - - [128, 448, 1, 32, 128, 128, 32, 32]
    - [114, 1031.0]
  - - [64, 256, 1, 256, 64, 64, 256, 256]
    - [180, 763.0]
  - - [64, 704, 1, 1, 64, 64, 1, 1]
    - [114, 11.0]
  - - [1, 1024, 1, 1, 1, 1, 1, 1]
    - [114, 0.26]
  - - [256, 1, 1, 3328, 256, 256, 3328, 3328]
    - [120, 37.0]
  - - [32, 64, 1, 32, 32, 32, 32, 32]
    - [116, 17.0]
  - - [256, 256, 1, 1, 256, 256, 1, 1]
    - [131, 17.0]
  - - [32, 256, 1, 32, 32, 32, 32, 32]
    - [144, 66.0]
  - - [128, 1, 1, 256, 128, 128, 256, 256]
    - [120, 6.0]
  - - [32, 64, 1, 3328, 32, 32, 3328, 3328]
    - [158, 305.0]
  - - [1, 128, 1, 3328, 1, 1, 3328, 3328]
    - [120, 19.0]
  - - [32, 256, 1, 256, 32, 32, 256, 256]
    - [133, 413.0]
  - - [1, 448, 1, 1, 1, 1, 1, 1]
    - [122, 0.12]
  - - [1, 704, 1, 3328, 1, 1, 3328, 3328]
    - [170, 91.0]
  - - [64, 1, 1, 3328, 64, 64, 3328, 3328]
    - [124, 10.0]
  - - [448, 64, 1, 3328, 448, 448, 3328, 3328]
    - [120, 2767.0]
  - - [256, 32, 1, 1280, 256, 256, 1280, 1280]
    - [120, 935.0]
  - - [128, 448, 1, 3328, 128, 128, 3328, 3328]
    - [144, 3901.0]
  - - [64, 1024, 1, 256, 64, 64, 256, 256]
    - [177, 2135.0]
  - - [64, 32, 1, 32, 64, 64, 32, 32]
    - [114, 17.0]
  - - [1, 448, 1, 3328, 1, 1, 3328, 3328]
    - [174, 65.0]
  - - [1024, 64, 1, 256, 1024, 1024, 256, 256]
    - [128, 2162.0]
  - - [64, 704, 1, 1280, 64, 64, 1280, 1280]
    - [176, 3074.0]
  - - [64, 32, 1, 3328, 64, 64, 3328, 3328]
    - [120, 305.0]
  - - [64, 448, 1, 1, 64, 64, 1, 1]
    - [182, 18.0]
  - - [128, 128, 1, 1280, 128, 128, 1280, 1280]
    - [122, 1956.0]
  - - [64, 128, 1, 256, 64, 64, 256, 256]
    - [182, 397.0]
  - - [64, 448, 1, 32, 64, 64, 32, 32]
    - [156, 243.0]
  - - [128, 64, 1, 3328, 128, 128, 3328, 3328]
    - [133, 1226.0]
  - - [32, 64, 1, 1280, 32, 32, 1280, 1280]
    - [120, 237.0]
  - - [448, 32, 1, 256, 448, 448, 256, 256]
    - [135, 651.0]
  - - [1024, 32, 1, 256, 1024, 1024, 256, 256]
    - [180, 1323.0]
  - - [1, 128, 1, 256, 1, 1, 256, 256]
    - [120, 6.0]
  - - [32, 256, 1, 1280, 32, 32, 1280, 1280]
    - [146, 923.0]
  - - [32, 128, 1, 3328, 32, 32, 3328, 3328]
    - [133, 604.0]
  - - [32, 128, 1, 32, 32, 32, 32, 32]
    - [175, 34.0]
  - - [1, 128, 1, 1, 1, 1, 1, 1]
    - [114, 0.07]
  - - [128, 64, 1, 1, 128, 128, 1, 1]
    - [114, 2.0]
  - - [32, 448, 1, 256, 32, 32, 256, 256]
    - [144, 646.0]
  - - [1, 704, 1, 256, 1, 1, 256, 256]
    - [150, 47.0]
  - - [32, 256, 1, 3328, 32, 32, 3328, 3328]
    - [170, 1199.0]
  - - [256, 32, 1, 32, 256, 256, 32, 32]
    - [123, 68.0]
  - - [64, 256, 1, 3328, 64, 64, 3328, 3328]
    - [170, 2195.0]
  - - [1, 704, 1, 1, 1, 1, 1, 1]
    - [114, 0.17]
  - - [128, 448, 1, 1, 128, 128, 1, 1]
    - [114, 14.0]
  - - [64, 128, 1, 32, 64, 64, 32, 32]
    - [116, 64.0]
  - - [704, 1, 1, 1280, 704, 704, 1280, 1280]
    - [124, 70.0]
  - - [1024, 1, 1, 1, 1024, 1024, 1, 1]
    - [114, 1.0]
  - - [256, 128, 1, 32, 256, 256, 32, 32]
    - [142, 256.0]
  - - [448, 128, 1, 1, 448, 448, 1, 1]
    - [114, 14.0]
  - - [704, 32, 1, 32, 704, 704, 32, 32]
    - [126, 183.0]
  - - [128, 32, 1, 256, 128, 128, 256, 256]
    - [182, 190.0]
  - - [64, 32, 1, 1280, 64, 64, 1280, 1280]
    - [133, 241.0]
  - - [448, 128, 1, 32, 448, 448, 32, 32]
    - [114, 1055.0]
  - - [128, 448, 1, 256, 128, 128, 256, 256]
    - [131, 2022.0]
  - - [32, 32, 1, 256, 32, 32, 256, 256]
    - [135, 49.0]
  - - [256, 64, 1, 32, 256, 256, 32, 32]
    - [114, 308.0]
  - - [1, 1024, 1, 1280, 1, 1, 1280, 1280]
    - [146, 101.0]
  - - [32, 32, 1, 3328, 32, 32, 3328, 3328]
    - [137, 152.0]
  - - [1, 256, 1, 1280, 1, 1, 1280, 1280]
    - [114, 31.0]
  - - [1, 128, 1, 1280, 1, 1, 1280, 1280]
    - [120, 14.0]
  - - [1, 64, 1, 256, 1, 1, 256, 256]
    - [114, 3.0]
  - - [256, 64, 1, 1280, 256, 256, 1280, 1280]
    - [133, 1765.0]
  - - [32, 704, 1, 256, 32, 32, 256, 256]
    - [170, 952.0]
  - - [1, 64, 1, 1, 1, 1, 1, 1]
    - [116, 0.02]
  - - [704, 64, 1, 1280, 704, 704, 1280, 1280]
    - [183, 2875.0]
  - - [1, 704, 1, 1280, 1, 1, 1280, 1280]
    - [114, 72.0]
  - - [128, 128, 1, 32, 128, 128, 32, 32]
    - [114, 305.0]
  - - [1024, 64, 1, 1, 1024, 1024, 1, 1]
    - [114, 40.0]
  - - [704, 1, 1, 256, 704, 704, 256, 256]
    - [114, 49.0]
  - - [128, 64, 1, 1280, 128, 128, 1280, 1280]
    - [148, 1040.0]
  - - [64, 64, 1, 32, 64, 64, 32, 32]
    - [123, 34.0]
  - - [1, 1, 1, 1280, 1, 1, 1280, 1280]
    - [120, 0.11]
  - - [64, 704, 1, 256, 64, 64, 256, 256]
    - [166, 1652.0]
  - - [1, 448, 1, 1280, 1, 1, 1280, 1280]
    - [133, 49.0]
  - - [64, 256, 1, 32, 64, 64, 32, 32]
    - [125, 200.0]
  - - [32, 128, 1, 1280, 32, 32, 1280, 1280]
    - [133, 475.0]
  - - [128, 128, 1, 3328, 128, 128, 3328, 3328]
    - [120, 2174.0]
  - - [64, 448, 1, 3328, 64, 64, 3328, 3328]
    - [176, 3001.0]
  - - [32, 64, 1, 256, 32, 32, 256, 256]
    - [133, 96.0]
  - - [128, 256, 1, 32, 128, 128, 32, 32]
    - [122, 256.0]
  - - [64, 256, 1, 1280, 64, 64, 1280, 1280]
    - [170, 1722.0]
  - - [64, 64, 1, 256, 64, 64, 256, 256]
    - [129, 190.0]
  - - [448, 64, 1, 32, 448, 448, 32, 32]
    - [139, 229.0]
  - - [64, 128, 1, 1280, 64, 64, 1280, 1280]
    - [158, 945.0]
  - - [1, 1024, 1, 256, 1, 1, 256, 256]
    - [114, 68.0]
  - - [128, 1, 1, 3328, 128, 128, 3328, 3328]
    - [120, 19.0]
  - - [128, 128, 1, 1, 128, 128, 1, 1]
    - [114, 10.0]
  - - [32, 128, 1, 256, 32, 32, 256, 256]
    - [114, 312.0]
  - - [1, 64, 1, 1280, 1, 1, 1280, 1280]
    - [114, 8.0]
  - - [448, 128, 1, 1280, 448, 448, 1280, 1280]
    - [131, 3446.0]
  - - [256, 64, 1, 1, 256, 256, 1, 1]
    - [114, 10.0]
  - - [256, 256, 1, 1280, 256, 256, 1280, 1280]
    - [147, 4029.0]
  - - [704, 1, 1, 3328, 704, 704, 3328, 3328]
    - [137, 86.0]
  - - [128, 32, 1, 3328, 128, 128, 3328, 3328]
    - [133, 610.0]
  - - [32, 32, 1, 1280, 32, 32, 1280, 1280]
    - [158, 119.0]
  - - [1, 1, 1, 256, 1, 1, 256, 256]
    - [129, 0.05]
  - - [1, 448, 1, 256, 1, 1, 256, 256]
    - [120, 20.0]
  - - [256, 64, 1, 3328, 256, 256, 3328, 3328]
    - [120, 2152.0]
  - - [64, 32, 1, 256, 64, 64, 256, 256]
    - [133, 95.0]
  - - [128, 1, 1, 1280, 128, 128, 1280, 1280]
    - [133, 15.0]
  - - [512, 128, 1, 784, 512, 512, 784, 784]
    - [115, 3416.0]
  - - [256, 64, 1, 3136, 256, 256, 3136, 3136]
    - [120, 2166.0]
  - - [64, 256, 1, 3136, 64, 64, 3136, 3136]
    - [170, 2198.0]
  - - [128, 512, 1, 784, 128, 128, 784, 784]
    - [141, 3448.0]
  - - [64, 64, 1, 3136, 64, 64, 3136, 3136]
    - [170, 599.0]
  - - [14, 14, 1, 64, 14, 14, 64, 64]
    - [114, 5.0]
  - - [15, 14, 1, 64, 15, 15, 64, 64]
    - [114, 6.0]
  - - [15, 15, 1, 64, 15, 15, 64, 64]
    - [114, 3.0]
  - - [17, 15, 1, 64, 17, 17, 64, 64]
    - [116, 4.0]
  - - [17, 17, 1, 64, 17, 17, 64, 64]
    - [114, 4.0]
  - - [21, 17, 1, 64, 21, 21, 64, 64]
    - [114, 5.0]
  - - [21, 21, 1, 64, 21, 21, 64, 64]
    - [114, 6.0]
  - - [24, 24, 1, 64, 24, 24, 64, 64]
    - [114, 8.0]
  - - [30, 30, 1, 64, 30, 30, 64, 64]
    - [114, 25.0]
  - - [30, 31, 1, 64, 30, 30, 64, 64]
    - [166, 14.0]
  - - [31, 31, 1, 64, 31, 31, 64, 64]
    - [118, 14.0]
  - - [32, 32, 1, 64, 32, 32, 64, 64]
    - [114, 35.0]
  - - [32, 35, 1, 64, 32, 32, 64, 64]
    - [116, 16.0]
  - - [34, 24, 1, 64, 34, 34, 64, 64]
    - [142, 12.0]
  - - [34, 34, 1, 64, 34, 34, 64, 64]
    - [162, 18.0]
  - - [35, 35, 1, 64, 35, 35, 64, 64]
    - [114, 18.0]
  - - [27, 27, 1, 64, 27, 27, 64, 64]
    - [114, 10.0]
  - - [27, 33, 1, 64, 27, 27, 64, 64]
    - [166, 14.0]
  - - [33, 33, 1, 64, 33, 33, 64, 64]
    - [118, 16.0]
  - - [2, 4, 1, 1024, 2, 2, 1024, 1024]
    - [114, 1.0]
  - - [2, 32, 1, 1024, 2, 2, 1024, 1024]
    - [114, 7.0]
  - - [64, 512, 1, 512, 64, 64, 512, 512]
    - [176, 1868.0]
  - - [1024, 4, 1, 1024, 1024, 1024, 1024, 1024]
    - [133, 364.0]
  - - [1024, 32, 1, 1024, 1024, 1024, 1024, 1024]
    - [133, 2467.0]
  - - [3, 3, 512, 64, 3, 3, 64, 64]
    - [114, 53.0]
  - - [5, 5, 512, 64, 5, 5, 64, 64]
    - [127, 139.0]
  - - [5, 5, 960, 64, 5, 5, 64, 64]
    - [127, 213.0]
  - - [9, 9, 512, 64, 9, 9, 64, 64]
    - [176, 434.0]
  - - [27, 27, 32768, 128, 27, 27, 128, 128]
    - [121, 3635.0]
  - - [64, 512, 1, 1024, 64, 64, 1024, 1024]
    - [152, 2918.0]
  - - [64, 960, 1, 1024, 64, 64, 1024, 1024]
    - [131, 3865.0]
  - - [14, 14, 10880, 64, 14, 14, 64, 64]
    - [120, 2591.0]
  - - [15, 14, 10880, 64, 15, 15, 64, 64]
    - [158, 2758.0]
  - - [15, 15, 7680, 64, 15, 15, 64, 64]
    - [158, 2894.0]
  - - [15, 15, 10880, 64, 15, 15, 64, 64]
    - [158, 2832.0]
  - - [17, 15, 7680, 64, 17, 17, 64, 64]
    - [178, 2138.0]
  - - [17, 17, 7680, 64, 17, 17, 64, 64]
    - [153, 1882.0]
  - - [21, 17, 6144, 64, 21, 21, 64, 64]
    - [153, 2108.0]
  - - [21, 21, 6144, 64, 21, 21, 64, 64]
    - [147, 2254.0]
  - - [24, 24, 4736, 64, 24, 24, 64, 64]
    - [159, 2834.0]
  - - [30, 30, 2048, 64, 30, 30, 64, 64]
    - [158, 3178.0]
  - - [30, 31, 2048, 64, 30, 30, 64, 64]
    - [168, 3397.0]
  - - [31, 31, 2048, 64, 31, 31, 64, 64]
    - [144, 3401.0]
  - - [34, 24, 4736, 64, 34, 34, 64, 64]
    - [179, 2607.0]
  - - [27, 27, 1920, 64, 27, 27, 64, 64]
    - [159, 3246.0]
  - - [27, 33, 1920, 64, 27, 27, 64, 64]
    - [115, 2496.0]
  - - [2, 8, 1, 1024, 2, 2, 1024, 1024]
    - [120, 2.0]
  - - [1024, 77, 1, 1024, 1024, 1024, 1024, 1024]
    - [177, 3413.0]
  - - [2, 10, 1, 1024, 2, 2, 1024, 1024]
    - [114, 2.0]
  - - [1024, 10, 1, 1024, 1024, 1024, 1024, 1024]
    - [133, 887.0]
  - - [2, 39, 1, 1024, 2, 2, 1024, 1024]
    - [120, 8.0]
  - - [1024, 39, 1, 1024, 1024, 1024, 1024, 1024]
    - [178, 2361.0]
  - - [2, 40, 1, 1024, 2, 2, 1024, 1024]
    - [120, 8.0]
  - - [1024, 40, 1, 1024, 1024, 1024, 1024, 1024]
    - [178, 2422.0]
  - - [2, 41, 1, 1024, 2, 2, 1024, 1024]
    - [114, 8.0]
  - - [1024, 41, 1, 1024, 1024, 1024, 1024, 1024]
    - [176, 2491.0]
  - - [2, 5, 1, 1024, 2, 2, 1024, 1024]
    - [114, 1.0]
  - - [1024, 5, 1, 1024, 1024, 1024, 1024, 1024]
    - [133, 430.0]
  - - [2, 6, 1, 1024, 2, 2, 1024, 1024]
    - [114, 1.0]
  - - [1024, 6, 1, 1024, 1024, 1024, 1024, 1024]
    - [182, 527.0]
  - - [1024, 8, 1, 1024, 1024, 1024, 1024, 1024]
    - [133, 694.0]
  - - [2, 9, 1, 1024, 2, 2, 1024, 1024]
    - [114, 2.0]
  - - [1024, 9, 1, 1024, 1024, 1024, 1024, 1024]
    - [133, 786.0]
  - - [4, 4, 32768, 64, 4, 4, 64, 64]
    - [176, 308.0]
  - - [4, 4, 38400, 64, 4, 4, 64, 64]
    - [176, 329.0]
  - - [17, 17, 6144, 64, 17, 17, 64, 64]
    - [128, 1811.0]
  - - [128, 128, 1, 64, 128, 128, 64, 64]
    - [140, 253.0]
  - - [64, 128, 1, 128, 64, 64, 128, 128]
    - [180, 229.0]
  - - [2, 1024, 1, 1024, 2, 2, 1024, 1024]
    - [182, 186.0]
  - - [5, 5, 1, 64, 5, 5, 64, 64]
    - [129, 0.35]
  - - [33, 33, 1, 32, 33, 33, 32, 32]
    - [114, 8.0]
  - - [1024, 16, 1, 1024, 1024, 1024, 1024, 1024]
    - [182, 1456.0]
  - - [2, 4, 1, 2560, 2, 2, 2560, 2560]
    - [114, 1.0]
  - - [2, 16, 1, 1024, 2, 2, 1024, 1024]
    - [114, 3.0]
  - - [2, 2, 1, 2048, 2, 2, 2048, 2048]
    - [120, 1.0]
  - - [1024, 1, 1, 1024, 1024, 1024, 1024, 1024]
    - [133, 90.0]
  - - [512, 1, 1, 2048, 512, 512, 2048, 2048]
    - [158, 66.0]
  - - [200, 1, 1, 1024, 200, 200, 1024, 1024]
    - [133, 21.0]
  - - [960, 1, 1, 2048, 960, 960, 2048, 2048]
    - [133, 106.0]
  - - [1024, 64, 1, 1024, 1024, 1024, 1024, 1024]
    - [181, 3280.0]
  - - [864, 1, 1, 256, 864, 864, 256, 256]
    - [176, 58.0]
  - - [1024, 80, 1, 1024, 1024, 1024, 1024, 1024]
    - [153, 3481.0]
  - - [1024, 82, 1, 1024, 1024, 1024, 1024, 1024]
    - [177, 3533.0]
  - - [1024, 12, 1, 1024, 1024, 1024, 1024, 1024]
    - [186, 1108.0]
  - - [2, 64, 1, 1024, 2, 2, 1024, 1024]
    - [127, 15.0]
  - - [2, 80, 1, 1024, 2, 2, 1024, 1024]
    - [127, 19.0]
  - - [2, 82, 1, 1024, 2, 2, 1024, 1024]
    - [137, 21.0]
  - - [2, 12, 1, 1024, 2, 2, 1024, 1024]
    - [186, 3.0]
  - - [2, 1, 1, 1024, 2, 2, 1024, 1024]
    - [120, 0.26]
  - - [24, 24, 6816, 64, 24, 24, 64, 64]
    - [171, 2926.0]
  - - [256, 128, 1, 3136, 256, 256, 3136, 3136]
    - [140, 3536.0]
  - - [576, 64, 1, 3136, 576, 576, 3136, 3136]
    - [114, 3380.0]
  - - [768, 16, 1, 768, 768, 768, 768, 768]
    - [137, 1004.0]
  - - [768, 12, 1, 768, 768, 768, 768, 768]
    - [146, 736.0]
  - - [768, 4, 1, 768, 768, 768, 768, 768]
    - [133, 246.0]
  - - [64, 1024, 1, 1024, 64, 64, 1024, 1024]
    - [177, 3551.0]
  - - [26, 26, 6272, 64, 26, 26, 64, 64]
    - [159, 3276.0]
  - - [2, 128, 1, 1024, 2, 2, 1024, 1024]
    - [120, 35.0]
  - - [2, 96, 1, 1024, 2, 2, 1024, 1024]
    - [120, 26.0]
  - - [256, 80, 1, 784, 256, 256, 784, 784]
    - [170, 1512.0]
  - - [256, 12, 1, 3800, 256, 256, 3800, 3800]
    - [163, 455.0]
  - - [256, 3, 1, 3800, 256, 256, 3800, 3800]
    - [124, 115.0]
  - - [256, 12, 1, 950, 256, 256, 950, 950]
    - [137, 283.0]
  - - [256, 3, 1, 950, 256, 256, 950, 950]
    - [150, 73.0]
  - - [256, 12, 1, 3220, 256, 256, 3220, 3220]
    - [137, 442.0]
  - - [256, 3, 1, 3220, 256, 256, 3220, 3220]
    - [137, 111.0]
  - - [256, 12, 1, 3072, 256, 256, 3072, 3072]
    - [163, 450.0]
  - - [256, 3, 1, 3072, 256, 256, 3072, 3072]
    - [137, 113.0]
  - - [256, 12, 1, 850, 256, 256, 850, 850]
    - [163, 269.0]
  - - [256, 3, 1, 850, 256, 256, 850, 850]
    - [124, 69.0]
  - - [256, 12, 1, 2852, 256, 256, 2852, 2852]
    - [174, 475.0]
  - - [256, 3, 1, 2852, 256, 256, 2852, 2852]
    - [163, 109.0]
  - - [256, 12, 1, 805, 256, 256, 805, 805]
    - [124, 264.0]
  - - [256, 3, 1, 805, 256, 256, 805, 805]
    - [122, 70.0]
  - - [256, 3, 1, 864, 256, 256, 864, 864]
    - [137, 70.0]
  - - [256, 3, 1, 768, 256, 256, 768, 768]
    - [120, 67.0]
  - - [256, 12, 1, 864, 256, 256, 864, 864]
    - [164, 310.0]
  - - [256, 12, 1, 768, 256, 256, 768, 768]
    - [120, 270.0]
  - - [256, 12, 1, 2904, 256, 256, 2904, 2904]
    - [163, 428.0]
  - - [256, 3, 1, 2904, 256, 256, 2904, 2904]
    - [124, 108.0]
  - - [256, 3, 1, 713, 256, 256, 713, 713]
    - [174, 63.0]
  - - [256, 12, 1, 888, 256, 256, 888, 888]
    - [150, 279.0]
  - - [256, 3, 1, 888, 256, 256, 888, 888]
    - [124, 70.0]
  - - [256, 12, 1, 713, 256, 256, 713, 713]
    - [124, 247.0]
  - - [256, 3, 1, 660, 256, 256, 660, 660]
    - [174, 60.0]
  - - [256, 3, 1, 672, 256, 256, 672, 672]
    - [124, 61.0]
  - - [256, 12, 1, 660, 256, 256, 660, 660]
    - [124, 233.0]
  - - [256, 3, 1, 726, 256, 256, 726, 726]
    - [124, 63.0]
  - - [256, 12, 1, 672, 256, 256, 672, 672]
    - [174, 254.0]
  - - [256, 3, 1, 247, 256, 256, 247, 247]
    - [146, 32.0]
  - - [256, 12, 1, 726, 256, 256, 726, 726]
    - [163, 250.0]
  - - [256, 3, 1, 216, 256, 256, 216, 216]
    - [114, 36.0]
  - - [256, 3, 1, 3400, 256, 256, 3400, 3400]
    - [137, 112.0]
  - - [256, 3, 1, 221, 256, 256, 221, 221]
    - [114, 38.0]
  - - [256, 12, 1, 3552, 256, 256, 3552, 3552]
    - [137, 453.0]
  - - [256, 3, 1, 3456, 256, 256, 3456, 3456]
    - [124, 115.0]
  - - [256, 3, 1, 204, 256, 256, 204, 204]
    - [120, 27.0]
  - - [256, 12, 1, 3400, 256, 256, 3400, 3400]
    - [137, 444.0]
  - - [256, 12, 1, 3456, 256, 256, 3456, 3456]
    - [186, 458.0]
  - - [256, 12, 1, 221, 256, 256, 221, 221]
    - [172, 114.0]
  - - [256, 3, 1, 3552, 256, 256, 3552, 3552]
    - [124, 114.0]
  - - [256, 3, 1, 228, 256, 256, 228, 228]
    - [120, 29.0]
  - - [256, 3, 1, 234, 256, 256, 234, 234]
    - [133, 30.0]
  - - [256, 12, 1, 234, 256, 256, 234, 234]
    - [170, 118.0]
  - - [256, 12, 1, 228, 256, 256, 228, 228]
    - [171, 137.0]
  - - [256, 3, 1, 252, 256, 256, 252, 252]
    - [140, 39.0]
  - - [256, 12, 1, 252, 256, 256, 252, 252]
    - [137, 186.0]
  - - [256, 12, 1, 247, 256, 256, 247, 247]
    - [172, 189.0]
  - - [128, 256, 1, 1444, 128, 128, 1444, 1444]
    - [134, 2555.0]
  - - [256, 128, 1, 25, 256, 256, 25, 25]
    - [122, 398.0]
  - - [256, 128, 1, 9, 256, 256, 9, 9]
    - [149, 162.0]
  - - [256, 256, 1, 1444, 256, 256, 1444, 1444]
    - [114, 3694.0]
  - - [512, 128, 1, 100, 512, 512, 100, 100]
    - [164, 1196.0]
  - - [64, 128, 1, 1444, 64, 64, 1444, 1444]
    - [124, 827.0]
  - - [81, 1024, 1, 1024, 81, 81, 1024, 1024]
    - [156, 3153.0]
  - - [81, 1000, 1, 1024, 81, 81, 1024, 1024]
    - [180, 3114.0]
  - - [1024, 20, 1, 1024, 1024, 1024, 1024, 1024]
    - [180, 1409.0]
  - - [2, 8, 1, 2048, 2, 2, 2048, 2048]
    - [114, 2.0]
  - - [2, 20, 1, 1024, 2, 2, 1024, 1024]
    - [114, 4.0]
  - - [2, 2, 1, 2560, 2, 2, 2560, 2560]
    - [120, 1.0]
- null
- null
- DeviceEfficiency
...
