library/src/blas3/Tensile/Logic/asm_full/navi22_Cijk_Ailk_Bjlk_HB.yaml
---
- {MinimumRequiredVersion: 4.28.0}
- navi22
- gfx1031
    SolutionIndex: 0
    SolutionNameMin: Cijk_Ailk_Bjlk_HB_MT128x128x8_SN_SU0_SUM0_TT8_16_WG16_8_1_WGM1
    SolutionIndex: 1
    SolutionNameMin: Cijk_Ailk_Bjlk_HB_MT256x128x8_SN_SU0_SUM0_TT16_16_WG16_8_1_WGM1
    SolutionIndex: 2
    SolutionNameMin: Cijk_Ailk_Bjlk_HB_MT128x64x16_SN_SU0_SUM0_TT8_8_WG16_8_1_WGM1
    SolutionIndex: 3
    SolutionNameMin: Cijk_Ailk_Bjlk_HB_MT128x128x16_SN_SU0_SUM0_TT8_16_WG16_8_1_WGM1
    SolutionIndex: 4
    SolutionNameMin: Cijk_Ailk_Bjlk_HB_MT128x128x16_SN_SU0_SUM0_TT8_8_WG16_16_1_WGM1
    SolutionIndex: 5
    SolutionNameMin: Cijk_Ailk_Bjlk_HB_MT128x256x16_SN_SU0_SUM0_TT8_16_WG16_16_1_WGM1
    SolutionIndex: 6
    SolutionNameMin: Cijk_Ailk_Bjlk_HB_MT128x64x32_SN_SU0_SUM0_TT8_8_WG16_8_1_WGM1
    SolutionIndex: 7
    SolutionNameMin: Cijk_Ailk_Bjlk_HB_MT128x128x8_SN_SU32_SUM3_TT8_16_WG16_8_1_WGM1
    SolutionIndex: 8
    SolutionNameMin: Cijk_Ailk_Bjlk_HB_MT128x64x16_SN_SU32_SUM3_TT8_8_WG16_8_1_WGM1
    SolutionIndex: 9
    SolutionNameMin: Cijk_Ailk_Bjlk_HB_MT128x128x16_SN_SU32_SUM3_TT8_16_WG16_8_1_WGM1
    SolutionIndex: 10
    SolutionNameMin: Cijk_Ailk_Bjlk_HB_MT128x128x16_SN_SU32_SUM3_TT8_8_WG16_16_1_WGM1
    SolutionIndex: 11
    SolutionNameMin: Cijk_Ailk_Bjlk_HB_MT128x256x16_SN_SU32_SUM3_TT8_16_WG16_16_1_WGM1
    SolutionIndex: 12
    SolutionNameMin: Cijk_Ailk_Bjlk_HB_MT128x128x8_SN_SU0_SUM0_TT8_16_WG16_8_1_WGM4
    SolutionIndex: 13
    SolutionNameMin: Cijk_Ailk_Bjlk_HB_MT256x128x8_SN_SU0_SUM0_TT16_16_WG16_8_1_WGM4
    SolutionIndex: 14
    SolutionNameMin: Cijk_Ailk_Bjlk_HB_MT128x64x16_SN_SU0_SUM0_TT8_8_WG16_8_1_WGM4
    SolutionIndex: 15
    SolutionNameMin: Cijk_Ailk_Bjlk_HB_MT128x128x16_SN_SU0_SUM0_TT8_16_WG16_8_1_WGM4
    SolutionIndex: 16
    SolutionNameMin: Cijk_Ailk_Bjlk_HB_MT128x128x16_SN_SU0_SUM0_TT8_8_WG16_16_1_WGM4
    SolutionIndex: 17
    SolutionNameMin: Cijk_Ailk_Bjlk_HB_MT128x256x16_SN_SU0_SUM0_TT8_16_WG16_16_1_WGM4
    SolutionIndex: 18
    SolutionNameMin: Cijk_Ailk_Bjlk_HB_MT128x128x32_SN_SU0_SUM0_TT8_8_WG16_16_1_WGM4
    SolutionIndex: 19
    SolutionNameMin: Cijk_Ailk_Bjlk_HB_MT128x128x8_SN_SU32_SUM3_TT8_16_WG16_8_1_WGM4
    SolutionIndex: 20
    SolutionNameMin: Cijk_Ailk_Bjlk_HB_MT128x64x16_SN_SU32_SUM3_TT8_8_WG16_8_1_WGM4
    SolutionIndex: 21
    SolutionNameMin: Cijk_Ailk_Bjlk_HB_MT128x128x16_SN_SU32_SUM3_TT8_16_WG16_8_1_WGM4
    SolutionIndex: 22
    SolutionNameMin: Cijk_Ailk_Bjlk_HB_MT128x128x16_SN_SU32_SUM3_TT8_8_WG16_16_1_WGM4
    SolutionIndex: 23
    SolutionNameMin: Cijk_Ailk_Bjlk_HB_MT128x128x8_SN_SU0_SUM0_TT8_16_WG16_8_1_WGM8
    SolutionIndex: 24
    SolutionNameMin: Cijk_Ailk_Bjlk_HB_MT256x128x8_SN_SU0_SUM0_TT16_16_WG16_8_1_WGM8
    SolutionIndex: 25
    SolutionNameMin: Cijk_Ailk_Bjlk_HB_MT128x64x16_SN_SU0_SUM0_TT8_8_WG16_8_1_WGM8
    SolutionIndex: 26
    SolutionNameMin: Cijk_Ailk_Bjlk_HB_MT128x128x16_SN_SU0_SUM0_TT8_16_WG16_8_1_WGM8
    SolutionIndex: 27
    SolutionNameMin: Cijk_Ailk_Bjlk_HB_MT128x128x16_SN_SU0_SUM0_TT8_8_WG16_16_1_WGM8
    SolutionIndex: 28
    SolutionNameMin: Cijk_Ailk_Bjlk_HB_MT128x256x16_SN_SU0_SUM0_TT8_16_WG16_16_1_WGM8
    SolutionIndex: 29
    SolutionNameMin: Cijk_Ailk_Bjlk_HB_MT128x128x32_SN_SU0_SUM0_TT8_8_WG16_16_1_WGM8
    SolutionIndex: 30
    SolutionNameMin: Cijk_Ailk_Bjlk_HB_MT128x128x8_SN_SU32_SUM3_TT8_16_WG16_8_1_WGM8
    SolutionIndex: 31
    SolutionNameMin: Cijk_Ailk_Bjlk_HB_MT128x64x16_SN_SU32_SUM3_TT8_8_WG16_8_1_WGM8
    SolutionIndex: 32
    SolutionNameMin: Cijk_Ailk_Bjlk_HB_MT128x128x16_SN_SU32_SUM3_TT8_16_WG16_8_1_WGM8
    SolutionIndex: 33
    SolutionNameMin: Cijk_Ailk_Bjlk_HB_MT128x128x16_SN_SU32_SUM3_TT8_8_WG16_16_1_WGM8
    SolutionIndex: 34
    SolutionNameMin: Cijk_Ailk_Bjlk_HB_MT128x256x16_SN_SU32_SUM3_TT8_16_WG16_16_1_WGM8
    SolutionIndex: 35
    SolutionNameMin: Cijk_Ailk_Bjlk_HB_MT64x64x8_SN_SU0_SUM0_TT8_8_WG8_8_1_WGM1
    SolutionIndex: 36
    SolutionNameMin: Cijk_Ailk_Bjlk_HB_MT64x64x16_SN_SU0_SUM0_TT8_8_WG8_8_1_WGM1
    SolutionIndex: 37
    SolutionNameMin: Cijk_Ailk_Bjlk_HB_MT128x64x16_SN_SU0_SUM0_TT8_8_WG16_8_1_WGM1
    SolutionIndex: 38
    SolutionNameMin: Cijk_Ailk_Bjlk_HB_MT128x128x16_SN_SU0_SUM0_TT8_8_WG16_16_1_WGM1
    SolutionIndex: 39
    SolutionNameMin: Cijk_Ailk_Bjlk_HB_MT64x64x32_SN_SU0_SUM0_TT8_8_WG8_8_1_WGM1
    SolutionIndex: 40
    SolutionNameMin: Cijk_Ailk_Bjlk_HB_MT64x64x8_SN_SU32_SUM3_TT8_8_WG8_8_1_WGM1
    SolutionIndex: 41
    SolutionNameMin: Cijk_Ailk_Bjlk_HB_MT64x64x16_SN_SU32_SUM3_TT8_8_WG8_8_1_WGM1
    SolutionIndex: 42
    SolutionNameMin: Cijk_Ailk_Bjlk_HB_MT128x64x16_SN_SU32_SUM3_TT8_8_WG16_8_1_WGM1
    SolutionIndex: 43
    SolutionNameMin: Cijk_Ailk_Bjlk_HB_MT128x128x16_SN_SU32_SUM3_TT8_8_WG16_16_1_WGM1
    SolutionIndex: 44
    SolutionNameMin: Cijk_Ailk_Bjlk_HB_MT64x64x8_SN_SU0_SUM0_TT8_8_WG8_8_1_WGM4
    SolutionIndex: 45
    SolutionNameMin: Cijk_Ailk_Bjlk_HB_MT64x64x16_SN_SU0_SUM0_TT8_8_WG8_8_1_WGM4
    SolutionIndex: 46
    SolutionNameMin: Cijk_Ailk_Bjlk_HB_MT128x64x16_SN_SU0_SUM0_TT8_8_WG16_8_1_WGM4
    SolutionIndex: 47
    SolutionNameMin: Cijk_Ailk_Bjlk_HB_MT128x128x16_SN_SU0_SUM0_TT8_8_WG16_16_1_WGM4
    SolutionIndex: 48
    SolutionNameMin: Cijk_Ailk_Bjlk_HB_MT64x64x8_SN_SU32_SUM3_TT8_8_WG8_8_1_WGM4
    SolutionIndex: 49
    SolutionNameMin: Cijk_Ailk_Bjlk_HB_MT64x64x16_SN_SU32_SUM3_TT8_8_WG8_8_1_WGM4
    SolutionIndex: 50
    SolutionNameMin: Cijk_Ailk_Bjlk_HB_MT128x64x16_SN_SU32_SUM3_TT8_8_WG16_8_1_WGM4
    SolutionIndex: 51
    SolutionNameMin: Cijk_Ailk_Bjlk_HB_MT128x128x16_SN_SU32_SUM3_TT8_8_WG16_16_1_WGM4
    SolutionIndex: 52
    SolutionNameMin: Cijk_Ailk_Bjlk_HB_MT64x64x8_SN_SU0_SUM0_TT8_8_WG8_8_1_WGM8
    SolutionIndex: 53
    SolutionNameMin: Cijk_Ailk_Bjlk_HB_MT64x64x16_SN_SU0_SUM0_TT8_8_WG8_8_1_WGM8
    SolutionIndex: 54
    SolutionNameMin: Cijk_Ailk_Bjlk_HB_MT128x64x16_SN_SU0_SUM0_TT8_8_WG16_8_1_WGM8
    SolutionIndex: 55
    SolutionNameMin: Cijk_Ailk_Bjlk_HB_MT64x64x32_SN_SU0_SUM0_TT8_8_WG8_8_1_WGM8
    SolutionIndex: 56
    SolutionNameMin: Cijk_Ailk_Bjlk_HB_MT64x64x8_SN_SU32_SUM3_TT8_8_WG8_8_1_WGM8
    SolutionIndex: 57
    SolutionNameMin: Cijk_Ailk_Bjlk_HB_MT64x64x16_SN_SU32_SUM3_TT8_8_WG8_8_1_WGM8
    SolutionIndex: 58
    SolutionNameMin: Cijk_Ailk_Bjlk_HB_MT128x64x16_SN_SU32_SUM3_TT8_8_WG16_8_1_WGM8
    SolutionIndex: 59
    SolutionNameMin: Cijk_Ailk_Bjlk_HB_MT128x128x16_SN_SU32_SUM3_TT8_8_WG16_16_1_WGM8
    SolutionIndex: 60
    SolutionNameMin: Cijk_Ailk_Bjlk_HB_MT64x32x8_SN_SU0_SUM0_TT4_4_WG16_8_1_WGM1
    SolutionIndex: 61
    SolutionNameMin: Cijk_Ailk_Bjlk_HB_MT32x16x16_SN_SU0_SUM0_TT2_2_WG16_8_1_WGM1
    SolutionIndex: 62
    SolutionNameMin: Cijk_Ailk_Bjlk_HB_MT64x32x16_SN_SU0_SUM0_TT4_4_WG16_8_1_WGM1
    SolutionIndex: 63
    SolutionNameMin: Cijk_Ailk_Bjlk_HB_MT32x32x16_SN_SU0_SUM0_TT2_2_WG16_16_1_WGM1
    SolutionIndex: 64
    SolutionNameMin: Cijk_Ailk_Bjlk_HB_MT64x64x16_SN_SU0_SUM0_TT4_4_WG16_16_1_WGM1
    SolutionIndex: 65
    SolutionNameMin: Cijk_Ailk_Bjlk_HB_MT16x16x32_SN_SU0_SUM0_TT2_2_WG8_8_1_WGM1
    SolutionIndex: 66
    SolutionNameMin: Cijk_Ailk_Bjlk_HB_MT32x16x32_SN_SU0_SUM0_TT2_2_WG16_8_1_WGM1
    SolutionIndex: 67
    SolutionNameMin: Cijk_Ailk_Bjlk_HB_MT64x32x32_SN_SU0_SUM0_TT4_4_WG16_8_1_WGM1
    SolutionIndex: 68
    SolutionNameMin: Cijk_Ailk_Bjlk_HB_MT32x32x32_SN_SU0_SUM0_TT2_2_WG16_16_1_WGM1
    SolutionIndex: 69
    SolutionNameMin: Cijk_Ailk_Bjlk_HB_MT64x64x32_SN_SU0_SUM0_TT4_4_WG16_16_1_WGM1
    SolutionIndex: 70
    SolutionNameMin: Cijk_Ailk_Bjlk_HB_MT64x32x8_SN_SU32_SUM3_TT4_4_WG16_8_1_WGM1
    SolutionIndex: 71
    SolutionNameMin: Cijk_Ailk_Bjlk_HB_MT64x64x8_SN_SU32_SUM3_TT4_4_WG16_16_1_WGM1
    SolutionIndex: 72
    SolutionNameMin: Cijk_Ailk_Bjlk_HB_MT32x16x16_SN_SU32_SUM3_TT2_2_WG16_8_1_WGM1
    SolutionIndex: 73
    SolutionNameMin: Cijk_Ailk_Bjlk_HB_MT64x32x16_SN_SU32_SUM3_TT4_4_WG16_8_1_WGM1
    SolutionIndex: 74
    SolutionNameMin: Cijk_Ailk_Bjlk_HB_MT32x32x16_SN_SU32_SUM3_TT2_2_WG16_16_1_WGM1
    SolutionIndex: 75
    SolutionNameMin: Cijk_Ailk_Bjlk_HB_MT64x64x16_SN_SU32_SUM3_TT4_4_WG16_16_1_WGM1
    SolutionIndex: 76
    SolutionNameMin: Cijk_Ailk_Bjlk_HB_MT32x32x32_SN_SU32_SUM3_TT4_4_WG8_8_1_WGM1
    SolutionIndex: 77
    SolutionNameMin: Cijk_Ailk_Bjlk_HB_MT64x32x32_SN_SU32_SUM3_TT4_4_WG16_8_1_WGM1
    SolutionIndex: 78
    SolutionNameMin: Cijk_Ailk_Bjlk_HB_MT64x32x8_SN_SU0_SUM0_TT4_4_WG16_8_1_WGM4
    SolutionIndex: 79
    SolutionNameMin: Cijk_Ailk_Bjlk_HB_MT32x16x16_SN_SU0_SUM0_TT2_2_WG16_8_1_WGM4
    SolutionIndex: 80
    SolutionNameMin: Cijk_Ailk_Bjlk_HB_MT64x32x16_SN_SU0_SUM0_TT4_4_WG16_8_1_WGM4
    SolutionIndex: 81
    SolutionNameMin: Cijk_Ailk_Bjlk_HB_MT64x64x16_SN_SU0_SUM0_TT4_4_WG16_16_1_WGM4
    SolutionIndex: 82
    SolutionNameMin: Cijk_Ailk_Bjlk_HB_MT32x16x32_SN_SU0_SUM0_TT2_2_WG16_8_1_WGM4
    SolutionIndex: 83
    SolutionNameMin: Cijk_Ailk_Bjlk_HB_MT64x32x32_SN_SU0_SUM0_TT4_4_WG16_8_1_WGM4
    SolutionIndex: 84
    SolutionNameMin: Cijk_Ailk_Bjlk_HB_MT32x32x32_SN_SU0_SUM0_TT2_2_WG16_16_1_WGM4
    SolutionIndex: 85
    SolutionNameMin: Cijk_Ailk_Bjlk_HB_MT64x64x32_SN_SU0_SUM0_TT4_4_WG16_16_1_WGM4
    SolutionIndex: 86
    SolutionNameMin: Cijk_Ailk_Bjlk_HB_MT64x32x8_SN_SU32_SUM3_TT4_4_WG16_8_1_WGM4
    SolutionIndex: 87
    SolutionNameMin: Cijk_Ailk_Bjlk_HB_MT32x32x8_SN_SU32_SUM3_TT2_2_WG16_16_1_WGM4
    SolutionIndex: 88
    SolutionNameMin: Cijk_Ailk_Bjlk_HB_MT64x32x16_SN_SU32_SUM3_TT4_4_WG16_8_1_WGM4
    SolutionIndex: 89
    SolutionNameMin: Cijk_Ailk_Bjlk_HB_MT32x32x16_SN_SU32_SUM3_TT2_2_WG16_16_1_WGM4
    SolutionIndex: 90
    SolutionNameMin: Cijk_Ailk_Bjlk_HB_MT64x64x16_SN_SU32_SUM3_TT4_4_WG16_16_1_WGM4
    SolutionIndex: 91
    SolutionNameMin: Cijk_Ailk_Bjlk_HB_MT16x16x32_SN_SU32_SUM3_TT2_2_WG8_8_1_WGM4
    SolutionIndex: 92
    SolutionNameMin: Cijk_Ailk_Bjlk_HB_MT32x32x32_SN_SU32_SUM3_TT4_4_WG8_8_1_WGM4
    SolutionIndex: 93
    SolutionNameMin: Cijk_Ailk_Bjlk_HB_MT32x32x32_SN_SU32_SUM3_TT2_2_WG16_16_1_WGM4
    SolutionIndex: 94
    SolutionNameMin: Cijk_Ailk_Bjlk_HB_MT64x64x32_SN_SU32_SUM3_TT4_4_WG16_16_1_WGM4
    SolutionIndex: 95
    SolutionNameMin: Cijk_Ailk_Bjlk_HB_MT32x32x8_SN_SU0_SUM0_TT4_4_WG8_8_1_WGM8
    SolutionIndex: 96
    SolutionNameMin: Cijk_Ailk_Bjlk_HB_MT64x32x8_SN_SU0_SUM0_TT4_4_WG16_8_1_WGM8
    SolutionIndex: 97
    SolutionNameMin: Cijk_Ailk_Bjlk_HB_MT64x64x8_SN_SU0_SUM0_TT4_4_WG16_16_1_WGM8
    SolutionIndex: 98
    SolutionNameMin: Cijk_Ailk_Bjlk_HB_MT32x32x16_SN_SU0_SUM0_TT4_4_WG8_8_1_WGM8
    SolutionIndex: 99
    SolutionNameMin: Cijk_Ailk_Bjlk_HB_MT32x16x16_SN_SU0_SUM0_TT2_2_WG16_8_1_WGM8
    SolutionIndex: 100
    SolutionNameMin: Cijk_Ailk_Bjlk_HB_MT64x32x16_SN_SU0_SUM0_TT4_4_WG16_8_1_WGM8
    SolutionIndex: 101
    SolutionNameMin: Cijk_Ailk_Bjlk_HB_MT32x32x16_SN_SU0_SUM0_TT2_2_WG16_16_1_WGM8
    SolutionIndex: 102
    SolutionNameMin: Cijk_Ailk_Bjlk_HB_MT64x64x16_SN_SU0_SUM0_TT4_4_WG16_16_1_WGM8
    SolutionIndex: 103
    SolutionNameMin: Cijk_Ailk_Bjlk_HB_MT32x32x32_SN_SU0_SUM0_TT4_4_WG8_8_1_WGM8
    SolutionIndex: 104
    SolutionNameMin: Cijk_Ailk_Bjlk_HB_MT32x16x32_SN_SU0_SUM0_TT2_2_WG16_8_1_WGM8
    SolutionIndex: 105
    SolutionNameMin: Cijk_Ailk_Bjlk_HB_MT64x32x32_SN_SU0_SUM0_TT4_4_WG16_8_1_WGM8
    SolutionIndex: 106
    SolutionNameMin: Cijk_Ailk_Bjlk_HB_MT32x32x32_SN_SU0_SUM0_TT2_2_WG16_16_1_WGM8
    SolutionIndex: 107
    SolutionNameMin: Cijk_Ailk_Bjlk_HB_MT64x32x8_SN_SU32_SUM3_TT4_4_WG16_8_1_WGM8
    SolutionIndex: 108
    SolutionNameMin: Cijk_Ailk_Bjlk_HB_MT64x64x8_SN_SU32_SUM3_TT4_4_WG16_16_1_WGM8
    SolutionIndex: 109
    SolutionNameMin: Cijk_Ailk_Bjlk_HB_MT32x32x16_SN_SU32_SUM3_TT4_4_WG8_8_1_WGM8
    SolutionIndex: 110
    SolutionNameMin: Cijk_Ailk_Bjlk_HB_MT32x16x16_SN_SU32_SUM3_TT2_2_WG16_8_1_WGM8
    SolutionIndex: 111
    SolutionNameMin: Cijk_Ailk_Bjlk_HB_MT64x32x16_SN_SU32_SUM3_TT4_4_WG16_8_1_WGM8
    SolutionIndex: 112
    SolutionNameMin: Cijk_Ailk_Bjlk_HB_MT32x32x16_SN_SU32_SUM3_TT2_2_WG16_16_1_WGM8
    SolutionIndex: 113
    SolutionNameMin: Cijk_Ailk_Bjlk_HB_MT32x32x32_SN_SU32_SUM3_TT4_4_WG8_8_1_WGM8
    SolutionIndex: 114
    SolutionNameMin: Cijk_Ailk_Bjlk_HB_MT32x16x32_SN_SU32_SUM3_TT2_2_WG16_8_1_WGM8
- - - [2944, 4288, 1, 1280, 2944, 2944, 2944, 4288]
    - [26, 24299.0]
  - - [2368, 5888, 1, 256, 2368, 2368, 2368, 5888]
    - [0, 23774.0]
  - - [1024, 5056, 1, 3328, 1024, 1024, 1024, 5056]
    - [28, 24697.0]
  - - [5888, 1024, 1, 1280, 5888, 5888, 5888, 1024]
    - [3, 24201.0]
  - - [5888, 1856, 1, 3328, 5888, 5888, 5888, 1856]
    - [15, 24234.0]
  - - [5056, 704, 1, 256, 5056, 5056, 5056, 704]
    - [8, 21290.0]
  - - [5888, 2944, 1, 3328, 5888, 5888, 5888, 2944]
    - [15, 25538.0]
  - - [1856, 4288, 1, 256, 1856, 1856, 1856, 4288]
    - [2, 22301.0]
  - - [5056, 5056, 1, 3328, 5056, 5056, 5056, 5056]
    - [13, 25026.0]
  - - [1408, 5888, 1, 1280, 1408, 1408, 1408, 5888]
    - [17, 24455.0]
  - - [448, 3584, 1, 3328, 448, 448, 448, 3584]
    - [11, 19751.0]
  - - [5888, 1408, 1, 1280, 5888, 5888, 5888, 1408]
    - [26, 24521.0]
  - - [3584, 1856, 1, 3328, 3584, 3584, 3584, 1856]
    - [15, 24321.0]
  - - [5056, 6784, 1, 1280, 5056, 5056, 5056, 6784]
    - [15, 25266.0]
  - - [5056, 5056, 1, 1280, 5056, 5056, 5056, 5056]
    - [17, 24882.0]
  - - [448, 5056, 1, 256, 448, 448, 448, 5056]
    - [19, 18269.0]
  - - [6784, 448, 1, 256, 6784, 6784, 6784, 448]
    - [25, 21757.0]
  - - [5888, 704, 1, 1280, 5888, 5888, 5888, 704]
    - [25, 23039.0]
  - - [3584, 1024, 1, 256, 3584, 3584, 3584, 1024]
    - [25, 22003.0]
  - - [6784, 4288, 1, 3328, 6784, 6784, 6784, 4288]
    - [15, 25054.0]
  - - [1856, 2368, 1, 3328, 1856, 1856, 1856, 2368]
    - [2, 22668.0]
  - - [5888, 2944, 1, 1280, 5888, 5888, 5888, 2944]
    - [3, 25471.0]
  - - [5888, 1024, 1, 256, 5888, 5888, 5888, 1024]
    - [0, 23155.0]
  - - [1408, 2944, 1, 256, 1408, 1408, 1408, 2944]
    - [12, 22782.0]
  - - [6784, 5056, 1, 3328, 6784, 6784, 6784, 5056]
    - [17, 25383.0]
  - - [5056, 5056, 1, 256, 5056, 5056, 5056, 5056]
    - [12, 24021.0]
  - - [1024, 3584, 1, 1280, 1024, 1024, 1024, 3584]
    - [17, 23100.0]
  - - [2368, 2944, 1, 1280, 2368, 2368, 2368, 2944]
    - [9, 24080.0]
  - - [1408, 4288, 1, 1280, 1408, 1408, 1408, 4288]
    - [15, 24045.0]
  - - [3584, 4288, 1, 1280, 3584, 3584, 3584, 4288]
    - [32, 24813.0]
  - - [2368, 704, 1, 1280, 2368, 2368, 2368, 704]
    - [2, 21027.0]
  - - [5056, 4288, 1, 3328, 5056, 5056, 5056, 4288]
    - [24, 24936.0]
  - - [3584, 2368, 1, 3328, 3584, 3584, 3584, 2368]
    - [26, 24259.0]
  - - [6784, 448, 1, 1280, 6784, 6784, 6784, 448]
    - [2, 22803.0]
  - - [4288, 2944, 1, 256, 4288, 4288, 4288, 2944]
    - [0, 23186.0]
  - - [5056, 2368, 1, 1280, 5056, 5056, 5056, 2368]
    - [15, 24297.0]
  - - [448, 3584, 1, 1280, 448, 448, 448, 3584]
    - [16, 19371.0]
  - - [6784, 5888, 1, 256, 6784, 6784, 6784, 5888]
    - [32, 25185.0]
  - - [1024, 1408, 1, 256, 1024, 1024, 1024, 1408]
    - [20, 20348.0]
  - - [2368, 2368, 1, 3328, 2368, 2368, 2368, 2368]
    - [2, 22820.0]
  - - [5056, 704, 1, 3328, 5056, 5056, 5056, 704]
    - [2, 23408.0]
  - - [1408, 1856, 1, 256, 1408, 1408, 1408, 1856]
    - [2, 20162.0]
  - - [5888, 1856, 1, 256, 5888, 5888, 5888, 1856]
    - [14, 23498.0]
  - - [704, 5888, 1, 256, 704, 704, 704, 5888]
    - [12, 20783.0]
  - - [4288, 6784, 1, 3328, 4288, 4288, 4288, 6784]
    - [26, 25054.0]
  - - [3584, 704, 1, 3328, 3584, 3584, 3584, 704]
    - [2, 22576.0]
  - - [1408, 1408, 1, 256, 1408, 1408, 1408, 1408]
    - [2, 18401.0]
  - - [448, 4288, 1, 256, 448, 448, 448, 4288]
    - [27, 16199.0]
  - - [704, 2368, 1, 1280, 704, 704, 704, 2368]
    - [16, 19602.0]
  - - [1856, 2368, 1, 1280, 1856, 1856, 1856, 2368]
    - [25, 22236.0]
  - - [1408, 1024, 1, 1280, 1408, 1408, 1408, 1024]
    - [2, 21489.0]
  - - [6784, 704, 1, 256, 6784, 6784, 6784, 704]
    - [25, 21301.0]
  - - [1408, 3584, 1, 256, 1408, 1408, 1408, 3584]
    - [7, 21844.0]
  - - [3584, 4288, 1, 3328, 3584, 3584, 3584, 4288]
    - [15, 24967.0]
  - - [5888, 1856, 1, 1280, 5888, 5888, 5888, 1856]
    - [12, 24037.0]
  - - [5056, 1024, 1, 3328, 5056, 5056, 5056, 1024]
    - [5, 24811.0]
  - - [2368, 3584, 1, 1280, 2368, 2368, 2368, 3584]
    - [23, 24137.0]
  - - [2944, 3584, 1, 3328, 2944, 2944, 2944, 3584]
    - [26, 24892.0]
  - - [6784, 2944, 1, 256, 6784, 6784, 6784, 2944]
    - [30, 24827.0]
  - - [1024, 2368, 1, 256, 1024, 1024, 1024, 2368]
    - [2, 21539.0]
  - - [4288, 2368, 1, 3328, 4288, 4288, 4288, 2368]
    - [3, 23875.0]
  - - [1856, 2368, 1, 256, 1856, 1856, 1856, 2368]
    - [25, 21382.0]
  - - [3584, 6784, 1, 3328, 3584, 3584, 3584, 6784]
    - [15, 25396.0]
  - - [6784, 1856, 1, 3328, 6784, 6784, 6784, 1856]
    - [26, 24470.0]
  - - [5056, 4288, 1, 1280, 5056, 5056, 5056, 4288]
    - [26, 24776.0]
  - - [1408, 5056, 1, 1280, 1408, 1408, 1408, 5056]
    - [26, 24562.0]
  - - [6784, 5888, 1, 3328, 6784, 6784, 6784, 5888]
    - [5, 25724.0]
  - - [2368, 5056, 1, 1280, 2368, 2368, 2368, 5056]
    - [23, 24245.0]
  - - [1024, 5056, 1, 1280, 1024, 1024, 1024, 5056]
    - [15, 24253.0]
  - - [4288, 1024, 1, 256, 4288, 4288, 4288, 1024]
    - [4, 22024.0]
  - - [2368, 1408, 1, 256, 2368, 2368, 2368, 1408]
    - [27, 21180.0]
  - - [5888, 448, 1, 1280, 5888, 5888, 5888, 448]
    - [14, 22269.0]
  - - [704, 5888, 1, 3328, 704, 704, 704, 5888]
    - [5, 22674.0]
  - - [1024, 6784, 1, 1280, 1024, 1024, 1024, 6784]
    - [15, 24192.0]
  - - [6784, 2368, 1, 1280, 6784, 6784, 6784, 2368]
    - [23, 24450.0]
  - - [3584, 2944, 1, 1280, 3584, 3584, 3584, 2944]
    - [3, 24776.0]
  - - [2368, 1024, 1, 3328, 2368, 2368, 2368, 1024]
    - [5, 22732.0]
  - - [1408, 5056, 1, 3328, 1408, 1408, 1408, 5056]
    - [28, 24952.0]
  - - [1856, 1856, 1, 3328, 1856, 1856, 1856, 1856]
    - [2, 22718.0]
  - - [2368, 2368, 1, 256, 2368, 2368, 2368, 2368]
    - [14, 21024.0]
  - - [4288, 4288, 1, 1280, 4288, 4288, 4288, 4288]
    - [9, 24619.0]
  - - [704, 6784, 1, 3328, 704, 704, 704, 6784]
    - [12, 22762.0]
  - - [5888, 5888, 1, 3328, 5888, 5888, 5888, 5888]
    - [24, 25734.0]
  - - [5056, 1024, 1, 1280, 5056, 5056, 5056, 1024]
    - [5, 24035.0]
  - - [448, 5888, 1, 3328, 448, 448, 448, 5888]
    - [2, 20103.0]
  - - [5056, 5888, 1, 1280, 5056, 5056, 5056, 5888]
    - [17, 25253.0]
  - - [448, 6784, 1, 256, 448, 448, 448, 6784]
    - [12, 18179.0]
  - - [3584, 5888, 1, 256, 3584, 3584, 3584, 5888]
    - [26, 24729.0]
  - - [2944, 3584, 1, 256, 2944, 2944, 2944, 3584]
    - [19, 23951.0]
  - - [6784, 2944, 1, 3328, 6784, 6784, 6784, 2944]
    - [26, 25590.0]
  - - [2944, 5056, 1, 3328, 2944, 2944, 2944, 5056]
    - [28, 25228.0]
  - - [2048, 7133, 1, 2048, 2048, 2048, 2048, 7133]
    - [15, 25212.0]
  - - [4288, 5888, 1, 1280, 4288, 4288, 4288, 5888]
    - [26, 24922.0]
  - - [4288, 4288, 1, 256, 4288, 4288, 4288, 4288]
    - [30, 23836.0]
  - - [4288, 1856, 1, 1280, 4288, 4288, 4288, 1856]
    - [15, 23478.0]
  - - [1856, 2944, 1, 3328, 1856, 1856, 1856, 2944]
    - [28, 23351.0]
  - - [256, 6784, 1, 3328, 256, 256, 256, 6784]
    - [2, 22345.0]
  - - [5056, 1024, 1, 256, 5056, 5056, 5056, 1024]
    - [10, 21728.0]
  - - [5056, 1856, 1, 3328, 5056, 5056, 5056, 1856]
    - [3, 24220.0]
  - - [1856, 1408, 1, 256, 1856, 1856, 1856, 1408]
    - [31, 20396.0]
  - - [5056, 256, 1, 3328, 5056, 5056, 5056, 256]
    - [4, 23345.0]
  - - [5056, 3584, 1, 256, 5056, 5056, 5056, 3584]
    - [12, 24441.0]
  - - [1856, 1024, 1, 1280, 1856, 1856, 1856, 1024]
    - [16, 22937.0]
  - - [1856, 1856, 1, 1280, 1856, 1856, 1856, 1856]
    - [14, 22040.0]
  - - [6784, 6784, 1, 1280, 6784, 6784, 6784, 6784]
    - [15, 25563.0]
  - - [1856, 1024, 1, 3328, 1856, 1856, 1856, 1024]
    - [16, 23206.0]
  - - [6784, 1024, 1, 256, 6784, 6784, 6784, 1024]
    - [21, 22661.0]
  - - [5056, 5888, 1, 3328, 5056, 5056, 5056, 5888]
    - [13, 25376.0]
  - - [1856, 1024, 1, 256, 1856, 1856, 1856, 1024]
    - [4, 19384.0]
  - - [5056, 1408, 1, 3328, 5056, 5056, 5056, 1408]
    - [15, 24893.0]
  - - [4288, 1024, 1, 3328, 4288, 4288, 4288, 1024]
    - [5, 23986.0]
  - - [2944, 1408, 1, 3328, 2944, 2944, 2944, 1408]
    - [3, 24296.0]
  - - [2944, 4288, 1, 3328, 2944, 2944, 2944, 4288]
    - [5, 24593.0]
  - - [5056, 2944, 1, 256, 5056, 5056, 5056, 2944]
    - [30, 24175.0]
  - - [2368, 1856, 1, 256, 2368, 2368, 2368, 1856]
    - [2, 21431.0]
  - - [1408, 3584, 1, 3328, 1408, 1408, 1408, 3584]
    - [5, 24396.0]
  - - [2368, 6784, 1, 256, 2368, 2368, 2368, 6784]
    - [23, 23758.0]
  - - [5056, 1408, 1, 1280, 5056, 5056, 5056, 1408]
    - [7, 24584.0]
  - - [1408, 5888, 1, 3328, 1408, 1408, 1408, 5888]
    - [28, 24814.0]
  - - [1856, 5056, 1, 256, 1856, 1856, 1856, 5056]
    - [30, 22918.0]
  - - [6784, 6784, 1, 256, 6784, 6784, 6784, 6784]
    - [23, 25210.0]
  - - [2368, 4288, 1, 1280, 2368, 2368, 2368, 4288]
    - [0, 23644.0]
  - - [3584, 1856, 1, 1280, 3584, 3584, 3584, 1856]
    - [12, 24007.0]
  - - [5888, 5056, 1, 256, 5888, 5888, 5888, 5056]
    - [0, 24562.0]
  - - [3584, 448, 1, 256, 3584, 3584, 3584, 448]
    - [25, 18942.0]
  - - [3072, 7435, 1, 1024, 3072, 3072, 3072, 7435]
    - [21, 24971.0]
  - - [256, 6784, 1, 256, 256, 256, 256, 6784]
    - [14, 20338.0]
  - - [1856, 3584, 1, 3328, 1856, 1856, 1856, 3584]
    - [21, 24329.0]
  - - [5056, 256, 1, 1280, 5056, 5056, 5056, 256]
    - [4, 22720.0]
  - - [3584, 3584, 1, 256, 3584, 3584, 3584, 3584]
    - [23, 24168.0]
  - - [6784, 4288, 1, 1280, 6784, 6784, 6784, 4288]
    - [26, 24958.0]
  - - [704, 5056, 1, 256, 704, 704, 704, 5056]
    - [2, 19749.0]
  - - [2944, 2368, 1, 1280, 2944, 2944, 2944, 2368]
    - [12, 24111.0]
  - - [6784, 3584, 1, 256, 6784, 6784, 6784, 3584]
    - [30, 24806.0]
  - - [704, 6784, 1, 256, 704, 704, 704, 6784]
    - [18, 20425.0]
  - - [1024, 3584, 1, 3328, 1024, 1024, 1024, 3584]
    - [5, 23499.0]
  - - [2944, 2944, 1, 3328, 2944, 2944, 2944, 2944]
    - [3, 24916.0]
  - - [5056, 6784, 1, 256, 5056, 5056, 5056, 6784]
    - [0, 24544.0]
  - - [1408, 4288, 1, 3328, 1408, 1408, 1408, 4288]
    - [19, 24318.0]
  - - [6784, 256, 1, 1280, 6784, 6784, 6784, 256]
    - [14, 22075.0]
  - - [2368, 704, 1, 3328, 2368, 2368, 2368, 704]
    - [2, 21166.0]
  - - [3584, 6784, 1, 256, 3584, 3584, 3584, 6784]
    - [21, 24767.0]
  - - [5056, 1856, 1, 256, 5056, 5056, 5056, 1856]
    - [8, 23126.0]
  - - [704, 4288, 1, 256, 704, 704, 704, 4288]
    - [2, 19605.0]
  - - [1408, 6784, 1, 1280, 1408, 1408, 1408, 6784]
    - [26, 24571.0]
  - - [3584, 3584, 1, 1280, 3584, 3584, 3584, 3584]
    - [28, 24976.0]
  - - [5056, 2368, 1, 3328, 5056, 5056, 5056, 2368]
    - [26, 24489.0]
  - - [2944, 4288, 1, 256, 2944, 2944, 2944, 4288]
    - [14, 23572.0]
  - - [1408, 3584, 1, 1280, 1408, 1408, 1408, 3584]
    - [28, 24109.0]
  - - [1024, 1408, 1, 1280, 1024, 1024, 1024, 1408]
    - [2, 21524.0]
  - - [2368, 6784, 1, 3328, 2368, 2368, 2368, 6784]
    - [3, 24586.0]
  - - [5056, 704, 1, 1280, 5056, 5056, 5056, 704]
    - [2, 23179.0]
  - - [1856, 4288, 1, 3328, 1856, 1856, 1856, 4288]
    - [17, 23753.0]
  - - [1408, 5888, 1, 256, 1408, 1408, 1408, 5888]
    - [12, 23729.0]
  - - [4096, 7133, 1, 4096, 4096, 4096, 4096, 7133]
    - [13, 25469.0]
  - - [3584, 704, 1, 1280, 3584, 3584, 3584, 704]
    - [2, 22292.0]
  - - [3584, 448, 1, 3328, 3584, 3584, 3584, 448]
    - [25, 22053.0]
  - - [704, 2368, 1, 3328, 704, 704, 704, 2368]
    - [4, 20444.0]
  - - [448, 5056, 1, 3328, 448, 448, 448, 5056]
    - [5, 21126.0]
  - - [4288, 448, 1, 256, 4288, 4288, 4288, 448]
    - [14, 17728.0]
  - - [448, 5888, 1, 256, 448, 448, 448, 5888]
    - [14, 17359.0]
  - - [5888, 2368, 1, 256, 5888, 5888, 5888, 2368]
    - [31, 23641.0]
  - - [6784, 704, 1, 3328, 6784, 6784, 6784, 704]
    - [14, 23424.0]
  - - [1408, 2944, 1, 3328, 1408, 1408, 1408, 2944]
    - [3, 24299.0]
  - - [2368, 704, 1, 256, 2368, 2368, 2368, 704]
    - [27, 15972.0]
  - - [3584, 2368, 1, 256, 3584, 3584, 3584, 2368]
    - [2, 22660.0]
  - - [5888, 5056, 1, 1280, 5888, 5888, 5888, 5056]
    - [13, 25259.0]
  - - [3584, 3584, 1, 3328, 3584, 3584, 3584, 3584]
    - [17, 25092.0]
  - - [5888, 6784, 1, 256, 5888, 5888, 5888, 6784]
    - [7, 25206.0]
  - - [4288, 2944, 1, 3328, 4288, 4288, 4288, 2944]
    - [15, 24559.0]
  - - [4288, 704, 1, 1280, 4288, 4288, 4288, 704]
    - [2, 22721.0]
  - - [256, 5056, 1, 1280, 256, 256, 256, 5056]
    - [16, 21400.0]
  - - [6784, 5888, 1, 1280, 6784, 6784, 6784, 5888]
    - [17, 25647.0]
  - - [5888, 4288, 1, 1280, 5888, 5888, 5888, 4288]
    - [15, 24904.0]
  - - [1408, 1856, 1, 1280, 1408, 1408, 1408, 1856]
    - [14, 23310.0]
  - - [5888, 448, 1, 3328, 5888, 5888, 5888, 448]
    - [2, 22537.0]
  - - [704, 5888, 1, 1280, 704, 704, 704, 5888]
    - [5, 22194.0]
  - - [1024, 6784, 1, 3328, 1024, 1024, 1024, 6784]
    - [26, 24414.0]
  - - [704, 2944, 1, 1280, 704, 704, 704, 2944]
    - [16, 21495.0]
  - - [5056, 2944, 1, 3328, 5056, 5056, 5056, 2944]
    - [15, 25186.0]
  - - [1408, 1408, 1, 3328, 1408, 1408, 1408, 1408]
    - [2, 21910.0]
  - - [448, 4288, 1, 1280, 448, 448, 448, 4288]
    - [16, 19359.0]
  - - [3584, 704, 1, 256, 3584, 3584, 3584, 704]
    - [2, 19657.0]
  - - [3584, 1408, 1, 3328, 3584, 3584, 3584, 1408]
    - [9, 23973.0]
  - - [2368, 1024, 1, 1280, 2368, 2368, 2368, 1024]
    - [4, 21705.0]
  - - [1856, 6784, 1, 256, 1856, 1856, 1856, 6784]
    - [7, 23497.0]
  - - [4288, 448, 1, 3328, 4288, 4288, 4288, 448]
    - [2, 22583.0]
  - - [4288, 3584, 1, 1280, 4288, 4288, 4288, 3584]
    - [28, 24867.0]
  - - [1760, 7133, 1, 1760, 1760, 1760, 1760, 7133]
    - [17, 24391.0]
  - - [5888, 1024, 1, 3328, 5888, 5888, 5888, 1024]
    - [9, 24439.0]
  - - [704, 6784, 1, 1280, 704, 704, 704, 6784]
    - [19, 22087.0]
  - - [1024, 2944, 1, 3328, 1024, 1024, 1024, 2944]
    - [25, 22910.0]
  - - [704, 5056, 1, 1280, 704, 704, 704, 5056]
    - [28, 21787.0]
  - - [1024, 5888, 1, 1280, 1024, 1024, 1024, 5888]
    - [3, 24083.0]
  - - [2944, 1856, 1, 256, 2944, 2944, 2944, 1856]
    - [25, 21781.0]
  - - [3584, 5056, 1, 256, 3584, 3584, 3584, 5056]
    - [12, 24219.0]
  - - [5888, 5056, 1, 3328, 5888, 5888, 5888, 5056]
    - [13, 25393.0]
  - - [3584, 6784, 1, 1280, 3584, 3584, 3584, 6784]
    - [3, 25297.0]
  - - [1856, 5888, 1, 256, 1856, 1856, 1856, 5888]
    - [7, 23240.0]
  - - [4288, 4288, 1, 3328, 4288, 4288, 4288, 4288]
    - [5, 24772.0]
  - - [4288, 1408, 1, 1280, 4288, 4288, 4288, 1408]
    - [0, 24040.0]
  - - [4288, 2368, 1, 256, 4288, 4288, 4288, 2368]
    - [20, 22943.0]
  - - [2944, 5056, 1, 1280, 2944, 2944, 2944, 5056]
    - [15, 25099.0]
  - - [6784, 2368, 1, 3328, 6784, 6784, 6784, 2368]
    - [3, 24584.0]
  - - [4288, 1856, 1, 3328, 4288, 4288, 4288, 1856]
    - [15, 23663.0]
  - - [1856, 2944, 1, 1280, 1856, 1856, 1856, 2944]
    - [23, 22992.0]
  - - [2944, 5888, 1, 1280, 2944, 2944, 2944, 5888]
    - [26, 25472.0]
  - - [3584, 1024, 1, 1280, 3584, 3584, 3584, 1024]
    - [28, 23111.0]
  - - [1024, 4288, 1, 256, 1024, 1024, 1024, 4288]
    - [14, 21419.0]
  - - [5888, 3584, 1, 3328, 5888, 5888, 5888, 3584]
    - [15, 25402.0]
  - - [5056, 3584, 1, 3328, 5056, 5056, 5056, 3584]
    - [28, 25290.0]
  - - [2368, 1408, 1, 1280, 2368, 2368, 2368, 1408]
    - [2, 22802.0]
  - - [5056, 2944, 1, 1280, 5056, 5056, 5056, 2944]
    - [15, 25055.0]
  - - [1024, 6784, 1, 256, 1024, 1024, 1024, 6784]
    - [7, 23314.0]
  - - [3584, 2944, 1, 256, 3584, 3584, 3584, 2944]
    - [19, 23959.0]
  - - [3584, 1408, 1, 1280, 3584, 3584, 3584, 1408]
    - [3, 23955.0]
  - - [5056, 6784, 1, 3328, 5056, 5056, 5056, 6784]
    - [13, 25398.0]
  - - [3584, 4288, 1, 256, 3584, 3584, 3584, 4288]
    - [30, 23632.0]
  - - [1856, 6784, 1, 3328, 1856, 1856, 1856, 6784]
    - [15, 24476.0]
  - - [5056, 1408, 1, 256, 5056, 5056, 5056, 1408]
    - [4, 23098.0]
  - - [5888, 5888, 1, 256, 5888, 5888, 5888, 5888]
    - [7, 25247.0]
  - - [4288, 1024, 1, 1280, 4288, 4288, 4288, 1024]
    - [5, 23717.0]
  - - [448, 6784, 1, 3328, 448, 448, 448, 6784]
    - [3, 20736.0]
  - - [2944, 1408, 1, 1280, 2944, 2944, 2944, 1408]
    - [3, 23808.0]
  - - [2944, 1856, 1, 3328, 2944, 2944, 2944, 1856]
    - [2, 23649.0]
  - - [3584, 5888, 1, 1280, 3584, 3584, 3584, 5888]
    - [15, 25338.0]
  - - [6784, 1856, 1, 1280, 6784, 6784, 6784, 1856]
    - [15, 24355.0]
  - - [5888, 256, 1, 3328, 5888, 5888, 5888, 256]
    - [4, 22171.0]
  - - [1856, 5888, 1, 3328, 1856, 1856, 1856, 5888]
    - [15, 24279.0]
  - - [3584, 1408, 1, 256, 3584, 3584, 3584, 1408]
    - [25, 22897.0]
  - - [704, 3584, 1, 3328, 704, 704, 704, 3584]
    - [2, 21359.0]
  - - [5056, 448, 1, 1280, 5056, 5056, 5056, 448]
    - [25, 21935.0]
  - - [4288, 704, 1, 256, 4288, 4288, 4288, 704]
    - [25, 19866.0]
  - - [2944, 1024, 1, 256, 2944, 2944, 2944, 1024]
    - [2, 20224.0]
  - - [2368, 4288, 1, 3328, 2368, 2368, 2368, 4288]
    - [15, 23938.0]
  - - [6784, 5056, 1, 256, 6784, 6784, 6784, 5056]
    - [0, 24668.0]
  - - [3584, 5056, 1, 3328, 3584, 3584, 3584, 5056]
    - [13, 25259.0]
  - - [4288, 5888, 1, 256, 4288, 4288, 4288, 5888]
    - [19, 24284.0]
  - - [2944, 6784, 1, 256, 2944, 2944, 2944, 6784]
    - [0, 24904.0]
  - - [2368, 2368, 1, 1280, 2368, 2368, 2368, 2368]
    - [2, 22768.0]
  - - [1856, 3584, 1, 1280, 1856, 1856, 1856, 3584]
    - [23, 24149.0]
  - - [5056, 3584, 1, 1280, 5056, 5056, 5056, 3584]
    - [28, 25184.0]
  - - [256, 5888, 1, 256, 256, 256, 256, 5888]
    - [16, 19829.0]
  - - [1856, 1408, 1, 3328, 1856, 1856, 1856, 1408]
    - [2, 21976.0]
  - - [1024, 4288, 1, 3328, 1024, 1024, 1024, 4288]
    - [21, 23656.0]
  - - [2944, 2368, 1, 3328, 2944, 2944, 2944, 2368]
    - [15, 24396.0]
  - - [1024, 1856, 1, 1280, 1024, 1024, 1024, 1856]
    - [4, 22430.0]
  - - [6784, 1856, 1, 256, 6784, 6784, 6784, 1856]
    - [25, 23697.0]
  - - [1024, 5888, 1, 256, 1024, 1024, 1024, 5888]
    - [7, 23169.0]
  - - [1408, 2368, 1, 256, 1408, 1408, 1408, 2368]
    - [14, 21908.0]
  - - [2944, 704, 1, 3328, 2944, 2944, 2944, 704]
    - [2, 22788.0]
  - - [2944, 2944, 1, 1280, 2944, 2944, 2944, 2944]
    - [26, 24772.0]
  - - [6784, 256, 1, 3328, 6784, 6784, 6784, 256]
    - [2, 22371.0]
  - - [1408, 5056, 1, 256, 1408, 1408, 1408, 5056]
    - [23, 22583.0]
  - - [5056, 256, 1, 256, 5056, 5056, 5056, 256]
    - [4, 17045.0]
  - - [1408, 4288, 1, 256, 1408, 1408, 1408, 4288]
    - [19, 22361.0]
  - - [5888, 2368, 1, 1280, 5888, 5888, 5888, 2368]
    - [12, 24542.0]
  - - [2368, 5888, 1, 1280, 2368, 2368, 2368, 5888]
    - [15, 24620.0]
  - - [5888, 256, 1, 1280, 5888, 5888, 5888, 256]
    - [16, 21811.0]
  - - [2368, 1856, 1, 3328, 2368, 2368, 2368, 1856]
    - [14, 22773.0]
  - - [2944, 704, 1, 256, 2944, 2944, 2944, 704]
    - [25, 19154.0]
  - - [2368, 6784, 1, 1280, 2368, 2368, 2368, 6784]
    - [3, 24462.0]
  - - [1856, 4288, 1, 1280, 1856, 1856, 1856, 4288]
    - [23, 23442.0]
  - - [704, 3584, 1, 256, 704, 704, 704, 3584]
    - [8, 19621.0]
  - - [704, 2944, 1, 3328, 704, 704, 704, 2944]
    - [4, 21830.0]
  - - [1856, 5056, 1, 3328, 1856, 1856, 1856, 5056]
    - [11, 24261.0]
  - - [3584, 5056, 1, 1280, 3584, 3584, 3584, 5056]
    - [15, 25137.0]
  - - [2944, 1024, 1, 3328, 2944, 2944, 2944, 1024]
    - [2, 23019.0]
  - - [1408, 6784, 1, 256, 1408, 1408, 1408, 6784]
    - [7, 23838.0]
  - - [6784, 1408, 1, 3328, 6784, 6784, 6784, 1408]
    - [3, 24709.0]
  - - [1024, 2368, 1, 1280, 1024, 1024, 1024, 2368]
    - [2, 22903.0]
  - - [6784, 2944, 1, 1280, 6784, 6784, 6784, 2944]
    - [3, 25491.0]
  - - [3584, 448, 1, 1280, 3584, 3584, 3584, 448]
    - [6, 21675.0]
  - - [2944, 6784, 1, 3328, 2944, 2944, 2944, 6784]
    - [3, 25590.0]
  - - [448, 5056, 1, 1280, 448, 448, 448, 5056]
    - [4, 20346.0]
  - - [5888, 704, 1, 256, 5888, 5888, 5888, 704]
    - [25, 21122.0]
  - - [256, 5888, 1, 3328, 256, 256, 256, 5888]
    - [27, 21837.0]
  - - [6784, 4288, 1, 256, 6784, 6784, 6784, 4288]
    - [12, 24386.0]
  - - [5888, 256, 1, 256, 5888, 5888, 5888, 256]
    - [16, 19891.0]
  - - [6784, 1024, 1, 1280, 6784, 6784, 6784, 1024]
    - [5, 24326.0]
  - - [2944, 704, 1, 1280, 2944, 2944, 2944, 704]
    - [14, 22501.0]
  - - [6784, 3584, 1, 1280, 6784, 6784, 6784, 3584]
    - [3, 25327.0]
  - - [1408, 2944, 1, 1280, 1408, 1408, 1408, 2944]
    - [15, 24013.0]
  - - [1408, 2368, 1, 3328, 1408, 1408, 1408, 2368]
    - [2, 23064.0]
  - - [1024, 3584, 1, 256, 1024, 1024, 1024, 3584]
    - [2, 20897.0]
  - - [2368, 2944, 1, 256, 2368, 2368, 2368, 2944]
    - [4, 22154.0]
  - - [2944, 5888, 1, 256, 2944, 2944, 2944, 5888]
    - [19, 24749.0]
  - - [3584, 1856, 1, 256, 3584, 3584, 3584, 1856]
    - [31, 23125.0]
  - - [704, 4288, 1, 3328, 704, 704, 704, 4288]
    - [2, 20918.0]
  - - [4288, 2944, 1, 1280, 4288, 4288, 4288, 2944]
    - [1, 24446.0]
  - - [4288, 5056, 1, 3328, 4288, 4288, 4288, 5056]
    - [17, 24942.0]
  - - [256, 5056, 1, 3328, 256, 256, 256, 5056]
    - [4, 22564.0]
  - - [5056, 2368, 1, 256, 5056, 5056, 5056, 2368]
    - [12, 23174.0]
  - - [4288, 704, 1, 3328, 4288, 4288, 4288, 704]
    - [2, 22905.0]
  - - [448, 3584, 1, 256, 448, 448, 448, 3584]
    - [16, 15665.0]
  - - [1024, 1408, 1, 3328, 1024, 1024, 1024, 1408]
    - [14, 22481.0]
  - - [2560, 7133, 1, 2560, 2560, 2560, 2560, 7133]
    - [28, 25388.0]
  - - [5888, 3584, 1, 256, 5888, 5888, 5888, 3584]
    - [30, 24643.0]
  - - [1408, 1856, 1, 3328, 1408, 1408, 1408, 1856]
    - [2, 23485.0]
  - - [6784, 1408, 1, 1280, 6784, 6784, 6784, 1408]
    - [26, 24607.0]
  - - [704, 2944, 1, 256, 704, 704, 704, 2944]
    - [16, 19507.0]
  - - [2944, 5888, 1, 3328, 2944, 2944, 2944, 5888]
    - [15, 25551.0]
  - - [1408, 6784, 1, 3328, 1408, 1408, 1408, 6784]
    - [3, 24755.0]
  - - [1408, 1408, 1, 1280, 1408, 1408, 1408, 1408]
    - [2, 21644.0]
  - - [448, 4288, 1, 3328, 448, 448, 448, 4288]
    - [22, 19992.0]
  - - [704, 2368, 1, 256, 704, 704, 704, 2368]
    - [16, 16351.0]
  - - [5888, 2368, 1, 3328, 5888, 5888, 5888, 2368]
    - [15, 24697.0]
  - - [4288, 5056, 1, 256, 4288, 4288, 4288, 5056]
    - [19, 23902.0]
  - - [4288, 448, 1, 1280, 4288, 4288, 4288, 448]
    - [2, 22144.0]
  - - [5888, 704, 1, 3328, 5888, 5888, 5888, 704]
    - [8, 23325.0]
  - - [4288, 3584, 1, 3328, 4288, 4288, 4288, 3584]
    - [34, 25009.0]
  - - [6784, 6784, 1, 3328, 6784, 6784, 6784, 6784]
    - [15, 25631.0]
  - - [704, 5056, 1, 3328, 704, 704, 704, 5056]
    - [5, 22428.0]
  - - [2368, 2944, 1, 3328, 2368, 2368, 2368, 2944]
    - [26, 24394.0]
  - - [2368, 3584, 1, 256, 2368, 2368, 2368, 3584]
    - [0, 23242.0]
  - - [3584, 2368, 1, 1280, 3584, 3584, 3584, 2368]
    - [26, 24121.0]
  - - [1856, 1856, 1, 256, 1856, 1856, 1856, 1856]
    - [2, 20957.0]
  - - [4288, 1408, 1, 3328, 4288, 4288, 4288, 1408]
    - [26, 24398.0]
  - - [4288, 5056, 1, 1280, 4288, 4288, 4288, 5056]
    - [28, 24784.0]
  - - [5888, 6784, 1, 1280, 5888, 5888, 5888, 6784]
    - [1, 25725.0]
  - - [5888, 1408, 1, 3328, 5888, 5888, 5888, 1408]
    - [3, 24682.0]
  - - [256, 5056, 1, 256, 256, 256, 256, 5056]
    - [14, 19770.0]
  - - [1408, 1024, 1, 256, 1408, 1408, 1408, 1024]
    - [25, 17952.0]
  - - [2368, 5056, 1, 256, 2368, 2368, 2368, 5056]
    - [26, 22500.0]
  - - [1024, 5056, 1, 256, 1024, 1024, 1024, 5056]
    - [14, 21828.0]
  - - [2368, 1408, 1, 3328, 2368, 2368, 2368, 1408]
    - [14, 22793.0]
  - - [5888, 448, 1, 256, 5888, 5888, 5888, 448]
    - [2, 19438.0]
  - - [6784, 5056, 1, 1280, 6784, 6784, 6784, 5056]
    - [17, 25255.0]
  - - [4288, 6784, 1, 1280, 4288, 4288, 4288, 6784]
    - [3, 24913.0]
  - - [6784, 1408, 1, 256, 6784, 6784, 6784, 1408]
    - [30, 23612.0]
  - - [5888, 4288, 1, 256, 5888, 5888, 5888, 4288]
    - [30, 24315.0]
  - - [5056, 5888, 1, 256, 5056, 5056, 5056, 5888]
    - [12, 24758.0]
  - - [2368, 1024, 1, 256, 2368, 2368, 2368, 1024]
    - [2, 20651.0]
  - - [1856, 6784, 1, 1280, 1856, 1856, 1856, 6784]
    - [3, 24369.0]
  - - [4288, 3584, 1, 256, 4288, 4288, 4288, 3584]
    - [23, 24086.0]
  - - [5056, 1856, 1, 1280, 5056, 5056, 5056, 1856]
    - [12, 23956.0]
  - - [1408, 1024, 1, 3328, 1408, 1408, 1408, 1024]
    - [2, 22491.0]
  - - [5888, 3584, 1, 1280, 5888, 5888, 5888, 3584]
    - [15, 25354.0]
  - - [1024, 2944, 1, 256, 1024, 1024, 1024, 2944]
    - [14, 21237.0]
  - - [448, 6784, 1, 1280, 448, 448, 448, 6784]
    - [23, 20499.0]
  - - [3584, 1024, 1, 3328, 3584, 3584, 3584, 1024]
    - [5, 23515.0]
  - - [2944, 1856, 1, 1280, 2944, 2944, 2944, 1856]
    - [2, 23451.0]
  - - [2368, 3584, 1, 3328, 2368, 2368, 2368, 3584]
    - [15, 24335.0]
  - - [3584, 5888, 1, 3328, 3584, 3584, 3584, 5888]
    - [3, 25402.0]
  - - [2944, 3584, 1, 1280, 2944, 2944, 2944, 3584]
    - [23, 24654.0]
  - - [1856, 5888, 1, 1280, 1856, 1856, 1856, 5888]
    - [3, 24129.0]
  - - [5056, 448, 1, 3328, 5056, 5056, 5056, 448]
    - [2, 23098.0]
  - - [4288, 1408, 1, 256, 4288, 4288, 4288, 1408]
    - [29, 22074.0]
  - - [4288, 2368, 1, 1280, 4288, 4288, 4288, 2368]
    - [14, 23769.0]
  - - [2944, 5056, 1, 256, 2944, 2944, 2944, 5056]
    - [23, 24243.0]
  - - [6784, 2368, 1, 256, 6784, 6784, 6784, 2368]
    - [25, 23794.0]
  - - [4288, 1856, 1, 256, 4288, 4288, 4288, 1856]
    - [2, 22754.0]
  - - [1856, 2944, 1, 256, 1856, 1856, 1856, 2944]
    - [7, 22196.0]
  - - [1856, 1408, 1, 1280, 1856, 1856, 1856, 1408]
    - [2, 21857.0]
  - - [1024, 4288, 1, 1280, 1024, 1024, 1024, 4288]
    - [25, 23209.0]
  - - [2368, 5056, 1, 3328, 2368, 2368, 2368, 5056]
    - [17, 24527.0]
  - - [1024, 1856, 1, 3328, 1024, 1024, 1024, 1856]
    - [4, 23066.0]
  - - [704, 3584, 1, 1280, 704, 704, 704, 3584]
    - [14, 20713.0]
  - - [4288, 6784, 1, 256, 4288, 4288, 4288, 6784]
    - [12, 24372.0]
  - - [3584, 2944, 1, 3328, 3584, 3584, 3584, 2944]
    - [21, 24867.0]
  - - [5888, 2944, 1, 256, 5888, 5888, 5888, 2944]
    - [23, 24799.0]
  - - [5056, 4288, 1, 256, 5056, 5056, 5056, 4288]
    - [12, 24127.0]
  - - [6784, 1024, 1, 3328, 6784, 6784, 6784, 1024]
    - [17, 24545.0]
  - - [5888, 5888, 1, 1280, 5888, 5888, 5888, 5888]
    - [13, 25659.0]
  - - [448, 5888, 1, 1280, 448, 448, 448, 5888]
    - [2, 19667.0]
  - - [2944, 1408, 1, 256, 2944, 2944, 2944, 1408]
    - [26, 22256.0]
  - - [1024, 2944, 1, 1280, 1024, 1024, 1024, 2944]
    - [2, 22313.0]
  - - [2368, 5888, 1, 3328, 2368, 2368, 2368, 5888]
    - [5, 24761.0]
  - - [2368, 1856, 1, 1280, 2368, 2368, 2368, 1856]
    - [25, 22802.0]
  - - [5888, 4288, 1, 3328, 5888, 5888, 5888, 4288]
    - [3, 25028.0]
  - - [6784, 704, 1, 1280, 6784, 6784, 6784, 704]
    - [2, 23069.0]
  - - [5056, 448, 1, 256, 5056, 5056, 5056, 448]
    - [2, 19446.0]
  - - [1856, 5056, 1, 1280, 1856, 1856, 1856, 5056]
    - [23, 24043.0]
  - - [2944, 1024, 1, 1280, 2944, 2944, 2944, 1024]
    - [14, 22787.0]
  - - [2368, 4288, 1, 256, 2368, 2368, 2368, 4288]
    - [20, 22822.0]
  - - [1024, 2368, 1, 3328, 1024, 1024, 1024, 2368]
    - [2, 23264.0]
  - - [4288, 5888, 1, 3328, 4288, 4288, 4288, 5888]
    - [15, 25012.0]
  - - [2944, 6784, 1, 1280, 2944, 2944, 2944, 6784]
    - [21, 25440.0]
  - - [256, 6784, 1, 1280, 256, 256, 256, 6784]
    - [2, 22071.0]
  - - [1856, 3584, 1, 256, 1856, 1856, 1856, 3584]
    - [33, 21350.0]
  - - [256, 5888, 1, 1280, 256, 256, 256, 5888]
    - [10, 21188.0]
  - - [7680, 5481, 1, 2560, 7680, 7680, 7680, 5481]
    - [15, 25555.0]
  - - [2944, 2368, 1, 256, 2944, 2944, 2944, 2368]
    - [2, 22648.0]
  - - [1024, 1856, 1, 256, 1024, 1024, 1024, 1856]
    - [14, 20721.0]
  - - [6784, 3584, 1, 3328, 6784, 6784, 6784, 3584]
    - [26, 25399.0]
  - - [1024, 5888, 1, 3328, 1024, 1024, 1024, 5888]
    - [3, 24398.0]
  - - [1408, 2368, 1, 1280, 1408, 1408, 1408, 2368]
    - [14, 22913.0]
  - - [2944, 2944, 1, 256, 2944, 2944, 2944, 2944]
    - [19, 23858.0]
  - - [6784, 256, 1, 256, 6784, 6784, 6784, 256]
    - [14, 20376.0]
  - - [5888, 1408, 1, 256, 5888, 5888, 5888, 1408]
    - [23, 23671.0]
  - - [5888, 6784, 1, 3328, 5888, 5888, 5888, 6784]
    - [24, 25777.0]
  - - [704, 4288, 1, 1280, 704, 704, 704, 4288]
    - [14, 20501.0]
  - - [6784, 448, 1, 3328, 6784, 6784, 6784, 448]
    - [2, 23172.0]
  - - [3136, 256, 64, 64, 3136, 3136, 3136, 256]
    - [29, 15680.0]
  - - [784, 512, 64, 128, 784, 784, 784, 512]
    - [7, 21014.0]
  - - [784, 128, 64, 512, 784, 784, 784, 128]
    - [7, 20833.0]
  - - [196, 256, 128, 1024, 196, 196, 196, 256]
    - [7, 18545.0]
  - - [196, 256, 64, 1024, 196, 196, 196, 256]
    - [27, 18005.0]
  - - [196, 1024, 128, 256, 196, 196, 196, 1024]
    - [23, 18126.0]
  - - [784, 128, 256, 512, 784, 784, 784, 128]
    - [0, 21978.0]
  - - [3136, 256, 256, 64, 3136, 3136, 3136, 256]
    - [0, 14123.0]
  - - [784, 128, 128, 512, 784, 784, 784, 128]
    - [23, 21610.0]
  - - [784, 512, 128, 128, 784, 784, 784, 512]
    - [23, 21311.0]
  - - [784, 512, 256, 128, 784, 784, 784, 512]
    - [23, 21610.0]
  - - [196, 1024, 64, 256, 196, 196, 196, 1024]
    - [16, 17733.0]
  - - [196, 1024, 256, 256, 196, 196, 196, 1024]
    - [0, 18463.0]
  - - [196, 256, 256, 1024, 196, 196, 196, 256]
    - [0, 18961.0]
  - - [3136, 256, 128, 64, 3136, 3136, 3136, 256]
    - [0, 19025.0]
  - - [1024, 1024, 1, 3328, 1024, 1024, 1024, 1024]
    - [37, 20343.0]
  - - [64, 6784, 1, 256, 64, 64, 64, 6784]
    - [52, 12029.0]
  - - [128, 6784, 1, 3328, 128, 128, 128, 6784]
    - [38, 20536.0]
  - - [256, 4288, 1, 3328, 256, 256, 256, 4288]
    - [36, 22058.0]
  - - [704, 1856, 1, 3328, 704, 704, 704, 1856]
    - [44, 21429.0]
  - - [448, 1024, 1, 1280, 448, 448, 448, 1024]
    - [52, 16275.0]
  - - [2368, 128, 1, 256, 2368, 2368, 2368, 128]
    - [40, 7983.0]
  - - [256, 1856, 1, 1280, 256, 256, 256, 1856]
    - [46, 16663.0]
  - - [448, 704, 1, 1280, 448, 448, 448, 704]
    - [57, 14408.0]
  - - [128, 3584, 1, 1280, 128, 128, 128, 3584]
    - [46, 16177.0]
  - - [4288, 256, 1, 256, 4288, 4288, 4288, 256]
    - [35, 15647.0]
  - - [5888, 64, 1, 3328, 5888, 5888, 5888, 64]
    - [46, 15399.0]
  - - [2944, 256, 1, 3328, 2944, 2944, 2944, 256]
    - [46, 20066.0]
  - - [256, 4288, 1, 1280, 256, 256, 256, 4288]
    - [46, 21028.0]
  - - [1408, 448, 1, 1280, 1408, 1408, 1408, 448]
    - [37, 19233.0]
  - - [6784, 128, 1, 1280, 6784, 6784, 6784, 128]
    - [38, 18864.0]
  - - [2368, 128, 1, 3328, 2368, 2368, 2368, 128]
    - [53, 15961.0]
  - - [2944, 128, 1, 256, 2944, 2944, 2944, 128]
    - [35, 8851.0]
  - - [448, 1408, 1, 256, 448, 448, 448, 1408]
    - [40, 12403.0]
  - - [64, 5056, 1, 3328, 64, 64, 64, 5056]
    - [39, 16900.0]
  - - [2368, 256, 1, 1280, 2368, 2368, 2368, 256]
    - [53, 17106.0]
  - - [256, 3584, 1, 3328, 256, 256, 256, 3584]
    - [38, 21149.0]
  - - [5056, 64, 1, 1280, 5056, 5056, 5056, 64]
    - [53, 14636.0]
  - - [1024, 704, 1, 256, 1024, 1024, 1024, 704]
    - [52, 12888.0]
  - - [4288, 128, 1, 1280, 4288, 4288, 4288, 128]
    - [36, 15795.0]
  - - [5888, 64, 1, 256, 5888, 5888, 5888, 64]
    - [40, 8507.0]
  - - [1856, 256, 1, 1280, 1856, 1856, 1856, 256]
    - [37, 16866.0]
  - - [64, 5888, 1, 3328, 64, 64, 64, 5888]
    - [53, 14937.0]
  - - [256, 1408, 1, 3328, 256, 256, 256, 1408]
    - [36, 14298.0]
  - - [6784, 128, 1, 3328, 6784, 6784, 6784, 128]
    - [43, 20019.0]
  - - [704, 704, 1, 3328, 704, 704, 704, 704]
    - [38, 15730.0]
  - - [3584, 256, 1, 3328, 3584, 3584, 3584, 256]
    - [47, 21102.0]
  - - [128, 3584, 1, 3328, 128, 128, 128, 3584]
    - [46, 18515.0]
  - - [128, 2944, 1, 1280, 128, 128, 128, 2944]
    - [41, 14245.0]
  - - [448, 1856, 1, 1280, 448, 448, 448, 1856]
    - [52, 18401.0]
  - - [3584, 128, 1, 256, 3584, 3584, 3584, 128]
    - [52, 12441.0]
  - - [448, 1408, 1, 3328, 448, 448, 448, 1408]
    - [36, 19656.0]
  - - [256, 3584, 1, 256, 256, 256, 256, 3584]
    - [40, 16494.0]
  - - [256, 2944, 1, 3328, 256, 256, 256, 2944]
    - [37, 19932.0]
  - - [1408, 704, 1, 256, 1408, 1408, 1408, 704]
    - [58, 15939.0]
  - - [448, 2944, 1, 3328, 448, 448, 448, 2944]
    - [45, 20732.0]
  - - [64, 5888, 1, 256, 64, 64, 64, 5888]
    - [35, 8245.0]
  - - [448, 2368, 1, 1280, 448, 448, 448, 2368]
    - [53, 19460.0]
  - - [128, 4288, 1, 3328, 128, 128, 128, 4288]
    - [46, 17707.0]
  - - [256, 2368, 1, 256, 256, 256, 256, 2368]
    - [40, 11956.0]
  - - [1024, 448, 1, 3328, 1024, 1024, 1024, 448]
    - [45, 18034.0]
  - - [1856, 704, 1, 1280, 1856, 1856, 1856, 704]
    - [36, 21112.0]
  - - [1024, 1024, 1, 1280, 1024, 1024, 1024, 1024]
    - [37, 19362.0]
  - - [256, 2944, 1, 256, 256, 256, 256, 2944]
    - [35, 13125.0]
  - - [128, 6784, 1, 1280, 128, 128, 128, 6784]
    - [51, 19445.0]
  - - [1408, 704, 1, 3328, 1408, 1408, 1408, 704]
    - [53, 19599.0]
  - - [128, 5888, 1, 1280, 128, 128, 128, 5888]
    - [54, 18250.0]
  - - [704, 1408, 1, 3328, 704, 704, 704, 1408]
    - [53, 19603.0]
  - - [6784, 128, 1, 256, 6784, 6784, 6784, 128]
    - [48, 13655.0]
  - - [704, 448, 1, 256, 704, 704, 704, 448]
    - [40, 8139.0]
  - - [256, 1856, 1, 3328, 256, 256, 256, 1856]
    - [37, 18629.0]
  - - [128, 4288, 1, 256, 128, 128, 128, 4288]
    - [58, 12197.0]
  - - [64, 6784, 1, 3328, 64, 64, 64, 6784]
    - [49, 16959.0]
  - - [2944, 256, 1, 1280, 2944, 2944, 2944, 256]
    - [50, 18886.0]
  - - [1856, 704, 1, 256, 1856, 1856, 1856, 704]
    - [35, 17101.0]
  - - [1408, 448, 1, 3328, 1408, 1408, 1408, 448]
    - [54, 19748.0]
  - - [2368, 256, 1, 256, 2368, 2368, 2368, 256]
    - [35, 12086.0]
  - - [704, 1856, 1, 256, 704, 704, 704, 1856]
    - [40, 19158.0]
  - - [5888, 64, 1, 1280, 5888, 5888, 5888, 64]
    - [37, 13398.0]
  - - [256, 2368, 1, 1280, 256, 256, 256, 2368]
    - [37, 17445.0]
  - - [2944, 448, 1, 256, 2944, 2944, 2944, 448]
    - [40, 16551.0]
  - - [2368, 128, 1, 1280, 2368, 2368, 2368, 128]
    - [36, 13777.0]
  - - [64, 5056, 1, 1280, 64, 64, 64, 5056]
    - [45, 14761.0]
  - - [704, 448, 1, 3328, 704, 704, 704, 448]
    - [36, 16592.0]
  - - [5056, 64, 1, 3328, 5056, 5056, 5056, 64]
    - [55, 16959.0]
  - - [2368, 448, 1, 1280, 2368, 2368, 2368, 448]
    - [35, 19527.0]
  - - [128, 3584, 1, 256, 128, 128, 128, 3584]
    - [40, 10411.0]
  - - [1856, 448, 1, 3328, 1856, 1856, 1856, 448]
    - [45, 18771.0]
  - - [128, 5056, 1, 256, 128, 128, 128, 5056]
    - [44, 12438.0]
  - - [4288, 256, 1, 1280, 4288, 4288, 4288, 256]
    - [37, 19718.0]
  - - [704, 704, 1, 256, 704, 704, 704, 704]
    - [35, 10022.0]
  - - [4288, 128, 1, 3328, 4288, 4288, 4288, 128]
    - [47, 17420.0]
  - - [256, 1408, 1, 1280, 256, 256, 256, 1408]
    - [52, 12960.0]
  - - [6784, 64, 1, 3328, 6784, 6784, 6784, 64]
    - [54, 17055.0]
  - - [128, 2944, 1, 3328, 128, 128, 128, 2944]
    - [37, 14951.0]
  - - [2944, 448, 1, 3328, 2944, 2944, 2944, 448]
    - [45, 20759.0]
  - - [2368, 448, 1, 3328, 2368, 2368, 2368, 448]
    - [54, 20193.0]
  - - [5056, 64, 1, 256, 5056, 5056, 5056, 64]
    - [35, 7756.0]
  - - [128, 5056, 1, 3328, 128, 128, 128, 5056]
    - [47, 20346.0]
  - - [6784, 64, 1, 256, 6784, 6784, 6784, 64]
    - [52, 9682.0]
  - - [128, 2368, 1, 256, 128, 128, 128, 2368]
    - [56, 7653.0]
  - - [3584, 256, 1, 256, 3584, 3584, 3584, 256]
    - [44, 16266.0]
  - - [128, 2944, 1, 256, 128, 128, 128, 2944]
    - [48, 10578.0]
  - - [3584, 128, 1, 3328, 3584, 3584, 3584, 128]
    - [45, 18355.0]
  - - [1024, 448, 1, 1280, 1024, 1024, 1024, 448]
    - [45, 17160.0]
  - - [5888, 128, 1, 3328, 5888, 5888, 5888, 128]
    - [46, 19568.0]
  - - [1408, 704, 1, 1280, 1408, 1408, 1408, 704]
    - [53, 19282.0]
  - - [448, 1408, 1, 1280, 448, 448, 448, 1408]
    - [52, 17974.0]
  - - [704, 1408, 1, 1280, 704, 704, 704, 1408]
    - [37, 18626.0]
  - - [448, 2944, 1, 256, 448, 448, 448, 2944]
    - [35, 16665.0]
  - - [448, 2368, 1, 256, 448, 448, 448, 2368]
    - [52, 15021.0]
  - - [64, 5056, 1, 256, 64, 64, 64, 5056]
    - [48, 7642.0]
  - - [5056, 128, 1, 3328, 5056, 5056, 5056, 128]
    - [59, 20654.0]
  - - [448, 704, 1, 256, 448, 448, 448, 704]
    - [56, 8446.0]
  - - [1856, 256, 1, 3328, 1856, 1856, 1856, 256]
    - [49, 18829.0]
  - - [2944, 128, 1, 3328, 2944, 2944, 2944, 128]
    - [45, 14923.0]
  - - [64, 6784, 1, 1280, 64, 64, 64, 6784]
    - [53, 15004.0]
  - - [704, 1024, 1, 1280, 704, 704, 704, 1024]
    - [37, 17280.0]
  - - [256, 4288, 1, 256, 256, 256, 256, 4288]
    - [42, 15323.0]
  - - [256, 2368, 1, 3328, 256, 256, 256, 2368]
    - [47, 19591.0]
  - - [1408, 256, 1, 1280, 1408, 1408, 1408, 256]
    - [35, 12924.0]
  - - [704, 448, 1, 1280, 704, 704, 704, 448]
    - [36, 14245.0]
  - - [1024, 704, 1, 1280, 1024, 1024, 1024, 704]
    - [42, 18193.0]
  - - [256, 1856, 1, 256, 256, 256, 256, 1856]
    - [46, 12412.0]
  - - [704, 1856, 1, 1280, 704, 704, 704, 1856]
    - [35, 21316.0]
  - - [1408, 256, 1, 3328, 1408, 1408, 1408, 256]
    - [36, 14287.0]
  - - [5888, 128, 1, 256, 5888, 5888, 5888, 128]
    - [40, 13019.0]
  - - [2368, 448, 1, 256, 2368, 2368, 2368, 448]
    - [45, 16910.0]
  - - [4288, 256, 1, 3328, 4288, 4288, 4288, 256]
    - [46, 20838.0]
  - - [2944, 256, 1, 256, 2944, 2944, 2944, 256]
    - [35, 13343.0]
  - - [1408, 448, 1, 256, 1408, 1408, 1408, 448]
    - [44, 12460.0]
  - - [6784, 64, 1, 1280, 6784, 6784, 6784, 64]
    - [42, 15168.0]
  - - [448, 1024, 1, 3328, 448, 448, 448, 1024]
    - [45, 17852.0]
  - - [2944, 448, 1, 1280, 2944, 2944, 2944, 448]
    - [52, 19922.0]
  - - [5056, 128, 1, 256, 5056, 5056, 5056, 128]
    - [35, 12532.0]
  - - [448, 1024, 1, 256, 448, 448, 448, 1024]
    - [56, 10411.0]
  - - [128, 5056, 1, 1280, 128, 128, 128, 5056]
    - [37, 18482.0]
  - - [1408, 256, 1, 256, 1408, 1408, 1408, 256]
    - [35, 8328.0]
  - - [128, 5888, 1, 3328, 128, 128, 128, 5888]
    - [46, 19546.0]
  - - [3584, 128, 1, 1280, 3584, 3584, 3584, 128]
    - [36, 16062.0]
  - - [4288, 128, 1, 256, 4288, 4288, 4288, 128]
    - [35, 10808.0]
  - - [2368, 256, 1, 3328, 2368, 2368, 2368, 256]
    - [47, 19119.0]
  - - [5888, 128, 1, 1280, 5888, 5888, 5888, 128]
    - [37, 18120.0]
  - - [256, 3584, 1, 1280, 256, 256, 256, 3584]
    - [47, 20691.0]
  - - [128, 5888, 1, 256, 128, 128, 128, 5888]
    - [35, 12966.0]
  - - [1024, 1024, 1, 256, 1024, 1024, 1024, 1024]
    - [35, 14864.0]
  - - [1024, 1024, 1, 1024, 1024, 1024, 1024, 1024]
    - [44, 18944.0]
  - - [64, 5888, 1, 1280, 64, 64, 64, 5888]
    - [36, 13339.0]
  - - [704, 1024, 1, 256, 704, 704, 704, 1024]
    - [40, 12780.0]
  - - [704, 704, 1, 1280, 704, 704, 704, 704]
    - [35, 14530.0]
  - - [128, 2368, 1, 1280, 128, 128, 128, 2368]
    - [45, 14968.0]
  - - [3584, 256, 1, 1280, 3584, 3584, 3584, 256]
    - [43, 20117.0]
  - - [5056, 128, 1, 1280, 5056, 5056, 5056, 128]
    - [37, 18982.0]
  - - [448, 1856, 1, 3328, 448, 448, 448, 1856]
    - [38, 18751.0]
  - - [1024, 448, 1, 256, 1024, 1024, 1024, 448]
    - [44, 10248.0]
  - - [2944, 128, 1, 1280, 2944, 2944, 2944, 128]
    - [35, 13406.0]
  - - [256, 2944, 1, 1280, 256, 256, 256, 2944]
    - [46, 19103.0]
  - - [704, 1024, 1, 3328, 704, 704, 704, 1024]
    - [54, 18682.0]
  - - [1856, 448, 1, 1280, 1856, 1856, 1856, 448]
    - [49, 17609.0]
  - - [128, 6784, 1, 256, 128, 128, 128, 6784]
    - [44, 13440.0]
  - - [704, 1408, 1, 256, 704, 704, 704, 1408]
    - [44, 14434.0]
  - - [256, 1408, 1, 256, 256, 256, 256, 1408]
    - [35, 8052.0]
  - - [448, 2944, 1, 1280, 448, 448, 448, 2944]
    - [53, 20399.0]
  - - [1856, 256, 1, 256, 1856, 1856, 1856, 256]
    - [35, 10764.0]
  - - [128, 2368, 1, 3328, 128, 128, 128, 2368]
    - [54, 15981.0]
  - - [448, 2368, 1, 3328, 448, 448, 448, 2368]
    - [36, 19781.0]
  - - [1856, 448, 1, 256, 1856, 1856, 1856, 448]
    - [44, 13593.0]
  - - [1024, 704, 1, 3328, 1024, 1024, 1024, 704]
    - [46, 18823.0]
  - - [128, 4288, 1, 1280, 128, 128, 128, 4288]
    - [54, 15859.0]
  - - [448, 704, 1, 3328, 448, 448, 448, 704]
    - [36, 16483.0]
  - - [448, 1856, 1, 256, 448, 448, 448, 1856]
    - [52, 13524.0]
  - - [1856, 704, 1, 3328, 1856, 1856, 1856, 704]
    - [45, 21358.0]
  - - [3136, 64, 128, 64, 3136, 3136, 3136, 64]
    - [48, 17177.0]
  - - [3136, 64, 64, 256, 3136, 3136, 3136, 64]
    - [52, 19660.0]
  - - [3136, 64, 256, 256, 3136, 3136, 3136, 64]
    - [55, 16714.0]
  - - [3136, 64, 128, 256, 3136, 3136, 3136, 64]
    - [35, 17533.0]
  - - [3136, 64, 64, 64, 3136, 3136, 3136, 64]
    - [56, 20532.0]
  - - [3136, 64, 256, 64, 3136, 3136, 3136, 64]
    - [35, 14260.0]
  - - [2368, 64, 1, 3328, 2368, 2368, 2368, 64]
    - [64, 11354.0]
  - - [1408, 64, 1, 1280, 1408, 1408, 1408, 64]
    - [62, 6084.0]
  - - [2944, 64, 1, 256, 2944, 2944, 2944, 64]
    - [62, 5715.0]
  - - [1024, 256, 1, 3328, 1024, 1024, 1024, 256]
    - [80, 10996.0]
  - - [1856, 64, 1, 1280, 1856, 1856, 1856, 64]
    - [109, 8881.0]
  - - [704, 128, 1, 1280, 704, 704, 704, 128]
    - [73, 6135.0]
  - - [4288, 64, 1, 3328, 4288, 4288, 4288, 64]
    - [67, 11697.0]
  - - [1856, 128, 1, 256, 1856, 1856, 1856, 128]
    - [96, 7105.0]
  - - [2944, 64, 1, 1280, 2944, 2944, 2944, 64]
    - [77, 9836.0]
  - - [64, 3584, 1, 3328, 64, 64, 64, 3584]
    - [81, 11503.0]
  - - [1024, 256, 1, 256, 1024, 1024, 1024, 256]
    - [86, 6876.0]
  - - [448, 448, 1, 256, 448, 448, 448, 448]
    - [107, 6220.0]
  - - [128, 1024, 1, 3328, 128, 128, 128, 1024]
    - [81, 9341.0]
  - - [64, 1856, 1, 1280, 64, 64, 64, 1856]
    - [113, 8263.0]
  - - [1024, 128, 1, 1280, 1024, 1024, 1024, 128]
    - [90, 8089.0]
  - - [448, 256, 1, 3328, 448, 448, 448, 256]
    - [105, 9210.0]
  - - [128, 704, 1, 1280, 128, 128, 128, 704]
    - [62, 6039.0]
  - - [1856, 128, 1, 3328, 1856, 1856, 1856, 128]
    - [64, 11896.0]
  - - [256, 448, 1, 256, 256, 256, 256, 448]
    - [64, 3716.0]
  - - [256, 1024, 1, 256, 256, 256, 256, 1024]
    - [96, 6890.0]
  - - [448, 448, 1, 3328, 448, 448, 448, 448]
    - [62, 11722.0]
  - - [1408, 128, 1, 1280, 1408, 1408, 1408, 128]
    - [103, 9525.0]
  - - [128, 1856, 1, 1280, 128, 128, 128, 1856]
    - [97, 10806.0]
  - - [64, 1408, 1, 3328, 64, 64, 64, 1408]
    - [83, 7297.0]
  - - [256, 448, 1, 3328, 256, 256, 256, 448]
    - [67, 9202.0]
  - - [64, 2368, 1, 1280, 64, 64, 64, 2368]
    - [102, 9246.0]
  - - [2368, 64, 1, 256, 2368, 2368, 2368, 64]
    - [81, 5013.0]
  - - [4288, 64, 1, 1280, 4288, 4288, 4288, 64]
    - [76, 11924.0]
  - - [128, 1024, 1, 1280, 128, 128, 128, 1024]
    - [75, 8105.0]
  - - [1856, 64, 1, 256, 1856, 1856, 1856, 64]
    - [89, 4842.0]
  - - [704, 128, 1, 256, 704, 704, 704, 128]
    - [72, 3126.0]
  - - [448, 256, 1, 1280, 448, 448, 448, 256]
    - [62, 7694.0]
  - - [1856, 128, 1, 1280, 1856, 1856, 1856, 128]
    - [70, 11484.0]
  - - [64, 3584, 1, 256, 64, 64, 64, 3584]
    - [67, 7626.0]
  - - [64, 1856, 1, 256, 64, 64, 64, 1856]
    - [64, 3949.0]
  - - [256, 1024, 1, 1280, 256, 256, 256, 1024]
    - [98, 10230.0]
  - - [3584, 64, 1, 1280, 3584, 3584, 3584, 64]
    - [90, 10324.0]
  - - [1408, 128, 1, 3328, 1408, 1408, 1408, 128]
    - [62, 10764.0]
  - - [64, 4288, 1, 3328, 64, 64, 64, 4288]
    - [62, 11374.0]
  - - [256, 704, 1, 256, 256, 256, 256, 704]
    - [95, 6687.0]
  - - [128, 1024, 1, 256, 128, 128, 128, 1024]
    - [81, 4313.0]
  - - [64, 2944, 1, 256, 64, 64, 64, 2944]
    - [62, 7907.0]
  - - [64, 1408, 1, 1280, 64, 64, 64, 1408]
    - [85, 6175.0]
  - - [704, 128, 1, 3328, 704, 704, 704, 128]
    - [80, 7666.0]
  - - [1408, 128, 1, 256, 1408, 1408, 1408, 128]
    - [86, 5428.0]
  - - [64, 2944, 1, 1280, 64, 64, 64, 2944]
    - [62, 9733.0]
  - - [704, 256, 1, 1280, 704, 704, 704, 256]
    - [62, 9362.0]
  - - [256, 448, 1, 1280, 256, 256, 256, 448]
    - [88, 7606.0]
  - - [64, 2368, 1, 3328, 64, 64, 64, 2368]
    - [81, 11299.0]
  - - [256, 704, 1, 3328, 256, 256, 256, 704]
    - [111, 10612.0]
  - - [64, 2944, 1, 3328, 64, 64, 64, 2944]
    - [111, 11106.0]
  - - [128, 1408, 1, 256, 128, 128, 128, 1408]
    - [108, 6969.0]
  - - [128, 1408, 1, 3328, 128, 128, 128, 1408]
    - [62, 10556.0]
  - - [1408, 64, 1, 256, 1408, 1408, 1408, 64]
    - [114, 4402.0]
  - - [64, 2368, 1, 256, 64, 64, 64, 2368]
    - [75, 6978.0]
  - - [1024, 128, 1, 3328, 1024, 1024, 1024, 128]
    - [103, 9968.0]
  - - [2368, 64, 1, 1280, 2368, 2368, 2368, 64]
    - [102, 9299.0]
  - - [4288, 64, 1, 256, 4288, 4288, 4288, 64]
    - [60, 7125.0]
  - - [64, 4288, 1, 1280, 64, 64, 64, 4288]
    - [107, 10448.0]
  - - [1408, 64, 1, 3328, 1408, 1408, 1408, 64]
    - [92, 7658.0]
  - - [448, 448, 1, 1280, 448, 448, 448, 448]
    - [100, 10384.0]
  - - [1024, 256, 1, 1280, 1024, 1024, 1024, 256]
    - [78, 10211.0]
  - - [3584, 64, 1, 3328, 3584, 3584, 3584, 64]
    - [81, 11850.0]
  - - [256, 1024, 1, 3328, 256, 256, 256, 1024]
    - [62, 11015.0]
  - - [1856, 64, 1, 3328, 1856, 1856, 1856, 64]
    - [83, 9512.0]
  - - [448, 256, 1, 256, 448, 448, 448, 256]
    - [70, 3915.0]
  - - [128, 704, 1, 256, 128, 128, 128, 704]
    - [61, 3178.0]
  - - [1024, 128, 1, 256, 1024, 1024, 1024, 128]
    - [81, 4392.0]
  - - [64, 3584, 1, 1280, 64, 64, 64, 3584]
    - [90, 10426.0]
  - - [3584, 64, 1, 256, 3584, 3584, 3584, 64]
    - [97, 6658.0]
  - - [64, 1856, 1, 3328, 64, 64, 64, 1856]
    - [67, 9516.0]
  - - [2944, 64, 1, 3328, 2944, 2944, 2944, 64]
    - [100, 11005.0]
  - - [128, 704, 1, 3328, 128, 128, 128, 704]
    - [67, 7325.0]
  - - [128, 1856, 1, 256, 128, 128, 128, 1856]
    - [71, 6818.0]
  - - [64, 4288, 1, 256, 64, 64, 64, 4288]
    - [60, 7380.0]
  - - [704, 256, 1, 3328, 704, 704, 704, 256]
    - [80, 10616.0]
  - - [256, 704, 1, 1280, 256, 256, 256, 704]
    - [62, 9423.0]
  - - [64, 1408, 1, 256, 64, 64, 64, 1408]
    - [99, 3151.0]
  - - [128, 1408, 1, 1280, 128, 128, 128, 1408]
    - [100, 9400.0]
  - - [128, 1856, 1, 3328, 128, 128, 128, 1856]
    - [88, 12056.0]
  - - [704, 256, 1, 256, 704, 704, 704, 256]
    - [86, 5532.0]
  - - [448, 64, 1, 1280, 448, 448, 448, 64]
    - [84, 3469.0]
  - - [64, 1024, 1, 1280, 64, 64, 64, 1024]
    - [79, 5699.0]
  - - [64, 704, 1, 1280, 64, 64, 64, 704]
    - [101, 4396.0]
  - - [64, 64, 1, 1280, 64, 64, 64, 64]
    - [68, 428.0]
  - - [128, 448, 1, 256, 128, 128, 128, 448]
    - [112, 2353.0]
  - - [256, 256, 1, 3328, 256, 256, 256, 256]
    - [69, 6147.0]
  - - [64, 448, 1, 1280, 64, 64, 64, 448]
    - [68, 2849.0]
  - - [64, 64, 1, 3328, 64, 64, 64, 64]
    - [106, 541.0]
  - - [256, 64, 1, 1280, 256, 256, 256, 64]
    - [84, 1664.0]
  - - [128, 448, 1, 1280, 128, 128, 128, 448]
    - [79, 4779.0]
  - - [704, 64, 1, 1280, 704, 704, 704, 64]
    - [66, 4056.0]
  - - [512, 32, 1, 512, 512, 512, 512, 32]
    - [110, 1441.0]
  - - [448, 64, 1, 3328, 448, 448, 448, 64]
    - [66, 3537.0]
  - - [64, 128, 1, 3328, 64, 64, 64, 128]
    - [84, 1081.0]
  - - [128, 128, 1, 3328, 128, 128, 128, 128]
    - [68, 2352.0]
  - - [256, 128, 1, 256, 256, 256, 256, 128]
    - [63, 1427.0]
  - - [64, 448, 1, 3328, 64, 64, 64, 448]
    - [66, 3542.0]
  - - [256, 64, 1, 256, 256, 256, 256, 64]
    - [74, 713.0]
  - - [256, 128, 1, 1280, 256, 256, 256, 128]
    - [106, 3202.0]
  - - [128, 64, 1, 1280, 128, 128, 128, 64]
    - [84, 831.0]
  - - [64, 1024, 1, 256, 64, 64, 64, 1024]
    - [79, 2542.0]
  - - [64, 704, 1, 256, 64, 64, 64, 704]
    - [87, 2695.0]
  - - [704, 64, 1, 3328, 704, 704, 704, 64]
    - [66, 4972.0]
  - - [512, 16, 1, 512, 512, 512, 512, 16]
    - [104, 522.0]
  - - [448, 128, 1, 256, 448, 448, 448, 128]
    - [101, 2345.0]
  - - [256, 256, 1, 256, 256, 256, 256, 256]
    - [61, 2581.0]
  - - [448, 128, 1, 3328, 448, 448, 448, 128]
    - [106, 5620.0]
  - - [128, 256, 1, 1280, 128, 128, 128, 256]
    - [68, 3251.0]
  - - [64, 256, 1, 1280, 64, 64, 64, 256]
    - [84, 1641.0]
  - - [1024, 32, 1, 512, 1024, 1024, 1024, 32]
    - [84, 2135.0]
  - - [64, 448, 1, 256, 64, 64, 64, 448]
    - [74, 1232.0]
  - - [64, 64, 1, 256, 64, 64, 64, 64]
    - [91, 248.0]
  - - [128, 256, 1, 3328, 128, 128, 128, 256]
    - [65, 4039.0]
  - - [64, 128, 1, 1280, 64, 64, 64, 128]
    - [93, 823.0]
  - - [128, 128, 1, 1280, 128, 128, 128, 128]
    - [68, 1638.0]
  - - [128, 256, 1, 256, 128, 128, 128, 256]
    - [74, 1362.0]
  - - [64, 128, 1, 256, 64, 64, 64, 128]
    - [84, 532.0]
  - - [704, 64, 1, 256, 704, 704, 704, 64]
    - [99, 2898.0]
  - - [128, 64, 1, 3328, 128, 128, 128, 64]
    - [84, 1072.0]
  - - [448, 64, 1, 256, 448, 448, 448, 64]
    - [74, 1215.0]
  - - [1024, 16, 1, 512, 1024, 1024, 1024, 16]
    - [82, 1062.0]
  - - [1024, 64, 1, 256, 1024, 1024, 1024, 64]
    - [61, 2573.0]
  - - [128, 64, 1, 256, 128, 128, 128, 64]
    - [101, 352.0]
  - - [1024, 64, 1, 1280, 1024, 1024, 1024, 64]
    - [90, 4860.0]
  - - [64, 1024, 1, 3328, 64, 64, 64, 1024]
    - [94, 6546.0]
  - - [448, 128, 1, 1280, 448, 448, 448, 128]
    - [66, 4766.0]
  - - [1024, 64, 1, 3328, 1024, 1024, 1024, 64]
    - [94, 6120.0]
  - - [64, 256, 1, 3328, 64, 64, 64, 256]
    - [84, 2127.0]
  - - [256, 256, 1, 1280, 256, 256, 256, 256]
    - [64, 4888.0]
  - - [256, 128, 1, 3328, 256, 256, 256, 128]
    - [68, 4018.0]
  - - [64, 256, 1, 256, 64, 64, 64, 256]
    - [72, 699.0]
  - - [64, 704, 1, 3328, 64, 64, 64, 704]
    - [104, 4946.0]
  - - [128, 448, 1, 3328, 128, 128, 128, 448]
    - [66, 5626.0]
  - - [256, 64, 1, 3328, 256, 256, 256, 64]
    - [68, 2130.0]
  - - [128, 128, 1, 256, 128, 128, 128, 128]
    - [89, 1128.0]
- null
- null
- DeviceEfficiency
...
