library/src/blas3/Tensile/Logic/asm_full/navi22_Cijk_Alik_Bjlk_HBH_GB.yaml
---
- {MinimumRequiredVersion: 4.28.0}
- navi22
- gfx1031
    SolutionIndex: 0
    SolutionNameMin: Cijk_Alik_Bjlk_HBH_GB_MT64x64x16_SN_SU0_SUM0_TT8_8_WG8_8_1_WGM1
    SolutionIndex: 1
    SolutionNameMin: Cijk_Alik_Bjlk_HBH_GB_MT64x64x16_SN_SU32_SUM3_TT8_8_WG8_8_1_WGM1
    SolutionIndex: 2
    SolutionNameMin: Cijk_Alik_Bjlk_HBH_GB_MT128x128x16_SN_SU32_SUM3_TT8_8_WG16_16_1_WGM1
    SolutionIndex: 3
    SolutionNameMin: Cijk_Alik_Bjlk_HBH_GB_MT64x64x32_SN_SU32_SUM3_TT8_8_WG8_8_1_WGM1
    SolutionIndex: 4
    SolutionNameMin: Cijk_Alik_Bjlk_HBH_GB_MT64x64x16_SN_SU0_SUM0_TT8_8_WG8_8_1_WGM4
    SolutionIndex: 5
    SolutionNameMin: Cijk_Alik_Bjlk_HBH_GB_MT64x64x16_SN_SU0_SUM0_TT8_8_WG8_8_1_WGM8
    SolutionIndex: 6
    SolutionNameMin: Cijk_Alik_Bjlk_HBH_GB_MT16x16x8_SN_SU0_SUM0_TT2_2_WG8_8_1_WGM1
    SolutionIndex: 7
    SolutionNameMin: Cijk_Alik_Bjlk_HBH_GB_MT32x16x8_SN_SU0_SUM0_TT2_2_WG16_8_1_WGM1
    SolutionIndex: 8
    SolutionNameMin: Cijk_Alik_Bjlk_HBH_GB_MT32x32x8_SN_SU0_SUM0_TT2_2_WG16_16_1_WGM1
    SolutionIndex: 9
    SolutionNameMin: Cijk_Alik_Bjlk_HBH_GB_MT64x64x8_SN_SU0_SUM0_TT4_4_WG16_16_1_WGM1
    SolutionIndex: 10
    SolutionNameMin: Cijk_Alik_Bjlk_HBH_GB_MT16x16x16_SN_SU0_SUM0_TT2_2_WG8_8_1_WGM1
    SolutionIndex: 11
    SolutionNameMin: Cijk_Alik_Bjlk_HBH_GB_MT32x32x16_SN_SU0_SUM0_TT4_4_WG8_8_1_WGM1
    SolutionIndex: 12
    SolutionNameMin: Cijk_Alik_Bjlk_HBH_GB_MT16x16x32_SN_SU0_SUM0_TT2_2_WG8_8_1_WGM1
    SolutionIndex: 13
    SolutionNameMin: Cijk_Alik_Bjlk_HBH_GB_MT32x32x32_SN_SU0_SUM0_TT2_2_WG16_16_1_WGM1
    SolutionIndex: 14
    SolutionNameMin: Cijk_Alik_Bjlk_HBH_GB_MT32x32x8_SN_SU32_SUM3_TT4_4_WG8_8_1_WGM1
    SolutionIndex: 15
    SolutionNameMin: Cijk_Alik_Bjlk_HBH_GB_MT32x16x8_SN_SU32_SUM3_TT2_2_WG16_8_1_WGM1
    SolutionIndex: 16
    SolutionNameMin: Cijk_Alik_Bjlk_HBH_GB_MT64x64x8_SN_SU32_SUM3_TT4_4_WG16_16_1_WGM1
    SolutionIndex: 17
    SolutionNameMin: Cijk_Alik_Bjlk_HBH_GB_MT16x16x16_SN_SU32_SUM3_TT2_2_WG8_8_1_WGM1
    SolutionIndex: 18
    SolutionNameMin: Cijk_Alik_Bjlk_HBH_GB_MT32x32x16_SN_SU32_SUM3_TT4_4_WG8_8_1_WGM1
    SolutionIndex: 19
    SolutionNameMin: Cijk_Alik_Bjlk_HBH_GB_MT32x16x16_SN_SU32_SUM3_TT2_2_WG16_8_1_WGM1
    SolutionIndex: 20
    SolutionNameMin: Cijk_Alik_Bjlk_HBH_GB_MT64x64x16_SN_SU32_SUM3_TT4_4_WG16_16_1_WGM1
    SolutionIndex: 21
    SolutionNameMin: Cijk_Alik_Bjlk_HBH_GB_MT16x16x32_SN_SU32_SUM3_TT2_2_WG8_8_1_WGM1
    SolutionIndex: 22
    SolutionNameMin: Cijk_Alik_Bjlk_HBH_GB_MT32x16x8_SN_SU0_SUM0_TT2_2_WG16_8_1_WGM4
    SolutionIndex: 23
    SolutionNameMin: Cijk_Alik_Bjlk_HBH_GB_MT64x64x8_SN_SU0_SUM0_TT4_4_WG16_16_1_WGM4
    SolutionIndex: 24
    SolutionNameMin: Cijk_Alik_Bjlk_HBH_GB_MT16x16x16_SN_SU0_SUM0_TT2_2_WG8_8_1_WGM4
    SolutionIndex: 25
    SolutionNameMin: Cijk_Alik_Bjlk_HBH_GB_MT32x32x16_SN_SU0_SUM0_TT4_4_WG8_8_1_WGM4
    SolutionIndex: 26
    SolutionNameMin: Cijk_Alik_Bjlk_HBH_GB_MT16x16x32_SN_SU0_SUM0_TT2_2_WG8_8_1_WGM4
    SolutionIndex: 27
    SolutionNameMin: Cijk_Alik_Bjlk_HBH_GB_MT32x32x8_SN_SU32_SUM3_TT2_2_WG16_16_1_WGM4
    SolutionIndex: 28
    SolutionNameMin: Cijk_Alik_Bjlk_HBH_GB_MT16x16x16_SN_SU32_SUM3_TT2_2_WG8_8_1_WGM4
    SolutionIndex: 29
    SolutionNameMin: Cijk_Alik_Bjlk_HBH_GB_MT16x16x32_SN_SU32_SUM3_TT2_2_WG8_8_1_WGM4
    SolutionIndex: 30
    SolutionNameMin: Cijk_Alik_Bjlk_HBH_GB_MT32x16x32_SN_SU32_SUM3_TT2_2_WG16_8_1_WGM4
    SolutionIndex: 31
    SolutionNameMin: Cijk_Alik_Bjlk_HBH_GB_MT16x16x8_SN_SU0_SUM0_TT2_2_WG8_8_1_WGM8
    SolutionIndex: 32
    SolutionNameMin: Cijk_Alik_Bjlk_HBH_GB_MT64x64x8_SN_SU0_SUM0_TT4_4_WG16_16_1_WGM8
    SolutionIndex: 33
    SolutionNameMin: Cijk_Alik_Bjlk_HBH_GB_MT32x16x16_SN_SU0_SUM0_TT2_2_WG16_8_1_WGM8
    SolutionIndex: 34
    SolutionNameMin: Cijk_Alik_Bjlk_HBH_GB_MT16x16x32_SN_SU0_SUM0_TT2_2_WG8_8_1_WGM8
    SolutionIndex: 35
    SolutionNameMin: Cijk_Alik_Bjlk_HBH_GB_MT32x32x8_SN_SU32_SUM3_TT4_4_WG8_8_1_WGM8
    SolutionIndex: 36
    SolutionNameMin: Cijk_Alik_Bjlk_HBH_GB_MT32x16x8_SN_SU32_SUM3_TT2_2_WG16_8_1_WGM8
    SolutionIndex: 37
    SolutionNameMin: Cijk_Alik_Bjlk_HBH_GB_MT64x64x8_SN_SU32_SUM3_TT4_4_WG16_16_1_WGM8
    SolutionIndex: 38
    SolutionNameMin: Cijk_Alik_Bjlk_HBH_GB_MT16x16x16_SN_SU32_SUM3_TT2_2_WG8_8_1_WGM8
    SolutionIndex: 39
    SolutionNameMin: Cijk_Alik_Bjlk_HBH_GB_MT32x32x16_SN_SU32_SUM3_TT4_4_WG8_8_1_WGM8
    SolutionIndex: 40
    SolutionNameMin: Cijk_Alik_Bjlk_HBH_GB_MT32x32x16_SN_SU32_SUM3_TT2_2_WG16_16_1_WGM8
    SolutionIndex: 41
    SolutionNameMin: Cijk_Alik_Bjlk_HBH_GB_MT16x16x32_SN_SU32_SUM3_TT2_2_WG8_8_1_WGM8
    SolutionIndex: 42
    SolutionNameMin: Cijk_Alik_Bjlk_HBH_GB_MT32x32x32_SN_SU32_SUM3_TT4_4_WG8_8_1_WGM8
    SolutionIndex: 43
    SolutionNameMin: Cijk_Alik_Bjlk_HBH_GB_MT16x32x8_SN_SU0_SUM0_TT2_4_WG8_8_1_WGM1
    SolutionIndex: 44
    SolutionNameMin: Cijk_Alik_Bjlk_HBH_GB_MT16x32x16_SN_SU0_SUM0_TT2_4_WG8_8_1_WGM1
    SolutionIndex: 45
    SolutionNameMin: Cijk_Alik_Bjlk_HBH_GB_MT16x32x32_SN_SU0_SUM0_TT2_4_WG8_8_1_WGM1
    SolutionIndex: 46
    SolutionNameMin: Cijk_Alik_Bjlk_HBH_GB_MT16x32x16_SN_SU32_SUM3_TT2_4_WG8_8_1_WGM1
    SolutionIndex: 47
    SolutionNameMin: Cijk_Alik_Bjlk_HBH_GB_MT16x32x32_SN_SU32_SUM3_TT2_4_WG8_8_1_WGM1
    SolutionIndex: 48
    SolutionNameMin: Cijk_Alik_Bjlk_HBH_GB_MT16x32x16_SN_SU0_SUM0_TT2_4_WG8_8_1_WGM4
    SolutionIndex: 49
    SolutionNameMin: Cijk_Alik_Bjlk_HBH_GB_MT16x32x16_SN_SU32_SUM3_TT2_4_WG8_8_1_WGM4
    SolutionIndex: 50
    SolutionNameMin: Cijk_Alik_Bjlk_HBH_GB_MT16x32x32_SN_SU32_SUM3_TT2_4_WG8_8_1_WGM4
    SolutionIndex: 51
    SolutionNameMin: Cijk_Alik_Bjlk_HBH_GB_MT16x32x16_SN_SU0_SUM0_TT2_4_WG8_8_1_WGM8
    SolutionIndex: 52
    SolutionNameMin: Cijk_Alik_Bjlk_HBH_GB_MT16x32x32_SN_SU0_SUM0_TT2_4_WG8_8_1_WGM8
- - - [64, 5056, 1, 256, 64, 64, 256, 5056]
    - [5, 9392.0]
  - - [64, 6784, 1, 3328, 64, 64, 3328, 6784]
    - [5, 12549.0]
  - - [64, 5056, 1, 3328, 64, 64, 3328, 5056]
    - [4, 13401.0]
  - - [64, 6784, 1, 1280, 64, 64, 1280, 6784]
    - [0, 12087.0]
  - - [64, 6784, 1, 256, 64, 64, 256, 6784]
    - [5, 8472.0]
  - - [64, 5056, 1, 1280, 64, 64, 1280, 5056]
    - [0, 11943.0]
  - - [64, 5888, 1, 3328, 64, 64, 3328, 5888]
    - [0, 11262.0]
  - - [64, 5888, 1, 1280, 64, 64, 1280, 5888]
    - [3, 11140.0]
  - - [64, 5888, 1, 256, 64, 64, 256, 5888]
    - [1, 7490.0]
  - - [1024, 1024, 1, 1024, 1024, 1024, 1024, 1024]
    - [2, 14546.0]
  - - [64, 1408, 1, 3328, 64, 64, 3328, 1408]
    - [25, 4993.0]
  - - [64, 1856, 1, 256, 64, 64, 256, 1856]
    - [14, 4707.0]
  - - [64, 2368, 1, 3328, 64, 64, 3328, 2368]
    - [9, 7032.0]
  - - [64, 3584, 1, 1280, 64, 64, 1280, 3584]
    - [37, 7217.0]
  - - [64, 2944, 1, 256, 64, 64, 256, 2944]
    - [37, 4393.0]
  - - [64, 1408, 1, 1280, 64, 64, 1280, 1408]
    - [25, 4353.0]
  - - [64, 2368, 1, 1280, 64, 64, 1280, 2368]
    - [9, 6441.0]
  - - [64, 3584, 1, 3328, 64, 64, 3328, 3584]
    - [23, 7849.0]
  - - [64, 1856, 1, 3328, 64, 64, 3328, 1856]
    - [11, 5558.0]
  - - [64, 1856, 1, 1280, 64, 64, 1280, 1856]
    - [39, 5193.0]
  - - [64, 4288, 1, 256, 64, 64, 256, 4288]
    - [16, 5121.0]
  - - [64, 2944, 1, 3328, 64, 64, 3328, 2944]
    - [32, 6385.0]
  - - [64, 4288, 1, 1280, 64, 64, 1280, 4288]
    - [32, 6694.0]
  - - [64, 2944, 1, 1280, 64, 64, 1280, 2944]
    - [32, 5973.0]
  - - [64, 1408, 1, 256, 64, 64, 256, 1408]
    - [35, 2841.0]
  - - [64, 2368, 1, 256, 64, 64, 256, 2368]
    - [16, 4226.0]
  - - [64, 3584, 1, 256, 64, 64, 256, 3584]
    - [23, 5252.0]
  - - [64, 4288, 1, 3328, 64, 64, 3328, 4288]
    - [32, 7055.0]
  - - [1, 2944, 1, 3328, 1, 1, 3328, 2944]
    - [46, 274.0]
  - - [1, 2368, 1, 1280, 1, 1, 1280, 2368]
    - [45, 223.0]
  - - [1, 1408, 1, 1280, 1, 1, 1280, 1408]
    - [52, 129.0]
  - - [1, 2368, 1, 3328, 1, 1, 3328, 2368]
    - [46, 235.0]
  - - [1, 3584, 1, 1280, 1, 1, 1280, 3584]
    - [44, 250.0]
  - - [1, 2944, 1, 1, 1, 1, 1, 2944]
    - [6, 1.0]
  - - [1, 1408, 1, 3328, 1, 1, 3328, 1408]
    - [50, 164.0]
  - - [1, 2944, 1, 256, 1, 1, 256, 2944]
    - [10, 108.0]
  - - [1, 5056, 1, 256, 1, 1, 256, 5056]
    - [44, 170.0]
  - - [1, 1856, 1, 256, 1, 1, 256, 1856]
    - [52, 99.0]
  - - [1, 1856, 1, 1280, 1, 1, 1280, 1856]
    - [45, 161.0]
  - - [1, 4288, 1, 1280, 1, 1, 1280, 4288]
    - [48, 255.0]
  - - [1, 1408, 1, 1, 1, 1, 1, 1408]
    - [27, 1.0]
  - - [1, 1408, 1, 256, 1, 1, 256, 1408]
    - [17, 63.0]
  - - [1, 2368, 1, 256, 1, 1, 256, 2368]
    - [24, 94.0]
  - - [1, 4288, 1, 1, 1, 1, 1, 4288]
    - [6, 1.0]
  - - [1, 1856, 1, 3328, 1, 1, 3328, 1856]
    - [47, 200.0]
  - - [1, 4288, 1, 3328, 1, 1, 3328, 4288]
    - [51, 302.0]
  - - [1, 2368, 1, 1, 1, 1, 1, 2368]
    - [6, 1.0]
  - - [1, 3584, 1, 3328, 1, 1, 3328, 3584]
    - [49, 316.0]
  - - [1, 5056, 1, 1, 1, 1, 1, 5056]
    - [8, 3.0]
  - - [1, 3584, 1, 256, 1, 1, 256, 3584]
    - [44, 189.0]
  - - [1, 5056, 1, 1280, 1, 1, 1280, 5056]
    - [44, 313.0]
  - - [1, 3584, 1, 1, 1, 1, 1, 3584]
    - [43, 2.0]
  - - [1, 2944, 1, 1280, 1, 1, 1280, 2944]
    - [51, 250.0]
  - - [1, 1856, 1, 1, 1, 1, 1, 1856]
    - [43, 1.0]
  - - [1, 4288, 1, 256, 1, 1, 256, 4288]
    - [48, 211.0]
  - - [64, 448, 1, 3328, 64, 64, 3328, 448]
    - [10, 3155.0]
  - - [1, 64, 1, 1280, 1, 1, 1280, 64]
    - [29, 9.0]
  - - [64, 128, 1, 256, 64, 64, 256, 128]
    - [19, 659.0]
  - - [128, 64, 1, 1280, 128, 128, 1280, 64]
    - [21, 950.0]
  - - [1, 128, 1, 1, 1, 1, 1, 128]
    - [42, 0.05]
  - - [64, 1024, 1, 3328, 64, 64, 3328, 1024]
    - [18, 4627.0]
  - - [1, 64, 1, 3328, 1, 1, 3328, 64]
    - [29, 10.0]
  - - [64, 448, 1, 1280, 64, 64, 1280, 448]
    - [40, 2760.0]
  - - [1, 256, 1, 1280, 1, 1, 1280, 256]
    - [21, 28.0]
  - - [64, 64, 1, 1280, 64, 64, 1280, 64]
    - [41, 492.0]
  - - [1, 1, 1, 3328, 1, 1, 3328, 1]
    - [7, 0.12]
  - - [1, 64, 1, 1, 1, 1, 1, 64]
    - [31, 0.03]
  - - [1, 128, 1, 1280, 1, 1, 1280, 128]
    - [30, 15.0]
  - - [64, 1024, 1, 1280, 64, 64, 1280, 1024]
    - [20, 4080.0]
  - - [64, 256, 1, 1280, 64, 64, 1280, 256]
    - [28, 1689.0]
  - - [1, 1024, 1, 256, 1, 1, 256, 1024]
    - [6, 50.0]
  - - [1, 704, 1, 3328, 1, 1, 3328, 704]
    - [29, 97.0]
  - - [1, 256, 1, 1, 1, 1, 1, 256]
    - [22, 0.07]
  - - [128, 64, 1, 256, 128, 128, 256, 64]
    - [17, 369.0]
  - - [64, 128, 1, 3328, 64, 64, 3328, 128]
    - [29, 1208.0]
  - - [64, 256, 1, 3328, 64, 64, 3328, 256]
    - [13, 2097.0]
  - - [1, 1, 1, 256, 1, 1, 256, 1]
    - [7, 0.04]
  - - [1, 704, 1, 1, 1, 1, 1, 704]
    - [7, 0.18]
  - - [1, 704, 1, 1280, 1, 1, 1280, 704]
    - [21, 74.0]
  - - [64, 448, 1, 256, 64, 64, 256, 448]
    - [28, 1219.0]
  - - [1, 448, 1, 1280, 1, 1, 1280, 448]
    - [21, 49.0]
  - - [64, 128, 1, 1280, 64, 64, 1280, 128]
    - [29, 925.0]
  - - [1, 1, 1, 1, 1, 1, 1, 1]
    - [7, 0.00025125627902704875]
  - - [256, 64, 1, 256, 256, 256, 256, 64]
    - [33, 1178.0]
  - - [1, 448, 1, 3328, 1, 1, 3328, 448]
    - [41, 70.0]
  - - [1, 128, 1, 256, 1, 1, 256, 128]
    - [17, 6.0]
  - - [1, 1024, 1, 3328, 1, 1, 3328, 1024]
    - [26, 120.0]
  - - [64, 1024, 1, 256, 64, 64, 256, 1024]
    - [35, 2249.0]
  - - [64, 256, 1, 256, 64, 64, 256, 256]
    - [17, 731.0]
  - - [1, 1024, 1, 1280, 1, 1, 1280, 1024]
    - [34, 109.0]
  - - [1, 1, 1, 1280, 1, 1, 1280, 1]
    - [15, 0.11]
  - - [64, 704, 1, 256, 64, 64, 256, 704]
    - [15, 2586.0]
  - - [64, 64, 1, 256, 64, 64, 256, 64]
    - [17, 192.0]
  - - [128, 64, 1, 3328, 128, 128, 3328, 64]
    - [21, 1256.0]
  - - [1, 448, 1, 256, 1, 1, 256, 448]
    - [36, 27.0]
  - - [1, 1024, 1, 1, 1, 1, 1, 1024]
    - [8, 0.26]
  - - [64, 704, 1, 3328, 64, 64, 3328, 704]
    - [38, 3855.0]
  - - [1, 256, 1, 256, 1, 1, 256, 256]
    - [38, 12.0]
  - - [1, 704, 1, 256, 1, 1, 256, 704]
    - [17, 32.0]
  - - [1, 128, 1, 3328, 1, 1, 3328, 128]
    - [12, 18.0]
  - - [64, 64, 1, 3328, 64, 64, 3328, 64]
    - [29, 613.0]
  - - [1, 448, 1, 1, 1, 1, 1, 448]
    - [17, 0.24]
  - - [1, 64, 1, 256, 1, 1, 256, 64]
    - [17, 5.0]
  - - [64, 704, 1, 1280, 64, 64, 1280, 704]
    - [39, 3809.0]
  - - [1, 256, 1, 3328, 1, 1, 3328, 256]
    - [29, 40.0]
- null
- null
- DeviceEfficiency
...
