library/src/blas3/Tensile/Logic/asm_full/navi22_Cijk_Alik_Bljk_HBH.yaml
---
- {MinimumRequiredVersion: 4.28.0}
- navi22
- gfx1031
    SolutionIndex: 0
    SolutionNameMin: Cijk_Alik_Bljk_HBH_MT128x64x8_SN_SU0_SUM0_TT8_8_WG16_8_1_WGM1
    SolutionIndex: 1
    SolutionNameMin: Cijk_Alik_Bljk_HBH_MT128x128x8_SN_SU0_SUM0_TT8_16_WG16_8_1_WGM1
    SolutionIndex: 2
    SolutionNameMin: Cijk_Alik_Bljk_HBH_MT128x128x8_SN_SU0_SUM0_TT8_8_WG16_16_1_WGM1
    SolutionIndex: 3
    SolutionNameMin: Cijk_Alik_Bljk_HBH_MT128x256x8_SN_SU0_SUM0_TT8_16_WG16_16_1_WGM1
    SolutionIndex: 4
    SolutionNameMin: Cijk_Alik_Bljk_HBH_MT128x64x16_SN_SU0_SUM0_TT8_8_WG16_8_1_WGM1
    SolutionIndex: 5
    SolutionNameMin: Cijk_Alik_Bljk_HBH_MT128x128x16_SN_SU0_SUM0_TT8_16_WG16_8_1_WGM1
    SolutionIndex: 6
    SolutionNameMin: Cijk_Alik_Bljk_HBH_MT128x128x16_SN_SU0_SUM0_TT8_8_WG16_16_1_WGM1
    SolutionIndex: 7
    SolutionNameMin: Cijk_Alik_Bljk_HBH_MT128x256x16_SN_SU0_SUM0_TT8_16_WG16_16_1_WGM1
    SolutionIndex: 8
    SolutionNameMin: Cijk_Alik_Bljk_HBH_MT128x128x32_SN_SU0_SUM0_TT8_8_WG16_16_1_WGM1
    SolutionIndex: 9
    SolutionNameMin: Cijk_Alik_Bljk_HBH_MT128x64x8_SN_SU32_SUM3_TT8_8_WG16_8_1_WGM1
    SolutionIndex: 10
    SolutionNameMin: Cijk_Alik_Bljk_HBH_MT128x128x8_SN_SU32_SUM3_TT8_16_WG16_8_1_WGM1
    SolutionIndex: 11
    SolutionNameMin: Cijk_Alik_Bljk_HBH_MT128x128x8_SN_SU32_SUM3_TT8_8_WG16_16_1_WGM1
    SolutionIndex: 12
    SolutionNameMin: Cijk_Alik_Bljk_HBH_MT128x64x16_SN_SU32_SUM3_TT8_8_WG16_8_1_WGM1
    SolutionIndex: 13
    SolutionNameMin: Cijk_Alik_Bljk_HBH_MT128x128x16_SN_SU32_SUM3_TT8_16_WG16_8_1_WGM1
    SolutionIndex: 14
    SolutionNameMin: Cijk_Alik_Bljk_HBH_MT128x128x16_SN_SU32_SUM3_TT8_8_WG16_16_1_WGM1
    SolutionIndex: 15
    SolutionNameMin: Cijk_Alik_Bljk_HBH_MT128x256x16_SN_SU32_SUM3_TT8_16_WG16_16_1_WGM1
    SolutionIndex: 16
    SolutionNameMin: Cijk_Alik_Bljk_HBH_MT128x128x32_SN_SU32_SUM3_TT8_16_WG16_8_1_WGM1
    SolutionIndex: 17
    SolutionNameMin: Cijk_Alik_Bljk_HBH_MT128x256x32_SN_SU32_SUM3_TT8_16_WG16_16_1_WGM1
    SolutionIndex: 18
    SolutionNameMin: Cijk_Alik_Bljk_HBH_MT128x64x8_SN_SU0_SUM0_TT8_8_WG16_8_1_WGM4
    SolutionIndex: 19
    SolutionNameMin: Cijk_Alik_Bljk_HBH_MT128x128x8_SN_SU0_SUM0_TT8_16_WG16_8_1_WGM4
    SolutionIndex: 20
    SolutionNameMin: Cijk_Alik_Bljk_HBH_MT128x128x8_SN_SU0_SUM0_TT8_8_WG16_16_1_WGM4
    SolutionIndex: 21
    SolutionNameMin: Cijk_Alik_Bljk_HBH_MT128x256x8_SN_SU0_SUM0_TT8_16_WG16_16_1_WGM4
    SolutionIndex: 22
    SolutionNameMin: Cijk_Alik_Bljk_HBH_MT128x64x16_SN_SU0_SUM0_TT8_8_WG16_8_1_WGM4
    SolutionIndex: 23
    SolutionNameMin: Cijk_Alik_Bljk_HBH_MT128x128x16_SN_SU0_SUM0_TT8_16_WG16_8_1_WGM4
    SolutionIndex: 24
    SolutionNameMin: Cijk_Alik_Bljk_HBH_MT128x128x16_SN_SU0_SUM0_TT8_8_WG16_16_1_WGM4
    SolutionIndex: 25
    SolutionNameMin: Cijk_Alik_Bljk_HBH_MT128x256x16_SN_SU0_SUM0_TT8_16_WG16_16_1_WGM4
    SolutionIndex: 26
    SolutionNameMin: Cijk_Alik_Bljk_HBH_MT128x128x32_SN_SU0_SUM0_TT8_8_WG16_16_1_WGM4
    SolutionIndex: 27
    SolutionNameMin: Cijk_Alik_Bljk_HBH_MT128x256x32_SN_SU0_SUM0_TT8_16_WG16_16_1_WGM4
    SolutionIndex: 28
    SolutionNameMin: Cijk_Alik_Bljk_HBH_MT128x64x8_SN_SU32_SUM3_TT8_8_WG16_8_1_WGM4
    SolutionIndex: 29
    SolutionNameMin: Cijk_Alik_Bljk_HBH_MT128x128x8_SN_SU32_SUM3_TT8_16_WG16_8_1_WGM4
    SolutionIndex: 30
    SolutionNameMin: Cijk_Alik_Bljk_HBH_MT128x128x8_SN_SU32_SUM3_TT8_8_WG16_16_1_WGM4
    SolutionIndex: 31
    SolutionNameMin: Cijk_Alik_Bljk_HBH_MT128x64x16_SN_SU32_SUM3_TT8_8_WG16_8_1_WGM4
    SolutionIndex: 32
    SolutionNameMin: Cijk_Alik_Bljk_HBH_MT128x128x16_SN_SU32_SUM3_TT8_16_WG16_8_1_WGM4
    SolutionIndex: 33
    SolutionNameMin: Cijk_Alik_Bljk_HBH_MT128x128x16_SN_SU32_SUM3_TT8_8_WG16_16_1_WGM4
    SolutionIndex: 34
    SolutionNameMin: Cijk_Alik_Bljk_HBH_MT128x256x16_SN_SU32_SUM3_TT8_16_WG16_16_1_WGM4
    SolutionIndex: 35
    SolutionNameMin: Cijk_Alik_Bljk_HBH_MT128x128x32_SN_SU32_SUM3_TT8_16_WG16_8_1_WGM4
    SolutionIndex: 36
    SolutionNameMin: Cijk_Alik_Bljk_HBH_MT128x256x32_SN_SU32_SUM3_TT8_16_WG16_16_1_WGM4
    SolutionIndex: 37
    SolutionNameMin: Cijk_Alik_Bljk_HBH_MT128x64x8_SN_SU0_SUM0_TT8_8_WG16_8_1_WGM8
    SolutionIndex: 38
    SolutionNameMin: Cijk_Alik_Bljk_HBH_MT128x128x8_SN_SU0_SUM0_TT8_16_WG16_8_1_WGM8
    SolutionIndex: 39
    SolutionNameMin: Cijk_Alik_Bljk_HBH_MT128x128x8_SN_SU0_SUM0_TT8_8_WG16_16_1_WGM8
    SolutionIndex: 40
    SolutionNameMin: Cijk_Alik_Bljk_HBH_MT128x64x16_SN_SU0_SUM0_TT8_8_WG16_8_1_WGM8
    SolutionIndex: 41
    SolutionNameMin: Cijk_Alik_Bljk_HBH_MT128x128x16_SN_SU0_SUM0_TT8_16_WG16_8_1_WGM8
    SolutionIndex: 42
    SolutionNameMin: Cijk_Alik_Bljk_HBH_MT128x128x16_SN_SU0_SUM0_TT8_8_WG16_16_1_WGM8
    SolutionIndex: 43
    SolutionNameMin: Cijk_Alik_Bljk_HBH_MT128x256x16_SN_SU0_SUM0_TT8_16_WG16_16_1_WGM8
    SolutionIndex: 44
    SolutionNameMin: Cijk_Alik_Bljk_HBH_MT128x128x32_SN_SU0_SUM0_TT8_8_WG16_16_1_WGM8
    SolutionIndex: 45
    SolutionNameMin: Cijk_Alik_Bljk_HBH_MT128x64x8_SN_SU32_SUM3_TT8_8_WG16_8_1_WGM8
    SolutionIndex: 46
    SolutionNameMin: Cijk_Alik_Bljk_HBH_MT128x128x8_SN_SU32_SUM3_TT8_16_WG16_8_1_WGM8
    SolutionIndex: 47
    SolutionNameMin: Cijk_Alik_Bljk_HBH_MT128x128x8_SN_SU32_SUM3_TT8_8_WG16_16_1_WGM8
    SolutionIndex: 48
    SolutionNameMin: Cijk_Alik_Bljk_HBH_MT128x64x16_SN_SU32_SUM3_TT8_8_WG16_8_1_WGM8
    SolutionIndex: 49
    SolutionNameMin: Cijk_Alik_Bljk_HBH_MT128x128x16_SN_SU32_SUM3_TT8_16_WG16_8_1_WGM8
    SolutionIndex: 50
    SolutionNameMin: Cijk_Alik_Bljk_HBH_MT128x128x16_SN_SU32_SUM3_TT8_8_WG16_16_1_WGM8
    SolutionIndex: 51
    SolutionNameMin: Cijk_Alik_Bljk_HBH_MT128x256x16_SN_SU32_SUM3_TT8_16_WG16_16_1_WGM8
    SolutionIndex: 52
    SolutionNameMin: Cijk_Alik_Bljk_HBH_MT128x128x32_SN_SU32_SUM3_TT8_16_WG16_8_1_WGM8
    SolutionIndex: 53
    SolutionNameMin: Cijk_Alik_Bljk_HBH_MT128x128x32_SN_SU32_SUM3_TT8_8_WG16_16_1_WGM8
    SolutionIndex: 54
    SolutionNameMin: Cijk_Alik_Bljk_HBH_MT128x256x32_SN_SU32_SUM3_TT8_16_WG16_16_1_WGM8
    SolutionIndex: 55
    SolutionNameMin: Cijk_Alik_Bljk_HBH_MT128x256x16_SN_SU0_SUM0_TT8_16_WG16_16_1_WGM1
    SolutionIndex: 56
    SolutionNameMin: Cijk_Alik_Bljk_HBH_MT128x128x32_SN_SU32_SUM3_TT8_16_WG16_8_1_WGM4
    SolutionIndex: 57
    SolutionNameMin: Cijk_Alik_Bljk_HBH_MT128x128x32_SN_SU32_SUM3_TT8_8_WG16_16_1_WGM4
    SolutionIndex: 58
    SolutionNameMin: Cijk_Alik_Bljk_HBH_MT128x128x16_SN_SU0_SUM0_TT8_16_WG16_8_1_WGM8
    SolutionIndex: 59
    SolutionNameMin: Cijk_Alik_Bljk_HBH_MT128x128x32_SN_SU32_SUM3_TT8_16_WG16_8_1_WGM8
    SolutionIndex: 60
    SolutionNameMin: Cijk_Alik_Bljk_HBH_MT128x128x32_SN_SU32_SUM3_TT8_8_WG16_16_1_WGM8
    SolutionIndex: 61
    SolutionNameMin: Cijk_Alik_Bljk_HBH_MT64x64x8_SN_SU0_SUM0_TT8_8_WG8_8_1_WGM1
    SolutionIndex: 62
    SolutionNameMin: Cijk_Alik_Bljk_HBH_MT128x64x8_SN_SU0_SUM0_TT8_8_WG16_8_1_WGM1
    SolutionIndex: 63
    SolutionNameMin: Cijk_Alik_Bljk_HBH_MT128x128x8_SN_SU0_SUM0_TT8_8_WG16_16_1_WGM1
    SolutionIndex: 64
    SolutionNameMin: Cijk_Alik_Bljk_HBH_MT64x64x16_SN_SU0_SUM0_TT8_8_WG8_8_1_WGM1
    SolutionIndex: 65
    SolutionNameMin: Cijk_Alik_Bljk_HBH_MT128x64x16_SN_SU0_SUM0_TT8_8_WG16_8_1_WGM1
    SolutionIndex: 66
    SolutionNameMin: Cijk_Alik_Bljk_HBH_MT128x128x16_SN_SU0_SUM0_TT8_8_WG16_16_1_WGM1
    SolutionIndex: 67
    SolutionNameMin: Cijk_Alik_Bljk_HBH_MT64x64x32_SN_SU0_SUM0_TT8_8_WG8_8_1_WGM1
    SolutionIndex: 68
    SolutionNameMin: Cijk_Alik_Bljk_HBH_MT128x64x32_SN_SU0_SUM0_TT8_8_WG16_8_1_WGM1
    SolutionIndex: 69
    SolutionNameMin: Cijk_Alik_Bljk_HBH_MT64x64x8_SN_SU32_SUM3_TT8_8_WG8_8_1_WGM1
    SolutionIndex: 70
    SolutionNameMin: Cijk_Alik_Bljk_HBH_MT128x64x8_SN_SU32_SUM3_TT8_8_WG16_8_1_WGM1
    SolutionIndex: 71
    SolutionNameMin: Cijk_Alik_Bljk_HBH_MT128x128x8_SN_SU32_SUM3_TT8_8_WG16_16_1_WGM1
    SolutionIndex: 72
    SolutionNameMin: Cijk_Alik_Bljk_HBH_MT64x64x16_SN_SU32_SUM3_TT8_8_WG8_8_1_WGM1
    SolutionIndex: 73
    SolutionNameMin: Cijk_Alik_Bljk_HBH_MT128x64x16_SN_SU32_SUM3_TT8_8_WG16_8_1_WGM1
    SolutionIndex: 74
    SolutionNameMin: Cijk_Alik_Bljk_HBH_MT128x128x16_SN_SU32_SUM3_TT8_8_WG16_16_1_WGM1
    SolutionIndex: 75
    SolutionNameMin: Cijk_Alik_Bljk_HBH_MT64x64x32_SN_SU32_SUM3_TT8_8_WG8_8_1_WGM1
    SolutionIndex: 76
    SolutionNameMin: Cijk_Alik_Bljk_HBH_MT64x64x8_SN_SU0_SUM0_TT8_8_WG8_8_1_WGM4
    SolutionIndex: 77
    SolutionNameMin: Cijk_Alik_Bljk_HBH_MT128x64x8_SN_SU0_SUM0_TT8_8_WG16_8_1_WGM4
    SolutionIndex: 78
    SolutionNameMin: Cijk_Alik_Bljk_HBH_MT128x128x8_SN_SU0_SUM0_TT8_8_WG16_16_1_WGM4
    SolutionIndex: 79
    SolutionNameMin: Cijk_Alik_Bljk_HBH_MT64x64x16_SN_SU0_SUM0_TT8_8_WG8_8_1_WGM4
    SolutionIndex: 80
    SolutionNameMin: Cijk_Alik_Bljk_HBH_MT128x64x16_SN_SU0_SUM0_TT8_8_WG16_8_1_WGM4
    SolutionIndex: 81
    SolutionNameMin: Cijk_Alik_Bljk_HBH_MT128x128x16_SN_SU0_SUM0_TT8_8_WG16_16_1_WGM4
    SolutionIndex: 82
    SolutionNameMin: Cijk_Alik_Bljk_HBH_MT64x64x32_SN_SU0_SUM0_TT8_8_WG8_8_1_WGM4
    SolutionIndex: 83
    SolutionNameMin: Cijk_Alik_Bljk_HBH_MT128x64x32_SN_SU0_SUM0_TT8_8_WG16_8_1_WGM4
    SolutionIndex: 84
    SolutionNameMin: Cijk_Alik_Bljk_HBH_MT64x64x8_SN_SU32_SUM3_TT8_8_WG8_8_1_WGM4
    SolutionIndex: 85
    SolutionNameMin: Cijk_Alik_Bljk_HBH_MT128x64x8_SN_SU32_SUM3_TT8_8_WG16_8_1_WGM4
    SolutionIndex: 86
    SolutionNameMin: Cijk_Alik_Bljk_HBH_MT128x128x8_SN_SU32_SUM3_TT8_8_WG16_16_1_WGM4
    SolutionIndex: 87
    SolutionNameMin: Cijk_Alik_Bljk_HBH_MT64x64x16_SN_SU32_SUM3_TT8_8_WG8_8_1_WGM4
    SolutionIndex: 88
    SolutionNameMin: Cijk_Alik_Bljk_HBH_MT128x64x16_SN_SU32_SUM3_TT8_8_WG16_8_1_WGM4
    SolutionIndex: 89
    SolutionNameMin: Cijk_Alik_Bljk_HBH_MT128x128x16_SN_SU32_SUM3_TT8_8_WG16_16_1_WGM4
    SolutionIndex: 90
    SolutionNameMin: Cijk_Alik_Bljk_HBH_MT64x64x32_SN_SU32_SUM3_TT8_8_WG8_8_1_WGM4
    SolutionIndex: 91
    SolutionNameMin: Cijk_Alik_Bljk_HBH_MT128x64x32_SN_SU32_SUM3_TT8_8_WG16_8_1_WGM4
    SolutionIndex: 92
    SolutionNameMin: Cijk_Alik_Bljk_HBH_MT128x128x32_SN_SU32_SUM3_TT8_8_WG16_16_1_WGM4
    SolutionIndex: 93
    SolutionNameMin: Cijk_Alik_Bljk_HBH_MT64x64x8_SN_SU0_SUM0_TT8_8_WG8_8_1_WGM8
    SolutionIndex: 94
    SolutionNameMin: Cijk_Alik_Bljk_HBH_MT128x64x8_SN_SU0_SUM0_TT8_8_WG16_8_1_WGM8
    SolutionIndex: 95
    SolutionNameMin: Cijk_Alik_Bljk_HBH_MT128x128x8_SN_SU0_SUM0_TT8_8_WG16_16_1_WGM8
    SolutionIndex: 96
    SolutionNameMin: Cijk_Alik_Bljk_HBH_MT64x64x16_SN_SU0_SUM0_TT8_8_WG8_8_1_WGM8
    SolutionIndex: 97
    SolutionNameMin: Cijk_Alik_Bljk_HBH_MT128x64x16_SN_SU0_SUM0_TT8_8_WG16_8_1_WGM8
    SolutionIndex: 98
    SolutionNameMin: Cijk_Alik_Bljk_HBH_MT128x128x16_SN_SU0_SUM0_TT8_8_WG16_16_1_WGM8
    SolutionIndex: 99
    SolutionNameMin: Cijk_Alik_Bljk_HBH_MT128x64x32_SN_SU0_SUM0_TT8_8_WG16_8_1_WGM8
    SolutionIndex: 100
    SolutionNameMin: Cijk_Alik_Bljk_HBH_MT64x64x8_SN_SU32_SUM3_TT8_8_WG8_8_1_WGM8
    SolutionIndex: 101
    SolutionNameMin: Cijk_Alik_Bljk_HBH_MT128x64x8_SN_SU32_SUM3_TT8_8_WG16_8_1_WGM8
    SolutionIndex: 102
    SolutionNameMin: Cijk_Alik_Bljk_HBH_MT64x64x16_SN_SU32_SUM3_TT8_8_WG8_8_1_WGM8
    SolutionIndex: 103
    SolutionNameMin: Cijk_Alik_Bljk_HBH_MT128x64x16_SN_SU32_SUM3_TT8_8_WG16_8_1_WGM8
    SolutionIndex: 104
    SolutionNameMin: Cijk_Alik_Bljk_HBH_MT128x128x16_SN_SU32_SUM3_TT8_8_WG16_16_1_WGM8
    SolutionIndex: 105
    SolutionNameMin: Cijk_Alik_Bljk_HBH_MT64x64x32_SN_SU32_SUM3_TT8_8_WG8_8_1_WGM8
    SolutionIndex: 106
    SolutionNameMin: Cijk_Alik_Bljk_HBH_MT128x64x32_SN_SU32_SUM3_TT8_8_WG16_8_1_WGM8
    SolutionIndex: 107
    SolutionNameMin: Cijk_Alik_Bljk_HBH_MT128x128x16_SN_SU0_SUM0_TT8_8_WG16_16_1_WGM1
    SolutionIndex: 108
    SolutionNameMin: Cijk_Alik_Bljk_HBH_MT128x128x16_SN_SU32_SUM3_TT8_8_WG16_16_1_WGM1
    SolutionIndex: 109
    SolutionNameMin: Cijk_Alik_Bljk_HBH_MT128x64x16_SN_SU0_SUM0_TT8_8_WG16_8_1_WGM4
    SolutionIndex: 110
    SolutionNameMin: Cijk_Alik_Bljk_HBH_MT128x128x16_SN_SU0_SUM0_TT8_8_WG16_16_1_WGM4
    SolutionIndex: 111
    SolutionNameMin: Cijk_Alik_Bljk_HBH_MT64x64x16_SN_SU32_SUM3_TT8_8_WG8_8_1_WGM4
    SolutionIndex: 112
    SolutionNameMin: Cijk_Alik_Bljk_HBH_MT128x128x16_SN_SU32_SUM3_TT8_8_WG16_16_1_WGM4
    SolutionIndex: 113
    SolutionNameMin: Cijk_Alik_Bljk_HBH_MT64x64x32_SN_SU32_SUM3_TT8_8_WG8_8_1_WGM4
    SolutionIndex: 114
    SolutionNameMin: Cijk_Alik_Bljk_HBH_MT128x128x32_SN_SU32_SUM3_TT8_8_WG16_16_1_WGM4
    SolutionIndex: 115
    SolutionNameMin: Cijk_Alik_Bljk_HBH_MT64x64x16_SN_SU0_SUM0_TT8_8_WG8_8_1_WGM8
    SolutionIndex: 116
    SolutionNameMin: Cijk_Alik_Bljk_HBH_MT128x128x16_SN_SU0_SUM0_TT8_8_WG16_16_1_WGM8
    SolutionIndex: 117
    SolutionNameMin: Cijk_Alik_Bljk_HBH_MT128x128x32_SN_SU0_SUM0_TT8_8_WG16_16_1_WGM8
    SolutionIndex: 118
    SolutionNameMin: Cijk_Alik_Bljk_HBH_MT64x64x16_SN_SU32_SUM3_TT8_8_WG8_8_1_WGM8
    SolutionIndex: 119
    SolutionNameMin: Cijk_Alik_Bljk_HBH_MT128x64x16_SN_SU32_SUM3_TT8_8_WG16_8_1_WGM8
    SolutionIndex: 120
    SolutionNameMin: Cijk_Alik_Bljk_HBH_MT128x128x16_SN_SU32_SUM3_TT8_8_WG16_16_1_WGM8
    SolutionIndex: 121
    SolutionNameMin: Cijk_Alik_Bljk_HBH_MT128x128x32_SN_SU32_SUM3_TT8_8_WG16_16_1_WGM8
    SolutionIndex: 122
    SolutionNameMin: Cijk_Alik_Bljk_HBH_MT16x16x8_SN_SU0_SUM0_TT2_2_WG8_8_1_WGM1
    SolutionIndex: 123
    SolutionNameMin: Cijk_Alik_Bljk_HBH_MT32x32x8_SN_SU0_SUM0_TT4_4_WG8_8_1_WGM1
    SolutionIndex: 124
    SolutionNameMin: Cijk_Alik_Bljk_HBH_MT32x16x8_SN_SU0_SUM0_TT2_2_WG16_8_1_WGM1
    SolutionIndex: 125
    SolutionNameMin: Cijk_Alik_Bljk_HBH_MT64x32x8_SN_SU0_SUM0_TT4_4_WG16_8_1_WGM1
    SolutionIndex: 126
    SolutionNameMin: Cijk_Alik_Bljk_HBH_MT32x32x8_SN_SU0_SUM0_TT2_2_WG16_16_1_WGM1
    SolutionIndex: 127
    SolutionNameMin: Cijk_Alik_Bljk_HBH_MT64x64x8_SN_SU0_SUM0_TT4_4_WG16_16_1_WGM1
    SolutionIndex: 128
    SolutionNameMin: Cijk_Alik_Bljk_HBH_MT16x16x16_SN_SU0_SUM0_TT2_2_WG8_8_1_WGM1
    SolutionIndex: 129
    SolutionNameMin: Cijk_Alik_Bljk_HBH_MT32x32x16_SN_SU0_SUM0_TT4_4_WG8_8_1_WGM1
    SolutionIndex: 130
    SolutionNameMin: Cijk_Alik_Bljk_HBH_MT32x16x16_SN_SU0_SUM0_TT2_2_WG16_8_1_WGM1
    SolutionIndex: 131
    SolutionNameMin: Cijk_Alik_Bljk_HBH_MT32x32x16_SN_SU0_SUM0_TT2_2_WG16_16_1_WGM1
    SolutionIndex: 132
    SolutionNameMin: Cijk_Alik_Bljk_HBH_MT16x16x32_SN_SU0_SUM0_TT2_2_WG8_8_1_WGM1
    SolutionIndex: 133
    SolutionNameMin: Cijk_Alik_Bljk_HBH_MT32x32x32_SN_SU0_SUM0_TT4_4_WG8_8_1_WGM1
    SolutionIndex: 134
    SolutionNameMin: Cijk_Alik_Bljk_HBH_MT32x16x32_SN_SU0_SUM0_TT2_2_WG16_8_1_WGM1
    SolutionIndex: 135
    SolutionNameMin: Cijk_Alik_Bljk_HBH_MT32x32x32_SN_SU0_SUM0_TT2_2_WG16_16_1_WGM1
    SolutionIndex: 136
    SolutionNameMin: Cijk_Alik_Bljk_HBH_MT16x16x8_SN_SU32_SUM3_TT2_2_WG8_8_1_WGM1
    SolutionIndex: 137
    SolutionNameMin: Cijk_Alik_Bljk_HBH_MT32x32x8_SN_SU32_SUM3_TT4_4_WG8_8_1_WGM1
    SolutionIndex: 138
    SolutionNameMin: Cijk_Alik_Bljk_HBH_MT32x16x8_SN_SU32_SUM3_TT2_2_WG16_8_1_WGM1
    SolutionIndex: 139
    SolutionNameMin: Cijk_Alik_Bljk_HBH_MT64x32x8_SN_SU32_SUM3_TT4_4_WG16_8_1_WGM1
    SolutionIndex: 140
    SolutionNameMin: Cijk_Alik_Bljk_HBH_MT32x32x8_SN_SU32_SUM3_TT2_2_WG16_16_1_WGM1
    SolutionIndex: 141
    SolutionNameMin: Cijk_Alik_Bljk_HBH_MT64x64x8_SN_SU32_SUM3_TT4_4_WG16_16_1_WGM1
    SolutionIndex: 142
    SolutionNameMin: Cijk_Alik_Bljk_HBH_MT16x16x16_SN_SU32_SUM3_TT2_2_WG8_8_1_WGM1
    SolutionIndex: 143
    SolutionNameMin: Cijk_Alik_Bljk_HBH_MT32x32x16_SN_SU32_SUM3_TT4_4_WG8_8_1_WGM1
    SolutionIndex: 144
    SolutionNameMin: Cijk_Alik_Bljk_HBH_MT32x16x16_SN_SU32_SUM3_TT2_2_WG16_8_1_WGM1
    SolutionIndex: 145
    SolutionNameMin: Cijk_Alik_Bljk_HBH_MT32x32x16_SN_SU32_SUM3_TT2_2_WG16_16_1_WGM1
    SolutionIndex: 146
    SolutionNameMin: Cijk_Alik_Bljk_HBH_MT16x16x32_SN_SU32_SUM3_TT2_2_WG8_8_1_WGM1
    SolutionIndex: 147
    SolutionNameMin: Cijk_Alik_Bljk_HBH_MT32x32x32_SN_SU32_SUM3_TT4_4_WG8_8_1_WGM1
    SolutionIndex: 148
    SolutionNameMin: Cijk_Alik_Bljk_HBH_MT32x16x32_SN_SU32_SUM3_TT2_2_WG16_8_1_WGM1
    SolutionIndex: 149
    SolutionNameMin: Cijk_Alik_Bljk_HBH_MT16x16x8_SN_SU0_SUM0_TT2_2_WG8_8_1_WGM4
    SolutionIndex: 150
    SolutionNameMin: Cijk_Alik_Bljk_HBH_MT32x32x8_SN_SU0_SUM0_TT4_4_WG8_8_1_WGM4
    SolutionIndex: 151
    SolutionNameMin: Cijk_Alik_Bljk_HBH_MT32x16x8_SN_SU0_SUM0_TT2_2_WG16_8_1_WGM4
    SolutionIndex: 152
    SolutionNameMin: Cijk_Alik_Bljk_HBH_MT64x32x8_SN_SU0_SUM0_TT4_4_WG16_8_1_WGM4
    SolutionIndex: 153
    SolutionNameMin: Cijk_Alik_Bljk_HBH_MT32x32x8_SN_SU0_SUM0_TT2_2_WG16_16_1_WGM4
    SolutionIndex: 154
    SolutionNameMin: Cijk_Alik_Bljk_HBH_MT64x64x8_SN_SU0_SUM0_TT4_4_WG16_16_1_WGM4
    SolutionIndex: 155
    SolutionNameMin: Cijk_Alik_Bljk_HBH_MT16x16x16_SN_SU0_SUM0_TT2_2_WG8_8_1_WGM4
    SolutionIndex: 156
    SolutionNameMin: Cijk_Alik_Bljk_HBH_MT32x32x16_SN_SU0_SUM0_TT4_4_WG8_8_1_WGM4
    SolutionIndex: 157
    SolutionNameMin: Cijk_Alik_Bljk_HBH_MT32x16x16_SN_SU0_SUM0_TT2_2_WG16_8_1_WGM4
    SolutionIndex: 158
    SolutionNameMin: Cijk_Alik_Bljk_HBH_MT32x32x16_SN_SU0_SUM0_TT2_2_WG16_16_1_WGM4
    SolutionIndex: 159
    SolutionNameMin: Cijk_Alik_Bljk_HBH_MT16x16x32_SN_SU0_SUM0_TT2_2_WG8_8_1_WGM4
    SolutionIndex: 160
    SolutionNameMin: Cijk_Alik_Bljk_HBH_MT32x16x32_SN_SU0_SUM0_TT2_2_WG16_8_1_WGM4
    SolutionIndex: 161
    SolutionNameMin: Cijk_Alik_Bljk_HBH_MT16x16x8_SN_SU32_SUM3_TT2_2_WG8_8_1_WGM4
    SolutionIndex: 162
    SolutionNameMin: Cijk_Alik_Bljk_HBH_MT32x32x8_SN_SU32_SUM3_TT4_4_WG8_8_1_WGM4
    SolutionIndex: 163
    SolutionNameMin: Cijk_Alik_Bljk_HBH_MT32x16x8_SN_SU32_SUM3_TT2_2_WG16_8_1_WGM4
    SolutionIndex: 164
    SolutionNameMin: Cijk_Alik_Bljk_HBH_MT64x32x8_SN_SU32_SUM3_TT4_4_WG16_8_1_WGM4
    SolutionIndex: 165
    SolutionNameMin: Cijk_Alik_Bljk_HBH_MT32x32x8_SN_SU32_SUM3_TT2_2_WG16_16_1_WGM4
    SolutionIndex: 166
    SolutionNameMin: Cijk_Alik_Bljk_HBH_MT64x64x8_SN_SU32_SUM3_TT4_4_WG16_16_1_WGM4
    SolutionIndex: 167
    SolutionNameMin: Cijk_Alik_Bljk_HBH_MT16x16x16_SN_SU32_SUM3_TT2_2_WG8_8_1_WGM4
    SolutionIndex: 168
    SolutionNameMin: Cijk_Alik_Bljk_HBH_MT32x32x16_SN_SU32_SUM3_TT4_4_WG8_8_1_WGM4
    SolutionIndex: 169
    SolutionNameMin: Cijk_Alik_Bljk_HBH_MT32x16x16_SN_SU32_SUM3_TT2_2_WG16_8_1_WGM4
    SolutionIndex: 170
    SolutionNameMin: Cijk_Alik_Bljk_HBH_MT64x32x16_SN_SU32_SUM3_TT4_4_WG16_8_1_WGM4
    SolutionIndex: 171
    SolutionNameMin: Cijk_Alik_Bljk_HBH_MT16x16x32_SN_SU32_SUM3_TT2_2_WG8_8_1_WGM4
    SolutionIndex: 172
    SolutionNameMin: Cijk_Alik_Bljk_HBH_MT32x16x32_SN_SU32_SUM3_TT2_2_WG16_8_1_WGM4
    SolutionIndex: 173
    SolutionNameMin: Cijk_Alik_Bljk_HBH_MT32x32x32_SN_SU32_SUM3_TT2_2_WG16_16_1_WGM4
    SolutionIndex: 174
    SolutionNameMin: Cijk_Alik_Bljk_HBH_MT16x16x8_SN_SU0_SUM0_TT2_2_WG8_8_1_WGM8
    SolutionIndex: 175
    SolutionNameMin: Cijk_Alik_Bljk_HBH_MT32x32x8_SN_SU0_SUM0_TT4_4_WG8_8_1_WGM8
    SolutionIndex: 176
    SolutionNameMin: Cijk_Alik_Bljk_HBH_MT32x16x8_SN_SU0_SUM0_TT2_2_WG16_8_1_WGM8
    SolutionIndex: 177
    SolutionNameMin: Cijk_Alik_Bljk_HBH_MT64x32x8_SN_SU0_SUM0_TT4_4_WG16_8_1_WGM8
    SolutionIndex: 178
    SolutionNameMin: Cijk_Alik_Bljk_HBH_MT32x32x8_SN_SU0_SUM0_TT2_2_WG16_16_1_WGM8
    SolutionIndex: 179
    SolutionNameMin: Cijk_Alik_Bljk_HBH_MT64x64x8_SN_SU0_SUM0_TT4_4_WG16_16_1_WGM8
    SolutionIndex: 180
    SolutionNameMin: Cijk_Alik_Bljk_HBH_MT16x16x16_SN_SU0_SUM0_TT2_2_WG8_8_1_WGM8
    SolutionIndex: 181
    SolutionNameMin: Cijk_Alik_Bljk_HBH_MT32x32x16_SN_SU0_SUM0_TT4_4_WG8_8_1_WGM8
    SolutionIndex: 182
    SolutionNameMin: Cijk_Alik_Bljk_HBH_MT32x16x16_SN_SU0_SUM0_TT2_2_WG16_8_1_WGM8
    SolutionIndex: 183
    SolutionNameMin: Cijk_Alik_Bljk_HBH_MT64x32x16_SN_SU0_SUM0_TT4_4_WG16_8_1_WGM8
    SolutionIndex: 184
    SolutionNameMin: Cijk_Alik_Bljk_HBH_MT32x32x16_SN_SU0_SUM0_TT2_2_WG16_16_1_WGM8
    SolutionIndex: 185
    SolutionNameMin: Cijk_Alik_Bljk_HBH_MT64x64x16_SN_SU0_SUM0_TT4_4_WG16_16_1_WGM8
    SolutionIndex: 186
    SolutionNameMin: Cijk_Alik_Bljk_HBH_MT16x16x32_SN_SU0_SUM0_TT2_2_WG8_8_1_WGM8
    SolutionIndex: 187
    SolutionNameMin: Cijk_Alik_Bljk_HBH_MT32x32x32_SN_SU0_SUM0_TT2_2_WG16_16_1_WGM8
    SolutionIndex: 188
    SolutionNameMin: Cijk_Alik_Bljk_HBH_MT16x16x8_SN_SU32_SUM3_TT2_2_WG8_8_1_WGM8
    SolutionIndex: 189
    SolutionNameMin: Cijk_Alik_Bljk_HBH_MT32x32x8_SN_SU32_SUM3_TT4_4_WG8_8_1_WGM8
    SolutionIndex: 190
    SolutionNameMin: Cijk_Alik_Bljk_HBH_MT32x16x8_SN_SU32_SUM3_TT2_2_WG16_8_1_WGM8
    SolutionIndex: 191
    SolutionNameMin: Cijk_Alik_Bljk_HBH_MT64x32x8_SN_SU32_SUM3_TT4_4_WG16_8_1_WGM8
    SolutionIndex: 192
    SolutionNameMin: Cijk_Alik_Bljk_HBH_MT32x32x8_SN_SU32_SUM3_TT2_2_WG16_16_1_WGM8
    SolutionIndex: 193
    SolutionNameMin: Cijk_Alik_Bljk_HBH_MT64x64x8_SN_SU32_SUM3_TT4_4_WG16_16_1_WGM8
    SolutionIndex: 194
    SolutionNameMin: Cijk_Alik_Bljk_HBH_MT16x16x16_SN_SU32_SUM3_TT2_2_WG8_8_1_WGM8
    SolutionIndex: 195
    SolutionNameMin: Cijk_Alik_Bljk_HBH_MT32x32x16_SN_SU32_SUM3_TT4_4_WG8_8_1_WGM8
    SolutionIndex: 196
    SolutionNameMin: Cijk_Alik_Bljk_HBH_MT32x16x16_SN_SU32_SUM3_TT2_2_WG16_8_1_WGM8
    SolutionIndex: 197
    SolutionNameMin: Cijk_Alik_Bljk_HBH_MT16x16x32_SN_SU32_SUM3_TT2_2_WG8_8_1_WGM8
    SolutionIndex: 198
    SolutionNameMin: Cijk_Alik_Bljk_HBH_MT32x32x8_SN_SU0_SUM0_TT4_4_WG8_8_1_WGM1
    SolutionIndex: 199
    SolutionNameMin: Cijk_Alik_Bljk_HBH_MT32x16x8_SN_SU0_SUM0_TT2_2_WG16_8_1_WGM1
    SolutionIndex: 200
    SolutionNameMin: Cijk_Alik_Bljk_HBH_MT64x32x8_SN_SU0_SUM0_TT4_4_WG16_8_1_WGM1
    SolutionIndex: 201
    SolutionNameMin: Cijk_Alik_Bljk_HBH_MT64x64x8_SN_SU0_SUM0_TT4_4_WG16_16_1_WGM1
    SolutionIndex: 202
    SolutionNameMin: Cijk_Alik_Bljk_HBH_MT16x16x16_SN_SU0_SUM0_TT2_2_WG8_8_1_WGM1
    SolutionIndex: 203
    SolutionNameMin: Cijk_Alik_Bljk_HBH_MT32x32x16_SN_SU0_SUM0_TT4_4_WG8_8_1_WGM1
    SolutionIndex: 204
    SolutionNameMin: Cijk_Alik_Bljk_HBH_MT32x16x16_SN_SU0_SUM0_TT2_2_WG16_8_1_WGM1
    SolutionIndex: 205
    SolutionNameMin: Cijk_Alik_Bljk_HBH_MT16x16x32_SN_SU0_SUM0_TT2_2_WG8_8_1_WGM1
    SolutionIndex: 206
    SolutionNameMin: Cijk_Alik_Bljk_HBH_MT64x64x8_SN_SU32_SUM3_TT4_4_WG16_16_1_WGM1
    SolutionIndex: 207
    SolutionNameMin: Cijk_Alik_Bljk_HBH_MT32x32x8_SN_SU0_SUM0_TT4_4_WG8_8_1_WGM4
    SolutionIndex: 208
    SolutionNameMin: Cijk_Alik_Bljk_HBH_MT64x64x8_SN_SU0_SUM0_TT4_4_WG16_16_1_WGM4
    SolutionIndex: 209
    SolutionNameMin: Cijk_Alik_Bljk_HBH_MT16x16x16_SN_SU0_SUM0_TT2_2_WG8_8_1_WGM4
    SolutionIndex: 210
    SolutionNameMin: Cijk_Alik_Bljk_HBH_MT16x16x32_SN_SU0_SUM0_TT2_2_WG8_8_1_WGM4
    SolutionIndex: 211
    SolutionNameMin: Cijk_Alik_Bljk_HBH_MT32x32x8_SN_SU32_SUM3_TT4_4_WG8_8_1_WGM4
    SolutionIndex: 212
    SolutionNameMin: Cijk_Alik_Bljk_HBH_MT64x64x8_SN_SU32_SUM3_TT4_4_WG16_16_1_WGM4
    SolutionIndex: 213
    SolutionNameMin: Cijk_Alik_Bljk_HBH_MT16x16x16_SN_SU32_SUM3_TT2_2_WG8_8_1_WGM4
    SolutionIndex: 214
    SolutionNameMin: Cijk_Alik_Bljk_HBH_MT32x32x8_SN_SU0_SUM0_TT4_4_WG8_8_1_WGM8
    SolutionIndex: 215
    SolutionNameMin: Cijk_Alik_Bljk_HBH_MT64x32x8_SN_SU0_SUM0_TT4_4_WG16_8_1_WGM8
    SolutionIndex: 216
    SolutionNameMin: Cijk_Alik_Bljk_HBH_MT64x64x8_SN_SU0_SUM0_TT4_4_WG16_16_1_WGM8
    SolutionIndex: 217
    SolutionNameMin: Cijk_Alik_Bljk_HBH_MT16x16x16_SN_SU0_SUM0_TT2_2_WG8_8_1_WGM8
    SolutionIndex: 218
    SolutionNameMin: Cijk_Alik_Bljk_HBH_MT16x16x32_SN_SU0_SUM0_TT2_2_WG8_8_1_WGM8
    SolutionIndex: 219
    SolutionNameMin: Cijk_Alik_Bljk_HBH_MT64x32x8_SN_SU32_SUM3_TT4_4_WG16_8_1_WGM8
    SolutionIndex: 220
    SolutionNameMin: Cijk_Alik_Bljk_HBH_MT16x16x16_SN_SU32_SUM3_TT2_2_WG8_8_1_WGM8
    SolutionIndex: 221
    SolutionNameMin: Cijk_Alik_Bljk_HBH_MT32x16x32_SN_SU32_SUM3_TT2_2_WG16_8_1_WGM8
    SolutionIndex: 222
    SolutionNameMin: Cijk_Alik_Bljk_HBH_MT32x8x8_SN_SU0_SUM0_TT2_2_WG16_4_1_WGM1
    SolutionIndex: 223
    SolutionNameMin: Cijk_Alik_Bljk_HBH_MT64x8x8_SN_SU0_SUM0_TT4_2_WG16_4_1_WGM1
    SolutionIndex: 224
    SolutionNameMin: Cijk_Alik_Bljk_HBH_MT32x8x16_SN_SU0_SUM0_TT2_2_WG16_4_1_WGM1
    SolutionIndex: 225
    SolutionNameMin: Cijk_Alik_Bljk_HBH_MT32x8x8_SN_SU32_SUM3_TT2_2_WG16_4_1_WGM1
    SolutionIndex: 226
    SolutionNameMin: Cijk_Alik_Bljk_HBH_MT32x8x16_SN_SU32_SUM3_TT2_2_WG16_4_1_WGM1
    SolutionIndex: 227
    SolutionNameMin: Cijk_Alik_Bljk_HBH_MT64x8x16_SN_SU32_SUM3_TT2_2_WG32_4_1_WGM1
    SolutionIndex: 228
    SolutionNameMin: Cijk_Alik_Bljk_HBH_MT32x8x16_SN_SU0_SUM0_TT2_2_WG16_4_1_WGM4
    SolutionIndex: 229
    SolutionNameMin: Cijk_Alik_Bljk_HBH_MT32x8x16_SN_SU32_SUM3_TT2_2_WG16_4_1_WGM4
    SolutionIndex: 230
    SolutionNameMin: Cijk_Alik_Bljk_HBH_MT32x8x8_SN_SU0_SUM0_TT2_2_WG16_4_1_WGM8
    SolutionIndex: 231
    SolutionNameMin: Cijk_Alik_Bljk_HBH_MT64x16x8_SN_SU0_SUM0_TT4_2_WG16_8_1_WGM8
    SolutionIndex: 232
    SolutionNameMin: Cijk_Alik_Bljk_HBH_MT32x8x16_SN_SU32_SUM3_TT2_2_WG16_4_1_WGM8
    SolutionIndex: 233
    SolutionNameMin: Cijk_Alik_Bljk_HBH_MT32x8x32_SN_SU32_SUM3_TT2_2_WG16_4_1_WGM8
    SolutionIndex: 234
    SolutionNameMin: Cijk_Alik_Bljk_HBH_MT16x32x16_SN_SU0_SUM0_TT2_4_WG8_8_1_WGM1
    SolutionIndex: 235
    SolutionNameMin: Cijk_Alik_Bljk_HBH_MT16x32x8_SN_SU32_SUM3_TT2_4_WG8_8_1_WGM1
    SolutionIndex: 236
    SolutionNameMin: Cijk_Alik_Bljk_HBH_MT32x32x8_SN_SU32_SUM3_TT2_4_WG16_8_1_WGM1
    SolutionIndex: 237
    SolutionNameMin: Cijk_Alik_Bljk_HBH_MT32x32x8_SN_SU0_SUM0_TT2_4_WG16_8_1_WGM4
    SolutionIndex: 238
    SolutionNameMin: Cijk_Alik_Bljk_HBH_MT16x32x16_SN_SU0_SUM0_TT2_4_WG8_8_1_WGM4
    SolutionIndex: 239
    SolutionNameMin: Cijk_Alik_Bljk_HBH_MT16x32x8_SN_SU32_SUM3_TT2_4_WG8_8_1_WGM4
    SolutionIndex: 240
    SolutionNameMin: Cijk_Alik_Bljk_HBH_MT16x32x16_SN_SU32_SUM3_TT2_4_WG8_8_1_WGM4
    SolutionIndex: 241
    SolutionNameMin: Cijk_Alik_Bljk_HBH_MT32x32x8_SN_SU0_SUM0_TT2_4_WG16_8_1_WGM8
    SolutionIndex: 242
    SolutionNameMin: Cijk_Alik_Bljk_HBH_MT16x32x8_SN_SU32_SUM3_TT2_4_WG8_8_1_WGM8
    SolutionIndex: 243
    SolutionNameMin: Cijk_Alik_Bljk_HBH_MT16x32x16_SN_SU32_SUM3_TT2_4_WG8_8_1_WGM8
- - - [2368, 1024, 1, 1, 2368, 2368, 1, 1]
    - [2, 312.0]
  - - [5056, 1408, 1, 3328, 5056, 5056, 3328, 3328]
    - [5, 20679.0]
  - - [5056, 1856, 1, 3328, 5056, 5056, 3328, 3328]
    - [5, 19930.0]
  - - [448, 3584, 1, 3328, 448, 448, 3328, 3328]
    - [7, 16924.0]
  - - [5056, 4288, 1, 32, 5056, 5056, 32, 32]
    - [18, 15056.0]
  - - [3584, 1024, 1, 256, 3584, 3584, 256, 256]
    - [32, 18124.0]
  - - [1408, 3584, 1, 3328, 1408, 1408, 3328, 3328]
    - [7, 20760.0]
  - - [1024, 2368, 1, 3328, 1024, 1024, 3328, 3328]
    - [7, 19486.0]
  - - [448, 3584, 1, 32, 448, 448, 32, 32]
    - [28, 4866.0]
  - - [4288, 6784, 1, 3328, 4288, 4288, 3328, 3328]
    - [7, 21216.0]
  - - [5888, 4288, 1, 3328, 5888, 5888, 3328, 3328]
    - [15, 21550.0]
  - - [2368, 1408, 1, 32, 2368, 2368, 32, 32]
    - [45, 7776.0]
  - - [1024, 2944, 1, 1, 1024, 1024, 1, 1]
    - [22, 302.0]
  - - [2944, 3584, 1, 3328, 2944, 2944, 3328, 3328]
    - [7, 21001.0]
  - - [2368, 2944, 1, 1280, 2368, 2368, 1280, 1280]
    - [32, 20180.0]
  - - [6784, 5888, 1, 3328, 6784, 6784, 3328, 3328]
    - [15, 22111.0]
  - - [3584, 1408, 1, 32, 3584, 3584, 32, 32]
    - [11, 8367.0]
  - - [5056, 256, 1, 256, 5056, 5056, 256, 256]
    - [14, 15615.0]
  - - [1856, 2368, 1, 256, 1856, 1856, 256, 256]
    - [41, 17586.0]
  - - [2368, 1024, 1, 3328, 2368, 2368, 3328, 3328]
    - [7, 19873.0]
  - - [3584, 4288, 1, 32, 3584, 3584, 32, 32]
    - [31, 13940.0]
  - - [3584, 3584, 1, 1, 3584, 3584, 1, 1]
    - [30, 475.0]
  - - [1408, 2368, 1, 1, 1408, 1408, 1, 1]
    - [45, 317.0]
  - - [5056, 6784, 1, 1280, 5056, 5056, 1280, 1280]
    - [34, 21293.0]
  - - [4288, 5056, 1, 1, 4288, 4288, 1, 1]
    - [45, 454.0]
  - - [5056, 4288, 1, 1, 5056, 5056, 1, 1]
    - [28, 531.0]
  - - [1408, 4288, 1, 1280, 1408, 1408, 1280, 1280]
    - [49, 20254.0]
  - - [4288, 1024, 1, 3328, 4288, 4288, 3328, 3328]
    - [7, 20149.0]
  - - [1024, 5056, 1, 1, 1024, 1024, 1, 1]
    - [22, 384.0]
  - - [704, 3584, 1, 1280, 704, 704, 1280, 1280]
    - [13, 17025.0]
  - - [1856, 5056, 1, 256, 1856, 1856, 256, 256]
    - [23, 19102.0]
  - - [1408, 1024, 1, 1280, 1408, 1408, 1280, 1280]
    - [13, 17038.0]
  - - [5056, 5888, 1, 3328, 5056, 5056, 3328, 3328]
    - [25, 21703.0]
  - - [3584, 3584, 1, 1280, 3584, 3584, 1280, 1280]
    - [7, 21556.0]
  - - [2368, 3584, 1, 32, 2368, 2368, 32, 32]
    - [37, 10855.0]
  - - [2944, 2368, 1, 1, 2944, 2944, 1, 1]
    - [31, 349.0]
  - - [704, 4288, 1, 1, 704, 704, 1, 1]
    - [4, 316.0]
  - - [1024, 6784, 1, 1280, 1024, 1024, 1280, 1280]
    - [7, 20729.0]
  - - [1024, 3584, 1, 1, 1024, 1024, 1, 1]
    - [18, 324.0]
  - - [256, 5056, 1, 32, 256, 256, 32, 32]
    - [0, 8284.0]
  - - [2368, 5056, 1, 32, 2368, 2368, 32, 32]
    - [18, 11847.0]
  - - [6784, 1856, 1, 32, 6784, 6784, 32, 32]
    - [22, 10515.0]
  - - [5056, 704, 1, 1, 5056, 5056, 1, 1]
    - [18, 350.0]
  - - [2944, 4288, 1, 256, 2944, 2944, 256, 256]
    - [23, 19788.0]
  - - [5056, 704, 1, 32, 5056, 5056, 32, 32]
    - [45, 9306.0]
  - - [1856, 4288, 1, 3328, 1856, 1856, 3328, 3328]
    - [25, 20409.0]
  - - [6784, 4288, 1, 32, 6784, 6784, 32, 32]
    - [18, 14880.0]
  - - [5888, 5056, 1, 256, 5888, 5888, 256, 256]
    - [25, 20629.0]
  - - [3584, 2368, 1, 3328, 3584, 3584, 3328, 3328]
    - [5, 20426.0]
  - - [4288, 1856, 1, 1, 4288, 4288, 1, 1]
    - [50, 401.0]
  - - [1856, 2944, 1, 1, 1856, 1856, 1, 1]
    - [28, 380.0]
  - - [1856, 2368, 1, 32, 1856, 1856, 32, 32]
    - [28, 8992.0]
  - - [4288, 1856, 1, 32, 4288, 4288, 32, 32]
    - [0, 11901.0]
  - - [5056, 2368, 1, 256, 5056, 5056, 256, 256]
    - [13, 19286.0]
  - - [1408, 5888, 1, 256, 1408, 1408, 256, 256]
    - [7, 19988.0]
  - - [5056, 6784, 1, 1, 5056, 5056, 1, 1]
    - [40, 833.0]
  - - [1024, 1408, 1, 3328, 1024, 1024, 3328, 3328]
    - [13, 17672.0]
  - - [256, 5056, 1, 1280, 256, 256, 1280, 1280]
    - [51, 18445.0]
  - - [704, 2368, 1, 1, 704, 704, 1, 1]
    - [48, 189.0]
  - - [3584, 4288, 1, 1280, 3584, 3584, 1280, 1280]
    - [25, 21338.0]
  - - [3584, 2368, 1, 1, 3584, 3584, 1, 1]
    - [37, 355.0]
  - - [4288, 448, 1, 3328, 4288, 4288, 3328, 3328]
    - [32, 16914.0]
  - - [704, 6784, 1, 1280, 704, 704, 1280, 1280]
    - [13, 18647.0]
  - - [2368, 4288, 1, 32, 2368, 2368, 32, 32]
    - [18, 12402.0]
  - - [704, 5056, 1, 1280, 704, 704, 1280, 1280]
    - [7, 18567.0]
  - - [3584, 6784, 1, 32, 3584, 3584, 32, 32]
    - [29, 15202.0]
  - - [3584, 6784, 1, 1280, 3584, 3584, 1280, 1280]
    - [7, 21506.0]
  - - [4288, 4288, 1, 3328, 4288, 4288, 3328, 3328]
    - [34, 19814.0]
  - - [1408, 3584, 1, 1, 1408, 1408, 1, 1]
    - [20, 312.0]
  - - [4288, 1856, 1, 3328, 4288, 4288, 3328, 3328]
    - [49, 19622.0]
  - - [1856, 2944, 1, 1280, 1856, 1856, 1280, 1280]
    - [32, 19422.0]
  - - [5056, 1024, 1, 3328, 5056, 5056, 3328, 3328]
    - [7, 21004.0]
  - - [3584, 704, 1, 1, 3584, 3584, 1, 1]
    - [48, 277.0]
  - - [448, 5056, 1, 1, 448, 448, 1, 1]
    - [31, 217.0]
  - - [5888, 5888, 1, 256, 5888, 5888, 256, 256]
    - [43, 21240.0]
  - - [3584, 704, 1, 32, 3584, 3584, 32, 32]
    - [37, 10708.0]
  - - [448, 6784, 1, 3328, 448, 448, 3328, 3328]
    - [13, 17695.0]
  - - [6784, 4288, 1, 1, 6784, 6784, 1, 1]
    - [9, 848.0]
  - - [3584, 6784, 1, 1, 3584, 3584, 1, 1]
    - [40, 806.0]
  - - [1408, 2368, 1, 32, 1408, 1408, 32, 32]
    - [37, 8688.0]
  - - [448, 5056, 1, 32, 448, 448, 32, 32]
    - [45, 5931.0]
  - - [4288, 4288, 1, 1280, 4288, 4288, 1280, 1280]
    - [7, 21251.0]
  - - [6784, 1408, 1, 1, 6784, 6784, 1, 1]
    - [11, 412.0]
  - - [1856, 5888, 1, 3328, 1856, 1856, 3328, 3328]
    - [15, 19948.0]
  - - [3584, 1856, 1, 3328, 3584, 3584, 3328, 3328]
    - [32, 20180.0]
  - - [5056, 5888, 1, 1, 5056, 5056, 1, 1]
    - [18, 771.0]
  - - [2944, 1024, 1, 256, 2944, 2944, 256, 256]
    - [41, 16799.0]
  - - [2368, 4288, 1, 3328, 2368, 2368, 3328, 3328]
    - [7, 20296.0]
  - - [2944, 6784, 1, 256, 2944, 2944, 256, 256]
    - [41, 20749.0]
  - - [2368, 2368, 1, 1280, 2368, 2368, 1280, 1280]
    - [32, 18957.0]
  - - [3584, 3584, 1, 32, 3584, 3584, 32, 32]
    - [28, 13812.0]
  - - [2944, 2944, 1, 1280, 2944, 2944, 1280, 1280]
    - [13, 20807.0]
  - - [1408, 5056, 1, 1, 1408, 1408, 1, 1]
    - [12, 383.0]
  - - [2368, 6784, 1, 1, 2368, 2368, 1, 1]
    - [0, 420.0]
  - - [6784, 4288, 1, 1280, 6784, 6784, 1280, 1280]
    - [25, 21574.0]
  - - [2944, 704, 1, 256, 2944, 2944, 256, 256]
    - [23, 15972.0]
  - - [2368, 6784, 1, 1280, 2368, 2368, 1280, 1280]
    - [7, 20847.0]
  - - [704, 2944, 1, 3328, 704, 704, 3328, 3328]
    - [32, 18181.0]
  - - [5888, 256, 1, 1, 5888, 5888, 1, 1]
    - [24, 222.0]
  - - [5056, 6784, 1, 32, 5056, 5056, 32, 32]
    - [28, 14709.0]
  - - [448, 5056, 1, 1280, 448, 448, 1280, 1280]
    - [15, 17561.0]
  - - [256, 5888, 1, 3328, 256, 256, 3328, 3328]
    - [32, 18102.0]
  - - [5888, 1024, 1, 1, 5888, 5888, 1, 1]
    - [20, 378.0]
  - - [5888, 448, 1, 32, 5888, 5888, 32, 32]
    - [37, 7918.0]
  - - [6784, 2944, 1, 256, 6784, 6784, 256, 256]
    - [23, 20737.0]
  - - [4288, 2944, 1, 256, 4288, 4288, 256, 256]
    - [32, 19790.0]
  - - [448, 5888, 1, 3328, 448, 448, 3328, 3328]
    - [7, 17510.0]
  - - [1408, 4288, 1, 1, 1408, 1408, 1, 1]
    - [28, 333.0]
  - - [1408, 1856, 1, 3328, 1408, 1408, 3328, 3328]
    - [13, 18309.0]
  - - [3584, 1024, 1, 3328, 3584, 3584, 3328, 3328]
    - [25, 19687.0]
  - - [2944, 5888, 1, 3328, 2944, 2944, 3328, 3328]
    - [7, 21751.0]
  - - [448, 4288, 1, 3328, 448, 448, 3328, 3328]
    - [32, 16452.0]
  - - [704, 2368, 1, 256, 704, 704, 256, 256]
    - [13, 13617.0]
  - - [4288, 3584, 1, 3328, 4288, 4288, 3328, 3328]
    - [34, 20421.0]
  - - [1408, 1024, 1, 1, 1408, 1408, 1, 1]
    - [2, 174.0]
  - - [1408, 1024, 1, 256, 1408, 1408, 256, 256]
    - [23, 14024.0]
  - - [5056, 3584, 1, 1, 5056, 5056, 1, 1]
    - [22, 741.0]
  - - [6784, 6784, 1, 3328, 6784, 6784, 3328, 3328]
    - [15, 21615.0]
  - - [2368, 2944, 1, 3328, 2368, 2368, 3328, 3328]
    - [5, 20097.0]
  - - [5056, 3584, 1, 32, 5056, 5056, 32, 32]
    - [18, 14157.0]
  - - [5056, 3584, 1, 1280, 5056, 5056, 1280, 1280]
    - [25, 21581.0]
  - - [1856, 1856, 1, 256, 1856, 1856, 256, 256]
    - [5, 16765.0]
  - - [5888, 4288, 1, 1, 5888, 5888, 1, 1]
    - [48, 827.0]
  - - [5056, 704, 1, 256, 5056, 5056, 256, 256]
    - [25, 15560.0]
  - - [2368, 5056, 1, 256, 2368, 2368, 256, 256]
    - [32, 19394.0]
  - - [1024, 5056, 1, 256, 1024, 1024, 256, 256]
    - [32, 18956.0]
  - - [5888, 448, 1, 256, 5888, 5888, 256, 256]
    - [32, 15107.0]
  - - [6784, 5056, 1, 1280, 6784, 6784, 1280, 1280]
    - [43, 21563.0]
  - - [4288, 6784, 1, 1280, 4288, 4288, 1280, 1280]
    - [7, 21227.0]
  - - [704, 6784, 1, 3328, 704, 704, 3328, 3328]
    - [5, 18936.0]
  - - [2944, 1856, 1, 1, 2944, 2944, 1, 1]
    - [39, 368.0]
  - - [5888, 4288, 1, 1280, 5888, 5888, 1280, 1280]
    - [25, 21429.0]
  - - [5888, 3584, 1, 1280, 5888, 5888, 1280, 1280]
    - [25, 21745.0]
  - - [3584, 1408, 1, 1280, 3584, 3584, 1280, 1280]
    - [32, 20130.0]
  - - [1024, 2944, 1, 256, 1024, 1024, 256, 256]
    - [13, 17865.0]
  - - [2944, 1856, 1, 1280, 2944, 2944, 1280, 1280]
    - [49, 19439.0]
  - - [1024, 2368, 1, 1, 1024, 1024, 1, 1]
    - [31, 313.0]
  - - [2944, 3584, 1, 1280, 2944, 2944, 1280, 1280]
    - [7, 20990.0]
  - - [1856, 4288, 1, 256, 1856, 1856, 256, 256]
    - [41, 18785.0]
  - - [448, 3584, 1, 1, 448, 448, 1, 1]
    - [18, 247.0]
  - - [2368, 2944, 1, 32, 2368, 2368, 32, 32]
    - [33, 10328.0]
  - - [4288, 704, 1, 256, 4288, 4288, 256, 256]
    - [32, 16067.0]
  - - [1856, 1024, 1, 256, 1856, 1856, 256, 256]
    - [5, 16674.0]
  - - [704, 6784, 1, 32, 704, 704, 32, 32]
    - [9, 10497.0]
  - - [1024, 4288, 1, 1, 1024, 1024, 1, 1]
    - [1, 367.0]
  - - [1408, 5888, 1, 1280, 1408, 1408, 1280, 1280]
    - [7, 21250.0]
  - - [5056, 1856, 1, 256, 5056, 5056, 256, 256]
    - [41, 19099.0]
  - - [6784, 704, 1, 1280, 6784, 6784, 1280, 1280]
    - [43, 19197.0]
  - - [5888, 1024, 1, 256, 5888, 5888, 256, 256]
    - [23, 19558.0]
  - - [6784, 1856, 1, 3328, 6784, 6784, 3328, 3328]
    - [13, 19692.0]
  - - [2368, 5888, 1, 1280, 2368, 2368, 1280, 1280]
    - [25, 21143.0]
  - - [5888, 6784, 1, 32, 5888, 5888, 32, 32]
    - [38, 16921.0]
  - - [6784, 6784, 1, 32, 6784, 6784, 32, 32]
    - [10, 17408.0]
  - - [6784, 256, 1, 256, 6784, 6784, 256, 256]
    - [23, 16565.0]
  - - [2368, 3584, 1, 3328, 2368, 2368, 3328, 3328]
    - [7, 20587.0]
  - - [5888, 1024, 1, 1280, 5888, 5888, 1280, 1280]
    - [32, 20430.0]
  - - [5888, 6784, 1, 3328, 5888, 5888, 3328, 3328]
    - [7, 21691.0]
  - - [6784, 448, 1, 1, 6784, 6784, 1, 1]
    - [4, 293.0]
  - - [6784, 1856, 1, 1, 6784, 6784, 1, 1]
    - [37, 401.0]
  - - [2944, 2368, 1, 1280, 2944, 2944, 1280, 1280]
    - [32, 20219.0]
  - - [6784, 448, 1, 32, 6784, 6784, 32, 32]
    - [45, 9175.0]
  - - [6784, 448, 1, 3328, 6784, 6784, 3328, 3328]
    - [32, 17487.0]
  - - [448, 3584, 1, 1280, 448, 448, 1280, 1280]
    - [15, 16039.0]
  - - [1408, 6784, 1, 1280, 1408, 1408, 1280, 1280]
    - [43, 20953.0]
  - - [5056, 5888, 1, 1280, 5056, 5056, 1280, 1280]
    - [25, 21657.0]
  - - [5888, 704, 1, 1, 5888, 5888, 1, 1]
    - [9, 352.0]
  - - [3584, 1856, 1, 1, 3584, 3584, 1, 1]
    - [28, 341.0]
  - - [5056, 2944, 1, 32, 5056, 5056, 32, 32]
    - [18, 12151.0]
  - - [4288, 6784, 1, 1, 4288, 4288, 1, 1]
    - [50, 706.0]
  - - [1024, 6784, 1, 1, 1024, 1024, 1, 1]
    - [0, 467.0]
  - - [2368, 5888, 1, 32, 2368, 2368, 32, 32]
    - [22, 11493.0]
  - - [3584, 4288, 1, 1, 3584, 3584, 1, 1]
    - [12, 370.0]
  - - [5888, 1024, 1, 3328, 5888, 5888, 3328, 3328]
    - [32, 20575.0]
  - - [6784, 5888, 1, 256, 6784, 6784, 256, 256]
    - [25, 21243.0]
  - - [5056, 1024, 1, 1, 5056, 5056, 1, 1]
    - [18, 598.0]
  - - [4288, 2368, 1, 32, 4288, 4288, 32, 32]
    - [18, 15071.0]
  - - [704, 3584, 1, 1, 704, 704, 1, 1]
    - [18, 395.0]
  - - [6784, 704, 1, 32, 6784, 6784, 32, 32]
    - [37, 13085.0]
  - - [704, 5888, 1, 256, 704, 704, 256, 256]
    - [25, 17390.0]
  - - [2368, 3584, 1, 1280, 2368, 2368, 1280, 1280]
    - [7, 20391.0]
  - - [3584, 5056, 1, 32, 3584, 3584, 32, 32]
    - [28, 12761.0]
  - - [6784, 1856, 1, 1280, 6784, 6784, 1280, 1280]
    - [13, 20490.0]
  - - [5056, 5056, 1, 3328, 5056, 5056, 3328, 3328]
    - [15, 21485.0]
  - - [2368, 5056, 1, 1, 2368, 2368, 1, 1]
    - [39, 371.0]
  - - [5888, 1408, 1, 256, 5888, 5888, 256, 256]
    - [32, 19590.0]
  - - [2368, 1024, 1, 32, 2368, 2368, 32, 32]
    - [9, 8380.0]
  - - [4288, 1024, 1, 256, 4288, 4288, 256, 256]
    - [15, 18610.0]
  - - [4288, 5888, 1, 1280, 4288, 4288, 1280, 1280]
    - [7, 21684.0]
  - - [1856, 2944, 1, 3328, 1856, 1856, 3328, 3328]
    - [32, 19491.0]
  - - [5056, 5888, 1, 256, 5056, 5056, 256, 256]
    - [25, 20751.0]
  - - [5056, 256, 1, 3328, 5056, 5056, 3328, 3328]
    - [25, 20579.0]
  - - [1024, 5888, 1, 1280, 1024, 1024, 1280, 1280]
    - [32, 20299.0]
  - - [5888, 5056, 1, 1280, 5888, 5888, 1280, 1280]
    - [25, 21744.0]
  - - [5888, 2944, 1, 1, 5888, 5888, 1, 1]
    - [18, 402.0]
  - - [1408, 4288, 1, 3328, 1408, 1408, 3328, 3328]
    - [32, 20364.0]
  - - [704, 2944, 1, 32, 704, 704, 32, 32]
    - [24, 5901.0]
  - - [2944, 4288, 1, 3328, 2944, 2944, 3328, 3328]
    - [25, 21087.0]
  - - [5056, 2944, 1, 256, 5056, 5056, 256, 256]
    - [41, 20164.0]
  - - [2368, 1856, 1, 256, 2368, 2368, 256, 256]
    - [23, 17503.0]
  - - [2368, 4288, 1, 1280, 2368, 2368, 1280, 1280]
    - [7, 20292.0]
  - - [3584, 448, 1, 256, 3584, 3584, 256, 256]
    - [31, 14484.0]
  - - [256, 6784, 1, 256, 256, 256, 256, 256]
    - [5, 16358.0]
  - - [1024, 1408, 1, 1, 1024, 1024, 1, 1]
    - [20, 264.0]
  - - [256, 5888, 1, 1, 256, 256, 1, 1]
    - [9, 315.0]
  - - [2944, 2944, 1, 1, 2944, 2944, 1, 1]
    - [33, 523.0]
  - - [6784, 3584, 1, 256, 6784, 6784, 256, 256]
    - [15, 20998.0]
  - - [1408, 1856, 1, 256, 1408, 1408, 256, 256]
    - [23, 16526.0]
  - - [2944, 2944, 1, 32, 2944, 2944, 32, 32]
    - [37, 10792.0]
  - - [2944, 2944, 1, 3328, 2944, 2944, 3328, 3328]
    - [5, 20925.0]
  - - [6784, 1408, 1, 32, 6784, 6784, 32, 32]
    - [0, 12736.0]
  - - [2368, 6784, 1, 3328, 2368, 2368, 3328, 3328]
    - [23, 19290.0]
  - - [4288, 3584, 1, 32, 4288, 4288, 32, 32]
    - [37, 15067.0]
  - - [3584, 704, 1, 1280, 3584, 3584, 1280, 1280]
    - [32, 17155.0]
  - - [448, 5056, 1, 3328, 448, 448, 3328, 3328]
    - [25, 18282.0]
  - - [4288, 448, 1, 256, 4288, 4288, 256, 256]
    - [32, 13415.0]
  - - [5056, 256, 1, 1280, 5056, 5056, 1280, 1280]
    - [34, 18896.0]
  - - [2944, 5888, 1, 32, 2944, 2944, 32, 32]
    - [9, 15617.0]
  - - [3584, 5056, 1, 256, 3584, 3584, 256, 256]
    - [13, 20187.0]
  - - [3584, 2368, 1, 256, 3584, 3584, 256, 256]
    - [23, 19207.0]
  - - [4288, 4288, 1, 256, 4288, 4288, 256, 256]
    - [15, 20044.0]
  - - [448, 5056, 1, 256, 448, 448, 256, 256]
    - [41, 15689.0]
  - - [4288, 704, 1, 1280, 4288, 4288, 1280, 1280]
    - [13, 17290.0]
  - - [2368, 704, 1, 1, 2368, 2368, 1, 1]
    - [0, 218.0]
  - - [1408, 1856, 1, 1280, 1408, 1408, 1280, 1280]
    - [49, 17695.0]
  - - [3584, 4288, 1, 3328, 3584, 3584, 3328, 3328]
    - [15, 19803.0]
  - - [448, 4288, 1, 32, 448, 448, 32, 32]
    - [45, 5166.0]
  - - [448, 4288, 1, 1280, 448, 448, 1280, 1280]
    - [32, 16306.0]
  - - [5056, 1024, 1, 256, 5056, 5056, 256, 256]
    - [32, 18286.0]
  - - [4288, 3584, 1, 1280, 4288, 4288, 1280, 1280]
    - [7, 21666.0]
  - - [1856, 3584, 1, 32, 1856, 1856, 32, 32]
    - [2, 10580.0]
  - - [5056, 3584, 1, 3328, 5056, 5056, 3328, 3328]
    - [15, 20199.0]
  - - [4288, 5056, 1, 256, 4288, 4288, 256, 256]
    - [34, 20187.0]
  - - [1856, 5888, 1, 256, 1856, 1856, 256, 256]
    - [23, 19482.0]
  - - [2368, 3584, 1, 1, 2368, 2368, 1, 1]
    - [39, 465.0]
  - - [4288, 2368, 1, 256, 4288, 4288, 256, 256]
    - [49, 19147.0]
  - - [1408, 2944, 1, 3328, 1408, 1408, 3328, 3328]
    - [32, 20239.0]
  - - [5888, 3584, 1, 1, 5888, 5888, 1, 1]
    - [29, 736.0]
  - - [6784, 5056, 1, 3328, 6784, 6784, 3328, 3328]
    - [7, 21846.0]
  - - [6784, 5056, 1, 1, 6784, 6784, 1, 1]
    - [46, 424.0]
  - - [5888, 3584, 1, 32, 5888, 5888, 32, 32]
    - [28, 15175.0]
  - - [5888, 3584, 1, 3328, 5888, 5888, 3328, 3328]
    - [43, 21997.0]
  - - [1024, 6784, 1, 256, 1024, 1024, 256, 256]
    - [32, 17070.0]
  - - [6784, 5888, 1, 32, 6784, 6784, 32, 32]
    - [18, 11449.0]
  - - [2368, 6784, 1, 32, 2368, 2368, 32, 32]
    - [9, 12245.0]
  - - [5056, 1408, 1, 1280, 5056, 5056, 1280, 1280]
    - [49, 20794.0]
  - - [3584, 1408, 1, 3328, 3584, 3584, 3328, 3328]
    - [32, 20043.0]
  - - [2944, 3584, 1, 1, 2944, 2944, 1, 1]
    - [24, 455.0]
  - - [2944, 1408, 1, 1280, 2944, 2944, 1280, 1280]
    - [32, 19737.0]
  - - [3584, 1024, 1, 1, 3584, 3584, 1, 1]
    - [48, 339.0]
  - - [2944, 1856, 1, 3328, 2944, 2944, 3328, 3328]
    - [13, 19487.0]
  - - [2944, 3584, 1, 32, 2944, 2944, 32, 32]
    - [53, 10941.0]
  - - [5888, 256, 1, 32, 5888, 5888, 32, 32]
    - [37, 8770.0]
  - - [6784, 5056, 1, 256, 6784, 6784, 256, 256]
    - [25, 20535.0]
  - - [1856, 3584, 1, 1280, 1856, 1856, 1280, 1280]
    - [13, 20094.0]
  - - [256, 5888, 1, 256, 256, 256, 256, 256]
    - [32, 16241.0]
  - - [1024, 4288, 1, 3328, 1024, 1024, 3328, 3328]
    - [34, 20669.0]
  - - [2368, 1408, 1, 1, 2368, 2368, 1, 1]
    - [50, 258.0]
  - - [1024, 1856, 1, 32, 1024, 1024, 32, 32]
    - [31, 6193.0]
  - - [5888, 2368, 1, 1, 5888, 5888, 1, 1]
    - [18, 499.0]
  - - [2368, 2368, 1, 1, 2368, 2368, 1, 1]
    - [18, 387.0]
  - - [704, 4288, 1, 256, 704, 704, 256, 256]
    - [49, 15797.0]
  - - [5888, 2368, 1, 32, 5888, 5888, 32, 32]
    - [9, 14264.0]
  - - [5888, 2368, 1, 1280, 5888, 5888, 1280, 1280]
    - [13, 20496.0]
  - - [2944, 5056, 1, 3328, 2944, 2944, 3328, 3328]
    - [15, 20932.0]
  - - [6784, 704, 1, 3328, 6784, 6784, 3328, 3328]
    - [34, 19239.0]
  - - [1856, 1856, 1, 32, 1856, 1856, 32, 32]
    - [20, 7796.0]
  - - [4288, 2944, 1, 32, 4288, 4288, 32, 32]
    - [4, 13315.0]
  - - [256, 5056, 1, 1, 256, 256, 1, 1]
    - [31, 214.0]
  - - [5056, 5056, 1, 256, 5056, 5056, 256, 256]
    - [34, 20248.0]
  - - [5888, 256, 1, 256, 5888, 5888, 256, 256]
    - [32, 16309.0]
  - - [6784, 6784, 1, 256, 6784, 6784, 256, 256]
    - [23, 20859.0]
  - - [3584, 704, 1, 3328, 3584, 3584, 3328, 3328]
    - [13, 17585.0]
  - - [4288, 704, 1, 3328, 4288, 4288, 3328, 3328]
    - [32, 17472.0]
  - - [4288, 2944, 1, 1280, 4288, 4288, 1280, 1280]
    - [32, 20634.0]
  - - [448, 3584, 1, 256, 448, 448, 256, 256]
    - [32, 14893.0]
  - - [6784, 256, 1, 32, 6784, 6784, 32, 32]
    - [18, 8603.0]
  - - [6784, 1408, 1, 1280, 6784, 6784, 1280, 1280]
    - [13, 20771.0]
  - - [2368, 5056, 1, 1280, 2368, 2368, 1280, 1280]
    - [25, 20635.0]
  - - [1408, 1408, 1, 1280, 1408, 1408, 1280, 1280]
    - [13, 17546.0]
  - - [5888, 1856, 1, 32, 5888, 5888, 32, 32]
    - [18, 14391.0]
  - - [5888, 704, 1, 3328, 5888, 5888, 3328, 3328]
    - [25, 19399.0]
  - - [448, 6784, 1, 256, 448, 448, 256, 256]
    - [32, 14997.0]
  - - [2944, 5888, 1, 256, 2944, 2944, 256, 256]
    - [15, 20667.0]
  - - [1856, 1408, 1, 32, 1856, 1856, 32, 32]
    - [0, 8533.0]
  - - [5888, 2944, 1, 1280, 5888, 5888, 1280, 1280]
    - [13, 21100.0]
  - - [448, 5888, 1, 1, 448, 448, 1, 1]
    - [37, 261.0]
  - - [3584, 1408, 1, 1, 3584, 3584, 1, 1]
    - [18, 367.0]
  - - [448, 5888, 1, 32, 448, 448, 32, 32]
    - [37, 7816.0]
  - - [5056, 704, 1, 1280, 5056, 5056, 1280, 1280]
    - [7, 18539.0]
  - - [1856, 6784, 1, 1, 1856, 1856, 1, 1]
    - [12, 514.0]
  - - [2368, 1024, 1, 256, 2368, 2368, 256, 256]
    - [5, 15684.0]
  - - [1856, 6784, 1, 32, 1856, 1856, 32, 32]
    - [37, 12889.0]
  - - [1856, 6784, 1, 1280, 1856, 1856, 1280, 1280]
    - [7, 20362.0]
  - - [5888, 5056, 1, 3328, 5888, 5888, 3328, 3328]
    - [25, 21720.0]
  - - [1408, 6784, 1, 32, 1408, 1408, 32, 32]
    - [0, 9797.0]
  - - [3584, 5888, 1, 3328, 3584, 3584, 3328, 3328]
    - [23, 18587.0]
  - - [4288, 1408, 1, 256, 4288, 4288, 256, 256]
    - [5, 16266.0]
  - - [6784, 2368, 1, 256, 6784, 6784, 256, 256]
    - [23, 19757.0]
  - - [1856, 1408, 1, 1280, 1856, 1856, 1280, 1280]
    - [13, 17905.0]
  - - [1856, 2368, 1, 1, 1856, 1856, 1, 1]
    - [4, 317.0]
  - - [1408, 5056, 1, 3328, 1408, 1408, 3328, 3328]
    - [43, 20648.0]
  - - [5056, 4288, 1, 256, 5056, 5056, 256, 256]
    - [25, 20105.0]
  - - [5056, 5056, 1, 32, 5056, 5056, 32, 32]
    - [22, 14868.0]
  - - [448, 5888, 1, 1280, 448, 448, 1280, 1280]
    - [7, 17068.0]
  - - [5056, 448, 1, 256, 5056, 5056, 256, 256]
    - [23, 14061.0]
  - - [4288, 5888, 1, 1, 4288, 4288, 1, 1]
    - [37, 786.0]
  - - [1856, 5056, 1, 1280, 1856, 1856, 1280, 1280]
    - [7, 20372.0]
  - - [2368, 4288, 1, 1, 2368, 2368, 1, 1]
    - [12, 393.0]
  - - [3584, 1856, 1, 256, 3584, 3584, 256, 256]
    - [13, 18558.0]
  - - [4288, 5888, 1, 32, 4288, 4288, 32, 32]
    - [18, 15786.0]
  - - [4288, 5888, 1, 3328, 4288, 4288, 3328, 3328]
    - [7, 21660.0]
  - - [1024, 2944, 1, 3328, 1024, 1024, 3328, 3328]
    - [25, 19275.0]
  - - [2944, 2368, 1, 256, 2944, 2944, 256, 256]
    - [15, 17811.0]
  - - [1024, 1856, 1, 256, 1024, 1024, 256, 256]
    - [49, 15446.0]
  - - [1024, 5888, 1, 32, 1024, 1024, 32, 32]
    - [9, 11192.0]
  - - [1024, 5888, 1, 3328, 1024, 1024, 3328, 3328]
    - [15, 20122.0]
  - - [5056, 2368, 1, 32, 5056, 5056, 32, 32]
    - [18, 11575.0]
  - - [1408, 2368, 1, 1280, 1408, 1408, 1280, 1280]
    - [32, 18578.0]
  - - [5056, 6784, 1, 3328, 5056, 5056, 3328, 3328]
    - [15, 21376.0]
  - - [1408, 2944, 1, 256, 1408, 1408, 256, 256]
    - [41, 18385.0]
  - - [704, 5056, 1, 32, 704, 704, 32, 32]
    - [37, 8590.0]
  - - [5056, 4288, 1, 1280, 5056, 5056, 1280, 1280]
    - [43, 21277.0]
  - - [4288, 448, 1, 1, 4288, 4288, 1, 1]
    - [9, 296.0]
  - - [5888, 5888, 1, 1, 5888, 5888, 1, 1]
    - [44, 638.0]
  - - [2944, 704, 1, 1280, 2944, 2944, 1280, 1280]
    - [49, 17807.0]
  - - [1024, 3584, 1, 1280, 1024, 1024, 1280, 1280]
    - [7, 19794.0]
  - - [2368, 2944, 1, 1, 2368, 2368, 1, 1]
    - [2, 413.0]
  - - [5056, 256, 1, 32, 5056, 5056, 32, 32]
    - [9, 4279.0]
  - - [5056, 1024, 1, 1280, 5056, 5056, 1280, 1280]
    - [43, 20786.0]
  - - [3584, 6784, 1, 256, 3584, 3584, 256, 256]
    - [41, 20601.0]
  - - [1856, 1408, 1, 256, 1856, 1856, 256, 256]
    - [5, 16381.0]
  - - [4288, 4288, 1, 32, 4288, 4288, 32, 32]
    - [37, 14851.0]
  - - [5888, 448, 1, 1, 5888, 5888, 1, 1]
    - [0, 372.0]
  - - [5056, 5056, 1, 1280, 5056, 5056, 1280, 1280]
    - [25, 21326.0]
  - - [6784, 1408, 1, 3328, 6784, 6784, 3328, 3328]
    - [13, 20007.0]
  - - [5888, 5888, 1, 3328, 5888, 5888, 3328, 3328]
    - [15, 22075.0]
  - - [5888, 1408, 1, 32, 5888, 5888, 32, 32]
    - [9, 8993.0]
  - - [256, 6784, 1, 3328, 256, 256, 3328, 3328]
    - [7, 18530.0]
  - - [6784, 2368, 1, 1280, 6784, 6784, 1280, 1280]
    - [32, 20633.0]
  - - [2944, 1408, 1, 1, 2944, 2944, 1, 1]
    - [30, 313.0]
  - - [6784, 1024, 1, 256, 6784, 6784, 256, 256]
    - [15, 19906.0]
  - - [5056, 1408, 1, 32, 5056, 5056, 32, 32]
    - [9, 10786.0]
  - - [1408, 6784, 1, 3328, 1408, 1408, 3328, 3328]
    - [23, 19403.0]
  - - [2944, 1408, 1, 3328, 2944, 2944, 3328, 3328]
    - [13, 20129.0]
  - - [704, 2368, 1, 32, 704, 704, 32, 32]
    - [37, 4885.0]
  - - [704, 6784, 1, 1, 704, 704, 1, 1]
    - [37, 343.0]
  - - [2368, 6784, 1, 256, 2368, 2368, 256, 256]
    - [32, 19919.0]
  - - [1856, 3584, 1, 3328, 1856, 1856, 3328, 3328]
    - [7, 20329.0]
  - - [704, 6784, 1, 256, 704, 704, 256, 256]
    - [32, 17735.0]
  - - [6784, 2944, 1, 32, 6784, 6784, 32, 32]
    - [6, 13816.0]
  - - [5888, 2368, 1, 3328, 5888, 5888, 3328, 3328]
    - [41, 20196.0]
  - - [2368, 704, 1, 1280, 2368, 2368, 1280, 1280]
    - [32, 16349.0]
  - - [1024, 1408, 1, 1280, 1024, 1024, 1280, 1280]
    - [32, 16786.0]
  - - [2944, 5056, 1, 32, 2944, 2944, 32, 32]
    - [18, 15576.0]
  - - [704, 2368, 1, 3328, 704, 704, 3328, 3328]
    - [7, 17628.0]
  - - [3584, 2944, 1, 256, 3584, 3584, 256, 256]
    - [32, 20077.0]
  - - [3584, 1024, 1, 1280, 3584, 3584, 1280, 1280]
    - [13, 19337.0]
  - - [5056, 3584, 1, 256, 5056, 5056, 256, 256]
    - [51, 20425.0]
  - - [2368, 704, 1, 256, 2368, 2368, 256, 256]
    - [49, 14788.0]
  - - [1856, 1856, 1, 1280, 1856, 1856, 1280, 1280]
    - [32, 17874.0]
  - - [4288, 704, 1, 1, 4288, 4288, 1, 1]
    - [0, 309.0]
  - - [1856, 1024, 1, 1, 1856, 1856, 1, 1]
    - [37, 236.0]
  - - [4288, 2944, 1, 3328, 4288, 4288, 3328, 3328]
    - [32, 20526.0]
  - - [4288, 704, 1, 32, 4288, 4288, 32, 32]
    - [37, 7918.0]
  - - [1856, 1024, 1, 32, 1856, 1856, 32, 32]
    - [30, 7583.0]
  - - [2944, 6784, 1, 1, 2944, 2944, 1, 1]
    - [20, 784.0]
  - - [6784, 2368, 1, 32, 6784, 6784, 32, 32]
    - [12, 14295.0]
  - - [5888, 5056, 1, 1, 5888, 5888, 1, 1]
    - [20, 752.0]
  - - [704, 5888, 1, 1, 704, 704, 1, 1]
    - [33, 311.0]
  - - [6784, 6784, 1, 1, 6784, 6784, 1, 1]
    - [46, 446.0]
  - - [5888, 448, 1, 3328, 5888, 5888, 3328, 3328]
    - [7, 17314.0]
  - - [704, 5888, 1, 32, 704, 704, 32, 32]
    - [33, 8290.0]
  - - [704, 5888, 1, 1280, 704, 704, 1280, 1280]
    - [15, 19189.0]
  - - [1024, 6784, 1, 3328, 1024, 1024, 3328, 3328]
    - [7, 20038.0]
  - - [704, 2944, 1, 1280, 704, 704, 1280, 1280]
    - [13, 17332.0]
  - - [4288, 6784, 1, 256, 4288, 4288, 256, 256]
    - [32, 20390.0]
  - - [1408, 1408, 1, 32, 1408, 1408, 32, 32]
    - [37, 9221.0]
  - - [1408, 1408, 1, 3328, 1408, 1408, 3328, 3328]
    - [13, 17975.0]
  - - [2944, 1856, 1, 256, 2944, 2944, 256, 256]
    - [23, 17546.0]
  - - [4288, 2944, 1, 1, 4288, 4288, 1, 1]
    - [4, 480.0]
  - - [6784, 5056, 1, 32, 6784, 6784, 32, 32]
    - [37, 15649.0]
  - - [2944, 4288, 1, 1280, 2944, 2944, 1280, 1280]
    - [25, 21294.0]
  - - [1024, 4288, 1, 256, 1024, 1024, 256, 256]
    - [32, 18337.0]
  - - [2368, 5888, 1, 1, 2368, 2368, 1, 1]
    - [42, 414.0]
  - - [1408, 1856, 1, 32, 1408, 1408, 32, 32]
    - [0, 8877.0]
  - - [1856, 6784, 1, 3328, 1856, 1856, 3328, 3328]
    - [41, 19402.0]
  - - [1024, 2368, 1, 32, 1024, 1024, 32, 32]
    - [9, 7198.0]
  - - [2368, 2368, 1, 3328, 2368, 2368, 3328, 3328]
    - [32, 19064.0]
  - - [3584, 5888, 1, 32, 3584, 3584, 32, 32]
    - [45, 15822.0]
  - - [3584, 5888, 1, 1280, 3584, 3584, 1280, 1280]
    - [15, 21771.0]
  - - [6784, 704, 1, 256, 6784, 6784, 256, 256]
    - [13, 17521.0]
  - - [3584, 1024, 1, 32, 3584, 3584, 32, 32]
    - [18, 9306.0]
  - - [2368, 5888, 1, 256, 2368, 2368, 256, 256]
    - [7, 19934.0]
  - - [5888, 5888, 1, 32, 5888, 5888, 32, 32]
    - [28, 16387.0]
  - - [1856, 1408, 1, 3328, 1856, 1856, 3328, 3328]
    - [49, 18054.0]
  - - [4288, 1024, 1, 1, 4288, 4288, 1, 1]
    - [33, 352.0]
  - - [704, 4288, 1, 3328, 704, 704, 3328, 3328]
    - [13, 17436.0]
  - - [2944, 5056, 1, 1280, 2944, 2944, 1280, 1280]
    - [15, 21229.0]
  - - [6784, 2944, 1, 1280, 6784, 6784, 1280, 1280]
    - [13, 21334.0]
  - - [6784, 256, 1, 3328, 6784, 6784, 3328, 3328]
    - [5, 17965.0]
  - - [1408, 5056, 1, 32, 1408, 1408, 32, 32]
    - [37, 13528.0]
  - - [5888, 1856, 1, 1280, 5888, 5888, 1280, 1280]
    - [32, 20298.0]
  - - [5888, 256, 1, 1280, 5888, 5888, 1280, 1280]
    - [13, 17901.0]
  - - [1856, 5056, 1, 1, 1856, 1856, 1, 1]
    - [48, 416.0]
  - - [3584, 1856, 1, 1280, 3584, 3584, 1280, 1280]
    - [32, 20209.0]
  - - [6784, 448, 1, 256, 6784, 6784, 256, 256]
    - [23, 15499.0]
  - - [704, 3584, 1, 256, 704, 704, 256, 256]
    - [23, 15996.0]
  - - [1856, 5056, 1, 32, 1856, 1856, 32, 32]
    - [0, 11113.0]
  - - [1856, 5056, 1, 3328, 1856, 1856, 3328, 3328]
    - [34, 20252.0]
  - - [1024, 2944, 1, 32, 1024, 1024, 32, 32]
    - [18, 8039.0]
  - - [1408, 6784, 1, 256, 1408, 1408, 256, 256]
    - [41, 19438.0]
  - - [1024, 2368, 1, 1280, 1024, 1024, 1280, 1280]
    - [7, 19154.0]
  - - [1856, 3584, 1, 1, 1856, 1856, 1, 1]
    - [41, 416.0]
  - - [2944, 5888, 1, 1280, 2944, 2944, 1280, 1280]
    - [25, 21818.0]
  - - [3584, 3584, 1, 256, 3584, 3584, 256, 256]
    - [32, 20306.0]
  - - [1856, 2368, 1, 3328, 1856, 1856, 3328, 3328]
    - [5, 18830.0]
  - - [5888, 704, 1, 256, 5888, 5888, 256, 256]
    - [49, 16576.0]
  - - [6784, 4288, 1, 256, 6784, 6784, 256, 256]
    - [15, 20487.0]
  - - [1408, 2368, 1, 3328, 1408, 1408, 3328, 3328]
    - [32, 19122.0]
  - - [1024, 3584, 1, 256, 1024, 1024, 256, 256]
    - [13, 16990.0]
  - - [4288, 1024, 1, 32, 4288, 4288, 32, 32]
    - [22, 10182.0]
  - - [5888, 1856, 1, 3328, 5888, 5888, 3328, 3328]
    - [41, 19856.0]
  - - [2368, 3584, 1, 256, 2368, 2368, 256, 256]
    - [32, 18782.0]
  - - [4288, 1408, 1, 3328, 4288, 4288, 3328, 3328]
    - [13, 20382.0]
  - - [256, 5056, 1, 256, 256, 256, 256, 256]
    - [49, 12943.0]
  - - [5888, 2944, 1, 3328, 5888, 5888, 3328, 3328]
    - [41, 21267.0]
  - - [2368, 1408, 1, 3328, 2368, 2368, 3328, 3328]
    - [13, 18966.0]
  - - [5888, 704, 1, 32, 5888, 5888, 32, 32]
    - [18, 9584.0]
  - - [2944, 704, 1, 1, 2944, 2944, 1, 1]
    - [9, 316.0]
  - - [6784, 1856, 1, 256, 6784, 6784, 256, 256]
    - [23, 19415.0]
  - - [1856, 1856, 1, 1, 1856, 1856, 1, 1]
    - [4, 318.0]
  - - [2944, 704, 1, 3328, 2944, 2944, 3328, 3328]
    - [32, 18014.0]
  - - [2368, 1856, 1, 32, 2368, 2368, 32, 32]
    - [18, 11779.0]
  - - [5056, 4288, 1, 3328, 5056, 5056, 3328, 3328]
    - [25, 21436.0]
  - - [3584, 448, 1, 3328, 3584, 3584, 3328, 3328]
    - [41, 16006.0]
  - - [256, 6784, 1, 1, 256, 256, 1, 1]
    - [50, 195.0]
  - - [1024, 3584, 1, 32, 1024, 1024, 32, 32]
    - [28, 8661.0]
  - - [256, 6784, 1, 32, 256, 256, 32, 32]
    - [9, 6080.0]
  - - [2944, 1408, 1, 32, 2944, 2944, 32, 32]
    - [18, 9943.0]
  - - [4288, 3584, 1, 1, 4288, 4288, 1, 1]
    - [10, 566.0]
  - - [5056, 448, 1, 3328, 5056, 5056, 3328, 3328]
    - [25, 17727.0]
  - - [6784, 3584, 1, 32, 6784, 6784, 32, 32]
    - [11, 15699.0]
  - - [4288, 1856, 1, 256, 4288, 4288, 256, 256]
    - [32, 18792.0]
  - - [1856, 2944, 1, 256, 1856, 1856, 256, 256]
    - [5, 18271.0]
  - - [2944, 5888, 1, 1, 2944, 2944, 1, 1]
    - [8, 448.0]
  - - [1024, 1856, 1, 3328, 1024, 1024, 3328, 3328]
    - [13, 18955.0]
  - - [5888, 1024, 1, 32, 5888, 5888, 32, 32]
    - [18, 11512.0]
  - - [1408, 5056, 1, 1280, 1408, 1408, 1280, 1280]
    - [32, 20761.0]
  - - [5056, 6784, 1, 256, 5056, 5056, 256, 256]
    - [41, 20496.0]
  - - [2944, 5056, 1, 1, 2944, 2944, 1, 1]
    - [45, 536.0]
  - - [5888, 5888, 1, 1280, 5888, 5888, 1280, 1280]
    - [7, 22004.0]
  - - [5056, 2944, 1, 1280, 5056, 5056, 1280, 1280]
    - [32, 20947.0]
  - - [2368, 1856, 1, 1280, 2368, 2368, 1280, 1280]
    - [13, 18654.0]
  - - [6784, 2944, 1, 1, 6784, 6784, 1, 1]
    - [37, 785.0]
  - - [2944, 1024, 1, 32, 2944, 2944, 32, 32]
    - [37, 8403.0]
  - - [2944, 1024, 1, 1280, 2944, 2944, 1280, 1280]
    - [25, 19313.0]
  - - [5056, 5056, 1, 1, 5056, 5056, 1, 1]
    - [47, 654.0]
  - - [2368, 4288, 1, 256, 2368, 2368, 256, 256]
    - [41, 19128.0]
  - - [2944, 6784, 1, 1280, 2944, 2944, 1280, 1280]
    - [25, 21358.0]
  - - [256, 6784, 1, 1280, 256, 256, 1280, 1280]
    - [7, 17913.0]
  - - [3584, 2368, 1, 32, 3584, 3584, 32, 32]
    - [18, 12378.0]
  - - [6784, 3584, 1, 3328, 6784, 6784, 3328, 3328]
    - [25, 21919.0]
  - - [2944, 2944, 1, 256, 2944, 2944, 256, 256]
    - [41, 19632.0]
  - - [1408, 1024, 1, 3328, 1408, 1408, 3328, 3328]
    - [32, 17264.0]
  - - [5056, 2368, 1, 1280, 5056, 5056, 1280, 1280]
    - [32, 20408.0]
  - - [2944, 1024, 1, 1, 2944, 2944, 1, 1]
    - [2, 321.0]
  - - [3584, 704, 1, 256, 3584, 3584, 256, 256]
    - [41, 15739.0]
  - - [2368, 5888, 1, 3328, 2368, 2368, 3328, 3328]
    - [15, 20482.0]
  - - [4288, 2368, 1, 1, 4288, 4288, 1, 1]
    - [31, 456.0]
  - - [1408, 3584, 1, 32, 1408, 1408, 32, 32]
    - [37, 10499.0]
  - - [2944, 4288, 1, 32, 2944, 2944, 32, 32]
    - [18, 14075.0]
  - - [5888, 1408, 1, 1280, 5888, 5888, 1280, 1280]
    - [32, 20685.0]
  - - [3584, 5056, 1, 1280, 3584, 3584, 1280, 1280]
    - [7, 21519.0]
  - - [5888, 6784, 1, 1280, 5888, 5888, 1280, 1280]
    - [25, 21598.0]
  - - [3584, 2944, 1, 1, 3584, 3584, 1, 1]
    - [12, 340.0]
  - - [1024, 1856, 1, 1, 1024, 1024, 1, 1]
    - [18, 318.0]
  - - [704, 5056, 1, 3328, 704, 704, 3328, 3328]
    - [7, 19533.0]
  - - [1024, 3584, 1, 3328, 1024, 1024, 3328, 3328]
    - [7, 20175.0]
  - - [5888, 256, 1, 3328, 5888, 5888, 3328, 3328]
    - [49, 18145.0]
  - - [1856, 1408, 1, 1, 1856, 1856, 1, 1]
    - [37, 259.0]
  - - [4288, 5056, 1, 1280, 4288, 4288, 1280, 1280]
    - [7, 21331.0]
  - - [1856, 1856, 1, 3328, 1856, 1856, 3328, 3328]
    - [5, 18247.0]
  - - [1024, 2368, 1, 256, 1024, 1024, 256, 256]
    - [32, 15275.0]
  - - [4288, 2368, 1, 3328, 4288, 4288, 3328, 3328]
    - [32, 19946.0]
  - - [5888, 3584, 1, 256, 5888, 5888, 256, 256]
    - [34, 20794.0]
  - - [1024, 5056, 1, 32, 1024, 1024, 32, 32]
    - [9, 9921.0]
  - - [5888, 448, 1, 1280, 5888, 5888, 1280, 1280]
    - [25, 16748.0]
  - - [704, 5888, 1, 3328, 704, 704, 3328, 3328]
    - [7, 19393.0]
  - - [1024, 1408, 1, 256, 1024, 1024, 256, 256]
    - [13, 13835.0]
  - - [3584, 2944, 1, 1280, 3584, 3584, 1280, 1280]
    - [13, 20863.0]
  - - [4288, 1856, 1, 1280, 4288, 4288, 1280, 1280]
    - [13, 19780.0]
  - - [3584, 5888, 1, 1, 3584, 3584, 1, 1]
    - [29, 529.0]
  - - [5888, 4288, 1, 256, 5888, 5888, 256, 256]
    - [49, 20265.0]
  - - [1024, 2944, 1, 1280, 1024, 1024, 1280, 1280]
    - [25, 19141.0]
  - - [2944, 3584, 1, 256, 2944, 2944, 256, 256]
    - [41, 20158.0]
  - - [5888, 1856, 1, 1, 5888, 5888, 1, 1]
    - [45, 372.0]
  - - [6784, 2368, 1, 3328, 6784, 6784, 3328, 3328]
    - [13, 19725.0]
  - - [1408, 4288, 1, 32, 1408, 1408, 32, 32]
    - [28, 10277.0]
  - - [1856, 1024, 1, 1280, 1856, 1856, 1280, 1280]
    - [15, 19071.0]
  - - [5888, 1856, 1, 256, 5888, 5888, 256, 256]
    - [49, 18893.0]
  - - [5056, 1856, 1, 1, 5056, 5056, 1, 1]
    - [0, 430.0]
  - - [5888, 2368, 1, 256, 5888, 5888, 256, 256]
    - [41, 19852.0]
  - - [1408, 1024, 1, 32, 1408, 1408, 32, 32]
    - [18, 8358.0]
  - - [5056, 1856, 1, 32, 5056, 5056, 32, 32]
    - [45, 11188.0]
  - - [5056, 1856, 1, 1280, 5056, 5056, 1280, 1280]
    - [32, 20179.0]
  - - [1408, 5888, 1, 3328, 1408, 1408, 3328, 3328]
    - [41, 20107.0]
  - - [5056, 704, 1, 3328, 5056, 5056, 3328, 3328]
    - [25, 18881.0]
  - - [5888, 6784, 1, 1, 5888, 5888, 1, 1]
    - [46, 607.0]
  - - [5888, 4288, 1, 32, 5888, 5888, 32, 32]
    - [37, 15244.0]
  - - [1408, 3584, 1, 256, 1408, 1408, 256, 256]
    - [43, 19591.0]
  - - [6784, 256, 1, 1, 6784, 6784, 1, 1]
    - [18, 347.0]
  - - [6784, 256, 1, 1280, 6784, 6784, 1280, 1280]
    - [32, 17758.0]
  - - [2368, 704, 1, 3328, 2368, 2368, 3328, 3328]
    - [49, 16885.0]
  - - [2944, 1856, 1, 32, 2944, 2944, 32, 32]
    - [18, 13307.0]
  - - [2368, 1408, 1, 256, 2368, 2368, 256, 256]
    - [32, 16465.0]
  - - [2368, 1856, 1, 1, 2368, 2368, 1, 1]
    - [18, 426.0]
  - - [4288, 1408, 1, 1, 4288, 4288, 1, 1]
    - [18, 420.0]
  - - [3584, 2368, 1, 1280, 3584, 3584, 1280, 1280]
    - [13, 20275.0]
  - - [1408, 2944, 1, 1, 1408, 1408, 1, 1]
    - [9, 378.0]
  - - [4288, 1408, 1, 32, 4288, 4288, 32, 32]
    - [0, 10321.0]
  - - [5888, 2944, 1, 256, 5888, 5888, 256, 256]
    - [32, 20688.0]
  - - [1408, 2944, 1, 32, 1408, 1408, 32, 32]
    - [20, 9914.0]
  - - [5888, 6784, 1, 256, 5888, 5888, 256, 256]
    - [49, 20990.0]
  - - [6784, 5888, 1, 1, 6784, 6784, 1, 1]
    - [48, 639.0]
  - - [6784, 5888, 1, 1280, 6784, 6784, 1280, 1280]
    - [25, 22010.0]
  - - [1024, 4288, 1, 32, 1024, 1024, 32, 32]
    - [9, 8227.0]
  - - [3584, 5888, 1, 256, 3584, 3584, 256, 256]
    - [23, 20667.0]
  - - [5056, 2368, 1, 1, 5056, 5056, 1, 1]
    - [42, 513.0]
  - - [5056, 448, 1, 1, 5056, 5056, 1, 1]
    - [18, 333.0]
  - - [2368, 1024, 1, 1280, 2368, 2368, 1280, 1280]
    - [7, 19124.0]
  - - [1856, 6784, 1, 256, 1856, 1856, 256, 256]
    - [23, 19652.0]
  - - [5056, 448, 1, 32, 5056, 5056, 32, 32]
    - [28, 8108.0]
  - - [3584, 2944, 1, 32, 3584, 3584, 32, 32]
    - [12, 10829.0]
  - - [3584, 1856, 1, 32, 3584, 3584, 32, 32]
    - [31, 9520.0]
  - - [4288, 1408, 1, 1280, 4288, 4288, 1280, 1280]
    - [13, 20203.0]
  - - [6784, 2368, 1, 1, 6784, 6784, 1, 1]
    - [48, 375.0]
  - - [704, 5056, 1, 1, 704, 704, 1, 1]
    - [28, 335.0]
  - - [2368, 1408, 1, 1280, 2368, 2368, 1280, 1280]
    - [13, 18753.0]
  - - [5888, 1408, 1, 1, 5888, 5888, 1, 1]
    - [45, 448.0]
  - - [1024, 4288, 1, 1280, 1024, 1024, 1280, 1280]
    - [43, 19426.0]
  - - [1856, 4288, 1, 1, 1856, 1856, 1, 1]
    - [42, 414.0]
  - - [3584, 4288, 1, 256, 3584, 3584, 256, 256]
    - [49, 19890.0]
  - - [2368, 2944, 1, 256, 2368, 2368, 256, 256]
    - [23, 19120.0]
  - - [704, 5056, 1, 256, 704, 704, 256, 256]
    - [34, 16943.0]
  - - [1856, 4288, 1, 32, 1856, 1856, 32, 32]
    - [48, 11566.0]
  - - [4288, 1024, 1, 1280, 4288, 4288, 1280, 1280]
    - [7, 19990.0]
  - - [4288, 6784, 1, 32, 4288, 4288, 32, 32]
    - [47, 14823.0]
  - - [3584, 1408, 1, 256, 3584, 3584, 256, 256]
    - [13, 19150.0]
  - - [704, 3584, 1, 3328, 704, 704, 3328, 3328]
    - [5, 17422.0]
  - - [5056, 448, 1, 1280, 5056, 5056, 1280, 1280]
    - [32, 16908.0]
  - - [1408, 2944, 1, 1280, 1408, 1408, 1280, 1280]
    - [32, 19737.0]
  - - [5888, 704, 1, 1280, 5888, 5888, 1280, 1280]
    - [25, 18646.0]
  - - [4288, 5888, 1, 256, 4288, 4288, 256, 256]
    - [25, 20575.0]
  - - [3584, 3584, 1, 3328, 3584, 3584, 3328, 3328]
    - [15, 20732.0]
  - - [2944, 6784, 1, 32, 2944, 2944, 32, 32]
    - [28, 16404.0]
  - - [5056, 256, 1, 1, 5056, 5056, 1, 1]
    - [33, 143.0]
  - - [2944, 2368, 1, 3328, 2944, 2944, 3328, 3328]
    - [5, 20294.0]
  - - [1024, 1856, 1, 1280, 1024, 1024, 1280, 1280]
    - [49, 18296.0]
  - - [448, 5888, 1, 256, 448, 448, 256, 256]
    - [5, 14259.0]
  - - [1024, 5888, 1, 256, 1024, 1024, 256, 256]
    - [13, 18561.0]
  - - [6784, 2944, 1, 3328, 6784, 6784, 3328, 3328]
    - [13, 19678.0]
  - - [1408, 2368, 1, 256, 1408, 1408, 256, 256]
    - [42, 13919.0]
  - - [1408, 5056, 1, 256, 1408, 1408, 256, 256]
    - [23, 18661.0]
  - - [1024, 1408, 1, 32, 1024, 1024, 32, 32]
    - [31, 5479.0]
  - - [6784, 704, 1, 1, 6784, 6784, 1, 1]
    - [48, 346.0]
  - - [704, 3584, 1, 32, 704, 704, 32, 32]
    - [20, 6522.0]
  - - [4288, 4288, 1, 1, 4288, 4288, 1, 1]
    - [4, 740.0]
  - - [5056, 2944, 1, 1, 5056, 5056, 1, 1]
    - [12, 580.0]
  - - [6784, 4288, 1, 3328, 6784, 6784, 3328, 3328]
    - [15, 21594.0]
  - - [5056, 2944, 1, 3328, 5056, 5056, 3328, 3328]
    - [41, 20263.0]
  - - [2368, 1856, 1, 3328, 2368, 2368, 3328, 3328]
    - [32, 18705.0]
  - - [1856, 4288, 1, 1280, 1856, 1856, 1280, 1280]
    - [25, 20283.0]
  - - [3584, 448, 1, 1, 3584, 3584, 1, 1]
    - [40, 296.0]
  - - [2944, 1024, 1, 3328, 2944, 2944, 3328, 3328]
    - [43, 19377.0]
  - - [5888, 5056, 1, 32, 5888, 5888, 32, 32]
    - [28, 14843.0]
  - - [704, 2944, 1, 1, 704, 704, 1, 1]
    - [33, 212.0]
  - - [3584, 448, 1, 32, 3584, 3584, 32, 32]
    - [18, 5865.0]
  - - [3584, 448, 1, 1280, 3584, 3584, 1280, 1280]
    - [41, 15653.0]
  - - [2944, 6784, 1, 3328, 2944, 2944, 3328, 3328]
    - [43, 21425.0]
  - - [1856, 2368, 1, 1280, 1856, 1856, 1280, 1280]
    - [32, 18590.0]
  - - [6784, 1024, 1, 1280, 6784, 6784, 1280, 1280]
    - [43, 20980.0]
  - - [6784, 3584, 1, 1280, 6784, 6784, 1280, 1280]
    - [25, 21785.0]
  - - [1408, 1408, 1, 1, 1408, 1408, 1, 1]
    - [2, 322.0]
  - - [1408, 4288, 1, 256, 1408, 1408, 256, 256]
    - [23, 19025.0]
  - - [256, 5056, 1, 3328, 256, 256, 3328, 3328]
    - [7, 20093.0]
  - - [448, 6784, 1, 1, 448, 448, 1, 1]
    - [42, 248.0]
  - - [704, 2944, 1, 256, 704, 704, 256, 256]
    - [6, 14022.0]
  - - [1408, 1408, 1, 256, 1408, 1408, 256, 256]
    - [23, 15195.0]
  - - [448, 6784, 1, 32, 448, 448, 32, 32]
    - [37, 6849.0]
  - - [1408, 1856, 1, 1, 1408, 1408, 1, 1]
    - [37, 282.0]
  - - [4288, 448, 1, 32, 4288, 4288, 32, 32]
    - [0, 6015.0]
  - - [4288, 448, 1, 1280, 4288, 4288, 1280, 1280]
    - [23, 16220.0]
  - - [2944, 704, 1, 32, 2944, 2944, 32, 32]
    - [9, 6809.0]
  - - [448, 4288, 1, 1, 448, 448, 1, 1]
    - [33, 197.0]
  - - [3584, 5056, 1, 1, 3584, 3584, 1, 1]
    - [37, 719.0]
  - - [1408, 3584, 1, 1280, 1408, 1408, 1280, 1280]
    - [25, 20629.0]
  - - [6784, 448, 1, 1280, 6784, 6784, 1280, 1280]
    - [13, 17224.0]
  - - [3584, 5056, 1, 3328, 3584, 3584, 3328, 3328]
    - [43, 21638.0]
  - - [2368, 2368, 1, 32, 2368, 2368, 32, 32]
    - [45, 9969.0]
  - - [5888, 2944, 1, 32, 5888, 5888, 32, 32]
    - [9, 13937.0]
  - - [1856, 2944, 1, 32, 1856, 1856, 32, 32]
    - [45, 10095.0]
  - - [5056, 1408, 1, 1, 5056, 5056, 1, 1]
    - [2, 404.0]
  - - [5888, 1408, 1, 3328, 5888, 5888, 3328, 3328]
    - [13, 20201.0]
  - - [448, 4288, 1, 256, 448, 448, 256, 256]
    - [41, 13510.0]
  - - [6784, 1024, 1, 1, 6784, 6784, 1, 1]
    - [26, 454.0]
  - - [6784, 1024, 1, 32, 6784, 6784, 32, 32]
    - [28, 12068.0]
  - - [6784, 3584, 1, 1, 6784, 6784, 1, 1]
    - [9, 574.0]
  - - [2944, 2368, 1, 32, 2944, 2944, 32, 32]
    - [45, 11535.0]
  - - [3584, 6784, 1, 3328, 3584, 3584, 3328, 3328]
    - [25, 21497.0]
  - - [6784, 1408, 1, 256, 6784, 6784, 256, 256]
    - [41, 19622.0]
  - - [5056, 1024, 1, 32, 5056, 5056, 32, 32]
    - [18, 10053.0]
  - - [1024, 5056, 1, 1280, 1024, 1024, 1280, 1280]
    - [7, 20764.0]
  - - [4288, 3584, 1, 256, 4288, 4288, 256, 256]
    - [15, 20296.0]
  - - [448, 6784, 1, 1280, 448, 448, 1280, 1280]
    - [13, 17195.0]
  - - [1856, 5888, 1, 1, 1856, 1856, 1, 1]
    - [31, 468.0]
  - - [256, 5888, 1, 32, 256, 256, 32, 32]
    - [12, 7178.0]
  - - [4288, 5056, 1, 32, 4288, 4288, 32, 32]
    - [18, 14991.0]
  - - [4288, 5056, 1, 3328, 4288, 4288, 3328, 3328]
    - [25, 21353.0]
  - - [1856, 5888, 1, 32, 1856, 1856, 32, 32]
    - [12, 10303.0]
  - - [1856, 5888, 1, 1280, 1856, 1856, 1280, 1280]
    - [7, 20413.0]
  - - [704, 2368, 1, 1280, 704, 704, 1280, 1280]
    - [25, 17178.0]
  - - [4288, 2368, 1, 1280, 4288, 4288, 1280, 1280]
    - [13, 19970.0]
  - - [2944, 5056, 1, 256, 2944, 2944, 256, 256]
    - [23, 19940.0]
  - - [2944, 4288, 1, 1, 2944, 2944, 1, 1]
    - [2, 387.0]
  - - [5056, 5888, 1, 32, 5056, 5056, 32, 32]
    - [46, 15088.0]
  - - [2368, 5056, 1, 3328, 2368, 2368, 3328, 3328]
    - [25, 20917.0]
  - - [1024, 5056, 1, 3328, 1024, 1024, 3328, 3328]
    - [15, 21230.0]
  - - [1024, 6784, 1, 32, 1024, 1024, 32, 32]
    - [48, 10687.0]
  - - [3584, 2944, 1, 3328, 3584, 3584, 3328, 3328]
    - [23, 20367.0]
  - - [1408, 5888, 1, 1, 1408, 1408, 1, 1]
    - [24, 437.0]
  - - [704, 4288, 1, 32, 704, 704, 32, 32]
    - [20, 6900.0]
  - - [1408, 5888, 1, 32, 1408, 1408, 32, 32]
    - [37, 12443.0]
  - - [6784, 1024, 1, 3328, 6784, 6784, 3328, 3328]
    - [25, 20833.0]
  - - [5056, 1408, 1, 256, 5056, 5056, 256, 256]
    - [41, 19228.0]
  - - [2944, 1408, 1, 256, 2944, 2944, 256, 256]
    - [41, 19168.0]
  - - [2368, 2368, 1, 256, 2368, 2368, 256, 256]
    - [32, 18007.0]
  - - [1408, 6784, 1, 1, 1408, 1408, 1, 1]
    - [24, 396.0]
  - - [6784, 6784, 1, 1280, 6784, 6784, 1280, 1280]
    - [25, 21611.0]
  - - [1024, 5888, 1, 1, 1024, 1024, 1, 1]
    - [22, 300.0]
  - - [1856, 3584, 1, 256, 1856, 1856, 256, 256]
    - [23, 18623.0]
  - - [2368, 704, 1, 32, 2368, 2368, 32, 32]
    - [9, 7915.0]
  - - [256, 5888, 1, 1280, 256, 256, 1280, 1280]
    - [32, 17398.0]
  - - [1856, 1024, 1, 3328, 1856, 1856, 3328, 3328]
    - [7, 20057.0]
  - - [5056, 2368, 1, 3328, 5056, 5056, 3328, 3328]
    - [23, 20158.0]
  - - [704, 4288, 1, 1280, 704, 704, 1280, 1280]
    - [32, 17003.0]
  - - [2560, 7000, 1, 2560, 2560, 2560, 2560, 2560]
    - [15, 19768.0]
  - - [7680, 12000, 1, 2560, 7680, 7680, 2560, 2560]
    - [15, 21011.0]
  - - [5124, 9124, 1, 1760, 5124, 5124, 1760, 1760]
    - [21, 21706.0]
  - - [512, 24000, 1, 1536, 512, 512, 1536, 1536]
    - [15, 20652.0]
  - - [3072, 24000, 1, 1024, 3072, 3072, 1024, 1024]
    - [15, 21294.0]
  - - [512, 48000, 1, 2816, 512, 512, 2816, 2816]
    - [15, 21408.0]
  - - [512, 48000, 1, 2048, 512, 512, 2048, 2048]
    - [13, 20332.0]
  - - [2048, 1600, 1, 2048, 2048, 2048, 2048, 2048]
    - [13, 17285.0]
  - - [512, 48000, 1, 1536, 512, 512, 1536, 1536]
    - [34, 20994.0]
  - - [8448, 5984, 1, 2816, 8448, 8448, 2816, 2816]
    - [7, 21589.0]
  - - [4096, 3200, 1, 1024, 4096, 4096, 1024, 1024]
    - [13, 20339.0]
  - - [1024, 24000, 1, 2560, 1024, 1024, 2560, 2560]
    - [15, 20195.0]
  - - [1760, 6400, 1, 1760, 1760, 1760, 1760, 1760]
    - [21, 21538.0]
  - - [5124, 9124, 1, 2048, 5124, 5124, 2048, 2048]
    - [51, 20670.0]
  - - [16384, 3200, 1, 4096, 16384, 16384, 4096, 4096]
    - [15, 19071.0]
  - - [1024, 48000, 1, 2560, 1024, 1024, 2560, 2560]
    - [15, 20483.0]
  - - [8448, 48000, 1, 2816, 8448, 8448, 2816, 2816]
    - [43, 21912.0]
  - - [2560, 3200, 1, 2560, 2560, 2560, 2560, 2560]
    - [15, 20429.0]
  - - [16384, 800, 1, 4096, 16384, 16384, 4096, 4096]
    - [32, 16358.0]
  - - [4608, 24000, 1, 1536, 4608, 4608, 1536, 1536]
    - [15, 21722.0]
  - - [7680, 48000, 1, 2560, 7680, 7680, 2560, 2560]
    - [15, 21815.0]
  - - [3072, 48000, 1, 1024, 3072, 3072, 1024, 1024]
    - [15, 21359.0]
  - - [8192, 3200, 1, 2048, 8192, 8192, 2048, 2048]
    - [13, 17654.0]
  - - [512, 24000, 1, 2816, 512, 512, 2816, 2816]
    - [25, 21060.0]
  - - [4096, 400, 1, 1024, 4096, 4096, 1024, 1024]
    - [13, 14063.0]
  - - [6144, 48000, 1, 2560, 6144, 6144, 2560, 2560]
    - [15, 21282.0]
  - - [4608, 48000, 1, 1536, 4608, 4608, 1536, 1536]
    - [15, 21239.0]
  - - [2048, 800, 1, 512, 2048, 2048, 512, 512]
    - [33, 12672.0]
  - - [4608, 5984, 1, 1536, 4608, 4608, 1536, 1536]
    - [15, 21167.0]
  - - [4096, 1600, 1, 1024, 4096, 4096, 1024, 1024]
    - [13, 19175.0]
  - - [6144, 5984, 1, 2048, 6144, 6144, 2048, 2048]
    - [13, 21022.0]
  - - [7680, 24000, 1, 2560, 7680, 7680, 2560, 2560]
    - [15, 21478.0]
  - - [6144, 48000, 1, 2048, 6144, 6144, 2048, 2048]
    - [13, 20058.0]
  - - [2048, 3200, 1, 2048, 2048, 2048, 2048, 2048]
    - [15, 18702.0]
  - - [5124, 9124, 1, 2560, 5124, 5124, 2560, 2560]
    - [15, 21045.0]
  - - [1024, 24000, 1, 1536, 1024, 1024, 1536, 1536]
    - [13, 20459.0]
  - - [2560, 6400, 1, 2560, 2560, 2560, 2560, 2560]
    - [15, 21072.0]
  - - [512, 24000, 1, 2560, 512, 512, 2560, 2560]
    - [15, 20521.0]
  - - [1024, 24000, 1, 2816, 1024, 1024, 2816, 2816]
    - [15, 21246.0]
  - - [7680, 5984, 1, 2560, 7680, 7680, 2560, 2560]
    - [15, 21286.0]
  - - [2048, 1600, 1, 512, 2048, 2048, 512, 512]
    - [14, 14727.0]
  - - [2048, 7000, 1, 2048, 2048, 2048, 2048, 2048]
    - [13, 19982.0]
  - - [1760, 800, 1, 1760, 1760, 1760, 1760, 1760]
    - [19, 16611.0]
  - - [2560, 1600, 1, 2560, 2560, 2560, 2560, 2560]
    - [15, 18944.0]
  - - [2048, 3200, 1, 512, 2048, 2048, 512, 512]
    - [13, 19997.0]
  - - [2560, 800, 1, 2560, 2560, 2560, 2560, 2560]
    - [49, 17054.0]
  - - [4608, 12000, 1, 1536, 4608, 4608, 1536, 1536]
    - [15, 21577.0]
  - - [6144, 24000, 1, 2048, 6144, 6144, 2048, 2048]
    - [13, 19053.0]
  - - [8192, 800, 1, 2048, 8192, 8192, 2048, 2048]
    - [13, 17801.0]
  - - [5124, 9124, 1, 4096, 5124, 5124, 4096, 4096]
    - [49, 18948.0]
  - - [8448, 24000, 1, 2816, 8448, 8448, 2816, 2816]
    - [15, 21921.0]
  - - [1024, 48000, 1, 1536, 1024, 1024, 1536, 1536]
    - [15, 20902.0]
  - - [8192, 1600, 1, 2048, 8192, 8192, 2048, 2048]
    - [13, 19665.0]
  - - [4096, 800, 1, 1024, 4096, 4096, 1024, 1024]
    - [13, 16351.0]
  - - [2048, 800, 1, 2048, 2048, 2048, 2048, 2048]
    - [14, 14608.0]
  - - [1760, 3200, 1, 1760, 1760, 1760, 1760, 1760]
    - [41, 20312.0]
  - - [512, 48000, 1, 2560, 512, 512, 2560, 2560]
    - [15, 20502.0]
  - - [512, 24000, 1, 2048, 512, 512, 2048, 2048]
    - [13, 20215.0]
  - - [16384, 1600, 1, 4096, 16384, 16384, 4096, 4096]
    - [15, 18136.0]
  - - [1024, 24000, 1, 2048, 1024, 1024, 2048, 2048]
    - [13, 19731.0]
  - - [8192, 400, 1, 2048, 8192, 8192, 2048, 2048]
    - [13, 15268.0]
  - - [2048, 6400, 1, 2048, 2048, 2048, 2048, 2048]
    - [13, 20194.0]
  - - [6144, 12000, 1, 2048, 6144, 6144, 2048, 2048]
    - [15, 20249.0]
  - - [1760, 7000, 1, 1760, 1760, 1760, 1760, 1760]
    - [21, 21257.0]
  - - [1024, 48000, 1, 2816, 1024, 1024, 2816, 2816]
    - [15, 21573.0]
  - - [4096, 7000, 1, 4096, 4096, 4096, 4096, 4096]
    - [54, 17211.0]
  - - [6144, 24000, 1, 2560, 6144, 6144, 2560, 2560]
    - [15, 20580.0]
  - - [8448, 12000, 1, 2816, 8448, 8448, 2816, 2816]
    - [15, 21699.0]
  - - [16384, 400, 1, 4096, 16384, 16384, 4096, 4096]
    - [15, 15901.0]
  - - [1760, 1600, 1, 1760, 1760, 1760, 1760, 1760]
    - [3, 18966.0]
  - - [1024, 48000, 1, 2048, 1024, 1024, 2048, 2048]
    - [13, 20038.0]
  - - [4096, 4096, 1, 4096, 4096, 4096, 4096, 4096]
    - [17, 16199.0]
  - - [2048, 2048, 1, 2049, 2048, 2048, 2049, 2049]
    - [32, 19760.0]
  - - [8192, 8191, 1, 8192, 8192, 8192, 8192, 8192]
    - [15, 17982.0]
  - - [8192, 8192, 1, 8192, 8192, 8192, 8192, 8192]
    - [15, 18090.0]
  - - [2047, 2048, 1, 2048, 2047, 2047, 2048, 2048]
    - [13, 17851.0]
  - - [2048, 2049, 1, 2048, 2048, 2048, 2048, 2048]
    - [13, 17826.0]
  - - [8192, 8192, 1, 8191, 8192, 8192, 8191, 8191]
    - [15, 21945.0]
  - - [3072, 513, 1, 3072, 3072, 3072, 3072, 3072]
    - [32, 13083.0]
  - - [8191, 8192, 1, 8192, 8191, 8191, 8192, 8192]
    - [15, 18025.0]
  - - [8192, 8193, 1, 8192, 8192, 8192, 8192, 8192]
    - [15, 18048.0]
  - - [4096, 4097, 1, 4096, 4096, 4096, 4096, 4096]
    - [51, 18174.0]
  - - [8192, 8192, 1, 8193, 8192, 8192, 8193, 8193]
    - [15, 21922.0]
  - - [4096, 4095, 1, 4096, 4096, 4096, 4096, 4096]
    - [17, 16035.0]
  - - [4096, 4096, 1, 4097, 4096, 4096, 4097, 4097]
    - [34, 20030.0]
  - - [2048, 2048, 1, 2048, 2048, 2048, 2048, 2048]
    - [13, 18838.0]
  - - [4095, 4096, 1, 4096, 4095, 4095, 4096, 4096]
    - [15, 16361.0]
  - - [8193, 8192, 1, 8192, 8193, 8193, 8192, 8192]
    - [15, 18015.0]
  - - [4096, 4096, 1, 4095, 4096, 4096, 4095, 4095]
    - [34, 20242.0]
  - - [3072, 511, 1, 3072, 3072, 3072, 3072, 3072]
    - [14, 16568.0]
  - - [2049, 2048, 1, 2048, 2049, 2049, 2048, 2048]
    - [15, 18975.0]
  - - [2048, 2047, 1, 2048, 2048, 2048, 2048, 2048]
    - [15, 18456.0]
  - - [2048, 2048, 1, 2047, 2048, 2048, 2047, 2047]
    - [23, 20204.0]
  - - [4097, 4096, 1, 4096, 4097, 4097, 4096, 4096]
    - [36, 17083.0]
  - - [128, 128, 512, 64, 128, 128, 64, 64]
    - [24, 11307.0]
  - - [512, 512, 64, 64, 512, 512, 64, 64]
    - [49, 16963.0]
  - - [1024, 2048, 1, 1024, 1024, 1024, 1024, 1024]
    - [13, 17493.0]
  - - [1024, 2048, 1, 4096, 1024, 1024, 4096, 4096]
    - [32, 16604.0]
  - - [1024, 4096, 1, 1024, 1024, 1024, 1024, 1024]
    - [13, 18966.0]
  - - [1024, 4096, 1, 4096, 1024, 1024, 4096, 4096]
    - [15, 19239.0]
  - - [4096, 2048, 1, 1024, 4096, 4096, 1024, 1024]
    - [15, 20795.0]
  - - [4096, 4096, 1, 1024, 4096, 4096, 1024, 1024]
    - [15, 21381.0]
  - - [30528, 2048, 1, 1024, 30528, 30528, 1024, 1024]
    - [15, 21395.0]
  - - [30528, 4096, 1, 1024, 30528, 30528, 1024, 1024]
    - [15, 21505.0]
  - - [128, 32768, 1, 256, 128, 128, 256, 256]
    - [13, 18519.0]
  - - [256, 4608, 1, 1024, 256, 256, 1024, 1024]
    - [15, 17949.0]
  - - [256, 4864, 1, 1024, 256, 256, 1024, 1024]
    - [15, 18857.0]
  - - [256, 5376, 1, 1024, 256, 256, 1024, 1024]
    - [13, 15750.0]
  - - [256, 5888, 1, 1024, 256, 256, 1024, 1024]
    - [13, 16999.0]
  - - [256, 6144, 1, 1024, 256, 256, 1024, 1024]
    - [13, 17454.0]
  - - [256, 6400, 1, 1024, 256, 256, 1024, 1024]
    - [13, 18145.0]
  - - [256, 6656, 1, 1024, 256, 256, 1024, 1024]
    - [34, 16675.0]
  - - [256, 7168, 1, 1024, 256, 256, 1024, 1024]
    - [15, 17988.0]
  - - [256, 7424, 1, 1024, 256, 256, 1024, 1024]
    - [15, 18570.0]
  - - [256, 7936, 1, 1024, 256, 256, 1024, 1024]
    - [13, 17313.0]
  - - [256, 8192, 1, 1024, 256, 256, 1024, 1024]
    - [13, 18119.0]
  - - [256, 8448, 1, 1024, 256, 256, 1024, 1024]
    - [13, 18138.0]
  - - [256, 8960, 1, 1024, 256, 256, 1024, 1024]
    - [13, 18957.0]
  - - [256, 9984, 1, 1024, 256, 256, 1024, 1024]
    - [15, 19321.0]
  - - [256, 10496, 1, 1024, 256, 256, 1024, 1024]
    - [32, 18033.0]
  - - [256, 11264, 1, 1024, 256, 256, 1024, 1024]
    - [13, 18911.0]
  - - [256, 11520, 1, 1024, 256, 256, 1024, 1024]
    - [13, 19324.0]
  - - [256, 11776, 1, 1024, 256, 256, 1024, 1024]
    - [34, 18390.0]
  - - [256, 12544, 1, 1024, 256, 256, 1024, 1024]
    - [51, 19585.0]
  - - [256, 13312, 1, 1024, 256, 256, 1024, 1024]
    - [13, 19053.0]
  - - [256, 14336, 1, 1024, 256, 256, 1024, 1024]
    - [34, 18902.0]
  - - [256, 14592, 1, 1024, 256, 256, 1024, 1024]
    - [13, 19263.0]
  - - [256, 14848, 1, 1024, 256, 256, 1024, 1024]
    - [34, 19501.0]
  - - [256, 15104, 1, 1024, 256, 256, 1024, 1024]
    - [34, 19827.0]
  - - [256, 16128, 1, 1024, 256, 256, 1024, 1024]
    - [13, 19188.0]
  - - [256, 18176, 1, 1024, 256, 256, 1024, 1024]
    - [32, 19301.0]
  - - [256, 18944, 1, 1024, 256, 256, 1024, 1024]
    - [13, 19669.0]
  - - [256, 19200, 1, 1024, 256, 256, 1024, 1024]
    - [32, 20249.0]
  - - [256, 20480, 1, 1024, 256, 256, 1024, 1024]
    - [34, 20353.0]
  - - [256, 20992, 1, 1024, 256, 256, 1024, 1024]
    - [13, 19621.0]
  - - [256, 21248, 1, 1024, 256, 256, 1024, 1024]
    - [32, 20240.0]
  - - [256, 21504, 1, 1024, 256, 256, 1024, 1024]
    - [32, 20380.0]
  - - [256, 22016, 1, 1024, 256, 256, 1024, 1024]
    - [34, 20219.0]
  - - [256, 22344, 1, 1024, 256, 256, 1024, 1024]
    - [51, 18799.0]
  - - [256, 23296, 1, 1024, 256, 256, 1024, 1024]
    - [49, 19669.0]
  - - [256, 23552, 1, 1024, 256, 256, 1024, 1024]
    - [32, 19865.0]
  - - [256, 31488, 1, 1024, 256, 256, 1024, 1024]
    - [13, 20429.0]
  - - [256, 32768, 1, 512, 256, 256, 512, 512]
    - [13, 20443.0]
  - - [256, 33536, 1, 1024, 256, 256, 1024, 1024]
    - [13, 20406.0]
  - - [256, 44505, 1, 1024, 256, 256, 1024, 1024]
    - [32, 20474.0]
  - - [512, 32768, 1, 13, 512, 512, 13, 13]
    - [0, 6175.0]
  - - [512, 32768, 1, 1024, 512, 512, 1024, 1024]
    - [49, 20799.0]
  - - [684, 8976, 1, 256, 684, 684, 256, 256]
    - [13, 16728.0]
  - - [1024, 1600, 1, 560, 1024, 1024, 560, 560]
    - [21, 16233.0]
  - - [1024, 1600, 1, 1024, 1024, 1024, 1024, 1024]
    - [15, 16555.0]
  - - [1024, 32768, 1, 480, 1024, 1024, 480, 480]
    - [7, 21587.0]
  - - [1024, 32768, 1, 1024, 1024, 1024, 1024, 1024]
    - [15, 20998.0]
  - - [1280, 8976, 1, 256, 1280, 1280, 256, 256]
    - [41, 19669.0]
  - - [1792, 8976, 1, 256, 1792, 1792, 256, 256]
    - [32, 20225.0]
  - - [2048, 684, 1, 512, 2048, 2048, 512, 512]
    - [32, 15202.0]
  - - [2048, 684, 1, 768, 2048, 2048, 768, 768]
    - [23, 15934.0]
  - - [2048, 960, 1, 74, 2048, 2048, 74, 74]
    - [0, 8882.0]
  - - [2048, 960, 1, 2048, 2048, 2048, 2048, 2048]
    - [13, 16389.0]
  - - [2048, 1536, 1, 512, 2048, 2048, 512, 512]
    - [13, 18166.0]
  - - [2048, 1536, 1, 768, 2048, 2048, 768, 768]
    - [7, 18969.0]
  - - [2048, 8976, 1, 256, 2048, 2048, 256, 256]
    - [13, 20168.0]
  - - [2304, 8976, 1, 256, 2304, 2304, 256, 256]
    - [23, 20324.0]
  - - [2560, 8976, 1, 256, 2560, 2560, 256, 256]
    - [23, 20389.0]
  - - [2816, 8976, 1, 256, 2816, 2816, 256, 256]
    - [32, 20447.0]
  - - [3072, 8976, 1, 256, 3072, 3072, 256, 256]
    - [5, 20441.0]
  - - [3328, 8976, 1, 256, 3328, 3328, 256, 256]
    - [23, 20523.0]
  - - [3840, 8976, 1, 256, 3840, 3840, 256, 256]
    - [41, 20654.0]
  - - [4096, 8976, 1, 256, 4096, 4096, 256, 256]
    - [5, 20653.0]
  - - [4352, 8976, 1, 256, 4352, 4352, 256, 256]
    - [25, 20649.0]
  - - [4608, 8976, 1, 256, 4608, 4608, 256, 256]
    - [23, 20662.0]
  - - [4864, 8976, 1, 256, 4864, 4864, 256, 256]
    - [49, 20666.0]
  - - [5120, 8976, 1, 256, 5120, 5120, 256, 256]
    - [32, 20690.0]
  - - [5376, 8976, 1, 256, 5376, 5376, 256, 256]
    - [25, 20702.0]
  - - [5632, 8976, 1, 256, 5632, 5632, 256, 256]
    - [41, 20699.0]
  - - [5888, 8976, 1, 256, 5888, 5888, 256, 256]
    - [43, 20726.0]
  - - [6144, 8976, 1, 256, 6144, 6144, 256, 256]
    - [32, 20695.0]
  - - [6400, 8976, 1, 256, 6400, 6400, 256, 256]
    - [41, 20741.0]
  - - [7168, 8976, 1, 256, 7168, 7168, 256, 256]
    - [32, 20734.0]
  - - [7936, 8976, 1, 256, 7936, 7936, 256, 256]
    - [13, 20808.0]
  - - [8192, 8976, 1, 256, 8192, 8192, 256, 256]
    - [23, 20785.0]
  - - [8448, 8976, 1, 256, 8448, 8448, 256, 256]
    - [15, 20833.0]
  - - [8960, 8976, 1, 256, 8960, 8960, 256, 256]
    - [5, 20824.0]
  - - [9472, 8976, 1, 256, 9472, 9472, 256, 256]
    - [25, 20969.0]
  - - [9728, 8976, 1, 256, 9728, 9728, 256, 256]
    - [15, 20961.0]
  - - [9984, 8976, 1, 256, 9984, 9984, 256, 256]
    - [25, 21046.0]
  - - [10240, 8976, 1, 256, 10240, 10240, 256, 256]
    - [5, 20832.0]
  - - [10496, 8976, 1, 256, 10496, 10496, 256, 256]
    - [25, 21039.0]
  - - [11264, 8976, 1, 256, 11264, 11264, 256, 256]
    - [15, 20945.0]
  - - [11776, 8976, 1, 256, 11776, 11776, 256, 256]
    - [23, 20975.0]
  - - [12544, 8976, 1, 256, 12544, 12544, 256, 256]
    - [15, 21051.0]
  - - [13312, 8976, 1, 256, 13312, 13312, 256, 256]
    - [15, 21000.0]
  - - [13568, 8976, 1, 256, 13568, 13568, 256, 256]
    - [25, 21088.0]
  - - [13824, 8976, 1, 256, 13824, 13824, 256, 256]
    - [15, 21020.0]
  - - [15104, 8976, 1, 256, 15104, 15104, 256, 256]
    - [15, 21106.0]
  - - [15360, 8976, 1, 256, 15360, 15360, 256, 256]
    - [32, 21001.0]
  - - [15872, 8976, 1, 256, 15872, 15872, 256, 256]
    - [15, 21018.0]
  - - [16128, 8976, 1, 256, 16128, 16128, 256, 256]
    - [25, 21117.0]
  - - [17152, 8976, 1, 256, 17152, 17152, 256, 256]
    - [25, 21105.0]
  - - [18176, 8976, 1, 256, 18176, 18176, 256, 256]
    - [25, 21131.0]
  - - [18688, 8976, 1, 256, 18688, 18688, 256, 256]
    - [25, 21119.0]
  - - [18944, 8976, 1, 256, 18944, 18944, 256, 256]
    - [15, 21064.0]
  - - [19712, 8976, 1, 256, 19712, 19712, 256, 256]
    - [25, 21143.0]
  - - [19968, 8976, 1, 256, 19968, 19968, 256, 256]
    - [15, 21063.0]
  - - [20480, 8976, 1, 256, 20480, 20480, 256, 256]
    - [23, 21012.0]
  - - [20992, 8976, 1, 256, 20992, 20992, 256, 256]
    - [15, 21039.0]
  - - [21248, 8976, 1, 256, 21248, 21248, 256, 256]
    - [25, 21151.0]
  - - [23552, 8976, 1, 256, 23552, 23552, 256, 256]
    - [15, 21086.0]
  - - [28672, 8976, 1, 256, 28672, 28672, 256, 256]
    - [15, 21103.0]
  - - [31488, 8976, 1, 256, 31488, 31488, 256, 256]
    - [7, 21160.0]
  - - [33536, 8976, 1, 256, 33536, 33536, 256, 256]
    - [7, 21086.0]
  - - [44505, 8976, 1, 256, 44505, 44505, 256, 256]
    - [7, 21090.0]
  - - [1024, 3840, 1, 1024, 1024, 1024, 1024, 1024]
    - [15, 20510.0]
  - - [1024, 3840, 1, 4096, 1024, 1024, 4096, 4096]
    - [15, 21018.0]
  - - [1024, 3968, 1, 1024, 1024, 1024, 1024, 1024]
    - [13, 18892.0]
  - - [1024, 3968, 1, 4096, 1024, 1024, 4096, 4096]
    - [15, 19130.0]
  - - [1024, 6528, 1, 1024, 1024, 1024, 1024, 1024]
    - [13, 20096.0]
  - - [1024, 6528, 1, 4096, 1024, 1024, 4096, 4096]
    - [34, 18296.0]
  - - [1024, 7104, 1, 1024, 1024, 1024, 1024, 1024]
    - [34, 18669.0]
  - - [1024, 7104, 1, 4096, 1024, 1024, 4096, 4096]
    - [36, 16245.0]
  - - [1024, 7200, 1, 1024, 1024, 1024, 1024, 1024]
    - [15, 19288.0]
  - - [1024, 7200, 1, 4096, 1024, 1024, 4096, 4096]
    - [36, 16146.0]
  - - [1024, 8064, 1, 1024, 1024, 1024, 1024, 1024]
    - [15, 19556.0]
  - - [1024, 8064, 1, 4096, 1024, 1024, 4096, 4096]
    - [54, 15679.0]
  - - [1024, 8160, 1, 1024, 1024, 1024, 1024, 1024]
    - [15, 19777.0]
  - - [1024, 8160, 1, 4096, 1024, 1024, 4096, 4096]
    - [36, 15727.0]
  - - [1024, 9216, 1, 1024, 1024, 1024, 1024, 1024]
    - [15, 20129.0]
  - - [1024, 9216, 1, 4096, 1024, 1024, 4096, 4096]
    - [52, 13679.0]
  - - [1024, 9520, 1, 1024, 1024, 1024, 1024, 1024]
    - [13, 20187.0]
  - - [1024, 9520, 1, 4096, 1024, 1024, 4096, 4096]
    - [36, 16510.0]
  - - [1024, 10064, 1, 1024, 1024, 1024, 1024, 1024]
    - [15, 20690.0]
  - - [1024, 10064, 1, 4096, 1024, 1024, 4096, 4096]
    - [54, 17418.0]
  - - [1024, 10080, 1, 1024, 1024, 1024, 1024, 1024]
    - [15, 20791.0]
  - - [1024, 10080, 1, 4096, 1024, 1024, 4096, 4096]
    - [15, 19000.0]
  - - [1024, 10200, 1, 1024, 1024, 1024, 1024, 1024]
    - [15, 20910.0]
  - - [1024, 10200, 1, 4096, 1024, 1024, 4096, 4096]
    - [15, 19473.0]
  - - [4096, 3840, 1, 1024, 4096, 4096, 1024, 1024]
    - [15, 21400.0]
  - - [4096, 3968, 1, 1024, 4096, 4096, 1024, 1024]
    - [13, 20888.0]
  - - [4096, 6528, 1, 1024, 4096, 4096, 1024, 1024]
    - [15, 21179.0]
  - - [4096, 7104, 1, 1024, 4096, 4096, 1024, 1024]
    - [15, 21437.0]
  - - [4096, 7200, 1, 1024, 4096, 4096, 1024, 1024]
    - [15, 20977.0]
  - - [4096, 8064, 1, 1024, 4096, 4096, 1024, 1024]
    - [15, 21193.0]
  - - [4096, 8160, 1, 1024, 4096, 4096, 1024, 1024]
    - [15, 21475.0]
  - - [4096, 9216, 1, 1024, 4096, 4096, 1024, 1024]
    - [15, 21554.0]
  - - [4096, 9520, 1, 1024, 4096, 4096, 1024, 1024]
    - [15, 21122.0]
  - - [4096, 10064, 1, 1024, 4096, 4096, 1024, 1024]
    - [15, 21143.0]
  - - [4096, 10080, 1, 1024, 4096, 4096, 1024, 1024]
    - [15, 21238.0]
  - - [4096, 10200, 1, 1024, 4096, 4096, 1024, 1024]
    - [15, 21400.0]
  - - [42720, 3968, 1, 1024, 42720, 42720, 1024, 1024]
    - [34, 21155.0]
  - - [42720, 6528, 1, 1024, 42720, 42720, 1024, 1024]
    - [51, 21279.0]
  - - [42720, 7104, 1, 1024, 42720, 42720, 1024, 1024]
    - [15, 21270.0]
  - - [42720, 7200, 1, 1024, 42720, 42720, 1024, 1024]
    - [51, 20893.0]
  - - [42720, 9520, 1, 1024, 42720, 42720, 1024, 1024]
    - [15, 20995.0]
  - - [42720, 10080, 1, 1024, 42720, 42720, 1024, 1024]
    - [15, 21104.0]
  - - [1024, 3240, 1, 1024, 1024, 1024, 1024, 1024]
    - [13, 18185.0]
  - - [1024, 3240, 1, 4096, 1024, 1024, 4096, 4096]
    - [15, 17465.0]
  - - [1024, 3960, 1, 1024, 1024, 1024, 1024, 1024]
    - [32, 17632.0]
  - - [1024, 3960, 1, 4096, 1024, 1024, 4096, 4096]
    - [15, 18428.0]
  - - [4096, 3240, 1, 1024, 4096, 4096, 1024, 1024]
    - [15, 20595.0]
  - - [4096, 3960, 1, 1024, 4096, 4096, 1024, 1024]
    - [13, 20602.0]
  - - [42720, 3960, 1, 1024, 42720, 42720, 1024, 1024]
    - [34, 21216.0]
  - - [7680, 8192, 1, 8192, 7680, 7680, 8192, 8192]
    - [25, 18582.0]
  - - [3840, 4096, 1, 4096, 3840, 3840, 4096, 4096]
    - [54, 17226.0]
  - - [1920, 2048, 1, 2048, 1920, 1920, 2048, 2048]
    - [15, 18869.0]
  - - [8192, 7680, 1, 8192, 8192, 8192, 8192, 8192]
    - [15, 18190.0]
  - - [4096, 3840, 1, 4096, 4096, 4096, 4096, 4096]
    - [49, 17969.0]
  - - [2048, 1920, 1, 2048, 2048, 2048, 2048, 2048]
    - [13, 18585.0]
  - - [512, 512, 16, 64, 512, 512, 64, 64]
    - [33, 12509.0]
  - - [512, 512, 128, 64, 512, 512, 64, 64]
    - [42, 16976.0]
  - - [4096, 512, 1, 1024, 4096, 4096, 1024, 1024]
    - [13, 17905.0]
  - - [30522, 616, 1, 1024, 30522, 30522, 1024, 1024]
    - [13, 19930.0]
  - - [128, 128, 128, 64, 128, 128, 64, 64]
    - [42, 9883.0]
  - - [128, 128, 160, 64, 128, 128, 64, 64]
    - [4, 11716.0]
  - - [1024, 1280, 1, 1024, 1024, 1024, 1024, 1024]
    - [15, 19554.0]
  - - [1024, 1280, 1, 4096, 1024, 1024, 4096, 4096]
    - [15, 19689.0]
  - - [4096, 1280, 1, 1024, 4096, 4096, 1024, 1024]
    - [15, 20171.0]
  - - [30522, 160, 1, 1024, 30522, 30522, 1024, 1024]
    - [32, 13011.0]
  - - [30522, 200, 1, 1024, 30522, 30522, 1024, 1024]
    - [13, 16000.0]
  - - [128, 128, 624, 64, 128, 128, 64, 64]
    - [6, 15259.0]
  - - [1024, 4992, 1, 1024, 1024, 1024, 1024, 1024]
    - [15, 20226.0]
  - - [1024, 4992, 1, 4096, 1024, 1024, 4096, 4096]
    - [15, 20219.0]
  - - [4096, 4992, 1, 1024, 4096, 4096, 1024, 1024]
    - [15, 21046.0]
  - - [30522, 780, 1, 1024, 30522, 30522, 1024, 1024]
    - [13, 18200.0]
  - - [30522, 308, 1, 1024, 30522, 30522, 1024, 1024]
    - [32, 16575.0]
  - - [128, 128, 640, 64, 128, 128, 64, 64]
    - [40, 12662.0]
  - - [1024, 5120, 1, 1024, 1024, 1024, 1024, 1024]
    - [15, 20735.0]
  - - [1024, 5120, 1, 4096, 1024, 1024, 4096, 4096]
    - [34, 18292.0]
  - - [4096, 5120, 1, 1024, 4096, 4096, 1024, 1024]
    - [15, 21676.0]
  - - [30522, 800, 1, 1024, 30522, 30522, 1024, 1024]
    - [13, 18675.0]
  - - [128, 128, 656, 64, 128, 128, 64, 64]
    - [50, 14806.0]
  - - [1024, 5248, 1, 1024, 1024, 1024, 1024, 1024]
    - [13, 19381.0]
  - - [1024, 5248, 1, 4096, 1024, 1024, 4096, 4096]
    - [34, 18198.0]
  - - [4096, 5248, 1, 1024, 4096, 4096, 1024, 1024]
    - [15, 21021.0]
  - - [30522, 820, 1, 1024, 30522, 30522, 1024, 1024]
    - [13, 19085.0]
  - - [512, 512, 80, 64, 512, 512, 64, 64]
    - [6, 17059.0]
  - - [1024, 2560, 1, 1024, 1024, 1024, 1024, 1024]
    - [15, 20229.0]
  - - [1024, 2560, 1, 4096, 1024, 1024, 4096, 4096]
    - [15, 20553.0]
  - - [4096, 2560, 1, 1024, 4096, 4096, 1024, 1024]
    - [15, 21324.0]
  - - [30522, 385, 1, 1024, 30522, 30522, 1024, 1024]
    - [51, 15828.0]
  - - [512, 512, 96, 64, 512, 512, 64, 64]
    - [33, 17015.0]
  - - [1024, 3072, 1, 1024, 1024, 1024, 1024, 1024]
    - [15, 19119.0]
  - - [1024, 3072, 1, 4096, 1024, 1024, 4096, 4096]
    - [15, 19639.0]
  - - [4096, 3072, 1, 1024, 4096, 4096, 1024, 1024]
    - [15, 20809.0]
  - - [30522, 462, 1, 1024, 30522, 30522, 1024, 1024]
    - [15, 18815.0]
  - - [4096, 1024, 1, 1024, 4096, 4096, 1024, 1024]
    - [13, 19281.0]
  - - [128, 128, 144, 64, 128, 128, 64, 64]
    - [22, 8956.0]
  - - [1024, 1152, 1, 1024, 1024, 1024, 1024, 1024]
    - [15, 16511.0]
  - - [1024, 1152, 1, 4096, 1024, 1024, 4096, 4096]
    - [15, 17793.0]
  - - [4096, 1152, 1, 1024, 4096, 4096, 1024, 1024]
    - [13, 19168.0]
  - - [30522, 180, 1, 1024, 30522, 30522, 1024, 1024]
    - [32, 14600.0]
  - - [1024, 32768, 1, 479, 1024, 1024, 479, 479]
    - [7, 21265.0]
  - - [1024, 8192, 1, 1024, 1024, 1024, 1024, 1024]
    - [15, 20841.0]
  - - [1024, 8192, 1, 4096, 1024, 1024, 4096, 4096]
    - [54, 15604.0]
  - - [1024, 9600, 1, 1024, 1024, 1024, 1024, 1024]
    - [13, 20534.0]
  - - [1024, 9600, 1, 4096, 1024, 1024, 4096, 4096]
    - [54, 16667.0]
  - - [4096, 8192, 1, 1024, 4096, 4096, 1024, 1024]
    - [15, 21674.0]
  - - [4096, 9600, 1, 1024, 4096, 4096, 1024, 1024]
    - [15, 21342.0]
  - - [33712, 8192, 1, 1024, 33712, 33712, 1024, 1024]
    - [15, 20991.0]
  - - [33712, 9600, 1, 1024, 33712, 33712, 1024, 1024]
    - [15, 20419.0]
  - - [1024, 1024, 128, 96, 1024, 1024, 96, 96]
    - [5, 19924.0]
  - - [30592, 4096, 1, 1024, 30592, 30592, 1024, 1024]
    - [15, 21622.0]
  - - [1536, 8192, 1, 1536, 1536, 1536, 1536, 1536]
    - [15, 21211.0]
  - - [3072, 8192, 1, 1024, 3072, 3072, 1024, 1024]
    - [15, 21619.0]
  - - [3072, 2048, 1, 1024, 3072, 3072, 1024, 1024]
    - [15, 20091.0]
  - - [50304, 8192, 1, 1024, 50304, 50304, 1024, 1024]
    - [51, 21222.0]
  - - [2048, 1024, 1, 8192, 2048, 2048, 8192, 8192]
    - [15, 16317.0]
  - - [50304, 2048, 1, 1024, 50304, 50304, 1024, 1024]
    - [34, 22040.0]
  - - [1536, 8192, 1, 6144, 1536, 1536, 6144, 6144]
    - [51, 19228.0]
  - - [50304, 4096, 1, 1536, 50304, 50304, 1536, 1536]
    - [15, 21051.0]
  - - [8192, 1024, 1, 2048, 8192, 8192, 2048, 2048]
    - [13, 19865.0]
  - - [2560, 2048, 1, 640, 2560, 2560, 640, 640]
    - [7, 20383.0]
  - - [1024, 1024, 128, 64, 1024, 1024, 64, 64]
    - [13, 17705.0]
  - - [2048, 1024, 1, 2048, 2048, 2048, 2048, 2048]
    - [13, 17793.0]
  - - [1536, 4096, 1, 1536, 1536, 1536, 1536, 1536]
    - [15, 20675.0]
  - - [1024, 1024, 64, 64, 1024, 1024, 64, 64]
    - [5, 17509.0]
  - - [30592, 8192, 1, 1024, 30592, 30592, 1024, 1024]
    - [15, 20817.0]
  - - [50304, 16384, 1, 1024, 50304, 50304, 1024, 1024]
    - [51, 21436.0]
  - - [4608, 4096, 1, 1536, 4608, 4608, 1536, 1536]
    - [15, 21679.0]
  - - [2560, 2048, 1, 2560, 2560, 2560, 2560, 2560]
    - [15, 21221.0]
  - - [7680, 2048, 1, 2560, 7680, 7680, 2560, 2560]
    - [43, 20429.0]
  - - [50304, 4096, 1, 1024, 50304, 50304, 1024, 1024]
    - [34, 21062.0]
  - - [1920, 2048, 1, 2560, 1920, 1920, 2560, 2560]
    - [51, 19781.0]
  - - [1024, 1024, 64, 96, 1024, 1024, 96, 96]
    - [13, 19447.0]
  - - [6144, 4096, 1, 1536, 6144, 6144, 1536, 1536]
    - [15, 21587.0]
  - - [1536, 4096, 1, 6144, 1536, 1536, 6144, 6144]
    - [34, 18681.0]
  - - [512, 512, 256, 64, 512, 512, 64, 64]
    - [13, 15991.0]
  - - [50304, 8192, 1, 1536, 50304, 50304, 1536, 1536]
    - [51, 21150.0]
  - - [6144, 8192, 1, 1536, 6144, 6144, 1536, 1536]
    - [15, 21554.0]
  - - [4096, 16384, 1, 1024, 4096, 4096, 1024, 1024]
    - [15, 21285.0]
  - - [30592, 1024, 1, 2048, 30592, 30592, 2048, 2048]
    - [34, 20446.0]
  - - [1024, 16384, 1, 4096, 1024, 1024, 4096, 4096]
    - [51, 18632.0]
  - - [512, 512, 40, 64, 512, 512, 64, 64]
    - [6, 14814.0]
  - - [6144, 1024, 1, 2048, 6144, 6144, 2048, 2048]
    - [15, 20313.0]
  - - [4608, 8192, 1, 1536, 4608, 4608, 1536, 1536]
    - [15, 21615.0]
  - - [30592, 2048, 1, 1024, 30592, 30592, 1024, 1024]
    - [15, 21414.0]
  - - [3072, 16384, 1, 1024, 3072, 3072, 1024, 1024]
    - [15, 21237.0]
  - - [1024, 1024, 256, 64, 1024, 1024, 64, 64]
    - [5, 17750.0]
  - - [1024, 16384, 1, 1024, 1024, 1024, 1024, 1024]
    - [15, 21344.0]
  - - [1024, 1024, 32, 64, 1024, 1024, 64, 64]
    - [14, 17279.0]
  - - [3072, 4096, 1, 1024, 3072, 3072, 1024, 1024]
    - [15, 20844.0]
  - - [30528, 8192, 1, 1024, 30528, 30528, 1024, 1024]
    - [15, 20660.0]
  - - [128, 128, 1024, 64, 128, 128, 64, 64]
    - [48, 12996.0]
  - - [1024, 3456, 1, 1024, 1024, 1024, 1024, 1024]
    - [13, 19073.0]
  - - [1024, 3456, 1, 480, 1024, 1024, 480, 480]
    - [32, 19396.0]
  - - [1024, 4096, 1, 480, 1024, 1024, 480, 480]
    - [5, 19475.0]
  - - [1024, 6912, 1, 1024, 1024, 1024, 1024, 1024]
    - [15, 20180.0]
  - - [1024, 6912, 1, 480, 1024, 1024, 480, 480]
    - [7, 20863.0]
  - - [128, 55296, 1, 256, 128, 128, 256, 256]
    - [49, 19687.0]
  - - [256, 55296, 1, 512, 256, 256, 512, 512]
    - [49, 20466.0]
  - - [256, 6912, 1, 512, 256, 256, 512, 512]
    - [13, 17490.0]
  - - [512, 3456, 1, 1024, 512, 512, 1024, 1024]
    - [49, 17293.0]
  - - [512, 3456, 1, 13, 512, 512, 13, 13]
    - [22, 2014.0]
  - - [512, 4096, 1, 1024, 512, 512, 1024, 1024]
    - [49, 17730.0]
  - - [512, 4096, 1, 13, 512, 512, 13, 13]
    - [19, 3341.0]
  - - [512, 55296, 1, 13, 512, 512, 13, 13]
    - [42, 7713.0]
  - - [512, 6912, 1, 1024, 512, 512, 1024, 1024]
    - [32, 19264.0]
  - - [512, 6912, 1, 13, 512, 512, 13, 13]
    - [40, 4657.0]
  - - [30528, 640, 1, 1024, 30528, 30528, 1024, 1024]
    - [13, 20817.0]
  - - [30528, 1280, 1, 1024, 30528, 30528, 1024, 1024]
    - [51, 21353.0]
  - - [30528, 1600, 1, 1024, 30528, 30528, 1024, 1024]
    - [13, 20281.0]
  - - [1024, 10240, 1, 1024, 1024, 1024, 1024, 1024]
    - [15, 21159.0]
  - - [4096, 10240, 1, 1024, 4096, 4096, 1024, 1024]
    - [15, 21525.0]
  - - [1024, 10240, 1, 4096, 1024, 1024, 4096, 4096]
    - [15, 19518.0]
  - - [128, 128, 1280, 64, 128, 128, 64, 64]
    - [41, 17050.0]
  - - [1024, 10496, 1, 4096, 1024, 1024, 4096, 4096]
    - [34, 19573.0]
  - - [30528, 1640, 1, 1024, 30528, 30528, 1024, 1024]
    - [13, 20741.0]
  - - [4096, 10496, 1, 1024, 4096, 4096, 1024, 1024]
    - [15, 21453.0]
  - - [1024, 10496, 1, 1024, 1024, 1024, 1024, 1024]
    - [15, 20645.0]
  - - [128, 128, 1312, 64, 128, 128, 64, 64]
    - [24, 13995.0]
  - - [30528, 160, 1, 1024, 30528, 30528, 1024, 1024]
    - [32, 12859.0]
  - - [30528, 240, 1, 1024, 30528, 30528, 1024, 1024]
    - [49, 19172.0]
  - - [1024, 6144, 1, 1024, 1024, 1024, 1024, 1024]
    - [15, 20247.0]
  - - [4096, 6144, 1, 1024, 4096, 4096, 1024, 1024]
    - [15, 21508.0]
  - - [1024, 6144, 1, 4096, 1024, 1024, 4096, 4096]
    - [51, 19358.0]
  - - [512, 512, 192, 64, 512, 512, 64, 64]
    - [32, 17606.0]
  - - [1024, 10224, 1, 1024, 1024, 1024, 1024, 1024]
    - [15, 20978.0]
  - - [1024, 10192, 1, 1024, 1024, 1024, 1024, 1024]
    - [15, 21003.0]
  - - [1024, 10208, 1, 1024, 1024, 1024, 1024, 1024]
    - [15, 21127.0]
  - - [1024, 10224, 1, 4096, 1024, 1024, 4096, 4096]
    - [34, 19417.0]
  - - [4096, 10224, 1, 1024, 4096, 4096, 1024, 1024]
    - [15, 21437.0]
  - - [3072, 10224, 1, 1024, 3072, 3072, 1024, 1024]
    - [15, 21529.0]
  - - [3072, 10240, 1, 1024, 3072, 3072, 1024, 1024]
    - [15, 21724.0]
  - - [1024, 10192, 1, 4096, 1024, 1024, 4096, 4096]
    - [34, 18896.0]
  - - [4096, 10192, 1, 1024, 4096, 4096, 1024, 1024]
    - [15, 21302.0]
  - - [3072, 10192, 1, 1024, 3072, 3072, 1024, 1024]
    - [15, 21454.0]
  - - [3072, 10200, 1, 1024, 3072, 3072, 1024, 1024]
    - [15, 21482.0]
  - - [1024, 10184, 1, 1024, 1024, 1024, 1024, 1024]
    - [15, 21016.0]
  - - [3072, 10208, 1, 1024, 3072, 3072, 1024, 1024]
    - [15, 21596.0]
  - - [1024, 10208, 1, 4096, 1024, 1024, 4096, 4096]
    - [15, 19524.0]
  - - [4096, 10208, 1, 1024, 4096, 4096, 1024, 1024]
    - [15, 21399.0]
  - - [2048, 10224, 1, 1024, 2048, 2048, 1024, 1024]
    - [15, 21417.0]
  - - [2048, 10240, 1, 1024, 2048, 2048, 1024, 1024]
    - [15, 21631.0]
  - - [1024, 10120, 1, 1024, 1024, 1024, 1024, 1024]
    - [15, 20929.0]
  - - [2048, 10192, 1, 1024, 2048, 2048, 1024, 1024]
    - [15, 21382.0]
  - - [1024, 10152, 1, 1024, 1024, 1024, 1024, 1024]
    - [15, 20934.0]
  - - [3072, 10080, 1, 1024, 3072, 3072, 1024, 1024]
    - [15, 21391.0]
  - - [1024, 2048, 1, 49, 1024, 1024, 49, 49]
    - [28, 10055.0]
  - - [4608, 512, 1, 49, 4608, 4608, 49, 49]
    - [18, 11469.0]
  - - [256, 256, 25, 12544, 256, 256, 12544, 12544]
    - [35, 15436.0]
  - - [256, 256, 49, 3200, 256, 256, 3200, 3200]
    - [43, 21000.0]
  - - [256, 256, 25, 6272, 256, 256, 6272, 6272]
    - [5, 19940.0]
  - - [256, 256, 49, 6400, 256, 256, 6400, 6400]
    - [34, 18659.0]
  - - [512, 512, 49, 1152, 512, 512, 1152, 1152]
    - [43, 21570.0]
  - - [512, 512, 25, 2048, 512, 512, 2048, 2048]
    - [32, 18355.0]
  - - [512, 512, 49, 2304, 512, 512, 2304, 2304]
    - [15, 20824.0]
  - - [512, 512, 25, 4096, 512, 512, 4096, 4096]
    - [36, 17887.0]
  - - [128, 128, 2048, 64, 128, 128, 64, 64]
    - [22, 12090.0]
  - - [30528, 2560, 1, 1024, 30528, 30528, 1024, 1024]
    - [15, 21520.0]
  - - [128, 128, 1536, 64, 128, 128, 64, 64]
    - [50, 14738.0]
  - - [1024, 12288, 1, 1024, 1024, 1024, 1024, 1024]
    - [15, 20947.0]
  - - [1024, 12288, 1, 4096, 1024, 1024, 4096, 4096]
    - [34, 18801.0]
  - - [30528, 1920, 1, 1024, 30528, 30528, 1024, 1024]
    - [13, 21144.0]
  - - [4096, 12288, 1, 1024, 4096, 4096, 1024, 1024]
    - [15, 21465.0]
  - - [128, 128, 81, 12544, 128, 128, 12544, 12544]
    - [35, 12593.0]
  - - [128, 128, 121, 9216, 128, 128, 9216, 9216]
    - [52, 12491.0]
  - - [128, 128, 169, 6400, 128, 128, 6400, 6400]
    - [16, 14827.0]
  - - [256, 256, 36, 4096, 256, 256, 4096, 4096]
    - [36, 15856.0]
  - - [256, 256, 49, 2304, 256, 256, 2304, 2304]
    - [51, 18995.0]
  - - [256, 256, 64, 2304, 256, 256, 2304, 2304]
    - [51, 17753.0]
  - - [256, 256, 81, 4096, 256, 256, 4096, 4096]
    - [54, 16097.0]
  - - [256, 256, 121, 2304, 256, 256, 2304, 2304]
    - [51, 18568.0]
  - - [256, 256, 169, 2304, 256, 256, 2304, 2304]
    - [51, 19661.0]
  - - [512, 512, 81, 1024, 512, 512, 1024, 1024]
    - [15, 20348.0]
  - - [512, 512, 121, 1024, 512, 512, 1024, 1024]
    - [15, 20402.0]
  - - [512, 512, 169, 1024, 512, 512, 1024, 1024]
    - [15, 20631.0]
  - - [512, 512, 36, 1024, 512, 512, 1024, 1024]
    - [15, 19942.0]
  - - [512, 512, 49, 1024, 512, 512, 1024, 1024]
    - [15, 20151.0]
  - - [512, 512, 64, 1024, 512, 512, 1024, 1024]
    - [15, 20027.0]
  - - [128, 128, 192, 64, 128, 128, 64, 64]
    - [4, 12172.0]
  - - [768, 2048, 1, 768, 768, 768, 768, 768]
    - [13, 18578.0]
  - - [3072, 2048, 1, 768, 3072, 3072, 768, 768]
    - [32, 20195.0]
  - - [768, 2048, 1, 3072, 768, 768, 3072, 3072]
    - [32, 17091.0]
  - - [384, 384, 144, 64, 384, 384, 64, 64]
    - [41, 17690.0]
  - - [768, 4608, 1, 768, 768, 768, 768, 768]
    - [49, 19386.0]
  - - [3072, 4608, 1, 768, 3072, 3072, 768, 768]
    - [7, 21234.0]
  - - [768, 4608, 1, 3072, 768, 768, 3072, 3072]
    - [15, 19413.0]
  - - [512, 512, 48, 64, 512, 512, 64, 64]
    - [24, 16190.0]
  - - [128, 128, 256, 64, 128, 128, 64, 64]
    - [22, 11074.0]
  - - [384, 384, 192, 64, 384, 384, 64, 64]
    - [49, 17969.0]
  - - [1024, 4608, 1, 1024, 1024, 1024, 1024, 1024]
    - [13, 19605.0]
  - - [4096, 4608, 1, 1024, 4096, 4096, 1024, 1024]
    - [15, 21464.0]
  - - [1024, 4608, 1, 4096, 1024, 1024, 4096, 4096]
    - [15, 19301.0]
  - - [2880, 3072, 1, 3072, 2880, 2880, 3072, 3072]
    - [15, 20865.0]
  - - [3072, 3072, 1, 3072, 3072, 3072, 3072, 3072]
    - [15, 21124.0]
  - - [3072, 512, 1, 3072, 3072, 3072, 3072, 3072]
    - [14, 16792.0]
  - - [4096, 512, 1, 4096, 4096, 4096, 4096, 4096]
    - [13, 16421.0]
  - - [512, 3072, 1, 3072, 512, 512, 3072, 3072]
    - [32, 17709.0]
  - - [512, 4096, 1, 4096, 512, 512, 4096, 4096]
    - [32, 17928.0]
  - - [512, 8192, 1, 8192, 512, 512, 8192, 8192]
    - [54, 16468.0]
  - - [8192, 512, 1, 8192, 8192, 8192, 8192, 8192]
    - [15, 17951.0]
  - - [256, 256, 36, 432, 256, 256, 432, 432]
    - [15, 17664.0]
  - - [256, 256, 36, 456, 256, 256, 456, 456]
    - [34, 17683.0]
  - - [256, 256, 36, 504, 256, 256, 504, 504]
    - [1, 17144.0]
  - - [256, 256, 49, 1120, 256, 256, 1120, 1120]
    - [7, 20696.0]
  - - [256, 256, 36, 442, 256, 256, 442, 442]
    - [43, 16178.0]
  - - [256, 256, 49, 950, 256, 256, 950, 950]
    - [25, 19375.0]
  - - [256, 256, 64, 616, 256, 256, 616, 616]
    - [41, 18717.0]
  - - [256, 256, 64, 660, 256, 256, 660, 660]
    - [23, 19070.0]
  - - [256, 256, 36, 408, 256, 256, 408, 408]
    - [43, 16097.0]
  - - [256, 256, 49, 1008, 256, 256, 1008, 1008]
    - [51, 17375.0]
  - - [256, 256, 36, 462, 256, 256, 462, 462]
    - [7, 16411.0]
  - - [256, 256, 36, 468, 256, 256, 468, 468]
    - [43, 16411.0]
  - - [256, 256, 36, 494, 256, 256, 494, 494]
    - [41, 16574.0]
  - - [512, 512, 64, 48, 512, 512, 48, 48]
    - [50, 16080.0]
  - - [256, 256, 64, 140, 256, 256, 140, 140]
    - [42, 14636.0]
  - - [512, 512, 64, 56, 512, 512, 56, 56]
    - [19, 15372.0]
  - - [512, 512, 49, 90, 512, 512, 90, 90]
    - [42, 16142.0]
  - - [512, 512, 49, 60, 512, 512, 60, 60]
    - [24, 14547.0]
  - - [256, 256, 49, 864, 256, 256, 864, 864]
    - [43, 19487.0]
  - - [256, 256, 64, 224, 256, 256, 224, 224]
    - [41, 17680.0]
  - - [256, 256, 64, 176, 256, 256, 176, 176]
    - [23, 16800.0]
  - - [256, 256, 64, 154, 256, 256, 154, 154]
    - [41, 14869.0]
  - - [512, 512, 49, 80, 512, 512, 80, 80]
    - [49, 17219.0]
  - - [256, 256, 49, 1200, 256, 256, 1200, 1200]
    - [7, 20627.0]
  - - [256, 256, 64, 704, 256, 256, 704, 704]
    - [23, 19396.0]
  - - [256, 256, 64, 768, 256, 256, 768, 768]
    - [5, 18652.0]
  - - [256, 256, 49, 1160, 256, 256, 1160, 1160]
    - [5, 15326.0]
  - - [256, 256, 49, 320, 256, 256, 320, 320]
    - [51, 17971.0]
  - - [512, 512, 49, 70, 512, 512, 70, 70]
    - [33, 15081.0]
  - - [256, 256, 49, 1240, 256, 256, 1240, 1240]
    - [7, 20536.0]
  - - [256, 256, 36, 384, 256, 256, 384, 384]
    - [23, 17389.0]
  - - [1024, 2048, 1, 888, 1024, 1024, 888, 888]
    - [1, 18301.0]
  - - [1024, 2048, 1, 713, 1024, 1024, 713, 713]
    - [5, 17521.0]
  - - [1024, 2048, 1, 660, 1024, 1024, 660, 660]
    - [1, 17677.0]
  - - [1024, 2048, 1, 726, 1024, 1024, 726, 726]
    - [1, 17659.0]
  - - [1024, 2048, 1, 672, 1024, 1024, 672, 672]
    - [1, 18485.0]
  - - [1024, 2048, 1, 850, 1024, 1024, 850, 850]
    - [5, 17719.0]
  - - [1024, 2048, 1, 805, 1024, 1024, 805, 805]
    - [19, 17756.0]
  - - [1024, 2048, 1, 864, 1024, 1024, 864, 864]
    - [5, 17969.0]
  - - [1024, 2048, 1, 768, 1024, 1024, 768, 768]
    - [13, 17491.0]
  - - [1024, 2048, 1, 950, 1024, 1024, 950, 950]
    - [1, 17952.0]
  - - [256, 128, 49, 1152, 256, 256, 1152, 1152]
    - [5, 18270.0]
  - - [256, 128, 121, 120, 256, 256, 120, 120]
    - [24, 13086.0]
  - - [256, 128, 169, 120, 256, 256, 120, 120]
    - [24, 15454.0]
  - - [256, 128, 36, 120, 256, 256, 120, 120]
    - [1, 9983.0]
  - - [256, 128, 49, 120, 256, 256, 120, 120]
    - [14, 10824.0]
  - - [256, 128, 64, 120, 256, 256, 120, 120]
    - [50, 11470.0]
  - - [256, 128, 36, 12000, 256, 256, 12000, 12000]
    - [49, 18332.0]
  - - [256, 128, 49, 1216, 256, 256, 1216, 1216]
    - [5, 19086.0]
  - - [256, 128, 121, 18, 256, 256, 18, 18]
    - [4, 4991.0]
  - - [256, 128, 169, 18, 256, 256, 18, 18]
    - [4, 5651.0]
  - - [256, 128, 36, 18, 256, 256, 18, 18]
    - [0, 4719.0]
  - - [256, 128, 49, 18, 256, 256, 18, 18]
    - [9, 4833.0]
  - - [256, 128, 64, 18, 256, 256, 18, 18]
    - [9, 4815.0]
  - - [256, 128, 36, 1800, 256, 256, 1800, 1800]
    - [5, 17778.0]
  - - [256, 128, 121, 19, 256, 256, 19, 19]
    - [12, 5483.0]
  - - [256, 128, 169, 19, 256, 256, 19, 19]
    - [4, 6377.0]
  - - [256, 128, 36, 19, 256, 256, 19, 19]
    - [9, 3013.0]
  - - [256, 128, 49, 19, 256, 256, 19, 19]
    - [4, 3459.0]
  - - [256, 128, 64, 19, 256, 256, 19, 19]
    - [0, 3977.0]
  - - [256, 128, 36, 1900, 256, 256, 1900, 1900]
    - [41, 17201.0]
  - - [256, 128, 49, 480, 256, 256, 480, 480]
    - [41, 16567.0]
  - - [256, 128, 81, 480, 256, 256, 480, 480]
    - [5, 16512.0]
  - - [256, 128, 64, 5880, 256, 256, 5880, 5880]
    - [5, 17576.0]
  - - [256, 128, 49, 72, 256, 256, 72, 72]
    - [4, 10194.0]
  - - [256, 128, 81, 72, 256, 256, 72, 72]
    - [4, 12458.0]
  - - [256, 128, 49, 76, 256, 256, 76, 76]
    - [4, 10876.0]
  - - [256, 128, 81, 76, 256, 256, 76, 76]
    - [4, 11838.0]
  - - [256, 128, 49, 7680, 256, 256, 7680, 7680]
    - [53, 13712.0]
  - - [256, 128, 64, 882, 256, 256, 882, 882]
    - [5, 18011.0]
  - - [256, 128, 64, 931, 256, 256, 931, 931]
    - [23, 18149.0]
  - - [256, 256, 49, 1152, 256, 256, 1152, 1152]
    - [7, 20639.0]
  - - [256, 256, 36, 12000, 256, 256, 12000, 12000]
    - [25, 19767.0]
  - - [256, 256, 49, 1216, 256, 256, 1216, 1216]
    - [21, 20813.0]
  - - [256, 256, 36, 1800, 256, 256, 1800, 1800]
    - [7, 19185.0]
  - - [256, 256, 36, 1900, 256, 256, 1900, 1900]
    - [15, 15230.0]
  - - [256, 256, 64, 5880, 256, 256, 5880, 5880]
    - [5, 20661.0]
  - - [256, 256, 49, 7680, 256, 256, 7680, 7680]
    - [36, 17451.0]
  - - [256, 256, 64, 882, 256, 256, 882, 882]
    - [5, 20129.0]
  - - [256, 256, 64, 931, 256, 256, 931, 931]
    - [41, 20013.0]
  - - [512, 256, 81, 1080, 512, 512, 1080, 1080]
    - [43, 20944.0]
  - - [512, 256, 25, 12000, 512, 512, 12000, 12000]
    - [25, 21915.0]
  - - [512, 256, 81, 162, 512, 512, 162, 162]
    - [5, 18458.0]
  - - [512, 256, 81, 171, 512, 512, 171, 171]
    - [41, 19094.0]
  - - [512, 256, 25, 1800, 512, 512, 1800, 1800]
    - [7, 21316.0]
  - - [512, 256, 25, 1900, 512, 512, 1900, 1900]
    - [27, 16179.0]
  - - [512, 256, 121, 1920, 512, 512, 1920, 1920]
    - [43, 21679.0]
  - - [512, 256, 169, 1920, 512, 512, 1920, 1920]
    - [25, 22068.0]
  - - [512, 256, 49, 1920, 512, 512, 1920, 1920]
    - [43, 21324.0]
  - - [512, 256, 121, 288, 512, 512, 288, 288]
    - [41, 20575.0]
  - - [512, 256, 169, 288, 512, 512, 288, 288]
    - [43, 20795.0]
  - - [512, 256, 49, 288, 512, 512, 288, 288]
    - [41, 19758.0]
  - - [512, 256, 25, 3000, 512, 512, 3000, 3000]
    - [25, 21569.0]
  - - [512, 256, 81, 3000, 512, 512, 3000, 3000]
    - [43, 21402.0]
  - - [512, 256, 121, 304, 512, 512, 304, 304]
    - [23, 20622.0]
  - - [512, 256, 169, 304, 512, 512, 304, 304]
    - [7, 20865.0]
  - - [512, 256, 49, 304, 512, 512, 304, 304]
    - [7, 19790.0]
  - - [512, 256, 25, 450, 512, 512, 450, 450]
    - [5, 19484.0]
  - - [512, 256, 81, 450, 512, 512, 450, 450]
    - [5, 20121.0]
  - - [512, 256, 25, 475, 512, 512, 475, 475]
    - [23, 19593.0]
  - - [512, 256, 81, 475, 512, 512, 475, 475]
    - [5, 19969.0]
  - - [512, 256, 121, 480, 512, 512, 480, 480]
    - [25, 21039.0]
  - - [512, 256, 169, 480, 512, 512, 480, 480]
    - [7, 21387.0]
  - - [512, 256, 49, 5880, 512, 512, 5880, 5880]
    - [25, 21678.0]
  - - [512, 256, 121, 72, 512, 512, 72, 72]
    - [24, 16355.0]
  - - [512, 256, 169, 72, 512, 512, 72, 72]
    - [5, 17043.0]
  - - [512, 256, 121, 76, 512, 512, 76, 76]
    - [24, 16718.0]
  - - [512, 256, 169, 76, 512, 512, 76, 76]
    - [5, 17053.0]
  - - [512, 256, 49, 882, 512, 512, 882, 882]
    - [7, 20881.0]
  - - [512, 256, 49, 931, 512, 512, 931, 931]
    - [25, 20750.0]
  - - [2304, 512, 1, 100, 2304, 2304, 100, 100]
    - [19, 13497.0]
  - - [2304, 512, 1, 361, 2304, 2304, 361, 361]
    - [1, 17034.0]
  - - [4608, 510, 1, 100, 4608, 4608, 100, 100]
    - [0, 10218.0]
  - - [4608, 510, 1, 361, 4608, 4608, 361, 361]
    - [41, 15875.0]
  - - [340, 256, 49, 1152, 340, 340, 1152, 1152]
    - [5, 18095.0]
  - - [340, 256, 36, 120, 340, 340, 120, 120]
    - [42, 13381.0]
  - - [340, 256, 49, 120, 340, 340, 120, 120]
    - [42, 13847.0]
  - - [340, 256, 64, 120, 340, 340, 120, 120]
    - [5, 14259.0]
  - - [340, 256, 36, 12000, 340, 340, 12000, 12000]
    - [23, 18373.0]
  - - [340, 256, 49, 1216, 340, 340, 1216, 1216]
    - [5, 18034.0]
  - - [340, 256, 36, 18, 340, 340, 18, 18]
    - [22, 3922.0]
  - - [340, 256, 49, 18, 340, 340, 18, 18]
    - [31, 4342.0]
  - - [340, 256, 64, 18, 340, 340, 18, 18]
    - [4, 4545.0]
  - - [340, 256, 36, 1800, 340, 340, 1800, 1800]
    - [23, 17932.0]
  - - [340, 256, 36, 19, 340, 340, 19, 19]
    - [40, 4193.0]
  - - [340, 256, 49, 19, 340, 340, 19, 19]
    - [40, 4568.0]
  - - [340, 256, 64, 19, 340, 340, 19, 19]
    - [4, 4768.0]
  - - [340, 256, 36, 1900, 340, 340, 1900, 1900]
    - [5, 17949.0]
  - - [340, 256, 64, 5880, 340, 340, 5880, 5880]
    - [25, 18963.0]
  - - [340, 256, 49, 7680, 340, 340, 7680, 7680]
    - [27, 14460.0]
  - - [340, 256, 64, 882, 340, 340, 882, 882]
    - [7, 18042.0]
  - - [340, 256, 64, 931, 340, 340, 931, 931]
    - [25, 18014.0]
  - - [510, 256, 49, 120, 510, 510, 120, 120]
    - [42, 14941.0]
  - - [510, 256, 64, 120, 510, 510, 120, 120]
    - [24, 15479.0]
  - - [510, 256, 49, 18, 510, 510, 18, 18]
    - [20, 3823.0]
  - - [510, 256, 64, 18, 510, 510, 18, 18]
    - [18, 3915.0]
  - - [510, 256, 49, 19, 510, 510, 19, 19]
    - [20, 4033.0]
  - - [510, 256, 64, 19, 510, 510, 19, 19]
    - [33, 4098.0]
  - - [510, 256, 36, 480, 510, 510, 480, 480]
    - [23, 19312.0]
  - - [510, 256, 36, 72, 510, 510, 72, 72]
    - [42, 10723.0]
  - - [510, 256, 36, 76, 510, 510, 76, 76]
    - [33, 11094.0]
  - - [510, 512, 36, 1080, 510, 510, 1080, 1080]
    - [43, 20713.0]
  - - [510, 512, 36, 162, 510, 510, 162, 162]
    - [43, 16989.0]
  - - [510, 512, 36, 171, 510, 510, 171, 171]
    - [32, 17672.0]
  - - [510, 512, 49, 1920, 510, 510, 1920, 1920]
    - [43, 21523.0]
  - - [510, 512, 64, 1920, 510, 510, 1920, 1920]
    - [25, 21671.0]
  - - [510, 512, 49, 288, 510, 510, 288, 288]
    - [41, 19923.0]
  - - [510, 512, 64, 288, 510, 510, 288, 288]
    - [25, 20425.0]
  - - [510, 512, 36, 3000, 510, 510, 3000, 3000]
    - [25, 21320.0]
  - - [510, 512, 49, 304, 510, 510, 304, 304]
    - [43, 20120.0]
  - - [510, 512, 64, 304, 510, 510, 304, 304]
    - [25, 20500.0]
  - - [510, 512, 36, 450, 510, 510, 450, 450]
    - [41, 20123.0]
  - - [510, 512, 36, 475, 510, 510, 475, 475]
    - [23, 20166.0]
  - - [510, 512, 49, 480, 510, 510, 480, 480]
    - [25, 20792.0]
  - - [510, 512, 64, 480, 510, 510, 480, 480]
    - [43, 20913.0]
  - - [510, 512, 49, 72, 510, 510, 72, 72]
    - [41, 12968.0]
  - - [510, 512, 64, 72, 510, 510, 72, 72]
    - [49, 13633.0]
  - - [510, 512, 49, 76, 510, 510, 76, 76]
    - [23, 13801.0]
  - - [510, 512, 64, 76, 510, 510, 76, 76]
    - [23, 14204.0]
  - - [1024, 1024, 160, 96, 1024, 1024, 96, 96]
    - [5, 19987.0]
  - - [2880, 16384, 1, 1920, 2880, 2880, 1920, 1920]
    - [43, 21790.0]
  - - [1920, 16384, 1, 960, 1920, 1920, 960, 960]
    - [21, 22071.0]
  - - [3840, 16384, 1, 1920, 3840, 3840, 1920, 1920]
    - [7, 22351.0]
  - - [1920, 16384, 1, 3840, 1920, 1920, 3840, 3840]
    - [15, 21995.0]
  - - [25216, 16384, 1, 1920, 25216, 25216, 1920, 1920]
    - [43, 22164.0]
  - - [1024, 1024, 40, 96, 1024, 1024, 96, 96]
    - [41, 19299.0]
  - - [2880, 4096, 1, 1920, 2880, 2880, 1920, 1920]
    - [3, 21370.0]
  - - [1920, 4096, 1, 960, 1920, 1920, 960, 960]
    - [21, 21581.0]
  - - [3840, 4096, 1, 1920, 3840, 3840, 1920, 1920]
    - [3, 22256.0]
  - - [1920, 4096, 1, 3840, 1920, 1920, 3840, 3840]
    - [43, 20977.0]
  - - [25216, 4096, 1, 1920, 25216, 25216, 1920, 1920]
    - [51, 22343.0]
  - - [1024, 1024, 80, 96, 1024, 1024, 96, 96]
    - [5, 19710.0]
  - - [2880, 8192, 1, 1920, 2880, 2880, 1920, 1920]
    - [43, 21685.0]
  - - [1920, 8192, 1, 960, 1920, 1920, 960, 960]
    - [3, 22131.0]
  - - [3840, 8192, 1, 1920, 3840, 3840, 1920, 1920]
    - [7, 22252.0]
  - - [1920, 8192, 1, 3840, 1920, 1920, 3840, 3840]
    - [15, 21707.0]
  - - [25216, 8192, 1, 1920, 25216, 25216, 1920, 1920]
    - [7, 22144.0]
  - - [1024, 1024, 96, 96, 1024, 1024, 96, 96]
    - [5, 19746.0]
  - - [1728, 16384, 1, 2304, 1728, 1728, 2304, 2304]
    - [7, 21331.0]
  - - [2304, 16384, 1, 576, 2304, 2304, 576, 576]
    - [21, 22380.0]
  - - [2304, 16384, 1, 2304, 2304, 2304, 2304, 2304]
    - [7, 22190.0]
  - - [12672, 16384, 1, 2304, 12672, 12672, 2304, 2304]
    - [15, 22233.0]
  - - [1024, 1024, 24, 96, 1024, 1024, 96, 96]
    - [5, 18889.0]
  - - [1728, 4096, 1, 2304, 1728, 1728, 2304, 2304]
    - [15, 19764.0]
  - - [2304, 4096, 1, 576, 2304, 2304, 576, 576]
    - [19, 22006.0]
  - - [2304, 4096, 1, 2304, 2304, 2304, 2304, 2304]
    - [7, 21387.0]
  - - [12672, 4096, 1, 2304, 12672, 12672, 2304, 2304]
    - [15, 22037.0]
  - - [1024, 1024, 48, 96, 1024, 1024, 96, 96]
    - [5, 19688.0]
  - - [1728, 8192, 1, 2304, 1728, 1728, 2304, 2304]
    - [7, 21013.0]
  - - [2304, 8192, 1, 576, 2304, 2304, 576, 576]
    - [19, 22177.0]
  - - [2304, 8192, 1, 2304, 2304, 2304, 2304, 2304]
    - [7, 22050.0]
  - - [12672, 8192, 1, 2304, 12672, 12672, 2304, 2304]
    - [15, 21563.0]
  - - [1024, 1024, 16, 96, 1024, 1024, 96, 96]
    - [13, 18278.0]
  - - [1152, 4096, 1, 3072, 1152, 1152, 3072, 3072]
    - [51, 19579.0]
  - - [3072, 4096, 1, 384, 3072, 3072, 384, 384]
    - [5, 20723.0]
  - - [1536, 4096, 1, 3072, 1536, 1536, 3072, 3072]
    - [15, 20508.0]
  - - [3072, 4096, 1, 1536, 3072, 3072, 1536, 1536]
    - [15, 21281.0]
  - - [6400, 4096, 1, 3072, 6400, 6400, 3072, 3072]
    - [15, 21836.0]
  - - [1024, 1024, 32, 96, 1024, 1024, 96, 96]
    - [5, 19056.0]
  - - [1152, 8192, 1, 3072, 1152, 1152, 3072, 3072]
    - [51, 18289.0]
  - - [3072, 8192, 1, 384, 3072, 3072, 384, 384]
    - [7, 21372.0]
  - - [1536, 8192, 1, 3072, 1536, 1536, 3072, 3072]
    - [34, 17915.0]
  - - [3072, 8192, 1, 1536, 3072, 3072, 1536, 1536]
    - [15, 21674.0]
  - - [6400, 8192, 1, 3072, 6400, 6400, 3072, 3072]
    - [51, 21405.0]
  - - [2048, 4096, 1, 2048, 2048, 2048, 2048, 2048]
    - [15, 20392.0]
  - - [2048, 4096, 1, 4096, 2048, 2048, 4096, 4096]
    - [15, 20545.0]
  - - [29000, 199, 1, 2048, 29000, 29000, 2048, 2048]
    - [13, 15280.0]
  - - [29000, 221, 1, 2048, 29000, 29000, 2048, 2048]
    - [51, 16482.0]
  - - [29000, 224, 1, 2048, 29000, 29000, 2048, 2048]
    - [13, 16893.0]
  - - [29000, 229, 1, 2048, 29000, 29000, 2048, 2048]
    - [51, 17049.0]
  - - [29000, 234, 1, 2048, 29000, 29000, 2048, 2048]
    - [34, 17368.0]
  - - [29000, 242, 1, 2048, 29000, 29000, 2048, 2048]
    - [15, 17878.0]
  - - [29000, 246, 1, 2048, 29000, 29000, 2048, 2048]
    - [15, 18203.0]
  - - [29000, 247, 1, 2048, 29000, 29000, 2048, 2048]
    - [13, 18329.0]
  - - [29000, 256, 1, 2048, 29000, 29000, 2048, 2048]
    - [51, 19544.0]
  - - [29000, 262, 1, 2048, 29000, 29000, 2048, 2048]
    - [13, 13194.0]
  - - [29000, 264, 1, 2048, 29000, 29000, 2048, 2048]
    - [13, 13366.0]
  - - [29000, 265, 1, 2048, 29000, 29000, 2048, 2048]
    - [13, 13501.0]
  - - [29000, 274, 1, 2048, 29000, 29000, 2048, 2048]
    - [13, 13822.0]
  - - [29000, 277, 1, 2048, 29000, 29000, 2048, 2048]
    - [13, 13959.0]
  - - [29000, 279, 1, 2048, 29000, 29000, 2048, 2048]
    - [13, 14148.0]
  - - [29000, 288, 1, 2048, 29000, 29000, 2048, 2048]
    - [13, 14544.0]
  - - [29000, 296, 1, 2048, 29000, 29000, 2048, 2048]
    - [13, 14804.0]
  - - [29000, 315, 1, 2048, 29000, 29000, 2048, 2048]
    - [13, 15604.0]
  - - [29000, 335, 1, 2048, 29000, 29000, 2048, 2048]
    - [13, 16641.0]
  - - [4096, 4096, 1, 2048, 4096, 4096, 2048, 2048]
    - [15, 20865.0]
  - - [29000, 2283, 1, 1024, 29000, 29000, 1024, 1024]
    - [51, 21147.0]
  - - [29000, 2296, 1, 1024, 29000, 29000, 1024, 1024]
    - [51, 21286.0]
  - - [29000, 2306, 1, 1024, 29000, 29000, 1024, 1024]
    - [13, 20009.0]
  - - [29000, 2309, 1, 1024, 29000, 29000, 1024, 1024]
    - [13, 20023.0]
  - - [29000, 2318, 1, 1024, 29000, 29000, 1024, 1024]
    - [13, 20122.0]
  - - [29000, 2320, 1, 1024, 29000, 29000, 1024, 1024]
    - [13, 20162.0]
  - - [29000, 2324, 1, 1024, 29000, 29000, 1024, 1024]
    - [13, 20211.0]
  - - [29000, 2325, 1, 1024, 29000, 29000, 1024, 1024]
    - [13, 20121.0]
  - - [29000, 2329, 1, 1024, 29000, 29000, 1024, 1024]
    - [13, 20232.0]
  - - [29000, 2338, 1, 1024, 29000, 29000, 1024, 1024]
    - [13, 20290.0]
  - - [29000, 2345, 1, 1024, 29000, 29000, 1024, 1024]
    - [13, 20491.0]
  - - [29000, 2350, 1, 1024, 29000, 29000, 1024, 1024]
    - [13, 20416.0]
  - - [29000, 2362, 1, 1024, 29000, 29000, 1024, 1024]
    - [13, 20454.0]
  - - [29000, 2366, 1, 1024, 29000, 29000, 1024, 1024]
    - [13, 20557.0]
  - - [29000, 2368, 1, 1024, 29000, 29000, 1024, 1024]
    - [13, 20556.0]
  - - [29000, 2374, 1, 1024, 29000, 29000, 1024, 1024]
    - [13, 20572.0]
  - - [29000, 2390, 1, 1024, 29000, 29000, 1024, 1024]
    - [13, 20731.0]
  - - [512, 512, 320, 64, 512, 512, 64, 64]
    - [13, 15968.0]
  - - [29000, 561, 1, 1024, 29000, 29000, 1024, 1024]
    - [49, 18315.0]
  - - [29000, 574, 1, 1024, 29000, 29000, 1024, 1024]
    - [49, 18689.0]
  - - [29000, 600, 1, 1024, 29000, 29000, 1024, 1024]
    - [49, 19404.0]
  - - [29000, 608, 1, 1024, 29000, 29000, 1024, 1024]
    - [13, 19671.0]
  - - [29000, 615, 1, 1024, 29000, 29000, 1024, 1024]
    - [49, 19878.0]
  - - [29000, 622, 1, 1024, 29000, 29000, 1024, 1024]
    - [49, 20031.0]
  - - [29000, 625, 1, 1024, 29000, 29000, 1024, 1024]
    - [13, 20179.0]
  - - [29000, 626, 1, 1024, 29000, 29000, 1024, 1024]
    - [49, 20112.0]
  - - [29000, 628, 1, 1024, 29000, 29000, 1024, 1024]
    - [49, 20159.0]
  - - [29000, 636, 1, 1024, 29000, 29000, 1024, 1024]
    - [13, 20436.0]
  - - [29000, 651, 1, 1024, 29000, 29000, 1024, 1024]
    - [34, 18072.0]
  - - [29000, 658, 1, 1024, 29000, 29000, 1024, 1024]
    - [34, 18233.0]
  - - [29000, 669, 1, 1024, 29000, 29000, 1024, 1024]
    - [34, 18494.0]
  - - [29000, 670, 1, 1024, 29000, 29000, 1024, 1024]
    - [34, 18553.0]
  - - [29000, 672, 1, 1024, 29000, 29000, 1024, 1024]
    - [15, 18540.0]
  - - [29000, 684, 1, 1024, 29000, 29000, 1024, 1024]
    - [34, 18885.0]
  - - [29000, 716, 1, 1024, 29000, 29000, 1024, 1024]
    - [34, 19717.0]
  - - [29000, 730, 1, 1024, 29000, 29000, 1024, 1024]
    - [34, 20187.0]
  - - [2560, 1024, 1, 2560, 2560, 2560, 2560, 2560]
    - [15, 19965.0]
  - - [2560, 1024, 1, 4096, 2560, 2560, 4096, 4096]
    - [51, 20356.0]
  - - [4096, 1024, 1, 2560, 4096, 4096, 2560, 2560]
    - [15, 19074.0]
  - - [1024, 1024, 512, 64, 1024, 1024, 64, 64]
    - [13, 17641.0]
  - - [1024, 32768, 1, 4096, 1024, 1024, 4096, 4096]
    - [34, 18883.0]
  - - [3072, 32768, 1, 1024, 3072, 3072, 1024, 1024]
    - [15, 21395.0]
  - - [4096, 32768, 1, 1024, 4096, 4096, 1024, 1024]
    - [15, 21326.0]
  - - [50304, 32768, 1, 1024, 50304, 50304, 1024, 1024]
    - [51, 21599.0]
  - - [1024, 1024, 24, 128, 1024, 1024, 128, 128]
    - [5, 19594.0]
  - - [128, 1024, 24, 1024, 128, 128, 1024, 1024]
    - [15, 18831.0]
  - - [128, 128, 49, 12800, 128, 128, 12800, 12800]
    - [59, 13782.0]
  - - [128, 128, 25, 25088, 128, 128, 25088, 25088]
    - [60, 13426.0]
  - - [128, 128, 49, 25600, 128, 128, 25600, 25600]
    - [56, 13014.0]
  - - [128, 128, 25, 50176, 128, 128, 50176, 50176]
    - [57, 12367.0]
  - - [128, 128, 36, 12544, 128, 128, 12544, 12544]
    - [56, 13468.0]
  - - [128, 128, 49, 9216, 128, 128, 9216, 9216]
    - [59, 12812.0]
  - - [1024, 1024, 1, 12544, 1024, 1024, 12544, 12544]
    - [55, 19082.0]
  - - [1024, 1000, 1, 12544, 1024, 1024, 12544, 12544]
    - [55, 17804.0]
  - - [128, 128, 36, 12000, 128, 128, 12000, 12000]
    - [58, 16977.0]
  - - [5888, 128, 1, 1, 5888, 5888, 1, 1]
    - [64, 227.0]
  - - [1856, 256, 1, 1, 1856, 1856, 1, 1]
    - [76, 212.0]
  - - [256, 1856, 1, 32, 256, 256, 32, 32]
    - [94, 3456.0]
  - - [128, 3584, 1, 1280, 128, 128, 1280, 1280]
    - [80, 13321.0]
  - - [2944, 128, 1, 32, 2944, 2944, 32, 32]
    - [61, 3792.0]
  - - [64, 6784, 1, 1, 64, 64, 1, 1]
    - [61, 157.0]
  - - [64, 5056, 1, 3328, 64, 64, 3328, 3328]
    - [72, 11918.0]
  - - [704, 1024, 1, 1, 704, 704, 1, 1]
    - [87, 145.0]
  - - [256, 1856, 1, 1280, 256, 256, 1280, 1280]
    - [88, 13181.0]
  - - [256, 1408, 1, 1, 256, 256, 1, 1]
    - [61, 80.0]
  - - [1024, 1024, 1, 1280, 1024, 1024, 1280, 1280]
    - [66, 13814.0]
  - - [704, 1408, 1, 3328, 704, 704, 3328, 3328]
    - [89, 13447.0]
  - - [1408, 704, 1, 256, 1408, 1408, 256, 256]
    - [80, 11179.0]
  - - [6784, 128, 1, 3328, 6784, 6784, 3328, 3328]
    - [98, 15609.0]
  - - [2944, 256, 1, 1, 2944, 2944, 1, 1]
    - [62, 159.0]
  - - [2944, 256, 1, 32, 2944, 2944, 32, 32]
    - [78, 4047.0]
  - - [128, 4288, 1, 3328, 128, 128, 3328, 3328]
    - [104, 13895.0]
  - - [5056, 128, 1, 256, 5056, 5056, 256, 256]
    - [104, 10240.0]
  - - [1856, 704, 1, 1280, 1856, 1856, 1280, 1280]
    - [98, 13756.0]
  - - [2368, 256, 1, 32, 2368, 2368, 32, 32]
    - [100, 3277.0]
  - - [5056, 64, 1, 32, 5056, 5056, 32, 32]
    - [61, 1842.0]
  - - [64, 6784, 1, 3328, 64, 64, 3328, 3328]
    - [79, 11198.0]
  - - [2944, 256, 1, 1280, 2944, 2944, 1280, 1280]
    - [97, 13432.0]
  - - [1024, 1024, 1, 3328, 1024, 1024, 3328, 3328]
    - [81, 14197.0]
  - - [5888, 64, 1, 256, 5888, 5888, 256, 256]
    - [88, 7632.0]
  - - [2944, 448, 1, 256, 2944, 2944, 256, 256]
    - [80, 12111.0]
  - - [5056, 64, 1, 3328, 5056, 5056, 3328, 3328]
    - [88, 12839.0]
  - - [1024, 448, 1, 32, 1024, 1024, 32, 32]
    - [100, 4343.0]
  - - [128, 2944, 1, 3328, 128, 128, 3328, 3328]
    - [97, 11337.0]
  - - [256, 1856, 1, 1, 256, 256, 1, 1]
    - [62, 91.0]
  - - [256, 3584, 1, 3328, 256, 256, 3328, 3328]
    - [66, 16206.0]
  - - [256, 4288, 1, 1280, 256, 256, 1280, 1280]
    - [97, 14352.0]
  - - [4288, 256, 1, 256, 4288, 4288, 256, 256]
    - [73, 11584.0]
  - - [128, 5888, 1, 32, 128, 128, 32, 32]
    - [97, 4962.0]
  - - [128, 5888, 1, 1280, 128, 128, 1280, 1280]
    - [73, 13455.0]
  - - [3584, 256, 1, 256, 3584, 3584, 256, 256]
    - [81, 12520.0]
  - - [1856, 256, 1, 256, 1856, 1856, 256, 256]
    - [73, 8590.0]
  - - [1024, 704, 1, 1, 1024, 1024, 1, 1]
    - [85, 141.0]
  - - [448, 1408, 1, 3328, 448, 448, 3328, 3328]
    - [96, 11934.0]
  - - [1024, 704, 1, 32, 1024, 1024, 32, 32]
    - [94, 3845.0]
  - - [448, 2944, 1, 256, 448, 448, 256, 256]
    - [98, 11716.0]
  - - [5888, 128, 1, 3328, 5888, 5888, 3328, 3328]
    - [80, 13919.0]
  - - [2944, 448, 1, 1, 2944, 2944, 1, 1]
    - [101, 191.0]
  - - [5056, 64, 1, 1280, 5056, 5056, 1280, 1280]
    - [88, 10992.0]
  - - [704, 704, 1, 32, 704, 704, 32, 32]
    - [61, 2661.0]
  - - [256, 4288, 1, 256, 256, 256, 256, 256]
    - [80, 12020.0]
  - - [5056, 128, 1, 1, 5056, 5056, 1, 1]
    - [87, 129.0]
  - - [704, 448, 1, 1280, 704, 704, 1280, 1280]
    - [96, 10754.0]
  - - [1024, 704, 1, 1280, 1024, 1024, 1280, 1280]
    - [97, 13338.0]
  - - [2368, 448, 1, 256, 2368, 2368, 256, 256]
    - [98, 11204.0]
  - - [4288, 256, 1, 3328, 4288, 4288, 3328, 3328]
    - [81, 14851.0]
  - - [128, 6784, 1, 32, 128, 128, 32, 32]
    - [70, 4439.0]
  - - [128, 6784, 1, 3328, 128, 128, 3328, 3328]
    - [104, 15258.0]
  - - [4288, 128, 1, 1, 4288, 4288, 1, 1]
    - [88, 120.0]
  - - [256, 2368, 1, 32, 256, 256, 32, 32]
    - [93, 3288.0]
  - - [448, 1024, 1, 256, 448, 448, 256, 256]
    - [72, 8329.0]
  - - [256, 1408, 1, 32, 256, 256, 32, 32]
    - [92, 2958.0]
  - - [256, 3584, 1, 32, 256, 256, 32, 32]
    - [61, 4616.0]
  - - [128, 4288, 1, 32, 128, 128, 32, 32]
    - [69, 2806.0]
  - - [448, 1856, 1, 1, 448, 448, 1, 1]
    - [69, 158.0]
  - - [448, 1856, 1, 32, 448, 448, 32, 32]
    - [61, 4264.0]
  - - [448, 1856, 1, 3328, 448, 448, 3328, 3328]
    - [66, 14617.0]
  - - [1024, 448, 1, 256, 1024, 1024, 256, 256]
    - [80, 8979.0]
  - - [704, 1856, 1, 32, 704, 704, 32, 32]
    - [61, 5162.0]
  - - [704, 1408, 1, 32, 704, 704, 32, 32]
    - [61, 4850.0]
  - - [5888, 128, 1, 32, 5888, 5888, 32, 32]
    - [61, 3816.0]
  - - [128, 4288, 1, 1280, 128, 128, 1280, 1280]
    - [74, 12991.0]
  - - [1856, 704, 1, 3328, 1856, 1856, 3328, 3328]
    - [81, 14186.0]
  - - [4288, 128, 1, 256, 4288, 4288, 256, 256]
    - [71, 8652.0]
  - - [704, 1856, 1, 3328, 704, 704, 3328, 3328]
    - [81, 14195.0]
  - - [2944, 128, 1, 1280, 2944, 2944, 1280, 1280]
    - [96, 11212.0]
  - - [1408, 448, 1, 1280, 1408, 1408, 1280, 1280]
    - [103, 13524.0]
  - - [128, 2368, 1, 1, 128, 128, 1, 1]
    - [83, 64.0]
  - - [128, 2944, 1, 1280, 128, 128, 1280, 1280]
    - [64, 11145.0]
  - - [1024, 448, 1, 1, 1024, 1024, 1, 1]
    - [85, 98.0]
  - - [256, 2944, 1, 256, 256, 256, 256, 256]
    - [104, 11567.0]
  - - [704, 448, 1, 32, 704, 704, 32, 32]
    - [93, 1835.0]
  - - [704, 1024, 1, 256, 704, 704, 256, 256]
    - [73, 10019.0]
  - - [1408, 448, 1, 3328, 1408, 1408, 3328, 3328]
    - [103, 14240.0]
  - - [256, 2368, 1, 1, 256, 256, 1, 1]
    - [61, 126.0]
  - - [5888, 64, 1, 3328, 5888, 5888, 3328, 3328]
    - [96, 11459.0]
  - - [704, 448, 1, 3328, 704, 704, 3328, 3328]
    - [64, 11715.0]
  - - [4288, 256, 1, 1, 4288, 4288, 1, 1]
    - [61, 193.0]
  - - [1856, 448, 1, 3328, 1856, 1856, 3328, 3328]
    - [74, 14685.0]
  - - [4288, 256, 1, 1280, 4288, 4288, 1280, 1280]
    - [81, 14193.0]
  - - [448, 2368, 1, 1280, 448, 448, 1280, 1280]
    - [66, 13741.0]
  - - [3584, 256, 1, 1, 3584, 3584, 1, 1]
    - [81, 174.0]
  - - [2368, 448, 1, 32, 2368, 2368, 32, 32]
    - [84, 5067.0]
  - - [1408, 704, 1, 1, 1408, 1408, 1, 1]
    - [101, 185.0]
  - - [2368, 256, 1, 256, 2368, 2368, 256, 256]
    - [71, 10183.0]
  - - [1856, 256, 1, 1280, 1856, 1856, 1280, 1280]
    - [73, 12923.0]
  - - [256, 2944, 1, 1, 256, 256, 1, 1]
    - [86, 253.0]
  - - [6784, 64, 1, 1, 6784, 6784, 1, 1]
    - [88, 158.0]
  - - [6784, 64, 1, 256, 6784, 6784, 256, 256]
    - [73, 8446.0]
  - - [448, 2368, 1, 256, 448, 448, 256, 256]
    - [66, 11040.0]
  - - [128, 2368, 1, 3328, 128, 128, 3328, 3328]
    - [74, 12893.0]
  - - [64, 5056, 1, 256, 64, 64, 256, 256]
    - [72, 7032.0]
  - - [2368, 448, 1, 3328, 2368, 2368, 3328, 3328]
    - [81, 14281.0]
  - - [256, 2368, 1, 3328, 256, 256, 3328, 3328]
    - [66, 15498.0]
  - - [5888, 64, 1, 1, 5888, 5888, 1, 1]
    - [61, 81.0]
  - - [256, 3584, 1, 1, 256, 256, 1, 1]
    - [65, 172.0]
  - - [704, 1856, 1, 1280, 704, 704, 1280, 1280]
    - [66, 13768.0]
  - - [448, 1024, 1, 3328, 448, 448, 3328, 3328]
    - [66, 11896.0]
  - - [128, 5056, 1, 32, 128, 128, 32, 32]
    - [100, 3287.0]
  - - [128, 5056, 1, 1280, 128, 128, 1280, 1280]
    - [104, 15250.0]
  - - [5888, 64, 1, 32, 5888, 5888, 32, 32]
    - [94, 2250.0]
  - - [2368, 256, 1, 1, 2368, 2368, 1, 1]
    - [79, 128.0]
  - - [5888, 64, 1, 1280, 5888, 5888, 1280, 1280]
    - [103, 10545.0]
  - - [256, 1408, 1, 256, 256, 256, 256, 256]
    - [87, 7833.0]
  - - [5056, 64, 1, 1, 5056, 5056, 1, 1]
    - [69, 72.0]
  - - [1408, 448, 1, 32, 1408, 1408, 32, 32]
    - [84, 3456.0]
  - - [5056, 128, 1, 1280, 5056, 5056, 1280, 1280]
    - [74, 15284.0]
  - - [1856, 704, 1, 256, 1856, 1856, 256, 256]
    - [81, 11687.0]
  - - [128, 6784, 1, 256, 128, 128, 256, 256]
    - [74, 11850.0]
  - - [256, 3584, 1, 256, 256, 256, 256, 256]
    - [98, 12349.0]
  - - [448, 704, 1, 1, 448, 448, 1, 1]
    - [69, 69.0]
  - - [448, 704, 1, 32, 448, 448, 32, 32]
    - [61, 1848.0]
  - - [448, 704, 1, 3328, 448, 448, 3328, 3328]
    - [79, 11722.0]
  - - [64, 5888, 1, 1, 64, 64, 1, 1]
    - [61, 74.0]
  - - [2368, 128, 1, 32, 2368, 2368, 32, 32]
    - [69, 1816.0]
  - - [2368, 256, 1, 1280, 2368, 2368, 1280, 1280]
    - [74, 14306.0]
  - - [2368, 128, 1, 3328, 2368, 2368, 3328, 3328]
    - [74, 13131.0]
  - - [4288, 256, 1, 32, 4288, 4288, 32, 32]
    - [76, 5166.0]
  - - [448, 1408, 1, 1, 448, 448, 1, 1]
    - [61, 127.0]
  - - [1408, 256, 1, 256, 1408, 1408, 256, 256]
    - [80, 7382.0]
  - - [256, 4288, 1, 32, 256, 256, 32, 32]
    - [101, 5274.0]
  - - [1408, 256, 1, 1280, 1408, 1408, 1280, 1280]
    - [97, 10189.0]
  - - [448, 1408, 1, 256, 448, 448, 256, 256]
    - [96, 9544.0]
  - - [128, 2944, 1, 32, 128, 128, 32, 32]
    - [78, 2030.0]
  - - [1856, 448, 1, 1, 1856, 1856, 1, 1]
    - [76, 168.0]
  - - [704, 704, 1, 1, 704, 704, 1, 1]
    - [69, 105.0]
  - - [1856, 448, 1, 1280, 1856, 1856, 1280, 1280]
    - [81, 13909.0]
  - - [128, 5888, 1, 256, 128, 128, 256, 256]
    - [97, 10900.0]
  - - [3584, 256, 1, 3328, 3584, 3584, 3328, 3328]
    - [81, 16194.0]
  - - [448, 2368, 1, 1, 448, 448, 1, 1]
    - [98, 191.0]
  - - [128, 6784, 1, 1, 128, 128, 1, 1]
    - [92, 210.0]
  - - [256, 2944, 1, 3328, 256, 256, 3328, 3328]
    - [65, 14015.0]
  - - [64, 5888, 1, 256, 64, 64, 256, 256]
    - [72, 7146.0]
  - - [704, 704, 1, 256, 704, 704, 256, 256]
    - [72, 8986.0]
  - - [448, 1024, 1, 32, 448, 448, 32, 32]
    - [93, 2505.0]
  - - [256, 2368, 1, 256, 256, 256, 256, 256]
    - [73, 10444.0]
  - - [448, 704, 1, 1280, 448, 448, 1280, 1280]
    - [79, 10737.0]
  - - [704, 1856, 1, 1, 704, 704, 1, 1]
    - [69, 189.0]
  - - [704, 448, 1, 256, 704, 704, 256, 256]
    - [102, 7300.0]
  - - [2368, 448, 1, 1280, 2368, 2368, 1280, 1280]
    - [98, 13705.0]
  - - [128, 5056, 1, 1, 128, 128, 1, 1]
    - [64, 127.0]
  - - [256, 2368, 1, 1280, 256, 256, 1280, 1280]
    - [74, 14353.0]
  - - [64, 6784, 1, 256, 64, 64, 256, 256]
    - [72, 7794.0]
  - - [128, 3584, 1, 256, 128, 128, 256, 256]
    - [73, 9076.0]
  - - [704, 1408, 1, 1, 704, 704, 1, 1]
    - [61, 185.0]
  - - [4288, 128, 1, 3328, 4288, 4288, 3328, 3328]
    - [74, 14006.0]
  - - [128, 6784, 1, 1280, 128, 128, 1280, 1280]
    - [89, 14663.0]
  - - [3584, 256, 1, 32, 3584, 3584, 32, 32]
    - [95, 4646.0]
  - - [1408, 256, 1, 32, 1408, 1408, 32, 32]
    - [73, 3117.0]
  - - [5888, 128, 1, 256, 5888, 5888, 256, 256]
    - [80, 10767.0]
  - - [128, 5056, 1, 3328, 128, 128, 3328, 3328]
    - [81, 16411.0]
  - - [1024, 448, 1, 3328, 1024, 1024, 3328, 3328]
    - [73, 13428.0]
  - - [3584, 128, 1, 1, 3584, 3584, 1, 1]
    - [61, 94.0]
  - - [128, 2368, 1, 256, 128, 128, 256, 256]
    - [80, 7362.0]
  - - [448, 1856, 1, 256, 448, 448, 256, 256]
    - [66, 10622.0]
  - - [3584, 128, 1, 256, 3584, 3584, 256, 256]
    - [103, 8979.0]
  - - [1024, 448, 1, 1280, 1024, 1024, 1280, 1280]
    - [97, 12694.0]
  - - [128, 5888, 1, 1, 128, 128, 1, 1]
    - [97, 144.0]
  - - [64, 5056, 1, 1, 64, 64, 1, 1]
    - [61, 64.0]
  - - [1856, 256, 1, 32, 1856, 1856, 32, 32]
    - [93, 4607.0]
  - - [64, 5056, 1, 32, 64, 64, 32, 32]
    - [100, 2784.0]
  - - [1408, 704, 1, 32, 1408, 1408, 32, 32]
    - [100, 7516.0]
  - - [1408, 704, 1, 1280, 1408, 1408, 1280, 1280]
    - [98, 13013.0]
  - - [1024, 1024, 1, 32, 1024, 1024, 32, 32]
    - [77, 4920.0]
  - - [5056, 128, 1, 3328, 5056, 5056, 3328, 3328]
    - [98, 16371.0]
  - - [128, 4288, 1, 1, 128, 128, 1, 1]
    - [87, 104.0]
  - - [2944, 128, 1, 3328, 2944, 2944, 3328, 3328]
    - [73, 11351.0]
  - - [5888, 128, 1, 1280, 5888, 5888, 1280, 1280]
    - [103, 13825.0]
  - - [2944, 128, 1, 256, 2944, 2944, 256, 256]
    - [73, 9205.0]
  - - [6784, 128, 1, 1, 6784, 6784, 1, 1]
    - [69, 284.0]
  - - [1408, 256, 1, 3328, 1408, 1408, 3328, 3328]
    - [73, 10917.0]
  - - [2944, 256, 1, 256, 2944, 2944, 256, 256]
    - [97, 10731.0]
  - - [6784, 128, 1, 256, 6784, 6784, 256, 256]
    - [89, 11774.0]
  - - [6784, 64, 1, 1280, 6784, 6784, 1280, 1280]
    - [73, 11967.0]
  - - [2944, 448, 1, 1280, 2944, 2944, 1280, 1280]
    - [81, 13813.0]
  - - [704, 448, 1, 1, 704, 704, 1, 1]
    - [87, 67.0]
  - - [256, 1408, 1, 3328, 256, 256, 3328, 3328]
    - [80, 10957.0]
  - - [2944, 128, 1, 1, 2944, 2944, 1, 1]
    - [76, 165.0]
  - - [704, 1024, 1, 32, 704, 704, 32, 32]
    - [72, 5915.0]
  - - [3584, 256, 1, 1280, 3584, 3584, 1280, 1280]
    - [81, 16053.0]
  - - [3584, 128, 1, 1280, 3584, 3584, 1280, 1280]
    - [73, 13214.0]
  - - [256, 1856, 1, 256, 256, 256, 256, 256]
    - [88, 11948.0]
  - - [256, 2944, 1, 1280, 256, 256, 1280, 1280]
    - [65, 14083.0]
  - - [2944, 256, 1, 3328, 2944, 2944, 3328, 3328]
    - [97, 14204.0]
  - - [704, 1024, 1, 3328, 704, 704, 3328, 3328]
    - [97, 13133.0]
  - - [448, 2944, 1, 1, 448, 448, 1, 1]
    - [100, 154.0]
  - - [448, 1856, 1, 1280, 448, 448, 1280, 1280]
    - [74, 13931.0]
  - - [2368, 448, 1, 1, 2368, 2368, 1, 1]
    - [69, 203.0]
  - - [448, 2944, 1, 32, 448, 448, 32, 32]
    - [76, 5342.0]
  - - [448, 2944, 1, 1280, 448, 448, 1280, 1280]
    - [81, 13863.0]
  - - [128, 2368, 1, 1280, 128, 128, 1280, 1280]
    - [104, 11540.0]
  - - [448, 2944, 1, 3328, 448, 448, 3328, 3328]
    - [66, 14584.0]
  - - [2368, 128, 1, 1280, 2368, 2368, 1280, 1280]
    - [74, 11445.0]
  - - [128, 3584, 1, 3328, 128, 128, 3328, 3328]
    - [65, 13624.0]
  - - [256, 4288, 1, 3328, 256, 256, 3328, 3328]
    - [81, 14823.0]
  - - [1856, 704, 1, 32, 1856, 1856, 32, 32]
    - [102, 5374.0]
  - - [2944, 448, 1, 32, 2944, 2944, 32, 32]
    - [85, 5397.0]
  - - [5056, 128, 1, 32, 5056, 5056, 32, 32]
    - [100, 3395.0]
  - - [6784, 128, 1, 1280, 6784, 6784, 1280, 1280]
    - [89, 15429.0]
  - - [1408, 704, 1, 3328, 1408, 1408, 3328, 3328]
    - [66, 13600.0]
  - - [1856, 704, 1, 1, 1856, 1856, 1, 1]
    - [61, 161.0]
  - - [256, 1856, 1, 3328, 256, 256, 3328, 3328]
    - [97, 14013.0]
  - - [4288, 128, 1, 1280, 4288, 4288, 1280, 1280]
    - [81, 13049.0]
  - - [128, 4288, 1, 256, 128, 128, 256, 256]
    - [65, 9256.0]
  - - [6784, 128, 1, 32, 6784, 6784, 32, 32]
    - [89, 6230.0]
  - - [1408, 448, 1, 1, 1408, 1408, 1, 1]
    - [82, 182.0]
  - - [64, 5056, 1, 1280, 64, 64, 1280, 1280]
    - [102, 10719.0]
  - - [448, 1408, 1, 32, 448, 448, 32, 32]
    - [84, 3456.0]
  - - [128, 5056, 1, 256, 128, 128, 256, 256]
    - [88, 12943.0]
  - - [1024, 1024, 1, 1, 1024, 1024, 1, 1]
    - [80, 179.0]
  - - [256, 1408, 1, 1280, 256, 256, 1280, 1280]
    - [73, 10685.0]
  - - [64, 5888, 1, 3328, 64, 64, 3328, 3328]
    - [72, 10440.0]
  - - [6784, 64, 1, 3328, 6784, 6784, 3328, 3328]
    - [88, 13136.0]
  - - [2944, 448, 1, 3328, 2944, 2944, 3328, 3328]
    - [98, 14317.0]
  - - [448, 1408, 1, 1280, 448, 448, 1280, 1280]
    - [64, 11651.0]
  - - [2368, 128, 1, 1, 2368, 2368, 1, 1]
    - [69, 54.0]
  - - [5056, 64, 1, 256, 5056, 5056, 256, 256]
    - [72, 7331.0]
  - - [2368, 128, 1, 256, 2368, 2368, 256, 256]
    - [87, 6879.0]
  - - [64, 6784, 1, 32, 64, 64, 32, 32]
    - [100, 2227.0]
  - - [256, 4288, 1, 1, 256, 256, 1, 1]
    - [94, 190.0]
  - - [128, 2944, 1, 256, 128, 128, 256, 256]
    - [65, 7608.0]
  - - [3584, 128, 1, 32, 3584, 3584, 32, 32]
    - [98, 3707.0]
  - - [3584, 128, 1, 3328, 3584, 3584, 3328, 3328]
    - [88, 13535.0]
  - - [704, 704, 1, 3328, 704, 704, 3328, 3328]
    - [104, 12755.0]
  - - [128, 2944, 1, 1, 128, 128, 1, 1]
    - [78, 80.0]
  - - [704, 1408, 1, 1280, 704, 704, 1280, 1280]
    - [66, 13061.0]
  - - [6784, 64, 1, 32, 6784, 6784, 32, 32]
    - [93, 2412.0]
  - - [64, 6784, 1, 1280, 64, 64, 1280, 1280]
    - [87, 10450.0]
  - - [704, 1408, 1, 256, 704, 704, 256, 256]
    - [66, 10919.0]
  - - [4288, 128, 1, 32, 4288, 4288, 32, 32]
    - [69, 3007.0]
  - - [448, 704, 1, 256, 448, 448, 256, 256]
    - [72, 7158.0]
  - - [1856, 256, 1, 3328, 1856, 1856, 3328, 3328]
    - [73, 13934.0]
  - - [448, 1024, 1, 1280, 448, 448, 1280, 1280]
    - [64, 11772.0]
  - - [1024, 1024, 1, 256, 1024, 1024, 256, 256]
    - [74, 11878.0]
  - - [256, 2944, 1, 32, 256, 256, 32, 32]
    - [98, 5558.0]
  - - [704, 1024, 1, 1280, 704, 704, 1280, 1280]
    - [80, 12668.0]
  - - [256, 3584, 1, 1280, 256, 256, 1280, 1280]
    - [81, 16097.0]
  - - [128, 2368, 1, 32, 128, 128, 32, 32]
    - [62, 2679.0]
  - - [704, 1856, 1, 256, 704, 704, 256, 256]
    - [89, 12690.0]
  - - [1856, 448, 1, 32, 1856, 1856, 32, 32]
    - [79, 6490.0]
  - - [1408, 448, 1, 256, 1408, 1408, 256, 256]
    - [97, 10610.0]
  - - [448, 1024, 1, 1, 448, 448, 1, 1]
    - [85, 108.0]
  - - [1024, 704, 1, 256, 1024, 1024, 256, 256]
    - [80, 10486.0]
  - - [64, 5888, 1, 32, 64, 64, 32, 32]
    - [84, 1926.0]
  - - [1856, 448, 1, 256, 1856, 1856, 256, 256]
    - [81, 10675.0]
  - - [128, 5888, 1, 3328, 128, 128, 3328, 3328]
    - [80, 13934.0]
  - - [2368, 256, 1, 3328, 2368, 2368, 3328, 3328]
    - [66, 15521.0]
  - - [64, 5888, 1, 1280, 64, 64, 1280, 1280]
    - [72, 9647.0]
  - - [1408, 256, 1, 1, 1408, 1408, 1, 1]
    - [61, 77.0]
  - - [704, 704, 1, 1280, 704, 704, 1280, 1280]
    - [98, 11920.0]
  - - [128, 3584, 1, 1, 128, 128, 1, 1]
    - [104, 88.0]
  - - [128, 3584, 1, 32, 128, 128, 32, 32]
    - [84, 2338.0]
  - - [448, 2368, 1, 32, 448, 448, 32, 32]
    - [69, 4836.0]
  - - [448, 2368, 1, 3328, 448, 448, 3328, 3328]
    - [98, 14303.0]
  - - [1024, 704, 1, 3328, 1024, 1024, 3328, 3328]
    - [97, 13317.0]
  - - [2048, 400, 1, 512, 2048, 2048, 512, 512]
    - [88, 11149.0]
  - - [2560, 128, 1, 2560, 2560, 2560, 2560, 2560]
    - [104, 13526.0]
  - - [1024, 700, 1, 512, 1024, 1024, 512, 512]
    - [88, 11334.0]
  - - [4096, 128, 1, 4096, 4096, 4096, 4096, 4096]
    - [89, 13450.0]
  - - [3072, 128, 1, 1024, 3072, 3072, 1024, 1024]
    - [103, 10346.0]
  - - [7680, 64, 1, 2560, 7680, 7680, 2560, 2560]
    - [73, 13192.0]
  - - [7680, 128, 1, 2560, 7680, 7680, 2560, 2560]
    - [89, 17004.0]
  - - [1024, 1024, 1, 1024, 1024, 1024, 1024, 1024]
    - [89, 13537.0]
  - - [2049, 512, 1, 2048, 2049, 2049, 2048, 2048]
    - [89, 13869.0]
  - - [1023, 512, 1, 1024, 1023, 1023, 1024, 1024]
    - [104, 11830.0]
  - - [1024, 512, 1, 1025, 1024, 1024, 1025, 1025]
    - [98, 12451.0]
  - - [1024, 1024, 1, 1023, 1024, 1024, 1023, 1023]
    - [66, 13658.0]
  - - [1024, 1025, 1, 1024, 1024, 1024, 1024, 1024]
    - [74, 13375.0]
  - - [1024, 1023, 1, 1024, 1024, 1024, 1024, 1024]
    - [74, 13172.0]
  - - [2048, 511, 1, 2048, 2048, 2048, 2048, 2048]
    - [74, 13683.0]
  - - [2047, 512, 1, 2048, 2047, 2047, 2048, 2048]
    - [74, 13726.0]
  - - [1025, 1024, 1, 1024, 1025, 1025, 1024, 1024]
    - [74, 13455.0]
  - - [1024, 1024, 1, 1025, 1024, 1024, 1025, 1025]
    - [66, 13636.0]
  - - [1025, 512, 1, 1024, 1025, 1025, 1024, 1024]
    - [74, 12457.0]
  - - [1024, 512, 1, 1023, 1024, 1024, 1023, 1023]
    - [81, 12520.0]
  - - [2048, 513, 1, 2048, 2048, 2048, 2048, 2048]
    - [74, 13747.0]
  - - [1024, 511, 1, 1024, 1024, 1024, 1024, 1024]
    - [89, 11598.0]
  - - [2048, 512, 1, 2047, 2048, 2048, 2047, 2047]
    - [81, 14146.0]
  - - [1024, 513, 1, 1024, 1024, 1024, 1024, 1024]
    - [74, 11964.0]
  - - [2048, 512, 1, 2049, 2048, 2048, 2049, 2049]
    - [104, 14225.0]
  - - [1023, 1024, 1, 1024, 1023, 1023, 1024, 1024]
    - [104, 13585.0]
  - - [64, 128, 512, 128, 64, 64, 128, 128]
    - [67, 8781.0]
  - - [64, 512, 64, 512, 64, 64, 512, 512]
    - [105, 9095.0]
  - - [256, 1280, 1, 1024, 256, 256, 1024, 1024]
    - [74, 11941.0]
  - - [256, 1536, 1, 1024, 256, 256, 1024, 1024]
    - [73, 10607.0]
  - - [256, 2304, 1, 1024, 256, 256, 1024, 1024]
    - [74, 13789.0]
  - - [256, 2560, 1, 1024, 256, 256, 1024, 1024]
    - [74, 15322.0]
  - - [256, 2816, 1, 1024, 256, 256, 1024, 1024]
    - [73, 12436.0]
  - - [256, 3328, 1, 1024, 256, 256, 1024, 1024]
    - [104, 14195.0]
  - - [256, 3584, 1, 1024, 256, 256, 1024, 1024]
    - [74, 15198.0]
  - - [512, 1600, 1, 512, 512, 512, 512, 512]
    - [103, 13010.0]
  - - [1024, 512, 1, 1024, 1024, 1024, 1024, 1024]
    - [74, 12561.0]
  - - [1024, 512, 1, 1600, 1024, 1024, 1600, 1600]
    - [81, 13303.0]
  - - [1024, 960, 1, 1024, 1024, 1024, 1024, 1024]
    - [73, 14150.0]
  - - [1024, 960, 1, 1600, 1024, 1024, 1600, 1600]
    - [80, 15037.0]
  - - [2048, 215, 1, 512, 2048, 2048, 512, 512]
    - [89, 8820.0]
  - - [2048, 215, 1, 768, 2048, 2048, 768, 768]
    - [81, 9830.0]
  - - [2048, 256, 1, 512, 2048, 2048, 512, 512]
    - [74, 11279.0]
  - - [2048, 256, 1, 768, 2048, 2048, 768, 768]
    - [89, 12121.0]
  - - [2048, 512, 1, 67, 2048, 2048, 67, 67]
    - [61, 7273.0]
  - - [2048, 512, 1, 74, 2048, 2048, 74, 74]
    - [85, 9724.0]
  - - [2048, 512, 1, 100, 2048, 2048, 100, 100]
    - [93, 8841.0]
  - - [2048, 512, 1, 2048, 2048, 2048, 2048, 2048]
    - [74, 13867.0]
  - - [1024, 512, 1, 4096, 1024, 1024, 4096, 4096]
    - [74, 13427.0]
  - - [30522, 77, 1, 1024, 30522, 30522, 1024, 1024]
    - [104, 10397.0]
  - - [1024, 780, 1, 1024, 1024, 1024, 1024, 1024]
    - [89, 13070.0]
  - - [1024, 800, 1, 1024, 1024, 1024, 1024, 1024]
    - [74, 13392.0]
  - - [1024, 820, 1, 1024, 1024, 1024, 1024, 1024]
    - [89, 13749.0]
  - - [1024, 385, 1, 1024, 1024, 1024, 1024, 1024]
    - [88, 10389.0]
  - - [1024, 462, 1, 1024, 1024, 1024, 1024, 1024]
    - [104, 11383.0]
  - - [1024, 1024, 1, 4096, 1024, 1024, 4096, 4096]
    - [74, 13693.0]
  - - [480, 1024, 1, 1024, 480, 480, 1024, 1024]
    - [74, 11491.0]
  - - [480, 2048, 1, 2048, 480, 480, 2048, 2048]
    - [74, 12987.0]
  - - [1024, 480, 1, 1024, 1024, 1024, 1024, 1024]
    - [89, 11165.0]
  - - [2048, 480, 1, 2048, 2048, 2048, 2048, 2048]
    - [89, 12949.0]
  - - [64, 1024, 256, 1024, 64, 64, 1024, 1024]
    - [75, 9993.0]
  - - [64, 512, 40, 512, 64, 64, 512, 512]
    - [105, 8910.0]
  - - [96, 1024, 64, 1024, 96, 96, 1024, 1024]
    - [104, 13172.0]
  - - [64, 1024, 128, 1024, 64, 64, 1024, 1024]
    - [75, 9904.0]
  - - [64, 1024, 32, 1024, 64, 64, 1024, 1024]
    - [90, 9196.0]
  - - [64, 512, 128, 512, 64, 64, 512, 512]
    - [90, 9683.0]
  - - [96, 1024, 128, 1024, 96, 96, 1024, 1024]
    - [89, 13432.0]
  - - [64, 512, 256, 512, 64, 64, 512, 512]
    - [90, 9710.0]
  - - [64, 1024, 64, 1024, 64, 64, 1024, 1024]
    - [75, 9587.0]
  - - [960, 1024, 1, 1024, 960, 960, 1024, 1024]
    - [74, 13228.0]
  - - [64, 128, 1024, 128, 64, 64, 128, 128]
    - [96, 9701.0]
  - - [1024, 864, 1, 1024, 1024, 1024, 1024, 1024]
    - [89, 14990.0]
  - - [1024, 864, 1, 480, 1024, 1024, 480, 480]
    - [98, 14386.0]
  - - [128, 3456, 1, 256, 128, 128, 256, 256]
    - [73, 10847.0]
  - - [128, 4096, 1, 256, 128, 128, 256, 256]
    - [74, 11355.0]
  - - [128, 6912, 1, 256, 128, 128, 256, 256]
    - [74, 11896.0]
  - - [256, 3456, 1, 512, 256, 256, 512, 512]
    - [104, 13777.0]
  - - [256, 4096, 1, 512, 256, 256, 512, 512]
    - [74, 12955.0]
  - - [512, 864, 1, 1024, 512, 512, 1024, 1024]
    - [73, 11382.0]
  - - [512, 864, 1, 13, 512, 512, 13, 13]
    - [93, 1203.0]
  - - [64, 128, 1280, 128, 64, 64, 128, 128]
    - [82, 9108.0]
  - - [64, 128, 1312, 128, 64, 64, 128, 128]
    - [90, 9127.0]
  - - [64, 512, 192, 512, 64, 64, 512, 512]
    - [75, 9690.0]
  - - [1024, 512, 1, 196, 1024, 1024, 196, 196]
    - [94, 10235.0]
  - - [2048, 512, 1, 49, 2048, 2048, 49, 49]
    - [93, 9515.0]
  - - [2304, 256, 1, 196, 2304, 2304, 196, 196]
    - [77, 12484.0]
  - - [512, 1024, 1, 196, 512, 512, 196, 196]
    - [62, 10840.0]
  - - [512, 2048, 1, 49, 512, 512, 49, 49]
    - [100, 8983.0]
  - - [64, 128, 2048, 128, 64, 64, 128, 128]
    - [105, 9441.0]
  - - [64, 128, 1536, 128, 64, 64, 128, 128]
    - [96, 10433.0]
  - - [128, 128, 64, 6400, 128, 128, 6400, 6400]
    - [92, 11265.0]
  - - [64, 128, 192, 128, 64, 64, 128, 128]
    - [75, 7655.0]
  - - [64, 384, 144, 384, 64, 64, 384, 384]
    - [79, 14050.0]
  - - [64, 512, 48, 512, 64, 64, 512, 512]
    - [75, 9000.0]
  - - [64, 128, 256, 128, 64, 64, 128, 128]
    - [82, 7877.0]
  - - [64, 384, 192, 384, 64, 64, 384, 384]
    - [79, 10778.0]
  - - [512, 1024, 1, 1024, 512, 512, 1024, 1024]
    - [74, 12937.0]
  - - [512, 2048, 1, 2048, 512, 512, 2048, 2048]
    - [74, 13819.0]
  - - [128, 128, 49, 1120, 128, 128, 1120, 1120]
    - [80, 14354.0]
  - - [128, 128, 49, 1064, 128, 128, 1064, 1064]
    - [62, 14434.0]
  - - [128, 128, 49, 1040, 128, 128, 1040, 1040]
    - [65, 14311.0]
  - - [128, 128, 64, 600, 128, 128, 600, 600]
    - [97, 12999.0]
  - - [128, 128, 64, 616, 128, 128, 616, 616]
    - [104, 13044.0]
  - - [128, 128, 49, 950, 128, 128, 950, 950]
    - [80, 14331.0]
  - - [128, 128, 49, 972, 128, 128, 972, 972]
    - [65, 14580.0]
  - - [128, 128, 64, 560, 128, 128, 560, 560]
    - [89, 13921.0]
  - - [128, 128, 49, 1008, 128, 128, 1008, 1008]
    - [65, 14789.0]
  - - [128, 128, 64, 532, 128, 128, 532, 532]
    - [89, 13613.0]
  - - [128, 128, 49, 1080, 128, 128, 1080, 1080]
    - [80, 14686.0]
  - - [128, 128, 64, 588, 128, 128, 588, 588]
    - [104, 13683.0]
  - - [128, 128, 49, 1160, 128, 128, 1160, 1160]
    - [65, 14721.0]
  - - [128, 128, 49, 988, 128, 128, 988, 988]
    - [97, 14656.0]
  - - [128, 128, 49, 936, 128, 128, 936, 936]
    - [65, 14523.0]
  - - [512, 1024, 1, 3800, 512, 512, 3800, 3800]
    - [66, 13975.0]
  - - [512, 1024, 1, 3400, 512, 512, 3400, 3400]
    - [81, 13926.0]
  - - [512, 1024, 1, 3456, 512, 512, 3456, 3456]
    - [66, 13992.0]
  - - [512, 1024, 1, 3072, 512, 512, 3072, 3072]
    - [74, 13146.0]
  - - [2048, 512, 1, 950, 2048, 2048, 950, 950]
    - [77, 14247.0]
  - - [512, 1024, 1, 3552, 512, 512, 3552, 3552]
    - [66, 13791.0]
  - - [512, 1024, 1, 3220, 512, 512, 3220, 3220]
    - [66, 13643.0]
  - - [2048, 512, 1, 850, 2048, 2048, 850, 850]
    - [65, 13784.0]
  - - [512, 2048, 1, 864, 512, 512, 864, 864]
    - [66, 13702.0]
  - - [512, 2048, 1, 768, 512, 512, 768, 768]
    - [98, 14025.0]
  - - [2048, 512, 1, 805, 2048, 2048, 805, 805]
    - [77, 14064.0]
  - - [512, 1024, 1, 2852, 512, 512, 2852, 2852]
    - [81, 13559.0]
  - - [512, 2048, 1, 888, 512, 512, 888, 888]
    - [94, 14932.0]
  - - [2048, 512, 1, 864, 2048, 2048, 864, 864]
    - [81, 14120.0]
  - - [2048, 512, 1, 768, 2048, 2048, 768, 768]
    - [66, 13489.0]
  - - [2048, 512, 1, 888, 2048, 2048, 888, 888]
    - [77, 14535.0]
  - - [2048, 256, 1, 950, 2048, 2048, 950, 950]
    - [66, 13163.0]
  - - [2048, 512, 1, 713, 2048, 2048, 713, 713]
    - [77, 13549.0]
  - - [512, 1024, 1, 2688, 512, 512, 2688, 2688]
    - [74, 13811.0]
  - - [512, 1024, 1, 2640, 512, 512, 2640, 2640]
    - [98, 13586.0]
  - - [512, 1024, 1, 2904, 512, 512, 2904, 2904]
    - [66, 13587.0]
  - - [1024, 512, 1, 950, 1024, 1024, 950, 950]
    - [98, 12571.0]
  - - [512, 2048, 1, 672, 512, 512, 672, 672]
    - [94, 14428.0]
  - - [512, 2048, 1, 660, 512, 512, 660, 660]
    - [94, 14188.0]
  - - [512, 2048, 1, 1008, 512, 512, 1008, 1008]
    - [77, 15143.0]
  - - [2048, 256, 1, 850, 2048, 2048, 850, 850]
    - [98, 12263.0]
  - - [2048, 512, 1, 726, 2048, 2048, 726, 726]
    - [77, 13989.0]
  - - [1024, 512, 1, 850, 1024, 1024, 850, 850]
    - [81, 12358.0]
  - - [2048, 512, 1, 660, 2048, 2048, 660, 660]
    - [77, 13902.0]
  - - [2048, 512, 1, 672, 2048, 2048, 672, 672]
    - [77, 14247.0]
  - - [512, 2048, 1, 840, 512, 512, 840, 840]
    - [94, 14764.0]
  - - [2048, 512, 1, 1008, 2048, 2048, 1008, 1008]
    - [94, 14424.0]
  - - [512, 2048, 1, 792, 512, 512, 792, 792]
    - [66, 13443.0]
  - - [1024, 512, 1, 805, 1024, 1024, 805, 805]
    - [81, 12121.0]
  - - [512, 2048, 1, 1050, 512, 512, 1050, 1050]
    - [62, 13937.0]
  - - [2048, 512, 1, 748, 2048, 2048, 748, 748]
    - [74, 13394.0]
  - - [2048, 256, 1, 864, 2048, 2048, 864, 864]
    - [98, 12431.0]
  - - [1024, 512, 1, 768, 1024, 1024, 768, 768]
    - [74, 12143.0]
  - - [1024, 512, 1, 864, 1024, 1024, 864, 864]
    - [93, 12689.0]
  - - [2048, 512, 1, 875, 2048, 2048, 875, 875]
    - [77, 14059.0]
  - - [2048, 512, 1, 840, 2048, 2048, 840, 840]
    - [62, 14369.0]
  - - [2048, 512, 1, 792, 2048, 2048, 792, 792]
    - [66, 13513.0]
  - - [512, 2048, 1, 736, 512, 512, 736, 736]
    - [66, 13544.0]
  - - [2048, 256, 1, 888, 2048, 2048, 888, 888]
    - [61, 13363.0]
  - - [512, 2048, 1, 704, 512, 512, 704, 704]
    - [94, 14705.0]
  - - [512, 2048, 1, 588, 512, 512, 588, 588]
    - [94, 14116.0]
  - - [1024, 512, 1, 888, 1024, 1024, 888, 888]
    - [93, 13034.0]
  - - [512, 2048, 1, 816, 512, 512, 816, 816]
    - [94, 14656.0]
  - - [1024, 512, 1, 713, 1024, 1024, 713, 713]
    - [74, 12784.0]
  - - [2048, 512, 1, 736, 2048, 2048, 736, 736]
    - [63, 13961.0]
  - - [2048, 512, 1, 588, 2048, 2048, 588, 588]
    - [77, 13439.0]
  - - [2048, 512, 1, 704, 2048, 2048, 704, 704]
    - [77, 14234.0]
  - - [1024, 512, 1, 660, 1024, 1024, 660, 660]
    - [62, 11883.0]
  - - [2048, 256, 1, 660, 2048, 2048, 660, 660]
    - [63, 11867.0]
  - - [2048, 256, 1, 672, 2048, 2048, 672, 672]
    - [61, 12674.0]
  - - [1024, 512, 1, 672, 1024, 1024, 672, 672]
    - [77, 12242.0]
  - - [1024, 512, 1, 726, 1024, 1024, 726, 726]
    - [77, 12000.0]
  - - [512, 2048, 1, 630, 512, 512, 630, 630]
    - [76, 14973.0]
  - - [512, 2048, 1, 600, 512, 512, 600, 600]
    - [76, 14202.0]
  - - [2048, 256, 1, 805, 2048, 2048, 805, 805]
    - [102, 12561.0]
  - - [2048, 256, 1, 713, 2048, 2048, 713, 713]
    - [81, 12917.0]
  - - [2048, 256, 1, 726, 2048, 2048, 726, 726]
    - [61, 13555.0]
  - - [320, 1024, 1, 1024, 320, 320, 1024, 1024]
    - [102, 10565.0]
  - - [1024, 1000, 1, 1024, 1024, 1024, 1024, 1024]
    - [74, 13382.0]
  - - [320, 1000, 1, 1024, 320, 320, 1024, 1024]
    - [87, 10101.0]
  - - [128, 128, 49, 1280, 128, 128, 1280, 1280]
    - [89, 13669.0]
  - - [128, 128, 49, 1360, 128, 128, 1360, 1360]
    - [77, 14250.0]
  - - [128, 128, 49, 1200, 128, 128, 1200, 1200]
    - [65, 14383.0]
  - - [128, 128, 49, 1240, 128, 128, 1240, 1240]
    - [80, 14185.0]
  - - [2304, 256, 1, 704, 2304, 2304, 704, 704]
    - [77, 13615.0]
  - - [2304, 256, 1, 736, 2304, 2304, 736, 736]
    - [81, 13617.0]
  - - [2304, 256, 1, 792, 2304, 2304, 792, 792]
    - [63, 13691.0]
  - - [2304, 256, 1, 748, 2304, 2304, 748, 748]
    - [63, 13617.0]
  - - [2304, 256, 1, 726, 2304, 2304, 726, 726]
    - [81, 13415.0]
  - - [2304, 256, 1, 713, 2304, 2304, 713, 713]
    - [63, 13402.0]
  - - [2304, 256, 1, 768, 2304, 2304, 768, 768]
    - [81, 13522.0]
  - - [512, 2048, 1, 759, 512, 512, 759, 759]
    - [77, 14273.0]
  - - [512, 2048, 1, 925, 512, 512, 925, 925]
    - [94, 14255.0]
  - - [2304, 256, 1, 805, 2304, 2304, 805, 805]
    - [63, 13636.0]
  - - [512, 2048, 1, 900, 512, 512, 900, 900]
    - [94, 13977.0]
  - - [512, 2048, 1, 875, 512, 512, 875, 875]
    - [77, 14124.0]
  - - [512, 2048, 1, 748, 512, 512, 748, 748]
    - [81, 13389.0]
  - - [512, 2048, 1, 726, 512, 512, 726, 726]
    - [94, 14288.0]
  - - [512, 2048, 1, 713, 512, 512, 713, 713]
    - [77, 14053.0]
  - - [512, 2048, 1, 805, 512, 512, 805, 805]
    - [77, 13874.0]
  - - [512, 2048, 1, 850, 512, 512, 850, 850]
    - [77, 14366.0]
  - - [512, 2048, 1, 950, 512, 512, 950, 950]
    - [77, 14251.0]
  - - [128, 128, 49, 1152, 128, 128, 1152, 1152]
    - [97, 14198.0]
  - - [128, 128, 49, 1216, 128, 128, 1216, 1216]
    - [97, 14189.0]
  - - [128, 128, 36, 1800, 128, 128, 1800, 1800]
    - [66, 14596.0]
  - - [128, 128, 36, 1900, 128, 128, 1900, 1900]
    - [81, 14630.0]
  - - [128, 128, 64, 5880, 128, 128, 5880, 5880]
    - [74, 14117.0]
  - - [128, 128, 49, 7680, 128, 128, 7680, 7680]
    - [92, 11103.0]
  - - [128, 128, 64, 882, 128, 128, 882, 882]
    - [98, 13962.0]
  - - [128, 128, 64, 931, 128, 128, 931, 931]
    - [66, 14030.0]
  - - [128, 64, 121, 1152, 128, 128, 1152, 1152]
    - [88, 11897.0]
  - - [128, 64, 81, 12000, 128, 128, 12000, 12000]
    - [73, 11125.0]
  - - [128, 64, 121, 1216, 128, 128, 1216, 1216]
    - [97, 13331.0]
  - - [128, 64, 81, 1800, 128, 128, 1800, 1800]
    - [64, 12567.0]
  - - [128, 64, 81, 1900, 128, 128, 1900, 1900]
    - [79, 12565.0]
  - - [128, 64, 49, 20280, 128, 128, 20280, 20280]
    - [97, 10964.0]
  - - [128, 64, 49, 3042, 128, 128, 3042, 3042]
    - [65, 12114.0]
  - - [128, 64, 49, 3211, 128, 128, 3211, 3211]
    - [88, 12112.0]
  - - [128, 64, 169, 5880, 128, 128, 5880, 5880]
    - [106, 10662.0]
  - - [128, 64, 121, 7680, 128, 128, 7680, 7680]
    - [91, 8921.0]
  - - [128, 64, 169, 882, 128, 128, 882, 882]
    - [68, 10222.0]
  - - [128, 64, 169, 931, 128, 128, 931, 931]
    - [99, 10178.0]
  - - [256, 128, 25, 1080, 256, 256, 1080, 1080]
    - [65, 15011.0]
  - - [256, 128, 25, 162, 256, 256, 162, 162]
    - [65, 9165.0]
  - - [256, 128, 25, 171, 256, 256, 171, 171]
    - [80, 9608.0]
  - - [1152, 256, 1, 1, 1152, 1152, 1, 1]
    - [65, 64.0]
  - - [1152, 256, 1, 1444, 1152, 1152, 1444, 1444]
    - [81, 11889.0]
  - - [1152, 256, 1, 25, 1152, 1152, 25, 25]
    - [86, 1321.0]
  - - [1152, 256, 1, 9, 1152, 1152, 9, 9]
    - [98, 553.0]
  - - [2304, 256, 1, 1444, 2304, 2304, 1444, 1444]
    - [63, 14700.0]
  - - [2304, 340, 1, 1, 2304, 2304, 1, 1]
    - [86, 98.0]
  - - [2304, 340, 1, 1444, 2304, 2304, 1444, 1444]
    - [81, 13292.0]
  - - [2304, 340, 1, 9, 2304, 2304, 9, 9]
    - [100, 1183.0]
  - - [2304, 510, 1, 25, 2304, 2304, 25, 25]
    - [69, 3448.0]
  - - [96, 1024, 160, 1024, 96, 96, 1024, 1024]
    - [74, 13435.0]
  - - [96, 1024, 40, 1024, 96, 96, 1024, 1024]
    - [74, 13028.0]
  - - [96, 1024, 80, 1024, 96, 96, 1024, 1024]
    - [74, 13133.0]
  - - [96, 1024, 96, 1024, 96, 96, 1024, 1024]
    - [89, 13295.0]
  - - [96, 1024, 24, 1024, 96, 96, 1024, 1024]
    - [74, 12914.0]
  - - [96, 1024, 48, 1024, 96, 96, 1024, 1024]
    - [74, 12963.0]
  - - [96, 1024, 16, 1024, 96, 96, 1024, 1024]
    - [74, 12056.0]
  - - [96, 1024, 32, 1024, 96, 96, 1024, 1024]
    - [74, 13152.0]
  - - [64, 512, 320, 512, 64, 64, 512, 512]
    - [75, 9790.0]
  - - [64, 512, 80, 512, 64, 64, 512, 512]
    - [90, 9297.0]
  - - [29000, 109, 1, 2560, 29000, 29000, 2560, 2560]
    - [89, 14492.0]
  - - [29000, 121, 1, 2560, 29000, 29000, 2560, 2560]
    - [89, 15916.0]
  - - [29000, 65, 1, 2560, 29000, 29000, 2560, 2560]
    - [104, 8790.0]
  - - [29000, 66, 1, 2560, 29000, 29000, 2560, 2560]
    - [74, 8929.0]
  - - [29000, 67, 1, 2560, 29000, 29000, 2560, 2560]
    - [74, 9047.0]
  - - [29000, 69, 1, 2560, 29000, 29000, 2560, 2560]
    - [74, 9316.0]
  - - [29000, 70, 1, 2560, 29000, 29000, 2560, 2560]
    - [74, 9444.0]
  - - [29000, 71, 1, 2560, 29000, 29000, 2560, 2560]
    - [74, 9581.0]
  - - [29000, 73, 1, 2560, 29000, 29000, 2560, 2560]
    - [74, 9830.0]
  - - [29000, 74, 1, 2560, 29000, 29000, 2560, 2560]
    - [104, 9952.0]
  - - [29000, 75, 1, 2560, 29000, 29000, 2560, 2560]
    - [74, 10116.0]
  - - [29000, 77, 1, 2560, 29000, 29000, 2560, 2560]
    - [74, 10375.0]
  - - [29000, 78, 1, 2560, 29000, 29000, 2560, 2560]
    - [104, 10508.0]
  - - [29000, 80, 1, 2560, 29000, 29000, 2560, 2560]
    - [74, 10780.0]
  - - [29000, 81, 1, 2560, 29000, 29000, 2560, 2560]
    - [74, 10919.0]
  - - [29000, 82, 1, 2560, 29000, 29000, 2560, 2560]
    - [74, 11020.0]
  - - [29000, 83, 1, 2560, 29000, 29000, 2560, 2560]
    - [74, 11172.0]
  - - [29000, 84, 1, 2560, 29000, 29000, 2560, 2560]
    - [74, 11300.0]
  - - [29000, 88, 1, 2560, 29000, 29000, 2560, 2560]
    - [74, 11839.0]
  - - [29000, 89, 1, 2560, 29000, 29000, 2560, 2560]
    - [74, 11965.0]
  - - [29000, 90, 1, 2560, 29000, 29000, 2560, 2560]
    - [104, 12069.0]
  - - [29000, 92, 1, 2560, 29000, 29000, 2560, 2560]
    - [74, 12328.0]
  - - [29000, 95, 1, 2560, 29000, 29000, 2560, 2560]
    - [74, 12676.0]
  - - [29000, 98, 1, 2560, 29000, 29000, 2560, 2560]
    - [74, 13075.0]
  - - [64, 1024, 512, 1024, 64, 64, 1024, 1024]
    - [105, 10015.0]
  - - [64, 64, 36, 50176, 64, 64, 50176, 50176]
    - [113, 6614.0]
  - - [64, 64, 49, 36864, 64, 64, 36864, 36864]
    - [113, 6189.0]
  - - [64, 64, 64, 25600, 64, 64, 25600, 25600]
    - [105, 7681.0]
  - - [256, 256, 1, 60800, 256, 256, 60800, 60800]
    - [107, 12482.0]
  - - [256, 256, 1, 54400, 256, 256, 54400, 54400]
    - [110, 12388.0]
  - - [256, 256, 1, 51520, 256, 256, 51520, 51520]
    - [116, 12330.0]
  - - [256, 256, 1, 55296, 256, 256, 55296, 55296]
    - [114, 9748.0]
  - - [256, 256, 1, 56832, 256, 256, 56832, 56832]
    - [119, 11089.0]
  - - [256, 256, 1, 45632, 256, 256, 45632, 45632]
    - [116, 12259.0]
  - - [256, 256, 1, 49152, 256, 256, 49152, 49152]
    - [121, 9704.0]
  - - [256, 512, 1, 13600, 256, 256, 13600, 13600]
    - [107, 12767.0]
  - - [256, 256, 1, 43008, 256, 256, 43008, 43008]
    - [117, 9621.0]
  - - [256, 512, 1, 15200, 256, 256, 15200, 15200]
    - [107, 13025.0]
  - - [256, 512, 1, 12880, 256, 256, 12880, 12880]
    - [107, 12602.0]
  - - [256, 512, 1, 13824, 256, 256, 13824, 13824]
    - [120, 11908.0]
  - - [512, 256, 1, 13824, 512, 512, 13824, 13824]
    - [108, 12102.0]
  - - [256, 512, 1, 14208, 256, 256, 14208, 14208]
    - [107, 12679.0]
  - - [512, 256, 1, 14208, 512, 512, 14208, 14208]
    - [116, 12761.0]
  - - [512, 256, 1, 15200, 512, 512, 15200, 15200]
    - [110, 12902.0]
  - - [256, 512, 1, 12288, 256, 256, 12288, 12288]
    - [112, 11378.0]
  - - [512, 256, 1, 12288, 512, 512, 12288, 12288]
    - [120, 10897.0]
  - - [128, 64, 25, 43320, 128, 128, 43320, 43320]
    - [109, 12722.0]
  - - [64, 64, 64, 20280, 64, 64, 20280, 20280]
    - [111, 9276.0]
  - - [64, 64, 49, 27000, 64, 64, 27000, 27000]
    - [118, 9212.0]
  - - [64, 64, 36, 43320, 64, 64, 43320, 43320]
    - [115, 9277.0]
  - - [32, 5056, 1, 1280, 32, 32, 1280, 1280]
    - [147, 4588.0]
  - - [4288, 64, 1, 3328, 4288, 4288, 3328, 3328]
    - [193, 5778.0]
  - - [2368, 64, 1, 1, 2368, 2368, 1, 1]
    - [192, 82.0]
  - - [1408, 128, 1, 32, 1408, 1408, 32, 32]
    - [191, 2465.0]
  - - [32, 2944, 1, 3328, 32, 32, 3328, 3328]
    - [126, 3997.0]
  - - [2368, 32, 1, 256, 2368, 2368, 256, 256]
    - [162, 2425.0]
  - - [1024, 128, 1, 32, 1024, 1024, 32, 32]
    - [179, 989.0]
  - - [32, 4288, 1, 1280, 32, 32, 1280, 1280]
    - [168, 4417.0]
  - - [32, 5056, 1, 32, 32, 32, 32, 32]
    - [145, 1116.0]
  - - [5888, 32, 1, 32, 5888, 5888, 32, 32]
    - [125, 1272.0]
  - - [64, 2368, 1, 1280, 64, 64, 1280, 1280]
    - [154, 5449.0]
  - - [128, 704, 1, 32, 128, 128, 32, 32]
    - [165, 700.0]
  - - [32, 4288, 1, 3328, 32, 32, 3328, 3328]
    - [126, 4231.0]
  - - [1408, 64, 1, 1, 1408, 1408, 1, 1]
    - [165, 22.0]
  - - [1856, 64, 1, 256, 1856, 1856, 256, 256]
    - [164, 3188.0]
  - - [1024, 256, 1, 256, 1024, 1024, 256, 256]
    - [127, 4341.0]
  - - [1856, 128, 1, 32, 1856, 1856, 32, 32]
    - [193, 1590.0]
  - - [1856, 128, 1, 1280, 1856, 1856, 1280, 1280]
    - [154, 6356.0]
  - - [4288, 32, 1, 3328, 4288, 4288, 3328, 3328]
    - [125, 4190.0]
  - - [3584, 64, 1, 1280, 3584, 3584, 1280, 1280]
    - [141, 5759.0]
  - - [64, 1856, 1, 256, 64, 64, 256, 256]
    - [191, 3242.0]
  - - [3584, 64, 1, 32, 3584, 3584, 32, 32]
    - [137, 2294.0]
  - - [1408, 128, 1, 3328, 1408, 1408, 3328, 3328]
    - [152, 5174.0]
  - - [32, 6784, 1, 3328, 32, 32, 3328, 3328]
    - [126, 4323.0]
  - - [32, 3584, 1, 256, 32, 32, 256, 256]
    - [137, 2924.0]
  - - [704, 256, 1, 32, 704, 704, 32, 32]
    - [141, 1243.0]
  - - [64, 2944, 1, 3328, 64, 64, 3328, 3328]
    - [125, 5485.0]
  - - [64, 4288, 1, 3328, 64, 64, 3328, 3328]
    - [125, 5795.0]
  - - [256, 704, 1, 256, 256, 256, 256, 256]
    - [162, 3845.0]
  - - [5056, 32, 1, 3328, 5056, 5056, 3328, 3328]
    - [152, 4652.0]
  - - [2944, 32, 1, 1280, 2944, 2944, 1280, 1280]
    - [140, 3534.0]
  - - [64, 1408, 1, 3328, 64, 64, 3328, 3328]
    - [129, 4541.0]
  - - [256, 448, 1, 1280, 256, 256, 1280, 1280]
    - [152, 4966.0]
  - - [448, 448, 1, 256, 448, 448, 256, 256]
    - [179, 4847.0]
  - - [1024, 256, 1, 1, 1024, 1024, 1, 1]
    - [162, 109.0]
  - - [1856, 64, 1, 32, 1856, 1856, 32, 32]
    - [124, 1776.0]
  - - [4288, 64, 1, 256, 4288, 4288, 256, 256]
    - [127, 5098.0]
  - - [1408, 64, 1, 256, 1408, 1408, 256, 256]
    - [165, 3204.0]
  - - [6784, 32, 1, 32, 6784, 6784, 32, 32]
    - [174, 2481.0]
  - - [448, 448, 1, 1280, 448, 448, 1280, 1280]
    - [127, 5475.0]
  - - [32, 5888, 1, 256, 32, 32, 256, 256]
    - [181, 3521.0]
  - - [1024, 128, 1, 256, 1024, 1024, 256, 256]
    - [141, 4346.0]
  - - [1856, 64, 1, 1280, 1856, 1856, 1280, 1280]
    - [177, 4722.0]
  - - [128, 1408, 1, 1, 128, 128, 1, 1]
    - [164, 94.0]
  - - [32, 2368, 1, 1280, 32, 32, 1280, 1280]
    - [195, 3786.0]
  - - [448, 256, 1, 256, 448, 448, 256, 256]
    - [166, 3904.0]
  - - [2944, 32, 1, 32, 2944, 2944, 32, 32]
    - [153, 701.0]
  - - [448, 448, 1, 32, 448, 448, 32, 32]
    - [125, 1384.0]
  - - [704, 256, 1, 3328, 704, 704, 3328, 3328]
    - [152, 5171.0]
  - - [64, 2944, 1, 1, 64, 64, 1, 1]
    - [141, 44.0]
  - - [64, 2944, 1, 32, 64, 64, 32, 32]
    - [150, 1294.0]
  - - [64, 2944, 1, 1280, 64, 64, 1280, 1280]
    - [177, 5189.0]
  - - [32, 3584, 1, 1280, 32, 32, 1280, 1280]
    - [143, 4163.0]
  - - [32, 2944, 1, 32, 32, 32, 32, 32]
    - [124, 704.0]
  - - [32, 6784, 1, 256, 32, 32, 256, 256]
    - [140, 3227.0]
  - - [448, 448, 1, 3328, 448, 448, 3328, 3328]
    - [179, 5495.0]
  - - [704, 128, 1, 1280, 704, 704, 1280, 1280]
    - [143, 4108.0]
  - - [32, 3584, 1, 3328, 32, 32, 3328, 3328]
    - [126, 4013.0]
  - - [128, 704, 1, 1280, 128, 128, 1280, 1280]
    - [156, 4096.0]
  - - [64, 4288, 1, 1, 64, 64, 1, 1]
    - [162, 65.0]
  - - [3584, 32, 1, 32, 3584, 3584, 32, 32]
    - [126, 830.0]
  - - [3584, 64, 1, 1, 3584, 3584, 1, 1]
    - [127, 54.0]
  - - [32, 4288, 1, 32, 32, 32, 32, 32]
    - [192, 998.0]
  - - [64, 1408, 1, 1, 64, 64, 1, 1]
    - [151, 23.0]
  - - [256, 1024, 1, 256, 256, 256, 256, 256]
    - [162, 4335.0]
  - - [1408, 128, 1, 1280, 1408, 1408, 1280, 1280]
    - [152, 4936.0]
  - - [64, 4288, 1, 1280, 64, 64, 1280, 1280]
    - [125, 5628.0]
  - - [64, 3584, 1, 1, 64, 64, 1, 1]
    - [191, 56.0]
  - - [1024, 128, 1, 1280, 1024, 1024, 1280, 1280]
    - [127, 4934.0]
  - - [2368, 32, 1, 32, 2368, 2368, 32, 32]
    - [126, 586.0]
  - - [128, 1408, 1, 256, 128, 128, 256, 256]
    - [152, 3782.0]
  - - [256, 448, 1, 3328, 256, 256, 3328, 3328]
    - [152, 5408.0]
  - - [2368, 64, 1, 256, 2368, 2368, 256, 256]
    - [193, 4802.0]
  - - [32, 2368, 1, 3328, 32, 32, 3328, 3328]
    - [143, 3801.0]
  - - [128, 1856, 1, 1, 128, 128, 1, 1]
    - [164, 121.0]
  - - [128, 1856, 1, 32, 128, 128, 32, 32]
    - [154, 1597.0]
  - - [3584, 32, 1, 256, 3584, 3584, 256, 256]
    - [189, 2913.0]
  - - [64, 3584, 1, 256, 64, 64, 256, 256]
    - [143, 4829.0]
  - - [32, 2944, 1, 1280, 32, 32, 1280, 1280]
    - [126, 3540.0]
  - - [4288, 32, 1, 32, 4288, 4288, 32, 32]
    - [177, 959.0]
  - - [1856, 64, 1, 1, 1856, 1856, 1, 1]
    - [122, 30.0]
  - - [128, 1024, 1, 3328, 128, 128, 3328, 3328]
    - [127, 5177.0]
  - - [1408, 128, 1, 1, 1408, 1408, 1, 1]
    - [122, 43.0]
  - - [5056, 32, 1, 256, 5056, 5056, 256, 256]
    - [164, 3367.0]
  - - [64, 1408, 1, 1280, 64, 64, 1280, 1280]
    - [152, 3711.0]
  - - [3584, 32, 1, 1280, 3584, 3584, 1280, 1280]
    - [164, 4209.0]
  - - [1856, 128, 1, 3328, 1856, 1856, 3328, 3328]
    - [193, 6335.0]
  - - [704, 256, 1, 1280, 704, 704, 1280, 1280]
    - [141, 5011.0]
  - - [1856, 128, 1, 1, 1856, 1856, 1, 1]
    - [152, 59.0]
  - - [256, 704, 1, 1, 256, 256, 1, 1]
    - [127, 44.0]
  - - [1024, 128, 1, 1, 1024, 1024, 1, 1]
    - [151, 34.0]
  - - [1856, 128, 1, 256, 1856, 1856, 256, 256]
    - [141, 4737.0]
  - - [1024, 256, 1, 1280, 1024, 1024, 1280, 1280]
    - [191, 5440.0]
  - - [64, 2368, 1, 32, 64, 64, 32, 32]
    - [154, 1123.0]
  - - [32, 2368, 1, 256, 32, 32, 256, 256]
    - [137, 2413.0]
  - - [32, 6784, 1, 1280, 32, 32, 1280, 1280]
    - [143, 4386.0]
  - - [32, 6784, 1, 32, 32, 32, 32, 32]
    - [175, 1389.0]
  - - [64, 3584, 1, 3328, 64, 64, 3328, 3328]
    - [166, 6205.0]
  - - [32, 5888, 1, 1280, 32, 32, 1280, 1280]
    - [156, 4053.0]
  - - [448, 256, 1, 1, 448, 448, 1, 1]
    - [122, 71.0]
  - - [448, 256, 1, 3328, 448, 448, 3328, 3328]
    - [177, 5317.0]
  - - [128, 704, 1, 3328, 128, 128, 3328, 3328]
    - [123, 4645.0]
  - - [2368, 32, 1, 3328, 2368, 2368, 3328, 3328]
    - [177, 3995.0]
  - - [2944, 64, 1, 3328, 2944, 2944, 3328, 3328]
    - [152, 5191.0]
  - - [128, 1024, 1, 32, 128, 128, 32, 32]
    - [154, 928.0]
  - - [32, 2368, 1, 32, 32, 32, 32, 32]
    - [136, 575.0]
  - - [64, 1856, 1, 1280, 64, 64, 1280, 1280]
    - [177, 4927.0]
  - - [32, 3584, 1, 32, 32, 32, 32, 32]
    - [175, 838.0]
  - - [704, 256, 1, 1, 704, 704, 1, 1]
    - [190, 83.0]
  - - [1024, 256, 1, 3328, 1024, 1024, 3328, 3328]
    - [193, 5521.0]
  - - [128, 1856, 1, 1280, 128, 128, 1280, 1280]
    - [154, 6079.0]
  - - [448, 256, 1, 32, 448, 448, 32, 32]
    - [126, 830.0]
  - - [64, 4288, 1, 32, 64, 64, 32, 32]
    - [154, 1756.0]
  - - [128, 704, 1, 1, 128, 128, 1, 1]
    - [122, 23.0]
  - - [4288, 64, 1, 1280, 4288, 4288, 1280, 1280]
    - [193, 5477.0]
  - - [448, 448, 1, 1, 448, 448, 1, 1]
    - [127, 47.0]
  - - [32, 5888, 1, 32, 32, 32, 32, 32]
    - [123, 1230.0]
  - - [1024, 128, 1, 3328, 1024, 1024, 3328, 3328]
    - [179, 5233.0]
  - - [4288, 64, 1, 32, 4288, 4288, 32, 32]
    - [141, 1756.0]
  - - [2368, 64, 1, 32, 2368, 2368, 32, 32]
    - [127, 1144.0]
  - - [64, 1408, 1, 32, 64, 64, 32, 32]
    - [124, 707.0]
  - - [32, 2944, 1, 256, 32, 32, 256, 256]
    - [140, 3233.0]
  - - [2944, 64, 1, 1, 2944, 2944, 1, 1]
    - [152, 107.0]
  - - [2944, 64, 1, 32, 2944, 2944, 32, 32]
    - [125, 1316.0]
  - - [64, 2944, 1, 256, 64, 64, 256, 256]
    - [125, 4795.0]
  - - [64, 2368, 1, 256, 64, 64, 256, 256]
    - [191, 4564.0]
  - - [1408, 64, 1, 3328, 1408, 1408, 3328, 3328]
    - [150, 4079.0]
  - - [6784, 32, 1, 1280, 6784, 6784, 1280, 1280]
    - [139, 4119.0]
  - - [2944, 64, 1, 1280, 2944, 2944, 1280, 1280]
    - [152, 4936.0]
  - - [2944, 32, 1, 256, 2944, 2944, 256, 256]
    - [162, 2610.0]
  - - [256, 1024, 1, 3328, 256, 256, 3328, 3328]
    - [177, 5529.0]
  - - [1856, 64, 1, 3328, 1856, 1856, 3328, 3328]
    - [152, 5129.0]
  - - [5888, 32, 1, 256, 5888, 5888, 256, 256]
    - [164, 3490.0]
  - - [128, 704, 1, 256, 128, 128, 256, 256]
    - [162, 2695.0]
  - - [3584, 64, 1, 256, 3584, 3584, 256, 256]
    - [141, 4408.0]
  - - [64, 1856, 1, 32, 64, 64, 32, 32]
    - [151, 914.0]
  - - [64, 1856, 1, 3328, 64, 64, 3328, 3328]
    - [152, 5311.0]
  - - [5888, 32, 1, 1280, 5888, 5888, 1280, 1280]
    - [191, 4090.0]
  - - [256, 704, 1, 32, 256, 256, 32, 32]
    - [152, 1207.0]
  - - [256, 704, 1, 1280, 256, 256, 1280, 1280]
    - [125, 5092.0]
  - - [1408, 64, 1, 32, 1408, 1408, 32, 32]
    - [153, 677.0]
  - - [128, 1408, 1, 1280, 128, 128, 1280, 1280]
    - [152, 5057.0]
  - - [128, 1856, 1, 3328, 128, 128, 3328, 3328]
    - [141, 6346.0]
  - - [2368, 64, 1, 3328, 2368, 2368, 3328, 3328]
    - [179, 5803.0]
  - - [32, 5056, 1, 3328, 32, 32, 3328, 3328]
    - [126, 4313.0]
  - - [64, 1856, 1, 1, 64, 64, 1, 1]
    - [124, 29.0]
  - - [704, 128, 1, 32, 704, 704, 32, 32]
    - [153, 714.0]
  - - [4288, 64, 1, 1, 4288, 4288, 1, 1]
    - [152, 64.0]
  - - [5056, 32, 1, 1280, 5056, 5056, 1280, 1280]
    - [139, 4245.0]
  - - [128, 1024, 1, 1, 128, 128, 1, 1]
    - [126, 33.0]
  - - [256, 1024, 1, 1, 256, 256, 1, 1]
    - [164, 61.0]
  - - [1408, 64, 1, 1280, 1408, 1408, 1280, 1280]
    - [177, 3662.0]
  - - [1024, 256, 1, 32, 1024, 1024, 32, 32]
    - [122, 2741.0]
  - - [2368, 32, 1, 1280, 2368, 2368, 1280, 1280]
    - [177, 3577.0]
  - - [704, 128, 1, 1, 704, 704, 1, 1]
    - [165, 23.0]
  - - [256, 448, 1, 256, 256, 256, 256, 256]
    - [139, 3277.0]
  - - [32, 4288, 1, 256, 32, 32, 256, 256]
    - [181, 3142.0]
  - - [128, 1408, 1, 32, 128, 128, 32, 32]
    - [191, 1222.0]
  - - [704, 128, 1, 3328, 704, 704, 3328, 3328]
    - [150, 4635.0]
  - - [64, 4288, 1, 256, 64, 64, 256, 256]
    - [152, 4452.0]
  - - [4288, 32, 1, 1280, 4288, 4288, 1280, 1280]
    - [139, 3845.0]
  - - [32, 5056, 1, 256, 32, 32, 256, 256]
    - [143, 3077.0]
  - - [704, 128, 1, 256, 704, 704, 256, 256]
    - [189, 2740.0]
  - - [256, 1024, 1, 32, 256, 256, 32, 32]
    - [152, 1638.0]
  - - [256, 1024, 1, 1280, 256, 256, 1280, 1280]
    - [125, 5421.0]
  - - [6784, 32, 1, 256, 6784, 6784, 256, 256]
    - [191, 3482.0]
  - - [64, 2368, 1, 1, 64, 64, 1, 1]
    - [126, 38.0]
  - - [1408, 128, 1, 256, 1408, 1408, 256, 256]
    - [162, 3794.0]
  - - [5888, 32, 1, 3328, 5888, 5888, 3328, 3328]
    - [152, 4448.0]
  - - [64, 2368, 1, 3328, 64, 64, 3328, 3328]
    - [166, 5939.0]
  - - [256, 704, 1, 3328, 256, 256, 3328, 3328]
    - [125, 5387.0]
  - - [128, 1408, 1, 3328, 128, 128, 3328, 3328]
    - [177, 5336.0]
  - - [2944, 32, 1, 3328, 2944, 2944, 3328, 3328]
    - [126, 3813.0]
  - - [2368, 64, 1, 1280, 2368, 2368, 1280, 1280]
    - [127, 5452.0]
  - - [128, 1024, 1, 1280, 128, 128, 1280, 1280]
    - [166, 4923.0]
  - - [128, 1024, 1, 256, 128, 128, 256, 256]
    - [175, 3779.0]
  - - [3584, 64, 1, 3328, 3584, 3584, 3328, 3328]
    - [193, 6060.0]
  - - [256, 448, 1, 1, 256, 256, 1, 1]
    - [176, 30.0]
  - - [256, 448, 1, 32, 256, 256, 32, 32]
    - [125, 846.0]
  - - [64, 3584, 1, 32, 64, 64, 32, 32]
    - [177, 1536.0]
  - - [64, 3584, 1, 1280, 64, 64, 1280, 1280]
    - [141, 5784.0]
  - - [4288, 32, 1, 256, 4288, 4288, 256, 256]
    - [191, 2997.0]
  - - [448, 256, 1, 1280, 448, 448, 1280, 1280]
    - [177, 4864.0]
  - - [128, 1856, 1, 256, 128, 128, 256, 256]
    - [166, 4693.0]
  - - [3584, 32, 1, 3328, 3584, 3584, 3328, 3328]
    - [177, 4365.0]
  - - [6784, 32, 1, 3328, 6784, 6784, 3328, 3328]
    - [177, 4708.0]
  - - [2944, 64, 1, 256, 2944, 2944, 256, 256]
    - [164, 3810.0]
  - - [64, 1408, 1, 256, 64, 64, 256, 256]
    - [189, 2633.0]
  - - [5056, 32, 1, 32, 5056, 5056, 32, 32]
    - [166, 1578.0]
  - - [32, 5888, 1, 3328, 32, 32, 3328, 3328]
    - [143, 4228.0]
  - - [704, 256, 1, 256, 704, 704, 256, 256]
    - [189, 4826.0]
  - - [1024, 256, 1, 196, 1024, 1024, 196, 196]
    - [162, 5008.0]
  - - [256, 1024, 1, 196, 256, 256, 196, 196]
    - [137, 5159.0]
  - - [1760, 64, 1, 1760, 1760, 1760, 1760, 1760]
    - [181, 6226.0]
  - - [2560, 32, 1, 2560, 2560, 2560, 2560, 2560]
    - [195, 4011.0]
  - - [4608, 32, 1, 1536, 4608, 4608, 1536, 1536]
    - [164, 3898.0]
  - - [3072, 64, 1, 1024, 3072, 3072, 1024, 1024]
    - [141, 4930.0]
  - - [2048, 128, 1, 2048, 2048, 2048, 2048, 2048]
    - [141, 5400.0]
  - - [4096, 64, 1, 4096, 4096, 4096, 4096, 4096]
    - [141, 5459.0]
  - - [7680, 32, 1, 2560, 7680, 7680, 2560, 2560]
    - [143, 4265.0]
  - - [2560, 64, 1, 2560, 2560, 2560, 2560, 2560]
    - [141, 5970.0]
  - - [1760, 128, 1, 1760, 1760, 1760, 1760, 1760]
    - [166, 6178.0]
  - - [3072, 32, 1, 1024, 3072, 3072, 1024, 1024]
    - [192, 3503.0]
  - - [6144, 32, 1, 2560, 6144, 6144, 2560, 2560]
    - [195, 4340.0]
  - - [4096, 32, 1, 4096, 4096, 4096, 4096, 4096]
    - [195, 4501.0]
  - - [2048, 64, 1, 2048, 2048, 2048, 2048, 2048]
    - [141, 4830.0]
  - - [8448, 32, 1, 2816, 8448, 8448, 2816, 2816]
    - [177, 4568.0]
  - - [512, 512, 1, 512, 512, 512, 512, 512]
    - [139, 4766.0]
  - - [511, 512, 1, 512, 511, 511, 512, 512]
    - [141, 4847.0]
  - - [512, 512, 1, 511, 512, 512, 511, 511]
    - [175, 5055.0]
  - - [512, 513, 1, 512, 512, 512, 512, 512]
    - [139, 4739.0]
  - - [512, 511, 1, 512, 512, 512, 512, 512]
    - [166, 5117.0]
  - - [513, 512, 1, 512, 513, 513, 512, 512]
    - [141, 4459.0]
  - - [512, 512, 1, 513, 512, 512, 513, 513]
    - [127, 4951.0]
  - - [512, 512, 1, 64, 512, 512, 64, 64]
    - [152, 2589.0]
  - - [33, 33, 1600, 32, 33, 33, 32, 32]
    - [174, 1984.0]
  - - [256, 684, 1, 1024, 256, 256, 1024, 1024]
    - [191, 4586.0]
  - - [1024, 200, 1, 560, 1024, 1024, 560, 560]
    - [189, 4595.0]
  - - [2048, 114, 1, 512, 2048, 2048, 512, 512]
    - [141, 4379.0]
  - - [2048, 114, 1, 768, 2048, 2048, 768, 768]
    - [141, 4581.0]
  - - [32, 32, 4608, 64, 32, 32, 64, 64]
    - [195, 4024.0]
  - - [32, 35, 4608, 64, 32, 32, 64, 64]
    - [181, 3587.0]
  - - [34, 34, 4736, 64, 34, 34, 64, 64]
    - [189, 2202.0]
  - - [35, 35, 4608, 64, 35, 35, 64, 64]
    - [189, 2305.0]
  - - [33, 33, 1920, 64, 33, 33, 64, 64]
    - [150, 2113.0]
  - - [480, 512, 1, 512, 480, 480, 512, 512]
    - [141, 4599.0]
  - - [512, 480, 1, 512, 512, 512, 512, 512]
    - [139, 5045.0]
  - - [1024, 200, 1, 1024, 1024, 1024, 1024, 1024]
    - [191, 4526.0]
  - - [1024, 308, 1, 1024, 1024, 1024, 1024, 1024]
    - [141, 6147.0]
  - - [1024, 160, 1, 1024, 1024, 1024, 1024, 1024]
    - [164, 4940.0]
  - - [1024, 180, 1, 1024, 1024, 1024, 1024, 1024]
    - [191, 4815.0]
  - - [128, 864, 1, 256, 128, 128, 256, 256]
    - [178, 3478.0]
  - - [256, 864, 1, 512, 256, 256, 512, 512]
    - [141, 5092.0]
  - - [1152, 128, 1, 784, 1152, 1152, 784, 784]
    - [179, 5689.0]
  - - [256, 512, 1, 784, 256, 256, 784, 784]
    - [175, 5386.0]
  - - [512, 256, 1, 784, 512, 512, 784, 784]
    - [123, 5495.0]
  - - [1024, 128, 1, 1024, 1024, 1024, 1024, 1024]
    - [141, 4525.0]
  - - [1024, 96, 1, 1024, 1024, 1024, 1024, 1024]
    - [168, 4295.0]
  - - [1024, 256, 1, 3800, 1024, 1024, 3800, 3800]
    - [175, 5740.0]
  - - [1024, 256, 1, 3400, 1024, 1024, 3400, 3400]
    - [189, 5724.0]
  - - [256, 1024, 1, 3400, 256, 256, 3400, 3400]
    - [175, 5700.0]
  - - [1024, 256, 1, 3220, 1024, 1024, 3220, 3220]
    - [175, 5700.0]
  - - [256, 1024, 1, 3220, 256, 256, 3220, 3220]
    - [150, 5794.0]
  - - [1024, 256, 1, 3456, 1024, 1024, 3456, 3456]
    - [194, 5761.0]
  - - [256, 1024, 1, 3456, 256, 256, 3456, 3456]
    - [123, 5809.0]
  - - [1024, 256, 1, 3072, 1024, 1024, 3072, 3072]
    - [193, 5382.0]
  - - [256, 1024, 1, 3072, 256, 256, 3072, 3072]
    - [141, 5451.0]
  - - [1024, 256, 1, 3552, 1024, 1024, 3552, 3552]
    - [177, 5687.0]
  - - [256, 1024, 1, 3552, 256, 256, 3552, 3552]
    - [177, 5692.0]
  - - [256, 1024, 1, 2852, 256, 256, 2852, 2852]
    - [150, 5851.0]
  - - [1024, 256, 1, 2852, 1024, 1024, 2852, 2852]
    - [150, 6148.0]
  - - [256, 512, 1, 10752, 256, 256, 10752, 10752]
    - [141, 5052.0]
  - - [256, 1024, 1, 3800, 256, 256, 3800, 3800]
    - [123, 5672.0]
  - - [256, 512, 1, 10560, 256, 256, 10560, 10560]
    - [175, 5511.0]
  - - [256, 1024, 1, 2992, 256, 256, 2992, 2992]
    - [152, 5652.0]
  - - [256, 1024, 1, 2688, 256, 256, 2688, 2688]
    - [123, 5931.0]
  - - [1024, 256, 1, 2688, 1024, 1024, 2688, 2688]
    - [150, 5771.0]
  - - [256, 1024, 1, 2904, 256, 256, 2904, 2904]
    - [175, 5663.0]
  - - [1024, 256, 1, 2904, 1024, 1024, 2904, 2904]
    - [150, 5597.0]
  - - [256, 1024, 1, 2640, 256, 256, 2640, 2640]
    - [150, 5817.0]
  - - [1024, 256, 1, 2640, 1024, 1024, 2640, 2640]
    - [177, 5535.0]
  - - [1024, 256, 1, 4032, 1024, 1024, 4032, 4032]
    - [189, 5995.0]
  - - [1024, 256, 1, 2992, 1024, 1024, 2992, 2992]
    - [152, 5634.0]
  - - [256, 1024, 1, 3360, 256, 256, 3360, 3360]
    - [125, 5695.0]
  - - [1024, 256, 1, 3360, 1024, 1024, 3360, 3360]
    - [123, 6242.0]
  - - [1024, 256, 1, 3500, 1024, 1024, 3500, 3500]
    - [175, 5619.0]
  - - [256, 1024, 1, 3500, 256, 256, 3500, 3500]
    - [150, 5729.0]
  - - [1024, 256, 1, 3168, 1024, 1024, 3168, 3168]
    - [123, 5681.0]
  - - [256, 1024, 1, 3168, 256, 256, 3168, 3168]
    - [152, 5700.0]
  - - [256, 1024, 1, 3036, 256, 256, 3036, 3036]
    - [150, 5665.0]
  - - [1024, 256, 1, 4200, 1024, 1024, 4200, 4200]
    - [162, 5729.0]
  - - [1024, 256, 1, 3600, 1024, 1024, 3600, 3600]
    - [177, 5589.0]
  - - [256, 1024, 1, 3600, 256, 256, 3600, 3600]
    - [175, 5750.0]
  - - [256, 1024, 1, 2944, 256, 256, 2944, 2944]
    - [123, 5913.0]
  - - [1024, 256, 1, 2944, 1024, 1024, 2944, 2944]
    - [177, 5703.0]
  - - [1024, 256, 1, 3700, 1024, 1024, 3700, 3700]
    - [189, 5995.0]
  - - [256, 1024, 1, 2352, 256, 256, 2352, 2352]
    - [168, 6852.0]
  - - [1024, 256, 1, 2352, 1024, 1024, 2352, 2352]
    - [123, 5685.0]
  - - [1024, 256, 1, 2816, 1024, 1024, 2816, 2816]
    - [193, 5511.0]
  - - [256, 1024, 1, 3700, 256, 256, 3700, 3700]
    - [175, 5854.0]
  - - [256, 1024, 1, 2816, 256, 256, 2816, 2816]
    - [141, 5488.0]
  - - [256, 512, 1, 11408, 256, 256, 11408, 11408]
    - [127, 5545.0]
  - - [1024, 256, 1, 3036, 1024, 1024, 3036, 3036]
    - [189, 5751.0]
  - - [1024, 256, 1, 3264, 1024, 1024, 3264, 3264]
    - [177, 5720.0]
  - - [256, 1024, 1, 3264, 256, 256, 3264, 3264]
    - [125, 5727.0]
  - - [1024, 256, 1, 3864, 1024, 1024, 3864, 3864]
    - [175, 5567.0]
  - - [256, 1024, 1, 4032, 256, 256, 4032, 4032]
    - [123, 5980.0]
  - - [1024, 256, 1, 3128, 1024, 1024, 3128, 3128]
    - [123, 5616.0]
  - - [256, 1024, 1, 3128, 256, 256, 3128, 3128]
    - [150, 5834.0]
  - - [256, 1024, 1, 3200, 256, 256, 3200, 3200]
    - [150, 5898.0]
  - - [256, 512, 1, 11616, 256, 256, 11616, 11616]
    - [123, 5506.0]
  - - [1024, 256, 1, 3200, 1024, 1024, 3200, 3200]
    - [175, 5869.0]
  - - [1024, 256, 1, 4000, 1024, 1024, 4000, 4000]
    - [189, 5907.0]
  - - [256, 1024, 1, 2520, 256, 256, 2520, 2520]
    - [150, 5824.0]
  - - [1024, 256, 1, 2520, 1024, 1024, 2520, 2520]
    - [175, 6240.0]
  - - [256, 1024, 1, 2976, 256, 256, 2976, 2976]
    - [125, 5684.0]
  - - [256, 1024, 1, 2400, 256, 256, 2400, 2400]
    - [150, 5883.0]
  - - [1024, 256, 1, 2400, 1024, 1024, 2400, 2400]
    - [150, 5926.0]
  - - [1024, 256, 1, 3696, 1024, 1024, 3696, 3696]
    - [177, 5588.0]
  - - [1024, 256, 1, 3900, 1024, 1024, 3900, 3900]
    - [175, 5652.0]
  - - [1024, 256, 1, 3772, 1024, 1024, 3772, 3772]
    - [189, 5665.0]
  - - [256, 1024, 1, 3696, 256, 256, 3696, 3696]
    - [175, 5814.0]
  - - [256, 1024, 1, 2728, 256, 256, 2728, 2728]
    - [150, 5854.0]
  - - [1024, 256, 1, 2728, 1024, 1024, 2728, 2728]
    - [189, 5798.0]
  - - [1024, 256, 1, 2480, 1024, 1024, 2480, 2480]
    - [123, 6396.0]
  - - [256, 1024, 1, 2480, 256, 256, 2480, 2480]
    - [177, 5616.0]
  - - [1024, 256, 1, 2880, 1024, 1024, 2880, 2880]
    - [177, 5708.0]
  - - [512, 256, 1, 3220, 512, 512, 3220, 3220]
    - [127, 5418.0]
  - - [256, 1024, 1, 2880, 256, 256, 2880, 2880]
    - [152, 5716.0]
  - - [256, 1024, 1, 4200, 256, 256, 4200, 4200]
    - [175, 5663.0]
  - - [1024, 256, 1, 3648, 1024, 1024, 3648, 3648]
    - [177, 5778.0]
  - - [1024, 256, 1, 3312, 1024, 1024, 3312, 3312]
    - [152, 5641.0]
  - - [256, 1024, 1, 3648, 256, 256, 3648, 3648]
    - [152, 5731.0]
  - - [1024, 256, 1, 3300, 1024, 1024, 3300, 3300]
    - [123, 5639.0]
  - - [1024, 256, 1, 3528, 1024, 1024, 3528, 3528]
    - [175, 5599.0]
  - - [256, 1024, 1, 2604, 256, 256, 2604, 2604]
    - [152, 5627.0]
  - - [1024, 256, 1, 2604, 1024, 1024, 2604, 2604]
    - [175, 5612.0]
  - - [512, 256, 1, 11408, 512, 512, 11408, 11408]
    - [123, 6676.0]
  - - [256, 1024, 1, 3312, 256, 256, 3312, 3312]
    - [152, 5658.0]
  - - [256, 1024, 1, 3300, 256, 256, 3300, 3300]
    - [150, 5690.0]
  - - [512, 256, 1, 3072, 512, 512, 3072, 3072]
    - [141, 4920.0]
  - - [256, 1024, 1, 3528, 256, 256, 3528, 3528]
    - [150, 5739.0]
  - - [1024, 256, 1, 2976, 1024, 1024, 2976, 2976]
    - [168, 7152.0]
  - - [1024, 256, 1, 2760, 1024, 1024, 2760, 2760]
    - [123, 5631.0]
  - - [512, 256, 1, 3800, 512, 512, 3800, 3800]
    - [123, 5266.0]
  - - [256, 1024, 1, 2760, 256, 256, 2760, 2760]
    - [150, 5847.0]
  - - [1024, 256, 1, 2160, 1024, 1024, 2160, 2160]
    - [162, 5890.0]
  - - [256, 1024, 1, 2160, 256, 256, 2160, 2160]
    - [150, 5853.0]
  - - [512, 256, 1, 11616, 512, 512, 11616, 11616]
    - [175, 5496.0]
  - - [512, 256, 1, 2852, 512, 512, 2852, 2852]
    - [127, 5271.0]
  - - [256, 1024, 1, 3864, 256, 256, 3864, 3864]
    - [150, 5635.0]
  - - [512, 256, 1, 2640, 512, 512, 2640, 2640]
    - [127, 5338.0]
  - - [256, 1024, 1, 4000, 256, 256, 4000, 4000]
    - [123, 5924.0]
  - - [512, 256, 1, 2904, 512, 512, 2904, 2904]
    - [150, 5227.0]
  - - [256, 1024, 1, 3900, 256, 256, 3900, 3900]
    - [175, 5693.0]
  - - [512, 256, 1, 2688, 512, 512, 2688, 2688]
    - [150, 5540.0]
  - - [256, 1024, 1, 3772, 256, 256, 3772, 3772]
    - [177, 5650.0]
  - - [512, 256, 1, 3400, 512, 512, 3400, 3400]
    - [137, 5359.0]
  - - [512, 256, 1, 3456, 512, 512, 3456, 3456]
    - [123, 5385.0]
  - - [512, 256, 1, 3552, 512, 512, 3552, 3552]
    - [154, 5424.0]
  - - [128, 64, 25, 6498, 128, 128, 6498, 6498]
    - [125, 5971.0]
  - - [128, 64, 25, 6859, 128, 128, 6859, 6859]
    - [125, 4441.0]
  - - [64, 64, 64, 3042, 64, 64, 3042, 3042]
    - [150, 5496.0]
  - - [64, 64, 64, 3211, 64, 64, 3211, 3211]
    - [125, 5511.0]
  - - [64, 64, 49, 4050, 64, 64, 4050, 4050]
    - [164, 5886.0]
  - - [64, 64, 49, 4275, 64, 64, 4275, 4275]
    - [125, 5780.0]
  - - [64, 64, 36, 6498, 64, 64, 6498, 6498]
    - [179, 5719.0]
  - - [64, 64, 36, 6859, 64, 64, 6859, 6859]
    - [179, 5891.0]
  - - [1152, 128, 1, 1444, 1152, 1152, 1444, 1444]
    - [179, 5313.0]
  - - [512, 256, 1, 361, 512, 512, 361, 361]
    - [141, 3810.0]
  - - [576, 128, 1, 1444, 576, 576, 1444, 1444]
    - [137, 3669.0]
  - - [29000, 35, 1, 2560, 29000, 29000, 2560, 2560]
    - [166, 3906.0]
  - - [29000, 36, 1, 2560, 29000, 29000, 2560, 2560]
    - [166, 4019.0]
  - - [29000, 39, 1, 2560, 29000, 29000, 2560, 2560]
    - [141, 4339.0]
  - - [29000, 40, 1, 2560, 29000, 29000, 2560, 2560]
    - [166, 4440.0]
  - - [29000, 42, 1, 2560, 29000, 29000, 2560, 2560]
    - [166, 4608.0]
  - - [29000, 43, 1, 2560, 29000, 29000, 2560, 2560]
    - [166, 4675.0]
  - - [29000, 44, 1, 2560, 29000, 29000, 2560, 2560]
    - [141, 4779.0]
  - - [29000, 46, 1, 2560, 29000, 29000, 2560, 2560]
    - [141, 4899.0]
  - - [29000, 48, 1, 2560, 29000, 29000, 2560, 2560]
    - [141, 5053.0]
  - - [29000, 49, 1, 2560, 29000, 29000, 2560, 2560]
    - [193, 5112.0]
  - - [29000, 50, 1, 2560, 29000, 29000, 2560, 2560]
    - [193, 5239.0]
  - - [29000, 51, 1, 2560, 29000, 29000, 2560, 2560]
    - [141, 5310.0]
  - - [29000, 53, 1, 2560, 29000, 29000, 2560, 2560]
    - [166, 5495.0]
  - - [29000, 54, 1, 2560, 29000, 29000, 2560, 2560]
    - [141, 5475.0]
  - - [29000, 55, 1, 2560, 29000, 29000, 2560, 2560]
    - [193, 5607.0]
  - - [29000, 56, 1, 2560, 29000, 29000, 2560, 2560]
    - [166, 5795.0]
  - - [29000, 57, 1, 2560, 29000, 29000, 2560, 2560]
    - [141, 5788.0]
  - - [29000, 58, 1, 2560, 29000, 29000, 2560, 2560]
    - [166, 5738.0]
  - - [29000, 59, 1, 2560, 29000, 29000, 2560, 2560]
    - [193, 5910.0]
  - - [29000, 61, 1, 2560, 29000, 29000, 2560, 2560]
    - [193, 6048.0]
  - - [29000, 63, 1, 2560, 29000, 29000, 2560, 2560]
    - [166, 6153.0]
  - - [256, 128, 1, 13600, 256, 256, 13600, 13600]
    - [201, 5194.0]
  - - [256, 128, 1, 12880, 256, 256, 12880, 12880]
    - [208, 5059.0]
  - - [128, 512, 1, 15200, 128, 128, 15200, 15200]
    - [198, 5508.0]
  - - [512, 128, 1, 15200, 512, 512, 15200, 15200]
    - [214, 5303.0]
  - - [128, 512, 1, 11408, 128, 128, 11408, 11408]
    - [198, 5335.0]
  - - [256, 128, 1, 13824, 256, 256, 13824, 13824]
    - [212, 4869.0]
  - - [128, 512, 1, 11616, 128, 128, 11616, 11616]
    - [198, 5241.0]
  - - [256, 128, 1, 14208, 256, 256, 14208, 14208]
    - [206, 4916.0]
  - - [128, 512, 1, 14208, 128, 128, 14208, 14208]
    - [189, 5466.0]
  - - [256, 128, 1, 15200, 256, 256, 15200, 15200]
    - [208, 5299.0]
  - - [512, 128, 1, 11408, 512, 512, 11408, 11408]
    - [207, 5245.0]
  - - [512, 128, 1, 16800, 512, 512, 16800, 16800]
    - [198, 5231.0]
  - - [128, 512, 1, 11264, 128, 128, 11264, 11264]
    - [201, 4972.0]
  - - [512, 128, 1, 11616, 512, 512, 11616, 11616]
    - [207, 8931.0]
  - - [512, 128, 1, 16128, 512, 512, 16128, 16128]
    - [216, 4906.0]
  - - [512, 128, 1, 11968, 512, 512, 11968, 11968]
    - [123, 5824.0]
  - - [128, 512, 1, 11968, 128, 128, 11968, 11968]
    - [123, 5655.0]
  - - [512, 128, 1, 12288, 512, 512, 12288, 12288]
    - [216, 4619.0]
  - - [128, 512, 1, 12288, 128, 128, 12288, 12288]
    - [212, 4889.0]
  - - [128, 512, 1, 12672, 128, 128, 12672, 12672]
    - [219, 5391.0]
  - - [512, 128, 1, 11776, 512, 512, 11776, 11776]
    - [208, 4654.0]
  - - [512, 128, 1, 12144, 512, 512, 12144, 12144]
    - [214, 5299.0]
  - - [512, 128, 1, 11264, 512, 512, 11264, 11264]
    - [208, 4691.0]
  - - [128, 512, 1, 12144, 128, 128, 12144, 12144]
    - [198, 5311.0]
  - - [512, 128, 1, 12672, 512, 512, 12672, 12672]
    - [215, 5262.0]
  - - [128, 512, 1, 12512, 128, 128, 12512, 12512]
    - [162, 5377.0]
  - - [128, 512, 1, 11776, 128, 128, 11776, 11776]
    - [201, 4968.0]
  - - [256, 128, 1, 12288, 256, 256, 12288, 12288]
    - [206, 4297.0]
  - - [40, 40, 1, 1909283, 40, 40, 1909283, 1909283]
    - [210, 691.0]
  - - [40, 40, 1, 3818566, 40, 40, 3818566, 3818566]
    - [218, 743.0]
  - - [5888, 1, 1, 3328, 5888, 5888, 3328, 3328]
    - [229, 239.0]
  - - [5056, 1, 1, 3328, 5056, 5056, 3328, 3328]
    - [226, 245.0]
  - - [6784, 1, 1, 1280, 6784, 6784, 1280, 1280]
    - [226, 220.0]
  - - [2944, 1, 1, 3328, 2944, 2944, 3328, 3328]
    - [232, 212.0]
  - - [3584, 1, 1, 1280, 3584, 3584, 1280, 1280]
    - [229, 207.0]
  - - [6784, 1, 1, 256, 6784, 6784, 256, 256]
    - [226, 159.0]
  - - [4288, 1, 1, 1280, 4288, 4288, 1280, 1280]
    - [226, 209.0]
  - - [5056, 1, 1, 1280, 5056, 5056, 1280, 1280]
    - [229, 247.0]
  - - [3584, 1, 1, 256, 3584, 3584, 256, 256]
    - [225, 190.0]
  - - [6784, 1, 1, 3328, 6784, 6784, 3328, 3328]
    - [232, 234.0]
  - - [1408, 1, 1, 1280, 1408, 1408, 1280, 1280]
    - [228, 125.0]
  - - [1408, 32, 1, 3328, 1408, 1408, 3328, 3328]
    - [163, 3074.0]
  - - [4288, 1, 1, 256, 4288, 4288, 256, 256]
    - [182, 148.0]
  - - [2368, 1, 1, 256, 2368, 2368, 256, 256]
    - [229, 92.0]
  - - [1856, 32, 1, 32, 1856, 1856, 32, 32]
    - [151, 457.0]
  - - [5056, 1, 1, 256, 5056, 5056, 256, 256]
    - [226, 152.0]
  - - [5056, 1, 1, 1, 5056, 5056, 1, 1]
    - [222, 1.0]
  - - [1408, 1, 1, 256, 1408, 1408, 256, 256]
    - [229, 57.0]
  - - [1408, 1, 1, 1, 1408, 1408, 1, 1]
    - [160, 1.0]
  - - [4288, 1, 1, 3328, 4288, 4288, 3328, 3328]
    - [226, 228.0]
  - - [2368, 1, 1, 1280, 2368, 2368, 1280, 1280]
    - [226, 180.0]
  - - [1856, 1, 1, 1, 1856, 1856, 1, 1]
    - [226, 0.49]
  - - [1856, 32, 1, 256, 1856, 1856, 256, 256]
    - [190, 2847.0]
  - - [1408, 32, 1, 32, 1408, 1408, 32, 32]
    - [138, 379.0]
  - - [1856, 32, 1, 1280, 1856, 1856, 1280, 1280]
    - [144, 2904.0]
  - - [1408, 1, 1, 3328, 1408, 1408, 3328, 3328]
    - [228, 154.0]
  - - [5888, 1, 1, 256, 5888, 5888, 256, 256]
    - [225, 148.0]
  - - [5888, 1, 1, 1, 5888, 5888, 1, 1]
    - [138, 3.0]
  - - [1856, 32, 1, 3328, 1856, 1856, 3328, 3328]
    - [176, 3541.0]
  - - [2368, 1, 1, 3328, 2368, 2368, 3328, 3328]
    - [226, 215.0]
  - - [6784, 1, 1, 1, 6784, 6784, 1, 1]
    - [223, 4.0]
  - - [5888, 1, 1, 1280, 5888, 5888, 1280, 1280]
    - [229, 224.0]
  - - [2944, 1, 1, 256, 2944, 2944, 256, 256]
    - [227, 111.0]
  - - [2944, 1, 1, 1, 2944, 2944, 1, 1]
    - [222, 1.0]
  - - [1408, 32, 1, 1280, 1408, 1408, 1280, 1280]
    - [176, 2789.0]
  - - [1856, 1, 1, 1280, 1856, 1856, 1280, 1280]
    - [228, 179.0]
  - - [3584, 1, 1, 1, 3584, 3584, 1, 1]
    - [224, 2.0]
  - - [2944, 1, 1, 1280, 2944, 2944, 1280, 1280]
    - [226, 185.0]
  - - [3584, 1, 1, 3328, 3584, 3584, 3328, 3328]
    - [232, 230.0]
  - - [1856, 1, 1, 3328, 1856, 1856, 3328, 3328]
    - [228, 195.0]
  - - [4288, 1, 1, 1, 4288, 4288, 1, 1]
    - [231, 2.0]
  - - [1856, 1, 1, 256, 1856, 1856, 256, 256]
    - [233, 99.0]
  - - [1408, 32, 1, 256, 1408, 1408, 256, 256]
    - [163, 1580.0]
  - - [2368, 1, 1, 1, 2368, 2368, 1, 1]
    - [222, 1.0]
  - - [1760, 32, 1, 1760, 1760, 1760, 1760, 1760]
    - [124, 3041.0]
  - - [3072, 16, 1, 1024, 3072, 3072, 1024, 1024]
    - [196, 2831.0]
  - - [2560, 16, 1, 2560, 2560, 2560, 2560, 2560]
    - [169, 2905.0]
  - - [2048, 32, 1, 2048, 2048, 2048, 2048, 2048]
    - [163, 3126.0]
  - - [1760, 16, 1, 1760, 1760, 1760, 1760, 1760]
    - [230, 2056.0]
  - - [7680, 16, 1, 2560, 7680, 7680, 2560, 2560]
    - [196, 3134.0]
  - - [8448, 16, 1, 2816, 8448, 8448, 2816, 2816]
    - [169, 3010.0]
  - - [4608, 16, 1, 1536, 4608, 4608, 1536, 1536]
    - [144, 2619.0]
  - - [6144, 16, 1, 2560, 6144, 6144, 2560, 2560]
    - [196, 2974.0]
  - - [4096, 16, 1, 4096, 4096, 4096, 4096, 4096]
    - [196, 2796.0]
  - - [2048, 16, 1, 2048, 2048, 2048, 2048, 2048]
    - [169, 2281.0]
  - - [2048, 2, 1, 2048, 2048, 2048, 2048, 2048]
    - [226, 385.0]
  - - [2560, 4, 1, 2560, 2560, 2560, 2560, 2560]
    - [232, 880.0]
  - - [32768, 1, 1, 256, 32768, 32768, 256, 256]
    - [226, 250.0]
  - - [1600, 1, 1, 1024, 1600, 1600, 1024, 1024]
    - [226, 125.0]
  - - [3456, 1, 1, 256, 3456, 3456, 256, 256]
    - [225, 123.0]
  - - [4096, 1, 1, 256, 4096, 4096, 256, 256]
    - [226, 134.0]
  - - [6912, 1, 1, 256, 6912, 6912, 256, 256]
    - [226, 161.0]
  - - [2048, 8, 1, 2048, 2048, 2048, 2048, 2048]
    - [226, 1392.0]
  - - [2560, 2, 1, 2560, 2560, 2560, 2560, 2560]
    - [226, 442.0]
  - - [29000, 27, 1, 2560, 29000, 29000, 2560, 2560]
    - [169, 2844.0]
  - - [1, 4288, 1, 1280, 1, 1, 1280, 1280]
    - [136, 200.0]
  - - [32, 1408, 1, 32, 32, 32, 32, 32]
    - [174, 901.0]
  - - [1, 1408, 1, 3328, 1, 1, 3328, 3328]
    - [142, 173.0]
  - - [1, 2368, 1, 1280, 1, 1, 1280, 1280]
    - [240, 173.0]
  - - [1, 5888, 1, 3328, 1, 1, 3328, 3328]
    - [235, 200.0]
  - - [1, 1856, 1, 256, 1, 1, 256, 256]
    - [136, 75.0]
  - - [1, 3584, 1, 3328, 1, 1, 3328, 3328]
    - [161, 201.0]
  - - [1, 6784, 1, 3328, 1, 1, 3328, 3328]
    - [243, 210.0]
  - - [1, 2368, 1, 256, 1, 1, 256, 256]
    - [161, 89.0]
  - - [32, 1856, 1, 3328, 32, 32, 3328, 3328]
    - [237, 4042.0]
  - - [1, 2944, 1, 1280, 1, 1, 1280, 1280]
    - [238, 185.0]
  - - [1, 1856, 1, 3328, 1, 1, 3328, 3328]
    - [128, 172.0]
  - - [1, 1408, 1, 1, 1, 1, 1, 1]
    - [131, 0.37]
  - - [1, 6784, 1, 256, 1, 1, 256, 256]
    - [239, 141.0]
  - - [1, 6784, 1, 1, 1, 1, 1, 1]
    - [122, 2.0]
  - - [1, 4288, 1, 3328, 1, 1, 3328, 3328]
    - [136, 194.0]
  - - [1, 2368, 1, 3328, 1, 1, 3328, 3328]
    - [188, 180.0]
  - - [1, 5888, 1, 1280, 1, 1, 1280, 1280]
    - [239, 189.0]
  - - [1, 2944, 1, 256, 1, 1, 256, 256]
    - [235, 101.0]
  - - [1, 6784, 1, 1280, 1, 1, 1280, 1280]
    - [242, 187.0]
  - - [1, 5056, 1, 1, 1, 1, 1, 1]
    - [122, 1.0]
  - - [32, 1856, 1, 32, 32, 32, 32, 32]
    - [174, 503.0]
  - - [32, 1408, 1, 256, 32, 32, 256, 256]
    - [236, 1648.0]
  - - [1, 5888, 1, 1, 1, 1, 1, 1]
    - [122, 1.0]
  - - [1, 2944, 1, 3328, 1, 1, 3328, 3328]
    - [234, 216.0]
  - - [1, 3584, 1, 1, 1, 1, 1, 1]
    - [122, 1.0]
  - - [1, 1408, 1, 256, 1, 1, 256, 256]
    - [128, 58.0]
  - - [1, 1856, 1, 1, 1, 1, 1, 1]
    - [124, 0.47]
  - - [1, 5056, 1, 1280, 1, 1, 1280, 1280]
    - [242, 198.0]
  - - [1, 5888, 1, 256, 1, 1, 256, 256]
    - [242, 141.0]
  - - [32, 1856, 1, 1280, 32, 32, 1280, 1280]
    - [237, 3358.0]
  - - [1, 2368, 1, 1, 1, 1, 1, 1]
    - [122, 1.0]
  - - [1, 1408, 1, 1280, 1, 1, 1280, 1280]
    - [167, 127.0]
  - - [1, 5056, 1, 256, 1, 1, 256, 256]
    - [235, 137.0]
  - - [1, 3584, 1, 1280, 1, 1, 1280, 1280]
    - [242, 186.0]
  - - [1, 4288, 1, 256, 1, 1, 256, 256]
    - [235, 125.0]
  - - [1, 4288, 1, 1, 1, 1, 1, 1]
    - [122, 1.0]
  - - [1, 2944, 1, 1, 1, 1, 1, 1]
    - [122, 1.0]
  - - [32, 1408, 1, 3328, 32, 32, 3328, 3328]
    - [241, 3203.0]
  - - [1, 5056, 1, 3328, 1, 1, 3328, 3328]
    - [235, 216.0]
  - - [32, 1856, 1, 256, 32, 32, 256, 256]
    - [241, 2077.0]
  - - [1, 1856, 1, 1280, 1, 1, 1280, 1280]
    - [136, 146.0]
  - - [1, 3584, 1, 256, 1, 1, 256, 256]
    - [235, 116.0]
  - - [32, 1408, 1, 1280, 32, 32, 1280, 1280]
    - [180, 3145.0]
  - - [2, 2048, 1, 1024, 2, 2, 1024, 1024]
    - [167, 269.0]
  - - [32, 1600, 1, 512, 32, 32, 512, 512]
    - [167, 2632.0]
  - - [1, 4096, 1, 256, 1, 1, 256, 256]
    - [194, 133.0]
  - - [1, 6912, 1, 256, 1, 1, 256, 256]
    - [239, 145.0]
  - - [2, 2048, 1, 768, 2, 2, 768, 768]
    - [136, 257.0]
  - - [2, 4608, 1, 768, 2, 2, 768, 768]
    - [235, 341.0]
  - - [2, 4608, 1, 1024, 2, 2, 1024, 1024]
    - [142, 325.0]
  - - [512, 16, 1, 500000, 512, 512, 500000, 500000]
    - [202, 2456.0]
  - - [1024, 8, 1, 500000, 1024, 1024, 500000, 500000]
    - [213, 1425.0]
  - - [1024, 16, 1, 500000, 1024, 1024, 500000, 500000]
    - [204, 2669.0]
  - - [512, 8, 1, 500000, 512, 512, 500000, 500000]
    - [217, 1231.0]
  - - [147, 64, 1, 12544, 147, 147, 12544, 12544]
    - [199, 2551.0]
  - - [256, 128, 1, 10752, 256, 256, 10752, 10752]
    - [200, 3617.0]
  - - [256, 128, 1, 10560, 256, 256, 10560, 10560]
    - [214, 4921.0]
  - - [256, 128, 1, 11408, 256, 256, 11408, 11408]
    - [211, 4658.0]
  - - [256, 12, 1, 11408, 256, 256, 11408, 11408]
    - [209, 999.0]
  - - [256, 128, 1, 11616, 256, 256, 11616, 11616]
    - [207, 4760.0]
  - - [256, 12, 1, 11616, 256, 256, 11616, 11616]
    - [202, 1002.0]
  - - [256, 12, 1, 12288, 256, 256, 12288, 12288]
    - [220, 1000.0]
  - - [576, 64, 1, 5625, 576, 576, 5625, 5625]
    - [214, 4484.0]
  - - [147, 64, 1, 22500, 147, 147, 22500, 22500]
    - [203, 2859.0]
  - - [11, 11, 1, 1909283, 11, 11, 1909283, 1909283]
    - [205, 41.0]
  - - [11, 11, 1, 3818566, 11, 11, 3818566, 3818566]
    - [221, 53.0]
  - - [448, 1, 1, 256, 448, 448, 256, 256]
    - [138, 27.0]
  - - [704, 64, 1, 3328, 704, 704, 3328, 3328]
    - [181, 3476.0]
  - - [256, 128, 1, 256, 256, 256, 256, 256]
    - [136, 2280.0]
  - - [448, 64, 1, 1, 448, 448, 1, 1]
    - [122, 7.0]
  - - [64, 1024, 1, 1280, 64, 64, 1280, 1280]
    - [177, 3591.0]
  - - [1024, 1, 1, 3328, 1024, 1024, 3328, 3328]
    - [128, 118.0]
  - - [1024, 64, 1, 1280, 1024, 1024, 1280, 1280]
    - [143, 3644.0]
  - - [448, 128, 1, 256, 448, 448, 256, 256]
    - [139, 2549.0]
  - - [1, 1024, 1, 3328, 1, 1, 3328, 3328]
    - [128, 128.0]
  - - [704, 64, 1, 32, 704, 704, 32, 32]
    - [130, 364.0]
  - - [32, 448, 1, 3328, 32, 32, 3328, 3328]
    - [180, 1878.0]
  - - [448, 1, 1, 1, 448, 448, 1, 1]
    - [124, 0.12]
  - - [64, 128, 1, 3328, 64, 64, 3328, 3328]
    - [155, 1206.0]
  - - [64, 128, 1, 1, 64, 64, 1, 1]
    - [122, 5.0]
  - - [256, 128, 1, 1, 256, 256, 1, 1]
    - [135, 18.0]
  - - [256, 32, 1, 3328, 256, 256, 3328, 3328]
    - [142, 1194.0]
  - - [1, 1, 1, 3328, 1, 1, 3328, 3328]
    - [132, 0.15]
  - - [32, 448, 1, 1280, 32, 32, 1280, 1280]
    - [180, 1487.0]
  - - [32, 448, 1, 32, 32, 32, 32, 32]
    - [124, 114.0]
  - - [64, 1024, 1, 32, 64, 64, 32, 32]
    - [176, 524.0]
  - - [128, 1, 1, 1, 128, 128, 1, 1]
    - [122, 0.03]
  - - [1024, 32, 1, 3328, 1024, 1024, 3328, 3328]
    - [155, 2991.0]
  - - [448, 1, 1, 1280, 448, 448, 1280, 1280]
    - [155, 49.0]
  - - [64, 64, 1, 1280, 64, 64, 1280, 1280]
    - [167, 474.0]
  - - [448, 128, 1, 3328, 448, 448, 3328, 3328]
    - [150, 3890.0]
  - - [128, 256, 1, 1280, 128, 128, 1280, 1280]
    - [188, 2602.0]
  - - [256, 256, 1, 32, 256, 256, 32, 32]
    - [179, 962.0]
  - - [1024, 1, 1, 256, 1024, 1024, 256, 256]
    - [163, 45.0]
  - - [128, 32, 1, 32, 128, 128, 32, 32]
    - [190, 34.0]
  - - [448, 64, 1, 256, 448, 448, 256, 256]
    - [163, 1188.0]
  - - [128, 256, 1, 3328, 128, 128, 3328, 3328]
    - [188, 3121.0]
  - - [1, 64, 1, 3328, 1, 1, 3328, 3328]
    - [128, 9.0]
  - - [64, 1024, 1, 1, 64, 64, 1, 1]
    - [165, 17.0]
  - - [64, 1024, 1, 3328, 64, 64, 3328, 3328]
    - [125, 4009.0]
  - - [32, 704, 1, 3328, 32, 32, 3328, 3328]
    - [194, 2764.0]
  - - [32, 1024, 1, 3328, 32, 32, 3328, 3328]
    - [194, 3086.0]
  - - [64, 1, 1, 256, 64, 64, 256, 256]
    - [122, 3.0]
  - - [1024, 64, 1, 32, 1024, 1024, 32, 32]
    - [151, 507.0]
  - - [1024, 64, 1, 3328, 1024, 1024, 3328, 3328]
    - [143, 4077.0]
  - - [32, 1024, 1, 256, 32, 32, 256, 256]
    - [142, 1362.0]
  - - [64, 1, 1, 1, 64, 64, 1, 1]
    - [124, 0.02]
  - - [256, 1, 1, 256, 256, 256, 256, 256]
    - [122, 11.0]
  - - [256, 128, 1, 3328, 256, 256, 3328, 3328]
    - [126, 3009.0]
  - - [64, 64, 1, 1, 64, 64, 1, 1]
    - [122, 1.0]
  - - [32, 704, 1, 1280, 32, 32, 1280, 1280]
    - [180, 2168.0]
  - - [256, 1, 1, 1280, 256, 256, 1280, 1280]
    - [167, 29.0]
  - - [128, 32, 1, 1280, 128, 128, 1280, 1280]
    - [167, 485.0]
  - - [128, 256, 1, 1, 128, 128, 1, 1]
    - [122, 8.0]
  - - [1, 256, 1, 256, 1, 1, 256, 256]
    - [176, 12.0]
  - - [1, 256, 1, 1, 1, 1, 1, 1]
    - [122, 0.06]
  - - [1024, 1, 1, 1280, 1024, 1024, 1280, 1280]
    - [155, 94.0]
  - - [64, 448, 1, 256, 64, 64, 256, 256]
    - [136, 1232.0]
  - - [1024, 32, 1, 1280, 1024, 1024, 1280, 1280]
    - [140, 2413.0]
  - - [256, 256, 1, 3328, 256, 256, 3328, 3328]
    - [123, 4228.0]
  - - [704, 32, 1, 1280, 704, 704, 1280, 1280]
    - [180, 2028.0]
  - - [64, 64, 1, 3328, 64, 64, 3328, 3328]
    - [142, 607.0]
  - - [32, 32, 1, 32, 32, 32, 32, 32]
    - [140, 9.0]
  - - [1024, 32, 1, 32, 1024, 1024, 32, 32]
    - [192, 262.0]
  - - [128, 64, 1, 32, 128, 128, 32, 32]
    - [192, 69.0]
  - - [64, 1, 1, 1280, 64, 64, 1280, 1280]
    - [128, 7.0]
  - - [448, 32, 1, 1280, 448, 448, 1280, 1280]
    - [128, 1537.0]
  - - [704, 32, 1, 3328, 704, 704, 3328, 3328]
    - [128, 2398.0]
  - - [128, 128, 1, 256, 128, 128, 256, 256]
    - [132, 1033.0]
  - - [64, 448, 1, 1280, 64, 64, 1280, 1280]
    - [188, 2463.0]
  - - [64, 256, 1, 1, 64, 64, 1, 1]
    - [122, 4.0]
  - - [256, 256, 1, 256, 256, 256, 256, 256]
    - [162, 2273.0]
  - - [448, 1, 1, 3328, 448, 448, 3328, 3328]
    - [128, 62.0]
  - - [256, 1, 1, 1, 256, 256, 1, 1]
    - [187, 0.14]
  - - [32, 1024, 1, 1280, 32, 32, 1280, 1280]
    - [188, 2542.0]
  - - [1, 256, 1, 3328, 1, 1, 3328, 3328]
    - [155, 42.0]
  - - [256, 32, 1, 256, 256, 256, 256, 256]
    - [128, 699.0]
  - - [256, 128, 1, 1280, 256, 256, 1280, 1280]
    - [188, 2605.0]
  - - [256, 64, 1, 256, 256, 256, 256, 256]
    - [169, 1172.0]
  - - [1, 1, 1, 1, 1, 1, 1, 1]
    - [149, 0.0005882352863190291]
  - - [32, 1024, 1, 32, 32, 32, 32, 32]
    - [183, 350.0]
  - - [128, 256, 1, 256, 128, 128, 256, 256]
    - [140, 1366.0]
  - - [704, 64, 1, 256, 704, 704, 256, 256]
    - [170, 1711.0]
  - - [704, 1, 1, 1, 704, 704, 1, 1]
    - [184, 0.18]
  - - [128, 448, 1, 1280, 128, 128, 1280, 1280]
    - [126, 3424.0]
  - - [448, 32, 1, 32, 448, 448, 32, 32]
    - [176, 270.0]
  - - [704, 64, 1, 1, 704, 704, 1, 1]
    - [126, 29.0]
  - - [704, 32, 1, 256, 704, 704, 256, 256]
    - [142, 1567.0]
  - - [32, 704, 1, 32, 32, 32, 32, 32]
    - [130, 419.0]
  - - [128, 64, 1, 256, 128, 128, 256, 256]
    - [155, 377.0]
  - - [448, 32, 1, 3328, 448, 448, 3328, 3328]
    - [128, 1986.0]
  - - [64, 704, 1, 32, 64, 64, 32, 32]
    - [124, 355.0]
  - - [64, 704, 1, 3328, 64, 64, 3328, 3328]
    - [181, 3547.0]
  - - [448, 64, 1, 1280, 448, 448, 1280, 1280]
    - [167, 2473.0]
  - - [128, 448, 1, 32, 128, 128, 32, 32]
    - [122, 1019.0]
  - - [64, 256, 1, 256, 64, 64, 256, 256]
    - [138, 783.0]
  - - [64, 704, 1, 1, 64, 64, 1, 1]
    - [133, 23.0]
  - - [1, 1024, 1, 1, 1, 1, 1, 1]
    - [124, 0.25]
  - - [256, 1, 1, 3328, 256, 256, 3328, 3328]
    - [132, 39.0]
  - - [32, 64, 1, 32, 32, 32, 32, 32]
    - [148, 35.0]
  - - [256, 256, 1, 1, 256, 256, 1, 1]
    - [124, 17.0]
  - - [32, 256, 1, 32, 32, 32, 32, 32]
    - [176, 67.0]
  - - [128, 1, 1, 256, 128, 128, 256, 256]
    - [128, 6.0]
  - - [32, 64, 1, 3328, 32, 32, 3328, 3328]
    - [146, 303.0]
  - - [1, 128, 1, 3328, 1, 1, 3328, 3328]
    - [128, 19.0]
  - - [32, 256, 1, 256, 32, 32, 256, 256]
    - [142, 413.0]
  - - [1, 448, 1, 1, 1, 1, 1, 1]
    - [192, 0.12]
  - - [1, 704, 1, 3328, 1, 1, 3328, 3328]
    - [180, 88.0]
  - - [64, 1, 1, 3328, 64, 64, 3328, 3328]
    - [132, 10.0]
  - - [448, 64, 1, 3328, 448, 448, 3328, 3328]
    - [157, 2756.0]
  - - [256, 32, 1, 1280, 256, 256, 1280, 1280]
    - [128, 921.0]
  - - [128, 448, 1, 3328, 128, 128, 3328, 3328]
    - [153, 3903.0]
  - - [64, 1024, 1, 256, 64, 64, 256, 256]
    - [189, 2162.0]
  - - [64, 32, 1, 32, 64, 64, 32, 32]
    - [173, 34.0]
  - - [1, 448, 1, 3328, 1, 1, 3328, 3328]
    - [186, 64.0]
  - - [1024, 64, 1, 256, 1024, 1024, 256, 256]
    - [137, 2076.0]
  - - [64, 704, 1, 1280, 64, 64, 1280, 1280]
    - [188, 3061.0]
  - - [64, 32, 1, 3328, 64, 64, 3328, 3328]
    - [167, 305.0]
  - - [64, 448, 1, 1, 64, 64, 1, 1]
    - [124, 8.0]
  - - [128, 128, 1, 1280, 128, 128, 1280, 1280]
    - [167, 1789.0]
  - - [64, 128, 1, 256, 64, 64, 256, 256]
    - [163, 396.0]
  - - [64, 448, 1, 32, 64, 64, 32, 32]
    - [188, 240.0]
  - - [128, 64, 1, 3328, 128, 128, 3328, 3328]
    - [194, 1225.0]
  - - [32, 64, 1, 1280, 32, 32, 1280, 1280]
    - [155, 240.0]
  - - [448, 32, 1, 256, 448, 448, 256, 256]
    - [128, 670.0]
  - - [1024, 32, 1, 256, 1024, 1024, 256, 256]
    - [178, 1340.0]
  - - [1, 128, 1, 256, 1, 1, 256, 256]
    - [122, 6.0]
  - - [32, 256, 1, 1280, 32, 32, 1280, 1280]
    - [194, 931.0]
  - - [32, 128, 1, 3328, 32, 32, 3328, 3328]
    - [146, 613.0]
  - - [32, 128, 1, 32, 32, 32, 32, 32]
    - [165, 74.0]
  - - [1, 128, 1, 1, 1, 1, 1, 1]
    - [126, 0.04]
  - - [128, 64, 1, 1, 128, 128, 1, 1]
    - [122, 2.0]
  - - [32, 448, 1, 256, 32, 32, 256, 256]
    - [158, 1037.0]
  - - [1, 704, 1, 256, 1, 1, 256, 256]
    - [149, 51.0]
  - - [32, 256, 1, 3328, 32, 32, 3328, 3328]
    - [167, 1343.0]
  - - [256, 32, 1, 32, 256, 256, 32, 32]
    - [151, 154.0]
  - - [64, 256, 1, 3328, 64, 64, 3328, 3328]
    - [180, 2199.0]
  - - [1, 704, 1, 1, 1, 1, 1, 1]
    - [184, 0.43]
  - - [128, 448, 1, 1, 128, 128, 1, 1]
    - [165, 36.0]
  - - [64, 128, 1, 32, 64, 64, 32, 32]
    - [174, 158.0]
  - - [704, 1, 1, 1280, 704, 704, 1280, 1280]
    - [128, 84.0]
  - - [1024, 1, 1, 1, 1024, 1024, 1, 1]
    - [130, 1.0]
  - - [256, 128, 1, 32, 256, 256, 32, 32]
    - [187, 558.0]
  - - [448, 128, 1, 1, 448, 448, 1, 1]
    - [139, 15.0]
  - - [704, 32, 1, 32, 704, 704, 32, 32]
    - [163, 179.0]
  - - [128, 32, 1, 256, 128, 128, 256, 256]
    - [124, 193.0]
  - - [64, 32, 1, 1280, 64, 64, 1280, 1280]
    - [167, 236.0]
  - - [448, 128, 1, 32, 448, 448, 32, 32]
    - [149, 448.0]
  - - [128, 448, 1, 256, 128, 128, 256, 256]
    - [140, 2073.0]
  - - [32, 32, 1, 256, 32, 32, 256, 256]
    - [176, 77.0]
  - - [256, 64, 1, 32, 256, 256, 32, 32]
    - [153, 305.0]
  - - [1, 1024, 1, 1280, 1, 1, 1280, 1280]
    - [128, 124.0]
  - - [32, 32, 1, 3328, 32, 32, 3328, 3328]
    - [146, 169.0]
  - - [1, 256, 1, 1280, 1, 1, 1280, 1280]
    - [142, 29.0]
  - - [1, 128, 1, 1280, 1, 1, 1280, 1280]
    - [128, 14.0]
  - - [1, 64, 1, 256, 1, 1, 256, 256]
    - [122, 3.0]
  - - [256, 64, 1, 1280, 256, 256, 1280, 1280]
    - [142, 1796.0]
  - - [32, 704, 1, 256, 32, 32, 256, 256]
    - [155, 942.0]
  - - [1, 64, 1, 1, 1, 1, 1, 1]
    - [126, 0.02]
  - - [704, 64, 1, 1280, 704, 704, 1280, 1280]
    - [195, 2892.0]
  - - [1, 704, 1, 1280, 1, 1, 1280, 1280]
    - [180, 72.0]
  - - [128, 128, 1, 32, 128, 128, 32, 32]
    - [124, 129.0]
  - - [1024, 64, 1, 1, 1024, 1024, 1, 1]
    - [195, 34.0]
  - - [704, 1, 1, 256, 704, 704, 256, 256]
    - [142, 31.0]
  - - [128, 64, 1, 1280, 128, 128, 1280, 1280]
    - [142, 950.0]
  - - [64, 64, 1, 32, 64, 64, 32, 32]
    - [122, 33.0]
  - - [1, 1, 1, 1280, 1, 1, 1280, 1280]
    - [128, 0.11]
  - - [64, 704, 1, 256, 64, 64, 256, 256]
    - [161, 1686.0]
  - - [1, 448, 1, 1280, 1, 1, 1280, 1280]
    - [128, 49.0]
  - - [64, 256, 1, 32, 64, 64, 32, 32]
    - [130, 132.0]
  - - [32, 128, 1, 1280, 32, 32, 1280, 1280]
    - [186, 574.0]
  - - [128, 128, 1, 3328, 128, 128, 3328, 3328]
    - [155, 2185.0]
  - - [64, 448, 1, 3328, 64, 64, 3328, 3328]
    - [155, 2943.0]
  - - [32, 64, 1, 256, 32, 32, 256, 256]
    - [122, 157.0]
  - - [128, 256, 1, 32, 128, 128, 32, 32]
    - [138, 257.0]
  - - [64, 256, 1, 1280, 64, 64, 1280, 1280]
    - [167, 1713.0]
  - - [64, 64, 1, 256, 64, 64, 256, 256]
    - [194, 193.0]
  - - [448, 64, 1, 32, 448, 448, 32, 32]
    - [146, 229.0]
  - - [64, 128, 1, 1280, 64, 64, 1280, 1280]
    - [167, 946.0]
  - - [1, 1024, 1, 256, 1, 1, 256, 256]
    - [128, 43.0]
  - - [128, 1, 1, 3328, 128, 128, 3328, 3328]
    - [128, 19.0]
  - - [128, 128, 1, 1, 128, 128, 1, 1]
    - [122, 4.0]
  - - [32, 128, 1, 256, 32, 32, 256, 256]
    - [142, 195.0]
  - - [1, 64, 1, 1280, 1, 1, 1280, 1280]
    - [128, 7.0]
  - - [448, 128, 1, 1280, 448, 448, 1280, 1280]
    - [140, 3411.0]
  - - [256, 64, 1, 1, 256, 256, 1, 1]
    - [130, 10.0]
  - - [256, 256, 1, 1280, 256, 256, 1280, 1280]
    - [195, 4018.0]
  - - [704, 1, 1, 3328, 704, 704, 3328, 3328]
    - [186, 95.0]
  - - [128, 32, 1, 3328, 128, 128, 3328, 3328]
    - [180, 673.0]
  - - [32, 32, 1, 1280, 32, 32, 1280, 1280]
    - [194, 150.0]
  - - [1, 1, 1, 256, 1, 1, 256, 256]
    - [194, 0.09]
  - - [1, 448, 1, 256, 1, 1, 256, 256]
    - [128, 34.0]
  - - [256, 64, 1, 3328, 256, 256, 3328, 3328]
    - [142, 2322.0]
  - - [64, 32, 1, 256, 64, 64, 256, 256]
    - [128, 168.0]
  - - [128, 1, 1, 1280, 128, 128, 1280, 1280]
    - [186, 15.0]
  - - [512, 128, 1, 784, 512, 512, 784, 784]
    - [123, 3524.0]
  - - [256, 64, 1, 3136, 256, 256, 3136, 3136]
    - [128, 2130.0]
  - - [64, 256, 1, 3136, 64, 64, 3136, 3136]
    - [194, 2190.0]
  - - [128, 512, 1, 784, 128, 128, 784, 784]
    - [150, 3430.0]
  - - [64, 64, 1, 3136, 64, 64, 3136, 3136]
    - [180, 602.0]
  - - [14, 14, 1, 64, 14, 14, 64, 64]
    - [122, 3.0]
  - - [15, 14, 1, 64, 15, 15, 64, 64]
    - [122, 3.0]
  - - [15, 15, 1, 64, 15, 15, 64, 64]
    - [122, 3.0]
  - - [17, 15, 1, 64, 17, 17, 64, 64]
    - [137, 5.0]
  - - [17, 17, 1, 64, 17, 17, 64, 64]
    - [172, 7.0]
  - - [21, 17, 1, 64, 21, 21, 64, 64]
    - [196, 9.0]
  - - [21, 21, 1, 64, 21, 21, 64, 64]
    - [185, 7.0]
  - - [24, 24, 1, 64, 24, 24, 64, 64]
    - [184, 15.0]
  - - [30, 30, 1, 64, 30, 30, 64, 64]
    - [151, 13.0]
  - - [30, 31, 1, 64, 30, 30, 64, 64]
    - [122, 13.0]
  - - [31, 31, 1, 64, 31, 31, 64, 64]
    - [170, 16.0]
  - - [32, 32, 1, 64, 32, 32, 64, 64]
    - [140, 16.0]
  - - [32, 35, 1, 64, 32, 32, 64, 64]
    - [136, 17.0]
  - - [34, 24, 1, 64, 34, 34, 64, 64]
    - [122, 25.0]
  - - [34, 34, 1, 64, 34, 34, 64, 64]
    - [149, 17.0]
  - - [35, 35, 1, 64, 35, 35, 64, 64]
    - [122, 17.0]
  - - [27, 27, 1, 64, 27, 27, 64, 64]
    - [174, 11.0]
  - - [27, 33, 1, 64, 27, 27, 64, 64]
    - [138, 13.0]
  - - [33, 33, 1, 64, 33, 33, 64, 64]
    - [136, 16.0]
  - - [2, 4, 1, 1024, 2, 2, 1024, 1024]
    - [122, 1.0]
  - - [2, 32, 1, 1024, 2, 2, 1024, 1024]
    - [180, 7.0]
  - - [64, 512, 1, 512, 64, 64, 512, 512]
    - [161, 1885.0]
  - - [1024, 4, 1, 1024, 1024, 1024, 1024, 1024]
    - [142, 365.0]
  - - [1024, 32, 1, 1024, 1024, 1024, 1024, 1024]
    - [142, 2482.0]
  - - [3, 3, 512, 64, 3, 3, 64, 64]
    - [122, 52.0]
  - - [5, 5, 512, 64, 5, 5, 64, 64]
    - [122, 143.0]
  - - [5, 5, 960, 64, 5, 5, 64, 64]
    - [161, 221.0]
  - - [9, 9, 512, 64, 9, 9, 64, 64]
    - [142, 417.0]
  - - [27, 27, 32768, 128, 27, 27, 128, 128]
    - [181, 3493.0]
  - - [64, 512, 1, 1024, 64, 64, 1024, 1024]
    - [161, 2954.0]
  - - [64, 960, 1, 1024, 64, 64, 1024, 1024]
    - [140, 3860.0]
  - - [14, 14, 10880, 64, 14, 14, 64, 64]
    - [128, 2821.0]
  - - [15, 14, 10880, 64, 15, 15, 64, 64]
    - [155, 2973.0]
  - - [15, 15, 7680, 64, 15, 15, 64, 64]
    - [128, 2783.0]
  - - [15, 15, 10880, 64, 15, 15, 64, 64]
    - [194, 2858.0]
  - - [17, 15, 7680, 64, 17, 17, 64, 64]
    - [151, 2054.0]
  - - [17, 17, 7680, 64, 17, 17, 64, 64]
    - [137, 1889.0]
  - - [21, 17, 6144, 64, 21, 21, 64, 64]
    - [175, 2082.0]
  - - [21, 21, 6144, 64, 21, 21, 64, 64]
    - [195, 2456.0]
  - - [24, 24, 4736, 64, 24, 24, 64, 64]
    - [195, 2750.0]
  - - [30, 30, 2048, 64, 30, 30, 64, 64]
    - [194, 3017.0]
  - - [30, 31, 2048, 64, 30, 30, 64, 64]
    - [178, 3390.0]
  - - [31, 31, 2048, 64, 31, 31, 64, 64]
    - [153, 3322.0]
  - - [34, 24, 4736, 64, 34, 34, 64, 64]
    - [181, 2520.0]
  - - [27, 27, 1920, 64, 27, 27, 64, 64]
    - [181, 2765.0]
  - - [27, 33, 1920, 64, 27, 27, 64, 64]
    - [150, 2583.0]
  - - [2, 8, 1, 1024, 2, 2, 1024, 1024]
    - [128, 2.0]
  - - [1024, 77, 1, 1024, 1024, 1024, 1024, 1024]
    - [189, 3507.0]
  - - [2, 10, 1, 1024, 2, 2, 1024, 1024]
    - [122, 2.0]
  - - [1024, 10, 1, 1024, 1024, 1024, 1024, 1024]
    - [167, 909.0]
  - - [2, 39, 1, 1024, 2, 2, 1024, 1024]
    - [128, 8.0]
  - - [1024, 39, 1, 1024, 1024, 1024, 1024, 1024]
    - [161, 2383.0]
  - - [2, 40, 1, 1024, 2, 2, 1024, 1024]
    - [128, 8.0]
  - - [1024, 40, 1, 1024, 1024, 1024, 1024, 1024]
    - [163, 2467.0]
  - - [2, 41, 1, 1024, 2, 2, 1024, 1024]
    - [122, 8.0]
  - - [1024, 41, 1, 1024, 1024, 1024, 1024, 1024]
    - [190, 2505.0]
  - - [2, 5, 1, 1024, 2, 2, 1024, 1024]
    - [122, 1.0]
  - - [1024, 5, 1, 1024, 1024, 1024, 1024, 1024]
    - [167, 460.0]
  - - [2, 6, 1, 1024, 2, 2, 1024, 1024]
    - [122, 1.0]
  - - [1024, 6, 1, 1024, 1024, 1024, 1024, 1024]
    - [194, 546.0]
  - - [1024, 8, 1, 1024, 1024, 1024, 1024, 1024]
    - [122, 703.0]
  - - [2, 9, 1, 1024, 2, 2, 1024, 1024]
    - [122, 2.0]
  - - [1024, 9, 1, 1024, 1024, 1024, 1024, 1024]
    - [194, 785.0]
  - - [4, 4, 32768, 64, 4, 4, 64, 64]
    - [188, 317.0]
  - - [4, 4, 38400, 64, 4, 4, 64, 64]
    - [161, 318.0]
  - - [17, 17, 6144, 64, 17, 17, 64, 64]
    - [175, 1806.0]
  - - [128, 128, 1, 64, 128, 128, 64, 64]
    - [136, 265.0]
  - - [64, 128, 1, 128, 64, 64, 128, 128]
    - [174, 232.0]
  - - [2, 1024, 1, 1024, 2, 2, 1024, 1024]
    - [142, 193.0]
  - - [5, 5, 1, 64, 5, 5, 64, 64]
    - [161, 0.37]
  - - [33, 33, 1, 32, 33, 33, 32, 32]
    - [122, 8.0]
  - - [1024, 16, 1, 1024, 1024, 1024, 1024, 1024]
    - [194, 1459.0]
  - - [2, 4, 1, 2560, 2, 2, 2560, 2560]
    - [122, 1.0]
  - - [2, 16, 1, 1024, 2, 2, 1024, 1024]
    - [122, 3.0]
  - - [2, 2, 1, 2048, 2, 2, 2048, 2048]
    - [128, 1.0]
  - - [1024, 1, 1, 1024, 1024, 1024, 1024, 1024]
    - [167, 93.0]
  - - [512, 1, 1, 2048, 512, 512, 2048, 2048]
    - [142, 66.0]
  - - [200, 1, 1, 1024, 200, 200, 1024, 1024]
    - [142, 21.0]
  - - [960, 1, 1, 2048, 960, 960, 2048, 2048]
    - [194, 103.0]
  - - [1024, 64, 1, 1024, 1024, 1024, 1024, 1024]
    - [141, 3303.0]
  - - [864, 1, 1, 256, 864, 864, 256, 256]
    - [167, 37.0]
  - - [1024, 80, 1, 1024, 1024, 1024, 1024, 1024]
    - [162, 3594.0]
  - - [1024, 82, 1, 1024, 1024, 1024, 1024, 1024]
    - [195, 3650.0]
  - - [1024, 12, 1, 1024, 1024, 1024, 1024, 1024]
    - [142, 1098.0]
  - - [2, 64, 1, 1024, 2, 2, 1024, 1024]
    - [128, 13.0]
  - - [2, 80, 1, 1024, 2, 2, 1024, 1024]
    - [128, 16.0]
  - - [2, 82, 1, 1024, 2, 2, 1024, 1024]
    - [167, 17.0]
  - - [2, 12, 1, 1024, 2, 2, 1024, 1024]
    - [194, 3.0]
  - - [2, 1, 1, 1024, 2, 2, 1024, 1024]
    - [128, 0.2]
  - - [24, 24, 6816, 64, 24, 24, 64, 64]
    - [156, 3020.0]
  - - [256, 128, 1, 3136, 256, 256, 3136, 3136]
    - [174, 3553.0]
  - - [576, 64, 1, 3136, 576, 576, 3136, 3136]
    - [122, 3400.0]
  - - [768, 16, 1, 768, 768, 768, 768, 768]
    - [180, 1004.0]
  - - [768, 12, 1, 768, 768, 768, 768, 768]
    - [180, 743.0]
  - - [768, 4, 1, 768, 768, 768, 768, 768]
    - [128, 245.0]
  - - [64, 1024, 1, 1024, 64, 64, 1024, 1024]
    - [189, 3577.0]
  - - [26, 26, 6272, 64, 26, 26, 64, 64]
    - [195, 3113.0]
  - - [2, 128, 1, 1024, 2, 2, 1024, 1024]
    - [128, 27.0]
  - - [2, 96, 1, 1024, 2, 2, 1024, 1024]
    - [128, 20.0]
  - - [256, 80, 1, 784, 256, 256, 784, 784]
    - [194, 1538.0]
  - - [256, 12, 1, 3800, 256, 256, 3800, 3800]
    - [171, 453.0]
  - - [256, 3, 1, 3800, 256, 256, 3800, 3800]
    - [146, 115.0]
  - - [256, 12, 1, 950, 256, 256, 950, 950]
    - [134, 308.0]
  - - [256, 3, 1, 950, 256, 256, 950, 950]
    - [160, 77.0]
  - - [256, 12, 1, 3220, 256, 256, 3220, 3220]
    - [171, 443.0]
  - - [256, 3, 1, 3220, 256, 256, 3220, 3220]
    - [146, 123.0]
  - - [256, 12, 1, 3072, 256, 256, 3072, 3072]
    - [197, 458.0]
  - - [256, 3, 1, 3072, 256, 256, 3072, 3072]
    - [132, 112.0]
  - - [256, 12, 1, 850, 256, 256, 850, 850]
    - [186, 273.0]
  - - [256, 3, 1, 850, 256, 256, 850, 850]
    - [159, 68.0]
  - - [256, 12, 1, 2852, 256, 256, 2852, 2852]
    - [171, 432.0]
  - - [256, 3, 1, 2852, 256, 256, 2852, 2852]
    - [146, 109.0]
  - - [256, 12, 1, 805, 256, 256, 805, 805]
    - [132, 263.0]
  - - [256, 3, 1, 805, 256, 256, 805, 805]
    - [159, 67.0]
  - - [256, 3, 1, 864, 256, 256, 864, 864]
    - [132, 71.0]
  - - [256, 3, 1, 768, 256, 256, 768, 768]
    - [142, 68.0]
  - - [256, 12, 1, 864, 256, 256, 864, 864]
    - [171, 282.0]
  - - [256, 12, 1, 768, 256, 256, 768, 768]
    - [167, 271.0]
  - - [256, 12, 1, 2904, 256, 256, 2904, 2904]
    - [197, 426.0]
  - - [256, 3, 1, 2904, 256, 256, 2904, 2904]
    - [132, 107.0]
  - - [256, 3, 1, 713, 256, 256, 713, 713]
    - [132, 61.0]
  - - [256, 12, 1, 888, 256, 256, 888, 888]
    - [197, 274.0]
  - - [256, 3, 1, 888, 256, 256, 888, 888]
    - [186, 70.0]
  - - [256, 12, 1, 713, 256, 256, 713, 713]
    - [186, 247.0]
  - - [256, 3, 1, 660, 256, 256, 660, 660]
    - [132, 59.0]
  - - [256, 3, 1, 672, 256, 256, 672, 672]
    - [196, 75.0]
  - - [256, 12, 1, 660, 256, 256, 660, 660]
    - [197, 240.0]
  - - [256, 3, 1, 726, 256, 256, 726, 726]
    - [132, 62.0]
  - - [256, 12, 1, 672, 256, 256, 672, 672]
    - [146, 249.0]
  - - [256, 3, 1, 247, 256, 256, 247, 247]
    - [194, 31.0]
  - - [256, 12, 1, 726, 256, 256, 726, 726]
    - [186, 246.0]
  - - [256, 3, 1, 216, 256, 256, 216, 216]
    - [128, 28.0]
  - - [256, 3, 1, 3400, 256, 256, 3400, 3400]
    - [197, 113.0]
  - - [256, 3, 1, 221, 256, 256, 221, 221]
    - [132, 29.0]
  - - [256, 12, 1, 3552, 256, 256, 3552, 3552]
    - [197, 451.0]
  - - [256, 3, 1, 3456, 256, 256, 3456, 3456]
    - [197, 116.0]
  - - [256, 3, 1, 204, 256, 256, 204, 204]
    - [194, 28.0]
  - - [256, 12, 1, 3400, 256, 256, 3400, 3400]
    - [146, 448.0]
  - - [256, 12, 1, 3456, 256, 256, 3456, 3456]
    - [159, 459.0]
  - - [256, 12, 1, 221, 256, 256, 221, 221]
    - [180, 114.0]
  - - [256, 3, 1, 3552, 256, 256, 3552, 3552]
    - [146, 115.0]
  - - [256, 3, 1, 228, 256, 256, 228, 228]
    - [186, 31.0]
  - - [256, 3, 1, 234, 256, 256, 234, 234]
    - [142, 30.0]
  - - [256, 12, 1, 234, 256, 256, 234, 234]
    - [122, 174.0]
  - - [256, 12, 1, 228, 256, 256, 228, 228]
    - [128, 118.0]
  - - [256, 3, 1, 252, 256, 256, 252, 252]
    - [130, 32.0]
  - - [256, 12, 1, 252, 256, 256, 252, 252]
    - [184, 127.0]
  - - [256, 12, 1, 247, 256, 256, 247, 247]
    - [155, 124.0]
  - - [128, 256, 1, 1444, 128, 128, 1444, 1444]
    - [155, 2701.0]
  - - [256, 128, 1, 25, 256, 256, 25, 25]
    - [124, 194.0]
  - - [256, 128, 1, 9, 256, 256, 9, 9]
    - [153, 72.0]
  - - [256, 256, 1, 1444, 256, 256, 1444, 1444]
    - [174, 3500.0]
  - - [512, 128, 1, 100, 512, 512, 100, 100]
    - [136, 1187.0]
  - - [64, 128, 1, 1444, 64, 64, 1444, 1444]
    - [159, 823.0]
  - - [81, 1024, 1, 1024, 81, 81, 1024, 1024]
    - [162, 3208.0]
  - - [81, 1000, 1, 1024, 81, 81, 1024, 1024]
    - [189, 3125.0]
  - - [1024, 20, 1, 1024, 1024, 1024, 1024, 1024]
    - [140, 1408.0]
  - - [2, 8, 1, 2048, 2, 2, 2048, 2048]
    - [122, 2.0]
  - - [2, 20, 1, 1024, 2, 2, 1024, 1024]
    - [122, 4.0]
  - - [2, 2, 1, 2560, 2, 2, 2560, 2560]
    - [128, 1.0]
- null
- null
- DeviceEfficiency
...
