library/src/blas3/Tensile/Logic/asm_full/navi21_Cijk_Alik_Bljk_HHS_BH.yaml
- {MinimumRequiredVersion: 4.26.0}
- navi21
- gfx1030
- [Device 73a2]
    SolutionIndex: 0
    SolutionNameMin: Cijk_Alik_Bljk_HHS_BH_MT128x64x8_SN_SU0_SUM0_TT8_8_WG16_8_1_WGM1
    SolutionIndex: 1
    SolutionNameMin: Cijk_Alik_Bljk_HHS_BH_MT128x128x8_SN_SU0_SUM0_TT8_16_WG16_8_1_WGM1
    SolutionIndex: 2
    SolutionNameMin: Cijk_Alik_Bljk_HHS_BH_MT128x128x8_SN_SU0_SUM0_TT8_8_WG16_16_1_WGM1
    SolutionIndex: 3
    SolutionNameMin: Cijk_Alik_Bljk_HHS_BH_MT128x256x8_SN_SU0_SUM0_TT8_16_WG16_16_1_WGM1
    SolutionIndex: 4
    SolutionNameMin: Cijk_Alik_Bljk_HHS_BH_MT128x64x16_SN_SU0_SUM0_TT8_8_WG16_8_1_WGM1
    SolutionIndex: 5
    SolutionNameMin: Cijk_Alik_Bljk_HHS_BH_MT128x128x16_SN_SU0_SUM0_TT8_16_WG16_8_1_WGM1
    SolutionIndex: 6
    SolutionNameMin: Cijk_Alik_Bljk_HHS_BH_MT128x128x16_SN_SU0_SUM0_TT8_8_WG16_16_1_WGM1
    SolutionIndex: 7
    SolutionNameMin: Cijk_Alik_Bljk_HHS_BH_MT128x256x16_SN_SU0_SUM0_TT8_16_WG16_16_1_WGM1
    SolutionIndex: 8
    SolutionNameMin: Cijk_Alik_Bljk_HHS_BH_MT128x64x8_SN_SU32_SUM3_TT8_8_WG16_8_1_WGM1
    SolutionIndex: 9
    SolutionNameMin: Cijk_Alik_Bljk_HHS_BH_MT128x128x8_SN_SU32_SUM3_TT8_16_WG16_8_1_WGM1
    SolutionIndex: 10
    SolutionNameMin: Cijk_Alik_Bljk_HHS_BH_MT128x256x8_SN_SU32_SUM3_TT8_16_WG16_16_1_WGM1
    SolutionIndex: 11
    SolutionNameMin: Cijk_Alik_Bljk_HHS_BH_MT128x64x16_SN_SU32_SUM3_TT8_8_WG16_8_1_WGM1
    SolutionIndex: 12
    SolutionNameMin: Cijk_Alik_Bljk_HHS_BH_MT128x128x16_SN_SU32_SUM3_TT8_16_WG16_8_1_WGM1
    SolutionIndex: 13
    SolutionNameMin: Cijk_Alik_Bljk_HHS_BH_MT128x128x16_SN_SU32_SUM3_TT8_8_WG16_16_1_WGM1
    SolutionIndex: 14
    SolutionNameMin: Cijk_Alik_Bljk_HHS_BH_MT128x256x16_SN_SU32_SUM3_TT8_16_WG16_16_1_WGM1
    SolutionIndex: 15
    SolutionNameMin: Cijk_Alik_Bljk_HHS_BH_MT128x128x32_SN_SU32_SUM3_TT8_16_WG16_8_1_WGM1
    SolutionIndex: 16
    SolutionNameMin: Cijk_Alik_Bljk_HHS_BH_MT128x256x32_SN_SU32_SUM3_TT8_16_WG16_16_1_WGM1
    SolutionIndex: 17
    SolutionNameMin: Cijk_Alik_Bljk_HHS_BH_MT128x64x8_SN_SU0_SUM0_TT8_8_WG16_8_1_WGM4
    SolutionIndex: 18
    SolutionNameMin: Cijk_Alik_Bljk_HHS_BH_MT128x128x8_SN_SU0_SUM0_TT8_8_WG16_16_1_WGM4
    SolutionIndex: 19
    SolutionNameMin: Cijk_Alik_Bljk_HHS_BH_MT128x256x8_SN_SU0_SUM0_TT8_16_WG16_16_1_WGM4
    SolutionIndex: 20
    SolutionNameMin: Cijk_Alik_Bljk_HHS_BH_MT128x64x16_SN_SU0_SUM0_TT8_8_WG16_8_1_WGM4
    SolutionIndex: 21
    SolutionNameMin: Cijk_Alik_Bljk_HHS_BH_MT128x128x16_SN_SU0_SUM0_TT8_16_WG16_8_1_WGM4
    SolutionIndex: 22
    SolutionNameMin: Cijk_Alik_Bljk_HHS_BH_MT128x128x16_SN_SU0_SUM0_TT8_8_WG16_16_1_WGM4
    SolutionIndex: 23
    SolutionNameMin: Cijk_Alik_Bljk_HHS_BH_MT128x256x16_SN_SU0_SUM0_TT8_16_WG16_16_1_WGM4
    SolutionIndex: 24
    SolutionNameMin: Cijk_Alik_Bljk_HHS_BH_MT128x64x8_SN_SU32_SUM3_TT8_8_WG16_8_1_WGM4
    SolutionIndex: 25
    SolutionNameMin: Cijk_Alik_Bljk_HHS_BH_MT128x128x8_SN_SU32_SUM3_TT8_8_WG16_16_1_WGM4
    SolutionIndex: 26
    SolutionNameMin: Cijk_Alik_Bljk_HHS_BH_MT128x256x8_SN_SU32_SUM3_TT8_16_WG16_16_1_WGM4
    SolutionIndex: 27
    SolutionNameMin: Cijk_Alik_Bljk_HHS_BH_MT128x64x16_SN_SU32_SUM3_TT8_8_WG16_8_1_WGM4
    SolutionIndex: 28
    SolutionNameMin: Cijk_Alik_Bljk_HHS_BH_MT128x128x16_SN_SU32_SUM3_TT8_16_WG16_8_1_WGM4
    SolutionIndex: 29
    SolutionNameMin: Cijk_Alik_Bljk_HHS_BH_MT128x128x16_SN_SU32_SUM3_TT8_8_WG16_16_1_WGM4
    SolutionIndex: 30
    SolutionNameMin: Cijk_Alik_Bljk_HHS_BH_MT128x256x16_SN_SU32_SUM3_TT8_16_WG16_16_1_WGM4
    SolutionIndex: 31
    SolutionNameMin: Cijk_Alik_Bljk_HHS_BH_MT128x64x32_SN_SU32_SUM3_TT8_8_WG16_8_1_WGM4
    SolutionIndex: 32
    SolutionNameMin: Cijk_Alik_Bljk_HHS_BH_MT128x128x32_SN_SU32_SUM3_TT8_16_WG16_8_1_WGM4
    SolutionIndex: 33
    SolutionNameMin: Cijk_Alik_Bljk_HHS_BH_MT128x256x32_SN_SU32_SUM3_TT8_16_WG16_16_1_WGM4
    SolutionIndex: 34
    SolutionNameMin: Cijk_Alik_Bljk_HHS_BH_MT128x64x8_SN_SU0_SUM0_TT8_8_WG16_8_1_WGM8
    SolutionIndex: 35
    SolutionNameMin: Cijk_Alik_Bljk_HHS_BH_MT128x128x8_SN_SU0_SUM0_TT8_16_WG16_8_1_WGM8
    SolutionIndex: 36
    SolutionNameMin: Cijk_Alik_Bljk_HHS_BH_MT128x256x8_SN_SU0_SUM0_TT8_16_WG16_16_1_WGM8
    SolutionIndex: 37
    SolutionNameMin: Cijk_Alik_Bljk_HHS_BH_MT128x64x16_SN_SU0_SUM0_TT8_8_WG16_8_1_WGM8
    SolutionIndex: 38
    SolutionNameMin: Cijk_Alik_Bljk_HHS_BH_MT128x128x16_SN_SU0_SUM0_TT8_16_WG16_8_1_WGM8
    SolutionIndex: 39
    SolutionNameMin: Cijk_Alik_Bljk_HHS_BH_MT128x128x16_SN_SU0_SUM0_TT8_8_WG16_16_1_WGM8
    SolutionIndex: 40
    SolutionNameMin: Cijk_Alik_Bljk_HHS_BH_MT128x256x16_SN_SU0_SUM0_TT8_16_WG16_16_1_WGM8
    SolutionIndex: 41
    SolutionNameMin: Cijk_Alik_Bljk_HHS_BH_MT128x64x8_SN_SU32_SUM3_TT8_8_WG16_8_1_WGM8
    SolutionIndex: 42
    SolutionNameMin: Cijk_Alik_Bljk_HHS_BH_MT128x128x8_SN_SU32_SUM3_TT8_16_WG16_8_1_WGM8
    SolutionIndex: 43
    SolutionNameMin: Cijk_Alik_Bljk_HHS_BH_MT128x128x8_SN_SU32_SUM3_TT8_8_WG16_16_1_WGM8
    SolutionIndex: 44
    SolutionNameMin: Cijk_Alik_Bljk_HHS_BH_MT128x128x16_SN_SU32_SUM3_TT8_16_WG16_8_1_WGM8
    SolutionIndex: 45
    SolutionNameMin: Cijk_Alik_Bljk_HHS_BH_MT128x128x16_SN_SU32_SUM3_TT8_8_WG16_16_1_WGM8
    SolutionIndex: 46
    SolutionNameMin: Cijk_Alik_Bljk_HHS_BH_MT128x256x16_SN_SU32_SUM3_TT8_16_WG16_16_1_WGM8
    SolutionIndex: 47
    SolutionNameMin: Cijk_Alik_Bljk_HHS_BH_MT128x128x32_SN_SU32_SUM3_TT8_16_WG16_8_1_WGM8
    SolutionIndex: 48
    SolutionNameMin: Cijk_Alik_Bljk_HHS_BH_MT128x256x32_SN_SU32_SUM3_TT8_16_WG16_16_1_WGM8
    SolutionIndex: 49
    SolutionNameMin: Cijk_Alik_Bljk_HHS_BH_MT128x256x16_SN_SU0_SUM0_TT8_16_WG16_16_1_WGM1
    SolutionIndex: 50
    SolutionNameMin: Cijk_Alik_Bljk_HHS_BH_MT128x128x32_SN_SU32_SUM3_TT8_16_WG16_8_1_WGM1
    SolutionIndex: 51
    SolutionNameMin: Cijk_Alik_Bljk_HHS_BH_MT128x128x32_SN_SU32_SUM3_TT8_16_WG16_8_1_WGM4
    SolutionIndex: 52
    SolutionNameMin: Cijk_Alik_Bljk_HHS_BH_MT128x128x32_SN_SU32_SUM3_TT8_16_WG16_8_1_WGM8
    SolutionIndex: 53
    SolutionNameMin: Cijk_Alik_Bljk_HHS_BH_MT64x64x8_SN_SU0_SUM0_TT8_8_WG8_8_1_WGM1
    SolutionIndex: 54
    SolutionNameMin: Cijk_Alik_Bljk_HHS_BH_MT128x64x8_SN_SU0_SUM0_TT8_8_WG16_8_1_WGM1
    SolutionIndex: 55
    SolutionNameMin: Cijk_Alik_Bljk_HHS_BH_MT128x128x8_SN_SU0_SUM0_TT8_8_WG16_16_1_WGM1
    SolutionIndex: 56
    SolutionNameMin: Cijk_Alik_Bljk_HHS_BH_MT64x64x16_SN_SU0_SUM0_TT8_8_WG8_8_1_WGM1
    SolutionIndex: 57
    SolutionNameMin: Cijk_Alik_Bljk_HHS_BH_MT128x64x16_SN_SU0_SUM0_TT8_8_WG16_8_1_WGM1
    SolutionIndex: 58
    SolutionNameMin: Cijk_Alik_Bljk_HHS_BH_MT128x128x16_SN_SU0_SUM0_TT8_8_WG16_16_1_WGM1
    SolutionIndex: 59
    SolutionNameMin: Cijk_Alik_Bljk_HHS_BH_MT64x64x32_SN_SU0_SUM0_TT8_8_WG8_8_1_WGM1
    SolutionIndex: 60
    SolutionNameMin: Cijk_Alik_Bljk_HHS_BH_MT128x64x32_SN_SU0_SUM0_TT8_8_WG16_8_1_WGM1
    SolutionIndex: 61
    SolutionNameMin: Cijk_Alik_Bljk_HHS_BH_MT64x64x8_SN_SU32_SUM3_TT8_8_WG8_8_1_WGM1
    SolutionIndex: 62
    SolutionNameMin: Cijk_Alik_Bljk_HHS_BH_MT128x64x8_SN_SU32_SUM3_TT8_8_WG16_8_1_WGM1
    SolutionIndex: 63
    SolutionNameMin: Cijk_Alik_Bljk_HHS_BH_MT64x64x16_SN_SU32_SUM3_TT8_8_WG8_8_1_WGM1
    SolutionIndex: 64
    SolutionNameMin: Cijk_Alik_Bljk_HHS_BH_MT128x64x16_SN_SU32_SUM3_TT8_8_WG16_8_1_WGM1
    SolutionIndex: 65
    SolutionNameMin: Cijk_Alik_Bljk_HHS_BH_MT128x128x16_SN_SU32_SUM3_TT8_8_WG16_16_1_WGM1
    SolutionIndex: 66
    SolutionNameMin: Cijk_Alik_Bljk_HHS_BH_MT64x64x32_SN_SU32_SUM3_TT8_8_WG8_8_1_WGM1
    SolutionIndex: 67
    SolutionNameMin: Cijk_Alik_Bljk_HHS_BH_MT128x64x32_SN_SU32_SUM3_TT8_8_WG16_8_1_WGM1
    SolutionIndex: 68
    SolutionNameMin: Cijk_Alik_Bljk_HHS_BH_MT64x64x8_SN_SU0_SUM0_TT8_8_WG8_8_1_WGM4
    SolutionIndex: 69
    SolutionNameMin: Cijk_Alik_Bljk_HHS_BH_MT128x64x8_SN_SU0_SUM0_TT8_8_WG16_8_1_WGM4
    SolutionIndex: 70
    SolutionNameMin: Cijk_Alik_Bljk_HHS_BH_MT128x128x8_SN_SU0_SUM0_TT8_8_WG16_16_1_WGM4
    SolutionIndex: 71
    SolutionNameMin: Cijk_Alik_Bljk_HHS_BH_MT64x64x16_SN_SU0_SUM0_TT8_8_WG8_8_1_WGM4
    SolutionIndex: 72
    SolutionNameMin: Cijk_Alik_Bljk_HHS_BH_MT128x64x16_SN_SU0_SUM0_TT8_8_WG16_8_1_WGM4
    SolutionIndex: 73
    SolutionNameMin: Cijk_Alik_Bljk_HHS_BH_MT128x128x16_SN_SU0_SUM0_TT8_8_WG16_16_1_WGM4
    SolutionIndex: 74
    SolutionNameMin: Cijk_Alik_Bljk_HHS_BH_MT64x64x32_SN_SU0_SUM0_TT8_8_WG8_8_1_WGM4
    SolutionIndex: 75
    SolutionNameMin: Cijk_Alik_Bljk_HHS_BH_MT64x64x16_SN_SU32_SUM3_TT8_8_WG8_8_1_WGM4
    SolutionIndex: 76
    SolutionNameMin: Cijk_Alik_Bljk_HHS_BH_MT128x64x16_SN_SU32_SUM3_TT8_8_WG16_8_1_WGM4
    SolutionIndex: 77
    SolutionNameMin: Cijk_Alik_Bljk_HHS_BH_MT128x128x16_SN_SU32_SUM3_TT8_8_WG16_16_1_WGM4
    SolutionIndex: 78
    SolutionNameMin: Cijk_Alik_Bljk_HHS_BH_MT64x64x32_SN_SU32_SUM3_TT8_8_WG8_8_1_WGM4
    SolutionIndex: 79
    SolutionNameMin: Cijk_Alik_Bljk_HHS_BH_MT128x64x32_SN_SU32_SUM3_TT8_8_WG16_8_1_WGM4
    SolutionIndex: 80
    SolutionNameMin: Cijk_Alik_Bljk_HHS_BH_MT64x64x8_SN_SU0_SUM0_TT8_8_WG8_8_1_WGM8
    SolutionIndex: 81
    SolutionNameMin: Cijk_Alik_Bljk_HHS_BH_MT128x64x8_SN_SU0_SUM0_TT8_8_WG16_8_1_WGM8
    SolutionIndex: 82
    SolutionNameMin: Cijk_Alik_Bljk_HHS_BH_MT128x128x8_SN_SU0_SUM0_TT8_8_WG16_16_1_WGM8
    SolutionIndex: 83
    SolutionNameMin: Cijk_Alik_Bljk_HHS_BH_MT64x64x16_SN_SU0_SUM0_TT8_8_WG8_8_1_WGM8
    SolutionIndex: 84
    SolutionNameMin: Cijk_Alik_Bljk_HHS_BH_MT128x64x16_SN_SU0_SUM0_TT8_8_WG16_8_1_WGM8
    SolutionIndex: 85
    SolutionNameMin: Cijk_Alik_Bljk_HHS_BH_MT128x128x16_SN_SU0_SUM0_TT8_8_WG16_16_1_WGM8
    SolutionIndex: 86
    SolutionNameMin: Cijk_Alik_Bljk_HHS_BH_MT128x64x32_SN_SU0_SUM0_TT8_8_WG16_8_1_WGM8
    SolutionIndex: 87
    SolutionNameMin: Cijk_Alik_Bljk_HHS_BH_MT64x64x8_SN_SU32_SUM3_TT8_8_WG8_8_1_WGM8
    SolutionIndex: 88
    SolutionNameMin: Cijk_Alik_Bljk_HHS_BH_MT128x64x8_SN_SU32_SUM3_TT8_8_WG16_8_1_WGM8
    SolutionIndex: 89
    SolutionNameMin: Cijk_Alik_Bljk_HHS_BH_MT64x64x16_SN_SU32_SUM3_TT8_8_WG8_8_1_WGM8
    SolutionIndex: 90
    SolutionNameMin: Cijk_Alik_Bljk_HHS_BH_MT128x64x16_SN_SU32_SUM3_TT8_8_WG16_8_1_WGM8
    SolutionIndex: 91
    SolutionNameMin: Cijk_Alik_Bljk_HHS_BH_MT128x128x16_SN_SU32_SUM3_TT8_8_WG16_16_1_WGM8
    SolutionIndex: 92
    SolutionNameMin: Cijk_Alik_Bljk_HHS_BH_MT64x64x32_SN_SU32_SUM3_TT8_8_WG8_8_1_WGM8
    SolutionIndex: 93
    SolutionNameMin: Cijk_Alik_Bljk_HHS_BH_MT64x64x16_SN_SU0_SUM0_TT8_8_WG8_8_1_WGM1
    SolutionIndex: 94
    SolutionNameMin: Cijk_Alik_Bljk_HHS_BH_MT128x64x16_SN_SU0_SUM0_TT8_8_WG16_8_1_WGM1
    SolutionIndex: 95
    SolutionNameMin: Cijk_Alik_Bljk_HHS_BH_MT128x128x16_SN_SU0_SUM0_TT8_8_WG16_16_1_WGM1
    SolutionIndex: 96
    SolutionNameMin: Cijk_Alik_Bljk_HHS_BH_MT128x64x16_SN_SU32_SUM3_TT8_8_WG16_8_1_WGM1
    SolutionIndex: 97
    SolutionNameMin: Cijk_Alik_Bljk_HHS_BH_MT64x64x32_SN_SU32_SUM3_TT8_8_WG8_8_1_WGM1
    SolutionIndex: 98
    SolutionNameMin: Cijk_Alik_Bljk_HHS_BH_MT128x64x32_SN_SU32_SUM3_TT8_8_WG16_8_1_WGM1
    SolutionIndex: 99
    SolutionNameMin: Cijk_Alik_Bljk_HHS_BH_MT128x64x16_SN_SU0_SUM0_TT8_8_WG16_8_1_WGM4
    SolutionIndex: 100
    SolutionNameMin: Cijk_Alik_Bljk_HHS_BH_MT128x128x16_SN_SU0_SUM0_TT8_8_WG16_16_1_WGM4
    SolutionIndex: 101
    SolutionNameMin: Cijk_Alik_Bljk_HHS_BH_MT128x64x16_SN_SU32_SUM3_TT8_8_WG16_8_1_WGM4
    SolutionIndex: 102
    SolutionNameMin: Cijk_Alik_Bljk_HHS_BH_MT128x64x32_SN_SU32_SUM3_TT8_8_WG16_8_1_WGM4
    SolutionIndex: 103
    SolutionNameMin: Cijk_Alik_Bljk_HHS_BH_MT64x64x16_SN_SU0_SUM0_TT8_8_WG8_8_1_WGM8
    SolutionIndex: 104
    SolutionNameMin: Cijk_Alik_Bljk_HHS_BH_MT128x64x16_SN_SU0_SUM0_TT8_8_WG16_8_1_WGM8
    SolutionIndex: 105
    SolutionNameMin: Cijk_Alik_Bljk_HHS_BH_MT128x64x32_SN_SU0_SUM0_TT8_8_WG16_8_1_WGM8
    SolutionIndex: 106
    SolutionNameMin: Cijk_Alik_Bljk_HHS_BH_MT64x64x16_SN_SU32_SUM3_TT8_8_WG8_8_1_WGM8
    SolutionIndex: 107
    SolutionNameMin: Cijk_Alik_Bljk_HHS_BH_MT128x64x16_SN_SU32_SUM3_TT8_8_WG16_8_1_WGM8
    SolutionIndex: 108
    SolutionNameMin: Cijk_Alik_Bljk_HHS_BH_MT64x64x32_SN_SU32_SUM3_TT8_8_WG8_8_1_WGM8
    SolutionIndex: 109
    SolutionNameMin: Cijk_Alik_Bljk_HHS_BH_MT128x64x32_SN_SU32_SUM3_TT8_8_WG16_8_1_WGM8
    SolutionIndex: 110
    SolutionNameMin: Cijk_Alik_Bljk_HHS_BH_MT16x16x8_SN_SU0_SUM0_TT2_2_WG8_8_1_WGM1
    SolutionIndex: 111
    SolutionNameMin: Cijk_Alik_Bljk_HHS_BH_MT32x32x8_SN_SU0_SUM0_TT4_4_WG8_8_1_WGM1
    SolutionIndex: 112
    SolutionNameMin: Cijk_Alik_Bljk_HHS_BH_MT32x16x8_SN_SU0_SUM0_TT2_2_WG16_8_1_WGM1
    SolutionIndex: 113
    SolutionNameMin: Cijk_Alik_Bljk_HHS_BH_MT64x32x8_SN_SU0_SUM0_TT4_4_WG16_8_1_WGM1
    SolutionIndex: 114
    SolutionNameMin: Cijk_Alik_Bljk_HHS_BH_MT32x32x8_SN_SU0_SUM0_TT2_2_WG16_16_1_WGM1
    SolutionIndex: 115
    SolutionNameMin: Cijk_Alik_Bljk_HHS_BH_MT64x64x8_SN_SU0_SUM0_TT4_4_WG16_16_1_WGM1
    SolutionIndex: 116
    SolutionNameMin: Cijk_Alik_Bljk_HHS_BH_MT16x16x16_SN_SU0_SUM0_TT2_2_WG8_8_1_WGM1
    SolutionIndex: 117
    SolutionNameMin: Cijk_Alik_Bljk_HHS_BH_MT32x32x16_SN_SU0_SUM0_TT4_4_WG8_8_1_WGM1
    SolutionIndex: 118
    SolutionNameMin: Cijk_Alik_Bljk_HHS_BH_MT16x16x32_SN_SU0_SUM0_TT2_2_WG8_8_1_WGM1
    SolutionIndex: 119
    SolutionNameMin: Cijk_Alik_Bljk_HHS_BH_MT16x16x8_SN_SU32_SUM3_TT2_2_WG8_8_1_WGM1
    SolutionIndex: 120
    SolutionNameMin: Cijk_Alik_Bljk_HHS_BH_MT32x32x8_SN_SU32_SUM3_TT4_4_WG8_8_1_WGM1
    SolutionIndex: 121
    SolutionNameMin: Cijk_Alik_Bljk_HHS_BH_MT32x16x8_SN_SU32_SUM3_TT2_2_WG16_8_1_WGM1
    SolutionIndex: 122
    SolutionNameMin: Cijk_Alik_Bljk_HHS_BH_MT32x32x8_SN_SU32_SUM3_TT2_2_WG16_16_1_WGM1
    SolutionIndex: 123
    SolutionNameMin: Cijk_Alik_Bljk_HHS_BH_MT64x64x8_SN_SU32_SUM3_TT4_4_WG16_16_1_WGM1
    SolutionIndex: 124
    SolutionNameMin: Cijk_Alik_Bljk_HHS_BH_MT16x16x16_SN_SU32_SUM3_TT2_2_WG8_8_1_WGM1
    SolutionIndex: 125
    SolutionNameMin: Cijk_Alik_Bljk_HHS_BH_MT32x32x16_SN_SU32_SUM3_TT4_4_WG8_8_1_WGM1
    SolutionIndex: 126
    SolutionNameMin: Cijk_Alik_Bljk_HHS_BH_MT32x16x16_SN_SU32_SUM3_TT2_2_WG16_8_1_WGM1
    SolutionIndex: 127
    SolutionNameMin: Cijk_Alik_Bljk_HHS_BH_MT16x16x32_SN_SU32_SUM3_TT2_2_WG8_8_1_WGM1
    SolutionIndex: 128
    SolutionNameMin: Cijk_Alik_Bljk_HHS_BH_MT16x16x8_SN_SU0_SUM0_TT2_2_WG8_8_1_WGM4
    SolutionIndex: 129
    SolutionNameMin: Cijk_Alik_Bljk_HHS_BH_MT32x32x8_SN_SU0_SUM0_TT4_4_WG8_8_1_WGM4
    SolutionIndex: 130
    SolutionNameMin: Cijk_Alik_Bljk_HHS_BH_MT32x16x8_SN_SU0_SUM0_TT2_2_WG16_8_1_WGM4
    SolutionIndex: 131
    SolutionNameMin: Cijk_Alik_Bljk_HHS_BH_MT64x32x8_SN_SU0_SUM0_TT4_4_WG16_8_1_WGM4
    SolutionIndex: 132
    SolutionNameMin: Cijk_Alik_Bljk_HHS_BH_MT32x32x8_SN_SU0_SUM0_TT2_2_WG16_16_1_WGM4
    SolutionIndex: 133
    SolutionNameMin: Cijk_Alik_Bljk_HHS_BH_MT64x64x8_SN_SU0_SUM0_TT4_4_WG16_16_1_WGM4
    SolutionIndex: 134
    SolutionNameMin: Cijk_Alik_Bljk_HHS_BH_MT16x16x16_SN_SU0_SUM0_TT2_2_WG8_8_1_WGM4
    SolutionIndex: 135
    SolutionNameMin: Cijk_Alik_Bljk_HHS_BH_MT32x32x16_SN_SU0_SUM0_TT4_4_WG8_8_1_WGM4
    SolutionIndex: 136
    SolutionNameMin: Cijk_Alik_Bljk_HHS_BH_MT16x16x32_SN_SU0_SUM0_TT2_2_WG8_8_1_WGM4
    SolutionIndex: 137
    SolutionNameMin: Cijk_Alik_Bljk_HHS_BH_MT16x16x8_SN_SU32_SUM3_TT2_2_WG8_8_1_WGM4
    SolutionIndex: 138
    SolutionNameMin: Cijk_Alik_Bljk_HHS_BH_MT32x32x8_SN_SU32_SUM3_TT4_4_WG8_8_1_WGM4
    SolutionIndex: 139
    SolutionNameMin: Cijk_Alik_Bljk_HHS_BH_MT32x16x8_SN_SU32_SUM3_TT2_2_WG16_8_1_WGM4
    SolutionIndex: 140
    SolutionNameMin: Cijk_Alik_Bljk_HHS_BH_MT64x32x8_SN_SU32_SUM3_TT4_4_WG16_8_1_WGM4
    SolutionIndex: 141
    SolutionNameMin: Cijk_Alik_Bljk_HHS_BH_MT64x64x8_SN_SU32_SUM3_TT4_4_WG16_16_1_WGM4
    SolutionIndex: 142
    SolutionNameMin: Cijk_Alik_Bljk_HHS_BH_MT16x16x16_SN_SU32_SUM3_TT2_2_WG8_8_1_WGM4
    SolutionIndex: 143
    SolutionNameMin: Cijk_Alik_Bljk_HHS_BH_MT32x32x16_SN_SU32_SUM3_TT4_4_WG8_8_1_WGM4
    SolutionIndex: 144
    SolutionNameMin: Cijk_Alik_Bljk_HHS_BH_MT32x16x16_SN_SU32_SUM3_TT2_2_WG16_8_1_WGM4
    SolutionIndex: 145
    SolutionNameMin: Cijk_Alik_Bljk_HHS_BH_MT16x16x8_SN_SU0_SUM0_TT2_2_WG8_8_1_WGM8
    SolutionIndex: 146
    SolutionNameMin: Cijk_Alik_Bljk_HHS_BH_MT32x32x8_SN_SU0_SUM0_TT4_4_WG8_8_1_WGM8
    SolutionIndex: 147
    SolutionNameMin: Cijk_Alik_Bljk_HHS_BH_MT32x16x8_SN_SU0_SUM0_TT2_2_WG16_8_1_WGM8
    SolutionIndex: 148
    SolutionNameMin: Cijk_Alik_Bljk_HHS_BH_MT64x32x8_SN_SU0_SUM0_TT4_4_WG16_8_1_WGM8
    SolutionIndex: 149
    SolutionNameMin: Cijk_Alik_Bljk_HHS_BH_MT32x32x8_SN_SU0_SUM0_TT2_2_WG16_16_1_WGM8
    SolutionIndex: 150
    SolutionNameMin: Cijk_Alik_Bljk_HHS_BH_MT64x64x8_SN_SU0_SUM0_TT4_4_WG16_16_1_WGM8
    SolutionIndex: 151
    SolutionNameMin: Cijk_Alik_Bljk_HHS_BH_MT16x16x16_SN_SU0_SUM0_TT2_2_WG8_8_1_WGM8
    SolutionIndex: 152
    SolutionNameMin: Cijk_Alik_Bljk_HHS_BH_MT32x32x16_SN_SU0_SUM0_TT4_4_WG8_8_1_WGM8
    SolutionIndex: 153
    SolutionNameMin: Cijk_Alik_Bljk_HHS_BH_MT32x16x16_SN_SU0_SUM0_TT2_2_WG16_8_1_WGM8
    SolutionIndex: 154
    SolutionNameMin: Cijk_Alik_Bljk_HHS_BH_MT16x16x32_SN_SU0_SUM0_TT2_2_WG8_8_1_WGM8
    SolutionIndex: 155
    SolutionNameMin: Cijk_Alik_Bljk_HHS_BH_MT16x16x8_SN_SU32_SUM3_TT2_2_WG8_8_1_WGM8
    SolutionIndex: 156
    SolutionNameMin: Cijk_Alik_Bljk_HHS_BH_MT32x32x8_SN_SU32_SUM3_TT4_4_WG8_8_1_WGM8
    SolutionIndex: 157
    SolutionNameMin: Cijk_Alik_Bljk_HHS_BH_MT32x16x8_SN_SU32_SUM3_TT2_2_WG16_8_1_WGM8
    SolutionIndex: 158
    SolutionNameMin: Cijk_Alik_Bljk_HHS_BH_MT64x32x8_SN_SU32_SUM3_TT4_4_WG16_8_1_WGM8
    SolutionIndex: 159
    SolutionNameMin: Cijk_Alik_Bljk_HHS_BH_MT32x32x8_SN_SU32_SUM3_TT2_2_WG16_16_1_WGM8
    SolutionIndex: 160
    SolutionNameMin: Cijk_Alik_Bljk_HHS_BH_MT64x64x8_SN_SU32_SUM3_TT4_4_WG16_16_1_WGM8
    SolutionIndex: 161
    SolutionNameMin: Cijk_Alik_Bljk_HHS_BH_MT16x16x16_SN_SU32_SUM3_TT2_2_WG8_8_1_WGM8
    SolutionIndex: 162
    SolutionNameMin: Cijk_Alik_Bljk_HHS_BH_MT32x32x16_SN_SU32_SUM3_TT4_4_WG8_8_1_WGM8
    SolutionIndex: 163
    SolutionNameMin: Cijk_Alik_Bljk_HHS_BH_MT32x16x16_SN_SU32_SUM3_TT2_2_WG16_8_1_WGM8
    SolutionIndex: 164
    SolutionNameMin: Cijk_Alik_Bljk_HHS_BH_MT32x32x32_SN_SU32_SUM3_TT2_2_WG16_16_1_WGM8
    SolutionIndex: 165
    SolutionNameMin: Cijk_Alik_Bljk_HHS_BH_MT32x32x8_SN_SU0_SUM0_TT4_4_WG8_8_1_WGM1
    SolutionIndex: 166
    SolutionNameMin: Cijk_Alik_Bljk_HHS_BH_MT64x64x8_SN_SU0_SUM0_TT4_4_WG16_16_1_WGM1
    SolutionIndex: 167
    SolutionNameMin: Cijk_Alik_Bljk_HHS_BH_MT16x16x16_SN_SU0_SUM0_TT2_2_WG8_8_1_WGM1
    SolutionIndex: 168
    SolutionNameMin: Cijk_Alik_Bljk_HHS_BH_MT16x16x32_SN_SU0_SUM0_TT2_2_WG8_8_1_WGM1
    SolutionIndex: 169
    SolutionNameMin: Cijk_Alik_Bljk_HHS_BH_MT32x32x16_SN_SU32_SUM3_TT4_4_WG8_8_1_WGM1
    SolutionIndex: 170
    SolutionNameMin: Cijk_Alik_Bljk_HHS_BH_MT32x32x8_SN_SU0_SUM0_TT4_4_WG8_8_1_WGM4
    SolutionIndex: 171
    SolutionNameMin: Cijk_Alik_Bljk_HHS_BH_MT16x16x16_SN_SU0_SUM0_TT2_2_WG8_8_1_WGM4
    SolutionIndex: 172
    SolutionNameMin: Cijk_Alik_Bljk_HHS_BH_MT32x32x16_SN_SU0_SUM0_TT4_4_WG8_8_1_WGM4
    SolutionIndex: 173
    SolutionNameMin: Cijk_Alik_Bljk_HHS_BH_MT16x16x32_SN_SU0_SUM0_TT2_2_WG8_8_1_WGM4
    SolutionIndex: 174
    SolutionNameMin: Cijk_Alik_Bljk_HHS_BH_MT64x64x8_SN_SU32_SUM3_TT4_4_WG16_16_1_WGM4
    SolutionIndex: 175
    SolutionNameMin: Cijk_Alik_Bljk_HHS_BH_MT32x32x8_SN_SU0_SUM0_TT4_4_WG8_8_1_WGM8
    SolutionIndex: 176
    SolutionNameMin: Cijk_Alik_Bljk_HHS_BH_MT64x64x8_SN_SU0_SUM0_TT4_4_WG16_16_1_WGM8
    SolutionIndex: 177
    SolutionNameMin: Cijk_Alik_Bljk_HHS_BH_MT16x16x16_SN_SU0_SUM0_TT2_2_WG8_8_1_WGM8
    SolutionIndex: 178
    SolutionNameMin: Cijk_Alik_Bljk_HHS_BH_MT32x32x16_SN_SU0_SUM0_TT4_4_WG8_8_1_WGM8
    SolutionIndex: 179
    SolutionNameMin: Cijk_Alik_Bljk_HHS_BH_MT16x16x32_SN_SU0_SUM0_TT2_2_WG8_8_1_WGM8
    SolutionIndex: 180
    SolutionNameMin: Cijk_Alik_Bljk_HHS_BH_MT64x64x8_SN_SU32_SUM3_TT4_4_WG16_16_1_WGM8
    SolutionIndex: 181
    SolutionNameMin: Cijk_Alik_Bljk_HHS_BH_MT16x16x32_SN_SU32_SUM3_TT2_2_WG8_8_1_WGM8
    SolutionIndex: 182
    SolutionNameMin: Cijk_Alik_Bljk_HHS_BH_MT32x8x8_SN_SU0_SUM0_TT2_2_WG16_4_1_WGM1
    SolutionIndex: 183
    SolutionNameMin: Cijk_Alik_Bljk_HHS_BH_MT32x8x16_SN_SU0_SUM0_TT2_2_WG16_4_1_WGM1
    SolutionIndex: 184
    SolutionNameMin: Cijk_Alik_Bljk_HHS_BH_MT32x8x8_SN_SU32_SUM3_TT2_2_WG16_4_1_WGM1
    SolutionIndex: 185
    SolutionNameMin: Cijk_Alik_Bljk_HHS_BH_MT32x8x16_SN_SU32_SUM3_TT2_2_WG16_4_1_WGM1
    SolutionIndex: 186
    SolutionNameMin: Cijk_Alik_Bljk_HHS_BH_MT32x8x16_SN_SU0_SUM0_TT2_2_WG16_4_1_WGM4
    SolutionIndex: 187
    SolutionNameMin: Cijk_Alik_Bljk_HHS_BH_MT32x8x8_SN_SU32_SUM3_TT2_2_WG16_4_1_WGM4
    SolutionIndex: 188
    SolutionNameMin: Cijk_Alik_Bljk_HHS_BH_MT32x8x16_SN_SU32_SUM3_TT2_2_WG16_4_1_WGM4
    SolutionIndex: 189
    SolutionNameMin: Cijk_Alik_Bljk_HHS_BH_MT32x8x8_SN_SU32_SUM3_TT2_2_WG16_4_1_WGM8
    SolutionIndex: 190
    SolutionNameMin: Cijk_Alik_Bljk_HHS_BH_MT32x8x16_SN_SU32_SUM3_TT2_2_WG16_4_1_WGM8
    SolutionIndex: 191
    SolutionNameMin: Cijk_Alik_Bljk_HHS_BH_MT16x32x8_SN_SU32_SUM3_TT2_4_WG8_8_1_WGM1
    SolutionIndex: 192
    SolutionNameMin: Cijk_Alik_Bljk_HHS_BH_MT32x32x8_SN_SU32_SUM3_TT2_4_WG16_8_1_WGM4
    SolutionIndex: 193
    SolutionNameMin: Cijk_Alik_Bljk_HHS_BH_MT32x32x8_SN_SU32_SUM3_TT2_4_WG16_8_1_WGM8
    SolutionIndex: 194
    SolutionNameMin: Cijk_Alik_Bljk_HHS_BH_MT16x16x8_SN_SU0_SUM0_SUS0_TT2_2_WG8_8_1_WGM1
    SolutionIndex: 195
    SolutionNameMin: Cijk_Alik_Bljk_HHS_BH_MT16x16x8_SN_SU0_SUM0_SUS0_TT2_2_WG8_8_1_WGM4
    SolutionIndex: 196
    SolutionNameMin: Cijk_Alik_Bljk_HHS_BH_MT16x16x8_SN_SU0_SUM0_SUS0_TT2_2_WG8_8_1_WGM8
    SolutionIndex: 197
    SolutionNameMin: Cijk_Alik_Bljk_HHS_BH_MT16x16x16_SN_SU0_SUM0_SUS0_TT2_2_WG8_8_1_WGM4
    SolutionIndex: 198
    SolutionNameMin: Cijk_Alik_Bljk_HHS_BH_MT16x16x8_SN_SU0_SUM0_SUS0_TT2_2_WG8_8_1_WGM8
    SolutionIndex: 199
    SolutionNameMin: Cijk_Alik_Bljk_HHS_BH_MT16x16x16_SN_SU0_SUM0_SUS0_TT2_2_WG8_8_1_WGM8
    SolutionIndex: 200
    SolutionNameMin: Cijk_Alik_Bljk_HHS_BH_MT16x16x16_SN_SU0_SUM0_SUS0_TT2_2_WG8_8_1_WGM1
    SolutionIndex: 201
    SolutionNameMin: Cijk_Alik_Bljk_HHS_BH_MT16x16x32_SN_SU0_SUM0_SUS0_TT2_2_WG8_8_1_WGM4
    SolutionIndex: 202
    SolutionNameMin: Cijk_Alik_Bljk_HHS_BH_MT16x16x32_SN_SU0_SUM0_SUS0_TT2_2_WG8_8_1_WGM4
    SolutionIndex: 203
    SolutionNameMin: Cijk_Alik_Bljk_HHS_BH_MT32x16x8_SN_SU0_SUM0_SUS0_TT2_2_WG16_8_1_WGM4
    SolutionIndex: 204
    SolutionNameMin: Cijk_Alik_Bljk_HHS_BH_MT32x16x8_SN_SU0_SUM0_SUS0_TT2_2_WG16_8_1_WGM1
    SolutionIndex: 205
    SolutionNameMin: Cijk_Alik_Bljk_HHS_BH_MT32x16x8_SN_SU32_SUM3_SUS128_TT2_2_WG16_8_1_WGM1
    SolutionIndex: 206
    SolutionNameMin: Cijk_Alik_Bljk_HHS_BH_MT32x32x8_SN_SU0_SUM0_SUS0_TT2_2_WG16_16_1_WGM1
    SolutionIndex: 207
    SolutionNameMin: Cijk_Alik_Bljk_HHS_BH_MT32x32x8_SN_SU0_SUM0_SUS0_TT2_2_WG16_16_1_WGM8
    SolutionIndex: 208
    SolutionNameMin: Cijk_Alik_Bljk_HHS_BH_MT32x32x8_SN_SU0_SUM0_SUS0_TT4_4_WG8_8_1_WGM4
    SolutionIndex: 209
    SolutionNameMin: Cijk_Alik_Bljk_HHS_BH_MT32x32x8_SN_SU0_SUM0_SUS0_TT4_4_WG8_8_1_WGM1
    SolutionIndex: 210
    SolutionNameMin: Cijk_Alik_Bljk_HHS_BH_MT32x32x8_SN_SU32_SUM3_SUS128_TT4_4_WG8_8_1_WGM1
    SolutionIndex: 211
    SolutionNameMin: Cijk_Alik_Bljk_HHS_BH_MT32x32x16_SN_SU0_SUM0_SUS0_TT4_4_WG8_8_1_WGM8
    SolutionIndex: 212
    SolutionNameMin: Cijk_Alik_Bljk_HHS_BH_MT32x32x16_SN_SU0_SUM0_SUS0_TT4_4_WG8_8_1_WGM1
    SolutionIndex: 213
    SolutionNameMin: Cijk_Alik_Bljk_HHS_BH_MT32x32x16_SN_SU32_SUM3_SUS128_TT4_4_WG8_8_1_WGM1
    SolutionIndex: 214
    SolutionNameMin: Cijk_Alik_Bljk_HHS_BH_MT32x32x8_SN_SU0_SUM0_SUS0_TT2_2_WG16_16_1_WGM8
    SolutionIndex: 215
    SolutionNameMin: Cijk_Alik_Bljk_HHS_BH_MT32x32x8_SN_SU32_SUM3_SUS128_TT2_2_WG16_16_1_WGM1
    SolutionIndex: 216
    SolutionNameMin: Cijk_Alik_Bljk_HHS_BH_MT32x32x8_SN_SU32_SUM3_SUS128_TT2_2_WG16_16_1_WGM4
    SolutionIndex: 217
    SolutionNameMin: Cijk_Alik_Bljk_HHS_BH_MT32x32x8_SN_SU0_SUM0_SUS0_TT2_2_WG16_16_1_WGM4
    SolutionIndex: 218
    SolutionNameMin: Cijk_Alik_Bljk_HHS_BH_MT32x32x32_SN_SU0_SUM0_SUS0_TT4_4_WG8_8_1_WGM4
    SolutionIndex: 219
    SolutionNameMin: Cijk_Alik_Bljk_HHS_BH_MT64x32x8_SN_SU0_SUM0_SUS0_TT4_4_WG16_8_1_WGM4
    SolutionIndex: 220
    SolutionNameMin: Cijk_Alik_Bljk_HHS_BH_MT64x64x8_SN_SU0_SUM0_SUS0_TT4_8_WG16_8_1_WGM8
    SolutionIndex: 221
    SolutionNameMin: Cijk_Alik_Bljk_HHS_BH_MT64x64x8_SN_SU0_SUM0_SUS0_TT4_8_WG16_8_1_WGM1
    SolutionIndex: 222
    SolutionNameMin: Cijk_Alik_Bljk_HHS_BH_MT64x64x8_SN_SU0_SUM0_SUS0_TT8_8_WG8_8_1_WGM4
    SolutionIndex: 223
    SolutionNameMin: Cijk_Alik_Bljk_HHS_BH_MT32x32x32_SN_SU0_SUM0_SUS0_TT4_4_WG8_8_1_WGM8
    SolutionIndex: 224
    SolutionNameMin: Cijk_Alik_Bljk_HHS_BH_MT32x32x32_SN_SU0_SUM0_SUS0_TT4_4_WG8_8_1_WGM4
    SolutionIndex: 225
    SolutionNameMin: Cijk_Alik_Bljk_HHS_BH_MT64x64x32_SN_SU0_SUM0_SUS0_TT8_8_WG8_8_1_WGM4
    SolutionIndex: 226
    SolutionNameMin: Cijk_Alik_Bljk_HHS_BH_MT64x64x32_SN_SU32_SUM3_SUS128_TT8_8_WG8_8_1_WGM1
    SolutionIndex: 227
    SolutionNameMin: Cijk_Alik_Bljk_HHS_BH_MT64x64x32_SN_SU32_SUM3_SUS128_TT8_8_WG8_8_1_WGM8
    SolutionIndex: 228
    SolutionNameMin: Cijk_Alik_Bljk_HHS_BH_MT64x64x32_SN_SU0_SUM0_SUS0_TT8_8_WG8_8_1_WGM1
    SolutionIndex: 229
    SolutionNameMin: Cijk_Alik_Bljk_HHS_BH_MT64x64x8_SN_SU0_SUM0_SUS0_TT8_8_WG8_8_1_WGM1
    SolutionIndex: 230
    SolutionNameMin: Cijk_Alik_Bljk_HHS_BH_MT64x64x16_SN_SU0_SUM0_SUS0_TT8_8_WG8_8_1_WGM1
    SolutionIndex: 231
    SolutionNameMin: Cijk_Alik_Bljk_HHS_BH_MT128x64x16_SN_SU0_SUM0_SUS0_TT8_8_WG16_8_1_WGM1
    SolutionIndex: 232
    SolutionNameMin: Cijk_Alik_Bljk_HHS_BH_MT64x64x16_SN_SU0_SUM0_SUS0_TT8_8_WG8_8_1_WGM8
    SolutionIndex: 233
    SolutionNameMin: Cijk_Alik_Bljk_HHS_BH_MT128x128x16_SN_SU0_SUM0_SUS0_TT8_8_WG16_16_1_WGM8
    SolutionIndex: 234
    SolutionNameMin: Cijk_Alik_Bljk_HHS_BH_MT128x128x16_SN_SU0_SUM0_SUS0_TT8_16_WG16_8_1_WGM1
    SolutionIndex: 235
    SolutionNameMin: Cijk_Alik_Bljk_HHS_BH_MT128x128x16_SN_SU32_SUM3_SUS128_TT8_16_WG16_8_1_WGM1
    SolutionIndex: 236
    SolutionNameMin: Cijk_Alik_Bljk_HHS_BH_MT64x64x16_SN_SU0_SUM0_SUS0_TT8_8_WG8_8_1_WGM1
    SolutionIndex: 237
    SolutionNameMin: Cijk_Alik_Bljk_HHS_BH_MT128x64x16_SN_SU32_SUM3_SUS128_TT8_8_WG16_8_1_WGM8
    SolutionIndex: 238
    SolutionNameMin: Cijk_Alik_Bljk_HHS_BH_MT128x64x16_SN_SU0_SUM0_SUS0_TT8_8_WG16_8_1_WGM4
    SolutionIndex: 239
    SolutionNameMin: Cijk_Alik_Bljk_HHS_BH_MT64x128x8_SN_SU0_SUM0_SUS0_TT4_8_WG16_16_1_WGM1
    SolutionIndex: 240
    SolutionNameMin: Cijk_Alik_Bljk_HHS_BH_MT128x64x16_SN_SU32_SUM3_SUS128_TT8_8_WG16_8_1_WGM4
    SolutionIndex: 241
    SolutionNameMin: Cijk_Alik_Bljk_HHS_BH_MT128x64x16_SN_SU0_SUM0_SUS0_TT8_8_WG16_8_1_WGM4
    SolutionIndex: 242
    SolutionNameMin: Cijk_Alik_Bljk_HHS_BH_MT128x128x16_SN_SU0_SUM0_SUS0_TT8_8_WG16_16_1_WGM1
    SolutionIndex: 243
    SolutionNameMin: Cijk_Alik_Bljk_HHS_BH_MT128x128x16_SN_SU0_SUM0_SUS0_TT8_8_WG16_16_1_WGM4
    SolutionIndex: 244
    SolutionNameMin: Cijk_Alik_Bljk_HHS_BH_MT128x128x16_SN_SU32_SUM3_SUS128_TT8_16_WG16_8_1_WGM4
    SolutionIndex: 245
    SolutionNameMin: Cijk_Alik_Bljk_HHS_BH_MT64x64x16_SN_SU0_SUM0_SUS0_TT8_8_WG8_8_1_WGM8
    SolutionIndex: 246
    SolutionNameMin: Cijk_Alik_Bljk_HHS_BH_MT128x128x32_SN_SU0_SUM0_SUS0_TT8_8_WG16_16_1_WGM4
    SolutionIndex: 247
    SolutionNameMin: Cijk_Alik_Bljk_HHS_BH_MT128x32x16_SN_SU0_SUM0_SUS0_TT8_8_WG16_4_1_WGM8
    SolutionIndex: 248
    SolutionNameMin: Cijk_Alik_Bljk_HHS_BH_MT128x32x16_SN_SU0_SUM0_SUS0_TT8_8_WG16_4_1_WGM4
    SolutionIndex: 249
    SolutionNameMin: Cijk_Alik_Bljk_HHS_BH_MT16x16x16_SN_SU32_SUM3_SUS128_TT2_2_WG8_8_1_WGM4
    SolutionIndex: 250
    SolutionNameMin: Cijk_Alik_Bljk_HHS_BH_MT16x16x16_SN_SU0_SUM0_SUS0_TT2_2_WG8_8_1_WGM8
    SolutionIndex: 251
    SolutionNameMin: Cijk_Alik_Bljk_HHS_BH_MT16x16x16_SN_SU32_SUM3_SUS128_TT2_2_WG8_8_1_WGM1
    SolutionIndex: 252
    SolutionNameMin: Cijk_Alik_Bljk_HHS_BH_MT64x64x16_SN_SU32_SUM3_SUS128_TT8_8_WG8_8_1_WGM1
    SolutionIndex: 253
    SolutionNameMin: Cijk_Alik_Bljk_HHS_BH_MT64x64x32_SN_SU0_SUM0_SUS0_TT8_8_WG8_8_1_WGM8
    SolutionIndex: 254
    SolutionNameMin: Cijk_Alik_Bljk_HHS_BH_MT128x64x8_SN_SU0_SUM0_SUS0_TT8_8_WG16_8_1_WGM8
    SolutionIndex: 255
    SolutionNameMin: Cijk_Alik_Bljk_HHS_BH_MT128x64x8_SN_SU0_SUM0_SUS0_TT8_8_WG16_8_1_WGM4
    SolutionIndex: 256
    SolutionNameMin: Cijk_Alik_Bljk_HHS_BH_MT128x128x8_SN_SU32_SUM3_SUS128_TT8_8_WG16_16_1_WGM1
    SolutionIndex: 257
    SolutionNameMin: Cijk_Alik_Bljk_HHS_BH_MT128x128x32_SN_SU32_SUM3_SUS128_TT8_8_WG16_16_1_WGM1
    SolutionIndex: 258
    SolutionNameMin: Cijk_Alik_Bljk_HHS_BH_MT128x128x8_SN_SU0_SUM0_SUS0_TT8_8_WG16_16_1_WGM4
    SolutionIndex: 259
    SolutionNameMin: Cijk_Alik_Bljk_HHS_BH_MT128x128x16_SN_SU0_SUM0_SUS0_TT8_8_WG16_16_1_WGM4
    SolutionIndex: 260
    SolutionNameMin: Cijk_Alik_Bljk_HHS_BH_MT128x128x32_SN_SU0_SUM0_SUS0_TT8_8_WG16_16_1_WGM4
    SolutionIndex: 261
    SolutionNameMin: Cijk_Alik_Bljk_HHS_BH_MT128x128x32_SN_SU0_SUM0_SUS0_TT8_8_WG16_16_1_WGM1
    SolutionIndex: 262
    SolutionNameMin: Cijk_Alik_Bljk_HHS_BH_MT128x128x16_SN_SU0_SUM0_SUS0_TT8_16_WG16_8_1_WGM4
- - - [2368, 1024, 1, 1]
    - [41, 1.081]
  - - [5056, 1408, 1, 3328]
    - [12, 68.276]
  - - [5056, 1856, 1, 3328]
    - [23, 69.093]
  - - [448, 3584, 1, 3328]
    - [23, 52.223]
  - - [5056, 4288, 1, 32]
    - [17, 56.297]
  - - [3584, 1024, 1, 256]
    - [38, 60.694]
  - - [1408, 3584, 1, 3328]
    - [44, 69.343]
  - - [1024, 2368, 1, 3328]
    - [28, 58.596]
  - - [448, 3584, 1, 32]
    - [18, 19.513]
  - - [4288, 6784, 1, 3328]
    - [7, 75.585]
  - - [5888, 4288, 1, 3328]
    - [23, 77.396]
  - - [2368, 1408, 1, 32]
    - [17, 35.085]
  - - [1024, 2944, 1, 1]
    - [34, 1.484]
  - - [2944, 3584, 1, 3328]
    - [23, 74.811]
  - - [2368, 2944, 1, 1280]
    - [28, 68.062]
  - - [6784, 5888, 1, 3328]
    - [23, 78.281]
  - - [3584, 1408, 1, 32]
    - [41, 39.085]
  - - [5056, 256, 1, 256]
    - [11, 41.16]
  - - [1856, 2368, 1, 256]
    - [28, 59.246]
  - - [2368, 1024, 1, 3328]
    - [28, 58.366]
  - - [3584, 4288, 1, 32]
    - [41, 55.138]
  - - [3584, 3584, 1, 1]
    - [25, 2.265]
  - - [1408, 2368, 1, 1]
    - [8, 1.748]
  - - [5056, 6784, 1, 1280]
    - [7, 76.171]
  - - [4288, 5056, 1, 1]
    - [8, 2.387]
  - - [5056, 4288, 1, 1]
    - [41, 2.371]
  - - [1408, 4288, 1, 1280]
    - [28, 67.119]
  - - [4288, 1024, 1, 3328]
    - [40, 69.356]
  - - [1024, 5056, 1, 1]
    - [34, 1.866]
  - - [704, 3584, 1, 1280]
    - [44, 59.252]
  - - [1856, 5056, 1, 256]
    - [23, 64.254]
  - - [1408, 1024, 1, 1280]
    - [38, 55.627]
  - - [5056, 5888, 1, 3328]
    - [23, 76.993]
  - - [3584, 3584, 1, 1280]
    - [23, 77.723]
  - - [2368, 3584, 1, 32]
    - [41, 47.937]
  - - [2944, 2368, 1, 1]
    - [0, 2.125]
  - - [704, 4288, 1, 1]
    - [41, 1.234]
  - - [1024, 6784, 1, 1280]
    - [23, 75.093]
  - - [1024, 3584, 1, 1]
    - [41, 1.71]
  - - [256, 5056, 1, 32]
    - [8, 25.252]
  - - [2368, 5056, 1, 32]
    - [17, 51.262]
  - - [6784, 1856, 1, 32]
    - [17, 55.693]
  - - [5056, 704, 1, 1]
    - [17, 1.498]
  - - [2944, 4288, 1, 256]
    - [14, 68.971]
  - - [5056, 704, 1, 32]
    - [8, 36.394]
  - - [1856, 4288, 1, 3328]
    - [44, 68.229]
  - - [6784, 4288, 1, 32]
    - [17, 59.724]
  - - [5888, 5056, 1, 256]
    - [23, 72.048]
  - - [3584, 2368, 1, 3328]
    - [23, 71.073]
  - - [4288, 1856, 1, 1]
    - [41, 2.055]
  - - [1856, 2944, 1, 1]
    - [24, 1.814]
  - - [1856, 2368, 1, 32]
    - [0, 39.658]
  - - [4288, 1856, 1, 32]
    - [0, 48.278]
  - - [5056, 2368, 1, 256]
    - [38, 65.711]
  - - [1408, 5888, 1, 256]
    - [44, 66.774]
  - - [5056, 6784, 1, 1]
    - [41, 2.47]
  - - [1024, 1408, 1, 3328]
    - [28, 56.654]
  - - [256, 5056, 1, 1280]
    - [38, 49.124]
  - - [704, 2368, 1, 1]
    - [41, 0.9]
  - - [3584, 4288, 1, 1280]
    - [23, 72.264]
  - - [3584, 2368, 1, 1]
    - [41, 2.157]
  - - [4288, 448, 1, 3328]
    - [40, 61.727]
  - - [704, 6784, 1, 1280]
    - [28, 64.346]
  - - [2368, 4288, 1, 32]
    - [17, 50.067]
  - - [704, 5056, 1, 1280]
    - [44, 61.12]
  - - [3584, 6784, 1, 32]
    - [35, 58.35]
  - - [3584, 6784, 1, 1280]
    - [23, 77.09]
  - - [4288, 4288, 1, 3328]
    - [30, 74.112]
  - - [1408, 3584, 1, 1]
    - [8, 1.996]
  - - [4288, 1856, 1, 3328]
    - [44, 68.154]
  - - [1856, 2944, 1, 1280]
    - [30, 68.45]
  - - [5056, 1024, 1, 3328]
    - [28, 70.897]
  - - [3584, 704, 1, 1]
    - [41, 1.475]
  - - [448, 5056, 1, 1]
    - [18, 0.835]
  - - [5888, 5888, 1, 256]
    - [46, 75.228]
  - - [3584, 704, 1, 32]
    - [34, 34.627]
  - - [448, 6784, 1, 3328]
    - [30, 65.628]
  - - [6784, 4288, 1, 1]
    - [8, 2.529]
  - - [3584, 6784, 1, 1]
    - [34, 2.427]
  - - [1408, 2368, 1, 32]
    - [17, 40.793]
  - - [448, 5056, 1, 32]
    - [34, 23.56]
  - - [4288, 4288, 1, 1280]
    - [7, 73.437]
  - - [6784, 1408, 1, 1]
    - [8, 2.274]
  - - [1856, 5888, 1, 3328]
    - [23, 73.234]
  - - [3584, 1856, 1, 3328]
    - [28, 68.42]
  - - [5056, 5888, 1, 1]
    - [41, 2.43]
  - - [2944, 1024, 1, 256]
    - [38, 54.714]
  - - [2368, 4288, 1, 3328]
    - [23, 71.829]
  - - [2944, 6784, 1, 256]
    - [38, 71.294]
  - - [2368, 2368, 1, 1280]
    - [12, 62.708]
  - - [3584, 3584, 1, 32]
    - [34, 54.226]
  - - [2944, 2944, 1, 1280]
    - [44, 71.61]
  - - [1408, 5056, 1, 1]
    - [0, 2.17]
  - - [2368, 6784, 1, 1]
    - [0, 2.315]
  - - [6784, 4288, 1, 1280]
    - [23, 76.009]
  - - [2944, 704, 1, 256]
    - [44, 51.68]
  - - [2368, 6784, 1, 1280]
    - [44, 71.56]
  - - [704, 2944, 1, 3328]
    - [23, 66.746]
  - - [5888, 256, 1, 1]
    - [0, 1.223]
  - - [5056, 6784, 1, 32]
    - [35, 59.377]
  - - [448, 5056, 1, 1280]
    - [28, 53.726]
  - - [256, 5888, 1, 3328]
    - [28, 59.216]
  - - [5888, 1024, 1, 1]
    - [41, 2.098]
  - - [5888, 448, 1, 32]
    - [41, 38.083]
  - - [6784, 2944, 1, 256]
    - [21, 71.917]
  - - [4288, 2944, 1, 256]
    - [28, 67.753]
  - - [448, 5888, 1, 3328]
    - [40, 57.572]
  - - [1408, 4288, 1, 1]
    - [41, 2.096]
  - - [1408, 1856, 1, 3328]
    - [44, 62.99]
  - - [3584, 1024, 1, 3328]
    - [12, 64.303]
  - - [2944, 5888, 1, 3328]
    - [14, 77.311]
  - - [448, 4288, 1, 3328]
    - [23, 62.02]
  - - [704, 2368, 1, 256]
    - [14, 44.447]
  - - [4288, 3584, 1, 3328]
    - [23, 73.771]
  - - [1408, 1024, 1, 1]
    - [24, 1.178]
  - - [1408, 1024, 1, 256]
    - [38, 49.739]
  - - [5056, 3584, 1, 1]
    - [25, 2.315]
  - - [6784, 6784, 1, 3328]
    - [23, 77.157]
  - - [2368, 2944, 1, 3328]
    - [28, 68.754]
  - - [5056, 3584, 1, 32]
    - [17, 54.962]
  - - [5056, 3584, 1, 1280]
    - [23, 74.935]
  - - [1856, 1856, 1, 256]
    - [44, 53.825]
  - - [5888, 4288, 1, 1]
    - [8, 2.486]
  - - [5056, 704, 1, 256]
    - [28, 55.465]
  - - [2368, 5056, 1, 256]
    - [30, 67.31]
  - - [1024, 5056, 1, 256]
    - [44, 64.272]
  - - [5888, 448, 1, 256]
    - [27, 48.607]
  - - [6784, 5056, 1, 1280]
    - [23, 76.729]
  - - [4288, 6784, 1, 1280]
    - [23, 75.08]
  - - [704, 6784, 1, 3328]
    - [44, 65.438]
  - - [2944, 1856, 1, 1]
    - [41, 2.028]
  - - [5888, 4288, 1, 1280]
    - [23, 76.618]
  - - [5888, 3584, 1, 1280]
    - [23, 77.748]
  - - [3584, 1408, 1, 1280]
    - [28, 68.603]
  - - [1024, 2944, 1, 256]
    - [12, 58.07]
  - - [2944, 1856, 1, 1280]
    - [44, 66.792]
  - - [1024, 2368, 1, 1]
    - [41, 1.536]
  - - [2944, 3584, 1, 1280]
    - [23, 74.549]
  - - [1856, 4288, 1, 256]
    - [44, 63.394]
  - - [448, 3584, 1, 1]
    - [25, 0.715]
  - - [2368, 2944, 1, 32]
    - [24, 46.254]
  - - [4288, 704, 1, 256]
    - [21, 53.807]
  - - [1856, 1024, 1, 256]
    - [14, 50.209]
  - - [704, 6784, 1, 32]
    - [34, 36.992]
  - - [1024, 4288, 1, 1]
    - [34, 1.861]
  - - [1408, 5888, 1, 1280]
    - [12, 70.672]
  - - [5056, 1856, 1, 256]
    - [28, 65.088]
  - - [6784, 704, 1, 1280]
    - [28, 64.292]
  - - [5888, 1024, 1, 256]
    - [38, 65.524]
  - - [6784, 1856, 1, 3328]
    - [12, 71.062]
  - - [2368, 5888, 1, 1280]
    - [30, 71.161]
  - - [5888, 6784, 1, 32]
    - [9, 63.654]
  - - [6784, 6784, 1, 32]
    - [42, 65.58]
  - - [6784, 256, 1, 256]
    - [22, 55.72]
  - - [2368, 3584, 1, 3328]
    - [23, 70.811]
  - - [5888, 1024, 1, 1280]
    - [28, 67.685]
  - - [5888, 6784, 1, 3328]
    - [23, 77.123]
  - - [6784, 448, 1, 1]
    - [8, 1.356]
  - - [6784, 1856, 1, 1]
    - [8, 2.36]
  - - [2944, 2368, 1, 1280]
    - [28, 66.094]
  - - [6784, 448, 1, 32]
    - [17, 39.602]
  - - [6784, 448, 1, 3328]
    - [28, 61.655]
  - - [448, 3584, 1, 1280]
    - [40, 50.493]
  - - [1408, 6784, 1, 1280]
    - [23, 70.349]
  - - [5056, 5888, 1, 1280]
    - [30, 76.546]
  - - [5888, 704, 1, 1]
    - [8, 1.827]
  - - [3584, 1856, 1, 1]
    - [41, 2.001]
  - - [5056, 2944, 1, 32]
    - [24, 53.193]
  - - [4288, 6784, 1, 1]
    - [0, 2.45]
  - - [1024, 6784, 1, 1]
    - [34, 2.118]
  - - [2368, 5888, 1, 32]
    - [0, 52.476]
  - - [3584, 4288, 1, 1]
    - [41, 2.333]
  - - [5888, 1024, 1, 3328]
    - [28, 68.265]
  - - [6784, 5888, 1, 256]
    - [40, 75.616]
  - - [5056, 1024, 1, 1]
    - [41, 1.712]
  - - [4288, 2368, 1, 32]
    - [34, 49.999]
  - - [704, 3584, 1, 1]
    - [41, 1.126]
  - - [6784, 704, 1, 32]
    - [17, 45.724]
  - - [704, 5888, 1, 256]
    - [23, 59.223]
  - - [2368, 3584, 1, 1280]
    - [23, 70.245]
  - - [3584, 5056, 1, 32]
    - [34, 56.045]
  - - [6784, 1856, 1, 1280]
    - [40, 69.415]
  - - [5056, 5056, 1, 3328]
    - [23, 74.782]
  - - [2368, 5056, 1, 1]
    - [41, 2.154]
  - - [5888, 1408, 1, 256]
    - [21, 68.161]
  - - [2368, 1024, 1, 32]
    - [17, 30.817]
  - - [4288, 1024, 1, 256]
    - [14, 63.904]
  - - [4288, 5888, 1, 1280]
    - [23, 76.411]
  - - [1856, 2944, 1, 3328]
    - [23, 69.077]
  - - [5056, 5888, 1, 256]
    - [14, 73.44]
  - - [5056, 256, 1, 3328]
    - [5, 50.452]
  - - [1024, 5888, 1, 1280]
    - [44, 67.836]
  - - [5888, 5056, 1, 1280]
    - [23, 76.442]
  - - [5888, 2944, 1, 1]
    - [0, 2.421]
  - - [1408, 4288, 1, 3328]
    - [44, 68.001]
  - - [704, 2944, 1, 32]
    - [34, 27.104]
  - - [2944, 4288, 1, 3328]
    - [46, 76.151]
  - - [5056, 2944, 1, 256]
    - [28, 69.011]
  - - [2368, 1856, 1, 256]
    - [28, 58.481]
  - - [2368, 4288, 1, 1280]
    - [14, 70.839]
  - - [3584, 448, 1, 256]
    - [27, 46.974]
  - - [256, 6784, 1, 256]
    - [22, 55.72]
  - - [1024, 1408, 1, 1]
    - [22, 1.121]
  - - [256, 5888, 1, 1]
    - [1, 1.042]
  - - [2944, 2944, 1, 1]
    - [8, 2.258]
  - - [6784, 3584, 1, 256]
    - [23, 75.046]
  - - [1408, 1856, 1, 256]
    - [12, 50.405]
  - - [2944, 2944, 1, 32]
    - [17, 52.844]
  - - [2944, 2944, 1, 3328]
    - [28, 72.188]
  - - [6784, 1408, 1, 32]
    - [34, 53.123]
  - - [2368, 6784, 1, 3328]
    - [7, 72.034]
  - - [4288, 3584, 1, 32]
    - [17, 53.75]
  - - [3584, 704, 1, 1280]
    - [28, 58.774]
  - - [448, 5056, 1, 3328]
    - [44, 54.725]
  - - [4288, 448, 1, 256]
    - [21, 48.487]
  - - [5056, 256, 1, 1280]
    - [5, 48.677]
  - - [2944, 5888, 1, 32]
    - [17, 57.77]
  - - [3584, 5056, 1, 256]
    - [44, 69.302]
  - - [3584, 2368, 1, 256]
    - [28, 66.072]
  - - [4288, 4288, 1, 256]
    - [7, 69.684]
  - - [448, 5056, 1, 256]
    - [28, 47.154]
  - - [4288, 704, 1, 1280]
    - [44, 59.695]
  - - [2368, 704, 1, 1]
    - [0, 1.056]
  - - [1408, 1856, 1, 1280]
    - [28, 60.922]
  - - [3584, 4288, 1, 3328]
    - [30, 73.16]
  - - [448, 4288, 1, 32]
    - [41, 22.013]
  - - [448, 4288, 1, 1280]
    - [23, 60.371]
  - - [5056, 1024, 1, 256]
    - [12, 65.027]
  - - [4288, 3584, 1, 1280]
    - [23, 73.004]
  - - [1856, 3584, 1, 32]
    - [17, 45.645]
  - - [5056, 3584, 1, 3328]
    - [23, 75.4]
  - - [4288, 5056, 1, 256]
    - [14, 71.536]
  - - [1856, 5888, 1, 256]
    - [30, 68.095]
  - - [2368, 3584, 1, 1]
    - [0, 2.055]
  - - [4288, 2368, 1, 256]
    - [44, 66.41]
  - - [1408, 2944, 1, 3328]
    - [40, 68.38]
  - - [5888, 3584, 1, 1]
    - [0, 2.493]
  - - [6784, 5056, 1, 3328]
    - [23, 77.326]
  - - [6784, 5056, 1, 1]
    - [17, 2.506]
  - - [5888, 3584, 1, 32]
    - [8, 56.505]
  - - [5888, 3584, 1, 3328]
    - [7, 78.299]
  - - [1024, 6784, 1, 256]
    - [5, 68.531]
  - - [6784, 5888, 1, 32]
    - [35, 62.602]
  - - [2368, 6784, 1, 32]
    - [8, 53.292]
  - - [5056, 1408, 1, 1280]
    - [12, 67.671]
  - - [3584, 1408, 1, 3328]
    - [12, 69.174]
  - - [2944, 3584, 1, 1]
    - [0, 2.281]
  - - [2944, 1408, 1, 1280]
    - [23, 66.295]
  - - [3584, 1024, 1, 1]
    - [25, 1.71]
  - - [2944, 1856, 1, 3328]
    - [44, 67.671]
  - - [2944, 3584, 1, 32]
    - [0, 54.251]
  - - [5888, 256, 1, 32]
    - [0, 27.758]
  - - [6784, 5056, 1, 256]
    - [14, 73.045]
  - - [1856, 3584, 1, 1280]
    - [23, 72.634]
  - - [256, 5888, 1, 256]
    - [5, 51.752]
  - - [1024, 4288, 1, 3328]
    - [23, 71.727]
  - - [2368, 1408, 1, 1]
    - [8, 1.511]
  - - [1024, 1856, 1, 32]
    - [34, 29.956]
  - - [5888, 2368, 1, 1]
    - [41, 2.393]
  - - [2368, 2368, 1, 1]
    - [8, 1.881]
  - - [704, 4288, 1, 256]
    - [46, 54.073]
  - - [5888, 2368, 1, 32]
    - [8, 55.792]
  - - [5888, 2368, 1, 1280]
    - [23, 71.269]
  - - [2944, 5056, 1, 3328]
    - [23, 76.277]
  - - [6784, 704, 1, 3328]
    - [28, 65.35]
  - - [1856, 1856, 1, 32]
    - [17, 35.934]
  - - [4288, 2944, 1, 32]
    - [0, 51.896]
  - - [256, 5056, 1, 1]
    - [0, 0.911]
  - - [5056, 5056, 1, 256]
    - [14, 70.906]
  - - [5888, 256, 1, 256]
    - [12, 51.325]
  - - [6784, 6784, 1, 256]
    - [30, 73.828]
  - - [3584, 704, 1, 3328]
    - [28, 60.477]
  - - [4288, 704, 1, 3328]
    - [44, 60.947]
  - - [4288, 2944, 1, 1280]
    - [12, 71.466]
  - - [448, 3584, 1, 256]
    - [23, 42.302]
  - - [6784, 256, 1, 32]
    - [41, 31.499]
  - - [6784, 1408, 1, 1280]
    - [12, 70.063]
  - - [2368, 5056, 1, 1280]
    - [23, 72.258]
  - - [1408, 1408, 1, 1280]
    - [46, 61.804]
  - - [5888, 1856, 1, 32]
    - [34, 54.181]
  - - [5888, 704, 1, 3328]
    - [7, 65.646]
  - - [448, 6784, 1, 256]
    - [40, 55.298]
  - - [2944, 5888, 1, 256]
    - [30, 73.803]
  - - [1856, 1408, 1, 32]
    - [0, 32.525]
  - - [5888, 2944, 1, 1280]
    - [28, 72.53]
  - - [448, 5888, 1, 1]
    - [41, 0.846]
  - - [3584, 1408, 1, 1]
    - [41, 1.843]
  - - [448, 5888, 1, 32]
    - [37, 25.056]
  - - [5056, 704, 1, 1280]
    - [44, 61.317]
  - - [1856, 6784, 1, 1]
    - [17, 2.199]
  - - [2368, 1024, 1, 256]
    - [22, 47.436]
  - - [1856, 6784, 1, 32]
    - [17, 51.179]
  - - [1856, 6784, 1, 1280]
    - [12, 70.347]
  - - [5888, 5056, 1, 3328]
    - [23, 77.006]
  - - [1408, 6784, 1, 32]
    - [17, 49.749]
  - - [3584, 5888, 1, 3328]
    - [23, 78.822]
  - - [4288, 1408, 1, 256]
    - [12, 62.936]
  - - [6784, 2368, 1, 256]
    - [21, 68.578]
  - - [1856, 1408, 1, 1280]
    - [28, 61.168]
  - - [1856, 2368, 1, 1]
    - [8, 1.721]
  - - [1408, 5056, 1, 3328]
    - [28, 68.326]
  - - [5056, 4288, 1, 256]
    - [46, 71.308]
  - - [5056, 5056, 1, 32]
    - [17, 56.674]
  - - [448, 5888, 1, 1280]
    - [23, 55.718]
  - - [5056, 448, 1, 256]
    - [27, 48.882]
  - - [4288, 5888, 1, 1]
    - [41, 2.423]
  - - [1856, 5056, 1, 1280]
    - [30, 69.032]
  - - [2368, 4288, 1, 1]
    - [0, 2.136]
  - - [3584, 1856, 1, 256]
    - [28, 63.539]
  - - [4288, 5888, 1, 32]
    - [0, 56.956]
  - - [4288, 5888, 1, 3328]
    - [23, 76.938]
  - - [1024, 2944, 1, 3328]
    - [23, 65.725]
  - - [2944, 2368, 1, 256]
    - [38, 63.742]
  - - [1024, 1856, 1, 256]
    - [30, 50.579]
  - - [1024, 5888, 1, 32]
    - [34, 46.8]
  - - [1024, 5888, 1, 3328]
    - [28, 68.344]
  - - [5056, 2368, 1, 32]
    - [24, 52.571]
  - - [1408, 2368, 1, 1280]
    - [44, 65.788]
  - - [5056, 6784, 1, 3328]
    - [23, 77.013]
  - - [1408, 2944, 1, 256]
    - [28, 58.873]
  - - [704, 5056, 1, 32]
    - [41, 31.722]
  - - [5056, 4288, 1, 1280]
    - [23, 76.095]
  - - [4288, 448, 1, 1]
    - [0, 1.123]
  - - [5888, 5888, 1, 1]
    - [34, 2.551]
  - - [2944, 704, 1, 1280]
    - [46, 63.597]
  - - [1024, 3584, 1, 1280]
    - [44, 63.884]
  - - [2368, 2944, 1, 1]
    - [0, 1.99]
  - - [5056, 256, 1, 32]
    - [8, 20.136]
  - - [5056, 1024, 1, 1280]
    - [44, 69.514]
  - - [3584, 6784, 1, 256]
    - [30, 72.235]
  - - [1856, 1408, 1, 256]
    - [39, 51.648]
  - - [4288, 4288, 1, 32]
    - [34, 54.892]
  - - [5888, 448, 1, 1]
    - [8, 1.645]
  - - [5056, 5056, 1, 1280]
    - [23, 74.193]
  - - [6784, 1408, 1, 3328]
    - [28, 70.602]
  - - [5888, 5888, 1, 3328]
    - [7, 78.062]
  - - [5888, 1408, 1, 32]
    - [0, 47.42]
  - - [256, 6784, 1, 3328]
    - [29, 61.781]
  - - [6784, 2368, 1, 1280]
    - [28, 71.5]
  - - [2944, 1408, 1, 1]
    - [25, 1.791]
  - - [6784, 1024, 1, 256]
    - [40, 69.528]
  - - [5056, 1408, 1, 32]
    - [17, 46.214]
  - - [1408, 6784, 1, 3328]
    - [23, 71.233]
  - - [2944, 1408, 1, 3328]
    - [23, 68.258]
  - - [704, 2368, 1, 32]
    - [41, 23.055]
  - - [704, 6784, 1, 1]
    - [41, 1.489]
  - - [2368, 6784, 1, 256]
    - [12, 68.477]
  - - [1856, 3584, 1, 3328]
    - [23, 73.776]
  - - [704, 6784, 1, 256]
    - [44, 59.417]
  - - [6784, 2944, 1, 32]
    - [35, 58.465]
  - - [5888, 2368, 1, 3328]
    - [23, 71.935]
  - - [2368, 704, 1, 1280]
    - [30, 51.792]
  - - [1024, 1408, 1, 1280]
    - [12, 55.449]
  - - [2944, 5056, 1, 32]
    - [0, 56.613]
  - - [704, 2368, 1, 3328]
    - [23, 54.217]
  - - [3584, 2944, 1, 256]
    - [44, 70.575]
  - - [3584, 1024, 1, 1280]
    - [44, 63.909]
  - - [5056, 3584, 1, 256]
    - [14, 71.971]
  - - [2368, 704, 1, 256]
    - [27, 45.029]
  - - [1856, 1856, 1, 1280]
    - [44, 59.327]
  - - [4288, 704, 1, 1]
    - [0, 1.469]
  - - [1856, 1024, 1, 1]
    - [17, 1.164]
  - - [4288, 2944, 1, 3328]
    - [28, 71.978]
  - - [4288, 704, 1, 32]
    - [17, 34.81]
  - - [1856, 1024, 1, 32]
    - [8, 27.007]
  - - [2944, 6784, 1, 1]
    - [8, 2.484]
  - - [6784, 2368, 1, 32]
    - [0, 56.845]
  - - [5888, 5056, 1, 1]
    - [4, 2.502]
  - - [704, 5888, 1, 1]
    - [34, 1.378]
  - - [6784, 6784, 1, 1]
    - [8, 2.592]
  - - [5888, 448, 1, 3328]
    - [44, 53.874]
  - - [704, 5888, 1, 32]
    - [41, 34.395]
  - - [704, 5888, 1, 1280]
    - [23, 66.821]
  - - [1024, 6784, 1, 3328]
    - [23, 76.566]
  - - [704, 2944, 1, 1280]
    - [23, 64.615]
  - - [4288, 6784, 1, 256]
    - [46, 71.811]
  - - [1408, 1408, 1, 32]
    - [17, 34.073]
  - - [1408, 1408, 1, 3328]
    - [23, 63.904]
  - - [2944, 1856, 1, 256]
    - [38, 61.969]
  - - [4288, 2944, 1, 1]
    - [8, 2.215]
  - - [6784, 5056, 1, 32]
    - [34, 60.274]
  - - [2944, 4288, 1, 1280]
    - [23, 75.271]
  - - [1024, 4288, 1, 256]
    - [28, 60.606]
  - - [2368, 5888, 1, 1]
    - [8, 2.242]
  - - [1408, 1856, 1, 32]
    - [17, 39.631]
  - - [1856, 6784, 1, 3328]
    - [30, 70.439]
  - - [1024, 2368, 1, 32]
    - [34, 32.78]
  - - [2368, 2368, 1, 3328]
    - [28, 66.11]
  - - [3584, 5888, 1, 32]
    - [34, 56.545]
  - - [3584, 5888, 1, 1280]
    - [23, 77.947]
  - - [6784, 704, 1, 256]
    - [21, 59.519]
  - - [3584, 1024, 1, 32]
    - [34, 39.899]
  - - [2368, 5888, 1, 256]
    - [14, 67.892]
  - - [5888, 5888, 1, 32]
    - [35, 63.647]
  - - [1856, 1408, 1, 3328]
    - [28, 62.708]
  - - [4288, 1024, 1, 1]
    - [0, 1.701]
  - - [704, 4288, 1, 3328]
    - [23, 65.756]
  - - [2944, 5056, 1, 1280]
    - [7, 75.474]
  - - [6784, 2944, 1, 1280]
    - [7, 74.116]
  - - [6784, 256, 1, 3328]
    - [22, 61.716]
  - - [1408, 5056, 1, 32]
    - [17, 50.881]
  - - [5888, 1856, 1, 1280]
    - [44, 68.231]
  - - [5888, 256, 1, 1280]
    - [12, 57.879]
  - - [1856, 5056, 1, 1]
    - [0, 2.1]
  - - [3584, 1856, 1, 1280]
    - [44, 68.247]
  - - [6784, 448, 1, 256]
    - [12, 51.023]
  - - [704, 3584, 1, 256]
    - [44, 51.928]
  - - [1856, 5056, 1, 32]
    - [0, 48.456]
  - - [1856, 5056, 1, 3328]
    - [23, 70.099]
  - - [1024, 2944, 1, 32]
    - [18, 34.433]
  - - [1408, 6784, 1, 256]
    - [28, 67.967]
  - - [1024, 2368, 1, 1280]
    - [44, 57.27]
  - - [1856, 3584, 1, 1]
    - [8, 1.913]
  - - [2944, 5888, 1, 1280]
    - [23, 76.69]
  - - [3584, 3584, 1, 256]
    - [30, 73.782]
  - - [1856, 2368, 1, 3328]
    - [44, 67.387]
  - - [5888, 704, 1, 256]
    - [21, 57.351]
  - - [6784, 4288, 1, 256]
    - [14, 72.057]
  - - [1408, 2368, 1, 3328]
    - [44, 67.229]
  - - [1024, 3584, 1, 256]
    - [5, 60.798]
  - - [4288, 1024, 1, 32]
    - [8, 40.847]
  - - [5888, 1856, 1, 3328]
    - [44, 68.558]
  - - [2368, 3584, 1, 256]
    - [38, 66.09]
  - - [4288, 1408, 1, 3328]
    - [44, 68.044]
  - - [256, 5056, 1, 256]
    - [37, 44.177]
  - - [5888, 2944, 1, 3328]
    - [30, 72.927]
  - - [2368, 1408, 1, 3328]
    - [28, 67.394]
  - - [5888, 704, 1, 32]
    - [41, 44.134]
  - - [2944, 704, 1, 1]
    - [41, 1.471]
  - - [6784, 1856, 1, 256]
    - [21, 65.995]
  - - [1856, 1856, 1, 1]
    - [41, 1.511]
  - - [2944, 704, 1, 3328]
    - [46, 66.286]
  - - [2368, 1856, 1, 32]
    - [34, 39.757]
  - - [5056, 4288, 1, 3328]
    - [23, 76.677]
  - - [3584, 448, 1, 3328]
    - [40, 51.312]
  - - [256, 6784, 1, 1]
    - [1, 1.146]
  - - [1024, 3584, 1, 32]
    - [41, 40.019]
  - - [256, 6784, 1, 32]
    - [18, 30.727]
  - - [2944, 1408, 1, 32]
    - [17, 43.874]
  - - [4288, 3584, 1, 1]
    - [0, 2.29]
  - - [5056, 448, 1, 3328]
    - [44, 54.515]
  - - [6784, 3584, 1, 32]
    - [42, 61.411]
  - - [4288, 1856, 1, 256]
    - [28, 63.958]
  - - [1856, 2944, 1, 256]
    - [30, 61.824]
  - - [2944, 5888, 1, 1]
    - [0, 2.457]
  - - [1024, 1856, 1, 3328]
    - [23, 61.544]
  - - [5888, 1024, 1, 32]
    - [34, 48.253]
  - - [1408, 5056, 1, 1280]
    - [30, 67.434]
  - - [5056, 6784, 1, 256]
    - [30, 73.045]
  - - [2944, 5056, 1, 1]
    - [24, 2.405]
  - - [5888, 5888, 1, 1280]
    - [23, 77.69]
  - - [5056, 2944, 1, 1280]
    - [12, 71.527]
  - - [2368, 1856, 1, 1280]
    - [44, 66.304]
  - - [6784, 2944, 1, 1]
    - [0, 2.484]
  - - [2944, 1024, 1, 32]
    - [17, 39.141]
  - - [2944, 1024, 1, 1280]
    - [28, 60.789]
  - - [5056, 5056, 1, 1]
    - [34, 2.4]
  - - [2368, 4288, 1, 256]
    - [38, 66.153]
  - - [2944, 6784, 1, 1280]
    - [23, 74.355]
  - - [256, 6784, 1, 1280]
    - [6, 61.17]
  - - [3584, 2368, 1, 32]
    - [34, 50.633]
  - - [6784, 3584, 1, 3328]
    - [23, 78.111]
  - - [2944, 2944, 1, 256]
    - [38, 69.077]
  - - [1408, 1024, 1, 3328]
    - [28, 56.399]
  - - [5056, 2368, 1, 1280]
    - [28, 68.274]
  - - [2944, 1024, 1, 1]
    - [41, 1.626]
  - - [3584, 704, 1, 256]
    - [44, 50.985]
  - - [2368, 5888, 1, 3328]
    - [40, 71.766]
  - - [4288, 2368, 1, 1]
    - [0, 2.15]
  - - [1408, 3584, 1, 32]
    - [8, 46.464]
  - - [2944, 4288, 1, 32]
    - [8, 55.23]
  - - [5888, 1408, 1, 1280]
    - [28, 71.127]
  - - [3584, 5056, 1, 1280]
    - [30, 74.624]
  - - [5888, 6784, 1, 1280]
    - [23, 76.702]
  - - [3584, 2944, 1, 1]
    - [41, 2.152]
  - - [1024, 1856, 1, 1]
    - [41, 1.34]
  - - [704, 5056, 1, 3328]
    - [44, 62.232]
  - - [1024, 3584, 1, 3328]
    - [28, 64.716]
  - - [5888, 256, 1, 3328]
    - [28, 59.038]
  - - [1856, 1408, 1, 1]
    - [0, 1.315]
  - - [4288, 5056, 1, 1280]
    - [23, 76.027]
  - - [1856, 1856, 1, 3328]
    - [44, 60.432]
  - - [1024, 2368, 1, 256]
    - [44, 50.299]
  - - [4288, 2368, 1, 3328]
    - [28, 70.43]
  - - [5888, 3584, 1, 256]
    - [23, 74.949]
  - - [1024, 5056, 1, 32]
    - [41, 44.492]
  - - [5888, 448, 1, 1280]
    - [44, 53.004]
  - - [704, 5888, 1, 3328]
    - [23, 68.364]
  - - [1024, 1408, 1, 256]
    - [44, 49.327]
  - - [3584, 2944, 1, 1280]
    - [44, 72.835]
  - - [4288, 1856, 1, 1280]
    - [23, 65.781]
  - - [3584, 5888, 1, 1]
    - [34, 2.421]
  - - [5888, 4288, 1, 256]
    - [46, 71.854]
  - - [1024, 2944, 1, 1280]
    - [40, 64.062]
  - - [2944, 3584, 1, 256]
    - [30, 70.656]
  - - [5888, 1856, 1, 1]
    - [0, 2.312]
  - - [6784, 2368, 1, 3328]
    - [44, 72.018]
  - - [1408, 4288, 1, 32]
    - [17, 48.533]
  - - [1856, 1024, 1, 1280]
    - [40, 59.911]
  - - [5888, 1856, 1, 256]
    - [28, 65.576]
  - - [5056, 1856, 1, 1]
    - [41, 2.087]
  - - [5888, 2368, 1, 256]
    - [38, 67.055]
  - - [1408, 1024, 1, 32]
    - [17, 29.074]
  - - [5056, 1856, 1, 32]
    - [41, 48.803]
  - - [5056, 1856, 1, 1280]
    - [40, 68.562]
  - - [1408, 5888, 1, 3328]
    - [44, 71.373]
  - - [5056, 704, 1, 3328]
    - [44, 62.185]
  - - [5888, 6784, 1, 1]
    - [34, 2.565]
  - - [5888, 4288, 1, 32]
    - [34, 58.567]
  - - [1408, 3584, 1, 256]
    - [28, 65.312]
  - - [6784, 256, 1, 1]
    - [41, 1.315]
  - - [6784, 256, 1, 1280]
    - [39, 61.156]
  - - [2368, 704, 1, 3328]
    - [30, 53.904]
  - - [2944, 1856, 1, 32]
    - [17, 48.102]
  - - [2368, 1408, 1, 256]
    - [39, 56.169]
  - - [2368, 1856, 1, 1]
    - [8, 1.714]
  - - [4288, 1408, 1, 1]
    - [0, 1.929]
  - - [3584, 2368, 1, 1280]
    - [23, 70.105]
  - - [1408, 2944, 1, 1]
    - [41, 1.863]
  - - [4288, 1408, 1, 32]
    - [0, 44.565]
  - - [5888, 2944, 1, 256]
    - [28, 70.647]
  - - [1408, 2944, 1, 32]
    - [0, 44.395]
  - - [5888, 6784, 1, 256]
    - [46, 73.552]
  - - [6784, 5888, 1, 1]
    - [43, 2.581]
  - - [6784, 5888, 1, 1280]
    - [23, 77.983]
  - - [1024, 4288, 1, 32]
    - [34, 41.488]
  - - [3584, 5888, 1, 256]
    - [30, 74.895]
  - - [5056, 2368, 1, 1]
    - [41, 2.188]
  - - [5056, 448, 1, 1]
    - [41, 1.266]
  - - [2368, 1024, 1, 1280]
    - [28, 56.85]
  - - [1856, 6784, 1, 256]
    - [28, 66.489]
  - - [5056, 448, 1, 32]
    - [0, 29.304]
  - - [3584, 2944, 1, 32]
    - [34, 51.885]
  - - [3584, 1856, 1, 32]
    - [34, 47.263]
  - - [4288, 1408, 1, 1280]
    - [28, 67.139]
  - - [6784, 2368, 1, 1]
    - [41, 2.432]
  - - [704, 5056, 1, 1]
    - [41, 1.32]
  - - [2368, 1408, 1, 1280]
    - [28, 65.716]
  - - [5888, 1408, 1, 1]
    - [8, 2.227]
  - - [1024, 4288, 1, 1280]
    - [30, 69.375]
  - - [1856, 4288, 1, 1]
    - [0, 2.035]
  - - [3584, 4288, 1, 256]
    - [12, 68.05]
  - - [2368, 2944, 1, 256]
    - [38, 62.187]
  - - [704, 5056, 1, 256]
    - [28, 55.287]
  - - [1856, 4288, 1, 32]
    - [8, 47.168]
  - - [4288, 1024, 1, 1280]
    - [40, 68.63]
  - - [4288, 6784, 1, 32]
    - [0, 57.594]
  - - [3584, 1408, 1, 256]
    - [44, 65.607]
  - - [704, 3584, 1, 3328]
    - [44, 60.834]
  - - [5056, 448, 1, 1280]
    - [28, 53.331]
  - - [1408, 2944, 1, 1280]
    - [40, 66.769]
  - - [5888, 704, 1, 1280]
    - [46, 64.398]
  - - [4288, 5888, 1, 256]
    - [14, 73.505]
  - - [3584, 3584, 1, 3328]
    - [23, 78.651]
  - - [2944, 6784, 1, 32]
    - [9, 58.991]
  - - [5056, 256, 1, 1]
    - [41, 0.859]
  - - [2944, 2368, 1, 3328]
    - [28, 67.004]
  - - [1024, 1856, 1, 1280]
    - [23, 59.78]
  - - [448, 5888, 1, 256]
    - [23, 48.95]
  - - [1024, 5888, 1, 256]
    - [12, 65.034]
  - - [6784, 2944, 1, 3328]
    - [23, 74.764]
  - - [1408, 2368, 1, 256]
    - [28, 58.668]
  - - [1408, 5056, 1, 256]
    - [28, 63.719]
  - - [1024, 1408, 1, 32]
    - [18, 26.687]
  - - [6784, 704, 1, 1]
    - [41, 1.967]
  - - [704, 3584, 1, 32]
    - [0, 28.282]
  - - [4288, 4288, 1, 1]
    - [0, 2.355]
  - - [5056, 2944, 1, 1]
    - [24, 2.251]
  - - [6784, 4288, 1, 3328]
    - [23, 76.063]
  - - [5056, 2944, 1, 3328]
    - [28, 71.951]
  - - [2368, 1856, 1, 3328]
    - [44, 67.507]
  - - [1856, 4288, 1, 1280]
    - [23, 66.21]
  - - [3584, 448, 1, 1]
    - [41, 1.232]
  - - [2944, 1024, 1, 3328]
    - [44, 61.975]
  - - [5888, 5056, 1, 32]
    - [34, 59.927]
  - - [704, 2944, 1, 1]
    - [41, 0.981]
  - - [3584, 448, 1, 32]
    - [34, 29.568]
  - - [3584, 448, 1, 1280]
    - [27, 49.918]
  - - [2944, 6784, 1, 3328]
    - [23, 74.962]
  - - [1856, 2368, 1, 1280]
    - [28, 66.137]
  - - [6784, 1024, 1, 1280]
    - [23, 74.258]
  - - [6784, 3584, 1, 1280]
    - [7, 77.696]
  - - [1408, 1408, 1, 1]
    - [8, 1.381]
  - - [1408, 4288, 1, 256]
    - [28, 62.711]
  - - [256, 5056, 1, 3328]
    - [44, 50.197]
  - - [448, 6784, 1, 1]
    - [25, 0.956]
  - - [704, 2944, 1, 256]
    - [23, 51.77]
  - - [1408, 1408, 1, 256]
    - [44, 53.902]
  - - [448, 6784, 1, 32]
    - [34, 27.562]
  - - [1408, 1856, 1, 1]
    - [41, 1.62]
  - - [4288, 448, 1, 32]
    - [0, 27.959]
  - - [4288, 448, 1, 1280]
    - [7, 58.736]
  - - [2944, 704, 1, 32]
    - [17, 35.453]
  - - [448, 4288, 1, 1]
    - [25, 0.772]
  - - [3584, 5056, 1, 1]
    - [34, 2.373]
  - - [1408, 3584, 1, 1280]
    - [28, 68.513]
  - - [6784, 448, 1, 1280]
    - [44, 60.38]
  - - [3584, 5056, 1, 3328]
    - [23, 75.82]
  - - [2368, 2368, 1, 32]
    - [8, 42.789]
  - - [5888, 2944, 1, 32]
    - [41, 57.087]
  - - [1856, 2944, 1, 32]
    - [8, 42.505]
  - - [5056, 1408, 1, 1]
    - [41, 1.963]
  - - [5888, 1408, 1, 3328]
    - [28, 71.493]
  - - [448, 4288, 1, 256]
    - [30, 49.615]
  - - [6784, 1024, 1, 1]
    - [41, 2.141]
  - - [6784, 1024, 1, 32]
    - [17, 50.046]
  - - [6784, 3584, 1, 1]
    - [24, 2.511]
  - - [2944, 2368, 1, 32]
    - [17, 50.527]
  - - [3584, 6784, 1, 3328]
    - [23, 78.089]
  - - [6784, 1408, 1, 256]
    - [38, 67.899]
  - - [5056, 1024, 1, 32]
    - [17, 42.665]
  - - [1024, 5056, 1, 1280]
    - [44, 70.008]
  - - [4288, 3584, 1, 256]
    - [14, 69.893]
  - - [448, 6784, 1, 1280]
    - [30, 64.188]
  - - [1856, 5888, 1, 1]
    - [41, 2.159]
  - - [256, 5888, 1, 32]
    - [8, 27.068]
  - - [4288, 5056, 1, 32]
    - [0, 56.094]
  - - [4288, 5056, 1, 3328]
    - [23, 76.997]
  - - [1856, 5888, 1, 32]
    - [8, 50.57]
  - - [1856, 5888, 1, 1280]
    - [23, 72.641]
  - - [704, 2368, 1, 1280]
    - [23, 52.713]
  - - [4288, 2368, 1, 1280]
    - [44, 69.839]
  - - [2944, 5056, 1, 256]
    - [14, 70.356]
  - - [2944, 4288, 1, 1]
    - [0, 2.369]
  - - [5056, 5888, 1, 32]
    - [41, 57.369]
  - - [2368, 5056, 1, 3328]
    - [23, 72.749]
  - - [1024, 5056, 1, 3328]
    - [44, 71.048]
  - - [1024, 6784, 1, 32]
    - [34, 48.686]
  - - [3584, 2944, 1, 3328]
    - [28, 73.248]
  - - [1408, 5888, 1, 1]
    - [24, 2.215]
  - - [704, 4288, 1, 32]
    - [34, 30.955]
  - - [1408, 5888, 1, 32]
    - [0, 52.589]
  - - [6784, 1024, 1, 3328]
    - [40, 74.802]
  - - [5056, 1408, 1, 256]
    - [12, 65.235]
  - - [2944, 1408, 1, 256]
    - [38, 60.757]
  - - [2368, 2368, 1, 256]
    - [38, 60.78]
  - - [1408, 6784, 1, 1]
    - [41, 2.274]
  - - [6784, 6784, 1, 1280]
    - [23, 76.771]
  - - [1024, 5888, 1, 1]
    - [41, 1.843]
  - - [1856, 3584, 1, 256]
    - [30, 66.119]
  - - [2368, 704, 1, 32]
    - [0, 25.175]
  - - [256, 5888, 1, 1280]
    - [28, 57.908]
  - - [1856, 1024, 1, 3328]
    - [40, 61.896]
  - - [5056, 2368, 1, 3328]
    - [28, 68.977]
  - - [704, 4288, 1, 1280]
    - [23, 64.141]
  - - [2560, 7000, 1, 2560]
    - [30, 74.922]
  - - [7680, 12000, 1, 2560]
    - [14, 78.29]
  - - [5124, 9124, 1, 1760]
    - [19, 80.004]
  - - [512, 24000, 1, 1536]
    - [30, 73.476]
  - - [3072, 24000, 1, 1024]
    - [14, 76.417]
  - - [512, 48000, 1, 2816]
    - [7, 77.577]
  - - [512, 48000, 1, 2048]
    - [28, 72.715]
  - - [2048, 1600, 1, 2048]
    - [29, 55.054]
  - - [512, 48000, 1, 1536]
    - [30, 75.355]
  - - [8448, 5984, 1, 2816]
    - [7, 76.568]
  - - [4096, 3200, 1, 1024]
    - [28, 70.733]
  - - [1024, 24000, 1, 2560]
    - [14, 76.456]
  - - [1760, 6400, 1, 1760]
    - [19, 79.269]
  - - [5124, 9124, 1, 2048]
    - [14, 74.326]
  - - [16384, 3200, 1, 4096]
    - [12, 69.74]
  - - [1024, 48000, 1, 2560]
    - [14, 77.331]
  - - [8448, 48000, 1, 2816]
    - [23, 79.433]
  - - [2560, 3200, 1, 2560]
    - [28, 70.836]
  - - [16384, 800, 1, 4096]
    - [12, 59.972]
  - - [4608, 24000, 1, 1536]
    - [30, 78.231]
  - - [7680, 48000, 1, 2560]
    - [14, 78.815]
  - - [3072, 48000, 1, 1024]
    - [14, 77.317]
  - - [8192, 3200, 1, 2048]
    - [14, 74.446]
  - - [512, 24000, 1, 2816]
    - [40, 73.925]
  - - [4096, 400, 1, 1024]
    - [30, 47.908]
  - - [6144, 48000, 1, 2560]
    - [14, 78.671]
  - - [4608, 48000, 1, 1536]
    - [30, 77.769]
  - - [2048, 800, 1, 512]
    - [46, 47.572]
  - - [4608, 5984, 1, 1536]
    - [30, 76.505]
  - - [4096, 1600, 1, 1024]
    - [28, 64.885]
  - - [6144, 5984, 1, 2048]
    - [14, 76.284]
  - - [7680, 24000, 1, 2560]
    - [14, 78.639]
  - - [6144, 48000, 1, 2048]
    - [14, 75.871]
  - - [2048, 3200, 1, 2048]
    - [14, 70.148]
  - - [5124, 9124, 1, 2560]
    - [14, 74.956]
  - - [1024, 24000, 1, 1536]
    - [30, 77.344]
  - - [2560, 6400, 1, 2560]
    - [30, 78.044]
  - - [512, 24000, 1, 2560]
    - [30, 72.988]
  - - [1024, 24000, 1, 2816]
    - [23, 78.023]
  - - [7680, 5984, 1, 2560]
    - [14, 76.528]
  - - [2048, 1600, 1, 512]
    - [44, 58.896]
  - - [2048, 7000, 1, 2048]
    - [14, 73.036]
  - - [1760, 800, 1, 1760]
    - [35, 58.219]
  - - [2560, 1600, 1, 2560]
    - [46, 66.949]
  - - [2048, 3200, 1, 512]
    - [28, 66.88]
  - - [2560, 800, 1, 2560]
    - [44, 61.123]
  - - [4608, 12000, 1, 1536]
    - [30, 77.462]
  - - [6144, 24000, 1, 2048]
    - [14, 75.601]
  - - [8192, 800, 1, 2048]
    - [12, 58.149]
  - - [5124, 9124, 1, 4096]
    - [30, 68.883]
  - - [8448, 24000, 1, 2816]
    - [23, 79.316]
  - - [1024, 48000, 1, 1536]
    - [14, 76.228]
  - - [8192, 1600, 1, 2048]
    - [14, 65.754]
  - - [4096, 800, 1, 1024]
    - [28, 56.06]
  - - [2048, 800, 1, 2048]
    - [14, 51.916]
  - - [1760, 3200, 1, 1760]
    - [5, 69.365]
  - - [512, 48000, 1, 2560]
    - [14, 75.867]
  - - [512, 24000, 1, 2048]
    - [30, 73.76]
  - - [16384, 1600, 1, 4096]
    - [12, 65.846]
  - - [1024, 24000, 1, 2048]
    - [14, 75.993]
  - - [8192, 400, 1, 2048]
    - [30, 50.845]
  - - [2048, 6400, 1, 2048]
    - [14, 70.836]
  - - [6144, 12000, 1, 2048]
    - [14, 75.907]
  - - [1760, 7000, 1, 1760]
    - [19, 77.951]
  - - [1024, 48000, 1, 2816]
    - [23, 78.617]
  - - [4096, 7000, 1, 4096]
    - [14, 71.563]
  - - [6144, 24000, 1, 2560]
    - [14, 78.296]
  - - [8448, 12000, 1, 2816]
    - [23, 78.946]
  - - [16384, 400, 1, 4096]
    - [14, 53.805]
  - - [1760, 1600, 1, 1760]
    - [19, 57.917]
  - - [1024, 48000, 1, 2048]
    - [30, 73.491]
  - - [4096, 4096, 1, 4096]
    - [14, 72.294]
  - - [2048, 2048, 1, 2049]
    - [23, 68.867]
  - - [8192, 8191, 1, 8192]
    - [16, 64.529]
  - - [8192, 8192, 1, 8192]
    - [14, 64.527]
  - - [2047, 2048, 1, 2048]
    - [14, 66.566]
  - - [2048, 2049, 1, 2048]
    - [14, 67.665]
  - - [8192, 8192, 1, 8191]
    - [23, 79.526]
  - - [3072, 513, 1, 3072]
    - [46, 50.552]
  - - [8191, 8192, 1, 8192]
    - [14, 65.607]
  - - [8192, 8193, 1, 8192]
    - [14, 62.499]
  - - [4096, 4097, 1, 4096]
    - [14, 67.322]
  - - [8192, 8192, 1, 8193]
    - [7, 78.973]
  - - [4096, 4095, 1, 4096]
    - [14, 74.771]
  - - [4096, 4096, 1, 4097]
    - [7, 74.29]
  - - [2048, 2048, 1, 2048]
    - [14, 67.746]
  - - [4095, 4096, 1, 4096]
    - [14, 72.23]
  - - [8193, 8192, 1, 8192]
    - [16, 63.031]
  - - [4096, 4096, 1, 4095]
    - [23, 74.272]
  - - [3072, 511, 1, 3072]
    - [28, 59.135]
  - - [2049, 2048, 1, 2048]
    - [30, 60.114]
  - - [2048, 2047, 1, 2048]
    - [14, 65.472]
  - - [2048, 2048, 1, 2047]
    - [23, 69.084]
  - - [4097, 4096, 1, 4096]
    - [14, 64.885]
  - - [128, 128, 512, 64]
    - [45, 46.762]
  - - [512, 512, 64, 64]
    - [21, 61.79]
  - - [1024, 2048, 1, 1024]
    - [30, 65.982]
  - - [1024, 2048, 1, 4096]
    - [30, 67.405]
  - - [1024, 4096, 1, 1024]
    - [30, 67.622]
  - - [1024, 4096, 1, 4096]
    - [30, 61.944]
  - - [4096, 2048, 1, 1024]
    - [28, 69.151]
  - - [4096, 4096, 1, 1024]
    - [14, 72.576]
  - - [30528, 2048, 1, 1024]
    - [14, 77.081]
  - - [30528, 4096, 1, 1024]
    - [14, 77.875]
  - - [128, 32768, 1, 256]
    - [14, 60.164]
  - - [256, 4608, 1, 1024]
    - [14, 63.372]
  - - [256, 4864, 1, 1024]
    - [44, 48.181]
  - - [256, 5376, 1, 1024]
    - [28, 52.722]
  - - [256, 5888, 1, 1024]
    - [44, 57.495]
  - - [256, 6144, 1, 1024]
    - [28, 59.778]
  - - [256, 6400, 1, 1024]
    - [44, 61.923]
  - - [256, 6656, 1, 1024]
    - [44, 64.211]
  - - [256, 7168, 1, 1024]
    - [14, 57.671]
  - - [256, 7424, 1, 1024]
    - [14, 59.377]
  - - [256, 7936, 1, 1024]
    - [14, 63.73]
  - - [256, 8192, 1, 1024]
    - [14, 65.571]
  - - [256, 8448, 1, 1024]
    - [14, 67.601]
  - - [256, 8960, 1, 1024]
    - [14, 71.506]
  - - [256, 9984, 1, 1024]
    - [44, 60.592]
  - - [256, 10496, 1, 1024]
    - [44, 63.739]
  - - [256, 11264, 1, 1024]
    - [44, 68.053]
  - - [256, 11520, 1, 1024]
    - [14, 62.684]
  - - [256, 11776, 1, 1024]
    - [14, 63.83]
  - - [256, 12544, 1, 1024]
    - [14, 67.229]
  - - [256, 13312, 1, 1024]
    - [14, 70.489]
  - - [256, 14336, 1, 1024]
    - [28, 63.868]
  - - [256, 14592, 1, 1024]
    - [44, 64.978]
  - - [256, 14848, 1, 1024]
    - [28, 65.831]
  - - [256, 15104, 1, 1024]
    - [28, 66.965]
  - - [256, 16128, 1, 1024]
    - [14, 66.352]
  - - [256, 18176, 1, 1024]
    - [14, 74.394]
  - - [256, 18944, 1, 1024]
    - [28, 66.016]
  - - [256, 19200, 1, 1024]
    - [44, 66.764]
  - - [256, 20480, 1, 1024]
    - [44, 70.974]
  - - [256, 20992, 1, 1024]
    - [14, 69.435]
  - - [256, 21248, 1, 1024]
    - [14, 70.496]
  - - [256, 21504, 1, 1024]
    - [14, 70.868]
  - - [256, 22016, 1, 1024]
    - [14, 72.661]
  - - [256, 22344, 1, 1024]
    - [14, 71.874]
  - - [256, 23296, 1, 1024]
    - [44, 67.051]
  - - [256, 23552, 1, 1024]
    - [44, 67.82]
  - - [256, 31488, 1, 1024]
    - [14, 74.922]
  - - [256, 32768, 1, 512]
    - [28, 68.804]
  - - [256, 33536, 1, 1024]
    - [44, 70.929]
  - - [256, 44505, 1, 1024]
    - [14, 74.058]
  - - [512, 32768, 1, 13]
    - [45, 26.885]
  - - [512, 32768, 1, 1024]
    - [30, 74.191]
  - - [684, 8976, 1, 256]
    - [46, 60.629]
  - - [1024, 1600, 1, 560]
    - [35, 61.091]
  - - [1024, 1600, 1, 1024]
    - [44, 59.602]
  - - [1024, 32768, 1, 480]
    - [19, 80.873]
  - - [1024, 32768, 1, 1024]
    - [30, 76.724]
  - - [1280, 8976, 1, 256]
    - [46, 67.608]
  - - [1792, 8976, 1, 256]
    - [30, 70.085]
  - - [2048, 684, 1, 512]
    - [44, 49.509]
  - - [2048, 684, 1, 768]
    - [44, 51.659]
  - - [2048, 960, 1, 74]
    - [4, 39.448]
  - - [2048, 960, 1, 2048]
    - [30, 60.71]
  - - [2048, 1536, 1, 512]
    - [30, 64.08]
  - - [2048, 1536, 1, 768]
    - [23, 66.013]
  - - [2048, 8976, 1, 256]
    - [30, 69.823]
  - - [2304, 8976, 1, 256]
    - [30, 73.352]
  - - [2560, 8976, 1, 256]
    - [30, 73.04]
  - - [2816, 8976, 1, 256]
    - [30, 71.5]
  - - [3072, 8976, 1, 256]
    - [30, 73.112]
  - - [3328, 8976, 1, 256]
    - [46, 72.192]
  - - [3840, 8976, 1, 256]
    - [23, 72.558]
  - - [4096, 8976, 1, 256]
    - [23, 71.973]
  - - [4352, 8976, 1, 256]
    - [23, 73.088]
  - - [4608, 8976, 1, 256]
    - [30, 73.909]
  - - [4864, 8976, 1, 256]
    - [30, 73.07]
  - - [5120, 8976, 1, 256]
    - [30, 73.74]
  - - [5376, 8976, 1, 256]
    - [40, 73.376]
  - - [5632, 8976, 1, 256]
    - [30, 73.976]
  - - [5888, 8976, 1, 256]
    - [23, 73.602]
  - - [6144, 8976, 1, 256]
    - [23, 72.088]
  - - [6400, 8976, 1, 256]
    - [46, 73.609]
  - - [7168, 8976, 1, 256]
    - [30, 73.625]
  - - [7936, 8976, 1, 256]
    - [23, 73.877]
  - - [8192, 8976, 1, 256]
    - [12, 71.481]
  - - [8448, 8976, 1, 256]
    - [30, 73.406]
  - - [8960, 8976, 1, 256]
    - [14, 73.561]
  - - [9472, 8976, 1, 256]
    - [23, 73.374]
  - - [9728, 8976, 1, 256]
    - [23, 72.578]
  - - [9984, 8976, 1, 256]
    - [30, 73.532]
  - - [10240, 8976, 1, 256]
    - [12, 71.493]
  - - [10496, 8976, 1, 256]
    - [14, 73.719]
  - - [11264, 8976, 1, 256]
    - [21, 71.872]
  - - [11776, 8976, 1, 256]
    - [23, 72.436]
  - - [12544, 8976, 1, 256]
    - [14, 73.988]
  - - [13312, 8976, 1, 256]
    - [12, 72.0]
  - - [13568, 8976, 1, 256]
    - [14, 74.022]
  - - [13824, 8976, 1, 256]
    - [28, 72.294]
  - - [15104, 8976, 1, 256]
    - [14, 74.193]
  - - [15360, 8976, 1, 256]
    - [12, 72.059]
  - - [15872, 8976, 1, 256]
    - [23, 72.772]
  - - [16128, 8976, 1, 256]
    - [46, 73.719]
  - - [17152, 8976, 1, 256]
    - [14, 74.369]
  - - [18176, 8976, 1, 256]
    - [14, 74.308]
  - - [18688, 8976, 1, 256]
    - [23, 74.24]
  - - [18944, 8976, 1, 256]
    - [23, 73.406]
  - - [19712, 8976, 1, 256]
    - [14, 74.355]
  - - [19968, 8976, 1, 256]
    - [21, 72.461]
  - - [20480, 8976, 1, 256]
    - [12, 72.228]
  - - [20992, 8976, 1, 256]
    - [30, 72.591]
  - - [21248, 8976, 1, 256]
    - [14, 74.443]
  - - [23552, 8976, 1, 256]
    - [21, 72.485]
  - - [28672, 8976, 1, 256]
    - [12, 72.447]
  - - [31488, 8976, 1, 256]
    - [14, 74.773]
  - - [33536, 8976, 1, 256]
    - [14, 74.811]
  - - [44505, 8976, 1, 256]
    - [21, 72.641]
  - - [1024, 3840, 1, 1024]
    - [28, 66.769]
  - - [1024, 3840, 1, 4096]
    - [30, 63.602]
  - - [1024, 3968, 1, 1024]
    - [28, 68.743]
  - - [1024, 3968, 1, 4096]
    - [14, 60.523]
  - - [1024, 6528, 1, 1024]
    - [30, 71.488]
  - - [1024, 6528, 1, 4096]
    - [30, 63.597]
  - - [1024, 7104, 1, 1024]
    - [28, 68.522]
  - - [1024, 7104, 1, 4096]
    - [30, 63.624]
  - - [1024, 7200, 1, 1024]
    - [30, 68.657]
  - - [1024, 7200, 1, 4096]
    - [14, 62.666]
  - - [1024, 8064, 1, 1024]
    - [28, 72.379]
  - - [1024, 8064, 1, 4096]
    - [14, 63.669]
  - - [1024, 8160, 1, 1024]
    - [28, 69.045]
  - - [1024, 8160, 1, 4096]
    - [30, 61.838]
  - - [1024, 9216, 1, 1024]
    - [30, 76.837]
  - - [1024, 9216, 1, 4096]
    - [14, 76.735]
  - - [1024, 9520, 1, 1024]
    - [30, 71.078]
  - - [1024, 9520, 1, 4096]
    - [46, 65.237]
  - - [1024, 10064, 1, 1024]
    - [30, 74.547]
  - - [1024, 10064, 1, 4096]
    - [14, 65.499]
  - - [1024, 10080, 1, 1024]
    - [30, 74.725]
  - - [1024, 10080, 1, 4096]
    - [14, 66.604]
  - - [1024, 10200, 1, 1024]
    - [30, 75.057]
  - - [1024, 10200, 1, 4096]
    - [30, 66.507]
  - - [4096, 3840, 1, 1024]
    - [14, 72.873]
  - - [4096, 3968, 1, 1024]
    - [28, 71.554]
  - - [4096, 6528, 1, 1024]
    - [14, 73.76]
  - - [4096, 7104, 1, 1024]
    - [14, 75.729]
  - - [4096, 7200, 1, 1024]
    - [14, 74.277]
  - - [4096, 8064, 1, 1024]
    - [14, 74.565]
  - - [4096, 8160, 1, 1024]
    - [14, 75.208]
  - - [4096, 9216, 1, 1024]
    - [14, 77.035]
  - - [4096, 9520, 1, 1024]
    - [14, 74.962]
  - - [4096, 10064, 1, 1024]
    - [14, 75.641]
  - - [4096, 10080, 1, 1024]
    - [14, 75.619]
  - - [4096, 10200, 1, 1024]
    - [14, 76.32]
  - - [42720, 3968, 1, 1024]
    - [14, 75.729]
  - - [42720, 6528, 1, 1024]
    - [14, 76.835]
  - - [42720, 7104, 1, 1024]
    - [14, 77.685]
  - - [42720, 7200, 1, 1024]
    - [14, 76.068]
  - - [42720, 9520, 1, 1024]
    - [14, 76.74]
  - - [42720, 10080, 1, 1024]
    - [14, 77.209]
  - - [1024, 3240, 1, 1024]
    - [14, 66.205]
  - - [1024, 3240, 1, 4096]
    - [30, 70.699]
  - - [1024, 3960, 1, 1024]
    - [28, 68.917]
  - - [1024, 3960, 1, 4096]
    - [30, 63.958]
  - - [4096, 3240, 1, 1024]
    - [14, 70.992]
  - - [4096, 3960, 1, 1024]
    - [28, 71.536]
  - - [42720, 3960, 1, 1024]
    - [14, 75.592]
  - - [7680, 8192, 1, 8192]
    - [16, 64.511]
  - - [3840, 4096, 1, 4096]
    - [14, 67.52]
  - - [1920, 2048, 1, 2048]
    - [14, 61.75]
  - - [8192, 7680, 1, 8192]
    - [16, 64.482]
  - - [4096, 3840, 1, 4096]
    - [14, 69.618]
  - - [2048, 1920, 1, 2048]
    - [14, 63.223]
  - - [512, 512, 16, 64]
    - [39, 49.313]
  - - [512, 512, 128, 64]
    - [28, 65.822]
  - - [4096, 512, 1, 1024]
    - [30, 66.144]
  - - [30522, 616, 1, 1024]
    - [28, 68.991]
  - - [128, 128, 128, 64]
    - [6, 38.133]
  - - [128, 128, 160, 64]
    - [6, 36.322]
  - - [1024, 1280, 1, 1024]
    - [28, 50.128]
  - - [1024, 1280, 1, 4096]
    - [44, 50.333]
  - - [4096, 1280, 1, 1024]
    - [14, 65.614]
  - - [30522, 160, 1, 1024]
    - [30, 43.998]
  - - [30522, 200, 1, 1024]
    - [46, 54.053]
  - - [128, 128, 624, 64]
    - [6, 48.111]
  - - [1024, 4992, 1, 1024]
    - [28, 69.264]
  - - [1024, 4992, 1, 4096]
    - [30, 61.917]
  - - [4096, 4992, 1, 1024]
    - [14, 73.491]
  - - [30522, 780, 1, 1024]
    - [28, 63.464]
  - - [30522, 308, 1, 1024]
    - [44, 58.005]
  - - [128, 128, 640, 64]
    - [13, 48.866]
  - - [1024, 5120, 1, 1024]
    - [28, 70.816]
  - - [1024, 5120, 1, 4096]
    - [14, 69.099]
  - - [4096, 5120, 1, 1024]
    - [14, 75.801]
  - - [30522, 800, 1, 1024]
    - [28, 65.023]
  - - [128, 128, 656, 64]
    - [13, 48.675]
  - - [1024, 5248, 1, 1024]
    - [30, 69.005]
  - - [1024, 5248, 1, 4096]
    - [14, 69.44]
  - - [4096, 5248, 1, 1024]
    - [14, 73.494]
  - - [30522, 820, 1, 1024]
    - [28, 66.514]
  - - [512, 512, 80, 64]
    - [5, 62.999]
  - - [1024, 2560, 1, 1024]
    - [28, 62.133]
  - - [1024, 2560, 1, 4096]
    - [14, 56.997]
  - - [4096, 2560, 1, 1024]
    - [14, 75.486]
  - - [30522, 385, 1, 1024]
    - [14, 55.309]
  - - [512, 512, 96, 64]
    - [5, 64.215]
  - - [1024, 3072, 1, 1024]
    - [30, 66.776]
  - - [1024, 3072, 1, 4096]
    - [30, 66.225]
  - - [4096, 3072, 1, 1024]
    - [14, 73.207]
  - - [30522, 462, 1, 1024]
    - [14, 65.567]
  - - [4096, 1024, 1, 1024]
    - [14, 64.096]
  - - [128, 128, 144, 64]
    - [37, 38.796]
  - - [1024, 1152, 1, 1024]
    - [28, 60.744]
  - - [1024, 1152, 1, 4096]
    - [28, 63.306]
  - - [4096, 1152, 1, 1024]
    - [28, 69.408]
  - - [30522, 180, 1, 1024]
    - [30, 49.076]
  - - [1024, 32768, 1, 479]
    - [19, 79.271]
  - - [1024, 8192, 1, 1024]
    - [28, 69.316]
  - - [1024, 8192, 1, 4096]
    - [14, 63.667]
  - - [1024, 9600, 1, 1024]
    - [28, 71.563]
  - - [1024, 9600, 1, 4096]
    - [30, 66.288]
  - - [4096, 8192, 1, 1024]
    - [14, 75.713]
  - - [4096, 9600, 1, 1024]
    - [14, 75.862]
  - - [33712, 8192, 1, 1024]
    - [14, 78.497]
  - - [33712, 9600, 1, 1024]
    - [14, 77.399]
  - - [1024, 1024, 128, 96]
    - [5, 61.538]
  - - [30592, 4096, 1, 1024]
    - [14, 78.222]
  - - [1536, 8192, 1, 1536]
    - [30, 75.754]
  - - [3072, 8192, 1, 1024]
    - [30, 75.732]
  - - [3072, 2048, 1, 1024]
    - [28, 69.878]
  - - [50304, 8192, 1, 1024]
    - [14, 78.321]
  - - [2048, 1024, 1, 8192]
    - [14, 66.713]
  - - [50304, 2048, 1, 1024]
    - [14, 77.76]
  - - [1536, 8192, 1, 6144]
    - [46, 68.765]
  - - [50304, 4096, 1, 1536]
    - [46, 78.335]
  - - [8192, 1024, 1, 2048]
    - [14, 68.253]
  - - [2560, 2048, 1, 640]
    - [38, 70.782]
  - - [1024, 1024, 128, 64]
    - [0, 57.026]
  - - [2048, 1024, 1, 2048]
    - [46, 66.399]
  - - [1536, 4096, 1, 1536]
    - [28, 70.455]
  - - [1024, 1024, 64, 64]
    - [0, 55.307]
  - - [30592, 8192, 1, 1024]
    - [14, 78.443]
  - - [50304, 16384, 1, 1024]
    - [14, 78.364]
  - - [4608, 4096, 1, 1536]
    - [30, 78.238]
  - - [2560, 2048, 1, 2560]
    - [30, 65.729]
  - - [7680, 2048, 1, 2560]
    - [30, 74.064]
  - - [50304, 4096, 1, 1024]
    - [14, 78.062]
  - - [1920, 2048, 1, 2560]
    - [44, 66.864]
  - - [1024, 1024, 64, 96]
    - [1, 64.915]
  - - [6144, 4096, 1, 1536]
    - [30, 75.134]
  - - [1536, 4096, 1, 6144]
    - [46, 62.262]
  - - [512, 512, 256, 64]
    - [1, 52.514]
  - - [50304, 8192, 1, 1536]
    - [46, 78.594]
  - - [6144, 8192, 1, 1536]
    - [14, 77.482]
  - - [4096, 16384, 1, 1024]
    - [14, 76.623]
  - - [30592, 1024, 1, 2048]
    - [14, 75.594]
  - - [1024, 16384, 1, 4096]
    - [14, 71.229]
  - - [512, 512, 40, 64]
    - [22, 56.742]
  - - [6144, 1024, 1, 2048]
    - [14, 67.371]
  - - [4608, 8192, 1, 1536]
    - [30, 78.878]
  - - [30592, 2048, 1, 1024]
    - [14, 77.473]
  - - [3072, 16384, 1, 1024]
    - [30, 77.572]
  - - [1024, 1024, 256, 64]
    - [12, 50.856]
  - - [1024, 16384, 1, 1024]
    - [30, 74.31]
  - - [1024, 1024, 32, 64]
    - [19, 66.435]
  - - [3072, 4096, 1, 1024]
    - [30, 75.4]
  - - [30528, 8192, 1, 1024]
    - [14, 78.231]
  - - [128, 128, 1024, 64]
    - [22, 51.079]
  - - [1024, 3456, 1, 1024]
    - [28, 69.801]
  - - [1024, 3456, 1, 480]
    - [38, 69.395]
  - - [1024, 4096, 1, 480]
    - [19, 69.679]
  - - [1024, 6912, 1, 1024]
    - [30, 75.63]
  - - [1024, 6912, 1, 480]
    - [19, 78.784]
  - - [128, 55296, 1, 256]
    - [14, 71.86]
  - - [256, 55296, 1, 512]
    - [14, 75.4]
  - - [256, 6912, 1, 512]
    - [13, 59.34]
  - - [512, 3456, 1, 1024]
    - [29, 61.391]
  - - [512, 3456, 1, 13]
    - [22, 12.658]
  - - [512, 4096, 1, 1024]
    - [30, 65.964]
  - - [512, 4096, 1, 13]
    - [29, 15.376]
  - - [512, 55296, 1, 13]
    - [41, 29.441]
  - - [512, 6912, 1, 1024]
    - [46, 73.742]
  - - [512, 6912, 1, 13]
    - [29, 17.893]
  - - [30528, 640, 1, 1024]
    - [28, 72.102]
  - - [30528, 1280, 1, 1024]
    - [14, 76.383]
  - - [30528, 1600, 1, 1024]
    - [28, 70.796]
  - - [1024, 10240, 1, 1024]
    - [30, 75.671]
  - - [4096, 10240, 1, 1024]
    - [14, 76.329]
  - - [1024, 10240, 1, 4096]
    - [14, 66.259]
  - - [128, 128, 1280, 64]
    - [5, 57.804]
  - - [1024, 10496, 1, 4096]
    - [14, 70.162]
  - - [30528, 1640, 1, 1024]
    - [12, 72.501]
  - - [4096, 10496, 1, 1024]
    - [14, 76.828]
  - - [1024, 10496, 1, 1024]
    - [28, 70.369]
  - - [128, 128, 1312, 64]
    - [44, 61.723]
  - - [30528, 160, 1, 1024]
    - [14, 44.143]
  - - [30528, 240, 1, 1024]
    - [44, 64.319]
  - - [1024, 6144, 1, 1024]
    - [28, 69.352]
  - - [4096, 6144, 1, 1024]
    - [14, 74.581]
  - - [1024, 6144, 1, 4096]
    - [14, 69.629]
  - - [512, 512, 192, 64]
    - [44, 66.446]
  - - [1024, 10224, 1, 1024]
    - [30, 74.464]
  - - [1024, 10192, 1, 1024]
    - [30, 74.946]
  - - [1024, 10208, 1, 1024]
    - [30, 74.849]
  - - [1024, 10224, 1, 4096]
    - [30, 72.036]
  - - [4096, 10224, 1, 1024]
    - [14, 75.662]
  - - [3072, 10224, 1, 1024]
    - [30, 76.663]
  - - [3072, 10240, 1, 1024]
    - [30, 77.478]
  - - [1024, 10192, 1, 4096]
    - [14, 75.973]
  - - [4096, 10192, 1, 1024]
    - [14, 75.734]
  - - [3072, 10192, 1, 1024]
    - [30, 76.699]
  - - [3072, 10200, 1, 1024]
    - [30, 76.672]
  - - [1024, 10184, 1, 1024]
    - [30, 75.159]
  - - [3072, 10208, 1, 1024]
    - [30, 76.535]
  - - [1024, 10208, 1, 4096]
    - [30, 76.548]
  - - [4096, 10208, 1, 1024]
    - [14, 75.761]
  - - [2048, 10224, 1, 1024]
    - [14, 74.953]
  - - [2048, 10240, 1, 1024]
    - [14, 75.917]
  - - [1024, 10120, 1, 1024]
    - [30, 74.967]
  - - [2048, 10192, 1, 1024]
    - [14, 74.881]
  - - [1024, 10152, 1, 1024]
    - [30, 74.791]
  - - [3072, 10080, 1, 1024]
    - [30, 76.217]
  - - [1024, 2048, 1, 49]
    - [19, 35.773]
  - - [4608, 512, 1, 49]
    - [18, 38.693]
  - - [256, 256, 25, 12544]
    - [5, 56.979]
  - - [256, 256, 49, 3200]
    - [46, 68.968]
  - - [256, 256, 25, 6272]
    - [28, 63.751]
  - - [256, 256, 49, 6400]
    - [46, 59.523]
  - - [512, 512, 49, 1152]
    - [23, 77.299]
  - - [512, 512, 25, 2048]
    - [33, 58.939]
  - - [512, 512, 49, 2304]
    - [46, 73.356]
  - - [512, 512, 25, 4096]
    - [33, 58.197]
  - - [128, 128, 2048, 64]
    - [44, 57.906]
  - - [30528, 2560, 1, 1024]
    - [14, 77.525]
  - - [128, 128, 1536, 64]
    - [38, 57.452]
  - - [1024, 12288, 1, 1024]
    - [30, 75.048]
  - - [1024, 12288, 1, 4096]
    - [14, 67.146]
  - - [30528, 1920, 1, 1024]
    - [12, 73.645]
  - - [4096, 12288, 1, 1024]
    - [14, 76.753]
  - - [128, 128, 81, 12544]
    - [15, 40.328]
  - - [128, 128, 121, 9216]
    - [31, 38.011]
  - - [128, 128, 169, 6400]
    - [47, 39.06]
  - - [256, 256, 36, 4096]
    - [33, 59.528]
  - - [256, 256, 49, 2304]
    - [46, 68.662]
  - - [256, 256, 64, 2304]
    - [30, 63.29]
  - - [256, 256, 81, 4096]
    - [32, 48.099]
  - - [256, 256, 121, 2304]
    - [14, 65.702]
  - - [256, 256, 169, 2304]
    - [46, 65.133]
  - - [512, 512, 81, 1024]
    - [46, 69.37]
  - - [512, 512, 121, 1024]
    - [14, 70.69]
  - - [512, 512, 169, 1024]
    - [30, 71.152]
  - - [512, 512, 36, 1024]
    - [46, 75.276]
  - - [512, 512, 49, 1024]
    - [46, 74.128]
  - - [512, 512, 64, 1024]
    - [46, 70.024]
  - - [128, 128, 192, 64]
    - [20, 33.297]
  - - [768, 2048, 1, 768]
    - [44, 59.291]
  - - [3072, 2048, 1, 768]
    - [28, 70.169]
  - - [768, 2048, 1, 3072]
    - [28, 61.161]
  - - [384, 384, 144, 64]
    - [5, 64.242]
  - - [768, 4608, 1, 768]
    - [23, 74.953]
  - - [3072, 4608, 1, 768]
    - [23, 77.64]
  - - [768, 4608, 1, 3072]
    - [30, 75.835]
  - - [512, 512, 48, 64]
    - [39, 59.485]
  - - [128, 128, 256, 64]
    - [20, 41.648]
  - - [384, 384, 192, 64]
    - [28, 65.822]
  - - [1024, 4608, 1, 1024]
    - [30, 74.8]
  - - [4096, 4608, 1, 1024]
    - [14, 76.742]
  - - [1024, 4608, 1, 4096]
    - [30, 67.518]
  - - [2880, 3072, 1, 3072]
    - [46, 72.605]
  - - [3072, 3072, 1, 3072]
    - [14, 77.588]
  - - [3072, 512, 1, 3072]
    - [44, 59.51]
  - - [4096, 512, 1, 4096]
    - [14, 67.218]
  - - [512, 3072, 1, 3072]
    - [28, 61.332]
  - - [512, 4096, 1, 4096]
    - [14, 67.335]
  - - [512, 8192, 1, 8192]
    - [30, 59.049]
  - - [8192, 512, 1, 8192]
    - [14, 59.081]
  - - [256, 256, 36, 432]
    - [23, 66.451]
  - - [256, 256, 36, 456]
    - [10, 69.539]
  - - [256, 256, 36, 504]
    - [10, 70.074]
  - - [256, 256, 49, 1120]
    - [7, 68.804]
  - - [256, 256, 36, 442]
    - [14, 67.793]
  - - [256, 256, 49, 950]
    - [7, 67.71]
  - - [256, 256, 64, 616]
    - [40, 66.113]
  - - [256, 256, 64, 660]
    - [3, 67.207]
  - - [256, 256, 36, 408]
    - [19, 67.773]
  - - [256, 256, 49, 1008]
    - [19, 69.997]
  - - [256, 256, 36, 462]
    - [46, 68.723]
  - - [256, 256, 36, 468]
    - [40, 68.204]
  - - [256, 256, 36, 494]
    - [7, 68.971]
  - - [512, 512, 64, 48]
    - [29, 59.212]
  - - [256, 256, 64, 140]
    - [38, 54.874]
  - - [512, 512, 64, 56]
    - [18, 57.971]
  - - [512, 512, 49, 90]
    - [28, 60.173]
  - - [512, 512, 49, 60]
    - [22, 56.23]
  - - [256, 256, 49, 864]
    - [7, 67.811]
  - - [256, 256, 64, 224]
    - [5, 61.971]
  - - [256, 256, 64, 176]
    - [21, 60.468]
  - - [256, 256, 64, 154]
    - [5, 55.151]
  - - [512, 512, 49, 80]
    - [5, 64.073]
  - - [256, 256, 49, 1200]
    - [23, 69.102]
  - - [256, 256, 64, 704]
    - [19, 69.575]
  - - [256, 256, 64, 768]
    - [46, 66.385]
  - - [256, 256, 49, 1160]
    - [7, 68.463]
  - - [256, 256, 49, 320]
    - [40, 62.652]
  - - [512, 512, 49, 70]
    - [22, 56.5]
  - - [256, 256, 49, 1240]
    - [23, 68.686]
  - - [256, 256, 36, 384]
    - [7, 68.675]
  - - [1024, 2048, 1, 888]
    - [19, 69.278]
  - - [1024, 2048, 1, 713]
    - [19, 67.951]
  - - [1024, 2048, 1, 660]
    - [19, 68.055]
  - - [1024, 2048, 1, 726]
    - [19, 67.985]
  - - [1024, 2048, 1, 672]
    - [19, 68.813]
  - - [1024, 2048, 1, 850]
    - [19, 68.459]
  - - [1024, 2048, 1, 805]
    - [19, 68.644]
  - - [1024, 2048, 1, 864]
    - [19, 70.015]
  - - [1024, 2048, 1, 768]
    - [23, 66.252]
  - - [1024, 2048, 1, 950]
    - [19, 68.867]
  - - [256, 128, 49, 1152]
    - [5, 61.434]
  - - [256, 128, 121, 120]
    - [39, 52.205]
  - - [256, 128, 169, 120]
    - [28, 54.08]
  - - [256, 128, 36, 120]
    - [1, 41.363]
  - - [256, 128, 49, 120]
    - [35, 43.292]
  - - [256, 128, 64, 120]
    - [5, 45.932]
  - - [256, 128, 36, 12000]
    - [12, 65.073]
  - - [256, 128, 49, 1216]
    - [21, 60.252]
  - - [256, 128, 121, 18]
    - [0, 19.398]
  - - [256, 128, 169, 18]
    - [0, 26.962]
  - - [256, 128, 36, 18]
    - [0, 11.915]
  - - [256, 128, 49, 18]
    - [0, 15.304]
  - - [256, 128, 64, 18]
    - [0, 20.276]
  - - [256, 128, 36, 1800]
    - [5, 64.107]
  - - [256, 128, 121, 19]
    - [0, 24.774]
  - - [256, 128, 169, 19]
    - [0, 27.6]
  - - [256, 128, 36, 19]
    - [0, 12.576]
  - - [256, 128, 49, 19]
    - [0, 15.931]
  - - [256, 128, 64, 19]
    - [0, 20.616]
  - - [256, 128, 36, 1900]
    - [21, 64.229]
  - - [256, 128, 49, 480]
    - [38, 57.953]
  - - [256, 128, 81, 480]
    - [5, 60.353]
  - - [256, 128, 64, 5880]
    - [38, 57.59]
  - - [256, 128, 49, 72]
    - [1, 33.957]
  - - [256, 128, 81, 72]
    - [9, 44.907]
  - - [256, 128, 49, 76]
    - [6, 35.473]
  - - [256, 128, 81, 76]
    - [9, 42.056]
  - - [256, 128, 49, 7680]
    - [32, 45.663]
  - - [256, 128, 64, 882]
    - [21, 59.695]
  - - [256, 128, 64, 931]
    - [38, 60.701]
  - - [256, 256, 49, 1152]
    - [23, 68.799]
  - - [256, 256, 36, 12000]
    - [23, 77.198]
  - - [256, 256, 49, 1216]
    - [40, 68.445]
  - - [256, 256, 36, 1800]
    - [23, 75.172]
  - - [256, 256, 36, 1900]
    - [40, 75.443]
  - - [256, 256, 64, 5880]
    - [23, 69.311]
  - - [256, 256, 49, 7680]
    - [48, 56.769]
  - - [256, 256, 64, 882]
    - [19, 66.284]
  - - [256, 256, 64, 931]
    - [7, 67.193]
  - - [512, 256, 81, 1080]
    - [23, 75.61]
  - - [512, 256, 25, 12000]
    - [23, 72.253]
  - - [512, 256, 81, 162]
    - [5, 63.687]
  - - [512, 256, 81, 171]
    - [5, 66.205]
  - - [512, 256, 25, 1800]
    - [7, 70.311]
  - - [512, 256, 25, 1900]
    - [7, 70.378]
  - - [512, 256, 121, 1920]
    - [7, 75.456]
  - - [512, 256, 169, 1920]
    - [7, 77.663]
  - - [512, 256, 49, 1920]
    - [21, 71.673]
  - - [512, 256, 121, 288]
    - [21, 70.886]
  - - [512, 256, 169, 288]
    - [12, 71.407]
  - - [512, 256, 49, 288]
    - [12, 67.825]
  - - [512, 256, 25, 3000]
    - [40, 70.985]
  - - [512, 256, 81, 3000]
    - [23, 78.213]
  - - [512, 256, 121, 304]
    - [5, 71.227]
  - - [512, 256, 169, 304]
    - [5, 71.56]
  - - [512, 256, 49, 304]
    - [5, 68.012]
  - - [512, 256, 25, 450]
    - [40, 62.999]
  - - [512, 256, 81, 450]
    - [5, 70.839]
  - - [512, 256, 25, 475]
    - [40, 64.096]
  - - [512, 256, 81, 475]
    - [5, 71.245]
  - - [512, 256, 121, 480]
    - [38, 72.558]
  - - [512, 256, 169, 480]
    - [7, 72.415]
  - - [512, 256, 49, 5880]
    - [38, 72.406]
  - - [512, 256, 121, 72]
    - [39, 55.927]
  - - [512, 256, 169, 72]
    - [5, 58.749]
  - - [512, 256, 121, 76]
    - [39, 58.804]
  - - [512, 256, 169, 76]
    - [5, 59.977]
  - - [512, 256, 49, 882]
    - [38, 70.773]
  - - [512, 256, 49, 931]
    - [5, 70.836]
  - - [2304, 512, 1, 100]
    - [18, 41.451]
  - - [2304, 512, 1, 361]
    - [1, 56.778]
  - - [4608, 510, 1, 100]
    - [11, 37.073]
  - - [4608, 510, 1, 361]
    - [1, 56.924]
  - - [340, 256, 49, 1152]
    - [21, 58.255]
  - - [340, 256, 36, 120]
    - [39, 41.661]
  - - [340, 256, 49, 120]
    - [22, 45.169]
  - - [340, 256, 64, 120]
    - [12, 47.781]
  - - [340, 256, 36, 12000]
    - [23, 68.912]
  - - [340, 256, 49, 1216]
    - [3, 58.855]
  - - [340, 256, 36, 18]
    - [17, 13.86]
  - - [340, 256, 49, 18]
    - [2, 15.299]
  - - [340, 256, 64, 18]
    - [24, 16.881]
  - - [340, 256, 36, 1800]
    - [40, 66.805]
  - - [340, 256, 36, 19]
    - [17, 14.823]
  - - [340, 256, 49, 19]
    - [34, 16.206]
  - - [340, 256, 64, 19]
    - [34, 17.325]
  - - [340, 256, 36, 1900]
    - [40, 66.911]
  - - [340, 256, 64, 5880]
    - [5, 62.817]
  - - [340, 256, 49, 7680]
    - [46, 47.581]
  - - [340, 256, 64, 882]
    - [5, 60.712]
  - - [340, 256, 64, 931]
    - [21, 61.048]
  - - [510, 256, 49, 120]
    - [39, 43.468]
  - - [510, 256, 64, 120]
    - [4, 44.916]
  - - [510, 256, 49, 18]
    - [0, 11.861]
  - - [510, 256, 64, 18]
    - [8, 12.475]
  - - [510, 256, 49, 19]
    - [0, 12.556]
  - - [510, 256, 64, 19]
    - [0, 13.206]
  - - [510, 256, 36, 480]
    - [5, 67.356]
  - - [510, 256, 36, 72]
    - [11, 32.457]
  - - [510, 256, 36, 76]
    - [4, 33.888]
  - - [510, 512, 36, 1080]
    - [23, 75.046]
  - - [510, 512, 36, 162]
    - [39, 55.95]
  - - [510, 512, 36, 171]
    - [29, 57.285]
  - - [510, 512, 49, 1920]
    - [40, 76.465]
  - - [510, 512, 64, 1920]
    - [23, 74.046]
  - - [510, 512, 49, 288]
    - [21, 67.604]
  - - [510, 512, 64, 288]
    - [38, 69.023]
  - - [510, 512, 36, 3000]
    - [40, 77.324]
  - - [510, 512, 49, 304]
    - [38, 68.391]
  - - [510, 512, 64, 304]
    - [40, 69.704]
  - - [510, 512, 36, 450]
    - [23, 68.641]
  - - [510, 512, 36, 475]
    - [40, 69.201]
  - - [510, 512, 49, 480]
    - [40, 71.651]
  - - [510, 512, 64, 480]
    - [21, 70.825]
  - - [510, 512, 49, 72]
    - [29, 44.084]
  - - [510, 512, 64, 72]
    - [45, 46.146]
  - - [510, 512, 49, 76]
    - [22, 45.796]
  - - [510, 512, 64, 76]
    - [39, 46.847]
  - - [1024, 1024, 160, 96]
    - [28, 61.38]
  - - [2880, 16384, 1, 1920]
    - [19, 76.733]
  - - [1920, 16384, 1, 960]
    - [19, 79.627]
  - - [3840, 16384, 1, 1920]
    - [19, 80.135]
  - - [1920, 16384, 1, 3840]
    - [40, 78.463]
  - - [25216, 16384, 1, 1920]
    - [26, 79.576]
  - - [1024, 1024, 40, 96]
    - [23, 69.668]
  - - [2880, 4096, 1, 1920]
    - [19, 75.596]
  - - [1920, 4096, 1, 960]
    - [19, 78.703]
  - - [3840, 4096, 1, 1920]
    - [3, 78.96]
  - - [1920, 4096, 1, 3840]
    - [23, 72.693]
  - - [25216, 4096, 1, 1920]
    - [26, 79.278]
  - - [1024, 1024, 80, 96]
    - [1, 61.892]
  - - [2880, 8192, 1, 1920]
    - [19, 78.547]
  - - [1920, 8192, 1, 960]
    - [19, 80.006]
  - - [3840, 8192, 1, 1920]
    - [19, 82.091]
  - - [1920, 8192, 1, 3840]
    - [23, 75.989]
  - - [25216, 8192, 1, 1920]
    - [26, 79.494]
  - - [1024, 1024, 96, 96]
    - [5, 60.899]
  - - [1728, 16384, 1, 2304]
    - [23, 75.377]
  - - [2304, 16384, 1, 576]
    - [19, 83.467]
  - - [2304, 16384, 1, 2304]
    - [23, 79.605]
  - - [12672, 16384, 1, 2304]
    - [23, 79.334]
  - - [1024, 1024, 24, 96]
    - [36, 68.45]
  - - [1728, 4096, 1, 2304]
    - [44, 67.653]
  - - [2304, 4096, 1, 576]
    - [19, 81.597]
  - - [2304, 4096, 1, 2304]
    - [23, 79.003]
  - - [12672, 4096, 1, 2304]
    - [23, 78.208]
  - - [1024, 1024, 48, 96]
    - [23, 70.34]
  - - [1728, 8192, 1, 2304]
    - [46, 72.704]
  - - [2304, 8192, 1, 576]
    - [19, 82.887]
  - - [2304, 8192, 1, 2304]
    - [23, 79.569]
  - - [12672, 8192, 1, 2304]
    - [23, 79.061]
  - - [1024, 1024, 16, 96]
    - [35, 65.655]
  - - [1152, 4096, 1, 3072]
    - [46, 76.801]
  - - [3072, 4096, 1, 384]
    - [19, 75.422]
  - - [1536, 4096, 1, 3072]
    - [30, 69.724]
  - - [3072, 4096, 1, 1536]
    - [30, 75.723]
  - - [6400, 4096, 1, 3072]
    - [14, 76.185]
  - - [1024, 1024, 32, 96]
    - [40, 70.358]
  - - [1152, 8192, 1, 3072]
    - [30, 78.222]
  - - [3072, 8192, 1, 384]
    - [19, 75.901]
  - - [1536, 8192, 1, 3072]
    - [30, 76.372]
  - - [3072, 8192, 1, 1536]
    - [30, 75.623]
  - - [6400, 8192, 1, 3072]
    - [14, 78.033]
  - - [2048, 4096, 1, 2048]
    - [14, 67.01]
  - - [2048, 4096, 1, 4096]
    - [14, 67.094]
  - - [29000, 199, 1, 2048]
    - [28, 53.759]
  - - [29000, 221, 1, 2048]
    - [44, 58.876]
  - - [29000, 224, 1, 2048]
    - [12, 59.266]
  - - [29000, 229, 1, 2048]
    - [44, 60.996]
  - - [29000, 234, 1, 2048]
    - [44, 61.493]
  - - [29000, 242, 1, 2048]
    - [12, 64.087]
  - - [29000, 246, 1, 2048]
    - [30, 64.527]
  - - [29000, 247, 1, 2048]
    - [46, 64.773]
  - - [29000, 256, 1, 2048]
    - [46, 68.975]
  - - [29000, 262, 1, 2048]
    - [12, 48.269]
  - - [29000, 264, 1, 2048]
    - [12, 48.235]
  - - [29000, 265, 1, 2048]
    - [12, 48.404]
  - - [29000, 274, 1, 2048]
    - [12, 49.058]
  - - [29000, 277, 1, 2048]
    - [12, 49.78]
  - - [29000, 279, 1, 2048]
    - [12, 49.963]
  - - [29000, 288, 1, 2048]
    - [12, 51.535]
  - - [29000, 296, 1, 2048]
    - [12, 52.83]
  - - [29000, 315, 1, 2048]
    - [12, 57.619]
  - - [29000, 335, 1, 2048]
    - [12, 60.177]
  - - [4096, 4096, 1, 2048]
    - [14, 73.399]
  - - [29000, 2283, 1, 1024]
    - [14, 76.277]
  - - [29000, 2296, 1, 1024]
    - [14, 76.672]
  - - [29000, 2306, 1, 1024]
    - [28, 70.166]
  - - [29000, 2309, 1, 1024]
    - [28, 70.211]
  - - [29000, 2318, 1, 1024]
    - [28, 70.561]
  - - [29000, 2320, 1, 1024]
    - [28, 70.581]
  - - [29000, 2324, 1, 1024]
    - [28, 70.724]
  - - [29000, 2325, 1, 1024]
    - [28, 70.624]
  - - [29000, 2329, 1, 1024]
    - [28, 70.83]
  - - [29000, 2338, 1, 1024]
    - [28, 71.143]
  - - [29000, 2345, 1, 1024]
    - [28, 71.283]
  - - [29000, 2350, 1, 1024]
    - [28, 71.445]
  - - [29000, 2362, 1, 1024]
    - [28, 71.784]
  - - [29000, 2366, 1, 1024]
    - [28, 71.969]
  - - [29000, 2368, 1, 1024]
    - [28, 72.003]
  - - [29000, 2374, 1, 1024]
    - [28, 72.14]
  - - [29000, 2390, 1, 1024]
    - [28, 72.591]
  - - [512, 512, 320, 64]
    - [1, 46.455]
  - - [29000, 561, 1, 1024]
    - [28, 63.315]
  - - [29000, 574, 1, 1024]
    - [44, 64.892]
  - - [29000, 600, 1, 1024]
    - [28, 67.811]
  - - [29000, 608, 1, 1024]
    - [28, 68.26]
  - - [29000, 615, 1, 1024]
    - [44, 69.176]
  - - [29000, 622, 1, 1024]
    - [44, 70.035]
  - - [29000, 625, 1, 1024]
    - [44, 70.268]
  - - [29000, 626, 1, 1024]
    - [44, 70.34]
  - - [29000, 628, 1, 1024]
    - [44, 70.419]
  - - [29000, 636, 1, 1024]
    - [28, 71.326]
  - - [29000, 651, 1, 1024]
    - [14, 64.209]
  - - [29000, 658, 1, 1024]
    - [14, 64.619]
  - - [29000, 669, 1, 1024]
    - [46, 65.91]
  - - [29000, 670, 1, 1024]
    - [14, 65.943]
  - - [29000, 672, 1, 1024]
    - [14, 66.142]
  - - [29000, 684, 1, 1024]
    - [14, 67.331]
  - - [29000, 716, 1, 1024]
    - [14, 69.968]
  - - [29000, 730, 1, 1024]
    - [14, 71.238]
  - - [2560, 1024, 1, 2560]
    - [29, 57.105]
  - - [2560, 1024, 1, 4096]
    - [44, 52.433]
  - - [4096, 1024, 1, 2560]
    - [30, 65.47]
  - - [1024, 1024, 512, 64]
    - [12, 51.019]
  - - [1024, 32768, 1, 4096]
    - [14, 72.634]
  - - [3072, 32768, 1, 1024]
    - [14, 77.117]
  - - [4096, 32768, 1, 1024]
    - [14, 76.844]
  - - [50304, 32768, 1, 1024]
    - [14, 78.346]
  - - [1024, 1024, 24, 128]
    - [23, 70.142]
  - - [128, 1024, 24, 1024]
    - [14, 63.787]
  - - [128, 128, 49, 12800]
    - [51, 41.255]
  - - [128, 128, 25, 25088]
    - [50, 44.005]
  - - [128, 128, 49, 25600]
    - [51, 39.784]
  - - [128, 128, 25, 50176]
    - [52, 39.73]
  - - [128, 128, 36, 12544]
    - [50, 47.596]
  - - [128, 128, 49, 9216]
    - [51, 38.866]
  - - [1024, 1024, 1, 12544]
    - [49, 65.488]
  - - [1024, 1000, 1, 12544]
    - [49, 62.941]
  - - [128, 128, 36, 12000]
    - [6, 56.051]
  - - [5888, 128, 1, 1]
    - [54, 0.598]
  - - [1856, 256, 1, 1]
    - [53, 0.501]
  - - [256, 1856, 1, 32]
    - [68, 8.489]
  - - [128, 3584, 1, 1280]
    - [65, 41.061]
  - - [2944, 128, 1, 32]
    - [53, 9.254]
  - - [64, 6784, 1, 1]
    - [68, 0.422]
  - - [64, 5056, 1, 3328]
    - [63, 28.46]
  - - [704, 1024, 1, 1]
    - [53, 0.702]
  - - [256, 1856, 1, 1280]
    - [85, 41.828]
  - - [256, 1408, 1, 1]
    - [57, 0.377]
  - - [1024, 1024, 1, 1280]
    - [85, 54.416]
  - - [704, 1408, 1, 3328]
    - [65, 52.399]
  - - [1408, 704, 1, 256]
    - [91, 42.719]
  - - [6784, 128, 1, 3328]
    - [91, 46.202]
  - - [2944, 256, 1, 1]
    - [53, 0.751]
  - - [2944, 256, 1, 32]
    - [53, 17.002]
  - - [128, 4288, 1, 3328]
    - [73, 52.239]
  - - [5056, 128, 1, 256]
    - [63, 32.444]
  - - [1856, 704, 1, 1280]
    - [76, 47.197]
  - - [2368, 256, 1, 32]
    - [53, 13.849]
  - - [5056, 64, 1, 32]
    - [68, 7.787]
  - - [64, 6784, 1, 3328]
    - [63, 34.618]
  - - [2944, 256, 1, 1280]
    - [84, 44.303]
  - - [1024, 1024, 1, 3328]
    - [73, 55.943]
  - - [5888, 64, 1, 256]
    - [63, 25.304]
  - - [2944, 448, 1, 256]
    - [90, 42.036]
  - - [5056, 64, 1, 3328]
    - [63, 29.037]
  - - [1024, 448, 1, 32]
    - [80, 10.966]
  - - [128, 2944, 1, 3328]
    - [91, 36.132]
  - - [256, 1856, 1, 1]
    - [56, 0.478]
  - - [256, 3584, 1, 3328]
    - [58, 49.054]
  - - [256, 4288, 1, 1280]
    - [85, 55.357]
  - - [4288, 256, 1, 256]
    - [65, 45.805]
  - - [128, 5888, 1, 32]
    - [55, 15.029]
  - - [128, 5888, 1, 1280]
    - [64, 44.375]
  - - [3584, 256, 1, 256]
    - [77, 41.33]
  - - [1856, 256, 1, 256]
    - [63, 29.633]
  - - [1024, 704, 1, 1]
    - [80, 0.684]
  - - [448, 1408, 1, 3328]
    - [64, 37.91]
  - - [1024, 704, 1, 32]
    - [80, 16.062]
  - - [448, 2944, 1, 256]
    - [89, 40.775]
  - - [5888, 128, 1, 3328]
    - [90, 45.129]
  - - [2944, 448, 1, 1]
    - [53, 1.128]
  - - [5056, 64, 1, 1280]
    - [63, 27.774]
  - - [704, 704, 1, 32]
    - [53, 11.927]
  - - [256, 4288, 1, 256]
    - [84, 44.833]
  - - [5056, 128, 1, 1]
    - [53, 0.629]
  - - [704, 448, 1, 1280]
    - [73, 27.986]
  - - [1024, 704, 1, 1280]
    - [84, 42.446]
  - - [2368, 448, 1, 256]
    - [76, 39.27]
  - - [4288, 256, 1, 3328]
    - [58, 57.743]
  - - [128, 6784, 1, 32]
    - [82, 16.495]
  - - [128, 6784, 1, 3328]
    - [85, 46.374]
  - - [4288, 128, 1, 1]
    - [53, 0.573]
  - - [256, 2368, 1, 32]
    - [53, 13.102]
  - - [448, 1024, 1, 256]
    - [63, 28.922]
  - - [256, 1408, 1, 32]
    - [53, 8.615]
  - - [256, 3584, 1, 32]
    - [82, 18.196]
  - - [128, 4288, 1, 32]
    - [53, 12.382]
  - - [448, 1856, 1, 1]
    - [53, 0.801]
  - - [448, 1856, 1, 32]
    - [53, 18.64]
  - - [448, 1856, 1, 3328]
    - [63, 43.955]
  - - [1024, 448, 1, 256]
    - [76, 30.107]
  - - [704, 1856, 1, 32]
    - [53, 25.771]
  - - [704, 1408, 1, 32]
    - [53, 21.169]
  - - [5888, 128, 1, 32]
    - [53, 16.29]
  - - [128, 4288, 1, 1280]
    - [65, 47.939]
  - - [1856, 704, 1, 3328]
    - [90, 48.271]
  - - [4288, 128, 1, 256]
    - [63, 34.156]
  - - [704, 1856, 1, 3328]
    - [64, 48.077]
  - - [2944, 128, 1, 1280]
    - [91, 34.368]
  - - [1408, 448, 1, 1280]
    - [76, 36.96]
  - - [128, 2368, 1, 1]
    - [53, 0.329]
  - - [128, 2944, 1, 1280]
    - [65, 34.391]
  - - [1024, 448, 1, 1]
    - [87, 0.483]
  - - [256, 2944, 1, 256]
    - [64, 38.654]
  - - [704, 448, 1, 32]
    - [53, 7.905]
  - - [704, 1024, 1, 256]
    - [75, 35.643]
  - - [1408, 448, 1, 3328]
    - [64, 37.91]
  - - [256, 2368, 1, 1]
    - [81, 0.571]
  - - [5888, 64, 1, 3328]
    - [75, 33.479]
  - - [704, 448, 1, 3328]
    - [85, 30.639]
  - - [4288, 256, 1, 1]
    - [61, 0.975]
  - - [1856, 448, 1, 3328]
    - [76, 49.16]
  - - [4288, 256, 1, 1280]
    - [85, 55.375]
  - - [448, 2368, 1, 1280]
    - [63, 41.871]
  - - [3584, 256, 1, 1]
    - [53, 0.767]
  - - [2368, 448, 1, 32]
    - [53, 22.392]
  - - [1408, 704, 1, 1]
    - [61, 0.893]
  - - [2368, 256, 1, 256]
    - [83, 30.283]
  - - [1856, 256, 1, 1280]
    - [85, 41.828]
  - - [256, 2944, 1, 1]
    - [62, 0.67]
  - - [6784, 64, 1, 1]
    - [56, 0.471]
  - - [6784, 64, 1, 256]
    - [64, 28.494]
  - - [448, 2368, 1, 256]
    - [63, 38.776]
  - - [128, 2368, 1, 3328]
    - [91, 29.308]
  - - [64, 5056, 1, 256]
    - [63, 21.679]
  - - [2368, 448, 1, 3328]
    - [76, 47.933]
  - - [256, 2368, 1, 3328]
    - [76, 36.743]
  - - [5888, 64, 1, 1]
    - [53, 0.417]
  - - [256, 3584, 1, 1]
    - [88, 0.749]
  - - [704, 1856, 1, 1280]
    - [76, 47.506]
  - - [448, 1024, 1, 3328]
    - [73, 44.222]
  - - [128, 5056, 1, 32]
    - [53, 13.822]
  - - [128, 5056, 1, 1280]
    - [64, 38.262]
  - - [5888, 64, 1, 32]
    - [53, 9.129]
  - - [2368, 256, 1, 1]
    - [53, 0.634]
  - - [5888, 64, 1, 1280]
    - [75, 31.835]
  - - [256, 1408, 1, 256]
    - [63, 24.318]
  - - [5056, 64, 1, 1]
    - [53, 0.361]
  - - [1408, 448, 1, 32]
    - [53, 14.785]
  - - [5056, 128, 1, 1280]
    - [64, 37.314]
  - - [1856, 704, 1, 256]
    - [76, 41.415]
  - - [128, 6784, 1, 256]
    - [65, 39.363]
  - - [256, 3584, 1, 256]
    - [73, 41.986]
  - - [448, 704, 1, 1]
    - [53, 0.345]
  - - [448, 704, 1, 32]
    - [53, 7.85]
  - - [448, 704, 1, 3328]
    - [73, 30.648]
  - - [64, 5888, 1, 1]
    - [56, 0.383]
  - - [2368, 128, 1, 32]
    - [53, 7.65]
  - - [2368, 256, 1, 1280]
    - [83, 35.079]
  - - [2368, 128, 1, 3328]
    - [73, 29.475]
  - - [4288, 256, 1, 32]
    - [53, 22.771]
  - - [448, 1408, 1, 1]
    - [53, 0.636]
  - - [1408, 256, 1, 256]
    - [63, 24.49]
  - - [256, 4288, 1, 32]
    - [53, 20.528]
  - - [1408, 256, 1, 1280]
    - [91, 33.082]
  - - [448, 1408, 1, 256]
    - [63, 31.731]
  - - [128, 2944, 1, 32]
    - [53, 9.069]
  - - [1856, 448, 1, 1]
    - [53, 0.817]
  - - [704, 704, 1, 1]
    - [53, 0.508]
  - - [1856, 448, 1, 1280]
    - [76, 47.039]
  - - [128, 5888, 1, 256]
    - [76, 38.449]
  - - [3584, 256, 1, 3328]
    - [73, 48.887]
  - - [448, 2368, 1, 1]
    - [53, 0.956]
  - - [128, 6784, 1, 1]
    - [58, 0.747]
  - - [256, 2944, 1, 3328]
    - [76, 45.359]
  - - [64, 5888, 1, 256]
    - [63, 25.245]
  - - [704, 704, 1, 256]
    - [63, 30.91]
  - - [448, 1024, 1, 32]
    - [53, 11.34]
  - - [256, 2368, 1, 256]
    - [76, 31.426]
  - - [448, 704, 1, 1280]
    - [73, 27.952]
  - - [704, 1856, 1, 1]
    - [61, 1.092]
  - - [704, 448, 1, 256]
    - [63, 21.631]
  - - [2368, 448, 1, 1280]
    - [76, 46.399]
  - - [128, 5056, 1, 1]
    - [80, 0.602]
  - - [256, 2368, 1, 1280]
    - [57, 35.943]
  - - [64, 6784, 1, 256]
    - [63, 26.962]
  - - [128, 3584, 1, 256]
    - [64, 30.312]
  - - [704, 1408, 1, 1]
    - [80, 0.873]
  - - [4288, 128, 1, 3328]
    - [91, 51.571]
  - - [128, 6784, 1, 1280]
    - [65, 45.341]
  - - [3584, 256, 1, 32]
    - [54, 17.9]
  - - [1408, 256, 1, 32]
    - [53, 8.911]
  - - [5888, 128, 1, 256]
    - [84, 37.391]
  - - [128, 5056, 1, 3328]
    - [57, 39.157]
  - - [1024, 448, 1, 3328]
    - [58, 43.761]
  - - [3584, 128, 1, 1]
    - [53, 0.467]
  - - [128, 2368, 1, 256]
    - [63, 20.497]
  - - [448, 1856, 1, 256]
    - [63, 38.787]
  - - [3584, 128, 1, 256]
    - [64, 30.037]
  - - [1024, 448, 1, 1280]
    - [85, 40.091]
  - - [128, 5888, 1, 1]
    - [56, 0.659]
  - - [64, 5056, 1, 1]
    - [53, 0.341]
  - - [1856, 256, 1, 32]
    - [53, 11.667]
  - - [64, 5056, 1, 32]
    - [53, 7.634]
  - - [1408, 704, 1, 32]
    - [53, 21.424]
  - - [1408, 704, 1, 1280]
    - [85, 50.802]
  - - [1024, 1024, 1, 32]
    - [80, 22.132]
  - - [5056, 128, 1, 3328]
    - [64, 38.751]
  - - [128, 4288, 1, 1]
    - [53, 0.53]
  - - [2944, 128, 1, 3328]
    - [65, 36.261]
  - - [5888, 128, 1, 1280]
    - [90, 44.052]
  - - [2944, 128, 1, 256]
    - [63, 25.424]
  - - [6784, 128, 1, 1]
    - [53, 0.837]
  - - [1408, 256, 1, 3328]
    - [77, 34.657]
  - - [2944, 256, 1, 256]
    - [76, 37.912]
  - - [6784, 128, 1, 256]
    - [65, 39.487]
  - - [6784, 64, 1, 1280]
    - [64, 36.046]
  - - [2944, 448, 1, 1280]
    - [90, 47.653]
  - - [704, 448, 1, 1]
    - [53, 0.345]
  - - [256, 1408, 1, 3328]
    - [73, 34.675]
  - - [2944, 128, 1, 1]
    - [53, 0.417]
  - - [704, 1024, 1, 32]
    - [53, 16.263]
  - - [3584, 256, 1, 1280]
    - [85, 47.7]
  - - [3584, 128, 1, 1280]
    - [77, 41.291]
  - - [256, 1856, 1, 256]
    - [64, 31.539]
  - - [256, 2944, 1, 1280]
    - [72, 44.321]
  - - [2944, 256, 1, 3328]
    - [76, 45.129]
  - - [704, 1024, 1, 3328]
    - [76, 43.132]
  - - [448, 2944, 1, 1]
    - [53, 1.119]
  - - [448, 1856, 1, 1280]
    - [75, 43.337]
  - - [2368, 448, 1, 1]
    - [53, 0.981]
  - - [448, 2944, 1, 32]
    - [53, 26.157]
  - - [448, 2944, 1, 1280]
    - [65, 46.051]
  - - [128, 2368, 1, 1280]
    - [65, 26.881]
  - - [448, 2944, 1, 3328]
    - [58, 47.342]
  - - [2368, 128, 1, 1280]
    - [65, 26.847]
  - - [128, 3584, 1, 3328]
    - [65, 43.761]
  - - [256, 4288, 1, 3328]
    - [91, 57.834]
  - - [1856, 704, 1, 32]
    - [53, 26.055]
  - - [2944, 448, 1, 32]
    - [80, 26.157]
  - - [5056, 128, 1, 32]
    - [53, 14.244]
  - - [6784, 128, 1, 1280]
    - [65, 45.39]
  - - [1408, 704, 1, 3328]
    - [85, 52.399]
  - - [1856, 704, 1, 1]
    - [53, 1.117]
  - - [256, 1856, 1, 3328]
    - [73, 45.837]
  - - [4288, 128, 1, 1280]
    - [65, 47.966]
  - - [128, 4288, 1, 256]
    - [64, 36.019]
  - - [6784, 128, 1, 32]
    - [53, 18.223]
  - - [1408, 448, 1, 1]
    - [80, 0.652]
  - - [64, 5056, 1, 1280]
    - [75, 27.176]
  - - [448, 1408, 1, 32]
    - [53, 14.688]
  - - [128, 5056, 1, 256]
    - [64, 33.134]
  - - [1024, 1024, 1, 1]
    - [87, 0.97]
  - - [256, 1408, 1, 1280]
    - [77, 33.105]
  - - [64, 5888, 1, 3328]
    - [63, 32.981]
  - - [6784, 64, 1, 3328]
    - [64, 37.709]
  - - [2944, 448, 1, 3328]
    - [76, 48.548]
  - - [448, 1408, 1, 1280]
    - [57, 36.662]
  - - [2368, 128, 1, 1]
    - [53, 0.35]
  - - [5056, 64, 1, 256]
    - [63, 21.629]
  - - [2368, 128, 1, 256]
    - [63, 20.74]
  - - [64, 6784, 1, 32]
    - [53, 9.673]
  - - [256, 4288, 1, 1]
    - [53, 0.848]
  - - [128, 2944, 1, 256]
    - [63, 25.304]
  - - [3584, 128, 1, 32]
    - [53, 10.546]
  - - [3584, 128, 1, 3328]
    - [65, 43.696]
  - - [704, 704, 1, 3328]
    - [85, 47.605]
  - - [128, 2944, 1, 1]
    - [53, 0.397]
  - - [704, 1408, 1, 1280]
    - [58, 51.055]
  - - [6784, 64, 1, 32]
    - [53, 10.309]
  - - [64, 6784, 1, 1280]
    - [89, 33.378]
  - - [704, 1408, 1, 256]
    - [65, 42.976]
  - - [4288, 128, 1, 32]
    - [53, 13.12]
  - - [448, 704, 1, 256]
    - [63, 21.683]
  - - [1856, 256, 1, 3328]
    - [73, 45.672]
  - - [448, 1024, 1, 1280]
    - [73, 40.263]
  - - [1024, 1024, 1, 256]
    - [73, 47.161]
  - - [256, 2944, 1, 32]
    - [53, 15.908]
  - - [704, 1024, 1, 1280]
    - [72, 41.815]
  - - [256, 3584, 1, 1280]
    - [73, 47.993]
  - - [128, 2368, 1, 32]
    - [53, 7.442]
  - - [704, 1856, 1, 256]
    - [76, 42.534]
  - - [1856, 448, 1, 32]
    - [53, 18.64]
  - - [1408, 448, 1, 256]
    - [76, 32.236]
  - - [448, 1024, 1, 1]
    - [53, 0.492]
  - - [1024, 704, 1, 256]
    - [64, 36.712]
  - - [64, 5888, 1, 32]
    - [53, 8.554]
  - - [1856, 448, 1, 256]
    - [89, 38.354]
  - - [128, 5888, 1, 3328]
    - [84, 45.41]
  - - [2368, 256, 1, 3328]
    - [76, 36.092]
  - - [64, 5888, 1, 1280]
    - [63, 31.429]
  - - [1408, 256, 1, 1]
    - [53, 0.395]
  - - [704, 704, 1, 1280]
    - [73, 43.34]
  - - [128, 3584, 1, 1]
    - [68, 0.462]
  - - [128, 3584, 1, 32]
    - [53, 10.821]
  - - [448, 2368, 1, 32]
    - [53, 22.263]
  - - [448, 2368, 1, 3328]
    - [63, 41.808]
  - - [1024, 704, 1, 3328]
    - [76, 43.31]
  - - [2048, 400, 1, 512]
    - [91, 39.656]
  - - [2560, 128, 1, 2560]
    - [91, 30.463]
  - - [1024, 700, 1, 512]
    - [76, 37.393]
  - - [4096, 128, 1, 4096]
    - [77, 47.766]
  - - [3072, 128, 1, 1024]
    - [65, 34.174]
  - - [7680, 64, 1, 2560]
    - [89, 37.838]
  - - [7680, 128, 1, 2560]
    - [65, 51.246]
  - - [1024, 1024, 1, 1024]
    - [77, 53.353]
  - - [2049, 512, 1, 2048]
    - [91, 54.01]
  - - [1023, 512, 1, 1024]
    - [76, 40.684]
  - - [1024, 512, 1, 1025]
    - [85, 46.376]
  - - [1024, 1024, 1, 1023]
    - [73, 53.656]
  - - [1024, 1025, 1, 1024]
    - [65, 52.165]
  - - [1024, 1023, 1, 1024]
    - [77, 51.332]
  - - [2048, 511, 1, 2048]
    - [77, 52.35]
  - - [2047, 512, 1, 2048]
    - [65, 52.965]
  - - [1025, 1024, 1, 1024]
    - [77, 52.798]
  - - [1024, 1024, 1, 1025]
    - [73, 53.523]
  - - [1025, 512, 1, 1024]
    - [76, 38.584]
  - - [1024, 512, 1, 1023]
    - [85, 46.286]
  - - [2048, 513, 1, 2048]
    - [90, 43.001]
  - - [1024, 511, 1, 1024]
    - [90, 39.945]
  - - [2048, 512, 1, 2047]
    - [73, 55.048]
  - - [1024, 513, 1, 1024]
    - [76, 37.968]
  - - [2048, 512, 1, 2049]
    - [73, 55.027]
  - - [1023, 1024, 1, 1024]
    - [77, 51.616]
  - - [64, 128, 512, 128]
    - [74, 32.142]
  - - [64, 512, 64, 512]
    - [92, 29.89]
  - - [256, 1280, 1, 1024]
    - [65, 29.385]
  - - [256, 1536, 1, 1024]
    - [65, 35.07]
  - - [256, 2304, 1, 1024]
    - [65, 50.24]
  - - [256, 2560, 1, 1024]
    - [76, 38.268]
  - - [256, 2816, 1, 1024]
    - [76, 42.031]
  - - [256, 3328, 1, 1024]
    - [76, 49.054]
  - - [256, 3584, 1, 1024]
    - [65, 47.287]
  - - [512, 1600, 1, 512]
    - [76, 44.885]
  - - [1024, 512, 1, 1024]
    - [90, 41.648]
  - - [1024, 512, 1, 1600]
    - [54, 50.437]
  - - [1024, 960, 1, 1024]
    - [65, 48.316]
  - - [1024, 960, 1, 1600]
    - [85, 51.039]
  - - [2048, 215, 1, 512]
    - [90, 31.047]
  - - [2048, 215, 1, 768]
    - [91, 33.576]
  - - [2048, 256, 1, 512]
    - [91, 40.806]
  - - [2048, 256, 1, 768]
    - [91, 44.307]
  - - [2048, 512, 1, 67]
    - [81, 30.596]
  - - [2048, 512, 1, 74]
    - [82, 31.596]
  - - [2048, 512, 1, 100]
    - [70, 35.949]
  - - [2048, 512, 1, 2048]
    - [65, 54.141]
  - - [1024, 512, 1, 4096]
    - [65, 47.08]
  - - [30522, 77, 1, 1024]
    - [91, 36.274]
  - - [1024, 780, 1, 1024]
    - [90, 44.459]
  - - [1024, 800, 1, 1024]
    - [76, 45.401]
  - - [1024, 820, 1, 1024]
    - [76, 46.604]
  - - [1024, 385, 1, 1024]
    - [76, 30.871]
  - - [1024, 462, 1, 1024]
    - [76, 36.649]
  - - [1024, 1024, 1, 4096]
    - [77, 54.303]
  - - [480, 1024, 1, 1024]
    - [77, 41.167]
  - - [480, 2048, 1, 2048]
    - [77, 50.825]
  - - [1024, 480, 1, 1024]
    - [76, 38.23]
  - - [2048, 480, 1, 2048]
    - [91, 49.92]
  - - [64, 1024, 256, 1024]
    - [92, 35.496]
  - - [64, 512, 40, 512]
    - [63, 27.406]
  - - [96, 1024, 64, 1024]
    - [65, 45.201]
  - - [64, 1024, 128, 1024]
    - [92, 34.67]
  - - [64, 1024, 32, 1024]
    - [66, 30.077]
  - - [64, 512, 128, 512]
    - [66, 33.006]
  - - [96, 1024, 128, 1024]
    - [65, 44.086]
  - - [64, 512, 256, 512]
    - [78, 34.564]
  - - [64, 1024, 64, 1024]
    - [66, 33.242]
  - - [960, 1024, 1, 1024]
    - [65, 47.605]
  - - [64, 128, 1024, 128]
    - [74, 33.849]
  - - [1024, 864, 1, 1024]
    - [65, 43.337]
  - - [1024, 864, 1, 480]
    - [69, 41.871]
  - - [128, 3456, 1, 256]
    - [64, 29.164]
  - - [128, 4096, 1, 256]
    - [64, 34.406]
  - - [128, 6912, 1, 256]
    - [65, 40.168]
  - - [256, 3456, 1, 512]
    - [65, 43.595]
  - - [256, 4096, 1, 512]
    - [65, 51.188]
  - - [512, 864, 1, 1024]
    - [77, 37.294]
  - - [512, 864, 1, 13]
    - [56, 3.544]
  - - [64, 128, 1280, 128]
    - [74, 34.375]
  - - [64, 128, 1312, 128]
    - [59, 34.255]
  - - [64, 512, 192, 512]
    - [92, 33.969]
  - - [1024, 512, 1, 196]
    - [54, 31.327]
  - - [2048, 512, 1, 49]
    - [87, 26.583]
  - - [2304, 256, 1, 196]
    - [81, 35.53]
  - - [512, 1024, 1, 196]
    - [81, 33.597]
  - - [512, 2048, 1, 49]
    - [80, 26.831]
  - - [64, 128, 2048, 128]
    - [66, 34.352]
  - - [64, 128, 1536, 128]
    - [74, 33.969]
  - - [128, 128, 64, 6400]
    - [65, 45.993]
  - - [64, 128, 192, 128]
    - [71, 31.278]
  - - [64, 384, 144, 384]
    - [83, 35.433]
  - - [64, 512, 48, 512]
    - [92, 29.919]
  - - [64, 128, 256, 128]
    - [66, 27.576]
  - - [64, 384, 192, 384]
    - [56, 42.764]
  - - [512, 1024, 1, 1024]
    - [77, 45.257]
  - - [512, 2048, 1, 2048]
    - [77, 54.504]
  - - [128, 128, 49, 1120]
    - [57, 46.672]
  - - [128, 128, 49, 1064]
    - [69, 50.764]
  - - [128, 128, 49, 1040]
    - [69, 50.768]
  - - [128, 128, 64, 600]
    - [58, 50.761]
  - - [128, 128, 64, 616]
    - [85, 50.913]
  - - [128, 128, 49, 950]
    - [84, 45.564]
  - - [128, 128, 49, 972]
    - [57, 45.747]
  - - [128, 128, 64, 560]
    - [58, 51.224]
  - - [128, 128, 49, 1008]
    - [69, 51.107]
  - - [128, 128, 64, 532]
    - [58, 49.936]
  - - [128, 128, 49, 1080]
    - [54, 46.771]
  - - [128, 128, 64, 588]
    - [85, 50.725]
  - - [128, 128, 49, 1160]
    - [57, 46.295]
  - - [128, 128, 49, 988]
    - [81, 47.062]
  - - [128, 128, 49, 936]
    - [84, 45.74]
  - - [512, 1024, 1, 3800]
    - [81, 51.528]
  - - [512, 1024, 1, 3400]
    - [81, 51.501]
  - - [512, 1024, 1, 3456]
    - [73, 51.661]
  - - [512, 1024, 1, 3072]
    - [65, 48.199]
  - - [2048, 512, 1, 950]
    - [85, 53.631]
  - - [512, 1024, 1, 3552]
    - [73, 51.725]
  - - [512, 1024, 1, 3220]
    - [81, 51.201]
  - - [2048, 512, 1, 850]
    - [85, 53.022]
  - - [512, 2048, 1, 864]
    - [73, 53.953]
  - - [512, 2048, 1, 768]
    - [73, 53.026]
  - - [2048, 512, 1, 805]
    - [73, 52.981]
  - - [512, 1024, 1, 2852]
    - [81, 51.014]
  - - [512, 2048, 1, 888]
    - [73, 53.556]
  - - [2048, 512, 1, 864]
    - [73, 53.838]
  - - [2048, 512, 1, 768]
    - [85, 53.026]
  - - [2048, 512, 1, 888]
    - [85, 53.394]
  - - [2048, 256, 1, 950]
    - [73, 45.307]
  - - [2048, 512, 1, 713]
    - [85, 52.507]
  - - [512, 1024, 1, 2688]
    - [73, 51.061]
  - - [512, 1024, 1, 2640]
    - [73, 51.07]
  - - [512, 1024, 1, 2904]
    - [81, 51.172]
  - - [1024, 512, 1, 950]
    - [69, 47.249]
  - - [512, 2048, 1, 672]
    - [73, 53.198]
  - - [512, 2048, 1, 660]
    - [73, 52.354]
  - - [512, 2048, 1, 1008]
    - [73, 54.364]
  - - [2048, 256, 1, 850]
    - [69, 44.759]
  - - [2048, 512, 1, 726]
    - [85, 52.742]
  - - [1024, 512, 1, 850]
    - [69, 46.414]
  - - [2048, 512, 1, 660]
    - [85, 52.318]
  - - [2048, 512, 1, 672]
    - [73, 52.986]
  - - [512, 2048, 1, 840]
    - [70, 53.385]
  - - [2048, 512, 1, 1008]
    - [73, 54.389]
  - - [512, 2048, 1, 792]
    - [82, 53.252]
  - - [1024, 512, 1, 805]
    - [69, 45.598]
  - - [512, 2048, 1, 1050]
    - [73, 53.994]
  - - [2048, 512, 1, 748]
    - [85, 52.848]
  - - [2048, 256, 1, 864]
    - [54, 47.484]
  - - [1024, 512, 1, 768]
    - [91, 44.833]
  - - [1024, 512, 1, 864]
    - [54, 48.291]
  - - [2048, 512, 1, 875]
    - [73, 53.29]
  - - [2048, 512, 1, 840]
    - [85, 53.27]
  - - [2048, 512, 1, 792]
    - [85, 53.071]
  - - [512, 2048, 1, 736]
    - [73, 53.437]
  - - [2048, 256, 1, 888]
    - [53, 45.704]
  - - [512, 2048, 1, 704]
    - [85, 53.408]
  - - [512, 2048, 1, 588]
    - [73, 51.937]
  - - [1024, 512, 1, 888]
    - [54, 47.653]
  - - [512, 2048, 1, 816]
    - [85, 53.766]
  - - [1024, 512, 1, 713]
    - [69, 44.856]
  - - [2048, 512, 1, 736]
    - [85, 53.568]
  - - [2048, 512, 1, 588]
    - [85, 51.898]
  - - [2048, 512, 1, 704]
    - [85, 53.238]
  - - [1024, 512, 1, 660]
    - [69, 45.122]
  - - [2048, 256, 1, 660]
    - [69, 43.655]
  - - [2048, 256, 1, 672]
    - [54, 46.588]
  - - [1024, 512, 1, 672]
    - [54, 46.807]
  - - [1024, 512, 1, 726]
    - [69, 45.48]
  - - [512, 2048, 1, 630]
    - [73, 52.216]
  - - [512, 2048, 1, 600]
    - [82, 52.255]
  - - [2048, 256, 1, 805]
    - [69, 44.657]
  - - [2048, 256, 1, 713]
    - [69, 43.829]
  - - [2048, 256, 1, 726]
    - [81, 43.899]
  - - [320, 1024, 1, 1024]
    - [63, 27.932]
  - - [1024, 1000, 1, 1024]
    - [77, 50.479]
  - - [320, 1000, 1, 1024]
    - [65, 27.057]
  - - [128, 128, 49, 1280]
    - [64, 46.049]
  - - [128, 128, 49, 1360]
    - [69, 50.042]
  - - [128, 128, 49, 1200]
    - [57, 46.857]
  - - [128, 128, 49, 1240]
    - [81, 48.149]
  - - [2304, 256, 1, 704]
    - [69, 51.695]
  - - [2304, 256, 1, 736]
    - [81, 51.869]
  - - [2304, 256, 1, 792]
    - [69, 50.761]
  - - [2304, 256, 1, 748]
    - [69, 49.32]
  - - [2304, 256, 1, 726]
    - [81, 49.036]
  - - [2304, 256, 1, 713]
    - [69, 48.65]
  - - [2304, 256, 1, 768]
    - [91, 49.798]
  - - [512, 2048, 1, 759]
    - [73, 52.713]
  - - [512, 2048, 1, 925]
    - [73, 53.602]
  - - [2304, 256, 1, 805]
    - [69, 49.543]
  - - [512, 2048, 1, 900]
    - [73, 53.383]
  - - [512, 2048, 1, 875]
    - [73, 53.428]
  - - [512, 2048, 1, 748]
    - [85, 52.848]
  - - [512, 2048, 1, 726]
    - [73, 52.71]
  - - [512, 2048, 1, 713]
    - [73, 52.706]
  - - [512, 2048, 1, 805]
    - [73, 53.071]
  - - [512, 2048, 1, 850]
    - [73, 53.247]
  - - [512, 2048, 1, 950]
    - [73, 53.606]
  - - [128, 128, 49, 1152]
    - [84, 46.947]
  - - [128, 128, 49, 1216]
    - [69, 47.73]
  - - [128, 128, 36, 1800]
    - [58, 54.382]
  - - [128, 128, 36, 1900]
    - [73, 54.673]
  - - [128, 128, 64, 5880]
    - [77, 53.834]
  - - [128, 128, 49, 7680]
    - [67, 34.521]
  - - [128, 128, 64, 882]
    - [58, 51.086]
  - - [128, 128, 64, 931]
    - [58, 52.485]
  - - [128, 64, 121, 1152]
    - [57, 43.631]
  - - [128, 64, 81, 12000]
    - [63, 32.796]
  - - [128, 64, 121, 1216]
    - [57, 43.132]
  - - [128, 64, 81, 1800]
    - [72, 38.97]
  - - [128, 64, 81, 1900]
    - [57, 39.067]
  - - [128, 64, 49, 20280]
    - [72, 34.659]
  - - [128, 64, 49, 3042]
    - [83, 35.415]
  - - [128, 64, 49, 3211]
    - [71, 35.986]
  - - [128, 64, 169, 5880]
    - [57, 32.43]
  - - [128, 64, 121, 7680]
    - [79, 26.123]
  - - [128, 64, 169, 882]
    - [60, 34.781]
  - - [128, 64, 169, 931]
    - [86, 35.133]
  - - [256, 128, 25, 1080]
    - [72, 47.161]
  - - [256, 128, 25, 162]
    - [57, 34.891]
  - - [256, 128, 25, 171]
    - [57, 35.268]
  - - [1152, 256, 1, 1]
    - [53, 0.327]
  - - [1152, 256, 1, 1444]
    - [69, 28.728]
  - - [1152, 256, 1, 25]
    - [66, 5.434]
  - - [1152, 256, 1, 9]
    - [56, 2.698]
  - - [2304, 256, 1, 1444]
    - [73, 53.759]
  - - [2304, 340, 1, 1]
    - [53, 0.453]
  - - [2304, 340, 1, 1444]
    - [73, 40.529]
  - - [2304, 340, 1, 9]
    - [57, 4.518]
  - - [2304, 510, 1, 25]
    - [53, 13.749]
  - - [96, 1024, 160, 1024]
    - [65, 44.632]
  - - [96, 1024, 40, 1024]
    - [65, 46.437]
  - - [96, 1024, 80, 1024]
    - [91, 44.54]
  - - [96, 1024, 96, 1024]
    - [91, 43.983]
  - - [96, 1024, 24, 1024]
    - [65, 42.354]
  - - [96, 1024, 48, 1024]
    - [65, 46.728]
  - - [96, 1024, 16, 1024]
    - [65, 40.407]
  - - [96, 1024, 32, 1024]
    - [77, 42.906]
  - - [64, 512, 320, 512]
    - [78, 34.436]
  - - [64, 512, 80, 512]
    - [66, 31.905]
  - - [29000, 109, 1, 2560]
    - [65, 48.688]
  - - [29000, 121, 1, 2560]
    - [65, 53.773]
  - - [29000, 65, 1, 2560]
    - [91, 29.319]
  - - [29000, 66, 1, 2560]
    - [77, 29.935]
  - - [29000, 67, 1, 2560]
    - [77, 30.402]
  - - [29000, 69, 1, 2560]
    - [77, 30.829]
  - - [29000, 70, 1, 2560]
    - [91, 31.517]
  - - [29000, 71, 1, 2560]
    - [65, 32.038]
  - - [29000, 73, 1, 2560]
    - [77, 33.078]
  - - [29000, 74, 1, 2560]
    - [65, 33.387]
  - - [29000, 75, 1, 2560]
    - [77, 33.851]
  - - [29000, 77, 1, 2560]
    - [65, 34.397]
  - - [29000, 78, 1, 2560]
    - [77, 35.257]
  - - [29000, 80, 1, 2560]
    - [91, 36.134]
  - - [29000, 81, 1, 2560]
    - [65, 36.635]
  - - [29000, 82, 1, 2560]
    - [91, 37.012]
  - - [29000, 83, 1, 2560]
    - [77, 37.391]
  - - [29000, 84, 1, 2560]
    - [91, 37.876]
  - - [29000, 88, 1, 2560]
    - [65, 39.744]
  - - [29000, 89, 1, 2560]
    - [65, 40.242]
  - - [29000, 90, 1, 2560]
    - [65, 40.384]
  - - [29000, 92, 1, 2560]
    - [91, 41.21]
  - - [29000, 95, 1, 2560]
    - [77, 42.618]
  - - [29000, 98, 1, 2560]
    - [65, 43.978]
  - - [64, 1024, 512, 1024]
    - [92, 35.893]
  - - [64, 64, 36, 50176]
    - [108, 26.673]
  - - [64, 64, 49, 36864]
    - [97, 20.009]
  - - [64, 64, 64, 25600]
    - [92, 23.736]
  - - [256, 256, 1, 60800]
    - [104, 35.521]
  - - [256, 256, 1, 54400]
    - [94, 35.647]
  - - [256, 256, 1, 51520]
    - [104, 35.491]
  - - [256, 256, 1, 55296]
    - [109, 27.485]
  - - [256, 256, 1, 56832]
    - [105, 27.616]
  - - [256, 256, 1, 45632]
    - [104, 35.288]
  - - [256, 256, 1, 49152]
    - [98, 27.321]
  - - [256, 512, 1, 13600]
    - [100, 44.869]
  - - [256, 256, 1, 43008]
    - [102, 27.138]
  - - [256, 512, 1, 15200]
    - [100, 45.749]
  - - [256, 512, 1, 12880]
    - [100, 44.407]
  - - [256, 512, 1, 13824]
    - [99, 39.056]
  - - [512, 256, 1, 13824]
    - [107, 39.902]
  - - [256, 512, 1, 14208]
    - [100, 45.212]
  - - [512, 256, 1, 14208]
    - [100, 45.3]
  - - [512, 256, 1, 15200]
    - [95, 45.776]
  - - [256, 512, 1, 12288]
    - [101, 38.359]
  - - [512, 256, 1, 12288]
    - [96, 38.286]
  - - [128, 64, 25, 43320]
    - [96, 37.154]
  - - [64, 64, 64, 20280]
    - [93, 27.359]
  - - [64, 64, 49, 27000]
    - [103, 28.298]
  - - [64, 64, 36, 43320]
    - [106, 27.88]
  - - [32, 5056, 1, 1280]
    - [156, 14.925]
  - - [4288, 64, 1, 3328]
    - [150, 21.325]
  - - [2368, 64, 1, 1]
    - [114, 0.208]
  - - [1408, 128, 1, 32]
    - [128, 6.256]
  - - [32, 2944, 1, 3328]
    - [152, 12.752]
  - - [2368, 32, 1, 256]
    - [119, 9.272]
  - - [1024, 128, 1, 32]
    - [128, 4.981]
  - - [32, 4288, 1, 1280]
    - [138, 16.481]
  - - [32, 5056, 1, 32]
    - [110, 5.782]
  - - [5888, 32, 1, 32]
    - [145, 6.355]
  - - [64, 2368, 1, 1280]
    - [120, 15.617]
  - - [128, 704, 1, 32]
    - [112, 3.826]
  - - [32, 4288, 1, 3328]
    - [156, 16.341]
  - - [1408, 64, 1, 1]
    - [114, 0.138]
  - - [1856, 64, 1, 256]
    - [120, 12.337]
  - - [1024, 256, 1, 256]
    - [115, 17.686]
  - - [1856, 128, 1, 32]
    - [150, 7.724]
  - - [1856, 128, 1, 1280]
    - [150, 18.381]
  - - [4288, 32, 1, 3328]
    - [138, 15.902]
  - - [3584, 64, 1, 1280]
    - [120, 17.539]
  - - [64, 1856, 1, 256]
    - [120, 12.121]
  - - [3584, 64, 1, 32]
    - [128, 7.138]
  - - [1408, 128, 1, 3328]
    - [129, 17.756]
  - - [32, 6784, 1, 3328]
    - [138, 16.84]
  - - [32, 3584, 1, 256]
    - [120, 11.661]
  - - [704, 256, 1, 32]
    - [145, 6.316]
  - - [64, 2944, 1, 3328]
    - [113, 17.429]
  - - [64, 4288, 1, 3328]
    - [115, 21.363]
  - - [256, 704, 1, 256]
    - [120, 16.364]
  - - [5056, 32, 1, 3328]
    - [138, 15.419]
  - - [2944, 32, 1, 1280]
    - [120, 11.952]
  - - [64, 1408, 1, 3328]
    - [112, 13.276]
  - - [256, 448, 1, 1280]
    - [113, 14.212]
  - - [448, 448, 1, 256]
    - [138, 16.278]
  - - [1024, 256, 1, 1]
    - [114, 0.356]
  - - [1856, 64, 1, 32]
    - [128, 4.661]
  - - [4288, 64, 1, 256]
    - [123, 18.051]
  - - [1408, 64, 1, 256]
    - [119, 10.709]
  - - [6784, 32, 1, 32]
    - [145, 6.995]
  - - [448, 448, 1, 1280]
    - [158, 17.519]
  - - [32, 5888, 1, 256]
    - [120, 14.744]
  - - [1024, 128, 1, 256]
    - [120, 12.874]
  - - [1856, 64, 1, 1280]
    - [148, 13.731]
  - - [128, 1408, 1, 1]
    - [114, 0.262]
  - - [32, 2368, 1, 1280]
    - [119, 11.627]
  - - [448, 256, 1, 256]
    - [138, 12.13]
  - - [2944, 32, 1, 32]
    - [145, 4.0]
  - - [448, 448, 1, 32]
    - [113, 6.707]
  - - [704, 256, 1, 3328]
    - [146, 17.343]
  - - [64, 2944, 1, 1]
    - [114, 0.273]
  - - [64, 2944, 1, 32]
    - [110, 6.355]
  - - [64, 2944, 1, 1280]
    - [120, 17.217]
  - - [32, 3584, 1, 1280]
    - [138, 14.056]
  - - [32, 2944, 1, 32]
    - [114, 4.047]
  - - [32, 6784, 1, 256]
    - [138, 14.715]
  - - [448, 448, 1, 3328]
    - [158, 18.036]
  - - [704, 128, 1, 1280]
    - [157, 12.319]
  - - [32, 3584, 1, 3328]
    - [138, 14.749]
  - - [128, 704, 1, 1280]
    - [130, 12.867]
  - - [64, 4288, 1, 1]
    - [114, 0.381]
  - - [3584, 32, 1, 32]
    - [145, 4.5]
  - - [3584, 64, 1, 1]
    - [114, 0.32]
  - - [32, 4288, 1, 32]
    - [114, 5.213]
  - - [64, 1408, 1, 1]
    - [114, 0.138]
  - - [256, 1024, 1, 256]
    - [123, 17.645]
  - - [1408, 128, 1, 1280]
    - [131, 16.222]
  - - [64, 4288, 1, 1280]
    - [150, 20.799]
  - - [64, 3584, 1, 1]
    - [114, 0.323]
  - - [1024, 128, 1, 1280]
    - [158, 15.511]
  - - [2368, 32, 1, 32]
    - [145, 3.296]
  - - [128, 1408, 1, 256]
    - [120, 16.161]
  - - [256, 448, 1, 3328]
    - [111, 15.207]
  - - [2368, 64, 1, 256]
    - [138, 13.675]
  - - [32, 2368, 1, 3328]
    - [119, 12.281]
  - - [128, 1856, 1, 1]
    - [114, 0.334]
  - - [128, 1856, 1, 32]
    - [150, 7.724]
  - - [3584, 32, 1, 256]
    - [120, 11.498]
  - - [64, 3584, 1, 256]
    - [120, 15.583]
  - - [32, 2944, 1, 1280]
    - [120, 12.502]
  - - [4288, 32, 1, 32]
    - [145, 5.159]
  - - [1856, 64, 1, 1]
    - [114, 0.178]
  - - [128, 1024, 1, 3328]
    - [148, 17.228]
  - - [1408, 128, 1, 1]
    - [114, 0.264]
  - - [5056, 32, 1, 256]
    - [120, 13.822]
  - - [64, 1408, 1, 1280]
    - [119, 13.249]
  - - [3584, 32, 1, 1280]
    - [138, 13.059]
  - - [1856, 128, 1, 3328]
    - [150, 18.845]
  - - [704, 256, 1, 1280]
    - [148, 16.427]
  - - [1856, 128, 1, 1]
    - [114, 0.334]
  - - [256, 704, 1, 1]
    - [114, 0.262]
  - - [1024, 128, 1, 1]
    - [114, 0.194]
  - - [1856, 128, 1, 256]
    - [138, 16.064]
  - - [1024, 256, 1, 1280]
    - [115, 20.359]
  - - [64, 2368, 1, 32]
    - [110, 5.525]
  - - [32, 2368, 1, 256]
    - [119, 9.08]
  - - [32, 6784, 1, 1280]
    - [156, 15.214]
  - - [32, 6784, 1, 32]
    - [145, 6.995]
  - - [64, 3584, 1, 3328]
    - [141, 17.952]
  - - [32, 5888, 1, 1280]
    - [138, 16.971]
  - - [448, 256, 1, 1]
    - [114, 0.167]
  - - [448, 256, 1, 3328]
    - [133, 14.902]
  - - [128, 704, 1, 3328]
    - [112, 13.58]
  - - [2368, 32, 1, 3328]
    - [128, 11.564]
  - - [2944, 64, 1, 3328]
    - [148, 16.912]
  - - [128, 1024, 1, 32]
    - [110, 4.929]
  - - [32, 2368, 1, 32]
    - [145, 3.296]
  - - [64, 1856, 1, 1280]
    - [131, 14.683]
  - - [32, 3584, 1, 32]
    - [110, 4.6]
  - - [704, 256, 1, 1]
    - [114, 0.257]
  - - [1024, 256, 1, 3328]
    - [150, 20.914]
  - - [128, 1856, 1, 1280]
    - [133, 18.421]
  - - [448, 256, 1, 32]
    - [110, 4.5]
  - - [64, 4288, 1, 32]
    - [150, 8.766]
  - - [128, 704, 1, 1]
    - [114, 0.131]
  - - [4288, 64, 1, 1280]
    - [150, 20.799]
  - - [448, 448, 1, 1]
    - [114, 0.282]
  - - [32, 5888, 1, 32]
    - [145, 6.355]
  - - [1024, 128, 1, 3328]
    - [120, 17.731]
  - - [4288, 64, 1, 32]
    - [150, 8.843]
  - - [2368, 64, 1, 32]
    - [110, 5.525]
  - - [64, 1408, 1, 32]
    - [110, 3.826]
  - - [32, 2944, 1, 256]
    - [120, 9.892]
  - - [2944, 64, 1, 1]
    - [114, 0.268]
  - - [2944, 64, 1, 32]
    - [113, 6.355]
  - - [64, 2944, 1, 256]
    - [120, 15.369]
  - - [64, 2368, 1, 256]
    - [138, 13.465]
  - - [1408, 64, 1, 3328]
    - [147, 12.872]
  - - [6784, 32, 1, 1280]
    - [156, 16.601]
  - - [2944, 64, 1, 1280]
    - [148, 16.617]
  - - [2944, 32, 1, 256]
    - [119, 9.964]
  - - [256, 1024, 1, 3328]
    - [115, 20.959]
  - - [1856, 64, 1, 3328]
    - [115, 15.105]
  - - [5888, 32, 1, 256]
    - [120, 14.625]
  - - [128, 704, 1, 256]
    - [119, 10.979]
  - - [3584, 64, 1, 256]
    - [120, 15.694]
  - - [64, 1856, 1, 32]
    - [110, 4.661]
  - - [64, 1856, 1, 3328]
    - [131, 15.486]
  - - [5888, 32, 1, 1280]
    - [138, 17.034]
  - - [256, 704, 1, 32]
    - [128, 6.195]
  - - [256, 704, 1, 1280]
    - [120, 17.533]
  - - [1408, 64, 1, 32]
    - [145, 3.826]
  - - [128, 1408, 1, 1280]
    - [120, 17.052]
  - - [128, 1856, 1, 3328]
    - [115, 18.897]
  - - [2368, 64, 1, 3328]
    - [120, 14.857]
  - - [32, 5056, 1, 3328]
    - [138, 15.568]
  - - [64, 1856, 1, 1]
    - [112, 0.176]
  - - [704, 128, 1, 32]
    - [112, 3.783]
  - - [4288, 64, 1, 1]
    - [114, 0.372]
  - - [5056, 32, 1, 1280]
    - [156, 15.387]
  - - [128, 1024, 1, 1]
    - [114, 0.194]
  - - [256, 1024, 1, 1]
    - [114, 0.365]
  - - [1408, 64, 1, 1280]
    - [119, 12.843]
  - - [1024, 256, 1, 32]
    - [150, 8.299]
  - - [2368, 32, 1, 1280]
    - [119, 10.695]
  - - [704, 128, 1, 1]
    - [114, 0.133]
  - - [256, 448, 1, 256]
    - [120, 12.22]
  - - [32, 4288, 1, 256]
    - [120, 13.709]
  - - [128, 1408, 1, 32]
    - [110, 6.195]
  - - [704, 128, 1, 3328]
    - [146, 13.034]
  - - [64, 4288, 1, 256]
    - [123, 18.092]
  - - [4288, 32, 1, 1280]
    - [156, 15.649]
  - - [32, 5056, 1, 256]
    - [120, 13.74]
  - - [704, 128, 1, 256]
    - [119, 10.578]
  - - [256, 1024, 1, 32]
    - [131, 8.227]
  - - [256, 1024, 1, 1280]
    - [133, 20.425]
  - - [6784, 32, 1, 256]
    - [120, 14.749]
  - - [64, 2368, 1, 1]
    - [112, 0.221]
  - - [1408, 128, 1, 256]
    - [138, 14.257]
  - - [5888, 32, 1, 3328]
    - [138, 16.804]
  - - [64, 2368, 1, 3328]
    - [120, 15.611]
  - - [256, 704, 1, 3328]
    - [111, 18.254]
  - - [128, 1408, 1, 3328]
    - [111, 17.864]
  - - [2944, 32, 1, 3328]
    - [138, 12.906]
  - - [2368, 64, 1, 1280]
    - [138, 14.442]
  - - [128, 1024, 1, 1280]
    - [131, 16.484]
  - - [128, 1024, 1, 256]
    - [120, 13.813]
  - - [3584, 64, 1, 3328]
    - [115, 17.875]
  - - [256, 448, 1, 1]
    - [114, 0.167]
  - - [256, 448, 1, 32]
    - [112, 4.451]
  - - [64, 3584, 1, 32]
    - [150, 7.595]
  - - [64, 3584, 1, 1280]
    - [150, 17.56]
  - - [4288, 32, 1, 256]
    - [120, 13.569]
  - - [448, 256, 1, 1280]
    - [140, 13.81]
  - - [128, 1856, 1, 256]
    - [150, 16.064]
  - - [3584, 32, 1, 3328]
    - [120, 14.031]
  - - [6784, 32, 1, 3328]
    - [138, 17.045]
  - - [2944, 64, 1, 256]
    - [120, 15.155]
  - - [64, 1408, 1, 256]
    - [119, 10.621]
  - - [5056, 32, 1, 32]
    - [145, 5.782]
  - - [32, 5888, 1, 3328]
    - [138, 16.896]
  - - [704, 256, 1, 256]
    - [138, 15.865]
  - - [1024, 256, 1, 196]
    - [150, 16.653]
  - - [256, 1024, 1, 196]
    - [150, 16.896]
  - - [1760, 64, 1, 1760]
    - [111, 16.876]
  - - [2560, 32, 1, 2560]
    - [124, 10.973]
  - - [4608, 32, 1, 1536]
    - [162, 15.437]
  - - [3072, 64, 1, 1024]
    - [140, 15.365]
  - - [2048, 128, 1, 2048]
    - [160, 20.046]
  - - [4096, 64, 1, 4096]
    - [160, 19.292]
  - - [7680, 32, 1, 2560]
    - [125, 14.629]
  - - [2560, 64, 1, 2560]
    - [125, 13.562]
  - - [1760, 128, 1, 1760]
    - [111, 19.658]
  - - [3072, 32, 1, 1024]
    - [125, 12.13]
  - - [6144, 32, 1, 2560]
    - [143, 14.185]
  - - [4096, 32, 1, 4096]
    - [125, 14.253]
  - - [2048, 64, 1, 2048]
    - [125, 14.018]
  - - [8448, 32, 1, 2816]
    - [158, 17.084]
  - - [512, 512, 1, 512]
    - [123, 19.409]
  - - [511, 512, 1, 512]
    - [123, 18.746]
  - - [512, 512, 1, 511]
    - [133, 19.446]
  - - [512, 513, 1, 512]
    - [123, 19.033]
  - - [512, 511, 1, 512]
    - [123, 18.816]
  - - [513, 512, 1, 512]
    - [141, 15.685]
  - - [512, 512, 1, 513]
    - [133, 19.473]
  - - [512, 512, 1, 64]
    - [123, 12.053]
  - - [33, 33, 1600, 32]
    - [145, 7.106]
  - - [256, 684, 1, 1024]
    - [140, 15.556]
  - - [1024, 200, 1, 560]
    - [146, 16.499]
  - - [2048, 114, 1, 512]
    - [141, 16.811]
  - - [2048, 114, 1, 768]
    - [141, 17.587]
  - - [32, 32, 4608, 64]
    - [114, 15.518]
  - - [32, 35, 4608, 64]
    - [146, 11.827]
  - - [34, 34, 4736, 64]
    - [145, 7.562]
  - - [35, 35, 4608, 64]
    - [137, 7.812]
  - - [33, 33, 1920, 64]
    - [128, 7.104]
  - - [480, 512, 1, 512]
    - [123, 17.875]
  - - [512, 480, 1, 512]
    - [123, 17.785]
  - - [1024, 200, 1, 1024]
    - [123, 15.593]
  - - [1024, 308, 1, 1024]
    - [123, 16.454]
  - - [1024, 160, 1, 1024]
    - [120, 13.373]
  - - [1024, 180, 1, 1024]
    - [158, 15.631]
  - - [128, 864, 1, 256]
    - [120, 11.827]
  - - [256, 864, 1, 512]
    - [123, 15.967]
  - - [1152, 128, 1, 784]
    - [120, 18.654]
  - - [256, 512, 1, 784]
    - [146, 17.722]
  - - [512, 256, 1, 784]
    - [129, 17.429]
  - - [1024, 128, 1, 1024]
    - [141, 15.802]
  - - [1024, 96, 1, 1024]
    - [156, 13.42]
  - - [1024, 256, 1, 3800]
    - [133, 21.259]
  - - [1024, 256, 1, 3400]
    - [133, 21.241]
  - - [256, 1024, 1, 3400]
    - [115, 21.62]
  - - [1024, 256, 1, 3220]
    - [133, 21.0]
  - - [256, 1024, 1, 3220]
    - [133, 21.201]
  - - [1024, 256, 1, 3456]
    - [115, 21.183]
  - - [256, 1024, 1, 3456]
    - [133, 21.219]
  - - [1024, 256, 1, 3072]
    - [141, 19.788]
  - - [256, 1024, 1, 3072]
    - [123, 19.649]
  - - [1024, 256, 1, 3552]
    - [115, 21.174]
  - - [256, 1024, 1, 3552]
    - [133, 21.171]
  - - [256, 1024, 1, 2852]
    - [133, 21.187]
  - - [1024, 256, 1, 2852]
    - [150, 21.104]
  - - [256, 512, 1, 10752]
    - [158, 15.588]
  - - [256, 1024, 1, 3800]
    - [115, 21.645]
  - - [256, 512, 1, 10560]
    - [129, 21.158]
  - - [256, 1024, 1, 2992]
    - [150, 21.135]
  - - [256, 1024, 1, 2688]
    - [150, 21.115]
  - - [1024, 256, 1, 2688]
    - [111, 21.11]
  - - [256, 1024, 1, 2904]
    - [115, 21.541]
  - - [1024, 256, 1, 2904]
    - [150, 21.216]
  - - [256, 1024, 1, 2640]
    - [133, 21.07]
  - - [1024, 256, 1, 2640]
    - [150, 21.41]
  - - [1024, 256, 1, 4032]
    - [111, 21.25]
  - - [1024, 256, 1, 2992]
    - [150, 21.435]
  - - [256, 1024, 1, 3360]
    - [133, 21.151]
  - - [1024, 256, 1, 3360]
    - [115, 21.183]
  - - [1024, 256, 1, 3500]
    - [150, 21.325]
  - - [256, 1024, 1, 3500]
    - [133, 21.214]
  - - [1024, 256, 1, 3168]
    - [115, 21.149]
  - - [256, 1024, 1, 3168]
    - [133, 21.14]
  - - [256, 1024, 1, 3036]
    - [115, 21.507]
  - - [1024, 256, 1, 4200]
    - [133, 21.309]
  - - [1024, 256, 1, 3600]
    - [133, 21.492]
  - - [256, 1024, 1, 3600]
    - [150, 21.196]
  - - [256, 1024, 1, 2944]
    - [133, 21.153]
  - - [1024, 256, 1, 2944]
    - [129, 21.164]
  - - [1024, 256, 1, 3700]
    - [133, 21.255]
  - - [256, 1024, 1, 2352]
    - [133, 21.036]
  - - [1024, 256, 1, 2352]
    - [133, 21.358]
  - - [1024, 256, 1, 2816]
    - [133, 20.873]
  - - [256, 1024, 1, 3700]
    - [115, 21.548]
  - - [256, 1024, 1, 2816]
    - [115, 20.885]
  - - [256, 512, 1, 11408]
    - [146, 20.185]
  - - [1024, 256, 1, 3036]
    - [150, 21.058]
  - - [1024, 256, 1, 3264]
    - [111, 21.196]
  - - [256, 1024, 1, 3264]
    - [150, 21.221]
  - - [1024, 256, 1, 3864]
    - [133, 21.232]
  - - [256, 1024, 1, 4032]
    - [115, 21.289]
  - - [1024, 256, 1, 3128]
    - [150, 21.228]
  - - [256, 1024, 1, 3128]
    - [115, 21.604]
  - - [256, 1024, 1, 3200]
    - [133, 21.201]
  - - [256, 512, 1, 11616]
    - [146, 20.592]
  - - [1024, 256, 1, 3200]
    - [129, 21.196]
  - - [1024, 256, 1, 4000]
    - [111, 21.234]
  - - [256, 1024, 1, 2520]
    - [115, 21.51]
  - - [1024, 256, 1, 2520]
    - [150, 21.115]
  - - [256, 1024, 1, 2976]
    - [150, 21.133]
  - - [256, 1024, 1, 2400]
    - [150, 21.056]
  - - [1024, 256, 1, 2400]
    - [111, 21.007]
  - - [1024, 256, 1, 3696]
    - [150, 21.478]
  - - [1024, 256, 1, 3900]
    - [133, 21.241]
  - - [1024, 256, 1, 3772]
    - [150, 21.216]
  - - [256, 1024, 1, 3696]
    - [123, 21.178]
  - - [256, 1024, 1, 2728]
    - [115, 21.521]
  - - [1024, 256, 1, 2728]
    - [150, 21.16]
  - - [1024, 256, 1, 2480]
    - [133, 21.311]
  - - [256, 1024, 1, 2480]
    - [150, 21.047]
  - - [1024, 256, 1, 2880]
    - [111, 21.174]
  - - [512, 256, 1, 3220]
    - [111, 15.938]
  - - [256, 1024, 1, 2880]
    - [150, 21.183]
  - - [256, 1024, 1, 4200]
    - [115, 21.692]
  - - [1024, 256, 1, 3648]
    - [115, 21.221]
  - - [1024, 256, 1, 3312]
    - [150, 21.462]
  - - [256, 1024, 1, 3648]
    - [150, 21.255]
  - - [1024, 256, 1, 3300]
    - [133, 21.142]
  - - [1024, 256, 1, 3528]
    - [150, 21.264]
  - - [256, 1024, 1, 2604]
    - [133, 21.194]
  - - [1024, 256, 1, 2604]
    - [133, 21.153]
  - - [512, 256, 1, 11408]
    - [111, 19.633]
  - - [256, 1024, 1, 3312]
    - [150, 21.169]
  - - [256, 1024, 1, 3300]
    - [115, 21.534]
  - - [512, 256, 1, 3072]
    - [160, 14.697]
  - - [256, 1024, 1, 3528]
    - [115, 21.634]
  - - [1024, 256, 1, 2976]
    - [115, 21.146]
  - - [1024, 256, 1, 2760]
    - [150, 21.185]
  - - [512, 256, 1, 3800]
    - [111, 15.987]
  - - [256, 1024, 1, 2760]
    - [115, 21.543]
  - - [1024, 256, 1, 2160]
    - [150, 21.239]
  - - [256, 1024, 1, 2160]
    - [150, 21.002]
  - - [512, 256, 1, 11616]
    - [111, 20.589]
  - - [512, 256, 1, 2852]
    - [111, 15.845]
  - - [256, 1024, 1, 3864]
    - [115, 21.663]
  - - [512, 256, 1, 2640]
    - [129, 18.947]
  - - [256, 1024, 1, 4000]
    - [133, 21.214]
  - - [512, 256, 1, 2904]
    - [111, 16.026]
  - - [256, 1024, 1, 3900]
    - [150, 21.131]
  - - [512, 256, 1, 2688]
    - [111, 19.77]
  - - [256, 1024, 1, 3772]
    - [150, 21.124]
  - - [512, 256, 1, 3400]
    - [111, 16.028]
  - - [512, 256, 1, 3456]
    - [146, 19.928]
  - - [512, 256, 1, 3552]
    - [129, 20.641]
  - - [128, 64, 25, 6498]
    - [129, 20.519]
  - - [128, 64, 25, 6859]
    - [129, 20.307]
  - - [64, 64, 64, 3042]
    - [141, 20.754]
  - - [64, 64, 64, 3211]
    - [133, 20.702]
  - - [64, 64, 49, 4050]
    - [146, 20.58]
  - - [64, 64, 49, 4275]
    - [111, 20.499]
  - - [64, 64, 36, 6498]
    - [129, 17.411]
  - - [64, 64, 36, 6859]
    - [146, 17.454]
  - - [1152, 128, 1, 1444]
    - [111, 16.962]
  - - [512, 256, 1, 361]
    - [129, 12.985]
  - - [576, 128, 1, 1444]
    - [119, 11.751]
  - - [29000, 35, 1, 2560]
    - [141, 12.671]
  - - [29000, 36, 1, 2560]
    - [160, 13.025]
  - - [29000, 39, 1, 2560]
    - [160, 14.097]
  - - [29000, 40, 1, 2560]
    - [141, 14.426]
  - - [29000, 42, 1, 2560]
    - [141, 15.098]
  - - [29000, 43, 1, 2560]
    - [160, 15.446]
  - - [29000, 44, 1, 2560]
    - [160, 15.8]
  - - [29000, 46, 1, 2560]
    - [141, 16.402]
  - - [29000, 48, 1, 2560]
    - [160, 16.946]
  - - [29000, 49, 1, 2560]
    - [123, 17.154]
  - - [29000, 50, 1, 2560]
    - [160, 17.325]
  - - [29000, 51, 1, 2560]
    - [160, 18.092]
  - - [29000, 53, 1, 2560]
    - [123, 18.523]
  - - [29000, 54, 1, 2560]
    - [141, 18.087]
  - - [29000, 55, 1, 2560]
    - [141, 19.245]
  - - [29000, 56, 1, 2560]
    - [141, 18.735]
  - - [29000, 57, 1, 2560]
    - [160, 18.891]
  - - [29000, 58, 1, 2560]
    - [160, 19.13]
  - - [29000, 59, 1, 2560]
    - [160, 19.382]
  - - [29000, 61, 1, 2560]
    - [160, 19.52]
  - - [29000, 63, 1, 2560]
    - [123, 20.17]
  - - [256, 128, 1, 13600]
    - [165, 13.562]
  - - [256, 128, 1, 12880]
    - [170, 13.671]
  - - [128, 512, 1, 15200]
    - [166, 19.335]
  - - [512, 128, 1, 15200]
    - [170, 18.94]
  - - [128, 512, 1, 11408]
    - [166, 18.645]
  - - [256, 128, 1, 13824]
    - [178, 12.432]
  - - [128, 512, 1, 11616]
    - [166, 18.694]
  - - [256, 128, 1, 14208]
    - [175, 16.035]
  - - [128, 512, 1, 14208]
    - [176, 19.206]
  - - [256, 128, 1, 15200]
    - [165, 13.912]
  - - [512, 128, 1, 11408]
    - [170, 18.55]
  - - [512, 128, 1, 16800]
    - [175, 19.256]
  - - [128, 512, 1, 11264]
    - [180, 17.239]
  - - [512, 128, 1, 11616]
    - [175, 18.541]
  - - [512, 128, 1, 16128]
    - [166, 18.771]
  - - [512, 128, 1, 11968]
    - [166, 18.776]
  - - [128, 512, 1, 11968]
    - [176, 18.814]
  - - [512, 128, 1, 12288]
    - [176, 16.612]
  - - [128, 512, 1, 12288]
    - [174, 17.492]
  - - [128, 512, 1, 12672]
    - [176, 18.924]
  - - [512, 128, 1, 11776]
    - [166, 17.907]
  - - [512, 128, 1, 12144]
    - [175, 18.672]
  - - [512, 128, 1, 11264]
    - [166, 17.192]
  - - [128, 512, 1, 12144]
    - [176, 18.818]
  - - [512, 128, 1, 12672]
    - [170, 18.875]
  - - [128, 512, 1, 12512]
    - [166, 18.911]
  - - [128, 512, 1, 11776]
    - [176, 17.503]
  - - [256, 128, 1, 12288]
    - [169, 12.173]
  - - [40, 40, 1, 1909283]
    - [179, 1.899]
  - - [40, 40, 1, 3818566]
    - [179, 1.897]
  - - [5888, 1, 1, 3328]
    - [189, 0.871]
  - - [5056, 1, 1, 3328]
    - [187, 0.812]
  - - [6784, 1, 1, 1280]
    - [184, 0.769]
  - - [2944, 1, 1, 3328]
    - [186, 0.684]
  - - [3584, 1, 1, 1280]
    - [185, 0.681]
  - - [6784, 1, 1, 256]
    - [187, 0.72]
  - - [4288, 1, 1, 1280]
    - [185, 0.801]
  - - [5056, 1, 1, 1280]
    - [189, 0.776]
  - - [3584, 1, 1, 256]
    - [189, 0.474]
  - - [6784, 1, 1, 3328]
    - [184, 0.794]
  - - [1408, 1, 1, 1280]
    - [185, 0.332]
  - - [1408, 32, 1, 3328]
    - [147, 9.391]
  - - [4288, 1, 1, 256]
    - [185, 0.555]
  - - [2368, 1, 1, 256]
    - [190, 0.345]
  - - [1856, 32, 1, 32]
    - [182, 2.522]
  - - [5056, 1, 1, 256]
    - [187, 0.625]
  - - [5056, 1, 1, 1]
    - [182, 0.007]
  - - [1408, 1, 1, 256]
    - [121, 0.221]
  - - [1408, 1, 1, 1]
    - [182, 0.002]
  - - [4288, 1, 1, 3328]
    - [185, 0.866]
  - - [2368, 1, 1, 1280]
    - [186, 0.517]
  - - [1856, 1, 1, 1]
    - [182, 0.002]
  - - [1856, 32, 1, 256]
    - [130, 7.589]
  - - [1408, 32, 1, 32]
    - [182, 1.96]
  - - [1856, 32, 1, 1280]
    - [130, 9.657]
  - - [1408, 1, 1, 3328]
    - [185, 0.363]
  - - [5888, 1, 1, 256]
    - [189, 0.697]
  - - [5888, 1, 1, 1]
    - [182, 0.009]
  - - [1856, 32, 1, 3328]
    - [147, 10.413]
  - - [2368, 1, 1, 3328]
    - [183, 0.559]
  - - [6784, 1, 1, 1]
    - [182, 0.009]
  - - [5888, 1, 1, 1280]
    - [187, 0.817]
  - - [2944, 1, 1, 256]
    - [185, 0.426]
  - - [2944, 1, 1, 1]
    - [182, 0.005]
  - - [1408, 32, 1, 1280]
    - [121, 8.491]
  - - [1856, 1, 1, 1280]
    - [185, 0.435]
  - - [3584, 1, 1, 1]
    - [182, 0.005]
  - - [2944, 1, 1, 1280]
    - [190, 0.627]
  - - [3584, 1, 1, 3328]
    - [185, 0.729]
  - - [1856, 1, 1, 3328]
    - [185, 0.476]
  - - [4288, 1, 1, 1]
    - [182, 0.007]
  - - [1856, 1, 1, 256]
    - [121, 0.286]
  - - [1408, 32, 1, 256]
    - [121, 6.637]
  - - [2368, 1, 1, 1]
    - [182, 0.002]
  - - [1760, 32, 1, 1760]
    - [147, 9.772]
  - - [3072, 16, 1, 1024]
    - [163, 8.349]
  - - [2560, 16, 1, 2560]
    - [126, 7.591]
  - - [2048, 32, 1, 2048]
    - [139, 9.332]
  - - [1760, 16, 1, 1760]
    - [153, 6.217]
  - - [7680, 16, 1, 2560]
    - [163, 9.79]
  - - [8448, 16, 1, 2816]
    - [139, 10.095]
  - - [4608, 16, 1, 1536]
    - [144, 9.964]
  - - [6144, 16, 1, 2560]
    - [126, 9.186]
  - - [4096, 16, 1, 4096]
    - [126, 9.328]
  - - [2048, 16, 1, 2048]
    - [144, 6.826]
  - - [2048, 2, 1, 2048]
    - [188, 1.04]
  - - [2560, 4, 1, 2560]
    - [190, 2.36]
  - - [32768, 1, 1, 256]
    - [188, 0.884]
  - - [1600, 1, 1, 1024]
    - [185, 0.363]
  - - [3456, 1, 1, 256]
    - [189, 0.46]
  - - [4096, 1, 1, 256]
    - [185, 0.537]
  - - [6912, 1, 1, 256]
    - [187, 0.711]
  - - [2048, 8, 1, 2048]
    - [185, 4.234]
  - - [2560, 2, 1, 2560]
    - [190, 1.162]
  - - [29000, 27, 1, 2560]
    - [144, 9.069]
  - - [1, 4288, 1, 1280]
    - [119, 0.749]
  - - [32, 1408, 1, 32]
    - [110, 1.983]
  - - [1, 1408, 1, 3328]
    - [134, 0.417]
  - - [1, 2368, 1, 1280]
    - [124, 0.514]
  - - [1, 5888, 1, 3328]
    - [119, 0.81]
  - - [1, 1856, 1, 256]
    - [119, 0.302]
  - - [1, 3584, 1, 3328]
    - [119, 0.688]
  - - [1, 6784, 1, 3328]
    - [119, 0.902]
  - - [1, 2368, 1, 256]
    - [119, 0.35]
  - - [32, 1856, 1, 3328]
    - [192, 13.03]
  - - [1, 2944, 1, 1280]
    - [119, 0.611]
  - - [1, 1856, 1, 3328]
    - [124, 0.532]
  - - [1, 1408, 1, 1]
    - [110, 0.002]
  - - [1, 6784, 1, 256]
    - [119, 0.629]
  - - [1, 6784, 1, 1]
    - [110, 0.009]
  - - [1, 4288, 1, 3328]
    - [119, 0.794]
  - - [1, 2368, 1, 3328]
    - [124, 0.555]
  - - [1, 5888, 1, 1280]
    - [119, 0.787]
  - - [1, 2944, 1, 256]
    - [119, 0.426]
  - - [1, 6784, 1, 1280]
    - [119, 0.869]
  - - [1, 5056, 1, 1]
    - [110, 0.007]
  - - [32, 1856, 1, 32]
    - [145, 2.615]
  - - [32, 1408, 1, 256]
    - [119, 6.921]
  - - [1, 5888, 1, 1]
    - [110, 0.009]
  - - [1, 2944, 1, 3328]
    - [119, 0.647]
  - - [1, 3584, 1, 1]
    - [110, 0.005]
  - - [1, 1408, 1, 256]
    - [119, 0.237]
  - - [1, 1856, 1, 1]
    - [110, 0.002]
  - - [1, 5056, 1, 1280]
    - [119, 0.765]
  - - [1, 5888, 1, 256]
    - [191, 0.582]
  - - [32, 1856, 1, 1280]
    - [193, 12.078]
  - - [1, 2368, 1, 1]
    - [110, 0.005]
  - - [1, 1408, 1, 1280]
    - [116, 0.381]
  - - [1, 5056, 1, 256]
    - [119, 0.564]
  - - [1, 3584, 1, 1280]
    - [119, 0.663]
  - - [1, 4288, 1, 256]
    - [119, 0.53]
  - - [1, 4288, 1, 1]
    - [110, 0.007]
  - - [1, 2944, 1, 1]
    - [110, 0.005]
  - - [32, 1408, 1, 3328]
    - [116, 10.519]
  - - [1, 5056, 1, 3328]
    - [119, 0.808]
  - - [32, 1856, 1, 256]
    - [192, 8.489]
  - - [1, 1856, 1, 1280]
    - [116, 0.483]
  - - [1, 3584, 1, 256]
    - [119, 0.471]
  - - [32, 1408, 1, 1280]
    - [124, 9.709]
  - - [2, 2048, 1, 1024]
    - [124, 1.004]
  - - [32, 1600, 1, 512]
    - [119, 9.24]
  - - [1, 4096, 1, 256]
    - [119, 0.51]
  - - [1, 6912, 1, 256]
    - [119, 0.645]
  - - [2, 2048, 1, 768]
    - [161, 0.959]
  - - [2, 4608, 1, 768]
    - [119, 1.5]
  - - [2, 4608, 1, 1024]
    - [124, 1.385]
  - - [512, 16, 1, 500000]
    - [179, 6.713]
  - - [1024, 8, 1, 500000]
    - [177, 4.703]
  - - [1024, 16, 1, 500000]
    - [171, 9.407]
  - - [512, 8, 1, 500000]
    - [173, 3.377]
  - - [147, 64, 1, 12544]
    - [167, 6.668]
  - - [256, 128, 1, 10752]
    - [172, 11.981]
  - - [256, 128, 1, 10560]
    - [175, 15.471]
  - - [256, 128, 1, 11408]
    - [175, 13.359]
  - - [256, 12, 1, 11408]
    - [173, 2.608]
  - - [256, 128, 1, 11616]
    - [165, 13.355]
  - - [256, 12, 1, 11616]
    - [179, 2.637]
  - - [256, 12, 1, 12288]
    - [181, 2.664]
  - - [576, 64, 1, 5625]
    - [175, 12.238]
  - - [147, 64, 1, 22500]
    - [167, 7.702]
  - - [11, 11, 1, 1909283]
    - [168, 0.189]
  - - [11, 11, 1, 3818566]
    - [168, 0.133]
  - - [448, 1, 1, 256]
    - [112, 0.061]
  - - [704, 64, 1, 3328]
    - [116, 10.815]
  - - [256, 128, 1, 256]
    - [116, 5.502]
  - - [448, 64, 1, 1]
    - [110, 0.043]
  - - [64, 1024, 1, 1280]
    - [119, 12.385]
  - - [1024, 1, 1, 3328]
    - [116, 0.332]
  - - [1024, 64, 1, 1280]
    - [159, 11.652]
  - - [448, 128, 1, 256]
    - [119, 8.536]
  - - [1, 1024, 1, 3328]
    - [116, 0.341]
  - - [704, 64, 1, 32]
    - [112, 2.008]
  - - [32, 448, 1, 3328]
    - [116, 5.04]
  - - [448, 1, 1, 1]
    - [110, 0.001]
  - - [64, 128, 1, 3328]
    - [116, 2.939]
  - - [64, 128, 1, 1]
    - [110, 0.011]
  - - [256, 128, 1, 1]
    - [114, 0.05]
  - - [256, 32, 1, 3328]
    - [142, 2.982]
  - - [1, 1, 1, 3328]
    - [154, 0.0]
  - - [32, 448, 1, 1280]
    - [116, 4.5]
  - - [32, 448, 1, 32]
    - [145, 0.663]
  - - [64, 1024, 1, 32]
    - [112, 2.849]
  - - [128, 1, 1, 1]
    - [110, 0.0]
  - - [1024, 32, 1, 3328]
    - [116, 9.448]
  - - [448, 1, 1, 1280]
    - [116, 0.138]
  - - [64, 64, 1, 1280]
    - [142, 1.317]
  - - [448, 128, 1, 3328]
    - [149, 11.322]
  - - [128, 256, 1, 1280]
    - [151, 8.793]
  - - [256, 256, 1, 32]
    - [114, 2.815]
  - - [1024, 1, 1, 256]
    - [116, 0.176]
  - - [128, 32, 1, 32]
    - [128, 0.187]
  - - [448, 64, 1, 256]
    - [116, 4.929]
  - - [128, 256, 1, 3328]
    - [134, 9.881]
  - - [1, 64, 1, 3328]
    - [116, 0.023]
  - - [64, 1024, 1, 1]
    - [114, 0.102]
  - - [64, 1024, 1, 3328]
    - [114, 12.84]
  - - [32, 704, 1, 3328]
    - [116, 6.865]
  - - [32, 1024, 1, 3328]
    - [124, 9.536]
  - - [64, 1, 1, 256]
    - [110, 0.011]
  - - [1024, 64, 1, 32]
    - [112, 3.072]
  - - [1024, 64, 1, 3328]
    - [114, 12.928]
  - - [32, 1024, 1, 256]
    - [119, 5.565]
  - - [64, 1, 1, 1]
    - [110, 0.0]
  - - [256, 1, 1, 256]
    - [116, 0.047]
  - - [256, 128, 1, 3328]
    - [116, 9.991]
  - - [64, 64, 1, 1]
    - [110, 0.007]
  - - [32, 704, 1, 1280]
    - [124, 6.219]
  - - [256, 1, 1, 1280]
    - [116, 0.079]
  - - [128, 32, 1, 1280]
    - [161, 1.34]
  - - [128, 256, 1, 1]
    - [114, 0.05]
  - - [1, 256, 1, 256]
    - [110, 0.043]
  - - [1, 256, 1, 1]
    - [110, 0.0]
  - - [1024, 1, 1, 1280]
    - [116, 0.298]
  - - [64, 448, 1, 256]
    - [116, 4.841]
  - - [1024, 32, 1, 1280]
    - [116, 8.448]
  - - [256, 256, 1, 3328]
    - [114, 13.12]
  - - [704, 32, 1, 1280]
    - [116, 6.623]
  - - [64, 64, 1, 3328]
    - [116, 1.471]
  - - [32, 32, 1, 32]
    - [156, 0.052]
  - - [1024, 32, 1, 32]
    - [116, 1.557]
  - - [128, 64, 1, 32]
    - [112, 0.374]
  - - [64, 1, 1, 1280]
    - [116, 0.02]
  - - [448, 32, 1, 1280]
    - [116, 4.559]
  - - [704, 32, 1, 3328]
    - [116, 7.431]
  - - [128, 128, 1, 256]
    - [116, 3.014]
  - - [64, 448, 1, 1280]
    - [116, 7.961]
  - - [64, 256, 1, 1]
    - [110, 0.025]
  - - [256, 256, 1, 256]
    - [119, 9.414]
  - - [448, 1, 1, 3328]
    - [116, 0.16]
  - - [256, 1, 1, 1]
    - [110, 0.0]
  - - [32, 1024, 1, 1280]
    - [151, 8.478]
  - - [1, 256, 1, 3328]
    - [116, 0.09]
  - - [256, 32, 1, 256]
    - [116, 1.516]
  - - [256, 128, 1, 1280]
    - [124, 8.942]
  - - [256, 64, 1, 256]
    - [116, 2.994]
  - - [1, 1, 1, 1]
    - [110, 0.0]
  - - [32, 1024, 1, 32]
    - [114, 1.498]
  - - [128, 256, 1, 256]
    - [119, 5.565]
  - - [704, 64, 1, 256]
    - [119, 7.108]
  - - [704, 1, 1, 1]
    - [110, 0.001]
  - - [128, 448, 1, 1280]
    - [119, 11.629]
  - - [448, 32, 1, 32]
    - [112, 0.654]
  - - [704, 64, 1, 1]
    - [110, 0.068]
  - - [704, 32, 1, 256]
    - [116, 4.04]
  - - [32, 704, 1, 32]
    - [114, 1.042]
  - - [128, 64, 1, 256]
    - [116, 1.516]
  - - [448, 32, 1, 3328]
    - [116, 5.024]
  - - [64, 704, 1, 32]
    - [114, 2.033]
  - - [64, 704, 1, 3328]
    - [151, 10.815]
  - - [448, 64, 1, 1280]
    - [116, 7.884]
  - - [128, 448, 1, 32]
    - [112, 2.493]
  - - [64, 256, 1, 256]
    - [116, 3.032]
  - - [64, 704, 1, 1]
    - [110, 0.068]
  - - [1, 1024, 1, 1]
    - [110, 0.002]
  - - [256, 1, 1, 3328]
    - [116, 0.09]
  - - [32, 64, 1, 32]
    - [110, 0.092]
  - - [256, 256, 1, 1]
    - [110, 0.104]
  - - [32, 256, 1, 32]
    - [112, 0.379]
  - - [128, 1, 1, 256]
    - [116, 0.023]
  - - [32, 64, 1, 3328]
    - [134, 0.735]
  - - [1, 128, 1, 3328]
    - [116, 0.045]
  - - [32, 256, 1, 256]
    - [124, 1.557]
  - - [1, 448, 1, 1]
    - [110, 0.001]
  - - [1, 704, 1, 3328]
    - [116, 0.235]
  - - [64, 1, 1, 3328]
    - [116, 0.023]
  - - [448, 64, 1, 3328]
    - [116, 8.852]
  - - [256, 32, 1, 1280]
    - [116, 2.599]
  - - [128, 448, 1, 3328]
    - [119, 11.958]
  - - [64, 1024, 1, 256]
    - [119, 9.321]
  - - [64, 32, 1, 32]
    - [164, 0.095]
  - - [1, 448, 1, 3328]
    - [116, 0.16]
  - - [1024, 64, 1, 256]
    - [119, 9.321]
  - - [64, 704, 1, 1280]
    - [151, 10.039]
  - - [64, 32, 1, 3328]
    - [116, 0.733]
  - - [64, 448, 1, 1]
    - [110, 0.047]
  - - [128, 128, 1, 1280]
    - [124, 5.143]
  - - [64, 128, 1, 256]
    - [116, 1.516]
  - - [64, 448, 1, 32]
    - [112, 1.293]
  - - [128, 64, 1, 3328]
    - [142, 2.951]
  - - [32, 64, 1, 1280]
    - [142, 0.656]
  - - [448, 32, 1, 256]
    - [116, 2.723]
  - - [1024, 32, 1, 256]
    - [119, 5.534]
  - - [1, 128, 1, 256]
    - [116, 0.023]
  - - [32, 256, 1, 1280]
    - [151, 2.617]
  - - [32, 128, 1, 3328]
    - [116, 1.469]
  - - [32, 128, 1, 32]
    - [145, 0.192]
  - - [1, 128, 1, 1]
    - [110, 0.0]
  - - [128, 64, 1, 1]
    - [110, 0.014]
  - - [32, 448, 1, 256]
    - [124, 2.741]
  - - [1, 704, 1, 256]
    - [116, 0.122]
  - - [32, 256, 1, 3328]
    - [116, 2.937]
  - - [256, 32, 1, 32]
    - [112, 0.374]
  - - [64, 256, 1, 3328]
    - [116, 5.752]
  - - [1, 704, 1, 1]
    - [114, 0.001]
  - - [128, 448, 1, 1]
    - [114, 0.088]
  - - [64, 128, 1, 32]
    - [112, 0.379]
  - - [704, 1, 1, 1280]
    - [116, 0.205]
  - - [1024, 1, 1, 1]
    - [110, 0.002]
  - - [256, 128, 1, 32]
    - [112, 1.46]
  - - [448, 128, 1, 1]
    - [114, 0.086]
  - - [704, 32, 1, 32]
    - [112, 1.017]
  - - [128, 32, 1, 256]
    - [116, 0.758]
  - - [64, 32, 1, 1280]
    - [161, 0.681]
  - - [448, 128, 1, 32]
    - [110, 2.723]
  - - [128, 448, 1, 256]
    - [119, 8.624]
  - - [32, 32, 1, 256]
    - [142, 0.194]
  - - [256, 64, 1, 32]
    - [116, 0.821]
  - - [1, 1024, 1, 1280]
    - [116, 0.302]
  - - [32, 32, 1, 3328]
    - [116, 0.368]
  - - [1, 256, 1, 1280]
    - [116, 0.083]
  - - [1, 128, 1, 1280]
    - [116, 0.041]
  - - [1, 64, 1, 256]
    - [110, 0.011]
  - - [256, 64, 1, 1280]
    - [151, 5.098]
  - - [32, 704, 1, 256]
    - [124, 3.991]
  - - [1, 64, 1, 1]
    - [110, 0.0]
  - - [704, 64, 1, 1280]
    - [116, 10.054]
  - - [1, 704, 1, 1280]
    - [124, 0.21]
  - - [128, 128, 1, 32]
    - [112, 0.74]
  - - [1024, 64, 1, 1]
    - [114, 0.099]
  - - [704, 1, 1, 256]
    - [161, 0.122]
  - - [128, 64, 1, 1280]
    - [124, 2.682]
  - - [64, 64, 1, 32]
    - [155, 0.192]
  - - [1, 1, 1, 1280]
    - [151, 0.0]
  - - [64, 704, 1, 256]
    - [119, 7.149]
  - - [1, 448, 1, 1280]
    - [116, 0.14]
  - - [64, 256, 1, 32]
    - [112, 0.749]
  - - [32, 128, 1, 1280]
    - [116, 1.308]
  - - [128, 128, 1, 3328]
    - [116, 5.813]
  - - [64, 448, 1, 3328]
    - [116, 8.829]
  - - [32, 64, 1, 256]
    - [142, 0.388]
  - - [128, 256, 1, 32]
    - [112, 1.478]
  - - [64, 256, 1, 1280]
    - [116, 5.132]
  - - [64, 64, 1, 256]
    - [116, 0.753]
  - - [448, 64, 1, 32]
    - [145, 1.293]
  - - [64, 128, 1, 1280]
    - [124, 2.635]
  - - [1, 1024, 1, 256]
    - [116, 0.176]
  - - [128, 1, 1, 3328]
    - [116, 0.045]
  - - [128, 128, 1, 1]
    - [112, 0.025]
  - - [32, 128, 1, 256]
    - [124, 0.774]
  - - [1, 64, 1, 1280]
    - [116, 0.02]
  - - [448, 128, 1, 1280]
    - [159, 10.158]
  - - [256, 64, 1, 1]
    - [110, 0.025]
  - - [256, 256, 1, 1280]
    - [119, 12.516]
  - - [704, 1, 1, 3328]
    - [116, 0.23]
  - - [128, 32, 1, 3328]
    - [124, 1.471]
  - - [32, 32, 1, 1280]
    - [161, 0.329]
  - - [1, 1, 1, 256]
    - [124, 0.0]
  - - [1, 448, 1, 256]
    - [116, 0.083]
  - - [256, 64, 1, 3328]
    - [116, 5.732]
  - - [64, 32, 1, 256]
    - [116, 0.379]
  - - [128, 1, 1, 1280]
    - [116, 0.041]
  - - [512, 128, 1, 784]
    - [110, 11.209]
  - - [256, 64, 1, 3136]
    - [116, 5.732]
  - - [64, 256, 1, 3136]
    - [116, 5.743]
  - - [128, 512, 1, 784]
    - [145, 11.476]
  - - [64, 64, 1, 3136]
    - [151, 1.462]
  - - [14, 14, 1, 64]
    - [161, 0.016]
  - - [15, 14, 1, 64]
    - [116, 0.023]
  - - [15, 15, 1, 64]
    - [116, 0.023]
  - - [17, 15, 1, 64]
    - [112, 0.025]
  - - [17, 17, 1, 64]
    - [110, 0.025]
  - - [21, 17, 1, 64]
    - [139, 0.032]
  - - [21, 21, 1, 64]
    - [139, 0.038]
  - - [24, 24, 1, 64]
    - [144, 0.052]
  - - [30, 30, 1, 64]
    - [144, 0.081]
  - - [30, 31, 1, 64]
    - [144, 0.083]
  - - [31, 31, 1, 64]
    - [139, 0.086]
  - - [32, 32, 1, 64]
    - [110, 0.099]
  - - [32, 35, 1, 64]
    - [116, 0.088]
  - - [34, 24, 1, 64]
    - [128, 0.059]
  - - [34, 34, 1, 64]
    - [112, 0.083]
  - - [35, 35, 1, 64]
    - [128, 0.097]
  - - [27, 27, 1, 64]
    - [128, 0.056]
  - - [27, 33, 1, 64]
    - [145, 0.07]
  - - [33, 33, 1, 64]
    - [130, 0.079]
  - - [2, 4, 1, 1024]
    - [110, 0.002]
  - - [2, 32, 1, 1024]
    - [116, 0.018]
  - - [64, 512, 1, 512]
    - [116, 7.115]
  - - [1024, 4, 1, 1024]
    - [161, 1.139]
  - - [1024, 32, 1, 1024]
    - [161, 8.053]
  - - [3, 3, 512, 64]
    - [145, 0.248]
  - - [5, 5, 512, 64]
    - [145, 0.675]
  - - [5, 5, 960, 64]
    - [110, 0.902]
  - - [9, 9, 512, 64]
    - [145, 2.037]
  - - [27, 27, 32768, 128]
    - [135, 9.957]
  - - [64, 512, 1, 1024]
    - [116, 7.787]
  - - [64, 960, 1, 1024]
    - [119, 11.595]
  - - [14, 14, 10880, 64]
    - [151, 8.782]
  - - [15, 14, 10880, 64]
    - [116, 9.393]
  - - [15, 15, 7680, 64]
    - [151, 9.707]
  - - [15, 15, 10880, 64]
    - [116, 10.0]
  - - [17, 15, 7680, 64]
    - [112, 7.144]
  - - [17, 17, 7680, 64]
    - [120, 6.075]
  - - [21, 17, 6144, 64]
    - [129, 6.321]
  - - [21, 21, 6144, 64]
    - [162, 7.264]
  - - [24, 24, 4736, 64]
    - [125, 9.037]
  - - [30, 30, 2048, 64]
    - [132, 12.746]
  - - [30, 31, 2048, 64]
    - [122, 13.032]
  - - [31, 31, 2048, 64]
    - [159, 13.377]
  - - [34, 24, 4736, 64]
    - [111, 8.764]
  - - [27, 27, 1920, 64]
    - [114, 10.427]
  - - [27, 33, 1920, 64]
    - [120, 8.82]
  - - [2, 8, 1, 1024]
    - [110, 0.005]
  - - [1024, 77, 1, 1024]
    - [155, 11.173]
  - - [2, 10, 1, 1024]
    - [116, 0.007]
  - - [1024, 10, 1, 1024]
    - [142, 2.842]
  - - [2, 39, 1, 1024]
    - [116, 0.023]
  - - [1024, 39, 1, 1024]
    - [119, 8.372]
  - - [2, 40, 1, 1024]
    - [116, 0.023]
  - - [1024, 40, 1, 1024]
    - [119, 8.649]
  - - [2, 41, 1, 1024]
    - [116, 0.025]
  - - [1024, 41, 1, 1024]
    - [119, 8.832]
  - - [2, 5, 1, 1024]
    - [110, 0.002]
  - - [1024, 5, 1, 1024]
    - [161, 1.421]
  - - [2, 6, 1, 1024]
    - [116, 0.005]
  - - [1024, 6, 1, 1024]
    - [161, 1.71]
  - - [1024, 8, 1, 1024]
    - [161, 2.269]
  - - [2, 9, 1, 1024]
    - [110, 0.005]
  - - [1024, 9, 1, 1024]
    - [161, 2.554]
  - - [4, 4, 32768, 64]
    - [110, 1.006]
  - - [4, 4, 38400, 64]
    - [128, 1.011]
  - - [17, 17, 6144, 64]
    - [138, 5.949]
  - - [128, 128, 1, 64]
    - [112, 1.299]
  - - [64, 128, 1, 128]
    - [145, 1.047]
  - - [2, 1024, 1, 1024]
    - [161, 0.582]
  - - [5, 5, 1, 64]
    - [110, 0.002]
  - - [33, 33, 1, 32]
    - [110, 0.041]
  - - [1024, 16, 1, 1024]
    - [142, 4.627]
  - - [2, 4, 1, 2560]
    - [110, 0.002]
  - - [2, 16, 1, 1024]
    - [116, 0.011]
  - - [2, 2, 1, 2048]
    - [110, 0.002]
  - - [1024, 1, 1, 1024]
    - [161, 0.284]
  - - [512, 1, 1, 2048]
    - [124, 0.169]
  - - [200, 1, 1, 1024]
    - [116, 0.059]
  - - [960, 1, 1, 2048]
    - [124, 0.298]
  - - [1024, 64, 1, 1024]
    - [159, 11.315]
  - - [864, 1, 1, 256]
    - [116, 0.147]
  - - [1024, 80, 1, 1024]
    - [155, 12.021]
  - - [1024, 82, 1, 1024]
    - [156, 11.643]
  - - [1024, 12, 1, 1024]
    - [161, 3.42]
  - - [2, 64, 1, 1024]
    - [116, 0.036]
  - - [2, 80, 1, 1024]
    - [116, 0.045]
  - - [2, 82, 1, 1024]
    - [116, 0.047]
  - - [2, 12, 1, 1024]
    - [110, 0.007]
  - - [2, 1, 1, 1024]
    - [116, 0.001]
  - - [24, 24, 6816, 64]
    - [117, 9.31]
  - - [256, 128, 1, 3136]
    - [134, 9.772]
  - - [576, 64, 1, 3136]
    - [116, 10.456]
  - - [768, 16, 1, 768]
    - [161, 3.296]
  - - [768, 12, 1, 768]
    - [142, 2.405]
  - - [768, 4, 1, 768]
    - [161, 0.803]
  - - [64, 1024, 1, 1024]
    - [119, 11.846]
  - - [26, 26, 6272, 64]
    - [135, 10.697]
  - - [2, 128, 1, 1024]
    - [116, 0.074]
  - - [2, 96, 1, 1024]
    - [116, 0.056]
  - - [256, 80, 1, 784]
    - [151, 4.573]
  - - [256, 12, 1, 3800]
    - [136, 1.092]
  - - [256, 3, 1, 3800]
    - [118, 0.273]
  - - [256, 12, 1, 950]
    - [136, 0.83]
  - - [256, 3, 1, 950]
    - [118, 0.21]
  - - [256, 12, 1, 3220]
    - [136, 1.074]
  - - [256, 3, 1, 3220]
    - [136, 0.271]
  - - [256, 12, 1, 3072]
    - [127, 1.078]
  - - [256, 3, 1, 3072]
    - [127, 0.268]
  - - [256, 12, 1, 850]
    - [136, 0.812]
  - - [256, 3, 1, 850]
    - [136, 0.203]
  - - [256, 12, 1, 2852]
    - [118, 1.063]
  - - [256, 3, 1, 2852]
    - [118, 0.266]
  - - [256, 12, 1, 805]
    - [127, 0.803]
  - - [256, 3, 1, 805]
    - [136, 0.203]
  - - [256, 3, 1, 864]
    - [118, 0.212]
  - - [256, 3, 1, 768]
    - [116, 0.21]
  - - [256, 12, 1, 864]
    - [136, 0.846]
  - - [256, 12, 1, 768]
    - [116, 0.837]
  - - [256, 12, 1, 2904]
    - [136, 1.058]
  - - [256, 3, 1, 2904]
    - [118, 0.266]
  - - [256, 3, 1, 713]
    - [136, 0.194]
  - - [256, 12, 1, 888]
    - [127, 0.817]
  - - [256, 3, 1, 888]
    - [136, 0.205]
  - - [256, 12, 1, 713]
    - [118, 0.765]
  - - [256, 3, 1, 660]
    - [136, 0.185]
  - - [256, 3, 1, 672]
    - [118, 0.194]
  - - [256, 12, 1, 660]
    - [154, 0.738]
  - - [256, 3, 1, 726]
    - [118, 0.189]
  - - [256, 12, 1, 672]
    - [136, 0.778]
  - - [256, 3, 1, 247]
    - [116, 0.115]
  - - [256, 12, 1, 726]
    - [136, 0.758]
  - - [256, 3, 1, 216]
    - [116, 0.108]
  - - [256, 3, 1, 3400]
    - [136, 0.273]
  - - [256, 3, 1, 221]
    - [116, 0.108]
  - - [256, 12, 1, 3552]
    - [136, 1.101]
  - - [256, 3, 1, 3456]
    - [118, 0.275]
  - - [256, 3, 1, 204]
    - [116, 0.104]
  - - [256, 12, 1, 3400]
    - [118, 1.083]
  - - [256, 12, 1, 3456]
    - [136, 1.096]
  - - [256, 12, 1, 221]
    - [116, 0.433]
  - - [256, 3, 1, 3552]
    - [136, 0.277]
  - - [256, 3, 1, 228]
    - [116, 0.111]
  - - [256, 3, 1, 234]
    - [116, 0.113]
  - - [256, 12, 1, 234]
    - [151, 0.456]
  - - [256, 12, 1, 228]
    - [116, 0.447]
  - - [256, 3, 1, 252]
    - [151, 0.117]
  - - [256, 12, 1, 252]
    - [116, 0.462]
  - - [256, 12, 1, 247]
    - [151, 0.46]
  - - [128, 256, 1, 1444]
    - [124, 7.884]
  - - [256, 128, 1, 25]
    - [130, 1.087]
  - - [256, 128, 1, 9]
    - [130, 0.411]
  - - [256, 256, 1, 1444]
    - [152, 10.792]
  - - [512, 128, 1, 100]
    - [145, 5.82]
  - - [64, 128, 1, 1444]
    - [127, 2.522]
  - - [81, 1024, 1, 1024]
    - [159, 10.528]
  - - [81, 1000, 1, 1024]
    - [159, 10.339]
  - - [1024, 20, 1, 1024]
    - [142, 5.055]
  - - [2, 8, 1, 2048]
    - [110, 0.005]
  - - [2, 20, 1, 1024]
    - [110, 0.011]
  - - [2, 2, 1, 2560]
    - [110, 0.002]
  - - [16, 16, 12, 64]
    - [194, 0.076]
  - - [16, 16, 16, 64]
    - [195, 0.087]
  - - [16, 16, 24, 64]
    - [194, 0.131]
  - - [16, 16, 32, 64]
    - [196, 0.174]
  - - [16, 16, 48, 64]
    - [196, 0.266]
  - - [16, 16, 64, 64]
    - [197, 0.342]
  - - [16, 16, 96, 64]
    - [198, 0.519]
  - - [16, 16, 128, 64]
    - [196, 0.678]
  - - [16, 16, 192, 64]
    - [196, 0.999]
  - - [16, 16, 256, 64]
    - [195, 1.262]
  - - [16, 16, 384, 64]
    - [199, 1.761]
  - - [16, 16, 512, 64]
    - [200, 2.112]
  - - [16, 16, 768, 64]
    - [200, 2.756]
  - - [16, 16, 1024, 64]
    - [200, 3.24]
  - - [16, 16, 1536, 64]
    - [201, 3.72]
  - - [16, 16, 2048, 64]
    - [202, 4.262]
  - - [16, 16, 3072, 64]
    - [202, 5.101]
  - - [32, 32, 12, 64]
    - [203, 0.262]
  - - [32, 32, 16, 64]
    - [204, 0.352]
  - - [32, 32, 24, 64]
    - [205, 0.526]
  - - [32, 32, 32, 64]
    - [204, 0.71]
  - - [32, 32, 48, 64]
    - [206, 1.034]
  - - [32, 32, 64, 64]
    - [207, 1.348]
  - - [32, 32, 96, 64]
    - [208, 1.908]
  - - [32, 32, 128, 64]
    - [209, 2.483]
  - - [32, 32, 192, 64]
    - [210, 3.404]
  - - [32, 32, 256, 64]
    - [211, 4.105]
  - - [32, 32, 384, 64]
    - [212, 5.237]
  - - [32, 32, 512, 64]
    - [213, 6.046]
  - - [32, 32, 768, 64]
    - [214, 7.354]
  - - [32, 32, 1024, 64]
    - [215, 8.505]
  - - [32, 32, 1536, 64]
    - [216, 9.977]
  - - [32, 32, 2048, 64]
    - [217, 11.156]
  - - [32, 32, 3072, 64]
    - [218, 13.663]
  - - [64, 64, 12, 64]
    - [194, 1.106]
  - - [64, 64, 16, 64]
    - [203, 1.375]
  - - [64, 64, 24, 64]
    - [219, 1.955]
  - - [64, 64, 32, 64]
    - [210, 2.571]
  - - [64, 64, 48, 64]
    - [208, 3.648]
  - - [64, 64, 64, 64]
    - [220, 4.571]
  - - [64, 64, 96, 64]
    - [220, 6.039]
  - - [64, 64, 128, 64]
    - [220, 7.182]
  - - [64, 64, 192, 64]
    - [221, 9.171]
  - - [64, 64, 256, 64]
    - [222, 10.706]
  - - [64, 64, 384, 64]
    - [223, 11.377]
  - - [64, 64, 512, 64]
    - [224, 12.69]
  - - [64, 64, 768, 64]
    - [225, 15.2]
  - - [64, 64, 1024, 64]
    - [225, 19.789]
  - - [64, 64, 1536, 64]
    - [226, 23.089]
  - - [64, 64, 2048, 64]
    - [227, 28.891]
  - - [64, 64, 3072, 64]
    - [228, 30.749]
  - - [256, 256, 12, 64]
    - [229, 10.896]
  - - [256, 256, 16, 64]
    - [229, 13.493]
  - - [256, 256, 24, 64]
    - [230, 17.1]
  - - [256, 256, 32, 64]
    - [231, 20.681]
  - - [256, 256, 48, 64]
    - [232, 25.429]
  - - [256, 256, 64, 64]
    - [232, 33.785]
  - - [256, 256, 96, 64]
    - [233, 43.09]
  - - [256, 256, 128, 64]
    - [233, 46.367]
  - - [256, 256, 192, 64]
    - [234, 51.405]
  - - [256, 256, 256, 64]
    - [235, 55.378]
  - - [256, 256, 384, 64]
    - [234, 59.213]
  - - [256, 256, 512, 64]
    - [235, 62.509]
  - - [256, 256, 768, 64]
    - [234, 50.951]
  - - [256, 256, 1024, 64]
    - [236, 40.183]
  - - [256, 256, 1536, 64]
    - [237, 40.379]
  - - [256, 256, 2048, 64]
    - [237, 40.101]
  - - [256, 256, 3072, 64]
    - [238, 39.804]
  - - [384, 384, 12, 64]
    - [239, 17.692]
  - - [384, 384, 16, 64]
    - [240, 24.124]
  - - [384, 384, 24, 64]
    - [241, 28.48]
  - - [384, 384, 32, 64]
    - [242, 40.891]
  - - [384, 384, 48, 64]
    - [233, 46.072]
  - - [384, 384, 64, 64]
    - [243, 49.764]
  - - [384, 384, 96, 64]
    - [244, 54.326]
  - - [384, 384, 128, 64]
    - [244, 57.587]
  - - [384, 384, 256, 64]
    - [244, 62.962]
  - - [384, 384, 384, 64]
    - [245, 47.746]
  - - [384, 384, 512, 64]
    - [236, 47.507]
  - - [384, 384, 768, 64]
    - [236, 45.029]
  - - [384, 384, 1024, 64]
    - [246, 43.549]
  - - [384, 384, 1536, 64]
    - [247, 43.786]
  - - [384, 384, 2048, 64]
    - [247, 43.33]
  - - [384, 384, 3072, 64]
    - [248, 43.314]
  - - [768, 1, 1, 768]
    - [194, 0.115]
  - - [768, 2, 1, 768]
    - [249, 0.219]
  - - [768, 8, 1, 768]
    - [250, 0.889]
  - - [768, 32, 1, 768]
    - [251, 3.554]
  - - [768, 64, 1, 768]
    - [205, 6.308]
  - - [768, 128, 1, 768]
    - [212, 10.988]
  - - [768, 256, 1, 768]
    - [252, 16.36]
  - - [64, 64, 1280, 64]
    - [253, 25.817]
  - - [128, 128, 12, 64]
    - [254, 3.602]
  - - [128, 128, 16, 64]
    - [255, 4.311]
  - - [128, 128, 24, 64]
    - [255, 6.157]
  - - [128, 128, 32, 64]
    - [254, 7.677]
  - - [128, 128, 48, 64]
    - [255, 10.247]
  - - [128, 128, 64, 64]
    - [256, 12.348]
  - - [128, 128, 96, 64]
    - [255, 15.924]
  - - [128, 128, 384, 64]
    - [257, 29.626]
  - - [128, 128, 768, 64]
    - [242, 45.622]
  - - [128, 128, 3072, 64]
    - [231, 29.527]
  - - [512, 512, 12, 64]
    - [258, 30.938]
  - - [512, 512, 24, 64]
    - [259, 40.12]
  - - [512, 512, 32, 64]
    - [233, 43.691]
  - - [512, 512, 384, 64]
    - [260, 46.099]
  - - [512, 512, 512, 64]
    - [261, 46.518]
  - - [512, 512, 768, 64]
    - [261, 46.401]
  - - [512, 512, 1024, 64]
    - [261, 46.232]
  - - [512, 512, 1536, 64]
    - [231, 46.164]
  - - [512, 512, 2048, 64]
    - [262, 46.216]
  - - [512, 512, 3072, 64]
    - [262, 46.277]
  - - [1024, 2, 1, 1024]
    - [249, 0.338]
- null
