library/src/blas3/Tensile/Logic/asm_full/navi22_Cijk_Ailk_Bljk_SB_GB.yaml
---
- {MinimumRequiredVersion: 4.28.0}
- navi22
- gfx1031
    SolutionIndex: 0
    SolutionNameMin: Cijk_Ailk_Bljk_SB_GB_MT128x64x8_SN_SU0_SUM0_TT8_8_WG16_8_1_WGM1
    SolutionIndex: 1
    SolutionNameMin: Cijk_Ailk_Bljk_SB_GB_MT128x128x8_SN_SU0_SUM0_TT8_16_WG16_8_1_WGM1
    SolutionIndex: 2
    SolutionNameMin: Cijk_Ailk_Bljk_SB_GB_MT128x128x8_SN_SU0_SUM0_TT8_8_WG16_16_1_WGM1
    SolutionIndex: 3
    SolutionNameMin: Cijk_Ailk_Bljk_SB_GB_MT128x128x16_SN_SU0_SUM0_TT8_16_WG16_8_1_WGM1
    SolutionIndex: 4
    SolutionNameMin: Cijk_Ailk_Bljk_SB_GB_MT128x128x16_SN_SU0_SUM0_TT8_8_WG16_16_1_WGM1
    SolutionIndex: 5
    SolutionNameMin: Cijk_Ailk_Bljk_SB_GB_MT128x256x16_SN_SU0_SUM0_TT8_16_WG16_16_1_WGM1
    SolutionIndex: 6
    SolutionNameMin: Cijk_Ailk_Bljk_SB_GB_MT128x128x32_SN_SU0_SUM0_TT8_8_WG16_16_1_WGM1
    SolutionIndex: 7
    SolutionNameMin: Cijk_Ailk_Bljk_SB_GB_MT128x64x8_SN_SU32_SUM3_TT8_8_WG16_8_1_WGM1
    SolutionIndex: 8
    SolutionNameMin: Cijk_Ailk_Bljk_SB_GB_MT128x128x8_SN_SU32_SUM3_TT8_16_WG16_8_1_WGM1
    SolutionIndex: 9
    SolutionNameMin: Cijk_Ailk_Bljk_SB_GB_MT128x128x8_SN_SU32_SUM3_TT8_8_WG16_16_1_WGM1
    SolutionIndex: 10
    SolutionNameMin: Cijk_Ailk_Bljk_SB_GB_MT128x64x16_SN_SU32_SUM3_TT8_8_WG16_8_1_WGM1
    SolutionIndex: 11
    SolutionNameMin: Cijk_Ailk_Bljk_SB_GB_MT128x128x16_SN_SU32_SUM3_TT8_16_WG16_8_1_WGM1
    SolutionIndex: 12
    SolutionNameMin: Cijk_Ailk_Bljk_SB_GB_MT128x128x16_SN_SU32_SUM3_TT8_8_WG16_16_1_WGM1
    SolutionIndex: 13
    SolutionNameMin: Cijk_Ailk_Bljk_SB_GB_MT128x256x16_SN_SU32_SUM3_TT8_16_WG16_16_1_WGM1
    SolutionIndex: 14
    SolutionNameMin: Cijk_Ailk_Bljk_SB_GB_MT128x64x32_SN_SU32_SUM3_TT8_8_WG16_8_1_WGM1
    SolutionIndex: 15
    SolutionNameMin: Cijk_Ailk_Bljk_SB_GB_MT128x128x32_SN_SU32_SUM3_TT8_8_WG16_16_1_WGM1
    SolutionIndex: 16
    SolutionNameMin: Cijk_Ailk_Bljk_SB_GB_MT128x64x8_SN_SU0_SUM0_TT8_8_WG16_8_1_WGM4
    SolutionIndex: 17
    SolutionNameMin: Cijk_Ailk_Bljk_SB_GB_MT128x128x8_SN_SU0_SUM0_TT8_16_WG16_8_1_WGM4
    SolutionIndex: 18
    SolutionNameMin: Cijk_Ailk_Bljk_SB_GB_MT128x128x8_SN_SU0_SUM0_TT8_8_WG16_16_1_WGM4
    SolutionIndex: 19
    SolutionNameMin: Cijk_Ailk_Bljk_SB_GB_MT128x64x16_SN_SU0_SUM0_TT8_8_WG16_8_1_WGM4
    SolutionIndex: 20
    SolutionNameMin: Cijk_Ailk_Bljk_SB_GB_MT128x128x16_SN_SU0_SUM0_TT8_16_WG16_8_1_WGM4
    SolutionIndex: 21
    SolutionNameMin: Cijk_Ailk_Bljk_SB_GB_MT128x256x16_SN_SU0_SUM0_TT8_16_WG16_16_1_WGM4
    SolutionIndex: 22
    SolutionNameMin: Cijk_Ailk_Bljk_SB_GB_MT128x64x8_SN_SU32_SUM3_TT8_8_WG16_8_1_WGM4
    SolutionIndex: 23
    SolutionNameMin: Cijk_Ailk_Bljk_SB_GB_MT128x128x8_SN_SU32_SUM3_TT8_16_WG16_8_1_WGM4
    SolutionIndex: 24
    SolutionNameMin: Cijk_Ailk_Bljk_SB_GB_MT128x128x8_SN_SU32_SUM3_TT8_8_WG16_16_1_WGM4
    SolutionIndex: 25
    SolutionNameMin: Cijk_Ailk_Bljk_SB_GB_MT128x64x16_SN_SU32_SUM3_TT8_8_WG16_8_1_WGM4
    SolutionIndex: 26
    SolutionNameMin: Cijk_Ailk_Bljk_SB_GB_MT128x128x16_SN_SU32_SUM3_TT8_16_WG16_8_1_WGM4
    SolutionIndex: 27
    SolutionNameMin: Cijk_Ailk_Bljk_SB_GB_MT128x128x16_SN_SU32_SUM3_TT8_8_WG16_16_1_WGM4
    SolutionIndex: 28
    SolutionNameMin: Cijk_Ailk_Bljk_SB_GB_MT128x256x16_SN_SU32_SUM3_TT8_16_WG16_16_1_WGM4
    SolutionIndex: 29
    SolutionNameMin: Cijk_Ailk_Bljk_SB_GB_MT128x64x32_SN_SU32_SUM3_TT8_8_WG16_8_1_WGM4
    SolutionIndex: 30
    SolutionNameMin: Cijk_Ailk_Bljk_SB_GB_MT128x64x8_SN_SU0_SUM0_TT8_8_WG16_8_1_WGM8
    SolutionIndex: 31
    SolutionNameMin: Cijk_Ailk_Bljk_SB_GB_MT128x128x8_SN_SU0_SUM0_TT8_16_WG16_8_1_WGM8
    SolutionIndex: 32
    SolutionNameMin: Cijk_Ailk_Bljk_SB_GB_MT128x128x8_SN_SU0_SUM0_TT8_8_WG16_16_1_WGM8
    SolutionIndex: 33
    SolutionNameMin: Cijk_Ailk_Bljk_SB_GB_MT128x64x16_SN_SU0_SUM0_TT8_8_WG16_8_1_WGM8
    SolutionIndex: 34
    SolutionNameMin: Cijk_Ailk_Bljk_SB_GB_MT128x128x16_SN_SU0_SUM0_TT8_16_WG16_8_1_WGM8
    SolutionIndex: 35
    SolutionNameMin: Cijk_Ailk_Bljk_SB_GB_MT128x256x16_SN_SU0_SUM0_TT8_16_WG16_16_1_WGM8
    SolutionIndex: 36
    SolutionNameMin: Cijk_Ailk_Bljk_SB_GB_MT128x64x8_SN_SU32_SUM3_TT8_8_WG16_8_1_WGM8
    SolutionIndex: 37
    SolutionNameMin: Cijk_Ailk_Bljk_SB_GB_MT128x128x8_SN_SU32_SUM3_TT8_16_WG16_8_1_WGM8
    SolutionIndex: 38
    SolutionNameMin: Cijk_Ailk_Bljk_SB_GB_MT128x128x8_SN_SU32_SUM3_TT8_8_WG16_16_1_WGM8
    SolutionIndex: 39
    SolutionNameMin: Cijk_Ailk_Bljk_SB_GB_MT128x64x16_SN_SU32_SUM3_TT8_8_WG16_8_1_WGM8
    SolutionIndex: 40
    SolutionNameMin: Cijk_Ailk_Bljk_SB_GB_MT128x128x16_SN_SU32_SUM3_TT8_16_WG16_8_1_WGM8
    SolutionIndex: 41
    SolutionNameMin: Cijk_Ailk_Bljk_SB_GB_MT128x256x16_SN_SU32_SUM3_TT8_16_WG16_16_1_WGM8
    SolutionIndex: 42
    SolutionNameMin: Cijk_Ailk_Bljk_SB_GB_MT128x64x8_SN_SU0_SUM0_TT8_8_WG16_8_1_WGM1
    SolutionIndex: 43
    SolutionNameMin: Cijk_Ailk_Bljk_SB_GB_MT128x128x8_SN_SU0_SUM0_TT8_16_WG16_8_1_WGM1
    SolutionIndex: 44
    SolutionNameMin: Cijk_Ailk_Bljk_SB_GB_MT128x64x8_SN_SU32_SUM3_TT8_8_WG16_8_1_WGM1
    SolutionIndex: 45
    SolutionNameMin: Cijk_Ailk_Bljk_SB_GB_MT128x128x8_SN_SU32_SUM3_TT8_16_WG16_8_1_WGM1
    SolutionIndex: 46
    SolutionNameMin: Cijk_Ailk_Bljk_SB_GB_MT128x64x8_SN_SU0_SUM0_TT8_8_WG16_8_1_WGM4
    SolutionIndex: 47
    SolutionNameMin: Cijk_Ailk_Bljk_SB_GB_MT128x64x8_SN_SU0_SUM0_TT8_8_WG16_8_1_WGM8
    SolutionIndex: 48
    SolutionNameMin: Cijk_Ailk_Bljk_SB_GB_MT128x128x8_SN_SU0_SUM0_TT8_16_WG16_8_1_WGM8
    SolutionIndex: 49
    SolutionNameMin: Cijk_Ailk_Bljk_SB_GB_MT32x32x8_SN_SU0_SUM0_TT4_4_WG8_8_1_WGM1
    SolutionIndex: 50
    SolutionNameMin: Cijk_Ailk_Bljk_SB_GB_MT32x64x8_SN_SU0_SUM0_TT4_8_WG8_8_1_WGM1
    SolutionIndex: 51
    SolutionNameMin: Cijk_Ailk_Bljk_SB_GB_MT64x64x8_SN_SU0_SUM0_TT8_8_WG8_8_1_WGM1
    SolutionIndex: 52
    SolutionNameMin: Cijk_Ailk_Bljk_SB_GB_MT64x64x8_SN_SU0_SUM0_TT4_8_WG16_8_1_WGM1
    SolutionIndex: 53
    SolutionNameMin: Cijk_Ailk_Bljk_SB_GB_MT128x64x8_SN_SU0_SUM0_TT8_8_WG16_8_1_WGM1
    SolutionIndex: 54
    SolutionNameMin: Cijk_Ailk_Bljk_SB_GB_MT128x128x8_SN_SU0_SUM0_TT8_8_WG16_16_1_WGM1
    SolutionIndex: 55
    SolutionNameMin: Cijk_Ailk_Bljk_SB_GB_MT64x64x16_SN_SU0_SUM0_TT8_8_WG8_8_1_WGM1
    SolutionIndex: 56
    SolutionNameMin: Cijk_Ailk_Bljk_SB_GB_MT64x64x16_SN_SU0_SUM0_TT4_8_WG16_8_1_WGM1
    SolutionIndex: 57
    SolutionNameMin: Cijk_Ailk_Bljk_SB_GB_MT128x64x16_SN_SU0_SUM0_TT8_8_WG16_8_1_WGM1
    SolutionIndex: 58
    SolutionNameMin: Cijk_Ailk_Bljk_SB_GB_MT64x128x16_SN_SU0_SUM0_TT4_8_WG16_16_1_WGM1
    SolutionIndex: 59
    SolutionNameMin: Cijk_Ailk_Bljk_SB_GB_MT128x128x16_SN_SU0_SUM0_TT8_8_WG16_16_1_WGM1
    SolutionIndex: 60
    SolutionNameMin: Cijk_Ailk_Bljk_SB_GB_MT64x64x32_SN_SU0_SUM0_TT8_8_WG8_8_1_WGM1
    SolutionIndex: 61
    SolutionNameMin: Cijk_Ailk_Bljk_SB_GB_MT64x64x32_SN_SU0_SUM0_TT4_8_WG16_8_1_WGM1
    SolutionIndex: 62
    SolutionNameMin: Cijk_Ailk_Bljk_SB_GB_MT64x64x8_SN_SU32_SUM3_TT8_8_WG8_8_1_WGM1
    SolutionIndex: 63
    SolutionNameMin: Cijk_Ailk_Bljk_SB_GB_MT64x64x8_SN_SU32_SUM3_TT4_8_WG16_8_1_WGM1
    SolutionIndex: 64
    SolutionNameMin: Cijk_Ailk_Bljk_SB_GB_MT128x64x8_SN_SU32_SUM3_TT8_8_WG16_8_1_WGM1
    SolutionIndex: 65
    SolutionNameMin: Cijk_Ailk_Bljk_SB_GB_MT128x128x8_SN_SU32_SUM3_TT8_8_WG16_16_1_WGM1
    SolutionIndex: 66
    SolutionNameMin: Cijk_Ailk_Bljk_SB_GB_MT32x32x16_SN_SU32_SUM3_TT4_4_WG8_8_1_WGM1
    SolutionIndex: 67
    SolutionNameMin: Cijk_Ailk_Bljk_SB_GB_MT64x64x16_SN_SU32_SUM3_TT8_8_WG8_8_1_WGM1
    SolutionIndex: 68
    SolutionNameMin: Cijk_Ailk_Bljk_SB_GB_MT64x64x16_SN_SU32_SUM3_TT4_8_WG16_8_1_WGM1
    SolutionIndex: 69
    SolutionNameMin: Cijk_Ailk_Bljk_SB_GB_MT128x64x16_SN_SU32_SUM3_TT8_8_WG16_8_1_WGM1
    SolutionIndex: 70
    SolutionNameMin: Cijk_Ailk_Bljk_SB_GB_MT64x64x16_SN_SU32_SUM3_TT4_4_WG16_16_1_WGM1
    SolutionIndex: 71
    SolutionNameMin: Cijk_Ailk_Bljk_SB_GB_MT64x128x16_SN_SU32_SUM3_TT4_8_WG16_16_1_WGM1
    SolutionIndex: 72
    SolutionNameMin: Cijk_Ailk_Bljk_SB_GB_MT128x128x16_SN_SU32_SUM3_TT8_8_WG16_16_1_WGM1
    SolutionIndex: 73
    SolutionNameMin: Cijk_Ailk_Bljk_SB_GB_MT64x64x32_SN_SU32_SUM3_TT8_8_WG8_8_1_WGM1
    SolutionIndex: 74
    SolutionNameMin: Cijk_Ailk_Bljk_SB_GB_MT64x128x32_SN_SU32_SUM3_TT4_8_WG16_16_1_WGM1
    SolutionIndex: 75
    SolutionNameMin: Cijk_Ailk_Bljk_SB_GB_MT32x32x8_SN_SU0_SUM0_TT4_4_WG8_8_1_WGM4
    SolutionIndex: 76
    SolutionNameMin: Cijk_Ailk_Bljk_SB_GB_MT64x64x8_SN_SU0_SUM0_TT8_8_WG8_8_1_WGM4
    SolutionIndex: 77
    SolutionNameMin: Cijk_Ailk_Bljk_SB_GB_MT64x64x8_SN_SU0_SUM0_TT4_8_WG16_8_1_WGM4
    SolutionIndex: 78
    SolutionNameMin: Cijk_Ailk_Bljk_SB_GB_MT128x64x8_SN_SU0_SUM0_TT8_8_WG16_8_1_WGM4
    SolutionIndex: 79
    SolutionNameMin: Cijk_Ailk_Bljk_SB_GB_MT128x128x8_SN_SU0_SUM0_TT8_8_WG16_16_1_WGM4
    SolutionIndex: 80
    SolutionNameMin: Cijk_Ailk_Bljk_SB_GB_MT32x64x16_SN_SU0_SUM0_TT4_8_WG8_8_1_WGM4
    SolutionIndex: 81
    SolutionNameMin: Cijk_Ailk_Bljk_SB_GB_MT64x64x16_SN_SU0_SUM0_TT8_8_WG8_8_1_WGM4
    SolutionIndex: 82
    SolutionNameMin: Cijk_Ailk_Bljk_SB_GB_MT128x64x16_SN_SU0_SUM0_TT8_8_WG16_8_1_WGM4
    SolutionIndex: 83
    SolutionNameMin: Cijk_Ailk_Bljk_SB_GB_MT128x128x16_SN_SU0_SUM0_TT8_8_WG16_16_1_WGM4
    SolutionIndex: 84
    SolutionNameMin: Cijk_Ailk_Bljk_SB_GB_MT32x64x8_SN_SU32_SUM3_TT4_8_WG8_8_1_WGM4
    SolutionIndex: 85
    SolutionNameMin: Cijk_Ailk_Bljk_SB_GB_MT64x64x8_SN_SU32_SUM3_TT8_8_WG8_8_1_WGM4
    SolutionIndex: 86
    SolutionNameMin: Cijk_Ailk_Bljk_SB_GB_MT64x64x8_SN_SU32_SUM3_TT4_8_WG16_8_1_WGM4
    SolutionIndex: 87
    SolutionNameMin: Cijk_Ailk_Bljk_SB_GB_MT128x64x8_SN_SU32_SUM3_TT8_8_WG16_8_1_WGM4
    SolutionIndex: 88
    SolutionNameMin: Cijk_Ailk_Bljk_SB_GB_MT128x128x8_SN_SU32_SUM3_TT8_8_WG16_16_1_WGM4
    SolutionIndex: 89
    SolutionNameMin: Cijk_Ailk_Bljk_SB_GB_MT64x64x16_SN_SU32_SUM3_TT8_8_WG8_8_1_WGM4
    SolutionIndex: 90
    SolutionNameMin: Cijk_Ailk_Bljk_SB_GB_MT64x64x16_SN_SU32_SUM3_TT4_8_WG16_8_1_WGM4
    SolutionIndex: 91
    SolutionNameMin: Cijk_Ailk_Bljk_SB_GB_MT128x64x16_SN_SU32_SUM3_TT8_8_WG16_8_1_WGM4
    SolutionIndex: 92
    SolutionNameMin: Cijk_Ailk_Bljk_SB_GB_MT64x128x16_SN_SU32_SUM3_TT4_8_WG16_16_1_WGM4
    SolutionIndex: 93
    SolutionNameMin: Cijk_Ailk_Bljk_SB_GB_MT128x128x16_SN_SU32_SUM3_TT8_8_WG16_16_1_WGM4
    SolutionIndex: 94
    SolutionNameMin: Cijk_Ailk_Bljk_SB_GB_MT64x64x32_SN_SU32_SUM3_TT8_8_WG8_8_1_WGM4
    SolutionIndex: 95
    SolutionNameMin: Cijk_Ailk_Bljk_SB_GB_MT64x64x32_SN_SU32_SUM3_TT4_8_WG16_8_1_WGM4
    SolutionIndex: 96
    SolutionNameMin: Cijk_Ailk_Bljk_SB_GB_MT64x64x32_SN_SU32_SUM3_TT4_4_WG16_16_1_WGM4
    SolutionIndex: 97
    SolutionNameMin: Cijk_Ailk_Bljk_SB_GB_MT64x64x8_SN_SU0_SUM0_TT8_8_WG8_8_1_WGM8
    SolutionIndex: 98
    SolutionNameMin: Cijk_Ailk_Bljk_SB_GB_MT64x64x8_SN_SU0_SUM0_TT4_8_WG16_8_1_WGM8
    SolutionIndex: 99
    SolutionNameMin: Cijk_Ailk_Bljk_SB_GB_MT128x64x8_SN_SU0_SUM0_TT8_8_WG16_8_1_WGM8
    SolutionIndex: 100
    SolutionNameMin: Cijk_Ailk_Bljk_SB_GB_MT128x128x8_SN_SU0_SUM0_TT8_8_WG16_16_1_WGM8
    SolutionIndex: 101
    SolutionNameMin: Cijk_Ailk_Bljk_SB_GB_MT64x64x16_SN_SU0_SUM0_TT8_8_WG8_8_1_WGM8
    SolutionIndex: 102
    SolutionNameMin: Cijk_Ailk_Bljk_SB_GB_MT64x32x16_SN_SU0_SUM0_TT4_4_WG16_8_1_WGM8
    SolutionIndex: 103
    SolutionNameMin: Cijk_Ailk_Bljk_SB_GB_MT128x64x16_SN_SU0_SUM0_TT8_8_WG16_8_1_WGM8
    SolutionIndex: 104
    SolutionNameMin: Cijk_Ailk_Bljk_SB_GB_MT64x64x16_SN_SU0_SUM0_TT4_4_WG16_16_1_WGM8
    SolutionIndex: 105
    SolutionNameMin: Cijk_Ailk_Bljk_SB_GB_MT32x32x8_SN_SU32_SUM3_TT4_4_WG8_8_1_WGM8
    SolutionIndex: 106
    SolutionNameMin: Cijk_Ailk_Bljk_SB_GB_MT64x64x8_SN_SU32_SUM3_TT8_8_WG8_8_1_WGM8
    SolutionIndex: 107
    SolutionNameMin: Cijk_Ailk_Bljk_SB_GB_MT64x32x8_SN_SU32_SUM3_TT4_4_WG16_8_1_WGM8
    SolutionIndex: 108
    SolutionNameMin: Cijk_Ailk_Bljk_SB_GB_MT64x64x8_SN_SU32_SUM3_TT4_8_WG16_8_1_WGM8
    SolutionIndex: 109
    SolutionNameMin: Cijk_Ailk_Bljk_SB_GB_MT128x64x8_SN_SU32_SUM3_TT8_8_WG16_8_1_WGM8
    SolutionIndex: 110
    SolutionNameMin: Cijk_Ailk_Bljk_SB_GB_MT128x128x8_SN_SU32_SUM3_TT8_8_WG16_16_1_WGM8
    SolutionIndex: 111
    SolutionNameMin: Cijk_Ailk_Bljk_SB_GB_MT64x64x16_SN_SU32_SUM3_TT8_8_WG8_8_1_WGM8
    SolutionIndex: 112
    SolutionNameMin: Cijk_Ailk_Bljk_SB_GB_MT64x64x16_SN_SU32_SUM3_TT4_8_WG16_8_1_WGM8
    SolutionIndex: 113
    SolutionNameMin: Cijk_Ailk_Bljk_SB_GB_MT128x64x16_SN_SU32_SUM3_TT8_8_WG16_8_1_WGM8
    SolutionIndex: 114
    SolutionNameMin: Cijk_Ailk_Bljk_SB_GB_MT64x64x16_SN_SU32_SUM3_TT4_4_WG16_16_1_WGM8
    SolutionIndex: 115
    SolutionNameMin: Cijk_Ailk_Bljk_SB_GB_MT64x128x16_SN_SU32_SUM3_TT4_8_WG16_16_1_WGM8
    SolutionIndex: 116
    SolutionNameMin: Cijk_Ailk_Bljk_SB_GB_MT128x128x16_SN_SU32_SUM3_TT8_8_WG16_16_1_WGM8
    SolutionIndex: 117
    SolutionNameMin: Cijk_Ailk_Bljk_SB_GB_MT64x64x32_SN_SU32_SUM3_TT8_8_WG8_8_1_WGM8
    SolutionIndex: 118
    SolutionNameMin: Cijk_Ailk_Bljk_SB_GB_MT64x64x32_SN_SU32_SUM3_TT4_8_WG16_8_1_WGM8
    SolutionIndex: 119
    SolutionNameMin: Cijk_Ailk_Bljk_SB_GB_MT64x64x32_SN_SU32_SUM3_TT4_4_WG16_16_1_WGM8
- - - [1024, 4096, 1, 1024, 1024, 1024, 1024, 1024]
    - [8, 11804.0]
  - - [4096, 4096, 1, 1024, 4096, 4096, 4096, 1024]
    - [1, 12333.0]
  - - [1024, 2048, 1, 1024, 1024, 1024, 1024, 1024]
    - [7, 11215.0]
  - - [4096, 2048, 1, 1024, 4096, 4096, 4096, 1024]
    - [1, 12230.0]
  - - [768, 4096, 1, 2, 768, 768, 768, 2]
    - [3, 331.0]
  - - [768, 4096, 1, 768, 768, 768, 768, 768]
    - [3, 11423.0]
  - - [3072, 4096, 1, 768, 3072, 3072, 3072, 768]
    - [3, 12221.0]
  - - [768, 2048, 1, 2, 768, 768, 768, 2]
    - [1, 349.0]
  - - [768, 2048, 1, 768, 768, 768, 768, 768]
    - [1, 10952.0]
  - - [3072, 2048, 1, 768, 3072, 3072, 3072, 768]
    - [1, 11817.0]
  - - [3072, 1024, 1, 768, 3072, 3072, 3072, 768]
    - [1, 11534.0]
  - - [3072, 512, 1, 768, 3072, 3072, 3072, 768]
    - [1, 11024.0]
  - - [1024, 3072, 1, 1024, 1024, 1024, 1024, 1024]
    - [3, 11190.0]
  - - [3072, 2048, 1, 1024, 3072, 3072, 3072, 1024]
    - [1, 11891.0]
  - - [3072, 3072, 1, 1024, 3072, 3072, 3072, 1024]
    - [1, 12365.0]
  - - [3072, 512, 1, 1024, 3072, 3072, 3072, 1024]
    - [1, 11036.0]
  - - [3072, 4096, 1, 1024, 3072, 3072, 3072, 1024]
    - [1, 12272.0]
  - - [1024, 2048, 1, 2, 1024, 1024, 1024, 2]
    - [7, 377.0]
  - - [1024, 3072, 1, 2, 1024, 1024, 1024, 2]
    - [8, 381.0]
  - - [1024, 4096, 1, 2, 1024, 1024, 1024, 2]
    - [1, 373.0]
  - - [128, 128, 512, 64, 128, 128, 128, 64]
    - [30, 10682.0]
  - - [512, 512, 64, 64, 512, 512, 512, 64]
    - [0, 11343.0]
  - - [2944, 4288, 1, 1280, 2944, 2944, 2944, 1280]
    - [1, 12103.0]
  - - [2368, 5888, 1, 256, 2368, 2368, 2368, 256]
    - [8, 11737.0]
  - - [5888, 1856, 1, 256, 5888, 5888, 5888, 256]
    - [30, 11650.0]
  - - [512, 24000, 1, 1536, 512, 512, 512, 1536]
    - [23, 12338.0]
  - - [5888, 1408, 1, 256, 5888, 5888, 5888, 256]
    - [8, 11692.0]
  - - [5888, 1856, 1, 3328, 5888, 5888, 5888, 3328]
    - [1, 12023.0]
  - - [1856, 4288, 1, 256, 1856, 1856, 1856, 256]
    - [17, 11175.0]
  - - [1024, 5056, 1, 128, 1024, 1024, 1024, 128]
    - [22, 11153.0]
  - - [5056, 5056, 1, 3328, 5056, 5056, 5056, 3328]
    - [1, 12391.0]
  - - [1408, 5888, 1, 1280, 1408, 1408, 1408, 1280]
    - [1, 12161.0]
  - - [6144, 6000, 1, 2560, 6144, 6144, 6144, 2560]
    - [8, 12584.0]
  - - [2368, 6784, 1, 128, 2368, 2368, 2368, 128]
    - [1, 11344.0]
  - - [1024, 3584, 1, 3328, 1024, 1024, 1024, 3328]
    - [1, 11588.0]
  - - [512, 48000, 1, 2048, 512, 512, 512, 2048]
    - [40, 12531.0]
  - - [5888, 1408, 1, 1280, 5888, 5888, 5888, 1280]
    - [1, 12214.0]
  - - [1408, 4288, 1, 256, 1408, 1408, 1408, 256]
    - [16, 11517.0]
  - - [1024, 2368, 1, 256, 1024, 1024, 1024, 256]
    - [16, 10983.0]
  - - [1408, 1856, 1, 1280, 1408, 1408, 1408, 1280]
    - [7, 11545.0]
  - - [5056, 5056, 1, 1280, 5056, 5056, 5056, 1280]
    - [1, 12261.0]
  - - [448, 5056, 1, 256, 448, 448, 448, 256]
    - [16, 9257.0]
  - - [1856, 1408, 1, 128, 1856, 1856, 1856, 128]
    - [0, 10015.0]
  - - [6784, 256, 1, 3328, 6784, 6784, 6784, 3328]
    - [30, 11072.0]
  - - [1408, 3584, 1, 256, 1408, 1408, 1408, 256]
    - [16, 11376.0]
  - - [4288, 448, 1, 256, 4288, 4288, 4288, 256]
    - [0, 10649.0]
  - - [1024, 1856, 1, 128, 1024, 1024, 1024, 128]
    - [0, 10119.0]
  - - [4288, 2944, 1, 1280, 4288, 4288, 4288, 1280]
    - [1, 12117.0]
  - - [704, 5056, 1, 1280, 704, 704, 704, 1280]
    - [37, 11001.0]
  - - [2368, 704, 1, 3328, 2368, 2368, 2368, 3328]
    - [7, 10696.0]
  - - [256, 5888, 1, 256, 256, 256, 256, 256]
    - [22, 9223.0]
  - - [1856, 4288, 1, 3328, 1856, 1856, 1856, 3328]
    - [1, 11688.0]
  - - [5888, 1024, 1, 256, 5888, 5888, 5888, 256]
    - [36, 11430.0]
  - - [1408, 2944, 1, 256, 1408, 1408, 1408, 256]
    - [34, 11225.0]
  - - [6784, 5056, 1, 3328, 6784, 6784, 6784, 3328]
    - [1, 12535.0]
  - - [5056, 5056, 1, 256, 5056, 5056, 5056, 256]
    - [8, 11942.0]
  - - [704, 5056, 1, 128, 704, 704, 704, 128]
    - [30, 9896.0]
  - - [2368, 2944, 1, 1280, 2368, 2368, 2368, 1280]
    - [1, 12064.0]
  - - [6784, 6784, 1, 1280, 6784, 6784, 6784, 1280]
    - [1, 12626.0]
  - - [1408, 4288, 1, 1280, 1408, 1408, 1408, 1280]
    - [17, 11985.0]
  - - [3584, 4288, 1, 1280, 3584, 3584, 3584, 1280]
    - [1, 12296.0]
  - - [512, 6000, 1, 2560, 512, 512, 512, 2560]
    - [36, 11520.0]
  - - [2368, 704, 1, 1280, 2368, 2368, 2368, 1280]
    - [7, 10517.0]
  - - [5056, 4288, 1, 3328, 5056, 5056, 5056, 3328]
    - [1, 12314.0]
  - - [3584, 2368, 1, 3328, 3584, 3584, 3584, 3328]
    - [1, 12058.0]
  - - [5888, 6784, 1, 1280, 5888, 5888, 5888, 1280]
    - [1, 12621.0]
  - - [6784, 448, 1, 1280, 6784, 6784, 6784, 1280]
    - [16, 11386.0]
  - - [2944, 5888, 1, 256, 2944, 2944, 2944, 256]
    - [17, 12252.0]
  - - [4288, 2944, 1, 256, 4288, 4288, 4288, 256]
    - [1, 11799.0]
  - - [5888, 704, 1, 1280, 5888, 5888, 5888, 1280]
    - [0, 11457.0]
  - - [448, 5888, 1, 128, 448, 448, 448, 128]
    - [22, 9150.0]
  - - [5056, 2368, 1, 1280, 5056, 5056, 5056, 1280]
    - [17, 12070.0]
  - - [448, 3584, 1, 1280, 448, 448, 448, 1280]
    - [23, 9612.0]
  - - [6784, 5888, 1, 256, 6784, 6784, 6784, 256]
    - [17, 12432.0]
  - - [1024, 1408, 1, 256, 1024, 1024, 1024, 256]
    - [22, 10264.0]
  - - [2368, 2368, 1, 3328, 2368, 2368, 2368, 3328]
    - [1, 11318.0]
  - - [1856, 6784, 1, 128, 1856, 1856, 1856, 128]
    - [23, 11183.0]
  - - [5056, 704, 1, 3328, 5056, 5056, 5056, 3328]
    - [22, 11586.0]
  - - [1408, 1856, 1, 256, 1408, 1408, 1408, 256]
    - [0, 11029.0]
  - - [2368, 5056, 1, 256, 2368, 2368, 2368, 256]
    - [17, 11614.0]
  - - [3584, 2368, 1, 1280, 3584, 3584, 3584, 1280]
    - [1, 11981.0]
  - - [704, 5888, 1, 256, 704, 704, 704, 256]
    - [1, 10557.0]
  - - [6784, 2944, 1, 128, 6784, 6784, 6784, 128]
    - [37, 11939.0]
  - - [2944, 6784, 1, 3328, 2944, 2944, 2944, 3328]
    - [1, 12666.0]
  - - [3584, 704, 1, 3328, 3584, 3584, 3584, 3328]
    - [16, 11253.0]
  - - [448, 4288, 1, 256, 448, 448, 448, 256]
    - [9, 9124.0]
  - - [704, 2368, 1, 1280, 704, 704, 704, 1280]
    - [41, 9703.0]
  - - [1856, 2368, 1, 1280, 1856, 1856, 1856, 1280]
    - [16, 11276.0]
  - - [1856, 4288, 1, 1280, 1856, 1856, 1856, 1280]
    - [17, 11677.0]
  - - [256, 193600, 1, 64, 256, 256, 256, 64]
    - [14, 7913.0]
  - - [704, 2944, 1, 128, 704, 704, 704, 128]
    - [7, 9315.0]
  - - [1408, 1024, 1, 1280, 1408, 1408, 1408, 1280]
    - [16, 11068.0]
  - - [704, 6784, 1, 256, 704, 704, 704, 256]
    - [2, 10434.0]
  - - [6784, 704, 1, 256, 6784, 6784, 6784, 256]
    - [16, 11231.0]
  - - [5056, 1408, 1, 128, 5056, 5056, 5056, 128]
    - [7, 11085.0]
  - - [2048, 7000, 1, 2048, 2048, 2048, 2048, 2048]
    - [1, 12388.0]
  - - [5056, 704, 1, 256, 5056, 5056, 5056, 256]
    - [36, 11037.0]
  - - [3584, 4288, 1, 3328, 3584, 3584, 3584, 3328]
    - [1, 12342.0]
  - - [5888, 1856, 1, 1280, 5888, 5888, 5888, 1280]
    - [1, 11941.0]
  - - [2368, 3584, 1, 1280, 2368, 2368, 2368, 1280]
    - [1, 11986.0]
  - - [2944, 3584, 1, 3328, 2944, 2944, 2944, 3328]
    - [1, 12299.0]
  - - [6784, 2944, 1, 256, 6784, 6784, 6784, 256]
    - [17, 12311.0]
  - - [1024, 1500, 1, 2560, 1024, 1024, 1024, 2560]
    - [8, 11000.0]
  - - [1856, 2368, 1, 256, 1856, 1856, 1856, 256]
    - [0, 11003.0]
  - - [3584, 6784, 1, 3328, 3584, 3584, 3584, 3328]
    - [8, 12539.0]
  - - [1024, 5888, 1, 3328, 1024, 1024, 1024, 3328]
    - [37, 12033.0]
  - - [6144, 24000, 1, 2560, 6144, 6144, 6144, 2560]
    - [1, 12435.0]
  - - [5056, 4288, 1, 1280, 5056, 5056, 5056, 1280]
    - [17, 12258.0]
  - - [2368, 2368, 1, 1280, 2368, 2368, 2368, 1280]
    - [0, 11247.0]
  - - [2944, 5888, 1, 128, 2944, 2944, 2944, 128]
    - [37, 11915.0]
  - - [704, 5888, 1, 1280, 704, 704, 704, 1280]
    - [8, 11118.0]
  - - [2368, 3584, 1, 128, 2368, 2368, 2368, 128]
    - [23, 11087.0]
  - - [1856, 5056, 1, 128, 1856, 1856, 1856, 128]
    - [7, 11054.0]
  - - [2944, 6784, 1, 1280, 2944, 2944, 2944, 1280]
    - [17, 12628.0]
  - - [1024, 5056, 1, 1280, 1024, 1024, 1024, 1280]
    - [8, 12107.0]
  - - [4288, 1024, 1, 256, 4288, 4288, 4288, 256]
    - [2, 11129.0]
  - - [2944, 2368, 1, 128, 2944, 2944, 2944, 128]
    - [30, 11313.0]
  - - [5888, 448, 1, 1280, 5888, 5888, 5888, 1280]
    - [0, 11040.0]
  - - [704, 5888, 1, 3328, 704, 704, 704, 3328]
    - [41, 11103.0]
  - - [3584, 2944, 1, 256, 3584, 3584, 3584, 256]
    - [40, 11766.0]
  - - [1856, 2368, 1, 3328, 1856, 1856, 1856, 3328]
    - [16, 11336.0]
  - - [512, 6000, 1, 2816, 512, 512, 512, 2816]
    - [7, 11511.0]
  - - [512, 24000, 1, 2048, 512, 512, 512, 2048]
    - [23, 12309.0]
  - - [1408, 5056, 1, 3328, 1408, 1408, 1408, 3328]
    - [17, 12361.0]
  - - [1856, 1856, 1, 3328, 1856, 1856, 1856, 3328]
    - [7, 11240.0]
  - - [2368, 2368, 1, 256, 2368, 2368, 2368, 256]
    - [30, 10640.0]
  - - [4288, 4288, 1, 1280, 4288, 4288, 4288, 1280]
    - [1, 12195.0]
  - - [5888, 1024, 1, 1280, 5888, 5888, 5888, 1280]
    - [17, 12045.0]
  - - [1024, 12544, 1, 256, 1024, 1024, 1024, 256]
    - [20, 11823.0]
  - - [5888, 448, 1, 128, 5888, 5888, 5888, 128]
    - [16, 10313.0]
  - - [512, 48000, 1, 2560, 512, 512, 512, 2560]
    - [23, 12547.0]
  - - [704, 6784, 1, 3328, 704, 704, 704, 3328]
    - [1, 11268.0]
  - - [5888, 5888, 1, 1280, 5888, 5888, 5888, 1280]
    - [1, 12662.0]
  - - [5056, 1024, 1, 1280, 5056, 5056, 5056, 1280]
    - [1, 12218.0]
  - - [448, 5888, 1, 3328, 448, 448, 448, 3328]
    - [16, 9939.0]
  - - [1024, 2944, 1, 1280, 1024, 1024, 1024, 1280]
    - [16, 11298.0]
  - - [5056, 5888, 1, 1280, 5056, 5056, 5056, 1280]
    - [1, 12413.0]
  - - [4288, 5888, 1, 128, 4288, 4288, 4288, 128]
    - [8, 11718.0]
  - - [1408, 3584, 1, 128, 1408, 1408, 1408, 128]
    - [16, 11245.0]
  - - [448, 3584, 1, 128, 448, 448, 448, 128]
    - [30, 8465.0]
  - - [5888, 2944, 1, 1280, 5888, 5888, 5888, 1280]
    - [17, 12599.0]
  - - [2368, 5888, 1, 128, 2368, 2368, 2368, 128]
    - [1, 11392.0]
  - - [3584, 5888, 1, 256, 3584, 3584, 3584, 256]
    - [8, 12194.0]
  - - [2368, 1024, 1, 128, 2368, 2368, 2368, 128]
    - [22, 10012.0]
  - - [2368, 704, 1, 128, 2368, 2368, 2368, 128]
    - [0, 9762.0]
  - - [3584, 2368, 1, 128, 3584, 3584, 3584, 128]
    - [7, 11486.0]
  - - [5056, 704, 1, 128, 5056, 5056, 5056, 128]
    - [22, 10517.0]
  - - [5056, 1408, 1, 3328, 5056, 5056, 5056, 3328]
    - [1, 12414.0]
  - - [6784, 1024, 1, 3328, 6784, 6784, 6784, 3328]
    - [1, 12120.0]
  - - [6784, 2944, 1, 3328, 6784, 6784, 6784, 3328]
    - [1, 12659.0]
  - - [1856, 1856, 1, 256, 1856, 1856, 1856, 256]
    - [0, 10815.0]
  - - [6784, 2368, 1, 1280, 6784, 6784, 6784, 1280]
    - [17, 12120.0]
  - - [4288, 3584, 1, 256, 4288, 4288, 4288, 256]
    - [37, 11943.0]
  - - [4288, 5888, 1, 1280, 4288, 4288, 4288, 1280]
    - [1, 12374.0]
  - - [1024, 6000, 1, 1536, 1024, 1024, 1024, 1536]
    - [1, 12171.0]
  - - [4288, 1856, 1, 1280, 4288, 4288, 4288, 1280]
    - [17, 11690.0]
  - - [1856, 2944, 1, 3328, 1856, 1856, 1856, 3328]
    - [1, 11607.0]
  - - [256, 6784, 1, 3328, 256, 256, 256, 3328]
    - [7, 11063.0]
  - - [512, 3000, 1, 1536, 512, 512, 512, 1536]
    - [37, 10808.0]
  - - [256, 5056, 1, 128, 256, 256, 256, 128]
    - [0, 9435.0]
  - - [5056, 1024, 1, 256, 5056, 5056, 5056, 256]
    - [17, 10783.0]
  - - [5056, 1856, 1, 3328, 5056, 5056, 5056, 3328]
    - [1, 12008.0]
  - - [4288, 1408, 1, 128, 4288, 4288, 4288, 128]
    - [16, 10891.0]
  - - [1856, 5888, 1, 3328, 1856, 1856, 1856, 3328]
    - [1, 11999.0]
  - - [4288, 5056, 1, 256, 4288, 4288, 4288, 256]
    - [8, 11907.0]
  - - [4096, 7000, 1, 4096, 4096, 4096, 4096, 4096]
    - [1, 12571.0]
  - - [5056, 256, 1, 3328, 5056, 5056, 5056, 3328]
    - [9, 11486.0]
  - - [1024, 3000, 1, 2560, 1024, 1024, 1024, 2560]
    - [36, 11520.0]
  - - [1024, 5888, 1, 1280, 1024, 1024, 1024, 1280]
    - [1, 11920.0]
  - - [6784, 2368, 1, 128, 6784, 6784, 6784, 128]
    - [36, 11582.0]
  - - [1856, 1024, 1, 1280, 1856, 1856, 1856, 1280]
    - [18, 11254.0]
  - - [6784, 4288, 1, 1280, 6784, 6784, 6784, 1280]
    - [37, 12369.0]
  - - [1856, 1856, 1, 1280, 1856, 1856, 1856, 1280]
    - [0, 11198.0]
  - - [3072, 24000, 1, 1024, 3072, 3072, 3072, 1024]
    - [23, 12538.0]
  - - [1408, 5056, 1, 1280, 1408, 1408, 1408, 1280]
    - [17, 12231.0]
  - - [5888, 1856, 1, 128, 5888, 5888, 5888, 128]
    - [30, 11498.0]
  - - [448, 6784, 1, 128, 448, 448, 448, 128]
    - [30, 9214.0]
  - - [5056, 3584, 1, 128, 5056, 5056, 5056, 128]
    - [31, 11698.0]
  - - [5888, 5888, 1, 3328, 5888, 5888, 5888, 3328]
    - [1, 12683.0]
  - - [6784, 1024, 1, 256, 6784, 6784, 6784, 256]
    - [37, 11419.0]
  - - [2944, 2368, 1, 256, 2944, 2944, 2944, 256]
    - [30, 11514.0]
  - - [5056, 5888, 1, 3328, 5056, 5056, 5056, 3328]
    - [1, 12485.0]
  - - [1856, 1024, 1, 256, 1856, 1856, 1856, 256]
    - [16, 10239.0]
  - - [512, 48000, 1, 1536, 512, 512, 512, 1536]
    - [8, 12556.0]
  - - [3584, 448, 1, 1280, 3584, 3584, 3584, 1280]
    - [16, 11181.0]
  - - [448, 5888, 1, 256, 448, 448, 448, 256]
    - [16, 9439.0]
  - - [1408, 6784, 1, 3328, 1408, 1408, 1408, 3328]
    - [8, 12218.0]
  - - [4288, 704, 1, 128, 4288, 4288, 4288, 128]
    - [30, 9852.0]
  - - [5056, 2944, 1, 256, 5056, 5056, 5056, 256]
    - [23, 12008.0]
  - - [6784, 5888, 1, 128, 6784, 6784, 6784, 128]
    - [31, 12103.0]
  - - [2944, 704, 1, 128, 2944, 2944, 2944, 128]
    - [16, 10331.0]
  - - [1408, 3584, 1, 3328, 1408, 1408, 1408, 3328]
    - [1, 12050.0]
  - - [2368, 6784, 1, 256, 2368, 2368, 2368, 256]
    - [17, 11799.0]
  - - [5056, 1408, 1, 1280, 5056, 5056, 5056, 1280]
    - [1, 12303.0]
  - - [5056, 4288, 1, 128, 5056, 5056, 5056, 128]
    - [16, 11524.0]
  - - [4288, 2368, 1, 3328, 4288, 4288, 4288, 3328]
    - [1, 11874.0]
  - - [1408, 1856, 1, 128, 1408, 1408, 1408, 128]
    - [7, 10210.0]
  - - [1408, 5888, 1, 3328, 1408, 1408, 1408, 3328]
    - [8, 12193.0]
  - - [6784, 6784, 1, 256, 6784, 6784, 6784, 256]
    - [17, 12424.0]
  - - [5888, 5056, 1, 128, 5888, 5888, 5888, 128]
    - [16, 11786.0]
  - - [4288, 2368, 1, 128, 4288, 4288, 4288, 128]
    - [7, 11337.0]
  - - [2368, 2944, 1, 256, 2368, 2368, 2368, 256]
    - [17, 11599.0]
  - - [3584, 1856, 1, 1280, 3584, 3584, 3584, 1280]
    - [1, 12054.0]
  - - [6784, 6784, 1, 128, 6784, 6784, 6784, 128]
    - [31, 12161.0]
  - - [5888, 5056, 1, 256, 5888, 5888, 5888, 256]
    - [8, 12155.0]
  - - [8448, 48000, 1, 2816, 8448, 8448, 8448, 2816]
    - [37, 12523.0]
  - - [512, 6000, 1, 2048, 512, 512, 512, 2048]
    - [36, 11498.0]
  - - [3584, 448, 1, 256, 3584, 3584, 3584, 256]
    - [16, 10594.0]
  - - [448, 4288, 1, 128, 448, 448, 448, 128]
    - [16, 8813.0]
  - - [256, 6784, 1, 256, 256, 256, 256, 256]
    - [22, 10306.0]
  - - [1408, 4288, 1, 128, 1408, 1408, 1408, 128]
    - [22, 11295.0]
  - - [2944, 704, 1, 3328, 2944, 2944, 2944, 3328]
    - [16, 11366.0]
  - - [3584, 3584, 1, 256, 3584, 3584, 3584, 256]
    - [23, 11958.0]
  - - [3584, 5056, 1, 256, 3584, 3584, 3584, 256]
    - [1, 12064.0]
  - - [2944, 2368, 1, 1280, 2944, 2944, 2944, 1280]
    - [1, 12072.0]
  - - [704, 6784, 1, 128, 704, 704, 704, 128]
    - [18, 10074.0]
  - - [6784, 3584, 1, 256, 6784, 6784, 6784, 256]
    - [17, 12268.0]
  - - [1856, 1408, 1, 256, 1856, 1856, 1856, 256]
    - [16, 10463.0]
  - - [5056, 2368, 1, 128, 5056, 5056, 5056, 128]
    - [0, 11440.0]
  - - [2944, 2944, 1, 3328, 2944, 2944, 2944, 3328]
    - [1, 12364.0]
  - - [5056, 6784, 1, 256, 5056, 5056, 5056, 256]
    - [17, 12209.0]
  - - [1856, 3584, 1, 128, 1856, 1856, 1856, 128]
    - [36, 10899.0]
  - - [3584, 6784, 1, 128, 3584, 3584, 3584, 128]
    - [8, 11850.0]
  - - [2368, 6784, 1, 1280, 2368, 2368, 2368, 1280]
    - [17, 12149.0]
  - - [5056, 1856, 1, 256, 5056, 5056, 5056, 256]
    - [0, 11545.0]
  - - [1024, 3000, 1, 2816, 1024, 1024, 1024, 2816]
    - [7, 11574.0]
  - - [1024, 1856, 1, 256, 1024, 1024, 1024, 256]
    - [0, 10693.0]
  - - [1408, 6784, 1, 1280, 1408, 1408, 1408, 1280]
    - [37, 12213.0]
  - - [3584, 3584, 1, 1280, 3584, 3584, 3584, 1280]
    - [1, 12329.0]
  - - [7680, 24000, 1, 2560, 7680, 7680, 7680, 2560]
    - [8, 12381.0]
  - - [4608, 48000, 1, 1536, 4608, 4608, 4608, 1536]
    - [8, 12461.0]
  - - [5888, 5888, 1, 128, 5888, 5888, 5888, 128]
    - [8, 12036.0]
  - - [5056, 2368, 1, 3328, 5056, 5056, 5056, 3328]
    - [1, 12157.0]
  - - [2944, 4288, 1, 256, 2944, 2944, 2944, 256]
    - [31, 11649.0]
  - - [1408, 3584, 1, 1280, 1408, 1408, 1408, 1280]
    - [1, 11962.0]
  - - [1024, 1500, 1, 2816, 1024, 1024, 1024, 2816]
    - [1, 11037.0]
  - - [1024, 6000, 1, 2048, 1024, 1024, 1024, 2048]
    - [23, 12247.0]
  - - [512, 24000, 1, 2560, 512, 512, 512, 2560]
    - [37, 12364.0]
  - - [6144, 3000, 1, 2560, 6144, 6144, 6144, 2560]
    - [1, 12287.0]
  - - [2368, 6784, 1, 3328, 2368, 2368, 2368, 3328]
    - [1, 12152.0]
  - - [1856, 1408, 1, 1280, 1856, 1856, 1856, 1280]
    - [22, 10871.0]
  - - [6784, 704, 1, 128, 6784, 6784, 6784, 128]
    - [16, 11103.0]
  - - [5056, 2944, 1, 128, 5056, 5056, 5056, 128]
    - [22, 11447.0]
  - - [1408, 5888, 1, 256, 1408, 1408, 1408, 256]
    - [1, 11761.0]
  - - [704, 2944, 1, 1280, 704, 704, 704, 1280]
    - [37, 10695.0]
  - - [3584, 704, 1, 1280, 3584, 3584, 3584, 1280]
    - [22, 11194.0]
  - - [5888, 2368, 1, 256, 5888, 5888, 5888, 256]
    - [3, 11723.0]
  - - [2944, 6784, 1, 128, 2944, 2944, 2944, 128]
    - [37, 11968.0]
  - - [3584, 448, 1, 3328, 3584, 3584, 3584, 3328]
    - [0, 11337.0]
  - - [704, 2368, 1, 3328, 704, 704, 704, 3328]
    - [5, 10218.0]
  - - [4608, 6000, 1, 1536, 4608, 4608, 4608, 1536]
    - [1, 12494.0]
  - - [256, 5888, 1, 128, 256, 256, 256, 128]
    - [30, 8389.0]
  - - [2944, 2944, 1, 1280, 2944, 2944, 2944, 1280]
    - [17, 12277.0]
  - - [5056, 448, 1, 3328, 5056, 5056, 5056, 3328]
    - [16, 11494.0]
  - - [6784, 704, 1, 3328, 6784, 6784, 6784, 3328]
    - [16, 11517.0]
  - - [5888, 4288, 1, 128, 5888, 5888, 5888, 128]
    - [16, 11731.0]
  - - [1408, 2944, 1, 3328, 1408, 1408, 1408, 3328]
    - [1, 12125.0]
  - - [3584, 704, 1, 128, 3584, 3584, 3584, 128]
    - [22, 10272.0]
  - - [448, 5056, 1, 128, 448, 448, 448, 128]
    - [16, 8722.0]
  - - [5056, 3584, 1, 256, 5056, 5056, 5056, 256]
    - [31, 12110.0]
  - - [4288, 4288, 1, 256, 4288, 4288, 4288, 256]
    - [17, 11915.0]
  - - [1408, 5056, 1, 128, 1408, 1408, 1408, 128]
    - [30, 11379.0]
  - - [2944, 3584, 1, 128, 2944, 2944, 2944, 128]
    - [37, 11643.0]
  - - [3584, 2368, 1, 256, 3584, 3584, 3584, 256]
    - [16, 11663.0]
  - - [5888, 5056, 1, 1280, 5888, 5888, 5888, 1280]
    - [1, 12512.0]
  - - [8448, 24000, 1, 2816, 8448, 8448, 8448, 2816]
    - [8, 12445.0]
  - - [3584, 3584, 1, 3328, 3584, 3584, 3584, 3328]
    - [1, 12372.0]
  - - [3072, 1500, 1, 128, 3072, 3072, 3072, 128]
    - [16, 10045.0]
  - - [2048, 3136, 1, 512, 2048, 2048, 2048, 512]
    - [3, 11639.0]
  - - [3025, 256, 64, 64, 3025, 3025, 3025, 64]
    - [6, 6572.0]
  - - [5888, 6784, 1, 256, 5888, 5888, 5888, 256]
    - [17, 12401.0]
  - - [4288, 2944, 1, 3328, 4288, 4288, 4288, 3328]
    - [1, 12201.0]
  - - [256, 5056, 1, 1280, 256, 256, 256, 1280]
    - [7, 11069.0]
  - - [2944, 5888, 1, 3328, 2944, 2944, 2944, 3328]
    - [31, 12609.0]
  - - [6784, 5888, 1, 1280, 6784, 6784, 6784, 1280]
    - [1, 12653.0]
  - - [5888, 4288, 1, 1280, 5888, 5888, 5888, 1280]
    - [1, 12338.0]
  - - [1024, 24000, 1, 2048, 1024, 1024, 1024, 2048]
    - [11, 12375.0]
  - - [5888, 3584, 1, 128, 5888, 5888, 5888, 128]
    - [37, 11826.0]
  - - [6784, 6784, 1, 3328, 6784, 6784, 6784, 3328]
    - [1, 12590.0]
  - - [704, 3584, 1, 128, 704, 704, 704, 128]
    - [30, 5904.0]
  - - [5888, 448, 1, 3328, 5888, 5888, 5888, 3328]
    - [16, 11131.0]
  - - [2368, 4288, 1, 1280, 2368, 2368, 2368, 1280]
    - [17, 11784.0]
  - - [4288, 2944, 1, 128, 4288, 4288, 4288, 128]
    - [8, 11319.0]
  - - [5056, 2944, 1, 3328, 5056, 5056, 5056, 3328]
    - [1, 12492.0]
  - - [2944, 3584, 1, 256, 2944, 2944, 2944, 256]
    - [17, 11769.0]
  - - [1408, 1408, 1, 3328, 1408, 1408, 1408, 3328]
    - [16, 10932.0]
  - - [3584, 3584, 1, 128, 3584, 3584, 3584, 128]
    - [16, 11491.0]
  - - [3584, 704, 1, 256, 3584, 3584, 3584, 256]
    - [16, 10841.0]
  - - [3584, 1408, 1, 3328, 3584, 3584, 3584, 3328]
    - [1, 12008.0]
  - - [704, 3584, 1, 1280, 704, 704, 704, 1280]
    - [0, 10519.0]
  - - [1024, 1408, 1, 128, 1024, 1024, 1024, 128]
    - [7, 9744.0]
  - - [1856, 6784, 1, 256, 1856, 1856, 1856, 256]
    - [17, 11659.0]
  - - [4288, 448, 1, 3328, 4288, 4288, 4288, 3328]
    - [22, 11339.0]
  - - [6784, 4288, 1, 128, 6784, 6784, 6784, 128]
    - [16, 11774.0]
  - - [6784, 704, 1, 1280, 6784, 6784, 6784, 1280]
    - [0, 11495.0]
  - - [3584, 6784, 1, 256, 3584, 3584, 3584, 256]
    - [23, 12251.0]
  - - [5888, 1024, 1, 3328, 5888, 5888, 5888, 3328]
    - [1, 12151.0]
  - - [704, 6784, 1, 1280, 704, 704, 704, 1280]
    - [1, 11252.0]
  - - [1856, 5056, 1, 3328, 1856, 1856, 1856, 3328]
    - [1, 11963.0]
  - - [1024, 3584, 1, 128, 1024, 1024, 1024, 128]
    - [7, 10500.0]
  - - [2368, 2944, 1, 128, 2368, 2368, 2368, 128]
    - [0, 11019.0]
  - - [5888, 2944, 1, 3328, 5888, 5888, 5888, 3328]
    - [1, 12646.0]
  - - [1408, 2368, 1, 128, 1408, 1408, 1408, 128]
    - [30, 10728.0]
  - - [5888, 2368, 1, 128, 5888, 5888, 5888, 128]
    - [16, 11587.0]
  - - [3584, 6784, 1, 1280, 3584, 3584, 3584, 1280]
    - [23, 12535.0]
  - - [4288, 1856, 1, 256, 4288, 4288, 4288, 256]
    - [16, 11340.0]
  - - [1856, 5888, 1, 256, 1856, 1856, 1856, 256]
    - [23, 11563.0]
  - - [4288, 4288, 1, 3328, 4288, 4288, 4288, 3328]
    - [1, 12268.0]
  - - [4288, 1408, 1, 1280, 4288, 4288, 4288, 1280]
    - [23, 11986.0]
  - - [3584, 5056, 1, 128, 3584, 3584, 3584, 128]
    - [16, 11686.0]
  - - [4288, 2368, 1, 256, 4288, 4288, 4288, 256]
    - [7, 11508.0]
  - - [2944, 5056, 1, 1280, 2944, 2944, 2944, 1280]
    - [1, 12446.0]
  - - [448, 6784, 1, 256, 448, 448, 448, 256]
    - [16, 9554.0]
  - - [1856, 2368, 1, 128, 1856, 1856, 1856, 128]
    - [16, 10594.0]
  - - [6784, 2368, 1, 3328, 6784, 6784, 6784, 3328]
    - [1, 12176.0]
  - - [1408, 6784, 1, 128, 1408, 1408, 1408, 128]
    - [0, 11450.0]
  - - [4288, 1856, 1, 3328, 4288, 4288, 4288, 3328]
    - [1, 11784.0]
  - - [3584, 448, 1, 128, 3584, 3584, 3584, 128]
    - [36, 9266.0]
  - - [3584, 1024, 1, 1280, 3584, 3584, 3584, 1280]
    - [1, 11470.0]
  - - [1856, 5056, 1, 256, 1856, 1856, 1856, 256]
    - [17, 11371.0]
  - - [6784, 4288, 1, 3328, 6784, 6784, 6784, 3328]
    - [1, 12397.0]
  - - [1024, 4288, 1, 256, 1024, 1024, 1024, 256]
    - [0, 11357.0]
  - - [5888, 3584, 1, 3328, 5888, 5888, 5888, 3328]
    - [23, 12558.0]
  - - [5056, 3584, 1, 3328, 5056, 5056, 5056, 3328]
    - [1, 12515.0]
  - - [2368, 1408, 1, 1280, 2368, 2368, 2368, 1280]
    - [30, 11242.0]
  - - [5056, 2944, 1, 1280, 5056, 5056, 5056, 1280]
    - [17, 12397.0]
  - - [8448, 6000, 1, 2816, 8448, 8448, 8448, 2816]
    - [20, 12495.0]
  - - [3584, 2944, 1, 1280, 3584, 3584, 3584, 1280]
    - [23, 12234.0]
  - - [1024, 6784, 1, 256, 1024, 1024, 1024, 256]
    - [1, 11537.0]
  - - [6784, 448, 1, 256, 6784, 6784, 6784, 256]
    - [16, 11052.0]
  - - [5124, 9124, 1, 2048, 5124, 5124, 5124, 2048]
    - [8, 12135.0]
  - - [2944, 5056, 1, 3328, 2944, 2944, 2944, 3328]
    - [1, 12417.0]
  - - [2944, 1408, 1, 128, 2944, 2944, 2944, 128]
    - [30, 10582.0]
  - - [5056, 6784, 1, 3328, 5056, 5056, 5056, 3328]
    - [1, 12486.0]
  - - [704, 2368, 1, 128, 704, 704, 704, 128]
    - [22, 5284.0]
  - - [3072, 1500, 1, 1024, 3072, 3072, 3072, 1024]
    - [1, 11408.0]
  - - [3584, 4288, 1, 256, 3584, 3584, 3584, 256]
    - [23, 11904.0]
  - - [1856, 6784, 1, 3328, 1856, 1856, 1856, 3328]
    - [1, 12125.0]
  - - [5888, 4288, 1, 256, 5888, 5888, 5888, 256]
    - [8, 12051.0]
  - - [5056, 1408, 1, 256, 5056, 5056, 5056, 256]
    - [37, 11565.0]
  - - [3584, 1024, 1, 256, 3584, 3584, 3584, 256]
    - [16, 11156.0]
  - - [512, 6000, 1, 1536, 512, 512, 512, 1536]
    - [7, 11460.0]
  - - [5888, 5888, 1, 256, 5888, 5888, 5888, 256]
    - [17, 12367.0]
  - - [4288, 1024, 1, 1280, 4288, 4288, 4288, 1280]
    - [1, 11821.0]
  - - [448, 6784, 1, 3328, 448, 448, 448, 3328]
    - [37, 10252.0]
  - - [2944, 1408, 1, 1280, 2944, 2944, 2944, 1280]
    - [1, 11956.0]
  - - [3072, 6000, 1, 1024, 3072, 3072, 3072, 1024]
    - [1, 12315.0]
  - - [2944, 1856, 1, 3328, 2944, 2944, 2944, 3328]
    - [1, 11610.0]
  - - [3584, 5888, 1, 1280, 3584, 3584, 3584, 1280]
    - [23, 12457.0]
  - - [6784, 1856, 1, 1280, 6784, 6784, 6784, 1280]
    - [1, 12056.0]
  - - [2944, 5056, 1, 256, 2944, 2944, 2944, 256]
    - [8, 11999.0]
  - - [5888, 256, 1, 3328, 5888, 5888, 5888, 3328]
    - [1, 11000.0]
  - - [2944, 4288, 1, 128, 2944, 2944, 2944, 128]
    - [22, 11499.0]
  - - [3584, 1408, 1, 256, 3584, 3584, 3584, 256]
    - [1, 11386.0]
  - - [704, 3584, 1, 3328, 704, 704, 704, 3328]
    - [16, 10568.0]
  - - [5056, 448, 1, 1280, 5056, 5056, 5056, 1280]
    - [16, 11335.0]
  - - [3584, 1856, 1, 3328, 3584, 3584, 3584, 3328]
    - [1, 12091.0]
  - - [4288, 6784, 1, 1280, 4288, 4288, 4288, 1280]
    - [23, 12351.0]
  - - [1024, 3000, 1, 2048, 1024, 1024, 1024, 2048]
    - [36, 11447.0]
  - - [2944, 1024, 1, 256, 2944, 2944, 2944, 256]
    - [30, 10959.0]
  - - [2368, 4288, 1, 3328, 2368, 2368, 2368, 3328]
    - [1, 11824.0]
  - - [1024, 1408, 1, 1280, 1024, 1024, 1024, 1280]
    - [16, 10866.0]
  - - [6784, 5056, 1, 256, 6784, 6784, 6784, 256]
    - [1, 12203.0]
  - - [1856, 1856, 1, 128, 1856, 1856, 1856, 128]
    - [30, 10365.0]
  - - [4288, 5888, 1, 256, 4288, 4288, 4288, 256]
    - [17, 12082.0]
  - - [2944, 6784, 1, 256, 2944, 2944, 2944, 256]
    - [1, 12283.0]
  - - [2944, 2944, 1, 128, 2944, 2944, 2944, 128]
    - [37, 11499.0]
  - - [1856, 3584, 1, 1280, 1856, 1856, 1856, 1280]
    - [17, 12036.0]
  - - [3584, 1408, 1, 1280, 3584, 3584, 3584, 1280]
    - [1, 11942.0]
  - - [4288, 448, 1, 128, 4288, 4288, 4288, 128]
    - [0, 9385.0]
  - - [5056, 256, 1, 1280, 5056, 5056, 5056, 1280]
    - [2, 11376.0]
  - - [1856, 1408, 1, 3328, 1856, 1856, 1856, 3328]
    - [16, 10974.0]
  - - [1024, 4288, 1, 3328, 1024, 1024, 1024, 3328]
    - [17, 11856.0]
  - - [5056, 448, 1, 256, 5056, 5056, 5056, 256]
    - [16, 10307.0]
  - - [2944, 2368, 1, 3328, 2944, 2944, 2944, 3328]
    - [17, 12120.0]
  - - [704, 4288, 1, 3328, 704, 704, 704, 3328]
    - [7, 10363.0]
  - - [1024, 1856, 1, 1280, 1024, 1024, 1024, 1280]
    - [8, 11179.0]
  - - [6784, 1856, 1, 256, 6784, 6784, 6784, 256]
    - [16, 11687.0]
  - - [512, 48000, 1, 2816, 512, 512, 512, 2816]
    - [17, 12609.0]
  - - [512, 3000, 1, 2816, 512, 512, 512, 2816]
    - [1, 10997.0]
  - - [1024, 5888, 1, 256, 1024, 1024, 1024, 256]
    - [16, 11491.0]
  - - [6784, 1408, 1, 256, 6784, 6784, 6784, 256]
    - [8, 11830.0]
  - - [1408, 2368, 1, 256, 1408, 1408, 1408, 256]
    - [16, 11102.0]
  - - [1408, 1408, 1, 256, 1408, 1408, 1408, 256]
    - [16, 10443.0]
  - - [2368, 2368, 1, 128, 2368, 2368, 2368, 128]
    - [0, 10816.0]
  - - [6784, 1408, 1, 128, 6784, 6784, 6784, 128]
    - [23, 11541.0]
  - - [1408, 5056, 1, 256, 1408, 1408, 1408, 256]
    - [17, 11793.0]
  - - [512, 50176, 1, 128, 512, 512, 512, 128]
    - [0, 11709.0]
  - - [4288, 3584, 1, 128, 4288, 4288, 4288, 128]
    - [8, 11563.0]
  - - [3584, 5056, 1, 1280, 3584, 3584, 3584, 1280]
    - [17, 12461.0]
  - - [1856, 1024, 1, 128, 1856, 1856, 1856, 128]
    - [4, 9548.0]
  - - [1024, 24000, 1, 1536, 1024, 1024, 1024, 1536]
    - [8, 12410.0]
  - - [704, 4288, 1, 256, 704, 704, 704, 256]
    - [30, 9865.0]
  - - [5888, 2368, 1, 1280, 5888, 5888, 5888, 1280]
    - [1, 12172.0]
  - - [6784, 1856, 1, 3328, 6784, 6784, 6784, 3328]
    - [1, 12144.0]
  - - [2368, 5888, 1, 1280, 2368, 2368, 2368, 1280]
    - [1, 12184.0]
  - - [5888, 256, 1, 1280, 5888, 5888, 5888, 1280]
    - [1, 10817.0]
  - - [2368, 1856, 1, 3328, 2368, 2368, 2368, 3328]
    - [0, 11326.0]
  - - [2944, 704, 1, 256, 2944, 2944, 2944, 256]
    - [16, 10259.0]
  - - [2368, 1024, 1, 3328, 2368, 2368, 2368, 3328]
    - [5, 11189.0]
  - - [704, 3584, 1, 256, 704, 704, 704, 256]
    - [16, 9646.0]
  - - [704, 2944, 1, 3328, 704, 704, 704, 3328]
    - [8, 10931.0]
  - - [6784, 1024, 1, 128, 6784, 6784, 6784, 128]
    - [30, 10844.0]
  - - [2944, 1024, 1, 3328, 2944, 2944, 2944, 3328]
    - [30, 11411.0]
  - - [2944, 5056, 1, 128, 2944, 2944, 2944, 128]
    - [0, 11595.0]
  - - [1408, 6784, 1, 256, 1408, 1408, 1408, 256]
    - [17, 11751.0]
  - - [6784, 1408, 1, 3328, 6784, 6784, 6784, 3328]
    - [1, 12264.0]
  - - [4288, 6784, 1, 128, 4288, 4288, 4288, 128]
    - [8, 11809.0]
  - - [1408, 2944, 1, 128, 1408, 1408, 1408, 128]
    - [16, 10944.0]
  - - [6784, 2944, 1, 1280, 6784, 6784, 6784, 1280]
    - [1, 12643.0]
  - - [4288, 1856, 1, 128, 4288, 4288, 4288, 128]
    - [0, 11143.0]
  - - [1856, 2944, 1, 128, 1856, 1856, 1856, 128]
    - [16, 10813.0]
  - - [6784, 448, 1, 128, 6784, 6784, 6784, 128]
    - [16, 10867.0]
  - - [448, 5056, 1, 1280, 448, 448, 448, 1280]
    - [17, 10340.0]
  - - [4288, 5056, 1, 1280, 4288, 4288, 4288, 1280]
    - [1, 12233.0]
  - - [2368, 1856, 1, 128, 2368, 2368, 2368, 128]
    - [30, 10387.0]
  - - [4288, 704, 1, 256, 4288, 4288, 4288, 256]
    - [0, 10842.0]
  - - [5888, 704, 1, 256, 5888, 5888, 5888, 256]
    - [16, 11180.0]
  - - [3584, 1024, 1, 128, 3584, 3584, 3584, 128]
    - [7, 10720.0]
  - - [256, 5888, 1, 3328, 256, 256, 256, 3328]
    - [11, 10773.0]
  - - [1408, 4288, 1, 3328, 1408, 1408, 1408, 3328]
    - [17, 12104.0]
  - - [6784, 4288, 1, 256, 6784, 6784, 6784, 256]
    - [17, 12100.0]
  - - [5888, 256, 1, 256, 5888, 5888, 5888, 256]
    - [32, 10086.0]
  - - [6784, 1024, 1, 1280, 6784, 6784, 6784, 1280]
    - [8, 12082.0]
  - - [5888, 1024, 1, 128, 5888, 5888, 5888, 128]
    - [7, 11283.0]
  - - [6784, 3584, 1, 1280, 6784, 6784, 6784, 1280]
    - [17, 12508.0]
  - - [1024, 6784, 1, 1280, 1024, 1024, 1024, 1280]
    - [1, 11996.0]
  - - [1408, 2944, 1, 1280, 1408, 1408, 1408, 1280]
    - [1, 12006.0]
  - - [1408, 2368, 1, 3328, 1408, 1408, 1408, 3328]
    - [1, 11448.0]
  - - [2944, 1856, 1, 128, 2944, 2944, 2944, 128]
    - [0, 10613.0]
  - - [256, 6784, 1, 128, 256, 256, 256, 128]
    - [16, 8227.0]
  - - [5056, 6784, 1, 128, 5056, 5056, 5056, 128]
    - [17, 11807.0]
  - - [4288, 5056, 1, 128, 4288, 4288, 4288, 128]
    - [16, 11512.0]
  - - [1856, 5888, 1, 128, 1856, 1856, 1856, 128]
    - [8, 11130.0]
  - - [3584, 1856, 1, 256, 3584, 3584, 3584, 256]
    - [16, 11542.0]
  - - [4288, 3584, 1, 1280, 4288, 4288, 4288, 1280]
    - [1, 12350.0]
  - - [704, 5888, 1, 128, 704, 704, 704, 128]
    - [16, 10091.0]
  - - [6784, 3584, 1, 128, 6784, 6784, 6784, 128]
    - [31, 11956.0]
  - - [5124, 1500, 1, 2048, 5124, 5124, 5124, 2048]
    - [1, 11762.0]
  - - [4288, 5056, 1, 3328, 4288, 4288, 4288, 3328]
    - [1, 12302.0]
  - - [1408, 1408, 1, 128, 1408, 1408, 1408, 128]
    - [16, 9634.0]
  - - [5056, 2368, 1, 256, 5056, 5056, 5056, 256]
    - [11, 11553.0]
  - - [4288, 704, 1, 3328, 4288, 4288, 4288, 3328]
    - [16, 11385.0]
  - - [448, 3584, 1, 256, 448, 448, 448, 256]
    - [22, 8901.0]
  - - [2368, 1024, 1, 1280, 2368, 2368, 2368, 1280]
    - [1, 11171.0]
  - - [2944, 1408, 1, 3328, 2944, 2944, 2944, 3328]
    - [17, 12121.0]
  - - [6144, 1500, 1, 2560, 6144, 6144, 6144, 2560]
    - [1, 12154.0]
  - - [1024, 1408, 1, 3328, 1024, 1024, 1024, 3328]
    - [7, 11164.0]
  - - [2944, 5888, 1, 1280, 2944, 2944, 2944, 1280]
    - [17, 12502.0]
  - - [5888, 3584, 1, 256, 5888, 5888, 5888, 256]
    - [17, 12189.0]
  - - [2368, 5056, 1, 128, 2368, 2368, 2368, 128]
    - [23, 11202.0]
  - - [1408, 1856, 1, 3328, 1408, 1408, 1408, 3328]
    - [16, 11682.0]
  - - [5888, 5056, 1, 3328, 5888, 5888, 5888, 3328]
    - [1, 12546.0]
  - - [7680, 6000, 1, 2560, 7680, 7680, 7680, 2560]
    - [3, 12523.0]
  - - [6784, 1408, 1, 1280, 6784, 6784, 6784, 1280]
    - [1, 12227.0]
  - - [512, 3000, 1, 2560, 512, 512, 512, 2560]
    - [8, 10949.0]
  - - [704, 2944, 1, 256, 704, 704, 704, 256]
    - [16, 9485.0]
  - - [6784, 5888, 1, 3328, 6784, 6784, 6784, 3328]
    - [1, 12625.0]
  - - [2368, 4288, 1, 128, 2368, 2368, 2368, 128]
    - [30, 11028.0]
  - - [1024, 6784, 1, 128, 1024, 1024, 1024, 128]
    - [7, 11134.0]
  - - [1024, 1500, 1, 1536, 1024, 1024, 1024, 1536]
    - [8, 10805.0]
  - - [1408, 1408, 1, 1280, 1408, 1408, 1408, 1280]
    - [30, 10577.0]
  - - [3072, 3000, 1, 1024, 3072, 3072, 3072, 1024]
    - [1, 12054.0]
  - - [448, 4288, 1, 3328, 448, 448, 448, 3328]
    - [17, 10078.0]
  - - [2368, 1408, 1, 256, 2368, 2368, 2368, 256]
    - [30, 10301.0]
  - - [704, 2368, 1, 256, 704, 704, 704, 256]
    - [33, 7822.0]
  - - [1024, 24000, 1, 2560, 1024, 1024, 1024, 2560]
    - [11, 12386.0]
  - - [5888, 2368, 1, 3328, 5888, 5888, 5888, 3328]
    - [1, 12181.0]
  - - [5124, 9124, 1, 1760, 5124, 5124, 5124, 1760]
    - [31, 12241.0]
  - - [4288, 448, 1, 1280, 4288, 4288, 4288, 1280]
    - [0, 11171.0]
  - - [5888, 704, 1, 3328, 5888, 5888, 5888, 3328]
    - [16, 11510.0]
  - - [5056, 256, 1, 128, 5056, 5056, 5056, 128]
    - [7, 8747.0]
  - - [1024, 6784, 1, 3328, 1024, 1024, 1024, 3328]
    - [8, 12060.0]
  - - [1408, 5888, 1, 128, 1408, 1408, 1408, 128]
    - [30, 11301.0]
  - - [512, 3136, 1, 2048, 512, 512, 512, 2048]
    - [9, 11355.0]
  - - [1408, 1024, 1, 256, 1408, 1408, 1408, 256]
    - [16, 9708.0]
  - - [8448, 1500, 1, 2816, 8448, 8448, 8448, 2816]
    - [1, 12203.0]
  - - [2560, 7000, 1, 2560, 2560, 2560, 2560, 2560]
    - [1, 12554.0]
  - - [5056, 6784, 1, 1280, 5056, 5056, 5056, 1280]
    - [1, 12480.0]
  - - [704, 5056, 1, 3328, 704, 704, 704, 3328]
    - [17, 11115.0]
  - - [3584, 5056, 1, 3328, 3584, 3584, 3584, 3328]
    - [1, 12442.0]
  - - [2368, 2944, 1, 3328, 2368, 2368, 2368, 3328]
    - [17, 12112.0]
  - - [2368, 3584, 1, 256, 2368, 2368, 2368, 256]
    - [8, 11304.0]
  - - [4608, 3000, 1, 1536, 4608, 4608, 4608, 1536]
    - [1, 12064.0]
  - - [5056, 3584, 1, 1280, 5056, 5056, 5056, 1280]
    - [1, 12373.0]
  - - [5124, 9124, 1, 4096, 5124, 5124, 5124, 4096]
    - [26, 12116.0]
  - - [7680, 48000, 1, 2560, 7680, 7680, 7680, 2560]
    - [1, 12698.0]
  - - [1856, 2944, 1, 1280, 1856, 1856, 1856, 1280]
    - [1, 11452.0]
  - - [4608, 1500, 1, 1536, 4608, 4608, 4608, 1536]
    - [1, 11968.0]
  - - [1024, 48000, 1, 2816, 1024, 1024, 1024, 2816]
    - [3, 12579.0]
  - - [5124, 9124, 1, 2560, 5124, 5124, 5124, 2560]
    - [1, 12189.0]
  - - [2944, 1408, 1, 256, 2944, 2944, 2944, 256]
    - [30, 8414.0]
  - - [4288, 1408, 1, 3328, 4288, 4288, 4288, 3328]
    - [1, 12110.0]
  - - [5888, 2944, 1, 128, 5888, 5888, 5888, 128]
    - [8, 11850.0]
  - - [2944, 1024, 1, 128, 2944, 2944, 2944, 128]
    - [16, 10761.0]
  - - [5124, 700, 1, 2048, 5124, 5124, 5124, 2048]
    - [0, 11188.0]
  - - [6784, 5056, 1, 128, 6784, 6784, 6784, 128]
    - [8, 11851.0]
  - - [256, 12544, 1, 1024, 256, 256, 256, 1024]
    - [8, 11735.0]
  - - [5888, 1408, 1, 3328, 5888, 5888, 5888, 3328]
    - [1, 12250.0]
  - - [2368, 1856, 1, 256, 2368, 2368, 2368, 256]
    - [16, 10981.0]
  - - [256, 5056, 1, 256, 256, 256, 256, 256]
    - [39, 9909.0]
  - - [5056, 5056, 1, 128, 5056, 5056, 5056, 128]
    - [30, 11570.0]
  - - [448, 3584, 1, 3328, 448, 448, 448, 3328]
    - [5, 9884.0]
  - - [5888, 256, 1, 128, 5888, 5888, 5888, 128]
    - [27, 9135.0]
  - - [3584, 1856, 1, 128, 3584, 3584, 3584, 128]
    - [36, 10753.0]
  - - [4288, 4288, 1, 128, 4288, 4288, 4288, 128]
    - [31, 11517.0]
  - - [1856, 1024, 1, 3328, 1856, 1856, 1856, 3328]
    - [5, 11668.0]
  - - [1856, 4288, 1, 128, 1856, 1856, 1856, 128]
    - [7, 10656.0]
  - - [1024, 6000, 1, 2560, 1024, 1024, 1024, 2560]
    - [8, 12194.0]
  - - [1024, 5056, 1, 256, 1024, 1024, 1024, 256]
    - [0, 11365.0]
  - - [5056, 5888, 1, 128, 5056, 5056, 5056, 128]
    - [31, 11778.0]
  - - [2368, 1408, 1, 3328, 2368, 2368, 2368, 3328]
    - [1, 11473.0]
  - - [1024, 48000, 1, 1536, 1024, 1024, 1024, 1536]
    - [8, 12535.0]
  - - [5888, 448, 1, 256, 5888, 5888, 5888, 256]
    - [16, 10641.0]
  - - [5888, 6784, 1, 128, 5888, 5888, 5888, 128]
    - [8, 12099.0]
  - - [6784, 5056, 1, 1280, 6784, 6784, 6784, 1280]
    - [1, 12526.0]
  - - [5056, 704, 1, 1280, 5056, 5056, 5056, 1280]
    - [0, 11566.0]
  - - [1024, 48000, 1, 2560, 1024, 1024, 1024, 2560]
    - [8, 12376.0]
  - - [1024, 2368, 1, 128, 1024, 1024, 1024, 128]
    - [7, 9810.0]
  - - [3072, 48000, 1, 1024, 3072, 3072, 3072, 1024]
    - [26, 12545.0]
  - - [1024, 5888, 1, 128, 1024, 1024, 1024, 128]
    - [22, 10773.0]
  - - [3584, 5888, 1, 128, 3584, 3584, 3584, 128]
    - [20, 11837.0]
  - - [5056, 5888, 1, 256, 5056, 5056, 5056, 256]
    - [31, 12154.0]
  - - [2368, 1024, 1, 256, 2368, 2368, 2368, 256]
    - [2, 10391.0]
  - - [2944, 1856, 1, 256, 2944, 2944, 2944, 256]
    - [16, 11410.0]
  - - [1856, 6784, 1, 1280, 1856, 1856, 1856, 1280]
    - [37, 12073.0]
  - - [8448, 3000, 1, 2816, 8448, 8448, 8448, 2816]
    - [17, 12263.0]
  - - [6784, 448, 1, 3328, 6784, 6784, 6784, 3328]
    - [0, 11497.0]
  - - [5056, 1856, 1, 1280, 5056, 5056, 5056, 1280]
    - [1, 11989.0]
  - - [1408, 1024, 1, 3328, 1408, 1408, 1408, 3328]
    - [7, 11171.0]
  - - [7680, 1500, 1, 2560, 7680, 7680, 7680, 2560]
    - [1, 12227.0]
  - - [5888, 3584, 1, 1280, 5888, 5888, 5888, 1280]
    - [1, 12514.0]
  - - [1856, 3584, 1, 3328, 1856, 1856, 1856, 3328]
    - [1, 12092.0]
  - - [1024, 2944, 1, 256, 1024, 1024, 1024, 256]
    - [16, 10809.0]
  - - [448, 6784, 1, 1280, 448, 448, 448, 1280]
    - [23, 10280.0]
  - - [704, 5056, 1, 256, 704, 704, 704, 256]
    - [16, 10313.0]
  - - [3584, 1024, 1, 3328, 3584, 3584, 3584, 3328]
    - [1, 11594.0]
  - - [2944, 1856, 1, 1280, 2944, 2944, 2944, 1280]
    - [16, 11628.0]
  - - [5056, 256, 1, 256, 5056, 5056, 5056, 256]
    - [9, 10479.0]
  - - [2944, 4288, 1, 3328, 2944, 2944, 2944, 3328]
    - [8, 12174.0]
  - - [2368, 3584, 1, 3328, 2368, 2368, 2368, 3328]
    - [1, 12029.0]
  - - [2944, 704, 1, 1280, 2944, 2944, 2944, 1280]
    - [16, 11192.0]
  - - [2944, 3584, 1, 1280, 2944, 2944, 2944, 1280]
    - [1, 12273.0]
  - - [1856, 5888, 1, 1280, 1856, 1856, 1856, 1280]
    - [1, 11942.0]
  - - [4608, 24000, 1, 1536, 4608, 4608, 4608, 1536]
    - [8, 12250.0]
  - - [4288, 1408, 1, 256, 4288, 4288, 4288, 256]
    - [8, 11190.0]
  - - [5888, 1408, 1, 128, 5888, 5888, 5888, 128]
    - [30, 11366.0]
  - - [4288, 2368, 1, 1280, 4288, 4288, 4288, 1280]
    - [1, 11818.0]
  - - [6784, 2368, 1, 256, 6784, 6784, 6784, 256]
    - [17, 11822.0]
  - - [1024, 24000, 1, 2816, 1024, 1024, 1024, 2816]
    - [8, 12524.0]
  - - [1856, 2944, 1, 256, 1856, 1856, 1856, 256]
    - [0, 11039.0]
  - - [5056, 1024, 1, 128, 5056, 5056, 5056, 128]
    - [8, 11086.0]
  - - [7680, 3000, 1, 2560, 7680, 7680, 7680, 2560]
    - [1, 12382.0]
  - - [4224, 1500, 1, 176, 4224, 4224, 4224, 176]
    - [16, 11100.0]
  - - [5124, 700, 1, 2560, 5124, 5124, 5124, 2560]
    - [16, 11219.0]
  - - [6784, 256, 1, 128, 6784, 6784, 6784, 128]
    - [16, 10041.0]
  - - [5888, 704, 1, 128, 5888, 5888, 5888, 128]
    - [16, 10940.0]
  - - [1024, 4288, 1, 1280, 1024, 1024, 1024, 1280]
    - [16, 11681.0]
  - - [2368, 5056, 1, 3328, 2368, 2368, 2368, 3328]
    - [23, 12029.0]
  - - [4288, 1024, 1, 3328, 4288, 4288, 4288, 3328]
    - [1, 11921.0]
  - - [6144, 48000, 1, 2560, 6144, 6144, 6144, 2560]
    - [8, 12576.0]
  - - [1024, 5056, 1, 3328, 1024, 1024, 1024, 3328]
    - [8, 12175.0]
  - - [1024, 1856, 1, 3328, 1024, 1024, 1024, 3328]
    - [17, 11504.0]
  - - [5124, 1500, 1, 2560, 5124, 5124, 5124, 2560]
    - [1, 11745.0]
  - - [4288, 6784, 1, 256, 4288, 4288, 4288, 256]
    - [17, 12094.0]
  - - [3584, 2944, 1, 3328, 3584, 3584, 3584, 3328]
    - [1, 12344.0]
  - - [5888, 2944, 1, 256, 5888, 5888, 5888, 256]
    - [17, 12231.0]
  - - [448, 4288, 1, 1280, 448, 448, 448, 1280]
    - [17, 9996.0]
  - - [1024, 4288, 1, 128, 1024, 1024, 1024, 128]
    - [7, 10969.0]
  - - [5056, 4288, 1, 256, 5056, 5056, 5056, 256]
    - [8, 11897.0]
  - - [1024, 3584, 1, 256, 1024, 1024, 1024, 256]
    - [0, 11124.0]
  - - [448, 5888, 1, 1280, 448, 448, 448, 1280]
    - [7, 9891.0]
  - - [512, 3000, 1, 2048, 512, 512, 512, 2048]
    - [9, 10952.0]
  - - [5056, 448, 1, 128, 5056, 5056, 5056, 128]
    - [30, 8965.0]
  - - [4288, 704, 1, 1280, 4288, 4288, 4288, 1280]
    - [16, 11298.0]
  - - [3584, 2944, 1, 128, 3584, 3584, 3584, 128]
    - [8, 11520.0]
  - - [6784, 256, 1, 1280, 6784, 6784, 6784, 1280]
    - [16, 11105.0]
  - - [2368, 5888, 1, 3328, 2368, 2368, 2368, 3328]
    - [1, 12200.0]
  - - [2368, 1856, 1, 1280, 2368, 2368, 2368, 1280]
    - [16, 11266.0]
  - - [448, 5056, 1, 3328, 448, 448, 448, 3328]
    - [41, 10486.0]
  - - [3584, 4288, 1, 128, 3584, 3584, 3584, 128]
    - [22, 11566.0]
  - - [1024, 6000, 1, 2816, 1024, 1024, 1024, 2816]
    - [17, 12245.0]
  - - [5888, 4288, 1, 3328, 5888, 5888, 5888, 3328]
    - [1, 12399.0]
  - - [2368, 704, 1, 256, 2368, 2368, 2368, 256]
    - [0, 10147.0]
  - - [3584, 1408, 1, 128, 3584, 3584, 3584, 128]
    - [7, 11091.0]
  - - [1856, 5056, 1, 1280, 1856, 1856, 1856, 1280]
    - [1, 11947.0]
  - - [2944, 1024, 1, 1280, 2944, 2944, 2944, 1280]
    - [30, 11311.0]
  - - [3584, 5888, 1, 3328, 3584, 3584, 3584, 3328]
    - [23, 12526.0]
  - - [2368, 4288, 1, 256, 2368, 2368, 2368, 256]
    - [0, 11306.0]
  - - [1024, 2368, 1, 3328, 1024, 1024, 1024, 3328]
    - [16, 11555.0]
  - - [1024, 2944, 1, 128, 1024, 1024, 1024, 128]
    - [16, 9676.0]
  - - [1024, 3584, 1, 1280, 1024, 1024, 1024, 1280]
    - [16, 11419.0]
  - - [4288, 5888, 1, 3328, 4288, 4288, 4288, 3328]
    - [1, 12356.0]
  - - [1024, 2944, 1, 3328, 1024, 1024, 1024, 3328]
    - [1, 11378.0]
  - - [256, 6784, 1, 1280, 256, 256, 256, 1280]
    - [7, 11009.0]
  - - [1856, 3584, 1, 256, 1856, 1856, 1856, 256]
    - [31, 11227.0]
  - - [6784, 1856, 1, 128, 6784, 6784, 6784, 128]
    - [30, 11573.0]
  - - [1024, 1500, 1, 2048, 1024, 1024, 1024, 2048]
    - [8, 10980.0]
  - - [512, 24000, 1, 2816, 512, 512, 512, 2816]
    - [23, 12408.0]
  - - [256, 5888, 1, 1280, 256, 256, 256, 1280]
    - [23, 10697.0]
  - - [4288, 6784, 1, 3328, 4288, 4288, 4288, 3328]
    - [1, 12396.0]
  - - [2368, 1408, 1, 128, 2368, 2368, 2368, 128]
    - [16, 9861.0]
  - - [1408, 1024, 1, 128, 1408, 1408, 1408, 128]
    - [22, 9775.0]
  - - [6784, 3584, 1, 3328, 6784, 6784, 6784, 3328]
    - [1, 12567.0]
  - - [1760, 7000, 1, 1760, 1760, 1760, 1760, 1760]
    - [1, 12210.0]
  - - [2368, 5056, 1, 1280, 2368, 2368, 2368, 1280]
    - [17, 12105.0]
  - - [1408, 2368, 1, 1280, 1408, 1408, 1408, 1280]
    - [22, 11353.0]
  - - [704, 4288, 1, 128, 704, 704, 704, 128]
    - [0, 9699.0]
  - - [2944, 2944, 1, 256, 2944, 2944, 2944, 256]
    - [17, 11844.0]
  - - [6784, 256, 1, 256, 6784, 6784, 6784, 256]
    - [30, 10616.0]
  - - [256, 5056, 1, 3328, 256, 256, 256, 3328]
    - [13, 11415.0]
  - - [5056, 1856, 1, 128, 5056, 5056, 5056, 128]
    - [36, 10523.0]
  - - [1024, 3000, 1, 1536, 1024, 1024, 1024, 1536]
    - [16, 11271.0]
  - - [5056, 1024, 1, 3328, 5056, 5056, 5056, 3328]
    - [1, 12270.0]
  - - [4288, 3584, 1, 3328, 4288, 4288, 4288, 3328]
    - [1, 12341.0]
  - - [1024, 2368, 1, 1280, 1024, 1024, 1024, 1280]
    - [7, 11387.0]
  - - [5888, 6784, 1, 3328, 5888, 5888, 5888, 3328]
    - [1, 12598.0]
  - - [704, 4288, 1, 1280, 704, 704, 704, 1280]
    - [16, 10279.0]
  - - [128, 50176, 1, 512, 128, 128, 128, 512]
    - [26, 11738.0]
  - - [1024, 48000, 1, 2048, 1024, 1024, 1024, 2048]
    - [3, 12584.0]
  - - [4288, 1024, 1, 128, 4288, 4288, 4288, 128]
    - [36, 10347.0]
  - - [784, 128, 128, 512, 784, 784, 784, 512]
    - [3, 10568.0]
  - - [784, 512, 256, 128, 784, 784, 784, 128]
    - [3, 10484.0]
  - - [3136, 256, 256, 64, 3136, 3136, 3136, 64]
    - [15, 7677.0]
  - - [784, 512, 128, 128, 784, 784, 784, 128]
    - [3, 10364.0]
  - - [784, 128, 256, 512, 784, 784, 784, 512]
    - [3, 10743.0]
  - - [3136, 256, 128, 64, 3136, 3136, 3136, 64]
    - [0, 8629.0]
  - - [4096, 512, 1, 1024, 4096, 4096, 4096, 1024]
    - [16, 11353.0]
  - - [2048, 768, 1, 512, 2048, 2048, 2048, 512]
    - [3, 10833.0]
  - - [4096, 512, 1, 2048, 4096, 4096, 4096, 2048]
    - [7, 11433.0]
  - - [4096, 1024, 1, 2048, 4096, 4096, 4096, 2048]
    - [1, 12186.0]
  - - [2048, 1024, 1, 2048, 2048, 2048, 2048, 2048]
    - [16, 11393.0]
  - - [2048, 1024, 1, 4096, 2048, 2048, 2048, 4096]
    - [22, 11409.0]
  - - [4096, 1024, 1, 1024, 4096, 4096, 4096, 1024]
    - [1, 12005.0]
  - - [2048, 1024, 1, 512, 2048, 2048, 2048, 512]
    - [0, 11187.0]
  - - [4096, 1024, 1, 4096, 4096, 4096, 4096, 4096]
    - [8, 12083.0]
  - - [2048, 1024, 1, 1024, 2048, 2048, 2048, 1024]
    - [16, 11250.0]
  - - [4096, 384, 1, 2048, 4096, 4096, 4096, 2048]
    - [2, 11110.0]
  - - [1225, 192, 64, 384, 1225, 1225, 1225, 384]
    - [16, 11259.0]
  - - [289, 128, 64, 1024, 289, 289, 289, 1024]
    - [26, 8493.0]
  - - [4096, 384, 1, 1536, 4096, 4096, 4096, 1536]
    - [1, 11286.0]
  - - [289, 192, 64, 1024, 289, 289, 289, 1024]
    - [39, 8356.0]
  - - [4096, 384, 1, 1280, 4096, 4096, 4096, 1280]
    - [1, 11241.0]
  - - [4096, 448, 1, 1280, 4096, 4096, 4096, 1280]
    - [22, 10804.0]
  - - [289, 256, 64, 1024, 289, 289, 289, 1024]
    - [11, 8770.0]
  - - [4096, 448, 1, 2048, 4096, 4096, 4096, 2048]
    - [7, 10862.0]
  - - [289, 384, 64, 1024, 289, 289, 289, 1024]
    - [26, 9121.0]
  - - [1024, 3594, 1, 4096, 1024, 1024, 1024, 4096]
    - [8, 11561.0]
  - - [4096, 3103, 1, 1024, 4096, 4096, 4096, 1024]
    - [1, 12058.0]
  - - [4096, 3136, 1, 1024, 4096, 4096, 4096, 1024]
    - [1, 12241.0]
  - - [1024, 3141, 1, 4096, 1024, 1024, 1024, 4096]
    - [3, 11926.0]
  - - [4096, 3559, 1, 1024, 4096, 4096, 4096, 1024]
    - [1, 12323.0]
  - - [4096, 3368, 1, 1024, 4096, 4096, 4096, 1024]
    - [1, 12010.0]
  - - [1024, 3335, 1, 4096, 1024, 1024, 1024, 4096]
    - [23, 11659.0]
  - - [1024, 3510, 1, 4096, 1024, 1024, 1024, 4096]
    - [22, 11713.0]
  - - [4096, 3209, 1, 1024, 4096, 4096, 4096, 1024]
    - [8, 11892.0]
  - - [4096, 3322, 1, 1024, 4096, 4096, 4096, 1024]
    - [1, 12416.0]
  - - [1024, 3400, 1, 4096, 1024, 1024, 1024, 4096]
    - [23, 11856.0]
  - - [1024, 3995, 1, 4096, 1024, 1024, 1024, 4096]
    - [26, 11738.0]
  - - [1024, 3503, 1, 4096, 1024, 1024, 1024, 4096]
    - [22, 11673.0]
  - - [4096, 3594, 1, 1024, 4096, 4096, 4096, 1024]
    - [1, 11929.0]
  - - [4096, 3473, 1, 1024, 4096, 4096, 4096, 1024]
    - [1, 12078.0]
  - - [4096, 3522, 1, 1024, 4096, 4096, 4096, 1024]
    - [1, 12222.0]
  - - [1024, 3103, 1, 4096, 1024, 1024, 1024, 4096]
    - [8, 11754.0]
  - - [1024, 3214, 1, 4096, 1024, 1024, 1024, 4096]
    - [26, 10655.0]
  - - [4096, 3449, 1, 1024, 4096, 4096, 4096, 1024]
    - [1, 12221.0]
  - - [1024, 3136, 1, 4096, 1024, 1024, 1024, 4096]
    - [8, 11906.0]
  - - [1024, 3955, 1, 33708, 1024, 1024, 1024, 33708]
    - [1, 11680.0]
  - - [1024, 3780, 1, 4096, 1024, 1024, 1024, 4096]
    - [28, 12037.0]
  - - [1024, 3906, 1, 33708, 1024, 1024, 1024, 33708]
    - [31, 11544.0]
  - - [1024, 3386, 1, 4096, 1024, 1024, 1024, 4096]
    - [23, 11824.0]
  - - [4096, 3396, 1, 1024, 4096, 4096, 4096, 1024]
    - [1, 12050.0]
  - - [1024, 3183, 1, 4096, 1024, 1024, 1024, 4096]
    - [3, 12029.0]
  - - [1024, 3098, 1, 4096, 1024, 1024, 1024, 4096]
    - [20, 11000.0]
  - - [1024, 3548, 1, 4096, 1024, 1024, 1024, 4096]
    - [26, 10505.0]
  - - [1024, 3224, 1, 4096, 1024, 1024, 1024, 4096]
    - [40, 10747.0]
  - - [4096, 3469, 1, 1024, 4096, 4096, 4096, 1024]
    - [1, 12046.0]
  - - [1024, 3582, 1, 4096, 1024, 1024, 1024, 4096]
    - [23, 11540.0]
  - - [1024, 2977, 1, 4096, 1024, 1024, 1024, 4096]
    - [5, 11399.0]
  - - [1024, 3939, 1, 1024, 1024, 1024, 1024, 1024]
    - [22, 11246.0]
  - - [4096, 3176, 1, 1024, 4096, 4096, 4096, 1024]
    - [8, 12349.0]
  - - [1024, 3559, 1, 4096, 1024, 1024, 1024, 4096]
    - [8, 11454.0]
  - - [1024, 3478, 1, 4096, 1024, 1024, 1024, 4096]
    - [22, 11617.0]
  - - [4096, 3343, 1, 1024, 4096, 4096, 4096, 1024]
    - [1, 11895.0]
  - - [4096, 3440, 1, 1024, 4096, 4096, 4096, 1024]
    - [1, 12256.0]
  - - [1024, 3996, 1, 33708, 1024, 1024, 1024, 33708]
    - [17, 11794.0]
  - - [1024, 4012, 1, 4096, 1024, 1024, 1024, 4096]
    - [23, 11810.0]
  - - [1024, 3322, 1, 4096, 1024, 1024, 1024, 4096]
    - [22, 11631.0]
  - - [1024, 3990, 1, 33708, 1024, 1024, 1024, 33708]
    - [1, 11783.0]
  - - [1024, 3314, 1, 4096, 1024, 1024, 1024, 4096]
    - [23, 11619.0]
  - - [4096, 3513, 1, 1024, 4096, 4096, 4096, 1024]
    - [1, 12149.0]
  - - [1024, 3562, 1, 4096, 1024, 1024, 1024, 4096]
    - [8, 11479.0]
  - - [1024, 3443, 1, 4096, 1024, 1024, 1024, 4096]
    - [23, 12014.0]
  - - [1024, 3554, 1, 4096, 1024, 1024, 1024, 4096]
    - [8, 11457.0]
  - - [1024, 3063, 1, 4096, 1024, 1024, 1024, 4096]
    - [5, 11682.0]
  - - [4096, 3460, 1, 1024, 4096, 4096, 4096, 1024]
    - [1, 12020.0]
  - - [1024, 3209, 1, 4096, 1024, 1024, 1024, 4096]
    - [3, 11108.0]
  - - [1024, 3147, 1, 4096, 1024, 1024, 1024, 4096]
    - [40, 11168.0]
  - - [4096, 3387, 1, 1024, 4096, 4096, 4096, 1024]
    - [1, 12057.0]
  - - [4096, 3436, 1, 1024, 4096, 4096, 4096, 1024]
    - [1, 12228.0]
  - - [1024, 3341, 1, 4096, 1024, 1024, 1024, 4096]
    - [23, 11647.0]
  - - [1024, 3516, 1, 4096, 1024, 1024, 1024, 4096]
    - [26, 10524.0]
  - - [4096, 3277, 1, 1024, 4096, 4096, 4096, 1024]
    - [1, 12184.0]
  - - [1024, 3454, 1, 4096, 1024, 1024, 1024, 4096]
    - [23, 12045.0]
  - - [1024, 3969, 1, 4096, 1024, 1024, 1024, 4096]
    - [26, 11671.0]
  - - [1024, 3999, 1, 4096, 1024, 1024, 1024, 4096]
    - [26, 11773.0]
  - - [1024, 4032, 1, 4096, 1024, 1024, 1024, 4096]
    - [40, 11851.0]
  - - [4096, 3541, 1, 1024, 4096, 4096, 4096, 1024]
    - [1, 12254.0]
  - - [4096, 3334, 1, 1024, 4096, 4096, 4096, 1024]
    - [1, 11845.0]
  - - [1024, 3365, 1, 4096, 1024, 1024, 1024, 4096]
    - [8, 11724.0]
  - - [1024, 3527, 1, 4096, 1024, 1024, 1024, 4096]
    - [26, 10511.0]
  - - [1024, 3190, 1, 4096, 1024, 1024, 1024, 4096]
    - [40, 11414.0]
  - - [4096, 3906, 1, 1024, 4096, 4096, 4096, 1024]
    - [1, 12189.0]
  - - [1024, 3593, 1, 4096, 1024, 1024, 1024, 4096]
    - [8, 11544.0]
  - - [1024, 3336, 1, 4096, 1024, 1024, 1024, 4096]
    - [8, 11641.0]
  - - [4096, 3504, 1, 1024, 4096, 4096, 4096, 1024]
    - [1, 12157.0]
  - - [4096, 3977, 1, 1024, 4096, 4096, 4096, 1024]
    - [1, 11988.0]
  - - [1024, 3906, 1, 4096, 1024, 1024, 1024, 4096]
    - [23, 11542.0]
  - - [4096, 3415, 1, 1024, 4096, 4096, 4096, 1024]
    - [1, 12127.0]
  - - [1024, 3295, 1, 4096, 1024, 1024, 1024, 4096]
    - [7, 11517.0]
  - - [4096, 3321, 1, 1024, 4096, 4096, 4096, 1024]
    - [3, 12285.0]
  - - [1024, 3072, 1, 4096, 1024, 1024, 1024, 4096]
    - [5, 11772.0]
  - - [1024, 3408, 1, 4096, 1024, 1024, 1024, 4096]
    - [23, 11895.0]
  - - [1024, 3522, 1, 4096, 1024, 1024, 1024, 4096]
    - [20, 10552.0]
  - - [4096, 3751, 1, 1024, 4096, 4096, 4096, 1024]
    - [1, 12177.0]
  - - [4096, 3378, 1, 1024, 4096, 4096, 4096, 1024]
    - [1, 12028.0]
  - - [1024, 3925, 1, 33708, 1024, 1024, 1024, 33708]
    - [1, 11607.0]
  - - [1024, 3990, 1, 1024, 1024, 1024, 1024, 1024]
    - [23, 11521.0]
  - - [1024, 3290, 1, 4096, 1024, 1024, 1024, 4096]
    - [7, 11525.0]
  - - [4096, 3500, 1, 1024, 4096, 4096, 4096, 1024]
    - [1, 12112.0]
  - - [4096, 3565, 1, 1024, 4096, 4096, 4096, 1024]
    - [1, 12387.0]
  - - [1024, 3484, 1, 4096, 1024, 1024, 1024, 4096]
    - [22, 11622.0]
  - - [4096, 3395, 1, 1024, 4096, 4096, 4096, 1024]
    - [1, 12068.0]
  - - [1024, 3681, 1, 1024, 1024, 1024, 1024, 1024]
    - [37, 11321.0]
  - - [1024, 3584, 1, 1024, 1024, 1024, 1024, 1024]
    - [22, 11333.0]
  - - [4096, 3093, 1, 1024, 4096, 4096, 4096, 1024]
    - [1, 12083.0]
  - - [1024, 4050, 1, 1024, 1024, 1024, 1024, 1024]
    - [8, 11773.0]
  - - [1024, 3301, 1, 4096, 1024, 1024, 1024, 4096]
    - [8, 11557.0]
  - - [1024, 3581, 1, 4096, 1024, 1024, 1024, 4096]
    - [8, 11513.0]
  - - [4096, 3374, 1, 1024, 4096, 4096, 4096, 1024]
    - [1, 11985.0]
  - - [1024, 3449, 1, 4096, 1024, 1024, 1024, 4096]
    - [23, 11968.0]
  - - [4096, 3215, 1, 1024, 4096, 4096, 4096, 1024]
    - [8, 11928.0]
  - - [4096, 3312, 1, 1024, 4096, 4096, 4096, 1024]
    - [1, 12321.0]
  - - [4096, 3479, 1, 1024, 4096, 4096, 4096, 1024]
    - [1, 12059.0]
  - - [4096, 3544, 1, 1024, 4096, 4096, 4096, 1024]
    - [1, 12294.0]
  - - [1024, 3263, 1, 4096, 1024, 1024, 1024, 4096]
    - [7, 11447.0]
  - - [4096, 3455, 1, 1024, 4096, 4096, 4096, 1024]
    - [1, 12231.0]
  - - [1024, 3379, 1, 4096, 1024, 1024, 1024, 4096]
    - [23, 11746.0]
  - - [1024, 3490, 1, 4096, 1024, 1024, 1024, 4096]
    - [26, 10460.0]
  - - [1024, 3368, 1, 4096, 1024, 1024, 1024, 4096]
    - [26, 10823.0]
  - - [4096, 3186, 1, 1024, 4096, 4096, 4096, 1024]
    - [1, 12354.0]
  - - [1024, 3428, 1, 4096, 1024, 1024, 1024, 4096]
    - [8, 11907.0]
  - - [4096, 3561, 1, 1024, 4096, 4096, 4096, 1024]
    - [1, 12316.0]
  - - [4096, 3418, 1, 1024, 4096, 4096, 4096, 1024]
    - [1, 12190.0]
  - - [1024, 3064, 1, 4096, 1024, 1024, 1024, 4096]
    - [5, 11638.0]
  - - [4096, 3259, 1, 1024, 4096, 4096, 4096, 1024]
    - [1, 12116.0]
  - - [4096, 3308, 1, 1024, 4096, 4096, 4096, 1024]
    - [1, 12296.0]
  - - [1024, 3533, 1, 4096, 1024, 1024, 1024, 4096]
    - [23, 11388.0]
  - - [1024, 3344, 1, 4096, 1024, 1024, 1024, 4096]
    - [8, 11646.0]
  - - [1024, 4030, 1, 1024, 1024, 1024, 1024, 1024]
    - [8, 11594.0]
  - - [4096, 3459, 1, 1024, 4096, 4096, 4096, 1024]
    - [1, 12033.0]
  - - [1024, 3572, 1, 4096, 1024, 1024, 1024, 4096]
    - [8, 11488.0]
  - - [1024, 3925, 1, 1024, 1024, 1024, 1024, 1024]
    - [22, 11432.0]
  - - [4096, 3435, 1, 1024, 4096, 4096, 4096, 1024]
    - [1, 12202.0]
  - - [1024, 3956, 1, 4096, 1024, 1024, 1024, 4096]
    - [23, 11672.0]
  - - [1024, 3463, 1, 4096, 1024, 1024, 1024, 4096]
    - [22, 11582.0]
  - - [4096, 3182, 1, 1024, 4096, 4096, 4096, 1024]
    - [1, 12340.0]
  - - [4096, 3976, 1, 1024, 4096, 4096, 4096, 1024]
    - [1, 11981.0]
  - - [1024, 3417, 1, 4096, 1024, 1024, 1024, 4096]
    - [23, 11904.0]
  - - [1024, 3528, 1, 4096, 1024, 1024, 1024, 4096]
    - [26, 10510.0]
  - - [4096, 3446, 1, 1024, 4096, 4096, 4096, 1024]
    - [8, 12220.0]
  - - [1024, 3543, 1, 4096, 1024, 1024, 1024, 4096]
    - [8, 11409.0]
  - - [4096, 3287, 1, 1024, 4096, 4096, 4096, 1024]
    - [1, 12193.0]
  - - [1024, 3499, 1, 4096, 1024, 1024, 1024, 4096]
    - [22, 11683.0]
  - - [1024, 3231, 1, 4096, 1024, 1024, 1024, 4096]
    - [8, 11332.0]
  - - [4096, 3519, 1, 1024, 4096, 4096, 4096, 1024]
    - [1, 12166.0]
  - - [4096, 3552, 1, 1024, 4096, 4096, 4096, 1024]
    - [1, 12336.0]
  - - [1024, 3458, 1, 4096, 1024, 1024, 1024, 4096]
    - [22, 11525.0]
  - - [1024, 3374, 1, 4096, 1024, 1024, 1024, 4096]
    - [8, 11717.0]
  - - [1024, 3396, 1, 4096, 1024, 1024, 1024, 4096]
    - [26, 10998.0]
  - - [1024, 2967, 1, 4096, 1024, 1024, 1024, 4096]
    - [40, 11013.0]
  - - [4096, 3482, 1, 1024, 4096, 4096, 4096, 1024]
    - [1, 12069.0]
  - - [1024, 3226, 1, 4096, 1024, 1024, 1024, 4096]
    - [8, 11320.0]
  - - [4096, 3377, 1, 1024, 4096, 4096, 4096, 1024]
    - [1, 12027.0]
  - - [4096, 3426, 1, 1024, 4096, 4096, 4096, 1024]
    - [1, 12193.0]
  - - [4096, 2935, 1, 1024, 4096, 4096, 4096, 1024]
    - [1, 12347.0]
  - - [1024, 3439, 1, 4096, 1024, 1024, 1024, 4096]
    - [23, 12011.0]
  - - [4096, 3267, 1, 1024, 4096, 4096, 4096, 1024]
    - [1, 12145.0]
  - - [4096, 3499, 1, 1024, 4096, 4096, 4096, 1024]
    - [1, 12129.0]
  - - [4096, 3356, 1, 1024, 4096, 4096, 4096, 1024]
    - [1, 11935.0]
  - - [4096, 3939, 1, 1024, 4096, 4096, 4096, 1024]
    - [1, 12277.0]
  - - [1024, 3526, 1, 4096, 1024, 1024, 1024, 4096]
    - [8, 11361.0]
  - - [1024, 3859, 1, 33708, 1024, 1024, 1024, 33708]
    - [26, 11465.0]
  - - [1024, 3385, 1, 4096, 1024, 1024, 1024, 4096]
    - [8, 11771.0]
  - - [1024, 3496, 1, 4096, 1024, 1024, 1024, 4096]
    - [26, 10444.0]
  - - [4096, 3141, 1, 1024, 4096, 4096, 4096, 1024]
    - [1, 12202.0]
  - - [4096, 3510, 1, 1024, 4096, 4096, 4096, 1024]
    - [1, 12216.0]
  - - [1024, 3434, 1, 4096, 1024, 1024, 1024, 4096]
    - [23, 11977.0]
  - - [4096, 3969, 1, 1024, 4096, 4096, 4096, 1024]
    - [1, 11940.0]
  - - [1024, 3121, 1, 4096, 1024, 1024, 1024, 4096]
    - [3, 11753.0]
  - - [1024, 3232, 1, 4096, 1024, 1024, 1024, 4096]
    - [40, 10732.0]
  - - [1024, 4030, 1, 33708, 1024, 1024, 1024, 33708]
    - [1, 11898.0]
  - - [1024, 3780, 1, 33708, 1024, 1024, 1024, 33708]
    - [5, 12119.0]
  - - [1024, 3969, 1, 1024, 1024, 1024, 1024, 1024]
    - [23, 11392.0]
  - - [4096, 3527, 1, 1024, 4096, 4096, 4096, 1024]
    - [1, 12273.0]
  - - [4096, 3336, 1, 1024, 4096, 4096, 4096, 1024]
    - [1, 11919.0]
  - - [4096, 3290, 1, 1024, 4096, 4096, 4096, 1024]
    - [1, 12273.0]
  - - [1024, 3469, 1, 4096, 1024, 1024, 1024, 4096]
    - [7, 11546.0]
  - - [4096, 3490, 1, 1024, 4096, 4096, 4096, 1024]
    - [1, 12121.0]
  - - [4096, 3064, 1, 1024, 4096, 4096, 4096, 1024]
    - [1, 12265.0]
  - - [4096, 3582, 1, 1024, 4096, 4096, 4096, 1024]
    - [1, 12398.0]
  - - [1024, 3956, 1, 1024, 1024, 1024, 1024, 1024]
    - [22, 11504.0]
  - - [4096, 3417, 1, 1024, 4096, 4096, 4096, 1024]
    - [1, 12157.0]
  - - [1024, 2736, 1, 4096, 1024, 1024, 1024, 4096]
    - [3, 11460.0]
  - - [1024, 3205, 1, 4096, 1024, 1024, 1024, 4096]
    - [26, 10660.0]
  - - [1024, 3143, 1, 4096, 1024, 1024, 1024, 4096]
    - [20, 11191.0]
  - - [1024, 4020, 1, 4096, 1024, 1024, 1024, 4096]
    - [40, 11824.0]
  - - [1024, 3318, 1, 4096, 1024, 1024, 1024, 4096]
    - [23, 11614.0]
  - - [4096, 3364, 1, 1024, 4096, 4096, 4096, 1024]
    - [1, 11939.0]
  - - [1024, 3353, 1, 4096, 1024, 1024, 1024, 4096]
    - [8, 11670.0]
  - - [1024, 3464, 1, 4096, 1024, 1024, 1024, 4096]
    - [26, 10481.0]
  - - [4096, 3205, 1, 1024, 4096, 4096, 4096, 1024]
    - [1, 11927.0]
  - - [4096, 3318, 1, 1024, 4096, 4096, 4096, 1024]
    - [1, 12328.0]
  - - [1024, 3402, 1, 4096, 1024, 1024, 1024, 4096]
    - [8, 11828.0]
  - - [4096, 3181, 1, 1024, 4096, 4096, 4096, 1024]
    - [1, 12385.0]
  - - [4096, 3550, 1, 1024, 4096, 4096, 4096, 1024]
    - [1, 12326.0]
  - - [4096, 3445, 1, 1024, 4096, 4096, 4096, 1024]
    - [1, 12253.0]
  - - [1024, 3138, 1, 4096, 1024, 1024, 1024, 4096]
    - [3, 11851.0]
  - - [4096, 3079, 1, 1024, 4096, 4096, 4096, 1024]
    - [1, 11996.0]
  - - [4096, 3144, 1, 1024, 4096, 4096, 4096, 1024]
    - [1, 12245.0]
  - - [4096, 3860, 1, 1024, 4096, 4096, 4096, 1024]
    - [1, 12085.0]
  - - [1024, 3515, 1, 4096, 1024, 1024, 1024, 4096]
    - [7, 11679.0]
  - - [4096, 3408, 1, 1024, 4096, 4096, 4096, 1024]
    - [1, 12113.0]
  - - [1024, 3181, 1, 4096, 1024, 1024, 1024, 4096]
    - [3, 12012.0]
  - - [4096, 3298, 1, 1024, 4096, 4096, 4096, 1024]
    - [1, 12247.0]
  - - [4096, 3585, 1, 1024, 4096, 4096, 4096, 1024]
    - [1, 11943.0]
  - - [1024, 3550, 1, 4096, 1024, 1024, 1024, 4096]
    - [8, 11423.0]
  - - [1024, 4020, 1, 1024, 1024, 1024, 1024, 1024]
    - [26, 11558.0]
  - - [4096, 3481, 1, 1024, 4096, 4096, 4096, 1024]
    - [1, 12062.0]
  - - [4096, 3530, 1, 1024, 4096, 4096, 4096, 1024]
    - [1, 12273.0]
  - - [4096, 3425, 1, 1024, 4096, 4096, 4096, 1024]
    - [1, 12191.0]
  - - [4096, 4026, 1, 1024, 4096, 4096, 4096, 1024]
    - [1, 12121.0]
  - - [1024, 3860, 1, 1024, 1024, 1024, 1024, 1024]
    - [36, 11261.0]
  - - [4096, 3975, 1, 1024, 4096, 4096, 4096, 1024]
    - [1, 11952.0]
  - - [1024, 3286, 1, 4096, 1024, 1024, 1024, 4096]
    - [7, 11494.0]
  - - [1024, 3176, 1, 4096, 1024, 1024, 1024, 4096]
    - [40, 11334.0]
  - - [1024, 3894, 1, 4096, 1024, 1024, 1024, 4096]
    - [23, 11533.0]
  - - [4096, 3355, 1, 1024, 4096, 4096, 4096, 1024]
    - [1, 11917.0]
  - - [4096, 3404, 1, 1024, 4096, 4096, 4096, 1024]
    - [1, 12129.0]
  - - [1024, 3501, 1, 4096, 1024, 1024, 1024, 4096]
    - [22, 11653.0]
  - - [4096, 3245, 1, 1024, 4096, 4096, 4096, 1024]
    - [1, 12033.0]
  - - [1024, 3431, 1, 4096, 1024, 1024, 1024, 4096]
    - [23, 11942.0]
  - - [1024, 4000, 1, 1024, 1024, 1024, 1024, 1024]
    - [26, 11333.0]
  - - [4096, 3509, 1, 1024, 4096, 4096, 4096, 1024]
    - [1, 12161.0]
  - - [4096, 3558, 1, 1024, 4096, 4096, 4096, 1024]
    - [1, 12353.0]
  - - [1024, 3535, 1, 4096, 1024, 1024, 1024, 4096]
    - [8, 11381.0]
  - - [1024, 3414, 1, 4096, 1024, 1024, 1024, 4096]
    - [23, 11917.0]
  - - [1024, 3445, 1, 4096, 1024, 1024, 1024, 4096]
    - [26, 10942.0]
  - - [1024, 3436, 1, 4096, 1024, 1024, 1024, 4096]
    - [40, 10980.0]
  - - [4096, 3472, 1, 1024, 4096, 4096, 4096, 1024]
    - [1, 12023.0]
  - - [1024, 3211, 1, 4096, 1024, 1024, 1024, 4096]
    - [8, 11297.0]
  - - [4096, 3383, 1, 1024, 4096, 4096, 4096, 1024]
    - [1, 12019.0]
  - - [4096, 3448, 1, 1024, 4096, 4096, 4096, 1024]
    - [1, 12295.0]
  - - [1024, 3343, 1, 4096, 1024, 1024, 1024, 4096]
    - [23, 11683.0]
  - - [1024, 3518, 1, 4096, 1024, 1024, 1024, 4096]
    - [20, 10537.0]
  - - [4096, 3289, 1, 1024, 4096, 4096, 4096, 1024]
    - [8, 12213.0]
  - - [1024, 3440, 1, 4096, 1024, 1024, 1024, 4096]
    - [8, 11961.0]
  - - [1024, 4032, 1, 33708, 1024, 1024, 1024, 33708]
    - [1, 11905.0]
  - - [4096, 3489, 1, 1024, 4096, 4096, 4096, 1024]
    - [1, 12123.0]
  - - [4096, 3346, 1, 1024, 4096, 4096, 4096, 1024]
    - [1, 11944.0]
  - - [1024, 3534, 1, 4096, 1024, 1024, 1024, 4096]
    - [8, 11384.0]
  - - [1024, 3079, 1, 4096, 1024, 1024, 1024, 4096]
    - [3, 11632.0]
  - - [1024, 3955, 1, 4096, 1024, 1024, 1024, 4096]
    - [37, 11648.0]
  - - [4096, 3236, 1, 1024, 4096, 4096, 4096, 1024]
    - [1, 12010.0]
  - - [1024, 3545, 1, 4096, 1024, 1024, 1024, 4096]
    - [8, 11409.0]
  - - [1024, 3144, 1, 4096, 1024, 1024, 1024, 4096]
    - [3, 11889.0]
  - - [4096, 3780, 1, 1024, 4096, 4096, 4096, 1024]
    - [1, 12275.0]
  - - [4096, 3163, 1, 1024, 4096, 4096, 4096, 1024]
    - [1, 12297.0]
  - - [4096, 3468, 1, 1024, 4096, 4096, 4096, 1024]
    - [1, 12049.0]
  - - [1024, 3539, 1, 4096, 1024, 1024, 1024, 4096]
    - [8, 11406.0]
  - - [1024, 3541, 1, 4096, 1024, 1024, 1024, 4096]
    - [8, 11424.0]
  - - [4096, 3363, 1, 1024, 4096, 4096, 4096, 1024]
    - [1, 11964.0]
  - - [1024, 3475, 1, 4096, 1024, 1024, 1024, 4096]
    - [7, 11582.0]
  - - [4096, 3110, 1, 1024, 4096, 4096, 4096, 1024]
    - [1, 12116.0]
  - - [1024, 3509, 1, 4096, 1024, 1024, 1024, 4096]
    - [22, 11700.0]
  - - [1024, 3413, 1, 4096, 1024, 1024, 1024, 4096]
    - [8, 11906.0]
  - - [1024, 3975, 1, 1024, 1024, 1024, 1024, 1024]
    - [26, 11288.0]
  - - [4096, 3549, 1, 1024, 4096, 4096, 4096, 1024]
    - [1, 12316.0]
  - - [4096, 3342, 1, 1024, 4096, 4096, 4096, 1024]
    - [1, 11911.0]
  - - [1024, 2985, 1, 4096, 1024, 1024, 1024, 4096]
    - [22, 11523.0]
  - - [1024, 3876, 1, 33708, 1024, 1024, 1024, 33708]
    - [8, 11457.0]
  - - [4096, 3280, 1, 1024, 4096, 4096, 4096, 1024]
    - [1, 12190.0]
  - - [4096, 3191, 1, 1024, 4096, 4096, 4096, 1024]
    - [1, 12461.0]
  - - [4096, 3512, 1, 1024, 4096, 4096, 4096, 1024]
    - [1, 12242.0]
  - - [1024, 3560, 1, 4096, 1024, 1024, 1024, 4096]
    - [8, 11468.0]
  - - [4096, 2499, 1, 1024, 4096, 4096, 4096, 1024]
    - [1, 12129.0]
  - - [1024, 3248, 1, 4096, 1024, 1024, 1024, 4096]
    - [8, 11384.0]
  - - [4096, 3423, 1, 1024, 4096, 4096, 4096, 1024]
    - [1, 12176.0]
  - - [4096, 3297, 1, 1024, 4096, 4096, 4096, 1024]
    - [1, 12278.0]
  - - [4096, 3154, 1, 1024, 4096, 4096, 4096, 1024]
    - [1, 12333.0]
  - - [1024, 3303, 1, 4096, 1024, 1024, 1024, 4096]
    - [23, 11577.0]
  - - [1024, 3222, 1, 4096, 1024, 1024, 1024, 4096]
    - [26, 10756.0]
  - - [1024, 3978, 1, 1024, 1024, 1024, 1024, 1024]
    - [3, 11310.0]
  - - [4096, 3529, 1, 1024, 4096, 4096, 4096, 1024]
    - [1, 12202.0]
  - - [4096, 3386, 1, 1024, 4096, 4096, 4096, 1024]
    - [1, 12063.0]
  - - [1024, 3451, 1, 4096, 1024, 1024, 1024, 4096]
    - [23, 12005.0]
  - - [4096, 3562, 1, 1024, 4096, 4096, 4096, 1024]
    - [1, 12336.0]
  - - [4096, 3276, 1, 1024, 4096, 4096, 4096, 1024]
    - [1, 12175.0]
  - - [1024, 3894, 1, 33708, 1024, 1024, 1024, 33708]
    - [1, 11513.0]
  - - [4096, 3540, 1, 1024, 4096, 4096, 4096, 1024]
    - [1, 12282.0]
  - - [1024, 3416, 1, 4096, 1024, 1024, 1024, 4096]
    - [23, 11911.0]
  - - [1024, 4005, 1, 33708, 1024, 1024, 1024, 33708]
    - [1, 11831.0]
  - - [1024, 3942, 1, 4096, 1024, 1024, 1024, 4096]
    - [23, 11613.0]
  - - [4096, 3403, 1, 1024, 4096, 4096, 4096, 1024]
    - [1, 12070.0]
  - - [4096, 3381, 1, 1024, 4096, 4096, 4096, 1024]
    - [1, 12046.0]
  - - [1024, 3492, 1, 4096, 1024, 1024, 1024, 4096]
    - [22, 11644.0]
  - - [4096, 3101, 1, 1024, 4096, 4096, 4096, 1024]
    - [1, 12073.0]
  - - [1024, 3430, 1, 4096, 1024, 1024, 1024, 4096]
    - [8, 11921.0]
  - - [1024, 3977, 1, 4096, 1024, 1024, 1024, 4096]
    - [26, 11695.0]
  - - [1024, 3640, 1, 4096, 1024, 1024, 1024, 4096]
    - [28, 11625.0]
  - - [4096, 3557, 1, 1024, 4096, 4096, 4096, 1024]
    - [1, 12291.0]
  - - [4096, 3414, 1, 1024, 4096, 4096, 4096, 1024]
    - [1, 12162.0]
  - - [1024, 3391, 1, 4096, 1024, 1024, 1024, 4096]
    - [8, 11793.0]
  - - [1024, 3356, 1, 4096, 1024, 1024, 1024, 4096]
    - [26, 10859.0]
  - - [4096, 3320, 1, 1024, 4096, 4096, 4096, 1024]
    - [1, 12318.0]
  - - [4096, 2765, 1, 1024, 4096, 4096, 4096, 1024]
    - [1, 11993.0]
  - - [1024, 3411, 1, 4096, 1024, 1024, 1024, 4096]
    - [23, 11855.0]
  - - [1024, 3978, 1, 4096, 1024, 1024, 1024, 4096]
    - [23, 11829.0]
  - - [4096, 3487, 1, 1024, 4096, 4096, 4096, 1024]
    - [8, 12058.0]
  - - [4096, 3520, 1, 1024, 4096, 4096, 4096, 1024]
    - [1, 12233.0]
  - - [4096, 3942, 1, 1024, 4096, 4096, 4096, 1024]
    - [1, 12294.0]
  - - [4096, 3431, 1, 1024, 4096, 4096, 4096, 1024]
    - [1, 12173.0]
  - - [1024, 3271, 1, 4096, 1024, 1024, 1024, 4096]
    - [8, 11466.0]
  - - [4096, 4020, 1, 1024, 4096, 4096, 4096, 1024]
    - [1, 12089.0]
  - - [1024, 3481, 1, 4096, 1024, 1024, 1024, 4096]
    - [22, 11571.0]
  - - [1024, 3419, 1, 4096, 1024, 1024, 1024, 4096]
    - [23, 11926.0]
  - - [1024, 4059, 1, 4096, 1024, 1024, 1024, 4096]
    - [40, 11929.0]
  - - [4096, 3345, 1, 1024, 4096, 4096, 4096, 1024]
    - [1, 11889.0]
  - - [4096, 3394, 1, 1024, 4096, 4096, 4096, 1024]
    - [1, 12086.0]
  - - [1024, 3298, 1, 4096, 1024, 1024, 1024, 4096]
    - [7, 11502.0]
  - - [4096, 3235, 1, 1024, 4096, 4096, 4096, 1024]
    - [1, 12031.0]
  - - [1024, 3681, 1, 33708, 1024, 1024, 1024, 33708]
    - [5, 11802.0]
  - - [1024, 3362, 1, 4096, 1024, 1024, 1024, 4096]
    - [23, 11706.0]
  - - [4096, 3467, 1, 1024, 4096, 4096, 4096, 1024]
    - [1, 11983.0]
  - - [1024, 3349, 1, 4096, 1024, 1024, 1024, 4096]
    - [8, 11667.0]
  - - [1024, 3460, 1, 4096, 1024, 1024, 1024, 4096]
    - [26, 10394.0]
  - - [4096, 3214, 1, 1024, 4096, 4096, 4096, 1024]
    - [1, 11979.0]
  - - [1024, 3398, 1, 4096, 1024, 1024, 1024, 4096]
    - [23, 11868.0]
  - - [4096, 3478, 1, 1024, 4096, 4096, 4096, 1024]
    - [1, 12042.0]
  - - [1024, 4050, 1, 33708, 1024, 1024, 1024, 33708]
    - [1, 11943.0]
  - - [1024, 3244, 1, 4096, 1024, 1024, 1024, 4096]
    - [7, 11363.0]
  - - [4096, 3341, 1, 1024, 4096, 4096, 4096, 1024]
    - [1, 11836.0]
  - - [4096, 3454, 1, 1024, 4096, 4096, 4096, 1024]
    - [1, 12229.0]
  - - [1024, 3166, 1, 4096, 1024, 1024, 1024, 4096]
    - [3, 11946.0]
  - - [1024, 3425, 1, 4096, 1024, 1024, 1024, 4096]
    - [26, 11020.0]
  - - [4096, 3295, 1, 1024, 4096, 4096, 4096, 1024]
    - [1, 12186.0]
  - - [4096, 3072, 1, 1024, 4096, 4096, 4096, 1024]
    - [1, 12334.0]
  - - [4096, 3822, 1, 1024, 4096, 4096, 4096, 1024]
    - [1, 12360.0]
  - - [1024, 3681, 1, 4096, 1024, 1024, 1024, 4096]
    - [28, 11743.0]
  - - [1024, 4050, 1, 4096, 1024, 1024, 1024, 4096]
    - [40, 11902.0]
  - - [4096, 3495, 1, 1024, 4096, 4096, 4096, 1024]
    - [1, 12110.0]
  - - [4096, 3560, 1, 1024, 4096, 4096, 4096, 1024]
    - [1, 12299.0]
  - - [1024, 3524, 1, 4096, 1024, 1024, 1024, 4096]
    - [8, 11372.0]
  - - [1024, 3942, 1, 33708, 1024, 1024, 1024, 33708]
    - [40, 11707.0]
  - - [1024, 3304, 1, 4096, 1024, 1024, 1024, 4096]
    - [8, 11507.0]
  - - [1024, 3387, 1, 4096, 1024, 1024, 1024, 4096]
    - [26, 10943.0]
  - - [1024, 3498, 1, 4096, 1024, 1024, 1024, 4096]
    - [11, 10515.0]
  - - [4096, 3458, 1, 1024, 4096, 4096, 4096, 1024]
    - [1, 11988.0]
  - - [4096, 2967, 1, 1024, 4096, 4096, 4096, 1024]
    - [1, 11919.0]
  - - [4096, 3385, 1, 1024, 4096, 4096, 4096, 1024]
    - [1, 12048.0]
  - - [4096, 3434, 1, 1024, 4096, 4096, 4096, 1024]
    - [1, 12235.0]
  - - [1024, 3519, 1, 4096, 1024, 1024, 1024, 4096]
    - [22, 11702.0]
  - - [1024, 3511, 1, 4096, 1024, 1024, 1024, 4096]
    - [22, 11735.0]
  - - [1024, 3288, 1, 4096, 1024, 1024, 1024, 4096]
    - [8, 11520.0]
  - - [1024, 2918, 1, 4096, 1024, 1024, 1024, 4096]
    - [28, 10947.0]
  - - [4096, 3573, 1, 1024, 4096, 4096, 4096, 1024]
    - [1, 12357.0]
  - - [1024, 3822, 1, 33708, 1024, 1024, 1024, 33708]
    - [5, 12248.0]
  - - [4096, 3539, 1, 1024, 4096, 4096, 4096, 1024]
    - [1, 12308.0]
  - - [4096, 3332, 1, 1024, 4096, 4096, 4096, 1024]
    - [1, 11890.0]
  - - [4096, 3286, 1, 1024, 4096, 4096, 4096, 1024]
    - [1, 12260.0]
  - - [1024, 4026, 1, 4096, 1024, 1024, 1024, 4096]
    - [26, 11842.0]
  - - [1024, 3277, 1, 4096, 1024, 1024, 1024, 4096]
    - [3, 11338.0]
  - - [1024, 3471, 1, 4096, 1024, 1024, 1024, 4096]
    - [11, 10404.0]
  - - [4096, 3518, 1, 1024, 4096, 4096, 4096, 1024]
    - [1, 12188.0]
  - - [1024, 3393, 1, 4096, 1024, 1024, 1024, 4096]
    - [8, 11821.0]
  - - [4096, 3413, 1, 1024, 4096, 4096, 4096, 1024]
    - [1, 12132.0]
  - - [4096, 3303, 1, 1024, 4096, 4096, 4096, 1024]
    - [1, 12266.0]
  - - [1024, 3207, 1, 4096, 1024, 1024, 1024, 4096]
    - [7, 11259.0]
  - - [1024, 3894, 1, 1024, 1024, 1024, 1024, 1024]
    - [36, 11205.0]
  - - [1024, 3977, 1, 1024, 1024, 1024, 1024, 1024]
    - [3, 11251.0]
  - - [4096, 3535, 1, 1024, 4096, 4096, 4096, 1024]
    - [1, 12246.0]
  - - [4096, 3376, 1, 1024, 4096, 4096, 4096, 1024]
    - [1, 12012.0]
  - - [1024, 3355, 1, 4096, 1024, 1024, 1024, 4096]
    - [8, 11691.0]
  - - [1024, 3466, 1, 4096, 1024, 1024, 1024, 4096]
    - [26, 10478.0]
  - - [4096, 3266, 1, 1024, 4096, 4096, 4096, 1024]
    - [8, 12102.0]
  - - [1024, 3404, 1, 4096, 1024, 1024, 1024, 4096]
    - [23, 11857.0]
  - - [1024, 3999, 1, 1024, 1024, 1024, 1024, 1024]
    - [26, 11277.0]
  - - [4096, 3498, 1, 1024, 4096, 4096, 4096, 1024]
    - [1, 12124.0]
  - - [1024, 4032, 1, 1024, 1024, 1024, 1024, 1024]
    - [8, 11556.0]
  - - [1024, 3410, 1, 4096, 1024, 1024, 1024, 4096]
    - [23, 11931.0]
  - - [4096, 3393, 1, 1024, 4096, 4096, 4096, 1024]
    - [1, 12088.0]
  - - [1024, 3140, 1, 4096, 1024, 1024, 1024, 4096]
    - [3, 11802.0]
  - - [1024, 3910, 1, 33708, 1024, 1024, 1024, 33708]
    - [17, 11551.0]
  - - [1024, 3334, 1, 4096, 1024, 1024, 1024, 4096]
    - [8, 11627.0]
  - - [4096, 3140, 1, 1024, 4096, 4096, 4096, 1024]
    - [1, 12202.0]
  - - [1024, 4005, 1, 4096, 1024, 1024, 1024, 4096]
    - [26, 11780.0]
  - - [1024, 3579, 1, 4096, 1024, 1024, 1024, 4096]
    - [8, 11515.0]
  - - [4096, 3372, 1, 1024, 4096, 4096, 4096, 1024]
    - [8, 11973.0]
  - - [1024, 3245, 1, 4096, 1024, 1024, 1024, 4096]
    - [8, 11353.0]
  - - [4096, 3956, 1, 1024, 4096, 4096, 4096, 1024]
    - [1, 12432.0]
  - - [4096, 3213, 1, 1024, 4096, 4096, 4096, 1024]
    - [1, 12041.0]
  - - [1024, 3361, 1, 4096, 1024, 1024, 1024, 4096]
    - [8, 11704.0]
  - - [1024, 3536, 1, 4096, 1024, 1024, 1024, 4096]
    - [26, 10444.0]
  - - [4096, 3477, 1, 1024, 4096, 4096, 4096, 1024]
    - [1, 12015.0]
  - - [4096, 3526, 1, 1024, 4096, 4096, 4096, 1024]
    - [1, 12221.0]
  - - [1024, 4005, 1, 1024, 1024, 1024, 1024, 1024]
    - [8, 11504.0]
  - - [1024, 3530, 1, 4096, 1024, 1024, 1024, 4096]
    - [23, 11388.0]
  - - [1024, 3944, 1, 4096, 1024, 1024, 1024, 4096]
    - [23, 11654.0]
  - - [4096, 3453, 1, 1024, 4096, 4096, 4096, 1024]
    - [1, 12271.0]
  - - [4096, 3184, 1, 1024, 4096, 4096, 4096, 1024]
    - [1, 12430.0]
  - - [4096, 3579, 1, 1024, 4096, 4096, 4096, 1024]
    - [1, 12443.0]
  - - [4096, 3351, 1, 1024, 4096, 4096, 4096, 1024]
    - [1, 11975.0]
  - - [4096, 3416, 1, 1024, 4096, 4096, 4096, 1024]
    - [1, 12181.0]
  - - [1024, 3822, 1, 4096, 1024, 1024, 1024, 4096]
    - [28, 12183.0]
  - - [1024, 3796, 1, 4096, 1024, 1024, 1024, 4096]
    - [41, 12124.0]
  - - [4096, 3257, 1, 1024, 4096, 4096, 4096, 1024]
    - [1, 12096.0]
  - - [4096, 3306, 1, 1024, 4096, 4096, 4096, 1024]
    - [1, 12318.0]
  - - [1024, 3505, 1, 4096, 1024, 1024, 1024, 4096]
    - [22, 11685.0]
  - - [1024, 3315, 1, 4096, 1024, 1024, 1024, 4096]
    - [8, 11543.0]
  - - [1024, 3486, 1, 4096, 1024, 1024, 1024, 4096]
    - [20, 10437.0]
  - - [4096, 3457, 1, 1024, 4096, 4096, 4096, 1024]
    - [1, 11994.0]
  - - [4096, 3870, 1, 1024, 4096, 4096, 4096, 1024]
    - [1, 12117.0]
  - - [1024, 3447, 1, 4096, 1024, 1024, 1024, 4096]
    - [23, 12005.0]
  - - [1024, 3558, 1, 4096, 1024, 1024, 1024, 4096]
    - [8, 11449.0]
  - - [4096, 3433, 1, 1024, 4096, 4096, 4096, 1024]
    - [8, 12172.0]
  - - [4096, 3180, 1, 1024, 4096, 4096, 4096, 1024]
    - [1, 12398.0]
  - - [1024, 3213, 1, 4096, 1024, 1024, 1024, 4096]
    - [3, 11135.0]
  - - [1024, 3900, 1, 4096, 1024, 1024, 1024, 4096]
    - [23, 11545.0]
  - - [4096, 3444, 1, 1024, 4096, 4096, 4096, 1024]
    - [3, 12188.0]
  - - [1024, 3504, 1, 4096, 1024, 1024, 1024, 4096]
    - [22, 11654.0]
  - - [4096, 4059, 1, 1024, 4096, 4096, 4096, 1024]
    - [1, 12181.0]
  - - [1024, 3442, 1, 4096, 1024, 1024, 1024, 4096]
    - [23, 12025.0]
  - - [4096, 3517, 1, 1024, 4096, 4096, 4096, 1024]
    - [1, 12204.0]
  - - [1024, 3566, 1, 4096, 1024, 1024, 1024, 4096]
    - [8, 11506.0]
  - - [4096, 3248, 1, 1024, 4096, 4096, 4096, 1024]
    - [1, 12082.0]
  - - [1024, 3547, 1, 4096, 1024, 1024, 1024, 4096]
    - [8, 11420.0]
  - - [1024, 3340, 1, 4096, 1024, 1024, 1024, 4096]
    - [23, 11658.0]
  - - [4096, 3480, 1, 1024, 4096, 4096, 4096, 1024]
    - [1, 12077.0]
  - - [4096, 3424, 1, 1024, 4096, 4096, 4096, 1024]
    - [1, 12199.0]
  - - [1024, 3906, 1, 1024, 1024, 1024, 1024, 1024]
    - [7, 11383.0]
  - - [4096, 3265, 1, 1024, 4096, 4096, 4096, 1024]
    - [1, 12161.0]
  - - [1024, 3384, 1, 4096, 1024, 1024, 1024, 4096]
    - [23, 11789.0]
  - - [1024, 3494, 1, 4096, 1024, 1024, 1024, 4096]
    - [11, 10499.0]
  - - [1024, 3236, 1, 4096, 1024, 1024, 1024, 4096]
    - [26, 10726.0]
  - - [4096, 3497, 1, 1024, 4096, 4096, 4096, 1024]
    - [8, 12098.0]
  - - [4096, 3354, 1, 1024, 4096, 4096, 4096, 1024]
    - [1, 11942.0]
  - - [4096, 3055, 1, 1024, 4096, 4096, 4096, 1024]
    - [1, 12231.0]
  - - [4096, 3244, 1, 1024, 4096, 4096, 4096, 1024]
    - [1, 12097.0]
  - - [4096, 3139, 1, 1024, 4096, 4096, 4096, 1024]
    - [1, 12258.0]
  - - [4096, 3508, 1, 1024, 4096, 4096, 4096, 1024]
    - [1, 12185.0]
  - - [4096, 4050, 1, 1024, 4096, 4096, 4096, 1024]
    - [1, 12186.0]
  - - [1024, 3472, 1, 4096, 1024, 1024, 1024, 4096]
    - [22, 11589.0]
  - - [1024, 3861, 1, 1024, 1024, 1024, 1024, 1024]
    - [22, 11008.0]
  - - [1024, 3910, 1, 1024, 1024, 1024, 1024, 1024]
    - [22, 11136.0]
  - - [4096, 3371, 1, 1024, 4096, 4096, 4096, 1024]
    - [1, 11956.0]
  - - [1024, 3751, 1, 4096, 1024, 1024, 1024, 4096]
    - [28, 11960.0]
  - - [4096, 3325, 1, 1024, 4096, 4096, 4096, 1024]
    - [3, 12296.0]
  - - [1024, 3321, 1, 4096, 1024, 1024, 1024, 4096]
    - [8, 11566.0]
  - - [1024, 3944, 1, 1024, 1024, 1024, 1024, 1024]
    - [7, 11488.0]
  - - [4096, 3525, 1, 1024, 4096, 4096, 4096, 1024]
    - [1, 12234.0]
  - - [4096, 3382, 1, 1024, 4096, 4096, 4096, 1024]
    - [1, 12031.0]
  - - [1024, 3453, 1, 4096, 1024, 1024, 1024, 4096]
    - [23, 12018.0]
  - - [4096, 3564, 1, 1024, 4096, 4096, 4096, 1024]
    - [1, 12372.0]
  - - [4096, 3288, 1, 1024, 4096, 4096, 4096, 1024]
    - [1, 12281.0]
  - - [1024, 3925, 1, 4096, 1024, 1024, 1024, 4096]
    - [23, 11615.0]
  - - [1024, 3057, 1, 4096, 1024, 1024, 1024, 4096]
    - [8, 11619.0]
  - - [4096, 3488, 1, 1024, 4096, 4096, 4096, 1024]
    - [1, 12073.0]
  - - [4096, 3046, 1, 1024, 4096, 4096, 4096, 1024]
    - [1, 12196.0]
  - - [1024, 3189, 1, 4096, 1024, 1024, 1024, 4096]
    - [8, 12094.0]
  - - [4096, 3399, 1, 1024, 4096, 4096, 4096, 1024]
    - [1, 12082.0]
  - - [1024, 3383, 1, 4096, 1024, 1024, 1024, 4096]
    - [8, 11779.0]
  - - [1024, 3415, 1, 4096, 1024, 1024, 1024, 4096]
    - [26, 11012.0]
  - - [1024, 3388, 1, 4096, 1024, 1024, 1024, 4096]
    - [26, 11002.0]
  - - [1024, 3376, 1, 4096, 1024, 1024, 1024, 4096]
    - [26, 10917.0]
  - - [1024, 3473, 1, 4096, 1024, 1024, 1024, 4096]
    - [26, 10399.0]
  - - [4096, 3162, 1, 1024, 4096, 4096, 4096, 1024]
    - [1, 12255.0]
  - - [1024, 3448, 1, 4096, 1024, 1024, 1024, 4096]
    - [23, 12000.0]
  - - [4096, 3362, 1, 1024, 4096, 4096, 4096, 1024]
    - [1, 11951.0]
  - - [1024, 3262, 1, 4096, 1024, 1024, 1024, 4096]
    - [7, 11349.0]
  - - [1024, 3184, 1, 4096, 1024, 1024, 1024, 4096]
    - [26, 11229.0]
  - - [1024, 3378, 1, 4096, 1024, 1024, 1024, 4096]
    - [26, 10962.0]
  - - [4096, 3548, 1, 1024, 4096, 4096, 4096, 1024]
    - [1, 12277.0]
  - - [4096, 2977, 1, 1024, 4096, 4096, 4096, 1024]
    - [1, 11942.0]
  - - [4096, 3443, 1, 1024, 4096, 4096, 4096, 1024]
    - [1, 12232.0]
  - - [1024, 3289, 1, 4096, 1024, 1024, 1024, 4096]
    - [23, 11536.0]
  - - [1024, 3483, 1, 4096, 1024, 1024, 1024, 4096]
    - [26, 10390.0]
  - - [4096, 3190, 1, 1024, 4096, 4096, 4096, 1024]
    - [1, 12397.0]
  - - [1024, 3421, 1, 4096, 1024, 1024, 1024, 4096]
    - [23, 11940.0]
  - - [1024, 3514, 1, 4096, 1024, 1024, 1024, 4096]
    - [7, 11641.0]
  - - [1024, 3532, 1, 4096, 1024, 1024, 1024, 4096]
    - [8, 11407.0]
  - - [1024, 3565, 1, 4096, 1024, 1024, 1024, 4096]
    - [23, 11499.0]
  - - [4096, 3422, 1, 1024, 4096, 4096, 4096, 1024]
    - [8, 12124.0]
  - - [4096, 3263, 1, 1024, 4096, 4096, 4096, 1024]
    - [1, 12136.0]
  - - [4096, 3296, 1, 1024, 4096, 4096, 4096, 1024]
    - [1, 12277.0]
  - - [4096, 3640, 1, 1024, 4096, 4096, 4096, 1024]
    - [1, 12130.0]
  - - [4096, 3463, 1, 1024, 4096, 4096, 4096, 1024]
    - [1, 12037.0]
  - - [4096, 3528, 1, 1024, 4096, 4096, 4096, 1024]
    - [1, 12216.0]
  - - [1024, 3351, 1, 4096, 1024, 1024, 1024, 4096]
    - [23, 11670.0]
  - - [1024, 3462, 1, 4096, 1024, 1024, 1024, 4096]
    - [26, 10413.0]
  - - [4096, 3226, 1, 1024, 4096, 4096, 4096, 1024]
    - [1, 11997.0]
  - - [4096, 3439, 1, 1024, 4096, 4096, 4096, 1024]
    - [1, 12240.0]
  - - [4096, 3121, 1, 1024, 4096, 4096, 4096, 1024]
    - [1, 12175.0]
  - - [1024, 4059, 1, 33708, 1024, 1024, 1024, 33708]
    - [1, 11980.0]
  - - [1024, 3311, 1, 4096, 1024, 1024, 1024, 4096]
    - [8, 11556.0]
  - - [1024, 3230, 1, 4096, 1024, 1024, 1024, 4096]
    - [20, 10725.0]
  - - [4096, 3353, 1, 1024, 4096, 4096, 4096, 1024]
    - [1, 11901.0]
  - - [4096, 3402, 1, 1024, 4096, 4096, 4096, 1024]
    - [1, 12122.0]
  - - [1024, 3427, 1, 4096, 1024, 1024, 1024, 4096]
    - [23, 11945.0]
  - - [1024, 3346, 1, 4096, 1024, 1024, 1024, 4096]
    - [23, 11701.0]
  - - [1024, 3126, 1, 4096, 1024, 1024, 1024, 4096]
    - [40, 11164.0]
  - - [1024, 3796, 1, 1024, 1024, 1024, 1024, 1024]
    - [11, 11525.0]
  - - [1024, 3990, 1, 4096, 1024, 1024, 1024, 4096]
    - [40, 11723.0]
  - - [1024, 3257, 1, 4096, 1024, 1024, 1024, 4096]
    - [8, 11415.0]
  - - [4096, 3996, 1, 1024, 4096, 4096, 4096, 1024]
    - [3, 11973.0]
  - - [1024, 3306, 1, 4096, 1024, 1024, 1024, 4096]
    - [23, 11581.0]
  - - [1024, 3389, 1, 4096, 1024, 1024, 1024, 4096]
    - [8, 11791.0]
  - - [1024, 3500, 1, 4096, 1024, 1024, 1024, 4096]
    - [7, 11631.0]
  - - [1024, 3999, 1, 33708, 1024, 1024, 1024, 33708]
    - [1, 11820.0]
  - - [4096, 3486, 1, 1024, 4096, 4096, 4096, 1024]
    - [1, 12151.0]
  - - [1024, 3438, 1, 4096, 1024, 1024, 1024, 4096]
    - [23, 12003.0]
  - - [4096, 3616, 1, 1024, 4096, 4096, 4096, 1024]
    - [1, 12069.0]
  - - [1024, 3955, 1, 1024, 1024, 1024, 1024, 1024]
    - [22, 11528.0]
  - - [4096, 3430, 1, 1024, 4096, 4096, 4096, 1024]
    - [1, 12226.0]
  - - [4096, 3271, 1, 1024, 4096, 4096, 4096, 1024]
    - [1, 12208.0]
  - - [1024, 3364, 1, 4096, 1024, 1024, 1024, 4096]
    - [23, 11731.0]
  - - [1024, 3497, 1, 4096, 1024, 1024, 1024, 4096]
    - [26, 10492.0]
  - - [4096, 3503, 1, 1024, 4096, 4096, 4096, 1024]
    - [1, 12144.0]
  - - [4096, 3344, 1, 1024, 4096, 4096, 4096, 1024]
    - [1, 11930.0]
  - - [1024, 3457, 1, 4096, 1024, 1024, 1024, 4096]
    - [22, 11538.0]
  - - [4096, 3466, 1, 1024, 4096, 4096, 4096, 1024]
    - [1, 12043.0]
  - - [1024, 3976, 1, 33708, 1024, 1024, 1024, 33708]
    - [17, 11748.0]
  - - [1024, 3395, 1, 4096, 1024, 1024, 1024, 4096]
    - [8, 11822.0]
  - - [4096, 3361, 1, 1024, 4096, 4096, 4096, 1024]
    - [1, 11930.0]
  - - [1024, 3751, 1, 33708, 1024, 1024, 1024, 33708]
    - [5, 12029.0]
  - - [1024, 3822, 1, 1024, 1024, 1024, 1024, 1024]
    - [8, 11739.0]
  - - [4096, 3315, 1, 1024, 4096, 4096, 4096, 1024]
    - [1, 12368.0]
  - - [1024, 3163, 1, 4096, 1024, 1024, 1024, 4096]
    - [8, 12007.0]
  - - [4096, 3547, 1, 1024, 4096, 4096, 4096, 1024]
    - [1, 12292.0]
  - - [4096, 3340, 1, 1024, 4096, 4096, 4096, 1024]
    - [1, 11916.0]
  - - [1024, 3296, 1, 4096, 1024, 1024, 1024, 4096]
    - [23, 11556.0]
  - - [1024, 3468, 1, 4096, 1024, 1024, 1024, 4096]
    - [25, 11205.0]
  - - [4096, 3294, 1, 1024, 4096, 4096, 4096, 1024]
    - [1, 12247.0]
  - - [1024, 3406, 1, 4096, 1024, 1024, 1024, 4096]
    - [8, 11886.0]
  - - [1024, 3860, 1, 33708, 1024, 1024, 1024, 33708]
    - [31, 11419.0]
  - - [1024, 3584, 1, 4096, 1024, 1024, 1024, 4096]
    - [23, 11544.0]
  - - [4096, 3189, 1, 1024, 4096, 4096, 4096, 1024]
    - [1, 12380.0]
  - - [4096, 3494, 1, 1024, 4096, 4096, 4096, 1024]
    - [1, 12151.0]
  - - [1024, 3093, 1, 4096, 1024, 1024, 1024, 4096]
    - [8, 11717.0]
  - - [4096, 3421, 1, 1024, 4096, 4096, 4096, 1024]
    - [1, 12166.0]
  - - [1024, 3479, 1, 4096, 1024, 1024, 1024, 4096]
    - [22, 11631.0]
  - - [1024, 3433, 1, 4096, 1024, 1024, 1024, 4096]
    - [23, 11992.0]
  - - [4096, 3311, 1, 1024, 4096, 4096, 4096, 1024]
    - [1, 12279.0]
  - - [1024, 3381, 1, 4096, 1024, 1024, 1024, 4096]
    - [8, 11791.0]
  - - [1024, 3996, 1, 4096, 1024, 1024, 1024, 4096]
    - [26, 11750.0]
  - - [4096, 3384, 1, 1024, 4096, 4096, 4096, 1024]
    - [1, 12025.0]
  - - [1024, 3247, 1, 4096, 1024, 1024, 1024, 4096]
    - [7, 11400.0]
  - - [1024, 3169, 1, 4096, 1024, 1024, 1024, 4096]
    - [40, 11358.0]
  - - [1024, 3088, 1, 4096, 1024, 1024, 1024, 4096]
    - [26, 10954.0]
  - - [1024, 3363, 1, 4096, 1024, 1024, 1024, 4096]
    - [26, 10931.0]
  - - [1024, 3538, 1, 4096, 1024, 1024, 1024, 4096]
    - [26, 10506.0]
  - - [1024, 3996, 1, 1024, 1024, 1024, 1024, 1024]
    - [8, 11476.0]
  - - [4096, 3169, 1, 1024, 4096, 4096, 4096, 1024]
    - [1, 12315.0]
  - - [4096, 3538, 1, 1024, 4096, 4096, 4096, 1024]
    - [1, 12299.0]
  - - [4096, 3401, 1, 1024, 4096, 4096, 4096, 1024]
    - [1, 12099.0]
  - - [4096, 3581, 1, 1024, 4096, 4096, 4096, 1024]
    - [1, 12436.0]
  - - [1024, 3180, 1, 4096, 1024, 1024, 1024, 4096]
    - [8, 12032.0]
  - - [1024, 3870, 1, 1024, 1024, 1024, 1024, 1024]
    - [7, 11088.0]
  - - [4096, 3555, 1, 1024, 4096, 4096, 4096, 1024]
    - [3, 12277.0]
  - - [4096, 3412, 1, 1024, 4096, 4096, 4096, 1024]
    - [1, 12154.0]
  - - [4096, 3302, 1, 1024, 4096, 4096, 4096, 1024]
    - [1, 12268.0]
  - - [1024, 3561, 1, 4096, 1024, 1024, 1024, 4096]
    - [8, 11455.0]
  - - [1024, 3302, 1, 4096, 1024, 1024, 1024, 4096]
    - [7, 11550.0]
  - - [1024, 3976, 1, 4096, 1024, 1024, 1024, 4096]
    - [40, 11715.0]
  - - [4096, 3485, 1, 1024, 4096, 4096, 4096, 1024]
    - [3, 12046.0]
  - - [4096, 3534, 1, 1024, 4096, 4096, 4096, 1024]
    - [1, 12282.0]
  - - [1024, 3110, 1, 4096, 1024, 1024, 1024, 4096]
    - [3, 11761.0]
  - - [1024, 3401, 1, 4096, 1024, 1024, 1024, 4096]
    - [26, 11071.0]
  - - [4096, 3216, 1, 1024, 4096, 4096, 4096, 1024]
    - [1, 11957.0]
  - - [1024, 4020, 1, 33708, 1024, 1024, 1024, 33708]
    - [17, 11865.0]
  - - [1024, 3215, 1, 4096, 1024, 1024, 1024, 4096]
    - [8, 11266.0]
  - - [4096, 3566, 1, 1024, 4096, 4096, 4096, 1024]
    - [1, 12320.0]
  - - [1024, 3137, 1, 4096, 1024, 1024, 1024, 4096]
    - [8, 11879.0]
  - - [4096, 3359, 1, 1024, 4096, 4096, 4096, 1024]
    - [1, 11907.0]
  - - [4096, 3392, 1, 1024, 4096, 4096, 4096, 1024]
    - [1, 12051.0]
  - - [1024, 3506, 1, 4096, 1024, 1024, 1024, 4096]
    - [22, 11691.0]
  - - [4096, 3233, 1, 1024, 4096, 4096, 4096, 1024]
    - [1, 12001.0]
  - - [1024, 3444, 1, 4096, 1024, 1024, 1024, 4096]
    - [23, 11998.0]
  - - [1024, 3975, 1, 4096, 1024, 1024, 1024, 4096]
    - [40, 11690.0]
  - - [1024, 3870, 1, 33708, 1024, 1024, 1024, 33708]
    - [1, 11441.0]
  - - [4096, 3465, 1, 1024, 4096, 4096, 4096, 1024]
    - [1, 12064.0]
  - - [1024, 3523, 1, 4096, 1024, 1024, 1024, 4096]
    - [8, 11337.0]
  - - [4096, 3990, 1, 1024, 4096, 4096, 4096, 1024]
    - [1, 12012.0]
  - - [1024, 3549, 1, 4096, 1024, 1024, 1024, 4096]
    - [8, 11436.0]
  - - [1024, 3342, 1, 4096, 1024, 1024, 1024, 4096]
    - [23, 11687.0]
  - - [4096, 3476, 1, 1024, 4096, 4096, 4096, 1024]
    - [1, 12033.0]
  - - [1024, 3418, 1, 4096, 1024, 1024, 1024, 4096]
    - [23, 11917.0]
  - - [1024, 3859, 1, 1024, 1024, 1024, 1024, 1024]
    - [22, 11025.0]
  - - [4096, 3339, 1, 1024, 4096, 4096, 4096, 1024]
    - [1, 11870.0]
  - - [4096, 3452, 1, 1024, 4096, 4096, 4096, 1024]
    - [1, 12230.0]
  - - [4096, 3293, 1, 1024, 4096, 4096, 4096, 1024]
    - [1, 12261.0]
  - - [1024, 3369, 1, 4096, 1024, 1024, 1024, 4096]
    - [23, 11741.0]
  - - [1024, 3544, 1, 4096, 1024, 1024, 1024, 4096]
    - [3, 10447.0]
  - - [4096, 3493, 1, 1024, 4096, 4096, 4096, 1024]
    - [1, 12117.0]
  - - [4096, 3350, 1, 1024, 4096, 4096, 4096, 1024]
    - [1, 11929.0]
  - - [4096, 3256, 1, 1024, 4096, 4096, 4096, 1024]
    - [1, 12131.0]
  - - [1024, 3870, 1, 4096, 1024, 1024, 1024, 4096]
    - [8, 11465.0]
  - - [4096, 4012, 1, 1024, 4096, 4096, 4096, 1024]
    - [1, 12060.0]
  - - [1024, 3280, 1, 4096, 1024, 1024, 1024, 4096]
    - [7, 11466.0]
  - - [4096, 3456, 1, 1024, 4096, 4096, 4096, 1024]
    - [1, 12312.0]
  - - [1024, 3555, 1, 4096, 1024, 1024, 1024, 4096]
    - [8, 11452.0]
  - - [4096, 3014, 1, 1024, 4096, 4096, 4096, 1024]
    - [1, 12057.0]
  - - [1024, 3474, 1, 4096, 1024, 1024, 1024, 4096]
    - [22, 11613.0]
  - - [4096, 3367, 1, 1024, 4096, 4096, 4096, 1024]
    - [1, 11983.0]
  - - [4096, 3432, 1, 1024, 4096, 4096, 4096, 1024]
    - [1, 12197.0]
  - - [4096, 3273, 1, 1024, 4096, 4096, 4096, 1024]
    - [1, 12172.0]
  - - [4096, 3130, 1, 1024, 4096, 4096, 4096, 1024]
    - [1, 12183.0]
  - - [1024, 2984, 1, 4096, 1024, 1024, 1024, 4096]
    - [5, 11388.0]
  - - [1024, 3995, 1, 1024, 1024, 1024, 1024, 1024]
    - [11, 11279.0]
  - - [1024, 3517, 1, 4096, 1024, 1024, 1024, 4096]
    - [20, 10589.0]
  - - [1024, 3455, 1, 4096, 1024, 1024, 1024, 4096]
    - [26, 10866.0]
  - - [1024, 3939, 1, 4096, 1024, 1024, 1024, 4096]
    - [23, 11642.0]
  - - [4096, 3147, 1, 1024, 4096, 4096, 4096, 1024]
    - [1, 12243.0]
  - - [4096, 3516, 1, 1024, 4096, 4096, 4096, 1024]
    - [1, 12223.0]
  - - [1024, 3876, 1, 4096, 1024, 1024, 1024, 4096]
    - [23, 11468.0]
  - - [1024, 3191, 1, 4096, 1024, 1024, 1024, 4096]
    - [3, 12028.0]
  - - [4096, 3411, 1, 1024, 4096, 4096, 4096, 1024]
    - [3, 12079.0]
  - - [1024, 3337, 1, 4096, 1024, 1024, 1024, 4096]
    - [8, 11604.0]
  - - [1024, 3512, 1, 4096, 1024, 1024, 1024, 4096]
    - [26, 10421.0]
  - - [4096, 3301, 1, 1024, 4096, 4096, 4096, 1024]
    - [1, 12244.0]
  - - [1024, 3450, 1, 4096, 1024, 1024, 1024, 4096]
    - [23, 12003.0]
  - - [4096, 3533, 1, 1024, 4096, 4096, 4096, 1024]
    - [1, 12238.0]
  - - [4096, 3390, 1, 1024, 4096, 4096, 4096, 1024]
    - [1, 12061.0]
  - - [4096, 3231, 1, 1024, 4096, 4096, 4096, 1024]
    - [1, 12033.0]
  - - [1024, 2499, 1, 4096, 1024, 1024, 1024, 4096]
    - [5, 11811.0]
  - - [1024, 3186, 1, 4096, 1024, 1024, 1024, 4096]
    - [40, 11356.0]
  - - [1024, 3380, 1, 4096, 1024, 1024, 1024, 4096]
    - [20, 11059.0]
  - - [4096, 3496, 1, 1024, 4096, 4096, 4096, 1024]
    - [1, 12127.0]
  - - [1024, 3956, 1, 33708, 1024, 1024, 1024, 33708]
    - [1, 11682.0]
  - - [1024, 3976, 1, 1024, 1024, 1024, 1024, 1024]
    - [23, 11429.0]
  - - [4096, 2736, 1, 1024, 4096, 4096, 4096, 1024]
    - [1, 11897.0]
  - - [1024, 3291, 1, 4096, 1024, 1024, 1024, 4096]
    - [8, 11511.0]
  - - [1024, 3944, 1, 33708, 1024, 1024, 1024, 33708]
    - [1, 11659.0]
  - - [1024, 3485, 1, 4096, 1024, 1024, 1024, 4096]
    - [7, 11586.0]
  - - [4096, 3138, 1, 1024, 4096, 4096, 4096, 1024]
    - [1, 12172.0]
  - - [1024, 3423, 1, 4096, 1024, 1024, 1024, 4096]
    - [23, 11915.0]
  - - [1024, 3491, 1, 4096, 1024, 1024, 1024, 4096]
    - [26, 10444.0]
  - - [1024, 3860, 1, 4096, 1024, 1024, 1024, 4096]
    - [8, 11413.0]
  - - [4096, 3211, 1, 1024, 4096, 4096, 4096, 1024]
    - [1, 11925.0]
  - - [1024, 3221, 1, 4096, 1024, 1024, 1024, 4096]
    - [8, 11306.0]
  - - [1024, 2917, 1, 4096, 1024, 1024, 1024, 4096]
    - [28, 10902.0]
  - - [4096, 3475, 1, 1024, 4096, 4096, 4096, 1024]
    - [1, 12054.0]
  - - [4096, 3524, 1, 1024, 4096, 4096, 4096, 1024]
    - [1, 12236.0]
  - - [4096, 2985, 1, 1024, 4096, 4096, 4096, 1024]
    - [1, 11968.0]
  - - [1024, 3480, 1, 4096, 1024, 1024, 1024, 4096]
    - [22, 11563.0]
  - - [4096, 3222, 1, 1024, 4096, 4096, 4096, 1024]
    - [1, 11977.0]
  - - [4096, 3451, 1, 1024, 4096, 4096, 4096, 1024]
    - [1, 12257.0]
  - - [1024, 3969, 1, 33708, 1024, 1024, 1024, 33708]
    - [1, 11713.0]
  - - [1024, 3640, 1, 1024, 1024, 1024, 1024, 1024]
    - [7, 11370.0]
  - - [1024, 3297, 1, 4096, 1024, 1024, 1024, 4096]
    - [8, 11510.0]
  - - [4096, 3944, 1, 1024, 4096, 4096, 4096, 1024]
    - [1, 12240.0]
  - - [1024, 3216, 1, 4096, 1024, 1024, 1024, 4096]
    - [8, 11286.0]
  - - [4096, 3349, 1, 1024, 4096, 4096, 4096, 1024]
    - [1, 11906.0]
  - - [4096, 3398, 1, 1024, 4096, 4096, 4096, 1024]
    - [1, 12087.0]
  - - [1024, 3154, 1, 4096, 1024, 1024, 1024, 4096]
    - [8, 11933.0]
  - - [1024, 3978, 1, 33708, 1024, 1024, 1024, 33708]
    - [1, 11739.0]
  - - [1024, 3348, 1, 4096, 1024, 1024, 1024, 4096]
    - [8, 11643.0]
  - - [4096, 3304, 1, 1024, 4096, 4096, 4096, 1024]
    - [1, 12226.0]
  - - [4096, 4030, 1, 1024, 4096, 4096, 4096, 1024]
    - [1, 12138.0]
  - - [1024, 4026, 1, 1024, 1024, 1024, 1024, 1024]
    - [8, 11541.0]
  - - [4096, 3471, 1, 1024, 4096, 4096, 4096, 1024]
    - [1, 12047.0]
  - - [1024, 3259, 1, 4096, 1024, 1024, 1024, 4096]
    - [7, 11414.0]
  - - [1024, 3308, 1, 4096, 1024, 1024, 1024, 4096]
    - [26, 10807.0]
  - - [4096, 3391, 1, 1024, 4096, 4096, 4096, 1024]
    - [1, 12029.0]
  - - [1024, 3312, 1, 4096, 1024, 1024, 1024, 4096]
    - [8, 11540.0]
  - - [1024, 3502, 1, 4096, 1024, 1024, 1024, 4096]
    - [11, 10400.0]
  - - [1024, 3968, 1, 33708, 1024, 1024, 1024, 33708]
    - [26, 11778.0]
  - - [1024, 3424, 1, 4096, 1024, 1024, 1024, 4096]
    - [23, 11929.0]
  - - [4096, 4032, 1, 1024, 4096, 4096, 4096, 1024]
    - [1, 12088.0]
  - - [1024, 3900, 1, 1024, 1024, 1024, 1024, 1024]
    - [36, 11370.0]
  - - [4096, 3442, 1, 1024, 4096, 4096, 4096, 1024]
    - [1, 12227.0]
  - - [1024, 3366, 1, 4096, 1024, 1024, 1024, 4096]
    - [23, 11753.0]
  - - [4096, 3999, 1, 1024, 4096, 4096, 4096, 1024]
    - [1, 12055.0]
  - - [1024, 3477, 1, 4096, 1024, 1024, 1024, 4096]
    - [22, 11594.0]
  - - [1024, 2505, 1, 4096, 1024, 1024, 1024, 4096]
    - [8, 11770.0]
  - - [4096, 3515, 1, 1024, 4096, 4096, 4096, 1024]
    - [8, 12151.0]
  - - [1024, 3564, 1, 4096, 1024, 1024, 1024, 4096]
    - [8, 11477.0]
  - - [4096, 3057, 1, 1024, 4096, 4096, 4096, 1024]
    - [1, 12219.0]
  - - [1024, 3339, 1, 4096, 1024, 1024, 1024, 4096]
    - [8, 11585.0]
  - - [4096, 3262, 1, 1024, 4096, 4096, 4096, 1024]
    - [1, 12114.0]
  - - [1024, 4030, 1, 4096, 1024, 1024, 1024, 4096]
    - [26, 11838.0]
  - - [1024, 3265, 1, 4096, 1024, 1024, 1024, 4096]
    - [7, 11430.0]
  - - [1024, 3459, 1, 4096, 1024, 1024, 1024, 4096]
    - [11, 10412.0]
  - - [4096, 3462, 1, 1024, 4096, 4096, 4096, 1024]
    - [1, 11992.0]
  - - [1024, 3513, 1, 4096, 1024, 1024, 1024, 4096]
    - [22, 11736.0]
  - - [1024, 3397, 1, 4096, 1024, 1024, 1024, 4096]
    - [8, 11847.0]
  - - [4096, 3572, 1, 1024, 4096, 4096, 4096, 1024]
    - [3, 12326.0]
  - - [4096, 3389, 1, 1024, 4096, 4096, 4096, 1024]
    - [1, 12087.0]
  - - [4096, 3438, 1, 1024, 4096, 4096, 4096, 1024]
    - [1, 12251.0]
  - - [1024, 3640, 1, 33708, 1024, 1024, 1024, 33708]
    - [5, 11674.0]
  - - [1024, 3995, 1, 33708, 1024, 1024, 1024, 33708]
    - [8, 11793.0]
  - - [1024, 3165, 1, 4096, 1024, 1024, 1024, 4096]
    - [8, 12002.0]
  - - [4096, 3543, 1, 1024, 4096, 4096, 4096, 1024]
    - [3, 12229.0]
  - - [4096, 3352, 1, 1024, 4096, 4096, 4096, 1024]
    - [8, 11930.0]
  - - [1024, 3359, 1, 4096, 1024, 1024, 1024, 4096]
    - [23, 11766.0]
  - - [1024, 3470, 1, 4096, 1024, 1024, 1024, 4096]
    - [26, 10442.0]
  - - [1024, 3392, 1, 4096, 1024, 1024, 1024, 4096]
    - [40, 10996.0]
  - - [4096, 3137, 1, 1024, 4096, 4096, 4096, 1024]
    - [1, 12231.0]
  - - [4096, 3506, 1, 1024, 4096, 4096, 4096, 1024]
    - [1, 12167.0]
  - - [1024, 3095, 1, 4096, 1024, 1024, 1024, 4096]
    - [8, 11717.0]
  - - [1024, 3859, 1, 4096, 1024, 1024, 1024, 4096]
    - [8, 11450.0]
  - - [4096, 3369, 1, 1024, 4096, 4096, 4096, 1024]
    - [1, 11971.0]
  - - [1024, 3435, 1, 4096, 1024, 1024, 1024, 4096]
    - [23, 11994.0]
  - - [1024, 3354, 1, 4096, 1024, 1024, 1024, 4096]
    - [8, 11685.0]
  - - [1024, 3055, 1, 4096, 1024, 1024, 1024, 4096]
    - [40, 11124.0]
  - - [4096, 3523, 1, 1024, 4096, 4096, 4096, 1024]
    - [1, 12210.0]
  - - [4096, 3380, 1, 1024, 4096, 4096, 4096, 1024]
    - [1, 12030.0]
  - - [1024, 3233, 1, 4096, 1024, 1024, 1024, 4096]
    - [11, 11168.0]
  - - [4096, 3221, 1, 1024, 4096, 4096, 4096, 1024]
    - [1, 11946.0]
  - - [4096, 3270, 1, 1024, 4096, 4096, 4096, 1024]
    - [1, 12179.0]
  - - [4096, 3593, 1, 1024, 4096, 4096, 4096, 1024]
    - [1, 11979.0]
  - - [1024, 3358, 1, 4096, 1024, 1024, 1024, 4096]
    - [23, 11672.0]
  - - [1024, 3540, 1, 4096, 1024, 1024, 1024, 4096]
    - [26, 10500.0]
  - - [4096, 3502, 1, 1024, 4096, 4096, 4096, 1024]
    - [1, 12139.0]
  - - [4096, 2505, 1, 1024, 4096, 4096, 4096, 1024]
    - [1, 12154.0]
  - - [4096, 3397, 1, 1024, 4096, 4096, 4096, 1024]
    - [1, 12099.0]
  - - [1024, 3300, 1, 4096, 1024, 1024, 1024, 4096]
    - [8, 11525.0]
  - - [4096, 3095, 1, 1024, 4096, 4096, 4096, 1024]
    - [1, 12031.0]
  - - [1024, 3182, 1, 4096, 1024, 1024, 1024, 4096]
    - [3, 12039.0]
  - - [1024, 3299, 1, 4096, 1024, 1024, 1024, 4096]
    - [26, 10910.0]
  - - [1024, 3276, 1, 4096, 1024, 1024, 1024, 4096]
    - [40, 10963.0]
  - - [1024, 3360, 1, 4096, 1024, 1024, 1024, 4096]
    - [26, 10882.0]
  - - [4096, 3360, 1, 1024, 4096, 4096, 4096, 1024]
    - [1, 11928.0]
  - - [4096, 2918, 1, 1024, 4096, 4096, 4096, 1024]
    - [1, 12280.0]
  - - [1024, 3939, 1, 33708, 1024, 1024, 1024, 33708]
    - [1, 11635.0]
  - - [4096, 3314, 1, 1024, 4096, 4096, 4096, 1024]
    - [1, 12327.0]
  - - [1024, 3319, 1, 4096, 1024, 1024, 1024, 4096]
    - [7, 11564.0]
  - - [1024, 3942, 1, 1024, 1024, 1024, 1024, 1024]
    - [22, 11212.0]
  - - [1024, 3465, 1, 4096, 1024, 1024, 1024, 4096]
    - [26, 10503.0]
  - - [4096, 3546, 1, 1024, 4096, 4096, 4096, 1024]
    - [1, 12274.0]
  - - [1024, 3403, 1, 4096, 1024, 1024, 1024, 4096]
    - [8, 11838.0]
  - - [1024, 3948, 1, 1024, 1024, 1024, 1024, 1024]
    - [36, 11186.0]
  - - [4096, 3441, 1, 1024, 4096, 4096, 4096, 1024]
    - [1, 12190.0]
  - - [1024, 3139, 1, 4096, 1024, 1024, 1024, 4096]
    - [3, 11854.0]
  - - [1024, 3563, 1, 4096, 1024, 1024, 1024, 4096]
    - [8, 11457.0]
  - - [1024, 3508, 1, 4096, 1024, 1024, 1024, 4096]
    - [22, 11699.0]
  - - [1024, 3975, 1, 33708, 1024, 1024, 1024, 33708]
    - [1, 11737.0]
  - - [1024, 3446, 1, 4096, 1024, 1024, 1024, 4096]
    - [23, 12002.0]
  - - [1024, 3529, 1, 4096, 1024, 1024, 1024, 4096]
    - [26, 10485.0]
  - - [4096, 3461, 1, 1024, 4096, 4096, 4096, 1024]
    - [8, 11966.0]
  - - [1024, 3574, 1, 4096, 1024, 1024, 1024, 4096]
    - [23, 11519.0]
  - - [1024, 3101, 1, 4096, 1024, 1024, 1024, 4096]
    - [3, 11713.0]
  - - [1024, 3927, 1, 1024, 1024, 1024, 1024, 1024]
    - [36, 11234.0]
  - - [4096, 3224, 1, 1024, 4096, 4096, 4096, 1024]
    - [1, 11973.0]
  - - [4096, 3437, 1, 1024, 4096, 4096, 4096, 1024]
    - [1, 12235.0]
  - - [4096, 3900, 1, 1024, 4096, 4096, 4096, 1024]
    - [1, 12182.0]
  - - [1024, 3495, 1, 4096, 1024, 1024, 1024, 4096]
    - [7, 11646.0]
  - - [1024, 3977, 1, 33708, 1024, 1024, 1024, 33708]
    - [1, 11748.0]
  - - [1024, 3328, 1, 4096, 1024, 1024, 1024, 4096]
    - [8, 11597.0]
  - - [4096, 3168, 1, 1024, 4096, 4096, 4096, 1024]
    - [1, 12294.0]
  - - [1024, 4026, 1, 33708, 1024, 1024, 1024, 33708]
    - [1, 11876.0]
  - - [1024, 3292, 1, 4096, 1024, 1024, 1024, 4096]
    - [8, 11500.0]
  - - [1024, 3294, 1, 4096, 1024, 1024, 1024, 4096]
    - [26, 10855.0]
  - - [4096, 3335, 1, 1024, 4096, 4096, 4096, 1024]
    - [1, 11821.0]
  - - [4096, 3400, 1, 1024, 4096, 4096, 4096, 1024]
    - [1, 12112.0]
  - - [1024, 3287, 1, 4096, 1024, 1024, 1024, 4096]
    - [8, 11492.0]
  - - [1024, 3910, 1, 4096, 1024, 1024, 1024, 4096]
    - [23, 11548.0]
  - - [1024, 3780, 1, 1024, 1024, 1024, 1024, 1024]
    - [8, 11658.0]
  - - [4096, 3098, 1, 1024, 4096, 4096, 4096, 1024]
    - [1, 12045.0]
  - - [1024, 3584, 1, 33708, 1024, 1024, 1024, 33708]
    - [5, 11533.0]
  - - [1024, 3371, 1, 4096, 1024, 1024, 1024, 4096]
    - [8, 11731.0]
  - - [1024, 3546, 1, 4096, 1024, 1024, 1024, 4096]
    - [20, 10503.0]
  - - [1024, 4012, 1, 1024, 1024, 1024, 1024, 1024]
    - [26, 11376.0]
  - - [4096, 3505, 1, 1024, 4096, 4096, 4096, 1024]
    - [1, 12158.0]
  - - [4096, 3554, 1, 1024, 4096, 4096, 4096, 1024]
    - [1, 12350.0]
  - - [4096, 3063, 1, 1024, 4096, 4096, 4096, 1024]
    - [1, 12257.0]
  - - [1024, 3900, 1, 33708, 1024, 1024, 1024, 33708]
    - [1, 11524.0]
  - - [1024, 3345, 1, 4096, 1024, 1024, 1024, 4096]
    - [8, 11644.0]
  - - [1024, 3357, 1, 4096, 1024, 1024, 1024, 4096]
    - [26, 10908.0]
  - - [1024, 3282, 1, 4096, 1024, 1024, 1024, 4096]
    - [26, 10863.0]
  - - [4096, 3484, 1, 1024, 4096, 4096, 4096, 1024]
    - [1, 12011.0]
  - - [1024, 3557, 1, 4096, 1024, 1024, 1024, 4096]
    - [8, 11450.0]
  - - [1024, 3476, 1, 4096, 1024, 1024, 1024, 4096]
    - [22, 11475.0]
  - - [1024, 3751, 1, 1024, 1024, 1024, 1024, 1024]
    - [8, 11607.0]
  - - [4096, 3379, 1, 1024, 4096, 4096, 4096, 1024]
    - [1, 11975.0]
  - - [4096, 3428, 1, 1024, 4096, 4096, 4096, 1024]
    - [1, 12209.0]
  - - [4096, 3126, 1, 1024, 4096, 4096, 4096, 1024]
    - [1, 12208.0]
  - - [1024, 3325, 1, 4096, 1024, 1024, 1024, 4096]
    - [8, 11574.0]
  - - [4096, 3501, 1, 1024, 4096, 4096, 4096, 1024]
    - [1, 12120.0]
  - - [4096, 3358, 1, 1024, 4096, 4096, 4096, 1024]
    - [1, 11960.0]
  - - [1024, 3441, 1, 4096, 1024, 1024, 1024, 4096]
    - [23, 12002.0]
  - - [1024, 3552, 1, 4096, 1024, 1024, 1024, 4096]
    - [41, 11361.0]
  - - [4096, 3232, 1, 1024, 4096, 4096, 4096, 1024]
    - [1, 12040.0]
  - - [1024, 3412, 1, 4096, 1024, 1024, 1024, 4096]
    - [8, 11887.0]
  - - [1024, 3372, 1, 4096, 1024, 1024, 1024, 4096]
    - [23, 11743.0]
  - - [1024, 3585, 1, 4096, 1024, 1024, 1024, 4096]
    - [23, 11507.0]
  - - [4096, 3143, 1, 1024, 4096, 4096, 4096, 1024]
    - [1, 12239.0]
  - - [4096, 3464, 1, 1024, 4096, 4096, 4096, 1024]
    - [1, 12059.0]
  - - [1024, 3145, 1, 4096, 1024, 1024, 1024, 4096]
    - [8, 11939.0]
  - - [4096, 3375, 1, 1024, 4096, 4096, 4096, 1024]
    - [1, 11997.0]
  - - [4096, 2917, 1, 1024, 4096, 4096, 4096, 1024]
    - [1, 12288.0]
  - - [4096, 3978, 1, 1024, 4096, 4096, 4096, 1024]
    - [1, 11991.0]
  - - [1024, 2765, 1, 4096, 1024, 1024, 1024, 4096]
    - [3, 11548.0]
  - - [1024, 3452, 1, 4096, 1024, 1024, 1024, 4096]
    - [23, 11978.0]
  - - [4096, 3584, 1, 1024, 4096, 4096, 4096, 1024]
    - [1, 12384.0]
  - - [4096, 3545, 1, 1024, 4096, 4096, 4096, 1024]
    - [1, 12305.0]
  - - [1024, 3352, 1, 4096, 1024, 1024, 1024, 4096]
    - [8, 11649.0]
  - - [4096, 3292, 1, 1024, 4096, 4096, 4096, 1024]
    - [1, 12213.0]
  - - [1024, 3525, 1, 4096, 1024, 1024, 1024, 4096]
    - [23, 11356.0]
  - - [1024, 3266, 1, 4096, 1024, 1024, 1024, 4096]
    - [0, 11297.0]
  - - [1024, 3382, 1, 4096, 1024, 1024, 1024, 4096]
    - [26, 10979.0]
  - - [4096, 3492, 1, 1024, 4096, 4096, 4096, 1024]
    - [1, 12130.0]
  - - [4096, 3419, 1, 1024, 4096, 4096, 4096, 1024]
    - [1, 12179.0]
  - - [1024, 3796, 1, 33708, 1024, 1024, 1024, 33708]
    - [21, 12161.0]
  - - [1024, 3293, 1, 4096, 1024, 1024, 1024, 4096]
    - [7, 11523.0]
  - - [4096, 3796, 1, 1024, 4096, 4096, 4096, 1024]
    - [3, 12262.0]
  - - [1024, 3487, 1, 4096, 1024, 1024, 1024, 4096]
    - [7, 11615.0]
  - - [4096, 3166, 1, 1024, 4096, 4096, 4096, 1024]
    - [1, 12302.0]
  - - [1024, 3409, 1, 4096, 1024, 1024, 1024, 4096]
    - [23, 11899.0]
  - - [1024, 3520, 1, 4096, 1024, 1024, 1024, 4096]
    - [26, 10481.0]
  - - [1024, 3573, 1, 4096, 1024, 1024, 1024, 4096]
    - [11, 10601.0]
  - - [4096, 3366, 1, 1024, 4096, 4096, 4096, 1024]
    - [1, 11940.0]
  - - [4096, 3720, 1, 1024, 4096, 4096, 4096, 1024]
    - [1, 12110.0]
  - - [4096, 3207, 1, 1024, 4096, 4096, 4096, 1024]
    - [1, 11933.0]
  - - [4096, 3272, 1, 1024, 4096, 4096, 4096, 1024]
    - [1, 12192.0]
  - - [1024, 3390, 1, 4096, 1024, 1024, 1024, 4096]
    - [8, 11783.0]
  - - [4096, 3183, 1, 1024, 4096, 4096, 4096, 1024]
    - [1, 12373.0]
  - - [4096, 3536, 1, 1024, 4096, 4096, 4096, 1024]
    - [1, 12264.0]
  - - [4096, 3563, 1, 1024, 4096, 4096, 4096, 1024]
    - [1, 12364.0]
  - - [1024, 3482, 1, 4096, 1024, 1024, 1024, 4096]
    - [7, 11612.0]
  - - [4096, 3447, 1, 1024, 4096, 4096, 4096, 1024]
    - [8, 12207.0]
  - - [4096, 3955, 1, 1024, 4096, 4096, 4096, 1024]
    - [1, 12347.0]
  - - [4096, 4005, 1, 1024, 4096, 4096, 4096, 1024]
    - [1, 12029.0]
  - - [1024, 3493, 1, 4096, 1024, 1024, 1024, 4096]
    - [22, 11614.0]
  - - [4096, 3410, 1, 1024, 4096, 4096, 4096, 1024]
    - [1, 12115.0]
  - - [1024, 3422, 1, 4096, 1024, 1024, 1024, 4096]
    - [23, 11919.0]
  - - [1024, 3350, 1, 4096, 1024, 1024, 1024, 4096]
    - [26, 10891.0]
  - - [4096, 3300, 1, 1024, 4096, 4096, 4096, 1024]
    - [8, 12206.0]
  - - [4096, 3910, 1, 1024, 4096, 4096, 4096, 1024]
    - [1, 12225.0]
  - - [1024, 3489, 1, 4096, 1024, 1024, 1024, 4096]
    - [22, 11650.0]
  - - [4096, 3483, 1, 1024, 4096, 4096, 4096, 1024]
    - [1, 12066.0]
  - - [4096, 3532, 1, 1024, 4096, 4096, 4096, 1024]
    - [1, 12269.0]
  - - [4096, 3230, 1, 1024, 4096, 4096, 4096, 1024]
    - [1, 12031.0]
  - - [4096, 3427, 1, 1024, 4096, 4096, 4096, 1024]
    - [1, 12203.0]
  - - [1024, 3377, 1, 4096, 1024, 1024, 1024, 4096]
    - [8, 11697.0]
  - - [1024, 3488, 1, 4096, 1024, 1024, 1024, 4096]
    - [7, 11559.0]
  - - [1024, 3616, 1, 4096, 1024, 1024, 1024, 4096]
    - [8, 11581.0]
  - - [1024, 3426, 1, 4096, 1024, 1024, 1024, 4096]
    - [8, 11910.0]
  - - [4096, 3357, 1, 1024, 4096, 4096, 4096, 1024]
    - [1, 11909.0]
  - - [4096, 3406, 1, 1024, 4096, 4096, 4096, 1024]
    - [8, 12124.0]
  - - [1024, 3046, 1, 4096, 1024, 1024, 1024, 4096]
    - [5, 11629.0]
  - - [1024, 3272, 1, 4096, 1024, 1024, 1024, 4096]
    - [26, 10818.0]
  - - [1024, 3256, 1, 4096, 1024, 1024, 1024, 4096]
    - [26, 10793.0]
  - - [4096, 3247, 1, 1024, 4096, 4096, 4096, 1024]
    - [1, 12096.0]
  - - [4096, 3088, 1, 1024, 4096, 4096, 4096, 1024]
    - [1, 12097.0]
  - - [1024, 3531, 1, 4096, 1024, 1024, 1024, 4096]
    - [23, 11388.0]
  - - [4096, 3511, 1, 1024, 4096, 4096, 4096, 1024]
    - [1, 12200.0]
  - - [1024, 3720, 1, 33708, 1024, 1024, 1024, 33708]
    - [5, 11928.0]
  - - [1024, 3267, 1, 4096, 1024, 1024, 1024, 4096]
    - [8, 11443.0]
  - - [1024, 3270, 1, 4096, 1024, 1024, 1024, 4096]
    - [26, 10881.0]
  - - [1024, 3461, 1, 4096, 1024, 1024, 1024, 4096]
    - [26, 10436.0]
  - - [4096, 3474, 1, 1024, 4096, 4096, 4096, 1024]
    - [1, 12035.0]
  - - [4096, 2984, 1, 1024, 4096, 4096, 4096, 1024]
    - [1, 11944.0]
  - - [1024, 3399, 1, 4096, 1024, 1024, 1024, 4096]
    - [23, 11890.0]
  - - [4096, 3574, 1, 1024, 4096, 4096, 4096, 1024]
    - [1, 12372.0]
  - - [1024, 3876, 1, 1024, 1024, 1024, 1024, 1024]
    - [36, 11303.0]
  - - [4096, 3337, 1, 1024, 4096, 4096, 4096, 1024]
    - [1, 11878.0]
  - - [4096, 3450, 1, 1024, 4096, 4096, 4096, 1024]
    - [1, 12256.0]
  - - [1024, 3720, 1, 1024, 1024, 1024, 1024, 1024]
    - [26, 11407.0]
  - - [1024, 4059, 1, 1024, 1024, 1024, 1024, 1024]
    - [8, 11670.0]
  - - [4096, 3291, 1, 1024, 4096, 4096, 4096, 1024]
    - [1, 12262.0]
  - - [4096, 3995, 1, 1024, 4096, 4096, 4096, 1024]
    - [1, 12032.0]
  - - [4096, 3491, 1, 1024, 4096, 4096, 4096, 1024]
    - [1, 12139.0]
  - - [4096, 3348, 1, 1024, 4096, 4096, 4096, 1024]
    - [1, 11951.0]
  - - [4096, 3925, 1, 1024, 4096, 4096, 4096, 1024]
    - [1, 12261.0]
  - - [4096, 3894, 1, 1024, 4096, 4096, 4096, 1024]
    - [1, 12160.0]
  - - [1024, 3456, 1, 4096, 1024, 1024, 1024, 4096]
    - [23, 12052.0]
  - - [1024, 3394, 1, 4096, 1024, 1024, 1024, 4096]
    - [26, 11051.0]
  - - [4096, 3165, 1, 1024, 4096, 4096, 4096, 1024]
    - [1, 12303.0]
  - - [4096, 3470, 1, 1024, 4096, 4096, 4096, 1024]
    - [1, 12090.0]
  - - [1024, 3014, 1, 4096, 1024, 1024, 1024, 4096]
    - [5, 11545.0]
  - - [1024, 3375, 1, 4096, 1024, 1024, 1024, 4096]
    - [40, 10963.0]
  - - [4096, 3859, 1, 1024, 4096, 4096, 4096, 1024]
    - [1, 12071.0]
  - - [4096, 3365, 1, 1024, 4096, 4096, 4096, 1024]
    - [1, 11962.0]
  - - [1024, 3162, 1, 4096, 1024, 1024, 1024, 4096]
    - [8, 11978.0]
  - - [1024, 3840, 1, 33708, 1024, 1024, 1024, 33708]
    - [5, 12308.0]
  - - [1024, 3437, 1, 4096, 1024, 1024, 1024, 4096]
    - [23, 11959.0]
  - - [4096, 3319, 1, 1024, 4096, 4096, 4096, 1024]
    - [1, 12278.0]
  - - [1024, 3320, 1, 4096, 1024, 1024, 1024, 4096]
    - [23, 11601.0]
  - - [4096, 3328, 1, 1024, 4096, 4096, 4096, 1024]
    - [1, 12409.0]
  - - [1024, 3235, 1, 4096, 1024, 1024, 1024, 4096]
    - [8, 11338.0]
  - - [4096, 3282, 1, 1024, 4096, 4096, 4096, 1024]
    - [1, 12184.0]
  - - [1024, 3367, 1, 4096, 1024, 1024, 1024, 4096]
    - [23, 11777.0]
  - - [1024, 3542, 1, 4096, 1024, 1024, 1024, 4096]
    - [23, 11403.0]
  - - [4096, 3145, 1, 1024, 4096, 4096, 4096, 1024]
    - [1, 12212.0]
  - - [4096, 3514, 1, 1024, 4096, 4096, 4096, 1024]
    - [1, 12204.0]
  - - [1024, 3432, 1, 4096, 1024, 1024, 1024, 4096]
    - [23, 11950.0]
  - - [4096, 3409, 1, 1024, 4096, 4096, 4096, 1024]
    - [1, 12105.0]
  - - [1024, 4012, 1, 33708, 1024, 1024, 1024, 33708]
    - [1, 11843.0]
  - - [4096, 3876, 1, 1024, 4096, 4096, 4096, 1024]
    - [1, 12132.0]
  - - [4096, 3299, 1, 1024, 4096, 4096, 4096, 1024]
    - [1, 12289.0]
  - - [1024, 3168, 1, 4096, 1024, 1024, 1024, 4096]
    - [8, 11991.0]
  - - [4096, 3681, 1, 1024, 4096, 4096, 4096, 1024]
    - [1, 12222.0]
  - - [4096, 3531, 1, 1024, 4096, 4096, 4096, 1024]
    - [1, 12248.0]
  - - [4096, 3388, 1, 1024, 4096, 4096, 4096, 1024]
    - [1, 12058.0]
  - - [1024, 3720, 1, 4096, 1024, 1024, 1024, 4096]
    - [28, 11857.0]
  - - [1024, 3332, 1, 4096, 1024, 1024, 1024, 4096]
    - [8, 11626.0]
  - - [1024, 3273, 1, 4096, 1024, 1024, 1024, 4096]
    - [26, 10925.0]
  - - [1024, 2935, 1, 4096, 1024, 1024, 1024, 4096]
    - [28, 11054.0]
  - - [1024, 3467, 1, 4096, 1024, 1024, 1024, 4096]
    - [26, 10429.0]
  - - [4096, 3542, 1, 1024, 4096, 4096, 4096, 1024]
    - [1, 12266.0]
  - - [1024, 3130, 1, 4096, 1024, 1024, 1024, 4096]
    - [3, 11832.0]
  - - [1024, 3405, 1, 4096, 1024, 1024, 1024, 4096]
    - [26, 11005.0]
  - - [1024, 3960, 1, 1024, 1024, 1024, 1024, 1024]
    - [7, 11522.0]
  - - [4096, 3405, 1, 1024, 4096, 4096, 4096, 1024]
    - [1, 12105.0]
  - - [1024, 10080, 1, 1024, 1024, 1024, 1024, 1024]
    - [23, 12183.0]
  - - [36548, 1216, 1, 1024, 36548, 36548, 36548, 1024]
    - [23, 11926.0]
  - - [1024, 2592, 1, 1024, 1024, 1024, 1024, 1024]
    - [7, 10940.0]
  - - [1024, 1568, 1, 1024, 1024, 1024, 1024, 1024]
    - [7, 10917.0]
  - - [1024, 4445, 1, 1024, 1024, 1024, 1024, 1024]
    - [8, 11917.0]
  - - [1024, 6272, 1, 1024, 1024, 1024, 1024, 1024]
    - [3, 12010.0]
  - - [36548, 3584, 1, 1024, 36548, 36548, 36548, 1024]
    - [23, 12434.0]
  - - [1024, 1827, 1, 1024, 1024, 1024, 1024, 1024]
    - [9, 10799.0]
  - - [1024, 3220, 1, 1024, 1024, 1024, 1024, 1024]
    - [7, 11124.0]
  - - [1024, 1856, 1, 1024, 1024, 1024, 1024, 1024]
    - [8, 11115.0]
  - - [1024, 1760, 1, 1024, 1024, 1024, 1024, 1024]
    - [24, 10327.0]
  - - [36548, 4235, 1, 1024, 36548, 36548, 36548, 1024]
    - [23, 12138.0]
  - - [1024, 1984, 1, 1024, 1024, 1024, 1024, 1024]
    - [22, 10947.0]
  - - [1024, 14720, 1, 1024, 1024, 1024, 1024, 1024]
    - [11, 12347.0]
  - - [1024, 1152, 1, 1024, 1024, 1024, 1024, 1024]
    - [9, 10187.0]
  - - [36548, 14976, 1, 1024, 36548, 36548, 36548, 1024]
    - [23, 12361.0]
  - - [36548, 1152, 1, 1024, 36548, 36548, 36548, 1024]
    - [20, 12478.0]
  - - [1024, 3392, 1, 1024, 1024, 1024, 1024, 1024]
    - [8, 11469.0]
  - - [1024, 1408, 1, 1024, 1024, 1024, 1024, 1024]
    - [7, 10864.0]
  - - [1024, 2080, 1, 1024, 1024, 1024, 1024, 1024]
    - [8, 10578.0]
  - - [1024, 1824, 1, 1024, 1024, 1024, 1024, 1024]
    - [8, 10629.0]
  - - [36548, 2432, 1, 1024, 36548, 36548, 36548, 1024]
    - [23, 12577.0]
  - - [36548, 1827, 1, 1024, 36548, 36548, 36548, 1024]
    - [23, 11958.0]
  - - [1024, 10176, 1, 1024, 1024, 1024, 1024, 1024]
    - [8, 12349.0]
  - - [1024, 1952, 1, 1024, 1024, 1024, 1024, 1024]
    - [22, 10754.0]
  - - [1024, 17024, 1, 1024, 1024, 1024, 1024, 1024]
    - [26, 12265.0]
  - - [1024, 1472, 1, 1024, 1024, 1024, 1024, 1024]
    - [22, 10416.0]
  - - [36548, 4459, 1, 1024, 36548, 36548, 36548, 1024]
    - [23, 12425.0]
  - - [1024, 3712, 1, 1024, 1024, 1024, 1024, 1024]
    - [8, 11593.0]
  - - [36548, 12928, 1, 1024, 36548, 36548, 36548, 1024]
    - [23, 12336.0]
  - - [1024, 1632, 1, 1024, 1024, 1024, 1024, 1024]
    - [22, 9874.0]
  - - [1024, 1696, 1, 1024, 1024, 1024, 1024, 1024]
    - [22, 10568.0]
  - - [36548, 1764, 1, 1024, 36548, 36548, 36548, 1024]
    - [23, 12340.0]
  - - [1024, 2944, 1, 1024, 1024, 1024, 1024, 1024]
    - [7, 11303.0]
  - - [36548, 14080, 1, 1024, 36548, 36548, 36548, 1024]
    - [23, 12393.0]
  - - [1024, 1280, 1, 1024, 1024, 1024, 1024, 1024]
    - [24, 10437.0]
  - - [1024, 13440, 1, 1024, 1024, 1024, 1024, 1024]
    - [11, 12351.0]
  - - [36548, 9120, 1, 1024, 36548, 36548, 36548, 1024]
    - [23, 12360.0]
  - - [1024, 3008, 1, 1024, 1024, 1024, 1024, 1024]
    - [22, 11052.0]
  - - [1024, 2560, 1, 1024, 1024, 1024, 1024, 1024]
    - [3, 11493.0]
  - - [1024, 2208, 1, 1024, 1024, 1024, 1024, 1024]
    - [36, 10676.0]
  - - [1024, 1920, 1, 1024, 1024, 1024, 1024, 1024]
    - [11, 11170.0]
  - - [36548, 2496, 1, 1024, 36548, 36548, 36548, 1024]
    - [23, 12283.0]
  - - [1024, 2016, 1, 1024, 1024, 1024, 1024, 1024]
    - [22, 10979.0]
  - - [1024, 1184, 1, 1024, 1024, 1024, 1024, 1024]
    - [9, 10493.0]
  - - [1024, 1664, 1, 1024, 1024, 1024, 1024, 1024]
    - [22, 10419.0]
  - - [1024, 11424, 1, 1024, 1024, 1024, 1024, 1024]
    - [11, 12150.0]
  - - [1024, 1216, 1, 1024, 1024, 1024, 1024, 1024]
    - [9, 10615.0]
  - - [36548, 3185, 1, 1024, 36548, 36548, 36548, 1024]
    - [40, 12458.0]
  - - [36548, 9216, 1, 1024, 36548, 36548, 36548, 1024]
    - [23, 12485.0]
  - - [1024, 3200, 1, 1024, 1024, 1024, 1024, 1024]
    - [8, 11216.0]
  - - [1024, 2656, 1, 1024, 1024, 1024, 1024, 1024]
    - [22, 10664.0]
  - - [1024, 2368, 1, 1024, 1024, 1024, 1024, 1024]
    - [22, 10985.0]
  - - [1024, 4459, 1, 1024, 1024, 1024, 1024, 1024]
    - [3, 11946.0]
  - - [1024, 3808, 1, 1024, 1024, 1024, 1024, 1024]
    - [8, 11810.0]
  - - [1024, 2336, 1, 1024, 1024, 1024, 1024, 1024]
    - [7, 11120.0]
  - - [1024, 2304, 1, 1024, 1024, 1024, 1024, 1024]
    - [22, 10807.0]
  - - [1024, 1560, 1, 1024, 1024, 1024, 1024, 1024]
    - [22, 10579.0]
  - - [1024, 2496, 1, 1024, 1024, 1024, 1024, 1024]
    - [26, 11137.0]
  - - [1024, 1504, 1, 1024, 1024, 1024, 1024, 1024]
    - [23, 10341.0]
  - - [1024, 3232, 1, 1024, 1024, 1024, 1024, 1024]
    - [22, 10967.0]
  - - [36548, 1015, 1, 1024, 36548, 36548, 36548, 1024]
    - [37, 12364.0]
  - - [1024, 2000, 1, 1024, 1024, 1024, 1024, 1024]
    - [22, 10923.0]
  - - [36548, 243, 1, 1024, 36548, 36548, 36548, 1024]
    - [20, 11494.0]
  - - [1024, 13184, 1, 1024, 1024, 1024, 1024, 1024]
    - [8, 12302.0]
  - - [1024, 2688, 1, 1024, 1024, 1024, 1024, 1024]
    - [7, 11461.0]
  - - [36548, 950, 1, 1024, 36548, 36548, 36548, 1024]
    - [16, 11788.0]
  - - [1024, 1764, 1, 1024, 1024, 1024, 1024, 1024]
    - [9, 10544.0]
  - - [1024, 1376, 1, 1024, 1024, 1024, 1024, 1024]
    - [22, 10552.0]
  - - [36548, 774, 1, 1024, 36548, 36548, 36548, 1024]
    - [30, 11076.0]
  - - [1024, 4256, 1, 1024, 1024, 1024, 1024, 1024]
    - [8, 11519.0]
  - - [36548, 3712, 1, 1024, 36548, 36548, 36548, 1024]
    - [23, 12445.0]
  - - [1024, 3360, 1, 1024, 1024, 1024, 1024, 1024]
    - [23, 11271.0]
  - - [1024, 2784, 1, 1024, 1024, 1024, 1024, 1024]
    - [8, 11347.0]
  - - [1024, 4992, 1, 1024, 1024, 1024, 1024, 1024]
    - [23, 11901.0]
  - - [36548, 1102, 1, 1024, 36548, 36548, 36548, 1024]
    - [23, 11962.0]
  - - [1024, 1536, 1, 1024, 1024, 1024, 1024, 1024]
    - [8, 11003.0]
  - - [1024, 2720, 1, 1024, 1024, 1024, 1024, 1024]
    - [8, 11003.0]
  - - [1024, 2752, 1, 1024, 1024, 1024, 1024, 1024]
    - [8, 11224.0]
  - - [1024, 2816, 1, 1024, 1024, 1024, 1024, 1024]
    - [3, 11626.0]
  - - [1024, 2624, 1, 1024, 1024, 1024, 1024, 1024]
    - [22, 11184.0]
  - - [1024, 2144, 1, 1024, 1024, 1024, 1024, 1024]
    - [8, 11091.0]
  - - [36548, 1131, 1, 1024, 36548, 36548, 36548, 1024]
    - [20, 12265.0]
  - - [1024, 3296, 1, 1024, 1024, 1024, 1024, 1024]
    - [7, 11355.0]
  - - [36548, 4992, 1, 1024, 36548, 36548, 36548, 1024]
    - [40, 12525.0]
  - - [1024, 1344, 1, 1024, 1024, 1024, 1024, 1024]
    - [22, 10378.0]
  - - [36548, 2401, 1, 1024, 36548, 36548, 36548, 1024]
    - [23, 12416.0]
  - - [1024, 15744, 1, 1024, 1024, 1024, 1024, 1024]
    - [23, 12367.0]
  - - [1024, 15232, 1, 1024, 1024, 1024, 1024, 1024]
    - [23, 12423.0]
  - - [1024, 1888, 1, 1024, 1024, 1024, 1024, 1024]
    - [23, 11300.0]
  - - [1024, 1792, 1, 1024, 1024, 1024, 1024, 1024]
    - [5, 10840.0]
  - - [36548, 1073, 1, 1024, 36548, 36548, 36548, 1024]
    - [23, 11661.0]
  - - [36548, 15488, 1, 1024, 36548, 36548, 36548, 1024]
    - [23, 12358.0]
  - - [1024, 2464, 1, 1024, 1024, 1024, 1024, 1024]
    - [36, 10459.0]
  - - [1024, 2272, 1, 1024, 1024, 1024, 1024, 1024]
    - [36, 10573.0]
  - - [1024, 2432, 1, 1024, 1024, 1024, 1024, 1024]
    - [3, 10979.0]
  - - [1024, 3936, 1, 1024, 1024, 1024, 1024, 1024]
    - [22, 11426.0]
  - - [36548, 13824, 1, 1024, 36548, 36548, 36548, 1024]
    - [23, 12314.0]
  - - [1024, 2401, 1, 1024, 1024, 1024, 1024, 1024]
    - [7, 10333.0]
  - - [1024, 2176, 1, 1024, 1024, 1024, 1024, 1024]
    - [8, 11087.0]
  - - [1024, 2240, 1, 1024, 1024, 1024, 1024, 1024]
    - [22, 11170.0]
  - - [1024, 1728, 1, 1024, 1024, 1024, 1024, 1024]
    - [22, 10775.0]
  - - [1024, 2528, 1, 1024, 1024, 1024, 1024, 1024]
    - [23, 11271.0]
  - - [1024, 2400, 1, 1024, 1024, 1024, 1024, 1024]
    - [8, 10795.0]
  - - [1024, 1440, 1, 1024, 1024, 1024, 1024, 1024]
    - [8, 9971.0]
  - - [1024, 2912, 1, 1024, 1024, 1024, 1024, 1024]
    - [36, 10838.0]
  - - [1024, 2880, 1, 1024, 1024, 1024, 1024, 1024]
    - [7, 11232.0]
  - - [1024, 4064, 1, 1024, 1024, 1024, 1024, 1024]
    - [3, 11523.0]
  - - [1024, 4655, 1, 1024, 1024, 1024, 1024, 1024]
    - [3, 11745.0]
  - - [36548, 6272, 1, 1024, 36548, 36548, 36548, 1024]
    - [23, 12521.0]
  - - [768, 2048, 1, 3072, 768, 768, 768, 3072]
    - [8, 11257.0]
  - - [768, 4096, 1, 3072, 768, 768, 768, 3072]
    - [8, 11821.0]
  - - [6272, 256, 1, 528, 6272, 6272, 6272, 528]
    - [1, 11319.0]
  - - [3136, 2048, 1, 1024, 3136, 3136, 3136, 1024]
    - [23, 12041.0]
  - - [50176, 128, 1, 256, 50176, 50176, 50176, 256]
    - [3, 11556.0]
  - - [12544, 1024, 1, 256, 12544, 12544, 12544, 256]
    - [8, 11954.0]
  - - [12544, 256, 1, 1024, 12544, 12544, 12544, 1024]
    - [1, 11845.0]
  - - [3136, 512, 1, 1024, 3136, 3136, 3136, 1024]
    - [2, 11057.0]
  - - [3136, 2048, 1, 512, 3136, 3136, 3136, 512]
    - [1, 11793.0]
  - - [289, 384, 32, 1024, 289, 289, 289, 1024]
    - [11, 8655.0]
  - - [4096, 512, 1, 4096, 4096, 4096, 4096, 4096]
    - [16, 11464.0]
  - - [50176, 512, 1, 256, 50176, 50176, 50176, 256]
    - [3, 12228.0]
  - - [12544, 1024, 1, 512, 12544, 12544, 12544, 512]
    - [1, 12221.0]
  - - [12544, 256, 1, 512, 12544, 12544, 12544, 512]
    - [1, 11761.0]
  - - [784, 128, 32, 256, 784, 784, 784, 256]
    - [0, 9647.0]
  - - [4096, 512, 1, 9216, 4096, 4096, 4096, 9216]
    - [22, 11356.0]
  - - [3136, 512, 1, 2048, 3136, 3136, 3136, 2048]
    - [2, 11450.0]
  - - [1225, 192, 32, 384, 1225, 1225, 1225, 384]
    - [16, 11023.0]
  - - [8192, 320, 1, 1280, 8192, 8192, 8192, 1280]
    - [16, 11545.0]
  - - [8192, 320, 1, 2048, 8192, 8192, 8192, 2048]
    - [16, 11635.0]
  - - [8192, 384, 1, 1280, 8192, 8192, 8192, 1280]
    - [1, 11696.0]
  - - [8192, 384, 1, 2048, 8192, 8192, 8192, 2048]
    - [1, 11746.0]
  - - [8192, 448, 1, 2048, 8192, 8192, 8192, 2048]
    - [16, 11485.0]
  - - [8192, 448, 1, 1280, 8192, 8192, 8192, 1280]
    - [16, 11467.0]
  - - [256, 6400, 1, 4096, 256, 256, 256, 4096]
    - [11, 11474.0]
  - - [512, 3433, 1, 2048, 512, 512, 512, 2048]
    - [7, 11162.0]
  - - [512, 3439, 1, 2048, 512, 512, 512, 2048]
    - [22, 10904.0]
  - - [512, 3461, 1, 2048, 512, 512, 512, 2048]
    - [7, 10944.0]
  - - [512, 3479, 1, 2048, 512, 512, 512, 2048]
    - [22, 11094.0]
  - - [512, 3494, 1, 2048, 512, 512, 512, 2048]
    - [7, 11093.0]
  - - [512, 3520, 1, 2048, 512, 512, 512, 2048]
    - [7, 11240.0]
  - - [512, 3530, 1, 2048, 512, 512, 512, 2048]
    - [28, 10767.0]
  - - [512, 3541, 1, 2048, 512, 512, 512, 2048]
    - [13, 10767.0]
  - - [512, 3564, 1, 2048, 512, 512, 512, 2048]
    - [23, 10806.0]
  - - [512, 3776, 1, 2048, 512, 512, 512, 2048]
    - [41, 11382.0]
  - - [512, 3859, 1, 512, 512, 512, 512, 512]
    - [36, 10100.0]
  - - [512, 3925, 1, 2048, 512, 512, 512, 2048]
    - [36, 10702.0]
  - - [512, 3944, 1, 2048, 512, 512, 512, 2048]
    - [22, 10730.0]
  - - [512, 3955, 1, 2048, 512, 512, 512, 2048]
    - [22, 10726.0]
  - - [512, 3969, 1, 2048, 512, 512, 512, 2048]
    - [22, 10805.0]
  - - [512, 3976, 1, 2048, 512, 512, 512, 2048]
    - [7, 10835.0]
  - - [2048, 1232, 1, 512, 2048, 2048, 2048, 512]
    - [16, 10664.0]
  - - [2048, 3165, 1, 512, 2048, 2048, 2048, 512]
    - [11, 11720.0]
  - - [512, 2387, 1, 512, 512, 512, 512, 512]
    - [9, 10151.0]
  - - [512, 2418, 1, 512, 512, 512, 512, 512]
    - [9, 10214.0]
  - - [512, 2418, 1, 2048, 512, 512, 512, 2048]
    - [28, 10722.0]
  - - [512, 2496, 1, 512, 512, 512, 512, 512]
    - [22, 10233.0]
  - - [512, 2496, 1, 2048, 512, 512, 512, 2048]
    - [28, 11023.0]
  - - [512, 2790, 1, 2048, 512, 512, 512, 2048]
    - [7, 10530.0]
  - - [512, 2864, 1, 2048, 512, 512, 512, 2048]
    - [7, 10831.0]
  - - [512, 3092, 1, 2048, 512, 512, 512, 2048]
    - [8, 10990.0]
  - - [512, 3113, 1, 2048, 512, 512, 512, 2048]
    - [8, 11097.0]
  - - [512, 3137, 1, 2048, 512, 512, 512, 2048]
    - [8, 11120.0]
  - - [512, 3165, 1, 2048, 512, 512, 512, 2048]
    - [8, 11204.0]
  - - [512, 3166, 1, 2048, 512, 512, 512, 2048]
    - [8, 11219.0]
  - - [512, 3194, 1, 2048, 512, 512, 512, 2048]
    - [8, 11286.0]
  - - [512, 3219, 1, 2048, 512, 512, 512, 2048]
    - [7, 10318.0]
  - - [512, 3222, 1, 2048, 512, 512, 512, 2048]
    - [7, 10378.0]
  - - [512, 3234, 1, 2048, 512, 512, 512, 2048]
    - [7, 10306.0]
  - - [512, 3237, 1, 2048, 512, 512, 512, 2048]
    - [7, 10334.0]
  - - [512, 3242, 1, 2048, 512, 512, 512, 2048]
    - [22, 10316.0]
  - - [512, 3246, 1, 2048, 512, 512, 512, 2048]
    - [7, 10390.0]
  - - [512, 3249, 1, 2048, 512, 512, 512, 2048]
    - [7, 10316.0]
  - - [512, 3251, 1, 2048, 512, 512, 512, 2048]
    - [7, 10336.0]
  - - [512, 3257, 1, 2048, 512, 512, 512, 2048]
    - [7, 10386.0]
  - - [512, 3262, 1, 2048, 512, 512, 512, 2048]
    - [22, 10393.0]
  - - [512, 3268, 1, 2048, 512, 512, 512, 2048]
    - [22, 10343.0]
  - - [512, 3282, 1, 2048, 512, 512, 512, 2048]
    - [7, 10449.0]
  - - [512, 3286, 1, 2048, 512, 512, 512, 2048]
    - [7, 10499.0]
  - - [512, 3287, 1, 2048, 512, 512, 512, 2048]
    - [7, 10472.0]
  - - [512, 3293, 1, 2048, 512, 512, 512, 2048]
    - [22, 10457.0]
  - - [512, 3297, 1, 2048, 512, 512, 512, 2048]
    - [7, 10517.0]
  - - [512, 3307, 1, 2048, 512, 512, 512, 2048]
    - [7, 10566.0]
  - - [512, 3314, 1, 2048, 512, 512, 512, 2048]
    - [22, 10599.0]
  - - [512, 3315, 1, 2048, 512, 512, 512, 2048]
    - [7, 10529.0]
  - - [512, 3319, 1, 2048, 512, 512, 512, 2048]
    - [7, 10598.0]
  - - [512, 3322, 1, 2048, 512, 512, 512, 2048]
    - [22, 10574.0]
  - - [512, 3323, 1, 2048, 512, 512, 512, 2048]
    - [22, 10577.0]
  - - [512, 3324, 1, 2048, 512, 512, 512, 2048]
    - [7, 10599.0]
  - - [512, 3325, 1, 2048, 512, 512, 512, 2048]
    - [22, 10768.0]
  - - [512, 3327, 1, 2048, 512, 512, 512, 2048]
    - [22, 10644.0]
  - - [512, 3329, 1, 2048, 512, 512, 512, 2048]
    - [7, 10656.0]
  - - [512, 3332, 1, 2048, 512, 512, 512, 2048]
    - [36, 10796.0]
  - - [512, 3336, 1, 2048, 512, 512, 512, 2048]
    - [22, 10568.0]
  - - [512, 3339, 1, 2048, 512, 512, 512, 2048]
    - [7, 10623.0]
  - - [512, 3342, 1, 2048, 512, 512, 512, 2048]
    - [36, 10875.0]
  - - [512, 3344, 1, 2048, 512, 512, 512, 2048]
    - [7, 10798.0]
  - - [512, 3358, 1, 2048, 512, 512, 512, 2048]
    - [22, 10680.0]
  - - [512, 3360, 1, 2048, 512, 512, 512, 2048]
    - [22, 10781.0]
  - - [512, 3364, 1, 2048, 512, 512, 512, 2048]
    - [22, 10774.0]
  - - [512, 3365, 1, 2048, 512, 512, 512, 2048]
    - [7, 10759.0]
  - - [512, 3369, 1, 2048, 512, 512, 512, 2048]
    - [7, 10802.0]
  - - [512, 3370, 1, 2048, 512, 512, 512, 2048]
    - [7, 10756.0]
  - - [512, 3371, 1, 2048, 512, 512, 512, 2048]
    - [7, 10768.0]
  - - [512, 3374, 1, 2048, 512, 512, 512, 2048]
    - [7, 10800.0]
  - - [512, 3376, 1, 2048, 512, 512, 512, 2048]
    - [22, 10812.0]
  - - [512, 3377, 1, 2048, 512, 512, 512, 2048]
    - [36, 10764.0]
  - - [512, 3378, 1, 2048, 512, 512, 512, 2048]
    - [22, 10799.0]
  - - [512, 3381, 1, 2048, 512, 512, 512, 2048]
    - [22, 10756.0]
  - - [512, 3382, 1, 2048, 512, 512, 512, 2048]
    - [7, 10806.0]
  - - [512, 3383, 1, 2048, 512, 512, 512, 2048]
    - [36, 10718.0]
  - - [512, 3384, 1, 2048, 512, 512, 512, 2048]
    - [36, 10833.0]
  - - [512, 3385, 1, 2048, 512, 512, 512, 2048]
    - [7, 10811.0]
  - - [512, 3386, 1, 2048, 512, 512, 512, 2048]
    - [7, 10818.0]
  - - [512, 3388, 1, 2048, 512, 512, 512, 2048]
    - [7, 10763.0]
  - - [512, 3390, 1, 2048, 512, 512, 512, 2048]
    - [22, 10821.0]
  - - [512, 3391, 1, 2048, 512, 512, 512, 2048]
    - [36, 10820.0]
  - - [512, 3396, 1, 2048, 512, 512, 512, 2048]
    - [7, 10849.0]
  - - [512, 3399, 1, 2048, 512, 512, 512, 2048]
    - [7, 10868.0]
  - - [512, 3402, 1, 2048, 512, 512, 512, 2048]
    - [22, 10852.0]
  - - [512, 3410, 1, 2048, 512, 512, 512, 2048]
    - [7, 10854.0]
  - - [512, 3412, 1, 2048, 512, 512, 512, 2048]
    - [22, 10903.0]
  - - [512, 3414, 1, 2048, 512, 512, 512, 2048]
    - [22, 10898.0]
  - - [512, 3415, 1, 2048, 512, 512, 512, 2048]
    - [22, 10904.0]
  - - [512, 3418, 1, 2048, 512, 512, 512, 2048]
    - [7, 10852.0]
  - - [512, 3420, 1, 2048, 512, 512, 512, 2048]
    - [7, 10919.0]
  - - [512, 3422, 1, 2048, 512, 512, 512, 2048]
    - [7, 10917.0]
  - - [512, 3425, 1, 2048, 512, 512, 512, 2048]
    - [36, 10872.0]
  - - [512, 3426, 1, 2048, 512, 512, 512, 2048]
    - [36, 10840.0]
  - - [512, 3427, 1, 2048, 512, 512, 512, 2048]
    - [7, 10961.0]
  - - [512, 3428, 1, 2048, 512, 512, 512, 2048]
    - [7, 10936.0]
  - - [512, 3430, 1, 2048, 512, 512, 512, 2048]
    - [7, 10822.0]
  - - [512, 3431, 1, 2048, 512, 512, 512, 2048]
    - [36, 10813.0]
  - - [512, 3432, 1, 2048, 512, 512, 512, 2048]
    - [36, 10771.0]
  - - [512, 3438, 1, 2048, 512, 512, 512, 2048]
    - [7, 10982.0]
  - - [512, 3440, 1, 2048, 512, 512, 512, 2048]
    - [7, 10945.0]
  - - [512, 3443, 1, 2048, 512, 512, 512, 2048]
    - [7, 10908.0]
  - - [512, 3445, 1, 2048, 512, 512, 512, 2048]
    - [22, 10935.0]
  - - [512, 3447, 1, 2048, 512, 512, 512, 2048]
    - [22, 10990.0]
  - - [512, 3448, 1, 2048, 512, 512, 512, 2048]
    - [7, 10926.0]
  - - [512, 3450, 1, 2048, 512, 512, 512, 2048]
    - [22, 10996.0]
  - - [512, 3451, 1, 2048, 512, 512, 512, 2048]
    - [7, 11005.0]
  - - [512, 3452, 1, 2048, 512, 512, 512, 2048]
    - [7, 11042.0]
  - - [512, 3453, 1, 2048, 512, 512, 512, 2048]
    - [22, 10969.0]
  - - [512, 3455, 1, 2048, 512, 512, 512, 2048]
    - [22, 10994.0]
  - - [512, 3456, 1, 2048, 512, 512, 512, 2048]
    - [22, 11025.0]
  - - [512, 3457, 1, 2048, 512, 512, 512, 2048]
    - [22, 10904.0]
  - - [512, 3458, 1, 2048, 512, 512, 512, 2048]
    - [7, 10965.0]
  - - [512, 3459, 1, 2048, 512, 512, 512, 2048]
    - [7, 10999.0]
  - - [512, 3460, 1, 2048, 512, 512, 512, 2048]
    - [7, 11022.0]
  - - [512, 3462, 1, 2048, 512, 512, 512, 2048]
    - [7, 10966.0]
  - - [512, 3466, 1, 2048, 512, 512, 512, 2048]
    - [7, 10987.0]
  - - [512, 3467, 1, 2048, 512, 512, 512, 2048]
    - [7, 10967.0]
  - - [512, 3468, 1, 2048, 512, 512, 512, 2048]
    - [22, 10996.0]
  - - [512, 3470, 1, 2048, 512, 512, 512, 2048]
    - [7, 10999.0]
  - - [512, 3471, 1, 2048, 512, 512, 512, 2048]
    - [7, 11001.0]
  - - [512, 3472, 1, 2048, 512, 512, 512, 2048]
    - [7, 10960.0]
  - - [512, 3475, 1, 2048, 512, 512, 512, 2048]
    - [7, 10970.0]
  - - [512, 3476, 1, 2048, 512, 512, 512, 2048]
    - [7, 11014.0]
  - - [512, 3477, 1, 2048, 512, 512, 512, 2048]
    - [7, 11036.0]
  - - [512, 3478, 1, 2048, 512, 512, 512, 2048]
    - [7, 11012.0]
  - - [512, 3480, 1, 2048, 512, 512, 512, 2048]
    - [36, 10949.0]
  - - [512, 3481, 1, 2048, 512, 512, 512, 2048]
    - [7, 10986.0]
  - - [512, 3483, 1, 2048, 512, 512, 512, 2048]
    - [22, 11049.0]
  - - [512, 3484, 1, 2048, 512, 512, 512, 2048]
    - [7, 11074.0]
  - - [512, 3487, 1, 2048, 512, 512, 512, 2048]
    - [7, 11065.0]
  - - [512, 3489, 1, 2048, 512, 512, 512, 2048]
    - [22, 11032.0]
  - - [512, 3490, 1, 2048, 512, 512, 512, 2048]
    - [7, 11049.0]
  - - [512, 3491, 1, 2048, 512, 512, 512, 2048]
    - [22, 11037.0]
  - - [512, 3493, 1, 2048, 512, 512, 512, 2048]
    - [22, 10982.0]
  - - [512, 3495, 1, 2048, 512, 512, 512, 2048]
    - [7, 11079.0]
  - - [512, 3497, 1, 2048, 512, 512, 512, 2048]
    - [7, 11065.0]
  - - [512, 3498, 1, 2048, 512, 512, 512, 2048]
    - [7, 11075.0]
  - - [512, 3499, 1, 2048, 512, 512, 512, 2048]
    - [7, 11060.0]
  - - [512, 3501, 1, 2048, 512, 512, 512, 2048]
    - [7, 11100.0]
  - - [512, 3503, 1, 2048, 512, 512, 512, 2048]
    - [22, 11059.0]
  - - [512, 3505, 1, 2048, 512, 512, 512, 2048]
    - [7, 11084.0]
  - - [512, 3507, 1, 2048, 512, 512, 512, 2048]
    - [7, 11031.0]
  - - [512, 3508, 1, 2048, 512, 512, 512, 2048]
    - [7, 11073.0]
  - - [512, 3509, 1, 2048, 512, 512, 512, 2048]
    - [7, 11030.0]
  - - [512, 3510, 1, 2048, 512, 512, 512, 2048]
    - [7, 11179.0]
  - - [512, 3511, 1, 2048, 512, 512, 512, 2048]
    - [7, 11197.0]
  - - [512, 3513, 1, 2048, 512, 512, 512, 2048]
    - [22, 11200.0]
  - - [512, 3514, 1, 2048, 512, 512, 512, 2048]
    - [7, 11238.0]
  - - [512, 3515, 1, 2048, 512, 512, 512, 2048]
    - [22, 11201.0]
  - - [512, 3517, 1, 2048, 512, 512, 512, 2048]
    - [7, 11154.0]
  - - [512, 3518, 1, 2048, 512, 512, 512, 2048]
    - [7, 11204.0]
  - - [512, 3519, 1, 2048, 512, 512, 512, 2048]
    - [22, 11193.0]
  - - [512, 3523, 1, 2048, 512, 512, 512, 2048]
    - [41, 10733.0]
  - - [512, 3528, 1, 2048, 512, 512, 512, 2048]
    - [41, 10735.0]
  - - [512, 3529, 1, 2048, 512, 512, 512, 2048]
    - [23, 10729.0]
  - - [512, 3531, 1, 2048, 512, 512, 512, 2048]
    - [8, 10789.0]
  - - [512, 3532, 1, 2048, 512, 512, 512, 2048]
    - [41, 10781.0]
  - - [512, 3533, 1, 2048, 512, 512, 512, 2048]
    - [23, 10736.0]
  - - [512, 3534, 1, 2048, 512, 512, 512, 2048]
    - [8, 10743.0]
  - - [512, 3538, 1, 2048, 512, 512, 512, 2048]
    - [28, 10722.0]
  - - [512, 3539, 1, 2048, 512, 512, 512, 2048]
    - [23, 10849.0]
  - - [512, 3540, 1, 2048, 512, 512, 512, 2048]
    - [28, 10725.0]
  - - [512, 3547, 1, 2048, 512, 512, 512, 2048]
    - [37, 10696.0]
  - - [512, 3548, 1, 2048, 512, 512, 512, 2048]
    - [8, 10757.0]
  - - [512, 3552, 1, 2048, 512, 512, 512, 2048]
    - [8, 10753.0]
  - - [512, 3575, 1, 2048, 512, 512, 512, 2048]
    - [13, 10812.0]
  - - [512, 3598, 1, 2048, 512, 512, 512, 2048]
    - [28, 10951.0]
  - - [512, 3599, 1, 2048, 512, 512, 512, 2048]
    - [28, 10934.0]
  - - [512, 3608, 1, 2048, 512, 512, 512, 2048]
    - [13, 10941.0]
  - - [512, 3776, 1, 512, 512, 512, 512, 512]
    - [7, 10341.0]
  - - [512, 3780, 1, 512, 512, 512, 512, 512]
    - [36, 10411.0]
  - - [512, 3780, 1, 2048, 512, 512, 512, 2048]
    - [23, 11406.0]
  - - [512, 3780, 1, 33708, 512, 512, 512, 33708]
    - [5, 12073.0]
  - - [512, 3796, 1, 512, 512, 512, 512, 512]
    - [9, 10861.0]
  - - [512, 3796, 1, 2048, 512, 512, 512, 2048]
    - [8, 11711.0]
  - - [512, 3796, 1, 33708, 512, 512, 512, 33708]
    - [5, 12122.0]
  - - [512, 3822, 1, 512, 512, 512, 512, 512]
    - [9, 10879.0]
  - - [512, 3822, 1, 2048, 512, 512, 512, 2048]
    - [8, 11734.0]
  - - [512, 3822, 1, 33708, 512, 512, 512, 33708]
    - [5, 12199.0]
  - - [512, 3835, 1, 512, 512, 512, 512, 512]
    - [9, 10927.0]
  - - [512, 3835, 1, 2048, 512, 512, 512, 2048]
    - [8, 11746.0]
  - - [512, 3840, 1, 512, 512, 512, 512, 512]
    - [7, 11197.0]
  - - [512, 3840, 1, 2048, 512, 512, 512, 2048]
    - [28, 11648.0]
  - - [512, 3840, 1, 33708, 512, 512, 512, 33708]
    - [5, 12260.0]
  - - [512, 3859, 1, 2048, 512, 512, 512, 2048]
    - [36, 10774.0]
  - - [512, 3859, 1, 33708, 512, 512, 512, 33708]
    - [30, 10894.0]
  - - [512, 3864, 1, 512, 512, 512, 512, 512]
    - [36, 10402.0]
  - - [512, 3864, 1, 2048, 512, 512, 512, 2048]
    - [22, 10786.0]
  - - [512, 3870, 1, 512, 512, 512, 512, 512]
    - [36, 10522.0]
  - - [512, 3870, 1, 2048, 512, 512, 512, 2048]
    - [36, 10810.0]
  - - [512, 3870, 1, 33708, 512, 512, 512, 33708]
    - [30, 10913.0]
  - - [512, 3876, 1, 512, 512, 512, 512, 512]
    - [36, 10451.0]
  - - [512, 3876, 1, 2048, 512, 512, 512, 2048]
    - [22, 10827.0]
  - - [512, 3876, 1, 33708, 512, 512, 512, 33708]
    - [30, 10932.0]
  - - [512, 3906, 1, 512, 512, 512, 512, 512]
    - [36, 10513.0]
  - - [512, 3906, 1, 2048, 512, 512, 512, 2048]
    - [7, 10901.0]
  - - [512, 3906, 1, 33708, 512, 512, 512, 33708]
    - [30, 10986.0]
  - - [512, 3910, 1, 512, 512, 512, 512, 512]
    - [36, 10487.0]
  - - [512, 3910, 1, 2048, 512, 512, 512, 2048]
    - [22, 10863.0]
  - - [512, 3910, 1, 33708, 512, 512, 512, 33708]
    - [36, 10991.0]
  - - [512, 3925, 1, 512, 512, 512, 512, 512]
    - [36, 10579.0]
  - - [512, 3925, 1, 33708, 512, 512, 512, 33708]
    - [36, 11037.0]
  - - [512, 3927, 1, 512, 512, 512, 512, 512]
    - [36, 10565.0]
  - - [512, 3942, 1, 512, 512, 512, 512, 512]
    - [36, 10660.0]
  - - [512, 3942, 1, 2048, 512, 512, 512, 2048]
    - [36, 11009.0]
  - - [512, 3942, 1, 33708, 512, 512, 512, 33708]
    - [30, 11065.0]
  - - [512, 3944, 1, 512, 512, 512, 512, 512]
    - [36, 10619.0]
  - - [512, 3944, 1, 33708, 512, 512, 512, 33708]
    - [30, 11088.0]
  - - [512, 3955, 1, 512, 512, 512, 512, 512]
    - [36, 10618.0]
  - - [512, 3955, 1, 33708, 512, 512, 512, 33708]
    - [30, 11125.0]
  - - [512, 3968, 1, 512, 512, 512, 512, 512]
    - [7, 10824.0]
  - - [512, 3968, 1, 2048, 512, 512, 512, 2048]
    - [36, 11047.0]
  - - [512, 3968, 1, 33708, 512, 512, 512, 33708]
    - [30, 11153.0]
  - - [512, 3969, 1, 512, 512, 512, 512, 512]
    - [36, 10656.0]
  - - [512, 3969, 1, 33708, 512, 512, 512, 33708]
    - [30, 11158.0]
  - - [512, 3976, 1, 512, 512, 512, 512, 512]
    - [36, 10723.0]
  - - [512, 3976, 1, 33708, 512, 512, 512, 33708]
    - [30, 11155.0]
  - - [512, 3977, 1, 512, 512, 512, 512, 512]
    - [36, 10697.0]
  - - [512, 3977, 1, 2048, 512, 512, 512, 2048]
    - [22, 11093.0]
  - - [512, 3977, 1, 33708, 512, 512, 512, 33708]
    - [30, 11175.0]
  - - [512, 3978, 1, 512, 512, 512, 512, 512]
    - [36, 10788.0]
  - - [512, 3978, 1, 2048, 512, 512, 512, 2048]
    - [22, 11061.0]
  - - [512, 3978, 1, 33708, 512, 512, 512, 33708]
    - [30, 11184.0]
  - - [512, 3990, 1, 512, 512, 512, 512, 512]
    - [36, 10726.0]
  - - [512, 3990, 1, 2048, 512, 512, 512, 2048]
    - [22, 11078.0]
  - - [512, 3990, 1, 33708, 512, 512, 512, 33708]
    - [30, 11212.0]
  - - [512, 3995, 1, 512, 512, 512, 512, 512]
    - [36, 10746.0]
  - - [512, 3995, 1, 2048, 512, 512, 512, 2048]
    - [36, 11138.0]
  - - [512, 3995, 1, 33708, 512, 512, 512, 33708]
    - [30, 11230.0]
  - - [512, 3996, 1, 512, 512, 512, 512, 512]
    - [36, 10748.0]
  - - [512, 3996, 1, 2048, 512, 512, 512, 2048]
    - [36, 11140.0]
  - - [512, 3996, 1, 33708, 512, 512, 512, 33708]
    - [30, 11235.0]
  - - [512, 3999, 1, 512, 512, 512, 512, 512]
    - [36, 10710.0]
  - - [512, 3999, 1, 2048, 512, 512, 512, 2048]
    - [7, 11129.0]
  - - [512, 3999, 1, 33708, 512, 512, 512, 33708]
    - [30, 11243.0]
  - - [512, 4005, 1, 512, 512, 512, 512, 512]
    - [36, 10757.0]
  - - [512, 4005, 1, 2048, 512, 512, 512, 2048]
    - [22, 11166.0]
  - - [512, 4005, 1, 33708, 512, 512, 512, 33708]
    - [30, 11251.0]
  - - [512, 4012, 1, 512, 512, 512, 512, 512]
    - [36, 10734.0]
  - - [512, 4012, 1, 2048, 512, 512, 512, 2048]
    - [36, 11192.0]
  - - [512, 4012, 1, 33708, 512, 512, 512, 33708]
    - [30, 11275.0]
  - - [512, 4020, 1, 512, 512, 512, 512, 512]
    - [36, 10777.0]
  - - [512, 4020, 1, 2048, 512, 512, 512, 2048]
    - [7, 11213.0]
  - - [512, 4020, 1, 33708, 512, 512, 512, 33708]
    - [30, 11295.0]
  - - [512, 4026, 1, 512, 512, 512, 512, 512]
    - [36, 10754.0]
  - - [512, 4026, 1, 2048, 512, 512, 512, 2048]
    - [7, 11211.0]
  - - [512, 4026, 1, 33708, 512, 512, 512, 33708]
    - [30, 11308.0]
  - - [512, 4030, 1, 512, 512, 512, 512, 512]
    - [36, 10754.0]
  - - [512, 4030, 1, 2048, 512, 512, 512, 2048]
    - [22, 11235.0]
  - - [512, 4030, 1, 33708, 512, 512, 512, 33708]
    - [30, 11330.0]
  - - [512, 4032, 1, 512, 512, 512, 512, 512]
    - [7, 10983.0]
  - - [512, 4032, 1, 2048, 512, 512, 512, 2048]
    - [7, 11234.0]
  - - [512, 4032, 1, 33708, 512, 512, 512, 33708]
    - [30, 11337.0]
  - - [512, 4050, 1, 512, 512, 512, 512, 512]
    - [36, 10836.0]
  - - [512, 4059, 1, 512, 512, 512, 512, 512]
    - [36, 10911.0]
  - - [2048, 644, 1, 512, 2048, 2048, 2048, 512]
    - [16, 9787.0]
  - - [2048, 668, 1, 512, 2048, 2048, 2048, 512]
    - [16, 10073.0]
  - - [2048, 714, 1, 512, 2048, 2048, 2048, 512]
    - [30, 8864.0]
  - - [2048, 720, 1, 512, 2048, 2048, 2048, 512]
    - [30, 10013.0]
  - - [2048, 722, 1, 512, 2048, 2048, 2048, 512]
    - [30, 10078.0]
  - - [2048, 781, 1, 512, 2048, 2048, 2048, 512]
    - [0, 9975.0]
  - - [2048, 848, 1, 512, 2048, 2048, 2048, 512]
    - [0, 10007.0]
  - - [2048, 872, 1, 512, 2048, 2048, 2048, 512]
    - [0, 10251.0]
  - - [2048, 936, 1, 512, 2048, 2048, 2048, 512]
    - [30, 9928.0]
  - - [2048, 980, 1, 512, 2048, 2048, 2048, 512]
    - [16, 9634.0]
  - - [2048, 1139, 1, 512, 2048, 2048, 2048, 512]
    - [16, 9587.0]
  - - [2048, 1184, 1, 512, 2048, 2048, 2048, 512]
    - [33, 9736.0]
  - - [2048, 1186, 1, 512, 2048, 2048, 2048, 512]
    - [16, 9981.0]
  - - [2048, 1279, 1, 512, 2048, 2048, 2048, 512]
    - [16, 11323.0]
  - - [2048, 1290, 1, 512, 2048, 2048, 2048, 512]
    - [30, 10780.0]
  - - [2048, 1327, 1, 512, 2048, 2048, 2048, 512]
    - [30, 11049.0]
  - - [2048, 1331, 1, 512, 2048, 2048, 2048, 512]
    - [30, 11010.0]
  - - [2048, 1341, 1, 512, 2048, 2048, 2048, 512]
    - [30, 11060.0]
  - - [2048, 1350, 1, 512, 2048, 2048, 2048, 512]
    - [16, 10718.0]
  - - [2048, 1359, 1, 512, 2048, 2048, 2048, 512]
    - [16, 10784.0]
  - - [2048, 1391, 1, 512, 2048, 2048, 2048, 512]
    - [16, 11031.0]
  - - [2048, 1424, 1, 512, 2048, 2048, 2048, 512]
    - [16, 10772.0]
  - - [2048, 1458, 1, 512, 2048, 2048, 2048, 512]
    - [16, 10996.0]
  - - [2048, 1462, 1, 512, 2048, 2048, 2048, 512]
    - [16, 11010.0]
  - - [2048, 1467, 1, 512, 2048, 2048, 2048, 512]
    - [16, 11044.0]
  - - [2048, 1472, 1, 512, 2048, 2048, 2048, 512]
    - [16, 11173.0]
  - - [2048, 1520, 1, 512, 2048, 2048, 2048, 512]
    - [3, 11012.0]
  - - [2048, 1596, 1, 512, 2048, 2048, 2048, 512]
    - [16, 11295.0]
  - - [2048, 1599, 1, 512, 2048, 2048, 2048, 512]
    - [16, 11279.0]
  - - [2048, 1615, 1, 512, 2048, 2048, 2048, 512]
    - [16, 11061.0]
  - - [2048, 1680, 1, 512, 2048, 2048, 2048, 512]
    - [16, 10994.0]
  - - [2048, 1709, 1, 512, 2048, 2048, 2048, 512]
    - [0, 11164.0]
  - - [2048, 1902, 1, 512, 2048, 2048, 2048, 512]
    - [20, 11364.0]
  - - [2048, 1917, 1, 512, 2048, 2048, 2048, 512]
    - [30, 11441.0]
  - - [2048, 2076, 1, 512, 2048, 2048, 2048, 512]
    - [16, 11134.0]
  - - [2048, 2195, 1, 512, 2048, 2048, 2048, 512]
    - [16, 11347.0]
  - - [2048, 2205, 1, 512, 2048, 2048, 2048, 512]
    - [16, 11436.0]
  - - [2048, 2418, 1, 512, 2048, 2048, 2048, 512]
    - [16, 11322.0]
  - - [2048, 2496, 1, 512, 2048, 2048, 2048, 512]
    - [16, 11426.0]
  - - [2048, 2790, 1, 512, 2048, 2048, 2048, 512]
    - [3, 11532.0]
  - - [2048, 2864, 1, 512, 2048, 2048, 2048, 512]
    - [16, 11511.0]
  - - [2048, 3092, 1, 512, 2048, 2048, 2048, 512]
    - [3, 11588.0]
  - - [2048, 3113, 1, 512, 2048, 2048, 2048, 512]
    - [3, 11634.0]
  - - [2048, 3137, 1, 512, 2048, 2048, 2048, 512]
    - [3, 11693.0]
  - - [2048, 3166, 1, 512, 2048, 2048, 2048, 512]
    - [3, 11737.0]
  - - [2048, 3194, 1, 512, 2048, 2048, 2048, 512]
    - [11, 11807.0]
  - - [2048, 3219, 1, 512, 2048, 2048, 2048, 512]
    - [16, 11504.0]
  - - [2048, 3222, 1, 512, 2048, 2048, 2048, 512]
    - [16, 11527.0]
  - - [2048, 3234, 1, 512, 2048, 2048, 2048, 512]
    - [16, 11552.0]
  - - [2048, 3237, 1, 512, 2048, 2048, 2048, 512]
    - [16, 11556.0]
  - - [2048, 3242, 1, 512, 2048, 2048, 2048, 512]
    - [16, 11597.0]
  - - [2048, 3246, 1, 512, 2048, 2048, 2048, 512]
    - [3, 11596.0]
  - - [2048, 3249, 1, 512, 2048, 2048, 2048, 512]
    - [3, 11635.0]
  - - [2048, 3251, 1, 512, 2048, 2048, 2048, 512]
    - [3, 11590.0]
  - - [2048, 3257, 1, 512, 2048, 2048, 2048, 512]
    - [3, 11601.0]
  - - [2048, 3262, 1, 512, 2048, 2048, 2048, 512]
    - [16, 11612.0]
  - - [2048, 3268, 1, 512, 2048, 2048, 2048, 512]
    - [3, 11714.0]
  - - [2048, 3282, 1, 512, 2048, 2048, 2048, 512]
    - [3, 11702.0]
  - - [2048, 3286, 1, 512, 2048, 2048, 2048, 512]
    - [3, 11693.0]
  - - [2048, 3287, 1, 512, 2048, 2048, 2048, 512]
    - [3, 11719.0]
  - - [2048, 3293, 1, 512, 2048, 2048, 2048, 512]
    - [3, 11734.0]
  - - [2048, 3297, 1, 512, 2048, 2048, 2048, 512]
    - [1, 11710.0]
  - - [2048, 3307, 1, 512, 2048, 2048, 2048, 512]
    - [3, 11752.0]
  - - [2048, 3314, 1, 512, 2048, 2048, 2048, 512]
    - [3, 11763.0]
  - - [2048, 3315, 1, 512, 2048, 2048, 2048, 512]
    - [3, 11794.0]
  - - [2048, 3319, 1, 512, 2048, 2048, 2048, 512]
    - [3, 11814.0]
  - - [2048, 3322, 1, 512, 2048, 2048, 2048, 512]
    - [1, 11766.0]
  - - [2048, 3323, 1, 512, 2048, 2048, 2048, 512]
    - [3, 11778.0]
  - - [2048, 3324, 1, 512, 2048, 2048, 2048, 512]
    - [11, 11765.0]
  - - [2048, 3325, 1, 512, 2048, 2048, 2048, 512]
    - [3, 11774.0]
  - - [2048, 3327, 1, 512, 2048, 2048, 2048, 512]
    - [3, 11788.0]
  - - [2048, 3329, 1, 512, 2048, 2048, 2048, 512]
    - [3, 11447.0]
  - - [2048, 3332, 1, 512, 2048, 2048, 2048, 512]
    - [3, 11468.0]
  - - [2048, 3336, 1, 512, 2048, 2048, 2048, 512]
    - [3, 11468.0]
  - - [2048, 3339, 1, 512, 2048, 2048, 2048, 512]
    - [3, 11479.0]
  - - [2048, 3342, 1, 512, 2048, 2048, 2048, 512]
    - [3, 11496.0]
  - - [2048, 3344, 1, 512, 2048, 2048, 2048, 512]
    - [3, 11507.0]
  - - [2048, 3358, 1, 512, 2048, 2048, 2048, 512]
    - [3, 11530.0]
  - - [2048, 3360, 1, 512, 2048, 2048, 2048, 512]
    - [3, 11564.0]
  - - [2048, 3364, 1, 512, 2048, 2048, 2048, 512]
    - [3, 11570.0]
  - - [2048, 3365, 1, 512, 2048, 2048, 2048, 512]
    - [3, 11566.0]
  - - [2048, 3369, 1, 512, 2048, 2048, 2048, 512]
    - [3, 11588.0]
  - - [2048, 3370, 1, 512, 2048, 2048, 2048, 512]
    - [3, 11600.0]
  - - [2048, 3371, 1, 512, 2048, 2048, 2048, 512]
    - [1, 11582.0]
  - - [2048, 3374, 1, 512, 2048, 2048, 2048, 512]
    - [3, 11591.0]
  - - [2048, 3376, 1, 512, 2048, 2048, 2048, 512]
    - [3, 11602.0]
  - - [2048, 3377, 1, 512, 2048, 2048, 2048, 512]
    - [3, 11607.0]
  - - [2048, 3378, 1, 512, 2048, 2048, 2048, 512]
    - [3, 11615.0]
  - - [2048, 3381, 1, 512, 2048, 2048, 2048, 512]
    - [3, 11637.0]
  - - [2048, 3382, 1, 512, 2048, 2048, 2048, 512]
    - [3, 11610.0]
  - - [2048, 3383, 1, 512, 2048, 2048, 2048, 512]
    - [3, 11599.0]
  - - [2048, 3384, 1, 512, 2048, 2048, 2048, 512]
    - [3, 11642.0]
  - - [2048, 3385, 1, 512, 2048, 2048, 2048, 512]
    - [3, 11639.0]
  - - [2048, 3386, 1, 512, 2048, 2048, 2048, 512]
    - [3, 11633.0]
  - - [2048, 3388, 1, 512, 2048, 2048, 2048, 512]
    - [3, 11637.0]
  - - [2048, 3390, 1, 512, 2048, 2048, 2048, 512]
    - [1, 11646.0]
  - - [2048, 3391, 1, 512, 2048, 2048, 2048, 512]
    - [3, 11659.0]
  - - [2048, 3396, 1, 512, 2048, 2048, 2048, 512]
    - [3, 11684.0]
  - - [2048, 3399, 1, 512, 2048, 2048, 2048, 512]
    - [3, 11667.0]
  - - [2048, 3402, 1, 512, 2048, 2048, 2048, 512]
    - [3, 11692.0]
  - - [2048, 3410, 1, 512, 2048, 2048, 2048, 512]
    - [3, 11705.0]
  - - [2048, 3412, 1, 512, 2048, 2048, 2048, 512]
    - [3, 11723.0]
  - - [2048, 3414, 1, 512, 2048, 2048, 2048, 512]
    - [3, 11724.0]
  - - [2048, 3415, 1, 512, 2048, 2048, 2048, 512]
    - [3, 11738.0]
  - - [2048, 3418, 1, 512, 2048, 2048, 2048, 512]
    - [3, 11756.0]
  - - [2048, 3420, 1, 512, 2048, 2048, 2048, 512]
    - [3, 11743.0]
  - - [2048, 3422, 1, 512, 2048, 2048, 2048, 512]
    - [1, 11763.0]
  - - [2048, 3425, 1, 512, 2048, 2048, 2048, 512]
    - [1, 11781.0]
  - - [2048, 3426, 1, 512, 2048, 2048, 2048, 512]
    - [1, 11740.0]
  - - [2048, 3427, 1, 512, 2048, 2048, 2048, 512]
    - [1, 11766.0]
  - - [2048, 3428, 1, 512, 2048, 2048, 2048, 512]
    - [1, 11826.0]
  - - [2048, 3430, 1, 512, 2048, 2048, 2048, 512]
    - [1, 11802.0]
  - - [2048, 3431, 1, 512, 2048, 2048, 2048, 512]
    - [1, 11783.0]
  - - [2048, 3432, 1, 512, 2048, 2048, 2048, 512]
    - [3, 11786.0]
  - - [2048, 3433, 1, 512, 2048, 2048, 2048, 512]
    - [3, 11789.0]
  - - [2048, 3438, 1, 512, 2048, 2048, 2048, 512]
    - [3, 11786.0]
  - - [2048, 3439, 1, 512, 2048, 2048, 2048, 512]
    - [1, 11861.0]
  - - [2048, 3440, 1, 512, 2048, 2048, 2048, 512]
    - [3, 11797.0]
  - - [2048, 3443, 1, 512, 2048, 2048, 2048, 512]
    - [3, 11816.0]
  - - [2048, 3445, 1, 512, 2048, 2048, 2048, 512]
    - [3, 11813.0]
  - - [2048, 3447, 1, 512, 2048, 2048, 2048, 512]
    - [3, 11811.0]
  - - [2048, 3448, 1, 512, 2048, 2048, 2048, 512]
    - [3, 11815.0]
  - - [2048, 3450, 1, 512, 2048, 2048, 2048, 512]
    - [3, 11806.0]
  - - [2048, 3451, 1, 512, 2048, 2048, 2048, 512]
    - [1, 11823.0]
  - - [2048, 3452, 1, 512, 2048, 2048, 2048, 512]
    - [1, 11826.0]
  - - [2048, 3453, 1, 512, 2048, 2048, 2048, 512]
    - [3, 11830.0]
  - - [2048, 3455, 1, 512, 2048, 2048, 2048, 512]
    - [3, 11861.0]
  - - [2048, 3456, 1, 512, 2048, 2048, 2048, 512]
    - [3, 11951.0]
  - - [2048, 3457, 1, 512, 2048, 2048, 2048, 512]
    - [16, 11517.0]
  - - [2048, 3458, 1, 512, 2048, 2048, 2048, 512]
    - [16, 11506.0]
  - - [2048, 3459, 1, 512, 2048, 2048, 2048, 512]
    - [16, 11506.0]
  - - [2048, 3460, 1, 512, 2048, 2048, 2048, 512]
    - [16, 11534.0]
  - - [2048, 3461, 1, 512, 2048, 2048, 2048, 512]
    - [16, 11524.0]
  - - [2048, 3462, 1, 512, 2048, 2048, 2048, 512]
    - [16, 11511.0]
  - - [2048, 3466, 1, 512, 2048, 2048, 2048, 512]
    - [16, 11557.0]
  - - [2048, 3467, 1, 512, 2048, 2048, 2048, 512]
    - [16, 11551.0]
  - - [2048, 3468, 1, 512, 2048, 2048, 2048, 512]
    - [0, 11527.0]
  - - [2048, 3470, 1, 512, 2048, 2048, 2048, 512]
    - [16, 11558.0]
  - - [2048, 3471, 1, 512, 2048, 2048, 2048, 512]
    - [16, 11549.0]
  - - [2048, 3472, 1, 512, 2048, 2048, 2048, 512]
    - [16, 11549.0]
  - - [2048, 3475, 1, 512, 2048, 2048, 2048, 512]
    - [16, 11554.0]
  - - [2048, 3476, 1, 512, 2048, 2048, 2048, 512]
    - [16, 11575.0]
  - - [2048, 3477, 1, 512, 2048, 2048, 2048, 512]
    - [16, 11594.0]
  - - [2048, 3478, 1, 512, 2048, 2048, 2048, 512]
    - [16, 11575.0]
  - - [2048, 3479, 1, 512, 2048, 2048, 2048, 512]
    - [22, 11564.0]
  - - [2048, 3480, 1, 512, 2048, 2048, 2048, 512]
    - [0, 11567.0]
  - - [2048, 3481, 1, 512, 2048, 2048, 2048, 512]
    - [16, 11590.0]
  - - [2048, 3483, 1, 512, 2048, 2048, 2048, 512]
    - [16, 11585.0]
  - - [2048, 3484, 1, 512, 2048, 2048, 2048, 512]
    - [0, 11581.0]
  - - [2048, 3487, 1, 512, 2048, 2048, 2048, 512]
    - [16, 11588.0]
  - - [2048, 3489, 1, 512, 2048, 2048, 2048, 512]
    - [16, 11617.0]
  - - [2048, 3490, 1, 512, 2048, 2048, 2048, 512]
    - [16, 11626.0]
  - - [2048, 3491, 1, 512, 2048, 2048, 2048, 512]
    - [0, 11593.0]
  - - [2048, 3493, 1, 512, 2048, 2048, 2048, 512]
    - [16, 11613.0]
  - - [2048, 3494, 1, 512, 2048, 2048, 2048, 512]
    - [16, 11604.0]
  - - [2048, 3495, 1, 512, 2048, 2048, 2048, 512]
    - [16, 11616.0]
  - - [2048, 3497, 1, 512, 2048, 2048, 2048, 512]
    - [16, 11611.0]
  - - [2048, 3498, 1, 512, 2048, 2048, 2048, 512]
    - [30, 11610.0]
  - - [2048, 3501, 1, 512, 2048, 2048, 2048, 512]
    - [16, 11630.0]
  - - [2048, 3503, 1, 512, 2048, 2048, 2048, 512]
    - [16, 11627.0]
  - - [2048, 3505, 1, 512, 2048, 2048, 2048, 512]
    - [16, 11651.0]
  - - [2048, 3507, 1, 512, 2048, 2048, 2048, 512]
    - [16, 11659.0]
  - - [2048, 3508, 1, 512, 2048, 2048, 2048, 512]
    - [16, 11663.0]
  - - [2048, 3509, 1, 512, 2048, 2048, 2048, 512]
    - [16, 11682.0]
  - - [2048, 3510, 1, 512, 2048, 2048, 2048, 512]
    - [16, 11669.0]
  - - [2048, 3511, 1, 512, 2048, 2048, 2048, 512]
    - [16, 11658.0]
  - - [2048, 3513, 1, 512, 2048, 2048, 2048, 512]
    - [16, 11682.0]
  - - [2048, 3514, 1, 512, 2048, 2048, 2048, 512]
    - [16, 11652.0]
  - - [2048, 3515, 1, 512, 2048, 2048, 2048, 512]
    - [16, 11667.0]
  - - [2048, 3517, 1, 512, 2048, 2048, 2048, 512]
    - [16, 11681.0]
  - - [2048, 3518, 1, 512, 2048, 2048, 2048, 512]
    - [16, 11680.0]
  - - [2048, 3519, 1, 512, 2048, 2048, 2048, 512]
    - [16, 11685.0]
  - - [2048, 3520, 1, 512, 2048, 2048, 2048, 512]
    - [0, 11738.0]
  - - [2048, 3523, 1, 512, 2048, 2048, 2048, 512]
    - [3, 11620.0]
  - - [2048, 3528, 1, 512, 2048, 2048, 2048, 512]
    - [3, 11633.0]
  - - [2048, 3529, 1, 512, 2048, 2048, 2048, 512]
    - [3, 11646.0]
  - - [2048, 3530, 1, 512, 2048, 2048, 2048, 512]
    - [1, 11629.0]
  - - [2048, 3531, 1, 512, 2048, 2048, 2048, 512]
    - [3, 11651.0]
  - - [2048, 3532, 1, 512, 2048, 2048, 2048, 512]
    - [3, 11634.0]
  - - [2048, 3533, 1, 512, 2048, 2048, 2048, 512]
    - [3, 11638.0]
  - - [2048, 3534, 1, 512, 2048, 2048, 2048, 512]
    - [3, 11643.0]
  - - [2048, 3538, 1, 512, 2048, 2048, 2048, 512]
    - [3, 11649.0]
  - - [2048, 3539, 1, 512, 2048, 2048, 2048, 512]
    - [3, 11669.0]
  - - [2048, 3540, 1, 512, 2048, 2048, 2048, 512]
    - [3, 11669.0]
  - - [2048, 3541, 1, 512, 2048, 2048, 2048, 512]
    - [3, 11672.0]
  - - [2048, 3547, 1, 512, 2048, 2048, 2048, 512]
    - [3, 11691.0]
  - - [2048, 3548, 1, 512, 2048, 2048, 2048, 512]
    - [3, 11688.0]
  - - [2048, 3552, 1, 512, 2048, 2048, 2048, 512]
    - [3, 11692.0]
  - - [2048, 3564, 1, 512, 2048, 2048, 2048, 512]
    - [3, 11733.0]
  - - [2048, 3575, 1, 512, 2048, 2048, 2048, 512]
    - [3, 11755.0]
  - - [2048, 3598, 1, 512, 2048, 2048, 2048, 512]
    - [0, 11477.0]
  - - [2048, 3599, 1, 512, 2048, 2048, 2048, 512]
    - [16, 11468.0]
  - - [2048, 3608, 1, 512, 2048, 2048, 2048, 512]
    - [16, 11497.0]
  - - [2048, 3776, 1, 512, 2048, 2048, 2048, 512]
    - [3, 11809.0]
  - - [2048, 3780, 1, 512, 2048, 2048, 2048, 512]
    - [3, 11838.0]
  - - [2048, 3796, 1, 512, 2048, 2048, 2048, 512]
    - [3, 11849.0]
  - - [2048, 3822, 1, 512, 2048, 2048, 2048, 512]
    - [3, 11860.0]
  - - [2048, 3835, 1, 512, 2048, 2048, 2048, 512]
    - [3, 11910.0]
  - - [2048, 3840, 1, 512, 2048, 2048, 2048, 512]
    - [3, 12162.0]
  - - [2048, 3859, 1, 512, 2048, 2048, 2048, 512]
    - [1, 11713.0]
  - - [2048, 3864, 1, 512, 2048, 2048, 2048, 512]
    - [3, 11699.0]
  - - [2048, 3870, 1, 512, 2048, 2048, 2048, 512]
    - [1, 11735.0]
  - - [2048, 3876, 1, 512, 2048, 2048, 2048, 512]
    - [1, 11779.0]
  - - [2048, 3906, 1, 512, 2048, 2048, 2048, 512]
    - [3, 11815.0]
  - - [2048, 3910, 1, 512, 2048, 2048, 2048, 512]
    - [1, 11868.0]
  - - [2048, 3925, 1, 512, 2048, 2048, 2048, 512]
    - [3, 11861.0]
  - - [2048, 3942, 1, 512, 2048, 2048, 2048, 512]
    - [1, 11885.0]
  - - [2048, 3944, 1, 512, 2048, 2048, 2048, 512]
    - [3, 11889.0]
  - - [2048, 3955, 1, 512, 2048, 2048, 2048, 512]
    - [3, 11933.0]
  - - [2048, 3968, 1, 512, 2048, 2048, 2048, 512]
    - [3, 12104.0]
  - - [2048, 3969, 1, 512, 2048, 2048, 2048, 512]
    - [3, 11638.0]
  - - [2048, 3976, 1, 512, 2048, 2048, 2048, 512]
    - [1, 11620.0]
  - - [2048, 3977, 1, 512, 2048, 2048, 2048, 512]
    - [3, 11626.0]
  - - [2048, 3978, 1, 512, 2048, 2048, 2048, 512]
    - [3, 11635.0]
  - - [2048, 3990, 1, 512, 2048, 2048, 2048, 512]
    - [1, 11695.0]
  - - [2048, 3995, 1, 512, 2048, 2048, 2048, 512]
    - [1, 11682.0]
  - - [2048, 3996, 1, 512, 2048, 2048, 2048, 512]
    - [3, 11677.0]
  - - [2048, 3999, 1, 512, 2048, 2048, 2048, 512]
    - [3, 11691.0]
  - - [2048, 4005, 1, 512, 2048, 2048, 2048, 512]
    - [3, 11697.0]
  - - [2048, 4012, 1, 512, 2048, 2048, 2048, 512]
    - [3, 11735.0]
  - - [2048, 4020, 1, 512, 2048, 2048, 2048, 512]
    - [1, 11780.0]
  - - [2048, 4026, 1, 512, 2048, 2048, 2048, 512]
    - [1, 11799.0]
  - - [2048, 4030, 1, 512, 2048, 2048, 2048, 512]
    - [3, 11800.0]
  - - [2048, 4032, 1, 512, 2048, 2048, 2048, 512]
    - [3, 11789.0]
  - - [1024, 4096, 1, 3072, 1024, 1024, 1024, 3072]
    - [23, 12127.0]
  - - [1024, 3840, 1, 1024, 1024, 1024, 1024, 1024]
    - [3, 12004.0]
  - - [1024, 3840, 1, 4096, 1024, 1024, 1024, 4096]
    - [13, 12264.0]
  - - [1024, 3968, 1, 1024, 1024, 1024, 1024, 1024]
    - [7, 11580.0]
  - - [1024, 3968, 1, 4096, 1024, 1024, 1024, 4096]
    - [26, 11707.0]
  - - [1024, 3968, 1, 42720, 1024, 1024, 1024, 42720]
    - [23, 11744.0]
  - - [1024, 7200, 1, 1024, 1024, 1024, 1024, 1024]
    - [8, 11936.0]
  - - [1024, 7200, 1, 4096, 1024, 1024, 1024, 4096]
    - [26, 12112.0]
  - - [1024, 7200, 1, 42720, 1024, 1024, 1024, 42720]
    - [17, 12148.0]
  - - [1024, 8160, 1, 1024, 1024, 1024, 1024, 1024]
    - [23, 12041.0]
  - - [1024, 8160, 1, 4096, 1024, 1024, 1024, 4096]
    - [26, 12146.0]
  - - [1024, 9520, 1, 1024, 1024, 1024, 1024, 1024]
    - [8, 12230.0]
  - - [1024, 9520, 1, 4096, 1024, 1024, 1024, 4096]
    - [40, 12319.0]
  - - [1024, 9520, 1, 42720, 1024, 1024, 1024, 42720]
    - [1, 12223.0]
  - - [1024, 10200, 1, 1024, 1024, 1024, 1024, 1024]
    - [23, 12314.0]
  - - [1024, 10200, 1, 4096, 1024, 1024, 1024, 4096]
    - [26, 12365.0]
  - - [4096, 3840, 1, 1024, 4096, 4096, 4096, 1024]
    - [1, 12503.0]
  - - [4096, 3968, 1, 1024, 4096, 4096, 4096, 1024]
    - [1, 12445.0]
  - - [4096, 7200, 1, 1024, 4096, 4096, 4096, 1024]
    - [1, 12305.0]
  - - [4096, 8160, 1, 1024, 4096, 4096, 4096, 1024]
    - [1, 12447.0]
  - - [4096, 9520, 1, 1024, 4096, 4096, 4096, 1024]
    - [1, 12474.0]
  - - [4096, 10200, 1, 1024, 4096, 4096, 4096, 1024]
    - [1, 12527.0]
  - - [1024, 2048, 1, 4096, 1024, 1024, 1024, 4096]
    - [7, 11429.0]
  - - [1024, 2048, 1, 30528, 1024, 1024, 1024, 30528]
    - [7, 11467.0]
  - - [1024, 4096, 1, 30528, 1024, 1024, 1024, 30528]
    - [1, 12082.0]
  - - [1024, 10240, 1, 256, 1024, 1024, 1024, 256]
    - [3, 11814.0]
  - - [1024, 10496, 1, 256, 1024, 1024, 1024, 256]
    - [3, 11918.0]
  - - [1024, 11008, 1, 256, 1024, 1024, 1024, 256]
    - [3, 11870.0]
  - - [1024, 11264, 1, 256, 1024, 1024, 1024, 256]
    - [1, 11829.0]
  - - [1024, 11520, 1, 256, 1024, 1024, 1024, 256]
    - [3, 12063.0]
  - - [1024, 12288, 1, 256, 1024, 1024, 1024, 256]
    - [3, 11945.0]
  - - [1024, 13312, 1, 256, 1024, 1024, 1024, 256]
    - [3, 12040.0]
  - - [1024, 13568, 1, 256, 1024, 1024, 1024, 256]
    - [1, 11987.0]
  - - [1024, 14336, 1, 256, 1024, 1024, 1024, 256]
    - [3, 12089.0]
  - - [1024, 14592, 1, 256, 1024, 1024, 1024, 256]
    - [3, 12045.0]
  - - [1024, 14848, 1, 256, 1024, 1024, 1024, 256]
    - [1, 12024.0]
  - - [1024, 15104, 1, 256, 1024, 1024, 1024, 256]
    - [26, 12027.0]
  - - [1024, 1600, 1, 1024, 1024, 1024, 1024, 1024]
    - [7, 11308.0]
  - - [1024, 1600, 1, 1, 1024, 1024, 1024, 1]
    - [22, 175.0]
  - - [1024, 16128, 1, 256, 1024, 1024, 1024, 256]
    - [11, 12114.0]
  - - [1024, 17152, 1, 256, 1024, 1024, 1024, 256]
    - [1, 12188.0]
  - - [1024, 1792, 1, 256, 1024, 1024, 1024, 256]
    - [1, 10388.0]
  - - [1024, 18944, 1, 256, 1024, 1024, 1024, 256]
    - [11, 12104.0]
  - - [1024, 19712, 1, 256, 1024, 1024, 1024, 256]
    - [3, 12167.0]
  - - [1024, 19968, 1, 256, 1024, 1024, 1024, 256]
    - [1, 12173.0]
  - - [1024, 20480, 1, 256, 1024, 1024, 1024, 256]
    - [3, 12213.0]
  - - [1024, 2048, 1, 256, 1024, 1024, 1024, 256]
    - [16, 10864.0]
  - - [1024, 20992, 1, 256, 1024, 1024, 1024, 256]
    - [3, 12179.0]
  - - [1024, 21504, 1, 256, 1024, 1024, 1024, 256]
    - [3, 12127.0]
  - - [1024, 22016, 1, 256, 1024, 1024, 1024, 256]
    - [11, 12184.0]
  - - [1024, 23552, 1, 256, 1024, 1024, 1024, 256]
    - [3, 12176.0]
  - - [1024, 2560, 1, 256, 1024, 1024, 1024, 256]
    - [16, 11133.0]
  - - [1024, 28672, 1, 256, 1024, 1024, 1024, 256]
    - [3, 12253.0]
  - - [1024, 3072, 1, 256, 1024, 1024, 1024, 256]
    - [1, 10891.0]
  - - [1024, 3328, 1, 256, 1024, 1024, 1024, 256]
    - [0, 11193.0]
  - - [1024, 33536, 1, 256, 1024, 1024, 1024, 256]
    - [3, 12299.0]
  - - [1024, 3840, 1, 256, 1024, 1024, 1024, 256]
    - [1, 11442.0]
  - - [1024, 40448, 1, 256, 1024, 1024, 1024, 256]
    - [3, 12330.0]
  - - [1024, 4096, 1, 256, 1024, 1024, 1024, 256]
    - [1, 11272.0]
  - - [1024, 4608, 1, 256, 1024, 1024, 1024, 256]
    - [0, 11387.0]
  - - [1024, 4864, 1, 256, 1024, 1024, 1024, 256]
    - [0, 11264.0]
  - - [1024, 5120, 1, 256, 1024, 1024, 1024, 256]
    - [11, 11635.0]
  - - [1024, 5632, 1, 256, 1024, 1024, 1024, 256]
    - [1, 11495.0]
  - - [1024, 6144, 1, 256, 1024, 1024, 1024, 256]
    - [3, 11426.0]
  - - [1024, 6400, 1, 256, 1024, 1024, 1024, 256]
    - [3, 11778.0]
  - - [1024, 7168, 1, 256, 1024, 1024, 1024, 256]
    - [1, 11606.0]
  - - [1024, 7424, 1, 256, 1024, 1024, 1024, 256]
    - [3, 11579.0]
  - - [1024, 7680, 1, 256, 1024, 1024, 1024, 256]
    - [3, 11890.0]
  - - [1024, 7936, 1, 256, 1024, 1024, 1024, 256]
    - [3, 11835.0]
  - - [1024, 8192, 1, 256, 1024, 1024, 1024, 256]
    - [3, 11757.0]
  - - [1024, 8448, 1, 256, 1024, 1024, 1024, 256]
    - [3, 11740.0]
  - - [1024, 8704, 1, 256, 1024, 1024, 1024, 256]
    - [1, 11729.0]
  - - [1024, 8960, 1, 256, 1024, 1024, 1024, 256]
    - [3, 11975.0]
  - - [1024, 9728, 1, 256, 1024, 1024, 1024, 256]
    - [3, 11828.0]
  - - [1024, 9984, 1, 256, 1024, 1024, 1024, 256]
    - [3, 11804.0]
  - - [2048, 1024, 1, 1, 2048, 2048, 2048, 1]
    - [16, 183.0]
  - - [2048, 1024, 1, 256, 2048, 2048, 2048, 256]
    - [0, 10948.0]
  - - [256, 8976, 1, 10240, 256, 256, 256, 10240]
    - [28, 10666.0]
  - - [256, 8976, 1, 10496, 256, 256, 256, 10496]
    - [7, 10907.0]
  - - [256, 8976, 1, 11008, 256, 256, 256, 11008]
    - [13, 10839.0]
  - - [256, 8976, 1, 11520, 256, 256, 256, 11520]
    - [13, 10842.0]
  - - [256, 8976, 1, 12288, 256, 256, 256, 12288]
    - [26, 10658.0]
  - - [256, 8976, 1, 14336, 256, 256, 256, 14336]
    - [26, 10672.0]
  - - [256, 8976, 1, 14848, 256, 256, 256, 14848]
    - [28, 10850.0]
  - - [256, 8976, 1, 15104, 256, 256, 256, 15104]
    - [7, 10933.0]
  - - [256, 8976, 1, 1536, 256, 256, 256, 1536]
    - [36, 10842.0]
  - - [256, 8976, 1, 15872, 256, 256, 256, 15872]
    - [13, 10846.0]
  - - [256, 8976, 1, 17152, 256, 256, 256, 17152]
    - [7, 10956.0]
  - - [256, 8976, 1, 19712, 256, 256, 256, 19712]
    - [7, 10892.0]
  - - [256, 8976, 1, 19968, 256, 256, 256, 19968]
    - [28, 10789.0]
  - - [256, 8976, 1, 20480, 256, 256, 256, 20480]
    - [11, 10684.0]
  - - [256, 8976, 1, 2048, 256, 256, 256, 2048]
    - [36, 10884.0]
  - - [256, 8976, 1, 20992, 256, 256, 256, 20992]
    - [28, 10853.0]
  - - [256, 8976, 1, 22016, 256, 256, 256, 22016]
    - [13, 10871.0]
  - - [256, 8976, 1, 2304, 256, 256, 256, 2304]
    - [36, 10914.0]
  - - [256, 8976, 1, 2560, 256, 256, 256, 2560]
    - [36, 10954.0]
  - - [256, 8976, 1, 26112, 256, 256, 256, 26112]
    - [28, 10778.0]
  - - [256, 8976, 1, 2816, 256, 256, 256, 2816]
    - [36, 10957.0]
  - - [256, 8976, 1, 3072, 256, 256, 256, 3072]
    - [36, 10963.0]
  - - [256, 8976, 1, 33536, 256, 256, 256, 33536]
    - [13, 10880.0]
  - - [256, 8976, 1, 4352, 256, 256, 256, 4352]
    - [28, 10724.0]
  - - [256, 8976, 1, 44505, 256, 256, 256, 44505]
    - [0, 10965.0]
  - - [256, 8976, 1, 4864, 256, 256, 256, 4864]
    - [36, 10983.0]
  - - [256, 8976, 1, 5376, 256, 256, 256, 5376]
    - [36, 10957.0]
  - - [256, 8976, 1, 5632, 256, 256, 256, 5632]
    - [36, 10970.0]
  - - [256, 8976, 1, 5888, 256, 256, 256, 5888]
    - [36, 10995.0]
  - - [256, 8976, 1, 6144, 256, 256, 256, 6144]
    - [22, 10837.0]
  - - [256, 8976, 1, 6656, 256, 256, 256, 6656]
    - [36, 10954.0]
  - - [256, 8976, 1, 7168, 256, 256, 256, 7168]
    - [22, 10866.0]
  - - [256, 8976, 1, 7424, 256, 256, 256, 7424]
    - [7, 10957.0]
  - - [256, 8976, 1, 8192, 256, 256, 256, 8192]
    - [11, 10623.0]
  - - [256, 8976, 1, 8448, 256, 256, 256, 8448]
    - [7, 10986.0]
  - - [256, 8976, 1, 8960, 256, 256, 256, 8960]
    - [36, 10962.0]
  - - [256, 8976, 1, 9472, 256, 256, 256, 9472]
    - [7, 10945.0]
  - - [256, 8976, 1, 9728, 256, 256, 256, 9728]
    - [7, 10959.0]
  - - [256, 8976, 1, 9984, 256, 256, 256, 9984]
    - [7, 10993.0]
  - - [3200, 1024, 1, 2048, 3200, 3200, 3200, 2048]
    - [1, 12298.0]
  - - [4096, 1024, 1, 1, 4096, 4096, 4096, 1]
    - [7, 156.0]
  - - [1024, 4096, 1, 4096, 1024, 1024, 1024, 4096]
    - [40, 12064.0]
  - - [1024, 3072, 1, 3072, 1024, 1024, 1024, 3072]
    - [8, 11816.0]
  - - [1024, 2048, 1, 3072, 1024, 1024, 1024, 3072]
    - [7, 11282.0]
  - - [30528, 4096, 1, 1024, 30528, 30528, 30528, 1024]
    - [37, 12534.0]
  - - [30528, 2048, 1, 1024, 30528, 30528, 30528, 1024]
    - [23, 12576.0]
  - - [512, 32768, 1, 256, 512, 512, 512, 256]
    - [23, 12096.0]
  - - [256, 32768, 1, 128, 256, 256, 256, 128]
    - [16, 11331.0]
  - - [1024, 32768, 1, 512, 1024, 1024, 1024, 512]
    - [23, 12441.0]
  - - [1024, 32768, 1, 1024, 1024, 1024, 1024, 1024]
    - [23, 12534.0]
  - - [479, 32768, 1, 1024, 479, 479, 479, 1024]
    - [40, 11456.0]
  - - [289, 128, 64, 768, 289, 289, 289, 768]
    - [23, 8442.0]
  - - [289, 160, 64, 768, 289, 289, 289, 768]
    - [0, 7112.0]
  - - [289, 192, 64, 768, 289, 289, 289, 768]
    - [19, 8386.0]
  - - [3136, 256, 64, 64, 3136, 3136, 3136, 64]
    - [0, 10677.0]
  - - [784, 512, 64, 128, 784, 784, 784, 128]
    - [3, 10164.0]
  - - [784, 128, 64, 512, 784, 784, 784, 512]
    - [34, 10200.0]
  - - [196, 1024, 64, 256, 196, 196, 196, 256]
    - [11, 8821.0]
  - - [196, 256, 64, 1024, 196, 196, 196, 1024]
    - [40, 8948.0]
  - - [3136, 256, 32, 64, 3136, 3136, 3136, 64]
    - [0, 11047.0]
  - - [784, 512, 32, 128, 784, 784, 784, 128]
    - [31, 10093.0]
  - - [784, 128, 32, 512, 784, 784, 784, 512]
    - [7, 9822.0]
  - - [196, 1024, 32, 256, 196, 196, 196, 256]
    - [3, 8631.0]
  - - [256, 6912, 1, 4, 256, 256, 256, 4]
    - [7, 685.0]
  - - [512, 4096, 1, 256, 512, 512, 512, 256]
    - [16, 10846.0]
  - - [1024, 4096, 1, 512, 1024, 1024, 1024, 512]
    - [3, 11749.0]
  - - [480, 4096, 1, 1024, 480, 480, 480, 1024]
    - [22, 10535.0]
  - - [512, 6912, 1, 256, 512, 512, 512, 256]
    - [22, 10701.0]
  - - [1024, 6912, 1, 512, 1024, 1024, 1024, 512]
    - [26, 11810.0]
  - - [1024, 6912, 1, 1024, 1024, 1024, 1024, 1024]
    - [23, 12087.0]
  - - [480, 6912, 1, 1024, 480, 480, 480, 1024]
    - [8, 11061.0]
  - - [256, 55296, 1, 128, 256, 256, 256, 128]
    - [16, 11370.0]
  - - [512, 55296, 1, 256, 512, 512, 512, 256]
    - [26, 12190.0]
  - - [1920, 2048, 1, 2048, 1920, 1920, 1920, 2048]
    - [1, 12348.0]
  - - [2880, 3072, 1, 3072, 2880, 2880, 2880, 3072]
    - [8, 12068.0]
  - - [3840, 4096, 1, 4096, 3840, 3840, 3840, 4096]
    - [3, 12517.0]
  - - [7680, 8192, 1, 8192, 7680, 7680, 7680, 8192]
    - [11, 12295.0]
  - - [2048, 2048, 1, 2048, 2048, 2048, 2048, 2048]
    - [8, 12110.0]
  - - [3072, 3072, 1, 3072, 3072, 3072, 3072, 3072]
    - [3, 12386.0]
  - - [4096, 4096, 1, 4096, 4096, 4096, 4096, 4096]
    - [8, 12462.0]
  - - [8192, 8192, 1, 8192, 8192, 8192, 8192, 8192]
    - [3, 12346.0]
  - - [1152, 1152, 1, 1152, 1152, 1152, 1152, 1152]
    - [16, 10162.0]
  - - [1536, 1536, 1, 1536, 1536, 1536, 1536, 1536]
    - [30, 11174.0]
  - - [1920, 1920, 1, 1920, 1920, 1920, 1920, 1920]
    - [17, 11650.0]
  - - [2304, 2304, 1, 2304, 2304, 2304, 2304, 2304]
    - [1, 11946.0]
  - - [2688, 2688, 1, 2688, 2688, 2688, 2688, 2688]
    - [17, 12077.0]
  - - [3456, 3456, 1, 3456, 3456, 3456, 3456, 3456]
    - [17, 12445.0]
  - - [3840, 3840, 1, 3840, 3840, 3840, 3840, 3840]
    - [3, 12499.0]
  - - [4224, 4224, 1, 4224, 4224, 4224, 4224, 4224]
    - [1, 12549.0]
  - - [4608, 4608, 1, 4608, 4608, 4608, 4608, 4608]
    - [1, 12591.0]
  - - [4992, 4992, 1, 4992, 4992, 4992, 4992, 4992]
    - [31, 12514.0]
  - - [5376, 5376, 1, 5376, 5376, 5376, 5376, 5376]
    - [37, 12507.0]
  - - [5760, 5760, 1, 5760, 5760, 5760, 5760, 5760]
    - [31, 12567.0]
  - - [6144, 6144, 1, 6144, 6144, 6144, 6144, 6144]
    - [40, 12498.0]
  - - [6528, 6528, 1, 6528, 6528, 6528, 6528, 6528]
    - [17, 12469.0]
  - - [6912, 6912, 1, 6912, 6912, 6912, 6912, 6912]
    - [17, 12528.0]
  - - [7296, 7296, 1, 7296, 7296, 7296, 7296, 7296]
    - [34, 12551.0]
  - - [7680, 7680, 1, 7680, 7680, 7680, 7680, 7680]
    - [20, 12277.0]
  - - [1152, 1152, 1, 384, 1152, 1152, 1152, 384]
    - [30, 8003.0]
  - - [1536, 1536, 1, 384, 1536, 1536, 1536, 384]
    - [30, 9551.0]
  - - [1920, 1920, 1, 384, 1920, 1920, 1920, 384]
    - [30, 10279.0]
  - - [2304, 2304, 1, 384, 2304, 2304, 2304, 384]
    - [37, 11451.0]
  - - [2688, 2688, 1, 384, 2688, 2688, 2688, 384]
    - [17, 11774.0]
  - - [3072, 3072, 1, 384, 3072, 3072, 3072, 384]
    - [3, 12088.0]
  - - [3456, 3456, 1, 384, 3456, 3456, 3456, 384]
    - [17, 12222.0]
  - - [3840, 3840, 1, 384, 3840, 3840, 3840, 384]
    - [1, 12334.0]
  - - [4224, 4224, 1, 384, 4224, 4224, 4224, 384]
    - [17, 12394.0]
  - - [4608, 4608, 1, 384, 4608, 4608, 4608, 384]
    - [1, 12445.0]
  - - [4992, 4992, 1, 384, 4992, 4992, 4992, 384]
    - [8, 12406.0]
  - - [5376, 5376, 1, 384, 5376, 5376, 5376, 384]
    - [1, 12436.0]
  - - [5760, 5760, 1, 384, 5760, 5760, 5760, 384]
    - [17, 12474.0]
  - - [6144, 6144, 1, 384, 6144, 6144, 6144, 384]
    - [23, 12471.0]
  - - [6528, 6528, 1, 384, 6528, 6528, 6528, 384]
    - [37, 12518.0]
  - - [6912, 6912, 1, 384, 6912, 6912, 6912, 384]
    - [17, 12555.0]
  - - [7296, 7296, 1, 384, 7296, 7296, 7296, 384]
    - [17, 12566.0]
  - - [7680, 7680, 1, 384, 7680, 7680, 7680, 384]
    - [1, 12567.0]
  - - [8064, 8064, 1, 384, 8064, 8064, 8064, 384]
    - [17, 12584.0]
  - - [8448, 8448, 1, 384, 8448, 8448, 8448, 384]
    - [1, 12584.0]
  - - [8832, 8832, 1, 384, 8832, 8832, 8832, 384]
    - [17, 12598.0]
  - - [9216, 9216, 1, 384, 9216, 9216, 9216, 384]
    - [8, 12577.0]
  - - [9600, 9600, 1, 384, 9600, 9600, 9600, 384]
    - [1, 12611.0]
  - - [9984, 9984, 1, 384, 9984, 9984, 9984, 384]
    - [1, 12600.0]
  - - [10368, 10368, 1, 384, 10368, 10368, 10368, 384]
    - [23, 12612.0]
  - - [10752, 10752, 1, 384, 10752, 10752, 10752, 384]
    - [17, 12605.0]
  - - [11136, 11136, 1, 384, 11136, 11136, 11136, 384]
    - [17, 12622.0]
  - - [11520, 11520, 1, 384, 11520, 11520, 11520, 384]
    - [1, 12613.0]
  - - [11904, 11904, 1, 384, 11904, 11904, 11904, 384]
    - [17, 12632.0]
  - - [12288, 12288, 1, 384, 12288, 12288, 12288, 384]
    - [1, 12609.0]
  - - [12672, 12672, 1, 384, 12672, 12672, 12672, 384]
    - [17, 12631.0]
  - - [13056, 13056, 1, 384, 13056, 13056, 13056, 384]
    - [17, 12615.0]
  - - [13440, 13440, 1, 384, 13440, 13440, 13440, 384]
    - [23, 12633.0]
  - - [13824, 13824, 1, 384, 13824, 13824, 13824, 384]
    - [17, 12623.0]
  - - [14208, 14208, 1, 384, 14208, 14208, 14208, 384]
    - [23, 12631.0]
  - - [14592, 14592, 1, 384, 14592, 14592, 14592, 384]
    - [17, 12623.0]
  - - [14976, 14976, 1, 384, 14976, 14976, 14976, 384]
    - [17, 12641.0]
  - - [15360, 15360, 1, 384, 15360, 15360, 15360, 384]
    - [23, 12629.0]
  - - [15744, 15744, 1, 384, 15744, 15744, 15744, 384]
    - [17, 12636.0]
  - - [16128, 16128, 1, 384, 16128, 16128, 16128, 384]
    - [17, 12632.0]
  - - [16512, 16512, 1, 384, 16512, 16512, 16512, 384]
    - [17, 12654.0]
  - - [16896, 16896, 1, 384, 16896, 16896, 16896, 384]
    - [23, 12626.0]
  - - [17280, 17280, 1, 384, 17280, 17280, 17280, 384]
    - [17, 12653.0]
  - - [17664, 17664, 1, 384, 17664, 17664, 17664, 384]
    - [23, 12458.0]
  - - [18048, 18048, 1, 384, 18048, 18048, 18048, 384]
    - [1, 12486.0]
  - - [18432, 18432, 1, 384, 18432, 18432, 18432, 384]
    - [1, 12483.0]
  - - [18816, 18816, 1, 384, 18816, 18816, 18816, 384]
    - [17, 12506.0]
  - - [19200, 19200, 1, 384, 19200, 19200, 19200, 384]
    - [8, 12496.0]
  - - [19584, 19584, 1, 384, 19584, 19584, 19584, 384]
    - [1, 12516.0]
  - - [19968, 19968, 1, 384, 19968, 19968, 19968, 384]
    - [8, 12508.0]
  - - [20352, 20352, 1, 384, 20352, 20352, 20352, 384]
    - [17, 12520.0]
  - - [20736, 20736, 1, 384, 20736, 20736, 20736, 384]
    - [8, 12515.0]
  - - [21120, 21120, 1, 384, 21120, 21120, 21120, 384]
    - [1, 12527.0]
  - - [21504, 21504, 1, 384, 21504, 21504, 21504, 384]
    - [1, 12515.0]
  - - [21888, 21888, 1, 384, 21888, 21888, 21888, 384]
    - [23, 12523.0]
  - - [22272, 22272, 1, 384, 22272, 22272, 22272, 384]
    - [8, 12526.0]
  - - [22656, 22656, 1, 384, 22656, 22656, 22656, 384]
    - [8, 12537.0]
  - - [23040, 23040, 1, 384, 23040, 23040, 23040, 384]
    - [8, 12534.0]
  - - [8192, 1024, 1, 1024, 8192, 8192, 8192, 1024]
    - [1, 12216.0]
  - - [8192, 4096, 1, 1024, 8192, 8192, 8192, 1024]
    - [8, 12554.0]
  - - [16384, 16384, 1, 16384, 16384, 16384, 16384, 16384]
    - [13, 11918.0]
  - - [1444, 256, 120, 128, 1444, 1444, 1444, 128]
    - [3, 10676.0]
  - - [1444, 256, 139, 128, 1444, 1444, 1444, 128]
    - [0, 10743.0]
  - - [1444, 256, 160, 128, 1444, 1444, 1444, 128]
    - [0, 10759.0]
  - - [1444, 256, 18, 128, 1444, 1444, 1444, 128]
    - [16, 10525.0]
  - - [1444, 256, 19, 128, 1444, 1444, 1444, 128]
    - [30, 10665.0]
  - - [1444, 256, 120, 256, 1444, 1444, 1444, 256]
    - [20, 11456.0]
  - - [1444, 256, 139, 256, 1444, 1444, 1444, 256]
    - [20, 11483.0]
  - - [1444, 256, 160, 256, 1444, 1444, 1444, 256]
    - [34, 11488.0]
  - - [1444, 256, 18, 256, 1444, 1444, 1444, 256]
    - [17, 10910.0]
  - - [1444, 256, 19, 256, 1444, 1444, 1444, 256]
    - [1, 11051.0]
  - - [361, 256, 120, 512, 361, 361, 361, 512]
    - [26, 10995.0]
  - - [361, 256, 139, 512, 361, 361, 361, 512]
    - [11, 11107.0]
  - - [361, 256, 160, 512, 361, 361, 361, 512]
    - [40, 11105.0]
  - - [361, 256, 18, 512, 361, 361, 361, 512]
    - [19, 9720.0]
  - - [361, 256, 19, 512, 361, 361, 361, 512]
    - [38, 9985.0]
  - - [173280, 128, 1, 64, 173280, 173280, 173280, 64]
    - [8, 8137.0]
  - - [200716, 128, 1, 64, 200716, 200716, 200716, 64]
    - [19, 6774.0]
  - - [231040, 128, 1, 64, 231040, 231040, 231040, 64]
    - [33, 7972.0]
  - - [25992, 128, 1, 64, 25992, 25992, 25992, 64]
    - [7, 8517.0]
  - - [27436, 128, 1, 64, 27436, 27436, 27436, 64]
    - [30, 9420.0]
  - - [8192, 7680, 1, 8192, 8192, 8192, 8192, 8192]
    - [3, 12313.0]
  - - [4096, 3840, 1, 4096, 4096, 4096, 4096, 4096]
    - [1, 12586.0]
  - - [2048, 1920, 1, 2048, 2048, 2048, 2048, 2048]
    - [1, 12221.0]
  - - [1024, 1280, 1, 2, 1024, 1024, 1024, 2]
    - [7, 315.0]
  - - [1024, 1280, 1, 4096, 1024, 1024, 1024, 4096]
    - [41, 11760.0]
  - - [4096, 1280, 1, 1024, 4096, 4096, 4096, 1024]
    - [1, 12216.0]
  - - [1024, 4992, 1, 2, 1024, 1024, 1024, 2]
    - [12, 340.0]
  - - [1024, 4992, 1, 4096, 1024, 1024, 1024, 4096]
    - [26, 11997.0]
  - - [4096, 4992, 1, 1024, 4096, 4096, 4096, 1024]
    - [1, 12403.0]
  - - [1024, 5120, 1, 2, 1024, 1024, 1024, 2]
    - [0, 556.0]
  - - [1024, 5120, 1, 1024, 1024, 1024, 1024, 1024]
    - [8, 12237.0]
  - - [1024, 5120, 1, 4096, 1024, 1024, 1024, 4096]
    - [23, 12384.0]
  - - [4096, 5120, 1, 1024, 4096, 4096, 4096, 1024]
    - [1, 12607.0]
  - - [1024, 5248, 1, 2, 1024, 1024, 1024, 2]
    - [0, 528.0]
  - - [1024, 5248, 1, 1024, 1024, 1024, 1024, 1024]
    - [8, 11907.0]
  - - [1024, 5248, 1, 4096, 1024, 1024, 1024, 4096]
    - [3, 11887.0]
  - - [4096, 5248, 1, 1024, 4096, 4096, 4096, 1024]
    - [1, 12467.0]
  - - [1024, 2560, 1, 2, 1024, 1024, 1024, 2]
    - [0, 388.0]
  - - [1024, 2560, 1, 4096, 1024, 1024, 1024, 4096]
    - [8, 12182.0]
  - - [4096, 2560, 1, 1024, 4096, 4096, 4096, 1024]
    - [1, 12463.0]
  - - [1024, 1152, 1, 2, 1024, 1024, 1024, 2]
    - [7, 324.0]
  - - [1024, 1152, 1, 4096, 1024, 1024, 1024, 4096]
    - [5, 10561.0]
  - - [4096, 1152, 1, 1024, 4096, 4096, 4096, 1024]
    - [16, 11675.0]
  - - [1024, 8192, 1, 1024, 1024, 1024, 1024, 1024]
    - [23, 12182.0]
  - - [1024, 8192, 1, 4096, 1024, 1024, 1024, 4096]
    - [26, 12212.0]
  - - [1024, 8192, 1, 33712, 1024, 1024, 1024, 33712]
    - [17, 12239.0]
  - - [1024, 9600, 1, 1024, 1024, 1024, 1024, 1024]
    - [3, 12289.0]
  - - [1024, 9600, 1, 4096, 1024, 1024, 1024, 4096]
    - [26, 12376.0]
  - - [1024, 9600, 1, 33712, 1024, 1024, 1024, 33712]
    - [17, 12465.0]
  - - [4096, 8192, 1, 1024, 4096, 4096, 4096, 1024]
    - [3, 12444.0]
  - - [4096, 9600, 1, 1024, 4096, 4096, 4096, 1024]
    - [3, 12510.0]
  - - [1024, 10064, 1, 1024, 1024, 1024, 1024, 1024]
    - [23, 12174.0]
  - - [1024, 10064, 1, 4096, 1024, 1024, 1024, 4096]
    - [23, 12362.0]
  - - [1024, 10080, 1, 4096, 1024, 1024, 1024, 4096]
    - [23, 12377.0]
  - - [1024, 10080, 1, 42720, 1024, 1024, 1024, 42720]
    - [8, 12162.0]
  - - [1024, 6528, 1, 1024, 1024, 1024, 1024, 1024]
    - [8, 11926.0]
  - - [1024, 6528, 1, 4096, 1024, 1024, 1024, 4096]
    - [26, 12050.0]
  - - [1024, 6528, 1, 42720, 1024, 1024, 1024, 42720]
    - [17, 12055.0]
  - - [1024, 7104, 1, 1024, 1024, 1024, 1024, 1024]
    - [23, 11845.0]
  - - [1024, 7104, 1, 4096, 1024, 1024, 1024, 4096]
    - [26, 11974.0]
  - - [1024, 7104, 1, 42720, 1024, 1024, 1024, 42720]
    - [17, 12000.0]
  - - [1024, 8064, 1, 1024, 1024, 1024, 1024, 1024]
    - [8, 12000.0]
  - - [1024, 8064, 1, 4096, 1024, 1024, 1024, 4096]
    - [11, 12077.0]
  - - [1024, 9216, 1, 1024, 1024, 1024, 1024, 1024]
    - [23, 12288.0]
  - - [1024, 9216, 1, 4096, 1024, 1024, 1024, 4096]
    - [26, 12339.0]
  - - [4096, 10064, 1, 1024, 4096, 4096, 4096, 1024]
    - [1, 12488.0]
  - - [4096, 10080, 1, 1024, 4096, 4096, 4096, 1024]
    - [1, 12483.0]
  - - [4096, 6528, 1, 1024, 4096, 4096, 4096, 1024]
    - [1, 12495.0]
  - - [4096, 7104, 1, 1024, 4096, 4096, 4096, 1024]
    - [1, 12397.0]
  - - [4096, 8064, 1, 1024, 4096, 4096, 4096, 1024]
    - [1, 12551.0]
  - - [4096, 9216, 1, 1024, 4096, 4096, 4096, 1024]
    - [1, 12509.0]
  - - [480, 32768, 1, 1024, 480, 480, 480, 1024]
    - [37, 11500.0]
  - - [2048, 960, 1, 2048, 2048, 2048, 2048, 2048]
    - [7, 11567.0]
  - - [2048, 1024, 1, 30592, 2048, 2048, 2048, 30592]
    - [33, 11099.0]
  - - [2048, 1024, 1, 6144, 2048, 2048, 2048, 6144]
    - [7, 11458.0]
  - - [2048, 1024, 1, 8192, 2048, 2048, 2048, 8192]
    - [22, 11313.0]
  - - [8192, 1024, 1, 2048, 8192, 8192, 8192, 2048]
    - [8, 12256.0]
  - - [1024, 8192, 1, 30592, 1024, 1024, 1024, 30592]
    - [5, 12207.0]
  - - [1024, 8192, 1, 3072, 1024, 1024, 1024, 3072]
    - [26, 12169.0]
  - - [512, 512, 256, 64, 512, 512, 512, 64]
    - [14, 7741.0]
  - - [1024, 2048, 1, 30592, 1024, 1024, 1024, 30592]
    - [33, 11083.0]
  - - [1024, 4096, 1, 30592, 1024, 1024, 1024, 30592]
    - [20, 11978.0]
  - - [512, 512, 128, 64, 512, 512, 512, 64]
    - [0, 9590.0]
  - - [2560, 2048, 1, 1920, 2560, 2560, 2560, 1920]
    - [1, 12433.0]
  - - [2560, 2048, 1, 2560, 2560, 2560, 2560, 2560]
    - [1, 12464.0]
  - - [2560, 2048, 1, 7680, 2560, 2560, 2560, 7680]
    - [28, 12456.0]
  - - [640, 2048, 1, 2560, 640, 640, 640, 2560]
    - [5, 11822.0]
  - - [512, 512, 40, 64, 512, 512, 512, 64]
    - [16, 10983.0]
  - - [1536, 4096, 1, 1536, 1536, 1536, 1536, 1536]
    - [1, 11965.0]
  - - [1536, 4096, 1, 4608, 1536, 1536, 1536, 4608]
    - [23, 11947.0]
  - - [1536, 4096, 1, 50304, 1536, 1536, 1536, 50304]
    - [5, 11930.0]
  - - [1536, 4096, 1, 6144, 1536, 1536, 1536, 6144]
    - [41, 11954.0]
  - - [6144, 4096, 1, 1536, 6144, 6144, 6144, 1536]
    - [1, 12592.0]
  - - [1024, 1024, 64, 96, 1024, 1024, 1024, 96]
    - [11, 11395.0]
  - - [1536, 8192, 1, 1536, 1536, 1536, 1536, 1536]
    - [23, 12403.0]
  - - [1536, 8192, 1, 4608, 1536, 1536, 1536, 4608]
    - [1, 12444.0]
  - - [1536, 8192, 1, 50304, 1536, 1536, 1536, 50304]
    - [3, 12364.0]
  - - [1536, 8192, 1, 6144, 1536, 1536, 1536, 6144]
    - [37, 12415.0]
  - - [6144, 8192, 1, 1536, 6144, 6144, 6144, 1536]
    - [1, 12677.0]
  - - [1024, 1024, 128, 96, 1024, 1024, 1024, 96]
    - [11, 11511.0]
  - - [1024, 16384, 1, 1024, 1024, 1024, 1024, 1024]
    - [23, 12372.0]
  - - [1024, 16384, 1, 3072, 1024, 1024, 1024, 3072]
    - [8, 12467.0]
  - - [1024, 16384, 1, 4096, 1024, 1024, 1024, 4096]
    - [8, 12460.0]
  - - [1024, 16384, 1, 50304, 1024, 1024, 1024, 50304]
    - [5, 12264.0]
  - - [4096, 16384, 1, 1024, 4096, 4096, 4096, 1024]
    - [3, 12537.0]
  - - [1024, 1024, 256, 64, 1024, 1024, 1024, 64]
    - [25, 8901.0]
  - - [1024, 2048, 1, 50304, 1024, 1024, 1024, 50304]
    - [20, 11091.0]
  - - [1024, 1024, 32, 64, 1024, 1024, 1024, 64]
    - [0, 10243.0]
  - - [1024, 4096, 1, 50304, 1024, 1024, 1024, 50304]
    - [3, 12057.0]
  - - [1024, 1024, 64, 64, 1024, 1024, 1024, 64]
    - [10, 8886.0]
  - - [1024, 8192, 1, 50304, 1024, 1024, 1024, 50304]
    - [3, 12060.0]
  - - [1024, 1024, 128, 64, 1024, 1024, 1024, 64]
    - [10, 8893.0]
  - - [128, 128, 1024, 64, 128, 128, 128, 64]
    - [29, 6058.0]
  - - [1024, 8192, 1, 30528, 1024, 1024, 1024, 30528]
    - [13, 12286.0]
  - - [1024, 3456, 1, 1024, 1024, 1024, 1024, 1024]
    - [3, 11631.0]
  - - [1024, 3456, 1, 512, 1024, 1024, 1024, 512]
    - [3, 11579.0]
  - - [256, 6912, 1, 128, 256, 256, 256, 128]
    - [0, 9951.0]
  - - [480, 3456, 1, 1024, 480, 480, 480, 1024]
    - [22, 10400.0]
  - - [512, 3456, 1, 256, 512, 512, 512, 256]
    - [22, 9899.0]
  - - [1024, 1280, 1, 30528, 1024, 1024, 1024, 30528]
    - [5, 12143.0]
  - - [1024, 1600, 1, 30528, 1024, 1024, 1024, 30528]
    - [0, 11516.0]
  - - [1024, 10240, 1, 1024, 1024, 1024, 1024, 1024]
    - [23, 12445.0]
  - - [1024, 10240, 1, 4096, 1024, 1024, 1024, 4096]
    - [23, 12521.0]
  - - [4096, 10240, 1, 1024, 4096, 4096, 4096, 1024]
    - [1, 12647.0]
  - - [128, 128, 1280, 64, 128, 128, 128, 64]
    - [0, 7484.0]
  - - [1024, 1640, 1, 30528, 1024, 1024, 1024, 30528]
    - [0, 10800.0]
  - - [1024, 10496, 1, 1024, 1024, 1024, 1024, 1024]
    - [8, 12366.0]
  - - [1024, 10496, 1, 4096, 1024, 1024, 1024, 4096]
    - [8, 12445.0]
  - - [4096, 10496, 1, 1024, 4096, 4096, 4096, 1024]
    - [1, 12578.0]
  - - [128, 128, 1312, 64, 128, 128, 128, 64]
    - [0, 7335.0]
  - - [1024, 6144, 1, 4096, 1024, 1024, 1024, 4096]
    - [8, 12031.0]
  - - [4096, 6144, 1, 1024, 4096, 4096, 4096, 1024]
    - [1, 12575.0]
  - - [1024, 6144, 1, 1024, 1024, 1024, 1024, 1024]
    - [8, 11910.0]
  - - [512, 512, 192, 64, 512, 512, 512, 64]
    - [0, 11218.0]
  - - [256, 6912, 1, 1, 256, 256, 256, 1]
    - [1, 213.0]
  - - [3136, 128, 64, 64, 3136, 3136, 3136, 64]
    - [33, 8075.0]
  - - [3136, 256, 64, 128, 3136, 3136, 3136, 128]
    - [3, 11592.0]
  - - [784, 512, 64, 256, 784, 784, 784, 256]
    - [3, 10623.0]
  - - [3136, 128, 64, 256, 3136, 3136, 3136, 256]
    - [3, 11808.0]
  - - [3136, 256, 64, 256, 3136, 3136, 3136, 256]
    - [34, 12013.0]
  - - [196, 1024, 64, 512, 196, 196, 196, 512]
    - [40, 9171.0]
  - - [784, 256, 64, 512, 784, 784, 784, 512]
    - [20, 10639.0]
  - - [784, 512, 64, 512, 784, 784, 784, 512]
    - [3, 10772.0]
  - - [196, 512, 64, 1024, 196, 196, 196, 1024]
    - [40, 9143.0]
  - - [196, 1024, 64, 1024, 196, 196, 196, 1024]
    - [11, 9294.0]
  - - [3136, 128, 32, 64, 3136, 3136, 3136, 64]
    - [16, 10769.0]
  - - [3136, 256, 32, 128, 3136, 3136, 3136, 128]
    - [0, 11303.0]
  - - [784, 512, 32, 256, 784, 784, 784, 256]
    - [31, 10498.0]
  - - [3136, 128, 32, 256, 3136, 3136, 3136, 256]
    - [20, 11605.0]
  - - [3136, 256, 32, 256, 3136, 3136, 3136, 256]
    - [3, 11835.0]
  - - [196, 1024, 32, 512, 196, 196, 196, 512]
    - [11, 9021.0]
  - - [784, 256, 32, 512, 784, 784, 784, 512]
    - [37, 10265.0]
  - - [784, 512, 32, 512, 784, 784, 784, 512]
    - [20, 10641.0]
  - - [196, 512, 32, 1024, 196, 196, 196, 1024]
    - [11, 8993.0]
  - - [196, 1024, 32, 1024, 196, 196, 196, 1024]
    - [40, 9170.0]
  - - [1024, 10224, 1, 1024, 1024, 1024, 1024, 1024]
    - [23, 12417.0]
  - - [1024, 10192, 1, 1024, 1024, 1024, 1024, 1024]
    - [23, 12376.0]
  - - [1024, 10208, 1, 1024, 1024, 1024, 1024, 1024]
    - [8, 12400.0]
  - - [1024, 10224, 1, 4096, 1024, 1024, 1024, 4096]
    - [23, 12494.0]
  - - [1024, 10224, 1, 3072, 1024, 1024, 1024, 3072]
    - [23, 12471.0]
  - - [4096, 10224, 1, 1024, 4096, 4096, 4096, 1024]
    - [1, 12622.0]
  - - [1024, 10240, 1, 3072, 1024, 1024, 1024, 3072]
    - [23, 12495.0]
  - - [1024, 10192, 1, 3072, 1024, 1024, 1024, 3072]
    - [23, 12451.0]
  - - [4096, 10192, 1, 1024, 4096, 4096, 4096, 1024]
    - [1, 12594.0]
  - - [1024, 10192, 1, 4096, 1024, 1024, 1024, 4096]
    - [23, 12472.0]
  - - [1024, 10200, 1, 3072, 1024, 1024, 1024, 3072]
    - [8, 12446.0]
  - - [1024, 10184, 1, 1024, 1024, 1024, 1024, 1024]
    - [23, 12362.0]
  - - [4096, 10208, 1, 1024, 4096, 4096, 4096, 1024]
    - [1, 12611.0]
  - - [1024, 10208, 1, 3072, 1024, 1024, 1024, 3072]
    - [8, 12468.0]
  - - [1024, 10208, 1, 4096, 1024, 1024, 1024, 4096]
    - [23, 12480.0]
  - - [1024, 10224, 1, 2048, 1024, 1024, 1024, 2048]
    - [23, 12455.0]
  - - [1024, 10240, 1, 2048, 1024, 1024, 1024, 2048]
    - [8, 12482.0]
  - - [1024, 10120, 1, 1024, 1024, 1024, 1024, 1024]
    - [23, 12299.0]
  - - [1024, 10192, 1, 2048, 1024, 1024, 1024, 2048]
    - [8, 12449.0]
  - - [1024, 10152, 1, 1024, 1024, 1024, 1024, 1024]
    - [23, 12349.0]
  - - [1024, 10080, 1, 3072, 1024, 1024, 1024, 3072]
    - [23, 12359.0]
  - - [100352, 512, 1, 256, 100352, 100352, 100352, 256]
    - [34, 12375.0]
  - - [12544, 2048, 1, 1024, 12544, 12544, 12544, 1024]
    - [1, 12572.0]
  - - [200704, 512, 1, 256, 200704, 200704, 200704, 256]
    - [20, 12430.0]
  - - [25088, 1024, 1, 512, 25088, 25088, 25088, 512]
    - [8, 12464.0]
  - - [50176, 1024, 1, 512, 50176, 50176, 50176, 512]
    - [20, 12493.0]
  - - [6272, 2048, 1, 1024, 6272, 6272, 6272, 1024]
    - [1, 12376.0]
  - - [196, 1024, 128, 256, 196, 196, 196, 256]
    - [11, 9025.0]
  - - [196, 1024, 256, 256, 196, 196, 196, 256]
    - [3, 9143.0]
  - - [196, 256, 128, 1024, 196, 196, 196, 1024]
    - [40, 9101.0]
  - - [196, 256, 256, 1024, 196, 196, 196, 1024]
    - [40, 9234.0]
  - - [196, 512, 128, 1024, 196, 196, 196, 1024]
    - [26, 9298.0]
  - - [196, 512, 256, 1024, 196, 196, 196, 1024]
    - [40, 9428.0]
  - - [3136, 128, 128, 256, 3136, 3136, 3136, 256]
    - [3, 12039.0]
  - - [3136, 128, 256, 256, 3136, 3136, 3136, 256]
    - [34, 12093.0]
  - - [784, 256, 128, 512, 784, 784, 784, 512]
    - [3, 10801.0]
  - - [784, 256, 256, 512, 784, 784, 784, 512]
    - [3, 10857.0]
  - - [128, 128, 2048, 64, 128, 128, 128, 64]
    - [0, 6029.0]
  - - [1024, 2560, 1, 30528, 1024, 1024, 1024, 30528]
    - [5, 12360.0]
  - - [128, 128, 1536, 64, 128, 128, 128, 64]
    - [0, 6790.0]
  - - [1024, 12288, 1, 4096, 1024, 1024, 1024, 4096]
    - [23, 12417.0]
  - - [1024, 12288, 1, 1024, 1024, 1024, 1024, 1024]
    - [23, 12332.0]
  - - [4096, 12288, 1, 1024, 4096, 4096, 4096, 1024]
    - [1, 12641.0]
  - - [1024, 1920, 1, 30528, 1024, 1024, 1024, 30528]
    - [8, 11994.0]
  - - [128, 128, 192, 64, 128, 128, 128, 64]
    - [18, 8538.0]
  - - [384, 384, 144, 64, 384, 384, 384, 64]
    - [0, 11328.0]
  - - [768, 4608, 1, 2, 768, 768, 768, 2]
    - [0, 532.0]
  - - [3072, 4608, 1, 768, 3072, 3072, 3072, 768]
    - [8, 12323.0]
  - - [768, 4608, 1, 3072, 768, 768, 768, 3072]
    - [37, 12040.0]
  - - [768, 4608, 1, 768, 768, 768, 768, 768]
    - [1, 11789.0]
  - - [512, 512, 48, 64, 512, 512, 512, 64]
    - [3, 8906.0]
  - - [128, 128, 256, 64, 128, 128, 128, 64]
    - [12, 9026.0]
  - - [384, 384, 192, 64, 384, 384, 384, 64]
    - [0, 8165.0]
  - - [1024, 4608, 1, 2, 1024, 1024, 1024, 2]
    - [7, 480.0]
  - - [4096, 4608, 1, 1024, 4096, 4096, 4096, 1024]
    - [1, 12539.0]
  - - [1024, 4608, 1, 4096, 1024, 1024, 1024, 4096]
    - [8, 11891.0]
  - - [1024, 4608, 1, 1024, 1024, 1024, 1024, 1024]
    - [8, 11672.0]
  - - [3072, 256, 2, 1024, 3072, 3072, 3072, 1024]
    - [1, 11103.0]
  - - [2852, 256, 2, 1024, 2852, 2852, 2852, 1024]
    - [18, 10207.0]
  - - [3220, 256, 2, 1024, 3220, 3220, 3220, 1024]
    - [16, 10101.0]
  - - [850, 2048, 2, 512, 850, 850, 850, 512]
    - [16, 10031.0]
  - - [768, 2048, 2, 512, 768, 768, 768, 512]
    - [0, 10616.0]
  - - [2904, 256, 2, 1024, 2904, 2904, 2904, 1024]
    - [18, 10157.0]
  - - [805, 2048, 2, 512, 805, 805, 805, 512]
    - [16, 9779.0]
  - - [864, 2048, 2, 512, 864, 864, 864, 512]
    - [16, 10575.0]
  - - [2992, 256, 2, 1024, 2992, 2992, 2992, 1024]
    - [32, 10409.0]
  - - [3400, 256, 2, 1024, 3400, 3400, 3400, 1024]
    - [30, 10618.0]
  - - [4032, 256, 2, 1024, 4032, 4032, 4032, 1024]
    - [30, 10815.0]
  - - [15200, 128, 2, 512, 15200, 15200, 15200, 512]
    - [34, 11386.0]
  - - [12288, 128, 2, 512, 12288, 12288, 12288, 512]
    - [37, 11442.0]
  - - [888, 2048, 2, 512, 888, 888, 888, 512]
    - [16, 11157.0]
  - - [13600, 128, 2, 512, 13600, 13600, 13600, 512]
    - [37, 11348.0]
  - - [12880, 128, 2, 512, 12880, 12880, 12880, 512]
    - [16, 10972.0]
  - - [3456, 256, 2, 1024, 3456, 3456, 3456, 1024]
    - [30, 11231.0]
  - - [2944, 256, 2, 1024, 2944, 2944, 2944, 1024]
    - [40, 10405.0]
  - - [2688, 256, 2, 1024, 2688, 2688, 2688, 1024]
    - [16, 10242.0]
  - - [13824, 128, 2, 512, 13824, 13824, 13824, 512]
    - [20, 11630.0]
  - - [3036, 256, 2, 1024, 3036, 3036, 3036, 1024]
    - [1, 10865.0]
  - - [3168, 256, 2, 1024, 3168, 3168, 3168, 1024]
    - [2, 10887.0]
  - - [3360, 256, 2, 1024, 3360, 3360, 3360, 1024]
    - [30, 10498.0]
  - - [3552, 256, 2, 1024, 3552, 3552, 3552, 1024]
    - [38, 10526.0]
  - - [11616, 128, 2, 512, 11616, 11616, 11616, 512]
    - [30, 10578.0]
  - - [4200, 256, 2, 1024, 4200, 4200, 4200, 1024]
    - [18, 10833.0]
  - - [840, 2048, 2, 512, 840, 840, 840, 512]
    - [16, 10584.0]
  - - [14208, 128, 2, 512, 14208, 14208, 14208, 512]
    - [30, 11183.0]
  - - [11968, 128, 2, 512, 11968, 11968, 11968, 512]
    - [30, 11197.0]
  - - [3264, 256, 2, 1024, 3264, 3264, 3264, 1024]
    - [16, 10518.0]
  - - [713, 2048, 2, 512, 713, 713, 713, 512]
    - [30, 8811.0]
  - - [13600, 256, 2, 512, 13600, 13600, 13600, 512]
    - [8, 11619.0]
  - - [12880, 256, 2, 512, 12880, 12880, 12880, 512]
    - [1, 11584.0]
  - - [12288, 256, 2, 512, 12288, 12288, 12288, 512]
    - [1, 11756.0]
  - - [2816, 256, 2, 1024, 2816, 2816, 2816, 1024]
    - [30, 10966.0]
  - - [850, 2048, 1, 512, 850, 850, 850, 512]
    - [16, 9945.0]
  - - [660, 2048, 2, 512, 660, 660, 660, 512]
    - [24, 9531.0]
  - - [672, 2048, 2, 512, 672, 672, 672, 512]
    - [23, 9766.0]
  - - [13440, 128, 2, 512, 13440, 13440, 13440, 512]
    - [16, 11561.0]
  - - [726, 2048, 2, 512, 726, 726, 726, 512]
    - [16, 10458.0]
  - - [3500, 256, 2, 1024, 3500, 3500, 3500, 1024]
    - [1, 10616.0]
  - - [13824, 256, 2, 512, 13824, 13824, 13824, 512]
    - [3, 11899.0]
  - - [15200, 256, 2, 512, 15200, 15200, 15200, 512]
    - [40, 11871.0]
  - - [3700, 256, 2, 1024, 3700, 3700, 3700, 1024]
    - [32, 11118.0]
  - - [748, 2048, 2, 512, 748, 748, 748, 512]
    - [3, 10809.0]
  - - [3600, 256, 2, 1024, 3600, 3600, 3600, 1024]
    - [9, 10891.0]
  - - [4032, 1024, 2, 256, 4032, 4032, 4032, 256]
    - [1, 11618.0]
  - - [16128, 128, 2, 512, 16128, 16128, 16128, 512]
    - [34, 11455.0]
  - - [15200, 128, 1, 512, 15200, 15200, 15200, 512]
    - [24, 11068.0]
  - - [13600, 128, 1, 512, 13600, 13600, 13600, 512]
    - [36, 10638.0]
  - - [2904, 1024, 2, 256, 2904, 2904, 2904, 256]
    - [30, 11320.0]
  - - [2992, 1024, 2, 256, 2992, 2992, 2992, 256]
    - [17, 11152.0]
  - - [1536, 2048, 1, 1024, 1536, 1536, 1536, 1024]
    - [8, 11534.0]
  - - [24576, 128, 1, 256, 24576, 24576, 24576, 256]
    - [16, 10948.0]
  - - [24576, 512, 1, 256, 24576, 24576, 24576, 256]
    - [3, 11915.0]
  - - [25760, 128, 1, 256, 25760, 25760, 25760, 256]
    - [7, 10575.0]
  - - [25760, 512, 1, 256, 25760, 25760, 25760, 256]
    - [8, 11990.0]
  - - [6144, 256, 1, 512, 6144, 6144, 6144, 512]
    - [18, 10921.0]
  - - [6440, 256, 1, 512, 6440, 6440, 6440, 512]
    - [16, 10124.0]
  - - [3036, 1024, 2, 256, 3036, 3036, 3036, 256]
    - [16, 11275.0]
  - - [13600, 512, 1, 128, 13600, 13600, 13600, 128]
    - [0, 11028.0]
  - - [9408, 512, 2, 128, 9408, 9408, 9408, 128]
    - [30, 11315.0]
  - - [56000, 256, 2, 64, 56000, 56000, 56000, 64]
    - [0, 11320.0]
  - - [2852, 1024, 2, 256, 2852, 2852, 2852, 256]
    - [16, 11145.0]
  - - [2816, 1024, 2, 256, 2816, 2816, 2816, 256]
    - [8, 11704.0]
  - - [60800, 256, 1, 64, 60800, 60800, 60800, 64]
    - [22, 11421.0]
  - - [2944, 1024, 2, 256, 2944, 2944, 2944, 256]
    - [37, 11683.0]
  - - [11776, 512, 2, 128, 11776, 11776, 11776, 128]
    - [8, 11683.0]
  - - [11616, 512, 2, 128, 11616, 11616, 11616, 128]
    - [1, 11621.0]
  - - [4200, 1024, 2, 256, 4200, 4200, 4200, 256]
    - [1, 11764.0]
  - - [54400, 256, 1, 64, 54400, 54400, 54400, 64]
    - [30, 11409.0]
  - - [15200, 512, 1, 128, 15200, 15200, 15200, 128]
    - [0, 11361.0]
  - - [2688, 1024, 2, 256, 2688, 2688, 2688, 256]
    - [1, 11857.0]
  - - [12672, 512, 2, 128, 12672, 12672, 12672, 128]
    - [23, 11832.0]
  - - [11968, 512, 2, 128, 11968, 11968, 11968, 128]
    - [0, 11467.0]
  - - [46464, 256, 2, 64, 46464, 46464, 46464, 64]
    - [0, 11305.0]
  - - [2400, 256, 2, 1024, 2400, 2400, 2400, 1024]
    - [38, 10691.0]
  - - [2520, 256, 2, 1024, 2520, 2520, 2520, 1024]
    - [35, 11204.0]
  - - [2400, 1024, 2, 256, 2400, 2400, 2400, 256]
    - [0, 11195.0]
  - - [10752, 128, 2, 512, 10752, 10752, 10752, 512]
    - [30, 11338.0]
  - - [45632, 256, 2, 64, 45632, 45632, 45632, 64]
    - [16, 10996.0]
  - - [2520, 1024, 2, 256, 2520, 2520, 2520, 256]
    - [37, 11409.0]
  - - [53760, 256, 2, 64, 53760, 53760, 53760, 64]
    - [0, 11432.0]
  - - [2352, 256, 2, 1024, 2352, 2352, 2352, 1024]
    - [18, 10498.0]
  - - [47872, 256, 2, 64, 47872, 47872, 47872, 64]
    - [1, 10679.0]
  - - [47104, 256, 2, 64, 47104, 47104, 47104, 64]
    - [16, 10432.0]
  - - [50688, 256, 2, 64, 50688, 50688, 50688, 64]
    - [0, 9521.0]
  - - [45056, 256, 2, 64, 45056, 45056, 45056, 64]
    - [16, 10821.0]
  - - [13440, 512, 2, 128, 13440, 13440, 13440, 128]
    - [37, 11864.0]
  - - [2352, 1024, 2, 256, 2352, 2352, 2352, 256]
    - [0, 10979.0]
  - - [11264, 512, 2, 128, 11264, 11264, 11264, 128]
    - [8, 11581.0]
  - - [10560, 128, 2, 512, 10560, 10560, 10560, 512]
    - [30, 11043.0]
  - - [16128, 512, 2, 128, 16128, 16128, 16128, 128]
    - [37, 11781.0]
  - - [37632, 256, 2, 64, 37632, 37632, 37632, 64]
    - [36, 11424.0]
  - - [51520, 256, 2, 64, 51520, 51520, 51520, 64]
    - [0, 11142.0]
  - - [14000, 512, 2, 128, 14000, 14000, 14000, 128]
    - [1, 11605.0]
  - - [10560, 512, 2, 128, 10560, 10560, 10560, 128]
    - [0, 11422.0]
  - - [64512, 256, 2, 64, 64512, 64512, 64512, 64]
    - [0, 11191.0]
  - - [54400, 256, 2, 64, 54400, 54400, 54400, 64]
    - [8, 8881.0]
  - - [3264, 1024, 2, 256, 3264, 3264, 3264, 256]
    - [8, 11547.0]
  - - [10752, 512, 2, 128, 10752, 10752, 10752, 128]
    - [8, 11632.0]
  - - [3168, 1024, 2, 256, 3168, 3168, 3168, 256]
    - [1, 11837.0]
  - - [950, 2048, 1, 512, 950, 950, 950, 512]
    - [16, 10385.0]
  - - [55296, 256, 2, 256, 55296, 55296, 55296, 256]
    - [26, 12214.0]
  - - [51520, 256, 2, 256, 51520, 51520, 51520, 256]
    - [34, 12112.0]
  - - [11408, 128, 2, 512, 11408, 11408, 11408, 512]
    - [24, 11564.0]
  - - [60800, 256, 2, 256, 60800, 60800, 60800, 256]
    - [34, 12330.0]
  - - [54400, 256, 2, 256, 54400, 54400, 54400, 256]
    - [20, 12308.0]
  - - [3700, 1024, 2, 256, 3700, 3700, 3700, 256]
    - [16, 11454.0]
  - - [60800, 256, 2, 64, 60800, 60800, 60800, 64]
    - [0, 11022.0]
  - - [3800, 1024, 1, 256, 3800, 3800, 3800, 256]
    - [2, 11304.0]
  - - [3400, 1024, 1, 256, 3400, 3400, 3400, 256]
    - [1, 11119.0]
  - - [3072, 1024, 2, 256, 3072, 3072, 3072, 256]
    - [16, 11452.0]
  - - [3600, 1024, 2, 256, 3600, 3600, 3600, 256]
    - [37, 11223.0]
  - - [12288, 512, 2, 128, 12288, 12288, 12288, 128]
    - [16, 11452.0]
  - - [49152, 256, 2, 256, 49152, 49152, 49152, 256]
    - [26, 11974.0]
  - - [12880, 512, 2, 128, 12880, 12880, 12880, 128]
    - [2, 11480.0]
  - - [11408, 512, 2, 128, 11408, 11408, 11408, 128]
    - [1, 11554.0]
  - - [42240, 256, 2, 64, 42240, 42240, 42240, 64]
    - [16, 11394.0]
  - - [1008, 2048, 2, 512, 1008, 1008, 1008, 512]
    - [1, 11515.0]
  - - [3360, 1024, 2, 256, 3360, 3360, 3360, 256]
    - [1, 11433.0]
  - - [14208, 512, 2, 128, 14208, 14208, 14208, 128]
    - [37, 11701.0]
  - - [56832, 256, 2, 64, 56832, 56832, 56832, 64]
    - [0, 9689.0]
  - - [43008, 256, 2, 64, 43008, 43008, 43008, 64]
    - [16, 11167.0]
  - - [13600, 512, 2, 128, 13600, 13600, 13600, 128]
    - [1, 11677.0]
  - - [3500, 1024, 2, 256, 3500, 3500, 3500, 256]
    - [8, 11459.0]
  - - [2640, 1024, 2, 256, 2640, 2640, 2640, 256]
    - [1, 11641.0]
  - - [13824, 512, 2, 128, 13824, 13824, 13824, 128]
    - [37, 11735.0]
  - - [3800, 256, 2, 1024, 3800, 3800, 3800, 1024]
    - [8, 11550.0]
  - - [55296, 256, 2, 64, 55296, 55296, 55296, 64]
    - [0, 10045.0]
  - - [2640, 256, 2, 1024, 2640, 2640, 2640, 1024]
    - [7, 10228.0]
  - - [15200, 512, 2, 128, 15200, 15200, 15200, 128]
    - [37, 11508.0]
  - - [3552, 1024, 2, 256, 3552, 3552, 3552, 256]
    - [1, 11576.0]
  - - [3220, 1024, 2, 256, 3220, 3220, 3220, 256]
    - [3, 11246.0]
  - - [3456, 1024, 2, 256, 3456, 3456, 3456, 256]
    - [8, 11857.0]
  - - [49152, 256, 2, 64, 49152, 49152, 49152, 64]
    - [1, 9207.0]
  - - [3400, 1024, 2, 256, 3400, 3400, 3400, 256]
    - [8, 11533.0]
  - - [950, 2048, 2, 512, 950, 950, 950, 512]
    - [23, 10893.0]
  - - [3800, 1024, 2, 256, 3800, 3800, 3800, 256]
    - [17, 11750.0]
  - - [1610, 2048, 1, 1024, 1610, 1610, 1610, 1024]
    - [22, 11106.0]
  - - [6912, 256, 1, 512, 6912, 6912, 6912, 512]
    - [16, 11043.0]
  - - [6800, 256, 1, 512, 6800, 6800, 6800, 512]
    - [16, 10659.0]
  - - [27648, 128, 1, 256, 27648, 27648, 27648, 256]
    - [23, 11474.0]
  - - [27200, 128, 1, 256, 27200, 27200, 27200, 256]
    - [32, 10920.0]
  - - [30400, 128, 1, 256, 30400, 30400, 30400, 256]
    - [23, 11241.0]
  - - [7600, 256, 1, 512, 7600, 7600, 7600, 512]
    - [9, 11165.0]
  - - [6144, 1024, 1, 512, 6144, 6144, 6144, 512]
    - [1, 11708.0]
  - - [6912, 1024, 1, 512, 6912, 6912, 6912, 512]
    - [1, 12015.0]
  - - [6440, 1024, 1, 512, 6440, 6440, 6440, 512]
    - [1, 11589.0]
  - - [27648, 512, 1, 256, 27648, 27648, 27648, 256]
    - [40, 11974.0]
  - - [1728, 2048, 1, 1024, 1728, 1728, 1728, 1024]
    - [16, 10987.0]
  - - [27200, 512, 1, 256, 27200, 27200, 27200, 256]
    - [1, 11932.0]
  - - [6800, 1024, 1, 512, 6800, 6800, 6800, 512]
    - [37, 11713.0]
  - - [1700, 2048, 1, 1024, 1700, 1700, 1700, 1024]
    - [7, 10799.0]
  - - [7600, 1024, 1, 512, 7600, 7600, 7600, 512]
    - [1, 12188.0]
  - - [30400, 512, 1, 256, 30400, 30400, 30400, 256]
    - [8, 12101.0]
  - - [1900, 2048, 1, 1024, 1900, 1900, 1900, 1024]
    - [8, 11967.0]
  - - [12544, 1024, 1, 1024, 12544, 12544, 12544, 1024]
    - [1, 12313.0]
  - - [1024, 1024, 160, 96, 1024, 1024, 1024, 96]
    - [11, 11522.0]
  - - [1920, 16384, 1, 25216, 1920, 1920, 1920, 25216]
    - [17, 12476.0]
  - - [3840, 16384, 1, 1920, 3840, 3840, 3840, 1920]
    - [1, 12650.0]
  - - [1920, 16384, 1, 3840, 1920, 1920, 1920, 3840]
    - [3, 12016.0]
  - - [960, 16384, 1, 1920, 960, 960, 960, 1920]
    - [1, 11627.0]
  - - [1920, 16384, 1, 2880, 1920, 1920, 1920, 2880]
    - [17, 12702.0]
  - - [1024, 1024, 40, 96, 1024, 1024, 1024, 96]
    - [0, 11561.0]
  - - [1920, 4096, 1, 25216, 1920, 1920, 1920, 25216]
    - [17, 12388.0]
  - - [3840, 4096, 1, 1920, 3840, 3840, 3840, 1920]
    - [17, 12613.0]
  - - [1920, 4096, 1, 3840, 1920, 1920, 1920, 3840]
    - [20, 12407.0]
  - - [960, 4096, 1, 1920, 960, 960, 960, 1920]
    - [1, 11392.0]
  - - [1920, 4096, 1, 2880, 1920, 1920, 1920, 2880]
    - [31, 12571.0]
  - - [1024, 1024, 80, 96, 1024, 1024, 1024, 96]
    - [11, 11504.0]
  - - [1920, 8192, 1, 25216, 1920, 1920, 1920, 25216]
    - [3, 12258.0]
  - - [3840, 8192, 1, 1920, 3840, 3840, 3840, 1920]
    - [17, 12666.0]
  - - [1920, 8192, 1, 3840, 1920, 1920, 1920, 3840]
    - [20, 12502.0]
  - - [960, 8192, 1, 1920, 960, 960, 960, 1920]
    - [17, 11528.0]
  - - [1920, 8192, 1, 2880, 1920, 1920, 1920, 2880]
    - [17, 12661.0]
  - - [1024, 1024, 96, 96, 1024, 1024, 1024, 96]
    - [11, 11407.0]
  - - [2304, 16384, 1, 12672, 2304, 2304, 2304, 12672]
    - [17, 12518.0]
  - - [2304, 16384, 1, 2304, 2304, 2304, 2304, 2304]
    - [8, 12593.0]
  - - [576, 16384, 1, 2304, 576, 576, 576, 2304]
    - [23, 11172.0]
  - - [2304, 16384, 1, 1728, 2304, 2304, 2304, 1728]
    - [17, 12627.0]
  - - [1024, 1024, 24, 96, 1024, 1024, 1024, 96]
    - [7, 11588.0]
  - - [2304, 4096, 1, 12672, 2304, 2304, 2304, 12672]
    - [17, 12339.0]
  - - [2304, 4096, 1, 2304, 2304, 2304, 2304, 2304]
    - [17, 12471.0]
  - - [576, 4096, 1, 2304, 576, 576, 576, 2304]
    - [17, 10922.0]
  - - [2304, 4096, 1, 1728, 2304, 2304, 2304, 1728]
    - [1, 12522.0]
  - - [1024, 1024, 48, 96, 1024, 1024, 1024, 96]
    - [11, 11417.0]
  - - [2304, 8192, 1, 12672, 2304, 2304, 2304, 12672]
    - [17, 12386.0]
  - - [2304, 8192, 1, 2304, 2304, 2304, 2304, 2304]
    - [23, 12508.0]
  - - [576, 8192, 1, 2304, 576, 576, 576, 2304]
    - [37, 11147.0]
  - - [2304, 8192, 1, 1728, 2304, 2304, 2304, 1728]
    - [17, 12606.0]
  - - [1024, 1024, 16, 96, 1024, 1024, 1024, 96]
    - [8, 11581.0]
  - - [3072, 4096, 1, 6400, 3072, 3072, 3072, 6400]
    - [1, 12475.0]
  - - [1536, 4096, 1, 3072, 1536, 1536, 1536, 3072]
    - [23, 12002.0]
  - - [3072, 4096, 1, 1536, 3072, 3072, 3072, 1536]
    - [1, 12356.0]
  - - [384, 4096, 1, 3072, 384, 384, 384, 3072]
    - [8, 11380.0]
  - - [3072, 4096, 1, 1152, 3072, 3072, 3072, 1152]
    - [17, 12354.0]
  - - [1024, 1024, 32, 96, 1024, 1024, 1024, 96]
    - [11, 11347.0]
  - - [3072, 8192, 1, 6400, 3072, 3072, 3072, 6400]
    - [1, 12623.0]
  - - [1536, 8192, 1, 3072, 1536, 1536, 1536, 3072]
    - [26, 12287.0]
  - - [3072, 8192, 1, 1536, 3072, 3072, 3072, 1536]
    - [3, 12495.0]
  - - [384, 8192, 1, 3072, 384, 384, 384, 3072]
    - [28, 11688.0]
  - - [3072, 8192, 1, 1152, 3072, 3072, 3072, 1152]
    - [1, 12576.0]
  - - [2048, 4096, 1, 2048, 2048, 2048, 2048, 2048]
    - [1, 12331.0]
  - - [2048, 4096, 1, 4096, 2048, 2048, 2048, 4096]
    - [11, 12242.0]
  - - [4096, 4096, 1, 2048, 4096, 4096, 4096, 2048]
    - [1, 12354.0]
  - - [1024, 2283, 1, 29000, 1024, 1024, 1024, 29000]
    - [7, 11162.0]
  - - [1024, 2296, 1, 29000, 1024, 1024, 1024, 29000]
    - [7, 11217.0]
  - - [1024, 2306, 1, 29000, 1024, 1024, 1024, 29000]
    - [0, 11261.0]
  - - [1024, 2309, 1, 29000, 1024, 1024, 1024, 29000]
    - [0, 11272.0]
  - - [1024, 2318, 1, 29000, 1024, 1024, 1024, 29000]
    - [0, 11316.0]
  - - [1024, 2320, 1, 29000, 1024, 1024, 1024, 29000]
    - [0, 11329.0]
  - - [1024, 2324, 1, 29000, 1024, 1024, 1024, 29000]
    - [0, 11316.0]
  - - [1024, 2325, 1, 29000, 1024, 1024, 1024, 29000]
    - [7, 11330.0]
  - - [1024, 2329, 1, 29000, 1024, 1024, 1024, 29000]
    - [0, 11327.0]
  - - [1024, 2338, 1, 29000, 1024, 1024, 1024, 29000]
    - [0, 11362.0]
  - - [1024, 2345, 1, 29000, 1024, 1024, 1024, 29000]
    - [7, 11418.0]
  - - [1024, 2350, 1, 29000, 1024, 1024, 1024, 29000]
    - [0, 11449.0]
  - - [1024, 2362, 1, 29000, 1024, 1024, 1024, 29000]
    - [30, 11482.0]
  - - [1024, 2366, 1, 29000, 1024, 1024, 1024, 29000]
    - [30, 11501.0]
  - - [1024, 2368, 1, 29000, 1024, 1024, 1024, 29000]
    - [16, 11512.0]
  - - [1024, 2374, 1, 29000, 1024, 1024, 1024, 29000]
    - [5, 11480.0]
  - - [1024, 2390, 1, 29000, 1024, 1024, 1024, 29000]
    - [5, 11554.0]
  - - [512, 512, 320, 64, 512, 512, 512, 64]
    - [0, 9166.0]
  - - [512, 512, 80, 64, 512, 512, 512, 64]
    - [16, 10845.0]
  - - [2560, 1024, 1, 2560, 2560, 2560, 2560, 2560]
    - [1, 12219.0]
  - - [2560, 1024, 1, 4096, 2560, 2560, 2560, 4096]
    - [5, 12265.0]
  - - [4096, 1024, 1, 2560, 4096, 4096, 4096, 2560]
    - [8, 12023.0]
  - - [1024, 1024, 512, 64, 1024, 1024, 1024, 64]
    - [25, 8913.0]
  - - [1024, 32768, 1, 3072, 1024, 1024, 1024, 3072]
    - [3, 12534.0]
  - - [1024, 32768, 1, 4096, 1024, 1024, 1024, 4096]
    - [26, 11827.0]
  - - [1024, 32768, 1, 50304, 1024, 1024, 1024, 50304]
    - [13, 12030.0]
  - - [4096, 32768, 1, 1024, 4096, 4096, 4096, 1024]
    - [1, 12516.0]
  - - [1024, 1024, 24, 128, 1024, 1024, 1024, 128]
    - [11, 11708.0]
  - - [128, 1024, 24, 1024, 128, 128, 128, 1024]
    - [26, 11159.0]
  - - [768, 320, 1, 30522, 768, 768, 768, 30522]
    - [42, 11110.0]
  - - [768, 640, 1, 30522, 768, 768, 768, 30522]
    - [45, 11813.0]
  - - [768, 1280, 1, 30522, 768, 768, 768, 30522]
    - [43, 12220.0]
  - - [1024, 780, 1, 30522, 1024, 1024, 1024, 30522]
    - [42, 10787.0]
  - - [1024, 308, 1, 30522, 1024, 1024, 1024, 30522]
    - [42, 10826.0]
  - - [1024, 800, 1, 30522, 1024, 1024, 1024, 30522]
    - [42, 11043.0]
  - - [1024, 820, 1, 30522, 1024, 1024, 1024, 30522]
    - [42, 11313.0]
  - - [1024, 385, 1, 30522, 1024, 1024, 1024, 30522]
    - [47, 9250.0]
  - - [1024, 462, 1, 30522, 1024, 1024, 1024, 30522]
    - [42, 10207.0]
  - - [1024, 640, 1, 30528, 1024, 1024, 1024, 30528]
    - [43, 11961.0]
  - - [2048, 199, 1, 29000, 2048, 2048, 2048, 29000]
    - [47, 8752.0]
  - - [2048, 221, 1, 29000, 2048, 2048, 2048, 29000]
    - [46, 9718.0]
  - - [2048, 224, 1, 29000, 2048, 2048, 2048, 29000]
    - [46, 9836.0]
  - - [2048, 229, 1, 29000, 2048, 2048, 2048, 29000]
    - [46, 10055.0]
  - - [2048, 234, 1, 29000, 2048, 2048, 2048, 29000]
    - [46, 10263.0]
  - - [2048, 242, 1, 29000, 2048, 2048, 2048, 29000]
    - [46, 10608.0]
  - - [2048, 246, 1, 29000, 2048, 2048, 2048, 29000]
    - [47, 10779.0]
  - - [2048, 247, 1, 29000, 2048, 2048, 2048, 29000]
    - [47, 10820.0]
  - - [2048, 256, 1, 29000, 2048, 2048, 2048, 29000]
    - [46, 11217.0]
  - - [2048, 262, 1, 29000, 2048, 2048, 2048, 29000]
    - [47, 9421.0]
  - - [2048, 264, 1, 29000, 2048, 2048, 2048, 29000]
    - [47, 9490.0]
  - - [2048, 265, 1, 29000, 2048, 2048, 2048, 29000]
    - [47, 9526.0]
  - - [2048, 274, 1, 29000, 2048, 2048, 2048, 29000]
    - [47, 9846.0]
  - - [2048, 277, 1, 29000, 2048, 2048, 2048, 29000]
    - [47, 9954.0]
  - - [2048, 279, 1, 29000, 2048, 2048, 2048, 29000]
    - [47, 10021.0]
  - - [2048, 288, 1, 29000, 2048, 2048, 2048, 29000]
    - [47, 10333.0]
  - - [2048, 296, 1, 29000, 2048, 2048, 2048, 29000]
    - [47, 10623.0]
  - - [2048, 315, 1, 29000, 2048, 2048, 2048, 29000]
    - [47, 11263.0]
  - - [2048, 335, 1, 29000, 2048, 2048, 2048, 29000]
    - [48, 10210.0]
  - - [1024, 561, 1, 29000, 1024, 1024, 1024, 29000]
    - [42, 10828.0]
  - - [1024, 574, 1, 29000, 1024, 1024, 1024, 29000]
    - [42, 11027.0]
  - - [1024, 600, 1, 29000, 1024, 1024, 1024, 29000]
    - [43, 11274.0]
  - - [1024, 608, 1, 29000, 1024, 1024, 1024, 29000]
    - [43, 11403.0]
  - - [1024, 615, 1, 29000, 1024, 1024, 1024, 29000]
    - [43, 11525.0]
  - - [1024, 622, 1, 29000, 1024, 1024, 1024, 29000]
    - [43, 11649.0]
  - - [1024, 625, 1, 29000, 1024, 1024, 1024, 29000]
    - [43, 11712.0]
  - - [1024, 626, 1, 29000, 1024, 1024, 1024, 29000]
    - [43, 11708.0]
  - - [1024, 628, 1, 29000, 1024, 1024, 1024, 29000]
    - [43, 11778.0]
  - - [1024, 636, 1, 29000, 1024, 1024, 1024, 29000]
    - [43, 11909.0]
  - - [1024, 651, 1, 29000, 1024, 1024, 1024, 29000]
    - [44, 10481.0]
  - - [1024, 658, 1, 29000, 1024, 1024, 1024, 29000]
    - [42, 10594.0]
  - - [1024, 669, 1, 29000, 1024, 1024, 1024, 29000]
    - [42, 10752.0]
  - - [1024, 670, 1, 29000, 1024, 1024, 1024, 29000]
    - [42, 10780.0]
  - - [1024, 672, 1, 29000, 1024, 1024, 1024, 29000]
    - [42, 10815.0]
  - - [1024, 684, 1, 29000, 1024, 1024, 1024, 29000]
    - [42, 10996.0]
  - - [1024, 716, 1, 29000, 1024, 1024, 1024, 29000]
    - [43, 10909.0]
  - - [1024, 730, 1, 29000, 1024, 1024, 1024, 29000]
    - [43, 11093.0]
  - - [1600, 512, 1, 1024, 1600, 1600, 1600, 1024]
    - [65, 9003.0]
  - - [1024, 512, 1, 1, 1024, 1024, 1024, 1]
    - [100, 127.0]
  - - [1024, 512, 1, 64, 1024, 1024, 1024, 64]
    - [50, 3902.0]
  - - [2048, 512, 1, 1, 2048, 2048, 2048, 1]
    - [49, 175.0]
  - - [768, 640, 1, 768, 768, 768, 768, 768]
    - [53, 9185.0]
  - - [768, 1024, 1, 2, 768, 768, 768, 2]
    - [54, 296.0]
  - - [768, 1024, 1, 768, 768, 768, 768, 768]
    - [78, 9875.0]
  - - [768, 1280, 1, 768, 768, 768, 768, 768]
    - [53, 10468.0]
  - - [768, 512, 1, 2, 768, 768, 768, 2]
    - [107, 161.0]
  - - [768, 512, 1, 768, 768, 768, 768, 768]
    - [53, 7512.0]
  - - [1024, 512, 1, 1024, 1024, 1024, 1024, 1024]
    - [87, 8095.0]
  - - [1024, 512, 1, 2, 1024, 1024, 1024, 2]
    - [66, 256.0]
  - - [64, 64, 768, 64, 64, 64, 64, 64]
    - [56, 6779.0]
  - - [64, 64, 96, 64, 64, 64, 64, 64]
    - [98, 4695.0]
  - - [704, 1024, 1, 128, 704, 704, 704, 128]
    - [51, 7702.0]
  - - [1024, 1024, 1, 3328, 1024, 1024, 1024, 3328]
    - [53, 10306.0]
  - - [1856, 448, 1, 3328, 1856, 1856, 1856, 3328]
    - [54, 9720.0]
  - - [128, 6784, 1, 3328, 128, 128, 128, 3328]
    - [59, 9868.0]
  - - [2368, 448, 1, 128, 2368, 2368, 2368, 128]
    - [97, 8424.0]
  - - [256, 4288, 1, 3328, 256, 256, 256, 3328]
    - [53, 10767.0]
  - - [704, 1856, 1, 3328, 704, 704, 704, 3328]
    - [78, 10038.0]
  - - [448, 1024, 1, 1280, 448, 448, 448, 1280]
    - [106, 8245.0]
  - - [256, 1408, 1, 3328, 256, 256, 256, 3328]
    - [53, 7622.0]
  - - [704, 1856, 1, 1280, 704, 704, 704, 1280]
    - [99, 9742.0]
  - - [128, 5056, 1, 128, 128, 128, 128, 128]
    - [53, 6846.0]
  - - [2368, 128, 1, 256, 2368, 2368, 2368, 256]
    - [51, 6643.0]
  - - [64, 5056, 1, 256, 64, 64, 64, 256]
    - [108, 5523.0]
  - - [256, 2944, 1, 256, 256, 256, 256, 256]
    - [64, 7792.0]
  - - [256, 1856, 1, 1280, 256, 256, 256, 1280]
    - [87, 9368.0]
  - - [4288, 256, 1, 256, 4288, 4288, 4288, 256]
    - [53, 9190.0]
  - - [2944, 128, 1, 128, 2944, 2944, 2944, 128]
    - [52, 4525.0]
  - - [5888, 64, 1, 3328, 5888, 5888, 5888, 3328]
    - [69, 7876.0]
  - - [2944, 256, 1, 3328, 2944, 2944, 2944, 3328]
    - [87, 10106.0]
  - - [1408, 448, 1, 1280, 1408, 1408, 1408, 1280]
    - [82, 9914.0]
  - - [1408, 704, 1, 3328, 1408, 1408, 1408, 3328]
    - [64, 9725.0]
  - - [1408, 256, 1, 1280, 1408, 1408, 1408, 1280]
    - [99, 7261.0]
  - - [3072, 128, 1, 1024, 3072, 3072, 3072, 1024]
    - [64, 7877.0]
  - - [6784, 64, 1, 256, 6784, 6784, 6784, 256]
    - [62, 6351.0]
  - - [2944, 256, 1, 256, 2944, 2944, 2944, 256]
    - [53, 8210.0]
  - - [704, 1408, 1, 3328, 704, 704, 704, 3328]
    - [53, 9648.0]
  - - [2944, 256, 1, 128, 2944, 2944, 2944, 128]
    - [53, 6563.0]
  - - [2368, 128, 1, 3328, 2368, 2368, 2368, 3328]
    - [100, 8672.0]
  - - [64, 193600, 1, 64, 64, 64, 64, 64]
    - [89, 8367.0]
  - - [448, 1408, 1, 256, 448, 448, 448, 256]
    - [85, 8544.0]
  - - [64, 5056, 1, 3328, 64, 64, 64, 3328]
    - [67, 8469.0]
  - - [512, 1500, 1, 2816, 512, 512, 512, 2816]
    - [64, 10206.0]
  - - [1024, 448, 1, 128, 1024, 1024, 1024, 128]
    - [97, 5160.0]
  - - [256, 3584, 1, 3328, 256, 256, 256, 3328]
    - [65, 10436.0]
  - - [256, 1408, 1, 256, 256, 256, 256, 256]
    - [82, 5992.0]
  - - [5056, 64, 1, 1280, 5056, 5056, 5056, 1280]
    - [51, 8790.0]
  - - [1024, 704, 1, 256, 1024, 1024, 1024, 256]
    - [53, 7907.0]
  - - [128, 4288, 1, 128, 128, 128, 128, 128]
    - [99, 5338.0]
  - - [3584, 256, 1, 128, 3584, 3584, 3584, 128]
    - [53, 7232.0]
  - - [448, 1024, 1, 256, 448, 448, 448, 256]
    - [106, 6734.0]
  - - [5888, 64, 1, 256, 5888, 5888, 5888, 256]
    - [109, 6380.0]
  - - [1856, 256, 1, 1280, 1856, 1856, 1856, 1280]
    - [87, 9137.0]
  - - [64, 5888, 1, 3328, 64, 64, 64, 3328]
    - [55, 7123.0]
  - - [448, 1856, 1, 128, 448, 448, 448, 128]
    - [97, 6711.0]
  - - [1024, 704, 1, 1280, 1024, 1024, 1024, 1280]
    - [78, 9300.0]
  - - [128, 5888, 1, 256, 128, 128, 128, 256]
    - [109, 7824.0]
  - - [704, 704, 1, 3328, 704, 704, 704, 3328]
    - [65, 8340.0]
  - - [704, 1408, 1, 1280, 704, 704, 704, 1280]
    - [78, 9563.0]
  - - [3584, 256, 1, 3328, 3584, 3584, 3584, 3328]
    - [65, 10785.0]
  - - [704, 1856, 1, 128, 704, 704, 704, 128]
    - [97, 8041.0]
  - - [128, 3584, 1, 3328, 128, 128, 128, 3328]
    - [64, 9642.0]
  - - [2944, 448, 1, 128, 2944, 2944, 2944, 128]
    - [78, 8024.0]
  - - [64, 193600, 1, 256, 64, 64, 64, 256]
    - [111, 7886.0]
  - - [128, 2944, 1, 1280, 128, 128, 128, 1280]
    - [64, 7807.0]
  - - [448, 2944, 1, 1280, 448, 448, 448, 1280]
    - [54, 9084.0]
  - - [3584, 128, 1, 256, 3584, 3584, 3584, 256]
    - [53, 6703.0]
  - - [448, 1408, 1, 3328, 448, 448, 448, 3328]
    - [81, 9105.0]
  - - [704, 1024, 1, 256, 704, 704, 704, 256]
    - [64, 7690.0]
  - - [256, 3584, 1, 256, 256, 256, 256, 256]
    - [87, 8461.0]
  - - [256, 2944, 1, 3328, 256, 256, 256, 3328]
    - [64, 10258.0]
  - - [448, 2368, 1, 128, 448, 448, 448, 128]
    - [97, 7412.0]
  - - [1408, 704, 1, 256, 1408, 1408, 1408, 256]
    - [82, 8579.0]
  - - [448, 2944, 1, 3328, 448, 448, 448, 3328]
    - [79, 9372.0]
  - - [64, 5888, 1, 256, 64, 64, 64, 256]
    - [63, 5365.0]
  - - [512, 1500, 1, 2048, 512, 512, 512, 2048]
    - [64, 9985.0]
  - - [6784, 128, 1, 3328, 6784, 6784, 6784, 3328]
    - [54, 10160.0]
  - - [704, 704, 1, 256, 704, 704, 704, 256]
    - [64, 6903.0]
  - - [448, 704, 1, 1280, 448, 448, 448, 1280]
    - [51, 8159.0]
  - - [1024, 448, 1, 3328, 1024, 1024, 1024, 3328]
    - [53, 9522.0]
  - - [2944, 128, 1, 256, 2944, 2944, 2944, 256]
    - [78, 5708.0]
  - - [1024, 1024, 1, 1280, 1024, 1024, 1024, 1280]
    - [78, 9981.0]
  - - [448, 1024, 1, 128, 448, 448, 448, 128]
    - [85, 5178.0]
  - - [448, 2368, 1, 3328, 448, 448, 448, 3328]
    - [54, 9345.0]
  - - [5056, 64, 1, 128, 5056, 5056, 5056, 128]
    - [86, 5769.0]
  - - [1024, 700, 1, 512, 1024, 1024, 1024, 512]
    - [99, 8943.0]
  - - [128, 6784, 1, 1280, 128, 128, 128, 1280]
    - [72, 9699.0]
  - - [1856, 256, 1, 256, 1856, 1856, 1856, 256]
    - [85, 7847.0]
  - - [128, 5888, 1, 1280, 128, 128, 128, 1280]
    - [87, 9684.0]
  - - [256, 4288, 1, 1280, 256, 256, 256, 1280]
    - [109, 10313.0]
  - - [256, 1856, 1, 128, 256, 256, 256, 128]
    - [64, 5307.0]
  - - [7680, 64, 1, 2560, 7680, 7680, 7680, 2560]
    - [57, 10125.0]
  - - [448, 1408, 1, 128, 448, 448, 448, 128]
    - [58, 6136.0]
  - - [6784, 128, 1, 256, 6784, 6784, 6784, 256]
    - [99, 8842.0]
  - - [704, 448, 1, 256, 704, 704, 704, 256]
    - [85, 5670.0]
  - - [704, 448, 1, 128, 704, 704, 704, 128]
    - [105, 4350.0]
  - - [704, 1408, 1, 128, 704, 704, 704, 128]
    - [97, 7463.0]
  - - [4288, 128, 1, 1280, 4288, 4288, 4288, 1280]
    - [79, 8644.0]
  - - [128, 2944, 1, 128, 128, 128, 128, 128]
    - [80, 4902.0]
  - - [128, 4288, 1, 256, 128, 128, 128, 256]
    - [87, 6685.0]
  - - [704, 448, 1, 3328, 704, 704, 704, 3328]
    - [51, 8509.0]
  - - [448, 2368, 1, 1280, 448, 448, 448, 1280]
    - [65, 8980.0]
  - - [64, 6784, 1, 3328, 64, 64, 64, 3328]
    - [67, 7856.0]
  - - [2944, 256, 1, 1280, 2944, 2944, 2944, 1280]
    - [64, 9925.0]
  - - [256, 2368, 1, 128, 256, 256, 256, 128]
    - [106, 6006.0]
  - - [1856, 704, 1, 256, 1856, 1856, 1856, 256]
    - [106, 8711.0]
  - - [1856, 448, 1, 1280, 1856, 1856, 1856, 1280]
    - [54, 9367.0]
  - - [128, 5888, 1, 128, 128, 128, 128, 128]
    - [85, 6737.0]
  - - [1024, 1024, 1, 256, 1024, 1024, 1024, 256]
    - [64, 8842.0]
  - - [704, 1856, 1, 256, 704, 704, 704, 256]
    - [78, 8697.0]
  - - [256, 2368, 1, 1280, 256, 256, 256, 1280]
    - [88, 9456.0]
  - - [2944, 448, 1, 256, 2944, 2944, 2944, 256]
    - [78, 9111.0]
  - - [1856, 448, 1, 128, 1856, 1856, 1856, 128]
    - [76, 6719.0]
  - - [2368, 128, 1, 1280, 2368, 2368, 2368, 1280]
    - [53, 7729.0]
  - - [64, 6784, 1, 256, 64, 64, 64, 256]
    - [89, 5580.0]
  - - [64, 5056, 1, 1280, 64, 64, 64, 1280]
    - [67, 7725.0]
  - - [3025, 64, 64, 64, 3025, 3025, 3025, 64]
    - [78, 7480.0]
  - - [2368, 256, 1, 1280, 2368, 2368, 2368, 1280]
    - [54, 9887.0]
  - - [2368, 448, 1, 1280, 2368, 2368, 2368, 1280]
    - [109, 10084.0]
  - - [128, 3584, 1, 256, 128, 128, 128, 256]
    - [109, 6742.0]
  - - [704, 448, 1, 1280, 704, 704, 704, 1280]
    - [106, 7959.0]
  - - [4288, 256, 1, 1280, 4288, 4288, 4288, 1280]
    - [78, 10303.0]
  - - [4288, 128, 1, 3328, 4288, 4288, 4288, 3328]
    - [83, 8779.0]
  - - [7680, 128, 1, 2560, 7680, 7680, 7680, 2560]
    - [54, 11220.0]
  - - [1408, 256, 1, 128, 1408, 1408, 1408, 128]
    - [63, 4982.0]
  - - [256, 1408, 1, 1280, 256, 256, 256, 1280]
    - [53, 7257.0]
  - - [6784, 64, 1, 3328, 6784, 6784, 6784, 3328]
    - [91, 9068.0]
  - - [128, 2944, 1, 3328, 128, 128, 128, 3328]
    - [64, 7912.0]
  - - [2944, 448, 1, 3328, 2944, 2944, 2944, 3328]
    - [53, 10228.0]
  - - [5888, 128, 1, 256, 5888, 5888, 5888, 256]
    - [85, 8389.0]
  - - [5056, 64, 1, 256, 5056, 5056, 5056, 256]
    - [90, 6228.0]
  - - [512, 1500, 1, 1536, 512, 512, 512, 1536]
    - [64, 9822.0]
  - - [128, 3584, 1, 1280, 128, 128, 128, 1280]
    - [87, 9003.0]
  - - [1024, 704, 1, 128, 1024, 1024, 1024, 128]
    - [64, 6426.0]
  - - [128, 5056, 1, 3328, 128, 128, 128, 3328]
    - [72, 10501.0]
  - - [1024, 1024, 1, 128, 1024, 1024, 1024, 128]
    - [64, 7600.0]
  - - [4288, 128, 1, 256, 4288, 4288, 4288, 256]
    - [76, 6622.0]
  - - [1408, 448, 1, 128, 1408, 1408, 1408, 128]
    - [78, 6348.0]
  - - [3584, 256, 1, 256, 3584, 3584, 3584, 256]
    - [88, 8784.0]
  - - [128, 2944, 1, 256, 128, 128, 128, 256]
    - [64, 5602.0]
  - - [128, 6784, 1, 128, 128, 128, 128, 128]
    - [64, 6688.0]
  - - [448, 1856, 1, 256, 448, 448, 448, 256]
    - [99, 7701.0]
  - - [3584, 128, 1, 3328, 3584, 3584, 3584, 3328]
    - [53, 9729.0]
  - - [5888, 128, 1, 3328, 5888, 5888, 5888, 3328]
    - [64, 10132.0]
  - - [1408, 704, 1, 1280, 1408, 1408, 1408, 1280]
    - [87, 9688.0]
  - - [448, 2944, 1, 256, 448, 448, 448, 256]
    - [88, 8035.0]
  - - [448, 2368, 1, 256, 448, 448, 448, 256]
    - [87, 7863.0]
  - - [64, 6784, 1, 1280, 64, 64, 64, 1280]
    - [89, 7914.0]
  - - [128, 2368, 1, 3328, 128, 128, 128, 3328]
    - [91, 8650.0]
  - - [5056, 64, 1, 3328, 5056, 5056, 5056, 3328]
    - [57, 8872.0]
  - - [64, 5888, 1, 128, 64, 64, 64, 128]
    - [63, 4314.0]
  - - [5056, 128, 1, 3328, 5056, 5056, 5056, 3328]
    - [79, 10786.0]
  - - [448, 704, 1, 256, 448, 448, 448, 256]
    - [85, 5734.0]
  - - [2944, 128, 1, 3328, 2944, 2944, 2944, 3328]
    - [99, 7891.0]
  - - [128, 5056, 1, 1280, 128, 128, 128, 1280]
    - [64, 10172.0]
  - - [704, 704, 1, 128, 704, 704, 704, 128]
    - [62, 5003.0]
  - - [2368, 128, 1, 128, 2368, 2368, 2368, 128]
    - [63, 4154.0]
  - - [5056, 128, 1, 128, 5056, 5056, 5056, 128]
    - [64, 6145.0]
  - - [448, 1024, 1, 3328, 448, 448, 448, 3328]
    - [55, 8490.0]
  - - [2368, 256, 1, 256, 2368, 2368, 2368, 256]
    - [53, 7425.0]
  - - [256, 2368, 1, 3328, 256, 256, 256, 3328]
    - [88, 10002.0]
  - - [256, 3584, 1, 128, 256, 256, 256, 128]
    - [53, 6868.0]
  - - [4288, 256, 1, 128, 4288, 4288, 4288, 128]
    - [53, 7712.0]
  - - [448, 1856, 1, 3328, 448, 448, 448, 3328]
    - [54, 9568.0]
  - - [2368, 256, 1, 128, 2368, 2368, 2368, 128]
    - [51, 5996.0]
  - - [256, 1856, 1, 256, 256, 256, 256, 256]
    - [64, 6935.0]
  - - [256, 2944, 1, 128, 256, 256, 256, 128]
    - [78, 6448.0]
  - - [1408, 256, 1, 3328, 1408, 1408, 1408, 3328]
    - [64, 7554.0]
  - - [2368, 448, 1, 256, 2368, 2368, 2368, 256]
    - [53, 8835.0]
  - - [4288, 256, 1, 3328, 4288, 4288, 4288, 3328]
    - [53, 10861.0]
  - - [1856, 704, 1, 128, 1856, 1856, 1856, 128]
    - [51, 8198.0]
  - - [4288, 128, 1, 128, 4288, 4288, 4288, 128]
    - [57, 5884.0]
  - - [6784, 64, 1, 1280, 6784, 6784, 6784, 1280]
    - [99, 8485.0]
  - - [3584, 128, 1, 128, 3584, 3584, 3584, 128]
    - [62, 5097.0]
  - - [256, 2368, 1, 256, 256, 256, 256, 256]
    - [53, 7313.0]
  - - [2944, 448, 1, 1280, 2944, 2944, 2944, 1280]
    - [78, 9941.0]
  - - [448, 1408, 1, 1280, 448, 448, 448, 1280]
    - [106, 8659.0]
  - - [448, 1856, 1, 1280, 448, 448, 448, 1280]
    - [65, 9148.0]
  - - [1856, 256, 1, 128, 1856, 1856, 1856, 128]
    - [86, 6168.0]
  - - [128, 2368, 1, 256, 128, 128, 128, 256]
    - [87, 5623.0]
  - - [5888, 64, 1, 1280, 5888, 5888, 5888, 1280]
    - [109, 7532.0]
  - - [1024, 448, 1, 1280, 1024, 1024, 1024, 1280]
    - [53, 9045.0]
  - - [128, 5056, 1, 256, 128, 128, 128, 256]
    - [91, 7600.0]
  - - [1856, 704, 1, 1280, 1856, 1856, 1856, 1280]
    - [78, 9715.0]
  - - [448, 2944, 1, 128, 448, 448, 448, 128]
    - [85, 7896.0]
  - - [1408, 256, 1, 256, 1408, 1408, 1408, 256]
    - [78, 5586.0]
  - - [2368, 448, 1, 3328, 2368, 2368, 2368, 3328]
    - [109, 10355.0]
  - - [128, 5888, 1, 3328, 128, 128, 128, 3328]
    - [64, 10030.0]
  - - [64, 5056, 1, 128, 64, 64, 64, 128]
    - [108, 4226.0]
  - - [64, 6784, 1, 128, 64, 64, 64, 128]
    - [85, 4616.0]
  - - [448, 704, 1, 128, 448, 448, 448, 128]
    - [77, 4286.0]
  - - [1408, 448, 1, 256, 1408, 1408, 1408, 256]
    - [53, 7955.0]
  - - [1408, 704, 1, 128, 1408, 1408, 1408, 128]
    - [78, 7359.0]
  - - [2368, 256, 1, 3328, 2368, 2368, 2368, 3328]
    - [54, 10221.0]
  - - [5888, 128, 1, 1280, 5888, 5888, 5888, 1280]
    - [53, 9589.0]
  - - [256, 3584, 1, 1280, 256, 256, 256, 1280]
    - [88, 10076.0]
  - - [256, 1408, 1, 128, 256, 256, 256, 128]
    - [64, 4288.0]
  - - [256, 4288, 1, 128, 256, 256, 256, 128]
    - [109, 7466.0]
  - - [5888, 128, 1, 128, 5888, 5888, 5888, 128]
    - [99, 6431.0]
  - - [1408, 448, 1, 3328, 1408, 1408, 1408, 3328]
    - [53, 10217.0]
  - - [704, 1024, 1, 1280, 704, 704, 704, 1280]
    - [78, 9304.0]
  - - [1856, 256, 1, 3328, 1856, 1856, 1856, 3328]
    - [109, 9813.0]
  - - [64, 5888, 1, 1280, 64, 64, 64, 1280]
    - [111, 7171.0]
  - - [6784, 64, 1, 128, 6784, 6784, 6784, 128]
    - [99, 4944.0]
  - - [704, 704, 1, 1280, 704, 704, 704, 1280]
    - [99, 7836.0]
  - - [128, 2368, 1, 1280, 128, 128, 128, 1280]
    - [91, 7866.0]
  - - [3584, 256, 1, 1280, 3584, 3584, 3584, 1280]
    - [110, 10291.0]
  - - [128, 4288, 1, 3328, 128, 128, 128, 3328]
    - [59, 9106.0]
  - - [3584, 128, 1, 1280, 3584, 3584, 3584, 1280]
    - [109, 9383.0]
  - - [5056, 128, 1, 1280, 5056, 5056, 5056, 1280]
    - [54, 10172.0]
  - - [256, 4288, 1, 256, 256, 256, 256, 256]
    - [64, 8804.0]
  - - [1024, 448, 1, 256, 1024, 1024, 1024, 256]
    - [53, 6788.0]
  - - [2944, 128, 1, 1280, 2944, 2944, 2944, 1280]
    - [87, 7813.0]
  - - [128, 2368, 1, 128, 128, 128, 128, 128]
    - [87, 5359.0]
  - - [256, 2944, 1, 1280, 256, 256, 256, 1280]
    - [64, 9612.0]
  - - [2560, 128, 1, 2560, 2560, 2560, 2560, 2560]
    - [116, 9398.0]
  - - [704, 1024, 1, 3328, 704, 704, 704, 3328]
    - [53, 9528.0]
  - - [128, 6784, 1, 256, 128, 128, 128, 256]
    - [64, 8119.0]
  - - [256, 1856, 1, 3328, 256, 256, 256, 3328]
    - [87, 9832.0]
  - - [6784, 128, 1, 128, 6784, 6784, 6784, 128]
    - [87, 8066.0]
  - - [128, 3584, 1, 128, 128, 128, 128, 128]
    - [53, 6510.0]
  - - [704, 1408, 1, 256, 704, 704, 704, 256]
    - [64, 8929.0]
  - - [4096, 128, 1, 4096, 4096, 4096, 4096, 4096]
    - [65, 8926.0]
  - - [5888, 64, 1, 128, 5888, 5888, 5888, 128]
    - [53, 4441.0]
  - - [5056, 128, 1, 256, 5056, 5056, 5056, 256]
    - [62, 7742.0]
  - - [6784, 128, 1, 1280, 6784, 6784, 6784, 1280]
    - [54, 9786.0]
  - - [1856, 448, 1, 256, 1856, 1856, 1856, 256]
    - [53, 8026.0]
  - - [1024, 704, 1, 3328, 1024, 1024, 1024, 3328]
    - [99, 9665.0]
  - - [128, 4288, 1, 1280, 128, 128, 128, 1280]
    - [109, 8762.0]
  - - [448, 704, 1, 3328, 448, 448, 448, 3328]
    - [51, 8348.0]
  - - [1856, 704, 1, 3328, 1856, 1856, 1856, 3328]
    - [53, 10078.0]
  - - [512, 1500, 1, 2560, 512, 512, 512, 2560]
    - [64, 10102.0]
  - - [3136, 64, 128, 64, 3136, 3136, 3136, 64]
    - [75, 5085.0]
  - - [3136, 64, 128, 256, 3136, 3136, 3136, 256]
    - [57, 8791.0]
  - - [3136, 64, 256, 64, 3136, 3136, 3136, 64]
    - [49, 5209.0]
  - - [3136, 64, 256, 256, 3136, 3136, 3136, 256]
    - [57, 8741.0]
  - - [1024, 512, 1, 2048, 1024, 1024, 1024, 2048]
    - [54, 8808.0]
  - - [4096, 256, 1, 2048, 4096, 4096, 4096, 2048]
    - [53, 10324.0]
  - - [2048, 256, 1, 4096, 2048, 2048, 2048, 4096]
    - [83, 8873.0]
  - - [512, 768, 1, 2048, 512, 512, 512, 2048]
    - [87, 8008.0]
  - - [2048, 256, 1, 1024, 2048, 2048, 2048, 1024]
    - [88, 8179.0]
  - - [2048, 200, 1, 512, 2048, 2048, 2048, 512]
    - [99, 5914.0]
  - - [4096, 200, 1, 1024, 4096, 4096, 4096, 1024]
    - [99, 7793.0]
  - - [2048, 200, 1, 4096, 2048, 2048, 2048, 4096]
    - [100, 6932.0]
  - - [2048, 512, 1, 1024, 2048, 2048, 2048, 1024]
    - [78, 10054.0]
  - - [1024, 1024, 1, 512, 1024, 1024, 1024, 512]
    - [78, 9577.0]
  - - [2048, 512, 1, 4096, 2048, 2048, 2048, 4096]
    - [87, 10312.0]
  - - [1024, 1024, 1, 4096, 1024, 1024, 1024, 4096]
    - [64, 10295.0]
  - - [4096, 200, 1, 2048, 4096, 4096, 4096, 2048]
    - [51, 8014.0]
  - - [2048, 200, 1, 1024, 2048, 2048, 2048, 1024]
    - [99, 6402.0]
  - - [1024, 768, 1, 512, 1024, 1024, 1024, 512]
    - [53, 9395.0]
  - - [2048, 200, 1, 2048, 2048, 2048, 2048, 2048]
    - [79, 6738.0]
  - - [2048, 256, 1, 2048, 2048, 2048, 2048, 2048]
    - [79, 8578.0]
  - - [512, 768, 1, 512, 512, 512, 512, 512]
    - [64, 7079.0]
  - - [4096, 256, 1, 4096, 4096, 4096, 4096, 4096]
    - [53, 10370.0]
  - - [1024, 512, 1, 512, 1024, 1024, 1024, 512]
    - [65, 7951.0]
  - - [1024, 1024, 1, 2048, 1024, 1024, 1024, 2048]
    - [64, 10071.0]
  - - [4096, 256, 1, 1024, 4096, 4096, 4096, 1024]
    - [78, 9873.0]
  - - [512, 768, 1, 1024, 512, 512, 512, 1024]
    - [64, 7623.0]
  - - [1024, 512, 1, 4096, 1024, 1024, 1024, 4096]
    - [93, 8762.0]
  - - [4096, 200, 1, 4096, 4096, 4096, 4096, 4096]
    - [99, 7869.0]
  - - [2048, 256, 1, 512, 2048, 2048, 2048, 512]
    - [100, 7714.0]
  - - [1024, 1024, 1, 1024, 1024, 1024, 1024, 1024]
    - [87, 9836.0]
  - - [4096, 192, 1, 2048, 4096, 4096, 4096, 2048]
    - [78, 10247.0]
  - - [5329, 64, 64, 160, 5329, 5329, 5329, 160]
    - [52, 7488.0]
  - - [1225, 64, 64, 384, 1225, 1225, 1225, 384]
    - [103, 9104.0]
  - - [4096, 320, 1, 1280, 4096, 4096, 4096, 1280]
    - [53, 11255.0]
  - - [4096, 192, 1, 1280, 4096, 4096, 4096, 1280]
    - [99, 10060.0]
  - - [1225, 96, 64, 384, 1225, 1225, 1225, 384]
    - [83, 8047.0]
  - - [4096, 320, 1, 2048, 4096, 4096, 4096, 2048]
    - [53, 11368.0]
  - - [4096, 256, 1, 1536, 4096, 4096, 4096, 1536]
    - [78, 10085.0]
  - - [64, 147, 432, 148, 64, 64, 64, 148]
    - [76, 7599.0]
  - - [64, 123, 528, 123, 64, 64, 64, 123]
    - [101, 7590.0]
  - - [64, 111, 576, 112, 64, 64, 64, 112]
    - [51, 7643.0]
  - - [64, 77, 816, 77, 64, 64, 64, 77]
    - [106, 5948.0]
  - - [64, 92, 688, 92, 64, 64, 64, 92]
    - [97, 7037.0]
  - - [64, 159, 400, 159, 64, 64, 64, 159]
    - [101, 7290.0]
  - - [64, 85, 752, 84, 64, 64, 64, 84]
    - [76, 6727.0]
  - - [64, 122, 528, 123, 64, 64, 64, 123]
    - [55, 7524.0]
  - - [64, 93, 688, 92, 64, 64, 64, 92]
    - [97, 6832.0]
  - - [64, 102, 624, 99, 64, 64, 64, 99]
    - [76, 7370.0]
  - - [64, 133, 480, 133, 64, 64, 64, 133]
    - [51, 7306.0]
  - - [64, 232, 272, 232, 64, 64, 64, 232]
    - [55, 8048.0]
  - - [64, 162, 400, 159, 64, 64, 64, 159]
    - [81, 7269.0]
  - - [64, 78, 816, 78, 64, 64, 64, 78]
    - [97, 6050.0]
  - - [64, 99, 624, 99, 64, 64, 64, 99]
    - [85, 7433.0]
  - - [64, 101, 624, 102, 64, 64, 64, 102]
    - [97, 7461.0]
  - - [64, 111, 576, 111, 64, 64, 64, 111]
    - [76, 7847.0]
  - - [64, 134, 480, 134, 64, 64, 64, 134]
    - [51, 7320.0]
  - - [64, 135, 480, 132, 64, 64, 64, 132]
    - [97, 7483.0]
  - - [64, 134, 480, 132, 64, 64, 64, 132]
    - [51, 7125.0]
  - - [64, 134, 480, 135, 64, 64, 64, 135]
    - [51, 7378.0]
  - - [64, 162, 400, 162, 64, 64, 64, 162]
    - [55, 7422.0]
  - - [64, 102, 624, 102, 64, 64, 64, 102]
    - [62, 7449.0]
  - - [64, 135, 480, 133, 64, 64, 64, 133]
    - [97, 7250.0]
  - - [64, 148, 432, 143, 64, 64, 64, 143]
    - [97, 7435.0]
  - - [64, 100, 624, 100, 64, 64, 64, 100]
    - [76, 7515.0]
  - - [64, 65, 992, 65, 64, 64, 64, 65]
    - [106, 5053.0]
  - - [64, 122, 528, 122, 64, 64, 64, 122]
    - [51, 8447.0]
  - - [64, 228, 272, 228, 64, 64, 64, 228]
    - [55, 7972.0]
  - - [64, 112, 576, 111, 64, 64, 64, 111]
    - [55, 7385.0]
  - - [64, 143, 432, 143, 64, 64, 64, 143]
    - [76, 7528.0]
  - - [64, 135, 480, 135, 64, 64, 64, 135]
    - [76, 7279.0]
  - - [64, 232, 272, 228, 64, 64, 64, 228]
    - [81, 8074.0]
  - - [64, 193, 320, 193, 64, 64, 64, 193]
    - [97, 7404.0]
  - - [64, 71, 896, 71, 64, 64, 64, 71]
    - [97, 5633.0]
  - - [64, 84, 752, 84, 64, 64, 64, 84]
    - [51, 6282.0]
  - - [64, 132, 480, 132, 64, 64, 64, 132]
    - [76, 7229.0]
  - - [64, 85, 752, 85, 64, 64, 64, 85]
    - [76, 6563.0]
  - - [64, 102, 624, 100, 64, 64, 64, 100]
    - [97, 7485.0]
  - - [64, 78, 816, 77, 64, 64, 64, 77]
    - [51, 6090.0]
  - - [64, 112, 576, 112, 64, 64, 64, 112]
    - [97, 8173.0]
  - - [64, 148, 432, 148, 64, 64, 64, 148]
    - [97, 7088.0]
  - - [64, 159, 400, 160, 64, 64, 64, 160]
    - [97, 8080.0]
  - - [64, 102, 624, 101, 64, 64, 64, 101]
    - [76, 7400.0]
  - - [64, 101, 624, 101, 64, 64, 64, 101]
    - [85, 7391.0]
  - - [64, 160, 400, 160, 64, 64, 64, 160]
    - [97, 8117.0]
  - - [64, 93, 688, 93, 64, 64, 64, 93]
    - [76, 6859.0]
  - - [64, 147, 432, 147, 64, 64, 64, 147]
    - [51, 6883.0]
  - - [64, 100, 624, 102, 64, 64, 64, 102]
    - [76, 7428.0]
  - - [64, 177, 352, 177, 64, 64, 64, 177]
    - [55, 7895.0]
  - - [500, 1024, 1, 512, 500, 500, 500, 512]
    - [53, 7858.0]
  - - [512, 1024, 1, 512, 512, 512, 512, 512]
    - [87, 7674.0]
  - - [200, 2048, 1, 512, 200, 200, 200, 512]
    - [109, 5894.0]
  - - [512, 2000, 1, 1024, 512, 512, 512, 1024]
    - [64, 9520.0]
  - - [512, 2048, 1, 512, 512, 512, 512, 512]
    - [109, 9512.0]
  - - [200, 2000, 1, 100, 200, 200, 200, 100]
    - [50, 3636.0]
  - - [200, 2000, 1, 1024, 200, 200, 200, 1024]
    - [109, 6200.0]
  - - [500, 1024, 1, 2048, 500, 500, 500, 2048]
    - [67, 8159.0]
  - - [512, 2048, 1, 100, 512, 512, 512, 100]
    - [54, 7114.0]
  - - [512, 2048, 1, 2000, 512, 512, 512, 2000]
    - [99, 10205.0]
  - - [200, 2000, 1, 10, 200, 200, 200, 10]
    - [70, 1149.0]
  - - [500, 2048, 1, 1024, 500, 500, 500, 1024]
    - [64, 9488.0]
  - - [500, 2000, 1, 10, 500, 500, 500, 10]
    - [114, 1374.0]
  - - [500, 2048, 1, 100, 500, 500, 500, 100]
    - [76, 6975.0]
  - - [512, 1024, 1, 500, 512, 512, 512, 500]
    - [65, 8096.0]
  - - [200, 2000, 1, 2000, 200, 200, 200, 2000]
    - [110, 6736.0]
  - - [500, 2048, 1, 2000, 500, 500, 500, 2000]
    - [53, 9936.0]
  - - [512, 2048, 1, 1024, 512, 512, 512, 1024]
    - [64, 9744.0]
  - - [512, 1024, 1, 100, 512, 512, 512, 100]
    - [53, 4690.0]
  - - [256, 2000, 1, 10, 256, 256, 256, 10]
    - [49, 1103.0]
  - - [512, 2000, 1, 100, 512, 512, 512, 100]
    - [64, 6267.0]
  - - [512, 2000, 1, 2048, 512, 512, 512, 2048]
    - [87, 9814.0]
  - - [500, 1024, 1, 500, 500, 500, 500, 500]
    - [76, 7331.0]
  - - [256, 2000, 1, 100, 256, 256, 256, 100]
    - [78, 4369.0]
  - - [512, 1024, 1, 2048, 512, 512, 512, 2048]
    - [116, 8495.0]
  - - [500, 2048, 1, 2048, 500, 500, 500, 2048]
    - [87, 9862.0]
  - - [200, 2048, 1, 10, 200, 200, 200, 10]
    - [49, 716.0]
  - - [500, 2000, 1, 512, 500, 500, 500, 512]
    - [87, 8957.0]
  - - [500, 1024, 1, 1024, 500, 500, 500, 1024]
    - [109, 7772.0]
  - - [200, 2000, 1, 500, 200, 200, 200, 500]
    - [87, 6105.0]
  - - [256, 2048, 1, 100, 256, 256, 256, 100]
    - [97, 5484.0]
  - - [500, 2000, 1, 1024, 500, 500, 500, 1024]
    - [87, 9352.0]
  - - [256, 2048, 1, 1024, 256, 256, 256, 1024]
    - [109, 8054.0]
  - - [200, 2048, 1, 1024, 200, 200, 200, 1024]
    - [109, 6367.0]
  - - [512, 2048, 1, 500, 512, 512, 512, 500]
    - [78, 9623.0]
  - - [512, 2000, 1, 10, 512, 512, 512, 10]
    - [57, 1620.0]
  - - [500, 1024, 1, 2000, 500, 500, 500, 2000]
    - [54, 8488.0]
  - - [512, 2000, 1, 512, 512, 512, 512, 512]
    - [87, 9240.0]
  - - [500, 2000, 1, 2000, 500, 500, 500, 2000]
    - [78, 9694.0]
  - - [500, 1024, 1, 10, 500, 500, 500, 10]
    - [104, 842.0]
  - - [256, 2048, 1, 10, 256, 256, 256, 10]
    - [84, 851.0]
  - - [256, 2048, 1, 500, 256, 256, 256, 500]
    - [109, 7620.0]
  - - [256, 2048, 1, 2048, 256, 256, 256, 2048]
    - [116, 8464.0]
  - - [256, 2000, 1, 512, 256, 256, 256, 512]
    - [109, 7314.0]
  - - [512, 1024, 1, 2000, 512, 512, 512, 2000]
    - [100, 8810.0]
  - - [256, 2000, 1, 2000, 256, 256, 256, 2000]
    - [54, 8515.0]
  - - [256, 2048, 1, 2000, 256, 256, 256, 2000]
    - [54, 8818.0]
  - - [200, 2048, 1, 100, 200, 200, 200, 100]
    - [89, 3814.0]
  - - [200, 2000, 1, 2048, 200, 200, 200, 2048]
    - [87, 6448.0]
  - - [500, 2048, 1, 512, 500, 500, 500, 512]
    - [87, 9188.0]
  - - [500, 2000, 1, 500, 500, 500, 500, 500]
    - [78, 9019.0]
  - - [200, 2048, 1, 2048, 200, 200, 200, 2048]
    - [87, 6595.0]
  - - [200, 2048, 1, 500, 200, 200, 200, 500]
    - [103, 6034.0]
  - - [512, 2000, 1, 500, 512, 512, 512, 500]
    - [78, 9255.0]
  - - [200, 2048, 1, 2000, 200, 200, 200, 2000]
    - [54, 6798.0]
  - - [500, 1024, 1, 100, 500, 500, 500, 100]
    - [77, 4324.0]
  - - [512, 1024, 1, 10, 512, 512, 512, 10]
    - [55, 892.0]
  - - [512, 1024, 1, 1024, 512, 512, 512, 1024]
    - [72, 8137.0]
  - - [500, 2048, 1, 10, 500, 500, 500, 10]
    - [102, 1290.0]
  - - [200, 2000, 1, 512, 200, 200, 200, 512]
    - [109, 5756.0]
  - - [256, 2000, 1, 500, 256, 256, 256, 500]
    - [87, 7348.0]
  - - [256, 2048, 1, 512, 256, 256, 256, 512]
    - [87, 7639.0]
  - - [256, 2000, 1, 2048, 256, 256, 256, 2048]
    - [88, 8294.0]
  - - [500, 2048, 1, 500, 500, 500, 500, 500]
    - [97, 9306.0]
  - - [256, 2000, 1, 1024, 256, 256, 256, 1024]
    - [87, 7802.0]
  - - [500, 2000, 1, 2048, 500, 500, 500, 2048]
    - [64, 9591.0]
  - - [512, 2000, 1, 2000, 512, 512, 512, 2000]
    - [99, 9891.0]
  - - [512, 2048, 1, 2048, 512, 512, 512, 2048]
    - [64, 10072.0]
  - - [512, 2048, 1, 10, 512, 512, 512, 10]
    - [51, 1324.0]
  - - [500, 2000, 1, 100, 500, 500, 500, 100]
    - [85, 5988.0]
  - - [1024, 1131, 1, 1024, 1024, 1024, 1024, 1024]
    - [65, 9645.0]
  - - [1024, 1102, 1, 1024, 1024, 1024, 1024, 1024]
    - [65, 9439.0]
  - - [1024, 774, 1, 1024, 1024, 1024, 1024, 1024]
    - [109, 8651.0]
  - - [4096, 128, 1, 2048, 4096, 4096, 4096, 2048]
    - [65, 8740.0]
  - - [4096, 128, 1, 3072, 4096, 4096, 4096, 3072]
    - [54, 8896.0]
  - - [1024, 1120, 1, 1024, 1024, 1024, 1024, 1024]
    - [87, 9519.0]
  - - [1024, 1015, 1, 1024, 1024, 1024, 1024, 1024]
    - [109, 9706.0]
  - - [1024, 992, 1, 1024, 1024, 1024, 1024, 1024]
    - [109, 9536.0]
  - - [1024, 950, 1, 1024, 1024, 1024, 1024, 1024]
    - [109, 10475.0]
  - - [1024, 1088, 1, 1024, 1024, 1024, 1024, 1024]
    - [87, 10362.0]
  - - [64, 128, 96, 128, 64, 64, 64, 128]
    - [58, 5707.0]
  - - [768, 1024, 1, 3072, 768, 768, 768, 3072]
    - [64, 10305.0]
  - - [768, 512, 1, 3072, 768, 768, 768, 3072]
    - [109, 8259.0]
  - - [64, 256, 192, 256, 64, 64, 64, 256]
    - [111, 8061.0]
  - - [64, 128, 384, 128, 64, 64, 64, 128]
    - [101, 8295.0]
  - - [64, 256, 96, 256, 64, 64, 64, 256]
    - [67, 8480.0]
  - - [6272, 112, 1, 512, 6272, 6272, 6272, 512]
    - [99, 8137.0]
  - - [2048, 320, 1, 1280, 2048, 2048, 2048, 1280]
    - [109, 10102.0]
  - - [5329, 64, 1, 448, 5329, 5329, 5329, 448]
    - [109, 5403.0]
  - - [784, 64, 32, 192, 784, 784, 784, 192]
    - [87, 8024.0]
  - - [6272, 64, 1, 480, 6272, 6272, 6272, 480]
    - [64, 6818.0]
  - - [6272, 64, 1, 512, 6272, 6272, 6272, 512]
    - [106, 6962.0]
  - - [6272, 160, 1, 528, 6272, 6272, 6272, 528]
    - [78, 8119.0]
  - - [289, 160, 32, 768, 289, 289, 289, 768]
    - [53, 6759.0]
  - - [5329, 64, 32, 160, 5329, 5329, 5329, 160]
    - [52, 7533.0]
  - - [5329, 96, 1, 576, 5329, 5329, 5329, 576]
    - [53, 6476.0]
  - - [1225, 64, 32, 288, 1225, 1225, 1225, 288]
    - [99, 10626.0]
  - - [289, 192, 32, 768, 289, 289, 289, 768]
    - [64, 8285.0]
  - - [2048, 448, 1, 1280, 2048, 2048, 2048, 1280]
    - [53, 10327.0]
  - - [3136, 64, 32, 64, 3136, 3136, 3136, 64]
    - [99, 10333.0]
  - - [6272, 128, 1, 528, 6272, 6272, 6272, 528]
    - [53, 10314.0]
  - - [6272, 96, 1, 480, 6272, 6272, 6272, 480]
    - [53, 7495.0]
  - - [2048, 448, 1, 2048, 2048, 2048, 2048, 2048]
    - [109, 10168.0]
  - - [784, 96, 32, 192, 784, 784, 784, 192]
    - [106, 7454.0]
  - - [1001, 512, 1, 4096, 1001, 1001, 1001, 4096]
    - [59, 8631.0]
  - - [2048, 192, 1, 1280, 2048, 2048, 2048, 1280]
    - [78, 7784.0]
  - - [1225, 64, 32, 256, 1225, 1225, 1225, 256]
    - [99, 10342.0]
  - - [2048, 256, 1, 1536, 2048, 2048, 2048, 1536]
    - [65, 8717.0]
  - - [6272, 128, 1, 512, 6272, 6272, 6272, 512]
    - [87, 9458.0]
  - - [1568, 384, 1, 832, 1568, 1568, 1568, 832]
    - [79, 9192.0]
  - - [1568, 256, 1, 832, 1568, 1568, 1568, 832]
    - [53, 7583.0]
  - - [1568, 192, 1, 832, 1568, 1568, 1568, 832]
    - [51, 7495.0]
  - - [289, 192, 32, 1024, 289, 289, 289, 1024]
    - [109, 8312.0]
  - - [1225, 64, 32, 384, 1225, 1225, 1225, 384]
    - [53, 9844.0]
  - - [2048, 320, 1, 2048, 2048, 2048, 2048, 2048]
    - [53, 10644.0]
  - - [2048, 384, 1, 1536, 2048, 2048, 2048, 1536]
    - [99, 10087.0]
  - - [5041, 96, 1, 576, 5041, 5041, 5041, 576]
    - [53, 6697.0]
  - - [6272, 192, 1, 480, 6272, 6272, 6272, 480]
    - [99, 9650.0]
  - - [5041, 192, 1, 720, 5041, 5041, 5041, 720]
    - [99, 9935.0]
  - - [289, 128, 32, 768, 289, 289, 289, 768]
    - [110, 7790.0]
  - - [12544, 64, 1, 147, 12544, 12544, 12544, 147]
    - [64, 6637.0]
  - - [6272, 160, 1, 512, 6272, 6272, 6272, 512]
    - [99, 8066.0]
  - - [1225, 64, 32, 192, 1225, 1225, 1225, 192]
    - [97, 10107.0]
  - - [784, 64, 32, 256, 784, 784, 784, 256]
    - [87, 9014.0]
  - - [6272, 144, 1, 512, 6272, 6272, 6272, 512]
    - [78, 7643.0]
  - - [8192, 192, 1, 1280, 8192, 8192, 8192, 1280]
    - [53, 10670.0]
  - - [8192, 192, 1, 2048, 8192, 8192, 8192, 2048]
    - [53, 10904.0]
  - - [65, 6400, 1, 1024, 65, 65, 65, 1024]
    - [109, 5121.0]
  - - [512, 1290, 1, 2048, 512, 512, 512, 2048]
    - [109, 8749.0]
  - - [512, 2205, 1, 2048, 512, 512, 512, 2048]
    - [87, 10711.0]
  - - [64, 512, 16, 512, 64, 64, 64, 512]
    - [111, 6765.0]
  - - [512, 600, 1, 2048, 512, 512, 512, 2048]
    - [93, 8509.0]
  - - [512, 644, 1, 512, 512, 512, 512, 512]
    - [78, 6366.0]
  - - [512, 644, 1, 2048, 512, 512, 512, 2048]
    - [64, 6691.0]
  - - [512, 668, 1, 2048, 512, 512, 512, 2048]
    - [87, 6946.0]
  - - [512, 714, 1, 512, 512, 512, 512, 512]
    - [64, 6694.0]
  - - [512, 714, 1, 2048, 512, 512, 512, 2048]
    - [87, 7401.0]
  - - [512, 720, 1, 512, 512, 512, 512, 512]
    - [87, 6567.0]
  - - [512, 720, 1, 2048, 512, 512, 512, 2048]
    - [113, 7572.0]
  - - [512, 722, 1, 2048, 512, 512, 512, 2048]
    - [53, 7616.0]
  - - [512, 781, 1, 512, 512, 512, 512, 512]
    - [62, 7271.0]
  - - [512, 781, 1, 2048, 512, 512, 512, 2048]
    - [53, 8088.0]
  - - [512, 848, 1, 2048, 512, 512, 512, 2048]
    - [64, 8748.0]
  - - [512, 872, 1, 2048, 512, 512, 512, 2048]
    - [64, 8956.0]
  - - [512, 936, 1, 512, 512, 512, 512, 512]
    - [109, 8250.0]
  - - [512, 936, 1, 2048, 512, 512, 512, 2048]
    - [64, 9581.0]
  - - [512, 980, 1, 512, 512, 512, 512, 512]
    - [88, 7551.0]
  - - [512, 980, 1, 2048, 512, 512, 512, 2048]
    - [65, 8356.0]
  - - [512, 1139, 1, 2048, 512, 512, 512, 2048]
    - [110, 9426.0]
  - - [512, 1184, 1, 2048, 512, 512, 512, 2048]
    - [88, 9733.0]
  - - [512, 1186, 1, 2048, 512, 512, 512, 2048]
    - [88, 9887.0]
  - - [512, 1232, 1, 512, 512, 512, 512, 512]
    - [87, 9201.0]
  - - [512, 1232, 1, 2048, 512, 512, 512, 2048]
    - [65, 10299.0]
  - - [512, 1279, 1, 2048, 512, 512, 512, 2048]
    - [65, 10408.0]
  - - [512, 1290, 1, 512, 512, 512, 512, 512]
    - [109, 7778.0]
  - - [512, 1327, 1, 2048, 512, 512, 512, 2048]
    - [64, 8844.0]
  - - [512, 1331, 1, 2048, 512, 512, 512, 2048]
    - [64, 8828.0]
  - - [512, 1341, 1, 2048, 512, 512, 512, 2048]
    - [109, 8878.0]
  - - [512, 1350, 1, 512, 512, 512, 512, 512]
    - [109, 8265.0]
  - - [512, 1350, 1, 2048, 512, 512, 512, 2048]
    - [64, 9021.0]
  - - [512, 1359, 1, 2048, 512, 512, 512, 2048]
    - [64, 9093.0]
  - - [512, 1391, 1, 2048, 512, 512, 512, 2048]
    - [64, 9267.0]
  - - [512, 1424, 1, 512, 512, 512, 512, 512]
    - [64, 8930.0]
  - - [512, 1424, 1, 2048, 512, 512, 512, 2048]
    - [87, 9494.0]
  - - [512, 1458, 1, 512, 512, 512, 512, 512]
    - [109, 9170.0]
  - - [512, 1458, 1, 2048, 512, 512, 512, 2048]
    - [53, 9761.0]
  - - [512, 1462, 1, 512, 512, 512, 512, 512]
    - [109, 8703.0]
  - - [512, 1462, 1, 2048, 512, 512, 512, 2048]
    - [87, 9807.0]
  - - [512, 1467, 1, 2048, 512, 512, 512, 2048]
    - [87, 9643.0]
  - - [512, 1472, 1, 2048, 512, 512, 512, 2048]
    - [87, 9790.0]
  - - [512, 1520, 1, 512, 512, 512, 512, 512]
    - [109, 9064.0]
  - - [512, 1520, 1, 2048, 512, 512, 512, 2048]
    - [87, 10070.0]
  - - [512, 1596, 1, 512, 512, 512, 512, 512]
    - [64, 9415.0]
  - - [512, 1596, 1, 2048, 512, 512, 512, 2048]
    - [64, 10461.0]
  - - [512, 1599, 1, 512, 512, 512, 512, 512]
    - [64, 9315.0]
  - - [512, 1599, 1, 2048, 512, 512, 512, 2048]
    - [64, 10515.0]
  - - [512, 1615, 1, 512, 512, 512, 512, 512]
    - [87, 8518.0]
  - - [512, 1615, 1, 2048, 512, 512, 512, 2048]
    - [65, 9285.0]
  - - [512, 1680, 1, 512, 512, 512, 512, 512]
    - [88, 9179.0]
  - - [512, 1680, 1, 2048, 512, 512, 512, 2048]
    - [110, 9671.0]
  - - [512, 1709, 1, 2048, 512, 512, 512, 2048]
    - [65, 9809.0]
  - - [512, 1890, 1, 512, 512, 512, 512, 512]
    - [64, 9580.0]
  - - [512, 1902, 1, 2048, 512, 512, 512, 2048]
    - [65, 10850.0]
  - - [512, 1917, 1, 512, 512, 512, 512, 512]
    - [109, 9671.0]
  - - [512, 1917, 1, 2048, 512, 512, 512, 2048]
    - [88, 10860.0]
  - - [512, 2076, 1, 2048, 512, 512, 512, 2048]
    - [64, 10156.0]
  - - [512, 2195, 1, 2048, 512, 512, 512, 2048]
    - [64, 10693.0]
  - - [512, 2205, 1, 512, 512, 512, 512, 512]
    - [87, 9830.0]
  - - [2048, 198, 1, 512, 2048, 2048, 2048, 512]
    - [99, 5875.0]
  - - [2048, 207, 1, 512, 2048, 2048, 2048, 512]
    - [99, 6205.0]
  - - [2048, 208, 1, 512, 2048, 2048, 2048, 512]
    - [64, 6480.0]
  - - [2048, 245, 1, 512, 2048, 2048, 2048, 512]
    - [99, 7148.0]
  - - [2048, 246, 1, 512, 2048, 2048, 2048, 512]
    - [99, 7201.0]
  - - [2048, 264, 1, 512, 2048, 2048, 2048, 512]
    - [99, 7707.0]
  - - [2048, 401, 1, 512, 2048, 2048, 2048, 512]
    - [99, 8396.0]
  - - [2048, 439, 1, 512, 2048, 2048, 2048, 512]
    - [99, 9112.0]
  - - [2048, 443, 1, 512, 2048, 2048, 2048, 512]
    - [78, 9206.0]
  - - [2048, 446, 1, 512, 2048, 2048, 2048, 512]
    - [78, 9221.0]
  - - [2048, 465, 1, 512, 2048, 2048, 2048, 512]
    - [99, 8618.0]
  - - [2048, 468, 1, 512, 2048, 2048, 2048, 512]
    - [78, 8658.0]
  - - [2048, 493, 1, 512, 2048, 2048, 2048, 512]
    - [109, 9258.0]
  - - [2048, 495, 1, 512, 2048, 2048, 2048, 512]
    - [99, 9135.0]
  - - [2048, 511, 1, 512, 2048, 2048, 2048, 512]
    - [109, 9494.0]
  - - [2048, 512, 1, 512, 2048, 2048, 2048, 512]
    - [87, 9737.0]
  - - [2048, 540, 1, 512, 2048, 2048, 2048, 512]
    - [53, 9118.0]
  - - [2048, 550, 1, 512, 2048, 2048, 2048, 512]
    - [64, 9335.0]
  - - [2048, 560, 1, 512, 2048, 2048, 2048, 512]
    - [78, 9434.0]
  - - [2048, 600, 1, 512, 2048, 2048, 2048, 512]
    - [109, 9833.0]
  - - [64, 64, 496, 64, 64, 64, 64, 64]
    - [106, 5805.0]
  - - [64, 65, 496, 64, 64, 64, 64, 64]
    - [85, 4063.0]
  - - [64, 65, 496, 65, 64, 64, 64, 65]
    - [76, 3812.0]
  - - [64, 70, 216, 70, 64, 64, 64, 70]
    - [50, 3311.0]
  - - [64, 71, 216, 71, 64, 64, 64, 71]
    - [106, 3477.0]
  - - [64, 78, 248, 77, 64, 64, 64, 77]
    - [62, 4373.0]
  - - [64, 80, 152, 80, 64, 64, 64, 80]
    - [106, 3706.0]
  - - [64, 93, 344, 93, 64, 64, 64, 93]
    - [76, 5097.0]
  - - [64, 102, 312, 102, 64, 64, 64, 102]
    - [67, 5447.0]
  - - [64, 122, 264, 122, 64, 64, 64, 122]
    - [89, 6089.0]
  - - [64, 122, 264, 123, 64, 64, 64, 123]
    - [67, 6386.0]
  - - [64, 123, 264, 123, 64, 64, 64, 123]
    - [101, 6340.0]
  - - [64, 512, 96, 512, 64, 64, 64, 512]
    - [68, 7371.0]
  - - [64, 512, 128, 512, 64, 64, 64, 512]
    - [68, 7109.0]
  - - [64, 128, 512, 128, 64, 64, 64, 128]
    - [101, 8337.0]
  - - [64, 512, 64, 512, 64, 64, 64, 512]
    - [89, 8374.0]
  - - [2048, 512, 1, 2048, 2048, 2048, 2048, 2048]
    - [87, 10050.0]
  - - [512, 1600, 1, 32, 512, 512, 512, 32]
    - [86, 2972.0]
  - - [512, 1600, 1, 512, 512, 512, 512, 512]
    - [87, 9745.0]
  - - [560, 1600, 1, 1024, 560, 560, 560, 1024]
    - [64, 8430.0]
  - - [1024, 512, 1, 3072, 1024, 1024, 1024, 3072]
    - [65, 8710.0]
  - - [64, 192, 64, 1280, 64, 64, 64, 1280]
    - [95, 4875.0]
  - - [64, 320, 64, 1280, 64, 64, 64, 1280]
    - [89, 7607.0]
  - - [64, 384, 64, 1280, 64, 64, 64, 1280]
    - [94, 7260.0]
  - - [64, 448, 64, 1280, 64, 64, 64, 1280]
    - [94, 7304.0]
  - - [64, 192, 64, 2048, 64, 64, 64, 2048]
    - [73, 6586.0]
  - - [64, 320, 64, 2048, 64, 64, 64, 2048]
    - [95, 6675.0]
  - - [64, 384, 64, 2048, 64, 64, 64, 2048]
    - [118, 6492.0]
  - - [64, 448, 64, 2048, 64, 64, 64, 2048]
    - [94, 6545.0]
  - - [1225, 64, 64, 192, 1225, 1225, 1225, 192]
    - [78, 10545.0]
  - - [1225, 64, 64, 256, 1225, 1225, 1225, 256]
    - [103, 10040.0]
  - - [1225, 64, 64, 288, 1225, 1225, 1225, 288]
    - [99, 10633.0]
  - - [5329, 80, 64, 64, 5329, 5329, 5329, 64]
    - [76, 5506.0]
  - - [3136, 64, 64, 64, 3136, 3136, 3136, 64]
    - [99, 10050.0]
  - - [3136, 64, 64, 256, 3136, 3136, 3136, 256]
    - [103, 8923.0]
  - - [64, 192, 32, 1280, 64, 64, 64, 1280]
    - [89, 7654.0]
  - - [64, 320, 32, 1280, 64, 64, 64, 1280]
    - [67, 9130.0]
  - - [64, 384, 32, 1280, 64, 64, 64, 1280]
    - [60, 6778.0]
  - - [64, 448, 32, 1280, 64, 64, 64, 1280]
    - [89, 7626.0]
  - - [64, 192, 32, 2048, 64, 64, 64, 2048]
    - [112, 5322.0]
  - - [64, 320, 32, 2048, 64, 64, 64, 2048]
    - [111, 7172.0]
  - - [64, 384, 32, 2048, 64, 64, 64, 2048]
    - [111, 7300.0]
  - - [64, 448, 32, 2048, 64, 64, 64, 2048]
    - [67, 6817.0]
  - - [5329, 80, 32, 64, 5329, 5329, 5329, 64]
    - [78, 6213.0]
  - - [3136, 64, 32, 256, 3136, 3136, 3136, 256]
    - [82, 9391.0]
  - - [196, 256, 32, 1024, 196, 196, 196, 1024]
    - [64, 8475.0]
  - - [256, 4096, 1, 4, 256, 256, 256, 4]
    - [61, 510.0]
  - - [960, 1024, 1, 1024, 960, 960, 960, 1024]
    - [64, 9232.0]
  - - [768, 768, 1, 768, 768, 768, 768, 768]
    - [57, 9078.0]
  - - [768, 768, 1, 384, 768, 768, 768, 384]
    - [78, 8248.0]
  - - [100, 128, 120, 512, 100, 100, 100, 512]
    - [87, 8433.0]
  - - [100, 128, 139, 512, 100, 100, 100, 512]
    - [64, 8495.0]
  - - [100, 128, 160, 512, 100, 100, 100, 512]
    - [109, 8520.0]
  - - [22500, 64, 1, 147, 22500, 22500, 22500, 147]
    - [99, 8563.0]
  - - [1024, 960, 1, 1024, 1024, 1024, 1024, 1024]
    - [64, 10836.0]
  - - [1024, 616, 1, 1024, 1024, 1024, 1024, 1024]
    - [88, 9524.0]
  - - [64, 128, 128, 128, 64, 64, 64, 128]
    - [112, 5542.0]
  - - [64, 128, 160, 128, 64, 64, 64, 128]
    - [71, 5962.0]
  - - [1024, 1024, 1, 2, 1024, 1024, 1024, 2]
    - [77, 277.0]
  - - [64, 128, 624, 128, 64, 64, 64, 128]
    - [92, 7084.0]
  - - [1024, 780, 1, 1024, 1024, 1024, 1024, 1024]
    - [65, 9062.0]
  - - [64, 128, 640, 128, 64, 64, 64, 128]
    - [111, 7963.0]
  - - [1024, 800, 1, 1024, 1024, 1024, 1024, 1024]
    - [65, 9239.0]
  - - [64, 128, 656, 128, 64, 64, 64, 128]
    - [115, 6891.0]
  - - [1024, 820, 1, 1024, 1024, 1024, 1024, 1024]
    - [65, 9470.0]
  - - [64, 512, 80, 512, 64, 64, 64, 512]
    - [89, 7392.0]
  - - [1024, 385, 1, 1024, 1024, 1024, 1024, 1024]
    - [109, 7728.0]
  - - [1024, 462, 1, 1024, 1024, 1024, 1024, 1024]
    - [53, 7656.0]
  - - [64, 128, 144, 128, 64, 64, 64, 128]
    - [56, 5954.0]
  - - [1024, 960, 1, 64, 1024, 1024, 1024, 64]
    - [78, 5252.0]
  - - [64, 512, 256, 512, 64, 64, 64, 512]
    - [117, 7372.0]
  - - [64, 512, 40, 512, 64, 64, 64, 512]
    - [89, 7626.0]
  - - [96, 1024, 64, 1024, 96, 96, 96, 1024]
    - [93, 8192.0]
  - - [96, 1024, 128, 1024, 96, 96, 96, 1024]
    - [69, 8270.0]
  - - [64, 1024, 256, 1024, 64, 64, 64, 1024]
    - [94, 7320.0]
  - - [64, 1024, 32, 1024, 64, 64, 64, 1024]
    - [117, 6963.0]
  - - [64, 1024, 64, 1024, 64, 64, 64, 1024]
    - [73, 7185.0]
  - - [64, 1024, 128, 1024, 64, 64, 64, 1024]
    - [94, 7233.0]
  - - [64, 128, 1024, 128, 64, 64, 64, 128]
    - [74, 5456.0]
  - - [1024, 864, 1, 1024, 1024, 1024, 1024, 1024]
    - [65, 9671.0]
  - - [1024, 864, 1, 512, 1024, 1024, 1024, 512]
    - [99, 8995.0]
  - - [256, 3456, 1, 128, 256, 256, 256, 128]
    - [109, 6806.0]
  - - [256, 4096, 1, 128, 256, 256, 256, 128]
    - [53, 7318.0]
  - - [480, 864, 1, 1024, 480, 480, 480, 1024]
    - [87, 7888.0]
  - - [512, 864, 1, 256, 512, 512, 512, 256]
    - [109, 6284.0]
  - - [64, 128, 1280, 128, 64, 64, 64, 128]
    - [96, 5318.0]
  - - [64, 128, 1312, 128, 64, 64, 64, 128]
    - [119, 5329.0]
