library/src/blas3/Tensile/Logic/asm_full/navi22_Cijk_Alik_Bjlk_SB_GB.yaml
---
- {MinimumRequiredVersion: 4.28.0}
- navi22
- gfx1031
    SolutionIndex: 0
    SolutionNameMin: Cijk_Alik_Bjlk_SB_GB_MT128x64x8_SN_SU0_SUM0_TT8_8_WG16_8_1_WGM1
    SolutionIndex: 1
    SolutionNameMin: Cijk_Alik_Bjlk_SB_GB_MT128x128x8_SN_SU0_SUM0_TT8_16_WG16_8_1_WGM1
    SolutionIndex: 2
    SolutionNameMin: Cijk_Alik_Bjlk_SB_GB_MT128x128x8_SN_SU0_SUM0_TT8_8_WG16_16_1_WGM1
    SolutionIndex: 3
    SolutionNameMin: Cijk_Alik_Bjlk_SB_GB_MT128x128x16_SN_SU0_SUM0_TT8_16_WG16_8_1_WGM1
    SolutionIndex: 4
    SolutionNameMin: Cijk_Alik_Bjlk_SB_GB_MT128x128x16_SN_SU0_SUM0_TT8_8_WG16_16_1_WGM1
    SolutionIndex: 5
    SolutionNameMin: Cijk_Alik_Bjlk_SB_GB_MT128x256x16_SN_SU0_SUM0_TT8_16_WG16_16_1_WGM1
    SolutionIndex: 6
    SolutionNameMin: Cijk_Alik_Bjlk_SB_GB_MT128x64x8_SN_SU32_SUM3_TT8_8_WG16_8_1_WGM1
    SolutionIndex: 7
    SolutionNameMin: Cijk_Alik_Bjlk_SB_GB_MT128x128x8_SN_SU32_SUM3_TT8_16_WG16_8_1_WGM1
    SolutionIndex: 8
    SolutionNameMin: Cijk_Alik_Bjlk_SB_GB_MT128x128x8_SN_SU32_SUM3_TT8_8_WG16_16_1_WGM1
    SolutionIndex: 9
    SolutionNameMin: Cijk_Alik_Bjlk_SB_GB_MT128x64x16_SN_SU32_SUM3_TT8_8_WG16_8_1_WGM1
    SolutionIndex: 10
    SolutionNameMin: Cijk_Alik_Bjlk_SB_GB_MT128x128x16_SN_SU32_SUM3_TT8_16_WG16_8_1_WGM1
    SolutionIndex: 11
    SolutionNameMin: Cijk_Alik_Bjlk_SB_GB_MT128x128x16_SN_SU32_SUM3_TT8_8_WG16_16_1_WGM1
    SolutionIndex: 12
    SolutionNameMin: Cijk_Alik_Bjlk_SB_GB_MT128x256x16_SN_SU32_SUM3_TT8_16_WG16_16_1_WGM1
    SolutionIndex: 13
    SolutionNameMin: Cijk_Alik_Bjlk_SB_GB_MT128x64x8_SN_SU0_SUM0_TT8_8_WG16_8_1_WGM4
    SolutionIndex: 14
    SolutionNameMin: Cijk_Alik_Bjlk_SB_GB_MT128x128x8_SN_SU0_SUM0_TT8_16_WG16_8_1_WGM4
    SolutionIndex: 15
    SolutionNameMin: Cijk_Alik_Bjlk_SB_GB_MT128x128x8_SN_SU0_SUM0_TT8_8_WG16_16_1_WGM4
    SolutionIndex: 16
    SolutionNameMin: Cijk_Alik_Bjlk_SB_GB_MT128x64x16_SN_SU0_SUM0_TT8_8_WG16_8_1_WGM4
    SolutionIndex: 17
    SolutionNameMin: Cijk_Alik_Bjlk_SB_GB_MT128x128x16_SN_SU0_SUM0_TT8_16_WG16_8_1_WGM4
    SolutionIndex: 18
    SolutionNameMin: Cijk_Alik_Bjlk_SB_GB_MT128x128x16_SN_SU0_SUM0_TT8_8_WG16_16_1_WGM4
    SolutionIndex: 19
    SolutionNameMin: Cijk_Alik_Bjlk_SB_GB_MT128x256x16_SN_SU0_SUM0_TT8_16_WG16_16_1_WGM4
    SolutionIndex: 20
    SolutionNameMin: Cijk_Alik_Bjlk_SB_GB_MT128x64x8_SN_SU32_SUM3_TT8_8_WG16_8_1_WGM4
    SolutionIndex: 21
    SolutionNameMin: Cijk_Alik_Bjlk_SB_GB_MT128x128x8_SN_SU32_SUM3_TT8_16_WG16_8_1_WGM4
    SolutionIndex: 22
    SolutionNameMin: Cijk_Alik_Bjlk_SB_GB_MT128x128x8_SN_SU32_SUM3_TT8_8_WG16_16_1_WGM4
    SolutionIndex: 23
    SolutionNameMin: Cijk_Alik_Bjlk_SB_GB_MT128x128x16_SN_SU32_SUM3_TT8_16_WG16_8_1_WGM4
    SolutionIndex: 24
    SolutionNameMin: Cijk_Alik_Bjlk_SB_GB_MT128x128x16_SN_SU32_SUM3_TT8_8_WG16_16_1_WGM4
    SolutionIndex: 25
    SolutionNameMin: Cijk_Alik_Bjlk_SB_GB_MT128x64x8_SN_SU0_SUM0_TT8_8_WG16_8_1_WGM8
    SolutionIndex: 26
    SolutionNameMin: Cijk_Alik_Bjlk_SB_GB_MT128x128x8_SN_SU0_SUM0_TT8_16_WG16_8_1_WGM8
    SolutionIndex: 27
    SolutionNameMin: Cijk_Alik_Bjlk_SB_GB_MT128x128x8_SN_SU0_SUM0_TT8_8_WG16_16_1_WGM8
    SolutionIndex: 28
    SolutionNameMin: Cijk_Alik_Bjlk_SB_GB_MT128x64x16_SN_SU0_SUM0_TT8_8_WG16_8_1_WGM8
    SolutionIndex: 29
    SolutionNameMin: Cijk_Alik_Bjlk_SB_GB_MT128x128x16_SN_SU0_SUM0_TT8_16_WG16_8_1_WGM8
    SolutionIndex: 30
    SolutionNameMin: Cijk_Alik_Bjlk_SB_GB_MT128x128x16_SN_SU0_SUM0_TT8_8_WG16_16_1_WGM8
    SolutionIndex: 31
    SolutionNameMin: Cijk_Alik_Bjlk_SB_GB_MT128x256x16_SN_SU0_SUM0_TT8_16_WG16_16_1_WGM8
    SolutionIndex: 32
    SolutionNameMin: Cijk_Alik_Bjlk_SB_GB_MT128x64x8_SN_SU32_SUM3_TT8_8_WG16_8_1_WGM8
    SolutionIndex: 33
    SolutionNameMin: Cijk_Alik_Bjlk_SB_GB_MT128x128x8_SN_SU32_SUM3_TT8_16_WG16_8_1_WGM8
    SolutionIndex: 34
    SolutionNameMin: Cijk_Alik_Bjlk_SB_GB_MT128x128x8_SN_SU32_SUM3_TT8_8_WG16_16_1_WGM8
    SolutionIndex: 35
    SolutionNameMin: Cijk_Alik_Bjlk_SB_GB_MT128x128x16_SN_SU32_SUM3_TT8_16_WG16_8_1_WGM8
    SolutionIndex: 36
    SolutionNameMin: Cijk_Alik_Bjlk_SB_GB_MT128x128x16_SN_SU32_SUM3_TT8_8_WG16_16_1_WGM8
    SolutionIndex: 37
    SolutionNameMin: Cijk_Alik_Bjlk_SB_GB_MT128x256x16_SN_SU32_SUM3_TT8_16_WG16_16_1_WGM8
    SolutionIndex: 38
    SolutionNameMin: Cijk_Alik_Bjlk_SB_GB_MT64x64x8_SN_SU0_SUM0_TT8_8_WG8_8_1_WGM1
    SolutionIndex: 39
    SolutionNameMin: Cijk_Alik_Bjlk_SB_GB_MT64x64x8_SN_SU0_SUM0_TT4_8_WG16_8_1_WGM1
    SolutionIndex: 40
    SolutionNameMin: Cijk_Alik_Bjlk_SB_GB_MT128x64x8_SN_SU0_SUM0_TT8_8_WG16_8_1_WGM1
    SolutionIndex: 41
    SolutionNameMin: Cijk_Alik_Bjlk_SB_GB_MT128x128x8_SN_SU0_SUM0_TT8_8_WG16_16_1_WGM1
    SolutionIndex: 42
    SolutionNameMin: Cijk_Alik_Bjlk_SB_GB_MT64x64x16_SN_SU0_SUM0_TT8_8_WG8_8_1_WGM1
    SolutionIndex: 43
    SolutionNameMin: Cijk_Alik_Bjlk_SB_GB_MT128x64x16_SN_SU0_SUM0_TT8_8_WG16_8_1_WGM1
    SolutionIndex: 44
    SolutionNameMin: Cijk_Alik_Bjlk_SB_GB_MT128x128x16_SN_SU0_SUM0_TT8_8_WG16_16_1_WGM1
    SolutionIndex: 45
    SolutionNameMin: Cijk_Alik_Bjlk_SB_GB_MT32x64x8_SN_SU32_SUM3_TT4_8_WG8_8_1_WGM1
    SolutionIndex: 46
    SolutionNameMin: Cijk_Alik_Bjlk_SB_GB_MT64x64x8_SN_SU32_SUM3_TT8_8_WG8_8_1_WGM1
    SolutionIndex: 47
    SolutionNameMin: Cijk_Alik_Bjlk_SB_GB_MT64x64x8_SN_SU32_SUM3_TT4_8_WG16_8_1_WGM1
    SolutionIndex: 48
    SolutionNameMin: Cijk_Alik_Bjlk_SB_GB_MT128x64x8_SN_SU32_SUM3_TT8_8_WG16_8_1_WGM1
    SolutionIndex: 49
    SolutionNameMin: Cijk_Alik_Bjlk_SB_GB_MT64x128x8_SN_SU32_SUM3_TT4_8_WG16_16_1_WGM1
    SolutionIndex: 50
    SolutionNameMin: Cijk_Alik_Bjlk_SB_GB_MT128x128x8_SN_SU32_SUM3_TT8_8_WG16_16_1_WGM1
    SolutionIndex: 51
    SolutionNameMin: Cijk_Alik_Bjlk_SB_GB_MT64x64x16_SN_SU32_SUM3_TT8_8_WG8_8_1_WGM1
    SolutionIndex: 52
    SolutionNameMin: Cijk_Alik_Bjlk_SB_GB_MT64x64x16_SN_SU32_SUM3_TT4_8_WG16_8_1_WGM1
    SolutionIndex: 53
    SolutionNameMin: Cijk_Alik_Bjlk_SB_GB_MT128x64x16_SN_SU32_SUM3_TT8_8_WG16_8_1_WGM1
    SolutionIndex: 54
    SolutionNameMin: Cijk_Alik_Bjlk_SB_GB_MT128x128x16_SN_SU32_SUM3_TT8_8_WG16_16_1_WGM1
    SolutionIndex: 55
    SolutionNameMin: Cijk_Alik_Bjlk_SB_GB_MT64x64x8_SN_SU0_SUM0_TT8_8_WG8_8_1_WGM4
    SolutionIndex: 56
    SolutionNameMin: Cijk_Alik_Bjlk_SB_GB_MT64x64x8_SN_SU0_SUM0_TT4_8_WG16_8_1_WGM4
    SolutionIndex: 57
    SolutionNameMin: Cijk_Alik_Bjlk_SB_GB_MT128x64x8_SN_SU0_SUM0_TT8_8_WG16_8_1_WGM4
    SolutionIndex: 58
    SolutionNameMin: Cijk_Alik_Bjlk_SB_GB_MT128x128x8_SN_SU0_SUM0_TT8_8_WG16_16_1_WGM4
    SolutionIndex: 59
    SolutionNameMin: Cijk_Alik_Bjlk_SB_GB_MT64x64x16_SN_SU0_SUM0_TT8_8_WG8_8_1_WGM4
    SolutionIndex: 60
    SolutionNameMin: Cijk_Alik_Bjlk_SB_GB_MT128x64x16_SN_SU0_SUM0_TT8_8_WG16_8_1_WGM4
    SolutionIndex: 61
    SolutionNameMin: Cijk_Alik_Bjlk_SB_GB_MT128x128x16_SN_SU0_SUM0_TT8_8_WG16_16_1_WGM4
    SolutionIndex: 62
    SolutionNameMin: Cijk_Alik_Bjlk_SB_GB_MT64x64x8_SN_SU32_SUM3_TT8_8_WG8_8_1_WGM4
    SolutionIndex: 63
    SolutionNameMin: Cijk_Alik_Bjlk_SB_GB_MT64x64x8_SN_SU32_SUM3_TT4_8_WG16_8_1_WGM4
    SolutionIndex: 64
    SolutionNameMin: Cijk_Alik_Bjlk_SB_GB_MT128x64x8_SN_SU32_SUM3_TT8_8_WG16_8_1_WGM4
    SolutionIndex: 65
    SolutionNameMin: Cijk_Alik_Bjlk_SB_GB_MT128x128x8_SN_SU32_SUM3_TT8_8_WG16_16_1_WGM4
    SolutionIndex: 66
    SolutionNameMin: Cijk_Alik_Bjlk_SB_GB_MT64x64x16_SN_SU32_SUM3_TT8_8_WG8_8_1_WGM4
    SolutionIndex: 67
    SolutionNameMin: Cijk_Alik_Bjlk_SB_GB_MT128x64x16_SN_SU32_SUM3_TT8_8_WG16_8_1_WGM4
    SolutionIndex: 68
    SolutionNameMin: Cijk_Alik_Bjlk_SB_GB_MT128x128x16_SN_SU32_SUM3_TT8_8_WG16_16_1_WGM4
    SolutionIndex: 69
    SolutionNameMin: Cijk_Alik_Bjlk_SB_GB_MT64x64x8_SN_SU0_SUM0_TT8_8_WG8_8_1_WGM8
    SolutionIndex: 70
    SolutionNameMin: Cijk_Alik_Bjlk_SB_GB_MT64x64x8_SN_SU0_SUM0_TT4_8_WG16_8_1_WGM8
    SolutionIndex: 71
    SolutionNameMin: Cijk_Alik_Bjlk_SB_GB_MT128x64x8_SN_SU0_SUM0_TT8_8_WG16_8_1_WGM8
    SolutionIndex: 72
    SolutionNameMin: Cijk_Alik_Bjlk_SB_GB_MT128x128x8_SN_SU0_SUM0_TT8_8_WG16_16_1_WGM8
    SolutionIndex: 73
    SolutionNameMin: Cijk_Alik_Bjlk_SB_GB_MT64x64x16_SN_SU0_SUM0_TT8_8_WG8_8_1_WGM8
    SolutionIndex: 74
    SolutionNameMin: Cijk_Alik_Bjlk_SB_GB_MT128x64x16_SN_SU0_SUM0_TT8_8_WG16_8_1_WGM8
    SolutionIndex: 75
    SolutionNameMin: Cijk_Alik_Bjlk_SB_GB_MT32x32x8_SN_SU32_SUM3_TT4_4_WG8_8_1_WGM8
    SolutionIndex: 76
    SolutionNameMin: Cijk_Alik_Bjlk_SB_GB_MT64x64x8_SN_SU32_SUM3_TT8_8_WG8_8_1_WGM8
    SolutionIndex: 77
    SolutionNameMin: Cijk_Alik_Bjlk_SB_GB_MT128x64x8_SN_SU32_SUM3_TT8_8_WG16_8_1_WGM8
    SolutionIndex: 78
    SolutionNameMin: Cijk_Alik_Bjlk_SB_GB_MT64x128x8_SN_SU32_SUM3_TT4_8_WG16_16_1_WGM8
    SolutionIndex: 79
    SolutionNameMin: Cijk_Alik_Bjlk_SB_GB_MT128x128x8_SN_SU32_SUM3_TT8_8_WG16_16_1_WGM8
    SolutionIndex: 80
    SolutionNameMin: Cijk_Alik_Bjlk_SB_GB_MT64x64x16_SN_SU32_SUM3_TT4_8_WG16_8_1_WGM8
    SolutionIndex: 81
    SolutionNameMin: Cijk_Alik_Bjlk_SB_GB_MT128x64x16_SN_SU32_SUM3_TT8_8_WG16_8_1_WGM8
    SolutionIndex: 82
    SolutionNameMin: Cijk_Alik_Bjlk_SB_GB_MT64x128x16_SN_SU32_SUM3_TT4_8_WG16_16_1_WGM8
    SolutionIndex: 83
    SolutionNameMin: Cijk_Alik_Bjlk_SB_GB_MT128x128x16_SN_SU32_SUM3_TT8_8_WG16_16_1_WGM8
    SolutionIndex: 84
    SolutionNameMin: Cijk_Alik_Bjlk_SB_GB_MT16x16x8_SN_SU0_SUM0_TT2_2_WG8_8_1_WGM1
    SolutionIndex: 85
    SolutionNameMin: Cijk_Alik_Bjlk_SB_GB_MT32x32x8_SN_SU0_SUM0_TT4_4_WG8_8_1_WGM1
    SolutionIndex: 86
    SolutionNameMin: Cijk_Alik_Bjlk_SB_GB_MT64x32x8_SN_SU0_SUM0_TT4_4_WG16_8_1_WGM1
    SolutionIndex: 87
    SolutionNameMin: Cijk_Alik_Bjlk_SB_GB_MT64x64x8_SN_SU0_SUM0_TT4_4_WG16_16_1_WGM1
    SolutionIndex: 88
    SolutionNameMin: Cijk_Alik_Bjlk_SB_GB_MT16x16x16_SN_SU0_SUM0_TT2_2_WG8_8_1_WGM1
    SolutionIndex: 89
    SolutionNameMin: Cijk_Alik_Bjlk_SB_GB_MT64x32x16_SN_SU0_SUM0_TT4_4_WG16_8_1_WGM1
    SolutionIndex: 90
    SolutionNameMin: Cijk_Alik_Bjlk_SB_GB_MT32x32x16_SN_SU0_SUM0_TT2_2_WG16_16_1_WGM1
    SolutionIndex: 91
    SolutionNameMin: Cijk_Alik_Bjlk_SB_GB_MT16x16x32_SN_SU0_SUM0_TT2_2_WG8_8_1_WGM1
    SolutionIndex: 92
    SolutionNameMin: Cijk_Alik_Bjlk_SB_GB_MT16x16x8_SN_SU32_SUM3_TT2_2_WG8_8_1_WGM1
    SolutionIndex: 93
    SolutionNameMin: Cijk_Alik_Bjlk_SB_GB_MT32x32x8_SN_SU32_SUM3_TT4_4_WG8_8_1_WGM1
    SolutionIndex: 94
    SolutionNameMin: Cijk_Alik_Bjlk_SB_GB_MT32x16x8_SN_SU32_SUM3_TT2_2_WG16_8_1_WGM1
    SolutionIndex: 95
    SolutionNameMin: Cijk_Alik_Bjlk_SB_GB_MT64x32x8_SN_SU32_SUM3_TT4_4_WG16_8_1_WGM1
    SolutionIndex: 96
    SolutionNameMin: Cijk_Alik_Bjlk_SB_GB_MT32x32x8_SN_SU32_SUM3_TT2_2_WG16_16_1_WGM1
    SolutionIndex: 97
    SolutionNameMin: Cijk_Alik_Bjlk_SB_GB_MT64x64x8_SN_SU32_SUM3_TT4_4_WG16_16_1_WGM1
    SolutionIndex: 98
    SolutionNameMin: Cijk_Alik_Bjlk_SB_GB_MT16x16x16_SN_SU32_SUM3_TT2_2_WG8_8_1_WGM1
    SolutionIndex: 99
    SolutionNameMin: Cijk_Alik_Bjlk_SB_GB_MT32x32x16_SN_SU32_SUM3_TT4_4_WG8_8_1_WGM1
    SolutionIndex: 100
    SolutionNameMin: Cijk_Alik_Bjlk_SB_GB_MT32x16x16_SN_SU32_SUM3_TT2_2_WG16_8_1_WGM1
    SolutionIndex: 101
    SolutionNameMin: Cijk_Alik_Bjlk_SB_GB_MT16x16x32_SN_SU32_SUM3_TT2_2_WG8_8_1_WGM1
    SolutionIndex: 102
    SolutionNameMin: Cijk_Alik_Bjlk_SB_GB_MT32x16x32_SN_SU32_SUM3_TT2_2_WG16_8_1_WGM1
    SolutionIndex: 103
    SolutionNameMin: Cijk_Alik_Bjlk_SB_GB_MT32x32x8_SN_SU0_SUM0_TT4_4_WG8_8_1_WGM4
    SolutionIndex: 104
    SolutionNameMin: Cijk_Alik_Bjlk_SB_GB_MT64x32x8_SN_SU0_SUM0_TT4_4_WG16_8_1_WGM4
    SolutionIndex: 105
    SolutionNameMin: Cijk_Alik_Bjlk_SB_GB_MT32x32x8_SN_SU0_SUM0_TT2_2_WG16_16_1_WGM4
    SolutionIndex: 106
    SolutionNameMin: Cijk_Alik_Bjlk_SB_GB_MT64x64x8_SN_SU0_SUM0_TT4_4_WG16_16_1_WGM4
    SolutionIndex: 107
    SolutionNameMin: Cijk_Alik_Bjlk_SB_GB_MT32x32x16_SN_SU0_SUM0_TT4_4_WG8_8_1_WGM4
    SolutionIndex: 108
    SolutionNameMin: Cijk_Alik_Bjlk_SB_GB_MT32x16x16_SN_SU0_SUM0_TT2_2_WG16_8_1_WGM4
    SolutionIndex: 109
    SolutionNameMin: Cijk_Alik_Bjlk_SB_GB_MT32x32x16_SN_SU0_SUM0_TT2_2_WG16_16_1_WGM4
    SolutionIndex: 110
    SolutionNameMin: Cijk_Alik_Bjlk_SB_GB_MT16x16x32_SN_SU0_SUM0_TT2_2_WG8_8_1_WGM4
    SolutionIndex: 111
    SolutionNameMin: Cijk_Alik_Bjlk_SB_GB_MT16x16x8_SN_SU32_SUM3_TT2_2_WG8_8_1_WGM4
    SolutionIndex: 112
    SolutionNameMin: Cijk_Alik_Bjlk_SB_GB_MT32x32x8_SN_SU32_SUM3_TT4_4_WG8_8_1_WGM4
    SolutionIndex: 113
    SolutionNameMin: Cijk_Alik_Bjlk_SB_GB_MT32x16x8_SN_SU32_SUM3_TT2_2_WG16_8_1_WGM4
    SolutionIndex: 114
    SolutionNameMin: Cijk_Alik_Bjlk_SB_GB_MT64x32x8_SN_SU32_SUM3_TT4_4_WG16_8_1_WGM4
    SolutionIndex: 115
    SolutionNameMin: Cijk_Alik_Bjlk_SB_GB_MT64x64x8_SN_SU32_SUM3_TT4_4_WG16_16_1_WGM4
    SolutionIndex: 116
    SolutionNameMin: Cijk_Alik_Bjlk_SB_GB_MT16x16x16_SN_SU32_SUM3_TT2_2_WG8_8_1_WGM4
    SolutionIndex: 117
    SolutionNameMin: Cijk_Alik_Bjlk_SB_GB_MT32x32x16_SN_SU32_SUM3_TT2_2_WG16_16_1_WGM4
    SolutionIndex: 118
    SolutionNameMin: Cijk_Alik_Bjlk_SB_GB_MT16x16x8_SN_SU0_SUM0_TT2_2_WG8_8_1_WGM8
    SolutionIndex: 119
    SolutionNameMin: Cijk_Alik_Bjlk_SB_GB_MT32x32x8_SN_SU0_SUM0_TT4_4_WG8_8_1_WGM8
    SolutionIndex: 120
    SolutionNameMin: Cijk_Alik_Bjlk_SB_GB_MT64x32x8_SN_SU0_SUM0_TT4_4_WG16_8_1_WGM8
    SolutionIndex: 121
    SolutionNameMin: Cijk_Alik_Bjlk_SB_GB_MT32x32x8_SN_SU0_SUM0_TT2_2_WG16_16_1_WGM8
    SolutionIndex: 122
    SolutionNameMin: Cijk_Alik_Bjlk_SB_GB_MT64x64x8_SN_SU0_SUM0_TT4_4_WG16_16_1_WGM8
    SolutionIndex: 123
    SolutionNameMin: Cijk_Alik_Bjlk_SB_GB_MT16x16x16_SN_SU0_SUM0_TT2_2_WG8_8_1_WGM8
    SolutionIndex: 124
    SolutionNameMin: Cijk_Alik_Bjlk_SB_GB_MT32x32x16_SN_SU0_SUM0_TT4_4_WG8_8_1_WGM8
    SolutionIndex: 125
    SolutionNameMin: Cijk_Alik_Bjlk_SB_GB_MT32x32x16_SN_SU0_SUM0_TT2_2_WG16_16_1_WGM8
    SolutionIndex: 126
    SolutionNameMin: Cijk_Alik_Bjlk_SB_GB_MT64x64x16_SN_SU0_SUM0_TT4_4_WG16_16_1_WGM8
    SolutionIndex: 127
    SolutionNameMin: Cijk_Alik_Bjlk_SB_GB_MT16x16x32_SN_SU0_SUM0_TT2_2_WG8_8_1_WGM8
    SolutionIndex: 128
    SolutionNameMin: Cijk_Alik_Bjlk_SB_GB_MT16x16x8_SN_SU32_SUM3_TT2_2_WG8_8_1_WGM8
    SolutionIndex: 129
    SolutionNameMin: Cijk_Alik_Bjlk_SB_GB_MT32x32x8_SN_SU32_SUM3_TT4_4_WG8_8_1_WGM8
    SolutionIndex: 130
    SolutionNameMin: Cijk_Alik_Bjlk_SB_GB_MT32x16x8_SN_SU32_SUM3_TT2_2_WG16_8_1_WGM8
    SolutionIndex: 131
    SolutionNameMin: Cijk_Alik_Bjlk_SB_GB_MT64x32x8_SN_SU32_SUM3_TT4_4_WG16_8_1_WGM8
    SolutionIndex: 132
    SolutionNameMin: Cijk_Alik_Bjlk_SB_GB_MT32x32x8_SN_SU32_SUM3_TT2_2_WG16_16_1_WGM8
    SolutionIndex: 133
    SolutionNameMin: Cijk_Alik_Bjlk_SB_GB_MT64x64x8_SN_SU32_SUM3_TT4_4_WG16_16_1_WGM8
    SolutionIndex: 134
    SolutionNameMin: Cijk_Alik_Bjlk_SB_GB_MT16x16x16_SN_SU32_SUM3_TT2_2_WG8_8_1_WGM8
    SolutionIndex: 135
    SolutionNameMin: Cijk_Alik_Bjlk_SB_GB_MT64x32x16_SN_SU32_SUM3_TT4_4_WG16_8_1_WGM8
    SolutionIndex: 136
    SolutionNameMin: Cijk_Alik_Bjlk_SB_GB_MT32x32x16_SN_SU32_SUM3_TT2_2_WG16_16_1_WGM8
    SolutionIndex: 137
    SolutionNameMin: Cijk_Alik_Bjlk_SB_GB_MT16x16x32_SN_SU32_SUM3_TT2_2_WG8_8_1_WGM8
    SolutionIndex: 138
    SolutionNameMin: Cijk_Alik_Bjlk_SB_GB_MT32x16x32_SN_SU32_SUM3_TT2_2_WG16_8_1_WGM8
    SolutionIndex: 139
    SolutionNameMin: Cijk_Alik_Bjlk_SB_GB_MT32x8x8_SN_SU32_SUM3_TT2_2_WG16_4_1_WGM1
    SolutionIndex: 140
    SolutionNameMin: Cijk_Alik_Bjlk_SB_GB_MT64x8x8_SN_SU32_SUM3_TT4_2_WG16_4_1_WGM1
    SolutionIndex: 141
    SolutionNameMin: Cijk_Alik_Bjlk_SB_GB_MT64x4x16_SN_SU32_SUM3_TT4_1_WG16_4_1_WGM1
    SolutionIndex: 142
    SolutionNameMin: Cijk_Alik_Bjlk_SB_GB_MT32x8x8_SN_SU32_SUM3_TT2_2_WG16_4_1_WGM4
    SolutionIndex: 143
    SolutionNameMin: Cijk_Alik_Bjlk_SB_GB_MT64x8x8_SN_SU32_SUM3_TT4_2_WG16_4_1_WGM4
    SolutionIndex: 144
    SolutionNameMin: Cijk_Alik_Bjlk_SB_GB_MT64x4x16_SN_SU32_SUM3_TT4_1_WG16_4_1_WGM4
    SolutionIndex: 145
    SolutionNameMin: Cijk_Alik_Bjlk_SB_GB_MT64x8x16_SN_SU32_SUM3_TT4_1_WG16_8_1_WGM4
    SolutionIndex: 146
    SolutionNameMin: Cijk_Alik_Bjlk_SB_GB_MT32x8x8_SN_SU0_SUM0_TT2_2_WG16_4_1_WGM8
    SolutionIndex: 147
    SolutionNameMin: Cijk_Alik_Bjlk_SB_GB_MT32x8x8_SN_SU32_SUM3_TT2_2_WG16_4_1_WGM8
    SolutionIndex: 148
    SolutionNameMin: Cijk_Alik_Bjlk_SB_GB_MT64x8x16_SN_SU32_SUM3_TT4_2_WG16_4_1_WGM8
    SolutionIndex: 149
    SolutionNameMin: Cijk_Alik_Bjlk_SB_GB_MT8x32x8_SN_SU0_SUM0_TT1_4_WG8_8_1_WGM1
    SolutionIndex: 150
    SolutionNameMin: Cijk_Alik_Bjlk_SB_GB_MT8x32x16_SN_SU0_SUM0_TT1_4_WG8_8_1_WGM1
    SolutionIndex: 151
    SolutionNameMin: Cijk_Alik_Bjlk_SB_GB_MT8x32x32_SN_SU0_SUM0_TT1_4_WG8_8_1_WGM1
    SolutionIndex: 152
    SolutionNameMin: Cijk_Alik_Bjlk_SB_GB_MT8x32x16_SN_SU32_SUM3_TT1_4_WG8_8_1_WGM1
    SolutionIndex: 153
    SolutionNameMin: Cijk_Alik_Bjlk_SB_GB_MT8x32x8_SN_SU0_SUM0_TT1_4_WG8_8_1_WGM4
    SolutionIndex: 154
    SolutionNameMin: Cijk_Alik_Bjlk_SB_GB_MT8x32x16_SN_SU0_SUM0_TT1_4_WG8_8_1_WGM4
    SolutionIndex: 155
    SolutionNameMin: Cijk_Alik_Bjlk_SB_GB_MT8x32x32_SN_SU0_SUM0_TT1_4_WG8_8_1_WGM4
    SolutionIndex: 156
    SolutionNameMin: Cijk_Alik_Bjlk_SB_GB_MT8x32x8_SN_SU32_SUM3_TT1_4_WG8_8_1_WGM4
    SolutionIndex: 157
    SolutionNameMin: Cijk_Alik_Bjlk_SB_GB_MT8x32x16_SN_SU32_SUM3_TT1_4_WG8_8_1_WGM4
    SolutionIndex: 158
    SolutionNameMin: Cijk_Alik_Bjlk_SB_GB_MT8x32x32_SN_SU32_SUM3_TT1_4_WG8_8_1_WGM4
    SolutionIndex: 159
    SolutionNameMin: Cijk_Alik_Bjlk_SB_GB_MT16x32x32_SN_SU32_SUM3_TT2_4_WG8_8_1_WGM4
    SolutionIndex: 160
    SolutionNameMin: Cijk_Alik_Bjlk_SB_GB_MT8x32x8_SN_SU0_SUM0_TT1_4_WG8_8_1_WGM8
    SolutionIndex: 161
    SolutionNameMin: Cijk_Alik_Bjlk_SB_GB_MT8x32x16_SN_SU0_SUM0_TT1_4_WG8_8_1_WGM8
    SolutionIndex: 162
    SolutionNameMin: Cijk_Alik_Bjlk_SB_GB_MT8x32x8_SN_SU32_SUM3_TT1_4_WG8_8_1_WGM8
    SolutionIndex: 163
    SolutionNameMin: Cijk_Alik_Bjlk_SB_GB_MT8x32x16_SN_SU32_SUM3_TT1_4_WG8_8_1_WGM8
    SolutionIndex: 164
    SolutionNameMin: Cijk_Alik_Bjlk_SB_GB_MT16x64x32_SN_SU32_SUM3_TT1_4_WG16_16_1_WGM8
- - - [2944, 4288, 1, 1280, 2944, 2944, 1280, 4288]
    - [17, 12089.0]
  - - [2368, 5888, 1, 256, 2368, 2368, 256, 5888]
    - [17, 11599.0]
  - - [5888, 1024, 1, 1280, 5888, 5888, 1280, 1024]
    - [17, 12009.0]
  - - [5888, 1856, 1, 3328, 5888, 5888, 3328, 1856]
    - [17, 11974.0]
  - - [5056, 704, 1, 256, 5056, 5056, 256, 704]
    - [32, 10089.0]
  - - [5888, 2944, 1, 3328, 5888, 5888, 3328, 2944]
    - [29, 12558.0]
  - - [1856, 4288, 1, 256, 1856, 1856, 256, 4288]
    - [29, 10949.0]
  - - [1024, 5056, 1, 128, 1024, 1024, 128, 5056]
    - [6, 10430.0]
  - - [5056, 5056, 1, 3328, 5056, 5056, 3328, 5056]
    - [17, 12301.0]
  - - [1408, 5888, 1, 1280, 1408, 1408, 1280, 5888]
    - [35, 12114.0]
  - - [1024, 3584, 1, 3328, 1024, 1024, 3328, 3584]
    - [5, 11605.0]
  - - [5888, 1408, 1, 1280, 5888, 5888, 1280, 1408]
    - [29, 12157.0]
  - - [1024, 2368, 1, 256, 1024, 1024, 256, 2368]
    - [24, 9856.0]
  - - [1408, 1856, 1, 1280, 1408, 1408, 1280, 1856]
    - [29, 10733.0]
  - - [5056, 5056, 1, 1280, 5056, 5056, 1280, 5056]
    - [17, 12257.0]
  - - [448, 5056, 1, 256, 448, 448, 256, 5056]
    - [15, 9302.0]
  - - [1856, 1408, 1, 128, 1856, 1856, 128, 1408]
    - [20, 9460.0]
  - - [6784, 256, 1, 3328, 6784, 6784, 3328, 256]
    - [10, 10607.0]
  - - [6784, 4288, 1, 3328, 6784, 6784, 3328, 4288]
    - [10, 12400.0]
  - - [4288, 448, 1, 256, 4288, 4288, 256, 448]
    - [34, 8801.0]
  - - [1856, 2368, 1, 3328, 1856, 1856, 3328, 2368]
    - [3, 11142.0]
  - - [4288, 2944, 1, 1280, 4288, 4288, 1280, 2944]
    - [17, 12107.0]
  - - [704, 5056, 1, 1280, 704, 704, 1280, 5056]
    - [3, 11008.0]
  - - [2368, 704, 1, 3328, 2368, 2368, 3328, 704]
    - [3, 10179.0]
  - - [256, 5888, 1, 256, 256, 256, 256, 5888]
    - [29, 9214.0]
  - - [1856, 4288, 1, 3328, 1856, 1856, 3328, 4288]
    - [29, 11729.0]
  - - [5888, 1024, 1, 256, 5888, 5888, 256, 1024]
    - [26, 11124.0]
  - - [448, 5056, 1, 3328, 448, 448, 3328, 5056]
    - [19, 10565.0]
  - - [1408, 2944, 1, 256, 1408, 1408, 256, 2944]
    - [29, 11357.0]
  - - [6784, 5056, 1, 3328, 6784, 6784, 3328, 5056]
    - [17, 12470.0]
  - - [5056, 5056, 1, 256, 5056, 5056, 256, 5056]
    - [17, 11915.0]
  - - [1408, 6784, 1, 128, 1408, 1408, 128, 6784]
    - [26, 11294.0]
  - - [704, 5056, 1, 128, 704, 704, 128, 5056]
    - [25, 9628.0]
  - - [2368, 2944, 1, 1280, 2368, 2368, 1280, 2944]
    - [10, 12004.0]
  - - [6784, 6784, 1, 1280, 6784, 6784, 1280, 6784]
    - [29, 12604.0]
  - - [1408, 4288, 1, 1280, 1408, 1408, 1280, 4288]
    - [17, 11959.0]
  - - [3584, 4288, 1, 1280, 3584, 3584, 1280, 4288]
    - [29, 12276.0]
  - - [2368, 704, 1, 1280, 2368, 2368, 1280, 704]
    - [29, 9821.0]
  - - [5056, 4288, 1, 3328, 5056, 5056, 3328, 4288]
    - [17, 12272.0]
  - - [3584, 2368, 1, 3328, 3584, 3584, 3328, 2368]
    - [29, 12043.0]
  - - [6784, 448, 1, 1280, 6784, 6784, 1280, 448]
    - [28, 10239.0]
  - - [1408, 2944, 1, 128, 1408, 1408, 128, 2944]
    - [4, 10599.0]
  - - [4288, 2944, 1, 256, 4288, 4288, 256, 2944]
    - [29, 11682.0]
  - - [5888, 704, 1, 1280, 5888, 5888, 1280, 704]
    - [17, 11077.0]
  - - [448, 5888, 1, 128, 448, 448, 128, 5888]
    - [6, 8834.0]
  - - [5056, 2368, 1, 1280, 5056, 5056, 1280, 2368]
    - [29, 12041.0]
  - - [448, 3584, 1, 1280, 448, 448, 1280, 3584]
    - [29, 9628.0]
  - - [6784, 5888, 1, 256, 6784, 6784, 256, 5888]
    - [17, 12427.0]
  - - [5888, 2944, 1, 128, 5888, 5888, 128, 2944]
    - [17, 11675.0]
  - - [1024, 1408, 1, 256, 1024, 1024, 256, 1408]
    - [32, 9801.0]
  - - [2368, 2368, 1, 3328, 2368, 2368, 3328, 2368]
    - [17, 11293.0]
  - - [1856, 6784, 1, 128, 1856, 1856, 128, 6784]
    - [7, 10574.0]
  - - [5056, 704, 1, 3328, 5056, 5056, 3328, 704]
    - [10, 11127.0]
  - - [1408, 1856, 1, 256, 1408, 1408, 256, 1856]
    - [28, 9982.0]
  - - [2368, 5056, 1, 256, 2368, 2368, 256, 5056]
    - [17, 11587.0]
  - - [5888, 1856, 1, 256, 5888, 5888, 256, 1856]
    - [10, 11520.0]
  - - [704, 5888, 1, 256, 704, 704, 256, 5888]
    - [3, 10422.0]
  - - [2944, 6784, 1, 3328, 2944, 2944, 3328, 6784]
    - [17, 12605.0]
  - - [3584, 704, 1, 3328, 3584, 3584, 3328, 704]
    - [3, 10454.0]
  - - [448, 4288, 1, 256, 448, 448, 256, 4288]
    - [14, 8652.0]
  - - [704, 2368, 1, 1280, 704, 704, 1280, 2368]
    - [10, 9850.0]
  - - [1856, 2368, 1, 1280, 1856, 1856, 1280, 2368]
    - [29, 11037.0]
  - - [1856, 4288, 1, 1280, 1856, 1856, 1280, 4288]
    - [17, 11652.0]
  - - [704, 2944, 1, 128, 704, 704, 128, 2944]
    - [4, 9129.0]
  - - [1408, 1024, 1, 1280, 1408, 1408, 1280, 1024]
    - [17, 10310.0]
  - - [704, 6784, 1, 256, 704, 704, 256, 6784]
    - [23, 10252.0]
  - - [6784, 704, 1, 256, 6784, 6784, 256, 704]
    - [10, 10199.0]
  - - [5056, 1408, 1, 128, 5056, 5056, 128, 1408]
    - [21, 10715.0]
  - - [3584, 4288, 1, 3328, 3584, 3584, 3328, 4288]
    - [17, 12333.0]
  - - [5888, 1856, 1, 1280, 5888, 5888, 1280, 1856]
    - [17, 11899.0]
  - - [5056, 1024, 1, 3328, 5056, 5056, 3328, 1024]
    - [17, 12245.0]
  - - [1024, 4288, 1, 128, 1024, 1024, 128, 4288]
    - [6, 9948.0]
  - - [2368, 3584, 1, 1280, 2368, 2368, 1280, 3584]
    - [17, 11969.0]
  - - [2368, 6784, 1, 1280, 2368, 2368, 1280, 6784]
    - [17, 12095.0]
  - - [2944, 3584, 1, 3328, 2944, 2944, 3328, 3584]
    - [17, 12306.0]
  - - [6784, 2944, 1, 256, 6784, 6784, 256, 2944]
    - [10, 12270.0]
  - - [4288, 2368, 1, 3328, 4288, 4288, 3328, 2368]
    - [17, 11817.0]
  - - [1856, 2368, 1, 256, 1856, 1856, 256, 2368]
    - [26, 10144.0]
  - - [3584, 6784, 1, 3328, 3584, 3584, 3328, 6784]
    - [17, 12541.0]
  - - [1024, 5888, 1, 3328, 1024, 1024, 3328, 5888]
    - [17, 12110.0]
  - - [5056, 4288, 1, 1280, 5056, 5056, 1280, 4288]
    - [29, 12238.0]
  - - [1408, 5056, 1, 1280, 1408, 1408, 1280, 5056]
    - [17, 12223.0]
  - - [2944, 5888, 1, 128, 2944, 2944, 128, 5888]
    - [26, 11802.0]
  - - [704, 5888, 1, 1280, 704, 704, 1280, 5888]
    - [10, 11112.0]
  - - [2368, 3584, 1, 128, 2368, 2368, 128, 3584]
    - [7, 10807.0]
  - - [6784, 5888, 1, 3328, 6784, 6784, 3328, 5888]
    - [29, 12645.0]
  - - [1024, 5056, 1, 1280, 1024, 1024, 1280, 5056]
    - [17, 12028.0]
  - - [4288, 1024, 1, 256, 4288, 4288, 256, 1024]
    - [17, 10765.0]
  - - [2944, 2368, 1, 128, 2944, 2944, 128, 2368]
    - [35, 10914.0]
  - - [5888, 448, 1, 1280, 5888, 5888, 1280, 448]
    - [16, 9971.0]
  - - [704, 5888, 1, 3328, 704, 704, 3328, 5888]
    - [31, 11230.0]
  - - [3584, 2944, 1, 256, 3584, 3584, 256, 2944]
    - [29, 11666.0]
  - - [2368, 1024, 1, 3328, 2368, 2368, 3328, 1024]
    - [12, 11298.0]
  - - [1408, 5056, 1, 3328, 1408, 1408, 3328, 5056]
    - [29, 12329.0]
  - - [1856, 1856, 1, 3328, 1856, 1856, 3328, 1856]
    - [10, 10829.0]
  - - [2368, 2368, 1, 256, 2368, 2368, 256, 2368]
    - [29, 10492.0]
  - - [4288, 4288, 1, 1280, 4288, 4288, 1280, 4288]
    - [29, 12171.0]
  - - [1408, 4288, 1, 256, 1408, 1408, 256, 4288]
    - [26, 10952.0]
  - - [5888, 448, 1, 128, 5888, 5888, 128, 448]
    - [25, 9719.0]
  - - [704, 6784, 1, 3328, 704, 704, 3328, 6784]
    - [3, 11310.0]
  - - [5888, 5888, 1, 1280, 5888, 5888, 1280, 5888]
    - [17, 12605.0]
  - - [5056, 1024, 1, 1280, 5056, 5056, 1280, 1024]
    - [17, 12049.0]
  - - [448, 5888, 1, 3328, 448, 448, 3328, 5888]
    - [5, 9984.0]
  - - [1024, 2944, 1, 1280, 1024, 1024, 1280, 2944]
    - [3, 11160.0]
  - - [5056, 5888, 1, 1280, 5056, 5056, 1280, 5888]
    - [29, 12439.0]
  - - [4288, 5888, 1, 128, 4288, 4288, 128, 5888]
    - [26, 11609.0]
  - - [1408, 3584, 1, 128, 1408, 1408, 128, 3584]
    - [25, 10751.0]
  - - [448, 3584, 1, 128, 448, 448, 128, 3584]
    - [15, 8382.0]
  - - [5888, 2944, 1, 1280, 5888, 5888, 1280, 2944]
    - [10, 12548.0]
  - - [2368, 5888, 1, 128, 2368, 2368, 128, 5888]
    - [1, 11030.0]
  - - [3584, 5888, 1, 256, 3584, 3584, 256, 5888]
    - [17, 12225.0]
  - - [2368, 704, 1, 128, 2368, 2368, 128, 704]
    - [25, 8996.0]
  - - [3584, 2944, 1, 1280, 3584, 3584, 1280, 2944]
    - [17, 12243.0]
  - - [3584, 2368, 1, 128, 3584, 3584, 128, 2368]
    - [32, 10717.0]
  - - [5056, 704, 1, 128, 5056, 5056, 128, 704]
    - [32, 10248.0]
  - - [5056, 1408, 1, 3328, 5056, 5056, 3328, 1408]
    - [17, 12327.0]
  - - [6784, 1024, 1, 3328, 6784, 6784, 3328, 1024]
    - [31, 12139.0]
  - - [6784, 2944, 1, 3328, 6784, 6784, 3328, 2944]
    - [29, 12622.0]
  - - [2944, 5056, 1, 3328, 2944, 2944, 3328, 5056]
    - [29, 12435.0]
  - - [1856, 1856, 1, 256, 1856, 1856, 256, 1856]
    - [27, 9744.0]
  - - [1024, 5888, 1, 128, 1024, 1024, 128, 5888]
    - [10, 10671.0]
  - - [6784, 2368, 1, 1280, 6784, 6784, 1280, 2368]
    - [29, 12101.0]
  - - [4288, 5888, 1, 1280, 4288, 4288, 1280, 5888]
    - [17, 12329.0]
  - - [4288, 4288, 1, 256, 4288, 4288, 256, 4288]
    - [29, 11826.0]
  - - [4288, 1856, 1, 1280, 4288, 4288, 1280, 1856]
    - [3, 11675.0]
  - - [1856, 2944, 1, 3328, 1856, 1856, 3328, 2944]
    - [23, 11594.0]
  - - [256, 6784, 1, 3328, 256, 256, 3328, 6784]
    - [29, 10658.0]
  - - [256, 5056, 1, 128, 256, 256, 128, 5056]
    - [25, 8487.0]
  - - [5056, 1024, 1, 256, 5056, 5056, 256, 1024]
    - [21, 11321.0]
  - - [5056, 1856, 1, 3328, 5056, 5056, 3328, 1856]
    - [17, 11970.0]
  - - [1856, 1408, 1, 256, 1856, 1856, 256, 1408]
    - [22, 9758.0]
  - - [4288, 1408, 1, 128, 4288, 4288, 128, 1408]
    - [27, 10680.0]
  - - [4288, 5056, 1, 256, 4288, 4288, 256, 5056]
    - [10, 11901.0]
  - - [5056, 256, 1, 3328, 5056, 5056, 3328, 256]
    - [5, 11566.0]
  - - [1024, 5888, 1, 1280, 1024, 1024, 1280, 5888]
    - [3, 12009.0]
  - - [6784, 2368, 1, 128, 6784, 6784, 128, 2368]
    - [29, 11362.0]
  - - [5056, 3584, 1, 256, 5056, 5056, 256, 3584]
    - [23, 12028.0]
  - - [1856, 1024, 1, 1280, 1856, 1856, 1280, 1024]
    - [12, 11299.0]
  - - [6784, 4288, 1, 1280, 6784, 6784, 1280, 4288]
    - [29, 12341.0]
  - - [1856, 1856, 1, 1280, 1856, 1856, 1280, 1856]
    - [17, 10664.0]
  - - [6784, 2944, 1, 128, 6784, 6784, 128, 2944]
    - [17, 11901.0]
  - - [5888, 1856, 1, 128, 5888, 5888, 128, 1856]
    - [25, 11058.0]
  - - [2368, 1024, 1, 128, 2368, 2368, 128, 1024]
    - [8, 9711.0]
  - - [5056, 3584, 1, 128, 5056, 5056, 128, 3584]
    - [33, 11618.0]
  - - [5888, 5888, 1, 3328, 5888, 5888, 3328, 5888]
    - [5, 12596.0]
  - - [6784, 1024, 1, 256, 6784, 6784, 256, 1024]
    - [29, 11261.0]
  - - [2944, 2368, 1, 256, 2944, 2944, 256, 2368]
    - [29, 11411.0]
  - - [5056, 5888, 1, 3328, 5056, 5056, 3328, 5888]
    - [17, 12481.0]
  - - [1856, 1024, 1, 256, 1856, 1856, 256, 1024]
    - [22, 9746.0]
  - - [3584, 448, 1, 1280, 3584, 3584, 1280, 448]
    - [9, 10064.0]
  - - [448, 5888, 1, 256, 448, 448, 256, 5888]
    - [21, 9296.0]
  - - [1408, 6784, 1, 3328, 1408, 1408, 3328, 6784]
    - [29, 12255.0]
  - - [4288, 704, 1, 128, 4288, 4288, 128, 704]
    - [25, 9401.0]
  - - [5056, 2944, 1, 256, 5056, 5056, 256, 2944]
    - [29, 11922.0]
  - - [6784, 5888, 1, 128, 6784, 6784, 128, 5888]
    - [17, 12040.0]
  - - [2368, 1856, 1, 256, 2368, 2368, 256, 1856]
    - [26, 10313.0]
  - - [1408, 3584, 1, 3328, 1408, 1408, 3328, 3584]
    - [10, 12014.0]
  - - [2368, 6784, 1, 256, 2368, 2368, 256, 6784]
    - [23, 11725.0]
  - - [5056, 1408, 1, 1280, 5056, 5056, 1280, 1408]
    - [17, 12245.0]
  - - [5056, 4288, 1, 128, 5056, 5056, 128, 4288]
    - [21, 11375.0]
  - - [1408, 1856, 1, 128, 1408, 1408, 128, 1856]
    - [25, 10286.0]
  - - [1408, 5888, 1, 3328, 1408, 1408, 3328, 5888]
    - [19, 12257.0]
  - - [6784, 6784, 1, 256, 6784, 6784, 256, 6784]
    - [29, 12433.0]
  - - [4288, 2368, 1, 128, 4288, 4288, 128, 2368]
    - [7, 10759.0]
  - - [1856, 4288, 1, 128, 1856, 1856, 128, 4288]
    - [1, 10710.0]
  - - [2368, 2944, 1, 256, 2368, 2368, 256, 2944]
    - [10, 11538.0]
  - - [3584, 1856, 1, 1280, 3584, 3584, 1280, 1856]
    - [3, 12002.0]
  - - [6784, 6784, 1, 128, 6784, 6784, 128, 6784]
    - [29, 12098.0]
  - - [5888, 5056, 1, 256, 5888, 5888, 256, 5056]
    - [10, 12155.0]
  - - [3584, 448, 1, 256, 3584, 3584, 256, 448]
    - [28, 9308.0]
  - - [448, 4288, 1, 128, 448, 448, 128, 4288]
    - [18, 8622.0]
  - - [2944, 4288, 1, 3328, 2944, 2944, 3328, 4288]
    - [17, 12181.0]
  - - [256, 6784, 1, 256, 256, 256, 256, 6784]
    - [20, 9619.0]
  - - [1408, 4288, 1, 128, 1408, 1408, 128, 4288]
    - [25, 10754.0]
  - - [2944, 704, 1, 3328, 2944, 2944, 3328, 704]
    - [3, 10912.0]
  - - [3584, 3584, 1, 256, 3584, 3584, 256, 3584]
    - [29, 11927.0]
  - - [3584, 5056, 1, 256, 3584, 3584, 256, 5056]
    - [10, 12082.0]
  - - [2944, 2368, 1, 1280, 2944, 2944, 1280, 2368]
    - [29, 12016.0]
  - - [1408, 3584, 1, 256, 1408, 1408, 256, 3584]
    - [17, 11402.0]
  - - [6784, 3584, 1, 256, 6784, 6784, 256, 3584]
    - [29, 12301.0]
  - - [5056, 2368, 1, 128, 5056, 5056, 128, 2368]
    - [3, 10961.0]
  - - [2944, 2944, 1, 3328, 2944, 2944, 3328, 2944]
    - [17, 12316.0]
  - - [5056, 6784, 1, 256, 5056, 5056, 256, 6784]
    - [29, 12185.0]
  - - [1856, 3584, 1, 128, 1856, 1856, 128, 3584]
    - [18, 10595.0]
  - - [6784, 448, 1, 256, 6784, 6784, 256, 448]
    - [28, 9954.0]
  - - [3584, 6784, 1, 128, 3584, 3584, 128, 6784]
    - [17, 11845.0]
  - - [5056, 1856, 1, 256, 5056, 5056, 256, 1856]
    - [10, 11372.0]
  - - [1024, 1856, 1, 256, 1024, 1024, 256, 1856]
    - [17, 10162.0]
  - - [1408, 6784, 1, 1280, 1408, 1408, 1280, 6784]
    - [17, 12229.0]
  - - [3584, 3584, 1, 1280, 3584, 3584, 1280, 3584]
    - [17, 12369.0]
  - - [5888, 5888, 1, 128, 5888, 5888, 128, 5888]
    - [17, 11982.0]
  - - [5056, 5888, 1, 128, 5056, 5056, 128, 5888]
    - [26, 11686.0]
  - - [5056, 2368, 1, 3328, 5056, 5056, 3328, 2368]
    - [29, 12093.0]
  - - [2944, 4288, 1, 256, 2944, 2944, 256, 4288]
    - [29, 11631.0]
  - - [1408, 3584, 1, 1280, 1408, 1408, 1280, 3584]
    - [29, 11945.0]
  - - [2368, 6784, 1, 3328, 2368, 2368, 3328, 6784]
    - [17, 12146.0]
  - - [1856, 1408, 1, 1280, 1856, 1856, 1280, 1408]
    - [29, 10587.0]
  - - [6784, 704, 1, 128, 6784, 6784, 128, 704]
    - [25, 10461.0]
  - - [1408, 5888, 1, 256, 1408, 1408, 256, 5888]
    - [29, 11788.0]
  - - [704, 2944, 1, 1280, 704, 704, 1280, 2944]
    - [3, 10682.0]
  - - [1856, 2368, 1, 128, 1856, 1856, 128, 2368]
    - [25, 9580.0]
  - - [3584, 704, 1, 1280, 3584, 3584, 1280, 704]
    - [17, 10214.0]
  - - [2944, 6784, 1, 128, 2944, 2944, 128, 6784]
    - [17, 11877.0]
  - - [3584, 448, 1, 3328, 3584, 3584, 3328, 448]
    - [9, 10158.0]
  - - [704, 2368, 1, 3328, 704, 704, 3328, 2368]
    - [5, 10302.0]
  - - [256, 5888, 1, 128, 256, 256, 128, 5888]
    - [2, 8032.0]
  - - [2944, 2944, 1, 1280, 2944, 2944, 1280, 2944]
    - [29, 12276.0]
  - - [5888, 2368, 1, 256, 5888, 5888, 256, 2368]
    - [17, 11748.0]
  - - [6784, 704, 1, 3328, 6784, 6784, 3328, 704]
    - [29, 11320.0]
  - - [5888, 4288, 1, 128, 5888, 5888, 128, 4288]
    - [23, 11572.0]
  - - [1408, 2944, 1, 3328, 1408, 1408, 3328, 2944]
    - [17, 12065.0]
  - - [3584, 704, 1, 128, 3584, 3584, 128, 704]
    - [32, 9340.0]
  - - [5056, 5056, 1, 128, 5056, 5056, 128, 5056]
    - [29, 11441.0]
  - - [448, 5056, 1, 128, 448, 448, 128, 5056]
    - [13, 8765.0]
  - - [1408, 5056, 1, 128, 1408, 1408, 128, 5056]
    - [21, 11099.0]
  - - [2944, 3584, 1, 128, 2944, 2944, 128, 3584]
    - [21, 11591.0]
  - - [3584, 2368, 1, 256, 3584, 3584, 256, 2368]
    - [35, 11578.0]
  - - [5888, 5056, 1, 1280, 5888, 5888, 1280, 5056]
    - [17, 12461.0]
  - - [2368, 5056, 1, 128, 2368, 2368, 128, 5056]
    - [14, 10928.0]
  - - [3584, 3584, 1, 3328, 3584, 3584, 3328, 3584]
    - [29, 12386.0]
  - - [5888, 6784, 1, 256, 5888, 5888, 256, 6784]
    - [17, 12409.0]
  - - [4288, 2944, 1, 3328, 4288, 4288, 3328, 2944]
    - [29, 12178.0]
  - - [4288, 704, 1, 1280, 4288, 4288, 1280, 704]
    - [23, 10153.0]
  - - [256, 5056, 1, 1280, 256, 256, 1280, 5056]
    - [5, 11184.0]
  - - [2944, 5888, 1, 3328, 2944, 2944, 3328, 5888]
    - [17, 12593.0]
  - - [6784, 5888, 1, 1280, 6784, 6784, 1280, 5888]
    - [17, 12609.0]
  - - [5888, 4288, 1, 1280, 5888, 5888, 1280, 4288]
    - [10, 12319.0]
  - - [5888, 3584, 1, 128, 5888, 5888, 128, 3584]
    - [35, 11745.0]
  - - [1856, 1856, 1, 128, 1856, 1856, 128, 1856]
    - [25, 9994.0]
  - - [3584, 1024, 1, 3328, 3584, 3584, 3328, 1024]
    - [3, 11616.0]
  - - [704, 3584, 1, 128, 704, 704, 128, 3584]
    - [0, 9227.0]
  - - [5888, 448, 1, 3328, 5888, 5888, 3328, 448]
    - [28, 10041.0]
  - - [2368, 4288, 1, 1280, 2368, 2368, 1280, 4288]
    - [29, 11772.0]
  - - [4288, 2944, 1, 128, 4288, 4288, 128, 2944]
    - [10, 11278.0]
  - - [1024, 6784, 1, 3328, 1024, 1024, 3328, 6784]
    - [17, 12102.0]
  - - [5056, 2944, 1, 3328, 5056, 5056, 3328, 2944]
    - [17, 12430.0]
  - - [2944, 3584, 1, 256, 2944, 2944, 256, 3584]
    - [29, 11756.0]
  - - [1408, 1408, 1, 3328, 1408, 1408, 3328, 1408]
    - [10, 10580.0]
  - - [3584, 3584, 1, 128, 3584, 3584, 128, 3584]
    - [17, 11200.0]
  - - [3584, 704, 1, 256, 3584, 3584, 256, 704]
    - [28, 9172.0]
  - - [3584, 1408, 1, 3328, 3584, 3584, 3328, 1408]
    - [17, 11509.0]
  - - [704, 3584, 1, 1280, 704, 704, 1280, 3584]
    - [29, 10343.0]
  - - [2944, 6784, 1, 1280, 2944, 2944, 1280, 6784]
    - [17, 12568.0]
  - - [1856, 6784, 1, 256, 1856, 1856, 256, 6784]
    - [10, 11444.0]
  - - [4288, 448, 1, 3328, 4288, 4288, 3328, 448]
    - [9, 10147.0]
  - - [6784, 4288, 1, 128, 6784, 6784, 128, 4288]
    - [10, 11612.0]
  - - [6784, 704, 1, 1280, 6784, 6784, 1280, 704]
    - [3, 11184.0]
  - - [5888, 1024, 1, 3328, 5888, 5888, 3328, 1024]
    - [29, 12092.0]
  - - [704, 6784, 1, 1280, 704, 704, 1280, 6784]
    - [26, 11163.0]
  - - [1856, 5056, 1, 3328, 1856, 1856, 3328, 5056]
    - [29, 11962.0]
  - - [1024, 3584, 1, 128, 1024, 1024, 128, 3584]
    - [6, 9982.0]
  - - [1024, 1408, 1, 128, 1024, 1024, 128, 1408]
    - [0, 8697.0]
  - - [2368, 2944, 1, 128, 2368, 2368, 128, 2944]
    - [1, 10785.0]
  - - [5056, 2944, 1, 128, 5056, 5056, 128, 2944]
    - [26, 11412.0]
  - - [5888, 5056, 1, 3328, 5888, 5888, 3328, 5056]
    - [23, 12469.0]
  - - [1408, 2368, 1, 128, 1408, 1408, 128, 2368]
    - [25, 9879.0]
  - - [5888, 2368, 1, 128, 5888, 5888, 128, 2368]
    - [10, 11129.0]
  - - [3584, 6784, 1, 1280, 3584, 3584, 1280, 6784]
    - [29, 12514.0]
  - - [1856, 5888, 1, 256, 1856, 1856, 256, 5888]
    - [17, 11437.0]
  - - [4288, 4288, 1, 3328, 4288, 4288, 3328, 4288]
    - [17, 12202.0]
  - - [4288, 1408, 1, 1280, 4288, 4288, 1280, 1408]
    - [29, 11937.0]
  - - [3584, 5056, 1, 128, 3584, 3584, 128, 5056]
    - [35, 11421.0]
  - - [4288, 2368, 1, 256, 4288, 4288, 256, 2368]
    - [17, 11408.0]
  - - [2944, 5056, 1, 1280, 2944, 2944, 1280, 5056]
    - [35, 12399.0]
  - - [448, 6784, 1, 256, 448, 448, 256, 6784]
    - [7, 9697.0]
  - - [6784, 2368, 1, 3328, 6784, 6784, 3328, 2368]
    - [35, 12139.0]
  - - [4288, 1856, 1, 3328, 4288, 4288, 3328, 1856]
    - [10, 11708.0]
  - - [3584, 448, 1, 128, 3584, 3584, 128, 448]
    - [20, 8806.0]
  - - [3584, 1024, 1, 1280, 3584, 3584, 1280, 1024]
    - [29, 11475.0]
  - - [1856, 5056, 1, 256, 1856, 1856, 256, 5056]
    - [17, 11408.0]
  - - [1024, 4288, 1, 256, 1024, 1024, 256, 4288]
    - [17, 10749.0]
  - - [5888, 3584, 1, 3328, 5888, 5888, 3328, 3584]
    - [29, 12549.0]
  - - [5056, 3584, 1, 3328, 5056, 5056, 3328, 3584]
    - [17, 12465.0]
  - - [2368, 1408, 1, 1280, 2368, 2368, 1280, 1408]
    - [29, 11178.0]
  - - [5056, 2944, 1, 1280, 5056, 5056, 1280, 2944]
    - [29, 12389.0]
  - - [1024, 6784, 1, 256, 1024, 1024, 256, 6784]
    - [3, 11419.0]
  - - [2944, 1408, 1, 128, 2944, 2944, 128, 1408]
    - [33, 10658.0]
  - - [5056, 6784, 1, 3328, 5056, 5056, 3328, 6784]
    - [29, 12496.0]
  - - [3584, 4288, 1, 256, 3584, 3584, 256, 4288]
    - [23, 11774.0]
  - - [1856, 6784, 1, 3328, 1856, 1856, 3328, 6784]
    - [17, 12098.0]
  - - [5888, 4288, 1, 256, 5888, 5888, 256, 4288]
    - [10, 12059.0]
  - - [5056, 1408, 1, 256, 5056, 5056, 256, 1408]
    - [29, 11513.0]
  - - [3584, 1024, 1, 256, 3584, 3584, 256, 1024]
    - [35, 11007.0]
  - - [5888, 5888, 1, 256, 5888, 5888, 256, 5888]
    - [35, 12384.0]
  - - [4288, 1024, 1, 1280, 4288, 4288, 1280, 1024]
    - [3, 11683.0]
  - - [448, 6784, 1, 3328, 448, 448, 3328, 6784]
    - [3, 10395.0]
  - - [2944, 1408, 1, 1280, 2944, 2944, 1280, 1408]
    - [17, 11927.0]
  - - [2944, 1856, 1, 3328, 2944, 2944, 3328, 1856]
    - [17, 11596.0]
  - - [2944, 2944, 1, 128, 2944, 2944, 128, 2944]
    - [34, 10482.0]
  - - [3584, 5888, 1, 1280, 3584, 3584, 1280, 5888]
    - [17, 12503.0]
  - - [6784, 1856, 1, 1280, 6784, 6784, 1280, 1856]
    - [35, 12035.0]
  - - [2944, 5056, 1, 256, 2944, 2944, 256, 5056]
    - [10, 11868.0]
  - - [5888, 256, 1, 3328, 5888, 5888, 3328, 256]
    - [23, 10877.0]
  - - [1856, 5888, 1, 3328, 1856, 1856, 3328, 5888]
    - [17, 12003.0]
  - - [3584, 1408, 1, 256, 3584, 3584, 256, 1408]
    - [23, 10898.0]
  - - [704, 3584, 1, 3328, 704, 704, 3328, 3584]
    - [3, 10492.0]
  - - [5056, 448, 1, 1280, 5056, 5056, 1280, 448]
    - [29, 10114.0]
  - - [3584, 1856, 1, 3328, 3584, 3584, 3328, 1856]
    - [29, 12065.0]
  - - [2944, 1024, 1, 256, 2944, 2944, 256, 1024]
    - [27, 10472.0]
  - - [1024, 2368, 1, 128, 1024, 1024, 128, 2368]
    - [6, 9428.0]
  - - [2368, 4288, 1, 3328, 2368, 2368, 3328, 4288]
    - [17, 11843.0]
  - - [1024, 1408, 1, 1280, 1024, 1024, 1280, 1408]
    - [3, 10136.0]
  - - [6784, 5056, 1, 256, 6784, 6784, 256, 5056]
    - [10, 12209.0]
  - - [448, 6784, 1, 128, 448, 448, 128, 6784]
    - [15, 8997.0]
  - - [2944, 6784, 1, 256, 2944, 2944, 256, 6784]
    - [29, 12348.0]
  - - [2368, 2368, 1, 1280, 2368, 2368, 1280, 2368]
    - [10, 11249.0]
  - - [1856, 3584, 1, 1280, 1856, 1856, 1280, 3584]
    - [29, 11990.0]
  - - [3584, 1408, 1, 1280, 3584, 3584, 1280, 1408]
    - [10, 11926.0]
  - - [4288, 448, 1, 128, 4288, 4288, 128, 448]
    - [25, 8883.0]
  - - [5056, 256, 1, 1280, 5056, 5056, 1280, 256]
    - [37, 11088.0]
  - - [1856, 1408, 1, 3328, 1856, 1856, 3328, 1408]
    - [10, 10809.0]
  - - [1024, 4288, 1, 3328, 1024, 1024, 3328, 4288]
    - [17, 11866.0]
  - - [5056, 448, 1, 256, 5056, 5056, 256, 448]
    - [20, 9658.0]
  - - [2944, 2368, 1, 3328, 2944, 2944, 3328, 2368]
    - [17, 12095.0]
  - - [1024, 1856, 1, 1280, 1024, 1024, 1280, 1856]
    - [3, 11096.0]
  - - [6784, 1856, 1, 256, 6784, 6784, 256, 1856]
    - [10, 11652.0]
  - - [1024, 5888, 1, 256, 1024, 1024, 256, 5888]
    - [10, 11569.0]
  - - [1408, 2368, 1, 256, 1408, 1408, 256, 2368]
    - [29, 10527.0]
  - - [1408, 1408, 1, 256, 1408, 1408, 256, 1408]
    - [15, 9794.0]
  - - [2368, 2368, 1, 128, 2368, 2368, 128, 2368]
    - [33, 10268.0]
  - - [6784, 1408, 1, 128, 6784, 6784, 128, 1408]
    - [21, 11493.0]
  - - [4288, 5888, 1, 256, 4288, 4288, 256, 5888]
    - [29, 12046.0]
  - - [1408, 5056, 1, 256, 1408, 1408, 256, 5056]
    - [17, 11605.0]
  - - [4288, 3584, 1, 128, 4288, 4288, 128, 3584]
    - [33, 11504.0]
  - - [3584, 5056, 1, 1280, 3584, 3584, 1280, 5056]
    - [10, 12426.0]
  - - [1856, 1024, 1, 128, 1856, 1856, 128, 1024]
    - [22, 8866.0]
  - - [704, 4288, 1, 256, 704, 704, 256, 4288]
    - [7, 9626.0]
  - - [5888, 2368, 1, 1280, 5888, 5888, 1280, 2368]
    - [17, 12149.0]
  - - [2368, 5888, 1, 1280, 2368, 2368, 1280, 5888]
    - [17, 12135.0]
  - - [5888, 256, 1, 1280, 5888, 5888, 1280, 256]
    - [17, 10683.0]
  - - [2368, 1856, 1, 3328, 2368, 2368, 3328, 1856]
    - [17, 11171.0]
  - - [2944, 704, 1, 256, 2944, 2944, 256, 704]
    - [27, 9305.0]
  - - [704, 3584, 1, 256, 704, 704, 256, 3584]
    - [1, 9206.0]
  - - [704, 2944, 1, 3328, 704, 704, 3328, 2944]
    - [3, 10935.0]
  - - [6784, 1024, 1, 128, 6784, 6784, 128, 1024]
    - [33, 10726.0]
  - - [2944, 1024, 1, 3328, 2944, 2944, 3328, 1024]
    - [5, 11342.0]
  - - [2944, 5056, 1, 128, 2944, 2944, 128, 5056]
    - [33, 11319.0]
  - - [1408, 6784, 1, 256, 1408, 1408, 256, 6784]
    - [23, 11828.0]
  - - [6784, 1408, 1, 3328, 6784, 6784, 3328, 1408]
    - [35, 12275.0]
  - - [4288, 6784, 1, 128, 4288, 4288, 128, 6784]
    - [26, 11682.0]
  - - [6784, 2944, 1, 1280, 6784, 6784, 1280, 2944]
    - [29, 12599.0]
  - - [4288, 1856, 1, 128, 4288, 4288, 128, 1856]
    - [33, 10552.0]
  - - [1856, 2944, 1, 128, 1856, 1856, 128, 2944]
    - [3, 10533.0]
  - - [6784, 448, 1, 128, 6784, 6784, 128, 448]
    - [25, 10341.0]
  - - [448, 5056, 1, 1280, 448, 448, 1280, 5056]
    - [5, 10431.0]
  - - [2368, 1856, 1, 128, 2368, 2368, 128, 1856]
    - [32, 9894.0]
  - - [4288, 704, 1, 256, 4288, 4288, 256, 704]
    - [9, 9701.0]
  - - [5888, 704, 1, 256, 5888, 5888, 256, 704]
    - [10, 10402.0]
  - - [3584, 1024, 1, 128, 3584, 3584, 128, 1024]
    - [25, 9961.0]
  - - [256, 5888, 1, 3328, 256, 256, 3328, 5888]
    - [29, 10946.0]
  - - [1408, 4288, 1, 3328, 1408, 1408, 3328, 4288]
    - [17, 12100.0]
  - - [6784, 4288, 1, 256, 6784, 6784, 256, 4288]
    - [10, 12104.0]
  - - [5888, 256, 1, 256, 5888, 5888, 256, 256]
    - [22, 9784.0]
  - - [6784, 1024, 1, 1280, 6784, 6784, 1280, 1024]
    - [29, 12063.0]
  - - [5888, 1024, 1, 128, 5888, 5888, 128, 1024]
    - [27, 10645.0]
  - - [2944, 704, 1, 1280, 2944, 2944, 1280, 704]
    - [17, 10683.0]
  - - [6784, 3584, 1, 1280, 6784, 6784, 1280, 3584]
    - [17, 12517.0]
  - - [1024, 6784, 1, 1280, 1024, 1024, 1280, 6784]
    - [3, 11988.0]
  - - [1408, 2944, 1, 1280, 1408, 1408, 1280, 2944]
    - [29, 12001.0]
  - - [1408, 2368, 1, 3328, 1408, 1408, 3328, 2368]
    - [3, 11450.0]
  - - [2944, 1856, 1, 128, 2944, 2944, 128, 1856]
    - [25, 10607.0]
  - - [256, 6784, 1, 128, 256, 256, 128, 6784]
    - [30, 9066.0]
  - - [5056, 6784, 1, 128, 5056, 5056, 128, 6784]
    - [26, 11735.0]
  - - [4288, 5056, 1, 128, 4288, 4288, 128, 5056]
    - [10, 11397.0]
  - - [1856, 5888, 1, 128, 1856, 1856, 128, 5888]
    - [21, 11002.0]
  - - [2944, 5888, 1, 256, 2944, 2944, 256, 5888]
    - [35, 12327.0]
  - - [3584, 1856, 1, 256, 3584, 3584, 256, 1856]
    - [10, 11412.0]
  - - [4288, 3584, 1, 1280, 4288, 4288, 1280, 3584]
    - [17, 12313.0]
  - - [704, 4288, 1, 3328, 704, 704, 3328, 4288]
    - [3, 10376.0]
  - - [704, 5888, 1, 128, 704, 704, 128, 5888]
    - [7, 9302.0]
  - - [6784, 3584, 1, 128, 6784, 6784, 128, 3584]
    - [29, 11894.0]
  - - [4288, 5056, 1, 3328, 4288, 4288, 3328, 5056]
    - [17, 12294.0]
  - - [1408, 1408, 1, 128, 1408, 1408, 128, 1408]
    - [13, 9148.0]
  - - [5056, 2368, 1, 256, 5056, 5056, 256, 2368]
    - [10, 11562.0]
  - - [4288, 704, 1, 3328, 4288, 4288, 3328, 704]
    - [3, 10332.0]
  - - [448, 3584, 1, 256, 448, 448, 256, 3584]
    - [17, 8437.0]
  - - [2368, 1024, 1, 1280, 2368, 2368, 1280, 1024]
    - [29, 10858.0]
  - - [2944, 1408, 1, 3328, 2944, 2944, 3328, 1408]
    - [17, 11941.0]
  - - [1024, 1408, 1, 3328, 1024, 1024, 3328, 1408]
    - [29, 10435.0]
  - - [2944, 5888, 1, 1280, 2944, 2944, 1280, 5888]
    - [17, 12554.0]
  - - [5888, 3584, 1, 256, 5888, 5888, 256, 3584]
    - [17, 12219.0]
  - - [1408, 1856, 1, 3328, 1408, 1408, 3328, 1856]
    - [3, 10893.0]
  - - [6784, 1408, 1, 1280, 6784, 6784, 1280, 1408]
    - [17, 12211.0]
  - - [704, 2944, 1, 256, 704, 704, 256, 2944]
    - [2, 9917.0]
  - - [704, 4288, 1, 128, 704, 704, 128, 4288]
    - [25, 9209.0]
  - - [2368, 4288, 1, 128, 2368, 2368, 128, 4288]
    - [33, 10867.0]
  - - [1024, 6784, 1, 128, 1024, 1024, 128, 6784]
    - [10, 10849.0]
  - - [1408, 1408, 1, 1280, 1408, 1408, 1280, 1408]
    - [3, 10456.0]
  - - [448, 4288, 1, 3328, 448, 448, 3328, 4288]
    - [3, 10108.0]
  - - [2368, 1408, 1, 256, 2368, 2368, 256, 1408]
    - [10, 9969.0]
  - - [5888, 5056, 1, 128, 5888, 5888, 128, 5056]
    - [10, 11672.0]
  - - [704, 2368, 1, 256, 704, 704, 256, 2368]
    - [15, 9107.0]
  - - [5888, 2368, 1, 3328, 5888, 5888, 3328, 2368]
    - [3, 12201.0]
  - - [4288, 448, 1, 1280, 4288, 4288, 1280, 448]
    - [9, 9968.0]
  - - [5888, 704, 1, 3328, 5888, 5888, 3328, 704]
    - [19, 11212.0]
  - - [5056, 256, 1, 128, 5056, 5056, 128, 256]
    - [8, 8822.0]
  - - [1408, 5888, 1, 128, 1408, 1408, 128, 5888]
    - [33, 11189.0]
  - - [1408, 1024, 1, 256, 1408, 1408, 256, 1024]
    - [27, 9498.0]
  - - [1024, 1856, 1, 128, 1024, 1024, 128, 1856]
    - [6, 9222.0]
  - - [5056, 6784, 1, 1280, 5056, 5056, 1280, 6784]
    - [17, 12458.0]
  - - [704, 5056, 1, 3328, 704, 704, 3328, 5056]
    - [31, 11196.0]
  - - [3584, 5056, 1, 3328, 3584, 3584, 3328, 5056]
    - [17, 12451.0]
  - - [2368, 2944, 1, 3328, 2368, 2368, 3328, 2944]
    - [29, 12098.0]
  - - [2368, 3584, 1, 256, 2368, 2368, 256, 3584]
    - [10, 11267.0]
  - - [5056, 3584, 1, 1280, 5056, 5056, 1280, 3584]
    - [29, 12403.0]
  - - [1856, 2944, 1, 1280, 1856, 1856, 1280, 2944]
    - [17, 11431.0]
  - - [3584, 2368, 1, 1280, 3584, 3584, 1280, 2368]
    - [29, 11987.0]
  - - [2944, 1408, 1, 256, 2944, 2944, 256, 1408]
    - [29, 11398.0]
  - - [4288, 1408, 1, 3328, 4288, 4288, 3328, 1408]
    - [17, 12098.0]
  - - [2944, 1024, 1, 128, 2944, 2944, 128, 1024]
    - [25, 9874.0]
  - - [4288, 5056, 1, 1280, 4288, 4288, 1280, 5056]
    - [29, 12244.0]
  - - [5888, 6784, 1, 1280, 5888, 5888, 1280, 6784]
    - [17, 12622.0]
  - - [6784, 5056, 1, 128, 6784, 6784, 128, 5056]
    - [29, 11737.0]
  - - [5888, 1408, 1, 3328, 5888, 5888, 3328, 1408]
    - [3, 12248.0]
  - - [256, 5056, 1, 256, 256, 256, 256, 5056]
    - [20, 9500.0]
  - - [448, 3584, 1, 3328, 448, 448, 3328, 3584]
    - [19, 9970.0]
  - - [704, 2368, 1, 128, 704, 704, 128, 2368]
    - [9, 7737.0]
  - - [5888, 256, 1, 128, 5888, 5888, 128, 256]
    - [36, 8148.0]
  - - [3584, 1856, 1, 128, 3584, 3584, 128, 1856]
    - [15, 10371.0]
  - - [4288, 4288, 1, 128, 4288, 4288, 128, 4288]
    - [10, 11233.0]
  - - [1856, 1024, 1, 3328, 1856, 1856, 3328, 1024]
    - [5, 11672.0]
  - - [1024, 5056, 1, 256, 1024, 1024, 256, 5056]
    - [23, 11095.0]
  - - [2368, 1408, 1, 3328, 2368, 2368, 3328, 1408]
    - [29, 11366.0]
  - - [5888, 448, 1, 256, 5888, 5888, 256, 448]
    - [28, 9506.0]
  - - [5888, 6784, 1, 128, 5888, 5888, 128, 6784]
    - [17, 12022.0]
  - - [6784, 5056, 1, 1280, 6784, 6784, 1280, 5056]
    - [3, 12468.0]
  - - [5056, 704, 1, 1280, 5056, 5056, 1280, 704]
    - [17, 10939.0]
  - - [4288, 6784, 1, 1280, 4288, 4288, 1280, 6784]
    - [29, 12352.0]
  - - [6784, 1408, 1, 256, 6784, 6784, 256, 1408]
    - [17, 11638.0]
  - - [3584, 5888, 1, 128, 3584, 3584, 128, 5888]
    - [29, 11794.0]
  - - [5056, 5888, 1, 256, 5056, 5056, 256, 5888]
    - [29, 12149.0]
  - - [2368, 1024, 1, 256, 2368, 2368, 256, 1024]
    - [4, 10041.0]
  - - [2944, 1856, 1, 256, 2944, 2944, 256, 1856]
    - [23, 10974.0]
  - - [1856, 6784, 1, 1280, 1856, 1856, 1280, 6784]
    - [35, 12058.0]
  - - [4288, 3584, 1, 256, 4288, 4288, 256, 3584]
    - [35, 11877.0]
  - - [5056, 1856, 1, 1280, 5056, 5056, 1280, 1856]
    - [3, 11895.0]
  - - [1408, 1024, 1, 3328, 1408, 1408, 3328, 1024]
    - [3, 10526.0]
  - - [5888, 3584, 1, 1280, 5888, 5888, 1280, 3584]
    - [3, 12491.0]
  - - [1856, 3584, 1, 3328, 1856, 1856, 3328, 3584]
    - [29, 12071.0]
  - - [1024, 2944, 1, 256, 1024, 1024, 256, 2944]
    - [3, 10274.0]
  - - [448, 6784, 1, 1280, 448, 448, 1280, 6784]
    - [1, 10338.0]
  - - [704, 5056, 1, 256, 704, 704, 256, 5056]
    - [7, 10320.0]
  - - [2944, 1856, 1, 1280, 2944, 2944, 1280, 1856]
    - [17, 11531.0]
  - - [5056, 256, 1, 256, 5056, 5056, 256, 256]
    - [11, 10127.0]
  - - [2368, 3584, 1, 3328, 2368, 2368, 3328, 3584]
    - [23, 12037.0]
  - - [3584, 5888, 1, 3328, 3584, 3584, 3328, 5888]
    - [29, 12552.0]
  - - [2944, 3584, 1, 1280, 2944, 2944, 1280, 3584]
    - [29, 12247.0]
  - - [1856, 5888, 1, 1280, 1856, 1856, 1280, 5888]
    - [3, 11962.0]
  - - [5056, 448, 1, 3328, 5056, 5056, 3328, 448]
    - [29, 10477.0]
  - - [4288, 1408, 1, 256, 4288, 4288, 256, 1408]
    - [17, 11194.0]
  - - [5888, 1408, 1, 128, 5888, 5888, 128, 1408]
    - [29, 11135.0]
  - - [4288, 2368, 1, 1280, 4288, 4288, 1280, 2368]
    - [29, 11799.0]
  - - [6784, 2368, 1, 256, 6784, 6784, 256, 2368]
    - [23, 11803.0]
  - - [4288, 1856, 1, 256, 4288, 4288, 256, 1856]
    - [10, 11258.0]
  - - [1856, 2944, 1, 256, 1856, 1856, 256, 2944]
    - [29, 10973.0]
  - - [5056, 1024, 1, 128, 5056, 5056, 128, 1024]
    - [7, 10893.0]
  - - [6784, 256, 1, 128, 6784, 6784, 128, 256]
    - [15, 9340.0]
  - - [5888, 704, 1, 128, 5888, 5888, 128, 704]
    - [25, 10307.0]
  - - [1024, 4288, 1, 1280, 1024, 1024, 1280, 4288]
    - [17, 11719.0]
  - - [2368, 5056, 1, 3328, 2368, 2368, 3328, 5056]
    - [29, 12098.0]
  - - [4288, 1024, 1, 3328, 4288, 4288, 3328, 1024]
    - [23, 11861.0]
  - - [1024, 5056, 1, 3328, 1024, 1024, 3328, 5056]
    - [19, 12251.0]
  - - [1024, 1856, 1, 3328, 1024, 1024, 3328, 1856]
    - [3, 11386.0]
  - - [704, 6784, 1, 128, 704, 704, 128, 6784]
    - [15, 9454.0]
  - - [4288, 6784, 1, 256, 4288, 4288, 256, 6784]
    - [29, 12082.0]
  - - [3584, 2944, 1, 3328, 3584, 3584, 3328, 2944]
    - [29, 12322.0]
  - - [5888, 2944, 1, 256, 5888, 5888, 256, 2944]
    - [17, 12224.0]
  - - [2368, 6784, 1, 128, 2368, 2368, 128, 6784]
    - [21, 11353.0]
  - - [448, 4288, 1, 1280, 448, 448, 1280, 4288]
    - [17, 10002.0]
  - - [5056, 4288, 1, 256, 5056, 5056, 256, 4288]
    - [10, 11876.0]
  - - [1024, 3584, 1, 256, 1024, 1024, 256, 3584]
    - [3, 10824.0]
  - - [1856, 5056, 1, 128, 1856, 1856, 128, 5056]
    - [17, 10825.0]
  - - [6784, 6784, 1, 3328, 6784, 6784, 3328, 6784]
    - [17, 12482.0]
  - - [448, 5888, 1, 1280, 448, 448, 1280, 5888]
    - [26, 9753.0]
  - - [5056, 448, 1, 128, 5056, 5056, 128, 448]
    - [25, 8517.0]
  - - [3584, 2944, 1, 128, 3584, 3584, 128, 2944]
    - [10, 11257.0]
  - - [6784, 256, 1, 1280, 6784, 6784, 1280, 256]
    - [17, 10492.0]
  - - [2368, 5888, 1, 3328, 2368, 2368, 3328, 5888]
    - [17, 12209.0]
  - - [2368, 1856, 1, 1280, 2368, 2368, 1280, 1856]
    - [10, 10986.0]
  - - [3584, 4288, 1, 128, 3584, 3584, 128, 4288]
    - [10, 11227.0]
  - - [5888, 4288, 1, 3328, 5888, 5888, 3328, 4288]
    - [10, 12368.0]
  - - [2368, 704, 1, 256, 2368, 2368, 256, 704]
    - [8, 8695.0]
  - - [3584, 1408, 1, 128, 3584, 3584, 128, 1408]
    - [36, 10520.0]
  - - [1856, 5056, 1, 1280, 1856, 1856, 1280, 5056]
    - [17, 11927.0]
  - - [2944, 1024, 1, 1280, 2944, 2944, 1280, 1024]
    - [17, 11279.0]
  - - [2368, 4288, 1, 256, 2368, 2368, 256, 4288]
    - [29, 11379.0]
  - - [1024, 2368, 1, 3328, 1024, 1024, 3328, 2368]
    - [5, 11299.0]
  - - [6784, 1856, 1, 3328, 6784, 6784, 3328, 1856]
    - [29, 12120.0]
  - - [1024, 2944, 1, 128, 1024, 1024, 128, 2944]
    - [6, 10091.0]
  - - [1024, 3584, 1, 1280, 1024, 1024, 1280, 3584]
    - [3, 11497.0]
  - - [4288, 5888, 1, 3328, 4288, 4288, 3328, 5888]
    - [17, 12375.0]
  - - [1024, 2944, 1, 3328, 1024, 1024, 3328, 2944]
    - [10, 11318.0]
  - - [3584, 6784, 1, 256, 3584, 3584, 256, 6784]
    - [29, 12272.0]
  - - [256, 6784, 1, 1280, 256, 256, 1280, 6784]
    - [3, 10488.0]
  - - [1856, 3584, 1, 256, 1856, 1856, 256, 3584]
    - [26, 11292.0]
  - - [6784, 1856, 1, 128, 6784, 6784, 128, 1856]
    - [25, 11113.0]
  - - [2944, 704, 1, 128, 2944, 2944, 128, 704]
    - [25, 9647.0]
  - - [256, 5888, 1, 1280, 256, 256, 1280, 5888]
    - [3, 10833.0]
  - - [4288, 6784, 1, 3328, 4288, 4288, 3328, 6784]
    - [17, 12405.0]
  - - [2368, 1408, 1, 128, 2368, 2368, 128, 1408]
    - [20, 9616.0]
  - - [1408, 1024, 1, 128, 1408, 1408, 128, 1024]
    - [22, 8847.0]
  - - [6784, 3584, 1, 3328, 6784, 6784, 3328, 3584]
    - [29, 12536.0]
  - - [2368, 5056, 1, 1280, 2368, 2368, 1280, 5056]
    - [17, 12027.0]
  - - [1408, 2368, 1, 1280, 1408, 1408, 1280, 2368]
    - [17, 11315.0]
  - - [2944, 4288, 1, 128, 2944, 2944, 128, 4288]
    - [17, 11284.0]
  - - [2944, 2944, 1, 256, 2944, 2944, 256, 2944]
    - [29, 11887.0]
  - - [6784, 256, 1, 256, 6784, 6784, 256, 256]
    - [10, 9729.0]
  - - [256, 5056, 1, 3328, 256, 256, 3328, 5056]
    - [5, 11598.0]
  - - [5056, 1856, 1, 128, 5056, 5056, 128, 1856]
    - [32, 10700.0]
  - - [5888, 1408, 1, 256, 5888, 5888, 256, 1408]
    - [17, 11779.0]
  - - [4288, 3584, 1, 3328, 4288, 4288, 3328, 3584]
    - [29, 12345.0]
  - - [1024, 2368, 1, 1280, 1024, 1024, 1280, 2368]
    - [17, 10951.0]
  - - [5888, 6784, 1, 3328, 5888, 5888, 3328, 6784]
    - [23, 12631.0]
  - - [704, 4288, 1, 1280, 704, 704, 1280, 4288]
    - [26, 10176.0]
  - - [6784, 448, 1, 3328, 6784, 6784, 3328, 448]
    - [17, 10392.0]
  - - [4288, 1024, 1, 128, 4288, 4288, 128, 1024]
    - [22, 10101.0]
  - - [1920, 2048, 1, 2048, 1920, 1920, 2048, 2048]
    - [29, 12308.0]
  - - [2880, 3072, 1, 3072, 2880, 2880, 3072, 3072]
    - [29, 12106.0]
  - - [3840, 4096, 1, 4096, 3840, 3840, 4096, 4096]
    - [29, 12599.0]
  - - [7680, 8192, 1, 8192, 7680, 7680, 8192, 8192]
    - [35, 12412.0]
  - - [2048, 2048, 1, 2048, 2048, 2048, 2048, 2048]
    - [29, 11776.0]
  - - [3072, 3072, 1, 3072, 3072, 3072, 3072, 3072]
    - [29, 12441.0]
  - - [4096, 4096, 1, 4096, 4096, 4096, 4096, 4096]
    - [35, 12465.0]
  - - [8192, 8192, 1, 8192, 8192, 8192, 8192, 8192]
    - [31, 12324.0]
  - - [1152, 1152, 1, 1152, 1152, 1152, 1152, 1152]
    - [25, 9271.0]
  - - [1536, 1536, 1, 1536, 1536, 1536, 1536, 1536]
    - [31, 10759.0]
  - - [1920, 1920, 1, 1920, 1920, 1920, 1920, 1920]
    - [10, 11600.0]
  - - [2304, 2304, 1, 2304, 2304, 2304, 2304, 2304]
    - [29, 11908.0]
  - - [2688, 2688, 1, 2688, 2688, 2688, 2688, 2688]
    - [3, 12056.0]
  - - [3456, 3456, 1, 3456, 3456, 3456, 3456, 3456]
    - [29, 12424.0]
  - - [3840, 3840, 1, 3840, 3840, 3840, 3840, 3840]
    - [17, 12593.0]
  - - [4224, 4224, 1, 4224, 4224, 4224, 4224, 4224]
    - [23, 12509.0]
  - - [4608, 4608, 1, 4608, 4608, 4608, 4608, 4608]
    - [17, 12602.0]
  - - [4992, 4992, 1, 4992, 4992, 4992, 4992, 4992]
    - [17, 12551.0]
  - - [5376, 5376, 1, 5376, 5376, 5376, 5376, 5376]
    - [35, 12587.0]
  - - [5760, 5760, 1, 5760, 5760, 5760, 5760, 5760]
    - [29, 12620.0]
  - - [6144, 6144, 1, 6144, 6144, 6144, 6144, 6144]
    - [37, 12398.0]
  - - [6528, 6528, 1, 6528, 6528, 6528, 6528, 6528]
    - [17, 12495.0]
  - - [6912, 6912, 1, 6912, 6912, 6912, 6912, 6912]
    - [19, 12542.0]
  - - [7296, 7296, 1, 7296, 7296, 7296, 7296, 7296]
    - [17, 12369.0]
  - - [7680, 7680, 1, 7680, 7680, 7680, 7680, 7680]
    - [23, 12368.0]
  - - [1856, 448, 1, 3328, 1856, 1856, 3328, 448]
    - [50, 9325.0]
  - - [128, 6784, 1, 3328, 128, 128, 3328, 6784]
    - [68, 9788.0]
  - - [2368, 448, 1, 128, 2368, 2368, 128, 448]
    - [46, 7759.0]
  - - [256, 4288, 1, 3328, 256, 256, 3328, 4288]
    - [57, 9978.0]
  - - [704, 1856, 1, 3328, 704, 704, 3328, 1856]
    - [72, 9099.0]
  - - [448, 1024, 1, 1280, 448, 448, 1280, 1024]
    - [69, 8415.0]
  - - [256, 1408, 1, 3328, 256, 256, 3328, 1408]
    - [57, 7231.0]
  - - [704, 1856, 1, 1280, 704, 704, 1280, 1856]
    - [58, 8897.0]
  - - [128, 5056, 1, 128, 128, 128, 128, 5056]
    - [73, 6713.0]
  - - [2368, 128, 1, 256, 2368, 2368, 256, 128]
    - [49, 6100.0]
  - - [64, 5056, 1, 256, 64, 64, 256, 5056]
    - [39, 6257.0]
  - - [256, 2944, 1, 256, 256, 256, 256, 2944]
    - [71, 7404.0]
  - - [256, 1856, 1, 1280, 256, 256, 1280, 1856]
    - [43, 8646.0]
  - - [128, 3584, 1, 1280, 128, 128, 1280, 3584]
    - [57, 8498.0]
  - - [4288, 256, 1, 256, 4288, 4288, 256, 256]
    - [79, 7759.0]
  - - [2944, 128, 1, 128, 2944, 2944, 128, 128]
    - [47, 4393.0]
  - - [5888, 64, 1, 3328, 5888, 5888, 3328, 64]
    - [80, 5486.0]
  - - [2944, 256, 1, 3328, 2944, 2944, 3328, 256]
    - [53, 8929.0]
  - - [1408, 448, 1, 1280, 1408, 1408, 1280, 448]
    - [74, 9007.0]
  - - [1408, 704, 1, 3328, 1408, 1408, 3328, 704]
    - [59, 8870.0]
  - - [6784, 64, 1, 256, 6784, 6784, 256, 64]
    - [51, 5893.0]
  - - [2944, 256, 1, 256, 2944, 2944, 256, 256]
    - [77, 7566.0]
  - - [704, 1408, 1, 3328, 704, 704, 3328, 1408]
    - [77, 8738.0]
  - - [2944, 256, 1, 128, 2944, 2944, 128, 256]
    - [64, 6440.0]
  - - [448, 2944, 1, 128, 448, 448, 128, 2944]
    - [76, 7773.0]
  - - [2368, 128, 1, 3328, 2368, 2368, 3328, 128]
    - [61, 8632.0]
  - - [2944, 128, 1, 256, 2944, 2944, 256, 128]
    - [48, 5365.0]
  - - [448, 1408, 1, 256, 448, 448, 256, 1408]
    - [73, 7133.0]
  - - [64, 5056, 1, 3328, 64, 64, 3328, 5056]
    - [59, 8555.0]
  - - [1024, 448, 1, 128, 1024, 1024, 128, 448]
    - [69, 5010.0]
  - - [256, 3584, 1, 3328, 256, 256, 3328, 3584]
    - [41, 10393.0]
  - - [5056, 64, 1, 1280, 5056, 5056, 1280, 64]
    - [51, 7736.0]
  - - [1024, 704, 1, 256, 1024, 1024, 256, 704]
    - [48, 7382.0]
  - - [128, 4288, 1, 128, 128, 128, 128, 4288]
    - [40, 5121.0]
  - - [3584, 256, 1, 128, 3584, 3584, 128, 256]
    - [64, 6941.0]
  - - [4288, 128, 1, 1280, 4288, 4288, 1280, 128]
    - [65, 8576.0]
  - - [5888, 64, 1, 256, 5888, 5888, 256, 64]
    - [52, 5215.0]
  - - [1856, 256, 1, 1280, 1856, 1856, 1280, 256]
    - [64, 8477.0]
  - - [64, 5888, 1, 3328, 64, 64, 3328, 5888]
    - [42, 7328.0]
  - - [704, 1024, 1, 1280, 704, 704, 1280, 1024]
    - [64, 8544.0]
  - - [448, 1856, 1, 128, 448, 448, 128, 1856]
    - [76, 6320.0]
  - - [1024, 704, 1, 1280, 1024, 1024, 1280, 704]
    - [60, 8309.0]
  - - [128, 5888, 1, 256, 128, 128, 256, 5888]
    - [57, 7519.0]
  - - [704, 704, 1, 3328, 704, 704, 3328, 704]
    - [72, 8222.0]
  - - [704, 1408, 1, 1280, 704, 704, 1280, 1408]
    - [64, 8681.0]
  - - [3584, 256, 1, 3328, 3584, 3584, 3328, 256]
    - [54, 10191.0]
  - - [704, 1856, 1, 128, 704, 704, 128, 1856]
    - [76, 7500.0]
  - - [128, 3584, 1, 3328, 128, 128, 3328, 3584]
    - [40, 9150.0]
  - - [128, 2944, 1, 1280, 128, 128, 1280, 2944]
    - [40, 7091.0]
  - - [3584, 128, 1, 256, 3584, 3584, 256, 128]
    - [62, 6439.0]
  - - [448, 1408, 1, 3328, 448, 448, 3328, 1408]
    - [59, 9158.0]
  - - [256, 3584, 1, 256, 256, 256, 256, 3584]
    - [72, 8383.0]
  - - [256, 2944, 1, 3328, 256, 256, 3328, 2944]
    - [48, 9232.0]
  - - [448, 2368, 1, 128, 448, 448, 128, 2368]
    - [69, 6886.0]
  - - [1408, 704, 1, 256, 1408, 1408, 256, 704]
    - [51, 7570.0]
  - - [448, 2944, 1, 3328, 448, 448, 3328, 2944]
    - [41, 9167.0]
  - - [64, 5888, 1, 256, 64, 64, 256, 5888]
    - [73, 5336.0]
  - - [6784, 128, 1, 3328, 6784, 6784, 3328, 128]
    - [83, 9677.0]
  - - [704, 704, 1, 256, 704, 704, 256, 704]
    - [50, 6836.0]
  - - [128, 4288, 1, 3328, 128, 128, 3328, 4288]
    - [50, 9222.0]
  - - [448, 704, 1, 1280, 448, 448, 1280, 704]
    - [73, 7634.0]
  - - [1024, 448, 1, 3328, 1024, 1024, 3328, 448]
    - [74, 8814.0]
  - - [1856, 704, 1, 1280, 1856, 1856, 1280, 704]
    - [53, 8891.0]
  - - [448, 1408, 1, 1280, 448, 448, 1280, 1408]
    - [59, 8770.0]
  - - [1024, 1024, 1, 1280, 1024, 1024, 1280, 1024]
    - [60, 9030.0]
  - - [448, 1024, 1, 128, 448, 448, 128, 1024]
    - [62, 5133.0]
  - - [448, 2368, 1, 3328, 448, 448, 3328, 2368]
    - [58, 9138.0]
  - - [5056, 64, 1, 128, 5056, 5056, 128, 64]
    - [47, 4226.0]
  - - [704, 1024, 1, 256, 704, 704, 256, 1024]
    - [48, 7220.0]
  - - [128, 6784, 1, 1280, 128, 128, 1280, 6784]
    - [72, 9523.0]
  - - [1856, 256, 1, 256, 1856, 1856, 256, 256]
    - [62, 6720.0]
  - - [256, 4288, 1, 1280, 256, 256, 1280, 4288]
    - [53, 9375.0]
  - - [256, 1856, 1, 128, 256, 256, 128, 1856]
    - [40, 5243.0]
  - - [448, 1408, 1, 128, 448, 448, 128, 1408]
    - [62, 6107.0]
  - - [6784, 128, 1, 256, 6784, 6784, 256, 128]
    - [54, 8060.0]
  - - [704, 448, 1, 256, 704, 704, 256, 448]
    - [62, 5448.0]
  - - [704, 1408, 1, 128, 704, 704, 128, 1408]
    - [55, 7064.0]
  - - [2944, 448, 1, 128, 2944, 2944, 128, 448]
    - [71, 7758.0]
  - - [128, 2944, 1, 128, 128, 128, 128, 2944]
    - [56, 4458.0]
  - - [1024, 704, 1, 3328, 1024, 1024, 3328, 704]
    - [74, 8605.0]
  - - [128, 4288, 1, 256, 128, 128, 256, 4288]
    - [57, 6445.0]
  - - [704, 448, 1, 3328, 704, 704, 3328, 448]
    - [42, 8225.0]
  - - [1024, 1024, 1, 3328, 1024, 1024, 3328, 1024]
    - [53, 9269.0]
  - - [448, 2368, 1, 1280, 448, 448, 1280, 2368]
    - [41, 8874.0]
  - - [64, 6784, 1, 3328, 64, 64, 3328, 6784]
    - [73, 8334.0]
  - - [2944, 256, 1, 1280, 2944, 2944, 1280, 256]
    - [53, 8703.0]
  - - [256, 2368, 1, 128, 256, 256, 128, 2368]
    - [57, 5535.0]
  - - [1856, 704, 1, 256, 1856, 1856, 256, 704]
    - [62, 7826.0]
  - - [1408, 448, 1, 3328, 1408, 1408, 3328, 448]
    - [74, 9410.0]
  - - [2368, 256, 1, 256, 2368, 2368, 256, 256]
    - [62, 7028.0]
  - - [1856, 448, 1, 1280, 1856, 1856, 1280, 448]
    - [72, 8909.0]
  - - [128, 5888, 1, 128, 128, 128, 128, 5888]
    - [69, 6184.0]
  - - [1024, 1024, 1, 256, 1024, 1024, 256, 1024]
    - [48, 8249.0]
  - - [704, 1856, 1, 256, 704, 704, 256, 1856]
    - [72, 7915.0]
  - - [64, 6784, 1, 256, 64, 64, 256, 6784]
    - [42, 5937.0]
  - - [256, 2368, 1, 1280, 256, 256, 1280, 2368]
    - [41, 9320.0]
  - - [2944, 448, 1, 256, 2944, 2944, 256, 448]
    - [74, 7959.0]
  - - [1856, 448, 1, 128, 1856, 1856, 128, 448]
    - [68, 6474.0]
  - - [2368, 128, 1, 1280, 2368, 2368, 1280, 128]
    - [50, 7722.0]
  - - [2368, 256, 1, 128, 2368, 2368, 128, 256]
    - [82, 6129.0]
  - - [64, 5056, 1, 1280, 64, 64, 1280, 5056]
    - [73, 7862.0]
  - - [2368, 256, 1, 1280, 2368, 2368, 1280, 256]
    - [50, 9463.0]
  - - [2368, 448, 1, 1280, 2368, 2368, 1280, 448]
    - [74, 8990.0]
  - - [128, 3584, 1, 256, 128, 128, 256, 3584]
    - [77, 7205.0]
  - - [704, 448, 1, 1280, 704, 704, 1280, 448]
    - [73, 7956.0]
  - - [128, 5056, 1, 256, 128, 128, 256, 5056]
    - [50, 8276.0]
  - - [4288, 256, 1, 1280, 4288, 4288, 1280, 256]
    - [60, 9257.0]
  - - [4288, 128, 1, 3328, 4288, 4288, 3328, 128]
    - [65, 8909.0]
  - - [1408, 256, 1, 128, 1408, 1408, 128, 256]
    - [56, 4233.0]
  - - [256, 1408, 1, 1280, 256, 256, 1280, 1408]
    - [71, 6829.0]
  - - [128, 2368, 1, 256, 128, 128, 256, 2368]
    - [77, 5449.0]
  - - [6784, 64, 1, 3328, 6784, 6784, 3328, 64]
    - [53, 8152.0]
  - - [128, 2944, 1, 3328, 128, 128, 3328, 2944]
    - [48, 7557.0]
  - - [2944, 448, 1, 3328, 2944, 2944, 3328, 448]
    - [81, 9182.0]
  - - [256, 4288, 1, 256, 256, 256, 256, 4288]
    - [60, 7997.0]
  - - [5888, 128, 1, 256, 5888, 5888, 256, 128]
    - [77, 7259.0]
  - - [2368, 448, 1, 3328, 2368, 2368, 3328, 448]
    - [60, 9320.0]
  - - [5056, 64, 1, 256, 5056, 5056, 256, 64]
    - [47, 5344.0]
  - - [1024, 704, 1, 128, 1024, 1024, 128, 704]
    - [47, 6462.0]
  - - [128, 5056, 1, 3328, 128, 128, 3328, 5056]
    - [41, 10635.0]
  - - [704, 1024, 1, 128, 704, 704, 128, 1024]
    - [69, 6277.0]
  - - [4288, 128, 1, 256, 4288, 4288, 256, 128]
    - [50, 6307.0]
  - - [1408, 448, 1, 128, 1408, 1408, 128, 448]
    - [71, 6034.0]
  - - [128, 5888, 1, 1280, 128, 128, 1280, 5888]
    - [57, 9009.0]
  - - [704, 448, 1, 128, 704, 704, 128, 448]
    - [70, 4295.0]
  - - [3584, 256, 1, 256, 3584, 3584, 256, 256]
    - [54, 8265.0]
  - - [128, 2944, 1, 256, 128, 128, 256, 2944]
    - [40, 5494.0]
  - - [128, 6784, 1, 128, 128, 128, 128, 6784]
    - [61, 6515.0]
  - - [448, 1856, 1, 256, 448, 448, 256, 1856]
    - [65, 7485.0]
  - - [3584, 128, 1, 3328, 3584, 3584, 3328, 128]
    - [60, 8742.0]
  - - [1024, 448, 1, 1280, 1024, 1024, 1280, 448]
    - [74, 8327.0]
  - - [5888, 128, 1, 3328, 5888, 5888, 3328, 128]
    - [54, 6584.0]
  - - [1408, 704, 1, 1280, 1408, 1408, 1280, 704]
    - [67, 8593.0]
  - - [448, 2944, 1, 256, 448, 448, 256, 2944]
    - [62, 8012.0]
  - - [448, 2368, 1, 256, 448, 448, 256, 2368]
    - [58, 7711.0]
  - - [128, 2368, 1, 3328, 128, 128, 3328, 2368]
    - [54, 8821.0]
  - - [5056, 128, 1, 1280, 5056, 5056, 1280, 128]
    - [79, 9921.0]
  - - [5056, 64, 1, 3328, 5056, 5056, 3328, 64]
    - [51, 8582.0]
  - - [64, 5888, 1, 128, 64, 64, 128, 5888]
    - [52, 4491.0]
  - - [5056, 128, 1, 3328, 5056, 5056, 3328, 128]
    - [50, 10504.0]
  - - [448, 704, 1, 256, 448, 448, 256, 704]
    - [47, 5347.0]
  - - [2944, 128, 1, 3328, 2944, 2944, 3328, 128]
    - [67, 7285.0]
  - - [128, 5056, 1, 1280, 128, 128, 1280, 5056]
    - [41, 9822.0]
  - - [704, 704, 1, 128, 704, 704, 128, 704]
    - [38, 4948.0]
  - - [64, 6784, 1, 1280, 64, 64, 1280, 6784]
    - [73, 7827.0]
  - - [2368, 128, 1, 128, 2368, 2368, 128, 128]
    - [78, 4119.0]
  - - [5056, 128, 1, 128, 5056, 5056, 128, 128]
    - [62, 6109.0]
  - - [1024, 1024, 1, 1024, 1024, 1024, 1024, 1024]
    - [53, 8848.0]
  - - [448, 1024, 1, 3328, 448, 448, 3328, 1024]
    - [59, 8697.0]
  - - [256, 2368, 1, 3328, 256, 256, 3328, 2368]
    - [41, 9958.0]
  - - [256, 3584, 1, 128, 256, 256, 128, 3584]
    - [44, 7871.0]
  - - [4288, 256, 1, 128, 4288, 4288, 128, 256]
    - [55, 8516.0]
  - - [256, 1856, 1, 256, 256, 256, 256, 1856]
    - [71, 7462.0]
  - - [256, 2944, 1, 128, 256, 256, 128, 2944]
    - [55, 6950.0]
  - - [1408, 256, 1, 3328, 1408, 1408, 3328, 256]
    - [55, 7128.0]
  - - [2368, 448, 1, 256, 2368, 2368, 256, 448]
    - [64, 7777.0]
  - - [4288, 256, 1, 3328, 4288, 4288, 3328, 256]
    - [53, 9620.0]
  - - [1856, 704, 1, 128, 1856, 1856, 128, 704]
    - [69, 7845.0]
  - - [4288, 128, 1, 128, 4288, 4288, 128, 128]
    - [76, 6141.0]
  - - [1408, 448, 1, 256, 1408, 1408, 256, 448]
    - [74, 8164.0]
  - - [6784, 64, 1, 1280, 6784, 6784, 1280, 64]
    - [53, 7797.0]
  - - [3584, 128, 1, 128, 3584, 3584, 128, 128]
    - [46, 5036.0]
  - - [256, 2368, 1, 256, 256, 256, 256, 2368]
    - [41, 6891.0]
  - - [2944, 448, 1, 1280, 2944, 2944, 1280, 448]
    - [60, 9035.0]
  - - [448, 1856, 1, 1280, 448, 448, 1280, 1856]
    - [58, 9094.0]
  - - [1856, 256, 1, 128, 1856, 1856, 128, 256]
    - [55, 5288.0]
  - - [5056, 128, 1, 256, 5056, 5056, 256, 128]
    - [65, 7476.0]
  - - [448, 1024, 1, 256, 448, 448, 256, 1024]
    - [73, 7144.0]
  - - [64, 6784, 1, 128, 64, 64, 128, 6784]
    - [73, 5513.0]
  - - [5888, 64, 1, 1280, 5888, 5888, 1280, 64]
    - [66, 7031.0]
  - - [128, 3584, 1, 128, 128, 128, 128, 3584]
    - [71, 6425.0]
  - - [1408, 256, 1, 256, 1408, 1408, 256, 256]
    - [64, 6119.0]
  - - [128, 5888, 1, 3328, 128, 128, 3328, 5888]
    - [43, 9071.0]
  - - [1408, 256, 1, 1280, 1408, 1408, 1280, 256]
    - [55, 6789.0]
  - - [1024, 1024, 1, 128, 1024, 1024, 128, 1024]
    - [58, 7239.0]
  - - [64, 5056, 1, 128, 64, 64, 128, 5056]
    - [45, 5436.0]
  - - [5888, 64, 1, 128, 5888, 5888, 128, 64]
    - [63, 5395.0]
  - - [448, 704, 1, 128, 448, 448, 128, 704]
    - [56, 5515.0]
  - - [1408, 704, 1, 128, 1408, 1408, 128, 704]
    - [71, 7018.0]
  - - [2368, 256, 1, 3328, 2368, 2368, 3328, 256]
    - [65, 9775.0]
  - - [5888, 128, 1, 1280, 5888, 5888, 1280, 128]
    - [53, 8569.0]
  - - [256, 3584, 1, 1280, 256, 256, 1280, 3584]
    - [41, 10098.0]
  - - [256, 1408, 1, 128, 256, 256, 128, 1408]
    - [75, 4479.0]
  - - [256, 4288, 1, 128, 256, 256, 128, 4288]
    - [69, 7235.0]
  - - [5888, 128, 1, 128, 5888, 5888, 128, 128]
    - [38, 6297.0]
  - - [1856, 256, 1, 3328, 1856, 1856, 3328, 256]
    - [74, 9160.0]
  - - [64, 5888, 1, 1280, 64, 64, 1280, 5888]
    - [66, 7144.0]
  - - [6784, 64, 1, 128, 6784, 6784, 128, 64]
    - [47, 5417.0]
  - - [704, 704, 1, 1280, 704, 704, 1280, 704]
    - [50, 7649.0]
  - - [128, 2368, 1, 1280, 128, 128, 1280, 2368]
    - [53, 7816.0]
  - - [3584, 256, 1, 1280, 3584, 3584, 1280, 256]
    - [54, 9939.0]
  - - [3584, 128, 1, 1280, 3584, 3584, 1280, 128]
    - [81, 8527.0]
  - - [448, 1856, 1, 3328, 448, 448, 3328, 1856]
    - [72, 9416.0]
  - - [1024, 448, 1, 256, 1024, 1024, 256, 448]
    - [48, 6510.0]
  - - [2944, 128, 1, 1280, 2944, 2944, 1280, 128]
    - [74, 6924.0]
  - - [128, 2368, 1, 128, 128, 128, 128, 2368]
    - [39, 4067.0]
  - - [256, 2944, 1, 1280, 256, 256, 1280, 2944]
    - [55, 8914.0]
  - - [704, 1024, 1, 3328, 704, 704, 3328, 1024]
    - [64, 8926.0]
  - - [128, 6784, 1, 256, 128, 128, 256, 6784]
    - [54, 8048.0]
  - - [256, 1856, 1, 3328, 256, 256, 3328, 1856]
    - [43, 9126.0]
  - - [6784, 128, 1, 128, 6784, 6784, 128, 128]
    - [69, 6753.0]
  - - [704, 1408, 1, 256, 704, 704, 256, 1408]
    - [77, 7905.0]
  - - [256, 1408, 1, 256, 256, 256, 256, 1408]
    - [39, 5870.0]
  - - [448, 2944, 1, 1280, 448, 448, 1280, 2944]
    - [72, 8967.0]
  - - [6784, 128, 1, 1280, 6784, 6784, 1280, 128]
    - [54, 9413.0]
  - - [1856, 448, 1, 256, 1856, 1856, 256, 448]
    - [58, 7275.0]
  - - [128, 4288, 1, 1280, 128, 128, 1280, 4288]
    - [72, 8536.0]
  - - [448, 704, 1, 3328, 448, 448, 3328, 704]
    - [42, 8214.0]
  - - [1856, 704, 1, 3328, 1856, 1856, 3328, 704]
    - [74, 9052.0]
  - - [960, 1024, 1, 1024, 960, 960, 1024, 1024]
    - [51, 8369.0]
  - - [768, 768, 1, 768, 768, 768, 768, 768]
    - [41, 8701.0]
  - - [1024, 128, 1, 128, 1024, 1024, 128, 128]
    - [106, 2769.0]
  - - [2368, 64, 1, 3328, 2368, 2368, 3328, 64]
    - [97, 4505.0]
  - - [1408, 64, 1, 128, 1408, 1408, 128, 64]
    - [105, 1786.0]
  - - [1408, 64, 1, 1280, 1408, 1408, 1280, 64]
    - [93, 2954.0]
  - - [2944, 64, 1, 256, 2944, 2944, 256, 64]
    - [133, 2959.0]
  - - [1024, 256, 1, 3328, 1024, 1024, 3328, 256]
    - [115, 3986.0]
  - - [1856, 64, 1, 1280, 1856, 1856, 1280, 64]
    - [95, 3561.0]
  - - [704, 128, 1, 1280, 704, 704, 1280, 128]
    - [119, 2997.0]
  - - [4288, 64, 1, 3328, 4288, 4288, 3328, 64]
    - [115, 4129.0]
  - - [4288, 64, 1, 256, 4288, 4288, 256, 64]
    - [115, 3346.0]
  - - [64, 3584, 1, 3328, 64, 64, 3328, 3584]
    - [106, 4541.0]
  - - [704, 256, 1, 128, 704, 704, 128, 256]
    - [129, 2408.0]
  - - [128, 1408, 1, 128, 128, 128, 128, 1408]
    - [122, 2364.0]
  - - [4288, 64, 1, 1280, 4288, 4288, 1280, 64]
    - [115, 4002.0]
  - - [1024, 256, 1, 256, 1024, 1024, 256, 256]
    - [87, 3286.0]
  - - [448, 448, 1, 256, 448, 448, 256, 448]
    - [115, 3172.0]
  - - [128, 1024, 1, 3328, 128, 128, 3328, 1024]
    - [122, 3794.0]
  - - [64, 1856, 1, 1280, 64, 64, 1280, 1856]
    - [86, 3596.0]
  - - [256, 1024, 1, 256, 256, 256, 256, 1024]
    - [122, 3306.0]
  - - [1024, 128, 1, 1280, 1024, 1024, 1280, 128]
    - [97, 3596.0]
  - - [448, 256, 1, 3328, 448, 448, 3328, 256]
    - [120, 3766.0]
  - - [128, 1024, 1, 128, 128, 128, 128, 1024]
    - [122, 2046.0]
  - - [128, 704, 1, 1280, 128, 128, 1280, 704]
    - [119, 2993.0]
  - - [1856, 128, 1, 3328, 1856, 1856, 3328, 128]
    - [133, 4689.0]
  - - [64, 2944, 1, 128, 64, 64, 128, 2944]
    - [89, 2599.0]
  - - [448, 448, 1, 3328, 448, 448, 3328, 448]
    - [106, 4021.0]
  - - [1408, 128, 1, 1280, 1408, 1408, 1280, 128]
    - [119, 3479.0]
  - - [128, 1856, 1, 1280, 128, 128, 1280, 1856]
    - [122, 4467.0]
  - - [256, 448, 1, 256, 256, 256, 256, 448]
    - [114, 2497.0]
  - - [128, 1856, 1, 128, 128, 128, 128, 1856]
    - [122, 2964.0]
  - - [64, 1408, 1, 3328, 64, 64, 3328, 1408]
    - [85, 3171.0]
  - - [128, 1408, 1, 256, 128, 128, 256, 1408]
    - [122, 2859.0]
  - - [4288, 64, 1, 128, 4288, 4288, 128, 64]
    - [133, 3584.0]
  - - [256, 448, 1, 3328, 256, 256, 3328, 448]
    - [104, 3758.0]
  - - [64, 2368, 1, 1280, 64, 64, 1280, 2368]
    - [87, 4142.0]
  - - [2368, 64, 1, 256, 2368, 2368, 256, 64]
    - [133, 3154.0]
  - - [1408, 128, 1, 128, 1408, 1408, 128, 128]
    - [107, 2428.0]
  - - [1024, 256, 1, 128, 1024, 1024, 128, 256]
    - [133, 2764.0]
  - - [2944, 64, 1, 128, 2944, 2944, 128, 64]
    - [97, 2355.0]
  - - [1856, 64, 1, 256, 1856, 1856, 256, 64]
    - [95, 2603.0]
  - - [704, 128, 1, 256, 704, 704, 256, 128]
    - [112, 2038.0]
  - - [448, 256, 1, 1280, 448, 448, 1280, 256]
    - [120, 3502.0]
  - - [1856, 128, 1, 1280, 1856, 1856, 1280, 128]
    - [133, 4501.0]
  - - [64, 3584, 1, 256, 64, 64, 256, 3584]
    - [87, 3529.0]
  - - [3584, 64, 1, 128, 3584, 3584, 128, 64]
    - [97, 2807.0]
  - - [256, 1024, 1, 1280, 256, 256, 1280, 1024]
    - [106, 3971.0]
  - - [3584, 64, 1, 1280, 3584, 3584, 1280, 64]
    - [97, 4316.0]
  - - [128, 1856, 1, 3328, 128, 128, 3328, 1856]
    - [87, 4641.0]
  - - [64, 2944, 1, 3328, 64, 64, 3328, 2944]
    - [120, 3710.0]
  - - [64, 4288, 1, 3328, 64, 64, 3328, 4288]
    - [97, 4124.0]
  - - [64, 1856, 1, 256, 64, 64, 256, 1856]
    - [131, 2644.0]
  - - [256, 704, 1, 256, 256, 256, 256, 704]
    - [115, 2891.0]
  - - [2368, 64, 1, 128, 2368, 2368, 128, 64]
    - [115, 2389.0]
  - - [64, 1408, 1, 128, 64, 64, 128, 1408]
    - [85, 1522.0]
  - - [704, 256, 1, 3328, 704, 704, 3328, 256]
    - [103, 3632.0]
  - - [64, 2944, 1, 256, 64, 64, 256, 2944]
    - [122, 2963.0]
  - - [448, 256, 1, 128, 448, 448, 128, 256]
    - [85, 1892.0]
  - - [704, 128, 1, 3328, 704, 704, 3328, 128]
    - [103, 3250.0]
  - - [128, 704, 1, 128, 128, 128, 128, 704]
    - [112, 1530.0]
  - - [256, 448, 1, 1280, 256, 256, 1280, 448]
    - [104, 3525.0]
  - - [704, 256, 1, 1280, 704, 704, 1280, 256]
    - [103, 3540.0]
  - - [64, 2368, 1, 3328, 64, 64, 3328, 2368]
    - [122, 4476.0]
  - - [1856, 64, 1, 128, 1856, 1856, 128, 64]
    - [95, 2715.0]
  - - [704, 128, 1, 128, 704, 704, 128, 128]
    - [112, 2160.0]
  - - [256, 704, 1, 3328, 256, 256, 3328, 704]
    - [103, 3634.0]
  - - [256, 448, 1, 128, 256, 256, 128, 448]
    - [95, 1849.0]
  - - [64, 3584, 1, 128, 64, 64, 128, 3584]
    - [106, 2856.0]
  - - [1024, 128, 1, 256, 1024, 1024, 256, 128]
    - [95, 2923.0]
  - - [2944, 64, 1, 1280, 2944, 2944, 1280, 64]
    - [106, 3620.0]
  - - [128, 1408, 1, 3328, 128, 128, 3328, 1408]
    - [85, 3580.0]
  - - [1408, 64, 1, 256, 1408, 1408, 256, 64]
    - [95, 2067.0]
  - - [64, 1856, 1, 128, 64, 64, 128, 1856]
    - [92, 1954.0]
  - - [64, 2368, 1, 256, 64, 64, 256, 2368]
    - [122, 3060.0]
  - - [1024, 128, 1, 3328, 1024, 1024, 3328, 128]
    - [122, 3886.0]
  - - [1856, 128, 1, 128, 1856, 1856, 128, 128]
    - [97, 2993.0]
  - - [2368, 64, 1, 1280, 2368, 2368, 1280, 64]
    - [97, 4143.0]
  - - [128, 1024, 1, 1280, 128, 128, 1280, 1024]
    - [115, 3743.0]
  - - [64, 4288, 1, 1280, 64, 64, 1280, 4288]
    - [106, 3989.0]
  - - [1408, 64, 1, 3328, 1408, 1408, 3328, 64]
    - [112, 3234.0]
  - - [64, 2944, 1, 1280, 64, 64, 1280, 2944]
    - [122, 3577.0]
  - - [256, 704, 1, 128, 256, 256, 128, 704]
    - [86, 3012.0]
  - - [256, 1024, 1, 128, 256, 256, 128, 1024]
    - [97, 3495.0]
  - - [64, 1408, 1, 1280, 64, 64, 1280, 1408]
    - [112, 3119.0]
  - - [448, 448, 1, 1280, 448, 448, 1280, 448]
    - [133, 3997.0]
  - - [1024, 256, 1, 1280, 1024, 1024, 1280, 256]
    - [122, 3886.0]
  - - [128, 1024, 1, 256, 128, 128, 256, 1024]
    - [133, 3349.0]
  - - [3584, 64, 1, 3328, 3584, 3584, 3328, 64]
    - [97, 4593.0]
  - - [1408, 128, 1, 256, 1408, 1408, 256, 128]
    - [115, 3334.0]
  - - [256, 1024, 1, 3328, 256, 256, 3328, 1024]
    - [97, 3992.0]
  - - [1856, 64, 1, 3328, 1856, 1856, 3328, 64]
    - [114, 3905.0]
  - - [448, 256, 1, 256, 448, 448, 256, 256]
    - [114, 3137.0]
  - - [128, 704, 1, 256, 128, 128, 256, 704]
    - [93, 2639.0]
  - - [64, 3584, 1, 1280, 64, 64, 1280, 3584]
    - [122, 4457.0]
  - - [3584, 64, 1, 256, 3584, 3584, 256, 64]
    - [97, 4005.0]
  - - [64, 1856, 1, 3328, 64, 64, 3328, 1856]
    - [86, 3841.0]
  - - [1408, 128, 1, 3328, 1408, 1408, 3328, 128]
    - [103, 3644.0]
  - - [128, 704, 1, 3328, 128, 128, 3328, 704]
    - [112, 3267.0]
  - - [128, 1856, 1, 256, 128, 128, 256, 1856]
    - [133, 3668.0]
  - - [64, 4288, 1, 256, 64, 64, 256, 4288]
    - [133, 3404.0]
  - - [256, 704, 1, 1280, 256, 256, 1280, 704]
    - [119, 3538.0]
  - - [64, 2368, 1, 128, 64, 64, 128, 2368]
    - [97, 2443.0]
  - - [64, 4288, 1, 128, 64, 64, 128, 4288]
    - [97, 2962.0]
  - - [1856, 128, 1, 256, 1856, 1856, 256, 128]
    - [115, 3722.0]
  - - [64, 1408, 1, 256, 64, 64, 256, 1408]
    - [93, 2105.0]
  - - [2944, 64, 1, 3328, 2944, 2944, 3328, 64]
    - [133, 3755.0]
  - - [128, 1408, 1, 1280, 128, 128, 1280, 1408]
    - [97, 3503.0]
  - - [448, 448, 1, 128, 448, 448, 128, 448]
    - [115, 2590.0]
  - - [704, 256, 1, 256, 704, 704, 256, 256]
    - [93, 2855.0]
  - - [512, 512, 1, 512, 512, 512, 512, 512]
    - [97, 3673.0]
  - - [384, 384, 1, 384, 384, 384, 384, 384]
    - [122, 3513.0]
  - - [3584, 4, 1, 1280, 3584, 3584, 1280, 4]
    - [147, 640.0]
  - - [2944, 4, 1, 256, 2944, 2944, 256, 4]
    - [139, 437.0]
  - - [2368, 4, 1, 1280, 2368, 2368, 1280, 4]
    - [139, 534.0]
  - - [6784, 4, 1, 1280, 6784, 6784, 1280, 4]
    - [147, 624.0]
  - - [1856, 4, 1, 1280, 1856, 1856, 1280, 4]
    - [147, 403.0]
  - - [2944, 4, 1, 128, 2944, 2944, 128, 4]
    - [142, 239.0]
  - - [3584, 4, 1, 128, 3584, 3584, 128, 4]
    - [147, 276.0]
  - - [4288, 4, 1, 256, 4288, 4288, 256, 4]
    - [147, 394.0]
  - - [3584, 4, 1, 3328, 3584, 3584, 3328, 4]
    - [142, 656.0]
  - - [5888, 4, 1, 128, 5888, 5888, 128, 4]
    - [139, 369.0]
  - - [2368, 4, 1, 256, 2368, 2368, 256, 4]
    - [139, 299.0]
  - - [1408, 4, 1, 256, 1408, 1408, 256, 4]
    - [139, 188.0]
  - - [5056, 4, 1, 1280, 5056, 5056, 1280, 4]
    - [143, 621.0]
  - - [1408, 4, 1, 3328, 1408, 1408, 3328, 4]
    - [113, 310.0]
  - - [6784, 4, 1, 128, 6784, 6784, 128, 4]
    - [142, 405.0]
  - - [5888, 4, 1, 3328, 5888, 5888, 3328, 4]
    - [145, 400.0]
  - - [5056, 4, 1, 128, 5056, 5056, 128, 4]
    - [142, 343.0]
  - - [5888, 4, 1, 1280, 5888, 5888, 1280, 4]
    - [139, 592.0]
  - - [2944, 4, 1, 3328, 2944, 2944, 3328, 4]
    - [139, 570.0]
  - - [2368, 4, 1, 128, 2368, 2368, 128, 4]
    - [139, 192.0]
  - - [1856, 4, 1, 128, 1856, 1856, 128, 4]
    - [139, 157.0]
  - - [1408, 4, 1, 1280, 1408, 1408, 1280, 4]
    - [139, 324.0]
  - - [6784, 4, 1, 256, 6784, 6784, 256, 4]
    - [140, 452.0]
  - - [4288, 4, 1, 128, 4288, 4288, 128, 4]
    - [146, 376.0]
  - - [1856, 4, 1, 3328, 1856, 1856, 3328, 4]
    - [130, 417.0]
  - - [3584, 4, 1, 256, 3584, 3584, 256, 4]
    - [144, 436.0]
  - - [2368, 4, 1, 3328, 2368, 2368, 3328, 4]
    - [139, 518.0]
  - - [6784, 4, 1, 3328, 6784, 6784, 3328, 4]
    - [141, 551.0]
  - - [4288, 4, 1, 1280, 4288, 4288, 1280, 4]
    - [147, 615.0]
  - - [1856, 4, 1, 256, 1856, 1856, 256, 4]
    - [147, 335.0]
  - - [1408, 4, 1, 128, 1408, 1408, 128, 4]
    - [108, 167.0]
  - - [5056, 4, 1, 256, 5056, 5056, 256, 4]
    - [148, 481.0]
  - - [4288, 4, 1, 3328, 4288, 4288, 3328, 4]
    - [142, 637.0]
  - - [2944, 4, 1, 1280, 2944, 2944, 1280, 4]
    - [142, 552.0]
  - - [5888, 4, 1, 256, 5888, 5888, 256, 4]
    - [140, 502.0]
  - - [5056, 4, 1, 3328, 5056, 5056, 3328, 4]
    - [143, 711.0]
  - - [4, 1856, 1, 3328, 4, 4, 3328, 1856]
    - [155, 706.0]
  - - [4, 2944, 1, 1280, 4, 4, 1280, 2944]
    - [155, 766.0]
  - - [4, 1408, 1, 128, 4, 4, 128, 1408]
    - [111, 215.0]
  - - [4, 2368, 1, 1280, 4, 4, 1280, 2368]
    - [155, 748.0]
  - - [4, 3584, 1, 128, 4, 4, 128, 3584]
    - [150, 485.0]
  - - [4, 5888, 1, 3328, 4, 4, 3328, 5888]
    - [153, 535.0]
  - - [4, 1408, 1, 3328, 4, 4, 3328, 1408]
    - [158, 545.0]
  - - [4, 6784, 1, 3328, 4, 4, 3328, 6784]
    - [152, 910.0]
  - - [4, 4288, 1, 128, 4, 4, 128, 4288]
    - [156, 543.0]
  - - [4, 5056, 1, 3328, 4, 4, 3328, 5056]
    - [153, 971.0]
  - - [4, 6784, 1, 1280, 4, 4, 1280, 6784]
    - [154, 875.0]
  - - [4, 2944, 1, 3328, 4, 4, 3328, 2944]
    - [155, 825.0]
  - - [4, 5056, 1, 256, 4, 4, 256, 5056]
    - [160, 591.0]
  - - [4, 5056, 1, 1280, 4, 4, 1280, 5056]
    - [149, 893.0]
  - - [4, 2368, 1, 3328, 4, 4, 3328, 2368]
    - [155, 784.0]
  - - [4, 1856, 1, 256, 4, 4, 256, 1856]
    - [123, 249.0]
  - - [4, 2368, 1, 256, 4, 4, 256, 2368]
    - [150, 305.0]
  - - [4, 2944, 1, 256, 4, 4, 256, 2944]
    - [163, 376.0]
  - - [4, 4288, 1, 1280, 4, 4, 1280, 4288]
    - [157, 798.0]
  - - [4, 6784, 1, 128, 4, 4, 128, 6784]
    - [156, 461.0]
  - - [4, 3584, 1, 1280, 4, 4, 1280, 3584]
    - [150, 786.0]
  - - [4, 5888, 1, 256, 4, 4, 256, 5888]
    - [149, 616.0]
  - - [4, 6784, 1, 256, 4, 4, 256, 6784]
    - [162, 774.0]
  - - [4, 1408, 1, 1280, 4, 4, 1280, 1408]
    - [151, 423.0]
  - - [4, 3584, 1, 256, 4, 4, 256, 3584]
    - [150, 455.0]
  - - [4, 1408, 1, 256, 4, 4, 256, 1408]
    - [116, 195.0]
  - - [4, 4288, 1, 3328, 4, 4, 3328, 4288]
    - [161, 873.0]
  - - [4, 5888, 1, 1280, 4, 4, 1280, 5888]
    - [156, 890.0]
  - - [4, 1856, 1, 1280, 4, 4, 1280, 1856]
    - [151, 555.0]
  - - [4, 1856, 1, 128, 4, 4, 128, 1856]
    - [164, 219.0]
  - - [4, 2944, 1, 128, 4, 4, 128, 2944]
    - [159, 260.0]
  - - [4, 5056, 1, 128, 4, 4, 128, 5056]
    - [158, 533.0]
  - - [4, 4288, 1, 256, 4, 4, 256, 4288]
    - [160, 699.0]
  - - [4, 3584, 1, 3328, 4, 4, 3328, 3584]
    - [154, 916.0]
  - - [4, 5888, 1, 128, 4, 4, 128, 5888]
    - [153, 691.0]
  - - [4, 2368, 1, 128, 4, 4, 128, 2368]
    - [163, 317.0]
  - - [4, 704, 1, 1280, 4, 4, 1280, 704]
    - [88, 217.0]
  - - [128, 64, 1, 256, 128, 128, 256, 64]
    - [130, 502.0]
  - - [64, 4, 1, 256, 64, 64, 256, 4]
    - [98, 14.0]
  - - [64, 704, 1, 128, 64, 64, 128, 704]
    - [84, 952.0]
  - - [448, 64, 1, 1280, 448, 448, 1280, 64]
    - [92, 1638.0]
  - - [128, 4, 1, 1280, 128, 128, 1280, 4]
    - [91, 39.0]
  - - [64, 1024, 1, 1280, 64, 64, 1280, 1024]
    - [129, 2727.0]
  - - [64, 704, 1, 1280, 64, 64, 1280, 704]
    - [118, 1991.0]
  - - [1024, 64, 1, 128, 1024, 1024, 128, 64]
    - [114, 1216.0]
  - - [64, 1024, 1, 3328, 64, 64, 3328, 1024]
    - [126, 3117.0]
  - - [1024, 64, 1, 1280, 1024, 1024, 1280, 64]
    - [93, 2792.0]
  - - [4, 704, 1, 256, 4, 4, 256, 704]
    - [134, 101.0]
  - - [704, 4, 1, 1280, 704, 704, 1280, 4]
    - [98, 204.0]
  - - [64, 448, 1, 256, 64, 64, 256, 448]
    - [128, 1046.0]
  - - [64, 1024, 1, 128, 64, 64, 128, 1024]
    - [97, 1192.0]
  - - [4, 64, 1, 1280, 4, 4, 1280, 64]
    - [91, 20.0]
  - - [128, 256, 1, 3328, 128, 128, 3328, 256]
    - [121, 1864.0]
  - - [64, 448, 1, 1280, 64, 64, 1280, 448]
    - [134, 1625.0]
  - - [448, 4, 1, 256, 448, 448, 256, 4]
    - [111, 65.0]
  - - [448, 4, 1, 1280, 448, 448, 1280, 4]
    - [134, 137.0]
  - - [128, 4, 1, 128, 128, 128, 128, 4]
    - [84, 11.0]
  - - [256, 4, 1, 128, 256, 256, 128, 4]
    - [96, 23.0]
  - - [704, 64, 1, 3328, 704, 704, 3328, 64]
    - [93, 2162.0]
  - - [64, 128, 1, 256, 64, 64, 256, 128]
    - [116, 312.0]
  - - [704, 64, 1, 128, 704, 704, 128, 64]
    - [134, 901.0]
  - - [1024, 4, 1, 256, 1024, 1024, 256, 4]
    - [134, 148.0]
  - - [256, 256, 1, 128, 256, 256, 128, 256]
    - [95, 1198.0]
  - - [64, 256, 1, 128, 64, 64, 128, 256]
    - [100, 624.0]
  - - [704, 64, 1, 1280, 704, 704, 1280, 64]
    - [118, 1954.0]
  - - [128, 448, 1, 256, 128, 128, 256, 448]
    - [129, 1572.0]
  - - [128, 256, 1, 1280, 128, 128, 1280, 256]
    - [132, 1704.0]
  - - [448, 64, 1, 3328, 448, 448, 3328, 64]
    - [123, 1804.0]
  - - [256, 128, 1, 128, 256, 256, 128, 128]
    - [103, 900.0]
  - - [64, 128, 1, 3328, 64, 64, 3328, 128]
    - [101, 729.0]
  - - [128, 128, 1, 3328, 128, 128, 3328, 128]
    - [90, 1301.0]
  - - [256, 128, 1, 256, 256, 256, 256, 128]
    - [111, 1081.0]
  - - [64, 448, 1, 3328, 64, 64, 3328, 448]
    - [88, 1803.0]
  - - [256, 256, 1, 3328, 256, 256, 3328, 256]
    - [85, 3121.0]
  - - [1024, 4, 1, 3328, 1024, 1024, 3328, 4]
    - [116, 310.0]
  - - [4, 4, 1, 256, 4, 4, 256, 4]
    - [84, 1.0]
  - - [256, 64, 1, 256, 256, 256, 256, 64]
    - [117, 587.0]
  - - [256, 128, 1, 1280, 256, 256, 1280, 128]
    - [92, 1729.0]
  - - [128, 64, 1, 1280, 128, 128, 1280, 64]
    - [101, 611.0]
  - - [4, 448, 1, 3328, 4, 4, 3328, 448]
    - [91, 164.0]
  - - [64, 1024, 1, 256, 64, 64, 256, 1024]
    - [129, 1708.0]
  - - [256, 4, 1, 1280, 256, 256, 1280, 4]
    - [110, 78.0]
  - - [64, 704, 1, 256, 64, 64, 256, 704]
    - [118, 1293.0]
  - - [4, 704, 1, 128, 4, 4, 128, 704]
    - [92, 62.0]
  - - [448, 128, 1, 256, 448, 448, 256, 128]
    - [99, 1803.0]
  - - [448, 64, 1, 128, 448, 448, 128, 64]
    - [128, 642.0]
  - - [4, 448, 1, 1280, 4, 4, 1280, 448]
    - [101, 129.0]
  - - [256, 256, 1, 256, 256, 256, 256, 256]
    - [133, 1820.0]
  - - [256, 64, 1, 128, 256, 256, 128, 64]
    - [84, 576.0]
  - - [4, 1024, 1, 3328, 4, 4, 3328, 1024]
    - [123, 309.0]
  - - [704, 4, 1, 128, 704, 704, 128, 4]
    - [92, 62.0]
  - - [256, 4, 1, 256, 256, 256, 256, 4]
    - [111, 37.0]
  - - [256, 4, 1, 3328, 256, 256, 3328, 4]
    - [91, 97.0]
  - - [4, 256, 1, 256, 4, 4, 256, 256]
    - [85, 37.0]
  - - [4, 4, 1, 128, 4, 4, 128, 4]
    - [88, 1.0]
  - - [4, 128, 1, 256, 4, 4, 256, 128]
    - [88, 18.0]
  - - [64, 64, 1, 1280, 64, 64, 1280, 64]
    - [127, 318.0]
  - - [448, 128, 1, 3328, 448, 448, 3328, 128]
    - [119, 2906.0]
  - - [4, 448, 1, 128, 4, 4, 128, 448]
    - [94, 41.0]
  - - [64, 256, 1, 1280, 64, 64, 1280, 256]
    - [136, 1125.0]
  - - [4, 128, 1, 3328, 4, 4, 3328, 128]
    - [91, 49.0]
  - - [64, 4, 1, 128, 64, 64, 128, 4]
    - [88, 6.0]
  - - [64, 64, 1, 256, 64, 64, 256, 64]
    - [128, 153.0]
  - - [4, 704, 1, 3328, 4, 4, 3328, 704]
    - [88, 216.0]
  - - [4, 4, 1, 1280, 4, 4, 1280, 4]
    - [84, 1.0]
  - - [128, 128, 1, 128, 128, 128, 128, 128]
    - [128, 387.0]
  - - [1024, 4, 1, 128, 1024, 1024, 128, 4]
    - [128, 91.0]
  - - [64, 64, 1, 3328, 64, 64, 3328, 64]
    - [91, 393.0]
  - - [4, 64, 1, 128, 4, 4, 128, 64]
    - [92, 6.0]
  - - [64, 128, 1, 1280, 64, 64, 1280, 128]
    - [127, 610.0]
  - - [128, 128, 1, 1280, 128, 128, 1280, 128]
    - [125, 1120.0]
  - - [128, 256, 1, 256, 128, 128, 256, 256]
    - [111, 1056.0]
  - - [256, 64, 1, 1280, 256, 256, 1280, 64]
    - [109, 1114.0]
  - - [1024, 4, 1, 1280, 1024, 1024, 1280, 4]
    - [116, 270.0]
  - - [704, 64, 1, 256, 704, 704, 256, 64]
    - [128, 1290.0]
  - - [128, 448, 1, 1280, 128, 128, 1280, 448]
    - [129, 2457.0]
  - - [128, 64, 1, 3328, 128, 128, 3328, 64]
    - [110, 752.0]
  - - [448, 64, 1, 256, 448, 448, 256, 64]
    - [84, 1192.0]
  - - [4, 256, 1, 128, 4, 4, 128, 256]
    - [84, 35.0]
  - - [1024, 64, 1, 256, 1024, 1024, 256, 64]
    - [135, 1856.0]
  - - [64, 128, 1, 128, 64, 64, 128, 128]
    - [111, 196.0]
  - - [4, 4, 1, 3328, 4, 4, 3328, 4]
    - [91, 2.0]
  - - [4, 1024, 1, 1280, 4, 4, 1280, 1024]
    - [88, 268.0]
  - - [704, 4, 1, 256, 704, 704, 256, 4]
    - [128, 104.0]
  - - [128, 4, 1, 3328, 128, 128, 3328, 4]
    - [91, 49.0]
  - - [448, 4, 1, 3328, 448, 448, 3328, 4]
    - [110, 163.0]
  - - [704, 4, 1, 3328, 704, 704, 3328, 4]
    - [116, 230.0]
  - - [448, 128, 1, 1280, 448, 448, 1280, 128]
    - [103, 2594.0]
  - - [1024, 64, 1, 3328, 1024, 1024, 3328, 64]
    - [129, 3012.0]
  - - [4, 1024, 1, 128, 4, 4, 128, 1024]
    - [116, 89.0]
  - - [64, 256, 1, 3328, 64, 64, 3328, 256]
    - [90, 1299.0]
  - - [448, 128, 1, 128, 448, 448, 128, 128]
    - [124, 1385.0]
  - - [128, 256, 1, 128, 128, 128, 128, 256]
    - [132, 721.0]
  - - [128, 4, 1, 256, 128, 128, 256, 4]
    - [90, 18.0]
  - - [256, 256, 1, 1280, 256, 256, 1280, 256]
    - [85, 2789.0]
  - - [256, 128, 1, 3328, 256, 256, 3328, 128]
    - [121, 1831.0]
  - - [448, 4, 1, 128, 448, 448, 128, 4]
    - [92, 40.0]
  - - [4, 256, 1, 3328, 4, 4, 3328, 256]
    - [110, 98.0]
  - - [4, 128, 1, 128, 4, 4, 128, 128]
    - [91, 15.0]
  - - [4, 256, 1, 1280, 4, 4, 1280, 256]
    - [101, 79.0]
  - - [64, 4, 1, 3328, 64, 64, 3328, 4]
    - [137, 26.0]
  - - [4, 64, 1, 3328, 4, 4, 3328, 64]
    - [91, 24.0]
  - - [4, 1024, 1, 256, 4, 4, 256, 1024]
    - [127, 184.0]
  - - [64, 256, 1, 256, 64, 64, 256, 256]
    - [88, 870.0]
  - - [4, 64, 1, 256, 4, 4, 256, 64]
    - [137, 12.0]
  - - [128, 448, 1, 128, 128, 128, 128, 448]
    - [85, 1498.0]
  - - [64, 448, 1, 128, 64, 64, 128, 448]
    - [138, 725.0]
  - - [64, 704, 1, 3328, 64, 64, 3328, 704]
    - [118, 2200.0]
  - - [128, 448, 1, 3328, 128, 128, 3328, 448]
    - [119, 2719.0]
  - - [4, 448, 1, 256, 4, 4, 256, 448]
    - [91, 87.0]
  - - [4, 128, 1, 1280, 4, 4, 1280, 128]
    - [91, 39.0]
  - - [128, 64, 1, 128, 128, 128, 128, 64]
    - [102, 252.0]
  - - [64, 64, 1, 128, 64, 64, 128, 64]
    - [123, 161.0]
  - - [64, 4, 1, 1280, 64, 64, 1280, 4]
    - [101, 20.0]
  - - [256, 64, 1, 3328, 256, 256, 3328, 64]
    - [90, 1294.0]
  - - [128, 128, 1, 256, 128, 128, 256, 128]
    - [92, 597.0]
- null
- null
- DeviceEfficiency
...
