library/src/blas3/Tensile/Logic/asm_full/navi22_Cijk_Ailk_Bljk_SB.yaml
---
- {MinimumRequiredVersion: 4.28.0}
- navi22
- gfx1031
    SolutionIndex: 0
    SolutionNameMin: Cijk_Ailk_Bljk_SB_MT128x64x8_SN_SU0_SUM0_TT8_8_WG16_8_1_WGM1
    SolutionIndex: 1
    SolutionNameMin: Cijk_Ailk_Bljk_SB_MT128x128x8_SN_SU0_SUM0_TT8_16_WG16_8_1_WGM1
    SolutionIndex: 2
    SolutionNameMin: Cijk_Ailk_Bljk_SB_MT128x128x8_SN_SU0_SUM0_TT8_8_WG16_16_1_WGM1
    SolutionIndex: 3
    SolutionNameMin: Cijk_Ailk_Bljk_SB_MT128x64x16_SN_SU0_SUM0_TT8_8_WG16_8_1_WGM1
    SolutionIndex: 4
    SolutionNameMin: Cijk_Ailk_Bljk_SB_MT128x128x16_SN_SU0_SUM0_TT8_16_WG16_8_1_WGM1
    SolutionIndex: 5
    SolutionNameMin: Cijk_Ailk_Bljk_SB_MT128x128x16_SN_SU0_SUM0_TT8_8_WG16_16_1_WGM1
    SolutionIndex: 6
    SolutionNameMin: Cijk_Ailk_Bljk_SB_MT128x256x16_SN_SU0_SUM0_TT8_16_WG16_16_1_WGM1
    SolutionIndex: 7
    SolutionNameMin: Cijk_Ailk_Bljk_SB_MT128x64x8_SN_SU32_SUM3_TT8_8_WG16_8_1_WGM1
    SolutionIndex: 8
    SolutionNameMin: Cijk_Ailk_Bljk_SB_MT128x128x8_SN_SU32_SUM3_TT8_16_WG16_8_1_WGM1
    SolutionIndex: 9
    SolutionNameMin: Cijk_Ailk_Bljk_SB_MT128x128x8_SN_SU32_SUM3_TT8_8_WG16_16_1_WGM1
    SolutionIndex: 10
    SolutionNameMin: Cijk_Ailk_Bljk_SB_MT128x64x16_SN_SU32_SUM3_TT8_8_WG16_8_1_WGM1
    SolutionIndex: 11
    SolutionNameMin: Cijk_Ailk_Bljk_SB_MT128x128x16_SN_SU32_SUM3_TT8_16_WG16_8_1_WGM1
    SolutionIndex: 12
    SolutionNameMin: Cijk_Ailk_Bljk_SB_MT128x256x16_SN_SU32_SUM3_TT8_16_WG16_16_1_WGM1
    SolutionIndex: 13
    SolutionNameMin: Cijk_Ailk_Bljk_SB_MT128x64x32_SN_SU32_SUM3_TT8_8_WG16_8_1_WGM1
    SolutionIndex: 14
    SolutionNameMin: Cijk_Ailk_Bljk_SB_MT128x128x32_SN_SU32_SUM3_TT8_8_WG16_16_1_WGM1
    SolutionIndex: 15
    SolutionNameMin: Cijk_Ailk_Bljk_SB_MT128x64x8_SN_SU0_SUM0_TT8_8_WG16_8_1_WGM4
    SolutionIndex: 16
    SolutionNameMin: Cijk_Ailk_Bljk_SB_MT128x128x8_SN_SU0_SUM0_TT8_16_WG16_8_1_WGM4
    SolutionIndex: 17
    SolutionNameMin: Cijk_Ailk_Bljk_SB_MT128x128x8_SN_SU0_SUM0_TT8_8_WG16_16_1_WGM4
    SolutionIndex: 18
    SolutionNameMin: Cijk_Ailk_Bljk_SB_MT128x64x16_SN_SU0_SUM0_TT8_8_WG16_8_1_WGM4
    SolutionIndex: 19
    SolutionNameMin: Cijk_Ailk_Bljk_SB_MT128x128x16_SN_SU0_SUM0_TT8_16_WG16_8_1_WGM4
    SolutionIndex: 20
    SolutionNameMin: Cijk_Ailk_Bljk_SB_MT128x256x16_SN_SU0_SUM0_TT8_16_WG16_16_1_WGM4
    SolutionIndex: 21
    SolutionNameMin: Cijk_Ailk_Bljk_SB_MT128x64x8_SN_SU32_SUM3_TT8_8_WG16_8_1_WGM4
    SolutionIndex: 22
    SolutionNameMin: Cijk_Ailk_Bljk_SB_MT128x128x8_SN_SU32_SUM3_TT8_16_WG16_8_1_WGM4
    SolutionIndex: 23
    SolutionNameMin: Cijk_Ailk_Bljk_SB_MT128x128x8_SN_SU32_SUM3_TT8_8_WG16_16_1_WGM4
    SolutionIndex: 24
    SolutionNameMin: Cijk_Ailk_Bljk_SB_MT128x64x16_SN_SU32_SUM3_TT8_8_WG16_8_1_WGM4
    SolutionIndex: 25
    SolutionNameMin: Cijk_Ailk_Bljk_SB_MT128x128x16_SN_SU32_SUM3_TT8_16_WG16_8_1_WGM4
    SolutionIndex: 26
    SolutionNameMin: Cijk_Ailk_Bljk_SB_MT128x128x16_SN_SU32_SUM3_TT8_8_WG16_16_1_WGM4
    SolutionIndex: 27
    SolutionNameMin: Cijk_Ailk_Bljk_SB_MT128x256x16_SN_SU32_SUM3_TT8_16_WG16_16_1_WGM4
    SolutionIndex: 28
    SolutionNameMin: Cijk_Ailk_Bljk_SB_MT128x64x8_SN_SU0_SUM0_TT8_8_WG16_8_1_WGM8
    SolutionIndex: 29
    SolutionNameMin: Cijk_Ailk_Bljk_SB_MT128x128x8_SN_SU0_SUM0_TT8_16_WG16_8_1_WGM8
    SolutionIndex: 30
    SolutionNameMin: Cijk_Ailk_Bljk_SB_MT128x128x8_SN_SU0_SUM0_TT8_8_WG16_16_1_WGM8
    SolutionIndex: 31
    SolutionNameMin: Cijk_Ailk_Bljk_SB_MT128x64x16_SN_SU0_SUM0_TT8_8_WG16_8_1_WGM8
    SolutionIndex: 32
    SolutionNameMin: Cijk_Ailk_Bljk_SB_MT128x128x16_SN_SU0_SUM0_TT8_16_WG16_8_1_WGM8
    SolutionIndex: 33
    SolutionNameMin: Cijk_Ailk_Bljk_SB_MT128x128x16_SN_SU0_SUM0_TT8_8_WG16_16_1_WGM8
    SolutionIndex: 34
    SolutionNameMin: Cijk_Ailk_Bljk_SB_MT128x256x16_SN_SU0_SUM0_TT8_16_WG16_16_1_WGM8
    SolutionIndex: 35
    SolutionNameMin: Cijk_Ailk_Bljk_SB_MT128x64x8_SN_SU32_SUM3_TT8_8_WG16_8_1_WGM8
    SolutionIndex: 36
    SolutionNameMin: Cijk_Ailk_Bljk_SB_MT128x128x8_SN_SU32_SUM3_TT8_16_WG16_8_1_WGM8
    SolutionIndex: 37
    SolutionNameMin: Cijk_Ailk_Bljk_SB_MT128x128x8_SN_SU32_SUM3_TT8_8_WG16_16_1_WGM8
    SolutionIndex: 38
    SolutionNameMin: Cijk_Ailk_Bljk_SB_MT128x64x16_SN_SU32_SUM3_TT8_8_WG16_8_1_WGM8
    SolutionIndex: 39
    SolutionNameMin: Cijk_Ailk_Bljk_SB_MT128x128x16_SN_SU32_SUM3_TT8_16_WG16_8_1_WGM8
    SolutionIndex: 40
    SolutionNameMin: Cijk_Ailk_Bljk_SB_MT128x128x16_SN_SU32_SUM3_TT8_8_WG16_16_1_WGM8
    SolutionIndex: 41
    SolutionNameMin: Cijk_Ailk_Bljk_SB_MT128x256x16_SN_SU32_SUM3_TT8_16_WG16_16_1_WGM8
    SolutionIndex: 42
    SolutionNameMin: Cijk_Ailk_Bljk_SB_MT128x64x8_SN_SU0_SUM0_TT8_8_WG16_8_1_WGM1
    SolutionIndex: 43
    SolutionNameMin: Cijk_Ailk_Bljk_SB_MT128x128x8_SN_SU0_SUM0_TT8_16_WG16_8_1_WGM1
    SolutionIndex: 44
    SolutionNameMin: Cijk_Ailk_Bljk_SB_MT128x64x8_SN_SU0_SUM0_TT8_8_WG16_8_1_WGM4
    SolutionIndex: 45
    SolutionNameMin: Cijk_Ailk_Bljk_SB_MT128x64x8_SN_SU0_SUM0_TT8_8_WG16_8_1_WGM8
    SolutionIndex: 46
    SolutionNameMin: Cijk_Ailk_Bljk_SB_MT128x64x8_SN_SU32_SUM3_TT8_8_WG16_8_1_WGM8
    SolutionIndex: 47
    SolutionNameMin: Cijk_Ailk_Bljk_SB_MT32x32x8_SN_SU0_SUM0_TT4_4_WG8_8_1_WGM1
    SolutionIndex: 48
    SolutionNameMin: Cijk_Ailk_Bljk_SB_MT64x64x8_SN_SU0_SUM0_TT8_8_WG8_8_1_WGM1
    SolutionIndex: 49
    SolutionNameMin: Cijk_Ailk_Bljk_SB_MT64x64x8_SN_SU0_SUM0_TT4_8_WG16_8_1_WGM1
    SolutionIndex: 50
    SolutionNameMin: Cijk_Ailk_Bljk_SB_MT128x64x8_SN_SU0_SUM0_TT8_8_WG16_8_1_WGM1
    SolutionIndex: 51
    SolutionNameMin: Cijk_Ailk_Bljk_SB_MT128x128x8_SN_SU0_SUM0_TT8_8_WG16_16_1_WGM1
    SolutionIndex: 52
    SolutionNameMin: Cijk_Ailk_Bljk_SB_MT64x64x16_SN_SU0_SUM0_TT8_8_WG8_8_1_WGM1
    SolutionIndex: 53
    SolutionNameMin: Cijk_Ailk_Bljk_SB_MT64x64x16_SN_SU0_SUM0_TT4_8_WG16_8_1_WGM1
    SolutionIndex: 54
    SolutionNameMin: Cijk_Ailk_Bljk_SB_MT128x64x16_SN_SU0_SUM0_TT8_8_WG16_8_1_WGM1
    SolutionIndex: 55
    SolutionNameMin: Cijk_Ailk_Bljk_SB_MT128x128x16_SN_SU0_SUM0_TT8_8_WG16_16_1_WGM1
    SolutionIndex: 56
    SolutionNameMin: Cijk_Ailk_Bljk_SB_MT64x64x32_SN_SU0_SUM0_TT8_8_WG8_8_1_WGM1
    SolutionIndex: 57
    SolutionNameMin: Cijk_Ailk_Bljk_SB_MT32x32x8_SN_SU32_SUM3_TT4_4_WG8_8_1_WGM1
    SolutionIndex: 58
    SolutionNameMin: Cijk_Ailk_Bljk_SB_MT32x64x8_SN_SU32_SUM3_TT4_8_WG8_8_1_WGM1
    SolutionIndex: 59
    SolutionNameMin: Cijk_Ailk_Bljk_SB_MT64x64x8_SN_SU32_SUM3_TT8_8_WG8_8_1_WGM1
    SolutionIndex: 60
    SolutionNameMin: Cijk_Ailk_Bljk_SB_MT64x64x8_SN_SU32_SUM3_TT4_8_WG16_8_1_WGM1
    SolutionIndex: 61
    SolutionNameMin: Cijk_Ailk_Bljk_SB_MT128x64x8_SN_SU32_SUM3_TT8_8_WG16_8_1_WGM1
    SolutionIndex: 62
    SolutionNameMin: Cijk_Ailk_Bljk_SB_MT128x128x8_SN_SU32_SUM3_TT8_8_WG16_16_1_WGM1
    SolutionIndex: 63
    SolutionNameMin: Cijk_Ailk_Bljk_SB_MT64x64x16_SN_SU32_SUM3_TT8_8_WG8_8_1_WGM1
    SolutionIndex: 64
    SolutionNameMin: Cijk_Ailk_Bljk_SB_MT64x64x16_SN_SU32_SUM3_TT4_8_WG16_8_1_WGM1
    SolutionIndex: 65
    SolutionNameMin: Cijk_Ailk_Bljk_SB_MT128x64x16_SN_SU32_SUM3_TT8_8_WG16_8_1_WGM1
    SolutionIndex: 66
    SolutionNameMin: Cijk_Ailk_Bljk_SB_MT64x128x16_SN_SU32_SUM3_TT4_8_WG16_16_1_WGM1
    SolutionIndex: 67
    SolutionNameMin: Cijk_Ailk_Bljk_SB_MT128x128x16_SN_SU32_SUM3_TT8_8_WG16_16_1_WGM1
    SolutionIndex: 68
    SolutionNameMin: Cijk_Ailk_Bljk_SB_MT64x64x32_SN_SU32_SUM3_TT8_8_WG8_8_1_WGM1
    SolutionIndex: 69
    SolutionNameMin: Cijk_Ailk_Bljk_SB_MT64x64x32_SN_SU32_SUM3_TT4_8_WG16_8_1_WGM1
    SolutionIndex: 70
    SolutionNameMin: Cijk_Ailk_Bljk_SB_MT32x32x8_SN_SU0_SUM0_TT4_4_WG8_8_1_WGM4
    SolutionIndex: 71
    SolutionNameMin: Cijk_Ailk_Bljk_SB_MT32x64x8_SN_SU0_SUM0_TT4_8_WG8_8_1_WGM4
    SolutionIndex: 72
    SolutionNameMin: Cijk_Ailk_Bljk_SB_MT64x64x8_SN_SU0_SUM0_TT8_8_WG8_8_1_WGM4
    SolutionIndex: 73
    SolutionNameMin: Cijk_Ailk_Bljk_SB_MT128x64x8_SN_SU0_SUM0_TT8_8_WG16_8_1_WGM4
    SolutionIndex: 74
    SolutionNameMin: Cijk_Ailk_Bljk_SB_MT128x128x8_SN_SU0_SUM0_TT8_8_WG16_16_1_WGM4
    SolutionIndex: 75
    SolutionNameMin: Cijk_Ailk_Bljk_SB_MT64x64x16_SN_SU0_SUM0_TT8_8_WG8_8_1_WGM4
    SolutionIndex: 76
    SolutionNameMin: Cijk_Ailk_Bljk_SB_MT64x64x16_SN_SU0_SUM0_TT4_8_WG16_8_1_WGM4
    SolutionIndex: 77
    SolutionNameMin: Cijk_Ailk_Bljk_SB_MT128x64x16_SN_SU0_SUM0_TT8_8_WG16_8_1_WGM4
    SolutionIndex: 78
    SolutionNameMin: Cijk_Ailk_Bljk_SB_MT64x128x16_SN_SU0_SUM0_TT4_8_WG16_16_1_WGM4
    SolutionIndex: 79
    SolutionNameMin: Cijk_Ailk_Bljk_SB_MT64x64x32_SN_SU0_SUM0_TT8_8_WG8_8_1_WGM4
    SolutionIndex: 80
    SolutionNameMin: Cijk_Ailk_Bljk_SB_MT32x32x8_SN_SU32_SUM3_TT4_4_WG8_8_1_WGM4
    SolutionIndex: 81
    SolutionNameMin: Cijk_Ailk_Bljk_SB_MT64x64x8_SN_SU32_SUM3_TT8_8_WG8_8_1_WGM4
    SolutionIndex: 82
    SolutionNameMin: Cijk_Ailk_Bljk_SB_MT64x64x8_SN_SU32_SUM3_TT4_8_WG16_8_1_WGM4
    SolutionIndex: 83
    SolutionNameMin: Cijk_Ailk_Bljk_SB_MT128x64x8_SN_SU32_SUM3_TT8_8_WG16_8_1_WGM4
    SolutionIndex: 84
    SolutionNameMin: Cijk_Ailk_Bljk_SB_MT128x128x8_SN_SU32_SUM3_TT8_8_WG16_16_1_WGM4
    SolutionIndex: 85
    SolutionNameMin: Cijk_Ailk_Bljk_SB_MT64x64x16_SN_SU32_SUM3_TT8_8_WG8_8_1_WGM4
    SolutionIndex: 86
    SolutionNameMin: Cijk_Ailk_Bljk_SB_MT64x64x16_SN_SU32_SUM3_TT4_8_WG16_8_1_WGM4
    SolutionIndex: 87
    SolutionNameMin: Cijk_Ailk_Bljk_SB_MT128x64x16_SN_SU32_SUM3_TT8_8_WG16_8_1_WGM4
    SolutionIndex: 88
    SolutionNameMin: Cijk_Ailk_Bljk_SB_MT64x64x16_SN_SU32_SUM3_TT4_4_WG16_16_1_WGM4
    SolutionIndex: 89
    SolutionNameMin: Cijk_Ailk_Bljk_SB_MT64x128x16_SN_SU32_SUM3_TT4_8_WG16_16_1_WGM4
    SolutionIndex: 90
    SolutionNameMin: Cijk_Ailk_Bljk_SB_MT128x128x16_SN_SU32_SUM3_TT8_8_WG16_16_1_WGM4
    SolutionIndex: 91
    SolutionNameMin: Cijk_Ailk_Bljk_SB_MT64x64x32_SN_SU32_SUM3_TT8_8_WG8_8_1_WGM4
    SolutionIndex: 92
    SolutionNameMin: Cijk_Ailk_Bljk_SB_MT64x64x32_SN_SU32_SUM3_TT4_8_WG16_8_1_WGM4
    SolutionIndex: 93
    SolutionNameMin: Cijk_Ailk_Bljk_SB_MT64x64x32_SN_SU32_SUM3_TT4_4_WG16_16_1_WGM4
    SolutionIndex: 94
    SolutionNameMin: Cijk_Ailk_Bljk_SB_MT64x64x8_SN_SU0_SUM0_TT8_8_WG8_8_1_WGM8
    SolutionIndex: 95
    SolutionNameMin: Cijk_Ailk_Bljk_SB_MT64x32x8_SN_SU0_SUM0_TT4_4_WG16_8_1_WGM8
    SolutionIndex: 96
    SolutionNameMin: Cijk_Ailk_Bljk_SB_MT128x64x8_SN_SU0_SUM0_TT8_8_WG16_8_1_WGM8
    SolutionIndex: 97
    SolutionNameMin: Cijk_Ailk_Bljk_SB_MT128x128x8_SN_SU0_SUM0_TT8_8_WG16_16_1_WGM8
    SolutionIndex: 98
    SolutionNameMin: Cijk_Ailk_Bljk_SB_MT64x64x16_SN_SU0_SUM0_TT8_8_WG8_8_1_WGM8
    SolutionIndex: 99
    SolutionNameMin: Cijk_Ailk_Bljk_SB_MT128x64x16_SN_SU0_SUM0_TT8_8_WG16_8_1_WGM8
    SolutionIndex: 100
    SolutionNameMin: Cijk_Ailk_Bljk_SB_MT32x32x8_SN_SU32_SUM3_TT4_4_WG8_8_1_WGM8
    SolutionIndex: 101
    SolutionNameMin: Cijk_Ailk_Bljk_SB_MT64x64x8_SN_SU32_SUM3_TT8_8_WG8_8_1_WGM8
    SolutionIndex: 102
    SolutionNameMin: Cijk_Ailk_Bljk_SB_MT64x32x8_SN_SU32_SUM3_TT4_4_WG16_8_1_WGM8
    SolutionIndex: 103
    SolutionNameMin: Cijk_Ailk_Bljk_SB_MT64x64x8_SN_SU32_SUM3_TT4_8_WG16_8_1_WGM8
    SolutionIndex: 104
    SolutionNameMin: Cijk_Ailk_Bljk_SB_MT128x64x8_SN_SU32_SUM3_TT8_8_WG16_8_1_WGM8
    SolutionIndex: 105
    SolutionNameMin: Cijk_Ailk_Bljk_SB_MT128x128x8_SN_SU32_SUM3_TT8_8_WG16_16_1_WGM8
    SolutionIndex: 106
    SolutionNameMin: Cijk_Ailk_Bljk_SB_MT64x64x16_SN_SU32_SUM3_TT8_8_WG8_8_1_WGM8
    SolutionIndex: 107
    SolutionNameMin: Cijk_Ailk_Bljk_SB_MT64x64x16_SN_SU32_SUM3_TT4_8_WG16_8_1_WGM8
    SolutionIndex: 108
    SolutionNameMin: Cijk_Ailk_Bljk_SB_MT128x64x16_SN_SU32_SUM3_TT8_8_WG16_8_1_WGM8
    SolutionIndex: 109
    SolutionNameMin: Cijk_Ailk_Bljk_SB_MT64x128x16_SN_SU32_SUM3_TT4_8_WG16_16_1_WGM8
    SolutionIndex: 110
    SolutionNameMin: Cijk_Ailk_Bljk_SB_MT128x128x16_SN_SU32_SUM3_TT8_8_WG16_16_1_WGM8
    SolutionIndex: 111
    SolutionNameMin: Cijk_Ailk_Bljk_SB_MT32x64x32_SN_SU32_SUM3_TT4_8_WG8_8_1_WGM8
    SolutionIndex: 112
    SolutionNameMin: Cijk_Ailk_Bljk_SB_MT64x64x32_SN_SU32_SUM3_TT8_8_WG8_8_1_WGM8
    SolutionIndex: 113
    SolutionNameMin: Cijk_Ailk_Bljk_SB_MT64x64x32_SN_SU32_SUM3_TT4_8_WG16_8_1_WGM8
    SolutionIndex: 114
    SolutionNameMin: Cijk_Ailk_Bljk_SB_MT64x64x32_SN_SU32_SUM3_TT4_4_WG16_16_1_WGM8
    SolutionIndex: 115
    SolutionNameMin: Cijk_Ailk_Bljk_SB_MT64x128x32_SN_SU32_SUM3_TT4_8_WG16_16_1_WGM8
- - - [1024, 4096, 1, 1024, 1024, 1024, 1024, 1024]
    - [8, 11750.0]
  - - [4096, 4096, 1, 1024, 4096, 4096, 4096, 1024]
    - [1, 12336.0]
  - - [1024, 2048, 1, 1024, 1024, 1024, 1024, 1024]
    - [21, 11075.0]
  - - [4096, 2048, 1, 1024, 4096, 4096, 4096, 1024]
    - [1, 12211.0]
  - - [768, 4096, 1, 2, 768, 768, 768, 2]
    - [30, 316.0]
  - - [768, 4096, 1, 768, 768, 768, 768, 768]
    - [1, 11507.0]
  - - [3072, 4096, 1, 768, 3072, 3072, 3072, 768]
    - [1, 12260.0]
  - - [768, 2048, 1, 2, 768, 768, 768, 2]
    - [15, 342.0]
  - - [768, 2048, 1, 768, 768, 768, 768, 768]
    - [1, 11006.0]
  - - [3072, 2048, 1, 768, 3072, 3072, 3072, 768]
    - [1, 11834.0]
  - - [3072, 1024, 1, 768, 3072, 3072, 3072, 768]
    - [1, 11534.0]
  - - [3072, 512, 1, 768, 3072, 3072, 3072, 768]
    - [1, 11010.0]
  - - [1024, 3072, 1, 1024, 1024, 1024, 1024, 1024]
    - [4, 11193.0]
  - - [3072, 2048, 1, 1024, 3072, 3072, 3072, 1024]
    - [1, 11851.0]
  - - [3072, 3072, 1, 1024, 3072, 3072, 3072, 1024]
    - [1, 12349.0]
  - - [3072, 512, 1, 1024, 3072, 3072, 3072, 1024]
    - [1, 10909.0]
  - - [3072, 4096, 1, 1024, 3072, 3072, 3072, 1024]
    - [1, 12304.0]
  - - [1024, 2048, 1, 2, 1024, 1024, 1024, 2]
    - [10, 335.0]
  - - [1024, 3072, 1, 2, 1024, 1024, 1024, 2]
    - [7, 371.0]
  - - [1024, 4096, 1, 2, 1024, 1024, 1024, 2]
    - [10, 368.0]
  - - [128, 128, 512, 64, 128, 128, 128, 64]
    - [40, 10261.0]
  - - [512, 512, 64, 64, 512, 512, 512, 64]
    - [0, 10761.0]
  - - [2944, 4288, 1, 1280, 2944, 2944, 2944, 1280]
    - [36, 12101.0]
  - - [2368, 5888, 1, 256, 2368, 2368, 2368, 256]
    - [8, 11697.0]
  - - [5888, 1856, 1, 256, 5888, 5888, 5888, 256]
    - [15, 11582.0]
  - - [512, 24000, 1, 1536, 512, 512, 512, 1536]
    - [22, 12318.0]
  - - [5888, 1408, 1, 256, 5888, 5888, 5888, 256]
    - [1, 11724.0]
  - - [5888, 1856, 1, 3328, 5888, 5888, 5888, 3328]
    - [1, 12033.0]
  - - [1856, 4288, 1, 256, 1856, 1856, 1856, 256]
    - [1, 11099.0]
  - - [1024, 5056, 1, 128, 1024, 1024, 1024, 128]
    - [0, 11030.0]
  - - [5056, 5056, 1, 3328, 5056, 5056, 5056, 3328]
    - [1, 12332.0]
  - - [1408, 5888, 1, 1280, 1408, 1408, 1408, 1280]
    - [1, 12146.0]
  - - [6144, 6000, 1, 2560, 6144, 6144, 6144, 2560]
    - [8, 12547.0]
  - - [2368, 6784, 1, 128, 2368, 2368, 2368, 128]
    - [8, 11234.0]
  - - [1024, 3584, 1, 3328, 1024, 1024, 1024, 3328]
    - [1, 11580.0]
  - - [512, 48000, 1, 2048, 512, 512, 512, 2048]
    - [8, 12513.0]
  - - [5888, 1408, 1, 1280, 5888, 5888, 5888, 1280]
    - [1, 12201.0]
  - - [1408, 4288, 1, 256, 1408, 1408, 1408, 256]
    - [0, 11486.0]
  - - [1024, 2368, 1, 256, 1024, 1024, 1024, 256]
    - [15, 10952.0]
  - - [1408, 1856, 1, 1280, 1408, 1408, 1408, 1280]
    - [28, 11497.0]
  - - [5056, 5056, 1, 1280, 5056, 5056, 5056, 1280]
    - [1, 12245.0]
  - - [448, 5056, 1, 256, 448, 448, 448, 256]
    - [15, 9419.0]
  - - [1856, 1408, 1, 128, 1856, 1856, 1856, 128]
    - [0, 10051.0]
  - - [6784, 256, 1, 3328, 6784, 6784, 6784, 3328]
    - [15, 11016.0]
  - - [1408, 3584, 1, 256, 1408, 1408, 1408, 256]
    - [28, 11350.0]
  - - [4288, 448, 1, 256, 4288, 4288, 4288, 256]
    - [7, 10622.0]
  - - [1024, 1856, 1, 128, 1024, 1024, 1024, 128]
    - [0, 10069.0]
  - - [4288, 2944, 1, 1280, 4288, 4288, 4288, 1280]
    - [1, 12115.0]
  - - [704, 5056, 1, 1280, 704, 704, 704, 1280]
    - [8, 11023.0]
  - - [2368, 704, 1, 3328, 2368, 2368, 2368, 3328]
    - [7, 10654.0]
  - - [256, 5888, 1, 256, 256, 256, 256, 256]
    - [40, 9509.0]
  - - [1856, 4288, 1, 3328, 1856, 1856, 1856, 3328]
    - [36, 11684.0]
  - - [5888, 1024, 1, 256, 5888, 5888, 5888, 256]
    - [15, 11391.0]
  - - [1408, 2944, 1, 256, 1408, 1408, 1408, 256]
    - [1, 11428.0]
  - - [6784, 5056, 1, 3328, 6784, 6784, 6784, 3328]
    - [8, 12450.0]
  - - [5056, 5056, 1, 256, 5056, 5056, 5056, 256]
    - [22, 11883.0]
  - - [704, 5056, 1, 128, 704, 704, 704, 128]
    - [15, 9904.0]
  - - [2368, 2944, 1, 1280, 2368, 2368, 2368, 1280]
    - [1, 12057.0]
  - - [6784, 6784, 1, 1280, 6784, 6784, 6784, 1280]
    - [1, 12621.0]
  - - [1408, 4288, 1, 1280, 1408, 1408, 1408, 1280]
    - [16, 11978.0]
  - - [3584, 4288, 1, 1280, 3584, 3584, 3584, 1280]
    - [1, 12272.0]
  - - [512, 6000, 1, 2560, 512, 512, 512, 2560]
    - [35, 11496.0]
  - - [2368, 704, 1, 1280, 2368, 2368, 2368, 1280]
    - [7, 10456.0]
  - - [5056, 4288, 1, 3328, 5056, 5056, 5056, 3328]
    - [1, 12297.0]
  - - [3584, 2368, 1, 3328, 3584, 3584, 3584, 3328]
    - [1, 12042.0]
  - - [5888, 6784, 1, 1280, 5888, 5888, 5888, 1280]
    - [1, 12608.0]
  - - [6784, 448, 1, 1280, 6784, 6784, 6784, 1280]
    - [15, 11339.0]
  - - [2944, 5888, 1, 256, 2944, 2944, 2944, 256]
    - [16, 12253.0]
  - - [4288, 2944, 1, 256, 4288, 4288, 4288, 256]
    - [36, 11805.0]
  - - [5888, 704, 1, 1280, 5888, 5888, 5888, 1280]
    - [7, 11411.0]
  - - [448, 5888, 1, 128, 448, 448, 448, 128]
    - [15, 9135.0]
  - - [5056, 2368, 1, 1280, 5056, 5056, 5056, 1280]
    - [16, 12093.0]
  - - [448, 3584, 1, 1280, 448, 448, 448, 1280]
    - [22, 9633.0]
  - - [6784, 5888, 1, 256, 6784, 6784, 6784, 256]
    - [16, 12420.0]
  - - [1024, 1408, 1, 256, 1024, 1024, 1024, 256]
    - [15, 10310.0]
  - - [2368, 2368, 1, 3328, 2368, 2368, 2368, 3328]
    - [1, 11331.0]
  - - [1856, 6784, 1, 128, 1856, 1856, 1856, 128]
    - [15, 11049.0]
  - - [5056, 704, 1, 3328, 5056, 5056, 5056, 3328]
    - [15, 11565.0]
  - - [1408, 1856, 1, 256, 1408, 1408, 1408, 256]
    - [0, 10985.0]
  - - [2368, 5056, 1, 256, 2368, 2368, 2368, 256]
    - [16, 11591.0]
  - - [3584, 2368, 1, 1280, 3584, 3584, 3584, 1280]
    - [1, 11988.0]
  - - [704, 5888, 1, 256, 704, 704, 704, 256]
    - [1, 10367.0]
  - - [6784, 2944, 1, 128, 6784, 6784, 6784, 128]
    - [22, 11964.0]
  - - [2944, 6784, 1, 3328, 2944, 2944, 2944, 3328]
    - [1, 12658.0]
  - - [3584, 704, 1, 3328, 3584, 3584, 3584, 3328]
    - [7, 11211.0]
  - - [448, 4288, 1, 256, 448, 448, 448, 256]
    - [26, 8631.0]
  - - [704, 2368, 1, 1280, 704, 704, 704, 1280]
    - [6, 9737.0]
  - - [1856, 2368, 1, 1280, 1856, 1856, 1856, 1280]
    - [28, 11229.0]
  - - [1856, 4288, 1, 1280, 1856, 1856, 1856, 1280]
    - [16, 11676.0]
  - - [256, 193600, 1, 64, 256, 256, 256, 64]
    - [13, 7894.0]
  - - [704, 2944, 1, 128, 704, 704, 704, 128]
    - [23, 9104.0]
  - - [1408, 1024, 1, 1280, 1408, 1408, 1408, 1280]
    - [15, 11009.0]
  - - [704, 6784, 1, 256, 704, 704, 704, 256]
    - [16, 10626.0]
  - - [6784, 704, 1, 256, 6784, 6784, 6784, 256]
    - [15, 11205.0]
  - - [5056, 1408, 1, 128, 5056, 5056, 5056, 128]
    - [7, 11137.0]
  - - [2048, 7000, 1, 2048, 2048, 2048, 2048, 2048]
    - [1, 12376.0]
  - - [5056, 704, 1, 256, 5056, 5056, 5056, 256]
    - [0, 10830.0]
  - - [3584, 4288, 1, 3328, 3584, 3584, 3584, 3328]
    - [1, 12335.0]
  - - [5888, 1856, 1, 1280, 5888, 5888, 5888, 1280]
    - [1, 11962.0]
  - - [2368, 3584, 1, 1280, 2368, 2368, 2368, 1280]
    - [1, 11981.0]
  - - [2944, 3584, 1, 3328, 2944, 2944, 2944, 3328]
    - [1, 12294.0]
  - - [6784, 2944, 1, 256, 6784, 6784, 6784, 256]
    - [16, 12312.0]
  - - [1024, 1500, 1, 2560, 1024, 1024, 1024, 2560]
    - [8, 10989.0]
  - - [1856, 2368, 1, 256, 1856, 1856, 1856, 256]
    - [0, 10620.0]
  - - [3584, 6784, 1, 3328, 3584, 3584, 3584, 3328]
    - [1, 12526.0]
  - - [1024, 5888, 1, 3328, 1024, 1024, 1024, 3328]
    - [22, 12053.0]
  - - [6144, 24000, 1, 2560, 6144, 6144, 6144, 2560]
    - [1, 12426.0]
  - - [5056, 4288, 1, 1280, 5056, 5056, 5056, 1280]
    - [1, 12204.0]
  - - [2368, 2368, 1, 1280, 2368, 2368, 2368, 1280]
    - [28, 11219.0]
  - - [2944, 5888, 1, 128, 2944, 2944, 2944, 128]
    - [36, 11969.0]
  - - [704, 5888, 1, 1280, 704, 704, 704, 1280]
    - [1, 11126.0]
  - - [2368, 3584, 1, 128, 2368, 2368, 2368, 128]
    - [28, 11044.0]
  - - [1856, 5056, 1, 128, 1856, 1856, 1856, 128]
    - [0, 11008.0]
  - - [2944, 6784, 1, 1280, 2944, 2944, 2944, 1280]
    - [1, 12619.0]
  - - [1024, 5056, 1, 1280, 1024, 1024, 1024, 1280]
    - [1, 12089.0]
  - - [4288, 1024, 1, 256, 4288, 4288, 4288, 256]
    - [8, 11241.0]
  - - [2944, 2368, 1, 128, 2944, 2944, 2944, 128]
    - [28, 11267.0]
  - - [5888, 448, 1, 1280, 5888, 5888, 5888, 1280]
    - [28, 11017.0]
  - - [704, 5888, 1, 3328, 704, 704, 704, 3328]
    - [27, 11087.0]
  - - [3584, 2944, 1, 256, 3584, 3584, 3584, 256]
    - [8, 11769.0]
  - - [1856, 2368, 1, 3328, 1856, 1856, 1856, 3328]
    - [28, 11279.0]
  - - [512, 6000, 1, 2816, 512, 512, 512, 2816]
    - [35, 11502.0]
  - - [512, 24000, 1, 2048, 512, 512, 512, 2048]
    - [22, 12306.0]
  - - [1408, 5056, 1, 3328, 1408, 1408, 1408, 3328]
    - [16, 12368.0]
  - - [1856, 1856, 1, 3328, 1856, 1856, 1856, 3328]
    - [28, 11166.0]
  - - [2368, 2368, 1, 256, 2368, 2368, 2368, 256]
    - [16, 10627.0]
  - - [4288, 4288, 1, 1280, 4288, 4288, 4288, 1280]
    - [36, 12145.0]
  - - [5888, 1024, 1, 1280, 5888, 5888, 5888, 1280]
    - [1, 12013.0]
  - - [1024, 12544, 1, 256, 1024, 1024, 1024, 256]
    - [4, 11872.0]
  - - [5888, 448, 1, 128, 5888, 5888, 5888, 128]
    - [15, 10313.0]
  - - [512, 48000, 1, 2560, 512, 512, 512, 2560]
    - [22, 12544.0]
  - - [704, 6784, 1, 3328, 704, 704, 704, 3328]
    - [1, 11260.0]
  - - [5888, 5888, 1, 1280, 5888, 5888, 5888, 1280]
    - [1, 12646.0]
  - - [5056, 1024, 1, 1280, 5056, 5056, 5056, 1280]
    - [1, 12198.0]
  - - [448, 5888, 1, 3328, 448, 448, 448, 3328]
    - [16, 9903.0]
  - - [1024, 2944, 1, 1280, 1024, 1024, 1024, 1280]
    - [15, 11264.0]
  - - [5056, 5888, 1, 1280, 5056, 5056, 5056, 1280]
    - [1, 12410.0]
  - - [4288, 5888, 1, 128, 4288, 4288, 4288, 128]
    - [36, 11722.0]
  - - [1408, 3584, 1, 128, 1408, 1408, 1408, 128]
    - [28, 11175.0]
  - - [448, 3584, 1, 128, 448, 448, 448, 128]
    - [28, 8542.0]
  - - [5888, 2944, 1, 1280, 5888, 5888, 5888, 1280]
    - [16, 12593.0]
  - - [2368, 5888, 1, 128, 2368, 2368, 2368, 128]
    - [1, 11357.0]
  - - [3584, 5888, 1, 256, 3584, 3584, 3584, 256]
    - [8, 12234.0]
  - - [2368, 1024, 1, 128, 2368, 2368, 2368, 128]
    - [7, 9993.0]
  - - [2368, 704, 1, 128, 2368, 2368, 2368, 128]
    - [7, 9664.0]
  - - [3584, 2368, 1, 128, 3584, 3584, 3584, 128]
    - [28, 11445.0]
  - - [5056, 704, 1, 128, 5056, 5056, 5056, 128]
    - [21, 10791.0]
  - - [5056, 1408, 1, 3328, 5056, 5056, 5056, 3328]
    - [1, 12385.0]
  - - [6784, 1024, 1, 3328, 6784, 6784, 6784, 3328]
    - [36, 12096.0]
  - - [6784, 2944, 1, 3328, 6784, 6784, 6784, 3328]
    - [1, 12646.0]
  - - [1856, 1856, 1, 256, 1856, 1856, 1856, 256]
    - [15, 10804.0]
  - - [6784, 2368, 1, 1280, 6784, 6784, 6784, 1280]
    - [1, 12157.0]
  - - [4288, 3584, 1, 256, 4288, 4288, 4288, 256]
    - [8, 11965.0]
  - - [4288, 5888, 1, 1280, 4288, 4288, 4288, 1280]
    - [1, 12360.0]
  - - [1024, 6000, 1, 1536, 1024, 1024, 1024, 1536]
    - [22, 12221.0]
  - - [4288, 1856, 1, 1280, 4288, 4288, 4288, 1280]
    - [16, 11736.0]
  - - [1856, 2944, 1, 3328, 1856, 1856, 1856, 3328]
    - [1, 11646.0]
  - - [256, 6784, 1, 3328, 256, 256, 256, 3328]
    - [35, 11086.0]
  - - [512, 3000, 1, 1536, 512, 512, 512, 1536]
    - [36, 10863.0]
  - - [256, 5056, 1, 128, 256, 256, 256, 128]
    - [21, 9757.0]
  - - [5056, 1024, 1, 256, 5056, 5056, 5056, 256]
    - [22, 11680.0]
  - - [5056, 1856, 1, 3328, 5056, 5056, 5056, 3328]
    - [1, 12038.0]
  - - [4288, 1408, 1, 128, 4288, 4288, 4288, 128]
    - [15, 10974.0]
  - - [1856, 5888, 1, 3328, 1856, 1856, 1856, 3328]
    - [1, 12044.0]
  - - [4288, 5056, 1, 256, 4288, 4288, 4288, 256]
    - [1, 11962.0]
  - - [4096, 7000, 1, 4096, 4096, 4096, 4096, 4096]
    - [1, 12619.0]
  - - [5056, 256, 1, 3328, 5056, 5056, 5056, 3328]
    - [1, 11602.0]
  - - [1024, 3000, 1, 2560, 1024, 1024, 1024, 2560]
    - [22, 11516.0]
  - - [1024, 5888, 1, 1280, 1024, 1024, 1024, 1280]
    - [1, 12082.0]
  - - [6784, 2368, 1, 128, 6784, 6784, 6784, 128]
    - [28, 11625.0]
  - - [1856, 1024, 1, 1280, 1856, 1856, 1856, 1280]
    - [16, 11344.0]
  - - [6784, 4288, 1, 1280, 6784, 6784, 6784, 1280]
    - [1, 12390.0]
  - - [1856, 1856, 1, 1280, 1856, 1856, 1856, 1280]
    - [0, 11130.0]
  - - [3072, 24000, 1, 1024, 3072, 3072, 3072, 1024]
    - [1, 12610.0]
  - - [1408, 5056, 1, 1280, 1408, 1408, 1408, 1280]
    - [16, 12317.0]
  - - [5888, 1856, 1, 128, 5888, 5888, 5888, 128]
    - [35, 11503.0]
  - - [448, 6784, 1, 128, 448, 448, 448, 128]
    - [15, 9293.0]
  - - [5056, 3584, 1, 128, 5056, 5056, 5056, 128]
    - [22, 11691.0]
  - - [5888, 5888, 1, 3328, 5888, 5888, 5888, 3328]
    - [1, 12681.0]
  - - [6784, 1024, 1, 256, 6784, 6784, 6784, 256]
    - [29, 11636.0]
  - - [2944, 2368, 1, 256, 2944, 2944, 2944, 256]
    - [36, 11611.0]
  - - [5056, 5888, 1, 3328, 5056, 5056, 5056, 3328]
    - [1, 12541.0]
  - - [1856, 1024, 1, 256, 1856, 1856, 1856, 256]
    - [15, 10531.0]
  - - [512, 48000, 1, 1536, 512, 512, 512, 1536]
    - [8, 12550.0]
  - - [3584, 448, 1, 1280, 3584, 3584, 3584, 1280]
    - [28, 11112.0]
  - - [448, 5888, 1, 256, 448, 448, 448, 256]
    - [15, 9546.0]
  - - [1408, 6784, 1, 3328, 1408, 1408, 1408, 3328]
    - [22, 12275.0]
  - - [4288, 704, 1, 128, 4288, 4288, 4288, 128]
    - [7, 10382.0]
  - - [5056, 2944, 1, 256, 5056, 5056, 5056, 256]
    - [29, 12065.0]
  - - [6784, 5888, 1, 128, 6784, 6784, 6784, 128]
    - [1, 12104.0]
  - - [2944, 704, 1, 128, 2944, 2944, 2944, 128]
    - [15, 10339.0]
  - - [1408, 3584, 1, 3328, 1408, 1408, 1408, 3328]
    - [1, 12050.0]
  - - [2368, 6784, 1, 256, 2368, 2368, 2368, 256]
    - [16, 11828.0]
  - - [5056, 1408, 1, 1280, 5056, 5056, 5056, 1280]
    - [1, 12329.0]
  - - [5056, 4288, 1, 128, 5056, 5056, 5056, 128]
    - [0, 11551.0]
  - - [4288, 2368, 1, 3328, 4288, 4288, 4288, 3328]
    - [1, 11882.0]
  - - [1408, 1856, 1, 128, 1408, 1408, 1408, 128]
    - [15, 10680.0]
  - - [1408, 5888, 1, 3328, 1408, 1408, 1408, 3328]
    - [1, 12260.0]
  - - [6784, 6784, 1, 256, 6784, 6784, 6784, 256]
    - [36, 12455.0]
  - - [5888, 5056, 1, 128, 5888, 5888, 5888, 128]
    - [8, 11816.0]
  - - [4288, 2368, 1, 128, 4288, 4288, 4288, 128]
    - [0, 11189.0]
  - - [2368, 2944, 1, 256, 2368, 2368, 2368, 256]
    - [8, 11654.0]
  - - [3584, 1856, 1, 1280, 3584, 3584, 3584, 1280]
    - [1, 12060.0]
  - - [6784, 6784, 1, 128, 6784, 6784, 6784, 128]
    - [8, 12121.0]
  - - [5888, 5056, 1, 256, 5888, 5888, 5888, 256]
    - [8, 12179.0]
  - - [8448, 48000, 1, 2816, 8448, 8448, 8448, 2816]
    - [16, 12569.0]
  - - [512, 6000, 1, 2048, 512, 512, 512, 2048]
    - [35, 11529.0]
  - - [3584, 448, 1, 256, 3584, 3584, 3584, 256]
    - [0, 10654.0]
  - - [448, 4288, 1, 128, 448, 448, 448, 128]
    - [35, 8877.0]
  - - [256, 6784, 1, 256, 256, 256, 256, 256]
    - [21, 10550.0]
  - - [1408, 4288, 1, 128, 1408, 1408, 1408, 128]
    - [28, 11368.0]
  - - [2944, 704, 1, 3328, 2944, 2944, 2944, 3328]
    - [15, 11322.0]
  - - [3584, 3584, 1, 256, 3584, 3584, 3584, 256]
    - [16, 12002.0]
  - - [3584, 5056, 1, 256, 3584, 3584, 3584, 256]
    - [8, 12091.0]
  - - [2944, 2368, 1, 1280, 2944, 2944, 2944, 1280]
    - [1, 12072.0]
  - - [704, 6784, 1, 128, 704, 704, 704, 128]
    - [15, 10240.0]
  - - [6784, 3584, 1, 256, 6784, 6784, 6784, 256]
    - [8, 12295.0]
  - - [1856, 1408, 1, 256, 1856, 1856, 1856, 256]
    - [0, 10506.0]
  - - [5056, 2368, 1, 128, 5056, 5056, 5056, 128]
    - [7, 11433.0]
  - - [2944, 2944, 1, 3328, 2944, 2944, 2944, 3328]
    - [1, 12346.0]
  - - [5056, 6784, 1, 256, 5056, 5056, 5056, 256]
    - [16, 12203.0]
  - - [1856, 3584, 1, 128, 1856, 1856, 1856, 128]
    - [28, 10936.0]
  - - [3584, 6784, 1, 128, 3584, 3584, 3584, 128]
    - [8, 11887.0]
  - - [2368, 6784, 1, 1280, 2368, 2368, 2368, 1280]
    - [16, 12134.0]
  - - [5056, 1856, 1, 256, 5056, 5056, 5056, 256]
    - [15, 11502.0]
  - - [1024, 3000, 1, 2816, 1024, 1024, 1024, 2816]
    - [16, 11537.0]
  - - [1024, 1856, 1, 256, 1024, 1024, 1024, 256]
    - [15, 10703.0]
  - - [1408, 6784, 1, 1280, 1408, 1408, 1408, 1280]
    - [1, 12230.0]
  - - [3584, 3584, 1, 1280, 3584, 3584, 3584, 1280]
    - [1, 12350.0]
  - - [7680, 24000, 1, 2560, 7680, 7680, 7680, 2560]
    - [1, 12667.0]
  - - [4608, 48000, 1, 1536, 4608, 4608, 4608, 1536]
    - [1, 12707.0]
  - - [5888, 5888, 1, 128, 5888, 5888, 5888, 128]
    - [8, 12065.0]
  - - [5056, 2368, 1, 3328, 5056, 5056, 5056, 3328]
    - [1, 12138.0]
  - - [2944, 4288, 1, 256, 2944, 2944, 2944, 256]
    - [16, 11783.0]
  - - [1408, 3584, 1, 1280, 1408, 1408, 1408, 1280]
    - [1, 11982.0]
  - - [1024, 1500, 1, 2816, 1024, 1024, 1024, 2816]
    - [8, 11110.0]
  - - [1024, 6000, 1, 2048, 1024, 1024, 1024, 2048]
    - [22, 12264.0]
  - - [512, 24000, 1, 2560, 512, 512, 512, 2560]
    - [22, 12373.0]
  - - [6144, 3000, 1, 2560, 6144, 6144, 6144, 2560]
    - [1, 12269.0]
  - - [2368, 6784, 1, 3328, 2368, 2368, 2368, 3328]
    - [1, 12176.0]
  - - [1856, 1408, 1, 1280, 1856, 1856, 1856, 1280]
    - [15, 10879.0]
  - - [6784, 704, 1, 128, 6784, 6784, 6784, 128]
    - [15, 11063.0]
  - - [5056, 2944, 1, 128, 5056, 5056, 5056, 128]
    - [29, 11666.0]
  - - [1408, 5888, 1, 256, 1408, 1408, 1408, 256]
    - [1, 11867.0]
  - - [704, 2944, 1, 1280, 704, 704, 704, 1280]
    - [36, 10774.0]
  - - [3584, 704, 1, 1280, 3584, 3584, 3584, 1280]
    - [15, 11186.0]
  - - [5888, 2368, 1, 256, 5888, 5888, 5888, 256]
    - [36, 11799.0]
  - - [2944, 6784, 1, 128, 2944, 2944, 2944, 128]
    - [8, 12002.0]
  - - [3584, 448, 1, 3328, 3584, 3584, 3584, 3328]
    - [28, 11254.0]
  - - [704, 2368, 1, 3328, 704, 704, 704, 3328]
    - [6, 10264.0]
  - - [4608, 6000, 1, 1536, 4608, 4608, 4608, 1536]
    - [1, 12562.0]
  - - [256, 5888, 1, 128, 256, 256, 256, 128]
    - [28, 9330.0]
  - - [2944, 2944, 1, 1280, 2944, 2944, 2944, 1280]
    - [1, 12317.0]
  - - [5056, 448, 1, 3328, 5056, 5056, 5056, 3328]
    - [7, 11436.0]
  - - [6784, 704, 1, 3328, 6784, 6784, 6784, 3328]
    - [28, 11499.0]
  - - [5888, 4288, 1, 128, 5888, 5888, 5888, 128]
    - [8, 11744.0]
  - - [1408, 2944, 1, 3328, 1408, 1408, 1408, 3328]
    - [1, 12106.0]
  - - [3584, 704, 1, 128, 3584, 3584, 3584, 128]
    - [15, 10561.0]
  - - [448, 5056, 1, 128, 448, 448, 448, 128]
    - [15, 8926.0]
  - - [5056, 3584, 1, 256, 5056, 5056, 5056, 256]
    - [16, 12118.0]
  - - [4288, 4288, 1, 256, 4288, 4288, 4288, 256]
    - [16, 11890.0]
  - - [1408, 5056, 1, 128, 1408, 1408, 1408, 128]
    - [0, 11376.0]
  - - [2944, 3584, 1, 128, 2944, 2944, 2944, 128]
    - [22, 11643.0]
  - - [3584, 2368, 1, 256, 3584, 3584, 3584, 256]
    - [7, 11628.0]
  - - [5888, 5056, 1, 1280, 5888, 5888, 5888, 1280]
    - [1, 12493.0]
  - - [8448, 24000, 1, 2816, 8448, 8448, 8448, 2816]
    - [16, 12656.0]
  - - [3584, 3584, 1, 3328, 3584, 3584, 3584, 3328]
    - [1, 12399.0]
  - - [3072, 1500, 1, 128, 3072, 3072, 3072, 128]
    - [15, 10650.0]
  - - [2048, 3136, 1, 512, 2048, 2048, 2048, 512]
    - [1, 11893.0]
  - - [3025, 256, 64, 64, 3025, 3025, 3025, 64]
    - [0, 9253.0]
  - - [5888, 6784, 1, 256, 5888, 5888, 5888, 256]
    - [16, 12389.0]
  - - [4288, 2944, 1, 3328, 4288, 4288, 4288, 3328]
    - [1, 12177.0]
  - - [256, 5056, 1, 1280, 256, 256, 256, 1280]
    - [7, 11086.0]
  - - [2944, 5888, 1, 3328, 2944, 2944, 2944, 3328]
    - [16, 12631.0]
  - - [6784, 5888, 1, 1280, 6784, 6784, 6784, 1280]
    - [1, 12670.0]
  - - [5888, 4288, 1, 1280, 5888, 5888, 5888, 1280]
    - [1, 12348.0]
  - - [1024, 24000, 1, 2048, 1024, 1024, 1024, 2048]
    - [8, 12471.0]
  - - [5888, 3584, 1, 128, 5888, 5888, 5888, 128]
    - [8, 11880.0]
  - - [6784, 6784, 1, 3328, 6784, 6784, 6784, 3328]
    - [22, 12642.0]
  - - [704, 3584, 1, 128, 704, 704, 704, 128]
    - [35, 9460.0]
  - - [5888, 448, 1, 3328, 5888, 5888, 5888, 3328]
    - [15, 11121.0]
  - - [2368, 4288, 1, 1280, 2368, 2368, 2368, 1280]
    - [1, 11810.0]
  - - [4288, 2944, 1, 128, 4288, 4288, 4288, 128]
    - [0, 11365.0]
  - - [5056, 2944, 1, 3328, 5056, 5056, 5056, 3328]
    - [1, 12492.0]
  - - [2944, 3584, 1, 256, 2944, 2944, 2944, 256]
    - [1, 11950.0]
  - - [1408, 1408, 1, 3328, 1408, 1408, 1408, 3328]
    - [15, 10854.0]
  - - [3584, 3584, 1, 128, 3584, 3584, 3584, 128]
    - [36, 11626.0]
  - - [3584, 704, 1, 256, 3584, 3584, 3584, 256]
    - [15, 10871.0]
  - - [3584, 1408, 1, 3328, 3584, 3584, 3584, 3328]
    - [1, 12027.0]
  - - [704, 3584, 1, 1280, 704, 704, 704, 1280]
    - [15, 10493.0]
  - - [1024, 1408, 1, 128, 1024, 1024, 1024, 128]
    - [7, 9796.0]
  - - [1856, 6784, 1, 256, 1856, 1856, 1856, 256]
    - [16, 11728.0]
  - - [4288, 448, 1, 3328, 4288, 4288, 4288, 3328]
    - [0, 11301.0]
  - - [6784, 4288, 1, 128, 6784, 6784, 6784, 128]
    - [16, 11772.0]
  - - [6784, 704, 1, 1280, 6784, 6784, 6784, 1280]
    - [15, 11455.0]
  - - [3584, 6784, 1, 256, 3584, 3584, 3584, 256]
    - [22, 12241.0]
  - - [5888, 1024, 1, 3328, 5888, 5888, 5888, 3328]
    - [1, 12136.0]
  - - [704, 6784, 1, 1280, 704, 704, 704, 1280]
    - [8, 11267.0]
  - - [1856, 5056, 1, 3328, 1856, 1856, 1856, 3328]
    - [16, 12014.0]
  - - [1024, 3584, 1, 128, 1024, 1024, 1024, 128]
    - [7, 10784.0]
  - - [2368, 2944, 1, 128, 2368, 2368, 2368, 128]
    - [8, 11104.0]
  - - [5888, 2944, 1, 3328, 5888, 5888, 5888, 3328]
    - [1, 12624.0]
  - - [1408, 2368, 1, 128, 1408, 1408, 1408, 128]
    - [28, 10734.0]
  - - [5888, 2368, 1, 128, 5888, 5888, 5888, 128]
    - [15, 11598.0]
  - - [3584, 6784, 1, 1280, 3584, 3584, 3584, 1280]
    - [1, 12526.0]
  - - [4288, 1856, 1, 256, 4288, 4288, 4288, 256]
    - [7, 11333.0]
  - - [1856, 5888, 1, 256, 1856, 1856, 1856, 256]
    - [22, 11656.0]
  - - [4288, 4288, 1, 3328, 4288, 4288, 4288, 3328]
    - [16, 12259.0]
  - - [4288, 1408, 1, 1280, 4288, 4288, 4288, 1280]
    - [16, 12041.0]
  - - [3584, 5056, 1, 128, 3584, 3584, 3584, 128]
    - [0, 11693.0]
  - - [4288, 2368, 1, 256, 4288, 4288, 4288, 256]
    - [35, 11497.0]
  - - [2944, 5056, 1, 1280, 2944, 2944, 2944, 1280]
    - [16, 12441.0]
  - - [448, 6784, 1, 256, 448, 448, 448, 256]
    - [15, 9544.0]
  - - [1856, 2368, 1, 128, 1856, 1856, 1856, 128]
    - [7, 10732.0]
  - - [6784, 2368, 1, 3328, 6784, 6784, 6784, 3328]
    - [16, 12157.0]
  - - [1408, 6784, 1, 128, 1408, 1408, 1408, 128]
    - [22, 11427.0]
  - - [4288, 1856, 1, 3328, 4288, 4288, 4288, 3328]
    - [1, 11773.0]
  - - [3584, 448, 1, 128, 3584, 3584, 3584, 128]
    - [15, 9900.0]
  - - [3584, 1024, 1, 1280, 3584, 3584, 3584, 1280]
    - [1, 11534.0]
  - - [1856, 5056, 1, 256, 1856, 1856, 1856, 256]
    - [16, 11538.0]
  - - [6784, 4288, 1, 3328, 6784, 6784, 6784, 3328]
    - [22, 12379.0]
  - - [1024, 4288, 1, 256, 1024, 1024, 1024, 256]
    - [28, 11377.0]
  - - [5888, 3584, 1, 3328, 5888, 5888, 5888, 3328]
    - [1, 12567.0]
  - - [5056, 3584, 1, 3328, 5056, 5056, 5056, 3328]
    - [1, 12514.0]
  - - [2368, 1408, 1, 1280, 2368, 2368, 2368, 1280]
    - [29, 11293.0]
  - - [5056, 2944, 1, 1280, 5056, 5056, 5056, 1280]
    - [1, 12436.0]
  - - [8448, 6000, 1, 2816, 8448, 8448, 8448, 2816]
    - [22, 12603.0]
  - - [3584, 2944, 1, 1280, 3584, 3584, 3584, 1280]
    - [1, 12295.0]
  - - [1024, 6784, 1, 256, 1024, 1024, 1024, 256]
    - [1, 11662.0]
  - - [6784, 448, 1, 256, 6784, 6784, 6784, 256]
    - [15, 11090.0]
  - - [5124, 9124, 1, 2048, 5124, 5124, 5124, 2048]
    - [1, 12232.0]
  - - [2944, 5056, 1, 3328, 2944, 2944, 2944, 3328]
    - [16, 12477.0]
  - - [2944, 1408, 1, 128, 2944, 2944, 2944, 128]
    - [28, 10877.0]
  - - [5056, 6784, 1, 3328, 5056, 5056, 5056, 3328]
    - [1, 12538.0]
  - - [704, 2368, 1, 128, 704, 704, 704, 128]
    - [15, 8774.0]
  - - [3072, 1500, 1, 1024, 3072, 3072, 3072, 1024]
    - [8, 11528.0]
  - - [3584, 4288, 1, 256, 3584, 3584, 3584, 256]
    - [22, 11948.0]
  - - [1856, 6784, 1, 3328, 1856, 1856, 1856, 3328]
    - [1, 12114.0]
  - - [5888, 4288, 1, 256, 5888, 5888, 5888, 256]
    - [1, 12063.0]
  - - [5056, 1408, 1, 256, 5056, 5056, 5056, 256]
    - [8, 11718.0]
  - - [3584, 1024, 1, 256, 3584, 3584, 3584, 256]
    - [15, 11161.0]
  - - [512, 6000, 1, 1536, 512, 512, 512, 1536]
    - [7, 11464.0]
  - - [5888, 5888, 1, 256, 5888, 5888, 5888, 256]
    - [1, 12369.0]
  - - [4288, 1024, 1, 1280, 4288, 4288, 4288, 1280]
    - [16, 11768.0]
  - - [448, 6784, 1, 3328, 448, 448, 448, 3328]
    - [36, 10364.0]
  - - [2944, 1408, 1, 1280, 2944, 2944, 2944, 1280]
    - [1, 12007.0]
  - - [3072, 6000, 1, 1024, 3072, 3072, 3072, 1024]
    - [1, 12413.0]
  - - [2944, 1856, 1, 3328, 2944, 2944, 2944, 3328]
    - [1, 11626.0]
  - - [3584, 5888, 1, 1280, 3584, 3584, 3584, 1280]
    - [1, 12533.0]
  - - [6784, 1856, 1, 1280, 6784, 6784, 6784, 1280]
    - [1, 12099.0]
  - - [2944, 5056, 1, 256, 2944, 2944, 2944, 256]
    - [1, 12053.0]
  - - [5888, 256, 1, 3328, 5888, 5888, 5888, 3328]
    - [1, 10956.0]
  - - [2944, 4288, 1, 128, 2944, 2944, 2944, 128]
    - [0, 11577.0]
  - - [3584, 1408, 1, 256, 3584, 3584, 3584, 256]
    - [1, 11504.0]
  - - [704, 3584, 1, 3328, 704, 704, 704, 3328]
    - [28, 10568.0]
  - - [5056, 448, 1, 1280, 5056, 5056, 5056, 1280]
    - [0, 11388.0]
  - - [3584, 1856, 1, 3328, 3584, 3584, 3584, 3328]
    - [1, 12110.0]
  - - [4288, 6784, 1, 1280, 4288, 4288, 4288, 1280]
    - [1, 12382.0]
  - - [1024, 3000, 1, 2048, 1024, 1024, 1024, 2048]
    - [21, 11497.0]
  - - [2944, 1024, 1, 256, 2944, 2944, 2944, 256]
    - [0, 11034.0]
  - - [2368, 4288, 1, 3328, 2368, 2368, 2368, 3328]
    - [1, 11863.0]
  - - [1024, 1408, 1, 1280, 1024, 1024, 1024, 1280]
    - [28, 10967.0]
  - - [6784, 5056, 1, 256, 6784, 6784, 6784, 256]
    - [1, 12247.0]
  - - [1856, 1856, 1, 128, 1856, 1856, 1856, 128]
    - [0, 10404.0]
  - - [4288, 5888, 1, 256, 4288, 4288, 4288, 256]
    - [16, 12091.0]
  - - [2944, 6784, 1, 256, 2944, 2944, 2944, 256]
    - [29, 12331.0]
  - - [2944, 2944, 1, 128, 2944, 2944, 2944, 128]
    - [28, 11458.0]
  - - [1856, 3584, 1, 1280, 1856, 1856, 1856, 1280]
    - [16, 12063.0]
  - - [3584, 1408, 1, 1280, 3584, 3584, 3584, 1280]
    - [1, 11980.0]
  - - [4288, 448, 1, 128, 4288, 4288, 4288, 128]
    - [0, 9796.0]
  - - [5056, 256, 1, 1280, 5056, 5056, 5056, 1280]
    - [1, 11454.0]
  - - [1856, 1408, 1, 3328, 1856, 1856, 1856, 3328]
    - [28, 10972.0]
  - - [1024, 4288, 1, 3328, 1024, 1024, 1024, 3328]
    - [22, 11893.0]
  - - [5056, 448, 1, 256, 5056, 5056, 5056, 256]
    - [7, 10875.0]
  - - [2944, 2368, 1, 3328, 2944, 2944, 2944, 3328]
    - [16, 12136.0]
  - - [704, 4288, 1, 3328, 704, 704, 704, 3328]
    - [22, 10381.0]
  - - [1024, 1856, 1, 1280, 1024, 1024, 1024, 1280]
    - [1, 11323.0]
  - - [6784, 1856, 1, 256, 6784, 6784, 6784, 256]
    - [16, 11734.0]
  - - [512, 48000, 1, 2816, 512, 512, 512, 2816]
    - [8, 12589.0]
  - - [512, 3000, 1, 2816, 512, 512, 512, 2816]
    - [36, 11045.0]
  - - [1024, 5888, 1, 256, 1024, 1024, 1024, 256]
    - [1, 11600.0]
  - - [6784, 1408, 1, 256, 6784, 6784, 6784, 256]
    - [1, 11943.0]
  - - [1408, 2368, 1, 256, 1408, 1408, 1408, 256]
    - [15, 11085.0]
  - - [1408, 1408, 1, 256, 1408, 1408, 1408, 256]
    - [28, 10421.0]
  - - [2368, 2368, 1, 128, 2368, 2368, 2368, 128]
    - [15, 10859.0]
  - - [6784, 1408, 1, 128, 6784, 6784, 6784, 128]
    - [36, 11545.0]
  - - [1408, 5056, 1, 256, 1408, 1408, 1408, 256]
    - [16, 11802.0]
  - - [512, 50176, 1, 128, 512, 512, 512, 128]
    - [0, 11708.0]
  - - [4288, 3584, 1, 128, 4288, 4288, 4288, 128]
    - [8, 11574.0]
  - - [3584, 5056, 1, 1280, 3584, 3584, 3584, 1280]
    - [16, 12451.0]
  - - [1856, 1024, 1, 128, 1856, 1856, 1856, 128]
    - [7, 9444.0]
  - - [1024, 24000, 1, 1536, 1024, 1024, 1024, 1536]
    - [8, 12478.0]
  - - [704, 4288, 1, 256, 704, 704, 704, 256]
    - [15, 9933.0]
  - - [5888, 2368, 1, 1280, 5888, 5888, 5888, 1280]
    - [1, 12186.0]
  - - [6784, 1856, 1, 3328, 6784, 6784, 6784, 3328]
    - [1, 12126.0]
  - - [2368, 5888, 1, 1280, 2368, 2368, 2368, 1280]
    - [1, 12186.0]
  - - [5888, 256, 1, 1280, 5888, 5888, 5888, 1280]
    - [1, 10804.0]
  - - [2368, 1856, 1, 3328, 2368, 2368, 2368, 3328]
    - [15, 11299.0]
  - - [2944, 704, 1, 256, 2944, 2944, 2944, 256]
    - [0, 10855.0]
  - - [2368, 1024, 1, 3328, 2368, 2368, 2368, 3328]
    - [20, 11339.0]
  - - [704, 3584, 1, 256, 704, 704, 704, 256]
    - [15, 10137.0]
  - - [704, 2944, 1, 3328, 704, 704, 704, 3328]
    - [22, 10964.0]
  - - [6784, 1024, 1, 128, 6784, 6784, 6784, 128]
    - [28, 11333.0]
  - - [2944, 1024, 1, 3328, 2944, 2944, 2944, 3328]
    - [1, 11406.0]
  - - [2944, 5056, 1, 128, 2944, 2944, 2944, 128]
    - [35, 11622.0]
  - - [1408, 6784, 1, 256, 1408, 1408, 1408, 256]
    - [1, 11922.0]
  - - [6784, 1408, 1, 3328, 6784, 6784, 6784, 3328]
    - [1, 12231.0]
  - - [4288, 6784, 1, 128, 4288, 4288, 4288, 128]
    - [16, 11812.0]
  - - [1408, 2944, 1, 128, 1408, 1408, 1408, 128]
    - [15, 10873.0]
  - - [6784, 2944, 1, 1280, 6784, 6784, 6784, 1280]
    - [1, 12626.0]
  - - [4288, 1856, 1, 128, 4288, 4288, 4288, 128]
    - [7, 11104.0]
  - - [1856, 2944, 1, 128, 1856, 1856, 1856, 128]
    - [0, 10827.0]
  - - [6784, 448, 1, 128, 6784, 6784, 6784, 128]
    - [28, 10836.0]
  - - [448, 5056, 1, 1280, 448, 448, 448, 1280]
    - [22, 10381.0]
  - - [4288, 5056, 1, 1280, 4288, 4288, 4288, 1280]
    - [16, 12294.0]
  - - [2368, 1856, 1, 128, 2368, 2368, 2368, 128]
    - [15, 10675.0]
  - - [4288, 704, 1, 256, 4288, 4288, 4288, 256]
    - [7, 10934.0]
  - - [5888, 704, 1, 256, 5888, 5888, 5888, 256]
    - [15, 11208.0]
  - - [3584, 1024, 1, 128, 3584, 3584, 3584, 128]
    - [0, 10925.0]
  - - [256, 5888, 1, 3328, 256, 256, 256, 3328]
    - [4, 10792.0]
  - - [1408, 4288, 1, 3328, 1408, 1408, 1408, 3328]
    - [16, 12133.0]
  - - [6784, 4288, 1, 256, 6784, 6784, 6784, 256]
    - [8, 12122.0]
  - - [5888, 256, 1, 256, 5888, 5888, 5888, 256]
    - [28, 10038.0]
  - - [6784, 1024, 1, 1280, 6784, 6784, 6784, 1280]
    - [1, 12092.0]
  - - [5888, 1024, 1, 128, 5888, 5888, 5888, 128]
    - [15, 11353.0]
  - - [6784, 3584, 1, 1280, 6784, 6784, 6784, 1280]
    - [1, 12538.0]
  - - [1024, 6784, 1, 1280, 1024, 1024, 1024, 1280]
    - [1, 12032.0]
  - - [1408, 2944, 1, 1280, 1408, 1408, 1408, 1280]
    - [16, 12017.0]
  - - [1408, 2368, 1, 3328, 1408, 1408, 1408, 3328]
    - [16, 11468.0]
  - - [2944, 1856, 1, 128, 2944, 2944, 2944, 128]
    - [0, 11180.0]
  - - [256, 6784, 1, 128, 256, 256, 256, 128]
    - [15, 10050.0]
  - - [5056, 6784, 1, 128, 5056, 5056, 5056, 128]
    - [16, 11786.0]
  - - [4288, 5056, 1, 128, 4288, 4288, 4288, 128]
    - [8, 11585.0]
  - - [1856, 5888, 1, 128, 1856, 1856, 1856, 128]
    - [29, 11117.0]
  - - [3584, 1856, 1, 256, 3584, 3584, 3584, 256]
    - [0, 11504.0]
  - - [4288, 3584, 1, 1280, 4288, 4288, 4288, 1280]
    - [1, 12318.0]
  - - [704, 5888, 1, 128, 704, 704, 704, 128]
    - [15, 10007.0]
  - - [6784, 3584, 1, 128, 6784, 6784, 6784, 128]
    - [29, 11982.0]
  - - [5124, 1500, 1, 2048, 5124, 5124, 5124, 2048]
    - [1, 11758.0]
  - - [4288, 5056, 1, 3328, 4288, 4288, 4288, 3328]
    - [1, 12330.0]
  - - [1408, 1408, 1, 128, 1408, 1408, 1408, 128]
    - [28, 9943.0]
  - - [5056, 2368, 1, 256, 5056, 5056, 5056, 256]
    - [1, 11667.0]
  - - [4288, 704, 1, 3328, 4288, 4288, 4288, 3328]
    - [28, 11353.0]
  - - [448, 3584, 1, 256, 448, 448, 448, 256]
    - [15, 8983.0]
  - - [2368, 1024, 1, 1280, 2368, 2368, 2368, 1280]
    - [1, 11226.0]
  - - [2944, 1408, 1, 3328, 2944, 2944, 2944, 3328]
    - [1, 12130.0]
  - - [6144, 1500, 1, 2560, 6144, 6144, 6144, 2560]
    - [1, 12183.0]
  - - [1024, 1408, 1, 3328, 1024, 1024, 1024, 3328]
    - [28, 11131.0]
  - - [2944, 5888, 1, 1280, 2944, 2944, 2944, 1280]
    - [1, 12592.0]
  - - [5888, 3584, 1, 256, 5888, 5888, 5888, 256]
    - [1, 12226.0]
  - - [2368, 5056, 1, 128, 2368, 2368, 2368, 128]
    - [28, 11207.0]
  - - [1408, 1856, 1, 3328, 1408, 1408, 1408, 3328]
    - [28, 11632.0]
  - - [5888, 5056, 1, 3328, 5888, 5888, 5888, 3328]
    - [1, 12525.0]
  - - [7680, 6000, 1, 2560, 7680, 7680, 7680, 2560]
    - [1, 12648.0]
  - - [6784, 1408, 1, 1280, 6784, 6784, 6784, 1280]
    - [1, 12240.0]
  - - [512, 3000, 1, 2560, 512, 512, 512, 2560]
    - [36, 11047.0]
  - - [704, 2944, 1, 256, 704, 704, 704, 256]
    - [15, 10000.0]
  - - [6784, 5888, 1, 3328, 6784, 6784, 6784, 3328]
    - [16, 12666.0]
  - - [2368, 4288, 1, 128, 2368, 2368, 2368, 128]
    - [15, 11154.0]
  - - [1024, 6784, 1, 128, 1024, 1024, 1024, 128]
    - [0, 11307.0]
  - - [1024, 1500, 1, 1536, 1024, 1024, 1024, 1536]
    - [8, 10956.0]
  - - [1408, 1408, 1, 1280, 1408, 1408, 1408, 1280]
    - [35, 10760.0]
  - - [3072, 3000, 1, 1024, 3072, 3072, 3072, 1024]
    - [1, 12095.0]
  - - [448, 4288, 1, 3328, 448, 448, 448, 3328]
    - [16, 10178.0]
  - - [2368, 1408, 1, 256, 2368, 2368, 2368, 256]
    - [0, 10979.0]
  - - [704, 2368, 1, 256, 704, 704, 704, 256]
    - [15, 9446.0]
  - - [1024, 24000, 1, 2560, 1024, 1024, 1024, 2560]
    - [8, 12494.0]
  - - [5888, 2368, 1, 3328, 5888, 5888, 5888, 3328]
    - [1, 12233.0]
  - - [5124, 9124, 1, 1760, 5124, 5124, 5124, 1760]
    - [1, 12251.0]
  - - [4288, 448, 1, 1280, 4288, 4288, 4288, 1280]
    - [0, 11177.0]
  - - [5888, 704, 1, 3328, 5888, 5888, 5888, 3328]
    - [15, 11470.0]
  - - [5056, 256, 1, 128, 5056, 5056, 5056, 128]
    - [7, 9184.0]
  - - [1024, 6784, 1, 3328, 1024, 1024, 1024, 3328]
    - [8, 12093.0]
  - - [1408, 5888, 1, 128, 1408, 1408, 1408, 128]
    - [15, 11391.0]
  - - [512, 3136, 1, 2048, 512, 512, 512, 2048]
    - [8, 11389.0]
  - - [1408, 1024, 1, 256, 1408, 1408, 1408, 256]
    - [0, 10540.0]
  - - [8448, 1500, 1, 2816, 8448, 8448, 8448, 2816]
    - [16, 12184.0]
  - - [2560, 7000, 1, 2560, 2560, 2560, 2560, 2560]
    - [22, 12550.0]
  - - [5056, 6784, 1, 1280, 5056, 5056, 5056, 1280]
    - [16, 12506.0]
  - - [704, 5056, 1, 3328, 704, 704, 704, 3328]
    - [22, 11171.0]
  - - [3584, 5056, 1, 3328, 3584, 3584, 3584, 3328]
    - [1, 12498.0]
  - - [2368, 2944, 1, 3328, 2368, 2368, 2368, 3328]
    - [1, 12134.0]
  - - [2368, 3584, 1, 256, 2368, 2368, 2368, 256]
    - [1, 11583.0]
  - - [4608, 3000, 1, 1536, 4608, 4608, 4608, 1536]
    - [1, 12103.0]
  - - [5056, 3584, 1, 1280, 5056, 5056, 5056, 1280]
    - [16, 12444.0]
  - - [5124, 9124, 1, 4096, 5124, 5124, 5124, 4096]
    - [1, 12225.0]
  - - [7680, 48000, 1, 2560, 7680, 7680, 7680, 2560]
    - [1, 12684.0]
  - - [1856, 2944, 1, 1280, 1856, 1856, 1856, 1280]
    - [16, 11529.0]
  - - [4608, 1500, 1, 1536, 4608, 4608, 4608, 1536]
    - [1, 11997.0]
  - - [1024, 48000, 1, 2816, 1024, 1024, 1024, 2816]
    - [16, 12659.0]
  - - [5124, 9124, 1, 2560, 5124, 5124, 5124, 2560]
    - [1, 12234.0]
  - - [2944, 1408, 1, 256, 2944, 2944, 2944, 256]
    - [1, 11418.0]
  - - [4288, 1408, 1, 3328, 4288, 4288, 4288, 3328]
    - [1, 12148.0]
  - - [5888, 2944, 1, 128, 5888, 5888, 5888, 128]
    - [8, 11861.0]
  - - [2944, 1024, 1, 128, 2944, 2944, 2944, 128]
    - [28, 10660.0]
  - - [5124, 700, 1, 2048, 5124, 5124, 5124, 2048]
    - [15, 11114.0]
  - - [6784, 5056, 1, 128, 6784, 6784, 6784, 128]
    - [36, 11859.0]
  - - [256, 12544, 1, 1024, 256, 256, 256, 1024]
    - [22, 11770.0]
  - - [5888, 1408, 1, 3328, 5888, 5888, 5888, 3328]
    - [1, 12255.0]
  - - [2368, 1856, 1, 256, 2368, 2368, 2368, 256]
    - [15, 10930.0]
  - - [256, 5056, 1, 256, 256, 256, 256, 256]
    - [21, 10440.0]
  - - [5056, 5056, 1, 128, 5056, 5056, 5056, 128]
    - [36, 11572.0]
  - - [448, 3584, 1, 3328, 448, 448, 448, 3328]
    - [20, 9873.0]
  - - [5888, 256, 1, 128, 5888, 5888, 5888, 128]
    - [15, 9657.0]
  - - [3584, 1856, 1, 128, 3584, 3584, 3584, 128]
    - [28, 11298.0]
  - - [4288, 4288, 1, 128, 4288, 4288, 4288, 128]
    - [36, 11506.0]
  - - [1856, 1024, 1, 3328, 1856, 1856, 1856, 3328]
    - [6, 11642.0]
  - - [1856, 4288, 1, 128, 1856, 1856, 1856, 128]
    - [28, 10921.0]
  - - [1024, 6000, 1, 2560, 1024, 1024, 1024, 2560]
    - [22, 12236.0]
  - - [1024, 5056, 1, 256, 1024, 1024, 1024, 256]
    - [16, 11361.0]
  - - [5056, 5888, 1, 128, 5056, 5056, 5056, 128]
    - [1, 11672.0]
  - - [2368, 1408, 1, 3328, 2368, 2368, 2368, 3328]
    - [8, 11451.0]
  - - [1024, 48000, 1, 1536, 1024, 1024, 1024, 1536]
    - [8, 12618.0]
  - - [5888, 448, 1, 256, 5888, 5888, 5888, 256]
    - [28, 10638.0]
  - - [5888, 6784, 1, 128, 5888, 5888, 5888, 128]
    - [8, 12088.0]
  - - [6784, 5056, 1, 1280, 6784, 6784, 6784, 1280]
    - [1, 12506.0]
  - - [5056, 704, 1, 1280, 5056, 5056, 5056, 1280]
    - [0, 11465.0]
  - - [1024, 48000, 1, 2560, 1024, 1024, 1024, 2560]
    - [8, 12649.0]
  - - [1024, 2368, 1, 128, 1024, 1024, 1024, 128]
    - [15, 7713.0]
  - - [3072, 48000, 1, 1024, 3072, 3072, 3072, 1024]
    - [11, 12515.0]
  - - [1024, 5888, 1, 128, 1024, 1024, 1024, 128]
    - [7, 10959.0]
  - - [3584, 5888, 1, 128, 3584, 3584, 3584, 128]
    - [39, 11827.0]
  - - [5056, 5888, 1, 256, 5056, 5056, 5056, 256]
    - [29, 12179.0]
  - - [2368, 1024, 1, 256, 2368, 2368, 2368, 256]
    - [0, 10332.0]
  - - [2944, 1856, 1, 256, 2944, 2944, 2944, 256]
    - [28, 11380.0]
  - - [1856, 6784, 1, 1280, 1856, 1856, 1856, 1280]
    - [16, 12073.0]
  - - [8448, 3000, 1, 2816, 8448, 8448, 8448, 2816]
    - [1, 12244.0]
  - - [6784, 448, 1, 3328, 6784, 6784, 6784, 3328]
    - [15, 11408.0]
  - - [5056, 1856, 1, 1280, 5056, 5056, 5056, 1280]
    - [1, 11960.0]
  - - [1408, 1024, 1, 3328, 1408, 1408, 1408, 3328]
    - [15, 11070.0]
  - - [7680, 1500, 1, 2560, 7680, 7680, 7680, 2560]
    - [1, 12218.0]
  - - [5888, 3584, 1, 1280, 5888, 5888, 5888, 1280]
    - [1, 12490.0]
  - - [1856, 3584, 1, 3328, 1856, 1856, 1856, 3328]
    - [16, 12042.0]
  - - [1024, 2944, 1, 256, 1024, 1024, 1024, 256]
    - [7, 10815.0]
  - - [448, 6784, 1, 1280, 448, 448, 448, 1280]
    - [22, 10285.0]
  - - [704, 5056, 1, 256, 704, 704, 704, 256]
    - [0, 10292.0]
  - - [3584, 1024, 1, 3328, 3584, 3584, 3584, 3328]
    - [1, 11589.0]
  - - [2944, 1856, 1, 1280, 2944, 2944, 2944, 1280]
    - [28, 11557.0]
  - - [5056, 256, 1, 256, 5056, 5056, 5056, 256]
    - [5, 10342.0]
  - - [2944, 4288, 1, 3328, 2944, 2944, 2944, 3328]
    - [8, 12140.0]
  - - [2368, 3584, 1, 3328, 2368, 2368, 2368, 3328]
    - [22, 12005.0]
  - - [2944, 704, 1, 1280, 2944, 2944, 2944, 1280]
    - [28, 11145.0]
  - - [2944, 3584, 1, 1280, 2944, 2944, 2944, 1280]
    - [1, 12246.0]
  - - [1856, 5888, 1, 1280, 1856, 1856, 1856, 1280]
    - [16, 11946.0]
  - - [4608, 24000, 1, 1536, 4608, 4608, 4608, 1536]
    - [1, 12618.0]
  - - [4288, 1408, 1, 256, 4288, 4288, 4288, 256]
    - [7, 11145.0]
  - - [5888, 1408, 1, 128, 5888, 5888, 5888, 128]
    - [28, 11362.0]
  - - [4288, 2368, 1, 1280, 4288, 4288, 4288, 1280]
    - [1, 11813.0]
  - - [6784, 2368, 1, 256, 6784, 6784, 6784, 256]
    - [1, 11844.0]
  - - [1024, 24000, 1, 2816, 1024, 1024, 1024, 2816]
    - [8, 12488.0]
  - - [1856, 2944, 1, 256, 1856, 1856, 1856, 256]
    - [1, 11007.0]
  - - [5056, 1024, 1, 128, 5056, 5056, 5056, 128]
    - [8, 11172.0]
  - - [7680, 3000, 1, 2560, 7680, 7680, 7680, 2560]
    - [1, 12350.0]
  - - [4224, 1500, 1, 176, 4224, 4224, 4224, 176]
    - [28, 11085.0]
  - - [5124, 700, 1, 2560, 5124, 5124, 5124, 2560]
    - [15, 11143.0]
  - - [6784, 256, 1, 128, 6784, 6784, 6784, 128]
    - [28, 9915.0]
  - - [5888, 704, 1, 128, 5888, 5888, 5888, 128]
    - [7, 10841.0]
  - - [1024, 4288, 1, 1280, 1024, 1024, 1024, 1280]
    - [1, 11680.0]
  - - [2368, 5056, 1, 3328, 2368, 2368, 2368, 3328]
    - [16, 12032.0]
  - - [4288, 1024, 1, 3328, 4288, 4288, 4288, 3328]
    - [1, 11886.0]
  - - [6144, 48000, 1, 2560, 6144, 6144, 6144, 2560]
    - [1, 12551.0]
  - - [1024, 5056, 1, 3328, 1024, 1024, 1024, 3328]
    - [22, 12181.0]
  - - [1024, 1856, 1, 3328, 1024, 1024, 1024, 3328]
    - [1, 11504.0]
  - - [5124, 1500, 1, 2560, 5124, 5124, 5124, 2560]
    - [1, 11731.0]
  - - [4288, 6784, 1, 256, 4288, 4288, 4288, 256]
    - [36, 12121.0]
  - - [3584, 2944, 1, 3328, 3584, 3584, 3584, 3328]
    - [1, 12335.0]
  - - [5888, 2944, 1, 256, 5888, 5888, 5888, 256]
    - [16, 12242.0]
  - - [448, 4288, 1, 1280, 448, 448, 448, 1280]
    - [16, 9979.0]
  - - [1024, 4288, 1, 128, 1024, 1024, 1024, 128]
    - [7, 10918.0]
  - - [5056, 4288, 1, 256, 5056, 5056, 5056, 256]
    - [16, 11871.0]
  - - [1024, 3584, 1, 256, 1024, 1024, 1024, 256]
    - [15, 11129.0]
  - - [448, 5888, 1, 1280, 448, 448, 448, 1280]
    - [7, 9859.0]
  - - [512, 3000, 1, 2048, 512, 512, 512, 2048]
    - [8, 10998.0]
  - - [5056, 448, 1, 128, 5056, 5056, 5056, 128]
    - [35, 8899.0]
  - - [4288, 704, 1, 1280, 4288, 4288, 4288, 1280]
    - [28, 11272.0]
  - - [3584, 2944, 1, 128, 3584, 3584, 3584, 128]
    - [28, 11361.0]
  - - [6784, 256, 1, 1280, 6784, 6784, 6784, 1280]
    - [28, 11025.0]
  - - [2368, 5888, 1, 3328, 2368, 2368, 2368, 3328]
    - [1, 12156.0]
  - - [2368, 1856, 1, 1280, 2368, 2368, 2368, 1280]
    - [28, 11229.0]
  - - [448, 5056, 1, 3328, 448, 448, 448, 3328]
    - [6, 10514.0]
  - - [3584, 4288, 1, 128, 3584, 3584, 3584, 128]
    - [15, 11528.0]
  - - [1024, 6000, 1, 2816, 1024, 1024, 1024, 2816]
    - [19, 12141.0]
  - - [5888, 4288, 1, 3328, 5888, 5888, 5888, 3328]
    - [8, 12346.0]
  - - [2368, 704, 1, 256, 2368, 2368, 2368, 256]
    - [0, 9861.0]
  - - [3584, 1408, 1, 128, 3584, 3584, 3584, 128]
    - [7, 11087.0]
  - - [1856, 5056, 1, 1280, 1856, 1856, 1856, 1280]
    - [16, 11948.0]
  - - [2944, 1024, 1, 1280, 2944, 2944, 2944, 1280]
    - [28, 11270.0]
  - - [3584, 5888, 1, 3328, 3584, 3584, 3584, 3328]
    - [1, 12511.0]
  - - [2368, 4288, 1, 256, 2368, 2368, 2368, 256]
    - [28, 11305.0]
  - - [1024, 2368, 1, 3328, 1024, 1024, 1024, 3328]
    - [7, 11447.0]
  - - [1024, 2944, 1, 128, 1024, 1024, 1024, 128]
    - [28, 9754.0]
  - - [1024, 3584, 1, 1280, 1024, 1024, 1024, 1280]
    - [15, 11233.0]
  - - [4288, 5888, 1, 3328, 4288, 4288, 4288, 3328]
    - [1, 12364.0]
  - - [1024, 2944, 1, 3328, 1024, 1024, 1024, 3328]
    - [1, 11368.0]
  - - [256, 6784, 1, 1280, 256, 256, 256, 1280]
    - [7, 10745.0]
  - - [1856, 3584, 1, 256, 1856, 1856, 1856, 256]
    - [29, 11354.0]
  - - [6784, 1856, 1, 128, 6784, 6784, 6784, 128]
    - [28, 11570.0]
  - - [1024, 1500, 1, 2048, 1024, 1024, 1024, 2048]
    - [22, 10920.0]
  - - [512, 24000, 1, 2816, 512, 512, 512, 2816]
    - [36, 12362.0]
  - - [256, 5888, 1, 1280, 256, 256, 256, 1280]
    - [22, 10728.0]
  - - [4288, 6784, 1, 3328, 4288, 4288, 4288, 3328]
    - [1, 12380.0]
  - - [2368, 1408, 1, 128, 2368, 2368, 2368, 128]
    - [21, 10065.0]
  - - [1408, 1024, 1, 128, 1408, 1408, 1408, 128]
    - [21, 9642.0]
  - - [6784, 3584, 1, 3328, 6784, 6784, 6784, 3328]
    - [1, 12534.0]
  - - [1760, 7000, 1, 1760, 1760, 1760, 1760, 1760]
    - [16, 12164.0]
  - - [2368, 5056, 1, 1280, 2368, 2368, 2368, 1280]
    - [16, 12079.0]
  - - [1408, 2368, 1, 1280, 1408, 1408, 1408, 1280]
    - [28, 11318.0]
  - - [704, 4288, 1, 128, 704, 704, 704, 128]
    - [28, 9675.0]
  - - [2944, 2944, 1, 256, 2944, 2944, 2944, 256]
    - [16, 11854.0]
  - - [6784, 256, 1, 256, 6784, 6784, 6784, 256]
    - [28, 10591.0]
  - - [256, 5056, 1, 3328, 256, 256, 256, 3328]
    - [12, 11336.0]
  - - [5056, 1856, 1, 128, 5056, 5056, 5056, 128]
    - [15, 10356.0]
  - - [1024, 3000, 1, 1536, 1024, 1024, 1024, 1536]
    - [7, 11447.0]
  - - [5056, 1024, 1, 3328, 5056, 5056, 5056, 3328]
    - [8, 12226.0]
  - - [4288, 3584, 1, 3328, 4288, 4288, 4288, 3328]
    - [1, 12332.0]
  - - [1024, 2368, 1, 1280, 1024, 1024, 1024, 1280]
    - [15, 11349.0]
  - - [5888, 6784, 1, 3328, 5888, 5888, 5888, 3328]
    - [1, 12619.0]
  - - [704, 4288, 1, 1280, 704, 704, 704, 1280]
    - [7, 10244.0]
  - - [128, 50176, 1, 512, 128, 128, 128, 512]
    - [11, 11636.0]
  - - [1024, 48000, 1, 2048, 1024, 1024, 1024, 2048]
    - [4, 12555.0]
  - - [4288, 1024, 1, 128, 4288, 4288, 4288, 128]
    - [7, 10313.0]
  - - [784, 128, 128, 512, 784, 784, 784, 512]
    - [32, 10578.0]
  - - [784, 512, 256, 128, 784, 784, 784, 128]
    - [4, 10486.0]
  - - [3136, 256, 256, 64, 3136, 3136, 3136, 64]
    - [0, 7705.0]
  - - [784, 512, 128, 128, 784, 784, 784, 128]
    - [4, 10339.0]
  - - [784, 128, 256, 512, 784, 784, 784, 512]
    - [32, 10741.0]
  - - [3136, 256, 128, 64, 3136, 3136, 3136, 64]
    - [0, 8591.0]
  - - [4096, 512, 1, 1024, 4096, 4096, 4096, 1024]
    - [15, 11249.0]
  - - [2048, 768, 1, 512, 2048, 2048, 2048, 512]
    - [8, 10939.0]
  - - [4096, 512, 1, 2048, 4096, 4096, 4096, 2048]
    - [15, 11324.0]
  - - [4096, 1024, 1, 2048, 4096, 4096, 4096, 2048]
    - [8, 11976.0]
  - - [2048, 1024, 1, 2048, 2048, 2048, 2048, 2048]
    - [15, 11133.0]
  - - [2048, 1024, 1, 4096, 2048, 2048, 2048, 4096]
    - [7, 11270.0]
  - - [4096, 1024, 1, 1024, 4096, 4096, 4096, 1024]
    - [25, 11830.0]
  - - [2048, 1024, 1, 512, 2048, 2048, 2048, 512]
    - [0, 11138.0]
  - - [4096, 1024, 1, 4096, 4096, 4096, 4096, 4096]
    - [1, 12184.0]
  - - [2048, 1024, 1, 1024, 2048, 2048, 2048, 1024]
    - [15, 11262.0]
  - - [4096, 384, 1, 2048, 4096, 4096, 4096, 2048]
    - [1, 11300.0]
  - - [1225, 192, 64, 384, 1225, 1225, 1225, 384]
    - [28, 11249.0]
  - - [289, 128, 64, 1024, 289, 289, 289, 1024]
    - [11, 8480.0]
  - - [4096, 384, 1, 1536, 4096, 4096, 4096, 1536]
    - [1, 11315.0]
  - - [289, 192, 64, 1024, 289, 289, 289, 1024]
    - [24, 8318.0]
  - - [4096, 384, 1, 1280, 4096, 4096, 4096, 1280]
    - [1, 11250.0]
  - - [4096, 448, 1, 1280, 4096, 4096, 4096, 1280]
    - [21, 10690.0]
  - - [289, 256, 64, 1024, 289, 289, 289, 1024]
    - [11, 8772.0]
  - - [4096, 448, 1, 2048, 4096, 4096, 4096, 2048]
    - [0, 10791.0]
  - - [289, 384, 64, 1024, 289, 289, 289, 1024]
    - [11, 9116.0]
  - - [1024, 3594, 1, 4096, 1024, 1024, 1024, 4096]
    - [8, 11563.0]
  - - [4096, 3103, 1, 1024, 4096, 4096, 4096, 1024]
    - [1, 12076.0]
  - - [4096, 3136, 1, 1024, 4096, 4096, 4096, 1024]
    - [1, 12287.0]
  - - [1024, 3141, 1, 4096, 1024, 1024, 1024, 4096]
    - [4, 11901.0]
  - - [4096, 3559, 1, 1024, 4096, 4096, 4096, 1024]
    - [1, 12299.0]
  - - [4096, 3368, 1, 1024, 4096, 4096, 4096, 1024]
    - [1, 11991.0]
  - - [1024, 3335, 1, 4096, 1024, 1024, 1024, 4096]
    - [4, 11515.0]
  - - [1024, 3510, 1, 4096, 1024, 1024, 1024, 4096]
    - [39, 10710.0]
  - - [4096, 3209, 1, 1024, 4096, 4096, 4096, 1024]
    - [1, 11951.0]
  - - [4096, 3322, 1, 1024, 4096, 4096, 4096, 1024]
    - [1, 12355.0]
  - - [1024, 3400, 1, 4096, 1024, 1024, 1024, 4096]
    - [8, 11823.0]
  - - [1024, 3995, 1, 4096, 1024, 1024, 1024, 4096]
    - [22, 11757.0]
  - - [1024, 3503, 1, 4096, 1024, 1024, 1024, 4096]
    - [7, 11580.0]
  - - [4096, 3594, 1, 1024, 4096, 4096, 4096, 1024]
    - [8, 11950.0]
  - - [4096, 3473, 1, 1024, 4096, 4096, 4096, 1024]
    - [1, 12102.0]
  - - [4096, 3522, 1, 1024, 4096, 4096, 4096, 1024]
    - [1, 12264.0]
  - - [1024, 3103, 1, 4096, 1024, 1024, 1024, 4096]
    - [4, 11710.0]
  - - [1024, 3214, 1, 4096, 1024, 1024, 1024, 4096]
    - [11, 10973.0]
  - - [4096, 3449, 1, 1024, 4096, 4096, 4096, 1024]
    - [1, 12240.0]
  - - [1024, 3136, 1, 4096, 1024, 1024, 1024, 4096]
    - [4, 11867.0]
  - - [1024, 3955, 1, 33708, 1024, 1024, 1024, 33708]
    - [16, 11687.0]
  - - [1024, 3780, 1, 4096, 1024, 1024, 1024, 4096]
    - [27, 12058.0]
  - - [1024, 3906, 1, 33708, 1024, 1024, 1024, 33708]
    - [16, 11530.0]
  - - [1024, 3386, 1, 4096, 1024, 1024, 1024, 4096]
    - [8, 11757.0]
  - - [4096, 3396, 1, 1024, 4096, 4096, 4096, 1024]
    - [1, 12032.0]
  - - [1024, 3183, 1, 4096, 1024, 1024, 1024, 4096]
    - [4, 12044.0]
  - - [1024, 3098, 1, 4096, 1024, 1024, 1024, 4096]
    - [39, 11540.0]
  - - [1024, 3548, 1, 4096, 1024, 1024, 1024, 4096]
    - [39, 10859.0]
  - - [1024, 3224, 1, 4096, 1024, 1024, 1024, 4096]
    - [39, 10978.0]
  - - [4096, 3469, 1, 1024, 4096, 4096, 4096, 1024]
    - [1, 12031.0]
  - - [1024, 3582, 1, 4096, 1024, 1024, 1024, 4096]
    - [6, 11495.0]
  - - [1024, 2977, 1, 4096, 1024, 1024, 1024, 4096]
    - [27, 11264.0]
  - - [1024, 3939, 1, 1024, 1024, 1024, 1024, 1024]
    - [35, 11212.0]
  - - [4096, 3176, 1, 1024, 4096, 4096, 4096, 1024]
    - [1, 12374.0]
  - - [1024, 3559, 1, 4096, 1024, 1024, 1024, 4096]
    - [6, 11398.0]
  - - [1024, 3478, 1, 4096, 1024, 1024, 1024, 4096]
    - [39, 10635.0]
  - - [4096, 3343, 1, 1024, 4096, 4096, 4096, 1024]
    - [1, 11880.0]
  - - [4096, 3440, 1, 1024, 4096, 4096, 4096, 1024]
    - [1, 12269.0]
  - - [1024, 3996, 1, 33708, 1024, 1024, 1024, 33708]
    - [1, 11788.0]
  - - [1024, 4012, 1, 4096, 1024, 1024, 1024, 4096]
    - [22, 11817.0]
  - - [1024, 3322, 1, 4096, 1024, 1024, 1024, 4096]
    - [4, 11502.0]
  - - [1024, 3990, 1, 33708, 1024, 1024, 1024, 33708]
    - [1, 11766.0]
  - - [1024, 3314, 1, 4096, 1024, 1024, 1024, 4096]
    - [8, 11519.0]
  - - [4096, 3513, 1, 1024, 4096, 4096, 4096, 1024]
    - [8, 12152.0]
  - - [1024, 3562, 1, 4096, 1024, 1024, 1024, 4096]
    - [8, 11501.0]
  - - [1024, 3443, 1, 4096, 1024, 1024, 1024, 4096]
    - [25, 11121.0]
  - - [1024, 3554, 1, 4096, 1024, 1024, 1024, 4096]
    - [25, 10821.0]
  - - [1024, 3063, 1, 4096, 1024, 1024, 1024, 4096]
    - [27, 11526.0]
  - - [4096, 3460, 1, 1024, 4096, 4096, 4096, 1024]
    - [1, 11995.0]
  - - [1024, 3209, 1, 4096, 1024, 1024, 1024, 4096]
    - [7, 11174.0]
  - - [1024, 3147, 1, 4096, 1024, 1024, 1024, 4096]
    - [11, 11870.0]
  - - [4096, 3387, 1, 1024, 4096, 4096, 4096, 1024]
    - [8, 12019.0]
  - - [4096, 3436, 1, 1024, 4096, 4096, 4096, 1024]
    - [1, 12218.0]
  - - [1024, 3341, 1, 4096, 1024, 1024, 1024, 4096]
    - [4, 11480.0]
  - - [1024, 3516, 1, 4096, 1024, 1024, 1024, 4096]
    - [27, 10729.0]
  - - [4096, 3277, 1, 1024, 4096, 4096, 4096, 1024]
    - [8, 12157.0]
  - - [1024, 3454, 1, 4096, 1024, 1024, 1024, 4096]
    - [8, 11960.0]
  - - [1024, 3969, 1, 4096, 1024, 1024, 1024, 4096]
    - [25, 10205.0]
  - - [1024, 3999, 1, 4096, 1024, 1024, 1024, 4096]
    - [22, 11785.0]
  - - [1024, 4032, 1, 4096, 1024, 1024, 1024, 4096]
    - [22, 11836.0]
  - - [4096, 3541, 1, 1024, 4096, 4096, 4096, 1024]
    - [1, 12231.0]
  - - [4096, 3334, 1, 1024, 4096, 4096, 4096, 1024]
    - [1, 11910.0]
  - - [1024, 3365, 1, 4096, 1024, 1024, 1024, 4096]
    - [4, 11582.0]
  - - [1024, 3527, 1, 4096, 1024, 1024, 1024, 4096]
    - [25, 10776.0]
  - - [1024, 3190, 1, 4096, 1024, 1024, 1024, 4096]
    - [39, 11816.0]
  - - [4096, 3906, 1, 1024, 4096, 4096, 4096, 1024]
    - [1, 12194.0]
  - - [1024, 3593, 1, 4096, 1024, 1024, 1024, 4096]
    - [8, 11569.0]
  - - [1024, 3336, 1, 4096, 1024, 1024, 1024, 4096]
    - [25, 10928.0]
  - - [4096, 3504, 1, 1024, 4096, 4096, 4096, 1024]
    - [1, 12147.0]
  - - [4096, 3977, 1, 1024, 4096, 4096, 4096, 1024]
    - [1, 12009.0]
  - - [1024, 3906, 1, 4096, 1024, 1024, 1024, 4096]
    - [22, 11611.0]
  - - [4096, 3415, 1, 1024, 4096, 4096, 4096, 1024]
    - [1, 12127.0]
  - - [1024, 3295, 1, 4096, 1024, 1024, 1024, 4096]
    - [4, 11382.0]
  - - [4096, 3321, 1, 1024, 4096, 4096, 4096, 1024]
    - [8, 12283.0]
  - - [1024, 3072, 1, 4096, 1024, 1024, 1024, 4096]
    - [6, 11797.0]
  - - [1024, 3408, 1, 4096, 1024, 1024, 1024, 4096]
    - [25, 10999.0]
  - - [1024, 3522, 1, 4096, 1024, 1024, 1024, 4096]
    - [25, 10694.0]
  - - [4096, 3751, 1, 1024, 4096, 4096, 4096, 1024]
    - [1, 12179.0]
  - - [4096, 3378, 1, 1024, 4096, 4096, 4096, 1024]
    - [8, 12003.0]
  - - [1024, 3925, 1, 33708, 1024, 1024, 1024, 33708]
    - [1, 11586.0]
  - - [1024, 3990, 1, 1024, 1024, 1024, 1024, 1024]
    - [22, 11491.0]
  - - [1024, 3290, 1, 4096, 1024, 1024, 1024, 4096]
    - [8, 11497.0]
  - - [4096, 3500, 1, 1024, 4096, 4096, 4096, 1024]
    - [1, 12131.0]
  - - [4096, 3565, 1, 1024, 4096, 4096, 4096, 1024]
    - [1, 12392.0]
  - - [1024, 3484, 1, 4096, 1024, 1024, 1024, 4096]
    - [7, 11512.0]
  - - [4096, 3395, 1, 1024, 4096, 4096, 4096, 1024]
    - [1, 12050.0]
  - - [1024, 3681, 1, 1024, 1024, 1024, 1024, 1024]
    - [8, 11483.0]
  - - [1024, 3584, 1, 1024, 1024, 1024, 1024, 1024]
    - [7, 11267.0]
  - - [4096, 3093, 1, 1024, 4096, 4096, 4096, 1024]
    - [1, 12099.0]
  - - [1024, 4050, 1, 1024, 1024, 1024, 1024, 1024]
    - [8, 11620.0]
  - - [1024, 3301, 1, 4096, 1024, 1024, 1024, 4096]
    - [4, 11394.0]
  - - [1024, 3581, 1, 4096, 1024, 1024, 1024, 4096]
    - [25, 10799.0]
  - - [4096, 3374, 1, 1024, 4096, 4096, 4096, 1024]
    - [8, 11976.0]
  - - [1024, 3449, 1, 4096, 1024, 1024, 1024, 4096]
    - [22, 12054.0]
  - - [4096, 3215, 1, 1024, 4096, 4096, 4096, 1024]
    - [1, 11895.0]
  - - [4096, 3312, 1, 1024, 4096, 4096, 4096, 1024]
    - [1, 12323.0]
  - - [4096, 3479, 1, 1024, 4096, 4096, 4096, 1024]
    - [1, 12112.0]
  - - [4096, 3544, 1, 1024, 4096, 4096, 4096, 1024]
    - [1, 12303.0]
  - - [1024, 3263, 1, 4096, 1024, 1024, 1024, 4096]
    - [4, 11246.0]
  - - [4096, 3455, 1, 1024, 4096, 4096, 4096, 1024]
    - [1, 12253.0]
  - - [1024, 3379, 1, 4096, 1024, 1024, 1024, 4096]
    - [39, 11650.0]
  - - [1024, 3490, 1, 4096, 1024, 1024, 1024, 4096]
    - [35, 11397.0]
  - - [1024, 3368, 1, 4096, 1024, 1024, 1024, 4096]
    - [36, 11504.0]
  - - [4096, 3186, 1, 1024, 4096, 4096, 4096, 1024]
    - [1, 12344.0]
  - - [1024, 3428, 1, 4096, 1024, 1024, 1024, 4096]
    - [4, 11817.0]
  - - [4096, 3561, 1, 1024, 4096, 4096, 4096, 1024]
    - [1, 12347.0]
  - - [4096, 3418, 1, 1024, 4096, 4096, 4096, 1024]
    - [1, 12190.0]
  - - [1024, 3064, 1, 4096, 1024, 1024, 1024, 4096]
    - [6, 11698.0]
  - - [4096, 3259, 1, 1024, 4096, 4096, 4096, 1024]
    - [8, 12130.0]
  - - [4096, 3308, 1, 1024, 4096, 4096, 4096, 1024]
    - [1, 12323.0]
  - - [1024, 3533, 1, 4096, 1024, 1024, 1024, 4096]
    - [8, 11421.0]
  - - [1024, 3344, 1, 4096, 1024, 1024, 1024, 4096]
    - [39, 10941.0]
  - - [1024, 4030, 1, 1024, 1024, 1024, 1024, 1024]
    - [8, 11281.0]
  - - [4096, 3459, 1, 1024, 4096, 4096, 4096, 1024]
    - [1, 12032.0]
  - - [1024, 3572, 1, 4096, 1024, 1024, 1024, 4096]
    - [22, 11518.0]
  - - [1024, 3925, 1, 1024, 1024, 1024, 1024, 1024]
    - [21, 11145.0]
  - - [4096, 3435, 1, 1024, 4096, 4096, 4096, 1024]
    - [1, 12224.0]
  - - [1024, 3956, 1, 4096, 1024, 1024, 1024, 4096]
    - [22, 11727.0]
  - - [1024, 3463, 1, 4096, 1024, 1024, 1024, 4096]
    - [0, 11211.0]
  - - [4096, 3182, 1, 1024, 4096, 4096, 4096, 1024]
    - [8, 12367.0]
  - - [4096, 3976, 1, 1024, 4096, 4096, 4096, 1024]
    - [1, 12019.0]
  - - [1024, 3417, 1, 4096, 1024, 1024, 1024, 4096]
    - [8, 11874.0]
  - - [1024, 3528, 1, 4096, 1024, 1024, 1024, 4096]
    - [39, 10794.0]
  - - [4096, 3446, 1, 1024, 4096, 4096, 4096, 1024]
    - [8, 12226.0]
  - - [1024, 3543, 1, 4096, 1024, 1024, 1024, 4096]
    - [8, 11437.0]
  - - [4096, 3287, 1, 1024, 4096, 4096, 4096, 1024]
    - [8, 12192.0]
  - - [1024, 3499, 1, 4096, 1024, 1024, 1024, 4096]
    - [7, 11623.0]
  - - [1024, 3231, 1, 4096, 1024, 1024, 1024, 4096]
    - [39, 10989.0]
  - - [4096, 3519, 1, 1024, 4096, 4096, 4096, 1024]
    - [1, 12183.0]
  - - [4096, 3552, 1, 1024, 4096, 4096, 4096, 1024]
    - [1, 12329.0]
  - - [1024, 3458, 1, 4096, 1024, 1024, 1024, 4096]
    - [3, 11130.0]
  - - [1024, 3374, 1, 4096, 1024, 1024, 1024, 4096]
    - [25, 10992.0]
  - - [1024, 3396, 1, 4096, 1024, 1024, 1024, 4096]
    - [39, 11016.0]
  - - [1024, 2967, 1, 4096, 1024, 1024, 1024, 4096]
    - [27, 11194.0]
  - - [4096, 3482, 1, 1024, 4096, 4096, 4096, 1024]
    - [8, 12084.0]
  - - [1024, 3226, 1, 4096, 1024, 1024, 1024, 4096]
    - [4, 11181.0]
  - - [4096, 3377, 1, 1024, 4096, 4096, 4096, 1024]
    - [8, 12020.0]
  - - [4096, 3426, 1, 1024, 4096, 4096, 4096, 1024]
    - [1, 12225.0]
  - - [4096, 2935, 1, 1024, 4096, 4096, 4096, 1024]
    - [1, 12393.0]
  - - [1024, 3439, 1, 4096, 1024, 1024, 1024, 4096]
    - [8, 11945.0]
  - - [4096, 3267, 1, 1024, 4096, 4096, 4096, 1024]
    - [8, 12152.0]
  - - [4096, 3499, 1, 1024, 4096, 4096, 4096, 1024]
    - [1, 12188.0]
  - - [4096, 3356, 1, 1024, 4096, 4096, 4096, 1024]
    - [1, 11993.0]
  - - [4096, 3939, 1, 1024, 4096, 4096, 4096, 1024]
    - [1, 12352.0]
  - - [1024, 3526, 1, 4096, 1024, 1024, 1024, 4096]
    - [6, 11289.0]
  - - [1024, 3859, 1, 33708, 1024, 1024, 1024, 33708]
    - [36, 11413.0]
  - - [1024, 3385, 1, 4096, 1024, 1024, 1024, 4096]
    - [8, 11760.0]
  - - [1024, 3496, 1, 4096, 1024, 1024, 1024, 4096]
    - [39, 10747.0]
  - - [4096, 3141, 1, 1024, 4096, 4096, 4096, 1024]
    - [1, 12239.0]
  - - [4096, 3510, 1, 1024, 4096, 4096, 4096, 1024]
    - [1, 12224.0]
  - - [1024, 3434, 1, 4096, 1024, 1024, 1024, 4096]
    - [8, 11923.0]
  - - [4096, 3969, 1, 1024, 4096, 4096, 4096, 1024]
    - [1, 11957.0]
  - - [1024, 3121, 1, 4096, 1024, 1024, 1024, 4096]
    - [4, 11795.0]
  - - [1024, 3232, 1, 4096, 1024, 1024, 1024, 4096]
    - [22, 11338.0]
  - - [1024, 4030, 1, 33708, 1024, 1024, 1024, 33708]
    - [1, 11880.0]
  - - [1024, 3780, 1, 33708, 1024, 1024, 1024, 33708]
    - [6, 12108.0]
  - - [1024, 3969, 1, 1024, 1024, 1024, 1024, 1024]
    - [22, 11476.0]
  - - [4096, 3527, 1, 1024, 4096, 4096, 4096, 1024]
    - [1, 12270.0]
  - - [4096, 3336, 1, 1024, 4096, 4096, 4096, 1024]
    - [1, 11904.0]
  - - [4096, 3290, 1, 1024, 4096, 4096, 4096, 1024]
    - [1, 12279.0]
  - - [1024, 3469, 1, 4096, 1024, 1024, 1024, 4096]
    - [7, 11436.0]
  - - [4096, 3490, 1, 1024, 4096, 4096, 4096, 1024]
    - [1, 12125.0]
  - - [4096, 3064, 1, 1024, 4096, 4096, 4096, 1024]
    - [1, 12287.0]
  - - [4096, 3582, 1, 1024, 4096, 4096, 4096, 1024]
    - [1, 12438.0]
  - - [1024, 3956, 1, 1024, 1024, 1024, 1024, 1024]
    - [8, 11424.0]
  - - [4096, 3417, 1, 1024, 4096, 4096, 4096, 1024]
    - [1, 12181.0]
  - - [1024, 2736, 1, 4096, 1024, 1024, 1024, 4096]
    - [8, 11463.0]
  - - [1024, 3205, 1, 4096, 1024, 1024, 1024, 4096]
    - [4, 11094.0]
  - - [1024, 3143, 1, 4096, 1024, 1024, 1024, 4096]
    - [39, 11599.0]
  - - [1024, 4020, 1, 4096, 1024, 1024, 1024, 4096]
    - [22, 11868.0]
  - - [1024, 3318, 1, 4096, 1024, 1024, 1024, 4096]
    - [4, 11455.0]
  - - [4096, 3364, 1, 1024, 4096, 4096, 4096, 1024]
    - [1, 11926.0]
  - - [1024, 3353, 1, 4096, 1024, 1024, 1024, 4096]
    - [4, 11560.0]
  - - [1024, 3464, 1, 4096, 1024, 1024, 1024, 4096]
    - [39, 10606.0]
  - - [4096, 3205, 1, 1024, 4096, 4096, 4096, 1024]
    - [1, 11921.0]
  - - [4096, 3318, 1, 1024, 4096, 4096, 4096, 1024]
    - [1, 12325.0]
  - - [1024, 3402, 1, 4096, 1024, 1024, 1024, 4096]
    - [4, 11739.0]
  - - [4096, 3181, 1, 1024, 4096, 4096, 4096, 1024]
    - [1, 12364.0]
  - - [4096, 3550, 1, 1024, 4096, 4096, 4096, 1024]
    - [1, 12322.0]
  - - [4096, 3445, 1, 1024, 4096, 4096, 4096, 1024]
    - [1, 12266.0]
  - - [1024, 3138, 1, 4096, 1024, 1024, 1024, 4096]
    - [4, 11820.0]
  - - [4096, 3079, 1, 1024, 4096, 4096, 4096, 1024]
    - [1, 11980.0]
  - - [4096, 3144, 1, 1024, 4096, 4096, 4096, 1024]
    - [1, 12290.0]
  - - [4096, 3860, 1, 1024, 4096, 4096, 4096, 1024]
    - [1, 12124.0]
  - - [1024, 3515, 1, 4096, 1024, 1024, 1024, 4096]
    - [7, 11583.0]
  - - [4096, 3408, 1, 1024, 4096, 4096, 4096, 1024]
    - [1, 12099.0]
  - - [1024, 3181, 1, 4096, 1024, 1024, 1024, 4096]
    - [4, 12006.0]
  - - [4096, 3298, 1, 1024, 4096, 4096, 4096, 1024]
    - [1, 12252.0]
  - - [4096, 3585, 1, 1024, 4096, 4096, 4096, 1024]
    - [1, 11977.0]
  - - [1024, 3550, 1, 4096, 1024, 1024, 1024, 4096]
    - [22, 11447.0]
  - - [1024, 4020, 1, 1024, 1024, 1024, 1024, 1024]
    - [22, 11532.0]
  - - [4096, 3481, 1, 1024, 4096, 4096, 4096, 1024]
    - [8, 12074.0]
  - - [4096, 3530, 1, 1024, 4096, 4096, 4096, 1024]
    - [1, 12291.0]
  - - [4096, 3425, 1, 1024, 4096, 4096, 4096, 1024]
    - [1, 12196.0]
  - - [4096, 4026, 1, 1024, 4096, 4096, 4096, 1024]
    - [1, 12140.0]
  - - [1024, 3860, 1, 1024, 1024, 1024, 1024, 1024]
    - [8, 11179.0]
  - - [4096, 3975, 1, 1024, 4096, 4096, 4096, 1024]
    - [1, 11984.0]
  - - [1024, 3286, 1, 4096, 1024, 1024, 1024, 4096]
    - [4, 11332.0]
  - - [1024, 3176, 1, 4096, 1024, 1024, 1024, 4096]
    - [39, 11790.0]
  - - [1024, 3894, 1, 4096, 1024, 1024, 1024, 4096]
    - [8, 11573.0]
  - - [4096, 3355, 1, 1024, 4096, 4096, 4096, 1024]
    - [1, 11905.0]
  - - [4096, 3404, 1, 1024, 4096, 4096, 4096, 1024]
    - [1, 12122.0]
  - - [1024, 3501, 1, 4096, 1024, 1024, 1024, 4096]
    - [7, 11562.0]
  - - [4096, 3245, 1, 1024, 4096, 4096, 4096, 1024]
    - [1, 12033.0]
  - - [1024, 3431, 1, 4096, 1024, 1024, 1024, 4096]
    - [8, 11913.0]
  - - [1024, 4000, 1, 1024, 1024, 1024, 1024, 1024]
    - [39, 11200.0]
  - - [4096, 3509, 1, 1024, 4096, 4096, 4096, 1024]
    - [1, 12194.0]
  - - [4096, 3558, 1, 1024, 4096, 4096, 4096, 1024]
    - [1, 12371.0]
  - - [1024, 3535, 1, 4096, 1024, 1024, 1024, 4096]
    - [6, 11329.0]
  - - [1024, 3414, 1, 4096, 1024, 1024, 1024, 4096]
    - [39, 10993.0]
  - - [1024, 3445, 1, 4096, 1024, 1024, 1024, 4096]
    - [39, 11094.0]
  - - [1024, 3436, 1, 4096, 1024, 1024, 1024, 4096]
    - [39, 11078.0]
  - - [4096, 3472, 1, 1024, 4096, 4096, 4096, 1024]
    - [1, 12053.0]
  - - [1024, 3211, 1, 4096, 1024, 1024, 1024, 4096]
    - [4, 11127.0]
  - - [4096, 3383, 1, 1024, 4096, 4096, 4096, 1024]
    - [1, 12052.0]
  - - [4096, 3448, 1, 1024, 4096, 4096, 4096, 1024]
    - [1, 12315.0]
  - - [1024, 3343, 1, 4096, 1024, 1024, 1024, 4096]
    - [4, 11570.0]
  - - [1024, 3518, 1, 4096, 1024, 1024, 1024, 4096]
    - [27, 10717.0]
  - - [4096, 3289, 1, 1024, 4096, 4096, 4096, 1024]
    - [1, 12216.0]
  - - [1024, 3440, 1, 4096, 1024, 1024, 1024, 4096]
    - [4, 11907.0]
  - - [1024, 4032, 1, 33708, 1024, 1024, 1024, 33708]
    - [16, 11905.0]
  - - [4096, 3489, 1, 1024, 4096, 4096, 4096, 1024]
    - [1, 12146.0]
  - - [4096, 3346, 1, 1024, 4096, 4096, 4096, 1024]
    - [1, 11958.0]
  - - [1024, 3534, 1, 4096, 1024, 1024, 1024, 4096]
    - [8, 11410.0]
  - - [1024, 3079, 1, 4096, 1024, 1024, 1024, 4096]
    - [39, 11431.0]
  - - [1024, 3955, 1, 4096, 1024, 1024, 1024, 4096]
    - [25, 10122.0]
  - - [4096, 3236, 1, 1024, 4096, 4096, 4096, 1024]
    - [8, 12041.0]
  - - [1024, 3545, 1, 4096, 1024, 1024, 1024, 4096]
    - [8, 11444.0]
  - - [1024, 3144, 1, 4096, 1024, 1024, 1024, 4096]
    - [39, 11650.0]
  - - [4096, 3780, 1, 1024, 4096, 4096, 4096, 1024]
    - [8, 12271.0]
  - - [4096, 3163, 1, 1024, 4096, 4096, 4096, 1024]
    - [1, 12377.0]
  - - [4096, 3468, 1, 1024, 4096, 4096, 4096, 1024]
    - [1, 12099.0]
  - - [1024, 3539, 1, 4096, 1024, 1024, 1024, 4096]
    - [8, 11443.0]
  - - [1024, 3541, 1, 4096, 1024, 1024, 1024, 4096]
    - [39, 10794.0]
  - - [4096, 3363, 1, 1024, 4096, 4096, 4096, 1024]
    - [1, 11969.0]
  - - [1024, 3475, 1, 4096, 1024, 1024, 1024, 4096]
    - [6, 11133.0]
  - - [4096, 3110, 1, 1024, 4096, 4096, 4096, 1024]
    - [1, 12151.0]
  - - [1024, 3509, 1, 4096, 1024, 1024, 1024, 4096]
    - [7, 11624.0]
  - - [1024, 3413, 1, 4096, 1024, 1024, 1024, 4096]
    - [25, 11020.0]
  - - [1024, 3975, 1, 1024, 1024, 1024, 1024, 1024]
    - [8, 11116.0]
  - - [4096, 3549, 1, 1024, 4096, 4096, 4096, 1024]
    - [1, 12318.0]
  - - [4096, 3342, 1, 1024, 4096, 4096, 4096, 1024]
    - [1, 11935.0]
  - - [1024, 2985, 1, 4096, 1024, 1024, 1024, 4096]
    - [6, 11369.0]
  - - [1024, 3876, 1, 33708, 1024, 1024, 1024, 33708]
    - [29, 11469.0]
  - - [4096, 3280, 1, 1024, 4096, 4096, 4096, 1024]
    - [1, 12238.0]
  - - [4096, 3191, 1, 1024, 4096, 4096, 4096, 1024]
    - [1, 12457.0]
  - - [4096, 3512, 1, 1024, 4096, 4096, 4096, 1024]
    - [1, 12272.0]
  - - [1024, 3560, 1, 4096, 1024, 1024, 1024, 4096]
    - [8, 11485.0]
  - - [4096, 2499, 1, 1024, 4096, 4096, 4096, 1024]
    - [1, 12119.0]
  - - [1024, 3248, 1, 4096, 1024, 1024, 1024, 4096]
    - [4, 11278.0]
  - - [4096, 3423, 1, 1024, 4096, 4096, 4096, 1024]
    - [8, 12157.0]
  - - [4096, 3297, 1, 1024, 4096, 4096, 4096, 1024]
    - [1, 12290.0]
  - - [4096, 3154, 1, 1024, 4096, 4096, 4096, 1024]
    - [1, 12349.0]
  - - [1024, 3303, 1, 4096, 1024, 1024, 1024, 4096]
    - [4, 11445.0]
  - - [1024, 3222, 1, 4096, 1024, 1024, 1024, 4096]
    - [39, 10967.0]
  - - [1024, 3978, 1, 1024, 1024, 1024, 1024, 1024]
    - [8, 11460.0]
  - - [4096, 3529, 1, 1024, 4096, 4096, 4096, 1024]
    - [1, 12226.0]
  - - [4096, 3386, 1, 1024, 4096, 4096, 4096, 1024]
    - [1, 12084.0]
  - - [1024, 3451, 1, 4096, 1024, 1024, 1024, 4096]
    - [8, 11971.0]
  - - [4096, 3562, 1, 1024, 4096, 4096, 4096, 1024]
    - [1, 12294.0]
  - - [4096, 3276, 1, 1024, 4096, 4096, 4096, 1024]
    - [1, 12177.0]
  - - [1024, 3894, 1, 33708, 1024, 1024, 1024, 33708]
    - [16, 11500.0]
  - - [4096, 3540, 1, 1024, 4096, 4096, 4096, 1024]
    - [1, 12323.0]
  - - [1024, 3416, 1, 4096, 1024, 1024, 1024, 4096]
    - [22, 11953.0]
  - - [1024, 4005, 1, 33708, 1024, 1024, 1024, 33708]
    - [1, 11814.0]
  - - [1024, 3942, 1, 4096, 1024, 1024, 1024, 4096]
    - [22, 11698.0]
  - - [4096, 3403, 1, 1024, 4096, 4096, 4096, 1024]
    - [8, 12099.0]
  - - [4096, 3381, 1, 1024, 4096, 4096, 4096, 1024]
    - [1, 12035.0]
  - - [1024, 3492, 1, 4096, 1024, 1024, 1024, 4096]
    - [3, 11209.0]
  - - [4096, 3101, 1, 1024, 4096, 4096, 4096, 1024]
    - [1, 12054.0]
  - - [1024, 3430, 1, 4096, 1024, 1024, 1024, 4096]
    - [4, 11873.0]
  - - [1024, 3977, 1, 4096, 1024, 1024, 1024, 4096]
    - [25, 10005.0]
  - - [1024, 3640, 1, 4096, 1024, 1024, 1024, 4096]
    - [4, 10718.0]
  - - [4096, 3557, 1, 1024, 4096, 4096, 4096, 1024]
    - [8, 12275.0]
  - - [4096, 3414, 1, 1024, 4096, 4096, 4096, 1024]
    - [1, 12154.0]
  - - [1024, 3391, 1, 4096, 1024, 1024, 1024, 4096]
    - [4, 11706.0]
  - - [1024, 3356, 1, 4096, 1024, 1024, 1024, 4096]
    - [39, 10931.0]
  - - [4096, 3320, 1, 1024, 4096, 4096, 4096, 1024]
    - [1, 12339.0]
  - - [4096, 2765, 1, 1024, 4096, 4096, 4096, 1024]
    - [1, 12037.0]
  - - [1024, 3411, 1, 4096, 1024, 1024, 1024, 4096]
    - [4, 11783.0]
  - - [1024, 3978, 1, 4096, 1024, 1024, 1024, 4096]
    - [22, 11776.0]
  - - [4096, 3487, 1, 1024, 4096, 4096, 4096, 1024]
    - [1, 12111.0]
  - - [4096, 3520, 1, 1024, 4096, 4096, 4096, 1024]
    - [1, 12232.0]
  - - [4096, 3942, 1, 1024, 4096, 4096, 4096, 1024]
    - [1, 12343.0]
  - - [4096, 3431, 1, 1024, 4096, 4096, 4096, 1024]
    - [1, 12235.0]
  - - [1024, 3271, 1, 4096, 1024, 1024, 1024, 4096]
    - [4, 11331.0]
  - - [4096, 4020, 1, 1024, 4096, 4096, 4096, 1024]
    - [1, 12093.0]
  - - [1024, 3481, 1, 4096, 1024, 1024, 1024, 4096]
    - [3, 11171.0]
  - - [1024, 3419, 1, 4096, 1024, 1024, 1024, 4096]
    - [8, 11853.0]
  - - [1024, 4059, 1, 4096, 1024, 1024, 1024, 4096]
    - [36, 12039.0]
  - - [4096, 3345, 1, 1024, 4096, 4096, 4096, 1024]
    - [1, 11910.0]
  - - [4096, 3394, 1, 1024, 4096, 4096, 4096, 1024]
    - [1, 12100.0]
  - - [1024, 3298, 1, 4096, 1024, 1024, 1024, 4096]
    - [8, 11471.0]
  - - [4096, 3235, 1, 1024, 4096, 4096, 4096, 1024]
    - [1, 12032.0]
  - - [1024, 3681, 1, 33708, 1024, 1024, 1024, 33708]
    - [6, 11804.0]
  - - [1024, 3362, 1, 4096, 1024, 1024, 1024, 4096]
    - [8, 11667.0]
  - - [4096, 3467, 1, 1024, 4096, 4096, 4096, 1024]
    - [1, 12018.0]
  - - [1024, 3349, 1, 4096, 1024, 1024, 1024, 4096]
    - [4, 11571.0]
  - - [1024, 3460, 1, 4096, 1024, 1024, 1024, 4096]
    - [19, 10615.0]
  - - [4096, 3214, 1, 1024, 4096, 4096, 4096, 1024]
    - [8, 11970.0]
  - - [1024, 3398, 1, 4096, 1024, 1024, 1024, 4096]
    - [4, 11761.0]
  - - [4096, 3478, 1, 1024, 4096, 4096, 4096, 1024]
    - [8, 12046.0]
  - - [1024, 4050, 1, 33708, 1024, 1024, 1024, 33708]
    - [1, 11951.0]
  - - [1024, 3244, 1, 4096, 1024, 1024, 1024, 4096]
    - [8, 11361.0]
  - - [4096, 3341, 1, 1024, 4096, 4096, 4096, 1024]
    - [1, 11859.0]
  - - [4096, 3454, 1, 1024, 4096, 4096, 4096, 1024]
    - [1, 12322.0]
  - - [1024, 3166, 1, 4096, 1024, 1024, 1024, 4096]
    - [4, 11973.0]
  - - [1024, 3425, 1, 4096, 1024, 1024, 1024, 4096]
    - [26, 10884.0]
  - - [4096, 3295, 1, 1024, 4096, 4096, 4096, 1024]
    - [1, 12204.0]
  - - [4096, 3072, 1, 1024, 4096, 4096, 4096, 1024]
    - [1, 12338.0]
  - - [4096, 3822, 1, 1024, 4096, 4096, 4096, 1024]
    - [1, 12430.0]
  - - [1024, 3681, 1, 4096, 1024, 1024, 1024, 4096]
    - [22, 11777.0]
  - - [1024, 4050, 1, 4096, 1024, 1024, 1024, 4096]
    - [22, 11918.0]
  - - [4096, 3495, 1, 1024, 4096, 4096, 4096, 1024]
    - [1, 12129.0]
  - - [4096, 3560, 1, 1024, 4096, 4096, 4096, 1024]
    - [1, 12384.0]
  - - [1024, 3524, 1, 4096, 1024, 1024, 1024, 4096]
    - [6, 11274.0]
  - - [1024, 3942, 1, 33708, 1024, 1024, 1024, 33708]
    - [16, 11646.0]
  - - [1024, 3304, 1, 4096, 1024, 1024, 1024, 4096]
    - [8, 11494.0]
  - - [1024, 3387, 1, 4096, 1024, 1024, 1024, 4096]
    - [39, 11003.0]
  - - [1024, 3498, 1, 4096, 1024, 1024, 1024, 4096]
    - [39, 10705.0]
  - - [4096, 3458, 1, 1024, 4096, 4096, 4096, 1024]
    - [1, 11990.0]
  - - [4096, 2967, 1, 1024, 4096, 4096, 4096, 1024]
    - [1, 11934.0]
  - - [4096, 3385, 1, 1024, 4096, 4096, 4096, 1024]
    - [1, 12070.0]
  - - [4096, 3434, 1, 1024, 4096, 4096, 4096, 1024]
    - [1, 12235.0]
  - - [1024, 3519, 1, 4096, 1024, 1024, 1024, 4096]
    - [7, 11657.0]
  - - [1024, 3511, 1, 4096, 1024, 1024, 1024, 4096]
    - [35, 11283.0]
  - - [1024, 3288, 1, 4096, 1024, 1024, 1024, 4096]
    - [25, 11395.0]
  - - [1024, 2918, 1, 4096, 1024, 1024, 1024, 4096]
    - [27, 11080.0]
  - - [4096, 3573, 1, 1024, 4096, 4096, 4096, 1024]
    - [8, 12364.0]
  - - [1024, 3822, 1, 33708, 1024, 1024, 1024, 33708]
    - [20, 12244.0]
  - - [4096, 3539, 1, 1024, 4096, 4096, 4096, 1024]
    - [1, 12302.0]
  - - [4096, 3332, 1, 1024, 4096, 4096, 4096, 1024]
    - [1, 11915.0]
  - - [4096, 3286, 1, 1024, 4096, 4096, 4096, 1024]
    - [1, 12272.0]
  - - [1024, 4026, 1, 4096, 1024, 1024, 1024, 4096]
    - [22, 11869.0]
  - - [1024, 3277, 1, 4096, 1024, 1024, 1024, 4096]
    - [4, 11381.0]
  - - [1024, 3471, 1, 4096, 1024, 1024, 1024, 4096]
    - [39, 10649.0]
  - - [4096, 3518, 1, 1024, 4096, 4096, 4096, 1024]
    - [1, 12210.0]
  - - [1024, 3393, 1, 4096, 1024, 1024, 1024, 4096]
    - [4, 11717.0]
  - - [4096, 3413, 1, 1024, 4096, 4096, 4096, 1024]
    - [1, 12117.0]
  - - [4096, 3303, 1, 1024, 4096, 4096, 4096, 1024]
    - [1, 12308.0]
  - - [1024, 3207, 1, 4096, 1024, 1024, 1024, 4096]
    - [4, 11124.0]
  - - [1024, 3894, 1, 1024, 1024, 1024, 1024, 1024]
    - [35, 11044.0]
  - - [1024, 3977, 1, 1024, 1024, 1024, 1024, 1024]
    - [8, 11500.0]
  - - [4096, 3535, 1, 1024, 4096, 4096, 4096, 1024]
    - [1, 12244.0]
  - - [4096, 3376, 1, 1024, 4096, 4096, 4096, 1024]
    - [1, 12041.0]
  - - [1024, 3355, 1, 4096, 1024, 1024, 1024, 4096]
    - [4, 11599.0]
  - - [1024, 3466, 1, 4096, 1024, 1024, 1024, 4096]
    - [39, 10605.0]
  - - [4096, 3266, 1, 1024, 4096, 4096, 4096, 1024]
    - [8, 12110.0]
  - - [1024, 3404, 1, 4096, 1024, 1024, 1024, 4096]
    - [4, 11770.0]
  - - [1024, 3999, 1, 1024, 1024, 1024, 1024, 1024]
    - [8, 11240.0]
  - - [4096, 3498, 1, 1024, 4096, 4096, 4096, 1024]
    - [1, 12132.0]
  - - [1024, 4032, 1, 1024, 1024, 1024, 1024, 1024]
    - [22, 11588.0]
  - - [1024, 3410, 1, 4096, 1024, 1024, 1024, 4096]
    - [8, 11858.0]
  - - [4096, 3393, 1, 1024, 4096, 4096, 4096, 1024]
    - [1, 12043.0]
  - - [1024, 3140, 1, 4096, 1024, 1024, 1024, 4096]
    - [4, 11886.0]
  - - [1024, 3910, 1, 33708, 1024, 1024, 1024, 33708]
    - [29, 11555.0]
  - - [1024, 3334, 1, 4096, 1024, 1024, 1024, 4096]
    - [8, 11592.0]
  - - [4096, 3140, 1, 1024, 4096, 4096, 4096, 1024]
    - [1, 12197.0]
  - - [1024, 4005, 1, 4096, 1024, 1024, 1024, 4096]
    - [25, 11781.0]
  - - [1024, 3579, 1, 4096, 1024, 1024, 1024, 4096]
    - [4, 11432.0]
  - - [4096, 3372, 1, 1024, 4096, 4096, 4096, 1024]
    - [1, 11968.0]
  - - [1024, 3245, 1, 4096, 1024, 1024, 1024, 4096]
    - [4, 11264.0]
  - - [4096, 3956, 1, 1024, 4096, 4096, 4096, 1024]
    - [1, 12312.0]
  - - [4096, 3213, 1, 1024, 4096, 4096, 4096, 1024]
    - [1, 11966.0]
  - - [1024, 3361, 1, 4096, 1024, 1024, 1024, 4096]
    - [4, 11608.0]
  - - [1024, 3536, 1, 4096, 1024, 1024, 1024, 4096]
    - [39, 10815.0]
  - - [4096, 3477, 1, 1024, 4096, 4096, 4096, 1024]
    - [1, 12069.0]
  - - [4096, 3526, 1, 1024, 4096, 4096, 4096, 1024]
    - [1, 12230.0]
  - - [1024, 4005, 1, 1024, 1024, 1024, 1024, 1024]
    - [22, 11528.0]
  - - [1024, 3530, 1, 4096, 1024, 1024, 1024, 4096]
    - [6, 11302.0]
  - - [1024, 3944, 1, 4096, 1024, 1024, 1024, 4096]
    - [36, 11608.0]
  - - [4096, 3453, 1, 1024, 4096, 4096, 4096, 1024]
    - [1, 12261.0]
  - - [4096, 3184, 1, 1024, 4096, 4096, 4096, 1024]
    - [1, 12411.0]
  - - [4096, 3579, 1, 1024, 4096, 4096, 4096, 1024]
    - [1, 12464.0]
  - - [4096, 3351, 1, 1024, 4096, 4096, 4096, 1024]
    - [1, 11982.0]
  - - [4096, 3416, 1, 1024, 4096, 4096, 4096, 1024]
    - [1, 12235.0]
  - - [1024, 3822, 1, 4096, 1024, 1024, 1024, 4096]
    - [27, 12173.0]
  - - [1024, 3796, 1, 4096, 1024, 1024, 1024, 4096]
    - [27, 12110.0]
  - - [4096, 3257, 1, 1024, 4096, 4096, 4096, 1024]
    - [1, 12109.0]
  - - [4096, 3306, 1, 1024, 4096, 4096, 4096, 1024]
    - [1, 12295.0]
  - - [1024, 3505, 1, 4096, 1024, 1024, 1024, 4096]
    - [7, 11600.0]
  - - [1024, 3315, 1, 4096, 1024, 1024, 1024, 4096]
    - [39, 11091.0]
  - - [1024, 3486, 1, 4096, 1024, 1024, 1024, 4096]
    - [25, 10733.0]
  - - [4096, 3457, 1, 1024, 4096, 4096, 4096, 1024]
    - [8, 11980.0]
  - - [4096, 3870, 1, 1024, 4096, 4096, 4096, 1024]
    - [1, 12130.0]
  - - [1024, 3447, 1, 4096, 1024, 1024, 1024, 4096]
    - [8, 11910.0]
  - - [1024, 3558, 1, 4096, 1024, 1024, 1024, 4096]
    - [25, 10772.0]
  - - [4096, 3433, 1, 1024, 4096, 4096, 4096, 1024]
    - [8, 12174.0]
  - - [4096, 3180, 1, 1024, 4096, 4096, 4096, 1024]
    - [1, 12403.0]
  - - [1024, 3213, 1, 4096, 1024, 1024, 1024, 4096]
    - [4, 11136.0]
  - - [1024, 3900, 1, 4096, 1024, 1024, 1024, 4096]
    - [8, 11604.0]
  - - [4096, 3444, 1, 1024, 4096, 4096, 4096, 1024]
    - [8, 12233.0]
  - - [1024, 3504, 1, 4096, 1024, 1024, 1024, 4096]
    - [6, 11237.0]
  - - [4096, 4059, 1, 1024, 4096, 4096, 4096, 1024]
    - [1, 12201.0]
  - - [1024, 3442, 1, 4096, 1024, 1024, 1024, 4096]
    - [4, 11851.0]
  - - [4096, 3517, 1, 1024, 4096, 4096, 4096, 1024]
    - [1, 12201.0]
  - - [1024, 3566, 1, 4096, 1024, 1024, 1024, 4096]
    - [8, 11508.0]
  - - [4096, 3248, 1, 1024, 4096, 4096, 4096, 1024]
    - [1, 12089.0]
  - - [1024, 3547, 1, 4096, 1024, 1024, 1024, 4096]
    - [8, 11446.0]
  - - [1024, 3340, 1, 4096, 1024, 1024, 1024, 4096]
    - [39, 10937.0]
  - - [4096, 3480, 1, 1024, 4096, 4096, 4096, 1024]
    - [1, 12071.0]
  - - [4096, 3424, 1, 1024, 4096, 4096, 4096, 1024]
    - [1, 12215.0]
  - - [1024, 3906, 1, 1024, 1024, 1024, 1024, 1024]
    - [7, 11336.0]
  - - [4096, 3265, 1, 1024, 4096, 4096, 4096, 1024]
    - [1, 12171.0]
  - - [1024, 3384, 1, 4096, 1024, 1024, 1024, 4096]
    - [8, 11750.0]
  - - [1024, 3494, 1, 4096, 1024, 1024, 1024, 4096]
    - [25, 10713.0]
  - - [1024, 3236, 1, 4096, 1024, 1024, 1024, 4096]
    - [39, 10985.0]
  - - [4096, 3497, 1, 1024, 4096, 4096, 4096, 1024]
    - [1, 12087.0]
  - - [4096, 3354, 1, 1024, 4096, 4096, 4096, 1024]
    - [1, 11954.0]
  - - [4096, 3055, 1, 1024, 4096, 4096, 4096, 1024]
    - [1, 12253.0]
  - - [4096, 3244, 1, 1024, 4096, 4096, 4096, 1024]
    - [1, 12100.0]
  - - [4096, 3139, 1, 1024, 4096, 4096, 4096, 1024]
    - [1, 12272.0]
  - - [4096, 3508, 1, 1024, 4096, 4096, 4096, 1024]
    - [1, 12198.0]
  - - [4096, 4050, 1, 1024, 4096, 4096, 4096, 1024]
    - [1, 12207.0]
  - - [1024, 3472, 1, 4096, 1024, 1024, 1024, 4096]
    - [7, 11478.0]
  - - [1024, 3861, 1, 1024, 1024, 1024, 1024, 1024]
    - [21, 10957.0]
  - - [1024, 3910, 1, 1024, 1024, 1024, 1024, 1024]
    - [4, 11177.0]
  - - [4096, 3371, 1, 1024, 4096, 4096, 4096, 1024]
    - [1, 12005.0]
  - - [1024, 3751, 1, 4096, 1024, 1024, 1024, 4096]
    - [27, 11988.0]
  - - [4096, 3325, 1, 1024, 4096, 4096, 4096, 1024]
    - [8, 12347.0]
  - - [1024, 3321, 1, 4096, 1024, 1024, 1024, 4096]
    - [8, 11550.0]
  - - [1024, 3944, 1, 1024, 1024, 1024, 1024, 1024]
    - [21, 11439.0]
  - - [4096, 3525, 1, 1024, 4096, 4096, 4096, 1024]
    - [1, 12237.0]
  - - [4096, 3382, 1, 1024, 4096, 4096, 4096, 1024]
    - [1, 12081.0]
  - - [1024, 3453, 1, 4096, 1024, 1024, 1024, 4096]
    - [8, 11987.0]
  - - [4096, 3564, 1, 1024, 4096, 4096, 4096, 1024]
    - [1, 12338.0]
  - - [4096, 3288, 1, 1024, 4096, 4096, 4096, 1024]
    - [1, 12270.0]
  - - [1024, 3925, 1, 4096, 1024, 1024, 1024, 4096]
    - [22, 11671.0]
  - - [1024, 3057, 1, 4096, 1024, 1024, 1024, 4096]
    - [6, 11642.0]
  - - [4096, 3488, 1, 1024, 4096, 4096, 4096, 1024]
    - [1, 12089.0]
  - - [4096, 3046, 1, 1024, 4096, 4096, 4096, 1024]
    - [1, 12233.0]
  - - [1024, 3189, 1, 4096, 1024, 1024, 1024, 4096]
    - [4, 12036.0]
  - - [4096, 3399, 1, 1024, 4096, 4096, 4096, 1024]
    - [1, 12062.0]
  - - [1024, 3383, 1, 4096, 1024, 1024, 1024, 4096]
    - [36, 11795.0]
  - - [1024, 3415, 1, 4096, 1024, 1024, 1024, 4096]
    - [22, 11937.0]
  - - [1024, 3388, 1, 4096, 1024, 1024, 1024, 4096]
    - [4, 11660.0]
  - - [1024, 3376, 1, 4096, 1024, 1024, 1024, 4096]
    - [39, 10923.0]
  - - [1024, 3473, 1, 4096, 1024, 1024, 1024, 4096]
    - [25, 10593.0]
  - - [4096, 3162, 1, 1024, 4096, 4096, 4096, 1024]
    - [1, 12253.0]
  - - [1024, 3448, 1, 4096, 1024, 1024, 1024, 4096]
    - [22, 12025.0]
  - - [4096, 3362, 1, 1024, 4096, 4096, 4096, 1024]
    - [1, 11913.0]
  - - [1024, 3262, 1, 4096, 1024, 1024, 1024, 4096]
    - [4, 11319.0]
  - - [1024, 3184, 1, 4096, 1024, 1024, 1024, 4096]
    - [39, 11821.0]
  - - [1024, 3378, 1, 4096, 1024, 1024, 1024, 4096]
    - [39, 11007.0]
  - - [4096, 3548, 1, 1024, 4096, 4096, 4096, 1024]
    - [8, 12300.0]
  - - [4096, 2977, 1, 1024, 4096, 4096, 4096, 1024]
    - [1, 11970.0]
  - - [4096, 3443, 1, 1024, 4096, 4096, 4096, 1024]
    - [1, 12277.0]
  - - [1024, 3289, 1, 4096, 1024, 1024, 1024, 4096]
    - [4, 11392.0]
  - - [1024, 3483, 1, 4096, 1024, 1024, 1024, 4096]
    - [19, 10669.0]
  - - [4096, 3190, 1, 1024, 4096, 4096, 4096, 1024]
    - [1, 12423.0]
  - - [1024, 3421, 1, 4096, 1024, 1024, 1024, 4096]
    - [22, 11923.0]
  - - [1024, 3514, 1, 4096, 1024, 1024, 1024, 4096]
    - [25, 10775.0]
  - - [1024, 3532, 1, 4096, 1024, 1024, 1024, 4096]
    - [39, 10746.0]
  - - [1024, 3565, 1, 4096, 1024, 1024, 1024, 4096]
    - [25, 10868.0]
  - - [4096, 3422, 1, 1024, 4096, 4096, 4096, 1024]
    - [1, 12147.0]
  - - [4096, 3263, 1, 1024, 4096, 4096, 4096, 1024]
    - [1, 12156.0]
  - - [4096, 3296, 1, 1024, 4096, 4096, 4096, 1024]
    - [1, 12293.0]
  - - [4096, 3640, 1, 1024, 4096, 4096, 4096, 1024]
    - [1, 12165.0]
  - - [4096, 3463, 1, 1024, 4096, 4096, 4096, 1024]
    - [1, 12059.0]
  - - [4096, 3528, 1, 1024, 4096, 4096, 4096, 1024]
    - [1, 12279.0]
  - - [1024, 3351, 1, 4096, 1024, 1024, 1024, 4096]
    - [8, 11631.0]
  - - [1024, 3462, 1, 4096, 1024, 1024, 1024, 4096]
    - [25, 10572.0]
  - - [4096, 3226, 1, 1024, 4096, 4096, 4096, 1024]
    - [1, 11994.0]
  - - [4096, 3439, 1, 1024, 4096, 4096, 4096, 1024]
    - [1, 12238.0]
  - - [4096, 3121, 1, 1024, 4096, 4096, 4096, 1024]
    - [1, 12177.0]
  - - [1024, 4059, 1, 33708, 1024, 1024, 1024, 33708]
    - [1, 11978.0]
  - - [1024, 3311, 1, 4096, 1024, 1024, 1024, 4096]
    - [8, 11518.0]
  - - [1024, 3230, 1, 4096, 1024, 1024, 1024, 4096]
    - [39, 10991.0]
  - - [4096, 3353, 1, 1024, 4096, 4096, 4096, 1024]
    - [1, 11917.0]
  - - [4096, 3402, 1, 1024, 4096, 4096, 4096, 1024]
    - [1, 12121.0]
  - - [1024, 3427, 1, 4096, 1024, 1024, 1024, 4096]
    - [22, 11950.0]
  - - [1024, 3346, 1, 4096, 1024, 1024, 1024, 4096]
    - [39, 10867.0]
  - - [1024, 3126, 1, 4096, 1024, 1024, 1024, 4096]
    - [39, 11553.0]
  - - [1024, 3796, 1, 1024, 1024, 1024, 1024, 1024]
    - [8, 11473.0]
  - - [1024, 3990, 1, 4096, 1024, 1024, 1024, 4096]
    - [22, 11774.0]
  - - [1024, 3257, 1, 4096, 1024, 1024, 1024, 4096]
    - [4, 11306.0]
  - - [4096, 3996, 1, 1024, 4096, 4096, 4096, 1024]
    - [1, 12032.0]
  - - [1024, 3306, 1, 4096, 1024, 1024, 1024, 4096]
    - [4, 11424.0]
  - - [1024, 3389, 1, 4096, 1024, 1024, 1024, 4096]
    - [25, 11032.0]
  - - [1024, 3500, 1, 4096, 1024, 1024, 1024, 4096]
    - [25, 10702.0]
  - - [1024, 3999, 1, 33708, 1024, 1024, 1024, 33708]
    - [25, 11837.0]
  - - [4096, 3486, 1, 1024, 4096, 4096, 4096, 1024]
    - [1, 12111.0]
  - - [1024, 3438, 1, 4096, 1024, 1024, 1024, 4096]
    - [8, 11934.0]
  - - [4096, 3616, 1, 1024, 4096, 4096, 4096, 1024]
    - [8, 12008.0]
  - - [1024, 3955, 1, 1024, 1024, 1024, 1024, 1024]
    - [7, 11407.0]
  - - [4096, 3430, 1, 1024, 4096, 4096, 4096, 1024]
    - [1, 12211.0]
  - - [4096, 3271, 1, 1024, 4096, 4096, 4096, 1024]
    - [1, 12197.0]
  - - [1024, 3364, 1, 4096, 1024, 1024, 1024, 4096]
    - [4, 11594.0]
  - - [1024, 3497, 1, 4096, 1024, 1024, 1024, 4096]
    - [25, 10747.0]
  - - [4096, 3503, 1, 1024, 4096, 4096, 4096, 1024]
    - [1, 12132.0]
  - - [4096, 3344, 1, 1024, 4096, 4096, 4096, 1024]
    - [1, 11937.0]
  - - [1024, 3457, 1, 4096, 1024, 1024, 1024, 4096]
    - [6, 11051.0]
  - - [4096, 3466, 1, 1024, 4096, 4096, 4096, 1024]
    - [1, 12020.0]
  - - [1024, 3976, 1, 33708, 1024, 1024, 1024, 33708]
    - [1, 11732.0]
  - - [1024, 3395, 1, 4096, 1024, 1024, 1024, 4096]
    - [8, 11780.0]
  - - [4096, 3361, 1, 1024, 4096, 4096, 4096, 1024]
    - [8, 11968.0]
  - - [1024, 3751, 1, 33708, 1024, 1024, 1024, 33708]
    - [6, 12018.0]
  - - [1024, 3822, 1, 1024, 1024, 1024, 1024, 1024]
    - [8, 11756.0]
  - - [4096, 3315, 1, 1024, 4096, 4096, 4096, 1024]
    - [1, 12339.0]
  - - [1024, 3163, 1, 4096, 1024, 1024, 1024, 4096]
    - [8, 12081.0]
  - - [4096, 3547, 1, 1024, 4096, 4096, 4096, 1024]
    - [1, 12263.0]
  - - [4096, 3340, 1, 1024, 4096, 4096, 4096, 1024]
    - [1, 11918.0]
  - - [1024, 3296, 1, 4096, 1024, 1024, 1024, 4096]
    - [4, 11378.0]
  - - [1024, 3468, 1, 4096, 1024, 1024, 1024, 4096]
    - [19, 10587.0]
  - - [4096, 3294, 1, 1024, 4096, 4096, 4096, 1024]
    - [8, 12207.0]
  - - [1024, 3406, 1, 4096, 1024, 1024, 1024, 4096]
    - [8, 11793.0]
  - - [1024, 3860, 1, 33708, 1024, 1024, 1024, 33708]
    - [1, 11410.0]
  - - [1024, 3584, 1, 4096, 1024, 1024, 1024, 4096]
    - [8, 11559.0]
  - - [4096, 3189, 1, 1024, 4096, 4096, 4096, 1024]
    - [8, 12386.0]
  - - [4096, 3494, 1, 1024, 4096, 4096, 4096, 1024]
    - [1, 12185.0]
  - - [1024, 3093, 1, 4096, 1024, 1024, 1024, 4096]
    - [4, 11657.0]
  - - [4096, 3421, 1, 1024, 4096, 4096, 4096, 1024]
    - [1, 12154.0]
  - - [1024, 3479, 1, 4096, 1024, 1024, 1024, 4096]
    - [7, 11507.0]
  - - [1024, 3433, 1, 4096, 1024, 1024, 1024, 4096]
    - [22, 11969.0]
  - - [4096, 3311, 1, 1024, 4096, 4096, 4096, 1024]
    - [1, 12256.0]
  - - [1024, 3381, 1, 4096, 1024, 1024, 1024, 4096]
    - [8, 11760.0]
  - - [1024, 3996, 1, 4096, 1024, 1024, 1024, 4096]
    - [22, 11784.0]
  - - [4096, 3384, 1, 1024, 4096, 4096, 4096, 1024]
    - [8, 12010.0]
  - - [1024, 3247, 1, 4096, 1024, 1024, 1024, 4096]
    - [4, 11253.0]
  - - [1024, 3169, 1, 4096, 1024, 1024, 1024, 4096]
    - [39, 11761.0]
  - - [1024, 3088, 1, 4096, 1024, 1024, 1024, 4096]
    - [11, 11486.0]
  - - [1024, 3363, 1, 4096, 1024, 1024, 1024, 4096]
    - [39, 10958.0]
  - - [1024, 3538, 1, 4096, 1024, 1024, 1024, 4096]
    - [25, 10807.0]
  - - [1024, 3996, 1, 1024, 1024, 1024, 1024, 1024]
    - [22, 11170.0]
  - - [4096, 3169, 1, 1024, 4096, 4096, 4096, 1024]
    - [1, 12339.0]
  - - [4096, 3538, 1, 1024, 4096, 4096, 4096, 1024]
    - [1, 12255.0]
  - - [4096, 3401, 1, 1024, 4096, 4096, 4096, 1024]
    - [1, 12129.0]
  - - [4096, 3581, 1, 1024, 4096, 4096, 4096, 1024]
    - [1, 12428.0]
  - - [1024, 3180, 1, 4096, 1024, 1024, 1024, 4096]
    - [4, 12014.0]
  - - [1024, 3870, 1, 1024, 1024, 1024, 1024, 1024]
    - [8, 10997.0]
  - - [4096, 3555, 1, 1024, 4096, 4096, 4096, 1024]
    - [1, 12345.0]
  - - [4096, 3412, 1, 1024, 4096, 4096, 4096, 1024]
    - [1, 12170.0]
  - - [4096, 3302, 1, 1024, 4096, 4096, 4096, 1024]
    - [1, 12320.0]
  - - [1024, 3561, 1, 4096, 1024, 1024, 1024, 4096]
    - [8, 11486.0]
  - - [1024, 3302, 1, 4096, 1024, 1024, 1024, 4096]
    - [19, 10865.0]
  - - [1024, 3976, 1, 4096, 1024, 1024, 1024, 4096]
    - [25, 9990.0]
  - - [4096, 3485, 1, 1024, 4096, 4096, 4096, 1024]
    - [1, 12076.0]
  - - [4096, 3534, 1, 1024, 4096, 4096, 4096, 1024]
    - [1, 12316.0]
  - - [1024, 3110, 1, 4096, 1024, 1024, 1024, 4096]
    - [4, 11750.0]
  - - [1024, 3401, 1, 4096, 1024, 1024, 1024, 4096]
    - [25, 10889.0]
  - - [4096, 3216, 1, 1024, 4096, 4096, 4096, 1024]
    - [1, 11974.0]
  - - [1024, 4020, 1, 33708, 1024, 1024, 1024, 33708]
    - [1, 11867.0]
  - - [1024, 3215, 1, 4096, 1024, 1024, 1024, 4096]
    - [8, 11267.0]
  - - [4096, 3566, 1, 1024, 4096, 4096, 4096, 1024]
    - [1, 12309.0]
  - - [1024, 3137, 1, 4096, 1024, 1024, 1024, 4096]
    - [4, 11842.0]
  - - [4096, 3359, 1, 1024, 4096, 4096, 4096, 1024]
    - [1, 11958.0]
  - - [4096, 3392, 1, 1024, 4096, 4096, 4096, 1024]
    - [1, 12125.0]
  - - [1024, 3506, 1, 4096, 1024, 1024, 1024, 4096]
    - [7, 11638.0]
  - - [4096, 3233, 1, 1024, 4096, 4096, 4096, 1024]
    - [1, 12044.0]
  - - [1024, 3444, 1, 4096, 1024, 1024, 1024, 4096]
    - [22, 12046.0]
  - - [1024, 3975, 1, 4096, 1024, 1024, 1024, 4096]
    - [25, 11716.0]
  - - [1024, 3870, 1, 33708, 1024, 1024, 1024, 33708]
    - [16, 11438.0]
  - - [4096, 3465, 1, 1024, 4096, 4096, 4096, 1024]
    - [1, 12048.0]
  - - [1024, 3523, 1, 4096, 1024, 1024, 1024, 4096]
    - [8, 11370.0]
  - - [4096, 3990, 1, 1024, 4096, 4096, 4096, 1024]
    - [1, 12008.0]
  - - [1024, 3549, 1, 4096, 1024, 1024, 1024, 4096]
    - [6, 11356.0]
  - - [1024, 3342, 1, 4096, 1024, 1024, 1024, 4096]
    - [39, 10915.0]
  - - [4096, 3476, 1, 1024, 4096, 4096, 4096, 1024]
    - [1, 12060.0]
  - - [1024, 3418, 1, 4096, 1024, 1024, 1024, 4096]
    - [22, 11990.0]
  - - [1024, 3859, 1, 1024, 1024, 1024, 1024, 1024]
    - [21, 10915.0]
  - - [4096, 3339, 1, 1024, 4096, 4096, 4096, 1024]
    - [8, 11875.0]
  - - [4096, 3452, 1, 1024, 4096, 4096, 4096, 1024]
    - [1, 12286.0]
  - - [4096, 3293, 1, 1024, 4096, 4096, 4096, 1024]
    - [1, 12264.0]
  - - [1024, 3369, 1, 4096, 1024, 1024, 1024, 4096]
    - [8, 11725.0]
  - - [1024, 3544, 1, 4096, 1024, 1024, 1024, 4096]
    - [25, 10840.0]
  - - [4096, 3493, 1, 1024, 4096, 4096, 4096, 1024]
    - [1, 12116.0]
  - - [4096, 3350, 1, 1024, 4096, 4096, 4096, 1024]
    - [1, 11983.0]
  - - [4096, 3256, 1, 1024, 4096, 4096, 4096, 1024]
    - [1, 12161.0]
  - - [1024, 3870, 1, 4096, 1024, 1024, 1024, 4096]
    - [8, 11537.0]
  - - [4096, 4012, 1, 1024, 4096, 4096, 4096, 1024]
    - [1, 12073.0]
  - - [1024, 3280, 1, 4096, 1024, 1024, 1024, 4096]
    - [4, 11341.0]
  - - [4096, 3456, 1, 1024, 4096, 4096, 4096, 1024]
    - [1, 12296.0]
  - - [1024, 3555, 1, 4096, 1024, 1024, 1024, 4096]
    - [6, 11400.0]
  - - [4096, 3014, 1, 1024, 4096, 4096, 4096, 1024]
    - [1, 12063.0]
  - - [1024, 3474, 1, 4096, 1024, 1024, 1024, 4096]
    - [7, 11524.0]
  - - [4096, 3367, 1, 1024, 4096, 4096, 4096, 1024]
    - [8, 11976.0]
  - - [4096, 3432, 1, 1024, 4096, 4096, 4096, 1024]
    - [1, 12239.0]
  - - [4096, 3273, 1, 1024, 4096, 4096, 4096, 1024]
    - [1, 12167.0]
  - - [4096, 3130, 1, 1024, 4096, 4096, 4096, 1024]
    - [1, 12261.0]
  - - [1024, 2984, 1, 4096, 1024, 1024, 1024, 4096]
    - [6, 11404.0]
  - - [1024, 3995, 1, 1024, 1024, 1024, 1024, 1024]
    - [8, 11530.0]
  - - [1024, 3517, 1, 4096, 1024, 1024, 1024, 4096]
    - [3, 11318.0]
  - - [1024, 3455, 1, 4096, 1024, 1024, 1024, 4096]
    - [39, 11067.0]
  - - [1024, 3939, 1, 4096, 1024, 1024, 1024, 4096]
    - [22, 11651.0]
  - - [4096, 3147, 1, 1024, 4096, 4096, 4096, 1024]
    - [8, 12247.0]
  - - [4096, 3516, 1, 1024, 4096, 4096, 4096, 1024]
    - [1, 12247.0]
  - - [1024, 3876, 1, 4096, 1024, 1024, 1024, 4096]
    - [22, 11518.0]
  - - [1024, 3191, 1, 4096, 1024, 1024, 1024, 4096]
    - [4, 12088.0]
  - - [4096, 3411, 1, 1024, 4096, 4096, 4096, 1024]
    - [8, 12163.0]
  - - [1024, 3337, 1, 4096, 1024, 1024, 1024, 4096]
    - [4, 11552.0]
  - - [1024, 3512, 1, 4096, 1024, 1024, 1024, 4096]
    - [25, 10749.0]
  - - [4096, 3301, 1, 1024, 4096, 4096, 4096, 1024]
    - [1, 12266.0]
  - - [1024, 3450, 1, 4096, 1024, 1024, 1024, 4096]
    - [22, 12057.0]
  - - [4096, 3533, 1, 1024, 4096, 4096, 4096, 1024]
    - [8, 12250.0]
  - - [4096, 3390, 1, 1024, 4096, 4096, 4096, 1024]
    - [1, 12115.0]
  - - [4096, 3231, 1, 1024, 4096, 4096, 4096, 1024]
    - [1, 12080.0]
  - - [1024, 2499, 1, 4096, 1024, 1024, 1024, 4096]
    - [8, 11852.0]
  - - [1024, 3186, 1, 4096, 1024, 1024, 1024, 4096]
    - [4, 12079.0]
  - - [1024, 3380, 1, 4096, 1024, 1024, 1024, 4096]
    - [39, 10993.0]
  - - [4096, 3496, 1, 1024, 4096, 4096, 4096, 1024]
    - [1, 12124.0]
  - - [1024, 3956, 1, 33708, 1024, 1024, 1024, 33708]
    - [16, 11695.0]
  - - [1024, 3976, 1, 1024, 1024, 1024, 1024, 1024]
    - [22, 11376.0]
  - - [4096, 2736, 1, 1024, 4096, 4096, 4096, 1024]
    - [1, 11913.0]
  - - [1024, 3291, 1, 4096, 1024, 1024, 1024, 4096]
    - [8, 11491.0]
  - - [1024, 3944, 1, 33708, 1024, 1024, 1024, 33708]
    - [16, 11657.0]
  - - [1024, 3485, 1, 4096, 1024, 1024, 1024, 4096]
    - [7, 11574.0]
  - - [4096, 3138, 1, 1024, 4096, 4096, 4096, 1024]
    - [8, 12166.0]
  - - [1024, 3423, 1, 4096, 1024, 1024, 1024, 4096]
    - [8, 11854.0]
  - - [1024, 3491, 1, 4096, 1024, 1024, 1024, 4096]
    - [39, 10694.0]
  - - [1024, 3860, 1, 4096, 1024, 1024, 1024, 4096]
    - [39, 10153.0]
  - - [4096, 3211, 1, 1024, 4096, 4096, 4096, 1024]
    - [8, 11921.0]
  - - [1024, 3221, 1, 4096, 1024, 1024, 1024, 4096]
    - [4, 11148.0]
  - - [1024, 2917, 1, 4096, 1024, 1024, 1024, 4096]
    - [27, 11051.0]
  - - [4096, 3475, 1, 1024, 4096, 4096, 4096, 1024]
    - [8, 12017.0]
  - - [4096, 3524, 1, 1024, 4096, 4096, 4096, 1024]
    - [1, 12241.0]
  - - [4096, 2985, 1, 1024, 4096, 4096, 4096, 1024]
    - [1, 11971.0]
  - - [1024, 3480, 1, 4096, 1024, 1024, 1024, 4096]
    - [6, 11142.0]
  - - [4096, 3222, 1, 1024, 4096, 4096, 4096, 1024]
    - [8, 11955.0]
  - - [4096, 3451, 1, 1024, 4096, 4096, 4096, 1024]
    - [1, 12274.0]
  - - [1024, 3969, 1, 33708, 1024, 1024, 1024, 33708]
    - [1, 11717.0]
  - - [1024, 3640, 1, 1024, 1024, 1024, 1024, 1024]
    - [21, 11344.0]
  - - [1024, 3297, 1, 4096, 1024, 1024, 1024, 4096]
    - [8, 11486.0]
  - - [4096, 3944, 1, 1024, 4096, 4096, 4096, 1024]
    - [1, 12298.0]
  - - [1024, 3216, 1, 4096, 1024, 1024, 1024, 4096]
    - [4, 11112.0]
  - - [4096, 3349, 1, 1024, 4096, 4096, 4096, 1024]
    - [1, 11901.0]
  - - [4096, 3398, 1, 1024, 4096, 4096, 4096, 1024]
    - [1, 12089.0]
  - - [1024, 3154, 1, 4096, 1024, 1024, 1024, 4096]
    - [4, 11889.0]
  - - [1024, 3978, 1, 33708, 1024, 1024, 1024, 33708]
    - [16, 11730.0]
  - - [1024, 3348, 1, 4096, 1024, 1024, 1024, 4096]
    - [8, 11622.0]
  - - [4096, 3304, 1, 1024, 4096, 4096, 4096, 1024]
    - [8, 12219.0]
  - - [4096, 4030, 1, 1024, 4096, 4096, 4096, 1024]
    - [1, 12151.0]
  - - [1024, 4026, 1, 1024, 1024, 1024, 1024, 1024]
    - [22, 11651.0]
  - - [4096, 3471, 1, 1024, 4096, 4096, 4096, 1024]
    - [1, 12084.0]
  - - [1024, 3259, 1, 4096, 1024, 1024, 1024, 4096]
    - [4, 11239.0]
  - - [1024, 3308, 1, 4096, 1024, 1024, 1024, 4096]
    - [39, 11083.0]
  - - [4096, 3391, 1, 1024, 4096, 4096, 4096, 1024]
    - [1, 12045.0]
  - - [1024, 3312, 1, 4096, 1024, 1024, 1024, 4096]
    - [4, 11448.0]
  - - [1024, 3502, 1, 4096, 1024, 1024, 1024, 4096]
    - [25, 10726.0]
  - - [1024, 3968, 1, 33708, 1024, 1024, 1024, 33708]
    - [8, 11706.0]
  - - [1024, 3424, 1, 4096, 1024, 1024, 1024, 4096]
    - [8, 11865.0]
  - - [4096, 4032, 1, 1024, 4096, 4096, 4096, 1024]
    - [1, 12119.0]
  - - [1024, 3900, 1, 1024, 1024, 1024, 1024, 1024]
    - [8, 11309.0]
  - - [4096, 3442, 1, 1024, 4096, 4096, 4096, 1024]
    - [1, 12230.0]
  - - [1024, 3366, 1, 4096, 1024, 1024, 1024, 4096]
    - [8, 11700.0]
  - - [4096, 3999, 1, 1024, 4096, 4096, 4096, 1024]
    - [1, 12017.0]
  - - [1024, 3477, 1, 4096, 1024, 1024, 1024, 4096]
    - [7, 11522.0]
  - - [1024, 2505, 1, 4096, 1024, 1024, 1024, 4096]
    - [8, 11745.0]
  - - [4096, 3515, 1, 1024, 4096, 4096, 4096, 1024]
    - [1, 12170.0]
  - - [1024, 3564, 1, 4096, 1024, 1024, 1024, 4096]
    - [4, 11386.0]
  - - [4096, 3057, 1, 1024, 4096, 4096, 4096, 1024]
    - [8, 12229.0]
  - - [1024, 3339, 1, 4096, 1024, 1024, 1024, 4096]
    - [4, 11550.0]
  - - [4096, 3262, 1, 1024, 4096, 4096, 4096, 1024]
    - [1, 12137.0]
  - - [1024, 4030, 1, 4096, 1024, 1024, 1024, 4096]
    - [22, 11860.0]
  - - [1024, 3265, 1, 4096, 1024, 1024, 1024, 4096]
    - [4, 11338.0]
  - - [1024, 3459, 1, 4096, 1024, 1024, 1024, 4096]
    - [25, 10634.0]
  - - [4096, 3462, 1, 1024, 4096, 4096, 4096, 1024]
    - [8, 12022.0]
  - - [1024, 3513, 1, 4096, 1024, 1024, 1024, 4096]
    - [7, 11654.0]
  - - [1024, 3397, 1, 4096, 1024, 1024, 1024, 4096]
    - [39, 11004.0]
  - - [4096, 3572, 1, 1024, 4096, 4096, 4096, 1024]
    - [8, 12366.0]
  - - [4096, 3389, 1, 1024, 4096, 4096, 4096, 1024]
    - [1, 12079.0]
  - - [4096, 3438, 1, 1024, 4096, 4096, 4096, 1024]
    - [1, 12264.0]
  - - [1024, 3640, 1, 33708, 1024, 1024, 1024, 33708]
    - [6, 11671.0]
  - - [1024, 3995, 1, 33708, 1024, 1024, 1024, 33708]
    - [1, 11789.0]
  - - [1024, 3165, 1, 4096, 1024, 1024, 1024, 4096]
    - [8, 12112.0]
  - - [4096, 3543, 1, 1024, 4096, 4096, 4096, 1024]
    - [1, 12281.0]
  - - [4096, 3352, 1, 1024, 4096, 4096, 4096, 1024]
    - [1, 11970.0]
  - - [1024, 3359, 1, 4096, 1024, 1024, 1024, 4096]
    - [4, 11592.0]
  - - [1024, 3470, 1, 4096, 1024, 1024, 1024, 4096]
    - [19, 10698.0]
  - - [1024, 3392, 1, 4096, 1024, 1024, 1024, 4096]
    - [39, 11013.0]
  - - [4096, 3137, 1, 1024, 4096, 4096, 4096, 1024]
    - [1, 12219.0]
  - - [4096, 3506, 1, 1024, 4096, 4096, 4096, 1024]
    - [1, 12219.0]
  - - [1024, 3095, 1, 4096, 1024, 1024, 1024, 4096]
    - [4, 11699.0]
  - - [1024, 3859, 1, 4096, 1024, 1024, 1024, 4096]
    - [22, 11462.0]
  - - [4096, 3369, 1, 1024, 4096, 4096, 4096, 1024]
    - [8, 11971.0]
  - - [1024, 3435, 1, 4096, 1024, 1024, 1024, 4096]
    - [4, 11867.0]
  - - [1024, 3354, 1, 4096, 1024, 1024, 1024, 4096]
    - [39, 10917.0]
  - - [1024, 3055, 1, 4096, 1024, 1024, 1024, 4096]
    - [27, 11479.0]
  - - [4096, 3523, 1, 1024, 4096, 4096, 4096, 1024]
    - [1, 12213.0]
  - - [4096, 3380, 1, 1024, 4096, 4096, 4096, 1024]
    - [1, 12032.0]
  - - [1024, 3233, 1, 4096, 1024, 1024, 1024, 4096]
    - [4, 11195.0]
  - - [4096, 3221, 1, 1024, 4096, 4096, 4096, 1024]
    - [1, 11971.0]
  - - [4096, 3270, 1, 1024, 4096, 4096, 4096, 1024]
    - [1, 12174.0]
  - - [4096, 3593, 1, 1024, 4096, 4096, 4096, 1024]
    - [1, 11990.0]
  - - [1024, 3358, 1, 4096, 1024, 1024, 1024, 4096]
    - [4, 11599.0]
  - - [1024, 3540, 1, 4096, 1024, 1024, 1024, 4096]
    - [8, 11411.0]
  - - [4096, 3502, 1, 1024, 4096, 4096, 4096, 1024]
    - [8, 12209.0]
  - - [4096, 2505, 1, 1024, 4096, 4096, 4096, 1024]
    - [1, 12214.0]
  - - [4096, 3397, 1, 1024, 4096, 4096, 4096, 1024]
    - [1, 12158.0]
  - - [1024, 3300, 1, 4096, 1024, 1024, 1024, 4096]
    - [8, 11513.0]
  - - [4096, 3095, 1, 1024, 4096, 4096, 4096, 1024]
    - [1, 12045.0]
  - - [1024, 3182, 1, 4096, 1024, 1024, 1024, 4096]
    - [4, 12024.0]
  - - [1024, 3299, 1, 4096, 1024, 1024, 1024, 4096]
    - [19, 11080.0]
  - - [1024, 3276, 1, 4096, 1024, 1024, 1024, 4096]
    - [39, 11066.0]
  - - [1024, 3360, 1, 4096, 1024, 1024, 1024, 4096]
    - [39, 10991.0]
  - - [4096, 3360, 1, 1024, 4096, 4096, 4096, 1024]
    - [1, 11942.0]
  - - [4096, 2918, 1, 1024, 4096, 4096, 4096, 1024]
    - [1, 12320.0]
  - - [1024, 3939, 1, 33708, 1024, 1024, 1024, 33708]
    - [1, 11635.0]
  - - [4096, 3314, 1, 1024, 4096, 4096, 4096, 1024]
    - [1, 12328.0]
  - - [1024, 3319, 1, 4096, 1024, 1024, 1024, 4096]
    - [7, 11541.0]
  - - [1024, 3942, 1, 1024, 1024, 1024, 1024, 1024]
    - [21, 11082.0]
  - - [1024, 3465, 1, 4096, 1024, 1024, 1024, 4096]
    - [39, 10637.0]
  - - [4096, 3546, 1, 1024, 4096, 4096, 4096, 1024]
    - [8, 12271.0]
  - - [1024, 3403, 1, 4096, 1024, 1024, 1024, 4096]
    - [8, 11828.0]
  - - [1024, 3948, 1, 1024, 1024, 1024, 1024, 1024]
    - [8, 11201.0]
  - - [4096, 3441, 1, 1024, 4096, 4096, 4096, 1024]
    - [1, 12251.0]
  - - [1024, 3139, 1, 4096, 1024, 1024, 1024, 4096]
    - [4, 11885.0]
  - - [1024, 3563, 1, 4096, 1024, 1024, 1024, 4096]
    - [39, 10787.0]
  - - [1024, 3508, 1, 4096, 1024, 1024, 1024, 4096]
    - [39, 10676.0]
  - - [1024, 3975, 1, 33708, 1024, 1024, 1024, 33708]
    - [1, 11729.0]
  - - [1024, 3446, 1, 4096, 1024, 1024, 1024, 4096]
    - [8, 11953.0]
  - - [1024, 3529, 1, 4096, 1024, 1024, 1024, 4096]
    - [39, 10818.0]
  - - [4096, 3461, 1, 1024, 4096, 4096, 4096, 1024]
    - [1, 12009.0]
  - - [1024, 3574, 1, 4096, 1024, 1024, 1024, 4096]
    - [8, 11524.0]
  - - [1024, 3101, 1, 4096, 1024, 1024, 1024, 4096]
    - [39, 11505.0]
  - - [1024, 3927, 1, 1024, 1024, 1024, 1024, 1024]
    - [8, 11129.0]
  - - [4096, 3224, 1, 1024, 4096, 4096, 4096, 1024]
    - [1, 11980.0]
  - - [4096, 3437, 1, 1024, 4096, 4096, 4096, 1024]
    - [1, 12250.0]
  - - [4096, 3900, 1, 1024, 4096, 4096, 4096, 1024]
    - [1, 12242.0]
  - - [1024, 3495, 1, 4096, 1024, 1024, 1024, 4096]
    - [7, 11613.0]
  - - [1024, 3977, 1, 33708, 1024, 1024, 1024, 33708]
    - [1, 11734.0]
  - - [1024, 3328, 1, 4096, 1024, 1024, 1024, 4096]
    - [8, 11575.0]
  - - [4096, 3168, 1, 1024, 4096, 4096, 4096, 1024]
    - [8, 12324.0]
  - - [1024, 4026, 1, 33708, 1024, 1024, 1024, 33708]
    - [4, 11928.0]
  - - [1024, 3292, 1, 4096, 1024, 1024, 1024, 4096]
    - [8, 11478.0]
  - - [1024, 3294, 1, 4096, 1024, 1024, 1024, 4096]
    - [25, 10979.0]
  - - [4096, 3335, 1, 1024, 4096, 4096, 4096, 1024]
    - [1, 11835.0]
  - - [4096, 3400, 1, 1024, 4096, 4096, 4096, 1024]
    - [1, 12111.0]
  - - [1024, 3287, 1, 4096, 1024, 1024, 1024, 4096]
    - [4, 11373.0]
  - - [1024, 3910, 1, 4096, 1024, 1024, 1024, 4096]
    - [22, 11638.0]
  - - [1024, 3780, 1, 1024, 1024, 1024, 1024, 1024]
    - [8, 11731.0]
  - - [4096, 3098, 1, 1024, 4096, 4096, 4096, 1024]
    - [1, 12063.0]
  - - [1024, 3584, 1, 33708, 1024, 1024, 1024, 33708]
    - [6, 11532.0]
  - - [1024, 3371, 1, 4096, 1024, 1024, 1024, 4096]
    - [8, 11699.0]
  - - [1024, 3546, 1, 4096, 1024, 1024, 1024, 4096]
    - [25, 10700.0]
  - - [1024, 4012, 1, 1024, 1024, 1024, 1024, 1024]
    - [22, 11176.0]
  - - [4096, 3505, 1, 1024, 4096, 4096, 4096, 1024]
    - [1, 12153.0]
  - - [4096, 3554, 1, 1024, 4096, 4096, 4096, 1024]
    - [1, 12339.0]
  - - [4096, 3063, 1, 1024, 4096, 4096, 4096, 1024]
    - [1, 12273.0]
  - - [1024, 3900, 1, 33708, 1024, 1024, 1024, 33708]
    - [1, 11515.0]
  - - [1024, 3345, 1, 4096, 1024, 1024, 1024, 4096]
    - [8, 11623.0]
  - - [1024, 3357, 1, 4096, 1024, 1024, 1024, 4096]
    - [39, 10949.0]
  - - [1024, 3282, 1, 4096, 1024, 1024, 1024, 4096]
    - [39, 11047.0]
  - - [4096, 3484, 1, 1024, 4096, 4096, 4096, 1024]
    - [1, 12052.0]
  - - [1024, 3557, 1, 4096, 1024, 1024, 1024, 4096]
    - [8, 11469.0]
  - - [1024, 3476, 1, 4096, 1024, 1024, 1024, 4096]
    - [39, 10664.0]
  - - [1024, 3751, 1, 1024, 1024, 1024, 1024, 1024]
    - [39, 11256.0]
  - - [4096, 3379, 1, 1024, 4096, 4096, 4096, 1024]
    - [1, 12008.0]
  - - [4096, 3428, 1, 1024, 4096, 4096, 4096, 1024]
    - [1, 12212.0]
  - - [4096, 3126, 1, 1024, 4096, 4096, 4096, 1024]
    - [1, 12222.0]
  - - [1024, 3325, 1, 4096, 1024, 1024, 1024, 4096]
    - [4, 11472.0]
  - - [4096, 3501, 1, 1024, 4096, 4096, 4096, 1024]
    - [1, 12124.0]
  - - [4096, 3358, 1, 1024, 4096, 4096, 4096, 1024]
    - [1, 11966.0]
  - - [1024, 3441, 1, 4096, 1024, 1024, 1024, 4096]
    - [4, 11831.0]
  - - [1024, 3552, 1, 4096, 1024, 1024, 1024, 4096]
    - [25, 10635.0]
  - - [4096, 3232, 1, 1024, 4096, 4096, 4096, 1024]
    - [1, 12000.0]
  - - [1024, 3412, 1, 4096, 1024, 1024, 1024, 4096]
    - [4, 11750.0]
  - - [1024, 3372, 1, 4096, 1024, 1024, 1024, 4096]
    - [39, 11042.0]
  - - [1024, 3585, 1, 4096, 1024, 1024, 1024, 4096]
    - [25, 10732.0]
  - - [4096, 3143, 1, 1024, 4096, 4096, 4096, 1024]
    - [1, 12221.0]
  - - [4096, 3464, 1, 1024, 4096, 4096, 4096, 1024]
    - [1, 12068.0]
  - - [1024, 3145, 1, 4096, 1024, 1024, 1024, 4096]
    - [4, 11840.0]
  - - [4096, 3375, 1, 1024, 4096, 4096, 4096, 1024]
    - [1, 11972.0]
  - - [4096, 2917, 1, 1024, 4096, 4096, 4096, 1024]
    - [1, 12299.0]
  - - [4096, 3978, 1, 1024, 4096, 4096, 4096, 1024]
    - [1, 12012.0]
  - - [1024, 2765, 1, 4096, 1024, 1024, 1024, 4096]
    - [8, 11720.0]
  - - [1024, 3452, 1, 4096, 1024, 1024, 1024, 4096]
    - [4, 11939.0]
  - - [4096, 3584, 1, 1024, 4096, 4096, 4096, 1024]
    - [8, 12417.0]
  - - [4096, 3545, 1, 1024, 4096, 4096, 4096, 1024]
    - [1, 12349.0]
  - - [1024, 3352, 1, 4096, 1024, 1024, 1024, 4096]
    - [4, 11577.0]
  - - [4096, 3292, 1, 1024, 4096, 4096, 4096, 1024]
    - [8, 12236.0]
  - - [1024, 3525, 1, 4096, 1024, 1024, 1024, 4096]
    - [8, 11387.0]
  - - [1024, 3266, 1, 4096, 1024, 1024, 1024, 4096]
    - [39, 11070.0]
  - - [1024, 3382, 1, 4096, 1024, 1024, 1024, 4096]
    - [39, 10953.0]
  - - [4096, 3492, 1, 1024, 4096, 4096, 4096, 1024]
    - [8, 12103.0]
  - - [4096, 3419, 1, 1024, 4096, 4096, 4096, 1024]
    - [1, 12202.0]
  - - [1024, 3796, 1, 33708, 1024, 1024, 1024, 33708]
    - [6, 12162.0]
  - - [1024, 3293, 1, 4096, 1024, 1024, 1024, 4096]
    - [8, 11479.0]
  - - [4096, 3796, 1, 1024, 4096, 4096, 4096, 1024]
    - [1, 12306.0]
  - - [1024, 3487, 1, 4096, 1024, 1024, 1024, 4096]
    - [3, 11187.0]
  - - [4096, 3166, 1, 1024, 4096, 4096, 4096, 1024]
    - [8, 12299.0]
  - - [1024, 3409, 1, 4096, 1024, 1024, 1024, 4096]
    - [4, 11780.0]
  - - [1024, 3520, 1, 4096, 1024, 1024, 1024, 4096]
    - [19, 10757.0]
  - - [1024, 3573, 1, 4096, 1024, 1024, 1024, 4096]
    - [19, 10872.0]
  - - [4096, 3366, 1, 1024, 4096, 4096, 4096, 1024]
    - [1, 11983.0]
  - - [4096, 3720, 1, 1024, 4096, 4096, 4096, 1024]
    - [1, 12149.0]
  - - [4096, 3207, 1, 1024, 4096, 4096, 4096, 1024]
    - [1, 11935.0]
  - - [4096, 3272, 1, 1024, 4096, 4096, 4096, 1024]
    - [1, 12217.0]
  - - [1024, 3390, 1, 4096, 1024, 1024, 1024, 4096]
    - [8, 11767.0]
  - - [4096, 3183, 1, 1024, 4096, 4096, 4096, 1024]
    - [1, 12395.0]
  - - [4096, 3536, 1, 1024, 4096, 4096, 4096, 1024]
    - [1, 12318.0]
  - - [4096, 3563, 1, 1024, 4096, 4096, 4096, 1024]
    - [1, 12395.0]
  - - [1024, 3482, 1, 4096, 1024, 1024, 1024, 4096]
    - [7, 11568.0]
  - - [4096, 3447, 1, 1024, 4096, 4096, 4096, 1024]
    - [8, 12247.0]
  - - [4096, 3955, 1, 1024, 4096, 4096, 4096, 1024]
    - [1, 12340.0]
  - - [4096, 4005, 1, 1024, 4096, 4096, 4096, 1024]
    - [1, 12057.0]
  - - [1024, 3493, 1, 4096, 1024, 1024, 1024, 4096]
    - [3, 11204.0]
  - - [4096, 3410, 1, 1024, 4096, 4096, 4096, 1024]
    - [8, 12126.0]
  - - [1024, 3422, 1, 4096, 1024, 1024, 1024, 4096]
    - [8, 11894.0]
  - - [1024, 3350, 1, 4096, 1024, 1024, 1024, 4096]
    - [39, 10866.0]
  - - [4096, 3300, 1, 1024, 4096, 4096, 4096, 1024]
    - [1, 12234.0]
  - - [4096, 3910, 1, 1024, 4096, 4096, 4096, 1024]
    - [1, 12256.0]
  - - [1024, 3489, 1, 4096, 1024, 1024, 1024, 4096]
    - [0, 11229.0]
  - - [4096, 3483, 1, 1024, 4096, 4096, 4096, 1024]
    - [1, 12066.0]
  - - [4096, 3532, 1, 1024, 4096, 4096, 4096, 1024]
    - [1, 12291.0]
  - - [4096, 3230, 1, 1024, 4096, 4096, 4096, 1024]
    - [1, 12047.0]
  - - [4096, 3427, 1, 1024, 4096, 4096, 4096, 1024]
    - [1, 12229.0]
  - - [1024, 3377, 1, 4096, 1024, 1024, 1024, 4096]
    - [4, 11674.0]
  - - [1024, 3488, 1, 4096, 1024, 1024, 1024, 4096]
    - [39, 10679.0]
  - - [1024, 3616, 1, 4096, 1024, 1024, 1024, 4096]
    - [25, 10728.0]
  - - [1024, 3426, 1, 4096, 1024, 1024, 1024, 4096]
    - [39, 11085.0]
  - - [4096, 3357, 1, 1024, 4096, 4096, 4096, 1024]
    - [8, 11952.0]
  - - [4096, 3406, 1, 1024, 4096, 4096, 4096, 1024]
    - [1, 12146.0]
  - - [1024, 3046, 1, 4096, 1024, 1024, 1024, 4096]
    - [12, 11625.0]
  - - [1024, 3272, 1, 4096, 1024, 1024, 1024, 4096]
    - [22, 11472.0]
  - - [1024, 3256, 1, 4096, 1024, 1024, 1024, 4096]
    - [15, 11198.0]
  - - [4096, 3247, 1, 1024, 4096, 4096, 4096, 1024]
    - [1, 12068.0]
  - - [4096, 3088, 1, 1024, 4096, 4096, 4096, 1024]
    - [1, 12099.0]
  - - [1024, 3531, 1, 4096, 1024, 1024, 1024, 4096]
    - [6, 11269.0]
  - - [4096, 3511, 1, 1024, 4096, 4096, 4096, 1024]
    - [1, 12185.0]
  - - [1024, 3720, 1, 33708, 1024, 1024, 1024, 33708]
    - [6, 11924.0]
  - - [1024, 3267, 1, 4096, 1024, 1024, 1024, 4096]
    - [8, 11431.0]
  - - [1024, 3270, 1, 4096, 1024, 1024, 1024, 4096]
    - [25, 11006.0]
  - - [1024, 3461, 1, 4096, 1024, 1024, 1024, 4096]
    - [39, 10587.0]
  - - [4096, 3474, 1, 1024, 4096, 4096, 4096, 1024]
    - [1, 12039.0]
  - - [4096, 2984, 1, 1024, 4096, 4096, 4096, 1024]
    - [1, 11981.0]
  - - [1024, 3399, 1, 4096, 1024, 1024, 1024, 4096]
    - [8, 11809.0]
  - - [4096, 3574, 1, 1024, 4096, 4096, 4096, 1024]
    - [8, 12383.0]
  - - [1024, 3876, 1, 1024, 1024, 1024, 1024, 1024]
    - [8, 11234.0]
  - - [4096, 3337, 1, 1024, 4096, 4096, 4096, 1024]
    - [1, 11919.0]
  - - [4096, 3450, 1, 1024, 4096, 4096, 4096, 1024]
    - [1, 12295.0]
  - - [1024, 3720, 1, 1024, 1024, 1024, 1024, 1024]
    - [8, 11533.0]
  - - [1024, 4059, 1, 1024, 1024, 1024, 1024, 1024]
    - [22, 11715.0]
  - - [4096, 3291, 1, 1024, 4096, 4096, 4096, 1024]
    - [1, 12287.0]
  - - [4096, 3995, 1, 1024, 4096, 4096, 4096, 1024]
    - [1, 12075.0]
  - - [4096, 3491, 1, 1024, 4096, 4096, 4096, 1024]
    - [1, 12109.0]
  - - [4096, 3348, 1, 1024, 4096, 4096, 4096, 1024]
    - [1, 11959.0]
  - - [4096, 3925, 1, 1024, 4096, 4096, 4096, 1024]
    - [1, 12280.0]
  - - [4096, 3894, 1, 1024, 4096, 4096, 4096, 1024]
    - [1, 12190.0]
  - - [1024, 3456, 1, 4096, 1024, 1024, 1024, 4096]
    - [8, 11969.0]
  - - [1024, 3394, 1, 4096, 1024, 1024, 1024, 4096]
    - [25, 11115.0]
  - - [4096, 3165, 1, 1024, 4096, 4096, 4096, 1024]
    - [1, 12238.0]
  - - [4096, 3470, 1, 1024, 4096, 4096, 4096, 1024]
    - [1, 12078.0]
  - - [1024, 3014, 1, 4096, 1024, 1024, 1024, 4096]
    - [6, 11478.0]
  - - [1024, 3375, 1, 4096, 1024, 1024, 1024, 4096]
    - [25, 10918.0]
  - - [4096, 3859, 1, 1024, 4096, 4096, 4096, 1024]
    - [1, 12041.0]
  - - [4096, 3365, 1, 1024, 4096, 4096, 4096, 1024]
    - [1, 12001.0]
  - - [1024, 3162, 1, 4096, 1024, 1024, 1024, 4096]
    - [4, 11933.0]
  - - [1024, 3840, 1, 33708, 1024, 1024, 1024, 33708]
    - [6, 12302.0]
  - - [1024, 3437, 1, 4096, 1024, 1024, 1024, 4096]
    - [8, 11930.0]
  - - [4096, 3319, 1, 1024, 4096, 4096, 4096, 1024]
    - [8, 12312.0]
  - - [1024, 3320, 1, 4096, 1024, 1024, 1024, 4096]
    - [8, 11559.0]
  - - [4096, 3328, 1, 1024, 4096, 4096, 4096, 1024]
    - [8, 12363.0]
  - - [1024, 3235, 1, 4096, 1024, 1024, 1024, 4096]
    - [4, 11198.0]
  - - [4096, 3282, 1, 1024, 4096, 4096, 4096, 1024]
    - [8, 12189.0]
  - - [1024, 3367, 1, 4096, 1024, 1024, 1024, 4096]
    - [8, 11702.0]
  - - [1024, 3542, 1, 4096, 1024, 1024, 1024, 4096]
    - [25, 10838.0]
  - - [4096, 3145, 1, 1024, 4096, 4096, 4096, 1024]
    - [1, 12234.0]
  - - [4096, 3514, 1, 1024, 4096, 4096, 4096, 1024]
    - [1, 12233.0]
  - - [1024, 3432, 1, 4096, 1024, 1024, 1024, 4096]
    - [8, 11895.0]
  - - [4096, 3409, 1, 1024, 4096, 4096, 4096, 1024]
    - [22, 12131.0]
  - - [1024, 4012, 1, 33708, 1024, 1024, 1024, 33708]
    - [16, 11847.0]
  - - [4096, 3876, 1, 1024, 4096, 4096, 4096, 1024]
    - [1, 12160.0]
  - - [4096, 3299, 1, 1024, 4096, 4096, 4096, 1024]
    - [1, 12309.0]
  - - [1024, 3168, 1, 4096, 1024, 1024, 1024, 4096]
    - [8, 12141.0]
  - - [4096, 3681, 1, 1024, 4096, 4096, 4096, 1024]
    - [1, 12217.0]
  - - [4096, 3531, 1, 1024, 4096, 4096, 4096, 1024]
    - [1, 12287.0]
  - - [4096, 3388, 1, 1024, 4096, 4096, 4096, 1024]
    - [1, 12099.0]
  - - [1024, 3720, 1, 4096, 1024, 1024, 1024, 4096]
    - [27, 11875.0]
  - - [1024, 3332, 1, 4096, 1024, 1024, 1024, 4096]
    - [39, 10869.0]
  - - [1024, 3273, 1, 4096, 1024, 1024, 1024, 4096]
    - [25, 11032.0]
  - - [1024, 2935, 1, 4096, 1024, 1024, 1024, 4096]
    - [27, 11099.0]
  - - [1024, 3467, 1, 4096, 1024, 1024, 1024, 4096]
    - [39, 10682.0]
  - - [4096, 3542, 1, 1024, 4096, 4096, 4096, 1024]
    - [1, 12268.0]
  - - [1024, 3130, 1, 4096, 1024, 1024, 1024, 4096]
    - [4, 11813.0]
  - - [1024, 3405, 1, 4096, 1024, 1024, 1024, 4096]
    - [25, 11008.0]
  - - [1024, 3960, 1, 1024, 1024, 1024, 1024, 1024]
    - [21, 11181.0]
  - - [4096, 3405, 1, 1024, 4096, 4096, 4096, 1024]
    - [8, 12113.0]
  - - [1024, 10080, 1, 1024, 1024, 1024, 1024, 1024]
    - [8, 12193.0]
  - - [36548, 1216, 1, 1024, 36548, 36548, 36548, 1024]
    - [22, 11927.0]
  - - [1024, 2592, 1, 1024, 1024, 1024, 1024, 1024]
    - [7, 10916.0]
  - - [1024, 1568, 1, 1024, 1024, 1024, 1024, 1024]
    - [7, 10877.0]
  - - [1024, 4445, 1, 1024, 1024, 1024, 1024, 1024]
    - [8, 11854.0]
  - - [1024, 6272, 1, 1024, 1024, 1024, 1024, 1024]
    - [4, 12002.0]
  - - [36548, 3584, 1, 1024, 36548, 36548, 36548, 1024]
    - [22, 12437.0]
  - - [1024, 1827, 1, 1024, 1024, 1024, 1024, 1024]
    - [22, 10706.0]
  - - [1024, 3220, 1, 1024, 1024, 1024, 1024, 1024]
    - [21, 11110.0]
  - - [1024, 1856, 1, 1024, 1024, 1024, 1024, 1024]
    - [8, 11073.0]
  - - [1024, 1760, 1, 1024, 1024, 1024, 1024, 1024]
    - [8, 10206.0]
  - - [36548, 4235, 1, 1024, 36548, 36548, 36548, 1024]
    - [22, 12137.0]
  - - [1024, 1984, 1, 1024, 1024, 1024, 1024, 1024]
    - [7, 10811.0]
  - - [1024, 14720, 1, 1024, 1024, 1024, 1024, 1024]
    - [25, 12332.0]
  - - [1024, 1152, 1, 1024, 1024, 1024, 1024, 1024]
    - [8, 10214.0]
  - - [36548, 14976, 1, 1024, 36548, 36548, 36548, 1024]
    - [11, 12541.0]
  - - [36548, 1152, 1, 1024, 36548, 36548, 36548, 1024]
    - [22, 12470.0]
  - - [1024, 3392, 1, 1024, 1024, 1024, 1024, 1024]
    - [8, 11488.0]
  - - [1024, 1408, 1, 1024, 1024, 1024, 1024, 1024]
    - [21, 10805.0]
  - - [1024, 2080, 1, 1024, 1024, 1024, 1024, 1024]
    - [8, 10550.0]
  - - [1024, 1824, 1, 1024, 1024, 1024, 1024, 1024]
    - [8, 10640.0]
  - - [36548, 2432, 1, 1024, 36548, 36548, 36548, 1024]
    - [22, 12556.0]
  - - [36548, 1827, 1, 1024, 36548, 36548, 36548, 1024]
    - [22, 11950.0]
  - - [1024, 10176, 1, 1024, 1024, 1024, 1024, 1024]
    - [22, 12366.0]
  - - [1024, 1952, 1, 1024, 1024, 1024, 1024, 1024]
    - [7, 10662.0]
  - - [1024, 17024, 1, 1024, 1024, 1024, 1024, 1024]
    - [25, 12260.0]
  - - [1024, 1472, 1, 1024, 1024, 1024, 1024, 1024]
    - [21, 10319.0]
  - - [36548, 4459, 1, 1024, 36548, 36548, 36548, 1024]
    - [22, 12393.0]
  - - [1024, 3712, 1, 1024, 1024, 1024, 1024, 1024]
    - [8, 11564.0]
  - - [36548, 12928, 1, 1024, 36548, 36548, 36548, 1024]
    - [25, 12319.0]
  - - [1024, 1632, 1, 1024, 1024, 1024, 1024, 1024]
    - [35, 9839.0]
  - - [1024, 1696, 1, 1024, 1024, 1024, 1024, 1024]
    - [21, 10527.0]
  - - [36548, 1764, 1, 1024, 36548, 36548, 36548, 1024]
    - [22, 12336.0]
  - - [1024, 2944, 1, 1024, 1024, 1024, 1024, 1024]
    - [7, 11165.0]
  - - [36548, 14080, 1, 1024, 36548, 36548, 36548, 1024]
    - [36, 12589.0]
  - - [1024, 1280, 1, 1024, 1024, 1024, 1024, 1024]
    - [9, 10358.0]
  - - [1024, 13440, 1, 1024, 1024, 1024, 1024, 1024]
    - [11, 12321.0]
  - - [36548, 9120, 1, 1024, 36548, 36548, 36548, 1024]
    - [22, 12332.0]
  - - [1024, 3008, 1, 1024, 1024, 1024, 1024, 1024]
    - [7, 11011.0]
  - - [1024, 2560, 1, 1024, 1024, 1024, 1024, 1024]
    - [8, 11434.0]
  - - [1024, 2208, 1, 1024, 1024, 1024, 1024, 1024]
    - [21, 10666.0]
  - - [1024, 1920, 1, 1024, 1024, 1024, 1024, 1024]
    - [8, 11221.0]
  - - [36548, 2496, 1, 1024, 36548, 36548, 36548, 1024]
    - [22, 12265.0]
  - - [1024, 2016, 1, 1024, 1024, 1024, 1024, 1024]
    - [21, 10936.0]
  - - [1024, 1184, 1, 1024, 1024, 1024, 1024, 1024]
    - [8, 10325.0]
  - - [1024, 1664, 1, 1024, 1024, 1024, 1024, 1024]
    - [7, 10386.0]
  - - [1024, 11424, 1, 1024, 1024, 1024, 1024, 1024]
    - [8, 12222.0]
  - - [1024, 1216, 1, 1024, 1024, 1024, 1024, 1024]
    - [9, 10529.0]
  - - [36548, 3185, 1, 1024, 36548, 36548, 36548, 1024]
    - [39, 12430.0]
  - - [36548, 9216, 1, 1024, 36548, 36548, 36548, 1024]
    - [22, 12453.0]
  - - [1024, 3200, 1, 1024, 1024, 1024, 1024, 1024]
    - [4, 11708.0]
  - - [1024, 2656, 1, 1024, 1024, 1024, 1024, 1024]
    - [21, 11083.0]
  - - [1024, 2368, 1, 1024, 1024, 1024, 1024, 1024]
    - [7, 11234.0]
  - - [1024, 4459, 1, 1024, 1024, 1024, 1024, 1024]
    - [11, 11663.0]
  - - [1024, 3808, 1, 1024, 1024, 1024, 1024, 1024]
    - [8, 11779.0]
  - - [1024, 2336, 1, 1024, 1024, 1024, 1024, 1024]
    - [7, 11070.0]
  - - [1024, 2304, 1, 1024, 1024, 1024, 1024, 1024]
    - [7, 10708.0]
  - - [1024, 1560, 1, 1024, 1024, 1024, 1024, 1024]
    - [21, 10511.0]
  - - [1024, 2496, 1, 1024, 1024, 1024, 1024, 1024]
    - [25, 11083.0]
  - - [1024, 1504, 1, 1024, 1024, 1024, 1024, 1024]
    - [8, 10428.0]
  - - [1024, 3232, 1, 1024, 1024, 1024, 1024, 1024]
    - [21, 10856.0]
  - - [36548, 1015, 1, 1024, 36548, 36548, 36548, 1024]
    - [36, 12354.0]
  - - [1024, 2000, 1, 1024, 1024, 1024, 1024, 1024]
    - [7, 10891.0]
  - - [36548, 243, 1, 1024, 36548, 36548, 36548, 1024]
    - [4, 11487.0]
  - - [1024, 13184, 1, 1024, 1024, 1024, 1024, 1024]
    - [8, 12312.0]
  - - [1024, 2688, 1, 1024, 1024, 1024, 1024, 1024]
    - [7, 11354.0]
  - - [36548, 950, 1, 1024, 36548, 36548, 36548, 1024]
    - [15, 11734.0]
  - - [1024, 1764, 1, 1024, 1024, 1024, 1024, 1024]
    - [8, 10491.0]
  - - [1024, 1376, 1, 1024, 1024, 1024, 1024, 1024]
    - [21, 10466.0]
  - - [36548, 774, 1, 1024, 36548, 36548, 36548, 1024]
    - [15, 11027.0]
  - - [1024, 4256, 1, 1024, 1024, 1024, 1024, 1024]
    - [7, 11482.0]
  - - [36548, 3712, 1, 1024, 36548, 36548, 36548, 1024]
    - [22, 12427.0]
  - - [1024, 3360, 1, 1024, 1024, 1024, 1024, 1024]
    - [22, 11159.0]
  - - [1024, 2784, 1, 1024, 1024, 1024, 1024, 1024]
    - [8, 11311.0]
  - - [1024, 4992, 1, 1024, 1024, 1024, 1024, 1024]
    - [4, 11891.0]
  - - [36548, 1102, 1, 1024, 36548, 36548, 36548, 1024]
    - [22, 11952.0]
  - - [1024, 1536, 1, 1024, 1024, 1024, 1024, 1024]
    - [8, 11021.0]
  - - [1024, 2720, 1, 1024, 1024, 1024, 1024, 1024]
    - [8, 10987.0]
  - - [1024, 2752, 1, 1024, 1024, 1024, 1024, 1024]
    - [8, 11187.0]
  - - [1024, 2816, 1, 1024, 1024, 1024, 1024, 1024]
    - [11, 11588.0]
  - - [1024, 2624, 1, 1024, 1024, 1024, 1024, 1024]
    - [7, 11073.0]
  - - [1024, 2144, 1, 1024, 1024, 1024, 1024, 1024]
    - [8, 10849.0]
  - - [36548, 1131, 1, 1024, 36548, 36548, 36548, 1024]
    - [4, 12254.0]
  - - [1024, 3296, 1, 1024, 1024, 1024, 1024, 1024]
    - [21, 11279.0]
  - - [36548, 4992, 1, 1024, 36548, 36548, 36548, 1024]
    - [39, 12501.0]
  - - [1024, 1344, 1, 1024, 1024, 1024, 1024, 1024]
    - [7, 10294.0]
  - - [36548, 2401, 1, 1024, 36548, 36548, 36548, 1024]
    - [36, 12383.0]
  - - [1024, 15744, 1, 1024, 1024, 1024, 1024, 1024]
    - [8, 12352.0]
  - - [1024, 15232, 1, 1024, 1024, 1024, 1024, 1024]
    - [22, 12369.0]
  - - [1024, 1888, 1, 1024, 1024, 1024, 1024, 1024]
    - [22, 11328.0]
  - - [1024, 1792, 1, 1024, 1024, 1024, 1024, 1024]
    - [8, 10884.0]
  - - [36548, 1073, 1, 1024, 36548, 36548, 36548, 1024]
    - [22, 11647.0]
  - - [36548, 15488, 1, 1024, 36548, 36548, 36548, 1024]
    - [22, 12326.0]
  - - [1024, 2464, 1, 1024, 1024, 1024, 1024, 1024]
    - [22, 10458.0]
  - - [1024, 2272, 1, 1024, 1024, 1024, 1024, 1024]
    - [21, 10539.0]
  - - [1024, 2432, 1, 1024, 1024, 1024, 1024, 1024]
    - [4, 10978.0]
  - - [1024, 3936, 1, 1024, 1024, 1024, 1024, 1024]
    - [21, 11179.0]
  - - [36548, 13824, 1, 1024, 36548, 36548, 36548, 1024]
    - [32, 12553.0]
  - - [1024, 2401, 1, 1024, 1024, 1024, 1024, 1024]
    - [22, 11120.0]
  - - [1024, 2176, 1, 1024, 1024, 1024, 1024, 1024]
    - [8, 11532.0]
  - - [1024, 2240, 1, 1024, 1024, 1024, 1024, 1024]
    - [21, 11453.0]
  - - [1024, 1728, 1, 1024, 1024, 1024, 1024, 1024]
    - [21, 11157.0]
  - - [1024, 2528, 1, 1024, 1024, 1024, 1024, 1024]
    - [8, 11712.0]
  - - [1024, 2400, 1, 1024, 1024, 1024, 1024, 1024]
    - [8, 11144.0]
  - - [1024, 1440, 1, 1024, 1024, 1024, 1024, 1024]
    - [8, 10379.0]
  - - [1024, 2912, 1, 1024, 1024, 1024, 1024, 1024]
    - [35, 11104.0]
  - - [1024, 2880, 1, 1024, 1024, 1024, 1024, 1024]
    - [21, 11556.0]
  - - [1024, 4064, 1, 1024, 1024, 1024, 1024, 1024]
    - [8, 11894.0]
  - - [1024, 4655, 1, 1024, 1024, 1024, 1024, 1024]
    - [8, 11880.0]
  - - [36548, 6272, 1, 1024, 36548, 36548, 36548, 1024]
    - [22, 12592.0]
  - - [768, 2048, 1, 3072, 768, 768, 768, 3072]
    - [22, 11393.0]
  - - [768, 4096, 1, 3072, 768, 768, 768, 3072]
    - [22, 11836.0]
  - - [6272, 256, 1, 528, 6272, 6272, 6272, 528]
    - [1, 11247.0]
  - - [3136, 2048, 1, 1024, 3136, 3136, 3136, 1024]
    - [8, 12163.0]
  - - [50176, 128, 1, 256, 50176, 50176, 50176, 256]
    - [36, 11684.0]
  - - [12544, 1024, 1, 256, 12544, 12544, 12544, 256]
    - [8, 12039.0]
  - - [12544, 256, 1, 1024, 12544, 12544, 12544, 1024]
    - [1, 11915.0]
  - - [3136, 512, 1, 1024, 3136, 3136, 3136, 1024]
    - [1, 11171.0]
  - - [3136, 2048, 1, 512, 3136, 3136, 3136, 512]
    - [8, 11999.0]
  - - [289, 384, 32, 1024, 289, 289, 289, 1024]
    - [36, 8760.0]
  - - [4096, 512, 1, 4096, 4096, 4096, 4096, 4096]
    - [0, 11433.0]
  - - [50176, 512, 1, 256, 50176, 50176, 50176, 256]
    - [11, 12227.0]
  - - [12544, 1024, 1, 512, 12544, 12544, 12544, 512]
    - [22, 12227.0]
  - - [12544, 256, 1, 512, 12544, 12544, 12544, 512]
    - [1, 11756.0]
  - - [784, 128, 32, 256, 784, 784, 784, 256]
    - [21, 9669.0]
  - - [4096, 512, 1, 9216, 4096, 4096, 4096, 9216]
    - [21, 11288.0]
  - - [3136, 512, 1, 2048, 3136, 3136, 3136, 2048]
    - [1, 11422.0]
  - - [1225, 192, 32, 384, 1225, 1225, 1225, 384]
    - [28, 11130.0]
  - - [8192, 320, 1, 1280, 8192, 8192, 8192, 1280]
    - [28, 11575.0]
  - - [8192, 320, 1, 2048, 8192, 8192, 8192, 2048]
    - [28, 11612.0]
  - - [8192, 384, 1, 1280, 8192, 8192, 8192, 1280]
    - [1, 11749.0]
  - - [8192, 384, 1, 2048, 8192, 8192, 8192, 2048]
    - [1, 11802.0]
  - - [8192, 448, 1, 2048, 8192, 8192, 8192, 2048]
    - [15, 11448.0]
  - - [8192, 448, 1, 1280, 8192, 8192, 8192, 1280]
    - [15, 11431.0]
  - - [256, 6400, 1, 4096, 256, 256, 256, 4096]
    - [39, 11692.0]
  - - [512, 3433, 1, 2048, 512, 512, 512, 2048]
    - [35, 11135.0]
  - - [512, 3439, 1, 2048, 512, 512, 512, 2048]
    - [35, 11174.0]
  - - [512, 3461, 1, 2048, 512, 512, 512, 2048]
    - [7, 11246.0]
  - - [512, 3479, 1, 2048, 512, 512, 512, 2048]
    - [7, 11285.0]
  - - [512, 3494, 1, 2048, 512, 512, 512, 2048]
    - [35, 11350.0]
  - - [512, 3520, 1, 2048, 512, 512, 512, 2048]
    - [7, 11446.0]
  - - [512, 3530, 1, 2048, 512, 512, 512, 2048]
    - [8, 10999.0]
  - - [512, 3541, 1, 2048, 512, 512, 512, 2048]
    - [8, 11034.0]
  - - [512, 3564, 1, 2048, 512, 512, 512, 2048]
    - [22, 11099.0]
  - - [512, 3776, 1, 2048, 512, 512, 512, 2048]
    - [8, 11720.0]
  - - [512, 3859, 1, 512, 512, 512, 512, 512]
    - [35, 10566.0]
  - - [512, 3925, 1, 2048, 512, 512, 512, 2048]
    - [7, 10885.0]
  - - [512, 3944, 1, 2048, 512, 512, 512, 2048]
    - [7, 10947.0]
  - - [512, 3955, 1, 2048, 512, 512, 512, 2048]
    - [35, 10987.0]
  - - [512, 3969, 1, 2048, 512, 512, 512, 2048]
    - [35, 11030.0]
  - - [512, 3976, 1, 2048, 512, 512, 512, 2048]
    - [35, 11031.0]
  - - [2048, 1232, 1, 512, 2048, 2048, 2048, 512]
    - [1, 11049.0]
  - - [2048, 3165, 1, 512, 2048, 2048, 2048, 512]
    - [1, 11978.0]
  - - [512, 2387, 1, 512, 512, 512, 512, 512]
    - [23, 10224.0]
  - - [512, 2418, 1, 512, 512, 512, 512, 512]
    - [35, 10270.0]
  - - [512, 2418, 1, 2048, 512, 512, 512, 2048]
    - [27, 11021.0]
  - - [512, 2496, 1, 512, 512, 512, 512, 512]
    - [21, 10776.0]
  - - [512, 2496, 1, 2048, 512, 512, 512, 2048]
    - [27, 11350.0]
  - - [512, 2790, 1, 2048, 512, 512, 512, 2048]
    - [7, 10931.0]
  - - [512, 2864, 1, 2048, 512, 512, 512, 2048]
    - [35, 11201.0]
  - - [512, 3092, 1, 2048, 512, 512, 512, 2048]
    - [36, 11381.0]
  - - [512, 3113, 1, 2048, 512, 512, 512, 2048]
    - [8, 11456.0]
  - - [512, 3137, 1, 2048, 512, 512, 512, 2048]
    - [8, 11577.0]
  - - [512, 3165, 1, 2048, 512, 512, 512, 2048]
    - [22, 11617.0]
  - - [512, 3166, 1, 2048, 512, 512, 512, 2048]
    - [36, 11630.0]
  - - [512, 3194, 1, 2048, 512, 512, 512, 2048]
    - [8, 11728.0]
  - - [512, 3219, 1, 2048, 512, 512, 512, 2048]
    - [7, 10515.0]
  - - [512, 3222, 1, 2048, 512, 512, 512, 2048]
    - [7, 10547.0]
  - - [512, 3234, 1, 2048, 512, 512, 512, 2048]
    - [21, 10584.0]
  - - [512, 3237, 1, 2048, 512, 512, 512, 2048]
    - [7, 10594.0]
  - - [512, 3242, 1, 2048, 512, 512, 512, 2048]
    - [7, 10604.0]
  - - [512, 3246, 1, 2048, 512, 512, 512, 2048]
    - [35, 10592.0]
  - - [512, 3249, 1, 2048, 512, 512, 512, 2048]
    - [35, 10642.0]
  - - [512, 3251, 1, 2048, 512, 512, 512, 2048]
    - [35, 10614.0]
  - - [512, 3257, 1, 2048, 512, 512, 512, 2048]
    - [21, 10661.0]
  - - [512, 3262, 1, 2048, 512, 512, 512, 2048]
    - [7, 10660.0]
  - - [512, 3268, 1, 2048, 512, 512, 512, 2048]
    - [35, 10681.0]
  - - [512, 3282, 1, 2048, 512, 512, 512, 2048]
    - [21, 10757.0]
  - - [512, 3286, 1, 2048, 512, 512, 512, 2048]
    - [21, 10762.0]
  - - [512, 3287, 1, 2048, 512, 512, 512, 2048]
    - [35, 10778.0]
  - - [512, 3293, 1, 2048, 512, 512, 512, 2048]
    - [21, 10762.0]
  - - [512, 3297, 1, 2048, 512, 512, 512, 2048]
    - [35, 10769.0]
  - - [512, 3307, 1, 2048, 512, 512, 512, 2048]
    - [35, 10821.0]
  - - [512, 3314, 1, 2048, 512, 512, 512, 2048]
    - [21, 10847.0]
  - - [512, 3315, 1, 2048, 512, 512, 512, 2048]
    - [7, 10845.0]
  - - [512, 3319, 1, 2048, 512, 512, 512, 2048]
    - [35, 10852.0]
  - - [512, 3322, 1, 2048, 512, 512, 512, 2048]
    - [21, 10890.0]
  - - [512, 3323, 1, 2048, 512, 512, 512, 2048]
    - [35, 10893.0]
  - - [512, 3324, 1, 2048, 512, 512, 512, 2048]
    - [35, 10853.0]
  - - [512, 3325, 1, 2048, 512, 512, 512, 2048]
    - [35, 10885.0]
  - - [512, 3327, 1, 2048, 512, 512, 512, 2048]
    - [7, 10832.0]
  - - [512, 3329, 1, 2048, 512, 512, 512, 2048]
    - [21, 10847.0]
  - - [512, 3332, 1, 2048, 512, 512, 512, 2048]
    - [35, 10858.0]
  - - [512, 3336, 1, 2048, 512, 512, 512, 2048]
    - [21, 10876.0]
  - - [512, 3339, 1, 2048, 512, 512, 512, 2048]
    - [7, 10896.0]
  - - [512, 3342, 1, 2048, 512, 512, 512, 2048]
    - [21, 10920.0]
  - - [512, 3344, 1, 2048, 512, 512, 512, 2048]
    - [21, 10919.0]
  - - [512, 3358, 1, 2048, 512, 512, 512, 2048]
    - [35, 10954.0]
  - - [512, 3360, 1, 2048, 512, 512, 512, 2048]
    - [7, 10963.0]
  - - [512, 3364, 1, 2048, 512, 512, 512, 2048]
    - [7, 10939.0]
  - - [512, 3365, 1, 2048, 512, 512, 512, 2048]
    - [21, 10974.0]
  - - [512, 3369, 1, 2048, 512, 512, 512, 2048]
    - [35, 10991.0]
  - - [512, 3370, 1, 2048, 512, 512, 512, 2048]
    - [21, 10974.0]
  - - [512, 3371, 1, 2048, 512, 512, 512, 2048]
    - [35, 10958.0]
  - - [512, 3374, 1, 2048, 512, 512, 512, 2048]
    - [7, 10972.0]
  - - [512, 3376, 1, 2048, 512, 512, 512, 2048]
    - [21, 11001.0]
  - - [512, 3377, 1, 2048, 512, 512, 512, 2048]
    - [7, 11005.0]
  - - [512, 3378, 1, 2048, 512, 512, 512, 2048]
    - [7, 11002.0]
  - - [512, 3381, 1, 2048, 512, 512, 512, 2048]
    - [7, 11025.0]
  - - [512, 3382, 1, 2048, 512, 512, 512, 2048]
    - [7, 11017.0]
  - - [512, 3383, 1, 2048, 512, 512, 512, 2048]
    - [35, 11034.0]
  - - [512, 3384, 1, 2048, 512, 512, 512, 2048]
    - [7, 11040.0]
  - - [512, 3385, 1, 2048, 512, 512, 512, 2048]
    - [21, 11038.0]
  - - [512, 3386, 1, 2048, 512, 512, 512, 2048]
    - [7, 11022.0]
  - - [512, 3388, 1, 2048, 512, 512, 512, 2048]
    - [21, 11034.0]
  - - [512, 3390, 1, 2048, 512, 512, 512, 2048]
    - [35, 11049.0]
  - - [512, 3391, 1, 2048, 512, 512, 512, 2048]
    - [35, 11047.0]
  - - [512, 3396, 1, 2048, 512, 512, 512, 2048]
    - [21, 11039.0]
  - - [512, 3399, 1, 2048, 512, 512, 512, 2048]
    - [21, 11071.0]
  - - [512, 3402, 1, 2048, 512, 512, 512, 2048]
    - [21, 11059.0]
  - - [512, 3410, 1, 2048, 512, 512, 512, 2048]
    - [35, 11098.0]
  - - [512, 3412, 1, 2048, 512, 512, 512, 2048]
    - [7, 11115.0]
  - - [512, 3414, 1, 2048, 512, 512, 512, 2048]
    - [7, 11124.0]
  - - [512, 3415, 1, 2048, 512, 512, 512, 2048]
    - [21, 11126.0]
  - - [512, 3418, 1, 2048, 512, 512, 512, 2048]
    - [35, 11117.0]
  - - [512, 3420, 1, 2048, 512, 512, 512, 2048]
    - [35, 11123.0]
  - - [512, 3422, 1, 2048, 512, 512, 512, 2048]
    - [21, 11144.0]
  - - [512, 3425, 1, 2048, 512, 512, 512, 2048]
    - [35, 11140.0]
  - - [512, 3426, 1, 2048, 512, 512, 512, 2048]
    - [7, 11131.0]
  - - [512, 3427, 1, 2048, 512, 512, 512, 2048]
    - [7, 11149.0]
  - - [512, 3428, 1, 2048, 512, 512, 512, 2048]
    - [21, 11167.0]
  - - [512, 3430, 1, 2048, 512, 512, 512, 2048]
    - [21, 11145.0]
  - - [512, 3431, 1, 2048, 512, 512, 512, 2048]
    - [7, 11162.0]
  - - [512, 3432, 1, 2048, 512, 512, 512, 2048]
    - [21, 11153.0]
  - - [512, 3438, 1, 2048, 512, 512, 512, 2048]
    - [21, 11170.0]
  - - [512, 3440, 1, 2048, 512, 512, 512, 2048]
    - [7, 11198.0]
  - - [512, 3443, 1, 2048, 512, 512, 512, 2048]
    - [7, 11191.0]
  - - [512, 3445, 1, 2048, 512, 512, 512, 2048]
    - [21, 11191.0]
  - - [512, 3447, 1, 2048, 512, 512, 512, 2048]
    - [21, 11211.0]
  - - [512, 3448, 1, 2048, 512, 512, 512, 2048]
    - [35, 11206.0]
  - - [512, 3450, 1, 2048, 512, 512, 512, 2048]
    - [35, 11218.0]
  - - [512, 3451, 1, 2048, 512, 512, 512, 2048]
    - [35, 11230.0]
  - - [512, 3452, 1, 2048, 512, 512, 512, 2048]
    - [7, 11236.0]
  - - [512, 3453, 1, 2048, 512, 512, 512, 2048]
    - [7, 11235.0]
  - - [512, 3455, 1, 2048, 512, 512, 512, 2048]
    - [7, 11225.0]
  - - [512, 3456, 1, 2048, 512, 512, 512, 2048]
    - [21, 11282.0]
  - - [512, 3457, 1, 2048, 512, 512, 512, 2048]
    - [21, 11265.0]
  - - [512, 3458, 1, 2048, 512, 512, 512, 2048]
    - [35, 11240.0]
  - - [512, 3459, 1, 2048, 512, 512, 512, 2048]
    - [21, 11259.0]
  - - [512, 3460, 1, 2048, 512, 512, 512, 2048]
    - [7, 11251.0]
  - - [512, 3462, 1, 2048, 512, 512, 512, 2048]
    - [21, 11259.0]
  - - [512, 3466, 1, 2048, 512, 512, 512, 2048]
    - [35, 11309.0]
  - - [512, 3467, 1, 2048, 512, 512, 512, 2048]
    - [21, 11290.0]
  - - [512, 3468, 1, 2048, 512, 512, 512, 2048]
    - [35, 11292.0]
  - - [512, 3470, 1, 2048, 512, 512, 512, 2048]
    - [21, 11296.0]
  - - [512, 3471, 1, 2048, 512, 512, 512, 2048]
    - [21, 11304.0]
  - - [512, 3472, 1, 2048, 512, 512, 512, 2048]
    - [7, 11300.0]
  - - [512, 3475, 1, 2048, 512, 512, 512, 2048]
    - [35, 11320.0]
  - - [512, 3476, 1, 2048, 512, 512, 512, 2048]
    - [21, 11334.0]
  - - [512, 3477, 1, 2048, 512, 512, 512, 2048]
    - [7, 11299.0]
  - - [512, 3478, 1, 2048, 512, 512, 512, 2048]
    - [21, 11280.0]
  - - [512, 3480, 1, 2048, 512, 512, 512, 2048]
    - [7, 11333.0]
  - - [512, 3481, 1, 2048, 512, 512, 512, 2048]
    - [35, 11343.0]
  - - [512, 3483, 1, 2048, 512, 512, 512, 2048]
    - [21, 11331.0]
  - - [512, 3484, 1, 2048, 512, 512, 512, 2048]
    - [35, 11315.0]
  - - [512, 3487, 1, 2048, 512, 512, 512, 2048]
    - [35, 11344.0]
  - - [512, 3489, 1, 2048, 512, 512, 512, 2048]
    - [35, 11370.0]
  - - [512, 3490, 1, 2048, 512, 512, 512, 2048]
    - [35, 11366.0]
  - - [512, 3491, 1, 2048, 512, 512, 512, 2048]
    - [21, 11375.0]
  - - [512, 3493, 1, 2048, 512, 512, 512, 2048]
    - [7, 11350.0]
  - - [512, 3495, 1, 2048, 512, 512, 512, 2048]
    - [35, 11343.0]
  - - [512, 3497, 1, 2048, 512, 512, 512, 2048]
    - [21, 11400.0]
  - - [512, 3498, 1, 2048, 512, 512, 512, 2048]
    - [35, 11379.0]
  - - [512, 3499, 1, 2048, 512, 512, 512, 2048]
    - [21, 11394.0]
  - - [512, 3501, 1, 2048, 512, 512, 512, 2048]
    - [7, 11378.0]
  - - [512, 3503, 1, 2048, 512, 512, 512, 2048]
    - [35, 11399.0]
  - - [512, 3505, 1, 2048, 512, 512, 512, 2048]
    - [21, 11398.0]
  - - [512, 3507, 1, 2048, 512, 512, 512, 2048]
    - [21, 11402.0]
  - - [512, 3508, 1, 2048, 512, 512, 512, 2048]
    - [35, 11402.0]
  - - [512, 3509, 1, 2048, 512, 512, 512, 2048]
    - [21, 11406.0]
  - - [512, 3510, 1, 2048, 512, 512, 512, 2048]
    - [21, 11421.0]
  - - [512, 3511, 1, 2048, 512, 512, 512, 2048]
    - [7, 11411.0]
  - - [512, 3513, 1, 2048, 512, 512, 512, 2048]
    - [35, 11412.0]
  - - [512, 3514, 1, 2048, 512, 512, 512, 2048]
    - [35, 11411.0]
  - - [512, 3515, 1, 2048, 512, 512, 512, 2048]
    - [21, 11431.0]
  - - [512, 3517, 1, 2048, 512, 512, 512, 2048]
    - [35, 11417.0]
  - - [512, 3518, 1, 2048, 512, 512, 512, 2048]
    - [21, 11436.0]
  - - [512, 3519, 1, 2048, 512, 512, 512, 2048]
    - [21, 11442.0]
  - - [512, 3523, 1, 2048, 512, 512, 512, 2048]
    - [22, 10992.0]
  - - [512, 3528, 1, 2048, 512, 512, 512, 2048]
    - [22, 10994.0]
  - - [512, 3529, 1, 2048, 512, 512, 512, 2048]
    - [8, 10997.0]
  - - [512, 3531, 1, 2048, 512, 512, 512, 2048]
    - [8, 10998.0]
  - - [512, 3532, 1, 2048, 512, 512, 512, 2048]
    - [22, 11021.0]
  - - [512, 3533, 1, 2048, 512, 512, 512, 2048]
    - [8, 11009.0]
  - - [512, 3534, 1, 2048, 512, 512, 512, 2048]
    - [8, 11014.0]
  - - [512, 3538, 1, 2048, 512, 512, 512, 2048]
    - [8, 11026.0]
  - - [512, 3539, 1, 2048, 512, 512, 512, 2048]
    - [22, 11048.0]
  - - [512, 3540, 1, 2048, 512, 512, 512, 2048]
    - [22, 11040.0]
  - - [512, 3547, 1, 2048, 512, 512, 512, 2048]
    - [8, 11061.0]
  - - [512, 3548, 1, 2048, 512, 512, 512, 2048]
    - [22, 11081.0]
  - - [512, 3552, 1, 2048, 512, 512, 512, 2048]
    - [8, 11086.0]
  - - [512, 3575, 1, 2048, 512, 512, 512, 2048]
    - [8, 11139.0]
  - - [512, 3598, 1, 2048, 512, 512, 512, 2048]
    - [22, 11203.0]
  - - [512, 3599, 1, 2048, 512, 512, 512, 2048]
    - [22, 11204.0]
  - - [512, 3608, 1, 2048, 512, 512, 512, 2048]
    - [8, 11225.0]
  - - [512, 3776, 1, 512, 512, 512, 512, 512]
    - [35, 11090.0]
  - - [512, 3780, 1, 512, 512, 512, 512, 512]
    - [22, 11010.0]
  - - [512, 3780, 1, 2048, 512, 512, 512, 2048]
    - [8, 11725.0]
  - - [512, 3780, 1, 33708, 512, 512, 512, 33708]
    - [20, 12085.0]
  - - [512, 3796, 1, 512, 512, 512, 512, 512]
    - [21, 10788.0]
  - - [512, 3796, 1, 2048, 512, 512, 512, 2048]
    - [8, 11787.0]
  - - [512, 3796, 1, 33708, 512, 512, 512, 33708]
    - [6, 12135.0]
  - - [512, 3822, 1, 512, 512, 512, 512, 512]
    - [35, 10843.0]
  - - [512, 3822, 1, 2048, 512, 512, 512, 2048]
    - [22, 11876.0]
  - - [512, 3822, 1, 33708, 512, 512, 512, 33708]
    - [20, 12219.0]
  - - [512, 3835, 1, 512, 512, 512, 512, 512]
    - [37, 10913.0]
  - - [512, 3835, 1, 2048, 512, 512, 512, 2048]
    - [22, 11873.0]
  - - [512, 3840, 1, 512, 512, 512, 512, 512]
    - [8, 11499.0]
  - - [512, 3840, 1, 2048, 512, 512, 512, 2048]
    - [8, 11989.0]
  - - [512, 3840, 1, 33708, 512, 512, 512, 33708]
    - [6, 12275.0]
  - - [512, 3859, 1, 2048, 512, 512, 512, 2048]
    - [7, 10723.0]
  - - [512, 3859, 1, 33708, 512, 512, 512, 33708]
    - [15, 10806.0]
  - - [512, 3864, 1, 512, 512, 512, 512, 512]
    - [35, 10471.0]
  - - [512, 3864, 1, 2048, 512, 512, 512, 2048]
    - [7, 10769.0]
  - - [512, 3870, 1, 512, 512, 512, 512, 512]
    - [35, 10552.0]
  - - [512, 3870, 1, 2048, 512, 512, 512, 2048]
    - [35, 10777.0]
  - - [512, 3870, 1, 33708, 512, 512, 512, 33708]
    - [0, 10849.0]
  - - [512, 3876, 1, 512, 512, 512, 512, 512]
    - [35, 10490.0]
  - - [512, 3876, 1, 2048, 512, 512, 512, 2048]
    - [35, 10821.0]
  - - [512, 3876, 1, 33708, 512, 512, 512, 33708]
    - [0, 10833.0]
  - - [512, 3906, 1, 512, 512, 512, 512, 512]
    - [35, 10534.0]
  - - [512, 3906, 1, 2048, 512, 512, 512, 2048]
    - [21, 10803.0]
  - - [512, 3906, 1, 33708, 512, 512, 512, 33708]
    - [0, 10875.0]
  - - [512, 3910, 1, 512, 512, 512, 512, 512]
    - [35, 10500.0]
  - - [512, 3910, 1, 2048, 512, 512, 512, 2048]
    - [35, 10829.0]
  - - [512, 3910, 1, 33708, 512, 512, 512, 33708]
    - [0, 10883.0]
  - - [512, 3925, 1, 512, 512, 512, 512, 512]
    - [35, 10501.0]
  - - [512, 3925, 1, 33708, 512, 512, 512, 33708]
    - [0, 10934.0]
  - - [512, 3927, 1, 512, 512, 512, 512, 512]
    - [35, 10511.0]
  - - [512, 3942, 1, 512, 512, 512, 512, 512]
    - [35, 10618.0]
  - - [512, 3942, 1, 2048, 512, 512, 512, 2048]
    - [21, 10875.0]
  - - [512, 3942, 1, 33708, 512, 512, 512, 33708]
    - [7, 10971.0]
  - - [512, 3944, 1, 512, 512, 512, 512, 512]
    - [35, 10595.0]
  - - [512, 3944, 1, 33708, 512, 512, 512, 33708]
    - [0, 10987.0]
  - - [512, 3955, 1, 512, 512, 512, 512, 512]
    - [35, 10556.0]
  - - [512, 3955, 1, 33708, 512, 512, 512, 33708]
    - [0, 10997.0]
  - - [512, 3968, 1, 512, 512, 512, 512, 512]
    - [35, 10702.0]
  - - [512, 3968, 1, 2048, 512, 512, 512, 2048]
    - [7, 10990.0]
  - - [512, 3968, 1, 33708, 512, 512, 512, 33708]
    - [0, 11034.0]
  - - [512, 3969, 1, 512, 512, 512, 512, 512]
    - [35, 10665.0]
  - - [512, 3969, 1, 33708, 512, 512, 512, 33708]
    - [28, 11024.0]
  - - [512, 3976, 1, 512, 512, 512, 512, 512]
    - [35, 10636.0]
  - - [512, 3976, 1, 33708, 512, 512, 512, 33708]
    - [0, 11039.0]
  - - [512, 3977, 1, 512, 512, 512, 512, 512]
    - [35, 10649.0]
  - - [512, 3977, 1, 2048, 512, 512, 512, 2048]
    - [21, 10966.0]
  - - [512, 3977, 1, 33708, 512, 512, 512, 33708]
    - [28, 11058.0]
  - - [512, 3978, 1, 512, 512, 512, 512, 512]
    - [35, 10626.0]
  - - [512, 3978, 1, 2048, 512, 512, 512, 2048]
    - [35, 11000.0]
  - - [512, 3978, 1, 33708, 512, 512, 512, 33708]
    - [28, 11106.0]
  - - [512, 3990, 1, 512, 512, 512, 512, 512]
    - [35, 10750.0]
  - - [512, 3990, 1, 2048, 512, 512, 512, 2048]
    - [35, 11067.0]
  - - [512, 3990, 1, 33708, 512, 512, 512, 33708]
    - [28, 11131.0]
  - - [512, 3995, 1, 512, 512, 512, 512, 512]
    - [35, 10754.0]
  - - [512, 3995, 1, 2048, 512, 512, 512, 2048]
    - [7, 11087.0]
  - - [512, 3995, 1, 33708, 512, 512, 512, 33708]
    - [28, 11150.0]
  - - [512, 3996, 1, 512, 512, 512, 512, 512]
    - [35, 10750.0]
  - - [512, 3996, 1, 2048, 512, 512, 512, 2048]
    - [35, 11084.0]
  - - [512, 3996, 1, 33708, 512, 512, 512, 33708]
    - [28, 11165.0]
  - - [512, 3999, 1, 512, 512, 512, 512, 512]
    - [35, 10763.0]
  - - [512, 3999, 1, 2048, 512, 512, 512, 2048]
    - [35, 11122.0]
  - - [512, 3999, 1, 33708, 512, 512, 512, 33708]
    - [28, 11164.0]
  - - [512, 4005, 1, 512, 512, 512, 512, 512]
    - [35, 10808.0]
  - - [512, 4005, 1, 2048, 512, 512, 512, 2048]
    - [35, 11093.0]
  - - [512, 4005, 1, 33708, 512, 512, 512, 33708]
    - [15, 11166.0]
  - - [512, 4012, 1, 512, 512, 512, 512, 512]
    - [35, 10785.0]
  - - [512, 4012, 1, 2048, 512, 512, 512, 2048]
    - [35, 11143.0]
  - - [512, 4012, 1, 33708, 512, 512, 512, 33708]
    - [28, 11195.0]
  - - [512, 4020, 1, 512, 512, 512, 512, 512]
    - [35, 10802.0]
  - - [512, 4020, 1, 2048, 512, 512, 512, 2048]
    - [35, 11158.0]
  - - [512, 4020, 1, 33708, 512, 512, 512, 33708]
    - [28, 11209.0]
  - - [512, 4026, 1, 512, 512, 512, 512, 512]
    - [35, 10807.0]
  - - [512, 4026, 1, 2048, 512, 512, 512, 2048]
    - [21, 11149.0]
  - - [512, 4026, 1, 33708, 512, 512, 512, 33708]
    - [28, 11221.0]
  - - [512, 4030, 1, 512, 512, 512, 512, 512]
    - [35, 10840.0]
  - - [512, 4030, 1, 2048, 512, 512, 512, 2048]
    - [21, 11167.0]
  - - [512, 4030, 1, 33708, 512, 512, 512, 33708]
    - [15, 11235.0]
  - - [512, 4032, 1, 512, 512, 512, 512, 512]
    - [35, 10924.0]
  - - [512, 4032, 1, 2048, 512, 512, 512, 2048]
    - [7, 11206.0]
  - - [512, 4032, 1, 33708, 512, 512, 512, 33708]
    - [28, 11250.0]
  - - [512, 4050, 1, 512, 512, 512, 512, 512]
    - [35, 10871.0]
  - - [512, 4059, 1, 512, 512, 512, 512, 512]
    - [35, 10970.0]
  - - [2048, 644, 1, 512, 2048, 2048, 2048, 512]
    - [15, 9847.0]
  - - [2048, 668, 1, 512, 2048, 2048, 2048, 512]
    - [15, 10122.0]
  - - [2048, 714, 1, 512, 2048, 2048, 2048, 512]
    - [28, 9974.0]
  - - [2048, 720, 1, 512, 2048, 2048, 2048, 512]
    - [16, 10064.0]
  - - [2048, 722, 1, 512, 2048, 2048, 2048, 512]
    - [28, 10051.0]
  - - [2048, 781, 1, 512, 2048, 2048, 2048, 512]
    - [28, 9939.0]
  - - [2048, 848, 1, 512, 2048, 2048, 2048, 512]
    - [1, 10107.0]
  - - [2048, 872, 1, 512, 2048, 2048, 2048, 512]
    - [16, 10318.0]
  - - [2048, 936, 1, 512, 2048, 2048, 2048, 512]
    - [28, 10888.0]
  - - [2048, 980, 1, 512, 2048, 2048, 2048, 512]
    - [15, 10662.0]
  - - [2048, 1139, 1, 512, 2048, 2048, 2048, 512]
    - [15, 10760.0]
  - - [2048, 1184, 1, 512, 2048, 2048, 2048, 512]
    - [1, 10716.0]
  - - [2048, 1186, 1, 512, 2048, 2048, 2048, 512]
    - [1, 10689.0]
  - - [2048, 1279, 1, 512, 2048, 2048, 2048, 512]
    - [1, 11333.0]
  - - [2048, 1290, 1, 512, 2048, 2048, 2048, 512]
    - [28, 10808.0]
  - - [2048, 1327, 1, 512, 2048, 2048, 2048, 512]
    - [28, 11077.0]
  - - [2048, 1331, 1, 512, 2048, 2048, 2048, 512]
    - [28, 11101.0]
  - - [2048, 1341, 1, 512, 2048, 2048, 2048, 512]
    - [28, 11165.0]
  - - [2048, 1350, 1, 512, 2048, 2048, 2048, 512]
    - [16, 10955.0]
  - - [2048, 1359, 1, 512, 2048, 2048, 2048, 512]
    - [22, 10997.0]
  - - [2048, 1391, 1, 512, 2048, 2048, 2048, 512]
    - [16, 11244.0]
  - - [2048, 1424, 1, 512, 2048, 2048, 2048, 512]
    - [28, 10803.0]
  - - [2048, 1458, 1, 512, 2048, 2048, 2048, 512]
    - [15, 11005.0]
  - - [2048, 1462, 1, 512, 2048, 2048, 2048, 512]
    - [28, 11032.0]
  - - [2048, 1467, 1, 512, 2048, 2048, 2048, 512]
    - [28, 11083.0]
  - - [2048, 1472, 1, 512, 2048, 2048, 2048, 512]
    - [0, 11186.0]
  - - [2048, 1520, 1, 512, 2048, 2048, 2048, 512]
    - [1, 11227.0]
  - - [2048, 1596, 1, 512, 2048, 2048, 2048, 512]
    - [15, 11361.0]
  - - [2048, 1599, 1, 512, 2048, 2048, 2048, 512]
    - [15, 11346.0]
  - - [2048, 1615, 1, 512, 2048, 2048, 2048, 512]
    - [28, 11051.0]
  - - [2048, 1680, 1, 512, 2048, 2048, 2048, 512]
    - [15, 11040.0]
  - - [2048, 1709, 1, 512, 2048, 2048, 2048, 512]
    - [28, 11193.0]
  - - [2048, 1902, 1, 512, 2048, 2048, 2048, 512]
    - [1, 11641.0]
  - - [2048, 1917, 1, 512, 2048, 2048, 2048, 512]
    - [22, 11770.0]
  - - [2048, 2076, 1, 512, 2048, 2048, 2048, 512]
    - [1, 11184.0]
  - - [2048, 2195, 1, 512, 2048, 2048, 2048, 512]
    - [15, 11363.0]
  - - [2048, 2205, 1, 512, 2048, 2048, 2048, 512]
    - [28, 11450.0]
  - - [2048, 2418, 1, 512, 2048, 2048, 2048, 512]
    - [1, 11460.0]
  - - [2048, 2496, 1, 512, 2048, 2048, 2048, 512]
    - [1, 11753.0]
  - - [2048, 2790, 1, 512, 2048, 2048, 2048, 512]
    - [1, 11800.0]
  - - [2048, 2864, 1, 512, 2048, 2048, 2048, 512]
    - [28, 11589.0]
  - - [2048, 3092, 1, 512, 2048, 2048, 2048, 512]
    - [1, 11723.0]
  - - [2048, 3113, 1, 512, 2048, 2048, 2048, 512]
    - [8, 11770.0]
  - - [2048, 3137, 1, 512, 2048, 2048, 2048, 512]
    - [1, 11926.0]
  - - [2048, 3166, 1, 512, 2048, 2048, 2048, 512]
    - [1, 11997.0]
  - - [2048, 3194, 1, 512, 2048, 2048, 2048, 512]
    - [1, 12033.0]
  - - [2048, 3219, 1, 512, 2048, 2048, 2048, 512]
    - [19, 11619.0]
  - - [2048, 3222, 1, 512, 2048, 2048, 2048, 512]
    - [1, 11677.0]
  - - [2048, 3234, 1, 512, 2048, 2048, 2048, 512]
    - [1, 11762.0]
  - - [2048, 3237, 1, 512, 2048, 2048, 2048, 512]
    - [1, 11747.0]
  - - [2048, 3242, 1, 512, 2048, 2048, 2048, 512]
    - [1, 11768.0]
  - - [2048, 3246, 1, 512, 2048, 2048, 2048, 512]
    - [1, 11763.0]
  - - [2048, 3249, 1, 512, 2048, 2048, 2048, 512]
    - [1, 11771.0]
  - - [2048, 3251, 1, 512, 2048, 2048, 2048, 512]
    - [1, 11792.0]
  - - [2048, 3257, 1, 512, 2048, 2048, 2048, 512]
    - [1, 11815.0]
  - - [2048, 3262, 1, 512, 2048, 2048, 2048, 512]
    - [1, 11818.0]
  - - [2048, 3268, 1, 512, 2048, 2048, 2048, 512]
    - [1, 11866.0]
  - - [2048, 3282, 1, 512, 2048, 2048, 2048, 512]
    - [22, 11804.0]
  - - [2048, 3286, 1, 512, 2048, 2048, 2048, 512]
    - [1, 11883.0]
  - - [2048, 3287, 1, 512, 2048, 2048, 2048, 512]
    - [1, 11915.0]
  - - [2048, 3293, 1, 512, 2048, 2048, 2048, 512]
    - [1, 11931.0]
  - - [2048, 3297, 1, 512, 2048, 2048, 2048, 512]
    - [1, 11945.0]
  - - [2048, 3307, 1, 512, 2048, 2048, 2048, 512]
    - [1, 11969.0]
  - - [2048, 3314, 1, 512, 2048, 2048, 2048, 512]
    - [1, 11986.0]
  - - [2048, 3315, 1, 512, 2048, 2048, 2048, 512]
    - [1, 11984.0]
  - - [2048, 3319, 1, 512, 2048, 2048, 2048, 512]
    - [1, 11997.0]
  - - [2048, 3322, 1, 512, 2048, 2048, 2048, 512]
    - [1, 11967.0]
  - - [2048, 3323, 1, 512, 2048, 2048, 2048, 512]
    - [1, 12008.0]
  - - [2048, 3324, 1, 512, 2048, 2048, 2048, 512]
    - [1, 12053.0]
  - - [2048, 3325, 1, 512, 2048, 2048, 2048, 512]
    - [1, 12003.0]
  - - [2048, 3327, 1, 512, 2048, 2048, 2048, 512]
    - [1, 12020.0]
  - - [2048, 3329, 1, 512, 2048, 2048, 2048, 512]
    - [1, 11588.0]
  - - [2048, 3332, 1, 512, 2048, 2048, 2048, 512]
    - [1, 11597.0]
  - - [2048, 3336, 1, 512, 2048, 2048, 2048, 512]
    - [1, 11613.0]
  - - [2048, 3339, 1, 512, 2048, 2048, 2048, 512]
    - [1, 11660.0]
  - - [2048, 3342, 1, 512, 2048, 2048, 2048, 512]
    - [1, 11635.0]
  - - [2048, 3344, 1, 512, 2048, 2048, 2048, 512]
    - [1, 11645.0]
  - - [2048, 3358, 1, 512, 2048, 2048, 2048, 512]
    - [1, 11690.0]
  - - [2048, 3360, 1, 512, 2048, 2048, 2048, 512]
    - [1, 11682.0]
  - - [2048, 3364, 1, 512, 2048, 2048, 2048, 512]
    - [1, 11703.0]
  - - [2048, 3365, 1, 512, 2048, 2048, 2048, 512]
    - [1, 11740.0]
  - - [2048, 3369, 1, 512, 2048, 2048, 2048, 512]
    - [1, 11732.0]
  - - [2048, 3370, 1, 512, 2048, 2048, 2048, 512]
    - [1, 11744.0]
  - - [2048, 3371, 1, 512, 2048, 2048, 2048, 512]
    - [1, 11745.0]
  - - [2048, 3374, 1, 512, 2048, 2048, 2048, 512]
    - [1, 11759.0]
  - - [2048, 3376, 1, 512, 2048, 2048, 2048, 512]
    - [1, 11741.0]
  - - [2048, 3377, 1, 512, 2048, 2048, 2048, 512]
    - [1, 11768.0]
  - - [2048, 3378, 1, 512, 2048, 2048, 2048, 512]
    - [1, 11766.0]
  - - [2048, 3381, 1, 512, 2048, 2048, 2048, 512]
    - [1, 11774.0]
  - - [2048, 3382, 1, 512, 2048, 2048, 2048, 512]
    - [1, 11798.0]
  - - [2048, 3383, 1, 512, 2048, 2048, 2048, 512]
    - [1, 11784.0]
  - - [2048, 3384, 1, 512, 2048, 2048, 2048, 512]
    - [1, 11786.0]
  - - [2048, 3385, 1, 512, 2048, 2048, 2048, 512]
    - [1, 11794.0]
  - - [2048, 3386, 1, 512, 2048, 2048, 2048, 512]
    - [1, 11792.0]
  - - [2048, 3388, 1, 512, 2048, 2048, 2048, 512]
    - [1, 11796.0]
  - - [2048, 3390, 1, 512, 2048, 2048, 2048, 512]
    - [1, 11771.0]
  - - [2048, 3391, 1, 512, 2048, 2048, 2048, 512]
    - [1, 11804.0]
  - - [2048, 3396, 1, 512, 2048, 2048, 2048, 512]
    - [1, 11819.0]
  - - [2048, 3399, 1, 512, 2048, 2048, 2048, 512]
    - [1, 11807.0]
  - - [2048, 3402, 1, 512, 2048, 2048, 2048, 512]
    - [1, 11865.0]
  - - [2048, 3410, 1, 512, 2048, 2048, 2048, 512]
    - [1, 11839.0]
  - - [2048, 3412, 1, 512, 2048, 2048, 2048, 512]
    - [1, 11878.0]
  - - [2048, 3414, 1, 512, 2048, 2048, 2048, 512]
    - [1, 11902.0]
  - - [2048, 3415, 1, 512, 2048, 2048, 2048, 512]
    - [1, 11858.0]
  - - [2048, 3418, 1, 512, 2048, 2048, 2048, 512]
    - [1, 11876.0]
  - - [2048, 3420, 1, 512, 2048, 2048, 2048, 512]
    - [1, 11916.0]
  - - [2048, 3422, 1, 512, 2048, 2048, 2048, 512]
    - [1, 11897.0]
  - - [2048, 3425, 1, 512, 2048, 2048, 2048, 512]
    - [1, 11894.0]
  - - [2048, 3426, 1, 512, 2048, 2048, 2048, 512]
    - [1, 11888.0]
  - - [2048, 3427, 1, 512, 2048, 2048, 2048, 512]
    - [1, 11930.0]
  - - [2048, 3428, 1, 512, 2048, 2048, 2048, 512]
    - [1, 11921.0]
  - - [2048, 3430, 1, 512, 2048, 2048, 2048, 512]
    - [1, 11943.0]
  - - [2048, 3431, 1, 512, 2048, 2048, 2048, 512]
    - [1, 11895.0]
  - - [2048, 3432, 1, 512, 2048, 2048, 2048, 512]
    - [1, 11953.0]
  - - [2048, 3433, 1, 512, 2048, 2048, 2048, 512]
    - [1, 11934.0]
  - - [2048, 3438, 1, 512, 2048, 2048, 2048, 512]
    - [1, 11930.0]
  - - [2048, 3439, 1, 512, 2048, 2048, 2048, 512]
    - [1, 11935.0]
  - - [2048, 3440, 1, 512, 2048, 2048, 2048, 512]
    - [1, 11939.0]
  - - [2048, 3443, 1, 512, 2048, 2048, 2048, 512]
    - [1, 11969.0]
  - - [2048, 3445, 1, 512, 2048, 2048, 2048, 512]
    - [1, 11961.0]
  - - [2048, 3447, 1, 512, 2048, 2048, 2048, 512]
    - [1, 11944.0]
  - - [2048, 3448, 1, 512, 2048, 2048, 2048, 512]
    - [1, 11906.0]
  - - [2048, 3450, 1, 512, 2048, 2048, 2048, 512]
    - [1, 11938.0]
  - - [2048, 3451, 1, 512, 2048, 2048, 2048, 512]
    - [1, 11970.0]
  - - [2048, 3452, 1, 512, 2048, 2048, 2048, 512]
    - [1, 11974.0]
  - - [2048, 3453, 1, 512, 2048, 2048, 2048, 512]
    - [1, 11990.0]
  - - [2048, 3455, 1, 512, 2048, 2048, 2048, 512]
    - [1, 11966.0]
  - - [2048, 3456, 1, 512, 2048, 2048, 2048, 512]
    - [1, 12079.0]
  - - [2048, 3457, 1, 512, 2048, 2048, 2048, 512]
    - [1, 11560.0]
  - - [2048, 3458, 1, 512, 2048, 2048, 2048, 512]
    - [1, 11574.0]
  - - [2048, 3459, 1, 512, 2048, 2048, 2048, 512]
    - [1, 11556.0]
  - - [2048, 3460, 1, 512, 2048, 2048, 2048, 512]
    - [1, 11586.0]
  - - [2048, 3461, 1, 512, 2048, 2048, 2048, 512]
    - [1, 11564.0]
  - - [2048, 3462, 1, 512, 2048, 2048, 2048, 512]
    - [1, 11562.0]
  - - [2048, 3466, 1, 512, 2048, 2048, 2048, 512]
    - [28, 11564.0]
  - - [2048, 3467, 1, 512, 2048, 2048, 2048, 512]
    - [1, 11576.0]
  - - [2048, 3468, 1, 512, 2048, 2048, 2048, 512]
    - [1, 11577.0]
  - - [2048, 3470, 1, 512, 2048, 2048, 2048, 512]
    - [1, 11606.0]
  - - [2048, 3471, 1, 512, 2048, 2048, 2048, 512]
    - [1, 11616.0]
  - - [2048, 3472, 1, 512, 2048, 2048, 2048, 512]
    - [1, 11591.0]
  - - [2048, 3475, 1, 512, 2048, 2048, 2048, 512]
    - [1, 11616.0]
  - - [2048, 3476, 1, 512, 2048, 2048, 2048, 512]
    - [22, 11592.0]
  - - [2048, 3477, 1, 512, 2048, 2048, 2048, 512]
    - [1, 11603.0]
  - - [2048, 3478, 1, 512, 2048, 2048, 2048, 512]
    - [1, 11607.0]
  - - [2048, 3479, 1, 512, 2048, 2048, 2048, 512]
    - [1, 11611.0]
  - - [2048, 3480, 1, 512, 2048, 2048, 2048, 512]
    - [1, 11642.0]
  - - [2048, 3481, 1, 512, 2048, 2048, 2048, 512]
    - [1, 11627.0]
  - - [2048, 3483, 1, 512, 2048, 2048, 2048, 512]
    - [15, 11618.0]
  - - [2048, 3484, 1, 512, 2048, 2048, 2048, 512]
    - [1, 11634.0]
  - - [2048, 3487, 1, 512, 2048, 2048, 2048, 512]
    - [1, 11635.0]
  - - [2048, 3489, 1, 512, 2048, 2048, 2048, 512]
    - [1, 11630.0]
  - - [2048, 3490, 1, 512, 2048, 2048, 2048, 512]
    - [1, 11643.0]
  - - [2048, 3491, 1, 512, 2048, 2048, 2048, 512]
    - [1, 11648.0]
  - - [2048, 3493, 1, 512, 2048, 2048, 2048, 512]
    - [1, 11665.0]
  - - [2048, 3494, 1, 512, 2048, 2048, 2048, 512]
    - [1, 11662.0]
  - - [2048, 3495, 1, 512, 2048, 2048, 2048, 512]
    - [1, 11685.0]
  - - [2048, 3497, 1, 512, 2048, 2048, 2048, 512]
    - [1, 11703.0]
  - - [2048, 3498, 1, 512, 2048, 2048, 2048, 512]
    - [1, 11681.0]
  - - [2048, 3501, 1, 512, 2048, 2048, 2048, 512]
    - [1, 11710.0]
  - - [2048, 3503, 1, 512, 2048, 2048, 2048, 512]
    - [1, 11680.0]
  - - [2048, 3505, 1, 512, 2048, 2048, 2048, 512]
    - [1, 11689.0]
  - - [2048, 3507, 1, 512, 2048, 2048, 2048, 512]
    - [1, 11708.0]
  - - [2048, 3508, 1, 512, 2048, 2048, 2048, 512]
    - [1, 11736.0]
  - - [2048, 3509, 1, 512, 2048, 2048, 2048, 512]
    - [1, 11715.0]
  - - [2048, 3510, 1, 512, 2048, 2048, 2048, 512]
    - [1, 11740.0]
  - - [2048, 3511, 1, 512, 2048, 2048, 2048, 512]
    - [1, 11752.0]
  - - [2048, 3513, 1, 512, 2048, 2048, 2048, 512]
    - [1, 11742.0]
  - - [2048, 3514, 1, 512, 2048, 2048, 2048, 512]
    - [1, 11774.0]
  - - [2048, 3515, 1, 512, 2048, 2048, 2048, 512]
    - [1, 11726.0]
  - - [2048, 3517, 1, 512, 2048, 2048, 2048, 512]
    - [1, 11739.0]
  - - [2048, 3518, 1, 512, 2048, 2048, 2048, 512]
    - [1, 11756.0]
  - - [2048, 3519, 1, 512, 2048, 2048, 2048, 512]
    - [1, 11736.0]
  - - [2048, 3520, 1, 512, 2048, 2048, 2048, 512]
    - [15, 11767.0]
  - - [2048, 3523, 1, 512, 2048, 2048, 2048, 512]
    - [1, 11763.0]
  - - [2048, 3528, 1, 512, 2048, 2048, 2048, 512]
    - [1, 11778.0]
  - - [2048, 3529, 1, 512, 2048, 2048, 2048, 512]
    - [1, 11751.0]
  - - [2048, 3530, 1, 512, 2048, 2048, 2048, 512]
    - [1, 11767.0]
  - - [2048, 3531, 1, 512, 2048, 2048, 2048, 512]
    - [1, 11788.0]
  - - [2048, 3532, 1, 512, 2048, 2048, 2048, 512]
    - [1, 11778.0]
  - - [2048, 3533, 1, 512, 2048, 2048, 2048, 512]
    - [1, 11827.0]
  - - [2048, 3534, 1, 512, 2048, 2048, 2048, 512]
    - [1, 11805.0]
  - - [2048, 3538, 1, 512, 2048, 2048, 2048, 512]
    - [1, 11798.0]
  - - [2048, 3539, 1, 512, 2048, 2048, 2048, 512]
    - [1, 11800.0]
  - - [2048, 3540, 1, 512, 2048, 2048, 2048, 512]
    - [1, 11834.0]
  - - [2048, 3541, 1, 512, 2048, 2048, 2048, 512]
    - [1, 11839.0]
  - - [2048, 3547, 1, 512, 2048, 2048, 2048, 512]
    - [1, 11822.0]
  - - [2048, 3548, 1, 512, 2048, 2048, 2048, 512]
    - [1, 11836.0]
  - - [2048, 3552, 1, 512, 2048, 2048, 2048, 512]
    - [1, 11849.0]
  - - [2048, 3564, 1, 512, 2048, 2048, 2048, 512]
    - [1, 11896.0]
  - - [2048, 3575, 1, 512, 2048, 2048, 2048, 512]
    - [1, 11911.0]
  - - [2048, 3598, 1, 512, 2048, 2048, 2048, 512]
    - [1, 11524.0]
  - - [2048, 3599, 1, 512, 2048, 2048, 2048, 512]
    - [1, 11554.0]
  - - [2048, 3608, 1, 512, 2048, 2048, 2048, 512]
    - [1, 11574.0]
  - - [2048, 3776, 1, 512, 2048, 2048, 2048, 512]
    - [1, 12040.0]
  - - [2048, 3780, 1, 512, 2048, 2048, 2048, 512]
    - [1, 12060.0]
  - - [2048, 3796, 1, 512, 2048, 2048, 2048, 512]
    - [1, 12112.0]
  - - [2048, 3822, 1, 512, 2048, 2048, 2048, 512]
    - [1, 12114.0]
  - - [2048, 3835, 1, 512, 2048, 2048, 2048, 512]
    - [1, 12134.0]
  - - [2048, 3840, 1, 512, 2048, 2048, 2048, 512]
    - [1, 12282.0]
  - - [2048, 3859, 1, 512, 2048, 2048, 2048, 512]
    - [1, 11876.0]
  - - [2048, 3864, 1, 512, 2048, 2048, 2048, 512]
    - [1, 11884.0]
  - - [2048, 3870, 1, 512, 2048, 2048, 2048, 512]
    - [1, 11872.0]
  - - [2048, 3876, 1, 512, 2048, 2048, 2048, 512]
    - [1, 11880.0]
  - - [2048, 3906, 1, 512, 2048, 2048, 2048, 512]
    - [1, 11966.0]
  - - [2048, 3910, 1, 512, 2048, 2048, 2048, 512]
    - [1, 11956.0]
  - - [2048, 3925, 1, 512, 2048, 2048, 2048, 512]
    - [1, 12003.0]
  - - [2048, 3942, 1, 512, 2048, 2048, 2048, 512]
    - [1, 12061.0]
  - - [2048, 3944, 1, 512, 2048, 2048, 2048, 512]
    - [1, 12061.0]
  - - [2048, 3955, 1, 512, 2048, 2048, 2048, 512]
    - [1, 12086.0]
  - - [2048, 3968, 1, 512, 2048, 2048, 2048, 512]
    - [1, 12237.0]
  - - [2048, 3969, 1, 512, 2048, 2048, 2048, 512]
    - [1, 11724.0]
  - - [2048, 3976, 1, 512, 2048, 2048, 2048, 512]
    - [1, 11792.0]
  - - [2048, 3977, 1, 512, 2048, 2048, 2048, 512]
    - [1, 11777.0]
  - - [2048, 3978, 1, 512, 2048, 2048, 2048, 512]
    - [1, 11763.0]
  - - [2048, 3990, 1, 512, 2048, 2048, 2048, 512]
    - [1, 11793.0]
  - - [2048, 3995, 1, 512, 2048, 2048, 2048, 512]
    - [1, 11840.0]
  - - [2048, 3996, 1, 512, 2048, 2048, 2048, 512]
    - [1, 11801.0]
  - - [2048, 3999, 1, 512, 2048, 2048, 2048, 512]
    - [1, 11833.0]
  - - [2048, 4005, 1, 512, 2048, 2048, 2048, 512]
    - [1, 11849.0]
  - - [2048, 4012, 1, 512, 2048, 2048, 2048, 512]
    - [1, 11881.0]
  - - [2048, 4020, 1, 512, 2048, 2048, 2048, 512]
    - [1, 11885.0]
  - - [2048, 4026, 1, 512, 2048, 2048, 2048, 512]
    - [1, 11904.0]
  - - [2048, 4030, 1, 512, 2048, 2048, 2048, 512]
    - [1, 11913.0]
  - - [2048, 4032, 1, 512, 2048, 2048, 2048, 512]
    - [1, 11923.0]
  - - [1024, 4096, 1, 3072, 1024, 1024, 1024, 3072]
    - [22, 12179.0]
  - - [1024, 3840, 1, 1024, 1024, 1024, 1024, 1024]
    - [8, 12149.0]
  - - [1024, 3840, 1, 4096, 1024, 1024, 1024, 4096]
    - [6, 12330.0]
  - - [1024, 3968, 1, 1024, 1024, 1024, 1024, 1024]
    - [8, 11657.0]
  - - [1024, 3968, 1, 4096, 1024, 1024, 1024, 4096]
    - [22, 11828.0]
  - - [1024, 3968, 1, 42720, 1024, 1024, 1024, 42720]
    - [16, 11834.0]
  - - [1024, 7200, 1, 1024, 1024, 1024, 1024, 1024]
    - [8, 12066.0]
  - - [1024, 7200, 1, 4096, 1024, 1024, 1024, 4096]
    - [22, 12205.0]
  - - [1024, 7200, 1, 42720, 1024, 1024, 1024, 42720]
    - [8, 12266.0]
  - - [1024, 8160, 1, 1024, 1024, 1024, 1024, 1024]
    - [22, 12203.0]
  - - [1024, 8160, 1, 4096, 1024, 1024, 1024, 4096]
    - [22, 12266.0]
  - - [1024, 9520, 1, 1024, 1024, 1024, 1024, 1024]
    - [22, 12291.0]
  - - [1024, 9520, 1, 4096, 1024, 1024, 1024, 4096]
    - [8, 12401.0]
  - - [1024, 9520, 1, 42720, 1024, 1024, 1024, 42720]
    - [16, 12478.0]
  - - [1024, 10200, 1, 1024, 1024, 1024, 1024, 1024]
    - [22, 12394.0]
  - - [1024, 10200, 1, 4096, 1024, 1024, 1024, 4096]
    - [22, 12455.0]
  - - [4096, 3840, 1, 1024, 4096, 4096, 4096, 1024]
    - [1, 12578.0]
  - - [4096, 3968, 1, 1024, 4096, 4096, 4096, 1024]
    - [1, 12496.0]
  - - [4096, 7200, 1, 1024, 4096, 4096, 4096, 1024]
    - [1, 12365.0]
  - - [4096, 8160, 1, 1024, 4096, 4096, 4096, 1024]
    - [1, 12509.0]
  - - [4096, 9520, 1, 1024, 4096, 4096, 4096, 1024]
    - [1, 12527.0]
  - - [4096, 10200, 1, 1024, 4096, 4096, 4096, 1024]
    - [1, 12587.0]
  - - [1024, 2048, 1, 4096, 1024, 1024, 1024, 4096]
    - [21, 11406.0]
  - - [1024, 2048, 1, 30528, 1024, 1024, 1024, 30528]
    - [28, 11412.0]
  - - [1024, 4096, 1, 30528, 1024, 1024, 1024, 30528]
    - [1, 12198.0]
  - - [1024, 10240, 1, 256, 1024, 1024, 1024, 256]
    - [1, 12078.0]
  - - [1024, 10496, 1, 256, 1024, 1024, 1024, 256]
    - [1, 12115.0]
  - - [1024, 11008, 1, 256, 1024, 1024, 1024, 256]
    - [1, 12000.0]
  - - [1024, 11264, 1, 256, 1024, 1024, 1024, 256]
    - [1, 11988.0]
  - - [1024, 11520, 1, 256, 1024, 1024, 1024, 256]
    - [1, 12194.0]
  - - [1024, 12288, 1, 256, 1024, 1024, 1024, 256]
    - [1, 12060.0]
  - - [1024, 13312, 1, 256, 1024, 1024, 1024, 256]
    - [1, 12122.0]
  - - [1024, 13568, 1, 256, 1024, 1024, 1024, 256]
    - [1, 12109.0]
  - - [1024, 14336, 1, 256, 1024, 1024, 1024, 256]
    - [1, 12204.0]
  - - [1024, 14592, 1, 256, 1024, 1024, 1024, 256]
    - [1, 12150.0]
  - - [1024, 14848, 1, 256, 1024, 1024, 1024, 256]
    - [1, 12126.0]
  - - [1024, 15104, 1, 256, 1024, 1024, 1024, 256]
    - [1, 12128.0]
  - - [1024, 1600, 1, 1024, 1024, 1024, 1024, 1024]
    - [21, 11228.0]
  - - [1024, 1600, 1, 1, 1024, 1024, 1024, 1]
    - [21, 238.0]
  - - [1024, 16128, 1, 256, 1024, 1024, 1024, 256]
    - [1, 12183.0]
  - - [1024, 17152, 1, 256, 1024, 1024, 1024, 256]
    - [1, 12173.0]
  - - [1024, 1792, 1, 256, 1024, 1024, 1024, 256]
    - [1, 10412.0]
  - - [1024, 18944, 1, 256, 1024, 1024, 1024, 256]
    - [1, 12135.0]
  - - [1024, 19712, 1, 256, 1024, 1024, 1024, 256]
    - [1, 12156.0]
  - - [1024, 19968, 1, 256, 1024, 1024, 1024, 256]
    - [4, 12123.0]
  - - [1024, 20480, 1, 256, 1024, 1024, 1024, 256]
    - [4, 12217.0]
  - - [1024, 2048, 1, 256, 1024, 1024, 1024, 256]
    - [28, 10833.0]
  - - [1024, 20992, 1, 256, 1024, 1024, 1024, 256]
    - [1, 12160.0]
  - - [1024, 21504, 1, 256, 1024, 1024, 1024, 256]
    - [4, 12124.0]
  - - [1024, 22016, 1, 256, 1024, 1024, 1024, 256]
    - [4, 12210.0]
  - - [1024, 23552, 1, 256, 1024, 1024, 1024, 256]
    - [4, 12194.0]
  - - [1024, 2560, 1, 256, 1024, 1024, 1024, 256]
    - [1, 11166.0]
  - - [1024, 28672, 1, 256, 1024, 1024, 1024, 256]
    - [4, 12252.0]
  - - [1024, 3072, 1, 256, 1024, 1024, 1024, 256]
    - [1, 10986.0]
  - - [1024, 3328, 1, 256, 1024, 1024, 1024, 256]
    - [0, 11257.0]
  - - [1024, 33536, 1, 256, 1024, 1024, 1024, 256]
    - [4, 12298.0]
  - - [1024, 3840, 1, 256, 1024, 1024, 1024, 256]
    - [1, 11547.0]
  - - [1024, 40448, 1, 256, 1024, 1024, 1024, 256]
    - [4, 12295.0]
  - - [1024, 4096, 1, 256, 1024, 1024, 1024, 256]
    - [1, 11396.0]
  - - [1024, 4608, 1, 256, 1024, 1024, 1024, 256]
    - [15, 11417.0]
  - - [1024, 4864, 1, 256, 1024, 1024, 1024, 256]
    - [1, 11360.0]
  - - [1024, 5120, 1, 256, 1024, 1024, 1024, 256]
    - [1, 11842.0]
  - - [1024, 5632, 1, 256, 1024, 1024, 1024, 256]
    - [1, 11678.0]
  - - [1024, 6144, 1, 256, 1024, 1024, 1024, 256]
    - [1, 11600.0]
  - - [1024, 6400, 1, 256, 1024, 1024, 1024, 256]
    - [1, 11996.0]
  - - [1024, 7168, 1, 256, 1024, 1024, 1024, 256]
    - [1, 11775.0]
  - - [1024, 7424, 1, 256, 1024, 1024, 1024, 256]
    - [1, 11738.0]
  - - [1024, 7680, 1, 256, 1024, 1024, 1024, 256]
    - [1, 12037.0]
  - - [1024, 7936, 1, 256, 1024, 1024, 1024, 256]
    - [1, 11989.0]
  - - [1024, 8192, 1, 256, 1024, 1024, 1024, 256]
    - [1, 11940.0]
  - - [1024, 8448, 1, 256, 1024, 1024, 1024, 256]
    - [1, 11849.0]
  - - [1024, 8704, 1, 256, 1024, 1024, 1024, 256]
    - [1, 11843.0]
  - - [1024, 8960, 1, 256, 1024, 1024, 1024, 256]
    - [1, 12111.0]
  - - [1024, 9728, 1, 256, 1024, 1024, 1024, 256]
    - [1, 11977.0]
  - - [1024, 9984, 1, 256, 1024, 1024, 1024, 256]
    - [1, 11906.0]
  - - [2048, 1024, 1, 1, 2048, 2048, 2048, 1]
    - [23, 244.0]
  - - [2048, 1024, 1, 256, 2048, 2048, 2048, 256]
    - [0, 10961.0]
  - - [256, 8976, 1, 10240, 256, 256, 256, 10240]
    - [12, 10769.0]
  - - [256, 8976, 1, 10496, 256, 256, 256, 10496]
    - [7, 10903.0]
  - - [256, 8976, 1, 11008, 256, 256, 256, 11008]
    - [7, 10867.0]
  - - [256, 8976, 1, 11520, 256, 256, 256, 11520]
    - [41, 10824.0]
  - - [256, 8976, 1, 12288, 256, 256, 256, 12288]
    - [7, 10706.0]
  - - [256, 8976, 1, 14336, 256, 256, 256, 14336]
    - [7, 10660.0]
  - - [256, 8976, 1, 14848, 256, 256, 256, 14848]
    - [12, 10835.0]
  - - [256, 8976, 1, 15104, 256, 256, 256, 15104]
    - [27, 10843.0]
  - - [256, 8976, 1, 1536, 256, 256, 256, 1536]
    - [35, 10874.0]
  - - [256, 8976, 1, 15872, 256, 256, 256, 15872]
    - [41, 10777.0]
  - - [256, 8976, 1, 17152, 256, 256, 256, 17152]
    - [27, 10855.0]
  - - [256, 8976, 1, 19712, 256, 256, 256, 19712]
    - [12, 10858.0]
  - - [256, 8976, 1, 19968, 256, 256, 256, 19968]
    - [27, 10831.0]
  - - [256, 8976, 1, 20480, 256, 256, 256, 20480]
    - [12, 10692.0]
  - - [256, 8976, 1, 2048, 256, 256, 256, 2048]
    - [35, 10900.0]
  - - [256, 8976, 1, 20992, 256, 256, 256, 20992]
    - [12, 10850.0]
  - - [256, 8976, 1, 22016, 256, 256, 256, 22016]
    - [12, 10824.0]
  - - [256, 8976, 1, 2304, 256, 256, 256, 2304]
    - [35, 10927.0]
  - - [256, 8976, 1, 2560, 256, 256, 256, 2560]
    - [35, 10905.0]
  - - [256, 8976, 1, 26112, 256, 256, 256, 26112]
    - [12, 10816.0]
  - - [256, 8976, 1, 2816, 256, 256, 256, 2816]
    - [35, 10935.0]
  - - [256, 8976, 1, 3072, 256, 256, 256, 3072]
    - [7, 10889.0]
  - - [256, 8976, 1, 33536, 256, 256, 256, 33536]
    - [12, 10868.0]
  - - [256, 8976, 1, 4352, 256, 256, 256, 4352]
    - [41, 10708.0]
  - - [256, 8976, 1, 44505, 256, 256, 256, 44505]
    - [35, 10979.0]
  - - [256, 8976, 1, 4864, 256, 256, 256, 4864]
    - [7, 10884.0]
  - - [256, 8976, 1, 5376, 256, 256, 256, 5376]
    - [21, 10906.0]
  - - [256, 8976, 1, 5632, 256, 256, 256, 5632]
    - [7, 10888.0]
  - - [256, 8976, 1, 5888, 256, 256, 256, 5888]
    - [35, 10866.0]
  - - [256, 8976, 1, 6144, 256, 256, 256, 6144]
    - [21, 10811.0]
  - - [256, 8976, 1, 6656, 256, 256, 256, 6656]
    - [7, 10913.0]
  - - [256, 8976, 1, 7168, 256, 256, 256, 7168]
    - [35, 10781.0]
  - - [256, 8976, 1, 7424, 256, 256, 256, 7424]
    - [21, 10953.0]
  - - [256, 8976, 1, 8192, 256, 256, 256, 8192]
    - [38, 10578.0]
  - - [256, 8976, 1, 8448, 256, 256, 256, 8448]
    - [35, 10972.0]
  - - [256, 8976, 1, 8960, 256, 256, 256, 8960]
    - [35, 10930.0]
  - - [256, 8976, 1, 9472, 256, 256, 256, 9472]
    - [7, 10895.0]
  - - [256, 8976, 1, 9728, 256, 256, 256, 9728]
    - [7, 10917.0]
  - - [256, 8976, 1, 9984, 256, 256, 256, 9984]
    - [21, 10922.0]
  - - [3200, 1024, 1, 2048, 3200, 3200, 3200, 2048]
    - [1, 12260.0]
  - - [4096, 1024, 1, 1, 4096, 4096, 4096, 1]
    - [21, 266.0]
  - - [1024, 4096, 1, 4096, 1024, 1024, 1024, 4096]
    - [22, 12184.0]
  - - [1024, 3072, 1, 3072, 1024, 1024, 1024, 3072]
    - [8, 11835.0]
  - - [1024, 2048, 1, 3072, 1024, 1024, 1024, 3072]
    - [35, 11414.0]
  - - [30528, 4096, 1, 1024, 30528, 30528, 30528, 1024]
    - [22, 12591.0]
  - - [30528, 2048, 1, 1024, 30528, 30528, 30528, 1024]
    - [22, 12548.0]
  - - [512, 32768, 1, 256, 512, 512, 512, 256]
    - [22, 12088.0]
  - - [256, 32768, 1, 128, 256, 256, 256, 128]
    - [15, 11288.0]
  - - [1024, 32768, 1, 512, 1024, 1024, 1024, 512]
    - [22, 12414.0]
  - - [1024, 32768, 1, 1024, 1024, 1024, 1024, 1024]
    - [22, 12497.0]
  - - [479, 32768, 1, 1024, 479, 479, 479, 1024]
    - [11, 11426.0]
  - - [289, 128, 64, 768, 289, 289, 289, 768]
    - [36, 8466.0]
  - - [289, 160, 64, 768, 289, 289, 289, 768]
    - [0, 7216.0]
  - - [289, 192, 64, 768, 289, 289, 289, 768]
    - [3, 8344.0]
  - - [3136, 256, 64, 64, 3136, 3136, 3136, 64]
    - [0, 10534.0]
  - - [784, 512, 64, 128, 784, 784, 784, 128]
    - [4, 10112.0]
  - - [784, 128, 64, 512, 784, 784, 784, 512]
    - [11, 10188.0]
  - - [196, 1024, 64, 256, 196, 196, 196, 256]
    - [11, 8847.0]
  - - [196, 256, 64, 1024, 196, 196, 196, 1024]
    - [39, 8909.0]
  - - [3136, 256, 32, 64, 3136, 3136, 3136, 64]
    - [0, 11004.0]
  - - [784, 512, 32, 128, 784, 784, 784, 128]
    - [29, 10133.0]
  - - [784, 128, 32, 512, 784, 784, 784, 512]
    - [35, 9821.0]
  - - [196, 1024, 32, 256, 196, 196, 196, 256]
    - [32, 8743.0]
  - - [256, 6912, 1, 4, 256, 256, 256, 4]
    - [3, 1003.0]
  - - [512, 4096, 1, 256, 512, 512, 512, 256]
    - [15, 10890.0]
  - - [1024, 4096, 1, 512, 1024, 1024, 1024, 512]
    - [1, 11858.0]
  - - [480, 4096, 1, 1024, 480, 480, 480, 1024]
    - [21, 10522.0]
  - - [512, 6912, 1, 256, 512, 512, 512, 256]
    - [1, 11356.0]
  - - [1024, 6912, 1, 512, 1024, 1024, 1024, 512]
    - [1, 12000.0]
  - - [1024, 6912, 1, 1024, 1024, 1024, 1024, 1024]
    - [22, 12204.0]
  - - [480, 6912, 1, 1024, 480, 480, 480, 1024]
    - [22, 11196.0]
  - - [256, 55296, 1, 128, 256, 256, 256, 128]
    - [0, 11576.0]
  - - [512, 55296, 1, 256, 512, 512, 512, 256]
    - [25, 12185.0]
  - - [1920, 2048, 1, 2048, 1920, 1920, 1920, 2048]
    - [8, 12323.0]
  - - [2880, 3072, 1, 3072, 2880, 2880, 2880, 3072]
    - [1, 12113.0]
  - - [3840, 4096, 1, 4096, 3840, 3840, 3840, 4096]
    - [1, 12625.0]
  - - [7680, 8192, 1, 8192, 7680, 7680, 7680, 8192]
    - [4, 12580.0]
  - - [2048, 2048, 1, 2048, 2048, 2048, 2048, 2048]
    - [1, 12154.0]
  - - [3072, 3072, 1, 3072, 3072, 3072, 3072, 3072]
    - [1, 12472.0]
  - - [4096, 4096, 1, 4096, 4096, 4096, 4096, 4096]
    - [8, 12468.0]
  - - [8192, 8192, 1, 8192, 8192, 8192, 8192, 8192]
    - [11, 12573.0]
  - - [1152, 1152, 1, 1152, 1152, 1152, 1152, 1152]
    - [15, 10200.0]
  - - [1536, 1536, 1, 1536, 1536, 1536, 1536, 1536]
    - [28, 11148.0]
  - - [1920, 1920, 1, 1920, 1920, 1920, 1920, 1920]
    - [16, 11645.0]
  - - [2304, 2304, 1, 2304, 2304, 2304, 2304, 2304]
    - [1, 11947.0]
  - - [2688, 2688, 1, 2688, 2688, 2688, 2688, 2688]
    - [16, 12091.0]
  - - [3456, 3456, 1, 3456, 3456, 3456, 3456, 3456]
    - [16, 12461.0]
  - - [3840, 3840, 1, 3840, 3840, 3840, 3840, 3840]
    - [22, 12569.0]
  - - [4224, 4224, 1, 4224, 4224, 4224, 4224, 4224]
    - [1, 12560.0]
  - - [4608, 4608, 1, 4608, 4608, 4608, 4608, 4608]
    - [1, 12616.0]
  - - [4992, 4992, 1, 4992, 4992, 4992, 4992, 4992]
    - [29, 12475.0]
  - - [5376, 5376, 1, 5376, 5376, 5376, 5376, 5376]
    - [36, 12475.0]
  - - [5760, 5760, 1, 5760, 5760, 5760, 5760, 5760]
    - [29, 12529.0]
  - - [6144, 6144, 1, 6144, 6144, 6144, 6144, 6144]
    - [27, 12440.0]
  - - [6528, 6528, 1, 6528, 6528, 6528, 6528, 6528]
    - [16, 12436.0]
  - - [6912, 6912, 1, 6912, 6912, 6912, 6912, 6912]
    - [16, 12502.0]
  - - [7296, 7296, 1, 7296, 7296, 7296, 7296, 7296]
    - [16, 12306.0]
  - - [7680, 7680, 1, 7680, 7680, 7680, 7680, 7680]
    - [39, 12260.0]
  - - [1152, 1152, 1, 384, 1152, 1152, 1152, 384]
    - [15, 8623.0]
  - - [1536, 1536, 1, 384, 1536, 1536, 1536, 384]
    - [28, 10503.0]
  - - [1920, 1920, 1, 384, 1920, 1920, 1920, 384]
    - [16, 11287.0]
  - - [2304, 2304, 1, 384, 2304, 2304, 2304, 384]
    - [16, 11565.0]
  - - [2688, 2688, 1, 384, 2688, 2688, 2688, 384]
    - [16, 11797.0]
  - - [3072, 3072, 1, 384, 3072, 3072, 3072, 384]
    - [1, 12123.0]
  - - [3456, 3456, 1, 384, 3456, 3456, 3456, 384]
    - [1, 12214.0]
  - - [3840, 3840, 1, 384, 3840, 3840, 3840, 384]
    - [1, 12402.0]
  - - [4224, 4224, 1, 384, 4224, 4224, 4224, 384]
    - [16, 12385.0]
  - - [4608, 4608, 1, 384, 4608, 4608, 4608, 384]
    - [1, 12460.0]
  - - [4992, 4992, 1, 384, 4992, 4992, 4992, 384]
    - [16, 12407.0]
  - - [5376, 5376, 1, 384, 5376, 5376, 5376, 384]
    - [16, 12430.0]
  - - [5760, 5760, 1, 384, 5760, 5760, 5760, 384]
    - [16, 12479.0]
  - - [6144, 6144, 1, 384, 6144, 6144, 6144, 384]
    - [1, 12481.0]
  - - [6528, 6528, 1, 384, 6528, 6528, 6528, 384]
    - [1, 12509.0]
  - - [6912, 6912, 1, 384, 6912, 6912, 6912, 384]
    - [16, 12549.0]
  - - [7296, 7296, 1, 384, 7296, 7296, 7296, 384]
    - [16, 12569.0]
  - - [7680, 7680, 1, 384, 7680, 7680, 7680, 384]
    - [1, 12567.0]
  - - [8064, 8064, 1, 384, 8064, 8064, 8064, 384]
    - [16, 12578.0]
  - - [8448, 8448, 1, 384, 8448, 8448, 8448, 384]
    - [16, 12579.0]
  - - [8832, 8832, 1, 384, 8832, 8832, 8832, 384]
    - [16, 12591.0]
  - - [9216, 9216, 1, 384, 9216, 9216, 9216, 384]
    - [22, 12568.0]
  - - [9600, 9600, 1, 384, 9600, 9600, 9600, 384]
    - [16, 12580.0]
  - - [9984, 9984, 1, 384, 9984, 9984, 9984, 384]
    - [16, 12576.0]
  - - [10368, 10368, 1, 384, 10368, 10368, 10368, 384]
    - [16, 12598.0]
  - - [10752, 10752, 1, 384, 10752, 10752, 10752, 384]
    - [16, 12580.0]
  - - [11136, 11136, 1, 384, 11136, 11136, 11136, 384]
    - [16, 12598.0]
  - - [11520, 11520, 1, 384, 11520, 11520, 11520, 384]
    - [16, 12582.0]
  - - [11904, 11904, 1, 384, 11904, 11904, 11904, 384]
    - [16, 12599.0]
  - - [12288, 12288, 1, 384, 12288, 12288, 12288, 384]
    - [1, 12581.0]
  - - [12672, 12672, 1, 384, 12672, 12672, 12672, 384]
    - [16, 12604.0]
  - - [13056, 13056, 1, 384, 13056, 13056, 13056, 384]
    - [16, 12595.0]
  - - [13440, 13440, 1, 384, 13440, 13440, 13440, 384]
    - [1, 12601.0]
  - - [13824, 13824, 1, 384, 13824, 13824, 13824, 384]
    - [1, 12590.0]
  - - [14208, 14208, 1, 384, 14208, 14208, 14208, 384]
    - [16, 12610.0]
  - - [14592, 14592, 1, 384, 14592, 14592, 14592, 384]
    - [16, 12595.0]
  - - [14976, 14976, 1, 384, 14976, 14976, 14976, 384]
    - [16, 12613.0]
  - - [15360, 15360, 1, 384, 15360, 15360, 15360, 384]
    - [22, 12598.0]
  - - [15744, 15744, 1, 384, 15744, 15744, 15744, 384]
    - [16, 12615.0]
  - - [16128, 16128, 1, 384, 16128, 16128, 16128, 384]
    - [16, 12595.0]
  - - [16512, 16512, 1, 384, 16512, 16512, 16512, 384]
    - [16, 12613.0]
  - - [16896, 16896, 1, 384, 16896, 16896, 16896, 384]
    - [16, 12602.0]
  - - [17280, 17280, 1, 384, 17280, 17280, 17280, 384]
    - [16, 12616.0]
  - - [17664, 17664, 1, 384, 17664, 17664, 17664, 384]
    - [1, 12436.0]
  - - [18048, 18048, 1, 384, 18048, 18048, 18048, 384]
    - [1, 12461.0]
  - - [18432, 18432, 1, 384, 18432, 18432, 18432, 384]
    - [1, 12451.0]
  - - [18816, 18816, 1, 384, 18816, 18816, 18816, 384]
    - [16, 12475.0]
  - - [19200, 19200, 1, 384, 19200, 19200, 19200, 384]
    - [1, 12462.0]
  - - [19584, 19584, 1, 384, 19584, 19584, 19584, 384]
    - [1, 12613.0]
  - - [19968, 19968, 1, 384, 19968, 19968, 19968, 384]
    - [1, 12474.0]
  - - [20352, 20352, 1, 384, 20352, 20352, 20352, 384]
    - [16, 12503.0]
  - - [20736, 20736, 1, 384, 20736, 20736, 20736, 384]
    - [1, 12486.0]
  - - [21120, 21120, 1, 384, 21120, 21120, 21120, 384]
    - [1, 12503.0]
  - - [21504, 21504, 1, 384, 21504, 21504, 21504, 384]
    - [1, 12494.0]
  - - [21888, 21888, 1, 384, 21888, 21888, 21888, 384]
    - [16, 12502.0]
  - - [22272, 22272, 1, 384, 22272, 22272, 22272, 384]
    - [1, 12503.0]
  - - [22656, 22656, 1, 384, 22656, 22656, 22656, 384]
    - [1, 12516.0]
  - - [23040, 23040, 1, 384, 23040, 23040, 23040, 384]
    - [1, 12506.0]
  - - [8192, 1024, 1, 1024, 8192, 8192, 8192, 1024]
    - [1, 12237.0]
  - - [8192, 4096, 1, 1024, 8192, 8192, 8192, 1024]
    - [1, 12496.0]
  - - [16384, 16384, 1, 16384, 16384, 16384, 16384, 16384]
    - [12, 11904.0]
  - - [1444, 256, 120, 128, 1444, 1444, 1444, 128]
    - [4, 10722.0]
  - - [1444, 256, 139, 128, 1444, 1444, 1444, 128]
    - [0, 10763.0]
  - - [1444, 256, 160, 128, 1444, 1444, 1444, 128]
    - [0, 10784.0]
  - - [1444, 256, 18, 128, 1444, 1444, 1444, 128]
    - [28, 10479.0]
  - - [1444, 256, 19, 128, 1444, 1444, 1444, 128]
    - [15, 10642.0]
  - - [1444, 256, 120, 256, 1444, 1444, 1444, 256]
    - [19, 11463.0]
  - - [1444, 256, 139, 256, 1444, 1444, 1444, 256]
    - [4, 11493.0]
  - - [1444, 256, 160, 256, 1444, 1444, 1444, 256]
    - [32, 11493.0]
  - - [1444, 256, 18, 256, 1444, 1444, 1444, 256]
    - [1, 10947.0]
  - - [1444, 256, 19, 256, 1444, 1444, 1444, 256]
    - [1, 11140.0]
  - - [361, 256, 120, 512, 361, 361, 361, 512]
    - [11, 10979.0]
  - - [361, 256, 139, 512, 361, 361, 361, 512]
    - [25, 11114.0]
  - - [361, 256, 160, 512, 361, 361, 361, 512]
    - [39, 11204.0]
  - - [361, 256, 18, 512, 361, 361, 361, 512]
    - [35, 10115.0]
  - - [361, 256, 19, 512, 361, 361, 361, 512]
    - [36, 9901.0]
  - - [173280, 128, 1, 64, 173280, 173280, 173280, 64]
    - [8, 7894.0]
  - - [200716, 128, 1, 64, 200716, 200716, 200716, 64]
    - [31, 6645.0]
  - - [231040, 128, 1, 64, 231040, 231040, 231040, 64]
    - [18, 7949.0]
  - - [25992, 128, 1, 64, 25992, 25992, 25992, 64]
    - [15, 8510.0]
  - - [27436, 128, 1, 64, 27436, 27436, 27436, 64]
    - [15, 9452.0]
  - - [8192, 7680, 1, 8192, 8192, 8192, 8192, 8192]
    - [4, 12249.0]
  - - [4096, 3840, 1, 4096, 4096, 4096, 4096, 4096]
    - [1, 12575.0]
  - - [2048, 1920, 1, 2048, 2048, 2048, 2048, 2048]
    - [8, 12201.0]
  - - [1024, 1280, 1, 2, 1024, 1024, 1024, 2]
    - [3, 314.0]
  - - [1024, 1280, 1, 4096, 1024, 1024, 1024, 4096]
    - [6, 11871.0]
  - - [4096, 1280, 1, 1024, 4096, 4096, 4096, 1024]
    - [8, 12206.0]
  - - [1024, 4992, 1, 2, 1024, 1024, 1024, 2]
    - [2, 366.0]
  - - [1024, 4992, 1, 4096, 1024, 1024, 1024, 4096]
    - [25, 11992.0]
  - - [4096, 4992, 1, 1024, 4096, 4096, 4096, 1024]
    - [1, 12358.0]
  - - [1024, 5120, 1, 2, 1024, 1024, 1024, 2]
    - [9, 367.0]
  - - [1024, 5120, 1, 1024, 1024, 1024, 1024, 1024]
    - [8, 12136.0]
  - - [1024, 5120, 1, 4096, 1024, 1024, 1024, 4096]
    - [25, 12258.0]
  - - [4096, 5120, 1, 1024, 4096, 4096, 4096, 1024]
    - [4, 12422.0]
  - - [1024, 5248, 1, 2, 1024, 1024, 1024, 2]
    - [14, 351.0]
  - - [1024, 5248, 1, 1024, 1024, 1024, 1024, 1024]
    - [8, 11742.0]
  - - [1024, 5248, 1, 4096, 1024, 1024, 1024, 4096]
    - [22, 11959.0]
  - - [4096, 5248, 1, 1024, 4096, 4096, 4096, 1024]
    - [1, 12544.0]
  - - [1024, 2560, 1, 2, 1024, 1024, 1024, 2]
    - [0, 488.0]
  - - [1024, 2560, 1, 4096, 1024, 1024, 1024, 4096]
    - [6, 12223.0]
  - - [4096, 2560, 1, 1024, 4096, 4096, 4096, 1024]
    - [1, 12434.0]
  - - [1024, 1152, 1, 2, 1024, 1024, 1024, 2]
    - [35, 324.0]
  - - [1024, 1152, 1, 4096, 1024, 1024, 1024, 4096]
    - [6, 10551.0]
  - - [4096, 1152, 1, 1024, 4096, 4096, 4096, 1024]
    - [1, 11751.0]
  - - [1024, 8192, 1, 1024, 1024, 1024, 1024, 1024]
    - [8, 12181.0]
  - - [1024, 8192, 1, 4096, 1024, 1024, 1024, 4096]
    - [25, 12166.0]
  - - [1024, 8192, 1, 33712, 1024, 1024, 1024, 33712]
    - [1, 12234.0]
  - - [1024, 9600, 1, 1024, 1024, 1024, 1024, 1024]
    - [22, 12347.0]
  - - [1024, 9600, 1, 4096, 1024, 1024, 1024, 4096]
    - [25, 12411.0]
  - - [1024, 9600, 1, 33712, 1024, 1024, 1024, 33712]
    - [16, 12462.0]
  - - [4096, 8192, 1, 1024, 4096, 4096, 4096, 1024]
    - [4, 12445.0]
  - - [4096, 9600, 1, 1024, 4096, 4096, 4096, 1024]
    - [4, 12499.0]
  - - [1024, 10064, 1, 1024, 1024, 1024, 1024, 1024]
    - [8, 12176.0]
  - - [1024, 10064, 1, 4096, 1024, 1024, 1024, 4096]
    - [11, 12242.0]
  - - [1024, 10080, 1, 4096, 1024, 1024, 1024, 4096]
    - [36, 12312.0]
  - - [1024, 10080, 1, 42720, 1024, 1024, 1024, 42720]
    - [16, 12194.0]
  - - [1024, 6528, 1, 1024, 1024, 1024, 1024, 1024]
    - [4, 11898.0]
  - - [1024, 6528, 1, 4096, 1024, 1024, 1024, 4096]
    - [25, 11967.0]
  - - [1024, 6528, 1, 42720, 1024, 1024, 1024, 42720]
    - [16, 12034.0]
  - - [1024, 7104, 1, 1024, 1024, 1024, 1024, 1024]
    - [22, 11818.0]
  - - [1024, 7104, 1, 4096, 1024, 1024, 1024, 4096]
    - [25, 11944.0]
  - - [1024, 7104, 1, 42720, 1024, 1024, 1024, 42720]
    - [16, 11976.0]
  - - [1024, 8064, 1, 1024, 1024, 1024, 1024, 1024]
    - [8, 12011.0]
  - - [1024, 8064, 1, 4096, 1024, 1024, 1024, 4096]
    - [25, 12039.0]
  - - [1024, 9216, 1, 1024, 1024, 1024, 1024, 1024]
    - [8, 12273.0]
  - - [1024, 9216, 1, 4096, 1024, 1024, 1024, 4096]
    - [25, 12332.0]
  - - [4096, 10064, 1, 1024, 4096, 4096, 4096, 1024]
    - [1, 12460.0]
  - - [4096, 10080, 1, 1024, 4096, 4096, 4096, 1024]
    - [1, 12478.0]
  - - [4096, 6528, 1, 1024, 4096, 4096, 4096, 1024]
    - [1, 12495.0]
  - - [4096, 7104, 1, 1024, 4096, 4096, 4096, 1024]
    - [1, 12402.0]
  - - [4096, 8064, 1, 1024, 4096, 4096, 4096, 1024]
    - [1, 12548.0]
  - - [4096, 9216, 1, 1024, 4096, 4096, 4096, 1024]
    - [1, 12504.0]
  - - [480, 32768, 1, 1024, 480, 480, 480, 1024]
    - [36, 11486.0]
  - - [2048, 960, 1, 2048, 2048, 2048, 2048, 2048]
    - [7, 11464.0]
  - - [2048, 1024, 1, 30592, 2048, 2048, 2048, 30592]
    - [18, 11082.0]
  - - [2048, 1024, 1, 6144, 2048, 2048, 2048, 6144]
    - [7, 11396.0]
  - - [2048, 1024, 1, 8192, 2048, 2048, 2048, 8192]
    - [7, 11296.0]
  - - [8192, 1024, 1, 2048, 8192, 8192, 8192, 2048]
    - [1, 12298.0]
  - - [1024, 8192, 1, 30592, 1024, 1024, 1024, 30592]
    - [6, 12204.0]
  - - [1024, 8192, 1, 3072, 1024, 1024, 1024, 3072]
    - [22, 12330.0]
  - - [512, 512, 256, 64, 512, 512, 512, 64]
    - [1, 9493.0]
  - - [1024, 2048, 1, 30592, 1024, 1024, 1024, 30592]
    - [4, 11087.0]
  - - [1024, 4096, 1, 30592, 1024, 1024, 1024, 30592]
    - [4, 11981.0]
  - - [512, 512, 128, 64, 512, 512, 512, 64]
    - [0, 9555.0]
  - - [2560, 2048, 1, 1920, 2560, 2560, 2560, 1920]
    - [1, 12453.0]
  - - [2560, 2048, 1, 2560, 2560, 2560, 2560, 2560]
    - [22, 12423.0]
  - - [2560, 2048, 1, 7680, 2560, 2560, 2560, 7680]
    - [27, 12415.0]
  - - [640, 2048, 1, 2560, 640, 640, 640, 2560]
    - [12, 11635.0]
  - - [512, 512, 40, 64, 512, 512, 512, 64]
    - [7, 10110.0]
  - - [1536, 4096, 1, 1536, 1536, 1536, 1536, 1536]
    - [22, 11983.0]
  - - [1536, 4096, 1, 4608, 1536, 1536, 1536, 4608]
    - [27, 11953.0]
  - - [1536, 4096, 1, 50304, 1536, 1536, 1536, 50304]
    - [20, 11925.0]
  - - [1536, 4096, 1, 6144, 1536, 1536, 1536, 6144]
    - [41, 11932.0]
  - - [6144, 4096, 1, 1536, 6144, 6144, 6144, 1536]
    - [1, 12595.0]
  - - [1024, 1024, 64, 96, 1024, 1024, 1024, 96]
    - [11, 11499.0]
  - - [1536, 8192, 1, 1536, 1536, 1536, 1536, 1536]
    - [22, 12407.0]
  - - [1536, 8192, 1, 4608, 1536, 1536, 1536, 4608]
    - [1, 12431.0]
  - - [1536, 8192, 1, 50304, 1536, 1536, 1536, 50304]
    - [11, 12143.0]
  - - [1536, 8192, 1, 6144, 1536, 1536, 1536, 6144]
    - [36, 12412.0]
  - - [6144, 8192, 1, 1536, 6144, 6144, 6144, 1536]
    - [1, 12668.0]
  - - [1024, 1024, 128, 96, 1024, 1024, 1024, 96]
    - [11, 11571.0]
  - - [1024, 16384, 1, 1024, 1024, 1024, 1024, 1024]
    - [8, 12366.0]
  - - [1024, 16384, 1, 3072, 1024, 1024, 1024, 3072]
    - [8, 12444.0]
  - - [1024, 16384, 1, 4096, 1024, 1024, 1024, 4096]
    - [8, 12452.0]
  - - [1024, 16384, 1, 50304, 1024, 1024, 1024, 50304]
    - [4, 12306.0]
  - - [4096, 16384, 1, 1024, 4096, 4096, 4096, 1024]
    - [4, 12524.0]
  - - [1024, 1024, 256, 64, 1024, 1024, 1024, 64]
    - [10, 8929.0]
  - - [1024, 2048, 1, 50304, 1024, 1024, 1024, 50304]
    - [4, 11076.0]
  - - [1024, 1024, 32, 64, 1024, 1024, 1024, 64]
    - [0, 10179.0]
  - - [1024, 4096, 1, 50304, 1024, 1024, 1024, 50304]
    - [4, 12029.0]
  - - [1024, 1024, 64, 64, 1024, 1024, 1024, 64]
    - [10, 8922.0]
  - - [1024, 8192, 1, 50304, 1024, 1024, 1024, 50304]
    - [20, 12124.0]
  - - [1024, 1024, 128, 64, 1024, 1024, 1024, 64]
    - [24, 8925.0]
  - - [128, 128, 1024, 64, 128, 128, 128, 64]
    - [3, 5527.0]
  - - [1024, 8192, 1, 30528, 1024, 1024, 1024, 30528]
    - [1, 12205.0]
  - - [1024, 3456, 1, 1024, 1024, 1024, 1024, 1024]
    - [4, 11649.0]
  - - [1024, 3456, 1, 512, 1024, 1024, 1024, 512]
    - [4, 11597.0]
  - - [256, 6912, 1, 128, 256, 256, 256, 128]
    - [0, 9796.0]
  - - [480, 3456, 1, 1024, 480, 480, 480, 1024]
    - [21, 10358.0]
  - - [512, 3456, 1, 256, 512, 512, 512, 256]
    - [0, 9899.0]
  - - [1024, 1280, 1, 30528, 1024, 1024, 1024, 30528]
    - [34, 12107.0]
  - - [1024, 1600, 1, 30528, 1024, 1024, 1024, 30528]
    - [0, 11475.0]
  - - [1024, 10240, 1, 1024, 1024, 1024, 1024, 1024]
    - [8, 12467.0]
  - - [1024, 10240, 1, 4096, 1024, 1024, 1024, 4096]
    - [22, 12485.0]
  - - [4096, 10240, 1, 1024, 4096, 4096, 4096, 1024]
    - [1, 12646.0]
  - - [128, 128, 1280, 64, 128, 128, 128, 64]
    - [0, 6865.0]
  - - [1024, 1640, 1, 30528, 1024, 1024, 1024, 30528]
    - [0, 10751.0]
  - - [1024, 10496, 1, 1024, 1024, 1024, 1024, 1024]
    - [8, 12396.0]
  - - [1024, 10496, 1, 4096, 1024, 1024, 1024, 4096]
    - [8, 12442.0]
  - - [4096, 10496, 1, 1024, 4096, 4096, 4096, 1024]
    - [1, 12587.0]
  - - [128, 128, 1312, 64, 128, 128, 128, 64]
    - [0, 6875.0]
  - - [1024, 6144, 1, 4096, 1024, 1024, 1024, 4096]
    - [8, 12025.0]
  - - [4096, 6144, 1, 1024, 4096, 4096, 4096, 1024]
    - [1, 12581.0]
  - - [1024, 6144, 1, 1024, 1024, 1024, 1024, 1024]
    - [8, 11908.0]
  - - [512, 512, 192, 64, 512, 512, 512, 64]
    - [0, 8876.0]
  - - [256, 6912, 1, 1, 256, 256, 256, 1]
    - [37, 212.0]
  - - [3136, 128, 64, 64, 3136, 3136, 3136, 64]
    - [3, 7934.0]
  - - [3136, 256, 64, 128, 3136, 3136, 3136, 128]
    - [4, 11637.0]
  - - [784, 512, 64, 256, 784, 784, 784, 256]
    - [4, 10641.0]
  - - [3136, 128, 64, 256, 3136, 3136, 3136, 256]
    - [32, 11831.0]
  - - [3136, 256, 64, 256, 3136, 3136, 3136, 256]
    - [4, 12034.0]
  - - [196, 1024, 64, 512, 196, 196, 196, 512]
    - [11, 9171.0]
  - - [784, 256, 64, 512, 784, 784, 784, 512]
    - [4, 10658.0]
  - - [784, 512, 64, 512, 784, 784, 784, 512]
    - [19, 10788.0]
  - - [196, 512, 64, 1024, 196, 196, 196, 1024]
    - [39, 9155.0]
  - - [196, 1024, 64, 1024, 196, 196, 196, 1024]
    - [25, 9296.0]
  - - [3136, 128, 32, 64, 3136, 3136, 3136, 64]
    - [28, 10774.0]
  - - [3136, 256, 32, 128, 3136, 3136, 3136, 128]
    - [0, 11334.0]
  - - [784, 512, 32, 256, 784, 784, 784, 256]
    - [16, 10507.0]
  - - [3136, 128, 32, 256, 3136, 3136, 3136, 256]
    - [4, 11435.0]
  - - [3136, 256, 32, 256, 3136, 3136, 3136, 256]
    - [4, 11844.0]
  - - [196, 1024, 32, 512, 196, 196, 196, 512]
    - [25, 9032.0]
  - - [784, 256, 32, 512, 784, 784, 784, 512]
    - [36, 10380.0]
  - - [784, 512, 32, 512, 784, 784, 784, 512]
    - [4, 10663.0]
  - - [196, 512, 32, 1024, 196, 196, 196, 1024]
    - [11, 8982.0]
  - - [196, 1024, 32, 1024, 196, 196, 196, 1024]
    - [39, 9177.0]
  - - [1024, 10224, 1, 1024, 1024, 1024, 1024, 1024]
    - [22, 12408.0]
  - - [1024, 10192, 1, 1024, 1024, 1024, 1024, 1024]
    - [8, 12380.0]
  - - [1024, 10208, 1, 1024, 1024, 1024, 1024, 1024]
    - [22, 12405.0]
  - - [1024, 10224, 1, 4096, 1024, 1024, 1024, 4096]
    - [22, 12470.0]
  - - [1024, 10224, 1, 3072, 1024, 1024, 1024, 3072]
    - [22, 12456.0]
  - - [4096, 10224, 1, 1024, 4096, 4096, 4096, 1024]
    - [1, 12598.0]
  - - [1024, 10240, 1, 3072, 1024, 1024, 1024, 3072]
    - [8, 12476.0]
  - - [1024, 10192, 1, 3072, 1024, 1024, 1024, 3072]
    - [22, 12433.0]
  - - [4096, 10192, 1, 1024, 4096, 4096, 4096, 1024]
    - [1, 12554.0]
  - - [1024, 10192, 1, 4096, 1024, 1024, 1024, 4096]
    - [22, 12423.0]
  - - [1024, 10200, 1, 3072, 1024, 1024, 1024, 3072]
    - [8, 12417.0]
  - - [1024, 10184, 1, 1024, 1024, 1024, 1024, 1024]
    - [22, 12341.0]
  - - [4096, 10208, 1, 1024, 4096, 4096, 4096, 1024]
    - [1, 12578.0]
  - - [1024, 10208, 1, 3072, 1024, 1024, 1024, 3072]
    - [22, 12440.0]
  - - [1024, 10208, 1, 4096, 1024, 1024, 1024, 4096]
    - [22, 12456.0]
  - - [1024, 10224, 1, 2048, 1024, 1024, 1024, 2048]
    - [22, 12423.0]
  - - [1024, 10240, 1, 2048, 1024, 1024, 1024, 2048]
    - [22, 12462.0]
  - - [1024, 10120, 1, 1024, 1024, 1024, 1024, 1024]
    - [22, 12285.0]
  - - [1024, 10192, 1, 2048, 1024, 1024, 1024, 2048]
    - [8, 12390.0]
  - - [1024, 10152, 1, 1024, 1024, 1024, 1024, 1024]
    - [22, 12357.0]
  - - [1024, 10080, 1, 3072, 1024, 1024, 1024, 3072]
    - [22, 12314.0]
  - - [100352, 512, 1, 256, 100352, 100352, 100352, 256]
    - [32, 12361.0]
  - - [12544, 2048, 1, 1024, 12544, 12544, 12544, 1024]
    - [1, 12545.0]
  - - [200704, 512, 1, 256, 200704, 200704, 200704, 256]
    - [32, 12401.0]
  - - [25088, 1024, 1, 512, 25088, 25088, 25088, 512]
    - [1, 12427.0]
  - - [50176, 1024, 1, 512, 50176, 50176, 50176, 512]
    - [19, 12451.0]
  - - [6272, 2048, 1, 1024, 6272, 6272, 6272, 1024]
    - [1, 12325.0]
  - - [196, 1024, 128, 256, 196, 196, 196, 256]
    - [11, 9033.0]
  - - [196, 1024, 256, 256, 196, 196, 196, 256]
    - [11, 9129.0]
  - - [196, 256, 128, 1024, 196, 196, 196, 1024]
    - [39, 9096.0]
  - - [196, 256, 256, 1024, 196, 196, 196, 1024]
    - [39, 9227.0]
  - - [196, 512, 128, 1024, 196, 196, 196, 1024]
    - [39, 9257.0]
  - - [196, 512, 256, 1024, 196, 196, 196, 1024]
    - [11, 9398.0]
  - - [3136, 128, 128, 256, 3136, 3136, 3136, 256]
    - [32, 11982.0]
  - - [3136, 128, 256, 256, 3136, 3136, 3136, 256]
    - [32, 12071.0]
  - - [784, 256, 128, 512, 784, 784, 784, 512]
    - [4, 10774.0]
  - - [784, 256, 256, 512, 784, 784, 784, 512]
    - [4, 10843.0]
  - - [128, 128, 2048, 64, 128, 128, 128, 64]
    - [0, 6076.0]
  - - [1024, 2560, 1, 30528, 1024, 1024, 1024, 30528]
    - [20, 12350.0]
  - - [128, 128, 1536, 64, 128, 128, 128, 64]
    - [0, 6832.0]
  - - [1024, 12288, 1, 4096, 1024, 1024, 1024, 4096]
    - [22, 12390.0]
  - - [1024, 12288, 1, 1024, 1024, 1024, 1024, 1024]
    - [22, 12299.0]
  - - [4096, 12288, 1, 1024, 4096, 4096, 4096, 1024]
    - [1, 12613.0]
  - - [1024, 1920, 1, 30528, 1024, 1024, 1024, 30528]
    - [8, 11975.0]
  - - [128, 128, 192, 64, 128, 128, 128, 64]
    - [17, 8626.0]
  - - [384, 384, 144, 64, 384, 384, 384, 64]
    - [0, 11270.0]
  - - [768, 4608, 1, 2, 768, 768, 768, 2]
    - [30, 493.0]
  - - [3072, 4608, 1, 768, 3072, 3072, 3072, 768]
    - [1, 12322.0]
  - - [768, 4608, 1, 3072, 768, 768, 768, 3072]
    - [8, 12039.0]
  - - [768, 4608, 1, 768, 768, 768, 768, 768]
    - [1, 11791.0]
  - - [512, 512, 48, 64, 512, 512, 512, 64]
    - [28, 10868.0]
  - - [128, 128, 256, 64, 128, 128, 128, 64]
    - [33, 9412.0]
  - - [384, 384, 192, 64, 384, 384, 384, 64]
    - [0, 11369.0]
  - - [1024, 4608, 1, 2, 1024, 1024, 1024, 2]
    - [20, 488.0]
  - - [4096, 4608, 1, 1024, 4096, 4096, 4096, 1024]
    - [1, 12523.0]
  - - [1024, 4608, 1, 4096, 1024, 1024, 1024, 4096]
    - [22, 11967.0]
  - - [1024, 4608, 1, 1024, 1024, 1024, 1024, 1024]
    - [8, 11693.0]
  - - [3072, 256, 2, 1024, 3072, 3072, 3072, 1024]
    - [1, 11054.0]
  - - [2852, 256, 2, 1024, 2852, 2852, 2852, 1024]
    - [1, 10209.0]
  - - [3220, 256, 2, 1024, 3220, 3220, 3220, 1024]
    - [15, 10082.0]
  - - [850, 2048, 2, 512, 850, 850, 850, 512]
    - [15, 10384.0]
  - - [768, 2048, 2, 512, 768, 768, 768, 512]
    - [4, 10922.0]
  - - [2904, 256, 2, 1024, 2904, 2904, 2904, 1024]
    - [30, 9976.0]
  - - [805, 2048, 2, 512, 805, 805, 805, 512]
    - [21, 10072.0]
  - - [864, 2048, 2, 512, 864, 864, 864, 512]
    - [0, 10849.0]
  - - [2992, 256, 2, 1024, 2992, 2992, 2992, 1024]
    - [1, 10744.0]
  - - [3400, 256, 2, 1024, 3400, 3400, 3400, 1024]
    - [15, 10598.0]
  - - [4032, 256, 2, 1024, 4032, 4032, 4032, 1024]
    - [7, 11016.0]
  - - [15200, 128, 2, 512, 15200, 15200, 15200, 512]
    - [29, 11539.0]
  - - [12288, 128, 2, 512, 12288, 12288, 12288, 512]
    - [1, 11428.0]
  - - [888, 2048, 2, 512, 888, 888, 888, 512]
    - [15, 11118.0]
  - - [13600, 128, 2, 512, 13600, 13600, 13600, 512]
    - [22, 11304.0]
  - - [12880, 128, 2, 512, 12880, 12880, 12880, 512]
    - [15, 10961.0]
  - - [3456, 256, 2, 1024, 3456, 3456, 3456, 1024]
    - [28, 11167.0]
  - - [2944, 256, 2, 1024, 2944, 2944, 2944, 1024]
    - [4, 10340.0]
  - - [2688, 256, 2, 1024, 2688, 2688, 2688, 1024]
    - [15, 10226.0]
  - - [13824, 128, 2, 512, 13824, 13824, 13824, 512]
    - [19, 11322.0]
  - - [3036, 256, 2, 1024, 3036, 3036, 3036, 1024]
    - [25, 10428.0]
  - - [3168, 256, 2, 1024, 3168, 3168, 3168, 1024]
    - [19, 10846.0]
  - - [3360, 256, 2, 1024, 3360, 3360, 3360, 1024]
    - [28, 10491.0]
  - - [3552, 256, 2, 1024, 3552, 3552, 3552, 1024]
    - [8, 10398.0]
  - - [11616, 128, 2, 512, 11616, 11616, 11616, 512]
    - [28, 10592.0]
  - - [4200, 256, 2, 1024, 4200, 4200, 4200, 1024]
    - [22, 10613.0]
  - - [840, 2048, 2, 512, 840, 840, 840, 512]
    - [15, 10316.0]
  - - [14208, 128, 2, 512, 14208, 14208, 14208, 512]
    - [28, 11169.0]
  - - [11968, 128, 2, 512, 11968, 11968, 11968, 512]
    - [15, 11135.0]
  - - [3264, 256, 2, 1024, 3264, 3264, 3264, 1024]
    - [15, 10442.0]
  - - [713, 2048, 2, 512, 713, 713, 713, 512]
    - [0, 9987.0]
  - - [13600, 256, 2, 512, 13600, 13600, 13600, 512]
    - [4, 11576.0]
  - - [12880, 256, 2, 512, 12880, 12880, 12880, 512]
    - [1, 11489.0]
  - - [12288, 256, 2, 512, 12288, 12288, 12288, 512]
    - [1, 11729.0]
  - - [2816, 256, 2, 1024, 2816, 2816, 2816, 1024]
    - [28, 10891.0]
  - - [850, 2048, 1, 512, 850, 850, 850, 512]
    - [15, 9545.0]
  - - [660, 2048, 2, 512, 660, 660, 660, 512]
    - [4, 9336.0]
  - - [672, 2048, 2, 512, 672, 672, 672, 512]
    - [4, 9497.0]
  - - [13440, 128, 2, 512, 13440, 13440, 13440, 512]
    - [28, 11233.0]
  - - [726, 2048, 2, 512, 726, 726, 726, 512]
    - [4, 10206.0]
  - - [3500, 256, 2, 1024, 3500, 3500, 3500, 1024]
    - [4, 10325.0]
  - - [13824, 256, 2, 512, 13824, 13824, 13824, 512]
    - [4, 11944.0]
  - - [15200, 256, 2, 512, 15200, 15200, 15200, 512]
    - [32, 11866.0]
  - - [3700, 256, 2, 1024, 3700, 3700, 3700, 1024]
    - [1, 11176.0]
  - - [748, 2048, 2, 512, 748, 748, 748, 512]
    - [22, 10859.0]
  - - [3600, 256, 2, 1024, 3600, 3600, 3600, 1024]
    - [8, 10866.0]
  - - [4032, 1024, 2, 256, 4032, 4032, 4032, 256]
    - [8, 11624.0]
  - - [16128, 128, 2, 512, 16128, 16128, 16128, 512]
    - [11, 11511.0]
  - - [15200, 128, 1, 512, 15200, 15200, 15200, 512]
    - [8, 10861.0]
  - - [13600, 128, 1, 512, 13600, 13600, 13600, 512]
    - [28, 10585.0]
  - - [2904, 1024, 2, 256, 2904, 2904, 2904, 256]
    - [16, 10928.0]
  - - [2992, 1024, 2, 256, 2992, 2992, 2992, 256]
    - [35, 10762.0]
  - - [1536, 2048, 1, 1024, 1536, 1536, 1536, 1024]
    - [4, 11288.0]
  - - [24576, 128, 1, 256, 24576, 24576, 24576, 256]
    - [5, 10641.0]
  - - [24576, 512, 1, 256, 24576, 24576, 24576, 256]
    - [4, 11914.0]
  - - [25760, 128, 1, 256, 25760, 25760, 25760, 256]
    - [0, 10565.0]
  - - [25760, 512, 1, 256, 25760, 25760, 25760, 256]
    - [36, 11823.0]
  - - [6144, 256, 1, 512, 6144, 6144, 6144, 512]
    - [8, 10960.0]
  - - [6440, 256, 1, 512, 6440, 6440, 6440, 512]
    - [28, 10080.0]
  - - [3036, 1024, 2, 256, 3036, 3036, 3036, 256]
    - [1, 11265.0]
  - - [13600, 512, 1, 128, 13600, 13600, 13600, 128]
    - [35, 10995.0]
  - - [9408, 512, 2, 128, 9408, 9408, 9408, 128]
    - [7, 11229.0]
  - - [56000, 256, 2, 64, 56000, 56000, 56000, 64]
    - [8, 8556.0]
  - - [2852, 1024, 2, 256, 2852, 2852, 2852, 256]
    - [8, 11117.0]
  - - [2816, 1024, 2, 256, 2816, 2816, 2816, 256]
    - [8, 11690.0]
  - - [60800, 256, 1, 64, 60800, 60800, 60800, 64]
    - [28, 11377.0]
  - - [2944, 1024, 2, 256, 2944, 2944, 2944, 256]
    - [36, 11663.0]
  - - [11776, 512, 2, 128, 11776, 11776, 11776, 128]
    - [8, 11731.0]
  - - [11616, 512, 2, 128, 11616, 11616, 11616, 128]
    - [0, 11496.0]
  - - [4200, 1024, 2, 256, 4200, 4200, 4200, 256]
    - [8, 11723.0]
  - - [54400, 256, 1, 64, 54400, 54400, 54400, 64]
    - [28, 11357.0]
  - - [15200, 512, 1, 128, 15200, 15200, 15200, 128]
    - [35, 11185.0]
  - - [2688, 1024, 2, 256, 2688, 2688, 2688, 256]
    - [1, 11841.0]
  - - [12672, 512, 2, 128, 12672, 12672, 12672, 128]
    - [22, 11823.0]
  - - [11968, 512, 2, 128, 11968, 11968, 11968, 128]
    - [1, 11606.0]
  - - [46464, 256, 2, 64, 46464, 46464, 46464, 64]
    - [0, 11345.0]
  - - [2400, 256, 2, 1024, 2400, 2400, 2400, 1024]
    - [37, 10572.0]
  - - [2520, 256, 2, 1024, 2520, 2520, 2520, 1024]
    - [20, 11250.0]
  - - [2400, 1024, 2, 256, 2400, 2400, 2400, 256]
    - [8, 11151.0]
  - - [10752, 128, 2, 512, 10752, 10752, 10752, 512]
    - [28, 11258.0]
  - - [45632, 256, 2, 64, 45632, 45632, 45632, 64]
    - [15, 10980.0]
  - - [2520, 1024, 2, 256, 2520, 2520, 2520, 256]
    - [8, 11388.0]
  - - [53760, 256, 2, 64, 53760, 53760, 53760, 64]
    - [0, 11353.0]
  - - [2352, 256, 2, 1024, 2352, 2352, 2352, 1024]
    - [30, 10422.0]
  - - [47872, 256, 2, 64, 47872, 47872, 47872, 64]
    - [15, 10548.0]
  - - [47104, 256, 2, 64, 47104, 47104, 47104, 64]
    - [15, 10351.0]
  - - [50688, 256, 2, 64, 50688, 50688, 50688, 64]
    - [0, 9511.0]
  - - [45056, 256, 2, 64, 45056, 45056, 45056, 64]
    - [15, 10865.0]
  - - [13440, 512, 2, 128, 13440, 13440, 13440, 128]
    - [8, 11802.0]
  - - [2352, 1024, 2, 256, 2352, 2352, 2352, 256]
    - [0, 10924.0]
  - - [11264, 512, 2, 128, 11264, 11264, 11264, 128]
    - [15, 11434.0]
  - - [10560, 128, 2, 512, 10560, 10560, 10560, 512]
    - [7, 11011.0]
  - - [16128, 512, 2, 128, 16128, 16128, 16128, 128]
    - [29, 11823.0]
  - - [37632, 256, 2, 64, 37632, 37632, 37632, 64]
    - [15, 11344.0]
  - - [51520, 256, 2, 64, 51520, 51520, 51520, 64]
    - [0, 11235.0]
  - - [14000, 512, 2, 128, 14000, 14000, 14000, 128]
    - [16, 11694.0]
  - - [10560, 512, 2, 128, 10560, 10560, 10560, 128]
    - [36, 11310.0]
  - - [64512, 256, 2, 64, 64512, 64512, 64512, 64]
    - [0, 11201.0]
  - - [54400, 256, 2, 64, 54400, 54400, 54400, 64]
    - [8, 8742.0]
  - - [3264, 1024, 2, 256, 3264, 3264, 3264, 256]
    - [1, 11566.0]
  - - [10752, 512, 2, 128, 10752, 10752, 10752, 128]
    - [8, 11672.0]
  - - [3168, 1024, 2, 256, 3168, 3168, 3168, 256]
    - [1, 11817.0]
  - - [950, 2048, 1, 512, 950, 950, 950, 512]
    - [15, 10327.0]
  - - [55296, 256, 2, 256, 55296, 55296, 55296, 256]
    - [19, 12207.0]
  - - [51520, 256, 2, 256, 51520, 51520, 51520, 256]
    - [4, 12088.0]
  - - [11408, 128, 2, 512, 11408, 11408, 11408, 512]
    - [16, 11388.0]
  - - [60800, 256, 2, 256, 60800, 60800, 60800, 256]
    - [32, 12312.0]
  - - [54400, 256, 2, 256, 54400, 54400, 54400, 256]
    - [19, 12299.0]
  - - [3700, 1024, 2, 256, 3700, 3700, 3700, 256]
    - [36, 11454.0]
  - - [60800, 256, 2, 64, 60800, 60800, 60800, 64]
    - [0, 11070.0]
  - - [3800, 1024, 1, 256, 3800, 3800, 3800, 256]
    - [1, 11287.0]
  - - [3400, 1024, 1, 256, 3400, 3400, 3400, 256]
    - [1, 11147.0]
  - - [3072, 1024, 2, 256, 3072, 3072, 3072, 256]
    - [4, 11447.0]
  - - [3600, 1024, 2, 256, 3600, 3600, 3600, 256]
    - [36, 11264.0]
  - - [12288, 512, 2, 128, 12288, 12288, 12288, 128]
    - [21, 11450.0]
  - - [49152, 256, 2, 256, 49152, 49152, 49152, 256]
    - [25, 12023.0]
  - - [12880, 512, 2, 128, 12880, 12880, 12880, 128]
    - [28, 11418.0]
  - - [11408, 512, 2, 128, 11408, 11408, 11408, 128]
    - [29, 11638.0]
  - - [42240, 256, 2, 64, 42240, 42240, 42240, 64]
    - [15, 11342.0]
  - - [1008, 2048, 2, 512, 1008, 1008, 1008, 512]
    - [1, 11567.0]
  - - [3360, 1024, 2, 256, 3360, 3360, 3360, 256]
    - [1, 11401.0]
  - - [14208, 512, 2, 128, 14208, 14208, 14208, 128]
    - [22, 11732.0]
  - - [56832, 256, 2, 64, 56832, 56832, 56832, 64]
    - [0, 9429.0]
  - - [43008, 256, 2, 64, 43008, 43008, 43008, 64]
    - [15, 11181.0]
  - - [13600, 512, 2, 128, 13600, 13600, 13600, 128]
    - [1, 11712.0]
  - - [3500, 1024, 2, 256, 3500, 3500, 3500, 256]
    - [1, 11369.0]
  - - [2640, 1024, 2, 256, 2640, 2640, 2640, 256]
    - [8, 11542.0]
  - - [13824, 512, 2, 128, 13824, 13824, 13824, 128]
    - [22, 11763.0]
  - - [3800, 256, 2, 1024, 3800, 3800, 3800, 1024]
    - [1, 11433.0]
  - - [55296, 256, 2, 64, 55296, 55296, 55296, 64]
    - [0, 10276.0]
  - - [2640, 256, 2, 1024, 2640, 2640, 2640, 1024]
    - [15, 10194.0]
  - - [15200, 512, 2, 128, 15200, 15200, 15200, 128]
    - [36, 11662.0]
  - - [3552, 1024, 2, 256, 3552, 3552, 3552, 256]
    - [8, 11657.0]
  - - [3220, 1024, 2, 256, 3220, 3220, 3220, 256]
    - [1, 11379.0]
  - - [3456, 1024, 2, 256, 3456, 3456, 3456, 256]
    - [1, 11910.0]
  - - [49152, 256, 2, 64, 49152, 49152, 49152, 64]
    - [0, 9654.0]
  - - [3400, 1024, 2, 256, 3400, 3400, 3400, 256]
    - [8, 11480.0]
  - - [950, 2048, 2, 512, 950, 950, 950, 512]
    - [22, 10967.0]
  - - [3800, 1024, 2, 256, 3800, 3800, 3800, 256]
    - [16, 11780.0]
  - - [1610, 2048, 1, 1024, 1610, 1610, 1610, 1024]
    - [15, 11091.0]
  - - [6912, 256, 1, 512, 6912, 6912, 6912, 512]
    - [15, 11013.0]
  - - [6800, 256, 1, 512, 6800, 6800, 6800, 512]
    - [15, 10636.0]
  - - [27648, 128, 1, 256, 27648, 27648, 27648, 256]
    - [16, 11339.0]
  - - [27200, 128, 1, 256, 27200, 27200, 27200, 256]
    - [0, 10947.0]
  - - [30400, 128, 1, 256, 30400, 30400, 30400, 256]
    - [22, 11123.0]
  - - [7600, 256, 1, 512, 7600, 7600, 7600, 512]
    - [22, 10944.0]
  - - [6144, 1024, 1, 512, 6144, 6144, 6144, 512]
    - [1, 11770.0]
  - - [6912, 1024, 1, 512, 6912, 6912, 6912, 512]
    - [1, 12056.0]
  - - [6440, 1024, 1, 512, 6440, 6440, 6440, 512]
    - [36, 11658.0]
  - - [27648, 512, 1, 256, 27648, 27648, 27648, 256]
    - [8, 11976.0]
  - - [1728, 2048, 1, 1024, 1728, 1728, 1728, 1024]
    - [1, 10981.0]
  - - [27200, 512, 1, 256, 27200, 27200, 27200, 256]
    - [8, 11899.0]
  - - [6800, 1024, 1, 512, 6800, 6800, 6800, 512]
    - [36, 11719.0]
  - - [1700, 2048, 1, 1024, 1700, 1700, 1700, 1024]
    - [1, 10772.0]
  - - [7600, 1024, 1, 512, 7600, 7600, 7600, 512]
    - [1, 12161.0]
  - - [30400, 512, 1, 256, 30400, 30400, 30400, 256]
    - [16, 12035.0]
  - - [1900, 2048, 1, 1024, 1900, 1900, 1900, 1024]
    - [8, 12000.0]
  - - [12544, 1024, 1, 1024, 12544, 12544, 12544, 1024]
    - [1, 12307.0]
  - - [1024, 1024, 160, 96, 1024, 1024, 1024, 96]
    - [11, 11558.0]
  - - [1920, 16384, 1, 25216, 1920, 1920, 1920, 25216]
    - [16, 12461.0]
  - - [3840, 16384, 1, 1920, 3840, 3840, 3840, 1920]
    - [1, 12643.0]
  - - [1920, 16384, 1, 3840, 1920, 1920, 1920, 3840]
    - [25, 11891.0]
  - - [960, 16384, 1, 1920, 960, 960, 960, 1920]
    - [22, 11618.0]
  - - [1920, 16384, 1, 2880, 1920, 1920, 1920, 2880]
    - [16, 12688.0]
  - - [1024, 1024, 40, 96, 1024, 1024, 1024, 96]
    - [0, 11554.0]
  - - [1920, 4096, 1, 25216, 1920, 1920, 1920, 25216]
    - [16, 12376.0]
  - - [3840, 4096, 1, 1920, 3840, 3840, 3840, 1920]
    - [16, 12601.0]
  - - [1920, 4096, 1, 3840, 1920, 1920, 1920, 3840]
    - [19, 12399.0]
  - - [960, 4096, 1, 1920, 960, 960, 960, 1920]
    - [16, 11383.0]
  - - [1920, 4096, 1, 2880, 1920, 1920, 1920, 2880]
    - [16, 12578.0]
  - - [1024, 1024, 80, 96, 1024, 1024, 1024, 96]
    - [11, 11532.0]
  - - [1920, 8192, 1, 25216, 1920, 1920, 1920, 25216]
    - [39, 12258.0]
  - - [3840, 8192, 1, 1920, 3840, 3840, 3840, 1920]
    - [1, 12652.0]
  - - [1920, 8192, 1, 3840, 1920, 1920, 1920, 3840]
    - [19, 12494.0]
  - - [960, 8192, 1, 1920, 960, 960, 960, 1920]
    - [16, 11558.0]
  - - [1920, 8192, 1, 2880, 1920, 1920, 1920, 2880]
    - [16, 12650.0]
  - - [1024, 1024, 96, 96, 1024, 1024, 1024, 96]
    - [11, 11530.0]
  - - [2304, 16384, 1, 12672, 2304, 2304, 2304, 12672]
    - [16, 12333.0]
  - - [2304, 16384, 1, 2304, 2304, 2304, 2304, 2304]
    - [8, 12582.0]
  - - [576, 16384, 1, 2304, 576, 576, 576, 2304]
    - [36, 11165.0]
  - - [2304, 16384, 1, 1728, 2304, 2304, 2304, 1728]
    - [16, 12618.0]
  - - [1024, 1024, 24, 96, 1024, 1024, 1024, 96]
    - [15, 11525.0]
  - - [2304, 4096, 1, 12672, 2304, 2304, 2304, 12672]
    - [16, 12316.0]
  - - [2304, 4096, 1, 2304, 2304, 2304, 2304, 2304]
    - [1, 12466.0]
  - - [576, 4096, 1, 2304, 576, 576, 576, 2304]
    - [36, 10918.0]
  - - [2304, 4096, 1, 1728, 2304, 2304, 2304, 1728]
    - [29, 12496.0]
  - - [1024, 1024, 48, 96, 1024, 1024, 1024, 96]
    - [11, 11489.0]
  - - [2304, 8192, 1, 12672, 2304, 2304, 2304, 12672]
    - [16, 12364.0]
  - - [2304, 8192, 1, 2304, 2304, 2304, 2304, 2304]
    - [22, 12504.0]
  - - [576, 8192, 1, 2304, 576, 576, 576, 2304]
    - [36, 11081.0]
  - - [2304, 8192, 1, 1728, 2304, 2304, 2304, 1728]
    - [29, 12588.0]
  - - [1024, 1024, 16, 96, 1024, 1024, 1024, 96]
    - [15, 11529.0]
  - - [3072, 4096, 1, 6400, 3072, 3072, 3072, 6400]
    - [1, 12448.0]
  - - [1536, 4096, 1, 3072, 1536, 1536, 1536, 3072]
    - [22, 12010.0]
  - - [3072, 4096, 1, 1536, 3072, 3072, 3072, 1536]
    - [1, 12349.0]
  - - [384, 4096, 1, 3072, 384, 384, 384, 3072]
    - [8, 11264.0]
  - - [3072, 4096, 1, 1152, 3072, 3072, 3072, 1152]
    - [1, 12323.0]
  - - [1024, 1024, 32, 96, 1024, 1024, 1024, 96]
    - [11, 11311.0]
  - - [3072, 8192, 1, 6400, 3072, 3072, 3072, 6400]
    - [1, 12597.0]
  - - [1536, 8192, 1, 3072, 1536, 1536, 1536, 3072]
    - [25, 12286.0]
  - - [3072, 8192, 1, 1536, 3072, 3072, 3072, 1536]
    - [1, 12479.0]
  - - [384, 8192, 1, 3072, 384, 384, 384, 3072]
    - [41, 11694.0]
  - - [3072, 8192, 1, 1152, 3072, 3072, 3072, 1152]
    - [1, 12563.0]
  - - [2048, 4096, 1, 2048, 2048, 2048, 2048, 2048]
    - [8, 12319.0]
  - - [2048, 4096, 1, 4096, 2048, 2048, 2048, 4096]
    - [11, 12223.0]
  - - [4096, 4096, 1, 2048, 4096, 4096, 4096, 2048]
    - [8, 12361.0]
  - - [1024, 2283, 1, 29000, 1024, 1024, 1024, 29000]
    - [28, 11103.0]
  - - [1024, 2296, 1, 29000, 1024, 1024, 1024, 29000]
    - [28, 11147.0]
  - - [1024, 2306, 1, 29000, 1024, 1024, 1024, 29000]
    - [0, 11155.0]
  - - [1024, 2309, 1, 29000, 1024, 1024, 1024, 29000]
    - [0, 11188.0]
  - - [1024, 2318, 1, 29000, 1024, 1024, 1024, 29000]
    - [0, 11208.0]
  - - [1024, 2320, 1, 29000, 1024, 1024, 1024, 29000]
    - [28, 11216.0]
  - - [1024, 2324, 1, 29000, 1024, 1024, 1024, 29000]
    - [7, 11256.0]
  - - [1024, 2325, 1, 29000, 1024, 1024, 1024, 29000]
    - [0, 11272.0]
  - - [1024, 2329, 1, 29000, 1024, 1024, 1024, 29000]
    - [0, 11285.0]
  - - [1024, 2338, 1, 29000, 1024, 1024, 1024, 29000]
    - [0, 11324.0]
  - - [1024, 2345, 1, 29000, 1024, 1024, 1024, 29000]
    - [0, 11348.0]
  - - [1024, 2350, 1, 29000, 1024, 1024, 1024, 29000]
    - [0, 11365.0]
  - - [1024, 2362, 1, 29000, 1024, 1024, 1024, 29000]
    - [28, 11426.0]
  - - [1024, 2366, 1, 29000, 1024, 1024, 1024, 29000]
    - [0, 11444.0]
  - - [1024, 2368, 1, 29000, 1024, 1024, 1024, 29000]
    - [0, 11450.0]
  - - [1024, 2374, 1, 29000, 1024, 1024, 1024, 29000]
    - [20, 11463.0]
  - - [1024, 2390, 1, 29000, 1024, 1024, 1024, 29000]
    - [6, 11538.0]
  - - [512, 512, 320, 64, 512, 512, 512, 64]
    - [0, 9258.0]
  - - [512, 512, 80, 64, 512, 512, 512, 64]
    - [15, 11060.0]
  - - [2560, 1024, 1, 2560, 2560, 2560, 2560, 2560]
    - [1, 12209.0]
  - - [2560, 1024, 1, 4096, 2560, 2560, 2560, 4096]
    - [6, 12262.0]
  - - [4096, 1024, 1, 2560, 4096, 4096, 4096, 2560]
    - [8, 12195.0]
  - - [1024, 1024, 512, 64, 1024, 1024, 1024, 64]
    - [10, 8918.0]
  - - [1024, 32768, 1, 3072, 1024, 1024, 1024, 3072]
    - [8, 12565.0]
  - - [1024, 32768, 1, 4096, 1024, 1024, 1024, 4096]
    - [11, 11635.0]
  - - [1024, 32768, 1, 50304, 1024, 1024, 1024, 50304]
    - [12, 12013.0]
  - - [4096, 32768, 1, 1024, 4096, 4096, 4096, 1024]
    - [11, 12043.0]
  - - [1024, 1024, 24, 128, 1024, 1024, 1024, 128]
    - [11, 11710.0]
  - - [128, 1024, 24, 1024, 128, 128, 128, 1024]
    - [11, 10990.0]
  - - [768, 320, 1, 30522, 768, 768, 768, 30522]
    - [42, 10963.0]
  - - [768, 640, 1, 30522, 768, 768, 768, 30522]
    - [43, 11804.0]
  - - [768, 1280, 1, 30522, 768, 768, 768, 30522]
    - [43, 12194.0]
  - - [1024, 780, 1, 30522, 1024, 1024, 1024, 30522]
    - [42, 10725.0]
  - - [1024, 308, 1, 30522, 1024, 1024, 1024, 30522]
    - [42, 10767.0]
  - - [1024, 800, 1, 30522, 1024, 1024, 1024, 30522]
    - [42, 10977.0]
  - - [1024, 820, 1, 30522, 1024, 1024, 1024, 30522]
    - [42, 11225.0]
  - - [1024, 385, 1, 30522, 1024, 1024, 1024, 30522]
    - [45, 9220.0]
  - - [1024, 462, 1, 30522, 1024, 1024, 1024, 30522]
    - [42, 10127.0]
  - - [1024, 640, 1, 30528, 1024, 1024, 1024, 30528]
    - [43, 11969.0]
  - - [2048, 199, 1, 29000, 2048, 2048, 2048, 29000]
    - [44, 8704.0]
  - - [2048, 221, 1, 29000, 2048, 2048, 2048, 29000]
    - [44, 9632.0]
  - - [2048, 224, 1, 29000, 2048, 2048, 2048, 29000]
    - [44, 9771.0]
  - - [2048, 229, 1, 29000, 2048, 2048, 2048, 29000]
    - [46, 9987.0]
  - - [2048, 234, 1, 29000, 2048, 2048, 2048, 29000]
    - [45, 10201.0]
  - - [2048, 242, 1, 29000, 2048, 2048, 2048, 29000]
    - [45, 10546.0]
  - - [2048, 246, 1, 29000, 2048, 2048, 2048, 29000]
    - [45, 10715.0]
  - - [2048, 247, 1, 29000, 2048, 2048, 2048, 29000]
    - [45, 10749.0]
  - - [2048, 256, 1, 29000, 2048, 2048, 2048, 29000]
    - [45, 11135.0]
  - - [2048, 262, 1, 29000, 2048, 2048, 2048, 29000]
    - [45, 9366.0]
  - - [2048, 264, 1, 29000, 2048, 2048, 2048, 29000]
    - [45, 9441.0]
  - - [2048, 265, 1, 29000, 2048, 2048, 2048, 29000]
    - [45, 9475.0]
  - - [2048, 274, 1, 29000, 2048, 2048, 2048, 29000]
    - [45, 9783.0]
  - - [2048, 277, 1, 29000, 2048, 2048, 2048, 29000]
    - [45, 9888.0]
  - - [2048, 279, 1, 29000, 2048, 2048, 2048, 29000]
    - [45, 9963.0]
  - - [2048, 288, 1, 29000, 2048, 2048, 2048, 29000]
    - [45, 10279.0]
  - - [2048, 296, 1, 29000, 2048, 2048, 2048, 29000]
    - [45, 10558.0]
  - - [2048, 315, 1, 29000, 2048, 2048, 2048, 29000]
    - [45, 11204.0]
  - - [2048, 335, 1, 29000, 2048, 2048, 2048, 29000]
    - [43, 10202.0]
  - - [1024, 561, 1, 29000, 1024, 1024, 1024, 29000]
    - [42, 10722.0]
  - - [1024, 574, 1, 29000, 1024, 1024, 1024, 29000]
    - [42, 10965.0]
  - - [1024, 600, 1, 29000, 1024, 1024, 1024, 29000]
    - [43, 11254.0]
  - - [1024, 608, 1, 29000, 1024, 1024, 1024, 29000]
    - [43, 11388.0]
  - - [1024, 615, 1, 29000, 1024, 1024, 1024, 29000]
    - [43, 11520.0]
  - - [1024, 622, 1, 29000, 1024, 1024, 1024, 29000]
    - [43, 11651.0]
  - - [1024, 625, 1, 29000, 1024, 1024, 1024, 29000]
    - [43, 11701.0]
  - - [1024, 626, 1, 29000, 1024, 1024, 1024, 29000]
    - [43, 11716.0]
  - - [1024, 628, 1, 29000, 1024, 1024, 1024, 29000]
    - [43, 11763.0]
  - - [1024, 636, 1, 29000, 1024, 1024, 1024, 29000]
    - [43, 11889.0]
  - - [1024, 651, 1, 29000, 1024, 1024, 1024, 29000]
    - [42, 10428.0]
  - - [1024, 658, 1, 29000, 1024, 1024, 1024, 29000]
    - [42, 10533.0]
  - - [1024, 669, 1, 29000, 1024, 1024, 1024, 29000]
    - [42, 10703.0]
  - - [1024, 670, 1, 29000, 1024, 1024, 1024, 29000]
    - [42, 10724.0]
  - - [1024, 672, 1, 29000, 1024, 1024, 1024, 29000]
    - [42, 10765.0]
  - - [1024, 684, 1, 29000, 1024, 1024, 1024, 29000]
    - [42, 10928.0]
  - - [1024, 716, 1, 29000, 1024, 1024, 1024, 29000]
    - [43, 10886.0]
  - - [1024, 730, 1, 29000, 1024, 1024, 1024, 29000]
    - [43, 11115.0]
  - - [1600, 512, 1, 1024, 1600, 1600, 1600, 1024]
    - [51, 8987.0]
  - - [1024, 512, 1, 1, 1024, 1024, 1024, 1]
    - [97, 131.0]
  - - [1024, 512, 1, 64, 1024, 1024, 1024, 64]
    - [48, 4014.0]
  - - [2048, 512, 1, 1, 2048, 2048, 2048, 1]
    - [80, 146.0]
  - - [768, 640, 1, 768, 768, 768, 768, 768]
    - [50, 9149.0]
  - - [768, 1024, 1, 2, 768, 768, 768, 2]
    - [82, 260.0]
  - - [768, 1024, 1, 768, 768, 768, 768, 768]
    - [96, 7995.0]
  - - [768, 1280, 1, 768, 768, 768, 768, 768]
    - [110, 9107.0]
  - - [768, 512, 1, 2, 768, 768, 768, 2]
    - [111, 185.0]
  - - [768, 512, 1, 768, 768, 768, 768, 768]
    - [50, 7494.0]
  - - [1024, 512, 1, 1024, 1024, 1024, 1024, 1024]
    - [62, 8095.0]
  - - [1024, 512, 1, 2, 1024, 1024, 1024, 2]
    - [102, 350.0]
  - - [64, 64, 768, 64, 64, 64, 64, 64]
    - [60, 7284.0]
  - - [64, 64, 96, 64, 64, 64, 64, 64]
    - [49, 4576.0]
  - - [704, 1024, 1, 128, 704, 704, 704, 128]
    - [48, 7406.0]
  - - [1024, 1024, 1, 3328, 1024, 1024, 1024, 3328]
    - [73, 10129.0]
  - - [1856, 448, 1, 3328, 1856, 1856, 1856, 3328]
    - [51, 9589.0]
  - - [128, 6784, 1, 3328, 128, 128, 128, 3328]
    - [67, 9762.0]
  - - [2368, 448, 1, 128, 2368, 2368, 2368, 128]
    - [94, 8230.0]
  - - [256, 4288, 1, 3328, 256, 256, 256, 3328]
    - [50, 10783.0]
  - - [704, 1856, 1, 3328, 704, 704, 704, 3328]
    - [96, 9905.0]
  - - [448, 1024, 1, 1280, 448, 448, 448, 1280]
    - [48, 8144.0]
  - - [256, 1408, 1, 3328, 256, 256, 256, 3328]
    - [104, 7590.0]
  - - [704, 1856, 1, 1280, 704, 704, 704, 1280]
    - [104, 9774.0]
  - - [128, 5056, 1, 128, 128, 128, 128, 128]
    - [61, 6285.0]
  - - [2368, 128, 1, 256, 2368, 2368, 2368, 256]
    - [59, 5488.0]
  - - [64, 5056, 1, 256, 64, 64, 64, 256]
    - [60, 5331.0]
  - - [256, 2944, 1, 256, 256, 256, 256, 256]
    - [104, 7953.0]
  - - [256, 1856, 1, 1280, 256, 256, 256, 1280]
    - [83, 9644.0]
  - - [4288, 256, 1, 256, 4288, 4288, 4288, 256]
    - [61, 8882.0]
  - - [2944, 128, 1, 128, 2944, 2944, 2944, 128]
    - [50, 4441.0]
  - - [5888, 64, 1, 3328, 5888, 5888, 5888, 3328]
    - [50, 7884.0]
  - - [2944, 256, 1, 3328, 2944, 2944, 2944, 3328]
    - [96, 9949.0]
  - - [1408, 448, 1, 1280, 1408, 1408, 1408, 1280]
    - [96, 9612.0]
  - - [1408, 704, 1, 3328, 1408, 1408, 1408, 3328]
    - [83, 9719.0]
  - - [1408, 256, 1, 1280, 1408, 1408, 1408, 1280]
    - [96, 7220.0]
  - - [3072, 128, 1, 1024, 3072, 3072, 3072, 1024]
    - [96, 7518.0]
  - - [6784, 64, 1, 256, 6784, 6784, 6784, 256]
    - [61, 6315.0]
  - - [2944, 256, 1, 256, 2944, 2944, 2944, 256]
    - [96, 8259.0]
  - - [704, 1408, 1, 3328, 704, 704, 704, 3328]
    - [96, 9598.0]
  - - [2944, 256, 1, 128, 2944, 2944, 2944, 128]
    - [73, 6617.0]
  - - [2368, 128, 1, 3328, 2368, 2368, 2368, 3328]
    - [55, 8623.0]
  - - [64, 193600, 1, 64, 64, 64, 64, 64]
    - [98, 8344.0]
  - - [448, 1408, 1, 256, 448, 448, 448, 256]
    - [81, 7893.0]
  - - [64, 5056, 1, 3328, 64, 64, 64, 3328]
    - [63, 8513.0]
  - - [512, 1500, 1, 2816, 512, 512, 512, 2816]
    - [96, 10038.0]
  - - [1024, 448, 1, 128, 1024, 1024, 1024, 128]
    - [54, 6054.0]
  - - [256, 3584, 1, 3328, 256, 256, 256, 3328]
    - [74, 10337.0]
  - - [256, 1408, 1, 256, 256, 256, 256, 256]
    - [61, 5506.0]
  - - [5056, 64, 1, 1280, 5056, 5056, 5056, 1280]
    - [72, 8647.0]
  - - [1024, 704, 1, 256, 1024, 1024, 1024, 256]
    - [61, 7664.0]
  - - [128, 4288, 1, 128, 128, 128, 128, 128]
    - [61, 5371.0]
  - - [3584, 256, 1, 128, 3584, 3584, 3584, 128]
    - [73, 7405.0]
  - - [448, 1024, 1, 256, 448, 448, 448, 256]
    - [81, 6517.0]
  - - [5888, 64, 1, 256, 5888, 5888, 5888, 256]
    - [73, 5602.0]
  - - [1856, 256, 1, 1280, 1856, 1856, 1856, 1280]
    - [83, 9013.0]
  - - [64, 5888, 1, 3328, 64, 64, 64, 3328]
    - [63, 7174.0]
  - - [448, 1856, 1, 128, 448, 448, 448, 128]
    - [94, 6365.0]
  - - [1024, 704, 1, 1280, 1024, 1024, 1024, 1280]
    - [73, 9250.0]
  - - [128, 5888, 1, 256, 128, 128, 128, 256]
    - [61, 6925.0]
  - - [704, 704, 1, 3328, 704, 704, 704, 3328]
    - [51, 8204.0]
  - - [704, 1408, 1, 1280, 704, 704, 704, 1280]
    - [50, 9348.0]
  - - [3584, 256, 1, 3328, 3584, 3584, 3584, 3328]
    - [51, 10598.0]
  - - [704, 1856, 1, 128, 704, 704, 704, 128]
    - [94, 7904.0]
  - - [128, 3584, 1, 3328, 128, 128, 128, 3328]
    - [61, 9570.0]
  - - [2944, 448, 1, 128, 2944, 2944, 2944, 128]
    - [81, 8449.0]
  - - [64, 193600, 1, 256, 64, 64, 64, 256]
    - [106, 7888.0]
  - - [128, 2944, 1, 1280, 128, 128, 128, 1280]
    - [61, 7732.0]
  - - [448, 2944, 1, 1280, 448, 448, 448, 1280]
    - [55, 8998.0]
  - - [3584, 128, 1, 256, 3584, 3584, 3584, 256]
    - [50, 6788.0]
  - - [448, 1408, 1, 3328, 448, 448, 448, 3328]
    - [75, 9222.0]
  - - [704, 1024, 1, 256, 704, 704, 704, 256]
    - [50, 7658.0]
  - - [256, 3584, 1, 256, 256, 256, 256, 256]
    - [83, 8635.0]
  - - [256, 2944, 1, 3328, 256, 256, 256, 3328]
    - [50, 10100.0]
  - - [448, 2368, 1, 128, 448, 448, 448, 128]
    - [48, 7200.0]
  - - [1408, 704, 1, 256, 1408, 1408, 1408, 256]
    - [73, 8510.0]
  - - [448, 2944, 1, 3328, 448, 448, 448, 3328]
    - [73, 9216.0]
  - - [64, 5888, 1, 256, 64, 64, 64, 256]
    - [103, 5170.0]
  - - [512, 1500, 1, 2048, 512, 512, 512, 2048]
    - [83, 9777.0]
  - - [6784, 128, 1, 3328, 6784, 6784, 6784, 3328]
    - [51, 9947.0]
  - - [704, 704, 1, 256, 704, 704, 704, 256]
    - [50, 7025.0]
  - - [448, 704, 1, 1280, 448, 448, 448, 1280]
    - [48, 8000.0]
  - - [1024, 448, 1, 3328, 1024, 1024, 1024, 3328]
    - [77, 9398.0]
  - - [2944, 128, 1, 256, 2944, 2944, 2944, 256]
    - [50, 5763.0]
  - - [1024, 1024, 1, 1280, 1024, 1024, 1024, 1280]
    - [73, 9945.0]
  - - [448, 1024, 1, 128, 448, 448, 448, 128]
    - [81, 5062.0]
  - - [448, 2368, 1, 3328, 448, 448, 448, 3328]
    - [51, 9143.0]
  - - [5056, 64, 1, 128, 5056, 5056, 5056, 128]
    - [114, 4444.0]
  - - [1024, 700, 1, 512, 1024, 1024, 1024, 512]
    - [73, 8360.0]
  - - [128, 6784, 1, 1280, 128, 128, 128, 1280]
    - [62, 9479.0]
  - - [1856, 256, 1, 256, 1856, 1856, 1856, 256]
    - [94, 7257.0]
  - - [128, 5888, 1, 1280, 128, 128, 128, 1280]
    - [83, 9538.0]
  - - [256, 4288, 1, 1280, 256, 256, 256, 1280]
    - [83, 10325.0]
  - - [256, 1856, 1, 128, 256, 256, 256, 128]
    - [96, 5270.0]
  - - [7680, 64, 1, 2560, 7680, 7680, 7680, 2560]
    - [50, 10100.0]
  - - [448, 1408, 1, 128, 448, 448, 448, 128]
    - [81, 6053.0]
  - - [6784, 128, 1, 256, 6784, 6784, 6784, 256]
    - [51, 8107.0]
  - - [704, 448, 1, 256, 704, 704, 704, 256]
    - [101, 6774.0]
  - - [704, 448, 1, 128, 704, 704, 704, 128]
    - [72, 5298.0]
  - - [704, 1408, 1, 128, 704, 704, 704, 128]
    - [83, 6851.0]
  - - [4288, 128, 1, 1280, 4288, 4288, 4288, 1280]
    - [51, 8882.0]
  - - [128, 2944, 1, 128, 128, 128, 128, 128]
    - [76, 4261.0]
  - - [128, 4288, 1, 256, 128, 128, 128, 256]
    - [108, 5675.0]
  - - [704, 448, 1, 3328, 704, 704, 704, 3328]
    - [48, 8504.0]
  - - [448, 2368, 1, 1280, 448, 448, 448, 1280]
    - [50, 8854.0]
  - - [64, 6784, 1, 3328, 64, 64, 64, 3328]
    - [63, 8086.0]
  - - [2944, 256, 1, 1280, 2944, 2944, 2944, 1280]
    - [50, 9846.0]
  - - [256, 2368, 1, 128, 256, 256, 256, 128]
    - [59, 7016.0]
  - - [1856, 704, 1, 256, 1856, 1856, 1856, 256]
    - [50, 8375.0]
  - - [1856, 448, 1, 1280, 1856, 1856, 1856, 1280]
    - [97, 9145.0]
  - - [128, 5888, 1, 128, 128, 128, 128, 128]
    - [83, 5628.0]
  - - [1024, 1024, 1, 256, 1024, 1024, 1024, 256]
    - [50, 8767.0]
  - - [704, 1856, 1, 256, 704, 704, 704, 256]
    - [96, 8634.0]
  - - [256, 2368, 1, 1280, 256, 256, 256, 1280]
    - [105, 9401.0]
  - - [2944, 448, 1, 256, 2944, 2944, 2944, 256]
    - [73, 9062.0]
  - - [1856, 448, 1, 128, 1856, 1856, 1856, 128]
    - [61, 6594.0]
  - - [2368, 128, 1, 1280, 2368, 2368, 2368, 1280]
    - [48, 7763.0]
  - - [64, 6784, 1, 256, 64, 64, 64, 256]
    - [81, 6127.0]
  - - [64, 5056, 1, 1280, 64, 64, 64, 1280]
    - [85, 7679.0]
  - - [3025, 64, 64, 64, 3025, 3025, 3025, 64]
    - [96, 8788.0]
  - - [2368, 256, 1, 1280, 2368, 2368, 2368, 1280]
    - [51, 9847.0]
  - - [2368, 448, 1, 1280, 2368, 2368, 2368, 1280]
    - [50, 10125.0]
  - - [128, 3584, 1, 256, 128, 128, 128, 256]
    - [108, 5266.0]
  - - [704, 448, 1, 1280, 704, 704, 704, 1280]
    - [48, 7845.0]
  - - [4288, 256, 1, 1280, 4288, 4288, 4288, 1280]
    - [96, 10322.0]
  - - [4288, 128, 1, 3328, 4288, 4288, 4288, 3328]
    - [51, 9334.0]
  - - [7680, 128, 1, 2560, 7680, 7680, 7680, 2560]
    - [55, 11044.0]
  - - [1408, 256, 1, 128, 1408, 1408, 1408, 128]
    - [50, 4320.0]
  - - [256, 1408, 1, 1280, 256, 256, 256, 1280]
    - [87, 7305.0]
  - - [6784, 64, 1, 3328, 6784, 6784, 6784, 3328]
    - [65, 8992.0]
  - - [128, 2944, 1, 3328, 128, 128, 128, 3328]
    - [61, 7815.0]
  - - [2944, 448, 1, 3328, 2944, 2944, 2944, 3328]
    - [50, 10308.0]
  - - [5888, 128, 1, 256, 5888, 5888, 5888, 256]
    - [83, 7927.0]
  - - [5056, 64, 1, 256, 5056, 5056, 5056, 256]
    - [81, 5951.0]
  - - [512, 1500, 1, 1536, 512, 512, 512, 1536]
    - [83, 9674.0]
  - - [128, 3584, 1, 1280, 128, 128, 128, 1280]
    - [61, 8949.0]
  - - [1024, 704, 1, 128, 1024, 1024, 1024, 128]
    - [61, 6471.0]
  - - [128, 5056, 1, 3328, 128, 128, 128, 3328]
    - [62, 10613.0]
  - - [1024, 1024, 1, 128, 1024, 1024, 1024, 128]
    - [59, 7932.0]
  - - [4288, 128, 1, 256, 4288, 4288, 4288, 256]
    - [51, 7228.0]
  - - [1408, 448, 1, 128, 1408, 1408, 1408, 128]
    - [73, 6398.0]
  - - [3584, 256, 1, 256, 3584, 3584, 3584, 256]
    - [84, 8706.0]
  - - [128, 2944, 1, 256, 128, 128, 128, 256]
    - [104, 5655.0]
  - - [128, 6784, 1, 128, 128, 128, 128, 128]
    - [62, 6753.0]
  - - [448, 1856, 1, 256, 448, 448, 448, 256]
    - [73, 7651.0]
  - - [3584, 128, 1, 3328, 3584, 3584, 3584, 3328]
    - [73, 9629.0]
  - - [5888, 128, 1, 3328, 5888, 5888, 5888, 3328]
    - [50, 9994.0]
  - - [1408, 704, 1, 1280, 1408, 1408, 1408, 1280]
    - [83, 9563.0]
  - - [448, 2944, 1, 256, 448, 448, 448, 256]
    - [73, 8271.0]
  - - [448, 2368, 1, 256, 448, 448, 448, 256]
    - [101, 7872.0]
  - - [64, 6784, 1, 1280, 64, 64, 64, 1280]
    - [63, 8099.0]
  - - [128, 2368, 1, 3328, 128, 128, 128, 3328]
    - [104, 8799.0]
  - - [5056, 64, 1, 3328, 5056, 5056, 5056, 3328]
    - [50, 9260.0]
  - - [64, 5888, 1, 128, 64, 64, 64, 128]
    - [107, 4299.0]
  - - [5056, 128, 1, 3328, 5056, 5056, 5056, 3328]
    - [97, 10805.0]
  - - [448, 704, 1, 256, 448, 448, 448, 256]
    - [101, 5523.0]
  - - [2944, 128, 1, 3328, 2944, 2944, 2944, 3328]
    - [96, 8005.0]
  - - [128, 5056, 1, 1280, 128, 128, 128, 1280]
    - [62, 10396.0]
  - - [704, 704, 1, 128, 704, 704, 704, 128]
    - [94, 5027.0]
  - - [2368, 128, 1, 128, 2368, 2368, 2368, 128]
    - [81, 4050.0]
  - - [5056, 128, 1, 128, 5056, 5056, 5056, 128]
    - [50, 6136.0]
  - - [448, 1024, 1, 3328, 448, 448, 448, 3328]
    - [52, 8643.0]
  - - [2368, 256, 1, 256, 2368, 2368, 2368, 256]
    - [50, 7497.0]
  - - [256, 2368, 1, 3328, 256, 256, 256, 3328]
    - [62, 9939.0]
  - - [256, 3584, 1, 128, 256, 256, 256, 128]
    - [83, 8033.0]
  - - [4288, 256, 1, 128, 4288, 4288, 4288, 128]
    - [101, 8304.0]
  - - [448, 1856, 1, 3328, 448, 448, 448, 3328]
    - [62, 9404.0]
  - - [2368, 256, 1, 128, 2368, 2368, 2368, 128]
    - [48, 6139.0]
  - - [256, 1856, 1, 256, 256, 256, 256, 256]
    - [83, 7064.0]
  - - [256, 2944, 1, 128, 256, 256, 256, 128]
    - [50, 6431.0]
  - - [1408, 256, 1, 3328, 1408, 1408, 1408, 3328]
    - [96, 7583.0]
  - - [2368, 448, 1, 256, 2368, 2368, 2368, 256]
    - [50, 8705.0]
  - - [4288, 256, 1, 3328, 4288, 4288, 4288, 3328]
    - [50, 10703.0]
  - - [1856, 704, 1, 128, 1856, 1856, 1856, 128]
    - [81, 8516.0]
  - - [4288, 128, 1, 128, 4288, 4288, 4288, 128]
    - [48, 6445.0]
  - - [6784, 64, 1, 1280, 6784, 6784, 6784, 1280]
    - [73, 8477.0]
  - - [3584, 128, 1, 128, 3584, 3584, 3584, 128]
    - [81, 6181.0]
  - - [256, 2368, 1, 256, 256, 256, 256, 256]
    - [50, 7355.0]
  - - [2944, 448, 1, 1280, 2944, 2944, 2944, 1280]
    - [96, 9905.0]
  - - [448, 1408, 1, 1280, 448, 448, 448, 1280]
    - [63, 8799.0]
  - - [448, 1856, 1, 1280, 448, 448, 448, 1280]
    - [62, 9061.0]
  - - [1856, 256, 1, 128, 1856, 1856, 1856, 128]
    - [72, 5189.0]
  - - [128, 2368, 1, 256, 128, 128, 128, 256]
    - [83, 5535.0]
  - - [5888, 64, 1, 1280, 5888, 5888, 5888, 1280]
    - [50, 7490.0]
  - - [1024, 448, 1, 1280, 1024, 1024, 1024, 1280]
    - [73, 8894.0]
  - - [128, 5056, 1, 256, 128, 128, 128, 256]
    - [104, 7649.0]
  - - [1856, 704, 1, 1280, 1856, 1856, 1856, 1280]
    - [73, 9697.0]
  - - [448, 2944, 1, 128, 448, 448, 448, 128]
    - [94, 7646.0]
  - - [1408, 256, 1, 256, 1408, 1408, 1408, 256]
    - [96, 5647.0]
  - - [2368, 448, 1, 3328, 2368, 2368, 2368, 3328]
    - [73, 10348.0]
  - - [128, 5888, 1, 3328, 128, 128, 128, 3328]
    - [61, 9864.0]
  - - [64, 5056, 1, 128, 64, 64, 64, 128]
    - [82, 4142.0]
  - - [64, 6784, 1, 128, 64, 64, 64, 128]
    - [101, 4548.0]
  - - [448, 704, 1, 128, 448, 448, 448, 128]
    - [81, 5368.0]
  - - [1408, 448, 1, 256, 1408, 1408, 1408, 256]
    - [73, 7877.0]
  - - [1408, 704, 1, 128, 1408, 1408, 1408, 128]
    - [50, 7217.0]
  - - [2368, 256, 1, 3328, 2368, 2368, 2368, 3328]
    - [51, 10202.0]
  - - [5888, 128, 1, 1280, 5888, 5888, 5888, 1280]
    - [73, 9506.0]
  - - [256, 3584, 1, 1280, 256, 256, 256, 1280]
    - [62, 10065.0]
  - - [256, 1408, 1, 128, 256, 256, 256, 128]
    - [106, 4532.0]
  - - [256, 4288, 1, 128, 256, 256, 256, 128]
    - [61, 8207.0]
  - - [5888, 128, 1, 128, 5888, 5888, 5888, 128]
    - [96, 6653.0]
  - - [1408, 448, 1, 3328, 1408, 1408, 1408, 3328]
    - [96, 10190.0]
  - - [704, 1024, 1, 1280, 704, 704, 704, 1280]
    - [50, 9196.0]
  - - [1856, 256, 1, 3328, 1856, 1856, 1856, 3328]
    - [50, 9706.0]
  - - [64, 5888, 1, 1280, 64, 64, 64, 1280]
    - [63, 6904.0]
  - - [6784, 64, 1, 128, 6784, 6784, 6784, 128]
    - [61, 6273.0]
  - - [704, 704, 1, 1280, 704, 704, 704, 1280]
    - [51, 8022.0]
  - - [128, 2368, 1, 1280, 128, 128, 128, 1280]
    - [108, 8147.0]
  - - [3584, 256, 1, 1280, 3584, 3584, 3584, 1280]
    - [97, 10170.0]
  - - [128, 4288, 1, 3328, 128, 128, 128, 3328]
    - [51, 8982.0]
  - - [3584, 128, 1, 1280, 3584, 3584, 3584, 1280]
    - [96, 8960.0]
  - - [5056, 128, 1, 1280, 5056, 5056, 5056, 1280]
    - [105, 10242.0]
  - - [256, 4288, 1, 256, 256, 256, 256, 256]
    - [83, 8169.0]
  - - [1024, 448, 1, 256, 1024, 1024, 1024, 256]
    - [73, 7788.0]
  - - [2944, 128, 1, 1280, 2944, 2944, 2944, 1280]
    - [104, 7563.0]
  - - [128, 2368, 1, 128, 128, 128, 128, 128]
    - [103, 5187.0]
  - - [256, 2944, 1, 1280, 256, 256, 256, 1280]
    - [61, 9607.0]
  - - [2560, 128, 1, 2560, 2560, 2560, 2560, 2560]
    - [55, 9241.0]
  - - [704, 1024, 1, 3328, 704, 704, 704, 3328]
    - [96, 9466.0]
  - - [128, 6784, 1, 256, 128, 128, 128, 256]
    - [83, 8856.0]
  - - [256, 1856, 1, 3328, 256, 256, 256, 3328]
    - [50, 9785.0]
  - - [6784, 128, 1, 128, 6784, 6784, 6784, 128]
    - [96, 6895.0]
  - - [128, 3584, 1, 128, 128, 128, 128, 128]
    - [83, 5045.0]
  - - [704, 1408, 1, 256, 704, 704, 704, 256]
    - [73, 8186.0]
  - - [4096, 128, 1, 4096, 4096, 4096, 4096, 4096]
    - [51, 8909.0]
  - - [5888, 64, 1, 128, 5888, 5888, 5888, 128]
    - [50, 4417.0]
  - - [5056, 128, 1, 256, 5056, 5056, 5056, 256]
    - [63, 8011.0]
  - - [6784, 128, 1, 1280, 6784, 6784, 6784, 1280]
    - [110, 9706.0]
  - - [1856, 448, 1, 256, 1856, 1856, 1856, 256]
    - [50, 7797.0]
  - - [1024, 704, 1, 3328, 1024, 1024, 1024, 3328]
    - [73, 9484.0]
  - - [128, 4288, 1, 1280, 128, 128, 128, 1280]
    - [83, 8528.0]
  - - [448, 704, 1, 3328, 448, 448, 448, 3328]
    - [48, 8217.0]
  - - [1856, 704, 1, 3328, 1856, 1856, 1856, 3328]
    - [50, 9995.0]
  - - [512, 1500, 1, 2560, 512, 512, 512, 2560]
    - [61, 9973.0]
  - - [3136, 64, 128, 64, 3136, 3136, 3136, 64]
    - [79, 5390.0]
  - - [3136, 64, 128, 256, 3136, 3136, 3136, 256]
    - [54, 8796.0]
  - - [3136, 64, 256, 64, 3136, 3136, 3136, 64]
    - [47, 5262.0]
  - - [3136, 64, 256, 256, 3136, 3136, 3136, 256]
    - [99, 8757.0]
  - - [1024, 512, 1, 2048, 1024, 1024, 1024, 2048]
    - [51, 8691.0]
  - - [4096, 256, 1, 2048, 4096, 4096, 4096, 2048]
    - [50, 10316.0]
  - - [2048, 256, 1, 4096, 2048, 2048, 2048, 4096]
    - [51, 8729.0]
  - - [512, 768, 1, 2048, 512, 512, 512, 2048]
    - [87, 7901.0]
  - - [2048, 256, 1, 1024, 2048, 2048, 2048, 1024]
    - [84, 8122.0]
  - - [2048, 200, 1, 512, 2048, 2048, 2048, 512]
    - [73, 5809.0]
  - - [4096, 200, 1, 1024, 4096, 4096, 4096, 1024]
    - [96, 7721.0]
  - - [2048, 200, 1, 4096, 2048, 2048, 2048, 4096]
    - [74, 6882.0]
  - - [2048, 512, 1, 1024, 2048, 2048, 2048, 1024]
    - [96, 9763.0]
  - - [1024, 1024, 1, 512, 1024, 1024, 1024, 512]
    - [50, 9539.0]
  - - [2048, 512, 1, 4096, 2048, 2048, 2048, 4096]
    - [61, 10250.0]
  - - [1024, 1024, 1, 4096, 1024, 1024, 1024, 4096]
    - [83, 10222.0]
  - - [4096, 200, 1, 2048, 4096, 4096, 4096, 2048]
    - [96, 7963.0]
  - - [2048, 200, 1, 1024, 2048, 2048, 2048, 1024]
    - [74, 6390.0]
  - - [1024, 768, 1, 512, 1024, 1024, 1024, 512]
    - [96, 9390.0]
  - - [2048, 200, 1, 2048, 2048, 2048, 2048, 2048]
    - [97, 6851.0]
  - - [2048, 256, 1, 2048, 2048, 2048, 2048, 2048]
    - [97, 8668.0]
  - - [512, 768, 1, 512, 512, 512, 512, 512]
    - [73, 7649.0]
  - - [4096, 256, 1, 4096, 4096, 4096, 4096, 4096]
    - [50, 10250.0]
  - - [1024, 512, 1, 512, 1024, 1024, 1024, 512]
    - [61, 7596.0]
  - - [1024, 1024, 1, 2048, 1024, 1024, 1024, 2048]
    - [61, 9949.0]
  - - [4096, 256, 1, 1024, 4096, 4096, 4096, 1024]
    - [73, 9851.0]
  - - [512, 768, 1, 1024, 512, 512, 512, 1024]
    - [83, 7504.0]
  - - [1024, 512, 1, 4096, 1024, 1024, 1024, 4096]
    - [51, 8677.0]
  - - [4096, 200, 1, 4096, 4096, 4096, 4096, 4096]
    - [96, 7841.0]
  - - [2048, 256, 1, 512, 2048, 2048, 2048, 512]
    - [97, 7687.0]
  - - [1024, 1024, 1, 1024, 1024, 1024, 1024, 1024]
    - [83, 9774.0]
  - - [4096, 192, 1, 2048, 4096, 4096, 4096, 2048]
    - [83, 10146.0]
  - - [5329, 64, 64, 160, 5329, 5329, 5329, 160]
    - [49, 7509.0]
  - - [1225, 64, 64, 384, 1225, 1225, 1225, 384]
    - [77, 9200.0]
  - - [4096, 320, 1, 1280, 4096, 4096, 4096, 1280]
    - [50, 11130.0]
  - - [4096, 192, 1, 1280, 4096, 4096, 4096, 1280]
    - [50, 9927.0]
  - - [1225, 96, 64, 384, 1225, 1225, 1225, 384]
    - [55, 8009.0]
  - - [4096, 320, 1, 2048, 4096, 4096, 4096, 2048]
    - [50, 11234.0]
  - - [4096, 256, 1, 1536, 4096, 4096, 4096, 1536]
    - [73, 10022.0]
  - - [64, 147, 432, 148, 64, 64, 64, 148]
    - [72, 7877.0]
  - - [64, 123, 528, 123, 64, 64, 64, 123]
    - [48, 8397.0]
  - - [64, 111, 576, 112, 64, 64, 64, 112]
    - [94, 7646.0]
  - - [64, 77, 816, 77, 64, 64, 64, 77]
    - [72, 5713.0]
  - - [64, 92, 688, 92, 64, 64, 64, 92]
    - [94, 6585.0]
  - - [64, 159, 400, 159, 64, 64, 64, 159]
    - [52, 7375.0]
  - - [64, 85, 752, 84, 64, 64, 64, 84]
    - [48, 6243.0]
  - - [64, 122, 528, 123, 64, 64, 64, 123]
    - [75, 7464.0]
  - - [64, 93, 688, 92, 64, 64, 64, 92]
    - [101, 6600.0]
  - - [64, 102, 624, 99, 64, 64, 64, 99]
    - [72, 6434.0]
  - - [64, 133, 480, 133, 64, 64, 64, 133]
    - [94, 7118.0]
  - - [64, 232, 272, 232, 64, 64, 64, 232]
    - [94, 8925.0]
  - - [64, 162, 400, 159, 64, 64, 64, 159]
    - [94, 8582.0]
  - - [64, 78, 816, 78, 64, 64, 64, 78]
    - [94, 5997.0]
  - - [64, 99, 624, 99, 64, 64, 64, 99]
    - [94, 7281.0]
  - - [64, 101, 624, 102, 64, 64, 64, 102]
    - [94, 7231.0]
  - - [64, 111, 576, 111, 64, 64, 64, 111]
    - [52, 7194.0]
  - - [64, 134, 480, 134, 64, 64, 64, 134]
    - [72, 7277.0]
  - - [64, 135, 480, 132, 64, 64, 64, 132]
    - [94, 7430.0]
  - - [64, 134, 480, 132, 64, 64, 64, 132]
    - [94, 7385.0]
  - - [64, 134, 480, 135, 64, 64, 64, 135]
    - [72, 7380.0]
  - - [64, 162, 400, 162, 64, 64, 64, 162]
    - [48, 8400.0]
  - - [64, 102, 624, 102, 64, 64, 64, 102]
    - [52, 6468.0]
  - - [64, 135, 480, 133, 64, 64, 64, 133]
    - [72, 7248.0]
  - - [64, 148, 432, 143, 64, 64, 64, 143]
    - [72, 7816.0]
  - - [64, 100, 624, 100, 64, 64, 64, 100]
    - [81, 7484.0]
  - - [64, 65, 992, 65, 64, 64, 64, 65]
    - [81, 5113.0]
  - - [64, 122, 528, 122, 64, 64, 64, 122]
    - [52, 7405.0]
  - - [64, 228, 272, 228, 64, 64, 64, 228]
    - [94, 8169.0]
  - - [64, 112, 576, 111, 64, 64, 64, 111]
    - [52, 6923.0]
  - - [64, 143, 432, 143, 64, 64, 64, 143]
    - [94, 7665.0]
  - - [64, 135, 480, 135, 64, 64, 64, 135]
    - [94, 7336.0]
  - - [64, 232, 272, 228, 64, 64, 64, 228]
    - [52, 8139.0]
  - - [64, 193, 320, 193, 64, 64, 64, 193]
    - [94, 7891.0]
  - - [64, 71, 896, 71, 64, 64, 64, 71]
    - [101, 5529.0]
  - - [64, 84, 752, 84, 64, 64, 64, 84]
    - [59, 6594.0]
  - - [64, 132, 480, 132, 64, 64, 64, 132]
    - [94, 7179.0]
  - - [64, 85, 752, 85, 64, 64, 64, 85]
    - [72, 6634.0]
  - - [64, 102, 624, 100, 64, 64, 64, 100]
    - [48, 6478.0]
  - - [64, 78, 816, 77, 64, 64, 64, 77]
    - [59, 6133.0]
  - - [64, 112, 576, 112, 64, 64, 64, 112]
    - [48, 8377.0]
  - - [64, 148, 432, 148, 64, 64, 64, 148]
    - [72, 8002.0]
  - - [64, 159, 400, 160, 64, 64, 64, 160]
    - [94, 8603.0]
  - - [64, 102, 624, 101, 64, 64, 64, 101]
    - [72, 7591.0]
  - - [64, 101, 624, 101, 64, 64, 64, 101]
    - [59, 7550.0]
  - - [64, 160, 400, 160, 64, 64, 64, 160]
    - [72, 8651.0]
  - - [64, 93, 688, 93, 64, 64, 64, 93]
    - [72, 7092.0]
  - - [64, 147, 432, 147, 64, 64, 64, 147]
    - [94, 7701.0]
  - - [64, 100, 624, 102, 64, 64, 64, 102]
    - [72, 7538.0]
  - - [64, 177, 352, 177, 64, 64, 64, 177]
    - [98, 8075.0]
  - - [500, 1024, 1, 512, 500, 500, 500, 512]
    - [73, 7692.0]
  - - [512, 1024, 1, 512, 512, 512, 512, 512]
    - [62, 8095.0]
  - - [200, 2048, 1, 512, 200, 200, 200, 512]
    - [104, 5822.0]
  - - [512, 2000, 1, 1024, 512, 512, 512, 1024]
    - [83, 9440.0]
  - - [512, 2048, 1, 512, 512, 512, 512, 512]
    - [73, 9373.0]
  - - [200, 2000, 1, 100, 200, 200, 200, 100]
    - [58, 3584.0]
  - - [200, 2000, 1, 1024, 200, 200, 200, 1024]
    - [83, 6113.0]
  - - [500, 1024, 1, 2048, 500, 500, 500, 2048]
    - [62, 8186.0]
  - - [512, 2048, 1, 100, 512, 512, 512, 100]
    - [61, 6696.0]
  - - [512, 2048, 1, 2000, 512, 512, 512, 2000]
    - [73, 10128.0]
  - - [200, 2000, 1, 10, 200, 200, 200, 10]
    - [70, 735.0]
  - - [500, 2048, 1, 1024, 500, 500, 500, 1024]
    - [83, 9393.0]
  - - [500, 2000, 1, 10, 500, 500, 500, 10]
    - [100, 1205.0]
  - - [500, 2048, 1, 100, 500, 500, 500, 100]
    - [94, 6132.0]
  - - [512, 1024, 1, 500, 512, 512, 512, 500]
    - [73, 7550.0]
  - - [200, 2000, 1, 2000, 200, 200, 200, 2000]
    - [74, 6581.0]
  - - [500, 2048, 1, 2000, 500, 500, 500, 2000]
    - [50, 9868.0]
  - - [512, 2048, 1, 1024, 512, 512, 512, 1024]
    - [104, 9693.0]
  - - [512, 1024, 1, 100, 512, 512, 512, 100]
    - [61, 4864.0]
  - - [256, 2000, 1, 10, 256, 256, 256, 10]
    - [47, 1255.0]
  - - [512, 2000, 1, 100, 512, 512, 512, 100]
    - [83, 6360.0]
  - - [512, 2000, 1, 2048, 512, 512, 512, 2048]
    - [61, 9776.0]
  - - [500, 1024, 1, 500, 500, 500, 500, 500]
    - [74, 7191.0]
  - - [256, 2000, 1, 100, 256, 256, 256, 100]
    - [83, 4369.0]
  - - [512, 1024, 1, 2048, 512, 512, 512, 2048]
    - [62, 8456.0]
  - - [500, 2048, 1, 2048, 500, 500, 500, 2048]
    - [61, 9722.0]
  - - [200, 2048, 1, 10, 200, 200, 200, 10]
    - [95, 737.0]
  - - [500, 2000, 1, 512, 500, 500, 500, 512]
    - [83, 8886.0]
  - - [500, 1024, 1, 1024, 500, 500, 500, 1024]
    - [61, 7674.0]
  - - [200, 2000, 1, 500, 200, 200, 200, 500]
    - [51, 5656.0]
  - - [256, 2048, 1, 100, 256, 256, 256, 100]
    - [73, 4775.0]
  - - [500, 2000, 1, 1024, 500, 500, 500, 1024]
    - [61, 9215.0]
  - - [256, 2048, 1, 1024, 256, 256, 256, 1024]
    - [84, 8030.0]
  - - [200, 2048, 1, 1024, 200, 200, 200, 1024]
    - [108, 6334.0]
  - - [512, 2048, 1, 500, 512, 512, 512, 500]
    - [73, 9526.0]
  - - [512, 2000, 1, 10, 512, 512, 512, 10]
    - [100, 1306.0]
  - - [500, 1024, 1, 2000, 500, 500, 500, 2000]
    - [74, 8388.0]
  - - [512, 2000, 1, 512, 512, 512, 512, 512]
    - [73, 9457.0]
  - - [500, 2000, 1, 2000, 500, 500, 500, 2000]
    - [96, 9622.0]
  - - [500, 1024, 1, 10, 500, 500, 500, 10]
    - [70, 818.0]
  - - [256, 2048, 1, 10, 256, 256, 256, 10]
    - [82, 895.0]
  - - [256, 2048, 1, 500, 256, 256, 256, 500]
    - [84, 7546.0]
  - - [256, 2048, 1, 2048, 256, 256, 256, 2048]
    - [105, 8376.0]
  - - [256, 2000, 1, 512, 256, 256, 256, 512]
    - [104, 7290.0]
  - - [512, 1024, 1, 2000, 512, 512, 512, 2000]
    - [74, 8728.0]
  - - [256, 2000, 1, 2000, 256, 256, 256, 2000]
    - [62, 8400.0]
  - - [256, 2048, 1, 2000, 256, 256, 256, 2000]
    - [74, 8724.0]
  - - [200, 2048, 1, 100, 200, 200, 200, 100]
    - [48, 4561.0]
  - - [200, 2000, 1, 2048, 200, 200, 200, 2048]
    - [84, 6411.0]
  - - [500, 2048, 1, 512, 500, 500, 500, 512]
    - [83, 9121.0]
  - - [500, 2000, 1, 500, 500, 500, 500, 500]
    - [73, 8986.0]
  - - [200, 2048, 1, 2048, 200, 200, 200, 2048]
    - [105, 6554.0]
  - - [200, 2048, 1, 500, 200, 200, 200, 500]
    - [74, 5821.0]
  - - [512, 2000, 1, 500, 512, 512, 512, 500]
    - [73, 9239.0]
  - - [200, 2048, 1, 2000, 200, 200, 200, 2000]
    - [62, 6752.0]
  - - [500, 1024, 1, 100, 500, 500, 500, 100]
    - [59, 4776.0]
  - - [512, 1024, 1, 10, 512, 512, 512, 10]
    - [88, 886.0]
  - - [512, 1024, 1, 1024, 512, 512, 512, 1024]
    - [62, 8037.0]
  - - [500, 2048, 1, 10, 500, 500, 500, 10]
    - [57, 1196.0]
  - - [200, 2000, 1, 512, 200, 200, 200, 512]
    - [104, 5623.0]
  - - [256, 2000, 1, 500, 256, 256, 256, 500]
    - [51, 7244.0]
  - - [256, 2048, 1, 512, 256, 256, 256, 512]
    - [104, 7498.0]
  - - [256, 2000, 1, 2048, 256, 256, 256, 2048]
    - [84, 8209.0]
  - - [500, 2048, 1, 500, 500, 500, 500, 500]
    - [73, 9101.0]
  - - [256, 2000, 1, 1024, 256, 256, 256, 1024]
    - [83, 7818.0]
  - - [500, 2000, 1, 2048, 500, 500, 500, 2048]
    - [104, 9537.0]
  - - [512, 2000, 1, 2000, 512, 512, 512, 2000]
    - [96, 9847.0]
  - - [512, 2048, 1, 2048, 512, 512, 512, 2048]
    - [83, 9992.0]
  - - [512, 2048, 1, 10, 512, 512, 512, 10]
    - [94, 1736.0]
  - - [500, 2000, 1, 100, 500, 500, 500, 100]
    - [74, 6477.0]
  - - [1024, 1131, 1, 1024, 1024, 1024, 1024, 1024]
    - [83, 9536.0]
  - - [1024, 1102, 1, 1024, 1024, 1024, 1024, 1024]
    - [62, 9302.0]
  - - [1024, 774, 1, 1024, 1024, 1024, 1024, 1024]
    - [104, 8522.0]
  - - [4096, 128, 1, 2048, 4096, 4096, 4096, 2048]
    - [62, 8725.0]
  - - [4096, 128, 1, 3072, 4096, 4096, 4096, 3072]
    - [51, 8877.0]
  - - [1024, 1120, 1, 1024, 1024, 1024, 1024, 1024]
    - [83, 9477.0]
  - - [1024, 1015, 1, 1024, 1024, 1024, 1024, 1024]
    - [83, 9647.0]
  - - [1024, 992, 1, 1024, 1024, 1024, 1024, 1024]
    - [83, 9486.0]
  - - [1024, 950, 1, 1024, 1024, 1024, 1024, 1024]
    - [104, 10148.0]
  - - [1024, 1088, 1, 1024, 1024, 1024, 1024, 1024]
    - [83, 10353.0]
  - - [64, 128, 96, 128, 64, 64, 64, 128]
    - [114, 3660.0]
  - - [768, 1024, 1, 3072, 768, 768, 768, 3072]
    - [61, 10192.0]
  - - [768, 512, 1, 3072, 768, 768, 768, 3072]
    - [54, 8076.0]
  - - [64, 256, 192, 256, 64, 64, 64, 256]
    - [86, 7252.0]
  - - [64, 128, 384, 128, 64, 64, 64, 128]
    - [106, 8207.0]
  - - [64, 256, 96, 256, 64, 64, 64, 256]
    - [63, 8207.0]
  - - [6272, 112, 1, 512, 6272, 6272, 6272, 512]
    - [96, 7954.0]
  - - [2048, 320, 1, 1280, 2048, 2048, 2048, 1280]
    - [99, 10017.0]
  - - [5329, 64, 1, 448, 5329, 5329, 5329, 448]
    - [83, 5335.0]
  - - [784, 64, 32, 192, 784, 784, 784, 192]
    - [61, 8292.0]
  - - [6272, 64, 1, 480, 6272, 6272, 6272, 480]
    - [83, 6976.0]
  - - [6272, 64, 1, 512, 6272, 6272, 6272, 512]
    - [65, 7345.0]
  - - [6272, 160, 1, 528, 6272, 6272, 6272, 528]
    - [73, 8040.0]
  - - [289, 160, 32, 768, 289, 289, 289, 768]
    - [83, 6861.0]
  - - [5329, 64, 32, 160, 5329, 5329, 5329, 160]
    - [50, 7597.0]
  - - [5329, 96, 1, 576, 5329, 5329, 5329, 576]
    - [73, 6398.0]
  - - [1225, 64, 32, 288, 1225, 1225, 1225, 288]
    - [96, 10557.0]
  - - [289, 192, 32, 768, 289, 289, 289, 768]
    - [104, 8133.0]
  - - [2048, 448, 1, 1280, 2048, 2048, 2048, 1280]
    - [50, 10196.0]
  - - [3136, 64, 32, 64, 3136, 3136, 3136, 64]
    - [94, 10075.0]
  - - [6272, 128, 1, 528, 6272, 6272, 6272, 528]
    - [50, 10155.0]
  - - [6272, 96, 1, 480, 6272, 6272, 6272, 480]
    - [96, 6931.0]
  - - [2048, 448, 1, 2048, 2048, 2048, 2048, 2048]
    - [73, 10112.0]
  - - [784, 96, 32, 192, 784, 784, 784, 192]
    - [72, 6881.0]
  - - [1001, 512, 1, 4096, 1001, 1001, 1001, 4096]
    - [62, 8402.0]
  - - [2048, 192, 1, 1280, 2048, 2048, 2048, 1280]
    - [104, 7696.0]
  - - [1225, 64, 32, 256, 1225, 1225, 1225, 256]
    - [96, 9000.0]
  - - [2048, 256, 1, 1536, 2048, 2048, 2048, 1536]
    - [97, 8456.0]
  - - [6272, 128, 1, 512, 6272, 6272, 6272, 512]
    - [77, 9363.0]
  - - [1568, 384, 1, 832, 1568, 1568, 1568, 832]
    - [96, 9216.0]
  - - [1568, 256, 1, 832, 1568, 1568, 1568, 832]
    - [59, 7576.0]
  - - [1568, 192, 1, 832, 1568, 1568, 1568, 832]
    - [50, 7549.0]
  - - [289, 192, 32, 1024, 289, 289, 289, 1024]
    - [104, 8248.0]
  - - [1225, 64, 32, 384, 1225, 1225, 1225, 384]
    - [73, 10617.0]
  - - [2048, 320, 1, 2048, 2048, 2048, 2048, 2048]
    - [54, 10476.0]
  - - [2048, 384, 1, 1536, 2048, 2048, 2048, 1536]
    - [96, 10038.0]
  - - [5041, 96, 1, 576, 5041, 5041, 5041, 576]
    - [54, 6665.0]
  - - [6272, 192, 1, 480, 6272, 6272, 6272, 480]
    - [61, 9570.0]
  - - [5041, 192, 1, 720, 5041, 5041, 5041, 720]
    - [73, 9829.0]
  - - [289, 128, 32, 768, 289, 289, 289, 768]
    - [110, 6378.0]
  - - [12544, 64, 1, 147, 12544, 12544, 12544, 147]
    - [61, 7285.0]
  - - [6272, 160, 1, 512, 6272, 6272, 6272, 512]
    - [96, 8028.0]
  - - [1225, 64, 32, 192, 1225, 1225, 1225, 192]
    - [77, 9082.0]
  - - [784, 64, 32, 256, 784, 784, 784, 256]
    - [108, 8284.0]
  - - [6272, 144, 1, 512, 6272, 6272, 6272, 512]
    - [54, 7259.0]
  - - [8192, 192, 1, 1280, 8192, 8192, 8192, 1280]
    - [73, 10666.0]
  - - [8192, 192, 1, 2048, 8192, 8192, 8192, 2048]
    - [50, 10918.0]
  - - [65, 6400, 1, 1024, 65, 65, 65, 1024]
    - [104, 5013.0]
  - - [512, 1290, 1, 2048, 512, 512, 512, 2048]
    - [83, 8516.0]
  - - [512, 2205, 1, 2048, 512, 512, 512, 2048]
    - [104, 10696.0]
  - - [64, 512, 16, 512, 64, 64, 64, 512]
    - [63, 7255.0]
  - - [512, 600, 1, 2048, 512, 512, 512, 2048]
    - [110, 8278.0]
  - - [512, 644, 1, 512, 512, 512, 512, 512]
    - [73, 5797.0]
  - - [512, 644, 1, 2048, 512, 512, 512, 2048]
    - [104, 6777.0]
  - - [512, 668, 1, 2048, 512, 512, 512, 2048]
    - [104, 6859.0]
  - - [512, 714, 1, 512, 512, 512, 512, 512]
    - [73, 6345.0]
  - - [512, 714, 1, 2048, 512, 512, 512, 2048]
    - [73, 7339.0]
  - - [512, 720, 1, 512, 512, 512, 512, 512]
    - [104, 6442.0]
  - - [512, 720, 1, 2048, 512, 512, 512, 2048]
    - [96, 7451.0]
  - - [512, 722, 1, 2048, 512, 512, 512, 2048]
    - [61, 7595.0]
  - - [512, 781, 1, 512, 512, 512, 512, 512]
    - [104, 6917.0]
  - - [512, 781, 1, 2048, 512, 512, 512, 2048]
    - [61, 7985.0]
  - - [512, 848, 1, 2048, 512, 512, 512, 2048]
    - [61, 8663.0]
  - - [512, 872, 1, 2048, 512, 512, 512, 2048]
    - [61, 8833.0]
  - - [512, 936, 1, 512, 512, 512, 512, 512]
    - [104, 8045.0]
  - - [512, 936, 1, 2048, 512, 512, 512, 2048]
    - [61, 9459.0]
  - - [512, 980, 1, 512, 512, 512, 512, 512]
    - [104, 7148.0]
  - - [512, 980, 1, 2048, 512, 512, 512, 2048]
    - [62, 8147.0]
  - - [512, 1139, 1, 2048, 512, 512, 512, 2048]
    - [105, 9214.0]
  - - [512, 1184, 1, 2048, 512, 512, 512, 2048]
    - [62, 9641.0]
  - - [512, 1186, 1, 2048, 512, 512, 512, 2048]
    - [62, 9675.0]
  - - [512, 1232, 1, 512, 512, 512, 512, 512]
    - [62, 8589.0]
  - - [512, 1232, 1, 2048, 512, 512, 512, 2048]
    - [62, 9999.0]
  - - [512, 1279, 1, 2048, 512, 512, 512, 2048]
    - [62, 10288.0]
  - - [512, 1290, 1, 512, 512, 512, 512, 512]
    - [96, 7703.0]
  - - [512, 1327, 1, 2048, 512, 512, 512, 2048]
    - [61, 8700.0]
  - - [512, 1331, 1, 2048, 512, 512, 512, 2048]
    - [61, 8837.0]
  - - [512, 1341, 1, 2048, 512, 512, 512, 2048]
    - [61, 8787.0]
  - - [512, 1350, 1, 512, 512, 512, 512, 512]
    - [104, 8154.0]
  - - [512, 1350, 1, 2048, 512, 512, 512, 2048]
    - [61, 8845.0]
  - - [512, 1359, 1, 2048, 512, 512, 512, 2048]
    - [83, 8951.0]
  - - [512, 1391, 1, 2048, 512, 512, 512, 2048]
    - [83, 9345.0]
  - - [512, 1424, 1, 512, 512, 512, 512, 512]
    - [104, 8480.0]
  - - [512, 1424, 1, 2048, 512, 512, 512, 2048]
    - [83, 9336.0]
  - - [512, 1458, 1, 512, 512, 512, 512, 512]
    - [104, 8876.0]
  - - [512, 1458, 1, 2048, 512, 512, 512, 2048]
    - [61, 9740.0]
  - - [512, 1462, 1, 512, 512, 512, 512, 512]
    - [73, 8559.0]
  - - [512, 1462, 1, 2048, 512, 512, 512, 2048]
    - [61, 9442.0]
  - - [512, 1467, 1, 2048, 512, 512, 512, 2048]
    - [104, 9511.0]
  - - [512, 1472, 1, 2048, 512, 512, 512, 2048]
    - [61, 9628.0]
  - - [512, 1520, 1, 512, 512, 512, 512, 512]
    - [104, 9060.0]
  - - [512, 1520, 1, 2048, 512, 512, 512, 2048]
    - [104, 9973.0]
  - - [512, 1596, 1, 512, 512, 512, 512, 512]
    - [61, 9314.0]
  - - [512, 1596, 1, 2048, 512, 512, 512, 2048]
    - [61, 10353.0]
  - - [512, 1599, 1, 512, 512, 512, 512, 512]
    - [104, 9241.0]
  - - [512, 1599, 1, 2048, 512, 512, 512, 2048]
    - [83, 10317.0]
  - - [512, 1615, 1, 512, 512, 512, 512, 512]
    - [73, 8842.0]
  - - [512, 1615, 1, 2048, 512, 512, 512, 2048]
    - [62, 9269.0]
  - - [512, 1680, 1, 512, 512, 512, 512, 512]
    - [84, 8710.0]
  - - [512, 1680, 1, 2048, 512, 512, 512, 2048]
    - [62, 9557.0]
  - - [512, 1709, 1, 2048, 512, 512, 512, 2048]
    - [62, 9734.0]
  - - [512, 1890, 1, 512, 512, 512, 512, 512]
    - [110, 9565.0]
  - - [512, 1902, 1, 2048, 512, 512, 512, 2048]
    - [62, 10644.0]
  - - [512, 1917, 1, 512, 512, 512, 512, 512]
    - [105, 9638.0]
  - - [512, 1917, 1, 2048, 512, 512, 512, 2048]
    - [84, 10769.0]
  - - [512, 2076, 1, 2048, 512, 512, 512, 2048]
    - [83, 10032.0]
  - - [512, 2195, 1, 2048, 512, 512, 512, 2048]
    - [61, 10593.0]
  - - [512, 2205, 1, 512, 512, 512, 512, 512]
    - [104, 9679.0]
  - - [2048, 198, 1, 512, 2048, 2048, 2048, 512]
    - [96, 5888.0]
  - - [2048, 207, 1, 512, 2048, 2048, 2048, 512]
    - [96, 6118.0]
  - - [2048, 208, 1, 512, 2048, 2048, 2048, 512]
    - [73, 6092.0]
  - - [2048, 245, 1, 512, 2048, 2048, 2048, 512]
    - [73, 7069.0]
  - - [2048, 246, 1, 512, 2048, 2048, 2048, 512]
    - [50, 7087.0]
  - - [2048, 264, 1, 512, 2048, 2048, 2048, 512]
    - [96, 7664.0]
  - - [2048, 401, 1, 512, 2048, 2048, 2048, 512]
    - [96, 8356.0]
  - - [2048, 439, 1, 512, 2048, 2048, 2048, 512]
    - [96, 9019.0]
  - - [2048, 443, 1, 512, 2048, 2048, 2048, 512]
    - [73, 9133.0]
  - - [2048, 446, 1, 512, 2048, 2048, 2048, 512]
    - [96, 9195.0]
  - - [2048, 465, 1, 512, 2048, 2048, 2048, 512]
    - [96, 8545.0]
  - - [2048, 468, 1, 512, 2048, 2048, 2048, 512]
    - [73, 8649.0]
  - - [2048, 493, 1, 512, 2048, 2048, 2048, 512]
    - [73, 9038.0]
  - - [2048, 495, 1, 512, 2048, 2048, 2048, 512]
    - [96, 9065.0]
  - - [2048, 511, 1, 512, 2048, 2048, 2048, 512]
    - [73, 9270.0]
  - - [2048, 512, 1, 512, 2048, 2048, 2048, 512]
    - [73, 9419.0]
  - - [2048, 540, 1, 512, 2048, 2048, 2048, 512]
    - [83, 9057.0]
  - - [2048, 550, 1, 512, 2048, 2048, 2048, 512]
    - [50, 8922.0]
  - - [2048, 560, 1, 512, 2048, 2048, 2048, 512]
    - [50, 9112.0]
  - - [2048, 600, 1, 512, 2048, 2048, 2048, 512]
    - [73, 9667.0]
  - - [64, 64, 496, 64, 64, 64, 64, 64]
    - [103, 5368.0]
  - - [64, 65, 496, 64, 64, 64, 64, 64]
    - [94, 4116.0]
  - - [64, 65, 496, 65, 64, 64, 64, 65]
    - [48, 3899.0]
  - - [64, 70, 216, 70, 64, 64, 64, 70]
    - [60, 3431.0]
  - - [64, 71, 216, 71, 64, 64, 64, 71]
    - [48, 3303.0]
  - - [64, 78, 248, 77, 64, 64, 64, 77]
    - [94, 3835.0]
  - - [64, 80, 152, 80, 64, 64, 64, 80]
    - [72, 3801.0]
  - - [64, 93, 344, 93, 64, 64, 64, 93]
    - [94, 4823.0]
  - - [64, 102, 312, 102, 64, 64, 64, 102]
    - [53, 5112.0]
  - - [64, 122, 264, 122, 64, 64, 64, 122]
    - [78, 5752.0]
  - - [64, 122, 264, 123, 64, 64, 64, 123]
    - [64, 6254.0]
  - - [64, 123, 264, 123, 64, 64, 64, 123]
    - [64, 6043.0]
  - - [64, 512, 96, 512, 64, 64, 64, 512]
    - [85, 7770.0]
  - - [64, 512, 128, 512, 64, 64, 64, 512]
    - [91, 7153.0]
  - - [64, 128, 512, 128, 64, 64, 64, 128]
    - [106, 8247.0]
  - - [64, 512, 64, 512, 64, 64, 64, 512]
    - [85, 8489.0]
  - - [2048, 512, 1, 2048, 2048, 2048, 2048, 2048]
    - [50, 10190.0]
  - - [512, 1600, 1, 32, 512, 512, 512, 32]
    - [82, 2945.0]
  - - [512, 1600, 1, 512, 512, 512, 512, 512]
    - [104, 9664.0]
  - - [560, 1600, 1, 1024, 560, 560, 560, 1024]
    - [61, 8264.0]
  - - [1024, 512, 1, 3072, 1024, 1024, 1024, 3072]
    - [51, 8576.0]
  - - [64, 192, 64, 1280, 64, 64, 64, 1280]
    - [56, 6526.0]
  - - [64, 320, 64, 1280, 64, 64, 64, 1280]
    - [64, 7366.0]
  - - [64, 384, 64, 1280, 64, 64, 64, 1280]
    - [86, 7147.0]
  - - [64, 448, 64, 1280, 64, 64, 64, 1280]
    - [91, 7413.0]
  - - [64, 192, 64, 2048, 64, 64, 64, 2048]
    - [63, 6438.0]
  - - [64, 320, 64, 2048, 64, 64, 64, 2048]
    - [69, 6644.0]
  - - [64, 384, 64, 2048, 64, 64, 64, 2048]
    - [91, 6538.0]
  - - [64, 448, 64, 2048, 64, 64, 64, 2048]
    - [113, 6577.0]
  - - [1225, 64, 64, 192, 1225, 1225, 1225, 192]
    - [50, 10506.0]
  - - [1225, 64, 64, 256, 1225, 1225, 1225, 256]
    - [99, 9974.0]
  - - [1225, 64, 64, 288, 1225, 1225, 1225, 288]
    - [50, 10511.0]
  - - [5329, 80, 64, 64, 5329, 5329, 5329, 64]
    - [94, 5601.0]
  - - [3136, 64, 64, 64, 3136, 3136, 3136, 64]
    - [73, 10276.0]
  - - [3136, 64, 64, 256, 3136, 3136, 3136, 256]
    - [77, 8923.0]
  - - [64, 192, 32, 1280, 64, 64, 64, 1280]
    - [63, 7320.0]
  - - [64, 320, 32, 1280, 64, 64, 64, 1280]
    - [63, 9233.0]
  - - [64, 384, 32, 1280, 64, 64, 64, 1280]
    - [106, 7717.0]
  - - [64, 448, 32, 1280, 64, 64, 64, 1280]
    - [92, 5015.0]
  - - [64, 192, 32, 2048, 64, 64, 64, 2048]
    - [85, 7256.0]
  - - [64, 320, 32, 2048, 64, 64, 64, 2048]
    - [63, 8168.0]
  - - [64, 384, 32, 2048, 64, 64, 64, 2048]
    - [63, 7346.0]
  - - [64, 448, 32, 2048, 64, 64, 64, 2048]
    - [112, 6902.0]
  - - [5329, 80, 32, 64, 5329, 5329, 5329, 64]
    - [96, 6281.0]
  - - [3136, 64, 32, 256, 3136, 3136, 3136, 256]
    - [77, 9611.0]
  - - [196, 256, 32, 1024, 196, 196, 196, 1024]
    - [104, 8409.0]
  - - [256, 4096, 1, 4, 256, 256, 256, 4]
    - [70, 797.0]
  - - [960, 1024, 1, 1024, 960, 960, 960, 1024]
    - [61, 9150.0]
  - - [768, 768, 1, 768, 768, 768, 768, 768]
    - [90, 9114.0]
  - - [768, 768, 1, 384, 768, 768, 768, 384]
    - [73, 8159.0]
  - - [100, 128, 120, 512, 100, 100, 100, 512]
    - [90, 7963.0]
  - - [100, 128, 139, 512, 100, 100, 100, 512]
    - [104, 8383.0]
  - - [100, 128, 160, 512, 100, 100, 100, 512]
    - [90, 8343.0]
  - - [22500, 64, 1, 147, 22500, 22500, 22500, 147]
    - [50, 8467.0]
  - - [1024, 960, 1, 1024, 1024, 1024, 1024, 1024]
    - [61, 10748.0]
  - - [1024, 616, 1, 1024, 1024, 1024, 1024, 1024]
    - [110, 9329.0]
  - - [64, 128, 128, 128, 64, 64, 64, 128]
    - [109, 4537.0]
  - - [64, 128, 160, 128, 64, 64, 64, 128]
    - [89, 5162.0]
  - - [1024, 1024, 1, 2, 1024, 1024, 1024, 2]
    - [93, 308.0]
  - - [64, 128, 624, 128, 64, 64, 64, 128]
    - [85, 7422.0]
  - - [1024, 780, 1, 1024, 1024, 1024, 1024, 1024]
    - [51, 8947.0]
  - - [64, 128, 640, 128, 64, 64, 64, 128]
    - [106, 7410.0]
  - - [1024, 800, 1, 1024, 1024, 1024, 1024, 1024]
    - [51, 9118.0]
  - - [64, 128, 656, 128, 64, 64, 64, 128]
    - [63, 7393.0]
  - - [1024, 820, 1, 1024, 1024, 1024, 1024, 1024]
    - [62, 9397.0]
  - - [64, 512, 80, 512, 64, 64, 64, 512]
    - [64, 7377.0]
  - - [1024, 385, 1, 1024, 1024, 1024, 1024, 1024]
    - [73, 7611.0]
  - - [1024, 462, 1, 1024, 1024, 1024, 1024, 1024]
    - [51, 7460.0]
  - - [64, 128, 144, 128, 64, 64, 64, 128]
    - [115, 3261.0]
  - - [1024, 960, 1, 64, 1024, 1024, 1024, 64]
    - [104, 5332.0]
  - - [64, 512, 256, 512, 64, 64, 64, 512]
    - [68, 7338.0]
  - - [64, 512, 40, 512, 64, 64, 64, 512]
    - [85, 7723.0]
  - - [96, 1024, 64, 1024, 96, 96, 96, 1024]
    - [90, 8132.0]
  - - [96, 1024, 128, 1024, 96, 96, 96, 1024]
    - [110, 8262.0]
  - - [64, 1024, 256, 1024, 64, 64, 64, 1024]
    - [112, 7367.0]
  - - [64, 1024, 32, 1024, 64, 64, 64, 1024]
    - [91, 6980.0]
  - - [64, 1024, 64, 1024, 64, 64, 64, 1024]
    - [68, 7166.0]
  - - [64, 1024, 128, 1024, 64, 64, 64, 1024]
    - [68, 7297.0]
  - - [64, 128, 1024, 128, 64, 64, 64, 128]
    - [68, 5662.0]
  - - [1024, 864, 1, 1024, 1024, 1024, 1024, 1024]
    - [62, 9714.0]
  - - [1024, 864, 1, 512, 1024, 1024, 1024, 512]
    - [73, 8879.0]
  - - [256, 3456, 1, 128, 256, 256, 256, 128]
    - [104, 6982.0]
  - - [256, 4096, 1, 128, 256, 256, 256, 128]
    - [50, 7342.0]
  - - [480, 864, 1, 1024, 480, 480, 480, 1024]
    - [83, 7841.0]
  - - [512, 864, 1, 256, 512, 512, 512, 256]
    - [104, 6236.0]
  - - [64, 128, 1280, 128, 64, 64, 64, 128]
    - [91, 5409.0]
  - - [64, 128, 1312, 128, 64, 64, 64, 128]
    - [68, 5358.0]
  - - [64, 512, 192, 512, 64, 64, 64, 512]
    - [68, 7294.0]
  - - [256, 4096, 1, 1, 256, 256, 256, 1]
    - [71, 206.0]
  - - [64, 128, 2048, 128, 64, 64, 64, 128]
    - [91, 5373.0]
  - - [64, 128, 1536, 128, 64, 64, 64, 128]
    - [91, 5359.0]
  - - [64, 128, 192, 128, 64, 64, 64, 128]
    - [66, 6729.0]
  - - [64, 384, 144, 384, 64, 64, 64, 384]
    - [63, 7933.0]
  - - [64, 512, 48, 512, 64, 64, 64, 512]
    - [63, 8182.0]
  - - [64, 128, 256, 128, 64, 64, 64, 128]
    - [106, 8051.0]
  - - [64, 384, 192, 384, 64, 64, 64, 384]
    - [66, 7311.0]
  - - [950, 512, 2, 2048, 950, 950, 950, 2048]
    - [61, 9399.0]
  - - [3400, 256, 1, 1024, 3400, 3400, 3400, 1024]
    - [51, 9458.0]
  - - [3800, 256, 1, 1024, 3800, 3800, 3800, 1024]
    - [84, 10515.0]
  - - [850, 512, 2, 2048, 850, 850, 850, 2048]
    - [105, 9651.0]
  - - [805, 512, 2, 2048, 805, 805, 805, 2048]
    - [62, 9196.0]
