library/src/blas3/Tensile/Logic/asm_full/navi22_Cijk_Ailk_Bljk_HBH.yaml
---
- {MinimumRequiredVersion: 4.28.0}
- navi22
- gfx1031
    SolutionIndex: 0
    SolutionNameMin: Cijk_Ailk_Bljk_HBH_MT128x64x8_SN_SU0_SUM0_TT8_8_WG16_8_1_WGM1
    SolutionIndex: 1
    SolutionNameMin: Cijk_Ailk_Bljk_HBH_MT128x128x8_SN_SU0_SUM0_TT8_16_WG16_8_1_WGM1
    SolutionIndex: 2
    SolutionNameMin: Cijk_Ailk_Bljk_HBH_MT128x64x16_SN_SU0_SUM0_TT8_8_WG16_8_1_WGM1
    SolutionIndex: 3
    SolutionNameMin: Cijk_Ailk_Bljk_HBH_MT128x128x16_SN_SU0_SUM0_TT8_16_WG16_8_1_WGM1
    SolutionIndex: 4
    SolutionNameMin: Cijk_Ailk_Bljk_HBH_MT128x128x16_SN_SU0_SUM0_TT8_8_WG16_16_1_WGM1
    SolutionIndex: 5
    SolutionNameMin: Cijk_Ailk_Bljk_HBH_MT128x256x16_SN_SU0_SUM0_TT8_16_WG16_16_1_WGM1
    SolutionIndex: 6
    SolutionNameMin: Cijk_Ailk_Bljk_HBH_MT128x128x32_SN_SU0_SUM0_TT8_16_WG16_8_1_WGM1
    SolutionIndex: 7
    SolutionNameMin: Cijk_Ailk_Bljk_HBH_MT128x128x32_SN_SU0_SUM0_TT8_8_WG16_16_1_WGM1
    SolutionIndex: 8
    SolutionNameMin: Cijk_Ailk_Bljk_HBH_MT128x64x8_SN_SU32_SUM3_TT8_8_WG16_8_1_WGM1
    SolutionIndex: 9
    SolutionNameMin: Cijk_Ailk_Bljk_HBH_MT128x128x8_SN_SU32_SUM3_TT8_16_WG16_8_1_WGM1
    SolutionIndex: 10
    SolutionNameMin: Cijk_Ailk_Bljk_HBH_MT128x64x16_SN_SU32_SUM3_TT8_8_WG16_8_1_WGM1
    SolutionIndex: 11
    SolutionNameMin: Cijk_Ailk_Bljk_HBH_MT128x128x16_SN_SU32_SUM3_TT8_16_WG16_8_1_WGM1
    SolutionIndex: 12
    SolutionNameMin: Cijk_Ailk_Bljk_HBH_MT128x256x16_SN_SU32_SUM3_TT8_16_WG16_16_1_WGM1
    SolutionIndex: 13
    SolutionNameMin: Cijk_Ailk_Bljk_HBH_MT128x64x8_SN_SU0_SUM0_TT8_8_WG16_8_1_WGM4
    SolutionIndex: 14
    SolutionNameMin: Cijk_Ailk_Bljk_HBH_MT128x128x8_SN_SU0_SUM0_TT8_16_WG16_8_1_WGM4
    SolutionIndex: 15
    SolutionNameMin: Cijk_Ailk_Bljk_HBH_MT128x64x16_SN_SU0_SUM0_TT8_8_WG16_8_1_WGM4
    SolutionIndex: 16
    SolutionNameMin: Cijk_Ailk_Bljk_HBH_MT128x128x16_SN_SU0_SUM0_TT8_16_WG16_8_1_WGM4
    SolutionIndex: 17
    SolutionNameMin: Cijk_Ailk_Bljk_HBH_MT128x128x16_SN_SU0_SUM0_TT8_8_WG16_16_1_WGM4
    SolutionIndex: 18
    SolutionNameMin: Cijk_Ailk_Bljk_HBH_MT128x256x16_SN_SU0_SUM0_TT8_16_WG16_16_1_WGM4
    SolutionIndex: 19
    SolutionNameMin: Cijk_Ailk_Bljk_HBH_MT128x64x8_SN_SU32_SUM3_TT8_8_WG16_8_1_WGM4
    SolutionIndex: 20
    SolutionNameMin: Cijk_Ailk_Bljk_HBH_MT128x128x8_SN_SU32_SUM3_TT8_16_WG16_8_1_WGM4
    SolutionIndex: 21
    SolutionNameMin: Cijk_Ailk_Bljk_HBH_MT128x128x16_SN_SU32_SUM3_TT8_16_WG16_8_1_WGM4
    SolutionIndex: 22
    SolutionNameMin: Cijk_Ailk_Bljk_HBH_MT128x256x16_SN_SU32_SUM3_TT8_16_WG16_16_1_WGM4
    SolutionIndex: 23
    SolutionNameMin: Cijk_Ailk_Bljk_HBH_MT128x64x8_SN_SU0_SUM0_TT8_8_WG16_8_1_WGM8
    SolutionIndex: 24
    SolutionNameMin: Cijk_Ailk_Bljk_HBH_MT128x128x8_SN_SU0_SUM0_TT8_16_WG16_8_1_WGM8
    SolutionIndex: 25
    SolutionNameMin: Cijk_Ailk_Bljk_HBH_MT128x64x16_SN_SU0_SUM0_TT8_8_WG16_8_1_WGM8
    SolutionIndex: 26
    SolutionNameMin: Cijk_Ailk_Bljk_HBH_MT128x128x16_SN_SU0_SUM0_TT8_16_WG16_8_1_WGM8
    SolutionIndex: 27
    SolutionNameMin: Cijk_Ailk_Bljk_HBH_MT128x128x16_SN_SU0_SUM0_TT8_8_WG16_16_1_WGM8
    SolutionIndex: 28
    SolutionNameMin: Cijk_Ailk_Bljk_HBH_MT128x256x16_SN_SU0_SUM0_TT8_16_WG16_16_1_WGM8
    SolutionIndex: 29
    SolutionNameMin: Cijk_Ailk_Bljk_HBH_MT128x64x8_SN_SU32_SUM3_TT8_8_WG16_8_1_WGM8
    SolutionIndex: 30
    SolutionNameMin: Cijk_Ailk_Bljk_HBH_MT128x128x8_SN_SU32_SUM3_TT8_16_WG16_8_1_WGM8
    SolutionIndex: 31
    SolutionNameMin: Cijk_Ailk_Bljk_HBH_MT128x128x16_SN_SU32_SUM3_TT8_16_WG16_8_1_WGM8
    SolutionIndex: 32
    SolutionNameMin: Cijk_Ailk_Bljk_HBH_MT128x128x16_SN_SU32_SUM3_TT8_8_WG16_16_1_WGM8
    SolutionIndex: 33
    SolutionNameMin: Cijk_Ailk_Bljk_HBH_MT128x256x16_SN_SU32_SUM3_TT8_16_WG16_16_1_WGM8
    SolutionIndex: 34
    SolutionNameMin: Cijk_Ailk_Bljk_HBH_MT128x64x16_SN_SU0_SUM0_TT8_8_WG16_8_1_WGM1
    SolutionIndex: 35
    SolutionNameMin: Cijk_Ailk_Bljk_HBH_MT128x128x16_SN_SU0_SUM0_TT8_16_WG16_8_1_WGM1
    SolutionIndex: 36
    SolutionNameMin: Cijk_Ailk_Bljk_HBH_MT128x128x16_SN_SU32_SUM3_TT8_16_WG16_8_1_WGM1
    SolutionIndex: 37
    SolutionNameMin: Cijk_Ailk_Bljk_HBH_MT128x256x16_SN_SU0_SUM0_TT8_16_WG16_16_1_WGM4
    SolutionIndex: 38
    SolutionNameMin: Cijk_Ailk_Bljk_HBH_MT128x256x16_SN_SU32_SUM3_TT8_16_WG16_16_1_WGM4
    SolutionIndex: 39
    SolutionNameMin: Cijk_Ailk_Bljk_HBH_MT128x64x16_SN_SU0_SUM0_TT8_8_WG16_8_1_WGM8
    SolutionIndex: 40
    SolutionNameMin: Cijk_Ailk_Bljk_HBH_MT128x256x16_SN_SU0_SUM0_TT8_16_WG16_16_1_WGM8
    SolutionIndex: 41
    SolutionNameMin: Cijk_Ailk_Bljk_HBH_MT128x64x16_SN_SU32_SUM3_TT8_8_WG16_8_1_WGM8
    SolutionIndex: 42
    SolutionNameMin: Cijk_Ailk_Bljk_HBH_MT128x128x16_SN_SU32_SUM3_TT8_16_WG16_8_1_WGM8
    SolutionIndex: 43
    SolutionNameMin: Cijk_Ailk_Bljk_HBH_MT64x64x8_SN_SU0_SUM0_TT8_8_WG8_8_1_WGM1
    SolutionIndex: 44
    SolutionNameMin: Cijk_Ailk_Bljk_HBH_MT128x64x8_SN_SU0_SUM0_TT8_8_WG16_8_1_WGM1
    SolutionIndex: 45
    SolutionNameMin: Cijk_Ailk_Bljk_HBH_MT64x64x16_SN_SU0_SUM0_TT8_8_WG8_8_1_WGM1
    SolutionIndex: 46
    SolutionNameMin: Cijk_Ailk_Bljk_HBH_MT128x64x16_SN_SU0_SUM0_TT8_8_WG16_8_1_WGM1
    SolutionIndex: 47
    SolutionNameMin: Cijk_Ailk_Bljk_HBH_MT128x128x16_SN_SU0_SUM0_TT8_8_WG16_16_1_WGM1
    SolutionIndex: 48
    SolutionNameMin: Cijk_Ailk_Bljk_HBH_MT64x64x32_SN_SU0_SUM0_TT8_8_WG8_8_1_WGM1
    SolutionIndex: 49
    SolutionNameMin: Cijk_Ailk_Bljk_HBH_MT128x64x32_SN_SU0_SUM0_TT8_8_WG16_8_1_WGM1
    SolutionIndex: 50
    SolutionNameMin: Cijk_Ailk_Bljk_HBH_MT128x64x8_SN_SU32_SUM3_TT8_8_WG16_8_1_WGM1
    SolutionIndex: 51
    SolutionNameMin: Cijk_Ailk_Bljk_HBH_MT64x64x16_SN_SU32_SUM3_TT8_8_WG8_8_1_WGM1
    SolutionIndex: 52
    SolutionNameMin: Cijk_Ailk_Bljk_HBH_MT128x64x16_SN_SU32_SUM3_TT8_8_WG16_8_1_WGM1
    SolutionIndex: 53
    SolutionNameMin: Cijk_Ailk_Bljk_HBH_MT128x128x16_SN_SU32_SUM3_TT8_8_WG16_16_1_WGM1
    SolutionIndex: 54
    SolutionNameMin: Cijk_Ailk_Bljk_HBH_MT64x64x32_SN_SU32_SUM3_TT8_8_WG8_8_1_WGM1
    SolutionIndex: 55
    SolutionNameMin: Cijk_Ailk_Bljk_HBH_MT64x64x8_SN_SU0_SUM0_TT8_8_WG8_8_1_WGM4
    SolutionIndex: 56
    SolutionNameMin: Cijk_Ailk_Bljk_HBH_MT128x64x8_SN_SU0_SUM0_TT8_8_WG16_8_1_WGM4
    SolutionIndex: 57
    SolutionNameMin: Cijk_Ailk_Bljk_HBH_MT64x64x16_SN_SU0_SUM0_TT8_8_WG8_8_1_WGM4
    SolutionIndex: 58
    SolutionNameMin: Cijk_Ailk_Bljk_HBH_MT128x64x16_SN_SU0_SUM0_TT8_8_WG16_8_1_WGM4
    SolutionIndex: 59
    SolutionNameMin: Cijk_Ailk_Bljk_HBH_MT128x128x16_SN_SU0_SUM0_TT8_8_WG16_16_1_WGM4
    SolutionIndex: 60
    SolutionNameMin: Cijk_Ailk_Bljk_HBH_MT64x64x32_SN_SU0_SUM0_TT8_8_WG8_8_1_WGM4
    SolutionIndex: 61
    SolutionNameMin: Cijk_Ailk_Bljk_HBH_MT64x64x8_SN_SU32_SUM3_TT8_8_WG8_8_1_WGM4
    SolutionIndex: 62
    SolutionNameMin: Cijk_Ailk_Bljk_HBH_MT128x64x8_SN_SU32_SUM3_TT8_8_WG16_8_1_WGM4
    SolutionIndex: 63
    SolutionNameMin: Cijk_Ailk_Bljk_HBH_MT64x64x16_SN_SU32_SUM3_TT8_8_WG8_8_1_WGM4
    SolutionIndex: 64
    SolutionNameMin: Cijk_Ailk_Bljk_HBH_MT128x64x16_SN_SU32_SUM3_TT8_8_WG16_8_1_WGM4
    SolutionIndex: 65
    SolutionNameMin: Cijk_Ailk_Bljk_HBH_MT128x128x16_SN_SU32_SUM3_TT8_8_WG16_16_1_WGM4
    SolutionIndex: 66
    SolutionNameMin: Cijk_Ailk_Bljk_HBH_MT64x64x32_SN_SU32_SUM3_TT8_8_WG8_8_1_WGM4
    SolutionIndex: 67
    SolutionNameMin: Cijk_Ailk_Bljk_HBH_MT64x64x8_SN_SU0_SUM0_TT8_8_WG8_8_1_WGM8
    SolutionIndex: 68
    SolutionNameMin: Cijk_Ailk_Bljk_HBH_MT128x64x8_SN_SU0_SUM0_TT8_8_WG16_8_1_WGM8
    SolutionIndex: 69
    SolutionNameMin: Cijk_Ailk_Bljk_HBH_MT64x64x16_SN_SU0_SUM0_TT8_8_WG8_8_1_WGM8
    SolutionIndex: 70
    SolutionNameMin: Cijk_Ailk_Bljk_HBH_MT128x64x16_SN_SU0_SUM0_TT8_8_WG16_8_1_WGM8
    SolutionIndex: 71
    SolutionNameMin: Cijk_Ailk_Bljk_HBH_MT128x128x16_SN_SU0_SUM0_TT8_8_WG16_16_1_WGM8
    SolutionIndex: 72
    SolutionNameMin: Cijk_Ailk_Bljk_HBH_MT64x64x8_SN_SU32_SUM3_TT8_8_WG8_8_1_WGM8
    SolutionIndex: 73
    SolutionNameMin: Cijk_Ailk_Bljk_HBH_MT128x64x8_SN_SU32_SUM3_TT8_8_WG16_8_1_WGM8
    SolutionIndex: 74
    SolutionNameMin: Cijk_Ailk_Bljk_HBH_MT64x64x16_SN_SU32_SUM3_TT8_8_WG8_8_1_WGM8
    SolutionIndex: 75
    SolutionNameMin: Cijk_Ailk_Bljk_HBH_MT128x64x16_SN_SU32_SUM3_TT8_8_WG16_8_1_WGM8
    SolutionIndex: 76
    SolutionNameMin: Cijk_Ailk_Bljk_HBH_MT128x128x16_SN_SU32_SUM3_TT8_8_WG16_16_1_WGM8
    SolutionIndex: 77
    SolutionNameMin: Cijk_Ailk_Bljk_HBH_MT64x64x32_SN_SU32_SUM3_TT8_8_WG8_8_1_WGM8
    SolutionIndex: 78
    SolutionNameMin: Cijk_Ailk_Bljk_HBH_MT64x64x16_SN_SU0_SUM0_TT8_8_WG8_8_1_WGM1
    SolutionIndex: 79
    SolutionNameMin: Cijk_Ailk_Bljk_HBH_MT128x64x16_SN_SU0_SUM0_TT8_8_WG16_8_1_WGM1
    SolutionIndex: 80
    SolutionNameMin: Cijk_Ailk_Bljk_HBH_MT128x128x16_SN_SU0_SUM0_TT8_8_WG16_16_1_WGM1
    SolutionIndex: 81
    SolutionNameMin: Cijk_Ailk_Bljk_HBH_MT128x128x16_SN_SU32_SUM3_TT8_8_WG16_16_1_WGM1
    SolutionIndex: 82
    SolutionNameMin: Cijk_Ailk_Bljk_HBH_MT128x64x16_SN_SU0_SUM0_TT8_8_WG16_8_1_WGM4
    SolutionIndex: 83
    SolutionNameMin: Cijk_Ailk_Bljk_HBH_MT128x128x16_SN_SU0_SUM0_TT8_8_WG16_16_1_WGM4
    SolutionIndex: 84
    SolutionNameMin: Cijk_Ailk_Bljk_HBH_MT128x64x16_SN_SU0_SUM0_TT8_8_WG16_8_1_WGM8
    SolutionIndex: 85
    SolutionNameMin: Cijk_Ailk_Bljk_HBH_MT128x128x16_SN_SU0_SUM0_TT8_8_WG16_16_1_WGM8
    SolutionIndex: 86
    SolutionNameMin: Cijk_Ailk_Bljk_HBH_MT16x16x8_SN_SU0_SUM0_TT2_2_WG8_8_1_WGM1
    SolutionIndex: 87
    SolutionNameMin: Cijk_Ailk_Bljk_HBH_MT32x32x8_SN_SU0_SUM0_TT4_4_WG8_8_1_WGM1
    SolutionIndex: 88
    SolutionNameMin: Cijk_Ailk_Bljk_HBH_MT32x16x8_SN_SU0_SUM0_TT2_2_WG16_8_1_WGM1
    SolutionIndex: 89
    SolutionNameMin: Cijk_Ailk_Bljk_HBH_MT64x32x8_SN_SU0_SUM0_TT4_4_WG16_8_1_WGM1
    SolutionIndex: 90
    SolutionNameMin: Cijk_Ailk_Bljk_HBH_MT32x32x8_SN_SU0_SUM0_TT2_2_WG16_16_1_WGM1
    SolutionIndex: 91
    SolutionNameMin: Cijk_Ailk_Bljk_HBH_MT16x16x16_SN_SU0_SUM0_TT2_2_WG8_8_1_WGM1
    SolutionIndex: 92
    SolutionNameMin: Cijk_Ailk_Bljk_HBH_MT32x32x16_SN_SU0_SUM0_TT4_4_WG8_8_1_WGM1
    SolutionIndex: 93
    SolutionNameMin: Cijk_Ailk_Bljk_HBH_MT32x16x16_SN_SU0_SUM0_TT2_2_WG16_8_1_WGM1
    SolutionIndex: 94
    SolutionNameMin: Cijk_Ailk_Bljk_HBH_MT64x32x16_SN_SU0_SUM0_TT4_4_WG16_8_1_WGM1
    SolutionIndex: 95
    SolutionNameMin: Cijk_Ailk_Bljk_HBH_MT32x32x16_SN_SU0_SUM0_TT2_2_WG16_16_1_WGM1
    SolutionIndex: 96
    SolutionNameMin: Cijk_Ailk_Bljk_HBH_MT16x16x32_SN_SU0_SUM0_TT2_2_WG8_8_1_WGM1
    SolutionIndex: 97
    SolutionNameMin: Cijk_Ailk_Bljk_HBH_MT32x16x32_SN_SU0_SUM0_TT2_2_WG16_8_1_WGM1
    SolutionIndex: 98
    SolutionNameMin: Cijk_Ailk_Bljk_HBH_MT16x16x8_SN_SU32_SUM3_TT2_2_WG8_8_1_WGM1
    SolutionIndex: 99
    SolutionNameMin: Cijk_Ailk_Bljk_HBH_MT32x16x8_SN_SU32_SUM3_TT2_2_WG16_8_1_WGM1
    SolutionIndex: 100
    SolutionNameMin: Cijk_Ailk_Bljk_HBH_MT64x32x8_SN_SU32_SUM3_TT4_4_WG16_8_1_WGM1
    SolutionIndex: 101
    SolutionNameMin: Cijk_Ailk_Bljk_HBH_MT32x32x8_SN_SU32_SUM3_TT2_2_WG16_16_1_WGM1
    SolutionIndex: 102
    SolutionNameMin: Cijk_Ailk_Bljk_HBH_MT64x64x8_SN_SU32_SUM3_TT4_4_WG16_16_1_WGM1
    SolutionIndex: 103
    SolutionNameMin: Cijk_Ailk_Bljk_HBH_MT16x16x16_SN_SU32_SUM3_TT2_2_WG8_8_1_WGM1
    SolutionIndex: 104
    SolutionNameMin: Cijk_Ailk_Bljk_HBH_MT32x32x16_SN_SU32_SUM3_TT4_4_WG8_8_1_WGM1
    SolutionIndex: 105
    SolutionNameMin: Cijk_Ailk_Bljk_HBH_MT32x16x16_SN_SU32_SUM3_TT2_2_WG16_8_1_WGM1
    SolutionIndex: 106
    SolutionNameMin: Cijk_Ailk_Bljk_HBH_MT64x32x16_SN_SU32_SUM3_TT4_4_WG16_8_1_WGM1
    SolutionIndex: 107
    SolutionNameMin: Cijk_Ailk_Bljk_HBH_MT32x32x16_SN_SU32_SUM3_TT2_2_WG16_16_1_WGM1
    SolutionIndex: 108
    SolutionNameMin: Cijk_Ailk_Bljk_HBH_MT16x16x32_SN_SU32_SUM3_TT2_2_WG8_8_1_WGM1
    SolutionIndex: 109
    SolutionNameMin: Cijk_Ailk_Bljk_HBH_MT32x16x32_SN_SU32_SUM3_TT2_2_WG16_8_1_WGM1
    SolutionIndex: 110
    SolutionNameMin: Cijk_Ailk_Bljk_HBH_MT32x16x8_SN_SU0_SUM0_TT2_2_WG16_8_1_WGM4
    SolutionIndex: 111
    SolutionNameMin: Cijk_Ailk_Bljk_HBH_MT64x32x8_SN_SU0_SUM0_TT4_4_WG16_8_1_WGM4
    SolutionIndex: 112
    SolutionNameMin: Cijk_Ailk_Bljk_HBH_MT32x32x8_SN_SU0_SUM0_TT2_2_WG16_16_1_WGM4
    SolutionIndex: 113
    SolutionNameMin: Cijk_Ailk_Bljk_HBH_MT32x32x16_SN_SU0_SUM0_TT4_4_WG8_8_1_WGM4
    SolutionIndex: 114
    SolutionNameMin: Cijk_Ailk_Bljk_HBH_MT32x16x16_SN_SU0_SUM0_TT2_2_WG16_8_1_WGM4
    SolutionIndex: 115
    SolutionNameMin: Cijk_Ailk_Bljk_HBH_MT64x32x16_SN_SU0_SUM0_TT4_4_WG16_8_1_WGM4
    SolutionIndex: 116
    SolutionNameMin: Cijk_Ailk_Bljk_HBH_MT32x16x32_SN_SU0_SUM0_TT2_2_WG16_8_1_WGM4
    SolutionIndex: 117
    SolutionNameMin: Cijk_Ailk_Bljk_HBH_MT32x32x8_SN_SU32_SUM3_TT4_4_WG8_8_1_WGM4
    SolutionIndex: 118
    SolutionNameMin: Cijk_Ailk_Bljk_HBH_MT32x16x8_SN_SU32_SUM3_TT2_2_WG16_8_1_WGM4
    SolutionIndex: 119
    SolutionNameMin: Cijk_Ailk_Bljk_HBH_MT64x32x8_SN_SU32_SUM3_TT4_4_WG16_8_1_WGM4
    SolutionIndex: 120
    SolutionNameMin: Cijk_Ailk_Bljk_HBH_MT32x32x8_SN_SU32_SUM3_TT2_2_WG16_16_1_WGM4
    SolutionIndex: 121
    SolutionNameMin: Cijk_Ailk_Bljk_HBH_MT16x16x16_SN_SU32_SUM3_TT2_2_WG8_8_1_WGM4
    SolutionIndex: 122
    SolutionNameMin: Cijk_Ailk_Bljk_HBH_MT32x32x16_SN_SU32_SUM3_TT4_4_WG8_8_1_WGM4
    SolutionIndex: 123
    SolutionNameMin: Cijk_Ailk_Bljk_HBH_MT32x16x16_SN_SU32_SUM3_TT2_2_WG16_8_1_WGM4
    SolutionIndex: 124
    SolutionNameMin: Cijk_Ailk_Bljk_HBH_MT64x32x16_SN_SU32_SUM3_TT4_4_WG16_8_1_WGM4
    SolutionIndex: 125
    SolutionNameMin: Cijk_Ailk_Bljk_HBH_MT32x16x32_SN_SU32_SUM3_TT2_2_WG16_8_1_WGM4
    SolutionIndex: 126
    SolutionNameMin: Cijk_Ailk_Bljk_HBH_MT64x32x8_SN_SU0_SUM0_TT4_4_WG16_8_1_WGM8
    SolutionIndex: 127
    SolutionNameMin: Cijk_Ailk_Bljk_HBH_MT32x16x16_SN_SU0_SUM0_TT2_2_WG16_8_1_WGM8
    SolutionIndex: 128
    SolutionNameMin: Cijk_Ailk_Bljk_HBH_MT64x32x16_SN_SU0_SUM0_TT4_4_WG16_8_1_WGM8
    SolutionIndex: 129
    SolutionNameMin: Cijk_Ailk_Bljk_HBH_MT16x16x32_SN_SU0_SUM0_TT2_2_WG8_8_1_WGM8
    SolutionIndex: 130
    SolutionNameMin: Cijk_Ailk_Bljk_HBH_MT32x16x32_SN_SU0_SUM0_TT2_2_WG16_8_1_WGM8
    SolutionIndex: 131
    SolutionNameMin: Cijk_Ailk_Bljk_HBH_MT64x32x8_SN_SU32_SUM3_TT4_4_WG16_8_1_WGM8
    SolutionIndex: 132
    SolutionNameMin: Cijk_Ailk_Bljk_HBH_MT32x32x8_SN_SU32_SUM3_TT2_2_WG16_16_1_WGM8
    SolutionIndex: 133
    SolutionNameMin: Cijk_Ailk_Bljk_HBH_MT16x16x16_SN_SU32_SUM3_TT2_2_WG8_8_1_WGM8
    SolutionIndex: 134
    SolutionNameMin: Cijk_Ailk_Bljk_HBH_MT32x32x16_SN_SU32_SUM3_TT4_4_WG8_8_1_WGM8
    SolutionIndex: 135
    SolutionNameMin: Cijk_Ailk_Bljk_HBH_MT32x16x16_SN_SU32_SUM3_TT2_2_WG16_8_1_WGM8
    SolutionIndex: 136
    SolutionNameMin: Cijk_Ailk_Bljk_HBH_MT64x32x16_SN_SU32_SUM3_TT4_4_WG16_8_1_WGM8
    SolutionIndex: 137
    SolutionNameMin: Cijk_Ailk_Bljk_HBH_MT32x16x32_SN_SU32_SUM3_TT2_2_WG16_8_1_WGM8
    SolutionIndex: 138
    SolutionNameMin: Cijk_Ailk_Bljk_HBH_MT32x8x8_SN_SU0_SUM0_TT2_2_WG16_4_1_WGM1
    SolutionIndex: 139
    SolutionNameMin: Cijk_Ailk_Bljk_HBH_MT64x8x8_SN_SU0_SUM0_TT4_2_WG16_4_1_WGM1
    SolutionIndex: 140
    SolutionNameMin: Cijk_Ailk_Bljk_HBH_MT64x8x16_SN_SU0_SUM0_TT4_2_WG16_4_1_WGM1
    SolutionIndex: 141
    SolutionNameMin: Cijk_Ailk_Bljk_HBH_MT64x16x16_SN_SU0_SUM0_TT4_2_WG16_8_1_WGM1
    SolutionIndex: 142
    SolutionNameMin: Cijk_Ailk_Bljk_HBH_MT64x8x16_SN_SU0_SUM0_TT2_2_WG32_4_1_WGM1
    SolutionIndex: 143
    SolutionNameMin: Cijk_Ailk_Bljk_HBH_MT128x8x16_SN_SU0_SUM0_TT4_2_WG32_4_1_WGM1
    SolutionIndex: 144
    SolutionNameMin: Cijk_Ailk_Bljk_HBH_MT64x16x32_SN_SU0_SUM0_TT4_2_WG16_8_1_WGM1
    SolutionIndex: 145
    SolutionNameMin: Cijk_Ailk_Bljk_HBH_MT64x8x32_SN_SU0_SUM0_TT2_2_WG32_4_1_WGM1
    SolutionIndex: 146
    SolutionNameMin: Cijk_Ailk_Bljk_HBH_MT128x8x32_SN_SU0_SUM0_TT4_2_WG32_4_1_WGM1
    SolutionIndex: 147
    SolutionNameMin: Cijk_Ailk_Bljk_HBH_MT64x16x16_SN_SU32_SUM3_TT4_2_WG16_8_1_WGM1
    SolutionIndex: 148
    SolutionNameMin: Cijk_Ailk_Bljk_HBH_MT128x8x16_SN_SU32_SUM3_TT4_2_WG32_4_1_WGM1
    SolutionIndex: 149
    SolutionNameMin: Cijk_Ailk_Bljk_HBH_MT64x8x32_SN_SU32_SUM3_TT2_2_WG32_4_1_WGM1
    SolutionIndex: 150
    SolutionNameMin: Cijk_Ailk_Bljk_HBH_MT64x8x8_SN_SU0_SUM0_TT4_2_WG16_4_1_WGM4
    SolutionIndex: 151
    SolutionNameMin: Cijk_Ailk_Bljk_HBH_MT64x16x8_SN_SU0_SUM0_TT4_2_WG16_8_1_WGM4
    SolutionIndex: 152
    SolutionNameMin: Cijk_Ailk_Bljk_HBH_MT64x8x16_SN_SU0_SUM0_TT4_2_WG16_4_1_WGM4
    SolutionIndex: 153
    SolutionNameMin: Cijk_Ailk_Bljk_HBH_MT64x16x16_SN_SU0_SUM0_TT4_2_WG16_8_1_WGM4
    SolutionIndex: 154
    SolutionNameMin: Cijk_Ailk_Bljk_HBH_MT64x8x16_SN_SU0_SUM0_TT2_2_WG32_4_1_WGM4
    SolutionIndex: 155
    SolutionNameMin: Cijk_Ailk_Bljk_HBH_MT128x8x16_SN_SU0_SUM0_TT4_2_WG32_4_1_WGM4
    SolutionIndex: 156
    SolutionNameMin: Cijk_Ailk_Bljk_HBH_MT64x16x16_SN_SU32_SUM3_TT4_2_WG16_8_1_WGM4
    SolutionIndex: 157
    SolutionNameMin: Cijk_Ailk_Bljk_HBH_MT64x8x32_SN_SU32_SUM3_TT2_2_WG32_4_1_WGM4
    SolutionIndex: 158
    SolutionNameMin: Cijk_Ailk_Bljk_HBH_MT64x8x8_SN_SU0_SUM0_TT4_2_WG16_4_1_WGM8
    SolutionIndex: 159
    SolutionNameMin: Cijk_Ailk_Bljk_HBH_MT32x8x16_SN_SU0_SUM0_TT2_2_WG16_4_1_WGM8
    SolutionIndex: 160
    SolutionNameMin: Cijk_Ailk_Bljk_HBH_MT64x16x16_SN_SU0_SUM0_TT4_2_WG16_8_1_WGM8
    SolutionIndex: 161
    SolutionNameMin: Cijk_Ailk_Bljk_HBH_MT64x8x16_SN_SU0_SUM0_TT2_2_WG32_4_1_WGM8
    SolutionIndex: 162
    SolutionNameMin: Cijk_Ailk_Bljk_HBH_MT128x8x16_SN_SU0_SUM0_TT4_2_WG32_4_1_WGM8
    SolutionIndex: 163
    SolutionNameMin: Cijk_Ailk_Bljk_HBH_MT64x8x32_SN_SU0_SUM0_TT2_2_WG32_4_1_WGM8
    SolutionIndex: 164
    SolutionNameMin: Cijk_Ailk_Bljk_HBH_MT128x8x32_SN_SU0_SUM0_TT4_2_WG32_4_1_WGM8
    SolutionIndex: 165
    SolutionNameMin: Cijk_Ailk_Bljk_HBH_MT128x8x16_SN_SU32_SUM3_TT4_2_WG32_4_1_WGM8
    SolutionIndex: 166
    SolutionNameMin: Cijk_Ailk_Bljk_HBH_MT32x16x16_SN_SU0_SUM0_TT2_2_WG16_8_1_WGM1
    SolutionIndex: 167
    SolutionNameMin: Cijk_Ailk_Bljk_HBH_MT32x16x32_SN_SU0_SUM0_TT2_2_WG16_8_1_WGM1
    SolutionIndex: 168
    SolutionNameMin: Cijk_Ailk_Bljk_HBH_MT64x32x8_SN_SU32_SUM3_TT4_4_WG16_8_1_WGM1
    SolutionIndex: 169
    SolutionNameMin: Cijk_Ailk_Bljk_HBH_MT32x16x16_SN_SU0_SUM0_TT2_2_WG16_8_1_WGM4
    SolutionIndex: 170
    SolutionNameMin: Cijk_Ailk_Bljk_HBH_MT32x16x32_SN_SU0_SUM0_TT2_2_WG16_8_1_WGM4
    SolutionIndex: 171
    SolutionNameMin: Cijk_Ailk_Bljk_HBH_MT32x16x16_SN_SU32_SUM3_TT2_2_WG16_8_1_WGM4
    SolutionIndex: 172
    SolutionNameMin: Cijk_Ailk_Bljk_HBH_MT32x16x16_SN_SU0_SUM0_TT2_2_WG16_8_1_WGM8
    SolutionIndex: 173
    SolutionNameMin: Cijk_Ailk_Bljk_HBH_MT32x16x16_SN_SU32_SUM3_TT2_2_WG16_8_1_WGM8
    SolutionIndex: 174
    SolutionNameMin: Cijk_Ailk_Bljk_HBH_MT32x16x32_SN_SU32_SUM3_TT2_2_WG16_8_1_WGM8
- - - [2944, 4288, 1, 1280, 2944, 2944, 2944, 1280]
    - [26, 21908.0]
  - - [2368, 5888, 1, 256, 2368, 2368, 2368, 256]
    - [16, 20886.0]
  - - [5888, 1856, 1, 3328, 5888, 5888, 5888, 3328]
    - [3, 21616.0]
  - - [5888, 2944, 1, 3328, 5888, 5888, 5888, 3328]
    - [31, 22867.0]
  - - [1856, 4288, 1, 256, 1856, 1856, 1856, 256]
    - [3, 19489.0]
  - - [5056, 5056, 1, 3328, 5056, 5056, 5056, 3328]
    - [16, 22392.0]
  - - [1408, 5888, 1, 1280, 1408, 1408, 1408, 1280]
    - [16, 21984.0]
  - - [1024, 3584, 1, 3328, 1024, 1024, 1024, 3328]
    - [3, 21066.0]
  - - [448, 3584, 1, 3328, 448, 448, 448, 3328]
    - [18, 17290.0]
  - - [5888, 1408, 1, 1280, 5888, 5888, 5888, 1280]
    - [26, 22111.0]
  - - [1024, 2368, 1, 256, 1024, 1024, 1024, 256]
    - [16, 17546.0]
  - - [5056, 6784, 1, 1280, 5056, 5056, 5056, 1280]
    - [3, 22609.0]
  - - [5056, 5056, 1, 1280, 5056, 5056, 5056, 1280]
    - [3, 22282.0]
  - - [4288, 6784, 1, 256, 4288, 4288, 4288, 256]
    - [16, 21672.0]
  - - [6784, 448, 1, 256, 6784, 6784, 6784, 256]
    - [15, 17145.0]
  - - [5056, 256, 1, 1280, 5056, 5056, 5056, 1280]
    - [3, 20403.0]
  - - [5888, 704, 1, 1280, 5888, 5888, 5888, 1280]
    - [26, 20025.0]
  - - [3584, 1024, 1, 256, 3584, 3584, 3584, 256]
    - [11, 19573.0]
  - - [6784, 4288, 1, 3328, 6784, 6784, 6784, 3328]
    - [16, 22573.0]
  - - [1856, 2368, 1, 3328, 1856, 1856, 1856, 3328]
    - [3, 20208.0]
  - - [5888, 2944, 1, 1280, 5888, 5888, 5888, 1280]
    - [16, 22829.0]
  - - [5888, 1024, 1, 256, 5888, 5888, 5888, 256]
    - [3, 20802.0]
  - - [1408, 2944, 1, 256, 1408, 1408, 1408, 256]
    - [3, 20446.0]
  - - [6784, 5056, 1, 3328, 6784, 6784, 6784, 3328]
    - [21, 22721.0]
  - - [5056, 5056, 1, 256, 5056, 5056, 5056, 256]
    - [16, 21240.0]
  - - [1024, 3584, 1, 1280, 1024, 1024, 1024, 1280]
    - [11, 20727.0]
  - - [2368, 2944, 1, 1280, 2368, 2368, 2368, 1280]
    - [11, 21776.0]
  - - [6784, 6784, 1, 1280, 6784, 6784, 6784, 1280]
    - [16, 22982.0]
  - - [1408, 4288, 1, 1280, 1408, 1408, 1408, 1280]
    - [26, 21560.0]
  - - [3584, 4288, 1, 1280, 3584, 3584, 3584, 1280]
    - [3, 22329.0]
  - - [2368, 704, 1, 1280, 2368, 2368, 2368, 1280]
    - [16, 17893.0]
  - - [5056, 4288, 1, 3328, 5056, 5056, 5056, 3328]
    - [11, 22310.0]
  - - [3584, 2368, 1, 3328, 3584, 3584, 3584, 3328]
    - [16, 21614.0]
  - - [5888, 6784, 1, 1280, 5888, 5888, 5888, 1280]
    - [3, 22974.0]
  - - [6784, 448, 1, 1280, 6784, 6784, 6784, 1280]
    - [11, 18376.0]
  - - [2944, 5888, 1, 256, 2944, 2944, 2944, 256]
    - [3, 22071.0]
  - - [4288, 2944, 1, 256, 4288, 4288, 4288, 256]
    - [3, 20993.0]
  - - [5056, 2368, 1, 1280, 5056, 5056, 5056, 1280]
    - [31, 21814.0]
  - - [448, 3584, 1, 1280, 448, 448, 448, 1280]
    - [16, 17262.0]
  - - [6784, 5888, 1, 256, 6784, 6784, 6784, 256]
    - [3, 22332.0]
  - - [1024, 1408, 1, 256, 1024, 1024, 1024, 256]
    - [3, 16419.0]
  - - [2368, 2368, 1, 3328, 2368, 2368, 2368, 3328]
    - [3, 20558.0]
  - - [5056, 704, 1, 3328, 5056, 5056, 5056, 3328]
    - [3, 20224.0]
  - - [1408, 1856, 1, 256, 1408, 1408, 1408, 256]
    - [31, 16405.0]
  - - [5888, 1856, 1, 256, 5888, 5888, 5888, 256]
    - [26, 20595.0]
  - - [704, 5888, 1, 256, 704, 704, 704, 256]
    - [21, 18353.0]
  - - [3584, 704, 1, 3328, 3584, 3584, 3584, 3328]
    - [3, 18958.0]
  - - [1408, 1408, 1, 256, 1408, 1408, 1408, 256]
    - [16, 16132.0]
  - - [448, 4288, 1, 256, 448, 448, 448, 256]
    - [16, 14456.0]
  - - [704, 2368, 1, 1280, 704, 704, 704, 1280]
    - [26, 17402.0]
  - - [1856, 2368, 1, 1280, 1856, 1856, 1856, 1280]
    - [21, 19736.0]
  - - [1408, 1408, 1, 3328, 1408, 1408, 1408, 3328]
    - [16, 18893.0]
  - - [1408, 1024, 1, 1280, 1408, 1408, 1408, 1280]
    - [3, 18012.0]
  - - [704, 6784, 1, 256, 704, 704, 704, 256]
    - [21, 17225.0]
  - - [6784, 704, 1, 256, 6784, 6784, 6784, 256]
    - [3, 17471.0]
  - - [5056, 704, 1, 256, 5056, 5056, 5056, 256]
    - [2, 16424.0]
  - - [1408, 3584, 1, 256, 1408, 1408, 1408, 256]
    - [16, 19597.0]
  - - [3584, 4288, 1, 3328, 3584, 3584, 3584, 3328]
    - [16, 21961.0]
  - - [5888, 1856, 1, 1280, 5888, 5888, 5888, 1280]
    - [3, 21688.0]
  - - [2368, 3584, 1, 1280, 2368, 2368, 2368, 1280]
    - [16, 21702.0]
  - - [2944, 3584, 1, 3328, 2944, 2944, 2944, 3328]
    - [3, 22441.0]
  - - [6784, 2944, 1, 256, 6784, 6784, 6784, 256]
    - [3, 22095.0]
  - - [1856, 2368, 1, 256, 1856, 1856, 1856, 256]
    - [26, 18542.0]
  - - [3584, 6784, 1, 3328, 3584, 3584, 3584, 3328]
    - [3, 22877.0]
  - - [5056, 4288, 1, 1280, 5056, 5056, 5056, 1280]
    - [3, 22217.0]
  - - [6784, 1856, 1, 3328, 6784, 6784, 6784, 3328]
    - [3, 22052.0]
  - - [1408, 5056, 1, 1280, 1408, 1408, 1408, 1280]
    - [16, 22186.0]
  - - [6784, 5888, 1, 3328, 6784, 6784, 6784, 3328]
    - [16, 23067.0]
  - - [2368, 5056, 1, 1280, 2368, 2368, 2368, 1280]
    - [3, 21725.0]
  - - [1024, 5056, 1, 1280, 1024, 1024, 1024, 1280]
    - [16, 21897.0]
  - - [4288, 1024, 1, 256, 4288, 4288, 4288, 256]
    - [3, 19624.0]
  - - [2368, 1408, 1, 256, 2368, 2368, 2368, 256]
    - [11, 18718.0]
  - - [5888, 448, 1, 1280, 5888, 5888, 5888, 1280]
    - [16, 17715.0]
  - - [704, 5888, 1, 3328, 704, 704, 704, 3328]
    - [5, 20403.0]
  - - [1024, 6784, 1, 1280, 1024, 1024, 1024, 1280]
    - [16, 21831.0]
  - - [3584, 2944, 1, 1280, 3584, 3584, 3584, 1280]
    - [31, 22313.0]
  - - [1408, 5056, 1, 3328, 1408, 1408, 1408, 3328]
    - [3, 22384.0]
  - - [1856, 1856, 1, 3328, 1856, 1856, 1856, 3328]
    - [3, 19488.0]
  - - [2368, 2368, 1, 256, 2368, 2368, 2368, 256]
    - [16, 19074.0]
  - - [4288, 4288, 1, 1280, 4288, 4288, 4288, 1280]
    - [16, 22128.0]
  - - [5888, 1024, 1, 1280, 5888, 5888, 5888, 1280]
    - [16, 21826.0]
  - - [704, 6784, 1, 3328, 704, 704, 704, 3328]
    - [3, 20568.0]
  - - [5888, 5888, 1, 3328, 5888, 5888, 5888, 3328]
    - [26, 23060.0]
  - - [5056, 1024, 1, 1280, 5056, 5056, 5056, 1280]
    - [3, 21832.0]
  - - [448, 5888, 1, 3328, 448, 448, 448, 3328]
    - [5, 18023.0]
  - - [1024, 2944, 1, 1280, 1024, 1024, 1024, 1280]
    - [3, 19940.0]
  - - [5056, 5888, 1, 1280, 5056, 5056, 5056, 1280]
    - [3, 22609.0]
  - - [448, 6784, 1, 256, 448, 448, 448, 256]
    - [21, 16498.0]
  - - [3584, 5888, 1, 256, 3584, 3584, 3584, 256]
    - [21, 22027.0]
  - - [2944, 3584, 1, 256, 2944, 2944, 2944, 256]
    - [3, 21373.0]
  - - [6784, 1024, 1, 3328, 6784, 6784, 6784, 3328]
    - [5, 22143.0]
  - - [6784, 2944, 1, 3328, 6784, 6784, 6784, 3328]
    - [5, 21789.0]
  - - [6784, 2368, 1, 1280, 6784, 6784, 6784, 1280]
    - [11, 21980.0]
  - - [4288, 3584, 1, 256, 4288, 4288, 4288, 256]
    - [11, 21305.0]
  - - [4288, 5888, 1, 1280, 4288, 4288, 4288, 1280]
    - [3, 22436.0]
  - - [4288, 1856, 1, 1280, 4288, 4288, 4288, 1280]
    - [3, 21146.0]
  - - [1856, 2944, 1, 3328, 1856, 1856, 1856, 3328]
    - [3, 21028.0]
  - - [256, 6784, 1, 3328, 256, 256, 256, 3328]
    - [21, 19283.0]
  - - [5056, 1024, 1, 256, 5056, 5056, 5056, 256]
    - [12, 18652.0]
  - - [5056, 1856, 1, 3328, 5056, 5056, 5056, 3328]
    - [3, 21787.0]
  - - [5056, 256, 1, 3328, 5056, 5056, 5056, 3328]
    - [18, 20464.0]
  - - [1024, 5888, 1, 1280, 1024, 1024, 1024, 1280]
    - [3, 21467.0]
  - - [5056, 3584, 1, 256, 5056, 5056, 5056, 256]
    - [11, 21586.0]
  - - [1856, 1024, 1, 1280, 1856, 1856, 1856, 1280]
    - [5, 20239.0]
  - - [1856, 1856, 1, 1280, 1856, 1856, 1856, 1280]
    - [3, 18984.0]
  - - [1856, 1024, 1, 3328, 1856, 1856, 1856, 3328]
    - [5, 20612.0]
  - - [6784, 1024, 1, 256, 6784, 6784, 6784, 256]
    - [16, 20873.0]
  - - [5056, 5888, 1, 3328, 5056, 5056, 5056, 3328]
    - [3, 22710.0]
  - - [1856, 1024, 1, 256, 1856, 1856, 1856, 256]
    - [4, 16572.0]
  - - [5056, 1408, 1, 3328, 5056, 5056, 5056, 3328]
    - [16, 22211.0]
  - - [448, 5888, 1, 256, 448, 448, 448, 256]
    - [16, 14913.0]
  - - [1408, 6784, 1, 3328, 1408, 1408, 1408, 3328]
    - [3, 22289.0]
  - - [2944, 1408, 1, 3328, 2944, 2944, 2944, 3328]
    - [26, 21656.0]
  - - [2944, 4288, 1, 3328, 2944, 2944, 2944, 3328]
    - [5, 22239.0]
  - - [5056, 2944, 1, 256, 5056, 5056, 5056, 256]
    - [16, 21424.0]
  - - [2368, 1856, 1, 256, 2368, 2368, 2368, 256]
    - [11, 18475.0]
  - - [1408, 3584, 1, 3328, 1408, 1408, 1408, 3328]
    - [3, 21796.0]
  - - [2368, 6784, 1, 256, 2368, 2368, 2368, 256]
    - [16, 21055.0]
  - - [4288, 2368, 1, 3328, 4288, 4288, 4288, 3328]
    - [3, 21551.0]
  - - [704, 3584, 1, 1280, 704, 704, 704, 1280]
    - [3, 18201.0]
  - - [1408, 5888, 1, 3328, 1408, 1408, 1408, 3328]
    - [18, 22095.0]
  - - [1856, 5056, 1, 256, 1856, 1856, 1856, 256]
    - [21, 19585.0]
  - - [6784, 6784, 1, 256, 6784, 6784, 6784, 256]
    - [16, 22377.0]
  - - [2368, 4288, 1, 1280, 2368, 2368, 2368, 1280]
    - [3, 21402.0]
  - - [3584, 1856, 1, 1280, 3584, 3584, 3584, 1280]
    - [16, 21696.0]
  - - [3584, 448, 1, 256, 3584, 3584, 3584, 256]
    - [2, 16574.0]
  - - [3584, 3584, 1, 1280, 3584, 3584, 3584, 1280]
    - [3, 22476.0]
  - - [256, 6784, 1, 256, 256, 256, 256, 256]
    - [3, 17179.0]
  - - [1856, 3584, 1, 3328, 1856, 1856, 1856, 3328]
    - [3, 21878.0]
  - - [3584, 3584, 1, 256, 3584, 3584, 3584, 256]
    - [21, 21543.0]
  - - [6784, 4288, 1, 1280, 6784, 6784, 6784, 1280]
    - [11, 22479.0]
  - - [3584, 5056, 1, 256, 3584, 3584, 3584, 256]
    - [11, 21324.0]
  - - [2944, 2368, 1, 1280, 2944, 2944, 2944, 1280]
    - [21, 21778.0]
  - - [6784, 3584, 1, 256, 6784, 6784, 6784, 256]
    - [3, 22080.0]
  - - [1856, 1408, 1, 256, 1856, 1856, 1856, 256]
    - [11, 17485.0]
  - - [2944, 2944, 1, 3328, 2944, 2944, 2944, 3328]
    - [3, 22438.0]
  - - [5056, 6784, 1, 256, 5056, 5056, 5056, 256]
    - [21, 21877.0]
  - - [1408, 4288, 1, 3328, 1408, 1408, 1408, 3328]
    - [3, 22009.0]
  - - [6784, 256, 1, 1280, 6784, 6784, 6784, 1280]
    - [3, 18543.0]
  - - [2368, 704, 1, 3328, 2368, 2368, 2368, 3328]
    - [3, 18027.0]
  - - [3584, 6784, 1, 256, 3584, 3584, 3584, 256]
    - [26, 22071.0]
  - - [5056, 1856, 1, 256, 5056, 5056, 5056, 256]
    - [11, 20181.0]
  - - [704, 4288, 1, 256, 704, 704, 704, 256]
    - [21, 16859.0]
  - - [1408, 6784, 1, 1280, 1408, 1408, 1408, 1280]
    - [16, 22207.0]
  - - [5056, 2368, 1, 3328, 5056, 5056, 5056, 3328]
    - [3, 21964.0]
  - - [2944, 4288, 1, 256, 2944, 2944, 2944, 256]
    - [16, 21029.0]
  - - [1408, 3584, 1, 1280, 1408, 1408, 1408, 1280]
    - [3, 21578.0]
  - - [2368, 6784, 1, 3328, 2368, 2368, 2368, 3328]
    - [16, 20977.0]
  - - [5056, 704, 1, 1280, 5056, 5056, 5056, 1280]
    - [16, 19350.0]
  - - [1856, 4288, 1, 3328, 1856, 1856, 1856, 3328]
    - [18, 21214.0]
  - - [1408, 5888, 1, 256, 1408, 1408, 1408, 256]
    - [3, 21219.0]
  - - [704, 2944, 1, 1280, 704, 704, 704, 1280]
    - [3, 19246.0]
  - - [3584, 704, 1, 1280, 3584, 3584, 3584, 1280]
    - [26, 18304.0]
  - - [5888, 5056, 1, 256, 5888, 5888, 5888, 256]
    - [11, 21817.0]
  - - [3584, 448, 1, 3328, 3584, 3584, 3584, 3328]
    - [25, 17676.0]
  - - [704, 2368, 1, 3328, 704, 704, 704, 3328]
    - [18, 18080.0]
  - - [448, 5056, 1, 3328, 448, 448, 448, 3328]
    - [5, 19059.0]
  - - [4288, 448, 1, 256, 4288, 4288, 4288, 256]
    - [0, 15151.0]
  - - [5888, 2368, 1, 256, 5888, 5888, 5888, 256]
    - [31, 21068.0]
  - - [6784, 704, 1, 3328, 6784, 6784, 6784, 3328]
    - [3, 20560.0]
  - - [1408, 2944, 1, 3328, 1408, 1408, 1408, 3328]
    - [26, 21684.0]
  - - [4288, 4288, 1, 256, 4288, 4288, 4288, 256]
    - [26, 21218.0]
  - - [2368, 704, 1, 256, 2368, 2368, 2368, 256]
    - [10, 15485.0]
  - - [3584, 2368, 1, 256, 3584, 3584, 3584, 256]
    - [16, 20493.0]
  - - [5888, 5056, 1, 1280, 5888, 5888, 5888, 1280]
    - [3, 22614.0]
  - - [3584, 3584, 1, 3328, 3584, 3584, 3584, 3328]
    - [3, 22580.0]
  - - [5888, 6784, 1, 256, 5888, 5888, 5888, 256]
    - [16, 22327.0]
  - - [4288, 2944, 1, 3328, 4288, 4288, 4288, 3328]
    - [3, 22191.0]
  - - [256, 5056, 1, 1280, 256, 256, 256, 1280]
    - [31, 19436.0]
  - - [6784, 5888, 1, 1280, 6784, 6784, 6784, 1280]
    - [3, 22978.0]
  - - [5888, 4288, 1, 1280, 5888, 5888, 5888, 1280]
    - [26, 22424.0]
  - - [1408, 1856, 1, 1280, 1408, 1408, 1408, 1280]
    - [3, 19326.0]
  - - [5888, 448, 1, 3328, 5888, 5888, 5888, 3328]
    - [16, 18030.0]
  - - [704, 5888, 1, 1280, 704, 704, 704, 1280]
    - [3, 19616.0]
  - - [5056, 2944, 1, 3328, 5056, 5056, 5056, 3328]
    - [26, 22408.0]
  - - [448, 4288, 1, 1280, 448, 448, 448, 1280]
    - [31, 17012.0]
  - - [3584, 704, 1, 256, 3584, 3584, 3584, 256]
    - [25, 15731.0]
  - - [3584, 1408, 1, 3328, 3584, 3584, 3584, 3328]
    - [21, 21683.0]
  - - [2368, 1024, 1, 1280, 2368, 2368, 2368, 1280]
    - [18, 19107.0]
  - - [2944, 6784, 1, 1280, 2944, 2944, 2944, 1280]
    - [11, 22814.0]
  - - [1856, 6784, 1, 256, 1856, 1856, 1856, 256]
    - [16, 20798.0]
  - - [4288, 448, 1, 3328, 4288, 4288, 4288, 3328]
    - [21, 18175.0]
  - - [6784, 704, 1, 1280, 6784, 6784, 6784, 1280]
    - [26, 19958.0]
  - - [5888, 1024, 1, 3328, 5888, 5888, 5888, 3328]
    - [3, 22048.0]
  - - [704, 6784, 1, 1280, 704, 704, 704, 1280]
    - [11, 20257.0]
  - - [5056, 1024, 1, 3328, 5056, 5056, 5056, 3328]
    - [3, 22034.0]
  - - [704, 5056, 1, 1280, 704, 704, 704, 1280]
    - [3, 19519.0]
  - - [2944, 1856, 1, 256, 2944, 2944, 2944, 256]
    - [31, 18711.0]
  - - [5888, 5056, 1, 3328, 5888, 5888, 5888, 3328]
    - [16, 22684.0]
  - - [3584, 6784, 1, 1280, 3584, 3584, 3584, 1280]
    - [3, 22743.0]
  - - [1856, 5888, 1, 256, 1856, 1856, 1856, 256]
    - [3, 20680.0]
  - - [4288, 4288, 1, 3328, 4288, 4288, 4288, 3328]
    - [16, 22249.0]
  - - [4288, 1408, 1, 1280, 4288, 4288, 4288, 1280]
    - [26, 21668.0]
  - - [4288, 2368, 1, 256, 4288, 4288, 4288, 256]
    - [16, 20261.0]
  - - [2944, 5056, 1, 1280, 2944, 2944, 2944, 1280]
    - [21, 22434.0]
  - - [6784, 2368, 1, 3328, 6784, 6784, 6784, 3328]
    - [21, 21605.0]
  - - [4288, 1856, 1, 3328, 4288, 4288, 4288, 3328]
    - [16, 21123.0]
  - - [1856, 2944, 1, 1280, 1856, 1856, 1856, 1280]
    - [31, 20721.0]
  - - [4288, 6784, 1, 3328, 4288, 4288, 4288, 3328]
    - [21, 22589.0]
  - - [3584, 1024, 1, 1280, 3584, 3584, 3584, 1280]
    - [11, 20507.0]
  - - [1024, 4288, 1, 256, 1024, 1024, 1024, 256]
    - [2, 16903.0]
  - - [5888, 3584, 1, 3328, 5888, 5888, 5888, 3328]
    - [3, 22848.0]
  - - [5056, 3584, 1, 3328, 5056, 5056, 5056, 3328]
    - [26, 21678.0]
  - - [2368, 1408, 1, 1280, 2368, 2368, 2368, 1280]
    - [16, 19607.0]
  - - [5056, 2944, 1, 1280, 5056, 5056, 5056, 1280]
    - [3, 22532.0]
  - - [1024, 6784, 1, 256, 1024, 1024, 1024, 256]
    - [3, 20814.0]
  - - [2944, 5056, 1, 3328, 2944, 2944, 2944, 3328]
    - [16, 21858.0]
  - - [3584, 2944, 1, 256, 3584, 3584, 3584, 256]
    - [31, 20597.0]
  - - [5056, 6784, 1, 3328, 5056, 5056, 5056, 3328]
    - [3, 22716.0]
  - - [3584, 4288, 1, 256, 3584, 3584, 3584, 256]
    - [26, 20978.0]
  - - [1856, 6784, 1, 3328, 1856, 1856, 1856, 3328]
    - [3, 22035.0]
  - - [5056, 1408, 1, 1280, 5056, 5056, 5056, 1280]
    - [3, 22215.0]
  - - [5888, 5888, 1, 256, 5888, 5888, 5888, 256]
    - [26, 22314.0]
  - - [4288, 1024, 1, 1280, 4288, 4288, 4288, 1280]
    - [21, 21082.0]
  - - [448, 6784, 1, 3328, 448, 448, 448, 3328]
    - [3, 18828.0]
  - - [2944, 1408, 1, 1280, 2944, 2944, 2944, 1280]
    - [16, 21244.0]
  - - [2944, 1856, 1, 3328, 2944, 2944, 2944, 3328]
    - [3, 21018.0]
  - - [448, 5056, 1, 256, 448, 448, 448, 256]
    - [11, 14695.0]
  - - [3584, 5888, 1, 1280, 3584, 3584, 3584, 1280]
    - [16, 22775.0]
  - - [6784, 1856, 1, 1280, 6784, 6784, 6784, 1280]
    - [3, 21883.0]
  - - [5888, 256, 1, 3328, 5888, 5888, 5888, 3328]
    - [11, 19635.0]
  - - [1856, 5888, 1, 3328, 1856, 1856, 1856, 3328]
    - [16, 21680.0]
  - - [3584, 1408, 1, 256, 3584, 3584, 3584, 256]
    - [16, 19450.0]
  - - [704, 3584, 1, 3328, 704, 704, 704, 3328]
    - [26, 18779.0]
  - - [5056, 448, 1, 1280, 5056, 5056, 5056, 1280]
    - [26, 18051.0]
  - - [3584, 1856, 1, 3328, 3584, 3584, 3584, 3328]
    - [26, 21698.0]
  - - [2944, 1024, 1, 256, 2944, 2944, 2944, 256]
    - [26, 17939.0]
  - - [2368, 4288, 1, 3328, 2368, 2368, 2368, 3328]
    - [3, 21363.0]
  - - [1024, 1408, 1, 1280, 1024, 1024, 1024, 1280]
    - [11, 18222.0]
  - - [6784, 5056, 1, 256, 6784, 6784, 6784, 256]
    - [11, 21949.0]
  - - [4288, 5888, 1, 256, 4288, 4288, 4288, 256]
    - [11, 21701.0]
  - - [2944, 6784, 1, 256, 2944, 2944, 2944, 256]
    - [11, 22130.0]
  - - [2368, 2368, 1, 1280, 2368, 2368, 2368, 1280]
    - [11, 20292.0]
  - - [1856, 3584, 1, 1280, 1856, 1856, 1856, 1280]
    - [3, 21672.0]
  - - [3584, 1408, 1, 1280, 3584, 3584, 3584, 1280]
    - [16, 21633.0]
  - - [5056, 3584, 1, 1280, 5056, 5056, 5056, 1280]
    - [11, 22529.0]
  - - [256, 5888, 1, 256, 256, 256, 256, 256]
    - [11, 17289.0]
  - - [1856, 1408, 1, 3328, 1856, 1856, 1856, 3328]
    - [3, 19626.0]
  - - [1024, 4288, 1, 3328, 1024, 1024, 1024, 3328]
    - [5, 21547.0]
  - - [2944, 2368, 1, 3328, 2944, 2944, 2944, 3328]
    - [3, 21936.0]
  - - [704, 4288, 1, 3328, 704, 704, 704, 3328]
    - [16, 18580.0]
  - - [1024, 1856, 1, 1280, 1024, 1024, 1024, 1280]
    - [16, 19574.0]
  - - [6784, 1856, 1, 256, 6784, 6784, 6784, 256]
    - [11, 20809.0]
  - - [1024, 5888, 1, 256, 1024, 1024, 1024, 256]
    - [11, 20707.0]
  - - [1408, 2368, 1, 256, 1408, 1408, 1408, 256]
    - [3, 18317.0]
  - - [2944, 704, 1, 3328, 2944, 2944, 2944, 3328]
    - [3, 19574.0]
  - - [2944, 2944, 1, 1280, 2944, 2944, 2944, 1280]
    - [16, 22229.0]
  - - [6784, 256, 1, 3328, 6784, 6784, 6784, 3328]
    - [11, 19290.0]
  - - [1408, 5056, 1, 256, 1408, 1408, 1408, 256]
    - [21, 19987.0]
  - - [1408, 4288, 1, 256, 1408, 1408, 1408, 256]
    - [21, 19491.0]
  - - [5888, 2368, 1, 1280, 5888, 5888, 5888, 1280]
    - [3, 22065.0]
  - - [2368, 5888, 1, 1280, 2368, 2368, 2368, 1280]
    - [26, 22066.0]
  - - [5888, 256, 1, 1280, 5888, 5888, 5888, 1280]
    - [3, 19275.0]
  - - [2368, 1856, 1, 3328, 2368, 2368, 2368, 3328]
    - [3, 20007.0]
  - - [2944, 704, 1, 256, 2944, 2944, 2944, 256]
    - [2, 15514.0]
  - - [2368, 6784, 1, 1280, 2368, 2368, 2368, 1280]
    - [3, 22029.0]
  - - [2368, 1024, 1, 3328, 2368, 2368, 2368, 3328]
    - [5, 20414.0]
  - - [1856, 4288, 1, 1280, 1856, 1856, 1856, 1280]
    - [16, 21110.0]
  - - [704, 3584, 1, 256, 704, 704, 704, 256]
    - [3, 16812.0]
  - - [704, 2944, 1, 3328, 704, 704, 704, 3328]
    - [11, 19707.0]
  - - [1856, 5056, 1, 3328, 1856, 1856, 1856, 3328]
    - [3, 21720.0]
  - - [3584, 5056, 1, 1280, 3584, 3584, 3584, 1280]
    - [16, 22505.0]
  - - [2944, 1024, 1, 3328, 2944, 2944, 2944, 3328]
    - [16, 20472.0]
  - - [1408, 6784, 1, 256, 1408, 1408, 1408, 256]
    - [26, 21164.0]
  - - [6784, 1408, 1, 3328, 6784, 6784, 6784, 3328]
    - [3, 22315.0]
  - - [1024, 2368, 1, 1280, 1024, 1024, 1024, 1280]
    - [31, 18387.0]
  - - [6784, 2944, 1, 1280, 6784, 6784, 6784, 1280]
    - [3, 22806.0]
  - - [3584, 448, 1, 1280, 3584, 3584, 3584, 1280]
    - [25, 17470.0]
  - - [2944, 6784, 1, 3328, 2944, 2944, 2944, 3328]
    - [26, 22890.0]
  - - [448, 5056, 1, 1280, 448, 448, 448, 1280]
    - [16, 18246.0]
  - - [4288, 5056, 1, 1280, 4288, 4288, 4288, 1280]
    - [16, 22151.0]
  - - [4288, 704, 1, 256, 4288, 4288, 4288, 256]
    - [16, 16910.0]
  - - [5888, 704, 1, 256, 5888, 5888, 5888, 256]
    - [26, 18290.0]
  - - [256, 5888, 1, 3328, 256, 256, 256, 3328]
    - [11, 19527.0]
  - - [6784, 4288, 1, 256, 6784, 6784, 6784, 256]
    - [11, 21587.0]
  - - [5888, 256, 1, 256, 5888, 5888, 5888, 256]
    - [11, 17335.0]
  - - [6784, 1024, 1, 1280, 6784, 6784, 6784, 1280]
    - [11, 21863.0]
  - - [2944, 704, 1, 1280, 2944, 2944, 2944, 1280]
    - [16, 19144.0]
  - - [6784, 3584, 1, 1280, 6784, 6784, 6784, 1280]
    - [3, 22787.0]
  - - [1408, 2944, 1, 1280, 1408, 1408, 1408, 1280]
    - [16, 21574.0]
  - - [1408, 2368, 1, 3328, 1408, 1408, 1408, 3328]
    - [3, 20592.0]
  - - [2368, 2944, 1, 256, 2368, 2368, 2368, 256]
    - [3, 19742.0]
  - - [3584, 1856, 1, 256, 3584, 3584, 3584, 256]
    - [31, 19194.0]
  - - [4288, 3584, 1, 1280, 4288, 4288, 4288, 1280]
    - [3, 22270.0]
  - - [4288, 2944, 1, 1280, 4288, 4288, 4288, 1280]
    - [26, 22016.0]
  - - [5056, 448, 1, 3328, 5056, 5056, 5056, 3328]
    - [3, 18920.0]
  - - [4288, 5056, 1, 3328, 4288, 4288, 4288, 3328]
    - [16, 22252.0]
  - - [256, 5056, 1, 3328, 256, 256, 256, 3328]
    - [12, 20481.0]
  - - [5056, 2368, 1, 256, 5056, 5056, 5056, 256]
    - [26, 19759.0]
  - - [4288, 704, 1, 3328, 4288, 4288, 4288, 3328]
    - [11, 18799.0]
  - - [448, 3584, 1, 256, 448, 448, 448, 256]
    - [16, 14362.0]
  - - [1024, 1408, 1, 3328, 1024, 1024, 1024, 3328]
    - [3, 18660.0]
  - - [2944, 5888, 1, 1280, 2944, 2944, 2944, 1280]
    - [11, 22752.0]
  - - [5888, 3584, 1, 256, 5888, 5888, 5888, 256]
    - [3, 22023.0]
  - - [1408, 1856, 1, 3328, 1408, 1408, 1408, 3328]
    - [16, 19751.0]
  - - [6784, 1408, 1, 1280, 6784, 6784, 6784, 1280]
    - [3, 22190.0]
  - - [704, 2944, 1, 256, 704, 704, 704, 256]
    - [17, 16196.0]
  - - [2944, 5888, 1, 3328, 2944, 2944, 2944, 3328]
    - [16, 21499.0]
  - - [1408, 1408, 1, 1280, 1408, 1408, 1408, 1280]
    - [26, 18071.0]
  - - [448, 4288, 1, 3328, 448, 448, 448, 3328]
    - [11, 17886.0]
  - - [704, 2368, 1, 256, 704, 704, 704, 256]
    - [31, 14216.0]
  - - [5888, 2368, 1, 3328, 5888, 5888, 5888, 3328]
    - [16, 21695.0]
  - - [4288, 5056, 1, 256, 4288, 4288, 4288, 256]
    - [11, 21137.0]
  - - [4288, 448, 1, 1280, 4288, 4288, 4288, 1280]
    - [3, 17795.0]
  - - [5888, 704, 1, 3328, 5888, 5888, 5888, 3328]
    - [3, 20320.0]
  - - [4288, 3584, 1, 3328, 4288, 4288, 4288, 3328]
    - [21, 22126.0]
  - - [1024, 6784, 1, 3328, 1024, 1024, 1024, 3328]
    - [3, 22024.0]
  - - [1408, 1024, 1, 256, 1408, 1408, 1408, 256]
    - [29, 15706.0]
  - - [6784, 6784, 1, 3328, 6784, 6784, 6784, 3328]
    - [16, 23029.0]
  - - [704, 5056, 1, 3328, 704, 704, 704, 3328]
    - [5, 20177.0]
  - - [3584, 5056, 1, 3328, 3584, 3584, 3584, 3328]
    - [26, 21195.0]
  - - [2368, 2944, 1, 3328, 2368, 2368, 2368, 3328]
    - [16, 21644.0]
  - - [2368, 3584, 1, 256, 2368, 2368, 2368, 256]
    - [3, 20028.0]
  - - [3584, 2368, 1, 1280, 3584, 3584, 3584, 1280]
    - [3, 21681.0]
  - - [1856, 1856, 1, 256, 1856, 1856, 1856, 256]
    - [16, 17787.0]
  - - [4288, 1408, 1, 3328, 4288, 4288, 4288, 3328]
    - [3, 21992.0]
  - - [5888, 1408, 1, 3328, 5888, 5888, 5888, 3328]
    - [3, 22315.0]
  - - [256, 5056, 1, 256, 256, 256, 256, 256]
    - [15, 14076.0]
  - - [2368, 5056, 1, 256, 2368, 2368, 2368, 256]
    - [16, 20654.0]
  - - [1024, 5056, 1, 256, 1024, 1024, 1024, 256]
    - [21, 20106.0]
  - - [2368, 1408, 1, 3328, 2368, 2368, 2368, 3328]
    - [3, 20580.0]
  - - [5888, 448, 1, 256, 5888, 5888, 5888, 256]
    - [2, 15595.0]
  - - [6784, 5056, 1, 1280, 6784, 6784, 6784, 1280]
    - [3, 22560.0]
  - - [4288, 6784, 1, 1280, 4288, 4288, 4288, 1280]
    - [16, 22455.0]
  - - [6784, 1408, 1, 256, 6784, 6784, 6784, 256]
    - [3, 21026.0]
  - - [5888, 4288, 1, 256, 5888, 5888, 5888, 256]
    - [16, 21640.0]
  - - [5056, 5888, 1, 256, 5056, 5056, 5056, 256]
    - [16, 21719.0]
  - - [2368, 1024, 1, 256, 2368, 2368, 2368, 256]
    - [3, 17615.0]
  - - [1856, 6784, 1, 1280, 1856, 1856, 1856, 1280]
    - [31, 21786.0]
  - - [6784, 448, 1, 3328, 6784, 6784, 6784, 3328]
    - [3, 18805.0]
  - - [5056, 1856, 1, 1280, 5056, 5056, 5056, 1280]
    - [16, 21552.0]
  - - [1408, 1024, 1, 3328, 1408, 1408, 1408, 3328]
    - [3, 18802.0]
  - - [5888, 3584, 1, 1280, 5888, 5888, 5888, 1280]
    - [3, 22775.0]
  - - [1024, 2944, 1, 256, 1024, 1024, 1024, 256]
    - [3, 18972.0]
  - - [448, 6784, 1, 1280, 448, 448, 448, 1280]
    - [3, 18442.0]
  - - [704, 5056, 1, 256, 704, 704, 704, 256]
    - [22, 16312.0]
  - - [3584, 1024, 1, 3328, 3584, 3584, 3584, 3328]
    - [26, 20763.0]
  - - [2944, 1856, 1, 1280, 2944, 2944, 2944, 1280]
    - [16, 20821.0]
  - - [5056, 256, 1, 256, 5056, 5056, 5056, 256]
    - [3, 16888.0]
  - - [2368, 3584, 1, 3328, 2368, 2368, 2368, 3328]
    - [3, 21883.0]
  - - [3584, 5888, 1, 3328, 3584, 3584, 3584, 3328]
    - [21, 22878.0]
  - - [2944, 3584, 1, 1280, 2944, 2944, 2944, 1280]
    - [26, 22221.0]
  - - [1856, 5888, 1, 1280, 1856, 1856, 1856, 1280]
    - [11, 21683.0]
  - - [4288, 1408, 1, 256, 4288, 4288, 4288, 256]
    - [3, 20178.0]
  - - [4288, 2368, 1, 1280, 4288, 4288, 4288, 1280]
    - [3, 21378.0]
  - - [2944, 5056, 1, 256, 2944, 2944, 2944, 256]
    - [3, 21391.0]
  - - [6784, 2368, 1, 256, 6784, 6784, 6784, 256]
    - [3, 21034.0]
  - - [4288, 1856, 1, 256, 4288, 4288, 4288, 256]
    - [16, 19858.0]
  - - [1856, 2944, 1, 256, 1856, 1856, 1856, 256]
    - [26, 19310.0]
  - - [1856, 1408, 1, 1280, 1856, 1856, 1856, 1280]
    - [3, 19324.0]
  - - [1024, 4288, 1, 1280, 1024, 1024, 1024, 1280]
    - [16, 20787.0]
  - - [2368, 5056, 1, 3328, 2368, 2368, 2368, 3328]
    - [21, 21381.0]
  - - [4288, 1024, 1, 3328, 4288, 4288, 4288, 3328]
    - [3, 21513.0]
  - - [1024, 5056, 1, 3328, 1024, 1024, 1024, 3328]
    - [5, 21994.0]
  - - [1024, 1856, 1, 3328, 1024, 1024, 1024, 3328]
    - [16, 20432.0]
  - - [3584, 2944, 1, 3328, 3584, 3584, 3584, 3328]
    - [31, 22416.0]
  - - [5888, 2944, 1, 256, 5888, 5888, 5888, 256]
    - [3, 21785.0]
  - - [5056, 4288, 1, 256, 5056, 5056, 5056, 256]
    - [16, 21184.0]
  - - [1024, 3584, 1, 256, 1024, 1024, 1024, 256]
    - [3, 19549.0]
  - - [5056, 1408, 1, 256, 5056, 5056, 5056, 256]
    - [31, 20258.0]
  - - [5888, 5888, 1, 1280, 5888, 5888, 5888, 1280]
    - [16, 22916.0]
  - - [448, 5888, 1, 1280, 448, 448, 448, 1280]
    - [3, 17500.0]
  - - [4288, 704, 1, 1280, 4288, 4288, 4288, 1280]
    - [16, 18172.0]
  - - [2944, 1408, 1, 256, 2944, 2944, 2944, 256]
    - [11, 19238.0]
  - - [2368, 5888, 1, 3328, 2368, 2368, 2368, 3328]
    - [26, 21400.0]
  - - [2368, 1856, 1, 1280, 2368, 2368, 2368, 1280]
    - [16, 19501.0]
  - - [5888, 4288, 1, 3328, 5888, 5888, 5888, 3328]
    - [3, 22555.0]
  - - [5056, 448, 1, 256, 5056, 5056, 5056, 256]
    - [2, 16371.0]
  - - [1856, 5056, 1, 1280, 1856, 1856, 1856, 1280]
    - [21, 21582.0]
  - - [2944, 1024, 1, 1280, 2944, 2944, 2944, 1280]
    - [3, 20288.0]
  - - [2368, 4288, 1, 256, 2368, 2368, 2368, 256]
    - [16, 19968.0]
  - - [1024, 2368, 1, 3328, 1024, 1024, 1024, 3328]
    - [5, 20179.0]
  - - [4288, 5888, 1, 3328, 4288, 4288, 4288, 3328]
    - [26, 22534.0]
  - - [1024, 2944, 1, 3328, 1024, 1024, 1024, 3328]
    - [3, 20574.0]
  - - [256, 6784, 1, 1280, 256, 256, 256, 1280]
    - [16, 18360.0]
  - - [1856, 3584, 1, 256, 1856, 1856, 1856, 256]
    - [11, 18904.0]
  - - [256, 5888, 1, 1280, 256, 256, 256, 1280]
    - [31, 18656.0]
  - - [2944, 2368, 1, 256, 2944, 2944, 2944, 256]
    - [16, 20364.0]
  - - [1024, 1856, 1, 256, 1024, 1024, 1024, 256]
    - [21, 17084.0]
  - - [6784, 3584, 1, 3328, 6784, 6784, 6784, 3328]
    - [16, 22884.0]
  - - [1024, 5888, 1, 3328, 1024, 1024, 1024, 3328]
    - [3, 21960.0]
  - - [1408, 2368, 1, 1280, 1408, 1408, 1408, 1280]
    - [26, 19765.0]
  - - [2944, 2944, 1, 256, 2944, 2944, 2944, 256]
    - [26, 21277.0]
  - - [6784, 256, 1, 256, 6784, 6784, 6784, 256]
    - [16, 17408.0]
  - - [5888, 1408, 1, 256, 5888, 5888, 5888, 256]
    - [11, 21164.0]
  - - [5888, 6784, 1, 3328, 5888, 5888, 5888, 3328]
    - [16, 23056.0]
  - - [704, 4288, 1, 1280, 704, 704, 704, 1280]
    - [16, 18199.0]
  - - [4096, 7000, 1, 4096, 4096, 4096, 4096, 4096]
    - [31, 21987.0]
  - - [5124, 9124, 1, 1760, 5124, 5124, 5124, 1760]
    - [14, 22771.0]
  - - [1024, 1500, 1, 1536, 1024, 1024, 1024, 1536]
    - [16, 19141.0]
  - - [512, 24000, 1, 2048, 512, 512, 512, 2048]
    - [21, 22226.0]
  - - [3072, 24000, 1, 1024, 3072, 3072, 3072, 1024]
    - [3, 22910.0]
  - - [1024, 3000, 1, 2560, 1024, 1024, 1024, 2560]
    - [16, 20649.0]
  - - [512, 3136, 1, 2048, 512, 512, 512, 2048]
    - [21, 19646.0]
  - - [8448, 1500, 1, 2816, 8448, 8448, 8448, 2816]
    - [16, 22199.0]
  - - [2560, 7000, 1, 2560, 2560, 2560, 2560, 2560]
    - [31, 22819.0]
  - - [512, 48000, 1, 2048, 512, 512, 512, 2048]
    - [31, 22587.0]
  - - [196, 256, 64, 1024, 196, 196, 196, 1024]
    - [11, 16228.0]
  - - [512, 48000, 1, 1536, 512, 512, 512, 1536]
    - [31, 22912.0]
  - - [4608, 1500, 1, 1536, 4608, 4608, 4608, 1536]
    - [16, 21563.0]
  - - [1024, 24000, 1, 2560, 1024, 1024, 1024, 2560]
    - [11, 22661.0]
  - - [4608, 3000, 1, 1536, 4608, 4608, 4608, 1536]
    - [16, 21949.0]
  - - [5124, 9124, 1, 2048, 5124, 5124, 5124, 2048]
    - [3, 22175.0]
  - - [5124, 700, 1, 2560, 5124, 5124, 5124, 2560]
    - [11, 18837.0]
  - - [6144, 6000, 1, 2560, 6144, 6144, 6144, 2560]
    - [3, 22961.0]
  - - [1024, 1500, 1, 2816, 1024, 1024, 1024, 2816]
    - [3, 19229.0]
  - - [8448, 48000, 1, 2816, 8448, 8448, 8448, 2816]
    - [5, 23149.0]
  - - [512, 6000, 1, 2048, 512, 512, 512, 2048]
    - [21, 19433.0]
  - - [4224, 1500, 1, 176, 4224, 4224, 4224, 176]
    - [14, 18882.0]
  - - [1024, 6000, 1, 2816, 1024, 1024, 1024, 2816]
    - [3, 22093.0]
  - - [1024, 48000, 1, 1536, 1024, 1024, 1024, 1536]
    - [11, 22840.0]
  - - [1024, 48000, 1, 2560, 1024, 1024, 1024, 2560]
    - [3, 22955.0]
  - - [4608, 24000, 1, 1536, 4608, 4608, 4608, 1536]
    - [3, 22977.0]
  - - [7680, 48000, 1, 2560, 7680, 7680, 7680, 2560]
    - [11, 22951.0]
  - - [3072, 48000, 1, 1024, 3072, 3072, 3072, 1024]
    - [3, 22977.0]
  - - [1024, 1500, 1, 2048, 1024, 1024, 1024, 2048]
    - [21, 19282.0]
  - - [1024, 3000, 1, 2048, 1024, 1024, 1024, 2048]
    - [11, 20148.0]
  - - [1024, 6000, 1, 2048, 1024, 1024, 1024, 2048]
    - [21, 22152.0]
  - - [512, 24000, 1, 2816, 512, 512, 512, 2816]
    - [16, 22537.0]
  - - [6144, 48000, 1, 2560, 6144, 6144, 6144, 2560]
    - [3, 22903.0]
  - - [1760, 7000, 1, 1760, 1760, 1760, 1760, 1760]
    - [24, 22506.0]
  - - [8448, 3000, 1, 2816, 8448, 8448, 8448, 2816]
    - [26, 22302.0]
  - - [4608, 48000, 1, 1536, 4608, 4608, 4608, 1536]
    - [31, 22532.0]
  - - [7680, 1500, 1, 2560, 7680, 7680, 7680, 2560]
    - [3, 22232.0]
  - - [512, 3000, 1, 1536, 512, 512, 512, 1536]
    - [11, 19172.0]
  - - [1024, 3000, 1, 2816, 1024, 1024, 1024, 2816]
    - [18, 20483.0]
  - - [5124, 9124, 1, 2560, 5124, 5124, 5124, 2560]
    - [3, 22207.0]
  - - [512, 48000, 1, 2816, 512, 512, 512, 2816]
    - [16, 22886.0]
  - - [512, 3000, 1, 2816, 512, 512, 512, 2816]
    - [26, 19559.0]
  - - [1024, 24000, 1, 1536, 1024, 1024, 1024, 1536]
    - [21, 22606.0]
  - - [7680, 6000, 1, 2560, 7680, 7680, 7680, 2560]
    - [3, 22903.0]
  - - [512, 6000, 1, 2560, 512, 512, 512, 2560]
    - [11, 20436.0]
  - - [512, 24000, 1, 2560, 512, 512, 512, 2560]
    - [21, 22402.0]
  - - [6144, 3000, 1, 2560, 6144, 6144, 6144, 2560]
    - [11, 22237.0]
  - - [1024, 24000, 1, 2816, 1024, 1024, 1024, 2816]
    - [3, 22703.0]
  - - [2048, 7000, 1, 2048, 2048, 2048, 2048, 2048]
    - [11, 22604.0]
  - - [7680, 3000, 1, 2560, 7680, 7680, 7680, 2560]
    - [21, 22373.0]
  - - [5124, 700, 1, 2048, 5124, 5124, 5124, 2048]
    - [3, 18720.0]
  - - [5124, 9124, 1, 4096, 5124, 5124, 5124, 4096]
    - [31, 19940.0]
  - - [256, 193600, 1, 64, 256, 256, 256, 64]
    - [10, 17501.0]
  - - [8448, 6000, 1, 2816, 8448, 8448, 8448, 2816]
    - [16, 22971.0]
  - - [5124, 1500, 1, 2560, 5124, 5124, 5124, 2560]
    - [3, 21318.0]
  - - [1024, 1500, 1, 2560, 1024, 1024, 1024, 2560]
    - [11, 19752.0]
  - - [1024, 6000, 1, 2560, 1024, 1024, 1024, 2560]
    - [11, 22298.0]
  - - [196, 1024, 64, 256, 196, 196, 196, 256]
    - [16, 15916.0]
  - - [512, 50176, 1, 128, 512, 512, 512, 128]
    - [3, 21207.0]
  - - [7680, 24000, 1, 2560, 7680, 7680, 7680, 2560]
    - [11, 22675.0]
  - - [512, 3000, 1, 2560, 512, 512, 512, 2560]
    - [11, 19125.0]
  - - [8448, 24000, 1, 2816, 8448, 8448, 8448, 2816]
    - [21, 22856.0]
  - - [512, 6000, 1, 1536, 512, 512, 512, 1536]
    - [16, 20215.0]
  - - [3072, 6000, 1, 1024, 3072, 3072, 3072, 1024]
    - [21, 22570.0]
  - - [3072, 1500, 1, 128, 3072, 3072, 3072, 128]
    - [16, 17067.0]
  - - [2048, 3136, 1, 512, 2048, 2048, 2048, 512]
    - [3, 21122.0]
  - - [1024, 3000, 1, 1536, 1024, 1024, 1024, 1536]
    - [16, 20553.0]
  - - [512, 6000, 1, 2816, 512, 512, 512, 2816]
    - [5, 20829.0]
  - - [128, 50176, 1, 512, 128, 128, 128, 512]
    - [31, 21448.0]
  - - [256, 12544, 1, 1024, 256, 256, 256, 1024]
    - [11, 21342.0]
  - - [1024, 12544, 1, 256, 1024, 1024, 1024, 256]
    - [3, 21566.0]
  - - [512, 48000, 1, 2560, 512, 512, 512, 2560]
    - [11, 22773.0]
  - - [512, 24000, 1, 1536, 512, 512, 512, 1536]
    - [21, 22437.0]
  - - [1024, 24000, 1, 2048, 1024, 1024, 1024, 2048]
    - [21, 22601.0]
  - - [5124, 1500, 1, 2048, 5124, 5124, 5124, 2048]
    - [3, 21229.0]
  - - [3072, 1500, 1, 1024, 3072, 3072, 3072, 1024]
    - [16, 20708.0]
  - - [6144, 1500, 1, 2560, 6144, 6144, 6144, 2560]
    - [3, 22095.0]
  - - [1024, 48000, 1, 2816, 1024, 1024, 1024, 2816]
    - [11, 23043.0]
  - - [1024, 6000, 1, 1536, 1024, 1024, 1024, 1536]
    - [16, 22007.0]
  - - [512, 3000, 1, 2048, 512, 512, 512, 2048]
    - [11, 19517.0]
  - - [6144, 24000, 1, 2560, 6144, 6144, 6144, 2560]
    - [11, 22598.0]
  - - [4608, 6000, 1, 1536, 4608, 4608, 4608, 1536]
    - [31, 22816.0]
  - - [3072, 3000, 1, 1024, 3072, 3072, 3072, 1024]
    - [3, 21833.0]
  - - [1024, 48000, 1, 2048, 1024, 1024, 1024, 2048]
    - [11, 22407.0]
  - - [784, 512, 64, 128, 784, 784, 784, 128]
    - [16, 17901.0]
  - - [3136, 256, 64, 64, 3136, 3136, 3136, 64]
    - [0, 17305.0]
  - - [12544, 1024, 1, 256, 12544, 12544, 12544, 256]
    - [3, 21453.0]
  - - [784, 128, 128, 512, 784, 784, 784, 512]
    - [3, 18817.0]
  - - [784, 512, 256, 128, 784, 784, 784, 128]
    - [3, 18623.0]
  - - [3136, 512, 1, 2048, 3136, 3136, 3136, 2048]
    - [3, 20132.0]
  - - [12544, 256, 1, 1024, 12544, 12544, 12544, 1024]
    - [11, 21436.0]
  - - [3136, 2048, 1, 512, 3136, 3136, 3136, 512]
    - [11, 21375.0]
  - - [3136, 256, 256, 64, 3136, 3136, 3136, 64]
    - [8, 12779.0]
  - - [784, 128, 64, 512, 784, 784, 784, 512]
    - [3, 18644.0]
  - - [784, 512, 128, 128, 784, 784, 784, 128]
    - [11, 18449.0]
  - - [784, 128, 256, 512, 784, 784, 784, 512]
    - [26, 19147.0]
  - - [3136, 256, 128, 64, 3136, 3136, 3136, 64]
    - [0, 17686.0]
  - - [128, 128, 512, 64, 128, 128, 128, 64]
    - [23, 16279.0]
  - - [512, 512, 64, 64, 512, 512, 512, 64]
    - [16, 19113.0]
  - - [1024, 2048, 1, 2, 1024, 1024, 1024, 2]
    - [13, 711.0]
  - - [1024, 2048, 1, 1024, 1024, 1024, 1024, 1024]
    - [21, 19713.0]
  - - [1024, 2048, 1, 4096, 1024, 1024, 1024, 4096]
    - [11, 20160.0]
  - - [1024, 2048, 1, 30528, 1024, 1024, 1024, 30528]
    - [26, 20395.0]
  - - [1024, 4096, 1, 1024, 1024, 1024, 1024, 1024]
    - [11, 21618.0]
  - - [1024, 4096, 1, 4096, 1024, 1024, 1024, 4096]
    - [3, 21916.0]
  - - [1024, 4096, 1, 30528, 1024, 1024, 1024, 30528]
    - [16, 22332.0]
  - - [4096, 2048, 1, 1024, 4096, 4096, 4096, 1024]
    - [3, 22237.0]
  - - [4096, 4096, 1, 1024, 4096, 4096, 4096, 1024]
    - [3, 22566.0]
  - - [256, 8976, 1, 1536, 256, 256, 256, 1536]
    - [31, 19070.0]
  - - [256, 8976, 1, 2048, 256, 256, 256, 2048]
    - [31, 18868.0]
  - - [256, 8976, 1, 2304, 256, 256, 256, 2304]
    - [31, 19000.0]
  - - [256, 8976, 1, 2560, 256, 256, 256, 2560]
    - [21, 18888.0]
  - - [256, 8976, 1, 2816, 256, 256, 256, 2816]
    - [33, 19016.0]
  - - [256, 8976, 1, 3072, 256, 256, 256, 3072]
    - [21, 19072.0]
  - - [256, 8976, 1, 4352, 256, 256, 256, 4352]
    - [21, 19415.0]
  - - [256, 8976, 1, 4864, 256, 256, 256, 4864]
    - [16, 19390.0]
  - - [256, 8976, 1, 5376, 256, 256, 256, 5376]
    - [31, 19487.0]
  - - [256, 8976, 1, 5632, 256, 256, 256, 5632]
    - [31, 19410.0]
  - - [256, 8976, 1, 5888, 256, 256, 256, 5888]
    - [31, 19447.0]
  - - [256, 8976, 1, 6144, 256, 256, 256, 6144]
    - [31, 19526.0]
  - - [256, 8976, 1, 6656, 256, 256, 256, 6656]
    - [31, 19529.0]
  - - [256, 8976, 1, 7168, 256, 256, 256, 7168]
    - [31, 19542.0]
  - - [256, 8976, 1, 7424, 256, 256, 256, 7424]
    - [26, 19590.0]
  - - [256, 8976, 1, 8192, 256, 256, 256, 8192]
    - [21, 19479.0]
  - - [256, 8976, 1, 8448, 256, 256, 256, 8448]
    - [21, 19644.0]
  - - [256, 8976, 1, 8960, 256, 256, 256, 8960]
    - [3, 19557.0]
  - - [256, 8976, 1, 9472, 256, 256, 256, 9472]
    - [21, 19560.0]
  - - [256, 8976, 1, 9728, 256, 256, 256, 9728]
    - [21, 19578.0]
  - - [256, 8976, 1, 9984, 256, 256, 256, 9984]
    - [16, 19622.0]
  - - [256, 8976, 1, 10240, 256, 256, 256, 10240]
    - [21, 19383.0]
  - - [256, 8976, 1, 10496, 256, 256, 256, 10496]
    - [16, 19577.0]
  - - [256, 8976, 1, 11008, 256, 256, 256, 11008]
    - [21, 19602.0]
  - - [256, 8976, 1, 11520, 256, 256, 256, 11520]
    - [16, 19599.0]
  - - [256, 8976, 1, 12288, 256, 256, 256, 12288]
    - [31, 19285.0]
  - - [256, 8976, 1, 14336, 256, 256, 256, 14336]
    - [31, 19415.0]
  - - [256, 8976, 1, 14848, 256, 256, 256, 14848]
    - [21, 19690.0]
  - - [256, 8976, 1, 15104, 256, 256, 256, 15104]
    - [16, 19666.0]
  - - [256, 8976, 1, 15872, 256, 256, 256, 15872]
    - [31, 19622.0]
  - - [256, 8976, 1, 17152, 256, 256, 256, 17152]
    - [3, 19657.0]
  - - [256, 8976, 1, 19712, 256, 256, 256, 19712]
    - [21, 19716.0]
  - - [256, 8976, 1, 19968, 256, 256, 256, 19968]
    - [11, 19619.0]
  - - [256, 8976, 1, 20480, 256, 256, 256, 20480]
    - [21, 19160.0]
  - - [256, 8976, 1, 20992, 256, 256, 256, 20992]
    - [21, 19610.0]
  - - [256, 8976, 1, 22016, 256, 256, 256, 22016]
    - [11, 19676.0]
  - - [256, 8976, 1, 26112, 256, 256, 256, 26112]
    - [11, 19414.0]
  - - [256, 8976, 1, 33536, 256, 256, 256, 33536]
    - [3, 19679.0]
  - - [256, 8976, 1, 44505, 256, 256, 256, 44505]
    - [28, 19791.0]
  - - [256, 32768, 1, 128, 256, 256, 256, 128]
    - [14, 20259.0]
  - - [480, 32768, 1, 1024, 480, 480, 480, 1024]
    - [21, 21047.0]
  - - [512, 32768, 1, 256, 512, 512, 512, 256]
    - [11, 21762.0]
  - - [1024, 1600, 1, 1, 1024, 1024, 1024, 1]
    - [13, 350.0]
  - - [1024, 1600, 1, 1024, 1024, 1024, 1024, 1024]
    - [2, 17791.0]
  - - [1024, 1792, 1, 256, 1024, 1024, 1024, 256]
    - [11, 18180.0]
  - - [1024, 2048, 1, 256, 1024, 1024, 1024, 256]
    - [3, 18199.0]
  - - [1024, 2560, 1, 256, 1024, 1024, 1024, 256]
    - [11, 19914.0]
  - - [1024, 3072, 1, 256, 1024, 1024, 1024, 256]
    - [21, 19331.0]
  - - [1024, 3328, 1, 256, 1024, 1024, 1024, 256]
    - [16, 18867.0]
  - - [1024, 3840, 1, 256, 1024, 1024, 1024, 256]
    - [11, 19123.0]
  - - [1024, 4096, 1, 256, 1024, 1024, 1024, 256]
    - [11, 19167.0]
  - - [1024, 4608, 1, 256, 1024, 1024, 1024, 256]
    - [11, 19272.0]
  - - [1024, 4864, 1, 256, 1024, 1024, 1024, 256]
    - [11, 19220.0]
  - - [1024, 5120, 1, 256, 1024, 1024, 1024, 256]
    - [11, 19837.0]
  - - [1024, 5632, 1, 256, 1024, 1024, 1024, 256]
    - [11, 19860.0]
  - - [1024, 6144, 1, 256, 1024, 1024, 1024, 256]
    - [11, 19864.0]
  - - [1024, 6400, 1, 256, 1024, 1024, 1024, 256]
    - [11, 20336.0]
  - - [1024, 7168, 1, 256, 1024, 1024, 1024, 256]
    - [11, 20170.0]
  - - [1024, 7424, 1, 256, 1024, 1024, 1024, 256]
    - [26, 20273.0]
  - - [1024, 7680, 1, 256, 1024, 1024, 1024, 256]
    - [3, 21486.0]
  - - [1024, 7936, 1, 256, 1024, 1024, 1024, 256]
    - [3, 21430.0]
  - - [1024, 8192, 1, 256, 1024, 1024, 1024, 256]
    - [11, 21338.0]
  - - [1024, 8448, 1, 256, 1024, 1024, 1024, 256]
    - [3, 21278.0]
  - - [1024, 8704, 1, 256, 1024, 1024, 1024, 256]
    - [11, 21178.0]
  - - [1024, 8960, 1, 256, 1024, 1024, 1024, 256]
    - [11, 21592.0]
  - - [1024, 9728, 1, 256, 1024, 1024, 1024, 256]
    - [11, 21423.0]
  - - [1024, 9984, 1, 256, 1024, 1024, 1024, 256]
    - [3, 21372.0]
  - - [1024, 10240, 1, 256, 1024, 1024, 1024, 256]
    - [3, 21683.0]
  - - [1024, 10496, 1, 256, 1024, 1024, 1024, 256]
    - [11, 21716.0]
  - - [1024, 11008, 1, 256, 1024, 1024, 1024, 256]
    - [3, 21538.0]
  - - [1024, 11264, 1, 256, 1024, 1024, 1024, 256]
    - [11, 21497.0]
  - - [1024, 11520, 1, 256, 1024, 1024, 1024, 256]
    - [3, 21754.0]
  - - [1024, 12288, 1, 256, 1024, 1024, 1024, 256]
    - [3, 21671.0]
  - - [1024, 13312, 1, 256, 1024, 1024, 1024, 256]
    - [3, 21808.0]
  - - [1024, 13568, 1, 256, 1024, 1024, 1024, 256]
    - [11, 21754.0]
  - - [1024, 14336, 1, 256, 1024, 1024, 1024, 256]
    - [11, 21872.0]
  - - [1024, 14592, 1, 256, 1024, 1024, 1024, 256]
    - [11, 21848.0]
  - - [1024, 14848, 1, 256, 1024, 1024, 1024, 256]
    - [11, 21796.0]
  - - [1024, 15104, 1, 256, 1024, 1024, 1024, 256]
    - [3, 21793.0]
  - - [1024, 16128, 1, 256, 1024, 1024, 1024, 256]
    - [3, 21883.0]
  - - [1024, 17152, 1, 256, 1024, 1024, 1024, 256]
    - [11, 21948.0]
  - - [1024, 18944, 1, 256, 1024, 1024, 1024, 256]
    - [3, 21937.0]
  - - [1024, 19712, 1, 256, 1024, 1024, 1024, 256]
    - [3, 22040.0]
  - - [1024, 19968, 1, 256, 1024, 1024, 1024, 256]
    - [3, 22018.0]
  - - [1024, 20480, 1, 256, 1024, 1024, 1024, 256]
    - [3, 22028.0]
  - - [1024, 20992, 1, 256, 1024, 1024, 1024, 256]
    - [3, 22102.0]
  - - [1024, 21504, 1, 256, 1024, 1024, 1024, 256]
    - [3, 22020.0]
  - - [1024, 22016, 1, 256, 1024, 1024, 1024, 256]
    - [11, 22079.0]
  - - [1024, 23552, 1, 256, 1024, 1024, 1024, 256]
    - [3, 22142.0]
  - - [1024, 28672, 1, 256, 1024, 1024, 1024, 256]
    - [3, 22174.0]
  - - [1024, 32768, 1, 512, 1024, 1024, 1024, 512]
    - [11, 22525.0]
  - - [1024, 32768, 1, 1024, 1024, 1024, 1024, 1024]
    - [21, 22736.0]
  - - [1024, 33536, 1, 256, 1024, 1024, 1024, 256]
    - [16, 22214.0]
  - - [1024, 40448, 1, 256, 1024, 1024, 1024, 256]
    - [3, 22340.0]
  - - [2048, 960, 1, 2048, 2048, 2048, 2048, 2048]
    - [3, 18555.0]
  - - [2048, 1024, 1, 1, 2048, 2048, 2048, 1]
    - [4, 288.0]
  - - [2048, 1024, 1, 256, 2048, 2048, 2048, 256]
    - [16, 18174.0]
  - - [3200, 1024, 1, 2048, 3200, 3200, 3200, 2048]
    - [3, 21713.0]
  - - [4096, 1024, 1, 1, 4096, 4096, 4096, 1]
    - [19, 337.0]
  - - [1024, 3840, 1, 1024, 1024, 1024, 1024, 1024]
    - [3, 21289.0]
  - - [1024, 3840, 1, 4096, 1024, 1024, 1024, 4096]
    - [3, 22173.0]
  - - [1024, 3968, 1, 1024, 1024, 1024, 1024, 1024]
    - [21, 20529.0]
  - - [1024, 3968, 1, 4096, 1024, 1024, 1024, 4096]
    - [21, 21252.0]
  - - [1024, 3968, 1, 42720, 1024, 1024, 1024, 42720]
    - [11, 21696.0]
  - - [1024, 6528, 1, 1024, 1024, 1024, 1024, 1024]
    - [11, 21780.0]
  - - [1024, 6528, 1, 4096, 1024, 1024, 1024, 4096]
    - [3, 21974.0]
  - - [1024, 6528, 1, 42720, 1024, 1024, 1024, 42720]
    - [26, 22263.0]
  - - [1024, 7104, 1, 1024, 1024, 1024, 1024, 1024]
    - [21, 21567.0]
  - - [1024, 7104, 1, 4096, 1024, 1024, 1024, 4096]
    - [3, 21936.0]
  - - [1024, 7104, 1, 42720, 1024, 1024, 1024, 42720]
    - [16, 22006.0]
  - - [1024, 7200, 1, 1024, 1024, 1024, 1024, 1024]
    - [11, 21604.0]
  - - [1024, 7200, 1, 4096, 1024, 1024, 1024, 4096]
    - [3, 22091.0]
  - - [1024, 7200, 1, 42720, 1024, 1024, 1024, 42720]
    - [11, 22271.0]
  - - [1024, 8064, 1, 1024, 1024, 1024, 1024, 1024]
    - [11, 21830.0]
  - - [1024, 8064, 1, 4096, 1024, 1024, 1024, 4096]
    - [11, 22229.0]
  - - [1024, 8160, 1, 1024, 1024, 1024, 1024, 1024]
    - [21, 21991.0]
  - - [1024, 8160, 1, 4096, 1024, 1024, 1024, 4096]
    - [21, 22448.0]
  - - [1024, 9216, 1, 1024, 1024, 1024, 1024, 1024]
    - [21, 22442.0]
  - - [1024, 9216, 1, 4096, 1024, 1024, 1024, 4096]
    - [21, 22602.0]
  - - [1024, 9520, 1, 1024, 1024, 1024, 1024, 1024]
    - [21, 22234.0]
  - - [1024, 9520, 1, 4096, 1024, 1024, 1024, 4096]
    - [21, 22463.0]
  - - [1024, 9520, 1, 42720, 1024, 1024, 1024, 42720]
    - [14, 22477.0]
  - - [1024, 10064, 1, 1024, 1024, 1024, 1024, 1024]
    - [16, 22108.0]
  - - [1024, 10064, 1, 4096, 1024, 1024, 1024, 4096]
    - [21, 22344.0]
  - - [1024, 10080, 1, 1024, 1024, 1024, 1024, 1024]
    - [16, 22121.0]
  - - [1024, 10080, 1, 4096, 1024, 1024, 1024, 4096]
    - [21, 22437.0]
  - - [1024, 10080, 1, 42720, 1024, 1024, 1024, 42720]
    - [3, 22525.0]
  - - [1024, 10200, 1, 1024, 1024, 1024, 1024, 1024]
    - [21, 22339.0]
  - - [1024, 10200, 1, 4096, 1024, 1024, 1024, 4096]
    - [11, 22475.0]
  - - [4096, 3840, 1, 1024, 4096, 4096, 4096, 1024]
    - [3, 22715.0]
  - - [4096, 3968, 1, 1024, 4096, 4096, 4096, 1024]
    - [3, 22722.0]
  - - [4096, 6528, 1, 1024, 4096, 4096, 4096, 1024]
    - [3, 22864.0]
  - - [4096, 7104, 1, 1024, 4096, 4096, 4096, 1024]
    - [11, 22623.0]
  - - [4096, 7200, 1, 1024, 4096, 4096, 4096, 1024]
    - [21, 22486.0]
  - - [4096, 8064, 1, 1024, 4096, 4096, 4096, 1024]
    - [3, 22865.0]
  - - [4096, 8160, 1, 1024, 4096, 4096, 4096, 1024]
    - [3, 22759.0]
  - - [4096, 9216, 1, 1024, 4096, 4096, 4096, 1024]
    - [3, 22850.0]
  - - [4096, 9520, 1, 1024, 4096, 4096, 4096, 1024]
    - [3, 22699.0]
  - - [4096, 10064, 1, 1024, 4096, 4096, 4096, 1024]
    - [3, 22741.0]
  - - [4096, 10080, 1, 1024, 4096, 4096, 4096, 1024]
    - [3, 22778.0]
  - - [4096, 10200, 1, 1024, 4096, 4096, 4096, 1024]
    - [3, 22776.0]
  - - [1024, 3240, 1, 1024, 1024, 1024, 1024, 1024]
    - [21, 19835.0]
  - - [1024, 3240, 1, 4096, 1024, 1024, 1024, 4096]
    - [11, 20307.0]
  - - [1024, 3960, 1, 1024, 1024, 1024, 1024, 1024]
    - [21, 20287.0]
  - - [1024, 3960, 1, 4096, 1024, 1024, 1024, 4096]
    - [11, 21176.0]
  - - [1024, 3960, 1, 42720, 1024, 1024, 1024, 42720]
    - [11, 21658.0]
  - - [4096, 3240, 1, 1024, 4096, 4096, 4096, 1024]
    - [3, 21938.0]
  - - [4096, 3960, 1, 1024, 4096, 4096, 4096, 1024]
    - [16, 22511.0]
  - - [289, 128, 64, 768, 289, 289, 289, 768]
    - [11, 15398.0]
  - - [289, 160, 64, 768, 289, 289, 289, 768]
    - [10, 11268.0]
  - - [289, 192, 64, 768, 289, 289, 289, 768]
    - [15, 13274.0]
  - - [3136, 256, 32, 64, 3136, 3136, 3136, 64]
    - [17, 14757.0]
  - - [784, 512, 32, 128, 784, 784, 784, 128]
    - [3, 17756.0]
  - - [784, 128, 32, 512, 784, 784, 784, 512]
    - [3, 17502.0]
  - - [196, 1024, 32, 256, 196, 196, 196, 256]
    - [21, 15358.0]
  - - [3136, 128, 64, 64, 3136, 3136, 3136, 64]
    - [4, 17495.0]
  - - [3136, 256, 64, 128, 3136, 3136, 3136, 128]
    - [3, 20794.0]
  - - [784, 512, 64, 256, 784, 784, 784, 256]
    - [3, 19097.0]
  - - [3136, 128, 64, 256, 3136, 3136, 3136, 256]
    - [16, 20766.0]
  - - [3136, 256, 64, 256, 3136, 3136, 3136, 256]
    - [3, 21714.0]
  - - [196, 1024, 64, 512, 196, 196, 196, 512]
    - [11, 16545.0]
  - - [784, 256, 64, 512, 784, 784, 784, 512]
    - [3, 19359.0]
  - - [784, 512, 64, 512, 784, 784, 784, 512]
    - [3, 19638.0]
  - - [196, 512, 64, 1024, 196, 196, 196, 1024]
    - [21, 16686.0]
  - - [196, 1024, 64, 1024, 196, 196, 196, 1024]
    - [21, 16778.0]
  - - [3136, 128, 32, 64, 3136, 3136, 3136, 64]
    - [14, 17213.0]
  - - [3136, 256, 32, 128, 3136, 3136, 3136, 128]
    - [3, 20715.0]
  - - [784, 512, 32, 256, 784, 784, 784, 256]
    - [11, 18851.0]
  - - [3136, 128, 32, 256, 3136, 3136, 3136, 256]
    - [31, 21063.0]
  - - [3136, 256, 32, 256, 3136, 3136, 3136, 256]
    - [11, 21477.0]
  - - [196, 1024, 32, 512, 196, 196, 196, 512]
    - [3, 16365.0]
  - - [784, 256, 32, 512, 784, 784, 784, 512]
    - [26, 18699.0]
  - - [784, 512, 32, 512, 784, 784, 784, 512]
    - [3, 19383.0]
  - - [196, 512, 32, 1024, 196, 196, 196, 1024]
    - [21, 16321.0]
  - - [196, 1024, 32, 1024, 196, 196, 196, 1024]
    - [21, 16553.0]
  - - [7680, 8192, 1, 8192, 7680, 7680, 7680, 8192]
    - [21, 22858.0]
  - - [3840, 4096, 1, 4096, 3840, 3840, 3840, 4096]
    - [11, 21235.0]
  - - [1920, 2048, 1, 2048, 1920, 1920, 1920, 2048]
    - [16, 21478.0]
  - - [8192, 7680, 1, 8192, 8192, 8192, 8192, 8192]
    - [11, 22705.0]
  - - [4096, 3840, 1, 4096, 4096, 4096, 4096, 4096]
    - [3, 22915.0]
  - - [2048, 1920, 1, 2048, 2048, 2048, 2048, 2048]
    - [3, 21493.0]
  - - [8192, 8192, 1, 8192, 8192, 8192, 8192, 8192]
    - [5, 22791.0]
  - - [4096, 4096, 1, 4096, 4096, 4096, 4096, 4096]
    - [11, 20941.0]
  - - [2048, 2048, 1, 2048, 2048, 2048, 2048, 2048]
    - [11, 21245.0]
  - - [1024, 4096, 1, 2, 1024, 1024, 1024, 2]
    - [25, 573.0]
  - - [4096, 512, 1, 1024, 4096, 4096, 4096, 1024]
    - [3, 19225.0]
  - - [1024, 1280, 1, 2, 1024, 1024, 1024, 2]
    - [7, 440.0]
  - - [1024, 1280, 1, 1024, 1024, 1024, 1024, 1024]
    - [12, 19345.0]
  - - [1024, 1280, 1, 4096, 1024, 1024, 1024, 4096]
    - [12, 21207.0]
  - - [4096, 1024, 1, 1024, 4096, 4096, 4096, 1024]
    - [3, 21191.0]
  - - [4096, 1280, 1, 1024, 4096, 4096, 4096, 1024]
    - [16, 21799.0]
  - - [1024, 4992, 1, 2, 1024, 1024, 1024, 2]
    - [19, 755.0]
  - - [1024, 4992, 1, 1024, 1024, 1024, 1024, 1024]
    - [3, 21127.0]
  - - [1024, 4992, 1, 4096, 1024, 1024, 1024, 4096]
    - [21, 21860.0]
  - - [4096, 4992, 1, 1024, 4096, 4096, 4096, 1024]
    - [3, 22671.0]
  - - [1024, 5120, 1, 2, 1024, 1024, 1024, 2]
    - [13, 626.0]
  - - [1024, 5120, 1, 1024, 1024, 1024, 1024, 1024]
    - [16, 22084.0]
  - - [1024, 5120, 1, 4096, 1024, 1024, 1024, 4096]
    - [21, 22248.0]
  - - [4096, 5120, 1, 1024, 4096, 4096, 4096, 1024]
    - [3, 22675.0]
  - - [1024, 5248, 1, 2, 1024, 1024, 1024, 2]
    - [8, 622.0]
  - - [1024, 5248, 1, 1024, 1024, 1024, 1024, 1024]
    - [11, 21562.0]
  - - [1024, 5248, 1, 4096, 1024, 1024, 1024, 4096]
    - [3, 21737.0]
  - - [4096, 5248, 1, 1024, 4096, 4096, 4096, 1024]
    - [3, 22753.0]
  - - [1024, 2560, 1, 2, 1024, 1024, 1024, 2]
    - [13, 594.0]
  - - [1024, 2560, 1, 1024, 1024, 1024, 1024, 1024]
    - [11, 21417.0]
  - - [1024, 2560, 1, 4096, 1024, 1024, 1024, 4096]
    - [12, 21727.0]
  - - [4096, 2560, 1, 1024, 4096, 4096, 4096, 1024]
    - [11, 22530.0]
  - - [1024, 3072, 1, 2, 1024, 1024, 1024, 2]
    - [15, 645.0]
  - - [1024, 3072, 1, 1024, 1024, 1024, 1024, 1024]
    - [11, 20890.0]
  - - [1024, 3072, 1, 4096, 1024, 1024, 1024, 4096]
    - [21, 21148.0]
  - - [4096, 3072, 1, 1024, 4096, 4096, 4096, 1024]
    - [3, 22423.0]
  - - [1024, 1152, 1, 2, 1024, 1024, 1024, 2]
    - [24, 628.0]
  - - [1024, 1152, 1, 1024, 1024, 1024, 1024, 1024]
    - [11, 18550.0]
  - - [1024, 1152, 1, 4096, 1024, 1024, 1024, 4096]
    - [11, 18786.0]
  - - [4096, 1152, 1, 1024, 4096, 4096, 4096, 1024]
    - [3, 20957.0]
  - - [479, 32768, 1, 1024, 479, 479, 479, 1024]
    - [21, 20800.0]
  - - [1024, 8192, 1, 1024, 1024, 1024, 1024, 1024]
    - [21, 22138.0]
  - - [1024, 8192, 1, 4096, 1024, 1024, 1024, 4096]
    - [21, 22483.0]
  - - [1024, 8192, 1, 33712, 1024, 1024, 1024, 33712]
    - [26, 22398.0]
  - - [1024, 9600, 1, 1024, 1024, 1024, 1024, 1024]
    - [16, 22378.0]
  - - [1024, 9600, 1, 4096, 1024, 1024, 1024, 4096]
    - [21, 22682.0]
  - - [1024, 9600, 1, 33712, 1024, 1024, 1024, 33712]
    - [24, 22672.0]
  - - [4096, 8192, 1, 1024, 4096, 4096, 4096, 1024]
    - [3, 22793.0]
  - - [4096, 9600, 1, 1024, 4096, 4096, 4096, 1024]
    - [3, 22778.0]
  - - [1024, 1024, 64, 64, 1024, 1024, 1024, 64]
    - [2, 18201.0]
  - - [1024, 16384, 1, 3072, 1024, 1024, 1024, 3072]
    - [11, 22686.0]
  - - [1024, 2048, 1, 30592, 1024, 1024, 1024, 30592]
    - [3, 20385.0]
  - - [640, 2048, 1, 2560, 640, 640, 640, 2560]
    - [5, 21216.0]
  - - [1024, 1024, 64, 96, 1024, 1024, 1024, 96]
    - [3, 20718.0]
  - - [1536, 4096, 1, 4608, 1536, 1536, 1536, 4608]
    - [3, 21955.0]
  - - [512, 512, 256, 64, 512, 512, 512, 64]
    - [10, 16161.0]
  - - [2048, 1024, 1, 8192, 2048, 2048, 2048, 8192]
    - [11, 20266.0]
  - - [4096, 16384, 1, 1024, 4096, 4096, 4096, 1024]
    - [3, 22830.0]
  - - [1024, 8192, 1, 50304, 1024, 1024, 1024, 50304]
    - [12, 22386.0]
  - - [1536, 8192, 1, 50304, 1536, 1536, 1536, 50304]
    - [26, 22231.0]
  - - [6144, 8192, 1, 1536, 6144, 6144, 6144, 1536]
    - [3, 23026.0]
  - - [1024, 4096, 1, 30592, 1024, 1024, 1024, 30592]
    - [16, 22300.0]
  - - [1536, 4096, 1, 6144, 1536, 1536, 1536, 6144]
    - [3, 21870.0]
  - - [1024, 16384, 1, 4096, 1024, 1024, 1024, 4096]
    - [21, 22278.0]
  - - [1024, 16384, 1, 50304, 1024, 1024, 1024, 50304]
    - [12, 22467.0]
  - - [1024, 4096, 1, 3072, 1024, 1024, 1024, 3072]
    - [3, 21901.0]
  - - [1536, 8192, 1, 1536, 1536, 1536, 1536, 1536]
    - [11, 22576.0]
  - - [1024, 2048, 1, 3072, 1024, 1024, 1024, 3072]
    - [11, 20134.0]
  - - [2560, 2048, 1, 7680, 2560, 2560, 2560, 7680]
    - [3, 22533.0]
  - - [2048, 1024, 1, 2048, 2048, 2048, 2048, 2048]
    - [11, 19276.0]
  - - [2048, 1024, 1, 30592, 2048, 2048, 2048, 30592]
    - [11, 20344.0]
  - - [8192, 1024, 1, 2048, 8192, 8192, 8192, 2048]
    - [3, 22449.0]
  - - [2560, 2048, 1, 2560, 2560, 2560, 2560, 2560]
    - [5, 22571.0]
  - - [1536, 8192, 1, 4608, 1536, 1536, 1536, 4608]
    - [16, 22641.0]
  - - [1024, 2048, 1, 50304, 1024, 1024, 1024, 50304]
    - [11, 20362.0]
  - - [1024, 1024, 32, 64, 1024, 1024, 1024, 64]
    - [16, 19396.0]
  - - [1536, 8192, 1, 6144, 1536, 1536, 1536, 6144]
    - [11, 22643.0]
  - - [1024, 1024, 256, 64, 1024, 1024, 1024, 64]
    - [15, 17231.0]
  - - [512, 512, 40, 64, 512, 512, 512, 64]
    - [17, 17605.0]
  - - [1536, 4096, 1, 50304, 1536, 1536, 1536, 50304]
    - [28, 21884.0]
  - - [1024, 1024, 128, 96, 1024, 1024, 1024, 96]
    - [11, 21094.0]
  - - [1024, 8192, 1, 3072, 1024, 1024, 1024, 3072]
    - [11, 22445.0]
  - - [1024, 1024, 128, 64, 1024, 1024, 1024, 64]
    - [15, 17261.0]
  - - [1024, 4096, 1, 50304, 1024, 1024, 1024, 50304]
    - [26, 22258.0]
  - - [6144, 4096, 1, 1536, 6144, 6144, 6144, 1536]
    - [16, 22836.0]
  - - [1024, 16384, 1, 1024, 1024, 1024, 1024, 1024]
    - [11, 22526.0]
  - - [2560, 2048, 1, 1920, 2560, 2560, 2560, 1920]
    - [14, 22510.0]
  - - [2048, 1024, 1, 6144, 2048, 2048, 2048, 6144]
    - [3, 20025.0]
  - - [512, 512, 128, 64, 512, 512, 512, 64]
    - [26, 19590.0]
  - - [1024, 8192, 1, 30592, 1024, 1024, 1024, 30592]
    - [18, 22354.0]
  - - [1536, 4096, 1, 1536, 1536, 1536, 1536, 1536]
    - [11, 21610.0]
  - - [128, 128, 1024, 64, 128, 128, 128, 64]
    - [2, 15192.0]
  - - [1024, 8192, 1, 30528, 1024, 1024, 1024, 30528]
    - [28, 22372.0]
  - - [1024, 3456, 1, 1024, 1024, 1024, 1024, 1024]
    - [16, 21264.0]
  - - [1024, 3456, 1, 512, 1024, 1024, 1024, 512]
    - [3, 21069.0]
  - - [1024, 4096, 1, 512, 1024, 1024, 1024, 512]
    - [3, 20437.0]
  - - [1024, 6912, 1, 1024, 1024, 1024, 1024, 1024]
    - [3, 22034.0]
  - - [1024, 6912, 1, 512, 1024, 1024, 1024, 512]
    - [3, 21705.0]
  - - [256, 55296, 1, 128, 256, 256, 256, 128]
    - [3, 20675.0]
  - - [256, 6912, 1, 128, 256, 256, 256, 128]
    - [14, 15861.0]
  - - [480, 3456, 1, 1024, 480, 480, 480, 1024]
    - [21, 17629.0]
  - - [480, 4096, 1, 1024, 480, 480, 480, 1024]
    - [21, 17595.0]
  - - [480, 6912, 1, 1024, 480, 480, 480, 1024]
    - [21, 19431.0]
  - - [512, 3456, 1, 256, 512, 512, 512, 256]
    - [31, 15620.0]
  - - [512, 4096, 1, 256, 512, 512, 512, 256]
    - [11, 16408.0]
  - - [512, 55296, 1, 256, 512, 512, 512, 256]
    - [3, 22078.0]
  - - [512, 6912, 1, 256, 512, 512, 512, 256]
    - [3, 20026.0]
  - - [1024, 1280, 1, 30528, 1024, 1024, 1024, 30528]
    - [33, 21763.0]
  - - [1024, 1600, 1, 30528, 1024, 1024, 1024, 30528]
    - [5, 18431.0]
  - - [1024, 10240, 1, 1024, 1024, 1024, 1024, 1024]
    - [16, 22434.0]
  - - [1024, 10240, 1, 4096, 1024, 1024, 1024, 4096]
    - [11, 22685.0]
  - - [4096, 10240, 1, 1024, 4096, 4096, 4096, 1024]
    - [3, 22824.0]
  - - [128, 128, 1280, 64, 128, 128, 128, 64]
    - [2, 16578.0]
  - - [1024, 1640, 1, 30528, 1024, 1024, 1024, 30528]
    - [11, 18950.0]
  - - [1024, 10496, 1, 1024, 1024, 1024, 1024, 1024]
    - [11, 22460.0]
  - - [1024, 10496, 1, 4096, 1024, 1024, 1024, 4096]
    - [11, 22634.0]
  - - [4096, 10496, 1, 1024, 4096, 4096, 4096, 1024]
    - [11, 22832.0]
  - - [128, 128, 1312, 64, 128, 128, 128, 64]
    - [2, 16583.0]
  - - [1024, 6144, 1, 4096, 1024, 1024, 1024, 4096]
    - [3, 21745.0]
  - - [4096, 6144, 1, 1024, 4096, 4096, 4096, 1024]
    - [3, 22753.0]
  - - [1024, 6144, 1, 1024, 1024, 1024, 1024, 1024]
    - [11, 21596.0]
  - - [512, 512, 192, 64, 512, 512, 512, 64]
    - [10, 17824.0]
  - - [256, 6912, 1, 1, 256, 256, 256, 1]
    - [2, 324.0]
  - - [1024, 10224, 1, 1024, 1024, 1024, 1024, 1024]
    - [16, 22362.0]
  - - [1024, 10192, 1, 1024, 1024, 1024, 1024, 1024]
    - [21, 22348.0]
  - - [1024, 10208, 1, 1024, 1024, 1024, 1024, 1024]
    - [21, 22374.0]
  - - [1024, 10224, 1, 4096, 1024, 1024, 1024, 4096]
    - [21, 22640.0]
  - - [1024, 10224, 1, 3072, 1024, 1024, 1024, 3072]
    - [11, 22642.0]
  - - [4096, 10224, 1, 1024, 4096, 4096, 4096, 1024]
    - [3, 22751.0]
  - - [1024, 10240, 1, 3072, 1024, 1024, 1024, 3072]
    - [21, 22656.0]
  - - [1024, 10192, 1, 3072, 1024, 1024, 1024, 3072]
    - [16, 22571.0]
  - - [4096, 10192, 1, 1024, 4096, 4096, 4096, 1024]
    - [3, 22688.0]
  - - [1024, 10192, 1, 4096, 1024, 1024, 1024, 4096]
    - [11, 22400.0]
  - - [1024, 10200, 1, 3072, 1024, 1024, 1024, 3072]
    - [11, 22574.0]
  - - [1024, 10184, 1, 1024, 1024, 1024, 1024, 1024]
    - [21, 22297.0]
  - - [4096, 10208, 1, 1024, 4096, 4096, 4096, 1024]
    - [31, 22693.0]
  - - [1024, 10208, 1, 3072, 1024, 1024, 1024, 3072]
    - [3, 22682.0]
  - - [1024, 10208, 1, 4096, 1024, 1024, 1024, 4096]
    - [21, 22481.0]
  - - [1024, 10224, 1, 2048, 1024, 1024, 1024, 2048]
    - [11, 22634.0]
  - - [1024, 10240, 1, 2048, 1024, 1024, 1024, 2048]
    - [11, 22684.0]
  - - [1024, 10120, 1, 1024, 1024, 1024, 1024, 1024]
    - [16, 22247.0]
  - - [1024, 10192, 1, 2048, 1024, 1024, 1024, 2048]
    - [11, 22536.0]
  - - [1024, 10152, 1, 1024, 1024, 1024, 1024, 1024]
    - [16, 22277.0]
  - - [1024, 10080, 1, 3072, 1024, 1024, 1024, 3072]
    - [11, 22515.0]
  - - [100352, 512, 1, 256, 100352, 100352, 100352, 256]
    - [3, 22349.0]
  - - [12544, 2048, 1, 1024, 12544, 12544, 12544, 1024]
    - [16, 22814.0]
  - - [200704, 512, 1, 256, 200704, 200704, 200704, 256]
    - [26, 22467.0]
  - - [25088, 1024, 1, 512, 25088, 25088, 25088, 512]
    - [3, 22601.0]
  - - [50176, 1024, 1, 512, 50176, 50176, 50176, 512]
    - [3, 22803.0]
  - - [6272, 2048, 1, 1024, 6272, 6272, 6272, 1024]
    - [3, 22448.0]
  - - [3136, 128, 128, 256, 3136, 3136, 3136, 256]
    - [16, 21055.0]
  - - [3136, 128, 256, 256, 3136, 3136, 3136, 256]
    - [3, 21324.0]
  - - [784, 256, 128, 512, 784, 784, 784, 512]
    - [3, 19532.0]
  - - [784, 256, 256, 512, 784, 784, 784, 512]
    - [3, 19702.0]
  - - [128, 128, 2048, 64, 128, 128, 128, 64]
    - [0, 15172.0]
  - - [1024, 2560, 1, 30528, 1024, 1024, 1024, 30528]
    - [18, 22450.0]
  - - [128, 128, 1536, 64, 128, 128, 128, 64]
    - [11, 18332.0]
  - - [1024, 12288, 1, 4096, 1024, 1024, 1024, 4096]
    - [21, 22680.0]
  - - [1024, 12288, 1, 1024, 1024, 1024, 1024, 1024]
    - [16, 22448.0]
  - - [4096, 12288, 1, 1024, 4096, 4096, 4096, 1024]
    - [3, 22915.0]
  - - [1024, 1920, 1, 30528, 1024, 1024, 1024, 30528]
    - [21, 21955.0]
  - - [128, 128, 192, 64, 128, 128, 128, 64]
    - [23, 13808.0]
  - - [768, 2048, 1, 2, 768, 768, 768, 2]
    - [0, 612.0]
  - - [3072, 2048, 1, 768, 3072, 3072, 3072, 768]
    - [16, 21542.0]
  - - [768, 2048, 1, 3072, 768, 768, 768, 3072]
    - [11, 20370.0]
  - - [768, 2048, 1, 768, 768, 768, 768, 768]
    - [16, 19452.0]
  - - [384, 384, 144, 64, 384, 384, 384, 64]
    - [16, 17843.0]
  - - [768, 4608, 1, 2, 768, 768, 768, 2]
    - [2, 681.0]
  - - [3072, 4608, 1, 768, 3072, 3072, 3072, 768]
    - [16, 22395.0]
  - - [768, 4608, 1, 3072, 768, 768, 768, 3072]
    - [3, 21797.0]
  - - [768, 4608, 1, 768, 768, 768, 768, 768]
    - [16, 20852.0]
  - - [512, 512, 48, 64, 512, 512, 512, 64]
    - [31, 17976.0]
  - - [128, 128, 256, 64, 128, 128, 128, 64]
    - [2, 11621.0]
  - - [384, 384, 192, 64, 384, 384, 384, 64]
    - [26, 18653.0]
  - - [1024, 4608, 1, 2, 1024, 1024, 1024, 2]
    - [19, 664.0]
  - - [4096, 4608, 1, 1024, 4096, 4096, 4096, 1024]
    - [11, 22737.0]
  - - [1024, 4608, 1, 4096, 1024, 1024, 1024, 4096]
    - [11, 21755.0]
  - - [1024, 4608, 1, 1024, 1024, 1024, 1024, 1024]
    - [3, 20890.0]
  - - [8192, 1024, 1, 1024, 8192, 8192, 8192, 1024]
    - [3, 22271.0]
  - - [8192, 4096, 1, 1024, 8192, 8192, 8192, 1024]
    - [3, 22864.0]
  - - [196, 1024, 128, 256, 196, 196, 196, 256]
    - [16, 15805.0]
  - - [196, 1024, 256, 256, 196, 196, 196, 256]
    - [16, 16062.0]
  - - [196, 256, 128, 1024, 196, 196, 196, 1024]
    - [21, 16086.0]
  - - [196, 256, 256, 1024, 196, 196, 196, 1024]
    - [31, 16456.0]
  - - [196, 512, 128, 1024, 196, 196, 196, 1024]
    - [31, 16691.0]
  - - [196, 512, 256, 1024, 196, 196, 196, 1024]
    - [21, 17020.0]
  - - [3072, 256, 2, 1024, 3072, 3072, 3072, 1024]
    - [3, 19680.0]
  - - [768, 2048, 2, 512, 768, 768, 768, 512]
    - [16, 20549.0]
  - - [2904, 256, 2, 1024, 2904, 2904, 2904, 1024]
    - [3, 18608.0]
  - - [864, 2048, 2, 512, 864, 864, 864, 512]
    - [3, 18538.0]
  - - [2992, 256, 2, 1024, 2992, 2992, 2992, 1024]
    - [11, 18551.0]
  - - [3400, 256, 2, 1024, 3400, 3400, 3400, 1024]
    - [3, 17959.0]
  - - [4032, 256, 2, 1024, 4032, 4032, 4032, 1024]
    - [3, 18569.0]
  - - [15200, 128, 2, 512, 15200, 15200, 15200, 512]
    - [3, 20548.0]
  - - [12288, 128, 2, 512, 12288, 12288, 12288, 512]
    - [3, 20638.0]
  - - [888, 2048, 2, 512, 888, 888, 888, 512]
    - [3, 19073.0]
  - - [13600, 128, 2, 512, 13600, 13600, 13600, 512]
    - [3, 19267.0]
  - - [12880, 128, 2, 512, 12880, 12880, 12880, 512]
    - [16, 18617.0]
  - - [3456, 256, 2, 1024, 3456, 3456, 3456, 1024]
    - [26, 18622.0]
  - - [2944, 256, 2, 1024, 2944, 2944, 2944, 1024]
    - [16, 18574.0]
  - - [2688, 256, 2, 1024, 2688, 2688, 2688, 1024]
    - [16, 17099.0]
  - - [13824, 128, 2, 512, 13824, 13824, 13824, 512]
    - [3, 20409.0]
  - - [3168, 256, 2, 1024, 3168, 3168, 3168, 1024]
    - [11, 19531.0]
  - - [3360, 256, 2, 1024, 3360, 3360, 3360, 1024]
    - [3, 17715.0]
  - - [3552, 256, 2, 1024, 3552, 3552, 3552, 1024]
    - [11, 18563.0]
  - - [11616, 128, 2, 512, 11616, 11616, 11616, 512]
    - [26, 18269.0]
  - - [4200, 256, 2, 1024, 4200, 4200, 4200, 1024]
    - [26, 18934.0]
  - - [840, 2048, 2, 512, 840, 840, 840, 512]
    - [3, 18120.0]
  - - [14208, 128, 2, 512, 14208, 14208, 14208, 512]
    - [26, 19431.0]
  - - [11968, 128, 2, 512, 11968, 11968, 11968, 512]
    - [3, 18503.0]
  - - [3264, 256, 2, 1024, 3264, 3264, 3264, 1024]
    - [3, 17045.0]
  - - [13600, 256, 2, 512, 13600, 13600, 13600, 512]
    - [16, 20508.0]
  - - [12880, 256, 2, 512, 12880, 12880, 12880, 512]
    - [31, 20773.0]
  - - [12288, 256, 2, 512, 12288, 12288, 12288, 512]
    - [31, 21307.0]
  - - [2816, 256, 2, 1024, 2816, 2816, 2816, 1024]
    - [31, 18566.0]
  - - [672, 2048, 2, 512, 672, 672, 672, 512]
    - [3, 17612.0]
  - - [13440, 128, 2, 512, 13440, 13440, 13440, 512]
    - [16, 19964.0]
  - - [13824, 256, 2, 512, 13824, 13824, 13824, 512]
    - [11, 21453.0]
  - - [15200, 256, 2, 512, 15200, 15200, 15200, 512]
    - [26, 21038.0]
  - - [3600, 256, 2, 1024, 3600, 3600, 3600, 1024]
    - [3, 18647.0]
  - - [4032, 1024, 2, 256, 4032, 4032, 4032, 256]
    - [11, 20696.0]
  - - [16128, 128, 2, 512, 16128, 16128, 16128, 512]
    - [3, 21089.0]
  - - [15200, 128, 1, 512, 15200, 15200, 15200, 512]
    - [11, 19395.0]
  - - [13600, 128, 1, 512, 13600, 13600, 13600, 512]
    - [11, 17300.0]
  - - [2904, 1024, 2, 256, 2904, 2904, 2904, 256]
    - [3, 19156.0]
  - - [2992, 1024, 2, 256, 2992, 2992, 2992, 256]
    - [11, 18886.0]
  - - [1536, 2048, 1, 1024, 1536, 1536, 1536, 1024]
    - [3, 20447.0]
  - - [24576, 128, 1, 256, 24576, 24576, 24576, 256]
    - [3, 18105.0]
  - - [24576, 512, 1, 256, 24576, 24576, 24576, 256]
    - [3, 21581.0]
  - - [25760, 128, 1, 256, 25760, 25760, 25760, 256]
    - [11, 17771.0]
  - - [25760, 512, 1, 256, 25760, 25760, 25760, 256]
    - [16, 21124.0]
  - - [6144, 256, 1, 512, 6144, 6144, 6144, 512]
    - [3, 19331.0]
  - - [6440, 256, 1, 512, 6440, 6440, 6440, 512]
    - [3, 16158.0]
  - - [13600, 512, 1, 128, 13600, 13600, 13600, 128]
    - [3, 18131.0]
  - - [9408, 512, 2, 128, 9408, 9408, 9408, 128]
    - [12, 18460.0]
  - - [56000, 256, 2, 64, 56000, 56000, 56000, 64]
    - [27, 16688.0]
  - - [2816, 1024, 2, 256, 2816, 2816, 2816, 256]
    - [21, 19962.0]
  - - [60800, 256, 1, 64, 60800, 60800, 60800, 64]
    - [24, 19105.0]
  - - [2944, 1024, 2, 256, 2944, 2944, 2944, 256]
    - [3, 19994.0]
  - - [11776, 512, 2, 128, 11776, 11776, 11776, 128]
    - [3, 20203.0]
  - - [11616, 512, 2, 128, 11616, 11616, 11616, 128]
    - [16, 19480.0]
  - - [4200, 1024, 2, 256, 4200, 4200, 4200, 256]
    - [3, 20048.0]
  - - [54400, 256, 1, 64, 54400, 54400, 54400, 64]
    - [16, 18438.0]
  - - [15200, 512, 1, 128, 15200, 15200, 15200, 128]
    - [3, 18461.0]
  - - [2688, 1024, 2, 256, 2688, 2688, 2688, 256]
    - [16, 20116.0]
  - - [12672, 512, 2, 128, 12672, 12672, 12672, 128]
    - [16, 20430.0]
  - - [11968, 512, 2, 128, 11968, 11968, 11968, 128]
    - [3, 20257.0]
  - - [46464, 256, 2, 64, 46464, 46464, 46464, 64]
    - [14, 19892.0]
  - - [2400, 256, 2, 1024, 2400, 2400, 2400, 1024]
    - [21, 18741.0]
  - - [2520, 256, 2, 1024, 2520, 2520, 2520, 1024]
    - [11, 20134.0]
  - - [2400, 1024, 2, 256, 2400, 2400, 2400, 256]
    - [31, 18510.0]
  - - [10752, 128, 2, 512, 10752, 10752, 10752, 512]
    - [3, 19096.0]
  - - [45632, 256, 2, 64, 45632, 45632, 45632, 64]
    - [31, 17788.0]
  - - [2520, 1024, 2, 256, 2520, 2520, 2520, 256]
    - [3, 18896.0]
  - - [53760, 256, 2, 64, 53760, 53760, 53760, 64]
    - [27, 18697.0]
  - - [2352, 256, 2, 1024, 2352, 2352, 2352, 1024]
    - [21, 17717.0]
  - - [47872, 256, 2, 64, 47872, 47872, 47872, 64]
    - [31, 18841.0]
  - - [47104, 256, 2, 64, 47104, 47104, 47104, 64]
    - [32, 18574.0]
  - - [50688, 256, 2, 64, 50688, 50688, 50688, 64]
    - [3, 18844.0]
  - - [45056, 256, 2, 64, 45056, 45056, 45056, 64]
    - [26, 18987.0]
  - - [13440, 512, 2, 128, 13440, 13440, 13440, 128]
    - [16, 20470.0]
  - - [2352, 1024, 2, 256, 2352, 2352, 2352, 256]
    - [3, 18193.0]
  - - [11264, 512, 2, 128, 11264, 11264, 11264, 128]
    - [16, 19770.0]
  - - [10560, 128, 2, 512, 10560, 10560, 10560, 512]
    - [11, 17929.0]
  - - [16128, 512, 2, 128, 16128, 16128, 16128, 128]
    - [16, 20225.0]
  - - [37632, 256, 2, 64, 37632, 37632, 37632, 64]
    - [31, 19001.0]
  - - [51520, 256, 2, 64, 51520, 51520, 51520, 64]
    - [16, 18287.0]
  - - [14000, 512, 2, 128, 14000, 14000, 14000, 128]
    - [21, 19292.0]
  - - [10560, 512, 2, 128, 10560, 10560, 10560, 128]
    - [20, 18914.0]
  - - [64512, 256, 2, 64, 64512, 64512, 64512, 64]
    - [31, 19422.0]
  - - [54400, 256, 2, 64, 54400, 54400, 54400, 64]
    - [24, 19935.0]
  - - [3264, 1024, 2, 256, 3264, 3264, 3264, 256]
    - [16, 20583.0]
  - - [10752, 512, 2, 128, 10752, 10752, 10752, 128]
    - [26, 20792.0]
  - - [3168, 1024, 2, 256, 3168, 3168, 3168, 256]
    - [16, 20798.0]
  - - [55296, 256, 2, 256, 55296, 55296, 55296, 256]
    - [11, 22003.0]
  - - [51520, 256, 2, 256, 51520, 51520, 51520, 256]
    - [11, 21854.0]
  - - [11408, 128, 2, 512, 11408, 11408, 11408, 512]
    - [26, 19737.0]
  - - [60800, 256, 2, 256, 60800, 60800, 60800, 256]
    - [3, 22106.0]
  - - [54400, 256, 2, 256, 54400, 54400, 54400, 256]
    - [16, 22074.0]
  - - [60800, 256, 2, 64, 60800, 60800, 60800, 64]
    - [31, 19525.0]
  - - [3800, 1024, 1, 256, 3800, 3800, 3800, 256]
    - [3, 20011.0]
  - - [3400, 1024, 1, 256, 3400, 3400, 3400, 256]
    - [3, 19554.0]
  - - [3072, 1024, 2, 256, 3072, 3072, 3072, 256]
    - [3, 20707.0]
  - - [3600, 1024, 2, 256, 3600, 3600, 3600, 256]
    - [21, 19964.0]
  - - [12288, 512, 2, 128, 12288, 12288, 12288, 128]
    - [3, 20481.0]
  - - [49152, 256, 2, 256, 49152, 49152, 49152, 256]
    - [3, 22047.0]
  - - [12880, 512, 2, 128, 12880, 12880, 12880, 128]
    - [11, 20330.0]
  - - [11408, 512, 2, 128, 11408, 11408, 11408, 128]
    - [3, 20179.0]
  - - [42240, 256, 2, 64, 42240, 42240, 42240, 64]
    - [9, 19751.0]
  - - [1008, 2048, 2, 512, 1008, 1008, 1008, 512]
    - [3, 20757.0]
  - - [3360, 1024, 2, 256, 3360, 3360, 3360, 256]
    - [11, 20068.0]
  - - [14208, 512, 2, 128, 14208, 14208, 14208, 128]
    - [21, 20887.0]
  - - [56832, 256, 2, 64, 56832, 56832, 56832, 64]
    - [11, 19636.0]
  - - [43008, 256, 2, 64, 43008, 43008, 43008, 64]
    - [3, 19226.0]
  - - [13600, 512, 2, 128, 13600, 13600, 13600, 128]
    - [3, 20651.0]
  - - [2640, 1024, 2, 256, 2640, 2640, 2640, 256]
    - [3, 20189.0]
  - - [13824, 512, 2, 128, 13824, 13824, 13824, 128]
    - [26, 20933.0]
  - - [3800, 256, 2, 1024, 3800, 3800, 3800, 1024]
    - [26, 20413.0]
  - - [55296, 256, 2, 64, 55296, 55296, 55296, 64]
    - [11, 19429.0]
  - - [2640, 256, 2, 1024, 2640, 2640, 2640, 1024]
    - [11, 17088.0]
  - - [15200, 512, 2, 128, 15200, 15200, 15200, 128]
    - [30, 20620.0]
  - - [3552, 1024, 2, 256, 3552, 3552, 3552, 256]
    - [11, 20614.0]
  - - [3456, 1024, 2, 256, 3456, 3456, 3456, 256]
    - [3, 21322.0]
  - - [49152, 256, 2, 64, 49152, 49152, 49152, 64]
    - [11, 19294.0]
  - - [3400, 1024, 2, 256, 3400, 3400, 3400, 256]
    - [21, 20504.0]
  - - [3800, 1024, 2, 256, 3800, 3800, 3800, 256]
    - [3, 20954.0]
  - - [6912, 256, 1, 512, 6912, 6912, 6912, 512]
    - [11, 18765.0]
  - - [6800, 256, 1, 512, 6800, 6800, 6800, 512]
    - [21, 17016.0]
  - - [27648, 128, 1, 256, 27648, 27648, 27648, 256]
    - [3, 20414.0]
  - - [27200, 128, 1, 256, 27200, 27200, 27200, 256]
    - [11, 18302.0]
  - - [30400, 128, 1, 256, 30400, 30400, 30400, 256]
    - [3, 19010.0]
  - - [7600, 256, 1, 512, 7600, 7600, 7600, 512]
    - [3, 20116.0]
  - - [6144, 1024, 1, 512, 6144, 6144, 6144, 512]
    - [3, 21276.0]
  - - [6912, 1024, 1, 512, 6912, 6912, 6912, 512]
    - [11, 21773.0]
  - - [6440, 1024, 1, 512, 6440, 6440, 6440, 512]
    - [3, 20758.0]
  - - [27648, 512, 1, 256, 27648, 27648, 27648, 256]
    - [3, 21648.0]
  - - [1728, 2048, 1, 1024, 1728, 1728, 1728, 1024]
    - [11, 19850.0]
  - - [27200, 512, 1, 256, 27200, 27200, 27200, 256]
    - [26, 21269.0]
  - - [6800, 1024, 1, 512, 6800, 6800, 6800, 512]
    - [11, 21163.0]
  - - [7600, 1024, 1, 512, 7600, 7600, 7600, 512]
    - [3, 21608.0]
  - - [30400, 512, 1, 256, 30400, 30400, 30400, 256]
    - [16, 21439.0]
  - - [12544, 1024, 1, 1024, 12544, 12544, 12544, 1024]
    - [3, 22393.0]
  - - [173280, 128, 1, 64, 173280, 173280, 173280, 64]
    - [30, 18590.0]
  - - [231040, 128, 1, 64, 231040, 231040, 231040, 64]
    - [3, 19528.0]
  - - [25992, 128, 1, 64, 25992, 25992, 25992, 64]
    - [0, 14890.0]
  - - [2852, 256, 2, 1024, 2852, 2852, 2852, 1024]
    - [11, 18253.0]
  - - [3220, 256, 2, 1024, 3220, 3220, 3220, 1024]
    - [3, 17290.0]
  - - [850, 2048, 2, 512, 850, 850, 850, 512]
    - [3, 18823.0]
  - - [805, 2048, 2, 512, 805, 805, 805, 512]
    - [3, 17960.0]
  - - [3036, 256, 2, 1024, 3036, 3036, 3036, 1024]
    - [11, 18949.0]
  - - [713, 2048, 2, 512, 713, 713, 713, 512]
    - [3, 17955.0]
  - - [850, 2048, 1, 512, 850, 850, 850, 512]
    - [3, 16951.0]
  - - [660, 2048, 2, 512, 660, 660, 660, 512]
    - [26, 16470.0]
  - - [726, 2048, 2, 512, 726, 726, 726, 512]
    - [26, 18586.0]
  - - [3500, 256, 2, 1024, 3500, 3500, 3500, 1024]
    - [11, 18354.0]
  - - [3700, 256, 2, 1024, 3700, 3700, 3700, 1024]
    - [3, 18966.0]
  - - [748, 2048, 2, 512, 748, 748, 748, 512]
    - [3, 18868.0]
  - - [3036, 1024, 2, 256, 3036, 3036, 3036, 256]
    - [11, 19086.0]
  - - [2852, 1024, 2, 256, 2852, 2852, 2852, 256]
    - [3, 18980.0]
  - - [950, 2048, 1, 512, 950, 950, 950, 512]
    - [11, 16422.0]
  - - [3700, 1024, 2, 256, 3700, 3700, 3700, 256]
    - [26, 19670.0]
  - - [3500, 1024, 2, 256, 3500, 3500, 3500, 256]
    - [3, 19476.0]
  - - [3220, 1024, 2, 256, 3220, 3220, 3220, 256]
    - [3, 20007.0]
  - - [950, 2048, 2, 512, 950, 950, 950, 512]
    - [3, 18820.0]
  - - [1610, 2048, 1, 1024, 1610, 1610, 1610, 1024]
    - [3, 19497.0]
  - - [1700, 2048, 1, 1024, 1700, 1700, 1700, 1024]
    - [3, 18921.0]
  - - [1900, 2048, 1, 1024, 1900, 1900, 1900, 1024]
    - [3, 21047.0]
  - - [1444, 256, 120, 128, 1444, 1444, 1444, 128]
    - [3, 19467.0]
  - - [1444, 256, 139, 128, 1444, 1444, 1444, 128]
    - [31, 19512.0]
  - - [1444, 256, 160, 128, 1444, 1444, 1444, 128]
    - [3, 19583.0]
  - - [1444, 256, 18, 128, 1444, 1444, 1444, 128]
    - [3, 17885.0]
  - - [1444, 256, 19, 128, 1444, 1444, 1444, 128]
    - [11, 18355.0]
  - - [1444, 256, 120, 256, 1444, 1444, 1444, 256]
    - [3, 20538.0]
  - - [1444, 256, 139, 256, 1444, 1444, 1444, 256]
    - [3, 20628.0]
  - - [1444, 256, 160, 256, 1444, 1444, 1444, 256]
    - [3, 20641.0]
  - - [1444, 256, 18, 256, 1444, 1444, 1444, 256]
    - [3, 19248.0]
  - - [1444, 256, 19, 256, 1444, 1444, 1444, 256]
    - [3, 19629.0]
  - - [361, 256, 120, 512, 361, 361, 361, 512]
    - [3, 20006.0]
  - - [361, 256, 139, 512, 361, 361, 361, 512]
    - [3, 19648.0]
  - - [361, 256, 160, 512, 361, 361, 361, 512]
    - [3, 19372.0]
  - - [361, 256, 18, 512, 361, 361, 361, 512]
    - [31, 16886.0]
  - - [361, 256, 19, 512, 361, 361, 361, 512]
    - [31, 17973.0]
  - - [200716, 128, 1, 64, 200716, 200716, 200716, 64]
    - [17, 18253.0]
  - - [27436, 128, 1, 64, 27436, 27436, 27436, 64]
    - [23, 13394.0]
  - - [1024, 1024, 160, 96, 1024, 1024, 1024, 96]
    - [3, 21149.0]
  - - [1920, 16384, 1, 25216, 1920, 1920, 1920, 25216]
    - [16, 22660.0]
  - - [3840, 16384, 1, 1920, 3840, 3840, 3840, 1920]
    - [14, 23362.0]
  - - [1920, 16384, 1, 3840, 1920, 1920, 1920, 3840]
    - [3, 22997.0]
  - - [960, 16384, 1, 1920, 960, 960, 960, 1920]
    - [20, 21277.0]
  - - [1920, 16384, 1, 2880, 1920, 1920, 1920, 2880]
    - [14, 23575.0]
  - - [1024, 1024, 40, 96, 1024, 1024, 1024, 96]
    - [3, 20256.0]
  - - [1920, 4096, 1, 25216, 1920, 1920, 1920, 25216]
    - [11, 22498.0]
  - - [3840, 4096, 1, 1920, 3840, 3840, 3840, 1920]
    - [14, 23330.0]
  - - [1920, 4096, 1, 3840, 1920, 1920, 1920, 3840]
    - [3, 22754.0]
  - - [960, 4096, 1, 1920, 960, 960, 960, 1920]
    - [11, 20173.0]
  - - [1920, 4096, 1, 2880, 1920, 1920, 1920, 2880]
    - [14, 23061.0]
  - - [1024, 1024, 80, 96, 1024, 1024, 1024, 96]
    - [11, 20869.0]
  - - [1920, 8192, 1, 25216, 1920, 1920, 1920, 25216]
    - [11, 22657.0]
  - - [3840, 8192, 1, 1920, 3840, 3840, 3840, 1920]
    - [24, 23373.0]
  - - [1920, 8192, 1, 3840, 1920, 1920, 1920, 3840]
    - [16, 22814.0]
  - - [960, 8192, 1, 1920, 960, 960, 960, 1920]
    - [14, 21175.0]
  - - [1920, 8192, 1, 2880, 1920, 1920, 1920, 2880]
    - [14, 23536.0]
  - - [1024, 1024, 96, 96, 1024, 1024, 1024, 96]
    - [3, 20980.0]
  - - [2304, 16384, 1, 12672, 2304, 2304, 2304, 12672]
    - [3, 22783.0]
  - - [2304, 16384, 1, 2304, 2304, 2304, 2304, 2304]
    - [16, 22962.0]
  - - [576, 16384, 1, 2304, 576, 576, 576, 2304]
    - [3, 20398.0]
  - - [2304, 16384, 1, 1728, 2304, 2304, 2304, 1728]
    - [14, 23469.0]
  - - [1024, 1024, 24, 96, 1024, 1024, 1024, 96]
    - [11, 19897.0]
  - - [2304, 4096, 1, 12672, 2304, 2304, 2304, 12672]
    - [1, 22821.0]
  - - [2304, 4096, 1, 2304, 2304, 2304, 2304, 2304]
    - [3, 22664.0]
  - - [576, 4096, 1, 2304, 576, 576, 576, 2304]
    - [5, 19651.0]
  - - [2304, 4096, 1, 1728, 2304, 2304, 2304, 1728]
    - [14, 23165.0]
  - - [1024, 1024, 48, 96, 1024, 1024, 1024, 96]
    - [11, 20856.0]
  - - [2304, 8192, 1, 12672, 2304, 2304, 2304, 12672]
    - [1, 23035.0]
  - - [2304, 8192, 1, 2304, 2304, 2304, 2304, 2304]
    - [26, 22904.0]
  - - [576, 8192, 1, 2304, 576, 576, 576, 2304]
    - [5, 20191.0]
  - - [2304, 8192, 1, 1728, 2304, 2304, 2304, 1728]
    - [14, 23425.0]
  - - [1024, 1024, 16, 96, 1024, 1024, 1024, 96]
    - [3, 19233.0]
  - - [3072, 4096, 1, 6400, 3072, 3072, 3072, 6400]
    - [16, 22701.0]
  - - [1536, 4096, 1, 3072, 1536, 1536, 1536, 3072]
    - [3, 21850.0]
  - - [3072, 4096, 1, 1536, 3072, 3072, 3072, 1536]
    - [11, 22580.0]
  - - [384, 4096, 1, 3072, 384, 384, 384, 3072]
    - [11, 20341.0]
  - - [3072, 4096, 1, 1152, 3072, 3072, 3072, 1152]
    - [14, 22882.0]
  - - [1024, 1024, 32, 96, 1024, 1024, 1024, 96]
    - [11, 20439.0]
  - - [3072, 8192, 1, 6400, 3072, 3072, 3072, 6400]
    - [3, 22986.0]
  - - [1536, 8192, 1, 3072, 1536, 1536, 1536, 3072]
    - [21, 22642.0]
  - - [3072, 8192, 1, 1536, 3072, 3072, 3072, 1536]
    - [16, 22852.0]
  - - [384, 8192, 1, 3072, 384, 384, 384, 3072]
    - [11, 20952.0]
  - - [3072, 8192, 1, 1152, 3072, 3072, 3072, 1152]
    - [14, 23363.0]
  - - [2048, 4096, 1, 2048, 2048, 2048, 2048, 2048]
    - [3, 22464.0]
  - - [2048, 4096, 1, 4096, 2048, 2048, 2048, 4096]
    - [3, 22487.0]
  - - [4096, 4096, 1, 2048, 4096, 4096, 4096, 2048]
    - [3, 22702.0]
  - - [1024, 2283, 1, 29000, 1024, 1024, 1024, 29000]
    - [28, 20167.0]
  - - [1024, 2296, 1, 29000, 1024, 1024, 1024, 29000]
    - [18, 20298.0]
  - - [1024, 2306, 1, 29000, 1024, 1024, 1024, 29000]
    - [18, 20239.0]
  - - [1024, 2309, 1, 29000, 1024, 1024, 1024, 29000]
    - [18, 20259.0]
  - - [1024, 2318, 1, 29000, 1024, 1024, 1024, 29000]
    - [5, 20345.0]
  - - [1024, 2320, 1, 29000, 1024, 1024, 1024, 29000]
    - [5, 20359.0]
  - - [1024, 2324, 1, 29000, 1024, 1024, 1024, 29000]
    - [18, 20401.0]
  - - [1024, 2325, 1, 29000, 1024, 1024, 1024, 29000]
    - [28, 20404.0]
  - - [1024, 2329, 1, 29000, 1024, 1024, 1024, 29000]
    - [5, 20435.0]
  - - [1024, 2338, 1, 29000, 1024, 1024, 1024, 29000]
    - [5, 20508.0]
  - - [1024, 2345, 1, 29000, 1024, 1024, 1024, 29000]
    - [18, 20582.0]
  - - [1024, 2350, 1, 29000, 1024, 1024, 1024, 29000]
    - [28, 20621.0]
  - - [1024, 2362, 1, 29000, 1024, 1024, 1024, 29000]
    - [18, 20721.0]
  - - [1024, 2366, 1, 29000, 1024, 1024, 1024, 29000]
    - [28, 20768.0]
  - - [1024, 2368, 1, 29000, 1024, 1024, 1024, 29000]
    - [18, 20807.0]
  - - [1024, 2374, 1, 29000, 1024, 1024, 1024, 29000]
    - [28, 20852.0]
  - - [1024, 2390, 1, 29000, 1024, 1024, 1024, 29000]
    - [28, 20970.0]
  - - [512, 512, 320, 64, 512, 512, 512, 64]
    - [0, 17504.0]
  - - [512, 512, 80, 64, 512, 512, 512, 64]
    - [26, 18915.0]
  - - [2560, 1024, 1, 2560, 2560, 2560, 2560, 2560]
    - [5, 22072.0]
  - - [2560, 1024, 1, 4096, 2560, 2560, 2560, 4096]
    - [11, 22061.0]
  - - [4096, 1024, 1, 2560, 4096, 4096, 4096, 2560]
    - [3, 21836.0]
  - - [1024, 1024, 512, 64, 1024, 1024, 1024, 64]
    - [6, 17267.0]
  - - [1024, 32768, 1, 3072, 1024, 1024, 1024, 3072]
    - [21, 23038.0]
  - - [1024, 32768, 1, 4096, 1024, 1024, 1024, 4096]
    - [21, 23036.0]
  - - [1024, 32768, 1, 50304, 1024, 1024, 1024, 50304]
    - [11, 22864.0]
  - - [4096, 32768, 1, 1024, 4096, 4096, 4096, 1024]
    - [3, 23003.0]
  - - [1024, 1024, 24, 128, 1024, 1024, 1024, 128]
    - [11, 20852.0]
  - - [128, 1024, 24, 1024, 128, 128, 128, 1024]
    - [11, 20702.0]
  - - [1024, 780, 1, 30522, 1024, 1024, 1024, 30522]
    - [35, 17858.0]
  - - [1024, 308, 1, 30522, 1024, 1024, 1024, 30522]
    - [34, 16875.0]
  - - [1024, 800, 1, 30522, 1024, 1024, 1024, 30522]
    - [36, 18280.0]
  - - [1024, 820, 1, 30522, 1024, 1024, 1024, 30522]
    - [35, 18755.0]
  - - [1024, 385, 1, 30522, 1024, 1024, 1024, 30522]
    - [35, 14784.0]
  - - [1024, 462, 1, 30522, 1024, 1024, 1024, 30522]
    - [35, 17615.0]
  - - [1024, 640, 1, 30528, 1024, 1024, 1024, 30528]
    - [35, 21355.0]
  - - [2048, 199, 1, 29000, 2048, 2048, 2048, 29000]
    - [36, 15217.0]
  - - [2048, 221, 1, 29000, 2048, 2048, 2048, 29000]
    - [35, 16835.0]
  - - [2048, 224, 1, 29000, 2048, 2048, 2048, 29000]
    - [35, 17051.0]
  - - [2048, 229, 1, 29000, 2048, 2048, 2048, 29000]
    - [42, 17539.0]
  - - [2048, 234, 1, 29000, 2048, 2048, 2048, 29000]
    - [36, 17952.0]
  - - [2048, 242, 1, 29000, 2048, 2048, 2048, 29000]
    - [42, 18360.0]
  - - [2048, 246, 1, 29000, 2048, 2048, 2048, 29000]
    - [42, 18608.0]
  - - [2048, 247, 1, 29000, 2048, 2048, 2048, 29000]
    - [36, 18729.0]
  - - [2048, 256, 1, 29000, 2048, 2048, 2048, 29000]
    - [35, 19460.0]
  - - [2048, 262, 1, 29000, 2048, 2048, 2048, 29000]
    - [34, 14717.0]
  - - [2048, 264, 1, 29000, 2048, 2048, 2048, 29000]
    - [39, 14822.0]
  - - [2048, 265, 1, 29000, 2048, 2048, 2048, 29000]
    - [41, 14874.0]
  - - [2048, 274, 1, 29000, 2048, 2048, 2048, 29000]
    - [34, 15378.0]
  - - [2048, 277, 1, 29000, 2048, 2048, 2048, 29000]
    - [34, 15520.0]
  - - [2048, 279, 1, 29000, 2048, 2048, 2048, 29000]
    - [34, 15635.0]
  - - [2048, 288, 1, 29000, 2048, 2048, 2048, 29000]
    - [34, 16100.0]
  - - [2048, 296, 1, 29000, 2048, 2048, 2048, 29000]
    - [41, 16579.0]
  - - [2048, 315, 1, 29000, 2048, 2048, 2048, 29000]
    - [34, 17573.0]
  - - [2048, 335, 1, 29000, 2048, 2048, 2048, 29000]
    - [42, 18166.0]
  - - [1024, 561, 1, 29000, 1024, 1024, 1024, 29000]
    - [35, 18838.0]
  - - [1024, 574, 1, 29000, 1024, 1024, 1024, 29000]
    - [35, 19167.0]
  - - [1024, 600, 1, 29000, 1024, 1024, 1024, 29000]
    - [35, 20025.0]
  - - [1024, 608, 1, 29000, 1024, 1024, 1024, 29000]
    - [35, 20218.0]
  - - [1024, 615, 1, 29000, 1024, 1024, 1024, 29000]
    - [35, 20387.0]
  - - [1024, 622, 1, 29000, 1024, 1024, 1024, 29000]
    - [35, 20684.0]
  - - [1024, 625, 1, 29000, 1024, 1024, 1024, 29000]
    - [35, 20685.0]
  - - [1024, 626, 1, 29000, 1024, 1024, 1024, 29000]
    - [35, 20720.0]
  - - [1024, 628, 1, 29000, 1024, 1024, 1024, 29000]
    - [35, 20794.0]
  - - [1024, 636, 1, 29000, 1024, 1024, 1024, 29000]
    - [35, 21104.0]
  - - [1024, 651, 1, 29000, 1024, 1024, 1024, 29000]
    - [40, 17715.0]
  - - [1024, 658, 1, 29000, 1024, 1024, 1024, 29000]
    - [35, 17855.0]
  - - [1024, 669, 1, 29000, 1024, 1024, 1024, 29000]
    - [35, 18148.0]
  - - [1024, 670, 1, 29000, 1024, 1024, 1024, 29000]
    - [40, 18137.0]
  - - [1024, 672, 1, 29000, 1024, 1024, 1024, 29000]
    - [35, 18200.0]
  - - [1024, 684, 1, 29000, 1024, 1024, 1024, 29000]
    - [35, 18541.0]
  - - [1024, 716, 1, 29000, 1024, 1024, 1024, 29000]
    - [37, 19456.0]
  - - [1024, 730, 1, 29000, 1024, 1024, 1024, 29000]
    - [38, 19866.0]
  - - [1024, 1024, 1, 3328, 1024, 1024, 1024, 3328]
    - [58, 16293.0]
  - - [128, 6784, 1, 3328, 128, 128, 128, 3328]
    - [65, 16772.0]
  - - [256, 4288, 1, 3328, 256, 256, 256, 3328]
    - [58, 16820.0]
  - - [704, 1856, 1, 3328, 704, 704, 704, 3328]
    - [46, 15670.0]
  - - [448, 1024, 1, 1280, 448, 448, 448, 1280]
    - [57, 12352.0]
  - - [1024, 704, 1, 256, 1024, 1024, 1024, 256]
    - [46, 11740.0]
  - - [256, 1856, 1, 1280, 256, 256, 256, 1280]
    - [64, 15413.0]
  - - [256, 2944, 1, 3328, 256, 256, 256, 3328]
    - [46, 16159.0]
  - - [128, 3584, 1, 1280, 128, 128, 128, 1280]
    - [70, 14246.0]
  - - [4288, 256, 1, 256, 4288, 4288, 4288, 256]
    - [46, 13107.0]
  - - [5888, 64, 1, 3328, 5888, 5888, 5888, 3328]
    - [58, 13053.0]
  - - [2944, 256, 1, 3328, 2944, 2944, 2944, 3328]
    - [58, 16264.0]
  - - [1408, 448, 1, 1280, 1408, 1408, 1408, 1280]
    - [74, 16941.0]
  - - [1408, 256, 1, 1280, 1408, 1408, 1408, 1280]
    - [45, 12470.0]
  - - [6784, 64, 1, 256, 6784, 6784, 6784, 256]
    - [52, 9325.0]
  - - [2368, 128, 1, 3328, 2368, 2368, 2368, 3328]
    - [71, 14378.0]
  - - [2944, 128, 1, 256, 2944, 2944, 2944, 256]
    - [58, 8162.0]
  - - [448, 1408, 1, 256, 448, 448, 448, 256]
    - [48, 10751.0]
  - - [64, 5056, 1, 3328, 64, 64, 64, 3328]
    - [74, 12903.0]
  - - [256, 3584, 1, 3328, 256, 256, 256, 3328]
    - [59, 17488.0]
  - - [256, 1408, 1, 256, 256, 256, 256, 256]
    - [68, 7914.0]
  - - [5056, 64, 1, 1280, 5056, 5056, 5056, 1280]
    - [58, 12831.0]
  - - [2368, 128, 1, 256, 2368, 2368, 2368, 256]
    - [57, 7225.0]
  - - [4288, 128, 1, 1280, 4288, 4288, 4288, 1280]
    - [47, 13851.0]
  - - [5888, 64, 1, 256, 5888, 5888, 5888, 256]
    - [70, 8134.0]
  - - [1856, 256, 1, 1280, 1856, 1856, 1856, 1280]
    - [44, 14669.0]
  - - [64, 5888, 1, 3328, 64, 64, 64, 3328]
    - [45, 11443.0]
  - - [1024, 704, 1, 1280, 1024, 1024, 1024, 1280]
    - [58, 14577.0]
  - - [256, 1408, 1, 3328, 256, 256, 256, 3328]
    - [46, 12174.0]
  - - [6784, 128, 1, 3328, 6784, 6784, 6784, 3328]
    - [59, 16599.0]
  - - [704, 704, 1, 3328, 704, 704, 704, 3328]
    - [57, 14049.0]
  - - [3584, 256, 1, 3328, 3584, 3584, 3584, 3328]
    - [71, 17504.0]
  - - [128, 3584, 1, 3328, 128, 128, 128, 3328]
    - [52, 15295.0]
  - - [128, 2944, 1, 1280, 128, 128, 128, 1280]
    - [52, 11759.0]
  - - [448, 1856, 1, 1280, 448, 448, 448, 1280]
    - [47, 14890.0]
  - - [3584, 128, 1, 256, 3584, 3584, 3584, 256]
    - [44, 9787.0]
  - - [448, 1408, 1, 3328, 448, 448, 448, 3328]
    - [69, 13614.0]
  - - [704, 1024, 1, 256, 704, 704, 704, 256]
    - [47, 11392.0]
  - - [256, 3584, 1, 256, 256, 256, 256, 256]
    - [71, 13240.0]
  - - [1408, 704, 1, 256, 1408, 1408, 1408, 256]
    - [46, 12562.0]
  - - [448, 2944, 1, 3328, 448, 448, 448, 3328]
    - [47, 15389.0]
  - - [64, 5888, 1, 256, 64, 64, 64, 256]
    - [51, 7572.0]
  - - [448, 2368, 1, 1280, 448, 448, 448, 1280]
    - [59, 14709.0]
  - - [704, 704, 1, 256, 704, 704, 704, 256]
    - [45, 9568.0]
  - - [128, 4288, 1, 3328, 128, 128, 128, 3328]
    - [51, 15412.0]
  - - [256, 2368, 1, 256, 256, 256, 256, 256]
    - [46, 11213.0]
  - - [1024, 448, 1, 3328, 1024, 1024, 1024, 3328]
    - [68, 15347.0]
  - - [1856, 704, 1, 1280, 1856, 1856, 1856, 1280]
    - [46, 15155.0]
  - - [1024, 1024, 1, 1280, 1024, 1024, 1024, 1280]
    - [64, 15990.0]
  - - [256, 2944, 1, 256, 256, 256, 256, 256]
    - [46, 12089.0]
  - - [128, 6784, 1, 1280, 128, 128, 128, 1280]
    - [53, 15761.0]
  - - [1408, 704, 1, 3328, 1408, 1408, 1408, 3328]
    - [70, 15365.0]
  - - [128, 5888, 1, 1280, 128, 128, 128, 1280]
    - [52, 15154.0]
  - - [704, 1408, 1, 3328, 704, 704, 704, 3328]
    - [46, 15203.0]
  - - [448, 704, 1, 1280, 448, 448, 448, 1280]
    - [57, 11881.0]
  - - [6784, 128, 1, 256, 6784, 6784, 6784, 256]
    - [71, 12732.0]
  - - [704, 448, 1, 256, 704, 704, 704, 256]
    - [69, 7947.0]
  - - [256, 1856, 1, 3328, 256, 256, 256, 3328]
    - [58, 15832.0]
  - - [1024, 704, 1, 3328, 1024, 1024, 1024, 3328]
    - [51, 15435.0]
  - - [128, 4288, 1, 256, 128, 128, 128, 256]
    - [49, 10408.0]
  - - [64, 6784, 1, 3328, 64, 64, 64, 3328]
    - [69, 13143.0]
  - - [2944, 256, 1, 1280, 2944, 2944, 2944, 1280]
    - [52, 15283.0]
  - - [1856, 704, 1, 256, 1856, 1856, 1856, 256]
    - [46, 13097.0]
  - - [704, 1856, 1, 256, 704, 704, 704, 256]
    - [58, 12905.0]
  - - [2944, 448, 1, 256, 2944, 2944, 2944, 256]
    - [52, 13593.0]
  - - [2368, 128, 1, 1280, 2368, 2368, 2368, 1280]
    - [59, 12301.0]
  - - [64, 6784, 1, 256, 64, 64, 64, 256]
    - [51, 8524.0]
  - - [64, 5056, 1, 1280, 64, 64, 64, 1280]
    - [51, 11760.0]
  - - [704, 448, 1, 3328, 704, 704, 704, 3328]
    - [57, 13084.0]
  - - [2368, 256, 1, 1280, 2368, 2368, 2368, 1280]
    - [47, 15263.0]
  - - [2368, 448, 1, 1280, 2368, 2368, 2368, 1280]
    - [46, 15587.0]
  - - [128, 3584, 1, 256, 128, 128, 128, 256]
    - [64, 12058.0]
  - - [1856, 448, 1, 3328, 1856, 1856, 1856, 3328]
    - [71, 15891.0]
  - - [128, 5056, 1, 256, 128, 128, 128, 256]
    - [44, 12863.0]
  - - [4288, 256, 1, 1280, 4288, 4288, 4288, 1280]
    - [51, 16233.0]
  - - [4288, 128, 1, 3328, 4288, 4288, 4288, 3328]
    - [71, 15141.0]
  - - [448, 2368, 1, 3328, 448, 448, 448, 3328]
    - [47, 15328.0]
  - - [256, 1408, 1, 1280, 256, 256, 256, 1280]
    - [46, 11330.0]
  - - [128, 2368, 1, 256, 128, 128, 128, 256]
    - [64, 7653.0]
  - - [6784, 64, 1, 3328, 6784, 6784, 6784, 3328]
    - [52, 14499.0]
  - - [128, 2944, 1, 3328, 128, 128, 128, 3328]
    - [64, 12722.0]
  - - [2944, 448, 1, 3328, 2944, 2944, 2944, 3328]
    - [70, 15994.0]
  - - [5888, 128, 1, 256, 5888, 5888, 5888, 256]
    - [44, 12029.0]
  - - [5056, 64, 1, 256, 5056, 5056, 5056, 256]
    - [45, 7656.0]
  - - [128, 5056, 1, 3328, 128, 128, 128, 3328]
    - [76, 17602.0]
  - - [256, 4288, 1, 1280, 256, 256, 256, 1280]
    - [56, 16365.0]
  - - [4288, 128, 1, 256, 4288, 4288, 4288, 256]
    - [44, 9558.0]
  - - [3584, 256, 1, 256, 3584, 3584, 3584, 256]
    - [71, 13561.0]
  - - [128, 2944, 1, 256, 128, 128, 128, 256]
    - [74, 8360.0]
  - - [3584, 128, 1, 3328, 3584, 3584, 3584, 3328]
    - [58, 15310.0]
  - - [5888, 128, 1, 3328, 5888, 5888, 5888, 3328]
    - [64, 16043.0]
  - - [1408, 704, 1, 1280, 1408, 1408, 1408, 1280]
    - [70, 14867.0]
  - - [448, 1408, 1, 1280, 448, 448, 448, 1280]
    - [45, 13065.0]
  - - [704, 1408, 1, 1280, 704, 704, 704, 1280]
    - [58, 14658.0]
  - - [448, 2944, 1, 256, 448, 448, 448, 256]
    - [69, 12636.0]
  - - [448, 2368, 1, 256, 448, 448, 448, 256]
    - [47, 11922.0]
  - - [64, 6784, 1, 1280, 64, 64, 64, 1280]
    - [74, 12124.0]
  - - [128, 2368, 1, 3328, 128, 128, 128, 3328]
    - [76, 14191.0]
  - - [5056, 64, 1, 3328, 5056, 5056, 5056, 3328]
    - [64, 15318.0]
  - - [5056, 128, 1, 3328, 5056, 5056, 5056, 3328]
    - [71, 17859.0]
  - - [448, 704, 1, 256, 448, 448, 448, 256]
    - [45, 7646.0]
  - - [1856, 256, 1, 3328, 1856, 1856, 1856, 3328]
    - [44, 15947.0]
  - - [2944, 128, 1, 3328, 2944, 2944, 2944, 3328]
    - [64, 12737.0]
  - - [1024, 1024, 1, 256, 1024, 1024, 1024, 256]
    - [46, 13146.0]
  - - [704, 1024, 1, 1280, 704, 704, 704, 1280]
    - [46, 14472.0]
  - - [256, 4288, 1, 256, 256, 256, 256, 256]
    - [58, 13655.0]
  - - [2368, 256, 1, 256, 2368, 2368, 2368, 256]
    - [47, 10674.0]
  - - [256, 2368, 1, 3328, 256, 256, 256, 3328]
    - [59, 16673.0]
  - - [704, 448, 1, 1280, 704, 704, 704, 1280]
    - [69, 12138.0]
  - - [256, 1856, 1, 256, 256, 256, 256, 256]
    - [69, 11242.0]
  - - [64, 5056, 1, 256, 64, 64, 64, 256]
    - [57, 9043.0]
  - - [1408, 256, 1, 3328, 1408, 1408, 1408, 3328]
    - [70, 12156.0]
  - - [2368, 448, 1, 256, 2368, 2368, 2368, 256]
    - [70, 13222.0]
  - - [4288, 256, 1, 3328, 4288, 4288, 4288, 3328]
    - [70, 16732.0]
  - - [2944, 256, 1, 256, 2944, 2944, 2944, 256]
    - [46, 12059.0]
  - - [6784, 64, 1, 1280, 6784, 6784, 6784, 1280]
    - [58, 13450.0]
  - - [704, 1856, 1, 1280, 704, 704, 704, 1280]
    - [70, 15193.0]
  - - [448, 1024, 1, 3328, 448, 448, 448, 3328]
    - [45, 13024.0]
  - - [2944, 448, 1, 1280, 2944, 2944, 2944, 1280]
    - [58, 15594.0]
  - - [448, 1024, 1, 256, 448, 448, 448, 256]
    - [45, 9218.0]
  - - [1024, 448, 1, 1280, 1024, 1024, 1024, 1280]
    - [56, 14378.0]
  - - [256, 2368, 1, 1280, 256, 256, 256, 1280]
    - [47, 15305.0]
  - - [128, 5056, 1, 1280, 128, 128, 128, 1280]
    - [53, 16275.0]
  - - [1408, 256, 1, 256, 1408, 1408, 1408, 256]
    - [44, 7781.0]
  - - [128, 5888, 1, 3328, 128, 128, 128, 3328]
    - [64, 15841.0]
  - - [2368, 448, 1, 3328, 2368, 2368, 2368, 3328]
    - [46, 16191.0]
  - - [3584, 128, 1, 1280, 3584, 3584, 3584, 1280]
    - [46, 14163.0]
  - - [1408, 448, 1, 256, 1408, 1408, 1408, 256]
    - [46, 11584.0]
  - - [2368, 256, 1, 3328, 2368, 2368, 2368, 3328]
    - [71, 16709.0]
  - - [5888, 128, 1, 1280, 5888, 5888, 5888, 1280]
    - [58, 15206.0]
  - - [256, 3584, 1, 1280, 256, 256, 256, 1280]
    - [59, 16753.0]
  - - [128, 5888, 1, 256, 128, 128, 128, 256]
    - [64, 11779.0]
  - - [1408, 448, 1, 3328, 1408, 1408, 1408, 3328]
    - [70, 16321.0]
  - - [64, 5888, 1, 1280, 64, 64, 64, 1280]
    - [51, 10643.0]
  - - [704, 704, 1, 1280, 704, 704, 704, 1280]
    - [57, 13222.0]
  - - [128, 2368, 1, 1280, 128, 128, 128, 1280]
    - [46, 12662.0]
  - - [3584, 256, 1, 1280, 3584, 3584, 3584, 1280]
    - [71, 17215.0]
  - - [5888, 64, 1, 1280, 5888, 5888, 5888, 1280]
    - [45, 12754.0]
  - - [5056, 128, 1, 1280, 5056, 5056, 5056, 1280]
    - [71, 16326.0]
  - - [448, 1856, 1, 3328, 448, 448, 448, 3328]
    - [47, 15694.0]
  - - [1024, 448, 1, 256, 1024, 1024, 1024, 256]
    - [56, 9919.0]
  - - [2944, 128, 1, 1280, 2944, 2944, 2944, 1280]
    - [44, 12047.0]
  - - [256, 2944, 1, 1280, 256, 256, 256, 1280]
    - [46, 15259.0]
  - - [704, 1024, 1, 3328, 704, 704, 704, 3328]
    - [46, 15165.0]
  - - [1856, 448, 1, 1280, 1856, 1856, 1856, 1280]
    - [59, 15003.0]
  - - [128, 6784, 1, 256, 128, 128, 128, 256]
    - [65, 12461.0]
  - - [704, 1408, 1, 256, 704, 704, 704, 256]
    - [46, 12049.0]
  - - [448, 2944, 1, 1280, 448, 448, 448, 1280]
    - [59, 14914.0]
  - - [1856, 256, 1, 256, 1856, 1856, 1856, 256]
    - [50, 9458.0]
  - - [5056, 128, 1, 256, 5056, 5056, 5056, 256]
    - [52, 11240.0]
  - - [6784, 128, 1, 1280, 6784, 6784, 6784, 1280]
    - [71, 15961.0]
  - - [1856, 448, 1, 256, 1856, 1856, 1856, 256]
    - [59, 11543.0]
  - - [128, 4288, 1, 1280, 128, 128, 128, 1280]
    - [76, 13846.0]
  - - [448, 704, 1, 3328, 448, 448, 448, 3328]
    - [69, 13055.0]
  - - [448, 1856, 1, 256, 448, 448, 448, 256]
    - [45, 11506.0]
  - - [1856, 704, 1, 3328, 1856, 1856, 1856, 3328]
    - [70, 15688.0]
  - - [64, 193600, 1, 64, 64, 64, 64, 64]
    - [63, 13758.0]
  - - [1024, 700, 1, 512, 1024, 1024, 1024, 512]
    - [74, 14787.0]
  - - [2560, 128, 1, 2560, 2560, 2560, 2560, 2560]
    - [53, 16169.0]
  - - [64, 193600, 1, 256, 64, 64, 64, 256]
    - [66, 12379.0]
  - - [4096, 128, 1, 4096, 4096, 4096, 4096, 4096]
    - [59, 14971.0]
  - - [512, 1500, 1, 2816, 512, 512, 512, 2816]
    - [70, 16446.0]
  - - [3072, 128, 1, 1024, 3072, 3072, 3072, 1024]
    - [46, 12947.0]
  - - [7680, 64, 1, 2560, 7680, 7680, 7680, 2560]
    - [46, 16688.0]
  - - [7680, 128, 1, 2560, 7680, 7680, 7680, 2560]
    - [71, 18512.0]
  - - [512, 1500, 1, 2560, 512, 512, 512, 2560]
    - [70, 15917.0]
  - - [1024, 1024, 1, 1024, 1024, 1024, 1024, 1024]
    - [46, 15414.0]
  - - [512, 1500, 1, 2048, 512, 512, 512, 2048]
    - [73, 15697.0]
  - - [512, 1500, 1, 1536, 512, 512, 512, 1536]
    - [70, 16006.0]
  - - [3136, 64, 128, 64, 3136, 3136, 3136, 64]
    - [58, 16954.0]
  - - [3136, 64, 64, 256, 3136, 3136, 3136, 256]
    - [58, 17184.0]
  - - [3136, 64, 128, 256, 3136, 3136, 3136, 256]
    - [58, 16332.0]
  - - [3136, 64, 256, 64, 3136, 3136, 3136, 64]
    - [43, 12023.0]
  - - [3136, 64, 64, 64, 3136, 3136, 3136, 64]
    - [56, 16743.0]
  - - [3136, 64, 256, 256, 3136, 3136, 3136, 256]
    - [58, 16239.0]
  - - [64, 128, 512, 128, 64, 64, 64, 128]
    - [69, 15410.0]
  - - [64, 512, 64, 512, 64, 64, 64, 512]
    - [77, 11844.0]
  - - [512, 1600, 1, 32, 512, 512, 512, 32]
    - [55, 7009.0]
  - - [512, 1600, 1, 512, 512, 512, 512, 512]
    - [46, 16397.0]
  - - [560, 1600, 1, 1024, 560, 560, 560, 1024]
    - [46, 13649.0]
  - - [1024, 512, 1, 1, 1024, 1024, 1024, 1]
    - [55, 85.0]
  - - [1024, 512, 1, 64, 1024, 1024, 1024, 64]
    - [56, 5131.0]
  - - [1024, 512, 1, 1024, 1024, 1024, 1024, 1024]
    - [59, 13422.0]
  - - [1024, 960, 1, 64, 1024, 1024, 1024, 64]
    - [72, 7884.0]
  - - [1024, 960, 1, 1024, 1024, 1024, 1024, 1024]
    - [52, 16448.0]
  - - [1600, 512, 1, 1024, 1600, 1600, 1600, 1024]
    - [53, 14599.0]
  - - [2048, 512, 1, 1, 2048, 2048, 2048, 1]
    - [61, 187.0]
  - - [2048, 512, 1, 2048, 2048, 2048, 2048, 2048]
    - [46, 15891.0]
  - - [64, 192, 64, 1280, 64, 64, 64, 1280]
    - [63, 12653.0]
  - - [64, 320, 64, 1280, 64, 64, 64, 1280]
    - [60, 11385.0]
  - - [64, 384, 64, 1280, 64, 64, 64, 1280]
    - [54, 12038.0]
  - - [64, 448, 64, 1280, 64, 64, 64, 1280]
    - [66, 8699.0]
  - - [64, 192, 64, 2048, 64, 64, 64, 2048]
    - [51, 11569.0]
  - - [64, 320, 64, 2048, 64, 64, 64, 2048]
    - [77, 10737.0]
  - - [64, 384, 64, 2048, 64, 64, 64, 2048]
    - [77, 11938.0]
  - - [64, 448, 64, 2048, 64, 64, 64, 2048]
    - [54, 11617.0]
  - - [1225, 64, 64, 192, 1225, 1225, 1225, 192]
    - [67, 17567.0]
  - - [1225, 64, 64, 256, 1225, 1225, 1225, 256]
    - [70, 16778.0]
  - - [1225, 64, 64, 288, 1225, 1225, 1225, 288]
    - [58, 16921.0]
  - - [5329, 80, 64, 64, 5329, 5329, 5329, 64]
    - [43, 9952.0]
  - - [64, 192, 32, 1280, 64, 64, 64, 1280]
    - [63, 11518.0]
  - - [64, 320, 32, 1280, 64, 64, 64, 1280]
    - [63, 13898.0]
  - - [64, 384, 32, 1280, 64, 64, 64, 1280]
    - [63, 13138.0]
  - - [64, 448, 32, 1280, 64, 64, 64, 1280]
    - [63, 11603.0]
  - - [64, 192, 32, 2048, 64, 64, 64, 2048]
    - [74, 11320.0]
  - - [64, 320, 32, 2048, 64, 64, 64, 2048]
    - [63, 12988.0]
  - - [64, 384, 32, 2048, 64, 64, 64, 2048]
    - [51, 12656.0]
  - - [64, 448, 32, 2048, 64, 64, 64, 2048]
    - [74, 11634.0]
  - - [1225, 64, 32, 192, 1225, 1225, 1225, 192]
    - [70, 13677.0]
  - - [1225, 64, 32, 256, 1225, 1225, 1225, 256]
    - [58, 14472.0]
  - - [1225, 64, 32, 288, 1225, 1225, 1225, 288]
    - [70, 16369.0]
  - - [5329, 80, 32, 64, 5329, 5329, 5329, 64]
    - [75, 9378.0]
  - - [289, 128, 32, 768, 289, 289, 289, 768]
    - [47, 12808.0]
  - - [289, 160, 32, 768, 289, 289, 289, 768]
    - [45, 10548.0]
  - - [289, 192, 32, 768, 289, 289, 289, 768]
    - [45, 12566.0]
  - - [3136, 64, 32, 64, 3136, 3136, 3136, 64]
    - [56, 13981.0]
  - - [3136, 64, 32, 256, 3136, 3136, 3136, 256]
    - [58, 17333.0]
  - - [196, 256, 32, 1024, 196, 196, 196, 1024]
    - [53, 13322.0]
  - - [960, 1024, 1, 1024, 960, 960, 960, 1024]
    - [46, 14405.0]
  - - [64, 512, 16, 512, 64, 64, 64, 512]
    - [51, 10061.0]
  - - [64, 512, 128, 512, 64, 64, 64, 512]
    - [77, 12065.0]
  - - [1024, 512, 1, 2, 1024, 1024, 1024, 2]
    - [68, 352.0]
  - - [1024, 512, 1, 4096, 1024, 1024, 1024, 4096]
    - [47, 14988.0]
  - - [1024, 616, 1, 1024, 1024, 1024, 1024, 1024]
    - [76, 15198.0]
  - - [64, 128, 128, 128, 64, 64, 64, 128]
    - [45, 9093.0]
  - - [64, 128, 160, 128, 64, 64, 64, 128]
    - [45, 9743.0]
  - - [1024, 1024, 1, 2, 1024, 1024, 1024, 2]
    - [55, 357.0]
  - - [1024, 1024, 1, 4096, 1024, 1024, 1024, 4096]
    - [58, 16183.0]
  - - [64, 128, 624, 128, 64, 64, 64, 128]
    - [57, 11832.0]
  - - [1024, 780, 1, 1024, 1024, 1024, 1024, 1024]
    - [59, 14195.0]
  - - [64, 128, 640, 128, 64, 64, 64, 128]
    - [69, 12210.0]
  - - [1024, 800, 1, 1024, 1024, 1024, 1024, 1024]
    - [76, 14458.0]
  - - [64, 128, 656, 128, 64, 64, 64, 128]
    - [57, 12013.0]
  - - [1024, 820, 1, 1024, 1024, 1024, 1024, 1024]
    - [71, 14799.0]
  - - [64, 512, 80, 512, 64, 64, 64, 512]
    - [66, 11419.0]
  - - [1024, 385, 1, 1024, 1024, 1024, 1024, 1024]
    - [62, 11736.0]
  - - [64, 512, 96, 512, 64, 64, 64, 512]
    - [54, 11467.0]
  - - [1024, 462, 1, 1024, 1024, 1024, 1024, 1024]
    - [69, 12221.0]
  - - [64, 128, 144, 128, 64, 64, 64, 128]
    - [51, 9545.0]
  - - [64, 1024, 32, 1024, 64, 64, 64, 1024]
    - [77, 8790.0]
  - - [96, 1024, 64, 1024, 96, 96, 96, 1024]
    - [65, 14182.0]
  - - [64, 1024, 256, 1024, 64, 64, 64, 1024]
    - [54, 12780.0]
  - - [64, 512, 256, 512, 64, 64, 64, 512]
    - [77, 12350.0]
  - - [64, 1024, 64, 1024, 64, 64, 64, 1024]
    - [77, 12622.0]
  - - [64, 1024, 128, 1024, 64, 64, 64, 1024]
    - [54, 12564.0]
  - - [96, 1024, 128, 1024, 96, 96, 96, 1024]
    - [76, 14414.0]
  - - [64, 512, 40, 512, 64, 64, 64, 512]
    - [54, 10598.0]
  - - [64, 128, 1024, 128, 64, 64, 64, 128]
    - [57, 16632.0]
  - - [1024, 864, 1, 1024, 1024, 1024, 1024, 1024]
    - [59, 16242.0]
  - - [1024, 864, 1, 512, 1024, 1024, 1024, 512]
    - [71, 15099.0]
  - - [256, 3456, 1, 128, 256, 256, 256, 128]
    - [47, 13418.0]
  - - [256, 4096, 1, 128, 256, 256, 256, 128]
    - [44, 13752.0]
  - - [480, 864, 1, 1024, 480, 480, 480, 1024]
    - [46, 13083.0]
  - - [512, 864, 1, 256, 512, 512, 512, 256]
    - [44, 10166.0]
  - - [64, 128, 1280, 128, 64, 64, 64, 128]
    - [45, 15252.0]
  - - [64, 128, 1312, 128, 64, 64, 64, 128]
    - [45, 14259.0]
  - - [64, 512, 192, 512, 64, 64, 64, 512]
    - [66, 12252.0]
  - - [256, 4096, 1, 1, 256, 256, 256, 1]
    - [50, 286.0]
  - - [12544, 64, 1, 147, 12544, 12544, 12544, 147]
    - [56, 12555.0]
  - - [64, 128, 2048, 128, 64, 64, 64, 128]
    - [57, 11788.0]
  - - [64, 128, 1536, 128, 64, 64, 64, 128]
    - [45, 13925.0]
  - - [64, 128, 192, 128, 64, 64, 64, 128]
    - [45, 12489.0]
  - - [64, 384, 144, 384, 64, 64, 64, 384]
    - [57, 17325.0]
  - - [64, 512, 48, 512, 64, 64, 64, 512]
    - [54, 11197.0]
  - - [64, 128, 256, 128, 64, 64, 64, 128]
    - [57, 13172.0]
  - - [64, 384, 192, 384, 64, 64, 64, 384]
    - [74, 16024.0]
  - - [3400, 256, 1, 1024, 3400, 3400, 3400, 1024]
    - [47, 16294.0]
  - - [3800, 256, 1, 1024, 3800, 3800, 3800, 1024]
    - [47, 17955.0]
  - - [864, 512, 2, 2048, 864, 864, 864, 2048]
    - [53, 16222.0]
  - - [888, 512, 2, 2048, 888, 888, 888, 2048]
    - [53, 16619.0]
  - - [51520, 64, 2, 256, 51520, 51520, 51520, 256]
    - [69, 17538.0]
  - - [46464, 64, 2, 256, 46464, 46464, 46464, 256]
    - [75, 17679.0]
  - - [49152, 64, 2, 256, 49152, 49152, 49152, 256]
    - [64, 17781.0]
  - - [1536, 512, 1, 1024, 1536, 1536, 1536, 1024]
    - [46, 16468.0]
  - - [1728, 512, 1, 1024, 1728, 1728, 1728, 1024]
    - [47, 16472.0]
  - - [1024, 1024, 1, 320, 1024, 1024, 1024, 320]
    - [46, 13607.0]
  - - [51520, 64, 2, 64, 51520, 51520, 51520, 64]
    - [67, 14564.0]
  - - [55296, 64, 2, 64, 55296, 55296, 55296, 64]
    - [58, 14774.0]
  - - [49152, 64, 2, 64, 49152, 49152, 49152, 64]
    - [46, 14360.0]
  - - [54400, 64, 2, 64, 54400, 54400, 54400, 64]
    - [73, 15703.0]
  - - [42240, 64, 2, 256, 42240, 42240, 42240, 256]
    - [52, 17105.0]
  - - [672, 512, 2, 2048, 672, 672, 672, 2048]
    - [52, 14099.0]
  - - [54400, 64, 2, 256, 54400, 54400, 54400, 256]
    - [64, 17230.0]
  - - [56832, 64, 2, 256, 56832, 56832, 56832, 256]
    - [70, 17227.0]
  - - [55296, 64, 2, 256, 55296, 55296, 55296, 256]
    - [46, 17319.0]
  - - [60800, 64, 2, 64, 60800, 60800, 60800, 64]
    - [52, 16482.0]
  - - [768, 512, 2, 2048, 768, 768, 768, 2048]
    - [64, 16213.0]
  - - [43008, 64, 2, 256, 43008, 43008, 43008, 256]
    - [46, 17020.0]
  - - [864, 256, 2, 2048, 864, 864, 864, 2048]
    - [52, 14165.0]
  - - [768, 256, 2, 2048, 768, 768, 768, 2048]
    - [75, 12840.0]
  - - [45632, 64, 2, 256, 45632, 45632, 45632, 256]
    - [46, 16607.0]
  - - [60800, 64, 2, 256, 60800, 60800, 60800, 256]
    - [75, 17868.0]
  - - [1024, 1024, 1, 81, 1024, 1024, 1024, 81]
    - [72, 11447.0]
  - - [950, 512, 2, 2048, 950, 950, 950, 2048]
    - [52, 14995.0]
  - - [850, 512, 2, 2048, 850, 850, 850, 2048]
    - [53, 15927.0]
  - - [805, 512, 2, 2048, 805, 805, 805, 2048]
    - [53, 15057.0]
  - - [950, 256, 2, 2048, 950, 950, 950, 2048]
    - [74, 13257.0]
  - - [1900, 512, 1, 1024, 1900, 1900, 1900, 1024]
    - [53, 17046.0]
  - - [1700, 512, 1, 1024, 1700, 1700, 1700, 1024]
    - [47, 15320.0]
  - - [1610, 512, 1, 1024, 1610, 1610, 1610, 1024]
    - [53, 14731.0]
  - - [660, 512, 2, 2048, 660, 660, 660, 2048]
    - [52, 13808.0]
  - - [726, 512, 2, 2048, 726, 726, 726, 2048]
    - [52, 15207.0]
  - - [713, 512, 2, 2048, 713, 713, 713, 2048]
    - [52, 14893.0]
  - - [805, 256, 2, 2048, 805, 805, 805, 2048]
    - [46, 13132.0]
  - - [850, 256, 2, 2048, 850, 850, 850, 2048]
    - [75, 14413.0]
  - - [100, 128, 120, 512, 100, 100, 100, 512]
    - [76, 12859.0]
  - - [100, 128, 139, 512, 100, 100, 100, 512]
    - [53, 13141.0]
  - - [100, 128, 160, 512, 100, 100, 100, 512]
    - [76, 13320.0]
  - - [22500, 64, 1, 147, 22500, 22500, 22500, 147]
    - [70, 11567.0]
  - - [96, 1024, 160, 1024, 96, 96, 96, 1024]
    - [53, 14498.0]
  - - [96, 1024, 40, 1024, 96, 96, 96, 1024]
    - [76, 14425.0]
  - - [96, 1024, 80, 1024, 96, 96, 96, 1024]
    - [76, 14331.0]
  - - [96, 1024, 96, 1024, 96, 96, 96, 1024]
    - [53, 14318.0]
  - - [96, 1024, 24, 1024, 96, 96, 96, 1024]
    - [53, 13791.0]
  - - [96, 1024, 48, 1024, 96, 96, 96, 1024]
    - [53, 13950.0]
  - - [96, 1024, 16, 1024, 96, 96, 96, 1024]
    - [52, 13071.0]
  - - [96, 1024, 32, 1024, 96, 96, 96, 1024]
    - [53, 14123.0]
  - - [64, 512, 320, 512, 64, 64, 64, 512]
    - [77, 12448.0]
  - - [64, 1024, 512, 1024, 64, 64, 64, 1024]
    - [54, 12802.0]
  - - [1024, 77, 1, 30522, 1024, 1024, 1024, 30522]
    - [78, 8903.0]
  - - [1024, 200, 1, 30522, 1024, 1024, 1024, 30522]
    - [84, 11111.0]
  - - [1024, 160, 1, 30522, 1024, 1024, 1024, 30522]
    - [79, 11800.0]
  - - [1024, 180, 1, 30522, 1024, 1024, 1024, 30522]
    - [84, 12894.0]
  - - [1024, 160, 1, 30528, 1024, 1024, 1024, 30528]
    - [82, 11885.0]
  - - [1024, 240, 1, 30528, 1024, 1024, 1024, 30528]
    - [80, 13068.0]
  - - [2560, 109, 1, 29000, 2560, 2560, 2560, 29000]
    - [85, 15723.0]
  - - [2560, 121, 1, 29000, 2560, 2560, 2560, 29000]
    - [83, 17338.0]
  - - [2560, 65, 1, 29000, 2560, 2560, 2560, 29000]
    - [83, 9596.0]
  - - [2560, 66, 1, 29000, 2560, 2560, 2560, 29000]
    - [85, 9741.0]
  - - [2560, 67, 1, 29000, 2560, 2560, 2560, 29000]
    - [80, 9896.0]
  - - [2560, 69, 1, 29000, 2560, 2560, 2560, 29000]
    - [80, 10167.0]
  - - [2560, 70, 1, 29000, 2560, 2560, 2560, 29000]
    - [85, 10346.0]
  - - [2560, 71, 1, 29000, 2560, 2560, 2560, 29000]
    - [80, 10460.0]
  - - [2560, 73, 1, 29000, 2560, 2560, 2560, 29000]
    - [80, 10749.0]
  - - [2560, 74, 1, 29000, 2560, 2560, 2560, 29000]
    - [81, 10887.0]
  - - [2560, 75, 1, 29000, 2560, 2560, 2560, 29000]
    - [85, 11048.0]
  - - [2560, 77, 1, 29000, 2560, 2560, 2560, 29000]
    - [85, 11322.0]
  - - [2560, 78, 1, 29000, 2560, 2560, 2560, 29000]
    - [80, 11456.0]
  - - [2560, 80, 1, 29000, 2560, 2560, 2560, 29000]
    - [80, 11732.0]
  - - [2560, 81, 1, 29000, 2560, 2560, 2560, 29000]
    - [85, 11860.0]
  - - [2560, 82, 1, 29000, 2560, 2560, 2560, 29000]
    - [83, 11999.0]
  - - [2560, 83, 1, 29000, 2560, 2560, 2560, 29000]
    - [80, 12160.0]
  - - [2560, 84, 1, 29000, 2560, 2560, 2560, 29000]
    - [85, 12273.0]
  - - [2560, 88, 1, 29000, 2560, 2560, 2560, 29000]
    - [80, 12824.0]
  - - [2560, 89, 1, 29000, 2560, 2560, 2560, 29000]
    - [80, 13012.0]
  - - [2560, 90, 1, 29000, 2560, 2560, 2560, 29000]
    - [80, 13097.0]
  - - [2560, 92, 1, 29000, 2560, 2560, 2560, 29000]
    - [80, 13373.0]
  - - [2560, 95, 1, 29000, 2560, 2560, 2560, 29000]
    - [83, 13794.0]
  - - [2560, 98, 1, 29000, 2560, 2560, 2560, 29000]
    - [85, 14248.0]
  - - [2368, 64, 1, 3328, 2368, 2368, 2368, 3328]
    - [115, 7537.0]
  - - [256, 704, 1, 1280, 256, 256, 256, 1280]
    - [111, 7684.0]
  - - [1408, 64, 1, 1280, 1408, 1408, 1408, 1280]
    - [94, 5158.0]
  - - [1024, 256, 1, 3328, 1024, 1024, 1024, 3328]
    - [111, 8244.0]
  - - [704, 128, 1, 1280, 704, 704, 704, 1280]
    - [104, 5310.0]
  - - [64, 3584, 1, 3328, 64, 64, 64, 3328]
    - [100, 8546.0]
  - - [1024, 256, 1, 256, 1024, 1024, 1024, 256]
    - [111, 5992.0]
  - - [448, 448, 1, 256, 448, 448, 448, 256]
    - [111, 5525.0]
  - - [128, 1024, 1, 3328, 128, 128, 128, 3328]
    - [136, 6621.0]
  - - [64, 1856, 1, 1280, 64, 64, 64, 1280]
    - [106, 6788.0]
  - - [448, 256, 1, 256, 448, 448, 448, 256]
    - [106, 3745.0]
  - - [256, 1024, 1, 256, 256, 256, 256, 256]
    - [126, 5907.0]
  - - [1024, 128, 1, 1280, 1024, 1024, 1024, 1280]
    - [106, 6013.0]
  - - [448, 256, 1, 3328, 448, 448, 448, 3328]
    - [94, 7414.0]
  - - [128, 704, 1, 1280, 128, 128, 128, 1280]
    - [113, 5315.0]
  - - [1856, 128, 1, 3328, 1856, 1856, 1856, 3328]
    - [89, 9023.0]
  - - [256, 448, 1, 256, 256, 256, 256, 256]
    - [128, 3754.0]
  - - [448, 448, 1, 3328, 448, 448, 448, 3328]
    - [126, 8939.0]
  - - [1408, 128, 1, 1280, 1408, 1408, 1408, 1280]
    - [126, 7563.0]
  - - [128, 1856, 1, 1280, 128, 128, 128, 1280]
    - [111, 8359.0]
  - - [64, 1408, 1, 3328, 64, 64, 64, 3328]
    - [106, 5860.0]
  - - [256, 704, 1, 256, 256, 256, 256, 256]
    - [126, 4982.0]
  - - [128, 1408, 1, 256, 128, 128, 128, 256]
    - [92, 4993.0]
  - - [256, 448, 1, 3328, 256, 256, 256, 3328]
    - [94, 7466.0]
  - - [64, 2368, 1, 1280, 64, 64, 64, 1280]
    - [119, 6874.0]
  - - [2368, 64, 1, 256, 2368, 2368, 2368, 256]
    - [117, 4778.0]
  - - [704, 128, 1, 3328, 704, 704, 704, 3328]
    - [94, 5855.0]
  - - [4288, 64, 1, 1280, 4288, 4288, 4288, 1280]
    - [111, 8258.0]
  - - [128, 1024, 1, 1280, 128, 128, 128, 1280]
    - [131, 6418.0]
  - - [128, 1024, 1, 256, 128, 128, 128, 256]
    - [131, 3911.0]
  - - [1856, 64, 1, 256, 1856, 1856, 1856, 256]
    - [94, 3949.0]
  - - [704, 128, 1, 256, 704, 704, 704, 256]
    - [86, 2950.0]
  - - [448, 256, 1, 1280, 448, 448, 448, 1280]
    - [94, 6536.0]
  - - [1856, 128, 1, 1280, 1856, 1856, 1856, 1280]
    - [89, 8629.0]
  - - [64, 3584, 1, 256, 64, 64, 64, 256]
    - [100, 5519.0]
  - - [64, 1856, 1, 256, 64, 64, 64, 256]
    - [106, 3909.0]
  - - [256, 1024, 1, 1280, 256, 256, 256, 1280]
    - [104, 8427.0]
  - - [3584, 64, 1, 1280, 3584, 3584, 3584, 1280]
    - [89, 8247.0]
  - - [1408, 128, 1, 3328, 1408, 1408, 1408, 3328]
    - [126, 8180.0]
  - - [64, 2944, 1, 3328, 64, 64, 64, 3328]
    - [131, 7978.0]
  - - [64, 4288, 1, 3328, 64, 64, 64, 3328]
    - [119, 8646.0]
  - - [64, 2944, 1, 256, 64, 64, 64, 256]
    - [106, 5045.0]
  - - [64, 1408, 1, 1280, 64, 64, 64, 1280]
    - [113, 5325.0]
  - - [64, 2944, 1, 1280, 64, 64, 64, 1280]
    - [131, 7476.0]
  - - [704, 256, 1, 256, 704, 704, 704, 256]
    - [111, 4972.0]
  - - [256, 448, 1, 1280, 256, 256, 256, 1280]
    - [124, 6583.0]
  - - [704, 256, 1, 1280, 704, 704, 704, 1280]
    - [89, 7549.0]
  - - [64, 2368, 1, 3328, 64, 64, 64, 3328]
    - [94, 7834.0]
  - - [256, 704, 1, 3328, 256, 256, 256, 3328]
    - [111, 8319.0]
  - - [2944, 64, 1, 1280, 2944, 2944, 2944, 1280]
    - [111, 7725.0]
  - - [128, 1408, 1, 3328, 128, 128, 128, 3328]
    - [111, 8053.0]
  - - [1408, 64, 1, 256, 1408, 1408, 1408, 256]
    - [106, 2980.0]
  - - [64, 2368, 1, 256, 64, 64, 64, 256]
    - [119, 4409.0]
  - - [1024, 128, 1, 3328, 1024, 1024, 1024, 3328]
    - [128, 6556.0]
  - - [2368, 64, 1, 1280, 2368, 2368, 2368, 1280]
    - [94, 6963.0]
  - - [4288, 64, 1, 256, 4288, 4288, 4288, 256]
    - [89, 6184.0]
  - - [64, 4288, 1, 1280, 64, 64, 64, 1280]
    - [100, 8215.0]
  - - [1408, 64, 1, 3328, 1408, 1408, 1408, 3328]
    - [94, 5850.0]
  - - [2944, 64, 1, 256, 2944, 2944, 2944, 256]
    - [111, 5243.0]
  - - [448, 448, 1, 1280, 448, 448, 448, 1280]
    - [126, 8287.0]
  - - [1024, 256, 1, 1280, 1024, 1024, 1024, 1280]
    - [111, 8164.0]
  - - [3584, 64, 1, 3328, 3584, 3584, 3584, 3328]
    - [111, 8708.0]
  - - [256, 1024, 1, 3328, 256, 256, 256, 3328]
    - [89, 8580.0]
  - - [1856, 64, 1, 3328, 1856, 1856, 1856, 3328]
    - [94, 7567.0]
  - - [1856, 64, 1, 1280, 1856, 1856, 1856, 1280]
    - [94, 6728.0]
  - - [1024, 128, 1, 256, 1024, 1024, 1024, 256]
    - [94, 3848.0]
  - - [64, 3584, 1, 1280, 64, 64, 64, 1280]
    - [131, 7821.0]
  - - [3584, 64, 1, 256, 3584, 3584, 3584, 256]
    - [89, 5757.0]
  - - [64, 1856, 1, 3328, 64, 64, 64, 3328]
    - [115, 7664.0]
  - - [1408, 128, 1, 256, 1408, 1408, 1408, 256]
    - [111, 5037.0]
  - - [128, 704, 1, 256, 128, 128, 128, 256]
    - [128, 2913.0]
  - - [128, 704, 1, 3328, 128, 128, 128, 3328]
    - [115, 5887.0]
  - - [128, 1856, 1, 256, 128, 128, 128, 256]
    - [89, 5737.0]
  - - [64, 4288, 1, 256, 64, 64, 64, 256]
    - [100, 6098.0]
  - - [704, 256, 1, 3328, 704, 704, 704, 3328]
    - [89, 8271.0]
  - - [1856, 128, 1, 256, 1856, 1856, 1856, 256]
    - [111, 5928.0]
  - - [4288, 64, 1, 3328, 4288, 4288, 4288, 3328]
    - [131, 8730.0]
  - - [64, 1408, 1, 256, 64, 64, 64, 256]
    - [128, 2898.0]
  - - [2944, 64, 1, 3328, 2944, 2944, 2944, 3328]
    - [89, 8424.0]
  - - [128, 1408, 1, 1280, 128, 128, 128, 1280]
    - [126, 7446.0]
  - - [128, 1856, 1, 3328, 128, 128, 128, 3328]
    - [111, 8860.0]
  - - [1760, 64, 1, 1760, 1760, 1760, 1760, 1760]
    - [106, 6107.0]
  - - [2560, 32, 1, 2560, 2560, 2560, 2560, 2560]
    - [124, 6332.0]
  - - [2048, 128, 1, 2048, 2048, 2048, 2048, 2048]
    - [111, 8524.0]
  - - [4608, 32, 1, 1536, 4608, 4608, 4608, 1536]
    - [106, 6781.0]
  - - [3072, 64, 1, 1024, 3072, 3072, 3072, 1024]
    - [89, 7822.0]
  - - [128, 1500, 1, 1280, 128, 128, 128, 1280]
    - [111, 7772.0]
  - - [4096, 32, 1, 4096, 4096, 4096, 4096, 4096]
    - [94, 6555.0]
  - - [1760, 128, 1, 1760, 1760, 1760, 1760, 1760]
    - [126, 8158.0]
  - - [4096, 64, 1, 4096, 4096, 4096, 4096, 4096]
    - [126, 8662.0]
  - - [7680, 32, 1, 2560, 7680, 7680, 7680, 2560]
    - [89, 9467.0]
  - - [2560, 64, 1, 2560, 2560, 2560, 2560, 2560]
    - [115, 7866.0]
  - - [3072, 32, 1, 1024, 3072, 3072, 3072, 1024]
    - [128, 5200.0]
  - - [6144, 32, 1, 2560, 6144, 6144, 6144, 2560]
    - [111, 8397.0]
  - - [176, 1500, 1, 1408, 176, 176, 176, 1408]
    - [126, 7434.0]
  - - [2048, 64, 1, 2048, 2048, 2048, 2048, 2048]
    - [94, 6272.0]
  - - [8448, 32, 1, 2816, 8448, 8448, 8448, 2816]
    - [111, 8619.0]
  - - [512, 512, 1, 64, 512, 512, 512, 64]
    - [119, 3095.0]
  - - [32, 33, 1600, 33, 32, 32, 32, 33]
    - [87, 3212.0]
  - - [256, 1024, 1, 1, 256, 256, 256, 1]
    - [111, 58.0]
  - - [257, 1024, 1, 4096, 257, 257, 257, 4096]
    - [119, 7432.0]
  - - [512, 200, 1, 1, 512, 512, 512, 1]
    - [90, 24.0]
  - - [512, 200, 1, 32, 512, 512, 512, 32]
    - [90, 731.0]
  - - [512, 215, 1, 2048, 512, 512, 512, 2048]
    - [124, 6718.0]
  - - [512, 256, 1, 2048, 512, 512, 512, 2048]
    - [119, 6714.0]
  - - [560, 200, 1, 1024, 560, 560, 560, 1024]
    - [131, 5828.0]
  - - [768, 215, 1, 2048, 768, 768, 768, 2048]
    - [111, 7186.0]
  - - [768, 256, 1, 2048, 768, 768, 768, 2048]
    - [111, 8459.0]
  - - [1024, 200, 1, 1, 1024, 1024, 1024, 1]
    - [111, 94.0]
  - - [64, 32, 4608, 32, 64, 64, 64, 32]
    - [126, 9710.0]
  - - [64, 34, 4736, 34, 64, 64, 64, 34]
    - [111, 5244.0]
  - - [64, 35, 4608, 32, 64, 64, 64, 32]
    - [126, 5617.0]
  - - [64, 35, 4608, 35, 64, 64, 64, 35]
    - [111, 5341.0]
  - - [64, 33, 1920, 27, 64, 64, 64, 27]
    - [89, 4651.0]
  - - [64, 33, 1920, 33, 64, 64, 64, 33]
    - [126, 4752.0]
  - - [1225, 32, 64, 192, 1225, 1225, 1225, 192]
    - [89, 9798.0]
  - - [1225, 48, 64, 192, 1225, 1225, 1225, 192]
    - [131, 7555.0]
  - - [1225, 48, 64, 256, 1225, 1225, 1225, 256]
    - [119, 7594.0]
  - - [1225, 48, 64, 288, 1225, 1225, 1225, 288]
    - [126, 7592.0]
  - - [1225, 32, 32, 192, 1225, 1225, 1225, 192]
    - [111, 9350.0]
  - - [1225, 48, 32, 192, 1225, 1225, 1225, 192]
    - [119, 7382.0]
  - - [1225, 48, 32, 256, 1225, 1225, 1225, 256]
    - [131, 7354.0]
  - - [1225, 48, 32, 288, 1225, 1225, 1225, 288]
    - [89, 7421.0]
  - - [49, 2048, 64, 512, 49, 49, 49, 512]
    - [106, 7076.0]
  - - [49, 512, 64, 2048, 49, 49, 49, 2048]
    - [124, 6950.0]
  - - [49, 2048, 32, 512, 49, 49, 49, 512]
    - [102, 7054.0]
  - - [49, 512, 32, 2048, 49, 49, 49, 2048]
    - [136, 6579.0]
  - - [49, 2048, 64, 1024, 49, 49, 49, 1024]
    - [119, 7788.0]
  - - [49, 1024, 64, 2048, 49, 49, 49, 2048]
    - [124, 7072.0]
  - - [49, 2048, 32, 1024, 49, 49, 49, 1024]
    - [131, 7491.0]
  - - [49, 1024, 32, 2048, 49, 49, 49, 2048]
    - [106, 6946.0]
  - - [480, 512, 1, 512, 480, 480, 480, 512]
    - [126, 7472.0]
  - - [512, 480, 1, 512, 512, 512, 512, 512]
    - [111, 8812.0]
  - - [512, 512, 1, 512, 512, 512, 512, 512]
    - [126, 8234.0]
  - - [1024, 160, 1, 1024, 1024, 1024, 1024, 1024]
    - [94, 8097.0]
  - - [1024, 200, 1, 1024, 1024, 1024, 1024, 1024]
    - [111, 7217.0]
  - - [1024, 308, 1, 1024, 1024, 1024, 1024, 1024]
    - [111, 8402.0]
  - - [1024, 180, 1, 1024, 1024, 1024, 1024, 1024]
    - [111, 7379.0]
  - - [256, 864, 1, 128, 256, 256, 256, 128]
    - [111, 4056.0]
  - - [3136, 64, 1, 576, 3136, 3136, 3136, 576]
    - [111, 7189.0]
  - - [784, 128, 1, 1152, 784, 784, 784, 1152]
    - [134, 5723.0]
  - - [1024, 128, 1, 1024, 1024, 1024, 1024, 1024]
    - [94, 5795.0]
  - - [1024, 128, 1, 2, 1024, 1024, 1024, 2]
    - [86, 137.0]
  - - [1024, 96, 1, 1024, 1024, 1024, 1024, 1024]
    - [94, 5430.0]
  - - [1024, 96, 1, 2, 1024, 1024, 1024, 2]
    - [86, 106.0]
  - - [49, 2048, 128, 512, 49, 49, 49, 512]
    - [100, 7178.0]
  - - [49, 2048, 256, 512, 49, 49, 49, 512]
    - [100, 7699.0]
  - - [49, 512, 128, 2048, 49, 49, 49, 2048]
    - [124, 7078.0]
  - - [49, 512, 256, 2048, 49, 49, 49, 2048]
    - [106, 7139.0]
  - - [100, 128, 18, 512, 100, 100, 100, 512]
    - [94, 5771.0]
  - - [100, 128, 19, 512, 100, 100, 100, 512]
    - [106, 6062.0]
  - - [1444, 128, 1, 576, 1444, 1444, 1444, 576]
    - [89, 7681.0]
  - - [361, 512, 1, 2304, 361, 361, 361, 2304]
    - [111, 8158.0]
  - - [2560, 35, 1, 29000, 2560, 2560, 2560, 29000]
    - [106, 4700.0]
  - - [2560, 36, 1, 29000, 2560, 2560, 2560, 29000]
    - [94, 4809.0]
  - - [2560, 39, 1, 29000, 2560, 2560, 2560, 29000]
    - [94, 5222.0]
  - - [2560, 40, 1, 29000, 2560, 2560, 2560, 29000]
    - [94, 5392.0]
  - - [2560, 42, 1, 29000, 2560, 2560, 2560, 29000]
    - [106, 5659.0]
  - - [2560, 43, 1, 29000, 2560, 2560, 2560, 29000]
    - [94, 5810.0]
  - - [2560, 44, 1, 29000, 2560, 2560, 2560, 29000]
    - [94, 5930.0]
  - - [2560, 46, 1, 29000, 2560, 2560, 2560, 29000]
    - [94, 6189.0]
  - - [2560, 48, 1, 29000, 2560, 2560, 2560, 29000]
    - [94, 6463.0]
  - - [2560, 49, 1, 29000, 2560, 2560, 2560, 29000]
    - [94, 6605.0]
  - - [2560, 50, 1, 29000, 2560, 2560, 2560, 29000]
    - [106, 6747.0]
  - - [2560, 51, 1, 29000, 2560, 2560, 2560, 29000]
    - [94, 6851.0]
  - - [2560, 53, 1, 29000, 2560, 2560, 2560, 29000]
    - [94, 7158.0]
  - - [2560, 54, 1, 29000, 2560, 2560, 2560, 29000]
    - [94, 7299.0]
  - - [2560, 55, 1, 29000, 2560, 2560, 2560, 29000]
    - [94, 7446.0]
  - - [2560, 56, 1, 29000, 2560, 2560, 2560, 29000]
    - [94, 7559.0]
  - - [2560, 57, 1, 29000, 2560, 2560, 2560, 29000]
    - [94, 7703.0]
  - - [2560, 58, 1, 29000, 2560, 2560, 2560, 29000]
    - [106, 7829.0]
  - - [2560, 59, 1, 29000, 2560, 2560, 2560, 29000]
    - [94, 7990.0]
  - - [2560, 61, 1, 29000, 2560, 2560, 2560, 29000]
    - [94, 8216.0]
  - - [2560, 63, 1, 29000, 2560, 2560, 2560, 29000]
    - [106, 8495.0]
  - - [1909283, 40, 1, 40, 1909283, 1909283, 1909283, 40]
    - [126, 6086.0]
  - - [3818566, 40, 1, 40, 3818566, 3818566, 3818566, 40]
    - [119, 6141.0]
  - - [1760, 32, 1, 1760, 1760, 1760, 1760, 1760]
    - [144, 4766.0]
  - - [7680, 4, 1, 2560, 7680, 7680, 7680, 2560]
    - [146, 2968.0]
  - - [3072, 16, 1, 1024, 3072, 3072, 3072, 1024]
    - [163, 4384.0]
  - - [2048, 16, 1, 2048, 2048, 2048, 2048, 2048]
    - [149, 3852.0]
  - - [3072, 1, 1, 128, 3072, 3072, 3072, 128]
    - [161, 75.0]
  - - [8448, 16, 1, 2816, 8448, 8448, 8448, 2816]
    - [151, 6137.0]
  - - [7680, 2, 1, 2560, 7680, 7680, 7680, 2560]
    - [164, 1477.0]
  - - [4224, 1, 1, 128, 4224, 4224, 4224, 128]
    - [154, 100.0]
  - - [7680, 1, 1, 2560, 7680, 7680, 7680, 2560]
    - [162, 676.0]
  - - [6144, 2, 1, 2560, 6144, 6144, 6144, 2560]
    - [149, 1117.0]
  - - [1760, 16, 1, 1760, 1760, 1760, 1760, 1760]
    - [137, 3432.0]
  - - [6144, 4, 1, 2560, 6144, 6144, 6144, 2560]
    - [164, 2401.0]
  - - [3072, 4, 1, 1024, 3072, 3072, 3072, 1024]
    - [163, 1045.0]
  - - [2048, 32, 1, 2048, 2048, 2048, 2048, 2048]
    - [156, 4898.0]
  - - [4608, 16, 1, 1536, 4608, 4608, 4608, 1536]
    - [141, 5143.0]
  - - [3072, 2, 1, 1024, 3072, 3072, 3072, 1024]
    - [157, 519.0]
  - - [8448, 1, 1, 2816, 8448, 8448, 8448, 2816]
    - [155, 663.0]
  - - [6144, 1, 1, 2560, 6144, 6144, 6144, 2560]
    - [152, 572.0]
  - - [4608, 1, 1, 1536, 4608, 4608, 4608, 1536]
    - [145, 406.0]
  - - [8448, 4, 1, 2816, 8448, 8448, 8448, 2816]
    - [165, 2632.0]
  - - [4608, 2, 1, 1536, 4608, 4608, 4608, 1536]
    - [157, 817.0]
  - - [2560, 16, 1, 2560, 2560, 2560, 2560, 2560]
    - [164, 4329.0]
  - - [6144, 16, 1, 2560, 6144, 6144, 6144, 2560]
    - [156, 6211.0]
  - - [4096, 16, 1, 4096, 4096, 4096, 4096, 4096]
    - [141, 5335.0]
  - - [7680, 16, 1, 2560, 7680, 7680, 7680, 2560]
    - [160, 6383.0]
  - - [3072, 1, 1, 1024, 3072, 3072, 3072, 1024]
    - [159, 279.0]
  - - [8448, 2, 1, 2816, 8448, 8448, 8448, 2816]
    - [162, 1330.0]
  - - [4608, 4, 1, 1536, 4608, 4608, 4608, 1536]
    - [157, 1631.0]
  - - [2048, 2, 1, 2048, 2048, 2048, 2048, 2048]
    - [149, 483.0]
  - - [2048, 2, 1, 2, 2048, 2048, 2048, 2]
    - [138, 2.0]
  - - [2560, 4, 1, 2, 2560, 2560, 2560, 2]
    - [138, 5.0]
  - - [2560, 4, 1, 2560, 2560, 2560, 2560, 2560]
    - [149, 1227.0]
  - - [2048, 1, 1, 512, 2048, 2048, 2048, 512]
    - [145, 133.0]
  - - [12288, 12, 2, 256, 12288, 12288, 12288, 256]
    - [147, 4108.0]
  - - [12288, 3, 2, 256, 12288, 12288, 12288, 256]
    - [139, 1434.0]
  - - [51520, 12, 2, 256, 51520, 51520, 51520, 256]
    - [147, 5415.0]
  - - [51520, 3, 2, 256, 51520, 51520, 51520, 256]
    - [165, 2501.0]
  - - [15200, 12, 2, 256, 15200, 15200, 15200, 256]
    - [153, 4430.0]
  - - [15200, 3, 2, 256, 15200, 15200, 15200, 256]
    - [158, 1604.0]
  - - [3456, 3, 2, 256, 3456, 3456, 3456, 256]
    - [142, 750.0]
  - - [13600, 12, 2, 256, 13600, 13600, 13600, 256]
    - [143, 4255.0]
  - - [12880, 3, 2, 256, 12880, 12880, 12880, 256]
    - [158, 1411.0]
  - - [3400, 3, 2, 256, 3400, 3400, 3400, 256]
    - [154, 740.0]
  - - [12880, 12, 2, 256, 12880, 12880, 12880, 256]
    - [141, 4205.0]
  - - [13824, 12, 2, 256, 13824, 13824, 13824, 256]
    - [141, 4290.0]
  - - [13824, 3, 2, 256, 13824, 13824, 13824, 256]
    - [139, 1552.0]
  - - [13600, 3, 2, 256, 13600, 13600, 13600, 256]
    - [150, 1503.0]
  - - [3456, 12, 2, 256, 3456, 3456, 3456, 256]
    - [151, 2407.0]
  - - [3800, 3, 2, 256, 3800, 3800, 3800, 256]
    - [161, 817.0]
  - - [3400, 12, 2, 256, 3400, 3400, 3400, 256]
    - [110, 2352.0]
  - - [3800, 12, 2, 256, 3800, 3800, 3800, 256]
    - [141, 2617.0]
  - - [55296, 3, 2, 256, 55296, 55296, 55296, 256]
    - [143, 2380.0]
  - - [3072, 3, 2, 256, 3072, 3072, 3072, 256]
    - [149, 678.0]
  - - [3072, 12, 2, 256, 3072, 3072, 3072, 256]
    - [139, 2868.0]
  - - [54400, 3, 2, 256, 54400, 54400, 54400, 256]
    - [148, 2523.0]
  - - [60800, 12, 2, 256, 60800, 60800, 60800, 256]
    - [151, 5476.0]
  - - [60800, 3, 2, 256, 60800, 60800, 60800, 256]
    - [155, 2348.0]
  - - [3220, 3, 2, 256, 3220, 3220, 3220, 256]
    - [140, 981.0]
  - - [3220, 12, 2, 256, 3220, 3220, 3220, 256]
    - [141, 2264.0]
  - - [2048, 8, 1, 2, 2048, 2048, 2048, 2]
    - [138, 8.0]
  - - [2048, 8, 1, 2048, 2048, 2048, 2048, 2048]
    - [157, 1955.0]
  - - [2560, 2, 1, 2, 2560, 2560, 2560, 2]
    - [116, 5.0]
  - - [2560, 2, 1, 2560, 2560, 2560, 2560, 2560]
    - [149, 605.0]
  - - [2560, 27, 1, 29000, 2560, 2560, 2560, 29000]
    - [164, 5531.0]
  - - [1909283, 11, 1, 11, 1909283, 1909283, 1909283, 11]
    - [150, 2368.0]
  - - [3818566, 11, 1, 11, 3818566, 3818566, 3818566, 11]
    - [158, 2165.0]
  - - [512, 16, 1, 500000, 512, 512, 512, 500000]
    - [170, 3363.0]
  - - [512, 2, 1, 500000, 512, 512, 512, 500000]
    - [167, 427.0]
  - - [1024, 16, 1, 500000, 1024, 1024, 1024, 500000]
    - [171, 4482.0]
  - - [1024, 4, 1, 500000, 1024, 1024, 1024, 500000]
    - [169, 1136.0]
  - - [512, 8, 1, 500000, 512, 512, 512, 500000]
    - [174, 1702.0]
  - - [512, 1, 1, 500000, 512, 512, 512, 500000]
    - [167, 216.0]
  - - [512, 4, 1, 500000, 512, 512, 512, 500000]
    - [167, 860.0]
  - - [1024, 1, 1, 500000, 1024, 1024, 1024, 500000]
    - [172, 285.0]
  - - [1024, 2, 1, 500000, 1024, 1024, 1024, 500000]
    - [166, 571.0]
  - - [1024, 8, 1, 500000, 1024, 1024, 1024, 500000]
    - [173, 2264.0]
  - - [49, 512, 1, 4608, 49, 49, 49, 4608]
    - [168, 3911.0]
  - - [448, 64, 1, 1280, 448, 448, 448, 1280]
    - [116, 3175.0]
  - - [64, 1024, 1, 1280, 64, 64, 64, 1280]
    - [106, 5691.0]
  - - [64, 704, 1, 1280, 64, 64, 64, 1280]
    - [105, 4149.0]
  - - [256, 128, 1, 256, 256, 256, 256, 256]
    - [86, 1559.0]
  - - [64, 1024, 1, 3328, 64, 64, 64, 3328]
    - [94, 5396.0]
  - - [1024, 64, 1, 1280, 1024, 1024, 1024, 1280]
    - [136, 4911.0]
  - - [256, 256, 1, 3328, 256, 256, 256, 3328]
    - [115, 5333.0]
  - - [64, 448, 1, 1280, 64, 64, 64, 1280]
    - [97, 3475.0]
  - - [64, 64, 1, 3328, 64, 64, 64, 3328]
    - [109, 621.0]
  - - [704, 64, 1, 3328, 704, 704, 704, 3328]
    - [114, 4181.0]
  - - [64, 128, 1, 256, 64, 64, 64, 256]
    - [103, 402.0]
  - - [704, 64, 1, 1280, 704, 704, 704, 1280]
    - [127, 3591.0]
  - - [128, 448, 1, 256, 128, 128, 128, 256]
    - [105, 2238.0]
  - - [448, 64, 1, 3328, 448, 448, 448, 3328]
    - [97, 3516.0]
  - - [64, 128, 1, 3328, 64, 64, 64, 3328]
    - [109, 1243.0]
  - - [128, 128, 1, 3328, 128, 128, 128, 3328]
    - [116, 2406.0]
  - - [256, 256, 1, 256, 256, 256, 256, 256]
    - [93, 2376.0]
  - - [128, 64, 1, 1280, 128, 128, 128, 1280]
    - [109, 952.0]
  - - [64, 1024, 1, 256, 64, 64, 64, 256]
    - [106, 2330.0]
  - - [64, 704, 1, 256, 64, 64, 64, 256]
    - [105, 1814.0]
  - - [1, 1, 1, 1280, 1, 1, 1, 1280]
    - [90, 0.08]
  - - [256, 64, 1, 3328, 256, 256, 256, 3328]
    - [97, 2365.0]
  - - [448, 128, 1, 256, 448, 448, 448, 256]
    - [114, 2191.0]
  - - [64, 704, 1, 3328, 64, 64, 64, 3328]
    - [105, 4101.0]
  - - [64, 448, 1, 3328, 64, 64, 64, 3328]
    - [130, 3506.0]
  - - [448, 128, 1, 3328, 448, 448, 448, 3328]
    - [115, 4650.0]
  - - [128, 256, 1, 1280, 128, 128, 128, 1280]
    - [135, 2937.0]
  - - [64, 448, 1, 256, 64, 64, 64, 256]
    - [105, 1292.0]
  - - [64, 256, 1, 1280, 64, 64, 64, 1280]
    - [97, 1836.0]
  - - [64, 128, 1, 1280, 64, 64, 64, 1280]
    - [109, 958.0]
  - - [64, 64, 1, 256, 64, 64, 64, 256]
    - [123, 191.0]
  - - [256, 128, 1, 1280, 256, 256, 256, 1280]
    - [135, 2893.0]
  - - [128, 256, 1, 3328, 128, 128, 128, 3328]
    - [135, 3489.0]
  - - [256, 64, 1, 256, 256, 256, 256, 256]
    - [103, 744.0]
  - - [128, 128, 1, 1280, 128, 128, 128, 1280]
    - [97, 1808.0]
  - - [128, 256, 1, 256, 128, 128, 128, 256]
    - [123, 1451.0]
  - - [256, 64, 1, 1280, 256, 256, 256, 1280]
    - [97, 1799.0]
  - - [704, 64, 1, 256, 704, 704, 704, 256]
    - [135, 1819.0]
  - - [128, 448, 1, 1280, 128, 128, 128, 1280]
    - [124, 4333.0]
  - - [64, 64, 1, 1280, 64, 64, 64, 1280]
    - [108, 479.0]
  - - [128, 64, 1, 3328, 128, 128, 128, 3328]
    - [116, 1238.0]
  - - [448, 64, 1, 256, 448, 448, 448, 256]
    - [135, 1288.0]
  - - [1024, 64, 1, 256, 1024, 1024, 1024, 256]
    - [105, 2317.0]
  - - [1, 1, 1, 1, 1, 1, 1, 1]
    - [132, 0.00023696682450230245]
  - - [448, 128, 1, 1280, 448, 448, 448, 1280]
    - [106, 4166.0]
  - - [1024, 64, 1, 3328, 1024, 1024, 1024, 3328]
    - [128, 5030.0]
  - - [128, 64, 1, 256, 128, 128, 128, 256]
    - [103, 374.0]
  - - [64, 256, 1, 3328, 64, 64, 64, 3328]
    - [116, 2342.0]
  - - [256, 256, 1, 1280, 256, 256, 256, 1280]
    - [106, 4718.0]
  - - [256, 128, 1, 3328, 256, 256, 256, 3328]
    - [135, 3464.0]
  - - [64, 256, 1, 256, 64, 64, 64, 256]
    - [105, 768.0]
  - - [1, 1, 1, 256, 1, 1, 1, 256]
    - [112, 0.06]
  - - [128, 448, 1, 3328, 128, 128, 128, 3328]
    - [94, 4766.0]
  - - [128, 128, 1, 256, 128, 128, 128, 256]
    - [97, 738.0]
  - - [1024, 16, 1, 512, 1024, 1024, 1024, 512]
    - [97, 1140.0]
  - - [512, 16, 1, 512, 512, 512, 512, 512]
    - [137, 892.0]
  - - [128, 1, 1, 1408, 128, 128, 128, 1408]
    - [96, 13.0]
  - - [64, 1, 1, 1216, 64, 64, 64, 1216]
    - [96, 7.0]
  - - [1024, 2, 1, 512, 1024, 1024, 1024, 512]
    - [116, 139.0]
  - - [512, 1, 1, 512, 512, 512, 512, 512]
    - [109, 35.0]
  - - [1024, 4, 1, 512, 1024, 1024, 1024, 512]
    - [97, 277.0]
  - - [512, 4, 1, 512, 512, 512, 512, 512]
    - [116, 145.0]
  - - [1024, 32, 1, 512, 1024, 1024, 1024, 512]
    - [98, 1978.0]
  - - [512, 2, 1, 512, 512, 512, 512, 512]
    - [109, 70.0]
  - - [1024, 1, 1, 512, 1024, 1024, 1024, 512]
    - [97, 70.0]
  - - [512, 32, 1, 512, 512, 512, 512, 512]
    - [137, 1165.0]
  - - [128, 1, 1, 1024, 128, 128, 128, 1024]
    - [96, 13.0]
  - - [64, 14, 1, 14, 64, 64, 64, 14]
    - [86, 3.0]
  - - [64, 14, 1, 15, 64, 64, 64, 15]
    - [103, 4.0]
  - - [64, 15, 1, 15, 64, 64, 64, 15]
    - [98, 4.0]
  - - [64, 15, 1, 17, 64, 64, 64, 17]
    - [86, 4.0]
  - - [64, 17, 1, 17, 64, 64, 64, 17]
    - [99, 5.0]
  - - [64, 17, 1, 21, 64, 64, 64, 21]
    - [86, 5.0]
  - - [64, 21, 1, 21, 64, 64, 64, 21]
    - [91, 7.0]
  - - [64, 24, 1, 24, 64, 64, 64, 24]
    - [86, 9.0]
  - - [64, 24, 1, 34, 64, 64, 64, 34]
    - [86, 12.0]
  - - [64, 30, 1, 30, 64, 64, 64, 30]
    - [86, 13.0]
  - - [64, 31, 1, 30, 64, 64, 64, 30]
    - [86, 14.0]
  - - [64, 31, 1, 31, 64, 64, 64, 31]
    - [125, 15.0]
  - - [64, 32, 1, 32, 64, 64, 64, 32]
    - [95, 17.0]
  - - [64, 34, 1, 34, 64, 64, 64, 34]
    - [112, 18.0]
  - - [64, 35, 1, 32, 64, 64, 64, 32]
    - [88, 17.0]
  - - [64, 35, 1, 35, 64, 64, 64, 35]
    - [114, 19.0]
  - - [64, 512, 1, 512, 64, 64, 64, 512]
    - [123, 2118.0]
  - - [1024, 4, 1, 2, 1024, 1024, 1024, 2]
    - [86, 2.0]
  - - [1024, 4, 1, 1024, 1024, 1024, 1024, 1024]
    - [109, 414.0]
  - - [1024, 32, 1, 2, 1024, 1024, 1024, 2]
    - [87, 17.0]
  - - [1024, 32, 1, 1024, 1024, 1024, 1024, 1024]
    - [97, 2593.0]
  - - [32, 200, 1, 1, 32, 32, 32, 1]
    - [86, 2.0]
  - - [64, 3, 512, 3, 64, 64, 64, 3]
    - [131, 82.0]
  - - [64, 5, 512, 5, 64, 64, 64, 5]
    - [86, 138.0]
  - - [64, 5, 960, 5, 64, 64, 64, 5]
    - [109, 224.0]
  - - [64, 9, 512, 9, 64, 64, 64, 9]
    - [125, 542.0]
  - - [64, 512, 1, 1, 64, 64, 64, 1]
    - [88, 8.0]
  - - [67, 512, 1, 2048, 67, 67, 67, 2048]
    - [135, 2894.0]
  - - [74, 512, 1, 2048, 74, 74, 74, 2048]
    - [135, 3228.0]
  - - [74, 960, 1, 2048, 74, 74, 74, 2048]
    - [106, 4333.0]
  - - [100, 512, 1, 2048, 100, 100, 100, 2048]
    - [106, 4161.0]
  - - [128, 27, 32768, 27, 128, 128, 128, 27]
    - [131, 4019.0]
  - - [64, 14, 10880, 14, 64, 64, 64, 14]
    - [111, 2858.0]
  - - [64, 14, 10880, 15, 64, 64, 64, 15]
    - [111, 2902.0]
  - - [64, 15, 7680, 15, 64, 64, 64, 15]
    - [111, 3055.0]
  - - [64, 15, 10880, 15, 64, 64, 64, 15]
    - [126, 3154.0]
  - - [64, 15, 7680, 17, 64, 64, 64, 17]
    - [119, 3360.0]
  - - [64, 17, 6144, 17, 64, 64, 64, 17]
    - [87, 3336.0]
  - - [64, 17, 7680, 17, 64, 64, 64, 17]
    - [87, 3385.0]
  - - [64, 17, 6144, 21, 64, 64, 64, 21]
    - [126, 3968.0]
  - - [64, 21, 6144, 21, 64, 64, 64, 21]
    - [100, 4924.0]
  - - [64, 24, 4736, 24, 64, 64, 64, 24]
    - [111, 6024.0]
  - - [64, 24, 4736, 34, 64, 64, 64, 34]
    - [111, 7148.0]
  - - [64, 30, 2048, 30, 64, 64, 64, 30]
    - [128, 6568.0]
  - - [64, 31, 2048, 30, 64, 64, 64, 30]
    - [128, 6787.0]
  - - [64, 31, 2048, 31, 64, 64, 64, 31]
    - [128, 6861.0]
  - - [64, 27, 1920, 27, 64, 64, 64, 27]
    - [128, 5627.0]
  - - [1024, 8, 1, 1024, 1024, 1024, 1024, 1024]
    - [97, 966.0]
  - - [1024, 77, 1, 1024, 1024, 1024, 1024, 1024]
    - [94, 4923.0]
  - - [1024, 10, 1, 2, 1024, 1024, 1024, 2]
    - [91, 12.0]
  - - [1024, 10, 1, 1024, 1024, 1024, 1024, 1024]
    - [109, 986.0]
  - - [1024, 39, 1, 2, 1024, 1024, 1024, 2]
    - [86, 44.0]
  - - [1024, 39, 1, 1024, 1024, 1024, 1024, 1024]
    - [127, 2904.0]
  - - [1024, 40, 1, 2, 1024, 1024, 1024, 2]
    - [86, 46.0]
  - - [1024, 40, 1, 1024, 1024, 1024, 1024, 1024]
    - [114, 2992.0]
  - - [1024, 41, 1, 2, 1024, 1024, 1024, 2]
    - [90, 21.0]
  - - [1024, 41, 1, 1024, 1024, 1024, 1024, 1024]
    - [93, 3023.0]
  - - [1024, 5, 1, 2, 1024, 1024, 1024, 2]
    - [86, 6.0]
  - - [1024, 5, 1, 1024, 1024, 1024, 1024, 1024]
    - [97, 485.0]
  - - [1024, 6, 1, 2, 1024, 1024, 1024, 2]
    - [86, 3.0]
  - - [1024, 6, 1, 1024, 1024, 1024, 1024, 1024]
    - [109, 595.0]
  - - [1024, 8, 1, 2, 1024, 1024, 1024, 2]
    - [86, 4.0]
  - - [1024, 9, 1, 2, 1024, 1024, 1024, 2]
    - [116, 5.0]
  - - [1024, 9, 1, 1024, 1024, 1024, 1024, 1024]
    - [125, 892.0]
  - - [64, 4, 32768, 4, 64, 64, 64, 4]
    - [111, 326.0]
  - - [64, 4, 38400, 4, 64, 64, 64, 4]
    - [89, 331.0]
  - - [128, 128, 1, 64, 128, 128, 128, 64]
    - [93, 541.0]
  - - [64, 128, 1, 128, 64, 64, 64, 128]
    - [105, 444.0]
  - - [64, 5, 1, 5, 64, 64, 64, 5]
    - [98, 0.41]
  - - [32, 33, 1, 33, 32, 32, 32, 33]
    - [86, 8.0]
  - - [1024, 16, 1, 2, 1024, 1024, 1024, 2]
    - [98, 9.0]
  - - [1024, 16, 1, 1024, 1024, 1024, 1024, 1024]
    - [109, 1592.0]
  - - [1024, 1, 1, 2, 1024, 1024, 1024, 2]
    - [90, 1.0]
  - - [1024, 1, 1, 1024, 1024, 1024, 1024, 1024]
    - [137, 99.0]
  - - [1024, 1, 1, 200, 1024, 1024, 1024, 200]
    - [123, 37.0]
  - - [1024, 1, 1, 1600, 1024, 1024, 1024, 1600]
    - [97, 116.0]
  - - [1024, 64, 1, 2, 1024, 1024, 1024, 2]
    - [101, 35.0]
  - - [1024, 64, 1, 1024, 1024, 1024, 1024, 1024]
    - [115, 4137.0]
  - - [1024, 80, 1, 1024, 1024, 1024, 1024, 1024]
    - [94, 4420.0]
  - - [1024, 80, 1, 2, 1024, 1024, 1024, 2]
    - [98, 42.0]
  - - [1024, 82, 1, 1024, 1024, 1024, 1024, 1024]
    - [115, 4540.0]
  - - [1024, 82, 1, 2, 1024, 1024, 1024, 2]
    - [98, 43.0]
  - - [1024, 12, 1, 1024, 1024, 1024, 1024, 1024]
    - [109, 1224.0]
  - - [1024, 12, 1, 2, 1024, 1024, 1024, 2]
    - [107, 7.0]
  - - [64, 24, 6816, 24, 64, 64, 64, 24]
    - [100, 5729.0]
  - - [64, 26, 6272, 26, 64, 64, 64, 26]
    - [131, 7287.0]
  - - [196, 256, 1, 2304, 196, 196, 196, 2304]
    - [106, 4566.0]
  - - [768, 3, 2, 256, 768, 768, 768, 256]
    - [105, 322.0]
  - - [768, 12, 2, 256, 768, 768, 768, 256]
    - [135, 786.0]
  - - [864, 12, 2, 256, 864, 864, 864, 256]
    - [135, 865.0]
  - - [864, 3, 2, 256, 864, 864, 864, 256]
    - [133, 214.0]
  - - [216, 3, 2, 256, 216, 216, 216, 256]
    - [135, 58.0]
  - - [176, 12, 2, 256, 176, 176, 176, 256]
    - [121, 195.0]
  - - [176, 3, 2, 256, 176, 176, 176, 256]
    - [121, 46.0]
  - - [192, 12, 2, 256, 192, 192, 192, 256]
    - [121, 201.0]
  - - [192, 3, 2, 256, 192, 192, 192, 256]
    - [135, 53.0]
  - - [216, 12, 2, 256, 216, 216, 216, 256]
    - [103, 230.0]
  - - [850, 3, 2, 256, 850, 850, 850, 256]
    - [105, 210.0]
  - - [850, 12, 2, 256, 850, 850, 850, 256]
    - [97, 837.0]
  - - [805, 12, 2, 256, 805, 805, 805, 256]
    - [123, 808.0]
  - - [805, 3, 2, 256, 805, 805, 805, 256]
    - [120, 236.0]
  - - [247, 3, 2, 256, 247, 247, 247, 256]
    - [129, 99.0]
  - - [950, 3, 2, 256, 950, 950, 950, 256]
    - [103, 372.0]
  - - [187, 12, 2, 256, 187, 187, 187, 256]
    - [121, 326.0]
  - - [247, 12, 2, 256, 247, 247, 247, 256]
    - [133, 253.0]
  - - [187, 3, 2, 256, 187, 187, 187, 256]
    - [133, 48.0]
  - - [228, 12, 2, 256, 228, 228, 228, 256]
    - [121, 240.0]
  - - [221, 12, 2, 256, 221, 221, 221, 256]
    - [122, 262.0]
  - - [950, 12, 2, 256, 950, 950, 950, 256]
    - [135, 915.0]
  - - [228, 3, 2, 256, 228, 228, 228, 256]
    - [121, 60.0]
  - - [221, 3, 2, 256, 221, 221, 221, 256]
    - [137, 91.0]
  - - [25, 128, 120, 256, 25, 25, 25, 256]
    - [122, 4201.0]
  - - [25, 128, 139, 256, 25, 25, 25, 256]
    - [105, 4004.0]
  - - [25, 128, 160, 256, 25, 25, 25, 256]
    - [114, 4011.0]
  - - [25, 128, 18, 256, 25, 25, 25, 256]
    - [118, 2371.0]
  - - [25, 128, 19, 256, 25, 25, 25, 256]
    - [105, 1871.0]
  - - [9, 128, 120, 256, 9, 9, 9, 256]
    - [133, 1629.0]
  - - [9, 128, 139, 256, 9, 9, 9, 256]
    - [121, 1804.0]
  - - [9, 128, 160, 256, 9, 9, 9, 256]
    - [103, 1819.0]
  - - [9, 128, 18, 256, 9, 9, 9, 256]
    - [133, 769.0]
  - - [9, 128, 19, 256, 9, 9, 9, 256]
    - [133, 805.0]
  - - [100, 512, 1, 2304, 100, 100, 100, 2304]
    - [106, 4216.0]
  - - [25, 256, 1, 1152, 25, 25, 25, 1152]
    - [109, 674.0]
  - - [9, 256, 1, 1152, 9, 9, 9, 1152]
    - [137, 250.0]
  - - [1024, 20, 1, 1024, 1024, 1024, 1024, 1024]
    - [116, 1589.0]
  - - [1024, 20, 1, 2, 1024, 1024, 1024, 2]
    - [108, 22.0]
- null
- null
- DeviceEfficiency
...
