library/src/blas3/Tensile/Logic/asm_full/navi22_Cijk_Alik_Bljk_SB.yaml
---
- {MinimumRequiredVersion: 4.28.0}
- navi22
- gfx1031
    SolutionIndex: 0
    SolutionNameMin: Cijk_Alik_Bljk_SB_MT128x64x8_SN_SU0_SUM0_TT8_8_WG16_8_1_WGM1
    SolutionIndex: 1
    SolutionNameMin: Cijk_Alik_Bljk_SB_MT128x128x8_SN_SU0_SUM0_TT8_16_WG16_8_1_WGM1
    SolutionIndex: 2
    SolutionNameMin: Cijk_Alik_Bljk_SB_MT128x128x8_SN_SU0_SUM0_TT8_8_WG16_16_1_WGM1
    SolutionIndex: 3
    SolutionNameMin: Cijk_Alik_Bljk_SB_MT128x64x16_SN_SU0_SUM0_TT8_8_WG16_8_1_WGM1
    SolutionIndex: 4
    SolutionNameMin: Cijk_Alik_Bljk_SB_MT128x128x16_SN_SU0_SUM0_TT8_16_WG16_8_1_WGM1
    SolutionIndex: 5
    SolutionNameMin: Cijk_Alik_Bljk_SB_MT128x128x16_SN_SU0_SUM0_TT8_8_WG16_16_1_WGM1
    SolutionIndex: 6
    SolutionNameMin: Cijk_Alik_Bljk_SB_MT128x256x16_SN_SU0_SUM0_TT8_16_WG16_16_1_WGM1
    SolutionIndex: 7
    SolutionNameMin: Cijk_Alik_Bljk_SB_MT128x64x8_SN_SU32_SUM3_TT8_8_WG16_8_1_WGM1
    SolutionIndex: 8
    SolutionNameMin: Cijk_Alik_Bljk_SB_MT128x128x8_SN_SU32_SUM3_TT8_16_WG16_8_1_WGM1
    SolutionIndex: 9
    SolutionNameMin: Cijk_Alik_Bljk_SB_MT128x128x8_SN_SU32_SUM3_TT8_8_WG16_16_1_WGM1
    SolutionIndex: 10
    SolutionNameMin: Cijk_Alik_Bljk_SB_MT128x256x8_SN_SU32_SUM3_TT8_16_WG16_16_1_WGM1
    SolutionIndex: 11
    SolutionNameMin: Cijk_Alik_Bljk_SB_MT128x64x16_SN_SU32_SUM3_TT8_8_WG16_8_1_WGM1
    SolutionIndex: 12
    SolutionNameMin: Cijk_Alik_Bljk_SB_MT128x128x16_SN_SU32_SUM3_TT8_16_WG16_8_1_WGM1
    SolutionIndex: 13
    SolutionNameMin: Cijk_Alik_Bljk_SB_MT128x128x16_SN_SU32_SUM3_TT8_8_WG16_16_1_WGM1
    SolutionIndex: 14
    SolutionNameMin: Cijk_Alik_Bljk_SB_MT128x256x16_SN_SU32_SUM3_TT8_16_WG16_16_1_WGM1
    SolutionIndex: 15
    SolutionNameMin: Cijk_Alik_Bljk_SB_MT128x128x32_SN_SU32_SUM3_TT8_16_WG16_8_1_WGM1
    SolutionIndex: 16
    SolutionNameMin: Cijk_Alik_Bljk_SB_MT128x64x8_SN_SU0_SUM0_TT8_8_WG16_8_1_WGM4
    SolutionIndex: 17
    SolutionNameMin: Cijk_Alik_Bljk_SB_MT128x128x8_SN_SU0_SUM0_TT8_16_WG16_8_1_WGM4
    SolutionIndex: 18
    SolutionNameMin: Cijk_Alik_Bljk_SB_MT128x128x8_SN_SU0_SUM0_TT8_8_WG16_16_1_WGM4
    SolutionIndex: 19
    SolutionNameMin: Cijk_Alik_Bljk_SB_MT128x64x16_SN_SU0_SUM0_TT8_8_WG16_8_1_WGM4
    SolutionIndex: 20
    SolutionNameMin: Cijk_Alik_Bljk_SB_MT128x128x16_SN_SU0_SUM0_TT8_16_WG16_8_1_WGM4
    SolutionIndex: 21
    SolutionNameMin: Cijk_Alik_Bljk_SB_MT128x128x16_SN_SU0_SUM0_TT8_8_WG16_16_1_WGM4
    SolutionIndex: 22
    SolutionNameMin: Cijk_Alik_Bljk_SB_MT128x256x16_SN_SU0_SUM0_TT8_16_WG16_16_1_WGM4
    SolutionIndex: 23
    SolutionNameMin: Cijk_Alik_Bljk_SB_MT128x128x32_SN_SU0_SUM0_TT8_8_WG16_16_1_WGM4
    SolutionIndex: 24
    SolutionNameMin: Cijk_Alik_Bljk_SB_MT128x64x8_SN_SU32_SUM3_TT8_8_WG16_8_1_WGM4
    SolutionIndex: 25
    SolutionNameMin: Cijk_Alik_Bljk_SB_MT128x128x8_SN_SU32_SUM3_TT8_16_WG16_8_1_WGM4
    SolutionIndex: 26
    SolutionNameMin: Cijk_Alik_Bljk_SB_MT128x128x8_SN_SU32_SUM3_TT8_8_WG16_16_1_WGM4
    SolutionIndex: 27
    SolutionNameMin: Cijk_Alik_Bljk_SB_MT128x64x16_SN_SU32_SUM3_TT8_8_WG16_8_1_WGM4
    SolutionIndex: 28
    SolutionNameMin: Cijk_Alik_Bljk_SB_MT128x128x16_SN_SU32_SUM3_TT8_16_WG16_8_1_WGM4
    SolutionIndex: 29
    SolutionNameMin: Cijk_Alik_Bljk_SB_MT128x128x16_SN_SU32_SUM3_TT8_8_WG16_16_1_WGM4
    SolutionIndex: 30
    SolutionNameMin: Cijk_Alik_Bljk_SB_MT128x256x16_SN_SU32_SUM3_TT8_16_WG16_16_1_WGM4
    SolutionIndex: 31
    SolutionNameMin: Cijk_Alik_Bljk_SB_MT128x64x32_SN_SU32_SUM3_TT8_8_WG16_8_1_WGM4
    SolutionIndex: 32
    SolutionNameMin: Cijk_Alik_Bljk_SB_MT128x128x32_SN_SU32_SUM3_TT8_16_WG16_8_1_WGM4
    SolutionIndex: 33
    SolutionNameMin: Cijk_Alik_Bljk_SB_MT128x128x32_SN_SU32_SUM3_TT8_8_WG16_16_1_WGM4
    SolutionIndex: 34
    SolutionNameMin: Cijk_Alik_Bljk_SB_MT128x64x8_SN_SU0_SUM0_TT8_8_WG16_8_1_WGM8
    SolutionIndex: 35
    SolutionNameMin: Cijk_Alik_Bljk_SB_MT128x128x8_SN_SU0_SUM0_TT8_16_WG16_8_1_WGM8
    SolutionIndex: 36
    SolutionNameMin: Cijk_Alik_Bljk_SB_MT128x128x8_SN_SU0_SUM0_TT8_8_WG16_16_1_WGM8
    SolutionIndex: 37
    SolutionNameMin: Cijk_Alik_Bljk_SB_MT128x64x16_SN_SU0_SUM0_TT8_8_WG16_8_1_WGM8
    SolutionIndex: 38
    SolutionNameMin: Cijk_Alik_Bljk_SB_MT128x128x16_SN_SU0_SUM0_TT8_16_WG16_8_1_WGM8
    SolutionIndex: 39
    SolutionNameMin: Cijk_Alik_Bljk_SB_MT128x128x16_SN_SU0_SUM0_TT8_8_WG16_16_1_WGM8
    SolutionIndex: 40
    SolutionNameMin: Cijk_Alik_Bljk_SB_MT128x256x16_SN_SU0_SUM0_TT8_16_WG16_16_1_WGM8
    SolutionIndex: 41
    SolutionNameMin: Cijk_Alik_Bljk_SB_MT128x128x32_SN_SU0_SUM0_TT8_16_WG16_8_1_WGM8
    SolutionIndex: 42
    SolutionNameMin: Cijk_Alik_Bljk_SB_MT128x128x32_SN_SU0_SUM0_TT8_8_WG16_16_1_WGM8
    SolutionIndex: 43
    SolutionNameMin: Cijk_Alik_Bljk_SB_MT128x64x8_SN_SU32_SUM3_TT8_8_WG16_8_1_WGM8
    SolutionIndex: 44
    SolutionNameMin: Cijk_Alik_Bljk_SB_MT128x128x8_SN_SU32_SUM3_TT8_16_WG16_8_1_WGM8
    SolutionIndex: 45
    SolutionNameMin: Cijk_Alik_Bljk_SB_MT128x128x8_SN_SU32_SUM3_TT8_8_WG16_16_1_WGM8
    SolutionIndex: 46
    SolutionNameMin: Cijk_Alik_Bljk_SB_MT128x64x16_SN_SU32_SUM3_TT8_8_WG16_8_1_WGM8
    SolutionIndex: 47
    SolutionNameMin: Cijk_Alik_Bljk_SB_MT128x128x16_SN_SU32_SUM3_TT8_16_WG16_8_1_WGM8
    SolutionIndex: 48
    SolutionNameMin: Cijk_Alik_Bljk_SB_MT128x128x16_SN_SU32_SUM3_TT8_8_WG16_16_1_WGM8
    SolutionIndex: 49
    SolutionNameMin: Cijk_Alik_Bljk_SB_MT128x256x16_SN_SU32_SUM3_TT8_16_WG16_16_1_WGM8
    SolutionIndex: 50
    SolutionNameMin: Cijk_Alik_Bljk_SB_MT128x128x32_SN_SU32_SUM3_TT8_16_WG16_8_1_WGM8
    SolutionIndex: 51
    SolutionNameMin: Cijk_Alik_Bljk_SB_MT128x128x32_SN_SU32_SUM3_TT8_8_WG16_16_1_WGM8
    SolutionIndex: 52
    SolutionNameMin: Cijk_Alik_Bljk_SB_MT128x128x16_SN_SU0_SUM0_TT8_16_WG16_8_1_WGM1
    SolutionIndex: 53
    SolutionNameMin: Cijk_Alik_Bljk_SB_MT128x128x32_SN_SU0_SUM0_TT8_16_WG16_8_1_WGM1
    SolutionIndex: 54
    SolutionNameMin: Cijk_Alik_Bljk_SB_MT128x64x16_SN_SU32_SUM3_TT8_8_WG16_8_1_WGM1
    SolutionIndex: 55
    SolutionNameMin: Cijk_Alik_Bljk_SB_MT128x128x16_SN_SU32_SUM3_TT8_16_WG16_8_1_WGM1
    SolutionIndex: 56
    SolutionNameMin: Cijk_Alik_Bljk_SB_MT128x256x16_SN_SU32_SUM3_TT8_16_WG16_16_1_WGM1
    SolutionIndex: 57
    SolutionNameMin: Cijk_Alik_Bljk_SB_MT128x128x32_SN_SU32_SUM3_TT8_16_WG16_8_1_WGM1
    SolutionIndex: 58
    SolutionNameMin: Cijk_Alik_Bljk_SB_MT128x128x32_SN_SU32_SUM3_TT8_8_WG16_16_1_WGM1
    SolutionIndex: 59
    SolutionNameMin: Cijk_Alik_Bljk_SB_MT128x128x16_SN_SU0_SUM0_TT8_16_WG16_8_1_WGM4
    SolutionIndex: 60
    SolutionNameMin: Cijk_Alik_Bljk_SB_MT128x128x32_SN_SU0_SUM0_TT8_16_WG16_8_1_WGM4
    SolutionIndex: 61
    SolutionNameMin: Cijk_Alik_Bljk_SB_MT128x128x16_SN_SU32_SUM3_TT8_8_WG16_16_1_WGM4
    SolutionIndex: 62
    SolutionNameMin: Cijk_Alik_Bljk_SB_MT128x256x16_SN_SU32_SUM3_TT8_16_WG16_16_1_WGM4
    SolutionIndex: 63
    SolutionNameMin: Cijk_Alik_Bljk_SB_MT128x128x32_SN_SU32_SUM3_TT8_16_WG16_8_1_WGM4
    SolutionIndex: 64
    SolutionNameMin: Cijk_Alik_Bljk_SB_MT128x128x32_SN_SU32_SUM3_TT8_8_WG16_16_1_WGM4
    SolutionIndex: 65
    SolutionNameMin: Cijk_Alik_Bljk_SB_MT128x128x16_SN_SU0_SUM0_TT8_16_WG16_8_1_WGM8
    SolutionIndex: 66
    SolutionNameMin: Cijk_Alik_Bljk_SB_MT128x128x32_SN_SU0_SUM0_TT8_16_WG16_8_1_WGM8
    SolutionIndex: 67
    SolutionNameMin: Cijk_Alik_Bljk_SB_MT128x128x16_SN_SU32_SUM3_TT8_16_WG16_8_1_WGM8
    SolutionIndex: 68
    SolutionNameMin: Cijk_Alik_Bljk_SB_MT128x64x32_SN_SU32_SUM3_TT8_8_WG16_8_1_WGM8
    SolutionIndex: 69
    SolutionNameMin: Cijk_Alik_Bljk_SB_MT128x128x32_SN_SU32_SUM3_TT8_16_WG16_8_1_WGM8
    SolutionIndex: 70
    SolutionNameMin: Cijk_Alik_Bljk_SB_MT128x128x32_SN_SU32_SUM3_TT8_8_WG16_16_1_WGM8
    SolutionIndex: 72
    SolutionNameMin: Cijk_Alik_Bljk_SB_MT32x64x8_SN_SU0_SUM0_TT4_8_WG8_8_1_WGM1
    SolutionIndex: 73
    SolutionNameMin: Cijk_Alik_Bljk_SB_MT64x64x8_SN_SU0_SUM0_TT8_8_WG8_8_1_WGM1
    SolutionIndex: 74
    SolutionNameMin: Cijk_Alik_Bljk_SB_MT64x32x8_SN_SU0_SUM0_TT4_4_WG16_8_1_WGM1
    SolutionIndex: 75
    SolutionNameMin: Cijk_Alik_Bljk_SB_MT64x64x8_SN_SU0_SUM0_TT4_8_WG16_8_1_WGM1
    SolutionIndex: 76
    SolutionNameMin: Cijk_Alik_Bljk_SB_MT128x64x8_SN_SU0_SUM0_TT8_8_WG16_8_1_WGM1
    SolutionIndex: 77
    SolutionNameMin: Cijk_Alik_Bljk_SB_MT64x128x8_SN_SU0_SUM0_TT4_8_WG16_16_1_WGM1
    SolutionIndex: 78
    SolutionNameMin: Cijk_Alik_Bljk_SB_MT128x128x8_SN_SU0_SUM0_TT8_8_WG16_16_1_WGM1
    SolutionIndex: 81
    SolutionNameMin: Cijk_Alik_Bljk_SB_MT64x64x16_SN_SU0_SUM0_TT8_8_WG8_8_1_WGM1
    SolutionIndex: 82
    SolutionNameMin: Cijk_Alik_Bljk_SB_MT64x32x16_SN_SU0_SUM0_TT4_4_WG16_8_1_WGM1
    SolutionIndex: 83
    SolutionNameMin: Cijk_Alik_Bljk_SB_MT64x64x16_SN_SU0_SUM0_TT4_8_WG16_8_1_WGM1
    SolutionIndex: 84
    SolutionNameMin: Cijk_Alik_Bljk_SB_MT128x64x16_SN_SU0_SUM0_TT8_8_WG16_8_1_WGM1
    SolutionIndex: 85
    SolutionNameMin: Cijk_Alik_Bljk_SB_MT64x64x16_SN_SU0_SUM0_TT4_4_WG16_16_1_WGM1
    SolutionIndex: 86
    SolutionNameMin: Cijk_Alik_Bljk_SB_MT128x128x16_SN_SU0_SUM0_TT8_8_WG16_16_1_WGM1
    SolutionIndex: 87
    SolutionNameMin: Cijk_Alik_Bljk_SB_MT64x64x8_SN_SU32_SUM3_TT8_8_WG8_8_1_WGM1
    SolutionIndex: 88
    SolutionNameMin: Cijk_Alik_Bljk_SB_MT64x64x8_SN_SU32_SUM3_TT4_8_WG16_8_1_WGM1
    SolutionIndex: 89
    SolutionNameMin: Cijk_Alik_Bljk_SB_MT128x64x8_SN_SU32_SUM3_TT8_8_WG16_8_1_WGM1
    SolutionIndex: 90
    SolutionNameMin: Cijk_Alik_Bljk_SB_MT128x128x8_SN_SU32_SUM3_TT8_8_WG16_16_1_WGM1
    SolutionIndex: 91
    SolutionNameMin: Cijk_Alik_Bljk_SB_MT32x64x16_SN_SU32_SUM3_TT4_8_WG8_8_1_WGM1
    SolutionIndex: 92
    SolutionNameMin: Cijk_Alik_Bljk_SB_MT64x64x16_SN_SU32_SUM3_TT8_8_WG8_8_1_WGM1
    SolutionIndex: 95
    SolutionNameMin: Cijk_Alik_Bljk_SB_MT128x64x16_SN_SU32_SUM3_TT8_8_WG16_8_1_WGM1
    SolutionIndex: 96
    SolutionNameMin: Cijk_Alik_Bljk_SB_MT64x128x16_SN_SU32_SUM3_TT4_8_WG16_16_1_WGM1
    SolutionIndex: 97
    SolutionNameMin: Cijk_Alik_Bljk_SB_MT128x128x16_SN_SU32_SUM3_TT8_8_WG16_16_1_WGM1
    SolutionIndex: 100
    SolutionNameMin: Cijk_Alik_Bljk_SB_MT128x64x32_SN_SU32_SUM3_TT8_8_WG16_8_1_WGM1
    SolutionIndex: 103
    SolutionNameMin: Cijk_Alik_Bljk_SB_MT128x128x32_SN_SU32_SUM3_TT8_8_WG16_16_1_WGM1
    SolutionIndex: 104
    SolutionNameMin: Cijk_Alik_Bljk_SB_MT32x64x8_SN_SU0_SUM0_TT4_8_WG8_8_1_WGM4
    SolutionIndex: 105
    SolutionNameMin: Cijk_Alik_Bljk_SB_MT64x64x8_SN_SU0_SUM0_TT8_8_WG8_8_1_WGM4
    SolutionIndex: 106
    SolutionNameMin: Cijk_Alik_Bljk_SB_MT64x64x8_SN_SU0_SUM0_TT4_8_WG16_8_1_WGM4
    SolutionIndex: 107
    SolutionNameMin: Cijk_Alik_Bljk_SB_MT128x64x8_SN_SU0_SUM0_TT8_8_WG16_8_1_WGM4
    SolutionIndex: 109
    SolutionNameMin: Cijk_Alik_Bljk_SB_MT128x128x8_SN_SU0_SUM0_TT8_8_WG16_16_1_WGM4
    SolutionIndex: 110
    SolutionNameMin: Cijk_Alik_Bljk_SB_MT64x64x16_SN_SU0_SUM0_TT8_8_WG8_8_1_WGM4
    SolutionIndex: 111
    SolutionNameMin: Cijk_Alik_Bljk_SB_MT64x64x16_SN_SU0_SUM0_TT4_8_WG16_8_1_WGM4
    SolutionIndex: 112
    SolutionNameMin: Cijk_Alik_Bljk_SB_MT128x64x16_SN_SU0_SUM0_TT8_8_WG16_8_1_WGM4
    SolutionIndex: 113
    SolutionNameMin: Cijk_Alik_Bljk_SB_MT128x128x16_SN_SU0_SUM0_TT8_8_WG16_16_1_WGM4
    SolutionIndex: 117
    SolutionNameMin: Cijk_Alik_Bljk_SB_MT64x64x8_SN_SU32_SUM3_TT8_8_WG8_8_1_WGM4
    SolutionIndex: 118
    SolutionNameMin: Cijk_Alik_Bljk_SB_MT64x64x8_SN_SU32_SUM3_TT4_8_WG16_8_1_WGM4
    SolutionIndex: 119
    SolutionNameMin: Cijk_Alik_Bljk_SB_MT128x64x8_SN_SU32_SUM3_TT8_8_WG16_8_1_WGM4
    SolutionIndex: 120
    SolutionNameMin: Cijk_Alik_Bljk_SB_MT64x128x8_SN_SU32_SUM3_TT4_8_WG16_16_1_WGM4
    SolutionIndex: 121
    SolutionNameMin: Cijk_Alik_Bljk_SB_MT128x128x8_SN_SU32_SUM3_TT8_8_WG16_16_1_WGM4
    SolutionIndex: 123
    SolutionNameMin: Cijk_Alik_Bljk_SB_MT64x64x16_SN_SU32_SUM3_TT8_8_WG8_8_1_WGM4
    SolutionIndex: 124
    SolutionNameMin: Cijk_Alik_Bljk_SB_MT64x32x16_SN_SU32_SUM3_TT4_4_WG16_8_1_WGM4
    SolutionIndex: 125
    SolutionNameMin: Cijk_Alik_Bljk_SB_MT64x64x16_SN_SU32_SUM3_TT4_8_WG16_8_1_WGM4
    SolutionIndex: 126
    SolutionNameMin: Cijk_Alik_Bljk_SB_MT128x64x16_SN_SU32_SUM3_TT8_8_WG16_8_1_WGM4
    SolutionIndex: 127
    SolutionNameMin: Cijk_Alik_Bljk_SB_MT64x128x16_SN_SU32_SUM3_TT4_8_WG16_16_1_WGM4
    SolutionIndex: 128
    SolutionNameMin: Cijk_Alik_Bljk_SB_MT128x128x16_SN_SU32_SUM3_TT8_8_WG16_16_1_WGM4
    SolutionIndex: 130
    SolutionNameMin: Cijk_Alik_Bljk_SB_MT64x64x32_SN_SU32_SUM3_TT4_8_WG16_8_1_WGM4
    SolutionIndex: 131
    SolutionNameMin: Cijk_Alik_Bljk_SB_MT128x64x32_SN_SU32_SUM3_TT8_8_WG16_8_1_WGM4
    SolutionIndex: 134
    SolutionNameMin: Cijk_Alik_Bljk_SB_MT128x128x32_SN_SU32_SUM3_TT8_8_WG16_16_1_WGM4
    SolutionIndex: 135
    SolutionNameMin: Cijk_Alik_Bljk_SB_MT32x32x8_SN_SU0_SUM0_TT4_4_WG8_8_1_WGM8
    SolutionIndex: 136
    SolutionNameMin: Cijk_Alik_Bljk_SB_MT64x64x8_SN_SU0_SUM0_TT8_8_WG8_8_1_WGM8
    SolutionIndex: 137
    SolutionNameMin: Cijk_Alik_Bljk_SB_MT64x64x8_SN_SU0_SUM0_TT4_8_WG16_8_1_WGM8
    SolutionIndex: 138
    SolutionNameMin: Cijk_Alik_Bljk_SB_MT128x64x8_SN_SU0_SUM0_TT8_8_WG16_8_1_WGM8
    SolutionIndex: 139
    SolutionNameMin: Cijk_Alik_Bljk_SB_MT128x128x8_SN_SU0_SUM0_TT8_8_WG16_16_1_WGM8
    SolutionIndex: 140
    SolutionNameMin: Cijk_Alik_Bljk_SB_MT64x64x16_SN_SU0_SUM0_TT8_8_WG8_8_1_WGM8
    SolutionIndex: 141
    SolutionNameMin: Cijk_Alik_Bljk_SB_MT128x64x16_SN_SU0_SUM0_TT8_8_WG16_8_1_WGM8
    SolutionIndex: 143
    SolutionNameMin: Cijk_Alik_Bljk_SB_MT128x128x16_SN_SU0_SUM0_TT8_8_WG16_16_1_WGM8
    SolutionIndex: 145
    SolutionNameMin: Cijk_Alik_Bljk_SB_MT128x128x32_SN_SU0_SUM0_TT8_8_WG16_16_1_WGM8
    SolutionIndex: 146
    SolutionNameMin: Cijk_Alik_Bljk_SB_MT32x32x8_SN_SU32_SUM3_TT4_4_WG8_8_1_WGM8
    SolutionIndex: 147
    SolutionNameMin: Cijk_Alik_Bljk_SB_MT32x64x8_SN_SU32_SUM3_TT4_8_WG8_8_1_WGM8
    SolutionIndex: 148
    SolutionNameMin: Cijk_Alik_Bljk_SB_MT64x64x8_SN_SU32_SUM3_TT8_8_WG8_8_1_WGM8
    SolutionIndex: 149
    SolutionNameMin: Cijk_Alik_Bljk_SB_MT64x64x8_SN_SU32_SUM3_TT4_8_WG16_8_1_WGM8
    SolutionIndex: 150
    SolutionNameMin: Cijk_Alik_Bljk_SB_MT128x64x8_SN_SU32_SUM3_TT8_8_WG16_8_1_WGM8
    SolutionIndex: 151
    SolutionNameMin: Cijk_Alik_Bljk_SB_MT128x128x8_SN_SU32_SUM3_TT8_8_WG16_16_1_WGM8
    SolutionIndex: 152
    SolutionNameMin: Cijk_Alik_Bljk_SB_MT64x64x16_SN_SU32_SUM3_TT8_8_WG8_8_1_WGM8
    SolutionIndex: 153
    SolutionNameMin: Cijk_Alik_Bljk_SB_MT64x64x16_SN_SU32_SUM3_TT4_8_WG16_8_1_WGM8
    SolutionIndex: 154
    SolutionNameMin: Cijk_Alik_Bljk_SB_MT128x64x16_SN_SU32_SUM3_TT8_8_WG16_8_1_WGM8
    SolutionIndex: 155
    SolutionNameMin: Cijk_Alik_Bljk_SB_MT64x64x16_SN_SU32_SUM3_TT4_4_WG16_16_1_WGM8
    SolutionIndex: 156
    SolutionNameMin: Cijk_Alik_Bljk_SB_MT64x128x16_SN_SU32_SUM3_TT4_8_WG16_16_1_WGM8
    SolutionIndex: 157
    SolutionNameMin: Cijk_Alik_Bljk_SB_MT128x128x16_SN_SU32_SUM3_TT8_8_WG16_16_1_WGM8
    SolutionIndex: 158
    SolutionNameMin: Cijk_Alik_Bljk_SB_MT64x64x32_SN_SU32_SUM3_TT8_8_WG8_8_1_WGM8
    SolutionIndex: 159
    SolutionNameMin: Cijk_Alik_Bljk_SB_MT64x64x32_SN_SU32_SUM3_TT4_8_WG16_8_1_WGM8
    SolutionIndex: 161
    SolutionNameMin: Cijk_Alik_Bljk_SB_MT128x128x32_SN_SU32_SUM3_TT8_8_WG16_16_1_WGM8
- - - [1024, 4096, 1, 1024, 1024, 1024, 1024, 1024]
    - [12, 11616.0]
  - - [4096, 4096, 1, 1024, 4096, 4096, 1024, 1024]
    - [14, 12032.0]
  - - [1024, 4096, 1, 4096, 1024, 1024, 4096, 4096]
    - [28, 11151.0]
  - - [30528, 4096, 1, 1024, 30528, 30528, 1024, 1024]
    - [49, 12402.0]
  - - [1024, 2048, 1, 1024, 1024, 1024, 1024, 1024]
    - [12, 10498.0]
  - - [4096, 2048, 1, 1024, 4096, 4096, 1024, 1024]
    - [14, 11908.0]
  - - [1024, 2048, 1, 4096, 1024, 1024, 4096, 4096]
    - [12, 10804.0]
  - - [30528, 2048, 1, 1024, 30528, 30528, 1024, 1024]
    - [49, 12317.0]
  - - [30522, 320, 1, 768, 30522, 30522, 768, 768]
    - [47, 9984.0]
  - - [3072, 4096, 1, 768, 3072, 3072, 768, 768]
    - [28, 11969.0]
  - - [768, 4096, 1, 3072, 768, 768, 3072, 3072]
    - [49, 11734.0]
  - - [768, 4096, 1, 768, 768, 768, 768, 768]
    - [49, 11396.0]
  - - [30522, 160, 1, 768, 30522, 30522, 768, 768]
    - [27, 8249.0]
  - - [30522, 640, 1, 768, 30522, 30522, 768, 768]
    - [12, 12048.0]
  - - [30522, 1280, 1, 768, 30522, 30522, 768, 768]
    - [49, 12200.0]
  - - [1024, 3072, 1, 1024, 1024, 1024, 1024, 1024]
    - [14, 11288.0]
  - - [1024, 2048, 1, 3072, 1024, 1024, 3072, 3072]
    - [12, 10811.0]
  - - [1024, 3072, 1, 3072, 1024, 1024, 3072, 3072]
    - [14, 11749.0]
  - - [3072, 2048, 1, 1024, 3072, 3072, 1024, 1024]
    - [28, 11603.0]
  - - [3072, 3072, 1, 1024, 3072, 3072, 1024, 1024]
    - [28, 12017.0]
  - - [3072, 512, 1, 1024, 3072, 3072, 1024, 1024]
    - [12, 10794.0]
  - - [30522, 160, 1, 1024, 30522, 30522, 1024, 1024]
    - [47, 7451.0]
  - - [128, 128, 512, 64, 128, 128, 64, 64]
    - [48, 9425.0]
  - - [512, 512, 64, 64, 512, 512, 64, 64]
    - [4, 10583.0]
  - - [256, 256, 192, 64, 256, 256, 64, 64]
    - [36, 10346.0]
  - - [256, 256, 96, 64, 256, 256, 64, 64]
    - [36, 9893.0]
  - - [128, 128, 384, 64, 128, 128, 64, 64]
    - [39, 9342.0]
  - - [128, 128, 96, 64, 128, 128, 64, 64]
    - [36, 7391.0]
  - - [512, 512, 16, 64, 512, 512, 64, 64]
    - [7, 9628.0]
  - - [512, 512, 96, 64, 512, 512, 64, 64]
    - [0, 10441.0]
  - - [512, 512, 128, 64, 512, 512, 64, 64]
    - [0, 7709.0]
  - - [2944, 4288, 1, 1280, 2944, 2944, 1280, 1280]
    - [30, 11908.0]
  - - [2368, 5888, 1, 256, 2368, 2368, 256, 256]
    - [12, 11418.0]
  - - [5888, 1856, 1, 256, 5888, 5888, 256, 256]
    - [20, 11280.0]
  - - [512, 24000, 1, 1536, 512, 512, 1536, 1536]
    - [30, 12142.0]
  - - [5888, 1408, 1, 256, 5888, 5888, 256, 256]
    - [28, 11399.0]
  - - [5888, 1856, 1, 3328, 5888, 5888, 3328, 3328]
    - [12, 11673.0]
  - - [5056, 704, 1, 256, 5056, 5056, 256, 256]
    - [9, 9737.0]
  - - [5888, 2944, 1, 3328, 5888, 5888, 3328, 3328]
    - [12, 12248.0]
  - - [1856, 4288, 1, 256, 1856, 1856, 256, 256]
    - [20, 10851.0]
  - - [1024, 5056, 1, 128, 1024, 1024, 128, 128]
    - [20, 10278.0]
  - - [5056, 5056, 1, 3328, 5056, 5056, 3328, 3328]
    - [30, 12145.0]
  - - [1408, 5888, 1, 1280, 1408, 1408, 1280, 1280]
    - [30, 11986.0]
  - - [2368, 6784, 1, 128, 2368, 2368, 128, 128]
    - [17, 11102.0]
  - - [1024, 3584, 1, 3328, 1024, 1024, 3328, 3328]
    - [14, 11488.0]
  - - [512, 48000, 1, 2048, 512, 512, 2048, 2048]
    - [49, 12248.0]
  - - [5888, 1408, 1, 1280, 5888, 5888, 1280, 1280]
    - [28, 11835.0]
  - - [1024, 2368, 1, 256, 1024, 1024, 256, 256]
    - [28, 9715.0]
  - - [1408, 1856, 1, 1280, 1408, 1408, 1280, 1280]
    - [28, 10455.0]
  - - [6144, 24000, 1, 2048, 6144, 6144, 2048, 2048]
    - [6, 12420.0]
  - - [5056, 5056, 1, 1280, 5056, 5056, 1280, 1280]
    - [14, 9910.0]
  - - [448, 5056, 1, 256, 448, 448, 256, 256]
    - [9, 7586.0]
  - - [1760, 6400, 1, 1760, 1760, 1760, 1760, 1760]
    - [38, 10217.0]
  - - [1856, 1408, 1, 128, 1856, 1856, 128, 128]
    - [9, 7911.0]
  - - [6784, 256, 1, 3328, 6784, 6784, 3328, 3328]
    - [49, 9768.0]
  - - [6784, 4288, 1, 3328, 6784, 6784, 3328, 3328]
    - [30, 10972.0]
  - - [4288, 448, 1, 256, 4288, 4288, 256, 256]
    - [9, 7460.0]
  - - [1856, 2368, 1, 3328, 1856, 1856, 3328, 3328]
    - [12, 10500.0]
  - - [4288, 2944, 1, 1280, 4288, 4288, 1280, 1280]
    - [28, 9449.0]
  - - [704, 5056, 1, 1280, 704, 704, 1280, 1280]
    - [30, 10439.0]
  - - [2368, 704, 1, 3328, 2368, 2368, 3328, 3328]
    - [28, 9800.0]
  - - [256, 5888, 1, 256, 256, 256, 256, 256]
    - [29, 8590.0]
  - - [1856, 4288, 1, 3328, 1856, 1856, 3328, 3328]
    - [47, 9115.0]
  - - [5888, 1024, 1, 256, 5888, 5888, 256, 256]
    - [9, 9879.0]
  - - [16384, 3200, 1, 4096, 16384, 16384, 4096, 4096]
    - [14, 10129.0]
  - - [1408, 2944, 1, 256, 1408, 1408, 256, 256]
    - [26, 9443.0]
  - - [6784, 5056, 1, 3328, 6784, 6784, 3328, 3328]
    - [12, 11212.0]
  - - [5056, 5056, 1, 256, 5056, 5056, 256, 256]
    - [28, 11484.0]
  - - [1408, 6784, 1, 128, 1408, 1408, 128, 128]
    - [9, 10818.0]
  - - [704, 5056, 1, 128, 704, 704, 128, 128]
    - [18, 9309.0]
  - - [2368, 2944, 1, 1280, 2368, 2368, 1280, 1280]
    - [47, 11659.0]
  - - [6784, 6784, 1, 1280, 6784, 6784, 1280, 1280]
    - [12, 11077.0]
  - - [1408, 4288, 1, 1280, 1408, 1408, 1280, 1280]
    - [28, 11211.0]
  - - [3584, 4288, 1, 1280, 3584, 3584, 1280, 1280]
    - [14, 8807.0]
  - - [2368, 704, 1, 1280, 2368, 2368, 1280, 1280]
    - [28, 9173.0]
  - - [5056, 4288, 1, 3328, 5056, 5056, 3328, 3328]
    - [12, 10713.0]
  - - [3584, 2368, 1, 3328, 3584, 3584, 3328, 3328]
    - [12, 8327.0]
  - - [6784, 448, 1, 1280, 6784, 6784, 1280, 1280]
    - [38, 9433.0]
  - - [1408, 2944, 1, 128, 1408, 1408, 128, 128]
    - [18, 9914.0]
  - - [4288, 2944, 1, 256, 4288, 4288, 256, 256]
    - [38, 11300.0]
  - - [5888, 704, 1, 1280, 5888, 5888, 1280, 1280]
    - [22, 10568.0]
  - - [448, 5888, 1, 128, 448, 448, 128, 128]
    - [18, 7893.0]
  - - [5056, 2368, 1, 1280, 5056, 5056, 1280, 1280]
    - [20, 9885.0]
  - - [448, 3584, 1, 1280, 448, 448, 1280, 1280]
    - [22, 9174.0]
  - - [6784, 5888, 1, 256, 6784, 6784, 256, 256]
    - [20, 12031.0]
  - - [1024, 1408, 1, 256, 1024, 1024, 256, 256]
    - [9, 8689.0]
  - - [2368, 2368, 1, 3328, 2368, 2368, 3328, 3328]
    - [12, 10545.0]
  - - [1856, 6784, 1, 128, 1856, 1856, 128, 128]
    - [26, 10617.0]
  - - [5056, 704, 1, 3328, 5056, 5056, 3328, 3328]
    - [30, 10575.0]
  - - [1408, 1856, 1, 256, 1408, 1408, 256, 256]
    - [39, 8354.0]
  - - [2368, 5056, 1, 256, 2368, 2368, 256, 256]
    - [20, 10946.0]
  - - [3584, 2368, 1, 1280, 3584, 3584, 1280, 1280]
    - [28, 11166.0]
  - - [704, 5888, 1, 256, 704, 704, 256, 256]
    - [28, 9672.0]
  - - [6784, 2944, 1, 128, 6784, 6784, 128, 128]
    - [47, 10231.0]
  - - [2560, 1600, 1, 2560, 2560, 2560, 2560, 2560]
    - [47, 11212.0]
  - - [4288, 6784, 1, 3328, 4288, 4288, 3328, 3328]
    - [30, 11144.0]
  - - [2944, 6784, 1, 3328, 2944, 2944, 3328, 3328]
    - [28, 10833.0]
  - - [6144, 5984, 1, 2048, 6144, 6144, 2048, 2048]
    - [47, 8709.0]
  - - [3584, 704, 1, 3328, 3584, 3584, 3328, 3328]
    - [12, 9904.0]
  - - [2048, 1600, 1, 512, 2048, 2048, 512, 512]
    - [28, 9738.0]
  - - [448, 4288, 1, 256, 448, 448, 256, 256]
    - [25, 8372.0]
  - - [1856, 4288, 1, 128, 1856, 1856, 128, 128]
    - [4, 9860.0]
  - - [704, 2368, 1, 1280, 704, 704, 1280, 1280]
    - [14, 9729.0]
  - - [1856, 2368, 1, 1280, 1856, 1856, 1280, 1280]
    - [47, 10513.0]
  - - [1856, 4288, 1, 1280, 1856, 1856, 1280, 1280]
    - [30, 11258.0]
  - - [704, 2944, 1, 128, 704, 704, 128, 128]
    - [25, 7952.0]
  - - [1408, 1024, 1, 1280, 1408, 1408, 1280, 1280]
    - [28, 9787.0]
  - - [704, 6784, 1, 256, 704, 704, 256, 256]
    - [28, 9850.0]
  - - [6784, 704, 1, 256, 6784, 6784, 256, 256]
    - [12, 9889.0]
  - - [5056, 1408, 1, 128, 5056, 5056, 128, 128]
    - [26, 10188.0]
  - - [2048, 7000, 1, 2048, 2048, 2048, 2048, 2048]
    - [12, 8113.0]
  - - [3584, 4288, 1, 3328, 3584, 3584, 3328, 3328]
    - [14, 10344.0]
  - - [5888, 1856, 1, 1280, 5888, 5888, 1280, 1280]
    - [47, 10523.0]
  - - [2368, 3584, 1, 1280, 2368, 2368, 1280, 1280]
    - [28, 11408.0]
  - - [2368, 6784, 1, 1280, 2368, 2368, 1280, 1280]
    - [30, 8562.0]
  - - [2944, 3584, 1, 3328, 2944, 2944, 3328, 3328]
    - [20, 9565.0]
  - - [6784, 2944, 1, 256, 6784, 6784, 256, 256]
    - [20, 11759.0]
  - - [4288, 2368, 1, 3328, 4288, 4288, 3328, 3328]
    - [12, 9714.0]
  - - [1856, 2368, 1, 256, 1856, 1856, 256, 256]
    - [26, 9017.0]
  - - [3584, 6784, 1, 3328, 3584, 3584, 3328, 3328]
    - [28, 10932.0]
  - - [1024, 5888, 1, 3328, 1024, 1024, 3328, 3328]
    - [12, 8542.0]
  - - [6144, 24000, 1, 2560, 6144, 6144, 2560, 2560]
    - [28, 11484.0]
  - - [5056, 4288, 1, 1280, 5056, 5056, 1280, 1280]
    - [12, 9505.0]
  - - [6784, 1856, 1, 3328, 6784, 6784, 3328, 3328]
    - [47, 9627.0]
  - - [1408, 5056, 1, 1280, 1408, 1408, 1280, 1280]
    - [28, 11807.0]
  - - [2368, 2368, 1, 1280, 2368, 2368, 1280, 1280]
    - [28, 10823.0]
  - - [2944, 5888, 1, 128, 2944, 2944, 128, 128]
    - [44, 10456.0]
  - - [704, 5888, 1, 1280, 704, 704, 1280, 1280]
    - [14, 10503.0]
  - - [2368, 3584, 1, 128, 2368, 2368, 128, 128]
    - [25, 10059.0]
  - - [1856, 5056, 1, 128, 1856, 1856, 128, 128]
    - [26, 10136.0]
  - - [8192, 3200, 1, 2048, 8192, 8192, 2048, 2048]
    - [12, 9390.0]
  - - [1024, 5056, 1, 1280, 1024, 1024, 1280, 1280]
    - [38, 11103.0]
  - - [4288, 1024, 1, 256, 4288, 4288, 256, 256]
    - [20, 10171.0]
  - - [2944, 2368, 1, 128, 2944, 2944, 128, 128]
    - [17, 10138.0]
  - - [5888, 448, 1, 1280, 5888, 5888, 1280, 1280]
    - [49, 9411.0]
  - - [704, 5888, 1, 3328, 704, 704, 3328, 3328]
    - [4, 7713.0]
  - - [3584, 2944, 1, 256, 3584, 3584, 256, 256]
    - [47, 10577.0]
  - - [512, 24000, 1, 2048, 512, 512, 2048, 2048]
    - [47, 6996.0]
  - - [1408, 5056, 1, 3328, 1408, 1408, 3328, 3328]
    - [30, 8748.0]
  - - [1856, 1856, 1, 3328, 1856, 1856, 3328, 3328]
    - [12, 10297.0]
  - - [2560, 800, 1, 2560, 2560, 2560, 2560, 2560]
    - [28, 10287.0]
  - - [2368, 2368, 1, 256, 2368, 2368, 256, 256]
    - [20, 10089.0]
  - - [4288, 4288, 1, 1280, 4288, 4288, 1280, 1280]
    - [14, 9643.0]
  - - [5888, 1024, 1, 1280, 5888, 5888, 1280, 1280]
    - [28, 11326.0]
  - - [1408, 4288, 1, 256, 1408, 1408, 256, 256]
    - [26, 9720.0]
  - - [5888, 448, 1, 128, 5888, 5888, 128, 128]
    - [43, 8337.0]
  - - [512, 48000, 1, 2560, 512, 512, 2560, 2560]
    - [12, 9958.0]
  - - [704, 6784, 1, 3328, 704, 704, 3328, 3328]
    - [28, 7616.0]
  - - [2560, 6400, 1, 2560, 2560, 2560, 2560, 2560]
    - [28, 9727.0]
  - - [5056, 1024, 1, 1280, 5056, 5056, 1280, 1280]
    - [14, 11277.0]
  - - [448, 5888, 1, 3328, 448, 448, 3328, 3328]
    - [12, 7503.0]
  - - [1024, 2944, 1, 1280, 1024, 1024, 1280, 1280]
    - [12, 10359.0]
  - - [5056, 5888, 1, 1280, 5056, 5056, 1280, 1280]
    - [12, 10122.0]
  - - [4288, 5888, 1, 128, 4288, 4288, 128, 128]
    - [44, 11166.0]
  - - [1408, 3584, 1, 128, 1408, 1408, 128, 128]
    - [18, 10345.0]
  - - [448, 3584, 1, 128, 448, 448, 128, 128]
    - [18, 8028.0]
  - - [5888, 2944, 1, 1280, 5888, 5888, 1280, 1280]
    - [12, 9577.0]
  - - [2368, 5888, 1, 128, 2368, 2368, 128, 128]
    - [8, 9780.0]
  - - [3584, 5888, 1, 256, 3584, 3584, 256, 256]
    - [28, 11742.0]
  - - [2368, 1024, 1, 128, 2368, 2368, 128, 128]
    - [26, 8560.0]
  - - [2368, 704, 1, 128, 2368, 2368, 128, 128]
    - [18, 7776.0]
  - - [3584, 2944, 1, 1280, 3584, 3584, 1280, 1280]
    - [28, 11571.0]
  - - [3584, 2368, 1, 128, 3584, 3584, 128, 128]
    - [28, 10064.0]
  - - [5056, 704, 1, 128, 5056, 5056, 128, 128]
    - [43, 8519.0]
  - - [5056, 1408, 1, 3328, 5056, 5056, 3328, 3328]
    - [12, 8945.0]
  - - [6784, 1024, 1, 3328, 6784, 6784, 3328, 3328]
    - [30, 8718.0]
  - - [6784, 2944, 1, 3328, 6784, 6784, 3328, 3328]
    - [28, 10648.0]
  - - [2944, 5056, 1, 3328, 2944, 2944, 3328, 3328]
    - [20, 10129.0]
  - - [1856, 1856, 1, 256, 1856, 1856, 256, 256]
    - [26, 8629.0]
  - - [1024, 5888, 1, 128, 1024, 1024, 128, 128]
    - [12, 9904.0]
  - - [6784, 2368, 1, 1280, 6784, 6784, 1280, 1280]
    - [12, 9192.0]
  - - [4288, 5888, 1, 1280, 4288, 4288, 1280, 1280]
    - [30, 10109.0]
  - - [4288, 4288, 1, 256, 4288, 4288, 256, 256]
    - [20, 11358.0]
  - - [4288, 1856, 1, 1280, 4288, 4288, 1280, 1280]
    - [20, 11167.0]
  - - [1856, 2944, 1, 3328, 1856, 1856, 3328, 3328]
    - [38, 10339.0]
  - - [256, 6784, 1, 3328, 256, 256, 3328, 3328]
    - [14, 10409.0]
  - - [256, 5056, 1, 128, 256, 256, 128, 128]
    - [0, 6886.0]
  - - [5056, 1024, 1, 256, 5056, 5056, 256, 256]
    - [20, 10573.0]
  - - [5056, 1856, 1, 3328, 5056, 5056, 3328, 3328]
    - [38, 9261.0]
  - - [1856, 1408, 1, 256, 1856, 1856, 256, 256]
    - [26, 8312.0]
  - - [8448, 12000, 1, 2816, 8448, 8448, 2816, 2816]
    - [20, 12128.0]
  - - [4288, 1408, 1, 128, 4288, 4288, 128, 128]
    - [9, 8633.0]
  - - [1856, 5888, 1, 3328, 1856, 1856, 3328, 3328]
    - [14, 9226.0]
  - - [4288, 5056, 1, 256, 4288, 4288, 256, 256]
    - [47, 11355.0]
  - - [4096, 800, 1, 1024, 4096, 4096, 1024, 1024]
    - [12, 9241.0]
  - - [5056, 256, 1, 3328, 5056, 5056, 3328, 3328]
    - [14, 11046.0]
  - - [1024, 5888, 1, 1280, 1024, 1024, 1280, 1280]
    - [28, 11190.0]
  - - [6784, 2368, 1, 128, 6784, 6784, 128, 128]
    - [38, 10838.0]
  - - [1856, 1024, 1, 1280, 1856, 1856, 1280, 1280]
    - [30, 10799.0]
  - - [6784, 4288, 1, 1280, 6784, 6784, 1280, 1280]
    - [14, 10540.0]
  - - [1856, 1856, 1, 1280, 1856, 1856, 1280, 1280]
    - [12, 9876.0]
  - - [4096, 400, 1, 1024, 4096, 4096, 1024, 1024]
    - [47, 7955.0]
  - - [3072, 24000, 1, 1024, 3072, 3072, 1024, 1024]
    - [12, 10663.0]
  - - [5888, 1856, 1, 128, 5888, 5888, 128, 128]
    - [36, 9287.0]
  - - [5056, 3584, 1, 128, 5056, 5056, 128, 128]
    - [28, 10529.0]
  - - [5888, 5888, 1, 3328, 5888, 5888, 3328, 3328]
    - [28, 11404.0]
  - - [6784, 1024, 1, 256, 6784, 6784, 256, 256]
    - [26, 9934.0]
  - - [2944, 2368, 1, 256, 2944, 2944, 256, 256]
    - [26, 9790.0]
  - - [5056, 5888, 1, 3328, 5056, 5056, 3328, 3328]
    - [12, 11217.0]
  - - [1856, 1024, 1, 256, 1856, 1856, 256, 256]
    - [26, 7593.0]
  - - [512, 48000, 1, 1536, 512, 512, 1536, 1536]
    - [30, 8988.0]
  - - [3584, 448, 1, 1280, 3584, 3584, 1280, 1280]
    - [11, 8940.0]
  - - [8448, 5984, 1, 2816, 8448, 8448, 2816, 2816]
    - [47, 11309.0]
  - - [448, 5888, 1, 256, 448, 448, 256, 256]
    - [9, 7852.0]
  - - [1408, 6784, 1, 3328, 1408, 1408, 3328, 3328]
    - [12, 9507.0]
  - - [4288, 704, 1, 128, 4288, 4288, 128, 128]
    - [36, 6967.0]
  - - [5056, 2944, 1, 256, 5056, 5056, 256, 256]
    - [20, 11572.0]
  - - [6784, 5888, 1, 128, 6784, 6784, 128, 128]
    - [4, 11754.0]
  - - [2944, 704, 1, 128, 2944, 2944, 128, 128]
    - [9, 8541.0]
  - - [1408, 3584, 1, 3328, 1408, 1408, 3328, 3328]
    - [49, 10136.0]
  - - [2368, 6784, 1, 256, 2368, 2368, 256, 256]
    - [20, 11278.0]
  - - [5056, 1408, 1, 1280, 5056, 5056, 1280, 1280]
    - [4, 11540.0]
  - - [5056, 4288, 1, 128, 5056, 5056, 128, 128]
    - [38, 10793.0]
  - - [1408, 1856, 1, 128, 1408, 1408, 128, 128]
    - [26, 8963.0]
  - - [1408, 5888, 1, 3328, 1408, 1408, 3328, 3328]
    - [49, 9885.0]
  - - [6784, 6784, 1, 256, 6784, 6784, 256, 256]
    - [28, 11962.0]
  - - [4288, 2368, 1, 128, 4288, 4288, 128, 128]
    - [35, 10307.0]
  - - [2368, 2944, 1, 256, 2368, 2368, 256, 256]
    - [12, 11128.0]
  - - [3584, 1856, 1, 1280, 3584, 3584, 1280, 1280]
    - [28, 11487.0]
  - - [6784, 6784, 1, 128, 6784, 6784, 128, 128]
    - [17, 11766.0]
  - - [5888, 5056, 1, 256, 5888, 5888, 256, 256]
    - [47, 11750.0]
  - - [8448, 48000, 1, 2816, 8448, 8448, 2816, 2816]
    - [49, 12268.0]
  - - [3584, 448, 1, 256, 3584, 3584, 256, 256]
    - [46, 6671.0]
  - - [448, 4288, 1, 128, 448, 448, 128, 128]
    - [26, 7474.0]
  - - [256, 6784, 1, 256, 256, 256, 256, 256]
    - [28, 8616.0]
  - - [1408, 4288, 1, 128, 1408, 1408, 128, 128]
    - [18, 10060.0]
  - - [2944, 704, 1, 3328, 2944, 2944, 3328, 3328]
    - [28, 10462.0]
  - - [5056, 256, 1, 1280, 5056, 5056, 1280, 1280]
    - [30, 10678.0]
  - - [3584, 3584, 1, 256, 3584, 3584, 256, 256]
    - [20, 10993.0]
  - - [3584, 5056, 1, 256, 3584, 3584, 256, 256]
    - [28, 11548.0]
  - - [2944, 2368, 1, 1280, 2944, 2944, 1280, 1280]
    - [28, 11650.0]
  - - [1408, 3584, 1, 256, 1408, 1408, 256, 256]
    - [20, 10691.0]
  - - [6784, 3584, 1, 256, 6784, 6784, 256, 256]
    - [47, 11790.0]
  - - [5056, 2368, 1, 128, 5056, 5056, 128, 128]
    - [35, 10429.0]
  - - [2944, 2944, 1, 3328, 2944, 2944, 3328, 3328]
    - [49, 9597.0]
  - - [5056, 6784, 1, 256, 5056, 5056, 256, 256]
    - [28, 11669.0]
  - - [1856, 3584, 1, 128, 1856, 1856, 128, 128]
    - [18, 10306.0]
  - - [6784, 448, 1, 256, 6784, 6784, 256, 256]
    - [11, 9358.0]
  - - [3584, 6784, 1, 128, 3584, 3584, 128, 128]
    - [4, 10566.0]
  - - [5056, 1856, 1, 256, 5056, 5056, 256, 256]
    - [12, 10819.0]
  - - [4608, 5984, 1, 1536, 4608, 4608, 1536, 1536]
    - [47, 10034.0]
  - - [1760, 3200, 1, 1760, 1760, 1760, 1760, 1760]
    - [17, 11588.0]
  - - [1024, 1856, 1, 256, 1024, 1024, 256, 256]
    - [20, 9215.0]
  - - [4096, 1600, 1, 1024, 4096, 4096, 1024, 1024]
    - [12, 11246.0]
  - - [1408, 6784, 1, 1280, 1408, 1408, 1280, 1280]
    - [47, 11492.0]
  - - [3584, 3584, 1, 1280, 3584, 3584, 1280, 1280]
    - [14, 10752.0]
  - - [7680, 24000, 1, 2560, 7680, 7680, 2560, 2560]
    - [28, 12025.0]
  - - [4608, 48000, 1, 1536, 4608, 4608, 1536, 1536]
    - [30, 12136.0]
  - - [5888, 5888, 1, 128, 5888, 5888, 128, 128]
    - [20, 11611.0]
  - - [5056, 2368, 1, 3328, 5056, 5056, 3328, 3328]
    - [22, 10080.0]
  - - [2944, 4288, 1, 256, 2944, 2944, 256, 256]
    - [9, 10057.0]
  - - [1408, 3584, 1, 1280, 1408, 1408, 1280, 1280]
    - [49, 11461.0]
  - - [8192, 1600, 1, 2048, 8192, 8192, 2048, 2048]
    - [12, 7451.0]
  - - [512, 24000, 1, 2560, 512, 512, 2560, 2560]
    - [28, 8273.0]
  - - [2368, 6784, 1, 3328, 2368, 2368, 3328, 3328]
    - [20, 10265.0]
  - - [1856, 1408, 1, 1280, 1856, 1856, 1280, 1280]
    - [12, 9789.0]
  - - [6784, 704, 1, 128, 6784, 6784, 128, 128]
    - [36, 9057.0]
  - - [1408, 5888, 1, 256, 1408, 1408, 256, 256]
    - [28, 11269.0]
  - - [704, 2944, 1, 1280, 704, 704, 1280, 1280]
    - [20, 10067.0]
  - - [704, 6784, 1, 128, 704, 704, 128, 128]
    - [18, 9399.0]
  - - [3584, 704, 1, 1280, 3584, 3584, 1280, 1280]
    - [47, 9842.0]
  - - [5888, 2368, 1, 256, 5888, 5888, 256, 256]
    - [38, 11357.0]
  - - [2944, 6784, 1, 128, 2944, 2944, 128, 128]
    - [38, 11468.0]
  - - [3584, 448, 1, 3328, 3584, 3584, 3328, 3328]
    - [46, 9413.0]
  - - [704, 2368, 1, 3328, 704, 704, 3328, 3328]
    - [14, 10018.0]
  - - [256, 5888, 1, 128, 256, 256, 128, 128]
    - [21, 7484.0]
  - - [2048, 3200, 1, 512, 2048, 2048, 512, 512]
    - [20, 11222.0]
  - - [2944, 2944, 1, 1280, 2944, 2944, 1280, 1280]
    - [28, 11691.0]
  - - [5056, 448, 1, 3328, 5056, 5056, 3328, 3328]
    - [40, 9427.0]
  - - [6784, 704, 1, 3328, 6784, 6784, 3328, 3328]
    - [30, 7439.0]
  - - [5888, 4288, 1, 128, 5888, 5888, 128, 128]
    - [0, 3607.0]
  - - [1408, 2944, 1, 3328, 1408, 1408, 3328, 3328]
    - [47, 11178.0]
  - - [3584, 704, 1, 128, 3584, 3584, 128, 128]
    - [43, 8119.0]
  - - [4608, 12000, 1, 1536, 4608, 4608, 1536, 1536]
    - [12, 11115.0]
  - - [5056, 5056, 1, 128, 5056, 5056, 128, 128]
    - [0, 3778.0]
  - - [8192, 800, 1, 2048, 8192, 8192, 2048, 2048]
    - [28, 7030.0]
  - - [448, 5056, 1, 128, 448, 448, 128, 128]
    - [9, 6574.0]
  - - [5056, 3584, 1, 256, 5056, 5056, 256, 256]
    - [28, 11574.0]
  - - [1408, 5056, 1, 128, 1408, 1408, 128, 128]
    - [28, 10551.0]
  - - [2944, 3584, 1, 128, 2944, 2944, 128, 128]
    - [38, 11074.0]
  - - [3584, 2368, 1, 256, 3584, 3584, 256, 256]
    - [28, 11080.0]
  - - [8448, 24000, 1, 2816, 8448, 8448, 2816, 2816]
    - [14, 12123.0]
  - - [3584, 3584, 1, 3328, 3584, 3584, 3328, 3328]
    - [38, 10316.0]
  - - [5888, 6784, 1, 256, 5888, 5888, 256, 256]
    - [28, 11950.0]
  - - [4288, 2944, 1, 3328, 4288, 4288, 3328, 3328]
    - [28, 10239.0]
  - - [256, 5056, 1, 1280, 256, 256, 1280, 1280]
    - [9, 9360.0]
  - - [2944, 5888, 1, 3328, 2944, 2944, 3328, 3328]
    - [30, 10927.0]
  - - [6784, 5888, 1, 1280, 6784, 6784, 1280, 1280]
    - [28, 10745.0]
  - - [2048, 800, 1, 512, 2048, 2048, 512, 512]
    - [9, 7963.0]
  - - [5888, 4288, 1, 1280, 5888, 5888, 1280, 1280]
    - [28, 11861.0]
  - - [1024, 24000, 1, 2048, 1024, 1024, 2048, 2048]
    - [28, 9483.0]
  - - [5888, 3584, 1, 128, 5888, 5888, 128, 128]
    - [20, 11152.0]
  - - [1024, 2944, 1, 128, 1024, 1024, 128, 128]
    - [9, 8858.0]
  - - [704, 3584, 1, 128, 704, 704, 128, 128]
    - [26, 8715.0]
  - - [5888, 448, 1, 3328, 5888, 5888, 3328, 3328]
    - [28, 7373.0]
  - - [2368, 4288, 1, 1280, 2368, 2368, 1280, 1280]
    - [12, 11183.0]
  - - [4288, 2944, 1, 128, 4288, 4288, 128, 128]
    - [36, 10534.0]
  - - [1024, 6784, 1, 3328, 1024, 1024, 3328, 3328]
    - [4, 8281.0]
  - - [5056, 2944, 1, 3328, 5056, 5056, 3328, 3328]
    - [12, 10195.0]
  - - [2944, 3584, 1, 256, 2944, 2944, 256, 256]
    - [20, 10401.0]
  - - [1408, 1408, 1, 3328, 1408, 1408, 3328, 3328]
    - [12, 10156.0]
  - - [3584, 3584, 1, 128, 3584, 3584, 128, 128]
    - [4, 10414.0]
  - - [3584, 704, 1, 256, 3584, 3584, 256, 256]
    - [46, 8824.0]
  - - [3584, 1408, 1, 3328, 3584, 3584, 3328, 3328]
    - [20, 10622.0]
  - - [704, 3584, 1, 1280, 704, 704, 1280, 1280]
    - [28, 9685.0]
  - - [2944, 6784, 1, 1280, 2944, 2944, 1280, 1280]
    - [12, 9603.0]
  - - [1856, 6784, 1, 256, 1856, 1856, 256, 256]
    - [9, 10148.0]
  - - [4288, 448, 1, 3328, 4288, 4288, 3328, 3328]
    - [12, 9581.0]
  - - [6784, 4288, 1, 128, 6784, 6784, 128, 128]
    - [20, 11092.0]
  - - [6784, 704, 1, 1280, 6784, 6784, 1280, 1280]
    - [30, 10459.0]
  - - [3584, 6784, 1, 256, 3584, 3584, 256, 256]
    - [12, 11813.0]
  - - [6144, 12000, 1, 2048, 6144, 6144, 2048, 2048]
    - [47, 10643.0]
  - - [5888, 1024, 1, 3328, 5888, 5888, 3328, 3328]
    - [14, 8423.0]
  - - [704, 6784, 1, 1280, 704, 704, 1280, 1280]
    - [12, 10391.0]
  - - [1856, 5056, 1, 3328, 1856, 1856, 3328, 3328]
    - [47, 9326.0]
  - - [1024, 3584, 1, 128, 1024, 1024, 128, 128]
    - [9, 7954.0]
  - - [1024, 1408, 1, 128, 1024, 1024, 128, 128]
    - [26, 7203.0]
  - - [2368, 2944, 1, 128, 2368, 2368, 128, 128]
    - [26, 9643.0]
  - - [5056, 2944, 1, 128, 5056, 5056, 128, 128]
    - [38, 10757.0]
  - - [5888, 5056, 1, 3328, 5888, 5888, 3328, 3328]
    - [14, 11211.0]
  - - [5888, 2368, 1, 128, 5888, 5888, 128, 128]
    - [9, 9296.0]
  - - [3584, 6784, 1, 1280, 3584, 3584, 1280, 1280]
    - [14, 10033.0]
  - - [1856, 5888, 1, 256, 1856, 1856, 256, 256]
    - [26, 9916.0]
  - - [4288, 4288, 1, 3328, 4288, 4288, 3328, 3328]
    - [12, 10731.0]
  - - [4288, 1408, 1, 1280, 4288, 4288, 1280, 1280]
    - [4, 11428.0]
  - - [3584, 5056, 1, 128, 3584, 3584, 128, 128]
    - [26, 9818.0]
  - - [4288, 2368, 1, 256, 4288, 4288, 256, 256]
    - [28, 10581.0]
  - - [2944, 5056, 1, 1280, 2944, 2944, 1280, 1280]
    - [40, 8886.0]
  - - [448, 6784, 1, 256, 448, 448, 256, 256]
    - [28, 8111.0]
  - - [1856, 2368, 1, 128, 1856, 1856, 128, 128]
    - [9, 9106.0]
  - - [6784, 2368, 1, 3328, 6784, 6784, 3328, 3328]
    - [28, 9982.0]
  - - [4288, 1856, 1, 3328, 4288, 4288, 3328, 3328]
    - [28, 9362.0]
  - - [3584, 448, 1, 128, 3584, 3584, 128, 128]
    - [24, 6016.0]
  - - [2048, 1600, 1, 2048, 2048, 2048, 2048, 2048]
    - [12, 10616.0]
  - - [3584, 1024, 1, 1280, 3584, 3584, 1280, 1280]
    - [28, 10881.0]
  - - [1856, 5056, 1, 256, 1856, 1856, 256, 256]
    - [20, 11003.0]
  - - [1024, 4288, 1, 256, 1024, 1024, 256, 256]
    - [12, 10422.0]
  - - [5888, 3584, 1, 3328, 5888, 5888, 3328, 3328]
    - [47, 10764.0]
  - - [5056, 3584, 1, 3328, 5056, 5056, 3328, 3328]
    - [30, 10623.0]
  - - [2368, 1408, 1, 1280, 2368, 2368, 1280, 1280]
    - [28, 10292.0]
  - - [5056, 2944, 1, 1280, 5056, 5056, 1280, 1280]
    - [12, 8654.0]
  - - [1024, 6784, 1, 256, 1024, 1024, 256, 256]
    - [26, 9637.0]
  - - [5124, 9124, 1, 2048, 5124, 5124, 2048, 2048]
    - [49, 10617.0]
  - - [2944, 1408, 1, 128, 2944, 2944, 128, 128]
    - [9, 8625.0]
  - - [3584, 1408, 1, 1280, 3584, 3584, 1280, 1280]
    - [12, 11378.0]
  - - [5056, 6784, 1, 3328, 5056, 5056, 3328, 3328]
    - [12, 11370.0]
  - - [3584, 4288, 1, 256, 3584, 3584, 256, 256]
    - [26, 10047.0]
  - - [1856, 6784, 1, 3328, 1856, 1856, 3328, 3328]
    - [12, 9868.0]
  - - [5888, 4288, 1, 256, 5888, 5888, 256, 256]
    - [12, 11604.0]
  - - [5056, 1408, 1, 256, 5056, 5056, 256, 256]
    - [38, 10879.0]
  - - [3584, 1024, 1, 256, 3584, 3584, 256, 256]
    - [47, 10521.0]
  - - [5888, 5888, 1, 256, 5888, 5888, 256, 256]
    - [47, 11973.0]
  - - [4288, 1024, 1, 1280, 4288, 4288, 1280, 1280]
    - [14, 11226.0]
  - - [448, 6784, 1, 3328, 448, 448, 3328, 3328]
    - [29, 6201.0]
  - - [2944, 1408, 1, 1280, 2944, 2944, 1280, 1280]
    - [28, 11069.0]
  - - [2944, 1856, 1, 3328, 2944, 2944, 3328, 3328]
    - [20, 10071.0]
  - - [3584, 5888, 1, 1280, 3584, 3584, 1280, 1280]
    - [28, 9561.0]
  - - [6784, 1856, 1, 1280, 6784, 6784, 1280, 1280]
    - [12, 8561.0]
  - - [2944, 5056, 1, 256, 2944, 2944, 256, 256]
    - [28, 10569.0]
  - - [5888, 256, 1, 3328, 5888, 5888, 3328, 3328]
    - [15, 8010.0]
  - - [2944, 4288, 1, 128, 2944, 2944, 128, 128]
    - [36, 9753.0]
  - - [3584, 1408, 1, 256, 3584, 3584, 256, 256]
    - [28, 10615.0]
  - - [704, 3584, 1, 3328, 704, 704, 3328, 3328]
    - [47, 10070.0]
  - - [4096, 3200, 1, 1024, 4096, 4096, 1024, 1024]
    - [12, 10335.0]
  - - [5056, 448, 1, 1280, 5056, 5056, 1280, 1280]
    - [30, 9561.0]
  - - [3584, 1856, 1, 3328, 3584, 3584, 3328, 3328]
    - [20, 9595.0]
  - - [4288, 6784, 1, 1280, 4288, 4288, 1280, 1280]
    - [49, 10529.0]
  - - [2560, 7000, 1, 2560, 2560, 2560, 2560, 2560]
    - [49, 9982.0]
  - - [2944, 1024, 1, 256, 2944, 2944, 256, 256]
    - [26, 8957.0]
  - - [2368, 4288, 1, 3328, 2368, 2368, 3328, 3328]
    - [12, 9729.0]
  - - [1024, 1408, 1, 1280, 1024, 1024, 1280, 1280]
    - [12, 9028.0]
  - - [6784, 5056, 1, 256, 6784, 6784, 256, 256]
    - [28, 11792.0]
  - - [1856, 1856, 1, 128, 1856, 1856, 128, 128]
    - [9, 8995.0]
  - - [3584, 5056, 1, 3328, 3584, 3584, 3328, 3328]
    - [47, 10698.0]
  - - [448, 6784, 1, 128, 448, 448, 128, 128]
    - [18, 6806.0]
  - - [2944, 6784, 1, 256, 2944, 2944, 256, 256]
    - [47, 11859.0]
  - - [2944, 2944, 1, 128, 2944, 2944, 128, 128]
    - [17, 10993.0]
  - - [1856, 3584, 1, 1280, 1856, 1856, 1280, 1280]
    - [47, 11539.0]
  - - [4288, 448, 1, 128, 4288, 4288, 128, 128]
    - [9, 7747.0]
  - - [4608, 24000, 1, 1536, 4608, 4608, 1536, 1536]
    - [49, 12421.0]
  - - [1856, 1408, 1, 3328, 1856, 1856, 3328, 3328]
    - [12, 10542.0]
  - - [1024, 4288, 1, 3328, 1024, 1024, 3328, 3328]
    - [14, 11728.0]
  - - [5056, 448, 1, 256, 5056, 5056, 256, 256]
    - [11, 9146.0]
  - - [2944, 2368, 1, 3328, 2944, 2944, 3328, 3328]
    - [12, 11761.0]
  - - [704, 4288, 1, 3328, 704, 704, 3328, 3328]
    - [12, 10064.0]
  - - [1024, 1856, 1, 1280, 1024, 1024, 1280, 1280]
    - [28, 10804.0]
  - - [2048, 6400, 1, 2048, 2048, 2048, 2048, 2048]
    - [14, 12291.0]
  - - [512, 48000, 1, 2816, 512, 512, 2816, 2816]
    - [49, 12290.0]
  - - [5124, 9124, 1, 2560, 5124, 5124, 2560, 2560]
    - [49, 11925.0]
  - - [1024, 5888, 1, 256, 1024, 1024, 256, 256]
    - [12, 11093.0]
  - - [1408, 2368, 1, 256, 1408, 1408, 256, 256]
    - [45, 10142.0]
  - - [1408, 1408, 1, 256, 1408, 1408, 256, 256]
    - [9, 9357.0]
  - - [2368, 2368, 1, 128, 2368, 2368, 128, 128]
    - [17, 9938.0]
  - - [6784, 1408, 1, 128, 6784, 6784, 128, 128]
    - [35, 11071.0]
  - - [4288, 5888, 1, 256, 4288, 4288, 256, 256]
    - [20, 11699.0]
  - - [1408, 5056, 1, 256, 1408, 1408, 256, 256]
    - [28, 11303.0]
  - - [4288, 3584, 1, 128, 4288, 4288, 128, 128]
    - [35, 11111.0]
  - - [3584, 5056, 1, 1280, 3584, 3584, 1280, 1280]
    - [14, 12132.0]
  - - [1856, 1024, 1, 128, 1856, 1856, 128, 128]
    - [9, 9593.0]
  - - [1024, 24000, 1, 1536, 1024, 1024, 1536, 1536]
    - [14, 12213.0]
  - - [704, 4288, 1, 256, 704, 704, 256, 256]
    - [9, 9333.0]
  - - [5888, 2368, 1, 1280, 5888, 5888, 1280, 1280]
    - [12, 11807.0]
  - - [2368, 5888, 1, 1280, 2368, 2368, 1280, 1280]
    - [49, 11944.0]
  - - [5888, 256, 1, 1280, 5888, 5888, 1280, 1280]
    - [12, 10347.0]
  - - [2368, 1856, 1, 3328, 2368, 2368, 3328, 3328]
    - [28, 10823.0]
  - - [2944, 704, 1, 256, 2944, 2944, 256, 256]
    - [45, 9498.0]
  - - [2368, 1024, 1, 3328, 2368, 2368, 3328, 3328]
    - [14, 11221.0]
  - - [704, 3584, 1, 256, 704, 704, 256, 256]
    - [9, 9375.0]
  - - [704, 2944, 1, 3328, 704, 704, 3328, 3328]
    - [12, 10582.0]
  - - [6784, 1024, 1, 128, 6784, 6784, 128, 128]
    - [26, 10802.0]
  - - [2944, 1024, 1, 3328, 2944, 2944, 3328, 3328]
    - [30, 11251.0]
  - - [2944, 5056, 1, 128, 2944, 2944, 128, 128]
    - [17, 11141.0]
  - - [1408, 6784, 1, 256, 1408, 1408, 256, 256]
    - [38, 11465.0]
  - - [6784, 1408, 1, 3328, 6784, 6784, 3328, 3328]
    - [12, 11891.0]
  - - [4288, 6784, 1, 128, 4288, 4288, 128, 128]
    - [35, 11439.0]
  - - [6784, 2944, 1, 1280, 6784, 6784, 1280, 1280]
    - [47, 12161.0]
  - - [4288, 1856, 1, 128, 4288, 4288, 128, 128]
    - [17, 10330.0]
  - - [1856, 2944, 1, 128, 1856, 1856, 128, 128]
    - [1, 10303.0]
  - - [6784, 448, 1, 128, 6784, 6784, 128, 128]
    - [19, 9119.0]
  - - [448, 5056, 1, 1280, 448, 448, 1280, 1280]
    - [14, 10313.0]
  - - [2368, 1856, 1, 128, 2368, 2368, 128, 128]
    - [35, 9689.0]
  - - [4288, 704, 1, 256, 4288, 4288, 256, 256]
    - [20, 9397.0]
  - - [5888, 704, 1, 256, 5888, 5888, 256, 256]
    - [12, 10176.0]
  - - [3584, 1024, 1, 128, 3584, 3584, 128, 128]
    - [28, 10172.0]
  - - [256, 5888, 1, 3328, 256, 256, 3328, 3328]
    - [12, 10608.0]
  - - [1408, 4288, 1, 3328, 1408, 1408, 3328, 3328]
    - [47, 11774.0]
  - - [6784, 4288, 1, 256, 6784, 6784, 256, 256]
    - [12, 11775.0]
  - - [5888, 256, 1, 256, 5888, 5888, 256, 256]
    - [26, 9402.0]
  - - [6784, 1024, 1, 1280, 6784, 6784, 1280, 1280]
    - [30, 11897.0]
  - - [5888, 1024, 1, 128, 5888, 5888, 128, 128]
    - [20, 10894.0]
  - - [6784, 3584, 1, 1280, 6784, 6784, 1280, 1280]
    - [30, 12192.0]
  - - [1024, 6784, 1, 1280, 1024, 1024, 1280, 1280]
    - [12, 11693.0]
  - - [1408, 2944, 1, 1280, 1408, 1408, 1280, 1280]
    - [28, 11665.0]
  - - [2048, 800, 1, 2048, 2048, 2048, 2048, 2048]
    - [12, 9649.0]
  - - [1408, 2368, 1, 3328, 1408, 1408, 3328, 3328]
    - [47, 11112.0]
  - - [2944, 1856, 1, 128, 2944, 2944, 128, 128]
    - [17, 10300.0]
  - - [256, 6784, 1, 128, 256, 256, 128, 128]
    - [24, 9103.0]
  - - [5056, 6784, 1, 128, 5056, 5056, 128, 128]
    - [12, 11325.0]
  - - [4288, 5056, 1, 128, 4288, 4288, 128, 128]
    - [44, 11151.0]
  - - [1856, 5888, 1, 128, 1856, 1856, 128, 128]
    - [18, 10678.0]
  - - [2944, 5888, 1, 256, 2944, 2944, 256, 256]
    - [38, 11947.0]
  - - [3584, 1856, 1, 256, 3584, 3584, 256, 256]
    - [12, 11053.0]
  - - [4288, 3584, 1, 1280, 4288, 4288, 1280, 1280]
    - [49, 12056.0]
  - - [704, 5888, 1, 128, 704, 704, 128, 128]
    - [9, 9588.0]
  - - [6784, 3584, 1, 128, 6784, 6784, 128, 128]
    - [35, 11667.0]
  - - [4288, 5056, 1, 3328, 4288, 4288, 3328, 3328]
    - [14, 12121.0]
  - - [1408, 1408, 1, 128, 1408, 1408, 128, 128]
    - [9, 9141.0]
  - - [5056, 2368, 1, 256, 5056, 5056, 256, 256]
    - [4, 11299.0]
  - - [4288, 704, 1, 3328, 4288, 4288, 3328, 3328]
    - [28, 10071.0]
  - - [448, 3584, 1, 256, 448, 448, 256, 256]
    - [28, 8779.0]
  - - [2368, 1024, 1, 1280, 2368, 2368, 1280, 1280]
    - [49, 10974.0]
  - - [2944, 1408, 1, 3328, 2944, 2944, 3328, 3328]
    - [28, 11728.0]
  - - [1024, 1408, 1, 3328, 1024, 1024, 3328, 3328]
    - [12, 10198.0]
  - - [2944, 5888, 1, 1280, 2944, 2944, 1280, 1280]
    - [28, 12207.0]
  - - [5888, 3584, 1, 256, 5888, 5888, 256, 256]
    - [20, 11924.0]
  - - [2368, 5056, 1, 128, 2368, 2368, 128, 128]
    - [17, 10849.0]
  - - [1408, 1856, 1, 3328, 1408, 1408, 3328, 3328]
    - [12, 10561.0]
  - - [6784, 1408, 1, 1280, 6784, 6784, 1280, 1280]
    - [12, 11849.0]
  - - [4096, 7000, 1, 4096, 4096, 4096, 4096, 4096]
    - [14, 11986.0]
  - - [704, 2944, 1, 256, 704, 704, 256, 256]
    - [26, 9605.0]
  - - [6784, 5888, 1, 3328, 6784, 6784, 3328, 3328]
    - [22, 12374.0]
  - - [2368, 4288, 1, 128, 2368, 2368, 128, 128]
    - [35, 10671.0]
  - - [1024, 6784, 1, 128, 1024, 1024, 128, 128]
    - [4, 10959.0]
  - - [1408, 1408, 1, 1280, 1408, 1408, 1280, 1280]
    - [28, 10164.0]
  - - [16384, 400, 1, 4096, 16384, 16384, 4096, 4096]
    - [49, 9366.0]
  - - [448, 4288, 1, 3328, 448, 448, 3328, 3328]
    - [12, 9787.0]
  - - [2368, 1408, 1, 256, 2368, 2368, 256, 256]
    - [4, 10239.0]
  - - [5888, 5056, 1, 128, 5888, 5888, 128, 128]
    - [4, 11406.0]
  - - [704, 2368, 1, 256, 704, 704, 256, 256]
    - [26, 8954.0]
  - - [1024, 24000, 1, 2560, 1024, 1024, 2560, 2560]
    - [14, 12278.0]
  - - [5888, 2368, 1, 3328, 5888, 5888, 3328, 3328]
    - [12, 11876.0]
  - - [5124, 9124, 1, 1760, 5124, 5124, 1760, 1760]
    - [17, 12187.0]
  - - [4288, 448, 1, 1280, 4288, 4288, 1280, 1280]
    - [28, 9581.0]
  - - [5888, 704, 1, 3328, 5888, 5888, 3328, 3328]
    - [30, 11113.0]
  - - [5056, 256, 1, 128, 5056, 5056, 128, 128]
    - [9, 9113.0]
  - - [1408, 5888, 1, 128, 1408, 1408, 128, 128]
    - [44, 11156.0]
  - - [7680, 12000, 1, 2560, 7680, 7680, 2560, 2560]
    - [6, 12454.0]
  - - [1408, 1024, 1, 256, 1408, 1408, 256, 256]
    - [9, 9154.0]
  - - [8192, 400, 1, 2048, 8192, 8192, 2048, 2048]
    - [12, 9215.0]
  - - [1024, 1856, 1, 128, 1024, 1024, 128, 128]
    - [7, 8859.0]
  - - [5056, 6784, 1, 1280, 5056, 5056, 1280, 1280]
    - [20, 12031.0]
  - - [704, 5056, 1, 3328, 704, 704, 3328, 3328]
    - [49, 11098.0]
  - - [2368, 2944, 1, 3328, 2368, 2368, 3328, 3328]
    - [47, 11704.0]
  - - [2368, 3584, 1, 256, 2368, 2368, 256, 256]
    - [12, 11053.0]
  - - [5056, 3584, 1, 1280, 5056, 5056, 1280, 1280]
    - [22, 12171.0]
  - - [5124, 9124, 1, 4096, 5124, 5124, 4096, 4096]
    - [30, 11993.0]
  - - [7680, 48000, 1, 2560, 7680, 7680, 2560, 2560]
    - [6, 12491.0]
  - - [1856, 2944, 1, 1280, 1856, 1856, 1280, 1280]
    - [47, 11161.0]
  - - [1024, 48000, 1, 2816, 1024, 1024, 2816, 2816]
    - [6, 12374.0]
  - - [2944, 1408, 1, 256, 2944, 2944, 256, 256]
    - [20, 10933.0]
  - - [4288, 1408, 1, 3328, 4288, 4288, 3328, 3328]
    - [47, 11761.0]
  - - [5888, 2944, 1, 128, 5888, 5888, 128, 128]
    - [20, 11484.0]
  - - [2944, 1024, 1, 128, 2944, 2944, 128, 128]
    - [18, 9997.0]
  - - [4288, 5056, 1, 1280, 4288, 4288, 1280, 1280]
    - [30, 12035.0]
  - - [5888, 6784, 1, 1280, 5888, 5888, 1280, 1280]
    - [47, 12238.0]
  - - [6784, 5056, 1, 128, 6784, 6784, 128, 128]
    - [4, 11509.0]
  - - [1760, 1600, 1, 1760, 1760, 1760, 1760, 1760]
    - [35, 10549.0]
  - - [5888, 1408, 1, 3328, 5888, 5888, 3328, 3328]
    - [12, 11896.0]
  - - [2368, 1856, 1, 256, 2368, 2368, 256, 256]
    - [20, 10062.0]
  - - [256, 5056, 1, 256, 256, 256, 256, 256]
    - [45, 9885.0]
  - - [448, 3584, 1, 3328, 448, 448, 3328, 3328]
    - [22, 9849.0]
  - - [704, 2368, 1, 128, 704, 704, 128, 128]
    - [26, 8481.0]
  - - [5888, 256, 1, 128, 5888, 5888, 128, 128]
    - [26, 9170.0]
  - - [3584, 1856, 1, 128, 3584, 3584, 128, 128]
    - [12, 10463.0]
  - - [4288, 4288, 1, 128, 4288, 4288, 128, 128]
    - [35, 11222.0]
  - - [1856, 1024, 1, 3328, 1856, 1856, 3328, 3328]
    - [14, 11611.0]
  - - [1024, 5056, 1, 256, 1024, 1024, 256, 256]
    - [20, 10867.0]
  - - [5888, 5888, 1, 1280, 5888, 5888, 1280, 1280]
    - [22, 12420.0]
  - - [5056, 5888, 1, 128, 5056, 5056, 128, 128]
    - [4, 11358.0]
  - - [2368, 1408, 1, 3328, 2368, 2368, 3328, 3328]
    - [28, 11089.0]
  - - [1024, 48000, 1, 1536, 1024, 1024, 1536, 1536]
    - [14, 12305.0]
  - - [5888, 448, 1, 256, 5888, 5888, 256, 256]
    - [11, 9052.0]
  - - [2560, 3200, 1, 2560, 2560, 2560, 2560, 2560]
    - [28, 12137.0]
  - - [5888, 6784, 1, 128, 5888, 5888, 128, 128]
    - [4, 11759.0]
  - - [6144, 48000, 1, 2048, 6144, 6144, 2048, 2048]
    - [14, 12451.0]
  - - [6784, 5056, 1, 1280, 6784, 6784, 1280, 1280]
    - [6, 12121.0]
  - - [5056, 704, 1, 1280, 5056, 5056, 1280, 1280]
    - [12, 10649.0]
  - - [1024, 48000, 1, 2560, 1024, 1024, 2560, 2560]
    - [14, 12343.0]
  - - [1024, 2368, 1, 128, 1024, 1024, 128, 128]
    - [26, 9150.0]
  - - [16384, 800, 1, 4096, 16384, 16384, 4096, 4096]
    - [47, 10457.0]
  - - [5888, 5056, 1, 1280, 5888, 5888, 1280, 1280]
    - [6, 12213.0]
  - - [3072, 48000, 1, 1024, 3072, 3072, 1024, 1024]
    - [30, 12326.0]
  - - [6784, 1408, 1, 256, 6784, 6784, 256, 256]
    - [38, 11477.0]
  - - [3584, 5888, 1, 128, 3584, 3584, 128, 128]
    - [38, 11553.0]
  - - [5056, 5888, 1, 256, 5056, 5056, 256, 256]
    - [20, 11743.0]
  - - [2368, 1024, 1, 256, 2368, 2368, 256, 256]
    - [26, 9763.0]
  - - [2944, 1856, 1, 256, 2944, 2944, 256, 256]
    - [20, 10742.0]
  - - [1856, 6784, 1, 1280, 1856, 1856, 1280, 1280]
    - [47, 11625.0]
  - - [4288, 3584, 1, 256, 4288, 4288, 256, 256]
    - [20, 11498.0]
  - - [6784, 448, 1, 3328, 6784, 6784, 3328, 3328]
    - [28, 10056.0]
  - - [5056, 1856, 1, 1280, 5056, 5056, 1280, 1280]
    - [28, 11495.0]
  - - [1408, 1024, 1, 3328, 1408, 1408, 3328, 3328]
    - [28, 10166.0]
  - - [5888, 3584, 1, 1280, 5888, 5888, 1280, 1280]
    - [14, 12155.0]
  - - [1856, 3584, 1, 3328, 1856, 1856, 3328, 3328]
    - [47, 11642.0]
  - - [1024, 2944, 1, 256, 1024, 1024, 256, 256]
    - [12, 10099.0]
  - - [448, 6784, 1, 1280, 448, 448, 1280, 1280]
    - [28, 9951.0]
  - - [704, 5056, 1, 256, 704, 704, 256, 256]
    - [26, 9896.0]
  - - [3584, 1024, 1, 3328, 3584, 3584, 3328, 3328]
    - [47, 11258.0]
  - - [2944, 1856, 1, 1280, 2944, 2944, 1280, 1280]
    - [12, 11156.0]
  - - [5056, 256, 1, 256, 5056, 5056, 256, 256]
    - [9, 10170.0]
  - - [2944, 4288, 1, 3328, 2944, 2944, 3328, 3328]
    - [30, 12017.0]
  - - [2368, 3584, 1, 3328, 2368, 2368, 3328, 3328]
    - [12, 11658.0]
  - - [2944, 704, 1, 1280, 2944, 2944, 1280, 1280]
    - [47, 10328.0]
  - - [2944, 3584, 1, 1280, 2944, 2944, 1280, 1280]
    - [12, 11931.0]
  - - [1856, 5888, 1, 1280, 1856, 1856, 1280, 1280]
    - [47, 11625.0]
  - - [2048, 3200, 1, 2048, 2048, 2048, 2048, 2048]
    - [12, 12093.0]
  - - [4288, 1408, 1, 256, 4288, 4288, 256, 256]
    - [28, 11137.0]
  - - [5888, 1408, 1, 128, 5888, 5888, 128, 128]
    - [38, 11156.0]
  - - [4288, 2368, 1, 1280, 4288, 4288, 1280, 1280]
    - [12, 11471.0]
  - - [6784, 2368, 1, 256, 6784, 6784, 256, 256]
    - [20, 11475.0]
  - - [1024, 24000, 1, 2816, 1024, 1024, 2816, 2816]
    - [6, 12322.0]
  - - [7680, 5984, 1, 2560, 7680, 7680, 2560, 2560]
    - [28, 12243.0]
  - - [4288, 1856, 1, 256, 4288, 4288, 256, 256]
    - [20, 10853.0]
  - - [1856, 2944, 1, 256, 1856, 1856, 256, 256]
    - [38, 10658.0]
  - - [5056, 1024, 1, 128, 5056, 5056, 128, 128]
    - [26, 10682.0]
  - - [1760, 800, 1, 1760, 1760, 1760, 1760, 1760]
    - [35, 10081.0]
  - - [6784, 256, 1, 128, 6784, 6784, 128, 128]
    - [18, 9156.0]
  - - [5888, 704, 1, 128, 5888, 5888, 128, 128]
    - [38, 9581.0]
  - - [1408, 2368, 1, 128, 1408, 1408, 128, 128]
    - [18, 9906.0]
  - - [1024, 4288, 1, 1280, 1024, 1024, 1280, 1280]
    - [14, 11457.0]
  - - [2368, 5056, 1, 3328, 2368, 2368, 3328, 3328]
    - [28, 11688.0]
  - - [4288, 1024, 1, 3328, 4288, 4288, 3328, 3328]
    - [28, 11538.0]
  - - [6144, 48000, 1, 2560, 6144, 6144, 2560, 2560]
    - [6, 12490.0]
  - - [1024, 5056, 1, 3328, 1024, 1024, 3328, 3328]
    - [30, 12098.0]
  - - [1024, 1856, 1, 3328, 1024, 1024, 3328, 3328]
    - [28, 11225.0]
  - - [4288, 6784, 1, 256, 4288, 4288, 256, 256]
    - [12, 11739.0]
  - - [3584, 2944, 1, 3328, 3584, 3584, 3328, 3328]
    - [12, 11967.0]
  - - [5888, 2944, 1, 256, 5888, 5888, 256, 256]
    - [20, 11917.0]
  - - [448, 4288, 1, 1280, 448, 448, 1280, 1280]
    - [47, 9628.0]
  - - [1024, 4288, 1, 128, 1024, 1024, 128, 128]
    - [20, 9785.0]
  - - [5056, 4288, 1, 256, 5056, 5056, 256, 256]
    - [12, 11560.0]
  - - [1024, 3584, 1, 256, 1024, 1024, 256, 256]
    - [12, 10483.0]
  - - [6784, 6784, 1, 3328, 6784, 6784, 3328, 3328]
    - [20, 12288.0]
  - - [448, 5888, 1, 1280, 448, 448, 1280, 1280]
    - [14, 9658.0]
  - - [5056, 448, 1, 128, 5056, 5056, 128, 128]
    - [43, 9117.0]
  - - [4288, 704, 1, 1280, 4288, 4288, 1280, 1280]
    - [12, 9997.0]
  - - [3584, 2944, 1, 128, 3584, 3584, 128, 128]
    - [28, 11189.0]
  - - [6784, 256, 1, 1280, 6784, 6784, 1280, 1280]
    - [28, 10239.0]
  - - [2368, 5888, 1, 3328, 2368, 2368, 3328, 3328]
    - [30, 12060.0]
  - - [2368, 1856, 1, 1280, 2368, 2368, 1280, 1280]
    - [12, 10715.0]
  - - [448, 5056, 1, 3328, 448, 448, 3328, 3328]
    - [30, 10526.0]
  - - [3584, 4288, 1, 128, 3584, 3584, 128, 128]
    - [28, 11072.0]
  - - [5888, 4288, 1, 3328, 5888, 5888, 3328, 3328]
    - [40, 12092.0]
  - - [2368, 704, 1, 256, 2368, 2368, 256, 256]
    - [26, 8810.0]
  - - [3584, 1408, 1, 128, 3584, 3584, 128, 128]
    - [20, 10687.0]
  - - [1856, 5056, 1, 1280, 1856, 1856, 1280, 1280]
    - [28, 11591.0]
  - - [2944, 1024, 1, 1280, 2944, 2944, 1280, 1280]
    - [30, 11122.0]
  - - [3584, 5888, 1, 3328, 3584, 3584, 3328, 3328]
    - [6, 12240.0]
  - - [2368, 4288, 1, 256, 2368, 2368, 256, 256]
    - [12, 11016.0]
  - - [1024, 2368, 1, 3328, 1024, 1024, 3328, 3328]
    - [14, 11226.0]
  - - [1024, 3584, 1, 1280, 1024, 1024, 1280, 1280]
    - [14, 11261.0]
  - - [4288, 5888, 1, 3328, 4288, 4288, 3328, 3328]
    - [49, 12077.0]
  - - [1024, 2944, 1, 3328, 1024, 1024, 3328, 3328]
    - [30, 11219.0]
  - - [6784, 1856, 1, 256, 6784, 6784, 256, 256]
    - [12, 11321.0]
  - - [256, 6784, 1, 1280, 256, 256, 1280, 1280]
    - [14, 10283.0]
  - - [1856, 3584, 1, 256, 1856, 1856, 256, 256]
    - [28, 11049.0]
  - - [6784, 1856, 1, 128, 6784, 6784, 128, 128]
    - [38, 10955.0]
  - - [512, 24000, 1, 2816, 512, 512, 2816, 2816]
    - [30, 12238.0]
  - - [256, 5888, 1, 1280, 256, 256, 1280, 1280]
    - [12, 10384.0]
  - - [16384, 1600, 1, 4096, 16384, 16384, 4096, 4096]
    - [47, 11342.0]
  - - [2368, 1408, 1, 128, 2368, 2368, 128, 128]
    - [18, 9664.0]
  - - [1408, 1024, 1, 128, 1408, 1408, 128, 128]
    - [36, 9038.0]
  - - [6784, 3584, 1, 3328, 6784, 6784, 3328, 3328]
    - [14, 12233.0]
  - - [1760, 7000, 1, 1760, 1760, 1760, 1760, 1760]
    - [17, 12105.0]
  - - [2368, 5056, 1, 1280, 2368, 2368, 1280, 1280]
    - [28, 11653.0]
  - - [1408, 2368, 1, 1280, 1408, 1408, 1280, 1280]
    - [28, 10961.0]
  - - [704, 4288, 1, 128, 704, 704, 128, 128]
    - [26, 8953.0]
  - - [2944, 2944, 1, 256, 2944, 2944, 256, 256]
    - [20, 11629.0]
  - - [6784, 256, 1, 256, 6784, 6784, 256, 256]
    - [47, 9632.0]
  - - [256, 5056, 1, 3328, 256, 256, 3328, 3328]
    - [30, 11519.0]
  - - [5056, 1856, 1, 128, 5056, 5056, 128, 128]
    - [35, 10529.0]
  - - [5056, 1024, 1, 3328, 5056, 5056, 3328, 3328]
    - [14, 11904.0]
  - - [4288, 3584, 1, 3328, 4288, 4288, 3328, 3328]
    - [49, 12126.0]
  - - [1024, 2368, 1, 1280, 1024, 1024, 1280, 1280]
    - [30, 10680.0]
  - - [5888, 6784, 1, 3328, 5888, 5888, 3328, 3328]
    - [12, 12294.0]
  - - [704, 4288, 1, 1280, 704, 704, 1280, 1280]
    - [47, 9908.0]
  - - [1024, 48000, 1, 2048, 1024, 1024, 2048, 2048]
    - [30, 12306.0]
  - - [4288, 1024, 1, 128, 4288, 4288, 128, 128]
    - [9, 10271.0]
  - - [4096, 512, 1, 32, 4096, 4096, 32, 32]
    - [43, 5897.0]
  - - [2048, 1024, 1, 1664, 2048, 2048, 1664, 1664]
    - [4, 10770.0]
  - - [4096, 512, 1, 1408, 4096, 4096, 1408, 1408]
    - [25, 10838.0]
  - - [4096, 1024, 1, 1280, 4096, 4096, 1280, 1280]
    - [28, 11774.0]
  - - [2048, 1024, 1, 640, 2048, 2048, 640, 640]
    - [25, 10622.0]
  - - [4096, 1024, 1, 13312, 4096, 4096, 13312, 13312]
    - [47, 11158.0]
  - - [2048, 1024, 1, 13312, 2048, 2048, 13312, 13312]
    - [47, 10319.0]
  - - [2048, 1024, 1, 3584, 2048, 2048, 3584, 3584]
    - [12, 10785.0]
  - - [4096, 1024, 1, 1920, 4096, 4096, 1920, 1920]
    - [20, 11855.0]
  - - [4096, 1024, 1, 12288, 4096, 4096, 12288, 12288]
    - [47, 10683.0]
  - - [4096, 1024, 1, 8320, 4096, 4096, 8320, 8320]
    - [20, 11898.0]
  - - [4096, 1024, 1, 15360, 4096, 4096, 15360, 15360]
    - [47, 10863.0]
  - - [4096, 512, 1, 3072, 4096, 4096, 3072, 3072]
    - [12, 10786.0]
  - - [4096, 512, 1, 13312, 4096, 4096, 13312, 13312]
    - [28, 9599.0]
  - - [4096, 1024, 1, 3840, 4096, 4096, 3840, 3840]
    - [28, 11832.0]
  - - [2048, 1024, 1, 3200, 2048, 2048, 3200, 3200]
    - [4, 10820.0]
  - - [4096, 512, 1, 3840, 4096, 4096, 3840, 3840]
    - [28, 10823.0]
  - - [4096, 512, 1, 5632, 4096, 4096, 5632, 5632]
    - [12, 10819.0]
  - - [4096, 512, 1, 64, 4096, 4096, 64, 64]
    - [24, 8125.0]
  - - [2048, 1024, 1, 512, 2048, 2048, 512, 512]
    - [12, 10417.0]
  - - [4096, 512, 1, 8192, 4096, 4096, 8192, 8192]
    - [50, 9040.0]
  - - [4096, 512, 1, 2304, 4096, 4096, 2304, 2304]
    - [28, 10757.0]
  - - [4096, 512, 1, 2816, 4096, 4096, 2816, 2816]
    - [12, 10812.0]
  - - [2048, 1024, 1, 7680, 2048, 2048, 7680, 7680]
    - [12, 10665.0]
  - - [4096, 512, 1, 1920, 4096, 4096, 1920, 1920]
    - [25, 10760.0]
  - - [4096, 1024, 1, 32, 4096, 4096, 32, 32]
    - [7, 6560.0]
  - - [4096, 512, 1, 16640, 4096, 4096, 16640, 16640]
    - [28, 10830.0]
  - - [2048, 1024, 1, 1024, 2048, 2048, 1024, 1024]
    - [28, 10495.0]
  - - [4096, 512, 1, 1792, 4096, 4096, 1792, 1792]
    - [47, 10756.0]
  - - [4096, 1024, 1, 8192, 4096, 4096, 8192, 8192]
    - [49, 9929.0]
  - - [2048, 1024, 1, 4160, 2048, 2048, 4160, 4160]
    - [17, 11107.0]
  - - [4096, 512, 1, 10240, 4096, 4096, 10240, 10240]
    - [47, 9967.0]
  - - [4096, 512, 1, 512, 4096, 4096, 512, 512]
    - [47, 10170.0]
  - - [2048, 1024, 1, 6656, 2048, 2048, 6656, 6656]
    - [12, 10849.0]
  - - [2048, 1024, 1, 14336, 2048, 2048, 14336, 14336]
    - [47, 10283.0]
  - - [4096, 512, 1, 11264, 4096, 4096, 11264, 11264]
    - [28, 9926.0]
  - - [4096, 512, 1, 128, 4096, 4096, 128, 128]
    - [18, 9218.0]
  - - [4096, 512, 1, 768, 4096, 4096, 768, 768]
    - [47, 10605.0]
  - - [4096, 1024, 1, 11264, 4096, 4096, 11264, 11264]
    - [47, 11132.0]
  - - [4096, 1024, 1, 16640, 4096, 4096, 16640, 16640]
    - [47, 11856.0]
  - - [2048, 1024, 1, 5632, 2048, 2048, 5632, 5632]
    - [12, 10825.0]
  - - [4096, 512, 1, 12288, 4096, 4096, 12288, 12288]
    - [28, 9385.0]
  - - [4096, 1024, 1, 5632, 4096, 4096, 5632, 5632]
    - [12, 11830.0]
  - - [2048, 1024, 1, 10240, 2048, 2048, 10240, 10240]
    - [12, 10496.0]
  - - [4096, 1024, 1, 640, 4096, 4096, 640, 640]
    - [25, 11607.0]
  - - [2048, 1024, 1, 12288, 2048, 2048, 12288, 12288]
    - [47, 9771.0]
  - - [4096, 1024, 1, 10240, 4096, 4096, 10240, 10240]
    - [47, 10926.0]
  - - [2048, 1024, 1, 4608, 2048, 2048, 4608, 4608]
    - [12, 10797.0]
  - - [4096, 512, 1, 3584, 4096, 4096, 3584, 3584]
    - [12, 10801.0]
  - - [4096, 1024, 1, 4608, 4096, 4096, 4608, 4608]
    - [12, 11805.0]
  - - [4096, 1024, 1, 3328, 4096, 4096, 3328, 3328]
    - [28, 11818.0]
  - - [2048, 1024, 1, 9216, 2048, 2048, 9216, 9216]
    - [12, 10621.0]
  - - [2048, 1024, 1, 2304, 2048, 2048, 2304, 2304]
    - [12, 10729.0]
  - - [4096, 512, 1, 6144, 4096, 4096, 6144, 6144]
    - [12, 10574.0]
  - - [4096, 512, 1, 15360, 4096, 4096, 15360, 15360]
    - [47, 9423.0]
  - - [4096, 1024, 1, 7168, 4096, 4096, 7168, 7168]
    - [12, 10752.0]
  - - [4096, 1024, 1, 9216, 4096, 4096, 9216, 9216]
    - [49, 10826.0]
  - - [4096, 1024, 1, 7680, 4096, 4096, 7680, 7680]
    - [47, 11503.0]
  - - [2048, 1024, 1, 8192, 2048, 2048, 8192, 8192]
    - [12, 9406.0]
  - - [4096, 1024, 1, 64, 4096, 4096, 64, 64]
    - [2, 9156.0]
  - - [2048, 1024, 1, 1280, 2048, 2048, 1280, 1280]
    - [12, 10684.0]
  - - [2048, 1024, 1, 3328, 2048, 2048, 3328, 3328]
    - [12, 10832.0]
  - - [4096, 512, 1, 14336, 4096, 4096, 14336, 14336]
    - [47, 10075.0]
  - - [4096, 512, 1, 8320, 4096, 4096, 8320, 8320]
    - [28, 10858.0]
  - - [4096, 1024, 1, 6656, 4096, 4096, 6656, 6656]
    - [12, 11813.0]
  - - [2048, 1024, 1, 256, 2048, 2048, 256, 256]
    - [9, 9761.0]
  - - [4096, 512, 1, 1024, 4096, 4096, 1024, 1024]
    - [12, 10617.0]
  - - [4096, 1024, 1, 1536, 4096, 4096, 1536, 1536]
    - [28, 11797.0]
  - - [2048, 1024, 1, 32, 2048, 2048, 32, 32]
    - [43, 5678.0]
  - - [4096, 512, 1, 640, 4096, 4096, 640, 640]
    - [44, 10649.0]
  - - [4096, 512, 1, 16384, 4096, 4096, 16384, 16384]
    - [32, 9161.0]
  - - [4096, 1024, 1, 512, 4096, 4096, 512, 512]
    - [28, 11379.0]
  - - [2048, 1024, 1, 1152, 2048, 2048, 1152, 1152]
    - [20, 10715.0]
  - - [4096, 1024, 1, 2080, 4096, 4096, 2080, 2080]
    - [17, 12141.0]
  - - [4096, 1024, 1, 768, 4096, 4096, 768, 768]
    - [28, 11656.0]
  - - [4096, 1024, 1, 2560, 4096, 4096, 2560, 2560]
    - [12, 11798.0]
  - - [2048, 1024, 1, 64, 2048, 2048, 64, 64]
    - [0, 8410.0]
  - - [4096, 1024, 1, 16384, 4096, 4096, 16384, 16384]
    - [41, 9976.0]
  - - [4096, 512, 1, 6656, 4096, 4096, 6656, 6656]
    - [12, 10824.0]
  - - [2048, 1024, 1, 128, 2048, 2048, 128, 128]
    - [9, 9032.0]
  - - [2048, 1024, 1, 2080, 2048, 2048, 2080, 2080]
    - [17, 11102.0]
  - - [2048, 1024, 1, 16640, 2048, 2048, 16640, 16640]
    - [47, 10819.0]
  - - [2048, 1024, 1, 3072, 2048, 2048, 3072, 3072]
    - [12, 10746.0]
  - - [4096, 1024, 1, 1408, 4096, 4096, 1408, 1408]
    - [25, 11784.0]
  - - [4096, 1024, 1, 2048, 4096, 4096, 2048, 2048]
    - [12, 11781.0]
  - - [2048, 1024, 1, 2560, 2048, 2048, 2560, 2560]
    - [12, 10772.0]
  - - [4096, 1024, 1, 128, 4096, 4096, 128, 128]
    - [12, 10453.0]
  - - [4096, 1024, 1, 14336, 4096, 4096, 14336, 14336]
    - [47, 11165.0]
  - - [4096, 512, 1, 9216, 4096, 4096, 9216, 9216]
    - [28, 9872.0]
  - - [2048, 1024, 1, 2048, 2048, 2048, 2048, 2048]
    - [12, 10677.0]
  - - [4096, 512, 1, 1536, 4096, 4096, 1536, 1536]
    - [12, 10724.0]
  - - [2048, 1024, 1, 16384, 2048, 2048, 16384, 16384]
    - [50, 9196.0]
  - - [4096, 1024, 1, 1024, 4096, 4096, 1024, 1024]
    - [12, 11611.0]
  - - [4096, 1024, 1, 1664, 4096, 4096, 1664, 1664]
    - [25, 11876.0]
  - - [4096, 512, 1, 384, 4096, 4096, 384, 384]
    - [44, 10388.0]
  - - [4096, 512, 1, 3328, 4096, 4096, 3328, 3328]
    - [47, 10799.0]
  - - [4096, 1024, 1, 256, 4096, 4096, 256, 256]
    - [28, 11215.0]
  - - [2048, 1024, 1, 7168, 2048, 2048, 7168, 7168]
    - [12, 10830.0]
  - - [2048, 1024, 1, 1536, 2048, 2048, 1536, 1536]
    - [12, 10616.0]
  - - [4096, 512, 1, 7168, 4096, 4096, 7168, 7168]
    - [12, 10479.0]
  - - [4096, 1024, 1, 896, 4096, 4096, 896, 896]
    - [25, 11784.0]
  - - [4096, 1024, 1, 4096, 4096, 4096, 4096, 4096]
    - [12, 11639.0]
  - - [2048, 1024, 1, 6144, 2048, 2048, 6144, 6144]
    - [12, 10841.0]
  - - [4096, 512, 1, 4160, 4096, 4096, 4160, 4160]
    - [35, 11070.0]
  - - [4096, 512, 1, 2080, 4096, 4096, 2080, 2080]
    - [35, 11065.0]
  - - [4096, 1024, 1, 5120, 4096, 4096, 5120, 5120]
    - [12, 11722.0]
  - - [2048, 1024, 1, 1920, 2048, 2048, 1920, 1920]
    - [20, 10723.0]
  - - [2048, 1024, 1, 15360, 2048, 2048, 15360, 15360]
    - [47, 9602.0]
  - - [4096, 1024, 1, 2816, 4096, 4096, 2816, 2816]
    - [12, 11828.0]
  - - [4096, 512, 1, 256, 4096, 4096, 256, 256]
    - [28, 9898.0]
  - - [2048, 1024, 1, 5120, 2048, 2048, 5120, 5120]
    - [12, 10822.0]
  - - [2048, 1024, 1, 4096, 2048, 2048, 4096, 4096]
    - [12, 10741.0]
  - - [4096, 512, 1, 4608, 4096, 4096, 4608, 4608]
    - [12, 10821.0]
  - - [4096, 512, 1, 1664, 4096, 4096, 1664, 1664]
    - [25, 10793.0]
  - - [2048, 1024, 1, 896, 2048, 2048, 896, 896]
    - [25, 10713.0]
  - - [4096, 1024, 1, 4160, 4096, 4096, 4160, 4160]
    - [17, 12131.0]
  - - [2048, 1024, 1, 11264, 2048, 2048, 11264, 11264]
    - [47, 10365.0]
  - - [2048, 1024, 1, 384, 2048, 2048, 384, 384]
    - [26, 10109.0]
  - - [2048, 1024, 1, 3840, 2048, 2048, 3840, 3840]
    - [28, 10830.0]
  - - [4096, 512, 1, 1280, 4096, 4096, 1280, 1280]
    - [47, 10707.0]
  - - [4096, 1024, 1, 1152, 4096, 4096, 1152, 1152]
    - [25, 11854.0]
  - - [2048, 1024, 1, 1408, 2048, 2048, 1408, 1408]
    - [20, 10728.0]
  - - [4096, 512, 1, 896, 4096, 4096, 896, 896]
    - [44, 10726.0]
  - - [4096, 1024, 1, 3072, 4096, 4096, 3072, 3072]
    - [12, 11811.0]
  - - [2048, 1024, 1, 2816, 2048, 2048, 2816, 2816]
    - [28, 10778.0]
  - - [4096, 1024, 1, 1792, 4096, 4096, 1792, 1792]
    - [28, 11805.0]
  - - [4096, 512, 1, 1152, 4096, 4096, 1152, 1152]
    - [44, 10808.0]
  - - [4096, 512, 1, 7680, 4096, 4096, 7680, 7680]
    - [28, 10556.0]
  - - [4096, 1024, 1, 384, 4096, 4096, 384, 384]
    - [25, 11323.0]
  - - [2048, 1024, 1, 1792, 2048, 2048, 1792, 1792]
    - [12, 10739.0]
  - - [4096, 1024, 1, 3584, 4096, 4096, 3584, 3584]
    - [12, 11835.0]
  - - [2048, 1024, 1, 768, 2048, 2048, 768, 768]
    - [28, 10435.0]
  - - [2048, 1024, 1, 8320, 2048, 2048, 8320, 8320]
    - [20, 10860.0]
  - - [4096, 512, 1, 2048, 4096, 4096, 2048, 2048]
    - [12, 10687.0]
  - - [4096, 512, 1, 2560, 4096, 4096, 2560, 2560]
    - [28, 10807.0]
  - - [4096, 1024, 1, 2304, 4096, 4096, 2304, 2304]
    - [12, 11812.0]
  - - [4096, 512, 1, 5120, 4096, 4096, 5120, 5120]
    - [12, 10714.0]
  - - [4096, 1024, 1, 6144, 4096, 4096, 6144, 6144]
    - [12, 11577.0]
  - - [1024, 3392, 1, 4096, 1024, 1024, 4096, 4096]
    - [30, 10841.0]
  - - [1024, 3301, 1, 4096, 1024, 1024, 4096, 4096]
    - [28, 10482.0]
  - - [1024, 3443, 1, 4096, 1024, 1024, 4096, 4096]
    - [30, 10984.0]
  - - [132, 134, 480, 64, 132, 132, 64, 64]
    - [7, 3878.0]
  - - [162, 162, 400, 64, 162, 162, 64, 64]
    - [34, 5451.0]
  - - [4096, 3548, 1, 1024, 4096, 4096, 1024, 1024]
    - [12, 11961.0]
  - - [4096, 2977, 1, 1024, 4096, 4096, 1024, 1024]
    - [12, 11610.0]
  - - [132, 135, 480, 64, 132, 132, 64, 64]
    - [16, 3906.0]
  - - [1024, 2985, 1, 4096, 1024, 1024, 4096, 4096]
    - [30, 11407.0]
  - - [33708, 3681, 1, 1024, 33708, 33708, 1024, 1024]
    - [47, 12127.0]
  - - [4096, 3443, 1, 1024, 4096, 4096, 1024, 1024]
    - [12, 11917.0]
  - - [1024, 3400, 1, 4096, 1024, 1024, 4096, 4096]
    - [30, 10890.0]
  - - [4096, 3995, 1, 1024, 4096, 4096, 1024, 1024]
    - [14, 11790.0]
  - - [4096, 3190, 1, 1024, 4096, 4096, 1024, 1024]
    - [12, 12067.0]
  - - [4096, 3594, 1, 1024, 4096, 4096, 1024, 1024]
    - [12, 11678.0]
  - - [159, 162, 400, 64, 159, 159, 64, 64]
    - [16, 5395.0]
  - - [1024, 3565, 1, 4096, 1024, 1024, 4096, 4096]
    - [30, 11270.0]
  - - [4096, 3422, 1, 1024, 4096, 4096, 1024, 1024]
    - [12, 11844.0]
  - - [1024, 3214, 1, 4096, 1024, 1024, 4096, 4096]
    - [28, 10235.0]
  - - [33708, 3584, 1, 1024, 33708, 33708, 1024, 1024]
    - [49, 12339.0]
  - - [33708, 3640, 1, 1024, 33708, 33708, 1024, 1024]
    - [47, 11988.0]
  - - [4096, 3263, 1, 1024, 4096, 4096, 1024, 1024]
    - [14, 11823.0]
  - - [4096, 3296, 1, 1024, 4096, 4096, 1024, 1024]
    - [14, 11950.0]
  - - [1024, 3557, 1, 4096, 1024, 1024, 4096, 4096]
    - [30, 11343.0]
  - - [4096, 3463, 1, 1024, 4096, 4096, 1024, 1024]
    - [12, 11697.0]
  - - [4096, 3528, 1, 1024, 4096, 4096, 1024, 1024]
    - [12, 11906.0]
  - - [4096, 3226, 1, 1024, 4096, 4096, 1024, 1024]
    - [14, 11675.0]
  - - [4096, 3439, 1, 1024, 4096, 4096, 1024, 1024]
    - [12, 11913.0]
  - - [1024, 3523, 1, 4096, 1024, 1024, 4096, 4096]
    - [30, 11192.0]
  - - [1024, 3098, 1, 4096, 1024, 1024, 4096, 4096]
    - [12, 10701.0]
  - - [4096, 3121, 1, 1024, 4096, 4096, 1024, 1024]
    - [12, 11796.0]
  - - [33708, 3894, 1, 1024, 33708, 33708, 1024, 1024]
    - [47, 12019.0]
  - - [1024, 3548, 1, 4096, 1024, 1024, 4096, 4096]
    - [14, 11325.0]
  - - [1024, 3451, 1, 4096, 1024, 1024, 4096, 4096]
    - [30, 11046.0]
  - - [4096, 3353, 1, 1024, 4096, 4096, 1024, 1024]
    - [12, 11621.0]
  - - [4096, 3402, 1, 1024, 4096, 4096, 1024, 1024]
    - [12, 11807.0]
  - - [4096, 3939, 1, 1024, 4096, 4096, 1024, 1024]
    - [12, 11999.0]
  - - [133, 133, 480, 64, 133, 133, 64, 64]
    - [24, 3869.0]
  - - [1024, 3559, 1, 4096, 1024, 1024, 4096, 4096]
    - [30, 11294.0]
  - - [1024, 2977, 1, 4096, 1024, 1024, 4096, 4096]
    - [30, 11378.0]
  - - [1024, 3478, 1, 4096, 1024, 1024, 4096, 4096]
    - [30, 11115.0]
  - - [134, 134, 480, 64, 134, 134, 64, 64]
    - [34, 3942.0]
  - - [1024, 3368, 1, 4096, 1024, 1024, 4096, 4096]
    - [14, 10782.0]
  - - [4096, 4012, 1, 1024, 4096, 4096, 1024, 1024]
    - [12, 11768.0]
  - - [4096, 3486, 1, 1024, 4096, 4096, 1024, 1024]
    - [12, 11778.0]
  - - [1024, 3479, 1, 4096, 1024, 1024, 4096, 4096]
    - [30, 11124.0]
  - - [1024, 3505, 1, 4096, 1024, 1024, 4096, 4096]
    - [30, 11227.0]
  - - [4096, 3381, 1, 1024, 4096, 4096, 1024, 1024]
    - [12, 11729.0]
  - - [4096, 3430, 1, 1024, 4096, 4096, 1024, 1024]
    - [12, 11875.0]
  - - [1024, 3554, 1, 4096, 1024, 1024, 4096, 4096]
    - [14, 11250.0]
  - - [4096, 3271, 1, 1024, 4096, 4096, 1024, 1024]
    - [12, 11832.0]
  - - [1024, 3063, 1, 4096, 1024, 1024, 4096, 4096]
    - [30, 11650.0]
  - - [1024, 3209, 1, 4096, 1024, 1024, 4096, 4096]
    - [12, 10308.0]
  - - [4096, 3503, 1, 1024, 4096, 4096, 1024, 1024]
    - [12, 11822.0]
  - - [4096, 3344, 1, 1024, 4096, 4096, 1024, 1024]
    - [12, 11587.0]
  - - [1024, 3147, 1, 4096, 1024, 1024, 4096, 4096]
    - [28, 11263.0]
  - - [1024, 3322, 1, 4096, 1024, 1024, 4096, 4096]
    - [28, 10495.0]
  - - [1024, 3341, 1, 4096, 1024, 1024, 4096, 4096]
    - [14, 10728.0]
  - - [1024, 3516, 1, 4096, 1024, 1024, 4096, 4096]
    - [30, 11254.0]
  - - [1024, 3454, 1, 4096, 1024, 1024, 4096, 4096]
    - [14, 11048.0]
  - - [4096, 3969, 1, 1024, 4096, 4096, 1024, 1024]
    - [14, 11705.0]
  - - [4096, 3466, 1, 1024, 4096, 4096, 1024, 1024]
    - [12, 11703.0]
  - - [1024, 3999, 1, 1024, 1024, 1024, 1024, 1024]
    - [28, 11323.0]
  - - [1024, 4032, 1, 1024, 1024, 1024, 1024, 1024]
    - [28, 11451.0]
  - - [1024, 3403, 1, 4096, 1024, 1024, 4096, 4096]
    - [14, 10881.0]
  - - [4096, 3361, 1, 1024, 4096, 4096, 1024, 1024]
    - [12, 11635.0]
  - - [1024, 3527, 1, 4096, 1024, 1024, 4096, 4096]
    - [30, 11264.0]
  - - [1024, 3822, 1, 4096, 1024, 1024, 4096, 4096]
    - [30, 12151.0]
  - - [4096, 3315, 1, 1024, 4096, 4096, 1024, 1024]
    - [14, 11987.0]
  - - [232, 232, 272, 64, 232, 232, 64, 64]
    - [19, 6643.0]
  - - [1024, 3336, 1, 4096, 1024, 1024, 4096, 4096]
    - [30, 10692.0]
  - - [228, 232, 272, 64, 228, 228, 64, 64]
    - [37, 6394.0]
  - - [4096, 3547, 1, 1024, 4096, 4096, 1024, 1024]
    - [12, 11959.0]
  - - [4096, 3340, 1, 1024, 4096, 4096, 1024, 1024]
    - [12, 11596.0]
  - - [1024, 3906, 1, 1024, 1024, 1024, 1024, 1024]
    - [28, 11082.0]
  - - [1024, 3295, 1, 4096, 1024, 1024, 4096, 4096]
    - [28, 10630.0]
  - - [4096, 3294, 1, 1024, 4096, 4096, 1024, 1024]
    - [12, 10219.0]
  - - [33708, 3968, 1, 1024, 33708, 33708, 1024, 1024]
    - [47, 10909.0]
  - - [1024, 3473, 1, 4096, 1024, 1024, 4096, 4096]
    - [49, 8712.0]
  - - [1024, 3072, 1, 4096, 1024, 1024, 4096, 4096]
    - [30, 10754.0]
  - - [4096, 3189, 1, 1024, 4096, 4096, 1024, 1024]
    - [12, 10324.0]
  - - [4096, 3494, 1, 1024, 4096, 4096, 1024, 1024]
    - [12, 10132.0]
  - - [1024, 3522, 1, 4096, 1024, 1024, 4096, 4096]
    - [32, 8806.0]
  - - [33708, 3944, 1, 1024, 33708, 33708, 1024, 1024]
    - [47, 10803.0]
  - - [135, 135, 480, 64, 135, 135, 64, 64]
    - [16, 3384.0]
  - - [4096, 3421, 1, 1024, 4096, 4096, 1024, 1024]
    - [12, 10304.0]
  - - [4096, 3311, 1, 1024, 4096, 4096, 1024, 1024]
    - [12, 10519.0]
  - - [1024, 3990, 1, 1024, 1024, 1024, 1024, 1024]
    - [28, 10645.0]
  - - [1024, 3290, 1, 4096, 1024, 1024, 4096, 4096]
    - [30, 9175.0]
  - - [4096, 3565, 1, 1024, 4096, 4096, 1024, 1024]
    - [12, 10065.0]
  - - [1024, 3484, 1, 4096, 1024, 1024, 4096, 4096]
    - [30, 8923.0]
  - - [4096, 3384, 1, 1024, 4096, 4096, 1024, 1024]
    - [12, 10096.0]
  - - [1024, 3422, 1, 4096, 1024, 1024, 4096, 4096]
    - [32, 9307.0]
  - - [4096, 3681, 1, 1024, 4096, 4096, 1024, 1024]
    - [12, 9923.0]
  - - [1024, 3584, 1, 1024, 1024, 1024, 1024, 1024]
    - [14, 10593.0]
  - - [4096, 4050, 1, 1024, 4096, 4096, 1024, 1024]
    - [12, 8379.0]
  - - [1024, 3996, 1, 4096, 1024, 1024, 4096, 4096]
    - [50, 7961.0]
  - - [4096, 3169, 1, 1024, 4096, 4096, 1024, 1024]
    - [12, 10353.0]
  - - [4096, 3538, 1, 1024, 4096, 4096, 1024, 1024]
    - [14, 9580.0]
  - - [1024, 3495, 1, 4096, 1024, 1024, 4096, 4096]
    - [49, 8777.0]
  - - [4096, 3401, 1, 1024, 4096, 4096, 1024, 1024]
    - [12, 10233.0]
  - - [1024, 3560, 1, 4096, 1024, 1024, 4096, 4096]
    - [30, 8887.0]
  - - [133, 135, 480, 64, 133, 133, 64, 64]
    - [34, 3625.0]
  - - [1024, 3263, 1, 4096, 1024, 1024, 4096, 4096]
    - [47, 9387.0]
  - - [1024, 3870, 1, 4096, 1024, 1024, 4096, 4096]
    - [50, 8292.0]
  - - [4096, 3555, 1, 1024, 4096, 4096, 1024, 1024]
    - [14, 9595.0]
  - - [4096, 3412, 1, 1024, 4096, 4096, 1024, 1024]
    - [12, 10138.0]
  - - [1024, 3296, 1, 4096, 1024, 1024, 4096, 4096]
    - [28, 9207.0]
  - - [1024, 3379, 1, 4096, 1024, 1024, 4096, 4096]
    - [49, 9379.0]
  - - [4096, 3302, 1, 1024, 4096, 4096, 1024, 1024]
    - [12, 10179.0]
  - - [1024, 3490, 1, 4096, 1024, 1024, 4096, 4096]
    - [30, 8682.0]
  - - [1024, 3428, 1, 4096, 1024, 1024, 4096, 4096]
    - [50, 9104.0]
  - - [1024, 3976, 1, 4096, 1024, 1024, 4096, 4096]
    - [32, 8115.0]
  - - [4096, 3485, 1, 1024, 4096, 4096, 1024, 1024]
    - [12, 10127.0]
  - - [4096, 3534, 1, 1024, 4096, 4096, 1024, 1024]
    - [12, 10077.0]
  - - [1024, 3064, 1, 4096, 1024, 1024, 4096, 4096]
    - [49, 10325.0]
  - - [4096, 3216, 1, 1024, 4096, 4096, 1024, 1024]
    - [12, 10136.0]
  - - [1024, 3450, 1, 4096, 1024, 1024, 4096, 4096]
    - [15, 9597.0]
  - - [1024, 3533, 1, 4096, 1024, 1024, 4096, 4096]
    - [29, 8719.0]
  - - [1024, 4030, 1, 1024, 1024, 1024, 1024, 1024]
    - [28, 10603.0]
  - - [1024, 3311, 1, 4096, 1024, 1024, 4096, 4096]
    - [32, 9232.0]
  - - [1024, 3468, 1, 4096, 1024, 1024, 4096, 4096]
    - [28, 8911.0]
  - - [4096, 3359, 1, 1024, 4096, 4096, 1024, 1024]
    - [12, 10161.0]
  - - [4096, 3392, 1, 1024, 4096, 4096, 1024, 1024]
    - [12, 10265.0]
  - - [1024, 3925, 1, 1024, 1024, 1024, 1024, 1024]
    - [28, 10508.0]
  - - [4096, 3233, 1, 1024, 4096, 4096, 1024, 1024]
    - [12, 10147.0]
  - - [4096, 3956, 1, 1024, 4096, 4096, 1024, 1024]
    - [12, 9022.0]
  - - [1024, 3463, 1, 4096, 1024, 1024, 4096, 4096]
    - [49, 8978.0]
  - - [1024, 3126, 1, 4096, 1024, 1024, 4096, 4096]
    - [47, 9524.0]
  - - [1024, 3363, 1, 4096, 1024, 1024, 4096, 4096]
    - [49, 9394.0]
  - - [4096, 3465, 1, 1024, 4096, 4096, 1024, 1024]
    - [12, 10140.0]
  - - [33708, 3996, 1, 1024, 33708, 33708, 1024, 1024]
    - [49, 10792.0]
  - - [1024, 3231, 1, 4096, 1024, 1024, 4096, 4096]
    - [30, 9549.0]
  - - [33708, 3978, 1, 1024, 33708, 33708, 1024, 1024]
    - [49, 10827.0]
  - - [4096, 3476, 1, 1024, 4096, 4096, 1024, 1024]
    - [12, 10134.0]
  - - [4096, 3339, 1, 1024, 4096, 4096, 1024, 1024]
    - [12, 10096.0]
  - - [4096, 3452, 1, 1024, 4096, 4096, 1024, 1024]
    - [12, 10428.0]
  - - [1024, 3396, 1, 4096, 1024, 1024, 4096, 4096]
    - [30, 9210.0]
  - - [4096, 3293, 1, 1024, 4096, 4096, 1024, 1024]
    - [12, 10156.0]
  - - [1024, 3432, 1, 4096, 1024, 1024, 4096, 4096]
    - [32, 9139.0]
  - - [4096, 3493, 1, 1024, 4096, 4096, 1024, 1024]
    - [12, 9985.0]
  - - [4096, 3350, 1, 1024, 4096, 4096, 1024, 1024]
    - [12, 10153.0]
  - - [1024, 3079, 1, 4096, 1024, 1024, 4096, 4096]
    - [49, 9244.0]
  - - [1024, 3101, 1, 4096, 1024, 1024, 4096, 4096]
    - [32, 9484.0]
  - - [33708, 3939, 1, 1024, 33708, 33708, 1024, 1024]
    - [47, 12085.0]
  - - [4096, 3256, 1, 1024, 4096, 4096, 1024, 1024]
    - [14, 11785.0]
  - - [1024, 3439, 1, 4096, 1024, 1024, 4096, 4096]
    - [14, 11001.0]
  - - [1024, 3510, 1, 4096, 1024, 1024, 4096, 4096]
    - [30, 11222.0]
  - - [4096, 3900, 1, 1024, 4096, 4096, 1024, 1024]
    - [12, 11878.0]
  - - [1024, 3470, 1, 4096, 1024, 1024, 4096, 4096]
    - [30, 11098.0]
  - - [4096, 3456, 1, 1024, 4096, 4096, 1024, 1024]
    - [12, 11931.0]
  - - [4096, 3014, 1, 1024, 4096, 4096, 1024, 1024]
    - [12, 11737.0]
  - - [4096, 3367, 1, 1024, 4096, 4096, 1024, 1024]
    - [12, 11678.0]
  - - [4096, 3432, 1, 1024, 4096, 4096, 1024, 1024]
    - [12, 11880.0]
  - - [33708, 4026, 1, 1024, 33708, 33708, 1024, 1024]
    - [30, 12132.0]
  - - [4096, 3273, 1, 1024, 4096, 4096, 1024, 1024]
    - [14, 11855.0]
  - - [4096, 3130, 1, 1024, 4096, 4096, 1024, 1024]
    - [12, 11858.0]
  - - [1024, 3496, 1, 4096, 1024, 1024, 4096, 4096]
    - [30, 11112.0]
  - - [1024, 3995, 1, 4096, 1024, 1024, 4096, 4096]
    - [14, 11006.0]
  - - [1024, 3939, 1, 4096, 1024, 1024, 4096, 4096]
    - [14, 10843.0]
  - - [1024, 3121, 1, 4096, 1024, 1024, 4096, 4096]
    - [28, 10634.0]
  - - [1024, 3232, 1, 4096, 1024, 1024, 4096, 4096]
    - [12, 10255.0]
  - - [4096, 3147, 1, 1024, 4096, 4096, 1024, 1024]
    - [12, 11909.0]
  - - [4096, 3516, 1, 1024, 4096, 4096, 1024, 1024]
    - [12, 11891.0]
  - - [1024, 3969, 1, 1024, 1024, 1024, 1024, 1024]
    - [28, 11203.0]
  - - [1024, 3364, 1, 4096, 1024, 1024, 4096, 4096]
    - [30, 10771.0]
  - - [4096, 3411, 1, 1024, 4096, 4096, 1024, 1024]
    - [12, 11829.0]
  - - [147, 147, 432, 64, 147, 147, 64, 64]
    - [16, 4660.0]
  - - [4096, 3301, 1, 1024, 4096, 4096, 1024, 1024]
    - [14, 11952.0]
  - - [1024, 3513, 1, 4096, 1024, 1024, 4096, 4096]
    - [14, 11234.0]
  - - [1024, 3469, 1, 4096, 1024, 1024, 4096, 4096]
    - [14, 11100.0]
  - - [1024, 3095, 1, 4096, 1024, 1024, 4096, 4096]
    - [12, 10987.0]
  - - [4096, 3533, 1, 1024, 4096, 4096, 1024, 1024]
    - [12, 11904.0]
  - - [4096, 3390, 1, 1024, 4096, 4096, 1024, 1024]
    - [12, 11735.0]
  - - [4096, 3582, 1, 1024, 4096, 4096, 1024, 1024]
    - [12, 12054.0]
  - - [1024, 3956, 1, 1024, 1024, 1024, 1024, 1024]
    - [28, 11221.0]
  - - [4096, 3585, 1, 1024, 4096, 4096, 1024, 1024]
    - [12, 11631.0]
  - - [4096, 3231, 1, 1024, 4096, 4096, 1024, 1024]
    - [12, 11709.0]
  - - [1024, 3205, 1, 4096, 1024, 1024, 4096, 4096]
    - [28, 10602.0]
  - - [4096, 3496, 1, 1024, 4096, 4096, 1024, 1024]
    - [12, 11785.0]
  - - [1024, 3143, 1, 4096, 1024, 1024, 4096, 4096]
    - [28, 10933.0]
  - - [1024, 3318, 1, 4096, 1024, 1024, 4096, 4096]
    - [49, 10566.0]
  - - [1024, 3353, 1, 4096, 1024, 1024, 4096, 4096]
    - [30, 10739.0]
  - - [1024, 3464, 1, 4096, 1024, 1024, 4096, 4096]
    - [14, 11079.0]
  - - [4096, 2736, 1, 1024, 4096, 4096, 1024, 1024]
    - [12, 11574.0]
  - - [1024, 3402, 1, 4096, 1024, 1024, 4096, 4096]
    - [30, 10902.0]
  - - [4096, 3138, 1, 1024, 4096, 4096, 1024, 1024]
    - [12, 11877.0]
  - - [1024, 3860, 1, 4096, 1024, 1024, 4096, 4096]
    - [14, 10598.0]
  - - [148, 148, 432, 64, 148, 148, 64, 64]
    - [16, 4710.0]
  - - [1024, 3539, 1, 4096, 1024, 1024, 4096, 4096]
    - [30, 11310.0]
  - - [4096, 3211, 1, 1024, 4096, 4096, 1024, 1024]
    - [14, 11647.0]
  - - [1024, 3332, 1, 4096, 1024, 1024, 4096, 4096]
    - [14, 10691.0]
  - - [1024, 3466, 1, 4096, 1024, 1024, 4096, 4096]
    - [30, 11102.0]
  - - [4096, 3475, 1, 1024, 4096, 4096, 1024, 1024]
    - [12, 11723.0]
  - - [4096, 3524, 1, 1024, 4096, 4096, 1024, 1024]
    - [12, 11886.0]
  - - [4096, 2985, 1, 1024, 4096, 4096, 1024, 1024]
    - [12, 11632.0]
  - - [4096, 3222, 1, 1024, 4096, 4096, 1024, 1024]
    - [14, 11661.0]
  - - [4096, 3451, 1, 1024, 4096, 4096, 1024, 1024]
    - [12, 11933.0]
  - - [1024, 3181, 1, 4096, 1024, 1024, 4096, 4096]
    - [28, 10886.0]
  - - [1024, 3640, 1, 4096, 1024, 1024, 4096, 4096]
    - [30, 11550.0]
  - - [1024, 3375, 1, 4096, 1024, 1024, 4096, 4096]
    - [28, 10878.0]
  - - [1024, 3550, 1, 4096, 1024, 1024, 4096, 4096]
    - [30, 11355.0]
  - - [1024, 4020, 1, 1024, 1024, 1024, 1024, 1024]
    - [28, 11338.0]
  - - [4096, 3349, 1, 1024, 4096, 4096, 1024, 1024]
    - [12, 11618.0]
  - - [4096, 3398, 1, 1024, 4096, 4096, 1024, 1024]
    - [12, 11753.0]
  - - [33708, 3976, 1, 1024, 33708, 33708, 1024, 1024]
    - [30, 11983.0]
  - - [1024, 2917, 1, 4096, 1024, 1024, 4096, 4096]
    - [30, 11133.0]
  - - [33708, 3910, 1, 1024, 33708, 33708, 1024, 1024]
    - [47, 12042.0]
  - - [4096, 3860, 1, 1024, 4096, 4096, 1024, 1024]
    - [12, 11747.0]
  - - [4096, 3304, 1, 1024, 4096, 4096, 1024, 1024]
    - [12, 11941.0]
  - - [1024, 3286, 1, 4096, 1024, 1024, 4096, 4096]
    - [28, 10534.0]
  - - [1024, 3460, 1, 4096, 1024, 1024, 4096, 4096]
    - [14, 11073.0]
  - - [1024, 4026, 1, 4096, 1024, 1024, 4096, 4096]
    - [14, 11081.0]
  - - [4096, 3471, 1, 1024, 4096, 4096, 1024, 1024]
    - [12, 11730.0]
  - - [193, 193, 320, 64, 193, 193, 64, 64]
    - [34, 5326.0]
  - - [1024, 3894, 1, 1024, 1024, 1024, 1024, 1024]
    - [28, 11094.0]
  - - [1024, 3506, 1, 4096, 1024, 1024, 4096, 4096]
    - [14, 11211.0]
  - - [1024, 4000, 1, 1024, 1024, 1024, 1024, 1024]
    - [28, 11270.0]
  - - [1024, 3900, 1, 4096, 1024, 1024, 4096, 4096]
    - [14, 10740.0]
  - - [1024, 3445, 1, 4096, 1024, 1024, 4096, 4096]
    - [14, 11032.0]
  - - [4096, 3442, 1, 1024, 4096, 4096, 1024, 1024]
    - [12, 11929.0]
  - - [1024, 3358, 1, 4096, 1024, 1024, 4096, 4096]
    - [14, 10769.0]
  - - [1024, 3211, 1, 4096, 1024, 1024, 4096, 4096]
    - [28, 10376.0]
  - - [4096, 3515, 1, 1024, 4096, 4096, 1024, 1024]
    - [12, 11773.0]
  - - [1024, 3564, 1, 4096, 1024, 1024, 4096, 4096]
    - [30, 11320.0]
  - - [4096, 3057, 1, 1024, 4096, 4096, 1024, 1024]
    - [12, 11862.0]
  - - [1024, 3343, 1, 4096, 1024, 1024, 4096, 4096]
    - [14, 10690.0]
  - - [4096, 3262, 1, 1024, 4096, 4096, 1024, 1024]
    - [14, 11791.0]
  - - [1024, 3518, 1, 4096, 1024, 1024, 4096, 4096]
    - [30, 11256.0]
  - - [33708, 3876, 1, 1024, 33708, 33708, 1024, 1024]
    - [47, 11966.0]
  - - [4096, 3462, 1, 1024, 4096, 4096, 1024, 1024]
    - [12, 11700.0]
  - - [1024, 3265, 1, 4096, 1024, 1024, 4096, 4096]
    - [28, 10381.0]
  - - [4096, 3389, 1, 1024, 4096, 4096, 1024, 1024]
    - [12, 11755.0]
  - - [4096, 3438, 1, 1024, 4096, 4096, 1024, 1024]
    - [12, 11903.0]
  - - [1024, 3955, 1, 1024, 1024, 1024, 1024, 1024]
    - [28, 11198.0]
  - - [1024, 3545, 1, 4096, 1024, 1024, 4096, 4096]
    - [14, 11325.0]
  - - [1024, 3144, 1, 4096, 1024, 1024, 4096, 4096]
    - [28, 10894.0]
  - - [1024, 3417, 1, 4096, 1024, 1024, 4096, 4096]
    - [14, 10938.0]
  - - [4096, 3543, 1, 1024, 4096, 4096, 1024, 1024]
    - [12, 11919.0]
  - - [4096, 3352, 1, 1024, 4096, 4096, 1024, 1024]
    - [12, 11628.0]
  - - [33708, 3975, 1, 1024, 33708, 33708, 1024, 1024]
    - [30, 11986.0]
  - - [148, 147, 432, 64, 148, 148, 64, 64]
    - [16, 4665.0]
  - - [4096, 3137, 1, 1024, 4096, 4096, 1024, 1024]
    - [12, 11868.0]
  - - [4096, 3506, 1, 1024, 4096, 4096, 1024, 1024]
    - [12, 11852.0]
  - - [1024, 3975, 1, 1024, 1024, 1024, 1024, 1024]
    - [28, 11243.0]
  - - [1024, 3859, 1, 4096, 1024, 1024, 4096, 4096]
    - [14, 10645.0]
  - - [4096, 3369, 1, 1024, 4096, 4096, 1024, 1024]
    - [12, 11684.0]
  - - [1024, 3434, 1, 4096, 1024, 1024, 4096, 4096]
    - [14, 11004.0]
  - - [1024, 3292, 1, 4096, 1024, 1024, 4096, 4096]
    - [47, 10372.0]
  - - [4096, 3523, 1, 1024, 4096, 4096, 1024, 1024]
    - [12, 11891.0]
  - - [4096, 3380, 1, 1024, 4096, 4096, 1024, 1024]
    - [12, 11725.0]
  - - [1024, 3408, 1, 4096, 1024, 1024, 4096, 4096]
    - [30, 10890.0]
  - - [4096, 3221, 1, 1024, 4096, 4096, 1024, 1024]
    - [12, 11666.0]
  - - [4096, 3270, 1, 1024, 4096, 4096, 1024, 1024]
    - [12, 11834.0]
  - - [143, 143, 432, 64, 143, 143, 64, 64]
    - [43, 4420.0]
  - - [1024, 3303, 1, 4096, 1024, 1024, 4096, 4096]
    - [12, 10404.0]
  - - [4096, 3502, 1, 1024, 4096, 4096, 1024, 1024]
    - [12, 11833.0]
  - - [1024, 3222, 1, 4096, 1024, 1024, 4096, 4096]
    - [28, 10367.0]
  - - [4096, 2505, 1, 1024, 4096, 4096, 1024, 1024]
    - [14, 11821.0]
  - - [4096, 3397, 1, 1024, 4096, 4096, 1024, 1024]
    - [12, 11785.0]
  - - [4096, 3562, 1, 1024, 4096, 4096, 1024, 1024]
    - [12, 12037.0]
  - - [4096, 3095, 1, 1024, 4096, 4096, 1024, 1024]
    - [12, 11728.0]
  - - [1024, 3226, 1, 4096, 1024, 1024, 4096, 4096]
    - [47, 10367.0]
  - - [177, 177, 352, 64, 177, 177, 64, 64]
    - [16, 5807.0]
  - - [4096, 3360, 1, 1024, 4096, 4096, 1024, 1024]
    - [12, 11660.0]
  - - [1024, 3942, 1, 1024, 1024, 1024, 1024, 1024]
    - [28, 11163.0]
  - - [1024, 3298, 1, 4096, 1024, 1024, 4096, 4096]
    - [28, 10819.0]
  - - [1024, 3381, 1, 4096, 1024, 1024, 4096, 4096]
    - [30, 10783.0]
  - - [4096, 3314, 1, 1024, 4096, 4096, 1024, 1024]
    - [12, 11970.0]
  - - [1024, 3492, 1, 4096, 1024, 1024, 4096, 4096]
    - [14, 11135.0]
  - - [1024, 3430, 1, 4096, 1024, 1024, 4096, 4096]
    - [14, 10983.0]
  - - [4096, 3977, 1, 1024, 4096, 4096, 1024, 1024]
    - [12, 11683.0]
  - - [4096, 3546, 1, 1024, 4096, 4096, 1024, 1024]
    - [12, 11962.0]
  - - [4096, 3640, 1, 1024, 4096, 4096, 1024, 1024]
    - [12, 11817.0]
  - - [4096, 3441, 1, 1024, 4096, 4096, 1024, 1024]
    - [12, 11896.0]
  - - [33708, 4059, 1, 1024, 33708, 33708, 1024, 1024]
    - [30, 12233.0]
  - - [1024, 3978, 1, 1024, 1024, 1024, 1024, 1024]
    - [28, 11196.0]
  - - [1024, 3376, 1, 4096, 1024, 1024, 4096, 4096]
    - [14, 10829.0]
  - - [1024, 3482, 1, 4096, 1024, 1024, 4096, 4096]
    - [49, 11033.0]
  - - [1024, 3563, 1, 4096, 1024, 1024, 4096, 4096]
    - [30, 11362.0]
  - - [4096, 4020, 1, 1024, 4096, 4096, 1024, 1024]
    - [12, 11817.0]
  - - [1024, 3271, 1, 4096, 1024, 1024, 4096, 4096]
    - [28, 10620.0]
  - - [1024, 3291, 1, 4096, 1024, 1024, 4096, 4096]
    - [28, 10315.0]
  - - [1024, 3431, 1, 4096, 1024, 1024, 4096, 4096]
    - [14, 10982.0]
  - - [1024, 3481, 1, 4096, 1024, 1024, 4096, 4096]
    - [30, 11133.0]
  - - [4096, 3461, 1, 1024, 4096, 4096, 1024, 1024]
    - [12, 11693.0]
  - - [1024, 3574, 1, 4096, 1024, 1024, 4096, 4096]
    - [30, 11418.0]
  - - [1024, 4059, 1, 1024, 1024, 1024, 1024, 1024]
    - [28, 11481.0]
  - - [1024, 3421, 1, 4096, 1024, 1024, 4096, 4096]
    - [14, 10957.0]
  - - [4096, 3224, 1, 1024, 4096, 4096, 1024, 1024]
    - [12, 11672.0]
  - - [4096, 3437, 1, 1024, 4096, 4096, 1024, 1024]
    - [12, 11912.0]
  - - [4096, 3168, 1, 1024, 4096, 4096, 1024, 1024]
    - [12, 11957.0]
  - - [33708, 3990, 1, 1024, 33708, 33708, 1024, 1024]
    - [30, 12023.0]
  - - [1024, 3349, 1, 4096, 1024, 1024, 4096, 4096]
    - [30, 10687.0]
  - - [4096, 3335, 1, 1024, 4096, 4096, 1024, 1024]
    - [12, 11575.0]
  - - [4096, 3400, 1, 1024, 4096, 4096, 1024, 1024]
    - [12, 11780.0]
  - - [160, 159, 400, 64, 160, 160, 64, 64]
    - [34, 5453.0]
  - - [1024, 3398, 1, 4096, 1024, 1024, 4096, 4096]
    - [30, 10825.0]
  - - [1024, 3780, 1, 4096, 1024, 1024, 4096, 4096]
    - [30, 12029.0]
  - - [4096, 3098, 1, 1024, 4096, 4096, 1024, 1024]
    - [12, 11694.0]
  - - [1024, 4012, 1, 4096, 1024, 1024, 4096, 4096]
    - [14, 11030.0]
  - - [4096, 3505, 1, 1024, 4096, 4096, 1024, 1024]
    - [12, 11803.0]
  - - [4096, 3554, 1, 1024, 4096, 4096, 1024, 1024]
    - [12, 11957.0]
  - - [4096, 3063, 1, 1024, 4096, 4096, 1024, 1024]
    - [12, 11920.0]
  - - [1024, 3503, 1, 4096, 1024, 1024, 4096, 4096]
    - [30, 11159.0]
  - - [1024, 3166, 1, 4096, 1024, 1024, 4096, 4096]
    - [28, 11318.0]
  - - [1024, 3425, 1, 4096, 1024, 1024, 4096, 4096]
    - [14, 10967.0]
  - - [1024, 3344, 1, 4096, 1024, 1024, 4096, 4096]
    - [28, 10786.0]
  - - [4096, 3484, 1, 1024, 4096, 4096, 1024, 1024]
    - [12, 11725.0]
  - - [1024, 3681, 1, 1024, 1024, 1024, 1024, 1024]
    - [30, 11266.0]
  - - [1024, 4050, 1, 1024, 1024, 1024, 1024, 1024]
    - [28, 11487.0]
  - - [4096, 3379, 1, 1024, 4096, 4096, 1024, 1024]
    - [12, 11736.0]
  - - [4096, 3428, 1, 1024, 4096, 4096, 1024, 1024]
    - [12, 11891.0]
  - - [1024, 3304, 1, 4096, 1024, 1024, 4096, 4096]
    - [28, 10554.0]
  - - [1024, 3387, 1, 4096, 1024, 1024, 4096, 4096]
    - [14, 10846.0]
  - - [4096, 3126, 1, 1024, 4096, 4096, 1024, 1024]
    - [12, 11796.0]
  - - [1024, 3498, 1, 4096, 1024, 1024, 4096, 4096]
    - [30, 11182.0]
  - - [1024, 3436, 1, 4096, 1024, 1024, 4096, 4096]
    - [30, 11017.0]
  - - [4096, 3501, 1, 1024, 4096, 4096, 1024, 1024]
    - [12, 11832.0]
  - - [4096, 3358, 1, 1024, 4096, 4096, 1024, 1024]
    - [12, 11639.0]
  - - [4096, 3232, 1, 1024, 4096, 4096, 1024, 1024]
    - [14, 11709.0]
  - - [1024, 3585, 1, 4096, 1024, 1024, 4096, 4096]
    - [14, 11427.0]
  - - [4096, 3143, 1, 1024, 4096, 4096, 1024, 1024]
    - [12, 11852.0]
  - - [4096, 3464, 1, 1024, 4096, 4096, 1024, 1024]
    - [12, 11670.0]
  - - [1024, 3366, 1, 4096, 1024, 1024, 4096, 4096]
    - [28, 10773.0]
  - - [4096, 3375, 1, 1024, 4096, 4096, 1024, 1024]
    - [12, 11695.0]
  - - [4096, 2917, 1, 1024, 4096, 4096, 1024, 1024]
    - [12, 11909.0]
  - - [4096, 4026, 1, 1024, 4096, 4096, 1024, 1024]
    - [12, 11825.0]
  - - [1024, 3277, 1, 4096, 1024, 1024, 4096, 4096]
    - [28, 10232.0]
  - - [1024, 3103, 1, 4096, 1024, 1024, 4096, 4096]
    - [28, 10461.0]
  - - [33708, 3995, 1, 1024, 33708, 33708, 1024, 1024]
    - [30, 12040.0]
  - - [1024, 3297, 1, 4096, 1024, 1024, 4096, 4096]
    - [28, 10529.0]
  - - [4096, 3545, 1, 1024, 4096, 4096, 1024, 1024]
    - [12, 11932.0]
  - - [1024, 3399, 1, 4096, 1024, 1024, 4096, 4096]
    - [14, 10884.0]
  - - [33708, 3796, 1, 1024, 33708, 33708, 1024, 1024]
    - [49, 12201.0]
  - - [4096, 3292, 1, 1024, 4096, 4096, 1024, 1024]
    - [14, 11904.0]
  - - [33708, 3859, 1, 1024, 33708, 33708, 1024, 1024]
    - [47, 11921.0]
  - - [4096, 3566, 1, 1024, 4096, 4096, 1024, 1024]
    - [12, 12031.0]
  - - [4096, 3894, 1, 1024, 4096, 4096, 1024, 1024]
    - [12, 11863.0]
  - - [4096, 3492, 1, 1024, 4096, 4096, 1024, 1024]
    - [12, 11787.0]
  - - [1024, 3977, 1, 1024, 1024, 1024, 1024, 1024]
    - [28, 11216.0]
  - - [1024, 3272, 1, 4096, 1024, 1024, 4096, 4096]
    - [12, 10737.0]
  - - [135, 134, 480, 64, 135, 135, 64, 64]
    - [34, 3983.0]
  - - [1024, 3355, 1, 4096, 1024, 1024, 4096, 4096]
    - [14, 10774.0]
  - - [4096, 3419, 1, 1024, 4096, 4096, 1024, 1024]
    - [12, 11852.0]
  - - [1024, 3404, 1, 4096, 1024, 1024, 4096, 4096]
    - [14, 10881.0]
  - - [4096, 3999, 1, 1024, 4096, 4096, 1024, 1024]
    - [12, 11748.0]
  - - [4096, 3166, 1, 1024, 4096, 4096, 1024, 1024]
    - [12, 11989.0]
  - - [33708, 3840, 1, 1024, 33708, 33708, 1024, 1024]
    - [30, 12357.0]
  - - [4096, 4032, 1, 1024, 4096, 4096, 1024, 1024]
    - [12, 11816.0]
  - - [1024, 3573, 1, 4096, 1024, 1024, 4096, 4096]
    - [49, 11191.0]
  - - [4096, 3366, 1, 1024, 4096, 4096, 1024, 1024]
    - [12, 11654.0]
  - - [1024, 3541, 1, 4096, 1024, 1024, 4096, 4096]
    - [30, 11258.0]
  - - [4096, 3207, 1, 1024, 4096, 4096, 1024, 1024]
    - [14, 11609.0]
  - - [4096, 3272, 1, 1024, 4096, 4096, 1024, 1024]
    - [12, 11835.0]
  - - [1024, 3334, 1, 4096, 1024, 1024, 4096, 4096]
    - [30, 10687.0]
  - - [228, 228, 272, 64, 228, 228, 64, 64]
    - [3, 6415.0]
  - - [4096, 3183, 1, 1024, 4096, 4096, 1024, 1024]
    - [12, 12005.0]
  - - [4096, 3536, 1, 1024, 4096, 4096, 1024, 1024]
    - [12, 11936.0]
  - - [1024, 4005, 1, 1024, 1024, 1024, 1024, 1024]
    - [28, 11299.0]
  - - [1024, 3245, 1, 4096, 1024, 1024, 4096, 4096]
    - [28, 10397.0]
  - - [4096, 3447, 1, 1024, 4096, 4096, 1024, 1024]
    - [12, 11941.0]
  - - [1024, 3183, 1, 4096, 1024, 1024, 4096, 4096]
    - [47, 10832.0]
  - - [1024, 3361, 1, 4096, 1024, 1024, 4096, 4096]
    - [14, 10766.0]
  - - [33708, 3870, 1, 1024, 33708, 33708, 1024, 1024]
    - [28, 11911.0]
  - - [1024, 3321, 1, 4096, 1024, 1024, 4096, 4096]
    - [28, 10618.0]
  - - [1024, 3486, 1, 4096, 1024, 1024, 4096, 4096]
    - [14, 11148.0]
  - - [4096, 4005, 1, 1024, 4096, 4096, 1024, 1024]
    - [12, 11772.0]
  - - [4096, 3410, 1, 1024, 4096, 4096, 1024, 1024]
    - [12, 11837.0]
  - - [1024, 3944, 1, 1024, 1024, 1024, 1024, 1024]
    - [28, 11166.0]
  - - [4096, 3300, 1, 1024, 4096, 4096, 1024, 1024]
    - [12, 11939.0]
  - - [4096, 3579, 1, 1024, 4096, 4096, 1024, 1024]
    - [12, 12031.0]
  - - [4096, 3483, 1, 1024, 4096, 4096, 1024, 1024]
    - [12, 11756.0]
  - - [4096, 3532, 1, 1024, 4096, 4096, 1024, 1024]
    - [12, 11909.0]
  - - [1024, 3140, 1, 4096, 1024, 1024, 4096, 4096]
    - [12, 10788.0]
  - - [1024, 3372, 1, 4096, 1024, 1024, 4096, 4096]
    - [14, 10753.0]
  - - [1024, 3224, 1, 4096, 1024, 1024, 4096, 4096]
    - [28, 10375.0]
  - - [4096, 3230, 1, 1024, 4096, 4096, 1024, 1024]
    - [12, 11702.0]
  - - [4096, 3427, 1, 1024, 4096, 4096, 1024, 1024]
    - [12, 11887.0]
  - - [1024, 3796, 1, 1024, 1024, 1024, 1024, 1024]
    - [30, 11498.0]
  - - [143, 148, 432, 64, 143, 143, 64, 64]
    - [7, 4564.0]
  - - [1024, 3616, 1, 4096, 1024, 1024, 4096, 4096]
    - [30, 11402.0]
  - - [1024, 3315, 1, 4096, 1024, 1024, 4096, 4096]
    - [28, 10589.0]
  - - [1024, 3476, 1, 4096, 1024, 1024, 4096, 4096]
    - [30, 11133.0]
  - - [1024, 3509, 1, 4096, 1024, 1024, 4096, 4096]
    - [30, 11240.0]
  - - [4096, 3357, 1, 1024, 4096, 4096, 1024, 1024]
    - [12, 11624.0]
  - - [4096, 3406, 1, 1024, 4096, 4096, 1024, 1024]
    - [12, 11814.0]
  - - [1024, 3558, 1, 4096, 1024, 1024, 4096, 4096]
    - [30, 11357.0]
  - - [4096, 3593, 1, 1024, 4096, 4096, 1024, 1024]
    - [12, 11660.0]
  - - [4096, 3247, 1, 1024, 4096, 4096, 1024, 1024]
    - [12, 11745.0]
  - - [4096, 3088, 1, 1024, 4096, 4096, 1024, 1024]
    - [12, 11704.0]
  - - [1024, 3213, 1, 4096, 1024, 1024, 4096, 4096]
    - [14, 10031.0]
  - - [4096, 3511, 1, 1024, 4096, 4096, 1024, 1024]
    - [12, 11854.0]
  - - [1024, 3365, 1, 4096, 1024, 1024, 4096, 4096]
    - [12, 10915.0]
  - - [1024, 3504, 1, 4096, 1024, 1024, 4096, 4096]
    - [14, 11224.0]
  - - [1024, 3442, 1, 4096, 1024, 1024, 4096, 4096]
    - [30, 11050.0]
  - - [4096, 3474, 1, 1024, 4096, 4096, 1024, 1024]
    - [12, 11717.0]
  - - [4096, 2984, 1, 1024, 4096, 4096, 1024, 1024]
    - [12, 11637.0]
  - - [1024, 3876, 1, 4096, 1024, 1024, 4096, 4096]
    - [30, 10656.0]
  - - [4096, 3337, 1, 1024, 4096, 4096, 1024, 1024]
    - [12, 11575.0]
  - - [4096, 3450, 1, 1024, 4096, 4096, 1024, 1024]
    - [12, 11941.0]
  - - [1024, 3547, 1, 4096, 1024, 1024, 4096, 4096]
    - [30, 11276.0]
  - - [4096, 3291, 1, 1024, 4096, 4096, 1024, 1024]
    - [12, 11912.0]
  - - [1024, 3340, 1, 4096, 1024, 1024, 4096, 4096]
    - [28, 10832.0]
  - - [4096, 3491, 1, 1024, 4096, 4096, 1024, 1024]
    - [12, 11758.0]
  - - [4096, 3348, 1, 1024, 4096, 4096, 1024, 1024]
    - [12, 11609.0]
  - - [4096, 3906, 1, 1024, 4096, 4096, 1024, 1024]
    - [12, 11854.0]
  - - [1024, 3477, 1, 4096, 1024, 1024, 4096, 4096]
    - [30, 11087.0]
  - - [1024, 3397, 1, 4096, 1024, 1024, 4096, 4096]
    - [30, 10883.0]
  - - [4096, 3165, 1, 1024, 4096, 4096, 1024, 1024]
    - [12, 11986.0]
  - - [4096, 3470, 1, 1024, 4096, 4096, 1024, 1024]
    - [12, 11722.0]
  - - [1024, 3526, 1, 4096, 1024, 1024, 4096, 4096]
    - [30, 11263.0]
  - - [4096, 3365, 1, 1024, 4096, 4096, 1024, 1024]
    - [12, 11679.0]
  - - [4096, 3319, 1, 1024, 4096, 4096, 1024, 1024]
    - [12, 12000.0]
  - - [1024, 3401, 1, 4096, 1024, 1024, 4096, 4096]
    - [14, 10887.0]
  - - [1024, 3294, 1, 4096, 1024, 1024, 4096, 4096]
    - [28, 10691.0]
  - - [159, 159, 400, 64, 159, 159, 64, 64]
    - [34, 5322.0]
  - - [1024, 3472, 1, 4096, 1024, 1024, 4096, 4096]
    - [14, 11129.0]
  - - [4096, 3328, 1, 1024, 4096, 4096, 1024, 1024]
    - [12, 12047.0]
  - - [1024, 3861, 1, 1024, 1024, 1024, 1024, 1024]
    - [28, 10950.0]
  - - [1024, 3910, 1, 1024, 1024, 1024, 1024, 1024]
    - [28, 11125.0]
  - - [1024, 3410, 1, 4096, 1024, 1024, 4096, 4096]
    - [14, 10909.0]
  - - [1024, 3395, 1, 4096, 1024, 1024, 4096, 4096]
    - [14, 10837.0]
  - - [4096, 3282, 1, 1024, 4096, 4096, 1024, 1024]
    - [12, 11888.0]
  - - [1024, 3751, 1, 1024, 1024, 1024, 1024, 1024]
    - [30, 11460.0]
  - - [4096, 3145, 1, 1024, 4096, 4096, 1024, 1024]
    - [12, 11882.0]
  - - [4096, 3514, 1, 1024, 4096, 4096, 1024, 1024]
    - [12, 11865.0]
  - - [4096, 3944, 1, 1024, 4096, 4096, 1024, 1024]
    - [12, 12011.0]
  - - [1024, 3515, 1, 4096, 1024, 1024, 4096, 4096]
    - [30, 11230.0]
  - - [4096, 3409, 1, 1024, 4096, 4096, 1024, 1024]
    - [12, 11821.0]
  - - [4096, 3564, 1, 1024, 4096, 4096, 1024, 1024]
    - [12, 12035.0]
  - - [4096, 3299, 1, 1024, 4096, 4096, 1024, 1024]
    - [12, 11925.0]
  - - [1024, 3057, 1, 4096, 1024, 1024, 4096, 4096]
    - [30, 11636.0]
  - - [4096, 3531, 1, 1024, 4096, 4096, 1024, 1024]
    - [12, 11925.0]
  - - [4096, 3388, 1, 1024, 4096, 4096, 1024, 1024]
    - [12, 11740.0]
  - - [1024, 3189, 1, 4096, 1024, 1024, 4096, 4096]
    - [28, 10632.0]
  - - [1024, 3300, 1, 4096, 1024, 1024, 4096, 4096]
    - [28, 10679.0]
  - - [1024, 3720, 1, 4096, 1024, 1024, 4096, 4096]
    - [30, 11822.0]
  - - [1024, 3383, 1, 4096, 1024, 1024, 4096, 4096]
    - [30, 10802.0]
  - - [1024, 3494, 1, 4096, 1024, 1024, 4096, 4096]
    - [30, 11189.0]
  - - [1024, 3448, 1, 4096, 1024, 1024, 4096, 4096]
    - [30, 11050.0]
  - - [4096, 3542, 1, 1024, 4096, 4096, 1024, 1024]
    - [12, 11934.0]
  - - [1024, 3488, 1, 4096, 1024, 1024, 4096, 4096]
    - [49, 11031.0]
  - - [4096, 3405, 1, 1024, 4096, 4096, 1024, 1024]
    - [12, 11803.0]
  - - [1024, 3262, 1, 4096, 1024, 1024, 4096, 4096]
    - [28, 10298.0]
  - - [33708, 4005, 1, 1024, 33708, 33708, 1024, 1024]
    - [30, 12063.0]
  - - [1024, 3594, 1, 4096, 1024, 1024, 4096, 4096]
    - [30, 11462.0]
  - - [4096, 3103, 1, 1024, 4096, 4096, 1024, 1024]
    - [12, 11741.0]
  - - [4096, 3136, 1, 1024, 4096, 4096, 1024, 1024]
    - [12, 11858.0]
  - - [1024, 3378, 1, 4096, 1024, 1024, 4096, 4096]
    - [30, 10820.0]
  - - [4096, 3559, 1, 1024, 4096, 4096, 1024, 1024]
    - [12, 12001.0]
  - - [4096, 3368, 1, 1024, 4096, 4096, 1024, 1024]
    - [12, 11679.0]
  - - [4096, 3209, 1, 1024, 4096, 4096, 1024, 1024]
    - [14, 11641.0]
  - - [4096, 3322, 1, 1024, 4096, 4096, 1024, 1024]
    - [14, 12032.0]
  - - [1024, 3483, 1, 4096, 1024, 1024, 4096, 4096]
    - [30, 11088.0]
  - - [4096, 3473, 1, 1024, 4096, 4096, 1024, 1024]
    - [12, 11714.0]
  - - [4096, 3522, 1, 1024, 4096, 4096, 1024, 1024]
    - [12, 11901.0]
  - - [1024, 3532, 1, 4096, 1024, 1024, 4096, 4096]
    - [30, 11271.0]
  - - [4096, 3449, 1, 1024, 4096, 4096, 1024, 1024]
    - [12, 11939.0]
  - - [1024, 3351, 1, 4096, 1024, 1024, 4096, 4096]
    - [30, 10640.0]
  - - [1024, 3462, 1, 4096, 1024, 1024, 4096, 4096]
    - [14, 11084.0]
  - - [4096, 3396, 1, 1024, 4096, 4096, 1024, 1024]
    - [12, 11771.0]
  - - [132, 132, 480, 64, 132, 132, 64, 64]
    - [24, 3838.0]
  - - [1024, 3416, 1, 4096, 1024, 1024, 4096, 4096]
    - [14, 10960.0]
  - - [4096, 3469, 1, 1024, 4096, 4096, 1024, 1024]
    - [12, 11708.0]
  - - [1024, 3582, 1, 4096, 1024, 1024, 4096, 4096]
    - [49, 11295.0]
  - - [1024, 3230, 1, 4096, 1024, 1024, 4096, 4096]
    - [12, 10382.0]
  - - [1024, 3489, 1, 4096, 1024, 1024, 4096, 4096]
    - [30, 11149.0]
  - - [1024, 3427, 1, 4096, 1024, 1024, 4096, 4096]
    - [14, 10957.0]
  - - [1024, 3346, 1, 4096, 1024, 1024, 4096, 4096]
    - [14, 10712.0]
  - - [33708, 3977, 1, 1024, 33708, 33708, 1024, 1024]
    - [30, 11989.0]
  - - [4096, 3796, 1, 1024, 4096, 4096, 1024, 1024]
    - [14, 12032.0]
  - - [4096, 3176, 1, 1024, 4096, 4096, 1024, 1024]
    - [12, 12008.0]
  - - [4096, 3990, 1, 1024, 4096, 4096, 1024, 1024]
    - [12, 11723.0]
  - - [1024, 3257, 1, 4096, 1024, 1024, 4096, 4096]
    - [30, 9378.0]
  - - [4096, 3343, 1, 1024, 4096, 4096, 1024, 1024]
    - [12, 10038.0]
  - - [4096, 3440, 1, 1024, 4096, 4096, 1024, 1024]
    - [12, 10266.0]
  - - [33708, 4030, 1, 1024, 33708, 33708, 1024, 1024]
    - [49, 10957.0]
  - - [1024, 3190, 1, 4096, 1024, 1024, 4096, 4096]
    - [14, 9434.0]
  - - [1024, 3389, 1, 4096, 1024, 1024, 4096, 4096]
    - [32, 9175.0]
  - - [1024, 3500, 1, 4096, 1024, 1024, 4096, 4096]
    - [49, 9066.0]
  - - [1024, 3471, 1, 4096, 1024, 1024, 4096, 4096]
    - [49, 8870.0]
  - - [1024, 3438, 1, 4096, 1024, 1024, 4096, 4096]
    - [32, 9293.0]
  - - [4096, 3513, 1, 1024, 4096, 4096, 1024, 1024]
    - [14, 9669.0]
  - - [1024, 3562, 1, 4096, 1024, 1024, 4096, 4096]
    - [50, 8701.0]
  - - [4096, 3616, 1, 1024, 4096, 4096, 1024, 1024]
    - [14, 9259.0]
  - - [4096, 3955, 1, 1024, 4096, 4096, 1024, 1024]
    - [12, 8466.0]
  - - [1024, 3441, 1, 4096, 1024, 1024, 4096, 4096]
    - [32, 9269.0]
  - - [1024, 3236, 1, 4096, 1024, 1024, 4096, 4096]
    - [49, 9643.0]
  - - [1024, 3524, 1, 4096, 1024, 1024, 4096, 4096]
    - [50, 8686.0]
  - - [4096, 3460, 1, 1024, 4096, 4096, 1024, 1024]
    - [12, 10050.0]
  - - [1024, 3384, 1, 4096, 1024, 1024, 4096, 4096]
    - [32, 9152.0]
  - - [4096, 3387, 1, 1024, 4096, 4096, 1024, 1024]
    - [12, 10272.0]
  - - [4096, 3436, 1, 1024, 4096, 4096, 1024, 1024]
    - [12, 10349.0]
  - - [4096, 3277, 1, 1024, 4096, 4096, 1024, 1024]
    - [12, 11152.0]
  - - [1024, 3457, 1, 4096, 1024, 1024, 4096, 4096]
    - [30, 8850.0]
  - - [1024, 3999, 1, 4096, 1024, 1024, 4096, 4096]
    - [50, 8043.0]
  - - [1024, 4032, 1, 4096, 1024, 1024, 4096, 4096]
    - [47, 9291.0]
  - - [4096, 3541, 1, 1024, 4096, 4096, 1024, 1024]
    - [20, 10835.0]
  - - [4096, 3334, 1, 1024, 4096, 4096, 1024, 1024]
    - [12, 10059.0]
  - - [1024, 3393, 1, 4096, 1024, 1024, 4096, 4096]
    - [32, 9170.0]
  - - [1024, 3411, 1, 4096, 1024, 1024, 4096, 4096]
    - [32, 9217.0]
  - - [1024, 3822, 1, 1024, 1024, 1024, 1024, 1024]
    - [30, 10866.0]
  - - [1024, 3593, 1, 4096, 1024, 1024, 4096, 4096]
    - [50, 8700.0]
  - - [33708, 3822, 1, 1024, 33708, 33708, 1024, 1024]
    - [49, 10876.0]
  - - [4096, 3504, 1, 1024, 4096, 4096, 1024, 1024]
    - [13, 9508.0]
  - - [1024, 3163, 1, 4096, 1024, 1024, 4096, 4096]
    - [28, 9300.0]
  - - [1024, 3357, 1, 4096, 1024, 1024, 4096, 4096]
    - [30, 9396.0]
  - - [1024, 3906, 1, 4096, 1024, 1024, 4096, 4096]
    - [50, 8162.0]
  - - [4096, 3415, 1, 1024, 4096, 4096, 1024, 1024]
    - [13, 9620.0]
  - - [1024, 3406, 1, 4096, 1024, 1024, 4096, 4096]
    - [32, 9130.0]
  - - [4096, 3321, 1, 1024, 4096, 4096, 1024, 1024]
    - [12, 10338.0]
  - - [4096, 3584, 1, 1024, 4096, 4096, 1024, 1024]
    - [14, 9667.0]
  - - [1024, 2736, 1, 4096, 1024, 1024, 4096, 4096]
    - [14, 10222.0]
  - - [1024, 3110, 1, 4096, 1024, 1024, 4096, 4096]
    - [32, 9221.0]
  - - [33708, 3999, 1, 1024, 33708, 33708, 1024, 1024]
    - [49, 10768.0]
  - - [1024, 3093, 1, 4096, 1024, 1024, 4096, 4096]
    - [32, 9131.0]
  - - [4096, 3378, 1, 1024, 4096, 4096, 1024, 1024]
    - [12, 10126.0]
  - - [1024, 3543, 1, 4096, 1024, 1024, 4096, 4096]
    - [50, 8704.0]
  - - [33708, 3925, 1, 1024, 33708, 33708, 1024, 1024]
    - [47, 10749.0]
  - - [1024, 3352, 1, 4096, 1024, 1024, 4096, 4096]
    - [29, 9207.0]
  - - [4096, 3780, 1, 1024, 4096, 4096, 1024, 1024]
    - [12, 8985.0]
  - - [1024, 3990, 1, 4096, 1024, 1024, 4096, 4096]
    - [50, 8048.0]
  - - [4096, 3500, 1, 1024, 4096, 4096, 1024, 1024]
    - [38, 10717.0]
  - - [4096, 3996, 1, 1024, 4096, 4096, 1024, 1024]
    - [10, 9348.0]
  - - [1024, 3247, 1, 4096, 1024, 1024, 4096, 4096]
    - [28, 9146.0]
  - - [4096, 3395, 1, 1024, 4096, 4096, 1024, 1024]
    - [14, 9505.0]
  - - [1024, 3169, 1, 4096, 1024, 1024, 4096, 4096]
    - [49, 9450.0]
  - - [1024, 3088, 1, 4096, 1024, 1024, 4096, 4096]
    - [50, 9274.0]
  - - [1024, 3584, 1, 4096, 1024, 1024, 4096, 4096]
    - [32, 8707.0]
  - - [4096, 3093, 1, 1024, 4096, 4096, 1024, 1024]
    - [12, 10433.0]
  - - [1024, 3538, 1, 4096, 1024, 1024, 4096, 4096]
    - [32, 8769.0]
  - - [1024, 3996, 1, 1024, 1024, 1024, 1024, 1024]
    - [28, 10617.0]
  - - [1024, 3581, 1, 4096, 1024, 1024, 4096, 4096]
    - [32, 8653.0]
  - - [4096, 3374, 1, 1024, 4096, 4096, 1024, 1024]
    - [12, 10114.0]
  - - [33708, 3751, 1, 1024, 33708, 33708, 1024, 1024]
    - [30, 12073.0]
  - - [4096, 3215, 1, 1024, 4096, 4096, 1024, 1024]
    - [14, 11643.0]
  - - [4096, 3312, 1, 1024, 4096, 4096, 1024, 1024]
    - [14, 11981.0]
  - - [4096, 3581, 1, 1024, 4096, 4096, 1024, 1024]
    - [12, 12077.0]
  - - [4096, 3479, 1, 1024, 4096, 4096, 1024, 1024]
    - [12, 11763.0]
  - - [4096, 3544, 1, 1024, 4096, 4096, 1024, 1024]
    - [12, 11967.0]
  - - [1024, 3870, 1, 1024, 1024, 1024, 1024, 1024]
    - [28, 10968.0]
  - - [1024, 3374, 1, 4096, 1024, 1024, 4096, 4096]
    - [30, 10808.0]
  - - [1024, 2967, 1, 4096, 1024, 1024, 4096, 4096]
    - [14, 11332.0]
  - - [4096, 3455, 1, 1024, 4096, 4096, 1024, 1024]
    - [12, 11982.0]
  - - [4096, 3942, 1, 1024, 4096, 4096, 1024, 1024]
    - [12, 11985.0]
  - - [1024, 3528, 1, 4096, 1024, 1024, 4096, 4096]
    - [47, 10467.0]
  - - [4096, 3186, 1, 1024, 4096, 4096, 1024, 1024]
    - [12, 11761.0]
  - - [1024, 3976, 1, 1024, 1024, 1024, 1024, 1024]
    - [28, 11209.0]
  - - [1024, 3511, 1, 4096, 1024, 1024, 4096, 4096]
    - [49, 11111.0]
  - - [4096, 3573, 1, 1024, 4096, 4096, 1024, 1024]
    - [12, 12034.0]
  - - [4096, 3561, 1, 1024, 4096, 4096, 1024, 1024]
    - [12, 12015.0]
  - - [4096, 3418, 1, 1024, 4096, 4096, 1024, 1024]
    - [12, 11804.0]
  - - [33708, 3906, 1, 1024, 33708, 33708, 1024, 1024]
    - [47, 12057.0]
  - - [4096, 3259, 1, 1024, 4096, 4096, 1024, 1024]
    - [12, 11806.0]
  - - [4096, 3308, 1, 1024, 4096, 4096, 1024, 1024]
    - [14, 11961.0]
  - - [1024, 3419, 1, 4096, 1024, 1024, 4096, 4096]
    - [14, 10943.0]
  - - [1024, 3215, 1, 4096, 1024, 1024, 4096, 4096]
    - [28, 10485.0]
  - - [1024, 4030, 1, 4096, 1024, 1024, 4096, 4096]
    - [14, 11101.0]
  - - [4096, 3459, 1, 1024, 4096, 4096, 1024, 1024]
    - [12, 11693.0]
  - - [1024, 3572, 1, 4096, 1024, 1024, 4096, 4096]
    - [30, 11400.0]
  - - [1024, 3137, 1, 4096, 1024, 1024, 4096, 4096]
    - [13, 10697.0]
  - - [1024, 3312, 1, 4096, 1024, 1024, 4096, 4096]
    - [28, 10569.0]
  - - [1024, 3925, 1, 4096, 1024, 1024, 4096, 4096]
    - [14, 10799.0]
  - - [1024, 3453, 1, 4096, 1024, 1024, 4096, 4096]
    - [14, 11068.0]
  - - [4096, 3435, 1, 1024, 4096, 4096, 1024, 1024]
    - [12, 11909.0]
  - - [1024, 3176, 1, 4096, 1024, 1024, 4096, 4096]
    - [13, 10595.0]
  - - [1024, 3444, 1, 4096, 1024, 1024, 4096, 4096]
    - [30, 11042.0]
  - - [4096, 3975, 1, 1024, 4096, 4096, 1024, 1024]
    - [14, 11725.0]
  - - [4096, 3182, 1, 1024, 4096, 4096, 1024, 1024]
    - [12, 12051.0]
  - - [1024, 3475, 1, 4096, 1024, 1024, 4096, 4096]
    - [30, 11065.0]
  - - [33708, 3955, 1, 1024, 33708, 33708, 1024, 1024]
    - [47, 12189.0]
  - - [4096, 3446, 1, 1024, 4096, 4096, 1024, 1024]
    - [12, 11927.0]
  - - [1024, 3138, 1, 4096, 1024, 1024, 4096, 4096]
    - [47, 10592.0]
  - - [1024, 3549, 1, 4096, 1024, 1024, 4096, 4096]
    - [14, 11353.0]
  - - [4096, 3287, 1, 1024, 4096, 4096, 1024, 1024]
    - [14, 11921.0]
  - - [1024, 3342, 1, 4096, 1024, 1024, 4096, 4096]
    - [28, 10890.0]
  - - [4096, 3519, 1, 1024, 4096, 4096, 1024, 1024]
    - [12, 11897.0]
  - - [4096, 3552, 1, 1024, 4096, 4096, 1024, 1024]
    - [12, 12004.0]
  - - [4096, 3859, 1, 1024, 4096, 4096, 1024, 1024]
    - [12, 11767.0]
  - - [33708, 3969, 1, 1024, 33708, 33708, 1024, 1024]
    - [30, 11979.0]
  - - [1024, 3369, 1, 4096, 1024, 1024, 4096, 4096]
    - [30, 10808.0]
  - - [4096, 3482, 1, 1024, 4096, 4096, 1024, 1024]
    - [12, 11782.0]
  - - [1024, 3306, 1, 4096, 1024, 1024, 4096, 4096]
    - [12, 10774.0]
  - - [1024, 3474, 1, 4096, 1024, 1024, 4096, 4096]
    - [30, 11127.0]
  - - [4096, 3377, 1, 1024, 4096, 4096, 1024, 1024]
    - [12, 11704.0]
  - - [4096, 3426, 1, 1024, 4096, 4096, 1024, 1024]
    - [12, 11877.0]
  - - [4096, 2935, 1, 1024, 4096, 4096, 1024, 1024]
    - [12, 12009.0]
  - - [4096, 3267, 1, 1024, 4096, 4096, 1024, 1024]
    - [14, 11852.0]
  - - [1024, 3299, 1, 4096, 1024, 1024, 4096, 4096]
    - [28, 10490.0]
  - - [1024, 3456, 1, 4096, 1024, 1024, 4096, 4096]
    - [14, 11072.0]
  - - [1024, 3280, 1, 4096, 1024, 1024, 4096, 4096]
    - [12, 10835.0]
  - - [1024, 3555, 1, 4096, 1024, 1024, 4096, 4096]
    - [30, 11363.0]
  - - [4096, 3499, 1, 1024, 4096, 4096, 1024, 1024]
    - [12, 11842.0]
  - - [4096, 3356, 1, 1024, 4096, 4096, 1024, 1024]
    - [12, 11652.0]
  - - [1024, 3412, 1, 4096, 1024, 1024, 4096, 4096]
    - [14, 10935.0]
  - - [1024, 2984, 1, 4096, 1024, 1024, 4096, 4096]
    - [14, 11421.0]
  - - [4096, 3141, 1, 1024, 4096, 4096, 1024, 1024]
    - [12, 11908.0]
  - - [4096, 3510, 1, 1024, 4096, 4096, 1024, 1024]
    - [12, 11875.0]
  - - [1024, 3995, 1, 1024, 1024, 1024, 1024, 1024]
    - [28, 11335.0]
  - - [1024, 3517, 1, 4096, 1024, 1024, 4096, 4096]
    - [30, 11222.0]
  - - [1024, 3455, 1, 4096, 1024, 1024, 4096, 4096]
    - [14, 11069.0]
  - - [1024, 3939, 1, 1024, 1024, 1024, 1024, 1024]
    - [28, 11192.0]
  - - [1024, 3447, 1, 4096, 1024, 1024, 4096, 4096]
    - [14, 11054.0]
  - - [1024, 3969, 1, 4096, 1024, 1024, 4096, 4096]
    - [14, 10962.0]
  - - [4096, 3527, 1, 1024, 4096, 4096, 1024, 1024]
    - [12, 11907.0]
  - - [4096, 3336, 1, 1024, 4096, 4096, 1024, 1024]
    - [12, 11584.0]
  - - [1024, 3191, 1, 4096, 1024, 1024, 4096, 4096]
    - [28, 11093.0]
  - - [1024, 3302, 1, 4096, 1024, 1024, 4096, 4096]
    - [47, 10704.0]
  - - [1024, 3337, 1, 4096, 1024, 1024, 4096, 4096]
    - [14, 10730.0]
  - - [4096, 3290, 1, 1024, 4096, 4096, 1024, 1024]
    - [14, 11910.0]
  - - [1024, 3512, 1, 4096, 1024, 1024, 4096, 4096]
    - [14, 11253.0]
  - - [1024, 3433, 1, 4096, 1024, 1024, 4096, 4096]
    - [30, 10992.0]
  - - [4096, 3876, 1, 1024, 4096, 4096, 1024, 1024]
    - [12, 11814.0]
  - - [4096, 3490, 1, 1024, 4096, 4096, 1024, 1024]
    - [12, 11807.0]
  - - [4096, 3064, 1, 1024, 4096, 4096, 1024, 1024]
    - [12, 11934.0]
  - - [1024, 3508, 1, 4096, 1024, 1024, 4096, 4096]
    - [30, 11222.0]
  - - [1024, 3956, 1, 4096, 1024, 1024, 4096, 4096]
    - [14, 10925.0]
  - - [4096, 3417, 1, 1024, 4096, 4096, 1024, 1024]
    - [12, 11839.0]
  - - [1024, 3248, 1, 4096, 1024, 1024, 4096, 4096]
    - [12, 10334.0]
  - - [1024, 2499, 1, 4096, 1024, 1024, 4096, 4096]
    - [30, 11847.0]
  - - [1024, 3186, 1, 4096, 1024, 1024, 4096, 4096]
    - [12, 11103.0]
  - - [1024, 3180, 1, 4096, 1024, 1024, 4096, 4096]
    - [28, 11012.0]
  - - [4096, 3364, 1, 1024, 4096, 4096, 1024, 1024]
    - [12, 11662.0]
  - - [4096, 3976, 1, 1024, 4096, 4096, 1024, 1024]
    - [12, 11689.0]
  - - [4096, 3205, 1, 1024, 4096, 4096, 1024, 1024]
    - [14, 11623.0]
  - - [4096, 3318, 1, 1024, 4096, 4096, 1024, 1024]
    - [14, 12010.0]
  - - [1024, 3377, 1, 4096, 1024, 1024, 4096, 4096]
    - [28, 10914.0]
  - - [1024, 3485, 1, 4096, 1024, 1024, 4096, 4096]
    - [14, 11145.0]
  - - [4096, 3181, 1, 1024, 4096, 4096, 1024, 1024]
    - [12, 12024.0]
  - - [4096, 3550, 1, 1024, 4096, 4096, 1024, 1024]
    - [12, 11985.0]
  - - [1024, 3534, 1, 4096, 1024, 1024, 4096, 4096]
    - [30, 11178.0]
  - - [1024, 3860, 1, 1024, 1024, 1024, 1024, 1024]
    - [28, 10956.0]
  - - [160, 160, 400, 64, 160, 160, 64, 64]
    - [16, 5535.0]
  - - [4096, 3445, 1, 1024, 4096, 4096, 1024, 1024]
    - [12, 11947.0]
  - - [1024, 3391, 1, 4096, 1024, 1024, 4096, 4096]
    - [14, 10868.0]
  - - [1024, 3221, 1, 4096, 1024, 1024, 4096, 4096]
    - [12, 10535.0]
  - - [4096, 3079, 1, 1024, 4096, 4096, 1024, 1024]
    - [12, 11649.0]
  - - [4096, 3144, 1, 1024, 4096, 4096, 1024, 1024]
    - [12, 11891.0]
  - - [1024, 3270, 1, 4096, 1024, 1024, 4096, 4096]
    - [28, 10544.0]
  - - [1024, 3561, 1, 4096, 1024, 1024, 4096, 4096]
    - [30, 11348.0]
  - - [1024, 3480, 1, 4096, 1024, 1024, 4096, 4096]
    - [30, 11132.0]
  - - [4096, 3408, 1, 1024, 4096, 4096, 1024, 1024]
    - [12, 11817.0]
  - - [1024, 3418, 1, 4096, 1024, 1024, 4096, 4096]
    - [28, 10990.0]
  - - [4096, 3298, 1, 1024, 4096, 4096, 1024, 1024]
    - [14, 11936.0]
  - - [1024, 3640, 1, 1024, 1024, 1024, 1024, 1024]
    - [30, 11132.0]
  - - [1024, 3449, 1, 4096, 1024, 1024, 4096, 4096]
    - [14, 11058.0]
  - - [1024, 4020, 1, 4096, 1024, 1024, 4096, 4096]
    - [30, 11043.0]
  - - [4096, 3481, 1, 1024, 4096, 4096, 1024, 1024]
    - [12, 11768.0]
  - - [4096, 3530, 1, 1024, 4096, 4096, 1024, 1024]
    - [12, 11928.0]
  - - [1024, 3216, 1, 4096, 1024, 1024, 4096, 4096]
    - [14, 10035.0]
  - - [1024, 3491, 1, 4096, 1024, 1024, 4096, 4096]
    - [14, 11172.0]
  - - [1024, 3154, 1, 4096, 1024, 1024, 4096, 4096]
    - [12, 10906.0]
  - - [4096, 3425, 1, 1024, 4096, 4096, 1024, 1024]
    - [12, 11866.0]
  - - [1024, 3348, 1, 4096, 1024, 1024, 4096, 4096]
    - [28, 10788.0]
  - - [1024, 3415, 1, 4096, 1024, 1024, 4096, 4096]
    - [14, 10935.0]
  - - [1024, 4026, 1, 1024, 1024, 1024, 1024, 1024]
    - [28, 11372.0]
  - - [1024, 3367, 1, 4096, 1024, 1024, 4096, 4096]
    - [14, 10801.0]
  - - [1024, 3259, 1, 4096, 1024, 1024, 4096, 4096]
    - [28, 10329.0]
  - - [1024, 3894, 1, 4096, 1024, 1024, 4096, 4096]
    - [30, 10713.0]
  - - [4096, 3355, 1, 1024, 4096, 4096, 1024, 1024]
    - [12, 11626.0]
  - - [4096, 3404, 1, 1024, 4096, 4096, 1024, 1024]
    - [12, 11805.0]
  - - [1024, 3308, 1, 4096, 1024, 1024, 4096, 4096]
    - [12, 10539.0]
  - - [4096, 3245, 1, 1024, 4096, 4096, 1024, 1024]
    - [12, 11761.0]
  - - [1024, 3502, 1, 4096, 1024, 1024, 4096, 4096]
    - [14, 11146.0]
  - - [33708, 4032, 1, 1024, 33708, 33708, 1024, 1024]
    - [30, 12154.0]
  - - [1024, 3424, 1, 4096, 1024, 1024, 4096, 4096]
    - [30, 10937.0]
  - - [4096, 3509, 1, 1024, 4096, 4096, 1024, 1024]
    - [12, 11861.0]
  - - [4096, 3558, 1, 1024, 4096, 4096, 1024, 1024]
    - [12, 12030.0]
  - - [1024, 3900, 1, 1024, 1024, 1024, 1024, 1024]
    - [28, 11126.0]
  - - [1024, 2505, 1, 4096, 1024, 1024, 4096, 4096]
    - [30, 11856.0]
  - - [4096, 3472, 1, 1024, 4096, 4096, 1024, 1024]
    - [12, 11749.0]
  - - [1024, 3386, 1, 4096, 1024, 1024, 4096, 4096]
    - [30, 10832.0]
  - - [4096, 3383, 1, 1024, 4096, 4096, 1024, 1024]
    - [12, 11727.0]
  - - [4096, 3448, 1, 1024, 4096, 4096, 1024, 1024]
    - [12, 11946.0]
  - - [4096, 4030, 1, 1024, 4096, 4096, 1024, 1024]
    - [12, 11844.0]
  - - [4096, 3289, 1, 1024, 4096, 4096, 1024, 1024]
    - [14, 11923.0]
  - - [1024, 3459, 1, 4096, 1024, 1024, 4096, 4096]
    - [30, 11072.0]
  - - [1024, 2918, 1, 4096, 1024, 1024, 4096, 4096]
    - [30, 11167.0]
  - - [4096, 3489, 1, 1024, 4096, 4096, 1024, 1024]
    - [12, 11800.0]
  - - [4096, 3346, 1, 1024, 4096, 4096, 1024, 1024]
    - [12, 11607.0]
  - - [4096, 3572, 1, 1024, 4096, 4096, 1024, 1024]
    - [12, 12071.0]
  - - [1024, 3955, 1, 4096, 1024, 1024, 4096, 4096]
    - [30, 10856.0]
  - - [4096, 3236, 1, 1024, 4096, 4096, 1024, 1024]
    - [12, 11724.0]
  - - [4096, 3163, 1, 1024, 4096, 4096, 1024, 1024]
    - [12, 11989.0]
  - - [4096, 3468, 1, 1024, 4096, 4096, 1024, 1024]
    - [12, 11734.0]
  - - [1024, 3165, 1, 4096, 1024, 1024, 4096, 4096]
    - [12, 10746.0]
  - - [1024, 3276, 1, 4096, 1024, 1024, 4096, 4096]
    - [28, 10631.0]
  - - [1024, 3359, 1, 4096, 1024, 1024, 4096, 4096]
    - [14, 10784.0]
  - - [4096, 3363, 1, 1024, 4096, 4096, 1024, 1024]
    - [12, 11645.0]
  - - [1024, 3385, 1, 4096, 1024, 1024, 4096, 4096]
    - [28, 10843.0]
  - - [1024, 3207, 1, 4096, 1024, 1024, 4096, 4096]
    - [28, 10187.0]
  - - [1024, 3458, 1, 4096, 1024, 1024, 4096, 4096]
    - [14, 11091.0]
  - - [4096, 3110, 1, 1024, 4096, 4096, 1024, 1024]
    - [12, 11781.0]
  - - [4096, 3925, 1, 1024, 4096, 4096, 1024, 1024]
    - [12, 11960.0]
  - - [1024, 3975, 1, 4096, 1024, 1024, 4096, 4096]
    - [30, 10926.0]
  - - [4096, 3549, 1, 1024, 4096, 4096, 1024, 1024]
    - [12, 11986.0]
  - - [4096, 3342, 1, 1024, 4096, 4096, 1024, 1024]
    - [12, 11582.0]
  - - [1024, 3859, 1, 1024, 1024, 1024, 1024, 1024]
    - [28, 10963.0]
  - - [1024, 3497, 1, 4096, 1024, 1024, 4096, 4096]
    - [14, 11192.0]
  - - [4096, 3280, 1, 1024, 4096, 4096, 1024, 1024]
    - [12, 11881.0]
  - - [1024, 3435, 1, 4096, 1024, 1024, 4096, 4096]
    - [30, 10999.0]
  - - [1024, 3354, 1, 4096, 1024, 1024, 4096, 4096]
    - [30, 10765.0]
  - - [4096, 3191, 1, 1024, 4096, 4096, 1024, 1024]
    - [12, 12106.0]
  - - [4096, 3512, 1, 1024, 4096, 4096, 1024, 1024]
    - [12, 11884.0]
  - - [1024, 3055, 1, 4096, 1024, 1024, 4096, 4096]
    - [14, 11649.0]
  - - [4096, 2499, 1, 1024, 4096, 4096, 1024, 1024]
    - [14, 11847.0]
  - - [1024, 3233, 1, 4096, 1024, 1024, 4096, 4096]
    - [28, 10576.0]
  - - [4096, 3423, 1, 1024, 4096, 4096, 1024, 1024]
    - [12, 11874.0]
  - - [1024, 3319, 1, 4096, 1024, 1024, 4096, 4096]
    - [28, 10663.0]
  - - [4096, 3297, 1, 1024, 4096, 4096, 1024, 1024]
    - [12, 11927.0]
  - - [4096, 3154, 1, 1024, 4096, 4096, 1024, 1024]
    - [12, 11953.0]
  - - [1024, 3540, 1, 4096, 1024, 1024, 4096, 4096]
    - [30, 11313.0]
  - - [1024, 3289, 1, 4096, 1024, 1024, 4096, 4096]
    - [28, 10490.0]
  - - [4096, 3529, 1, 1024, 4096, 4096, 1024, 1024]
    - [12, 11932.0]
  - - [4096, 3386, 1, 1024, 4096, 4096, 1024, 1024]
    - [12, 11754.0]
  - - [4096, 3276, 1, 1024, 4096, 4096, 1024, 1024]
    - [12, 11868.0]
  - - [1024, 3244, 1, 4096, 1024, 1024, 4096, 4096]
    - [28, 10382.0]
  - - [1024, 3182, 1, 4096, 1024, 1024, 4096, 4096]
    - [12, 11056.0]
  - - [4096, 3540, 1, 1024, 4096, 4096, 1024, 1024]
    - [12, 11969.0]
  - - [1024, 3360, 1, 4096, 1024, 1024, 4096, 4096]
    - [30, 10767.0]
  - - [1024, 3942, 1, 4096, 1024, 1024, 4096, 4096]
    - [30, 10817.0]
  - - [4096, 3403, 1, 1024, 4096, 4096, 1024, 1024]
    - [12, 11808.0]
  - - [4096, 3101, 1, 1024, 4096, 4096, 1024, 1024]
    - [12, 11764.0]
  - - [4096, 2918, 1, 1024, 4096, 4096, 1024, 1024]
    - [12, 11964.0]
  - - [1024, 3465, 1, 4096, 1024, 1024, 4096, 4096]
    - [14, 11099.0]
  - - [33708, 3780, 1, 1024, 33708, 33708, 1024, 1024]
    - [30, 12156.0]
  - - [4096, 3557, 1, 1024, 4096, 4096, 1024, 1024]
    - [12, 12008.0]
  - - [4096, 3414, 1, 1024, 4096, 4096, 1024, 1024]
    - [12, 11835.0]
  - - [1024, 3948, 1, 1024, 1024, 1024, 1024, 1024]
    - [28, 11210.0]
  - - [4096, 3320, 1, 1024, 4096, 4096, 1024, 1024]
    - [14, 12021.0]
  - - [4096, 2765, 1, 1024, 4096, 4096, 1024, 1024]
    - [12, 11691.0]
  - - [1024, 3978, 1, 4096, 1024, 1024, 4096, 4096]
    - [14, 10893.0]
  - - [4096, 3487, 1, 1024, 4096, 4096, 1024, 1024]
    - [12, 11776.0]
  - - [4096, 3520, 1, 1024, 4096, 4096, 1024, 1024]
    - [12, 11900.0]
  - - [1024, 3139, 1, 4096, 1024, 1024, 4096, 4096]
    - [28, 10671.0]
  - - [1024, 3314, 1, 4096, 1024, 1024, 4096, 4096]
    - [28, 10678.0]
  - - [4096, 3431, 1, 1024, 4096, 4096, 1024, 1024]
    - [12, 11900.0]
  - - [1024, 3446, 1, 4096, 1024, 1024, 4096, 4096]
    - [14, 11031.0]
  - - [1024, 4059, 1, 4096, 1024, 1024, 4096, 4096]
    - [30, 11118.0]
  - - [4096, 3345, 1, 1024, 4096, 4096, 1024, 1024]
    - [12, 11610.0]
  - - [4096, 3394, 1, 1024, 4096, 4096, 1024, 1024]
    - [12, 11785.0]
  - - [1024, 3927, 1, 1024, 1024, 1024, 1024, 1024]
    - [28, 11160.0]
  - - [4096, 3235, 1, 1024, 4096, 4096, 1024, 1024]
    - [12, 11724.0]
  - - [1024, 3328, 1, 4096, 1024, 1024, 4096, 4096]
    - [28, 10949.0]
  - - [33708, 3956, 1, 1024, 33708, 33708, 1024, 1024]
    - [47, 12213.0]
  - - [4096, 3467, 1, 1024, 4096, 4096, 1024, 1024]
    - [12, 11714.0]
  - - [1024, 3287, 1, 4096, 1024, 1024, 4096, 4096]
    - [28, 10607.0]
  - - [4096, 3214, 1, 1024, 4096, 4096, 1024, 1024]
    - [12, 11653.0]
  - - [4096, 3910, 1, 1024, 4096, 4096, 1024, 1024]
    - [12, 11909.0]
  - - [1024, 3780, 1, 1024, 1024, 1024, 1024, 1024]
    - [30, 11476.0]
  - - [1024, 3371, 1, 4096, 1024, 1024, 4096, 4096]
    - [28, 10866.0]
  - - [4096, 3478, 1, 1024, 4096, 4096, 1024, 1024]
    - [12, 11748.0]
  - - [1024, 3546, 1, 4096, 1024, 1024, 4096, 4096]
    - [14, 11323.0]
  - - [1024, 4012, 1, 1024, 1024, 1024, 1024, 1024]
    - [28, 11298.0]
  - - [4096, 3341, 1, 1024, 4096, 4096, 1024, 1024]
    - [12, 11594.0]
  - - [4096, 3454, 1, 1024, 4096, 4096, 1024, 1024]
    - [12, 11971.0]
  - - [4096, 3295, 1, 1024, 4096, 4096, 1024, 1024]
    - [14, 11929.0]
  - - [4096, 3072, 1, 1024, 4096, 4096, 1024, 1024]
    - [12, 12000.0]
  - - [1024, 3282, 1, 4096, 1024, 1024, 4096, 4096]
    - [12, 10529.0]
  - - [33708, 3720, 1, 1024, 33708, 33708, 1024, 1024]
    - [30, 11964.0]
  - - [1024, 3681, 1, 4096, 1024, 1024, 4096, 4096]
    - [30, 11691.0]
  - - [1024, 4050, 1, 4096, 1024, 1024, 4096, 4096]
    - [14, 11126.0]
  - - [4096, 3495, 1, 1024, 4096, 4096, 1024, 1024]
    - [12, 11715.0]
  - - [4096, 3560, 1, 1024, 4096, 4096, 1024, 1024]
    - [14, 11890.0]
  - - [4096, 3751, 1, 1024, 4096, 4096, 1024, 1024]
    - [14, 11899.0]
  - - [1024, 3414, 1, 4096, 1024, 1024, 4096, 4096]
    - [14, 10920.0]
  - - [33708, 3860, 1, 1024, 33708, 33708, 1024, 1024]
    - [47, 11815.0]
  - - [1024, 3325, 1, 4096, 1024, 1024, 4096, 4096]
    - [47, 10490.0]
  - - [4096, 3458, 1, 1024, 4096, 4096, 1024, 1024]
    - [12, 11588.0]
  - - [4096, 2967, 1, 1024, 4096, 4096, 1024, 1024]
    - [12, 11522.0]
  - - [1024, 3519, 1, 4096, 1024, 1024, 4096, 4096]
    - [30, 11263.0]
  - - [4096, 3385, 1, 1024, 4096, 4096, 1024, 1024]
    - [12, 11736.0]
  - - [4096, 3434, 1, 1024, 4096, 4096, 1024, 1024]
    - [12, 11905.0]
  - - [1024, 3552, 1, 4096, 1024, 1024, 4096, 4096]
    - [30, 11343.0]
  - - [4096, 3822, 1, 1024, 4096, 4096, 1024, 1024]
    - [14, 12104.0]
  - - [1024, 3544, 1, 4096, 1024, 1024, 4096, 4096]
    - [30, 11266.0]
  - - [4096, 3539, 1, 1024, 4096, 4096, 1024, 1024]
    - [12, 11868.0]
  - - [4096, 3332, 1, 1024, 4096, 4096, 1024, 1024]
    - [12, 11571.0]
  - - [1024, 3145, 1, 4096, 1024, 1024, 4096, 4096]
    - [47, 10797.0]
  - - [1024, 3535, 1, 4096, 1024, 1024, 4096, 4096]
    - [30, 11285.0]
  - - [1024, 3320, 1, 4096, 1024, 1024, 4096, 4096]
    - [28, 10798.0]
  - - [33708, 4012, 1, 1024, 33708, 33708, 1024, 1024]
    - [30, 12101.0]
  - - [4096, 3286, 1, 1024, 4096, 4096, 1024, 1024]
    - [14, 11866.0]
  - - [1024, 3514, 1, 4096, 1024, 1024, 4096, 4096]
    - [14, 11213.0]
  - - [1024, 2765, 1, 4096, 1024, 1024, 4096, 4096]
    - [12, 10716.0]
  - - [1024, 3452, 1, 4096, 1024, 1024, 4096, 4096]
    - [14, 11057.0]
  - - [4096, 3518, 1, 1024, 4096, 4096, 1024, 1024]
    - [12, 11902.0]
  - - [1024, 3529, 1, 4096, 1024, 1024, 4096, 4096]
    - [14, 11277.0]
  - - [4096, 3413, 1, 1024, 4096, 4096, 1024, 1024]
    - [12, 11838.0]
  - - [33708, 4050, 1, 1024, 33708, 33708, 1024, 1024]
    - [30, 12193.0]
  - - [1024, 3525, 1, 4096, 1024, 1024, 4096, 4096]
    - [30, 11249.0]
  - - [4096, 3303, 1, 1024, 4096, 4096, 1024, 1024]
    - [12, 11947.0]
  - - [1024, 3382, 1, 4096, 1024, 1024, 4096, 4096]
    - [30, 10826.0]
  - - [1024, 3390, 1, 4096, 1024, 1024, 4096, 4096]
    - [30, 10855.0]
  - - [1024, 3977, 1, 4096, 1024, 1024, 4096, 4096]
    - [30, 10858.0]
  - - [1024, 3184, 1, 4096, 1024, 1024, 4096, 4096]
    - [28, 10705.0]
  - - [4096, 3535, 1, 1024, 4096, 4096, 1024, 1024]
    - [12, 11939.0]
  - - [4096, 3376, 1, 1024, 4096, 4096, 1024, 1024]
    - [12, 11696.0]
  - - [4096, 3978, 1, 1024, 4096, 4096, 1024, 1024]
    - [12, 11683.0]
  - - [1024, 3136, 1, 4096, 1024, 1024, 4096, 4096]
    - [47, 10835.0]
  - - [1024, 3293, 1, 4096, 1024, 1024, 4096, 4096]
    - [28, 10568.0]
  - - [4096, 3266, 1, 1024, 4096, 4096, 1024, 1024]
    - [14, 11825.0]
  - - [1024, 3487, 1, 4096, 1024, 1024, 4096, 4096]
    - [14, 11158.0]
  - - [1024, 3409, 1, 4096, 1024, 1024, 4096, 4096]
    - [14, 10910.0]
  - - [4096, 3498, 1, 1024, 4096, 4096, 1024, 1024]
    - [12, 11825.0]
  - - [1024, 3520, 1, 4096, 1024, 1024, 4096, 4096]
    - [30, 11196.0]
  - - [1024, 3530, 1, 4096, 1024, 1024, 4096, 4096]
    - [30, 11157.0]
  - - [4096, 3393, 1, 1024, 4096, 4096, 1024, 1024]
    - [12, 11751.0]
  - - [4096, 3140, 1, 1024, 4096, 4096, 1024, 1024]
    - [12, 11901.0]
  - - [1024, 3536, 1, 4096, 1024, 1024, 4096, 4096]
    - [30, 11269.0]
  - - [1024, 3288, 1, 4096, 1024, 1024, 4096, 4096]
    - [28, 10572.0]
  - - [1024, 4005, 1, 4096, 1024, 1024, 4096, 4096]
    - [14, 11023.0]
  - - [1024, 3579, 1, 4096, 1024, 1024, 4096, 4096]
    - [30, 11397.0]
  - - [4096, 3372, 1, 1024, 4096, 4096, 1024, 1024]
    - [12, 11695.0]
  - - [1024, 3440, 1, 4096, 1024, 1024, 4096, 4096]
    - [30, 11011.0]
  - - [4096, 3213, 1, 1024, 4096, 4096, 1024, 1024]
    - [12, 11651.0]
  - - [4096, 3477, 1, 1024, 4096, 4096, 1024, 1024]
    - [12, 11752.0]
  - - [4096, 3526, 1, 1024, 4096, 4096, 1024, 1024]
    - [12, 11911.0]
  - - [1024, 3493, 1, 4096, 1024, 1024, 4096, 4096]
    - [14, 11175.0]
  - - [1024, 3944, 1, 4096, 1024, 1024, 4096, 4096]
    - [14, 10878.0]
  - - [4096, 3453, 1, 1024, 4096, 4096, 1024, 1024]
    - [12, 11949.0]
  - - [1024, 3350, 1, 4096, 1024, 1024, 4096, 4096]
    - [30, 10752.0]
  - - [4096, 3184, 1, 1024, 4096, 4096, 1024, 1024]
    - [12, 12068.0]
  - - [1024, 3423, 1, 4096, 1024, 1024, 4096, 4096]
    - [30, 10964.0]
  - - [4096, 3351, 1, 1024, 4096, 4096, 1024, 1024]
    - [12, 11606.0]
  - - [4096, 3416, 1, 1024, 4096, 4096, 1024, 1024]
    - [12, 11829.0]
  - - [1024, 3796, 1, 4096, 1024, 1024, 4096, 4096]
    - [14, 11970.0]
  - - [4096, 3257, 1, 1024, 4096, 4096, 1024, 1024]
    - [12, 11793.0]
  - - [4096, 3306, 1, 1024, 4096, 4096, 1024, 1024]
    - [14, 11963.0]
  - - [33708, 4020, 1, 1024, 33708, 33708, 1024, 1024]
    - [30, 12121.0]
  - - [1024, 3426, 1, 4096, 1024, 1024, 4096, 4096]
    - [30, 10959.0]
  - - [4096, 3457, 1, 1024, 4096, 4096, 1024, 1024]
    - [12, 11668.0]
  - - [1024, 2935, 1, 4096, 1024, 1024, 4096, 4096]
    - [14, 11199.0]
  - - [1024, 3046, 1, 4096, 1024, 1024, 4096, 4096]
    - [30, 11636.0]
  - - [4096, 3433, 1, 1024, 4096, 4096, 1024, 1024]
    - [12, 11891.0]
  - - [1024, 3256, 1, 4096, 1024, 1024, 4096, 4096]
    - [47, 10295.0]
  - - [1024, 3531, 1, 4096, 1024, 1024, 4096, 4096]
    - [30, 11139.0]
  - - [4096, 3180, 1, 1024, 4096, 4096, 1024, 1024]
    - [12, 12013.0]
  - - [1024, 3388, 1, 4096, 1024, 1024, 4096, 4096]
    - [14, 10837.0]
  - - [4096, 3444, 1, 1024, 4096, 4096, 1024, 1024]
    - [12, 11936.0]
  - - [1024, 3501, 1, 4096, 1024, 1024, 4096, 4096]
    - [14, 11169.0]
  - - [1024, 3266, 1, 4096, 1024, 1024, 4096, 4096]
    - [12, 10692.0]
  - - [1024, 3267, 1, 4096, 1024, 1024, 4096, 4096]
    - [49, 10431.0]
  - - [1024, 3461, 1, 4096, 1024, 1024, 4096, 4096]
    - [14, 11069.0]
  - - [4096, 3870, 1, 1024, 4096, 4096, 1024, 1024]
    - [12, 11786.0]
  - - [4096, 3517, 1, 1024, 4096, 4096, 1024, 1024]
    - [12, 11887.0]
  - - [1024, 3566, 1, 4096, 1024, 1024, 4096, 4096]
    - [30, 11333.0]
  - - [4096, 3574, 1, 1024, 4096, 4096, 1024, 1024]
    - [12, 12040.0]
  - - [1024, 3876, 1, 1024, 1024, 1024, 1024, 1024]
    - [28, 11045.0]
  - - [4096, 3720, 1, 1024, 4096, 4096, 1024, 1024]
    - [14, 11783.0]
  - - [4096, 3248, 1, 1024, 4096, 4096, 1024, 1024]
    - [14, 11765.0]
  - - [4096, 4059, 1, 1024, 4096, 4096, 1024, 1024]
    - [12, 11915.0]
  - - [1024, 3380, 1, 4096, 1024, 1024, 4096, 4096]
    - [30, 10818.0]
  - - [4096, 3480, 1, 1024, 4096, 4096, 1024, 1024]
    - [12, 11765.0]
  - - [1024, 3335, 1, 4096, 1024, 1024, 4096, 4096]
    - [14, 10700.0]
  - - [1024, 3345, 1, 4096, 1024, 1024, 4096, 4096]
    - [30, 10743.0]
  - - [4096, 3391, 1, 1024, 4096, 4096, 1024, 1024]
    - [12, 11761.0]
  - - [4096, 3424, 1, 1024, 4096, 4096, 1024, 1024]
    - [12, 11880.0]
  - - [1024, 3394, 1, 4096, 1024, 1024, 4096, 4096]
    - [14, 10857.0]
  - - [4096, 3265, 1, 1024, 4096, 4096, 1024, 1024]
    - [12, 11822.0]
  - - [1024, 3014, 1, 4096, 1024, 1024, 4096, 4096]
    - [30, 11520.0]
  - - [4096, 3497, 1, 1024, 4096, 4096, 1024, 1024]
    - [12, 11814.0]
  - - [4096, 3354, 1, 1024, 4096, 4096, 1024, 1024]
    - [12, 11626.0]
  - - [4096, 3055, 1, 1024, 4096, 4096, 1024, 1024]
    - [12, 11911.0]
  - - [1024, 3499, 1, 4096, 1024, 1024, 4096, 4096]
    - [30, 11164.0]
  - - [1024, 3162, 1, 4096, 1024, 1024, 4096, 4096]
    - [13, 10539.0]
  - - [4096, 3244, 1, 1024, 4096, 4096, 1024, 1024]
    - [12, 11748.0]
  - - [1024, 3437, 1, 4096, 1024, 1024, 4096, 4096]
    - [28, 11064.0]
  - - [1024, 3356, 1, 4096, 1024, 1024, 4096, 4096]
    - [14, 10762.0]
  - - [4096, 3139, 1, 1024, 4096, 4096, 1024, 1024]
    - [12, 11867.0]
  - - [4096, 3508, 1, 1024, 4096, 4096, 1024, 1024]
    - [12, 11856.0]
  - - [1024, 3235, 1, 4096, 1024, 1024, 4096, 4096]
    - [28, 10580.0]
  - - [1024, 3910, 1, 4096, 1024, 1024, 4096, 4096]
    - [30, 10697.0]
  - - [4096, 3371, 1, 1024, 4096, 4096, 1024, 1024]
    - [12, 11694.0]
  - - [1024, 3751, 1, 4096, 1024, 1024, 4096, 4096]
    - [30, 11832.0]
  - - [4096, 3325, 1, 1024, 4096, 4096, 1024, 1024]
    - [12, 12015.0]
  - - [1024, 3413, 1, 4096, 1024, 1024, 4096, 4096]
    - [14, 10924.0]
  - - [1024, 3542, 1, 4096, 1024, 1024, 4096, 4096]
    - [30, 11256.0]
  - - [33708, 3900, 1, 1024, 33708, 33708, 1024, 1024]
    - [47, 12042.0]
  - - [4096, 3525, 1, 1024, 4096, 4096, 1024, 1024]
    - [12, 11895.0]
  - - [4096, 3382, 1, 1024, 4096, 4096, 1024, 1024]
    - [12, 11724.0]
  - - [1024, 3339, 1, 4096, 1024, 1024, 4096, 4096]
    - [14, 10704.0]
  - - [4096, 3288, 1, 1024, 4096, 4096, 1024, 1024]
    - [12, 11894.0]
  - - [1024, 3141, 1, 4096, 1024, 1024, 4096, 4096]
    - [12, 10716.0]
  - - [1024, 3168, 1, 4096, 1024, 1024, 4096, 4096]
    - [28, 10812.0]
  - - [4096, 3488, 1, 1024, 4096, 4096, 1024, 1024]
    - [12, 11778.0]
  - - [4096, 3046, 1, 1024, 4096, 4096, 1024, 1024]
    - [12, 11880.0]
  - - [1024, 3362, 1, 4096, 1024, 1024, 4096, 4096]
    - [30, 10768.0]
  - - [33708, 3942, 1, 1024, 33708, 33708, 1024, 1024]
    - [47, 12159.0]
  - - [4096, 3399, 1, 1024, 4096, 4096, 1024, 1024]
    - [12, 11780.0]
  - - [1024, 3720, 1, 1024, 1024, 1024, 1024, 1024]
    - [30, 11321.0]
  - - [4096, 3563, 1, 1024, 4096, 4096, 1024, 1024]
    - [12, 12005.0]
  - - [1024, 3273, 1, 4096, 1024, 1024, 4096, 4096]
    - [28, 10365.0]
  - - [4096, 3162, 1, 1024, 4096, 4096, 1024, 1024]
    - [12, 11968.0]
  - - [1024, 3467, 1, 4096, 1024, 1024, 4096, 4096]
    - [14, 11061.0]
  - - [1024, 3130, 1, 4096, 1024, 1024, 4096, 4096]
    - [47, 10763.0]
  - - [1024, 3405, 1, 4096, 1024, 1024, 4096, 4096]
    - [14, 10899.0]
  - - [4096, 3362, 1, 1024, 4096, 4096, 1024, 1024]
    - [12, 11636.0]
  - - [1024, 3960, 1, 1024, 1024, 1024, 1024, 1024]
    - [28, 11207.0]
  - - [1024, 3712, 1, 36548, 1024, 1024, 36548, 36548]
    - [22, 11982.0]
  - - [1024, 3712, 1, 1024, 1024, 1024, 1024, 1024]
    - [12, 11403.0]
  - - [4032, 384, 1, 64, 4032, 4032, 64, 64]
    - [2, 8230.0]
  - - [1024, 2048, 1, 49, 1024, 1024, 49, 49]
    - [0, 7126.0]
  - - [4608, 512, 1, 49, 4608, 4608, 49, 49]
    - [18, 7697.0]
  - - [9216, 512, 1, 4096, 9216, 9216, 4096, 4096]
    - [49, 10648.0]
  - - [3456, 384, 1, 289, 3456, 3456, 289, 289]
    - [34, 9296.0]
  - - [3456, 384, 1, 169, 3456, 3456, 169, 169]
    - [34, 9066.0]
  - - [4096, 512, 1, 1001, 4096, 4096, 1001, 1001]
    - [35, 10904.0]
  - - [384, 448, 49, 512, 384, 384, 512, 512]
    - [47, 10156.0]
  - - [384, 448, 64, 256, 384, 384, 256, 256]
    - [28, 9972.0]
  - - [384, 448, 36, 256, 384, 384, 256, 256]
    - [38, 9794.0]
  - - [384, 448, 49, 256, 384, 384, 256, 256]
    - [12, 9942.0]
  - - [384, 448, 64, 512, 384, 384, 512, 512]
    - [28, 10228.0]
  - - [384, 448, 36, 512, 384, 384, 512, 512]
    - [47, 10151.0]
  - - [1024, 6400, 1, 65, 1024, 1024, 65, 65]
    - [0, 9437.0]
  - - [4096, 6400, 1, 256, 4096, 4096, 256, 256]
    - [12, 11978.0]
  - - [512, 3194, 1, 2048, 512, 512, 2048, 2048]
    - [47, 11107.0]
  - - [512, 3222, 1, 2048, 512, 512, 2048, 2048]
    - [49, 10015.0]
  - - [512, 3234, 1, 2048, 512, 512, 2048, 2048]
    - [49, 10054.0]
  - - [512, 3242, 1, 2048, 512, 512, 2048, 2048]
    - [30, 10112.0]
  - - [512, 3257, 1, 2048, 512, 512, 2048, 2048]
    - [30, 10131.0]
  - - [512, 3332, 1, 2048, 512, 512, 2048, 2048]
    - [14, 10355.0]
  - - [512, 3336, 1, 2048, 512, 512, 2048, 2048]
    - [49, 10385.0]
  - - [512, 3378, 1, 2048, 512, 512, 2048, 2048]
    - [49, 10501.0]
  - - [512, 3396, 1, 2048, 512, 512, 2048, 2048]
    - [49, 10550.0]
  - - [512, 3399, 1, 2048, 512, 512, 2048, 2048]
    - [30, 10567.0]
  - - [512, 3451, 1, 2048, 512, 512, 2048, 2048]
    - [49, 10731.0]
  - - [512, 3456, 1, 2048, 512, 512, 2048, 2048]
    - [30, 10732.0]
  - - [512, 3458, 1, 2048, 512, 512, 2048, 2048]
    - [14, 10707.0]
  - - [512, 3467, 1, 2048, 512, 512, 2048, 2048]
    - [30, 10763.0]
  - - [512, 3468, 1, 2048, 512, 512, 2048, 2048]
    - [49, 10746.0]
  - - [512, 3470, 1, 2048, 512, 512, 2048, 2048]
    - [30, 10787.0]
  - - [512, 3477, 1, 2048, 512, 512, 2048, 2048]
    - [30, 10778.0]
  - - [512, 3478, 1, 2048, 512, 512, 2048, 2048]
    - [30, 10810.0]
  - - [512, 3495, 1, 2048, 512, 512, 2048, 2048]
    - [49, 10846.0]
  - - [512, 3507, 1, 2048, 512, 512, 2048, 2048]
    - [30, 10886.0]
  - - [512, 3515, 1, 2048, 512, 512, 2048, 2048]
    - [30, 10913.0]
  - - [512, 3517, 1, 2048, 512, 512, 2048, 2048]
    - [49, 10889.0]
  - - [2048, 2864, 1, 512, 2048, 2048, 512, 512]
    - [12, 11094.0]
  - - [2048, 3287, 1, 512, 2048, 2048, 512, 512]
    - [12, 11540.0]
  - - [2048, 3412, 1, 512, 2048, 2048, 512, 512]
    - [12, 11496.0]
  - - [2048, 3456, 1, 512, 2048, 2048, 512, 512]
    - [12, 11719.0]
  - - [2048, 3466, 1, 512, 2048, 2048, 512, 512]
    - [12, 11225.0]
  - - [2048, 3476, 1, 512, 2048, 2048, 512, 512]
    - [28, 11266.0]
  - - [2048, 3999, 1, 512, 2048, 2048, 512, 512]
    - [12, 11470.0]
  - - [33708, 189, 1, 512, 33708, 33708, 512, 512]
    - [27, 9636.0]
  - - [33708, 2496, 1, 512, 33708, 33708, 512, 512]
    - [12, 11886.0]
  - - [33708, 3864, 1, 512, 33708, 33708, 512, 512]
    - [12, 11906.0]
  - - [33708, 3969, 1, 512, 33708, 33708, 512, 512]
    - [6, 11871.0]
  - - [33708, 3995, 1, 512, 33708, 33708, 512, 512]
    - [14, 11922.0]
  - - [134, 134, 240, 64, 134, 134, 64, 64]
    - [7, 3800.0]
  - - [135, 134, 240, 64, 135, 135, 64, 64]
    - [24, 3894.0]
  - - [135, 135, 240, 64, 135, 135, 64, 64]
    - [34, 3935.0]
  - - [512, 2790, 1, 2048, 512, 512, 2048, 2048]
    - [28, 9959.0]
  - - [512, 2864, 1, 2048, 512, 512, 2048, 2048]
    - [12, 10210.0]
  - - [512, 3092, 1, 2048, 512, 512, 2048, 2048]
    - [12, 10772.0]
  - - [512, 3113, 1, 2048, 512, 512, 2048, 2048]
    - [12, 11036.0]
  - - [512, 3137, 1, 2048, 512, 512, 2048, 2048]
    - [28, 11111.0]
  - - [512, 3165, 1, 2048, 512, 512, 2048, 2048]
    - [12, 11213.0]
  - - [512, 3166, 1, 2048, 512, 512, 2048, 2048]
    - [47, 11214.0]
  - - [512, 3219, 1, 2048, 512, 512, 2048, 2048]
    - [49, 10009.0]
  - - [512, 3237, 1, 2048, 512, 512, 2048, 2048]
    - [49, 10056.0]
  - - [512, 3246, 1, 2048, 512, 512, 2048, 2048]
    - [30, 10080.0]
  - - [512, 3249, 1, 2048, 512, 512, 2048, 2048]
    - [49, 10132.0]
  - - [512, 3251, 1, 2048, 512, 512, 2048, 2048]
    - [49, 10131.0]
  - - [512, 3262, 1, 2048, 512, 512, 2048, 2048]
    - [49, 10173.0]
  - - [512, 3268, 1, 2048, 512, 512, 2048, 2048]
    - [49, 10178.0]
  - - [512, 3282, 1, 2048, 512, 512, 2048, 2048]
    - [49, 10203.0]
  - - [512, 3286, 1, 2048, 512, 512, 2048, 2048]
    - [49, 10200.0]
  - - [512, 3287, 1, 2048, 512, 512, 2048, 2048]
    - [30, 10231.0]
  - - [512, 3293, 1, 2048, 512, 512, 2048, 2048]
    - [49, 10242.0]
  - - [512, 3297, 1, 2048, 512, 512, 2048, 2048]
    - [49, 10237.0]
  - - [512, 3307, 1, 2048, 512, 512, 2048, 2048]
    - [30, 10274.0]
  - - [512, 3314, 1, 2048, 512, 512, 2048, 2048]
    - [49, 10279.0]
  - - [512, 3315, 1, 2048, 512, 512, 2048, 2048]
    - [49, 10285.0]
  - - [512, 3319, 1, 2048, 512, 512, 2048, 2048]
    - [49, 10308.0]
  - - [512, 3322, 1, 2048, 512, 512, 2048, 2048]
    - [14, 10308.0]
  - - [512, 3323, 1, 2048, 512, 512, 2048, 2048]
    - [14, 10333.0]
  - - [512, 3324, 1, 2048, 512, 512, 2048, 2048]
    - [30, 10308.0]
  - - [512, 3325, 1, 2048, 512, 512, 2048, 2048]
    - [14, 10329.0]
  - - [512, 3327, 1, 2048, 512, 512, 2048, 2048]
    - [30, 10321.0]
  - - [512, 3329, 1, 2048, 512, 512, 2048, 2048]
    - [49, 10370.0]
  - - [512, 3339, 1, 2048, 512, 512, 2048, 2048]
    - [49, 10400.0]
  - - [512, 3342, 1, 2048, 512, 512, 2048, 2048]
    - [30, 10438.0]
  - - [512, 3344, 1, 2048, 512, 512, 2048, 2048]
    - [49, 10399.0]
  - - [512, 3358, 1, 2048, 512, 512, 2048, 2048]
    - [30, 10456.0]
  - - [512, 3360, 1, 2048, 512, 512, 2048, 2048]
    - [30, 10466.0]
  - - [512, 3364, 1, 2048, 512, 512, 2048, 2048]
    - [30, 10478.0]
  - - [512, 3365, 1, 2048, 512, 512, 2048, 2048]
    - [30, 10465.0]
  - - [512, 3369, 1, 2048, 512, 512, 2048, 2048]
    - [49, 10483.0]
  - - [512, 3371, 1, 2048, 512, 512, 2048, 2048]
    - [30, 10494.0]
  - - [512, 3374, 1, 2048, 512, 512, 2048, 2048]
    - [30, 10506.0]
  - - [512, 3376, 1, 2048, 512, 512, 2048, 2048]
    - [14, 10486.0]
  - - [512, 3377, 1, 2048, 512, 512, 2048, 2048]
    - [49, 10498.0]
  - - [512, 3381, 1, 2048, 512, 512, 2048, 2048]
    - [49, 10503.0]
  - - [512, 3382, 1, 2048, 512, 512, 2048, 2048]
    - [30, 10519.0]
  - - [512, 3383, 1, 2048, 512, 512, 2048, 2048]
    - [49, 10529.0]
  - - [512, 3384, 1, 2048, 512, 512, 2048, 2048]
    - [14, 10519.0]
  - - [512, 3385, 1, 2048, 512, 512, 2048, 2048]
    - [14, 10524.0]
  - - [512, 3386, 1, 2048, 512, 512, 2048, 2048]
    - [14, 10541.0]
  - - [512, 3388, 1, 2048, 512, 512, 2048, 2048]
    - [30, 10529.0]
  - - [512, 3390, 1, 2048, 512, 512, 2048, 2048]
    - [49, 10546.0]
  - - [512, 3391, 1, 2048, 512, 512, 2048, 2048]
    - [30, 10533.0]
  - - [512, 3402, 1, 2048, 512, 512, 2048, 2048]
    - [49, 10583.0]
  - - [512, 3410, 1, 2048, 512, 512, 2048, 2048]
    - [49, 10588.0]
  - - [512, 3412, 1, 2048, 512, 512, 2048, 2048]
    - [30, 10605.0]
  - - [512, 3414, 1, 2048, 512, 512, 2048, 2048]
    - [14, 10621.0]
  - - [512, 3415, 1, 2048, 512, 512, 2048, 2048]
    - [30, 10601.0]
  - - [512, 3418, 1, 2048, 512, 512, 2048, 2048]
    - [49, 10617.0]
  - - [512, 3420, 1, 2048, 512, 512, 2048, 2048]
    - [30, 10646.0]
  - - [512, 3422, 1, 2048, 512, 512, 2048, 2048]
    - [30, 10641.0]
  - - [512, 3425, 1, 2048, 512, 512, 2048, 2048]
    - [30, 10649.0]
  - - [512, 3426, 1, 2048, 512, 512, 2048, 2048]
    - [49, 10670.0]
  - - [512, 3427, 1, 2048, 512, 512, 2048, 2048]
    - [14, 10649.0]
  - - [512, 3428, 1, 2048, 512, 512, 2048, 2048]
    - [49, 10660.0]
  - - [512, 3430, 1, 2048, 512, 512, 2048, 2048]
    - [30, 10671.0]
  - - [512, 3431, 1, 2048, 512, 512, 2048, 2048]
    - [14, 10660.0]
  - - [512, 3432, 1, 2048, 512, 512, 2048, 2048]
    - [30, 10687.0]
  - - [512, 3438, 1, 2048, 512, 512, 2048, 2048]
    - [30, 10663.0]
  - - [512, 3439, 1, 2048, 512, 512, 2048, 2048]
    - [30, 10685.0]
  - - [512, 3440, 1, 2048, 512, 512, 2048, 2048]
    - [30, 10700.0]
  - - [512, 3443, 1, 2048, 512, 512, 2048, 2048]
    - [30, 10722.0]
  - - [512, 3445, 1, 2048, 512, 512, 2048, 2048]
    - [14, 10694.0]
  - - [512, 3447, 1, 2048, 512, 512, 2048, 2048]
    - [14, 10711.0]
  - - [512, 3448, 1, 2048, 512, 512, 2048, 2048]
    - [49, 10715.0]
  - - [512, 3450, 1, 2048, 512, 512, 2048, 2048]
    - [14, 10719.0]
  - - [512, 3452, 1, 2048, 512, 512, 2048, 2048]
    - [49, 10712.0]
  - - [512, 3453, 1, 2048, 512, 512, 2048, 2048]
    - [30, 10727.0]
  - - [512, 3455, 1, 2048, 512, 512, 2048, 2048]
    - [30, 10712.0]
  - - [512, 3457, 1, 2048, 512, 512, 2048, 2048]
    - [49, 10741.0]
  - - [512, 3459, 1, 2048, 512, 512, 2048, 2048]
    - [30, 10740.0]
  - - [512, 3460, 1, 2048, 512, 512, 2048, 2048]
    - [49, 10733.0]
  - - [512, 3461, 1, 2048, 512, 512, 2048, 2048]
    - [30, 10752.0]
  - - [512, 3462, 1, 2048, 512, 512, 2048, 2048]
    - [49, 10770.0]
  - - [512, 3466, 1, 2048, 512, 512, 2048, 2048]
    - [14, 10747.0]
  - - [512, 3471, 1, 2048, 512, 512, 2048, 2048]
    - [30, 10785.0]
  - - [512, 3472, 1, 2048, 512, 512, 2048, 2048]
    - [14, 10765.0]
  - - [512, 3475, 1, 2048, 512, 512, 2048, 2048]
    - [49, 10790.0]
  - - [512, 3476, 1, 2048, 512, 512, 2048, 2048]
    - [30, 10797.0]
  - - [512, 3479, 1, 2048, 512, 512, 2048, 2048]
    - [30, 10778.0]
  - - [512, 3480, 1, 2048, 512, 512, 2048, 2048]
    - [14, 10800.0]
  - - [512, 3481, 1, 2048, 512, 512, 2048, 2048]
    - [49, 10836.0]
  - - [512, 3483, 1, 2048, 512, 512, 2048, 2048]
    - [14, 10823.0]
  - - [512, 3484, 1, 2048, 512, 512, 2048, 2048]
    - [14, 10815.0]
  - - [512, 3487, 1, 2048, 512, 512, 2048, 2048]
    - [30, 10807.0]
  - - [512, 3489, 1, 2048, 512, 512, 2048, 2048]
    - [49, 10855.0]
  - - [512, 3490, 1, 2048, 512, 512, 2048, 2048]
    - [49, 10790.0]
  - - [512, 3491, 1, 2048, 512, 512, 2048, 2048]
    - [30, 10839.0]
  - - [512, 3493, 1, 2048, 512, 512, 2048, 2048]
    - [30, 10840.0]
  - - [512, 3494, 1, 2048, 512, 512, 2048, 2048]
    - [49, 10853.0]
  - - [512, 3497, 1, 2048, 512, 512, 2048, 2048]
    - [30, 10858.0]
  - - [512, 3498, 1, 2048, 512, 512, 2048, 2048]
    - [49, 10849.0]
  - - [512, 3499, 1, 2048, 512, 512, 2048, 2048]
    - [49, 10856.0]
  - - [512, 3501, 1, 2048, 512, 512, 2048, 2048]
    - [30, 10839.0]
  - - [512, 3503, 1, 2048, 512, 512, 2048, 2048]
    - [30, 10889.0]
  - - [512, 3508, 1, 2048, 512, 512, 2048, 2048]
    - [49, 10897.0]
  - - [512, 3509, 1, 2048, 512, 512, 2048, 2048]
    - [30, 10896.0]
  - - [512, 3511, 1, 2048, 512, 512, 2048, 2048]
    - [49, 10871.0]
  - - [512, 3514, 1, 2048, 512, 512, 2048, 2048]
    - [30, 10891.0]
  - - [512, 3518, 1, 2048, 512, 512, 2048, 2048]
    - [49, 10894.0]
  - - [512, 3519, 1, 2048, 512, 512, 2048, 2048]
    - [49, 10916.0]
  - - [512, 3520, 1, 2048, 512, 512, 2048, 2048]
    - [30, 10914.0]
  - - [512, 3523, 1, 2048, 512, 512, 2048, 2048]
    - [30, 10884.0]
  - - [512, 3528, 1, 2048, 512, 512, 2048, 2048]
    - [49, 10831.0]
  - - [512, 3529, 1, 2048, 512, 512, 2048, 2048]
    - [30, 10932.0]
  - - [512, 3530, 1, 2048, 512, 512, 2048, 2048]
    - [49, 10928.0]
  - - [512, 3532, 1, 2048, 512, 512, 2048, 2048]
    - [30, 10922.0]
  - - [512, 3533, 1, 2048, 512, 512, 2048, 2048]
    - [49, 10918.0]
  - - [512, 3534, 1, 2048, 512, 512, 2048, 2048]
    - [49, 10947.0]
  - - [512, 3538, 1, 2048, 512, 512, 2048, 2048]
    - [49, 10973.0]
  - - [512, 3539, 1, 2048, 512, 512, 2048, 2048]
    - [49, 10980.0]
  - - [512, 3541, 1, 2048, 512, 512, 2048, 2048]
    - [49, 10985.0]
  - - [512, 3547, 1, 2048, 512, 512, 2048, 2048]
    - [49, 10966.0]
  - - [512, 3548, 1, 2048, 512, 512, 2048, 2048]
    - [30, 11000.0]
  - - [512, 3552, 1, 2048, 512, 512, 2048, 2048]
    - [49, 10998.0]
  - - [512, 3564, 1, 2048, 512, 512, 2048, 2048]
    - [30, 11026.0]
  - - [512, 3575, 1, 2048, 512, 512, 2048, 2048]
    - [30, 11077.0]
  - - [512, 3598, 1, 2048, 512, 512, 2048, 2048]
    - [30, 11123.0]
  - - [512, 3599, 1, 2048, 512, 512, 2048, 2048]
    - [49, 11139.0]
  - - [512, 3608, 1, 2048, 512, 512, 2048, 2048]
    - [14, 11171.0]
  - - [512, 3780, 1, 512, 512, 512, 512, 512]
    - [28, 10582.0]
  - - [512, 3780, 1, 2048, 512, 512, 2048, 2048]
    - [30, 11647.0]
  - - [512, 3796, 1, 512, 512, 512, 512, 512]
    - [30, 10661.0]
  - - [512, 3796, 1, 2048, 512, 512, 2048, 2048]
    - [14, 11705.0]
  - - [512, 3822, 1, 512, 512, 512, 512, 512]
    - [28, 10693.0]
  - - [512, 3822, 1, 2048, 512, 512, 2048, 2048]
    - [49, 11775.0]
  - - [512, 3840, 1, 512, 512, 512, 512, 512]
    - [12, 11143.0]
  - - [512, 3840, 1, 2048, 512, 512, 2048, 2048]
    - [14, 11911.0]
  - - [512, 3859, 1, 512, 512, 512, 512, 512]
    - [28, 9682.0]
  - - [512, 3859, 1, 2048, 512, 512, 2048, 2048]
    - [28, 10112.0]
  - - [512, 3870, 1, 512, 512, 512, 512, 512]
    - [25, 9755.0]
  - - [512, 3870, 1, 2048, 512, 512, 2048, 2048]
    - [28, 10180.0]
  - - [512, 3876, 1, 512, 512, 512, 512, 512]
    - [44, 9804.0]
  - - [512, 3876, 1, 2048, 512, 512, 2048, 2048]
    - [47, 10161.0]
  - - [512, 3906, 1, 512, 512, 512, 512, 512]
    - [25, 9834.0]
  - - [512, 3906, 1, 2048, 512, 512, 2048, 2048]
    - [28, 10230.0]
  - - [512, 3910, 1, 512, 512, 512, 512, 512]
    - [25, 9911.0]
  - - [512, 3910, 1, 2048, 512, 512, 2048, 2048]
    - [47, 10239.0]
  - - [512, 3925, 1, 512, 512, 512, 512, 512]
    - [47, 9854.0]
  - - [512, 3925, 1, 2048, 512, 512, 2048, 2048]
    - [28, 10284.0]
  - - [512, 3927, 1, 512, 512, 512, 512, 512]
    - [25, 9866.0]
  - - [512, 3942, 1, 512, 512, 512, 512, 512]
    - [47, 9893.0]
  - - [512, 3942, 1, 2048, 512, 512, 2048, 2048]
    - [47, 10360.0]
  - - [512, 3944, 1, 512, 512, 512, 512, 512]
    - [25, 9966.0]
  - - [512, 3944, 1, 2048, 512, 512, 2048, 2048]
    - [47, 10350.0]
  - - [512, 3955, 1, 512, 512, 512, 512, 512]
    - [47, 9887.0]
  - - [512, 3955, 1, 2048, 512, 512, 2048, 2048]
    - [12, 10348.0]
  - - [512, 3968, 1, 512, 512, 512, 512, 512]
    - [47, 10140.0]
  - - [512, 3968, 1, 2048, 512, 512, 2048, 2048]
    - [28, 10470.0]
  - - [512, 3969, 1, 512, 512, 512, 512, 512]
    - [28, 9958.0]
  - - [512, 3969, 1, 2048, 512, 512, 2048, 2048]
    - [47, 10420.0]
  - - [512, 3976, 1, 512, 512, 512, 512, 512]
    - [47, 9968.0]
  - - [512, 3976, 1, 2048, 512, 512, 2048, 2048]
    - [28, 10372.0]
  - - [512, 3977, 1, 512, 512, 512, 512, 512]
    - [47, 9973.0]
  - - [512, 3977, 1, 2048, 512, 512, 2048, 2048]
    - [28, 10397.0]
  - - [512, 3978, 1, 512, 512, 512, 512, 512]
    - [47, 10000.0]
  - - [512, 3978, 1, 2048, 512, 512, 2048, 2048]
    - [12, 10404.0]
  - - [512, 3990, 1, 512, 512, 512, 512, 512]
    - [28, 10032.0]
  - - [512, 3990, 1, 2048, 512, 512, 2048, 2048]
    - [28, 10428.0]
  - - [512, 3995, 1, 512, 512, 512, 512, 512]
    - [28, 10020.0]
  - - [512, 3995, 1, 2048, 512, 512, 2048, 2048]
    - [47, 10467.0]
  - - [512, 3996, 1, 512, 512, 512, 512, 512]
    - [47, 10121.0]
  - - [512, 3996, 1, 2048, 512, 512, 2048, 2048]
    - [12, 10447.0]
  - - [512, 3999, 1, 512, 512, 512, 512, 512]
    - [28, 9988.0]
  - - [512, 3999, 1, 2048, 512, 512, 2048, 2048]
    - [12, 10455.0]
  - - [512, 4005, 1, 512, 512, 512, 512, 512]
    - [47, 10068.0]
  - - [512, 4005, 1, 2048, 512, 512, 2048, 2048]
    - [28, 10467.0]
  - - [512, 4012, 1, 512, 512, 512, 512, 512]
    - [47, 10066.0]
  - - [512, 4012, 1, 2048, 512, 512, 2048, 2048]
    - [47, 10571.0]
  - - [512, 4020, 1, 512, 512, 512, 512, 512]
    - [25, 10046.0]
  - - [512, 4020, 1, 2048, 512, 512, 2048, 2048]
    - [12, 10512.0]
  - - [512, 4026, 1, 512, 512, 512, 512, 512]
    - [28, 10078.0]
  - - [512, 4026, 1, 2048, 512, 512, 2048, 2048]
    - [12, 10516.0]
  - - [512, 4030, 1, 512, 512, 512, 512, 512]
    - [47, 10162.0]
  - - [512, 4030, 1, 2048, 512, 512, 2048, 2048]
    - [12, 10532.0]
  - - [512, 4032, 1, 512, 512, 512, 512, 512]
    - [28, 10095.0]
  - - [512, 4032, 1, 2048, 512, 512, 2048, 2048]
    - [47, 10573.0]
  - - [512, 4050, 1, 512, 512, 512, 512, 512]
    - [25, 10212.0]
  - - [512, 4059, 1, 512, 512, 512, 512, 512]
    - [47, 10204.0]
  - - [2048, 2790, 1, 512, 2048, 2048, 512, 512]
    - [12, 11388.0]
  - - [2048, 3092, 1, 512, 2048, 2048, 512, 512]
    - [12, 11400.0]
  - - [2048, 3113, 1, 512, 2048, 2048, 512, 512]
    - [12, 11460.0]
  - - [2048, 3137, 1, 512, 2048, 2048, 512, 512]
    - [12, 11542.0]
  - - [2048, 3165, 1, 512, 2048, 2048, 512, 512]
    - [12, 11599.0]
  - - [2048, 3166, 1, 512, 2048, 2048, 512, 512]
    - [12, 11638.0]
  - - [2048, 3194, 1, 512, 2048, 2048, 512, 512]
    - [12, 11705.0]
  - - [2048, 3219, 1, 512, 2048, 2048, 512, 512]
    - [12, 11322.0]
  - - [2048, 3222, 1, 512, 2048, 2048, 512, 512]
    - [12, 11349.0]
  - - [2048, 3234, 1, 512, 2048, 2048, 512, 512]
    - [12, 11376.0]
  - - [2048, 3237, 1, 512, 2048, 2048, 512, 512]
    - [12, 11395.0]
  - - [2048, 3242, 1, 512, 2048, 2048, 512, 512]
    - [12, 11399.0]
  - - [2048, 3246, 1, 512, 2048, 2048, 512, 512]
    - [12, 11419.0]
  - - [2048, 3249, 1, 512, 2048, 2048, 512, 512]
    - [12, 11409.0]
  - - [2048, 3251, 1, 512, 2048, 2048, 512, 512]
    - [12, 11420.0]
  - - [2048, 3257, 1, 512, 2048, 2048, 512, 512]
    - [12, 11460.0]
  - - [2048, 3262, 1, 512, 2048, 2048, 512, 512]
    - [12, 11467.0]
  - - [2048, 3268, 1, 512, 2048, 2048, 512, 512]
    - [12, 11498.0]
  - - [2048, 3282, 1, 512, 2048, 2048, 512, 512]
    - [12, 11547.0]
  - - [2048, 3286, 1, 512, 2048, 2048, 512, 512]
    - [12, 11536.0]
  - - [2048, 3293, 1, 512, 2048, 2048, 512, 512]
    - [12, 11575.0]
  - - [2048, 3297, 1, 512, 2048, 2048, 512, 512]
    - [28, 11590.0]
  - - [2048, 3307, 1, 512, 2048, 2048, 512, 512]
    - [12, 11603.0]
  - - [2048, 3314, 1, 512, 2048, 2048, 512, 512]
    - [12, 11637.0]
  - - [2048, 3315, 1, 512, 2048, 2048, 512, 512]
    - [12, 11619.0]
  - - [2048, 3319, 1, 512, 2048, 2048, 512, 512]
    - [28, 11636.0]
  - - [2048, 3322, 1, 512, 2048, 2048, 512, 512]
    - [28, 11634.0]
  - - [2048, 3323, 1, 512, 2048, 2048, 512, 512]
    - [28, 11648.0]
  - - [2048, 3324, 1, 512, 2048, 2048, 512, 512]
    - [12, 11654.0]
  - - [2048, 3325, 1, 512, 2048, 2048, 512, 512]
    - [28, 11661.0]
  - - [2048, 3327, 1, 512, 2048, 2048, 512, 512]
    - [12, 11650.0]
  - - [2048, 3329, 1, 512, 2048, 2048, 512, 512]
    - [12, 11198.0]
  - - [2048, 3332, 1, 512, 2048, 2048, 512, 512]
    - [12, 11238.0]
  - - [2048, 3336, 1, 512, 2048, 2048, 512, 512]
    - [12, 11258.0]
  - - [2048, 3339, 1, 512, 2048, 2048, 512, 512]
    - [12, 11254.0]
  - - [2048, 3342, 1, 512, 2048, 2048, 512, 512]
    - [12, 11287.0]
  - - [2048, 3344, 1, 512, 2048, 2048, 512, 512]
    - [12, 11289.0]
  - - [2048, 3358, 1, 512, 2048, 2048, 512, 512]
    - [12, 11334.0]
  - - [2048, 3360, 1, 512, 2048, 2048, 512, 512]
    - [12, 11348.0]
  - - [2048, 3364, 1, 512, 2048, 2048, 512, 512]
    - [28, 11371.0]
  - - [2048, 3365, 1, 512, 2048, 2048, 512, 512]
    - [12, 11354.0]
  - - [2048, 3369, 1, 512, 2048, 2048, 512, 512]
    - [12, 11346.0]
  - - [2048, 3371, 1, 512, 2048, 2048, 512, 512]
    - [12, 11389.0]
  - - [2048, 3374, 1, 512, 2048, 2048, 512, 512]
    - [12, 11380.0]
  - - [2048, 3376, 1, 512, 2048, 2048, 512, 512]
    - [12, 11378.0]
  - - [2048, 3377, 1, 512, 2048, 2048, 512, 512]
    - [12, 11396.0]
  - - [2048, 3378, 1, 512, 2048, 2048, 512, 512]
    - [28, 11378.0]
  - - [2048, 3381, 1, 512, 2048, 2048, 512, 512]
    - [12, 11407.0]
  - - [2048, 3382, 1, 512, 2048, 2048, 512, 512]
    - [12, 11398.0]
  - - [2048, 3383, 1, 512, 2048, 2048, 512, 512]
    - [12, 11394.0]
  - - [2048, 3384, 1, 512, 2048, 2048, 512, 512]
    - [12, 11444.0]
  - - [2048, 3385, 1, 512, 2048, 2048, 512, 512]
    - [12, 11436.0]
  - - [2048, 3386, 1, 512, 2048, 2048, 512, 512]
    - [12, 11408.0]
  - - [2048, 3388, 1, 512, 2048, 2048, 512, 512]
    - [12, 11416.0]
  - - [2048, 3390, 1, 512, 2048, 2048, 512, 512]
    - [12, 11436.0]
  - - [2048, 3391, 1, 512, 2048, 2048, 512, 512]
    - [28, 11405.0]
  - - [2048, 3396, 1, 512, 2048, 2048, 512, 512]
    - [28, 11423.0]
  - - [2048, 3399, 1, 512, 2048, 2048, 512, 512]
    - [12, 11448.0]
  - - [2048, 3402, 1, 512, 2048, 2048, 512, 512]
    - [12, 11475.0]
  - - [2048, 3410, 1, 512, 2048, 2048, 512, 512]
    - [12, 11485.0]
  - - [2048, 3414, 1, 512, 2048, 2048, 512, 512]
    - [12, 11508.0]
  - - [2048, 3415, 1, 512, 2048, 2048, 512, 512]
    - [12, 11513.0]
  - - [2048, 3418, 1, 512, 2048, 2048, 512, 512]
    - [12, 11510.0]
  - - [2048, 3420, 1, 512, 2048, 2048, 512, 512]
    - [12, 11542.0]
  - - [2048, 3422, 1, 512, 2048, 2048, 512, 512]
    - [12, 11522.0]
  - - [2048, 3425, 1, 512, 2048, 2048, 512, 512]
    - [28, 11549.0]
  - - [2048, 3426, 1, 512, 2048, 2048, 512, 512]
    - [12, 11525.0]
  - - [2048, 3427, 1, 512, 2048, 2048, 512, 512]
    - [12, 11511.0]
  - - [2048, 3428, 1, 512, 2048, 2048, 512, 512]
    - [28, 11532.0]
  - - [2048, 3430, 1, 512, 2048, 2048, 512, 512]
    - [28, 11544.0]
  - - [2048, 3431, 1, 512, 2048, 2048, 512, 512]
    - [12, 11547.0]
  - - [2048, 3432, 1, 512, 2048, 2048, 512, 512]
    - [12, 11567.0]
  - - [2048, 3438, 1, 512, 2048, 2048, 512, 512]
    - [12, 11557.0]
  - - [2048, 3439, 1, 512, 2048, 2048, 512, 512]
    - [12, 11556.0]
  - - [2048, 3440, 1, 512, 2048, 2048, 512, 512]
    - [12, 11577.0]
  - - [2048, 3443, 1, 512, 2048, 2048, 512, 512]
    - [12, 11576.0]
  - - [2048, 3445, 1, 512, 2048, 2048, 512, 512]
    - [28, 11576.0]
  - - [2048, 3447, 1, 512, 2048, 2048, 512, 512]
    - [12, 11608.0]
  - - [2048, 3448, 1, 512, 2048, 2048, 512, 512]
    - [12, 11601.0]
  - - [2048, 3450, 1, 512, 2048, 2048, 512, 512]
    - [12, 11603.0]
  - - [2048, 3451, 1, 512, 2048, 2048, 512, 512]
    - [12, 11600.0]
  - - [2048, 3452, 1, 512, 2048, 2048, 512, 512]
    - [12, 11577.0]
  - - [2048, 3453, 1, 512, 2048, 2048, 512, 512]
    - [12, 11642.0]
  - - [2048, 3455, 1, 512, 2048, 2048, 512, 512]
    - [12, 11628.0]
  - - [2048, 3457, 1, 512, 2048, 2048, 512, 512]
    - [28, 11223.0]
  - - [2048, 3458, 1, 512, 2048, 2048, 512, 512]
    - [12, 11200.0]
  - - [2048, 3459, 1, 512, 2048, 2048, 512, 512]
    - [28, 11196.0]
  - - [2048, 3460, 1, 512, 2048, 2048, 512, 512]
    - [28, 11237.0]
  - - [2048, 3461, 1, 512, 2048, 2048, 512, 512]
    - [12, 11232.0]
  - - [2048, 3462, 1, 512, 2048, 2048, 512, 512]
    - [28, 11204.0]
  - - [2048, 3467, 1, 512, 2048, 2048, 512, 512]
    - [28, 11214.0]
  - - [2048, 3468, 1, 512, 2048, 2048, 512, 512]
    - [28, 11256.0]
  - - [2048, 3470, 1, 512, 2048, 2048, 512, 512]
    - [12, 11228.0]
  - - [2048, 3471, 1, 512, 2048, 2048, 512, 512]
    - [28, 11235.0]
  - - [2048, 3472, 1, 512, 2048, 2048, 512, 512]
    - [12, 11244.0]
  - - [2048, 3475, 1, 512, 2048, 2048, 512, 512]
    - [12, 11273.0]
  - - [2048, 3477, 1, 512, 2048, 2048, 512, 512]
    - [12, 11284.0]
  - - [2048, 3478, 1, 512, 2048, 2048, 512, 512]
    - [12, 11264.0]
  - - [2048, 3479, 1, 512, 2048, 2048, 512, 512]
    - [12, 11252.0]
  - - [2048, 3480, 1, 512, 2048, 2048, 512, 512]
    - [12, 11294.0]
  - - [2048, 3481, 1, 512, 2048, 2048, 512, 512]
    - [28, 11195.0]
  - - [2048, 3483, 1, 512, 2048, 2048, 512, 512]
    - [12, 11300.0]
  - - [2048, 3484, 1, 512, 2048, 2048, 512, 512]
    - [12, 11264.0]
  - - [2048, 3487, 1, 512, 2048, 2048, 512, 512]
    - [12, 11287.0]
  - - [2048, 3489, 1, 512, 2048, 2048, 512, 512]
    - [28, 11244.0]
  - - [2048, 3490, 1, 512, 2048, 2048, 512, 512]
    - [28, 11326.0]
  - - [2048, 3491, 1, 512, 2048, 2048, 512, 512]
    - [12, 11272.0]
  - - [2048, 3493, 1, 512, 2048, 2048, 512, 512]
    - [28, 11327.0]
  - - [2048, 3494, 1, 512, 2048, 2048, 512, 512]
    - [12, 11312.0]
  - - [2048, 3495, 1, 512, 2048, 2048, 512, 512]
    - [12, 11320.0]
  - - [2048, 3497, 1, 512, 2048, 2048, 512, 512]
    - [12, 11326.0]
  - - [2048, 3498, 1, 512, 2048, 2048, 512, 512]
    - [12, 11331.0]
  - - [2048, 3499, 1, 512, 2048, 2048, 512, 512]
    - [12, 11334.0]
  - - [2048, 3501, 1, 512, 2048, 2048, 512, 512]
    - [12, 11338.0]
  - - [2048, 3503, 1, 512, 2048, 2048, 512, 512]
    - [28, 11336.0]
  - - [2048, 3507, 1, 512, 2048, 2048, 512, 512]
    - [12, 11348.0]
  - - [2048, 3508, 1, 512, 2048, 2048, 512, 512]
    - [12, 11347.0]
  - - [2048, 3509, 1, 512, 2048, 2048, 512, 512]
    - [12, 11365.0]
  - - [2048, 3511, 1, 512, 2048, 2048, 512, 512]
    - [12, 11367.0]
  - - [2048, 3514, 1, 512, 2048, 2048, 512, 512]
    - [12, 11394.0]
  - - [2048, 3515, 1, 512, 2048, 2048, 512, 512]
    - [12, 11383.0]
  - - [2048, 3517, 1, 512, 2048, 2048, 512, 512]
    - [28, 11383.0]
  - - [2048, 3518, 1, 512, 2048, 2048, 512, 512]
    - [12, 11383.0]
  - - [2048, 3519, 1, 512, 2048, 2048, 512, 512]
    - [12, 11411.0]
  - - [2048, 3520, 1, 512, 2048, 2048, 512, 512]
    - [12, 11381.0]
  - - [2048, 3523, 1, 512, 2048, 2048, 512, 512]
    - [12, 11402.0]
  - - [2048, 3528, 1, 512, 2048, 2048, 512, 512]
    - [28, 11463.0]
  - - [2048, 3529, 1, 512, 2048, 2048, 512, 512]
    - [12, 11422.0]
  - - [2048, 3530, 1, 512, 2048, 2048, 512, 512]
    - [12, 11449.0]
  - - [2048, 3532, 1, 512, 2048, 2048, 512, 512]
    - [28, 11446.0]
  - - [2048, 3533, 1, 512, 2048, 2048, 512, 512]
    - [12, 11434.0]
  - - [2048, 3534, 1, 512, 2048, 2048, 512, 512]
    - [12, 11439.0]
  - - [2048, 3538, 1, 512, 2048, 2048, 512, 512]
    - [12, 11444.0]
  - - [2048, 3539, 1, 512, 2048, 2048, 512, 512]
    - [28, 11487.0]
  - - [2048, 3541, 1, 512, 2048, 2048, 512, 512]
    - [12, 11468.0]
  - - [2048, 3547, 1, 512, 2048, 2048, 512, 512]
    - [12, 11467.0]
  - - [2048, 3548, 1, 512, 2048, 2048, 512, 512]
    - [12, 11475.0]
  - - [2048, 3552, 1, 512, 2048, 2048, 512, 512]
    - [12, 11480.0]
  - - [2048, 3564, 1, 512, 2048, 2048, 512, 512]
    - [12, 11507.0]
  - - [2048, 3575, 1, 512, 2048, 2048, 512, 512]
    - [12, 11582.0]
  - - [2048, 3598, 1, 512, 2048, 2048, 512, 512]
    - [12, 11237.0]
  - - [2048, 3599, 1, 512, 2048, 2048, 512, 512]
    - [12, 11228.0]
  - - [2048, 3608, 1, 512, 2048, 2048, 512, 512]
    - [12, 11238.0]
  - - [2048, 3780, 1, 512, 2048, 2048, 512, 512]
    - [12, 11678.0]
  - - [2048, 3796, 1, 512, 2048, 2048, 512, 512]
    - [12, 11708.0]
  - - [2048, 3822, 1, 512, 2048, 2048, 512, 512]
    - [12, 11778.0]
  - - [2048, 3840, 1, 512, 2048, 2048, 512, 512]
    - [12, 11916.0]
  - - [2048, 3859, 1, 512, 2048, 2048, 512, 512]
    - [28, 11466.0]
  - - [2048, 3870, 1, 512, 2048, 2048, 512, 512]
    - [12, 11527.0]
  - - [2048, 3876, 1, 512, 2048, 2048, 512, 512]
    - [12, 11543.0]
  - - [2048, 3906, 1, 512, 2048, 2048, 512, 512]
    - [12, 11609.0]
  - - [2048, 3910, 1, 512, 2048, 2048, 512, 512]
    - [12, 11644.0]
  - - [2048, 3925, 1, 512, 2048, 2048, 512, 512]
    - [12, 11667.0]
  - - [2048, 3942, 1, 512, 2048, 2048, 512, 512]
    - [12, 11700.0]
  - - [2048, 3944, 1, 512, 2048, 2048, 512, 512]
    - [12, 11708.0]
  - - [2048, 3955, 1, 512, 2048, 2048, 512, 512]
    - [12, 11725.0]
  - - [2048, 3968, 1, 512, 2048, 2048, 512, 512]
    - [12, 11853.0]
  - - [2048, 3969, 1, 512, 2048, 2048, 512, 512]
    - [12, 11408.0]
  - - [2048, 3976, 1, 512, 2048, 2048, 512, 512]
    - [28, 11437.0]
  - - [2048, 3977, 1, 512, 2048, 2048, 512, 512]
    - [12, 11411.0]
  - - [2048, 3978, 1, 512, 2048, 2048, 512, 512]
    - [12, 11422.0]
  - - [2048, 3990, 1, 512, 2048, 2048, 512, 512]
    - [12, 11454.0]
  - - [2048, 3995, 1, 512, 2048, 2048, 512, 512]
    - [12, 11431.0]
  - - [2048, 3996, 1, 512, 2048, 2048, 512, 512]
    - [12, 11456.0]
  - - [2048, 4005, 1, 512, 2048, 2048, 512, 512]
    - [12, 11489.0]
  - - [2048, 4012, 1, 512, 2048, 2048, 512, 512]
    - [12, 11519.0]
  - - [2048, 4020, 1, 512, 2048, 2048, 512, 512]
    - [12, 11520.0]
  - - [2048, 4026, 1, 512, 2048, 2048, 512, 512]
    - [12, 11549.0]
  - - [2048, 4030, 1, 512, 2048, 2048, 512, 512]
    - [12, 11559.0]
  - - [2048, 4032, 1, 512, 2048, 2048, 512, 512]
    - [12, 11578.0]
  - - [33708, 184, 1, 512, 33708, 33708, 512, 512]
    - [46, 9386.0]
  - - [33708, 208, 1, 512, 33708, 33708, 512, 512]
    - [12, 9435.0]
  - - [33708, 246, 1, 512, 33708, 33708, 512, 512]
    - [28, 11089.0]
  - - [33708, 264, 1, 512, 33708, 33708, 512, 512]
    - [27, 8256.0]
  - - [33708, 465, 1, 512, 33708, 33708, 512, 512]
    - [12, 10867.0]
  - - [33708, 468, 1, 512, 33708, 33708, 512, 512]
    - [12, 10941.0]
  - - [33708, 493, 1, 512, 33708, 33708, 512, 512]
    - [28, 11502.0]
  - - [33708, 540, 1, 512, 33708, 33708, 512, 512]
    - [12, 10179.0]
  - - [33708, 550, 1, 512, 33708, 33708, 512, 512]
    - [28, 10380.0]
  - - [33708, 560, 1, 512, 33708, 33708, 512, 512]
    - [28, 10566.0]
  - - [33708, 644, 1, 512, 33708, 33708, 512, 512]
    - [12, 10107.0]
  - - [33708, 714, 1, 512, 33708, 33708, 512, 512]
    - [47, 11176.0]
  - - [33708, 720, 1, 512, 33708, 33708, 512, 512]
    - [12, 11275.0]
  - - [33708, 781, 1, 512, 33708, 33708, 512, 512]
    - [12, 10542.0]
  - - [33708, 936, 1, 512, 33708, 33708, 512, 512]
    - [12, 11080.0]
  - - [33708, 980, 1, 512, 33708, 33708, 512, 512]
    - [12, 11583.0]
  - - [33708, 1232, 1, 512, 33708, 33708, 512, 512]
    - [12, 11677.0]
  - - [33708, 1290, 1, 512, 33708, 33708, 512, 512]
    - [12, 11136.0]
  - - [33708, 1350, 1, 512, 33708, 33708, 512, 512]
    - [12, 11635.0]
  - - [33708, 1424, 1, 512, 33708, 33708, 512, 512]
    - [12, 11284.0]
  - - [33708, 1458, 1, 512, 33708, 33708, 512, 512]
    - [12, 11541.0]
  - - [33708, 1462, 1, 512, 33708, 33708, 512, 512]
    - [12, 11582.0]
  - - [33708, 1520, 1, 512, 33708, 33708, 512, 512]
    - [12, 12025.0]
  - - [33708, 1596, 1, 512, 33708, 33708, 512, 512]
    - [28, 11679.0]
  - - [33708, 1599, 1, 512, 33708, 33708, 512, 512]
    - [12, 11703.0]
  - - [33708, 1615, 1, 512, 33708, 33708, 512, 512]
    - [12, 11818.0]
  - - [33708, 1680, 1, 512, 33708, 33708, 512, 512]
    - [12, 11426.0]
  - - [33708, 1917, 1, 512, 33708, 33708, 512, 512]
    - [12, 12142.0]
  - - [33708, 2205, 1, 512, 33708, 33708, 512, 512]
    - [28, 11666.0]
  - - [33708, 2418, 1, 512, 33708, 33708, 512, 512]
    - [12, 12124.0]
  - - [33708, 3776, 1, 512, 33708, 33708, 512, 512]
    - [14, 12019.0]
  - - [33708, 3780, 1, 512, 33708, 33708, 512, 512]
    - [12, 12032.0]
  - - [33708, 3796, 1, 512, 33708, 33708, 512, 512]
    - [12, 12080.0]
  - - [33708, 3822, 1, 512, 33708, 33708, 512, 512]
    - [12, 12161.0]
  - - [33708, 3835, 1, 512, 33708, 33708, 512, 512]
    - [12, 12201.0]
  - - [33708, 3840, 1, 512, 33708, 33708, 512, 512]
    - [6, 12224.0]
  - - [33708, 3859, 1, 512, 33708, 33708, 512, 512]
    - [12, 11887.0]
  - - [33708, 3870, 1, 512, 33708, 33708, 512, 512]
    - [12, 11927.0]
  - - [33708, 3876, 1, 512, 33708, 33708, 512, 512]
    - [12, 11950.0]
  - - [33708, 3906, 1, 512, 33708, 33708, 512, 512]
    - [12, 12027.0]
  - - [33708, 3910, 1, 512, 33708, 33708, 512, 512]
    - [12, 12035.0]
  - - [33708, 3925, 1, 512, 33708, 33708, 512, 512]
    - [47, 12083.0]
  - - [33708, 3942, 1, 512, 33708, 33708, 512, 512]
    - [28, 12133.0]
  - - [33708, 3944, 1, 512, 33708, 33708, 512, 512]
    - [12, 12144.0]
  - - [33708, 3955, 1, 512, 33708, 33708, 512, 512]
    - [12, 12175.0]
  - - [33708, 3968, 1, 512, 33708, 33708, 512, 512]
    - [47, 12215.0]
  - - [33708, 3976, 1, 512, 33708, 33708, 512, 512]
    - [14, 11877.0]
  - - [33708, 3977, 1, 512, 33708, 33708, 512, 512]
    - [12, 11868.0]
  - - [33708, 3978, 1, 512, 33708, 33708, 512, 512]
    - [49, 11885.0]
  - - [33708, 3990, 1, 512, 33708, 33708, 512, 512]
    - [6, 11938.0]
  - - [33708, 3996, 1, 512, 33708, 33708, 512, 512]
    - [6, 11957.0]
  - - [33708, 3999, 1, 512, 33708, 33708, 512, 512]
    - [14, 11964.0]
  - - [33708, 4005, 1, 512, 33708, 33708, 512, 512]
    - [6, 11965.0]
  - - [33708, 4012, 1, 512, 33708, 33708, 512, 512]
    - [28, 9923.0]
  - - [33708, 4020, 1, 512, 33708, 33708, 512, 512]
    - [12, 9721.0]
  - - [33708, 4026, 1, 512, 33708, 33708, 512, 512]
    - [12, 9802.0]
  - - [33708, 4030, 1, 512, 33708, 33708, 512, 512]
    - [9, 10796.0]
  - - [33708, 4032, 1, 512, 33708, 33708, 512, 512]
    - [14, 10072.0]
  - - [3072, 512, 1, 3072, 3072, 3072, 3072, 3072]
    - [28, 10567.0]
  - - [511, 8192, 1, 8192, 511, 511, 8192, 8192]
    - [32, 6989.0]
  - - [4096, 4096, 1, 4096, 4096, 4096, 4096, 4096]
    - [38, 6821.0]
  - - [8192, 8193, 1, 8192, 8192, 8192, 8192, 8192]
    - [14, 10593.0]
  - - [3072, 3072, 1, 3071, 3072, 3072, 3071, 3071]
    - [22, 10584.0]
  - - [8192, 8192, 1, 8193, 8192, 8192, 8193, 8193]
    - [22, 12186.0]
  - - [7681, 8192, 1, 8192, 7681, 7681, 8192, 8192]
    - [14, 10328.0]
  - - [7680, 8192, 1, 8193, 7680, 7680, 8193, 8193]
    - [22, 12096.0]
  - - [513, 4096, 1, 4096, 513, 513, 4096, 4096]
    - [49, 8065.0]
  - - [3073, 512, 1, 3072, 3073, 3073, 3072, 3072]
    - [12, 10233.0]
  - - [7680, 8192, 1, 8192, 7680, 7680, 8192, 8192]
    - [14, 10699.0]
  - - [4096, 4096, 1, 4097, 4096, 4096, 4097, 4097]
    - [22, 11467.0]
  - - [8192, 8191, 1, 8192, 8192, 8192, 8192, 8192]
    - [14, 10787.0]
  - - [8192, 512, 1, 8193, 8192, 8192, 8193, 8193]
    - [40, 8611.0]
  - - [2880, 3071, 1, 3072, 2880, 2880, 3072, 3072]
    - [50, 8369.0]
  - - [2880, 3072, 1, 3072, 2880, 2880, 3072, 3072]
    - [50, 8278.0]
  - - [4096, 511, 1, 4096, 4096, 4096, 4096, 4096]
    - [28, 8280.0]
  - - [512, 3072, 1, 3072, 512, 512, 3072, 3072]
    - [28, 10548.0]
  - - [512, 8191, 1, 8192, 512, 512, 8192, 8192]
    - [50, 7350.0]
  - - [4096, 4095, 1, 4096, 4096, 4096, 4096, 4096]
    - [47, 7183.0]
  - - [8192, 511, 1, 8192, 8192, 8192, 8192, 8192]
    - [51, 6168.0]
  - - [8192, 512, 1, 8192, 8192, 8192, 8192, 8192]
    - [33, 6463.0]
  - - [511, 3072, 1, 3072, 511, 511, 3072, 3072]
    - [47, 10244.0]
  - - [7680, 8193, 1, 8192, 7680, 7680, 8192, 8192]
    - [14, 10466.0]
  - - [2048, 2048, 1, 2048, 2048, 2048, 2048, 2048]
    - [12, 11395.0]
  - - [3072, 512, 1, 3073, 3072, 3072, 3073, 3073]
    - [17, 11015.0]
  - - [513, 8192, 1, 8192, 513, 513, 8192, 8192]
    - [47, 6723.0]
  - - [7679, 8192, 1, 8192, 7679, 7679, 8192, 8192]
    - [49, 10647.0]
  - - [3840, 4096, 1, 4097, 3840, 3840, 4097, 4097]
    - [22, 11527.0]
  - - [512, 3072, 1, 3071, 512, 512, 3071, 3071]
    - [17, 10861.0]
  - - [7680, 8192, 1, 8191, 7680, 7680, 8191, 8191]
    - [22, 12149.0]
  - - [3072, 511, 1, 3072, 3072, 3072, 3072, 3072]
    - [28, 10379.0]
  - - [8193, 8192, 1, 8192, 8193, 8193, 8192, 8192]
    - [14, 10248.0]
  - - [512, 4096, 1, 4095, 512, 512, 4095, 4095]
    - [20, 10029.0]
  - - [512, 3071, 1, 3072, 512, 512, 3072, 3072]
    - [47, 10441.0]
  - - [3073, 3072, 1, 3072, 3073, 3073, 3072, 3072]
    - [50, 7909.0]
  - - [512, 3073, 1, 3072, 512, 512, 3072, 3072]
    - [28, 10044.0]
  - - [4096, 4096, 1, 4095, 4096, 4096, 4095, 4095]
    - [6, 11468.0]
  - - [1920, 2048, 1, 2047, 1920, 1920, 2047, 2047]
    - [17, 11962.0]
  - - [1920, 2049, 1, 2048, 1920, 1920, 2048, 2048]
    - [12, 10736.0]
  - - [512, 8192, 1, 8191, 512, 512, 8191, 8191]
    - [6, 8701.0]
  - - [3840, 4096, 1, 4096, 3840, 3840, 4096, 4096]
    - [50, 8974.0]
  - - [8191, 512, 1, 8192, 8191, 8191, 8192, 8192]
    - [51, 6298.0]
  - - [2881, 3072, 1, 3072, 2881, 2881, 3072, 3072]
    - [50, 8574.0]
  - - [512, 4096, 1, 4096, 512, 512, 4096, 4096]
    - [48, 8795.0]
  - - [3841, 4096, 1, 4096, 3841, 3841, 4096, 4096]
    - [38, 10285.0]
  - - [2880, 3072, 1, 3073, 2880, 2880, 3073, 3073]
    - [14, 10322.0]
  - - [4095, 512, 1, 4096, 4095, 4095, 4096, 4096]
    - [14, 8458.0]
  - - [1919, 2048, 1, 2048, 1919, 1919, 2048, 2048]
    - [12, 11552.0]
  - - [1920, 2048, 1, 2048, 1920, 1920, 2048, 2048]
    - [47, 11782.0]
  - - [8192, 8192, 1, 8192, 8192, 8192, 8192, 8192]
    - [14, 10839.0]
  - - [511, 4096, 1, 4096, 511, 511, 4096, 4096]
    - [29, 8354.0]
  - - [8192, 513, 1, 8192, 8192, 8192, 8192, 8192]
    - [41, 5886.0]
  - - [513, 3072, 1, 3072, 513, 513, 3072, 3072]
    - [30, 9180.0]
  - - [7680, 8191, 1, 8192, 7680, 7680, 8192, 8192]
    - [14, 10353.0]
  - - [512, 4097, 1, 4096, 512, 512, 4096, 4096]
    - [49, 8530.0]
  - - [2047, 2048, 1, 2048, 2047, 2047, 2048, 2048]
    - [12, 11353.0]
  - - [2049, 2048, 1, 2048, 2049, 2049, 2048, 2048]
    - [49, 11003.0]
  - - [3840, 4095, 1, 4096, 3840, 3840, 4096, 4096]
    - [47, 8442.0]
  - - [2880, 3072, 1, 3071, 2880, 2880, 3071, 3071]
    - [22, 10761.0]
  - - [3072, 3072, 1, 3073, 3072, 3072, 3073, 3073]
    - [4, 11942.0]
  - - [2880, 3073, 1, 3072, 2880, 2880, 3072, 3072]
    - [50, 7996.0]
  - - [4096, 513, 1, 4096, 4096, 4096, 4096, 4096]
    - [41, 7444.0]
  - - [4097, 512, 1, 4096, 4097, 4097, 4096, 4096]
    - [32, 8064.0]
  - - [8192, 512, 1, 8191, 8192, 8192, 8191, 8191]
    - [22, 8543.0]
  - - [1921, 2048, 1, 2048, 1921, 1921, 2048, 2048]
    - [12, 10687.0]
  - - [512, 3072, 1, 3073, 512, 512, 3073, 3073]
    - [17, 11037.0]
  - - [2048, 2049, 1, 2048, 2048, 2048, 2048, 2048]
    - [28, 10772.0]
  - - [3072, 512, 1, 3071, 3072, 3072, 3071, 3071]
    - [35, 11061.0]
  - - [3071, 3072, 1, 3072, 3071, 3071, 3072, 3072]
    - [32, 8181.0]
  - - [3840, 4097, 1, 4096, 3840, 3840, 4096, 4096]
    - [50, 8773.0]
  - - [2048, 2047, 1, 2048, 2048, 2048, 2048, 2048]
    - [28, 11240.0]
  - - [2879, 3072, 1, 3072, 2879, 2879, 3072, 3072]
    - [50, 8579.0]
  - - [3072, 513, 1, 3072, 3072, 3072, 3072, 3072]
    - [47, 8954.0]
  - - [512, 4095, 1, 4096, 512, 512, 4096, 4096]
    - [29, 8561.0]
  - - [3071, 512, 1, 3072, 3071, 3071, 3072, 3072]
    - [28, 10425.0]
  - - [4096, 512, 1, 4096, 4096, 4096, 4096, 4096]
    - [28, 8244.0]
  - - [4097, 4096, 1, 4096, 4097, 4097, 4096, 4096]
    - [47, 7921.0]
  - - [2048, 2048, 1, 2047, 2048, 2048, 2047, 2047]
    - [25, 11615.0]
  - - [3839, 4096, 1, 4096, 3839, 3839, 4096, 4096]
    - [50, 8854.0]
  - - [512, 4096, 1, 4097, 512, 512, 4097, 4097]
    - [38, 10051.0]
  - - [3072, 3073, 1, 3072, 3072, 3072, 3072, 3072]
    - [50, 7542.0]
  - - [2048, 2048, 1, 2049, 2048, 2048, 2049, 2049]
    - [35, 11496.0]
  - - [8191, 8192, 1, 8192, 8191, 8191, 8192, 8192]
    - [14, 10800.0]
  - - [3072, 3071, 1, 3072, 3072, 3072, 3072, 3072]
    - [50, 7785.0]
  - - [4096, 512, 1, 4097, 4096, 4096, 4097, 4097]
    - [20, 9982.0]
  - - [3840, 4096, 1, 4095, 3840, 3840, 4095, 4095]
    - [22, 11544.0]
  - - [1920, 2047, 1, 2048, 1920, 1920, 2048, 2048]
    - [47, 11504.0]
  - - [8192, 8192, 1, 8191, 8192, 8192, 8191, 8191]
    - [30, 12168.0]
  - - [3072, 3072, 1, 3072, 3072, 3072, 3072, 3072]
    - [32, 7855.0]
  - - [512, 8193, 1, 8192, 512, 512, 8192, 8192]
    - [50, 7539.0]
  - - [4096, 512, 1, 4095, 4096, 4096, 4095, 4095]
    - [20, 9947.0]
  - - [8193, 512, 1, 8192, 8193, 8193, 8192, 8192]
    - [33, 6444.0]
  - - [4095, 4096, 1, 4096, 4095, 4095, 4096, 4096]
    - [4, 6938.0]
  - - [4096, 4097, 1, 4096, 4096, 4096, 4096, 4096]
    - [29, 7267.0]
  - - [512, 8192, 1, 8192, 512, 512, 8192, 8192]
    - [32, 7354.0]
  - - [512, 8192, 1, 8193, 512, 512, 8193, 8193]
    - [6, 8537.0]
  - - [1920, 2048, 1, 2049, 1920, 1920, 2049, 2049]
    - [35, 11814.0]
  - - [479, 3072, 1, 3072, 479, 479, 3072, 3072]
    - [28, 9985.0]
  - - [479, 4096, 1, 4096, 479, 479, 4096, 4096]
    - [48, 8766.0]
  - - [479, 8192, 1, 8192, 479, 479, 8192, 8192]
    - [32, 7074.0]
  - - [480, 3072, 1, 3071, 480, 480, 3071, 3071]
    - [17, 10183.0]
  - - [480, 3072, 1, 3073, 480, 480, 3073, 3073]
    - [1, 10376.0]
  - - [480, 3073, 1, 3072, 480, 480, 3072, 3072]
    - [28, 10027.0]
  - - [480, 4095, 1, 4096, 480, 480, 4096, 4096]
    - [47, 8626.0]
  - - [480, 4096, 1, 4095, 480, 480, 4095, 4095]
    - [20, 9776.0]
  - - [480, 4096, 1, 4097, 480, 480, 4097, 4097]
    - [38, 9768.0]
  - - [480, 4097, 1, 4096, 480, 480, 4096, 4096]
    - [29, 8816.0]
  - - [480, 8191, 1, 8192, 480, 480, 8192, 8192]
    - [33, 6693.0]
  - - [480, 8192, 1, 8191, 480, 480, 8191, 8191]
    - [14, 8040.0]
  - - [480, 8192, 1, 8193, 480, 480, 8193, 8193]
    - [6, 8065.0]
  - - [480, 8193, 1, 8192, 480, 480, 8192, 8192]
    - [32, 6928.0]
  - - [481, 3072, 1, 3072, 481, 481, 3072, 3072]
    - [28, 9778.0]
  - - [481, 4096, 1, 4096, 481, 481, 4096, 4096]
    - [48, 8839.0]
  - - [481, 8192, 1, 8192, 481, 481, 8192, 8192]
    - [50, 6932.0]
  - - [3072, 479, 1, 3072, 3072, 3072, 3072, 3072]
    - [28, 9609.0]
  - - [3072, 480, 1, 3071, 3072, 3072, 3071, 3071]
    - [17, 10387.0]
  - - [3072, 480, 1, 3073, 3072, 3072, 3073, 3073]
    - [25, 10334.0]
  - - [3072, 481, 1, 3072, 3072, 3072, 3072, 3072]
    - [47, 10093.0]
  - - [3073, 480, 1, 3072, 3073, 3073, 3072, 3072]
    - [47, 10036.0]
  - - [480, 3072, 1, 3072, 480, 480, 3072, 3072]
    - [28, 10026.0]
  - - [480, 4096, 1, 4096, 480, 480, 4096, 4096]
    - [47, 8801.0]
  - - [480, 8192, 1, 8192, 480, 480, 8192, 8192]
    - [32, 6804.0]
  - - [3072, 480, 1, 3072, 3072, 3072, 3072, 3072]
    - [28, 9581.0]
  - - [4096, 480, 1, 4096, 4096, 4096, 4096, 4096]
    - [32, 7823.0]
  - - [8192, 480, 1, 8192, 8192, 8192, 8192, 8192]
    - [33, 6310.0]
  - - [1024, 3840, 1, 1024, 1024, 1024, 1024, 1024]
    - [14, 11050.0]
  - - [1024, 3840, 1, 4096, 1024, 1024, 4096, 4096]
    - [50, 8725.0]
  - - [1024, 3968, 1, 1024, 1024, 1024, 1024, 1024]
    - [12, 10486.0]
  - - [1024, 3968, 1, 4096, 1024, 1024, 4096, 4096]
    - [50, 8335.0]
  - - [1024, 7200, 1, 1024, 1024, 1024, 1024, 1024]
    - [12, 10795.0]
  - - [1024, 7200, 1, 4096, 1024, 1024, 4096, 4096]
    - [32, 7641.0]
  - - [1024, 8160, 1, 1024, 1024, 1024, 1024, 1024]
    - [28, 11058.0]
  - - [1024, 8160, 1, 4096, 1024, 1024, 4096, 4096]
    - [28, 8182.0]
  - - [1024, 9520, 1, 1024, 1024, 1024, 1024, 1024]
    - [12, 10407.0]
  - - [1024, 9520, 1, 4096, 1024, 1024, 4096, 4096]
    - [28, 8243.0]
  - - [1024, 10200, 1, 1024, 1024, 1024, 1024, 1024]
    - [12, 9389.0]
  - - [1024, 10200, 1, 4096, 1024, 1024, 4096, 4096]
    - [28, 8675.0]
  - - [4096, 3840, 1, 1024, 4096, 4096, 1024, 1024]
    - [12, 8698.0]
  - - [4096, 3968, 1, 1024, 4096, 4096, 1024, 1024]
    - [12, 8624.0]
  - - [4096, 7200, 1, 1024, 4096, 4096, 1024, 1024]
    - [12, 8963.0]
  - - [4096, 8160, 1, 1024, 4096, 4096, 1024, 1024]
    - [12, 9687.0]
  - - [4096, 9520, 1, 1024, 4096, 4096, 1024, 1024]
    - [12, 9772.0]
  - - [4096, 10200, 1, 1024, 4096, 4096, 1024, 1024]
    - [12, 9714.0]
  - - [42720, 3968, 1, 1024, 42720, 42720, 1024, 1024]
    - [28, 12248.0]
  - - [42720, 7200, 1, 1024, 42720, 42720, 1024, 1024]
    - [47, 12116.0]
  - - [42720, 9520, 1, 1024, 42720, 42720, 1024, 1024]
    - [47, 12197.0]
  - - [2048, 960, 1, 2048, 2048, 2048, 2048, 2048]
    - [12, 9980.0]
  - - [2048, 960, 1, 74, 2048, 2048, 74, 74]
    - [0, 8390.0]
  - - [1600, 1024, 1, 960, 1600, 1600, 960, 960]
    - [35, 9849.0]
  - - [2048, 2048, 1, 960, 2048, 2048, 960, 960]
    - [17, 11981.0]
  - - [4096, 1024, 1, 257, 4096, 4096, 257, 257]
    - [17, 11060.0]
  - - [10240, 8976, 1, 256, 10240, 10240, 256, 256]
    - [12, 11986.0]
  - - [1024, 1600, 1, 1024, 1024, 1024, 1024, 1024]
    - [11, 9635.0]
  - - [1024, 1600, 1, 560, 1024, 1024, 560, 560]
    - [34, 10548.0]
  - - [10496, 8976, 1, 256, 10496, 10496, 256, 256]
    - [12, 11990.0]
  - - [11264, 8976, 1, 256, 11264, 11264, 256, 256]
    - [12, 11999.0]
  - - [11776, 8976, 1, 256, 11776, 11776, 256, 256]
    - [20, 11998.0]
  - - [12544, 8976, 1, 256, 12544, 12544, 256, 256]
    - [12, 12007.0]
  - - [1280, 8976, 1, 256, 1280, 1280, 256, 256]
    - [20, 11429.0]
  - - [13312, 8976, 1, 256, 13312, 13312, 256, 256]
    - [12, 12009.0]
  - - [13568, 8976, 1, 256, 13568, 13568, 256, 256]
    - [12, 12012.0]
  - - [13824, 8976, 1, 256, 13824, 13824, 256, 256]
    - [12, 12018.0]
  - - [15104, 8976, 1, 256, 15104, 15104, 256, 256]
    - [20, 12024.0]
  - - [15360, 8976, 1, 256, 15360, 15360, 256, 256]
    - [12, 12027.0]
  - - [15872, 8976, 1, 256, 15872, 15872, 256, 256]
    - [20, 12023.0]
  - - [16128, 8976, 1, 256, 16128, 16128, 256, 256]
    - [12, 12026.0]
  - - [17152, 8976, 1, 256, 17152, 17152, 256, 256]
    - [20, 12028.0]
  - - [1792, 8976, 1, 256, 1792, 1792, 256, 256]
    - [20, 11667.0]
  - - [18176, 8976, 1, 256, 18176, 18176, 256, 256]
    - [20, 12031.0]
  - - [18688, 8976, 1, 256, 18688, 18688, 256, 256]
    - [20, 12034.0]
  - - [18944, 8976, 1, 256, 18944, 18944, 256, 256]
    - [20, 12033.0]
  - - [19712, 8976, 1, 256, 19712, 19712, 256, 256]
    - [20, 12031.0]
  - - [19968, 8976, 1, 256, 19968, 19968, 256, 256]
    - [12, 12033.0]
  - - [20480, 8976, 1, 256, 20480, 20480, 256, 256]
    - [12, 12027.0]
  - - [2048, 1536, 1, 512, 2048, 2048, 512, 512]
    - [12, 10982.0]
  - - [2048, 1536, 1, 768, 2048, 2048, 768, 768]
    - [30, 11308.0]
  - - [2048, 684, 1, 512, 2048, 2048, 512, 512]
    - [28, 9188.0]
  - - [2048, 684, 1, 768, 2048, 2048, 768, 768]
    - [28, 9427.0]
  - - [2048, 8976, 1, 256, 2048, 2048, 256, 256]
    - [20, 11643.0]
  - - [20992, 8976, 1, 256, 20992, 20992, 256, 256]
    - [12, 12035.0]
  - - [21248, 8976, 1, 256, 21248, 21248, 256, 256]
    - [12, 12035.0]
  - - [2304, 8976, 1, 256, 2304, 2304, 256, 256]
    - [28, 11778.0]
  - - [23552, 8976, 1, 256, 23552, 23552, 256, 256]
    - [12, 12039.0]
  - - [2560, 8976, 1, 256, 2560, 2560, 256, 256]
    - [28, 11791.0]
  - - [256, 10496, 1, 1024, 256, 256, 1024, 1024]
    - [28, 10674.0]
  - - [256, 11264, 1, 1024, 256, 256, 1024, 1024]
    - [12, 11473.0]
  - - [256, 11520, 1, 1024, 256, 256, 1024, 1024]
    - [12, 11714.0]
  - - [256, 11776, 1, 1024, 256, 256, 1024, 1024]
    - [49, 11029.0]
  - - [256, 12544, 1, 1024, 256, 256, 1024, 1024]
    - [49, 11672.0]
  - - [256, 13312, 1, 1024, 256, 256, 1024, 1024]
    - [47, 11186.0]
  - - [256, 14336, 1, 1024, 256, 256, 1024, 1024]
    - [49, 11267.0]
  - - [256, 14592, 1, 1024, 256, 256, 1024, 1024]
    - [49, 11413.0]
  - - [256, 14848, 1, 1024, 256, 256, 1024, 1024]
    - [30, 11579.0]
  - - [256, 15104, 1, 1024, 256, 256, 1024, 1024]
    - [49, 11753.0]
  - - [256, 16128, 1, 1024, 256, 256, 1024, 1024]
    - [12, 11545.0]
  - - [256, 18176, 1, 1024, 256, 256, 1024, 1024]
    - [47, 11327.0]
  - - [256, 18944, 1, 1024, 256, 256, 1024, 1024]
    - [47, 11725.0]
  - - [256, 19200, 1, 1024, 256, 256, 1024, 1024]
    - [47, 11865.0]
  - - [256, 20480, 1, 1024, 256, 256, 1024, 1024]
    - [49, 11875.0]
  - - [256, 20992, 1, 1024, 256, 256, 1024, 1024]
    - [47, 11519.0]
  - - [256, 21248, 1, 1024, 256, 256, 1024, 1024]
    - [28, 11605.0]
  - - [256, 21504, 1, 1024, 256, 256, 1024, 1024]
    - [47, 11711.0]
  - - [256, 22016, 1, 1024, 256, 256, 1024, 1024]
    - [49, 11550.0]
  - - [256, 22344, 1, 1024, 256, 256, 1024, 1024]
    - [49, 11589.0]
  - - [256, 23296, 1, 1024, 256, 256, 1024, 1024]
    - [47, 11524.0]
  - - [256, 23552, 1, 1024, 256, 256, 1024, 1024]
    - [47, 11611.0]
  - - [256, 31488, 1, 1024, 256, 256, 1024, 1024]
    - [47, 11809.0]
  - - [256, 33536, 1, 1024, 256, 256, 1024, 1024]
    - [47, 11729.0]
  - - [256, 44505, 1, 1024, 256, 256, 1024, 1024]
    - [47, 11919.0]
  - - [256, 4608, 1, 1024, 256, 256, 1024, 1024]
    - [30, 10268.0]
  - - [256, 4864, 1, 1024, 256, 256, 1024, 1024]
    - [49, 10977.0]
  - - [256, 5376, 1, 1024, 256, 256, 1024, 1024]
    - [47, 9607.0]
  - - [256, 5888, 1, 1024, 256, 256, 1024, 1024]
    - [28, 10453.0]
  - - [256, 6144, 1, 1024, 256, 256, 1024, 1024]
    - [47, 10871.0]
  - - [256, 6400, 1, 1024, 256, 256, 1024, 1024]
    - [47, 11260.0]
  - - [256, 6656, 1, 1024, 256, 256, 1024, 1024]
    - [30, 10224.0]
  - - [256, 7168, 1, 1024, 256, 256, 1024, 1024]
    - [30, 10948.0]
  - - [256, 7424, 1, 1024, 256, 256, 1024, 1024]
    - [49, 11236.0]
  - - [256, 7936, 1, 1024, 256, 256, 1024, 1024]
    - [47, 10348.0]
  - - [256, 8192, 1, 1024, 256, 256, 1024, 1024]
    - [28, 10641.0]
  - - [256, 8448, 1, 1024, 256, 256, 1024, 1024]
    - [47, 10963.0]
  - - [256, 8960, 1, 1024, 256, 256, 1024, 1024]
    - [47, 11561.0]
  - - [256, 9984, 1, 1024, 256, 256, 1024, 1024]
    - [49, 11497.0]
  - - [2816, 8976, 1, 256, 2816, 2816, 256, 256]
    - [28, 11755.0]
  - - [28672, 8976, 1, 256, 28672, 28672, 256, 256]
    - [12, 12036.0]
  - - [3072, 8976, 1, 256, 3072, 3072, 256, 256]
    - [12, 11771.0]
  - - [31488, 8976, 1, 256, 31488, 31488, 256, 256]
    - [20, 12039.0]
  - - [3328, 8976, 1, 256, 3328, 3328, 256, 256]
    - [12, 11817.0]
  - - [33536, 8976, 1, 256, 33536, 33536, 256, 256]
    - [12, 12041.0]
  - - [3840, 8976, 1, 256, 3840, 3840, 256, 256]
    - [12, 11867.0]
  - - [4096, 8976, 1, 256, 4096, 4096, 256, 256]
    - [12, 11859.0]
  - - [4352, 8976, 1, 256, 4352, 4352, 256, 256]
    - [12, 11896.0]
  - - [44505, 8976, 1, 256, 44505, 44505, 256, 256]
    - [20, 12013.0]
  - - [4608, 8976, 1, 256, 4608, 4608, 256, 256]
    - [12, 11910.0]
  - - [4864, 8976, 1, 256, 4864, 4864, 256, 256]
    - [12, 11911.0]
  - - [5120, 8976, 1, 256, 5120, 5120, 256, 256]
    - [4, 11824.0]
  - - [5376, 8976, 1, 256, 5376, 5376, 256, 256]
    - [12, 11919.0]
  - - [5632, 8976, 1, 256, 5632, 5632, 256, 256]
    - [12, 11918.0]
  - - [5888, 8976, 1, 256, 5888, 5888, 256, 256]
    - [12, 11928.0]
  - - [6144, 8976, 1, 256, 6144, 6144, 256, 256]
    - [12, 11936.0]
  - - [6400, 8976, 1, 256, 6400, 6400, 256, 256]
    - [12, 11941.0]
  - - [684, 8976, 1, 256, 684, 684, 256, 256]
    - [20, 9814.0]
  - - [7168, 8976, 1, 256, 7168, 7168, 256, 256]
    - [12, 11965.0]
  - - [7936, 8976, 1, 256, 7936, 7936, 256, 256]
    - [12, 11971.0]
  - - [8192, 8976, 1, 256, 8192, 8192, 256, 256]
    - [12, 11950.0]
  - - [8448, 8976, 1, 256, 8448, 8448, 256, 256]
    - [12, 11976.0]
  - - [8960, 8976, 1, 256, 8960, 8960, 256, 256]
    - [12, 11982.0]
  - - [9472, 8976, 1, 256, 9472, 9472, 256, 256]
    - [12, 11987.0]
  - - [9728, 8976, 1, 256, 9728, 9728, 256, 256]
    - [12, 11993.0]
  - - [9984, 8976, 1, 256, 9984, 9984, 256, 256]
    - [12, 11987.0]
  - - [512, 32768, 1, 13, 512, 512, 13, 13]
    - [1, 3272.0]
  - - [256, 32768, 1, 512, 256, 256, 512, 512]
    - [47, 11757.0]
  - - [128, 32768, 1, 512, 128, 128, 512, 512]
    - [28, 11450.0]
  - - [1024, 32768, 1, 479, 1024, 1024, 479, 479]
    - [25, 12199.0]
  - - [1024, 32768, 1, 1024, 1024, 1024, 1024, 1024]
    - [12, 12151.0]
  - - [512, 32768, 1, 1024, 512, 512, 1024, 1024]
    - [30, 12077.0]
  - - [1023, 2048, 1, 4096, 1023, 1023, 4096, 4096]
    - [12, 10562.0]
  - - [1025, 2048, 1, 4096, 1025, 1025, 4096, 4096]
    - [14, 9835.0]
  - - [1024, 2047, 1, 4096, 1024, 1024, 4096, 4096]
    - [28, 10485.0]
  - - [1024, 2049, 1, 4096, 1024, 1024, 4096, 4096]
    - [12, 10429.0]
  - - [1024, 2048, 1, 4095, 1024, 1024, 4095, 4095]
    - [17, 11107.0]
  - - [1024, 2048, 1, 4097, 1024, 1024, 4097, 4097]
    - [17, 11096.0]
  - - [1023, 3072, 1, 1024, 1023, 1023, 1024, 1024]
    - [14, 11287.0]
  - - [1025, 3072, 1, 1024, 1025, 1025, 1024, 1024]
    - [47, 10249.0]
  - - [1024, 3071, 1, 1024, 1024, 1024, 1024, 1024]
    - [30, 11226.0]
  - - [1024, 3073, 1, 1024, 1024, 1024, 1024, 1024]
    - [28, 11138.0]
  - - [1024, 3072, 1, 1023, 1024, 1024, 1023, 1023]
    - [1, 11544.0]
  - - [1024, 3072, 1, 1025, 1024, 1024, 1025, 1025]
    - [17, 11503.0]
  - - [3071, 512, 1, 1024, 3071, 3071, 1024, 1024]
    - [47, 10575.0]
  - - [3073, 512, 1, 1024, 3073, 3073, 1024, 1024]
    - [47, 10521.0]
  - - [3072, 511, 1, 1024, 3072, 3072, 1024, 1024]
    - [28, 10526.0]
  - - [3072, 513, 1, 1024, 3072, 3072, 1024, 1024]
    - [12, 9012.0]
  - - [3072, 512, 1, 1023, 3072, 3072, 1023, 1023]
    - [35, 11152.0]
  - - [3072, 512, 1, 1025, 3072, 3072, 1025, 1025]
    - [35, 11039.0]
  - - [128, 32768, 1, 256, 128, 128, 256, 256]
    - [12, 11272.0]
  - - [1024, 4096, 1, 480, 1024, 1024, 480, 480]
    - [1, 11848.0]
  - - [512, 4096, 1, 1024, 512, 512, 1024, 1024]
    - [28, 10609.0]
  - - [512, 55296, 1, 13, 512, 512, 13, 13]
    - [0, 3555.0]
  - - [256, 55296, 1, 512, 256, 256, 512, 512]
    - [47, 11877.0]
  - - [128, 55296, 1, 256, 128, 128, 256, 256]
    - [28, 11390.0]
  - - [1024, 6912, 1, 480, 1024, 1024, 480, 480]
    - [1, 12010.0]
  - - [1024, 6912, 1, 1024, 1024, 1024, 1024, 1024]
    - [14, 11858.0]
  - - [512, 6912, 1, 1024, 512, 512, 1024, 1024]
    - [28, 11548.0]
  - - [256, 6912, 1, 512, 256, 256, 512, 512]
    - [30, 10198.0]
  - - [1151, 1152, 1, 1152, 1151, 1151, 1152, 1152]
    - [20, 9185.0]
  - - [1153, 1152, 1, 1152, 1153, 1153, 1152, 1152]
    - [44, 9309.0]
  - - [1152, 1151, 1, 1152, 1152, 1152, 1152, 1152]
    - [4, 9213.0]
  - - [1152, 1153, 1, 1152, 1152, 1152, 1152, 1152]
    - [44, 9199.0]
  - - [1152, 1152, 1, 1151, 1152, 1152, 1151, 1151]
    - [16, 9698.0]
  - - [1152, 1152, 1, 1153, 1152, 1152, 1153, 1153]
    - [16, 9572.0]
  - - [1535, 1536, 1, 1536, 1535, 1535, 1536, 1536]
    - [14, 10768.0]
  - - [1537, 1536, 1, 1536, 1537, 1537, 1536, 1536]
    - [49, 10799.0]
  - - [1536, 1535, 1, 1536, 1536, 1536, 1536, 1536]
    - [30, 10748.0]
  - - [1536, 1537, 1, 1536, 1536, 1536, 1536, 1536]
    - [28, 10533.0]
  - - [1536, 1536, 1, 1535, 1536, 1536, 1535, 1535]
    - [17, 10917.0]
  - - [1536, 1536, 1, 1537, 1536, 1536, 1537, 1537]
    - [22, 10925.0]
  - - [1919, 1920, 1, 1920, 1919, 1919, 1920, 1920]
    - [25, 11288.0]
  - - [1921, 1920, 1, 1920, 1921, 1921, 1920, 1920]
    - [38, 11186.0]
  - - [1920, 1919, 1, 1920, 1920, 1920, 1920, 1920]
    - [38, 11215.0]
  - - [1920, 1921, 1, 1920, 1920, 1920, 1920, 1920]
    - [25, 11242.0]
  - - [1920, 1920, 1, 1919, 1920, 1920, 1919, 1919]
    - [17, 11551.0]
  - - [1920, 1920, 1, 1921, 1920, 1920, 1921, 1921]
    - [35, 11529.0]
  - - [2303, 2304, 1, 2304, 2303, 2303, 2304, 2304]
    - [28, 11532.0]
  - - [2305, 2304, 1, 2304, 2305, 2305, 2304, 2304]
    - [30, 11133.0]
  - - [2304, 2303, 1, 2304, 2304, 2304, 2304, 2304]
    - [12, 11532.0]
  - - [2304, 2305, 1, 2304, 2304, 2304, 2304, 2304]
    - [30, 11122.0]
  - - [2304, 2304, 1, 2303, 2304, 2304, 2303, 2303]
    - [35, 11818.0]
  - - [2304, 2304, 1, 2305, 2304, 2304, 2305, 2305]
    - [35, 11781.0]
  - - [2687, 2688, 1, 2688, 2687, 2687, 2688, 2688]
    - [38, 11695.0]
  - - [2689, 2688, 1, 2688, 2689, 2689, 2688, 2688]
    - [1, 11244.0]
  - - [2688, 2687, 1, 2688, 2688, 2688, 2688, 2688]
    - [4, 11709.0]
  - - [2688, 2689, 1, 2688, 2688, 2688, 2688, 2688]
    - [22, 11453.0]
  - - [2688, 2688, 1, 2687, 2688, 2688, 2687, 2687]
    - [35, 11965.0]
  - - [2688, 2688, 1, 2689, 2688, 2688, 2689, 2689]
    - [17, 11908.0]
  - - [3455, 3456, 1, 3456, 3455, 3455, 3456, 3456]
    - [20, 12068.0]
  - - [3457, 3456, 1, 3456, 3457, 3457, 3456, 3456]
    - [20, 11738.0]
  - - [3456, 3455, 1, 3456, 3456, 3456, 3456, 3456]
    - [4, 12069.0]
  - - [3456, 3457, 1, 3456, 3456, 3456, 3456, 3456]
    - [22, 11975.0]
  - - [3456, 3456, 1, 3455, 3456, 3456, 3455, 3455]
    - [17, 12335.0]
  - - [3456, 3456, 1, 3457, 3456, 3456, 3457, 3457]
    - [17, 12314.0]
  - - [3839, 3840, 1, 3840, 3839, 3839, 3840, 3840]
    - [28, 12209.0]
  - - [3841, 3840, 1, 3840, 3841, 3841, 3840, 3840]
    - [28, 11738.0]
  - - [3840, 3839, 1, 3840, 3840, 3840, 3840, 3840]
    - [28, 12225.0]
  - - [3840, 3841, 1, 3840, 3840, 3840, 3840, 3840]
    - [12, 11753.0]
  - - [3840, 3840, 1, 3839, 3840, 3840, 3839, 3839]
    - [38, 12221.0]
  - - [3840, 3840, 1, 3841, 3840, 3840, 3841, 3841]
    - [20, 12215.0]
  - - [4223, 4224, 1, 4224, 4223, 4223, 4224, 4224]
    - [38, 12171.0]
  - - [4225, 4224, 1, 4224, 4225, 4225, 4224, 4224]
    - [28, 11768.0]
  - - [4224, 4223, 1, 4224, 4224, 4224, 4224, 4224]
    - [20, 12176.0]
  - - [4224, 4225, 1, 4224, 4224, 4224, 4224, 4224]
    - [6, 11809.0]
  - - [4224, 4224, 1, 4223, 4224, 4224, 4223, 4223]
    - [17, 12393.0]
  - - [4224, 4224, 1, 4225, 4224, 4224, 4225, 4225]
    - [17, 12350.0]
  - - [4607, 4608, 1, 4608, 4607, 4607, 4608, 4608]
    - [28, 12243.0]
  - - [4609, 4608, 1, 4608, 4609, 4609, 4608, 4608]
    - [49, 11939.0]
  - - [4608, 4607, 1, 4608, 4608, 4608, 4608, 4608]
    - [47, 12253.0]
  - - [4608, 4609, 1, 4608, 4608, 4608, 4608, 4608]
    - [28, 11915.0]
  - - [4608, 4608, 1, 4607, 4608, 4608, 4607, 4607]
    - [20, 12250.0]
  - - [4608, 4608, 1, 4609, 4608, 4608, 4609, 4609]
    - [22, 12252.0]
  - - [4991, 4992, 1, 4992, 4991, 4991, 4992, 4992]
    - [20, 12198.0]
  - - [4993, 4992, 1, 4992, 4993, 4993, 4992, 4992]
    - [20, 12014.0]
  - - [4992, 4991, 1, 4992, 4992, 4992, 4992, 4992]
    - [12, 12191.0]
  - - [4992, 4993, 1, 4992, 4992, 4992, 4992, 4992]
    - [40, 12040.0]
  - - [4992, 4992, 1, 4991, 4992, 4992, 4991, 4991]
    - [35, 12369.0]
  - - [4992, 4992, 1, 4993, 4992, 4992, 4993, 4993]
    - [35, 12350.0]
  - - [5375, 5376, 1, 5376, 5375, 5375, 5376, 5376]
    - [40, 12293.0]
  - - [5377, 5376, 1, 5376, 5377, 5377, 5376, 5376]
    - [40, 12036.0]
  - - [5376, 5375, 1, 5376, 5376, 5376, 5376, 5376]
    - [22, 12304.0]
  - - [5376, 5377, 1, 5376, 5376, 5376, 5376, 5376]
    - [12, 11954.0]
  - - [5376, 5376, 1, 5375, 5376, 5376, 5375, 5375]
    - [6, 12298.0]
  - - [5376, 5376, 1, 5377, 5376, 5376, 5377, 5377]
    - [40, 12297.0]
  - - [5759, 5760, 1, 5760, 5759, 5759, 5760, 5760]
    - [38, 12246.0]
  - - [5761, 5760, 1, 5760, 5761, 5761, 5760, 5760]
    - [28, 11994.0]
  - - [5760, 5759, 1, 5760, 5760, 5760, 5760, 5760]
    - [20, 12249.0]
  - - [5760, 5761, 1, 5760, 5760, 5760, 5760, 5760]
    - [30, 11396.0]
  - - [5760, 5760, 1, 5759, 5760, 5760, 5759, 5759]
    - [22, 11704.0]
  - - [5760, 5760, 1, 5761, 5760, 5760, 5761, 5761]
    - [22, 11668.0]
  - - [6143, 6144, 1, 6144, 6143, 6143, 6144, 6144]
    - [28, 10904.0]
  - - [6145, 6144, 1, 6144, 6145, 6145, 6144, 6144]
    - [14, 10638.0]
  - - [6144, 6143, 1, 6144, 6144, 6144, 6144, 6144]
    - [14, 10705.0]
  - - [6144, 6145, 1, 6144, 6144, 6144, 6144, 6144]
    - [14, 10296.0]
  - - [6144, 6144, 1, 6143, 6144, 6144, 6143, 6143]
    - [40, 11840.0]
  - - [6144, 6144, 1, 6145, 6144, 6144, 6145, 6145]
    - [22, 11844.0]
  - - [6527, 6528, 1, 6528, 6527, 6527, 6528, 6528]
    - [38, 11638.0]
  - - [6529, 6528, 1, 6528, 6529, 6529, 6528, 6528]
    - [38, 11491.0]
  - - [6528, 6527, 1, 6528, 6528, 6528, 6528, 6528]
    - [38, 11737.0]
  - - [6528, 6529, 1, 6528, 6528, 6528, 6528, 6528]
    - [49, 11617.0]
  - - [6528, 6528, 1, 6527, 6528, 6528, 6527, 6527]
    - [38, 11724.0]
  - - [6528, 6528, 1, 6529, 6528, 6528, 6529, 6529]
    - [38, 11764.0]
  - - [6911, 6912, 1, 6912, 6911, 6911, 6912, 6912]
    - [49, 11830.0]
  - - [6913, 6912, 1, 6912, 6913, 6913, 6912, 6912]
    - [47, 11617.0]
  - - [6912, 6911, 1, 6912, 6912, 6912, 6912, 6912]
    - [30, 11825.0]
  - - [6912, 6913, 1, 6912, 6912, 6912, 6912, 6912]
    - [47, 11606.0]
  - - [6912, 6912, 1, 6911, 6912, 6912, 6911, 6911]
    - [40, 12032.0]
  - - [6912, 6912, 1, 6913, 6912, 6912, 6913, 6913]
    - [22, 12122.0]
  - - [7295, 7296, 1, 7296, 7295, 7295, 7296, 7296]
    - [38, 11877.0]
  - - [7297, 7296, 1, 7296, 7297, 7297, 7296, 7296]
    - [47, 11726.0]
  - - [7296, 7295, 1, 7296, 7296, 7296, 7296, 7296]
    - [38, 11935.0]
  - - [7296, 7297, 1, 7296, 7296, 7296, 7296, 7296]
    - [49, 11787.0]
  - - [7296, 7296, 1, 7295, 7296, 7296, 7295, 7295]
    - [38, 11930.0]
  - - [7296, 7296, 1, 7297, 7296, 7296, 7297, 7297]
    - [47, 11932.0]
  - - [7679, 7680, 1, 7680, 7679, 7679, 7680, 7680]
    - [49, 11565.0]
  - - [7681, 7680, 1, 7680, 7681, 7681, 7680, 7680]
    - [49, 11627.0]
  - - [7680, 7679, 1, 7680, 7680, 7680, 7680, 7680]
    - [49, 11754.0]
  - - [7680, 7681, 1, 7680, 7680, 7680, 7680, 7680]
    - [49, 11086.0]
  - - [7680, 7680, 1, 7679, 7680, 7680, 7679, 7679]
    - [40, 12111.0]
  - - [7680, 7680, 1, 7681, 7680, 7680, 7681, 7681]
    - [40, 12105.0]
  - - [1152, 1152, 1, 1152, 1152, 1152, 1152, 1152]
    - [9, 8746.0]
  - - [1536, 1536, 1, 1536, 1536, 1536, 1536, 1536]
    - [30, 10583.0]
  - - [1920, 1920, 1, 1920, 1920, 1920, 1920, 1920]
    - [38, 11106.0]
  - - [2304, 2304, 1, 2304, 2304, 2304, 2304, 2304]
    - [28, 11413.0]
  - - [2688, 2688, 1, 2688, 2688, 2688, 2688, 2688]
    - [38, 11211.0]
  - - [3456, 3456, 1, 3456, 3456, 3456, 3456, 3456]
    - [20, 10746.0]
  - - [3840, 3840, 1, 3840, 3840, 3840, 3840, 3840]
    - [47, 10557.0]
  - - [4224, 4224, 1, 4224, 4224, 4224, 4224, 4224]
    - [20, 11382.0]
  - - [4608, 4608, 1, 4608, 4608, 4608, 4608, 4608]
    - [28, 10952.0]
  - - [4992, 4992, 1, 4992, 4992, 4992, 4992, 4992]
    - [47, 11448.0]
  - - [5376, 5376, 1, 5376, 5376, 5376, 5376, 5376]
    - [49, 11433.0]
  - - [5760, 5760, 1, 5760, 5760, 5760, 5760, 5760]
    - [47, 11548.0]
  - - [6144, 6144, 1, 6144, 6144, 6144, 6144, 6144]
    - [14, 10534.0]
  - - [6528, 6528, 1, 6528, 6528, 6528, 6528, 6528]
    - [28, 11685.0]
  - - [6912, 6912, 1, 6912, 6912, 6912, 6912, 6912]
    - [49, 11818.0]
  - - [7296, 7296, 1, 7296, 7296, 7296, 7296, 7296]
    - [47, 11905.0]
  - - [7680, 7680, 1, 7680, 7680, 7680, 7680, 7680]
    - [49, 11790.0]
  - - [256, 128, 49, 1152, 256, 256, 1152, 1152]
    - [15, 4540.0]
  - - [256, 128, 121, 120, 256, 256, 120, 120]
    - [18, 6789.0]
  - - [256, 128, 169, 120, 256, 256, 120, 120]
    - [39, 8315.0]
  - - [256, 128, 36, 120, 256, 256, 120, 120]
    - [2, 6548.0]
  - - [256, 128, 49, 120, 256, 256, 120, 120]
    - [16, 7084.0]
  - - [256, 128, 64, 120, 256, 256, 120, 120]
    - [18, 7432.0]
  - - [256, 128, 36, 12000, 256, 256, 12000, 12000]
    - [28, 9721.0]
  - - [256, 128, 49, 1216, 256, 256, 1216, 1216]
    - [4, 10804.0]
  - - [256, 128, 121, 18, 256, 256, 18, 18]
    - [0, 2659.0]
  - - [256, 128, 169, 18, 256, 256, 18, 18]
    - [1, 3067.0]
  - - [256, 128, 36, 18, 256, 256, 18, 18]
    - [13, 2628.0]
  - - [256, 128, 49, 18, 256, 256, 18, 18]
    - [7, 2294.0]
  - - [256, 128, 64, 18, 256, 256, 18, 18]
    - [3, 2692.0]
  - - [256, 128, 36, 1800, 256, 256, 1800, 1800]
    - [38, 9913.0]
  - - [256, 128, 121, 19, 256, 256, 19, 19]
    - [0, 2954.0]
  - - [256, 128, 169, 19, 256, 256, 19, 19]
    - [1, 2954.0]
  - - [256, 128, 36, 19, 256, 256, 19, 19]
    - [0, 2410.0]
  - - [256, 128, 49, 19, 256, 256, 19, 19]
    - [0, 2354.0]
  - - [256, 128, 64, 19, 256, 256, 19, 19]
    - [3, 2689.0]
  - - [256, 128, 36, 1900, 256, 256, 1900, 1900]
    - [38, 9923.0]
  - - [256, 128, 49, 480, 256, 256, 480, 480]
    - [2, 10117.0]
  - - [256, 128, 81, 480, 256, 256, 480, 480]
    - [28, 9566.0]
  - - [256, 128, 64, 5880, 256, 256, 5880, 5880]
    - [20, 9565.0]
  - - [256, 128, 49, 72, 256, 256, 72, 72]
    - [2, 5959.0]
  - - [256, 128, 81, 72, 256, 256, 72, 72]
    - [16, 6055.0]
  - - [256, 128, 49, 76, 256, 256, 76, 76]
    - [5, 5507.0]
  - - [256, 128, 81, 76, 256, 256, 76, 76]
    - [39, 6245.0]
  - - [256, 128, 49, 7680, 256, 256, 7680, 7680]
    - [33, 3462.0]
  - - [256, 128, 64, 882, 256, 256, 882, 882]
    - [47, 9908.0]
  - - [256, 128, 64, 931, 256, 256, 931, 931]
    - [20, 9873.0]
  - - [256, 256, 49, 1152, 256, 256, 1152, 1152]
    - [30, 10911.0]
  - - [256, 256, 36, 12000, 256, 256, 12000, 12000]
    - [0, 7799.0]
  - - [256, 256, 49, 1216, 256, 256, 1216, 1216]
    - [40, 11604.0]
  - - [256, 256, 36, 1800, 256, 256, 1800, 1800]
    - [40, 10772.0]
  - - [256, 256, 36, 1900, 256, 256, 1900, 1900]
    - [22, 10778.0]
  - - [256, 256, 64, 5880, 256, 256, 5880, 5880]
    - [0, 10003.0]
  - - [256, 256, 49, 7680, 256, 256, 7680, 7680]
    - [32, 5447.0]
  - - [256, 256, 64, 882, 256, 256, 882, 882]
    - [38, 11390.0]
  - - [256, 256, 64, 931, 256, 256, 931, 931]
    - [4, 11395.0]
  - - [340, 256, 49, 1152, 340, 340, 1152, 1152]
    - [20, 10199.0]
  - - [340, 256, 36, 120, 340, 340, 120, 120]
    - [2, 8728.0]
  - - [340, 256, 49, 120, 340, 340, 120, 120]
    - [17, 8916.0]
  - - [340, 256, 64, 120, 340, 340, 120, 120]
    - [16, 8970.0]
  - - [340, 256, 36, 12000, 340, 340, 12000, 12000]
    - [35, 7576.0]
  - - [340, 256, 49, 1216, 340, 340, 1216, 1216]
    - [35, 10425.0]
  - - [340, 256, 36, 18, 340, 340, 18, 18]
    - [5, 2910.0]
  - - [340, 256, 49, 18, 340, 340, 18, 18]
    - [39, 2973.0]
  - - [340, 256, 64, 18, 340, 340, 18, 18]
    - [48, 3051.0]
  - - [340, 256, 36, 1800, 340, 340, 1800, 1800]
    - [35, 10417.0]
  - - [340, 256, 36, 19, 340, 340, 19, 19]
    - [18, 3063.0]
  - - [340, 256, 49, 19, 340, 340, 19, 19]
    - [45, 3551.0]
  - - [340, 256, 64, 19, 340, 340, 19, 19]
    - [26, 3665.0]
  - - [340, 256, 36, 1900, 340, 340, 1900, 1900]
    - [35, 10364.0]
  - - [340, 256, 64, 5880, 340, 340, 5880, 5880]
    - [0, 9228.0]
  - - [340, 256, 49, 7680, 340, 340, 7680, 7680]
    - [15, 6095.0]
  - - [340, 256, 64, 882, 340, 340, 882, 882]
    - [40, 10167.0]
  - - [340, 256, 64, 931, 340, 340, 931, 931]
    - [40, 10169.0]
  - - [510, 256, 49, 120, 510, 510, 120, 120]
    - [18, 9825.0]
  - - [510, 256, 64, 120, 510, 510, 120, 120]
    - [45, 10124.0]
  - - [510, 256, 49, 18, 510, 510, 18, 18]
    - [18, 3475.0]
  - - [510, 256, 64, 18, 510, 510, 18, 18]
    - [34, 3544.0]
  - - [510, 256, 49, 19, 510, 510, 19, 19]
    - [43, 3611.0]
  - - [510, 256, 64, 19, 510, 510, 19, 19]
    - [39, 3711.0]
  - - [510, 256, 36, 480, 510, 510, 480, 480]
    - [1, 11276.0]
  - - [510, 256, 36, 72, 510, 510, 72, 72]
    - [16, 7287.0]
  - - [510, 256, 36, 76, 510, 510, 76, 76]
    - [21, 7489.0]
  - - [510, 512, 36, 1080, 510, 510, 1080, 1080]
    - [17, 12076.0]
  - - [510, 512, 36, 162, 510, 510, 162, 162]
    - [17, 10299.0]
  - - [510, 512, 36, 171, 510, 510, 171, 171]
    - [17, 10658.0]
  - - [510, 512, 49, 1920, 510, 510, 1920, 1920]
    - [49, 10404.0]
  - - [510, 512, 64, 1920, 510, 510, 1920, 1920]
    - [12, 8105.0]
  - - [510, 512, 49, 288, 510, 510, 288, 288]
    - [6, 2843.0]
  - - [510, 512, 64, 288, 510, 510, 288, 288]
    - [17, 11733.0]
  - - [510, 512, 36, 3000, 510, 510, 3000, 3000]
    - [4, 10740.0]
  - - [510, 512, 49, 304, 510, 510, 304, 304]
    - [35, 11406.0]
  - - [510, 512, 64, 304, 510, 510, 304, 304]
    - [17, 11742.0]
  - - [510, 512, 36, 450, 510, 510, 450, 450]
    - [4, 11543.0]
  - - [510, 512, 36, 475, 510, 510, 475, 475]
    - [38, 11579.0]
  - - [510, 512, 49, 480, 510, 510, 480, 480]
    - [17, 11859.0]
  - - [510, 512, 64, 480, 510, 510, 480, 480]
    - [35, 11958.0]
  - - [510, 512, 49, 72, 510, 510, 72, 72]
    - [18, 8946.0]
  - - [510, 512, 64, 72, 510, 510, 72, 72]
    - [36, 9051.0]
  - - [510, 512, 49, 76, 510, 510, 76, 76]
    - [21, 8892.0]
  - - [510, 512, 64, 76, 510, 510, 76, 76]
    - [29, 9062.0]
  - - [512, 256, 81, 1080, 512, 512, 1080, 1080]
    - [4, 11811.0]
  - - [512, 256, 25, 12000, 512, 512, 12000, 12000]
    - [0, 8896.0]
  - - [512, 256, 81, 162, 512, 512, 162, 162]
    - [4, 10447.0]
  - - [512, 256, 81, 171, 512, 512, 171, 171]
    - [4, 10604.0]
  - - [512, 256, 25, 1800, 512, 512, 1800, 1800]
    - [22, 11981.0]
  - - [512, 256, 25, 1900, 512, 512, 1900, 1900]
    - [40, 12019.0]
  - - [512, 256, 121, 1920, 512, 512, 1920, 1920]
    - [12, 7556.0]
  - - [512, 256, 169, 1920, 512, 512, 1920, 1920]
    - [40, 8359.0]
  - - [512, 256, 49, 1920, 512, 512, 1920, 1920]
    - [38, 11209.0]
  - - [512, 256, 121, 288, 512, 512, 288, 288]
    - [4, 11729.0]
  - - [512, 256, 169, 288, 512, 512, 288, 288]
    - [4, 11939.0]
  - - [512, 256, 49, 288, 512, 512, 288, 288]
    - [1, 11566.0]
  - - [512, 256, 25, 3000, 512, 512, 3000, 3000]
    - [40, 12154.0]
  - - [512, 256, 81, 3000, 512, 512, 3000, 3000]
    - [0, 9645.0]
  - - [512, 256, 121, 304, 512, 512, 304, 304]
    - [38, 11758.0]
  - - [512, 256, 169, 304, 512, 512, 304, 304]
    - [4, 11954.0]
  - - [512, 256, 49, 304, 512, 512, 304, 304]
    - [1, 11572.0]
  - - [512, 256, 25, 450, 512, 512, 450, 450]
    - [1, 11565.0]
  - - [512, 256, 81, 450, 512, 512, 450, 450]
    - [20, 11516.0]
  - - [512, 256, 25, 475, 512, 512, 475, 475]
    - [1, 11502.0]
  - - [512, 256, 81, 475, 512, 512, 475, 475]
    - [4, 11620.0]
  - - [512, 256, 121, 480, 512, 512, 480, 480]
    - [1, 12015.0]
  - - [512, 256, 169, 480, 512, 512, 480, 480]
    - [1, 12156.0]
  - - [512, 256, 49, 5880, 512, 512, 5880, 5880]
    - [0, 9300.0]
  - - [512, 256, 121, 72, 512, 512, 72, 72]
    - [39, 8486.0]
  - - [512, 256, 169, 72, 512, 512, 72, 72]
    - [0, 6521.0]
  - - [512, 256, 121, 76, 512, 512, 76, 76]
    - [21, 9309.0]
  - - [512, 256, 169, 76, 512, 512, 76, 76]
    - [37, 7820.0]
  - - [512, 256, 49, 882, 512, 512, 882, 882]
    - [22, 11633.0]
  - - [512, 256, 49, 931, 512, 512, 931, 931]
    - [22, 11667.0]
  - - [2304, 512, 1, 100, 2304, 2304, 100, 100]
    - [2, 7792.0]
  - - [2304, 512, 1, 361, 2304, 2304, 361, 361]
    - [35, 9250.0]
  - - [4608, 510, 1, 100, 4608, 4608, 100, 100]
    - [43, 6896.0]
  - - [4608, 510, 1, 361, 4608, 4608, 361, 361]
    - [35, 9718.0]
  - - [8192, 7680, 1, 8192, 8192, 8192, 8192, 8192]
    - [14, 10744.0]
  - - [4096, 3840, 1, 4096, 4096, 4096, 4096, 4096]
    - [28, 7840.0]
  - - [2048, 1920, 1, 2048, 2048, 2048, 2048, 2048]
    - [12, 11509.0]
  - - [30522, 616, 1, 1024, 30522, 30522, 1024, 1024]
    - [47, 5852.0]
  - - [128, 128, 128, 64, 128, 128, 64, 64]
    - [16, 4269.0]
  - - [128, 128, 160, 64, 128, 128, 64, 64]
    - [29, 6498.0]
  - - [1024, 1280, 1, 1024, 1024, 1024, 1024, 1024]
    - [14, 10912.0]
  - - [1024, 1280, 1, 4096, 1024, 1024, 4096, 4096]
    - [30, 11071.0]
  - - [4096, 1280, 1, 1024, 4096, 4096, 1024, 1024]
    - [14, 11538.0]
  - - [30522, 200, 1, 1024, 30522, 30522, 1024, 1024]
    - [49, 5769.0]
  - - [128, 128, 624, 64, 128, 128, 64, 64]
    - [48, 7094.0]
  - - [1024, 4992, 1, 1024, 1024, 1024, 1024, 1024]
    - [28, 11091.0]
  - - [1024, 4992, 1, 4096, 1024, 1024, 4096, 4096]
    - [28, 7424.0]
  - - [4096, 4992, 1, 1024, 4096, 4096, 1024, 1024]
    - [14, 11349.0]
  - - [30522, 780, 1, 1024, 30522, 30522, 1024, 1024]
    - [47, 6665.0]
  - - [30522, 308, 1, 1024, 30522, 30522, 1024, 1024]
    - [14, 5530.0]
  - - [128, 128, 640, 64, 128, 128, 64, 64]
    - [48, 7228.0]
  - - [1024, 5120, 1, 1024, 1024, 1024, 1024, 1024]
    - [28, 11216.0]
  - - [1024, 5120, 1, 4096, 1024, 1024, 4096, 4096]
    - [28, 7379.0]
  - - [4096, 5120, 1, 1024, 4096, 4096, 1024, 1024]
    - [12, 8441.0]
  - - [30522, 800, 1, 1024, 30522, 30522, 1024, 1024]
    - [47, 6707.0]
  - - [128, 128, 656, 64, 128, 128, 64, 64]
    - [29, 8266.0]
  - - [1024, 5248, 1, 1024, 1024, 1024, 1024, 1024]
    - [12, 11060.0]
  - - [1024, 5248, 1, 4096, 1024, 1024, 4096, 4096]
    - [28, 7495.0]
  - - [4096, 5248, 1, 1024, 4096, 4096, 1024, 1024]
    - [12, 8579.0]
  - - [30522, 820, 1, 1024, 30522, 30522, 1024, 1024]
    - [47, 6888.0]
  - - [512, 512, 80, 64, 512, 512, 64, 64]
    - [23, 6549.0]
  - - [1024, 2560, 1, 1024, 1024, 1024, 1024, 1024]
    - [30, 10590.0]
  - - [1024, 2560, 1, 4096, 1024, 1024, 4096, 4096]
    - [30, 12028.0]
  - - [4096, 2560, 1, 1024, 4096, 4096, 1024, 1024]
    - [12, 11763.0]
  - - [30522, 385, 1, 1024, 30522, 30522, 1024, 1024]
    - [49, 4414.0]
  - - [30522, 462, 1, 1024, 30522, 30522, 1024, 1024]
    - [30, 4917.0]
  - - [128, 128, 144, 64, 128, 128, 64, 64]
    - [34, 4392.0]
  - - [1024, 1152, 1, 1024, 1024, 1024, 1024, 1024]
    - [49, 9610.0]
  - - [1024, 1152, 1, 4096, 1024, 1024, 4096, 4096]
    - [30, 9848.0]
  - - [4096, 1152, 1, 1024, 4096, 4096, 1024, 1024]
    - [12, 10872.0]
  - - [30522, 180, 1, 1024, 30522, 30522, 1024, 1024]
    - [48, 5727.0]
  - - [1024, 8192, 1, 1024, 1024, 1024, 1024, 1024]
    - [28, 11317.0]
  - - [1024, 8192, 1, 4096, 1024, 1024, 4096, 4096]
    - [30, 8388.0]
  - - [1024, 9600, 1, 1024, 1024, 1024, 1024, 1024]
    - [28, 10074.0]
  - - [1024, 9600, 1, 4096, 1024, 1024, 4096, 4096]
    - [47, 8509.0]
  - - [4096, 8192, 1, 1024, 4096, 4096, 1024, 1024]
    - [12, 9548.0]
  - - [4096, 9600, 1, 1024, 4096, 4096, 1024, 1024]
    - [12, 9719.0]
  - - [33712, 8192, 1, 1024, 33712, 33712, 1024, 1024]
    - [47, 11591.0]
  - - [33712, 9600, 1, 1024, 33712, 33712, 1024, 1024]
    - [30, 11565.0]
  - - [1024, 10064, 1, 1024, 1024, 1024, 1024, 1024]
    - [12, 9567.0]
  - - [1024, 10064, 1, 4096, 1024, 1024, 4096, 4096]
    - [28, 8578.0]
  - - [1024, 10080, 1, 1024, 1024, 1024, 1024, 1024]
    - [12, 9479.0]
  - - [1024, 10080, 1, 4096, 1024, 1024, 4096, 4096]
    - [47, 8318.0]
  - - [1024, 6528, 1, 1024, 1024, 1024, 1024, 1024]
    - [12, 11455.0]
  - - [1024, 6528, 1, 4096, 1024, 1024, 4096, 4096]
    - [28, 7399.0]
  - - [1024, 7104, 1, 1024, 1024, 1024, 1024, 1024]
    - [28, 10762.0]
  - - [1024, 7104, 1, 4096, 1024, 1024, 4096, 4096]
    - [28, 7624.0]
  - - [1024, 8064, 1, 1024, 1024, 1024, 1024, 1024]
    - [12, 10967.0]
  - - [1024, 8064, 1, 4096, 1024, 1024, 4096, 4096]
    - [28, 8040.0]
  - - [1024, 9216, 1, 1024, 1024, 1024, 1024, 1024]
    - [12, 10928.0]
  - - [1024, 9216, 1, 4096, 1024, 1024, 4096, 4096]
    - [28, 8556.0]
  - - [4096, 10064, 1, 1024, 4096, 4096, 1024, 1024]
    - [12, 9500.0]
  - - [4096, 10080, 1, 1024, 4096, 4096, 1024, 1024]
    - [12, 10053.0]
  - - [4096, 6528, 1, 1024, 4096, 4096, 1024, 1024]
    - [12, 8287.0]
  - - [4096, 7104, 1, 1024, 4096, 4096, 1024, 1024]
    - [12, 8760.0]
  - - [4096, 8064, 1, 1024, 4096, 4096, 1024, 1024]
    - [12, 9317.0]
  - - [4096, 9216, 1, 1024, 4096, 4096, 1024, 1024]
    - [12, 9627.0]
  - - [42720, 10080, 1, 1024, 42720, 42720, 1024, 1024]
    - [49, 11810.0]
  - - [42720, 6528, 1, 1024, 42720, 42720, 1024, 1024]
    - [47, 11501.0]
  - - [42720, 7104, 1, 1024, 42720, 42720, 1024, 1024]
    - [49, 11668.0]
  - - [1024, 32768, 1, 480, 1024, 1024, 480, 480]
    - [20, 7219.0]
  - - [30592, 1024, 1, 2048, 30592, 30592, 2048, 2048]
    - [30, 9708.0]
  - - [6144, 1024, 1, 2048, 6144, 6144, 2048, 2048]
    - [12, 10130.0]
  - - [8192, 1024, 1, 2048, 8192, 8192, 2048, 2048]
    - [12, 6894.0]
  - - [30592, 8192, 1, 1024, 30592, 30592, 1024, 1024]
    - [49, 11710.0]
  - - [3072, 8192, 1, 1024, 3072, 3072, 1024, 1024]
    - [22, 9910.0]
  - - [512, 512, 256, 64, 512, 512, 64, 64]
    - [27, 7413.0]
  - - [30592, 2048, 1, 1024, 30592, 30592, 1024, 1024]
    - [49, 10092.0]
  - - [30592, 4096, 1, 1024, 30592, 30592, 1024, 1024]
    - [49, 10991.0]
  - - [3072, 4096, 1, 1024, 3072, 3072, 1024, 1024]
    - [12, 11546.0]
  - - [1920, 2048, 1, 2560, 1920, 1920, 2560, 2560]
    - [12, 11709.0]
  - - [2560, 2048, 1, 2560, 2560, 2560, 2560, 2560]
    - [30, 12076.0]
  - - [2560, 2048, 1, 640, 2560, 2560, 640, 640]
    - [38, 11334.0]
  - - [7680, 2048, 1, 2560, 7680, 7680, 2560, 2560]
    - [28, 9607.0]
  - - [512, 512, 40, 64, 512, 512, 64, 64]
    - [7, 8218.0]
  - - [1536, 4096, 1, 1536, 1536, 1536, 1536, 1536]
    - [30, 11591.0]
  - - [1536, 4096, 1, 6144, 1536, 1536, 6144, 6144]
    - [26, 8218.0]
  - - [4608, 4096, 1, 1536, 4608, 4608, 1536, 1536]
    - [12, 9822.0]
  - - [50304, 4096, 1, 1536, 50304, 50304, 1536, 1536]
    - [49, 11876.0]
  - - [6144, 4096, 1, 1536, 6144, 6144, 1536, 1536]
    - [12, 10113.0]
  - - [1024, 1024, 64, 96, 1024, 1024, 96, 96]
    - [12, 11015.0]
  - - [1536, 8192, 1, 1536, 1536, 1536, 1536, 1536]
    - [12, 8413.0]
  - - [1536, 8192, 1, 6144, 1536, 1536, 6144, 6144]
    - [28, 10121.0]
  - - [4608, 8192, 1, 1536, 4608, 4608, 1536, 1536]
    - [28, 10909.0]
  - - [50304, 8192, 1, 1536, 50304, 50304, 1536, 1536]
    - [49, 12153.0]
  - - [6144, 8192, 1, 1536, 6144, 6144, 1536, 1536]
    - [12, 10986.0]
  - - [1024, 1024, 128, 96, 1024, 1024, 96, 96]
    - [20, 8086.0]
  - - [1024, 16384, 1, 1024, 1024, 1024, 1024, 1024]
    - [28, 6855.0]
  - - [1024, 16384, 1, 4096, 1024, 1024, 4096, 4096]
    - [30, 9473.0]
  - - [3072, 16384, 1, 1024, 3072, 3072, 1024, 1024]
    - [12, 9984.0]
  - - [4096, 16384, 1, 1024, 4096, 4096, 1024, 1024]
    - [12, 10716.0]
  - - [50304, 16384, 1, 1024, 50304, 50304, 1024, 1024]
    - [49, 12113.0]
  - - [1024, 1024, 256, 64, 1024, 1024, 64, 64]
    - [13, 4321.0]
  - - [50304, 2048, 1, 1024, 50304, 50304, 1024, 1024]
    - [49, 11180.0]
  - - [1024, 1024, 32, 64, 1024, 1024, 64, 64]
    - [5, 8216.0]
  - - [50304, 4096, 1, 1024, 50304, 50304, 1024, 1024]
    - [49, 11597.0]
  - - [1024, 1024, 64, 64, 1024, 1024, 64, 64]
    - [11, 8412.0]
  - - [50304, 8192, 1, 1024, 50304, 50304, 1024, 1024]
    - [49, 11938.0]
  - - [1024, 1024, 128, 64, 1024, 1024, 64, 64]
    - [19, 6115.0]
  - - [30528, 8192, 1, 1024, 30528, 30528, 1024, 1024]
    - [49, 11581.0]
  - - [128, 128, 1024, 64, 128, 128, 64, 64]
    - [37, 5410.0]
  - - [1024, 3456, 1, 1024, 1024, 1024, 1024, 1024]
    - [12, 11204.0]
  - - [1024, 3456, 1, 480, 1024, 1024, 480, 480]
    - [4, 11038.0]
  - - [512, 3456, 1, 1024, 512, 512, 1024, 1024]
    - [30, 9922.0]
  - - [512, 3456, 1, 13, 512, 512, 13, 13]
    - [0, 1743.0]
  - - [512, 4096, 1, 13, 512, 512, 13, 13]
    - [36, 2443.0]
  - - [512, 6912, 1, 13, 512, 512, 13, 13]
    - [39, 2576.0]
  - - [30528, 640, 1, 1024, 30528, 30528, 1024, 1024]
    - [48, 6268.0]
  - - [30528, 1280, 1, 1024, 30528, 30528, 1024, 1024]
    - [47, 7946.0]
  - - [30528, 1600, 1, 1024, 30528, 30528, 1024, 1024]
    - [49, 8918.0]
  - - [1024, 10240, 1, 1024, 1024, 1024, 1024, 1024]
    - [12, 9513.0]
  - - [4096, 10240, 1, 1024, 4096, 4096, 1024, 1024]
    - [12, 9711.0]
  - - [1024, 10240, 1, 4096, 1024, 1024, 4096, 4096]
    - [28, 8720.0]
  - - [128, 128, 1280, 64, 128, 128, 64, 64]
    - [37, 5139.0]
  - - [1024, 10496, 1, 4096, 1024, 1024, 4096, 4096]
    - [28, 8968.0]
  - - [30528, 1640, 1, 1024, 30528, 30528, 1024, 1024]
    - [47, 9039.0]
  - - [4096, 10496, 1, 1024, 4096, 4096, 1024, 1024]
    - [12, 10142.0]
  - - [1024, 10496, 1, 1024, 1024, 1024, 1024, 1024]
    - [12, 9408.0]
  - - [128, 128, 1312, 64, 128, 128, 64, 64]
    - [37, 5153.0]
  - - [30528, 160, 1, 1024, 30528, 30528, 1024, 1024]
    - [30, 7028.0]
  - - [30528, 240, 1, 1024, 30528, 30528, 1024, 1024]
    - [49, 9115.0]
  - - [1024, 6144, 1, 1024, 1024, 1024, 1024, 1024]
    - [12, 10963.0]
  - - [4096, 6144, 1, 1024, 4096, 4096, 1024, 1024]
    - [12, 8913.0]
  - - [1024, 6144, 1, 4096, 1024, 1024, 4096, 4096]
    - [28, 7521.0]
  - - [512, 512, 192, 64, 512, 512, 64, 64]
    - [42, 7459.0]
  - - [1024, 10224, 1, 1024, 1024, 1024, 1024, 1024]
    - [12, 9328.0]
  - - [1024, 10192, 1, 1024, 1024, 1024, 1024, 1024]
    - [12, 9652.0]
  - - [1024, 10208, 1, 1024, 1024, 1024, 1024, 1024]
    - [12, 9490.0]
  - - [1024, 10224, 1, 4096, 1024, 1024, 4096, 4096]
    - [28, 8728.0]
  - - [4096, 10224, 1, 1024, 4096, 4096, 1024, 1024]
    - [12, 9862.0]
  - - [3072, 10224, 1, 1024, 3072, 3072, 1024, 1024]
    - [12, 9163.0]
  - - [3072, 10240, 1, 1024, 3072, 3072, 1024, 1024]
    - [12, 9421.0]
  - - [1024, 10192, 1, 4096, 1024, 1024, 4096, 4096]
    - [28, 8451.0]
  - - [4096, 10192, 1, 1024, 4096, 4096, 1024, 1024]
    - [12, 9849.0]
  - - [3072, 10192, 1, 1024, 3072, 3072, 1024, 1024]
    - [12, 9069.0]
  - - [3072, 10200, 1, 1024, 3072, 3072, 1024, 1024]
    - [12, 9108.0]
  - - [1024, 10184, 1, 1024, 1024, 1024, 1024, 1024]
    - [12, 9554.0]
  - - [3072, 10208, 1, 1024, 3072, 3072, 1024, 1024]
    - [12, 9203.0]
  - - [1024, 10208, 1, 4096, 1024, 1024, 4096, 4096]
    - [28, 8709.0]
  - - [4096, 10208, 1, 1024, 4096, 4096, 1024, 1024]
    - [12, 9978.0]
  - - [2048, 10224, 1, 1024, 2048, 2048, 1024, 1024]
    - [12, 7953.0]
  - - [2048, 10240, 1, 1024, 2048, 2048, 1024, 1024]
    - [12, 7875.0]
  - - [4096, 256, 1, 12288, 4096, 4096, 12288, 12288]
    - [48, 3969.0]
  - - [2048, 256, 1, 13312, 2048, 2048, 13312, 13312]
    - [62, 5934.0]
  - - [4096, 256, 1, 15360, 4096, 4096, 15360, 15360]
    - [28, 4472.0]
  - - [2048, 512, 1, 16640, 2048, 2048, 16640, 16640]
    - [69, 5988.0]
  - - [4096, 256, 1, 14336, 4096, 4096, 14336, 14336]
    - [47, 4298.0]
  - - [1024, 1024, 1, 8192, 1024, 1024, 8192, 8192]
    - [56, 9774.0]
  - - [1024, 512, 1, 16384, 1024, 1024, 16384, 16384]
    - [32, 4969.0]
  - - [4096, 256, 1, 9216, 4096, 4096, 9216, 9216]
    - [33, 3694.0]
  - - [1024, 512, 1, 12288, 1024, 1024, 12288, 12288]
    - [55, 9723.0]
  - - [4096, 200, 1, 12288, 4096, 4096, 12288, 12288]
    - [44, 4537.0]
  - - [1024, 1024, 1, 13312, 1024, 1024, 13312, 13312]
    - [63, 6248.0]
  - - [2048, 256, 1, 16384, 2048, 2048, 16384, 16384]
    - [56, 5603.0]
  - - [2048, 512, 1, 16384, 2048, 2048, 16384, 16384]
    - [70, 5162.0]
  - - [1024, 1024, 1, 8320, 1024, 1024, 8320, 8320]
    - [52, 10791.0]
  - - [2048, 256, 1, 14336, 2048, 2048, 14336, 14336]
    - [55, 7215.0]
  - - [4096, 200, 1, 16640, 4096, 4096, 16640, 16640]
    - [48, 6027.0]
  - - [1024, 1024, 1, 16640, 1024, 1024, 16640, 16640]
    - [57, 7091.0]
  - - [1024, 1024, 1, 14336, 1024, 1024, 14336, 14336]
    - [53, 5834.0]
  - - [2048, 512, 1, 9216, 2048, 2048, 9216, 9216]
    - [13, 6621.0]
  - - [1024, 1024, 1, 15360, 1024, 1024, 15360, 15360]
    - [58, 6024.0]
  - - [2048, 512, 1, 8192, 2048, 2048, 8192, 8192]
    - [50, 6598.0]
  - - [2048, 512, 1, 13312, 2048, 2048, 13312, 13312]
    - [61, 4901.0]
  - - [1024, 1024, 1, 11264, 1024, 1024, 11264, 11264]
    - [47, 6774.0]
  - - [1024, 512, 1, 16640, 1024, 1024, 16640, 16640]
    - [32, 6673.0]
  - - [2048, 512, 1, 10240, 2048, 2048, 10240, 10240]
    - [57, 5022.0]
  - - [2048, 256, 1, 16640, 2048, 2048, 16640, 16640]
    - [57, 8392.0]
  - - [4096, 256, 1, 13312, 4096, 4096, 13312, 13312]
    - [51, 3986.0]
  - - [4096, 200, 1, 15360, 4096, 4096, 15360, 15360]
    - [48, 3453.0]
  - - [2048, 512, 1, 12288, 2048, 2048, 12288, 12288]
    - [63, 4572.0]
  - - [4096, 256, 1, 8192, 4096, 4096, 8192, 8192]
    - [32, 3481.0]
  - - [2048, 512, 1, 15360, 2048, 2048, 15360, 15360]
    - [67, 4965.0]
  - - [2048, 512, 1, 11264, 2048, 2048, 11264, 11264]
    - [57, 5348.0]
  - - [2048, 256, 1, 12288, 2048, 2048, 12288, 12288]
    - [68, 3393.0]
  - - [1024, 1024, 1, 12288, 1024, 1024, 12288, 12288]
    - [63, 5701.0]
  - - [4096, 256, 1, 16384, 4096, 4096, 16384, 16384]
    - [30, 4417.0]
  - - [2048, 256, 1, 15360, 2048, 2048, 15360, 15360]
    - [70, 3421.0]
  - - [2048, 512, 1, 8320, 2048, 2048, 8320, 8320]
    - [4, 8381.0]
  - - [1024, 1024, 1, 10240, 1024, 1024, 10240, 10240]
    - [60, 7963.0]
  - - [1024, 1024, 1, 9216, 1024, 1024, 9216, 9216]
    - [30, 9355.0]
  - - [4096, 200, 1, 16384, 4096, 4096, 16384, 16384]
    - [32, 3576.0]
  - - [2048, 512, 1, 14336, 2048, 2048, 14336, 14336]
    - [63, 4624.0]
  - - [1024, 512, 1, 13312, 1024, 1024, 13312, 13312]
    - [60, 7650.0]
  - - [4096, 256, 1, 8320, 4096, 4096, 8320, 8320]
    - [59, 10872.0]
  - - [4096, 200, 1, 13312, 4096, 4096, 13312, 13312]
    - [29, 3235.0]
  - - [1024, 512, 1, 14336, 1024, 1024, 14336, 14336]
    - [60, 6999.0]
  - - [4096, 256, 1, 11264, 4096, 4096, 11264, 11264]
    - [13, 3984.0]
  - - [4096, 256, 1, 10240, 4096, 4096, 10240, 10240]
    - [12, 3927.0]
  - - [4096, 200, 1, 14336, 4096, 4096, 14336, 14336]
    - [28, 3408.0]
  - - [4096, 256, 1, 16640, 4096, 4096, 16640, 16640]
    - [46, 5317.0]
  - - [1024, 512, 1, 15360, 1024, 1024, 15360, 15360]
    - [32, 5921.0]
  - - [1024, 1024, 1, 16384, 1024, 1024, 16384, 16384]
    - [58, 5858.0]
  - - [224, 192, 36, 10368, 224, 224, 10368, 10368]
    - [54, 4434.0]
  - - [320, 256, 9, 19584, 320, 320, 19584, 19584]
    - [66, 7293.0]
  - - [256, 256, 11, 13056, 256, 256, 13056, 13056]
    - [31, 6487.0]
  - - [320, 256, 9, 9792, 320, 320, 9792, 9792]
    - [52, 9395.0]
  - - [320, 256, 11, 13056, 320, 320, 13056, 13056]
    - [63, 7487.0]
  - - [256, 256, 9, 9792, 256, 256, 9792, 9792]
    - [65, 10179.0]
  - - [256, 224, 9, 19584, 256, 256, 19584, 19584]
    - [52, 8011.0]
  - - [256, 256, 9, 19584, 256, 256, 19584, 19584]
    - [59, 8814.0]
  - - [128, 128, 36, 12000, 128, 128, 12000, 12000]
    - [28, 9409.0]
  - - [128, 128, 49, 12800, 128, 128, 12800, 12800]
    - [64, 5221.0]
  - - [128, 128, 25, 25088, 128, 128, 25088, 25088]
    - [69, 4703.0]
  - - [128, 128, 49, 25600, 128, 128, 25600, 25600]
    - [58, 4491.0]
  - - [128, 128, 25, 50176, 128, 128, 50176, 50176]
    - [64, 4258.0]
  - - [128, 128, 36, 12544, 128, 128, 12544, 12544]
    - [70, 7600.0]
  - - [128, 128, 49, 9216, 128, 128, 9216, 9216]
    - [70, 5540.0]
  - - [1024, 1024, 1, 12544, 1024, 1024, 12544, 12544]
    - [57, 7066.0]
  - - [1024, 1000, 1, 12544, 1024, 1024, 12544, 12544]
    - [53, 6800.0]
  - - [1024, 512, 1, 1600, 1024, 1024, 1600, 1600]
    - [76, 7912.0]
  - - [2048, 512, 1, 100, 2048, 2048, 100, 100]
    - [76, 5248.0]
  - - [768, 640, 1, 768, 768, 768, 768, 768]
    - [95, 7924.0]
  - - [768, 1280, 1, 768, 768, 768, 768, 768]
    - [113, 7817.0]
  - - [1024, 512, 1, 1024, 1024, 1024, 1024, 1024]
    - [128, 7245.0]
  - - [1024, 512, 1, 3072, 1024, 1024, 3072, 3072]
    - [157, 7977.0]
  - - [30522, 120, 1, 1024, 30522, 30522, 1024, 1024]
    - [157, 9346.0]
  - - [30522, 80, 1, 1024, 30522, 30522, 1024, 1024]
    - [97, 6347.0]
  - - [64, 128, 512, 128, 64, 64, 128, 128]
    - [156, 6763.0]
  - - [64, 512, 64, 512, 64, 64, 512, 512]
    - [156, 6827.0]
  - - [64, 64, 768, 64, 64, 64, 64, 64]
    - [153, 5815.0]
  - - [64, 64, 96, 64, 64, 64, 64, 64]
    - [72, 3848.0]
  - - [1856, 448, 1, 3328, 1856, 1856, 3328, 3328]
    - [128, 8641.0]
  - - [128, 6784, 1, 3328, 128, 128, 3328, 3328]
    - [161, 7770.0]
  - - [2048, 400, 1, 512, 2048, 2048, 512, 512]
    - [119, 6827.0]
  - - [2368, 448, 1, 128, 2368, 2368, 128, 128]
    - [119, 6357.0]
  - - [256, 4288, 1, 3328, 256, 256, 3328, 3328]
    - [154, 8067.0]
  - - [704, 1856, 1, 3328, 704, 704, 3328, 3328]
    - [154, 8415.0]
  - - [448, 1024, 1, 1280, 448, 448, 1280, 1280]
    - [152, 7244.0]
  - - [256, 1408, 1, 3328, 256, 256, 3328, 3328]
    - [126, 6681.0]
  - - [704, 1856, 1, 1280, 704, 704, 1280, 1280]
    - [126, 8149.0]
  - - [128, 5056, 1, 128, 128, 128, 128, 128]
    - [119, 5892.0]
  - - [2368, 128, 1, 256, 2368, 2368, 256, 256]
    - [120, 4961.0]
  - - [64, 5056, 1, 256, 64, 64, 256, 256]
    - [152, 4978.0]
  - - [256, 2944, 1, 256, 256, 256, 256, 256]
    - [154, 6760.0]
  - - [256, 1856, 1, 1280, 256, 256, 1280, 1280]
    - [126, 8157.0]
  - - [128, 3584, 1, 1280, 128, 128, 1280, 1280]
    - [95, 7957.0]
  - - [4288, 256, 1, 256, 4288, 4288, 256, 256]
    - [151, 7502.0]
  - - [2944, 128, 1, 128, 2944, 2944, 128, 128]
    - [149, 4269.0]
  - - [5888, 64, 1, 3328, 5888, 5888, 3328, 3328]
    - [159, 4323.0]
  - - [2944, 256, 1, 3328, 2944, 2944, 3328, 3328]
    - [126, 8557.0]
  - - [704, 1024, 1, 128, 704, 704, 128, 128]
    - [118, 5422.0]
  - - [1408, 448, 1, 1280, 1408, 1408, 1280, 1280]
    - [95, 8417.0]
  - - [1408, 704, 1, 3328, 1408, 1408, 3328, 3328]
    - [154, 8110.0]
  - - [1408, 256, 1, 1280, 1408, 1408, 1280, 1280]
    - [141, 6352.0]
  - - [3072, 128, 1, 1024, 3072, 3072, 1024, 1024]
    - [118, 5678.0]
  - - [2944, 256, 1, 256, 2944, 2944, 256, 256]
    - [151, 6644.0]
  - - [704, 1408, 1, 3328, 704, 704, 3328, 3328]
    - [95, 8238.0]
  - - [2944, 256, 1, 128, 2944, 2944, 128, 128]
    - [150, 6240.0]
  - - [2368, 128, 1, 3328, 2368, 2368, 3328, 3328]
    - [157, 8210.0]
  - - [2944, 128, 1, 256, 2944, 2944, 256, 256]
    - [95, 5137.0]
  - - [448, 1408, 1, 256, 448, 448, 256, 256]
    - [152, 6559.0]
  - - [64, 5056, 1, 3328, 64, 64, 3328, 3328]
    - [158, 5753.0]
  - - [1024, 448, 1, 128, 1024, 1024, 128, 128]
    - [148, 4910.0]
  - - [256, 3584, 1, 3328, 256, 256, 3328, 3328]
    - [128, 9612.0]
  - - [256, 1408, 1, 256, 256, 256, 256, 256]
    - [150, 5026.0]
  - - [5056, 64, 1, 1280, 5056, 5056, 1280, 1280]
    - [154, 7282.0]
  - - [1024, 704, 1, 256, 1024, 1024, 256, 256]
    - [150, 6435.0]
  - - [128, 4288, 1, 128, 128, 128, 128, 128]
    - [138, 4886.0]
  - - [6784, 64, 1, 128, 6784, 6784, 128, 128]
    - [89, 4518.0]
  - - [3584, 256, 1, 128, 3584, 3584, 128, 128]
    - [151, 6635.0]
  - - [5888, 64, 1, 256, 5888, 5888, 256, 256]
    - [154, 5072.0]
  - - [1856, 256, 1, 1280, 1856, 1856, 1280, 1280]
    - [95, 8026.0]
  - - [64, 5888, 1, 3328, 64, 64, 3328, 3328]
    - [130, 4488.0]
  - - [704, 1024, 1, 1280, 704, 704, 1280, 1280]
    - [154, 7677.0]
  - - [448, 1856, 1, 128, 448, 448, 128, 128]
    - [150, 6006.0]
  - - [1024, 704, 1, 1280, 1024, 1024, 1280, 1280]
    - [154, 7879.0]
  - - [128, 5888, 1, 256, 128, 128, 256, 256]
    - [89, 5773.0]
  - - [704, 704, 1, 3328, 704, 704, 3328, 3328]
    - [90, 7551.0]
  - - [704, 1408, 1, 1280, 704, 704, 1280, 1280]
    - [121, 7993.0]
  - - [3584, 256, 1, 3328, 3584, 3584, 3328, 3328]
    - [113, 9550.0]
  - - [704, 1856, 1, 128, 704, 704, 128, 128]
    - [109, 6755.0]
  - - [2944, 448, 1, 128, 2944, 2944, 128, 128]
    - [86, 6631.0]
  - - [128, 2944, 1, 1280, 128, 128, 1280, 1280]
    - [154, 6873.0]
  - - [448, 2944, 1, 1280, 448, 448, 1280, 1280]
    - [97, 8313.0]
  - - [3584, 128, 1, 256, 3584, 3584, 256, 256]
    - [128, 6035.0]
  - - [448, 1408, 1, 3328, 448, 448, 3328, 3328]
    - [152, 8078.0]
  - - [256, 3584, 1, 256, 256, 256, 256, 256]
    - [151, 8033.0]
  - - [256, 2944, 1, 3328, 256, 256, 3328, 3328]
    - [126, 8493.0]
  - - [448, 2368, 1, 128, 448, 448, 128, 128]
    - [121, 6322.0]
  - - [1408, 704, 1, 256, 1408, 1408, 256, 256]
    - [95, 6994.0]
  - - [448, 2944, 1, 3328, 448, 448, 3328, 3328]
    - [97, 8463.0]
  - - [64, 5888, 1, 256, 64, 64, 256, 256]
    - [152, 4823.0]
  - - [6784, 128, 1, 3328, 6784, 6784, 3328, 3328]
    - [128, 9020.0]
  - - [704, 704, 1, 256, 704, 704, 256, 256]
    - [151, 4972.0]
  - - [128, 4288, 1, 3328, 128, 128, 3328, 3328]
    - [134, 7010.0]
  - - [448, 704, 1, 1280, 448, 448, 1280, 1280]
    - [123, 6951.0]
  - - [128, 5056, 1, 1280, 128, 128, 1280, 1280]
    - [157, 9235.0]
  - - [1024, 448, 1, 3328, 1024, 1024, 3328, 3328]
    - [95, 8413.0]
  - - [1856, 704, 1, 1280, 1856, 1856, 1280, 1280]
    - [90, 8349.0]
  - - [448, 1024, 1, 128, 448, 448, 128, 128]
    - [148, 4668.0]
  - - [448, 2368, 1, 3328, 448, 448, 3328, 3328]
    - [128, 8407.0]
  - - [5056, 64, 1, 128, 5056, 5056, 128, 128]
    - [88, 4134.0]
  - - [1024, 700, 1, 512, 1024, 1024, 512, 512]
    - [126, 7055.0]
  - - [704, 1024, 1, 256, 704, 704, 256, 256]
    - [90, 6404.0]
  - - [128, 6784, 1, 1280, 128, 128, 1280, 1280]
    - [97, 8865.0]
  - - [1856, 256, 1, 256, 1856, 1856, 256, 256]
    - [123, 6683.0]
  - - [256, 4288, 1, 1280, 256, 256, 1280, 1280]
    - [95, 8872.0]
  - - [256, 1856, 1, 128, 256, 256, 128, 128]
    - [150, 5216.0]
  - - [7680, 64, 1, 2560, 7680, 7680, 2560, 2560]
    - [125, 4694.0]
  - - [448, 1408, 1, 128, 448, 448, 128, 128]
    - [123, 5538.0]
  - - [6784, 128, 1, 256, 6784, 6784, 256, 256]
    - [97, 7556.0]
  - - [704, 448, 1, 256, 704, 704, 256, 256]
    - [123, 4864.0]
  - - [704, 1408, 1, 128, 704, 704, 128, 128]
    - [150, 6338.0]
  - - [4288, 128, 1, 1280, 4288, 4288, 1280, 1280]
    - [90, 7969.0]
  - - [128, 2944, 1, 128, 128, 128, 128, 128]
    - [150, 3890.0]
  - - [1024, 704, 1, 3328, 1024, 1024, 3328, 3328]
    - [95, 8115.0]
  - - [128, 4288, 1, 256, 128, 128, 256, 256]
    - [89, 6245.0]
  - - [704, 448, 1, 3328, 704, 704, 3328, 3328]
    - [152, 7450.0]
  - - [448, 2368, 1, 1280, 448, 448, 1280, 1280]
    - [97, 8260.0]
  - - [64, 6784, 1, 3328, 64, 64, 3328, 3328]
    - [130, 3676.0]
  - - [2944, 256, 1, 1280, 2944, 2944, 1280, 1280]
    - [154, 8034.0]
  - - [256, 2368, 1, 128, 256, 256, 128, 128]
    - [150, 5748.0]
  - - [1856, 704, 1, 256, 1856, 1856, 256, 256]
    - [113, 7374.0]
  - - [1408, 448, 1, 3328, 1408, 1408, 3328, 3328]
    - [95, 8971.0]
  - - [1856, 448, 1, 1280, 1856, 1856, 1280, 1280]
    - [128, 8370.0]
  - - [128, 5888, 1, 128, 128, 128, 128, 128]
    - [89, 5970.0]
  - - [704, 1856, 1, 256, 704, 704, 256, 256]
    - [151, 8033.0]
  - - [256, 2368, 1, 1280, 256, 256, 1280, 1280]
    - [90, 8744.0]
  - - [2944, 448, 1, 256, 2944, 2944, 256, 256]
    - [154, 7635.0]
  - - [1856, 448, 1, 128, 1856, 1856, 128, 128]
    - [109, 5848.0]
  - - [2368, 128, 1, 1280, 2368, 2368, 1280, 1280]
    - [128, 7398.0]
  - - [64, 6784, 1, 256, 64, 64, 256, 256]
    - [123, 5007.0]
  - - [64, 5056, 1, 1280, 64, 64, 1280, 1280]
    - [123, 7034.0]
  - - [2368, 256, 1, 1280, 2368, 2368, 1280, 1280]
    - [90, 8709.0]
  - - [2368, 448, 1, 1280, 2368, 2368, 1280, 1280]
    - [95, 8476.0]
  - - [128, 3584, 1, 256, 128, 128, 256, 256]
    - [119, 6240.0]
  - - [704, 448, 1, 1280, 704, 704, 1280, 1280]
    - [92, 6920.0]
  - - [128, 3584, 1, 3328, 128, 128, 3328, 3328]
    - [154, 8414.0]
  - - [4288, 256, 1, 1280, 4288, 4288, 1280, 1280]
    - [126, 8747.0]
  - - [4288, 128, 1, 3328, 4288, 4288, 3328, 3328]
    - [145, 6834.0]
  - - [7680, 128, 1, 2560, 7680, 7680, 2560, 2560]
    - [157, 5911.0]
  - - [1408, 256, 1, 128, 1408, 1408, 128, 128]
    - [138, 4142.0]
  - - [256, 1408, 1, 1280, 256, 256, 1280, 1280]
    - [95, 6380.0]
  - - [128, 2368, 1, 256, 128, 128, 256, 256]
    - [119, 5173.0]
  - - [6784, 64, 1, 3328, 6784, 6784, 3328, 3328]
    - [125, 3584.0]
  - - [128, 2944, 1, 3328, 128, 128, 3328, 3328]
    - [126, 7036.0]
  - - [2944, 448, 1, 3328, 2944, 2944, 3328, 3328]
    - [126, 8702.0]
  - - [256, 4288, 1, 256, 256, 256, 256, 256]
    - [154, 7695.0]
  - - [5888, 128, 1, 256, 5888, 5888, 256, 256]
    - [121, 6784.0]
  - - [5056, 64, 1, 256, 5056, 5056, 256, 256]
    - [152, 5152.0]
  - - [1024, 704, 1, 128, 1024, 1024, 128, 128]
    - [89, 5885.0]
  - - [128, 5056, 1, 3328, 128, 128, 3328, 3328]
    - [161, 8001.0]
  - - [4288, 128, 1, 256, 4288, 4288, 256, 256]
    - [151, 5964.0]
  - - [1408, 448, 1, 128, 1408, 1408, 128, 128]
    - [112, 6706.0]
  - - [704, 448, 1, 128, 704, 704, 128, 128]
    - [91, 4427.0]
  - - [3584, 256, 1, 256, 3584, 3584, 256, 256]
    - [128, 7877.0]
  - - [128, 2944, 1, 256, 128, 128, 256, 256]
    - [95, 4629.0]
  - - [128, 6784, 1, 128, 128, 128, 128, 128]
    - [128, 5654.0]
  - - [448, 1856, 1, 256, 448, 448, 256, 256]
    - [128, 6925.0]
  - - [3584, 128, 1, 3328, 3584, 3584, 3328, 3328]
    - [154, 8403.0]
  - - [5888, 128, 1, 3328, 5888, 5888, 3328, 3328]
    - [96, 5852.0]
  - - [1408, 704, 1, 1280, 1408, 1408, 1280, 1280]
    - [154, 8140.0]
  - - [6784, 64, 1, 256, 6784, 6784, 256, 256]
    - [92, 5963.0]
  - - [448, 2944, 1, 256, 448, 448, 256, 256]
    - [128, 7450.0]
  - - [448, 2368, 1, 256, 448, 448, 256, 256]
    - [113, 7177.0]
  - - [64, 6784, 1, 1280, 64, 64, 1280, 1280]
    - [92, 7261.0]
  - - [128, 2368, 1, 3328, 128, 128, 3328, 3328]
    - [157, 8252.0]
  - - [5056, 64, 1, 3328, 5056, 5056, 3328, 3328]
    - [131, 6434.0]
  - - [64, 5888, 1, 128, 64, 64, 128, 128]
    - [123, 3621.0]
  - - [5056, 128, 1, 3328, 5056, 5056, 3328, 3328]
    - [134, 7994.0]
  - - [448, 704, 1, 256, 448, 448, 256, 256]
    - [123, 4783.0]
  - - [2944, 128, 1, 3328, 2944, 2944, 3328, 3328]
    - [154, 6822.0]
  - - [704, 704, 1, 128, 704, 704, 128, 128]
    - [118, 4651.0]
  - - [2368, 128, 1, 128, 2368, 2368, 128, 128]
    - [118, 3927.0]
  - - [5056, 128, 1, 128, 5056, 5056, 128, 128]
    - [156, 5769.0]
  - - [448, 1024, 1, 3328, 448, 448, 3328, 3328]
    - [152, 7615.0]
  - - [2368, 256, 1, 256, 2368, 2368, 256, 256]
    - [90, 7607.0]
  - - [256, 2368, 1, 3328, 256, 256, 3328, 3328]
    - [86, 8471.0]
  - - [256, 3584, 1, 128, 256, 256, 128, 128]
    - [109, 6162.0]
  - - [4288, 256, 1, 128, 4288, 4288, 128, 128]
    - [139, 6256.0]
  - - [2368, 256, 1, 128, 2368, 2368, 128, 128]
    - [117, 5396.0]
  - - [256, 1856, 1, 256, 256, 256, 256, 256]
    - [95, 5825.0]
  - - [256, 2944, 1, 128, 256, 256, 128, 128]
    - [76, 5289.0]
  - - [1408, 256, 1, 3328, 1408, 1408, 3328, 3328]
    - [126, 6736.0]
  - - [2368, 448, 1, 256, 2368, 2368, 256, 256]
    - [95, 7242.0]
  - - [4288, 256, 1, 3328, 4288, 4288, 3328, 3328]
    - [154, 7814.0]
  - - [1856, 704, 1, 128, 1856, 1856, 128, 128]
    - [151, 6717.0]
  - - [4288, 128, 1, 128, 4288, 4288, 128, 128]
    - [89, 4879.0]
  - - [1408, 448, 1, 256, 1408, 1408, 256, 256]
    - [152, 6532.0]
  - - [6784, 64, 1, 1280, 6784, 6784, 1280, 1280]
    - [126, 7563.0]
  - - [3584, 128, 1, 128, 3584, 3584, 128, 128]
    - [89, 4951.0]
  - - [256, 2368, 1, 256, 256, 256, 256, 256]
    - [95, 6672.0]
  - - [2944, 448, 1, 1280, 2944, 2944, 1280, 1280]
    - [126, 8496.0]
  - - [448, 1408, 1, 1280, 448, 448, 1280, 1280]
    - [92, 7803.0]
  - - [448, 1856, 1, 1280, 448, 448, 1280, 1280]
    - [90, 8365.0]
  - - [1856, 256, 1, 128, 1856, 1856, 128, 128]
    - [137, 5652.0]
  - - [2560, 128, 1, 2560, 2560, 2560, 2560, 2560]
    - [97, 8862.0]
  - - [448, 1024, 1, 256, 448, 448, 256, 256]
    - [152, 5740.0]
  - - [1024, 448, 1, 1280, 1024, 1024, 1280, 1280]
    - [126, 7861.0]
  - - [128, 5056, 1, 256, 128, 128, 256, 256]
    - [119, 6979.0]
  - - [448, 2944, 1, 128, 448, 448, 128, 128]
    - [121, 6868.0]
  - - [128, 3584, 1, 128, 128, 128, 128, 128]
    - [150, 5133.0]
  - - [1408, 256, 1, 256, 1408, 1408, 256, 256]
    - [150, 5015.0]
  - - [128, 5888, 1, 3328, 128, 128, 3328, 3328]
    - [161, 6174.0]
  - - [2368, 448, 1, 3328, 2368, 2368, 3328, 3328]
    - [126, 8800.0]
  - - [128, 5888, 1, 1280, 128, 128, 1280, 1280]
    - [126, 8227.0]
  - - [64, 5056, 1, 128, 64, 64, 128, 128]
    - [149, 4150.0]
  - - [64, 6784, 1, 128, 64, 64, 128, 128]
    - [125, 4718.0]
  - - [448, 704, 1, 128, 448, 448, 128, 128]
    - [75, 4053.0]
  - - [1408, 704, 1, 128, 1408, 1408, 128, 128]
    - [150, 6720.0]
  - - [2368, 256, 1, 3328, 2368, 2368, 3328, 3328]
    - [97, 9097.0]
  - - [5888, 128, 1, 1280, 5888, 5888, 1280, 1280]
    - [95, 8221.0]
  - - [256, 3584, 1, 1280, 256, 256, 1280, 1280]
    - [90, 9310.0]
  - - [256, 1408, 1, 128, 256, 256, 128, 128]
    - [89, 4076.0]
  - - [256, 4288, 1, 128, 256, 256, 128, 128]
    - [76, 6736.0]
  - - [5888, 128, 1, 128, 5888, 5888, 128, 128]
    - [121, 6474.0]
  - - [1856, 256, 1, 3328, 1856, 1856, 3328, 3328]
    - [126, 8643.0]
  - - [64, 5888, 1, 1280, 64, 64, 1280, 1280]
    - [92, 6348.0]
  - - [704, 704, 1, 1280, 704, 704, 1280, 1280]
    - [90, 7342.0]
  - - [128, 2368, 1, 1280, 128, 128, 1280, 1280]
    - [97, 7354.0]
  - - [3584, 256, 1, 1280, 3584, 3584, 1280, 1280]
    - [151, 9322.0]
  - - [5888, 64, 1, 1280, 5888, 5888, 1280, 1280]
    - [95, 6626.0]
  - - [3584, 128, 1, 1280, 3584, 3584, 1280, 1280]
    - [95, 7974.0]
  - - [5056, 128, 1, 1280, 5056, 5056, 1280, 1280]
    - [128, 9268.0]
  - - [448, 1856, 1, 3328, 448, 448, 3328, 3328]
    - [128, 8654.0]
  - - [1024, 448, 1, 256, 1024, 1024, 256, 256]
    - [154, 6820.0]
  - - [2944, 128, 1, 1280, 2944, 2944, 1280, 1280]
    - [95, 6606.0]
  - - [128, 2368, 1, 128, 128, 128, 128, 128]
    - [106, 4924.0]
  - - [256, 2944, 1, 1280, 256, 256, 1280, 1280]
    - [95, 8223.0]
  - - [704, 1024, 1, 3328, 704, 704, 3328, 3328]
    - [95, 8106.0]
  - - [128, 6784, 1, 256, 128, 128, 256, 256]
    - [97, 7556.0]
  - - [256, 1856, 1, 3328, 256, 256, 3328, 3328]
    - [126, 8719.0]
  - - [6784, 128, 1, 128, 6784, 6784, 128, 128]
    - [121, 6500.0]
  - - [704, 1408, 1, 256, 704, 704, 256, 256]
    - [151, 7025.0]
  - - [4096, 128, 1, 4096, 4096, 4096, 4096, 4096]
    - [103, 6454.0]
  - - [5888, 64, 1, 128, 5888, 5888, 128, 128]
    - [117, 4123.0]
  - - [5056, 128, 1, 256, 5056, 5056, 256, 256]
    - [151, 7222.0]
  - - [6784, 128, 1, 1280, 6784, 6784, 1280, 1280]
    - [97, 9023.0]
  - - [1856, 448, 1, 256, 1856, 1856, 256, 256]
    - [121, 7119.0]
  - - [128, 4288, 1, 1280, 128, 128, 1280, 1280]
    - [121, 7991.0]
  - - [448, 704, 1, 3328, 448, 448, 3328, 3328]
    - [123, 7460.0]
  - - [1856, 704, 1, 3328, 1856, 1856, 3328, 3328]
    - [154, 8500.0]
  - - [1024, 1024, 1, 3328, 1024, 1024, 3328, 3328]
    - [95, 8717.0]
  - - [2048, 200, 1, 3200, 2048, 2048, 3200, 3200]
    - [139, 6516.0]
  - - [2048, 256, 1, 3328, 2048, 2048, 3328, 3328]
    - [97, 7961.0]
  - - [4096, 200, 1, 11264, 4096, 4096, 11264, 11264]
    - [157, 3184.0]
  - - [2048, 512, 1, 1024, 2048, 2048, 1024, 1024]
    - [121, 7824.0]
  - - [1024, 1024, 1, 64, 1024, 1024, 64, 64]
    - [76, 5218.0]
  - - [512, 1024, 1, 1536, 512, 512, 1536, 1536]
    - [90, 7802.0]
  - - [1024, 512, 1, 512, 1024, 1024, 512, 512]
    - [90, 6890.0]
  - - [2048, 512, 1, 640, 2048, 2048, 640, 640]
    - [126, 8467.0]
  - - [1024, 1024, 1, 512, 1024, 1024, 512, 512]
    - [126, 8095.0]
  - - [2048, 256, 1, 2048, 2048, 2048, 2048, 2048]
    - [157, 7734.0]
  - - [1024, 512, 1, 128, 1024, 1024, 128, 128]
    - [111, 5268.0]
  - - [2048, 512, 1, 256, 2048, 2048, 256, 256]
    - [95, 7494.0]
  - - [4096, 200, 1, 2560, 4096, 4096, 2560, 2560]
    - [121, 6679.0]
  - - [1024, 1024, 1, 1152, 1024, 1024, 1152, 1152]
    - [141, 8485.0]
  - - [2048, 200, 1, 32, 2048, 2048, 32, 32]
    - [155, 1158.0]
  - - [512, 1024, 1, 2816, 512, 512, 2816, 2816]
    - [157, 7889.0]
  - - [2048, 200, 1, 2080, 2048, 2048, 2080, 2080]
    - [78, 6527.0]
  - - [2048, 200, 1, 1024, 2048, 2048, 1024, 1024]
    - [154, 5792.0]
  - - [4096, 200, 1, 4096, 4096, 4096, 4096, 4096]
    - [128, 6205.0]
  - - [1024, 512, 1, 11264, 1024, 1024, 11264, 11264]
    - [161, 7148.0]
  - - [1024, 1024, 1, 1792, 1024, 1024, 1792, 1792]
    - [154, 8466.0]
  - - [4096, 200, 1, 768, 4096, 4096, 768, 768]
    - [154, 6570.0]
  - - [4096, 256, 1, 1024, 4096, 4096, 1024, 1024]
    - [154, 8339.0]
  - - [1024, 512, 1, 256, 1024, 1024, 256, 256]
    - [90, 6146.0]
  - - [1024, 512, 1, 1408, 1024, 1024, 1408, 1408]
    - [90, 7885.0]
  - - [1024, 512, 1, 5632, 1024, 1024, 5632, 5632]
    - [97, 8044.0]
  - - [4096, 200, 1, 256, 4096, 4096, 256, 256]
    - [150, 6509.0]
  - - [512, 1024, 1, 3072, 512, 512, 3072, 3072]
    - [97, 7912.0]
  - - [1024, 1024, 1, 4160, 1024, 1024, 4160, 4160]
    - [90, 8900.0]
  - - [2048, 256, 1, 384, 2048, 2048, 384, 384]
    - [78, 6839.0]
  - - [4096, 200, 1, 640, 4096, 4096, 640, 640]
    - [151, 6549.0]
  - - [1024, 1024, 1, 7168, 1024, 1024, 7168, 7168]
    - [154, 8703.0]
  - - [4096, 256, 1, 768, 4096, 4096, 768, 768]
    - [126, 8361.0]
  - - [2048, 256, 1, 6656, 2048, 2048, 6656, 6656]
    - [86, 7419.0]
  - - [2048, 200, 1, 3072, 2048, 2048, 3072, 3072]
    - [128, 6191.0]
  - - [1024, 512, 1, 2816, 1024, 1024, 2816, 2816]
    - [143, 7953.0]
  - - [4096, 256, 1, 7680, 4096, 4096, 7680, 7680]
    - [97, 7913.0]
  - - [4096, 200, 1, 1024, 4096, 4096, 1024, 1024]
    - [90, 6044.0]
  - - [2048, 200, 1, 1792, 2048, 2048, 1792, 1792]
    - [121, 6114.0]
  - - [1024, 1024, 1, 2816, 1024, 1024, 2816, 2816]
    - [95, 8645.0]
  - - [2048, 512, 1, 1536, 2048, 2048, 1536, 1536]
    - [95, 8526.0]
  - - [4096, 256, 1, 3072, 4096, 4096, 3072, 3072]
    - [154, 8636.0]
  - - [2048, 256, 1, 5632, 2048, 2048, 5632, 5632]
    - [97, 8048.0]
  - - [1024, 512, 1, 6656, 1024, 1024, 6656, 6656]
    - [128, 8064.0]
  - - [4096, 200, 1, 2080, 4096, 4096, 2080, 2080]
    - [138, 7508.0]
  - - [2048, 200, 1, 13312, 2048, 2048, 13312, 13312]
    - [103, 3068.0]
  - - [4096, 256, 1, 3584, 4096, 4096, 3584, 3584]
    - [126, 7475.0]
  - - [2048, 256, 1, 8192, 2048, 2048, 8192, 8192]
    - [134, 6326.0]
  - - [2048, 512, 1, 512, 2048, 2048, 512, 512]
    - [126, 8054.0]
  - - [2048, 512, 1, 1152, 2048, 2048, 1152, 1152]
    - [112, 8539.0]
  - - [2048, 200, 1, 9216, 2048, 2048, 9216, 9216]
    - [151, 5339.0]
  - - [2048, 200, 1, 2560, 2048, 2048, 2560, 2560]
    - [157, 6025.0]
  - - [2048, 256, 1, 4608, 2048, 2048, 4608, 4608]
    - [128, 7992.0]
  - - [2048, 256, 1, 3584, 2048, 2048, 3584, 3584]
    - [97, 8007.0]
  - - [1024, 512, 1, 640, 1024, 1024, 640, 640]
    - [121, 7285.0]
  - - [2048, 512, 1, 768, 2048, 2048, 768, 768]
    - [126, 8328.0]
  - - [2048, 200, 1, 1408, 2048, 2048, 1408, 1408]
    - [109, 6228.0]
  - - [4096, 200, 1, 2048, 4096, 4096, 2048, 2048]
    - [95, 6759.0]
  - - [1024, 1024, 1, 5632, 1024, 1024, 5632, 5632]
    - [95, 8826.0]
  - - [2048, 512, 1, 3584, 2048, 2048, 3584, 3584]
    - [95, 8784.0]
  - - [1024, 512, 1, 64, 1024, 1024, 64, 64]
    - [150, 4849.0]
  - - [4096, 200, 1, 7680, 4096, 4096, 7680, 7680]
    - [97, 6423.0]
  - - [1024, 1024, 1, 1280, 1024, 1024, 1280, 1280]
    - [95, 7799.0]
  - - [2048, 200, 1, 896, 2048, 2048, 896, 896]
    - [151, 5948.0]
  - - [2048, 256, 1, 32, 2048, 2048, 32, 32]
    - [72, 3396.0]
  - - [2048, 256, 1, 1280, 2048, 2048, 1280, 1280]
    - [113, 7604.0]
  - - [4096, 256, 1, 4096, 4096, 4096, 4096, 4096]
    - [157, 8104.0]
  - - [2048, 256, 1, 11264, 2048, 2048, 11264, 11264]
    - [130, 3719.0]
  - - [4096, 200, 1, 9216, 4096, 4096, 9216, 9216]
    - [97, 5690.0]
  - - [1024, 512, 1, 4096, 1024, 1024, 4096, 4096]
    - [157, 7459.0]
  - - [4096, 200, 1, 3840, 4096, 4096, 3840, 3840]
    - [128, 5860.0]
  - - [1024, 1024, 1, 1920, 1024, 1024, 1920, 1920]
    - [78, 8181.0]
  - - [2048, 200, 1, 7168, 2048, 2048, 7168, 7168]
    - [157, 5470.0]
  - - [4096, 256, 1, 1152, 4096, 4096, 1152, 1152]
    - [151, 8618.0]
  - - [2048, 256, 1, 1920, 2048, 2048, 1920, 1920]
    - [139, 7965.0]
  - - [2048, 512, 1, 4160, 2048, 2048, 4160, 4160]
    - [78, 8879.0]
  - - [2048, 512, 1, 5632, 2048, 2048, 5632, 5632]
    - [95, 8755.0]
  - - [4096, 256, 1, 7168, 4096, 4096, 7168, 7168]
    - [97, 7867.0]
  - - [4096, 200, 1, 128, 4096, 4096, 128, 128]
    - [146, 3533.0]
  - - [2048, 200, 1, 5120, 2048, 2048, 5120, 5120]
    - [157, 6293.0]
  - - [1024, 1024, 1, 6656, 1024, 1024, 6656, 6656]
    - [95, 8852.0]
  - - [512, 1024, 1, 3200, 512, 512, 3200, 3200]
    - [109, 8344.0]
  - - [2048, 256, 1, 1536, 2048, 2048, 1536, 1536]
    - [97, 7728.0]
  - - [4096, 256, 1, 256, 4096, 4096, 256, 256]
    - [113, 7411.0]
  - - [2048, 512, 1, 1408, 2048, 2048, 1408, 1408]
    - [141, 8638.0]
  - - [1024, 512, 1, 2080, 1024, 1024, 2080, 2080]
    - [78, 8498.0]
  - - [2048, 512, 1, 2304, 2048, 2048, 2304, 2304]
    - [95, 8709.0]
  - - [4096, 200, 1, 512, 4096, 4096, 512, 512]
    - [150, 6405.0]
  - - [2048, 200, 1, 1280, 2048, 2048, 1280, 1280]
    - [90, 6008.0]
  - - [1024, 1024, 1, 2304, 1024, 1024, 2304, 2304]
    - [95, 8696.0]
  - - [2048, 512, 1, 4608, 2048, 2048, 4608, 4608]
    - [95, 8828.0]
  - - [4096, 256, 1, 6144, 4096, 4096, 6144, 6144]
    - [100, 5780.0]
  - - [4096, 256, 1, 896, 4096, 4096, 896, 896]
    - [139, 8166.0]
  - - [2048, 256, 1, 640, 2048, 2048, 640, 640]
    - [109, 7388.0]
  - - [2048, 512, 1, 384, 2048, 2048, 384, 384]
    - [150, 8389.0]
  - - [2048, 200, 1, 16384, 2048, 2048, 16384, 16384]
    - [145, 4938.0]
  - - [4096, 200, 1, 10240, 4096, 4096, 10240, 10240]
    - [95, 4543.0]
  - - [1024, 512, 1, 9216, 1024, 1024, 9216, 9216]
    - [128, 7927.0]
  - - [4096, 200, 1, 1920, 4096, 4096, 1920, 1920]
    - [121, 6833.0]
  - - [2048, 512, 1, 7680, 2048, 2048, 7680, 7680]
    - [97, 7232.0]
  - - [1024, 512, 1, 3584, 1024, 1024, 3584, 3584]
    - [128, 7933.0]
  - - [1024, 1024, 1, 32, 1024, 1024, 32, 32]
    - [118, 3322.0]
  - - [2048, 512, 1, 1664, 2048, 2048, 1664, 1664]
    - [112, 8654.0]
  - - [2048, 200, 1, 2048, 2048, 2048, 2048, 2048]
    - [90, 6140.0]
  - - [1024, 1024, 1, 3584, 1024, 1024, 3584, 3584]
    - [95, 8811.0]
  - - [4096, 256, 1, 6656, 4096, 4096, 6656, 6656]
    - [97, 7129.0]
  - - [4096, 256, 1, 4160, 4096, 4096, 4160, 4160]
    - [126, 8099.0]
  - - [2048, 256, 1, 3072, 2048, 2048, 3072, 3072]
    - [128, 7764.0]
  - - [2048, 256, 1, 8320, 2048, 2048, 8320, 8320]
    - [86, 7204.0]
  - - [1024, 512, 1, 3200, 1024, 1024, 3200, 3200]
    - [139, 8291.0]
  - - [1024, 512, 1, 896, 1024, 1024, 896, 896]
    - [78, 7863.0]
  - - [2048, 512, 1, 1280, 2048, 2048, 1280, 1280]
    - [95, 8480.0]
  - - [4096, 200, 1, 64, 4096, 4096, 64, 64]
    - [135, 3936.0]
  - - [1024, 1024, 1, 5120, 1024, 1024, 5120, 5120]
    - [154, 8826.0]
  - - [2048, 512, 1, 6656, 2048, 2048, 6656, 6656]
    - [97, 8192.0]
  - - [1024, 1024, 1, 128, 1024, 1024, 128, 128]
    - [89, 6541.0]
  - - [512, 1024, 1, 1792, 512, 512, 1792, 1792]
    - [128, 7822.0]
  - - [4096, 256, 1, 2816, 4096, 4096, 2816, 2816]
    - [154, 8753.0]
  - - [1024, 1024, 1, 4096, 1024, 1024, 4096, 4096]
    - [97, 8490.0]
  - - [2048, 200, 1, 4160, 2048, 2048, 4160, 4160]
    - [151, 6773.0]
  - - [1024, 512, 1, 768, 1024, 1024, 768, 768]
    - [157, 7039.0]
  - - [4096, 200, 1, 8320, 4096, 4096, 8320, 8320]
    - [154, 6852.0]
  - - [2048, 512, 1, 896, 2048, 2048, 896, 896]
    - [150, 7953.0]
  - - [4096, 200, 1, 7168, 4096, 4096, 7168, 7168]
    - [103, 5311.0]
  - - [2048, 200, 1, 3840, 2048, 2048, 3840, 3840]
    - [143, 5933.0]
  - - [1024, 1024, 1, 768, 1024, 1024, 768, 768]
    - [126, 8139.0]
  - - [4096, 256, 1, 2304, 4096, 4096, 2304, 2304]
    - [95, 8687.0]
  - - [2048, 200, 1, 16640, 2048, 2048, 16640, 16640]
    - [103, 5635.0]
  - - [2048, 256, 1, 2816, 2048, 2048, 2816, 2816]
    - [97, 7400.0]
  - - [1024, 512, 1, 384, 1024, 1024, 384, 384]
    - [89, 6853.0]
  - - [2048, 200, 1, 7680, 2048, 2048, 7680, 7680]
    - [103, 5501.0]
  - - [1024, 512, 1, 4608, 1024, 1024, 4608, 4608]
    - [157, 7955.0]
  - - [4096, 200, 1, 32, 4096, 4096, 32, 32]
    - [124, 3236.0]
  - - [4096, 200, 1, 3328, 4096, 4096, 3328, 3328]
    - [97, 6372.0]
  - - [1024, 1024, 1, 1408, 1024, 1024, 1408, 1408]
    - [112, 8566.0]
  - - [2048, 200, 1, 15360, 2048, 2048, 15360, 15360]
    - [103, 5629.0]
  - - [512, 1024, 1, 2048, 512, 512, 2048, 2048]
    - [97, 7071.0]
  - - [4096, 256, 1, 5632, 4096, 4096, 5632, 5632]
    - [97, 4587.0]
  - - [2048, 256, 1, 1408, 2048, 2048, 1408, 1408]
    - [121, 7892.0]
  - - [2048, 256, 1, 6144, 2048, 2048, 6144, 6144]
    - [157, 8013.0]
  - - [4096, 256, 1, 3328, 4096, 4096, 3328, 3328]
    - [86, 7989.0]
  - - [2048, 512, 1, 6144, 2048, 2048, 6144, 6144]
    - [97, 8353.0]
  - - [2048, 512, 1, 3200, 2048, 2048, 3200, 3200]
    - [141, 8713.0]
  - - [2048, 200, 1, 4608, 2048, 2048, 4608, 4608]
    - [90, 6388.0]
  - - [1024, 1024, 1, 6144, 1024, 1024, 6144, 6144]
    - [154, 8787.0]
  - - [4096, 256, 1, 1664, 4096, 4096, 1664, 1664]
    - [139, 8700.0]
  - - [2048, 200, 1, 384, 2048, 2048, 384, 384]
    - [119, 5285.0]
  - - [4096, 256, 1, 1792, 4096, 4096, 1792, 1792]
    - [154, 8674.0]
  - - [2048, 512, 1, 2816, 2048, 2048, 2816, 2816]
    - [95, 8743.0]
  - - [4096, 256, 1, 384, 4096, 4096, 384, 384]
    - [121, 7989.0]
  - - [2048, 256, 1, 128, 2048, 2048, 128, 128]
    - [89, 5023.0]
  - - [1024, 1024, 1, 640, 1024, 1024, 640, 640]
    - [112, 8303.0]
  - - [4096, 200, 1, 5632, 4096, 4096, 5632, 5632]
    - [97, 4444.0]
  - - [2048, 200, 1, 1152, 2048, 2048, 1152, 1152]
    - [128, 6068.0]
  - - [4096, 256, 1, 512, 4096, 4096, 512, 512]
    - [126, 8107.0]
  - - [1024, 1024, 1, 384, 1024, 1024, 384, 384]
    - [150, 8171.0]
  - - [2048, 200, 1, 512, 2048, 2048, 512, 512]
    - [121, 5470.0]
  - - [2048, 256, 1, 9216, 2048, 2048, 9216, 9216]
    - [103, 5089.0]
  - - [2048, 256, 1, 1792, 2048, 2048, 1792, 1792]
    - [128, 7820.0]
  - - [4096, 200, 1, 1792, 4096, 4096, 1792, 1792]
    - [126, 6799.0]
  - - [2048, 200, 1, 1536, 2048, 2048, 1536, 1536]
    - [90, 6122.0]
  - - [1024, 1024, 1, 3072, 1024, 1024, 3072, 3072]
    - [97, 8435.0]
  - - [1024, 1024, 1, 2080, 1024, 1024, 2080, 2080]
    - [107, 9590.0]
  - - [2048, 200, 1, 2304, 2048, 2048, 2304, 2304]
    - [90, 6217.0]
  - - [2048, 256, 1, 7168, 2048, 2048, 7168, 7168]
    - [134, 6845.0]
  - - [2048, 512, 1, 1792, 2048, 2048, 1792, 1792]
    - [126, 8656.0]
  - - [1024, 1024, 1, 4608, 1024, 1024, 4608, 4608]
    - [95, 8841.0]
  - - [512, 1024, 1, 1280, 512, 512, 1280, 1280]
    - [90, 7748.0]
  - - [2048, 256, 1, 3200, 2048, 2048, 3200, 3200]
    - [139, 8320.0]
  - - [1024, 512, 1, 3328, 1024, 1024, 3328, 3328]
    - [97, 8016.0]
  - - [1024, 512, 1, 4160, 1024, 1024, 4160, 4160]
    - [109, 8736.0]
  - - [4096, 200, 1, 6656, 4096, 4096, 6656, 6656]
    - [97, 5596.0]
  - - [2048, 200, 1, 3328, 2048, 2048, 3328, 3328]
    - [90, 6161.0]
  - - [1024, 1024, 1, 256, 1024, 1024, 256, 256]
    - [97, 7822.0]
  - - [2048, 256, 1, 64, 2048, 2048, 64, 64]
    - [76, 4964.0]
  - - [2048, 256, 1, 2304, 2048, 2048, 2304, 2304]
    - [157, 7902.0]
  - - [4096, 200, 1, 8192, 4096, 4096, 8192, 8192]
    - [103, 5145.0]
  - - [1024, 512, 1, 7168, 1024, 1024, 7168, 7168]
    - [128, 7854.0]
  - - [1024, 512, 1, 1792, 1024, 1024, 1792, 1792]
    - [143, 7771.0]
  - - [4096, 200, 1, 2816, 4096, 4096, 2816, 2816]
    - [126, 6901.0]
  - - [1024, 1024, 1, 896, 1024, 1024, 896, 896]
    - [90, 8515.0]
  - - [4096, 256, 1, 5120, 4096, 4096, 5120, 5120]
    - [157, 5939.0]
  - - [4096, 256, 1, 2048, 4096, 4096, 2048, 2048]
    - [126, 8481.0]
  - - [2048, 256, 1, 5120, 2048, 2048, 5120, 5120]
    - [128, 7998.0]
  - - [2048, 256, 1, 7680, 2048, 2048, 7680, 7680]
    - [145, 6731.0]
  - - [2048, 200, 1, 3584, 2048, 2048, 3584, 3584]
    - [90, 6252.0]
  - - [1024, 512, 1, 1536, 1024, 1024, 1536, 1536]
    - [97, 7659.0]
  - - [2048, 200, 1, 64, 2048, 2048, 64, 64]
    - [107, 2819.0]
  - - [2048, 200, 1, 4096, 2048, 2048, 4096, 4096]
    - [97, 6142.0]
  - - [1024, 1024, 1, 1536, 1024, 1024, 1536, 1536]
    - [95, 8453.0]
  - - [4096, 256, 1, 32, 4096, 4096, 32, 32]
    - [82, 3745.0]
  - - [4096, 256, 1, 1280, 4096, 4096, 1280, 1280]
    - [126, 8546.0]
  - - [2048, 256, 1, 1024, 2048, 2048, 1024, 1024]
    - [97, 7419.0]
  - - [1024, 512, 1, 1152, 1024, 1024, 1152, 1152]
    - [78, 7785.0]
  - - [2048, 512, 1, 3328, 2048, 2048, 3328, 3328]
    - [95, 8805.0]
  - - [4096, 200, 1, 3584, 4096, 4096, 3584, 3584]
    - [154, 6123.0]
  - - [2048, 200, 1, 256, 2048, 2048, 256, 256]
    - [150, 4806.0]
  - - [4096, 256, 1, 1920, 4096, 4096, 1920, 1920]
    - [141, 8734.0]
  - - [2048, 256, 1, 1664, 2048, 2048, 1664, 1664]
    - [109, 7983.0]
  - - [4096, 200, 1, 5120, 4096, 4096, 5120, 5120]
    - [128, 5690.0]
  - - [1024, 512, 1, 8192, 1024, 1024, 8192, 8192]
    - [157, 7356.0]
  - - [4096, 200, 1, 896, 4096, 4096, 896, 896]
    - [151, 6659.0]
  - - [2048, 200, 1, 640, 2048, 2048, 640, 640]
    - [139, 5838.0]
  - - [4096, 200, 1, 1408, 4096, 4096, 1408, 1408]
    - [121, 6801.0]
  - - [2048, 200, 1, 5632, 2048, 2048, 5632, 5632]
    - [90, 6423.0]
  - - [1024, 512, 1, 2560, 1024, 1024, 2560, 2560]
    - [97, 7896.0]
  - - [4096, 200, 1, 1280, 4096, 4096, 1280, 1280]
    - [126, 6697.0]
  - - [1024, 1024, 1, 2560, 1024, 1024, 2560, 2560]
    - [95, 8636.0]
  - - [2048, 512, 1, 64, 2048, 2048, 64, 64]
    - [89, 5092.0]
  - - [2048, 200, 1, 8192, 2048, 2048, 8192, 8192]
    - [103, 5355.0]
  - - [2048, 512, 1, 3072, 2048, 2048, 3072, 3072]
    - [157, 8319.0]
  - - [4096, 256, 1, 640, 4096, 4096, 640, 640]
    - [139, 8271.0]
  - - [2048, 256, 1, 4096, 2048, 2048, 4096, 4096]
    - [157, 7971.0]
  - - [4096, 200, 1, 1664, 4096, 4096, 1664, 1664]
    - [121, 6799.0]
  - - [2048, 200, 1, 6656, 2048, 2048, 6656, 6656]
    - [113, 6202.0]
  - - [512, 1024, 1, 768, 512, 512, 768, 768]
    - [86, 7326.0]
  - - [2048, 200, 1, 8320, 2048, 2048, 8320, 8320]
    - [86, 5915.0]
  - - [4096, 256, 1, 3840, 4096, 4096, 3840, 3840]
    - [97, 7492.0]
  - - [1024, 1024, 1, 3200, 1024, 1024, 3200, 3200]
    - [154, 8783.0]
  - - [4096, 256, 1, 4608, 4096, 4096, 4608, 4608]
    - [97, 6271.0]
  - - [1024, 512, 1, 32, 1024, 1024, 32, 32]
    - [85, 2778.0]
  - - [1024, 512, 1, 3840, 1024, 1024, 3840, 3840]
    - [143, 7976.0]
  - - [2048, 512, 1, 1920, 2048, 2048, 1920, 1920]
    - [126, 8675.0]
  - - [4096, 200, 1, 6144, 4096, 4096, 6144, 6144]
    - [97, 6627.0]
  - - [2048, 200, 1, 2816, 2048, 2048, 2816, 2816]
    - [121, 5949.0]
  - - [1024, 1024, 1, 3840, 1024, 1024, 3840, 3840]
    - [95, 8478.0]
  - - [2048, 256, 1, 3840, 2048, 2048, 3840, 3840]
    - [157, 7920.0]
  - - [1024, 512, 1, 7680, 1024, 1024, 7680, 7680]
    - [143, 8105.0]
  - - [2048, 200, 1, 10240, 2048, 2048, 10240, 10240]
    - [103, 4313.0]
  - - [2048, 512, 1, 5120, 2048, 2048, 5120, 5120]
    - [154, 8604.0]
  - - [512, 1024, 1, 512, 512, 512, 512, 512]
    - [128, 6940.0]
  - - [2048, 512, 1, 32, 2048, 2048, 32, 32]
    - [104, 3322.0]
  - - [4096, 256, 1, 2560, 4096, 4096, 2560, 2560]
    - [154, 8758.0]
  - - [4096, 256, 1, 64, 4096, 4096, 64, 64]
    - [89, 5008.0]
  - - [2048, 200, 1, 768, 2048, 2048, 768, 768]
    - [151, 5933.0]
  - - [2048, 512, 1, 2560, 2048, 2048, 2560, 2560]
    - [95, 8710.0]
  - - [2048, 512, 1, 7168, 2048, 2048, 7168, 7168]
    - [97, 7431.0]
  - - [2048, 512, 1, 128, 2048, 2048, 128, 128]
    - [119, 6404.0]
  - - [4096, 200, 1, 2304, 4096, 4096, 2304, 2304]
    - [154, 6852.0]
  - - [2048, 512, 1, 4096, 2048, 2048, 4096, 4096]
    - [97, 8383.0]
  - - [2048, 256, 1, 2560, 2048, 2048, 2560, 2560]
    - [97, 7910.0]
  - - [2048, 256, 1, 4160, 2048, 2048, 4160, 4160]
    - [109, 8685.0]
  - - [1024, 512, 1, 1664, 1024, 1024, 1664, 1664]
    - [109, 8033.0]
  - - [2048, 512, 1, 2080, 2048, 2048, 2080, 2080]
    - [76, 9642.0]
  - - [2048, 512, 1, 3840, 2048, 2048, 3840, 3840]
    - [95, 8731.0]
  - - [4096, 200, 1, 3072, 4096, 4096, 3072, 3072]
    - [154, 6869.0]
  - - [1024, 1024, 1, 1664, 1024, 1024, 1664, 1664]
    - [112, 8682.0]
  - - [512, 1024, 1, 2304, 512, 512, 2304, 2304]
    - [128, 7898.0]
  - - [4096, 256, 1, 1408, 4096, 4096, 1408, 1408]
    - [154, 8651.0]
  - - [2048, 256, 1, 1152, 2048, 2048, 1152, 1152]
    - [121, 7820.0]
  - - [1024, 512, 1, 1280, 1024, 1024, 1280, 1280]
    - [90, 7682.0]
  - - [2048, 200, 1, 12288, 2048, 2048, 12288, 12288]
    - [152, 2899.0]
  - - [2048, 200, 1, 1664, 2048, 2048, 1664, 1664]
    - [139, 5979.0]
  - - [4096, 200, 1, 4608, 4096, 4096, 4608, 4608]
    - [97, 5662.0]
  - - [512, 1024, 1, 2560, 512, 512, 2560, 2560]
    - [128, 8027.0]
  - - [4096, 200, 1, 384, 4096, 4096, 384, 384]
    - [121, 6232.0]
  - - [2048, 200, 1, 128, 2048, 2048, 128, 128]
    - [81, 4052.0]
  - - [2048, 200, 1, 11264, 2048, 2048, 11264, 11264]
    - [123, 3155.0]
  - - [1024, 512, 1, 1920, 1024, 1024, 1920, 1920]
    - [139, 8017.0]
  - - [4096, 256, 1, 1536, 4096, 4096, 1536, 1536]
    - [126, 8628.0]
  - - [2048, 256, 1, 256, 2048, 2048, 256, 256]
    - [90, 6278.0]
  - - [2048, 256, 1, 10240, 2048, 2048, 10240, 10240]
    - [103, 5405.0]
  - - [1024, 512, 1, 5120, 1024, 1024, 5120, 5120]
    - [157, 7939.0]
  - - [1024, 512, 1, 8320, 1024, 1024, 8320, 8320]
    - [139, 8483.0]
  - - [1024, 512, 1, 10240, 1024, 1024, 10240, 10240]
    - [157, 7618.0]
  - - [1024, 1024, 1, 2048, 1024, 1024, 2048, 2048]
    - [154, 8079.0]
  - - [2048, 256, 1, 2080, 2048, 2048, 2080, 2080]
    - [109, 8504.0]
  - - [4096, 256, 1, 128, 4096, 4096, 128, 128]
    - [151, 6337.0]
  - - [2048, 256, 1, 896, 2048, 2048, 896, 896]
    - [121, 7604.0]
  - - [4096, 200, 1, 1152, 4096, 4096, 1152, 1152]
    - [151, 6711.0]
  - - [2048, 200, 1, 6144, 2048, 2048, 6144, 6144]
    - [128, 6315.0]
  - - [1024, 1024, 1, 7680, 1024, 1024, 7680, 7680]
    - [141, 8530.0]
  - - [2048, 200, 1, 1920, 2048, 2048, 1920, 1920]
    - [139, 6285.0]
  - - [4096, 256, 1, 2080, 4096, 4096, 2080, 2080]
    - [89, 9593.0]
  - - [2048, 200, 1, 14336, 2048, 2048, 14336, 14336]
    - [103, 5565.0]
  - - [1024, 512, 1, 6144, 1024, 1024, 6144, 6144]
    - [157, 7788.0]
  - - [1024, 512, 1, 2304, 1024, 1024, 2304, 2304]
    - [90, 7904.0]
  - - [4096, 200, 1, 4160, 4096, 4096, 4160, 4160]
    - [128, 6542.0]
  - - [4096, 200, 1, 1536, 4096, 4096, 1536, 1536]
    - [154, 6787.0]
  - - [2048, 320, 1, 64, 2048, 2048, 64, 64]
    - [76, 4018.0]
  - - [2048, 384, 1, 64, 2048, 2048, 64, 64]
    - [107, 4849.0]
  - - [1024, 384, 1, 289, 1024, 1024, 289, 289]
    - [107, 5919.0]
  - - [2048, 448, 1, 64, 2048, 2048, 64, 64]
    - [107, 5943.0]
  - - [102, 101, 624, 64, 102, 102, 64, 64]
    - [137, 4484.0]
  - - [101, 101, 624, 64, 101, 101, 64, 64]
    - [81, 4470.0]
  - - [85, 85, 752, 64, 85, 85, 64, 64]
    - [136, 4054.0]
  - - [112, 111, 576, 64, 112, 112, 64, 64]
    - [110, 5661.0]
  - - [65, 65, 992, 64, 65, 65, 64, 64]
    - [105, 2663.0]
  - - [77, 77, 816, 64, 77, 77, 64, 64]
    - [105, 3599.0]
  - - [111, 111, 576, 64, 111, 111, 64, 64]
    - [81, 5017.0]
  - - [84, 85, 752, 64, 84, 84, 64, 64]
    - [73, 4046.0]
  - - [84, 84, 752, 64, 84, 84, 64, 64]
    - [73, 4051.0]
  - - [71, 71, 896, 64, 71, 71, 64, 64]
    - [87, 3100.0]
  - - [122, 122, 528, 64, 122, 122, 64, 64]
    - [83, 5248.0]
  - - [78, 78, 816, 64, 78, 78, 64, 64]
    - [73, 3689.0]
  - - [112, 112, 576, 64, 112, 112, 64, 64]
    - [140, 5712.0]
  - - [77, 78, 816, 64, 77, 77, 64, 64]
    - [105, 3605.0]
  - - [111, 112, 576, 64, 111, 111, 64, 64]
    - [140, 5079.0]
  - - [92, 93, 688, 64, 92, 92, 64, 64]
    - [105, 4345.0]
  - - [102, 102, 624, 64, 102, 102, 64, 64]
    - [137, 4537.0]
  - - [99, 99, 624, 64, 99, 99, 64, 64]
    - [81, 4401.0]
  - - [100, 102, 624, 64, 100, 100, 64, 64]
    - [81, 4469.0]
  - - [123, 122, 528, 64, 123, 123, 64, 64]
    - [83, 5312.0]
  - - [99, 102, 624, 64, 99, 99, 64, 64]
    - [81, 4511.0]
  - - [93, 93, 688, 64, 93, 93, 64, 64]
    - [73, 4342.0]
  - - [123, 123, 528, 64, 123, 123, 64, 64]
    - [153, 5255.0]
  - - [100, 100, 624, 64, 100, 100, 64, 64]
    - [140, 4413.0]
  - - [101, 102, 624, 64, 101, 101, 64, 64]
    - [81, 4534.0]
  - - [102, 100, 624, 64, 102, 102, 64, 64]
    - [140, 4527.0]
  - - [92, 92, 688, 64, 92, 92, 64, 64]
    - [73, 4317.0]
  - - [3072, 128, 1, 4096, 3072, 3072, 4096, 4096]
    - [123, 6954.0]
  - - [1728, 320, 1, 64, 1728, 1728, 64, 64]
    - [118, 3898.0]
  - - [1440, 320, 1, 196, 1440, 1440, 196, 196]
    - [119, 6369.0]
  - - [2592, 384, 1, 289, 2592, 2592, 289, 289]
    - [138, 7808.0]
  - - [192, 80, 36, 10368, 192, 192, 10368, 10368]
    - [127, 4087.0]
  - - [1280, 384, 1, 64, 1280, 1280, 64, 64]
    - [77, 4117.0]
  - - [1280, 448, 1, 64, 1280, 1280, 64, 64]
    - [76, 3896.0]
  - - [3456, 256, 1, 169, 3456, 3456, 169, 169]
    - [121, 7007.0]
  - - [2304, 256, 1, 196, 2304, 2304, 196, 196]
    - [76, 6509.0]
  - - [224, 192, 36, 2592, 224, 224, 2592, 2592]
    - [84, 8433.0]
  - - [192, 128, 36, 1568, 192, 192, 1568, 1568]
    - [78, 7370.0]
  - - [1296, 288, 1, 196, 1296, 1296, 196, 196]
    - [150, 4630.0]
  - - [192, 64, 36, 6272, 192, 192, 6272, 6272]
    - [152, 5683.0]
  - - [1728, 224, 1, 1225, 1728, 1728, 1225, 1225]
    - [76, 7333.0]
  - - [1152, 384, 1, 64, 1152, 1152, 64, 64]
    - [72, 3300.0]
  - - [1792, 256, 1, 289, 1792, 1792, 289, 289]
    - [154, 6827.0]
  - - [1728, 384, 1, 169, 1728, 1728, 169, 169]
    - [73, 6182.0]
  - - [1568, 256, 1, 289, 1568, 1568, 289, 289]
    - [76, 6093.0]
  - - [1152, 448, 1, 64, 1152, 1152, 64, 64]
    - [75, 3762.0]
  - - [1536, 256, 1, 64, 1536, 1536, 64, 64]
    - [147, 3329.0]
  - - [1440, 320, 1, 49, 1440, 1440, 49, 49]
    - [104, 3068.0]
  - - [1344, 512, 1, 64, 1344, 1344, 64, 64]
    - [118, 4352.0]
  - - [1152, 256, 1, 196, 1152, 1152, 196, 196]
    - [138, 4857.0]
  - - [1728, 192, 1, 1225, 1728, 1728, 1225, 1225]
    - [138, 6344.0]
  - - [2048, 512, 1, 49, 2048, 2048, 49, 49]
    - [104, 4875.0]
  - - [512, 2048, 1, 49, 512, 512, 49, 49]
    - [73, 4347.0]
  - - [1728, 192, 1, 64, 1728, 1728, 64, 64]
    - [104, 4115.0]
  - - [1536, 384, 1, 64, 1536, 1536, 64, 64]
    - [107, 5393.0]
  - - [2048, 192, 1, 64, 2048, 2048, 64, 64]
    - [137, 4354.0]
  - - [128, 96, 36, 1568, 128, 128, 1568, 1568]
    - [151, 6857.0]
  - - [128, 128, 36, 3136, 128, 128, 3136, 3136]
    - [128, 8771.0]
  - - [1280, 320, 1, 64, 1280, 1280, 64, 64]
    - [74, 3682.0]
  - - [1792, 320, 1, 289, 1792, 1792, 289, 289]
    - [138, 6519.0]
  - - [2880, 320, 1, 64, 2880, 2880, 64, 64]
    - [105, 5201.0]
  - - [1728, 384, 1, 49, 1728, 1728, 49, 49]
    - [106, 3519.0]
  - - [512, 1024, 1, 196, 512, 512, 196, 196]
    - [138, 5919.0]
  - - [224, 192, 36, 5184, 224, 224, 5184, 5184]
    - [141, 8466.0]
  - - [192, 80, 36, 20736, 192, 192, 20736, 20736]
    - [156, 2734.0]
