library/src/blas3/Tensile/Logic/asm_full/navi22_Cijk_Ailk_Bjlk_SB_GB.yaml
---
- {MinimumRequiredVersion: 4.28.0}
- navi22
- gfx1031
    SolutionIndex: 0
    SolutionNameMin: Cijk_Ailk_Bjlk_SB_GB_MT128x64x8_SN_SU0_SUM0_TT8_8_WG16_8_1_WGM1
    SolutionIndex: 1
    SolutionNameMin: Cijk_Ailk_Bjlk_SB_GB_MT128x128x8_SN_SU0_SUM0_TT8_16_WG16_8_1_WGM1
    SolutionIndex: 2
    SolutionNameMin: Cijk_Ailk_Bjlk_SB_GB_MT128x128x8_SN_SU0_SUM0_TT8_8_WG16_16_1_WGM1
    SolutionIndex: 3
    SolutionNameMin: Cijk_Ailk_Bjlk_SB_GB_MT128x64x16_SN_SU0_SUM0_TT8_8_WG16_8_1_WGM1
    SolutionIndex: 4
    SolutionNameMin: Cijk_Ailk_Bjlk_SB_GB_MT128x128x16_SN_SU0_SUM0_TT8_16_WG16_8_1_WGM1
    SolutionIndex: 5
    SolutionNameMin: Cijk_Ailk_Bjlk_SB_GB_MT128x128x16_SN_SU0_SUM0_TT8_8_WG16_16_1_WGM1
    SolutionIndex: 6
    SolutionNameMin: Cijk_Ailk_Bjlk_SB_GB_MT128x256x16_SN_SU0_SUM0_TT8_16_WG16_16_1_WGM1
    SolutionIndex: 7
    SolutionNameMin: Cijk_Ailk_Bjlk_SB_GB_MT128x128x32_SN_SU0_SUM0_TT8_8_WG16_16_1_WGM1
    SolutionIndex: 8
    SolutionNameMin: Cijk_Ailk_Bjlk_SB_GB_MT128x64x8_SN_SU32_SUM3_TT8_8_WG16_8_1_WGM1
    SolutionIndex: 9
    SolutionNameMin: Cijk_Ailk_Bjlk_SB_GB_MT128x128x8_SN_SU32_SUM3_TT8_16_WG16_8_1_WGM1
    SolutionIndex: 10
    SolutionNameMin: Cijk_Ailk_Bjlk_SB_GB_MT128x128x8_SN_SU32_SUM3_TT8_8_WG16_16_1_WGM1
    SolutionIndex: 11
    SolutionNameMin: Cijk_Ailk_Bjlk_SB_GB_MT128x64x16_SN_SU32_SUM3_TT8_8_WG16_8_1_WGM1
    SolutionIndex: 12
    SolutionNameMin: Cijk_Ailk_Bjlk_SB_GB_MT128x128x16_SN_SU32_SUM3_TT8_16_WG16_8_1_WGM1
    SolutionIndex: 13
    SolutionNameMin: Cijk_Ailk_Bjlk_SB_GB_MT128x128x16_SN_SU32_SUM3_TT8_8_WG16_16_1_WGM1
    SolutionIndex: 14
    SolutionNameMin: Cijk_Ailk_Bjlk_SB_GB_MT128x256x16_SN_SU32_SUM3_TT8_16_WG16_16_1_WGM1
    SolutionIndex: 15
    SolutionNameMin: Cijk_Ailk_Bjlk_SB_GB_MT128x64x8_SN_SU0_SUM0_TT8_8_WG16_8_1_WGM4
    SolutionIndex: 16
    SolutionNameMin: Cijk_Ailk_Bjlk_SB_GB_MT128x128x8_SN_SU0_SUM0_TT8_16_WG16_8_1_WGM4
    SolutionIndex: 17
    SolutionNameMin: Cijk_Ailk_Bjlk_SB_GB_MT128x128x8_SN_SU0_SUM0_TT8_8_WG16_16_1_WGM4
    SolutionIndex: 18
    SolutionNameMin: Cijk_Ailk_Bjlk_SB_GB_MT128x64x16_SN_SU0_SUM0_TT8_8_WG16_8_1_WGM4
    SolutionIndex: 19
    SolutionNameMin: Cijk_Ailk_Bjlk_SB_GB_MT128x128x16_SN_SU0_SUM0_TT8_16_WG16_8_1_WGM4
    SolutionIndex: 20
    SolutionNameMin: Cijk_Ailk_Bjlk_SB_GB_MT128x128x16_SN_SU0_SUM0_TT8_8_WG16_16_1_WGM4
    SolutionIndex: 21
    SolutionNameMin: Cijk_Ailk_Bjlk_SB_GB_MT128x256x16_SN_SU0_SUM0_TT8_16_WG16_16_1_WGM4
    SolutionIndex: 22
    SolutionNameMin: Cijk_Ailk_Bjlk_SB_GB_MT128x128x32_SN_SU0_SUM0_TT8_8_WG16_16_1_WGM4
    SolutionIndex: 23
    SolutionNameMin: Cijk_Ailk_Bjlk_SB_GB_MT128x64x8_SN_SU32_SUM3_TT8_8_WG16_8_1_WGM4
    SolutionIndex: 24
    SolutionNameMin: Cijk_Ailk_Bjlk_SB_GB_MT128x128x8_SN_SU32_SUM3_TT8_16_WG16_8_1_WGM4
    SolutionIndex: 25
    SolutionNameMin: Cijk_Ailk_Bjlk_SB_GB_MT128x128x8_SN_SU32_SUM3_TT8_8_WG16_16_1_WGM4
    SolutionIndex: 26
    SolutionNameMin: Cijk_Ailk_Bjlk_SB_GB_MT128x64x16_SN_SU32_SUM3_TT8_8_WG16_8_1_WGM4
    SolutionIndex: 27
    SolutionNameMin: Cijk_Ailk_Bjlk_SB_GB_MT128x128x16_SN_SU32_SUM3_TT8_16_WG16_8_1_WGM4
    SolutionIndex: 28
    SolutionNameMin: Cijk_Ailk_Bjlk_SB_GB_MT128x128x16_SN_SU32_SUM3_TT8_8_WG16_16_1_WGM4
    SolutionIndex: 29
    SolutionNameMin: Cijk_Ailk_Bjlk_SB_GB_MT128x256x16_SN_SU32_SUM3_TT8_16_WG16_16_1_WGM4
    SolutionIndex: 30
    SolutionNameMin: Cijk_Ailk_Bjlk_SB_GB_MT128x64x8_SN_SU0_SUM0_TT8_8_WG16_8_1_WGM8
    SolutionIndex: 31
    SolutionNameMin: Cijk_Ailk_Bjlk_SB_GB_MT128x128x8_SN_SU0_SUM0_TT8_16_WG16_8_1_WGM8
    SolutionIndex: 32
    SolutionNameMin: Cijk_Ailk_Bjlk_SB_GB_MT128x128x8_SN_SU0_SUM0_TT8_8_WG16_16_1_WGM8
    SolutionIndex: 33
    SolutionNameMin: Cijk_Ailk_Bjlk_SB_GB_MT128x256x8_SN_SU0_SUM0_TT8_16_WG16_16_1_WGM8
    SolutionIndex: 34
    SolutionNameMin: Cijk_Ailk_Bjlk_SB_GB_MT128x64x16_SN_SU0_SUM0_TT8_8_WG16_8_1_WGM8
    SolutionIndex: 35
    SolutionNameMin: Cijk_Ailk_Bjlk_SB_GB_MT128x128x16_SN_SU0_SUM0_TT8_16_WG16_8_1_WGM8
    SolutionIndex: 36
    SolutionNameMin: Cijk_Ailk_Bjlk_SB_GB_MT128x128x16_SN_SU0_SUM0_TT8_8_WG16_16_1_WGM8
    SolutionIndex: 37
    SolutionNameMin: Cijk_Ailk_Bjlk_SB_GB_MT128x256x16_SN_SU0_SUM0_TT8_16_WG16_16_1_WGM8
    SolutionIndex: 38
    SolutionNameMin: Cijk_Ailk_Bjlk_SB_GB_MT128x128x32_SN_SU0_SUM0_TT8_8_WG16_16_1_WGM8
    SolutionIndex: 39
    SolutionNameMin: Cijk_Ailk_Bjlk_SB_GB_MT128x64x8_SN_SU32_SUM3_TT8_8_WG16_8_1_WGM8
    SolutionIndex: 40
    SolutionNameMin: Cijk_Ailk_Bjlk_SB_GB_MT128x128x8_SN_SU32_SUM3_TT8_16_WG16_8_1_WGM8
    SolutionIndex: 41
    SolutionNameMin: Cijk_Ailk_Bjlk_SB_GB_MT128x64x16_SN_SU32_SUM3_TT8_8_WG16_8_1_WGM8
    SolutionIndex: 42
    SolutionNameMin: Cijk_Ailk_Bjlk_SB_GB_MT128x128x16_SN_SU32_SUM3_TT8_16_WG16_8_1_WGM8
    SolutionIndex: 43
    SolutionNameMin: Cijk_Ailk_Bjlk_SB_GB_MT128x128x16_SN_SU32_SUM3_TT8_8_WG16_16_1_WGM8
    SolutionIndex: 44
    SolutionNameMin: Cijk_Ailk_Bjlk_SB_GB_MT128x128x8_SN_SU0_SUM0_TT8_16_WG16_8_1_WGM1
    SolutionIndex: 45
    SolutionNameMin: Cijk_Ailk_Bjlk_SB_GB_MT128x64x16_SN_SU0_SUM0_TT8_8_WG16_8_1_WGM1
    SolutionIndex: 46
    SolutionNameMin: Cijk_Ailk_Bjlk_SB_GB_MT128x128x16_SN_SU0_SUM0_TT8_16_WG16_8_1_WGM1
    SolutionIndex: 47
    SolutionNameMin: Cijk_Ailk_Bjlk_SB_GB_MT128x128x16_SN_SU32_SUM3_TT8_16_WG16_8_1_WGM1
    SolutionIndex: 48
    SolutionNameMin: Cijk_Ailk_Bjlk_SB_GB_MT128x64x8_SN_SU0_SUM0_TT8_8_WG16_8_1_WGM4
    SolutionIndex: 49
    SolutionNameMin: Cijk_Ailk_Bjlk_SB_GB_MT128x64x16_SN_SU0_SUM0_TT8_8_WG16_8_1_WGM4
    SolutionIndex: 50
    SolutionNameMin: Cijk_Ailk_Bjlk_SB_GB_MT128x128x16_SN_SU0_SUM0_TT8_16_WG16_8_1_WGM4
    SolutionIndex: 51
    SolutionNameMin: Cijk_Ailk_Bjlk_SB_GB_MT128x128x16_SN_SU0_SUM0_TT8_8_WG16_16_1_WGM4
    SolutionIndex: 52
    SolutionNameMin: Cijk_Ailk_Bjlk_SB_GB_MT128x128x32_SN_SU32_SUM3_TT8_8_WG16_16_1_WGM4
    SolutionIndex: 53
    SolutionNameMin: Cijk_Ailk_Bjlk_SB_GB_MT128x64x8_SN_SU0_SUM0_TT8_8_WG16_8_1_WGM8
    SolutionIndex: 54
    SolutionNameMin: Cijk_Ailk_Bjlk_SB_GB_MT128x64x16_SN_SU0_SUM0_TT8_8_WG16_8_1_WGM8
    SolutionIndex: 55
    SolutionNameMin: Cijk_Ailk_Bjlk_SB_GB_MT32x32x8_SN_SU0_SUM0_TT4_4_WG8_8_1_WGM1
    SolutionIndex: 56
    SolutionNameMin: Cijk_Ailk_Bjlk_SB_GB_MT32x64x8_SN_SU0_SUM0_TT4_8_WG8_8_1_WGM1
    SolutionIndex: 57
    SolutionNameMin: Cijk_Ailk_Bjlk_SB_GB_MT64x64x8_SN_SU0_SUM0_TT8_8_WG8_8_1_WGM1
    SolutionIndex: 58
    SolutionNameMin: Cijk_Ailk_Bjlk_SB_GB_MT64x64x8_SN_SU0_SUM0_TT4_8_WG16_8_1_WGM1
    SolutionIndex: 59
    SolutionNameMin: Cijk_Ailk_Bjlk_SB_GB_MT128x64x8_SN_SU0_SUM0_TT8_8_WG16_8_1_WGM1
    SolutionIndex: 60
    SolutionNameMin: Cijk_Ailk_Bjlk_SB_GB_MT128x128x8_SN_SU0_SUM0_TT8_8_WG16_16_1_WGM1
    SolutionIndex: 61
    SolutionNameMin: Cijk_Ailk_Bjlk_SB_GB_MT64x64x16_SN_SU0_SUM0_TT8_8_WG8_8_1_WGM1
    SolutionIndex: 63
    SolutionNameMin: Cijk_Ailk_Bjlk_SB_GB_MT128x64x16_SN_SU0_SUM0_TT8_8_WG16_8_1_WGM1
    SolutionIndex: 64
    SolutionNameMin: Cijk_Ailk_Bjlk_SB_GB_MT64x64x16_SN_SU0_SUM0_TT4_4_WG16_16_1_WGM1
    SolutionIndex: 65
    SolutionNameMin: Cijk_Ailk_Bjlk_SB_GB_MT128x128x16_SN_SU0_SUM0_TT8_8_WG16_16_1_WGM1
    SolutionIndex: 66
    SolutionNameMin: Cijk_Ailk_Bjlk_SB_GB_MT64x64x32_SN_SU0_SUM0_TT8_8_WG8_8_1_WGM1
    SolutionIndex: 68
    SolutionNameMin: Cijk_Ailk_Bjlk_SB_GB_MT32x32x8_SN_SU32_SUM3_TT4_4_WG8_8_1_WGM1
    SolutionIndex: 69
    SolutionNameMin: Cijk_Ailk_Bjlk_SB_GB_MT32x64x8_SN_SU32_SUM3_TT4_8_WG8_8_1_WGM1
    SolutionIndex: 70
    SolutionNameMin: Cijk_Ailk_Bjlk_SB_GB_MT64x64x8_SN_SU32_SUM3_TT8_8_WG8_8_1_WGM1
    SolutionIndex: 71
    SolutionNameMin: Cijk_Ailk_Bjlk_SB_GB_MT64x64x8_SN_SU32_SUM3_TT4_8_WG16_8_1_WGM1
    SolutionIndex: 72
    SolutionNameMin: Cijk_Ailk_Bjlk_SB_GB_MT128x64x8_SN_SU32_SUM3_TT8_8_WG16_8_1_WGM1
    SolutionIndex: 74
    SolutionNameMin: Cijk_Ailk_Bjlk_SB_GB_MT128x64x16_SN_SU32_SUM3_TT8_8_WG16_8_1_WGM1
    SolutionIndex: 75
    SolutionNameMin: Cijk_Ailk_Bjlk_SB_GB_MT64x128x16_SN_SU32_SUM3_TT4_8_WG16_16_1_WGM1
    SolutionIndex: 76
    SolutionNameMin: Cijk_Ailk_Bjlk_SB_GB_MT128x128x16_SN_SU32_SUM3_TT8_8_WG16_16_1_WGM1
    SolutionIndex: 77
    SolutionNameMin: Cijk_Ailk_Bjlk_SB_GB_MT32x32x8_SN_SU0_SUM0_TT4_4_WG8_8_1_WGM4
    SolutionIndex: 78
    SolutionNameMin: Cijk_Ailk_Bjlk_SB_GB_MT32x64x8_SN_SU0_SUM0_TT4_8_WG8_8_1_WGM4
    SolutionIndex: 79
    SolutionNameMin: Cijk_Ailk_Bjlk_SB_GB_MT64x64x8_SN_SU0_SUM0_TT8_8_WG8_8_1_WGM4
    SolutionIndex: 80
    SolutionNameMin: Cijk_Ailk_Bjlk_SB_GB_MT64x64x8_SN_SU0_SUM0_TT4_8_WG16_8_1_WGM4
    SolutionIndex: 81
    SolutionNameMin: Cijk_Ailk_Bjlk_SB_GB_MT128x64x8_SN_SU0_SUM0_TT8_8_WG16_8_1_WGM4
    SolutionIndex: 82
    SolutionNameMin: Cijk_Ailk_Bjlk_SB_GB_MT128x128x8_SN_SU0_SUM0_TT8_8_WG16_16_1_WGM4
    SolutionIndex: 83
    SolutionNameMin: Cijk_Ailk_Bjlk_SB_GB_MT64x64x16_SN_SU0_SUM0_TT8_8_WG8_8_1_WGM4
    SolutionIndex: 84
    SolutionNameMin: Cijk_Ailk_Bjlk_SB_GB_MT64x32x16_SN_SU0_SUM0_TT4_4_WG16_8_1_WGM4
    SolutionIndex: 85
    SolutionNameMin: Cijk_Ailk_Bjlk_SB_GB_MT64x64x16_SN_SU0_SUM0_TT4_8_WG16_8_1_WGM4
    SolutionIndex: 86
    SolutionNameMin: Cijk_Ailk_Bjlk_SB_GB_MT128x64x16_SN_SU0_SUM0_TT8_8_WG16_8_1_WGM4
    SolutionIndex: 87
    SolutionNameMin: Cijk_Ailk_Bjlk_SB_GB_MT64x64x16_SN_SU0_SUM0_TT4_4_WG16_16_1_WGM4
    SolutionIndex: 88
    SolutionNameMin: Cijk_Ailk_Bjlk_SB_GB_MT128x128x16_SN_SU0_SUM0_TT8_8_WG16_16_1_WGM4
    SolutionIndex: 90
    SolutionNameMin: Cijk_Ailk_Bjlk_SB_GB_MT128x128x32_SN_SU0_SUM0_TT8_8_WG16_16_1_WGM4
    SolutionIndex: 91
    SolutionNameMin: Cijk_Ailk_Bjlk_SB_GB_MT32x64x8_SN_SU32_SUM3_TT4_8_WG8_8_1_WGM4
    SolutionIndex: 92
    SolutionNameMin: Cijk_Ailk_Bjlk_SB_GB_MT64x64x8_SN_SU32_SUM3_TT8_8_WG8_8_1_WGM4
    SolutionIndex: 93
    SolutionNameMin: Cijk_Ailk_Bjlk_SB_GB_MT64x64x8_SN_SU32_SUM3_TT4_8_WG16_8_1_WGM4
    SolutionIndex: 94
    SolutionNameMin: Cijk_Ailk_Bjlk_SB_GB_MT128x64x8_SN_SU32_SUM3_TT8_8_WG16_8_1_WGM4
    SolutionIndex: 95
    SolutionNameMin: Cijk_Ailk_Bjlk_SB_GB_MT128x64x16_SN_SU32_SUM3_TT8_8_WG16_8_1_WGM4
    SolutionIndex: 97
    SolutionNameMin: Cijk_Ailk_Bjlk_SB_GB_MT128x128x16_SN_SU32_SUM3_TT8_8_WG16_16_1_WGM4
    SolutionIndex: 98
    SolutionNameMin: Cijk_Ailk_Bjlk_SB_GB_MT128x128x32_SN_SU32_SUM3_TT8_8_WG16_16_1_WGM4
    SolutionIndex: 99
    SolutionNameMin: Cijk_Ailk_Bjlk_SB_GB_MT32x32x8_SN_SU0_SUM0_TT4_4_WG8_8_1_WGM8
    SolutionIndex: 100
    SolutionNameMin: Cijk_Ailk_Bjlk_SB_GB_MT32x64x8_SN_SU0_SUM0_TT4_8_WG8_8_1_WGM8
    SolutionIndex: 101
    SolutionNameMin: Cijk_Ailk_Bjlk_SB_GB_MT64x64x8_SN_SU0_SUM0_TT8_8_WG8_8_1_WGM8
    SolutionIndex: 102
    SolutionNameMin: Cijk_Ailk_Bjlk_SB_GB_MT64x64x8_SN_SU0_SUM0_TT4_8_WG16_8_1_WGM8
    SolutionIndex: 103
    SolutionNameMin: Cijk_Ailk_Bjlk_SB_GB_MT128x64x8_SN_SU0_SUM0_TT8_8_WG16_8_1_WGM8
    SolutionIndex: 104
    SolutionNameMin: Cijk_Ailk_Bjlk_SB_GB_MT128x128x8_SN_SU0_SUM0_TT8_8_WG16_16_1_WGM8
    SolutionIndex: 105
    SolutionNameMin: Cijk_Ailk_Bjlk_SB_GB_MT64x64x16_SN_SU0_SUM0_TT8_8_WG8_8_1_WGM8
    SolutionIndex: 106
    SolutionNameMin: Cijk_Ailk_Bjlk_SB_GB_MT128x64x16_SN_SU0_SUM0_TT8_8_WG16_8_1_WGM8
    SolutionIndex: 107
    SolutionNameMin: Cijk_Ailk_Bjlk_SB_GB_MT64x64x16_SN_SU0_SUM0_TT4_4_WG16_16_1_WGM8
    SolutionIndex: 108
    SolutionNameMin: Cijk_Ailk_Bjlk_SB_GB_MT128x128x16_SN_SU0_SUM0_TT8_8_WG16_16_1_WGM8
    SolutionIndex: 109
    SolutionNameMin: Cijk_Ailk_Bjlk_SB_GB_MT64x64x32_SN_SU0_SUM0_TT8_8_WG8_8_1_WGM8
    SolutionIndex: 110
    SolutionNameMin: Cijk_Ailk_Bjlk_SB_GB_MT64x64x32_SN_SU0_SUM0_TT4_8_WG16_8_1_WGM8
    SolutionIndex: 113
    SolutionNameMin: Cijk_Ailk_Bjlk_SB_GB_MT64x64x8_SN_SU32_SUM3_TT8_8_WG8_8_1_WGM8
    SolutionIndex: 114
    SolutionNameMin: Cijk_Ailk_Bjlk_SB_GB_MT128x64x8_SN_SU32_SUM3_TT8_8_WG16_8_1_WGM8
    SolutionIndex: 115
    SolutionNameMin: Cijk_Ailk_Bjlk_SB_GB_MT128x128x8_SN_SU32_SUM3_TT8_8_WG16_16_1_WGM8
    SolutionIndex: 118
    SolutionNameMin: Cijk_Ailk_Bjlk_SB_GB_MT64x64x32_SN_SU32_SUM3_TT4_4_WG16_16_1_WGM8
- - - [2048, 2048, 1, 512, 2048, 2048, 2048, 2048]
    - [1, 11980.0]
  - - [1600, 1024, 1, 512, 1600, 1600, 1600, 1024]
    - [0, 10488.0]
  - - [4096, 1024, 1, 4096, 4096, 4096, 4096, 1024]
    - [19, 12373.0]
  - - [4096, 1024, 1, 2048, 4096, 4096, 4096, 1024]
    - [16, 12322.0]
  - - [3072, 768, 1, 4096, 3072, 3072, 3072, 768]
    - [3, 11543.0]
  - - [3072, 1024, 1, 2048, 3072, 3072, 3072, 1024]
    - [31, 11945.0]
  - - [3072, 1024, 1, 3072, 3072, 3072, 3072, 1024]
    - [16, 11992.0]
  - - [3072, 1024, 1, 512, 3072, 3072, 3072, 1024]
    - [20, 11659.0]
  - - [2944, 4288, 1, 1280, 2944, 2944, 2944, 4288]
    - [19, 12263.0]
  - - [2368, 5888, 1, 256, 2368, 2368, 2368, 5888]
    - [1, 11927.0]
  - - [5888, 1024, 1, 1280, 5888, 5888, 5888, 1024]
    - [19, 12209.0]
  - - [5888, 1856, 1, 3328, 5888, 5888, 5888, 1856]
    - [34, 12202.0]
  - - [5056, 704, 1, 256, 5056, 5056, 5056, 704]
    - [0, 11419.0]
  - - [5888, 2944, 1, 3328, 5888, 5888, 5888, 2944]
    - [35, 12775.0]
  - - [1856, 4288, 1, 256, 1856, 1856, 1856, 4288]
    - [0, 11391.0]
  - - [1024, 5056, 1, 128, 1024, 1024, 1024, 5056]
    - [0, 11517.0]
  - - [5056, 5056, 1, 3328, 5056, 5056, 5056, 5056]
    - [35, 12502.0]
  - - [1408, 5888, 1, 1280, 1408, 1408, 1408, 5888]
    - [31, 12329.0]
  - - [1024, 3584, 1, 3328, 1024, 1024, 1024, 3584]
    - [3, 11819.0]
  - - [5888, 1408, 1, 1280, 5888, 5888, 5888, 1408]
    - [1, 12318.0]
  - - [1024, 2368, 1, 256, 1024, 1024, 1024, 2368]
    - [30, 11386.0]
  - - [1408, 1856, 1, 1280, 1408, 1408, 1408, 1856]
    - [34, 11877.0]
  - - [5056, 5056, 1, 1280, 5056, 5056, 5056, 5056]
    - [19, 12462.0]
  - - [448, 5056, 1, 256, 448, 448, 448, 5056]
    - [15, 9818.0]
  - - [1856, 1408, 1, 128, 1856, 1856, 1856, 1408]
    - [0, 10401.0]
  - - [6784, 256, 1, 3328, 6784, 6784, 6784, 256]
    - [18, 11453.0]
  - - [6784, 4288, 1, 3328, 6784, 6784, 6784, 4288]
    - [35, 12528.0]
  - - [4288, 448, 1, 256, 4288, 4288, 4288, 448]
    - [0, 10761.0]
  - - [1856, 2368, 1, 3328, 1856, 1856, 1856, 2368]
    - [34, 11633.0]
  - - [4288, 2944, 1, 1280, 4288, 4288, 4288, 2944]
    - [16, 12258.0]
  - - [704, 5056, 1, 1280, 704, 704, 704, 5056]
    - [1, 11200.0]
  - - [2368, 704, 1, 3328, 2368, 2368, 2368, 704]
    - [23, 10976.0]
  - - [256, 5888, 1, 256, 256, 256, 256, 5888]
    - [2, 10373.0]
  - - [1856, 4288, 1, 3328, 1856, 1856, 1856, 4288]
    - [35, 11877.0]
  - - [5888, 1024, 1, 256, 5888, 5888, 5888, 1024]
    - [15, 11761.0]
  - - [448, 5056, 1, 3328, 448, 448, 448, 5056]
    - [6, 10643.0]
  - - [1408, 2944, 1, 256, 1408, 1408, 1408, 2944]
    - [20, 11718.0]
  - - [6784, 5056, 1, 3328, 6784, 6784, 6784, 5056]
    - [19, 12676.0]
  - - [5056, 5056, 1, 256, 5056, 5056, 5056, 5056]
    - [1, 12167.0]
  - - [1408, 6784, 1, 128, 1408, 1408, 1408, 6784]
    - [0, 11700.0]
  - - [704, 5056, 1, 128, 704, 704, 704, 5056]
    - [30, 10229.0]
  - - [2368, 2944, 1, 1280, 2368, 2368, 2368, 2944]
    - [1, 12202.0]
  - - [6784, 6784, 1, 1280, 6784, 6784, 6784, 6784]
    - [19, 12782.0]
  - - [1408, 4288, 1, 1280, 1408, 1408, 1408, 4288]
    - [16, 12142.0]
  - - [3584, 4288, 1, 1280, 3584, 3584, 3584, 4288]
    - [16, 12444.0]
  - - [2368, 704, 1, 1280, 2368, 2368, 2368, 704]
    - [0, 10825.0]
  - - [5056, 4288, 1, 3328, 5056, 5056, 5056, 4288]
    - [35, 12466.0]
  - - [3584, 2368, 1, 3328, 3584, 3584, 3584, 2368]
    - [19, 12196.0]
  - - [6784, 448, 1, 1280, 6784, 6784, 6784, 448]
    - [30, 11708.0]
  - - [1408, 2944, 1, 128, 1408, 1408, 1408, 2944]
    - [36, 11371.0]
  - - [4288, 2944, 1, 256, 4288, 4288, 4288, 2944]
    - [9, 11948.0]
  - - [5888, 704, 1, 1280, 5888, 5888, 5888, 704]
    - [15, 11771.0]
  - - [448, 5888, 1, 128, 448, 448, 448, 5888]
    - [23, 9416.0]
  - - [5056, 2368, 1, 1280, 5056, 5056, 5056, 2368]
    - [31, 12208.0]
  - - [448, 3584, 1, 1280, 448, 448, 448, 3584]
    - [20, 9928.0]
  - - [6784, 5888, 1, 256, 6784, 6784, 6784, 5888]
    - [19, 12595.0]
  - - [5888, 2944, 1, 128, 5888, 5888, 5888, 2944]
    - [20, 12026.0]
  - - [1024, 1408, 1, 256, 1024, 1024, 1024, 1408]
    - [0, 10875.0]
  - - [2368, 2368, 1, 3328, 2368, 2368, 2368, 2368]
    - [18, 11604.0]
  - - [1856, 6784, 1, 128, 1856, 1856, 1856, 6784]
    - [5, 11421.0]
  - - [5056, 704, 1, 3328, 5056, 5056, 5056, 704]
    - [34, 11907.0]
  - - [1408, 1856, 1, 256, 1408, 1408, 1408, 1856]
    - [0, 11475.0]
  - - [2368, 5056, 1, 256, 2368, 2368, 2368, 5056]
    - [16, 11857.0]
  - - [5888, 1856, 1, 256, 5888, 5888, 5888, 1856]
    - [30, 11972.0]
  - - [704, 5888, 1, 256, 704, 704, 704, 5888]
    - [20, 10764.0]
  - - [2944, 6784, 1, 3328, 2944, 2944, 2944, 6784]
    - [19, 12803.0]
  - - [3584, 704, 1, 3328, 3584, 3584, 3584, 704]
    - [34, 11584.0]
  - - [448, 4288, 1, 256, 448, 448, 448, 4288]
    - [20, 9498.0]
  - - [704, 2368, 1, 1280, 704, 704, 704, 2368]
    - [36, 10238.0]
  - - [1856, 2368, 1, 1280, 1856, 1856, 1856, 2368]
    - [18, 11587.0]
  - - [1856, 4288, 1, 1280, 1856, 1856, 1856, 4288]
    - [19, 11805.0]
  - - [704, 2944, 1, 128, 704, 704, 704, 2944]
    - [0, 9536.0]
  - - [1408, 1024, 1, 1280, 1408, 1408, 1408, 1024]
    - [30, 11381.0]
  - - [704, 6784, 1, 256, 704, 704, 704, 6784]
    - [20, 10938.0]
  - - [6784, 704, 1, 256, 6784, 6784, 6784, 704]
    - [30, 11554.0]
  - - [5056, 1408, 1, 128, 5056, 5056, 5056, 1408]
    - [1, 11425.0]
  - - [3584, 4288, 1, 3328, 3584, 3584, 3584, 4288]
    - [19, 12499.0]
  - - [5888, 1856, 1, 1280, 5888, 5888, 5888, 1856]
    - [18, 12165.0]
  - - [5056, 1024, 1, 3328, 5056, 5056, 5056, 1024]
    - [1, 12425.0]
  - - [1024, 4288, 1, 128, 1024, 1024, 1024, 4288]
    - [23, 11327.0]
  - - [2368, 3584, 1, 1280, 2368, 2368, 2368, 3584]
    - [1, 12155.0]
  - - [2368, 6784, 1, 1280, 2368, 2368, 2368, 6784]
    - [19, 12265.0]
  - - [2944, 3584, 1, 3328, 2944, 2944, 2944, 3584]
    - [19, 12462.0]
  - - [6784, 2944, 1, 256, 6784, 6784, 6784, 2944]
    - [1, 12464.0]
  - - [4288, 2368, 1, 3328, 4288, 4288, 4288, 2368]
    - [18, 12047.0]
  - - [1856, 2368, 1, 256, 1856, 1856, 1856, 2368]
    - [0, 11233.0]
  - - [3584, 6784, 1, 3328, 3584, 3584, 3584, 6784]
    - [4, 12694.0]
  - - [1024, 5888, 1, 3328, 1024, 1024, 1024, 5888]
    - [19, 12275.0]
  - - [5056, 4288, 1, 1280, 5056, 5056, 5056, 4288]
    - [35, 12426.0]
  - - [2944, 5888, 1, 128, 2944, 2944, 2944, 5888]
    - [36, 12065.0]
  - - [704, 5888, 1, 1280, 704, 704, 704, 5888]
    - [1, 11278.0]
  - - [2368, 3584, 1, 128, 2368, 2368, 2368, 3584]
    - [5, 11380.0]
  - - [6784, 5888, 1, 3328, 6784, 6784, 6784, 5888]
    - [35, 12834.0]
  - - [1024, 5056, 1, 1280, 1024, 1024, 1024, 5056]
    - [16, 12298.0]
  - - [4288, 1024, 1, 256, 4288, 4288, 4288, 1024]
    - [5, 11370.0]
  - - [2944, 2368, 1, 128, 2944, 2944, 2944, 2368]
    - [30, 11634.0]
  - - [5888, 448, 1, 1280, 5888, 5888, 5888, 448]
    - [30, 11377.0]
  - - [704, 5888, 1, 3328, 704, 704, 704, 5888]
    - [4, 11337.0]
  - - [6784, 2368, 1, 1280, 6784, 6784, 6784, 2368]
    - [4, 12260.0]
  - - [3584, 2944, 1, 256, 3584, 3584, 3584, 2944]
    - [31, 12068.0]
  - - [2368, 1024, 1, 3328, 2368, 2368, 2368, 1024]
    - [1, 11468.0]
  - - [1408, 5056, 1, 3328, 1408, 1408, 1408, 5056]
    - [31, 12517.0]
  - - [1856, 1856, 1, 3328, 1856, 1856, 1856, 1856]
    - [3, 11563.0]
  - - [2368, 2368, 1, 256, 2368, 2368, 2368, 2368]
    - [15, 11282.0]
  - - [4288, 4288, 1, 1280, 4288, 4288, 4288, 4288]
    - [4, 12339.0]
  - - [1408, 4288, 1, 256, 1408, 1408, 1408, 4288]
    - [0, 11815.0]
  - - [5888, 448, 1, 128, 5888, 5888, 5888, 448]
    - [15, 10767.0]
  - - [704, 6784, 1, 3328, 704, 704, 704, 6784]
    - [19, 11468.0]
  - - [5888, 5888, 1, 1280, 5888, 5888, 5888, 5888]
    - [4, 12785.0]
  - - [5056, 1024, 1, 1280, 5056, 5056, 5056, 1024]
    - [16, 12345.0]
  - - [448, 5888, 1, 3328, 448, 448, 448, 5888]
    - [15, 10235.0]
  - - [1024, 2944, 1, 1280, 1024, 1024, 1024, 2944]
    - [30, 11607.0]
  - - [5056, 5888, 1, 1280, 5056, 5056, 5056, 5888]
    - [19, 12626.0]
  - - [4288, 5888, 1, 128, 4288, 4288, 4288, 5888]
    - [31, 11930.0]
  - - [1408, 3584, 1, 128, 1408, 1408, 1408, 3584]
    - [30, 11489.0]
  - - [448, 3584, 1, 128, 448, 448, 448, 3584]
    - [23, 8716.0]
  - - [5888, 2944, 1, 1280, 5888, 5888, 5888, 2944]
    - [4, 12738.0]
  - - [2368, 5888, 1, 128, 2368, 2368, 2368, 5888]
    - [13, 11559.0]
  - - [3584, 5888, 1, 256, 3584, 3584, 3584, 5888]
    - [4, 12421.0]
  - - [2368, 704, 1, 128, 2368, 2368, 2368, 704]
    - [0, 10037.0]
  - - [3584, 2944, 1, 1280, 3584, 3584, 3584, 2944]
    - [4, 12414.0]
  - - [3584, 2368, 1, 128, 3584, 3584, 3584, 2368]
    - [30, 11744.0]
  - - [5056, 704, 1, 128, 5056, 5056, 5056, 704]
    - [8, 10963.0]
  - - [5056, 1408, 1, 3328, 5056, 5056, 5056, 1408]
    - [35, 12503.0]
  - - [6784, 1024, 1, 3328, 6784, 6784, 6784, 1024]
    - [35, 12253.0]
  - - [6784, 2944, 1, 3328, 6784, 6784, 6784, 2944]
    - [19, 12804.0]
  - - [2944, 5056, 1, 3328, 2944, 2944, 2944, 5056]
    - [19, 12622.0]
  - - [1856, 1856, 1, 256, 1856, 1856, 1856, 1856]
    - [0, 11104.0]
  - - [1024, 5888, 1, 128, 1024, 1024, 1024, 5888]
    - [23, 11581.0]
  - - [2048, 7133, 1, 2048, 2048, 2048, 2048, 7133]
    - [16, 12628.0]
  - - [4288, 5888, 1, 1280, 4288, 4288, 4288, 5888]
    - [35, 12477.0]
  - - [4288, 4288, 1, 256, 4288, 4288, 4288, 4288]
    - [16, 12018.0]
  - - [4288, 1856, 1, 1280, 4288, 4288, 4288, 1856]
    - [18, 11841.0]
  - - [1856, 2944, 1, 3328, 1856, 1856, 1856, 2944]
    - [16, 11740.0]
  - - [256, 6784, 1, 3328, 256, 256, 256, 6784]
    - [3, 11452.0]
  - - [256, 5056, 1, 128, 256, 256, 256, 5056]
    - [15, 9885.0]
  - - [5056, 1024, 1, 256, 5056, 5056, 5056, 1024]
    - [20, 11794.0]
  - - [5056, 1856, 1, 3328, 5056, 5056, 5056, 1856]
    - [35, 12150.0]
  - - [1856, 1408, 1, 256, 1856, 1856, 1856, 1408]
    - [8, 10670.0]
  - - [4288, 1408, 1, 128, 4288, 4288, 4288, 1408]
    - [5, 11358.0]
  - - [4288, 5056, 1, 256, 4288, 4288, 4288, 5056]
    - [1, 12120.0]
  - - [5056, 256, 1, 3328, 5056, 5056, 5056, 256]
    - [5, 11952.0]
  - - [1024, 5888, 1, 1280, 1024, 1024, 1024, 5888]
    - [1, 12205.0]
  - - [6784, 2368, 1, 128, 6784, 6784, 6784, 2368]
    - [30, 11898.0]
  - - [5056, 3584, 1, 256, 5056, 5056, 5056, 3584]
    - [31, 12313.0]
  - - [1856, 1024, 1, 1280, 1856, 1856, 1856, 1024]
    - [13, 11662.0]
  - - [6784, 4288, 1, 1280, 6784, 6784, 6784, 4288]
    - [19, 12502.0]
  - - [1856, 1856, 1, 1280, 1856, 1856, 1856, 1856]
    - [3, 11451.0]
  - - [6784, 2944, 1, 128, 6784, 6784, 6784, 2944]
    - [1, 12175.0]
  - - [1408, 5056, 1, 1280, 1408, 1408, 1408, 5056]
    - [31, 12407.0]
  - - [5888, 1856, 1, 128, 5888, 5888, 5888, 1856]
    - [30, 11834.0]
  - - [2368, 1024, 1, 128, 2368, 2368, 2368, 1024]
    - [8, 10237.0]
  - - [5056, 3584, 1, 128, 5056, 5056, 5056, 3584]
    - [31, 11892.0]
  - - [5888, 5888, 1, 3328, 5888, 5888, 5888, 5888]
    - [4, 12817.0]
  - - [6784, 1024, 1, 256, 6784, 6784, 6784, 1024]
    - [31, 11771.0]
  - - [2944, 2368, 1, 256, 2944, 2944, 2944, 2368]
    - [15, 11822.0]
  - - [5056, 5888, 1, 3328, 5056, 5056, 5056, 5888]
    - [35, 12670.0]
  - - [1856, 1024, 1, 256, 1856, 1856, 1856, 1024]
    - [25, 10568.0]
  - - [3584, 448, 1, 1280, 3584, 3584, 3584, 448]
    - [34, 11491.0]
  - - [448, 5888, 1, 256, 448, 448, 448, 5888]
    - [15, 9890.0]
  - - [1408, 6784, 1, 3328, 1408, 1408, 1408, 6784]
    - [35, 12397.0]
  - - [4288, 704, 1, 128, 4288, 4288, 4288, 704]
    - [0, 10668.0]
  - - [5056, 2944, 1, 256, 5056, 5056, 5056, 2944]
    - [31, 12212.0]
  - - [6784, 5888, 1, 128, 6784, 6784, 6784, 5888]
    - [1, 12317.0]
  - - [2368, 1856, 1, 256, 2368, 2368, 2368, 1856]
    - [0, 11175.0]
  - - [1408, 3584, 1, 3328, 1408, 1408, 1408, 3584]
    - [4, 12176.0]
  - - [2368, 6784, 1, 256, 2368, 2368, 2368, 6784]
    - [16, 11957.0]
  - - [5056, 1408, 1, 1280, 5056, 5056, 5056, 1408]
    - [1, 12433.0]
  - - [5056, 4288, 1, 128, 5056, 5056, 5056, 4288]
    - [30, 11825.0]
  - - [1408, 1856, 1, 128, 1408, 1408, 1408, 1856]
    - [30, 11135.0]
  - - [1408, 5888, 1, 3328, 1408, 1408, 1408, 5888]
    - [19, 12396.0]
  - - [6784, 6784, 1, 256, 6784, 6784, 6784, 6784]
    - [16, 12587.0]
  - - [4288, 2368, 1, 128, 4288, 4288, 4288, 2368]
    - [0, 11535.0]
  - - [1856, 4288, 1, 128, 1856, 1856, 1856, 4288]
    - [0, 11217.0]
  - - [2368, 2944, 1, 256, 2368, 2368, 2368, 2944]
    - [1, 11769.0]
  - - [3584, 1856, 1, 1280, 3584, 3584, 3584, 1856]
    - [40, 12156.0]
  - - [6784, 6784, 1, 128, 6784, 6784, 6784, 6784]
    - [16, 12331.0]
  - - [5888, 5056, 1, 256, 5888, 5888, 5888, 5056]
    - [4, 12346.0]
  - - [3584, 448, 1, 256, 3584, 3584, 3584, 448]
    - [30, 10891.0]
  - - [448, 4288, 1, 128, 448, 448, 448, 4288]
    - [15, 9121.0]
  - - [2944, 4288, 1, 3328, 2944, 2944, 2944, 4288]
    - [4, 12315.0]
  - - [256, 6784, 1, 256, 256, 256, 256, 6784]
    - [15, 10818.0]
  - - [1408, 4288, 1, 128, 1408, 1408, 1408, 4288]
    - [15, 11656.0]
  - - [2944, 704, 1, 3328, 2944, 2944, 2944, 704]
    - [18, 11651.0]
  - - [3584, 3584, 1, 256, 3584, 3584, 3584, 3584]
    - [35, 12157.0]
  - - [3584, 5056, 1, 256, 3584, 3584, 3584, 5056]
    - [4, 12274.0]
  - - [2944, 2368, 1, 1280, 2944, 2944, 2944, 2368]
    - [16, 12172.0]
  - - [1408, 3584, 1, 256, 1408, 1408, 1408, 3584]
    - [30, 11750.0]
  - - [6784, 3584, 1, 256, 6784, 6784, 6784, 3584]
    - [19, 12435.0]
  - - [5056, 2368, 1, 128, 5056, 5056, 5056, 2368]
    - [30, 11575.0]
  - - [2944, 2944, 1, 3328, 2944, 2944, 2944, 2944]
    - [35, 12483.0]
  - - [5056, 6784, 1, 256, 5056, 5056, 5056, 6784]
    - [31, 12395.0]
  - - [1856, 3584, 1, 128, 1856, 1856, 1856, 3584]
    - [28, 11041.0]
  - - [6784, 448, 1, 256, 6784, 6784, 6784, 448]
    - [30, 11422.0]
  - - [3584, 6784, 1, 128, 3584, 3584, 3584, 6784]
    - [4, 12094.0]
  - - [5056, 1856, 1, 256, 5056, 5056, 5056, 1856]
    - [15, 11789.0]
  - - [1024, 1856, 1, 256, 1024, 1024, 1024, 1856]
    - [15, 11058.0]
  - - [1408, 6784, 1, 1280, 1408, 1408, 1408, 6784]
    - [4, 12362.0]
  - - [3584, 3584, 1, 1280, 3584, 3584, 3584, 3584]
    - [19, 12498.0]
  - - [5888, 5888, 1, 128, 5888, 5888, 5888, 5888]
    - [9, 12235.0]
  - - [5056, 5888, 1, 128, 5056, 5056, 5056, 5888]
    - [13, 11949.0]
  - - [5056, 2368, 1, 3328, 5056, 5056, 5056, 2368]
    - [35, 12273.0]
  - - [2944, 4288, 1, 256, 2944, 2944, 2944, 4288]
    - [0, 11926.0]
  - - [1408, 3584, 1, 1280, 1408, 1408, 1408, 3584]
    - [19, 12114.0]
  - - [2368, 6784, 1, 3328, 2368, 2368, 2368, 6784]
    - [19, 12300.0]
  - - [1856, 1408, 1, 1280, 1856, 1856, 1856, 1408]
    - [30, 11148.0]
  - - [6784, 704, 1, 128, 6784, 6784, 6784, 704]
    - [30, 11346.0]
  - - [1408, 5888, 1, 256, 1408, 1408, 1408, 5888]
    - [1, 12008.0]
  - - [704, 2944, 1, 1280, 704, 704, 704, 2944]
    - [5, 11005.0]
  - - [1856, 2368, 1, 128, 1856, 1856, 1856, 2368]
    - [39, 10949.0]
  - - [4096, 7133, 1, 4096, 4096, 4096, 4096, 7133]
    - [19, 12715.0]
  - - [3584, 704, 1, 1280, 3584, 3584, 3584, 704]
    - [15, 11498.0]
  - - [2944, 6784, 1, 128, 2944, 2944, 2944, 6784]
    - [36, 12156.0]
  - - [3584, 448, 1, 3328, 3584, 3584, 3584, 448]
    - [18, 11615.0]
  - - [704, 2368, 1, 3328, 704, 704, 704, 2368]
    - [36, 10390.0]
  - - [256, 5888, 1, 128, 256, 256, 256, 5888]
    - [30, 10007.0]
  - - [2944, 2944, 1, 1280, 2944, 2944, 2944, 2944]
    - [19, 12439.0]
  - - [5888, 2368, 1, 256, 5888, 5888, 5888, 2368]
    - [30, 11959.0]
  - - [6784, 704, 1, 3328, 6784, 6784, 6784, 704]
    - [18, 11844.0]
  - - [5888, 4288, 1, 128, 5888, 5888, 5888, 4288]
    - [15, 11951.0]
  - - [1408, 2944, 1, 3328, 1408, 1408, 1408, 2944]
    - [31, 12236.0]
  - - [3584, 704, 1, 128, 3584, 3584, 3584, 704]
    - [30, 10816.0]
  - - [5056, 5056, 1, 128, 5056, 5056, 5056, 5056]
    - [23, 11802.0]
  - - [448, 5056, 1, 128, 448, 448, 448, 5056]
    - [23, 9089.0]
  - - [1408, 5056, 1, 128, 1408, 1408, 1408, 5056]
    - [0, 11643.0]
  - - [2944, 3584, 1, 128, 2944, 2944, 2944, 3584]
    - [24, 11800.0]
  - - [3584, 2368, 1, 256, 3584, 3584, 3584, 2368]
    - [30, 11911.0]
  - - [5888, 5056, 1, 1280, 5888, 5888, 5888, 5056]
    - [4, 12636.0]
  - - [2368, 5056, 1, 128, 2368, 2368, 2368, 5056]
    - [30, 11474.0]
  - - [3584, 3584, 1, 3328, 3584, 3584, 3584, 3584]
    - [4, 12526.0]
  - - [5888, 6784, 1, 256, 5888, 5888, 5888, 6784]
    - [16, 12576.0]
  - - [4288, 2944, 1, 3328, 4288, 4288, 4288, 2944]
    - [19, 12318.0]
  - - [4288, 704, 1, 1280, 4288, 4288, 4288, 704]
    - [0, 11600.0]
  - - [256, 5056, 1, 1280, 256, 256, 256, 5056]
    - [36, 11676.0]
  - - [2944, 5888, 1, 3328, 2944, 2944, 2944, 5888]
    - [35, 12780.0]
  - - [6784, 5888, 1, 1280, 6784, 6784, 6784, 5888]
    - [35, 12811.0]
  - - [5888, 4288, 1, 1280, 5888, 5888, 5888, 4288]
    - [19, 12483.0]
  - - [5888, 3584, 1, 128, 5888, 5888, 5888, 3584]
    - [31, 12066.0]
  - - [1856, 1856, 1, 128, 1856, 1856, 1856, 1856]
    - [8, 10791.0]
  - - [704, 3584, 1, 128, 704, 704, 704, 3584]
    - [30, 9925.0]
  - - [5888, 448, 1, 3328, 5888, 5888, 5888, 448]
    - [30, 11437.0]
  - - [2368, 4288, 1, 1280, 2368, 2368, 2368, 4288]
    - [1, 11920.0]
  - - [4288, 2944, 1, 128, 4288, 4288, 4288, 2944]
    - [13, 11696.0]
  - - [1024, 6784, 1, 3328, 1024, 1024, 1024, 6784]
    - [19, 12252.0]
  - - [5056, 2944, 1, 3328, 5056, 5056, 5056, 2944]
    - [19, 12623.0]
  - - [2944, 3584, 1, 256, 2944, 2944, 2944, 3584]
    - [31, 12059.0]
  - - [1408, 1408, 1, 3328, 1408, 1408, 1408, 1408]
    - [15, 11186.0]
  - - [3584, 3584, 1, 128, 3584, 3584, 3584, 3584]
    - [0, 11818.0]
  - - [3584, 704, 1, 256, 3584, 3584, 3584, 704]
    - [0, 11179.0]
  - - [3584, 1408, 1, 3328, 3584, 3584, 3584, 1408]
    - [4, 12177.0]
  - - [704, 3584, 1, 1280, 704, 704, 704, 3584]
    - [15, 10814.0]
  - - [2944, 6784, 1, 1280, 2944, 2944, 2944, 6784]
    - [35, 12767.0]
  - - [1856, 6784, 1, 256, 1856, 1856, 1856, 6784]
    - [1, 11831.0]
  - - [4288, 448, 1, 3328, 4288, 4288, 4288, 448]
    - [30, 11619.0]
  - - [6784, 4288, 1, 128, 6784, 6784, 6784, 4288]
    - [0, 12049.0]
  - - [6784, 704, 1, 1280, 6784, 6784, 6784, 704]
    - [15, 11772.0]
  - - [5888, 1024, 1, 3328, 5888, 5888, 5888, 1024]
    - [35, 12277.0]
  - - [704, 6784, 1, 1280, 704, 704, 704, 6784]
    - [1, 11384.0]
  - - [1856, 5056, 1, 3328, 1856, 1856, 1856, 5056]
    - [19, 12148.0]
  - - [1024, 3584, 1, 128, 1024, 1024, 1024, 3584]
    - [23, 11048.0]
  - - [1024, 1408, 1, 128, 1024, 1024, 1024, 1408]
    - [0, 10185.0]
  - - [2368, 2944, 1, 128, 2368, 2368, 2368, 2944]
    - [20, 11373.0]
  - - [5056, 2944, 1, 128, 5056, 5056, 5056, 2944]
    - [36, 11830.0]
  - - [5888, 5056, 1, 3328, 5888, 5888, 5888, 5056]
    - [4, 12673.0]
  - - [1408, 2368, 1, 128, 1408, 1408, 1408, 2368]
    - [30, 10994.0]
  - - [5888, 2368, 1, 128, 5888, 5888, 5888, 2368]
    - [30, 11841.0]
  - - [3584, 6784, 1, 1280, 3584, 3584, 3584, 6784]
    - [4, 12665.0]
  - - [3072, 7435, 1, 1024, 3072, 3072, 3072, 7435]
    - [4, 12519.0]
  - - [1856, 5888, 1, 256, 1856, 1856, 1856, 5888]
    - [31, 11715.0]
  - - [4288, 4288, 1, 3328, 4288, 4288, 4288, 4288]
    - [35, 12386.0]
  - - [4288, 1408, 1, 1280, 4288, 4288, 4288, 1408]
    - [16, 12130.0]
  - - [3584, 5056, 1, 128, 3584, 3584, 3584, 5056]
    - [0, 11920.0]
  - - [4288, 2368, 1, 256, 4288, 4288, 4288, 2368]
    - [0, 11754.0]
  - - [2944, 5056, 1, 1280, 2944, 2944, 2944, 5056]
    - [31, 12572.0]
  - - [448, 6784, 1, 256, 448, 448, 448, 6784]
    - [28, 9960.0]
  - - [6784, 2368, 1, 3328, 6784, 6784, 6784, 2368]
    - [12, 12299.0]
  - - [4288, 1856, 1, 3328, 4288, 4288, 4288, 1856]
    - [19, 11879.0]
  - - [3584, 448, 1, 128, 3584, 3584, 3584, 448]
    - [8, 10094.0]
  - - [3584, 1024, 1, 1280, 3584, 3584, 3584, 1024]
    - [15, 11751.0]
  - - [1856, 5056, 1, 256, 1856, 1856, 1856, 5056]
    - [24, 11600.0]
  - - [1024, 4288, 1, 256, 1024, 1024, 1024, 4288]
    - [0, 11736.0]
  - - [5888, 3584, 1, 3328, 5888, 5888, 5888, 3584]
    - [19, 12706.0]
  - - [5056, 3584, 1, 3328, 5056, 5056, 5056, 3584]
    - [19, 12629.0]
  - - [2368, 1408, 1, 1280, 2368, 2368, 2368, 1408]
    - [23, 11573.0]
  - - [5056, 2944, 1, 1280, 5056, 5056, 5056, 2944]
    - [31, 12572.0]
  - - [1024, 6784, 1, 256, 1024, 1024, 1024, 6784]
    - [30, 11802.0]
  - - [2944, 1408, 1, 128, 2944, 2944, 2944, 1408]
    - [36, 11371.0]
  - - [5056, 6784, 1, 3328, 5056, 5056, 5056, 6784]
    - [35, 12665.0]
  - - [3584, 4288, 1, 256, 3584, 3584, 3584, 4288]
    - [1, 12074.0]
  - - [1856, 6784, 1, 3328, 1856, 1856, 1856, 6784]
    - [19, 12261.0]
  - - [5888, 4288, 1, 256, 5888, 5888, 5888, 4288]
    - [9, 12197.0]
  - - [5056, 1408, 1, 256, 5056, 5056, 5056, 1408]
    - [5, 11957.0]
  - - [3584, 1024, 1, 256, 3584, 3584, 3584, 1024]
    - [0, 11458.0]
  - - [5888, 5888, 1, 256, 5888, 5888, 5888, 5888]
    - [24, 12539.0]
  - - [4288, 1024, 1, 1280, 4288, 4288, 4288, 1024]
    - [9, 11919.0]
  - - [448, 6784, 1, 3328, 448, 448, 448, 6784]
    - [31, 10531.0]
  - - [2944, 1408, 1, 1280, 2944, 2944, 2944, 1408]
    - [31, 12143.0]
  - - [2944, 1856, 1, 3328, 2944, 2944, 2944, 1856]
    - [34, 11947.0]
  - - [2944, 2944, 1, 128, 2944, 2944, 2944, 2944]
    - [0, 11740.0]
  - - [3584, 5888, 1, 1280, 3584, 3584, 3584, 5888]
    - [19, 12651.0]
  - - [6784, 1856, 1, 1280, 6784, 6784, 6784, 1856]
    - [34, 12208.0]
  - - [2944, 5056, 1, 256, 2944, 2944, 2944, 5056]
    - [1, 12173.0]
  - - [2944, 5888, 1, 1280, 2944, 2944, 2944, 5888]
    - [35, 12740.0]
  - - [5888, 256, 1, 3328, 5888, 5888, 5888, 256]
    - [36, 11257.0]
  - - [1856, 5888, 1, 3328, 1856, 1856, 1856, 5888]
    - [35, 12155.0]
  - - [3584, 1408, 1, 256, 3584, 3584, 3584, 1408]
    - [0, 11695.0]
  - - [704, 3584, 1, 3328, 704, 704, 704, 3584]
    - [15, 10903.0]
  - - [5056, 448, 1, 1280, 5056, 5056, 5056, 448]
    - [8, 11638.0]
  - - [3584, 1856, 1, 3328, 3584, 3584, 3584, 1856]
    - [12, 12233.0]
  - - [2944, 1024, 1, 256, 2944, 2944, 2944, 1024]
    - [0, 11253.0]
  - - [1024, 2368, 1, 128, 1024, 1024, 1024, 2368]
    - [15, 10991.0]
  - - [2368, 4288, 1, 3328, 2368, 2368, 2368, 4288]
    - [1, 11971.0]
  - - [1024, 1408, 1, 1280, 1024, 1024, 1024, 1408]
    - [39, 11323.0]
  - - [6784, 5056, 1, 256, 6784, 6784, 6784, 5056]
    - [1, 12358.0]
  - - [448, 6784, 1, 128, 448, 448, 448, 6784]
    - [15, 9410.0]
  - - [2944, 6784, 1, 256, 2944, 2944, 2944, 6784]
    - [1, 12489.0]
  - - [2368, 2368, 1, 1280, 2368, 2368, 2368, 2368]
    - [15, 11551.0]
  - - [1856, 3584, 1, 1280, 1856, 1856, 1856, 3584]
    - [31, 12158.0]
  - - [3584, 1408, 1, 1280, 3584, 3584, 3584, 1408]
    - [16, 12082.0]
  - - [4288, 448, 1, 128, 4288, 4288, 4288, 448]
    - [23, 9781.0]
  - - [5056, 256, 1, 1280, 5056, 5056, 5056, 256]
    - [13, 11782.0]
  - - [1856, 1408, 1, 3328, 1856, 1856, 1856, 1408]
    - [30, 11308.0]
  - - [1024, 4288, 1, 3328, 1024, 1024, 1024, 4288]
    - [30, 12025.0]
  - - [5056, 448, 1, 256, 5056, 5056, 5056, 448]
    - [0, 11130.0]
  - - [2944, 2368, 1, 3328, 2944, 2944, 2944, 2368]
    - [35, 12259.0]
  - - [1024, 1856, 1, 1280, 1024, 1024, 1024, 1856]
    - [20, 11599.0]
  - - [6784, 1856, 1, 256, 6784, 6784, 6784, 1856]
    - [8, 12005.0]
  - - [1024, 5888, 1, 256, 1024, 1024, 1024, 5888]
    - [15, 11826.0]
  - - [1408, 2368, 1, 256, 1408, 1408, 1408, 2368]
    - [0, 11411.0]
  - - [1408, 1408, 1, 256, 1408, 1408, 1408, 1408]
    - [15, 10812.0]
  - - [2368, 2368, 1, 128, 2368, 2368, 2368, 2368]
    - [30, 11090.0]
  - - [6784, 1408, 1, 128, 6784, 6784, 6784, 1408]
    - [20, 11736.0]
  - - [4288, 5888, 1, 256, 4288, 4288, 4288, 5888]
    - [40, 12218.0]
  - - [1408, 5056, 1, 256, 1408, 1408, 1408, 5056]
    - [20, 11862.0]
  - - [4288, 3584, 1, 128, 4288, 4288, 4288, 3584]
    - [15, 11754.0]
  - - [3584, 5056, 1, 1280, 3584, 3584, 3584, 5056]
    - [4, 12591.0]
  - - [1856, 1024, 1, 128, 1856, 1856, 1856, 1024]
    - [8, 9593.0]
  - - [704, 4288, 1, 256, 704, 704, 704, 4288]
    - [30, 10271.0]
  - - [5888, 2368, 1, 1280, 5888, 5888, 5888, 2368]
    - [1, 12299.0]
  - - [2368, 5888, 1, 1280, 2368, 2368, 2368, 5888]
    - [19, 12292.0]
  - - [5888, 256, 1, 1280, 5888, 5888, 5888, 256]
    - [5, 11094.0]
  - - [2368, 1856, 1, 3328, 2368, 2368, 2368, 1856]
    - [18, 11648.0]
  - - [2944, 704, 1, 256, 2944, 2944, 2944, 704]
    - [0, 11049.0]
  - - [704, 3584, 1, 256, 704, 704, 704, 3584]
    - [30, 10418.0]
  - - [704, 2944, 1, 3328, 704, 704, 704, 2944]
    - [20, 11128.0]
  - - [6784, 1024, 1, 128, 6784, 6784, 6784, 1024]
    - [30, 11599.0]
  - - [2944, 1024, 1, 3328, 2944, 2944, 2944, 1024]
    - [30, 11707.0]
  - - [2944, 5056, 1, 128, 2944, 2944, 2944, 5056]
    - [30, 11915.0]
  - - [1408, 6784, 1, 256, 1408, 1408, 1408, 6784]
    - [31, 12052.0]
  - - [6784, 1408, 1, 3328, 6784, 6784, 6784, 1408]
    - [35, 12390.0]
  - - [4288, 6784, 1, 128, 4288, 4288, 4288, 6784]
    - [31, 11947.0]
  - - [6784, 2944, 1, 1280, 6784, 6784, 6784, 2944]
    - [42, 12756.0]
  - - [4288, 1856, 1, 128, 4288, 4288, 4288, 1856]
    - [23, 11372.0]
  - - [1856, 2944, 1, 128, 1856, 1856, 1856, 2944]
    - [0, 11018.0]
  - - [6784, 448, 1, 128, 6784, 6784, 6784, 448]
    - [15, 11102.0]
  - - [448, 5056, 1, 1280, 448, 448, 448, 5056]
    - [20, 10562.0]
  - - [2368, 1856, 1, 128, 2368, 2368, 2368, 1856]
    - [0, 10911.0]
  - - [4288, 704, 1, 256, 4288, 4288, 4288, 704]
    - [3, 11081.0]
  - - [5888, 704, 1, 256, 5888, 5888, 5888, 704]
    - [30, 11524.0]
  - - [3584, 1024, 1, 128, 3584, 3584, 3584, 1024]
    - [0, 11201.0]
  - - [256, 5888, 1, 3328, 256, 256, 256, 5888]
    - [5, 11268.0]
  - - [1408, 4288, 1, 3328, 1408, 1408, 1408, 4288]
    - [16, 12255.0]
  - - [6784, 4288, 1, 256, 6784, 6784, 6784, 4288]
    - [16, 12250.0]
  - - [5888, 256, 1, 256, 5888, 5888, 5888, 256]
    - [17, 10329.0]
  - - [6784, 1024, 1, 1280, 6784, 6784, 6784, 1024]
    - [35, 12216.0]
  - - [5888, 1024, 1, 128, 5888, 5888, 5888, 1024]
    - [0, 11598.0]
  - - [6784, 3584, 1, 1280, 6784, 6784, 6784, 3584]
    - [19, 12662.0]
  - - [1024, 6784, 1, 1280, 1024, 1024, 1024, 6784]
    - [4, 12182.0]
  - - [1408, 2944, 1, 1280, 1408, 1408, 1408, 2944]
    - [1, 12167.0]
  - - [1408, 2368, 1, 3328, 1408, 1408, 1408, 2368]
    - [18, 11732.0]
  - - [2944, 1856, 1, 128, 2944, 2944, 2944, 1856]
    - [30, 11454.0]
  - - [256, 6784, 1, 128, 256, 256, 256, 6784]
    - [15, 10486.0]
  - - [5056, 6784, 1, 128, 5056, 5056, 5056, 6784]
    - [5, 11981.0]
  - - [4288, 5056, 1, 128, 4288, 4288, 4288, 5056]
    - [30, 11739.0]
  - - [1856, 5888, 1, 128, 1856, 1856, 1856, 5888]
    - [36, 11352.0]
  - - [2944, 5888, 1, 256, 2944, 2944, 2944, 5888]
    - [35, 12480.0]
  - - [3584, 1856, 1, 256, 3584, 3584, 3584, 1856]
    - [0, 11813.0]
  - - [4288, 3584, 1, 1280, 4288, 4288, 4288, 3584]
    - [9, 12434.0]
  - - [704, 4288, 1, 3328, 704, 704, 704, 4288]
    - [34, 10623.0]
  - - [704, 5888, 1, 128, 704, 704, 704, 5888]
    - [15, 10355.0]
  - - [6784, 3584, 1, 128, 6784, 6784, 6784, 3584]
    - [24, 12113.0]
  - - [4288, 5056, 1, 3328, 4288, 4288, 4288, 5056]
    - [4, 12467.0]
  - - [1408, 1408, 1, 128, 1408, 1408, 1408, 1408]
    - [0, 10183.0]
  - - [5056, 2368, 1, 256, 5056, 5056, 5056, 2368]
    - [30, 11828.0]
  - - [4288, 704, 1, 3328, 4288, 4288, 4288, 704]
    - [3, 11700.0]
  - - [448, 3584, 1, 256, 448, 448, 448, 3584]
    - [20, 9279.0]
  - - [2368, 1024, 1, 1280, 2368, 2368, 2368, 1024]
    - [1, 11303.0]
  - - [2944, 1408, 1, 3328, 2944, 2944, 2944, 1408]
    - [19, 12253.0]
  - - [1024, 1408, 1, 3328, 1024, 1024, 1024, 1408]
    - [34, 11528.0]
  - - [2560, 7133, 1, 2560, 2560, 2560, 2560, 7133]
    - [19, 12723.0]
  - - [5888, 3584, 1, 256, 5888, 5888, 5888, 3584]
    - [4, 12391.0]
  - - [1408, 1856, 1, 3328, 1408, 1408, 1408, 1856]
    - [18, 11965.0]
  - - [6784, 1408, 1, 1280, 6784, 6784, 6784, 1408]
    - [19, 12346.0]
  - - [704, 2944, 1, 256, 704, 704, 704, 2944]
    - [30, 10207.0]
  - - [704, 4288, 1, 128, 704, 704, 704, 4288]
    - [39, 9913.0]
  - - [2368, 4288, 1, 128, 2368, 2368, 2368, 4288]
    - [0, 11449.0]
  - - [1024, 6784, 1, 128, 1024, 1024, 1024, 6784]
    - [23, 11608.0]
  - - [1408, 1408, 1, 1280, 1408, 1408, 1408, 1408]
    - [30, 11092.0]
  - - [448, 4288, 1, 3328, 448, 448, 448, 4288]
    - [16, 10305.0]
  - - [2368, 1408, 1, 256, 2368, 2368, 2368, 1408]
    - [0, 11163.0]
  - - [5888, 5056, 1, 128, 5888, 5888, 5888, 5056]
    - [30, 12027.0]
  - - [704, 2368, 1, 256, 704, 704, 704, 2368]
    - [8, 9612.0]
  - - [5888, 2368, 1, 3328, 5888, 5888, 5888, 2368]
    - [19, 12352.0]
  - - [4288, 448, 1, 1280, 4288, 4288, 4288, 448]
    - [0, 11423.0]
  - - [5888, 704, 1, 3328, 5888, 5888, 5888, 704]
    - [18, 11827.0]
  - - [5056, 256, 1, 128, 5056, 5056, 5056, 256]
    - [0, 9467.0]
  - - [1408, 5888, 1, 128, 1408, 1408, 1408, 5888]
    - [15, 11702.0]
  - - [1408, 1024, 1, 256, 1408, 1408, 1408, 1024]
    - [15, 10869.0]
  - - [1024, 1856, 1, 128, 1024, 1024, 1024, 1856]
    - [23, 10559.0]
  - - [5056, 6784, 1, 1280, 5056, 5056, 5056, 6784]
    - [35, 12633.0]
  - - [704, 5056, 1, 3328, 704, 704, 704, 5056]
    - [19, 11307.0]
  - - [3584, 5056, 1, 3328, 3584, 3584, 3584, 5056]
    - [19, 12636.0]
  - - [2368, 2944, 1, 3328, 2368, 2368, 2368, 2944]
    - [1, 12242.0]
  - - [2368, 3584, 1, 256, 2368, 2368, 2368, 3584]
    - [1, 11680.0]
  - - [5056, 3584, 1, 1280, 5056, 5056, 5056, 3584]
    - [16, 12579.0]
  - - [1856, 2944, 1, 1280, 1856, 1856, 1856, 2944]
    - [31, 11648.0]
  - - [3584, 2368, 1, 1280, 3584, 3584, 3584, 2368]
    - [3, 12142.0]
  - - [2944, 1408, 1, 256, 2944, 2944, 2944, 1408]
    - [36, 11726.0]
  - - [4288, 1408, 1, 3328, 4288, 4288, 4288, 1408]
    - [19, 12263.0]
  - - [2944, 1024, 1, 128, 2944, 2944, 2944, 1024]
    - [30, 10950.0]
  - - [4288, 5056, 1, 1280, 4288, 4288, 4288, 5056]
    - [1, 12411.0]
  - - [5888, 6784, 1, 1280, 5888, 5888, 5888, 6784]
    - [4, 12801.0]
  - - [6784, 5056, 1, 128, 6784, 6784, 6784, 5056]
    - [30, 12025.0]
  - - [5888, 1408, 1, 3328, 5888, 5888, 5888, 1408]
    - [4, 12392.0]
  - - [256, 5056, 1, 256, 256, 256, 256, 5056]
    - [15, 10800.0]
  - - [448, 3584, 1, 3328, 448, 448, 448, 3584]
    - [5, 10043.0]
  - - [704, 2368, 1, 128, 704, 704, 704, 2368]
    - [15, 9119.0]
  - - [5888, 256, 1, 128, 5888, 5888, 5888, 256]
    - [36, 9986.0]
  - - [3584, 1856, 1, 128, 3584, 3584, 3584, 1856]
    - [23, 11603.0]
  - - [4288, 4288, 1, 128, 4288, 4288, 4288, 4288]
    - [30, 11715.0]
  - - [1856, 1024, 1, 3328, 1856, 1856, 1856, 1024]
    - [5, 11837.0]
  - - [1024, 5056, 1, 256, 1024, 1024, 1024, 5056]
    - [20, 11783.0]
  - - [2368, 1408, 1, 3328, 2368, 2368, 2368, 1408]
    - [18, 11691.0]
  - - [5888, 448, 1, 256, 5888, 5888, 5888, 448]
    - [30, 11059.0]
  - - [5888, 6784, 1, 128, 5888, 5888, 5888, 6784]
    - [1, 12273.0]
  - - [6784, 5056, 1, 1280, 6784, 6784, 6784, 5056]
    - [19, 12638.0]
  - - [5056, 704, 1, 1280, 5056, 5056, 5056, 704]
    - [15, 11786.0]
  - - [4288, 6784, 1, 1280, 4288, 4288, 4288, 6784]
    - [35, 12485.0]
  - - [6784, 1408, 1, 256, 6784, 6784, 6784, 1408]
    - [1, 11991.0]
  - - [3584, 5888, 1, 128, 3584, 3584, 3584, 5888]
    - [19, 12098.0]
  - - [5056, 5888, 1, 256, 5056, 5056, 5056, 5888]
    - [31, 12357.0]
  - - [2368, 1024, 1, 256, 2368, 2368, 2368, 1024]
    - [10, 10651.0]
  - - [2944, 1856, 1, 256, 2944, 2944, 2944, 1856]
    - [15, 11649.0]
  - - [1856, 6784, 1, 1280, 1856, 1856, 1856, 6784]
    - [31, 12198.0]
  - - [4288, 3584, 1, 256, 4288, 4288, 4288, 3584]
    - [1, 12096.0]
  - - [5056, 1856, 1, 1280, 5056, 5056, 5056, 1856]
    - [19, 12085.0]
  - - [1408, 1024, 1, 3328, 1408, 1408, 1408, 1024]
    - [3, 11499.0]
  - - [5888, 3584, 1, 1280, 5888, 5888, 5888, 3584]
    - [4, 12667.0]
  - - [1856, 3584, 1, 3328, 1856, 1856, 1856, 3584]
    - [4, 12222.0]
  - - [1024, 2944, 1, 256, 1024, 1024, 1024, 2944]
    - [0, 11280.0]
  - - [448, 6784, 1, 1280, 448, 448, 448, 6784]
    - [16, 10460.0]
  - - [704, 5056, 1, 256, 704, 704, 704, 5056]
    - [20, 10695.0]
  - - [3584, 1024, 1, 3328, 3584, 3584, 3584, 1024]
    - [30, 11801.0]
  - - [2944, 1856, 1, 1280, 2944, 2944, 2944, 1856]
    - [18, 11899.0]
  - - [5056, 256, 1, 256, 5056, 5056, 5056, 256]
    - [0, 10661.0]
  - - [2368, 3584, 1, 3328, 2368, 2368, 2368, 3584]
    - [19, 12186.0]
  - - [2944, 704, 1, 1280, 2944, 2944, 2944, 704]
    - [30, 11520.0]
  - - [2944, 3584, 1, 1280, 2944, 2944, 2944, 3584]
    - [31, 12419.0]
  - - [1856, 5888, 1, 1280, 1856, 1856, 1856, 5888]
    - [16, 12094.0]
  - - [5056, 448, 1, 3328, 5056, 5056, 5056, 448]
    - [3, 11774.0]
  - - [4288, 1408, 1, 256, 4288, 4288, 4288, 1408]
    - [13, 11709.0]
  - - [5888, 1408, 1, 128, 5888, 5888, 5888, 1408]
    - [30, 11713.0]
  - - [4288, 2368, 1, 1280, 4288, 4288, 4288, 2368]
    - [18, 12017.0]
  - - [6784, 2368, 1, 256, 6784, 6784, 6784, 2368]
    - [30, 12038.0]
  - - [4288, 1856, 1, 256, 4288, 4288, 4288, 1856]
    - [15, 11606.0]
  - - [1856, 2944, 1, 256, 1856, 1856, 1856, 2944]
    - [23, 11264.0]
  - - [5056, 1024, 1, 128, 5056, 5056, 5056, 1024]
    - [5, 11410.0]
  - - [1760, 7133, 1, 1760, 1760, 1760, 1760, 7133]
    - [4, 12200.0]
  - - [6784, 256, 1, 128, 6784, 6784, 6784, 256]
    - [15, 10188.0]
  - - [5888, 704, 1, 128, 5888, 5888, 5888, 704]
    - [15, 11236.0]
  - - [1024, 4288, 1, 1280, 1024, 1024, 1024, 4288]
    - [41, 11976.0]
  - - [2368, 5056, 1, 3328, 2368, 2368, 2368, 5056]
    - [4, 12252.0]
  - - [4288, 1024, 1, 3328, 4288, 4288, 4288, 1024]
    - [16, 12021.0]
  - - [1024, 5056, 1, 3328, 1024, 1024, 1024, 5056]
    - [27, 12404.0]
  - - [1024, 1856, 1, 3328, 1024, 1024, 1024, 1856]
    - [36, 11774.0]
  - - [704, 6784, 1, 128, 704, 704, 704, 6784]
    - [17, 10421.0]
  - - [4288, 6784, 1, 256, 4288, 4288, 4288, 6784]
    - [9, 12254.0]
  - - [3584, 2944, 1, 3328, 3584, 3584, 3584, 2944]
    - [35, 12458.0]
  - - [5888, 2944, 1, 256, 5888, 5888, 5888, 2944]
    - [1, 12380.0]
  - - [2368, 6784, 1, 128, 2368, 2368, 2368, 6784]
    - [16, 11632.0]
  - - [448, 4288, 1, 1280, 448, 448, 448, 4288]
    - [5, 10159.0]
  - - [5056, 4288, 1, 256, 5056, 5056, 5056, 4288]
    - [12, 12064.0]
  - - [1024, 3584, 1, 256, 1024, 1024, 1024, 3584]
    - [30, 11469.0]
  - - [1856, 5056, 1, 128, 1856, 1856, 1856, 5056]
    - [8, 11293.0]
  - - [6784, 6784, 1, 3328, 6784, 6784, 6784, 6784]
    - [4, 12787.0]
  - - [448, 5888, 1, 1280, 448, 448, 448, 5888]
    - [30, 10149.0]
  - - [5056, 448, 1, 128, 5056, 5056, 5056, 448]
    - [8, 10691.0]
  - - [3584, 2944, 1, 128, 3584, 3584, 3584, 2944]
    - [0, 11748.0]
  - - [6784, 256, 1, 1280, 6784, 6784, 6784, 256]
    - [30, 11374.0]
  - - [2368, 5888, 1, 3328, 2368, 2368, 2368, 5888]
    - [1, 12345.0]
  - - [2368, 1856, 1, 1280, 2368, 2368, 2368, 1856]
    - [30, 11620.0]
  - - [3584, 4288, 1, 128, 3584, 3584, 3584, 4288]
    - [0, 11964.0]
  - - [5888, 4288, 1, 3328, 5888, 5888, 5888, 4288]
    - [4, 12489.0]
  - - [2368, 704, 1, 256, 2368, 2368, 2368, 704]
    - [0, 10264.0]
  - - [3584, 1408, 1, 128, 3584, 3584, 3584, 1408]
    - [0, 11489.0]
  - - [1856, 5056, 1, 1280, 1856, 1856, 1856, 5056]
    - [4, 12063.0]
  - - [2944, 1024, 1, 1280, 2944, 2944, 2944, 1024]
    - [30, 11618.0]
  - - [3584, 5888, 1, 3328, 3584, 3584, 3584, 5888]
    - [19, 12683.0]
  - - [2368, 4288, 1, 256, 2368, 2368, 2368, 4288]
    - [0, 11605.0]
  - - [1024, 2368, 1, 3328, 1024, 1024, 1024, 2368]
    - [34, 11828.0]
  - - [6784, 1856, 1, 3328, 6784, 6784, 6784, 1856]
    - [19, 12247.0]
  - - [1024, 2944, 1, 128, 1024, 1024, 1024, 2944]
    - [15, 10821.0]
  - - [1024, 3584, 1, 1280, 1024, 1024, 1024, 3584]
    - [34, 11755.0]
  - - [4288, 5888, 1, 3328, 4288, 4288, 4288, 5888]
    - [35, 12489.0]
  - - [1024, 2944, 1, 3328, 1024, 1024, 1024, 2944]
    - [34, 11676.0]
  - - [3584, 6784, 1, 256, 3584, 3584, 3584, 6784]
    - [31, 12397.0]
  - - [256, 6784, 1, 1280, 256, 256, 256, 6784]
    - [15, 11374.0]
  - - [1856, 3584, 1, 256, 1856, 1856, 1856, 3584]
    - [31, 11692.0]
  - - [6784, 1856, 1, 128, 6784, 6784, 6784, 1856]
    - [0, 11843.0]
  - - [2944, 704, 1, 128, 2944, 2944, 2944, 704]
    - [30, 10758.0]
  - - [256, 5888, 1, 1280, 256, 256, 256, 5888]
    - [36, 11146.0]
  - - [4288, 6784, 1, 3328, 4288, 4288, 4288, 6784]
    - [35, 12500.0]
  - - [7680, 5481, 1, 2560, 7680, 7680, 7680, 5481]
    - [19, 12754.0]
  - - [2368, 1408, 1, 128, 2368, 2368, 2368, 1408]
    - [0, 10723.0]
  - - [1408, 1024, 1, 128, 1408, 1408, 1408, 1024]
    - [0, 10264.0]
  - - [6784, 3584, 1, 3328, 6784, 6784, 6784, 3584]
    - [19, 12674.0]
  - - [2368, 5056, 1, 1280, 2368, 2368, 2368, 5056]
    - [16, 12185.0]
  - - [1408, 2368, 1, 1280, 1408, 1408, 1408, 2368]
    - [34, 11643.0]
  - - [2944, 4288, 1, 128, 2944, 2944, 2944, 4288]
    - [0, 11805.0]
  - - [2944, 2944, 1, 256, 2944, 2944, 2944, 2944]
    - [24, 12076.0]
  - - [6784, 256, 1, 256, 6784, 6784, 6784, 256]
    - [15, 10929.0]
  - - [256, 5056, 1, 3328, 256, 256, 256, 5056]
    - [5, 11873.0]
  - - [5056, 1856, 1, 128, 5056, 5056, 5056, 1856]
    - [23, 11490.0]
  - - [5888, 1408, 1, 256, 5888, 5888, 5888, 1408]
    - [12, 11963.0]
  - - [4288, 3584, 1, 3328, 4288, 4288, 4288, 3584]
    - [4, 12469.0]
  - - [1024, 2368, 1, 1280, 1024, 1024, 1024, 2368]
    - [30, 11714.0]
  - - [5888, 6784, 1, 3328, 5888, 5888, 5888, 6784]
    - [4, 12809.0]
  - - [704, 4288, 1, 1280, 704, 704, 704, 4288]
    - [0, 10540.0]
  - - [6784, 448, 1, 3328, 6784, 6784, 6784, 448]
    - [18, 11761.0]
  - - [4288, 1024, 1, 128, 4288, 4288, 4288, 1024]
    - [5, 10986.0]
  - - [196, 256, 256, 1024, 196, 196, 196, 256]
    - [4, 9525.0]
  - - [784, 512, 256, 128, 784, 784, 784, 512]
    - [4, 10709.0]
  - - [784, 128, 128, 512, 784, 784, 784, 128]
    - [4, 10871.0]
  - - [3136, 256, 256, 64, 3136, 3136, 3136, 256]
    - [0, 8245.0]
  - - [784, 128, 256, 512, 784, 784, 784, 128]
    - [4, 10991.0]
  - - [196, 256, 128, 1024, 196, 196, 196, 256]
    - [4, 9420.0]
  - - [3136, 256, 128, 64, 3136, 3136, 3136, 256]
    - [0, 9064.0]
  - - [784, 512, 128, 128, 784, 784, 784, 512]
    - [36, 10603.0]
  - - [196, 1024, 128, 256, 196, 196, 196, 1024]
    - [4, 9277.0]
  - - [196, 1024, 256, 256, 196, 196, 196, 1024]
    - [20, 9371.0]
  - - [5329, 160, 64, 64, 5329, 5329, 5329, 160]
    - [34, 7070.0]
  - - [1225, 384, 64, 192, 1225, 1225, 1225, 384]
    - [5, 11544.0]
  - - [289, 1024, 64, 256, 289, 289, 289, 1024]
    - [36, 9180.0]
  - - [1225, 384, 64, 64, 1225, 1225, 1225, 384]
    - [0, 10415.0]
  - - [1225, 384, 64, 96, 1225, 1225, 1225, 384]
    - [3, 10383.0]
  - - [289, 1024, 64, 384, 289, 289, 289, 1024]
    - [16, 9357.0]
  - - [289, 1024, 64, 192, 289, 289, 289, 1024]
    - [1, 9070.0]
  - - [289, 1024, 64, 128, 289, 289, 289, 1024]
    - [0, 8872.0]
  - - [4096, 1024, 1, 2984, 4096, 4096, 4096, 1024]
    - [31, 12341.0]
  - - [1024, 4096, 1, 3437, 1024, 1024, 1024, 4096]
    - [19, 12342.0]
  - - [1024, 4096, 1, 3235, 1024, 1024, 1024, 4096]
    - [19, 12356.0]
  - - [4096, 1024, 1, 4032, 4096, 4096, 4096, 1024]
    - [19, 12354.0]
  - - [1024, 4096, 1, 3334, 1024, 1024, 1024, 4096]
    - [16, 12345.0]
  - - [4096, 1024, 1, 3288, 4096, 4096, 4096, 1024]
    - [19, 12340.0]
  - - [1024, 4096, 1, 3515, 1024, 1024, 1024, 4096]
    - [19, 12344.0]
  - - [4096, 1024, 1, 3437, 4096, 4096, 4096, 1024]
    - [19, 12346.0]
  - - [1024, 4096, 1, 3259, 1024, 1024, 1024, 4096]
    - [16, 12337.0]
  - - [1024, 4096, 1, 3384, 1024, 1024, 1024, 4096]
    - [19, 12363.0]
  - - [4096, 1024, 1, 3458, 4096, 4096, 4096, 1024]
    - [12, 12344.0]
  - - [1024, 4096, 1, 3412, 1024, 1024, 1024, 4096]
    - [4, 12346.0]
  - - [1024, 4096, 1, 3529, 1024, 1024, 1024, 4096]
    - [19, 12346.0]
  - - [1024, 4096, 1, 4032, 1024, 1024, 1024, 4096]
    - [4, 12363.0]
  - - [4096, 1024, 1, 3999, 4096, 4096, 4096, 1024]
    - [19, 12355.0]
  - - [1024, 4096, 1, 3079, 1024, 1024, 1024, 4096]
    - [19, 12332.0]
  - - [1024, 4096, 1, 3876, 1024, 1024, 1024, 4096]
    - [19, 12368.0]
  - - [1024, 4096, 1, 3450, 1024, 1024, 1024, 4096]
    - [4, 12345.0]
  - - [1024, 4096, 1, 3256, 1024, 1024, 1024, 4096]
    - [16, 12365.0]
  - - [4096, 1024, 1, 3403, 4096, 4096, 4096, 1024]
    - [4, 12341.0]
  - - [1024, 4096, 1, 3359, 1024, 1024, 1024, 4096]
    - [16, 12357.0]
  - - [4096, 1024, 1, 3549, 4096, 4096, 4096, 1024]
    - [27, 12353.0]
  - - [4096, 1024, 1, 3176, 4096, 4096, 4096, 1024]
    - [19, 12356.0]
  - - [1024, 4096, 1, 3504, 1024, 1024, 1024, 4096]
    - [19, 12349.0]
  - - [4096, 1024, 1, 3314, 4096, 4096, 4096, 1024]
    - [16, 12354.0]
  - - [4096, 1024, 1, 3183, 4096, 4096, 4096, 1024]
    - [35, 12372.0]
  - - [1024, 4096, 1, 3209, 1024, 1024, 1024, 4096]
    - [4, 12358.0]
  - - [1024, 4096, 1, 3720, 1024, 1024, 1024, 4096]
    - [16, 12364.0]
  - - [1024, 4096, 1, 3859, 1024, 1024, 1024, 4096]
    - [16, 12361.0]
  - - [1024, 33708, 1, 4059, 1024, 1024, 1024, 33708]
    - [4, 12728.0]
  - - [4096, 1024, 1, 3477, 4096, 4096, 4096, 1024]
    - [4, 12342.0]
  - - [4096, 1024, 1, 3233, 4096, 4096, 4096, 1024]
    - [19, 12342.0]
  - - [4096, 1024, 1, 3409, 4096, 4096, 4096, 1024]
    - [16, 12347.0]
  - - [4096, 1024, 1, 3564, 4096, 4096, 4096, 1024]
    - [16, 12367.0]
  - - [4096, 1024, 1, 3190, 4096, 4096, 4096, 1024]
    - [1, 12351.0]
  - - [1024, 4096, 1, 3288, 1024, 1024, 1024, 4096]
    - [35, 12340.0]
  - - [4096, 1024, 1, 3451, 4096, 4096, 4096, 1024]
    - [1, 12353.0]
  - - [1024, 4096, 1, 3348, 1024, 1024, 1024, 4096]
    - [19, 12340.0]
  - - [1024, 4096, 1, 3465, 1024, 1024, 1024, 4096]
    - [19, 12345.0]
  - - [1024, 33708, 1, 4032, 1024, 1024, 1024, 33708]
    - [19, 12731.0]
  - - [1024, 33708, 1, 3840, 1024, 1024, 1024, 33708]
    - [19, 12734.0]
  - - [4096, 1024, 1, 3391, 4096, 4096, 4096, 1024]
    - [19, 12341.0]
  - - [1024, 4096, 1, 3530, 1024, 1024, 1024, 4096]
    - [19, 12346.0]
  - - [4096, 1024, 1, 3209, 4096, 4096, 4096, 1024]
    - [1, 12338.0]
  - - [1024, 4096, 1, 3457, 1024, 1024, 1024, 4096]
    - [4, 12346.0]
  - - [1024, 4096, 1, 3386, 1024, 1024, 1024, 4096]
    - [16, 12341.0]
  - - [4096, 1024, 1, 3350, 4096, 4096, 4096, 1024]
    - [19, 12343.0]
  - - [1024, 4096, 1, 3184, 1024, 1024, 1024, 4096]
    - [19, 12345.0]
  - - [1024, 4096, 1, 3093, 1024, 1024, 1024, 4096]
    - [1, 12357.0]
  - - [1024, 4096, 1, 3400, 1024, 1024, 1024, 4096]
    - [4, 12357.0]
  - - [1024, 4096, 1, 3214, 1024, 1024, 1024, 4096]
    - [4, 12359.0]
  - - [4096, 1024, 1, 3406, 4096, 4096, 4096, 1024]
    - [16, 12342.0]
  - - [1024, 4096, 1, 3565, 1024, 1024, 1024, 4096]
    - [12, 12350.0]
  - - [4096, 1024, 1, 3536, 4096, 4096, 4096, 1024]
    - [19, 12352.0]
  - - [1024, 4096, 1, 3183, 1024, 1024, 1024, 4096]
    - [16, 12340.0]
  - - [1024, 4096, 1, 3462, 1024, 1024, 1024, 4096]
    - [4, 12342.0]
  - - [4096, 1024, 1, 3130, 4096, 4096, 4096, 1024]
    - [16, 12337.0]
  - - [4096, 1024, 1, 3381, 4096, 4096, 4096, 1024]
    - [16, 12344.0]
  - - [4096, 1024, 1, 3298, 4096, 4096, 4096, 1024]
    - [1, 12342.0]
  - - [1024, 4096, 1, 3292, 1024, 1024, 1024, 4096]
    - [16, 12339.0]
  - - [4096, 1024, 1, 3289, 4096, 4096, 4096, 1024]
    - [16, 12344.0]
  - - [1024, 4096, 1, 3379, 1024, 1024, 1024, 4096]
    - [19, 12345.0]
  - - [1024, 4096, 1, 3990, 1024, 1024, 1024, 4096]
    - [19, 12356.0]
  - - [1024, 4096, 1, 3540, 1024, 1024, 1024, 4096]
    - [19, 12356.0]
  - - [4096, 1024, 1, 3412, 4096, 4096, 4096, 1024]
    - [16, 12348.0]
  - - [1024, 4096, 1, 3555, 1024, 1024, 1024, 4096]
    - [4, 12347.0]
  - - [1024, 4096, 1, 3518, 1024, 1024, 1024, 4096]
    - [16, 12353.0]
  - - [4096, 1024, 1, 3189, 4096, 4096, 4096, 1024]
    - [19, 12336.0]
  - - [1024, 4096, 1, 3298, 1024, 1024, 1024, 4096]
    - [4, 12342.0]
  - - [4096, 1024, 1, 3072, 4096, 4096, 4096, 1024]
    - [1, 12343.0]
  - - [1024, 4096, 1, 3393, 1024, 1024, 1024, 4096]
    - [16, 12346.0]
  - - [1024, 4096, 1, 3207, 1024, 1024, 1024, 4096]
    - [1, 12359.0]
  - - [4096, 1024, 1, 3487, 4096, 4096, 4096, 1024]
    - [19, 12345.0]
  - - [4096, 1024, 1, 3431, 4096, 4096, 4096, 1024]
    - [27, 12352.0]
  - - [4096, 1024, 1, 3378, 4096, 4096, 4096, 1024]
    - [1, 12344.0]
  - - [4096, 1024, 1, 3529, 4096, 4096, 4096, 1024]
    - [19, 12350.0]
  - - [4096, 1024, 1, 3460, 4096, 4096, 4096, 1024]
    - [19, 12342.0]
  - - [1024, 4096, 1, 3336, 1024, 1024, 1024, 4096]
    - [19, 12339.0]
  - - [1024, 4096, 1, 3501, 1024, 1024, 1024, 4096]
    - [19, 12361.0]
  - - [1024, 4096, 1, 3584, 1024, 1024, 1024, 4096]
    - [4, 12360.0]
  - - [4096, 1024, 1, 2499, 4096, 4096, 4096, 1024]
    - [16, 12323.0]
  - - [4096, 1024, 1, 3352, 4096, 4096, 4096, 1024]
    - [4, 12355.0]
  - - [1024, 4096, 1, 3543, 1024, 1024, 1024, 4096]
    - [4, 12347.0]
  - - [1024, 4096, 1, 3476, 1024, 1024, 1024, 4096]
    - [16, 12345.0]
  - - [1024, 33708, 1, 3822, 1024, 1024, 1024, 33708]
    - [4, 12731.0]
  - - [1024, 4096, 1, 3436, 1024, 1024, 1024, 4096]
    - [4, 12340.0]
  - - [1024, 4096, 1, 3594, 1024, 1024, 1024, 4096]
    - [16, 12352.0]
  - - [4096, 1024, 1, 3514, 4096, 4096, 4096, 1024]
    - [4, 12338.0]
  - - [1024, 4096, 1, 3064, 1024, 1024, 1024, 4096]
    - [19, 12334.0]
  - - [4096, 1024, 1, 3371, 4096, 4096, 4096, 1024]
    - [4, 12338.0]
  - - [4096, 1024, 1, 3558, 4096, 4096, 4096, 1024]
    - [19, 12346.0]
  - - [4096, 1024, 1, 3517, 4096, 4096, 4096, 1024]
    - [19, 12348.0]
  - - [4096, 1024, 1, 3144, 4096, 4096, 4096, 1024]
    - [16, 12342.0]
  - - [1024, 4096, 1, 3312, 1024, 1024, 1024, 4096]
    - [19, 12348.0]
  - - [4096, 1024, 1, 3079, 4096, 4096, 4096, 1024]
    - [1, 12333.0]
  - - [1024, 4096, 1, 3415, 1024, 1024, 1024, 4096]
    - [16, 12343.0]
  - - [1024, 4096, 1, 3221, 1024, 1024, 1024, 4096]
    - [19, 12350.0]
  - - [1024, 4096, 1, 3978, 1024, 1024, 1024, 4096]
    - [16, 12347.0]
  - - [4096, 1024, 1, 3876, 4096, 4096, 4096, 1024]
    - [19, 12356.0]
  - - [1024, 4096, 1, 3528, 1024, 1024, 1024, 4096]
    - [16, 12347.0]
  - - [1024, 4096, 1, 3181, 1024, 1024, 1024, 4096]
    - [1, 12339.0]
  - - [4096, 1024, 1, 3445, 4096, 4096, 4096, 1024]
    - [1, 12342.0]
  - - [4096, 1024, 1, 3450, 4096, 4096, 4096, 1024]
    - [1, 12343.0]
  - - [4096, 1024, 1, 3377, 4096, 4096, 4096, 1024]
    - [19, 12339.0]
  - - [1024, 4096, 1, 3532, 1024, 1024, 1024, 4096]
    - [16, 12344.0]
  - - [1024, 33708, 1, 3944, 1024, 1024, 1024, 33708]
    - [4, 12728.0]
  - - [4096, 1024, 1, 3483, 4096, 4096, 4096, 1024]
    - [4, 12341.0]
  - - [1024, 4096, 1, 3358, 1024, 1024, 1024, 4096]
    - [4, 12341.0]
  - - [4096, 1024, 1, 3464, 4096, 4096, 4096, 1024]
    - [16, 12348.0]
  - - [4096, 1024, 1, 3282, 4096, 4096, 4096, 1024]
    - [4, 12342.0]
  - - [4096, 1024, 1, 3256, 4096, 4096, 4096, 1024]
    - [27, 12354.0]
  - - [1024, 4096, 1, 3057, 1024, 1024, 1024, 4096]
    - [16, 12336.0]
  - - [4096, 1024, 1, 3481, 4096, 4096, 4096, 1024]
    - [19, 12345.0]
  - - [4096, 1024, 1, 3340, 4096, 4096, 4096, 1024]
    - [19, 12340.0]
  - - [1024, 4096, 1, 3273, 1024, 1024, 1024, 4096]
    - [16, 12343.0]
  - - [4096, 1024, 1, 3392, 4096, 4096, 4096, 1024]
    - [4, 12354.0]
  - - [4096, 1024, 1, 3337, 4096, 4096, 4096, 1024]
    - [19, 12342.0]
  - - [4096, 1024, 1, 3359, 4096, 4096, 4096, 1024]
    - [1, 12342.0]
  - - [4096, 1024, 1, 3498, 4096, 4096, 4096, 1024]
    - [19, 12351.0]
  - - [4096, 1024, 1, 3169, 4096, 4096, 4096, 1024]
    - [19, 12340.0]
  - - [1024, 33708, 1, 3859, 1024, 1024, 1024, 33708]
    - [35, 12730.0]
  - - [1024, 4096, 1, 3103, 1024, 1024, 1024, 4096]
    - [16, 12337.0]
  - - [4096, 1024, 1, 3900, 4096, 4096, 4096, 1024]
    - [19, 12353.0]
  - - [1024, 4096, 1, 3442, 1024, 1024, 1024, 4096]
    - [19, 12343.0]
  - - [1024, 4096, 1, 3248, 1024, 1024, 1024, 4096]
    - [4, 12347.0]
  - - [1024, 4096, 1, 3351, 1024, 1024, 1024, 4096]
    - [4, 12364.0]
  - - [4096, 1024, 1, 3593, 4096, 4096, 4096, 1024]
    - [19, 12345.0]
  - - [1024, 4096, 1, 3780, 1024, 1024, 1024, 4096]
    - [19, 12354.0]
  - - [1024, 33708, 1, 3681, 1024, 1024, 1024, 33708]
    - [4, 12728.0]
  - - [4096, 1024, 1, 3374, 4096, 4096, 4096, 1024]
    - [19, 12344.0]
  - - [1024, 4096, 1, 3557, 1024, 1024, 1024, 4096]
    - [4, 12347.0]
  - - [4096, 1024, 1, 3906, 4096, 4096, 4096, 1024]
    - [35, 12341.0]
  - - [4096, 1024, 1, 3504, 4096, 4096, 4096, 1024]
    - [19, 12359.0]
  - - [1024, 4096, 1, 3270, 1024, 1024, 1024, 4096]
    - [16, 12344.0]
  - - [4096, 1024, 1, 3098, 4096, 4096, 4096, 1024]
    - [16, 12339.0]
  - - [4096, 1024, 1, 3216, 4096, 4096, 4096, 1024]
    - [12, 12350.0]
  - - [1024, 4096, 1, 3550, 1024, 1024, 1024, 4096]
    - [4, 12345.0]
  - - [4096, 1024, 1, 3449, 4096, 4096, 4096, 1024]
    - [19, 12351.0]
  - - [1024, 4096, 1, 3403, 1024, 1024, 1024, 4096]
    - [16, 12342.0]
  - - [1024, 4096, 1, 3523, 1024, 1024, 1024, 4096]
    - [16, 12347.0]
  - - [1024, 4096, 1, 3486, 1024, 1024, 1024, 4096]
    - [19, 12342.0]
  - - [1024, 4096, 1, 3564, 1024, 1024, 1024, 4096]
    - [19, 12347.0]
  - - [1024, 33708, 1, 4005, 1024, 1024, 1024, 33708]
    - [4, 12731.0]
  - - [4096, 1024, 1, 3296, 4096, 4096, 4096, 1024]
    - [4, 12348.0]
  - - [1024, 4096, 1, 3263, 1024, 1024, 1024, 4096]
    - [16, 12342.0]
  - - [1024, 4096, 1, 3130, 1024, 1024, 1024, 4096]
    - [16, 12340.0]
  - - [1024, 4096, 1, 3295, 1024, 1024, 1024, 4096]
    - [1, 12336.0]
  - - [1024, 33708, 1, 3925, 1024, 1024, 1024, 33708]
    - [4, 12731.0]
  - - [1024, 4096, 1, 3378, 1024, 1024, 1024, 4096]
    - [27, 12330.0]
  - - [4096, 1024, 1, 3720, 4096, 4096, 4096, 1024]
    - [1, 12352.0]
  - - [4096, 1024, 1, 3399, 4096, 4096, 4096, 1024]
    - [35, 12343.0]
  - - [4096, 1024, 1, 3543, 4096, 4096, 4096, 1024]
    - [19, 12361.0]
  - - [4096, 1024, 1, 3497, 4096, 4096, 4096, 1024]
    - [19, 12339.0]
  - - [4096, 1024, 1, 3594, 4096, 4096, 4096, 1024]
    - [4, 12348.0]
  - - [1024, 4096, 1, 3144, 1024, 1024, 1024, 4096]
    - [4, 12338.0]
  - - [1024, 4096, 1, 3975, 1024, 1024, 1024, 4096]
    - [19, 12354.0]
  - - [4096, 1024, 1, 3205, 4096, 4096, 4096, 1024]
    - [19, 12337.0]
  - - [1024, 33708, 1, 3995, 1024, 1024, 1024, 33708]
    - [19, 12730.0]
  - - [1024, 4096, 1, 3392, 1024, 1024, 1024, 4096]
    - [4, 12353.0]
  - - [1024, 4096, 1, 3055, 1024, 1024, 1024, 4096]
    - [1, 12346.0]
  - - [1024, 4096, 1, 4026, 1024, 1024, 1024, 4096]
    - [4, 12360.0]
  - - [4096, 1024, 1, 3557, 4096, 4096, 4096, 1024]
    - [19, 12351.0]
  - - [4096, 1024, 1, 3515, 4096, 4096, 4096, 1024]
    - [19, 12344.0]
  - - [4096, 1024, 1, 3486, 4096, 4096, 4096, 1024]
    - [35, 12363.0]
  - - [4096, 1024, 1, 3457, 4096, 4096, 4096, 1024]
    - [19, 12345.0]
  - - [1024, 4096, 1, 3511, 1024, 1024, 1024, 4096]
    - [4, 12351.0]
  - - [4096, 1024, 1, 3138, 4096, 4096, 4096, 1024]
    - [16, 12338.0]
  - - [1024, 4096, 1, 3339, 1024, 1024, 1024, 4096]
    - [19, 12343.0]
  - - [1024, 4096, 1, 3939, 1024, 1024, 1024, 4096]
    - [19, 12354.0]
  - - [4096, 1024, 1, 3500, 4096, 4096, 4096, 1024]
    - [4, 12346.0]
  - - [4096, 1024, 1, 3395, 4096, 4096, 4096, 1024]
    - [12, 12346.0]
  - - [4096, 1024, 1, 4020, 4096, 4096, 4096, 1024]
    - [19, 12354.0]
  - - [4096, 1024, 1, 3942, 4096, 4096, 4096, 1024]
    - [19, 12349.0]
  - - [4096, 1024, 1, 3349, 4096, 4096, 4096, 1024]
    - [19, 12348.0]
  - - [1024, 4096, 1, 3322, 1024, 1024, 1024, 4096]
    - [16, 12348.0]
  - - [4096, 1024, 1, 3452, 4096, 4096, 4096, 1024]
    - [19, 12343.0]
  - - [1024, 4096, 1, 3417, 1024, 1024, 1024, 4096]
    - [16, 12349.0]
  - - [1024, 4096, 1, 3526, 1024, 1024, 1024, 4096]
    - [16, 12348.0]
  - - [4096, 1024, 1, 3485, 4096, 4096, 4096, 1024]
    - [19, 12366.0]
  - - [4096, 1024, 1, 3303, 4096, 4096, 4096, 1024]
    - [4, 12360.0]
  - - [4096, 1024, 1, 3344, 4096, 4096, 4096, 1024]
    - [12, 12350.0]
  - - [1024, 4096, 1, 3479, 1024, 1024, 1024, 4096]
    - [16, 12346.0]
  - - [4096, 1024, 1, 3300, 4096, 4096, 4096, 1024]
    - [19, 12350.0]
  - - [1024, 4096, 1, 3439, 1024, 1024, 1024, 4096]
    - [16, 12340.0]
  - - [4096, 1024, 1, 3280, 4096, 4096, 4096, 1024]
    - [19, 12347.0]
  - - [1024, 4096, 1, 3245, 1024, 1024, 1024, 4096]
    - [1, 12333.0]
  - - [1024, 4096, 1, 3328, 1024, 1024, 1024, 4096]
    - [19, 12349.0]
  - - [4096, 1024, 1, 3418, 4096, 4096, 4096, 1024]
    - [19, 12345.0]
  - - [1024, 4096, 1, 3493, 1024, 1024, 1024, 4096]
    - [4, 12346.0]
  - - [1024, 4096, 1, 3500, 1024, 1024, 1024, 4096]
    - [16, 12350.0]
  - - [1024, 4096, 1, 3166, 1024, 1024, 1024, 4096]
    - [16, 12342.0]
  - - [4096, 1024, 1, 3126, 4096, 4096, 4096, 1024]
    - [19, 12335.0]
  - - [1024, 4096, 1, 3277, 1024, 1024, 1024, 4096]
    - [4, 12341.0]
  - - [1024, 4096, 1, 3315, 1024, 1024, 1024, 4096]
    - [1, 12363.0]
  - - [1024, 4096, 1, 3414, 1024, 1024, 1024, 4096]
    - [16, 12343.0]
  - - [4096, 1024, 1, 3531, 4096, 4096, 4096, 1024]
    - [19, 12342.0]
  - - [4096, 1024, 1, 3484, 4096, 4096, 4096, 1024]
    - [4, 12353.0]
  - - [1024, 4096, 1, 3180, 1024, 1024, 1024, 4096]
    - [19, 12348.0]
  - - [4096, 1024, 1, 3360, 4096, 4096, 4096, 1024]
    - [1, 12343.0]
  - - [1024, 33708, 1, 3990, 1024, 1024, 1024, 33708]
    - [4, 12728.0]
  - - [4096, 1024, 1, 3466, 4096, 4096, 4096, 1024]
    - [4, 12341.0]
  - - [1024, 4096, 1, 3428, 1024, 1024, 1024, 4096]
    - [4, 12340.0]
  - - [1024, 4096, 1, 3137, 1024, 1024, 1024, 4096]
    - [1, 12337.0]
  - - [4096, 1024, 1, 4059, 4096, 4096, 4096, 1024]
    - [19, 12353.0]
  - - [1024, 4096, 1, 3353, 1024, 1024, 1024, 4096]
    - [4, 12346.0]
  - - [1024, 4096, 1, 3942, 1024, 1024, 1024, 4096]
    - [4, 12356.0]
  - - [4096, 1024, 1, 3506, 4096, 4096, 4096, 1024]
    - [19, 12344.0]
  - - [4096, 1024, 1, 3508, 4096, 4096, 4096, 1024]
    - [4, 12342.0]
  - - [4096, 1024, 1, 3956, 4096, 4096, 4096, 1024]
    - [4, 12352.0]
  - - [1024, 4096, 1, 3272, 1024, 1024, 1024, 4096]
    - [16, 12343.0]
  - - [1024, 4096, 1, 3443, 1024, 1024, 1024, 4096]
    - [1, 12346.0]
  - - [1024, 4096, 1, 3375, 1024, 1024, 1024, 4096]
    - [16, 12345.0]
  - - [1024, 4096, 1, 3525, 1024, 1024, 1024, 4096]
    - [4, 12348.0]
  - - [4096, 1024, 1, 3472, 4096, 4096, 4096, 1024]
    - [4, 12348.0]
  - - [1024, 4096, 1, 3520, 1024, 1024, 1024, 4096]
    - [19, 12347.0]
  - - [4096, 1024, 1, 3322, 4096, 4096, 4096, 1024]
    - [19, 12345.0]
  - - [4096, 1024, 1, 3387, 4096, 4096, 4096, 1024]
    - [19, 12338.0]
  - - [1024, 33708, 1, 3939, 1024, 1024, 1024, 33708]
    - [4, 12731.0]
  - - [4096, 1024, 1, 3345, 4096, 4096, 4096, 1024]
    - [1, 12344.0]
  - - [4096, 1024, 1, 2967, 4096, 4096, 4096, 1024]
    - [16, 12333.0]
  - - [1024, 4096, 1, 3453, 1024, 1024, 1024, 4096]
    - [16, 12345.0]
  - - [1024, 4096, 1, 3640, 1024, 1024, 1024, 4096]
    - [16, 12354.0]
  - - [4096, 1024, 1, 3291, 4096, 4096, 4096, 1024]
    - [19, 12342.0]
  - - [1024, 4096, 1, 3350, 1024, 1024, 1024, 4096]
    - [19, 12341.0]
  - - [4096, 1024, 1, 3417, 4096, 4096, 4096, 1024]
    - [1, 12338.0]
  - - [1024, 4096, 1, 3467, 1024, 1024, 1024, 4096]
    - [16, 12343.0]
  - - [1024, 4096, 1, 3491, 1024, 1024, 1024, 4096]
    - [1, 12342.0]
  - - [1024, 4096, 1, 3822, 1024, 1024, 1024, 4096]
    - [19, 12350.0]
  - - [4096, 1024, 1, 3292, 4096, 4096, 4096, 1024]
    - [1, 12336.0]
  - - [1024, 4096, 1, 3231, 1024, 1024, 1024, 4096]
    - [16, 12339.0]
  - - [1024, 4096, 1, 3364, 1024, 1024, 1024, 4096]
    - [16, 12346.0]
  - - [1024, 4096, 1, 3995, 1024, 1024, 1024, 4096]
    - [4, 12370.0]
  - - [1024, 4096, 1, 3545, 1024, 1024, 1024, 4096]
    - [19, 12348.0]
  - - [1024, 4096, 1, 3186, 1024, 1024, 1024, 4096]
    - [1, 12344.0]
  - - [4096, 1024, 1, 3432, 4096, 4096, 4096, 1024]
    - [1, 12344.0]
  - - [4096, 1024, 1, 3367, 4096, 4096, 4096, 1024]
    - [1, 12338.0]
  - - [4096, 1024, 1, 3503, 4096, 4096, 4096, 1024]
    - [27, 12336.0]
  - - [1024, 4096, 1, 3095, 1024, 1024, 1024, 4096]
    - [4, 12340.0]
  - - [4096, 1024, 1, 3465, 4096, 4096, 4096, 1024]
    - [35, 12352.0]
  - - [1024, 4096, 1, 3402, 1024, 1024, 1024, 4096]
    - [16, 12344.0]
  - - [4096, 1024, 1, 3140, 4096, 4096, 4096, 1024]
    - [16, 12341.0]
  - - [4096, 1024, 1, 3424, 4096, 4096, 4096, 1024]
    - [19, 12352.0]
  - - [4096, 1024, 1, 3257, 4096, 4096, 4096, 1024]
    - [16, 12340.0]
  - - [4096, 1024, 1, 2917, 4096, 4096, 4096, 1024]
    - [16, 12352.0]
  - - [1024, 33708, 1, 3640, 1024, 1024, 1024, 33708]
    - [4, 12731.0]
  - - [1024, 4096, 1, 3456, 1024, 1024, 1024, 4096]
    - [4, 12352.0]
  - - [1024, 4096, 1, 3014, 1024, 1024, 1024, 4096]
    - [4, 12335.0]
  - - [4096, 1024, 1, 3372, 4096, 4096, 4096, 1024]
    - [19, 12355.0]
  - - [1024, 4096, 1, 3294, 1024, 1024, 1024, 4096]
    - [16, 12340.0]
  - - [4096, 1024, 1, 3446, 4096, 4096, 4096, 1024]
    - [19, 12344.0]
  - - [1024, 4096, 1, 3389, 1024, 1024, 1024, 4096]
    - [16, 12342.0]
  - - [4096, 1024, 1, 3259, 4096, 4096, 4096, 1024]
    - [16, 12343.0]
  - - [4096, 1024, 1, 3544, 4096, 4096, 4096, 1024]
    - [19, 12346.0]
  - - [4096, 1024, 1, 3479, 4096, 4096, 4096, 1024]
    - [1, 12340.0]
  - - [4096, 1024, 1, 3542, 4096, 4096, 4096, 1024]
    - [19, 12347.0]
  - - [4096, 1024, 1, 3321, 4096, 4096, 4096, 1024]
    - [1, 12343.0]
  - - [1024, 4096, 1, 3147, 1024, 1024, 1024, 4096]
    - [19, 12333.0]
  - - [1024, 4096, 1, 3944, 1024, 1024, 1024, 4096]
    - [4, 12352.0]
  - - [4096, 1024, 1, 3870, 4096, 4096, 4096, 1024]
    - [19, 12351.0]
  - - [1024, 4096, 1, 3308, 1024, 1024, 1024, 4096]
    - [4, 12340.0]
  - - [4096, 1024, 1, 3401, 4096, 4096, 4096, 1024]
    - [19, 12356.0]
  - - [1024, 4096, 1, 3395, 1024, 1024, 1024, 4096]
    - [4, 12348.0]
  - - [1024, 4096, 1, 3563, 1024, 1024, 1024, 4096]
    - [19, 12339.0]
  - - [1024, 33708, 1, 3870, 1024, 1024, 1024, 33708]
    - [4, 12730.0]
  - - [4096, 1024, 1, 3494, 4096, 4096, 4096, 1024]
    - [19, 12339.0]
  - - [1024, 4096, 1, 3271, 1024, 1024, 1024, 4096]
    - [4, 12344.0]
  - - [1024, 33708, 1, 3910, 1024, 1024, 1024, 33708]
    - [19, 12732.0]
  - - [1024, 4096, 1, 3287, 1024, 1024, 1024, 4096]
    - [4, 12341.0]
  - - [1024, 33708, 1, 3860, 1024, 1024, 1024, 33708]
    - [4, 12730.0]
  - - [4096, 1024, 1, 3341, 4096, 4096, 4096, 1024]
    - [19, 12338.0]
  - - [1024, 4096, 1, 3136, 1024, 1024, 1024, 4096]
    - [16, 12343.0]
  - - [4096, 1024, 1, 3439, 4096, 4096, 4096, 1024]
    - [4, 12344.0]
  - - [1024, 4096, 1, 3751, 1024, 1024, 1024, 4096]
    - [4, 12350.0]
  - - [1024, 4096, 1, 3301, 1024, 1024, 1024, 4096]
    - [16, 12343.0]
  - - [4096, 1024, 1, 3468, 4096, 4096, 4096, 1024]
    - [19, 12343.0]
  - - [1024, 4096, 1, 3416, 1024, 1024, 1024, 4096]
    - [16, 12345.0]
  - - [4096, 1024, 1, 3163, 4096, 4096, 4096, 1024]
    - [19, 12333.0]
  - - [1024, 4096, 1, 3230, 1024, 1024, 1024, 4096]
    - [16, 12336.0]
  - - [1024, 4096, 1, 3581, 1024, 1024, 1024, 4096]
    - [12, 12348.0]
  - - [4096, 1024, 1, 3463, 4096, 4096, 4096, 1024]
    - [19, 12341.0]
  - - [1024, 4096, 1, 3478, 1024, 1024, 1024, 4096]
    - [19, 12346.0]
  - - [4096, 1024, 1, 3262, 4096, 4096, 4096, 1024]
    - [16, 12338.0]
  - - [1024, 4096, 1, 3438, 1024, 1024, 1024, 4096]
    - [4, 12337.0]
  - - [1024, 4096, 1, 3244, 1024, 1024, 1024, 4096]
    - [4, 12343.0]
  - - [1024, 4096, 1, 3445, 1024, 1024, 1024, 4096]
    - [4, 12347.0]
  - - [4096, 1024, 1, 3328, 4096, 4096, 4096, 1024]
    - [16, 12340.0]
  - - [1024, 4096, 1, 3492, 1024, 1024, 1024, 4096]
    - [4, 12346.0]
  - - [4096, 1024, 1, 3211, 4096, 4096, 4096, 1024]
    - [1, 12331.0]
  - - [1024, 4096, 1, 3910, 1024, 1024, 1024, 4096]
    - [19, 12354.0]
  - - [1024, 4096, 1, 3314, 1024, 1024, 1024, 4096]
    - [19, 12340.0]
  - - [4096, 1024, 1, 3859, 4096, 4096, 4096, 1024]
    - [4, 12348.0]
  - - [4096, 1024, 1, 3383, 4096, 4096, 4096, 1024]
    - [19, 12343.0]
  - - [1024, 4096, 1, 3409, 1024, 1024, 1024, 4096]
    - [4, 12339.0]
  - - [1024, 4096, 1, 4020, 1024, 1024, 1024, 4096]
    - [19, 12356.0]
  - - [4096, 1024, 1, 3530, 4096, 4096, 4096, 1024]
    - [19, 12343.0]
  - - [4096, 1024, 1, 3411, 4096, 4096, 4096, 1024]
    - [19, 12340.0]
  - - [1024, 4096, 1, 3566, 1024, 1024, 1024, 4096]
    - [4, 12348.0]
  - - [4096, 1024, 1, 3493, 4096, 4096, 4096, 1024]
    - [4, 12348.0]
  - - [4096, 1024, 1, 3184, 4096, 4096, 4096, 1024]
    - [12, 12344.0]
  - - [1024, 4096, 1, 3072, 1024, 1024, 1024, 4096]
    - [16, 12344.0]
  - - [1024, 4096, 1, 3431, 1024, 1024, 1024, 4096]
    - [19, 12348.0]
  - - [4096, 1024, 1, 3306, 4096, 4096, 4096, 1024]
    - [27, 12345.0]
  - - [1024, 4096, 1, 3352, 1024, 1024, 1024, 4096]
    - [16, 12349.0]
  - - [4096, 1024, 1, 3295, 4096, 4096, 4096, 1024]
    - [4, 12338.0]
  - - [1024, 4096, 1, 3517, 1024, 1024, 1024, 4096]
    - [16, 12327.0]
  - - [4096, 1024, 1, 3426, 4096, 4096, 4096, 1024]
    - [19, 12343.0]
  - - [4096, 1024, 1, 3385, 4096, 4096, 4096, 1024]
    - [19, 12347.0]
  - - [4096, 1024, 1, 3572, 4096, 4096, 4096, 1024]
    - [19, 12350.0]
  - - [4096, 1024, 1, 3459, 4096, 4096, 4096, 1024]
    - [19, 12340.0]
  - - [1024, 4096, 1, 3374, 1024, 1024, 1024, 4096]
    - [4, 12341.0]
  - - [4096, 1024, 1, 3166, 4096, 4096, 4096, 1024]
    - [16, 12333.0]
  - - [4096, 1024, 1, 3093, 4096, 4096, 4096, 1024]
    - [1, 12331.0]
  - - [4096, 1024, 1, 3523, 4096, 4096, 4096, 1024]
    - [19, 12343.0]
  - - [4096, 1024, 1, 3413, 4096, 4096, 4096, 1024]
    - [19, 12341.0]
  - - [1024, 4096, 1, 3996, 1024, 1024, 1024, 4096]
    - [19, 12352.0]
  - - [1024, 4096, 1, 3452, 1024, 1024, 1024, 4096]
    - [19, 12344.0]
  - - [4096, 1024, 1, 3232, 4096, 4096, 4096, 1024]
    - [19, 12348.0]
  - - [4096, 1024, 1, 3400, 4096, 4096, 4096, 1024]
    - [1, 12346.0]
  - - [4096, 1024, 1, 3334, 4096, 4096, 4096, 1024]
    - [16, 12350.0]
  - - [1024, 4096, 1, 3345, 1024, 1024, 1024, 4096]
    - [16, 12345.0]
  - - [1024, 4096, 1, 3538, 1024, 1024, 1024, 4096]
    - [16, 12344.0]
  - - [1024, 4096, 1, 3466, 1024, 1024, 1024, 4096]
    - [19, 12345.0]
  - - [4096, 1024, 1, 3315, 4096, 4096, 4096, 1024]
    - [35, 12339.0]
  - - [4096, 1024, 1, 3214, 4096, 4096, 4096, 1024]
    - [4, 12340.0]
  - - [1024, 33708, 1, 3900, 1024, 1024, 1024, 33708]
    - [4, 12732.0]
  - - [1024, 4096, 1, 3367, 1024, 1024, 1024, 4096]
    - [4, 12345.0]
  - - [1024, 4096, 1, 2917, 1024, 1024, 1024, 4096]
    - [1, 12333.0]
  - - [1024, 4096, 1, 3544, 1024, 1024, 1024, 4096]
    - [16, 12351.0]
  - - [4096, 1024, 1, 3414, 4096, 4096, 4096, 1024]
    - [4, 12343.0]
  - - [4096, 1024, 1, 3565, 4096, 4096, 4096, 1024]
    - [19, 12346.0]
  - - [1024, 4096, 1, 3512, 1024, 1024, 1024, 4096]
    - [16, 12347.0]
  - - [1024, 4096, 1, 3191, 1024, 1024, 1024, 4096]
    - [16, 12338.0]
  - - [1024, 4096, 1, 3289, 1024, 1024, 1024, 4096]
    - [16, 12341.0]
  - - [4096, 1024, 1, 3290, 4096, 4096, 4096, 1024]
    - [19, 12337.0]
  - - [1024, 4096, 1, 3211, 1024, 1024, 1024, 4096]
    - [16, 12340.0]
  - - [1024, 33708, 1, 3969, 1024, 1024, 1024, 33708]
    - [4, 12729.0]
  - - [4096, 1024, 1, 3566, 4096, 4096, 4096, 1024]
    - [19, 12343.0]
  - - [1024, 4096, 1, 3459, 1024, 1024, 1024, 4096]
    - [4, 12343.0]
  - - [1024, 4096, 1, 3372, 1024, 1024, 1024, 4096]
    - [19, 12362.0]
  - - [4096, 1024, 1, 3339, 4096, 4096, 4096, 1024]
    - [19, 12339.0]
  - - [4096, 1024, 1, 3425, 4096, 4096, 4096, 1024]
    - [19, 12346.0]
  - - [4096, 1024, 1, 3388, 4096, 4096, 4096, 1024]
    - [35, 12352.0]
  - - [1024, 4096, 1, 3531, 1024, 1024, 1024, 4096]
    - [16, 12345.0]
  - - [4096, 1024, 1, 3286, 4096, 4096, 4096, 1024]
    - [19, 12340.0]
  - - [4096, 1024, 1, 3462, 4096, 4096, 4096, 1024]
    - [19, 12343.0]
  - - [1024, 4096, 1, 3388, 1024, 1024, 1024, 4096]
    - [4, 12345.0]
  - - [4096, 1024, 1, 3165, 4096, 4096, 4096, 1024]
    - [19, 12335.0]
  - - [4096, 1024, 1, 3304, 4096, 4096, 4096, 1024]
    - [19, 12365.0]
  - - [1024, 4096, 1, 2736, 1024, 1024, 1024, 4096]
    - [4, 12336.0]
  - - [4096, 1024, 1, 3397, 4096, 4096, 4096, 1024]
    - [19, 12344.0]
  - - [1024, 4096, 1, 3311, 1024, 1024, 1024, 4096]
    - [4, 12344.0]
  - - [1024, 4096, 1, 3394, 1024, 1024, 1024, 4096]
    - [1, 12350.0]
  - - [4096, 1024, 1, 2736, 4096, 4096, 4096, 1024]
    - [4, 12331.0]
  - - [1024, 4096, 1, 3559, 1024, 1024, 1024, 4096]
    - [19, 12346.0]
  - - [4096, 1024, 1, 3180, 4096, 4096, 4096, 1024]
    - [19, 12338.0]
  - - [1024, 4096, 1, 3480, 1024, 1024, 1024, 4096]
    - [16, 12352.0]
  - - [4096, 1024, 1, 3318, 4096, 4096, 4096, 1024]
    - [19, 12343.0]
  - - [4096, 1024, 1, 3213, 4096, 4096, 4096, 1024]
    - [4, 12337.0]
  - - [1024, 4096, 1, 3286, 1024, 1024, 1024, 4096]
    - [19, 12341.0]
  - - [4096, 1024, 1, 3471, 4096, 4096, 4096, 1024]
    - [4, 12347.0]
  - - [1024, 4096, 1, 3381, 1024, 1024, 1024, 4096]
    - [4, 12343.0]
  - - [4096, 1024, 1, 3502, 4096, 4096, 4096, 1024]
    - [16, 12339.0]
  - - [1024, 4096, 1, 3552, 1024, 1024, 1024, 4096]
    - [4, 12353.0]
  - - [4096, 1024, 1, 3519, 4096, 4096, 4096, 1024]
    - [4, 12343.0]
  - - [1024, 4096, 1, 3300, 1024, 1024, 1024, 4096]
    - [19, 12341.0]
  - - [1024, 4096, 1, 3419, 1024, 1024, 1024, 4096]
    - [16, 12346.0]
  - - [4096, 1024, 1, 4030, 4096, 4096, 4096, 1024]
    - [19, 12354.0]
  - - [4096, 1024, 1, 3976, 4096, 4096, 4096, 1024]
    - [19, 12355.0]
  - - [1024, 4096, 1, 3473, 1024, 1024, 1024, 4096]
    - [4, 12346.0]
  - - [4096, 1024, 1, 3428, 4096, 4096, 4096, 1024]
    - [16, 12339.0]
  - - [1024, 4096, 1, 3433, 1024, 1024, 1024, 4096]
    - [4, 12344.0]
  - - [4096, 1024, 1, 3534, 4096, 4096, 4096, 1024]
    - [19, 12350.0]
  - - [4096, 1024, 1, 3461, 4096, 4096, 4096, 1024]
    - [19, 12350.0]
  - - [4096, 1024, 1, 3681, 4096, 4096, 4096, 1024]
    - [4, 12343.0]
  - - [4096, 1024, 1, 3495, 4096, 4096, 4096, 1024]
    - [19, 12350.0]
  - - [4096, 1024, 1, 3351, 4096, 4096, 4096, 1024]
    - [19, 12340.0]
  - - [1024, 4096, 1, 4059, 1024, 1024, 1024, 4096]
    - [4, 12354.0]
  - - [4096, 1024, 1, 3990, 4096, 4096, 4096, 1024]
    - [27, 12347.0]
  - - [1024, 4096, 1, 3325, 1024, 1024, 1024, 4096]
    - [1, 12343.0]
  - - [1024, 4096, 1, 3408, 1024, 1024, 1024, 4096]
    - [4, 12357.0]
  - - [4096, 1024, 1, 3394, 4096, 4096, 4096, 1024]
    - [19, 12344.0]
  - - [1024, 4096, 1, 3573, 1024, 1024, 1024, 4096]
    - [4, 12351.0]
  - - [4096, 1024, 1, 3386, 4096, 4096, 4096, 1024]
    - [4, 12344.0]
  - - [4096, 1024, 1, 3540, 4096, 4096, 4096, 1024]
    - [19, 12346.0]
  - - [1024, 4096, 1, 3182, 1024, 1024, 1024, 4096]
    - [16, 12342.0]
  - - [1024, 4096, 1, 3430, 1024, 1024, 1024, 4096]
    - [16, 12346.0]
  - - [1024, 4096, 1, 3236, 1024, 1024, 1024, 4096]
    - [1, 12344.0]
  - - [4096, 1024, 1, 2977, 4096, 4096, 4096, 1024]
    - [1, 12335.0]
  - - [1024, 4096, 1, 3355, 1024, 1024, 1024, 4096]
    - [4, 12351.0]
  - - [4096, 1024, 1, 3139, 4096, 4096, 4096, 1024]
    - [16, 12343.0]
  - - [4096, 1024, 1, 3516, 4096, 4096, 4096, 1024]
    - [19, 12360.0]
  - - [4096, 1024, 1, 3368, 4096, 4096, 4096, 1024]
    - [27, 12347.0]
  - - [4096, 1024, 1, 3559, 4096, 4096, 4096, 1024]
    - [35, 12342.0]
  - - [1024, 4096, 1, 3506, 1024, 1024, 1024, 4096]
    - [16, 12351.0]
  - - [1024, 4096, 1, 3145, 1024, 1024, 1024, 4096]
    - [16, 12343.0]
  - - [1024, 4096, 1, 3369, 1024, 1024, 1024, 4096]
    - [19, 12347.0]
  - - [4096, 1024, 1, 3522, 4096, 4096, 4096, 1024]
    - [19, 12347.0]
  - - [1024, 33708, 1, 3894, 1024, 1024, 1024, 33708]
    - [4, 12731.0]
  - - [4096, 1024, 1, 3336, 4096, 4096, 4096, 1024]
    - [19, 12344.0]
  - - [1024, 4096, 1, 3382, 1024, 1024, 1024, 4096]
    - [4, 12348.0]
  - - [4096, 1024, 1, 3533, 4096, 4096, 4096, 1024]
    - [19, 12343.0]
  - - [4096, 1024, 1, 4050, 4096, 4096, 4096, 1024]
    - [19, 12364.0]
  - - [4096, 1024, 1, 3480, 4096, 4096, 4096, 1024]
    - [19, 12343.0]
  - - [1024, 4096, 1, 3344, 1024, 1024, 1024, 4096]
    - [16, 12349.0]
  - - [1024, 4096, 1, 3509, 1024, 1024, 1024, 4096]
    - [4, 12347.0]
  - - [1024, 4096, 1, 3956, 1024, 1024, 1024, 4096]
    - [4, 12352.0]
  - - [4096, 1024, 1, 3616, 4096, 4096, 4096, 1024]
    - [19, 12353.0]
  - - [1024, 4096, 1, 3366, 1024, 1024, 1024, 4096]
    - [4, 12341.0]
  - - [4096, 1024, 1, 2935, 4096, 4096, 4096, 1024]
    - [16, 12335.0]
  - - [4096, 1024, 1, 3393, 4096, 4096, 4096, 1024]
    - [19, 12349.0]
  - - [4096, 1024, 1, 3547, 4096, 4096, 4096, 1024]
    - [1, 12344.0]
  - - [1024, 4096, 1, 3499, 1024, 1024, 1024, 4096]
    - [4, 12345.0]
  - - [4096, 1024, 1, 3357, 4096, 4096, 4096, 1024]
    - [19, 12342.0]
  - - [4096, 1024, 1, 3272, 4096, 4096, 4096, 1024]
    - [1, 12342.0]
  - - [4096, 1024, 1, 3207, 4096, 4096, 4096, 1024]
    - [4, 12338.0]
  - - [4096, 1024, 1, 3894, 4096, 4096, 4096, 1024]
    - [4, 12349.0]
  - - [1024, 4096, 1, 3444, 1024, 1024, 1024, 4096]
    - [16, 12345.0]
  - - [4096, 1024, 1, 3561, 4096, 4096, 4096, 1024]
    - [19, 12347.0]
  - - [4096, 1024, 1, 3376, 4096, 4096, 4096, 1024]
    - [4, 12346.0]
  - - [1024, 4096, 1, 3458, 1024, 1024, 1024, 4096]
    - [19, 12349.0]
  - - [4096, 1024, 1, 3231, 4096, 4096, 4096, 1024]
    - [19, 12335.0]
  - - [1024, 4096, 1, 3505, 1024, 1024, 1024, 4096]
    - [4, 12345.0]
  - - [4096, 1024, 1, 3277, 4096, 4096, 4096, 1024]
    - [19, 12336.0]
  - - [1024, 4096, 1, 3391, 1024, 1024, 1024, 4096]
    - [16, 12342.0]
  - - [1024, 4096, 1, 3536, 1024, 1024, 1024, 4096]
    - [16, 12355.0]
  - - [1024, 4096, 1, 3063, 1024, 1024, 1024, 4096]
    - [1, 12335.0]
  - - [1024, 4096, 1, 3189, 1024, 1024, 1024, 4096]
    - [16, 12338.0]
  - - [1024, 4096, 1, 2505, 1024, 1024, 1024, 4096]
    - [1, 12321.0]
  - - [4096, 1024, 1, 3454, 4096, 4096, 4096, 1024]
    - [19, 12348.0]
  - - [1024, 4096, 1, 3405, 1024, 1024, 1024, 4096]
    - [4, 12342.0]
  - - [1024, 33708, 1, 4050, 1024, 1024, 1024, 33708]
    - [4, 12730.0]
  - - [4096, 1024, 1, 3520, 4096, 4096, 4096, 1024]
    - [19, 12350.0]
  - - [1024, 4096, 1, 3487, 1024, 1024, 1024, 4096]
    - [4, 12343.0]
  - - [1024, 4096, 1, 3558, 1024, 1024, 1024, 4096]
    - [19, 12344.0]
  - - [4096, 1024, 1, 3297, 4096, 4096, 4096, 1024]
    - [19, 12338.0]
  - - [1024, 4096, 1, 3483, 1024, 1024, 1024, 4096]
    - [16, 12344.0]
  - - [1024, 33708, 1, 3751, 1024, 1024, 1024, 33708]
    - [19, 12730.0]
  - - [4096, 1024, 1, 3380, 4096, 4096, 4096, 1024]
    - [19, 12347.0]
  - - [1024, 4096, 1, 3380, 1024, 1024, 1024, 4096]
    - [4, 12343.0]
  - - [1024, 4096, 1, 3396, 1024, 1024, 1024, 4096]
    - [4, 12347.0]
  - - [1024, 4096, 1, 3497, 1024, 1024, 1024, 4096]
    - [4, 12351.0]
  - - [1024, 4096, 1, 3502, 1024, 1024, 1024, 4096]
    - [16, 12346.0]
  - - [1024, 4096, 1, 3138, 1024, 1024, 1024, 4096]
    - [19, 12340.0]
  - - [4096, 1024, 1, 3939, 4096, 4096, 4096, 1024]
    - [19, 12354.0]
  - - [1024, 4096, 1, 3303, 1024, 1024, 1024, 4096]
    - [19, 12342.0]
  - - [1024, 4096, 1, 3418, 1024, 1024, 1024, 4096]
    - [4, 12345.0]
  - - [1024, 4096, 1, 3224, 1024, 1024, 1024, 4096]
    - [19, 12348.0]
  - - [4096, 1024, 1, 3978, 4096, 4096, 4096, 1024]
    - [4, 12350.0]
  - - [1024, 4096, 1, 3472, 1024, 1024, 1024, 4096]
    - [4, 12349.0]
  - - [4096, 1024, 1, 3353, 4096, 4096, 4096, 1024]
    - [19, 12340.0]
  - - [4096, 1024, 1, 3362, 4096, 4096, 4096, 1024]
    - [19, 12343.0]
  - - [1024, 33708, 1, 3978, 1024, 1024, 1024, 33708]
    - [19, 12731.0]
  - - [1024, 4096, 1, 3432, 1024, 1024, 1024, 4096]
    - [16, 12346.0]
  - - [1024, 4096, 1, 3139, 1024, 1024, 1024, 4096]
    - [4, 12346.0]
  - - [1024, 4096, 1, 3341, 1024, 1024, 1024, 4096]
    - [12, 12342.0]
  - - [1024, 4096, 1, 3494, 1024, 1024, 1024, 4096]
    - [19, 12347.0]
  - - [1024, 4096, 1, 3969, 1024, 1024, 1024, 4096]
    - [4, 12355.0]
  - - [1024, 4096, 1, 3163, 1024, 1024, 1024, 4096]
    - [16, 12338.0]
  - - [4096, 1024, 1, 3405, 4096, 4096, 4096, 1024]
    - [4, 12344.0]
  - - [4096, 1024, 1, 3453, 4096, 4096, 4096, 1024]
    - [35, 12352.0]
  - - [1024, 4096, 1, 3411, 1024, 1024, 1024, 4096]
    - [19, 12346.0]
  - - [1024, 4096, 1, 3527, 1024, 1024, 1024, 4096]
    - [4, 12346.0]
  - - [4096, 1024, 1, 3474, 4096, 4096, 4096, 1024]
    - [19, 12344.0]
  - - [1024, 4096, 1, 3572, 1024, 1024, 1024, 4096]
    - [16, 12346.0]
  - - [4096, 1024, 1, 3293, 4096, 4096, 4096, 1024]
    - [19, 12338.0]
  - - [4096, 1024, 1, 3247, 4096, 4096, 4096, 1024]
    - [12, 12339.0]
  - - [1024, 4096, 1, 3425, 1024, 1024, 1024, 4096]
    - [4, 12343.0]
  - - [1024, 4096, 1, 3354, 1024, 1024, 1024, 4096]
    - [4, 12342.0]
  - - [4096, 1024, 1, 3382, 4096, 4096, 4096, 1024]
    - [19, 12344.0]
  - - [4096, 1024, 1, 3236, 4096, 4096, 4096, 1024]
    - [35, 12348.0]
  - - [1024, 4096, 1, 3519, 1024, 1024, 1024, 4096]
    - [4, 12345.0]
  - - [4096, 1024, 1, 3354, 4096, 4096, 4096, 1024]
    - [19, 12340.0]
  - - [4096, 1024, 1, 3501, 4096, 4096, 4096, 1024]
    - [19, 12343.0]
  - - [4096, 1024, 1, 3266, 4096, 4096, 4096, 1024]
    - [1, 12337.0]
  - - [1024, 4096, 1, 3368, 1024, 1024, 1024, 4096]
    - [16, 12352.0]
  - - [1024, 4096, 1, 4030, 1024, 1024, 1024, 4096]
    - [19, 12356.0]
  - - [1024, 4096, 1, 3533, 1024, 1024, 1024, 4096]
    - [4, 12347.0]
  - - [4096, 1024, 1, 3332, 4096, 4096, 4096, 1024]
    - [4, 12340.0]
  - - [4096, 1024, 1, 3584, 4096, 4096, 4096, 1024]
    - [4, 12349.0]
  - - [1024, 4096, 1, 3616, 1024, 1024, 1024, 4096]
    - [4, 12358.0]
  - - [4096, 1024, 1, 3265, 4096, 4096, 4096, 1024]
    - [19, 12346.0]
  - - [4096, 1024, 1, 3361, 4096, 4096, 4096, 1024]
    - [35, 12356.0]
  - - [4096, 1024, 1, 3467, 4096, 4096, 4096, 1024]
    - [1, 12341.0]
  - - [1024, 4096, 1, 3454, 1024, 1024, 1024, 4096]
    - [4, 12348.0]
  - - [1024, 4096, 1, 3101, 1024, 1024, 1024, 4096]
    - [19, 12338.0]
  - - [1024, 4096, 1, 3508, 1024, 1024, 1024, 4096]
    - [4, 12354.0]
  - - [4096, 1024, 1, 3267, 4096, 4096, 4096, 1024]
    - [19, 12342.0]
  - - [4096, 1024, 1, 3419, 4096, 4096, 4096, 1024]
    - [16, 12343.0]
  - - [4096, 1024, 1, 3822, 4096, 4096, 4096, 1024]
    - [4, 12345.0]
  - - [1024, 4096, 1, 3266, 1024, 1024, 1024, 4096]
    - [4, 12342.0]
  - - [4096, 1024, 1, 3440, 4096, 4096, 4096, 1024]
    - [4, 12347.0]
  - - [1024, 4096, 1, 3361, 1024, 1024, 1024, 4096]
    - [4, 12346.0]
  - - [1024, 4096, 1, 3546, 1024, 1024, 1024, 4096]
    - [4, 12346.0]
  - - [4096, 1024, 1, 3473, 4096, 4096, 4096, 1024]
    - [19, 12349.0]
  - - [4096, 1024, 1, 3546, 4096, 4096, 4096, 1024]
    - [4, 12345.0]
  - - [1024, 4096, 1, 3088, 1024, 1024, 1024, 4096]
    - [16, 12342.0]
  - - [1024, 4096, 1, 3535, 1024, 1024, 1024, 4096]
    - [4, 12350.0]
  - - [1024, 4096, 1, 3447, 1024, 1024, 1024, 4096]
    - [1, 12347.0]
  - - [1024, 4096, 1, 3560, 1024, 1024, 1024, 4096]
    - [4, 12347.0]
  - - [1024, 4096, 1, 3422, 1024, 1024, 1024, 4096]
    - [16, 12342.0]
  - - [1024, 4096, 1, 3469, 1024, 1024, 1024, 4096]
    - [19, 12347.0]
  - - [4096, 1024, 1, 3488, 4096, 4096, 4096, 1024]
    - [19, 12354.0]
  - - [1024, 4096, 1, 3110, 1024, 1024, 1024, 4096]
    - [4, 12335.0]
  - - [1024, 4096, 1, 3265, 1024, 1024, 1024, 4096]
    - [16, 12345.0]
  - - [1024, 4096, 1, 3291, 1024, 1024, 1024, 4096]
    - [16, 12339.0]
  - - [1024, 4096, 1, 3390, 1024, 1024, 1024, 4096]
    - [4, 12348.0]
  - - [4096, 1024, 1, 3046, 4096, 4096, 4096, 1024]
    - [16, 12335.0]
  - - [1024, 4096, 1, 3539, 1024, 1024, 1024, 4096]
    - [16, 12344.0]
  - - [4096, 1024, 1, 3221, 4096, 4096, 4096, 1024]
    - [19, 12336.0]
  - - [4096, 1024, 1, 3433, 4096, 4096, 4096, 1024]
    - [4, 12341.0]
  - - [4096, 1024, 1, 3364, 4096, 4096, 4096, 1024]
    - [35, 12351.0]
  - - [4096, 1024, 1, 3470, 4096, 4096, 4096, 1024]
    - [4, 12342.0]
  - - [1024, 4096, 1, 3404, 1024, 1024, 1024, 4096]
    - [16, 12340.0]
  - - [1024, 33708, 1, 3968, 1024, 1024, 1024, 33708]
    - [19, 12737.0]
  - - [4096, 1024, 1, 3088, 4096, 4096, 4096, 1024]
    - [16, 12352.0]
  - - [1024, 4096, 1, 3247, 1024, 1024, 1024, 4096]
    - [4, 12343.0]
  - - [1024, 33708, 1, 3996, 1024, 1024, 1024, 33708]
    - [4, 12731.0]
  - - [4096, 1024, 1, 3482, 4096, 4096, 4096, 1024]
    - [19, 12341.0]
  - - [4096, 1024, 1, 3995, 4096, 4096, 4096, 1024]
    - [19, 12354.0]
  - - [1024, 4096, 1, 3280, 1024, 1024, 1024, 4096]
    - [4, 12346.0]
  - - [4096, 1024, 1, 3271, 4096, 4096, 4096, 1024]
    - [19, 12347.0]
  - - [4096, 1024, 1, 3545, 4096, 4096, 4096, 1024]
    - [4, 12347.0]
  - - [4096, 1024, 1, 3476, 4096, 4096, 4096, 1024]
    - [19, 12344.0]
  - - [4096, 1024, 1, 3496, 4096, 4096, 4096, 1024]
    - [1, 12340.0]
  - - [4096, 1024, 1, 3191, 4096, 4096, 4096, 1024]
    - [19, 12342.0]
  - - [4096, 1024, 1, 3311, 4096, 4096, 4096, 1024]
    - [19, 12340.0]
  - - [1024, 4096, 1, 3302, 1024, 1024, 1024, 4096]
    - [16, 12342.0]
  - - [1024, 4096, 1, 3681, 1024, 1024, 1024, 4096]
    - [4, 12350.0]
  - - [4096, 1024, 1, 3582, 4096, 4096, 4096, 1024]
    - [19, 12341.0]
  - - [4096, 1024, 1, 3421, 4096, 4096, 4096, 1024]
    - [1, 12344.0]
  - - [4096, 1024, 1, 3560, 4096, 4096, 4096, 1024]
    - [16, 12347.0]
  - - [1024, 4096, 1, 3495, 1024, 1024, 1024, 4096]
    - [19, 12343.0]
  - - [4096, 1024, 1, 3186, 4096, 4096, 4096, 1024]
    - [16, 12338.0]
  - - [4096, 1024, 1, 3925, 4096, 4096, 4096, 1024]
    - [19, 12353.0]
  - - [1024, 4096, 1, 3435, 1024, 1024, 1024, 4096]
    - [16, 12343.0]
  - - [4096, 1024, 1, 3434, 4096, 4096, 4096, 1024]
    - [16, 12342.0]
  - - [1024, 33708, 1, 4012, 1024, 1024, 1024, 33708]
    - [19, 12729.0]
  - - [1024, 4096, 1, 3340, 1024, 1024, 1024, 4096]
    - [16, 12338.0]
  - - [4096, 1024, 1, 3489, 4096, 4096, 4096, 1024]
    - [4, 12341.0]
  - - [1024, 4096, 1, 3162, 1024, 1024, 1024, 4096]
    - [16, 12338.0]
  - - [4096, 1024, 1, 3436, 4096, 4096, 4096, 1024]
    - [19, 12336.0]
  - - [4096, 1024, 1, 3574, 4096, 4096, 4096, 1024]
    - [19, 12348.0]
  - - [4096, 1024, 1, 3469, 4096, 4096, 4096, 1024]
    - [19, 12345.0]
  - - [1024, 4096, 1, 3410, 1024, 1024, 1024, 4096]
    - [4, 12348.0]
  - - [1024, 4096, 1, 3216, 1024, 1024, 1024, 4096]
    - [16, 12356.0]
  - - [4096, 1024, 1, 3095, 4096, 4096, 4096, 1024]
    - [16, 12341.0]
  - - [4096, 1024, 1, 3448, 4096, 4096, 4096, 1024]
    - [19, 12345.0]
  - - [1024, 4096, 1, 3176, 1024, 1024, 1024, 4096]
    - [16, 12341.0]
  - - [4096, 1024, 1, 2918, 4096, 4096, 4096, 1024]
    - [16, 12332.0]
  - - [1024, 4096, 1, 3424, 1024, 1024, 1024, 4096]
    - [4, 12350.0]
  - - [4096, 1024, 1, 3402, 4096, 4096, 4096, 1024]
    - [4, 12339.0]
  - - [4096, 1024, 1, 3145, 4096, 4096, 4096, 1024]
    - [19, 12351.0]
  - - [1024, 33708, 1, 3976, 1024, 1024, 1024, 33708]
    - [4, 12731.0]
  - - [4096, 1024, 1, 3518, 4096, 4096, 4096, 1024]
    - [19, 12347.0]
  - - [4096, 1024, 1, 3110, 4096, 4096, 4096, 1024]
    - [27, 12339.0]
  - - [4096, 1024, 1, 3325, 4096, 4096, 4096, 1024]
    - [35, 12350.0]
  - - [1024, 33708, 1, 3999, 1024, 1024, 1024, 33708]
    - [19, 12732.0]
  - - [4096, 1024, 1, 2985, 4096, 4096, 4096, 1024]
    - [16, 12335.0]
  - - [1024, 4096, 1, 3371, 1024, 1024, 1024, 4096]
    - [4, 12344.0]
  - - [4096, 1024, 1, 3342, 4096, 4096, 4096, 1024]
    - [19, 12345.0]
  - - [4096, 1024, 1, 3141, 4096, 4096, 4096, 1024]
    - [4, 12338.0]
  - - [4096, 1024, 1, 3532, 4096, 4096, 4096, 1024]
    - [19, 12341.0]
  - - [1024, 4096, 1, 3169, 1024, 1024, 1024, 4096]
    - [4, 12344.0]
  - - [1024, 4096, 1, 3514, 1024, 1024, 1024, 4096]
    - [16, 12345.0]
  - - [4096, 1024, 1, 3780, 4096, 4096, 4096, 1024]
    - [19, 12351.0]
  - - [1024, 4096, 1, 3098, 1024, 1024, 1024, 4096]
    - [16, 12339.0]
  - - [1024, 4096, 1, 3449, 1024, 1024, 1024, 4096]
    - [19, 12344.0]
  - - [1024, 4096, 1, 3222, 1024, 1024, 1024, 4096]
    - [16, 12340.0]
  - - [1024, 4096, 1, 3346, 1024, 1024, 1024, 4096]
    - [4, 12357.0]
  - - [4096, 1024, 1, 3064, 4096, 4096, 4096, 1024]
    - [1, 12342.0]
  - - [4096, 1024, 1, 3511, 4096, 4096, 4096, 1024]
    - [19, 12356.0]
  - - [4096, 1024, 1, 3384, 4096, 4096, 4096, 1024]
    - [16, 12346.0]
  - - [4096, 1024, 1, 3356, 4096, 4096, 4096, 1024]
    - [27, 12343.0]
  - - [1024, 4096, 1, 3796, 1024, 1024, 1024, 4096]
    - [4, 12348.0]
  - - [4096, 1024, 1, 3427, 4096, 4096, 4096, 1024]
    - [19, 12343.0]
  - - [4096, 1024, 1, 3390, 4096, 4096, 4096, 1024]
    - [19, 12342.0]
  - - [4096, 1024, 1, 3573, 4096, 4096, 4096, 1024]
    - [4, 12347.0]
  - - [4096, 1024, 1, 3456, 4096, 4096, 4096, 1024]
    - [19, 12351.0]
  - - [1024, 4096, 1, 3360, 1024, 1024, 1024, 4096]
    - [19, 12351.0]
  - - [1024, 33708, 1, 3977, 1024, 1024, 1024, 33708]
    - [4, 12732.0]
  - - [1024, 4096, 1, 2918, 1024, 1024, 1024, 4096]
    - [1, 12331.0]
  - - [4096, 1024, 1, 3975, 4096, 4096, 4096, 1024]
    - [19, 12350.0]
  - - [4096, 1024, 1, 3525, 4096, 4096, 4096, 1024]
    - [19, 12349.0]
  - - [4096, 1024, 1, 3398, 4096, 4096, 4096, 1024]
    - [16, 12343.0]
  - - [4096, 1024, 1, 3640, 4096, 4096, 4096, 1024]
    - [19, 12357.0]
  - - [4096, 1024, 1, 3014, 4096, 4096, 4096, 1024]
    - [16, 12337.0]
  - - [1024, 4096, 1, 3446, 1024, 1024, 1024, 4096]
    - [19, 12343.0]
  - - [1024, 33708, 1, 3796, 1024, 1024, 1024, 33708]
    - [4, 12729.0]
  - - [4096, 1024, 1, 3101, 4096, 4096, 4096, 1024]
    - [16, 12340.0]
  - - [4096, 1024, 1, 3563, 4096, 4096, 4096, 1024]
    - [19, 12348.0]
  - - [4096, 1024, 1, 3539, 4096, 4096, 4096, 1024]
    - [19, 12348.0]
  - - [4096, 1024, 1, 3182, 4096, 4096, 4096, 1024]
    - [16, 12338.0]
  - - [1024, 4096, 1, 3468, 1024, 1024, 1024, 4096]
    - [16, 12344.0]
  - - [4096, 1024, 1, 3312, 4096, 4096, 4096, 1024]
    - [19, 12346.0]
  - - [4096, 1024, 1, 3215, 4096, 4096, 4096, 1024]
    - [19, 12338.0]
  - - [4096, 1024, 1, 3910, 4096, 4096, 4096, 1024]
    - [19, 12355.0]
  - - [1024, 33708, 1, 3780, 1024, 1024, 1024, 33708]
    - [19, 12732.0]
  - - [1024, 4096, 1, 3290, 1024, 1024, 1024, 4096]
    - [19, 12350.0]
  - - [1024, 4096, 1, 4012, 1024, 1024, 1024, 4096]
    - [4, 12354.0]
  - - [1024, 4096, 1, 3385, 1024, 1024, 1024, 4096]
    - [4, 12342.0]
  - - [1024, 33708, 1, 3975, 1024, 1024, 1024, 33708]
    - [4, 12731.0]
  - - [4096, 1024, 1, 3996, 4096, 4096, 4096, 1024]
    - [19, 12350.0]
  - - [4096, 1024, 1, 2765, 4096, 4096, 4096, 1024]
    - [16, 12324.0]
  - - [4096, 1024, 1, 3538, 4096, 4096, 4096, 1024]
    - [19, 12355.0]
  - - [4096, 1024, 1, 3415, 4096, 4096, 4096, 1024]
    - [19, 12352.0]
  - - [1024, 4096, 1, 3554, 1024, 1024, 1024, 4096]
    - [19, 12351.0]
  - - [4096, 1024, 1, 3513, 4096, 4096, 4096, 1024]
    - [16, 12343.0]
  - - [1024, 4096, 1, 3304, 1024, 1024, 1024, 4096]
    - [4, 12346.0]
  - - [4096, 1024, 1, 3294, 4096, 4096, 4096, 1024]
    - [16, 12340.0]
  - - [4096, 1024, 1, 3396, 4096, 4096, 4096, 1024]
    - [1, 12344.0]
  - - [1024, 4096, 1, 3213, 1024, 1024, 1024, 4096]
    - [19, 12336.0]
  - - [4096, 1024, 1, 3137, 4096, 4096, 4096, 1024]
    - [16, 12342.0]
  - - [4096, 1024, 1, 3552, 4096, 4096, 4096, 1024]
    - [19, 12369.0]
  - - [1024, 4096, 1, 3461, 1024, 1024, 1024, 4096]
    - [19, 12344.0]
  - - [4096, 1024, 1, 3263, 4096, 4096, 4096, 1024]
    - [16, 12341.0]
  - - [4096, 1024, 1, 3430, 4096, 4096, 4096, 1024]
    - [19, 12344.0]
  - - [4096, 1024, 1, 3389, 4096, 4096, 4096, 1024]
    - [16, 12343.0]
  - - [4096, 1024, 1, 3528, 4096, 4096, 4096, 1024]
    - [1, 12345.0]
  - - [1024, 4096, 1, 3463, 1024, 1024, 1024, 4096]
    - [4, 12344.0]
  - - [4096, 1024, 1, 3526, 4096, 4096, 4096, 1024]
    - [19, 12347.0]
  - - [4096, 1024, 1, 3154, 4096, 4096, 4096, 1024]
    - [16, 12342.0]
  - - [4096, 1024, 1, 3499, 4096, 4096, 4096, 1024]
    - [19, 12351.0]
  - - [4096, 1024, 1, 3955, 4096, 4096, 4096, 1024]
    - [19, 12352.0]
  - - [1024, 4096, 1, 3297, 1024, 1024, 1024, 4096]
    - [4, 12338.0]
  - - [1024, 4096, 1, 3233, 1024, 1024, 1024, 4096]
    - [16, 12343.0]
  - - [1024, 4096, 1, 3226, 1024, 1024, 1024, 4096]
    - [27, 12344.0]
  - - [4096, 1024, 1, 3404, 4096, 4096, 4096, 1024]
    - [19, 12341.0]
  - - [4096, 1024, 1, 3355, 4096, 4096, 4096, 1024]
    - [1, 12339.0]
  - - [1024, 4096, 1, 3542, 1024, 1024, 1024, 4096]
    - [4, 12349.0]
  - - [4096, 1024, 1, 3181, 4096, 4096, 4096, 1024]
    - [16, 12339.0]
  - - [1024, 4096, 1, 3474, 1024, 1024, 1024, 4096]
    - [19, 12349.0]
  - - [4096, 1024, 1, 3319, 4096, 4096, 4096, 1024]
    - [4, 12340.0]
  - - [1024, 4096, 1, 3434, 1024, 1024, 1024, 4096]
    - [4, 12344.0]
  - - [1024, 4096, 1, 3860, 1024, 1024, 1024, 4096]
    - [4, 12350.0]
  - - [1024, 4096, 1, 3343, 1024, 1024, 1024, 4096]
    - [4, 12343.0]
  - - [1024, 4096, 1, 3488, 1024, 1024, 1024, 4096]
    - [19, 12352.0]
  - - [1024, 4096, 1, 3046, 1024, 1024, 1024, 4096]
    - [16, 12337.0]
  - - [1024, 4096, 1, 3141, 1024, 1024, 1024, 4096]
    - [19, 12334.0]
  - - [1024, 4096, 1, 3516, 1024, 1024, 1024, 4096]
    - [1, 12344.0]
  - - [4096, 1024, 1, 3147, 4096, 4096, 4096, 1024]
    - [16, 12345.0]
  - - [1024, 4096, 1, 3421, 1024, 1024, 1024, 4096]
    - [4, 12343.0]
  - - [4096, 1024, 1, 3944, 4096, 4096, 4096, 1024]
    - [19, 12350.0]
  - - [1024, 4096, 1, 3574, 1024, 1024, 1024, 4096]
    - [4, 12349.0]
  - - [1024, 4096, 1, 3977, 1024, 1024, 1024, 4096]
    - [19, 12358.0]
  - - [1024, 4096, 1, 2985, 1024, 1024, 1024, 4096]
    - [1, 12341.0]
  - - [1024, 4096, 1, 3427, 1024, 1024, 1024, 4096]
    - [27, 12350.0]
  - - [1024, 4096, 1, 3482, 1024, 1024, 1024, 4096]
    - [1, 12347.0]
  - - [1024, 4096, 1, 3332, 1024, 1024, 1024, 4096]
    - [4, 12343.0]
  - - [4096, 1024, 1, 3308, 4096, 4096, 4096, 1024]
    - [19, 12342.0]
  - - [1024, 4096, 1, 3513, 1024, 1024, 1024, 4096]
    - [4, 12345.0]
  - - [1024, 4096, 1, 3154, 1024, 1024, 1024, 4096]
    - [4, 12351.0]
  - - [1024, 4096, 1, 3955, 1024, 1024, 1024, 4096]
    - [4, 12356.0]
  - - [1024, 4096, 1, 2967, 1024, 1024, 1024, 4096]
    - [1, 12336.0]
  - - [1024, 33708, 1, 3942, 1024, 1024, 1024, 33708]
    - [19, 12731.0]
  - - [1024, 4096, 1, 3319, 1024, 1024, 1024, 4096]
    - [4, 12343.0]
  - - [4096, 1024, 1, 3860, 4096, 4096, 4096, 1024]
    - [19, 12351.0]
  - - [1024, 4096, 1, 3548, 1024, 1024, 1024, 4096]
    - [4, 12349.0]
  - - [4096, 1024, 1, 3977, 4096, 4096, 4096, 1024]
    - [19, 12352.0]
  - - [4096, 1024, 1, 3535, 4096, 4096, 4096, 1024]
    - [19, 12342.0]
  - - [1024, 4096, 1, 3541, 1024, 1024, 1024, 4096]
    - [4, 12344.0]
  - - [1024, 33708, 1, 3584, 1024, 1024, 1024, 33708]
    - [4, 12731.0]
  - - [1024, 4096, 1, 3168, 1024, 1024, 1024, 4096]
    - [16, 12343.0]
  - - [1024, 4096, 1, 3448, 1024, 1024, 1024, 4096]
    - [4, 12348.0]
  - - [4096, 1024, 1, 3343, 4096, 4096, 4096, 1024]
    - [16, 12339.0]
  - - [1024, 4096, 1, 3357, 1024, 1024, 1024, 4096]
    - [19, 12339.0]
  - - [4096, 1024, 1, 3510, 4096, 4096, 4096, 1024]
    - [19, 12348.0]
  - - [4096, 1024, 1, 3369, 4096, 4096, 4096, 1024]
    - [19, 12342.0]
  - - [4096, 1024, 1, 3379, 4096, 4096, 4096, 1024]
    - [19, 12343.0]
  - - [1024, 4096, 1, 3276, 1024, 1024, 1024, 4096]
    - [4, 12340.0]
  - - [1024, 4096, 1, 3363, 1024, 1024, 1024, 4096]
    - [16, 12350.0]
  - - [4096, 1024, 1, 3055, 4096, 4096, 4096, 1024]
    - [1, 12339.0]
  - - [1024, 4096, 1, 3524, 1024, 1024, 1024, 4096]
    - [19, 12345.0]
  - - [4096, 1024, 1, 3057, 4096, 4096, 4096, 1024]
    - [16, 12343.0]
  - - [1024, 33708, 1, 3720, 1024, 1024, 1024, 33708]
    - [19, 12728.0]
  - - [1024, 4096, 1, 3383, 1024, 1024, 1024, 4096]
    - [16, 12344.0]
  - - [1024, 4096, 1, 3522, 1024, 1024, 1024, 4096]
    - [19, 12354.0]
  - - [1024, 33708, 1, 3956, 1024, 1024, 1024, 33708]
    - [4, 12731.0]
  - - [1024, 4096, 1, 3481, 1024, 1024, 1024, 4096]
    - [19, 12348.0]
  - - [4096, 1024, 1, 3562, 4096, 4096, 4096, 1024]
    - [19, 12347.0]
  - - [4096, 1024, 1, 3299, 4096, 4096, 4096, 1024]
    - [35, 12354.0]
  - - [1024, 4096, 1, 3262, 1024, 1024, 1024, 4096]
    - [4, 12344.0]
  - - [1024, 33708, 1, 4026, 1024, 1024, 1024, 33708]
    - [4, 12734.0]
  - - [4096, 1024, 1, 3168, 4096, 4096, 4096, 1024]
    - [16, 12348.0]
  - - [1024, 4096, 1, 3999, 1024, 1024, 1024, 4096]
    - [19, 12350.0]
  - - [1024, 4096, 1, 3549, 1024, 1024, 1024, 4096]
    - [19, 12353.0]
  - - [4096, 1024, 1, 3375, 4096, 4096, 4096, 1024]
    - [19, 12345.0]
  - - [1024, 4096, 1, 3496, 1024, 1024, 1024, 4096]
    - [16, 12349.0]
  - - [1024, 4096, 1, 3190, 1024, 1024, 1024, 4096]
    - [16, 12341.0]
  - - [4096, 1024, 1, 3273, 4096, 4096, 4096, 1024]
    - [4, 12339.0]
  - - [1024, 4096, 1, 3406, 1024, 1024, 1024, 4096]
    - [4, 12342.0]
  - - [4096, 1024, 1, 4005, 4096, 4096, 4096, 1024]
    - [4, 12353.0]
  - - [4096, 1024, 1, 3555, 4096, 4096, 4096, 1024]
    - [19, 12351.0]
  - - [4096, 1024, 1, 2505, 4096, 4096, 4096, 1024]
    - [35, 12332.0]
  - - [1024, 4096, 1, 3460, 1024, 1024, 1024, 4096]
    - [19, 12346.0]
  - - [1024, 4096, 1, 3579, 1024, 1024, 1024, 4096]
    - [4, 12347.0]
  - - [1024, 33708, 1, 4030, 1024, 1024, 1024, 33708]
    - [4, 12734.0]
  - - [1024, 4096, 1, 3510, 1024, 1024, 1024, 4096]
    - [4, 12349.0]
  - - [1024, 4096, 1, 3282, 1024, 1024, 1024, 4096]
    - [1, 12347.0]
  - - [1024, 4096, 1, 3377, 1024, 1024, 1024, 4096]
    - [4, 12362.0]
  - - [1024, 4096, 1, 2935, 1024, 1024, 1024, 4096]
    - [1, 12333.0]
  - - [1024, 4096, 1, 3498, 1024, 1024, 1024, 4096]
    - [16, 12348.0]
  - - [1024, 4096, 1, 3593, 1024, 1024, 1024, 4096]
    - [16, 12347.0]
  - - [4096, 1024, 1, 3226, 4096, 4096, 4096, 1024]
    - [16, 12341.0]
  - - [1024, 4096, 1, 2499, 1024, 1024, 1024, 4096]
    - [16, 12325.0]
  - - [1024, 4096, 1, 3296, 1024, 1024, 1024, 4096]
    - [19, 12351.0]
  - - [1024, 4096, 1, 3455, 1024, 1024, 1024, 4096]
    - [4, 12355.0]
  - - [1024, 4096, 1, 3399, 1024, 1024, 1024, 4096]
    - [12, 12351.0]
  - - [1024, 4096, 1, 3205, 1024, 1024, 1024, 4096]
    - [16, 12352.0]
  - - [4096, 1024, 1, 4026, 4096, 4096, 4096, 1024]
    - [19, 12356.0]
  - - [1024, 4096, 1, 3484, 1024, 1024, 1024, 4096]
    - [16, 12353.0]
  - - [4096, 1024, 1, 3302, 4096, 4096, 4096, 1024]
    - [19, 12346.0]
  - - [1024, 4096, 1, 3485, 1024, 1024, 1024, 4096]
    - [4, 12347.0]
  - - [1024, 4096, 1, 3126, 1024, 1024, 1024, 4096]
    - [4, 12344.0]
  - - [1024, 4096, 1, 4050, 1024, 1024, 1024, 4096]
    - [19, 12355.0]
  - - [4096, 1024, 1, 3235, 4096, 4096, 4096, 1024]
    - [19, 12345.0]
  - - [1024, 33708, 1, 3955, 1024, 1024, 1024, 33708]
    - [4, 12733.0]
  - - [1024, 4096, 1, 3342, 1024, 1024, 1024, 4096]
    - [4, 12344.0]
  - - [1024, 4096, 1, 3397, 1024, 1024, 1024, 4096]
    - [4, 12347.0]
  - - [4096, 1024, 1, 3491, 4096, 4096, 4096, 1024]
    - [19, 12349.0]
  - - [1024, 4096, 1, 3503, 1024, 1024, 1024, 4096]
    - [4, 12340.0]
  - - [1024, 4096, 1, 3140, 1024, 1024, 1024, 4096]
    - [19, 12345.0]
  - - [4096, 1024, 1, 3121, 4096, 4096, 4096, 1024]
    - [4, 12334.0]
  - - [4096, 1024, 1, 3276, 4096, 4096, 4096, 1024]
    - [19, 12340.0]
  - - [1024, 4096, 1, 3321, 1024, 1024, 1024, 4096]
    - [4, 12346.0]
  - - [1024, 4096, 1, 3870, 1024, 1024, 1024, 4096]
    - [19, 12346.0]
  - - [4096, 1024, 1, 3475, 4096, 4096, 4096, 1024]
    - [19, 12346.0]
  - - [1024, 4096, 1, 2984, 1024, 1024, 1024, 4096]
    - [16, 12339.0]
  - - [4096, 1024, 1, 3363, 4096, 4096, 4096, 1024]
    - [4, 12345.0]
  - - [1024, 4096, 1, 3582, 1024, 1024, 1024, 4096]
    - [16, 12347.0]
  - - [4096, 1024, 1, 3509, 4096, 4096, 4096, 1024]
    - [19, 12352.0]
  - - [1024, 4096, 1, 3426, 1024, 1024, 1024, 4096]
    - [4, 12345.0]
  - - [4096, 1024, 1, 3136, 4096, 4096, 4096, 1024]
    - [16, 12355.0]
  - - [1024, 4096, 1, 3232, 1024, 1024, 1024, 4096]
    - [4, 12348.0]
  - - [4096, 1024, 1, 3103, 4096, 4096, 4096, 1024]
    - [16, 12341.0]
  - - [1024, 4096, 1, 3335, 1024, 1024, 1024, 4096]
    - [19, 12344.0]
  - - [1024, 4096, 1, 3900, 1024, 1024, 1024, 4096]
    - [19, 12352.0]
  - - [4096, 1024, 1, 3512, 4096, 4096, 4096, 1024]
    - [19, 12348.0]
  - - [4096, 1024, 1, 3222, 4096, 4096, 4096, 1024]
    - [19, 12341.0]
  - - [1024, 4096, 1, 3165, 1024, 1024, 1024, 4096]
    - [19, 12343.0]
  - - [4096, 1024, 1, 3408, 4096, 4096, 4096, 1024]
    - [4, 12346.0]
  - - [4096, 1024, 1, 3751, 4096, 4096, 4096, 1024]
    - [19, 12349.0]
  - - [1024, 4096, 1, 3318, 1024, 1024, 1024, 4096]
    - [19, 12339.0]
  - - [4096, 1024, 1, 3442, 4096, 4096, 4096, 1024]
    - [19, 12343.0]
  - - [1024, 4096, 1, 3413, 1024, 1024, 1024, 4096]
    - [4, 12346.0]
  - - [4096, 1024, 1, 3524, 4096, 4096, 4096, 1024]
    - [19, 12345.0]
  - - [1024, 4096, 1, 3976, 1024, 1024, 1024, 4096]
    - [19, 12353.0]
  - - [1024, 4096, 1, 3475, 1024, 1024, 1024, 4096]
    - [4, 12347.0]
  - - [1024, 4096, 1, 3534, 1024, 1024, 1024, 4096]
    - [19, 12346.0]
  - - [4096, 1024, 1, 3301, 4096, 4096, 4096, 1024]
    - [19, 12342.0]
  - - [4096, 1024, 1, 3248, 4096, 4096, 4096, 1024]
    - [12, 12352.0]
  - - [1024, 4096, 1, 2977, 1024, 1024, 1024, 4096]
    - [16, 12332.0]
  - - [4096, 1024, 1, 3346, 4096, 4096, 4096, 1024]
    - [16, 12342.0]
  - - [1024, 4096, 1, 3451, 1024, 1024, 1024, 4096]
    - [16, 12353.0]
  - - [1024, 4096, 1, 3257, 1024, 1024, 1024, 4096]
    - [16, 12341.0]
  - - [1024, 4096, 1, 3356, 1024, 1024, 1024, 4096]
    - [19, 12346.0]
  - - [4096, 1024, 1, 3348, 4096, 4096, 4096, 1024]
    - [16, 12341.0]
  - - [4096, 1024, 1, 3335, 4096, 4096, 4096, 1024]
    - [4, 12343.0]
  - - [4096, 1024, 1, 3505, 4096, 4096, 4096, 1024]
    - [19, 12348.0]
  - - [1024, 4096, 1, 3490, 1024, 1024, 1024, 4096]
    - [4, 12348.0]
  - - [4096, 1024, 1, 3447, 4096, 4096, 4096, 1024]
    - [19, 12350.0]
  - - [1024, 4096, 1, 3267, 1024, 1024, 1024, 4096]
    - [4, 12341.0]
  - - [4096, 1024, 1, 3230, 4096, 4096, 4096, 1024]
    - [19, 12344.0]
  - - [4096, 1024, 1, 3455, 4096, 4096, 4096, 1024]
    - [19, 12345.0]
  - - [1024, 4096, 1, 3925, 1024, 1024, 1024, 4096]
    - [4, 12356.0]
  - - [1024, 4096, 1, 3362, 1024, 1024, 1024, 4096]
    - [4, 12346.0]
  - - [4096, 1024, 1, 3969, 4096, 4096, 4096, 1024]
    - [19, 12355.0]
  - - [4096, 1024, 1, 3527, 4096, 4096, 4096, 1024]
    - [19, 12350.0]
  - - [1024, 4096, 1, 3585, 1024, 1024, 1024, 4096]
    - [19, 12348.0]
  - - [4096, 1024, 1, 3063, 4096, 4096, 4096, 1024]
    - [16, 12340.0]
  - - [4096, 1024, 1, 3435, 4096, 4096, 4096, 1024]
    - [4, 12345.0]
  - - [4096, 1024, 1, 3366, 4096, 4096, 4096, 1024]
    - [19, 12344.0]
  - - [4096, 1024, 1, 3581, 4096, 4096, 4096, 1024]
    - [19, 12360.0]
  - - [1024, 33708, 1, 3906, 1024, 1024, 1024, 33708]
    - [4, 12730.0]
  - - [1024, 4096, 1, 3464, 1024, 1024, 1024, 4096]
    - [16, 12349.0]
  - - [1024, 4096, 1, 3440, 1024, 1024, 1024, 4096]
    - [4, 12351.0]
  - - [4096, 1024, 1, 3143, 4096, 4096, 4096, 1024]
    - [16, 12333.0]
  - - [1024, 4096, 1, 3349, 1024, 1024, 1024, 4096]
    - [4, 12342.0]
  - - [4096, 1024, 1, 3416, 4096, 4096, 4096, 1024]
    - [19, 12347.0]
  - - [4096, 1024, 1, 3365, 4096, 4096, 4096, 1024]
    - [16, 12346.0]
  - - [1024, 4096, 1, 3470, 1024, 1024, 1024, 4096]
    - [19, 12346.0]
  - - [4096, 1024, 1, 3287, 4096, 4096, 4096, 1024]
    - [19, 12339.0]
  - - [1024, 4096, 1, 3441, 1024, 1024, 1024, 4096]
    - [19, 12348.0]
  - - [4096, 1024, 1, 3224, 4096, 4096, 4096, 1024]
    - [16, 12343.0]
  - - [1024, 4096, 1, 3387, 1024, 1024, 1024, 4096]
    - [4, 12342.0]
  - - [1024, 4096, 1, 3547, 1024, 1024, 1024, 4096]
    - [19, 12349.0]
  - - [4096, 1024, 1, 3478, 4096, 4096, 4096, 1024]
    - [4, 12344.0]
  - - [4096, 1024, 1, 3548, 4096, 4096, 4096, 1024]
    - [19, 12344.0]
  - - [1024, 33708, 1, 4020, 1024, 1024, 1024, 33708]
    - [4, 12731.0]
  - - [4096, 1024, 1, 3320, 4096, 4096, 4096, 1024]
    - [16, 12345.0]
  - - [1024, 4096, 1, 3906, 1024, 1024, 1024, 4096]
    - [4, 12353.0]
  - - [4096, 1024, 1, 3796, 4096, 4096, 4096, 1024]
    - [4, 12345.0]
  - - [1024, 4096, 1, 3306, 1024, 1024, 1024, 4096]
    - [4, 12336.0]
  - - [1024, 4096, 1, 3401, 1024, 1024, 1024, 4096]
    - [16, 12342.0]
  - - [1024, 4096, 1, 3215, 1024, 1024, 1024, 4096]
    - [16, 12336.0]
  - - [4096, 1024, 1, 4012, 4096, 4096, 4096, 1024]
    - [19, 12355.0]
  - - [1024, 4096, 1, 2765, 1024, 1024, 1024, 4096]
    - [19, 12326.0]
  - - [4096, 1024, 1, 3554, 4096, 4096, 4096, 1024]
    - [19, 12339.0]
  - - [4096, 1024, 1, 3423, 4096, 4096, 4096, 1024]
    - [19, 12341.0]
  - - [1024, 4096, 1, 3562, 1024, 1024, 1024, 4096]
    - [19, 12341.0]
  - - [1024, 4096, 1, 3489, 1024, 1024, 1024, 4096]
    - [16, 12341.0]
  - - [4096, 1024, 1, 3358, 4096, 4096, 4096, 1024]
    - [19, 12342.0]
  - - [4096, 1024, 1, 3270, 4096, 4096, 4096, 1024]
    - [16, 12346.0]
  - - [1024, 4096, 1, 3293, 1024, 1024, 1024, 4096]
    - [1, 12337.0]
  - - [1024, 4096, 1, 3376, 1024, 1024, 1024, 4096]
    - [1, 12348.0]
  - - [4096, 1024, 1, 3245, 4096, 4096, 4096, 1024]
    - [4, 12339.0]
  - - [4096, 1024, 1, 3541, 4096, 4096, 4096, 1024]
    - [19, 12344.0]
  - - [4096, 1024, 1, 3443, 4096, 4096, 4096, 1024]
    - [27, 12350.0]
  - - [4096, 1024, 1, 3438, 4096, 4096, 4096, 1024]
    - [1, 12340.0]
  - - [4096, 1024, 1, 3244, 4096, 4096, 4096, 1024]
    - [35, 12353.0]
  - - [1024, 4096, 1, 3365, 1024, 1024, 1024, 4096]
    - [19, 12344.0]
  - - [1024, 4096, 1, 3299, 1024, 1024, 1024, 4096]
    - [16, 12339.0]
  - - [1024, 4096, 1, 3471, 1024, 1024, 1024, 4096]
    - [4, 12344.0]
  - - [1024, 4096, 1, 3398, 1024, 1024, 1024, 4096]
    - [16, 12343.0]
  - - [4096, 1024, 1, 3162, 4096, 4096, 4096, 1024]
    - [19, 12343.0]
  - - [1024, 4096, 1, 4005, 1024, 1024, 1024, 4096]
    - [19, 12358.0]
  - - [4096, 1024, 1, 3579, 4096, 4096, 4096, 1024]
    - [19, 12351.0]
  - - [1024, 4096, 1, 3121, 1024, 1024, 1024, 4096]
    - [4, 12336.0]
  - - [4096, 1024, 1, 3441, 4096, 4096, 4096, 1024]
    - [19, 12347.0]
  - - [4096, 1024, 1, 3422, 4096, 4096, 4096, 1024]
    - [12, 12346.0]
  - - [4096, 1024, 1, 3444, 4096, 4096, 4096, 1024]
    - [27, 12349.0]
  - - [1024, 4096, 1, 3337, 1024, 1024, 1024, 4096]
    - [4, 12343.0]
  - - [4096, 1024, 1, 3550, 4096, 4096, 4096, 1024]
    - [19, 12348.0]
  - - [1024, 4096, 1, 3477, 1024, 1024, 1024, 4096]
    - [16, 12346.0]
  - - [4096, 1024, 1, 3490, 4096, 4096, 4096, 1024]
    - [19, 12347.0]
  - - [4096, 1024, 1, 3585, 4096, 4096, 4096, 1024]
    - [4, 12343.0]
  - - [1024, 4096, 1, 3143, 1024, 1024, 1024, 4096]
    - [16, 12338.0]
  - - [1024, 33708, 1, 3876, 1024, 1024, 1024, 33708]
    - [4, 12733.0]
  - - [1024, 4096, 1, 3320, 1024, 1024, 1024, 4096]
    - [16, 12345.0]
  - - [1024, 4096, 1, 3423, 1024, 1024, 1024, 4096]
    - [16, 12360.0]
  - - [1024, 4096, 1, 3894, 1024, 1024, 1024, 4096]
    - [19, 12357.0]
  - - [4096, 1024, 1, 3410, 4096, 4096, 4096, 1024]
    - [19, 12344.0]
  - - [1024, 4096, 1, 3561, 1024, 1024, 1024, 4096]
    - [4, 12344.0]
  - - [4096, 1024, 1, 3492, 4096, 4096, 4096, 1024]
    - [19, 12345.0]
  - - [36548, 1024, 1, 3712, 36548, 36548, 36548, 1024]
    - [35, 12722.0]
  - - [4096, 2048, 1, 128, 4096, 4096, 4096, 2048]
    - [30, 11561.0]
  - - [4096, 3072, 1, 128, 4096, 4096, 4096, 3072]
    - [4, 11874.0]
  - - [768, 3072, 1, 4096, 768, 768, 768, 3072]
    - [15, 11543.0]
  - - [768, 30522, 1, 1280, 768, 768, 768, 30522]
    - [19, 12665.0]
  - - [768, 30522, 1, 320, 768, 768, 768, 30522]
    - [35, 12437.0]
  - - [768, 30522, 1, 640, 768, 768, 768, 30522]
    - [19, 12587.0]
  - - [256, 512, 36, 98, 256, 256, 256, 512]
    - [30, 10958.0]
  - - [256, 256, 64, 56, 256, 256, 256, 256]
    - [0, 10448.0]
  - - [512, 486, 36, 800, 512, 512, 512, 486]
    - [31, 11749.0]
  - - [512, 512, 36, 1568, 512, 512, 512, 512]
    - [35, 12582.0]
  - - [256, 384, 36, 4096, 256, 256, 256, 384]
    - [35, 12257.0]
  - - [128, 256, 64, 32, 128, 128, 128, 256]
    - [15, 5301.0]
  - - [128, 256, 64, 9, 128, 128, 128, 256]
    - [36, 1884.0]
  - - [256, 512, 36, 784, 256, 256, 256, 512]
    - [39, 11881.0]
  - - [256, 324, 36, 32, 256, 256, 256, 324]
    - [0, 6017.0]
  - - [512, 512, 36, 33, 512, 512, 512, 512]
    - [0, 7577.0]
  - - [192, 384, 64, 128, 192, 192, 192, 384]
    - [15, 8294.0]
  - - [512, 512, 64, 72, 512, 512, 512, 512]
    - [15, 11689.0]
  - - [512, 512, 36, 128, 512, 512, 512, 512]
    - [43, 11748.0]
  - - [192, 384, 64, 2304, 192, 192, 192, 384]
    - [4, 9076.0]
  - - [384, 256, 64, 450, 384, 384, 384, 256]
    - [0, 11798.0]
  - - [384, 256, 64, 2304, 384, 384, 384, 256]
    - [4, 12132.0]
  - - [512, 512, 64, 144, 512, 512, 512, 512]
    - [36, 11968.0]
  - - [256, 256, 36, 6272, 256, 256, 256, 256]
    - [18, 11550.0]
  - - [256, 384, 64, 2304, 256, 256, 256, 384]
    - [19, 12122.0]
  - - [512, 512, 36, 66, 512, 512, 512, 512]
    - [23, 10832.0]
  - - [128, 256, 64, 800, 128, 128, 128, 256]
    - [3, 11435.0]
  - - [192, 256, 36, 512, 192, 192, 192, 256]
    - [30, 8410.0]
  - - [256, 512, 64, 200, 256, 256, 256, 512]
    - [31, 11879.0]
  - - [256, 512, 64, 25, 256, 256, 256, 512]
    - [15, 5575.0]
  - - [128, 256, 36, 1568, 128, 128, 128, 256]
    - [36, 10831.0]
  - - [128, 256, 64, 288, 128, 128, 128, 256]
    - [15, 11239.0]
  - - [256, 384, 64, 1152, 256, 256, 256, 384]
    - [4, 12054.0]
  - - [160, 320, 64, 288, 160, 160, 160, 320]
    - [15, 7179.0]
  - - [128, 256, 36, 128, 128, 128, 128, 256]
    - [5, 9497.0]
  - - [512, 512, 36, 16, 512, 512, 512, 512]
    - [29, 4108.0]
  - - [384, 256, 36, 800, 384, 384, 384, 256]
    - [20, 11992.0]
  - - [192, 384, 36, 4096, 192, 192, 192, 384]
    - [19, 9168.0]
  - - [256, 384, 64, 576, 256, 256, 256, 384]
    - [0, 11932.0]
  - - [512, 512, 64, 14, 512, 512, 512, 512]
    - [0, 3873.0]
  - - [512, 512, 36, 8, 512, 512, 512, 512]
    - [8, 1943.0]
  - - [512, 486, 64, 128, 512, 512, 512, 486]
    - [0, 11185.0]
  - - [256, 256, 36, 128, 256, 256, 256, 256]
    - [15, 10732.0]
  - - [256, 256, 36, 32, 256, 256, 256, 256]
    - [15, 6826.0]
  - - [192, 256, 64, 288, 192, 192, 192, 256]
    - [5, 8710.0]
  - - [256, 256, 36, 16, 256, 256, 256, 256]
    - [0, 3637.0]
  - - [128, 256, 36, 3200, 128, 128, 128, 256]
    - [20, 10887.0]
  - - [160, 320, 64, 512, 160, 160, 160, 320]
    - [18, 7369.0]
  - - [160, 320, 36, 512, 160, 160, 160, 320]
    - [3, 7213.0]
  - - [256, 512, 36, 4, 256, 256, 256, 512]
    - [12, 1008.0]
  - - [256, 324, 64, 1568, 256, 256, 256, 324]
    - [19, 10171.0]
  - - [256, 256, 36, 3200, 256, 256, 256, 256]
    - [3, 11513.0]
  - - [256, 256, 36, 210, 256, 256, 256, 256]
    - [15, 10884.0]
  - - [192, 384, 64, 576, 192, 192, 192, 384]
    - [30, 8883.0]
  - - [512, 512, 64, 800, 512, 512, 512, 512]
    - [4, 12511.0]
  - - [256, 256, 64, 1152, 256, 256, 256, 256]
    - [4, 12168.0]
  - - [512, 486, 64, 512, 512, 512, 512, 486]
    - [16, 11684.0]
  - - [256, 512, 64, 1600, 256, 256, 256, 512]
    - [19, 12455.0]
  - - [512, 512, 64, 9, 512, 512, 512, 512]
    - [0, 2479.0]
  - - [256, 512, 36, 1568, 256, 256, 256, 512]
    - [4, 12013.0]
  - - [128, 256, 64, 3200, 128, 128, 128, 256]
    - [3, 11714.0]
  - - [256, 512, 64, 4, 256, 256, 256, 512]
    - [0, 1078.0]
  - - [256, 256, 64, 450, 256, 256, 256, 256]
    - [9, 11884.0]
  - - [256, 256, 64, 72, 256, 256, 256, 256]
    - [30, 10413.0]
  - - [128, 256, 36, 3136, 128, 128, 128, 256]
    - [43, 10862.0]
  - - [160, 320, 64, 242, 160, 160, 160, 320]
    - [15, 7131.0]
  - - [512, 512, 36, 512, 512, 512, 512, 512]
    - [4, 12391.0]
  - - [512, 512, 36, 256, 512, 512, 512, 512]
    - [40, 12157.0]
  - - [512, 512, 36, 1024, 512, 512, 512, 512]
    - [4, 12545.0]
  - - [256, 256, 36, 4096, 256, 256, 256, 256]
    - [34, 11527.0]
  - - [256, 256, 64, 896, 256, 256, 256, 256]
    - [4, 12115.0]
  - - [128, 256, 64, 242, 128, 128, 128, 256]
    - [30, 11023.0]
  - - [192, 384, 36, 1024, 192, 192, 192, 384]
    - [5, 9016.0]
  - - [128, 256, 64, 100, 128, 128, 128, 256]
    - [30, 9763.0]
  - - [384, 256, 64, 1152, 384, 384, 384, 256]
    - [35, 12059.0]
  - - [192, 384, 36, 128, 192, 192, 192, 384]
    - [30, 7960.0]
  - - [128, 256, 64, 1568, 128, 128, 128, 256]
    - [3, 11558.0]
  - - [128, 256, 64, 72, 128, 128, 128, 256]
    - [23, 9085.0]
  - - [256, 256, 36, 12544, 256, 256, 256, 256]
    - [3, 11558.0]
  - - [256, 256, 36, 105, 256, 256, 256, 256]
    - [30, 10120.0]
  - - [128, 256, 36, 392, 128, 128, 128, 256]
    - [5, 10364.0]
  - - [384, 256, 36, 1024, 384, 384, 384, 256]
    - [4, 12073.0]
  - - [128, 256, 64, 1152, 128, 128, 128, 256]
    - [3, 11487.0]
  - - [256, 324, 64, 32, 256, 256, 256, 324]
    - [0, 7031.0]
  - - [256, 384, 36, 800, 256, 256, 256, 384]
    - [19, 12047.0]
  - - [512, 512, 64, 4, 512, 512, 512, 512]
    - [28, 1214.0]
  - - [192, 320, 36, 128, 192, 192, 192, 320]
    - [30, 7685.0]
  - - [192, 384, 64, 242, 192, 192, 192, 384]
    - [15, 8690.0]
  - - [256, 486, 64, 32, 256, 256, 256, 486]
    - [0, 7145.0]
  - - [512, 512, 64, 64, 512, 512, 512, 512]
    - [0, 11585.0]
  - - [128, 256, 36, 512, 128, 128, 128, 256]
    - [5, 10578.0]
  - - [512, 512, 64, 576, 512, 512, 512, 512]
    - [4, 12457.0]
  - - [256, 256, 64, 9, 256, 256, 256, 256]
    - [4, 2582.0]
  - - [128, 256, 36, 12544, 128, 128, 128, 256]
    - [37, 11044.0]
  - - [256, 512, 36, 3136, 256, 256, 256, 512]
    - [35, 12083.0]
  - - [144, 288, 36, 512, 144, 144, 144, 288]
    - [0, 5894.0]
  - - [384, 384, 36, 800, 384, 384, 384, 384]
    - [4, 11854.0]
  - - [512, 512, 64, 1600, 512, 512, 512, 512]
    - [19, 12565.0]
  - - [512, 512, 36, 4, 512, 512, 512, 512]
    - [0, 1042.0]
  - - [192, 384, 64, 450, 192, 192, 192, 384]
    - [15, 8830.0]
  - - [256, 256, 36, 1024, 256, 256, 256, 256]
    - [34, 11367.0]
  - - [256, 512, 64, 400, 256, 256, 256, 512]
    - [4, 12184.0]
  - - [128, 256, 36, 6272, 128, 128, 128, 256]
    - [37, 10979.0]
  - - [256, 256, 36, 512, 256, 256, 256, 256]
    - [30, 11256.0]
  - - [256, 256, 64, 112, 256, 256, 256, 256]
    - [15, 11276.0]
  - - [512, 512, 64, 18, 512, 512, 512, 512]
    - [1, 4402.0]
  - - [256, 256, 64, 18, 256, 256, 256, 256]
    - [28, 4007.0]
  - - [256, 256, 64, 1568, 256, 256, 256, 256]
    - [35, 12223.0]
  - - [384, 256, 36, 4096, 384, 384, 384, 256]
    - [4, 12263.0]
  - - [256, 512, 64, 800, 256, 256, 256, 512]
    - [4, 12365.0]
  - - [256, 384, 36, 2048, 256, 256, 256, 384]
    - [35, 12181.0]
  - - [384, 384, 64, 2304, 384, 384, 384, 384]
    - [4, 12607.0]
  - - [160, 320, 64, 128, 160, 160, 160, 320]
    - [15, 6903.0]
  - - [512, 512, 36, 528, 512, 512, 512, 512]
    - [35, 12390.0]
  - - [160, 320, 36, 128, 160, 160, 160, 320]
    - [39, 6510.0]
  - - [256, 512, 36, 49, 256, 256, 256, 512]
    - [39, 9132.0]
  - - [384, 384, 64, 450, 384, 384, 384, 384]
    - [4, 12292.0]
  - - [256, 256, 64, 3200, 256, 256, 256, 256]
    - [4, 12337.0]
  - - [512, 512, 64, 8, 512, 512, 512, 512]
    - [0, 2150.0]
  - - [512, 512, 64, 288, 512, 512, 512, 512]
    - [4, 12289.0]
  - - [384, 384, 36, 1024, 384, 384, 384, 384]
    - [4, 11904.0]
  - - [128, 256, 36, 16, 128, 128, 128, 256]
    - [8, 2477.0]
  - - [256, 256, 64, 288, 256, 256, 256, 256]
    - [1, 11852.0]
  - - [256, 384, 36, 1024, 256, 256, 256, 384]
    - [35, 12034.0]
  - - [256, 324, 36, 3200, 256, 256, 256, 324]
    - [4, 10285.0]
  - - [192, 384, 64, 512, 192, 192, 192, 384]
    - [1, 8859.0]
  - - [128, 256, 64, 1600, 128, 128, 128, 256]
    - [34, 11563.0]
  - - [512, 512, 36, 32, 512, 512, 512, 512]
    - [0, 8229.0]
  - - [512, 512, 36, 3136, 512, 512, 512, 512]
    - [19, 12624.0]
  - - [128, 256, 64, 6400, 128, 128, 128, 256]
    - [3, 11727.0]
  - - [256, 256, 36, 2048, 256, 256, 256, 256]
    - [3, 11449.0]
  - - [256, 256, 64, 6400, 256, 256, 256, 256]
    - [4, 12372.0]
  - - [256, 256, 36, 1680, 256, 256, 256, 256]
    - [3, 11421.0]
  - - [192, 384, 36, 2048, 192, 192, 192, 384]
    - [4, 9094.0]
  - - [256, 256, 64, 144, 256, 256, 256, 256]
    - [20, 11281.0]
  - - [384, 384, 36, 4096, 384, 384, 384, 384]
    - [19, 12047.0]
  - - [160, 320, 64, 1152, 160, 160, 160, 320]
    - [0, 7510.0]
  - - [384, 256, 36, 2048, 384, 384, 384, 256]
    - [4, 12184.0]
  - - [256, 512, 36, 392, 256, 256, 256, 512]
    - [15, 11758.0]
  - - [256, 512, 64, 50, 256, 256, 256, 512]
    - [32, 9763.0]
  - - [384, 384, 36, 2048, 384, 384, 384, 384]
    - [4, 11999.0]
  - - [256, 384, 64, 450, 256, 256, 256, 384]
    - [1, 11810.0]
  - - [192, 320, 64, 128, 192, 192, 192, 320]
    - [8, 8163.0]
  - - [128, 256, 36, 32, 128, 128, 128, 256]
    - [25, 5668.0]
  - - [512, 512, 64, 256, 512, 512, 512, 512]
    - [4, 12230.0]
  - - [256, 512, 64, 32, 256, 256, 256, 512]
    - [0, 7481.0]
  - - [384, 384, 64, 576, 384, 384, 384, 384]
    - [35, 12404.0]
  - - [512, 486, 36, 288, 512, 512, 512, 486]
    - [16, 11307.0]
  - - [144, 288, 64, 242, 144, 144, 144, 288]
    - [0, 5787.0]
  - - [384, 256, 64, 576, 384, 384, 384, 256]
    - [35, 11901.0]
  - - [512, 512, 36, 64, 512, 512, 512, 512]
    - [0, 11050.0]
  - - [448, 384, 64, 128, 448, 448, 448, 384]
    - [23, 10175.0]
  - - [144, 288, 64, 288, 144, 144, 144, 288]
    - [0, 5832.0]
  - - [512, 512, 64, 224, 512, 512, 512, 512]
    - [1, 12167.0]
  - - [384, 384, 64, 1152, 384, 384, 384, 384]
    - [19, 12547.0]
  - - [448, 384, 36, 128, 448, 448, 448, 384]
    - [15, 9872.0]
  - - [256, 486, 36, 128, 256, 256, 256, 486]
    - [8, 10424.0]
  - - [256, 256, 36, 800, 256, 256, 256, 256]
    - [30, 11381.0]
  - - [192, 384, 36, 800, 192, 192, 192, 384]
    - [20, 8976.0]
  - - [256, 256, 36, 256, 256, 256, 256, 256]
    - [15, 11139.0]
  - - [192, 384, 64, 1152, 192, 192, 192, 384]
    - [4, 8998.0]
  - - [128, 256, 64, 200, 128, 128, 128, 256]
    - [30, 10940.0]
  - - [512, 512, 64, 28, 512, 512, 512, 512]
    - [1, 6496.0]
  - - [144, 288, 64, 1152, 144, 144, 144, 288]
    - [3, 6081.0]
  - - [256, 256, 64, 576, 256, 256, 256, 256]
    - [36, 11992.0]
  - - [256, 256, 64, 2304, 256, 256, 256, 256]
    - [4, 12298.0]
  - - [192, 384, 36, 512, 192, 192, 192, 384]
    - [36, 8830.0]
  - - [256, 512, 36, 32, 256, 256, 256, 512]
    - [15, 6814.0]
  - - [512, 512, 64, 128, 512, 512, 512, 512]
    - [36, 11901.0]
  - - [512, 512, 64, 32, 512, 512, 512, 512]
    - [0, 8676.0]
  - - [128, 256, 36, 196, 128, 128, 128, 256]
    - [2, 9578.0]
  - - [196, 528, 32, 32, 196, 196, 196, 528]
    - [0, 3925.0]
  - - [196, 512, 32, 24, 196, 196, 196, 512]
    - [39, 3296.0]
  - - [1225, 192, 32, 32, 1225, 1225, 1225, 192]
    - [23, 7943.0]
  - - [1001, 1536, 1, 32, 1001, 1001, 1001, 1536]
    - [23, 5336.0]
  - - [196, 480, 32, 64, 196, 196, 196, 480]
    - [8, 5914.0]
  - - [289, 1024, 32, 384, 289, 289, 289, 1024]
    - [1, 9171.0]
  - - [784, 192, 32, 96, 784, 784, 784, 192]
    - [39, 9814.0]
  - - [50176, 256, 1, 128, 50176, 50176, 50176, 256]
    - [43, 11858.0]
  - - [289, 1024, 32, 256, 289, 289, 289, 1024]
    - [20, 9024.0]
  - - [289, 1024, 32, 192, 289, 289, 289, 1024]
    - [16, 8912.0]
  - - [12544, 512, 1, 256, 12544, 12544, 12544, 512]
    - [31, 11932.0]
  - - [1225, 1728, 1, 192, 1225, 1225, 1225, 1728]
    - [15, 10294.0]
  - - [196, 480, 32, 96, 196, 196, 196, 480]
    - [8, 7066.0]
  - - [196, 512, 32, 144, 196, 196, 196, 512]
    - [23, 8170.0]
  - - [289, 768, 32, 128, 289, 289, 289, 768]
    - [30, 8627.0]
  - - [5329, 576, 1, 96, 5329, 5329, 5329, 576]
    - [30, 10607.0]
  - - [196, 528, 32, 128, 196, 196, 196, 528]
    - [23, 7494.0]
  - - [5329, 448, 1, 64, 5329, 5329, 5329, 448]
    - [0, 9385.0]
  - - [784, 256, 32, 64, 784, 784, 784, 256]
    - [39, 9708.0]
  - - [784, 192, 32, 32, 784, 784, 784, 192]
    - [15, 7762.0]
  - - [21609, 288, 1, 32, 21609, 21609, 21609, 288]
    - [39, 7425.0]
  - - [784, 256, 32, 32, 784, 784, 784, 256]
    - [15, 8143.0]
  - - [5041, 720, 1, 192, 5041, 5041, 5041, 720]
    - [0, 10565.0]
  - - [196, 512, 32, 128, 196, 196, 196, 512]
    - [23, 8022.0]
  - - [289, 768, 32, 160, 289, 289, 289, 768]
    - [15, 8807.0]
  - - [1001, 4096, 1, 512, 1001, 1001, 1001, 4096]
    - [1, 11691.0]
  - - [1225, 192, 32, 64, 1225, 1225, 1225, 192]
    - [15, 10337.0]
  - - [784, 192, 32, 16, 784, 784, 784, 192]
    - [23, 4940.0]
  - - [3136, 1024, 1, 2048, 3136, 3136, 3136, 1024]
    - [1, 12144.0]
  - - [784, 256, 32, 128, 784, 784, 784, 256]
    - [36, 10097.0]
  - - [196, 512, 32, 32, 196, 196, 196, 512]
    - [0, 4127.0]
  - - [1225, 384, 32, 96, 1225, 1225, 1225, 384]
    - [8, 11036.0]
  - - [5041, 576, 1, 96, 5041, 5041, 5041, 576]
    - [30, 10705.0]
  - - [5329, 160, 32, 64, 5329, 5329, 5329, 160]
    - [0, 8122.0]
  - - [1225, 288, 32, 48, 1225, 1225, 1225, 288]
    - [30, 8193.0]
  - - [4096, 9216, 1, 512, 4096, 4096, 4096, 9216]
    - [4, 12637.0]
  - - [196, 480, 32, 192, 196, 196, 196, 480]
    - [15, 7971.0]
  - - [3136, 1024, 1, 512, 3136, 3136, 3136, 1024]
    - [5, 11689.0]
  - - [784, 192, 32, 64, 784, 784, 784, 192]
    - [0, 9474.0]
  - - [289, 1024, 32, 128, 289, 289, 289, 1024]
    - [0, 8738.0]
  - - [289, 768, 32, 192, 289, 289, 289, 768]
    - [36, 8930.0]
  - - [196, 512, 32, 112, 196, 196, 196, 512]
    - [30, 7975.0]
  - - [1001, 2048, 1, 32, 1001, 1001, 1001, 2048]
    - [23, 5953.0]
  - - [1225, 288, 32, 64, 1225, 1225, 1225, 288]
    - [8, 9132.0]
  - - [1225, 384, 32, 192, 1225, 1225, 1225, 384]
    - [1, 11452.0]
  - - [50176, 256, 1, 512, 50176, 50176, 50176, 256]
    - [4, 12309.0]
  - - [196, 512, 32, 160, 196, 196, 196, 512]
    - [39, 8303.0]
  - - [4096, 4096, 1, 512, 4096, 4096, 4096, 4096]
    - [19, 12469.0]
  - - [1225, 256, 32, 64, 1225, 1225, 1225, 256]
    - [30, 10518.0]
  - - [196, 480, 32, 16, 196, 196, 196, 480]
    - [0, 2234.0]
  - - [1225, 256, 32, 48, 1225, 1225, 1225, 256]
    - [15, 9887.0]
  - - [1225, 1200, 1, 64, 1225, 1225, 1225, 1200]
    - [30, 7408.0]
  - - [1225, 384, 32, 64, 1225, 1225, 1225, 384]
    - [8, 10704.0]
  - - [12544, 512, 1, 1024, 12544, 12544, 12544, 512]
    - [16, 12294.0]
  - - [196, 512, 32, 64, 196, 196, 196, 512]
    - [39, 6266.0]
  - - [196, 528, 32, 256, 196, 196, 196, 528]
    - [30, 7923.0]
  - - [196, 528, 32, 160, 196, 196, 196, 528]
    - [0, 7785.0]
  - - [1225, 192, 32, 48, 1225, 1225, 1225, 192]
    - [15, 9578.0]
  - - [1001, 2048, 1, 64, 1001, 1001, 1001, 2048]
    - [15, 8655.0]
  - - [289, 768, 128, 128, 289, 289, 289, 768]
    - [0, 8948.0]
  - - [1225, 192, 128, 64, 1225, 1225, 1225, 192]
    - [0, 7620.0]
  - - [1225, 288, 128, 48, 1225, 1225, 1225, 288]
    - [0, 5358.0]
  - - [289, 768, 128, 192, 289, 289, 289, 768]
    - [1, 9120.0]
  - - [289, 768, 128, 160, 289, 289, 289, 768]
    - [30, 9018.0]
  - - [1225, 256, 128, 48, 1225, 1225, 1225, 256]
    - [0, 7124.0]
  - - [1225, 192, 128, 48, 1225, 1225, 1225, 192]
    - [12, 5813.0]
  - - [1225, 288, 128, 64, 1225, 1225, 1225, 288]
    - [3, 7009.0]
  - - [1225, 256, 128, 64, 1225, 1225, 1225, 256]
    - [3, 6290.0]
  - - [1001, 2048, 1, 128, 1001, 1001, 1001, 2048]
    - [39, 9872.0]
  - - [1225, 192, 128, 32, 1225, 1225, 1225, 192]
    - [0, 5560.0]
  - - [1001, 1536, 1, 64, 1001, 1001, 1001, 1536]
    - [15, 7388.0]
  - - [1024, 4096, 1, 64, 1024, 1024, 1024, 4096]
    - [8, 10627.0]
  - - [1024, 4096, 1, 6336, 1024, 1024, 1024, 4096]
    - [4, 12382.0]
  - - [512, 33708, 1, 3780, 512, 512, 512, 33708]
    - [4, 12688.0]
  - - [512, 33708, 1, 3968, 512, 512, 512, 33708]
    - [4, 12680.0]
  - - [512, 33708, 1, 4030, 512, 512, 512, 33708]
    - [4, 12685.0]
  - - [196, 256, 64, 1024, 196, 196, 196, 256]
    - [36, 9218.0]
  - - [196, 1024, 64, 256, 196, 196, 196, 1024]
    - [30, 9127.0]
  - - [289, 768, 64, 128, 289, 289, 289, 768]
    - [0, 8846.0]
  - - [289, 768, 64, 160, 289, 289, 289, 768]
    - [0, 8940.0]
  - - [289, 768, 64, 192, 289, 289, 289, 768]
    - [5, 9017.0]
  - - [784, 128, 64, 512, 784, 784, 784, 128]
    - [20, 10468.0]
  - - [784, 512, 64, 128, 784, 784, 784, 512]
    - [5, 10515.0]
  - - [1225, 192, 64, 32, 1225, 1225, 1225, 192]
    - [30, 8156.0]
  - - [1225, 192, 64, 48, 1225, 1225, 1225, 192]
    - [30, 10088.0]
  - - [1225, 192, 64, 64, 1225, 1225, 1225, 192]
    - [30, 10723.0]
  - - [1225, 256, 64, 48, 1225, 1225, 1225, 256]
    - [0, 10096.0]
  - - [1225, 256, 64, 64, 1225, 1225, 1225, 256]
    - [0, 10546.0]
  - - [1225, 288, 64, 48, 1225, 1225, 1225, 288]
    - [0, 8170.0]
  - - [1225, 288, 64, 64, 1225, 1225, 1225, 288]
    - [0, 8943.0]
  - - [3136, 256, 64, 64, 3136, 3136, 3136, 256]
    - [0, 9240.0]
  - - [256, 44505, 1, 8976, 256, 256, 256, 44505]
    - [4, 12654.0]
  - - [512, 33708, 1, 3796, 512, 512, 512, 33708]
    - [4, 12691.0]
  - - [512, 33708, 1, 3822, 512, 512, 512, 33708]
    - [19, 12691.0]
  - - [512, 33708, 1, 3840, 512, 512, 512, 33708]
    - [35, 12687.0]
  - - [512, 33708, 1, 3859, 512, 512, 512, 33708]
    - [35, 12690.0]
  - - [512, 33708, 1, 3870, 512, 512, 512, 33708]
    - [19, 12689.0]
  - - [512, 33708, 1, 3876, 512, 512, 512, 33708]
    - [4, 12689.0]
  - - [512, 33708, 1, 3906, 512, 512, 512, 33708]
    - [4, 12691.0]
  - - [512, 33708, 1, 3910, 512, 512, 512, 33708]
    - [4, 12691.0]
  - - [512, 33708, 1, 3925, 512, 512, 512, 33708]
    - [35, 12687.0]
  - - [512, 33708, 1, 3942, 512, 512, 512, 33708]
    - [35, 12693.0]
  - - [512, 33708, 1, 3944, 512, 512, 512, 33708]
    - [4, 12693.0]
  - - [512, 33708, 1, 3955, 512, 512, 512, 33708]
    - [4, 12693.0]
  - - [512, 33708, 1, 3969, 512, 512, 512, 33708]
    - [19, 12696.0]
  - - [512, 33708, 1, 3976, 512, 512, 512, 33708]
    - [19, 12693.0]
  - - [512, 33708, 1, 3977, 512, 512, 512, 33708]
    - [35, 12691.0]
  - - [512, 33708, 1, 3978, 512, 512, 512, 33708]
    - [4, 12691.0]
  - - [512, 33708, 1, 3990, 512, 512, 512, 33708]
    - [4, 12694.0]
  - - [512, 33708, 1, 3995, 512, 512, 512, 33708]
    - [4, 12693.0]
  - - [512, 33708, 1, 3996, 512, 512, 512, 33708]
    - [4, 12691.0]
  - - [512, 33708, 1, 3999, 512, 512, 512, 33708]
    - [4, 12692.0]
  - - [512, 33708, 1, 4005, 512, 512, 512, 33708]
    - [19, 12693.0]
  - - [512, 33708, 1, 4012, 512, 512, 512, 33708]
    - [4, 12692.0]
  - - [512, 33708, 1, 4020, 512, 512, 512, 33708]
    - [4, 12690.0]
  - - [512, 33708, 1, 4026, 512, 512, 512, 33708]
    - [35, 12692.0]
  - - [512, 33708, 1, 4032, 512, 512, 512, 33708]
    - [35, 12691.0]
  - - [1024, 3072, 1, 2048, 1024, 1024, 1024, 3072]
    - [16, 11925.0]
  - - [1024, 3072, 1, 3072, 1024, 1024, 1024, 3072]
    - [1, 11986.0]
  - - [1024, 30522, 1, 20, 1024, 1024, 1024, 30522]
    - [0, 4965.0]
  - - [1024, 30522, 1, 80, 1024, 1024, 1024, 30522]
    - [23, 10833.0]
  - - [1024, 30522, 1, 120, 1024, 1024, 1024, 30522]
    - [8, 11827.0]
  - - [1024, 4096, 1, 3840, 1024, 1024, 1024, 4096]
    - [4, 12361.0]
  - - [1024, 4096, 1, 3968, 1024, 1024, 1024, 4096]
    - [4, 12359.0]
  - - [1024, 4096, 1, 7200, 1024, 1024, 1024, 4096]
    - [4, 12387.0]
  - - [1024, 4096, 1, 8160, 1024, 1024, 1024, 4096]
    - [4, 12393.0]
  - - [1024, 4096, 1, 9520, 1024, 1024, 1024, 4096]
    - [19, 12394.0]
  - - [1024, 4096, 1, 10200, 1024, 1024, 1024, 4096]
    - [35, 12393.0]
  - - [1024, 42720, 1, 3968, 1024, 1024, 1024, 42720]
    - [19, 12781.0]
  - - [1024, 42720, 1, 7200, 1024, 1024, 1024, 42720]
    - [4, 12784.0]
  - - [1024, 42720, 1, 9520, 1024, 1024, 1024, 42720]
    - [19, 12783.0]
  - - [4096, 1024, 1, 3840, 4096, 4096, 4096, 1024]
    - [4, 12354.0]
  - - [4096, 1024, 1, 3968, 4096, 4096, 4096, 1024]
    - [4, 12359.0]
  - - [4096, 1024, 1, 7200, 4096, 4096, 4096, 1024]
    - [35, 12382.0]
  - - [4096, 1024, 1, 8160, 4096, 4096, 4096, 1024]
    - [4, 12385.0]
  - - [4096, 1024, 1, 9520, 4096, 4096, 4096, 1024]
    - [35, 12391.0]
  - - [4096, 1024, 1, 10200, 4096, 4096, 4096, 1024]
    - [19, 12391.0]
  - - [5760, 5760, 1, 5760, 5760, 5760, 5760, 5760]
    - [19, 12735.0]
  - - [7744, 7744, 1, 7744, 7744, 7744, 7744, 7744]
    - [19, 12573.0]
  - - [1152, 1152, 1, 384, 1152, 1152, 1152, 1152]
    - [30, 10143.0]
  - - [1536, 1536, 1, 384, 1536, 1536, 1536, 1536]
    - [0, 11246.0]
  - - [1920, 1920, 1, 384, 1920, 1920, 1920, 1920]
    - [30, 11601.0]
  - - [2304, 2304, 1, 384, 2304, 2304, 2304, 2304]
    - [15, 11748.0]
  - - [2688, 2688, 1, 384, 2688, 2688, 2688, 2688]
    - [31, 11929.0]
  - - [3072, 3072, 1, 384, 3072, 3072, 3072, 3072]
    - [19, 12374.0]
  - - [3456, 3456, 1, 384, 3456, 3456, 3456, 3456]
    - [4, 12370.0]
  - - [3840, 3840, 1, 384, 3840, 3840, 3840, 3840]
    - [4, 12563.0]
  - - [4224, 4224, 1, 384, 4224, 4224, 4224, 4224]
    - [35, 12478.0]
  - - [4608, 4608, 1, 384, 4608, 4608, 4608, 4608]
    - [4, 12570.0]
  - - [4992, 4992, 1, 384, 4992, 4992, 4992, 4992]
    - [19, 12502.0]
  - - [5376, 5376, 1, 384, 5376, 5376, 5376, 5376]
    - [35, 12555.0]
  - - [5760, 5760, 1, 384, 5760, 5760, 5760, 5760]
    - [19, 12597.0]
  - - [6144, 6144, 1, 384, 6144, 6144, 6144, 6144]
    - [19, 12604.0]
  - - [6528, 6528, 1, 384, 6528, 6528, 6528, 6528]
    - [19, 12617.0]
  - - [6912, 6912, 1, 384, 6912, 6912, 6912, 6912]
    - [4, 12678.0]
  - - [7296, 7296, 1, 384, 7296, 7296, 7296, 7296]
    - [19, 12674.0]
  - - [7680, 7680, 1, 384, 7680, 7680, 7680, 7680]
    - [35, 12706.0]
  - - [1536, 768, 1, 384, 1536, 1536, 1536, 768]
    - [20, 10239.0]
  - - [1920, 960, 1, 384, 1920, 1920, 1920, 960]
    - [15, 10896.0]
  - - [2304, 1152, 1, 384, 2304, 2304, 2304, 1152]
    - [15, 11225.0]
  - - [2688, 1344, 1, 384, 2688, 2688, 2688, 1344]
    - [15, 11467.0]
  - - [3072, 1536, 1, 384, 3072, 3072, 3072, 1536]
    - [30, 11793.0]
  - - [3456, 1728, 1, 384, 3456, 3456, 3456, 1728]
    - [15, 11810.0]
  - - [3840, 1920, 1, 384, 3840, 3840, 3840, 1920]
    - [4, 12138.0]
  - - [4224, 2112, 1, 384, 4224, 4224, 4224, 2112]
    - [30, 11935.0]
  - - [4608, 2304, 1, 384, 4608, 4608, 4608, 2304]
    - [4, 12287.0]
  - - [4992, 2496, 1, 384, 4992, 4992, 4992, 2496]
    - [4, 12124.0]
  - - [5376, 2688, 1, 384, 5376, 5376, 5376, 2688]
    - [4, 12350.0]
  - - [5760, 2880, 1, 384, 5760, 5760, 5760, 2880]
    - [4, 12234.0]
  - - [6144, 3072, 1, 384, 6144, 6144, 6144, 3072]
    - [27, 12495.0]
  - - [6528, 3264, 1, 384, 6528, 6528, 6528, 3264]
    - [4, 12242.0]
  - - [6912, 3456, 1, 384, 6912, 6912, 6912, 3456]
    - [35, 12601.0]
  - - [7296, 3648, 1, 384, 7296, 7296, 7296, 3648]
    - [19, 12362.0]
  - - [7680, 3840, 1, 384, 7680, 7680, 7680, 3840]
    - [4, 12643.0]
  - - [768, 1536, 1, 384, 768, 768, 768, 1536]
    - [20, 10290.0]
  - - [1152, 2304, 1, 384, 1152, 1152, 1152, 2304]
    - [15, 11227.0]
  - - [1536, 3072, 1, 384, 1536, 1536, 1536, 3072]
    - [15, 11815.0]
  - - [1920, 3840, 1, 384, 1920, 1920, 1920, 3840]
    - [4, 12155.0]
  - - [2304, 4608, 1, 384, 2304, 2304, 2304, 4608]
    - [19, 12298.0]
  - - [2688, 5376, 1, 384, 2688, 2688, 2688, 5376]
    - [4, 12364.0]
  - - [3072, 6144, 1, 384, 3072, 3072, 3072, 6144]
    - [12, 12495.0]
  - - [3456, 6912, 1, 384, 3456, 3456, 3456, 6912]
    - [19, 12610.0]
  - - [3840, 7680, 1, 384, 3840, 3840, 3840, 7680]
    - [4, 12644.0]
  - - [4224, 8448, 1, 384, 4224, 4224, 4224, 8448]
    - [4, 12664.0]
  - - [4608, 9216, 1, 384, 4608, 4608, 4608, 9216]
    - [35, 12653.0]
  - - [4992, 9984, 1, 384, 4992, 4992, 4992, 9984]
    - [35, 12651.0]
  - - [5376, 10752, 1, 384, 5376, 5376, 5376, 10752]
    - [19, 12666.0]
  - - [5760, 11520, 1, 384, 5760, 5760, 5760, 11520]
    - [35, 12695.0]
  - - [6144, 12288, 1, 384, 6144, 6144, 6144, 12288]
    - [4, 12694.0]
  - - [6528, 13056, 1, 384, 6528, 6528, 6528, 13056]
    - [4, 12700.0]
  - - [6912, 13824, 1, 384, 6912, 6912, 6912, 13824]
    - [4, 12715.0]
  - - [7296, 14592, 1, 384, 7296, 7296, 7296, 14592]
    - [4, 12736.0]
  - - [7680, 15360, 1, 384, 7680, 7680, 7680, 15360]
    - [19, 12734.0]
  - - [2048, 2048, 1, 1024, 2048, 2048, 2048, 2048]
    - [1, 12196.0]
  - - [256, 10240, 1, 8976, 256, 256, 256, 10240]
    - [37, 12454.0]
  - - [256, 10496, 1, 8976, 256, 256, 256, 10496]
    - [3, 11645.0]
  - - [256, 11008, 1, 8976, 256, 256, 256, 11008]
    - [19, 11920.0]
  - - [256, 11264, 1, 8976, 256, 256, 256, 11264]
    - [35, 12187.0]
  - - [256, 11520, 1, 8976, 256, 256, 256, 11520]
    - [4, 12429.0]
  - - [256, 11776, 1, 8976, 256, 256, 256, 11776]
    - [18, 11713.0]
  - - [256, 12544, 1, 8976, 256, 256, 256, 12544]
    - [37, 12271.0]
  - - [256, 12800, 1, 8976, 256, 256, 256, 12800]
    - [37, 12514.0]
  - - [256, 13312, 1, 8976, 256, 256, 256, 13312]
    - [3, 11959.0]
  - - [256, 13568, 1, 8976, 256, 256, 256, 13568]
    - [4, 12089.0]
  - - [256, 14336, 1, 8976, 256, 256, 256, 14336]
    - [3, 11814.0]
  - - [256, 14848, 1, 8976, 256, 256, 256, 14848]
    - [21, 12160.0]
  - - [256, 15104, 1, 8976, 256, 256, 256, 15104]
    - [37, 12357.0]
  - - [256, 15872, 1, 8976, 256, 256, 256, 15872]
    - [35, 12021.0]
  - - [256, 16128, 1, 8976, 256, 256, 256, 16128]
    - [4, 12206.0]
  - - [256, 17152, 1, 8976, 256, 256, 256, 17152]
    - [3, 12085.0]
  - - [256, 17408, 1, 8976, 256, 256, 256, 17408]
    - [4, 12251.0]
  - - [256, 18688, 1, 8976, 256, 256, 256, 18688]
    - [4, 12294.0]
  - - [256, 19968, 1, 8976, 256, 256, 256, 19968]
    - [4, 12322.0]
  - - [256, 20480, 1, 8976, 256, 256, 256, 20480]
    - [4, 12623.0]
  - - [256, 20992, 1, 8976, 256, 256, 256, 20992]
    - [4, 12217.0]
  - - [256, 21248, 1, 8976, 256, 256, 256, 21248]
    - [4, 12358.0]
  - - [256, 22016, 1, 8976, 256, 256, 256, 22016]
    - [4, 12119.0]
  - - [256, 26112, 1, 8976, 256, 256, 256, 26112]
    - [4, 12339.0]
  - - [256, 32512, 1, 8976, 256, 256, 256, 32512]
    - [4, 12439.0]
  - - [256, 33536, 1, 8976, 256, 256, 256, 33536]
    - [4, 12364.0]
  - - [256, 4864, 1, 8976, 256, 256, 256, 4864]
    - [21, 11612.0]
  - - [256, 5120, 1, 8976, 256, 256, 256, 5120]
    - [21, 12192.0]
  - - [256, 5632, 1, 8976, 256, 256, 256, 5632]
    - [18, 11523.0]
  - - [256, 5888, 1, 8976, 256, 256, 256, 5888]
    - [5, 11290.0]
  - - [256, 6144, 1, 8976, 256, 256, 256, 6144]
    - [20, 11753.0]
  - - [256, 7168, 1, 8976, 256, 256, 256, 7168]
    - [21, 11568.0]
  - - [256, 8192, 1, 8976, 256, 256, 256, 8192]
    - [18, 11761.0]
  - - [256, 8960, 1, 8976, 256, 256, 256, 8960]
    - [4, 12330.0]
  - - [256, 9728, 1, 8976, 256, 256, 256, 9728]
    - [21, 11865.0]
  - - [256, 9984, 1, 8976, 256, 256, 256, 9984]
    - [6, 12164.0]
  - - [3200, 2048, 1, 1024, 3200, 3200, 3200, 2048]
    - [1, 12536.0]
  - - [4096, 4096, 1, 1024, 4096, 4096, 4096, 4096]
    - [19, 12542.0]
  - - [512, 3280, 1, 1600, 512, 512, 512, 3280]
    - [30, 10963.0]
  - - [512, 3280, 1, 200, 512, 512, 512, 3280]
    - [39, 9890.0]
  - - [768, 2048, 1, 256, 768, 768, 768, 2048]
    - [20, 10960.0]
  - - [1600, 1024, 1, 960, 1600, 1600, 1600, 1024]
    - [0, 10668.0]
  - - [2048, 2048, 1, 960, 2048, 2048, 2048, 2048]
    - [4, 12219.0]
  - - [1024, 3072, 1, 1024, 1024, 1024, 1024, 3072]
    - [4, 11850.0]
  - - [1024, 3072, 1, 512, 1024, 1024, 1024, 3072]
    - [5, 11680.0]
  - - [1024, 4096, 1, 2048, 1024, 1024, 1024, 4096]
    - [4, 12338.0]
  - - [1024, 30528, 1, 2048, 1024, 1024, 1024, 30528]
    - [35, 12713.0]
  - - [1024, 4096, 1, 4096, 1024, 1024, 1024, 4096]
    - [4, 12367.0]
  - - [1024, 30528, 1, 4096, 1024, 1024, 1024, 30528]
    - [35, 12737.0]
  - - [9216, 128, 1, 128, 9216, 9216, 9216, 128]
    - [8, 8966.0]
  - - [9600, 128, 1, 128, 9600, 9600, 9600, 128]
    - [0, 9770.0]
  - - [9984, 128, 1, 128, 9984, 9984, 9984, 128]
    - [0, 9974.0]
  - - [10368, 128, 1, 128, 10368, 10368, 10368, 128]
    - [0, 9458.0]
  - - [10752, 128, 1, 128, 10752, 10752, 10752, 128]
    - [0, 9743.0]
  - - [11136, 128, 1, 128, 11136, 11136, 11136, 128]
    - [3, 9664.0]
  - - [11520, 128, 1, 128, 11520, 11520, 11520, 128]
    - [15, 9841.0]
  - - [11904, 128, 1, 128, 11904, 11904, 11904, 128]
    - [36, 10053.0]
  - - [12288, 128, 1, 128, 12288, 12288, 12288, 128]
    - [13, 10117.0]
  - - [12672, 128, 1, 128, 12672, 12672, 12672, 128]
    - [5, 10507.0]
  - - [13056, 128, 1, 128, 13056, 13056, 13056, 128]
    - [0, 10090.0]
  - - [13440, 128, 1, 128, 13440, 13440, 13440, 128]
    - [15, 10367.0]
  - - [13824, 128, 1, 128, 13824, 13824, 13824, 128]
    - [0, 10457.0]
  - - [14208, 128, 1, 128, 14208, 14208, 14208, 128]
    - [36, 10237.0]
  - - [14592, 128, 1, 128, 14592, 14592, 14592, 128]
    - [0, 10332.0]
  - - [14976, 128, 1, 128, 14976, 14976, 14976, 128]
    - [36, 10724.0]
  - - [15360, 128, 1, 128, 15360, 15360, 15360, 128]
    - [8, 10691.0]
  - - [15744, 128, 1, 128, 15744, 15744, 15744, 128]
    - [15, 10477.0]
  - - [16128, 128, 1, 128, 16128, 16128, 16128, 128]
    - [0, 10612.0]
  - - [16512, 128, 1, 128, 16512, 16512, 16512, 128]
    - [39, 10735.0]
  - - [16896, 128, 1, 128, 16896, 16896, 16896, 128]
    - [15, 10502.0]
  - - [17280, 128, 1, 128, 17280, 17280, 17280, 128]
    - [36, 10765.0]
  - - [17664, 128, 1, 128, 17664, 17664, 17664, 128]
    - [15, 10783.0]
  - - [18048, 128, 1, 128, 18048, 18048, 18048, 128]
    - [30, 10591.0]
  - - [18432, 128, 1, 128, 18432, 18432, 18432, 128]
    - [15, 10679.0]
  - - [18816, 128, 1, 128, 18816, 18816, 18816, 128]
    - [30, 10878.0]
  - - [19200, 128, 1, 128, 19200, 19200, 19200, 128]
    - [0, 10976.0]
  - - [19584, 128, 1, 128, 19584, 19584, 19584, 128]
    - [28, 10825.0]
  - - [19968, 128, 1, 128, 19968, 19968, 19968, 128]
    - [0, 10811.0]
  - - [20352, 128, 1, 128, 20352, 20352, 20352, 128]
    - [36, 11182.0]
  - - [20736, 128, 1, 128, 20736, 20736, 20736, 128]
    - [15, 10751.0]
  - - [21120, 128, 1, 128, 21120, 21120, 21120, 128]
    - [15, 10937.0]
  - - [21504, 128, 1, 128, 21504, 21504, 21504, 128]
    - [0, 10976.0]
  - - [21888, 128, 1, 128, 21888, 21888, 21888, 128]
    - [36, 10880.0]
  - - [22272, 128, 1, 128, 22272, 22272, 22272, 128]
    - [15, 10873.0]
  - - [22656, 128, 1, 128, 22656, 22656, 22656, 128]
    - [5, 11154.0]
  - - [23040, 128, 1, 128, 23040, 23040, 23040, 128]
    - [8, 11129.0]
  - - [9216, 128, 1, 256, 9216, 9216, 9216, 128]
    - [5, 10127.0]
  - - [9600, 128, 1, 256, 9600, 9600, 9600, 128]
    - [5, 10606.0]
  - - [9984, 128, 1, 256, 9984, 9984, 9984, 128]
    - [28, 10804.0]
  - - [10368, 128, 1, 256, 10368, 10368, 10368, 128]
    - [30, 10057.0]
  - - [10752, 128, 1, 256, 10752, 10752, 10752, 128]
    - [15, 10381.0]
  - - [11136, 128, 1, 256, 11136, 11136, 11136, 128]
    - [0, 10670.0]
  - - [11520, 128, 1, 256, 11520, 11520, 11520, 128]
    - [30, 10885.0]
  - - [11904, 128, 1, 256, 11904, 11904, 11904, 128]
    - [36, 10681.0]
  - - [12288, 128, 1, 256, 12288, 12288, 12288, 128]
    - [20, 10883.0]
  - - [12672, 128, 1, 256, 12672, 12672, 12672, 128]
    - [5, 11278.0]
  - - [13056, 128, 1, 256, 13056, 13056, 13056, 128]
    - [15, 10394.0]
  - - [13440, 128, 1, 256, 13440, 13440, 13440, 128]
    - [30, 10815.0]
  - - [13824, 128, 1, 256, 13824, 13824, 13824, 128]
    - [0, 11038.0]
  - - [14208, 128, 1, 256, 14208, 14208, 14208, 128]
    - [36, 10792.0]
  - - [14592, 128, 1, 256, 14592, 14592, 14592, 128]
    - [5, 10992.0]
  - - [14976, 128, 1, 256, 14976, 14976, 14976, 128]
    - [36, 11318.0]
  - - [15360, 128, 1, 256, 15360, 15360, 15360, 128]
    - [36, 11465.0]
  - - [15744, 128, 1, 256, 15744, 15744, 15744, 128]
    - [30, 10852.0]
  - - [16128, 128, 1, 256, 16128, 16128, 16128, 128]
    - [15, 11093.0]
  - - [16512, 128, 1, 256, 16512, 16512, 16512, 128]
    - [15, 11291.0]
  - - [16896, 128, 1, 256, 16896, 16896, 16896, 128]
    - [36, 11038.0]
  - - [17280, 128, 1, 256, 17280, 17280, 17280, 128]
    - [36, 11293.0]
  - - [17664, 128, 1, 256, 17664, 17664, 17664, 128]
    - [13, 11421.0]
  - - [18048, 128, 1, 256, 18048, 18048, 18048, 128]
    - [30, 10919.0]
  - - [18432, 128, 1, 256, 18432, 18432, 18432, 128]
    - [30, 11086.0]
  - - [18816, 128, 1, 256, 18816, 18816, 18816, 128]
    - [30, 11280.0]
  - - [19200, 128, 1, 256, 19200, 19200, 19200, 128]
    - [8, 11422.0]
  - - [19584, 128, 1, 256, 19584, 19584, 19584, 128]
    - [36, 11290.0]
  - - [19968, 128, 1, 256, 19968, 19968, 19968, 128]
    - [36, 11439.0]
  - - [20352, 128, 1, 256, 20352, 20352, 20352, 128]
    - [13, 11692.0]
  - - [20736, 128, 1, 256, 20736, 20736, 20736, 128]
    - [0, 11041.0]
  - - [21120, 128, 1, 256, 21120, 21120, 21120, 128]
    - [30, 11238.0]
  - - [21504, 128, 1, 256, 21504, 21504, 21504, 128]
    - [15, 11395.0]
  - - [21888, 128, 1, 256, 21888, 21888, 21888, 128]
    - [5, 11295.0]
  - - [22272, 128, 1, 256, 22272, 22272, 22272, 128]
    - [20, 11410.0]
  - - [22656, 128, 1, 256, 22656, 22656, 22656, 128]
    - [5, 11651.0]
  - - [23040, 128, 1, 256, 23040, 23040, 23040, 128]
    - [36, 11730.0]
  - - [8064, 8064, 1, 384, 8064, 8064, 8064, 8064]
    - [19, 12694.0]
  - - [8448, 8448, 1, 384, 8448, 8448, 8448, 8448]
    - [4, 12712.0]
  - - [8832, 8832, 1, 384, 8832, 8832, 8832, 8832]
    - [19, 12688.0]
  - - [9216, 9216, 1, 384, 9216, 9216, 9216, 9216]
    - [19, 12699.0]
  - - [9600, 9600, 1, 384, 9600, 9600, 9600, 9600]
    - [4, 12708.0]
  - - [9984, 9984, 1, 384, 9984, 9984, 9984, 9984]
    - [19, 12711.0]
  - - [10368, 10368, 1, 384, 10368, 10368, 10368, 10368]
    - [19, 12715.0]
  - - [10752, 10752, 1, 384, 10752, 10752, 10752, 10752]
    - [19, 12734.0]
  - - [11136, 11136, 1, 384, 11136, 11136, 11136, 11136]
    - [19, 12730.0]
  - - [11520, 11520, 1, 384, 11520, 11520, 11520, 11520]
    - [19, 12742.0]
  - - [11904, 11904, 1, 384, 11904, 11904, 11904, 11904]
    - [4, 12735.0]
  - - [12288, 12288, 1, 384, 12288, 12288, 12288, 12288]
    - [4, 12741.0]
  - - [12672, 12672, 1, 384, 12672, 12672, 12672, 12672]
    - [19, 12735.0]
  - - [13056, 13056, 1, 384, 13056, 13056, 13056, 13056]
    - [35, 12734.0]
  - - [13440, 13440, 1, 384, 13440, 13440, 13440, 13440]
    - [35, 12740.0]
  - - [13824, 13824, 1, 384, 13824, 13824, 13824, 13824]
    - [35, 12741.0]
  - - [14208, 14208, 1, 384, 14208, 14208, 14208, 14208]
    - [35, 12743.0]
  - - [14592, 14592, 1, 384, 14592, 14592, 14592, 14592]
    - [4, 12749.0]
  - - [14976, 14976, 1, 384, 14976, 14976, 14976, 14976]
    - [4, 12755.0]
  - - [15360, 15360, 1, 384, 15360, 15360, 15360, 15360]
    - [19, 12753.0]
  - - [15744, 15744, 1, 384, 15744, 15744, 15744, 15744]
    - [35, 12753.0]
  - - [16128, 16128, 1, 384, 16128, 16128, 16128, 16128]
    - [35, 12750.0]
  - - [16512, 16512, 1, 384, 16512, 16512, 16512, 16512]
    - [19, 12750.0]
  - - [16896, 16896, 1, 384, 16896, 16896, 16896, 16896]
    - [4, 12748.0]
  - - [17280, 17280, 1, 384, 17280, 17280, 17280, 17280]
    - [19, 12753.0]
  - - [17664, 17664, 1, 384, 17664, 17664, 17664, 17664]
    - [19, 12749.0]
  - - [18048, 18048, 1, 384, 18048, 18048, 18048, 18048]
    - [12, 12751.0]
  - - [18432, 18432, 1, 384, 18432, 18432, 18432, 18432]
    - [19, 12757.0]
  - - [18816, 18816, 1, 384, 18816, 18816, 18816, 18816]
    - [35, 12755.0]
  - - [19200, 19200, 1, 384, 19200, 19200, 19200, 19200]
    - [19, 12754.0]
  - - [19584, 19584, 1, 384, 19584, 19584, 19584, 19584]
    - [19, 12757.0]
  - - [19968, 19968, 1, 384, 19968, 19968, 19968, 19968]
    - [19, 12755.0]
  - - [20352, 20352, 1, 384, 20352, 20352, 20352, 20352]
    - [19, 12760.0]
  - - [20736, 20736, 1, 384, 20736, 20736, 20736, 20736]
    - [19, 12753.0]
  - - [21120, 21120, 1, 384, 21120, 21120, 21120, 21120]
    - [35, 12758.0]
  - - [21504, 21504, 1, 384, 21504, 21504, 21504, 21504]
    - [19, 12756.0]
  - - [21888, 21888, 1, 384, 21888, 21888, 21888, 21888]
    - [19, 12759.0]
  - - [22272, 22272, 1, 384, 22272, 22272, 22272, 22272]
    - [35, 12757.0]
  - - [22656, 22656, 1, 384, 22656, 22656, 22656, 22656]
    - [19, 12760.0]
  - - [23040, 23040, 1, 384, 23040, 23040, 23040, 23040]
    - [19, 12757.0]
  - - [1152, 1152, 1, 1152, 1152, 1152, 1152, 1152]
    - [30, 10503.0]
  - - [1536, 1536, 1, 1536, 1536, 1536, 1536, 1536]
    - [30, 11453.0]
  - - [1920, 1920, 1, 1920, 1920, 1920, 1920, 1920]
    - [30, 11823.0]
  - - [2304, 2304, 1, 2304, 2304, 2304, 2304, 2304]
    - [4, 12040.0]
  - - [2688, 2688, 1, 2688, 2688, 2688, 2688, 2688]
    - [19, 12171.0]
  - - [3072, 3072, 1, 3072, 3072, 3072, 3072, 3072]
    - [19, 12624.0]
  - - [3456, 3456, 1, 3456, 3456, 3456, 3456, 3456]
    - [4, 12559.0]
  - - [3840, 3840, 1, 3840, 3840, 3840, 3840, 3840]
    - [35, 12766.0]
  - - [4224, 4224, 1, 4224, 4224, 4224, 4224, 4224]
    - [19, 12664.0]
  - - [4608, 4608, 1, 4608, 4608, 4608, 4608, 4608]
    - [19, 12760.0]
  - - [4992, 4992, 1, 4992, 4992, 4992, 4992, 4992]
    - [19, 12663.0]
  - - [5376, 5376, 1, 5376, 5376, 5376, 5376, 5376]
    - [4, 12705.0]
  - - [6144, 6144, 1, 6144, 6144, 6144, 6144, 6144]
    - [19, 12744.0]
  - - [6528, 6528, 1, 6528, 6528, 6528, 6528, 6528]
    - [19, 12753.0]
  - - [6912, 6912, 1, 6912, 6912, 6912, 6912, 6912]
    - [19, 12813.0]
  - - [7296, 7296, 1, 7296, 7296, 7296, 7296, 7296]
    - [19, 12791.0]
  - - [7680, 7680, 1, 7680, 7680, 7680, 7680, 7680]
    - [19, 12835.0]
  - - [8064, 4032, 1, 384, 8064, 8064, 8064, 4032]
    - [4, 12426.0]
  - - [8448, 4224, 1, 384, 8448, 8448, 8448, 4224]
    - [19, 12653.0]
  - - [8832, 4416, 1, 384, 8832, 8832, 8832, 4416]
    - [4, 12456.0]
  - - [9216, 4608, 1, 384, 9216, 9216, 9216, 4608]
    - [4, 12645.0]
  - - [9600, 4800, 1, 384, 9600, 9600, 9600, 4800]
    - [4, 12475.0]
  - - [9984, 4992, 1, 384, 9984, 9984, 9984, 4992]
    - [4, 12643.0]
  - - [10368, 5184, 1, 384, 10368, 10368, 10368, 5184]
    - [35, 12489.0]
  - - [10752, 5376, 1, 384, 10752, 10752, 10752, 5376]
    - [35, 12675.0]
  - - [11136, 5568, 1, 384, 11136, 11136, 11136, 5568]
    - [4, 12519.0]
  - - [11520, 5760, 1, 384, 11520, 11520, 11520, 5760]
    - [35, 12686.0]
  - - [11904, 5952, 1, 384, 11904, 11904, 11904, 5952]
    - [19, 12552.0]
  - - [12288, 6144, 1, 384, 12288, 12288, 12288, 6144]
    - [4, 12695.0]
  - - [12672, 6336, 1, 384, 12672, 12672, 12672, 6336]
    - [4, 12568.0]
  - - [13056, 6528, 1, 384, 13056, 13056, 13056, 6528]
    - [19, 12692.0]
  - - [13440, 6720, 1, 384, 13440, 13440, 13440, 6720]
    - [19, 12576.0]
  - - [13824, 6912, 1, 384, 13824, 13824, 13824, 6912]
    - [35, 12716.0]
  - - [14208, 7104, 1, 384, 14208, 14208, 14208, 7104]
    - [4, 12607.0]
  - - [14592, 7296, 1, 384, 14592, 14592, 14592, 7296]
    - [19, 12731.0]
  - - [14976, 7488, 1, 384, 14976, 14976, 14976, 7488]
    - [4, 12606.0]
  - - [15360, 7680, 1, 384, 15360, 15360, 15360, 7680]
    - [4, 12736.0]
  - - [15744, 7872, 1, 384, 15744, 15744, 15744, 7872]
    - [35, 12614.0]
  - - [16128, 8064, 1, 384, 16128, 16128, 16128, 8064]
    - [19, 12742.0]
  - - [16512, 8256, 1, 384, 16512, 16512, 16512, 8256]
    - [4, 12625.0]
  - - [16896, 8448, 1, 384, 16896, 16896, 16896, 8448]
    - [4, 12731.0]
  - - [17280, 8640, 1, 384, 17280, 17280, 17280, 8640]
    - [4, 12642.0]
  - - [17664, 8832, 1, 384, 17664, 17664, 17664, 8832]
    - [4, 12730.0]
  - - [18048, 9024, 1, 384, 18048, 18048, 18048, 9024]
    - [4, 12643.0]
  - - [18432, 9216, 1, 384, 18432, 18432, 18432, 9216]
    - [4, 12735.0]
  - - [18816, 9408, 1, 384, 18816, 18816, 18816, 9408]
    - [4, 12652.0]
  - - [19200, 9600, 1, 384, 19200, 19200, 19200, 9600]
    - [4, 12738.0]
  - - [19584, 9792, 1, 384, 19584, 19584, 19584, 9792]
    - [19, 12662.0]
  - - [19968, 9984, 1, 384, 19968, 19968, 19968, 9984]
    - [35, 12741.0]
  - - [20352, 10176, 1, 384, 20352, 20352, 20352, 10176]
    - [4, 12663.0]
  - - [20736, 10368, 1, 384, 20736, 20736, 20736, 10368]
    - [12, 12739.0]
  - - [21120, 10560, 1, 384, 21120, 21120, 21120, 10560]
    - [4, 12668.0]
  - - [21504, 10752, 1, 384, 21504, 21504, 21504, 10752]
    - [19, 12747.0]
  - - [21888, 10944, 1, 384, 21888, 21888, 21888, 10944]
    - [4, 12669.0]
  - - [22272, 11136, 1, 384, 22272, 22272, 22272, 11136]
    - [19, 12751.0]
  - - [22656, 11328, 1, 384, 22656, 22656, 22656, 11328]
    - [19, 12678.0]
  - - [23040, 11520, 1, 384, 23040, 23040, 23040, 11520]
    - [4, 12752.0]
  - - [8064, 16128, 1, 384, 8064, 8064, 8064, 16128]
    - [19, 12743.0]
  - - [8448, 16896, 1, 384, 8448, 8448, 8448, 16896]
    - [19, 12735.0]
  - - [8832, 17664, 1, 384, 8832, 8832, 8832, 17664]
    - [19, 12735.0]
  - - [9216, 18432, 1, 384, 9216, 9216, 9216, 18432]
    - [19, 12738.0]
  - - [9600, 19200, 1, 384, 9600, 9600, 9600, 19200]
    - [19, 12745.0]
  - - [9984, 19968, 1, 384, 9984, 9984, 9984, 19968]
    - [19, 12743.0]
  - - [10368, 20736, 1, 384, 10368, 10368, 10368, 20736]
    - [35, 12752.0]
  - - [10752, 21504, 1, 384, 10752, 10752, 10752, 21504]
    - [35, 12746.0]
  - - [11136, 22272, 1, 384, 11136, 11136, 11136, 22272]
    - [35, 12758.0]
  - - [11520, 23040, 1, 384, 11520, 11520, 11520, 23040]
    - [4, 12751.0]
  - - [11904, 23808, 1, 384, 11904, 11904, 11904, 23808]
    - [35, 12759.0]
  - - [12288, 24576, 1, 384, 12288, 12288, 12288, 24576]
    - [4, 12752.0]
  - - [12672, 25344, 1, 384, 12672, 12672, 12672, 25344]
    - [4, 12755.0]
  - - [13056, 26112, 1, 384, 13056, 13056, 13056, 26112]
    - [19, 12754.0]
  - - [13440, 26880, 1, 384, 13440, 13440, 13440, 26880]
    - [19, 12757.0]
  - - [13824, 27648, 1, 384, 13824, 13824, 13824, 27648]
    - [4, 12753.0]
  - - [14208, 28416, 1, 384, 14208, 14208, 14208, 28416]
    - [35, 12762.0]
  - - [14592, 29184, 1, 384, 14592, 14592, 14592, 29184]
    - [4, 12753.0]
  - - [14976, 29952, 1, 384, 14976, 14976, 14976, 29952]
    - [35, 12760.0]
  - - [15360, 30720, 1, 384, 15360, 15360, 15360, 30720]
    - [19, 12756.0]
  - - [15744, 31488, 1, 384, 15744, 15744, 15744, 31488]
    - [19, 12760.0]
  - - [16128, 32256, 1, 384, 16128, 16128, 16128, 32256]
    - [4, 12754.0]
  - - [16512, 33024, 1, 384, 16512, 16512, 16512, 33024]
    - [19, 12763.0]
  - - [16896, 33792, 1, 384, 16896, 16896, 16896, 33792]
    - [19, 12758.0]
  - - [17280, 34560, 1, 384, 17280, 17280, 17280, 34560]
    - [1, 12730.0]
  - - [17664, 35328, 1, 384, 17664, 17664, 17664, 35328]
    - [27, 12230.0]
  - - [18048, 36096, 1, 384, 18048, 18048, 18048, 36096]
    - [27, 12678.0]
  - - [18432, 36864, 1, 384, 18432, 18432, 18432, 36864]
    - [14, 12336.0]
  - - [18816, 37632, 1, 384, 18816, 18816, 18816, 37632]
    - [19, 12290.0]
  - - [19200, 38400, 1, 384, 19200, 19200, 19200, 38400]
    - [9, 12290.0]
  - - [19584, 39168, 1, 384, 19584, 19584, 19584, 39168]
    - [6, 12460.0]
  - - [19968, 39936, 1, 384, 19968, 19968, 19968, 39936]
    - [13, 12399.0]
  - - [20352, 40704, 1, 384, 20352, 20352, 20352, 40704]
    - [37, 12388.0]
  - - [20736, 41472, 1, 384, 20736, 20736, 20736, 41472]
    - [27, 12625.0]
  - - [21120, 42240, 1, 384, 21120, 21120, 21120, 42240]
    - [16, 12341.0]
  - - [21504, 43008, 1, 384, 21504, 21504, 21504, 43008]
    - [42, 12370.0]
  - - [21888, 43776, 1, 384, 21888, 21888, 21888, 43776]
    - [35, 12364.0]
  - - [22272, 44544, 1, 384, 22272, 22272, 22272, 44544]
    - [42, 12394.0]
  - - [22656, 45312, 1, 384, 22656, 22656, 22656, 45312]
    - [40, 12361.0]
  - - [23040, 46080, 1, 384, 23040, 23040, 23040, 46080]
    - [42, 12428.0]
  - - [1152, 1536, 1, 384, 1152, 1152, 1152, 1536]
    - [30, 10952.0]
  - - [1920, 1536, 1, 384, 1920, 1920, 1920, 1536]
    - [36, 11556.0]
  - - [2304, 1536, 1, 384, 2304, 2304, 2304, 1536]
    - [28, 11595.0]
  - - [2688, 1536, 1, 384, 2688, 2688, 2688, 1536]
    - [16, 11470.0]
  - - [3456, 1536, 1, 384, 3456, 3456, 3456, 1536]
    - [35, 11475.0]
  - - [3840, 1536, 1, 384, 3840, 3840, 3840, 1536]
    - [42, 12022.0]
  - - [4224, 1536, 1, 384, 4224, 4224, 4224, 1536]
    - [36, 11992.0]
  - - [4608, 1536, 1, 384, 4608, 4608, 4608, 1536]
    - [31, 11974.0]
  - - [4992, 1536, 1, 384, 4992, 4992, 4992, 1536]
    - [31, 12078.0]
  - - [5376, 1536, 1, 384, 5376, 5376, 5376, 1536]
    - [4, 12030.0]
  - - [5760, 1536, 1, 384, 5760, 5760, 5760, 1536]
    - [19, 12401.0]
  - - [6144, 1536, 1, 384, 6144, 6144, 6144, 1536]
    - [19, 12330.0]
  - - [6528, 1536, 1, 384, 6528, 6528, 6528, 1536]
    - [1, 12276.0]
  - - [6912, 1536, 1, 384, 6912, 6912, 6912, 1536]
    - [19, 12237.0]
  - - [7296, 1536, 1, 384, 7296, 7296, 7296, 1536]
    - [35, 12216.0]
  - - [7680, 1536, 1, 384, 7680, 7680, 7680, 1536]
    - [19, 12482.0]
  - - [8064, 1536, 1, 384, 8064, 8064, 8064, 1536]
    - [42, 12455.0]
  - - [8448, 1536, 1, 384, 8448, 8448, 8448, 1536]
    - [35, 12422.0]
  - - [8832, 1536, 1, 384, 8832, 8832, 8832, 1536]
    - [19, 12404.0]
  - - [9216, 1536, 1, 384, 9216, 9216, 9216, 1536]
    - [4, 12304.0]
  - - [9600, 1536, 1, 384, 9600, 9600, 9600, 1536]
    - [19, 12579.0]
  - - [9984, 1536, 1, 384, 9984, 9984, 9984, 1536]
    - [4, 12536.0]
  - - [10368, 1536, 1, 384, 10368, 10368, 10368, 1536]
    - [35, 12485.0]
  - - [10752, 1536, 1, 384, 10752, 10752, 10752, 1536]
    - [19, 12465.0]
  - - [11136, 1536, 1, 384, 11136, 11136, 11136, 1536]
    - [4, 12439.0]
  - - [11520, 1536, 1, 384, 11520, 11520, 11520, 1536]
    - [19, 12603.0]
  - - [11904, 1536, 1, 384, 11904, 11904, 11904, 1536]
    - [4, 12573.0]
  - - [12288, 1536, 1, 384, 12288, 12288, 12288, 1536]
    - [27, 12501.0]
  - - [12672, 1536, 1, 384, 12672, 12672, 12672, 1536]
    - [12, 12487.0]
  - - [13056, 1536, 1, 384, 13056, 13056, 13056, 1536]
    - [35, 12463.0]
  - - [13440, 1536, 1, 384, 13440, 13440, 13440, 1536]
    - [35, 12621.0]
  - - [13824, 1536, 1, 384, 13824, 13824, 13824, 1536]
    - [42, 12562.0]
  - - [14208, 1536, 1, 384, 14208, 14208, 14208, 1536]
    - [19, 12554.0]
  - - [14592, 1536, 1, 384, 14592, 14592, 14592, 1536]
    - [35, 12531.0]
  - - [14976, 1536, 1, 384, 14976, 14976, 14976, 1536]
    - [16, 12487.0]
  - - [15360, 1536, 1, 384, 15360, 15360, 15360, 1536]
    - [19, 12616.0]
  - - [15744, 1536, 1, 384, 15744, 15744, 15744, 1536]
    - [35, 12602.0]
  - - [16128, 1536, 1, 384, 16128, 16128, 16128, 1536]
    - [19, 12564.0]
  - - [16512, 1536, 1, 384, 16512, 16512, 16512, 1536]
    - [1, 12536.0]
  - - [16896, 1536, 1, 384, 16896, 16896, 16896, 1536]
    - [4, 12491.0]
  - - [17280, 1536, 1, 384, 17280, 17280, 17280, 1536]
    - [4, 12616.0]
  - - [17664, 1536, 1, 384, 17664, 17664, 17664, 1536]
    - [4, 12585.0]
  - - [18048, 1536, 1, 384, 18048, 18048, 18048, 1536]
    - [42, 12574.0]
  - - [18432, 1536, 1, 384, 18432, 18432, 18432, 1536]
    - [4, 12568.0]
  - - [18816, 1536, 1, 384, 18816, 18816, 18816, 1536]
    - [19, 12559.0]
  - - [19200, 1536, 1, 384, 19200, 19200, 19200, 1536]
    - [35, 12652.0]
  - - [19584, 1536, 1, 384, 19584, 19584, 19584, 1536]
    - [35, 12632.0]
  - - [19968, 1536, 1, 384, 19968, 19968, 19968, 1536]
    - [42, 12590.0]
  - - [20352, 1536, 1, 384, 20352, 20352, 20352, 1536]
    - [35, 12596.0]
  - - [20736, 1536, 1, 384, 20736, 20736, 20736, 1536]
    - [19, 12575.0]
  - - [21120, 1536, 1, 384, 21120, 21120, 21120, 1536]
    - [4, 12639.0]
  - - [21504, 1536, 1, 384, 21504, 21504, 21504, 1536]
    - [4, 12609.0]
  - - [21888, 1536, 1, 384, 21888, 21888, 21888, 1536]
    - [19, 12591.0]
  - - [22272, 1536, 1, 384, 22272, 22272, 22272, 1536]
    - [19, 12567.0]
  - - [22656, 1536, 1, 384, 22656, 22656, 22656, 1536]
    - [35, 12563.0]
  - - [23040, 1536, 1, 384, 23040, 23040, 23040, 1536]
    - [4, 12633.0]
  - - [768, 1920, 1, 384, 768, 768, 768, 1920]
    - [3, 10627.0]
  - - [1152, 1920, 1, 384, 1152, 1152, 1152, 1920]
    - [20, 11398.0]
  - - [1536, 1920, 1, 384, 1536, 1536, 1536, 1920]
    - [30, 11613.0]
  - - [2304, 1920, 1, 384, 2304, 2304, 2304, 1920]
    - [31, 11606.0]
  - - [2688, 1920, 1, 384, 2688, 2688, 2688, 1920]
    - [19, 11777.0]
  - - [3072, 1920, 1, 384, 3072, 3072, 3072, 1920]
    - [20, 11982.0]
  - - [3456, 1920, 1, 384, 3456, 3456, 3456, 1920]
    - [30, 11864.0]
  - - [4224, 1920, 1, 384, 4224, 4224, 4224, 1920]
    - [35, 12263.0]
  - - [4608, 1920, 1, 384, 4608, 4608, 4608, 1920]
    - [4, 12387.0]
  - - [4992, 1920, 1, 384, 4992, 4992, 4992, 1920]
    - [4, 12159.0]
  - - [5376, 1920, 1, 384, 5376, 5376, 5376, 1920]
    - [19, 12275.0]
  - - [5760, 1920, 1, 384, 5760, 5760, 5760, 1920]
    - [42, 12397.0]
  - - [6144, 1920, 1, 384, 6144, 6144, 6144, 1920]
    - [4, 12515.0]
  - - [6528, 1920, 1, 384, 6528, 6528, 6528, 1920]
    - [35, 12337.0]
  - - [6912, 1920, 1, 384, 6912, 6912, 6912, 1920]
    - [4, 12399.0]
  - - [7296, 1920, 1, 384, 7296, 7296, 7296, 1920]
    - [35, 12502.0]
  - - [7680, 1920, 1, 384, 7680, 7680, 7680, 1920]
    - [4, 12572.0]
  - - [8064, 1920, 1, 384, 8064, 8064, 8064, 1920]
    - [1, 12391.0]
  - - [8448, 1920, 1, 384, 8448, 8448, 8448, 1920]
    - [4, 12485.0]
  - - [8832, 1920, 1, 384, 8832, 8832, 8832, 1920]
    - [19, 12562.0]
  - - [9216, 1920, 1, 384, 9216, 9216, 9216, 1920]
    - [27, 12578.0]
  - - [9600, 1920, 1, 384, 9600, 9600, 9600, 1920]
    - [35, 12458.0]
  - - [9984, 1920, 1, 384, 9984, 9984, 9984, 1920]
    - [19, 12488.0]
  - - [10368, 1920, 1, 384, 10368, 10368, 10368, 1920]
    - [35, 12566.0]
  - - [10752, 1920, 1, 384, 10752, 10752, 10752, 1920]
    - [42, 12605.0]
  - - [11136, 1920, 1, 384, 11136, 11136, 11136, 1920]
    - [35, 12500.0]
  - - [11520, 1920, 1, 384, 11520, 11520, 11520, 1920]
    - [42, 12537.0]
  - - [11904, 1920, 1, 384, 11904, 11904, 11904, 1920]
    - [4, 12587.0]
  - - [12288, 1920, 1, 384, 12288, 12288, 12288, 1920]
    - [4, 12606.0]
  - - [12672, 1920, 1, 384, 12672, 12672, 12672, 1920]
    - [4, 12519.0]
  - - [13056, 1920, 1, 384, 13056, 13056, 13056, 1920]
    - [4, 12547.0]
  - - [13440, 1920, 1, 384, 13440, 13440, 13440, 1920]
    - [4, 12604.0]
  - - [13824, 1920, 1, 384, 13824, 13824, 13824, 1920]
    - [4, 12611.0]
  - - [14208, 1920, 1, 384, 14208, 14208, 14208, 1920]
    - [4, 12525.0]
  - - [14592, 1920, 1, 384, 14592, 14592, 14592, 1920]
    - [4, 12546.0]
  - - [14976, 1920, 1, 384, 14976, 14976, 14976, 1920]
    - [4, 12591.0]
  - - [15360, 1920, 1, 384, 15360, 15360, 15360, 1920]
    - [4, 12652.0]
  - - [15744, 1920, 1, 384, 15744, 15744, 15744, 1920]
    - [4, 12554.0]
  - - [16128, 1920, 1, 384, 16128, 16128, 16128, 1920]
    - [35, 12588.0]
  - - [16512, 1920, 1, 384, 16512, 16512, 16512, 1920]
    - [35, 12629.0]
  - - [16896, 1920, 1, 384, 16896, 16896, 16896, 1920]
    - [4, 12629.0]
  - - [17280, 1920, 1, 384, 17280, 17280, 17280, 1920]
    - [19, 12559.0]
  - - [17664, 1920, 1, 384, 17664, 17664, 17664, 1920]
    - [4, 12582.0]
  - - [18048, 1920, 1, 384, 18048, 18048, 18048, 1920]
    - [4, 12617.0]
  - - [18432, 1920, 1, 384, 18432, 18432, 18432, 1920]
    - [19, 12581.0]
  - - [18816, 1920, 1, 384, 18816, 18816, 18816, 1920]
    - [27, 12555.0]
  - - [19200, 1920, 1, 384, 19200, 19200, 19200, 1920]
    - [4, 12600.0]
  - - [19584, 1920, 1, 384, 19584, 19584, 19584, 1920]
    - [19, 12629.0]
  - - [19968, 1920, 1, 384, 19968, 19968, 19968, 1920]
    - [19, 12640.0]
  - - [20352, 1920, 1, 384, 20352, 20352, 20352, 1920]
    - [19, 12583.0]
  - - [20736, 1920, 1, 384, 20736, 20736, 20736, 1920]
    - [4, 12618.0]
  - - [21120, 1920, 1, 384, 21120, 21120, 21120, 1920]
    - [19, 12638.0]
  - - [21504, 1920, 1, 384, 21504, 21504, 21504, 1920]
    - [4, 12657.0]
  - - [21888, 1920, 1, 384, 21888, 21888, 21888, 1920]
    - [19, 12604.0]
  - - [22272, 1920, 1, 384, 22272, 22272, 22272, 1920]
    - [4, 12620.0]
  - - [22656, 1920, 1, 384, 22656, 22656, 22656, 1920]
    - [4, 12647.0]
  - - [23040, 1920, 1, 384, 23040, 23040, 23040, 1920]
    - [4, 12662.0]
  - - [768, 2304, 1, 384, 768, 768, 768, 2304]
    - [8, 10931.0]
  - - [1536, 2304, 1, 384, 1536, 1536, 1536, 2304]
    - [20, 11507.0]
  - - [1920, 2304, 1, 384, 1920, 1920, 1920, 2304]
    - [34, 11485.0]
  - - [2688, 2304, 1, 384, 2688, 2688, 2688, 2304]
    - [40, 12070.0]
  - - [3072, 2304, 1, 384, 3072, 3072, 3072, 2304]
    - [1, 12019.0]
  - - [3456, 2304, 1, 384, 3456, 3456, 3456, 2304]
    - [1, 12068.0]
  - - [3840, 2304, 1, 384, 3840, 3840, 3840, 2304]
    - [4, 12386.0]
  - - [4224, 2304, 1, 384, 4224, 4224, 4224, 2304]
    - [19, 12326.0]
  - - [4992, 2304, 1, 384, 4992, 4992, 4992, 2304]
    - [4, 12196.0]
  - - [5376, 2304, 1, 384, 5376, 5376, 5376, 2304]
    - [19, 12426.0]
  - - [5760, 2304, 1, 384, 5760, 5760, 5760, 2304]
    - [19, 12394.0]
  - - [6144, 2304, 1, 384, 6144, 6144, 6144, 2304]
    - [4, 12352.0]
  - - [6528, 2304, 1, 384, 6528, 6528, 6528, 2304]
    - [42, 12514.0]
  - - [6912, 2304, 1, 384, 6912, 6912, 6912, 2304]
    - [12, 12454.0]
  - - [7296, 2304, 1, 384, 7296, 7296, 7296, 2304]
    - [4, 12408.0]
  - - [7680, 2304, 1, 384, 7680, 7680, 7680, 2304]
    - [19, 12566.0]
  - - [8064, 2304, 1, 384, 8064, 8064, 8064, 2304]
    - [19, 12519.0]
  - - [8448, 2304, 1, 384, 8448, 8448, 8448, 2304]
    - [42, 12443.0]
  - - [8832, 2304, 1, 384, 8832, 8832, 8832, 2304]
    - [16, 12421.0]
  - - [9216, 2304, 1, 384, 9216, 9216, 9216, 2304]
    - [4, 12530.0]
  - - [9600, 2304, 1, 384, 9600, 9600, 9600, 2304]
    - [19, 12511.0]
  - - [9984, 2304, 1, 384, 9984, 9984, 9984, 2304]
    - [35, 12477.0]
  - - [10368, 2304, 1, 384, 10368, 10368, 10368, 2304]
    - [4, 12578.0]
  - - [10752, 2304, 1, 384, 10752, 10752, 10752, 2304]
    - [4, 12537.0]
  - - [11136, 2304, 1, 384, 11136, 11136, 11136, 2304]
    - [35, 12505.0]
  - - [11520, 2304, 1, 384, 11520, 11520, 11520, 2304]
    - [4, 12607.0]
  - - [11904, 2304, 1, 384, 11904, 11904, 11904, 2304]
    - [4, 12581.0]
  - - [12288, 2304, 1, 384, 12288, 12288, 12288, 2304]
    - [4, 12549.0]
  - - [12672, 2304, 1, 384, 12672, 12672, 12672, 2304]
    - [35, 12545.0]
  - - [13056, 2304, 1, 384, 13056, 13056, 13056, 2304]
    - [4, 12631.0]
  - - [13440, 2304, 1, 384, 13440, 13440, 13440, 2304]
    - [19, 12607.0]
  - - [13824, 2304, 1, 384, 13824, 13824, 13824, 2304]
    - [12, 12564.0]
  - - [14208, 2304, 1, 384, 14208, 14208, 14208, 2304]
    - [4, 12635.0]
  - - [14592, 2304, 1, 384, 14592, 14592, 14592, 2304]
    - [4, 12598.0]
  - - [14976, 2304, 1, 384, 14976, 14976, 14976, 2304]
    - [35, 12566.0]
  - - [15360, 2304, 1, 384, 15360, 15360, 15360, 2304]
    - [27, 12581.0]
  - - [15744, 2304, 1, 384, 15744, 15744, 15744, 2304]
    - [12, 12612.0]
  - - [16128, 2304, 1, 384, 16128, 16128, 16128, 2304]
    - [35, 12581.0]
  - - [16512, 2304, 1, 384, 16512, 16512, 16512, 2304]
    - [35, 12573.0]
  - - [16896, 2304, 1, 384, 16896, 16896, 16896, 2304]
    - [4, 12638.0]
  - - [17280, 2304, 1, 384, 17280, 17280, 17280, 2304]
    - [12, 12613.0]
  - - [17664, 2304, 1, 384, 17664, 17664, 17664, 2304]
    - [4, 12583.0]
  - - [18048, 2304, 1, 384, 18048, 18048, 18048, 2304]
    - [4, 12651.0]
  - - [18432, 2304, 1, 384, 18432, 18432, 18432, 2304]
    - [19, 12625.0]
  - - [18816, 2304, 1, 384, 18816, 18816, 18816, 2304]
    - [19, 12619.0]
  - - [19200, 2304, 1, 384, 19200, 19200, 19200, 2304]
    - [19, 12667.0]
  - - [19584, 2304, 1, 384, 19584, 19584, 19584, 2304]
    - [4, 12641.0]
  - - [19968, 2304, 1, 384, 19968, 19968, 19968, 2304]
    - [19, 12617.0]
  - - [20352, 2304, 1, 384, 20352, 20352, 20352, 2304]
    - [19, 12617.0]
  - - [20736, 2304, 1, 384, 20736, 20736, 20736, 2304]
    - [19, 12653.0]
  - - [21120, 2304, 1, 384, 21120, 21120, 21120, 2304]
    - [12, 12632.0]
  - - [21504, 2304, 1, 384, 21504, 21504, 21504, 2304]
    - [12, 12614.0]
  - - [21888, 2304, 1, 384, 21888, 21888, 21888, 2304]
    - [19, 12673.0]
  - - [22272, 2304, 1, 384, 22272, 22272, 22272, 2304]
    - [33, 12203.0]
  - - [22656, 2304, 1, 384, 22656, 22656, 22656, 2304]
    - [29, 12336.0]
  - - [23040, 2304, 1, 384, 23040, 23040, 23040, 2304]
    - [24, 12608.0]
  - - [256, 32768, 1, 1, 256, 256, 256, 32768]
    - [36, 197.0]
  - - [289, 128, 64, 768, 289, 289, 289, 128]
    - [36, 8719.0]
  - - [289, 160, 64, 768, 289, 289, 289, 160]
    - [0, 7355.0]
  - - [289, 192, 64, 768, 289, 289, 289, 192]
    - [30, 8802.0]
  - - [3136, 256, 32, 64, 3136, 3136, 3136, 256]
    - [34, 10563.0]
  - - [784, 512, 32, 128, 784, 784, 784, 512]
    - [20, 10342.0]
  - - [784, 128, 32, 512, 784, 784, 784, 128]
    - [0, 10068.0]
  - - [196, 1024, 32, 256, 196, 196, 196, 1024]
    - [20, 8986.0]
  - - [1444, 128, 120, 256, 1444, 1444, 1444, 128]
    - [4, 11481.0]
  - - [1444, 128, 18, 256, 1444, 1444, 1444, 128]
    - [5, 10770.0]
  - - [1444, 128, 19, 256, 1444, 1444, 1444, 128]
    - [15, 10808.0]
  - - [1444, 256, 120, 256, 1444, 1444, 1444, 256]
    - [1, 11690.0]
  - - [1444, 256, 18, 256, 1444, 1444, 1444, 256]
    - [1, 11122.0]
  - - [1444, 256, 19, 256, 1444, 1444, 1444, 256]
    - [36, 11294.0]
  - - [361, 512, 120, 256, 361, 361, 361, 512]
    - [5, 11298.0]
  - - [361, 512, 18, 256, 361, 361, 361, 512]
    - [0, 10507.0]
  - - [361, 512, 19, 256, 361, 361, 361, 512]
    - [30, 10657.0]
  - - [7680, 8192, 1, 8192, 7680, 7680, 7680, 8192]
    - [35, 12501.0]
  - - [3840, 4096, 1, 4096, 3840, 3840, 3840, 4096]
    - [19, 12373.0]
  - - [1920, 2048, 1, 2048, 1920, 1920, 1920, 2048]
    - [1, 12411.0]
  - - [8192, 7680, 1, 8192, 8192, 8192, 8192, 7680]
    - [42, 12522.0]
  - - [4096, 3840, 1, 4096, 4096, 4096, 4096, 3840]
    - [19, 12206.0]
  - - [2048, 1920, 1, 2048, 2048, 2048, 2048, 1920]
    - [42, 12322.0]
  - - [8192, 8192, 1, 8192, 8192, 8192, 8192, 8192]
    - [35, 12533.0]
  - - [4096, 4096, 1, 4096, 4096, 4096, 4096, 4096]
    - [5, 12301.0]
  - - [2048, 2048, 1, 2048, 2048, 2048, 2048, 2048]
    - [4, 12282.0]
  - - [1024, 4096, 1, 512, 1024, 1024, 1024, 4096]
    - [4, 11772.0]
  - - [1024, 30522, 1, 77, 1024, 1024, 1024, 30522]
    - [16, 10581.0]
  - - [4096, 1024, 1, 512, 4096, 4096, 4096, 1024]
    - [1, 11942.0]
  - - [1024, 4096, 1, 1280, 1024, 1024, 1024, 4096]
    - [4, 12247.0]
  - - [1024, 30522, 1, 200, 1024, 1024, 1024, 30522]
    - [24, 12235.0]
  - - [4096, 1024, 1, 1280, 4096, 4096, 4096, 1024]
    - [1, 12239.0]
  - - [1024, 4096, 1, 4992, 1024, 1024, 1024, 4096]
    - [15, 11853.0]
  - - [1024, 30522, 1, 780, 1024, 1024, 1024, 30522]
    - [21, 12317.0]
  - - [4096, 1024, 1, 4992, 4096, 4096, 4096, 1024]
    - [22, 11889.0]
  - - [1024, 30522, 1, 308, 1024, 1024, 1024, 30522]
    - [19, 12436.0]
  - - [1024, 4096, 1, 5120, 1024, 1024, 1024, 4096]
    - [16, 12288.0]
  - - [1024, 30522, 1, 800, 1024, 1024, 1024, 30522]
    - [21, 11505.0]
  - - [4096, 1024, 1, 5120, 4096, 4096, 4096, 1024]
    - [21, 11226.0]
  - - [1024, 4096, 1, 5248, 1024, 1024, 1024, 4096]
    - [28, 12171.0]
  - - [1024, 30522, 1, 820, 1024, 1024, 1024, 30522]
    - [28, 11471.0]
  - - [4096, 1024, 1, 5248, 4096, 4096, 4096, 1024]
    - [3, 11891.0]
  - - [1024, 4096, 1, 2560, 1024, 1024, 1024, 4096]
    - [16, 12299.0]
  - - [1024, 30522, 1, 385, 1024, 1024, 1024, 30522]
    - [19, 12502.0]
  - - [4096, 1024, 1, 2560, 4096, 4096, 4096, 1024]
    - [1, 12316.0]
  - - [1024, 30522, 1, 462, 1024, 1024, 1024, 30522]
    - [27, 12465.0]
  - - [1024, 4096, 1, 1024, 1024, 1024, 1024, 4096]
    - [1, 12124.0]
  - - [1024, 30522, 1, 160, 1024, 1024, 1024, 30522]
    - [20, 12052.0]
  - - [4096, 1024, 1, 1024, 4096, 4096, 4096, 1024]
    - [1, 12179.0]
  - - [1024, 4096, 1, 1152, 1024, 1024, 1024, 4096]
    - [4, 12239.0]
  - - [1024, 30522, 1, 180, 1024, 1024, 1024, 30522]
    - [19, 12119.0]
  - - [4096, 1024, 1, 1152, 4096, 4096, 4096, 1024]
    - [1, 12185.0]
  - - [1024, 4096, 1, 8192, 1024, 1024, 1024, 4096]
    - [38, 12099.0]
  - - [1024, 4096, 1, 9600, 1024, 1024, 1024, 4096]
    - [9, 12187.0]
  - - [1024, 33712, 1, 8192, 1024, 1024, 1024, 33712]
    - [4, 12612.0]
  - - [1024, 33712, 1, 9600, 1024, 1024, 1024, 33712]
    - [12, 12599.0]
  - - [4096, 1024, 1, 8192, 4096, 4096, 4096, 1024]
    - [19, 12406.0]
  - - [4096, 1024, 1, 9600, 4096, 4096, 4096, 1024]
    - [35, 12412.0]
  - - [1024, 4096, 1, 10064, 1024, 1024, 1024, 4096]
    - [19, 12402.0]
  - - [1024, 4096, 1, 10080, 1024, 1024, 1024, 4096]
    - [4, 12405.0]
  - - [1024, 4096, 1, 6528, 1024, 1024, 1024, 4096]
    - [35, 12400.0]
  - - [1024, 4096, 1, 7104, 1024, 1024, 1024, 4096]
    - [19, 12408.0]
  - - [1024, 4096, 1, 8064, 1024, 1024, 1024, 4096]
    - [35, 12402.0]
  - - [1024, 4096, 1, 9216, 1024, 1024, 1024, 4096]
    - [4, 12409.0]
  - - [1024, 42720, 1, 10080, 1024, 1024, 1024, 42720]
    - [35, 12786.0]
  - - [1024, 42720, 1, 6528, 1024, 1024, 1024, 42720]
    - [4, 12789.0]
  - - [1024, 42720, 1, 7104, 1024, 1024, 1024, 42720]
    - [19, 12783.0]
  - - [4096, 1024, 1, 10064, 4096, 4096, 4096, 1024]
    - [35, 12393.0]
  - - [4096, 1024, 1, 10080, 4096, 4096, 4096, 1024]
    - [19, 12384.0]
  - - [4096, 1024, 1, 6528, 4096, 4096, 4096, 1024]
    - [19, 12380.0]
  - - [4096, 1024, 1, 7104, 4096, 4096, 4096, 1024]
    - [19, 12383.0]
  - - [4096, 1024, 1, 8064, 4096, 4096, 4096, 1024]
    - [19, 12384.0]
  - - [4096, 1024, 1, 9216, 4096, 4096, 4096, 1024]
    - [42, 12400.0]
  - - [1024, 1600, 1, 1, 1024, 1024, 1024, 1600]
    - [0, 237.0]
  - - [2048, 960, 1, 1, 2048, 2048, 2048, 960]
    - [3, 243.0]
  - - [2048, 2048, 1, 2, 2048, 2048, 2048, 2048]
    - [0, 519.0]
  - - [2048, 30592, 1, 1024, 2048, 2048, 2048, 30592]
    - [19, 12756.0]
  - - [2048, 6144, 1, 1024, 2048, 2048, 2048, 6144]
    - [19, 12497.0]
  - - [2048, 8192, 1, 1024, 2048, 2048, 2048, 8192]
    - [19, 12536.0]
  - - [8192, 2048, 1, 1024, 8192, 8192, 8192, 2048]
    - [4, 12535.0]
  - - [1024, 30592, 1, 8192, 1024, 1024, 1024, 30592]
    - [35, 12768.0]
  - - [1024, 3072, 1, 8192, 1024, 1024, 1024, 3072]
    - [6, 12032.0]
  - - [1024, 30592, 1, 2048, 1024, 1024, 1024, 30592]
    - [19, 12749.0]
  - - [1024, 30592, 1, 4096, 1024, 1024, 1024, 30592]
    - [19, 12765.0]
  - - [1024, 3072, 1, 4096, 1024, 1024, 1024, 3072]
    - [6, 11970.0]
  - - [2560, 1920, 1, 2048, 2560, 2560, 2560, 1920]
    - [31, 12540.0]
  - - [2560, 2560, 1, 2048, 2560, 2560, 2560, 2560]
    - [1, 12613.0]
  - - [2560, 2560, 1, 4, 2560, 2560, 2560, 2560]
    - [1, 1053.0]
  - - [2560, 7680, 1, 2048, 2560, 2560, 2560, 7680]
    - [4, 12776.0]
  - - [640, 2560, 1, 2048, 640, 640, 640, 2560]
    - [5, 12102.0]
  - - [1536, 1536, 1, 4096, 1536, 1536, 1536, 1536]
    - [30, 11588.0]
  - - [1536, 4608, 1, 4096, 1536, 1536, 1536, 4608]
    - [19, 12457.0]
  - - [1536, 50304, 1, 4096, 1536, 1536, 1536, 50304]
    - [19, 12803.0]
  - - [1536, 6144, 1, 4096, 1536, 1536, 1536, 6144]
    - [19, 12638.0]
  - - [6144, 1536, 1, 4096, 6144, 6144, 6144, 1536]
    - [19, 12642.0]
  - - [1536, 1536, 1, 8192, 1536, 1536, 1536, 1536]
    - [3, 11586.0]
  - - [1536, 4608, 1, 8192, 1536, 1536, 1536, 4608]
    - [35, 12468.0]
  - - [1536, 50304, 1, 8192, 1536, 1536, 1536, 50304]
    - [42, 12820.0]
  - - [1536, 6144, 1, 8192, 1536, 1536, 1536, 6144]
    - [19, 12652.0]
  - - [6144, 1536, 1, 8192, 6144, 6144, 6144, 1536]
    - [4, 12644.0]
  - - [1024, 3072, 1, 16384, 1024, 1024, 1024, 3072]
    - [6, 12039.0]
  - - [1024, 4096, 1, 16384, 1024, 1024, 1024, 4096]
    - [35, 12395.0]
  - - [1024, 50304, 1, 16384, 1024, 1024, 1024, 50304]
    - [19, 12721.0]
  - - [4096, 1024, 1, 16384, 4096, 4096, 4096, 1024]
    - [12, 12368.0]
  - - [1024, 50304, 1, 2048, 1024, 1024, 1024, 50304]
    - [35, 12761.0]
  - - [1024, 50304, 1, 4096, 1024, 1024, 1024, 50304]
    - [35, 12750.0]
  - - [1024, 50304, 1, 8192, 1024, 1024, 1024, 50304]
    - [19, 12773.0]
  - - [1024, 30528, 1, 8192, 1024, 1024, 1024, 30528]
    - [35, 12712.0]
  - - [256, 6912, 1, 1, 256, 256, 256, 6912]
    - [11, 243.0]
  - - [30528, 1024, 1, 640, 30528, 30528, 30528, 1024]
    - [19, 12606.0]
  - - [30528, 1024, 1, 1280, 30528, 30528, 30528, 1024]
    - [19, 12682.0]
  - - [4096, 1024, 1, 10240, 4096, 4096, 4096, 1024]
    - [35, 12397.0]
  - - [1024, 4096, 1, 10240, 1024, 1024, 1024, 4096]
    - [4, 12389.0]
  - - [30528, 1024, 1, 1600, 30528, 30528, 30528, 1024]
    - [35, 12701.0]
  - - [1024, 4096, 1, 10496, 1024, 1024, 1024, 4096]
    - [35, 12386.0]
  - - [30528, 1024, 1, 1640, 30528, 30528, 30528, 1024]
    - [35, 12700.0]
  - - [4096, 1024, 1, 10496, 4096, 4096, 4096, 1024]
    - [35, 12389.0]
  - - [30528, 1024, 1, 160, 30528, 30528, 30528, 1024]
    - [1, 12196.0]
  - - [1024, 4096, 1, 6144, 1024, 1024, 1024, 4096]
    - [19, 12375.0]
  - - [30528, 1024, 1, 240, 30528, 30528, 30528, 1024]
    - [9, 12403.0]
  - - [4096, 1024, 1, 6144, 4096, 4096, 4096, 1024]
    - [4, 12370.0]
  - - [3136, 128, 64, 256, 3136, 3136, 3136, 128]
    - [31, 12024.0]
  - - [784, 256, 64, 512, 784, 784, 784, 256]
    - [1, 10912.0]
  - - [3136, 256, 64, 128, 3136, 3136, 3136, 256]
    - [0, 11906.0]
  - - [3136, 256, 64, 256, 3136, 3136, 3136, 256]
    - [4, 12237.0]
  - - [196, 512, 64, 1024, 196, 196, 196, 512]
    - [4, 9418.0]
  - - [784, 512, 64, 256, 784, 784, 784, 512]
    - [16, 10844.0]
  - - [784, 512, 64, 512, 784, 784, 784, 512]
    - [35, 11013.0]
  - - [196, 1024, 64, 512, 196, 196, 196, 1024]
    - [31, 9412.0]
  - - [196, 1024, 64, 1024, 196, 196, 196, 1024]
    - [4, 9546.0]
  - - [3136, 128, 32, 256, 3136, 3136, 3136, 128]
    - [20, 11939.0]
  - - [784, 256, 32, 512, 784, 784, 784, 256]
    - [1, 10564.0]
  - - [3136, 256, 32, 128, 3136, 3136, 3136, 256]
    - [15, 11776.0]
  - - [3136, 256, 32, 256, 3136, 3136, 3136, 256]
    - [16, 12116.0]
  - - [196, 512, 32, 1024, 196, 196, 196, 512]
    - [36, 9263.0]
  - - [784, 512, 32, 256, 784, 784, 784, 512]
    - [1, 10720.0]
  - - [784, 512, 32, 512, 784, 784, 784, 512]
    - [16, 10920.0]
  - - [196, 1024, 32, 512, 196, 196, 196, 1024]
    - [1, 9288.0]
  - - [196, 1024, 32, 1024, 196, 196, 196, 1024]
    - [4, 9428.0]
  - - [1024, 4096, 1, 10224, 1024, 1024, 1024, 4096]
    - [4, 12384.0]
  - - [4096, 1024, 1, 10224, 4096, 4096, 4096, 1024]
    - [19, 12386.0]
  - - [1024, 3072, 1, 10224, 1024, 1024, 1024, 3072]
    - [6, 12041.0]
  - - [1024, 3072, 1, 10240, 1024, 1024, 1024, 3072]
    - [29, 12015.0]
  - - [4096, 1024, 1, 10192, 4096, 4096, 4096, 1024]
    - [35, 12393.0]
  - - [1024, 3072, 1, 10192, 1024, 1024, 1024, 3072]
    - [37, 12030.0]
  - - [1024, 4096, 1, 10192, 1024, 1024, 1024, 4096]
    - [27, 12362.0]
  - - [1024, 3072, 1, 10200, 1024, 1024, 1024, 3072]
    - [19, 12008.0]
  - - [4096, 1024, 1, 10208, 4096, 4096, 4096, 1024]
    - [35, 12384.0]
  - - [1024, 3072, 1, 10208, 1024, 1024, 1024, 3072]
    - [21, 12030.0]
  - - [1024, 4096, 1, 10208, 1024, 1024, 1024, 4096]
    - [35, 12379.0]
  - - [1024, 2048, 1, 10224, 1024, 1024, 1024, 2048]
    - [30, 11794.0]
  - - [1024, 2048, 1, 10240, 1024, 1024, 1024, 2048]
    - [15, 11785.0]
  - - [1024, 2048, 1, 10192, 1024, 1024, 1024, 2048]
    - [18, 11772.0]
  - - [1024, 3072, 1, 10080, 1024, 1024, 1024, 3072]
    - [4, 12009.0]
  - - [100352, 256, 1, 512, 100352, 100352, 100352, 256]
    - [19, 12564.0]
  - - [12544, 1024, 1, 2048, 12544, 12544, 12544, 1024]
    - [35, 12494.0]
  - - [12544, 147, 1, 64, 12544, 12544, 12544, 147]
    - [39, 6869.0]
  - - [200704, 256, 1, 512, 200704, 200704, 200704, 256]
    - [4, 12705.0]
  - - [25088, 512, 1, 1024, 25088, 25088, 25088, 512]
    - [19, 12444.0]
  - - [3136, 576, 1, 64, 3136, 3136, 3136, 576]
    - [0, 8438.0]
  - - [50176, 512, 1, 1024, 50176, 50176, 50176, 512]
    - [35, 12666.0]
  - - [6272, 1024, 1, 2048, 6272, 6272, 6272, 1024]
    - [4, 12372.0]
  - - [196, 1024, 128, 512, 196, 196, 196, 1024]
    - [1, 9544.0]
  - - [196, 1024, 256, 512, 196, 196, 196, 1024]
    - [31, 9616.0]
  - - [3136, 256, 128, 128, 3136, 3136, 3136, 256]
    - [19, 12021.0]
  - - [3136, 256, 256, 128, 3136, 3136, 3136, 256]
    - [19, 12062.0]
  - - [784, 512, 128, 256, 784, 784, 784, 512]
    - [31, 10923.0]
  - - [784, 512, 256, 256, 784, 784, 784, 512]
    - [35, 10981.0]
  - - [30528, 1024, 1, 2560, 30528, 30528, 30528, 1024]
    - [4, 12704.0]
  - - [1024, 4096, 1, 12288, 1024, 1024, 1024, 4096]
    - [12, 12376.0]
  - - [30528, 1024, 1, 1920, 30528, 30528, 30528, 1024]
    - [4, 12703.0]
  - - [4096, 1024, 1, 12288, 4096, 4096, 4096, 1024]
    - [19, 12386.0]
  - - [25600, 128, 25, 128, 25600, 25600, 25600, 128]
    - [41, 10545.0]
  - - [12544, 128, 36, 128, 12544, 12544, 12544, 128]
    - [34, 10729.0]
  - - [9216, 128, 49, 128, 9216, 9216, 9216, 128]
    - [26, 10791.0]
  - - [6400, 128, 64, 128, 6400, 6400, 6400, 128]
    - [3, 10804.0]
  - - [6400, 256, 25, 256, 6400, 6400, 6400, 256]
    - [4, 12553.0]
  - - [4096, 256, 36, 256, 4096, 4096, 4096, 256]
    - [4, 12480.0]
  - - [2304, 256, 49, 256, 2304, 2304, 2304, 256]
    - [4, 12422.0]
  - - [2304, 256, 64, 256, 2304, 2304, 2304, 256]
    - [35, 12494.0]
  - - [2304, 512, 25, 512, 2304, 2304, 2304, 512]
    - [35, 12690.0]
  - - [1024, 512, 36, 512, 1024, 1024, 1024, 512]
    - [19, 12552.0]
  - - [1024, 512, 49, 512, 1024, 1024, 1024, 512]
    - [35, 12595.0]
  - - [1024, 512, 64, 512, 1024, 1024, 1024, 512]
    - [4, 12641.0]
  - - [3072, 768, 1, 2048, 3072, 3072, 3072, 768]
    - [15, 11492.0]
  - - [768, 3072, 1, 2048, 768, 768, 768, 3072]
    - [15, 11512.0]
  - - [3072, 768, 1, 4608, 3072, 3072, 3072, 768]
    - [34, 11544.0]
  - - [768, 3072, 1, 4608, 768, 768, 768, 3072]
    - [15, 11582.0]
  - - [4096, 1024, 1, 4608, 4096, 4096, 4096, 1024]
    - [19, 12369.0]
  - - [1024, 4096, 1, 4608, 1024, 1024, 1024, 4096]
    - [4, 12360.0]
  - - [4880, 256, 49, 256, 4880, 4880, 4880, 256]
    - [19, 12233.0]
  - - [3128, 256, 64, 256, 3128, 3128, 3128, 256]
    - [9, 12168.0]
  - - [4680, 256, 49, 256, 4680, 4680, 4680, 256]
    - [19, 12335.0]
  - - [5280, 256, 36, 256, 5280, 5280, 5280, 256]
    - [4, 12271.0]
  - - [2640, 256, 64, 256, 2640, 2640, 2640, 256]
    - [35, 12231.0]
  - - [5304, 256, 49, 256, 5304, 5304, 5304, 256]
    - [35, 12346.0]
  - - [4524, 256, 49, 256, 4524, 4524, 4524, 256]
    - [35, 12253.0]
  - - [2760, 256, 64, 256, 2760, 2760, 2760, 256]
    - [4, 12215.0]
  - - [6440, 256, 36, 256, 6440, 6440, 6440, 256]
    - [4, 12346.0]
  - - [5704, 256, 36, 256, 5704, 5704, 5704, 256]
    - [35, 12339.0]
  - - [2666, 256, 64, 256, 2666, 2666, 2666, 256]
    - [4, 12273.0]
  - - [2128, 256, 64, 256, 2128, 2128, 2128, 256]
    - [4, 12176.0]
  - - [1160, 256, 49, 256, 1160, 1160, 1160, 256]
    - [36, 11138.0]
  - - [4056, 256, 49, 256, 4056, 4056, 4056, 256]
    - [4, 12367.0]
  - - [6144, 256, 36, 256, 6144, 6144, 6144, 256]
    - [4, 12587.0]
  - - [950, 2048, 2, 512, 950, 950, 950, 2048]
    - [36, 11067.0]
  - - [6336, 256, 36, 256, 6336, 6336, 6336, 256]
    - [9, 12374.0]
  - - [13600, 512, 2, 128, 13600, 13600, 13600, 512]
    - [13, 11884.0]
  - - [15200, 512, 2, 128, 15200, 15200, 15200, 512]
    - [0, 11842.0]
  - - [15200, 128, 2, 512, 15200, 15200, 15200, 128]
    - [20, 11862.0]
  - - [13600, 128, 2, 512, 13600, 13600, 13600, 128]
    - [13, 11586.0]
  - - [5632, 256, 36, 256, 5632, 5632, 5632, 256]
    - [4, 12562.0]
  - - [12288, 128, 2, 512, 12288, 12288, 12288, 128]
    - [5, 11579.0]
  - - [12880, 128, 2, 512, 12880, 12880, 12880, 128]
    - [15, 11264.0]
  - - [3220, 1024, 2, 256, 3220, 3220, 3220, 1024]
    - [1, 11552.0]
  - - [11408, 128, 2, 512, 11408, 11408, 11408, 128]
    - [20, 11862.0]
  - - [782, 128, 64, 128, 782, 782, 782, 128]
    - [15, 9954.0]
  - - [13824, 512, 2, 128, 13824, 13824, 13824, 512]
    - [23, 11911.0]
  - - [13824, 128, 2, 512, 13824, 13824, 13824, 128]
    - [5, 11913.0]
  - - [10560, 128, 2, 512, 10560, 10560, 10560, 128]
    - [15, 11277.0]
  - - [10752, 128, 2, 512, 10752, 10752, 10752, 128]
    - [30, 11591.0]
  - - [13600, 512, 2, 256, 13600, 13600, 13600, 512]
    - [5, 12105.0]
  - - [15200, 512, 2, 256, 15200, 15200, 15200, 512]
    - [24, 12159.0]
  - - [850, 2048, 2, 512, 850, 850, 850, 2048]
    - [0, 11009.0]
  - - [768, 2048, 2, 512, 768, 768, 768, 2048]
    - [20, 11654.0]
  - - [12880, 512, 2, 128, 12880, 12880, 12880, 512]
    - [8, 11778.0]
  - - [11616, 128, 2, 512, 11616, 11616, 11616, 128]
    - [15, 11193.0]
  - - [14208, 512, 2, 128, 14208, 14208, 14208, 512]
    - [30, 11910.0]
  - - [11408, 512, 2, 128, 11408, 11408, 11408, 512]
    - [28, 11768.0]
  - - [805, 2048, 2, 512, 805, 805, 805, 2048]
    - [0, 10394.0]
  - - [6912, 256, 36, 256, 6912, 6912, 6912, 256]
    - [4, 12575.0]
  - - [713, 2048, 2, 512, 713, 713, 713, 2048]
    - [5, 10723.0]
  - - [13824, 512, 2, 256, 13824, 13824, 13824, 512]
    - [31, 12179.0]
  - - [11616, 512, 2, 128, 11616, 11616, 11616, 512]
    - [0, 11732.0]
  - - [12288, 512, 2, 128, 12288, 12288, 12288, 512]
    - [23, 11897.0]
  - - [14208, 128, 2, 512, 14208, 14208, 14208, 128]
    - [15, 11538.0]
  - - [11968, 128, 2, 512, 11968, 11968, 11968, 128]
    - [30, 11499.0]
  - - [864, 2048, 2, 512, 864, 864, 864, 2048]
    - [0, 11126.0]
  - - [10560, 512, 2, 128, 10560, 10560, 10560, 512]
    - [8, 11657.0]
  - - [672, 2048, 2, 512, 672, 672, 672, 2048]
    - [5, 10159.0]
  - - [660, 2048, 2, 512, 660, 660, 660, 2048]
    - [5, 9955.0]
  - - [9408, 128, 2, 512, 9408, 9408, 9408, 128]
    - [30, 11282.0]
  - - [10752, 512, 2, 128, 10752, 10752, 10752, 512]
    - [36, 11839.0]
  - - [726, 2048, 2, 512, 726, 726, 726, 2048]
    - [5, 10914.0]
  - - [11968, 512, 2, 128, 11968, 11968, 11968, 512]
    - [9, 11701.0]
  - - [1240, 256, 49, 256, 1240, 1240, 1240, 256]
    - [5, 11841.0]
  - - [4032, 256, 2, 1024, 4032, 4032, 4032, 256]
    - [0, 11375.0]
  - - [888, 2048, 2, 512, 888, 888, 888, 2048]
    - [39, 11429.0]
  - - [12880, 512, 2, 256, 12880, 12880, 12880, 512]
    - [36, 12018.0]
  - - [12288, 512, 2, 256, 12288, 12288, 12288, 512]
    - [16, 12137.0]
  - - [13440, 128, 2, 512, 13440, 13440, 13440, 128]
    - [15, 11817.0]
  - - [864, 2048, 2, 256, 864, 864, 864, 2048]
    - [30, 10984.0]
  - - [12672, 128, 2, 512, 12672, 12672, 12672, 128]
    - [28, 11956.0]
  - - [11264, 128, 2, 512, 11264, 11264, 11264, 128]
    - [20, 11738.0]
  - - [11776, 128, 2, 512, 11776, 11776, 11776, 128]
    - [30, 11490.0]
  - - [16128, 128, 2, 512, 16128, 16128, 16128, 128]
    - [28, 11798.0]
  - - [4032, 1024, 2, 256, 4032, 4032, 4032, 1024]
    - [1, 11764.0]
  - - [14000, 128, 2, 512, 14000, 14000, 14000, 128]
    - [36, 11879.0]
  - - [13440, 512, 2, 128, 13440, 13440, 13440, 512]
    - [20, 12010.0]
  - - [805, 2048, 2, 256, 805, 805, 805, 2048]
    - [0, 10249.0]
  - - [768, 2048, 2, 256, 768, 768, 768, 2048]
    - [36, 11323.0]
  - - [3264, 1024, 2, 256, 3264, 3264, 3264, 1024]
    - [9, 11708.0]
  - - [1251, 256, 49, 256, 1251, 1251, 1251, 256]
    - [4, 11809.0]
  - - [4200, 256, 2, 1024, 4200, 4200, 4200, 256]
    - [5, 11363.0]
  - - [2352, 1024, 2, 256, 2352, 2352, 2352, 1024]
    - [15, 11235.0]
  - - [2400, 1024, 2, 256, 2400, 2400, 2400, 1024]
    - [15, 11452.0]
  - - [15200, 256, 2, 12, 15200, 15200, 15200, 256]
    - [36, 3977.0]
  - - [12880, 256, 2, 12, 12880, 12880, 12880, 256]
    - [32, 3864.0]
  - - [2520, 1024, 2, 256, 2520, 2520, 2520, 1024]
    - [36, 11598.0]
  - - [13600, 256, 2, 12, 13600, 13600, 13600, 256]
    - [32, 3923.0]
  - - [15200, 256, 2, 3, 15200, 15200, 15200, 256]
    - [15, 1160.0]
  - - [12880, 256, 2, 3, 12880, 12880, 12880, 256]
    - [15, 1114.0]
  - - [4200, 1024, 2, 256, 4200, 4200, 4200, 1024]
    - [8, 11837.0]
  - - [12288, 256, 2, 12, 12288, 12288, 12288, 256]
    - [32, 3013.0]
  - - [13824, 256, 2, 12, 13824, 13824, 13824, 256]
    - [18, 3560.0]
  - - [13600, 256, 2, 3, 13600, 13600, 13600, 256]
    - [20, 1148.0]
  - - [1900, 1024, 1, 2048, 1900, 1900, 1900, 1024]
    - [5, 11972.0]
  - - [7600, 512, 1, 256, 7600, 7600, 7600, 512]
    - [13, 11662.0]
  - - [1610, 1024, 1, 2048, 1610, 1610, 1610, 1024]
    - [15, 10785.0]
  - - [6144, 512, 1, 256, 6144, 6144, 6144, 512]
    - [20, 11323.0]
  - - [1900, 1024, 1, 512, 1900, 1900, 1900, 1024]
    - [5, 11562.0]
  - - [12544, 1024, 1, 1024, 12544, 12544, 12544, 1024]
    - [19, 12440.0]
  - - [3220, 256, 2, 12, 3220, 3220, 3220, 256]
    - [5, 2384.0]
  - - [3220, 256, 2, 3, 3220, 3220, 3220, 256]
    - [7, 695.0]
  - - [3800, 256, 2, 3, 3800, 3800, 3800, 256]
    - [15, 741.0]
  - - [13824, 256, 2, 3, 13824, 13824, 13824, 256]
    - [15, 887.0]
  - - [12288, 256, 2, 3, 12288, 12288, 12288, 256]
    - [9, 805.0]
  - - [2688, 256, 2, 1024, 2688, 2688, 2688, 256]
    - [15, 10763.0]
  - - [3072, 256, 2, 12, 3072, 3072, 3072, 256]
    - [15, 2200.0]
  - - [3800, 256, 2, 12, 3800, 3800, 3800, 256]
    - [36, 2554.0]
  - - [3072, 256, 2, 3, 3072, 3072, 3072, 256]
    - [22, 708.0]
  - - [2520, 256, 2, 1024, 2520, 2520, 2520, 256]
    - [36, 11592.0]
  - - [16128, 512, 2, 128, 16128, 16128, 16128, 512]
    - [20, 11963.0]
  - - [2400, 256, 2, 1024, 2400, 2400, 2400, 256]
    - [36, 10963.0]
  - - [2352, 256, 2, 1024, 2352, 2352, 2352, 256]
    - [36, 10751.0]
  - - [3036, 1024, 2, 256, 3036, 3036, 3036, 1024]
    - [0, 11534.0]
  - - [1024, 256, 1, 33536, 1024, 1024, 1024, 256]
    - [45, 10570.0]
  - - [1024, 1024, 1, 9520, 1024, 1024, 1024, 1024]
    - [46, 11922.0]
  - - [1024, 1024, 1, 10200, 1024, 1024, 1024, 1024]
    - [50, 11928.0]
  - - [1024, 256, 1, 21248, 1024, 1024, 1024, 256]
    - [49, 10458.0]
  - - [1024, 256, 1, 21504, 1024, 1024, 1024, 256]
    - [49, 10465.0]
  - - [1024, 256, 1, 22016, 1024, 1024, 1024, 256]
    - [54, 10471.0]
  - - [1024, 256, 1, 28672, 1024, 1024, 1024, 256]
    - [49, 10534.0]
  - - [256, 2560, 1, 8976, 256, 256, 256, 2560]
    - [51, 11693.0]
  - - [256, 2816, 1, 8976, 256, 256, 256, 2816]
    - [51, 11564.0]
  - - [256, 3328, 1, 8976, 256, 256, 256, 3328]
    - [48, 11577.0]
  - - [256, 3584, 1, 8976, 256, 256, 256, 3584]
    - [53, 11461.0]
  - - [256, 3840, 1, 8976, 256, 256, 256, 3840]
    - [5, 11995.0]
  - - [256, 4096, 1, 8976, 256, 256, 256, 4096]
    - [46, 11818.0]
  - - [256, 4352, 1, 8976, 256, 256, 256, 4352]
    - [46, 11758.0]
  - - [1024, 1024, 1, 32768, 1024, 1024, 1024, 1024]
    - [46, 12248.0]
  - - [1024, 512, 1, 32768, 1024, 1024, 1024, 512]
    - [54, 11538.0]
  - - [479, 1024, 1, 32768, 479, 479, 479, 1024]
    - [53, 10890.0]
  - - [512, 256, 1, 55296, 512, 512, 512, 256]
    - [52, 9340.0]
  - - [1024, 1024, 1, 8192, 1024, 1024, 1024, 1024]
    - [44, 11805.0]
  - - [1024, 1024, 1, 9600, 1024, 1024, 1024, 1024]
    - [46, 11898.0]
  - - [1024, 1024, 1, 10064, 1024, 1024, 1024, 1024]
    - [46, 11920.0]
  - - [1024, 1024, 1, 10080, 1024, 1024, 1024, 1024]
    - [46, 11924.0]
  - - [1024, 1024, 1, 9216, 1024, 1024, 1024, 1024]
    - [44, 11870.0]
  - - [480, 1024, 1, 32768, 480, 480, 480, 1024]
    - [53, 10909.0]
  - - [1024, 1024, 1, 16384, 1024, 1024, 1024, 1024]
    - [46, 12097.0]
  - - [1024, 1024, 1, 10240, 1024, 1024, 1024, 1024]
    - [47, 11904.0]
  - - [1024, 1024, 1, 10496, 1024, 1024, 1024, 1024]
    - [46, 11934.0]
  - - [1024, 1024, 1, 10224, 1024, 1024, 1024, 1024]
    - [46, 11930.0]
  - - [1024, 1024, 1, 10192, 1024, 1024, 1024, 1024]
    - [46, 11914.0]
  - - [1024, 1024, 1, 10208, 1024, 1024, 1024, 1024]
    - [46, 11909.0]
  - - [1024, 1024, 1, 10184, 1024, 1024, 1024, 1024]
    - [46, 11918.0]
  - - [1024, 1024, 1, 10120, 1024, 1024, 1024, 1024]
    - [46, 11924.0]
  - - [1024, 1024, 1, 10152, 1024, 1024, 1024, 1024]
    - [50, 11953.0]
  - - [1024, 1024, 1, 12288, 1024, 1024, 1024, 1024]
    - [46, 12018.0]
  - - [1024, 1024, 1, 512, 1024, 1024, 1024, 1024]
    - [81, 10207.0]
  - - [1024, 1024, 1, 200, 1024, 1024, 1024, 1024]
    - [59, 9354.0]
  - - [1024, 1024, 1, 4096, 1024, 1024, 1024, 1024]
    - [103, 10722.0]
  - - [1024, 1024, 1, 2048, 1024, 1024, 1024, 1024]
    - [81, 10607.0]
  - - [768, 768, 1, 16, 768, 768, 768, 768]
    - [99, 2537.0]
  - - [768, 768, 1, 320, 768, 768, 768, 768]
    - [59, 8634.0]
  - - [768, 768, 1, 4096, 768, 768, 768, 768]
    - [82, 10346.0]
  - - [768, 768, 1, 32, 768, 768, 768, 768]
    - [99, 3836.0]
  - - [768, 768, 1, 640, 768, 768, 768, 768]
    - [82, 9475.0]
  - - [768, 768, 1, 64, 768, 768, 768, 768]
    - [78, 5347.0]
  - - [768, 768, 1, 1280, 768, 768, 768, 768]
    - [104, 9979.0]
  - - [1024, 1024, 1, 3072, 1024, 1024, 1024, 1024]
    - [72, 10642.0]
  - - [1024, 1024, 1, 120, 1024, 1024, 1024, 1024]
    - [59, 8571.0]
  - - [1024, 1024, 1, 1, 1024, 1024, 1024, 1024]
    - [99, 213.0]
  - - [1024, 1024, 1, 20, 1024, 1024, 1024, 1024]
    - [99, 3139.0]
  - - [1024, 1024, 1, 4, 1024, 1024, 1024, 1024]
    - [78, 774.0]
  - - [1024, 1024, 1, 6, 1024, 1024, 1024, 1024]
    - [57, 1210.0]
  - - [1024, 1024, 1, 80, 1024, 1024, 1024, 1024]
    - [70, 7269.0]
  - - [128, 64, 512, 128, 128, 128, 128, 64]
    - [72, 10974.0]
  - - [512, 64, 64, 512, 512, 512, 512, 64]
    - [103, 11229.0]
  - - [64, 64, 768, 64, 64, 64, 64, 64]
    - [57, 7643.0]
  - - [1856, 448, 1, 3328, 1856, 1856, 1856, 448]
    - [108, 9963.0]
  - - [128, 6784, 1, 3328, 128, 128, 128, 6784]
    - [65, 10505.0]
  - - [2368, 448, 1, 128, 2368, 2368, 2368, 448]
    - [57, 8761.0]
  - - [256, 4288, 1, 3328, 256, 256, 256, 4288]
    - [59, 11118.0]
  - - [704, 1856, 1, 3328, 704, 704, 704, 1856]
    - [101, 11189.0]
  - - [448, 1024, 1, 1280, 448, 448, 448, 1024]
    - [101, 9465.0]
  - - [256, 1408, 1, 3328, 256, 256, 256, 1408]
    - [103, 7933.0]
  - - [704, 1856, 1, 1280, 704, 704, 704, 1856]
    - [101, 11163.0]
  - - [128, 5056, 1, 128, 128, 128, 128, 5056]
    - [101, 7383.0]
  - - [2368, 128, 1, 256, 2368, 2368, 2368, 128]
    - [57, 6340.0]
  - - [64, 5056, 1, 256, 64, 64, 64, 5056]
    - [79, 6638.0]
  - - [256, 2944, 1, 256, 256, 256, 256, 2944]
    - [81, 9041.0]
  - - [256, 1856, 1, 1280, 256, 256, 256, 1856]
    - [81, 9977.0]
  - - [128, 3584, 1, 1280, 128, 128, 128, 3584]
    - [59, 9645.0]
  - - [4288, 256, 1, 256, 4288, 4288, 4288, 256]
    - [101, 9895.0]
  - - [2944, 128, 1, 128, 2944, 2944, 2944, 128]
    - [58, 5583.0]
  - - [5888, 64, 1, 3328, 5888, 5888, 5888, 64]
    - [86, 8254.0]
  - - [2944, 256, 1, 3328, 2944, 2944, 2944, 256]
    - [59, 10358.0]
  - - [704, 1024, 1, 128, 704, 704, 704, 1024]
    - [57, 7526.0]
  - - [1408, 448, 1, 1280, 1408, 1408, 1408, 448]
    - [103, 10325.0]
  - - [1408, 704, 1, 3328, 1408, 1408, 1408, 704]
    - [103, 10116.0]
  - - [6784, 64, 1, 256, 6784, 6784, 6784, 64]
    - [103, 7303.0]
  - - [2944, 256, 1, 256, 2944, 2944, 2944, 256]
    - [103, 9016.0]
  - - [704, 1408, 1, 3328, 704, 704, 704, 1408]
    - [103, 10069.0]
  - - [2944, 256, 1, 128, 2944, 2944, 2944, 256]
    - [59, 7805.0]
  - - [448, 2944, 1, 128, 448, 448, 448, 2944]
    - [57, 9185.0]
  - - [2368, 128, 1, 3328, 2368, 2368, 2368, 128]
    - [104, 9058.0]
  - - [2944, 128, 1, 256, 2944, 2944, 2944, 128]
    - [59, 6440.0]
  - - [448, 1408, 1, 256, 448, 448, 448, 1408]
    - [57, 8700.0]
  - - [64, 5056, 1, 3328, 64, 64, 64, 5056]
    - [101, 9372.0]
  - - [1024, 448, 1, 128, 1024, 1024, 1024, 448]
    - [59, 6155.0]
  - - [256, 3584, 1, 3328, 256, 256, 256, 3584]
    - [88, 11078.0]
  - - [5056, 64, 1, 1280, 5056, 5056, 5056, 64]
    - [57, 8961.0]
  - - [1024, 704, 1, 256, 1024, 1024, 1024, 704]
    - [81, 8705.0]
  - - [128, 4288, 1, 128, 128, 128, 128, 4288]
    - [103, 6457.0]
  - - [3584, 256, 1, 128, 3584, 3584, 3584, 256]
    - [103, 8389.0]
  - - [4288, 128, 1, 1280, 4288, 4288, 4288, 128]
    - [82, 8970.0]
  - - [5888, 64, 1, 256, 5888, 5888, 5888, 64]
    - [59, 6406.0]
  - - [1856, 256, 1, 1280, 1856, 1856, 1856, 256]
    - [101, 9750.0]
  - - [64, 5888, 1, 3328, 64, 64, 64, 5888]
    - [61, 8083.0]
  - - [704, 1024, 1, 1280, 704, 704, 704, 1024]
    - [103, 9622.0]
  - - [448, 1856, 1, 128, 448, 448, 448, 1856]
    - [57, 7746.0]
  - - [1024, 704, 1, 1280, 1024, 1024, 1024, 704]
    - [103, 9777.0]
  - - [128, 5888, 1, 256, 128, 128, 128, 5888]
    - [103, 9041.0]
  - - [704, 704, 1, 3328, 704, 704, 704, 704]
    - [60, 8585.0]
  - - [704, 1408, 1, 1280, 704, 704, 704, 1408]
    - [57, 9997.0]
  - - [3584, 256, 1, 3328, 3584, 3584, 3584, 256]
    - [65, 11052.0]
  - - [704, 1856, 1, 128, 704, 704, 704, 1856]
    - [79, 9735.0]
  - - [128, 3584, 1, 3328, 128, 128, 128, 3584]
    - [81, 10010.0]
  - - [128, 2944, 1, 1280, 128, 128, 128, 2944]
    - [59, 8007.0]
  - - [3584, 128, 1, 256, 3584, 3584, 3584, 128]
    - [59, 7686.0]
  - - [448, 1408, 1, 3328, 448, 448, 448, 1408]
    - [79, 10426.0]
  - - [256, 3584, 1, 256, 256, 256, 256, 3584]
    - [59, 9556.0]
  - - [256, 2944, 1, 3328, 256, 256, 256, 2944]
    - [81, 10393.0]
  - - [448, 2368, 1, 128, 448, 448, 448, 2368]
    - [57, 8841.0]
  - - [1408, 704, 1, 256, 1408, 1408, 1408, 704]
    - [59, 9207.0]
  - - [448, 2944, 1, 3328, 448, 448, 448, 2944]
    - [79, 10603.0]
  - - [64, 5888, 1, 256, 64, 64, 64, 5888]
    - [101, 6338.0]
  - - [6784, 128, 1, 3328, 6784, 6784, 6784, 128]
    - [76, 10506.0]
  - - [704, 704, 1, 256, 704, 704, 704, 704]
    - [57, 7160.0]
  - - [448, 704, 1, 1280, 448, 448, 448, 704]
    - [79, 8861.0]
  - - [1024, 448, 1, 3328, 1024, 1024, 1024, 448]
    - [86, 9973.0]
  - - [1856, 704, 1, 1280, 1856, 1856, 1856, 704]
    - [79, 11122.0]
  - - [448, 1408, 1, 1280, 448, 448, 448, 1408]
    - [57, 10136.0]
  - - [1024, 1024, 1, 1280, 1024, 1024, 1024, 1024]
    - [103, 10522.0]
  - - [448, 1024, 1, 128, 448, 448, 448, 1024]
    - [57, 6104.0]
  - - [448, 2368, 1, 3328, 448, 448, 448, 2368]
    - [101, 10486.0]
  - - [5056, 64, 1, 128, 5056, 5056, 5056, 64]
    - [71, 5436.0]
  - - [704, 1024, 1, 256, 704, 704, 704, 1024]
    - [101, 8544.0]
  - - [128, 6784, 1, 1280, 128, 128, 128, 6784]
    - [65, 10212.0]
  - - [1856, 256, 1, 256, 1856, 1856, 1856, 256]
    - [57, 7992.0]
  - - [256, 4288, 1, 1280, 256, 256, 256, 4288]
    - [81, 10972.0]
  - - [256, 1856, 1, 128, 256, 256, 256, 1856]
    - [59, 6375.0]
  - - [448, 1408, 1, 128, 448, 448, 448, 1408]
    - [101, 7300.0]
  - - [6784, 128, 1, 256, 6784, 6784, 6784, 128]
    - [103, 9073.0]
  - - [704, 448, 1, 256, 704, 704, 704, 448]
    - [57, 6640.0]
  - - [704, 1408, 1, 128, 704, 704, 704, 1408]
    - [101, 8414.0]
  - - [2944, 448, 1, 128, 2944, 2944, 2944, 448]
    - [57, 9155.0]
  - - [128, 2944, 1, 128, 128, 128, 128, 2944]
    - [58, 5622.0]
  - - [1024, 704, 1, 3328, 1024, 1024, 1024, 704]
    - [81, 9970.0]
  - - [128, 4288, 1, 256, 128, 128, 128, 4288]
    - [59, 7737.0]
  - - [704, 448, 1, 3328, 704, 704, 704, 448]
    - [101, 9266.0]
  - - [1024, 1024, 1, 3328, 1024, 1024, 1024, 1024]
    - [103, 10665.0]
  - - [448, 2368, 1, 1280, 448, 448, 448, 2368]
    - [101, 10333.0]
  - - [64, 6784, 1, 3328, 64, 64, 64, 6784]
    - [83, 9170.0]
  - - [2944, 256, 1, 1280, 2944, 2944, 2944, 256]
    - [103, 10174.0]
  - - [256, 2368, 1, 128, 256, 256, 256, 2368]
    - [70, 7042.0]
  - - [1856, 704, 1, 256, 1856, 1856, 1856, 704]
    - [57, 10473.0]
  - - [1408, 448, 1, 3328, 1408, 1408, 1408, 448]
    - [106, 10697.0]
  - - [2368, 256, 1, 256, 2368, 2368, 2368, 256]
    - [101, 8398.0]
  - - [1856, 448, 1, 1280, 1856, 1856, 1856, 448]
    - [82, 9571.0]
  - - [128, 5888, 1, 128, 128, 128, 128, 5888]
    - [103, 7705.0]
  - - [1024, 1024, 1, 256, 1024, 1024, 1024, 1024]
    - [59, 9740.0]
  - - [704, 1856, 1, 256, 704, 704, 704, 1856]
    - [57, 10519.0]
  - - [128, 4288, 1, 3328, 128, 128, 128, 4288]
    - [82, 9463.0]
  - - [256, 2368, 1, 1280, 256, 256, 256, 2368]
    - [81, 9948.0]
  - - [2944, 448, 1, 256, 2944, 2944, 2944, 448]
    - [101, 9878.0]
  - - [1856, 448, 1, 128, 1856, 1856, 1856, 448]
    - [57, 7701.0]
  - - [2368, 128, 1, 1280, 2368, 2368, 2368, 128]
    - [57, 8416.0]
  - - [64, 6784, 1, 256, 64, 64, 64, 6784]
    - [57, 7180.0]
  - - [64, 5056, 1, 1280, 64, 64, 64, 5056]
    - [79, 8900.0]
  - - [2368, 256, 1, 1280, 2368, 2368, 2368, 256]
    - [60, 10015.0]
  - - [2368, 448, 1, 1280, 2368, 2368, 2368, 448]
    - [81, 10437.0]
  - - [128, 3584, 1, 256, 128, 128, 128, 3584]
    - [103, 7809.0]
  - - [704, 448, 1, 1280, 704, 704, 704, 448]
    - [57, 8826.0]
  - - [128, 5056, 1, 256, 128, 128, 128, 5056]
    - [103, 9024.0]
  - - [4288, 256, 1, 1280, 4288, 4288, 4288, 256]
    - [59, 10784.0]
  - - [4288, 128, 1, 3328, 4288, 4288, 4288, 128]
    - [82, 9486.0]
  - - [1408, 256, 1, 128, 1408, 1408, 1408, 256]
    - [58, 5402.0]
  - - [256, 1408, 1, 1280, 256, 256, 256, 1408]
    - [81, 7631.0]
  - - [128, 2368, 1, 256, 128, 128, 128, 2368]
    - [94, 6434.0]
  - - [6784, 64, 1, 3328, 6784, 6784, 6784, 64]
    - [86, 9435.0]
  - - [128, 2944, 1, 3328, 128, 128, 128, 2944]
    - [59, 8282.0]
  - - [2944, 448, 1, 3328, 2944, 2944, 2944, 448]
    - [79, 10603.0]
  - - [256, 4288, 1, 256, 256, 256, 256, 4288]
    - [103, 10080.0]
  - - [5888, 128, 1, 256, 5888, 5888, 5888, 128]
    - [59, 8908.0]
  - - [2368, 448, 1, 3328, 2368, 2368, 2368, 448]
    - [103, 10736.0]
  - - [5056, 64, 1, 256, 5056, 5056, 5056, 64]
    - [57, 6746.0]
  - - [1024, 704, 1, 128, 1024, 1024, 1024, 704]
    - [81, 7454.0]
  - - [128, 5056, 1, 3328, 128, 128, 128, 5056]
    - [60, 11060.0]
  - - [4288, 128, 1, 256, 4288, 4288, 4288, 128]
    - [101, 7562.0]
  - - [1408, 448, 1, 128, 1408, 1408, 1408, 448]
    - [103, 7380.0]
  - - [128, 5888, 1, 1280, 128, 128, 128, 5888]
    - [59, 10204.0]
  - - [704, 448, 1, 128, 704, 704, 704, 448]
    - [102, 5368.0]
  - - [3584, 256, 1, 256, 3584, 3584, 3584, 256]
    - [104, 9479.0]
  - - [128, 2944, 1, 256, 128, 128, 128, 2944]
    - [103, 6518.0]
  - - [128, 6784, 1, 128, 128, 128, 128, 6784]
    - [101, 7940.0]
  - - [448, 1856, 1, 256, 448, 448, 448, 1856]
    - [79, 8604.0]
  - - [3584, 128, 1, 3328, 3584, 3584, 3584, 128]
    - [63, 9963.0]
  - - [1024, 448, 1, 1280, 1024, 1024, 1024, 448]
    - [103, 9576.0]
  - - [5888, 128, 1, 3328, 5888, 5888, 5888, 128]
    - [59, 10339.0]
  - - [1408, 704, 1, 1280, 1408, 1408, 1408, 704]
    - [101, 10043.0]
  - - [448, 2944, 1, 256, 448, 448, 448, 2944]
    - [101, 9884.0]
  - - [448, 2368, 1, 256, 448, 448, 448, 2368]
    - [101, 9583.0]
  - - [128, 2368, 1, 3328, 128, 128, 128, 2368]
    - [59, 9070.0]
  - - [5056, 128, 1, 1280, 5056, 5056, 5056, 128]
    - [60, 10465.0]
  - - [5056, 64, 1, 3328, 5056, 5056, 5056, 64]
    - [101, 9389.0]
  - - [64, 5888, 1, 128, 64, 64, 64, 5888]
    - [102, 5583.0]
  - - [5056, 128, 1, 3328, 5056, 5056, 5056, 128]
    - [60, 11061.0]
  - - [448, 704, 1, 256, 448, 448, 448, 704]
    - [79, 6596.0]
  - - [2944, 128, 1, 3328, 2944, 2944, 2944, 128]
    - [63, 8267.0]
  - - [128, 5056, 1, 1280, 128, 128, 128, 5056]
    - [81, 10580.0]
  - - [704, 704, 1, 128, 704, 704, 704, 704]
    - [100, 6147.0]
  - - [64, 6784, 1, 1280, 64, 64, 64, 6784]
    - [57, 8847.0]
  - - [2368, 128, 1, 128, 2368, 2368, 2368, 128]
    - [100, 5146.0]
  - - [5056, 128, 1, 128, 5056, 5056, 5056, 128]
    - [57, 7449.0]
  - - [1024, 1024, 1, 1024, 1024, 1024, 1024, 1024]
    - [81, 10455.0]
  - - [448, 1024, 1, 3328, 448, 448, 448, 1024]
    - [101, 9772.0]
  - - [256, 2368, 1, 3328, 256, 256, 256, 2368]
    - [60, 10411.0]
  - - [256, 3584, 1, 128, 256, 256, 256, 3584]
    - [81, 8486.0]
  - - [4288, 256, 1, 128, 4288, 4288, 4288, 256]
    - [101, 8950.0]
  - - [2368, 256, 1, 128, 2368, 2368, 2368, 256]
    - [57, 7132.0]
  - - [256, 1856, 1, 256, 256, 256, 256, 1856]
    - [57, 8034.0]
  - - [256, 2944, 1, 128, 256, 256, 256, 2944]
    - [103, 7843.0]
  - - [1408, 256, 1, 3328, 1408, 1408, 1408, 256]
    - [81, 7954.0]
  - - [2368, 448, 1, 256, 2368, 2368, 2368, 448]
    - [79, 9610.0]
  - - [4288, 256, 1, 3328, 4288, 4288, 4288, 256]
    - [59, 11056.0]
  - - [1856, 704, 1, 128, 1856, 1856, 1856, 704]
    - [101, 9701.0]
  - - [4288, 128, 1, 128, 4288, 4288, 4288, 128]
    - [102, 6422.0]
  - - [1408, 448, 1, 256, 1408, 1408, 1408, 448]
    - [103, 8814.0]
  - - [6784, 64, 1, 1280, 6784, 6784, 6784, 64]
    - [103, 9066.0]
  - - [3584, 128, 1, 128, 3584, 3584, 3584, 128]
    - [57, 6168.0]
  - - [256, 2368, 1, 256, 256, 256, 256, 2368]
    - [81, 8565.0]
  - - [2944, 448, 1, 1280, 2944, 2944, 2944, 448]
    - [101, 10537.0]
  - - [448, 1856, 1, 1280, 448, 448, 448, 1856]
    - [82, 9576.0]
  - - [1856, 256, 1, 128, 1856, 1856, 1856, 256]
    - [80, 6270.0]
  - - [5056, 128, 1, 256, 5056, 5056, 5056, 128]
    - [79, 8822.0]
  - - [448, 1024, 1, 256, 448, 448, 448, 1024]
    - [79, 7696.0]
  - - [64, 6784, 1, 128, 64, 64, 64, 6784]
    - [70, 5753.0]
  - - [5888, 64, 1, 1280, 5888, 5888, 5888, 64]
    - [81, 7915.0]
  - - [128, 3584, 1, 128, 128, 128, 128, 3584]
    - [103, 6130.0]
  - - [1408, 256, 1, 256, 1408, 1408, 1408, 256]
    - [81, 6269.0]
  - - [128, 5888, 1, 3328, 128, 128, 128, 5888]
    - [72, 10335.0]
  - - [1408, 256, 1, 1280, 1408, 1408, 1408, 256]
    - [103, 7654.0]
  - - [64, 5056, 1, 128, 64, 64, 64, 5056]
    - [80, 5436.0]
  - - [5888, 64, 1, 128, 5888, 5888, 5888, 64]
    - [58, 5494.0]
  - - [448, 704, 1, 128, 448, 448, 448, 704]
    - [80, 5412.0]
  - - [1408, 704, 1, 128, 1408, 1408, 1408, 704]
    - [81, 8504.0]
  - - [2368, 256, 1, 3328, 2368, 2368, 2368, 256]
    - [60, 10472.0]
  - - [5888, 128, 1, 1280, 5888, 5888, 5888, 128]
    - [103, 10155.0]
  - - [256, 3584, 1, 1280, 256, 256, 256, 3584]
    - [88, 10770.0]
  - - [256, 1408, 1, 128, 256, 256, 256, 1408]
    - [56, 5328.0]
  - - [256, 4288, 1, 128, 256, 256, 256, 4288]
    - [59, 9042.0]
  - - [5888, 128, 1, 128, 5888, 5888, 5888, 128]
    - [79, 7560.0]
  - - [1856, 256, 1, 3328, 1856, 1856, 1856, 256]
    - [59, 10185.0]
  - - [64, 5888, 1, 1280, 64, 64, 64, 5888]
    - [79, 7767.0]
  - - [6784, 64, 1, 128, 6784, 6784, 6784, 64]
    - [59, 5789.0]
  - - [704, 704, 1, 1280, 704, 704, 704, 704]
    - [57, 8319.0]
  - - [128, 2368, 1, 1280, 128, 128, 128, 2368]
    - [81, 8637.0]
  - - [3584, 256, 1, 1280, 3584, 3584, 3584, 256]
    - [108, 10788.0]
  - - [3584, 128, 1, 1280, 3584, 3584, 3584, 128]
    - [94, 9502.0]
  - - [448, 1856, 1, 3328, 448, 448, 448, 1856]
    - [88, 9953.0]
  - - [1024, 448, 1, 256, 1024, 1024, 1024, 448]
    - [59, 7788.0]
  - - [2944, 128, 1, 1280, 2944, 2944, 2944, 128]
    - [81, 7939.0]
  - - [128, 2368, 1, 128, 128, 128, 128, 2368]
    - [58, 5159.0]
  - - [256, 2944, 1, 1280, 256, 256, 256, 2944]
    - [103, 10174.0]
  - - [704, 1024, 1, 3328, 704, 704, 704, 1024]
    - [81, 9901.0]
  - - [128, 6784, 1, 256, 128, 128, 128, 6784]
    - [103, 9073.0]
  - - [256, 1856, 1, 3328, 256, 256, 256, 1856]
    - [106, 10304.0]
  - - [6784, 128, 1, 128, 6784, 6784, 6784, 128]
    - [103, 7985.0]
  - - [704, 1408, 1, 256, 704, 704, 704, 1408]
    - [79, 9288.0]
  - - [256, 1408, 1, 256, 256, 256, 256, 1408]
    - [103, 6277.0]
  - - [448, 2944, 1, 1280, 448, 448, 448, 2944]
    - [79, 10571.0]
  - - [6784, 128, 1, 1280, 6784, 6784, 6784, 128]
    - [65, 10218.0]
  - - [1856, 448, 1, 256, 1856, 1856, 1856, 448]
    - [59, 8549.0]
  - - [128, 4288, 1, 1280, 128, 128, 128, 4288]
    - [94, 9030.0]
  - - [448, 704, 1, 3328, 448, 448, 448, 704]
    - [101, 9225.0]
  - - [1856, 704, 1, 3328, 1856, 1856, 1856, 704]
    - [79, 11175.0]
  - - [3136, 64, 128, 64, 3136, 3136, 3136, 64]
    - [55, 5944.0]
  - - [3136, 64, 128, 256, 3136, 3136, 3136, 64]
    - [59, 8825.0]
  - - [3136, 64, 256, 256, 3136, 3136, 3136, 64]
    - [57, 8742.0]
  - - [3136, 64, 256, 64, 3136, 3136, 3136, 64]
    - [86, 5461.0]
  - - [64, 1536, 64, 384, 64, 64, 64, 1536]
    - [79, 9684.0]
  - - [64, 1536, 64, 256, 64, 64, 64, 1536]
    - [70, 9718.0]
  - - [64, 92, 688, 92, 64, 64, 64, 92]
    - [79, 7195.0]
  - - [1024, 1024, 1, 3975, 1024, 1024, 1024, 1024]
    - [81, 10693.0]
  - - [64, 123, 528, 123, 64, 64, 64, 123]
    - [79, 9116.0]
  - - [64, 102, 624, 100, 64, 64, 64, 102]
    - [79, 7738.0]
  - - [64, 112, 576, 111, 64, 64, 64, 112]
    - [57, 8487.0]
  - - [64, 102, 624, 102, 64, 64, 64, 102]
    - [101, 7769.0]
  - - [64, 133, 480, 135, 64, 64, 64, 133]
    - [57, 7535.0]
  - - [1024, 1024, 1, 4026, 1024, 1024, 1024, 1024]
    - [103, 10710.0]
  - - [64, 160, 400, 159, 64, 64, 64, 160]
    - [79, 8963.0]
  - - [1024, 1024, 1, 3780, 1024, 1024, 1024, 1024]
    - [103, 10646.0]
  - - [64, 228, 272, 232, 64, 64, 64, 228]
    - [101, 9825.0]
  - - [1024, 1024, 1, 3822, 1024, 1024, 1024, 1024]
    - [81, 10674.0]
  - - [64, 77, 816, 77, 64, 64, 64, 77]
    - [79, 6003.0]
  - - [64, 159, 400, 159, 64, 64, 64, 159]
    - [79, 8873.0]
  - - [64, 135, 480, 134, 64, 64, 64, 135]
    - [57, 7602.0]
  - - [64, 99, 624, 99, 64, 64, 64, 99]
    - [79, 7530.0]
  - - [1024, 1024, 1, 3942, 1024, 1024, 1024, 1024]
    - [81, 10655.0]
  - - [1024, 1024, 1, 3861, 1024, 1024, 1024, 1024]
    - [81, 10645.0]
  - - [1024, 1024, 1, 4000, 1024, 1024, 1024, 1024]
    - [81, 10703.0]
  - - [1024, 1024, 1, 3870, 1024, 1024, 1024, 1024]
    - [81, 10676.0]
  - - [64, 65, 992, 65, 64, 64, 64, 65]
    - [57, 5182.0]
  - - [64, 133, 480, 133, 64, 64, 64, 133]
    - [57, 7535.0]
  - - [64, 232, 272, 232, 64, 64, 64, 232]
    - [79, 9949.0]
  - - [64, 148, 432, 148, 64, 64, 64, 148]
    - [101, 8372.0]
  - - [1024, 1024, 1, 4032, 1024, 1024, 1024, 1024]
    - [103, 10685.0]
  - - [1024, 1024, 1, 4012, 1024, 1024, 1024, 1024]
    - [81, 10664.0]
  - - [1024, 1024, 1, 3681, 1024, 1024, 1024, 1024]
    - [114, 10658.0]
  - - [1024, 1024, 1, 3927, 1024, 1024, 1024, 1024]
    - [94, 10655.0]
  - - [1024, 1024, 1, 3894, 1024, 1024, 1024, 1024]
    - [81, 10655.0]
  - - [64, 132, 480, 135, 64, 64, 64, 132]
    - [79, 7509.0]
  - - [64, 135, 480, 135, 64, 64, 64, 135]
    - [79, 7653.0]
  - - [1024, 1024, 1, 3876, 1024, 1024, 1024, 1024]
    - [103, 10670.0]
  - - [64, 84, 752, 85, 64, 64, 64, 84]
    - [57, 6624.0]
  - - [1024, 1024, 1, 4050, 1024, 1024, 1024, 1024]
    - [81, 10681.0]
  - - [64, 132, 480, 132, 64, 64, 64, 132]
    - [57, 7484.0]
  - - [64, 99, 624, 102, 64, 64, 64, 99]
    - [57, 7638.0]
  - - [64, 143, 432, 148, 64, 64, 64, 143]
    - [101, 8018.0]
  - - [1024, 1024, 1, 3584, 1024, 1024, 1024, 1024]
    - [81, 10678.0]
  - - [64, 162, 400, 162, 64, 64, 64, 162]
    - [101, 9094.0]
  - - [64, 148, 432, 147, 64, 64, 64, 148]
    - [79, 8396.0]
  - - [1024, 1024, 1, 3960, 1024, 1024, 1024, 1024]
    - [81, 10670.0]
  - - [64, 123, 528, 122, 64, 64, 64, 123]
    - [57, 9062.0]
  - - [64, 102, 624, 101, 64, 64, 64, 102]
    - [101, 7725.0]
  - - [1024, 1024, 1, 3978, 1024, 1024, 1024, 1024]
    - [81, 10689.0]
  - - [64, 160, 400, 160, 64, 64, 64, 160]
    - [79, 9017.0]
  - - [1024, 1024, 1, 3995, 1024, 1024, 1024, 1024]
    - [103, 10687.0]
  - - [64, 132, 480, 134, 64, 64, 64, 132]
    - [57, 7581.0]
  - - [64, 111, 576, 111, 64, 64, 64, 111]
    - [79, 8252.0]
  - - [64, 100, 624, 100, 64, 64, 64, 100]
    - [79, 7633.0]
  - - [1024, 1024, 1, 3977, 1024, 1024, 1024, 1024]
    - [81, 10674.0]
  - - [64, 112, 576, 112, 64, 64, 64, 112]
    - [57, 8472.0]
  - - [64, 159, 400, 162, 64, 64, 64, 159]
    - [57, 8865.0]
  - - [64, 122, 528, 122, 64, 64, 64, 122]
    - [101, 9108.0]
  - - [64, 228, 272, 228, 64, 64, 64, 228]
    - [57, 9689.0]
  - - [1024, 1024, 1, 3925, 1024, 1024, 1024, 1024]
    - [81, 10665.0]
  - - [64, 93, 688, 93, 64, 64, 64, 93]
    - [79, 7224.0]
  - - [1024, 1024, 1, 3956, 1024, 1024, 1024, 1024]
    - [81, 10685.0]
  - - [1024, 1024, 1, 3976, 1024, 1024, 1024, 1024]
    - [81, 10676.0]
  - - [64, 111, 576, 112, 64, 64, 64, 111]
    - [79, 8500.0]
  - - [64, 100, 624, 102, 64, 64, 64, 100]
    - [79, 7706.0]
  - - [1024, 1024, 1, 3955, 1024, 1024, 1024, 1024]
    - [103, 10679.0]
  - - [1024, 1024, 1, 4030, 1024, 1024, 1024, 1024]
    - [103, 10661.0]
  - - [1024, 1024, 1, 3906, 1024, 1024, 1024, 1024]
    - [103, 10659.0]
  - - [64, 101, 624, 102, 64, 64, 64, 101]
    - [79, 7713.0]
  - - [1024, 1024, 1, 3796, 1024, 1024, 1024, 1024]
    - [103, 10674.0]
  - - [1024, 1024, 1, 3859, 1024, 1024, 1024, 1024]
    - [103, 10694.0]
  - - [64, 71, 896, 71, 64, 64, 64, 71]
    - [57, 5609.0]
  - - [1024, 1024, 1, 3860, 1024, 1024, 1024, 1024]
    - [114, 10649.0]
  - - [1024, 1024, 1, 4005, 1024, 1024, 1024, 1024]
    - [81, 10658.0]
  - - [64, 84, 752, 84, 64, 64, 64, 84]
    - [57, 6597.0]
  - - [1024, 1024, 1, 3990, 1024, 1024, 1024, 1024]
    - [103, 10662.0]
  - - [64, 134, 480, 134, 64, 64, 64, 134]
    - [57, 7625.0]
  - - [64, 78, 816, 78, 64, 64, 64, 78]
    - [101, 6153.0]
  - - [1024, 1024, 1, 3999, 1024, 1024, 1024, 1024]
    - [103, 10668.0]
  - - [1024, 1024, 1, 4020, 1024, 1024, 1024, 1024]
    - [103, 10667.0]
  - - [1024, 1024, 1, 3939, 1024, 1024, 1024, 1024]
    - [103, 10684.0]
  - - [64, 77, 816, 78, 64, 64, 64, 77]
    - [57, 6121.0]
  - - [1024, 1024, 1, 4059, 1024, 1024, 1024, 1024]
    - [103, 10655.0]
  - - [1024, 1024, 1, 3944, 1024, 1024, 1024, 1024]
    - [103, 10674.0]
  - - [64, 193, 320, 193, 64, 64, 64, 193]
    - [70, 8359.0]
  - - [1024, 1024, 1, 3720, 1024, 1024, 1024, 1024]
    - [103, 10650.0]
  - - [1024, 1024, 1, 3910, 1024, 1024, 1024, 1024]
    - [103, 10654.0]
  - - [64, 143, 432, 143, 64, 64, 64, 143]
    - [57, 8063.0]
  - - [64, 92, 688, 93, 64, 64, 64, 92]
    - [57, 7242.0]
  - - [64, 101, 624, 101, 64, 64, 64, 101]
    - [101, 7672.0]
  - - [1024, 1024, 1, 3969, 1024, 1024, 1024, 1024]
    - [103, 10659.0]
  - - [1024, 1024, 1, 3948, 1024, 1024, 1024, 1024]
    - [103, 10693.0]
  - - [1024, 1024, 1, 3996, 1024, 1024, 1024, 1024]
    - [81, 10671.0]
  - - [1024, 1024, 1, 3900, 1024, 1024, 1024, 1024]
    - [103, 10699.0]
  - - [1024, 1024, 1, 3640, 1024, 1024, 1024, 1024]
    - [103, 10676.0]
  - - [64, 147, 432, 147, 64, 64, 64, 147]
    - [79, 8319.0]
  - - [1024, 1024, 1, 3751, 1024, 1024, 1024, 1024]
    - [103, 10657.0]
  - - [64, 177, 352, 177, 64, 64, 64, 177]
    - [79, 9800.0]
  - - [64, 85, 752, 85, 64, 64, 64, 85]
    - [79, 6682.0]
  - - [1024, 1024, 1, 3712, 1024, 1024, 1024, 1024]
    - [81, 10643.0]
  - - [1024, 1024, 1, 128, 1024, 1024, 1024, 1024]
    - [59, 8693.0]
  - - [64, 256, 192, 256, 64, 64, 64, 256]
    - [70, 10885.0]
  - - [64, 128, 384, 128, 64, 64, 64, 128]
    - [57, 10448.0]
  - - [64, 192, 36, 25088, 64, 64, 64, 192]
    - [92, 8413.0]
  - - [128, 128, 64, 25, 128, 128, 128, 128]
    - [68, 3766.0]
  - - [64, 192, 64, 3200, 64, 64, 64, 192]
    - [92, 8753.0]
  - - [64, 128, 64, 23104, 64, 64, 64, 128]
    - [78, 7188.0]
  - - [128, 128, 64, 1600, 128, 128, 128, 128]
    - [74, 10363.0]
  - - [80, 192, 64, 4608, 80, 80, 80, 192]
    - [63, 7066.0]
  - - [64, 128, 36, 30, 64, 64, 64, 128]
    - [118, 2280.0]
  - - [64, 128, 64, 11552, 64, 64, 64, 128]
    - [85, 7149.0]
  - - [128, 192, 64, 946, 128, 128, 128, 192]
    - [81, 11023.0]
  - - [64, 192, 64, 12800, 64, 64, 64, 192]
    - [79, 8212.0]
  - - [224, 224, 64, 128, 224, 224, 224, 224]
    - [57, 8101.0]
  - - [128, 128, 64, 3360, 128, 128, 128, 128]
    - [106, 10322.0]
  - - [128, 128, 64, 420, 128, 128, 128, 128]
    - [103, 9923.0]
  - - [64, 128, 64, 361, 64, 64, 64, 128]
    - [57, 7565.0]
  - - [64, 128, 36, 53824, 64, 64, 64, 128]
    - [113, 7649.0]
  - - [128, 160, 36, 512, 128, 128, 128, 160]
    - [81, 7998.0]
  - - [147, 64, 36, 18816, 147, 147, 147, 64]
    - [105, 7311.0]
  - - [96, 128, 64, 946, 96, 96, 96, 128]
    - [59, 7689.0]
  - - [128, 128, 64, 50, 128, 128, 128, 128]
    - [58, 5601.0]
  - - [160, 224, 36, 128, 160, 160, 160, 224]
    - [57, 6659.0]
  - - [192, 224, 64, 1152, 192, 192, 192, 224]
    - [79, 10064.0]
  - - [128, 128, 36, 784, 128, 128, 128, 128]
    - [82, 9606.0]
  - - [96, 128, 64, 288, 96, 96, 96, 128]
    - [57, 6948.0]
  - - [128, 128, 64, 400, 128, 128, 128, 128]
    - [103, 9906.0]
  - - [128, 128, 64, 800, 128, 128, 128, 128]
    - [94, 10223.0]
  - - [96, 128, 36, 512, 96, 96, 96, 128]
    - [103, 6599.0]
  - - [96, 128, 64, 800, 96, 96, 96, 128]
    - [81, 7630.0]
  - - [192, 224, 64, 128, 192, 192, 192, 224]
    - [57, 8969.0]
  - - [128, 128, 64, 288, 128, 128, 128, 128]
    - [81, 9636.0]
  - - [96, 208, 36, 512, 96, 96, 96, 208]
    - [81, 6114.0]
  - - [64, 128, 36, 1568, 64, 64, 64, 128]
    - [79, 8249.0]
  - - [192, 192, 36, 512, 192, 192, 192, 192]
    - [79, 10230.0]
  - - [128, 128, 36, 512, 128, 128, 128, 128]
    - [104, 9218.0]
  - - [96, 208, 64, 1152, 96, 96, 96, 208]
    - [103, 6985.0]
  - - [128, 192, 64, 3200, 128, 128, 128, 192]
    - [86, 11258.0]
  - - [160, 160, 64, 288, 160, 160, 160, 160]
    - [79, 7298.0]
  - - [128, 128, 36, 440, 128, 128, 128, 128]
    - [60, 9030.0]
  - - [96, 128, 36, 1568, 96, 96, 96, 128]
    - [60, 7352.0]
  - - [112, 224, 36, 2048, 112, 112, 112, 224]
    - [108, 8232.0]
  - - [128, 128, 36, 7040, 128, 128, 128, 128]
    - [98, 10414.0]
  - - [128, 128, 36, 1568, 128, 128, 128, 128]
    - [82, 10020.0]
  - - [160, 224, 64, 128, 160, 160, 160, 224]
    - [79, 7422.0]
  - - [192, 224, 36, 2592, 192, 192, 192, 224]
    - [79, 9733.0]
  - - [64, 128, 64, 2888, 64, 64, 64, 128]
    - [70, 8050.0]
  - - [64, 128, 36, 480, 64, 64, 64, 128]
    - [79, 7078.0]
  - - [147, 64, 64, 9702, 147, 147, 147, 64]
    - [113, 7489.0]
  - - [64, 192, 64, 3698, 64, 64, 64, 192]
    - [70, 8677.0]
  - - [73, 192, 64, 10439, 73, 73, 73, 192]
    - [106, 6481.0]
  - - [128, 128, 36, 880, 128, 128, 128, 128]
    - [104, 9705.0]
  - - [192, 224, 36, 128, 192, 192, 192, 224]
    - [57, 8122.0]
  - - [64, 128, 36, 12544, 64, 64, 64, 128]
    - [57, 7728.0]
  - - [160, 160, 36, 512, 160, 160, 160, 160]
    - [57, 7077.0]
  - - [128, 128, 36, 3136, 128, 128, 128, 128]
    - [88, 10225.0]
  - - [112, 224, 36, 512, 112, 112, 112, 224]
    - [59, 7648.0]
  - - [128, 128, 36, 49, 128, 128, 128, 128]
    - [99, 4314.0]
  - - [112, 224, 64, 1152, 112, 112, 112, 224]
    - [103, 8728.0]
  - - [128, 192, 36, 1568, 128, 128, 128, 192]
    - [59, 10147.0]
  - - [128, 192, 36, 512, 128, 128, 128, 192]
    - [81, 9746.0]
  - - [192, 192, 64, 288, 192, 192, 192, 192]
    - [101, 10650.0]
  - - [96, 208, 64, 242, 96, 96, 96, 208]
    - [70, 6327.0]
  - - [64, 128, 64, 5776, 64, 64, 64, 128]
    - [80, 7144.0]
  - - [128, 192, 64, 288, 128, 128, 128, 192]
    - [81, 10535.0]
  - - [96, 128, 36, 6272, 96, 96, 96, 128]
    - [76, 7748.0]
  - - [96, 128, 64, 3200, 96, 96, 96, 128]
    - [74, 7874.0]
  - - [128, 192, 64, 800, 128, 128, 128, 192]
    - [81, 11003.0]
  - - [64, 128, 64, 10, 64, 64, 64, 128]
    - [64, 1498.0]
  - - [96, 208, 64, 288, 96, 96, 96, 208]
    - [103, 6540.0]
  - - [64, 128, 64, 160, 64, 64, 64, 128]
    - [57, 6433.0]
  - - [128, 128, 64, 1568, 128, 128, 128, 128]
    - [74, 10355.0]
  - - [112, 224, 64, 242, 112, 112, 112, 224]
    - [101, 8031.0]
  - - [160, 192, 64, 288, 160, 160, 160, 192]
    - [113, 8722.0]
  - - [128, 160, 64, 288, 128, 128, 128, 160]
    - [81, 8714.0]
  - - [128, 128, 64, 210, 128, 128, 128, 128]
    - [103, 9260.0]
  - - [73, 192, 36, 23360, 73, 73, 73, 192]
    - [63, 5965.0]
  - - [160, 192, 36, 512, 160, 160, 160, 192]
    - [79, 8451.0]
  - - [64, 128, 64, 722, 64, 64, 64, 128]
    - [79, 8130.0]
  - - [112, 224, 64, 288, 112, 112, 112, 224]
    - [101, 8096.0]
  - - [64, 192, 36, 6272, 64, 64, 64, 192]
    - [79, 8369.0]
  - - [64, 128, 36, 6272, 64, 64, 64, 128]
    - [109, 8203.0]
  - - [128, 128, 36, 3200, 128, 128, 128, 128]
    - [65, 10212.0]
  - - [128, 128, 36, 392, 128, 128, 128, 128]
    - [60, 8893.0]
  - - [80, 192, 36, 10368, 80, 80, 80, 192]
    - [106, 6508.0]
  - - [224, 224, 36, 128, 224, 224, 224, 224]
    - [57, 7531.0]
  - - [64, 128, 36, 784, 64, 64, 64, 128]
    - [79, 7702.0]
  - - [128, 128, 64, 200, 128, 128, 128, 128]
    - [81, 9304.0]
  - - [5329, 64, 32, 80, 5329, 5329, 5329, 64]
    - [81, 10565.0]
  - - [64, 2048, 32, 384, 64, 64, 64, 2048]
    - [101, 11197.0]
  - - [289, 1792, 1, 320, 289, 289, 289, 1792]
    - [79, 7256.0]
  - - [1001, 1024, 1, 32, 1001, 1001, 1001, 1024]
    - [107, 4481.0]
  - - [784, 400, 1, 32, 784, 784, 784, 400]
    - [99, 2472.0]
  - - [64, 1536, 32, 256, 64, 64, 64, 1536]
    - [79, 11148.0]
  - - [289, 2592, 1, 384, 289, 289, 289, 2592]
    - [101, 7758.0]
  - - [64, 2048, 32, 448, 64, 64, 64, 2048]
    - [92, 10438.0]
  - - [289, 2016, 1, 256, 289, 289, 289, 2016]
    - [79, 7673.0]
  - - [64, 1536, 32, 384, 64, 64, 64, 1536]
    - [79, 11237.0]
  - - [64, 1280, 32, 320, 64, 64, 64, 1280]
    - [57, 10974.0]
  - - [289, 3456, 1, 384, 289, 289, 289, 3456]
    - [57, 9050.0]
  - - [64, 1280, 32, 384, 64, 64, 64, 1280]
    - [57, 11126.0]
  - - [729, 1600, 1, 192, 729, 729, 729, 1600]
    - [81, 9111.0]
  - - [289, 1344, 1, 192, 289, 289, 289, 1344]
    - [57, 5728.0]
  - - [64, 2048, 32, 320, 64, 64, 64, 2048]
    - [113, 11267.0]
  - - [64, 1280, 32, 448, 64, 64, 64, 1280]
    - [57, 11126.0]
  - - [64, 1280, 32, 192, 64, 64, 64, 1280]
    - [70, 10704.0]
  - - [289, 1792, 1, 256, 289, 289, 289, 1792]
    - [57, 6956.0]
  - - [64, 2048, 32, 192, 64, 64, 64, 2048]
    - [92, 11117.0]
  - - [5329, 64, 128, 80, 5329, 5329, 5329, 64]
    - [84, 5695.0]
  - - [64, 1280, 128, 448, 64, 64, 64, 1280]
    - [101, 9539.0]
  - - [64, 2048, 128, 192, 64, 64, 64, 2048]
    - [70, 8299.0]
  - - [64, 1280, 128, 384, 64, 64, 64, 1280]
    - [101, 9250.0]
  - - [64, 1280, 128, 320, 64, 64, 64, 1280]
    - [57, 8903.0]
  - - [64, 1280, 128, 192, 64, 64, 64, 1280]
    - [75, 8039.0]
  - - [256, 4096, 1, 6400, 256, 256, 256, 4096]
    - [114, 10684.0]
  - - [512, 2048, 1, 3427, 512, 512, 512, 2048]
    - [81, 10652.0]
  - - [512, 2048, 1, 3552, 512, 512, 512, 2048]
    - [114, 10676.0]
  - - [512, 2048, 1, 3840, 512, 512, 512, 2048]
    - [103, 10691.0]
  - - [2048, 512, 1, 3427, 2048, 2048, 2048, 512]
    - [81, 10657.0]
  - - [2048, 512, 1, 3452, 2048, 2048, 2048, 512]
    - [81, 10655.0]
  - - [2048, 512, 1, 3472, 2048, 2048, 2048, 512]
    - [81, 10656.0]
  - - [2048, 512, 1, 3475, 2048, 2048, 2048, 512]
    - [114, 10643.0]
  - - [64, 64, 496, 64, 64, 64, 64, 64]
    - [93, 6865.0]
  - - [64, 64, 496, 65, 64, 64, 64, 64]
    - [70, 7092.0]
  - - [64, 65, 496, 65, 64, 64, 64, 65]
    - [101, 4680.0]
  - - [64, 71, 448, 71, 64, 64, 64, 71]
    - [101, 5086.0]
  - - [64, 77, 408, 77, 64, 64, 64, 77]
    - [101, 5394.0]
  - - [64, 77, 408, 78, 64, 64, 64, 77]
    - [57, 5386.0]
  - - [64, 78, 408, 78, 64, 64, 64, 78]
    - [101, 5422.0]
  - - [64, 85, 376, 85, 64, 64, 64, 85]
    - [79, 5926.0]
  - - [64, 93, 344, 93, 64, 64, 64, 93]
    - [101, 6481.0]
  - - [64, 112, 288, 112, 64, 64, 64, 112]
    - [101, 7697.0]
  - - [64, 122, 264, 122, 64, 64, 64, 122]
    - [57, 7913.0]
  - - [64, 123, 264, 122, 64, 64, 64, 123]
    - [79, 8044.0]
  - - [64, 123, 264, 123, 64, 64, 64, 123]
    - [101, 8105.0]
  - - [64, 134, 240, 134, 64, 64, 64, 134]
    - [79, 6919.0]
  - - [64, 135, 240, 134, 64, 64, 64, 135]
    - [57, 6996.0]
  - - [64, 135, 240, 135, 64, 64, 64, 135]
    - [57, 6977.0]
  - - [64, 1280, 64, 192, 64, 64, 64, 1280]
    - [57, 11222.0]
  - - [64, 1280, 64, 320, 64, 64, 64, 1280]
    - [57, 10531.0]
  - - [64, 1280, 64, 384, 64, 64, 64, 1280]
    - [79, 9697.0]
  - - [64, 1280, 64, 448, 64, 64, 64, 1280]
    - [101, 9656.0]
  - - [64, 2048, 64, 192, 64, 64, 64, 2048]
    - [70, 8659.0]
  - - [64, 2048, 64, 320, 64, 64, 64, 2048]
    - [101, 9453.0]
  - - [64, 2048, 64, 384, 64, 64, 64, 2048]
    - [57, 9732.0]
  - - [64, 2048, 64, 448, 64, 64, 64, 2048]
    - [101, 9936.0]
  - - [3136, 64, 64, 64, 3136, 3136, 3136, 64]
    - [79, 10763.0]
  - - [3136, 64, 64, 256, 3136, 3136, 3136, 64]
    - [103, 8886.0]
  - - [5329, 64, 64, 80, 5329, 5329, 5329, 64]
    - [110, 6100.0]
  - - [257, 4096, 1, 1024, 257, 257, 257, 4096]
    - [57, 8922.0]
  - - [512, 2048, 1, 2790, 512, 512, 512, 2048]
    - [59, 10627.0]
  - - [512, 2048, 1, 2864, 512, 512, 512, 2048]
    - [103, 10670.0]
  - - [512, 2048, 1, 3092, 512, 512, 512, 2048]
    - [81, 10634.0]
  - - [512, 2048, 1, 3113, 512, 512, 512, 2048]
    - [103, 10655.0]
  - - [512, 2048, 1, 3137, 512, 512, 512, 2048]
    - [103, 10664.0]
  - - [512, 2048, 1, 3165, 512, 512, 512, 2048]
    - [103, 10664.0]
  - - [512, 2048, 1, 3166, 512, 512, 512, 2048]
    - [103, 10640.0]
  - - [512, 2048, 1, 3194, 512, 512, 512, 2048]
    - [114, 10642.0]
  - - [512, 2048, 1, 3219, 512, 512, 512, 2048]
    - [103, 10640.0]
  - - [512, 2048, 1, 3222, 512, 512, 512, 2048]
    - [103, 10650.0]
  - - [512, 2048, 1, 3234, 512, 512, 512, 2048]
    - [103, 10656.0]
  - - [512, 2048, 1, 3237, 512, 512, 512, 2048]
    - [103, 10687.0]
  - - [512, 2048, 1, 3242, 512, 512, 512, 2048]
    - [103, 10637.0]
  - - [512, 2048, 1, 3246, 512, 512, 512, 2048]
    - [103, 10657.0]
  - - [512, 2048, 1, 3249, 512, 512, 512, 2048]
    - [81, 10647.0]
  - - [512, 2048, 1, 3251, 512, 512, 512, 2048]
    - [72, 10645.0]
  - - [512, 2048, 1, 3257, 512, 512, 512, 2048]
    - [103, 10653.0]
  - - [512, 2048, 1, 3262, 512, 512, 512, 2048]
    - [81, 10634.0]
  - - [512, 2048, 1, 3268, 512, 512, 512, 2048]
    - [103, 10659.0]
  - - [512, 2048, 1, 3282, 512, 512, 512, 2048]
    - [103, 10664.0]
  - - [512, 2048, 1, 3286, 512, 512, 512, 2048]
    - [81, 10665.0]
  - - [512, 2048, 1, 3287, 512, 512, 512, 2048]
    - [103, 10669.0]
  - - [512, 2048, 1, 3293, 512, 512, 512, 2048]
    - [81, 10651.0]
  - - [512, 2048, 1, 3297, 512, 512, 512, 2048]
    - [81, 10641.0]
  - - [512, 2048, 1, 3307, 512, 512, 512, 2048]
    - [103, 10635.0]
  - - [512, 2048, 1, 3314, 512, 512, 512, 2048]
    - [81, 10651.0]
  - - [512, 2048, 1, 3315, 512, 512, 512, 2048]
    - [94, 10637.0]
  - - [512, 2048, 1, 3319, 512, 512, 512, 2048]
    - [103, 10652.0]
  - - [512, 2048, 1, 3322, 512, 512, 512, 2048]
    - [103, 10682.0]
  - - [512, 2048, 1, 3323, 512, 512, 512, 2048]
    - [81, 10660.0]
  - - [512, 2048, 1, 3324, 512, 512, 512, 2048]
    - [103, 10660.0]
  - - [512, 2048, 1, 3325, 512, 512, 512, 2048]
    - [81, 10658.0]
  - - [512, 2048, 1, 3327, 512, 512, 512, 2048]
    - [103, 10666.0]
  - - [512, 2048, 1, 3329, 512, 512, 512, 2048]
    - [103, 10674.0]
  - - [512, 2048, 1, 3332, 512, 512, 512, 2048]
    - [94, 10636.0]
  - - [512, 2048, 1, 3336, 512, 512, 512, 2048]
    - [114, 10649.0]
  - - [512, 2048, 1, 3339, 512, 512, 512, 2048]
    - [81, 10659.0]
  - - [512, 2048, 1, 3342, 512, 512, 512, 2048]
    - [103, 10668.0]
  - - [512, 2048, 1, 3344, 512, 512, 512, 2048]
    - [103, 10667.0]
  - - [512, 2048, 1, 3358, 512, 512, 512, 2048]
    - [103, 10660.0]
  - - [512, 2048, 1, 3360, 512, 512, 512, 2048]
    - [103, 10666.0]
  - - [512, 2048, 1, 3364, 512, 512, 512, 2048]
    - [114, 10651.0]
  - - [512, 2048, 1, 3365, 512, 512, 512, 2048]
    - [114, 10665.0]
  - - [512, 2048, 1, 3369, 512, 512, 512, 2048]
    - [103, 10655.0]
  - - [512, 2048, 1, 3371, 512, 512, 512, 2048]
    - [103, 10682.0]
  - - [512, 2048, 1, 3374, 512, 512, 512, 2048]
    - [81, 10640.0]
  - - [512, 2048, 1, 3376, 512, 512, 512, 2048]
    - [103, 10653.0]
  - - [512, 2048, 1, 3377, 512, 512, 512, 2048]
    - [72, 10635.0]
  - - [512, 2048, 1, 3378, 512, 512, 512, 2048]
    - [103, 10650.0]
  - - [512, 2048, 1, 3381, 512, 512, 512, 2048]
    - [81, 10645.0]
  - - [512, 2048, 1, 3382, 512, 512, 512, 2048]
    - [103, 10678.0]
  - - [512, 2048, 1, 3383, 512, 512, 512, 2048]
    - [81, 10658.0]
  - - [512, 2048, 1, 3384, 512, 512, 512, 2048]
    - [103, 10691.0]
  - - [512, 2048, 1, 3385, 512, 512, 512, 2048]
    - [103, 10662.0]
  - - [512, 2048, 1, 3386, 512, 512, 512, 2048]
    - [81, 10664.0]
  - - [512, 2048, 1, 3388, 512, 512, 512, 2048]
    - [103, 10694.0]
  - - [512, 2048, 1, 3390, 512, 512, 512, 2048]
    - [103, 10680.0]
  - - [512, 2048, 1, 3391, 512, 512, 512, 2048]
    - [81, 10655.0]
  - - [512, 2048, 1, 3396, 512, 512, 512, 2048]
    - [103, 10663.0]
  - - [512, 2048, 1, 3399, 512, 512, 512, 2048]
    - [81, 10646.0]
  - - [512, 2048, 1, 3402, 512, 512, 512, 2048]
    - [103, 10674.0]
  - - [512, 2048, 1, 3410, 512, 512, 512, 2048]
    - [114, 10655.0]
  - - [512, 2048, 1, 3412, 512, 512, 512, 2048]
    - [114, 10644.0]
  - - [512, 2048, 1, 3414, 512, 512, 512, 2048]
    - [103, 10664.0]
  - - [512, 2048, 1, 3415, 512, 512, 512, 2048]
    - [81, 10665.0]
  - - [512, 2048, 1, 3418, 512, 512, 512, 2048]
    - [103, 10666.0]
  - - [512, 2048, 1, 3420, 512, 512, 512, 2048]
    - [81, 10648.0]
  - - [512, 2048, 1, 3422, 512, 512, 512, 2048]
    - [103, 10658.0]
  - - [512, 2048, 1, 3425, 512, 512, 512, 2048]
    - [114, 10663.0]
  - - [512, 2048, 1, 3426, 512, 512, 512, 2048]
    - [81, 10616.0]
  - - [512, 2048, 1, 3428, 512, 512, 512, 2048]
    - [81, 10649.0]
  - - [512, 2048, 1, 3430, 512, 512, 512, 2048]
    - [81, 10663.0]
  - - [512, 2048, 1, 3431, 512, 512, 512, 2048]
    - [103, 10679.0]
  - - [512, 2048, 1, 3432, 512, 512, 512, 2048]
    - [103, 10679.0]
  - - [512, 2048, 1, 3438, 512, 512, 512, 2048]
    - [81, 10666.0]
  - - [512, 2048, 1, 3439, 512, 512, 512, 2048]
    - [103, 10679.0]
  - - [512, 2048, 1, 3440, 512, 512, 512, 2048]
    - [114, 10678.0]
  - - [512, 2048, 1, 3443, 512, 512, 512, 2048]
    - [103, 10639.0]
  - - [512, 2048, 1, 3445, 512, 512, 512, 2048]
    - [81, 10643.0]
  - - [512, 2048, 1, 3447, 512, 512, 512, 2048]
    - [103, 10634.0]
  - - [512, 2048, 1, 3448, 512, 512, 512, 2048]
    - [103, 10648.0]
  - - [512, 2048, 1, 3450, 512, 512, 512, 2048]
    - [103, 10668.0]
  - - [512, 2048, 1, 3451, 512, 512, 512, 2048]
    - [94, 10664.0]
  - - [512, 2048, 1, 3452, 512, 512, 512, 2048]
    - [103, 10671.0]
  - - [512, 2048, 1, 3453, 512, 512, 512, 2048]
    - [114, 10658.0]
  - - [512, 2048, 1, 3455, 512, 512, 512, 2048]
    - [103, 10612.0]
  - - [512, 2048, 1, 3456, 512, 512, 512, 2048]
    - [103, 10645.0]
  - - [512, 2048, 1, 3457, 512, 512, 512, 2048]
    - [103, 10625.0]
  - - [512, 2048, 1, 3458, 512, 512, 512, 2048]
    - [103, 10634.0]
  - - [512, 2048, 1, 3459, 512, 512, 512, 2048]
    - [81, 10650.0]
  - - [512, 2048, 1, 3460, 512, 512, 512, 2048]
    - [103, 10635.0]
  - - [512, 2048, 1, 3461, 512, 512, 512, 2048]
    - [103, 10674.0]
  - - [512, 2048, 1, 3462, 512, 512, 512, 2048]
    - [103, 10634.0]
  - - [512, 2048, 1, 3466, 512, 512, 512, 2048]
    - [103, 10634.0]
  - - [512, 2048, 1, 3467, 512, 512, 512, 2048]
    - [103, 10637.0]
  - - [512, 2048, 1, 3468, 512, 512, 512, 2048]
    - [103, 10640.0]
  - - [512, 2048, 1, 3470, 512, 512, 512, 2048]
    - [103, 10648.0]
  - - [512, 2048, 1, 3471, 512, 512, 512, 2048]
    - [81, 10623.0]
  - - [512, 2048, 1, 3472, 512, 512, 512, 2048]
    - [103, 10651.0]
  - - [512, 2048, 1, 3475, 512, 512, 512, 2048]
    - [103, 10636.0]
  - - [512, 2048, 1, 3476, 512, 512, 512, 2048]
    - [103, 10661.0]
  - - [512, 2048, 1, 3477, 512, 512, 512, 2048]
    - [103, 10625.0]
  - - [512, 2048, 1, 3478, 512, 512, 512, 2048]
    - [103, 10622.0]
  - - [512, 2048, 1, 3479, 512, 512, 512, 2048]
    - [59, 10647.0]
  - - [512, 2048, 1, 3480, 512, 512, 512, 2048]
    - [103, 10670.0]
  - - [512, 2048, 1, 3481, 512, 512, 512, 2048]
    - [103, 10655.0]
  - - [512, 2048, 1, 3483, 512, 512, 512, 2048]
    - [81, 10643.0]
  - - [512, 2048, 1, 3484, 512, 512, 512, 2048]
    - [59, 10630.0]
  - - [512, 2048, 1, 3487, 512, 512, 512, 2048]
    - [103, 10630.0]
  - - [512, 2048, 1, 3489, 512, 512, 512, 2048]
    - [103, 10648.0]
  - - [512, 2048, 1, 3490, 512, 512, 512, 2048]
    - [114, 10647.0]
  - - [512, 2048, 1, 3491, 512, 512, 512, 2048]
    - [103, 10630.0]
  - - [512, 2048, 1, 3493, 512, 512, 512, 2048]
    - [103, 10649.0]
  - - [512, 2048, 1, 3494, 512, 512, 512, 2048]
    - [103, 10644.0]
  - - [512, 2048, 1, 3495, 512, 512, 512, 2048]
    - [103, 10637.0]
  - - [512, 2048, 1, 3497, 512, 512, 512, 2048]
    - [81, 10646.0]
  - - [512, 2048, 1, 3498, 512, 512, 512, 2048]
    - [103, 10632.0]
  - - [512, 2048, 1, 3499, 512, 512, 512, 2048]
    - [103, 10634.0]
  - - [512, 2048, 1, 3501, 512, 512, 512, 2048]
    - [103, 10660.0]
  - - [512, 2048, 1, 3503, 512, 512, 512, 2048]
    - [114, 10644.0]
  - - [512, 2048, 1, 3507, 512, 512, 512, 2048]
    - [103, 10652.0]
  - - [512, 2048, 1, 3508, 512, 512, 512, 2048]
    - [59, 10641.0]
  - - [512, 2048, 1, 3509, 512, 512, 512, 2048]
    - [103, 10636.0]
  - - [512, 2048, 1, 3511, 512, 512, 512, 2048]
    - [103, 10650.0]
  - - [512, 2048, 1, 3514, 512, 512, 512, 2048]
    - [81, 10664.0]
  - - [512, 2048, 1, 3515, 512, 512, 512, 2048]
    - [72, 10629.0]
  - - [512, 2048, 1, 3517, 512, 512, 512, 2048]
    - [103, 10626.0]
  - - [512, 2048, 1, 3518, 512, 512, 512, 2048]
    - [114, 10621.0]
  - - [512, 2048, 1, 3519, 512, 512, 512, 2048]
    - [103, 10648.0]
  - - [512, 2048, 1, 3520, 512, 512, 512, 2048]
    - [103, 10644.0]
  - - [512, 2048, 1, 3523, 512, 512, 512, 2048]
    - [103, 10653.0]
  - - [512, 2048, 1, 3528, 512, 512, 512, 2048]
    - [103, 10658.0]
  - - [512, 2048, 1, 3529, 512, 512, 512, 2048]
    - [103, 10646.0]
  - - [512, 2048, 1, 3530, 512, 512, 512, 2048]
    - [72, 10634.0]
  - - [512, 2048, 1, 3532, 512, 512, 512, 2048]
    - [81, 10639.0]
  - - [512, 2048, 1, 3533, 512, 512, 512, 2048]
    - [103, 10647.0]
  - - [512, 2048, 1, 3534, 512, 512, 512, 2048]
    - [103, 10647.0]
  - - [512, 2048, 1, 3538, 512, 512, 512, 2048]
    - [103, 10675.0]
  - - [512, 2048, 1, 3539, 512, 512, 512, 2048]
    - [103, 10639.0]
  - - [512, 2048, 1, 3541, 512, 512, 512, 2048]
    - [114, 10642.0]
  - - [512, 2048, 1, 3547, 512, 512, 512, 2048]
    - [103, 10658.0]
  - - [512, 2048, 1, 3548, 512, 512, 512, 2048]
    - [103, 10666.0]
  - - [512, 2048, 1, 3564, 512, 512, 512, 2048]
    - [103, 10692.0]
  - - [512, 2048, 1, 3575, 512, 512, 512, 2048]
    - [103, 10642.0]
  - - [512, 2048, 1, 3598, 512, 512, 512, 2048]
    - [103, 10671.0]
  - - [512, 2048, 1, 3599, 512, 512, 512, 2048]
    - [72, 10688.0]
  - - [512, 2048, 1, 3608, 512, 512, 512, 2048]
    - [114, 10676.0]
  - - [512, 2048, 1, 3780, 512, 512, 512, 2048]
    - [81, 10660.0]
  - - [512, 2048, 1, 3796, 512, 512, 512, 2048]
    - [81, 10661.0]
  - - [512, 2048, 1, 3822, 512, 512, 512, 2048]
    - [81, 10668.0]
  - - [512, 2048, 1, 3859, 512, 512, 512, 2048]
    - [103, 10663.0]
  - - [512, 2048, 1, 3870, 512, 512, 512, 2048]
    - [81, 10680.0]
  - - [512, 2048, 1, 3876, 512, 512, 512, 2048]
    - [81, 10635.0]
  - - [512, 2048, 1, 3906, 512, 512, 512, 2048]
    - [81, 10692.0]
  - - [512, 2048, 1, 3910, 512, 512, 512, 2048]
    - [114, 10667.0]
  - - [512, 2048, 1, 3925, 512, 512, 512, 2048]
    - [81, 10682.0]
  - - [512, 2048, 1, 3942, 512, 512, 512, 2048]
    - [114, 10657.0]
  - - [512, 2048, 1, 3944, 512, 512, 512, 2048]
    - [103, 10679.0]
  - - [512, 2048, 1, 3955, 512, 512, 512, 2048]
    - [114, 10634.0]
  - - [512, 2048, 1, 3968, 512, 512, 512, 2048]
    - [59, 10665.0]
  - - [512, 2048, 1, 3969, 512, 512, 512, 2048]
    - [103, 10681.0]
  - - [512, 2048, 1, 3976, 512, 512, 512, 2048]
    - [103, 10684.0]
  - - [512, 2048, 1, 3977, 512, 512, 512, 2048]
    - [81, 10680.0]
  - - [512, 2048, 1, 3978, 512, 512, 512, 2048]
    - [114, 10676.0]
  - - [512, 2048, 1, 3990, 512, 512, 512, 2048]
    - [103, 10655.0]
  - - [512, 2048, 1, 3995, 512, 512, 512, 2048]
    - [114, 10666.0]
  - - [512, 2048, 1, 3996, 512, 512, 512, 2048]
    - [81, 10673.0]
  - - [512, 2048, 1, 3999, 512, 512, 512, 2048]
    - [103, 10694.0]
  - - [512, 2048, 1, 4005, 512, 512, 512, 2048]
    - [81, 10674.0]
  - - [512, 2048, 1, 4012, 512, 512, 512, 2048]
    - [103, 10655.0]
  - - [512, 2048, 1, 4020, 512, 512, 512, 2048]
    - [59, 10658.0]
  - - [512, 2048, 1, 4026, 512, 512, 512, 2048]
    - [103, 10695.0]
  - - [512, 2048, 1, 4030, 512, 512, 512, 2048]
    - [114, 10667.0]
  - - [512, 2048, 1, 4032, 512, 512, 512, 2048]
    - [103, 10676.0]
  - - [2048, 512, 1, 2790, 2048, 2048, 2048, 512]
    - [114, 10643.0]
  - - [2048, 512, 1, 2864, 2048, 2048, 2048, 512]
    - [103, 10661.0]
  - - [2048, 512, 1, 3092, 2048, 2048, 2048, 512]
    - [81, 10636.0]
  - - [2048, 512, 1, 3113, 2048, 2048, 2048, 512]
    - [81, 10634.0]
  - - [2048, 512, 1, 3137, 2048, 2048, 2048, 512]
    - [103, 10660.0]
  - - [2048, 512, 1, 3165, 2048, 2048, 2048, 512]
    - [94, 10634.0]
  - - [2048, 512, 1, 3166, 2048, 2048, 2048, 512]
    - [81, 10648.0]
  - - [2048, 512, 1, 3194, 2048, 2048, 2048, 512]
    - [94, 10635.0]
  - - [2048, 512, 1, 3219, 2048, 2048, 2048, 512]
    - [103, 10652.0]
  - - [2048, 512, 1, 3222, 2048, 2048, 2048, 512]
    - [81, 10658.0]
  - - [2048, 512, 1, 3234, 2048, 2048, 2048, 512]
    - [81, 10652.0]
  - - [2048, 512, 1, 3237, 2048, 2048, 2048, 512]
    - [114, 10624.0]
  - - [2048, 512, 1, 3242, 2048, 2048, 2048, 512]
    - [103, 10673.0]
  - - [2048, 512, 1, 3246, 2048, 2048, 2048, 512]
    - [103, 10661.0]
  - - [2048, 512, 1, 3249, 2048, 2048, 2048, 512]
    - [103, 10654.0]
  - - [2048, 512, 1, 3251, 2048, 2048, 2048, 512]
    - [103, 10650.0]
  - - [2048, 512, 1, 3257, 2048, 2048, 2048, 512]
    - [103, 10663.0]
  - - [2048, 512, 1, 3262, 2048, 2048, 2048, 512]
    - [103, 10679.0]
  - - [2048, 512, 1, 3268, 2048, 2048, 2048, 512]
    - [81, 10668.0]
  - - [2048, 512, 1, 3282, 2048, 2048, 2048, 512]
    - [103, 10678.0]
  - - [2048, 512, 1, 3286, 2048, 2048, 2048, 512]
    - [114, 10648.0]
  - - [2048, 512, 1, 3287, 2048, 2048, 2048, 512]
    - [94, 10620.0]
  - - [2048, 512, 1, 3293, 2048, 2048, 2048, 512]
    - [114, 10649.0]
  - - [2048, 512, 1, 3297, 2048, 2048, 2048, 512]
    - [103, 10642.0]
  - - [2048, 512, 1, 3307, 2048, 2048, 2048, 512]
    - [114, 10652.0]
  - - [2048, 512, 1, 3314, 2048, 2048, 2048, 512]
    - [59, 10650.0]
  - - [2048, 512, 1, 3315, 2048, 2048, 2048, 512]
    - [81, 10656.0]
  - - [2048, 512, 1, 3319, 2048, 2048, 2048, 512]
    - [103, 10670.0]
  - - [2048, 512, 1, 3322, 2048, 2048, 2048, 512]
    - [81, 10643.0]
  - - [2048, 512, 1, 3323, 2048, 2048, 2048, 512]
    - [103, 10639.0]
  - - [2048, 512, 1, 3324, 2048, 2048, 2048, 512]
    - [103, 10645.0]
  - - [2048, 512, 1, 3325, 2048, 2048, 2048, 512]
    - [103, 10657.0]
  - - [2048, 512, 1, 3327, 2048, 2048, 2048, 512]
    - [103, 10656.0]
  - - [2048, 512, 1, 3329, 2048, 2048, 2048, 512]
    - [114, 10648.0]
  - - [2048, 512, 1, 3332, 2048, 2048, 2048, 512]
    - [103, 10677.0]
  - - [2048, 512, 1, 3336, 2048, 2048, 2048, 512]
    - [103, 10652.0]
  - - [2048, 512, 1, 3339, 2048, 2048, 2048, 512]
    - [81, 10648.0]
  - - [2048, 512, 1, 3342, 2048, 2048, 2048, 512]
    - [103, 10666.0]
  - - [2048, 512, 1, 3344, 2048, 2048, 2048, 512]
    - [103, 10653.0]
  - - [2048, 512, 1, 3358, 2048, 2048, 2048, 512]
    - [81, 10646.0]
  - - [2048, 512, 1, 3360, 2048, 2048, 2048, 512]
    - [114, 10651.0]
  - - [2048, 512, 1, 3364, 2048, 2048, 2048, 512]
    - [103, 10649.0]
  - - [2048, 512, 1, 3365, 2048, 2048, 2048, 512]
    - [81, 10655.0]
  - - [2048, 512, 1, 3369, 2048, 2048, 2048, 512]
    - [81, 10642.0]
  - - [2048, 512, 1, 3371, 2048, 2048, 2048, 512]
    - [103, 10665.0]
  - - [2048, 512, 1, 3374, 2048, 2048, 2048, 512]
    - [81, 10655.0]
  - - [2048, 512, 1, 3376, 2048, 2048, 2048, 512]
    - [81, 10638.0]
  - - [2048, 512, 1, 3377, 2048, 2048, 2048, 512]
    - [103, 10666.0]
  - - [2048, 512, 1, 3378, 2048, 2048, 2048, 512]
    - [81, 10654.0]
  - - [2048, 512, 1, 3381, 2048, 2048, 2048, 512]
    - [103, 10636.0]
  - - [2048, 512, 1, 3382, 2048, 2048, 2048, 512]
    - [94, 10637.0]
  - - [2048, 512, 1, 3383, 2048, 2048, 2048, 512]
    - [81, 10639.0]
  - - [2048, 512, 1, 3384, 2048, 2048, 2048, 512]
    - [81, 10655.0]
  - - [2048, 512, 1, 3385, 2048, 2048, 2048, 512]
    - [103, 10683.0]
  - - [2048, 512, 1, 3386, 2048, 2048, 2048, 512]
    - [81, 10658.0]
  - - [2048, 512, 1, 3388, 2048, 2048, 2048, 512]
    - [103, 10677.0]
  - - [2048, 512, 1, 3390, 2048, 2048, 2048, 512]
    - [103, 10653.0]
  - - [2048, 512, 1, 3391, 2048, 2048, 2048, 512]
    - [81, 10651.0]
  - - [2048, 512, 1, 3396, 2048, 2048, 2048, 512]
    - [81, 10667.0]
  - - [2048, 512, 1, 3399, 2048, 2048, 2048, 512]
    - [103, 10672.0]
  - - [2048, 512, 1, 3402, 2048, 2048, 2048, 512]
    - [94, 10627.0]
  - - [2048, 512, 1, 3410, 2048, 2048, 2048, 512]
    - [103, 10642.0]
  - - [2048, 512, 1, 3412, 2048, 2048, 2048, 512]
    - [81, 10664.0]
  - - [2048, 512, 1, 3414, 2048, 2048, 2048, 512]
    - [81, 10642.0]
  - - [2048, 512, 1, 3415, 2048, 2048, 2048, 512]
    - [81, 10671.0]
  - - [2048, 512, 1, 3418, 2048, 2048, 2048, 512]
    - [81, 10669.0]
  - - [2048, 512, 1, 3420, 2048, 2048, 2048, 512]
    - [81, 10650.0]
  - - [2048, 512, 1, 3422, 2048, 2048, 2048, 512]
    - [81, 10632.0]
  - - [2048, 512, 1, 3425, 2048, 2048, 2048, 512]
    - [81, 10654.0]
  - - [2048, 512, 1, 3426, 2048, 2048, 2048, 512]
    - [81, 10643.0]
  - - [2048, 512, 1, 3428, 2048, 2048, 2048, 512]
    - [94, 10631.0]
  - - [2048, 512, 1, 3430, 2048, 2048, 2048, 512]
    - [81, 10685.0]
  - - [2048, 512, 1, 3431, 2048, 2048, 2048, 512]
    - [103, 10680.0]
  - - [2048, 512, 1, 3432, 2048, 2048, 2048, 512]
    - [81, 10666.0]
  - - [2048, 512, 1, 3438, 2048, 2048, 2048, 512]
    - [114, 10637.0]
  - - [2048, 512, 1, 3439, 2048, 2048, 2048, 512]
    - [114, 10664.0]
  - - [2048, 512, 1, 3440, 2048, 2048, 2048, 512]
    - [81, 10646.0]
  - - [2048, 512, 1, 3443, 2048, 2048, 2048, 512]
    - [114, 10647.0]
  - - [2048, 512, 1, 3445, 2048, 2048, 2048, 512]
    - [103, 10650.0]
  - - [2048, 512, 1, 3447, 2048, 2048, 2048, 512]
    - [103, 10646.0]
  - - [2048, 512, 1, 3448, 2048, 2048, 2048, 512]
    - [103, 10649.0]
  - - [2048, 512, 1, 3450, 2048, 2048, 2048, 512]
    - [114, 10629.0]
  - - [2048, 512, 1, 3451, 2048, 2048, 2048, 512]
    - [103, 10664.0]
  - - [2048, 512, 1, 3453, 2048, 2048, 2048, 512]
    - [103, 10649.0]
  - - [2048, 512, 1, 3455, 2048, 2048, 2048, 512]
    - [81, 10630.0]
  - - [2048, 512, 1, 3456, 2048, 2048, 2048, 512]
    - [81, 10664.0]
  - - [2048, 512, 1, 3457, 2048, 2048, 2048, 512]
    - [103, 10686.0]
  - - [2048, 512, 1, 3458, 2048, 2048, 2048, 512]
    - [103, 10670.0]
  - - [2048, 512, 1, 3459, 2048, 2048, 2048, 512]
    - [81, 10662.0]
  - - [2048, 512, 1, 3460, 2048, 2048, 2048, 512]
    - [114, 10667.0]
  - - [2048, 512, 1, 3461, 2048, 2048, 2048, 512]
    - [103, 10647.0]
  - - [2048, 512, 1, 3462, 2048, 2048, 2048, 512]
    - [103, 10679.0]
  - - [2048, 512, 1, 3466, 2048, 2048, 2048, 512]
    - [81, 10674.0]
  - - [2048, 512, 1, 3467, 2048, 2048, 2048, 512]
    - [103, 10655.0]
  - - [2048, 512, 1, 3468, 2048, 2048, 2048, 512]
    - [114, 10637.0]
  - - [2048, 512, 1, 3470, 2048, 2048, 2048, 512]
    - [114, 10650.0]
  - - [2048, 512, 1, 3471, 2048, 2048, 2048, 512]
    - [114, 10645.0]
  - - [2048, 512, 1, 3476, 2048, 2048, 2048, 512]
    - [103, 10688.0]
  - - [2048, 512, 1, 3477, 2048, 2048, 2048, 512]
    - [94, 10631.0]
  - - [2048, 512, 1, 3478, 2048, 2048, 2048, 512]
    - [72, 10672.0]
  - - [2048, 512, 1, 3479, 2048, 2048, 2048, 512]
    - [94, 10654.0]
  - - [2048, 512, 1, 3480, 2048, 2048, 2048, 512]
    - [103, 10683.0]
  - - [2048, 512, 1, 3481, 2048, 2048, 2048, 512]
    - [81, 10647.0]
  - - [2048, 512, 1, 3483, 2048, 2048, 2048, 512]
    - [103, 10659.0]
  - - [2048, 512, 1, 3484, 2048, 2048, 2048, 512]
    - [81, 10680.0]
  - - [2048, 512, 1, 3487, 2048, 2048, 2048, 512]
    - [81, 10645.0]
  - - [2048, 512, 1, 3489, 2048, 2048, 2048, 512]
    - [103, 10669.0]
  - - [2048, 512, 1, 3490, 2048, 2048, 2048, 512]
    - [94, 10647.0]
  - - [2048, 512, 1, 3491, 2048, 2048, 2048, 512]
    - [81, 10651.0]
  - - [2048, 512, 1, 3493, 2048, 2048, 2048, 512]
    - [81, 10670.0]
  - - [2048, 512, 1, 3494, 2048, 2048, 2048, 512]
    - [103, 10662.0]
  - - [2048, 512, 1, 3495, 2048, 2048, 2048, 512]
    - [94, 10658.0]
  - - [2048, 512, 1, 3497, 2048, 2048, 2048, 512]
    - [103, 10668.0]
  - - [2048, 512, 1, 3498, 2048, 2048, 2048, 512]
    - [81, 10647.0]
  - - [2048, 512, 1, 3499, 2048, 2048, 2048, 512]
    - [81, 10651.0]
  - - [2048, 512, 1, 3501, 2048, 2048, 2048, 512]
    - [81, 10672.0]
  - - [2048, 512, 1, 3503, 2048, 2048, 2048, 512]
    - [81, 10655.0]
  - - [2048, 512, 1, 3507, 2048, 2048, 2048, 512]
    - [81, 10647.0]
  - - [2048, 512, 1, 3508, 2048, 2048, 2048, 512]
    - [114, 10662.0]
  - - [2048, 512, 1, 3509, 2048, 2048, 2048, 512]
    - [81, 10658.0]
  - - [2048, 512, 1, 3511, 2048, 2048, 2048, 512]
    - [94, 10627.0]
  - - [2048, 512, 1, 3514, 2048, 2048, 2048, 512]
    - [81, 10674.0]
  - - [2048, 512, 1, 3515, 2048, 2048, 2048, 512]
    - [103, 10652.0]
  - - [2048, 512, 1, 3517, 2048, 2048, 2048, 512]
    - [114, 10647.0]
  - - [2048, 512, 1, 3518, 2048, 2048, 2048, 512]
    - [103, 10647.0]
  - - [2048, 512, 1, 3519, 2048, 2048, 2048, 512]
    - [103, 10683.0]
  - - [2048, 512, 1, 3520, 2048, 2048, 2048, 512]
    - [59, 10651.0]
  - - [2048, 512, 1, 3523, 2048, 2048, 2048, 512]
    - [103, 10667.0]
  - - [2048, 512, 1, 3528, 2048, 2048, 2048, 512]
    - [103, 10664.0]
  - - [2048, 512, 1, 3529, 2048, 2048, 2048, 512]
    - [103, 10660.0]
  - - [2048, 512, 1, 3530, 2048, 2048, 2048, 512]
    - [103, 10654.0]
  - - [2048, 512, 1, 3532, 2048, 2048, 2048, 512]
    - [81, 10665.0]
  - - [2048, 512, 1, 3533, 2048, 2048, 2048, 512]
    - [94, 10656.0]
  - - [2048, 512, 1, 3534, 2048, 2048, 2048, 512]
    - [81, 10638.0]
  - - [2048, 512, 1, 3538, 2048, 2048, 2048, 512]
    - [114, 10657.0]
  - - [2048, 512, 1, 3539, 2048, 2048, 2048, 512]
    - [103, 10631.0]
  - - [2048, 512, 1, 3541, 2048, 2048, 2048, 512]
    - [81, 10645.0]
  - - [2048, 512, 1, 3547, 2048, 2048, 2048, 512]
    - [94, 10658.0]
  - - [2048, 512, 1, 3548, 2048, 2048, 2048, 512]
    - [94, 10660.0]
  - - [2048, 512, 1, 3552, 2048, 2048, 2048, 512]
    - [94, 10663.0]
  - - [2048, 512, 1, 3564, 2048, 2048, 2048, 512]
    - [94, 10659.0]
  - - [2048, 512, 1, 3575, 2048, 2048, 2048, 512]
    - [103, 10656.0]
  - - [2048, 512, 1, 3598, 2048, 2048, 2048, 512]
    - [103, 10673.0]
  - - [2048, 512, 1, 3599, 2048, 2048, 2048, 512]
    - [81, 10649.0]
  - - [2048, 512, 1, 3608, 2048, 2048, 2048, 512]
    - [103, 10663.0]
  - - [2048, 512, 1, 3780, 2048, 2048, 2048, 512]
    - [103, 10646.0]
  - - [2048, 512, 1, 3796, 2048, 2048, 2048, 512]
    - [81, 10679.0]
  - - [2048, 512, 1, 3822, 2048, 2048, 2048, 512]
    - [81, 10662.0]
  - - [2048, 512, 1, 3840, 2048, 2048, 2048, 512]
    - [86, 10591.0]
  - - [2048, 512, 1, 3859, 2048, 2048, 2048, 512]
    - [81, 10641.0]
  - - [2048, 512, 1, 3870, 2048, 2048, 2048, 512]
    - [81, 10620.0]
  - - [2048, 512, 1, 3876, 2048, 2048, 2048, 512]
    - [81, 10626.0]
  - - [2048, 512, 1, 3906, 2048, 2048, 2048, 512]
    - [81, 10668.0]
  - - [2048, 512, 1, 3910, 2048, 2048, 2048, 512]
    - [81, 10687.0]
  - - [2048, 512, 1, 3925, 2048, 2048, 2048, 512]
    - [94, 10652.0]
  - - [2048, 512, 1, 3942, 2048, 2048, 2048, 512]
    - [81, 10651.0]
  - - [2048, 512, 1, 3944, 2048, 2048, 2048, 512]
    - [103, 10671.0]
  - - [2048, 512, 1, 3955, 2048, 2048, 2048, 512]
    - [81, 10677.0]
  - - [2048, 512, 1, 3968, 2048, 2048, 2048, 512]
    - [103, 10704.0]
  - - [2048, 512, 1, 3969, 2048, 2048, 2048, 512]
    - [94, 10667.0]
  - - [2048, 512, 1, 3976, 2048, 2048, 2048, 512]
    - [103, 10702.0]
  - - [2048, 512, 1, 3977, 2048, 2048, 2048, 512]
    - [114, 10674.0]
  - - [2048, 512, 1, 3978, 2048, 2048, 2048, 512]
    - [81, 10640.0]
  - - [2048, 512, 1, 3990, 2048, 2048, 2048, 512]
    - [81, 10671.0]
  - - [2048, 512, 1, 3995, 2048, 2048, 2048, 512]
    - [103, 10675.0]
  - - [2048, 512, 1, 3996, 2048, 2048, 2048, 512]
    - [81, 10684.0]
  - - [2048, 512, 1, 3999, 2048, 2048, 2048, 512]
    - [103, 10657.0]
  - - [2048, 512, 1, 4005, 2048, 2048, 2048, 512]
    - [81, 10683.0]
  - - [2048, 512, 1, 4012, 2048, 2048, 2048, 512]
    - [81, 10662.0]
  - - [2048, 512, 1, 4020, 2048, 2048, 2048, 512]
    - [103, 10686.0]
  - - [2048, 512, 1, 4026, 2048, 2048, 2048, 512]
    - [81, 10682.0]
  - - [2048, 512, 1, 4030, 2048, 2048, 2048, 512]
    - [103, 10684.0]
  - - [2048, 512, 1, 4032, 2048, 2048, 2048, 512]
    - [81, 10676.0]
  - - [64, 102, 312, 102, 64, 64, 64, 102]
    - [57, 6911.0]
  - - [64, 512, 16, 512, 64, 64, 64, 512]
    - [79, 7914.0]
  - - [64, 512, 96, 512, 64, 64, 64, 512]
    - [79, 10445.0]
  - - [1024, 1024, 1, 3840, 1024, 1024, 1024, 1024]
    - [81, 10687.0]
  - - [1024, 1024, 1, 3968, 1024, 1024, 1024, 1024]
    - [81, 10653.0]
  - - [1024, 1024, 1, 7200, 1024, 1024, 1024, 1024]
    - [81, 10711.0]
  - - [1024, 1024, 1, 8160, 1024, 1024, 1024, 1024]
    - [103, 10715.0]
  - - [768, 768, 1, 384, 768, 768, 768, 768]
    - [82, 8875.0]
  - - [768, 384, 1, 384, 768, 768, 768, 384]
    - [72, 7034.0]
  - - [1152, 576, 1, 384, 1152, 1152, 1152, 576]
    - [59, 8415.0]
  - - [384, 768, 1, 384, 384, 384, 384, 768]
    - [81, 7025.0]
  - - [1024, 1024, 1, 32, 1024, 1024, 1024, 1024]
    - [87, 4609.0]
  - - [64, 128, 512, 128, 64, 64, 64, 128]
    - [79, 10690.0]
  - - [64, 512, 64, 512, 64, 64, 64, 512]
    - [57, 10939.0]
  - - [1024, 1024, 1, 1600, 1024, 1024, 1024, 1024]
    - [103, 10525.0]
  - - [2048, 256, 1, 1024, 2048, 2048, 2048, 256]
    - [82, 8775.0]
  - - [256, 1280, 1, 8976, 256, 256, 256, 1280]
    - [88, 10309.0]
  - - [512, 2048, 1, 256, 512, 512, 512, 2048]
    - [59, 9719.0]
  - - [560, 1024, 1, 1600, 560, 560, 560, 1024]
    - [60, 9721.0]
  - - [560, 1024, 1, 200, 560, 560, 560, 1024]
    - [60, 7506.0]
  - - [1024, 1024, 1, 960, 1024, 1024, 1024, 1024]
    - [103, 10410.0]
  - - [2304, 128, 1, 128, 2304, 2304, 2304, 128]
    - [100, 5033.0]
  - - [2688, 128, 1, 128, 2688, 2688, 2688, 128]
    - [102, 5193.0]
  - - [3072, 128, 1, 128, 3072, 3072, 3072, 128]
    - [100, 5471.0]
  - - [3456, 128, 1, 128, 3456, 3456, 3456, 128]
    - [81, 6062.0]
  - - [3840, 128, 1, 128, 3840, 3840, 3840, 128]
    - [57, 6473.0]
  - - [4224, 128, 1, 128, 4224, 4224, 4224, 128]
    - [58, 6303.0]
  - - [4608, 128, 1, 128, 4608, 4608, 4608, 128]
    - [57, 6765.0]
  - - [4992, 128, 1, 128, 4992, 4992, 4992, 128]
    - [79, 7329.0]
  - - [5376, 128, 1, 128, 5376, 5376, 5376, 128]
    - [57, 7046.0]
  - - [5760, 128, 1, 128, 5760, 5760, 5760, 128]
    - [103, 7538.0]
  - - [6144, 128, 1, 128, 6144, 6144, 6144, 128]
    - [72, 7877.0]
  - - [6528, 128, 1, 128, 6528, 6528, 6528, 128]
    - [59, 7717.0]
  - - [6912, 128, 1, 128, 6912, 6912, 6912, 128]
    - [70, 7975.0]
  - - [7296, 128, 1, 128, 7296, 7296, 7296, 128]
    - [101, 8478.0]
  - - [7680, 128, 1, 128, 7680, 7680, 7680, 128]
    - [59, 8654.0]
  - - [8064, 128, 1, 128, 8064, 8064, 8064, 128]
    - [103, 8480.0]
  - - [8448, 128, 1, 128, 8448, 8448, 8448, 128]
    - [59, 8794.0]
  - - [8832, 128, 1, 128, 8832, 8832, 8832, 128]
    - [101, 9112.0]
  - - [2304, 128, 1, 256, 2304, 2304, 2304, 128]
    - [59, 6178.0]
  - - [2688, 128, 1, 256, 2688, 2688, 2688, 128]
    - [59, 6000.0]
  - - [3072, 128, 1, 256, 3072, 3072, 3072, 128]
    - [72, 6693.0]
  - - [3456, 128, 1, 256, 3456, 3456, 3456, 128]
    - [103, 7500.0]
  - - [3840, 128, 1, 256, 3840, 3840, 3840, 128]
    - [57, 8171.0]
  - - [4224, 128, 1, 256, 4224, 4224, 4224, 128]
    - [103, 7690.0]
  - - [4608, 128, 1, 256, 4608, 4608, 4608, 128]
    - [103, 8144.0]
  - - [4992, 128, 1, 256, 4992, 4992, 4992, 128]
    - [60, 8880.0]
  - - [5376, 128, 1, 256, 5376, 5376, 5376, 128]
    - [103, 8325.0]
  - - [5760, 128, 1, 256, 5760, 5760, 5760, 128]
    - [81, 8771.0]
  - - [6144, 128, 1, 256, 6144, 6144, 6144, 128]
    - [59, 9201.0]
  - - [6528, 128, 1, 256, 6528, 6528, 6528, 128]
    - [60, 8781.0]
  - - [6912, 128, 1, 256, 6912, 6912, 6912, 128]
    - [81, 9155.0]
  - - [7296, 128, 1, 256, 7296, 7296, 7296, 128]
    - [115, 9617.0]
  - - [7680, 128, 1, 256, 7680, 7680, 7680, 128]
    - [81, 10002.0]
  - - [8064, 128, 1, 256, 8064, 8064, 8064, 128]
    - [81, 9498.0]
  - - [8448, 128, 1, 256, 8448, 8448, 8448, 128]
    - [81, 9706.0]
  - - [8832, 128, 1, 256, 8832, 8832, 8832, 128]
    - [103, 10270.0]
  - - [768, 768, 1, 768, 768, 768, 768, 768]
    - [82, 9654.0]
  - - [384, 1536, 1, 384, 384, 384, 384, 1536]
    - [60, 8931.0]
  - - [384, 1920, 1, 384, 384, 384, 384, 1920]
    - [81, 9344.0]
  - - [384, 2304, 1, 384, 384, 384, 384, 2304]
    - [60, 9679.0]
  - - [64, 192, 64, 1280, 64, 64, 64, 192]
    - [79, 10095.0]
  - - [64, 320, 64, 1280, 64, 64, 64, 320]
    - [79, 10678.0]
  - - [64, 384, 64, 1280, 64, 64, 64, 384]
    - [70, 9350.0]
  - - [64, 448, 64, 1280, 64, 64, 64, 448]
    - [79, 9795.0]
  - - [64, 192, 64, 2048, 64, 64, 64, 192]
    - [92, 9863.0]
  - - [64, 320, 64, 2048, 64, 64, 64, 320]
    - [79, 9566.0]
  - - [64, 384, 64, 2048, 64, 64, 64, 384]
    - [66, 8300.0]
  - - [64, 448, 64, 2048, 64, 64, 64, 448]
    - [57, 9584.0]
  - - [1225, 64, 64, 192, 1225, 1225, 1225, 64]
    - [79, 10807.0]
  - - [1225, 64, 64, 256, 1225, 1225, 1225, 64]
    - [79, 10836.0]
  - - [1225, 64, 64, 288, 1225, 1225, 1225, 64]
    - [81, 10799.0]
  - - [5329, 80, 64, 64, 5329, 5329, 5329, 80]
    - [101, 5897.0]
  - - [64, 192, 32, 1280, 64, 64, 64, 192]
    - [101, 8035.0]
  - - [64, 320, 32, 1280, 64, 64, 64, 320]
    - [105, 10316.0]
  - - [64, 384, 32, 1280, 64, 64, 64, 384]
    - [57, 10117.0]
  - - [64, 448, 32, 1280, 64, 64, 64, 448]
    - [57, 9904.0]
  - - [64, 192, 32, 2048, 64, 64, 64, 192]
    - [61, 8167.0]
  - - [64, 320, 32, 2048, 64, 64, 64, 320]
    - [61, 10543.0]
  - - [64, 384, 32, 2048, 64, 64, 64, 384]
    - [57, 10040.0]
  - - [64, 448, 32, 2048, 64, 64, 64, 448]
    - [79, 9956.0]
  - - [1225, 64, 32, 192, 1225, 1225, 1225, 64]
    - [57, 10162.0]
  - - [1225, 64, 32, 256, 1225, 1225, 1225, 64]
    - [81, 10633.0]
  - - [1225, 64, 32, 288, 1225, 1225, 1225, 64]
    - [72, 10666.0]
  - - [5329, 80, 32, 64, 5329, 5329, 5329, 80]
    - [101, 6427.0]
  - - [289, 128, 32, 768, 289, 289, 289, 128]
    - [79, 9847.0]
  - - [289, 160, 32, 768, 289, 289, 289, 160]
    - [57, 8205.0]
  - - [289, 192, 32, 768, 289, 289, 289, 192]
    - [57, 9863.0]
  - - [3136, 64, 32, 64, 3136, 3136, 3136, 64]
    - [101, 10124.0]
  - - [3136, 64, 32, 256, 3136, 3136, 3136, 64]
    - [57, 10233.0]
  - - [196, 256, 32, 1024, 196, 196, 196, 256]
    - [94, 8825.0]
  - - [1024, 1024, 1, 6912, 1024, 1024, 1024, 1024]
    - [81, 10719.0]
  - - [1024, 512, 1, 4096, 1024, 1024, 1024, 512]
    - [82, 9248.0]
  - - [480, 1024, 1, 4096, 480, 480, 480, 1024]
    - [60, 8647.0]
  - - [1024, 512, 1, 6912, 1024, 1024, 1024, 512]
    - [90, 9348.0]
  - - [480, 1024, 1, 6912, 480, 480, 480, 1024]
    - [65, 8726.0]
  - - [100, 512, 120, 128, 100, 100, 100, 512]
    - [57, 8301.0]
  - - [100, 512, 18, 128, 100, 100, 100, 512]
    - [113, 5886.0]
  - - [100, 512, 19, 128, 100, 100, 100, 512]
    - [101, 6289.0]
  - - [1444, 576, 1, 128, 1444, 1444, 1444, 576]
    - [72, 7529.0]
  - - [173280, 64, 1, 128, 173280, 173280, 173280, 64]
    - [69, 7708.0]
  - - [25992, 64, 1, 128, 25992, 25992, 25992, 64]
    - [79, 8634.0]
  - - [27436, 64, 1, 128, 27436, 27436, 27436, 64]
    - [92, 8725.0]
  - - [361, 2304, 1, 512, 361, 361, 361, 2304]
    - [72, 9080.0]
  - - [960, 1024, 1, 1024, 960, 960, 960, 1024]
    - [101, 10876.0]
  - - [1024, 960, 1, 1024, 1024, 1024, 1024, 960]
    - [59, 11145.0]
  - - [1024, 1024, 1, 77, 1024, 1024, 1024, 1024]
    - [57, 6854.0]
  - - [64, 128, 160, 128, 64, 64, 64, 128]
    - [79, 9383.0]
  - - [1024, 1024, 1, 10, 1024, 1024, 1024, 1024]
    - [63, 1783.0]
  - - [64, 128, 624, 128, 64, 64, 64, 128]
    - [57, 11038.0]
  - - [1024, 1024, 1, 39, 1024, 1024, 1024, 1024]
    - [99, 4690.0]
  - - [1024, 1024, 1, 780, 1024, 1024, 1024, 1024]
    - [59, 10314.0]
  - - [1024, 1024, 1, 4992, 1024, 1024, 1024, 1024]
    - [114, 10688.0]
  - - [1024, 1024, 1, 308, 1024, 1024, 1024, 1024]
    - [59, 9793.0]
  - - [64, 128, 640, 128, 64, 64, 64, 128]
    - [79, 10998.0]
  - - [1024, 1024, 1, 40, 1024, 1024, 1024, 1024]
    - [91, 5066.0]
  - - [1024, 1024, 1, 800, 1024, 1024, 1024, 1024]
    - [103, 10361.0]
  - - [1024, 1024, 1, 5120, 1024, 1024, 1024, 1024]
    - [103, 10735.0]
  - - [64, 128, 656, 128, 64, 64, 64, 128]
    - [79, 10853.0]
  - - [1024, 1024, 1, 41, 1024, 1024, 1024, 1024]
    - [93, 4756.0]
  - - [1024, 1024, 1, 820, 1024, 1024, 1024, 1024]
    - [72, 10354.0]
  - - [1024, 1024, 1, 5248, 1024, 1024, 1024, 1024]
    - [103, 10685.0]
  - - [64, 512, 80, 512, 64, 64, 64, 512]
    - [101, 11089.0]
  - - [1024, 1024, 1, 5, 1024, 1024, 1024, 1024]
    - [57, 978.0]
  - - [1024, 1024, 1, 385, 1024, 1024, 1024, 1024]
    - [103, 9988.0]
  - - [1024, 1024, 1, 2560, 1024, 1024, 1024, 1024]
    - [114, 10594.0]
  - - [1024, 1024, 1, 462, 1024, 1024, 1024, 1024]
    - [81, 10088.0]
  - - [64, 128, 128, 128, 64, 64, 64, 128]
    - [79, 8484.0]
  - - [1024, 1024, 1, 8, 1024, 1024, 1024, 1024]
    - [77, 1762.0]
  - - [1024, 1024, 1, 160, 1024, 1024, 1024, 1024]
    - [59, 9079.0]
  - - [64, 128, 144, 128, 64, 64, 64, 128]
    - [101, 8560.0]
  - - [1024, 1024, 1, 9, 1024, 1024, 1024, 1024]
    - [77, 1661.0]
  - - [1024, 1024, 1, 180, 1024, 1024, 1024, 1024]
    - [72, 9189.0]
  - - [1024, 1024, 1, 1152, 1024, 1024, 1024, 1024]
    - [103, 10457.0]
  - - [1024, 1024, 1, 6528, 1024, 1024, 1024, 1024]
    - [103, 10748.0]
  - - [1024, 1024, 1, 7104, 1024, 1024, 1024, 1024]
    - [81, 10737.0]
  - - [1024, 1024, 1, 8064, 1024, 1024, 1024, 1024]
    - [114, 10704.0]
  - - [2048, 512, 1, 1, 2048, 2048, 2048, 512]
    - [70, 222.0]
  - - [1024, 1024, 1, 16, 1024, 1024, 1024, 1024]
    - [77, 2923.0]
  - - [512, 64, 256, 512, 512, 512, 512, 64]
    - [79, 9191.0]
  - - [64, 512, 256, 512, 64, 64, 64, 512]
    - [79, 9105.0]
  - - [512, 64, 128, 512, 512, 512, 512, 64]
    - [106, 9043.0]
  - - [64, 512, 128, 512, 64, 64, 64, 512]
    - [79, 8800.0]
  - - [512, 64, 40, 512, 512, 512, 512, 64]
    - [103, 10980.0]
  - - [64, 512, 40, 512, 64, 64, 64, 512]
    - [101, 10713.0]
  - - [1024, 96, 64, 1024, 1024, 1024, 1024, 96]
    - [88, 9101.0]
  - - [96, 1024, 64, 1024, 96, 96, 96, 1024]
    - [97, 9122.0]
  - - [1024, 96, 128, 1024, 1024, 1024, 1024, 96]
    - [76, 9198.0]
  - - [96, 1024, 128, 1024, 96, 96, 96, 1024]
    - [88, 9222.0]
  - - [1024, 64, 256, 1024, 1024, 1024, 1024, 64]
    - [95, 10212.0]
  - - [64, 1024, 256, 1024, 64, 64, 64, 1024]
    - [79, 9999.0]
  - - [1024, 64, 32, 1024, 1024, 1024, 1024, 64]
    - [72, 10630.0]
  - - [64, 1024, 32, 1024, 64, 64, 64, 1024]
    - [57, 10361.0]
  - - [1024, 64, 64, 1024, 1024, 1024, 1024, 64]
    - [101, 10114.0]
