library/src/blas3/Tensile/Logic/asm_full/navi22_Cijk_Alik_Bjlk_HB.yaml
---
- {MinimumRequiredVersion: 4.28.0}
- navi22
- gfx1031
    SolutionIndex: 0
    SolutionNameMin: Cijk_Alik_Bjlk_HB_MT128x256x8_SN_SU0_SUM0_TT8_16_WG16_16_1_WGM1
    SolutionIndex: 1
    SolutionNameMin: Cijk_Alik_Bjlk_HB_MT128x64x16_SN_SU0_SUM0_TT8_8_WG16_8_1_WGM1
    SolutionIndex: 2
    SolutionNameMin: Cijk_Alik_Bjlk_HB_MT128x128x16_SN_SU0_SUM0_TT8_16_WG16_8_1_WGM1
    SolutionIndex: 3
    SolutionNameMin: Cijk_Alik_Bjlk_HB_MT128x128x16_SN_SU0_SUM0_TT8_8_WG16_16_1_WGM1
    SolutionIndex: 4
    SolutionNameMin: Cijk_Alik_Bjlk_HB_MT128x256x16_SN_SU0_SUM0_TT8_16_WG16_16_1_WGM1
    SolutionIndex: 5
    SolutionNameMin: Cijk_Alik_Bjlk_HB_MT128x256x8_SN_SU32_SUM3_TT8_16_WG16_16_1_WGM1
    SolutionIndex: 6
    SolutionNameMin: Cijk_Alik_Bjlk_HB_MT128x64x16_SN_SU32_SUM3_TT8_8_WG16_8_1_WGM1
    SolutionIndex: 7
    SolutionNameMin: Cijk_Alik_Bjlk_HB_MT128x128x16_SN_SU32_SUM3_TT8_16_WG16_8_1_WGM1
    SolutionIndex: 8
    SolutionNameMin: Cijk_Alik_Bjlk_HB_MT128x128x16_SN_SU32_SUM3_TT8_8_WG16_16_1_WGM1
    SolutionIndex: 9
    SolutionNameMin: Cijk_Alik_Bjlk_HB_MT128x256x16_SN_SU32_SUM3_TT8_16_WG16_16_1_WGM1
    SolutionIndex: 10
    SolutionNameMin: Cijk_Alik_Bjlk_HB_MT128x128x8_SN_SU0_SUM0_TT8_16_WG16_8_1_WGM4
    SolutionIndex: 11
    SolutionNameMin: Cijk_Alik_Bjlk_HB_MT128x256x8_SN_SU0_SUM0_TT8_16_WG16_16_1_WGM4
    SolutionIndex: 12
    SolutionNameMin: Cijk_Alik_Bjlk_HB_MT128x64x16_SN_SU0_SUM0_TT8_8_WG16_8_1_WGM4
    SolutionIndex: 13
    SolutionNameMin: Cijk_Alik_Bjlk_HB_MT128x128x16_SN_SU0_SUM0_TT8_16_WG16_8_1_WGM4
    SolutionIndex: 14
    SolutionNameMin: Cijk_Alik_Bjlk_HB_MT128x128x16_SN_SU0_SUM0_TT8_8_WG16_16_1_WGM4
    SolutionIndex: 15
    SolutionNameMin: Cijk_Alik_Bjlk_HB_MT128x256x16_SN_SU0_SUM0_TT8_16_WG16_16_1_WGM4
    SolutionIndex: 16
    SolutionNameMin: Cijk_Alik_Bjlk_HB_MT128x128x16_SN_SU32_SUM3_TT8_16_WG16_8_1_WGM4
    SolutionIndex: 17
    SolutionNameMin: Cijk_Alik_Bjlk_HB_MT128x128x16_SN_SU32_SUM3_TT8_8_WG16_16_1_WGM4
    SolutionIndex: 18
    SolutionNameMin: Cijk_Alik_Bjlk_HB_MT128x256x16_SN_SU32_SUM3_TT8_16_WG16_16_1_WGM4
    SolutionIndex: 19
    SolutionNameMin: Cijk_Alik_Bjlk_HB_MT128x256x8_SN_SU0_SUM0_TT8_16_WG16_16_1_WGM8
    SolutionIndex: 20
    SolutionNameMin: Cijk_Alik_Bjlk_HB_MT128x64x16_SN_SU0_SUM0_TT8_8_WG16_8_1_WGM8
    SolutionIndex: 21
    SolutionNameMin: Cijk_Alik_Bjlk_HB_MT128x128x16_SN_SU0_SUM0_TT8_16_WG16_8_1_WGM8
    SolutionIndex: 22
    SolutionNameMin: Cijk_Alik_Bjlk_HB_MT256x128x16_SN_SU0_SUM0_TT16_16_WG16_8_1_WGM8
    SolutionIndex: 23
    SolutionNameMin: Cijk_Alik_Bjlk_HB_MT128x128x16_SN_SU0_SUM0_TT8_8_WG16_16_1_WGM8
    SolutionIndex: 24
    SolutionNameMin: Cijk_Alik_Bjlk_HB_MT128x256x16_SN_SU0_SUM0_TT8_16_WG16_16_1_WGM8
    SolutionIndex: 25
    SolutionNameMin: Cijk_Alik_Bjlk_HB_MT128x256x8_SN_SU32_SUM3_TT8_16_WG16_16_1_WGM8
    SolutionIndex: 26
    SolutionNameMin: Cijk_Alik_Bjlk_HB_MT128x64x16_SN_SU32_SUM3_TT8_8_WG16_8_1_WGM8
    SolutionIndex: 27
    SolutionNameMin: Cijk_Alik_Bjlk_HB_MT128x128x16_SN_SU32_SUM3_TT8_16_WG16_8_1_WGM8
    SolutionIndex: 28
    SolutionNameMin: Cijk_Alik_Bjlk_HB_MT128x256x16_SN_SU32_SUM3_TT8_16_WG16_16_1_WGM8
    SolutionIndex: 29
    SolutionNameMin: Cijk_Alik_Bjlk_HB_MT64x64x16_SN_SU0_SUM0_TT8_8_WG8_8_1_WGM1
    SolutionIndex: 30
    SolutionNameMin: Cijk_Alik_Bjlk_HB_MT128x64x16_SN_SU0_SUM0_TT8_8_WG16_8_1_WGM1
    SolutionIndex: 31
    SolutionNameMin: Cijk_Alik_Bjlk_HB_MT128x128x16_SN_SU0_SUM0_TT8_8_WG16_16_1_WGM1
    SolutionIndex: 32
    SolutionNameMin: Cijk_Alik_Bjlk_HB_MT64x64x8_SN_SU32_SUM3_TT8_8_WG8_8_1_WGM1
    SolutionIndex: 33
    SolutionNameMin: Cijk_Alik_Bjlk_HB_MT64x64x16_SN_SU32_SUM3_TT8_8_WG8_8_1_WGM1
    SolutionIndex: 34
    SolutionNameMin: Cijk_Alik_Bjlk_HB_MT128x64x16_SN_SU32_SUM3_TT8_8_WG16_8_1_WGM1
    SolutionIndex: 35
    SolutionNameMin: Cijk_Alik_Bjlk_HB_MT128x128x16_SN_SU32_SUM3_TT8_8_WG16_16_1_WGM1
    SolutionIndex: 36
    SolutionNameMin: Cijk_Alik_Bjlk_HB_MT64x64x16_SN_SU0_SUM0_TT8_8_WG8_8_1_WGM4
    SolutionIndex: 37
    SolutionNameMin: Cijk_Alik_Bjlk_HB_MT128x64x16_SN_SU0_SUM0_TT8_8_WG16_8_1_WGM4
    SolutionIndex: 38
    SolutionNameMin: Cijk_Alik_Bjlk_HB_MT128x128x16_SN_SU0_SUM0_TT8_8_WG16_16_1_WGM4
    SolutionIndex: 39
    SolutionNameMin: Cijk_Alik_Bjlk_HB_MT64x64x8_SN_SU32_SUM3_TT8_8_WG8_8_1_WGM4
    SolutionIndex: 40
    SolutionNameMin: Cijk_Alik_Bjlk_HB_MT64x64x16_SN_SU32_SUM3_TT8_8_WG8_8_1_WGM4
    SolutionIndex: 41
    SolutionNameMin: Cijk_Alik_Bjlk_HB_MT128x64x16_SN_SU32_SUM3_TT8_8_WG16_8_1_WGM4
    SolutionIndex: 42
    SolutionNameMin: Cijk_Alik_Bjlk_HB_MT128x128x16_SN_SU32_SUM3_TT8_8_WG16_16_1_WGM4
    SolutionIndex: 43
    SolutionNameMin: Cijk_Alik_Bjlk_HB_MT64x64x8_SN_SU0_SUM0_TT8_8_WG8_8_1_WGM8
    SolutionIndex: 44
    SolutionNameMin: Cijk_Alik_Bjlk_HB_MT64x64x16_SN_SU0_SUM0_TT8_8_WG8_8_1_WGM8
    SolutionIndex: 45
    SolutionNameMin: Cijk_Alik_Bjlk_HB_MT128x64x16_SN_SU0_SUM0_TT8_8_WG16_8_1_WGM8
    SolutionIndex: 46
    SolutionNameMin: Cijk_Alik_Bjlk_HB_MT128x128x16_SN_SU0_SUM0_TT8_8_WG16_16_1_WGM8
    SolutionIndex: 47
    SolutionNameMin: Cijk_Alik_Bjlk_HB_MT64x64x8_SN_SU32_SUM3_TT8_8_WG8_8_1_WGM8
    SolutionIndex: 48
    SolutionNameMin: Cijk_Alik_Bjlk_HB_MT64x64x16_SN_SU32_SUM3_TT8_8_WG8_8_1_WGM8
    SolutionIndex: 49
    SolutionNameMin: Cijk_Alik_Bjlk_HB_MT128x64x16_SN_SU32_SUM3_TT8_8_WG16_8_1_WGM8
    SolutionIndex: 50
    SolutionNameMin: Cijk_Alik_Bjlk_HB_MT128x128x16_SN_SU32_SUM3_TT8_8_WG16_16_1_WGM8
    SolutionIndex: 51
    SolutionNameMin: Cijk_Alik_Bjlk_HB_MT16x16x8_SN_SU0_SUM0_TT2_2_WG8_8_1_WGM1
    SolutionIndex: 52
    SolutionNameMin: Cijk_Alik_Bjlk_HB_MT32x32x8_SN_SU0_SUM0_TT2_2_WG16_16_1_WGM1
    SolutionIndex: 53
    SolutionNameMin: Cijk_Alik_Bjlk_HB_MT64x64x8_SN_SU0_SUM0_TT4_4_WG16_16_1_WGM1
    SolutionIndex: 54
    SolutionNameMin: Cijk_Alik_Bjlk_HB_MT16x16x16_SN_SU0_SUM0_TT2_2_WG8_8_1_WGM1
    SolutionIndex: 55
    SolutionNameMin: Cijk_Alik_Bjlk_HB_MT32x32x16_SN_SU0_SUM0_TT4_4_WG8_8_1_WGM1
    SolutionIndex: 56
    SolutionNameMin: Cijk_Alik_Bjlk_HB_MT32x16x16_SN_SU0_SUM0_TT2_2_WG16_8_1_WGM1
    SolutionIndex: 57
    SolutionNameMin: Cijk_Alik_Bjlk_HB_MT32x32x16_SN_SU0_SUM0_TT2_2_WG16_16_1_WGM1
    SolutionIndex: 58
    SolutionNameMin: Cijk_Alik_Bjlk_HB_MT64x64x16_SN_SU0_SUM0_TT4_4_WG16_16_1_WGM1
    SolutionIndex: 59
    SolutionNameMin: Cijk_Alik_Bjlk_HB_MT16x16x32_SN_SU0_SUM0_TT2_2_WG8_8_1_WGM1
    SolutionIndex: 60
    SolutionNameMin: Cijk_Alik_Bjlk_HB_MT32x32x8_SN_SU32_SUM3_TT2_2_WG16_16_1_WGM1
    SolutionIndex: 61
    SolutionNameMin: Cijk_Alik_Bjlk_HB_MT64x64x8_SN_SU32_SUM3_TT4_4_WG16_16_1_WGM1
    SolutionIndex: 62
    SolutionNameMin: Cijk_Alik_Bjlk_HB_MT16x16x16_SN_SU32_SUM3_TT2_2_WG8_8_1_WGM1
    SolutionIndex: 63
    SolutionNameMin: Cijk_Alik_Bjlk_HB_MT32x32x16_SN_SU32_SUM3_TT2_2_WG16_16_1_WGM1
    SolutionIndex: 64
    SolutionNameMin: Cijk_Alik_Bjlk_HB_MT64x64x16_SN_SU32_SUM3_TT4_4_WG16_16_1_WGM1
    SolutionIndex: 65
    SolutionNameMin: Cijk_Alik_Bjlk_HB_MT64x64x8_SN_SU0_SUM0_TT4_4_WG16_16_1_WGM4
    SolutionIndex: 66
    SolutionNameMin: Cijk_Alik_Bjlk_HB_MT16x16x16_SN_SU0_SUM0_TT2_2_WG8_8_1_WGM4
    SolutionIndex: 67
    SolutionNameMin: Cijk_Alik_Bjlk_HB_MT32x32x16_SN_SU0_SUM0_TT2_2_WG16_16_1_WGM4
    SolutionIndex: 68
    SolutionNameMin: Cijk_Alik_Bjlk_HB_MT64x64x16_SN_SU0_SUM0_TT4_4_WG16_16_1_WGM4
    SolutionIndex: 69
    SolutionNameMin: Cijk_Alik_Bjlk_HB_MT16x16x32_SN_SU0_SUM0_TT2_2_WG8_8_1_WGM4
    SolutionIndex: 70
    SolutionNameMin: Cijk_Alik_Bjlk_HB_MT16x16x8_SN_SU32_SUM3_TT2_2_WG8_8_1_WGM4
    SolutionIndex: 71
    SolutionNameMin: Cijk_Alik_Bjlk_HB_MT32x32x8_SN_SU32_SUM3_TT4_4_WG8_8_1_WGM4
    SolutionIndex: 72
    SolutionNameMin: Cijk_Alik_Bjlk_HB_MT64x32x8_SN_SU32_SUM3_TT4_4_WG16_8_1_WGM4
    SolutionIndex: 73
    SolutionNameMin: Cijk_Alik_Bjlk_HB_MT32x32x8_SN_SU32_SUM3_TT2_2_WG16_16_1_WGM4
    SolutionIndex: 74
    SolutionNameMin: Cijk_Alik_Bjlk_HB_MT64x64x8_SN_SU32_SUM3_TT4_4_WG16_16_1_WGM4
    SolutionIndex: 75
    SolutionNameMin: Cijk_Alik_Bjlk_HB_MT16x16x16_SN_SU32_SUM3_TT2_2_WG8_8_1_WGM4
    SolutionIndex: 76
    SolutionNameMin: Cijk_Alik_Bjlk_HB_MT32x32x16_SN_SU32_SUM3_TT4_4_WG8_8_1_WGM4
    SolutionIndex: 77
    SolutionNameMin: Cijk_Alik_Bjlk_HB_MT64x64x16_SN_SU32_SUM3_TT4_4_WG16_16_1_WGM4
    SolutionIndex: 78
    SolutionNameMin: Cijk_Alik_Bjlk_HB_MT16x16x32_SN_SU32_SUM3_TT2_2_WG8_8_1_WGM4
    SolutionIndex: 79
    SolutionNameMin: Cijk_Alik_Bjlk_HB_MT64x64x8_SN_SU0_SUM0_TT4_4_WG16_16_1_WGM8
    SolutionIndex: 80
    SolutionNameMin: Cijk_Alik_Bjlk_HB_MT16x16x16_SN_SU0_SUM0_TT2_2_WG8_8_1_WGM8
    SolutionIndex: 81
    SolutionNameMin: Cijk_Alik_Bjlk_HB_MT32x32x16_SN_SU0_SUM0_TT4_4_WG8_8_1_WGM8
    SolutionIndex: 82
    SolutionNameMin: Cijk_Alik_Bjlk_HB_MT64x64x16_SN_SU0_SUM0_TT4_4_WG16_16_1_WGM8
    SolutionIndex: 83
    SolutionNameMin: Cijk_Alik_Bjlk_HB_MT16x16x32_SN_SU0_SUM0_TT2_2_WG8_8_1_WGM8
    SolutionIndex: 84
    SolutionNameMin: Cijk_Alik_Bjlk_HB_MT64x32x8_SN_SU32_SUM3_TT4_4_WG16_8_1_WGM8
    SolutionIndex: 85
    SolutionNameMin: Cijk_Alik_Bjlk_HB_MT64x64x8_SN_SU32_SUM3_TT4_4_WG16_16_1_WGM8
    SolutionIndex: 86
    SolutionNameMin: Cijk_Alik_Bjlk_HB_MT16x16x16_SN_SU32_SUM3_TT2_2_WG8_8_1_WGM8
    SolutionIndex: 87
    SolutionNameMin: Cijk_Alik_Bjlk_HB_MT16x16x32_SN_SU32_SUM3_TT2_2_WG8_8_1_WGM8
- - - [2944, 4288, 1, 1280, 2944, 2944, 1280, 4288]
    - [24, 24104.0]
  - - [2368, 5888, 1, 256, 2368, 2368, 256, 5888]
    - [9, 23351.0]
  - - [1024, 5056, 1, 3328, 1024, 1024, 3328, 5056]
    - [4, 24415.0]
  - - [5888, 1024, 1, 1280, 5888, 5888, 1280, 1024]
    - [21, 23771.0]
  - - [5888, 1856, 1, 3328, 5888, 5888, 3328, 1856]
    - [13, 23932.0]
  - - [5056, 704, 1, 256, 5056, 5056, 256, 704]
    - [13, 17700.0]
  - - [5888, 2944, 1, 3328, 5888, 5888, 3328, 2944]
    - [21, 25197.0]
  - - [1856, 4288, 1, 256, 1856, 1856, 256, 4288]
    - [16, 21633.0]
  - - [5056, 5056, 1, 3328, 5056, 5056, 3328, 5056]
    - [15, 24867.0]
  - - [1408, 5888, 1, 1280, 1408, 1408, 1280, 5888]
    - [24, 24264.0]
  - - [448, 3584, 1, 3328, 448, 448, 3328, 3584]
    - [4, 19601.0]
  - - [5888, 1408, 1, 1280, 5888, 5888, 1280, 1408]
    - [21, 24136.0]
  - - [3584, 1856, 1, 3328, 3584, 3584, 3328, 1856]
    - [2, 23946.0]
  - - [5056, 6784, 1, 1280, 5056, 5056, 1280, 6784]
    - [13, 24915.0]
  - - [5056, 5056, 1, 1280, 5056, 5056, 1280, 5056]
    - [24, 24752.0]
  - - [448, 5056, 1, 256, 448, 448, 256, 5056]
    - [16, 17320.0]
  - - [6784, 448, 1, 256, 6784, 6784, 256, 448]
    - [20, 18995.0]
  - - [5888, 704, 1, 1280, 5888, 5888, 1280, 704]
    - [24, 21336.0]
  - - [3584, 1024, 1, 256, 3584, 3584, 256, 1024]
    - [28, 20604.0]
  - - [6784, 4288, 1, 3328, 6784, 6784, 3328, 4288]
    - [13, 24735.0]
  - - [1856, 2368, 1, 3328, 1856, 1856, 3328, 2368]
    - [2, 21911.0]
  - - [5888, 2944, 1, 1280, 5888, 5888, 1280, 2944]
    - [13, 25103.0]
  - - [5888, 1024, 1, 256, 5888, 5888, 256, 1024]
    - [16, 22626.0]
  - - [1408, 2944, 1, 256, 1408, 1408, 256, 2944]
    - [7, 22071.0]
  - - [6784, 5056, 1, 3328, 6784, 6784, 3328, 5056]
    - [24, 25210.0]
  - - [5056, 5056, 1, 256, 5056, 5056, 256, 5056]
    - [7, 23431.0]
  - - [1024, 3584, 1, 1280, 1024, 1024, 1280, 3584]
    - [18, 22837.0]
  - - [2368, 2944, 1, 1280, 2368, 2368, 1280, 2944]
    - [7, 23861.0]
  - - [1408, 4288, 1, 1280, 1408, 1408, 1280, 4288]
    - [21, 23677.0]
  - - [3584, 4288, 1, 1280, 3584, 3584, 1280, 4288]
    - [4, 24511.0]
  - - [2368, 704, 1, 1280, 2368, 2368, 1280, 704]
    - [11, 19466.0]
  - - [5056, 4288, 1, 3328, 5056, 5056, 3328, 4288]
    - [18, 24746.0]
  - - [3584, 2368, 1, 3328, 3584, 3584, 3328, 2368]
    - [2, 23918.0]
  - - [6784, 448, 1, 1280, 6784, 6784, 1280, 448]
    - [20, 19600.0]
  - - [1024, 1408, 1, 3328, 1024, 1024, 3328, 1408]
    - [21, 20016.0]
  - - [4288, 2944, 1, 256, 4288, 4288, 256, 2944]
    - [7, 22771.0]
  - - [5056, 2368, 1, 1280, 5056, 5056, 1280, 2368]
    - [21, 23994.0]
  - - [448, 3584, 1, 1280, 448, 448, 1280, 3584]
    - [0, 19086.0]
  - - [6784, 5888, 1, 256, 6784, 6784, 256, 5888]
    - [15, 24985.0]
  - - [1024, 1408, 1, 256, 1024, 1024, 256, 1408]
    - [6, 18165.0]
  - - [2368, 2368, 1, 3328, 2368, 2368, 3328, 2368]
    - [2, 22411.0]
  - - [5056, 704, 1, 3328, 5056, 5056, 3328, 704]
    - [4, 22112.0]
  - - [1408, 1856, 1, 256, 1408, 1408, 256, 1856]
    - [20, 17945.0]
  - - [5888, 1856, 1, 256, 5888, 5888, 256, 1856]
    - [27, 21826.0]
  - - [704, 5888, 1, 256, 704, 704, 256, 5888]
    - [16, 18889.0]
  - - [4288, 6784, 1, 3328, 4288, 4288, 3328, 6784]
    - [21, 24775.0]
  - - [3584, 704, 1, 3328, 3584, 3584, 3328, 704]
    - [2, 20357.0]
  - - [1408, 1408, 1, 256, 1408, 1408, 256, 1408]
    - [7, 17795.0]
  - - [448, 4288, 1, 256, 448, 448, 256, 4288]
    - [14, 15563.0]
  - - [704, 2368, 1, 1280, 704, 704, 1280, 2368]
    - [4, 18834.0]
  - - [1856, 2368, 1, 1280, 1856, 1856, 1280, 2368]
    - [21, 21380.0]
  - - [1408, 1024, 1, 1280, 1408, 1408, 1280, 1024]
    - [27, 19144.0]
  - - [6784, 704, 1, 256, 6784, 6784, 256, 704]
    - [13, 18938.0]
  - - [1408, 3584, 1, 256, 1408, 1408, 256, 3584]
    - [19, 21459.0]
  - - [3584, 4288, 1, 3328, 3584, 3584, 3328, 4288]
    - [15, 24803.0]
  - - [5888, 1856, 1, 1280, 5888, 5888, 1280, 1856]
    - [16, 23742.0]
  - - [5056, 1024, 1, 3328, 5056, 5056, 3328, 1024]
    - [4, 24591.0]
  - - [2368, 3584, 1, 1280, 2368, 2368, 1280, 3584]
    - [2, 23710.0]
  - - [2944, 3584, 1, 3328, 2944, 2944, 3328, 3584]
    - [21, 24577.0]
  - - [6784, 2944, 1, 256, 6784, 6784, 256, 2944]
    - [7, 24478.0]
  - - [1024, 2368, 1, 256, 1024, 1024, 256, 2368]
    - [1, 18949.0]
  - - [4288, 2368, 1, 3328, 4288, 4288, 3328, 2368]
    - [21, 23624.0]
  - - [1856, 2368, 1, 256, 1856, 1856, 256, 2368]
    - [27, 19788.0]
  - - [3584, 6784, 1, 3328, 3584, 3584, 3328, 6784]
    - [21, 25081.0]
  - - [6784, 1856, 1, 3328, 6784, 6784, 3328, 1856]
    - [21, 24154.0]
  - - [5056, 4288, 1, 1280, 5056, 5056, 1280, 4288]
    - [24, 24609.0]
  - - [1408, 5056, 1, 1280, 1408, 1408, 1280, 5056]
    - [15, 24393.0]
  - - [6784, 5888, 1, 3328, 6784, 6784, 3328, 5888]
    - [15, 25547.0]
  - - [2368, 5056, 1, 1280, 2368, 2368, 1280, 5056]
    - [15, 24035.0]
  - - [1024, 5056, 1, 1280, 1024, 1024, 1280, 5056]
    - [16, 23904.0]
  - - [4288, 1024, 1, 256, 4288, 4288, 256, 1024]
    - [5, 21759.0]
  - - [2368, 1408, 1, 256, 2368, 2368, 256, 1408]
    - [7, 20381.0]
  - - [5888, 448, 1, 1280, 5888, 5888, 1280, 448]
    - [20, 19243.0]
  - - [704, 5888, 1, 3328, 704, 704, 3328, 5888]
    - [4, 22482.0]
  - - [1024, 6784, 1, 1280, 1024, 1024, 1280, 6784]
    - [16, 23865.0]
  - - [3584, 2944, 1, 1280, 3584, 3584, 1280, 2944]
    - [16, 24404.0]
  - - [2368, 1024, 1, 3328, 2368, 2368, 3328, 1024]
    - [4, 22470.0]
  - - [1408, 5056, 1, 3328, 1408, 1408, 3328, 5056]
    - [18, 24759.0]
  - - [1856, 1856, 1, 3328, 1856, 1856, 3328, 1856]
    - [15, 21427.0]
  - - [2368, 2368, 1, 256, 2368, 2368, 256, 2368]
    - [2, 19773.0]
  - - [4288, 4288, 1, 1280, 4288, 4288, 1280, 4288]
    - [15, 24435.0]
  - - [704, 6784, 1, 3328, 704, 704, 3328, 6784]
    - [2, 22459.0]
  - - [5888, 5888, 1, 3328, 5888, 5888, 3328, 5888]
    - [24, 25513.0]
  - - [5056, 1024, 1, 1280, 5056, 5056, 1280, 1024]
    - [0, 23994.0]
  - - [448, 5888, 1, 3328, 448, 448, 3328, 5888]
    - [0, 19716.0]
  - - [5056, 5888, 1, 1280, 5056, 5056, 1280, 5888]
    - [24, 25101.0]
  - - [448, 6784, 1, 256, 448, 448, 256, 6784]
    - [16, 17985.0]
  - - [3584, 5888, 1, 256, 3584, 3584, 256, 5888]
    - [2, 24326.0]
  - - [2944, 3584, 1, 256, 2944, 2944, 256, 3584]
    - [7, 23529.0]
  - - [6784, 2944, 1, 3328, 6784, 6784, 3328, 2944]
    - [21, 25253.0]
  - - [2944, 5056, 1, 3328, 2944, 2944, 3328, 5056]
    - [24, 25084.0]
  - - [6784, 2368, 1, 1280, 6784, 6784, 1280, 2368]
    - [13, 24147.0]
  - - [4288, 5888, 1, 1280, 4288, 4288, 1280, 5888]
    - [2, 24612.0]
  - - [4288, 4288, 1, 256, 4288, 4288, 256, 4288]
    - [7, 23414.0]
  - - [4288, 1856, 1, 1280, 4288, 4288, 1280, 1856]
    - [2, 23142.0]
  - - [1856, 2944, 1, 3328, 1856, 1856, 3328, 2944]
    - [4, 23138.0]
  - - [256, 6784, 1, 3328, 256, 256, 3328, 6784]
    - [9, 20860.0]
  - - [5056, 1024, 1, 256, 5056, 5056, 256, 1024]
    - [5, 20761.0]
  - - [1408, 1408, 1, 1280, 1408, 1408, 1280, 1408]
    - [2, 19794.0]
  - - [5056, 1856, 1, 3328, 5056, 5056, 3328, 1856]
    - [13, 23926.0]
  - - [1856, 1408, 1, 256, 1856, 1856, 256, 1408]
    - [23, 17171.0]
  - - [5056, 256, 1, 3328, 5056, 5056, 3328, 256]
    - [5, 22099.0]
  - - [5056, 3584, 1, 256, 5056, 5056, 256, 3584]
    - [25, 23770.0]
  - - [1856, 1024, 1, 1280, 1856, 1856, 1280, 1024]
    - [5, 21976.0]
  - - [1856, 1856, 1, 1280, 1856, 1856, 1280, 1856]
    - [15, 20779.0]
  - - [6784, 6784, 1, 1280, 6784, 6784, 1280, 6784]
    - [21, 25271.0]
  - - [1856, 1024, 1, 3328, 1856, 1856, 3328, 1024]
    - [0, 22727.0]
  - - [6784, 1024, 1, 256, 6784, 6784, 256, 1024]
    - [24, 22208.0]
  - - [5056, 5888, 1, 3328, 5056, 5056, 3328, 5888]
    - [15, 25211.0]
  - - [1856, 1024, 1, 256, 1856, 1856, 256, 1024]
    - [3, 18388.0]
  - - [5056, 1408, 1, 3328, 5056, 5056, 3328, 1408]
    - [21, 24527.0]
  - - [4288, 1024, 1, 3328, 4288, 4288, 3328, 1024]
    - [24, 23591.0]
  - - [2944, 1408, 1, 3328, 2944, 2944, 3328, 1408]
    - [7, 23614.0]
  - - [2944, 4288, 1, 3328, 2944, 2944, 3328, 4288]
    - [4, 24455.0]
  - - [5056, 2944, 1, 256, 5056, 5056, 256, 2944]
    - [27, 23406.0]
  - - [2368, 1856, 1, 256, 2368, 2368, 256, 1856]
    - [7, 19815.0]
  - - [1408, 3584, 1, 3328, 1408, 1408, 3328, 3584]
    - [4, 24163.0]
  - - [2368, 6784, 1, 256, 2368, 2368, 256, 6784]
    - [7, 23468.0]
  - - [5056, 1408, 1, 1280, 5056, 5056, 1280, 1408]
    - [27, 24215.0]
  - - [1408, 5888, 1, 3328, 1408, 1408, 3328, 5888]
    - [15, 24647.0]
  - - [1856, 5056, 1, 256, 1856, 1856, 256, 5056]
    - [11, 22027.0]
  - - [6784, 6784, 1, 256, 6784, 6784, 256, 6784]
    - [13, 24806.0]
  - - [2368, 4288, 1, 1280, 2368, 2368, 1280, 4288]
    - [2, 23351.0]
  - - [3584, 1856, 1, 1280, 3584, 3584, 1280, 1856]
    - [13, 23611.0]
  - - [5888, 5056, 1, 256, 5888, 5888, 256, 5056]
    - [7, 24260.0]
  - - [3584, 448, 1, 256, 3584, 3584, 256, 448]
    - [20, 16929.0]
  - - [3584, 3584, 1, 1280, 3584, 3584, 1280, 3584]
    - [4, 24757.0]
  - - [256, 6784, 1, 256, 256, 256, 256, 6784]
    - [14, 18540.0]
  - - [1856, 3584, 1, 3328, 1856, 1856, 3328, 3584]
    - [2, 23968.0]
  - - [5056, 256, 1, 1280, 5056, 5056, 1280, 256]
    - [8, 20388.0]
  - - [3584, 3584, 1, 256, 3584, 3584, 256, 3584]
    - [27, 23180.0]
  - - [6784, 4288, 1, 1280, 6784, 6784, 1280, 4288]
    - [27, 24688.0]
  - - [704, 5056, 1, 256, 704, 704, 256, 5056]
    - [19, 19232.0]
  - - [2944, 2368, 1, 1280, 2944, 2944, 1280, 2368]
    - [13, 23738.0]
  - - [6784, 3584, 1, 256, 6784, 6784, 256, 3584]
    - [7, 24381.0]
  - - [704, 6784, 1, 256, 704, 704, 256, 6784]
    - [14, 19822.0]
  - - [1024, 3584, 1, 3328, 1024, 1024, 3328, 3584]
    - [9, 23175.0]
  - - [2944, 2944, 1, 3328, 2944, 2944, 3328, 2944]
    - [21, 24545.0]
  - - [5056, 6784, 1, 256, 5056, 5056, 256, 6784]
    - [27, 24182.0]
  - - [1408, 4288, 1, 3328, 1408, 1408, 3328, 4288]
    - [2, 24020.0]
  - - [6784, 256, 1, 1280, 6784, 6784, 1280, 256]
    - [28, 20257.0]
  - - [2368, 704, 1, 3328, 2368, 2368, 3328, 704]
    - [15, 19865.0]
  - - [3584, 6784, 1, 256, 3584, 3584, 256, 6784]
    - [27, 24394.0]
  - - [5056, 1856, 1, 256, 5056, 5056, 256, 1856]
    - [16, 22239.0]
  - - [704, 4288, 1, 256, 704, 704, 256, 4288]
    - [23, 17981.0]
  - - [1408, 6784, 1, 1280, 1408, 1408, 1280, 6784]
    - [24, 24317.0]
  - - [5056, 2368, 1, 3328, 5056, 5056, 3328, 2368]
    - [13, 24170.0]
  - - [2944, 4288, 1, 256, 2944, 2944, 256, 4288]
    - [28, 22650.0]
  - - [1408, 3584, 1, 1280, 1408, 1408, 1280, 3584]
    - [4, 23859.0]
  - - [1024, 1408, 1, 1280, 1024, 1024, 1280, 1408]
    - [2, 19268.0]
  - - [2368, 6784, 1, 3328, 2368, 2368, 3328, 6784]
    - [21, 24289.0]
  - - [5056, 704, 1, 1280, 5056, 5056, 1280, 704]
    - [19, 21029.0]
  - - [1856, 4288, 1, 3328, 1856, 1856, 3328, 4288]
    - [15, 23586.0]
  - - [1408, 5888, 1, 256, 1408, 1408, 256, 5888]
    - [24, 22636.0]
  - - [3584, 704, 1, 1280, 3584, 3584, 1280, 704]
    - [21, 19650.0]
  - - [3584, 448, 1, 3328, 3584, 3584, 3328, 448]
    - [28, 19015.0]
  - - [704, 2368, 1, 3328, 704, 704, 3328, 2368]
    - [24, 19894.0]
  - - [448, 5056, 1, 3328, 448, 448, 3328, 5056]
    - [5, 20760.0]
  - - [4288, 448, 1, 256, 4288, 4288, 256, 448]
    - [20, 15349.0]
  - - [448, 5888, 1, 256, 448, 448, 256, 5888]
    - [10, 16217.0]
  - - [5888, 2368, 1, 256, 5888, 5888, 256, 2368]
    - [27, 23100.0]
  - - [6784, 704, 1, 3328, 6784, 6784, 3328, 704]
    - [4, 22546.0]
  - - [1408, 2944, 1, 3328, 1408, 1408, 3328, 2944]
    - [13, 23666.0]
  - - [2368, 704, 1, 256, 2368, 2368, 256, 704]
    - [14, 14985.0]
  - - [3584, 2368, 1, 256, 3584, 3584, 256, 2368]
    - [27, 21618.0]
  - - [5888, 5056, 1, 1280, 5888, 5888, 1280, 5056]
    - [24, 25066.0]
  - - [3584, 3584, 1, 3328, 3584, 3584, 3328, 3584]
    - [24, 24940.0]
  - - [5888, 6784, 1, 256, 5888, 5888, 256, 6784]
    - [27, 24835.0]
  - - [4288, 2944, 1, 3328, 4288, 4288, 3328, 2944]
    - [21, 24301.0]
  - - [4288, 704, 1, 1280, 4288, 4288, 1280, 704]
    - [2, 20031.0]
  - - [256, 5056, 1, 1280, 256, 256, 1280, 5056]
    - [19, 20155.0]
  - - [6784, 5888, 1, 1280, 6784, 6784, 1280, 5888]
    - [4, 25480.0]
  - - [5888, 4288, 1, 1280, 5888, 5888, 1280, 4288]
    - [13, 24610.0]
  - - [3584, 1024, 1, 3328, 3584, 3584, 3328, 1024]
    - [4, 23268.0]
  - - [1408, 1856, 1, 1280, 1408, 1408, 1280, 1856]
    - [27, 20354.0]
  - - [5888, 448, 1, 3328, 5888, 5888, 3328, 448]
    - [24, 19395.0]
  - - [704, 5888, 1, 1280, 704, 704, 1280, 5888]
    - [0, 21672.0]
  - - [1024, 6784, 1, 3328, 1024, 1024, 3328, 6784]
    - [4, 24145.0]
  - - [704, 2944, 1, 1280, 704, 704, 1280, 2944]
    - [13, 20273.0]
  - - [5056, 2944, 1, 3328, 5056, 5056, 3328, 2944]
    - [21, 24882.0]
  - - [1408, 1408, 1, 3328, 1408, 1408, 3328, 1408]
    - [2, 20403.0]
  - - [448, 4288, 1, 1280, 448, 448, 1280, 4288]
    - [13, 19139.0]
  - - [3584, 704, 1, 256, 3584, 3584, 256, 704]
    - [26, 17252.0]
  - - [3584, 1408, 1, 3328, 3584, 3584, 3328, 1408]
    - [21, 23596.0]
  - - [2368, 1024, 1, 1280, 2368, 2368, 1280, 1024]
    - [19, 21209.0]
  - - [1856, 6784, 1, 256, 1856, 1856, 256, 6784]
    - [16, 22909.0]
  - - [4288, 448, 1, 3328, 4288, 4288, 3328, 448]
    - [2, 19635.0]
  - - [4288, 3584, 1, 1280, 4288, 4288, 1280, 3584]
    - [4, 24757.0]
  - - [5888, 1024, 1, 3328, 5888, 5888, 3328, 1024]
    - [2, 24048.0]
  - - [704, 6784, 1, 1280, 704, 704, 1280, 6784]
    - [22, 21175.0]
  - - [1024, 2944, 1, 3328, 1024, 1024, 3328, 2944]
    - [24, 22282.0]
  - - [704, 5056, 1, 1280, 704, 704, 1280, 5056]
    - [24, 21420.0]
  - - [1024, 5888, 1, 1280, 1024, 1024, 1280, 5888]
    - [16, 23833.0]
  - - [2944, 1856, 1, 256, 2944, 2944, 256, 1856]
    - [27, 20953.0]
  - - [3584, 5056, 1, 256, 3584, 3584, 256, 5056]
    - [16, 23680.0]
  - - [5888, 5056, 1, 3328, 5888, 5888, 3328, 5056]
    - [15, 25181.0]
  - - [3584, 6784, 1, 1280, 3584, 3584, 1280, 6784]
    - [21, 24972.0]
  - - [4288, 1856, 1, 256, 4288, 4288, 256, 1856]
    - [7, 21809.0]
  - - [1856, 5888, 1, 256, 1856, 1856, 256, 5888]
    - [2, 22834.0]
  - - [4288, 4288, 1, 3328, 4288, 4288, 3328, 4288]
    - [15, 24628.0]
  - - [4288, 1408, 1, 1280, 4288, 4288, 1280, 1408]
    - [13, 23508.0]
  - - [4288, 2368, 1, 256, 4288, 4288, 256, 2368]
    - [2, 22179.0]
  - - [2944, 5056, 1, 1280, 2944, 2944, 1280, 5056]
    - [24, 24902.0]
  - - [6784, 2368, 1, 3328, 6784, 6784, 3328, 2368]
    - [21, 24288.0]
  - - [4288, 1856, 1, 3328, 4288, 4288, 3328, 1856]
    - [2, 23338.0]
  - - [1856, 2944, 1, 1280, 1856, 1856, 1280, 2944]
    - [24, 22795.0]
  - - [3584, 1024, 1, 1280, 3584, 3584, 1280, 1024]
    - [15, 22893.0]
  - - [1024, 4288, 1, 256, 1024, 1024, 256, 4288]
    - [27, 19387.0]
  - - [5888, 3584, 1, 3328, 5888, 5888, 3328, 3584]
    - [21, 25082.0]
  - - [5056, 3584, 1, 3328, 5056, 5056, 3328, 3584]
    - [24, 25144.0]
  - - [2368, 1408, 1, 1280, 2368, 2368, 1280, 1408]
    - [2, 21745.0]
  - - [5056, 2944, 1, 1280, 5056, 5056, 1280, 2944]
    - [13, 24728.0]
  - - [1024, 6784, 1, 256, 1024, 1024, 256, 6784]
    - [7, 22858.0]
  - - [3584, 2944, 1, 256, 3584, 3584, 256, 2944]
    - [16, 23525.0]
  - - [3584, 1408, 1, 1280, 3584, 3584, 1280, 1408]
    - [13, 23555.0]
  - - [5056, 6784, 1, 3328, 5056, 5056, 3328, 6784]
    - [22, 25086.0]
  - - [3584, 4288, 1, 256, 3584, 3584, 256, 4288]
    - [27, 22818.0]
  - - [1856, 6784, 1, 3328, 1856, 1856, 3328, 6784]
    - [21, 24203.0]
  - - [5056, 1408, 1, 256, 5056, 5056, 256, 1408]
    - [16, 21415.0]
  - - [5888, 5888, 1, 256, 5888, 5888, 256, 5888]
    - [24, 24848.0]
  - - [4288, 1024, 1, 1280, 4288, 4288, 1280, 1024]
    - [4, 23286.0]
  - - [448, 6784, 1, 3328, 448, 448, 3328, 6784]
    - [2, 20506.0]
  - - [2944, 1408, 1, 1280, 2944, 2944, 1280, 1408]
    - [13, 23113.0]
  - - [2944, 1856, 1, 3328, 2944, 2944, 3328, 1856]
    - [2, 22970.0]
  - - [3584, 5888, 1, 1280, 3584, 3584, 1280, 5888]
    - [21, 25027.0]
  - - [6784, 1856, 1, 1280, 6784, 6784, 1280, 1856]
    - [13, 24030.0]
  - - [5888, 256, 1, 3328, 5888, 5888, 3328, 256]
    - [7, 21254.0]
  - - [1856, 5888, 1, 3328, 1856, 1856, 3328, 5888]
    - [13, 23987.0]
  - - [3584, 1408, 1, 256, 3584, 3584, 256, 1408]
    - [7, 22235.0]
  - - [704, 3584, 1, 3328, 704, 704, 3328, 3584]
    - [2, 20528.0]
  - - [5056, 448, 1, 1280, 5056, 5056, 1280, 448]
    - [16, 19298.0]
  - - [4288, 704, 1, 256, 4288, 4288, 256, 704]
    - [12, 17113.0]
  - - [2944, 1024, 1, 256, 2944, 2944, 256, 1024]
    - [11, 19294.0]
  - - [2368, 4288, 1, 3328, 2368, 2368, 3328, 4288]
    - [13, 23636.0]
  - - [6784, 5056, 1, 256, 6784, 6784, 256, 5056]
    - [7, 24274.0]
  - - [3584, 5056, 1, 3328, 3584, 3584, 3328, 5056]
    - [24, 25113.0]
  - - [4288, 5888, 1, 256, 4288, 4288, 256, 5888]
    - [16, 23812.0]
  - - [2944, 6784, 1, 256, 2944, 2944, 256, 6784]
    - [2, 24492.0]
  - - [2368, 2368, 1, 1280, 2368, 2368, 1280, 2368]
    - [2, 22139.0]
  - - [1856, 3584, 1, 1280, 1856, 1856, 1280, 3584]
    - [21, 23695.0]
  - - [5056, 3584, 1, 1280, 5056, 5056, 1280, 3584]
    - [24, 25024.0]
  - - [256, 5888, 1, 256, 256, 256, 256, 5888]
    - [14, 18588.0]
  - - [1856, 1408, 1, 3328, 1856, 1856, 3328, 1408]
    - [2, 21108.0]
  - - [1024, 4288, 1, 3328, 1024, 1024, 3328, 4288]
    - [4, 23695.0]
  - - [2944, 2368, 1, 3328, 2944, 2944, 3328, 2368]
    - [27, 23856.0]
  - - [1024, 1856, 1, 1280, 1024, 1024, 1280, 1856]
    - [7, 21062.0]
  - - [6784, 1856, 1, 256, 6784, 6784, 256, 1856]
    - [13, 22215.0]
  - - [1024, 5888, 1, 256, 1024, 1024, 256, 5888]
    - [2, 21709.0]
  - - [1408, 2368, 1, 256, 1408, 1408, 256, 2368]
    - [27, 18579.0]
  - - [2944, 704, 1, 3328, 2944, 2944, 3328, 704]
    - [13, 21100.0]
  - - [2944, 2944, 1, 1280, 2944, 2944, 1280, 2944]
    - [21, 24368.0]
  - - [6784, 256, 1, 3328, 6784, 6784, 3328, 256]
    - [4, 21266.0]
  - - [1408, 5056, 1, 256, 1408, 1408, 256, 5056]
    - [16, 22372.0]
  - - [5056, 256, 1, 256, 5056, 5056, 256, 256]
    - [8, 16069.0]
  - - [1408, 4288, 1, 256, 1408, 1408, 256, 4288]
    - [16, 21000.0]
  - - [5888, 2368, 1, 1280, 5888, 5888, 1280, 2368]
    - [13, 24234.0]
  - - [2368, 5888, 1, 1280, 2368, 2368, 1280, 5888]
    - [15, 24442.0]
  - - [5888, 256, 1, 1280, 5888, 5888, 1280, 256]
    - [7, 20693.0]
  - - [2368, 1856, 1, 3328, 2368, 2368, 3328, 1856]
    - [2, 21909.0]
  - - [2944, 704, 1, 256, 2944, 2944, 256, 704]
    - [12, 18183.0]
  - - [2368, 6784, 1, 1280, 2368, 2368, 1280, 6784]
    - [2, 24206.0]
  - - [1856, 4288, 1, 1280, 1856, 1856, 1280, 4288]
    - [24, 23261.0]
  - - [704, 3584, 1, 256, 704, 704, 256, 3584]
    - [3, 18164.0]
  - - [704, 2944, 1, 3328, 704, 704, 3328, 2944]
    - [2, 21420.0]
  - - [1856, 5056, 1, 3328, 1856, 1856, 3328, 5056]
    - [4, 24118.0]
  - - [3584, 5056, 1, 1280, 3584, 3584, 1280, 5056]
    - [24, 24907.0]
  - - [2944, 1024, 1, 3328, 2944, 2944, 3328, 1024]
    - [4, 22728.0]
  - - [1408, 6784, 1, 256, 1408, 1408, 256, 6784]
    - [27, 23333.0]
  - - [6784, 1408, 1, 3328, 6784, 6784, 3328, 1408]
    - [2, 24419.0]
  - - [1024, 2368, 1, 1280, 1024, 1024, 1280, 2368]
    - [4, 21023.0]
  - - [6784, 2944, 1, 1280, 6784, 6784, 1280, 2944]
    - [7, 25195.0]
  - - [3584, 448, 1, 1280, 3584, 3584, 1280, 448]
    - [20, 18728.0]
  - - [2944, 6784, 1, 3328, 2944, 2944, 3328, 6784]
    - [21, 25269.0]
  - - [448, 5056, 1, 1280, 448, 448, 1280, 5056]
    - [0, 19995.0]
  - - [5888, 704, 1, 256, 5888, 5888, 256, 704]
    - [17, 18748.0]
  - - [256, 5888, 1, 3328, 256, 256, 3328, 5888]
    - [7, 21287.0]
  - - [6784, 4288, 1, 256, 6784, 6784, 256, 4288]
    - [27, 23933.0]
  - - [5888, 256, 1, 256, 5888, 5888, 256, 256]
    - [14, 18463.0]
  - - [6784, 1024, 1, 1280, 6784, 6784, 1280, 1024]
    - [24, 24103.0]
  - - [2944, 704, 1, 1280, 2944, 2944, 1280, 704]
    - [13, 20748.0]
  - - [6784, 3584, 1, 1280, 6784, 6784, 1280, 3584]
    - [21, 25047.0]
  - - [1408, 2944, 1, 1280, 1408, 1408, 1280, 2944]
    - [13, 23552.0]
  - - [1408, 2368, 1, 3328, 1408, 1408, 3328, 2368]
    - [2, 22448.0]
  - - [1024, 3584, 1, 256, 1024, 1024, 256, 3584]
    - [7, 19830.0]
  - - [2368, 2944, 1, 256, 2368, 2368, 256, 2944]
    - [7, 21261.0]
  - - [2944, 5888, 1, 256, 2944, 2944, 256, 5888]
    - [7, 24420.0]
  - - [3584, 1856, 1, 256, 3584, 3584, 256, 1856]
    - [16, 21732.0]
  - - [704, 4288, 1, 3328, 704, 704, 3328, 4288]
    - [2, 20500.0]
  - - [4288, 2944, 1, 1280, 4288, 4288, 1280, 2944]
    - [13, 24097.0]
  - - [4288, 5056, 1, 3328, 4288, 4288, 3328, 5056]
    - [15, 24800.0]
  - - [256, 5056, 1, 3328, 256, 256, 3328, 5056]
    - [0, 21516.0]
  - - [5056, 2368, 1, 256, 5056, 5056, 256, 2368]
    - [27, 22731.0]
  - - [4288, 704, 1, 3328, 4288, 4288, 3328, 704]
    - [2, 20357.0]
  - - [448, 3584, 1, 256, 448, 448, 256, 3584]
    - [17, 14893.0]
  - - [2944, 5888, 1, 1280, 2944, 2944, 1280, 5888]
    - [16, 25090.0]
  - - [5888, 3584, 1, 256, 5888, 5888, 256, 3584]
    - [13, 24339.0]
  - - [1408, 1856, 1, 3328, 1408, 1408, 3328, 1856]
    - [2, 21277.0]
  - - [6784, 1408, 1, 1280, 6784, 6784, 1280, 1408]
    - [21, 24240.0]
  - - [704, 2944, 1, 256, 704, 704, 256, 2944]
    - [17, 18436.0]
  - - [2944, 5888, 1, 3328, 2944, 2944, 3328, 5888]
    - [21, 25212.0]
  - - [1408, 6784, 1, 3328, 1408, 1408, 3328, 6784]
    - [24, 24561.0]
  - - [448, 4288, 1, 3328, 448, 448, 3328, 4288]
    - [2, 19463.0]
  - - [704, 2368, 1, 256, 704, 704, 256, 2368]
    - [23, 15429.0]
  - - [5888, 2368, 1, 3328, 5888, 5888, 3328, 2368]
    - [13, 24378.0]
  - - [4288, 5056, 1, 256, 4288, 4288, 256, 5056]
    - [16, 23527.0]
  - - [4288, 448, 1, 1280, 4288, 4288, 1280, 448]
    - [20, 19213.0]
  - - [5888, 704, 1, 3328, 5888, 5888, 3328, 704]
    - [15, 22162.0]
  - - [4288, 3584, 1, 3328, 4288, 4288, 3328, 3584]
    - [4, 24867.0]
  - - [6784, 6784, 1, 3328, 6784, 6784, 3328, 6784]
    - [13, 25314.0]
  - - [704, 5056, 1, 3328, 704, 704, 3328, 5056]
    - [4, 22241.0]
  - - [2368, 2944, 1, 3328, 2368, 2368, 3328, 2944]
    - [2, 24036.0]
  - - [2368, 3584, 1, 256, 2368, 2368, 256, 3584]
    - [7, 21831.0]
  - - [3584, 2368, 1, 1280, 3584, 3584, 1280, 2368]
    - [21, 23742.0]
  - - [1856, 1856, 1, 256, 1856, 1856, 256, 1856]
    - [11, 19288.0]
  - - [4288, 1408, 1, 3328, 4288, 4288, 3328, 1408]
    - [7, 24014.0]
  - - [4288, 5056, 1, 1280, 4288, 4288, 1280, 5056]
    - [15, 24657.0]
  - - [5888, 6784, 1, 1280, 5888, 5888, 1280, 6784]
    - [21, 25317.0]
  - - [5888, 1408, 1, 3328, 5888, 5888, 3328, 1408]
    - [2, 24328.0]
  - - [256, 5056, 1, 256, 256, 256, 256, 5056]
    - [12, 16975.0]
  - - [1408, 1024, 1, 256, 1408, 1408, 256, 1024]
    - [20, 18005.0]
  - - [2368, 5056, 1, 256, 2368, 2368, 256, 5056]
    - [21, 22761.0]
  - - [1024, 5056, 1, 256, 1024, 1024, 256, 5056]
    - [21, 21594.0]
  - - [2368, 1408, 1, 3328, 2368, 2368, 3328, 1408]
    - [2, 22528.0]
  - - [5888, 448, 1, 256, 5888, 5888, 256, 448]
    - [26, 18163.0]
  - - [6784, 5056, 1, 1280, 6784, 6784, 1280, 5056]
    - [24, 25097.0]
  - - [4288, 6784, 1, 1280, 4288, 4288, 1280, 6784]
    - [13, 24673.0]
  - - [6784, 1408, 1, 256, 6784, 6784, 256, 1408]
    - [7, 23328.0]
  - - [5888, 4288, 1, 256, 5888, 5888, 256, 4288]
    - [27, 23842.0]
  - - [5056, 5888, 1, 256, 5056, 5056, 256, 5888]
    - [4, 24345.0]
  - - [2368, 1024, 1, 256, 2368, 2368, 256, 1024]
    - [3, 18731.0]
  - - [1856, 6784, 1, 1280, 1856, 1856, 1280, 6784]
    - [13, 24042.0]
  - - [4288, 3584, 1, 256, 4288, 4288, 256, 3584]
    - [28, 23335.0]
  - - [5056, 1856, 1, 1280, 5056, 5056, 1280, 1856]
    - [13, 23632.0]
  - - [1408, 1024, 1, 3328, 1408, 1408, 3328, 1024]
    - [2, 20117.0]
  - - [5888, 3584, 1, 1280, 5888, 5888, 1280, 3584]
    - [2, 25016.0]
  - - [1024, 2944, 1, 256, 1024, 1024, 256, 2944]
    - [7, 20299.0]
  - - [448, 6784, 1, 1280, 448, 448, 1280, 6784]
    - [13, 19406.0]
  - - [2944, 1856, 1, 1280, 2944, 2944, 1280, 1856]
    - [21, 22288.0]
  - - [2368, 3584, 1, 3328, 2368, 2368, 3328, 3584]
    - [13, 24023.0]
  - - [3584, 5888, 1, 3328, 3584, 3584, 3328, 5888]
    - [13, 25091.0]
  - - [2944, 3584, 1, 1280, 2944, 2944, 1280, 3584]
    - [13, 24308.0]
  - - [1856, 5888, 1, 1280, 1856, 1856, 1280, 5888]
    - [21, 23804.0]
  - - [5056, 448, 1, 3328, 5056, 5056, 3328, 448]
    - [4, 20695.0]
  - - [4288, 1408, 1, 256, 4288, 4288, 256, 1408]
    - [7, 21080.0]
  - - [4288, 2368, 1, 1280, 4288, 4288, 1280, 2368]
    - [2, 23428.0]
  - - [2944, 5056, 1, 256, 2944, 2944, 256, 5056]
    - [16, 23647.0]
  - - [6784, 2368, 1, 256, 6784, 6784, 256, 2368]
    - [21, 23180.0]
  - - [1856, 2944, 1, 256, 1856, 1856, 256, 2944]
    - [16, 21085.0]
  - - [1856, 1408, 1, 1280, 1856, 1856, 1280, 1408]
    - [7, 20885.0]
  - - [1024, 4288, 1, 1280, 1024, 1024, 1280, 4288]
    - [9, 22626.0]
  - - [2368, 5056, 1, 3328, 2368, 2368, 3328, 5056]
    - [24, 24365.0]
  - - [1024, 1856, 1, 3328, 1024, 1024, 3328, 1856]
    - [2, 22374.0]
  - - [704, 3584, 1, 1280, 704, 704, 1280, 3584]
    - [21, 19702.0]
  - - [4288, 6784, 1, 256, 4288, 4288, 256, 6784]
    - [2, 23907.0]
  - - [3584, 2944, 1, 3328, 3584, 3584, 3328, 2944]
    - [2, 24572.0]
  - - [5888, 2944, 1, 256, 5888, 5888, 256, 2944]
    - [27, 24393.0]
  - - [5056, 4288, 1, 256, 5056, 5056, 256, 4288]
    - [27, 23575.0]
  - - [6784, 1024, 1, 3328, 6784, 6784, 3328, 1024]
    - [9, 24304.0]
  - - [5888, 5888, 1, 1280, 5888, 5888, 1280, 5888]
    - [15, 25438.0]
  - - [448, 5888, 1, 1280, 448, 448, 1280, 5888]
    - [5, 19123.0]
  - - [2944, 1408, 1, 256, 2944, 2944, 256, 1408]
    - [7, 20767.0]
  - - [1024, 2944, 1, 1280, 1024, 1024, 1280, 2944]
    - [2, 21601.0]
  - - [2368, 5888, 1, 3328, 2368, 2368, 3328, 5888]
    - [24, 24595.0]
  - - [2368, 1856, 1, 1280, 2368, 2368, 1280, 1856]
    - [2, 21690.0]
  - - [5888, 4288, 1, 3328, 5888, 5888, 3328, 4288]
    - [21, 24728.0]
  - - [6784, 704, 1, 1280, 6784, 6784, 1280, 704]
    - [15, 21924.0]
  - - [5056, 448, 1, 256, 5056, 5056, 256, 448]
    - [7, 15324.0]
  - - [1856, 5056, 1, 1280, 1856, 1856, 1280, 5056]
    - [15, 23850.0]
  - - [2944, 1024, 1, 1280, 2944, 2944, 1280, 1024]
    - [4, 22380.0]
  - - [2368, 4288, 1, 256, 2368, 2368, 256, 4288]
    - [7, 22244.0]
  - - [1024, 2368, 1, 3328, 1024, 1024, 3328, 2368]
    - [4, 22425.0]
  - - [4288, 5888, 1, 3328, 4288, 4288, 3328, 5888]
    - [13, 24732.0]
  - - [2944, 6784, 1, 1280, 2944, 2944, 1280, 6784]
    - [21, 25140.0]
  - - [256, 6784, 1, 1280, 256, 256, 1280, 6784]
    - [2, 20409.0]
  - - [1856, 3584, 1, 256, 1856, 1856, 256, 3584]
    - [5, 20706.0]
  - - [256, 5888, 1, 1280, 256, 256, 1280, 5888]
    - [7, 20595.0]
  - - [2944, 2368, 1, 256, 2944, 2944, 256, 2368]
    - [2, 21903.0]
  - - [1024, 1856, 1, 256, 1024, 1024, 256, 1856]
    - [1, 16471.0]
  - - [6784, 3584, 1, 3328, 6784, 6784, 3328, 3584]
    - [13, 25094.0]
  - - [1024, 5888, 1, 3328, 1024, 1024, 3328, 5888]
    - [2, 24024.0]
  - - [1408, 2368, 1, 1280, 1408, 1408, 1280, 2368]
    - [21, 21349.0]
  - - [2944, 2944, 1, 256, 2944, 2944, 256, 2944]
    - [2, 22673.0]
  - - [6784, 256, 1, 256, 6784, 6784, 256, 256]
    - [0, 17727.0]
  - - [5888, 1408, 1, 256, 5888, 5888, 256, 1408]
    - [27, 22383.0]
  - - [5888, 6784, 1, 3328, 5888, 5888, 3328, 6784]
    - [22, 25420.0]
  - - [704, 4288, 1, 1280, 704, 704, 1280, 4288]
    - [2, 19704.0]
  - - [6784, 448, 1, 3328, 6784, 6784, 3328, 448]
    - [21, 20354.0]
  - - [1024, 1024, 1, 3328, 1024, 1024, 3328, 1024]
    - [30, 18149.0]
  - - [64, 6784, 1, 256, 64, 64, 256, 6784]
    - [36, 10506.0]
  - - [128, 6784, 1, 3328, 128, 128, 3328, 6784]
    - [31, 19105.0]
  - - [256, 4288, 1, 3328, 256, 256, 3328, 4288]
    - [30, 18733.0]
  - - [704, 1856, 1, 3328, 704, 704, 3328, 1856]
    - [44, 17953.0]
  - - [448, 1024, 1, 1280, 448, 448, 1280, 1024]
    - [29, 14600.0]
  - - [2368, 128, 1, 256, 2368, 2368, 256, 128]
    - [47, 7592.0]
  - - [256, 1856, 1, 1280, 256, 256, 1280, 1856]
    - [45, 16209.0]
  - - [448, 704, 1, 1280, 448, 448, 1280, 704]
    - [36, 13039.0]
  - - [128, 3584, 1, 1280, 128, 128, 1280, 3584]
    - [33, 15292.0]
  - - [4288, 256, 1, 256, 4288, 4288, 256, 256]
    - [36, 13748.0]
  - - [5888, 64, 1, 3328, 5888, 5888, 3328, 64]
    - [41, 13424.0]
  - - [2944, 256, 1, 3328, 2944, 2944, 3328, 256]
    - [45, 17353.0]
  - - [256, 4288, 1, 1280, 256, 256, 1280, 4288]
    - [49, 18319.0]
  - - [1408, 448, 1, 1280, 1408, 1408, 1280, 448]
    - [37, 16357.0]
  - - [6784, 128, 1, 1280, 6784, 6784, 1280, 128]
    - [46, 17699.0]
  - - [2368, 128, 1, 3328, 2368, 2368, 3328, 128]
    - [42, 15562.0]
  - - [2944, 128, 1, 256, 2944, 2944, 256, 128]
    - [49, 9067.0]
  - - [448, 1408, 1, 256, 448, 448, 256, 1408]
    - [29, 12836.0]
  - - [64, 5056, 1, 3328, 64, 64, 3328, 5056]
    - [40, 15095.0]
  - - [2368, 256, 1, 1280, 2368, 2368, 1280, 256]
    - [31, 16920.0]
  - - [256, 3584, 1, 3328, 256, 256, 3328, 3584]
    - [46, 19805.0]
  - - [5056, 64, 1, 1280, 5056, 5056, 1280, 64]
    - [34, 13241.0]
  - - [1024, 704, 1, 256, 1024, 1024, 256, 704]
    - [45, 11171.0]
  - - [4288, 128, 1, 1280, 4288, 4288, 1280, 128]
    - [35, 15413.0]
  - - [5888, 64, 1, 256, 5888, 5888, 256, 64]
    - [34, 8932.0]
  - - [1856, 256, 1, 1280, 1856, 1856, 1280, 256]
    - [33, 15562.0]
  - - [64, 5888, 1, 3328, 64, 64, 3328, 5888]
    - [44, 14495.0]
  - - [256, 1408, 1, 3328, 256, 256, 3328, 1408]
    - [40, 13252.0]
  - - [6784, 128, 1, 3328, 6784, 6784, 3328, 128]
    - [42, 18746.0]
  - - [704, 704, 1, 3328, 704, 704, 3328, 704]
    - [31, 15304.0]
  - - [3584, 256, 1, 3328, 3584, 3584, 3328, 256]
    - [38, 19766.0]
  - - [128, 3584, 1, 3328, 128, 128, 3328, 3584]
    - [30, 16796.0]
  - - [128, 2944, 1, 1280, 128, 128, 1280, 2944]
    - [33, 12980.0]
  - - [448, 1856, 1, 1280, 448, 448, 1280, 1856]
    - [44, 17804.0]
  - - [3584, 128, 1, 256, 3584, 3584, 256, 128]
    - [36, 10618.0]
  - - [448, 1408, 1, 3328, 448, 448, 3328, 1408]
    - [36, 16965.0]
  - - [256, 3584, 1, 256, 256, 256, 256, 3584]
    - [46, 15173.0]
  - - [256, 2944, 1, 3328, 256, 256, 3328, 2944]
    - [45, 17428.0]
  - - [1408, 704, 1, 256, 1408, 1408, 256, 704]
    - [48, 13440.0]
  - - [448, 2944, 1, 3328, 448, 448, 3328, 2944]
    - [29, 18566.0]
  - - [64, 5888, 1, 256, 64, 64, 256, 5888]
    - [36, 7455.0]
  - - [448, 2368, 1, 1280, 448, 448, 1280, 2368]
    - [29, 16625.0]
  - - [128, 4288, 1, 3328, 128, 128, 3328, 4288]
    - [38, 16459.0]
  - - [256, 2368, 1, 256, 256, 256, 256, 2368]
    - [37, 10572.0]
  - - [1024, 448, 1, 3328, 1024, 1024, 3328, 448]
    - [37, 16187.0]
  - - [1856, 704, 1, 1280, 1856, 1856, 1280, 704]
    - [44, 17758.0]
  - - [1024, 1024, 1, 1280, 1024, 1024, 1280, 1024]
    - [37, 17702.0]
  - - [256, 2944, 1, 256, 256, 256, 256, 2944]
    - [48, 13361.0]
  - - [128, 6784, 1, 1280, 128, 128, 1280, 6784]
    - [31, 18257.0]
  - - [1408, 704, 1, 3328, 1408, 1408, 3328, 704]
    - [45, 17001.0]
  - - [128, 5888, 1, 1280, 128, 128, 1280, 5888]
    - [49, 16948.0]
  - - [704, 1408, 1, 3328, 704, 704, 3328, 1408]
    - [44, 18298.0]
  - - [6784, 128, 1, 256, 6784, 6784, 256, 128]
    - [34, 13773.0]
  - - [704, 448, 1, 256, 704, 704, 256, 448]
    - [40, 8464.0]
  - - [256, 1856, 1, 3328, 256, 256, 3328, 1856]
    - [34, 17147.0]
  - - [128, 4288, 1, 256, 128, 128, 256, 4288]
    - [49, 9624.0]
  - - [64, 6784, 1, 3328, 64, 64, 3328, 6784]
    - [44, 15457.0]
  - - [2944, 256, 1, 1280, 2944, 2944, 1280, 256]
    - [45, 16208.0]
  - - [1856, 704, 1, 256, 1856, 1856, 256, 704]
    - [36, 14775.0]
  - - [1408, 448, 1, 3328, 1408, 1408, 3328, 448]
    - [45, 17596.0]
  - - [2368, 256, 1, 256, 2368, 2368, 256, 256]
    - [33, 10305.0]
  - - [704, 1856, 1, 256, 704, 704, 256, 1856]
    - [29, 14801.0]
  - - [5888, 64, 1, 1280, 5888, 5888, 1280, 64]
    - [34, 12029.0]
  - - [256, 2368, 1, 1280, 256, 256, 1280, 2368]
    - [48, 16377.0]
  - - [2944, 448, 1, 256, 2944, 2944, 256, 448]
    - [36, 14888.0]
  - - [2368, 128, 1, 1280, 2368, 2368, 1280, 128]
    - [44, 12872.0]
  - - [64, 5056, 1, 1280, 64, 64, 1280, 5056]
    - [44, 13301.0]
  - - [704, 448, 1, 3328, 704, 704, 3328, 448]
    - [36, 14901.0]
  - - [5056, 64, 1, 3328, 5056, 5056, 3328, 64]
    - [49, 14656.0]
  - - [2368, 448, 1, 1280, 2368, 2368, 1280, 448]
    - [30, 16877.0]
  - - [1408, 256, 1, 1280, 1408, 1408, 1280, 256]
    - [29, 11752.0]
  - - [1856, 448, 1, 3328, 1856, 1856, 3328, 448]
    - [36, 17834.0]
  - - [128, 5056, 1, 256, 128, 128, 256, 5056]
    - [36, 13107.0]
  - - [4288, 256, 1, 1280, 4288, 4288, 1280, 256]
    - [35, 17385.0]
  - - [704, 704, 1, 256, 704, 704, 256, 704]
    - [36, 9037.0]
  - - [4288, 128, 1, 3328, 4288, 4288, 3328, 128]
    - [42, 16600.0]
  - - [256, 1408, 1, 1280, 256, 256, 1280, 1408]
    - [37, 11800.0]
  - - [6784, 64, 1, 3328, 6784, 6784, 3328, 64]
    - [49, 15346.0]
  - - [128, 2944, 1, 3328, 128, 128, 3328, 2944]
    - [37, 13561.0]
  - - [2944, 448, 1, 3328, 2944, 2944, 3328, 448]
    - [42, 17695.0]
  - - [2368, 448, 1, 3328, 2368, 2368, 3328, 448]
    - [45, 17828.0]
  - - [5056, 64, 1, 256, 5056, 5056, 256, 64]
    - [40, 6858.0]
  - - [128, 5056, 1, 3328, 128, 128, 3328, 5056]
    - [46, 19254.0]
  - - [6784, 64, 1, 256, 6784, 6784, 256, 64]
    - [49, 8420.0]
  - - [128, 2368, 1, 256, 128, 128, 256, 2368]
    - [33, 6521.0]
  - - [3584, 256, 1, 256, 3584, 3584, 256, 256]
    - [50, 13530.0]
  - - [128, 2944, 1, 256, 128, 128, 256, 2944]
    - [39, 8691.0]
  - - [3584, 128, 1, 3328, 3584, 3584, 3328, 128]
    - [37, 16173.0]
  - - [1024, 448, 1, 1280, 1024, 1024, 1280, 448]
    - [37, 15709.0]
  - - [5888, 128, 1, 3328, 5888, 5888, 3328, 128]
    - [37, 17547.0]
  - - [1408, 704, 1, 1280, 1408, 1408, 1280, 704]
    - [36, 18043.0]
  - - [448, 1408, 1, 1280, 448, 448, 1280, 1408]
    - [40, 16272.0]
  - - [704, 1408, 1, 1280, 704, 704, 1280, 1408]
    - [44, 17428.0]
  - - [448, 2944, 1, 256, 448, 448, 256, 2944]
    - [29, 15073.0]
  - - [448, 2368, 1, 256, 448, 448, 256, 2368]
    - [29, 13261.0]
  - - [64, 5056, 1, 256, 64, 64, 256, 5056]
    - [33, 6801.0]
  - - [5056, 128, 1, 3328, 5056, 5056, 3328, 128]
    - [35, 19344.0]
  - - [448, 704, 1, 256, 448, 448, 256, 704]
    - [48, 6842.0]
  - - [1856, 256, 1, 3328, 1856, 1856, 3328, 256]
    - [44, 16471.0]
  - - [2944, 128, 1, 3328, 2944, 2944, 3328, 128]
    - [44, 13502.0]
  - - [64, 6784, 1, 1280, 64, 64, 1280, 6784]
    - [44, 14915.0]
  - - [704, 1024, 1, 1280, 704, 704, 1280, 1024]
    - [44, 15849.0]
  - - [256, 4288, 1, 256, 256, 256, 256, 4288]
    - [37, 16022.0]
  - - [256, 2368, 1, 3328, 256, 256, 3328, 2368]
    - [38, 18485.0]
  - - [128, 3584, 1, 256, 128, 128, 256, 3584]
    - [32, 10230.0]
  - - [704, 448, 1, 1280, 704, 704, 1280, 448]
    - [33, 13816.0]
  - - [1024, 704, 1, 1280, 1024, 1024, 1280, 704]
    - [49, 16200.0]
  - - [256, 1856, 1, 256, 256, 256, 256, 1856]
    - [44, 9608.0]
  - - [704, 1856, 1, 1280, 704, 704, 1280, 1856]
    - [36, 17796.0]
  - - [1408, 256, 1, 3328, 1408, 1408, 3328, 256]
    - [36, 13839.0]
  - - [5888, 128, 1, 256, 5888, 5888, 256, 128]
    - [33, 13089.0]
  - - [2368, 448, 1, 256, 2368, 2368, 256, 448]
    - [50, 13326.0]
  - - [4288, 256, 1, 3328, 4288, 4288, 3328, 256]
    - [45, 18157.0]
  - - [2944, 256, 1, 256, 2944, 2944, 256, 256]
    - [37, 13841.0]
  - - [1408, 448, 1, 256, 1408, 1408, 256, 448]
    - [37, 13065.0]
  - - [6784, 64, 1, 1280, 6784, 6784, 1280, 64]
    - [34, 14587.0]
  - - [448, 1024, 1, 3328, 448, 448, 3328, 1024]
    - [29, 16339.0]
  - - [2944, 448, 1, 1280, 2944, 2944, 1280, 448]
    - [44, 17933.0]
  - - [5056, 128, 1, 256, 5056, 5056, 256, 128]
    - [36, 13066.0]
  - - [448, 1024, 1, 256, 448, 448, 256, 1024]
    - [43, 10915.0]
  - - [128, 5056, 1, 1280, 128, 128, 1280, 5056]
    - [35, 18047.0]
  - - [1408, 256, 1, 256, 1408, 1408, 256, 256]
    - [39, 7639.0]
  - - [128, 5888, 1, 3328, 128, 128, 3328, 5888]
    - [37, 17454.0]
  - - [3584, 128, 1, 1280, 3584, 3584, 1280, 128]
    - [44, 14702.0]
  - - [4288, 128, 1, 256, 4288, 4288, 256, 128]
    - [40, 9507.0]
  - - [2368, 256, 1, 3328, 2368, 2368, 3328, 256]
    - [46, 18274.0]
  - - [5888, 128, 1, 1280, 5888, 5888, 1280, 128]
    - [49, 16186.0]
  - - [256, 3584, 1, 1280, 256, 256, 1280, 3584]
    - [31, 19297.0]
  - - [128, 5888, 1, 256, 128, 128, 256, 5888]
    - [41, 13549.0]
  - - [1024, 1024, 1, 256, 1024, 1024, 256, 1024]
    - [30, 15322.0]
  - - [1024, 1024, 1, 1024, 1024, 1024, 1024, 1024]
    - [34, 17330.0]
  - - [64, 5888, 1, 1280, 64, 64, 1280, 5888]
    - [29, 13022.0]
  - - [704, 1024, 1, 256, 704, 704, 256, 1024]
    - [29, 12996.0]
  - - [704, 704, 1, 1280, 704, 704, 1280, 704]
    - [33, 14564.0]
  - - [128, 2368, 1, 1280, 128, 128, 1280, 2368]
    - [37, 13729.0]
  - - [3584, 256, 1, 1280, 3584, 3584, 1280, 256]
    - [50, 19573.0]
  - - [5056, 128, 1, 1280, 5056, 5056, 1280, 128]
    - [42, 18214.0]
  - - [448, 1856, 1, 3328, 448, 448, 3328, 1856]
    - [38, 17666.0]
  - - [1024, 448, 1, 256, 1024, 1024, 256, 448]
    - [41, 10874.0]
  - - [2944, 128, 1, 1280, 2944, 2944, 1280, 128]
    - [29, 12640.0]
  - - [256, 2944, 1, 1280, 256, 256, 1280, 2944]
    - [49, 16296.0]
  - - [704, 1024, 1, 3328, 704, 704, 3328, 1024]
    - [37, 16798.0]
  - - [1856, 448, 1, 1280, 1856, 1856, 1280, 448]
    - [46, 16299.0]
  - - [128, 6784, 1, 256, 128, 128, 256, 6784]
    - [48, 13555.0]
  - - [704, 1408, 1, 256, 704, 704, 256, 1408]
    - [30, 14129.0]
  - - [256, 1408, 1, 256, 256, 256, 256, 1408]
    - [32, 9358.0]
  - - [448, 2944, 1, 1280, 448, 448, 1280, 2944]
    - [44, 17937.0]
  - - [1856, 256, 1, 256, 1856, 1856, 256, 256]
    - [43, 10119.0]
  - - [128, 2368, 1, 3328, 128, 128, 3328, 2368]
    - [35, 15132.0]
  - - [448, 2368, 1, 3328, 448, 448, 3328, 2368]
    - [38, 17409.0]
  - - [1856, 448, 1, 256, 1856, 1856, 256, 448]
    - [35, 12685.0]
  - - [1024, 704, 1, 3328, 1024, 1024, 3328, 704]
    - [37, 16663.0]
  - - [128, 4288, 1, 1280, 128, 128, 1280, 4288]
    - [42, 15326.0]
  - - [448, 704, 1, 3328, 448, 448, 3328, 704]
    - [29, 15468.0]
  - - [448, 1856, 1, 256, 448, 448, 256, 1856]
    - [29, 14620.0]
  - - [1856, 704, 1, 3328, 1856, 1856, 3328, 704]
    - [44, 18193.0]
  - - [2368, 64, 1, 3328, 2368, 2368, 3328, 64]
    - [61, 8241.0]
  - - [1408, 64, 1, 1280, 1408, 1408, 1280, 64]
    - [84, 4685.0]
  - - [2944, 64, 1, 256, 2944, 2944, 256, 64]
    - [74, 4862.0]
  - - [1024, 256, 1, 3328, 1024, 1024, 3328, 256]
    - [79, 8487.0]
  - - [1856, 64, 1, 1280, 1856, 1856, 1280, 64]
    - [61, 6091.0]
  - - [704, 128, 1, 1280, 704, 704, 1280, 128]
    - [72, 4955.0]
  - - [4288, 64, 1, 3328, 4288, 4288, 3328, 64]
    - [85, 8654.0]
  - - [1856, 128, 1, 256, 1856, 1856, 256, 128]
    - [61, 6270.0]
  - - [2944, 64, 1, 1280, 2944, 2944, 1280, 64]
    - [85, 7269.0]
  - - [64, 3584, 1, 3328, 64, 64, 3328, 3584]
    - [65, 9298.0]
  - - [1024, 256, 1, 256, 1024, 1024, 256, 256]
    - [77, 6404.0]
  - - [448, 448, 1, 256, 448, 448, 256, 448]
    - [65, 5286.0]
  - - [128, 1024, 1, 3328, 128, 128, 3328, 1024]
    - [58, 7137.0]
  - - [64, 1856, 1, 1280, 64, 64, 1280, 1856]
    - [64, 5623.0]
  - - [1024, 128, 1, 1280, 1024, 1024, 1280, 128]
    - [61, 6738.0]
  - - [448, 256, 1, 3328, 448, 448, 3328, 256]
    - [79, 6274.0]
  - - [128, 704, 1, 1280, 128, 128, 1280, 704]
    - [55, 4570.0]
  - - [1856, 128, 1, 3328, 1856, 1856, 3328, 128]
    - [85, 9473.0]
  - - [256, 448, 1, 256, 256, 256, 256, 448]
    - [61, 3572.0]
  - - [448, 448, 1, 3328, 448, 448, 3328, 448]
    - [65, 8524.0]
  - - [1408, 128, 1, 1280, 1408, 1408, 1280, 128]
    - [74, 6974.0]
  - - [128, 1856, 1, 1280, 128, 128, 1280, 1856]
    - [74, 8763.0]
  - - [64, 1408, 1, 3328, 64, 64, 3328, 1408]
    - [76, 5153.0]
  - - [256, 448, 1, 3328, 256, 256, 3328, 448]
    - [65, 6200.0]
  - - [64, 2368, 1, 1280, 64, 64, 1280, 2368]
    - [58, 7148.0]
  - - [2368, 64, 1, 256, 2368, 2368, 256, 64]
    - [61, 4459.0]
  - - [4288, 64, 1, 1280, 4288, 4288, 1280, 64]
    - [74, 8285.0]
  - - [128, 1024, 1, 1280, 128, 128, 1280, 1024]
    - [85, 6284.0]
  - - [1856, 64, 1, 256, 1856, 1856, 256, 64]
    - [61, 3603.0]
  - - [704, 128, 1, 256, 704, 704, 256, 128]
    - [84, 2876.0]
  - - [448, 256, 1, 1280, 448, 448, 1280, 256]
    - [74, 5798.0]
  - - [256, 1024, 1, 256, 256, 256, 256, 1024]
    - [65, 5846.0]
  - - [1856, 128, 1, 1280, 1856, 1856, 1280, 128]
    - [61, 9013.0]
  - - [64, 3584, 1, 256, 64, 64, 256, 3584]
    - [61, 5780.0]
  - - [64, 1856, 1, 256, 64, 64, 256, 1856]
    - [58, 3503.0]
  - - [256, 1024, 1, 1280, 256, 256, 1280, 1024]
    - [65, 8054.0]
  - - [3584, 64, 1, 1280, 3584, 3584, 1280, 64]
    - [85, 8676.0]
  - - [1408, 128, 1, 3328, 1408, 1408, 3328, 128]
    - [74, 7430.0]
  - - [64, 4288, 1, 3328, 64, 64, 3328, 4288]
    - [68, 7616.0]
  - - [256, 704, 1, 256, 256, 256, 256, 704]
    - [76, 5454.0]
  - - [128, 1024, 1, 256, 128, 128, 256, 1024]
    - [74, 3976.0]
  - - [64, 2944, 1, 256, 64, 64, 256, 2944]
    - [61, 4550.0]
  - - [64, 1408, 1, 1280, 64, 64, 1280, 1408]
    - [81, 4339.0]
  - - [704, 128, 1, 3328, 704, 704, 3328, 128]
    - [71, 4910.0]
  - - [1408, 128, 1, 256, 1408, 1408, 256, 128]
    - [84, 4776.0]
  - - [64, 2944, 1, 1280, 64, 64, 1280, 2944]
    - [79, 6681.0]
  - - [704, 256, 1, 1280, 704, 704, 1280, 256]
    - [65, 7081.0]
  - - [256, 448, 1, 1280, 256, 256, 1280, 448]
    - [71, 5793.0]
  - - [64, 2368, 1, 3328, 64, 64, 3328, 2368]
    - [58, 7896.0]
  - - [256, 704, 1, 3328, 256, 256, 3328, 704]
    - [65, 7676.0]
  - - [64, 2944, 1, 3328, 64, 64, 3328, 2944]
    - [53, 7349.0]
  - - [128, 1408, 1, 256, 128, 128, 256, 1408]
    - [79, 4747.0]
  - - [1408, 64, 1, 256, 1408, 1408, 256, 64]
    - [56, 2862.0]
  - - [64, 2368, 1, 256, 64, 64, 256, 2368]
    - [58, 4379.0]
  - - [1024, 128, 1, 3328, 1024, 1024, 3328, 128]
    - [61, 6984.0]
  - - [2368, 64, 1, 1280, 2368, 2368, 1280, 64]
    - [85, 7410.0]
  - - [4288, 64, 1, 256, 4288, 4288, 256, 64]
    - [85, 5944.0]
  - - [64, 4288, 1, 1280, 64, 64, 1280, 4288]
    - [58, 7234.0]
  - - [1408, 64, 1, 3328, 1408, 1408, 3328, 64]
    - [76, 5095.0]
  - - [448, 448, 1, 1280, 448, 448, 1280, 448]
    - [79, 7837.0]
  - - [1024, 256, 1, 1280, 1024, 1024, 1280, 256]
    - [61, 8490.0]
  - - [3584, 64, 1, 3328, 3584, 3584, 3328, 64]
    - [74, 9415.0]
  - - [256, 1024, 1, 3328, 256, 256, 3328, 1024]
    - [53, 8291.0]
  - - [1856, 64, 1, 3328, 1856, 1856, 3328, 64]
    - [85, 6349.0]
  - - [448, 256, 1, 256, 448, 448, 256, 256]
    - [84, 3625.0]
  - - [128, 704, 1, 256, 128, 128, 256, 704]
    - [84, 2779.0]
  - - [1024, 128, 1, 256, 1024, 1024, 256, 128]
    - [61, 4082.0]
  - - [64, 3584, 1, 1280, 64, 64, 1280, 3584]
    - [65, 8461.0]
  - - [3584, 64, 1, 256, 3584, 3584, 256, 64]
    - [85, 5849.0]
  - - [64, 1856, 1, 3328, 64, 64, 3328, 1856]
    - [64, 6468.0]
  - - [2944, 64, 1, 3328, 2944, 2944, 3328, 64]
    - [61, 7819.0]
  - - [128, 1408, 1, 3328, 128, 128, 3328, 1408]
    - [79, 7631.0]
  - - [128, 704, 1, 3328, 128, 128, 3328, 704]
    - [79, 4868.0]
  - - [128, 1856, 1, 256, 128, 128, 256, 1856]
    - [85, 5905.0]
  - - [64, 4288, 1, 256, 64, 64, 256, 4288]
    - [76, 6217.0]
  - - [704, 256, 1, 3328, 704, 704, 3328, 256]
    - [79, 7674.0]
  - - [256, 704, 1, 1280, 256, 256, 1280, 704]
    - [79, 7085.0]
  - - [64, 1408, 1, 256, 64, 64, 256, 1408]
    - [52, 2786.0]
  - - [128, 1408, 1, 1280, 128, 128, 1280, 1408]
    - [79, 7103.0]
  - - [128, 1856, 1, 3328, 128, 128, 3328, 1856]
    - [74, 9574.0]
  - - [704, 256, 1, 256, 704, 704, 256, 256]
    - [61, 4766.0]
  - - [704, 64, 1, 3328, 704, 704, 3328, 64]
    - [54, 3794.0]
  - - [448, 64, 1, 1280, 448, 448, 1280, 64]
    - [62, 2421.0]
  - - [64, 1024, 1, 1280, 64, 64, 1280, 1024]
    - [58, 4140.0]
  - - [64, 704, 1, 1280, 64, 64, 1280, 704]
    - [66, 3145.0]
  - - [128, 448, 1, 256, 128, 128, 256, 448]
    - [73, 2198.0]
  - - [256, 256, 1, 3328, 256, 256, 3328, 256]
    - [58, 4823.0]
  - - [64, 448, 1, 1280, 64, 64, 1280, 448]
    - [75, 2457.0]
  - - [64, 64, 1, 3328, 64, 64, 3328, 64]
    - [69, 493.0]
  - - [256, 64, 1, 1280, 256, 256, 1280, 64]
    - [62, 1475.0]
  - - [128, 448, 1, 1280, 128, 128, 1280, 448]
    - [70, 3645.0]
  - - [704, 64, 1, 1280, 704, 704, 1280, 64]
    - [80, 3055.0]
  - - [448, 64, 1, 3328, 448, 448, 3328, 64]
    - [62, 2876.0]
  - - [64, 128, 1, 3328, 64, 64, 3328, 128]
    - [59, 982.0]
  - - [128, 128, 1, 3328, 128, 128, 3328, 128]
    - [83, 1809.0]
  - - [256, 128, 1, 256, 256, 256, 256, 128]
    - [51, 1520.0]
  - - [64, 448, 1, 3328, 64, 64, 3328, 448]
    - [54, 2742.0]
  - - [256, 64, 1, 256, 256, 256, 256, 64]
    - [62, 668.0]
  - - [256, 128, 1, 1280, 256, 256, 1280, 128]
    - [86, 2580.0]
  - - [128, 64, 1, 1280, 128, 128, 1280, 64]
    - [87, 761.0]
  - - [64, 1024, 1, 256, 64, 64, 256, 1024]
    - [70, 2202.0]
  - - [64, 704, 1, 256, 64, 64, 256, 704]
    - [54, 1677.0]
  - - [448, 128, 1, 256, 448, 448, 256, 128]
    - [57, 2079.0]
  - - [256, 256, 1, 256, 256, 256, 256, 256]
    - [60, 2190.0]
  - - [448, 128, 1, 3328, 448, 448, 3328, 128]
    - [58, 4211.0]
  - - [128, 256, 1, 1280, 128, 128, 1280, 256]
    - [62, 2731.0]
  - - [64, 256, 1, 1280, 64, 64, 1280, 256]
    - [75, 1483.0]
  - - [64, 448, 1, 256, 64, 64, 256, 448]
    - [63, 1180.0]
  - - [64, 64, 1, 256, 64, 64, 256, 64]
    - [75, 272.0]
  - - [128, 256, 1, 3328, 128, 128, 3328, 256]
    - [54, 3157.0]
  - - [64, 128, 1, 1280, 64, 64, 1280, 128]
    - [69, 762.0]
  - - [128, 128, 1, 1280, 128, 128, 1280, 128]
    - [75, 1462.0]
  - - [128, 256, 1, 256, 128, 128, 256, 256]
    - [54, 1295.0]
  - - [64, 128, 1, 256, 64, 64, 256, 128]
    - [75, 343.0]
  - - [704, 64, 1, 256, 704, 704, 256, 64]
    - [54, 1625.0]
  - - [64, 64, 1, 1280, 64, 64, 1280, 64]
    - [87, 394.0]
  - - [128, 64, 1, 3328, 128, 128, 3328, 64]
    - [69, 974.0]
  - - [448, 64, 1, 256, 448, 448, 256, 64]
    - [66, 1739.0]
  - - [1024, 64, 1, 256, 1024, 1024, 256, 64]
    - [66, 3007.0]
  - - [128, 64, 1, 256, 128, 128, 256, 64]
    - [83, 490.0]
  - - [1024, 64, 1, 1280, 1024, 1024, 1280, 64]
    - [74, 4328.0]
  - - [64, 1024, 1, 3328, 64, 64, 3328, 1024]
    - [58, 4806.0]
  - - [448, 128, 1, 1280, 448, 448, 1280, 128]
    - [60, 3645.0]
  - - [1024, 64, 1, 3328, 1024, 1024, 3328, 64]
    - [64, 4733.0]
  - - [64, 256, 1, 3328, 64, 64, 3328, 256]
    - [67, 1760.0]
  - - [256, 256, 1, 1280, 256, 256, 1280, 256]
    - [82, 4068.0]
  - - [256, 128, 1, 3328, 256, 256, 3328, 128]
    - [67, 3219.0]
  - - [64, 256, 1, 256, 64, 64, 256, 256]
    - [62, 670.0]
  - - [64, 704, 1, 3328, 64, 64, 3328, 704]
    - [80, 3572.0]
  - - [128, 448, 1, 3328, 128, 128, 3328, 448]
    - [81, 4222.0]
  - - [256, 64, 1, 3328, 256, 256, 3328, 64]
    - [78, 1802.0]
  - - [128, 128, 1, 256, 128, 128, 256, 128]
    - [67, 701.0]
- null
- null
- DeviceEfficiency
...
