library/src/blas3/Tensile/Logic/asm_full/navi21_Cijk_Ailk_Bjlk_I8II_BH.yaml
---
- {MinimumRequiredVersion: 4.27.0}
- navi21
- gfx1030
    SolutionIndex: 0
    SolutionNameMin: Cijk_Ailk_Bjlk_I8II_BH_MT64x64x16_SN_EPS1_GRVW4_LRVW4_SU0_SUM0_SUS128_TT4_4_VW4_WG16_16_1_WGM1
    SolutionIndex: 1
    SolutionNameMin: Cijk_Ailk_Bjlk_I8II_BH_MT32x32x32_SN_EPS1_GRVW4_LRVW4_SU0_SUM0_SUS128_TT4_4_VW4_WG8_8_1_WGM1
    SolutionIndex: 2
    SolutionNameMin: Cijk_Ailk_Bjlk_I8II_BH_MT32x32x8_SN_EPS1_GRVW4_LRVW4_SU0_SUM0_SUS256_TT4_4_VW4_WG8_8_1_WGM1
    SolutionIndex: 3
    SolutionNameMin: Cijk_Ailk_Bjlk_I8II_BH_MT64x64x32_SN_EPS1_GRVW4_LRVW4_SU0_SUM0_SUS256_TT4_4_VW4_WG16_16_1_WGM1
    SolutionIndex: 4
    SolutionNameMin: Cijk_Ailk_Bjlk_I8II_BH_MT128x64x32_SN_EPS1_GRVW4_LRVW4_SU0_SUM0_SUS128_TT8_4_VW4_WG16_16_1_WGM4
    SolutionIndex: 5
    SolutionNameMin: Cijk_Ailk_Bjlk_I8II_BH_MT32x64x32_SN_EPS1_GRVW4_LRVW4_SU0_SUM0_SUS256_TT4_4_VW4_WG8_16_1_WGM4
    SolutionIndex: 6
    SolutionNameMin: Cijk_Ailk_Bjlk_I8II_BH_MT64x64x32_SN_EPS1_GRVW4_LRVW4_SU0_SUM0_SUS256_TT4_4_VW4_WG16_16_1_WGM4
    SolutionIndex: 7
    SolutionNameMin: Cijk_Ailk_Bjlk_I8II_BH_MT128x64x32_SN_EPS1_GRVW4_LRVW4_SU0_SUM0_SUS256_TT8_4_VW4_WG16_16_1_WGM4
    SolutionIndex: 8
    SolutionNameMin: Cijk_Ailk_Bjlk_I8II_BH_MT64x64x64_SN_EPS1_GRVW4_LRVW4_SU0_SUM0_SUS256_TT4_4_VW4_WG16_16_1_WGM4
    SolutionIndex: 9
    SolutionNameMin: Cijk_Ailk_Bjlk_I8II_BH_MT64x64x32_SN_EPS1_GRVW4_LRVW4_SU0_SUM0_SUS128_TT4_4_VW4_WG16_16_1_WGM8
    SolutionIndex: 10
    SolutionNameMin: Cijk_Ailk_Bjlk_I8II_BH_MT64x32x8_SN_EPS0_GRVW4_LRVW4_SU0_SUM0_SUS128_TT8_4_VW4_WG8_8_1_WGM1
    SolutionIndex: 11
    SolutionNameMin: Cijk_Ailk_Bjlk_I8II_BH_MT32x64x16_SN_EPS0_GRVW4_LRVW4_SU0_SUM0_SUS128_TT4_4_VW4_WG8_16_1_WGM1
    SolutionIndex: 12
    SolutionNameMin: Cijk_Ailk_Bjlk_I8II_BH_MT64x64x16_SN_EPS0_GRVW4_LRVW4_SU0_SUM0_SUS128_TT4_4_VW4_WG16_16_1_WGM1
    SolutionIndex: 13
    SolutionNameMin: Cijk_Ailk_Bjlk_I8II_BH_MT64x64x32_SN_EPS0_GRVW4_LRVW4_SU0_SUM0_SUS128_TT8_4_VW4_WG8_16_1_WGM1
    SolutionIndex: 14
    SolutionNameMin: Cijk_Ailk_Bjlk_I8II_BH_MT64x64x32_SN_EPS0_GRVW4_LRVW4_SU0_SUM0_SUS128_TT4_4_VW4_WG16_16_1_WGM1
    SolutionIndex: 15
    SolutionNameMin: Cijk_Ailk_Bjlk_I8II_BH_MT128x128x32_SN_EPS0_GRVW4_LRVW4_SU0_SUM0_SUS128_TT8_8_VW4_WG16_16_1_WGM1
    SolutionIndex: 16
    SolutionNameMin: Cijk_Ailk_Bjlk_I8II_BH_MT32x64x64_SN_EPS0_GRVW4_LRVW4_SU0_SUM0_SUS128_TT4_4_VW4_WG8_16_1_WGM1
    SolutionIndex: 17
    SolutionNameMin: Cijk_Ailk_Bjlk_I8II_BH_MT64x64x64_SN_EPS0_GRVW4_LRVW4_SU0_SUM0_SUS128_TT4_4_VW4_WG16_16_1_WGM1
    SolutionIndex: 18
    SolutionNameMin: Cijk_Ailk_Bjlk_I8II_BH_MT64x128x64_SN_EPS0_GRVW8_LRVW8_SU0_SUM0_SUS128_TT8_8_VW8_WG8_16_1_WGM1
    SolutionIndex: 19
    SolutionNameMin: Cijk_Ailk_Bjlk_I8II_BH_MT32x64x16_SN_EPS0_GRVW4_LRVW4_SU0_SUM0_SUS256_TT4_4_VW4_WG8_16_1_WGM1
    SolutionIndex: 20
    SolutionNameMin: Cijk_Ailk_Bjlk_I8II_BH_MT32x32x16_SN_EPS0_GRVW4_LRVW4_SU0_SUM0_SUS256_TT4_4_VW4_WG8_8_1_WGM1
    SolutionIndex: 21
    SolutionNameMin: Cijk_Ailk_Bjlk_I8II_BH_MT64x64x16_SN_EPS0_GRVW4_LRVW4_SU0_SUM0_SUS256_TT4_4_VW4_WG16_16_1_WGM1
    SolutionIndex: 22
    SolutionNameMin: Cijk_Ailk_Bjlk_I8II_BH_MT32x64x32_SN_EPS0_GRVW4_LRVW4_SU0_SUM0_SUS256_TT4_4_VW4_WG8_16_1_WGM1
    SolutionIndex: 23
    SolutionNameMin: Cijk_Ailk_Bjlk_I8II_BH_MT64x64x32_SN_EPS0_GRVW4_LRVW4_SU0_SUM0_SUS256_TT8_4_VW4_WG8_16_1_WGM1
    SolutionIndex: 24
    SolutionNameMin: Cijk_Ailk_Bjlk_I8II_BH_MT32x32x32_SN_EPS0_GRVW4_LRVW4_SU0_SUM0_SUS256_TT4_4_VW4_WG8_8_1_WGM1
    SolutionIndex: 25
    SolutionNameMin: Cijk_Ailk_Bjlk_I8II_BH_MT64x64x32_SN_EPS0_GRVW4_LRVW4_SU0_SUM0_SUS256_TT4_4_VW4_WG16_16_1_WGM1
    SolutionIndex: 26
    SolutionNameMin: Cijk_Ailk_Bjlk_I8II_BH_MT32x64x64_SN_EPS0_GRVW4_LRVW4_SU0_SUM0_SUS256_TT4_4_VW4_WG8_16_1_WGM1
    SolutionIndex: 27
    SolutionNameMin: Cijk_Ailk_Bjlk_I8II_BH_MT64x64x64_SN_EPS0_GRVW4_LRVW4_SU0_SUM0_SUS256_TT4_4_VW4_WG16_16_1_WGM1
    SolutionIndex: 28
    SolutionNameMin: Cijk_Ailk_Bjlk_I8II_BH_MT64x64x32_SN_EPS0_GRVW8_LRVW8_SU0_SUM0_SUS256_TT8_8_VW8_WG8_8_1_WGM1
    SolutionIndex: 29
    SolutionNameMin: Cijk_Ailk_Bjlk_I8II_BH_MT32x64x32_SN_EPS0_GRVW4_LRVW4_SU32_SUM0_SUS128_TT4_4_VW4_WG8_16_1_WGM1
    SolutionIndex: 30
    SolutionNameMin: Cijk_Ailk_Bjlk_I8II_BH_MT32x32x32_SN_EPS0_GRVW4_LRVW4_SU32_SUM0_SUS128_TT4_4_VW4_WG8_8_1_WGM1
    SolutionIndex: 31
    SolutionNameMin: Cijk_Ailk_Bjlk_I8II_BH_MT64x64x32_SN_EPS0_GRVW4_LRVW4_SU32_SUM0_SUS128_TT4_4_VW4_WG16_16_1_WGM1
    SolutionIndex: 32
    SolutionNameMin: Cijk_Ailk_Bjlk_I8II_BH_MT32x32x16_SN_EPS0_GRVW4_LRVW4_SU32_SUM3_SUS128_TT4_4_VW4_WG8_8_1_WGM1
    SolutionIndex: 33
    SolutionNameMin: Cijk_Ailk_Bjlk_I8II_BH_MT64x64x16_SN_EPS0_GRVW4_LRVW4_SU32_SUM3_SUS128_TT4_4_VW4_WG16_16_1_WGM1
    SolutionIndex: 34
    SolutionNameMin: Cijk_Ailk_Bjlk_I8II_BH_MT32x64x32_SN_EPS0_GRVW4_LRVW4_SU32_SUM3_SUS128_TT4_4_VW4_WG8_16_1_WGM1
    SolutionIndex: 35
    SolutionNameMin: Cijk_Ailk_Bjlk_I8II_BH_MT64x64x32_SN_EPS0_GRVW4_LRVW4_SU32_SUM3_SUS128_TT4_4_VW4_WG16_16_1_WGM1
    SolutionIndex: 36
    SolutionNameMin: Cijk_Ailk_Bjlk_I8II_BH_MT32x32x16_SN_EPS0_GRVW4_LRVW4_SU32_SUM0_SUS256_TT4_4_VW4_WG8_8_1_WGM1
    SolutionIndex: 37
    SolutionNameMin: Cijk_Ailk_Bjlk_I8II_BH_MT64x64x16_SN_EPS0_GRVW4_LRVW4_SU32_SUM0_SUS256_TT4_4_VW4_WG16_16_1_WGM1
    SolutionIndex: 38
    SolutionNameMin: Cijk_Ailk_Bjlk_I8II_BH_MT32x64x32_SN_EPS0_GRVW4_LRVW4_SU32_SUM0_SUS256_TT4_4_VW4_WG8_16_1_WGM1
    SolutionIndex: 39
    SolutionNameMin: Cijk_Ailk_Bjlk_I8II_BH_MT32x32x32_SN_EPS0_GRVW4_LRVW4_SU32_SUM0_SUS256_TT4_4_VW4_WG8_8_1_WGM1
    SolutionIndex: 40
    SolutionNameMin: Cijk_Ailk_Bjlk_I8II_BH_MT32x32x16_SN_EPS0_GRVW4_LRVW4_SU32_SUM3_SUS256_TT4_4_VW4_WG8_8_1_WGM1
    SolutionIndex: 41
    SolutionNameMin: Cijk_Ailk_Bjlk_I8II_BH_MT64x64x16_SN_EPS0_GRVW4_LRVW4_SU32_SUM3_SUS256_TT4_4_VW4_WG16_16_1_WGM1
    SolutionIndex: 42
    SolutionNameMin: Cijk_Ailk_Bjlk_I8II_BH_MT32x64x32_SN_EPS0_GRVW4_LRVW4_SU32_SUM3_SUS256_TT4_4_VW4_WG8_16_1_WGM1
    SolutionIndex: 43
    SolutionNameMin: Cijk_Ailk_Bjlk_I8II_BH_MT64x128x32_SN_EPS0_GRVW4_LRVW4_SU32_SUM3_SUS256_TT8_8_VW4_WG8_16_1_WGM1
    SolutionIndex: 44
    SolutionNameMin: Cijk_Ailk_Bjlk_I8II_BH_MT32x64x16_SN_EPS0_GRVW4_LRVW4_SU0_SUM0_SUS128_TT4_4_VW4_WG8_16_1_WGM4
    SolutionIndex: 45
    SolutionNameMin: Cijk_Ailk_Bjlk_I8II_BH_MT32x32x16_SN_EPS0_GRVW4_LRVW4_SU0_SUM0_SUS128_TT4_4_VW4_WG8_8_1_WGM4
    SolutionIndex: 46
    SolutionNameMin: Cijk_Ailk_Bjlk_I8II_BH_MT64x64x16_SN_EPS0_GRVW4_LRVW4_SU0_SUM0_SUS128_TT4_4_VW4_WG16_16_1_WGM4
    SolutionIndex: 47
    SolutionNameMin: Cijk_Ailk_Bjlk_I8II_BH_MT32x64x32_SN_EPS0_GRVW4_LRVW4_SU0_SUM0_SUS128_TT4_4_VW4_WG8_16_1_WGM4
    SolutionIndex: 48
    SolutionNameMin: Cijk_Ailk_Bjlk_I8II_BH_MT64x128x32_SN_EPS0_GRVW4_LRVW4_SU0_SUM0_SUS128_TT8_8_VW4_WG8_16_1_WGM4
    SolutionIndex: 49
    SolutionNameMin: Cijk_Ailk_Bjlk_I8II_BH_MT32x32x32_SN_EPS0_GRVW4_LRVW4_SU0_SUM0_SUS128_TT4_4_VW4_WG8_8_1_WGM4
    SolutionIndex: 50
    SolutionNameMin: Cijk_Ailk_Bjlk_I8II_BH_MT64x64x32_SN_EPS0_GRVW4_LRVW4_SU0_SUM0_SUS128_TT4_4_VW4_WG16_16_1_WGM4
    SolutionIndex: 51
    SolutionNameMin: Cijk_Ailk_Bjlk_I8II_BH_MT128x64x32_SN_EPS0_GRVW4_LRVW4_SU0_SUM0_SUS128_TT8_4_VW4_WG16_16_1_WGM4
    SolutionIndex: 52
    SolutionNameMin: Cijk_Ailk_Bjlk_I8II_BH_MT32x64x64_SN_EPS0_GRVW4_LRVW4_SU0_SUM0_SUS128_TT4_4_VW4_WG8_16_1_WGM4
    SolutionIndex: 53
    SolutionNameMin: Cijk_Ailk_Bjlk_I8II_BH_MT128x128x32_SN_EPS0_GRVW8_LRVW8_SU0_SUM0_SUS128_TT8_8_VW8_WG16_16_1_WGM4
    SolutionIndex: 54
    SolutionNameMin: Cijk_Ailk_Bjlk_I8II_BH_MT64x64x16_SN_EPS0_GRVW4_LRVW4_SU0_SUM0_SUS256_TT4_4_VW4_WG16_16_1_WGM4
    SolutionIndex: 55
    SolutionNameMin: Cijk_Ailk_Bjlk_I8II_BH_MT32x64x32_SN_EPS0_GRVW4_LRVW4_SU0_SUM0_SUS256_TT4_4_VW4_WG8_16_1_WGM4
    SolutionIndex: 56
    SolutionNameMin: Cijk_Ailk_Bjlk_I8II_BH_MT64x64x32_SN_EPS0_GRVW4_LRVW4_SU0_SUM0_SUS256_TT4_4_VW4_WG16_16_1_WGM4
    SolutionIndex: 57
    SolutionNameMin: Cijk_Ailk_Bjlk_I8II_BH_MT32x64x64_SN_EPS0_GRVW4_LRVW4_SU0_SUM0_SUS256_TT4_4_VW4_WG8_16_1_WGM4
    SolutionIndex: 58
    SolutionNameMin: Cijk_Ailk_Bjlk_I8II_BH_MT32x32x64_SN_EPS0_GRVW4_LRVW4_SU0_SUM0_SUS256_TT4_4_VW4_WG8_8_1_WGM4
    SolutionIndex: 59
    SolutionNameMin: Cijk_Ailk_Bjlk_I8II_BH_MT64x64x64_SN_EPS0_GRVW4_LRVW4_SU0_SUM0_SUS256_TT4_4_VW4_WG16_16_1_WGM4
    SolutionIndex: 60
    SolutionNameMin: Cijk_Ailk_Bjlk_I8II_BH_MT32x64x32_SN_EPS0_GRVW4_LRVW4_SU32_SUM0_SUS128_TT4_4_VW4_WG8_16_1_WGM4
    SolutionIndex: 61
    SolutionNameMin: Cijk_Ailk_Bjlk_I8II_BH_MT64x64x32_SN_EPS0_GRVW4_LRVW4_SU32_SUM0_SUS128_TT4_4_VW4_WG16_16_1_WGM4
    SolutionIndex: 62
    SolutionNameMin: Cijk_Ailk_Bjlk_I8II_BH_MT128x128x32_SN_EPS0_GRVW4_LRVW4_SU32_SUM0_SUS128_TT8_8_VW4_WG16_16_1_WGM4
    SolutionIndex: 63
    SolutionNameMin: Cijk_Ailk_Bjlk_I8II_BH_MT128x128x64_SN_EPS0_GRVW8_LRVW8_SU32_SUM0_SUS128_TT8_8_VW8_WG16_16_1_WGM4
    SolutionIndex: 64
    SolutionNameMin: Cijk_Ailk_Bjlk_I8II_BH_MT32x64x32_SN_EPS0_GRVW4_LRVW4_SU32_SUM3_SUS128_TT4_4_VW4_WG8_16_1_WGM4
    SolutionIndex: 65
    SolutionNameMin: Cijk_Ailk_Bjlk_I8II_BH_MT64x64x32_SN_EPS0_GRVW4_LRVW4_SU32_SUM3_SUS128_TT4_4_VW4_WG16_16_1_WGM4
    SolutionIndex: 66
    SolutionNameMin: Cijk_Ailk_Bjlk_I8II_BH_MT128x64x64_SN_EPS0_GRVW4_LRVW4_SU32_SUM3_SUS128_TT8_4_VW4_WG16_16_1_WGM4
    SolutionIndex: 67
    SolutionNameMin: Cijk_Ailk_Bjlk_I8II_BH_MT64x64x32_SN_EPS0_GRVW4_LRVW4_SU32_SUM0_SUS256_TT4_4_VW4_WG16_16_1_WGM4
    SolutionIndex: 68
    SolutionNameMin: Cijk_Ailk_Bjlk_I8II_BH_MT128x64x32_SN_EPS0_GRVW4_LRVW4_SU32_SUM0_SUS256_TT8_4_VW4_WG16_16_1_WGM4
    SolutionIndex: 69
    SolutionNameMin: Cijk_Ailk_Bjlk_I8II_BH_MT128x128x64_SN_EPS0_GRVW8_LRVW8_SU32_SUM0_SUS256_TT8_8_VW8_WG16_16_1_WGM4
    SolutionIndex: 70
    SolutionNameMin: Cijk_Ailk_Bjlk_I8II_BH_MT64x64x16_SN_EPS0_GRVW4_LRVW4_SU32_SUM3_SUS256_TT4_4_VW4_WG16_16_1_WGM4
    SolutionIndex: 71
    SolutionNameMin: Cijk_Ailk_Bjlk_I8II_BH_MT64x64x32_SN_EPS0_GRVW4_LRVW4_SU32_SUM3_SUS256_TT4_4_VW4_WG16_16_1_WGM4
    SolutionIndex: 72
    SolutionNameMin: Cijk_Ailk_Bjlk_I8II_BH_MT32x32x16_SN_EPS0_GRVW4_LRVW4_SU0_SUM0_SUS128_TT4_4_VW4_WG8_8_1_WGM8
    SolutionIndex: 73
    SolutionNameMin: Cijk_Ailk_Bjlk_I8II_BH_MT32x64x32_SN_EPS0_GRVW4_LRVW4_SU0_SUM0_SUS128_TT4_4_VW4_WG8_16_1_WGM8
    SolutionIndex: 74
    SolutionNameMin: Cijk_Ailk_Bjlk_I8II_BH_MT32x32x32_SN_EPS0_GRVW4_LRVW4_SU0_SUM0_SUS128_TT4_4_VW4_WG8_8_1_WGM8
    SolutionIndex: 75
    SolutionNameMin: Cijk_Ailk_Bjlk_I8II_BH_MT64x64x32_SN_EPS0_GRVW4_LRVW4_SU0_SUM0_SUS128_TT4_4_VW4_WG16_16_1_WGM8
    SolutionIndex: 76
    SolutionNameMin: Cijk_Ailk_Bjlk_I8II_BH_MT64x64x64_SN_EPS0_GRVW4_LRVW4_SU0_SUM0_SUS128_TT4_4_VW4_WG16_16_1_WGM8
    SolutionIndex: 77
    SolutionNameMin: Cijk_Ailk_Bjlk_I8II_BH_MT32x64x16_SN_EPS0_GRVW4_LRVW4_SU0_SUM0_SUS256_TT4_4_VW4_WG8_16_1_WGM8
    SolutionIndex: 78
    SolutionNameMin: Cijk_Ailk_Bjlk_I8II_BH_MT64x64x16_SN_EPS0_GRVW4_LRVW4_SU0_SUM0_SUS256_TT4_4_VW4_WG16_16_1_WGM8
    SolutionIndex: 79
    SolutionNameMin: Cijk_Ailk_Bjlk_I8II_BH_MT32x64x32_SN_EPS0_GRVW4_LRVW4_SU0_SUM0_SUS256_TT4_4_VW4_WG8_16_1_WGM8
    SolutionIndex: 80
    SolutionNameMin: Cijk_Ailk_Bjlk_I8II_BH_MT64x64x32_SN_EPS0_GRVW4_LRVW4_SU0_SUM0_SUS256_TT8_4_VW4_WG8_16_1_WGM8
    SolutionIndex: 81
    SolutionNameMin: Cijk_Ailk_Bjlk_I8II_BH_MT32x32x32_SN_EPS0_GRVW4_LRVW4_SU0_SUM0_SUS256_TT4_4_VW4_WG8_8_1_WGM8
    SolutionIndex: 82
    SolutionNameMin: Cijk_Ailk_Bjlk_I8II_BH_MT64x64x32_SN_EPS0_GRVW4_LRVW4_SU0_SUM0_SUS256_TT4_4_VW4_WG16_16_1_WGM8
    SolutionIndex: 83
    SolutionNameMin: Cijk_Ailk_Bjlk_I8II_BH_MT64x64x32_SN_EPS0_GRVW4_LRVW4_SU32_SUM0_SUS128_TT4_4_VW4_WG16_16_1_WGM8
    SolutionIndex: 84
    SolutionNameMin: Cijk_Ailk_Bjlk_I8II_BH_MT32x64x32_SN_EPS0_GRVW4_LRVW4_SU32_SUM3_SUS128_TT4_4_VW4_WG8_16_1_WGM8
    SolutionIndex: 85
    SolutionNameMin: Cijk_Ailk_Bjlk_I8II_BH_MT64x64x32_SN_EPS0_GRVW4_LRVW4_SU32_SUM3_SUS128_TT4_4_VW4_WG16_16_1_WGM8
    SolutionIndex: 86
    SolutionNameMin: Cijk_Ailk_Bjlk_I8II_BH_MT32x64x32_SN_EPS0_GRVW4_LRVW4_SU32_SUM3_SUS256_TT4_4_VW4_WG8_16_1_WGM8
    SolutionIndex: 87
    SolutionNameMin: Cijk_Ailk_Bjlk_I8II_BH_MT32x32x32_SN_EPS0_GRVW4_LRVW4_SU32_SUM3_SUS256_TT4_4_VW4_WG8_8_1_WGM8
- - - [768, 1024, 1, 1024, 768, 768, 768, 1024]
    - [53, 33250.0]
  - - [1536, 2048, 1, 2048, 1536, 1536, 1536, 2048]
    - [63, 40478.0]
  - - [32, 32, 1, 32, 32, 32, 32, 32]
    - [1, 19.0]
  - - [32, 32, 1, 64, 32, 32, 32, 32]
    - [40, 32.0]
  - - [32, 32, 1, 128, 32, 32, 32, 32]
    - [74, 49.0]
  - - [32, 32, 1, 256, 32, 32, 32, 32]
    - [49, 73.0]
  - - [32, 32, 1, 512, 32, 32, 32, 32]
    - [24, 97.0]
  - - [32, 32, 1, 1024, 32, 32, 32, 32]
    - [59, 124.0]
  - - [32, 64, 1, 32, 32, 32, 32, 64]
    - [11, 41.0]
  - - [32, 64, 1, 64, 32, 32, 32, 64]
    - [44, 66.0]
  - - [32, 64, 1, 128, 32, 32, 32, 64]
    - [47, 102.0]
  - - [32, 64, 1, 256, 32, 32, 32, 64]
    - [22, 152.0]
  - - [32, 64, 1, 512, 32, 32, 32, 64]
    - [47, 205.0]
  - - [32, 64, 1, 1024, 32, 32, 32, 64]
    - [26, 265.0]
  - - [32, 128, 1, 32, 32, 32, 32, 128]
    - [11, 78.0]
  - - [32, 128, 1, 64, 32, 32, 32, 128]
    - [11, 129.0]
  - - [32, 128, 1, 128, 32, 32, 32, 128]
    - [73, 205.0]
  - - [32, 128, 1, 256, 32, 32, 32, 128]
    - [34, 312.0]
  - - [32, 128, 1, 512, 32, 32, 32, 128]
    - [42, 433.0]
  - - [32, 128, 1, 1024, 32, 32, 32, 128]
    - [16, 530.0]
  - - [32, 256, 1, 32, 32, 32, 32, 256]
    - [19, 156.0]
  - - [32, 256, 1, 64, 32, 32, 32, 256]
    - [11, 260.0]
  - - [32, 256, 1, 128, 32, 32, 32, 256]
    - [47, 406.0]
  - - [32, 256, 1, 256, 32, 32, 32, 256]
    - [34, 628.0]
  - - [32, 256, 1, 512, 32, 32, 32, 256]
    - [84, 863.0]
  - - [32, 256, 1, 1024, 32, 32, 32, 256]
    - [16, 1054.0]
  - - [32, 512, 1, 32, 32, 32, 32, 512]
    - [11, 312.0]
  - - [32, 512, 1, 64, 32, 32, 32, 512]
    - [44, 524.0]
  - - [32, 512, 1, 128, 32, 32, 32, 512]
    - [47, 819.0]
  - - [32, 512, 1, 256, 32, 32, 32, 512]
    - [64, 1256.0]
  - - [32, 512, 1, 512, 32, 32, 32, 512]
    - [86, 1740.0]
  - - [32, 512, 1, 1024, 32, 32, 32, 512]
    - [16, 2124.0]
  - - [32, 1024, 1, 32, 32, 32, 32, 1024]
    - [11, 617.0]
  - - [32, 1024, 1, 64, 32, 32, 32, 1024]
    - [44, 1028.0]
  - - [32, 1024, 1, 128, 32, 32, 32, 1024]
    - [22, 1626.0]
  - - [32, 1024, 1, 256, 32, 32, 32, 1024]
    - [34, 2512.0]
  - - [32, 1024, 1, 512, 32, 32, 32, 1024]
    - [42, 3424.0]
  - - [32, 1024, 1, 1024, 32, 32, 32, 1024]
    - [57, 4205.0]
  - - [64, 32, 1, 32, 64, 64, 64, 32]
    - [72, 39.0]
  - - [64, 32, 1, 64, 64, 64, 64, 32]
    - [36, 63.0]
  - - [64, 32, 1, 128, 64, 64, 64, 32]
    - [81, 97.0]
  - - [64, 32, 1, 256, 64, 64, 64, 32]
    - [30, 150.0]
  - - [64, 32, 1, 512, 64, 64, 64, 32]
    - [39, 205.0]
  - - [64, 32, 1, 1024, 64, 64, 64, 32]
    - [58, 244.0]
  - - [64, 64, 1, 32, 64, 64, 64, 64]
    - [12, 80.0]
  - - [64, 64, 1, 64, 64, 64, 64, 64]
    - [41, 130.0]
  - - [64, 64, 1, 128, 64, 64, 64, 64]
    - [75, 208.0]
  - - [64, 64, 1, 256, 64, 64, 64, 64]
    - [29, 314.0]
  - - [64, 64, 1, 512, 64, 64, 64, 64]
    - [38, 432.0]
  - - [64, 64, 1, 1024, 64, 64, 64, 64]
    - [27, 542.0]
  - - [64, 128, 1, 32, 64, 64, 64, 128]
    - [12, 160.0]
  - - [64, 128, 1, 64, 64, 64, 64, 128]
    - [54, 262.0]
  - - [64, 128, 1, 128, 64, 64, 64, 128]
    - [82, 416.0]
  - - [64, 128, 1, 256, 64, 64, 64, 128]
    - [29, 636.0]
  - - [64, 128, 1, 512, 64, 64, 64, 128]
    - [34, 892.0]
  - - [64, 128, 1, 1024, 64, 64, 64, 128]
    - [42, 1101.0]
  - - [64, 256, 1, 32, 64, 64, 64, 256]
    - [12, 320.0]
  - - [64, 256, 1, 64, 64, 64, 64, 256]
    - [37, 524.0]
  - - [64, 256, 1, 128, 64, 64, 64, 256]
    - [50, 832.0]
  - - [64, 256, 1, 256, 64, 64, 64, 256]
    - [29, 1271.0]
  - - [64, 256, 1, 512, 64, 64, 64, 256]
    - [34, 1777.0]
  - - [64, 256, 1, 1024, 64, 64, 64, 256]
    - [42, 2196.0]
  - - [64, 512, 1, 32, 64, 64, 64, 512]
    - [3, 617.0]
  - - [64, 512, 1, 64, 64, 64, 64, 512]
    - [41, 1008.0]
  - - [64, 512, 1, 128, 64, 64, 64, 512]
    - [56, 1664.0]
  - - [64, 512, 1, 256, 64, 64, 64, 512]
    - [29, 2527.0]
  - - [64, 512, 1, 512, 64, 64, 64, 512]
    - [34, 3510.0]
  - - [64, 512, 1, 1024, 64, 64, 64, 512]
    - [86, 4415.0]
  - - [64, 1024, 1, 32, 64, 64, 64, 1024]
    - [3, 1165.0]
  - - [64, 1024, 1, 64, 64, 64, 64, 1024]
    - [77, 1978.0]
  - - [64, 1024, 1, 128, 64, 64, 64, 1024]
    - [50, 3178.0]
  - - [64, 1024, 1, 256, 64, 64, 64, 1024]
    - [29, 4906.0]
  - - [64, 1024, 1, 512, 64, 64, 64, 1024]
    - [35, 6848.0]
  - - [64, 1024, 1, 1024, 64, 64, 64, 1024]
    - [17, 8495.0]
  - - [128, 32, 1, 32, 128, 128, 128, 32]
    - [72, 76.0]
  - - [128, 32, 1, 64, 128, 128, 128, 32]
    - [40, 126.0]
  - - [128, 32, 1, 128, 128, 128, 128, 32]
    - [49, 194.0]
  - - [128, 32, 1, 256, 128, 128, 128, 32]
    - [30, 300.0]
  - - [128, 32, 1, 512, 128, 128, 128, 32]
    - [30, 426.0]
  - - [128, 32, 1, 1024, 128, 128, 128, 32]
    - [87, 517.0]
  - - [128, 64, 1, 32, 128, 128, 128, 64]
    - [21, 158.0]
  - - [128, 64, 1, 64, 128, 128, 128, 64]
    - [33, 257.0]
  - - [128, 64, 1, 128, 128, 128, 128, 64]
    - [82, 419.0]
  - - [128, 64, 1, 256, 128, 128, 128, 64]
    - [31, 643.0]
  - - [128, 64, 1, 512, 128, 128, 128, 64]
    - [29, 904.0]
  - - [128, 64, 1, 1024, 128, 128, 128, 64]
    - [86, 1113.0]
  - - [128, 128, 1, 32, 128, 128, 128, 128]
    - [21, 320.0]
  - - [128, 128, 1, 64, 128, 128, 128, 128]
    - [0, 514.0]
  - - [128, 128, 1, 128, 128, 128, 128, 128]
    - [14, 832.0]
  - - [128, 128, 1, 256, 128, 128, 128, 128]
    - [31, 1279.0]
  - - [128, 128, 1, 512, 128, 128, 128, 128]
    - [29, 1816.0]
  - - [128, 128, 1, 1024, 128, 128, 128, 128]
    - [64, 2225.0]
  - - [128, 256, 1, 32, 128, 128, 128, 256]
    - [54, 632.0]
  - - [128, 256, 1, 64, 128, 128, 128, 256]
    - [54, 1038.0]
  - - [128, 256, 1, 128, 128, 128, 128, 256]
    - [50, 1664.0]
  - - [128, 256, 1, 256, 128, 128, 128, 256]
    - [61, 2527.0]
  - - [128, 256, 1, 512, 128, 128, 128, 256]
    - [29, 3600.0]
  - - [128, 256, 1, 1024, 128, 128, 128, 256]
    - [34, 4427.0]
  - - [128, 512, 1, 32, 128, 128, 128, 512]
    - [54, 1192.0]
  - - [128, 512, 1, 64, 128, 128, 128, 512]
    - [54, 1997.0]
  - - [128, 512, 1, 128, 128, 128, 128, 512]
    - [50, 3226.0]
  - - [128, 512, 1, 256, 128, 128, 128, 512]
    - [83, 4964.0]
  - - [128, 512, 1, 512, 128, 128, 128, 512]
    - [65, 7049.0]
  - - [128, 512, 1, 1024, 128, 128, 128, 512]
    - [71, 8670.0]
  - - [128, 1024, 1, 32, 128, 128, 128, 1024]
    - [54, 2280.0]
  - - [128, 1024, 1, 64, 128, 128, 128, 1024]
    - [54, 3813.0]
  - - [128, 1024, 1, 128, 128, 128, 128, 1024]
    - [50, 6168.0]
  - - [128, 1024, 1, 256, 128, 128, 128, 1024]
    - [60, 9218.0]
  - - [128, 1024, 1, 512, 128, 128, 128, 1024]
    - [47, 12027.0]
  - - [128, 1024, 1, 1024, 128, 128, 128, 1024]
    - [79, 14069.0]
  - - [256, 32, 1, 32, 256, 256, 256, 32]
    - [72, 152.0]
  - - [256, 32, 1, 64, 256, 256, 256, 32]
    - [32, 247.0]
  - - [256, 32, 1, 128, 256, 256, 256, 32]
    - [74, 388.0]
  - - [256, 32, 1, 256, 256, 256, 256, 32]
    - [30, 603.0]
  - - [256, 32, 1, 512, 256, 256, 256, 32]
    - [30, 849.0]
  - - [256, 32, 1, 1024, 256, 256, 256, 32]
    - [39, 1041.0]
  - - [256, 64, 1, 32, 256, 256, 256, 64]
    - [21, 316.0]
  - - [256, 64, 1, 64, 256, 256, 256, 64]
    - [37, 514.0]
  - - [256, 64, 1, 128, 256, 256, 256, 64]
    - [14, 826.0]
  - - [256, 64, 1, 256, 256, 256, 256, 64]
    - [31, 1287.0]
  - - [256, 64, 1, 512, 256, 256, 256, 64]
    - [29, 1808.0]
  - - [256, 64, 1, 1024, 256, 256, 256, 64]
    - [38, 2231.0]
  - - [256, 128, 1, 32, 256, 256, 256, 128]
    - [46, 617.0]
  - - [256, 128, 1, 64, 256, 256, 256, 128]
    - [46, 1028.0]
  - - [256, 128, 1, 128, 256, 256, 256, 128]
    - [56, 1651.0]
  - - [256, 128, 1, 256, 256, 256, 256, 128]
    - [61, 2512.0]
  - - [256, 128, 1, 512, 256, 256, 256, 128]
    - [29, 3570.0]
  - - [256, 128, 1, 1024, 256, 256, 256, 128]
    - [38, 4415.0]
  - - [256, 256, 1, 32, 256, 256, 256, 256]
    - [54, 1234.0]
  - - [256, 256, 1, 64, 256, 256, 256, 256]
    - [54, 2036.0]
  - - [256, 256, 1, 128, 256, 256, 256, 256]
    - [56, 3277.0]
  - - [256, 256, 1, 256, 256, 256, 256, 256]
    - [83, 5023.0]
  - - [256, 256, 1, 512, 256, 256, 256, 256]
    - [67, 6876.0]
  - - [256, 256, 1, 1024, 256, 256, 256, 256]
    - [85, 8604.0]
  - - [256, 512, 1, 32, 256, 256, 256, 512]
    - [54, 2280.0]
  - - [256, 512, 1, 64, 256, 256, 256, 512]
    - [54, 3779.0]
  - - [256, 512, 1, 128, 256, 256, 256, 512]
    - [50, 6168.0]
  - - [256, 512, 1, 256, 256, 256, 256, 512]
    - [47, 9020.0]
  - - [256, 512, 1, 512, 256, 256, 256, 512]
    - [55, 11984.0]
  - - [256, 512, 1, 1024, 256, 256, 256, 512]
    - [47, 13923.0]
  - - [256, 1024, 1, 32, 256, 256, 256, 1024]
    - [54, 4194.0]
  - - [256, 1024, 1, 64, 256, 256, 256, 1024]
    - [54, 6876.0]
  - - [256, 1024, 1, 128, 256, 256, 256, 1024]
    - [65, 10618.0]
  - - [256, 1024, 1, 256, 256, 256, 256, 1024]
    - [59, 13923.0]
  - - [256, 1024, 1, 512, 256, 256, 256, 1024]
    - [80, 16819.0]
  - - [256, 1024, 1, 1024, 256, 256, 256, 1024]
    - [13, 19201.0]
  - - [512, 32, 1, 32, 512, 512, 512, 32]
    - [45, 305.0]
  - - [512, 32, 1, 64, 512, 512, 512, 32]
    - [32, 499.0]
  - - [512, 32, 1, 128, 512, 512, 512, 32]
    - [74, 777.0]
  - - [512, 32, 1, 256, 512, 512, 512, 32]
    - [30, 1212.0]
  - - [512, 32, 1, 512, 512, 512, 512, 32]
    - [30, 1705.0]
  - - [512, 32, 1, 1024, 512, 512, 512, 32]
    - [39, 2056.0]
  - - [512, 64, 1, 32, 512, 512, 512, 64]
    - [20, 596.0]
  - - [512, 64, 1, 64, 512, 512, 512, 64]
    - [40, 989.0]
  - - [512, 64, 1, 128, 512, 512, 512, 64]
    - [25, 1577.0]
  - - [512, 64, 1, 256, 512, 512, 512, 64]
    - [29, 2467.0]
  - - [512, 64, 1, 512, 512, 512, 512, 64]
    - [29, 3554.0]
  - - [512, 64, 1, 1024, 512, 512, 512, 64]
    - [38, 4415.0]
  - - [512, 128, 1, 32, 512, 512, 512, 128]
    - [54, 1165.0]
  - - [512, 128, 1, 64, 512, 512, 512, 128]
    - [54, 1960.0]
  - - [512, 128, 1, 128, 512, 512, 512, 128]
    - [75, 3154.0]
  - - [512, 128, 1, 256, 512, 512, 512, 128]
    - [83, 4849.0]
  - - [512, 128, 1, 512, 512, 512, 512, 128]
    - [29, 6848.0]
  - - [512, 128, 1, 1024, 512, 512, 512, 128]
    - [76, 8473.0]
  - - [512, 256, 1, 32, 512, 512, 512, 256]
    - [9, 2255.0]
  - - [512, 256, 1, 64, 512, 512, 512, 256]
    - [54, 3813.0]
  - - [512, 256, 1, 128, 512, 512, 512, 256]
    - [50, 6168.0]
  - - [512, 256, 1, 256, 512, 512, 512, 256]
    - [47, 9020.0]
  - - [512, 256, 1, 512, 512, 512, 512, 256]
    - [55, 11857.0]
  - - [512, 256, 1, 1024, 512, 512, 512, 256]
    - [57, 13923.0]
  - - [512, 512, 1, 32, 512, 512, 512, 512]
    - [70, 4194.0]
  - - [512, 512, 1, 64, 512, 512, 512, 512]
    - [54, 6991.0]
  - - [512, 512, 1, 128, 512, 512, 512, 512]
    - [6, 10552.0]
  - - [512, 512, 1, 256, 512, 512, 512, 512]
    - [6, 13808.0]
  - - [512, 512, 1, 512, 512, 512, 512, 512]
    - [23, 16777.0]
  - - [512, 512, 1, 1024, 512, 512, 512, 512]
    - [13, 19119.0]
  - - [512, 1024, 1, 32, 512, 512, 512, 1024]
    - [46, 6711.0]
  - - [512, 1024, 1, 64, 512, 512, 512, 1024]
    - [8, 10894.0]
  - - [512, 1024, 1, 128, 512, 512, 512, 1024]
    - [68, 15607.0]
  - - [512, 1024, 1, 256, 512, 512, 512, 1024]
    - [4, 19340.0]
  - - [512, 1024, 1, 512, 512, 512, 512, 1024]
    - [43, 22444.0]
  - - [512, 1024, 1, 1024, 512, 512, 512, 1024]
    - [18, 25348.0]
  - - [1024, 32, 1, 32, 1024, 1024, 1024, 32]
    - [72, 610.0]
  - - [1024, 32, 1, 64, 1024, 1024, 1024, 32]
    - [72, 1008.0]
  - - [1024, 32, 1, 128, 1024, 1024, 1024, 32]
    - [49, 1553.0]
  - - [1024, 32, 1, 256, 1024, 1024, 1024, 32]
    - [30, 2411.0]
  - - [1024, 32, 1, 512, 1024, 1024, 1024, 32]
    - [30, 3355.0]
  - - [1024, 32, 1, 1024, 1024, 1024, 1024, 32]
    - [39, 3995.0]
  - - [1024, 64, 1, 32, 1024, 1024, 1024, 64]
    - [2, 1152.0]
  - - [1024, 64, 1, 64, 1024, 1024, 1024, 64]
    - [40, 1924.0]
  - - [1024, 64, 1, 128, 1024, 1024, 1024, 64]
    - [50, 3017.0]
  - - [1024, 64, 1, 256, 1024, 1024, 1024, 64]
    - [29, 4766.0]
  - - [1024, 64, 1, 512, 1024, 1024, 1024, 64]
    - [64, 6738.0]
  - - [1024, 64, 1, 1024, 1024, 1024, 1024, 64]
    - [27, 8389.0]
  - - [1024, 128, 1, 32, 1024, 1024, 1024, 128]
    - [54, 2162.0]
  - - [1024, 128, 1, 64, 1024, 1024, 1024, 128]
    - [54, 3712.0]
  - - [1024, 128, 1, 128, 1024, 1024, 1024, 128]
    - [56, 5992.0]
  - - [1024, 128, 1, 256, 1024, 1024, 1024, 128]
    - [56, 8830.0]
  - - [1024, 128, 1, 512, 1024, 1024, 1024, 128]
    - [47, 11773.0]
  - - [1024, 128, 1, 1024, 1024, 1024, 1024, 128]
    - [52, 13894.0]
  - - [1024, 256, 1, 32, 1024, 1024, 1024, 256]
    - [54, 4112.0]
  - - [1024, 256, 1, 64, 1024, 1024, 1024, 256]
    - [78, 6876.0]
  - - [1024, 256, 1, 128, 1024, 1024, 1024, 256]
    - [50, 10421.0]
  - - [1024, 256, 1, 256, 1024, 1024, 1024, 256]
    - [59, 13640.0]
  - - [1024, 256, 1, 512, 1024, 1024, 1024, 256]
    - [13, 16904.0]
  - - [1024, 256, 1, 1024, 1024, 1024, 1024, 256]
    - [13, 19147.0]
  - - [1024, 512, 1, 32, 1024, 1024, 1024, 512]
    - [5, 6453.0]
  - - [1024, 512, 1, 64, 1024, 1024, 1024, 512]
    - [8, 10618.0]
  - - [1024, 512, 1, 128, 1024, 1024, 1024, 512]
    - [51, 15183.0]
  - - [1024, 512, 1, 256, 1024, 1024, 1024, 512]
    - [66, 19011.0]
  - - [1024, 512, 1, 512, 1024, 1024, 1024, 512]
    - [28, 22221.0]
  - - [1024, 512, 1, 1024, 1024, 1024, 1024, 512]
    - [48, 25158.0]
  - - [1024, 1024, 1, 32, 1024, 1024, 1024, 1024]
    - [10, 9533.0]
  - - [1024, 1024, 1, 64, 1024, 1024, 1024, 1024]
    - [7, 14653.0]
  - - [1024, 1024, 1, 128, 1024, 1024, 1024, 1024]
    - [62, 20032.0]
  - - [1024, 1024, 1, 256, 1024, 1024, 1024, 1024]
    - [15, 25663.0]
  - - [1024, 1024, 1, 512, 1024, 1024, 1024, 1024]
    - [15, 30060.0]
  - - [1024, 1024, 1, 1024, 1024, 1024, 1024, 1024]
    - [69, 32617.0]
- null
- null
- DeviceEfficiency
...
