library/src/blas3/Tensile/Logic/asm_full/navi22_Cijk_Ailk_Bljk_HB.yaml
---
- {MinimumRequiredVersion: 4.28.0}
- navi22
- gfx1031
    SolutionIndex: 0
    SolutionNameMin: Cijk_Ailk_Bljk_HB_MT128x64x8_SN_SU0_SUM0_TT8_8_WG16_8_1_WGM1
    SolutionIndex: 1
    SolutionNameMin: Cijk_Ailk_Bljk_HB_MT128x128x8_SN_SU0_SUM0_TT8_16_WG16_8_1_WGM1
    SolutionIndex: 2
    SolutionNameMin: Cijk_Ailk_Bljk_HB_MT256x128x8_SN_SU0_SUM0_TT16_16_WG16_8_1_WGM1
    SolutionIndex: 3
    SolutionNameMin: Cijk_Ailk_Bljk_HB_MT128x64x16_SN_SU0_SUM0_TT8_8_WG16_8_1_WGM1
    SolutionIndex: 4
    SolutionNameMin: Cijk_Ailk_Bljk_HB_MT128x128x16_SN_SU0_SUM0_TT8_16_WG16_8_1_WGM1
    SolutionIndex: 5
    SolutionNameMin: Cijk_Ailk_Bljk_HB_MT256x128x16_SN_SU0_SUM0_TT16_16_WG16_8_1_WGM1
    SolutionIndex: 6
    SolutionNameMin: Cijk_Ailk_Bljk_HB_MT128x128x16_SN_SU0_SUM0_TT8_8_WG16_16_1_WGM1
    SolutionIndex: 7
    SolutionNameMin: Cijk_Ailk_Bljk_HB_MT128x256x16_SN_SU0_SUM0_TT8_16_WG16_16_1_WGM1
    SolutionIndex: 8
    SolutionNameMin: Cijk_Ailk_Bljk_HB_MT128x64x8_SN_SU32_SUM3_TT8_8_WG16_8_1_WGM1
    SolutionIndex: 9
    SolutionNameMin: Cijk_Ailk_Bljk_HB_MT128x64x16_SN_SU32_SUM3_TT8_8_WG16_8_1_WGM1
    SolutionIndex: 10
    SolutionNameMin: Cijk_Ailk_Bljk_HB_MT128x128x16_SN_SU32_SUM3_TT8_16_WG16_8_1_WGM1
    SolutionIndex: 11
    SolutionNameMin: Cijk_Ailk_Bljk_HB_MT256x128x16_SN_SU32_SUM3_TT16_16_WG16_8_1_WGM1
    SolutionIndex: 12
    SolutionNameMin: Cijk_Ailk_Bljk_HB_MT128x128x16_SN_SU32_SUM3_TT8_8_WG16_16_1_WGM1
    SolutionIndex: 13
    SolutionNameMin: Cijk_Ailk_Bljk_HB_MT128x256x16_SN_SU32_SUM3_TT8_16_WG16_16_1_WGM1
    SolutionIndex: 14
    SolutionNameMin: Cijk_Ailk_Bljk_HB_MT128x64x8_SN_SU0_SUM0_TT8_8_WG16_8_1_WGM4
    SolutionIndex: 15
    SolutionNameMin: Cijk_Ailk_Bljk_HB_MT128x128x8_SN_SU0_SUM0_TT8_16_WG16_8_1_WGM4
    SolutionIndex: 16
    SolutionNameMin: Cijk_Ailk_Bljk_HB_MT256x128x8_SN_SU0_SUM0_TT16_16_WG16_8_1_WGM4
    SolutionIndex: 17
    SolutionNameMin: Cijk_Ailk_Bljk_HB_MT128x64x16_SN_SU0_SUM0_TT8_8_WG16_8_1_WGM4
    SolutionIndex: 18
    SolutionNameMin: Cijk_Ailk_Bljk_HB_MT128x128x16_SN_SU0_SUM0_TT8_16_WG16_8_1_WGM4
    SolutionIndex: 19
    SolutionNameMin: Cijk_Ailk_Bljk_HB_MT256x128x16_SN_SU0_SUM0_TT16_16_WG16_8_1_WGM4
    SolutionIndex: 20
    SolutionNameMin: Cijk_Ailk_Bljk_HB_MT128x128x16_SN_SU0_SUM0_TT8_8_WG16_16_1_WGM4
    SolutionIndex: 21
    SolutionNameMin: Cijk_Ailk_Bljk_HB_MT128x256x16_SN_SU0_SUM0_TT8_16_WG16_16_1_WGM4
    SolutionIndex: 22
    SolutionNameMin: Cijk_Ailk_Bljk_HB_MT128x128x32_SN_SU0_SUM0_TT8_16_WG16_8_1_WGM4
    SolutionIndex: 23
    SolutionNameMin: Cijk_Ailk_Bljk_HB_MT128x64x16_SN_SU32_SUM3_TT8_8_WG16_8_1_WGM4
    SolutionIndex: 24
    SolutionNameMin: Cijk_Ailk_Bljk_HB_MT128x128x16_SN_SU32_SUM3_TT8_16_WG16_8_1_WGM4
    SolutionIndex: 25
    SolutionNameMin: Cijk_Ailk_Bljk_HB_MT256x128x16_SN_SU32_SUM3_TT16_16_WG16_8_1_WGM4
    SolutionIndex: 26
    SolutionNameMin: Cijk_Ailk_Bljk_HB_MT128x256x16_SN_SU32_SUM3_TT8_16_WG16_16_1_WGM4
    SolutionIndex: 27
    SolutionNameMin: Cijk_Ailk_Bljk_HB_MT128x64x8_SN_SU0_SUM0_TT8_8_WG16_8_1_WGM8
    SolutionIndex: 28
    SolutionNameMin: Cijk_Ailk_Bljk_HB_MT256x128x8_SN_SU0_SUM0_TT16_16_WG16_8_1_WGM8
    SolutionIndex: 29
    SolutionNameMin: Cijk_Ailk_Bljk_HB_MT128x64x16_SN_SU0_SUM0_TT8_8_WG16_8_1_WGM8
    SolutionIndex: 30
    SolutionNameMin: Cijk_Ailk_Bljk_HB_MT128x128x16_SN_SU0_SUM0_TT8_16_WG16_8_1_WGM8
    SolutionIndex: 31
    SolutionNameMin: Cijk_Ailk_Bljk_HB_MT256x128x16_SN_SU0_SUM0_TT16_16_WG16_8_1_WGM8
    SolutionIndex: 32
    SolutionNameMin: Cijk_Ailk_Bljk_HB_MT128x128x16_SN_SU0_SUM0_TT8_8_WG16_16_1_WGM8
    SolutionIndex: 33
    SolutionNameMin: Cijk_Ailk_Bljk_HB_MT128x256x16_SN_SU0_SUM0_TT8_16_WG16_16_1_WGM8
    SolutionIndex: 34
    SolutionNameMin: Cijk_Ailk_Bljk_HB_MT128x128x16_SN_SU32_SUM3_TT8_16_WG16_8_1_WGM8
    SolutionIndex: 35
    SolutionNameMin: Cijk_Ailk_Bljk_HB_MT256x128x16_SN_SU32_SUM3_TT16_16_WG16_8_1_WGM8
    SolutionIndex: 36
    SolutionNameMin: Cijk_Ailk_Bljk_HB_MT128x128x16_SN_SU32_SUM3_TT8_8_WG16_16_1_WGM8
    SolutionIndex: 37
    SolutionNameMin: Cijk_Ailk_Bljk_HB_MT128x256x16_SN_SU32_SUM3_TT8_16_WG16_16_1_WGM8
    SolutionIndex: 38
    SolutionNameMin: Cijk_Ailk_Bljk_HB_MT128x128x32_SN_SU32_SUM3_TT8_8_WG16_16_1_WGM8
    SolutionIndex: 39
    SolutionNameMin: Cijk_Ailk_Bljk_HB_MT64x64x8_SN_SU0_SUM0_TT8_8_WG8_8_1_WGM1
    SolutionIndex: 40
    SolutionNameMin: Cijk_Ailk_Bljk_HB_MT128x64x8_SN_SU0_SUM0_TT8_8_WG16_8_1_WGM1
    SolutionIndex: 41
    SolutionNameMin: Cijk_Ailk_Bljk_HB_MT64x64x16_SN_SU0_SUM0_TT8_8_WG8_8_1_WGM1
    SolutionIndex: 42
    SolutionNameMin: Cijk_Ailk_Bljk_HB_MT128x64x16_SN_SU0_SUM0_TT8_8_WG16_8_1_WGM1
    SolutionIndex: 43
    SolutionNameMin: Cijk_Ailk_Bljk_HB_MT128x128x16_SN_SU0_SUM0_TT8_8_WG16_16_1_WGM1
    SolutionIndex: 44
    SolutionNameMin: Cijk_Ailk_Bljk_HB_MT128x64x8_SN_SU32_SUM3_TT8_8_WG16_8_1_WGM1
    SolutionIndex: 45
    SolutionNameMin: Cijk_Ailk_Bljk_HB_MT64x64x16_SN_SU32_SUM3_TT8_8_WG8_8_1_WGM1
    SolutionIndex: 46
    SolutionNameMin: Cijk_Ailk_Bljk_HB_MT128x64x16_SN_SU32_SUM3_TT8_8_WG16_8_1_WGM1
    SolutionIndex: 47
    SolutionNameMin: Cijk_Ailk_Bljk_HB_MT128x128x16_SN_SU32_SUM3_TT8_8_WG16_16_1_WGM1
    SolutionIndex: 48
    SolutionNameMin: Cijk_Ailk_Bljk_HB_MT128x64x8_SN_SU0_SUM0_TT8_8_WG16_8_1_WGM4
    SolutionIndex: 49
    SolutionNameMin: Cijk_Ailk_Bljk_HB_MT64x64x16_SN_SU0_SUM0_TT8_8_WG8_8_1_WGM4
    SolutionIndex: 50
    SolutionNameMin: Cijk_Ailk_Bljk_HB_MT128x64x16_SN_SU0_SUM0_TT8_8_WG16_8_1_WGM4
    SolutionIndex: 51
    SolutionNameMin: Cijk_Ailk_Bljk_HB_MT128x128x16_SN_SU0_SUM0_TT8_8_WG16_16_1_WGM4
    SolutionIndex: 52
    SolutionNameMin: Cijk_Ailk_Bljk_HB_MT128x64x32_SN_SU0_SUM0_TT8_8_WG16_8_1_WGM4
    SolutionIndex: 53
    SolutionNameMin: Cijk_Ailk_Bljk_HB_MT128x64x8_SN_SU32_SUM3_TT8_8_WG16_8_1_WGM4
    SolutionIndex: 54
    SolutionNameMin: Cijk_Ailk_Bljk_HB_MT64x64x16_SN_SU32_SUM3_TT8_8_WG8_8_1_WGM4
    SolutionIndex: 55
    SolutionNameMin: Cijk_Ailk_Bljk_HB_MT128x64x16_SN_SU32_SUM3_TT8_8_WG16_8_1_WGM4
    SolutionIndex: 56
    SolutionNameMin: Cijk_Ailk_Bljk_HB_MT128x128x16_SN_SU32_SUM3_TT8_8_WG16_16_1_WGM4
    SolutionIndex: 57
    SolutionNameMin: Cijk_Ailk_Bljk_HB_MT128x64x8_SN_SU0_SUM0_TT8_8_WG16_8_1_WGM8
    SolutionIndex: 58
    SolutionNameMin: Cijk_Ailk_Bljk_HB_MT64x64x16_SN_SU0_SUM0_TT8_8_WG8_8_1_WGM8
    SolutionIndex: 59
    SolutionNameMin: Cijk_Ailk_Bljk_HB_MT128x64x16_SN_SU0_SUM0_TT8_8_WG16_8_1_WGM8
    SolutionIndex: 60
    SolutionNameMin: Cijk_Ailk_Bljk_HB_MT128x128x16_SN_SU0_SUM0_TT8_8_WG16_16_1_WGM8
    SolutionIndex: 61
    SolutionNameMin: Cijk_Ailk_Bljk_HB_MT128x64x32_SN_SU0_SUM0_TT8_8_WG16_8_1_WGM8
    SolutionIndex: 62
    SolutionNameMin: Cijk_Ailk_Bljk_HB_MT128x64x8_SN_SU32_SUM3_TT8_8_WG16_8_1_WGM8
    SolutionIndex: 63
    SolutionNameMin: Cijk_Ailk_Bljk_HB_MT64x64x16_SN_SU32_SUM3_TT8_8_WG8_8_1_WGM8
    SolutionIndex: 64
    SolutionNameMin: Cijk_Ailk_Bljk_HB_MT128x64x16_SN_SU32_SUM3_TT8_8_WG16_8_1_WGM8
    SolutionIndex: 65
    SolutionNameMin: Cijk_Ailk_Bljk_HB_MT128x128x16_SN_SU32_SUM3_TT8_8_WG16_16_1_WGM8
    SolutionIndex: 66
    SolutionNameMin: Cijk_Ailk_Bljk_HB_MT64x64x32_SN_SU32_SUM3_TT8_8_WG8_8_1_WGM8
    SolutionIndex: 67
    SolutionNameMin: Cijk_Ailk_Bljk_HB_MT64x32x8_SN_SU0_SUM0_TT4_4_WG16_8_1_WGM1
    SolutionIndex: 68
    SolutionNameMin: Cijk_Ailk_Bljk_HB_MT64x64x8_SN_SU0_SUM0_TT4_4_WG16_16_1_WGM1
    SolutionIndex: 69
    SolutionNameMin: Cijk_Ailk_Bljk_HB_MT32x16x16_SN_SU0_SUM0_TT2_2_WG16_8_1_WGM1
    SolutionIndex: 70
    SolutionNameMin: Cijk_Ailk_Bljk_HB_MT64x32x16_SN_SU0_SUM0_TT4_4_WG16_8_1_WGM1
    SolutionIndex: 71
    SolutionNameMin: Cijk_Ailk_Bljk_HB_MT64x64x16_SN_SU0_SUM0_TT4_4_WG16_16_1_WGM1
    SolutionIndex: 72
    SolutionNameMin: Cijk_Ailk_Bljk_HB_MT16x16x32_SN_SU0_SUM0_TT2_2_WG8_8_1_WGM1
    SolutionIndex: 73
    SolutionNameMin: Cijk_Ailk_Bljk_HB_MT32x16x32_SN_SU0_SUM0_TT2_2_WG16_8_1_WGM1
    SolutionIndex: 74
    SolutionNameMin: Cijk_Ailk_Bljk_HB_MT32x16x8_SN_SU32_SUM3_TT2_2_WG16_8_1_WGM1
    SolutionIndex: 75
    SolutionNameMin: Cijk_Ailk_Bljk_HB_MT64x32x8_SN_SU32_SUM3_TT4_4_WG16_8_1_WGM1
    SolutionIndex: 76
    SolutionNameMin: Cijk_Ailk_Bljk_HB_MT64x64x8_SN_SU32_SUM3_TT4_4_WG16_16_1_WGM1
    SolutionIndex: 77
    SolutionNameMin: Cijk_Ailk_Bljk_HB_MT16x16x16_SN_SU32_SUM3_TT2_2_WG8_8_1_WGM1
    SolutionIndex: 78
    SolutionNameMin: Cijk_Ailk_Bljk_HB_MT32x16x16_SN_SU32_SUM3_TT2_2_WG16_8_1_WGM1
    SolutionIndex: 79
    SolutionNameMin: Cijk_Ailk_Bljk_HB_MT64x32x16_SN_SU32_SUM3_TT4_4_WG16_8_1_WGM1
    SolutionIndex: 80
    SolutionNameMin: Cijk_Ailk_Bljk_HB_MT64x64x16_SN_SU32_SUM3_TT4_4_WG16_16_1_WGM1
    SolutionIndex: 81
    SolutionNameMin: Cijk_Ailk_Bljk_HB_MT32x32x32_SN_SU32_SUM3_TT2_2_WG16_16_1_WGM1
    SolutionIndex: 82
    SolutionNameMin: Cijk_Ailk_Bljk_HB_MT64x32x8_SN_SU0_SUM0_TT4_4_WG16_8_1_WGM4
    SolutionIndex: 83
    SolutionNameMin: Cijk_Ailk_Bljk_HB_MT64x64x8_SN_SU0_SUM0_TT4_4_WG16_16_1_WGM4
    SolutionIndex: 84
    SolutionNameMin: Cijk_Ailk_Bljk_HB_MT32x16x16_SN_SU0_SUM0_TT2_2_WG16_8_1_WGM4
    SolutionIndex: 85
    SolutionNameMin: Cijk_Ailk_Bljk_HB_MT64x32x16_SN_SU0_SUM0_TT4_4_WG16_8_1_WGM4
    SolutionIndex: 86
    SolutionNameMin: Cijk_Ailk_Bljk_HB_MT16x16x32_SN_SU0_SUM0_TT2_2_WG8_8_1_WGM4
    SolutionIndex: 87
    SolutionNameMin: Cijk_Ailk_Bljk_HB_MT32x16x32_SN_SU0_SUM0_TT2_2_WG16_8_1_WGM4
    SolutionIndex: 88
    SolutionNameMin: Cijk_Ailk_Bljk_HB_MT64x32x8_SN_SU32_SUM3_TT4_4_WG16_8_1_WGM4
    SolutionIndex: 89
    SolutionNameMin: Cijk_Ailk_Bljk_HB_MT16x16x16_SN_SU32_SUM3_TT2_2_WG8_8_1_WGM4
    SolutionIndex: 90
    SolutionNameMin: Cijk_Ailk_Bljk_HB_MT32x16x16_SN_SU32_SUM3_TT2_2_WG16_8_1_WGM4
    SolutionIndex: 91
    SolutionNameMin: Cijk_Ailk_Bljk_HB_MT32x16x32_SN_SU32_SUM3_TT2_2_WG16_8_1_WGM4
    SolutionIndex: 92
    SolutionNameMin: Cijk_Ailk_Bljk_HB_MT16x16x8_SN_SU0_SUM0_TT2_2_WG8_8_1_WGM8
    SolutionIndex: 93
    SolutionNameMin: Cijk_Ailk_Bljk_HB_MT32x16x8_SN_SU0_SUM0_TT2_2_WG16_8_1_WGM8
    SolutionIndex: 94
    SolutionNameMin: Cijk_Ailk_Bljk_HB_MT64x32x8_SN_SU0_SUM0_TT4_4_WG16_8_1_WGM8
    SolutionIndex: 95
    SolutionNameMin: Cijk_Ailk_Bljk_HB_MT32x16x16_SN_SU0_SUM0_TT2_2_WG16_8_1_WGM8
    SolutionIndex: 96
    SolutionNameMin: Cijk_Ailk_Bljk_HB_MT64x32x16_SN_SU0_SUM0_TT4_4_WG16_8_1_WGM8
    SolutionIndex: 97
    SolutionNameMin: Cijk_Ailk_Bljk_HB_MT32x32x16_SN_SU0_SUM0_TT2_2_WG16_16_1_WGM8
    SolutionIndex: 98
    SolutionNameMin: Cijk_Ailk_Bljk_HB_MT64x64x16_SN_SU0_SUM0_TT4_4_WG16_16_1_WGM8
    SolutionIndex: 99
    SolutionNameMin: Cijk_Ailk_Bljk_HB_MT32x16x32_SN_SU0_SUM0_TT2_2_WG16_8_1_WGM8
    SolutionIndex: 100
    SolutionNameMin: Cijk_Ailk_Bljk_HB_MT16x16x8_SN_SU32_SUM3_TT2_2_WG8_8_1_WGM8
    SolutionIndex: 101
    SolutionNameMin: Cijk_Ailk_Bljk_HB_MT64x32x8_SN_SU32_SUM3_TT4_4_WG16_8_1_WGM8
    SolutionIndex: 102
    SolutionNameMin: Cijk_Ailk_Bljk_HB_MT64x64x8_SN_SU32_SUM3_TT4_4_WG16_16_1_WGM8
    SolutionIndex: 103
    SolutionNameMin: Cijk_Ailk_Bljk_HB_MT16x16x16_SN_SU32_SUM3_TT2_2_WG8_8_1_WGM8
    SolutionIndex: 104
    SolutionNameMin: Cijk_Ailk_Bljk_HB_MT32x16x16_SN_SU32_SUM3_TT2_2_WG16_8_1_WGM8
    SolutionIndex: 105
    SolutionNameMin: Cijk_Ailk_Bljk_HB_MT64x32x16_SN_SU32_SUM3_TT4_4_WG16_8_1_WGM8
    SolutionIndex: 106
    SolutionNameMin: Cijk_Ailk_Bljk_HB_MT32x32x16_SN_SU32_SUM3_TT2_2_WG16_16_1_WGM8
    SolutionIndex: 107
    SolutionNameMin: Cijk_Ailk_Bljk_HB_MT16x16x32_SN_SU32_SUM3_TT2_2_WG8_8_1_WGM8
    SolutionIndex: 108
    SolutionNameMin: Cijk_Ailk_Bljk_HB_MT64x32x32_SN_SU32_SUM3_TT4_4_WG16_8_1_WGM8
    SolutionIndex: 109
    SolutionNameMin: Cijk_Ailk_Bljk_HB_MT64x16x16_SN_SU0_SUM0_TT4_2_WG16_8_1_WGM1
    SolutionIndex: 110
    SolutionNameMin: Cijk_Ailk_Bljk_HB_MT128x8x32_SN_SU0_SUM0_TT4_2_WG32_4_1_WGM1
    SolutionIndex: 111
    SolutionNameMin: Cijk_Ailk_Bljk_HB_MT64x16x16_SN_SU32_SUM3_TT4_2_WG16_8_1_WGM1
    SolutionIndex: 112
    SolutionNameMin: Cijk_Ailk_Bljk_HB_MT64x8x16_SN_SU32_SUM3_TT2_2_WG32_4_1_WGM1
    SolutionIndex: 113
    SolutionNameMin: Cijk_Ailk_Bljk_HB_MT64x8x32_SN_SU32_SUM3_TT2_2_WG32_4_1_WGM1
    SolutionIndex: 114
    SolutionNameMin: Cijk_Ailk_Bljk_HB_MT128x8x32_SN_SU32_SUM3_TT4_2_WG32_4_1_WGM1
    SolutionIndex: 115
    SolutionNameMin: Cijk_Ailk_Bljk_HB_MT64x16x16_SN_SU0_SUM0_TT4_2_WG16_8_1_WGM4
    SolutionIndex: 116
    SolutionNameMin: Cijk_Ailk_Bljk_HB_MT64x8x32_SN_SU0_SUM0_TT2_2_WG32_4_1_WGM4
    SolutionIndex: 117
    SolutionNameMin: Cijk_Ailk_Bljk_HB_MT128x8x32_SN_SU0_SUM0_TT4_2_WG32_4_1_WGM4
    SolutionIndex: 118
    SolutionNameMin: Cijk_Ailk_Bljk_HB_MT64x16x8_SN_SU32_SUM3_TT4_2_WG16_8_1_WGM4
    SolutionIndex: 119
    SolutionNameMin: Cijk_Ailk_Bljk_HB_MT64x16x16_SN_SU32_SUM3_TT4_2_WG16_8_1_WGM4
    SolutionIndex: 120
    SolutionNameMin: Cijk_Ailk_Bljk_HB_MT64x8x32_SN_SU32_SUM3_TT2_2_WG32_4_1_WGM4
    SolutionIndex: 121
    SolutionNameMin: Cijk_Ailk_Bljk_HB_MT128x8x16_SN_SU0_SUM0_TT4_2_WG32_4_1_WGM8
    SolutionIndex: 122
    SolutionNameMin: Cijk_Ailk_Bljk_HB_MT64x8x32_SN_SU0_SUM0_TT2_2_WG32_4_1_WGM8
    SolutionIndex: 123
    SolutionNameMin: Cijk_Ailk_Bljk_HB_MT64x8x32_SN_SU32_SUM3_TT2_2_WG32_4_1_WGM8
    SolutionIndex: 124
    SolutionNameMin: Cijk_Ailk_Bljk_HB_MT128x8x32_SN_SU32_SUM3_TT4_2_WG32_4_1_WGM8
- - - [2944, 4288, 1, 1280, 2944, 2944, 2944, 1280]
    - [4, 24216.0]
  - - [2368, 5888, 1, 256, 2368, 2368, 2368, 256]
    - [4, 23424.0]
  - - [512, 24000, 1, 1536, 512, 512, 512, 1536]
    - [34, 24681.0]
  - - [5888, 1856, 1, 3328, 5888, 5888, 5888, 3328]
    - [18, 24040.0]
  - - [5888, 2944, 1, 3328, 5888, 5888, 5888, 3328]
    - [4, 25295.0]
  - - [1856, 4288, 1, 256, 1856, 1856, 1856, 256]
    - [24, 21564.0]
  - - [5056, 5056, 1, 3328, 5056, 5056, 5056, 3328]
    - [16, 24905.0]
  - - [1408, 5888, 1, 1280, 1408, 1408, 1408, 1280]
    - [21, 24308.0]
  - - [6144, 6000, 1, 2560, 6144, 6144, 6144, 2560]
    - [18, 25318.0]
  - - [1024, 3584, 1, 3328, 1024, 1024, 1024, 3328]
    - [21, 23150.0]
  - - [512, 48000, 1, 2048, 512, 512, 512, 2048]
    - [34, 25308.0]
  - - [448, 3584, 1, 3328, 448, 448, 448, 3328]
    - [7, 19464.0]
  - - [5888, 1408, 1, 1280, 5888, 5888, 5888, 1280]
    - [24, 24314.0]
  - - [1024, 2368, 1, 256, 1024, 1024, 1024, 256]
    - [3, 20447.0]
  - - [5056, 6784, 1, 1280, 5056, 5056, 5056, 1280]
    - [2, 25061.0]
  - - [5056, 5056, 1, 1280, 5056, 5056, 5056, 1280]
    - [16, 24754.0]
  - - [4288, 6784, 1, 256, 4288, 4288, 4288, 256]
    - [24, 24077.0]
  - - [6784, 448, 1, 256, 6784, 6784, 6784, 256]
    - [17, 20443.0]
  - - [5056, 256, 1, 1280, 5056, 5056, 5056, 1280]
    - [6, 21394.0]
  - - [5888, 704, 1, 1280, 5888, 5888, 5888, 1280]
    - [34, 21925.0]
  - - [3584, 1024, 1, 256, 3584, 3584, 3584, 256]
    - [4, 21509.0]
  - - [6784, 4288, 1, 3328, 6784, 6784, 6784, 3328]
    - [4, 24884.0]
  - - [1856, 2368, 1, 3328, 1856, 1856, 1856, 3328]
    - [30, 22136.0]
  - - [5888, 2944, 1, 1280, 5888, 5888, 5888, 1280]
    - [4, 25222.0]
  - - [5888, 1024, 1, 256, 5888, 5888, 5888, 256]
    - [24, 22941.0]
  - - [1408, 2944, 1, 256, 1408, 1408, 1408, 256]
    - [4, 22568.0]
  - - [6784, 5056, 1, 3328, 6784, 6784, 6784, 3328]
    - [18, 25150.0]
  - - [5056, 5056, 1, 256, 5056, 5056, 5056, 256]
    - [4, 23840.0]
  - - [1024, 3584, 1, 1280, 1024, 1024, 1024, 1280]
    - [26, 22809.0]
  - - [2368, 2944, 1, 1280, 2368, 2368, 2368, 1280]
    - [4, 23921.0]
  - - [6784, 6784, 1, 1280, 6784, 6784, 6784, 1280]
    - [4, 25365.0]
  - - [1408, 4288, 1, 1280, 1408, 1408, 1408, 1280]
    - [30, 23710.0]
  - - [3584, 4288, 1, 1280, 3584, 3584, 3584, 1280]
    - [4, 24636.0]
  - - [512, 6000, 1, 2560, 512, 512, 512, 2560]
    - [26, 22779.0]
  - - [2368, 704, 1, 1280, 2368, 2368, 2368, 1280]
    - [27, 19784.0]
  - - [5056, 4288, 1, 3328, 5056, 5056, 5056, 3328]
    - [16, 24805.0]
  - - [3584, 2368, 1, 3328, 3584, 3584, 3584, 3328]
    - [4, 24096.0]
  - - [5888, 6784, 1, 1280, 5888, 5888, 5888, 1280]
    - [16, 25567.0]
  - - [6784, 448, 1, 1280, 6784, 6784, 6784, 1280]
    - [17, 21298.0]
  - - [2944, 5888, 1, 256, 2944, 2944, 2944, 256]
    - [4, 24642.0]
  - - [4288, 2944, 1, 256, 4288, 4288, 4288, 256]
    - [4, 23330.0]
  - - [6144, 24000, 1, 2560, 6144, 6144, 6144, 2560]
    - [19, 25647.0]
  - - [5056, 2368, 1, 1280, 5056, 5056, 5056, 1280]
    - [4, 24075.0]
  - - [448, 3584, 1, 1280, 448, 448, 448, 1280]
    - [7, 18869.0]
  - - [6784, 5888, 1, 256, 6784, 6784, 6784, 256]
    - [4, 24971.0]
  - - [1024, 1408, 1, 256, 1024, 1024, 1024, 256]
    - [17, 18928.0]
  - - [2368, 2368, 1, 3328, 2368, 2368, 2368, 3328]
    - [10, 22555.0]
  - - [5056, 704, 1, 3328, 5056, 5056, 5056, 3328]
    - [33, 22271.0]
  - - [1408, 1856, 1, 256, 1408, 1408, 1408, 256]
    - [3, 20841.0]
  - - [5888, 1856, 1, 256, 5888, 5888, 5888, 256]
    - [18, 22845.0]
  - - [704, 5888, 1, 256, 704, 704, 704, 256]
    - [18, 19977.0]
  - - [3584, 704, 1, 3328, 3584, 3584, 3584, 3328]
    - [3, 21290.0]
  - - [1408, 1408, 1, 256, 1408, 1408, 1408, 256]
    - [3, 19356.0]
  - - [448, 4288, 1, 256, 448, 448, 448, 256]
    - [17, 17088.0]
  - - [704, 2368, 1, 1280, 704, 704, 704, 1280]
    - [7, 19364.0]
  - - [1856, 2368, 1, 1280, 1856, 1856, 1856, 1280]
    - [24, 21890.0]
  - - [1408, 1408, 1, 3328, 1408, 1408, 1408, 3328]
    - [30, 20916.0]
  - - [256, 193600, 1, 64, 256, 256, 256, 64]
    - [0, 21782.0]
  - - [1408, 1024, 1, 1280, 1408, 1408, 1408, 1280]
    - [3, 20662.0]
  - - [704, 6784, 1, 256, 704, 704, 704, 256]
    - [4, 19958.0]
  - - [6784, 704, 1, 256, 6784, 6784, 6784, 256]
    - [3, 21109.0]
  - - [2048, 7000, 1, 2048, 2048, 2048, 2048, 2048]
    - [24, 25083.0]
  - - [5056, 704, 1, 256, 5056, 5056, 5056, 256]
    - [0, 20757.0]
  - - [1408, 3584, 1, 256, 1408, 1408, 1408, 256]
    - [4, 22680.0]
  - - [3584, 4288, 1, 3328, 3584, 3584, 3584, 3328]
    - [16, 24808.0]
  - - [5888, 1856, 1, 1280, 5888, 5888, 5888, 1280]
    - [18, 23895.0]
  - - [2368, 3584, 1, 1280, 2368, 2368, 2368, 1280]
    - [30, 23850.0]
  - - [2944, 3584, 1, 3328, 2944, 2944, 2944, 3328]
    - [18, 24660.0]
  - - [6784, 2944, 1, 256, 6784, 6784, 6784, 256]
    - [24, 24598.0]
  - - [1024, 1500, 1, 2560, 1024, 1024, 1024, 2560]
    - [30, 21359.0]
  - - [1856, 2368, 1, 256, 1856, 1856, 1856, 256]
    - [17, 20531.0]
  - - [3584, 6784, 1, 3328, 3584, 3584, 3584, 3328]
    - [4, 25186.0]
  - - [5056, 4288, 1, 1280, 5056, 5056, 5056, 1280]
    - [16, 24629.0]
  - - [6784, 1856, 1, 3328, 6784, 6784, 6784, 3328]
    - [4, 24299.0]
  - - [1408, 5056, 1, 1280, 1408, 1408, 1408, 1280]
    - [30, 24284.0]
  - - [196, 1024, 64, 256, 196, 196, 196, 256]
    - [4, 17098.0]
  - - [6784, 5888, 1, 3328, 6784, 6784, 6784, 3328]
    - [18, 25490.0]
  - - [2368, 5056, 1, 1280, 2368, 2368, 2368, 1280]
    - [4, 24074.0]
  - - [1024, 5056, 1, 1280, 1024, 1024, 1024, 1280]
    - [18, 24081.0]
  - - [4288, 1024, 1, 256, 4288, 4288, 4288, 256]
    - [4, 21338.0]
  - - [2368, 1408, 1, 256, 2368, 2368, 2368, 256]
    - [3, 20381.0]
  - - [5888, 448, 1, 1280, 5888, 5888, 5888, 1280]
    - [17, 20834.0]
  - - [704, 5888, 1, 3328, 704, 704, 704, 3328]
    - [7, 22439.0]
  - - [1024, 6784, 1, 1280, 1024, 1024, 1024, 1280]
    - [18, 24025.0]
  - - [3584, 2944, 1, 1280, 3584, 3584, 3584, 1280]
    - [18, 24566.0]
  - - [512, 6000, 1, 2816, 512, 512, 512, 2816]
    - [7, 22901.0]
  - - [512, 24000, 1, 2048, 512, 512, 512, 2048]
    - [24, 24788.0]
  - - [1408, 5056, 1, 3328, 1408, 1408, 1408, 3328]
    - [21, 24696.0]
  - - [1856, 1856, 1, 3328, 1856, 1856, 1856, 3328]
    - [21, 21658.0]
  - - [2368, 2368, 1, 256, 2368, 2368, 2368, 256]
    - [4, 21117.0]
  - - [4288, 4288, 1, 1280, 4288, 4288, 4288, 1280]
    - [4, 24460.0]
  - - [5888, 1024, 1, 1280, 5888, 5888, 5888, 1280]
    - [4, 23944.0]
  - - [1024, 12544, 1, 256, 1024, 1024, 1024, 256]
    - [4, 23950.0]
  - - [512, 48000, 1, 2560, 512, 512, 512, 2560]
    - [10, 25351.0]
  - - [704, 6784, 1, 3328, 704, 704, 704, 3328]
    - [4, 22543.0]
  - - [5888, 5888, 1, 3328, 5888, 5888, 5888, 3328]
    - [2, 25585.0]
  - - [5056, 1024, 1, 1280, 5056, 5056, 5056, 1280]
    - [7, 24020.0]
  - - [448, 5888, 1, 3328, 448, 448, 448, 3328]
    - [21, 19784.0]
  - - [1024, 2944, 1, 1280, 1024, 1024, 1024, 1280]
    - [10, 22238.0]
  - - [5056, 5888, 1, 1280, 5056, 5056, 5056, 1280]
    - [16, 25101.0]
  - - [448, 6784, 1, 256, 448, 448, 448, 256]
    - [20, 17812.0]
  - - [3584, 5888, 1, 256, 3584, 3584, 3584, 256]
    - [4, 24587.0]
  - - [2944, 3584, 1, 256, 2944, 2944, 2944, 256]
    - [4, 23824.0]
  - - [3072, 1500, 1, 1024, 3072, 3072, 3072, 1024]
    - [18, 22791.0]
  - - [6784, 1024, 1, 3328, 6784, 6784, 6784, 3328]
    - [7, 24256.0]
  - - [6784, 2944, 1, 3328, 6784, 6784, 6784, 3328]
    - [4, 25370.0]
  - - [6784, 2368, 1, 1280, 6784, 6784, 6784, 1280]
    - [4, 24250.0]
  - - [4288, 3584, 1, 256, 4288, 4288, 4288, 256]
    - [7, 23856.0]
  - - [4288, 5888, 1, 1280, 4288, 4288, 4288, 1280]
    - [18, 24737.0]
  - - [1024, 6000, 1, 1536, 1024, 1024, 1024, 1536]
    - [24, 24182.0]
  - - [4288, 1856, 1, 1280, 4288, 4288, 4288, 1280]
    - [4, 23212.0]
  - - [1856, 2944, 1, 3328, 1856, 1856, 1856, 3328]
    - [7, 23108.0]
  - - [256, 6784, 1, 3328, 256, 256, 256, 3328]
    - [4, 20925.0]
  - - [512, 3000, 1, 1536, 512, 512, 512, 1536]
    - [34, 19720.0]
  - - [5056, 1024, 1, 256, 5056, 5056, 5056, 256]
    - [4, 20341.0]
  - - [5056, 1856, 1, 3328, 5056, 5056, 5056, 3328]
    - [4, 23993.0]
  - - [4096, 7000, 1, 4096, 4096, 4096, 4096, 4096]
    - [25, 25253.0]
  - - [5056, 256, 1, 3328, 5056, 5056, 5056, 3328]
    - [6, 21670.0]
  - - [1024, 5888, 1, 1280, 1024, 1024, 1024, 1280]
    - [4, 23902.0]
  - - [5056, 3584, 1, 256, 5056, 5056, 5056, 256]
    - [10, 23748.0]
  - - [1856, 1024, 1, 1280, 1856, 1856, 1856, 1280]
    - [4, 21992.0]
  - - [1856, 1856, 1, 1280, 1856, 1856, 1856, 1280]
    - [3, 20854.0]
  - - [3072, 24000, 1, 1024, 3072, 3072, 3072, 1024]
    - [35, 25317.0]
  - - [1856, 1024, 1, 3328, 1856, 1856, 1856, 3328]
    - [7, 22543.0]
  - - [6784, 1024, 1, 256, 6784, 6784, 6784, 256]
    - [7, 22280.0]
  - - [5056, 5888, 1, 3328, 5056, 5056, 5056, 3328]
    - [16, 25172.0]
  - - [1856, 1024, 1, 256, 1856, 1856, 1856, 256]
    - [6, 18457.0]
  - - [512, 48000, 1, 1536, 512, 512, 512, 1536]
    - [34, 25267.0]
  - - [5056, 1408, 1, 3328, 5056, 5056, 5056, 3328]
    - [4, 24623.0]
  - - [448, 5888, 1, 256, 448, 448, 448, 256]
    - [17, 17513.0]
  - - [1408, 6784, 1, 3328, 1408, 1408, 1408, 3328]
    - [7, 24461.0]
  - - [1024, 24000, 1, 2560, 1024, 1024, 1024, 2560]
    - [19, 25020.0]
  - - [2944, 1408, 1, 3328, 2944, 2944, 2944, 3328]
    - [4, 23836.0]
  - - [2944, 4288, 1, 3328, 2944, 2944, 2944, 3328]
    - [18, 24367.0]
  - - [5056, 2944, 1, 256, 5056, 5056, 5056, 256]
    - [34, 23478.0]
  - - [2368, 1856, 1, 256, 2368, 2368, 2368, 256]
    - [3, 20442.0]
  - - [1408, 3584, 1, 3328, 1408, 1408, 1408, 3328]
    - [7, 24051.0]
  - - [2368, 6784, 1, 256, 2368, 2368, 2368, 256]
    - [24, 23393.0]
  - - [4288, 2368, 1, 3328, 4288, 4288, 4288, 3328]
    - [4, 23655.0]
  - - [704, 3584, 1, 1280, 704, 704, 704, 1280]
    - [10, 20015.0]
  - - [1408, 5888, 1, 3328, 1408, 1408, 1408, 3328]
    - [7, 24472.0]
  - - [1856, 5056, 1, 256, 1856, 1856, 1856, 256]
    - [24, 21177.0]
  - - [6784, 6784, 1, 256, 6784, 6784, 6784, 256]
    - [34, 24887.0]
  - - [2368, 4288, 1, 1280, 2368, 2368, 2368, 1280]
    - [4, 23448.0]
  - - [3584, 1856, 1, 1280, 3584, 3584, 3584, 1280]
    - [18, 23757.0]
  - - [8448, 48000, 1, 2816, 8448, 8448, 8448, 2816]
    - [5, 25576.0]
  - - [512, 6000, 1, 2048, 512, 512, 512, 2048]
    - [37, 20787.0]
  - - [3584, 448, 1, 256, 3584, 3584, 3584, 256]
    - [8, 16833.0]
  - - [3584, 3584, 1, 1280, 3584, 3584, 3584, 1280]
    - [2, 24673.0]
  - - [256, 6784, 1, 256, 256, 256, 256, 256]
    - [3, 19280.0]
  - - [1856, 3584, 1, 3328, 1856, 1856, 1856, 3328]
    - [4, 24101.0]
  - - [3584, 3584, 1, 256, 3584, 3584, 3584, 256]
    - [34, 23804.0]
  - - [6784, 4288, 1, 1280, 6784, 6784, 6784, 1280]
    - [4, 24734.0]
  - - [3584, 5056, 1, 256, 3584, 3584, 3584, 256]
    - [18, 23586.0]
  - - [2944, 2368, 1, 1280, 2944, 2944, 2944, 1280]
    - [30, 23831.0]
  - - [6784, 3584, 1, 256, 6784, 6784, 6784, 256]
    - [4, 24509.0]
  - - [1856, 1408, 1, 256, 1856, 1856, 1856, 256]
    - [0, 19125.0]
  - - [2944, 2944, 1, 3328, 2944, 2944, 2944, 3328]
    - [4, 24606.0]
  - - [5056, 6784, 1, 256, 5056, 5056, 5056, 256]
    - [18, 24230.0]
  - - [1408, 4288, 1, 3328, 1408, 1408, 1408, 3328]
    - [4, 24060.0]
  - - [6784, 256, 1, 1280, 6784, 6784, 6784, 1280]
    - [33, 20121.0]
  - - [2368, 704, 1, 3328, 2368, 2368, 2368, 3328]
    - [33, 19747.0]
  - - [3584, 6784, 1, 256, 3584, 3584, 3584, 256]
    - [24, 24475.0]
  - - [5056, 1856, 1, 256, 5056, 5056, 5056, 256]
    - [18, 22343.0]
  - - [1024, 3000, 1, 2816, 1024, 1024, 1024, 2816]
    - [7, 22582.0]
  - - [704, 4288, 1, 256, 704, 704, 704, 256]
    - [3, 17405.0]
  - - [1408, 6784, 1, 1280, 1408, 1408, 1408, 1280]
    - [18, 24304.0]
  - - [7680, 24000, 1, 2560, 7680, 7680, 7680, 2560]
    - [5, 25257.0]
  - - [4608, 48000, 1, 1536, 4608, 4608, 4608, 1536]
    - [25, 25627.0]
  - - [1024, 24000, 1, 1536, 1024, 1024, 1024, 1536]
    - [34, 24910.0]
  - - [5056, 2368, 1, 3328, 5056, 5056, 5056, 3328]
    - [18, 24212.0]
  - - [2944, 4288, 1, 256, 2944, 2944, 2944, 256]
    - [18, 23273.0]
  - - [1408, 3584, 1, 1280, 1408, 1408, 1408, 1280]
    - [21, 23765.0]
  - - [1024, 1500, 1, 2816, 1024, 1024, 1024, 2816]
    - [4, 21209.0]
  - - [1024, 6000, 1, 2048, 1024, 1024, 1024, 2048]
    - [24, 23946.0]
  - - [512, 24000, 1, 2560, 512, 512, 512, 2560]
    - [34, 24778.0]
  - - [6144, 3000, 1, 2560, 6144, 6144, 6144, 2560]
    - [2, 24613.0]
  - - [2368, 6784, 1, 3328, 2368, 2368, 2368, 3328]
    - [4, 24311.0]
  - - [5056, 704, 1, 1280, 5056, 5056, 5056, 1280]
    - [3, 21336.0]
  - - [1856, 4288, 1, 3328, 1856, 1856, 1856, 3328]
    - [37, 23432.0]
  - - [1408, 5888, 1, 256, 1408, 1408, 1408, 256]
    - [4, 23379.0]
  - - [704, 2944, 1, 1280, 704, 704, 704, 1280]
    - [4, 20919.0]
  - - [3584, 704, 1, 1280, 3584, 3584, 3584, 1280]
    - [29, 20498.0]
  - - [5888, 5056, 1, 256, 5888, 5888, 5888, 256]
    - [10, 24040.0]
  - - [3584, 448, 1, 3328, 3584, 3584, 3584, 3328]
    - [17, 20973.0]
  - - [704, 2368, 1, 3328, 704, 704, 704, 3328]
    - [7, 20029.0]
  - - [448, 5056, 1, 3328, 448, 448, 448, 3328]
    - [33, 20556.0]
  - - [4288, 448, 1, 256, 4288, 4288, 4288, 256]
    - [0, 17365.0]
  - - [5888, 2368, 1, 256, 5888, 5888, 5888, 256]
    - [24, 23208.0]
  - - [6784, 704, 1, 3328, 6784, 6784, 6784, 3328]
    - [7, 22531.0]
  - - [1408, 2944, 1, 3328, 1408, 1408, 1408, 3328]
    - [4, 23976.0]
  - - [4288, 4288, 1, 256, 4288, 4288, 4288, 256]
    - [10, 23507.0]
  - - [2368, 704, 1, 256, 2368, 2368, 2368, 256]
    - [14, 17871.0]
  - - [3584, 2368, 1, 256, 3584, 3584, 3584, 256]
    - [30, 22325.0]
  - - [5888, 5056, 1, 1280, 5888, 5888, 5888, 1280]
    - [16, 25045.0]
  - - [8448, 24000, 1, 2816, 8448, 8448, 8448, 2816]
    - [26, 25349.0]
  - - [3584, 3584, 1, 3328, 3584, 3584, 3584, 3328]
    - [2, 24780.0]
  - - [3072, 1500, 1, 128, 3072, 3072, 3072, 128]
    - [27, 13647.0]
  - - [2048, 3136, 1, 512, 2048, 2048, 2048, 512]
    - [4, 22213.0]
  - - [5888, 6784, 1, 256, 5888, 5888, 5888, 256]
    - [24, 24921.0]
  - - [4288, 2944, 1, 3328, 4288, 4288, 4288, 3328]
    - [2, 24353.0]
  - - [256, 5056, 1, 1280, 256, 256, 256, 1280]
    - [3, 20043.0]
  - - [6784, 5888, 1, 1280, 6784, 6784, 6784, 1280]
    - [4, 25343.0]
  - - [5888, 4288, 1, 1280, 5888, 5888, 5888, 1280]
    - [4, 24641.0]
  - - [1024, 24000, 1, 2048, 1024, 1024, 1024, 2048]
    - [24, 24871.0]
  - - [1408, 1856, 1, 1280, 1408, 1408, 1408, 1280]
    - [3, 21368.0]
  - - [5888, 448, 1, 3328, 5888, 5888, 5888, 3328]
    - [3, 20839.0]
  - - [704, 5888, 1, 1280, 704, 704, 704, 1280]
    - [7, 21847.0]
  - - [5056, 2944, 1, 3328, 5056, 5056, 5056, 3328]
    - [16, 24979.0]
  - - [448, 4288, 1, 1280, 448, 448, 448, 1280]
    - [4, 18868.0]
  - - [3584, 704, 1, 256, 3584, 3584, 3584, 256]
    - [3, 18465.0]
  - - [3584, 1408, 1, 3328, 3584, 3584, 3584, 3328]
    - [4, 23698.0]
  - - [2368, 1024, 1, 1280, 2368, 2368, 2368, 1280]
    - [21, 21297.0]
  - - [2944, 6784, 1, 1280, 2944, 2944, 2944, 1280]
    - [4, 25179.0]
  - - [1856, 6784, 1, 256, 1856, 1856, 1856, 256]
    - [10, 22978.0]
  - - [4288, 448, 1, 3328, 4288, 4288, 4288, 3328]
    - [3, 21069.0]
  - - [6784, 704, 1, 1280, 6784, 6784, 6784, 1280]
    - [4, 21827.0]
  - - [5888, 1024, 1, 3328, 5888, 5888, 5888, 3328]
    - [4, 23929.0]
  - - [704, 6784, 1, 1280, 704, 704, 704, 1280]
    - [5, 20918.0]
  - - [512, 3000, 1, 2048, 512, 512, 512, 2048]
    - [10, 20324.0]
  - - [5056, 1024, 1, 3328, 5056, 5056, 5056, 3328]
    - [21, 24217.0]
  - - [704, 5056, 1, 1280, 704, 704, 704, 1280]
    - [7, 21211.0]
  - - [2944, 1856, 1, 256, 2944, 2944, 2944, 256]
    - [17, 20990.0]
  - - [5888, 5056, 1, 3328, 5888, 5888, 5888, 3328]
    - [5, 25175.0]
  - - [3584, 6784, 1, 1280, 3584, 3584, 3584, 1280]
    - [4, 25018.0]
  - - [1856, 5888, 1, 256, 1856, 1856, 1856, 256]
    - [10, 22897.0]
  - - [4288, 4288, 1, 3328, 4288, 4288, 4288, 3328]
    - [16, 24542.0]
  - - [4288, 1408, 1, 1280, 4288, 4288, 4288, 1280]
    - [34, 23450.0]
  - - [4288, 2368, 1, 256, 4288, 4288, 4288, 256]
    - [10, 22390.0]
  - - [2944, 5056, 1, 1280, 2944, 2944, 2944, 1280]
    - [4, 24782.0]
  - - [6784, 2368, 1, 3328, 6784, 6784, 6784, 3328]
    - [18, 24305.0]
  - - [4288, 1856, 1, 3328, 4288, 4288, 4288, 3328]
    - [4, 23410.0]
  - - [1856, 2944, 1, 1280, 1856, 1856, 1856, 1280]
    - [30, 22639.0]
  - - [4288, 6784, 1, 3328, 4288, 4288, 4288, 3328]
    - [18, 24795.0]
  - - [3584, 1024, 1, 1280, 3584, 3584, 3584, 1280]
    - [33, 22400.0]
  - - [1024, 4288, 1, 256, 1024, 1024, 1024, 256]
    - [9, 20008.0]
  - - [5888, 3584, 1, 3328, 5888, 5888, 5888, 3328]
    - [4, 25136.0]
  - - [5056, 3584, 1, 3328, 5056, 5056, 5056, 3328]
    - [16, 25025.0]
  - - [2368, 1408, 1, 1280, 2368, 2368, 2368, 1280]
    - [4, 21502.0]
  - - [5056, 2944, 1, 1280, 5056, 5056, 5056, 1280]
    - [34, 24756.0]
  - - [8448, 6000, 1, 2816, 8448, 8448, 8448, 2816]
    - [19, 25395.0]
  - - [1024, 6784, 1, 256, 1024, 1024, 1024, 256]
    - [4, 21918.0]
  - - [2944, 5056, 1, 3328, 2944, 2944, 2944, 3328]
    - [21, 24969.0]
  - - [3584, 2944, 1, 256, 3584, 3584, 3584, 256]
    - [24, 22922.0]
  - - [5056, 6784, 1, 3328, 5056, 5056, 5056, 3328]
    - [19, 25211.0]
  - - [3584, 4288, 1, 256, 3584, 3584, 3584, 256]
    - [18, 22874.0]
  - - [1856, 6784, 1, 3328, 1856, 1856, 1856, 3328]
    - [30, 24212.0]
  - - [512, 6000, 1, 1536, 512, 512, 512, 1536]
    - [24, 21556.0]
  - - [5056, 1408, 1, 1280, 5056, 5056, 5056, 1280]
    - [4, 24328.0]
  - - [5888, 5888, 1, 256, 5888, 5888, 5888, 256]
    - [34, 24851.0]
  - - [4288, 1024, 1, 1280, 4288, 4288, 4288, 1280]
    - [7, 23405.0]
  - - [448, 6784, 1, 3328, 448, 448, 448, 3328]
    - [4, 20454.0]
  - - [2944, 1408, 1, 1280, 2944, 2944, 2944, 1280]
    - [4, 23255.0]
  - - [3072, 6000, 1, 1024, 3072, 3072, 3072, 1024]
    - [24, 24780.0]
  - - [2944, 1856, 1, 3328, 2944, 2944, 2944, 3328]
    - [4, 23073.0]
  - - [448, 5056, 1, 256, 448, 448, 448, 256]
    - [17, 16197.0]
  - - [3584, 5888, 1, 1280, 3584, 3584, 3584, 1280]
    - [4, 25078.0]
  - - [6784, 1856, 1, 1280, 6784, 6784, 6784, 1280]
    - [4, 24104.0]
  - - [5888, 256, 1, 3328, 5888, 5888, 5888, 3328]
    - [18, 21276.0]
  - - [1856, 5888, 1, 3328, 1856, 1856, 1856, 3328]
    - [4, 24009.0]
  - - [3584, 1408, 1, 256, 3584, 3584, 3584, 256]
    - [18, 21199.0]
  - - [704, 3584, 1, 3328, 704, 704, 704, 3328]
    - [34, 20324.0]
  - - [5056, 448, 1, 1280, 5056, 5056, 5056, 1280]
    - [9, 20560.0]
  - - [3584, 1856, 1, 3328, 3584, 3584, 3584, 3328]
    - [24, 24035.0]
  - - [1024, 3000, 1, 2048, 1024, 1024, 1024, 2048]
    - [24, 22109.0]
  - - [2944, 1024, 1, 256, 2944, 2944, 2944, 256]
    - [18, 19141.0]
  - - [2368, 4288, 1, 3328, 2368, 2368, 2368, 3328]
    - [18, 23656.0]
  - - [1024, 1408, 1, 1280, 1024, 1024, 1024, 1280]
    - [17, 20130.0]
  - - [6784, 5056, 1, 256, 6784, 6784, 6784, 256]
    - [4, 24383.0]
  - - [4288, 5888, 1, 256, 4288, 4288, 4288, 256]
    - [4, 24085.0]
  - - [2944, 6784, 1, 256, 2944, 2944, 2944, 256]
    - [4, 24724.0]
  - - [2368, 2368, 1, 1280, 2368, 2368, 2368, 1280]
    - [4, 22261.0]
  - - [1856, 3584, 1, 1280, 1856, 1856, 1856, 1280]
    - [24, 23625.0]
  - - [3584, 1408, 1, 1280, 3584, 3584, 3584, 1280]
    - [4, 23646.0]
  - - [5056, 3584, 1, 1280, 5056, 5056, 5056, 1280]
    - [4, 24881.0]
  - - [256, 5888, 1, 256, 256, 256, 256, 256]
    - [12, 18393.0]
  - - [1856, 1408, 1, 3328, 1856, 1856, 1856, 3328]
    - [18, 21067.0]
  - - [1024, 4288, 1, 3328, 1024, 1024, 1024, 3328]
    - [4, 23555.0]
  - - [2944, 2368, 1, 3328, 2944, 2944, 2944, 3328]
    - [4, 24131.0]
  - - [704, 4288, 1, 3328, 704, 704, 704, 3328]
    - [4, 20410.0]
  - - [1024, 48000, 1, 2816, 1024, 1024, 1024, 2816]
    - [5, 25579.0]
  - - [1024, 1856, 1, 1280, 1024, 1024, 1024, 1280]
    - [18, 21092.0]
  - - [6784, 1856, 1, 256, 6784, 6784, 6784, 256]
    - [24, 22922.0]
  - - [512, 48000, 1, 2816, 512, 512, 512, 2816]
    - [18, 25383.0]
  - - [512, 3000, 1, 2816, 512, 512, 512, 2816]
    - [30, 20912.0]
  - - [1024, 5888, 1, 256, 1024, 1024, 1024, 256]
    - [4, 21654.0]
  - - [1408, 2368, 1, 256, 1408, 1408, 1408, 256]
    - [3, 19224.0]
  - - [2944, 704, 1, 3328, 2944, 2944, 2944, 3328]
    - [4, 21337.0]
  - - [2944, 2944, 1, 1280, 2944, 2944, 2944, 1280]
    - [4, 24508.0]
  - - [6784, 256, 1, 3328, 6784, 6784, 6784, 3328]
    - [7, 21288.0]
  - - [1408, 5056, 1, 256, 1408, 1408, 1408, 256]
    - [18, 21826.0]
  - - [512, 50176, 1, 128, 512, 512, 512, 128]
    - [4, 23223.0]
  - - [1408, 4288, 1, 256, 1408, 1408, 1408, 256]
    - [17, 21575.0]
  - - [5888, 2368, 1, 1280, 5888, 5888, 5888, 1280]
    - [30, 24301.0]
  - - [2368, 5888, 1, 1280, 2368, 2368, 2368, 1280]
    - [7, 24330.0]
  - - [5888, 256, 1, 1280, 5888, 5888, 5888, 1280]
    - [10, 20953.0]
  - - [2368, 1856, 1, 3328, 2368, 2368, 2368, 3328]
    - [4, 21927.0]
  - - [2944, 704, 1, 256, 2944, 2944, 2944, 256]
    - [3, 18196.0]
  - - [2368, 6784, 1, 1280, 2368, 2368, 2368, 1280]
    - [18, 24215.0]
  - - [2368, 1024, 1, 3328, 2368, 2368, 2368, 3328]
    - [7, 22365.0]
  - - [1856, 4288, 1, 1280, 1856, 1856, 1856, 1280]
    - [18, 23167.0]
  - - [704, 3584, 1, 256, 704, 704, 704, 256]
    - [3, 18540.0]
  - - [704, 2944, 1, 3328, 704, 704, 704, 3328]
    - [4, 21441.0]
  - - [1856, 5056, 1, 3328, 1856, 1856, 1856, 3328]
    - [33, 24002.0]
  - - [196, 256, 64, 1024, 196, 196, 196, 1024]
    - [36, 16148.0]
  - - [3584, 5056, 1, 1280, 3584, 3584, 3584, 1280]
    - [16, 24904.0]
  - - [2944, 1024, 1, 3328, 2944, 2944, 2944, 3328]
    - [7, 22723.0]
  - - [1408, 6784, 1, 256, 1408, 1408, 1408, 256]
    - [10, 23422.0]
  - - [6784, 1408, 1, 3328, 6784, 6784, 6784, 3328]
    - [4, 24496.0]
  - - [1024, 2368, 1, 1280, 1024, 1024, 1024, 1280]
    - [18, 21034.0]
  - - [6784, 2944, 1, 1280, 6784, 6784, 6784, 1280]
    - [18, 25265.0]
  - - [3584, 448, 1, 1280, 3584, 3584, 3584, 1280]
    - [3, 20643.0]
  - - [2944, 6784, 1, 3328, 2944, 2944, 2944, 3328]
    - [4, 25309.0]
  - - [448, 5056, 1, 1280, 448, 448, 448, 1280]
    - [18, 19619.0]
  - - [4288, 5056, 1, 1280, 4288, 4288, 4288, 1280]
    - [16, 24592.0]
  - - [4288, 704, 1, 256, 4288, 4288, 4288, 256]
    - [0, 20157.0]
  - - [5888, 704, 1, 256, 5888, 5888, 5888, 256]
    - [3, 20840.0]
  - - [256, 5888, 1, 3328, 256, 256, 256, 3328]
    - [4, 21258.0]
  - - [6784, 4288, 1, 256, 6784, 6784, 6784, 256]
    - [18, 24132.0]
  - - [5888, 256, 1, 256, 5888, 5888, 5888, 256]
    - [32, 18714.0]
  - - [6784, 1024, 1, 1280, 6784, 6784, 6784, 1280]
    - [7, 24018.0]
  - - [2944, 704, 1, 1280, 2944, 2944, 2944, 1280]
    - [17, 20998.0]
  - - [6784, 3584, 1, 1280, 6784, 6784, 6784, 1280]
    - [18, 25089.0]
  - - [1408, 2944, 1, 1280, 1408, 1408, 1408, 1280]
    - [4, 23718.0]
  - - [1408, 2368, 1, 3328, 1408, 1408, 1408, 3328]
    - [4, 22577.0]
  - - [2368, 2944, 1, 256, 2368, 2368, 2368, 256]
    - [24, 21343.0]
  - - [3584, 1856, 1, 256, 3584, 3584, 3584, 256]
    - [10, 21534.0]
  - - [4288, 3584, 1, 1280, 4288, 4288, 4288, 1280]
    - [21, 24601.0]
  - - [4288, 2944, 1, 1280, 4288, 4288, 4288, 1280]
    - [18, 24165.0]
  - - [5056, 448, 1, 3328, 5056, 5056, 5056, 3328]
    - [3, 21607.0]
  - - [5124, 1500, 1, 2048, 5124, 5124, 5124, 2048]
    - [24, 23311.0]
  - - [4288, 5056, 1, 3328, 4288, 4288, 4288, 3328]
    - [16, 24741.0]
  - - [256, 5056, 1, 3328, 256, 256, 256, 3328]
    - [6, 21157.0]
  - - [5056, 2368, 1, 256, 5056, 5056, 5056, 256]
    - [24, 22890.0]
  - - [4288, 704, 1, 3328, 4288, 4288, 4288, 3328]
    - [3, 21394.0]
  - - [448, 3584, 1, 256, 448, 448, 448, 256]
    - [17, 14947.0]
  - - [6144, 1500, 1, 2560, 6144, 6144, 6144, 2560]
    - [24, 24057.0]
  - - [1024, 1408, 1, 3328, 1024, 1024, 1024, 3328]
    - [3, 20718.0]
  - - [2944, 5888, 1, 1280, 2944, 2944, 2944, 1280]
    - [34, 25168.0]
  - - [5888, 3584, 1, 256, 5888, 5888, 5888, 256]
    - [24, 24478.0]
  - - [1408, 1856, 1, 3328, 1408, 1408, 1408, 3328]
    - [3, 21892.0]
  - - [7680, 6000, 1, 2560, 7680, 7680, 7680, 2560]
    - [18, 25368.0]
  - - [6784, 1408, 1, 1280, 6784, 6784, 6784, 1280]
    - [4, 24217.0]
  - - [512, 3000, 1, 2560, 512, 512, 512, 2560]
    - [34, 21057.0]
  - - [704, 2944, 1, 256, 704, 704, 704, 256]
    - [20, 17865.0]
  - - [2944, 5888, 1, 3328, 2944, 2944, 2944, 3328]
    - [18, 25251.0]
  - - [1024, 1500, 1, 1536, 1024, 1024, 1024, 1536]
    - [36, 19269.0]
  - - [1408, 1408, 1, 1280, 1408, 1408, 1408, 1280]
    - [29, 19974.0]
  - - [3072, 3000, 1, 1024, 3072, 3072, 3072, 1024]
    - [24, 23995.0]
  - - [448, 4288, 1, 3328, 448, 448, 448, 3328]
    - [4, 19719.0]
  - - [704, 2368, 1, 256, 704, 704, 704, 256]
    - [20, 15396.0]
  - - [5888, 2368, 1, 3328, 5888, 5888, 5888, 3328]
    - [16, 24462.0]
  - - [5124, 9124, 1, 1760, 5124, 5124, 5124, 1760]
    - [4, 24517.0]
  - - [4288, 5056, 1, 256, 4288, 4288, 4288, 256]
    - [18, 23418.0]
  - - [4288, 448, 1, 1280, 4288, 4288, 4288, 1280]
    - [3, 20688.0]
  - - [5888, 704, 1, 3328, 5888, 5888, 5888, 3328]
    - [10, 22223.0]
  - - [4288, 3584, 1, 3328, 4288, 4288, 4288, 3328]
    - [21, 24740.0]
  - - [1024, 6784, 1, 3328, 1024, 1024, 1024, 3328]
    - [4, 24043.0]
  - - [512, 3136, 1, 2048, 512, 512, 512, 2048]
    - [9, 20191.0]
  - - [1408, 1024, 1, 256, 1408, 1408, 1408, 256]
    - [14, 16978.0]
  - - [8448, 1500, 1, 2816, 8448, 8448, 8448, 2816]
    - [16, 24355.0]
  - - [2560, 7000, 1, 2560, 2560, 2560, 2560, 2560]
    - [24, 25120.0]
  - - [6784, 6784, 1, 3328, 6784, 6784, 6784, 3328]
    - [4, 25387.0]
  - - [704, 5056, 1, 3328, 704, 704, 704, 3328]
    - [7, 22037.0]
  - - [3584, 5056, 1, 3328, 3584, 3584, 3584, 3328]
    - [28, 25045.0]
  - - [2368, 2944, 1, 3328, 2368, 2368, 2368, 3328]
    - [4, 24091.0]
  - - [2368, 3584, 1, 256, 2368, 2368, 2368, 256]
    - [4, 22519.0]
  - - [4608, 3000, 1, 1536, 4608, 4608, 4608, 1536]
    - [4, 24190.0]
  - - [5124, 9124, 1, 4096, 5124, 5124, 5124, 4096]
    - [4, 24502.0]
  - - [7680, 48000, 1, 2560, 7680, 7680, 7680, 2560]
    - [35, 25499.0]
  - - [4608, 1500, 1, 1536, 4608, 4608, 4608, 1536]
    - [18, 23552.0]
  - - [3584, 2368, 1, 1280, 3584, 3584, 3584, 1280]
    - [4, 23802.0]
  - - [5124, 9124, 1, 2560, 5124, 5124, 5124, 2560]
    - [4, 24519.0]
  - - [1856, 1856, 1, 256, 1856, 1856, 1856, 256]
    - [9, 19104.0]
  - - [4288, 1408, 1, 3328, 4288, 4288, 4288, 3328]
    - [4, 24099.0]
  - - [5124, 9124, 1, 2048, 5124, 5124, 5124, 2048]
    - [24, 24466.0]
  - - [5124, 700, 1, 2048, 5124, 5124, 5124, 2048]
    - [9, 20764.0]
  - - [256, 12544, 1, 1024, 256, 256, 256, 1024]
    - [26, 23154.0]
  - - [5888, 1408, 1, 3328, 5888, 5888, 5888, 3328]
    - [16, 24430.0]
  - - [256, 5056, 1, 256, 256, 256, 256, 256]
    - [23, 16116.0]
  - - [2368, 5056, 1, 256, 2368, 2368, 2368, 256]
    - [34, 22643.0]
  - - [1024, 6000, 1, 2560, 1024, 1024, 1024, 2560]
    - [10, 24312.0]
  - - [1024, 5056, 1, 256, 1024, 1024, 1024, 256]
    - [18, 21678.0]
  - - [4224, 1500, 1, 176, 4224, 4224, 4224, 176]
    - [1, 21056.0]
  - - [2368, 1408, 1, 3328, 2368, 2368, 2368, 3328]
    - [4, 22605.0]
  - - [1024, 48000, 1, 1536, 1024, 1024, 1024, 1536]
    - [25, 25454.0]
  - - [5888, 448, 1, 256, 5888, 5888, 5888, 256]
    - [14, 19394.0]
  - - [6784, 5056, 1, 1280, 6784, 6784, 6784, 1280]
    - [4, 25011.0]
  - - [1024, 48000, 1, 2560, 1024, 1024, 1024, 2560]
    - [31, 25547.0]
  - - [4288, 6784, 1, 1280, 4288, 4288, 4288, 1280]
    - [30, 24688.0]
  - - [3072, 48000, 1, 1024, 3072, 3072, 3072, 1024]
    - [11, 25542.0]
  - - [6784, 1408, 1, 256, 6784, 6784, 6784, 256]
    - [10, 22798.0]
  - - [5888, 4288, 1, 256, 5888, 5888, 5888, 256]
    - [4, 23877.0]
  - - [5056, 5888, 1, 256, 5056, 5056, 5056, 256]
    - [7, 24162.0]
  - - [2368, 1024, 1, 256, 2368, 2368, 2368, 256]
    - [6, 19007.0]
  - - [1856, 6784, 1, 1280, 1856, 1856, 1856, 1280]
    - [4, 24033.0]
  - - [8448, 3000, 1, 2816, 8448, 8448, 8448, 2816]
    - [2, 24635.0]
  - - [6784, 448, 1, 3328, 6784, 6784, 6784, 3328]
    - [3, 21508.0]
  - - [5056, 1856, 1, 1280, 5056, 5056, 5056, 1280]
    - [18, 23764.0]
  - - [1408, 1024, 1, 3328, 1408, 1408, 1408, 3328]
    - [3, 21104.0]
  - - [7680, 1500, 1, 2560, 7680, 7680, 7680, 2560]
    - [4, 24514.0]
  - - [5888, 3584, 1, 1280, 5888, 5888, 5888, 1280]
    - [24, 25076.0]
  - - [1024, 2944, 1, 256, 1024, 1024, 1024, 256]
    - [4, 20471.0]
  - - [448, 6784, 1, 1280, 448, 448, 448, 1280]
    - [34, 19443.0]
  - - [704, 5056, 1, 256, 704, 704, 704, 256]
    - [32, 18268.0]
  - - [3584, 1024, 1, 3328, 3584, 3584, 3584, 3328]
    - [7, 23160.0]
  - - [2944, 1856, 1, 1280, 2944, 2944, 2944, 1280]
    - [4, 22761.0]
  - - [5056, 256, 1, 256, 5056, 5056, 5056, 256]
    - [3, 18266.0]
  - - [2368, 3584, 1, 3328, 2368, 2368, 2368, 3328]
    - [4, 24068.0]
  - - [3584, 5888, 1, 3328, 3584, 3584, 3584, 3328]
    - [4, 25123.0]
  - - [2944, 3584, 1, 1280, 2944, 2944, 2944, 1280]
    - [24, 24402.0]
  - - [1856, 5888, 1, 1280, 1856, 1856, 1856, 1280]
    - [4, 23805.0]
  - - [4608, 24000, 1, 1536, 4608, 4608, 4608, 1536]
    - [5, 25439.0]
  - - [4288, 1408, 1, 256, 4288, 4288, 4288, 256]
    - [10, 21034.0]
  - - [4288, 2368, 1, 1280, 4288, 4288, 4288, 1280]
    - [10, 23461.0]
  - - [2944, 5056, 1, 256, 2944, 2944, 2944, 256]
    - [18, 23369.0]
  - - [6784, 2368, 1, 256, 6784, 6784, 6784, 256]
    - [24, 23245.0]
  - - [1024, 24000, 1, 2816, 1024, 1024, 1024, 2816]
    - [19, 25126.0]
  - - [4288, 1856, 1, 256, 4288, 4288, 4288, 256]
    - [4, 21383.0]
  - - [1856, 2944, 1, 256, 1856, 1856, 1856, 256]
    - [4, 21200.0]
  - - [4608, 6000, 1, 1536, 4608, 4608, 4608, 1536]
    - [34, 25146.0]
  - - [7680, 3000, 1, 2560, 7680, 7680, 7680, 2560]
    - [2, 24802.0]
  - - [5124, 700, 1, 2560, 5124, 5124, 5124, 2560]
    - [17, 21020.0]
  - - [1856, 1408, 1, 1280, 1856, 1856, 1856, 1280]
    - [4, 21059.0]
  - - [1024, 4288, 1, 1280, 1024, 1024, 1024, 1280]
    - [18, 22696.0]
  - - [2368, 5056, 1, 3328, 2368, 2368, 2368, 3328]
    - [18, 24240.0]
  - - [4288, 1024, 1, 3328, 4288, 4288, 4288, 3328]
    - [7, 23783.0]
  - - [6144, 48000, 1, 2560, 6144, 6144, 6144, 2560]
    - [5, 25432.0]
  - - [1024, 5056, 1, 3328, 1024, 1024, 1024, 3328]
    - [7, 24181.0]
  - - [1024, 1856, 1, 3328, 1024, 1024, 1024, 3328]
    - [24, 22098.0]
  - - [5124, 1500, 1, 2560, 5124, 5124, 5124, 2560]
    - [4, 23443.0]
  - - [3584, 2944, 1, 3328, 3584, 3584, 3584, 3328]
    - [4, 24628.0]
  - - [5888, 2944, 1, 256, 5888, 5888, 5888, 256]
    - [34, 24409.0]
  - - [5056, 4288, 1, 256, 5056, 5056, 5056, 256]
    - [30, 23700.0]
  - - [1024, 3584, 1, 256, 1024, 1024, 1024, 256]
    - [34, 21151.0]
  - - [5056, 1408, 1, 256, 5056, 5056, 5056, 256]
    - [30, 22160.0]
  - - [5888, 5888, 1, 1280, 5888, 5888, 5888, 1280]
    - [16, 25434.0]
  - - [448, 5888, 1, 1280, 448, 448, 448, 1280]
    - [18, 18954.0]
  - - [1024, 3000, 1, 2560, 1024, 1024, 1024, 2560]
    - [24, 22209.0]
  - - [4288, 704, 1, 1280, 4288, 4288, 4288, 1280]
    - [17, 20490.0]
  - - [2944, 1408, 1, 256, 2944, 2944, 2944, 256]
    - [4, 21030.0]
  - - [2368, 5888, 1, 3328, 2368, 2368, 2368, 3328]
    - [7, 24443.0]
  - - [2368, 1856, 1, 1280, 2368, 2368, 2368, 1280]
    - [24, 21317.0]
  - - [1024, 6000, 1, 2816, 1024, 1024, 1024, 2816]
    - [24, 24438.0]
  - - [5888, 4288, 1, 3328, 5888, 5888, 5888, 3328]
    - [4, 24778.0]
  - - [5056, 448, 1, 256, 5056, 5056, 5056, 256]
    - [14, 18408.0]
  - - [1856, 5056, 1, 1280, 1856, 1856, 1856, 1280]
    - [30, 23724.0]
  - - [2944, 1024, 1, 1280, 2944, 2944, 2944, 1280]
    - [7, 22261.0]
  - - [2368, 4288, 1, 256, 2368, 2368, 2368, 256]
    - [18, 21723.0]
  - - [1024, 2368, 1, 3328, 1024, 1024, 1024, 3328]
    - [21, 22024.0]
  - - [4288, 5888, 1, 3328, 4288, 4288, 4288, 3328]
    - [4, 24774.0]
  - - [1024, 2944, 1, 3328, 1024, 1024, 1024, 3328]
    - [4, 22308.0]
  - - [256, 6784, 1, 1280, 256, 256, 256, 1280]
    - [3, 19966.0]
  - - [1856, 3584, 1, 256, 1856, 1856, 1856, 256]
    - [37, 21748.0]
  - - [1024, 1500, 1, 2048, 1024, 1024, 1024, 2048]
    - [10, 20701.0]
  - - [512, 24000, 1, 2816, 512, 512, 512, 2816]
    - [18, 24759.0]
  - - [256, 5888, 1, 1280, 256, 256, 256, 1280]
    - [4, 20165.0]
  - - [2944, 2368, 1, 256, 2944, 2944, 2944, 256]
    - [34, 22006.0]
  - - [1024, 1856, 1, 256, 1024, 1024, 1024, 256]
    - [3, 19587.0]
  - - [6784, 3584, 1, 3328, 6784, 6784, 6784, 3328]
    - [18, 25133.0]
  - - [1760, 7000, 1, 1760, 1760, 1760, 1760, 1760]
    - [18, 24174.0]
  - - [1024, 5888, 1, 3328, 1024, 1024, 1024, 3328]
    - [4, 24169.0]
  - - [1408, 2368, 1, 1280, 1408, 1408, 1408, 1280]
    - [18, 21675.0]
  - - [2944, 2944, 1, 256, 2944, 2944, 2944, 256]
    - [4, 22766.0]
  - - [6784, 256, 1, 256, 6784, 6784, 6784, 256]
    - [3, 17246.0]
  - - [1024, 3000, 1, 1536, 1024, 1024, 1024, 1536]
    - [24, 21849.0]
  - - [5888, 1408, 1, 256, 5888, 5888, 5888, 256]
    - [30, 22520.0]
  - - [5888, 6784, 1, 3328, 5888, 5888, 5888, 3328]
    - [19, 25577.0]
  - - [704, 4288, 1, 1280, 704, 704, 704, 1280]
    - [4, 19702.0]
  - - [128, 50176, 1, 512, 128, 128, 128, 512]
    - [24, 22772.0]
  - - [1024, 48000, 1, 2048, 1024, 1024, 1024, 2048]
    - [25, 25281.0]
  - - [784, 512, 64, 128, 784, 784, 784, 128]
    - [15, 20452.0]
  - - [3136, 256, 64, 64, 3136, 3136, 3136, 64]
    - [0, 20097.0]
  - - [12544, 1024, 1, 256, 12544, 12544, 12544, 256]
    - [15, 23664.0]
  - - [784, 128, 128, 512, 784, 784, 784, 512]
    - [22, 19092.0]
  - - [784, 512, 256, 128, 784, 784, 784, 128]
    - [4, 21188.0]
  - - [3136, 512, 1, 2048, 3136, 3136, 3136, 2048]
    - [4, 21600.0]
  - - [12544, 256, 1, 1024, 12544, 12544, 12544, 1024]
    - [13, 23381.0]
  - - [3136, 2048, 1, 512, 3136, 3136, 3136, 512]
    - [13, 22703.0]
  - - [3136, 256, 256, 64, 3136, 3136, 3136, 64]
    - [38, 13356.0]
  - - [784, 128, 64, 512, 784, 784, 784, 512]
    - [10, 20364.0]
  - - [784, 512, 128, 128, 784, 784, 784, 128]
    - [4, 20913.0]
  - - [784, 128, 256, 512, 784, 784, 784, 512]
    - [18, 19816.0]
  - - [3136, 256, 128, 64, 3136, 3136, 3136, 64]
    - [0, 19339.0]
  - - [1024, 1024, 1, 3328, 1024, 1024, 1024, 3328]
    - [42, 19157.0]
  - - [128, 6784, 1, 3328, 128, 128, 128, 3328]
    - [56, 19070.0]
  - - [256, 4288, 1, 3328, 256, 256, 256, 3328]
    - [50, 19885.0]
  - - [704, 1856, 1, 3328, 704, 704, 704, 3328]
    - [50, 18684.0]
  - - [448, 1024, 1, 1280, 448, 448, 448, 1280]
    - [45, 14732.0]
  - - [1024, 704, 1, 256, 1024, 1024, 1024, 256]
    - [48, 12606.0]
  - - [256, 1856, 1, 1280, 256, 256, 256, 1280]
    - [62, 17219.0]
  - - [256, 2944, 1, 3328, 256, 256, 256, 3328]
    - [55, 18668.0]
  - - [128, 3584, 1, 1280, 128, 128, 128, 1280]
    - [64, 15469.0]
  - - [4288, 256, 1, 256, 4288, 4288, 4288, 256]
    - [41, 15859.0]
  - - [5888, 64, 1, 3328, 5888, 5888, 5888, 3328]
    - [46, 14880.0]
  - - [2944, 256, 1, 3328, 2944, 2944, 2944, 3328]
    - [42, 18890.0]
  - - [1408, 448, 1, 1280, 1408, 1408, 1408, 1280]
    - [50, 18144.0]
  - - [1408, 256, 1, 1280, 1408, 1408, 1408, 1280]
    - [40, 12627.0]
  - - [3072, 128, 1, 1024, 3072, 3072, 3072, 1024]
    - [40, 14168.0]
  - - [6784, 64, 1, 256, 6784, 6784, 6784, 256]
    - [46, 10812.0]
  - - [2368, 128, 1, 3328, 2368, 2368, 2368, 3328]
    - [56, 15644.0]
  - - [2944, 128, 1, 256, 2944, 2944, 2944, 256]
    - [59, 9608.0]
  - - [448, 1408, 1, 256, 448, 448, 448, 256]
    - [54, 12796.0]
  - - [64, 5056, 1, 3328, 64, 64, 64, 3328]
    - [45, 15036.0]
  - - [512, 1500, 1, 2816, 512, 512, 512, 2816]
    - [59, 18378.0]
  - - [256, 3584, 1, 3328, 256, 256, 256, 3328]
    - [51, 20044.0]
  - - [256, 1408, 1, 256, 256, 256, 256, 256]
    - [57, 9943.0]
  - - [5056, 64, 1, 1280, 5056, 5056, 5056, 1280]
    - [45, 14523.0]
  - - [2368, 128, 1, 256, 2368, 2368, 2368, 256]
    - [44, 6576.0]
  - - [4288, 128, 1, 1280, 4288, 4288, 4288, 1280]
    - [51, 14772.0]
  - - [5888, 64, 1, 256, 5888, 5888, 5888, 256]
    - [45, 9205.0]
  - - [1856, 256, 1, 1280, 1856, 1856, 1856, 1280]
    - [40, 15988.0]
  - - [64, 5888, 1, 3328, 64, 64, 64, 3328]
    - [45, 13436.0]
  - - [1024, 704, 1, 1280, 1024, 1024, 1024, 1280]
    - [40, 16662.0]
  - - [256, 1408, 1, 3328, 256, 256, 256, 3328]
    - [42, 13669.0]
  - - [6784, 128, 1, 3328, 6784, 6784, 6784, 3328]
    - [51, 18886.0]
  - - [704, 704, 1, 3328, 704, 704, 704, 3328]
    - [41, 15143.0]
  - - [3584, 256, 1, 3328, 3584, 3584, 3584, 3328]
    - [60, 19864.0]
  - - [128, 3584, 1, 3328, 128, 128, 128, 3328]
    - [64, 17150.0]
  - - [128, 2944, 1, 1280, 128, 128, 128, 1280]
    - [42, 12828.0]
  - - [448, 1856, 1, 1280, 448, 448, 448, 1280]
    - [58, 17051.0]
  - - [3584, 128, 1, 256, 3584, 3584, 3584, 256]
    - [40, 9986.0]
  - - [448, 1408, 1, 3328, 448, 448, 448, 3328]
    - [54, 16968.0]
  - - [704, 1024, 1, 256, 704, 704, 704, 256]
    - [40, 13855.0]
  - - [256, 3584, 1, 256, 256, 256, 256, 256]
    - [40, 13784.0]
  - - [1408, 704, 1, 256, 1408, 1408, 1408, 256]
    - [40, 13912.0]
  - - [448, 2944, 1, 3328, 448, 448, 448, 3328]
    - [56, 17789.0]
  - - [64, 5888, 1, 256, 64, 64, 64, 256]
    - [45, 7253.0]
  - - [512, 1500, 1, 2048, 512, 512, 512, 2048]
    - [64, 17689.0]
  - - [448, 2368, 1, 1280, 448, 448, 448, 1280]
    - [41, 16540.0]
  - - [704, 704, 1, 256, 704, 704, 704, 256]
    - [44, 9289.0]
  - - [64, 193600, 1, 64, 64, 64, 64, 64]
    - [45, 12907.0]
  - - [128, 4288, 1, 3328, 128, 128, 128, 3328]
    - [56, 16567.0]
  - - [256, 2368, 1, 256, 256, 256, 256, 256]
    - [40, 11704.0]
  - - [1024, 448, 1, 3328, 1024, 1024, 1024, 3328]
    - [64, 17452.0]
  - - [1856, 704, 1, 1280, 1856, 1856, 1856, 1280]
    - [41, 18227.0]
  - - [1024, 1024, 1, 1280, 1024, 1024, 1024, 1280]
    - [40, 18830.0]
  - - [256, 2944, 1, 256, 256, 256, 256, 256]
    - [40, 15216.0]
  - - [1024, 700, 1, 512, 1024, 1024, 1024, 512]
    - [53, 13725.0]
  - - [128, 6784, 1, 1280, 128, 128, 128, 1280]
    - [47, 17548.0]
  - - [1408, 704, 1, 3328, 1408, 1408, 1408, 3328]
    - [49, 18211.0]
  - - [128, 5888, 1, 1280, 128, 128, 128, 1280]
    - [64, 17165.0]
  - - [704, 1408, 1, 3328, 704, 704, 704, 3328]
    - [42, 17938.0]
  - - [7680, 64, 1, 2560, 7680, 7680, 7680, 2560]
    - [50, 18194.0]
  - - [448, 704, 1, 1280, 448, 448, 448, 1280]
    - [58, 12998.0]
  - - [6784, 128, 1, 256, 6784, 6784, 6784, 256]
    - [50, 14761.0]
  - - [704, 448, 1, 256, 704, 704, 704, 256]
    - [45, 6808.0]
  - - [256, 1856, 1, 3328, 256, 256, 256, 3328]
    - [42, 17767.0]
  - - [1024, 704, 1, 3328, 1024, 1024, 1024, 3328]
    - [50, 17963.0]
  - - [128, 4288, 1, 256, 128, 128, 128, 256]
    - [55, 11867.0]
  - - [64, 6784, 1, 3328, 64, 64, 64, 3328]
    - [45, 15737.0]
  - - [2944, 256, 1, 1280, 2944, 2944, 2944, 1280]
    - [42, 17898.0]
  - - [1856, 704, 1, 256, 1856, 1856, 1856, 256]
    - [40, 16792.0]
  - - [704, 1856, 1, 256, 704, 704, 704, 256]
    - [45, 16478.0]
  - - [2944, 448, 1, 256, 2944, 2944, 2944, 256]
    - [40, 15560.0]
  - - [2368, 128, 1, 1280, 2368, 2368, 2368, 1280]
    - [45, 13866.0]
  - - [64, 6784, 1, 256, 64, 64, 64, 256]
    - [58, 9186.0]
  - - [64, 5056, 1, 1280, 64, 64, 64, 1280]
    - [45, 13589.0]
  - - [704, 448, 1, 3328, 704, 704, 704, 3328]
    - [45, 14910.0]
  - - [2368, 256, 1, 1280, 2368, 2368, 2368, 1280]
    - [60, 17106.0]
  - - [2368, 448, 1, 1280, 2368, 2368, 2368, 1280]
    - [50, 18460.0]
  - - [128, 3584, 1, 256, 128, 128, 128, 256]
    - [44, 10021.0]
  - - [1856, 448, 1, 3328, 1856, 1856, 1856, 3328]
    - [49, 18367.0]
  - - [128, 5056, 1, 256, 128, 128, 128, 256]
    - [42, 13647.0]
  - - [4288, 256, 1, 1280, 4288, 4288, 4288, 1280]
    - [42, 18855.0]
  - - [4288, 128, 1, 3328, 4288, 4288, 4288, 3328]
    - [56, 16854.0]
  - - [7680, 128, 1, 2560, 7680, 7680, 7680, 2560]
    - [51, 20829.0]
  - - [448, 2368, 1, 3328, 448, 448, 448, 3328]
    - [51, 17356.0]
  - - [256, 1408, 1, 1280, 256, 256, 256, 1280]
    - [62, 12544.0]
  - - [128, 2368, 1, 256, 128, 128, 128, 256]
    - [44, 7667.0]
  - - [6784, 64, 1, 3328, 6784, 6784, 6784, 3328]
    - [55, 16323.0]
  - - [128, 2944, 1, 3328, 128, 128, 128, 3328]
    - [64, 14271.0]
  - - [2944, 448, 1, 3328, 2944, 2944, 2944, 3328]
    - [59, 19048.0]
  - - [5888, 128, 1, 256, 5888, 5888, 5888, 256]
    - [40, 12760.0]
  - - [5056, 64, 1, 256, 5056, 5056, 5056, 256]
    - [45, 6915.0]
  - - [512, 1500, 1, 1536, 512, 512, 512, 1536]
    - [44, 17846.0]
  - - [128, 5056, 1, 3328, 128, 128, 128, 3328]
    - [56, 19383.0]
  - - [256, 4288, 1, 1280, 256, 256, 256, 1280]
    - [59, 18911.0]
  - - [4288, 128, 1, 256, 4288, 4288, 4288, 256]
    - [49, 9558.0]
  - - [3584, 256, 1, 256, 3584, 3584, 3584, 256]
    - [44, 13736.0]
  - - [128, 2944, 1, 256, 128, 128, 128, 256]
    - [53, 8259.0]
  - - [3584, 128, 1, 3328, 3584, 3584, 3584, 3328]
    - [50, 17170.0]
  - - [5888, 128, 1, 3328, 5888, 5888, 5888, 3328]
    - [50, 18752.0]
  - - [64, 193600, 1, 256, 64, 64, 64, 256]
    - [66, 15408.0]
  - - [1408, 704, 1, 1280, 1408, 1408, 1408, 1280]
    - [57, 17865.0]
  - - [448, 1408, 1, 1280, 448, 448, 448, 1280]
    - [41, 16779.0]
  - - [704, 1408, 1, 1280, 704, 704, 704, 1280]
    - [49, 18235.0]
  - - [448, 2944, 1, 256, 448, 448, 448, 256]
    - [63, 17018.0]
  - - [448, 2368, 1, 256, 448, 448, 448, 256]
    - [41, 15292.0]
  - - [64, 6784, 1, 1280, 64, 64, 64, 1280]
    - [63, 14796.0]
  - - [128, 2368, 1, 3328, 128, 128, 128, 3328]
    - [50, 15816.0]
  - - [5056, 64, 1, 3328, 5056, 5056, 5056, 3328]
    - [50, 16213.0]
  - - [5056, 128, 1, 3328, 5056, 5056, 5056, 3328]
    - [43, 19998.0]
  - - [448, 704, 1, 256, 448, 448, 448, 256]
    - [45, 6948.0]
  - - [1856, 256, 1, 3328, 1856, 1856, 1856, 3328]
    - [50, 17312.0]
  - - [2944, 128, 1, 3328, 2944, 2944, 2944, 3328]
    - [41, 14512.0]
  - - [1024, 1024, 1, 256, 1024, 1024, 1024, 256]
    - [40, 14448.0]
  - - [704, 1024, 1, 1280, 704, 704, 704, 1280]
    - [40, 16495.0]
  - - [256, 4288, 1, 256, 256, 256, 256, 256]
    - [62, 14964.0]
  - - [2368, 256, 1, 256, 2368, 2368, 2368, 256]
    - [40, 10852.0]
  - - [256, 2368, 1, 3328, 256, 256, 256, 3328]
    - [65, 18284.0]
  - - [704, 448, 1, 1280, 704, 704, 704, 1280]
    - [49, 13133.0]
  - - [256, 1856, 1, 256, 256, 256, 256, 256]
    - [53, 10450.0]
  - - [64, 5056, 1, 256, 64, 64, 64, 256]
    - [45, 6648.0]
  - - [1408, 256, 1, 3328, 1408, 1408, 1408, 3328]
    - [50, 13728.0]
  - - [2368, 448, 1, 256, 2368, 2368, 2368, 256]
    - [40, 14028.0]
  - - [4288, 256, 1, 3328, 4288, 4288, 4288, 3328]
    - [59, 19622.0]
  - - [2944, 256, 1, 256, 2944, 2944, 2944, 256]
    - [57, 12777.0]
  - - [6784, 64, 1, 1280, 6784, 6784, 6784, 1280]
    - [42, 14828.0]
  - - [704, 1856, 1, 1280, 704, 704, 704, 1280]
    - [50, 18042.0]
  - - [448, 1024, 1, 3328, 448, 448, 448, 3328]
    - [45, 16322.0]
  - - [2944, 448, 1, 1280, 2944, 2944, 2944, 1280]
    - [42, 18438.0]
  - - [448, 1024, 1, 256, 448, 448, 448, 256]
    - [49, 9204.0]
  - - [1024, 448, 1, 1280, 1024, 1024, 1024, 1280]
    - [48, 16991.0]
  - - [256, 2368, 1, 1280, 256, 256, 256, 1280]
    - [48, 17708.0]
  - - [128, 5056, 1, 1280, 128, 128, 128, 1280]
    - [55, 18368.0]
  - - [1408, 256, 1, 256, 1408, 1408, 1408, 256]
    - [40, 10162.0]
  - - [128, 5888, 1, 3328, 128, 128, 128, 3328]
    - [46, 18811.0]
  - - [2368, 448, 1, 3328, 2368, 2368, 2368, 3328]
    - [42, 18971.0]
  - - [3584, 128, 1, 1280, 3584, 3584, 3584, 1280]
    - [40, 16644.0]
  - - [1408, 448, 1, 256, 1408, 1408, 1408, 256]
    - [48, 12123.0]
  - - [2368, 256, 1, 3328, 2368, 2368, 2368, 3328]
    - [51, 18408.0]
  - - [5888, 128, 1, 1280, 5888, 5888, 5888, 1280]
    - [42, 18025.0]
  - - [256, 3584, 1, 1280, 256, 256, 256, 1280]
    - [56, 18973.0]
  - - [128, 5888, 1, 256, 128, 128, 128, 256]
    - [62, 14819.0]
  - - [1024, 1024, 1, 1024, 1024, 1024, 1024, 1024]
    - [46, 18500.0]
  - - [1408, 448, 1, 3328, 1408, 1408, 1408, 3328]
    - [42, 19067.0]
  - - [64, 5888, 1, 1280, 64, 64, 64, 1280]
    - [45, 12980.0]
  - - [704, 704, 1, 1280, 704, 704, 704, 1280]
    - [40, 14537.0]
  - - [128, 2368, 1, 1280, 128, 128, 128, 1280]
    - [42, 14211.0]
  - - [3584, 256, 1, 1280, 3584, 3584, 3584, 1280]
    - [51, 19450.0]
  - - [5888, 64, 1, 1280, 5888, 5888, 5888, 1280]
    - [50, 13680.0]
  - - [5056, 128, 1, 1280, 5056, 5056, 5056, 1280]
    - [42, 18246.0]
  - - [448, 1856, 1, 3328, 448, 448, 448, 3328]
    - [51, 17839.0]
  - - [1024, 448, 1, 256, 1024, 1024, 1024, 256]
    - [53, 12336.0]
  - - [2944, 128, 1, 1280, 2944, 2944, 2944, 1280]
    - [42, 13680.0]
  - - [256, 2944, 1, 1280, 256, 256, 256, 1280]
    - [40, 17326.0]
  - - [2560, 128, 1, 2560, 2560, 2560, 2560, 2560]
    - [59, 15875.0]
  - - [704, 1024, 1, 3328, 704, 704, 704, 3328]
    - [42, 17507.0]
  - - [1856, 448, 1, 1280, 1856, 1856, 1856, 1280]
    - [58, 17040.0]
  - - [128, 6784, 1, 256, 128, 128, 128, 256]
    - [44, 13061.0]
  - - [704, 1408, 1, 256, 704, 704, 704, 256]
    - [49, 13570.0]
  - - [4096, 128, 1, 4096, 4096, 4096, 4096, 4096]
    - [56, 16436.0]
  - - [448, 2944, 1, 1280, 448, 448, 448, 1280]
    - [58, 17933.0]
  - - [1856, 256, 1, 256, 1856, 1856, 1856, 256]
    - [40, 9623.0]
  - - [5056, 128, 1, 256, 5056, 5056, 5056, 256]
    - [44, 11379.0]
  - - [6784, 128, 1, 1280, 6784, 6784, 6784, 1280]
    - [65, 17784.0]
  - - [1856, 448, 1, 256, 1856, 1856, 1856, 256]
    - [49, 12901.0]
  - - [128, 4288, 1, 1280, 128, 128, 128, 1280]
    - [44, 15135.0]
  - - [448, 704, 1, 3328, 448, 448, 448, 3328]
    - [54, 15107.0]
  - - [448, 1856, 1, 256, 448, 448, 448, 256]
    - [59, 13188.0]
  - - [1856, 704, 1, 3328, 1856, 1856, 1856, 3328]
    - [42, 18777.0]
  - - [512, 1500, 1, 2560, 512, 512, 512, 2560]
    - [59, 18255.0]
  - - [3136, 64, 128, 64, 3136, 3136, 3136, 64]
    - [62, 17836.0]
  - - [3136, 64, 64, 256, 3136, 3136, 3136, 256]
    - [61, 16891.0]
  - - [3136, 64, 128, 256, 3136, 3136, 3136, 256]
    - [61, 16336.0]
  - - [3136, 64, 256, 64, 3136, 3136, 3136, 64]
    - [39, 12115.0]
  - - [3136, 64, 64, 64, 3136, 3136, 3136, 64]
    - [57, 19481.0]
  - - [3136, 64, 256, 256, 3136, 3136, 3136, 256]
    - [52, 16536.0]
  - - [2368, 64, 1, 3328, 2368, 2368, 2368, 3328]
    - [71, 8457.0]
  - - [256, 704, 1, 1280, 256, 256, 256, 1280]
    - [101, 8866.0]
  - - [1408, 64, 1, 1280, 1408, 1408, 1408, 1280]
    - [70, 5790.0]
  - - [4096, 32, 1, 4096, 4096, 4096, 4096, 4096]
    - [96, 7283.0]
  - - [3072, 64, 1, 1024, 3072, 3072, 3072, 1024]
    - [101, 9036.0]
  - - [1024, 256, 1, 3328, 1024, 1024, 1024, 3328]
    - [82, 9091.0]
  - - [6144, 32, 1, 2560, 6144, 6144, 6144, 2560]
    - [67, 9138.0]
  - - [704, 128, 1, 1280, 704, 704, 704, 1280]
    - [70, 5196.0]
  - - [64, 3584, 1, 3328, 64, 64, 64, 3328]
    - [88, 9504.0]
  - - [1024, 256, 1, 256, 1024, 1024, 1024, 256]
    - [82, 6179.0]
  - - [448, 448, 1, 256, 448, 448, 448, 256]
    - [71, 6132.0]
  - - [7680, 32, 1, 2560, 7680, 7680, 7680, 2560]
    - [67, 10141.0]
  - - [128, 1024, 1, 3328, 128, 128, 128, 3328]
    - [94, 7086.0]
  - - [64, 1856, 1, 1280, 64, 64, 64, 1280]
    - [105, 7460.0]
  - - [448, 256, 1, 256, 448, 448, 448, 256]
    - [88, 5478.0]
  - - [256, 1024, 1, 256, 256, 256, 256, 256]
    - [102, 7216.0]
  - - [1024, 128, 1, 1280, 1024, 1024, 1024, 1280]
    - [71, 6921.0]
  - - [3072, 32, 1, 1024, 3072, 3072, 3072, 1024]
    - [96, 5248.0]
  - - [448, 256, 1, 3328, 448, 448, 448, 3328]
    - [70, 7876.0]
  - - [128, 704, 1, 1280, 128, 128, 128, 1280]
    - [75, 6084.0]
  - - [1856, 128, 1, 3328, 1856, 1856, 1856, 3328]
    - [67, 9952.0]
  - - [256, 448, 1, 256, 256, 256, 256, 256]
    - [91, 3581.0]
  - - [8448, 32, 1, 2816, 8448, 8448, 8448, 2816]
    - [67, 9030.0]
  - - [448, 448, 1, 3328, 448, 448, 448, 3328]
    - [82, 9872.0]
  - - [1408, 128, 1, 1280, 1408, 1408, 1408, 1280]
    - [82, 8198.0]
  - - [128, 1856, 1, 1280, 128, 128, 128, 1280]
    - [67, 9204.0]
  - - [2048, 128, 1, 2048, 2048, 2048, 2048, 2048]
    - [88, 8643.0]
  - - [64, 1408, 1, 3328, 64, 64, 64, 3328]
    - [70, 5855.0]
  - - [256, 704, 1, 256, 256, 256, 256, 256]
    - [94, 5059.0]
  - - [128, 1408, 1, 256, 128, 128, 128, 256]
    - [82, 5059.0]
  - - [256, 448, 1, 3328, 256, 256, 256, 3328]
    - [85, 7522.0]
  - - [64, 2368, 1, 1280, 64, 64, 64, 1280]
    - [76, 7778.0]
  - - [2368, 64, 1, 256, 2368, 2368, 2368, 256]
    - [88, 4501.0]
  - - [704, 128, 1, 3328, 704, 704, 704, 3328]
    - [70, 5974.0]
  - - [4288, 64, 1, 1280, 4288, 4288, 4288, 1280]
    - [88, 9323.0]
  - - [2560, 64, 1, 2560, 2560, 2560, 2560, 2560]
    - [75, 8584.0]
  - - [128, 1024, 1, 1280, 128, 128, 128, 1280]
    - [88, 6916.0]
  - - [128, 1024, 1, 256, 128, 128, 128, 256]
    - [75, 4033.0]
  - - [1856, 64, 1, 256, 1856, 1856, 1856, 256]
    - [75, 3754.0]
  - - [704, 128, 1, 256, 704, 704, 704, 256]
    - [93, 3076.0]
  - - [448, 256, 1, 1280, 448, 448, 448, 1280]
    - [70, 6571.0]
  - - [1856, 128, 1, 1280, 1856, 1856, 1856, 1280]
    - [82, 9137.0]
  - - [64, 3584, 1, 256, 64, 64, 64, 256]
    - [76, 5780.0]
  - - [64, 1856, 1, 256, 64, 64, 64, 256]
    - [88, 3811.0]
  - - [256, 1024, 1, 1280, 256, 256, 256, 1280]
    - [67, 8693.0]
  - - [3584, 64, 1, 1280, 3584, 3584, 3584, 1280]
    - [94, 8865.0]
  - - [1408, 128, 1, 3328, 1408, 1408, 1408, 3328]
    - [94, 9014.0]
  - - [64, 2944, 1, 3328, 64, 64, 64, 3328]
    - [75, 9007.0]
  - - [64, 4288, 1, 3328, 64, 64, 64, 3328]
    - [88, 9578.0]
  - - [128, 1500, 1, 1280, 128, 128, 128, 1280]
    - [88, 8440.0]
  - - [64, 2944, 1, 256, 64, 64, 64, 256]
    - [88, 5312.0]
  - - [64, 1408, 1, 1280, 64, 64, 64, 1280]
    - [75, 5252.0]
  - - [64, 2944, 1, 1280, 64, 64, 64, 1280]
    - [101, 8231.0]
  - - [704, 256, 1, 256, 704, 704, 704, 256]
    - [88, 5196.0]
  - - [256, 448, 1, 1280, 256, 256, 256, 1280]
    - [70, 6530.0]
  - - [704, 256, 1, 1280, 704, 704, 704, 1280]
    - [67, 8334.0]
  - - [64, 2368, 1, 3328, 64, 64, 64, 3328]
    - [80, 8047.0]
  - - [256, 704, 1, 3328, 256, 256, 256, 3328]
    - [82, 9085.0]
  - - [4096, 64, 1, 4096, 4096, 4096, 4096, 4096]
    - [75, 8970.0]
  - - [1760, 128, 1, 1760, 1760, 1760, 1760, 1760]
    - [68, 9157.0]
  - - [2944, 64, 1, 1280, 2944, 2944, 2944, 1280]
    - [94, 8462.0]
  - - [128, 1408, 1, 3328, 128, 128, 128, 3328]
    - [101, 8925.0]
  - - [1408, 64, 1, 256, 1408, 1408, 1408, 256]
    - [74, 2965.0]
  - - [64, 2368, 1, 256, 64, 64, 64, 256]
    - [76, 4619.0]
  - - [1024, 128, 1, 3328, 1024, 1024, 1024, 3328]
    - [71, 7009.0]
  - - [2368, 64, 1, 1280, 2368, 2368, 2368, 1280]
    - [71, 7282.0]
  - - [4288, 64, 1, 256, 4288, 4288, 4288, 256]
    - [67, 6505.0]
  - - [64, 4288, 1, 1280, 64, 64, 64, 1280]
    - [75, 8956.0]
  - - [1408, 64, 1, 3328, 1408, 1408, 1408, 3328]
    - [79, 5948.0]
  - - [2944, 64, 1, 256, 2944, 2944, 2944, 256]
    - [94, 5432.0]
  - - [448, 448, 1, 1280, 448, 448, 448, 1280]
    - [82, 8976.0]
  - - [1024, 256, 1, 1280, 1024, 1024, 1024, 1280]
    - [82, 8766.0]
  - - [3584, 64, 1, 3328, 3584, 3584, 3584, 3328]
    - [67, 9724.0]
  - - [256, 1024, 1, 3328, 256, 256, 256, 3328]
    - [67, 9481.0]
  - - [1856, 64, 1, 3328, 1856, 1856, 1856, 3328]
    - [70, 7682.0]
  - - [1856, 64, 1, 1280, 1856, 1856, 1856, 1280]
    - [85, 6698.0]
  - - [4608, 32, 1, 1536, 4608, 4608, 4608, 1536]
    - [85, 7199.0]
  - - [1024, 128, 1, 256, 1024, 1024, 1024, 256]
    - [68, 5146.0]
  - - [64, 3584, 1, 1280, 64, 64, 64, 1280]
    - [76, 8775.0]
  - - [3584, 64, 1, 256, 3584, 3584, 3584, 256]
    - [82, 5992.0]
  - - [64, 1856, 1, 3328, 64, 64, 64, 3328]
    - [70, 7643.0]
  - - [1408, 128, 1, 256, 1408, 1408, 1408, 256]
    - [94, 5196.0]
  - - [128, 704, 1, 256, 128, 128, 128, 256]
    - [108, 3060.0]
  - - [128, 704, 1, 3328, 128, 128, 128, 3328]
    - [85, 5915.0]
  - - [128, 1856, 1, 256, 128, 128, 128, 256]
    - [76, 6193.0]
  - - [64, 4288, 1, 256, 64, 64, 64, 256]
    - [75, 6318.0]
  - - [2560, 32, 1, 2560, 2560, 2560, 2560, 2560]
    - [105, 5560.0]
  - - [704, 256, 1, 3328, 704, 704, 704, 3328]
    - [67, 8947.0]
  - - [176, 1500, 1, 1408, 176, 176, 176, 1408]
    - [68, 8077.0]
  - - [1856, 128, 1, 256, 1856, 1856, 1856, 256]
    - [94, 6181.0]
  - - [4288, 64, 1, 3328, 4288, 4288, 4288, 3328]
    - [88, 9268.0]
  - - [2048, 64, 1, 2048, 2048, 2048, 2048, 2048]
    - [98, 6724.0]
  - - [64, 1408, 1, 256, 64, 64, 64, 256]
    - [84, 2988.0]
  - - [2944, 64, 1, 3328, 2944, 2944, 2944, 3328]
    - [94, 9287.0]
  - - [128, 1408, 1, 1280, 128, 128, 128, 1280]
    - [67, 8094.0]
  - - [128, 1856, 1, 3328, 128, 128, 128, 3328]
    - [83, 9913.0]
  - - [1760, 64, 1, 1760, 1760, 1760, 1760, 1760]
    - [70, 6734.0]
  - - [1760, 32, 1, 1760, 1760, 1760, 1760, 1760]
    - [110, 5273.0]
  - - [2560, 16, 1, 2560, 2560, 2560, 2560, 2560]
    - [122, 4702.0]
  - - [1760, 16, 1, 1760, 1760, 1760, 1760, 1760]
    - [122, 3157.0]
  - - [8448, 4, 1, 2816, 8448, 8448, 8448, 2816]
    - [124, 3008.0]
  - - [7680, 16, 1, 2560, 7680, 7680, 7680, 2560]
    - [121, 7544.0]
  - - [4608, 1, 1, 1536, 4608, 4608, 4608, 1536]
    - [113, 423.0]
  - - [7680, 4, 1, 2560, 7680, 7680, 7680, 2560]
    - [122, 2845.0]
  - - [8448, 16, 1, 2816, 8448, 8448, 8448, 2816]
    - [118, 7120.0]
  - - [3072, 2, 1, 1024, 3072, 3072, 3072, 1024]
    - [116, 509.0]
  - - [6144, 16, 1, 2560, 6144, 6144, 6144, 2560]
    - [119, 7149.0]
  - - [7680, 1, 1, 2560, 7680, 7680, 7680, 2560]
    - [122, 711.0]
  - - [4608, 4, 1, 1536, 4608, 4608, 4608, 1536]
    - [123, 1685.0]
  - - [3072, 1, 1, 128, 3072, 3072, 3072, 128]
    - [112, 71.0]
  - - [2048, 32, 1, 2048, 2048, 2048, 2048, 2048]
    - [111, 5284.0]
  - - [2048, 16, 1, 2048, 2048, 2048, 2048, 2048]
    - [116, 3283.0]
  - - [8448, 1, 1, 2816, 8448, 8448, 8448, 2816]
    - [114, 753.0]
  - - [6144, 4, 1, 2560, 6144, 6144, 6144, 2560]
    - [120, 2521.0]
  - - [3072, 1, 1, 1024, 3072, 3072, 3072, 1024]
    - [116, 252.0]
  - - [3072, 16, 1, 1024, 3072, 3072, 3072, 1024]
    - [122, 3784.0]
  - - [4096, 16, 1, 4096, 4096, 4096, 4096, 4096]
    - [109, 5780.0]
  - - [6144, 1, 1, 2560, 6144, 6144, 6144, 2560]
    - [122, 648.0]
  - - [3072, 4, 1, 1024, 3072, 3072, 3072, 1024]
    - [123, 1002.0]
  - - [7680, 2, 1, 2560, 7680, 7680, 7680, 2560]
    - [117, 1330.0]
  - - [4224, 1, 1, 128, 4224, 4224, 4224, 128]
    - [112, 100.0]
  - - [8448, 2, 1, 2816, 8448, 8448, 8448, 2816]
    - [114, 1504.0]
  - - [4608, 2, 1, 1536, 4608, 4608, 4608, 1536]
    - [122, 838.0]
  - - [4608, 16, 1, 1536, 4608, 4608, 4608, 1536]
    - [115, 5362.0]
  - - [6144, 2, 1, 2560, 6144, 6144, 6144, 2560]
    - [123, 1270.0]
  - - [1024, 1, 1, 500000, 1024, 1024, 1024, 500000]
    - [87, 136.0]
  - - [1024, 16, 1, 500000, 1024, 1024, 1024, 500000]
    - [73, 2167.0]
  - - [1024, 2, 1, 500000, 1024, 1024, 1024, 500000]
    - [73, 271.0]
  - - [512, 1, 1, 500000, 512, 512, 512, 500000]
    - [73, 73.0]
  - - [1024, 8, 1, 500000, 1024, 1024, 1024, 500000]
    - [73, 1085.0]
  - - [1024, 4, 1, 500000, 1024, 1024, 1024, 500000]
    - [73, 543.0]
  - - [512, 16, 1, 500000, 512, 512, 512, 500000]
    - [73, 1107.0]
  - - [512, 2, 1, 500000, 512, 512, 512, 500000]
    - [87, 147.0]
  - - [512, 8, 1, 500000, 512, 512, 512, 500000]
    - [99, 586.0]
  - - [512, 4, 1, 500000, 512, 512, 512, 500000]
    - [73, 293.0]
  - - [512, 4, 1, 512, 512, 512, 512, 512]
    - [77, 180.0]
  - - [448, 64, 1, 1280, 448, 448, 448, 1280]
    - [78, 2936.0]
  - - [64, 1024, 1, 1280, 64, 64, 64, 1280]
    - [84, 4280.0]
  - - [64, 704, 1, 1280, 64, 64, 64, 1280]
    - [69, 3740.0]
  - - [256, 128, 1, 256, 256, 256, 256, 256]
    - [95, 1357.0]
  - - [64, 1024, 1, 3328, 64, 64, 64, 3328]
    - [70, 4977.0]
  - - [128, 1, 1, 1408, 128, 128, 128, 1408]
    - [72, 12.0]
  - - [1024, 64, 1, 1280, 1024, 1024, 1024, 1280]
    - [69, 4284.0]
  - - [256, 256, 1, 3328, 256, 256, 256, 3328]
    - [70, 5049.0]
  - - [64, 448, 1, 1280, 64, 64, 64, 1280]
    - [90, 2552.0]
  - - [512, 32, 1, 512, 512, 512, 512, 512]
    - [104, 1407.0]
  - - [64, 64, 1, 3328, 64, 64, 64, 3328]
    - [86, 535.0]
  - - [512, 1, 1, 512, 512, 512, 512, 512]
    - [77, 45.0]
  - - [512, 2, 1, 512, 512, 512, 512, 512]
    - [69, 87.0]
  - - [704, 64, 1, 3328, 704, 704, 704, 3328]
    - [95, 4382.0]
  - - [64, 128, 1, 256, 64, 64, 64, 256]
    - [78, 570.0]
  - - [704, 64, 1, 1280, 704, 704, 704, 1280]
    - [95, 3678.0]
  - - [128, 448, 1, 256, 128, 128, 128, 256]
    - [97, 3097.0]
  - - [448, 64, 1, 3328, 448, 448, 448, 3328]
    - [73, 3168.0]
  - - [64, 128, 1, 3328, 64, 64, 64, 3328]
    - [73, 973.0]
  - - [128, 128, 1, 3328, 128, 128, 128, 3328]
    - [73, 1837.0]
  - - [64, 1, 1, 1216, 64, 64, 64, 1216]
    - [72, 6.0]
  - - [256, 256, 1, 256, 256, 256, 256, 256]
    - [95, 2482.0]
  - - [128, 64, 1, 1280, 128, 128, 128, 1280]
    - [73, 761.0]
  - - [64, 1024, 1, 256, 64, 64, 64, 256]
    - [90, 2390.0]
  - - [64, 704, 1, 256, 64, 64, 64, 256]
    - [69, 1775.0]
  - - [1024, 2, 1, 512, 1024, 1024, 1024, 512]
    - [89, 123.0]
  - - [256, 64, 1, 3328, 256, 256, 256, 3328]
    - [73, 1822.0]
  - - [448, 128, 1, 256, 448, 448, 448, 256]
    - [84, 2178.0]
  - - [64, 704, 1, 3328, 64, 64, 64, 3328]
    - [95, 4351.0]
  - - [64, 448, 1, 3328, 64, 64, 64, 3328]
    - [90, 3029.0]
  - - [448, 128, 1, 3328, 448, 448, 448, 3328]
    - [69, 4863.0]
  - - [128, 256, 1, 1280, 128, 128, 128, 1280]
    - [84, 2857.0]
  - - [64, 448, 1, 256, 64, 64, 64, 256]
    - [97, 1188.0]
  - - [64, 256, 1, 1280, 64, 64, 64, 1280]
    - [73, 1485.0]
  - - [64, 128, 1, 1280, 64, 64, 64, 1280]
    - [99, 771.0]
  - - [1024, 32, 1, 512, 1024, 1024, 1024, 512]
    - [69, 1924.0]
  - - [64, 64, 1, 256, 64, 64, 64, 256]
    - [104, 172.0]
  - - [256, 128, 1, 1280, 256, 256, 256, 1280]
    - [95, 2789.0]
  - - [128, 256, 1, 3328, 128, 128, 128, 3328]
    - [78, 3383.0]
  - - [256, 64, 1, 256, 256, 256, 256, 256]
    - [90, 679.0]
  - - [128, 128, 1, 1280, 128, 128, 128, 1280]
    - [73, 1477.0]
  - - [128, 256, 1, 256, 128, 128, 128, 256]
    - [106, 1357.0]
  - - [256, 64, 1, 1280, 256, 256, 256, 1280]
    - [73, 1475.0]
  - - [704, 64, 1, 256, 704, 704, 704, 256]
    - [95, 1786.0]
  - - [128, 448, 1, 1280, 128, 128, 128, 1280]
    - [84, 4199.0]
  - - [64, 64, 1, 1280, 64, 64, 64, 1280]
    - [107, 383.0]
  - - [128, 64, 1, 3328, 128, 128, 128, 3328]
    - [73, 972.0]
  - - [448, 64, 1, 256, 448, 448, 448, 256]
    - [81, 1510.0]
  - - [1024, 16, 1, 512, 1024, 1024, 1024, 512]
    - [73, 1021.0]
  - - [512, 16, 1, 512, 512, 512, 512, 512]
    - [73, 514.0]
  - - [1024, 64, 1, 256, 1024, 1024, 1024, 256]
    - [78, 2370.0]
  - - [128, 1, 1, 1024, 128, 128, 128, 1024]
    - [89, 13.0]
  - - [448, 128, 1, 1280, 448, 448, 448, 1280]
    - [95, 4223.0]
  - - [1024, 64, 1, 3328, 1024, 1024, 1024, 3328]
    - [95, 4862.0]
  - - [128, 64, 1, 256, 128, 128, 128, 256]
    - [104, 343.0]
  - - [64, 256, 1, 3328, 64, 64, 64, 3328]
    - [90, 1928.0]
  - - [256, 256, 1, 1280, 256, 256, 256, 1280]
    - [84, 4258.0]
  - - [256, 128, 1, 3328, 256, 256, 256, 3328]
    - [84, 3366.0]
  - - [64, 256, 1, 256, 64, 64, 64, 256]
    - [100, 685.0]
  - - [1024, 4, 1, 512, 1024, 1024, 1024, 512]
    - [77, 245.0]
  - - [128, 448, 1, 3328, 128, 128, 128, 3328]
    - [95, 4866.0]
  - - [1024, 1, 1, 512, 1024, 1024, 1024, 512]
    - [103, 62.0]
  - - [128, 128, 1, 256, 128, 128, 128, 256]
    - [92, 777.0]
- null
- null
- DeviceEfficiency
...
