library/src/blas3/Tensile/Logic/asm_full/navi21_Cijk_Ailk_Bljk_I8II_BH.yaml
---
- {MinimumRequiredVersion: 4.27.0}
- navi21
- gfx1030
    SolutionIndex: 0
    SolutionNameMin: Cijk_Ailk_Bljk_I8II_BH_MT64x64x8_SN_EPS1_GRVW4_LRVW4_SU0_SUM0_SUS128_TT8_8_VW4_WG8_8_1_WGM1
    SolutionIndex: 1
    SolutionNameMin: Cijk_Ailk_Bljk_I8II_BH_MT64x32x8_SN_EPS1_GRVW4_LRVW4_SU0_SUM0_SUS256_TT8_4_VW4_WG8_8_1_WGM1
    SolutionIndex: 2
    SolutionNameMin: Cijk_Ailk_Bljk_I8II_BH_MT32x32x16_SN_EPS1_GRVW4_LRVW4_SU32_SUM0_SUS128_TT4_4_VW4_WG8_8_1_WGM1
    SolutionIndex: 3
    SolutionNameMin: Cijk_Ailk_Bljk_I8II_BH_MT64x64x8_SN_EPS1_GRVW4_LRVW4_SU32_SUM3_SUS128_TT8_8_VW4_WG8_8_1_WGM1
    SolutionIndex: 4
    SolutionNameMin: Cijk_Ailk_Bljk_I8II_BH_MT32x32x16_SN_EPS1_GRVW4_LRVW4_SU32_SUM3_SUS128_TT4_4_VW4_WG8_8_1_WGM1
    SolutionIndex: 5
    SolutionNameMin: Cijk_Ailk_Bljk_I8II_BH_MT64x64x16_SN_EPS1_GRVW4_LRVW4_SU0_SUM0_SUS128_TT4_4_VW4_WG16_16_1_WGM4
    SolutionIndex: 6
    SolutionNameMin: Cijk_Ailk_Bljk_I8II_BH_MT128x64x16_SN_EPS1_GRVW4_LRVW4_SU0_SUM0_SUS256_TT8_4_VW4_WG16_16_1_WGM4
    SolutionIndex: 7
    SolutionNameMin: Cijk_Ailk_Bljk_I8II_BH_MT32x32x8_SN_EPS1_GRVW4_LRVW4_SU0_SUM0_SUS256_TT4_4_VW4_WG8_8_1_WGM8
    SolutionIndex: 8
    SolutionNameMin: Cijk_Ailk_Bljk_I8II_BH_MT64x64x16_SN_EPS1_GRVW8_LRVW8_SU32_SUM0_SUS256_TT8_8_VW8_WG8_8_1_WGM8
    SolutionIndex: 9
    SolutionNameMin: Cijk_Ailk_Bljk_I8II_BH_MT32x32x8_SN_EPS0_GRVW4_LRVW4_SU0_SUM0_SUS128_TT4_4_VW4_WG8_8_1_WGM1
    SolutionIndex: 10
    SolutionNameMin: Cijk_Ailk_Bljk_I8II_BH_MT64x32x8_SN_EPS0_GRVW4_LRVW4_SU0_SUM0_SUS128_TT8_4_VW4_WG8_8_1_WGM1
    SolutionIndex: 11
    SolutionNameMin: Cijk_Ailk_Bljk_I8II_BH_MT32x64x16_SN_EPS0_GRVW4_LRVW4_SU0_SUM0_SUS128_TT4_4_VW4_WG8_16_1_WGM1
    SolutionIndex: 12
    SolutionNameMin: Cijk_Ailk_Bljk_I8II_BH_MT32x32x16_SN_EPS0_GRVW4_LRVW4_SU0_SUM0_SUS128_TT4_4_VW4_WG8_8_1_WGM1
    SolutionIndex: 13
    SolutionNameMin: Cijk_Ailk_Bljk_I8II_BH_MT64x32x16_SN_EPS0_GRVW4_LRVW4_SU0_SUM0_SUS128_TT8_4_VW4_WG8_8_1_WGM1
    SolutionIndex: 14
    SolutionNameMin: Cijk_Ailk_Bljk_I8II_BH_MT64x64x16_SN_EPS0_GRVW4_LRVW4_SU0_SUM0_SUS128_TT4_4_VW4_WG16_16_1_WGM1
    SolutionIndex: 15
    SolutionNameMin: Cijk_Ailk_Bljk_I8II_BH_MT32x32x32_SN_EPS0_GRVW4_LRVW4_SU0_SUM0_SUS128_TT4_4_VW4_WG8_8_1_WGM1
    SolutionIndex: 16
    SolutionNameMin: Cijk_Ailk_Bljk_I8II_BH_MT64x64x16_SN_EPS0_GRVW8_LRVW8_SU0_SUM0_SUS128_TT8_8_VW8_WG8_8_1_WGM1
    SolutionIndex: 17
    SolutionNameMin: Cijk_Ailk_Bljk_I8II_BH_MT64x64x8_SN_EPS0_GRVW4_LRVW4_SU0_SUM0_SUS256_TT8_8_VW4_WG8_8_1_WGM1
    SolutionIndex: 18
    SolutionNameMin: Cijk_Ailk_Bljk_I8II_BH_MT32x32x16_SN_EPS0_GRVW4_LRVW4_SU0_SUM0_SUS256_TT4_4_VW4_WG8_8_1_WGM1
    SolutionIndex: 19
    SolutionNameMin: Cijk_Ailk_Bljk_I8II_BH_MT64x32x16_SN_EPS0_GRVW4_LRVW4_SU0_SUM0_SUS256_TT8_4_VW4_WG8_8_1_WGM1
    SolutionIndex: 20
    SolutionNameMin: Cijk_Ailk_Bljk_I8II_BH_MT32x32x32_SN_EPS0_GRVW4_LRVW4_SU0_SUM0_SUS256_TT4_4_VW4_WG8_8_1_WGM1
    SolutionIndex: 21
    SolutionNameMin: Cijk_Ailk_Bljk_I8II_BH_MT128x64x16_SN_EPS0_GRVW8_LRVW8_SU0_SUM0_SUS256_TT16_8_VW8_WG8_8_1_WGM1
    SolutionIndex: 22
    SolutionNameMin: Cijk_Ailk_Bljk_I8II_BH_MT32x32x16_SN_EPS0_GRVW4_LRVW4_SU32_SUM0_SUS128_TT4_4_VW4_WG8_8_1_WGM1
    SolutionIndex: 23
    SolutionNameMin: Cijk_Ailk_Bljk_I8II_BH_MT32x32x32_SN_EPS0_GRVW4_LRVW4_SU32_SUM0_SUS128_TT4_4_VW4_WG8_8_1_WGM1
    SolutionIndex: 24
    SolutionNameMin: Cijk_Ailk_Bljk_I8II_BH_MT64x64x8_SN_EPS0_GRVW8_LRVW8_SU32_SUM0_SUS128_TT8_8_VW8_WG8_8_1_WGM1
    SolutionIndex: 25
    SolutionNameMin: Cijk_Ailk_Bljk_I8II_BH_MT128x64x16_SN_EPS0_GRVW8_LRVW8_SU32_SUM0_SUS128_TT16_8_VW8_WG8_8_1_WGM1
    SolutionIndex: 26
    SolutionNameMin: Cijk_Ailk_Bljk_I8II_BH_MT32x32x16_SN_EPS0_GRVW4_LRVW4_SU32_SUM3_SUS128_TT4_4_VW4_WG8_8_1_WGM1
    SolutionIndex: 27
    SolutionNameMin: Cijk_Ailk_Bljk_I8II_BH_MT32x32x32_SN_EPS0_GRVW4_LRVW4_SU32_SUM3_SUS128_TT4_4_VW4_WG8_8_1_WGM1
    SolutionIndex: 28
    SolutionNameMin: Cijk_Ailk_Bljk_I8II_BH_MT64x32x8_SN_EPS0_GRVW4_LRVW4_SU32_SUM0_SUS256_TT8_4_VW4_WG8_8_1_WGM1
    SolutionIndex: 29
    SolutionNameMin: Cijk_Ailk_Bljk_I8II_BH_MT32x32x32_SN_EPS0_GRVW4_LRVW4_SU32_SUM0_SUS256_TT4_4_VW4_WG8_8_1_WGM1
    SolutionIndex: 30
    SolutionNameMin: Cijk_Ailk_Bljk_I8II_BH_MT64x32x16_SN_EPS0_GRVW4_LRVW4_SU32_SUM3_SUS256_TT8_4_VW4_WG8_8_1_WGM1
    SolutionIndex: 31
    SolutionNameMin: Cijk_Ailk_Bljk_I8II_BH_MT32x32x32_SN_EPS0_GRVW4_LRVW4_SU32_SUM3_SUS256_TT4_4_VW4_WG8_8_1_WGM1
    SolutionIndex: 32
    SolutionNameMin: Cijk_Ailk_Bljk_I8II_BH_MT128x64x16_SN_EPS0_GRVW8_LRVW8_SU32_SUM3_SUS256_TT16_8_VW8_WG8_8_1_WGM1
    SolutionIndex: 33
    SolutionNameMin: Cijk_Ailk_Bljk_I8II_BH_MT64x64x16_SN_EPS0_GRVW4_LRVW4_SU0_SUM0_SUS128_TT4_4_VW4_WG16_16_1_WGM4
    SolutionIndex: 34
    SolutionNameMin: Cijk_Ailk_Bljk_I8II_BH_MT256x128x8_SN_EPS0_GRVW8_LRVW8_SU0_SUM0_SUS128_TT16_8_VW8_WG16_16_1_WGM4
    SolutionIndex: 35
    SolutionNameMin: Cijk_Ailk_Bljk_I8II_BH_MT64x64x16_SN_EPS0_GRVW4_LRVW4_SU0_SUM0_SUS256_TT4_4_VW4_WG16_16_1_WGM4
    SolutionIndex: 36
    SolutionNameMin: Cijk_Ailk_Bljk_I8II_BH_MT32x32x32_SN_EPS0_GRVW4_LRVW4_SU0_SUM0_SUS256_TT4_4_VW4_WG8_8_1_WGM4
    SolutionIndex: 37
    SolutionNameMin: Cijk_Ailk_Bljk_I8II_BH_MT32x32x16_SN_EPS0_GRVW4_LRVW4_SU32_SUM3_SUS128_TT4_4_VW4_WG8_8_1_WGM4
    SolutionIndex: 38
    SolutionNameMin: Cijk_Ailk_Bljk_I8II_BH_MT64x32x16_SN_EPS0_GRVW4_LRVW4_SU32_SUM3_SUS128_TT8_4_VW4_WG8_8_1_WGM4
    SolutionIndex: 39
    SolutionNameMin: Cijk_Ailk_Bljk_I8II_BH_MT32x32x32_SN_EPS0_GRVW4_LRVW4_SU32_SUM3_SUS128_TT4_4_VW4_WG8_8_1_WGM4
    SolutionIndex: 40
    SolutionNameMin: Cijk_Ailk_Bljk_I8II_BH_MT64x32x16_SN_EPS0_GRVW4_LRVW4_SU32_SUM3_SUS256_TT8_4_VW4_WG8_8_1_WGM4
    SolutionIndex: 41
    SolutionNameMin: Cijk_Ailk_Bljk_I8II_BH_MT32x32x32_SN_EPS0_GRVW4_LRVW4_SU32_SUM3_SUS256_TT4_4_VW4_WG8_8_1_WGM4
    SolutionIndex: 42
    SolutionNameMin: Cijk_Ailk_Bljk_I8II_BH_MT32x32x16_SN_EPS0_GRVW4_LRVW4_SU0_SUM0_SUS128_TT4_4_VW4_WG8_8_1_WGM8
    SolutionIndex: 43
    SolutionNameMin: Cijk_Ailk_Bljk_I8II_BH_MT32x32x16_SN_EPS0_GRVW4_LRVW4_SU0_SUM0_SUS256_TT4_4_VW4_WG8_8_1_WGM8
    SolutionIndex: 44
    SolutionNameMin: Cijk_Ailk_Bljk_I8II_BH_MT64x64x16_SN_EPS0_GRVW8_LRVW8_SU0_SUM0_SUS256_TT8_8_VW8_WG8_8_1_WGM8
    SolutionIndex: 45
    SolutionNameMin: Cijk_Ailk_Bljk_I8II_BH_MT32x32x16_SN_EPS0_GRVW4_LRVW4_SU32_SUM0_SUS128_TT4_4_VW4_WG8_8_1_WGM8
    SolutionIndex: 46
    SolutionNameMin: Cijk_Ailk_Bljk_I8II_BH_MT64x64x16_SN_EPS0_GRVW8_LRVW8_SU32_SUM0_SUS128_TT8_8_VW8_WG8_8_1_WGM8
    SolutionIndex: 47
    SolutionNameMin: Cijk_Ailk_Bljk_I8II_BH_MT32x32x32_SN_EPS0_GRVW4_LRVW4_SU32_SUM3_SUS128_TT4_4_VW4_WG8_8_1_WGM8
    SolutionIndex: 48
    SolutionNameMin: Cijk_Ailk_Bljk_I8II_BH_MT32x32x16_SN_EPS0_GRVW4_LRVW4_SU32_SUM0_SUS256_TT4_4_VW4_WG8_8_1_WGM8
    SolutionIndex: 49
    SolutionNameMin: Cijk_Ailk_Bljk_I8II_BH_MT32x32x32_SN_EPS0_GRVW4_LRVW4_SU32_SUM0_SUS256_TT4_4_VW4_WG8_8_1_WGM8
    SolutionIndex: 50
    SolutionNameMin: Cijk_Ailk_Bljk_I8II_BH_MT64x32x16_SN_EPS0_GRVW4_LRVW4_SU32_SUM3_SUS256_TT8_4_VW4_WG8_8_1_WGM8
- - - [768, 1024, 1, 1024, 768, 768, 768, 1024]
    - [32, 24522.0]
  - - [1536, 2048, 1, 2048, 1536, 1536, 1536, 2048]
    - [34, 33702.0]
  - - [32, 32, 1, 32, 32, 32, 32, 32]
    - [9, 20.0]
  - - [32, 32, 1, 64, 32, 32, 32, 64]
    - [12, 33.0]
  - - [32, 32, 1, 128, 32, 32, 32, 128]
    - [20, 48.0]
  - - [32, 32, 1, 256, 32, 32, 32, 256]
    - [20, 70.0]
  - - [32, 32, 1, 512, 32, 32, 32, 512]
    - [23, 93.0]
  - - [32, 32, 1, 1024, 32, 32, 32, 1024]
    - [23, 109.0]
  - - [32, 64, 1, 32, 32, 32, 32, 32]
    - [11, 39.0]
  - - [32, 64, 1, 64, 32, 32, 32, 64]
    - [12, 65.0]
  - - [32, 64, 1, 128, 32, 32, 32, 128]
    - [12, 96.0]
  - - [32, 64, 1, 256, 32, 32, 32, 256]
    - [27, 144.0]
  - - [32, 64, 1, 512, 32, 32, 32, 512]
    - [27, 193.0]
  - - [32, 64, 1, 1024, 32, 32, 32, 1024]
    - [31, 225.0]
  - - [32, 128, 1, 32, 32, 32, 32, 32]
    - [12, 78.0]
  - - [32, 128, 1, 64, 32, 32, 32, 64]
    - [12, 130.0]
  - - [32, 128, 1, 128, 32, 32, 32, 128]
    - [15, 191.0]
  - - [32, 128, 1, 256, 32, 32, 32, 256]
    - [27, 291.0]
  - - [32, 128, 1, 512, 32, 32, 32, 512]
    - [27, 394.0]
  - - [32, 128, 1, 1024, 32, 32, 32, 1024]
    - [31, 472.0]
  - - [32, 256, 1, 32, 32, 32, 32, 32]
    - [12, 158.0]
  - - [32, 256, 1, 64, 32, 32, 32, 64]
    - [12, 262.0]
  - - [32, 256, 1, 128, 32, 32, 32, 128]
    - [20, 388.0]
  - - [32, 256, 1, 256, 32, 32, 32, 256]
    - [27, 583.0]
  - - [32, 256, 1, 512, 32, 32, 32, 512]
    - [27, 794.0]
  - - [32, 256, 1, 1024, 32, 32, 32, 1024]
    - [39, 951.0]
  - - [32, 512, 1, 32, 32, 32, 32, 32]
    - [12, 316.0]
  - - [32, 512, 1, 64, 32, 32, 32, 64]
    - [12, 524.0]
  - - [32, 512, 1, 128, 32, 32, 32, 128]
    - [12, 777.0]
  - - [32, 512, 1, 256, 32, 32, 32, 256]
    - [27, 1172.0]
  - - [32, 512, 1, 512, 32, 32, 32, 512]
    - [27, 1583.0]
  - - [32, 512, 1, 1024, 32, 32, 32, 1024]
    - [27, 1885.0]
  - - [32, 1024, 1, 32, 32, 32, 32, 32]
    - [12, 632.0]
  - - [32, 1024, 1, 64, 32, 32, 32, 64]
    - [12, 1038.0]
  - - [32, 1024, 1, 128, 32, 32, 32, 128]
    - [20, 1565.0]
  - - [32, 1024, 1, 256, 32, 32, 32, 256]
    - [27, 2317.0]
  - - [32, 1024, 1, 512, 32, 32, 32, 512]
    - [27, 3007.0]
  - - [32, 1024, 1, 1024, 32, 32, 32, 1024]
    - [27, 3466.0]
  - - [64, 32, 1, 32, 64, 64, 64, 32]
    - [12, 39.0]
  - - [64, 32, 1, 64, 64, 64, 64, 64]
    - [12, 66.0]
  - - [64, 32, 1, 128, 64, 64, 64, 128]
    - [12, 96.0]
  - - [64, 32, 1, 256, 64, 64, 64, 256]
    - [23, 146.0]
  - - [64, 32, 1, 512, 64, 64, 64, 512]
    - [29, 194.0]
  - - [64, 32, 1, 1024, 64, 64, 64, 1024]
    - [29, 224.0]
  - - [64, 64, 1, 32, 64, 64, 64, 32]
    - [14, 77.0]
  - - [64, 64, 1, 64, 64, 64, 64, 64]
    - [12, 129.0]
  - - [64, 64, 1, 128, 64, 64, 64, 128]
    - [29, 193.0]
  - - [64, 64, 1, 256, 64, 64, 64, 256]
    - [23, 291.0]
  - - [64, 64, 1, 512, 64, 64, 64, 512]
    - [27, 399.0]
  - - [64, 64, 1, 1024, 64, 64, 64, 1024]
    - [41, 474.0]
  - - [64, 128, 1, 32, 64, 64, 64, 32]
    - [12, 156.0]
  - - [64, 128, 1, 64, 64, 64, 64, 64]
    - [12, 257.0]
  - - [64, 128, 1, 128, 64, 64, 64, 128]
    - [12, 386.0]
  - - [64, 128, 1, 256, 64, 64, 64, 256]
    - [23, 586.0]
  - - [64, 128, 1, 512, 64, 64, 64, 512]
    - [27, 788.0]
  - - [64, 128, 1, 1024, 64, 64, 64, 1024]
    - [27, 971.0]
  - - [64, 256, 1, 32, 64, 64, 64, 32]
    - [12, 312.0]
  - - [64, 256, 1, 64, 64, 64, 64, 64]
    - [12, 519.0]
  - - [64, 256, 1, 128, 64, 64, 64, 128]
    - [27, 771.0]
  - - [64, 256, 1, 256, 64, 64, 64, 256]
    - [27, 1178.0]
  - - [64, 256, 1, 512, 64, 64, 64, 512]
    - [27, 1583.0]
  - - [64, 256, 1, 1024, 64, 64, 64, 1024]
    - [27, 1885.0]
  - - [64, 512, 1, 32, 64, 64, 64, 32]
    - [12, 617.0]
  - - [64, 512, 1, 64, 64, 64, 64, 64]
    - [12, 1028.0]
  - - [64, 512, 1, 128, 64, 64, 64, 128]
    - [15, 1531.0]
  - - [64, 512, 1, 256, 64, 64, 64, 256]
    - [27, 2330.0]
  - - [64, 512, 1, 512, 64, 64, 64, 512]
    - [31, 2996.0]
  - - [64, 512, 1, 1024, 64, 64, 64, 1024]
    - [31, 3438.0]
  - - [64, 1024, 1, 32, 64, 64, 64, 32]
    - [12, 1192.0]
  - - [64, 1024, 1, 64, 64, 64, 64, 64]
    - [12, 1997.0]
  - - [64, 1024, 1, 128, 64, 64, 64, 128]
    - [27, 2975.0]
  - - [64, 1024, 1, 256, 64, 64, 64, 256]
    - [22, 4324.0]
  - - [64, 1024, 1, 512, 64, 64, 64, 512]
    - [4, 5377.0]
  - - [64, 1024, 1, 1024, 64, 64, 64, 1024]
    - [26, 5825.0]
  - - [128, 32, 1, 32, 128, 128, 128, 32]
    - [12, 79.0]
  - - [128, 32, 1, 64, 128, 128, 128, 64]
    - [12, 130.0]
  - - [128, 32, 1, 128, 128, 128, 128, 128]
    - [12, 190.0]
  - - [128, 32, 1, 256, 128, 128, 128, 256]
    - [27, 293.0]
  - - [128, 32, 1, 512, 128, 128, 128, 512]
    - [23, 399.0]
  - - [128, 32, 1, 1024, 128, 128, 128, 1024]
    - [31, 476.0]
  - - [128, 64, 1, 32, 128, 128, 128, 32]
    - [12, 156.0]
  - - [128, 64, 1, 64, 128, 128, 128, 64]
    - [18, 257.0]
  - - [128, 64, 1, 128, 128, 128, 128, 128]
    - [20, 386.0]
  - - [128, 64, 1, 256, 128, 128, 128, 256]
    - [23, 586.0]
  - - [128, 64, 1, 512, 128, 128, 128, 512]
    - [27, 800.0]
  - - [128, 64, 1, 1024, 128, 128, 128, 1024]
    - [47, 951.0]
  - - [128, 128, 1, 32, 128, 128, 128, 32]
    - [12, 312.0]
  - - [128, 128, 1, 64, 128, 128, 128, 64]
    - [12, 514.0]
  - - [128, 128, 1, 128, 128, 128, 128, 128]
    - [20, 765.0]
  - - [128, 128, 1, 256, 128, 128, 128, 256]
    - [23, 1165.0]
  - - [128, 128, 1, 512, 128, 128, 128, 512]
    - [23, 1583.0]
  - - [128, 128, 1, 1024, 128, 128, 128, 1024]
    - [27, 1885.0]
  - - [128, 256, 1, 32, 128, 128, 128, 32]
    - [12, 617.0]
  - - [128, 256, 1, 64, 128, 128, 128, 64]
    - [12, 1018.0]
  - - [128, 256, 1, 128, 128, 128, 128, 128]
    - [20, 1520.0]
  - - [128, 256, 1, 256, 128, 128, 128, 256]
    - [27, 2292.0]
  - - [128, 256, 1, 512, 128, 128, 128, 512]
    - [27, 2954.0]
  - - [128, 256, 1, 1024, 128, 128, 128, 1024]
    - [41, 3410.0]
  - - [128, 512, 1, 32, 128, 128, 128, 32]
    - [12, 1178.0]
  - - [128, 512, 1, 64, 128, 128, 128, 64]
    - [12, 1960.0]
  - - [128, 512, 1, 128, 128, 128, 128, 128]
    - [27, 2975.0]
  - - [128, 512, 1, 256, 128, 128, 128, 256]
    - [22, 4280.0]
  - - [128, 512, 1, 512, 128, 128, 128, 512]
    - [22, 5483.0]
  - - [128, 512, 1, 1024, 128, 128, 128, 1024]
    - [4, 5825.0]
  - - [128, 1024, 1, 32, 128, 128, 128, 32]
    - [33, 2231.0]
  - - [128, 1024, 1, 64, 128, 128, 128, 64]
    - [12, 3679.0]
  - - [128, 1024, 1, 128, 128, 128, 128, 128]
    - [12, 5483.0]
  - - [128, 1024, 1, 256, 128, 128, 128, 256]
    - [45, 7294.0]
  - - [128, 1024, 1, 512, 128, 128, 128, 512]
    - [12, 8715.0]
  - - [128, 1024, 1, 1024, 128, 128, 128, 1024]
    - [18, 9479.0]
  - - [256, 32, 1, 32, 256, 256, 256, 32]
    - [12, 156.0]
  - - [256, 32, 1, 64, 256, 256, 256, 64]
    - [12, 257.0]
  - - [256, 32, 1, 128, 256, 256, 256, 128]
    - [20, 383.0]
  - - [256, 32, 1, 256, 256, 256, 256, 256]
    - [27, 589.0]
  - - [256, 32, 1, 512, 256, 256, 256, 512]
    - [23, 800.0]
  - - [256, 32, 1, 1024, 256, 256, 256, 1024]
    - [31, 945.0]
  - - [256, 64, 1, 32, 256, 256, 256, 32]
    - [12, 308.0]
  - - [256, 64, 1, 64, 256, 256, 256, 64]
    - [12, 514.0]
  - - [256, 64, 1, 128, 256, 256, 256, 128]
    - [29, 771.0]
  - - [256, 64, 1, 256, 256, 256, 256, 256]
    - [23, 1178.0]
  - - [256, 64, 1, 512, 256, 256, 256, 512]
    - [23, 1583.0]
  - - [256, 64, 1, 1024, 256, 256, 256, 1024]
    - [29, 1864.0]
  - - [256, 128, 1, 32, 256, 256, 256, 32]
    - [12, 610.0]
  - - [256, 128, 1, 64, 256, 256, 256, 64]
    - [12, 1018.0]
  - - [256, 128, 1, 128, 256, 256, 256, 128]
    - [27, 1531.0]
  - - [256, 128, 1, 256, 256, 256, 256, 256]
    - [23, 2267.0]
  - - [256, 128, 1, 512, 256, 256, 256, 512]
    - [49, 2933.0]
  - - [256, 128, 1, 1024, 256, 256, 256, 1024]
    - [41, 3488.0]
  - - [256, 256, 1, 32, 256, 256, 256, 32]
    - [35, 1192.0]
  - - [256, 256, 1, 64, 256, 256, 256, 64]
    - [12, 1960.0]
  - - [256, 256, 1, 128, 256, 256, 256, 128]
    - [20, 2954.0]
  - - [256, 256, 1, 256, 256, 256, 256, 256]
    - [22, 4237.0]
  - - [256, 256, 1, 512, 256, 256, 256, 512]
    - [2, 5483.0]
  - - [256, 256, 1, 1024, 256, 256, 256, 1024]
    - [20, 5726.0]
  - - [256, 512, 1, 32, 256, 256, 256, 32]
    - [35, 2185.0]
  - - [256, 512, 1, 64, 256, 256, 256, 64]
    - [12, 3616.0]
  - - [256, 512, 1, 128, 256, 256, 256, 128]
    - [12, 5447.0]
  - - [256, 512, 1, 256, 256, 256, 256, 256]
    - [45, 7326.0]
  - - [256, 512, 1, 512, 256, 256, 256, 512]
    - [45, 8626.0]
  - - [256, 512, 1, 1024, 256, 256, 256, 1024]
    - [12, 9452.0]
  - - [256, 1024, 1, 32, 256, 256, 256, 32]
    - [33, 3957.0]
  - - [256, 1024, 1, 64, 256, 256, 256, 64]
    - [5, 5949.0]
  - - [256, 1024, 1, 128, 256, 256, 256, 128]
    - [13, 8604.0]
  - - [256, 1024, 1, 256, 256, 256, 256, 256]
    - [13, 11148.0]
  - - [256, 1024, 1, 512, 256, 256, 256, 512]
    - [30, 12807.0]
  - - [256, 1024, 1, 1024, 256, 256, 256, 1024]
    - [40, 13923.0]
  - - [512, 32, 1, 32, 512, 512, 512, 32]
    - [12, 312.0]
  - - [512, 32, 1, 64, 512, 512, 512, 64]
    - [12, 519.0]
  - - [512, 32, 1, 128, 512, 512, 512, 128]
    - [12, 765.0]
  - - [512, 32, 1, 256, 512, 512, 512, 256]
    - [23, 1172.0]
  - - [512, 32, 1, 512, 512, 512, 512, 512]
    - [23, 1589.0]
  - - [512, 32, 1, 1024, 512, 512, 512, 1024]
    - [31, 1856.0]
  - - [512, 64, 1, 32, 512, 512, 512, 32]
    - [12, 624.0]
  - - [512, 64, 1, 64, 512, 512, 512, 64]
    - [12, 1038.0]
  - - [512, 64, 1, 128, 512, 512, 512, 128]
    - [12, 1531.0]
  - - [512, 64, 1, 256, 512, 512, 512, 256]
    - [27, 2305.0]
  - - [512, 64, 1, 512, 512, 512, 512, 512]
    - [27, 2975.0]
  - - [512, 64, 1, 1024, 512, 512, 512, 1024]
    - [20, 3431.0]
  - - [512, 128, 1, 32, 512, 512, 512, 32]
    - [12, 1178.0]
  - - [512, 128, 1, 64, 512, 512, 512, 64]
    - [12, 1960.0]
  - - [512, 128, 1, 128, 512, 512, 512, 128]
    - [23, 2954.0]
  - - [512, 128, 1, 256, 512, 512, 512, 256]
    - [22, 4237.0]
  - - [512, 128, 1, 512, 512, 512, 512, 512]
    - [31, 5115.0]
  - - [512, 128, 1, 1024, 512, 512, 512, 1024]
    - [20, 5775.0]
  - - [512, 256, 1, 32, 512, 512, 512, 32]
    - [33, 2208.0]
  - - [512, 256, 1, 64, 512, 512, 512, 64]
    - [12, 3679.0]
  - - [512, 256, 1, 128, 512, 512, 512, 128]
    - [45, 5519.0]
  - - [512, 256, 1, 256, 512, 512, 512, 256]
    - [37, 7326.0]
  - - [512, 256, 1, 512, 512, 512, 512, 512]
    - [48, 8648.0]
  - - [512, 256, 1, 1024, 512, 512, 512, 1024]
    - [42, 9479.0]
  - - [512, 512, 1, 32, 512, 512, 512, 32]
    - [43, 3920.0]
  - - [512, 512, 1, 64, 512, 512, 512, 64]
    - [7, 6079.0]
  - - [512, 512, 1, 128, 512, 512, 512, 128]
    - [19, 8972.0]
  - - [512, 512, 1, 256, 512, 512, 512, 256]
    - [13, 11260.0]
  - - [512, 512, 1, 512, 512, 512, 512, 512]
    - [50, 12881.0]
  - - [512, 512, 1, 1024, 512, 512, 512, 1024]
    - [19, 13865.0]
  - - [512, 1024, 1, 32, 512, 512, 512, 32]
    - [10, 6307.0]
  - - [512, 1024, 1, 64, 512, 512, 512, 64]
    - [10, 9642.0]
  - - [512, 1024, 1, 128, 512, 512, 512, 128]
    - [6, 12710.0]
  - - [512, 1024, 1, 256, 512, 512, 512, 256]
    - [24, 15865.0]
  - - [512, 1024, 1, 512, 512, 512, 512, 512]
    - [44, 17683.0]
  - - [512, 1024, 1, 1024, 512, 512, 512, 1024]
    - [46, 18811.0]
  - - [1024, 32, 1, 32, 1024, 1024, 1024, 32]
    - [12, 617.0]
  - - [1024, 32, 1, 64, 1024, 1024, 1024, 64]
    - [12, 1038.0]
  - - [1024, 32, 1, 128, 1024, 1024, 1024, 128]
    - [12, 1531.0]
  - - [1024, 32, 1, 256, 1024, 1024, 1024, 256]
    - [23, 2305.0]
  - - [1024, 32, 1, 512, 1024, 1024, 1024, 512]
    - [29, 2954.0]
  - - [1024, 32, 1, 1024, 1024, 1024, 1024, 1024]
    - [36, 3383.0]
  - - [1024, 64, 1, 32, 1024, 1024, 1024, 32]
    - [12, 1192.0]
  - - [1024, 64, 1, 64, 1024, 1024, 1024, 64]
    - [12, 1997.0]
  - - [1024, 64, 1, 128, 1024, 1024, 1024, 128]
    - [29, 2996.0]
  - - [1024, 64, 1, 256, 1024, 1024, 1024, 256]
    - [15, 4194.0]
  - - [1024, 64, 1, 512, 1024, 1024, 1024, 512]
    - [20, 5131.0]
  - - [1024, 64, 1, 1024, 1024, 1024, 1024, 1024]
    - [20, 5746.0]
  - - [1024, 128, 1, 32, 1024, 1024, 1024, 32]
    - [12, 2162.0]
  - - [1024, 128, 1, 64, 1024, 1024, 1024, 64]
    - [12, 3647.0]
  - - [1024, 128, 1, 128, 1024, 1024, 1024, 128]
    - [12, 5483.0]
  - - [1024, 128, 1, 256, 1024, 1024, 1024, 256]
    - [12, 7263.0]
  - - [1024, 128, 1, 512, 1024, 1024, 1024, 512]
    - [12, 8582.0]
  - - [1024, 128, 1, 1024, 1024, 1024, 1024, 1024]
    - [12, 9425.0]
  - - [1024, 256, 1, 32, 1024, 1024, 1024, 32]
    - [12, 3884.0]
  - - [1024, 256, 1, 64, 1024, 1024, 1024, 64]
    - [13, 5992.0]
  - - [1024, 256, 1, 128, 1024, 1024, 1024, 128]
    - [13, 8877.0]
  - - [1024, 256, 1, 256, 1024, 1024, 1024, 256]
    - [13, 11111.0]
  - - [1024, 256, 1, 512, 1024, 1024, 1024, 512]
    - [50, 12734.0]
  - - [1024, 256, 1, 1024, 1024, 1024, 1024, 1024]
    - [38, 13865.0]
  - - [1024, 512, 1, 32, 1024, 1024, 1024, 32]
    - [10, 6404.0]
  - - [1024, 512, 1, 64, 1024, 1024, 1024, 64]
    - [1, 9698.0]
  - - [1024, 512, 1, 128, 1024, 1024, 1024, 128]
    - [17, 12474.0]
  - - [1024, 512, 1, 256, 1024, 1024, 1024, 256]
    - [3, 15828.0]
  - - [1024, 512, 1, 512, 1024, 1024, 1024, 512]
    - [16, 17568.0]
  - - [1024, 512, 1, 1024, 1024, 1024, 1024, 1024]
    - [8, 19637.0]
  - - [1024, 1024, 1, 32, 1024, 1024, 1024, 32]
    - [28, 9373.0]
  - - [1024, 1024, 1, 64, 1024, 1024, 1024, 64]
    - [1, 13696.0]
  - - [1024, 1024, 1, 128, 1024, 1024, 1024, 128]
    - [0, 16093.0]
  - - [1024, 1024, 1, 256, 1024, 1024, 1024, 256]
    - [21, 19709.0]
  - - [1024, 1024, 1, 512, 1024, 1024, 1024, 512]
    - [21, 23101.0]
  - - [1024, 1024, 1, 1024, 1024, 1024, 1024, 1024]
    - [25, 25111.0]
- null
- null
- DeviceEfficiency
...
