library/src/blas3/Tensile/Logic/asm_full/navi22_Cijk_Ailk_Bjlk_HBH.yaml
---
- {MinimumRequiredVersion: 4.28.0}
- navi22
- gfx1031
    SolutionIndex: 0
    SolutionNameMin: Cijk_Ailk_Bjlk_HBH_MT128x128x8_SN_SU0_SUM0_TT8_16_WG16_8_1_WGM1
    SolutionIndex: 1
    SolutionNameMin: Cijk_Ailk_Bjlk_HBH_MT128x64x16_SN_SU0_SUM0_TT8_8_WG16_8_1_WGM1
    SolutionIndex: 2
    SolutionNameMin: Cijk_Ailk_Bjlk_HBH_MT128x128x16_SN_SU0_SUM0_TT8_16_WG16_8_1_WGM1
    SolutionIndex: 3
    SolutionNameMin: Cijk_Ailk_Bjlk_HBH_MT128x128x16_SN_SU0_SUM0_TT8_8_WG16_16_1_WGM1
    SolutionIndex: 4
    SolutionNameMin: Cijk_Ailk_Bjlk_HBH_MT128x256x16_SN_SU0_SUM0_TT8_16_WG16_16_1_WGM1
    SolutionIndex: 5
    SolutionNameMin: Cijk_Ailk_Bjlk_HBH_MT128x128x32_SN_SU0_SUM0_TT8_16_WG16_8_1_WGM1
    SolutionIndex: 6
    SolutionNameMin: Cijk_Ailk_Bjlk_HBH_MT128x128x32_SN_SU0_SUM0_TT8_8_WG16_16_1_WGM1
    SolutionIndex: 7
    SolutionNameMin: Cijk_Ailk_Bjlk_HBH_MT128x128x8_SN_SU32_SUM3_TT8_16_WG16_8_1_WGM1
    SolutionIndex: 8
    SolutionNameMin: Cijk_Ailk_Bjlk_HBH_MT128x64x16_SN_SU32_SUM3_TT8_8_WG16_8_1_WGM1
    SolutionIndex: 9
    SolutionNameMin: Cijk_Ailk_Bjlk_HBH_MT128x128x16_SN_SU32_SUM3_TT8_16_WG16_8_1_WGM1
    SolutionIndex: 10
    SolutionNameMin: Cijk_Ailk_Bjlk_HBH_MT128x128x16_SN_SU32_SUM3_TT8_8_WG16_16_1_WGM1
    SolutionIndex: 11
    SolutionNameMin: Cijk_Ailk_Bjlk_HBH_MT128x128x32_SN_SU32_SUM3_TT8_8_WG16_16_1_WGM1
    SolutionIndex: 12
    SolutionNameMin: Cijk_Ailk_Bjlk_HBH_MT128x128x8_SN_SU0_SUM0_TT8_16_WG16_8_1_WGM4
    SolutionIndex: 13
    SolutionNameMin: Cijk_Ailk_Bjlk_HBH_MT128x64x16_SN_SU0_SUM0_TT8_8_WG16_8_1_WGM4
    SolutionIndex: 14
    SolutionNameMin: Cijk_Ailk_Bjlk_HBH_MT128x128x16_SN_SU0_SUM0_TT8_16_WG16_8_1_WGM4
    SolutionIndex: 15
    SolutionNameMin: Cijk_Ailk_Bjlk_HBH_MT128x128x16_SN_SU0_SUM0_TT8_8_WG16_16_1_WGM4
    SolutionIndex: 16
    SolutionNameMin: Cijk_Ailk_Bjlk_HBH_MT128x128x32_SN_SU0_SUM0_TT8_16_WG16_8_1_WGM4
    SolutionIndex: 17
    SolutionNameMin: Cijk_Ailk_Bjlk_HBH_MT128x128x32_SN_SU0_SUM0_TT8_8_WG16_16_1_WGM4
    SolutionIndex: 18
    SolutionNameMin: Cijk_Ailk_Bjlk_HBH_MT128x64x16_SN_SU32_SUM3_TT8_8_WG16_8_1_WGM4
    SolutionIndex: 19
    SolutionNameMin: Cijk_Ailk_Bjlk_HBH_MT128x128x16_SN_SU32_SUM3_TT8_16_WG16_8_1_WGM4
    SolutionIndex: 20
    SolutionNameMin: Cijk_Ailk_Bjlk_HBH_MT128x128x16_SN_SU32_SUM3_TT8_8_WG16_16_1_WGM4
    SolutionIndex: 21
    SolutionNameMin: Cijk_Ailk_Bjlk_HBH_MT128x128x32_SN_SU32_SUM3_TT8_16_WG16_8_1_WGM4
    SolutionIndex: 22
    SolutionNameMin: Cijk_Ailk_Bjlk_HBH_MT128x128x32_SN_SU32_SUM3_TT8_8_WG16_16_1_WGM4
    SolutionIndex: 23
    SolutionNameMin: Cijk_Ailk_Bjlk_HBH_MT128x64x16_SN_SU0_SUM0_TT8_8_WG16_8_1_WGM8
    SolutionIndex: 24
    SolutionNameMin: Cijk_Ailk_Bjlk_HBH_MT128x128x16_SN_SU0_SUM0_TT8_16_WG16_8_1_WGM8
    SolutionIndex: 25
    SolutionNameMin: Cijk_Ailk_Bjlk_HBH_MT128x128x16_SN_SU0_SUM0_TT8_8_WG16_16_1_WGM8
    SolutionIndex: 26
    SolutionNameMin: Cijk_Ailk_Bjlk_HBH_MT128x128x32_SN_SU0_SUM0_TT8_16_WG16_8_1_WGM8
    SolutionIndex: 27
    SolutionNameMin: Cijk_Ailk_Bjlk_HBH_MT128x128x32_SN_SU0_SUM0_TT8_8_WG16_16_1_WGM8
    SolutionIndex: 28
    SolutionNameMin: Cijk_Ailk_Bjlk_HBH_MT128x64x16_SN_SU32_SUM3_TT8_8_WG16_8_1_WGM8
    SolutionIndex: 29
    SolutionNameMin: Cijk_Ailk_Bjlk_HBH_MT128x128x16_SN_SU32_SUM3_TT8_16_WG16_8_1_WGM8
    SolutionIndex: 30
    SolutionNameMin: Cijk_Ailk_Bjlk_HBH_MT128x128x16_SN_SU32_SUM3_TT8_8_WG16_16_1_WGM8
    SolutionIndex: 31
    SolutionNameMin: Cijk_Ailk_Bjlk_HBH_MT128x128x32_SN_SU32_SUM3_TT8_8_WG16_16_1_WGM8
    SolutionIndex: 32
    SolutionNameMin: Cijk_Ailk_Bjlk_HBH_MT128x128x16_SN_SU0_SUM0_TT8_16_WG16_8_1_WGM1
    SolutionIndex: 33
    SolutionNameMin: Cijk_Ailk_Bjlk_HBH_MT128x128x32_SN_SU0_SUM0_TT8_16_WG16_8_1_WGM1
    SolutionIndex: 34
    SolutionNameMin: Cijk_Ailk_Bjlk_HBH_MT128x128x32_SN_SU0_SUM0_TT8_8_WG16_16_1_WGM1
    SolutionIndex: 35
    SolutionNameMin: Cijk_Ailk_Bjlk_HBH_MT128x128x16_SN_SU32_SUM3_TT8_16_WG16_8_1_WGM1
    SolutionIndex: 36
    SolutionNameMin: Cijk_Ailk_Bjlk_HBH_MT128x128x16_SN_SU0_SUM0_TT8_16_WG16_8_1_WGM4
    SolutionIndex: 37
    SolutionNameMin: Cijk_Ailk_Bjlk_HBH_MT64x64x8_SN_SU0_SUM0_TT8_8_WG8_8_1_WGM1
    SolutionIndex: 38
    SolutionNameMin: Cijk_Ailk_Bjlk_HBH_MT64x64x16_SN_SU0_SUM0_TT8_8_WG8_8_1_WGM1
    SolutionIndex: 39
    SolutionNameMin: Cijk_Ailk_Bjlk_HBH_MT128x64x16_SN_SU0_SUM0_TT8_8_WG16_8_1_WGM1
    SolutionIndex: 40
    SolutionNameMin: Cijk_Ailk_Bjlk_HBH_MT128x128x16_SN_SU0_SUM0_TT8_8_WG16_16_1_WGM1
    SolutionIndex: 41
    SolutionNameMin: Cijk_Ailk_Bjlk_HBH_MT128x64x32_SN_SU0_SUM0_TT8_8_WG16_8_1_WGM1
    SolutionIndex: 42
    SolutionNameMin: Cijk_Ailk_Bjlk_HBH_MT128x128x32_SN_SU0_SUM0_TT8_8_WG16_16_1_WGM1
    SolutionIndex: 43
    SolutionNameMin: Cijk_Ailk_Bjlk_HBH_MT64x64x8_SN_SU32_SUM3_TT8_8_WG8_8_1_WGM1
    SolutionIndex: 44
    SolutionNameMin: Cijk_Ailk_Bjlk_HBH_MT64x64x16_SN_SU32_SUM3_TT8_8_WG8_8_1_WGM1
    SolutionIndex: 45
    SolutionNameMin: Cijk_Ailk_Bjlk_HBH_MT128x64x16_SN_SU32_SUM3_TT8_8_WG16_8_1_WGM1
    SolutionIndex: 46
    SolutionNameMin: Cijk_Ailk_Bjlk_HBH_MT64x64x32_SN_SU32_SUM3_TT8_8_WG8_8_1_WGM1
    SolutionIndex: 47
    SolutionNameMin: Cijk_Ailk_Bjlk_HBH_MT128x128x32_SN_SU32_SUM3_TT8_8_WG16_16_1_WGM1
    SolutionIndex: 48
    SolutionNameMin: Cijk_Ailk_Bjlk_HBH_MT64x64x8_SN_SU0_SUM0_TT8_8_WG8_8_1_WGM4
    SolutionIndex: 49
    SolutionNameMin: Cijk_Ailk_Bjlk_HBH_MT64x64x16_SN_SU0_SUM0_TT8_8_WG8_8_1_WGM4
    SolutionIndex: 50
    SolutionNameMin: Cijk_Ailk_Bjlk_HBH_MT128x64x16_SN_SU0_SUM0_TT8_8_WG16_8_1_WGM4
    SolutionIndex: 51
    SolutionNameMin: Cijk_Ailk_Bjlk_HBH_MT128x128x16_SN_SU0_SUM0_TT8_8_WG16_16_1_WGM4
    SolutionIndex: 52
    SolutionNameMin: Cijk_Ailk_Bjlk_HBH_MT128x64x32_SN_SU0_SUM0_TT8_8_WG16_8_1_WGM4
    SolutionIndex: 53
    SolutionNameMin: Cijk_Ailk_Bjlk_HBH_MT128x128x32_SN_SU0_SUM0_TT8_8_WG16_16_1_WGM4
    SolutionIndex: 54
    SolutionNameMin: Cijk_Ailk_Bjlk_HBH_MT64x64x8_SN_SU32_SUM3_TT8_8_WG8_8_1_WGM4
    SolutionIndex: 55
    SolutionNameMin: Cijk_Ailk_Bjlk_HBH_MT64x64x16_SN_SU32_SUM3_TT8_8_WG8_8_1_WGM4
    SolutionIndex: 56
    SolutionNameMin: Cijk_Ailk_Bjlk_HBH_MT128x64x16_SN_SU32_SUM3_TT8_8_WG16_8_1_WGM4
    SolutionIndex: 57
    SolutionNameMin: Cijk_Ailk_Bjlk_HBH_MT128x128x32_SN_SU32_SUM3_TT8_8_WG16_16_1_WGM4
    SolutionIndex: 58
    SolutionNameMin: Cijk_Ailk_Bjlk_HBH_MT64x64x8_SN_SU0_SUM0_TT8_8_WG8_8_1_WGM8
    SolutionIndex: 59
    SolutionNameMin: Cijk_Ailk_Bjlk_HBH_MT64x64x16_SN_SU0_SUM0_TT8_8_WG8_8_1_WGM8
    SolutionIndex: 60
    SolutionNameMin: Cijk_Ailk_Bjlk_HBH_MT128x64x16_SN_SU0_SUM0_TT8_8_WG16_8_1_WGM8
    SolutionIndex: 61
    SolutionNameMin: Cijk_Ailk_Bjlk_HBH_MT128x128x16_SN_SU0_SUM0_TT8_8_WG16_16_1_WGM8
    SolutionIndex: 62
    SolutionNameMin: Cijk_Ailk_Bjlk_HBH_MT128x64x32_SN_SU0_SUM0_TT8_8_WG16_8_1_WGM8
    SolutionIndex: 63
    SolutionNameMin: Cijk_Ailk_Bjlk_HBH_MT128x128x32_SN_SU0_SUM0_TT8_8_WG16_16_1_WGM8
    SolutionIndex: 64
    SolutionNameMin: Cijk_Ailk_Bjlk_HBH_MT64x64x8_SN_SU32_SUM3_TT8_8_WG8_8_1_WGM8
    SolutionIndex: 65
    SolutionNameMin: Cijk_Ailk_Bjlk_HBH_MT64x64x16_SN_SU32_SUM3_TT8_8_WG8_8_1_WGM8
    SolutionIndex: 66
    SolutionNameMin: Cijk_Ailk_Bjlk_HBH_MT128x64x16_SN_SU32_SUM3_TT8_8_WG16_8_1_WGM8
    SolutionIndex: 67
    SolutionNameMin: Cijk_Ailk_Bjlk_HBH_MT64x64x32_SN_SU32_SUM3_TT8_8_WG8_8_1_WGM8
    SolutionIndex: 68
    SolutionNameMin: Cijk_Ailk_Bjlk_HBH_MT128x64x32_SN_SU32_SUM3_TT8_8_WG16_8_1_WGM8
    SolutionIndex: 69
    SolutionNameMin: Cijk_Ailk_Bjlk_HBH_MT128x128x32_SN_SU32_SUM3_TT8_8_WG16_16_1_WGM8
    SolutionIndex: 70
    SolutionNameMin: Cijk_Ailk_Bjlk_HBH_MT128x64x16_SN_SU0_SUM0_TT8_8_WG16_8_1_WGM1
    SolutionIndex: 71
    SolutionNameMin: Cijk_Ailk_Bjlk_HBH_MT128x64x32_SN_SU0_SUM0_TT8_8_WG16_8_1_WGM1
    SolutionIndex: 72
    SolutionNameMin: Cijk_Ailk_Bjlk_HBH_MT128x128x32_SN_SU0_SUM0_TT8_8_WG16_16_1_WGM1
    SolutionIndex: 73
    SolutionNameMin: Cijk_Ailk_Bjlk_HBH_MT128x64x16_SN_SU32_SUM3_TT8_8_WG16_8_1_WGM1
    SolutionIndex: 74
    SolutionNameMin: Cijk_Ailk_Bjlk_HBH_MT64x64x16_SN_SU0_SUM0_TT8_8_WG8_8_1_WGM4
    SolutionIndex: 75
    SolutionNameMin: Cijk_Ailk_Bjlk_HBH_MT128x64x16_SN_SU0_SUM0_TT8_8_WG16_8_1_WGM4
    SolutionIndex: 76
    SolutionNameMin: Cijk_Ailk_Bjlk_HBH_MT128x64x16_SN_SU0_SUM0_TT8_8_WG16_8_1_WGM8
    SolutionIndex: 77
    SolutionNameMin: Cijk_Ailk_Bjlk_HBH_MT16x16x8_SN_SU0_SUM0_TT2_2_WG8_8_1_WGM1
    SolutionIndex: 78
    SolutionNameMin: Cijk_Ailk_Bjlk_HBH_MT32x32x8_SN_SU0_SUM0_TT4_4_WG8_8_1_WGM1
    SolutionIndex: 79
    SolutionNameMin: Cijk_Ailk_Bjlk_HBH_MT32x16x8_SN_SU0_SUM0_TT2_2_WG16_8_1_WGM1
    SolutionIndex: 80
    SolutionNameMin: Cijk_Ailk_Bjlk_HBH_MT64x32x8_SN_SU0_SUM0_TT4_4_WG16_8_1_WGM1
    SolutionIndex: 81
    SolutionNameMin: Cijk_Ailk_Bjlk_HBH_MT32x32x8_SN_SU0_SUM0_TT2_2_WG16_16_1_WGM1
    SolutionIndex: 82
    SolutionNameMin: Cijk_Ailk_Bjlk_HBH_MT32x32x16_SN_SU0_SUM0_TT4_4_WG8_8_1_WGM1
    SolutionIndex: 83
    SolutionNameMin: Cijk_Ailk_Bjlk_HBH_MT32x16x16_SN_SU0_SUM0_TT2_2_WG16_8_1_WGM1
    SolutionIndex: 84
    SolutionNameMin: Cijk_Ailk_Bjlk_HBH_MT64x32x16_SN_SU0_SUM0_TT4_4_WG16_8_1_WGM1
    SolutionIndex: 85
    SolutionNameMin: Cijk_Ailk_Bjlk_HBH_MT32x32x16_SN_SU0_SUM0_TT2_2_WG16_16_1_WGM1
    SolutionIndex: 86
    SolutionNameMin: Cijk_Ailk_Bjlk_HBH_MT64x64x16_SN_SU0_SUM0_TT4_4_WG16_16_1_WGM1
    SolutionIndex: 87
    SolutionNameMin: Cijk_Ailk_Bjlk_HBH_MT32x16x32_SN_SU0_SUM0_TT2_2_WG16_8_1_WGM1
    SolutionIndex: 88
    SolutionNameMin: Cijk_Ailk_Bjlk_HBH_MT64x32x32_SN_SU0_SUM0_TT4_4_WG16_8_1_WGM1
    SolutionIndex: 89
    SolutionNameMin: Cijk_Ailk_Bjlk_HBH_MT32x32x32_SN_SU0_SUM0_TT2_2_WG16_16_1_WGM1
    SolutionIndex: 90
    SolutionNameMin: Cijk_Ailk_Bjlk_HBH_MT64x64x32_SN_SU0_SUM0_TT4_4_WG16_16_1_WGM1
    SolutionIndex: 91
    SolutionNameMin: Cijk_Ailk_Bjlk_HBH_MT32x16x8_SN_SU32_SUM3_TT2_2_WG16_8_1_WGM1
    SolutionIndex: 92
    SolutionNameMin: Cijk_Ailk_Bjlk_HBH_MT64x32x8_SN_SU32_SUM3_TT4_4_WG16_8_1_WGM1
    SolutionIndex: 93
    SolutionNameMin: Cijk_Ailk_Bjlk_HBH_MT32x32x8_SN_SU32_SUM3_TT2_2_WG16_16_1_WGM1
    SolutionIndex: 94
    SolutionNameMin: Cijk_Ailk_Bjlk_HBH_MT16x16x16_SN_SU32_SUM3_TT2_2_WG8_8_1_WGM1
    SolutionIndex: 95
    SolutionNameMin: Cijk_Ailk_Bjlk_HBH_MT32x32x16_SN_SU32_SUM3_TT4_4_WG8_8_1_WGM1
    SolutionIndex: 96
    SolutionNameMin: Cijk_Ailk_Bjlk_HBH_MT32x16x16_SN_SU32_SUM3_TT2_2_WG16_8_1_WGM1
    SolutionIndex: 97
    SolutionNameMin: Cijk_Ailk_Bjlk_HBH_MT64x32x16_SN_SU32_SUM3_TT4_4_WG16_8_1_WGM1
    SolutionIndex: 98
    SolutionNameMin: Cijk_Ailk_Bjlk_HBH_MT32x32x16_SN_SU32_SUM3_TT2_2_WG16_16_1_WGM1
    SolutionIndex: 99
    SolutionNameMin: Cijk_Ailk_Bjlk_HBH_MT64x64x16_SN_SU32_SUM3_TT4_4_WG16_16_1_WGM1
    SolutionIndex: 100
    SolutionNameMin: Cijk_Ailk_Bjlk_HBH_MT16x16x32_SN_SU32_SUM3_TT2_2_WG8_8_1_WGM1
    SolutionIndex: 101
    SolutionNameMin: Cijk_Ailk_Bjlk_HBH_MT32x32x32_SN_SU32_SUM3_TT4_4_WG8_8_1_WGM1
    SolutionIndex: 102
    SolutionNameMin: Cijk_Ailk_Bjlk_HBH_MT32x16x32_SN_SU32_SUM3_TT2_2_WG16_8_1_WGM1
    SolutionIndex: 103
    SolutionNameMin: Cijk_Ailk_Bjlk_HBH_MT64x32x32_SN_SU32_SUM3_TT4_4_WG16_8_1_WGM1
    SolutionIndex: 104
    SolutionNameMin: Cijk_Ailk_Bjlk_HBH_MT32x32x32_SN_SU32_SUM3_TT2_2_WG16_16_1_WGM1
    SolutionIndex: 105
    SolutionNameMin: Cijk_Ailk_Bjlk_HBH_MT64x64x32_SN_SU32_SUM3_TT4_4_WG16_16_1_WGM1
    SolutionIndex: 106
    SolutionNameMin: Cijk_Ailk_Bjlk_HBH_MT32x32x8_SN_SU0_SUM0_TT4_4_WG8_8_1_WGM4
    SolutionIndex: 107
    SolutionNameMin: Cijk_Ailk_Bjlk_HBH_MT32x16x8_SN_SU0_SUM0_TT2_2_WG16_8_1_WGM4
    SolutionIndex: 108
    SolutionNameMin: Cijk_Ailk_Bjlk_HBH_MT64x32x8_SN_SU0_SUM0_TT4_4_WG16_8_1_WGM4
    SolutionIndex: 109
    SolutionNameMin: Cijk_Ailk_Bjlk_HBH_MT32x32x8_SN_SU0_SUM0_TT2_2_WG16_16_1_WGM4
    SolutionIndex: 110
    SolutionNameMin: Cijk_Ailk_Bjlk_HBH_MT16x16x16_SN_SU0_SUM0_TT2_2_WG8_8_1_WGM4
    SolutionIndex: 111
    SolutionNameMin: Cijk_Ailk_Bjlk_HBH_MT32x32x16_SN_SU0_SUM0_TT4_4_WG8_8_1_WGM4
    SolutionIndex: 112
    SolutionNameMin: Cijk_Ailk_Bjlk_HBH_MT32x16x16_SN_SU0_SUM0_TT2_2_WG16_8_1_WGM4
    SolutionIndex: 113
    SolutionNameMin: Cijk_Ailk_Bjlk_HBH_MT64x32x16_SN_SU0_SUM0_TT4_4_WG16_8_1_WGM4
    SolutionIndex: 114
    SolutionNameMin: Cijk_Ailk_Bjlk_HBH_MT32x32x16_SN_SU0_SUM0_TT2_2_WG16_16_1_WGM4
    SolutionIndex: 115
    SolutionNameMin: Cijk_Ailk_Bjlk_HBH_MT64x64x16_SN_SU0_SUM0_TT4_4_WG16_16_1_WGM4
    SolutionIndex: 116
    SolutionNameMin: Cijk_Ailk_Bjlk_HBH_MT32x32x32_SN_SU0_SUM0_TT4_4_WG8_8_1_WGM4
    SolutionIndex: 117
    SolutionNameMin: Cijk_Ailk_Bjlk_HBH_MT32x16x32_SN_SU0_SUM0_TT2_2_WG16_8_1_WGM4
    SolutionIndex: 118
    SolutionNameMin: Cijk_Ailk_Bjlk_HBH_MT64x32x32_SN_SU0_SUM0_TT4_4_WG16_8_1_WGM4
    SolutionIndex: 119
    SolutionNameMin: Cijk_Ailk_Bjlk_HBH_MT32x32x32_SN_SU0_SUM0_TT2_2_WG16_16_1_WGM4
    SolutionIndex: 120
    SolutionNameMin: Cijk_Ailk_Bjlk_HBH_MT64x64x32_SN_SU0_SUM0_TT4_4_WG16_16_1_WGM4
    SolutionIndex: 121
    SolutionNameMin: Cijk_Ailk_Bjlk_HBH_MT32x32x8_SN_SU32_SUM3_TT4_4_WG8_8_1_WGM4
    SolutionIndex: 122
    SolutionNameMin: Cijk_Ailk_Bjlk_HBH_MT64x64x8_SN_SU32_SUM3_TT4_4_WG16_16_1_WGM4
    SolutionIndex: 123
    SolutionNameMin: Cijk_Ailk_Bjlk_HBH_MT16x16x16_SN_SU32_SUM3_TT2_2_WG8_8_1_WGM4
    SolutionIndex: 124
    SolutionNameMin: Cijk_Ailk_Bjlk_HBH_MT32x32x16_SN_SU32_SUM3_TT4_4_WG8_8_1_WGM4
    SolutionIndex: 125
    SolutionNameMin: Cijk_Ailk_Bjlk_HBH_MT32x16x16_SN_SU32_SUM3_TT2_2_WG16_8_1_WGM4
    SolutionIndex: 126
    SolutionNameMin: Cijk_Ailk_Bjlk_HBH_MT64x32x16_SN_SU32_SUM3_TT4_4_WG16_8_1_WGM4
    SolutionIndex: 127
    SolutionNameMin: Cijk_Ailk_Bjlk_HBH_MT64x64x16_SN_SU32_SUM3_TT4_4_WG16_16_1_WGM4
    SolutionIndex: 128
    SolutionNameMin: Cijk_Ailk_Bjlk_HBH_MT32x32x32_SN_SU32_SUM3_TT4_4_WG8_8_1_WGM4
    SolutionIndex: 129
    SolutionNameMin: Cijk_Ailk_Bjlk_HBH_MT32x16x32_SN_SU32_SUM3_TT2_2_WG16_8_1_WGM4
    SolutionIndex: 130
    SolutionNameMin: Cijk_Ailk_Bjlk_HBH_MT64x32x32_SN_SU32_SUM3_TT4_4_WG16_8_1_WGM4
    SolutionIndex: 131
    SolutionNameMin: Cijk_Ailk_Bjlk_HBH_MT32x32x32_SN_SU32_SUM3_TT2_2_WG16_16_1_WGM4
    SolutionIndex: 132
    SolutionNameMin: Cijk_Ailk_Bjlk_HBH_MT64x64x32_SN_SU32_SUM3_TT4_4_WG16_16_1_WGM4
    SolutionIndex: 133
    SolutionNameMin: Cijk_Ailk_Bjlk_HBH_MT32x32x8_SN_SU0_SUM0_TT4_4_WG8_8_1_WGM8
    SolutionIndex: 134
    SolutionNameMin: Cijk_Ailk_Bjlk_HBH_MT32x16x8_SN_SU0_SUM0_TT2_2_WG16_8_1_WGM8
    SolutionIndex: 135
    SolutionNameMin: Cijk_Ailk_Bjlk_HBH_MT64x32x8_SN_SU0_SUM0_TT4_4_WG16_8_1_WGM8
    SolutionIndex: 136
    SolutionNameMin: Cijk_Ailk_Bjlk_HBH_MT32x32x8_SN_SU0_SUM0_TT2_2_WG16_16_1_WGM8
    SolutionIndex: 137
    SolutionNameMin: Cijk_Ailk_Bjlk_HBH_MT16x16x16_SN_SU0_SUM0_TT2_2_WG8_8_1_WGM8
    SolutionIndex: 138
    SolutionNameMin: Cijk_Ailk_Bjlk_HBH_MT32x32x16_SN_SU0_SUM0_TT4_4_WG8_8_1_WGM8
    SolutionIndex: 139
    SolutionNameMin: Cijk_Ailk_Bjlk_HBH_MT32x16x16_SN_SU0_SUM0_TT2_2_WG16_8_1_WGM8
    SolutionIndex: 140
    SolutionNameMin: Cijk_Ailk_Bjlk_HBH_MT64x32x16_SN_SU0_SUM0_TT4_4_WG16_8_1_WGM8
    SolutionIndex: 141
    SolutionNameMin: Cijk_Ailk_Bjlk_HBH_MT64x64x16_SN_SU0_SUM0_TT4_4_WG16_16_1_WGM8
    SolutionIndex: 142
    SolutionNameMin: Cijk_Ailk_Bjlk_HBH_MT32x32x32_SN_SU0_SUM0_TT4_4_WG8_8_1_WGM8
    SolutionIndex: 143
    SolutionNameMin: Cijk_Ailk_Bjlk_HBH_MT32x16x32_SN_SU0_SUM0_TT2_2_WG16_8_1_WGM8
    SolutionIndex: 144
    SolutionNameMin: Cijk_Ailk_Bjlk_HBH_MT64x32x32_SN_SU0_SUM0_TT4_4_WG16_8_1_WGM8
    SolutionIndex: 145
    SolutionNameMin: Cijk_Ailk_Bjlk_HBH_MT32x32x32_SN_SU0_SUM0_TT2_2_WG16_16_1_WGM8
    SolutionIndex: 146
    SolutionNameMin: Cijk_Ailk_Bjlk_HBH_MT64x64x32_SN_SU0_SUM0_TT4_4_WG16_16_1_WGM8
    SolutionIndex: 147
    SolutionNameMin: Cijk_Ailk_Bjlk_HBH_MT32x32x8_SN_SU32_SUM3_TT4_4_WG8_8_1_WGM8
    SolutionIndex: 148
    SolutionNameMin: Cijk_Ailk_Bjlk_HBH_MT64x32x8_SN_SU32_SUM3_TT4_4_WG16_8_1_WGM8
    SolutionIndex: 149
    SolutionNameMin: Cijk_Ailk_Bjlk_HBH_MT16x16x16_SN_SU32_SUM3_TT2_2_WG8_8_1_WGM8
    SolutionIndex: 150
    SolutionNameMin: Cijk_Ailk_Bjlk_HBH_MT32x32x16_SN_SU32_SUM3_TT4_4_WG8_8_1_WGM8
    SolutionIndex: 151
    SolutionNameMin: Cijk_Ailk_Bjlk_HBH_MT32x16x16_SN_SU32_SUM3_TT2_2_WG16_8_1_WGM8
    SolutionIndex: 152
    SolutionNameMin: Cijk_Ailk_Bjlk_HBH_MT64x32x16_SN_SU32_SUM3_TT4_4_WG16_8_1_WGM8
    SolutionIndex: 153
    SolutionNameMin: Cijk_Ailk_Bjlk_HBH_MT16x16x32_SN_SU32_SUM3_TT2_2_WG8_8_1_WGM8
    SolutionIndex: 154
    SolutionNameMin: Cijk_Ailk_Bjlk_HBH_MT64x32x32_SN_SU32_SUM3_TT4_4_WG16_8_1_WGM8
    SolutionIndex: 155
    SolutionNameMin: Cijk_Ailk_Bjlk_HBH_MT32x32x32_SN_SU32_SUM3_TT2_2_WG16_16_1_WGM8
    SolutionIndex: 156
    SolutionNameMin: Cijk_Ailk_Bjlk_HBH_MT64x64x32_SN_SU32_SUM3_TT4_4_WG16_16_1_WGM8
    SolutionIndex: 157
    SolutionNameMin: Cijk_Ailk_Bjlk_HBH_MT16x16x32_SN_SU0_SUM0_TT2_2_WG8_8_1_WGM1
    SolutionIndex: 158
    SolutionNameMin: Cijk_Ailk_Bjlk_HBH_MT32x16x32_SN_SU0_SUM0_TT2_2_WG16_8_1_WGM1
    SolutionIndex: 159
    SolutionNameMin: Cijk_Ailk_Bjlk_HBH_MT64x64x32_SN_SU0_SUM0_TT4_4_WG16_16_1_WGM1
    SolutionIndex: 160
    SolutionNameMin: Cijk_Ailk_Bjlk_HBH_MT16x16x32_SN_SU32_SUM3_TT2_2_WG8_8_1_WGM1
    SolutionIndex: 161
    SolutionNameMin: Cijk_Ailk_Bjlk_HBH_MT32x16x32_SN_SU32_SUM3_TT2_2_WG16_8_1_WGM1
    SolutionIndex: 162
    SolutionNameMin: Cijk_Ailk_Bjlk_HBH_MT16x16x32_SN_SU0_SUM0_TT2_2_WG8_8_1_WGM4
    SolutionIndex: 163
    SolutionNameMin: Cijk_Ailk_Bjlk_HBH_MT32x16x32_SN_SU0_SUM0_TT2_2_WG16_8_1_WGM4
    SolutionIndex: 164
    SolutionNameMin: Cijk_Ailk_Bjlk_HBH_MT64x32x16_SN_SU0_SUM0_TT4_4_WG16_8_1_WGM8
    SolutionIndex: 165
    SolutionNameMin: Cijk_Ailk_Bjlk_HBH_MT32x16x32_SN_SU0_SUM0_TT2_2_WG16_8_1_WGM8
    SolutionIndex: 166
    SolutionNameMin: Cijk_Ailk_Bjlk_HBH_MT32x8x8_SN_SU0_SUM0_TT2_2_WG16_4_1_WGM1
    SolutionIndex: 167
    SolutionNameMin: Cijk_Ailk_Bjlk_HBH_MT32x8x8_SN_SU0_SUM0_TT2_2_WG16_4_1_WGM8
- - - [4096, 7133, 1, 4096, 4096, 4096, 4096, 7133]
    - [19, 23743.0]
  - - [2048, 7133, 1, 2048, 2048, 2048, 2048, 7133]
    - [14, 23504.0]
  - - [2560, 7133, 1, 2560, 2560, 2560, 2560, 7133]
    - [14, 23722.0]
  - - [3072, 7435, 1, 1024, 3072, 3072, 3072, 7435]
    - [24, 23269.0]
  - - [1760, 7133, 1, 1760, 1760, 1760, 1760, 7133]
    - [24, 22755.0]
  - - [7680, 5481, 1, 2560, 7680, 7680, 7680, 5481]
    - [14, 23833.0]
  - - [3136, 256, 64, 64, 3136, 3136, 3136, 256]
    - [0, 14948.0]
  - - [784, 512, 64, 128, 784, 784, 784, 512]
    - [9, 18660.0]
  - - [784, 128, 64, 512, 784, 784, 784, 128]
    - [2, 19341.0]
  - - [196, 256, 128, 1024, 196, 196, 196, 256]
    - [2, 17344.0]
  - - [196, 256, 64, 1024, 196, 196, 196, 256]
    - [9, 16900.0]
  - - [196, 1024, 128, 256, 196, 196, 196, 1024]
    - [14, 16702.0]
  - - [784, 128, 256, 512, 784, 784, 784, 128]
    - [2, 20273.0]
  - - [3136, 256, 256, 64, 3136, 3136, 3136, 256]
    - [0, 15469.0]
  - - [784, 128, 128, 512, 784, 784, 784, 128]
    - [14, 19934.0]
  - - [784, 512, 128, 128, 784, 784, 784, 512]
    - [14, 18990.0]
  - - [784, 512, 256, 128, 784, 784, 784, 512]
    - [9, 19215.0]
  - - [196, 1024, 64, 256, 196, 196, 196, 1024]
    - [2, 16448.0]
  - - [196, 1024, 256, 256, 196, 196, 196, 1024]
    - [19, 16957.0]
  - - [196, 256, 256, 1024, 196, 196, 196, 256]
    - [2, 17659.0]
  - - [3136, 256, 128, 64, 3136, 3136, 3136, 256]
    - [0, 18093.0]
  - - [1024, 4096, 1, 2048, 1024, 1024, 1024, 4096]
    - [2, 22829.0]
  - - [1024, 4096, 1, 4096, 1024, 1024, 1024, 4096]
    - [2, 22959.0]
  - - [1024, 30528, 1, 2048, 1024, 1024, 1024, 30528]
    - [2, 23749.0]
  - - [1024, 30528, 1, 4096, 1024, 1024, 1024, 30528]
    - [9, 23837.0]
  - - [4096, 1024, 1, 2048, 4096, 4096, 4096, 1024]
    - [2, 22748.0]
  - - [4096, 1024, 1, 4096, 4096, 4096, 4096, 1024]
    - [2, 22984.0]
  - - [256, 4864, 1, 8976, 256, 256, 256, 4864]
    - [9, 20827.0]
  - - [256, 5120, 1, 8976, 256, 256, 256, 5120]
    - [29, 22034.0]
  - - [256, 5632, 1, 8976, 256, 256, 256, 5632]
    - [29, 19751.0]
  - - [256, 5888, 1, 8976, 256, 256, 256, 5888]
    - [29, 20730.0]
  - - [256, 6144, 1, 8976, 256, 256, 256, 6144]
    - [19, 21544.0]
  - - [256, 7168, 1, 8976, 256, 256, 256, 7168]
    - [14, 21324.0]
  - - [256, 8192, 1, 8976, 256, 256, 256, 8192]
    - [14, 21197.0]
  - - [256, 8960, 1, 8976, 256, 256, 256, 8960]
    - [2, 22899.0]
  - - [256, 9728, 1, 8976, 256, 256, 256, 9728]
    - [14, 22058.0]
  - - [256, 9984, 1, 8976, 256, 256, 256, 9984]
    - [9, 22512.0]
  - - [256, 10240, 1, 8976, 256, 256, 256, 10240]
    - [19, 23042.0]
  - - [256, 10496, 1, 8976, 256, 256, 256, 10496]
    - [2, 21388.0]
  - - [256, 11008, 1, 8976, 256, 256, 256, 11008]
    - [14, 22335.0]
  - - [256, 11264, 1, 8976, 256, 256, 256, 11264]
    - [2, 22697.0]
  - - [256, 11520, 1, 8976, 256, 256, 256, 11520]
    - [9, 23217.0]
  - - [256, 11776, 1, 8976, 256, 256, 256, 11776]
    - [9, 21658.0]
  - - [256, 12544, 1, 8976, 256, 256, 256, 12544]
    - [19, 22861.0]
  - - [256, 12800, 1, 8976, 256, 256, 256, 12800]
    - [19, 23345.0]
  - - [256, 13312, 1, 8976, 256, 256, 256, 13312]
    - [14, 22286.0]
  - - [256, 13568, 1, 8976, 256, 256, 256, 13568]
    - [14, 22699.0]
  - - [256, 14336, 1, 8976, 256, 256, 256, 14336]
    - [9, 22064.0]
  - - [256, 14848, 1, 8976, 256, 256, 256, 14848]
    - [9, 22776.0]
  - - [256, 15104, 1, 8976, 256, 256, 256, 15104]
    - [14, 23143.0]
  - - [256, 15872, 1, 8976, 256, 256, 256, 15872]
    - [2, 22613.0]
  - - [256, 16128, 1, 8976, 256, 256, 256, 16128]
    - [2, 22930.0]
  - - [256, 17152, 1, 8976, 256, 256, 256, 17152]
    - [9, 22763.0]
  - - [256, 17408, 1, 8976, 256, 256, 256, 17408]
    - [19, 23046.0]
  - - [256, 18688, 1, 8976, 256, 256, 256, 18688]
    - [9, 23060.0]
  - - [256, 19968, 1, 8976, 256, 256, 256, 19968]
    - [29, 23198.0]
  - - [256, 20480, 1, 8976, 256, 256, 256, 20480]
    - [19, 23699.0]
  - - [256, 20992, 1, 8976, 256, 256, 256, 20992]
    - [9, 23008.0]
  - - [256, 21248, 1, 8976, 256, 256, 256, 21248]
    - [19, 23217.0]
  - - [256, 22016, 1, 8976, 256, 256, 256, 22016]
    - [2, 22847.0]
  - - [256, 26112, 1, 8976, 256, 256, 256, 26112]
    - [14, 23269.0]
  - - [256, 32512, 1, 8976, 256, 256, 256, 32512]
    - [14, 23461.0]
  - - [256, 32768, 1, 1, 256, 256, 256, 32768]
    - [0, 428.0]
  - - [256, 33536, 1, 8976, 256, 256, 256, 33536]
    - [14, 23372.0]
  - - [256, 44505, 1, 8976, 256, 256, 256, 44505]
    - [29, 23846.0]
  - - [768, 2048, 1, 256, 768, 768, 768, 2048]
    - [15, 18220.0]
  - - [1600, 1024, 1, 512, 1600, 1600, 1600, 1024]
    - [2, 17549.0]
  - - [1600, 1024, 1, 960, 1600, 1600, 1600, 1024]
    - [2, 18209.0]
  - - [2048, 960, 1, 1, 2048, 2048, 2048, 960]
    - [1, 287.0]
  - - [2048, 2048, 1, 512, 2048, 2048, 2048, 2048]
    - [14, 22153.0]
  - - [2048, 2048, 1, 960, 2048, 2048, 2048, 2048]
    - [2, 22636.0]
  - - [2048, 2048, 1, 1024, 2048, 2048, 2048, 2048]
    - [19, 22194.0]
  - - [3200, 2048, 1, 1024, 3200, 3200, 3200, 2048]
    - [24, 23355.0]
  - - [4096, 4096, 1, 1024, 4096, 4096, 4096, 4096]
    - [19, 23535.0]
  - - [1024, 4096, 1, 3840, 1024, 1024, 1024, 4096]
    - [2, 23087.0]
  - - [1024, 4096, 1, 3968, 1024, 1024, 1024, 4096]
    - [9, 22895.0]
  - - [1024, 4096, 1, 6528, 1024, 1024, 1024, 4096]
    - [2, 23126.0]
  - - [1024, 4096, 1, 7104, 1024, 1024, 1024, 4096]
    - [24, 22799.0]
  - - [1024, 4096, 1, 7200, 1024, 1024, 1024, 4096]
    - [24, 22763.0]
  - - [1024, 4096, 1, 8064, 1024, 1024, 1024, 4096]
    - [21, 22159.0]
  - - [1024, 4096, 1, 8160, 1024, 1024, 1024, 4096]
    - [26, 22255.0]
  - - [1024, 4096, 1, 9216, 1024, 1024, 1024, 4096]
    - [19, 23193.0]
  - - [1024, 4096, 1, 9520, 1024, 1024, 1024, 4096]
    - [19, 23178.0]
  - - [1024, 4096, 1, 10064, 1024, 1024, 1024, 4096]
    - [29, 23184.0]
  - - [1024, 4096, 1, 10080, 1024, 1024, 1024, 4096]
    - [9, 23179.0]
  - - [1024, 4096, 1, 10200, 1024, 1024, 1024, 4096]
    - [29, 23179.0]
  - - [1024, 42720, 1, 3968, 1024, 1024, 1024, 42720]
    - [2, 24100.0]
  - - [1024, 42720, 1, 6528, 1024, 1024, 1024, 42720]
    - [2, 24114.0]
  - - [1024, 42720, 1, 7104, 1024, 1024, 1024, 42720]
    - [9, 24047.0]
  - - [1024, 42720, 1, 7200, 1024, 1024, 1024, 42720]
    - [9, 24037.0]
  - - [1024, 42720, 1, 9520, 1024, 1024, 1024, 42720]
    - [14, 23518.0]
  - - [1024, 42720, 1, 10080, 1024, 1024, 1024, 42720]
    - [2, 23554.0]
  - - [4096, 1024, 1, 3840, 4096, 4096, 4096, 1024]
    - [2, 22909.0]
  - - [4096, 1024, 1, 3968, 4096, 4096, 4096, 1024]
    - [14, 22892.0]
  - - [4096, 1024, 1, 6528, 4096, 4096, 4096, 1024]
    - [2, 23064.0]
  - - [4096, 1024, 1, 7104, 4096, 4096, 4096, 1024]
    - [16, 22583.0]
  - - [4096, 1024, 1, 7200, 4096, 4096, 4096, 1024]
    - [16, 22583.0]
  - - [4096, 1024, 1, 8064, 4096, 4096, 4096, 1024]
    - [19, 23097.0]
  - - [4096, 1024, 1, 8160, 4096, 4096, 4096, 1024]
    - [19, 23114.0]
  - - [4096, 1024, 1, 9216, 4096, 4096, 4096, 1024]
    - [19, 23105.0]
  - - [4096, 1024, 1, 9520, 4096, 4096, 4096, 1024]
    - [19, 23196.0]
  - - [4096, 1024, 1, 10064, 4096, 4096, 4096, 1024]
    - [9, 23205.0]
  - - [4096, 1024, 1, 10080, 4096, 4096, 4096, 1024]
    - [24, 23241.0]
  - - [4096, 1024, 1, 10200, 4096, 4096, 4096, 1024]
    - [9, 23176.0]
  - - [1024, 4096, 1, 3240, 1024, 1024, 1024, 4096]
    - [14, 22981.0]
  - - [1024, 4096, 1, 3960, 1024, 1024, 1024, 4096]
    - [24, 22831.0]
  - - [1024, 42720, 1, 3960, 1024, 1024, 1024, 42720]
    - [9, 24082.0]
  - - [4096, 1024, 1, 3240, 4096, 4096, 4096, 1024]
    - [2, 22924.0]
  - - [4096, 1024, 1, 3960, 4096, 4096, 4096, 1024]
    - [2, 23048.0]
  - - [1225, 192, 64, 32, 1225, 1225, 1225, 192]
    - [13, 9940.0]
  - - [1225, 192, 64, 48, 1225, 1225, 1225, 192]
    - [13, 14520.0]
  - - [1225, 192, 64, 64, 1225, 1225, 1225, 192]
    - [23, 16089.0]
  - - [1225, 256, 64, 48, 1225, 1225, 1225, 256]
    - [13, 15429.0]
  - - [1225, 256, 64, 64, 1225, 1225, 1225, 256]
    - [25, 16725.0]
  - - [1225, 288, 64, 48, 1225, 1225, 1225, 288]
    - [8, 12541.0]
  - - [1225, 288, 64, 64, 1225, 1225, 1225, 288]
    - [13, 14512.0]
  - - [289, 768, 64, 128, 289, 289, 289, 768]
    - [19, 15414.0]
  - - [289, 768, 64, 160, 289, 289, 289, 768]
    - [19, 15898.0]
  - - [289, 768, 64, 192, 289, 289, 289, 768]
    - [9, 16219.0]
  - - [1225, 192, 32, 32, 1225, 1225, 1225, 192]
    - [18, 10490.0]
  - - [1225, 192, 32, 48, 1225, 1225, 1225, 192]
    - [28, 14156.0]
  - - [1225, 192, 32, 64, 1225, 1225, 1225, 192]
    - [23, 16067.0]
  - - [1225, 256, 32, 48, 1225, 1225, 1225, 256]
    - [23, 14209.0]
  - - [1225, 256, 32, 64, 1225, 1225, 1225, 256]
    - [13, 16752.0]
  - - [1225, 288, 32, 48, 1225, 1225, 1225, 288]
    - [18, 12596.0]
  - - [1225, 288, 32, 64, 1225, 1225, 1225, 288]
    - [23, 14561.0]
  - - [289, 768, 32, 128, 289, 289, 289, 768]
    - [9, 14735.0]
  - - [289, 768, 32, 160, 289, 289, 289, 768]
    - [9, 15315.0]
  - - [289, 768, 32, 192, 289, 289, 289, 768]
    - [19, 15638.0]
  - - [3136, 256, 32, 64, 3136, 3136, 3136, 256]
    - [30, 19021.0]
  - - [784, 128, 32, 512, 784, 784, 784, 128]
    - [14, 18132.0]
  - - [784, 512, 32, 128, 784, 784, 784, 512]
    - [2, 18256.0]
  - - [196, 1024, 32, 256, 196, 196, 196, 1024]
    - [19, 15904.0]
  - - [3136, 128, 64, 256, 3136, 3136, 3136, 128]
    - [14, 22163.0]
  - - [784, 256, 64, 512, 784, 784, 784, 256]
    - [2, 20202.0]
  - - [3136, 256, 64, 128, 3136, 3136, 3136, 256]
    - [2, 21491.0]
  - - [3136, 256, 64, 256, 3136, 3136, 3136, 256]
    - [2, 22551.0]
  - - [196, 512, 64, 1024, 196, 196, 196, 512]
    - [14, 17560.0]
  - - [784, 512, 64, 256, 784, 784, 784, 512]
    - [2, 19838.0]
  - - [784, 512, 64, 512, 784, 784, 784, 512]
    - [14, 20464.0]
  - - [196, 1024, 64, 512, 196, 196, 196, 1024]
    - [14, 17319.0]
  - - [196, 1024, 64, 1024, 196, 196, 196, 1024]
    - [24, 17824.0]
  - - [3136, 128, 32, 256, 3136, 3136, 3136, 128]
    - [19, 21943.0]
  - - [784, 256, 32, 512, 784, 784, 784, 256]
    - [24, 19555.0]
  - - [3136, 256, 32, 128, 3136, 3136, 3136, 256]
    - [29, 21033.0]
  - - [3136, 256, 32, 256, 3136, 3136, 3136, 256]
    - [29, 22255.0]
  - - [196, 512, 32, 1024, 196, 196, 196, 512]
    - [14, 17081.0]
  - - [784, 512, 32, 256, 784, 784, 784, 512]
    - [2, 19553.0]
  - - [784, 512, 32, 512, 784, 784, 784, 512]
    - [24, 20224.0]
  - - [196, 1024, 32, 512, 196, 196, 196, 1024]
    - [14, 16994.0]
  - - [196, 1024, 32, 1024, 196, 196, 196, 1024]
    - [14, 17478.0]
  - - [7680, 8192, 1, 8192, 7680, 7680, 7680, 8192]
    - [14, 23989.0]
  - - [3840, 4096, 1, 4096, 3840, 3840, 3840, 4096]
    - [2, 23967.0]
  - - [1920, 2048, 1, 2048, 1920, 1920, 1920, 2048]
    - [14, 22744.0]
  - - [8192, 7680, 1, 8192, 8192, 8192, 8192, 7680]
    - [19, 23990.0]
  - - [4096, 3840, 1, 4096, 4096, 4096, 4096, 3840]
    - [2, 23995.0]
  - - [2048, 1920, 1, 2048, 2048, 2048, 2048, 1920]
    - [14, 22821.0]
  - - [8192, 8192, 1, 8192, 8192, 8192, 8192, 8192]
    - [14, 23937.0]
  - - [4096, 4096, 1, 4096, 4096, 4096, 4096, 4096]
    - [2, 23738.0]
  - - [2048, 2048, 1, 2048, 2048, 2048, 2048, 2048]
    - [14, 22328.0]
  - - [1024, 4096, 1, 512, 1024, 1024, 1024, 4096]
    - [14, 21479.0]
  - - [1024, 30522, 1, 77, 1024, 1024, 1024, 30522]
    - [23, 17195.0]
  - - [4096, 1024, 1, 512, 4096, 4096, 4096, 1024]
    - [14, 22194.0]
  - - [1024, 4096, 1, 1280, 1024, 1024, 1024, 4096]
    - [9, 22751.0]
  - - [1024, 30522, 1, 200, 1024, 1024, 1024, 30522]
    - [12, 22377.0]
  - - [4096, 1024, 1, 1280, 4096, 4096, 4096, 1024]
    - [2, 22855.0]
  - - [1024, 4096, 1, 4992, 1024, 1024, 1024, 4096]
    - [9, 23119.0]
  - - [1024, 30522, 1, 780, 1024, 1024, 1024, 30522]
    - [24, 23473.0]
  - - [4096, 1024, 1, 4992, 4096, 4096, 4096, 1024]
    - [9, 23088.0]
  - - [1024, 30522, 1, 308, 1024, 1024, 1024, 30522]
    - [24, 22726.0]
  - - [1024, 4096, 1, 5120, 1024, 1024, 1024, 4096]
    - [2, 23119.0]
  - - [1024, 30522, 1, 800, 1024, 1024, 1024, 30522]
    - [29, 23666.0]
  - - [4096, 1024, 1, 5120, 4096, 4096, 4096, 1024]
    - [9, 23092.0]
  - - [1024, 4096, 1, 5248, 1024, 1024, 1024, 4096]
    - [2, 23057.0]
  - - [1024, 30522, 1, 820, 1024, 1024, 1024, 30522]
    - [9, 23505.0]
  - - [4096, 1024, 1, 5248, 4096, 4096, 4096, 1024]
    - [9, 23111.0]
  - - [1024, 4096, 1, 2560, 1024, 1024, 1024, 4096]
    - [29, 22677.0]
  - - [1024, 30522, 1, 385, 1024, 1024, 1024, 30522]
    - [14, 22919.0]
  - - [4096, 1024, 1, 2560, 4096, 4096, 4096, 1024]
    - [9, 23021.0]
  - - [1024, 4096, 1, 3072, 1024, 1024, 1024, 4096]
    - [2, 22855.0]
  - - [1024, 30522, 1, 462, 1024, 1024, 1024, 30522]
    - [14, 23039.0]
  - - [4096, 1024, 1, 3072, 4096, 4096, 4096, 1024]
    - [2, 23000.0]
  - - [1024, 4096, 1, 1024, 1024, 1024, 1024, 4096]
    - [14, 22155.0]
  - - [1024, 30522, 1, 160, 1024, 1024, 1024, 30522]
    - [14, 21931.0]
  - - [4096, 1024, 1, 1024, 4096, 4096, 4096, 1024]
    - [9, 22596.0]
  - - [1024, 4096, 1, 1152, 1024, 1024, 1024, 4096]
    - [29, 22717.0]
  - - [1024, 30522, 1, 180, 1024, 1024, 1024, 30522]
    - [29, 21841.0]
  - - [4096, 1024, 1, 1152, 4096, 4096, 4096, 1024]
    - [9, 22715.0]
  - - [1024, 4096, 1, 8192, 1024, 1024, 1024, 4096]
    - [9, 23165.0]
  - - [1024, 4096, 1, 9600, 1024, 1024, 1024, 4096]
    - [29, 23207.0]
  - - [1024, 33712, 1, 8192, 1024, 1024, 1024, 33712]
    - [24, 24030.0]
  - - [1024, 33712, 1, 9600, 1024, 1024, 1024, 33712]
    - [2, 24031.0]
  - - [4096, 1024, 1, 8192, 4096, 4096, 4096, 1024]
    - [2, 23122.0]
  - - [4096, 1024, 1, 9600, 4096, 4096, 4096, 1024]
    - [2, 23169.0]
  - - [1024, 1600, 1, 1, 1024, 1024, 1024, 1600]
    - [13, 246.0]
  - - [2560, 1920, 1, 2048, 2560, 2560, 2560, 1920]
    - [24, 23359.0]
  - - [1024, 3072, 1, 4096, 1024, 1024, 1024, 3072]
    - [9, 22308.0]
  - - [2560, 2560, 1, 2048, 2560, 2560, 2560, 2560]
    - [19, 23584.0]
  - - [2048, 2048, 1, 2, 2048, 2048, 2048, 2048]
    - [1, 639.0]
  - - [1024, 30592, 1, 2048, 1024, 1024, 1024, 30592]
    - [2, 24011.0]
  - - [1024, 3072, 1, 16384, 1024, 1024, 1024, 3072]
    - [2, 22444.0]
  - - [6144, 1536, 1, 4096, 6144, 6144, 6144, 1536]
    - [2, 23703.0]
  - - [1536, 4608, 1, 8192, 1536, 1536, 1536, 4608]
    - [29, 23439.0]
  - - [640, 2560, 1, 2048, 640, 640, 640, 2560]
    - [9, 21419.0]
  - - [1024, 4096, 1, 16384, 1024, 1024, 1024, 4096]
    - [29, 23227.0]
  - - [1536, 6144, 1, 4096, 1536, 1536, 1536, 6144]
    - [2, 23736.0]
  - - [1024, 30592, 1, 4096, 1024, 1024, 1024, 30592]
    - [29, 24106.0]
  - - [2560, 2560, 1, 4, 2560, 2560, 2560, 2560]
    - [15, 1736.0]
  - - [1536, 1536, 1, 4096, 1536, 1536, 1536, 1536]
    - [2, 20883.0]
  - - [2560, 7680, 1, 2048, 2560, 2560, 2560, 7680]
    - [24, 23986.0]
  - - [1536, 50304, 1, 4096, 1536, 1536, 1536, 50304]
    - [9, 24179.0]
  - - [2048, 8192, 1, 1024, 2048, 2048, 2048, 8192]
    - [14, 23492.0]
  - - [1024, 30592, 1, 8192, 1024, 1024, 1024, 30592]
    - [24, 24092.0]
  - - [4096, 1024, 1, 16384, 4096, 4096, 4096, 1024]
    - [24, 23297.0]
  - - [8192, 2048, 1, 1024, 8192, 8192, 8192, 2048]
    - [19, 23609.0]
  - - [1024, 50304, 1, 4096, 1024, 1024, 1024, 50304]
    - [2, 24136.0]
  - - [1536, 4608, 1, 4096, 1536, 1536, 1536, 4608]
    - [2, 23433.0]
  - - [6144, 1536, 1, 8192, 6144, 6144, 6144, 1536]
    - [24, 23812.0]
  - - [1024, 3072, 1, 8192, 1024, 1024, 1024, 3072]
    - [2, 22356.0]
  - - [1536, 1536, 1, 8192, 1536, 1536, 1536, 1536]
    - [9, 20914.0]
  - - [1536, 50304, 1, 8192, 1536, 1536, 1536, 50304]
    - [2, 23840.0]
  - - [2048, 6144, 1, 1024, 2048, 2048, 2048, 6144]
    - [2, 23331.0]
  - - [2048, 30592, 1, 1024, 2048, 2048, 2048, 30592]
    - [14, 23975.0]
  - - [1536, 6144, 1, 8192, 1536, 1536, 1536, 6144]
    - [24, 23765.0]
  - - [1024, 50304, 1, 2048, 1024, 1024, 1024, 50304]
    - [29, 24097.0]
  - - [1024, 50304, 1, 8192, 1024, 1024, 1024, 50304]
    - [0, 23653.0]
  - - [1024, 3072, 1, 2048, 1024, 1024, 1024, 3072]
    - [2, 21918.0]
  - - [1024, 50304, 1, 16384, 1024, 1024, 1024, 50304]
    - [14, 23906.0]
  - - [1024, 30528, 1, 8192, 1024, 1024, 1024, 30528]
    - [9, 23994.0]
  - - [256, 6912, 1, 1, 256, 256, 256, 6912]
    - [3, 140.0]
  - - [30528, 1024, 1, 640, 30528, 30528, 30528, 1024]
    - [19, 23554.0]
  - - [30528, 1024, 1, 1280, 30528, 30528, 30528, 1024]
    - [14, 23837.0]
  - - [4096, 1024, 1, 10240, 4096, 4096, 4096, 1024]
    - [19, 23206.0]
  - - [1024, 4096, 1, 10240, 1024, 1024, 1024, 4096]
    - [9, 23147.0]
  - - [30528, 1024, 1, 1600, 30528, 30528, 30528, 1024]
    - [29, 23874.0]
  - - [1024, 4096, 1, 10496, 1024, 1024, 1024, 4096]
    - [2, 23169.0]
  - - [30528, 1024, 1, 1640, 30528, 30528, 30528, 1024]
    - [14, 23797.0]
  - - [4096, 1024, 1, 10496, 4096, 4096, 4096, 1024]
    - [29, 23198.0]
  - - [30528, 1024, 1, 160, 30528, 30528, 30528, 1024]
    - [14, 22065.0]
  - - [1024, 4096, 1, 6144, 1024, 1024, 1024, 4096]
    - [2, 23153.0]
  - - [30528, 1024, 1, 240, 30528, 30528, 30528, 1024]
    - [19, 22792.0]
  - - [4096, 1024, 1, 6144, 4096, 4096, 4096, 1024]
    - [2, 23119.0]
  - - [1024, 4096, 1, 10224, 1024, 1024, 1024, 4096]
    - [24, 23219.0]
  - - [4096, 1024, 1, 10224, 4096, 4096, 4096, 1024]
    - [14, 23232.0]
  - - [1024, 3072, 1, 10224, 1024, 1024, 1024, 3072]
    - [14, 22463.0]
  - - [1024, 3072, 1, 10240, 1024, 1024, 1024, 3072]
    - [24, 22083.0]
  - - [4096, 1024, 1, 10192, 4096, 4096, 4096, 1024]
    - [19, 23239.0]
  - - [1024, 3072, 1, 10192, 1024, 1024, 1024, 3072]
    - [2, 22492.0]
  - - [1024, 4096, 1, 10192, 1024, 1024, 1024, 4096]
    - [14, 23199.0]
  - - [1024, 3072, 1, 10200, 1024, 1024, 1024, 3072]
    - [2, 22474.0]
  - - [4096, 1024, 1, 10208, 4096, 4096, 4096, 1024]
    - [19, 23188.0]
  - - [1024, 3072, 1, 10208, 1024, 1024, 1024, 3072]
    - [2, 22535.0]
  - - [1024, 4096, 1, 10208, 1024, 1024, 1024, 4096]
    - [29, 23211.0]
  - - [1024, 2048, 1, 10224, 1024, 1024, 1024, 2048]
    - [2, 21160.0]
  - - [1024, 2048, 1, 10240, 1024, 1024, 1024, 2048]
    - [14, 21011.0]
  - - [1024, 2048, 1, 10192, 1024, 1024, 1024, 2048]
    - [2, 21035.0]
  - - [1024, 3072, 1, 10080, 1024, 1024, 1024, 3072]
    - [24, 22046.0]
  - - [100352, 256, 1, 512, 100352, 100352, 100352, 256]
    - [24, 23355.0]
  - - [12544, 1024, 1, 2048, 12544, 12544, 12544, 1024]
    - [2, 23546.0]
  - - [12544, 147, 1, 64, 12544, 12544, 12544, 147]
    - [23, 9721.0]
  - - [200704, 256, 1, 512, 200704, 200704, 200704, 256]
    - [29, 23656.0]
  - - [25088, 512, 1, 1024, 25088, 25088, 25088, 512]
    - [2, 23352.0]
  - - [3136, 576, 1, 64, 3136, 3136, 3136, 576]
    - [8, 12457.0]
  - - [50176, 512, 1, 1024, 50176, 50176, 50176, 512]
    - [14, 23768.0]
  - - [6272, 1024, 1, 2048, 6272, 6272, 6272, 1024]
    - [2, 23166.0]
  - - [3136, 256, 128, 128, 3136, 3136, 3136, 256]
    - [9, 21715.0]
  - - [3136, 256, 256, 128, 3136, 3136, 3136, 256]
    - [19, 21922.0]
  - - [784, 512, 128, 256, 784, 784, 784, 512]
    - [2, 20077.0]
  - - [784, 512, 256, 256, 784, 784, 784, 512]
    - [19, 20211.0]
  - - [30528, 1024, 1, 2560, 30528, 30528, 30528, 1024]
    - [24, 23953.0]
  - - [1024, 4096, 1, 12288, 1024, 1024, 1024, 4096]
    - [29, 23262.0]
  - - [30528, 1024, 1, 1920, 30528, 30528, 30528, 1024]
    - [24, 23910.0]
  - - [4096, 1024, 1, 12288, 4096, 4096, 4096, 1024]
    - [29, 23276.0]
  - - [25600, 128, 25, 128, 25600, 25600, 25600, 128]
    - [2, 20621.0]
  - - [12544, 128, 36, 128, 12544, 12544, 12544, 128]
    - [16, 21289.0]
  - - [9216, 128, 49, 128, 9216, 9216, 9216, 128]
    - [21, 20785.0]
  - - [6400, 128, 64, 128, 6400, 6400, 6400, 128]
    - [16, 21402.0]
  - - [6400, 256, 25, 256, 6400, 6400, 6400, 256]
    - [2, 23140.0]
  - - [4096, 256, 36, 256, 4096, 4096, 4096, 256]
    - [2, 23024.0]
  - - [2304, 256, 49, 256, 2304, 2304, 2304, 256]
    - [2, 22912.0]
  - - [2304, 256, 64, 256, 2304, 2304, 2304, 256]
    - [9, 23086.0]
  - - [2304, 512, 25, 512, 2304, 2304, 2304, 512]
    - [2, 23551.0]
  - - [1024, 512, 36, 512, 1024, 1024, 1024, 512]
    - [2, 23339.0]
  - - [1024, 512, 49, 512, 1024, 1024, 1024, 512]
    - [2, 23466.0]
  - - [1024, 512, 64, 512, 1024, 1024, 1024, 512]
    - [2, 23570.0]
  - - [3072, 768, 1, 2048, 3072, 3072, 3072, 768]
    - [9, 20647.0]
  - - [768, 3072, 1, 2048, 768, 768, 768, 3072]
    - [14, 20720.0]
  - - [3072, 768, 1, 4608, 3072, 3072, 3072, 768]
    - [9, 20955.0]
  - - [768, 3072, 1, 4608, 768, 768, 768, 3072]
    - [19, 20825.0]
  - - [4096, 1024, 1, 4608, 4096, 4096, 4096, 1024]
    - [2, 23160.0]
  - - [1024, 4096, 1, 4608, 1024, 1024, 1024, 4096]
    - [29, 22950.0]
  - - [196, 1024, 128, 512, 196, 196, 196, 1024]
    - [29, 17614.0]
  - - [196, 1024, 256, 512, 196, 196, 196, 1024]
    - [29, 17775.0]
  - - [4880, 256, 49, 256, 4880, 4880, 4880, 256]
    - [19, 22596.0]
  - - [3128, 256, 64, 256, 3128, 3128, 3128, 256]
    - [14, 22520.0]
  - - [4680, 256, 49, 256, 4680, 4680, 4680, 256]
    - [24, 22800.0]
  - - [5280, 256, 36, 256, 5280, 5280, 5280, 256]
    - [2, 22619.0]
  - - [2640, 256, 64, 256, 2640, 2640, 2640, 256]
    - [24, 22482.0]
  - - [5304, 256, 49, 256, 5304, 5304, 5304, 256]
    - [2, 22797.0]
  - - [2760, 256, 64, 256, 2760, 2760, 2760, 256]
    - [9, 22455.0]
  - - [6440, 256, 36, 256, 6440, 6440, 6440, 256]
    - [24, 22782.0]
  - - [5704, 256, 36, 256, 5704, 5704, 5704, 256]
    - [9, 22793.0]
  - - [2128, 256, 64, 256, 2128, 2128, 2128, 256]
    - [2, 22337.0]
  - - [1160, 256, 49, 256, 1160, 1160, 1160, 256]
    - [2, 20153.0]
  - - [4056, 256, 49, 256, 4056, 4056, 4056, 256]
    - [2, 22755.0]
  - - [6144, 256, 36, 256, 6144, 6144, 6144, 256]
    - [2, 23168.0]
  - - [6336, 256, 36, 256, 6336, 6336, 6336, 256]
    - [9, 22911.0]
  - - [13600, 512, 2, 128, 13600, 13600, 13600, 512]
    - [9, 20575.0]
  - - [15200, 512, 2, 128, 15200, 15200, 15200, 512]
    - [2, 21208.0]
  - - [15200, 128, 2, 512, 15200, 15200, 15200, 128]
    - [9, 21363.0]
  - - [13600, 128, 2, 512, 13600, 13600, 13600, 128]
    - [2, 20762.0]
  - - [5632, 256, 36, 256, 5632, 5632, 5632, 256]
    - [14, 23163.0]
  - - [12288, 128, 2, 512, 12288, 12288, 12288, 128]
    - [2, 21076.0]
  - - [12880, 128, 2, 512, 12880, 12880, 12880, 128]
    - [2, 19681.0]
  - - [11408, 128, 2, 512, 11408, 11408, 11408, 128]
    - [2, 20681.0]
  - - [13824, 512, 2, 128, 13824, 13824, 13824, 512]
    - [24, 21418.0]
  - - [13824, 128, 2, 512, 13824, 13824, 13824, 128]
    - [24, 21931.0]
  - - [10560, 128, 2, 512, 10560, 10560, 10560, 128]
    - [29, 19364.0]
  - - [10752, 128, 2, 512, 10752, 10752, 10752, 128]
    - [29, 20811.0]
  - - [13600, 512, 2, 256, 13600, 13600, 13600, 512]
    - [2, 22316.0]
  - - [15200, 512, 2, 256, 15200, 15200, 15200, 512]
    - [9, 22345.0]
  - - [768, 2048, 2, 512, 768, 768, 768, 2048]
    - [2, 21418.0]
  - - [12880, 512, 2, 128, 12880, 12880, 12880, 512]
    - [29, 20291.0]
  - - [11616, 128, 2, 512, 11616, 11616, 11616, 128]
    - [29, 19258.0]
  - - [14208, 512, 2, 128, 14208, 14208, 14208, 512]
    - [19, 21524.0]
  - - [11408, 512, 2, 128, 11408, 11408, 11408, 512]
    - [29, 20103.0]
  - - [6912, 256, 36, 256, 6912, 6912, 6912, 256]
    - [29, 23259.0]
  - - [13824, 512, 2, 256, 13824, 13824, 13824, 512]
    - [19, 22389.0]
  - - [11616, 512, 2, 128, 11616, 11616, 11616, 512]
    - [24, 20420.0]
  - - [12288, 512, 2, 128, 12288, 12288, 12288, 512]
    - [2, 21395.0]
  - - [14208, 128, 2, 512, 14208, 14208, 14208, 128]
    - [2, 21024.0]
  - - [11968, 128, 2, 512, 11968, 11968, 11968, 128]
    - [2, 19958.0]
  - - [864, 2048, 2, 512, 864, 864, 864, 2048]
    - [2, 19947.0]
  - - [10560, 512, 2, 128, 10560, 10560, 10560, 512]
    - [5, 20159.0]
  - - [672, 2048, 2, 512, 672, 672, 672, 2048]
    - [14, 18307.0]
  - - [9408, 128, 2, 512, 9408, 9408, 9408, 128]
    - [2, 19041.0]
  - - [10752, 512, 2, 128, 10752, 10752, 10752, 512]
    - [19, 20266.0]
  - - [11968, 512, 2, 128, 11968, 11968, 11968, 512]
    - [29, 19463.0]
  - - [1240, 256, 49, 256, 1240, 1240, 1240, 256]
    - [14, 21459.0]
  - - [4032, 256, 2, 1024, 4032, 4032, 4032, 256]
    - [2, 19508.0]
  - - [888, 2048, 2, 512, 888, 888, 888, 2048]
    - [2, 20532.0]
  - - [12880, 512, 2, 256, 12880, 12880, 12880, 512]
    - [19, 21316.0]
  - - [12288, 512, 2, 256, 12288, 12288, 12288, 512]
    - [14, 21889.0]
  - - [13440, 128, 2, 512, 13440, 13440, 13440, 128]
    - [9, 20696.0]
  - - [864, 2048, 2, 256, 864, 864, 864, 2048]
    - [9, 17778.0]
  - - [12672, 128, 2, 512, 12672, 12672, 12672, 128]
    - [14, 21094.0]
  - - [11264, 128, 2, 512, 11264, 11264, 11264, 128]
    - [2, 20912.0]
  - - [11776, 128, 2, 512, 11776, 11776, 11776, 128]
    - [2, 19809.0]
  - - [16128, 128, 2, 512, 16128, 16128, 16128, 128]
    - [29, 21237.0]
  - - [4032, 1024, 2, 256, 4032, 4032, 4032, 1024]
    - [2, 20656.0]
  - - [14000, 128, 2, 512, 14000, 14000, 14000, 128]
    - [2, 20335.0]
  - - [13440, 512, 2, 128, 13440, 13440, 13440, 512]
    - [29, 20774.0]
  - - [768, 2048, 2, 256, 768, 768, 768, 2048]
    - [24, 19119.0]
  - - [3264, 1024, 2, 256, 3264, 3264, 3264, 1024]
    - [2, 20514.0]
  - - [4200, 256, 2, 1024, 4200, 4200, 4200, 256]
    - [24, 19608.0]
  - - [2352, 1024, 2, 256, 2352, 2352, 2352, 1024]
    - [2, 18769.0]
  - - [2400, 1024, 2, 256, 2400, 2400, 2400, 1024]
    - [9, 19152.0]
  - - [15200, 256, 2, 12, 15200, 15200, 15200, 256]
    - [8, 4288.0]
  - - [12880, 256, 2, 12, 12880, 12880, 12880, 256]
    - [23, 4310.0]
  - - [2520, 1024, 2, 256, 2520, 2520, 2520, 1024]
    - [24, 19976.0]
  - - [13600, 256, 2, 12, 13600, 13600, 13600, 256]
    - [1, 4536.0]
  - - [15200, 256, 2, 3, 15200, 15200, 15200, 256]
    - [1, 1205.0]
  - - [12880, 256, 2, 3, 12880, 12880, 12880, 256]
    - [8, 1136.0]
  - - [4200, 1024, 2, 256, 4200, 4200, 4200, 1024]
    - [2, 20692.0]
  - - [12288, 256, 2, 12, 12288, 12288, 12288, 256]
    - [23, 4410.0]
  - - [13824, 256, 2, 12, 13824, 13824, 13824, 256]
    - [20, 4973.0]
  - - [13600, 256, 2, 3, 13600, 13600, 13600, 256]
    - [1, 1163.0]
  - - [7600, 512, 1, 256, 7600, 7600, 7600, 512]
    - [2, 18774.0]
  - - [6144, 512, 1, 256, 6144, 6144, 6144, 512]
    - [14, 19011.0]
  - - [12544, 1024, 1, 1024, 12544, 12544, 12544, 1024]
    - [14, 23414.0]
  - - [3800, 256, 2, 3, 3800, 3800, 3800, 256]
    - [1, 829.0]
  - - [13824, 256, 2, 3, 13824, 13824, 13824, 256]
    - [31, 1017.0]
  - - [12288, 256, 2, 3, 12288, 12288, 12288, 256]
    - [8, 917.0]
  - - [2688, 256, 2, 1024, 2688, 2688, 2688, 256]
    - [2, 18432.0]
  - - [3072, 256, 2, 12, 3072, 3072, 3072, 256]
    - [15, 3457.0]
  - - [3800, 256, 2, 12, 3800, 3800, 3800, 256]
    - [1, 2417.0]
  - - [3072, 256, 2, 3, 3072, 3072, 3072, 256]
    - [27, 605.0]
  - - [2520, 256, 2, 1024, 2520, 2520, 2520, 256]
    - [29, 19820.0]
  - - [16128, 512, 2, 128, 16128, 16128, 16128, 512]
    - [14, 20852.0]
  - - [2400, 256, 2, 1024, 2400, 2400, 2400, 256]
    - [14, 18831.0]
  - - [2352, 256, 2, 1024, 2352, 2352, 2352, 256]
    - [27, 18070.0]
  - - [2944, 256, 2, 1024, 2944, 2944, 2944, 256]
    - [9, 19518.0]
  - - [2992, 1024, 2, 256, 2992, 2992, 2992, 1024]
    - [5, 19643.0]
  - - [2816, 256, 2, 1024, 2816, 2816, 2816, 256]
    - [2, 19021.0]
  - - [2904, 1024, 2, 256, 2904, 2904, 2904, 1024]
    - [2, 19850.0]
  - - [3456, 256, 2, 3, 3456, 3456, 3456, 256]
    - [1, 665.0]
  - - [3400, 256, 2, 3, 3400, 3400, 3400, 256]
    - [23, 610.0]
  - - [2816, 1024, 2, 256, 2816, 2816, 2816, 1024]
    - [29, 20719.0]
  - - [3456, 256, 2, 12, 3456, 3456, 3456, 256]
    - [25, 2469.0]
  - - [2944, 1024, 2, 256, 2944, 2944, 2944, 1024]
    - [14, 20718.0]
  - - [3168, 256, 2, 1024, 3168, 3168, 3168, 256]
    - [9, 20633.0]
  - - [2992, 256, 2, 1024, 2992, 2992, 2992, 256]
    - [9, 19560.0]
  - - [51520, 256, 2, 12, 51520, 51520, 51520, 256]
    - [30, 7957.0]
  - - [3072, 256, 2, 1024, 3072, 3072, 3072, 256]
    - [14, 19570.0]
  - - [2640, 1024, 2, 256, 2640, 2640, 2640, 1024]
    - [2, 19853.0]
  - - [2688, 1024, 2, 256, 2688, 2688, 2688, 1024]
    - [29, 20780.0]
  - - [2904, 256, 2, 1024, 2904, 2904, 2904, 256]
    - [19, 18631.0]
  - - [3264, 256, 2, 1024, 3264, 3264, 3264, 256]
    - [14, 18132.0]
  - - [54400, 256, 2, 12, 54400, 54400, 54400, 256]
    - [23, 8870.0]
  - - [55296, 256, 2, 3, 55296, 55296, 55296, 256]
    - [23, 2117.0]
  - - [60800, 256, 2, 12, 60800, 60800, 60800, 256]
    - [18, 8432.0]
  - - [51520, 256, 2, 3, 51520, 51520, 51520, 256]
    - [22, 2257.0]
  - - [55296, 256, 2, 12, 55296, 55296, 55296, 256]
    - [15, 7875.0]
  - - [3600, 1024, 2, 256, 3600, 3600, 3600, 1024]
    - [24, 19897.0]
  - - [60800, 256, 2, 3, 60800, 60800, 60800, 256]
    - [13, 2640.0]
  - - [952, 256, 64, 256, 952, 952, 952, 256]
    - [29, 20536.0]
  - - [49152, 256, 2, 12, 49152, 49152, 49152, 256]
    - [28, 6161.0]
  - - [3360, 256, 2, 1024, 3360, 3360, 3360, 256]
    - [2, 18983.0]
  - - [736, 256, 64, 256, 736, 736, 736, 256]
    - [2, 20977.0]
  - - [600, 256, 64, 256, 600, 600, 600, 256]
    - [2, 20357.0]
  - - [1440, 256, 49, 256, 1440, 1440, 1440, 256]
    - [24, 21109.0]
  - - [3168, 1024, 2, 256, 3168, 3168, 3168, 1024]
    - [2, 21376.0]
  - - [1368, 256, 49, 256, 1368, 1368, 1368, 256]
    - [14, 21634.0]
  - - [49152, 256, 2, 3, 49152, 49152, 49152, 256]
    - [13, 1610.0]
  - - [3600, 256, 2, 1024, 3600, 3600, 3600, 256]
    - [2, 20414.0]
  - - [3360, 1024, 2, 256, 3360, 3360, 3360, 1024]
    - [9, 20843.0]
  - - [54400, 256, 2, 3, 54400, 54400, 54400, 256]
    - [23, 2139.0]
  - - [3072, 1024, 2, 256, 3072, 3072, 3072, 1024]
    - [2, 21406.0]
  - - [2640, 256, 2, 1024, 2640, 2640, 2640, 256]
    - [2, 17596.0]
  - - [616, 256, 64, 256, 616, 616, 616, 256]
    - [24, 20965.0]
  - - [3008, 256, 64, 256, 3008, 3008, 3008, 256]
    - [9, 22478.0]
  - - [896, 256, 64, 256, 896, 896, 896, 256]
    - [14, 22574.0]
  - - [768, 256, 64, 256, 768, 768, 768, 256]
    - [14, 22488.0]
  - - [3552, 256, 2, 1024, 3552, 3552, 3552, 256]
    - [2, 20291.0]
  - - [3552, 1024, 2, 256, 3552, 3552, 3552, 1024]
    - [2, 21356.0]
  - - [800, 256, 64, 256, 800, 800, 800, 256]
    - [24, 19923.0]
  - - [1120, 256, 49, 256, 1120, 1120, 1120, 256]
    - [2, 21568.0]
  - - [2408, 256, 64, 256, 2408, 2408, 2408, 256]
    - [24, 22652.0]
  - - [3456, 256, 2, 1024, 3456, 3456, 3456, 256]
    - [2, 19785.0]
  - - [672, 256, 64, 256, 672, 672, 672, 256]
    - [2, 19266.0]
  - - [3456, 1024, 2, 256, 3456, 3456, 3456, 1024]
    - [24, 22027.0]
  - - [1064, 256, 49, 256, 1064, 1064, 1064, 256]
    - [19, 20487.0]
  - - [3400, 256, 2, 1024, 3400, 3400, 3400, 256]
    - [9, 19275.0]
  - - [704, 256, 64, 256, 704, 704, 704, 256]
    - [2, 20082.0]
  - - [3400, 1024, 2, 256, 3400, 3400, 3400, 1024]
    - [16, 21121.0]
  - - [3264, 256, 64, 256, 3264, 3264, 3264, 256]
    - [2, 22614.0]
  - - [3800, 1024, 2, 256, 3800, 3800, 3800, 1024]
    - [2, 21455.0]
  - - [3800, 256, 2, 1024, 3800, 3800, 3800, 256]
    - [2, 21520.0]
  - - [6440, 512, 1, 256, 6440, 6440, 6440, 512]
    - [2, 18867.0]
  - - [6912, 512, 1, 256, 6912, 6912, 6912, 512]
    - [2, 20991.0]
  - - [6800, 512, 1, 256, 6800, 6800, 6800, 512]
    - [2, 19693.0]
  - - [6800, 512, 1, 1024, 6800, 6800, 6800, 512]
    - [29, 21310.0]
  - - [6440, 512, 1, 1024, 6440, 6440, 6440, 512]
    - [14, 20141.0]
  - - [6912, 512, 1, 1024, 6912, 6912, 6912, 512]
    - [24, 22022.0]
  - - [1728, 1024, 1, 512, 1728, 1728, 1728, 1024]
    - [4, 17681.0]
  - - [1536, 1024, 1, 512, 1536, 1536, 1536, 1024]
    - [19, 18685.0]
  - - [7600, 512, 1, 1024, 7600, 7600, 7600, 512]
    - [24, 21812.0]
  - - [6144, 512, 1, 1024, 6144, 6144, 6144, 512]
    - [29, 21458.0]
  - - [1728, 1024, 1, 2048, 1728, 1728, 1728, 1024]
    - [14, 19521.0]
  - - [1536, 1024, 1, 2048, 1536, 1536, 1536, 1024]
    - [14, 20790.0]
  - - [4524, 256, 49, 256, 4524, 4524, 4524, 256]
    - [29, 22611.0]
  - - [2666, 256, 64, 256, 2666, 2666, 2666, 256]
    - [2, 22721.0]
  - - [950, 2048, 2, 512, 950, 950, 950, 2048]
    - [2, 19987.0]
  - - [3220, 1024, 2, 256, 3220, 3220, 3220, 1024]
    - [19, 20827.0]
  - - [782, 128, 64, 128, 782, 782, 782, 128]
    - [9, 17299.0]
  - - [850, 2048, 2, 512, 850, 850, 850, 2048]
    - [24, 19593.0]
  - - [805, 2048, 2, 512, 805, 805, 805, 2048]
    - [2, 18720.0]
  - - [713, 2048, 2, 512, 713, 713, 713, 2048]
    - [9, 19334.0]
  - - [660, 2048, 2, 512, 660, 660, 660, 2048]
    - [14, 18022.0]
  - - [726, 2048, 2, 512, 726, 726, 726, 2048]
    - [2, 19630.0]
  - - [805, 2048, 2, 256, 805, 805, 805, 2048]
    - [29, 17505.0]
  - - [1251, 256, 49, 256, 1251, 1251, 1251, 256]
    - [2, 21582.0]
  - - [1900, 1024, 1, 2048, 1900, 1900, 1900, 1024]
    - [2, 21703.0]
  - - [1610, 1024, 1, 2048, 1610, 1610, 1610, 1024]
    - [2, 18463.0]
  - - [1900, 1024, 1, 512, 1900, 1900, 1900, 1024]
    - [6, 19411.0]
  - - [3220, 256, 2, 12, 3220, 3220, 3220, 256]
    - [15, 1910.0]
  - - [3220, 256, 2, 3, 3220, 3220, 3220, 256]
    - [3, 565.0]
  - - [3036, 1024, 2, 256, 3036, 3036, 3036, 1024]
    - [2, 20200.0]
  - - [3036, 256, 2, 1024, 3036, 3036, 3036, 256]
    - [9, 19229.0]
  - - [850, 2048, 2, 256, 850, 850, 850, 2048]
    - [30, 17594.0]
  - - [2852, 1024, 2, 256, 2852, 2852, 2852, 1024]
    - [2, 20422.0]
  - - [950, 2048, 2, 256, 950, 950, 950, 2048]
    - [12, 19105.0]
  - - [3700, 1024, 2, 256, 3700, 3700, 3700, 1024]
    - [14, 21099.0]
  - - [2852, 256, 2, 1024, 2852, 2852, 2852, 256]
    - [29, 18728.0]
  - - [3700, 256, 2, 1024, 3700, 3700, 3700, 256]
    - [9, 20615.0]
  - - [1269, 256, 49, 256, 1269, 1269, 1269, 256]
    - [24, 21961.0]
  - - [1467, 256, 49, 256, 1467, 1467, 1467, 256]
    - [14, 21413.0]
  - - [3500, 256, 2, 1024, 3500, 3500, 3500, 256]
    - [5, 19463.0]
  - - [1449, 256, 49, 256, 1449, 1449, 1449, 256]
    - [9, 21133.0]
  - - [1278, 256, 49, 256, 1278, 1278, 1278, 256]
    - [2, 21935.0]
  - - [1413, 256, 49, 256, 1413, 1413, 1413, 256]
    - [24, 20712.0]
  - - [1341, 256, 49, 256, 1341, 1341, 1341, 256]
    - [24, 21527.0]
  - - [1287, 256, 49, 256, 1287, 1287, 1287, 256]
    - [19, 20359.0]
  - - [1332, 256, 49, 256, 1332, 1332, 1332, 256]
    - [2, 21177.0]
  - - [1359, 256, 49, 256, 1359, 1359, 1359, 256]
    - [2, 21622.0]
  - - [1395, 256, 49, 256, 1395, 1395, 1395, 256]
    - [24, 22046.0]
  - - [1323, 256, 49, 256, 1323, 1323, 1323, 256]
    - [2, 20997.0]
  - - [1404, 256, 49, 256, 1404, 1404, 1404, 256]
    - [2, 22182.0]
  - - [1386, 256, 49, 256, 1386, 1386, 1386, 256]
    - [2, 21938.0]
  - - [1350, 256, 49, 256, 1350, 1350, 1350, 256]
    - [2, 21371.0]
  - - [3500, 1024, 2, 256, 3500, 3500, 3500, 1024]
    - [9, 20914.0]
  - - [3220, 256, 2, 1024, 3220, 3220, 3220, 256]
    - [14, 17827.0]
  - - [690, 256, 64, 256, 690, 690, 690, 256]
    - [2, 19866.0]
  - - [660, 256, 64, 256, 660, 660, 660, 256]
    - [2, 18891.0]
  - - [782, 256, 64, 256, 782, 782, 782, 256]
    - [14, 19484.0]
  - - [884, 256, 64, 256, 884, 884, 884, 256]
    - [2, 21960.0]
  - - [1610, 1024, 1, 512, 1610, 1610, 1610, 1024]
    - [2, 17368.0]
  - - [1700, 1024, 1, 512, 1700, 1700, 1700, 1024]
    - [2, 18377.0]
  - - [1700, 1024, 1, 2048, 1700, 1700, 1700, 1024]
    - [9, 19615.0]
  - - [1444, 128, 120, 256, 1444, 1444, 1444, 128]
    - [19, 20994.0]
  - - [1444, 128, 18, 256, 1444, 1444, 1444, 128]
    - [2, 18621.0]
  - - [1444, 128, 19, 256, 1444, 1444, 1444, 128]
    - [2, 18943.0]
  - - [1444, 256, 120, 256, 1444, 1444, 1444, 256]
    - [19, 21496.0]
  - - [1444, 256, 18, 256, 1444, 1444, 1444, 256]
    - [24, 19890.0]
  - - [1444, 256, 19, 256, 1444, 1444, 1444, 256]
    - [24, 20312.0]
  - - [361, 512, 120, 256, 361, 361, 361, 512]
    - [9, 20832.0]
  - - [361, 512, 18, 256, 361, 361, 361, 512]
    - [10, 18037.0]
  - - [361, 512, 19, 256, 361, 361, 361, 512]
    - [14, 18567.0]
  - - [1920, 25216, 1, 16384, 1920, 1920, 1920, 25216]
    - [9, 24010.0]
  - - [3840, 1920, 1, 16384, 3840, 3840, 3840, 1920]
    - [9, 23464.0]
  - - [1920, 3840, 1, 16384, 1920, 1920, 1920, 3840]
    - [29, 23447.0]
  - - [960, 1920, 1, 16384, 960, 960, 960, 1920]
    - [9, 21188.0]
  - - [1920, 2880, 1, 16384, 1920, 1920, 1920, 2880]
    - [29, 22370.0]
  - - [1920, 25216, 1, 4096, 1920, 1920, 1920, 25216]
    - [24, 24137.0]
  - - [3840, 1920, 1, 4096, 3840, 3840, 3840, 1920]
    - [2, 23288.0]
  - - [1920, 3840, 1, 4096, 1920, 1920, 1920, 3840]
    - [2, 23348.0]
  - - [960, 1920, 1, 4096, 960, 960, 960, 1920]
    - [14, 20708.0]
  - - [1920, 2880, 1, 4096, 1920, 1920, 1920, 2880]
    - [29, 22169.0]
  - - [1920, 25216, 1, 8192, 1920, 1920, 1920, 25216]
    - [24, 23866.0]
  - - [3840, 1920, 1, 8192, 3840, 3840, 3840, 1920]
    - [2, 23412.0]
  - - [1920, 3840, 1, 8192, 1920, 1920, 1920, 3840]
    - [29, 23428.0]
  - - [960, 1920, 1, 8192, 960, 960, 960, 1920]
    - [2, 21295.0]
  - - [1920, 2880, 1, 8192, 1920, 1920, 1920, 2880]
    - [14, 22021.0]
  - - [2304, 12672, 1, 16384, 2304, 2304, 2304, 12672]
    - [2, 23580.0]
  - - [2304, 2304, 1, 16384, 2304, 2304, 2304, 2304]
    - [29, 22806.0]
  - - [576, 2304, 1, 16384, 576, 576, 576, 2304]
    - [2, 18426.0]
  - - [2304, 1728, 1, 16384, 2304, 2304, 2304, 1728]
    - [24, 22080.0]
  - - [2304, 12672, 1, 4096, 2304, 2304, 2304, 12672]
    - [9, 23999.0]
  - - [2304, 2304, 1, 4096, 2304, 2304, 2304, 2304]
    - [9, 22678.0]
  - - [576, 2304, 1, 4096, 576, 576, 576, 2304]
    - [14, 17789.0]
  - - [2304, 1728, 1, 4096, 2304, 2304, 2304, 1728]
    - [29, 21766.0]
  - - [2304, 12672, 1, 8192, 2304, 2304, 2304, 12672]
    - [29, 24027.0]
  - - [2304, 2304, 1, 8192, 2304, 2304, 2304, 2304]
    - [2, 22779.0]
  - - [576, 2304, 1, 8192, 576, 576, 576, 2304]
    - [24, 18184.0]
  - - [2304, 1728, 1, 8192, 2304, 2304, 2304, 1728]
    - [19, 21905.0]
  - - [3072, 6400, 1, 4096, 3072, 3072, 3072, 6400]
    - [14, 24009.0]
  - - [1536, 3072, 1, 4096, 1536, 1536, 1536, 3072]
    - [2, 22743.0]
  - - [3072, 1536, 1, 4096, 3072, 3072, 3072, 1536]
    - [14, 22556.0]
  - - [384, 3072, 1, 4096, 384, 384, 384, 3072]
    - [29, 19667.0]
  - - [3072, 1152, 1, 4096, 3072, 3072, 3072, 1152]
    - [29, 22712.0]
  - - [3072, 6400, 1, 8192, 3072, 3072, 3072, 6400]
    - [9, 24033.0]
  - - [1536, 3072, 1, 8192, 1536, 1536, 1536, 3072]
    - [2, 22810.0]
  - - [3072, 1536, 1, 8192, 3072, 3072, 3072, 1536]
    - [2, 22812.0]
  - - [384, 3072, 1, 8192, 384, 384, 384, 3072]
    - [14, 20024.0]
  - - [3072, 1152, 1, 8192, 3072, 3072, 3072, 1152]
    - [2, 23047.0]
  - - [2048, 2048, 1, 4096, 2048, 2048, 2048, 2048]
    - [2, 22923.0]
  - - [2048, 2048, 1, 8, 2048, 2048, 2048, 2048]
    - [0, 2980.0]
  - - [2048, 29000, 1, 199, 2048, 2048, 2048, 29000]
    - [19, 22083.0]
  - - [2048, 29000, 1, 221, 2048, 2048, 2048, 29000]
    - [14, 22260.0]
  - - [2048, 29000, 1, 224, 2048, 2048, 2048, 29000]
    - [14, 23054.0]
  - - [2048, 29000, 1, 229, 2048, 2048, 2048, 29000]
    - [14, 22374.0]
  - - [2048, 29000, 1, 234, 2048, 2048, 2048, 29000]
    - [14, 22490.0]
  - - [2048, 29000, 1, 242, 2048, 2048, 2048, 29000]
    - [2, 22605.0]
  - - [2048, 29000, 1, 246, 2048, 2048, 2048, 29000]
    - [9, 22570.0]
  - - [2048, 29000, 1, 247, 2048, 2048, 2048, 29000]
    - [19, 22505.0]
  - - [2048, 29000, 1, 256, 2048, 2048, 2048, 29000]
    - [14, 23147.0]
  - - [2048, 29000, 1, 262, 2048, 2048, 2048, 29000]
    - [14, 22736.0]
  - - [2048, 29000, 1, 264, 2048, 2048, 2048, 29000]
    - [7, 22819.0]
  - - [2048, 29000, 1, 265, 2048, 2048, 2048, 29000]
    - [19, 22532.0]
  - - [2048, 29000, 1, 274, 2048, 2048, 2048, 29000]
    - [9, 22763.0]
  - - [2048, 29000, 1, 277, 2048, 2048, 2048, 29000]
    - [9, 22689.0]
  - - [2048, 29000, 1, 279, 2048, 2048, 2048, 29000]
    - [2, 22697.0]
  - - [2048, 29000, 1, 288, 2048, 2048, 2048, 29000]
    - [14, 23245.0]
  - - [2048, 29000, 1, 296, 2048, 2048, 2048, 29000]
    - [7, 23017.0]
  - - [2048, 29000, 1, 315, 2048, 2048, 2048, 29000]
    - [14, 22813.0]
  - - [2048, 29000, 1, 335, 2048, 2048, 2048, 29000]
    - [14, 22873.0]
  - - [2048, 4096, 1, 4096, 2048, 2048, 2048, 4096]
    - [2, 23518.0]
  - - [4096, 2048, 1, 4096, 4096, 4096, 4096, 2048]
    - [2, 23474.0]
  - - [1024, 29000, 1, 2283, 1024, 1024, 1024, 29000]
    - [24, 23816.0]
  - - [1024, 29000, 1, 2296, 1024, 1024, 1024, 29000]
    - [14, 23838.0]
  - - [1024, 29000, 1, 2306, 1024, 1024, 1024, 29000]
    - [9, 23834.0]
  - - [1024, 29000, 1, 2309, 1024, 1024, 1024, 29000]
    - [14, 23830.0]
  - - [1024, 29000, 1, 2318, 1024, 1024, 1024, 29000]
    - [14, 23818.0]
  - - [1024, 29000, 1, 2320, 1024, 1024, 1024, 29000]
    - [29, 23884.0]
  - - [1024, 29000, 1, 2324, 1024, 1024, 1024, 29000]
    - [14, 23828.0]
  - - [1024, 29000, 1, 2325, 1024, 1024, 1024, 29000]
    - [14, 23825.0]
  - - [1024, 29000, 1, 2329, 1024, 1024, 1024, 29000]
    - [24, 23829.0]
  - - [1024, 29000, 1, 2338, 1024, 1024, 1024, 29000]
    - [19, 23818.0]
  - - [1024, 29000, 1, 2345, 1024, 1024, 1024, 29000]
    - [2, 23813.0]
  - - [1024, 29000, 1, 2350, 1024, 1024, 1024, 29000]
    - [14, 23835.0]
  - - [1024, 29000, 1, 2362, 1024, 1024, 1024, 29000]
    - [24, 23840.0]
  - - [1024, 29000, 1, 2366, 1024, 1024, 1024, 29000]
    - [14, 23827.0]
  - - [1024, 29000, 1, 2368, 1024, 1024, 1024, 29000]
    - [14, 23895.0]
  - - [1024, 29000, 1, 2374, 1024, 1024, 1024, 29000]
    - [14, 23832.0]
  - - [1024, 29000, 1, 2390, 1024, 1024, 1024, 29000]
    - [24, 23835.0]
  - - [1024, 29000, 1, 561, 1024, 1024, 1024, 29000]
    - [29, 23209.0]
  - - [1024, 29000, 1, 574, 1024, 1024, 1024, 29000]
    - [19, 23275.0]
  - - [1024, 29000, 1, 600, 1024, 1024, 1024, 29000]
    - [19, 23325.0]
  - - [1024, 29000, 1, 608, 1024, 1024, 1024, 29000]
    - [9, 23524.0]
  - - [1024, 29000, 1, 615, 1024, 1024, 1024, 29000]
    - [14, 23304.0]
  - - [1024, 29000, 1, 622, 1024, 1024, 1024, 29000]
    - [19, 23309.0]
  - - [1024, 29000, 1, 625, 1024, 1024, 1024, 29000]
    - [14, 23321.0]
  - - [1024, 29000, 1, 626, 1024, 1024, 1024, 29000]
    - [14, 23340.0]
  - - [1024, 29000, 1, 628, 1024, 1024, 1024, 29000]
    - [14, 23344.0]
  - - [1024, 29000, 1, 636, 1024, 1024, 1024, 29000]
    - [9, 23335.0]
  - - [1024, 29000, 1, 651, 1024, 1024, 1024, 29000]
    - [2, 23316.0]
  - - [1024, 29000, 1, 658, 1024, 1024, 1024, 29000]
    - [14, 23402.0]
  - - [1024, 29000, 1, 669, 1024, 1024, 1024, 29000]
    - [14, 23347.0]
  - - [1024, 29000, 1, 670, 1024, 1024, 1024, 29000]
    - [14, 23360.0]
  - - [1024, 29000, 1, 672, 1024, 1024, 1024, 29000]
    - [14, 23576.0]
  - - [1024, 29000, 1, 684, 1024, 1024, 1024, 29000]
    - [14, 23370.0]
  - - [1024, 29000, 1, 716, 1024, 1024, 1024, 29000]
    - [14, 23408.0]
  - - [1024, 29000, 1, 730, 1024, 1024, 1024, 29000]
    - [19, 23419.0]
  - - [2560, 2560, 1, 1024, 2560, 2560, 2560, 2560]
    - [14, 23268.0]
  - - [2560, 2560, 1, 2, 2560, 2560, 2560, 2560]
    - [12, 602.0]
  - - [2560, 29000, 1, 109, 2560, 2560, 2560, 29000]
    - [19, 20354.0]
  - - [2560, 29000, 1, 121, 2560, 2560, 2560, 29000]
    - [14, 20839.0]
  - - [2560, 29000, 1, 27, 2560, 2560, 2560, 29000]
    - [0, 8999.0]
  - - [2560, 29000, 1, 35, 2560, 2560, 2560, 29000]
    - [27, 11181.0]
  - - [2560, 29000, 1, 36, 2560, 2560, 2560, 29000]
    - [31, 11426.0]
  - - [2560, 29000, 1, 39, 2560, 2560, 2560, 29000]
    - [27, 12247.0]
  - - [2560, 29000, 1, 40, 2560, 2560, 2560, 29000]
    - [27, 12551.0]
  - - [2560, 29000, 1, 42, 2560, 2560, 2560, 29000]
    - [27, 12933.0]
  - - [2560, 29000, 1, 43, 2560, 2560, 2560, 29000]
    - [17, 13173.0]
  - - [2560, 29000, 1, 44, 2560, 2560, 2560, 29000]
    - [27, 13444.0]
  - - [2560, 29000, 1, 46, 2560, 2560, 2560, 29000]
    - [15, 13730.0]
  - - [2560, 29000, 1, 48, 2560, 2560, 2560, 29000]
    - [25, 14423.0]
  - - [2560, 29000, 1, 49, 2560, 2560, 2560, 29000]
    - [13, 14560.0]
  - - [2560, 29000, 1, 50, 2560, 2560, 2560, 29000]
    - [18, 14827.0]
  - - [2560, 29000, 1, 51, 2560, 2560, 2560, 29000]
    - [5, 14843.0]
  - - [2560, 29000, 1, 53, 2560, 2560, 2560, 29000]
    - [6, 15377.0]
  - - [2560, 29000, 1, 54, 2560, 2560, 2560, 29000]
    - [18, 15549.0]
  - - [2560, 29000, 1, 55, 2560, 2560, 2560, 29000]
    - [6, 15621.0]
  - - [2560, 29000, 1, 56, 2560, 2560, 2560, 29000]
    - [6, 15810.0]
  - - [2560, 29000, 1, 57, 2560, 2560, 2560, 29000]
    - [3, 15866.0]
  - - [2560, 29000, 1, 58, 2560, 2560, 2560, 29000]
    - [3, 16132.0]
  - - [2560, 29000, 1, 59, 2560, 2560, 2560, 29000]
    - [11, 16045.0]
  - - [2560, 29000, 1, 61, 2560, 2560, 2560, 29000]
    - [18, 16281.0]
  - - [2560, 29000, 1, 63, 2560, 2560, 2560, 29000]
    - [3, 16505.0]
  - - [2560, 29000, 1, 65, 2560, 2560, 2560, 29000]
    - [18, 17748.0]
  - - [2560, 29000, 1, 66, 2560, 2560, 2560, 29000]
    - [18, 17947.0]
  - - [2560, 29000, 1, 67, 2560, 2560, 2560, 29000]
    - [13, 17804.0]
  - - [2560, 29000, 1, 69, 2560, 2560, 2560, 29000]
    - [13, 17931.0]
  - - [2560, 29000, 1, 70, 2560, 2560, 2560, 29000]
    - [13, 18095.0]
  - - [2560, 29000, 1, 71, 2560, 2560, 2560, 29000]
    - [6, 17898.0]
  - - [2560, 29000, 1, 73, 2560, 2560, 2560, 29000]
    - [6, 17972.0]
  - - [2560, 29000, 1, 74, 2560, 2560, 2560, 29000]
    - [6, 18184.0]
  - - [2560, 29000, 1, 75, 2560, 2560, 2560, 29000]
    - [6, 17945.0]
  - - [2560, 29000, 1, 77, 2560, 2560, 2560, 29000]
    - [6, 17932.0]
  - - [2560, 29000, 1, 78, 2560, 2560, 2560, 29000]
    - [6, 18196.0]
  - - [2560, 29000, 1, 80, 2560, 2560, 2560, 29000]
    - [2, 20258.0]
  - - [2560, 29000, 1, 81, 2560, 2560, 2560, 29000]
    - [14, 19024.0]
  - - [2560, 29000, 1, 82, 2560, 2560, 2560, 29000]
    - [14, 19191.0]
  - - [2560, 29000, 1, 83, 2560, 2560, 2560, 29000]
    - [14, 19192.0]
  - - [2560, 29000, 1, 84, 2560, 2560, 2560, 29000]
    - [14, 19307.0]
  - - [2560, 29000, 1, 88, 2560, 2560, 2560, 29000]
    - [14, 19601.0]
  - - [2560, 29000, 1, 89, 2560, 2560, 2560, 29000]
    - [14, 19435.0]
  - - [2560, 29000, 1, 90, 2560, 2560, 2560, 29000]
    - [19, 19632.0]
  - - [2560, 29000, 1, 92, 2560, 2560, 2560, 29000]
    - [14, 19732.0]
  - - [2560, 29000, 1, 95, 2560, 2560, 2560, 29000]
    - [14, 19692.0]
  - - [2560, 29000, 1, 98, 2560, 2560, 2560, 29000]
    - [9, 20342.0]
  - - [2560, 4096, 1, 1024, 2560, 2560, 2560, 4096]
    - [9, 23622.0]
  - - [4096, 2560, 1, 1024, 4096, 4096, 4096, 2560]
    - [19, 23716.0]
  - - [1024, 3072, 1, 32768, 1024, 1024, 1024, 3072]
    - [19, 22573.0]
  - - [1024, 4096, 1, 32768, 1024, 1024, 1024, 4096]
    - [2, 23320.0]
  - - [1024, 50304, 1, 32768, 1024, 1024, 1024, 50304]
    - [2, 24005.0]
  - - [4096, 1024, 1, 32768, 4096, 4096, 4096, 1024]
    - [29, 23300.0]
  - - [1024, 128, 24, 1024, 1024, 1024, 1024, 128]
    - [14, 21709.0]
  - - [128, 1024, 24, 1024, 128, 128, 128, 1024]
    - [24, 21821.0]
  - - [256, 2560, 1, 8976, 256, 256, 256, 2560]
    - [32, 21113.0]
  - - [256, 2816, 1, 8976, 256, 256, 256, 2816]
    - [32, 21155.0]
  - - [256, 3328, 1, 8976, 256, 256, 256, 3328]
    - [36, 20565.0]
  - - [256, 3584, 1, 8976, 256, 256, 256, 3584]
    - [35, 20433.0]
  - - [256, 3840, 1, 8976, 256, 256, 256, 3840]
    - [2, 21395.0]
  - - [256, 4096, 1, 8976, 256, 256, 256, 4096]
    - [35, 20988.0]
  - - [256, 4352, 1, 8976, 256, 256, 256, 4352]
    - [35, 21169.0]
  - - [480, 1024, 1, 32768, 480, 480, 480, 1024]
    - [32, 19284.0]
  - - [1024, 256, 1, 21248, 1024, 1024, 1024, 256]
    - [35, 17325.0]
  - - [1024, 256, 1, 21504, 1024, 1024, 1024, 256]
    - [32, 17145.0]
  - - [1024, 256, 1, 22016, 1024, 1024, 1024, 256]
    - [35, 17105.0]
  - - [1024, 256, 1, 28672, 1024, 1024, 1024, 256]
    - [33, 16900.0]
  - - [1024, 256, 1, 33536, 1024, 1024, 1024, 256]
    - [32, 17524.0]
  - - [1024, 512, 1, 32768, 1024, 1024, 1024, 512]
    - [32, 20365.0]
  - - [1024, 1024, 1, 32768, 1024, 1024, 1024, 1024]
    - [36, 22591.0]
  - - [1024, 1024, 1, 9216, 1024, 1024, 1024, 1024]
    - [32, 21778.0]
  - - [1024, 1024, 1, 9520, 1024, 1024, 1024, 1024]
    - [32, 21670.0]
  - - [1024, 1024, 1, 10064, 1024, 1024, 1024, 1024]
    - [32, 21826.0]
  - - [1024, 1024, 1, 10080, 1024, 1024, 1024, 1024]
    - [32, 21781.0]
  - - [1024, 1024, 1, 10200, 1024, 1024, 1024, 1024]
    - [32, 21926.0]
  - - [479, 1024, 1, 32768, 479, 479, 479, 1024]
    - [32, 19011.0]
  - - [1024, 1024, 1, 8192, 1024, 1024, 1024, 1024]
    - [32, 21453.0]
  - - [1024, 1024, 1, 9600, 1024, 1024, 1024, 1024]
    - [32, 21743.0]
  - - [1024, 1024, 1, 16384, 1024, 1024, 1024, 1024]
    - [32, 22184.0]
  - - [512, 256, 1, 55296, 512, 512, 512, 256]
    - [34, 15439.0]
  - - [1024, 1024, 1, 10240, 1024, 1024, 1024, 1024]
    - [32, 21779.0]
  - - [1024, 1024, 1, 10496, 1024, 1024, 1024, 1024]
    - [32, 21791.0]
  - - [1024, 1024, 1, 10224, 1024, 1024, 1024, 1024]
    - [32, 21927.0]
  - - [1024, 1024, 1, 10192, 1024, 1024, 1024, 1024]
    - [32, 21928.0]
  - - [1024, 1024, 1, 10208, 1024, 1024, 1024, 1024]
    - [32, 21897.0]
  - - [1024, 1024, 1, 10184, 1024, 1024, 1024, 1024]
    - [32, 21834.0]
  - - [1024, 1024, 1, 10120, 1024, 1024, 1024, 1024]
    - [32, 21918.0]
  - - [1024, 1024, 1, 10152, 1024, 1024, 1024, 1024]
    - [32, 21902.0]
  - - [1024, 1024, 1, 12288, 1024, 1024, 1024, 1024]
    - [32, 22085.0]
  - - [64, 5888, 1, 1280, 64, 64, 64, 5888]
    - [49, 11969.0]
  - - [64, 5056, 1, 256, 64, 64, 64, 5056]
    - [38, 10566.0]
  - - [5888, 64, 1, 1280, 5888, 5888, 5888, 64]
    - [56, 13259.0]
  - - [5888, 64, 1, 3328, 5888, 5888, 5888, 64]
    - [52, 13854.0]
  - - [6784, 64, 1, 256, 6784, 6784, 6784, 64]
    - [50, 12108.0]
  - - [64, 6784, 1, 3328, 64, 64, 64, 6784]
    - [49, 14829.0]
  - - [64, 5056, 1, 3328, 64, 64, 64, 5056]
    - [49, 15362.0]
  - - [5056, 64, 1, 1280, 5056, 5056, 5056, 64]
    - [49, 14502.0]
  - - [64, 6784, 1, 1280, 64, 64, 64, 6784]
    - [46, 14077.0]
  - - [64, 6784, 1, 256, 64, 64, 64, 6784]
    - [59, 9325.0]
  - - [64, 5056, 1, 1280, 64, 64, 64, 5056]
    - [55, 13378.0]
  - - [5888, 64, 1, 256, 5888, 5888, 5888, 64]
    - [39, 8447.0]
  - - [64, 5888, 1, 3328, 64, 64, 64, 5888]
    - [67, 12870.0]
  - - [5056, 64, 1, 3328, 5056, 5056, 5056, 64]
    - [41, 15603.0]
  - - [6784, 64, 1, 3328, 6784, 6784, 6784, 64]
    - [68, 15329.0]
  - - [64, 5888, 1, 256, 64, 64, 64, 5888]
    - [43, 8245.0]
  - - [6784, 64, 1, 1280, 6784, 6784, 6784, 64]
    - [60, 14156.0]
  - - [5056, 64, 1, 256, 5056, 5056, 5056, 64]
    - [38, 8218.0]
  - - [1024, 1024, 1, 1024, 1024, 1024, 1024, 1024]
    - [65, 16699.0]
  - - [3136, 64, 128, 64, 3136, 3136, 3136, 64]
    - [49, 17615.0]
  - - [3136, 64, 64, 256, 3136, 3136, 3136, 64]
    - [54, 18818.0]
  - - [3136, 64, 256, 256, 3136, 3136, 3136, 64]
    - [37, 17032.0]
  - - [3136, 64, 128, 256, 3136, 3136, 3136, 64]
    - [58, 17079.0]
  - - [3136, 64, 64, 64, 3136, 3136, 3136, 64]
    - [55, 17491.0]
  - - [3136, 64, 256, 64, 3136, 3136, 3136, 64]
    - [37, 14684.0]
  - - [64, 128, 512, 128, 64, 64, 64, 128]
    - [54, 17860.0]
  - - [64, 512, 64, 512, 64, 64, 64, 512]
    - [58, 20681.0]
  - - [128, 64, 512, 128, 128, 128, 128, 64]
    - [49, 18462.0]
  - - [512, 64, 64, 512, 512, 512, 512, 64]
    - [39, 18622.0]
  - - [1024, 1024, 1, 4, 1024, 1024, 1024, 1024]
    - [48, 1205.0]
  - - [1024, 1024, 1, 32, 1024, 1024, 1024, 1024]
    - [48, 8347.0]
  - - [1024, 1024, 1, 2048, 1024, 1024, 1024, 1024]
    - [39, 17425.0]
  - - [1024, 1024, 1, 4096, 1024, 1024, 1024, 1024]
    - [60, 17605.0]
  - - [256, 1280, 1, 8976, 256, 256, 256, 1280]
    - [40, 17608.0]
  - - [257, 4096, 1, 1024, 257, 257, 257, 4096]
    - [42, 12763.0]
  - - [512, 2048, 1, 256, 512, 512, 512, 2048]
    - [39, 13682.0]
  - - [560, 1024, 1, 200, 560, 560, 560, 1024]
    - [40, 9370.0]
  - - [560, 1024, 1, 1600, 560, 560, 560, 1024]
    - [40, 16074.0]
  - - [1024, 1024, 1, 200, 1024, 1024, 1024, 1024]
    - [39, 12710.0]
  - - [1024, 1024, 1, 512, 1024, 1024, 1024, 1024]
    - [39, 15543.0]
  - - [1024, 1024, 1, 960, 1024, 1024, 1024, 1024]
    - [60, 16975.0]
  - - [1024, 1024, 1, 1600, 1024, 1024, 1024, 1024]
    - [50, 16855.0]
  - - [2048, 256, 1, 1024, 2048, 2048, 2048, 256]
    - [61, 14263.0]
  - - [1024, 1024, 1, 3840, 1024, 1024, 1024, 1024]
    - [60, 17304.0]
  - - [1024, 1024, 1, 3968, 1024, 1024, 1024, 1024]
    - [60, 17316.0]
  - - [1024, 1024, 1, 6528, 1024, 1024, 1024, 1024]
    - [60, 17445.0]
  - - [1024, 1024, 1, 7104, 1024, 1024, 1024, 1024]
    - [50, 17498.0]
  - - [1024, 1024, 1, 7200, 1024, 1024, 1024, 1024]
    - [62, 17521.0]
  - - [1024, 1024, 1, 8064, 1024, 1024, 1024, 1024]
    - [50, 17526.0]
  - - [1024, 1024, 1, 8160, 1024, 1024, 1024, 1024]
    - [50, 17532.0]
  - - [1024, 1024, 1, 3240, 1024, 1024, 1024, 1024]
    - [50, 17179.0]
  - - [1024, 1024, 1, 3960, 1024, 1024, 1024, 1024]
    - [59, 19587.0]
  - - [64, 1280, 64, 192, 64, 64, 64, 1280]
    - [49, 19381.0]
  - - [64, 1280, 64, 320, 64, 64, 64, 1280]
    - [48, 19414.0]
  - - [64, 1280, 64, 384, 64, 64, 64, 1280]
    - [44, 20303.0]
  - - [64, 1280, 64, 448, 64, 64, 64, 1280]
    - [49, 18997.0]
  - - [64, 2048, 64, 192, 64, 64, 64, 2048]
    - [55, 19443.0]
  - - [64, 2048, 64, 320, 64, 64, 64, 2048]
    - [58, 18912.0]
  - - [64, 2048, 64, 384, 64, 64, 64, 2048]
    - [64, 18789.0]
  - - [64, 2048, 64, 448, 64, 64, 64, 2048]
    - [59, 19412.0]
  - - [5329, 64, 64, 80, 5329, 5329, 5329, 64]
    - [66, 18084.0]
  - - [64, 1280, 32, 192, 64, 64, 64, 1280]
    - [44, 17963.0]
  - - [64, 1280, 32, 320, 64, 64, 64, 1280]
    - [37, 17856.0]
  - - [64, 1280, 32, 384, 64, 64, 64, 1280]
    - [55, 18648.0]
  - - [64, 1280, 32, 448, 64, 64, 64, 1280]
    - [38, 18695.0]
  - - [64, 2048, 32, 192, 64, 64, 64, 2048]
    - [49, 18886.0]
  - - [64, 2048, 32, 320, 64, 64, 64, 2048]
    - [55, 19196.0]
  - - [64, 2048, 32, 384, 64, 64, 64, 2048]
    - [49, 20032.0]
  - - [64, 2048, 32, 448, 64, 64, 64, 2048]
    - [38, 20097.0]
  - - [5329, 64, 32, 80, 5329, 5329, 5329, 64]
    - [49, 18250.0]
  - - [3136, 64, 32, 256, 3136, 3136, 3136, 64]
    - [49, 19458.0]
  - - [3136, 64, 32, 64, 3136, 3136, 3136, 64]
    - [58, 14733.0]
  - - [196, 256, 32, 1024, 196, 196, 196, 256]
    - [42, 14555.0]
  - - [3136, 64, 64, 128, 3136, 3136, 3136, 64]
    - [38, 18637.0]
  - - [3136, 64, 32, 128, 3136, 3136, 3136, 64]
    - [38, 18482.0]
  - - [960, 1024, 1, 1024, 960, 960, 960, 1024]
    - [38, 16363.0]
  - - [1024, 960, 1, 1024, 1024, 1024, 1024, 960]
    - [50, 18579.0]
  - - [64, 512, 16, 512, 64, 64, 64, 512]
    - [43, 13422.0]
  - - [1024, 1024, 1, 1, 1024, 1024, 1024, 1024]
    - [53, 151.0]
  - - [1024, 1024, 1, 77, 1024, 1024, 1024, 1024]
    - [56, 8393.0]
  - - [64, 128, 160, 128, 64, 64, 64, 128]
    - [49, 10980.0]
  - - [1024, 1024, 1, 10, 1024, 1024, 1024, 1024]
    - [50, 1638.0]
  - - [1024, 1024, 1, 1280, 1024, 1024, 1024, 1024]
    - [39, 16673.0]
  - - [64, 128, 624, 128, 64, 64, 64, 128]
    - [49, 15774.0]
  - - [1024, 1024, 1, 39, 1024, 1024, 1024, 1024]
    - [54, 5112.0]
  - - [1024, 1024, 1, 780, 1024, 1024, 1024, 1024]
    - [39, 16012.0]
  - - [1024, 1024, 1, 4992, 1024, 1024, 1024, 1024]
    - [50, 17386.0]
  - - [1024, 1024, 1, 308, 1024, 1024, 1024, 1024]
    - [39, 14115.0]
  - - [64, 128, 640, 128, 64, 64, 64, 128]
    - [49, 16070.0]
  - - [1024, 1024, 1, 40, 1024, 1024, 1024, 1024]
    - [54, 5825.0]
  - - [1024, 1024, 1, 800, 1024, 1024, 1024, 1024]
    - [50, 16232.0]
  - - [1024, 1024, 1, 5120, 1024, 1024, 1024, 1024]
    - [56, 17459.0]
  - - [64, 128, 656, 128, 64, 64, 64, 128]
    - [49, 16567.0]
  - - [1024, 1024, 1, 41, 1024, 1024, 1024, 1024]
    - [54, 5387.0]
  - - [1024, 1024, 1, 820, 1024, 1024, 1024, 1024]
    - [50, 16175.0]
  - - [1024, 1024, 1, 5248, 1024, 1024, 1024, 1024]
    - [60, 17401.0]
  - - [64, 512, 80, 512, 64, 64, 64, 512]
    - [48, 18457.0]
  - - [1024, 1024, 1, 5, 1024, 1024, 1024, 1024]
    - [58, 1507.0]
  - - [1024, 1024, 1, 385, 1024, 1024, 1024, 1024]
    - [39, 16187.0]
  - - [1024, 1024, 1, 2560, 1024, 1024, 1024, 1024]
    - [50, 17517.0]
  - - [64, 512, 96, 512, 64, 64, 64, 512]
    - [48, 17687.0]
  - - [1024, 1024, 1, 6, 1024, 1024, 1024, 1024]
    - [50, 1011.0]
  - - [1024, 1024, 1, 462, 1024, 1024, 1024, 1024]
    - [50, 15101.0]
  - - [1024, 1024, 1, 3072, 1024, 1024, 1024, 1024]
    - [56, 17365.0]
  - - [64, 128, 128, 128, 64, 64, 64, 128]
    - [38, 9840.0]
  - - [1024, 1024, 1, 8, 1024, 1024, 1024, 1024]
    - [48, 1422.0]
  - - [1024, 1024, 1, 160, 1024, 1024, 1024, 1024]
    - [38, 12633.0]
  - - [64, 128, 144, 128, 64, 64, 64, 128]
    - [59, 10120.0]
  - - [1024, 1024, 1, 9, 1024, 1024, 1024, 1024]
    - [60, 1508.0]
  - - [1024, 1024, 1, 180, 1024, 1024, 1024, 1024]
    - [45, 12369.0]
  - - [1024, 1024, 1, 1152, 1024, 1024, 1024, 1024]
    - [39, 16593.0]
  - - [2048, 512, 1, 1, 2048, 2048, 2048, 512]
    - [55, 180.0]
  - - [64, 1024, 32, 1024, 64, 64, 64, 1024]
    - [49, 19215.0]
  - - [1024, 64, 128, 1024, 1024, 1024, 1024, 64]
    - [39, 19376.0]
  - - [1024, 64, 32, 1024, 1024, 1024, 1024, 64]
    - [50, 18801.0]
  - - [1024, 96, 64, 1024, 1024, 1024, 1024, 96]
    - [47, 15551.0]
  - - [1024, 1024, 1, 16, 1024, 1024, 1024, 1024]
    - [48, 4132.0]
  - - [64, 512, 40, 512, 64, 64, 64, 512]
    - [59, 16202.0]
  - - [64, 1024, 256, 1024, 64, 64, 64, 1024]
    - [65, 19028.0]
  - - [96, 1024, 64, 1024, 96, 96, 96, 1024]
    - [49, 16107.0]
  - - [512, 64, 256, 512, 512, 512, 512, 64]
    - [56, 17993.0]
  - - [1024, 96, 128, 1024, 1024, 1024, 1024, 96]
    - [53, 15856.0]
  - - [64, 512, 128, 512, 64, 64, 64, 512]
    - [49, 19288.0]
  - - [64, 1024, 64, 1024, 64, 64, 64, 1024]
    - [58, 19097.0]
  - - [512, 64, 128, 512, 512, 512, 512, 64]
    - [55, 19109.0]
  - - [64, 1024, 128, 1024, 64, 64, 64, 1024]
    - [37, 19096.0]
  - - [1024, 64, 64, 1024, 1024, 1024, 1024, 64]
    - [60, 19006.0]
  - - [96, 1024, 128, 1024, 96, 96, 96, 1024]
    - [42, 15906.0]
  - - [64, 512, 256, 512, 64, 64, 64, 512]
    - [58, 17342.0]
  - - [1024, 64, 256, 1024, 1024, 1024, 1024, 64]
    - [60, 19721.0]
  - - [512, 64, 40, 512, 512, 512, 512, 64]
    - [50, 17963.0]
  - - [1024, 1024, 1, 64, 1024, 1024, 1024, 1024]
    - [50, 11984.0]
  - - [64, 128, 1024, 128, 64, 64, 64, 128]
    - [48, 18506.0]
  - - [128, 64, 1024, 128, 128, 128, 128, 64]
    - [65, 18991.0]
  - - [1024, 1024, 1, 3456, 1024, 1024, 1024, 1024]
    - [43, 18989.0]
  - - [1024, 1024, 1, 6912, 1024, 1024, 1024, 1024]
    - [39, 17695.0]
  - - [1024, 1024, 1, 864, 1024, 1024, 1024, 1024]
    - [56, 16903.0]
  - - [1024, 512, 1, 3456, 1024, 1024, 1024, 512]
    - [49, 15905.0]
  - - [1024, 512, 1, 4096, 1024, 1024, 1024, 512]
    - [53, 15886.0]
  - - [1024, 512, 1, 6912, 1024, 1024, 1024, 512]
    - [65, 16187.0]
  - - [1024, 512, 1, 864, 1024, 1024, 1024, 512]
    - [59, 14191.0]
  - - [256, 3456, 1, 1, 256, 256, 256, 3456]
    - [61, 133.0]
  - - [256, 4096, 1, 1, 256, 256, 256, 4096]
    - [60, 168.0]
  - - [480, 1024, 1, 3456, 480, 480, 480, 1024]
    - [42, 14720.0]
  - - [480, 1024, 1, 4096, 480, 480, 480, 1024]
    - [42, 14821.0]
  - - [480, 1024, 1, 6912, 480, 480, 480, 1024]
    - [63, 15030.0]
  - - [480, 1024, 1, 864, 480, 480, 480, 1024]
    - [40, 12791.0]
  - - [1024, 1024, 1, 80, 1024, 1024, 1024, 1024]
    - [56, 9425.0]
  - - [64, 128, 1280, 128, 64, 64, 64, 128]
    - [49, 16900.0]
  - - [128, 64, 1280, 128, 128, 128, 128, 64]
    - [50, 19125.0]
  - - [1024, 1024, 1, 82, 1024, 1024, 1024, 1024]
    - [48, 11619.0]
  - - [128, 64, 1312, 128, 128, 128, 128, 64]
    - [56, 18955.0]
  - - [64, 128, 1312, 128, 64, 64, 64, 128]
    - [44, 17384.0]
  - - [1024, 1024, 1, 12, 1024, 1024, 1024, 1024]
    - [55, 3294.0]
  - - [1024, 1024, 1, 6144, 1024, 1024, 1024, 1024]
    - [44, 17834.0]
  - - [64, 512, 192, 512, 64, 64, 64, 512]
    - [48, 17740.0]
  - - [512, 64, 192, 512, 512, 512, 512, 64]
    - [48, 19115.0]
  - - [784, 1152, 1, 128, 784, 784, 784, 1152]
    - [48, 11446.0]
  - - [64, 128, 2048, 128, 64, 64, 64, 128]
    - [37, 13853.0]
  - - [128, 64, 2048, 128, 128, 128, 128, 64]
    - [37, 12583.0]
  - - [1024, 1024, 1, 128, 1024, 1024, 1024, 1024]
    - [39, 13449.0]
  - - [128, 64, 1536, 128, 128, 128, 128, 64]
    - [66, 18659.0]
  - - [64, 128, 1536, 128, 64, 64, 64, 128]
    - [64, 18191.0]
  - - [1024, 1024, 1, 96, 1024, 1024, 1024, 1024]
    - [50, 13245.0]
  - - [92416, 64, 25, 64, 92416, 92416, 92416, 64]
    - [56, 9907.0]
  - - [50176, 64, 36, 64, 50176, 50176, 50176, 64]
    - [56, 9978.0]
  - - [36864, 64, 49, 64, 36864, 36864, 36864, 64]
    - [56, 10102.0]
  - - [25600, 64, 64, 64, 25600, 25600, 25600, 64]
    - [45, 10096.0]
  - - [64, 128, 192, 128, 64, 64, 64, 128]
    - [38, 13789.0]
  - - [128, 64, 192, 128, 128, 128, 128, 64]
    - [56, 14738.0]
  - - [768, 768, 1, 2048, 768, 768, 768, 768]
    - [42, 17890.0]
  - - [64, 384, 144, 384, 64, 64, 64, 384]
    - [49, 19758.0]
  - - [384, 64, 144, 384, 384, 384, 384, 64]
    - [65, 19525.0]
  - - [768, 768, 1, 4608, 768, 768, 768, 768]
    - [42, 18168.0]
  - - [64, 512, 48, 512, 64, 64, 64, 512]
    - [54, 18154.0]
  - - [512, 64, 48, 512, 512, 512, 512, 64]
    - [39, 17568.0]
  - - [64, 128, 256, 128, 64, 64, 64, 128]
    - [49, 13069.0]
  - - [128, 64, 256, 128, 128, 128, 128, 64]
    - [50, 13435.0]
  - - [64, 384, 192, 384, 64, 64, 64, 384]
    - [44, 19417.0]
  - - [384, 64, 192, 384, 384, 384, 384, 64]
    - [58, 20173.0]
  - - [1024, 1024, 1, 4608, 1024, 1024, 1024, 1024]
    - [50, 17618.0]
  - - [196, 2304, 1, 256, 196, 196, 196, 2304]
    - [51, 7790.0]
  - - [768, 512, 2, 2048, 768, 768, 768, 512]
    - [39, 17420.0]
  - - [672, 512, 2, 2048, 672, 672, 672, 512]
    - [59, 16448.0]
  - - [1008, 512, 2, 2048, 1008, 1008, 1008, 512]
    - [39, 16650.0]
  - - [864, 512, 2, 2048, 864, 864, 864, 512]
    - [53, 17712.0]
  - - [888, 512, 2, 2048, 888, 888, 888, 512]
    - [40, 18193.0]
  - - [840, 512, 2, 2048, 840, 840, 840, 512]
    - [63, 17210.0]
  - - [768, 256, 2, 12, 768, 768, 768, 256]
    - [51, 717.0]
  - - [864, 256, 2, 3, 864, 864, 864, 256]
    - [50, 215.0]
  - - [864, 256, 2, 12, 864, 864, 864, 256]
    - [41, 843.0]
  - - [768, 256, 2, 3, 768, 768, 768, 256]
    - [44, 237.0]
  - - [1024, 320, 1, 1024, 1024, 1024, 1024, 320]
    - [39, 13729.0]
  - - [173280, 64, 1, 128, 173280, 173280, 173280, 64]
    - [45, 9809.0]
  - - [25992, 64, 1, 128, 25992, 25992, 25992, 64]
    - [56, 11790.0]
  - - [713, 512, 2, 2048, 713, 713, 713, 512]
    - [50, 15938.0]
  - - [660, 512, 2, 2048, 660, 660, 660, 512]
    - [59, 16057.0]
  - - [726, 512, 2, 2048, 726, 726, 726, 512]
    - [39, 16273.0]
  - - [748, 512, 2, 2048, 748, 748, 748, 512]
    - [39, 16741.0]
  - - [805, 512, 2, 2048, 805, 805, 805, 512]
    - [53, 16528.0]
  - - [850, 512, 2, 2048, 850, 850, 850, 512]
    - [57, 17435.0]
  - - [850, 256, 2, 3, 850, 850, 850, 256]
    - [41, 216.0]
  - - [805, 256, 2, 12, 805, 805, 805, 256]
    - [50, 778.0]
  - - [805, 256, 2, 3, 805, 805, 805, 256]
    - [48, 212.0]
  - - [850, 256, 2, 12, 850, 850, 850, 256]
    - [52, 819.0]
  - - [950, 256, 2, 12, 950, 950, 950, 256]
    - [50, 915.0]
  - - [950, 256, 2, 3, 950, 950, 950, 256]
    - [60, 240.0]
  - - [100, 512, 120, 128, 100, 100, 100, 512]
    - [59, 11434.0]
  - - [100, 512, 18, 128, 100, 100, 100, 512]
    - [58, 7670.0]
  - - [100, 512, 19, 128, 100, 100, 100, 512]
    - [64, 8659.0]
  - - [1444, 576, 1, 128, 1444, 1444, 1444, 576]
    - [39, 9489.0]
  - - [27436, 64, 1, 128, 27436, 27436, 27436, 64]
    - [48, 11817.0]
  - - [361, 2304, 1, 512, 361, 361, 361, 2304]
    - [40, 14205.0]
  - - [96, 1024, 160, 1024, 96, 96, 96, 1024]
    - [38, 16432.0]
  - - [1024, 96, 160, 1024, 1024, 1024, 1024, 96]
    - [47, 16022.0]
  - - [96, 1024, 40, 1024, 96, 96, 96, 1024]
    - [42, 15792.0]
  - - [1024, 96, 40, 1024, 1024, 1024, 1024, 96]
    - [47, 15556.0]
  - - [96, 1024, 80, 1024, 96, 96, 96, 1024]
    - [42, 16016.0]
  - - [1024, 96, 80, 1024, 1024, 1024, 1024, 96]
    - [42, 15823.0]
  - - [96, 1024, 96, 1024, 96, 96, 96, 1024]
    - [65, 16564.0]
  - - [1024, 96, 96, 1024, 1024, 1024, 1024, 96]
    - [53, 15744.0]
  - - [96, 1024, 24, 1024, 96, 96, 96, 1024]
    - [51, 15015.0]
  - - [1024, 96, 24, 1024, 1024, 1024, 1024, 96]
    - [57, 14882.0]
  - - [96, 1024, 48, 1024, 96, 96, 96, 1024]
    - [49, 15588.0]
  - - [1024, 96, 48, 1024, 1024, 1024, 1024, 96]
    - [44, 15503.0]
  - - [96, 1024, 16, 1024, 96, 96, 96, 1024]
    - [59, 14381.0]
  - - [1024, 96, 16, 1024, 1024, 1024, 1024, 96]
    - [55, 14345.0]
  - - [96, 1024, 32, 1024, 96, 96, 96, 1024]
    - [51, 15479.0]
  - - [1024, 96, 32, 1024, 1024, 1024, 1024, 96]
    - [51, 15140.0]
  - - [512, 64, 320, 512, 512, 512, 512, 64]
    - [66, 18055.0]
  - - [64, 512, 320, 512, 64, 64, 64, 512]
    - [48, 17275.0]
  - - [1024, 1024, 1, 20, 1024, 1024, 1024, 1024]
    - [69, 4161.0]
  - - [512, 64, 80, 512, 512, 512, 512, 64]
    - [60, 18904.0]
  - - [1024, 64, 512, 1024, 1024, 1024, 1024, 64]
    - [60, 19886.0]
  - - [64, 1024, 512, 1024, 64, 64, 64, 1024]
    - [37, 20104.0]
  - - [512, 256, 1, 32768, 512, 512, 512, 256]
    - [72, 15803.0]
  - - [1024, 256, 1, 8192, 1024, 1024, 1024, 256]
    - [74, 16995.0]
  - - [1024, 256, 1, 8448, 1024, 1024, 1024, 256]
    - [70, 15515.0]
  - - [1024, 256, 1, 9728, 1024, 1024, 1024, 256]
    - [75, 15796.0]
  - - [1024, 256, 1, 9984, 1024, 1024, 1024, 256]
    - [70, 15791.0]
  - - [1024, 256, 1, 10496, 1024, 1024, 1024, 256]
    - [75, 15864.0]
  - - [1024, 256, 1, 11520, 1024, 1024, 1024, 256]
    - [76, 16038.0]
  - - [1024, 256, 1, 12032, 1024, 1024, 1024, 256]
    - [70, 16029.0]
  - - [1024, 256, 1, 13568, 1024, 1024, 1024, 256]
    - [76, 16277.0]
  - - [1024, 256, 1, 14336, 1024, 1024, 1024, 256]
    - [75, 16320.0]
  - - [1024, 256, 1, 14848, 1024, 1024, 1024, 256]
    - [71, 16236.0]
  - - [1024, 256, 1, 15104, 1024, 1024, 1024, 256]
    - [76, 16359.0]
  - - [1024, 256, 1, 15872, 1024, 1024, 1024, 256]
    - [75, 16387.0]
  - - [1024, 256, 1, 16128, 1024, 1024, 1024, 256]
    - [75, 16428.0]
  - - [1024, 256, 1, 17152, 1024, 1024, 1024, 256]
    - [76, 16498.0]
  - - [1024, 256, 1, 17408, 1024, 1024, 1024, 256]
    - [70, 16496.0]
  - - [1024, 256, 1, 18944, 1024, 1024, 1024, 256]
    - [73, 16621.0]
  - - [1024, 256, 1, 19712, 1024, 1024, 1024, 256]
    - [76, 16693.0]
  - - [1024, 256, 1, 19968, 1024, 1024, 1024, 256]
    - [70, 16635.0]
  - - [256, 128, 1, 55296, 256, 256, 256, 128]
    - [76, 9383.0]
  - - [3584, 64, 1, 1280, 3584, 3584, 3584, 64]
    - [120, 10202.0]
  - - [64, 4288, 1, 1280, 64, 64, 64, 4288]
    - [88, 10716.0]
  - - [3584, 64, 1, 3328, 3584, 3584, 3584, 64]
    - [120, 11316.0]
  - - [64, 4288, 1, 3328, 64, 64, 64, 4288]
    - [88, 11065.0]
  - - [1856, 64, 1, 3328, 1856, 1856, 1856, 64]
    - [118, 9723.0]
  - - [2944, 64, 1, 256, 2944, 2944, 2944, 64]
    - [84, 5557.0]
  - - [64, 1856, 1, 256, 64, 64, 64, 1856]
    - [152, 4295.0]
  - - [2368, 64, 1, 256, 2368, 2368, 2368, 64]
    - [84, 5215.0]
  - - [2368, 64, 1, 3328, 2368, 2368, 2368, 64]
    - [156, 10369.0]
  - - [64, 1408, 1, 3328, 64, 64, 64, 1408]
    - [88, 7468.0]
  - - [1856, 64, 1, 1280, 1856, 1856, 1856, 64]
    - [144, 8148.0]
  - - [64, 3584, 1, 1280, 64, 64, 64, 3584]
    - [146, 9953.0]
  - - [4288, 64, 1, 3328, 4288, 4288, 4288, 64]
    - [130, 10914.0]
  - - [64, 2944, 1, 256, 64, 64, 64, 2944]
    - [97, 5570.0]
  - - [64, 2368, 1, 1280, 64, 64, 64, 2368]
    - [86, 9014.0]
  - - [64, 3584, 1, 3328, 64, 64, 64, 3584]
    - [105, 10874.0]
  - - [3584, 64, 1, 256, 3584, 3584, 3584, 64]
    - [113, 8000.0]
  - - [64, 1856, 1, 3328, 64, 64, 64, 1856]
    - [113, 10023.0]
  - - [4288, 64, 1, 1280, 4288, 4288, 4288, 64]
    - [78, 11137.0]
  - - [1408, 64, 1, 256, 1408, 1408, 1408, 64]
    - [112, 4047.0]
  - - [64, 1408, 1, 256, 64, 64, 64, 1408]
    - [87, 4320.0]
  - - [64, 2368, 1, 3328, 64, 64, 64, 2368]
    - [105, 10408.0]
  - - [64, 1856, 1, 1280, 64, 64, 64, 1856]
    - [152, 9148.0]
  - - [64, 4288, 1, 256, 64, 64, 64, 4288]
    - [113, 8760.0]
  - - [64, 1408, 1, 1280, 64, 64, 64, 1408]
    - [118, 7076.0]
  - - [64, 2944, 1, 3328, 64, 64, 64, 2944]
    - [88, 10010.0]
  - - [1856, 64, 1, 256, 1856, 1856, 1856, 64]
    - [89, 4905.0]
  - - [2944, 64, 1, 1280, 2944, 2944, 2944, 64]
    - [88, 9852.0]
  - - [4288, 64, 1, 256, 4288, 4288, 4288, 64]
    - [84, 9172.0]
  - - [64, 2944, 1, 1280, 64, 64, 64, 2944]
    - [118, 9788.0]
  - - [1408, 64, 1, 1280, 1408, 1408, 1408, 64]
    - [128, 6982.0]
  - - [64, 2368, 1, 256, 64, 64, 64, 2368]
    - [88, 5773.0]
  - - [64, 3584, 1, 256, 64, 64, 64, 3584]
    - [152, 8201.0]
  - - [2944, 64, 1, 3328, 2944, 2944, 2944, 64]
    - [118, 10039.0]
  - - [2368, 64, 1, 1280, 2368, 2368, 2368, 64]
    - [156, 9948.0]
  - - [1408, 64, 1, 3328, 1408, 1408, 1408, 64]
    - [103, 7456.0]
  - - [33, 32, 200, 33, 33, 33, 33, 32]
    - [77, 1345.0]
  - - [33, 32, 1600, 33, 33, 33, 33, 32]
    - [82, 3223.0]
  - - [67, 2048, 1, 512, 67, 67, 67, 2048]
    - [78, 4779.0]
  - - [74, 2048, 1, 512, 74, 74, 74, 2048]
    - [78, 5337.0]
  - - [74, 2048, 1, 960, 74, 74, 74, 2048]
    - [128, 6524.0]
  - - [100, 2048, 1, 512, 100, 100, 100, 2048]
    - [140, 6363.0]
  - - [512, 512, 1, 200, 512, 512, 512, 512]
    - [103, 5813.0]
  - - [512, 512, 1, 1600, 512, 512, 512, 512]
    - [84, 9832.0]
  - - [1024, 256, 1, 1024, 1024, 1024, 1024, 256]
    - [113, 9334.0]
  - - [1024, 256, 1, 1280, 1024, 1024, 1024, 256]
    - [144, 9582.0]
  - - [1024, 256, 1, 2304, 1024, 1024, 1024, 256]
    - [144, 10103.0]
  - - [1024, 256, 1, 2816, 1024, 1024, 1024, 256]
    - [118, 10468.0]
  - - [1024, 256, 1, 3072, 1024, 1024, 1024, 256]
    - [88, 10619.0]
  - - [1024, 256, 1, 3328, 1024, 1024, 1024, 256]
    - [118, 10290.0]
  - - [1024, 256, 1, 3584, 1024, 1024, 1024, 256]
    - [118, 10331.0]
  - - [1024, 256, 1, 4096, 1024, 1024, 1024, 256]
    - [154, 10606.0]
  - - [1024, 256, 1, 4352, 1024, 1024, 1024, 256]
    - [144, 10712.0]
  - - [1024, 256, 1, 4608, 1024, 1024, 1024, 256]
    - [144, 10464.0]
  - - [1024, 256, 1, 5120, 1024, 1024, 1024, 256]
    - [118, 10492.0]
  - - [1024, 256, 1, 5376, 1024, 1024, 1024, 256]
    - [118, 10676.0]
  - - [1024, 256, 1, 5632, 1024, 1024, 1024, 256]
    - [154, 10671.0]
  - - [1024, 256, 1, 6144, 1024, 1024, 1024, 256]
    - [144, 10575.0]
  - - [1024, 256, 1, 6400, 1024, 1024, 1024, 256]
    - [147, 11770.0]
  - - [1024, 256, 1, 7680, 1024, 1024, 1024, 256]
    - [88, 10603.0]
  - - [1024, 256, 1, 7936, 1024, 1024, 1024, 256]
    - [118, 10760.0]
  - - [32, 64, 4608, 32, 32, 32, 32, 64]
    - [138, 10100.0]
  - - [32, 64, 4608, 35, 32, 32, 32, 64]
    - [82, 9647.0]
  - - [34, 64, 4736, 24, 34, 34, 34, 64]
    - [121, 4740.0]
  - - [34, 64, 4736, 34, 34, 34, 34, 64]
    - [82, 5534.0]
  - - [35, 64, 4608, 35, 35, 35, 35, 64]
    - [90, 5505.0]
  - - [64, 32, 4608, 32, 64, 64, 64, 32]
    - [84, 10832.0]
  - - [64, 32, 4608, 35, 64, 64, 64, 32]
    - [126, 10499.0]
  - - [64, 34, 4736, 24, 64, 64, 64, 34]
    - [80, 5287.0]
  - - [64, 34, 4736, 34, 64, 64, 64, 34]
    - [80, 5949.0]
  - - [64, 35, 4608, 35, 64, 64, 64, 35]
    - [80, 5956.0]
  - - [33, 64, 1920, 33, 33, 33, 33, 64]
    - [78, 4982.0]
  - - [64, 33, 1920, 33, 64, 64, 64, 33]
    - [84, 5203.0]
  - - [49, 512, 64, 2048, 49, 49, 49, 512]
    - [90, 9851.0]
  - - [49, 2048, 64, 512, 49, 49, 49, 2048]
    - [156, 9956.0]
  - - [49, 512, 32, 2048, 49, 49, 49, 512]
    - [90, 9696.0]
  - - [49, 2048, 32, 512, 49, 49, 49, 2048]
    - [105, 9809.0]
  - - [49, 1024, 64, 2048, 49, 49, 49, 1024]
    - [120, 9952.0]
  - - [49, 2048, 64, 1024, 49, 49, 49, 2048]
    - [105, 10076.0]
  - - [49, 1024, 32, 2048, 49, 49, 49, 1024]
    - [156, 9852.0]
  - - [49, 2048, 32, 1024, 49, 49, 49, 2048]
    - [90, 9881.0]
  - - [480, 512, 1, 512, 480, 480, 480, 512]
    - [84, 8678.0]
  - - [512, 480, 1, 512, 512, 512, 512, 480]
    - [88, 10247.0]
  - - [512, 512, 1, 512, 512, 512, 512, 512]
    - [84, 9698.0]
  - - [256, 864, 1, 1, 256, 256, 256, 864]
    - [135, 118.0]
  - - [512, 256, 1, 3456, 512, 512, 512, 256]
    - [84, 9060.0]
  - - [512, 256, 1, 4096, 512, 512, 512, 256]
    - [90, 9171.0]
  - - [512, 256, 1, 6912, 512, 512, 512, 256]
    - [120, 9479.0]
  - - [512, 256, 1, 864, 512, 512, 512, 256]
    - [99, 7122.0]
  - - [49, 4608, 1, 512, 49, 49, 49, 4608]
    - [132, 6561.0]
  - - [49, 2048, 128, 512, 49, 49, 49, 2048]
    - [106, 10104.0]
  - - [49, 2048, 256, 512, 49, 49, 49, 2048]
    - [120, 10128.0]
  - - [49, 512, 128, 2048, 49, 49, 49, 512]
    - [111, 10619.0]
  - - [49, 512, 256, 2048, 49, 49, 49, 512]
    - [156, 10108.0]
  - - [56, 512, 64, 512, 56, 56, 56, 512]
    - [120, 10996.0]
  - - [176, 256, 2, 3, 176, 176, 176, 256]
    - [81, 159.0]
  - - [176, 256, 2, 12, 176, 176, 176, 256]
    - [79, 563.0]
  - - [216, 256, 2, 3, 216, 216, 216, 256]
    - [109, 80.0]
  - - [192, 256, 2, 12, 192, 192, 192, 256]
    - [145, 284.0]
  - - [192, 256, 2, 3, 192, 192, 192, 256]
    - [93, 73.0]
  - - [216, 256, 2, 12, 216, 216, 216, 256]
    - [109, 306.0]
  - - [228, 256, 2, 12, 228, 228, 228, 256]
    - [148, 539.0]
  - - [228, 256, 2, 3, 228, 228, 228, 256]
    - [137, 172.0]
  - - [187, 256, 2, 12, 187, 187, 187, 256]
    - [116, 452.0]
  - - [247, 256, 2, 12, 247, 247, 247, 256]
    - [119, 671.0]
  - - [187, 256, 2, 3, 187, 187, 187, 256]
    - [112, 148.0]
  - - [221, 256, 2, 3, 221, 221, 221, 256]
    - [123, 152.0]
  - - [221, 256, 2, 12, 221, 221, 221, 256]
    - [109, 317.0]
  - - [247, 256, 2, 3, 247, 247, 247, 256]
    - [127, 149.0]
  - - [100, 2304, 1, 512, 100, 100, 100, 2304]
    - [146, 6687.0]
  - - [256, 128, 1, 32768, 256, 256, 256, 128]
    - [159, 9225.0]
  - - [2048, 2, 1, 2, 2048, 2048, 2048, 2]
    - [166, 4.0]
  - - [2560, 2, 1, 4, 2560, 2560, 2560, 2]
    - [166, 5.0]
  - - [2048, 2, 1, 8, 2048, 2048, 2048, 2]
    - [167, 19.0]
  - - [2560, 2, 1, 2, 2560, 2560, 2560, 2]
    - [91, 3.0]
  - - [25, 1152, 1, 256, 25, 25, 25, 1152]
    - [131, 1241.0]
  - - [9, 1152, 1, 256, 9, 9, 9, 1152]
    - [151, 461.0]
  - - [13, 512, 1, 32768, 13, 13, 13, 512]
    - [157, 3099.0]
  - - [1024, 2, 1, 4992, 1024, 1024, 1024, 2]
    - [158, 416.0]
  - - [1024, 2, 1, 5120, 1024, 1024, 1024, 2]
    - [163, 422.0]
  - - [1024, 2, 1, 5248, 1024, 1024, 1024, 2]
    - [165, 423.0]
  - - [256, 128, 1, 6912, 256, 256, 256, 128]
    - [164, 6505.0]
  - - [13, 512, 1, 55296, 13, 13, 13, 512]
    - [160, 3179.0]
  - - [13, 512, 1, 6912, 13, 13, 13, 512]
    - [162, 1954.0]
  - - [768, 2, 1, 4608, 768, 768, 768, 2]
    - [161, 405.0]
  - - [1024, 2, 1, 4608, 1024, 1024, 1024, 2]
    - [165, 398.0]
  - - [64, 448, 1, 3328, 64, 64, 64, 448]
    - [117, 4476.0]
  - - [1, 64, 1, 256, 1, 1, 1, 64]
    - [81, 3.0]
  - - [64, 128, 1, 256, 64, 64, 64, 128]
    - [96, 718.0]
  - - [64, 1024, 1, 3328, 64, 64, 64, 1024]
    - [105, 7685.0]
  - - [1, 64, 1, 1280, 1, 1, 1, 64]
    - [81, 4.0]
  - - [704, 64, 1, 3328, 704, 704, 704, 64]
    - [132, 4884.0]
  - - [64, 448, 1, 1280, 64, 64, 64, 448]
    - [143, 3225.0]
  - - [64, 704, 1, 3328, 64, 64, 64, 704]
    - [90, 4881.0]
  - - [64, 64, 1, 1280, 64, 64, 64, 64]
    - [131, 523.0]
  - - [1, 64, 1, 1, 1, 1, 1, 64]
    - [81, 0.02]
  - - [448, 64, 1, 1280, 448, 448, 448, 64]
    - [117, 3306.0]
  - - [64, 1024, 1, 1280, 64, 64, 64, 1024]
    - [120, 5490.0]
  - - [64, 256, 1, 1280, 64, 64, 64, 256]
    - [104, 2068.0]
  - - [704, 64, 1, 1280, 704, 704, 704, 64]
    - [117, 3956.0]
  - - [64, 128, 1, 1280, 64, 64, 64, 128]
    - [155, 1032.0]
  - - [448, 64, 1, 3328, 448, 448, 448, 64]
    - [87, 4241.0]
  - - [128, 64, 1, 256, 128, 128, 128, 64]
    - [155, 393.0]
  - - [64, 128, 1, 3328, 64, 64, 64, 128]
    - [89, 1391.0]
  - - [64, 256, 1, 3328, 64, 64, 64, 256]
    - [131, 2751.0]
  - - [1024, 64, 1, 1280, 1024, 1024, 1024, 64]
    - [146, 5468.0]
  - - [448, 64, 1, 256, 448, 448, 448, 64]
    - [117, 1349.0]
  - - [256, 64, 1, 256, 256, 256, 256, 64]
    - [94, 757.0]
  - - [1, 1, 1, 1, 1, 1, 1, 1]
    - [136, 0.00024271843644509215]
  - - [1024, 64, 1, 3328, 1024, 1024, 1024, 64]
    - [105, 7013.0]
  - - [64, 448, 1, 256, 64, 64, 64, 448]
    - [125, 1335.0]
  - - [128, 64, 1, 1280, 128, 128, 128, 64]
    - [119, 1317.0]
  - - [64, 1024, 1, 256, 64, 64, 64, 1024]
    - [124, 2482.0]
  - - [256, 64, 1, 1280, 256, 256, 256, 64]
    - [155, 2036.0]
  - - [64, 256, 1, 256, 64, 64, 64, 256]
    - [123, 800.0]
  - - [704, 64, 1, 256, 704, 704, 704, 64]
    - [125, 1922.0]
  - - [1, 1, 1, 256, 1, 1, 1, 1]
    - [81, 0.04]
  - - [64, 704, 1, 256, 64, 64, 64, 704]
    - [102, 1948.0]
  - - [64, 64, 1, 256, 64, 64, 64, 64]
    - [151, 196.0]
  - - [128, 64, 1, 3328, 128, 128, 128, 64]
    - [104, 1380.0]
  - - [1, 1, 1, 1280, 1, 1, 1, 1]
    - [81, 0.1]
  - - [1024, 64, 1, 256, 1024, 1024, 1024, 64]
    - [125, 2431.0]
  - - [256, 64, 1, 3328, 256, 256, 256, 64]
    - [104, 2726.0]
  - - [64, 64, 1, 3328, 64, 64, 64, 64]
    - [131, 696.0]
  - - [1, 1, 1, 3328, 1, 1, 1, 1]
    - [81, 0.12]
  - - [64, 704, 1, 1280, 64, 64, 64, 704]
    - [117, 3918.0]
  - - [512, 16, 1, 512, 512, 512, 512, 16]
    - [100, 606.0]
  - - [1024, 32, 1, 512, 1024, 1024, 1024, 32]
    - [89, 2292.0]
  - - [1024, 16, 1, 512, 1024, 1024, 1024, 16]
    - [131, 1651.0]
  - - [512, 32, 1, 512, 512, 512, 512, 32]
    - [104, 1230.0]
  - - [14, 64, 1, 14, 14, 14, 14, 64]
    - [81, 3.0]
  - - [15, 64, 1, 14, 15, 15, 15, 64]
    - [77, 3.0]
  - - [15, 64, 1, 15, 15, 15, 15, 64]
    - [77, 3.0]
  - - [17, 64, 1, 15, 17, 17, 17, 64]
    - [79, 4.0]
  - - [17, 64, 1, 17, 17, 17, 17, 64]
    - [77, 4.0]
  - - [21, 64, 1, 17, 21, 21, 21, 64]
    - [77, 5.0]
  - - [21, 64, 1, 21, 21, 21, 21, 64]
    - [117, 7.0]
  - - [24, 64, 1, 24, 24, 24, 24, 64]
    - [100, 9.0]
  - - [30, 64, 1, 30, 30, 30, 30, 64]
    - [141, 19.0]
  - - [30, 64, 1, 31, 30, 30, 30, 64]
    - [87, 14.0]
  - - [31, 64, 1, 31, 31, 31, 31, 64]
    - [134, 14.0]
  - - [32, 64, 1, 32, 32, 32, 32, 64]
    - [77, 16.0]
  - - [32, 64, 1, 35, 32, 32, 32, 64]
    - [79, 16.0]
  - - [34, 64, 1, 24, 34, 34, 34, 64]
    - [81, 12.0]
  - - [34, 64, 1, 34, 34, 34, 34, 64]
    - [79, 16.0]
  - - [35, 64, 1, 35, 35, 35, 35, 64]
    - [142, 22.0]
  - - [64, 14, 1, 14, 64, 64, 64, 14]
    - [77, 3.0]
  - - [64, 15, 1, 14, 64, 64, 64, 15]
    - [103, 5.0]
  - - [64, 15, 1, 15, 64, 64, 64, 15]
    - [143, 6.0]
  - - [64, 17, 1, 15, 64, 64, 64, 17]
    - [77, 4.0]
  - - [64, 17, 1, 17, 64, 64, 64, 17]
    - [77, 4.0]
  - - [64, 21, 1, 17, 64, 64, 64, 21]
    - [77, 5.0]
  - - [64, 21, 1, 21, 64, 64, 64, 21]
    - [79, 7.0]
  - - [64, 24, 1, 24, 64, 64, 64, 24]
    - [81, 9.0]
  - - [64, 30, 1, 30, 64, 64, 64, 30]
    - [104, 23.0]
  - - [64, 30, 1, 31, 64, 64, 64, 30]
    - [147, 19.0]
  - - [64, 31, 1, 31, 64, 64, 64, 31]
    - [110, 26.0]
  - - [64, 32, 1, 32, 64, 64, 64, 32]
    - [122, 21.0]
  - - [64, 32, 1, 35, 64, 64, 64, 32]
    - [110, 16.0]
  - - [64, 34, 1, 24, 64, 64, 64, 34]
    - [113, 17.0]
  - - [64, 34, 1, 34, 64, 64, 64, 34]
    - [139, 17.0]
  - - [64, 35, 1, 35, 64, 64, 64, 35]
    - [79, 17.0]
  - - [64, 512, 1, 512, 64, 64, 64, 512]
    - [119, 3355.0]
  - - [512, 64, 1, 512, 512, 512, 512, 64]
    - [145, 3329.0]
  - - [1024, 2, 1, 4, 1024, 1024, 1024, 2]
    - [81, 5.0]
  - - [1024, 2, 1, 32, 1024, 1024, 1024, 2]
    - [114, 31.0]
  - - [1024, 2, 1, 2048, 1024, 1024, 1024, 2]
    - [117, 322.0]
  - - [3, 64, 512, 3, 3, 3, 3, 64]
    - [77, 49.0]
  - - [5, 64, 512, 5, 5, 5, 5, 64]
    - [110, 207.0]
  - - [5, 64, 960, 5, 5, 5, 5, 64]
    - [77, 263.0]
  - - [9, 64, 512, 9, 9, 9, 9, 64]
    - [81, 462.0]
  - - [27, 128, 32768, 27, 27, 27, 27, 128]
    - [116, 4019.0]
  - - [512, 32, 1, 200, 512, 512, 512, 32]
    - [125, 853.0]
  - - [512, 32, 1, 1600, 512, 512, 512, 32]
    - [89, 2900.0]
  - - [1024, 64, 1, 512, 1024, 1024, 1024, 64]
    - [103, 4835.0]
  - - [1024, 64, 1, 960, 1024, 1024, 1024, 64]
    - [120, 6026.0]
  - - [14, 64, 10880, 14, 14, 14, 14, 64]
    - [82, 2306.0]
  - - [15, 64, 10880, 14, 15, 15, 15, 64]
    - [82, 2481.0]
  - - [15, 64, 7680, 15, 15, 15, 15, 64]
    - [82, 2485.0]
  - - [15, 64, 10880, 15, 15, 15, 15, 64]
    - [82, 2517.0]
  - - [17, 64, 7680, 15, 17, 17, 17, 64]
    - [78, 2281.0]
  - - [17, 64, 6144, 17, 17, 17, 17, 64]
    - [150, 2553.0]
  - - [17, 64, 7680, 17, 17, 17, 17, 64]
    - [111, 2596.0]
  - - [21, 64, 6144, 17, 21, 21, 21, 64]
    - [115, 2326.0]
  - - [21, 64, 6144, 21, 21, 21, 21, 64]
    - [95, 2725.0]
  - - [24, 64, 4736, 24, 24, 24, 24, 64]
    - [106, 3750.0]
  - - [30, 64, 2048, 30, 30, 30, 30, 64]
    - [116, 4204.0]
  - - [30, 64, 2048, 31, 30, 30, 30, 64]
    - [142, 4320.0]
  - - [31, 64, 2048, 31, 31, 31, 31, 64]
    - [101, 4467.0]
  - - [64, 14, 10880, 14, 64, 64, 64, 14]
    - [108, 2677.0]
  - - [64, 15, 10880, 14, 64, 64, 64, 15]
    - [106, 2626.0]
  - - [64, 15, 7680, 15, 64, 64, 64, 15]
    - [108, 2711.0]
  - - [64, 15, 10880, 15, 64, 64, 64, 15]
    - [80, 2763.0]
  - - [64, 17, 7680, 15, 64, 64, 64, 17]
    - [152, 2864.0]
  - - [64, 17, 6144, 17, 64, 64, 64, 17]
    - [140, 3083.0]
  - - [64, 17, 7680, 17, 64, 64, 64, 17]
    - [126, 3141.0]
  - - [64, 21, 6144, 17, 64, 64, 64, 21]
    - [150, 3516.0]
  - - [64, 21, 6144, 21, 64, 64, 64, 21]
    - [80, 4652.0]
  - - [64, 24, 4736, 24, 64, 64, 64, 24]
    - [108, 5770.0]
  - - [64, 30, 2048, 30, 64, 64, 64, 30]
    - [84, 5916.0]
  - - [64, 30, 2048, 31, 64, 64, 64, 30]
    - [84, 6017.0]
  - - [64, 31, 2048, 31, 64, 64, 64, 31]
    - [92, 6073.0]
  - - [27, 64, 1920, 27, 27, 27, 27, 64]
    - [81, 3546.0]
  - - [27, 64, 1920, 33, 27, 27, 27, 64]
    - [86, 4182.0]
  - - [64, 27, 1920, 27, 64, 64, 64, 27]
    - [148, 5214.0]
  - - [64, 27, 1920, 33, 64, 64, 64, 27]
    - [80, 5887.0]
  - - [1024, 2, 1, 1, 1024, 1024, 1024, 2]
    - [77, 1.0]
  - - [1024, 2, 1, 512, 1024, 1024, 1024, 2]
    - [102, 219.0]
  - - [1024, 2, 1, 10, 1024, 1024, 1024, 2]
    - [77, 5.0]
  - - [1024, 2, 1, 1280, 1024, 1024, 1024, 2]
    - [117, 237.0]
  - - [1024, 2, 1, 39, 1024, 1024, 1024, 2]
    - [134, 18.0]
  - - [1024, 2, 1, 40, 1024, 1024, 1024, 2]
    - [136, 19.0]
  - - [1024, 2, 1, 41, 1024, 1024, 1024, 2]
    - [80, 28.0]
  - - [1024, 2, 1, 5, 1024, 1024, 1024, 2]
    - [107, 3.0]
  - - [1024, 2, 1, 2560, 1024, 1024, 1024, 2]
    - [129, 293.0]
  - - [1024, 2, 1, 6, 1024, 1024, 1024, 2]
    - [77, 3.0]
  - - [1024, 2, 1, 3072, 1024, 1024, 1024, 2]
    - [102, 303.0]
  - - [1024, 2, 1, 8, 1024, 1024, 1024, 2]
    - [77, 4.0]
  - - [1024, 2, 1, 1024, 1024, 1024, 1024, 2]
    - [102, 216.0]
  - - [1024, 2, 1, 9, 1024, 1024, 1024, 2]
    - [77, 4.0]
  - - [1024, 2, 1, 1152, 1024, 1024, 1024, 2]
    - [87, 224.0]
  - - [4, 64, 32768, 4, 4, 4, 4, 64]
    - [133, 300.0]
  - - [4, 64, 38400, 4, 4, 4, 4, 64]
    - [78, 303.0]
  - - [64, 4, 32768, 4, 64, 64, 64, 4]
    - [80, 310.0]
  - - [64, 4, 38400, 4, 64, 64, 64, 4]
    - [80, 310.0]
  - - [64, 128, 1, 128, 64, 64, 64, 128]
    - [96, 448.0]
  - - [128, 64, 1, 128, 128, 128, 128, 64]
    - [98, 433.0]
  - - [5, 64, 1, 5, 5, 5, 5, 64]
    - [151, 1.0]
  - - [33, 32, 1, 33, 33, 33, 33, 32]
    - [81, 8.0]
  - - [1024, 2, 1, 16, 1024, 1024, 1024, 2]
    - [81, 8.0]
  - - [1024, 2, 1, 64, 1024, 1024, 1024, 2]
    - [110, 28.0]
  - - [256, 128, 1, 3456, 256, 256, 256, 128]
    - [89, 4290.0]
  - - [256, 128, 1, 4096, 256, 256, 256, 128]
    - [131, 4403.0]
  - - [256, 128, 1, 864, 256, 256, 256, 128]
    - [119, 2955.0]
  - - [1024, 2, 1, 80, 1024, 1024, 1024, 2]
    - [77, 58.0]
  - - [1024, 2, 1, 82, 1024, 1024, 1024, 2]
    - [85, 35.0]
  - - [1024, 2, 1, 12, 1024, 1024, 1024, 2]
    - [79, 6.0]
  - - [13, 512, 1, 3456, 13, 13, 13, 512]
    - [145, 1118.0]
  - - [13, 512, 1, 4096, 13, 13, 13, 512]
    - [145, 1141.0]
  - - [13, 512, 1, 864, 13, 13, 13, 512]
    - [145, 664.0]
  - - [64, 24, 6816, 24, 64, 64, 64, 24]
    - [84, 5843.0]
  - - [64, 26, 6272, 26, 64, 64, 64, 26]
    - [84, 5843.0]
  - - [1024, 2, 1, 128, 1024, 1024, 1024, 2]
    - [125, 52.0]
  - - [1024, 2, 1, 96, 1024, 1024, 1024, 2]
    - [104, 66.0]
  - - [768, 2, 1, 2048, 768, 768, 768, 2]
    - [117, 208.0]
  - - [1024, 81, 1, 1024, 1024, 1024, 1024, 81]
    - [84, 5289.0]
  - - [25, 256, 120, 128, 25, 25, 25, 256]
    - [111, 4950.0]
  - - [25, 256, 18, 128, 25, 25, 25, 256]
    - [117, 3206.0]
  - - [25, 256, 19, 128, 25, 25, 25, 256]
    - [89, 2256.0]
  - - [9, 256, 120, 128, 9, 9, 9, 256]
    - [137, 2198.0]
  - - [9, 256, 18, 128, 9, 9, 9, 256]
    - [153, 912.0]
  - - [9, 256, 19, 128, 9, 9, 9, 256]
    - [149, 947.0]
  - - [1024, 2, 1, 20, 1024, 1024, 1024, 2]
    - [83, 10.0]
- null
- null
- DeviceEfficiency
...
