library/src/blas3/Tensile/Logic/asm_full/navi21_Cijk_Alik_Bljk_HB_GB.yaml
- {MinimumRequiredVersion: 4.26.0}
- navi21
- gfx1030
- [Device 73a2]
    SolutionIndex: 0
    SolutionNameMin: Cijk_Alik_Bljk_HB_MT128x128x8_SN_SU0_SUM0_TT8_16_WG16_8_1_WGM1
    SolutionIndex: 1
    SolutionNameMin: Cijk_Alik_Bljk_HB_MT128x64x16_SN_SU0_SUM0_TT8_8_WG16_8_1_WGM1
    SolutionIndex: 2
    SolutionNameMin: Cijk_Alik_Bljk_HB_MT128x128x16_SN_SU0_SUM0_TT8_16_WG16_8_1_WGM1
    SolutionIndex: 3
    SolutionNameMin: Cijk_Alik_Bljk_HB_MT128x256x16_SN_SU0_SUM0_TT8_16_WG16_16_1_WGM1
    SolutionIndex: 4
    SolutionNameMin: Cijk_Alik_Bljk_HB_MT256x256x16_SN_SU0_SUM0_TT16_16_WG16_16_1_WGM1
    SolutionIndex: 5
    SolutionNameMin: Cijk_Alik_Bljk_HB_MT128x128x32_SN_SU0_SUM0_TT8_16_WG16_8_1_WGM1
    SolutionIndex: 6
    SolutionNameMin: Cijk_Alik_Bljk_HB_MT128x64x16_SN_SU32_SUM3_TT8_8_WG16_8_1_WGM1
    SolutionIndex: 7
    SolutionNameMin: Cijk_Alik_Bljk_HB_MT128x128x16_SN_SU32_SUM3_TT8_16_WG16_8_1_WGM1
    SolutionIndex: 8
    SolutionNameMin: Cijk_Alik_Bljk_HB_MT256x128x16_SN_SU32_SUM3_TT16_16_WG16_8_1_WGM1
    SolutionIndex: 9
    SolutionNameMin: Cijk_Alik_Bljk_HB_MT128x128x16_SN_SU32_SUM3_TT8_8_WG16_16_1_WGM1
    SolutionIndex: 10
    SolutionNameMin: Cijk_Alik_Bljk_HB_MT128x256x16_SN_SU32_SUM3_TT8_16_WG16_16_1_WGM1
    SolutionIndex: 11
    SolutionNameMin: Cijk_Alik_Bljk_HB_MT256x256x16_SN_SU32_SUM3_TT16_16_WG16_16_1_WGM1
    SolutionIndex: 12
    SolutionNameMin: Cijk_Alik_Bljk_HB_MT128x128x32_SN_SU32_SUM3_TT8_16_WG16_8_1_WGM1
    SolutionIndex: 13
    SolutionNameMin: Cijk_Alik_Bljk_HB_MT128x256x8_SN_SU0_SUM0_TT8_16_WG16_16_1_WGM4
    SolutionIndex: 14
    SolutionNameMin: Cijk_Alik_Bljk_HB_MT128x64x16_SN_SU0_SUM0_TT8_8_WG16_8_1_WGM4
    SolutionIndex: 15
    SolutionNameMin: Cijk_Alik_Bljk_HB_MT128x128x16_SN_SU0_SUM0_TT8_16_WG16_8_1_WGM4
    SolutionIndex: 16
    SolutionNameMin: Cijk_Alik_Bljk_HB_MT256x128x16_SN_SU0_SUM0_TT16_16_WG16_8_1_WGM4
    SolutionIndex: 17
    SolutionNameMin: Cijk_Alik_Bljk_HB_MT128x128x16_SN_SU0_SUM0_TT8_8_WG16_16_1_WGM4
    SolutionIndex: 18
    SolutionNameMin: Cijk_Alik_Bljk_HB_MT128x256x16_SN_SU0_SUM0_TT8_16_WG16_16_1_WGM4
    SolutionIndex: 19
    SolutionNameMin: Cijk_Alik_Bljk_HB_MT256x256x16_SN_SU0_SUM0_TT16_16_WG16_16_1_WGM4
    SolutionIndex: 20
    SolutionNameMin: Cijk_Alik_Bljk_HB_MT128x64x16_SN_SU32_SUM3_TT8_8_WG16_8_1_WGM4
    SolutionIndex: 21
    SolutionNameMin: Cijk_Alik_Bljk_HB_MT128x128x16_SN_SU32_SUM3_TT8_16_WG16_8_1_WGM4
    SolutionIndex: 22
    SolutionNameMin: Cijk_Alik_Bljk_HB_MT256x128x16_SN_SU32_SUM3_TT16_16_WG16_8_1_WGM4
    SolutionIndex: 23
    SolutionNameMin: Cijk_Alik_Bljk_HB_MT128x128x16_SN_SU32_SUM3_TT8_8_WG16_16_1_WGM4
    SolutionIndex: 24
    SolutionNameMin: Cijk_Alik_Bljk_HB_MT128x256x16_SN_SU32_SUM3_TT8_16_WG16_16_1_WGM4
    SolutionIndex: 25
    SolutionNameMin: Cijk_Alik_Bljk_HB_MT256x256x16_SN_SU32_SUM3_TT16_16_WG16_16_1_WGM4
    SolutionIndex: 26
    SolutionNameMin: Cijk_Alik_Bljk_HB_MT128x128x32_SN_SU32_SUM3_TT8_16_WG16_8_1_WGM4
    SolutionIndex: 27
    SolutionNameMin: Cijk_Alik_Bljk_HB_MT128x128x16_SN_SU0_SUM0_TT8_16_WG16_8_1_WGM8
    SolutionIndex: 28
    SolutionNameMin: Cijk_Alik_Bljk_HB_MT256x128x16_SN_SU0_SUM0_TT16_16_WG16_8_1_WGM8
    SolutionIndex: 29
    SolutionNameMin: Cijk_Alik_Bljk_HB_MT128x256x16_SN_SU0_SUM0_TT8_16_WG16_16_1_WGM8
    SolutionIndex: 30
    SolutionNameMin: Cijk_Alik_Bljk_HB_MT256x256x16_SN_SU0_SUM0_TT16_16_WG16_16_1_WGM8
    SolutionIndex: 31
    SolutionNameMin: Cijk_Alik_Bljk_HB_MT128x128x32_SN_SU0_SUM0_TT8_16_WG16_8_1_WGM8
    SolutionIndex: 32
    SolutionNameMin: Cijk_Alik_Bljk_HB_MT128x64x16_SN_SU32_SUM3_TT8_8_WG16_8_1_WGM8
    SolutionIndex: 33
    SolutionNameMin: Cijk_Alik_Bljk_HB_MT128x128x16_SN_SU32_SUM3_TT8_16_WG16_8_1_WGM8
    SolutionIndex: 34
    SolutionNameMin: Cijk_Alik_Bljk_HB_MT256x128x16_SN_SU32_SUM3_TT16_16_WG16_8_1_WGM8
    SolutionIndex: 35
    SolutionNameMin: Cijk_Alik_Bljk_HB_MT128x128x16_SN_SU32_SUM3_TT8_8_WG16_16_1_WGM8
    SolutionIndex: 36
    SolutionNameMin: Cijk_Alik_Bljk_HB_MT128x256x16_SN_SU32_SUM3_TT8_16_WG16_16_1_WGM8
    SolutionIndex: 37
    SolutionNameMin: Cijk_Alik_Bljk_HB_MT256x256x16_SN_SU32_SUM3_TT16_16_WG16_16_1_WGM8
    SolutionIndex: 38
    SolutionNameMin: Cijk_Alik_Bljk_HB_MT128x128x32_SN_SU32_SUM3_TT8_16_WG16_8_1_WGM8
    SolutionIndex: 39
    SolutionNameMin: Cijk_Alik_Bljk_HB_MT64x64x16_SN_SU0_SUM0_TT8_8_WG8_8_1_WGM1
    SolutionIndex: 40
    SolutionNameMin: Cijk_Alik_Bljk_HB_MT128x64x16_SN_SU0_SUM0_TT8_8_WG16_8_1_WGM1
    SolutionIndex: 41
    SolutionNameMin: Cijk_Alik_Bljk_HB_MT128x128x16_SN_SU0_SUM0_TT8_8_WG16_16_1_WGM1
    SolutionIndex: 42
    SolutionNameMin: Cijk_Alik_Bljk_HB_MT64x64x16_SN_SU32_SUM3_TT8_8_WG8_8_1_WGM1
    SolutionIndex: 43
    SolutionNameMin: Cijk_Alik_Bljk_HB_MT128x64x16_SN_SU32_SUM3_TT8_8_WG16_8_1_WGM1
    SolutionIndex: 44
    SolutionNameMin: Cijk_Alik_Bljk_HB_MT128x128x16_SN_SU32_SUM3_TT8_8_WG16_16_1_WGM1
    SolutionIndex: 45
    SolutionNameMin: Cijk_Alik_Bljk_HB_MT128x64x32_SN_SU32_SUM3_TT8_8_WG16_8_1_WGM1
    SolutionIndex: 46
    SolutionNameMin: Cijk_Alik_Bljk_HB_MT64x64x16_SN_SU0_SUM0_TT8_8_WG8_8_1_WGM4
    SolutionIndex: 47
    SolutionNameMin: Cijk_Alik_Bljk_HB_MT128x64x16_SN_SU0_SUM0_TT8_8_WG16_8_1_WGM4
    SolutionIndex: 48
    SolutionNameMin: Cijk_Alik_Bljk_HB_MT128x128x16_SN_SU0_SUM0_TT8_8_WG16_16_1_WGM4
    SolutionIndex: 49
    SolutionNameMin: Cijk_Alik_Bljk_HB_MT128x64x8_SN_SU32_SUM3_TT8_8_WG16_8_1_WGM4
    SolutionIndex: 50
    SolutionNameMin: Cijk_Alik_Bljk_HB_MT128x128x8_SN_SU32_SUM3_TT8_8_WG16_16_1_WGM4
    SolutionIndex: 51
    SolutionNameMin: Cijk_Alik_Bljk_HB_MT64x64x16_SN_SU32_SUM3_TT8_8_WG8_8_1_WGM4
    SolutionIndex: 52
    SolutionNameMin: Cijk_Alik_Bljk_HB_MT128x64x16_SN_SU32_SUM3_TT8_8_WG16_8_1_WGM4
    SolutionIndex: 53
    SolutionNameMin: Cijk_Alik_Bljk_HB_MT128x128x16_SN_SU32_SUM3_TT8_8_WG16_16_1_WGM4
    SolutionIndex: 54
    SolutionNameMin: Cijk_Alik_Bljk_HB_MT64x64x16_SN_SU0_SUM0_TT8_8_WG8_8_1_WGM8
    SolutionIndex: 55
    SolutionNameMin: Cijk_Alik_Bljk_HB_MT128x64x16_SN_SU0_SUM0_TT8_8_WG16_8_1_WGM8
    SolutionIndex: 56
    SolutionNameMin: Cijk_Alik_Bljk_HB_MT64x64x32_SN_SU0_SUM0_TT8_8_WG8_8_1_WGM8
    SolutionIndex: 57
    SolutionNameMin: Cijk_Alik_Bljk_HB_MT128x128x8_SN_SU32_SUM3_TT8_8_WG16_16_1_WGM8
    SolutionIndex: 58
    SolutionNameMin: Cijk_Alik_Bljk_HB_MT64x64x16_SN_SU32_SUM3_TT8_8_WG8_8_1_WGM8
    SolutionIndex: 59
    SolutionNameMin: Cijk_Alik_Bljk_HB_MT128x64x16_SN_SU32_SUM3_TT8_8_WG16_8_1_WGM8
    SolutionIndex: 60
    SolutionNameMin: Cijk_Alik_Bljk_HB_MT128x128x16_SN_SU32_SUM3_TT8_8_WG16_16_1_WGM8
    SolutionIndex: 61
    SolutionNameMin: Cijk_Alik_Bljk_HB_MT16x16x8_SN_SU0_SUM0_TT2_2_WG8_8_1_WGM1
    SolutionIndex: 62
    SolutionNameMin: Cijk_Alik_Bljk_HB_MT32x16x8_SN_SU0_SUM0_TT2_2_WG16_8_1_WGM1
    SolutionIndex: 63
    SolutionNameMin: Cijk_Alik_Bljk_HB_MT64x32x8_SN_SU0_SUM0_TT4_4_WG16_8_1_WGM1
    SolutionIndex: 64
    SolutionNameMin: Cijk_Alik_Bljk_HB_MT64x64x8_SN_SU0_SUM0_TT4_4_WG16_16_1_WGM1
    SolutionIndex: 65
    SolutionNameMin: Cijk_Alik_Bljk_HB_MT16x16x16_SN_SU0_SUM0_TT2_2_WG8_8_1_WGM1
    SolutionIndex: 66
    SolutionNameMin: Cijk_Alik_Bljk_HB_MT16x16x32_SN_SU0_SUM0_TT2_2_WG8_8_1_WGM1
    SolutionIndex: 67
    SolutionNameMin: Cijk_Alik_Bljk_HB_MT16x16x8_SN_SU32_SUM3_TT2_2_WG8_8_1_WGM1
    SolutionIndex: 68
    SolutionNameMin: Cijk_Alik_Bljk_HB_MT32x32x8_SN_SU32_SUM3_TT4_4_WG8_8_1_WGM1
    SolutionIndex: 69
    SolutionNameMin: Cijk_Alik_Bljk_HB_MT32x16x8_SN_SU32_SUM3_TT2_2_WG16_8_1_WGM1
    SolutionIndex: 70
    SolutionNameMin: Cijk_Alik_Bljk_HB_MT64x32x8_SN_SU32_SUM3_TT4_4_WG16_8_1_WGM1
    SolutionIndex: 71
    SolutionNameMin: Cijk_Alik_Bljk_HB_MT64x64x8_SN_SU32_SUM3_TT4_4_WG16_16_1_WGM1
    SolutionIndex: 72
    SolutionNameMin: Cijk_Alik_Bljk_HB_MT16x16x16_SN_SU32_SUM3_TT2_2_WG8_8_1_WGM1
    SolutionIndex: 73
    SolutionNameMin: Cijk_Alik_Bljk_HB_MT32x16x16_SN_SU32_SUM3_TT2_2_WG16_8_1_WGM1
    SolutionIndex: 74
    SolutionNameMin: Cijk_Alik_Bljk_HB_MT64x32x16_SN_SU32_SUM3_TT4_4_WG16_8_1_WGM1
    SolutionIndex: 75
    SolutionNameMin: Cijk_Alik_Bljk_HB_MT64x32x8_SN_SU0_SUM0_TT4_4_WG16_8_1_WGM4
    SolutionIndex: 76
    SolutionNameMin: Cijk_Alik_Bljk_HB_MT64x64x8_SN_SU0_SUM0_TT4_4_WG16_16_1_WGM4
    SolutionIndex: 77
    SolutionNameMin: Cijk_Alik_Bljk_HB_MT16x16x16_SN_SU0_SUM0_TT2_2_WG8_8_1_WGM4
    SolutionIndex: 78
    SolutionNameMin: Cijk_Alik_Bljk_HB_MT16x16x32_SN_SU0_SUM0_TT2_2_WG8_8_1_WGM4
    SolutionIndex: 79
    SolutionNameMin: Cijk_Alik_Bljk_HB_MT32x32x8_SN_SU32_SUM3_TT4_4_WG8_8_1_WGM4
    SolutionIndex: 80
    SolutionNameMin: Cijk_Alik_Bljk_HB_MT64x32x8_SN_SU32_SUM3_TT4_4_WG16_8_1_WGM4
    SolutionIndex: 81
    SolutionNameMin: Cijk_Alik_Bljk_HB_MT64x64x8_SN_SU32_SUM3_TT4_4_WG16_16_1_WGM4
    SolutionIndex: 82
    SolutionNameMin: Cijk_Alik_Bljk_HB_MT16x16x16_SN_SU32_SUM3_TT2_2_WG8_8_1_WGM4
    SolutionIndex: 83
    SolutionNameMin: Cijk_Alik_Bljk_HB_MT32x32x16_SN_SU32_SUM3_TT4_4_WG8_8_1_WGM4
    SolutionIndex: 84
    SolutionNameMin: Cijk_Alik_Bljk_HB_MT16x16x8_SN_SU0_SUM0_TT2_2_WG8_8_1_WGM8
    SolutionIndex: 85
    SolutionNameMin: Cijk_Alik_Bljk_HB_MT64x32x8_SN_SU0_SUM0_TT4_4_WG16_8_1_WGM8
    SolutionIndex: 86
    SolutionNameMin: Cijk_Alik_Bljk_HB_MT64x64x8_SN_SU0_SUM0_TT4_4_WG16_16_1_WGM8
    SolutionIndex: 87
    SolutionNameMin: Cijk_Alik_Bljk_HB_MT16x16x16_SN_SU0_SUM0_TT2_2_WG8_8_1_WGM8
    SolutionIndex: 88
    SolutionNameMin: Cijk_Alik_Bljk_HB_MT16x16x8_SN_SU32_SUM3_TT2_2_WG8_8_1_WGM8
    SolutionIndex: 89
    SolutionNameMin: Cijk_Alik_Bljk_HB_MT32x32x8_SN_SU32_SUM3_TT4_4_WG8_8_1_WGM8
    SolutionIndex: 90
    SolutionNameMin: Cijk_Alik_Bljk_HB_MT64x32x8_SN_SU32_SUM3_TT4_4_WG16_8_1_WGM8
    SolutionIndex: 91
    SolutionNameMin: Cijk_Alik_Bljk_HB_MT32x32x8_SN_SU32_SUM3_TT2_2_WG16_16_1_WGM8
    SolutionIndex: 92
    SolutionNameMin: Cijk_Alik_Bljk_HB_MT64x64x8_SN_SU32_SUM3_TT4_4_WG16_16_1_WGM8
    SolutionIndex: 93
    SolutionNameMin: Cijk_Alik_Bljk_HB_MT32x16x16_SN_SU32_SUM3_TT2_2_WG16_8_1_WGM8
    SolutionIndex: 94
    SolutionNameMin: Cijk_Alik_Bljk_HB_MT64x32x16_SN_SU32_SUM3_TT4_4_WG16_8_1_WGM8
    SolutionIndex: 95
    SolutionNameMin: Cijk_Alik_Bljk_HB_MT64x64x16_SN_SU32_SUM3_TT4_4_WG16_16_1_WGM8
    SolutionIndex: 96
    SolutionNameMin: Cijk_Alik_Bljk_HB_MT16x16x32_SN_SU32_SUM3_TT2_2_WG8_8_1_WGM8
    SolutionIndex: 97
    SolutionNameMin: Cijk_Alik_Bljk_HB_MT64x16x16_SN_SU32_SUM3_TT4_2_WG16_8_1_WGM1
    SolutionIndex: 98
    SolutionNameMin: Cijk_Alik_Bljk_HB_MT64x16x16_SN_SU32_SUM3_TT4_2_WG16_8_1_WGM4
    SolutionIndex: 99
    SolutionNameMin: Cijk_Alik_Bljk_HB_GB_MT16x16x8_SN_EPS1_GRVW2_LRVW2_SU0_SUM0_SUS0_TT2_2_VW2_WG8_8_1_WGM1
    SolutionIndex: 100
    SolutionNameMin: Cijk_Alik_Bljk_HB_GB_MT16x16x16_SN_EPS0_GRVW2_LRVW2_SU32_SUM3_SUS128_TT2_2_VW2_WG8_8_1_WGM8
    SolutionIndex: 101
    SolutionNameMin: Cijk_Alik_Bljk_HB_GB_MT16x16x16_SN_EPS0_GRVW2_LRVW2_SU32_SUM3_SUS128_TT2_2_VW2_WG8_8_1_WGM4
    SolutionIndex: 102
    SolutionNameMin: Cijk_Alik_Bljk_HB_GB_MT16x16x8_SN_EPS1_GRVW2_LRVW2_SU32_SUM3_SUS128_TT2_2_VW2_WG8_8_1_WGM1
    SolutionIndex: 103
    SolutionNameMin: Cijk_Alik_Bljk_HB_GB_MT64x32x8_SN_EPS1_GRVW2_LRVW2_SU32_SUM3_SUS128_TT4_4_VW2_WG16_8_1_WGM4
    SolutionIndex: 104
    SolutionNameMin: Cijk_Alik_Bljk_HB_GB_MT16x16x16_SN_EPS0_GRVW2_LRVW2_SU32_SUM3_SUS128_TT2_2_VW2_WG8_8_1_WGM1
    SolutionIndex: 105
    SolutionNameMin: Cijk_Alik_Bljk_HB_GB_MT16x16x16_SN_EPS1_GRVW2_LRVW2_SU32_SUM3_SUS128_TT2_2_VW2_WG8_8_1_WGM1
    SolutionIndex: 106
    SolutionNameMin: Cijk_Alik_Bljk_HB_GB_MT32x32x8_SN_EPS1_GRVW2_LRVW2_SU32_SUM3_SUS128_TT2_2_VW2_WG16_16_1_WGM1
    SolutionIndex: 107
    SolutionNameMin: Cijk_Alik_Bljk_HB_GB_MT64x64x8_SN_EPS1_GRVW2_LRVW2_SU32_SUM3_SUS128_TT4_4_VW2_WG16_16_1_WGM4
- - - [2944, 4288, 1, 1280]
    - [10, 86.451]
  - - [2368, 5888, 1, 256]
    - [10, 77.708]
  - - [5888, 1856, 1, 256]
    - [33, 78.125]
  - - [704, 6784, 1, 256]
    - [33, 66.557]
  - - [512, 24000, 1, 1536]
    - [24, 84.514]
  - - [5888, 1856, 1, 3328]
    - [16, 81.148]
  - - [5056, 704, 1, 256]
    - [21, 61.953]
  - - [5888, 2944, 1, 3328]
    - [16, 88.035]
  - - [1856, 4288, 1, 256]
    - [36, 69.133]
  - - [5056, 5056, 1, 3328]
    - [36, 87.324]
  - - [1408, 5888, 1, 1280]
    - [18, 78.605]
  - - [1024, 3584, 1, 3328]
    - [24, 70.008]
  - - [512, 48000, 1, 2048]
    - [34, 90.081]
  - - [448, 3584, 1, 3328]
    - [10, 56.198]
  - - [5888, 1408, 1, 1280]
    - [36, 78.642]
  - - [1024, 2368, 1, 256]
    - [20, 59.64]
  - - [5056, 6784, 1, 1280]
    - [36, 89.515]
  - - [5056, 5056, 1, 1280]
    - [36, 86.871]
  - - [448, 5056, 1, 256]
    - [6, 54.639]
  - - [6784, 448, 1, 256]
    - [9, 55.896]
  - - [1760, 6400, 1, 1760]
    - [29, 87.214]
  - - [5888, 704, 1, 1280]
    - [36, 74.315]
  - - [6784, 4288, 1, 3328]
    - [18, 88.127]
  - - [1856, 2368, 1, 3328]
    - [38, 67.962]
  - - [5888, 2944, 1, 1280]
    - [16, 85.49]
  - - [5888, 1024, 1, 256]
    - [21, 76.83]
  - - [16384, 3200, 1, 4096]
    - [11, 78.684]
  - - [1408, 2944, 1, 256]
    - [35, 63.464]
  - - [6784, 5056, 1, 3328]
    - [3, 89.824]
  - - [5056, 5056, 1, 256]
    - [7, 83.803]
  - - [1024, 3584, 1, 1280]
    - [7, 74.137]
  - - [2368, 2944, 1, 1280]
    - [27, 74.994]
  - - [6784, 6784, 1, 1280]
    - [10, 90.266]
  - - [1408, 4288, 1, 1280]
    - [18, 73.62]
  - - [3584, 4288, 1, 1280]
    - [10, 84.06]
  - - [2368, 704, 1, 1280]
    - [18, 55.483]
  - - [5056, 4288, 1, 3328]
    - [36, 89.282]
  - - [3584, 2368, 1, 3328]
    - [18, 80.62]
  - - [6784, 448, 1, 1280]
    - [21, 69.814]
  - - [4288, 2944, 1, 256]
    - [21, 81.401]
  - - [6144, 24000, 1, 2560]
    - [4, 91.101]
  - - [5056, 2368, 1, 1280]
    - [34, 81.076]
  - - [448, 3584, 1, 1280]
    - [10, 54.29]
  - - [6784, 5888, 1, 256]
    - [10, 90.264]
  - - [1024, 1408, 1, 256]
    - [32, 55.957]
  - - [2368, 2368, 1, 3328]
    - [18, 70.728]
  - - [5056, 704, 1, 3328]
    - [36, 67.344]
  - - [1408, 1856, 1, 256]
    - [35, 58.63]
  - - [3584, 2368, 1, 1280]
    - [36, 80.126]
  - - [704, 5888, 1, 256]
    - [36, 66.092]
  - - [2560, 1600, 1, 2560]
    - [37, 74.985]
  - - [6144, 5984, 1, 2048]
    - [25, 89.707]
  - - [3584, 704, 1, 3328]
    - [15, 65.58]
  - - [1408, 1408, 1, 256]
    - [23, 56.789]
  - - [448, 4288, 1, 256]
    - [6, 51.03]
  - - [704, 2368, 1, 1280]
    - [3, 56.155]
  - - [1856, 2368, 1, 1280]
    - [5, 66.063]
  - - [1408, 1024, 1, 1280]
    - [21, 60.669]
  - - [6784, 704, 1, 256]
    - [23, 61.702]
  - - [2048, 1600, 1, 512]
    - [21, 67.608]
  - - [2048, 7000, 1, 2048]
    - [25, 79.012]
  - - [1408, 3584, 1, 256]
    - [18, 71.991]
  - - [3584, 4288, 1, 3328]
    - [19, 85.468]
  - - [5888, 1856, 1, 1280]
    - [16, 79.4]
  - - [5056, 1024, 1, 3328]
    - [10, 78.572]
  - - [2368, 3584, 1, 1280]
    - [18, 79.887]
  - - [2944, 3584, 1, 3328]
    - [18, 90.088]
  - - [6784, 2944, 1, 256]
    - [33, 86.681]
  - - [4288, 2368, 1, 3328]
    - [19, 78.653]
  - - [1856, 2368, 1, 256]
    - [33, 67.004]
  - - [3584, 6784, 1, 3328]
    - [18, 90.295]
  - - [5056, 4288, 1, 1280]
    - [24, 88.414]
  - - [6784, 1856, 1, 3328]
    - [36, 81.653]
  - - [1408, 5056, 1, 1280]
    - [18, 76.156]
  - - [6784, 5888, 1, 3328]
    - [3, 92.269]
  - - [8448, 12000, 1, 2816]
    - [16, 92.759]
  - - [4096, 800, 1, 1024]
    - [21, 64.608]
  - - [8192, 3200, 1, 2048]
    - [11, 83.677]
  - - [2368, 5056, 1, 1280]
    - [18, 82.56]
  - - [1024, 5056, 1, 1280]
    - [24, 76.352]
  - - [4288, 1024, 1, 256]
    - [10, 69.855]
  - - [2368, 1408, 1, 256]
    - [9, 64.353]
  - - [5888, 448, 1, 1280]
    - [7, 61.865]
  - - [704, 5888, 1, 3328]
    - [36, 77.385]
  - - [1024, 6784, 1, 1280]
    - [10, 85.511]
  - - [3584, 2944, 1, 1280]
    - [36, 80.609]
  - - [512, 24000, 1, 2048]
    - [34, 84.59]
  - - [1408, 5056, 1, 3328]
    - [22, 76.632]
  - - [1856, 1856, 1, 3328]
    - [10, 65.208]
  - - [2560, 800, 1, 2560]
    - [34, 64.998]
  - - [2368, 2368, 1, 256]
    - [35, 63.595]
  - - [4288, 4288, 1, 1280]
    - [27, 84.478]
  - - [5888, 1024, 1, 1280]
    - [27, 77.13]
  - - [512, 48000, 1, 2560]
    - [22, 89.989]
  - - [704, 6784, 1, 3328]
    - [24, 71.096]
  - - [2560, 6400, 1, 2560]
    - [25, 90.665]
  - - [5056, 1024, 1, 1280]
    - [18, 76.704]
  - - [448, 5888, 1, 3328]
    - [10, 65.185]
  - - [1024, 2944, 1, 1280]
    - [7, 70.908]
  - - [5056, 5888, 1, 1280]
    - [24, 89.616]
  - - [448, 6784, 1, 256]
    - [7, 59.945]
  - - [3584, 5888, 1, 256]
    - [36, 87.448]
  - - [2944, 3584, 1, 256]
    - [18, 86.138]
  - - [6784, 1024, 1, 3328]
    - [10, 88.132]
  - - [6784, 2944, 1, 3328]
    - [10, 86.715]
  - - [2944, 5056, 1, 3328]
    - [18, 88.459]
  - - [6784, 2368, 1, 1280]
    - [24, 83.104]
  - - [4288, 5888, 1, 1280]
    - [10, 89.549]
  - - [4288, 4288, 1, 256]
    - [33, 81.556]
  - - [4288, 1856, 1, 1280]
    - [27, 77.511]
  - - [1856, 2944, 1, 3328]
    - [29, 81.926]
  - - [256, 6784, 1, 3328]
    - [35, 72.458]
  - - [5056, 1024, 1, 256]
    - [10, 70.55]
  - - [5056, 1856, 1, 3328]
    - [36, 80.737]
  - - [1856, 1408, 1, 256]
    - [23, 58.449]
  - - [4096, 7000, 1, 4096]
    - [11, 86.535]
  - - [5056, 256, 1, 3328]
    - [7, 55.35]
  - - [1024, 5888, 1, 1280]
    - [2, 77.52]
  - - [6144, 24000, 1, 2048]
    - [11, 87.573]
  - - [5056, 3584, 1, 256]
    - [7, 82.515]
  - - [1856, 1024, 1, 1280]
    - [3, 63.092]
  - - [1856, 1856, 1, 1280]
    - [18, 63.753]
  - - [4096, 400, 1, 1024]
    - [21, 51.973]
  - - [3072, 24000, 1, 1024]
    - [34, 91.268]
  - - [1856, 1024, 1, 3328]
    - [10, 66.094]
  - - [5888, 5888, 1, 3328]
    - [30, 91.198]
  - - [6784, 1024, 1, 256]
    - [29, 78.633]
  - - [5056, 5888, 1, 3328]
    - [36, 90.034]
  - - [1856, 1024, 1, 256]
    - [23, 50.534]
  - - [512, 48000, 1, 1536]
    - [22, 89.971]
  - - [5056, 1408, 1, 3328]
    - [36, 77.949]
  - - [8448, 5984, 1, 2816]
    - [34, 90.981]
  - - [4288, 1024, 1, 3328]
    - [18, 81.443]
  - - [1024, 24000, 1, 2560]
    - [22, 87.117]
  - - [2944, 1408, 1, 3328]
    - [36, 77.482]
  - - [2944, 4288, 1, 3328]
    - [18, 88.342]
  - - [5056, 2944, 1, 256]
    - [21, 83.117]
  - - [2368, 1856, 1, 256]
    - [23, 64.782]
  - - [1408, 3584, 1, 3328]
    - [18, 76.034]
  - - [2368, 6784, 1, 256]
    - [18, 78.874]
  - - [5056, 1408, 1, 1280]
    - [24, 77.011]
  - - [704, 3584, 1, 1280]
    - [7, 68.294]
  - - [1408, 5888, 1, 3328]
    - [18, 79.668]
  - - [1856, 5056, 1, 256]
    - [21, 73.972]
  - - [6784, 6784, 1, 256]
    - [21, 88.31]
  - - [2368, 4288, 1, 1280]
    - [10, 84.489]
  - - [3584, 1856, 1, 1280]
    - [16, 76.262]
  - - [5888, 5056, 1, 256]
    - [21, 85.337]
  - - [8448, 48000, 1, 2816]
    - [34, 94.162]
  - - [3584, 448, 1, 256]
    - [20, 50.504]
  - - [3584, 3584, 1, 1280]
    - [36, 89.655]
  - - [256, 6784, 1, 256]
    - [23, 62.92]
  - - [1856, 3584, 1, 3328]
    - [18, 83.614]
  - - [5056, 256, 1, 1280]
    - [14, 53.868]
  - - [3584, 3584, 1, 256]
    - [18, 85.481]
  - - [6784, 4288, 1, 1280]
    - [10, 87.769]
  - - [704, 5056, 1, 256]
    - [33, 62.027]
  - - [2944, 2368, 1, 1280]
    - [24, 75.269]
  - - [6784, 3584, 1, 256]
    - [18, 87.956]
  - - [2944, 2944, 1, 3328]
    - [18, 83.108]
  - - [5056, 6784, 1, 256]
    - [21, 87.354]
  - - [1408, 4288, 1, 3328]
    - [19, 76.077]
  - - [6784, 256, 1, 1280]
    - [9, 70.83]
  - - [2368, 704, 1, 3328]
    - [24, 58.616]
  - - [3584, 6784, 1, 256]
    - [33, 87.083]
  - - [5056, 1856, 1, 256]
    - [21, 77.153]
  - - [4608, 5984, 1, 1536]
    - [37, 88.894]
  - - [1760, 3200, 1, 1760]
    - [2, 82.941]
  - - [4096, 1600, 1, 1024]
    - [22, 75.686]
  - - [704, 4288, 1, 256]
    - [33, 58.58]
  - - [1408, 6784, 1, 1280]
    - [18, 80.764]
  - - [7680, 24000, 1, 2560]
    - [25, 92.576]
  - - [4608, 48000, 1, 1536]
    - [10, 92.479]
  - - [6144, 48000, 1, 2048]
    - [11, 89.172]
  - - [1024, 24000, 1, 1536]
    - [22, 89.695]
  - - [5056, 2368, 1, 3328]
    - [16, 81.836]
  - - [2944, 4288, 1, 256]
    - [18, 79.07]
  - - [1408, 3584, 1, 1280]
    - [18, 75.538]
  - - [8192, 1600, 1, 2048]
    - [10, 72.163]
  - - [512, 24000, 1, 2560]
    - [22, 83.941]
  - - [2368, 6784, 1, 3328]
    - [36, 82.889]
  - - [5056, 704, 1, 1280]
    - [21, 68.813]
  - - [1856, 4288, 1, 3328]
    - [25, 76.451]
  - - [1408, 5888, 1, 256]
    - [10, 75.682]
  - - [3584, 704, 1, 1280]
    - [33, 67.899]
  - - [3584, 448, 1, 3328]
    - [29, 55.72]
  - - [704, 2368, 1, 3328]
    - [10, 58.991]
  - - [448, 5056, 1, 3328]
    - [7, 63.415]
  - - [4288, 448, 1, 256]
    - [17, 50.152]
  - - [448, 5888, 1, 256]
    - [7, 53.865]
  - - [2048, 3200, 1, 512]
    - [22, 75.847]
  - - [5888, 2368, 1, 256]
    - [33, 80.167]
  - - [6784, 704, 1, 3328]
    - [24, 72.397]
  - - [1408, 2944, 1, 3328]
    - [36, 77.947]
  - - [4608, 12000, 1, 1536]
    - [10, 91.32]
  - - [2368, 704, 1, 256]
    - [9, 42.6]
  - - [3584, 2368, 1, 256]
    - [33, 77.699]
  - - [5888, 5056, 1, 1280]
    - [10, 89.091]
  - - [8448, 24000, 1, 2816]
    - [16, 93.49]
  - - [3584, 3584, 1, 3328]
    - [18, 89.601]
  - - [5888, 6784, 1, 256]
    - [21, 88.804]
  - - [4288, 2944, 1, 3328]
    - [16, 85.743]
  - - [256, 5056, 1, 1280]
    - [14, 57.676]
  - - [6784, 5888, 1, 1280]
    - [10, 92.215]
  - - [2048, 800, 1, 512]
    - [36, 52.246]
  - - [5888, 4288, 1, 1280]
    - [10, 88.978]
  - - [1024, 24000, 1, 2048]
    - [37, 86.368]
  - - [1408, 1856, 1, 1280]
    - [33, 66.67]
  - - [5888, 448, 1, 3328]
    - [10, 63.881]
  - - [704, 5888, 1, 1280]
    - [10, 76.677]
  - - [1024, 6784, 1, 3328]
    - [25, 87.338]
  - - [704, 2944, 1, 1280]
    - [10, 68.411]
  - - [5056, 2944, 1, 3328]
    - [16, 86.361]
  - - [1408, 1408, 1, 3328]
    - [36, 69.993]
  - - [448, 4288, 1, 1280]
    - [36, 63.539]
  - - [3584, 704, 1, 256]
    - [32, 61.585]
  - - [3584, 1408, 1, 3328]
    - [18, 75.513]
  - - [2368, 1024, 1, 1280]
    - [21, 64.414]
  - - [2944, 6784, 1, 1280]
    - [24, 86.187]
  - - [1856, 6784, 1, 256]
    - [18, 76.124]
  - - [4288, 448, 1, 3328]
    - [18, 67.186]
  - - [4288, 3584, 1, 1280]
    - [10, 84.935]
  - - [6144, 12000, 1, 2048]
    - [11, 85.411]
  - - [8192, 800, 1, 2048]
    - [12, 62.878]
  - - [5888, 1024, 1, 3328]
    - [10, 76.99]
  - - [704, 6784, 1, 1280]
    - [36, 70.895]
  - - [704, 5056, 1, 1280]
    - [33, 70.852]
  - - [2944, 1856, 1, 256]
    - [35, 66.153]
  - - [3584, 5056, 1, 256]
    - [21, 81.87]
  - - [5888, 5056, 1, 3328]
    - [4, 89.934]
  - - [3584, 6784, 1, 1280]
    - [36, 89.54]
  - - [1856, 5888, 1, 256]
    - [18, 77.34]
  - - [4288, 4288, 1, 3328]
    - [29, 84.669]
  - - [4288, 1408, 1, 1280]
    - [10, 75.298]
  - - [4288, 2368, 1, 256]
    - [21, 76.995]
  - - [2944, 5056, 1, 1280]
    - [10, 87.649]
  - - [6784, 2368, 1, 3328]
    - [10, 83.774]
  - - [4288, 1856, 1, 3328]
    - [18, 76.413]
  - - [1856, 2944, 1, 1280]
    - [18, 80.654]
  - - [2048, 1600, 1, 2048]
    - [26, 65.109]
  - - [4288, 6784, 1, 3328]
    - [19, 88.04]
  - - [3584, 1024, 1, 1280]
    - [33, 70.293]
  - - [1024, 4288, 1, 256]
    - [20, 67.049]
  - - [5888, 3584, 1, 3328]
    - [10, 91.556]
  - - [5056, 3584, 1, 3328]
    - [36, 88.549]
  - - [2368, 1408, 1, 1280]
    - [27, 70.18]
  - - [5056, 2944, 1, 1280]
    - [16, 84.137]
  - - [1024, 6784, 1, 256]
    - [7, 81.078]
  - - [3584, 2944, 1, 256]
    - [33, 84.232]
  - - [3584, 1408, 1, 1280]
    - [36, 73.913]
  - - [5056, 6784, 1, 3328]
    - [19, 90.072]
  - - [3584, 4288, 1, 256]
    - [33, 78.806]
  - - [1856, 6784, 1, 3328]
    - [18, 81.725]
  - - [5056, 1408, 1, 256]
    - [7, 75.461]
  - - [3584, 1024, 1, 256]
    - [33, 69.444]
  - - [5888, 5888, 1, 256]
    - [36, 88.527]
  - - [4288, 1024, 1, 1280]
    - [18, 80.358]
  - - [448, 6784, 1, 3328]
    - [36, 74.279]
  - - [2944, 1408, 1, 1280]
    - [36, 76.217]
  - - [2944, 1856, 1, 3328]
    - [29, 69.652]
  - - [3584, 5888, 1, 1280]
    - [36, 91.06]
  - - [6784, 1856, 1, 1280]
    - [24, 80.988]
  - - [5888, 256, 1, 3328]
    - [21, 65.776]
  - - [1856, 5888, 1, 3328]
    - [18, 83.778]
  - - [3584, 1408, 1, 256]
    - [33, 76.49]
  - - [704, 3584, 1, 3328]
    - [33, 68.887]
  - - [4096, 3200, 1, 1024]
    - [22, 82.447]
  - - [5056, 448, 1, 1280]
    - [33, 60.638]
  - - [3584, 1856, 1, 3328]
    - [28, 80.832]
  - - [2944, 1024, 1, 256]
    - [29, 65.797]
  - - [2368, 4288, 1, 3328]
    - [18, 85.982]
  - - [1024, 1408, 1, 1280]
    - [1, 61.914]
  - - [6784, 5056, 1, 256]
    - [21, 86.19]
  - - [3584, 5056, 1, 3328]
    - [30, 88.276]
  - - [4288, 5888, 1, 256]
    - [10, 86.377]
  - - [2944, 6784, 1, 256]
    - [33, 86.501]
  - - [2368, 2368, 1, 1280]
    - [18, 69.785]
  - - [1856, 3584, 1, 1280]
    - [18, 81.881]
  - - [5056, 3584, 1, 1280]
    - [10, 87.929]
  - - [256, 5888, 1, 256]
    - [23, 54.885]
  - - [1856, 1408, 1, 3328]
    - [33, 67.216]
  - - [1024, 4288, 1, 3328]
    - [10, 82.01]
  - - [2944, 2368, 1, 3328]
    - [18, 76.248]
  - - [704, 4288, 1, 3328]
    - [24, 73.976]
  - - [1024, 1856, 1, 1280]
    - [29, 63.444]
  - - [2048, 6400, 1, 2048]
    - [25, 84.374]
  - - [512, 48000, 1, 2816]
    - [34, 91.301]
  - - [5124, 9124, 1, 2560]
    - [10, 86.217]
  - - [1024, 5888, 1, 256]
    - [7, 72.661]
  - - [1408, 2368, 1, 256]
    - [35, 62.842]
  - - [2944, 704, 1, 3328]
    - [24, 72.271]
  - - [2944, 2944, 1, 1280]
    - [24, 81.973]
  - - [6784, 256, 1, 3328]
    - [9, 71.908]
  - - [1408, 5056, 1, 256]
    - [18, 68.84]
  - - [4608, 24000, 1, 1536]
    - [10, 91.958]
  - - [1408, 4288, 1, 256]
    - [35, 66.11]
  - - [5888, 2368, 1, 1280]
    - [24, 82.806]
  - - [2368, 5888, 1, 1280]
    - [10, 82.093]
  - - [5888, 256, 1, 1280]
    - [33, 63.577]
  - - [2368, 1856, 1, 3328]
    - [31, 68.373]
  - - [2944, 704, 1, 256]
    - [35, 55.774]
  - - [2368, 6784, 1, 1280]
    - [18, 82.826]
  - - [2368, 1024, 1, 3328]
    - [33, 66.884]
  - - [1856, 4288, 1, 1280]
    - [29, 74.601]
  - - [704, 3584, 1, 256]
    - [9, 59.185]
  - - [704, 2944, 1, 3328]
    - [10, 72.587]
  - - [1856, 5056, 1, 3328]
    - [29, 79.896]
  - - [3584, 5056, 1, 1280]
    - [36, 86.936]
  - - [2944, 1024, 1, 3328]
    - [10, 74.908]
  - - [1408, 6784, 1, 256]
    - [21, 79.393]
  - - [6784, 1408, 1, 3328]
    - [10, 81.904]
  - - [1024, 2368, 1, 1280]
    - [21, 65.522]
  - - [6784, 2944, 1, 1280]
    - [10, 86.124]
  - - [3584, 448, 1, 1280]
    - [33, 52.805]
  - - [2944, 6784, 1, 3328]
    - [25, 86.695]
  - - [448, 5056, 1, 1280]
    - [7, 60.829]
  - - [4288, 704, 1, 256]
    - [21, 58.463]
  - - [5888, 704, 1, 256]
    - [33, 66.347]
  - - [256, 5888, 1, 3328]
    - [7, 66.076]
  - - [6784, 4288, 1, 256]
    - [33, 84.75]
  - - [5888, 256, 1, 256]
    - [35, 54.405]
  - - [6784, 1024, 1, 1280]
    - [10, 87.525]
  - - [2944, 704, 1, 1280]
    - [24, 68.443]
  - - [6784, 3584, 1, 1280]
    - [10, 90.329]
  - - [1408, 2944, 1, 1280]
    - [29, 76.023]
  - - [2048, 800, 1, 2048]
    - [24, 56.733]
  - - [1408, 2368, 1, 3328]
    - [33, 71.966]
  - - [2368, 2944, 1, 256]
    - [33, 68.75]
  - - [2944, 5888, 1, 256]
    - [10, 86.343]
  - - [3584, 1856, 1, 256]
    - [21, 73.789]
  - - [4288, 2944, 1, 1280]
    - [28, 84.157]
  - - [5056, 448, 1, 3328]
    - [33, 63.349]
  - - [4288, 5056, 1, 3328]
    - [18, 88.951]
  - - [256, 5056, 1, 3328]
    - [14, 56.189]
  - - [5056, 2368, 1, 256]
    - [21, 78.768]
  - - [4288, 704, 1, 3328]
    - [36, 73.893]
  - - [448, 3584, 1, 256]
    - [1, 47.748]
  - - [1024, 1408, 1, 3328]
    - [7, 63.306]
  - - [2944, 5888, 1, 1280]
    - [10, 89.659]
  - - [5888, 3584, 1, 256]
    - [29, 88.644]
  - - [1408, 1856, 1, 3328]
    - [33, 67.933]
  - - [6784, 1408, 1, 1280]
    - [10, 80.778]
  - - [704, 2944, 1, 256]
    - [9, 57.764]
  - - [2944, 5888, 1, 3328]
    - [18, 89.666]
  - - [1408, 6784, 1, 3328]
    - [18, 81.405]
  - - [1408, 1408, 1, 1280]
    - [36, 66.453]
  - - [16384, 400, 1, 4096]
    - [11, 60.27]
  - - [448, 4288, 1, 3328]
    - [36, 66.737]
  - - [704, 2368, 1, 256]
    - [20, 49.728]
  - - [5888, 2368, 1, 3328]
    - [10, 83.453]
  - - [5124, 9124, 1, 1760]
    - [18, 89.835]
  - - [4288, 5056, 1, 256]
    - [33, 82.752]
  - - [4288, 448, 1, 1280]
    - [29, 62.438]
  - - [5888, 704, 1, 3328]
    - [36, 77.259]
  - - [4288, 3584, 1, 3328]
    - [25, 85.504]
  - - [1408, 1024, 1, 256]
    - [35, 52.765]
  - - [8192, 400, 1, 2048]
    - [24, 60.295]
  - - [2560, 7000, 1, 2560]
    - [25, 87.088]
  - - [6784, 6784, 1, 3328]
    - [3, 90.575]
  - - [704, 5056, 1, 3328]
    - [36, 66.88]
  - - [2368, 2944, 1, 3328]
    - [18, 76.492]
  - - [2368, 3584, 1, 256]
    - [18, 74.306]
  - - [5124, 9124, 1, 4096]
    - [37, 79.982]
  - - [7680, 48000, 1, 2560]
    - [25, 93.005]
  - - [1024, 48000, 1, 2816]
    - [22, 92.175]
  - - [1856, 1856, 1, 256]
    - [35, 56.839]
  - - [4288, 1408, 1, 3328]
    - [18, 76.444]
  - - [5124, 9124, 1, 2048]
    - [11, 82.285]
  - - [4288, 5056, 1, 1280]
    - [10, 88.22]
  - - [5888, 6784, 1, 1280]
    - [28, 90.846]
  - - [1760, 1600, 1, 1760]
    - [13, 68.693]
  - - [5888, 1408, 1, 3328]
    - [10, 79.738]
  - - [256, 5056, 1, 256]
    - [6, 51.127]
  - - [7680, 12000, 1, 2560]
    - [25, 91.252]
  - - [2368, 5056, 1, 256]
    - [10, 74.522]
  - - [1024, 5056, 1, 256]
    - [33, 71.427]
  - - [2368, 1408, 1, 3328]
    - [17, 69.081]
  - - [1024, 48000, 1, 1536]
    - [22, 92.044]
  - - [5888, 448, 1, 256]
    - [23, 49.848]
  - - [2560, 3200, 1, 2560]
    - [37, 77.972]
  - - [6784, 5056, 1, 1280]
    - [10, 89.37]
  - - [1024, 48000, 1, 2560]
    - [25, 91.633]
  - - [4288, 6784, 1, 1280]
    - [10, 87.295]
  - - [16384, 800, 1, 4096]
    - [12, 67.601]
  - - [3072, 48000, 1, 1024]
    - [34, 92.4]
  - - [6784, 1408, 1, 256]
    - [33, 76.571]
  - - [5888, 4288, 1, 256]
    - [21, 84.487]
  - - [5056, 5888, 1, 256]
    - [21, 86.244]
  - - [2368, 1024, 1, 256]
    - [23, 53.694]
  - - [1856, 6784, 1, 1280]
    - [18, 80.259]
  - - [6784, 1856, 1, 256]
    - [21, 78.407]
  - - [4288, 3584, 1, 256]
    - [21, 82.298]
  - - [6784, 448, 1, 3328]
    - [10, 73.48]
  - - [5056, 1856, 1, 1280]
    - [10, 79.587]
  - - [1408, 1024, 1, 3328]
    - [7, 62.939]
  - - [5888, 3584, 1, 1280]
    - [10, 91.238]
  - - [1024, 2944, 1, 256]
    - [7, 64.912]
  - - [448, 6784, 1, 1280]
    - [36, 71.603]
  - - [3584, 1024, 1, 3328]
    - [18, 69.884]
  - - [2944, 1856, 1, 1280]
    - [24, 68.598]
  - - [5056, 256, 1, 256]
    - [6, 45.413]
  - - [2368, 3584, 1, 3328]
    - [18, 81.538]
  - - [3584, 5888, 1, 3328]
    - [3, 91.225]
  - - [2944, 3584, 1, 1280]
    - [10, 89.619]
  - - [1856, 5888, 1, 1280]
    - [18, 81.996]
  - - [2048, 3200, 1, 2048]
    - [25, 80.719]
  - - [4288, 1408, 1, 256]
    - [21, 72.217]
  - - [4288, 2368, 1, 1280]
    - [10, 78.143]
  - - [2944, 5056, 1, 256]
    - [29, 79.873]
  - - [6784, 2368, 1, 256]
    - [33, 82.158]
  - - [1024, 24000, 1, 2816]
    - [8, 90.728]
  - - [7680, 5984, 1, 2560]
    - [10, 88.301]
  - - [4288, 1856, 1, 256]
    - [21, 70.426]
  - - [1856, 2944, 1, 256]
    - [23, 65.932]
  - - [6144, 48000, 1, 2560]
    - [4, 92.235]
  - - [1760, 800, 1, 1760]
    - [0, 59.814]
  - - [1856, 1408, 1, 1280]
    - [21, 68.684]
  - - [1024, 4288, 1, 1280]
    - [10, 78.741]
  - - [2368, 5056, 1, 3328]
    - [18, 84.026]
  - - [1024, 5056, 1, 3328]
    - [24, 78.037]
  - - [1024, 1856, 1, 3328]
    - [24, 66.943]
  - - [4288, 6784, 1, 256]
    - [21, 85.432]
  - - [3584, 2944, 1, 3328]
    - [19, 81.47]
  - - [5888, 2944, 1, 256]
    - [21, 85.854]
  - - [5056, 4288, 1, 256]
    - [33, 84.369]
  - - [1024, 3584, 1, 256]
    - [7, 69.81]
  - - [5888, 5888, 1, 1280]
    - [10, 90.634]
  - - [448, 5888, 1, 1280]
    - [10, 63.419]
  - - [4288, 704, 1, 1280]
    - [36, 70.994]
  - - [2944, 1408, 1, 256]
    - [21, 68.788]
  - - [2368, 5888, 1, 3328]
    - [18, 83.41]
  - - [2368, 1856, 1, 1280]
    - [31, 66.311]
  - - [5888, 4288, 1, 3328]
    - [10, 89.758]
  - - [6784, 704, 1, 1280]
    - [36, 70.568]
  - - [5056, 448, 1, 256]
    - [20, 57.982]
  - - [1856, 5056, 1, 1280]
    - [18, 78.878]
  - - [2944, 1024, 1, 1280]
    - [18, 73.631]
  - - [2368, 4288, 1, 256]
    - [33, 74.834]
  - - [1024, 2368, 1, 3328]
    - [7, 67.559]
  - - [4288, 5888, 1, 3328]
    - [18, 89.799]
  - - [1024, 2944, 1, 3328]
    - [24, 73.904]
  - - [256, 6784, 1, 1280]
    - [35, 70.89]
  - - [1856, 3584, 1, 256]
    - [18, 74.737]
  - - [512, 24000, 1, 2816]
    - [8, 84.771]
  - - [256, 5888, 1, 1280]
    - [7, 61.772]
  - - [16384, 1600, 1, 4096]
    - [12, 73.142]
  - - [2944, 2368, 1, 256]
    - [18, 67.01]
  - - [1024, 1856, 1, 256]
    - [6, 57.888]
  - - [6784, 3584, 1, 3328]
    - [10, 90.789]
  - - [1760, 7000, 1, 1760]
    - [3, 86.819]
  - - [1024, 5888, 1, 3328]
    - [24, 77.247]
  - - [1408, 2368, 1, 1280]
    - [33, 69.052]
  - - [2944, 2944, 1, 256]
    - [21, 76.183]
  - - [6784, 256, 1, 256]
    - [23, 62.528]
  - - [5888, 1408, 1, 256]
    - [21, 79.318]
  - - [5888, 6784, 1, 3328]
    - [28, 92.026]
  - - [704, 4288, 1, 1280]
    - [18, 69.589]
  - - [1024, 48000, 1, 2048]
    - [11, 90.205]
  - - [1024, 1024, 1, 3328]
    - [53, 63.27]
  - - [64, 6784, 1, 256]
    - [51, 25.796]
  - - [128, 6784, 1, 3328]
    - [60, 53.044]
  - - [2048, 400, 1, 512]
    - [60, 42.241]
  - - [256, 4288, 1, 3328]
    - [44, 65.919]
  - - [704, 1856, 1, 3328]
    - [60, 54.285]
  - - [448, 1024, 1, 1280]
    - [53, 41.526]
  - - [2368, 128, 1, 256]
    - [51, 18.861]
  - - [64, 5056, 1, 256]
    - [51, 19.506]
  - - [256, 1856, 1, 1280]
    - [53, 43.527]
  - - [448, 704, 1, 1280]
    - [39, 29.414]
  - - [4288, 256, 1, 256]
    - [44, 44.959]
  - - [128, 3584, 1, 1280]
    - [53, 43.403]
  - - [5888, 64, 1, 3328]
    - [52, 36.75]
  - - [2944, 256, 1, 3328]
    - [47, 50.322]
  - - [256, 4288, 1, 1280]
    - [44, 61.452]
  - - [1408, 448, 1, 1280]
    - [47, 42.636]
  - - [1408, 256, 1, 1280]
    - [53, 34.578]
  - - [3072, 128, 1, 1024]
    - [53, 35.153]
  - - [6784, 128, 1, 1280]
    - [44, 50.777]
  - - [6784, 64, 1, 256]
    - [42, 25.586]
  - - [2368, 128, 1, 3328]
    - [41, 32.022]
  - - [2944, 128, 1, 256]
    - [42, 23.005]
  - - [448, 1408, 1, 256]
    - [43, 30.612]
  - - [64, 5056, 1, 3328]
    - [51, 32.392]
  - - [2368, 256, 1, 1280]
    - [52, 39.854]
  - - [256, 3584, 1, 3328]
    - [60, 55.912]
  - - [5056, 64, 1, 1280]
    - [42, 29.852]
  - - [1024, 704, 1, 256]
    - [43, 36.455]
  - - [4288, 128, 1, 1280]
    - [44, 49.994]
  - - [5888, 64, 1, 256]
    - [51, 23.053]
  - - [1856, 256, 1, 1280]
    - [44, 43.694]
  - - [64, 5888, 1, 3328]
    - [58, 36.703]
  - - [256, 1408, 1, 3328]
    - [44, 37.51]
  - - [6784, 128, 1, 3328]
    - [44, 53.121]
  - - [704, 704, 1, 3328]
    - [41, 51.822]
  - - [3584, 256, 1, 3328]
    - [53, 55.792]
  - - [128, 3584, 1, 3328]
    - [44, 47.245]
  - - [128, 2944, 1, 1280]
    - [44, 35.983]
  - - [448, 1856, 1, 1280]
    - [53, 47.337]
  - - [3584, 128, 1, 256]
    - [42, 26.441]
  - - [448, 1408, 1, 3328]
    - [43, 45.068]
  - - [256, 3584, 1, 256]
    - [60, 41.654]
  - - [256, 2944, 1, 3328]
    - [47, 53.55]
  - - [1408, 704, 1, 256]
    - [57, 41.542]
  - - [448, 2944, 1, 3328]
    - [60, 54.754]
  - - [64, 5888, 1, 256]
    - [51, 22.669]
  - - [448, 2368, 1, 1280]
    - [40, 46.554]
  - - [128, 4288, 1, 3328]
    - [53, 55.806]
  - - [256, 2368, 1, 256]
    - [43, 31.426]
  - - [1024, 448, 1, 3328]
    - [48, 47.545]
  - - [1856, 704, 1, 1280]
    - [44, 51.995]
  - - [1024, 1024, 1, 1280]
    - [48, 60.798]
  - - [256, 2944, 1, 256]
    - [43, 38.792]
  - - [1024, 700, 1, 512]
    - [59, 38.58]
  - - [128, 6784, 1, 1280]
    - [44, 50.901]
  - - [1408, 704, 1, 3328]
    - [60, 59.839]
  - - [128, 5888, 1, 1280]
    - [52, 51.398]
  - - [704, 1408, 1, 3328]
    - [44, 59.552]
  - - [7680, 64, 1, 2560]
    - [45, 38.652]
  - - [6784, 128, 1, 256]
    - [60, 39.423]
  - - [704, 448, 1, 256]
    - [51, 19.543]
  - - [256, 1856, 1, 3328]
    - [44, 49.667]
  - - [128, 4288, 1, 256]
    - [43, 33.157]
  - - [64, 6784, 1, 3328]
    - [42, 40.836]
  - - [2944, 256, 1, 1280]
    - [52, 50.306]
  - - [1856, 704, 1, 256]
    - [60, 42.297]
  - - [1408, 448, 1, 3328]
    - [47, 44.641]
  - - [704, 1856, 1, 256]
    - [52, 46.809]
  - - [256, 2368, 1, 1280]
    - [52, 41.677]
  - - [2944, 448, 1, 256]
    - [51, 47.427]
  - - [2368, 128, 1, 1280]
    - [46, 28.307]
  - - [64, 5056, 1, 1280]
    - [51, 29.967]
  - - [704, 448, 1, 3328]
    - [48, 33.405]
  - - [2368, 448, 1, 1280]
    - [55, 46.653]
  - - [128, 3584, 1, 256]
    - [43, 28.004]
  - - [1856, 448, 1, 3328]
    - [48, 50.407]
  - - [128, 5056, 1, 256]
    - [52, 33.31]
  - - [4288, 256, 1, 1280]
    - [44, 61.38]
  - - [704, 704, 1, 256]
    - [51, 28.911]
  - - [4288, 128, 1, 3328]
    - [60, 55.384]
  - - [7680, 128, 1, 2560]
    - [44, 53.306]
  - - [256, 1408, 1, 1280]
    - [53, 34.533]
  - - [6784, 64, 1, 3328]
    - [52, 42.112]
  - - [128, 2944, 1, 3328]
    - [44, 38.659]
  - - [2944, 448, 1, 3328]
    - [60, 54.881]
  - - [5888, 128, 1, 256]
    - [51, 36.947]
  - - [5056, 64, 1, 256]
    - [51, 19.838]
  - - [128, 5056, 1, 3328]
    - [40, 46.466]
  - - [256, 4288, 1, 256]
    - [43, 47.31]
  - - [3584, 256, 1, 256]
    - [57, 41.138]
  - - [128, 2944, 1, 256]
    - [52, 23.005]
  - - [3584, 128, 1, 3328]
    - [53, 47.231]
  - - [1024, 448, 1, 1280]
    - [43, 41.654]
  - - [5888, 128, 1, 3328]
    - [47, 51.186]
  - - [1408, 704, 1, 1280]
    - [60, 56.566]
  - - [448, 1408, 1, 1280]
    - [43, 42.776]
  - - [704, 1408, 1, 1280]
    - [41, 56.924]
  - - [448, 2944, 1, 256]
    - [43, 42.694]
  - - [448, 2368, 1, 256]
    - [43, 38.291]
  - - [64, 6784, 1, 1280]
    - [42, 38.106]
  - - [128, 2368, 1, 3328]
    - [44, 31.934]
  - - [5056, 64, 1, 3328]
    - [58, 32.478]
  - - [5056, 128, 1, 3328]
    - [43, 44.639]
  - - [448, 704, 1, 256]
    - [58, 19.669]
  - - [1856, 256, 1, 3328]
    - [41, 49.737]
  - - [2944, 128, 1, 3328]
    - [53, 39.053]
  - - [448, 1024, 1, 3328]
    - [53, 47.915]
  - - [704, 1024, 1, 1280]
    - [47, 48.589]
  - - [2368, 256, 1, 256]
    - [54, 31.036]
  - - [256, 2368, 1, 3328]
    - [52, 43.82]
  - - [704, 448, 1, 1280]
    - [39, 29.626]
  - - [1024, 704, 1, 1280]
    - [40, 48.772]
  - - [256, 1856, 1, 256]
    - [49, 30.488]
  - - [704, 1856, 1, 1280]
    - [55, 53.699]
  - - [1408, 256, 1, 3328]
    - [44, 37.346]
  - - [2368, 448, 1, 256]
    - [52, 38.244]
  - - [4288, 256, 1, 3328]
    - [60, 65.835]
  - - [2944, 256, 1, 256]
    - [59, 37.847]
  - - [1408, 448, 1, 256]
    - [51, 32.011]
  - - [6784, 64, 1, 1280]
    - [59, 38.909]
  - - [2944, 448, 1, 1280]
    - [53, 52.544]
  - - [128, 2368, 1, 256]
    - [49, 19.109]
  - - [448, 1024, 1, 256]
    - [58, 27.088]
  - - [1856, 448, 1, 256]
    - [51, 37.456]
  - - [128, 5056, 1, 1280]
    - [43, 44.366]
  - - [1408, 256, 1, 256]
    - [50, 23.763]
  - - [256, 1408, 1, 256]
    - [49, 23.601]
  - - [2368, 448, 1, 3328]
    - [59, 50.085]
  - - [128, 5888, 1, 3328]
    - [43, 53.611]
  - - [3584, 128, 1, 1280]
    - [44, 43.035]
  - - [4288, 128, 1, 256]
    - [51, 31.505]
  - - [2368, 256, 1, 3328]
    - [47, 42.557]
  - - [5888, 128, 1, 1280]
    - [59, 50.989]
  - - [256, 3584, 1, 1280]
    - [53, 53.759]
  - - [128, 5888, 1, 256]
    - [52, 38.449]
  - - [1024, 1024, 1, 256]
    - [53, 46.798]
  - - [1024, 1024, 1, 1024]
    - [53, 58.964]
  - - [64, 5888, 1, 1280]
    - [51, 34.476]
  - - [704, 1024, 1, 256]
    - [52, 34.124]
  - - [704, 704, 1, 1280]
    - [48, 45.345]
  - - [128, 2368, 1, 1280]
    - [58, 28.546]
  - - [3584, 256, 1, 1280]
    - [53, 53.326]
  - - [5888, 64, 1, 1280]
    - [51, 34.368]
  - - [5056, 128, 1, 1280]
    - [42, 43.218]
  - - [448, 1856, 1, 3328]
    - [41, 50.317]
  - - [1024, 448, 1, 256]
    - [52, 27.828]
  - - [2944, 128, 1, 1280]
    - [44, 36.078]
  - - [256, 2944, 1, 1280]
    - [52, 51.301]
  - - [2560, 128, 1, 2560]
    - [44, 31.248]
  - - [704, 1024, 1, 3328]
    - [52, 50.599]
  - - [1856, 448, 1, 1280]
    - [53, 47.355]
  - - [128, 6784, 1, 256]
    - [44, 39.487]
  - - [704, 1408, 1, 256]
    - [44, 42.09]
  - - [4096, 128, 1, 4096]
    - [53, 48.973]
  - - [448, 2944, 1, 1280]
    - [44, 52.981]
  - - [1856, 256, 1, 256]
    - [51, 27.772]
  - - [5056, 128, 1, 256]
    - [51, 32.218]
  - - [448, 2368, 1, 3328]
    - [56, 45.293]
  - - [1024, 704, 1, 3328]
    - [43, 49.663]
  - - [128, 4288, 1, 1280]
    - [53, 50.058]
  - - [448, 704, 1, 3328]
    - [53, 33.339]
  - - [448, 1856, 1, 256]
    - [51, 39.949]
  - - [1856, 704, 1, 3328]
    - [53, 54.303]
  - - [1408, 64, 1, 1280]
    - [67, 12.68]
  - - [4096, 32, 1, 4096]
    - [74, 15.827]
  - - [3072, 64, 1, 1024]
    - [71, 16.49]
  - - [2944, 64, 1, 256]
    - [80, 16.486]
  - - [448, 448, 1, 3328]
    - [81, 20.761]
  - - [1024, 256, 1, 3328]
    - [86, 27.79]
  - - [6144, 32, 1, 2560]
    - [74, 16.826]
  - - [1856, 64, 1, 1280]
    - [85, 16.163]
  - - [704, 128, 1, 1280]
    - [75, 12.45]
  - - [1856, 128, 1, 256]
    - [81, 19.543]
  - - [2944, 64, 1, 1280]
    - [80, 20.33]
  - - [64, 3584, 1, 3328]
    - [64, 23.957]
  - - [1024, 256, 1, 256]
    - [92, 21.444]
  - - [448, 448, 1, 256]
    - [79, 16.326]
  - - [7680, 32, 1, 2560]
    - [94, 15.893]
  - - [128, 1024, 1, 3328]
    - [63, 20.197]
  - - [64, 1856, 1, 1280]
    - [85, 16.396]
  - - [448, 256, 1, 256]
    - [79, 12.042]
  - - [256, 1024, 1, 256]
    - [92, 21.444]
  - - [1024, 128, 1, 1280]
    - [70, 18.022]
  - - [3072, 32, 1, 1024]
    - [83, 11.658]
  - - [448, 256, 1, 3328]
    - [85, 17.878]
  - - [128, 704, 1, 1280]
    - [67, 13.551]
  - - [1856, 128, 1, 3328]
    - [76, 25.105]
  - - [256, 448, 1, 256]
    - [85, 12.13]
  - - [8448, 32, 1, 2816]
    - [74, 17.634]
  - - [1408, 128, 1, 1280]
    - [80, 19.261]
  - - [128, 1856, 1, 1280]
    - [76, 24.172]
  - - [2048, 128, 1, 2048]
    - [92, 24.848]
  - - [2560, 32, 1, 2560]
    - [72, 11.41]
  - - [64, 1408, 1, 3328]
    - [75, 13.869]
  - - [128, 1408, 1, 256]
    - [80, 16.111]
  - - [256, 448, 1, 3328]
    - [63, 17.968]
  - - [64, 2368, 1, 1280]
    - [63, 17.095]
  - - [2368, 64, 1, 256]
    - [68, 13.465]
  - - [704, 128, 1, 3328]
    - [75, 14.135]
  - - [4288, 64, 1, 1280]
    - [86, 26.085]
  - - [2560, 64, 1, 2560]
    - [92, 15.527]
  - - [128, 1024, 1, 1280]
    - [80, 18.196]
  - - [1856, 64, 1, 256]
    - [79, 12.206]
  - - [704, 128, 1, 256]
    - [88, 10.578]
  - - [448, 256, 1, 1280]
    - [81, 15.489]
  - - [1024, 256, 1, 1280]
    - [92, 26.558]
  - - [1856, 128, 1, 1280]
    - [92, 23.953]
  - - [64, 3584, 1, 256]
    - [92, 18.762]
  - - [64, 1856, 1, 256]
    - [68, 12.121]
  - - [256, 1024, 1, 1280]
    - [81, 26.615]
  - - [3584, 64, 1, 1280]
    - [64, 22.527]
  - - [1408, 128, 1, 3328]
    - [75, 20.526]
  - - [64, 4288, 1, 3328]
    - [86, 28.016]
  - - [2368, 64, 1, 3328]
    - [75, 17.172]
  - - [256, 704, 1, 256]
    - [80, 16.364]
  - - [128, 1024, 1, 256]
    - [85, 13.713]
  - - [64, 2944, 1, 256]
    - [80, 16.436]
  - - [64, 1408, 1, 1280]
    - [67, 13.467]
  - - [1408, 128, 1, 256]
    - [90, 15.865]
  - - [64, 2944, 1, 1280]
    - [85, 20.346]
  - - [256, 448, 1, 1280]
    - [70, 15.829]
  - - [704, 256, 1, 1280]
    - [92, 18.466]
  - - [64, 2368, 1, 3328]
    - [63, 17.839]
  - - [256, 704, 1, 3328]
    - [63, 21.347]
  - - [4096, 64, 1, 4096]
    - [95, 21.397]
  - - [1760, 128, 1, 1760]
    - [64, 23.7]
  - - [64, 2944, 1, 3328]
    - [85, 21.564]
  - - [128, 1408, 1, 3328]
    - [85, 21.3]
  - - [1408, 64, 1, 256]
    - [67, 10.535]
  - - [64, 2368, 1, 256]
    - [80, 13.632]
  - - [1024, 128, 1, 3328]
    - [75, 19.649]
  - - [2368, 64, 1, 1280]
    - [85, 16.488]
  - - [4288, 64, 1, 256]
    - [92, 21.952]
  - - [64, 4288, 1, 1280]
    - [86, 26.256]
  - - [1408, 64, 1, 3328]
    - [75, 13.869]
  - - [448, 448, 1, 1280]
    - [64, 19.847]
  - - [3584, 64, 1, 3328]
    - [76, 23.872]
  - - [256, 1024, 1, 3328]
    - [81, 27.154]
  - - [1856, 64, 1, 3328]
    - [75, 17.625]
  - - [1024, 128, 1, 256]
    - [85, 13.47]
  - - [4608, 32, 1, 1536]
    - [74, 16.037]
  - - [128, 704, 1, 256]
    - [67, 10.842]
  - - [64, 3584, 1, 1280]
    - [86, 22.698]
  - - [3584, 64, 1, 256]
    - [71, 18.399]
  - - [64, 1856, 1, 3328]
    - [75, 17.749]
  - - [2944, 64, 1, 3328]
    - [85, 20.334]
  - - [128, 704, 1, 3328]
    - [63, 14.201]
  - - [128, 1856, 1, 256]
    - [92, 19.543]
  - - [64, 4288, 1, 256]
    - [92, 22.074]
  - - [704, 256, 1, 3328]
    - [85, 20.758]
  - - [256, 704, 1, 1280]
    - [70, 19.563]
  - - [4288, 64, 1, 3328]
    - [64, 28.286]
  - - [2048, 64, 1, 2048]
    - [95, 16.793]
  - - [64, 1408, 1, 256]
    - [67, 10.709]
  - - [128, 1408, 1, 1280]
    - [80, 20.093]
  - - [128, 1856, 1, 3328]
    - [76, 25.184]
  - - [1760, 64, 1, 1760]
    - [86, 15.748]
  - - [704, 256, 1, 256]
    - [89, 15.962]
  - - [1024, 256, 1, 196]
    - [92, 19.448]
  - - [256, 1024, 1, 196]
    - [76, 19.579]
  - - [1760, 32, 1, 1760]
    - [62, 9.179]
  - - [1760, 16, 1, 1760]
    - [93, 5.376]
  - - [7680, 16, 1, 2560]
    - [97, 10.312]
  - - [8448, 16, 1, 2816]
    - [97, 11.762]
  - - [6144, 16, 1, 2560]
    - [98, 10.81]
  - - [2048, 16, 1, 2048]
    - [73, 6.447]
  - - [3072, 16, 1, 1024]
    - [73, 7.884]
  - - [4096, 16, 1, 4096]
    - [98, 10.032]
  - - [2560, 16, 1, 2560]
    - [73, 7.113]
  - - [2048, 32, 1, 2048]
    - [98, 10.052]
  - - [4608, 16, 1, 1536]
    - [97, 9.781]
  - - [1024, 16, 1, 500000]
    - [66, 3.894]
  - - [1024, 8, 1, 500000]
    - [78, 1.947]
  - - [512, 16, 1, 500000]
    - [66, 2.353]
  - - [512, 8, 1, 500000]
    - [66, 1.178]
  - - [128, 256, 1, 1280]
    - [65, 7.072]
  - - [448, 64, 1, 1280]
    - [77, 6.283]
  - - [64, 1024, 1, 1280]
    - [67, 11.902]
  - - [64, 704, 1, 1280]
    - [77, 9.161]
  - - [128, 448, 1, 256]
    - [88, 7.81]
  - - [256, 256, 1, 3328]
    - [67, 12.493]
  - - [64, 448, 1, 1280]
    - [77, 6.206]
  - - [64, 64, 1, 3328]
    - [96, 1.094]
  - - [704, 64, 1, 3328]
    - [87, 9.978]
  - - [64, 128, 1, 256]
    - [82, 1.245]
  - - [128, 448, 1, 1280]
    - [67, 10.765]
  - - [704, 64, 1, 1280]
    - [77, 9.136]
  - - [448, 64, 1, 3328]
    - [87, 6.781]
  - - [128, 64, 1, 1280]
    - [72, 1.96]
  - - [64, 128, 1, 3328]
    - [96, 2.184]
  - - [128, 128, 1, 3328]
    - [65, 4.133]
  - - [256, 128, 1, 256]
    - [61, 4.755]
  - - [256, 256, 1, 256]
    - [67, 8.926]
  - - [256, 64, 1, 256]
    - [77, 2.452]
  - - [64, 1024, 1, 256]
    - [67, 8.802]
  - - [64, 704, 1, 256]
    - [67, 6.346]
  - - [448, 128, 1, 256]
    - [67, 7.81]
  - - [64, 704, 1, 3328]
    - [65, 9.989]
  - - [64, 448, 1, 3328]
    - [65, 6.795]
  - - [448, 128, 1, 3328]
    - [84, 11.015]
  - - [64, 256, 1, 1280]
    - [65, 3.785]
  - - [64, 64, 1, 256]
    - [72, 0.625]
  - - [64, 448, 1, 256]
    - [61, 4.16]
  - - [256, 128, 1, 1280]
    - [65, 7.05]
  - - [128, 256, 1, 3328]
    - [65, 7.679]
  - - [64, 128, 1, 1280]
    - [72, 1.958]
  - - [128, 128, 1, 1280]
    - [87, 3.797]
  - - [128, 256, 1, 256]
    - [61, 4.778]
  - - [256, 64, 1, 1280]
    - [77, 3.803]
  - - [704, 64, 1, 256]
    - [67, 6.256]
  - - [64, 64, 1, 1280]
    - [72, 0.981]
  - - [128, 64, 1, 3328]
    - [78, 2.184]
  - - [448, 64, 1, 256]
    - [77, 4.182]
  - - [1024, 64, 1, 256]
    - [67, 8.681]
  - - [128, 64, 1, 256]
    - [72, 1.245]
  - - [1024, 64, 1, 1280]
    - [67, 11.667]
  - - [64, 1024, 1, 3328]
    - [67, 12.707]
  - - [448, 128, 1, 1280]
    - [91, 9.73]
  - - [1024, 64, 1, 3328]
    - [67, 12.714]
  - - [64, 256, 1, 3328]
    - [65, 4.14]
  - - [256, 256, 1, 1280]
    - [67, 12.13]
  - - [256, 128, 1, 3328]
    - [65, 7.688]
  - - [64, 256, 1, 256]
    - [69, 2.452]
  - - [128, 448, 1, 3328]
    - [67, 11.536]
  - - [256, 64, 1, 3328]
    - [77, 4.135]
  - - [128, 128, 1, 256]
    - [77, 2.463]
  - - [512, 128, 1, 784]
    - [61, 10.575]
  - - [256, 64, 1, 3136]
    - [65, 4.14]
  - - [64, 256, 1, 3136]
    - [65, 4.137]
  - - [128, 512, 1, 784]
    - [61, 10.575]
  - - [64, 64, 1, 3136]
    - [66, 1.094]
  - - [768, 1, 1, 768]
    - [99, 0.096]
  - - [768, 2, 1, 768]
    - [100, 0.187]
  - - [768, 4, 1, 768]
    - [100, 0.376]
  - - [768, 8, 1, 768]
    - [100, 0.753]
  - - [768, 16, 1, 768]
    - [100, 1.508]
  - - [768, 32, 1, 768]
    - [101, 3.02]
  - - [768, 64, 1, 768]
    - [102, 5.625]
  - - [768, 128, 1, 768]
    - [102, 9.226]
  - - [768, 256, 1, 768]
    - [103, 15.316]
  - - [1024, 1, 1, 1024]
    - [101, 0.144]
  - - [1024, 2, 1, 1024]
    - [100, 0.286]
  - - [1024, 4, 1, 1024]
    - [104, 0.576]
  - - [1024, 8, 1, 1024]
    - [105, 1.147]
  - - [1024, 16, 1, 1024]
    - [104, 2.297]
  - - [1024, 32, 1, 1024]
    - [100, 4.474]
  - - [1024, 64, 1, 1024]
    - [106, 7.392]
  - - [1024, 128, 1, 1024]
    - [107, 12.491]
- null
