library/src/blas3/Tensile/Logic/asm_full/navi21_Cijk_Ailk_Bljk_HB_GB.yaml
- {MinimumRequiredVersion: 4.26.0}
- navi21
- gfx1030
- [Device 73a2]
    SolutionIndex: 0
    SolutionNameMin: Cijk_Ailk_Bljk_HB_MT128x64x8_SN_SU0_SUM0_TT8_8_WG16_8_1_WGM1
    SolutionIndex: 1
    SolutionNameMin: Cijk_Ailk_Bljk_HB_MT128x128x8_SN_SU0_SUM0_TT8_16_WG16_8_1_WGM1
    SolutionIndex: 2
    SolutionNameMin: Cijk_Ailk_Bljk_HB_MT256x128x8_SN_SU0_SUM0_TT16_16_WG16_8_1_WGM1
    SolutionIndex: 3
    SolutionNameMin: Cijk_Ailk_Bljk_HB_MT128x64x16_SN_SU0_SUM0_TT8_8_WG16_8_1_WGM1
    SolutionIndex: 4
    SolutionNameMin: Cijk_Ailk_Bljk_HB_MT128x128x16_SN_SU0_SUM0_TT8_16_WG16_8_1_WGM1
    SolutionIndex: 5
    SolutionNameMin: Cijk_Ailk_Bljk_HB_MT256x128x16_SN_SU0_SUM0_TT16_16_WG16_8_1_WGM1
    SolutionIndex: 6
    SolutionNameMin: Cijk_Ailk_Bljk_HB_MT128x128x16_SN_SU0_SUM0_TT8_8_WG16_16_1_WGM1
    SolutionIndex: 7
    SolutionNameMin: Cijk_Ailk_Bljk_HB_MT128x256x16_SN_SU0_SUM0_TT8_16_WG16_16_1_WGM1
    SolutionIndex: 8
    SolutionNameMin: Cijk_Ailk_Bljk_HB_MT128x64x16_SN_SU32_SUM3_TT8_8_WG16_8_1_WGM1
    SolutionIndex: 9
    SolutionNameMin: Cijk_Ailk_Bljk_HB_MT128x128x16_SN_SU32_SUM3_TT8_16_WG16_8_1_WGM1
    SolutionIndex: 10
    SolutionNameMin: Cijk_Ailk_Bljk_HB_MT256x128x16_SN_SU32_SUM3_TT16_16_WG16_8_1_WGM1
    SolutionIndex: 11
    SolutionNameMin: Cijk_Ailk_Bljk_HB_MT128x128x16_SN_SU32_SUM3_TT8_8_WG16_16_1_WGM1
    SolutionIndex: 12
    SolutionNameMin: Cijk_Ailk_Bljk_HB_MT128x256x16_SN_SU32_SUM3_TT8_16_WG16_16_1_WGM1
    SolutionIndex: 13
    SolutionNameMin: Cijk_Ailk_Bljk_HB_MT128x64x8_SN_SU0_SUM0_TT8_8_WG16_8_1_WGM4
    SolutionIndex: 14
    SolutionNameMin: Cijk_Ailk_Bljk_HB_MT256x128x8_SN_SU0_SUM0_TT16_16_WG16_8_1_WGM4
    SolutionIndex: 15
    SolutionNameMin: Cijk_Ailk_Bljk_HB_MT128x64x16_SN_SU0_SUM0_TT8_8_WG16_8_1_WGM4
    SolutionIndex: 16
    SolutionNameMin: Cijk_Ailk_Bljk_HB_MT128x128x16_SN_SU0_SUM0_TT8_16_WG16_8_1_WGM4
    SolutionIndex: 17
    SolutionNameMin: Cijk_Ailk_Bljk_HB_MT256x128x16_SN_SU0_SUM0_TT16_16_WG16_8_1_WGM4
    SolutionIndex: 18
    SolutionNameMin: Cijk_Ailk_Bljk_HB_MT128x128x16_SN_SU0_SUM0_TT8_8_WG16_16_1_WGM4
    SolutionIndex: 19
    SolutionNameMin: Cijk_Ailk_Bljk_HB_MT128x256x16_SN_SU0_SUM0_TT8_16_WG16_16_1_WGM4
    SolutionIndex: 20
    SolutionNameMin: Cijk_Ailk_Bljk_HB_MT128x128x32_SN_SU0_SUM0_TT8_16_WG16_8_1_WGM4
    SolutionIndex: 21
    SolutionNameMin: Cijk_Ailk_Bljk_HB_MT128x64x8_SN_SU32_SUM3_TT8_8_WG16_8_1_WGM4
    SolutionIndex: 22
    SolutionNameMin: Cijk_Ailk_Bljk_HB_MT128x64x16_SN_SU32_SUM3_TT8_8_WG16_8_1_WGM4
    SolutionIndex: 23
    SolutionNameMin: Cijk_Ailk_Bljk_HB_MT128x128x16_SN_SU32_SUM3_TT8_16_WG16_8_1_WGM4
    SolutionIndex: 24
    SolutionNameMin: Cijk_Ailk_Bljk_HB_MT256x128x16_SN_SU32_SUM3_TT16_16_WG16_8_1_WGM4
    SolutionIndex: 25
    SolutionNameMin: Cijk_Ailk_Bljk_HB_MT128x128x16_SN_SU32_SUM3_TT8_8_WG16_16_1_WGM4
    SolutionIndex: 26
    SolutionNameMin: Cijk_Ailk_Bljk_HB_MT128x256x16_SN_SU32_SUM3_TT8_16_WG16_16_1_WGM4
    SolutionIndex: 27
    SolutionNameMin: Cijk_Ailk_Bljk_HB_MT128x64x8_SN_SU0_SUM0_TT8_8_WG16_8_1_WGM8
    SolutionIndex: 28
    SolutionNameMin: Cijk_Ailk_Bljk_HB_MT128x128x8_SN_SU0_SUM0_TT8_16_WG16_8_1_WGM8
    SolutionIndex: 29
    SolutionNameMin: Cijk_Ailk_Bljk_HB_MT256x128x8_SN_SU0_SUM0_TT16_16_WG16_8_1_WGM8
    SolutionIndex: 30
    SolutionNameMin: Cijk_Ailk_Bljk_HB_MT128x64x16_SN_SU0_SUM0_TT8_8_WG16_8_1_WGM8
    SolutionIndex: 31
    SolutionNameMin: Cijk_Ailk_Bljk_HB_MT128x128x16_SN_SU0_SUM0_TT8_16_WG16_8_1_WGM8
    SolutionIndex: 32
    SolutionNameMin: Cijk_Ailk_Bljk_HB_MT256x128x16_SN_SU0_SUM0_TT16_16_WG16_8_1_WGM8
    SolutionIndex: 33
    SolutionNameMin: Cijk_Ailk_Bljk_HB_MT128x128x16_SN_SU0_SUM0_TT8_8_WG16_16_1_WGM8
    SolutionIndex: 34
    SolutionNameMin: Cijk_Ailk_Bljk_HB_MT128x256x16_SN_SU0_SUM0_TT8_16_WG16_16_1_WGM8
    SolutionIndex: 35
    SolutionNameMin: Cijk_Ailk_Bljk_HB_MT128x128x32_SN_SU0_SUM0_TT8_8_WG16_16_1_WGM8
    SolutionIndex: 36
    SolutionNameMin: Cijk_Ailk_Bljk_HB_MT128x64x8_SN_SU32_SUM3_TT8_8_WG16_8_1_WGM8
    SolutionIndex: 37
    SolutionNameMin: Cijk_Ailk_Bljk_HB_MT128x128x8_SN_SU32_SUM3_TT8_16_WG16_8_1_WGM8
    SolutionIndex: 38
    SolutionNameMin: Cijk_Ailk_Bljk_HB_MT128x64x16_SN_SU32_SUM3_TT8_8_WG16_8_1_WGM8
    SolutionIndex: 39
    SolutionNameMin: Cijk_Ailk_Bljk_HB_MT128x128x16_SN_SU32_SUM3_TT8_16_WG16_8_1_WGM8
    SolutionIndex: 40
    SolutionNameMin: Cijk_Ailk_Bljk_HB_MT256x128x16_SN_SU32_SUM3_TT16_16_WG16_8_1_WGM8
    SolutionIndex: 41
    SolutionNameMin: Cijk_Ailk_Bljk_HB_MT128x128x16_SN_SU32_SUM3_TT8_8_WG16_16_1_WGM8
    SolutionIndex: 42
    SolutionNameMin: Cijk_Ailk_Bljk_HB_MT128x256x16_SN_SU32_SUM3_TT8_16_WG16_16_1_WGM8
    SolutionIndex: 43
    SolutionNameMin: Cijk_Ailk_Bljk_HB_MT64x64x8_SN_SU0_SUM0_TT8_8_WG8_8_1_WGM1
    SolutionIndex: 44
    SolutionNameMin: Cijk_Ailk_Bljk_HB_MT128x64x8_SN_SU0_SUM0_TT8_8_WG16_8_1_WGM1
    SolutionIndex: 45
    SolutionNameMin: Cijk_Ailk_Bljk_HB_MT64x64x16_SN_SU0_SUM0_TT8_8_WG8_8_1_WGM1
    SolutionIndex: 46
    SolutionNameMin: Cijk_Ailk_Bljk_HB_MT128x64x16_SN_SU0_SUM0_TT8_8_WG16_8_1_WGM1
    SolutionIndex: 47
    SolutionNameMin: Cijk_Ailk_Bljk_HB_MT128x128x16_SN_SU0_SUM0_TT8_8_WG16_16_1_WGM1
    SolutionIndex: 48
    SolutionNameMin: Cijk_Ailk_Bljk_HB_MT128x64x32_SN_SU0_SUM0_TT8_8_WG16_8_1_WGM1
    SolutionIndex: 49
    SolutionNameMin: Cijk_Ailk_Bljk_HB_MT64x64x8_SN_SU32_SUM3_TT8_8_WG8_8_1_WGM1
    SolutionIndex: 50
    SolutionNameMin: Cijk_Ailk_Bljk_HB_MT128x64x8_SN_SU32_SUM3_TT8_8_WG16_8_1_WGM1
    SolutionIndex: 51
    SolutionNameMin: Cijk_Ailk_Bljk_HB_MT64x64x16_SN_SU32_SUM3_TT8_8_WG8_8_1_WGM1
    SolutionIndex: 52
    SolutionNameMin: Cijk_Ailk_Bljk_HB_MT128x64x16_SN_SU32_SUM3_TT8_8_WG16_8_1_WGM1
    SolutionIndex: 53
    SolutionNameMin: Cijk_Ailk_Bljk_HB_MT128x128x16_SN_SU32_SUM3_TT8_8_WG16_16_1_WGM1
    SolutionIndex: 54
    SolutionNameMin: Cijk_Ailk_Bljk_HB_MT64x64x32_SN_SU32_SUM3_TT8_8_WG8_8_1_WGM1
    SolutionIndex: 55
    SolutionNameMin: Cijk_Ailk_Bljk_HB_MT64x64x8_SN_SU0_SUM0_TT8_8_WG8_8_1_WGM4
    SolutionIndex: 56
    SolutionNameMin: Cijk_Ailk_Bljk_HB_MT128x64x8_SN_SU0_SUM0_TT8_8_WG16_8_1_WGM4
    SolutionIndex: 57
    SolutionNameMin: Cijk_Ailk_Bljk_HB_MT64x64x16_SN_SU0_SUM0_TT8_8_WG8_8_1_WGM4
    SolutionIndex: 58
    SolutionNameMin: Cijk_Ailk_Bljk_HB_MT128x64x16_SN_SU0_SUM0_TT8_8_WG16_8_1_WGM4
    SolutionIndex: 59
    SolutionNameMin: Cijk_Ailk_Bljk_HB_MT128x128x16_SN_SU0_SUM0_TT8_8_WG16_16_1_WGM4
    SolutionIndex: 60
    SolutionNameMin: Cijk_Ailk_Bljk_HB_MT64x64x8_SN_SU32_SUM3_TT8_8_WG8_8_1_WGM4
    SolutionIndex: 61
    SolutionNameMin: Cijk_Ailk_Bljk_HB_MT128x64x8_SN_SU32_SUM3_TT8_8_WG16_8_1_WGM4
    SolutionIndex: 62
    SolutionNameMin: Cijk_Ailk_Bljk_HB_MT64x64x16_SN_SU32_SUM3_TT8_8_WG8_8_1_WGM4
    SolutionIndex: 63
    SolutionNameMin: Cijk_Ailk_Bljk_HB_MT128x64x16_SN_SU32_SUM3_TT8_8_WG16_8_1_WGM4
    SolutionIndex: 64
    SolutionNameMin: Cijk_Ailk_Bljk_HB_MT128x64x8_SN_SU0_SUM0_TT8_8_WG16_8_1_WGM8
    SolutionIndex: 65
    SolutionNameMin: Cijk_Ailk_Bljk_HB_MT128x64x16_SN_SU0_SUM0_TT8_8_WG16_8_1_WGM8
    SolutionIndex: 66
    SolutionNameMin: Cijk_Ailk_Bljk_HB_MT128x128x16_SN_SU0_SUM0_TT8_8_WG16_16_1_WGM8
    SolutionIndex: 67
    SolutionNameMin: Cijk_Ailk_Bljk_HB_MT128x64x8_SN_SU32_SUM3_TT8_8_WG16_8_1_WGM8
    SolutionIndex: 68
    SolutionNameMin: Cijk_Ailk_Bljk_HB_MT64x64x16_SN_SU32_SUM3_TT8_8_WG8_8_1_WGM8
    SolutionIndex: 69
    SolutionNameMin: Cijk_Ailk_Bljk_HB_MT128x64x16_SN_SU32_SUM3_TT8_8_WG16_8_1_WGM8
    SolutionIndex: 70
    SolutionNameMin: Cijk_Ailk_Bljk_HB_MT128x128x16_SN_SU32_SUM3_TT8_8_WG16_16_1_WGM8
    SolutionIndex: 71
    SolutionNameMin: Cijk_Ailk_Bljk_HB_MT32x16x8_SN_SU0_SUM0_TT2_2_WG16_8_1_WGM1
    SolutionIndex: 72
    SolutionNameMin: Cijk_Ailk_Bljk_HB_MT64x32x8_SN_SU0_SUM0_TT4_4_WG16_8_1_WGM1
    SolutionIndex: 73
    SolutionNameMin: Cijk_Ailk_Bljk_HB_MT64x64x8_SN_SU0_SUM0_TT4_4_WG16_16_1_WGM1
    SolutionIndex: 74
    SolutionNameMin: Cijk_Ailk_Bljk_HB_MT16x16x16_SN_SU0_SUM0_TT2_2_WG8_8_1_WGM1
    SolutionIndex: 75
    SolutionNameMin: Cijk_Ailk_Bljk_HB_MT32x16x16_SN_SU0_SUM0_TT2_2_WG16_8_1_WGM1
    SolutionIndex: 76
    SolutionNameMin: Cijk_Ailk_Bljk_HB_MT64x32x16_SN_SU0_SUM0_TT4_4_WG16_8_1_WGM1
    SolutionIndex: 77
    SolutionNameMin: Cijk_Ailk_Bljk_HB_MT16x16x32_SN_SU0_SUM0_TT2_2_WG8_8_1_WGM1
    SolutionIndex: 78
    SolutionNameMin: Cijk_Ailk_Bljk_HB_MT32x16x32_SN_SU0_SUM0_TT2_2_WG16_8_1_WGM1
    SolutionIndex: 79
    SolutionNameMin: Cijk_Ailk_Bljk_HB_MT32x16x8_SN_SU32_SUM3_TT2_2_WG16_8_1_WGM1
    SolutionIndex: 80
    SolutionNameMin: Cijk_Ailk_Bljk_HB_MT64x32x8_SN_SU32_SUM3_TT4_4_WG16_8_1_WGM1
    SolutionIndex: 81
    SolutionNameMin: Cijk_Ailk_Bljk_HB_MT64x64x8_SN_SU32_SUM3_TT4_4_WG16_16_1_WGM1
    SolutionIndex: 82
    SolutionNameMin: Cijk_Ailk_Bljk_HB_MT32x16x16_SN_SU32_SUM3_TT2_2_WG16_8_1_WGM1
    SolutionIndex: 83
    SolutionNameMin: Cijk_Ailk_Bljk_HB_MT64x32x8_SN_SU0_SUM0_TT4_4_WG16_8_1_WGM4
    SolutionIndex: 84
    SolutionNameMin: Cijk_Ailk_Bljk_HB_MT64x64x8_SN_SU0_SUM0_TT4_4_WG16_16_1_WGM4
    SolutionIndex: 85
    SolutionNameMin: Cijk_Ailk_Bljk_HB_MT32x16x16_SN_SU0_SUM0_TT2_2_WG16_8_1_WGM4
    SolutionIndex: 86
    SolutionNameMin: Cijk_Ailk_Bljk_HB_MT64x32x16_SN_SU0_SUM0_TT4_4_WG16_8_1_WGM4
    SolutionIndex: 87
    SolutionNameMin: Cijk_Ailk_Bljk_HB_MT32x16x32_SN_SU0_SUM0_TT2_2_WG16_8_1_WGM4
    SolutionIndex: 88
    SolutionNameMin: Cijk_Ailk_Bljk_HB_MT32x16x8_SN_SU32_SUM3_TT2_2_WG16_8_1_WGM4
    SolutionIndex: 89
    SolutionNameMin: Cijk_Ailk_Bljk_HB_MT64x32x8_SN_SU32_SUM3_TT4_4_WG16_8_1_WGM4
    SolutionIndex: 90
    SolutionNameMin: Cijk_Ailk_Bljk_HB_MT64x64x8_SN_SU32_SUM3_TT4_4_WG16_16_1_WGM4
    SolutionIndex: 91
    SolutionNameMin: Cijk_Ailk_Bljk_HB_MT64x32x8_SN_SU0_SUM0_TT4_4_WG16_8_1_WGM8
    SolutionIndex: 92
    SolutionNameMin: Cijk_Ailk_Bljk_HB_MT64x64x8_SN_SU0_SUM0_TT4_4_WG16_16_1_WGM8
    SolutionIndex: 93
    SolutionNameMin: Cijk_Ailk_Bljk_HB_MT32x16x16_SN_SU0_SUM0_TT2_2_WG16_8_1_WGM8
    SolutionIndex: 94
    SolutionNameMin: Cijk_Ailk_Bljk_HB_MT64x32x16_SN_SU0_SUM0_TT4_4_WG16_8_1_WGM8
    SolutionIndex: 95
    SolutionNameMin: Cijk_Ailk_Bljk_HB_MT64x32x8_SN_SU32_SUM3_TT4_4_WG16_8_1_WGM8
    SolutionIndex: 96
    SolutionNameMin: Cijk_Ailk_Bljk_HB_MT64x64x8_SN_SU32_SUM3_TT4_4_WG16_16_1_WGM8
    SolutionIndex: 97
    SolutionNameMin: Cijk_Ailk_Bljk_HB_MT32x16x16_SN_SU32_SUM3_TT2_2_WG16_8_1_WGM8
    SolutionIndex: 98
    SolutionNameMin: Cijk_Ailk_Bljk_HB_MT64x8x32_SN_SU0_SUM0_TT2_2_WG32_4_1_WGM1
    SolutionIndex: 99
    SolutionNameMin: Cijk_Ailk_Bljk_HB_MT128x8x32_SN_SU0_SUM0_TT4_2_WG32_4_1_WGM1
    SolutionIndex: 100
    SolutionNameMin: Cijk_Ailk_Bljk_HB_MT64x8x32_SN_SU0_SUM0_TT2_2_WG32_4_1_WGM4
    SolutionIndex: 101
    SolutionNameMin: Cijk_Ailk_Bljk_HB_MT64x8x32_SN_SU0_SUM0_TT2_2_WG32_4_1_WGM8
    SolutionIndex: 102
    SolutionNameMin: Cijk_Ailk_Bljk_HB_MT128x8x32_SN_SU0_SUM0_TT4_2_WG32_4_1_WGM8
    SolutionIndex: 103
    SolutionNameMin: Cijk_Ailk_Bljk_HB_GB_MT128x64x8_SN_SU0_SUM0_SUS0_TT8_8_WG16_8_1_WGM4
    SolutionIndex: 104
    SolutionNameMin: Cijk_Ailk_Bljk_HB_GB_MT128x64x8_SN_SU0_SUM0_SUS0_TT8_8_WG16_8_1_WGM1
    SolutionIndex: 105
    SolutionNameMin: Cijk_Ailk_Bljk_HB_GB_MT128x128x16_SN_SU0_SUM0_SUS0_TT8_8_WG16_16_1_WGM8
    SolutionIndex: 106
    SolutionNameMin: Cijk_Ailk_Bljk_HB_GB_MT128x64x8_SN_SU0_SUM0_SUS0_TT8_8_WG16_8_1_WGM8
    SolutionIndex: 107
    SolutionNameMin: Cijk_Ailk_Bljk_HB_GB_MT128x64x16_SN_SU32_SUM3_SUS128_TT8_8_WG16_8_1_WGM4
    SolutionIndex: 108
    SolutionNameMin: Cijk_Ailk_Bljk_HB_GB_MT128x64x8_SN_SU32_SUM3_SUS128_TT8_8_WG16_8_1_WGM1
    SolutionIndex: 109
    SolutionNameMin: Cijk_Ailk_Bljk_HB_GB_MT128x64x8_SN_SU32_SUM3_SUS128_TT8_8_WG16_8_1_WGM8
    SolutionIndex: 110
    SolutionNameMin: Cijk_Ailk_Bljk_HB_GB_MT128x64x16_SN_SU32_SUM3_SUS128_TT8_8_WG16_8_1_WGM1
    SolutionIndex: 111
    SolutionNameMin: Cijk_Ailk_Bljk_HB_GB_MT128x64x16_SN_SU32_SUM3_SUS128_TT8_8_WG16_8_1_WGM8
    SolutionIndex: 112
    SolutionNameMin: Cijk_Ailk_Bljk_HB_GB_MT128x128x8_SN_SU0_SUM0_SUS0_TT8_16_WG16_8_1_WGM8
    SolutionIndex: 113
    SolutionNameMin: Cijk_Ailk_Bljk_HB_GB_MT128x64x16_SN_SU0_SUM0_SUS0_TT8_8_WG16_8_1_WGM1
    SolutionIndex: 114
    SolutionNameMin: Cijk_Ailk_Bljk_HB_GB_MT128x64x8_SN_SU32_SUM3_SUS128_TT8_8_WG16_8_1_WGM4
    SolutionIndex: 115
    SolutionNameMin: Cijk_Ailk_Bljk_HB_GB_MT128x128x16_SN_SU0_SUM0_SUS0_TT8_8_WG16_16_1_WGM4
    SolutionIndex: 116
    SolutionNameMin: Cijk_Ailk_Bljk_HB_GB_MT128x64x16_SN_SU0_SUM0_SUS0_TT8_8_WG16_8_1_WGM4
    SolutionIndex: 117
    SolutionNameMin: Cijk_Ailk_Bljk_HB_GB_MT128x256x16_SN_SU0_SUM0_SUS0_TT8_16_WG16_16_1_WGM8
    SolutionIndex: 118
    SolutionNameMin: Cijk_Ailk_Bljk_HB_GB_MT128x128x16_SN_SU0_SUM0_SUS0_TT8_8_WG16_16_1_WGM1
    SolutionIndex: 119
    SolutionNameMin: Cijk_Ailk_Bljk_HB_GB_MT128x128x16_SN_SU32_SUM3_SUS128_TT8_8_WG16_16_1_WGM8
    SolutionIndex: 120
    SolutionNameMin: Cijk_Ailk_Bljk_HB_GB_MT128x128x16_SN_SU32_SUM3_SUS128_TT8_8_WG16_16_1_WGM1
    SolutionIndex: 121
    SolutionNameMin: Cijk_Ailk_Bljk_HB_GB_MT128x256x16_SN_SU32_SUM3_SUS128_TT8_16_WG16_16_1_WGM8
    SolutionIndex: 122
    SolutionNameMin: Cijk_Ailk_Bljk_HB_GB_MT128x256x16_SN_SU32_SUM3_SUS128_TT8_16_WG16_16_1_WGM1
    SolutionIndex: 123
    SolutionNameMin: Cijk_Ailk_Bljk_HB_GB_MT128x128x16_SN_SU32_SUM3_SUS128_TT8_8_WG16_16_1_WGM4
    SolutionIndex: 124
    SolutionNameMin: Cijk_Ailk_Bljk_HB_GB_MT128x256x16_SN_SU32_SUM3_SUS128_TT8_16_WG16_16_1_WGM4
    SolutionIndex: 125
    SolutionNameMin: Cijk_Ailk_Bljk_HB_GB_MT128x128x16_SN_SU32_SUM3_SUS128_TT8_16_WG16_8_1_WGM4
    SolutionIndex: 126
    SolutionNameMin: Cijk_Ailk_Bljk_HB_GB_MT128x64x16_SN_SU0_SUM0_SUS0_TT8_8_WG16_8_1_WGM8
    SolutionIndex: 127
    SolutionNameMin: Cijk_Ailk_Bljk_HB_GB_MT128x128x32_SN_SU0_SUM0_SUS0_TT8_8_WG16_16_1_WGM4
    SolutionIndex: 128
    SolutionNameMin: Cijk_Ailk_Bljk_HB_GB_MT256x128x8_SN_SU0_SUM0_SUS0_TT16_16_WG16_8_1_WGM8
    SolutionIndex: 129
    SolutionNameMin: Cijk_Ailk_Bljk_HB_GB_MT128x128x8_SN_SU0_SUM0_SUS0_TT8_16_WG16_8_1_WGM1
    SolutionIndex: 130
    SolutionNameMin: Cijk_Ailk_Bljk_HB_GB_MT128x128x16_SN_SU0_SUM0_SUS0_TT8_16_WG16_8_1_WGM4
    SolutionIndex: 131
    SolutionNameMin: Cijk_Ailk_Bljk_HB_GB_MT128x64x32_SN_SU32_SUM3_SUS128_TT8_8_WG16_8_1_WGM8
    SolutionIndex: 132
    SolutionNameMin: Cijk_Ailk_Bljk_HB_GB_MT128x64x32_SN_SU32_SUM3_SUS128_TT8_8_WG16_8_1_WGM1
    SolutionIndex: 133
    SolutionNameMin: Cijk_Ailk_Bljk_HB_GB_MT128x128x16_SN_SU0_SUM0_SUS0_TT8_16_WG16_8_1_WGM1
    SolutionIndex: 134
    SolutionNameMin: Cijk_Ailk_Bljk_HB_GB_MT128x256x16_SN_SU0_SUM0_SUS0_TT8_16_WG16_16_1_WGM4
    SolutionIndex: 135
    SolutionNameMin: Cijk_Ailk_Bljk_HB_GB_MT256x128x8_SN_SU0_SUM0_SUS0_TT16_16_WG16_8_1_WGM1
    SolutionIndex: 136
    SolutionNameMin: Cijk_Ailk_Bljk_HB_GB_MT256x128x32_SN_SU0_SUM0_SUS0_TT16_16_WG16_8_1_WGM1
    SolutionIndex: 137
    SolutionNameMin: Cijk_Ailk_Bljk_HB_GB_MT256x128x16_SN_SU0_SUM0_SUS0_TT16_16_WG16_8_1_WGM1
    SolutionIndex: 138
    SolutionNameMin: Cijk_Ailk_Bljk_HB_GB_MT128x64x32_SN_SU0_SUM0_SUS0_TT8_8_WG16_8_1_WGM1
    SolutionIndex: 139
    SolutionNameMin: Cijk_Ailk_Bljk_HB_GB_MT128x128x16_SN_SU32_SUM3_SUS128_TT8_16_WG16_8_1_WGM8
- - - [2944, 4288, 1, 1280]
    - [16, 94.929]
  - - [2368, 5888, 1, 256]
    - [9, 90.14]
  - - [512, 24000, 1, 1536]
    - [23, 96.832]
  - - [5888, 1856, 1, 3328]
    - [4, 91.879]
  - - [5888, 2944, 1, 3328]
    - [31, 97.95]
  - - [1856, 4288, 1, 256]
    - [30, 81.768]
  - - [5056, 5056, 1, 3328]
    - [4, 96.738]
  - - [1408, 5888, 1, 1280]
    - [31, 91.611]
  - - [6144, 6000, 1, 2560]
    - [23, 99.703]
  - - [1024, 3584, 1, 3328]
    - [31, 84.279]
  - - [512, 48000, 1, 2048]
    - [10, 98.401]
  - - [448, 3584, 1, 3328]
    - [3, 65.172]
  - - [5888, 1408, 1, 1280]
    - [4, 91.751]
  - - [1024, 2368, 1, 256]
    - [30, 72.801]
  - - [5056, 6784, 1, 1280]
    - [16, 98.847]
  - - [5056, 5056, 1, 1280]
    - [16, 96.246]
  - - [4288, 6784, 1, 256]
    - [4, 94.948]
  - - [6784, 448, 1, 256]
    - [3, 75.586]
  - - [5056, 256, 1, 1280]
    - [3, 67.986]
  - - [5888, 704, 1, 1280]
    - [31, 82.381]
  - - [3584, 1024, 1, 256]
    - [3, 78.226]
  - - [6784, 4288, 1, 3328]
    - [4, 97.326]
  - - [1856, 2368, 1, 3328]
    - [4, 88.274]
  - - [5888, 2944, 1, 1280]
    - [4, 97.48]
  - - [5888, 1024, 1, 256]
    - [4, 85.441]
  - - [1408, 2944, 1, 256]
    - [4, 79.07]
  - - [6784, 5056, 1, 3328]
    - [31, 99.175]
  - - [5056, 5056, 1, 256]
    - [23, 91.891]
  - - [1024, 3584, 1, 1280]
    - [31, 83.497]
  - - [2368, 2944, 1, 1280]
    - [31, 87.423]
  - - [6784, 6784, 1, 1280]
    - [4, 99.542]
  - - [1408, 4288, 1, 1280]
    - [31, 88.525]
  - - [3584, 4288, 1, 1280]
    - [31, 95.339]
  - - [512, 6000, 1, 2560]
    - [42, 81.303]
  - - [2368, 704, 1, 1280]
    - [3, 75.203]
  - - [5056, 4288, 1, 3328]
    - [19, 96.935]
  - - [3584, 2368, 1, 3328]
    - [31, 94.015]
  - - [5888, 6784, 1, 1280]
    - [2, 100.439]
  - - [6784, 448, 1, 1280]
    - [3, 79.63]
  - - [2944, 5888, 1, 256]
    - [4, 95.095]
  - - [4288, 2944, 1, 256]
    - [4, 91.035]
  - - [6144, 24000, 1, 2560]
    - [17, 101.177]
  - - [5056, 2368, 1, 1280]
    - [4, 90.632]
  - - [448, 3584, 1, 1280]
    - [3, 64.427]
  - - [6784, 5888, 1, 256]
    - [4, 98.517]
  - - [1024, 1408, 1, 256]
    - [27, 66.717]
  - - [2368, 2368, 1, 3328]
    - [4, 84.081]
  - - [5056, 704, 1, 3328]
    - [16, 81.354]
  - - [1408, 1856, 1, 256]
    - [30, 78.079]
  - - [5888, 1856, 1, 256]
    - [4, 86.974]
  - - [704, 5888, 1, 256]
    - [4, 73.951]
  - - [3584, 704, 1, 3328]
    - [30, 81.334]
  - - [1408, 1408, 1, 256]
    - [3, 72.842]
  - - [448, 4288, 1, 256]
    - [3, 61.06]
  - - [704, 2368, 1, 1280]
    - [3, 66.787]
  - - [1856, 2368, 1, 1280]
    - [4, 86.986]
  - - [1408, 1408, 1, 3328]
    - [30, 80.92]
  - - [256, 193600, 1, 64]
    - [27, 84.402]
  - - [1408, 1024, 1, 1280]
    - [27, 76.777]
  - - [704, 6784, 1, 256]
    - [3, 74.146]
  - - [6784, 704, 1, 256]
    - [30, 79.895]
  - - [2048, 7000, 1, 2048]
    - [23, 96.021]
  - - [5056, 704, 1, 256]
    - [3, 75.092]
  - - [1408, 3584, 1, 256]
    - [39, 84.462]
  - - [3584, 4288, 1, 3328]
    - [31, 96.135]
  - - [5888, 1856, 1, 1280]
    - [4, 91.129]
  - - [2368, 3584, 1, 1280]
    - [4, 92.986]
  - - [2944, 3584, 1, 3328]
    - [19, 98.761]
  - - [6784, 2944, 1, 256]
    - [4, 96.938]
  - - [1024, 1500, 1, 2560]
    - [39, 72.157]
  - - [1856, 2368, 1, 256]
    - [4, 76.681]
  - - [3584, 6784, 1, 3328]
    - [2, 98.698]
  - - [5056, 4288, 1, 1280]
    - [31, 96.316]
  - - [6784, 1856, 1, 3328]
    - [4, 92.361]
  - - [1408, 5056, 1, 1280]
    - [31, 89.812]
  - - [196, 1024, 64, 256]
    - [4, 66.934]
  - - [6784, 5888, 1, 3328]
    - [7, 100.526]
  - - [2368, 5056, 1, 1280]
    - [34, 90.49]
  - - [1024, 5056, 1, 1280]
    - [39, 90.555]
  - - [4288, 1024, 1, 256]
    - [9, 77.353]
  - - [2368, 1408, 1, 256]
    - [3, 75.166]
  - - [5888, 448, 1, 1280]
    - [27, 76.201]
  - - [704, 5888, 1, 3328]
    - [7, 85.238]
  - - [1024, 6784, 1, 1280]
    - [4, 94.956]
  - - [3584, 2944, 1, 1280]
    - [4, 97.625]
  - - [512, 6000, 1, 2816]
    - [19, 81.819]
  - - [512, 24000, 1, 2048]
    - [39, 96.709]
  - - [1408, 5056, 1, 3328]
    - [23, 90.582]
  - - [1856, 1856, 1, 3328]
    - [16, 78.971]
  - - [2368, 2368, 1, 256]
    - [15, 79.352]
  - - [4288, 4288, 1, 1280]
    - [4, 93.984]
  - - [5888, 1024, 1, 1280]
    - [4, 89.923]
  - - [1024, 12544, 1, 256]
    - [4, 94.08]
  - - [512, 48000, 1, 2560]
    - [40, 99.035]
  - - [704, 6784, 1, 3328]
    - [4, 85.636]
  - - [5888, 5888, 1, 3328]
    - [31, 100.326]
  - - [5056, 1024, 1, 1280]
    - [4, 90.217]
  - - [448, 5888, 1, 3328]
    - [12, 70.903]
  - - [1024, 2944, 1, 1280]
    - [15, 79.241]
  - - [5056, 5888, 1, 1280]
    - [4, 97.237]
  - - [448, 6784, 1, 256]
    - [18, 68.07]
  - - [3584, 5888, 1, 256]
    - [4, 96.463]
  - - [2944, 3584, 1, 256]
    - [4, 94.119]
  - - [3072, 1500, 1, 1024]
    - [39, 89.588]
  - - [6784, 1024, 1, 3328]
    - [7, 96.427]
  - - [6784, 2944, 1, 3328]
    - [4, 99.756]
  - - [6784, 2368, 1, 1280]
    - [16, 96.101]
  - - [4288, 3584, 1, 256]
    - [4, 91.782]
  - - [4288, 5888, 1, 1280]
    - [19, 97.237]
  - - [1024, 6000, 1, 1536]
    - [23, 90.143]
  - - [4288, 1856, 1, 1280]
    - [4, 87.31]
  - - [1856, 2944, 1, 3328]
    - [19, 90.046]
  - - [256, 6784, 1, 3328]
    - [41, 82.996]
  - - [512, 3000, 1, 1536]
    - [33, 70.616]
  - - [5056, 1024, 1, 256]
    - [6, 81.238]
  - - [5056, 1856, 1, 3328]
    - [4, 92.144]
  - - [4096, 7000, 1, 4096]
    - [9, 99.395]
  - - [5056, 256, 1, 3328]
    - [8, 70.141]
  - - [1024, 5888, 1, 1280]
    - [31, 89.501]
  - - [5056, 3584, 1, 256]
    - [7, 92.612]
  - - [1856, 1024, 1, 1280]
    - [3, 75.145]
  - - [1856, 1856, 1, 1280]
    - [4, 77.144]
  - - [3072, 24000, 1, 1024]
    - [40, 99.621]
  - - [1856, 1024, 1, 3328]
    - [3, 76.878]
  - - [6784, 1024, 1, 256]
    - [39, 90.087]
  - - [5056, 5888, 1, 3328]
    - [19, 97.794]
  - - [1856, 1024, 1, 256]
    - [3, 62.669]
  - - [512, 48000, 1, 1536]
    - [39, 98.621]
  - - [5056, 1408, 1, 3328]
    - [4, 90.425]
  - - [448, 5888, 1, 256]
    - [15, 63.308]
  - - [1408, 6784, 1, 3328]
    - [4, 94.17]
  - - [1024, 24000, 1, 2560]
    - [23, 98.577]
  - - [2944, 1408, 1, 3328]
    - [34, 84.628]
  - - [2944, 4288, 1, 3328]
    - [19, 96.583]
  - - [5056, 2944, 1, 256]
    - [9, 92.067]
  - - [2368, 1856, 1, 256]
    - [15, 76.898]
  - - [1408, 3584, 1, 3328]
    - [4, 91.662]
  - - [2368, 6784, 1, 256]
    - [4, 90.56]
  - - [4288, 2368, 1, 3328]
    - [4, 94.264]
  - - [704, 3584, 1, 1280]
    - [31, 75.887]
  - - [1408, 5888, 1, 3328]
    - [4, 92.426]
  - - [1856, 5056, 1, 256]
    - [23, 84.959]
  - - [6784, 6784, 1, 256]
    - [4, 97.632]
  - - [2368, 4288, 1, 1280]
    - [16, 93.068]
  - - [3584, 1856, 1, 1280]
    - [31, 89.911]
  - - [8448, 48000, 1, 2816]
    - [5, 102.03]
  - - [512, 6000, 1, 2048]
    - [42, 79.668]
  - - [3584, 448, 1, 256]
    - [30, 66.076]
  - - [3584, 3584, 1, 1280]
    - [19, 98.054]
  - - [256, 6784, 1, 256]
    - [3, 70.995]
  - - [1856, 3584, 1, 3328]
    - [34, 92.081]
  - - [3584, 3584, 1, 256]
    - [4, 94.213]
  - - [6784, 4288, 1, 1280]
    - [4, 96.981]
  - - [3584, 5056, 1, 256]
    - [31, 91.671]
  - - [2944, 2368, 1, 1280]
    - [31, 87.666]
  - - [6784, 3584, 1, 256]
    - [4, 96.246]
  - - [1856, 1408, 1, 256]
    - [0, 68.702]
  - - [2944, 2944, 1, 3328]
    - [4, 96.458]
  - - [5056, 6784, 1, 256]
    - [31, 95.848]
  - - [1408, 4288, 1, 3328]
    - [16, 90.095]
  - - [6784, 256, 1, 1280]
    - [6, 81.759]
  - - [2368, 704, 1, 3328]
    - [30, 77.515]
  - - [3584, 6784, 1, 256]
    - [4, 96.197]
  - - [5056, 1856, 1, 256]
    - [39, 84.686]
  - - [1024, 3000, 1, 2816]
    - [34, 81.706]
  - - [704, 4288, 1, 256]
    - [30, 68.207]
  - - [1408, 6784, 1, 1280]
    - [4, 93.661]
  - - [7680, 24000, 1, 2560]
    - [17, 101.471]
  - - [4608, 48000, 1, 1536]
    - [5, 101.69]
  - - [1024, 24000, 1, 1536]
    - [39, 98.274]
  - - [5056, 2368, 1, 3328]
    - [4, 91.43]
  - - [2944, 4288, 1, 256]
    - [16, 89.651]
  - - [1408, 3584, 1, 1280]
    - [4, 90.772]
  - - [1024, 1500, 1, 2816]
    - [4, 72.75]
  - - [1024, 6000, 1, 2048]
    - [39, 90.639]
  - - [512, 24000, 1, 2560]
    - [39, 97.058]
  - - [6144, 3000, 1, 2560]
    - [16, 97.08]
  - - [2368, 6784, 1, 3328]
    - [39, 96.672]
  - - [5056, 704, 1, 1280]
    - [3, 79.425]
  - - [1856, 4288, 1, 3328]
    - [4, 88.39]
  - - [1408, 5888, 1, 256]
    - [4, 88.325]
  - - [704, 2944, 1, 1280]
    - [4, 75.258]
  - - [3584, 704, 1, 1280]
    - [30, 80.498]
  - - [5888, 5056, 1, 256]
    - [4, 94.481]
  - - [3584, 448, 1, 3328]
    - [15, 75.35]
  - - [704, 2368, 1, 3328]
    - [15, 68.302]
  - - [448, 5056, 1, 3328]
    - [30, 72.811]
  - - [4288, 448, 1, 256]
    - [21, 65.369]
  - - [5888, 2368, 1, 256]
    - [4, 89.598]
  - - [6784, 704, 1, 3328]
    - [16, 86.077]
  - - [1408, 2944, 1, 3328]
    - [19, 84.939]
  - - [4288, 4288, 1, 256]
    - [23, 90.683]
  - - [2368, 704, 1, 256]
    - [13, 63.759]
  - - [3584, 2368, 1, 256]
    - [23, 85.827]
  - - [5888, 5056, 1, 1280]
    - [4, 97.345]
  - - [8448, 24000, 1, 2816]
    - [32, 101.379]
  - - [3584, 3584, 1, 3328]
    - [7, 98.512]
  - - [3072, 1500, 1, 128]
    - [30, 68.441]
  - - [2048, 3136, 1, 512]
    - [15, 85.221]
  - - [5888, 6784, 1, 256]
    - [4, 98.548]
  - - [4288, 2944, 1, 3328]
    - [16, 96.359]
  - - [256, 5056, 1, 1280]
    - [30, 69.548]
  - - [6784, 5888, 1, 1280]
    - [4, 100.263]
  - - [5888, 4288, 1, 1280]
    - [16, 97.138]
  - - [1024, 24000, 1, 2048]
    - [39, 98.558]
  - - [1408, 1856, 1, 1280]
    - [30, 82.234]
  - - [5888, 448, 1, 3328]
    - [3, 75.962]
  - - [704, 5888, 1, 1280]
    - [7, 83.206]
  - - [5056, 2944, 1, 3328]
    - [4, 96.68]
  - - [448, 4288, 1, 1280]
    - [16, 69.039]
  - - [3584, 704, 1, 256]
    - [3, 75.461]
  - - [3584, 1408, 1, 3328]
    - [4, 91.676]
  - - [2368, 1024, 1, 1280]
    - [3, 76.227]
  - - [2944, 6784, 1, 1280]
    - [4, 99.375]
  - - [1856, 6784, 1, 256]
    - [4, 89.152]
  - - [4288, 448, 1, 3328]
    - [15, 77.896]
  - - [6784, 704, 1, 1280]
    - [16, 84.58]
  - - [5888, 1024, 1, 3328]
    - [4, 90.656]
  - - [704, 6784, 1, 1280]
    - [31, 83.753]
  - - [512, 3000, 1, 2048]
    - [11, 71.653]
  - - [5056, 1024, 1, 3328]
    - [4, 93.839]
  - - [704, 5056, 1, 1280]
    - [31, 79.389]
  - - [2944, 1856, 1, 256]
    - [15, 82.026]
  - - [5888, 5056, 1, 3328]
    - [19, 97.762]
  - - [3584, 6784, 1, 1280]
    - [4, 98.329]
  - - [1856, 5888, 1, 256]
    - [4, 86.044]
  - - [4288, 4288, 1, 3328]
    - [31, 94.551]
  - - [4288, 1408, 1, 1280]
    - [4, 88.812]
  - - [4288, 2368, 1, 256]
    - [4, 85.069]
  - - [2944, 5056, 1, 1280]
    - [4, 95.862]
  - - [6784, 2368, 1, 3328]
    - [16, 96.909]
  - - [4288, 1856, 1, 3328]
    - [4, 88.378]
  - - [1856, 2944, 1, 1280]
    - [34, 87.818]
  - - [4288, 6784, 1, 3328]
    - [4, 97.258]
  - - [3584, 1024, 1, 1280]
    - [39, 82.887]
  - - [1024, 4288, 1, 256]
    - [30, 81.836]
  - - [5888, 3584, 1, 3328]
    - [19, 99.74]
  - - [5056, 3584, 1, 3328]
    - [7, 96.366]
  - - [2368, 1408, 1, 1280]
    - [4, 85.258]
  - - [5056, 2944, 1, 1280]
    - [4, 95.925]
  - - [8448, 6000, 1, 2816]
    - [4, 99.72]
  - - [1024, 6784, 1, 256]
    - [31, 85.286]
  - - [2944, 5056, 1, 3328]
    - [34, 96.805]
  - - [3584, 2944, 1, 256]
    - [23, 93.446]
  - - [5056, 6784, 1, 3328]
    - [4, 99.24]
  - - [3584, 4288, 1, 256]
    - [28, 88.575]
  - - [1856, 6784, 1, 3328]
    - [4, 92.125]
  - - [512, 6000, 1, 1536]
    - [38, 79.577]
  - - [5056, 1408, 1, 1280]
    - [4, 89.68]
  - - [5888, 5888, 1, 256]
    - [39, 98.139]
  - - [4288, 1024, 1, 1280]
    - [7, 86.984]
  - - [448, 6784, 1, 3328]
    - [34, 80.968]
  - - [2944, 1408, 1, 1280]
    - [4, 83.893]
  - - [3072, 6000, 1, 1024]
    - [39, 96.48]
  - - [2944, 1856, 1, 3328]
    - [31, 89.376]
  - - [448, 5056, 1, 256]
    - [30, 65.89]
  - - [3584, 5888, 1, 1280]
    - [19, 99.31]
  - - [6784, 1856, 1, 1280]
    - [4, 91.823]
  - - [5888, 256, 1, 3328]
    - [4, 73.855]
  - - [1856, 5888, 1, 3328]
    - [7, 92.195]
  - - [3584, 1408, 1, 256]
    - [39, 84.553]
  - - [704, 3584, 1, 3328]
    - [4, 78.381]
  - - [5056, 448, 1, 1280]
    - [3, 79.461]
  - - [3584, 1856, 1, 3328]
    - [16, 91.206]
  - - [1024, 3000, 1, 2048]
    - [26, 80.293]
  - - [2944, 1024, 1, 256]
    - [3, 74.795]
  - - [2368, 4288, 1, 3328]
    - [7, 94.606]
  - - [1024, 1408, 1, 1280]
    - [3, 77.122]
  - - [6784, 5056, 1, 256]
    - [23, 95.821]
  - - [4288, 5888, 1, 256]
    - [4, 94.753]
  - - [2944, 6784, 1, 256]
    - [4, 96.906]
  - - [2368, 2368, 1, 1280]
    - [16, 83.133]
  - - [1856, 3584, 1, 1280]
    - [19, 90.396]
  - - [3584, 1408, 1, 1280]
    - [4, 90.541]
  - - [5056, 3584, 1, 1280]
    - [4, 95.756]
  - - [256, 5888, 1, 256]
    - [18, 62.196]
  - - [1856, 1408, 1, 3328]
    - [16, 80.898]
  - - [1024, 4288, 1, 3328]
    - [19, 89.108]
  - - [2944, 2368, 1, 3328]
    - [16, 88.968]
  - - [704, 4288, 1, 3328]
    - [19, 80.565]
  - - [1024, 48000, 1, 2816]
    - [2, 100.35]
  - - [1024, 1856, 1, 1280]
    - [3, 75.338]
  - - [6784, 1856, 1, 256]
    - [16, 87.881]
  - - [512, 48000, 1, 2816]
    - [4, 99.327]
  - - [512, 3000, 1, 2816]
    - [41, 72.097]
  - - [1024, 5888, 1, 256]
    - [4, 85.207]
  - - [1408, 2368, 1, 256]
    - [30, 76.796]
  - - [2944, 704, 1, 3328]
    - [34, 79.615]
  - - [2944, 2944, 1, 1280]
    - [4, 95.783]
  - - [6784, 256, 1, 3328]
    - [6, 83.531]
  - - [1408, 5056, 1, 256]
    - [39, 84.409]
  - - [512, 50176, 1, 128]
    - [31, 94.059]
  - - [1408, 4288, 1, 256]
    - [3, 82.417]
  - - [5888, 2368, 1, 1280]
    - [9, 93.509]
  - - [2368, 5888, 1, 1280]
    - [4, 93.432]
  - - [5888, 256, 1, 1280]
    - [4, 71.265]
  - - [2368, 1856, 1, 3328]
    - [4, 88.725]
  - - [2944, 704, 1, 256]
    - [30, 69.379]
  - - [2368, 6784, 1, 1280]
    - [31, 95.925]
  - - [2368, 1024, 1, 3328]
    - [15, 77.746]
  - - [1856, 4288, 1, 1280]
    - [4, 87.22]
  - - [704, 3584, 1, 256]
    - [6, 66.503]
  - - [704, 2944, 1, 3328]
    - [19, 79.208]
  - - [1856, 5056, 1, 3328]
    - [4, 92.122]
  - - [196, 256, 64, 1024]
    - [26, 62.85]
  - - [3584, 5056, 1, 1280]
    - [9, 95.467]
  - - [2944, 1024, 1, 3328]
    - [7, 81.884]
  - - [1408, 6784, 1, 256]
    - [4, 90.239]
  - - [6784, 1408, 1, 3328]
    - [31, 94.121]
  - - [1024, 2368, 1, 1280]
    - [30, 77.474]
  - - [6784, 2944, 1, 1280]
    - [4, 99.339]
  - - [3584, 448, 1, 1280]
    - [15, 73.92]
  - - [2944, 6784, 1, 3328]
    - [4, 99.687]
  - - [448, 5056, 1, 1280]
    - [3, 71.701]
  - - [4288, 5056, 1, 1280]
    - [4, 96.32]
  - - [4288, 704, 1, 256]
    - [3, 73.828]
  - - [5888, 704, 1, 256]
    - [3, 78.106]
  - - [256, 5888, 1, 3328]
    - [4, 73.664]
  - - [6784, 4288, 1, 256]
    - [4, 94.719]
  - - [5888, 256, 1, 256]
    - [0, 62.531]
  - - [6784, 1024, 1, 1280]
    - [7, 95.505]
  - - [2944, 704, 1, 1280]
    - [31, 75.203]
  - - [6784, 3584, 1, 1280]
    - [19, 98.356]
  - - [1408, 2944, 1, 1280]
    - [4, 83.883]
  - - [1408, 2368, 1, 3328]
    - [4, 87.546]
  - - [2368, 2944, 1, 256]
    - [4, 84.544]
  - - [3584, 1856, 1, 256]
    - [3, 83.321]
  - - [4288, 3584, 1, 1280]
    - [31, 95.366]
  - - [4288, 2944, 1, 1280]
    - [4, 95.599]
  - - [5056, 448, 1, 3328]
    - [15, 81.125]
  - - [5124, 1500, 1, 2048]
    - [12, 89.832]
  - - [4288, 5056, 1, 3328]
    - [7, 97.082]
  - - [256, 5056, 1, 3328]
    - [30, 71.152]
  - - [5056, 2368, 1, 256]
    - [9, 85.957]
  - - [4288, 704, 1, 3328]
    - [19, 80.604]
  - - [448, 3584, 1, 256]
    - [3, 57.026]
  - - [6144, 1500, 1, 2560]
    - [39, 95.39]
  - - [1024, 1408, 1, 3328]
    - [3, 78.986]
  - - [2944, 5888, 1, 1280]
    - [7, 97.786]
  - - [5888, 3584, 1, 256]
    - [4, 96.935]
  - - [1408, 1856, 1, 3328]
    - [30, 84.131]
  - - [7680, 6000, 1, 2560]
    - [4, 99.655]
  - - [6784, 1408, 1, 1280]
    - [4, 93.0]
  - - [512, 3000, 1, 2560]
    - [41, 72.07]
  - - [704, 2944, 1, 256]
    - [3, 66.221]
  - - [2944, 5888, 1, 3328]
    - [34, 98.235]
  - - [1024, 1500, 1, 1536]
    - [18, 70.583]
  - - [1408, 1408, 1, 1280]
    - [30, 79.755]
  - - [3072, 3000, 1, 1024]
    - [23, 93.977]
  - - [448, 4288, 1, 3328]
    - [34, 73.519]
  - - [704, 2368, 1, 256]
    - [3, 59.691]
  - - [5888, 2368, 1, 3328]
    - [16, 94.121]
  - - [5124, 9124, 1, 1760]
    - [9, 97.097]
  - - [4288, 5056, 1, 256]
    - [4, 91.339]
  - - [4288, 448, 1, 1280]
    - [3, 75.453]
  - - [5888, 704, 1, 3328]
    - [34, 84.503]
  - - [4288, 3584, 1, 3328]
    - [16, 96.065]
  - - [1024, 6784, 1, 3328]
    - [31, 95.669]
  - - [512, 3136, 1, 2048]
    - [22, 74.605]
  - - [1408, 1024, 1, 256]
    - [27, 67.937]
  - - [8448, 1500, 1, 2816]
    - [4, 96.59]
  - - [2560, 7000, 1, 2560]
    - [31, 97.615]
  - - [6784, 6784, 1, 3328]
    - [16, 99.723]
  - - [704, 5056, 1, 3328]
    - [16, 80.765]
  - - [3584, 5056, 1, 3328]
    - [19, 96.188]
  - - [2368, 2944, 1, 3328]
    - [4, 88.843]
  - - [2368, 3584, 1, 256]
    - [9, 82.137]
  - - [4608, 3000, 1, 1536]
    - [39, 96.2]
  - - [5124, 9124, 1, 4096]
    - [12, 97.08]
  - - [7680, 48000, 1, 2560]
    - [5, 101.915]
  - - [4608, 1500, 1, 1536]
    - [39, 92.566]
  - - [3584, 2368, 1, 1280]
    - [31, 92.749]
  - - [5124, 9124, 1, 2560]
    - [16, 97.102]
  - - [1856, 1856, 1, 256]
    - [3, 70.831]
  - - [4288, 1408, 1, 3328]
    - [4, 89.991]
  - - [5124, 9124, 1, 2048]
    - [12, 96.935]
  - - [5124, 700, 1, 2048]
    - [23, 79.851]
  - - [256, 12544, 1, 1024]
    - [12, 83.553]
  - - [5888, 1408, 1, 3328]
    - [4, 92.47]
  - - [256, 5056, 1, 256]
    - [36, 60.991]
  - - [2368, 5056, 1, 256]
    - [4, 85.716]
  - - [1024, 6000, 1, 2560]
    - [9, 90.919]
  - - [1024, 5056, 1, 256]
    - [30, 81.694]
  - - [4224, 1500, 1, 176]
    - [30, 79.364]
  - - [2368, 1408, 1, 3328]
    - [4, 87.237]
  - - [1024, 48000, 1, 1536]
    - [32, 99.585]
  - - [5888, 448, 1, 256]
    - [27, 69.288]
  - - [6784, 5056, 1, 1280]
    - [4, 98.527]
  - - [1024, 48000, 1, 2560]
    - [5, 99.945]
  - - [4288, 6784, 1, 1280]
    - [4, 96.622]
  - - [3072, 48000, 1, 1024]
    - [23, 100.769]
  - - [6784, 1408, 1, 256]
    - [4, 87.273]
  - - [5888, 4288, 1, 256]
    - [31, 93.133]
  - - [5056, 5888, 1, 256]
    - [23, 95.194]
  - - [2368, 1024, 1, 256]
    - [30, 67.913]
  - - [1856, 6784, 1, 1280]
    - [4, 91.802]
  - - [8448, 3000, 1, 2816]
    - [29, 97.965]
  - - [6784, 448, 1, 3328]
    - [7, 80.285]
  - - [5056, 1856, 1, 1280]
    - [4, 91.071]
  - - [1408, 1024, 1, 3328]
    - [30, 79.061]
  - - [7680, 1500, 1, 2560]
    - [31, 95.964]
  - - [5888, 3584, 1, 1280]
    - [16, 99.166]
  - - [1024, 2944, 1, 256]
    - [30, 74.976]
  - - [448, 6784, 1, 1280]
    - [34, 78.091]
  - - [704, 5056, 1, 256]
    - [3, 69.707]
  - - [3584, 1024, 1, 3328]
    - [4, 84.828]
  - - [2944, 1856, 1, 1280]
    - [31, 87.652]
  - - [5056, 256, 1, 256]
    - [0, 56.906]
  - - [2368, 3584, 1, 3328]
    - [4, 94.09]
  - - [3584, 5888, 1, 3328]
    - [19, 99.619]
  - - [2944, 3584, 1, 1280]
    - [19, 97.847]
  - - [1856, 5888, 1, 1280]
    - [19, 91.175]
  - - [4608, 24000, 1, 1536]
    - [24, 100.854]
  - - [4288, 1408, 1, 256]
    - [28, 79.261]
  - - [4288, 2368, 1, 1280]
    - [16, 93.111]
  - - [2944, 5056, 1, 256]
    - [39, 91.79]
  - - [6784, 2368, 1, 256]
    - [23, 91.717]
  - - [1024, 24000, 1, 2816]
    - [34, 99.108]
  - - [4288, 1856, 1, 256]
    - [8, 80.194]
  - - [1856, 2944, 1, 256]
    - [9, 82.306]
  - - [4608, 6000, 1, 1536]
    - [16, 97.695]
  - - [7680, 3000, 1, 2560]
    - [4, 97.572]
  - - [5124, 700, 1, 2560]
    - [4, 81.375]
  - - [1856, 1408, 1, 1280]
    - [4, 78.26]
  - - [1024, 4288, 1, 1280]
    - [4, 86.111]
  - - [2368, 5056, 1, 3328]
    - [19, 91.814]
  - - [4288, 1024, 1, 3328]
    - [19, 89.902]
  - - [6144, 48000, 1, 2560]
    - [17, 101.881]
  - - [1024, 5056, 1, 3328]
    - [31, 92.511]
  - - [1024, 1856, 1, 3328]
    - [15, 77.679]
  - - [5124, 1500, 1, 2560]
    - [42, 90.946]
  - - [3584, 2944, 1, 3328]
    - [4, 98.334]
  - - [5888, 2944, 1, 256]
    - [4, 95.197]
  - - [5056, 4288, 1, 256]
    - [23, 92.602]
  - - [1024, 3584, 1, 256]
    - [15, 78.065]
  - - [5056, 1408, 1, 256]
    - [9, 86.299]
  - - [5888, 5888, 1, 1280]
    - [4, 100.094]
  - - [448, 5888, 1, 1280]
    - [30, 68.984]
  - - [1024, 3000, 1, 2560]
    - [26, 81.038]
  - - [4288, 704, 1, 1280]
    - [3, 79.092]
  - - [2944, 1408, 1, 256]
    - [4, 79.022]
  - - [2368, 5888, 1, 3328]
    - [4, 94.061]
  - - [2368, 1856, 1, 1280]
    - [4, 86.654]
  - - [1024, 6000, 1, 2816]
    - [31, 91.332]
  - - [5888, 4288, 1, 3328]
    - [31, 97.55]
  - - [5056, 448, 1, 256]
    - [3, 69.218]
  - - [1856, 5056, 1, 1280]
    - [4, 91.071]
  - - [2944, 1024, 1, 1280]
    - [34, 80.363]
  - - [2368, 4288, 1, 256]
    - [39, 85.139]
  - - [1024, 2368, 1, 3328]
    - [15, 78.323]
  - - [4288, 5888, 1, 3328]
    - [7, 97.688]
  - - [1024, 2944, 1, 3328]
    - [34, 80.597]
  - - [256, 6784, 1, 1280]
    - [33, 81.216]
  - - [1856, 3584, 1, 256]
    - [19, 82.253]
  - - [1024, 1500, 1, 2048]
    - [25, 71.383]
  - - [512, 24000, 1, 2816]
    - [4, 97.196]
  - - [256, 5888, 1, 1280]
    - [18, 69.707]
  - - [2944, 2368, 1, 256]
    - [30, 83.917]
  - - [1024, 1856, 1, 256]
    - [3, 69.915]
  - - [6784, 3584, 1, 3328]
    - [7, 98.804]
  - - [1760, 7000, 1, 1760]
    - [7, 94.013]
  - - [1024, 5888, 1, 3328]
    - [4, 90.43]
  - - [1408, 2368, 1, 1280]
    - [16, 84.934]
  - - [2944, 2944, 1, 256]
    - [4, 91.831]
  - - [6784, 256, 1, 256]
    - [18, 71.66]
  - - [1024, 3000, 1, 1536]
    - [30, 79.721]
  - - [5888, 1408, 1, 256]
    - [4, 88.385]
  - - [5888, 6784, 1, 3328]
    - [14, 100.68]
  - - [704, 4288, 1, 1280]
    - [19, 75.897]
  - - [128, 50176, 1, 512]
    - [26, 85.682]
  - - [1024, 48000, 1, 2048]
    - [23, 99.725]
  - - [784, 512, 64, 128]
    - [1, 79.769]
  - - [3136, 256, 64, 64]
    - [37, 88.633]
  - - [12544, 1024, 1, 256]
    - [9, 93.991]
  - - [784, 128, 128, 512]
    - [20, 73.146]
  - - [784, 512, 256, 128]
    - [0, 75.41]
  - - [3136, 512, 1, 2048]
    - [11, 73.553]
  - - [12544, 256, 1, 1024]
    - [7, 84.156]
  - - [3136, 2048, 1, 512]
    - [39, 84.37]
  - - [3136, 256, 256, 64]
    - [0, 45.245]
  - - [784, 128, 64, 512]
    - [38, 73.445]
  - - [784, 512, 128, 128]
    - [31, 81.009]
  - - [784, 128, 256, 512]
    - [35, 71.128]
  - - [3136, 256, 128, 64]
    - [0, 59.105]
  - - [1024, 1024, 1, 3328]
    - [59, 71.894]
  - - [128, 6784, 1, 3328]
    - [59, 61.007]
  - - [256, 4288, 1, 3328]
    - [53, 74.817]
  - - [704, 1856, 1, 3328]
    - [46, 71.009]
  - - [448, 1024, 1, 1280]
    - [64, 47.9]
  - - [1024, 704, 1, 256]
    - [44, 45.689]
  - - [256, 1856, 1, 1280]
    - [44, 51.818]
  - - [256, 2944, 1, 3328]
    - [44, 65.046]
  - - [128, 3584, 1, 1280]
    - [61, 49.368]
  - - [4288, 256, 1, 256]
    - [44, 54.208]
  - - [5888, 64, 1, 3328]
    - [45, 44.379]
  - - [2944, 256, 1, 3328]
    - [58, 64.559]
  - - [1408, 448, 1, 1280]
    - [56, 52.903]
  - - [1408, 256, 1, 1280]
    - [44, 39.506]
  - - [3072, 128, 1, 1024]
    - [113, 34.849]
  - - [6784, 64, 1, 256]
    - [44, 32.289]
  - - [2368, 128, 1, 3328]
    - [57, 35.696]
  - - [2944, 128, 1, 256]
    - [61, 29.369]
  - - [448, 1408, 1, 256]
    - [45, 36.663]
  - - [64, 5056, 1, 3328]
    - [51, 37.471]
  - - [512, 1500, 1, 2816]
    - [64, 65.152]
  - - [256, 3584, 1, 3328]
    - [59, 64.381]
  - - [256, 1408, 1, 256]
    - [67, 28.164]
  - - [5056, 64, 1, 1280]
    - [45, 35.067]
  - - [2368, 128, 1, 256]
    - [43, 20.744]
  - - [4288, 128, 1, 1280]
    - [64, 56.318]
  - - [5888, 64, 1, 256]
    - [44, 28.86]
  - - [1856, 256, 1, 1280]
    - [44, 49.677]
  - - [64, 5888, 1, 3328]
    - [51, 43.41]
  - - [1024, 704, 1, 1280]
    - [56, 60.069]
  - - [256, 1408, 1, 3328]
    - [59, 43.222]
  - - [6784, 128, 1, 3328]
    - [66, 61.007]
  - - [704, 704, 1, 3328]
    - [59, 57.391]
  - - [3584, 256, 1, 3328]
    - [66, 64.439]
  - - [128, 3584, 1, 3328]
    - [59, 53.979]
  - - [128, 2944, 1, 1280]
    - [50, 40.753]
  - - [448, 1856, 1, 1280]
    - [45, 63.491]
  - - [3584, 128, 1, 256]
    - [44, 35.135]
  - - [448, 1408, 1, 3328]
    - [44, 54.056]
  - - [704, 1024, 1, 256]
    - [44, 44.059]
  - - [256, 3584, 1, 256]
    - [44, 49.079]
  - - [1408, 704, 1, 256]
    - [56, 53.672]
  - - [448, 2944, 1, 3328]
    - [45, 67.284]
  - - [64, 5888, 1, 256]
    - [49, 24.59]
  - - [512, 1500, 1, 2048]
    - [67, 63.571]
  - - [448, 2368, 1, 1280]
    - [45, 63.161]
  - - [704, 704, 1, 256]
    - [50, 33.254]
  - - [64, 193600, 1, 64]
    - [51, 52.1]
  - - [128, 4288, 1, 3328]
    - [69, 63.575]
  - - [256, 2368, 1, 256]
    - [44, 39.641]
  - - [1024, 448, 1, 3328]
    - [58, 53.54]
  - - [1856, 704, 1, 1280]
    - [46, 68.538]
  - - [1024, 1024, 1, 1280]
    - [59, 69.898]
  - - [256, 2944, 1, 256]
    - [44, 48.462]
  - - [1024, 700, 1, 512]
    - [67, 48.999]
  - - [128, 6784, 1, 1280]
    - [53, 57.885]
  - - [1408, 704, 1, 3328]
    - [66, 68.49]
  - - [128, 5888, 1, 1280]
    - [67, 61.538]
  - - [704, 1408, 1, 3328]
    - [47, 68.535]
  - - [7680, 64, 1, 2560]
    - [65, 56.144]
  - - [448, 704, 1, 1280]
    - [45, 34.228]
  - - [6784, 128, 1, 256]
    - [44, 48.117]
  - - [704, 448, 1, 256]
    - [60, 22.743]
  - - [256, 1856, 1, 3328]
    - [46, 55.452]
  - - [1024, 704, 1, 3328]
    - [58, 61.753]
  - - [128, 4288, 1, 256]
    - [50, 41.725]
  - - [64, 6784, 1, 3328]
    - [68, 47.95]
  - - [2944, 256, 1, 1280]
    - [56, 61.996]
  - - [1856, 704, 1, 256]
    - [44, 55.857]
  - - [704, 1856, 1, 256]
    - [45, 55.167]
  - - [2944, 448, 1, 256]
    - [44, 61.215]
  - - [2368, 128, 1, 1280]
    - [45, 33.034]
  - - [64, 6784, 1, 256]
    - [51, 28.212]
  - - [64, 5056, 1, 1280]
    - [51, 34.389]
  - - [704, 448, 1, 3328]
    - [51, 37.143]
  - - [2368, 256, 1, 1280]
    - [44, 49.158]
  - - [2368, 448, 1, 1280]
    - [56, 67.65]
  - - [128, 3584, 1, 256]
    - [50, 35.397]
  - - [1856, 448, 1, 3328]
    - [56, 70.325]
  - - [128, 5056, 1, 256]
    - [61, 41.7]
  - - [4288, 256, 1, 1280]
    - [59, 69.512]
  - - [4288, 128, 1, 3328]
    - [59, 63.759]
  - - [7680, 128, 1, 2560]
    - [66, 67.559]
  - - [448, 2368, 1, 3328]
    - [45, 65.435]
  - - [256, 1408, 1, 1280]
    - [50, 39.422]
  - - [128, 2368, 1, 256]
    - [50, 24.173]
  - - [6784, 64, 1, 3328]
    - [65, 50.699]
  - - [128, 2944, 1, 3328]
    - [53, 44.64]
  - - [2944, 448, 1, 3328]
    - [58, 72.087]
  - - [5888, 128, 1, 256]
    - [44, 49.388]
  - - [5056, 64, 1, 256]
    - [51, 21.95]
  - - [512, 1500, 1, 1536]
    - [67, 62.818]
  - - [128, 5056, 1, 3328]
    - [61, 55.722]
  - - [256, 4288, 1, 1280]
    - [44, 71.178]
  - - [4288, 128, 1, 256]
    - [45, 36.748]
  - - [3584, 256, 1, 256]
    - [44, 48.992]
  - - [128, 2944, 1, 256]
    - [50, 29.593]
  - - [3584, 128, 1, 3328]
    - [66, 54.138]
  - - [5888, 128, 1, 3328]
    - [46, 64.477]
  - - [64, 193600, 1, 256]
    - [54, 59.428]
  - - [1408, 704, 1, 1280]
    - [70, 63.392]
  - - [448, 1408, 1, 1280]
    - [44, 51.179]
  - - [704, 1408, 1, 1280]
    - [47, 64.571]
  - - [448, 2944, 1, 256]
    - [45, 55.611]
  - - [448, 2368, 1, 256]
    - [45, 50.842]
  - - [64, 6784, 1, 1280]
    - [62, 44.225]
  - - [128, 2368, 1, 3328]
    - [45, 35.675]
  - - [5056, 64, 1, 3328]
    - [45, 37.997]
  - - [5056, 128, 1, 3328]
    - [52, 55.437]
  - - [448, 704, 1, 256]
    - [49, 22.275]
  - - [1856, 256, 1, 3328]
    - [59, 55.466]
  - - [2944, 128, 1, 3328]
    - [59, 45.146]
  - - [1024, 1024, 1, 256]
    - [44, 55.04]
  - - [704, 1024, 1, 1280]
    - [44, 58.861]
  - - [256, 4288, 1, 256]
    - [44, 59.129]
  - - [2368, 256, 1, 256]
    - [44, 35.571]
  - - [256, 2368, 1, 3328]
    - [67, 52.693]
  - - [704, 448, 1, 1280]
    - [45, 34.324]
  - - [256, 1856, 1, 256]
    - [44, 37.032]
  - - [64, 5056, 1, 256]
    - [49, 22.244]
  - - [1408, 256, 1, 3328]
    - [59, 43.236]
  - - [2368, 448, 1, 256]
    - [44, 51.726]
  - - [4288, 256, 1, 3328]
    - [59, 75.162]
  - - [2944, 256, 1, 256]
    - [44, 48.765]
  - - [6784, 64, 1, 1280]
    - [46, 46.757]
  - - [704, 1856, 1, 1280]
    - [44, 68.772]
  - - [448, 1024, 1, 3328]
    - [59, 53.123]
  - - [2944, 448, 1, 1280]
    - [56, 70.04]
  - - [448, 1024, 1, 256]
    - [45, 30.515]
  - - [1024, 448, 1, 1280]
    - [56, 50.068]
  - - [256, 2368, 1, 1280]
    - [64, 50.926]
  - - [128, 5056, 1, 1280]
    - [50, 53.294]
  - - [1408, 256, 1, 256]
    - [61, 28.381]
  - - [128, 5888, 1, 3328]
    - [61, 64.504]
  - - [2368, 448, 1, 3328]
    - [56, 70.158]
  - - [3584, 128, 1, 1280]
    - [44, 49.682]
  - - [1408, 448, 1, 256]
    - [44, 41.423]
  - - [2368, 256, 1, 3328]
    - [64, 51.423]
  - - [5888, 128, 1, 1280]
    - [44, 61.866]
  - - [256, 3584, 1, 1280]
    - [59, 61.347]
  - - [128, 5888, 1, 256]
    - [67, 47.473]
  - - [1024, 1024, 1, 1024]
    - [123, 61.208]
  - - [1408, 448, 1, 3328]
    - [56, 54.794]
  - - [64, 5888, 1, 1280]
    - [51, 39.832]
  - - [704, 704, 1, 1280]
    - [44, 51.644]
  - - [128, 2368, 1, 1280]
    - [50, 33.056]
  - - [3584, 256, 1, 1280]
    - [66, 61.294]
  - - [5888, 64, 1, 1280]
    - [45, 40.895]
  - - [5056, 128, 1, 1280]
    - [44, 52.481]
  - - [448, 1856, 1, 3328]
    - [45, 66.524]
  - - [1024, 448, 1, 256]
    - [56, 35.576]
  - - [2944, 128, 1, 1280]
    - [44, 41.155]
  - - [256, 2944, 1, 1280]
    - [44, 62.43]
  - - [2560, 128, 1, 2560]
    - [59, 38.151]
  - - [704, 1024, 1, 3328]
    - [56, 61.661]
  - - [1856, 448, 1, 1280]
    - [56, 67.147]
  - - [128, 6784, 1, 256]
    - [50, 46.53]
  - - [704, 1408, 1, 256]
    - [44, 51.075]
  - - [4096, 128, 1, 4096]
    - [53, 61.941]
  - - [448, 2944, 1, 1280]
    - [45, 65.488]
  - - [1856, 256, 1, 256]
    - [50, 32.444]
  - - [5056, 128, 1, 256]
    - [44, 38.12]
  - - [6784, 128, 1, 1280]
    - [59, 58.338]
  - - [1856, 448, 1, 256]
    - [56, 47.613]
  - - [128, 4288, 1, 1280]
    - [52, 58.577]
  - - [448, 704, 1, 3328]
    - [51, 37.109]
  - - [448, 1856, 1, 256]
    - [45, 46.916]
  - - [1856, 704, 1, 3328]
    - [58, 70.626]
  - - [512, 1500, 1, 2560]
    - [61, 63.959]
  - - [3136, 64, 128, 64]
    - [55, 80.975]
  - - [3136, 64, 64, 256]
    - [65, 81.826]
  - - [3136, 64, 128, 256]
    - [63, 45.057]
  - - [3136, 64, 256, 64]
    - [43, 35.865]
  - - [3136, 64, 64, 64]
    - [55, 73.31]
  - - [3136, 64, 256, 256]
    - [48, 46.111]
  - - [2368, 64, 1, 3328]
    - [86, 21.969]
  - - [256, 704, 1, 1280]
    - [80, 26.488]
  - - [1408, 64, 1, 1280]
    - [75, 17.759]
  - - [4096, 32, 1, 4096]
    - [94, 23.249]
  - - [3072, 64, 1, 1024]
    - [113, 19.67]
  - - [1024, 256, 1, 3328]
    - [73, 34.228]
  - - [6144, 32, 1, 2560]
    - [76, 27.951]
  - - [704, 128, 1, 1280]
    - [93, 17.691]
  - - [64, 3584, 1, 3328]
    - [84, 29.813]
  - - [1024, 256, 1, 256]
    - [81, 25.444]
  - - [448, 448, 1, 256]
    - [80, 22.283]
  - - [7680, 32, 1, 2560]
    - [83, 31.086]
  - - [128, 1024, 1, 3328]
    - [76, 23.107]
  - - [64, 1856, 1, 1280]
    - [95, 19.522]
  - - [448, 256, 1, 256]
    - [88, 13.882]
  - - [256, 1024, 1, 256]
    - [84, 25.849]
  - - [1024, 128, 1, 1280]
    - [94, 21.518]
  - - [3072, 32, 1, 1024]
    - [113, 9.257]
  - - [448, 256, 1, 3328]
    - [76, 20.334]
  - - [128, 704, 1, 1280]
    - [93, 17.691]
  - - [1856, 128, 1, 3328]
    - [72, 30.898]
  - - [256, 448, 1, 256]
    - [88, 13.99]
  - - [8448, 32, 1, 2816]
    - [91, 34.387]
  - - [448, 448, 1, 3328]
    - [76, 28.844]
  - - [1408, 128, 1, 1280]
    - [80, 25.193]
  - - [128, 1856, 1, 1280]
    - [73, 29.878]
  - - [2048, 128, 1, 2048]
    - [73, 33.109]
  - - [64, 1408, 1, 3328]
    - [75, 18.762]
  - - [256, 704, 1, 256]
    - [83, 18.357]
  - - [128, 1408, 1, 256]
    - [95, 19.382]
  - - [256, 448, 1, 3328]
    - [76, 20.308]
  - - [64, 2368, 1, 1280]
    - [89, 22.996]
  - - [2368, 64, 1, 256]
    - [80, 15.591]
  - - [704, 128, 1, 3328]
    - [93, 18.781]
  - - [4288, 64, 1, 1280]
    - [72, 32.856]
  - - [2560, 64, 1, 2560]
    - [76, 23.423]
  - - [128, 1024, 1, 1280]
    - [76, 21.451]
  - - [128, 1024, 1, 256]
    - [95, 14.711]
  - - [1856, 64, 1, 256]
    - [79, 14.154]
  - - [704, 128, 1, 256]
    - [93, 12.816]
  - - [448, 256, 1, 1280]
    - [76, 18.928]
  - - [1856, 128, 1, 1280]
    - [72, 29.567]
  - - [64, 3584, 1, 256]
    - [81, 22.333]
  - - [64, 1856, 1, 256]
    - [79, 13.993]
  - - [256, 1024, 1, 1280]
    - [92, 33.35]
  - - [3584, 64, 1, 1280]
    - [72, 28.455]
  - - [1408, 128, 1, 3328]
    - [76, 25.984]
  - - [64, 2944, 1, 3328]
    - [86, 27.066]
  - - [64, 4288, 1, 3328]
    - [81, 35.682]
  - - [128, 1500, 1, 1280]
    - [95, 28.057]
  - - [64, 2944, 1, 256]
    - [80, 20.476]
  - - [64, 1408, 1, 1280]
    - [93, 17.648]
  - - [64, 2944, 1, 1280]
    - [80, 27.744]
  - - [704, 256, 1, 256]
    - [80, 20.3]
  - - [256, 448, 1, 1280]
    - [76, 18.909]
  - - [704, 256, 1, 1280]
    - [80, 25.969]
  - - [64, 2368, 1, 3328]
    - [86, 21.904]
  - - [256, 704, 1, 3328]
    - [72, 26.03]
  - - [4096, 64, 1, 4096]
    - [80, 32.781]
  - - [1760, 128, 1, 1760]
    - [81, 28.504]
  - - [2944, 64, 1, 1280]
    - [94, 25.685]
  - - [128, 1408, 1, 3328]
    - [76, 25.974]
  - - [1408, 64, 1, 256]
    - [93, 12.816]
  - - [64, 2368, 1, 256]
    - [80, 16.645]
  - - [1024, 128, 1, 3328]
    - [76, 23.249]
  - - [2368, 64, 1, 1280]
    - [76, 20.807]
  - - [4288, 64, 1, 256]
    - [80, 25.981]
  - - [64, 4288, 1, 1280]
    - [81, 34.045]
  - - [1408, 64, 1, 3328]
    - [93, 18.772]
  - - [2944, 64, 1, 256]
    - [80, 20.052]
  - - [448, 448, 1, 1280]
    - [80, 29.668]
  - - [1024, 256, 1, 1280]
    - [73, 32.545]
  - - [3584, 64, 1, 3328]
    - [83, 29.755]
  - - [256, 1024, 1, 3328]
    - [92, 34.91]
  - - [1856, 64, 1, 3328]
    - [76, 21.07]
  - - [1856, 64, 1, 1280]
    - [76, 19.584]
  - - [4608, 32, 1, 1536]
    - [76, 24.445]
  - - [1024, 128, 1, 256]
    - [71, 14.658]
  - - [64, 3584, 1, 1280]
    - [96, 28.547]
  - - [3584, 64, 1, 256]
    - [83, 22.333]
  - - [64, 1856, 1, 3328]
    - [76, 20.894]
  - - [1408, 128, 1, 256]
    - [80, 19.382]
  - - [128, 704, 1, 256]
    - [93, 12.816]
  - - [128, 704, 1, 3328]
    - [93, 18.781]
  - - [128, 1856, 1, 256]
    - [84, 23.204]
  - - [64, 4288, 1, 256]
    - [81, 25.902]
  - - [2560, 32, 1, 2560]
    - [75, 16.913]
  - - [704, 256, 1, 3328]
    - [76, 25.993]
  - - [176, 1500, 1, 1408]
    - [90, 32.88]
  - - [1856, 128, 1, 256]
    - [72, 23.204]
  - - [4288, 64, 1, 3328]
    - [72, 34.464]
  - - [2048, 64, 1, 2048]
    - [76, 22.49]
  - - [64, 1408, 1, 256]
    - [93, 12.816]
  - - [2944, 64, 1, 3328]
    - [86, 27.136]
  - - [128, 1408, 1, 1280]
    - [89, 26.565]
  - - [128, 1856, 1, 3328]
    - [84, 31.243]
  - - [1760, 64, 1, 1760]
    - [76, 18.938]
  - - [1760, 32, 1, 1760]
    - [100, 13.428]
  - - [2560, 16, 1, 2560]
    - [101, 10.945]
  - - [1760, 16, 1, 1760]
    - [98, 7.369]
  - - [8448, 4, 1, 2816]
    - [101, 8.379]
  - - [7680, 16, 1, 2560]
    - [99, 23.527]
  - - [4608, 1, 1, 1536]
    - [101, 1.172]
  - - [7680, 4, 1, 2560]
    - [99, 7.345]
  - - [8448, 16, 1, 2816]
    - [102, 26.148]
  - - [3072, 2, 1, 1024]
    - [101, 1.456]
  - - [6144, 16, 1, 2560]
    - [99, 21.672]
  - - [7680, 1, 1, 2560]
    - [99, 1.849]
  - - [4608, 4, 1, 1536]
    - [101, 4.675]
  - - [3072, 1, 1, 128]
    - [85, 0.316]
  - - [2048, 32, 1, 2048]
    - [98, 15.989]
  - - [2048, 16, 1, 2048]
    - [98, 8.852]
  - - [8448, 1, 1, 2816]
    - [101, 2.098]
  - - [6144, 4, 1, 2560]
    - [101, 6.494]
  - - [3072, 1, 1, 1024]
    - [101, 0.728]
  - - [3072, 16, 1, 1024]
    - [126, 4.657]
  - - [4096, 16, 1, 4096]
    - [101, 16.768]
  - - [6144, 1, 1, 2560]
    - [101, 1.625]
  - - [3072, 4, 1, 1024]
    - [101, 2.906]
  - - [7680, 2, 1, 2560]
    - [99, 3.684]
  - - [4224, 1, 1, 128]
    - [85, 0.429]
  - - [8448, 2, 1, 2816]
    - [100, 4.193]
  - - [4608, 2, 1, 1536]
    - [101, 2.344]
  - - [4608, 16, 1, 1536]
    - [98, 17.26]
  - - [6144, 2, 1, 2560]
    - [101, 3.241]
  - - [1024, 1, 1, 500000]
    - [78, 0.316]
  - - [1024, 16, 1, 500000]
    - [78, 5.064]
  - - [1024, 2, 1, 500000]
    - [78, 0.634]
  - - [512, 1, 1, 500000]
    - [77, 0.162]
  - - [1024, 8, 1, 500000]
    - [87, 2.534]
  - - [1024, 4, 1, 500000]
    - [78, 1.266]
  - - [512, 16, 1, 500000]
    - [78, 2.544]
  - - [512, 2, 1, 500000]
    - [77, 0.321]
  - - [512, 8, 1, 500000]
    - [78, 1.273]
  - - [512, 4, 1, 500000]
    - [77, 0.639]
  - - [512, 4, 1, 512]
    - [93, 0.422]
  - - [448, 64, 1, 1280]
    - [75, 7.337]
  - - [64, 1024, 1, 1280]
    - [93, 14.962]
  - - [64, 704, 1, 1280]
    - [93, 11.142]
  - - [256, 128, 1, 256]
    - [93, 5.437]
  - - [64, 1024, 1, 3328]
    - [93, 16.163]
  - - [128, 1, 1, 1408]
    - [82, 0.034]
  - - [1024, 64, 1, 1280]
    - [93, 15.027]
  - - [256, 256, 1, 3328]
    - [93, 16.172]
  - - [64, 448, 1, 1280]
    - [75, 7.35]
  - - [512, 32, 1, 512]
    - [93, 3.499]
  - - [64, 64, 1, 3328]
    - [77, 1.186]
  - - [512, 1, 1, 512]
    - [93, 0.106]
  - - [512, 2, 1, 512]
    - [74, 0.21]
  - - [704, 64, 1, 3328]
    - [85, 12.076]
  - - [64, 128, 1, 256]
    - [93, 1.382]
  - - [704, 64, 1, 1280]
    - [93, 11.142]
  - - [128, 448, 1, 256]
    - [93, 9.03]
  - - [448, 64, 1, 3328]
    - [75, 8.027]
  - - [64, 128, 1, 3328]
    - [77, 2.37]
  - - [128, 128, 1, 3328]
    - [78, 4.709]
  - - [64, 1, 1, 1216]
    - [75, 0.017]
  - - [256, 256, 1, 256]
    - [93, 10.426]
  - - [128, 64, 1, 1280]
    - [82, 2.129]
  - - [64, 1024, 1, 256]
    - [93, 10.163]
  - - [64, 704, 1, 256]
    - [93, 7.357]
  - - [1024, 2, 1, 512]
    - [75, 0.424]
  - - [256, 64, 1, 3328]
    - [78, 4.719]
  - - [448, 128, 1, 256]
    - [93, 9.03]
  - - [64, 704, 1, 3328]
    - [93, 12.092]
  - - [64, 448, 1, 3328]
    - [75, 8.001]
  - - [448, 128, 1, 3328]
    - [93, 14.195]
  - - [128, 256, 1, 1280]
    - [75, 8.386]
  - - [64, 448, 1, 256]
    - [93, 4.757]
  - - [64, 256, 1, 1280]
    - [97, 4.241]
  - - [64, 128, 1, 1280]
    - [82, 2.124]
  - - [1024, 32, 1, 512]
    - [93, 7.0]
  - - [64, 64, 1, 256]
    - [93, 0.69]
  - - [256, 128, 1, 1280]
    - [93, 8.5]
  - - [128, 256, 1, 3328]
    - [75, 9.144]
  - - [256, 64, 1, 256]
    - [93, 2.749]
  - - [128, 128, 1, 1280]
    - [97, 4.249]
  - - [128, 256, 1, 256]
    - [93, 5.437]
  - - [256, 64, 1, 1280]
    - [93, 4.292]
  - - [704, 64, 1, 256]
    - [93, 7.357]
  - - [128, 448, 1, 1280]
    - [93, 13.187]
  - - [64, 64, 1, 1280]
    - [93, 1.071]
  - - [128, 64, 1, 3328]
    - [77, 2.373]
  - - [448, 64, 1, 256]
    - [93, 4.757]
  - - [1024, 16, 1, 512]
    - [75, 3.499]
  - - [512, 16, 1, 512]
    - [93, 1.755]
  - - [1024, 64, 1, 256]
    - [93, 10.373]
  - - [128, 1, 1, 1024]
    - [75, 0.031]
  - - [448, 128, 1, 1280]
    - [93, 13.267]
  - - [1024, 64, 1, 3328]
    - [93, 16.182]
  - - [128, 64, 1, 256]
    - [93, 1.389]
  - - [64, 256, 1, 3328]
    - [78, 4.712]
  - - [256, 256, 1, 1280]
    - [93, 15.027]
  - - [256, 128, 1, 3328]
    - [93, 9.187]
  - - [64, 256, 1, 256]
    - [93, 2.734]
  - - [1024, 4, 1, 512]
    - [93, 0.844]
  - - [128, 448, 1, 3328]
    - [93, 14.202]
  - - [1024, 1, 1, 512]
    - [93, 0.212]
  - - [128, 128, 1, 256]
    - [93, 2.734]
  - - [768, 1, 1, 1]
    - [103, 0.0]
  - - [768, 2, 1, 1]
    - [104, 0.001]
  - - [768, 4, 1, 1]
    - [105, 0.001]
  - - [768, 8, 1, 1]
    - [104, 0.002]
  - - [768, 16, 1, 1]
    - [106, 0.004]
  - - [768, 32, 1, 1]
    - [104, 0.009]
  - - [768, 64, 1, 1]
    - [107, 0.021]
  - - [768, 128, 1, 1]
    - [106, 0.042]
  - - [768, 256, 1, 1]
    - [108, 0.082]
  - - [768, 384, 1, 1]
    - [106, 0.125]
  - - [768, 512, 1, 1]
    - [106, 0.163]
  - - [768, 768, 1, 1]
    - [106, 0.229]
  - - [768, 1024, 1, 1]
    - [106, 0.291]
  - - [768, 1536, 1, 1]
    - [106, 0.41]
  - - [768, 2048, 1, 1]
    - [106, 0.521]
  - - [768, 3072, 1, 1]
    - [109, 0.663]
  - - [768, 4096, 1, 1]
    - [106, 0.776]
  - - [768, 6144, 1, 1]
    - [110, 1.023]
  - - [768, 8192, 1, 1]
    - [111, 1.21]
  - - [768, 12288, 1, 1]
    - [108, 1.455]
  - - [768, 16384, 1, 1]
    - [112, 1.574]
  - - [768, 16, 1, 768]
    - [103, 0.805]
  - - [768, 32, 1, 768]
    - [113, 2.067]
  - - [768, 64, 1, 768]
    - [114, 3.78]
  - - [768, 128, 1, 768]
    - [109, 8.389]
  - - [768, 256, 1, 768]
    - [113, 17.589]
  - - [768, 384, 1, 768]
    - [108, 24.23]
  - - [768, 512, 1, 768]
    - [106, 31.938]
  - - [768, 768, 1, 768]
    - [113, 47.04]
  - - [768, 1024, 1, 768]
    - [106, 52.274]
  - - [768, 1536, 1, 768]
    - [115, 64.594]
  - - [768, 2048, 1, 768]
    - [105, 65.869]
  - - [768, 3072, 1, 768]
    - [105, 79.035]
  - - [768, 4096, 1, 768]
    - [116, 78.85]
  - - [768, 6144, 1, 768]
    - [117, 91.653]
  - - [768, 16, 1, 3072]
    - [113, 1.651]
  - - [768, 32, 1, 3072]
    - [116, 3.31]
  - - [768, 64, 1, 3072]
    - [113, 6.816]
  - - [768, 128, 1, 3072]
    - [113, 13.555]
  - - [768, 256, 1, 3072]
    - [113, 26.9]
  - - [768, 384, 1, 3072]
    - [118, 33.362]
  - - [768, 512, 1, 3072]
    - [115, 44.199]
  - - [768, 768, 1, 3072]
    - [119, 64.804]
  - - [768, 1024, 1, 3072]
    - [111, 65.795]
  - - [768, 1536, 1, 3072]
    - [120, 81.059]
  - - [768, 2048, 1, 3072]
    - [120, 76.752]
  - - [768, 3072, 1, 3072]
    - [121, 90.429]
  - - [768, 4096, 1, 3072]
    - [122, 85.474]
  - - [768, 6144, 1, 3072]
    - [121, 98.759]
  - - [1024, 1, 1, 1]
    - [108, 0.0]
  - - [1024, 2, 1, 1]
    - [105, 0.001]
  - - [1024, 4, 1, 1]
    - [105, 0.001]
  - - [1024, 8, 1, 1]
    - [106, 0.003]
  - - [1024, 16, 1, 1]
    - [108, 0.006]
  - - [1024, 32, 1, 1]
    - [105, 0.012]
  - - [1024, 64, 1, 1]
    - [104, 0.028]
  - - [1024, 128, 1, 1]
    - [108, 0.055]
  - - [1024, 16, 1, 1024]
    - [111, 1.555]
  - - [1024, 32, 1, 1024]
    - [113, 3.138]
  - - [1024, 64, 1, 1024]
    - [113, 6.654]
  - - [1024, 128, 1, 1024]
    - [113, 13.188]
  - - [1024, 256, 1, 1024]
    - [113, 26.037]
  - - [1024, 384, 1, 1024]
    - [113, 34.799]
  - - [1024, 512, 1, 1024]
    - [116, 45.777]
  - - [1024, 768, 1, 1024]
    - [109, 54.606]
  - - [1024, 1536, 1, 1024]
    - [120, 68.713]
  - - [1024, 2048, 1, 1024]
    - [123, 72.483]
  - - [1024, 3072, 1, 1024]
    - [107, 79.664]
  - - [1024, 4096, 1, 1024]
    - [124, 83.13]
  - - [1024, 6144, 1, 1024]
    - [125, 92.622]
  - - [1024, 16, 1, 4096]
    - [116, 2.316]
  - - [1024, 32, 1, 4096]
    - [113, 4.619]
  - - [1024, 64, 1, 4096]
    - [113, 9.46]
  - - [1024, 128, 1, 4096]
    - [113, 18.778]
  - - [1024, 256, 1, 4096]
    - [111, 37.103]
  - - [1024, 384, 1, 4096]
    - [123, 45.327]
  - - [1024, 512, 1, 4096]
    - [119, 59.684]
  - - [1024, 768, 1, 4096]
    - [111, 67.471]
  - - [1024, 1024, 1, 4096]
    - [123, 73.932]
  - - [1024, 1536, 1, 4096]
    - [120, 78.039]
  - - [1024, 2048, 1, 4096]
    - [122, 82.265]
  - - [1024, 3072, 1, 4096]
    - [122, 86.322]
  - - [1024, 4096, 1, 4096]
    - [124, 88.369]
  - - [2304, 16, 1, 1]
    - [114, 0.013]
  - - [2304, 32, 1, 1]
    - [114, 0.026]
  - - [2304, 64, 1, 1]
    - [106, 0.063]
  - - [2304, 128, 1, 1]
    - [104, 0.123]
  - - [2304, 256, 1, 1]
    - [113, 0.23]
  - - [2304, 384, 1, 1]
    - [104, 0.319]
  - - [2304, 512, 1, 1]
    - [126, 0.401]
  - - [2304, 768, 1, 1]
    - [109, 0.523]
  - - [2304, 1024, 1, 1]
    - [106, 0.671]
  - - [2304, 1536, 1, 1]
    - [115, 0.859]
  - - [2304, 2048, 1, 1]
    - [127, 1.025]
  - - [2304, 3072, 1, 1]
    - [106, 1.279]
  - - [2304, 4096, 1, 1]
    - [118, 1.422]
  - - [2304, 6144, 1, 1]
    - [128, 1.484]
  - - [2304, 8192, 1, 1]
    - [113, 1.667]
  - - [2304, 12288, 1, 1]
    - [115, 2.184]
  - - [2304, 16384, 1, 1]
    - [111, 2.327]
  - - [2304, 24576, 1, 1]
    - [129, 2.737]
  - - [2304, 32768, 1, 1]
    - [104, 2.367]
  - - [2304, 49152, 1, 1]
    - [130, 1.164]
  - - [2304, 65536, 1, 1]
    - [131, 1.175]
  - - [2304, 98304, 1, 1]
    - [132, 1.185]
  - - [2304, 131072, 1, 1]
    - [131, 1.19]
  - - [2304, 16, 1, 768]
    - [114, 2.764]
  - - [2304, 32, 1, 768]
    - [111, 6.095]
  - - [2304, 64, 1, 768]
    - [109, 11.284]
  - - [2304, 128, 1, 768]
    - [106, 24.166]
  - - [2304, 256, 1, 768]
    - [106, 46.44]
  - - [2304, 384, 1, 768]
    - [118, 49.559]
  - - [2304, 512, 1, 768]
    - [118, 64.365]
  - - [2304, 768, 1, 768]
    - [118, 73.669]
  - - [2304, 1024, 1, 768]
    - [118, 78.638]
  - - [2304, 1536, 1, 768]
    - [133, 86.849]
  - - [2304, 2048, 1, 768]
    - [117, 91.826]
  - - [2304, 3072, 1, 768]
    - [134, 95.729]
  - - [2304, 4096, 1, 768]
    - [134, 97.995]
  - - [2304, 6144, 1, 768]
    - [134, 100.601]
  - - [3072, 16, 1, 1]
    - [106, 0.017]
  - - [3072, 32, 1, 1]
    - [114, 0.034]
  - - [3072, 64, 1, 1]
    - [111, 0.081]
  - - [3072, 128, 1, 1]
    - [104, 0.159]
  - - [3072, 256, 1, 1]
    - [113, 0.286]
  - - [3072, 384, 1, 1]
    - [115, 0.422]
  - - [3072, 512, 1, 1]
    - [119, 0.517]
  - - [3072, 768, 1, 1]
    - [106, 0.66]
  - - [3072, 1024, 1, 1]
    - [115, 0.812]
  - - [3072, 1536, 1, 1]
    - [129, 0.988]
  - - [3072, 2048, 1, 1]
    - [108, 1.176]
  - - [3072, 3072, 1, 1]
    - [135, 1.408]
  - - [3072, 4096, 1, 1]
    - [108, 1.559]
  - - [3072, 6144, 1, 1]
    - [136, 1.899]
  - - [3072, 8192, 1, 1]
    - [137, 2.12]
  - - [3072, 12288, 1, 1]
    - [135, 2.33]
  - - [3072, 16384, 1, 1]
    - [126, 2.794]
  - - [3072, 24576, 1, 1]
    - [104, 1.929]
  - - [3072, 32768, 1, 1]
    - [138, 1.156]
  - - [3072, 49152, 1, 1]
    - [110, 1.173]
  - - [3072, 65536, 1, 1]
    - [110, 1.18]
  - - [3072, 16, 1, 768]
    - [109, 3.629]
  - - [3072, 32, 1, 768]
    - [116, 7.998]
  - - [3072, 64, 1, 768]
    - [114, 14.837]
  - - [3072, 128, 1, 768]
    - [113, 31.577]
  - - [3072, 256, 1, 768]
    - [107, 50.289]
  - - [3072, 384, 1, 768]
    - [110, 62.775]
  - - [3072, 512, 1, 768]
    - [114, 63.375]
  - - [3072, 768, 1, 768]
    - [119, 76.813]
  - - [3072, 1024, 1, 768]
    - [116, 78.553]
  - - [3072, 1536, 1, 768]
    - [133, 91.365]
  - - [3072, 2048, 1, 768]
    - [130, 91.87]
  - - [3072, 3072, 1, 768]
    - [134, 97.819]
  - - [3072, 4096, 1, 768]
    - [130, 97.115]
  - - [3072, 6144, 1, 768]
    - [133, 101.861]
  - - [3072, 256, 1, 1024]
    - [103, 55.197]
  - - [3072, 384, 1, 1024]
    - [123, 68.696]
  - - [3072, 512, 1, 1024]
    - [123, 68.859]
  - - [3072, 768, 1, 1024]
    - [123, 80.64]
  - - [3072, 1024, 1, 1024]
    - [126, 80.456]
  - - [3072, 1536, 1, 1024]
    - [124, 93.207]
  - - [3072, 2048, 1, 1024]
    - [125, 93.222]
  - - [3072, 3072, 1, 1024]
    - [125, 98.837]
  - - [3072, 4096, 1, 1024]
    - [125, 97.849]
  - - [4096, 16, 1, 1024]
    - [113, 6.2]
  - - [4096, 32, 1, 1024]
    - [126, 12.213]
  - - [4096, 64, 1, 1024]
    - [126, 26.016]
  - - [4096, 128, 1, 1024]
    - [113, 45.711]
  - - [4096, 256, 1, 1024]
    - [123, 61.762]
  - - [4096, 384, 1, 1024]
    - [123, 68.519]
  - - [4096, 512, 1, 1024]
    - [121, 72.768]
  - - [4096, 768, 1, 1024]
    - [126, 80.323]
  - - [4096, 1024, 1, 1024]
    - [122, 82.587]
  - - [4096, 1536, 1, 1024]
    - [139, 91.986]
  - - [4096, 2048, 1, 1024]
    - [125, 92.741]
  - - [4096, 3072, 1, 1024]
    - [125, 97.622]
- null
