library/src/blas3/Tensile/Logic/asm_full/navi21_Cijk_Alik_Bljk_I8II_BH.yaml
---
- {MinimumRequiredVersion: 4.27.0}
- navi21
- gfx1030
    SolutionIndex: 0
    SolutionNameMin: Cijk_Alik_Bljk_I8II_BH_MT64x64x8_SN_EPS1_GRVW4_LRVW4_SU0_SUM0_SUS128_TT8_4_VW4_WG8_16_1_WGM1
    SolutionIndex: 1
    SolutionNameMin: Cijk_Alik_Bljk_I8II_BH_MT32x32x8_SN_EPS1_GRVW4_LRVW4_SU0_SUM0_SUS128_TT4_4_VW4_WG8_8_1_WGM1
    SolutionIndex: 2
    SolutionNameMin: Cijk_Alik_Bljk_I8II_BH_MT64x64x8_SN_EPS1_GRVW4_LRVW4_SU0_SUM0_SUS128_TT8_8_VW4_WG8_8_1_WGM1
    SolutionIndex: 3
    SolutionNameMin: Cijk_Alik_Bljk_I8II_BH_MT64x64x8_SN_EPS1_GRVW4_LRVW4_SU0_SUM0_SUS256_TT8_8_VW4_WG8_8_1_WGM1
    SolutionIndex: 4
    SolutionNameMin: Cijk_Alik_Bljk_I8II_BH_MT32x32x8_SN_EPS1_GRVW4_LRVW4_SU32_SUM0_SUS128_TT4_4_VW4_WG8_8_1_WGM1
    SolutionIndex: 5
    SolutionNameMin: Cijk_Alik_Bljk_I8II_BH_MT32x32x16_SN_EPS1_GRVW4_LRVW4_SU32_SUM3_SUS128_TT4_4_VW4_WG8_8_1_WGM1
    SolutionIndex: 6
    SolutionNameMin: Cijk_Alik_Bljk_I8II_BH_MT64x64x8_SN_EPS1_GRVW4_LRVW4_SU32_SUM0_SUS256_TT8_4_VW4_WG8_16_1_WGM1
    SolutionIndex: 7
    SolutionNameMin: Cijk_Alik_Bljk_I8II_BH_MT32x32x16_SN_EPS1_GRVW4_LRVW4_SU32_SUM0_SUS256_TT4_4_VW4_WG8_8_1_WGM1
    SolutionIndex: 8
    SolutionNameMin: Cijk_Alik_Bljk_I8II_BH_MT64x64x8_SN_EPS1_GRVW4_LRVW4_SU32_SUM3_SUS256_TT8_4_VW4_WG8_16_1_WGM1
    SolutionIndex: 9
    SolutionNameMin: Cijk_Alik_Bljk_I8II_BH_MT128x128x8_SN_EPS1_GRVW4_LRVW4_SU32_SUM3_SUS256_TT16_8_VW4_WG8_16_1_WGM1
    SolutionIndex: 10
    SolutionNameMin: Cijk_Alik_Bljk_I8II_BH_MT32x32x16_SN_EPS1_GRVW4_LRVW4_SU32_SUM3_SUS256_TT4_4_VW4_WG8_8_1_WGM1
    SolutionIndex: 11
    SolutionNameMin: Cijk_Alik_Bljk_I8II_BH_MT64x64x16_SN_EPS1_GRVW8_LRVW8_SU32_SUM3_SUS256_TT8_8_VW8_WG8_8_1_WGM1
    SolutionIndex: 12
    SolutionNameMin: Cijk_Alik_Bljk_I8II_BH_MT32x32x8_SN_EPS1_GRVW4_LRVW4_SU0_SUM0_SUS256_TT4_4_VW4_WG8_8_1_WGM8
    SolutionIndex: 13
    SolutionNameMin: Cijk_Alik_Bljk_I8II_BH_MT32x32x16_SN_EPS1_GRVW4_LRVW4_SU0_SUM0_SUS256_TT4_4_VW4_WG8_8_1_WGM8
    SolutionIndex: 14
    SolutionNameMin: Cijk_Alik_Bljk_I8II_BH_MT32x32x8_SN_EPS1_GRVW4_LRVW4_SU32_SUM0_SUS128_TT4_4_VW4_WG8_8_1_WGM8
    SolutionIndex: 15
    SolutionNameMin: Cijk_Alik_Bljk_I8II_BH_MT64x64x8_SN_EPS1_GRVW4_LRVW4_SU32_SUM3_SUS128_TT8_4_VW4_WG8_16_1_WGM8
    SolutionIndex: 16
    SolutionNameMin: Cijk_Alik_Bljk_I8II_BH_MT32x32x8_SN_EPS1_GRVW4_LRVW4_SU32_SUM3_SUS128_TT4_4_VW4_WG8_8_1_WGM8
    SolutionIndex: 17
    SolutionNameMin: Cijk_Alik_Bljk_I8II_BH_MT32x32x8_SN_EPS0_GRVW4_LRVW4_SU0_SUM0_SUS128_TT4_4_VW4_WG8_8_1_WGM1
    SolutionIndex: 18
    SolutionNameMin: Cijk_Alik_Bljk_I8II_BH_MT64x32x8_SN_EPS0_GRVW4_LRVW4_SU0_SUM0_SUS128_TT8_4_VW4_WG8_8_1_WGM1
    SolutionIndex: 19
    SolutionNameMin: Cijk_Alik_Bljk_I8II_BH_MT64x64x8_SN_EPS0_GRVW4_LRVW4_SU0_SUM0_SUS128_TT8_8_VW4_WG8_8_1_WGM1
    SolutionIndex: 20
    SolutionNameMin: Cijk_Alik_Bljk_I8II_BH_MT32x32x16_SN_EPS0_GRVW4_LRVW4_SU0_SUM0_SUS128_TT4_4_VW4_WG8_8_1_WGM1
    SolutionIndex: 21
    SolutionNameMin: Cijk_Alik_Bljk_I8II_BH_MT32x32x32_SN_EPS0_GRVW4_LRVW4_SU0_SUM0_SUS128_TT4_4_VW4_WG8_8_1_WGM1
    SolutionIndex: 22
    SolutionNameMin: Cijk_Alik_Bljk_I8II_BH_MT64x64x8_SN_EPS0_GRVW8_LRVW8_SU0_SUM0_SUS128_TT8_8_VW8_WG8_8_1_WGM1
    SolutionIndex: 23
    SolutionNameMin: Cijk_Alik_Bljk_I8II_BH_MT64x32x8_SN_EPS0_GRVW4_LRVW4_SU0_SUM0_SUS256_TT8_4_VW4_WG8_8_1_WGM1
    SolutionIndex: 24
    SolutionNameMin: Cijk_Alik_Bljk_I8II_BH_MT32x32x16_SN_EPS0_GRVW4_LRVW4_SU0_SUM0_SUS256_TT4_4_VW4_WG8_8_1_WGM1
    SolutionIndex: 25
    SolutionNameMin: Cijk_Alik_Bljk_I8II_BH_MT32x32x32_SN_EPS0_GRVW4_LRVW4_SU0_SUM0_SUS256_TT4_4_VW4_WG8_8_1_WGM1
    SolutionIndex: 26
    SolutionNameMin: Cijk_Alik_Bljk_I8II_BH_MT64x64x8_SN_EPS0_GRVW8_LRVW8_SU0_SUM0_SUS256_TT8_8_VW8_WG8_8_1_WGM1
    SolutionIndex: 27
    SolutionNameMin: Cijk_Alik_Bljk_I8II_BH_MT32x32x16_SN_EPS0_GRVW4_LRVW4_SU32_SUM0_SUS128_TT4_4_VW4_WG8_8_1_WGM1
    SolutionIndex: 28
    SolutionNameMin: Cijk_Alik_Bljk_I8II_BH_MT128x128x8_SN_EPS0_GRVW8_LRVW8_SU32_SUM0_SUS128_TT16_8_VW8_WG8_16_1_WGM1
    SolutionIndex: 29
    SolutionNameMin: Cijk_Alik_Bljk_I8II_BH_MT64x64x16_SN_EPS0_GRVW8_LRVW8_SU32_SUM0_SUS128_TT8_8_VW8_WG8_8_1_WGM1
    SolutionIndex: 30
    SolutionNameMin: Cijk_Alik_Bljk_I8II_BH_MT32x32x16_SN_EPS0_GRVW4_LRVW4_SU32_SUM3_SUS128_TT4_4_VW4_WG8_8_1_WGM1
    SolutionIndex: 31
    SolutionNameMin: Cijk_Alik_Bljk_I8II_BH_MT32x32x32_SN_EPS0_GRVW4_LRVW4_SU32_SUM3_SUS128_TT4_4_VW4_WG8_8_1_WGM1
    SolutionIndex: 32
    SolutionNameMin: Cijk_Alik_Bljk_I8II_BH_MT32x32x16_SN_EPS0_GRVW4_LRVW4_SU32_SUM0_SUS256_TT4_4_VW4_WG8_8_1_WGM1
    SolutionIndex: 33
    SolutionNameMin: Cijk_Alik_Bljk_I8II_BH_MT64x64x8_SN_EPS0_GRVW8_LRVW8_SU32_SUM0_SUS256_TT8_8_VW8_WG8_8_1_WGM1
    SolutionIndex: 34
    SolutionNameMin: Cijk_Alik_Bljk_I8II_BH_MT64x64x16_SN_EPS0_GRVW8_LRVW8_SU32_SUM0_SUS256_TT8_8_VW8_WG8_8_1_WGM1
    SolutionIndex: 35
    SolutionNameMin: Cijk_Alik_Bljk_I8II_BH_MT256x128x16_SN_EPS0_GRVW8_LRVW8_SU32_SUM0_SUS256_TT16_8_VW8_WG16_16_1_WGM1
    SolutionIndex: 36
    SolutionNameMin: Cijk_Alik_Bljk_I8II_BH_MT64x64x8_SN_EPS0_GRVW4_LRVW4_SU32_SUM3_SUS256_TT8_4_VW4_WG8_16_1_WGM1
    SolutionIndex: 37
    SolutionNameMin: Cijk_Alik_Bljk_I8II_BH_MT32x32x32_SN_EPS0_GRVW4_LRVW4_SU32_SUM3_SUS256_TT4_4_VW4_WG8_8_1_WGM1
    SolutionIndex: 38
    SolutionNameMin: Cijk_Alik_Bljk_I8II_BH_MT128x128x16_SN_EPS0_GRVW8_LRVW8_SU32_SUM3_SUS256_TT16_8_VW8_WG8_16_1_WGM1
    SolutionIndex: 39
    SolutionNameMin: Cijk_Alik_Bljk_I8II_BH_MT64x64x16_SN_EPS0_GRVW8_LRVW8_SU32_SUM3_SUS256_TT8_8_VW8_WG8_8_1_WGM1
    SolutionIndex: 40
    SolutionNameMin: Cijk_Alik_Bljk_I8II_BH_MT32x32x8_SN_EPS0_GRVW4_LRVW4_SU0_SUM0_SUS128_TT4_4_VW4_WG8_8_1_WGM4
    SolutionIndex: 41
    SolutionNameMin: Cijk_Alik_Bljk_I8II_BH_MT32x32x16_SN_EPS0_GRVW4_LRVW4_SU0_SUM0_SUS128_TT4_4_VW4_WG8_8_1_WGM4
    SolutionIndex: 42
    SolutionNameMin: Cijk_Alik_Bljk_I8II_BH_MT32x32x32_SN_EPS0_GRVW4_LRVW4_SU0_SUM0_SUS128_TT4_4_VW4_WG8_8_1_WGM4
    SolutionIndex: 43
    SolutionNameMin: Cijk_Alik_Bljk_I8II_BH_MT32x32x8_SN_EPS0_GRVW4_LRVW4_SU0_SUM0_SUS256_TT4_4_VW4_WG8_8_1_WGM4
    SolutionIndex: 44
    SolutionNameMin: Cijk_Alik_Bljk_I8II_BH_MT32x32x16_SN_EPS0_GRVW4_LRVW4_SU0_SUM0_SUS256_TT4_4_VW4_WG8_8_1_WGM4
    SolutionIndex: 45
    SolutionNameMin: Cijk_Alik_Bljk_I8II_BH_MT32x32x32_SN_EPS0_GRVW4_LRVW4_SU0_SUM0_SUS256_TT4_4_VW4_WG8_8_1_WGM4
    SolutionIndex: 46
    SolutionNameMin: Cijk_Alik_Bljk_I8II_BH_MT64x64x8_SN_EPS0_GRVW4_LRVW4_SU32_SUM0_SUS128_TT8_4_VW4_WG8_16_1_WGM4
    SolutionIndex: 47
    SolutionNameMin: Cijk_Alik_Bljk_I8II_BH_MT64x64x8_SN_EPS0_GRVW4_LRVW4_SU32_SUM3_SUS128_TT8_4_VW4_WG8_16_1_WGM4
    SolutionIndex: 48
    SolutionNameMin: Cijk_Alik_Bljk_I8II_BH_MT64x64x16_SN_EPS0_GRVW8_LRVW8_SU32_SUM3_SUS128_TT8_8_VW8_WG8_8_1_WGM4
    SolutionIndex: 49
    SolutionNameMin: Cijk_Alik_Bljk_I8II_BH_MT32x32x8_SN_EPS0_GRVW4_LRVW4_SU0_SUM0_SUS128_TT4_4_VW4_WG8_8_1_WGM8
    SolutionIndex: 50
    SolutionNameMin: Cijk_Alik_Bljk_I8II_BH_MT32x32x16_SN_EPS0_GRVW4_LRVW4_SU0_SUM0_SUS128_TT4_4_VW4_WG8_8_1_WGM8
    SolutionIndex: 51
    SolutionNameMin: Cijk_Alik_Bljk_I8II_BH_MT32x32x32_SN_EPS0_GRVW4_LRVW4_SU0_SUM0_SUS128_TT4_4_VW4_WG8_8_1_WGM8
    SolutionIndex: 52
    SolutionNameMin: Cijk_Alik_Bljk_I8II_BH_MT64x64x8_SN_EPS0_GRVW4_LRVW4_SU0_SUM0_SUS256_TT8_4_VW4_WG8_16_1_WGM8
    SolutionIndex: 53
    SolutionNameMin: Cijk_Alik_Bljk_I8II_BH_MT32x32x8_SN_EPS0_GRVW4_LRVW4_SU0_SUM0_SUS256_TT4_4_VW4_WG8_8_1_WGM8
    SolutionIndex: 54
    SolutionNameMin: Cijk_Alik_Bljk_I8II_BH_MT32x32x16_SN_EPS0_GRVW4_LRVW4_SU0_SUM0_SUS256_TT4_4_VW4_WG8_8_1_WGM8
    SolutionIndex: 55
    SolutionNameMin: Cijk_Alik_Bljk_I8II_BH_MT32x32x32_SN_EPS0_GRVW4_LRVW4_SU0_SUM0_SUS256_TT4_4_VW4_WG8_8_1_WGM8
    SolutionIndex: 56
    SolutionNameMin: Cijk_Alik_Bljk_I8II_BH_MT64x64x8_SN_EPS0_GRVW4_LRVW4_SU32_SUM0_SUS128_TT8_4_VW4_WG8_16_1_WGM8
    SolutionIndex: 57
    SolutionNameMin: Cijk_Alik_Bljk_I8II_BH_MT32x32x16_SN_EPS0_GRVW4_LRVW4_SU32_SUM0_SUS128_TT4_4_VW4_WG8_8_1_WGM8
    SolutionIndex: 58
    SolutionNameMin: Cijk_Alik_Bljk_I8II_BH_MT32x32x8_SN_EPS0_GRVW4_LRVW4_SU32_SUM3_SUS128_TT4_4_VW4_WG8_8_1_WGM8
    SolutionIndex: 59
    SolutionNameMin: Cijk_Alik_Bljk_I8II_BH_MT32x32x32_SN_EPS0_GRVW4_LRVW4_SU32_SUM3_SUS128_TT4_4_VW4_WG8_8_1_WGM8
    SolutionIndex: 60
    SolutionNameMin: Cijk_Alik_Bljk_I8II_BH_MT128x256x16_SN_EPS0_GRVW8_LRVW8_SU32_SUM3_SUS256_TT8_16_VW8_WG16_16_1_WGM8
- - - [768, 1024, 1, 1024, 768, 768, 1024, 1024]
    - [60, 18860.0]
  - - [1536, 2048, 1, 2048, 1536, 1536, 2048, 2048]
    - [35, 24515.0]
  - - [32, 32, 1, 32, 32, 32, 32, 32]
    - [17, 21.0]
  - - [32, 32, 1, 64, 32, 32, 64, 64]
    - [49, 37.0]
  - - [32, 32, 1, 128, 32, 32, 128, 128]
    - [54, 57.0]
  - - [32, 32, 1, 256, 32, 32, 256, 256]
    - [20, 80.0]
  - - [32, 32, 1, 512, 32, 32, 512, 512]
    - [21, 96.0]
  - - [32, 32, 1, 1024, 32, 32, 1024, 1024]
    - [51, 115.0]
  - - [32, 64, 1, 32, 32, 32, 32, 32]
    - [43, 44.0]
  - - [32, 64, 1, 64, 32, 32, 64, 64]
    - [49, 73.0]
  - - [32, 64, 1, 128, 32, 32, 128, 128]
    - [20, 113.0]
  - - [32, 64, 1, 256, 32, 32, 256, 256]
    - [54, 161.0]
  - - [32, 64, 1, 512, 32, 32, 512, 512]
    - [55, 196.0]
  - - [32, 64, 1, 1024, 32, 32, 1024, 1024]
    - [42, 234.0]
  - - [32, 128, 1, 32, 32, 32, 32, 32]
    - [43, 86.0]
  - - [32, 128, 1, 64, 32, 32, 64, 64]
    - [53, 147.0]
  - - [32, 128, 1, 128, 32, 32, 128, 128]
    - [44, 226.0]
  - - [32, 128, 1, 256, 32, 32, 256, 256]
    - [30, 320.0]
  - - [32, 128, 1, 512, 32, 32, 512, 512]
    - [37, 391.0]
  - - [32, 128, 1, 1024, 32, 32, 1024, 1024]
    - [37, 471.0]
  - - [32, 256, 1, 32, 32, 32, 32, 32]
    - [40, 172.0]
  - - [32, 256, 1, 64, 32, 32, 64, 64]
    - [43, 291.0]
  - - [32, 256, 1, 128, 32, 32, 128, 128]
    - [54, 456.0]
  - - [32, 256, 1, 256, 32, 32, 256, 256]
    - [20, 639.0]
  - - [32, 256, 1, 512, 32, 32, 512, 512]
    - [42, 788.0]
  - - [32, 256, 1, 1024, 32, 32, 1024, 1024]
    - [45, 938.0]
  - - [32, 512, 1, 32, 32, 32, 32, 32]
    - [43, 350.0]
  - - [32, 512, 1, 64, 32, 32, 64, 64]
    - [43, 583.0]
  - - [32, 512, 1, 128, 32, 32, 128, 128]
    - [44, 904.0]
  - - [32, 512, 1, 256, 32, 32, 256, 256]
    - [20, 1279.0]
  - - [32, 512, 1, 512, 32, 32, 512, 512]
    - [31, 1571.0]
  - - [32, 512, 1, 1024, 32, 32, 1024, 1024]
    - [51, 1868.0]
  - - [32, 1024, 1, 32, 32, 32, 32, 32]
    - [43, 699.0]
  - - [32, 1024, 1, 64, 32, 32, 64, 64]
    - [43, 1178.0]
  - - [32, 1024, 1, 128, 32, 32, 128, 128]
    - [20, 1808.0]
  - - [32, 1024, 1, 256, 32, 32, 256, 256]
    - [24, 2467.0]
  - - [32, 1024, 1, 512, 32, 32, 512, 512]
    - [30, 2824.0]
  - - [32, 1024, 1, 1024, 32, 32, 1024, 1024]
    - [10, 3160.0]
  - - [64, 32, 1, 32, 64, 64, 32, 32]
    - [43, 43.0]
  - - [64, 32, 1, 64, 64, 64, 64, 64]
    - [43, 72.0]
  - - [64, 32, 1, 128, 64, 64, 128, 128]
    - [54, 114.0]
  - - [64, 32, 1, 256, 64, 64, 256, 256]
    - [54, 161.0]
  - - [64, 32, 1, 512, 64, 64, 512, 512]
    - [42, 195.0]
  - - [64, 32, 1, 1024, 64, 64, 1024, 1024]
    - [42, 231.0]
  - - [64, 64, 1, 32, 64, 64, 32, 32]
    - [43, 85.0]
  - - [64, 64, 1, 64, 64, 64, 64, 64]
    - [53, 144.0]
  - - [64, 64, 1, 128, 64, 64, 128, 128]
    - [50, 224.0]
  - - [64, 64, 1, 256, 64, 64, 256, 256]
    - [24, 318.0]
  - - [64, 64, 1, 512, 64, 64, 512, 512]
    - [31, 391.0]
  - - [64, 64, 1, 1024, 64, 64, 1024, 1024]
    - [55, 465.0]
  - - [64, 128, 1, 32, 64, 64, 32, 32]
    - [43, 170.0]
  - - [64, 128, 1, 64, 64, 64, 64, 64]
    - [43, 291.0]
  - - [64, 128, 1, 128, 64, 64, 128, 128]
    - [50, 448.0]
  - - [64, 128, 1, 256, 64, 64, 256, 256]
    - [44, 636.0]
  - - [64, 128, 1, 512, 64, 64, 512, 512]
    - [59, 780.0]
  - - [64, 128, 1, 1024, 64, 64, 1024, 1024]
    - [51, 934.0]
  - - [64, 256, 1, 32, 64, 64, 32, 32]
    - [43, 345.0]
  - - [64, 256, 1, 64, 64, 64, 64, 64]
    - [40, 576.0]
  - - [64, 256, 1, 128, 64, 64, 128, 128]
    - [50, 896.0]
  - - [64, 256, 1, 256, 64, 64, 256, 256]
    - [20, 1271.0]
  - - [64, 256, 1, 512, 64, 64, 512, 512]
    - [42, 1577.0]
  - - [64, 256, 1, 1024, 64, 64, 1024, 1024]
    - [42, 1877.0]
  - - [64, 512, 1, 32, 64, 64, 32, 32]
    - [53, 690.0]
  - - [64, 512, 1, 64, 64, 64, 64, 64]
    - [43, 1152.0]
  - - [64, 512, 1, 128, 64, 64, 128, 128]
    - [54, 1777.0]
  - - [64, 512, 1, 256, 64, 64, 256, 256]
    - [54, 2467.0]
  - - [64, 512, 1, 512, 64, 64, 512, 512]
    - [44, 2883.0]
  - - [64, 512, 1, 1024, 64, 64, 1024, 1024]
    - [13, 3239.0]
  - - [64, 1024, 1, 32, 64, 64, 32, 32]
    - [40, 1311.0]
  - - [64, 1024, 1, 64, 64, 64, 64, 64]
    - [43, 2231.0]
  - - [64, 1024, 1, 128, 64, 64, 128, 128]
    - [44, 3410.0]
  - - [64, 1024, 1, 256, 64, 64, 256, 256]
    - [20, 4534.0]
  - - [64, 1024, 1, 512, 64, 64, 512, 512]
    - [30, 5309.0]
  - - [64, 1024, 1, 1024, 64, 64, 1024, 1024]
    - [10, 5815.0]
  - - [128, 32, 1, 32, 128, 128, 32, 32]
    - [53, 86.0]
  - - [128, 32, 1, 64, 128, 128, 64, 64]
    - [43, 144.0]
  - - [128, 32, 1, 128, 128, 128, 128, 128]
    - [20, 224.0]
  - - [128, 32, 1, 256, 128, 128, 256, 256]
    - [54, 320.0]
  - - [128, 32, 1, 512, 128, 128, 512, 512]
    - [45, 388.0]
  - - [128, 32, 1, 1024, 128, 128, 1024, 1024]
    - [21, 457.0]
  - - [128, 64, 1, 32, 128, 128, 32, 32]
    - [43, 170.0]
  - - [128, 64, 1, 64, 128, 128, 64, 64]
    - [43, 288.0]
  - - [128, 64, 1, 128, 128, 128, 128, 128]
    - [54, 452.0]
  - - [128, 64, 1, 256, 128, 128, 256, 256]
    - [44, 636.0]
  - - [128, 64, 1, 512, 128, 128, 512, 512]
    - [45, 783.0]
  - - [128, 64, 1, 1024, 128, 128, 1024, 1024]
    - [51, 928.0]
  - - [128, 128, 1, 32, 128, 128, 32, 32]
    - [43, 340.0]
  - - [128, 128, 1, 64, 128, 128, 64, 64]
    - [49, 576.0]
  - - [128, 128, 1, 128, 128, 128, 128, 128]
    - [44, 904.0]
  - - [128, 128, 1, 256, 128, 128, 256, 256]
    - [54, 1279.0]
  - - [128, 128, 1, 512, 128, 128, 512, 512]
    - [42, 1565.0]
  - - [128, 128, 1, 1024, 128, 128, 1024, 1024]
    - [21, 1852.0]
  - - [128, 256, 1, 32, 128, 128, 32, 32]
    - [49, 672.0]
  - - [128, 256, 1, 64, 128, 128, 64, 64]
    - [53, 1152.0]
  - - [128, 256, 1, 128, 128, 128, 128, 128]
    - [54, 1792.0]
  - - [128, 256, 1, 256, 128, 128, 256, 256]
    - [50, 2482.0]
  - - [128, 256, 1, 512, 128, 128, 512, 512]
    - [50, 2913.0]
  - - [128, 256, 1, 1024, 128, 128, 1024, 1024]
    - [57, 3277.0]
  - - [128, 512, 1, 32, 128, 128, 32, 32]
    - [49, 1311.0]
  - - [128, 512, 1, 64, 128, 128, 64, 64]
    - [53, 2231.0]
  - - [128, 512, 1, 128, 128, 128, 128, 128]
    - [54, 3410.0]
  - - [128, 512, 1, 256, 128, 128, 256, 256]
    - [20, 4510.0]
  - - [128, 512, 1, 512, 128, 128, 512, 512]
    - [27, 5430.0]
  - - [128, 512, 1, 1024, 128, 128, 1024, 1024]
    - [32, 5981.0]
  - - [128, 1024, 1, 32, 128, 128, 32, 32]
    - [53, 2439.0]
  - - [128, 1024, 1, 64, 128, 128, 64, 64]
    - [53, 4153.0]
  - - [128, 1024, 1, 128, 128, 128, 128, 128]
    - [17, 6035.0]
  - - [128, 1024, 1, 256, 128, 128, 256, 256]
    - [4, 7661.0]
  - - [128, 1024, 1, 512, 128, 128, 512, 512]
    - [14, 7678.0]
  - - [128, 1024, 1, 1024, 128, 128, 1024, 1024]
    - [48, 7326.0]
  - - [256, 32, 1, 32, 256, 256, 32, 32]
    - [43, 170.0]
  - - [256, 32, 1, 64, 256, 256, 64, 64]
    - [43, 288.0]
  - - [256, 32, 1, 128, 256, 256, 128, 128]
    - [54, 452.0]
  - - [256, 32, 1, 256, 256, 256, 256, 256]
    - [54, 639.0]
  - - [256, 32, 1, 512, 256, 256, 512, 512]
    - [42, 780.0]
  - - [256, 32, 1, 1024, 256, 256, 1024, 1024]
    - [21, 914.0]
  - - [256, 64, 1, 32, 256, 256, 32, 32]
    - [40, 336.0]
  - - [256, 64, 1, 64, 256, 256, 64, 64]
    - [43, 570.0]
  - - [256, 64, 1, 128, 256, 256, 128, 128]
    - [54, 896.0]
  - - [256, 64, 1, 256, 256, 256, 256, 256]
    - [20, 1263.0]
  - - [256, 64, 1, 512, 256, 256, 512, 512]
    - [25, 1548.0]
  - - [256, 64, 1, 1024, 256, 256, 1024, 1024]
    - [25, 1824.0]
  - - [256, 128, 1, 32, 256, 256, 32, 32]
    - [53, 672.0]
  - - [256, 128, 1, 64, 256, 256, 64, 64]
    - [53, 1140.0]
  - - [256, 128, 1, 128, 256, 256, 128, 128]
    - [41, 1777.0]
  - - [256, 128, 1, 256, 256, 256, 256, 256]
    - [44, 2497.0]
  - - [256, 128, 1, 512, 256, 256, 512, 512]
    - [37, 3062.0]
  - - [256, 128, 1, 1024, 256, 256, 1024, 1024]
    - [37, 3631.0]
  - - [256, 256, 1, 32, 256, 256, 32, 32]
    - [49, 1311.0]
  - - [256, 256, 1, 64, 256, 256, 64, 64]
    - [53, 2231.0]
  - - [256, 256, 1, 128, 256, 256, 128, 128]
    - [54, 3410.0]
  - - [256, 256, 1, 256, 256, 256, 256, 256]
    - [20, 4486.0]
  - - [256, 256, 1, 512, 256, 256, 512, 512]
    - [30, 5483.0]
  - - [256, 256, 1, 1024, 256, 256, 1024, 1024]
    - [30, 6035.0]
  - - [256, 512, 1, 32, 256, 256, 32, 32]
    - [53, 2411.0]
  - - [256, 512, 1, 64, 256, 256, 64, 64]
    - [53, 4153.0]
  - - [256, 512, 1, 128, 256, 256, 128, 128]
    - [17, 5949.0]
  - - [256, 512, 1, 256, 256, 256, 256, 256]
    - [4, 7557.0]
  - - [256, 512, 1, 512, 256, 256, 512, 512]
    - [16, 7609.0]
  - - [256, 512, 1, 1024, 256, 256, 1024, 1024]
    - [58, 7407.0]
  - - [256, 1024, 1, 32, 256, 256, 32, 32]
    - [53, 3920.0]
  - - [256, 1024, 1, 64, 256, 256, 64, 64]
    - [18, 6123.0]
  - - [256, 1024, 1, 128, 256, 256, 128, 128]
    - [46, 8224.0]
  - - [256, 1024, 1, 256, 256, 256, 256, 256]
    - [56, 10388.0]
  - - [256, 1024, 1, 512, 256, 256, 512, 512]
    - [47, 12070.0]
  - - [256, 1024, 1, 1024, 256, 256, 1024, 1024]
    - [39, 12081.0]
  - - [512, 32, 1, 32, 512, 512, 32, 32]
    - [43, 340.0]
  - - [512, 32, 1, 64, 512, 512, 64, 64]
    - [43, 576.0]
  - - [512, 32, 1, 128, 512, 512, 128, 128]
    - [41, 896.0]
  - - [512, 32, 1, 256, 512, 512, 256, 256]
    - [20, 1271.0]
  - - [512, 32, 1, 512, 512, 512, 512, 512]
    - [45, 1548.0]
  - - [512, 32, 1, 1024, 512, 512, 1024, 1024]
    - [31, 1816.0]
  - - [512, 64, 1, 32, 512, 512, 32, 32]
    - [17, 664.0]
  - - [512, 64, 1, 64, 512, 512, 64, 64]
    - [17, 1128.0]
  - - [512, 64, 1, 128, 512, 512, 128, 128]
    - [20, 1777.0]
  - - [512, 64, 1, 256, 512, 512, 256, 256]
    - [24, 2512.0]
  - - [512, 64, 1, 512, 512, 512, 512, 512]
    - [54, 2853.0]
  - - [512, 64, 1, 1024, 512, 512, 1024, 1024]
    - [5, 3178.0]
  - - [512, 128, 1, 32, 512, 512, 32, 32]
    - [49, 1279.0]
  - - [512, 128, 1, 64, 512, 512, 64, 64]
    - [43, 2185.0]
  - - [512, 128, 1, 128, 512, 512, 128, 128]
    - [20, 3355.0]
  - - [512, 128, 1, 256, 512, 512, 256, 256]
    - [20, 4486.0]
  - - [512, 128, 1, 512, 512, 512, 512, 512]
    - [24, 5430.0]
  - - [512, 128, 1, 1024, 512, 512, 1024, 1024]
    - [32, 6057.0]
  - - [512, 256, 1, 32, 512, 512, 32, 32]
    - [49, 2439.0]
  - - [512, 256, 1, 64, 512, 512, 64, 64]
    - [49, 4112.0]
  - - [512, 256, 1, 128, 512, 512, 128, 128]
    - [49, 6079.0]
  - - [512, 256, 1, 256, 512, 512, 256, 256]
    - [4, 7626.0]
  - - [512, 256, 1, 512, 512, 512, 512, 512]
    - [14, 7626.0]
  - - [512, 256, 1, 1024, 512, 512, 1024, 1024]
    - [58, 7507.0]
  - - [512, 512, 1, 32, 512, 512, 32, 32]
    - [53, 3995.0]
  - - [512, 512, 1, 64, 512, 512, 64, 64]
    - [18, 6079.0]
  - - [512, 512, 1, 128, 512, 512, 128, 128]
    - [52, 8265.0]
  - - [512, 512, 1, 256, 512, 512, 256, 256]
    - [0, 10421.0]
  - - [512, 512, 1, 512, 512, 512, 512, 512]
    - [15, 11815.0]
  - - [512, 512, 1, 1024, 512, 512, 1024, 1024]
    - [39, 12168.0]
  - - [512, 1024, 1, 32, 512, 512, 32, 32]
    - [49, 6605.0]
  - - [512, 1024, 1, 64, 512, 512, 64, 64]
    - [3, 9020.0]
  - - [512, 1024, 1, 128, 512, 512, 128, 128]
    - [26, 12614.0]
  - - [512, 1024, 1, 256, 512, 512, 256, 256]
    - [22, 15427.0]
  - - [512, 1024, 1, 512, 512, 512, 512, 512]
    - [39, 15392.0]
  - - [512, 1024, 1, 1024, 512, 512, 1024, 1024]
    - [34, 15874.0]
  - - [1024, 32, 1, 32, 1024, 1024, 32, 32]
    - [43, 681.0]
  - - [1024, 32, 1, 64, 1024, 1024, 64, 64]
    - [43, 1152.0]
  - - [1024, 32, 1, 128, 1024, 1024, 128, 128]
    - [20, 1777.0]
  - - [1024, 32, 1, 256, 1024, 1024, 256, 256]
    - [20, 2453.0]
  - - [1024, 32, 1, 512, 1024, 1024, 512, 512]
    - [20, 2759.0]
  - - [1024, 32, 1, 1024, 1024, 1024, 1024, 1024]
    - [7, 3062.0]
  - - [1024, 64, 1, 32, 1024, 1024, 32, 32]
    - [17, 1295.0]
  - - [1024, 64, 1, 64, 1024, 1024, 64, 64]
    - [17, 2208.0]
  - - [1024, 64, 1, 128, 1024, 1024, 128, 128]
    - [20, 3410.0]
  - - [1024, 64, 1, 256, 1024, 1024, 256, 256]
    - [24, 4438.0]
  - - [1024, 64, 1, 512, 1024, 1024, 512, 512]
    - [27, 5292.0]
  - - [1024, 64, 1, 1024, 1024, 1024, 1024, 1024]
    - [32, 5907.0]
  - - [1024, 128, 1, 32, 1024, 1024, 32, 32]
    - [17, 2356.0]
  - - [1024, 128, 1, 64, 1024, 1024, 64, 64]
    - [40, 3995.0]
  - - [1024, 128, 1, 128, 1024, 1024, 128, 128]
    - [40, 5992.0]
  - - [1024, 128, 1, 256, 1024, 1024, 256, 256]
    - [1, 7391.0]
  - - [1024, 128, 1, 512, 1024, 1024, 512, 512]
    - [8, 7154.0]
  - - [1024, 128, 1, 1024, 1024, 1024, 1024, 1024]
    - [10, 7367.0]
  - - [1024, 256, 1, 32, 1024, 1024, 32, 32]
    - [1, 3884.0]
  - - [1024, 256, 1, 64, 1024, 1024, 64, 64]
    - [23, 6123.0]
  - - [1024, 256, 1, 128, 1024, 1024, 128, 128]
    - [19, 8224.0]
  - - [1024, 256, 1, 256, 1024, 1024, 256, 256]
    - [36, 10324.0]
  - - [1024, 256, 1, 512, 1024, 1024, 512, 512]
    - [6, 11753.0]
  - - [1024, 256, 1, 1024, 1024, 1024, 1024, 1024]
    - [34, 12280.0]
  - - [1024, 512, 1, 32, 1024, 1024, 32, 32]
    - [12, 6260.0]
  - - [1024, 512, 1, 64, 1024, 1024, 64, 64]
    - [3, 9069.0]
  - - [1024, 512, 1, 128, 1024, 1024, 128, 128]
    - [26, 12567.0]
  - - [1024, 512, 1, 256, 1024, 1024, 256, 256]
    - [22, 15463.0]
  - - [1024, 512, 1, 512, 1024, 1024, 512, 512]
    - [29, 15374.0]
  - - [1024, 512, 1, 1024, 1024, 1024, 1024, 1024]
    - [11, 14946.0]
  - - [1024, 1024, 1, 32, 1024, 1024, 32, 32]
    - [19, 8693.0]
  - - [1024, 1024, 1, 64, 1024, 1024, 64, 64]
    - [2, 11611.0]
  - - [1024, 1024, 1, 128, 1024, 1024, 128, 128]
    - [33, 15047.0]
  - - [1024, 1024, 1, 256, 1024, 1024, 256, 256]
    - [28, 18667.0]
  - - [1024, 1024, 1, 512, 1024, 1024, 512, 512]
    - [9, 16489.0]
  - - [1024, 1024, 1, 1024, 1024, 1024, 1024, 1024]
    - [38, 17482.0]
- null
- null
- DeviceEfficiency
...
