library/src/blas3/Tensile/Logic/asm_full/navi21_Cijk_Ailk_Bjlk_SB.yaml
- {MinimumRequiredVersion: 4.26.0}
- navi21
- gfx1030
- [Device 73a2]
    SolutionIndex: 0
    SolutionNameMin: Cijk_Ailk_Bjlk_SB_MT128x64x8_SN_SU0_SUM0_TT8_8_WG16_8_1_WGM1
    SolutionIndex: 1
    SolutionNameMin: Cijk_Ailk_Bjlk_SB_MT128x128x8_SN_SU0_SUM0_TT8_16_WG16_8_1_WGM1
    SolutionIndex: 2
    SolutionNameMin: Cijk_Ailk_Bjlk_SB_MT128x128x8_SN_SU0_SUM0_TT8_8_WG16_16_1_WGM1
    SolutionIndex: 3
    SolutionNameMin: Cijk_Ailk_Bjlk_SB_MT128x64x16_SN_SU0_SUM0_TT8_8_WG16_8_1_WGM1
    SolutionIndex: 4
    SolutionNameMin: Cijk_Ailk_Bjlk_SB_MT128x128x16_SN_SU0_SUM0_TT8_16_WG16_8_1_WGM1
    SolutionIndex: 5
    SolutionNameMin: Cijk_Ailk_Bjlk_SB_MT128x128x16_SN_SU0_SUM0_TT8_8_WG16_16_1_WGM1
    SolutionIndex: 6
    SolutionNameMin: Cijk_Ailk_Bjlk_SB_MT128x256x16_SN_SU0_SUM0_TT8_16_WG16_16_1_WGM1
    SolutionIndex: 7
    SolutionNameMin: Cijk_Ailk_Bjlk_SB_MT128x64x32_SN_SU0_SUM0_TT8_8_WG16_8_1_WGM1
    SolutionIndex: 8
    SolutionNameMin: Cijk_Ailk_Bjlk_SB_MT128x128x32_SN_SU0_SUM0_TT8_8_WG16_16_1_WGM1
    SolutionIndex: 9
    SolutionNameMin: Cijk_Ailk_Bjlk_SB_MT128x64x8_SN_SU32_SUM3_TT8_8_WG16_8_1_WGM1
    SolutionIndex: 10
    SolutionNameMin: Cijk_Ailk_Bjlk_SB_MT128x128x8_SN_SU32_SUM3_TT8_16_WG16_8_1_WGM1
    SolutionIndex: 11
    SolutionNameMin: Cijk_Ailk_Bjlk_SB_MT128x128x8_SN_SU32_SUM3_TT8_8_WG16_16_1_WGM1
    SolutionIndex: 12
    SolutionNameMin: Cijk_Ailk_Bjlk_SB_MT128x256x8_SN_SU32_SUM3_TT8_16_WG16_16_1_WGM1
    SolutionIndex: 13
    SolutionNameMin: Cijk_Ailk_Bjlk_SB_MT128x64x16_SN_SU32_SUM3_TT8_8_WG16_8_1_WGM1
    SolutionIndex: 14
    SolutionNameMin: Cijk_Ailk_Bjlk_SB_MT128x128x16_SN_SU32_SUM3_TT8_16_WG16_8_1_WGM1
    SolutionIndex: 15
    SolutionNameMin: Cijk_Ailk_Bjlk_SB_MT128x128x16_SN_SU32_SUM3_TT8_8_WG16_16_1_WGM1
    SolutionIndex: 16
    SolutionNameMin: Cijk_Ailk_Bjlk_SB_MT128x128x32_SN_SU32_SUM3_TT8_8_WG16_16_1_WGM1
    SolutionIndex: 17
    SolutionNameMin: Cijk_Ailk_Bjlk_SB_MT128x64x8_SN_SU0_SUM0_TT8_8_WG16_8_1_WGM4
    SolutionIndex: 18
    SolutionNameMin: Cijk_Ailk_Bjlk_SB_MT128x128x8_SN_SU0_SUM0_TT8_16_WG16_8_1_WGM4
    SolutionIndex: 19
    SolutionNameMin: Cijk_Ailk_Bjlk_SB_MT128x128x8_SN_SU0_SUM0_TT8_8_WG16_16_1_WGM4
    SolutionIndex: 20
    SolutionNameMin: Cijk_Ailk_Bjlk_SB_MT128x64x16_SN_SU0_SUM0_TT8_8_WG16_8_1_WGM4
    SolutionIndex: 21
    SolutionNameMin: Cijk_Ailk_Bjlk_SB_MT128x128x16_SN_SU0_SUM0_TT8_16_WG16_8_1_WGM4
    SolutionIndex: 22
    SolutionNameMin: Cijk_Ailk_Bjlk_SB_MT128x128x16_SN_SU0_SUM0_TT8_8_WG16_16_1_WGM4
    SolutionIndex: 23
    SolutionNameMin: Cijk_Ailk_Bjlk_SB_MT128x256x16_SN_SU0_SUM0_TT8_16_WG16_16_1_WGM4
    SolutionIndex: 24
    SolutionNameMin: Cijk_Ailk_Bjlk_SB_MT128x64x8_SN_SU32_SUM3_TT8_8_WG16_8_1_WGM4
    SolutionIndex: 25
    SolutionNameMin: Cijk_Ailk_Bjlk_SB_MT128x128x8_SN_SU32_SUM3_TT8_16_WG16_8_1_WGM4
    SolutionIndex: 26
    SolutionNameMin: Cijk_Ailk_Bjlk_SB_MT128x128x8_SN_SU32_SUM3_TT8_8_WG16_16_1_WGM4
    SolutionIndex: 27
    SolutionNameMin: Cijk_Ailk_Bjlk_SB_MT128x256x8_SN_SU32_SUM3_TT8_16_WG16_16_1_WGM4
    SolutionIndex: 28
    SolutionNameMin: Cijk_Ailk_Bjlk_SB_MT128x64x16_SN_SU32_SUM3_TT8_8_WG16_8_1_WGM4
    SolutionIndex: 29
    SolutionNameMin: Cijk_Ailk_Bjlk_SB_MT128x128x16_SN_SU32_SUM3_TT8_16_WG16_8_1_WGM4
    SolutionIndex: 30
    SolutionNameMin: Cijk_Ailk_Bjlk_SB_MT128x128x16_SN_SU32_SUM3_TT8_8_WG16_16_1_WGM4
    SolutionIndex: 31
    SolutionNameMin: Cijk_Ailk_Bjlk_SB_MT128x256x16_SN_SU32_SUM3_TT8_16_WG16_16_1_WGM4
    SolutionIndex: 32
    SolutionNameMin: Cijk_Ailk_Bjlk_SB_MT128x128x32_SN_SU32_SUM3_TT8_8_WG16_16_1_WGM4
    SolutionIndex: 33
    SolutionNameMin: Cijk_Ailk_Bjlk_SB_MT128x64x8_SN_SU0_SUM0_TT8_8_WG16_8_1_WGM8
    SolutionIndex: 34
    SolutionNameMin: Cijk_Ailk_Bjlk_SB_MT128x128x8_SN_SU0_SUM0_TT8_16_WG16_8_1_WGM8
    SolutionIndex: 35
    SolutionNameMin: Cijk_Ailk_Bjlk_SB_MT128x128x8_SN_SU0_SUM0_TT8_8_WG16_16_1_WGM8
    SolutionIndex: 36
    SolutionNameMin: Cijk_Ailk_Bjlk_SB_MT128x64x16_SN_SU0_SUM0_TT8_8_WG16_8_1_WGM8
    SolutionIndex: 37
    SolutionNameMin: Cijk_Ailk_Bjlk_SB_MT128x128x16_SN_SU0_SUM0_TT8_16_WG16_8_1_WGM8
    SolutionIndex: 38
    SolutionNameMin: Cijk_Ailk_Bjlk_SB_MT128x128x16_SN_SU0_SUM0_TT8_8_WG16_16_1_WGM8
    SolutionIndex: 39
    SolutionNameMin: Cijk_Ailk_Bjlk_SB_MT128x256x16_SN_SU0_SUM0_TT8_16_WG16_16_1_WGM8
    SolutionIndex: 40
    SolutionNameMin: Cijk_Ailk_Bjlk_SB_MT128x64x32_SN_SU0_SUM0_TT8_8_WG16_8_1_WGM8
    SolutionIndex: 41
    SolutionNameMin: Cijk_Ailk_Bjlk_SB_MT128x128x32_SN_SU0_SUM0_TT8_8_WG16_16_1_WGM8
    SolutionIndex: 42
    SolutionNameMin: Cijk_Ailk_Bjlk_SB_MT128x64x8_SN_SU32_SUM3_TT8_8_WG16_8_1_WGM8
    SolutionIndex: 43
    SolutionNameMin: Cijk_Ailk_Bjlk_SB_MT128x128x8_SN_SU32_SUM3_TT8_16_WG16_8_1_WGM8
    SolutionIndex: 44
    SolutionNameMin: Cijk_Ailk_Bjlk_SB_MT128x128x8_SN_SU32_SUM3_TT8_8_WG16_16_1_WGM8
    SolutionIndex: 45
    SolutionNameMin: Cijk_Ailk_Bjlk_SB_MT128x64x16_SN_SU32_SUM3_TT8_8_WG16_8_1_WGM8
    SolutionIndex: 46
    SolutionNameMin: Cijk_Ailk_Bjlk_SB_MT128x128x16_SN_SU32_SUM3_TT8_16_WG16_8_1_WGM8
    SolutionIndex: 47
    SolutionNameMin: Cijk_Ailk_Bjlk_SB_MT128x128x16_SN_SU32_SUM3_TT8_8_WG16_16_1_WGM8
    SolutionIndex: 48
    SolutionNameMin: Cijk_Ailk_Bjlk_SB_MT128x64x8_SN_SU0_SUM0_TT8_8_WG16_8_1_WGM1
    SolutionIndex: 49
    SolutionNameMin: Cijk_Ailk_Bjlk_SB_MT128x64x16_SN_SU0_SUM0_TT8_8_WG16_8_1_WGM1
    SolutionIndex: 50
    SolutionNameMin: Cijk_Ailk_Bjlk_SB_MT128x128x16_SN_SU0_SUM0_TT8_8_WG16_16_1_WGM1
    SolutionIndex: 51
    SolutionNameMin: Cijk_Ailk_Bjlk_SB_MT128x128x32_SN_SU0_SUM0_TT8_8_WG16_16_1_WGM1
    SolutionIndex: 52
    SolutionNameMin: Cijk_Ailk_Bjlk_SB_MT128x128x16_SN_SU32_SUM3_TT8_8_WG16_16_1_WGM1
    SolutionIndex: 53
    SolutionNameMin: Cijk_Ailk_Bjlk_SB_MT128x128x32_SN_SU32_SUM3_TT8_8_WG16_16_1_WGM1
    SolutionIndex: 54
    SolutionNameMin: Cijk_Ailk_Bjlk_SB_MT128x64x8_SN_SU0_SUM0_TT8_8_WG16_8_1_WGM4
    SolutionIndex: 55
    SolutionNameMin: Cijk_Ailk_Bjlk_SB_MT128x128x16_SN_SU0_SUM0_TT8_8_WG16_16_1_WGM4
    SolutionIndex: 56
    SolutionNameMin: Cijk_Ailk_Bjlk_SB_MT128x64x8_SN_SU0_SUM0_TT8_8_WG16_8_1_WGM8
    SolutionIndex: 57
    SolutionNameMin: Cijk_Ailk_Bjlk_SB_MT128x128x16_SN_SU0_SUM0_TT8_8_WG16_16_1_WGM8
    SolutionIndex: 58
    SolutionNameMin: Cijk_Ailk_Bjlk_SB_MT128x128x32_SN_SU0_SUM0_TT8_8_WG16_16_1_WGM8
    SolutionIndex: 59
    SolutionNameMin: Cijk_Ailk_Bjlk_SB_MT32x32x8_SN_SU0_SUM0_TT4_4_WG8_8_1_WGM1
    SolutionIndex: 60
    SolutionNameMin: Cijk_Ailk_Bjlk_SB_MT32x64x8_SN_SU0_SUM0_TT4_8_WG8_8_1_WGM1
    SolutionIndex: 61
    SolutionNameMin: Cijk_Ailk_Bjlk_SB_MT64x64x8_SN_SU0_SUM0_TT8_8_WG8_8_1_WGM1
    SolutionIndex: 62
    SolutionNameMin: Cijk_Ailk_Bjlk_SB_MT64x64x8_SN_SU0_SUM0_TT4_8_WG16_8_1_WGM1
    SolutionIndex: 63
    SolutionNameMin: Cijk_Ailk_Bjlk_SB_MT128x64x8_SN_SU0_SUM0_TT8_8_WG16_8_1_WGM1
    SolutionIndex: 64
    SolutionNameMin: Cijk_Ailk_Bjlk_SB_MT128x128x8_SN_SU0_SUM0_TT8_8_WG16_16_1_WGM1
    SolutionIndex: 65
    SolutionNameMin: Cijk_Ailk_Bjlk_SB_MT32x64x16_SN_SU0_SUM0_TT4_8_WG8_8_1_WGM1
    SolutionIndex: 66
    SolutionNameMin: Cijk_Ailk_Bjlk_SB_MT64x64x16_SN_SU0_SUM0_TT8_8_WG8_8_1_WGM1
    SolutionIndex: 67
    SolutionNameMin: Cijk_Ailk_Bjlk_SB_MT64x32x16_SN_SU0_SUM0_TT4_4_WG16_8_1_WGM1
    SolutionIndex: 68
    SolutionNameMin: Cijk_Ailk_Bjlk_SB_MT64x64x16_SN_SU0_SUM0_TT4_8_WG16_8_1_WGM1
    SolutionIndex: 69
    SolutionNameMin: Cijk_Ailk_Bjlk_SB_MT128x64x16_SN_SU0_SUM0_TT8_8_WG16_8_1_WGM1
    SolutionIndex: 71
    SolutionNameMin: Cijk_Ailk_Bjlk_SB_MT128x128x16_SN_SU0_SUM0_TT8_8_WG16_16_1_WGM1
    SolutionIndex: 72
    SolutionNameMin: Cijk_Ailk_Bjlk_SB_MT64x64x32_SN_SU0_SUM0_TT4_8_WG16_8_1_WGM1
    SolutionIndex: 73
    SolutionNameMin: Cijk_Ailk_Bjlk_SB_MT64x64x32_SN_SU0_SUM0_TT4_4_WG16_16_1_WGM1
    SolutionIndex: 74
    SolutionNameMin: Cijk_Ailk_Bjlk_SB_MT128x128x32_SN_SU0_SUM0_TT8_8_WG16_16_1_WGM1
    SolutionIndex: 75
    SolutionNameMin: Cijk_Ailk_Bjlk_SB_MT32x32x8_SN_SU32_SUM3_TT4_4_WG8_8_1_WGM1
    SolutionIndex: 76
    SolutionNameMin: Cijk_Ailk_Bjlk_SB_MT64x64x8_SN_SU32_SUM3_TT8_8_WG8_8_1_WGM1
    SolutionIndex: 77
    SolutionNameMin: Cijk_Ailk_Bjlk_SB_MT128x64x8_SN_SU32_SUM3_TT8_8_WG16_8_1_WGM1
    SolutionIndex: 79
    SolutionNameMin: Cijk_Ailk_Bjlk_SB_MT64x64x16_SN_SU32_SUM3_TT8_8_WG8_8_1_WGM1
    SolutionIndex: 80
    SolutionNameMin: Cijk_Ailk_Bjlk_SB_MT64x64x16_SN_SU32_SUM3_TT4_8_WG16_8_1_WGM1
    SolutionIndex: 81
    SolutionNameMin: Cijk_Ailk_Bjlk_SB_MT128x64x16_SN_SU32_SUM3_TT8_8_WG16_8_1_WGM1
    SolutionIndex: 82
    SolutionNameMin: Cijk_Ailk_Bjlk_SB_MT64x64x16_SN_SU32_SUM3_TT4_4_WG16_16_1_WGM1
    SolutionIndex: 83
    SolutionNameMin: Cijk_Ailk_Bjlk_SB_MT64x128x32_SN_SU32_SUM3_TT4_8_WG16_16_1_WGM1
    SolutionIndex: 84
    SolutionNameMin: Cijk_Ailk_Bjlk_SB_MT128x128x32_SN_SU32_SUM3_TT8_8_WG16_16_1_WGM1
    SolutionIndex: 85
    SolutionNameMin: Cijk_Ailk_Bjlk_SB_MT32x64x8_SN_SU0_SUM0_TT4_8_WG8_8_1_WGM4
    SolutionIndex: 86
    SolutionNameMin: Cijk_Ailk_Bjlk_SB_MT64x64x8_SN_SU0_SUM0_TT8_8_WG8_8_1_WGM4
    SolutionIndex: 87
    SolutionNameMin: Cijk_Ailk_Bjlk_SB_MT128x64x8_SN_SU0_SUM0_TT8_8_WG16_8_1_WGM4
    SolutionIndex: 88
    SolutionNameMin: Cijk_Ailk_Bjlk_SB_MT128x128x8_SN_SU0_SUM0_TT8_8_WG16_16_1_WGM4
    SolutionIndex: 89
    SolutionNameMin: Cijk_Ailk_Bjlk_SB_MT32x64x16_SN_SU0_SUM0_TT4_8_WG8_8_1_WGM4
    SolutionIndex: 90
    SolutionNameMin: Cijk_Ailk_Bjlk_SB_MT64x64x16_SN_SU0_SUM0_TT4_8_WG16_8_1_WGM4
    SolutionIndex: 91
    SolutionNameMin: Cijk_Ailk_Bjlk_SB_MT128x64x16_SN_SU0_SUM0_TT8_8_WG16_8_1_WGM4
    SolutionIndex: 92
    SolutionNameMin: Cijk_Ailk_Bjlk_SB_MT64x64x16_SN_SU0_SUM0_TT4_4_WG16_16_1_WGM4
    SolutionIndex: 93
    SolutionNameMin: Cijk_Ailk_Bjlk_SB_MT128x128x16_SN_SU0_SUM0_TT8_8_WG16_16_1_WGM4
    SolutionIndex: 95
    SolutionNameMin: Cijk_Ailk_Bjlk_SB_MT64x64x32_SN_SU0_SUM0_TT4_4_WG16_16_1_WGM4
    SolutionIndex: 96
    SolutionNameMin: Cijk_Ailk_Bjlk_SB_MT128x128x32_SN_SU0_SUM0_TT8_8_WG16_16_1_WGM4
    SolutionIndex: 97
    SolutionNameMin: Cijk_Ailk_Bjlk_SB_MT32x64x8_SN_SU32_SUM3_TT4_8_WG8_8_1_WGM4
    SolutionIndex: 98
    SolutionNameMin: Cijk_Ailk_Bjlk_SB_MT64x64x8_SN_SU32_SUM3_TT8_8_WG8_8_1_WGM4
    SolutionIndex: 101
    SolutionNameMin: Cijk_Ailk_Bjlk_SB_MT64x64x16_SN_SU32_SUM3_TT8_8_WG8_8_1_WGM4
    SolutionIndex: 102
    SolutionNameMin: Cijk_Ailk_Bjlk_SB_MT64x128x16_SN_SU32_SUM3_TT4_8_WG16_16_1_WGM4
    SolutionIndex: 103
    SolutionNameMin: Cijk_Ailk_Bjlk_SB_MT128x128x16_SN_SU32_SUM3_TT8_8_WG16_16_1_WGM4
    SolutionIndex: 104
    SolutionNameMin: Cijk_Ailk_Bjlk_SB_MT64x64x32_SN_SU32_SUM3_TT4_8_WG16_8_1_WGM4
    SolutionIndex: 107
    SolutionNameMin: Cijk_Ailk_Bjlk_SB_MT32x32x8_SN_SU0_SUM0_TT4_4_WG8_8_1_WGM8
    SolutionIndex: 108
    SolutionNameMin: Cijk_Ailk_Bjlk_SB_MT32x64x8_SN_SU0_SUM0_TT4_8_WG8_8_1_WGM8
    SolutionIndex: 109
    SolutionNameMin: Cijk_Ailk_Bjlk_SB_MT64x64x8_SN_SU0_SUM0_TT8_8_WG8_8_1_WGM8
    SolutionIndex: 110
    SolutionNameMin: Cijk_Ailk_Bjlk_SB_MT128x64x8_SN_SU0_SUM0_TT8_8_WG16_8_1_WGM8
    SolutionIndex: 111
    SolutionNameMin: Cijk_Ailk_Bjlk_SB_MT128x128x8_SN_SU0_SUM0_TT8_8_WG16_16_1_WGM8
    SolutionIndex: 112
    SolutionNameMin: Cijk_Ailk_Bjlk_SB_MT32x64x16_SN_SU0_SUM0_TT4_8_WG8_8_1_WGM8
    SolutionIndex: 113
    SolutionNameMin: Cijk_Ailk_Bjlk_SB_MT64x64x16_SN_SU0_SUM0_TT8_8_WG8_8_1_WGM8
    SolutionIndex: 114
    SolutionNameMin: Cijk_Ailk_Bjlk_SB_MT128x64x16_SN_SU0_SUM0_TT8_8_WG16_8_1_WGM8
    SolutionIndex: 115
    SolutionNameMin: Cijk_Ailk_Bjlk_SB_MT64x128x16_SN_SU0_SUM0_TT4_8_WG16_16_1_WGM8
    SolutionIndex: 116
    SolutionNameMin: Cijk_Ailk_Bjlk_SB_MT128x128x16_SN_SU0_SUM0_TT8_8_WG16_16_1_WGM8
    SolutionIndex: 117
    SolutionNameMin: Cijk_Ailk_Bjlk_SB_MT64x64x32_SN_SU0_SUM0_TT4_8_WG16_8_1_WGM8
    SolutionIndex: 118
    SolutionNameMin: Cijk_Ailk_Bjlk_SB_MT128x128x32_SN_SU0_SUM0_TT8_8_WG16_16_1_WGM8
    SolutionIndex: 119
    SolutionNameMin: Cijk_Ailk_Bjlk_SB_MT64x64x8_SN_SU32_SUM3_TT8_8_WG8_8_1_WGM8
    SolutionIndex: 123
    SolutionNameMin: Cijk_Ailk_Bjlk_SB_MT128x64x16_SN_SU32_SUM3_TT8_8_WG16_8_1_WGM8
    SolutionIndex: 124
    SolutionNameMin: Cijk_Ailk_Bjlk_SB_MT64x128x16_SN_SU32_SUM3_TT4_8_WG16_16_1_WGM8
    SolutionIndex: 125
    SolutionNameMin: Cijk_Ailk_Bjlk_SB_MT128x128x16_SN_SU32_SUM3_TT8_8_WG16_16_1_WGM8
    SolutionIndex: 127
    SolutionNameMin: Cijk_Ailk_Bjlk_SB_MT128x128x32_SN_SU32_SUM3_TT8_8_WG16_16_1_WGM8
- - - [2048, 2048, 1, 512, 2048, 2048, 2048, 2048]
    - [17, 18267.0]
  - - [1600, 1024, 1, 512, 1600, 1600, 1600, 1024]
    - [5, 17183.0]
  - - [4096, 1024, 1, 4096, 4096, 4096, 4096, 1024]
    - [33, 18648.0]
  - - [4096, 1024, 1, 2048, 4096, 4096, 4096, 1024]
    - [17, 18594.0]
  - - [3072, 768, 1, 4096, 3072, 3072, 3072, 768]
    - [38, 19943.0]
  - - [3072, 1024, 1, 2048, 3072, 3072, 3072, 1024]
    - [33, 18813.0]
  - - [3072, 1024, 1, 3072, 3072, 3072, 3072, 1024]
    - [17, 18839.0]
  - - [3072, 1024, 1, 512, 3072, 3072, 3072, 1024]
    - [33, 18466.0]
  - - [2944, 4288, 1, 1280, 2944, 2944, 2944, 4288]
    - [21, 20100.0]
  - - [2368, 5888, 1, 256, 2368, 2368, 2368, 5888]
    - [18, 19114.0]
  - - [5888, 1024, 1, 1280, 5888, 5888, 5888, 1024]
    - [33, 19146.0]
  - - [5888, 1856, 1, 3328, 5888, 5888, 5888, 1856]
    - [3, 19493.0]
  - - [5056, 704, 1, 256, 5056, 5056, 5056, 704]
    - [9, 17238.0]
  - - [5888, 2944, 1, 3328, 5888, 5888, 5888, 2944]
    - [37, 20476.0]
  - - [1856, 4288, 1, 256, 1856, 1856, 1856, 4288]
    - [3, 18253.0]
  - - [1024, 5056, 1, 128, 1024, 1024, 1024, 5056]
    - [33, 18166.0]
  - - [5056, 5056, 1, 3328, 5056, 5056, 5056, 5056]
    - [37, 20233.0]
  - - [1408, 5888, 1, 1280, 1408, 1408, 1408, 5888]
    - [34, 19309.0]
  - - [1024, 3584, 1, 3328, 1024, 1024, 1024, 3584]
    - [20, 18702.0]
  - - [5888, 1408, 1, 1280, 5888, 5888, 5888, 1408]
    - [21, 19356.0]
  - - [1024, 2368, 1, 256, 1024, 1024, 1024, 2368]
    - [17, 16814.0]
  - - [1408, 1856, 1, 1280, 1408, 1408, 1408, 1856]
    - [20, 18788.0]
  - - [5056, 5056, 1, 1280, 5056, 5056, 5056, 5056]
    - [37, 20128.0]
  - - [448, 5056, 1, 256, 448, 448, 448, 5056]
    - [9, 15038.0]
  - - [1856, 1408, 1, 128, 1856, 1856, 1856, 1408]
    - [35, 15149.0]
  - - [6784, 256, 1, 3328, 6784, 6784, 6784, 256]
    - [38, 19306.0]
  - - [6784, 4288, 1, 3328, 6784, 6784, 6784, 4288]
    - [37, 20352.0]
  - - [4288, 448, 1, 256, 4288, 4288, 4288, 448]
    - [0, 16082.0]
  - - [1856, 2368, 1, 3328, 1856, 1856, 1856, 2368]
    - [34, 18858.0]
  - - [4288, 2944, 1, 1280, 4288, 4288, 4288, 2944]
    - [37, 20134.0]
  - - [704, 5056, 1, 1280, 704, 704, 704, 5056]
    - [5, 17229.0]
  - - [2368, 704, 1, 3328, 2368, 2368, 2368, 704]
    - [33, 17843.0]
  - - [256, 5888, 1, 256, 256, 256, 256, 5888]
    - [38, 15534.0]
  - - [1856, 4288, 1, 3328, 1856, 1856, 1856, 4288]
    - [3, 19113.0]
  - - [5888, 1024, 1, 256, 5888, 5888, 5888, 1024]
    - [33, 18773.0]
  - - [448, 5056, 1, 3328, 448, 448, 448, 5056]
    - [3, 16422.0]
  - - [1408, 2944, 1, 256, 1408, 1408, 1408, 2944]
    - [33, 17937.0]
  - - [6784, 5056, 1, 3328, 6784, 6784, 6784, 5056]
    - [21, 20715.0]
  - - [5056, 5056, 1, 256, 5056, 5056, 5056, 5056]
    - [18, 19582.0]
  - - [1408, 6784, 1, 128, 1408, 1408, 1408, 6784]
    - [33, 18839.0]
  - - [704, 5056, 1, 128, 704, 704, 704, 5056]
    - [47, 15486.0]
  - - [2368, 2944, 1, 1280, 2368, 2368, 2368, 2944]
    - [3, 18685.0]
  - - [6784, 6784, 1, 1280, 6784, 6784, 6784, 6784]
    - [37, 20786.0]
  - - [1408, 4288, 1, 1280, 1408, 1408, 1408, 4288]
    - [17, 19155.0]
  - - [3584, 4288, 1, 1280, 3584, 3584, 3584, 4288]
    - [21, 20049.0]
  - - [2368, 704, 1, 1280, 2368, 2368, 2368, 704]
    - [17, 17574.0]
  - - [5056, 4288, 1, 3328, 5056, 5056, 5056, 4288]
    - [37, 20258.0]
  - - [3584, 2368, 1, 3328, 3584, 3584, 3584, 2368]
    - [37, 19800.0]
  - - [6784, 448, 1, 1280, 6784, 6784, 6784, 448]
    - [33, 18143.0]
  - - [1408, 2944, 1, 128, 1408, 1408, 1408, 2944]
    - [17, 17442.0]
  - - [4288, 2944, 1, 256, 4288, 4288, 4288, 2944]
    - [1, 19574.0]
  - - [5888, 704, 1, 1280, 5888, 5888, 5888, 704]
    - [20, 18355.0]
  - - [448, 5888, 1, 128, 448, 448, 448, 5888]
    - [33, 14259.0]
  - - [5056, 2368, 1, 1280, 5056, 5056, 5056, 2368]
    - [17, 19271.0]
  - - [448, 3584, 1, 1280, 448, 448, 448, 3584]
    - [17, 14796.0]
  - - [6784, 5888, 1, 256, 6784, 6784, 6784, 5888]
    - [1, 20479.0]
  - - [5888, 2944, 1, 128, 5888, 5888, 5888, 2944]
    - [17, 19280.0]
  - - [1024, 1408, 1, 256, 1024, 1024, 1024, 1408]
    - [0, 16792.0]
  - - [2368, 2368, 1, 3328, 2368, 2368, 2368, 2368]
    - [36, 18790.0]
  - - [1856, 6784, 1, 128, 1856, 1856, 1856, 6784]
    - [17, 18365.0]
  - - [5056, 704, 1, 3328, 5056, 5056, 5056, 704]
    - [33, 18127.0]
  - - [1408, 1856, 1, 256, 1408, 1408, 1408, 1856]
    - [33, 17984.0]
  - - [2368, 5056, 1, 256, 2368, 2368, 2368, 5056]
    - [0, 18929.0]
  - - [5888, 1856, 1, 256, 5888, 5888, 5888, 1856]
    - [33, 19183.0]
  - - [704, 5888, 1, 256, 704, 704, 704, 5888]
    - [15, 16951.0]
  - - [2944, 6784, 1, 3328, 2944, 2944, 2944, 6784]
    - [37, 20838.0]
  - - [3584, 704, 1, 3328, 3584, 3584, 3584, 704]
    - [20, 18278.0]
  - - [448, 4288, 1, 256, 448, 448, 448, 4288]
    - [33, 14689.0]
  - - [704, 2368, 1, 1280, 704, 704, 704, 2368]
    - [17, 15416.0]
  - - [1856, 2368, 1, 1280, 1856, 1856, 1856, 2368]
    - [5, 18665.0]
  - - [1856, 4288, 1, 1280, 1856, 1856, 1856, 4288]
    - [20, 19047.0]
  - - [704, 2944, 1, 128, 704, 704, 704, 2944]
    - [0, 14545.0]
  - - [1408, 1024, 1, 1280, 1408, 1408, 1408, 1024]
    - [33, 18072.0]
  - - [704, 6784, 1, 256, 704, 704, 704, 6784]
    - [5, 17377.0]
  - - [6784, 704, 1, 256, 6784, 6784, 6784, 704]
    - [33, 18281.0]
  - - [5056, 1408, 1, 128, 5056, 5056, 5056, 1408]
    - [0, 18334.0]
  - - [3584, 4288, 1, 3328, 3584, 3584, 3584, 4288]
    - [37, 20147.0]
  - - [5888, 1856, 1, 1280, 5888, 5888, 5888, 1856]
    - [36, 19427.0]
  - - [5056, 1024, 1, 3328, 5056, 5056, 5056, 1024]
    - [1, 19827.0]
  - - [1024, 4288, 1, 128, 1024, 1024, 1024, 4288]
    - [9, 18130.0]
  - - [2368, 3584, 1, 1280, 2368, 2368, 2368, 3584]
    - [18, 19707.0]
  - - [2368, 6784, 1, 1280, 2368, 2368, 2368, 6784]
    - [37, 20184.0]
  - - [2944, 3584, 1, 3328, 2944, 2944, 2944, 3584]
    - [37, 20613.0]
  - - [6784, 2944, 1, 256, 6784, 6784, 6784, 2944]
    - [34, 20209.0]
  - - [4288, 2368, 1, 3328, 4288, 4288, 4288, 2368]
    - [37, 19816.0]
  - - [1856, 2368, 1, 256, 1856, 1856, 1856, 2368]
    - [38, 17542.0]
  - - [3584, 6784, 1, 3328, 3584, 3584, 3584, 6784]
    - [37, 20585.0]
  - - [1024, 5888, 1, 3328, 1024, 1024, 1024, 5888]
    - [33, 19227.0]
  - - [5056, 4288, 1, 1280, 5056, 5056, 5056, 4288]
    - [4, 20162.0]
  - - [2944, 5888, 1, 128, 2944, 2944, 2944, 5888]
    - [38, 19446.0]
  - - [704, 5888, 1, 1280, 704, 704, 704, 5888]
    - [34, 17693.0]
  - - [2368, 3584, 1, 128, 2368, 2368, 2368, 3584]
    - [38, 18344.0]
  - - [6784, 5888, 1, 3328, 6784, 6784, 6784, 5888]
    - [37, 20950.0]
  - - [1024, 5056, 1, 1280, 1024, 1024, 1024, 5056]
    - [38, 19537.0]
  - - [4288, 1024, 1, 256, 4288, 4288, 4288, 1024]
    - [15, 17674.0]
  - - [2944, 2368, 1, 128, 2944, 2944, 2944, 2368]
    - [17, 18699.0]
  - - [5888, 448, 1, 1280, 5888, 5888, 5888, 448]
    - [33, 17437.0]
  - - [704, 5888, 1, 3328, 704, 704, 704, 5888]
    - [6, 17821.0]
  - - [6784, 2368, 1, 1280, 6784, 6784, 6784, 2368]
    - [4, 20159.0]
  - - [3584, 2944, 1, 256, 3584, 3584, 3584, 2944]
    - [1, 19855.0]
  - - [2368, 1024, 1, 3328, 2368, 2368, 2368, 1024]
    - [20, 17576.0]
  - - [1408, 5056, 1, 3328, 1408, 1408, 1408, 5056]
    - [13, 19146.0]
  - - [1856, 1856, 1, 3328, 1856, 1856, 1856, 1856]
    - [17, 17633.0]
  - - [2368, 2368, 1, 256, 2368, 2368, 2368, 2368]
    - [0, 18208.0]
  - - [4288, 4288, 1, 1280, 4288, 4288, 4288, 4288]
    - [21, 19710.0]
  - - [1408, 4288, 1, 256, 1408, 1408, 1408, 4288]
    - [17, 18826.0]
  - - [5888, 448, 1, 128, 5888, 5888, 5888, 448]
    - [0, 16063.0]
  - - [704, 6784, 1, 3328, 704, 704, 704, 6784]
    - [34, 18328.0]
  - - [5888, 5888, 1, 1280, 5888, 5888, 5888, 5888]
    - [4, 20880.0]
  - - [5056, 1024, 1, 1280, 5056, 5056, 5056, 1024]
    - [1, 19591.0]
  - - [448, 5888, 1, 3328, 448, 448, 448, 5888]
    - [17, 15847.0]
  - - [1024, 2944, 1, 1280, 1024, 1024, 1024, 2944]
    - [33, 18006.0]
  - - [5056, 5888, 1, 1280, 5056, 5056, 5056, 5888]
    - [21, 20330.0]
  - - [4288, 5888, 1, 128, 4288, 4288, 4288, 5888]
    - [5, 19285.0]
  - - [1408, 3584, 1, 128, 1408, 1408, 1408, 3584]
    - [38, 17923.0]
  - - [448, 3584, 1, 128, 448, 448, 448, 3584]
    - [24, 12686.0]
  - - [5888, 2944, 1, 1280, 5888, 5888, 5888, 2944]
    - [4, 20393.0]
  - - [2368, 5888, 1, 128, 2368, 2368, 2368, 5888]
    - [33, 18680.0]
  - - [3584, 5888, 1, 256, 3584, 3584, 3584, 5888]
    - [1, 20253.0]
  - - [2368, 704, 1, 128, 2368, 2368, 2368, 704]
    - [33, 14360.0]
  - - [3584, 2944, 1, 1280, 3584, 3584, 3584, 2944]
    - [37, 20546.0]
  - - [3584, 2368, 1, 128, 3584, 3584, 3584, 2368]
    - [33, 18959.0]
  - - [5056, 704, 1, 128, 5056, 5056, 5056, 704]
    - [9, 16665.0]
  - - [5056, 1408, 1, 3328, 5056, 5056, 5056, 1408]
    - [36, 19134.0]
  - - [6784, 1024, 1, 3328, 6784, 6784, 6784, 1024]
    - [37, 20170.0]
  - - [6784, 2944, 1, 3328, 6784, 6784, 6784, 2944]
    - [4, 20833.0]
  - - [2944, 5056, 1, 3328, 2944, 2944, 2944, 5056]
    - [37, 20248.0]
  - - [1856, 1856, 1, 256, 1856, 1856, 1856, 1856]
    - [9, 16740.0]
  - - [1024, 5888, 1, 128, 1024, 1024, 1024, 5888]
    - [33, 18323.0]
  - - [2048, 7133, 1, 2048, 2048, 2048, 2048, 7133]
    - [21, 20585.0]
  - - [4288, 5888, 1, 1280, 4288, 4288, 4288, 5888]
    - [4, 20320.0]
  - - [4288, 4288, 1, 256, 4288, 4288, 4288, 4288]
    - [33, 19183.0]
  - - [4288, 1856, 1, 1280, 4288, 4288, 4288, 1856]
    - [3, 19054.0]
  - - [1856, 2944, 1, 3328, 1856, 1856, 1856, 2944]
    - [18, 18932.0]
  - - [256, 6784, 1, 3328, 256, 256, 256, 6784]
    - [22, 19299.0]
  - - [256, 5056, 1, 128, 256, 256, 256, 5056]
    - [33, 14088.0]
  - - [5056, 1024, 1, 256, 5056, 5056, 5056, 1024]
    - [5, 18945.0]
  - - [5056, 1856, 1, 3328, 5056, 5056, 5056, 1856]
    - [37, 19368.0]
  - - [1856, 1408, 1, 256, 1856, 1856, 1856, 1408]
    - [44, 16128.0]
  - - [4288, 1408, 1, 128, 4288, 4288, 4288, 1408]
    - [9, 18124.0]
  - - [4288, 5056, 1, 256, 4288, 4288, 4288, 5056]
    - [25, 19649.0]
  - - [5056, 256, 1, 3328, 5056, 5056, 5056, 256]
    - [0, 16394.0]
  - - [1024, 5888, 1, 1280, 1024, 1024, 1024, 5888]
    - [17, 19154.0]
  - - [6784, 2368, 1, 128, 6784, 6784, 6784, 2368]
    - [33, 19289.0]
  - - [5056, 3584, 1, 256, 5056, 5056, 5056, 3584]
    - [10, 19534.0]
  - - [1856, 1024, 1, 1280, 1856, 1856, 1856, 1024]
    - [17, 17394.0]
  - - [6784, 4288, 1, 1280, 6784, 6784, 6784, 4288]
    - [37, 20276.0]
  - - [1856, 1856, 1, 1280, 1856, 1856, 1856, 1856]
    - [33, 17438.0]
  - - [6784, 2944, 1, 128, 6784, 6784, 6784, 2944]
    - [38, 19695.0]
  - - [1408, 5056, 1, 1280, 1408, 1408, 1408, 5056]
    - [33, 19123.0]
  - - [5888, 1856, 1, 128, 5888, 5888, 5888, 1856]
    - [33, 18887.0]
  - - [2368, 1024, 1, 128, 2368, 2368, 2368, 1024]
    - [0, 15628.0]
  - - [5056, 3584, 1, 128, 5056, 5056, 5056, 3584]
    - [0, 19056.0]
  - - [5888, 5888, 1, 3328, 5888, 5888, 5888, 5888]
    - [37, 20940.0]
  - - [6784, 1024, 1, 256, 6784, 6784, 6784, 1024]
    - [5, 19272.0]
  - - [2944, 2368, 1, 256, 2944, 2944, 2944, 2368]
    - [33, 19088.0]
  - - [5056, 5888, 1, 3328, 5056, 5056, 5056, 5888]
    - [4, 20391.0]
  - - [1856, 1024, 1, 256, 1856, 1856, 1856, 1024]
    - [17, 15807.0]
  - - [3584, 448, 1, 1280, 3584, 3584, 3584, 448]
    - [33, 17118.0]
  - - [448, 5888, 1, 256, 448, 448, 448, 5888]
    - [33, 15100.0]
  - - [1408, 6784, 1, 3328, 1408, 1408, 1408, 6784]
    - [37, 19748.0]
  - - [4288, 704, 1, 128, 4288, 4288, 4288, 704]
    - [33, 15720.0]
  - - [5056, 2944, 1, 256, 5056, 5056, 5056, 2944]
    - [10, 19624.0]
  - - [6784, 5888, 1, 128, 6784, 6784, 6784, 5888]
    - [1, 20003.0]
  - - [2368, 1856, 1, 256, 2368, 2368, 2368, 1856]
    - [38, 17591.0]
  - - [1408, 3584, 1, 3328, 1408, 1408, 1408, 3584]
    - [37, 19411.0]
  - - [2368, 6784, 1, 256, 2368, 2368, 2368, 6784]
    - [10, 19457.0]
  - - [5056, 1408, 1, 1280, 5056, 5056, 5056, 1408]
    - [20, 19040.0]
  - - [5056, 4288, 1, 128, 5056, 5056, 5056, 4288]
    - [9, 19165.0]
  - - [1408, 1856, 1, 128, 1408, 1408, 1408, 1856]
    - [0, 16997.0]
  - - [1408, 5888, 1, 3328, 1408, 1408, 1408, 5888]
    - [21, 19430.0]
  - - [6784, 6784, 1, 256, 6784, 6784, 6784, 6784]
    - [37, 20378.0]
  - - [4288, 2368, 1, 128, 4288, 4288, 4288, 2368]
    - [33, 18295.0]
  - - [1856, 4288, 1, 128, 1856, 1856, 1856, 4288]
    - [0, 17791.0]
  - - [2368, 2944, 1, 256, 2368, 2368, 2368, 2944]
    - [0, 18215.0]
  - - [3584, 1856, 1, 1280, 3584, 3584, 3584, 1856]
    - [33, 19333.0]
  - - [6784, 6784, 1, 128, 6784, 6784, 6784, 6784]
    - [1, 19927.0]
  - - [5888, 5056, 1, 256, 5888, 5888, 5888, 5056]
    - [1, 19829.0]
  - - [3584, 448, 1, 256, 3584, 3584, 3584, 448]
    - [33, 16157.0]
  - - [448, 4288, 1, 128, 448, 448, 448, 4288]
    - [33, 13661.0]
  - - [2944, 4288, 1, 3328, 2944, 2944, 2944, 4288]
    - [4, 20216.0]
  - - [256, 6784, 1, 256, 256, 256, 256, 6784]
    - [19, 16931.0]
  - - [1408, 4288, 1, 128, 1408, 1408, 1408, 4288]
    - [17, 18391.0]
  - - [2944, 704, 1, 3328, 2944, 2944, 2944, 704]
    - [38, 17504.0]
  - - [3584, 3584, 1, 256, 3584, 3584, 3584, 3584]
    - [37, 19927.0]
  - - [3584, 5056, 1, 256, 3584, 3584, 3584, 5056]
    - [17, 19565.0]
  - - [2944, 2368, 1, 1280, 2944, 2944, 2944, 2368]
    - [36, 19428.0]
  - - [1408, 3584, 1, 256, 1408, 1408, 1408, 3584]
    - [5, 18679.0]
  - - [6784, 3584, 1, 256, 6784, 6784, 6784, 3584]
    - [1, 20133.0]
  - - [5056, 2368, 1, 128, 5056, 5056, 5056, 2368]
    - [17, 18712.0]
  - - [2944, 2944, 1, 3328, 2944, 2944, 2944, 2944]
    - [21, 20199.0]
  - - [5056, 6784, 1, 256, 5056, 5056, 5056, 6784]
    - [25, 20146.0]
  - - [1856, 3584, 1, 128, 1856, 1856, 1856, 3584]
    - [15, 17534.0]
  - - [6784, 448, 1, 256, 6784, 6784, 6784, 448]
    - [17, 17547.0]
  - - [3584, 6784, 1, 128, 3584, 3584, 3584, 6784]
    - [34, 19702.0]
  - - [5056, 1856, 1, 256, 5056, 5056, 5056, 1856]
    - [17, 18827.0]
  - - [1024, 1856, 1, 256, 1024, 1024, 1024, 1856]
    - [0, 16697.0]
  - - [1408, 6784, 1, 1280, 1408, 1408, 1408, 6784]
    - [1, 19647.0]
  - - [3584, 3584, 1, 1280, 3584, 3584, 3584, 3584]
    - [4, 20525.0]
  - - [5888, 5888, 1, 128, 5888, 5888, 5888, 5888]
    - [1, 19832.0]
  - - [5056, 5888, 1, 128, 5056, 5056, 5056, 5888]
    - [18, 19353.0]
  - - [5056, 2368, 1, 3328, 5056, 5056, 5056, 2368]
    - [20, 19304.0]
  - - [2944, 4288, 1, 256, 2944, 2944, 2944, 4288]
    - [33, 19492.0]
  - - [1408, 3584, 1, 1280, 1408, 1408, 1408, 3584]
    - [18, 19276.0]
  - - [2368, 6784, 1, 3328, 2368, 2368, 2368, 6784]
    - [21, 20267.0]
  - - [1856, 1408, 1, 1280, 1856, 1856, 1856, 1408]
    - [38, 17393.0]
  - - [6784, 704, 1, 128, 6784, 6784, 6784, 704]
    - [33, 17823.0]
  - - [1408, 5888, 1, 256, 1408, 1408, 1408, 5888]
    - [33, 18936.0]
  - - [704, 2944, 1, 1280, 704, 704, 704, 2944]
    - [5, 17319.0]
  - - [1856, 2368, 1, 128, 1856, 1856, 1856, 2368]
    - [0, 17235.0]
  - - [4096, 7133, 1, 4096, 4096, 4096, 4096, 7133]
    - [4, 20778.0]
  - - [3584, 704, 1, 1280, 3584, 3584, 3584, 704]
    - [17, 18087.0]
  - - [2944, 6784, 1, 128, 2944, 2944, 2944, 6784]
    - [43, 19735.0]
  - - [3584, 448, 1, 3328, 3584, 3584, 3584, 448]
    - [33, 17242.0]
  - - [704, 2368, 1, 3328, 704, 704, 704, 2368]
    - [33, 15508.0]
  - - [256, 5888, 1, 128, 256, 256, 256, 5888]
    - [0, 14356.0]
  - - [2944, 2944, 1, 1280, 2944, 2944, 2944, 2944]
    - [4, 20180.0]
  - - [5888, 2368, 1, 256, 5888, 5888, 5888, 2368]
    - [33, 19373.0]
  - - [6784, 704, 1, 3328, 6784, 6784, 6784, 704]
    - [3, 18734.0]
  - - [5888, 4288, 1, 128, 5888, 5888, 5888, 4288]
    - [33, 19496.0]
  - - [1408, 2944, 1, 3328, 1408, 1408, 1408, 2944]
    - [33, 18435.0]
  - - [3584, 704, 1, 128, 3584, 3584, 3584, 704]
    - [33, 16478.0]
  - - [5056, 5056, 1, 128, 5056, 5056, 5056, 5056]
    - [0, 19334.0]
  - - [448, 5056, 1, 128, 448, 448, 448, 5056]
    - [0, 13715.0]
  - - [1408, 5056, 1, 128, 1408, 1408, 1408, 5056]
    - [33, 18423.0]
  - - [2944, 3584, 1, 128, 2944, 2944, 2944, 3584]
    - [38, 19433.0]
  - - [3584, 2368, 1, 256, 3584, 3584, 3584, 2368]
    - [0, 19295.0]
  - - [5888, 5056, 1, 1280, 5888, 5888, 5888, 5056]
    - [4, 20311.0]
  - - [2368, 5056, 1, 128, 2368, 2368, 2368, 5056]
    - [17, 18491.0]
  - - [3584, 3584, 1, 3328, 3584, 3584, 3584, 3584]
    - [14, 20567.0]
  - - [5888, 6784, 1, 256, 5888, 5888, 5888, 6784]
    - [4, 20422.0]
  - - [4288, 2944, 1, 3328, 4288, 4288, 4288, 2944]
    - [21, 20223.0]
  - - [4288, 704, 1, 1280, 4288, 4288, 4288, 704]
    - [33, 17904.0]
  - - [256, 5056, 1, 1280, 256, 256, 256, 5056]
    - [33, 16303.0]
  - - [2944, 5888, 1, 3328, 2944, 2944, 2944, 5888]
    - [4, 20449.0]
  - - [6784, 5888, 1, 1280, 6784, 6784, 6784, 5888]
    - [37, 20856.0]
  - - [5888, 4288, 1, 1280, 5888, 5888, 5888, 4288]
    - [4, 20277.0]
  - - [5888, 3584, 1, 128, 5888, 5888, 5888, 3584]
    - [38, 19593.0]
  - - [1856, 1856, 1, 128, 1856, 1856, 1856, 1856]
    - [9, 16234.0]
  - - [704, 3584, 1, 128, 704, 704, 704, 3584]
    - [17, 14614.0]
  - - [5888, 448, 1, 3328, 5888, 5888, 5888, 448]
    - [17, 17507.0]
  - - [2368, 4288, 1, 1280, 2368, 2368, 2368, 4288]
    - [34, 19668.0]
  - - [4288, 2944, 1, 128, 4288, 4288, 4288, 2944]
    - [5, 18992.0]
  - - [1024, 6784, 1, 3328, 1024, 1024, 1024, 6784]
    - [4, 20132.0]
  - - [5056, 2944, 1, 3328, 5056, 5056, 5056, 2944]
    - [21, 20251.0]
  - - [2944, 3584, 1, 256, 2944, 2944, 2944, 3584]
    - [38, 19757.0]
  - - [1408, 1408, 1, 3328, 1408, 1408, 1408, 1408]
    - [33, 18389.0]
  - - [3584, 3584, 1, 128, 3584, 3584, 3584, 3584]
    - [38, 19449.0]
  - - [3584, 704, 1, 256, 3584, 3584, 3584, 704]
    - [17, 17486.0]
  - - [3584, 1408, 1, 3328, 3584, 3584, 3584, 1408]
    - [21, 19416.0]
  - - [704, 3584, 1, 1280, 704, 704, 704, 3584]
    - [38, 16905.0]
  - - [2944, 6784, 1, 1280, 2944, 2944, 2944, 6784]
    - [37, 20705.0]
  - - [1856, 6784, 1, 256, 1856, 1856, 1856, 6784]
    - [5, 18570.0]
  - - [4288, 448, 1, 3328, 4288, 4288, 4288, 448]
    - [33, 17769.0]
  - - [6784, 4288, 1, 128, 6784, 6784, 6784, 4288]
    - [33, 19550.0]
  - - [6784, 704, 1, 1280, 6784, 6784, 6784, 704]
    - [33, 18648.0]
  - - [5888, 1024, 1, 3328, 5888, 5888, 5888, 1024]
    - [20, 19200.0]
  - - [704, 6784, 1, 1280, 704, 704, 704, 6784]
    - [38, 18099.0]
  - - [1856, 5056, 1, 3328, 1856, 1856, 1856, 5056]
    - [1, 19378.0]
  - - [1024, 3584, 1, 128, 1024, 1024, 1024, 3584]
    - [33, 17322.0]
  - - [1024, 1408, 1, 128, 1024, 1024, 1024, 1408]
    - [0, 15177.0]
  - - [2368, 2944, 1, 128, 2368, 2368, 2368, 2944]
    - [17, 17918.0]
  - - [5056, 2944, 1, 128, 5056, 5056, 5056, 2944]
    - [5, 18999.0]
  - - [5888, 5056, 1, 3328, 5888, 5888, 5888, 5056]
    - [21, 20409.0]
  - - [1408, 2368, 1, 128, 1408, 1408, 1408, 2368]
    - [33, 16842.0]
  - - [5888, 2368, 1, 128, 5888, 5888, 5888, 2368]
    - [33, 19153.0]
  - - [3584, 6784, 1, 1280, 3584, 3584, 3584, 6784]
    - [37, 20463.0]
  - - [3072, 7435, 1, 1024, 3072, 3072, 3072, 7435]
    - [21, 20118.0]
  - - [1856, 5888, 1, 256, 1856, 1856, 1856, 5888]
    - [9, 18503.0]
  - - [4288, 4288, 1, 3328, 4288, 4288, 4288, 4288]
    - [37, 19766.0]
  - - [4288, 1408, 1, 1280, 4288, 4288, 4288, 1408]
    - [3, 19091.0]
  - - [3584, 5056, 1, 128, 3584, 3584, 3584, 5056]
    - [17, 19329.0]
  - - [4288, 2368, 1, 256, 4288, 4288, 4288, 2368]
    - [34, 18974.0]
  - - [2944, 5056, 1, 1280, 2944, 2944, 2944, 5056]
    - [37, 20121.0]
  - - [448, 6784, 1, 256, 448, 448, 448, 6784]
    - [5, 15879.0]
  - - [6784, 2368, 1, 3328, 6784, 6784, 6784, 2368]
    - [4, 20248.0]
  - - [4288, 1856, 1, 3328, 4288, 4288, 4288, 1856]
    - [20, 19107.0]
  - - [3584, 448, 1, 128, 3584, 3584, 3584, 448]
    - [33, 14914.0]
  - - [3584, 1024, 1, 1280, 3584, 3584, 3584, 1024]
    - [17, 18604.0]
  - - [1856, 5056, 1, 256, 1856, 1856, 1856, 5056]
    - [33, 18753.0]
  - - [1024, 4288, 1, 256, 1024, 1024, 1024, 4288]
    - [17, 18816.0]
  - - [5888, 3584, 1, 3328, 5888, 5888, 5888, 3584]
    - [4, 20793.0]
  - - [5056, 3584, 1, 3328, 5056, 5056, 5056, 3584]
    - [37, 20104.0]
  - - [2368, 1408, 1, 1280, 2368, 2368, 2368, 1408]
    - [38, 18651.0]
  - - [5056, 2944, 1, 1280, 5056, 5056, 5056, 2944]
    - [1, 20100.0]
  - - [1024, 6784, 1, 256, 1024, 1024, 1024, 6784]
    - [38, 19381.0]
  - - [2944, 1408, 1, 128, 2944, 2944, 2944, 1408]
    - [17, 17408.0]
  - - [5056, 6784, 1, 3328, 5056, 5056, 5056, 6784]
    - [37, 20699.0]
  - - [3584, 4288, 1, 256, 3584, 3584, 3584, 4288]
    - [24, 19312.0]
  - - [1856, 6784, 1, 3328, 1856, 1856, 1856, 6784]
    - [37, 19313.0]
  - - [5888, 4288, 1, 256, 5888, 5888, 5888, 4288]
    - [1, 19706.0]
  - - [5056, 1408, 1, 256, 5056, 5056, 5056, 1408]
    - [9, 18585.0]
  - - [3584, 1024, 1, 256, 3584, 3584, 3584, 1024]
    - [33, 18075.0]
  - - [5888, 5888, 1, 256, 5888, 5888, 5888, 5888]
    - [1, 20388.0]
  - - [4288, 1024, 1, 1280, 4288, 4288, 4288, 1024]
    - [5, 18607.0]
  - - [448, 6784, 1, 3328, 448, 448, 448, 6784]
    - [22, 17257.0]
  - - [2944, 1408, 1, 1280, 2944, 2944, 2944, 1408]
    - [33, 18316.0]
  - - [2944, 1856, 1, 3328, 2944, 2944, 2944, 1856]
    - [33, 19224.0]
  - - [2944, 2944, 1, 128, 2944, 2944, 2944, 2944]
    - [22, 19009.0]
  - - [3584, 5888, 1, 1280, 3584, 3584, 3584, 5888]
    - [37, 20673.0]
  - - [6784, 1856, 1, 1280, 6784, 6784, 6784, 1856]
    - [20, 19724.0]
  - - [2944, 5056, 1, 256, 2944, 2944, 2944, 5056]
    - [1, 19491.0]
  - - [2944, 5888, 1, 1280, 2944, 2944, 2944, 5888]
    - [21, 20370.0]
  - - [5888, 256, 1, 3328, 5888, 5888, 5888, 256]
    - [47, 16743.0]
  - - [1856, 5888, 1, 3328, 1856, 1856, 1856, 5888]
    - [37, 19234.0]
  - - [3584, 1408, 1, 256, 3584, 3584, 3584, 1408]
    - [38, 18487.0]
  - - [704, 3584, 1, 3328, 704, 704, 704, 3584]
    - [38, 17078.0]
  - - [5056, 448, 1, 1280, 5056, 5056, 5056, 448]
    - [33, 18216.0]
  - - [3584, 1856, 1, 3328, 3584, 3584, 3584, 1856]
    - [33, 19373.0]
  - - [2944, 1024, 1, 256, 2944, 2944, 2944, 1024]
    - [17, 17476.0]
  - - [1024, 2368, 1, 128, 1024, 1024, 1024, 2368]
    - [33, 16015.0]
  - - [2368, 4288, 1, 3328, 2368, 2368, 2368, 4288]
    - [37, 19819.0]
  - - [1024, 1408, 1, 1280, 1024, 1024, 1024, 1408]
    - [33, 18019.0]
  - - [6784, 5056, 1, 256, 6784, 6784, 6784, 5056]
    - [4, 20099.0]
  - - [448, 6784, 1, 128, 448, 448, 448, 6784]
    - [17, 14647.0]
  - - [2944, 6784, 1, 256, 2944, 2944, 2944, 6784]
    - [4, 20304.0]
  - - [2368, 2368, 1, 1280, 2368, 2368, 2368, 2368]
    - [0, 18654.0]
  - - [1856, 3584, 1, 1280, 1856, 1856, 1856, 3584]
    - [34, 19095.0]
  - - [3584, 1408, 1, 1280, 3584, 3584, 3584, 1408]
    - [21, 19288.0]
  - - [4288, 448, 1, 128, 4288, 4288, 4288, 448]
    - [17, 14813.0]
  - - [5056, 256, 1, 1280, 5056, 5056, 5056, 256]
    - [17, 15989.0]
  - - [1856, 1408, 1, 3328, 1856, 1856, 1856, 1408]
    - [38, 17718.0]
  - - [1024, 4288, 1, 3328, 1024, 1024, 1024, 4288]
    - [17, 19458.0]
  - - [5056, 448, 1, 256, 5056, 5056, 5056, 448]
    - [0, 17085.0]
  - - [2944, 2368, 1, 3328, 2944, 2944, 2944, 2368]
    - [3, 19514.0]
  - - [1024, 1856, 1, 1280, 1024, 1024, 1024, 1856]
    - [33, 17522.0]
  - - [6784, 1856, 1, 256, 6784, 6784, 6784, 1856]
    - [33, 19483.0]
  - - [1024, 5888, 1, 256, 1024, 1024, 1024, 5888]
    - [33, 18750.0]
  - - [1408, 2368, 1, 256, 1408, 1408, 1408, 2368]
    - [17, 17775.0]
  - - [1408, 1408, 1, 256, 1408, 1408, 1408, 1408]
    - [0, 17381.0]
  - - [2368, 2368, 1, 128, 2368, 2368, 2368, 2368]
    - [0, 17679.0]
  - - [6784, 1408, 1, 128, 6784, 6784, 6784, 1408]
    - [33, 18874.0]
  - - [4288, 5888, 1, 256, 4288, 4288, 4288, 5888]
    - [1, 19863.0]
  - - [1408, 5056, 1, 256, 1408, 1408, 1408, 5056]
    - [17, 18761.0]
  - - [4288, 3584, 1, 128, 4288, 4288, 4288, 3584]
    - [17, 19076.0]
  - - [3584, 5056, 1, 1280, 3584, 3584, 3584, 5056]
    - [46, 19979.0]
  - - [1856, 1024, 1, 128, 1856, 1856, 1856, 1024]
    - [33, 14498.0]
  - - [704, 4288, 1, 256, 704, 704, 704, 4288]
    - [5, 15987.0]
  - - [5888, 2368, 1, 1280, 5888, 5888, 5888, 2368]
    - [37, 19649.0]
  - - [2368, 5888, 1, 1280, 2368, 2368, 2368, 5888]
    - [37, 19614.0]
  - - [5888, 256, 1, 1280, 5888, 5888, 5888, 256]
    - [22, 16607.0]
  - - [2368, 1856, 1, 3328, 2368, 2368, 2368, 1856]
    - [1, 18875.0]
  - - [2944, 704, 1, 256, 2944, 2944, 2944, 704]
    - [17, 16336.0]
  - - [704, 3584, 1, 256, 704, 704, 704, 3584]
    - [38, 15785.0]
  - - [704, 2944, 1, 3328, 704, 704, 704, 2944]
    - [5, 17516.0]
  - - [6784, 1024, 1, 128, 6784, 6784, 6784, 1024]
    - [22, 18879.0]
  - - [2944, 1024, 1, 3328, 2944, 2944, 2944, 1024]
    - [0, 18114.0]
  - - [2944, 5056, 1, 128, 2944, 2944, 2944, 5056]
    - [33, 19280.0]
  - - [1408, 6784, 1, 256, 1408, 1408, 1408, 6784]
    - [34, 19221.0]
  - - [6784, 1408, 1, 3328, 6784, 6784, 6784, 1408]
    - [4, 19745.0]
  - - [4288, 6784, 1, 128, 4288, 4288, 4288, 6784]
    - [34, 19263.0]
  - - [6784, 2944, 1, 1280, 6784, 6784, 6784, 2944]
    - [37, 20758.0]
  - - [4288, 1856, 1, 128, 4288, 4288, 4288, 1856]
    - [9, 18062.0]
  - - [1856, 2944, 1, 128, 1856, 1856, 1856, 2944]
    - [0, 17372.0]
  - - [6784, 448, 1, 128, 6784, 6784, 6784, 448]
    - [17, 16899.0]
  - - [448, 5056, 1, 1280, 448, 448, 448, 5056]
    - [36, 16254.0]
  - - [2368, 1856, 1, 128, 2368, 2368, 2368, 1856]
    - [9, 16965.0]
  - - [4288, 704, 1, 256, 4288, 4288, 4288, 704]
    - [9, 16918.0]
  - - [5888, 704, 1, 256, 5888, 5888, 5888, 704]
    - [33, 17943.0]
  - - [3584, 1024, 1, 128, 3584, 3584, 3584, 1024]
    - [33, 17463.0]
  - - [256, 5888, 1, 3328, 256, 256, 256, 5888]
    - [22, 16835.0]
  - - [1408, 4288, 1, 3328, 1408, 1408, 1408, 4288]
    - [20, 19257.0]
  - - [6784, 4288, 1, 256, 6784, 6784, 6784, 4288]
    - [18, 19805.0]
  - - [5888, 256, 1, 256, 5888, 5888, 5888, 256]
    - [22, 15276.0]
  - - [6784, 1024, 1, 1280, 6784, 6784, 6784, 1024]
    - [21, 20059.0]
  - - [5888, 1024, 1, 128, 5888, 5888, 5888, 1024]
    - [33, 18340.0]
  - - [6784, 3584, 1, 1280, 6784, 6784, 6784, 3584]
    - [37, 20472.0]
  - - [1024, 6784, 1, 1280, 1024, 1024, 1024, 6784]
    - [1, 20011.0]
  - - [1408, 2944, 1, 1280, 1408, 1408, 1408, 2944]
    - [33, 18378.0]
  - - [1408, 2368, 1, 3328, 1408, 1408, 1408, 2368]
    - [22, 18904.0]
  - - [2944, 1856, 1, 128, 2944, 2944, 2944, 1856]
    - [33, 18271.0]
  - - [256, 6784, 1, 128, 256, 256, 256, 6784]
    - [33, 16179.0]
  - - [5056, 6784, 1, 128, 5056, 5056, 5056, 6784]
    - [38, 19579.0]
  - - [4288, 5056, 1, 128, 4288, 4288, 4288, 5056]
    - [0, 19080.0]
  - - [1856, 5888, 1, 128, 1856, 1856, 1856, 5888]
    - [0, 18276.0]
  - - [2944, 5888, 1, 256, 2944, 2944, 2944, 5888]
    - [1, 19953.0]
  - - [3584, 1856, 1, 256, 3584, 3584, 3584, 1856]
    - [0, 18967.0]
  - - [4288, 3584, 1, 1280, 4288, 4288, 4288, 3584]
    - [1, 20032.0]
  - - [704, 4288, 1, 3328, 704, 704, 704, 4288]
    - [38, 17156.0]
  - - [704, 5888, 1, 128, 704, 704, 704, 5888]
    - [38, 16088.0]
  - - [6784, 3584, 1, 128, 6784, 6784, 6784, 3584]
    - [1, 19593.0]
  - - [4288, 5056, 1, 3328, 4288, 4288, 4288, 5056]
    - [37, 20217.0]
  - - [1408, 1408, 1, 128, 1408, 1408, 1408, 1408]
    - [33, 15454.0]
  - - [5056, 2368, 1, 256, 5056, 5056, 5056, 2368]
    - [24, 19004.0]
  - - [4288, 704, 1, 3328, 4288, 4288, 4288, 704]
    - [0, 18068.0]
  - - [448, 3584, 1, 256, 448, 448, 448, 3584]
    - [17, 13943.0]
  - - [2368, 1024, 1, 1280, 2368, 2368, 2368, 1024]
    - [33, 17404.0]
  - - [2944, 1408, 1, 3328, 2944, 2944, 2944, 1408]
    - [17, 18456.0]
  - - [1024, 1408, 1, 3328, 1024, 1024, 1024, 1408]
    - [33, 18260.0]
  - - [2560, 7133, 1, 2560, 2560, 2560, 2560, 7133]
    - [4, 20205.0]
  - - [5888, 3584, 1, 256, 5888, 5888, 5888, 3584]
    - [34, 20102.0]
  - - [1408, 1856, 1, 3328, 1408, 1408, 1408, 1856]
    - [3, 18911.0]
  - - [6784, 1408, 1, 1280, 6784, 6784, 6784, 1408]
    - [37, 19677.0]
  - - [704, 2944, 1, 256, 704, 704, 704, 2944]
    - [5, 16137.0]
  - - [704, 4288, 1, 128, 704, 704, 704, 4288]
    - [22, 14907.0]
  - - [2368, 4288, 1, 128, 2368, 2368, 2368, 4288]
    - [0, 18389.0]
  - - [1024, 6784, 1, 128, 1024, 1024, 1024, 6784]
    - [22, 18720.0]
  - - [1408, 1408, 1, 1280, 1408, 1408, 1408, 1408]
    - [33, 18287.0]
  - - [448, 4288, 1, 3328, 448, 448, 448, 4288]
    - [47, 16207.0]
  - - [2368, 1408, 1, 256, 2368, 2368, 2368, 1408]
    - [22, 17745.0]
  - - [5888, 5056, 1, 128, 5888, 5888, 5888, 5056]
    - [24, 19543.0]
  - - [704, 2368, 1, 256, 704, 704, 704, 2368]
    - [17, 14360.0]
  - - [5888, 2368, 1, 3328, 5888, 5888, 5888, 2368]
    - [3, 19726.0]
  - - [4288, 448, 1, 1280, 4288, 4288, 4288, 448]
    - [17, 17392.0]
  - - [5888, 704, 1, 3328, 5888, 5888, 5888, 704]
    - [20, 18494.0]
  - - [5056, 256, 1, 128, 5056, 5056, 5056, 256]
    - [9, 12764.0]
  - - [1408, 5888, 1, 128, 1408, 1408, 1408, 5888]
    - [33, 18630.0]
  - - [1408, 1024, 1, 256, 1408, 1408, 1408, 1024]
    - [33, 16792.0]
  - - [1024, 1856, 1, 128, 1024, 1024, 1024, 1856]
    - [17, 15655.0]
  - - [5056, 6784, 1, 1280, 5056, 5056, 5056, 6784]
    - [37, 20648.0]
  - - [704, 5056, 1, 3328, 704, 704, 704, 5056]
    - [38, 17367.0]
  - - [3584, 5056, 1, 3328, 3584, 3584, 3584, 5056]
    - [4, 20070.0]
  - - [2368, 2944, 1, 3328, 2368, 2368, 2368, 2944]
    - [13, 18712.0]
  - - [2368, 3584, 1, 256, 2368, 2368, 2368, 3584]
    - [1, 18906.0]
  - - [5056, 3584, 1, 1280, 5056, 5056, 5056, 3584]
    - [1, 19973.0]
  - - [1856, 2944, 1, 1280, 1856, 1856, 1856, 2944]
    - [37, 18703.0]
  - - [3584, 2368, 1, 1280, 3584, 3584, 3584, 2368]
    - [37, 19634.0]
  - - [2944, 1408, 1, 256, 2944, 2944, 2944, 1408]
    - [33, 17919.0]
  - - [4288, 1408, 1, 3328, 4288, 4288, 4288, 1408]
    - [0, 19209.0]
  - - [2944, 1024, 1, 128, 2944, 2944, 2944, 1024]
    - [33, 16777.0]
  - - [4288, 5056, 1, 1280, 4288, 4288, 4288, 5056]
    - [21, 20123.0]
  - - [5888, 6784, 1, 1280, 5888, 5888, 5888, 6784]
    - [37, 20842.0]
  - - [6784, 5056, 1, 128, 6784, 6784, 6784, 5056]
    - [33, 19534.0]
  - - [5888, 1408, 1, 3328, 5888, 5888, 5888, 1408]
    - [21, 19388.0]
  - - [256, 5056, 1, 256, 256, 256, 256, 5056]
    - [33, 15241.0]
  - - [448, 3584, 1, 3328, 448, 448, 448, 3584]
    - [17, 14942.0]
  - - [704, 2368, 1, 128, 704, 704, 704, 2368]
    - [17, 13523.0]
  - - [5888, 256, 1, 128, 5888, 5888, 5888, 256]
    - [33, 14166.0]
  - - [3584, 1856, 1, 128, 3584, 3584, 3584, 1856]
    - [33, 18566.0]
  - - [4288, 4288, 1, 128, 4288, 4288, 4288, 4288]
    - [0, 19011.0]
  - - [1856, 1024, 1, 3328, 1856, 1856, 1856, 1024]
    - [33, 17631.0]
  - - [1024, 5056, 1, 256, 1024, 1024, 1024, 5056]
    - [17, 18736.0]
  - - [2368, 1408, 1, 3328, 2368, 2368, 2368, 1408]
    - [5, 18899.0]
  - - [5888, 448, 1, 256, 5888, 5888, 5888, 448]
    - [33, 16740.0]
  - - [5888, 6784, 1, 128, 5888, 5888, 5888, 6784]
    - [1, 19927.0]
  - - [6784, 5056, 1, 1280, 6784, 6784, 6784, 5056]
    - [37, 20593.0]
  - - [5056, 704, 1, 1280, 5056, 5056, 5056, 704]
    - [33, 17927.0]
  - - [4288, 6784, 1, 1280, 4288, 4288, 4288, 6784]
    - [37, 20216.0]
  - - [6784, 1408, 1, 256, 6784, 6784, 6784, 1408]
    - [33, 19062.0]
  - - [3584, 5888, 1, 128, 3584, 3584, 3584, 5888]
    - [38, 19713.0]
  - - [5056, 5888, 1, 256, 5056, 5056, 5056, 5888]
    - [1, 19910.0]
  - - [2368, 1024, 1, 256, 2368, 2368, 2368, 1024]
    - [0, 16293.0]
  - - [2944, 1856, 1, 256, 2944, 2944, 2944, 1856]
    - [0, 18731.0]
  - - [1856, 6784, 1, 1280, 1856, 1856, 1856, 6784]
    - [1, 19269.0]
  - - [4288, 3584, 1, 256, 4288, 4288, 4288, 3584]
    - [1, 19388.0]
  - - [5056, 1856, 1, 1280, 5056, 5056, 5056, 1856]
    - [4, 19252.0]
  - - [1408, 1024, 1, 3328, 1408, 1408, 1408, 1024]
    - [33, 18246.0]
  - - [5888, 3584, 1, 1280, 5888, 5888, 5888, 3584]
    - [37, 20698.0]
  - - [1856, 3584, 1, 3328, 1856, 1856, 1856, 3584]
    - [37, 19272.0]
  - - [1024, 2944, 1, 256, 1024, 1024, 1024, 2944]
    - [33, 17405.0]
  - - [448, 6784, 1, 1280, 448, 448, 448, 6784]
    - [22, 17104.0]
  - - [704, 5056, 1, 256, 704, 704, 704, 5056]
    - [38, 16507.0]
  - - [3584, 1024, 1, 3328, 3584, 3584, 3584, 1024]
    - [0, 18698.0]
  - - [2944, 1856, 1, 1280, 2944, 2944, 2944, 1856]
    - [33, 19129.0]
  - - [5056, 256, 1, 256, 5056, 5056, 5056, 256]
    - [9, 14558.0]
  - - [2368, 3584, 1, 3328, 2368, 2368, 2368, 3584]
    - [21, 19818.0]
  - - [2944, 704, 1, 1280, 2944, 2944, 2944, 704]
    - [38, 17274.0]
  - - [2944, 3584, 1, 1280, 2944, 2944, 2944, 3584]
    - [37, 20485.0]
  - - [1856, 5888, 1, 1280, 1856, 1856, 1856, 5888]
    - [1, 19141.0]
  - - [5056, 448, 1, 3328, 5056, 5056, 5056, 448]
    - [33, 18475.0]
  - - [4288, 1408, 1, 256, 4288, 4288, 4288, 1408]
    - [9, 18640.0]
  - - [5888, 1408, 1, 128, 5888, 5888, 5888, 1408]
    - [33, 18584.0]
  - - [4288, 2368, 1, 1280, 4288, 4288, 4288, 2368]
    - [37, 19688.0]
  - - [6784, 2368, 1, 256, 6784, 6784, 6784, 2368]
    - [1, 19552.0]
  - - [4288, 1856, 1, 256, 4288, 4288, 4288, 1856]
    - [9, 18630.0]
  - - [1856, 2944, 1, 256, 1856, 1856, 1856, 2944]
    - [22, 17979.0]
  - - [5056, 1024, 1, 128, 5056, 5056, 5056, 1024]
    - [5, 18256.0]
  - - [1760, 7133, 1, 1760, 1760, 1760, 1760, 7133]
    - [1, 20031.0]
  - - [6784, 256, 1, 128, 6784, 6784, 6784, 256]
    - [38, 16016.0]
  - - [5888, 704, 1, 128, 5888, 5888, 5888, 704]
    - [17, 17419.0]
  - - [1024, 4288, 1, 1280, 1024, 1024, 1024, 4288]
    - [0, 19385.0]
  - - [2368, 5056, 1, 3328, 2368, 2368, 2368, 5056]
    - [20, 19248.0]
  - - [4288, 1024, 1, 3328, 4288, 4288, 4288, 1024]
    - [5, 18842.0]
  - - [1024, 5056, 1, 3328, 1024, 1024, 1024, 5056]
    - [34, 19772.0]
  - - [1024, 1856, 1, 3328, 1024, 1024, 1024, 1856]
    - [33, 17662.0]
  - - [704, 6784, 1, 128, 704, 704, 704, 6784]
    - [33, 16549.0]
  - - [4288, 6784, 1, 256, 4288, 4288, 4288, 6784]
    - [1, 19811.0]
  - - [3584, 2944, 1, 3328, 3584, 3584, 3584, 2944]
    - [37, 20563.0]
  - - [5888, 2944, 1, 256, 5888, 5888, 5888, 2944]
    - [34, 19807.0]
  - - [2368, 6784, 1, 128, 2368, 2368, 2368, 6784]
    - [38, 19015.0]
  - - [448, 4288, 1, 1280, 448, 448, 448, 4288]
    - [5, 15919.0]
  - - [5056, 4288, 1, 256, 5056, 5056, 5056, 4288]
    - [43, 19673.0]
  - - [1024, 3584, 1, 256, 1024, 1024, 1024, 3584]
    - [33, 18089.0]
  - - [1856, 5056, 1, 128, 1856, 1856, 1856, 5056]
    - [9, 18019.0]
  - - [6784, 6784, 1, 3328, 6784, 6784, 6784, 6784]
    - [21, 20832.0]
  - - [448, 5888, 1, 1280, 448, 448, 448, 5888]
    - [17, 15694.0]
  - - [5056, 448, 1, 128, 5056, 5056, 5056, 448]
    - [9, 15878.0]
  - - [3584, 2944, 1, 128, 3584, 3584, 3584, 2944]
    - [38, 19405.0]
  - - [6784, 256, 1, 1280, 6784, 6784, 6784, 256]
    - [5, 19094.0]
  - - [2368, 5888, 1, 3328, 2368, 2368, 2368, 5888]
    - [21, 19720.0]
  - - [2368, 1856, 1, 1280, 2368, 2368, 2368, 1856]
    - [22, 18607.0]
  - - [3584, 4288, 1, 128, 3584, 3584, 3584, 4288]
    - [42, 19158.0]
  - - [5888, 4288, 1, 3328, 5888, 5888, 5888, 4288]
    - [14, 20358.0]
  - - [2368, 704, 1, 256, 2368, 2368, 2368, 704]
    - [17, 15644.0]
  - - [3584, 1408, 1, 128, 3584, 3584, 3584, 1408]
    - [22, 17952.0]
  - - [1856, 5056, 1, 1280, 1856, 1856, 1856, 5056]
    - [18, 19237.0]
  - - [2944, 1024, 1, 1280, 2944, 2944, 2944, 1024]
    - [33, 17986.0]
  - - [3584, 5888, 1, 3328, 3584, 3584, 3584, 5888]
    - [37, 20764.0]
  - - [2368, 4288, 1, 256, 2368, 2368, 2368, 4288]
    - [22, 18722.0]
  - - [1024, 2368, 1, 3328, 1024, 1024, 1024, 2368]
    - [36, 17627.0]
  - - [6784, 1856, 1, 3328, 6784, 6784, 6784, 1856]
    - [45, 19796.0]
  - - [1024, 2944, 1, 128, 1024, 1024, 1024, 2944]
    - [0, 16309.0]
  - - [1024, 3584, 1, 1280, 1024, 1024, 1024, 3584]
    - [33, 18587.0]
  - - [4288, 5888, 1, 3328, 4288, 4288, 4288, 5888]
    - [21, 20371.0]
  - - [1024, 2944, 1, 3328, 1024, 1024, 1024, 2944]
    - [9, 18068.0]
  - - [3584, 6784, 1, 256, 3584, 3584, 3584, 6784]
    - [34, 20014.0]
  - - [256, 6784, 1, 1280, 256, 256, 256, 6784]
    - [22, 18858.0]
  - - [1856, 3584, 1, 256, 1856, 1856, 1856, 3584]
    - [5, 18530.0]
  - - [6784, 1856, 1, 128, 6784, 6784, 6784, 1856]
    - [33, 19228.0]
  - - [2944, 704, 1, 128, 2944, 2944, 2944, 704]
    - [33, 15496.0]
  - - [256, 5888, 1, 1280, 256, 256, 256, 5888]
    - [47, 16641.0]
  - - [4288, 6784, 1, 3328, 4288, 4288, 4288, 6784]
    - [46, 20304.0]
  - - [7680, 5481, 1, 2560, 7680, 7680, 7680, 5481]
    - [37, 20795.0]
  - - [2368, 1408, 1, 128, 2368, 2368, 2368, 1408]
    - [2, 16117.0]
  - - [1408, 1024, 1, 128, 1408, 1408, 1408, 1024]
    - [33, 15431.0]
  - - [6784, 3584, 1, 3328, 6784, 6784, 6784, 3584]
    - [37, 20545.0]
  - - [2368, 5056, 1, 1280, 2368, 2368, 2368, 5056]
    - [17, 19161.0]
  - - [1408, 2368, 1, 1280, 1408, 1408, 1408, 2368]
    - [38, 18682.0]
  - - [2944, 4288, 1, 128, 2944, 2944, 2944, 4288]
    - [33, 19236.0]
  - - [2944, 2944, 1, 256, 2944, 2944, 2944, 2944]
    - [18, 19528.0]
  - - [6784, 256, 1, 256, 6784, 6784, 6784, 256]
    - [5, 17685.0]
  - - [256, 5056, 1, 3328, 256, 256, 256, 5056]
    - [33, 16446.0]
  - - [5056, 1856, 1, 128, 5056, 5056, 5056, 1856]
    - [17, 18473.0]
  - - [5888, 1408, 1, 256, 5888, 5888, 5888, 1408]
    - [0, 18889.0]
  - - [4288, 3584, 1, 3328, 4288, 4288, 4288, 3584]
    - [4, 20097.0]
  - - [1024, 2368, 1, 1280, 1024, 1024, 1024, 2368]
    - [17, 17378.0]
  - - [5888, 6784, 1, 3328, 5888, 5888, 5888, 6784]
    - [37, 20904.0]
  - - [704, 4288, 1, 1280, 704, 704, 704, 4288]
    - [5, 16919.0]
  - - [6784, 448, 1, 3328, 6784, 6784, 6784, 448]
    - [33, 18224.0]
  - - [4288, 1024, 1, 128, 4288, 4288, 4288, 1024]
    - [0, 17062.0]
  - - [196, 256, 256, 1024, 196, 196, 196, 256]
    - [4, 15443.0]
  - - [784, 512, 256, 128, 784, 784, 784, 512]
    - [0, 16756.0]
  - - [784, 128, 128, 512, 784, 784, 784, 128]
    - [22, 16839.0]
  - - [3136, 256, 256, 64, 3136, 3136, 3136, 256]
    - [0, 10082.0]
  - - [784, 128, 256, 512, 784, 784, 784, 128]
    - [33, 17074.0]
  - - [196, 256, 128, 1024, 196, 196, 196, 256]
    - [3, 14704.0]
  - - [3136, 256, 128, 64, 3136, 3136, 3136, 256]
    - [0, 11077.0]
  - - [784, 512, 128, 128, 784, 784, 784, 512]
    - [17, 15910.0]
  - - [196, 1024, 128, 256, 196, 196, 196, 1024]
    - [17, 15030.0]
  - - [196, 1024, 256, 256, 196, 196, 196, 1024]
    - [17, 15136.0]
  - - [5329, 160, 64, 64, 5329, 5329, 5329, 160]
    - [0, 7550.0]
  - - [1225, 384, 64, 192, 1225, 1225, 1225, 384]
    - [17, 18282.0]
  - - [289, 1024, 64, 256, 289, 289, 289, 1024]
    - [22, 14868.0]
  - - [1225, 384, 64, 64, 1225, 1225, 1225, 384]
    - [0, 15328.0]
  - - [1225, 384, 64, 96, 1225, 1225, 1225, 384]
    - [0, 14647.0]
  - - [289, 1024, 64, 384, 289, 289, 289, 1024]
    - [1, 15079.0]
  - - [289, 1024, 64, 192, 289, 289, 289, 1024]
    - [5, 14752.0]
  - - [289, 1024, 64, 128, 289, 289, 289, 1024]
    - [17, 14493.0]
  - - [4096, 1024, 1, 2984, 4096, 4096, 4096, 1024]
    - [33, 18596.0]
  - - [1024, 4096, 1, 3437, 1024, 1024, 1024, 4096]
    - [33, 18603.0]
  - - [1024, 4096, 1, 3235, 1024, 1024, 1024, 4096]
    - [0, 18593.0]
  - - [4096, 1024, 1, 4032, 4096, 4096, 4096, 1024]
    - [33, 18603.0]
  - - [1024, 4096, 1, 3334, 1024, 1024, 1024, 4096]
    - [33, 18631.0]
  - - [4096, 1024, 1, 3288, 4096, 4096, 4096, 1024]
    - [17, 18648.0]
  - - [1024, 4096, 1, 3515, 1024, 1024, 1024, 4096]
    - [17, 18586.0]
  - - [4096, 1024, 1, 3437, 4096, 4096, 4096, 1024]
    - [42, 18614.0]
  - - [1024, 4096, 1, 3259, 1024, 1024, 1024, 4096]
    - [33, 18594.0]
  - - [1024, 4096, 1, 3384, 1024, 1024, 1024, 4096]
    - [33, 18602.0]
  - - [4096, 1024, 1, 3458, 4096, 4096, 4096, 1024]
    - [24, 18610.0]
  - - [1024, 4096, 1, 3412, 1024, 1024, 1024, 4096]
    - [33, 18635.0]
  - - [1024, 4096, 1, 3529, 1024, 1024, 1024, 4096]
    - [9, 18595.0]
  - - [1024, 4096, 1, 4032, 1024, 1024, 1024, 4096]
    - [33, 18614.0]
  - - [4096, 1024, 1, 3999, 4096, 4096, 4096, 1024]
    - [17, 18604.0]
  - - [1024, 4096, 1, 3079, 1024, 1024, 1024, 4096]
    - [17, 18581.0]
  - - [1024, 4096, 1, 3876, 1024, 1024, 1024, 4096]
    - [17, 18597.0]
  - - [1024, 4096, 1, 3450, 1024, 1024, 1024, 4096]
    - [33, 18591.0]
  - - [1024, 4096, 1, 3256, 1024, 1024, 1024, 4096]
    - [17, 18608.0]
  - - [4096, 1024, 1, 3403, 4096, 4096, 4096, 1024]
    - [17, 18629.0]
  - - [1024, 4096, 1, 3359, 1024, 1024, 1024, 4096]
    - [24, 18604.0]
  - - [4096, 1024, 1, 3549, 4096, 4096, 4096, 1024]
    - [33, 18598.0]
  - - [4096, 1024, 1, 3176, 4096, 4096, 4096, 1024]
    - [33, 18625.0]
  - - [1024, 4096, 1, 3504, 1024, 1024, 1024, 4096]
    - [42, 18608.0]
  - - [4096, 1024, 1, 3314, 4096, 4096, 4096, 1024]
    - [33, 18607.0]
  - - [4096, 1024, 1, 3183, 4096, 4096, 4096, 1024]
    - [17, 18575.0]
  - - [1024, 4096, 1, 3209, 1024, 1024, 1024, 4096]
    - [0, 18615.0]
  - - [1024, 4096, 1, 3720, 1024, 1024, 1024, 4096]
    - [0, 18637.0]
  - - [1024, 4096, 1, 3859, 1024, 1024, 1024, 4096]
    - [17, 18616.0]
  - - [1024, 33708, 1, 4059, 1024, 1024, 1024, 33708]
    - [4, 20849.0]
  - - [4096, 1024, 1, 3477, 4096, 4096, 4096, 1024]
    - [24, 18588.0]
  - - [4096, 1024, 1, 3233, 4096, 4096, 4096, 1024]
    - [17, 18590.0]
  - - [4096, 1024, 1, 3409, 4096, 4096, 4096, 1024]
    - [33, 18591.0]
  - - [4096, 1024, 1, 3564, 4096, 4096, 4096, 1024]
    - [0, 18606.0]
  - - [4096, 1024, 1, 3190, 4096, 4096, 4096, 1024]
    - [17, 18626.0]
  - - [1024, 4096, 1, 3288, 1024, 1024, 1024, 4096]
    - [33, 18603.0]
  - - [4096, 1024, 1, 3451, 4096, 4096, 4096, 1024]
    - [0, 18590.0]
  - - [1024, 4096, 1, 3348, 1024, 1024, 1024, 4096]
    - [9, 18597.0]
  - - [1024, 4096, 1, 3465, 1024, 1024, 1024, 4096]
    - [0, 18605.0]
  - - [1024, 33708, 1, 4032, 1024, 1024, 1024, 33708]
    - [21, 20870.0]
  - - [1024, 33708, 1, 3840, 1024, 1024, 1024, 33708]
    - [4, 20855.0]
  - - [4096, 1024, 1, 3391, 4096, 4096, 4096, 1024]
    - [33, 18593.0]
  - - [1024, 4096, 1, 3530, 1024, 1024, 1024, 4096]
    - [33, 18585.0]
  - - [4096, 1024, 1, 3209, 4096, 4096, 4096, 1024]
    - [33, 18603.0]
  - - [1024, 4096, 1, 3457, 1024, 1024, 1024, 4096]
    - [33, 18627.0]
  - - [1024, 4096, 1, 3386, 1024, 1024, 1024, 4096]
    - [0, 18595.0]
  - - [4096, 1024, 1, 3350, 4096, 4096, 4096, 1024]
    - [17, 18587.0]
  - - [1024, 4096, 1, 3184, 1024, 1024, 1024, 4096]
    - [17, 18595.0]
  - - [1024, 4096, 1, 3093, 1024, 1024, 1024, 4096]
    - [0, 18621.0]
  - - [1024, 4096, 1, 3400, 1024, 1024, 1024, 4096]
    - [33, 18607.0]
  - - [1024, 4096, 1, 3214, 1024, 1024, 1024, 4096]
    - [0, 18592.0]
  - - [4096, 1024, 1, 3406, 4096, 4096, 4096, 1024]
    - [17, 18635.0]
  - - [1024, 4096, 1, 3565, 1024, 1024, 1024, 4096]
    - [17, 18600.0]
  - - [4096, 1024, 1, 3536, 4096, 4096, 4096, 1024]
    - [33, 18597.0]
  - - [1024, 4096, 1, 3183, 1024, 1024, 1024, 4096]
    - [17, 18596.0]
  - - [1024, 4096, 1, 3462, 1024, 1024, 1024, 4096]
    - [33, 18598.0]
  - - [4096, 1024, 1, 3130, 4096, 4096, 4096, 1024]
    - [33, 18634.0]
  - - [4096, 1024, 1, 3381, 4096, 4096, 4096, 1024]
    - [17, 18632.0]
  - - [4096, 1024, 1, 3298, 4096, 4096, 4096, 1024]
    - [42, 18624.0]
  - - [1024, 4096, 1, 3292, 1024, 1024, 1024, 4096]
    - [17, 18599.0]
  - - [4096, 1024, 1, 3289, 4096, 4096, 4096, 1024]
    - [33, 18630.0]
  - - [1024, 4096, 1, 3379, 1024, 1024, 1024, 4096]
    - [17, 18632.0]
  - - [1024, 4096, 1, 3990, 1024, 1024, 1024, 4096]
    - [17, 18624.0]
  - - [1024, 4096, 1, 3540, 1024, 1024, 1024, 4096]
    - [33, 18606.0]
  - - [4096, 1024, 1, 3412, 4096, 4096, 4096, 1024]
    - [0, 18610.0]
  - - [1024, 4096, 1, 3555, 1024, 1024, 1024, 4096]
    - [42, 18603.0]
  - - [1024, 4096, 1, 3518, 1024, 1024, 1024, 4096]
    - [0, 18632.0]
  - - [4096, 1024, 1, 3189, 4096, 4096, 4096, 1024]
    - [17, 18591.0]
  - - [1024, 4096, 1, 3298, 1024, 1024, 1024, 4096]
    - [24, 18601.0]
  - - [4096, 1024, 1, 3072, 4096, 4096, 4096, 1024]
    - [0, 18619.0]
  - - [1024, 4096, 1, 3393, 1024, 1024, 1024, 4096]
    - [33, 18600.0]
  - - [1024, 4096, 1, 3207, 1024, 1024, 1024, 4096]
    - [9, 18586.0]
  - - [4096, 1024, 1, 3487, 4096, 4096, 4096, 1024]
    - [17, 18632.0]
  - - [4096, 1024, 1, 3431, 4096, 4096, 4096, 1024]
    - [17, 18636.0]
  - - [4096, 1024, 1, 3378, 4096, 4096, 4096, 1024]
    - [17, 18640.0]
  - - [4096, 1024, 1, 3529, 4096, 4096, 4096, 1024]
    - [33, 18635.0]
  - - [4096, 1024, 1, 3460, 4096, 4096, 4096, 1024]
    - [33, 18639.0]
  - - [1024, 4096, 1, 3336, 1024, 1024, 1024, 4096]
    - [33, 18635.0]
  - - [1024, 4096, 1, 3501, 1024, 1024, 1024, 4096]
    - [17, 18641.0]
  - - [1024, 4096, 1, 3584, 1024, 1024, 1024, 4096]
    - [0, 18639.0]
  - - [4096, 1024, 1, 2499, 4096, 4096, 4096, 1024]
    - [17, 18605.0]
  - - [4096, 1024, 1, 3352, 4096, 4096, 4096, 1024]
    - [33, 18644.0]
  - - [1024, 4096, 1, 3543, 1024, 1024, 1024, 4096]
    - [17, 18619.0]
  - - [1024, 4096, 1, 3476, 1024, 1024, 1024, 4096]
    - [0, 18629.0]
  - - [1024, 33708, 1, 3822, 1024, 1024, 1024, 33708]
    - [4, 20869.0]
  - - [1024, 4096, 1, 3436, 1024, 1024, 1024, 4096]
    - [33, 18584.0]
  - - [1024, 4096, 1, 3594, 1024, 1024, 1024, 4096]
    - [33, 18603.0]
  - - [4096, 1024, 1, 3514, 4096, 4096, 4096, 1024]
    - [33, 18626.0]
  - - [1024, 4096, 1, 3064, 1024, 1024, 1024, 4096]
    - [24, 18608.0]
  - - [4096, 1024, 1, 3371, 4096, 4096, 4096, 1024]
    - [42, 18613.0]
  - - [4096, 1024, 1, 3558, 4096, 4096, 4096, 1024]
    - [33, 18642.0]
  - - [4096, 1024, 1, 3517, 4096, 4096, 4096, 1024]
    - [17, 18601.0]
  - - [4096, 1024, 1, 3144, 4096, 4096, 4096, 1024]
    - [0, 18616.0]
  - - [1024, 4096, 1, 3312, 1024, 1024, 1024, 4096]
    - [24, 18606.0]
  - - [4096, 1024, 1, 3079, 4096, 4096, 4096, 1024]
    - [17, 18619.0]
  - - [1024, 4096, 1, 3415, 1024, 1024, 1024, 4096]
    - [9, 18609.0]
  - - [1024, 4096, 1, 3221, 1024, 1024, 1024, 4096]
    - [17, 18613.0]
  - - [1024, 4096, 1, 3978, 1024, 1024, 1024, 4096]
    - [33, 18599.0]
  - - [4096, 1024, 1, 3876, 4096, 4096, 4096, 1024]
    - [42, 18623.0]
  - - [1024, 4096, 1, 3528, 1024, 1024, 1024, 4096]
    - [24, 18609.0]
  - - [1024, 4096, 1, 3181, 1024, 1024, 1024, 4096]
    - [17, 18625.0]
  - - [4096, 1024, 1, 3445, 4096, 4096, 4096, 1024]
    - [0, 18617.0]
  - - [4096, 1024, 1, 3450, 4096, 4096, 4096, 1024]
    - [17, 18628.0]
  - - [4096, 1024, 1, 3377, 4096, 4096, 4096, 1024]
    - [33, 18647.0]
  - - [1024, 4096, 1, 3532, 1024, 1024, 1024, 4096]
    - [33, 18622.0]
  - - [1024, 33708, 1, 3944, 1024, 1024, 1024, 33708]
    - [21, 20878.0]
  - - [4096, 1024, 1, 3483, 4096, 4096, 4096, 1024]
    - [33, 18630.0]
  - - [1024, 4096, 1, 3358, 1024, 1024, 1024, 4096]
    - [17, 18628.0]
  - - [4096, 1024, 1, 3464, 4096, 4096, 4096, 1024]
    - [33, 18610.0]
  - - [4096, 1024, 1, 3282, 4096, 4096, 4096, 1024]
    - [17, 18623.0]
  - - [4096, 1024, 1, 3256, 4096, 4096, 4096, 1024]
    - [33, 18628.0]
  - - [1024, 4096, 1, 3057, 1024, 1024, 1024, 4096]
    - [17, 18590.0]
  - - [4096, 1024, 1, 3481, 4096, 4096, 4096, 1024]
    - [33, 18631.0]
  - - [4096, 1024, 1, 3340, 4096, 4096, 4096, 1024]
    - [42, 18617.0]
  - - [1024, 4096, 1, 3273, 1024, 1024, 1024, 4096]
    - [33, 18637.0]
  - - [4096, 1024, 1, 3392, 4096, 4096, 4096, 1024]
    - [17, 18636.0]
  - - [4096, 1024, 1, 3337, 4096, 4096, 4096, 1024]
    - [17, 18615.0]
  - - [4096, 1024, 1, 3359, 4096, 4096, 4096, 1024]
    - [33, 18638.0]
  - - [4096, 1024, 1, 3498, 4096, 4096, 4096, 1024]
    - [17, 18626.0]
  - - [4096, 1024, 1, 3169, 4096, 4096, 4096, 1024]
    - [17, 18629.0]
  - - [1024, 33708, 1, 3859, 1024, 1024, 1024, 33708]
    - [37, 20881.0]
  - - [1024, 4096, 1, 3103, 1024, 1024, 1024, 4096]
    - [9, 18583.0]
  - - [4096, 1024, 1, 3900, 4096, 4096, 4096, 1024]
    - [17, 18630.0]
  - - [1024, 4096, 1, 3442, 1024, 1024, 1024, 4096]
    - [17, 18632.0]
  - - [1024, 4096, 1, 3248, 1024, 1024, 1024, 4096]
    - [33, 18646.0]
  - - [1024, 4096, 1, 3351, 1024, 1024, 1024, 4096]
    - [33, 18619.0]
  - - [4096, 1024, 1, 3593, 4096, 4096, 4096, 1024]
    - [17, 18643.0]
  - - [1024, 4096, 1, 3780, 1024, 1024, 1024, 4096]
    - [17, 18648.0]
  - - [1024, 33708, 1, 3681, 1024, 1024, 1024, 33708]
    - [21, 20865.0]
  - - [4096, 1024, 1, 3374, 4096, 4096, 4096, 1024]
    - [17, 18607.0]
  - - [1024, 4096, 1, 3557, 1024, 1024, 1024, 4096]
    - [17, 18635.0]
  - - [4096, 1024, 1, 3906, 4096, 4096, 4096, 1024]
    - [17, 18600.0]
  - - [4096, 1024, 1, 3504, 4096, 4096, 4096, 1024]
    - [33, 18618.0]
  - - [1024, 4096, 1, 3270, 1024, 1024, 1024, 4096]
    - [17, 18616.0]
  - - [4096, 1024, 1, 3098, 4096, 4096, 4096, 1024]
    - [0, 18612.0]
  - - [4096, 1024, 1, 3216, 4096, 4096, 4096, 1024]
    - [24, 18620.0]
  - - [1024, 4096, 1, 3550, 1024, 1024, 1024, 4096]
    - [17, 18637.0]
  - - [4096, 1024, 1, 3449, 4096, 4096, 4096, 1024]
    - [33, 18622.0]
  - - [1024, 4096, 1, 3403, 1024, 1024, 1024, 4096]
    - [33, 18638.0]
  - - [1024, 4096, 1, 3523, 1024, 1024, 1024, 4096]
    - [33, 18634.0]
  - - [1024, 4096, 1, 3486, 1024, 1024, 1024, 4096]
    - [33, 18639.0]
  - - [1024, 4096, 1, 3564, 1024, 1024, 1024, 4096]
    - [0, 18634.0]
  - - [1024, 33708, 1, 4005, 1024, 1024, 1024, 33708]
    - [37, 20869.0]
  - - [4096, 1024, 1, 3296, 4096, 4096, 4096, 1024]
    - [17, 18627.0]
  - - [1024, 4096, 1, 3263, 1024, 1024, 1024, 4096]
    - [42, 18614.0]
  - - [1024, 4096, 1, 3130, 1024, 1024, 1024, 4096]
    - [17, 18627.0]
  - - [1024, 4096, 1, 3295, 1024, 1024, 1024, 4096]
    - [0, 18642.0]
  - - [1024, 33708, 1, 3925, 1024, 1024, 1024, 33708]
    - [4, 20879.0]
  - - [1024, 4096, 1, 3378, 1024, 1024, 1024, 4096]
    - [17, 18621.0]
  - - [4096, 1024, 1, 3720, 4096, 4096, 4096, 1024]
    - [17, 18636.0]
  - - [4096, 1024, 1, 3399, 4096, 4096, 4096, 1024]
    - [42, 18620.0]
  - - [4096, 1024, 1, 3543, 4096, 4096, 4096, 1024]
    - [33, 18645.0]
  - - [4096, 1024, 1, 3497, 4096, 4096, 4096, 1024]
    - [17, 18627.0]
  - - [4096, 1024, 1, 3594, 4096, 4096, 4096, 1024]
    - [33, 18641.0]
  - - [1024, 4096, 1, 3144, 1024, 1024, 1024, 4096]
    - [17, 18642.0]
  - - [1024, 4096, 1, 3975, 1024, 1024, 1024, 4096]
    - [17, 18631.0]
  - - [4096, 1024, 1, 3205, 4096, 4096, 4096, 1024]
    - [33, 18616.0]
  - - [1024, 33708, 1, 3995, 1024, 1024, 1024, 33708]
    - [4, 20864.0]
  - - [1024, 4096, 1, 3392, 1024, 1024, 1024, 4096]
    - [17, 18616.0]
  - - [1024, 4096, 1, 3055, 1024, 1024, 1024, 4096]
    - [17, 18633.0]
  - - [1024, 4096, 1, 4026, 1024, 1024, 1024, 4096]
    - [0, 18614.0]
  - - [4096, 1024, 1, 3557, 4096, 4096, 4096, 1024]
    - [33, 18599.0]
  - - [4096, 1024, 1, 3515, 4096, 4096, 4096, 1024]
    - [33, 18622.0]
  - - [4096, 1024, 1, 3486, 4096, 4096, 4096, 1024]
    - [17, 18630.0]
  - - [4096, 1024, 1, 3457, 4096, 4096, 4096, 1024]
    - [42, 18619.0]
  - - [1024, 4096, 1, 3511, 1024, 1024, 1024, 4096]
    - [17, 18624.0]
  - - [4096, 1024, 1, 3138, 4096, 4096, 4096, 1024]
    - [17, 18624.0]
  - - [1024, 4096, 1, 3339, 1024, 1024, 1024, 4096]
    - [33, 18638.0]
  - - [1024, 4096, 1, 3939, 1024, 1024, 1024, 4096]
    - [17, 18639.0]
  - - [4096, 1024, 1, 3500, 4096, 4096, 4096, 1024]
    - [33, 18638.0]
  - - [4096, 1024, 1, 3395, 4096, 4096, 4096, 1024]
    - [17, 18627.0]
  - - [4096, 1024, 1, 4020, 4096, 4096, 4096, 1024]
    - [33, 18635.0]
  - - [4096, 1024, 1, 3942, 4096, 4096, 4096, 1024]
    - [33, 18644.0]
  - - [4096, 1024, 1, 3349, 4096, 4096, 4096, 1024]
    - [33, 18633.0]
  - - [1024, 4096, 1, 3322, 1024, 1024, 1024, 4096]
    - [33, 18621.0]
  - - [4096, 1024, 1, 3452, 4096, 4096, 4096, 1024]
    - [17, 18629.0]
  - - [1024, 4096, 1, 3417, 1024, 1024, 1024, 4096]
    - [17, 18633.0]
  - - [1024, 4096, 1, 3526, 1024, 1024, 1024, 4096]
    - [17, 18634.0]
  - - [4096, 1024, 1, 3485, 4096, 4096, 4096, 1024]
    - [33, 18634.0]
  - - [4096, 1024, 1, 3303, 4096, 4096, 4096, 1024]
    - [33, 18630.0]
  - - [4096, 1024, 1, 3344, 4096, 4096, 4096, 1024]
    - [33, 18641.0]
  - - [1024, 4096, 1, 3479, 1024, 1024, 1024, 4096]
    - [33, 18643.0]
  - - [4096, 1024, 1, 3300, 4096, 4096, 4096, 1024]
    - [17, 18614.0]
  - - [1024, 4096, 1, 3439, 1024, 1024, 1024, 4096]
    - [33, 18632.0]
  - - [4096, 1024, 1, 3280, 4096, 4096, 4096, 1024]
    - [33, 18644.0]
  - - [1024, 4096, 1, 3245, 1024, 1024, 1024, 4096]
    - [33, 18639.0]
  - - [1024, 4096, 1, 3328, 1024, 1024, 1024, 4096]
    - [33, 18634.0]
  - - [4096, 1024, 1, 3418, 4096, 4096, 4096, 1024]
    - [17, 18620.0]
  - - [1024, 4096, 1, 3493, 1024, 1024, 1024, 4096]
    - [33, 18627.0]
  - - [1024, 4096, 1, 3500, 1024, 1024, 1024, 4096]
    - [33, 18624.0]
  - - [1024, 4096, 1, 3166, 1024, 1024, 1024, 4096]
    - [17, 18633.0]
  - - [4096, 1024, 1, 3126, 4096, 4096, 4096, 1024]
    - [33, 18627.0]
  - - [1024, 4096, 1, 3277, 1024, 1024, 1024, 4096]
    - [17, 18623.0]
  - - [1024, 4096, 1, 3315, 1024, 1024, 1024, 4096]
    - [33, 18641.0]
  - - [1024, 4096, 1, 3414, 1024, 1024, 1024, 4096]
    - [0, 18630.0]
  - - [4096, 1024, 1, 3531, 4096, 4096, 4096, 1024]
    - [33, 18641.0]
  - - [4096, 1024, 1, 3484, 4096, 4096, 4096, 1024]
    - [33, 18636.0]
  - - [1024, 4096, 1, 3180, 1024, 1024, 1024, 4096]
    - [17, 18618.0]
  - - [4096, 1024, 1, 3360, 4096, 4096, 4096, 1024]
    - [33, 18633.0]
  - - [1024, 33708, 1, 3990, 1024, 1024, 1024, 33708]
    - [4, 20876.0]
  - - [4096, 1024, 1, 3466, 4096, 4096, 4096, 1024]
    - [42, 18611.0]
  - - [1024, 4096, 1, 3428, 1024, 1024, 1024, 4096]
    - [33, 18631.0]
  - - [1024, 4096, 1, 3137, 1024, 1024, 1024, 4096]
    - [17, 18629.0]
  - - [4096, 1024, 1, 4059, 4096, 4096, 4096, 1024]
    - [33, 18646.0]
  - - [1024, 4096, 1, 3353, 1024, 1024, 1024, 4096]
    - [17, 18631.0]
  - - [1024, 4096, 1, 3942, 1024, 1024, 1024, 4096]
    - [33, 18647.0]
  - - [4096, 1024, 1, 3506, 4096, 4096, 4096, 1024]
    - [17, 18635.0]
  - - [4096, 1024, 1, 3508, 4096, 4096, 4096, 1024]
    - [17, 18609.0]
  - - [4096, 1024, 1, 3956, 4096, 4096, 4096, 1024]
    - [17, 18638.0]
  - - [1024, 4096, 1, 3272, 1024, 1024, 1024, 4096]
    - [17, 18627.0]
  - - [1024, 4096, 1, 3443, 1024, 1024, 1024, 4096]
    - [33, 18643.0]
  - - [1024, 4096, 1, 3375, 1024, 1024, 1024, 4096]
    - [17, 18635.0]
  - - [1024, 4096, 1, 3525, 1024, 1024, 1024, 4096]
    - [33, 18638.0]
  - - [4096, 1024, 1, 3472, 4096, 4096, 4096, 1024]
    - [17, 18639.0]
  - - [1024, 4096, 1, 3520, 1024, 1024, 1024, 4096]
    - [33, 18645.0]
  - - [4096, 1024, 1, 3322, 4096, 4096, 4096, 1024]
    - [33, 18625.0]
  - - [4096, 1024, 1, 3387, 4096, 4096, 4096, 1024]
    - [33, 18631.0]
  - - [1024, 33708, 1, 3939, 1024, 1024, 1024, 33708]
    - [37, 20880.0]
  - - [4096, 1024, 1, 3345, 4096, 4096, 4096, 1024]
    - [33, 18625.0]
  - - [4096, 1024, 1, 2967, 4096, 4096, 4096, 1024]
    - [17, 18623.0]
  - - [1024, 4096, 1, 3453, 1024, 1024, 1024, 4096]
    - [33, 18621.0]
  - - [1024, 4096, 1, 3640, 1024, 1024, 1024, 4096]
    - [33, 18645.0]
  - - [4096, 1024, 1, 3291, 4096, 4096, 4096, 1024]
    - [33, 18630.0]
  - - [1024, 4096, 1, 3350, 1024, 1024, 1024, 4096]
    - [17, 18629.0]
  - - [4096, 1024, 1, 3417, 4096, 4096, 4096, 1024]
    - [33, 18626.0]
  - - [1024, 4096, 1, 3467, 1024, 1024, 1024, 4096]
    - [17, 18624.0]
  - - [1024, 4096, 1, 3491, 1024, 1024, 1024, 4096]
    - [17, 18632.0]
  - - [1024, 4096, 1, 3822, 1024, 1024, 1024, 4096]
    - [17, 18649.0]
  - - [4096, 1024, 1, 3292, 4096, 4096, 4096, 1024]
    - [33, 18628.0]
  - - [1024, 4096, 1, 3231, 1024, 1024, 1024, 4096]
    - [33, 18635.0]
  - - [1024, 4096, 1, 3364, 1024, 1024, 1024, 4096]
    - [33, 18634.0]
  - - [1024, 4096, 1, 3995, 1024, 1024, 1024, 4096]
    - [33, 18639.0]
  - - [1024, 4096, 1, 3545, 1024, 1024, 1024, 4096]
    - [17, 18655.0]
  - - [1024, 4096, 1, 3186, 1024, 1024, 1024, 4096]
    - [33, 18635.0]
  - - [4096, 1024, 1, 3432, 4096, 4096, 4096, 1024]
    - [33, 18644.0]
  - - [4096, 1024, 1, 3367, 4096, 4096, 4096, 1024]
    - [17, 18638.0]
  - - [4096, 1024, 1, 3503, 4096, 4096, 4096, 1024]
    - [33, 18637.0]
  - - [1024, 4096, 1, 3095, 1024, 1024, 1024, 4096]
    - [33, 18628.0]
  - - [4096, 1024, 1, 3465, 4096, 4096, 4096, 1024]
    - [33, 18627.0]
  - - [1024, 4096, 1, 3402, 1024, 1024, 1024, 4096]
    - [17, 18636.0]
  - - [4096, 1024, 1, 3140, 4096, 4096, 4096, 1024]
    - [33, 18628.0]
  - - [4096, 1024, 1, 3424, 4096, 4096, 4096, 1024]
    - [17, 18629.0]
  - - [4096, 1024, 1, 3257, 4096, 4096, 4096, 1024]
    - [17, 18637.0]
  - - [4096, 1024, 1, 2917, 4096, 4096, 4096, 1024]
    - [42, 18621.0]
  - - [1024, 33708, 1, 3640, 1024, 1024, 1024, 33708]
    - [37, 20877.0]
  - - [1024, 4096, 1, 3456, 1024, 1024, 1024, 4096]
    - [17, 18628.0]
  - - [1024, 4096, 1, 3014, 1024, 1024, 1024, 4096]
    - [17, 18627.0]
  - - [4096, 1024, 1, 3372, 4096, 4096, 4096, 1024]
    - [33, 18640.0]
  - - [1024, 4096, 1, 3294, 1024, 1024, 1024, 4096]
    - [17, 18626.0]
  - - [4096, 1024, 1, 3446, 4096, 4096, 4096, 1024]
    - [33, 18627.0]
  - - [1024, 4096, 1, 3389, 1024, 1024, 1024, 4096]
    - [17, 18636.0]
  - - [4096, 1024, 1, 3259, 4096, 4096, 4096, 1024]
    - [33, 18634.0]
  - - [4096, 1024, 1, 3544, 4096, 4096, 4096, 1024]
    - [17, 18658.0]
  - - [4096, 1024, 1, 3479, 4096, 4096, 4096, 1024]
    - [17, 18631.0]
  - - [4096, 1024, 1, 3542, 4096, 4096, 4096, 1024]
    - [17, 18635.0]
  - - [4096, 1024, 1, 3321, 4096, 4096, 4096, 1024]
    - [42, 18634.0]
  - - [1024, 4096, 1, 3147, 1024, 1024, 1024, 4096]
    - [33, 18621.0]
  - - [1024, 4096, 1, 3944, 1024, 1024, 1024, 4096]
    - [33, 18643.0]
  - - [4096, 1024, 1, 3870, 4096, 4096, 4096, 1024]
    - [33, 18639.0]
  - - [1024, 4096, 1, 3308, 1024, 1024, 1024, 4096]
    - [17, 18632.0]
  - - [4096, 1024, 1, 3401, 4096, 4096, 4096, 1024]
    - [33, 18631.0]
  - - [1024, 4096, 1, 3395, 1024, 1024, 1024, 4096]
    - [33, 18628.0]
  - - [1024, 4096, 1, 3563, 1024, 1024, 1024, 4096]
    - [33, 18639.0]
  - - [1024, 33708, 1, 3870, 1024, 1024, 1024, 33708]
    - [4, 20871.0]
  - - [4096, 1024, 1, 3494, 4096, 4096, 4096, 1024]
    - [33, 18629.0]
  - - [1024, 4096, 1, 3271, 1024, 1024, 1024, 4096]
    - [17, 18629.0]
  - - [1024, 33708, 1, 3910, 1024, 1024, 1024, 33708]
    - [37, 20861.0]
  - - [1024, 4096, 1, 3287, 1024, 1024, 1024, 4096]
    - [33, 18621.0]
  - - [1024, 33708, 1, 3860, 1024, 1024, 1024, 33708]
    - [4, 20855.0]
  - - [4096, 1024, 1, 3341, 4096, 4096, 4096, 1024]
    - [17, 18623.0]
  - - [1024, 4096, 1, 3136, 1024, 1024, 1024, 4096]
    - [33, 18638.0]
  - - [4096, 1024, 1, 3439, 4096, 4096, 4096, 1024]
    - [17, 18631.0]
  - - [1024, 4096, 1, 3751, 1024, 1024, 1024, 4096]
    - [33, 18629.0]
  - - [1024, 4096, 1, 3301, 1024, 1024, 1024, 4096]
    - [33, 18633.0]
  - - [4096, 1024, 1, 3468, 4096, 4096, 4096, 1024]
    - [33, 18599.0]
  - - [1024, 4096, 1, 3416, 1024, 1024, 1024, 4096]
    - [33, 18641.0]
  - - [4096, 1024, 1, 3163, 4096, 4096, 4096, 1024]
    - [33, 18617.0]
  - - [1024, 4096, 1, 3230, 1024, 1024, 1024, 4096]
    - [0, 18610.0]
  - - [1024, 4096, 1, 3581, 1024, 1024, 1024, 4096]
    - [24, 18604.0]
  - - [4096, 1024, 1, 3463, 4096, 4096, 4096, 1024]
    - [24, 18612.0]
  - - [1024, 4096, 1, 3478, 1024, 1024, 1024, 4096]
    - [0, 18613.0]
  - - [4096, 1024, 1, 3262, 4096, 4096, 4096, 1024]
    - [33, 18629.0]
  - - [1024, 4096, 1, 3438, 1024, 1024, 1024, 4096]
    - [33, 18635.0]
  - - [1024, 4096, 1, 3244, 1024, 1024, 1024, 4096]
    - [0, 18641.0]
  - - [1024, 4096, 1, 3445, 1024, 1024, 1024, 4096]
    - [17, 18636.0]
  - - [4096, 1024, 1, 3328, 4096, 4096, 4096, 1024]
    - [42, 18622.0]
  - - [1024, 4096, 1, 3492, 1024, 1024, 1024, 4096]
    - [0, 18627.0]
  - - [4096, 1024, 1, 3211, 4096, 4096, 4096, 1024]
    - [42, 18610.0]
  - - [1024, 4096, 1, 3910, 1024, 1024, 1024, 4096]
    - [0, 18616.0]
  - - [1024, 4096, 1, 3314, 1024, 1024, 1024, 4096]
    - [33, 18636.0]
  - - [4096, 1024, 1, 3859, 4096, 4096, 4096, 1024]
    - [42, 18616.0]
  - - [4096, 1024, 1, 3383, 4096, 4096, 4096, 1024]
    - [42, 18616.0]
  - - [1024, 4096, 1, 3409, 1024, 1024, 1024, 4096]
    - [33, 18639.0]
  - - [1024, 4096, 1, 4020, 1024, 1024, 1024, 4096]
    - [17, 18636.0]
  - - [4096, 1024, 1, 3530, 4096, 4096, 4096, 1024]
    - [33, 18633.0]
  - - [4096, 1024, 1, 3411, 4096, 4096, 4096, 1024]
    - [17, 18640.0]
  - - [1024, 4096, 1, 3566, 1024, 1024, 1024, 4096]
    - [33, 18647.0]
  - - [4096, 1024, 1, 3493, 4096, 4096, 4096, 1024]
    - [24, 18628.0]
  - - [4096, 1024, 1, 3184, 4096, 4096, 4096, 1024]
    - [17, 18632.0]
  - - [1024, 4096, 1, 3072, 1024, 1024, 1024, 4096]
    - [33, 18630.0]
  - - [1024, 4096, 1, 3431, 1024, 1024, 1024, 4096]
    - [33, 18639.0]
  - - [4096, 1024, 1, 3306, 4096, 4096, 4096, 1024]
    - [17, 18620.0]
  - - [1024, 4096, 1, 3352, 1024, 1024, 1024, 4096]
    - [33, 18640.0]
  - - [4096, 1024, 1, 3295, 4096, 4096, 4096, 1024]
    - [17, 18627.0]
  - - [1024, 4096, 1, 3517, 1024, 1024, 1024, 4096]
    - [0, 18644.0]
  - - [4096, 1024, 1, 3426, 4096, 4096, 4096, 1024]
    - [17, 18627.0]
  - - [4096, 1024, 1, 3385, 4096, 4096, 4096, 1024]
    - [17, 18633.0]
  - - [4096, 1024, 1, 3572, 4096, 4096, 4096, 1024]
    - [17, 18635.0]
  - - [4096, 1024, 1, 3459, 4096, 4096, 4096, 1024]
    - [33, 18645.0]
  - - [1024, 4096, 1, 3374, 1024, 1024, 1024, 4096]
    - [33, 18635.0]
  - - [4096, 1024, 1, 3166, 4096, 4096, 4096, 1024]
    - [33, 18639.0]
  - - [4096, 1024, 1, 3093, 4096, 4096, 4096, 1024]
    - [33, 18633.0]
  - - [4096, 1024, 1, 3523, 4096, 4096, 4096, 1024]
    - [33, 18631.0]
  - - [4096, 1024, 1, 3413, 4096, 4096, 4096, 1024]
    - [33, 18639.0]
  - - [1024, 4096, 1, 3996, 1024, 1024, 1024, 4096]
    - [33, 18643.0]
  - - [1024, 4096, 1, 3452, 1024, 1024, 1024, 4096]
    - [33, 18641.0]
  - - [4096, 1024, 1, 3232, 4096, 4096, 4096, 1024]
    - [33, 18633.0]
  - - [4096, 1024, 1, 3400, 4096, 4096, 4096, 1024]
    - [17, 18646.0]
  - - [4096, 1024, 1, 3334, 4096, 4096, 4096, 1024]
    - [17, 18632.0]
  - - [1024, 4096, 1, 3345, 1024, 1024, 1024, 4096]
    - [33, 18629.0]
  - - [1024, 4096, 1, 3538, 1024, 1024, 1024, 4096]
    - [33, 18637.0]
  - - [1024, 4096, 1, 3466, 1024, 1024, 1024, 4096]
    - [33, 18638.0]
  - - [4096, 1024, 1, 3315, 4096, 4096, 4096, 1024]
    - [33, 18632.0]
  - - [4096, 1024, 1, 3214, 4096, 4096, 4096, 1024]
    - [33, 18635.0]
  - - [1024, 33708, 1, 3900, 1024, 1024, 1024, 33708]
    - [37, 20876.0]
  - - [1024, 4096, 1, 3367, 1024, 1024, 1024, 4096]
    - [33, 18622.0]
  - - [1024, 4096, 1, 2917, 1024, 1024, 1024, 4096]
    - [33, 18623.0]
  - - [1024, 4096, 1, 3544, 1024, 1024, 1024, 4096]
    - [0, 18632.0]
  - - [4096, 1024, 1, 3414, 4096, 4096, 4096, 1024]
    - [17, 18627.0]
  - - [4096, 1024, 1, 3565, 4096, 4096, 4096, 1024]
    - [17, 18634.0]
  - - [1024, 4096, 1, 3512, 1024, 1024, 1024, 4096]
    - [33, 18643.0]
  - - [1024, 4096, 1, 3191, 1024, 1024, 1024, 4096]
    - [17, 18624.0]
  - - [1024, 4096, 1, 3289, 1024, 1024, 1024, 4096]
    - [17, 18626.0]
  - - [4096, 1024, 1, 3290, 4096, 4096, 4096, 1024]
    - [33, 18627.0]
  - - [1024, 4096, 1, 3211, 1024, 1024, 1024, 4096]
    - [33, 18629.0]
  - - [1024, 33708, 1, 3969, 1024, 1024, 1024, 33708]
    - [37, 20880.0]
  - - [4096, 1024, 1, 3566, 4096, 4096, 4096, 1024]
    - [24, 18604.0]
  - - [1024, 4096, 1, 3459, 1024, 1024, 1024, 4096]
    - [33, 18642.0]
  - - [1024, 4096, 1, 3372, 1024, 1024, 1024, 4096]
    - [17, 18629.0]
  - - [4096, 1024, 1, 3339, 4096, 4096, 4096, 1024]
    - [33, 18630.0]
  - - [4096, 1024, 1, 3425, 4096, 4096, 4096, 1024]
    - [17, 18623.0]
  - - [4096, 1024, 1, 3388, 4096, 4096, 4096, 1024]
    - [33, 18629.0]
  - - [1024, 4096, 1, 3531, 1024, 1024, 1024, 4096]
    - [33, 18621.0]
  - - [4096, 1024, 1, 3286, 4096, 4096, 4096, 1024]
    - [33, 18624.0]
  - - [4096, 1024, 1, 3462, 4096, 4096, 4096, 1024]
    - [33, 18644.0]
  - - [1024, 4096, 1, 3388, 1024, 1024, 1024, 4096]
    - [33, 18630.0]
  - - [4096, 1024, 1, 3165, 4096, 4096, 4096, 1024]
    - [0, 18607.0]
  - - [4096, 1024, 1, 3304, 4096, 4096, 4096, 1024]
    - [33, 18639.0]
  - - [1024, 4096, 1, 2736, 1024, 1024, 1024, 4096]
    - [33, 18634.0]
  - - [4096, 1024, 1, 3397, 4096, 4096, 4096, 1024]
    - [33, 18632.0]
  - - [1024, 4096, 1, 3311, 1024, 1024, 1024, 4096]
    - [33, 18627.0]
  - - [1024, 4096, 1, 3394, 1024, 1024, 1024, 4096]
    - [33, 18640.0]
  - - [4096, 1024, 1, 2736, 4096, 4096, 4096, 1024]
    - [33, 18629.0]
  - - [1024, 4096, 1, 3559, 1024, 1024, 1024, 4096]
    - [0, 18630.0]
  - - [4096, 1024, 1, 3180, 4096, 4096, 4096, 1024]
    - [33, 18614.0]
  - - [1024, 4096, 1, 3480, 1024, 1024, 1024, 4096]
    - [0, 18642.0]
  - - [4096, 1024, 1, 3318, 4096, 4096, 4096, 1024]
    - [17, 18631.0]
  - - [4096, 1024, 1, 3213, 4096, 4096, 4096, 1024]
    - [33, 18622.0]
  - - [1024, 4096, 1, 3286, 1024, 1024, 1024, 4096]
    - [17, 18639.0]
  - - [4096, 1024, 1, 3471, 4096, 4096, 4096, 1024]
    - [17, 18627.0]
  - - [1024, 4096, 1, 3381, 1024, 1024, 1024, 4096]
    - [33, 18634.0]
  - - [4096, 1024, 1, 3502, 4096, 4096, 4096, 1024]
    - [17, 18637.0]
  - - [1024, 4096, 1, 3552, 1024, 1024, 1024, 4096]
    - [17, 18627.0]
  - - [4096, 1024, 1, 3519, 4096, 4096, 4096, 1024]
    - [33, 18637.0]
  - - [1024, 4096, 1, 3300, 1024, 1024, 1024, 4096]
    - [17, 18642.0]
  - - [1024, 4096, 1, 3419, 1024, 1024, 1024, 4096]
    - [17, 18630.0]
  - - [4096, 1024, 1, 4030, 4096, 4096, 4096, 1024]
    - [17, 18632.0]
  - - [4096, 1024, 1, 3976, 4096, 4096, 4096, 1024]
    - [17, 18648.0]
  - - [1024, 4096, 1, 3473, 1024, 1024, 1024, 4096]
    - [33, 18630.0]
  - - [4096, 1024, 1, 3428, 4096, 4096, 4096, 1024]
    - [17, 18628.0]
  - - [1024, 4096, 1, 3433, 1024, 1024, 1024, 4096]
    - [17, 18629.0]
  - - [4096, 1024, 1, 3534, 4096, 4096, 4096, 1024]
    - [17, 18632.0]
  - - [4096, 1024, 1, 3461, 4096, 4096, 4096, 1024]
    - [33, 18634.0]
  - - [4096, 1024, 1, 3681, 4096, 4096, 4096, 1024]
    - [17, 18630.0]
  - - [4096, 1024, 1, 3495, 4096, 4096, 4096, 1024]
    - [17, 18631.0]
  - - [4096, 1024, 1, 3351, 4096, 4096, 4096, 1024]
    - [17, 18625.0]
  - - [1024, 4096, 1, 4059, 1024, 1024, 1024, 4096]
    - [17, 18635.0]
  - - [4096, 1024, 1, 3990, 4096, 4096, 4096, 1024]
    - [17, 18630.0]
  - - [1024, 4096, 1, 3325, 1024, 1024, 1024, 4096]
    - [33, 18618.0]
  - - [1024, 4096, 1, 3408, 1024, 1024, 1024, 4096]
    - [17, 18641.0]
  - - [4096, 1024, 1, 3394, 4096, 4096, 4096, 1024]
    - [17, 18630.0]
  - - [1024, 4096, 1, 3573, 1024, 1024, 1024, 4096]
    - [33, 18633.0]
  - - [4096, 1024, 1, 3386, 4096, 4096, 4096, 1024]
    - [33, 18635.0]
  - - [4096, 1024, 1, 3540, 4096, 4096, 4096, 1024]
    - [33, 18636.0]
  - - [1024, 4096, 1, 3182, 1024, 1024, 1024, 4096]
    - [33, 18633.0]
  - - [1024, 4096, 1, 3430, 1024, 1024, 1024, 4096]
    - [33, 18646.0]
  - - [1024, 4096, 1, 3236, 1024, 1024, 1024, 4096]
    - [17, 18626.0]
  - - [4096, 1024, 1, 2977, 4096, 4096, 4096, 1024]
    - [33, 18624.0]
  - - [1024, 4096, 1, 3355, 1024, 1024, 1024, 4096]
    - [33, 18631.0]
  - - [4096, 1024, 1, 3139, 4096, 4096, 4096, 1024]
    - [33, 18633.0]
  - - [4096, 1024, 1, 3516, 4096, 4096, 4096, 1024]
    - [33, 18639.0]
  - - [4096, 1024, 1, 3368, 4096, 4096, 4096, 1024]
    - [33, 18637.0]
  - - [4096, 1024, 1, 3559, 4096, 4096, 4096, 1024]
    - [33, 18624.0]
  - - [1024, 4096, 1, 3506, 1024, 1024, 1024, 4096]
    - [33, 18634.0]
  - - [1024, 4096, 1, 3145, 1024, 1024, 1024, 4096]
    - [17, 18627.0]
  - - [1024, 4096, 1, 3369, 1024, 1024, 1024, 4096]
    - [33, 18634.0]
  - - [4096, 1024, 1, 3522, 4096, 4096, 4096, 1024]
    - [17, 18633.0]
  - - [1024, 33708, 1, 3894, 1024, 1024, 1024, 33708]
    - [4, 20875.0]
  - - [4096, 1024, 1, 3336, 4096, 4096, 4096, 1024]
    - [33, 18637.0]
  - - [1024, 4096, 1, 3382, 1024, 1024, 1024, 4096]
    - [17, 18632.0]
  - - [4096, 1024, 1, 3533, 4096, 4096, 4096, 1024]
    - [17, 18629.0]
  - - [4096, 1024, 1, 4050, 4096, 4096, 4096, 1024]
    - [17, 18633.0]
  - - [4096, 1024, 1, 3480, 4096, 4096, 4096, 1024]
    - [33, 18647.0]
  - - [1024, 4096, 1, 3344, 1024, 1024, 1024, 4096]
    - [17, 18636.0]
  - - [1024, 4096, 1, 3509, 1024, 1024, 1024, 4096]
    - [17, 18625.0]
  - - [1024, 4096, 1, 3956, 1024, 1024, 1024, 4096]
    - [33, 18639.0]
  - - [4096, 1024, 1, 3616, 4096, 4096, 4096, 1024]
    - [33, 18635.0]
  - - [1024, 4096, 1, 3366, 1024, 1024, 1024, 4096]
    - [33, 18639.0]
  - - [4096, 1024, 1, 2935, 4096, 4096, 4096, 1024]
    - [0, 18609.0]
  - - [4096, 1024, 1, 3393, 4096, 4096, 4096, 1024]
    - [17, 18635.0]
  - - [4096, 1024, 1, 3547, 4096, 4096, 4096, 1024]
    - [17, 18639.0]
  - - [1024, 4096, 1, 3499, 1024, 1024, 1024, 4096]
    - [33, 18641.0]
  - - [4096, 1024, 1, 3357, 4096, 4096, 4096, 1024]
    - [17, 18633.0]
  - - [4096, 1024, 1, 3272, 4096, 4096, 4096, 1024]
    - [17, 18634.0]
  - - [4096, 1024, 1, 3207, 4096, 4096, 4096, 1024]
    - [17, 18621.0]
  - - [4096, 1024, 1, 3894, 4096, 4096, 4096, 1024]
    - [33, 18633.0]
  - - [1024, 4096, 1, 3444, 1024, 1024, 1024, 4096]
    - [33, 18625.0]
  - - [4096, 1024, 1, 3561, 4096, 4096, 4096, 1024]
    - [33, 18628.0]
  - - [4096, 1024, 1, 3376, 4096, 4096, 4096, 1024]
    - [33, 18638.0]
  - - [1024, 4096, 1, 3458, 1024, 1024, 1024, 4096]
    - [33, 18629.0]
  - - [4096, 1024, 1, 3231, 4096, 4096, 4096, 1024]
    - [33, 18619.0]
  - - [1024, 4096, 1, 3505, 1024, 1024, 1024, 4096]
    - [33, 18627.0]
  - - [4096, 1024, 1, 3277, 4096, 4096, 4096, 1024]
    - [33, 18631.0]
  - - [1024, 4096, 1, 3391, 1024, 1024, 1024, 4096]
    - [17, 18634.0]
  - - [1024, 4096, 1, 3536, 1024, 1024, 1024, 4096]
    - [17, 18634.0]
  - - [1024, 4096, 1, 3063, 1024, 1024, 1024, 4096]
    - [17, 18619.0]
  - - [1024, 4096, 1, 3189, 1024, 1024, 1024, 4096]
    - [33, 18629.0]
  - - [1024, 4096, 1, 2505, 1024, 1024, 1024, 4096]
    - [17, 18605.0]
  - - [4096, 1024, 1, 3454, 4096, 4096, 4096, 1024]
    - [33, 18630.0]
  - - [1024, 4096, 1, 3405, 1024, 1024, 1024, 4096]
    - [33, 18641.0]
  - - [1024, 33708, 1, 4050, 1024, 1024, 1024, 33708]
    - [21, 20879.0]
  - - [4096, 1024, 1, 3520, 4096, 4096, 4096, 1024]
    - [17, 18641.0]
  - - [1024, 4096, 1, 3487, 1024, 1024, 1024, 4096]
    - [33, 18601.0]
  - - [1024, 4096, 1, 3558, 1024, 1024, 1024, 4096]
    - [17, 18626.0]
  - - [4096, 1024, 1, 3297, 4096, 4096, 4096, 1024]
    - [17, 18621.0]
  - - [1024, 4096, 1, 3483, 1024, 1024, 1024, 4096]
    - [33, 18630.0]
  - - [1024, 33708, 1, 3751, 1024, 1024, 1024, 33708]
    - [4, 20871.0]
  - - [4096, 1024, 1, 3380, 4096, 4096, 4096, 1024]
    - [24, 18603.0]
  - - [1024, 4096, 1, 3380, 1024, 1024, 1024, 4096]
    - [33, 18637.0]
  - - [1024, 4096, 1, 3396, 1024, 1024, 1024, 4096]
    - [0, 18627.0]
  - - [1024, 4096, 1, 3497, 1024, 1024, 1024, 4096]
    - [0, 18628.0]
  - - [1024, 4096, 1, 3502, 1024, 1024, 1024, 4096]
    - [0, 18631.0]
  - - [1024, 4096, 1, 3138, 1024, 1024, 1024, 4096]
    - [17, 18635.0]
  - - [4096, 1024, 1, 3939, 4096, 4096, 4096, 1024]
    - [33, 18640.0]
  - - [1024, 4096, 1, 3303, 1024, 1024, 1024, 4096]
    - [17, 18620.0]
  - - [1024, 4096, 1, 3418, 1024, 1024, 1024, 4096]
    - [17, 18632.0]
  - - [1024, 4096, 1, 3224, 1024, 1024, 1024, 4096]
    - [33, 18649.0]
  - - [4096, 1024, 1, 3978, 4096, 4096, 4096, 1024]
    - [33, 18642.0]
  - - [1024, 4096, 1, 3472, 1024, 1024, 1024, 4096]
    - [17, 18636.0]
  - - [4096, 1024, 1, 3353, 4096, 4096, 4096, 1024]
    - [0, 18624.0]
  - - [4096, 1024, 1, 3362, 4096, 4096, 4096, 1024]
    - [17, 18640.0]
  - - [1024, 33708, 1, 3978, 1024, 1024, 1024, 33708]
    - [4, 20873.0]
  - - [1024, 4096, 1, 3432, 1024, 1024, 1024, 4096]
    - [33, 18591.0]
  - - [1024, 4096, 1, 3139, 1024, 1024, 1024, 4096]
    - [33, 18632.0]
  - - [1024, 4096, 1, 3341, 1024, 1024, 1024, 4096]
    - [24, 18607.0]
  - - [1024, 4096, 1, 3494, 1024, 1024, 1024, 4096]
    - [33, 18646.0]
  - - [1024, 4096, 1, 3969, 1024, 1024, 1024, 4096]
    - [17, 18643.0]
  - - [1024, 4096, 1, 3163, 1024, 1024, 1024, 4096]
    - [9, 18598.0]
  - - [4096, 1024, 1, 3405, 4096, 4096, 4096, 1024]
    - [33, 18627.0]
  - - [4096, 1024, 1, 3453, 4096, 4096, 4096, 1024]
    - [33, 18634.0]
  - - [1024, 4096, 1, 3411, 1024, 1024, 1024, 4096]
    - [33, 18634.0]
  - - [1024, 4096, 1, 3527, 1024, 1024, 1024, 4096]
    - [17, 18631.0]
  - - [4096, 1024, 1, 3474, 4096, 4096, 4096, 1024]
    - [33, 18629.0]
  - - [1024, 4096, 1, 3572, 1024, 1024, 1024, 4096]
    - [17, 18623.0]
  - - [4096, 1024, 1, 3293, 4096, 4096, 4096, 1024]
    - [17, 18629.0]
  - - [4096, 1024, 1, 3247, 4096, 4096, 4096, 1024]
    - [17, 18634.0]
  - - [1024, 4096, 1, 3425, 1024, 1024, 1024, 4096]
    - [33, 18640.0]
  - - [1024, 4096, 1, 3354, 1024, 1024, 1024, 4096]
    - [33, 18629.0]
  - - [4096, 1024, 1, 3382, 4096, 4096, 4096, 1024]
    - [17, 18635.0]
  - - [4096, 1024, 1, 3236, 4096, 4096, 4096, 1024]
    - [33, 18637.0]
  - - [1024, 4096, 1, 3519, 1024, 1024, 1024, 4096]
    - [17, 18628.0]
  - - [4096, 1024, 1, 3354, 4096, 4096, 4096, 1024]
    - [33, 18634.0]
  - - [4096, 1024, 1, 3501, 4096, 4096, 4096, 1024]
    - [17, 18638.0]
  - - [4096, 1024, 1, 3266, 4096, 4096, 4096, 1024]
    - [33, 18625.0]
  - - [1024, 4096, 1, 3368, 1024, 1024, 1024, 4096]
    - [17, 18635.0]
  - - [1024, 4096, 1, 4030, 1024, 1024, 1024, 4096]
    - [33, 18638.0]
  - - [1024, 4096, 1, 3533, 1024, 1024, 1024, 4096]
    - [17, 18629.0]
  - - [4096, 1024, 1, 3332, 4096, 4096, 4096, 1024]
    - [17, 18619.0]
  - - [4096, 1024, 1, 3584, 4096, 4096, 4096, 1024]
    - [33, 18638.0]
  - - [1024, 4096, 1, 3616, 1024, 1024, 1024, 4096]
    - [0, 18618.0]
  - - [4096, 1024, 1, 3265, 4096, 4096, 4096, 1024]
    - [33, 18631.0]
  - - [4096, 1024, 1, 3361, 4096, 4096, 4096, 1024]
    - [17, 18626.0]
  - - [4096, 1024, 1, 3467, 4096, 4096, 4096, 1024]
    - [33, 18647.0]
  - - [1024, 4096, 1, 3454, 1024, 1024, 1024, 4096]
    - [17, 18627.0]
  - - [1024, 4096, 1, 3101, 1024, 1024, 1024, 4096]
    - [33, 18635.0]
  - - [1024, 4096, 1, 3508, 1024, 1024, 1024, 4096]
    - [17, 18636.0]
  - - [4096, 1024, 1, 3267, 4096, 4096, 4096, 1024]
    - [33, 18628.0]
  - - [4096, 1024, 1, 3419, 4096, 4096, 4096, 1024]
    - [17, 18636.0]
  - - [4096, 1024, 1, 3822, 4096, 4096, 4096, 1024]
    - [17, 18638.0]
  - - [1024, 4096, 1, 3266, 1024, 1024, 1024, 4096]
    - [17, 18624.0]
  - - [4096, 1024, 1, 3440, 4096, 4096, 4096, 1024]
    - [17, 18632.0]
  - - [1024, 4096, 1, 3361, 1024, 1024, 1024, 4096]
    - [17, 18632.0]
  - - [1024, 4096, 1, 3546, 1024, 1024, 1024, 4096]
    - [33, 18647.0]
  - - [4096, 1024, 1, 3473, 4096, 4096, 4096, 1024]
    - [0, 18618.0]
  - - [4096, 1024, 1, 3546, 4096, 4096, 4096, 1024]
    - [17, 18633.0]
  - - [1024, 4096, 1, 3088, 1024, 1024, 1024, 4096]
    - [17, 18627.0]
  - - [1024, 4096, 1, 3535, 1024, 1024, 1024, 4096]
    - [17, 18633.0]
  - - [1024, 4096, 1, 3447, 1024, 1024, 1024, 4096]
    - [33, 18652.0]
  - - [1024, 4096, 1, 3560, 1024, 1024, 1024, 4096]
    - [17, 18644.0]
  - - [1024, 4096, 1, 3422, 1024, 1024, 1024, 4096]
    - [0, 18636.0]
  - - [1024, 4096, 1, 3469, 1024, 1024, 1024, 4096]
    - [33, 18644.0]
  - - [4096, 1024, 1, 3488, 4096, 4096, 4096, 1024]
    - [17, 18627.0]
  - - [1024, 4096, 1, 3110, 1024, 1024, 1024, 4096]
    - [33, 18625.0]
  - - [1024, 4096, 1, 3265, 1024, 1024, 1024, 4096]
    - [17, 18629.0]
  - - [1024, 4096, 1, 3291, 1024, 1024, 1024, 4096]
    - [33, 18637.0]
  - - [1024, 4096, 1, 3390, 1024, 1024, 1024, 4096]
    - [17, 18626.0]
  - - [4096, 1024, 1, 3046, 4096, 4096, 4096, 1024]
    - [33, 18624.0]
  - - [1024, 4096, 1, 3539, 1024, 1024, 1024, 4096]
    - [33, 18636.0]
  - - [4096, 1024, 1, 3221, 4096, 4096, 4096, 1024]
    - [33, 18623.0]
  - - [4096, 1024, 1, 3433, 4096, 4096, 4096, 1024]
    - [33, 18637.0]
  - - [4096, 1024, 1, 3364, 4096, 4096, 4096, 1024]
    - [17, 18637.0]
  - - [4096, 1024, 1, 3470, 4096, 4096, 4096, 1024]
    - [33, 18636.0]
  - - [1024, 4096, 1, 3404, 1024, 1024, 1024, 4096]
    - [17, 18632.0]
  - - [1024, 33708, 1, 3968, 1024, 1024, 1024, 33708]
    - [21, 20878.0]
  - - [4096, 1024, 1, 3088, 4096, 4096, 4096, 1024]
    - [33, 18620.0]
  - - [1024, 4096, 1, 3247, 1024, 1024, 1024, 4096]
    - [42, 18603.0]
  - - [1024, 33708, 1, 3996, 1024, 1024, 1024, 33708]
    - [37, 20870.0]
  - - [4096, 1024, 1, 3482, 4096, 4096, 4096, 1024]
    - [17, 18628.0]
  - - [4096, 1024, 1, 3995, 4096, 4096, 4096, 1024]
    - [17, 18627.0]
  - - [1024, 4096, 1, 3280, 1024, 1024, 1024, 4096]
    - [33, 18624.0]
  - - [4096, 1024, 1, 3271, 4096, 4096, 4096, 1024]
    - [33, 18637.0]
  - - [4096, 1024, 1, 3545, 4096, 4096, 4096, 1024]
    - [17, 18651.0]
  - - [4096, 1024, 1, 3476, 4096, 4096, 4096, 1024]
    - [33, 18637.0]
  - - [4096, 1024, 1, 3496, 4096, 4096, 4096, 1024]
    - [24, 18633.0]
  - - [4096, 1024, 1, 3191, 4096, 4096, 4096, 1024]
    - [33, 18636.0]
  - - [4096, 1024, 1, 3311, 4096, 4096, 4096, 1024]
    - [17, 18635.0]
  - - [1024, 4096, 1, 3302, 1024, 1024, 1024, 4096]
    - [17, 18627.0]
  - - [1024, 4096, 1, 3681, 1024, 1024, 1024, 4096]
    - [33, 18635.0]
  - - [4096, 1024, 1, 3582, 4096, 4096, 4096, 1024]
    - [17, 18635.0]
  - - [4096, 1024, 1, 3421, 4096, 4096, 4096, 1024]
    - [33, 18631.0]
  - - [4096, 1024, 1, 3560, 4096, 4096, 4096, 1024]
    - [17, 18649.0]
  - - [1024, 4096, 1, 3495, 1024, 1024, 1024, 4096]
    - [33, 18640.0]
  - - [4096, 1024, 1, 3186, 4096, 4096, 4096, 1024]
    - [33, 18631.0]
  - - [4096, 1024, 1, 3925, 4096, 4096, 4096, 1024]
    - [0, 18615.0]
  - - [1024, 4096, 1, 3435, 1024, 1024, 1024, 4096]
    - [33, 18631.0]
  - - [4096, 1024, 1, 3434, 4096, 4096, 4096, 1024]
    - [33, 18624.0]
  - - [1024, 33708, 1, 4012, 1024, 1024, 1024, 33708]
    - [21, 20868.0]
  - - [1024, 4096, 1, 3340, 1024, 1024, 1024, 4096]
    - [17, 18612.0]
  - - [4096, 1024, 1, 3489, 4096, 4096, 4096, 1024]
    - [42, 18611.0]
  - - [1024, 4096, 1, 3162, 1024, 1024, 1024, 4096]
    - [17, 18622.0]
  - - [4096, 1024, 1, 3436, 4096, 4096, 4096, 1024]
    - [33, 18637.0]
  - - [4096, 1024, 1, 3574, 4096, 4096, 4096, 1024]
    - [17, 18639.0]
  - - [4096, 1024, 1, 3469, 4096, 4096, 4096, 1024]
    - [33, 18637.0]
  - - [1024, 4096, 1, 3410, 1024, 1024, 1024, 4096]
    - [33, 18637.0]
  - - [1024, 4096, 1, 3216, 1024, 1024, 1024, 4096]
    - [33, 18644.0]
  - - [4096, 1024, 1, 3095, 4096, 4096, 4096, 1024]
    - [17, 18632.0]
  - - [4096, 1024, 1, 3448, 4096, 4096, 4096, 1024]
    - [17, 18635.0]
  - - [1024, 4096, 1, 3176, 1024, 1024, 1024, 4096]
    - [33, 18636.0]
  - - [4096, 1024, 1, 2918, 4096, 4096, 4096, 1024]
    - [17, 18621.0]
  - - [1024, 4096, 1, 3424, 1024, 1024, 1024, 4096]
    - [0, 18640.0]
  - - [4096, 1024, 1, 3402, 4096, 4096, 4096, 1024]
    - [33, 18634.0]
  - - [4096, 1024, 1, 3145, 4096, 4096, 4096, 1024]
    - [33, 18627.0]
  - - [1024, 33708, 1, 3976, 1024, 1024, 1024, 33708]
    - [37, 20877.0]
  - - [4096, 1024, 1, 3518, 4096, 4096, 4096, 1024]
    - [17, 18615.0]
  - - [4096, 1024, 1, 3110, 4096, 4096, 4096, 1024]
    - [17, 18630.0]
  - - [4096, 1024, 1, 3325, 4096, 4096, 4096, 1024]
    - [33, 18637.0]
  - - [1024, 33708, 1, 3999, 1024, 1024, 1024, 33708]
    - [4, 20870.0]
  - - [4096, 1024, 1, 2985, 4096, 4096, 4096, 1024]
    - [33, 18619.0]
  - - [1024, 4096, 1, 3371, 1024, 1024, 1024, 4096]
    - [33, 18603.0]
  - - [4096, 1024, 1, 3342, 4096, 4096, 4096, 1024]
    - [33, 18626.0]
  - - [4096, 1024, 1, 3141, 4096, 4096, 4096, 1024]
    - [0, 18601.0]
  - - [4096, 1024, 1, 3532, 4096, 4096, 4096, 1024]
    - [33, 18637.0]
  - - [1024, 4096, 1, 3169, 1024, 1024, 1024, 4096]
    - [33, 18626.0]
  - - [1024, 4096, 1, 3514, 1024, 1024, 1024, 4096]
    - [17, 18643.0]
  - - [4096, 1024, 1, 3780, 4096, 4096, 4096, 1024]
    - [17, 18624.0]
  - - [1024, 4096, 1, 3098, 1024, 1024, 1024, 4096]
    - [33, 18630.0]
  - - [1024, 4096, 1, 3449, 1024, 1024, 1024, 4096]
    - [17, 18626.0]
  - - [1024, 4096, 1, 3222, 1024, 1024, 1024, 4096]
    - [17, 18626.0]
  - - [1024, 4096, 1, 3346, 1024, 1024, 1024, 4096]
    - [33, 18644.0]
  - - [4096, 1024, 1, 3064, 4096, 4096, 4096, 1024]
    - [17, 18638.0]
  - - [4096, 1024, 1, 3511, 4096, 4096, 4096, 1024]
    - [17, 18629.0]
  - - [4096, 1024, 1, 3384, 4096, 4096, 4096, 1024]
    - [17, 18640.0]
  - - [4096, 1024, 1, 3356, 4096, 4096, 4096, 1024]
    - [33, 18638.0]
  - - [1024, 4096, 1, 3796, 1024, 1024, 1024, 4096]
    - [17, 18638.0]
  - - [4096, 1024, 1, 3427, 4096, 4096, 4096, 1024]
    - [33, 18622.0]
  - - [4096, 1024, 1, 3390, 4096, 4096, 4096, 1024]
    - [0, 18618.0]
  - - [4096, 1024, 1, 3573, 4096, 4096, 4096, 1024]
    - [33, 18646.0]
  - - [4096, 1024, 1, 3456, 4096, 4096, 4096, 1024]
    - [17, 18650.0]
  - - [1024, 4096, 1, 3360, 1024, 1024, 1024, 4096]
    - [17, 18635.0]
  - - [1024, 33708, 1, 3977, 1024, 1024, 1024, 33708]
    - [37, 20865.0]
  - - [1024, 4096, 1, 2918, 1024, 1024, 1024, 4096]
    - [17, 18578.0]
  - - [4096, 1024, 1, 3975, 4096, 4096, 4096, 1024]
    - [17, 18632.0]
  - - [4096, 1024, 1, 3525, 4096, 4096, 4096, 1024]
    - [42, 18622.0]
  - - [4096, 1024, 1, 3398, 4096, 4096, 4096, 1024]
    - [33, 18622.0]
  - - [4096, 1024, 1, 3640, 4096, 4096, 4096, 1024]
    - [33, 18648.0]
  - - [4096, 1024, 1, 3014, 4096, 4096, 4096, 1024]
    - [17, 18633.0]
  - - [1024, 4096, 1, 3446, 1024, 1024, 1024, 4096]
    - [33, 18601.0]
  - - [1024, 33708, 1, 3796, 1024, 1024, 1024, 33708]
    - [4, 20852.0]
  - - [4096, 1024, 1, 3101, 4096, 4096, 4096, 1024]
    - [33, 18585.0]
  - - [4096, 1024, 1, 3563, 4096, 4096, 4096, 1024]
    - [33, 18609.0]
  - - [4096, 1024, 1, 3539, 4096, 4096, 4096, 1024]
    - [42, 18607.0]
  - - [4096, 1024, 1, 3182, 4096, 4096, 4096, 1024]
    - [17, 18621.0]
  - - [1024, 4096, 1, 3468, 1024, 1024, 1024, 4096]
    - [33, 18626.0]
  - - [4096, 1024, 1, 3312, 4096, 4096, 4096, 1024]
    - [17, 18598.0]
  - - [4096, 1024, 1, 3215, 4096, 4096, 4096, 1024]
    - [33, 18596.0]
  - - [4096, 1024, 1, 3910, 4096, 4096, 4096, 1024]
    - [17, 18638.0]
  - - [1024, 33708, 1, 3780, 1024, 1024, 1024, 33708]
    - [4, 20864.0]
  - - [1024, 4096, 1, 3290, 1024, 1024, 1024, 4096]
    - [33, 18588.0]
  - - [1024, 4096, 1, 4012, 1024, 1024, 1024, 4096]
    - [33, 18636.0]
  - - [1024, 4096, 1, 3385, 1024, 1024, 1024, 4096]
    - [42, 18607.0]
  - - [1024, 33708, 1, 3975, 1024, 1024, 1024, 33708]
    - [4, 20876.0]
  - - [4096, 1024, 1, 3996, 4096, 4096, 4096, 1024]
    - [17, 18625.0]
  - - [4096, 1024, 1, 2765, 4096, 4096, 4096, 1024]
    - [17, 18590.0]
  - - [4096, 1024, 1, 3538, 4096, 4096, 4096, 1024]
    - [33, 18636.0]
  - - [4096, 1024, 1, 3415, 4096, 4096, 4096, 1024]
    - [42, 18633.0]
  - - [1024, 4096, 1, 3554, 1024, 1024, 1024, 4096]
    - [33, 18632.0]
  - - [4096, 1024, 1, 3513, 4096, 4096, 4096, 1024]
    - [33, 18595.0]
  - - [1024, 4096, 1, 3304, 1024, 1024, 1024, 4096]
    - [9, 18613.0]
  - - [4096, 1024, 1, 3294, 4096, 4096, 4096, 1024]
    - [0, 18617.0]
  - - [4096, 1024, 1, 3396, 4096, 4096, 4096, 1024]
    - [33, 18599.0]
  - - [1024, 4096, 1, 3213, 1024, 1024, 1024, 4096]
    - [24, 18602.0]
  - - [4096, 1024, 1, 3137, 4096, 4096, 4096, 1024]
    - [17, 18624.0]
  - - [4096, 1024, 1, 3552, 4096, 4096, 4096, 1024]
    - [33, 18637.0]
  - - [1024, 4096, 1, 3461, 1024, 1024, 1024, 4096]
    - [33, 18625.0]
  - - [4096, 1024, 1, 3263, 4096, 4096, 4096, 1024]
    - [42, 18604.0]
  - - [4096, 1024, 1, 3430, 4096, 4096, 4096, 1024]
    - [42, 18619.0]
  - - [4096, 1024, 1, 3389, 4096, 4096, 4096, 1024]
    - [24, 18610.0]
  - - [4096, 1024, 1, 3528, 4096, 4096, 4096, 1024]
    - [33, 18610.0]
  - - [1024, 4096, 1, 3463, 1024, 1024, 1024, 4096]
    - [17, 18602.0]
  - - [4096, 1024, 1, 3526, 4096, 4096, 4096, 1024]
    - [17, 18643.0]
  - - [4096, 1024, 1, 3154, 4096, 4096, 4096, 1024]
    - [17, 18620.0]
  - - [4096, 1024, 1, 3499, 4096, 4096, 4096, 1024]
    - [24, 18628.0]
  - - [4096, 1024, 1, 3955, 4096, 4096, 4096, 1024]
    - [17, 18609.0]
  - - [1024, 4096, 1, 3297, 1024, 1024, 1024, 4096]
    - [17, 18615.0]
  - - [1024, 4096, 1, 3233, 1024, 1024, 1024, 4096]
    - [17, 18605.0]
  - - [1024, 4096, 1, 3226, 1024, 1024, 1024, 4096]
    - [17, 18590.0]
  - - [4096, 1024, 1, 3404, 4096, 4096, 4096, 1024]
    - [33, 18637.0]
  - - [4096, 1024, 1, 3355, 4096, 4096, 4096, 1024]
    - [33, 18599.0]
  - - [1024, 4096, 1, 3542, 1024, 1024, 1024, 4096]
    - [33, 18636.0]
  - - [4096, 1024, 1, 3181, 4096, 4096, 4096, 1024]
    - [0, 18583.0]
  - - [1024, 4096, 1, 3474, 1024, 1024, 1024, 4096]
    - [17, 18631.0]
  - - [4096, 1024, 1, 3319, 4096, 4096, 4096, 1024]
    - [17, 18623.0]
  - - [1024, 4096, 1, 3434, 1024, 1024, 1024, 4096]
    - [17, 18617.0]
  - - [1024, 4096, 1, 3860, 1024, 1024, 1024, 4096]
    - [17, 18641.0]
  - - [1024, 4096, 1, 3343, 1024, 1024, 1024, 4096]
    - [17, 18637.0]
  - - [1024, 4096, 1, 3488, 1024, 1024, 1024, 4096]
    - [0, 18631.0]
  - - [1024, 4096, 1, 3046, 1024, 1024, 1024, 4096]
    - [9, 18585.0]
  - - [1024, 4096, 1, 3141, 1024, 1024, 1024, 4096]
    - [24, 18602.0]
  - - [1024, 4096, 1, 3516, 1024, 1024, 1024, 4096]
    - [17, 18632.0]
  - - [4096, 1024, 1, 3147, 4096, 4096, 4096, 1024]
    - [17, 18633.0]
  - - [1024, 4096, 1, 3421, 1024, 1024, 1024, 4096]
    - [17, 18622.0]
  - - [4096, 1024, 1, 3944, 4096, 4096, 4096, 1024]
    - [33, 18646.0]
  - - [1024, 4096, 1, 3574, 1024, 1024, 1024, 4096]
    - [24, 18601.0]
  - - [1024, 4096, 1, 3977, 1024, 1024, 1024, 4096]
    - [17, 18637.0]
  - - [1024, 4096, 1, 2985, 1024, 1024, 1024, 4096]
    - [42, 18599.0]
  - - [1024, 4096, 1, 3427, 1024, 1024, 1024, 4096]
    - [0, 18634.0]
  - - [1024, 4096, 1, 3482, 1024, 1024, 1024, 4096]
    - [33, 18639.0]
  - - [1024, 4096, 1, 3332, 1024, 1024, 1024, 4096]
    - [0, 18632.0]
  - - [4096, 1024, 1, 3308, 4096, 4096, 4096, 1024]
    - [24, 18605.0]
  - - [1024, 4096, 1, 3513, 1024, 1024, 1024, 4096]
    - [17, 18640.0]
  - - [1024, 4096, 1, 3154, 1024, 1024, 1024, 4096]
    - [33, 18629.0]
  - - [1024, 4096, 1, 3955, 1024, 1024, 1024, 4096]
    - [17, 18636.0]
  - - [1024, 4096, 1, 2967, 1024, 1024, 1024, 4096]
    - [33, 18632.0]
  - - [1024, 33708, 1, 3942, 1024, 1024, 1024, 33708]
    - [4, 20880.0]
  - - [1024, 4096, 1, 3319, 1024, 1024, 1024, 4096]
    - [17, 18604.0]
  - - [4096, 1024, 1, 3860, 4096, 4096, 4096, 1024]
    - [33, 18641.0]
  - - [1024, 4096, 1, 3548, 1024, 1024, 1024, 4096]
    - [17, 18625.0]
  - - [4096, 1024, 1, 3977, 4096, 4096, 4096, 1024]
    - [33, 18641.0]
  - - [4096, 1024, 1, 3535, 4096, 4096, 4096, 1024]
    - [17, 18600.0]
  - - [1024, 4096, 1, 3541, 1024, 1024, 1024, 4096]
    - [33, 18636.0]
  - - [1024, 33708, 1, 3584, 1024, 1024, 1024, 33708]
    - [37, 20844.0]
  - - [1024, 4096, 1, 3168, 1024, 1024, 1024, 4096]
    - [33, 18632.0]
  - - [1024, 4096, 1, 3448, 1024, 1024, 1024, 4096]
    - [0, 18604.0]
  - - [4096, 1024, 1, 3343, 4096, 4096, 4096, 1024]
    - [24, 18606.0]
  - - [1024, 4096, 1, 3357, 1024, 1024, 1024, 4096]
    - [17, 18604.0]
  - - [4096, 1024, 1, 3510, 4096, 4096, 4096, 1024]
    - [33, 18614.0]
  - - [4096, 1024, 1, 3369, 4096, 4096, 4096, 1024]
    - [33, 18589.0]
  - - [4096, 1024, 1, 3379, 4096, 4096, 4096, 1024]
    - [17, 18632.0]
  - - [1024, 4096, 1, 3276, 1024, 1024, 1024, 4096]
    - [33, 18629.0]
  - - [1024, 4096, 1, 3363, 1024, 1024, 1024, 4096]
    - [33, 18600.0]
  - - [4096, 1024, 1, 3055, 4096, 4096, 4096, 1024]
    - [42, 18611.0]
  - - [1024, 4096, 1, 3524, 1024, 1024, 1024, 4096]
    - [33, 18604.0]
  - - [4096, 1024, 1, 3057, 4096, 4096, 4096, 1024]
    - [0, 18599.0]
  - - [1024, 33708, 1, 3720, 1024, 1024, 1024, 33708]
    - [21, 20847.0]
  - - [1024, 4096, 1, 3383, 1024, 1024, 1024, 4096]
    - [33, 18591.0]
  - - [1024, 4096, 1, 3522, 1024, 1024, 1024, 4096]
    - [17, 18597.0]
  - - [1024, 33708, 1, 3956, 1024, 1024, 1024, 33708]
    - [37, 20849.0]
  - - [1024, 4096, 1, 3481, 1024, 1024, 1024, 4096]
    - [17, 18585.0]
  - - [4096, 1024, 1, 3562, 4096, 4096, 4096, 1024]
    - [33, 18594.0]
  - - [4096, 1024, 1, 3299, 4096, 4096, 4096, 1024]
    - [17, 18596.0]
  - - [1024, 4096, 1, 3262, 1024, 1024, 1024, 4096]
    - [17, 18590.0]
  - - [1024, 33708, 1, 4026, 1024, 1024, 1024, 33708]
    - [37, 20845.0]
  - - [4096, 1024, 1, 3168, 4096, 4096, 4096, 1024]
    - [33, 18588.0]
  - - [1024, 4096, 1, 3999, 1024, 1024, 1024, 4096]
    - [17, 18596.0]
  - - [1024, 4096, 1, 3549, 1024, 1024, 1024, 4096]
    - [33, 18603.0]
  - - [4096, 1024, 1, 3375, 4096, 4096, 4096, 1024]
    - [17, 18633.0]
  - - [1024, 4096, 1, 3496, 1024, 1024, 1024, 4096]
    - [33, 18608.0]
  - - [1024, 4096, 1, 3190, 1024, 1024, 1024, 4096]
    - [33, 18603.0]
  - - [4096, 1024, 1, 3273, 4096, 4096, 4096, 1024]
    - [24, 18610.0]
  - - [1024, 4096, 1, 3406, 1024, 1024, 1024, 4096]
    - [17, 18590.0]
  - - [4096, 1024, 1, 4005, 4096, 4096, 4096, 1024]
    - [17, 18605.0]
  - - [4096, 1024, 1, 3555, 4096, 4096, 4096, 1024]
    - [33, 18605.0]
  - - [4096, 1024, 1, 2505, 4096, 4096, 4096, 1024]
    - [33, 18576.0]
  - - [1024, 4096, 1, 3460, 1024, 1024, 1024, 4096]
    - [33, 18607.0]
  - - [1024, 4096, 1, 3579, 1024, 1024, 1024, 4096]
    - [24, 18608.0]
  - - [1024, 33708, 1, 4030, 1024, 1024, 1024, 33708]
    - [4, 20866.0]
  - - [1024, 4096, 1, 3510, 1024, 1024, 1024, 4096]
    - [17, 18588.0]
  - - [1024, 4096, 1, 3282, 1024, 1024, 1024, 4096]
    - [17, 18591.0]
  - - [1024, 4096, 1, 3377, 1024, 1024, 1024, 4096]
    - [17, 18597.0]
  - - [1024, 4096, 1, 2935, 1024, 1024, 1024, 4096]
    - [33, 18595.0]
  - - [1024, 4096, 1, 3498, 1024, 1024, 1024, 4096]
    - [0, 18639.0]
  - - [1024, 4096, 1, 3593, 1024, 1024, 1024, 4096]
    - [0, 18604.0]
  - - [4096, 1024, 1, 3226, 4096, 4096, 4096, 1024]
    - [17, 18593.0]
  - - [1024, 4096, 1, 2499, 1024, 1024, 1024, 4096]
    - [42, 18585.0]
  - - [1024, 4096, 1, 3296, 1024, 1024, 1024, 4096]
    - [33, 18635.0]
  - - [1024, 4096, 1, 3455, 1024, 1024, 1024, 4096]
    - [17, 18603.0]
  - - [1024, 4096, 1, 3399, 1024, 1024, 1024, 4096]
    - [33, 18631.0]
  - - [1024, 4096, 1, 3205, 1024, 1024, 1024, 4096]
    - [17, 18617.0]
  - - [4096, 1024, 1, 4026, 4096, 4096, 4096, 1024]
    - [33, 18606.0]
  - - [1024, 4096, 1, 3484, 1024, 1024, 1024, 4096]
    - [33, 18602.0]
  - - [4096, 1024, 1, 3302, 4096, 4096, 4096, 1024]
    - [17, 18617.0]
  - - [1024, 4096, 1, 3485, 1024, 1024, 1024, 4096]
    - [17, 18594.0]
  - - [1024, 4096, 1, 3126, 1024, 1024, 1024, 4096]
    - [42, 18620.0]
  - - [1024, 4096, 1, 4050, 1024, 1024, 1024, 4096]
    - [17, 18637.0]
  - - [4096, 1024, 1, 3235, 4096, 4096, 4096, 1024]
    - [33, 18617.0]
  - - [1024, 33708, 1, 3955, 1024, 1024, 1024, 33708]
    - [4, 20875.0]
  - - [1024, 4096, 1, 3342, 1024, 1024, 1024, 4096]
    - [33, 18625.0]
  - - [1024, 4096, 1, 3397, 1024, 1024, 1024, 4096]
    - [0, 18625.0]
  - - [4096, 1024, 1, 3491, 4096, 4096, 4096, 1024]
    - [24, 18618.0]
  - - [1024, 4096, 1, 3503, 1024, 1024, 1024, 4096]
    - [17, 18641.0]
  - - [1024, 4096, 1, 3140, 1024, 1024, 1024, 4096]
    - [17, 18591.0]
  - - [4096, 1024, 1, 3121, 4096, 4096, 4096, 1024]
    - [42, 18619.0]
  - - [4096, 1024, 1, 3276, 4096, 4096, 4096, 1024]
    - [17, 18596.0]
  - - [1024, 4096, 1, 3321, 1024, 1024, 1024, 4096]
    - [17, 18592.0]
  - - [1024, 4096, 1, 3870, 1024, 1024, 1024, 4096]
    - [17, 18600.0]
  - - [4096, 1024, 1, 3475, 4096, 4096, 4096, 1024]
    - [33, 18630.0]
  - - [1024, 4096, 1, 2984, 1024, 1024, 1024, 4096]
    - [0, 18602.0]
  - - [4096, 1024, 1, 3363, 4096, 4096, 4096, 1024]
    - [17, 18594.0]
  - - [1024, 4096, 1, 3582, 1024, 1024, 1024, 4096]
    - [42, 18606.0]
  - - [4096, 1024, 1, 3509, 4096, 4096, 4096, 1024]
    - [33, 18638.0]
  - - [1024, 4096, 1, 3426, 1024, 1024, 1024, 4096]
    - [17, 18599.0]
  - - [4096, 1024, 1, 3136, 4096, 4096, 4096, 1024]
    - [33, 18611.0]
  - - [1024, 4096, 1, 3232, 1024, 1024, 1024, 4096]
    - [33, 18606.0]
  - - [4096, 1024, 1, 3103, 4096, 4096, 4096, 1024]
    - [17, 18625.0]
  - - [1024, 4096, 1, 3335, 1024, 1024, 1024, 4096]
    - [0, 18620.0]
  - - [1024, 4096, 1, 3900, 1024, 1024, 1024, 4096]
    - [33, 18641.0]
  - - [4096, 1024, 1, 3512, 4096, 4096, 4096, 1024]
    - [33, 18635.0]
  - - [4096, 1024, 1, 3222, 4096, 4096, 4096, 1024]
    - [24, 18609.0]
  - - [1024, 4096, 1, 3165, 1024, 1024, 1024, 4096]
    - [17, 18629.0]
  - - [4096, 1024, 1, 3408, 4096, 4096, 4096, 1024]
    - [33, 18644.0]
  - - [4096, 1024, 1, 3751, 4096, 4096, 4096, 1024]
    - [17, 18638.0]
  - - [1024, 4096, 1, 3318, 1024, 1024, 1024, 4096]
    - [17, 18625.0]
  - - [4096, 1024, 1, 3442, 4096, 4096, 4096, 1024]
    - [33, 18636.0]
  - - [1024, 4096, 1, 3413, 1024, 1024, 1024, 4096]
    - [0, 18603.0]
  - - [4096, 1024, 1, 3524, 4096, 4096, 4096, 1024]
    - [0, 18614.0]
  - - [1024, 4096, 1, 3976, 1024, 1024, 1024, 4096]
    - [33, 18651.0]
  - - [1024, 4096, 1, 3475, 1024, 1024, 1024, 4096]
    - [17, 18644.0]
  - - [1024, 4096, 1, 3534, 1024, 1024, 1024, 4096]
    - [0, 18630.0]
  - - [4096, 1024, 1, 3301, 4096, 4096, 4096, 1024]
    - [42, 18623.0]
  - - [4096, 1024, 1, 3248, 4096, 4096, 4096, 1024]
    - [17, 18642.0]
  - - [1024, 4096, 1, 2977, 1024, 1024, 1024, 4096]
    - [33, 18587.0]
  - - [4096, 1024, 1, 3346, 4096, 4096, 4096, 1024]
    - [33, 18627.0]
  - - [1024, 4096, 1, 3451, 1024, 1024, 1024, 4096]
    - [33, 18643.0]
  - - [1024, 4096, 1, 3257, 1024, 1024, 1024, 4096]
    - [33, 18636.0]
  - - [1024, 4096, 1, 3356, 1024, 1024, 1024, 4096]
    - [17, 18637.0]
  - - [4096, 1024, 1, 3348, 4096, 4096, 4096, 1024]
    - [33, 18625.0]
  - - [4096, 1024, 1, 3335, 4096, 4096, 4096, 1024]
    - [17, 18633.0]
  - - [4096, 1024, 1, 3505, 4096, 4096, 4096, 1024]
    - [33, 18637.0]
  - - [1024, 4096, 1, 3490, 1024, 1024, 1024, 4096]
    - [33, 18636.0]
  - - [4096, 1024, 1, 3447, 4096, 4096, 4096, 1024]
    - [33, 18623.0]
  - - [1024, 4096, 1, 3267, 1024, 1024, 1024, 4096]
    - [33, 18628.0]
  - - [4096, 1024, 1, 3230, 4096, 4096, 4096, 1024]
    - [17, 18631.0]
  - - [4096, 1024, 1, 3455, 4096, 4096, 4096, 1024]
    - [17, 18634.0]
  - - [1024, 4096, 1, 3925, 1024, 1024, 1024, 4096]
    - [17, 18604.0]
  - - [1024, 4096, 1, 3362, 1024, 1024, 1024, 4096]
    - [17, 18629.0]
  - - [4096, 1024, 1, 3969, 4096, 4096, 4096, 1024]
    - [17, 18625.0]
  - - [4096, 1024, 1, 3527, 4096, 4096, 4096, 1024]
    - [33, 18634.0]
  - - [1024, 4096, 1, 3585, 1024, 1024, 1024, 4096]
    - [9, 18597.0]
  - - [4096, 1024, 1, 3063, 4096, 4096, 4096, 1024]
    - [0, 18602.0]
  - - [4096, 1024, 1, 3435, 4096, 4096, 4096, 1024]
    - [33, 18626.0]
  - - [4096, 1024, 1, 3366, 4096, 4096, 4096, 1024]
    - [0, 18613.0]
  - - [4096, 1024, 1, 3581, 4096, 4096, 4096, 1024]
    - [33, 18645.0]
  - - [1024, 33708, 1, 3906, 1024, 1024, 1024, 33708]
    - [4, 20873.0]
  - - [1024, 4096, 1, 3464, 1024, 1024, 1024, 4096]
    - [17, 18627.0]
  - - [1024, 4096, 1, 3440, 1024, 1024, 1024, 4096]
    - [3, 18610.0]
  - - [4096, 1024, 1, 3143, 4096, 4096, 4096, 1024]
    - [42, 18611.0]
  - - [1024, 4096, 1, 3349, 1024, 1024, 1024, 4096]
    - [42, 18608.0]
  - - [4096, 1024, 1, 3416, 4096, 4096, 4096, 1024]
    - [33, 18653.0]
  - - [4096, 1024, 1, 3365, 4096, 4096, 4096, 1024]
    - [33, 18632.0]
  - - [1024, 4096, 1, 3470, 1024, 1024, 1024, 4096]
    - [17, 18628.0]
  - - [4096, 1024, 1, 3287, 4096, 4096, 4096, 1024]
    - [17, 18626.0]
  - - [1024, 4096, 1, 3441, 1024, 1024, 1024, 4096]
    - [0, 18614.0]
  - - [4096, 1024, 1, 3224, 4096, 4096, 4096, 1024]
    - [33, 18637.0]
  - - [1024, 4096, 1, 3387, 1024, 1024, 1024, 4096]
    - [0, 18630.0]
  - - [1024, 4096, 1, 3547, 1024, 1024, 1024, 4096]
    - [17, 18635.0]
  - - [4096, 1024, 1, 3478, 4096, 4096, 4096, 1024]
    - [17, 18629.0]
  - - [4096, 1024, 1, 3548, 4096, 4096, 4096, 1024]
    - [33, 18638.0]
  - - [1024, 33708, 1, 4020, 1024, 1024, 1024, 33708]
    - [4, 20880.0]
  - - [4096, 1024, 1, 3320, 4096, 4096, 4096, 1024]
    - [33, 18596.0]
  - - [1024, 4096, 1, 3906, 1024, 1024, 1024, 4096]
    - [9, 18606.0]
  - - [4096, 1024, 1, 3796, 4096, 4096, 4096, 1024]
    - [33, 18615.0]
  - - [1024, 4096, 1, 3306, 1024, 1024, 1024, 4096]
    - [17, 18602.0]
  - - [1024, 4096, 1, 3401, 1024, 1024, 1024, 4096]
    - [17, 18599.0]
  - - [1024, 4096, 1, 3215, 1024, 1024, 1024, 4096]
    - [33, 18637.0]
  - - [4096, 1024, 1, 4012, 4096, 4096, 4096, 1024]
    - [0, 18610.0]
  - - [1024, 4096, 1, 2765, 1024, 1024, 1024, 4096]
    - [17, 18609.0]
  - - [4096, 1024, 1, 3554, 4096, 4096, 4096, 1024]
    - [33, 18602.0]
  - - [4096, 1024, 1, 3423, 4096, 4096, 4096, 1024]
    - [24, 18606.0]
  - - [1024, 4096, 1, 3562, 1024, 1024, 1024, 4096]
    - [33, 18597.0]
  - - [1024, 4096, 1, 3489, 1024, 1024, 1024, 4096]
    - [17, 18633.0]
  - - [4096, 1024, 1, 3358, 4096, 4096, 4096, 1024]
    - [42, 18621.0]
  - - [4096, 1024, 1, 3270, 4096, 4096, 4096, 1024]
    - [17, 18626.0]
  - - [1024, 4096, 1, 3293, 1024, 1024, 1024, 4096]
    - [17, 18617.0]
  - - [1024, 4096, 1, 3376, 1024, 1024, 1024, 4096]
    - [33, 18603.0]
  - - [4096, 1024, 1, 3245, 4096, 4096, 4096, 1024]
    - [42, 18607.0]
  - - [4096, 1024, 1, 3541, 4096, 4096, 4096, 1024]
    - [33, 18628.0]
  - - [4096, 1024, 1, 3443, 4096, 4096, 4096, 1024]
    - [17, 18626.0]
  - - [4096, 1024, 1, 3438, 4096, 4096, 4096, 1024]
    - [17, 18603.0]
  - - [4096, 1024, 1, 3244, 4096, 4096, 4096, 1024]
    - [17, 18630.0]
  - - [1024, 4096, 1, 3365, 1024, 1024, 1024, 4096]
    - [33, 18630.0]
  - - [1024, 4096, 1, 3299, 1024, 1024, 1024, 4096]
    - [17, 18597.0]
  - - [1024, 4096, 1, 3471, 1024, 1024, 1024, 4096]
    - [33, 18599.0]
  - - [1024, 4096, 1, 3398, 1024, 1024, 1024, 4096]
    - [33, 18644.0]
  - - [4096, 1024, 1, 3162, 4096, 4096, 4096, 1024]
    - [33, 18592.0]
  - - [1024, 4096, 1, 4005, 1024, 1024, 1024, 4096]
    - [33, 18602.0]
  - - [4096, 1024, 1, 3579, 4096, 4096, 4096, 1024]
    - [24, 18620.0]
  - - [1024, 4096, 1, 3121, 1024, 1024, 1024, 4096]
    - [33, 18589.0]
  - - [4096, 1024, 1, 3441, 4096, 4096, 4096, 1024]
    - [33, 18600.0]
  - - [4096, 1024, 1, 3422, 4096, 4096, 4096, 1024]
    - [24, 18615.0]
  - - [4096, 1024, 1, 3444, 4096, 4096, 4096, 1024]
    - [24, 18614.0]
  - - [1024, 4096, 1, 3337, 1024, 1024, 1024, 4096]
    - [24, 18598.0]
  - - [4096, 1024, 1, 3550, 4096, 4096, 4096, 1024]
    - [42, 18609.0]
  - - [1024, 4096, 1, 3477, 1024, 1024, 1024, 4096]
    - [42, 18612.0]
  - - [4096, 1024, 1, 3490, 4096, 4096, 4096, 1024]
    - [24, 18617.0]
  - - [4096, 1024, 1, 3585, 4096, 4096, 4096, 1024]
    - [0, 18616.0]
  - - [1024, 4096, 1, 3143, 1024, 1024, 1024, 4096]
    - [33, 18635.0]
  - - [1024, 33708, 1, 3876, 1024, 1024, 1024, 33708]
    - [4, 20879.0]
  - - [1024, 4096, 1, 3320, 1024, 1024, 1024, 4096]
    - [33, 18595.0]
  - - [1024, 4096, 1, 3423, 1024, 1024, 1024, 4096]
    - [33, 18633.0]
  - - [1024, 4096, 1, 3894, 1024, 1024, 1024, 4096]
    - [17, 18637.0]
  - - [4096, 1024, 1, 3410, 4096, 4096, 4096, 1024]
    - [33, 18623.0]
  - - [1024, 4096, 1, 3561, 1024, 1024, 1024, 4096]
    - [33, 18597.0]
  - - [4096, 1024, 1, 3492, 4096, 4096, 4096, 1024]
    - [17, 18592.0]
  - - [36548, 1024, 1, 3712, 36548, 36548, 36548, 1024]
    - [4, 20844.0]
  - - [4096, 2048, 1, 128, 4096, 4096, 4096, 2048]
    - [17, 18506.0]
  - - [4096, 3072, 1, 128, 4096, 4096, 4096, 3072]
    - [33, 19188.0]
  - - [768, 3072, 1, 4096, 768, 768, 768, 3072]
    - [5, 19946.0]
  - - [768, 30522, 1, 1280, 768, 768, 768, 30522]
    - [37, 20670.0]
  - - [768, 30522, 1, 320, 768, 768, 768, 30522]
    - [34, 20228.0]
  - - [768, 30522, 1, 640, 768, 768, 768, 30522]
    - [37, 20506.0]
  - - [256, 512, 36, 98, 256, 256, 256, 512]
    - [33, 17358.0]
  - - [256, 256, 64, 56, 256, 256, 256, 256]
    - [9, 15534.0]
  - - [512, 486, 36, 800, 512, 512, 512, 486]
    - [1, 19191.0]
  - - [512, 512, 36, 1568, 512, 512, 512, 512]
    - [21, 20527.0]
  - - [256, 384, 36, 4096, 256, 256, 256, 384]
    - [22, 20040.0]
  - - [128, 256, 64, 32, 128, 128, 128, 256]
    - [19, 7661.0]
  - - [128, 256, 64, 9, 128, 128, 128, 256]
    - [36, 2904.0]
  - - [256, 512, 36, 784, 256, 256, 256, 512]
    - [4, 19977.0]
  - - [256, 324, 36, 32, 256, 256, 256, 324]
    - [0, 9691.0]
  - - [512, 512, 36, 33, 512, 512, 512, 512]
    - [33, 13671.0]
  - - [192, 384, 64, 128, 192, 192, 192, 384]
    - [0, 13182.0]
  - - [512, 512, 64, 72, 512, 512, 512, 512]
    - [9, 18993.0]
  - - [512, 512, 36, 128, 512, 512, 512, 512]
    - [22, 19309.0]
  - - [192, 384, 64, 2304, 192, 192, 192, 384]
    - [37, 14765.0]
  - - [384, 256, 64, 450, 384, 384, 384, 256]
    - [1, 19179.0]
  - - [384, 256, 64, 2304, 384, 384, 384, 256]
    - [37, 19761.0]
  - - [512, 512, 64, 144, 512, 512, 512, 512]
    - [33, 19399.0]
  - - [256, 256, 36, 6272, 256, 256, 256, 256]
    - [38, 19884.0]
  - - [256, 384, 64, 2304, 256, 256, 256, 384]
    - [21, 19761.0]
  - - [512, 512, 36, 66, 512, 512, 512, 512]
    - [33, 17273.0]
  - - [128, 256, 64, 800, 128, 128, 128, 256]
    - [22, 17397.0]
  - - [192, 256, 36, 512, 192, 192, 192, 256]
    - [38, 14160.0]
  - - [256, 512, 64, 200, 256, 256, 256, 512]
    - [0, 19026.0]
  - - [256, 512, 64, 25, 256, 256, 256, 512]
    - [35, 10744.0]
  - - [128, 256, 36, 1568, 128, 128, 128, 256]
    - [35, 18744.0]
  - - [128, 256, 64, 288, 128, 128, 128, 256]
    - [5, 16740.0]
  - - [256, 384, 64, 1152, 256, 256, 256, 384]
    - [4, 19583.0]
  - - [160, 320, 64, 288, 160, 160, 160, 320]
    - [3, 11335.0]
  - - [128, 256, 36, 128, 128, 128, 128, 256]
    - [0, 14435.0]
  - - [512, 512, 36, 16, 512, 512, 512, 512]
    - [9, 7634.0]
  - - [384, 256, 36, 800, 384, 384, 384, 256]
    - [22, 19845.0]
  - - [192, 384, 36, 4096, 192, 192, 192, 384]
    - [5, 15022.0]
  - - [256, 384, 64, 576, 256, 256, 256, 384]
    - [38, 19418.0]
  - - [512, 512, 64, 14, 512, 512, 512, 512]
    - [3, 6848.0]
  - - [512, 512, 36, 8, 512, 512, 512, 512]
    - [33, 3936.0]
  - - [512, 486, 64, 128, 512, 512, 512, 486]
    - [0, 18090.0]
  - - [256, 256, 36, 128, 256, 256, 256, 256]
    - [0, 17100.0]
  - - [256, 256, 36, 32, 256, 256, 256, 256]
    - [0, 10066.0]
  - - [192, 256, 64, 288, 192, 192, 192, 256]
    - [0, 13450.0]
  - - [256, 256, 36, 16, 256, 256, 256, 256]
    - [0, 6011.0]
  - - [128, 256, 36, 3200, 128, 128, 128, 256]
    - [30, 18809.0]
  - - [160, 320, 64, 512, 160, 160, 160, 320]
    - [17, 11926.0]
  - - [160, 320, 36, 512, 160, 160, 160, 320]
    - [36, 11631.0]
  - - [256, 512, 36, 4, 256, 256, 256, 512]
    - [45, 1958.0]
  - - [256, 324, 64, 1568, 256, 256, 256, 324]
    - [21, 16521.0]
  - - [256, 256, 36, 3200, 256, 256, 256, 256]
    - [5, 19747.0]
  - - [256, 256, 36, 210, 256, 256, 256, 256]
    - [17, 17299.0]
  - - [192, 384, 64, 576, 192, 192, 192, 384]
    - [1, 14547.0]
  - - [512, 512, 64, 800, 512, 512, 512, 512]
    - [4, 20281.0]
  - - [256, 256, 64, 1152, 256, 256, 256, 256]
    - [20, 18325.0]
  - - [512, 486, 64, 512, 512, 512, 512, 486]
    - [1, 18891.0]
  - - [256, 512, 64, 1600, 256, 256, 256, 512]
    - [21, 19441.0]
  - - [512, 512, 64, 9, 512, 512, 512, 512]
    - [3, 4518.0]
  - - [256, 512, 36, 1568, 256, 256, 256, 512]
    - [5, 20048.0]
  - - [128, 256, 64, 3200, 128, 128, 128, 256]
    - [12, 17154.0]
  - - [256, 512, 64, 4, 256, 256, 256, 512]
    - [33, 2110.0]
  - - [256, 256, 64, 450, 256, 256, 256, 256]
    - [33, 18254.0]
  - - [256, 256, 64, 72, 256, 256, 256, 256]
    - [0, 16648.0]
  - - [128, 256, 36, 3136, 128, 128, 128, 256]
    - [38, 18780.0]
  - - [160, 320, 64, 242, 160, 160, 160, 320]
    - [3, 11103.0]
  - - [512, 512, 36, 512, 512, 512, 512, 512]
    - [4, 20331.0]
  - - [512, 512, 36, 256, 512, 512, 512, 512]
    - [1, 19914.0]
  - - [512, 512, 36, 1024, 512, 512, 512, 512]
    - [4, 20447.0]
  - - [256, 256, 36, 4096, 256, 256, 256, 256]
    - [38, 19838.0]
  - - [256, 256, 64, 896, 256, 256, 256, 256]
    - [17, 18282.0]
  - - [128, 256, 64, 242, 128, 128, 128, 256]
    - [47, 16030.0]
  - - [192, 384, 36, 1024, 192, 192, 192, 384]
    - [5, 14792.0]
  - - [128, 256, 64, 100, 128, 128, 128, 256]
    - [17, 14604.0]
  - - [384, 256, 64, 1152, 384, 384, 384, 256]
    - [21, 19600.0]
  - - [192, 384, 36, 128, 192, 192, 192, 384]
    - [9, 12030.0]
  - - [128, 256, 64, 1568, 128, 128, 128, 256]
    - [22, 17525.0]
  - - [128, 256, 64, 72, 128, 128, 128, 256]
    - [9, 13222.0]
  - - [256, 256, 36, 12544, 256, 256, 256, 256]
    - [6, 20028.0]
  - - [256, 256, 36, 105, 256, 256, 256, 256]
    - [9, 15639.0]
  - - [128, 256, 36, 392, 128, 128, 128, 256]
    - [35, 17255.0]
  - - [384, 256, 36, 1024, 384, 384, 384, 256]
    - [5, 19900.0]
  - - [128, 256, 64, 1152, 128, 128, 128, 256]
    - [38, 17456.0]
  - - [256, 324, 64, 32, 256, 256, 256, 324]
    - [9, 10684.0]
  - - [256, 384, 36, 800, 256, 256, 256, 384]
    - [38, 19768.0]
  - - [512, 512, 64, 4, 512, 512, 512, 512]
    - [9, 2075.0]
  - - [192, 320, 36, 128, 192, 192, 192, 320]
    - [9, 12245.0]
  - - [192, 384, 64, 242, 192, 192, 192, 384]
    - [38, 13939.0]
  - - [256, 486, 64, 32, 256, 256, 256, 486]
    - [33, 10283.0]
  - - [512, 512, 64, 64, 512, 512, 512, 512]
    - [0, 18944.0]
  - - [128, 256, 36, 512, 128, 128, 128, 256]
    - [5, 17743.0]
  - - [512, 512, 64, 576, 512, 512, 512, 512]
    - [4, 20185.0]
  - - [256, 256, 64, 9, 256, 256, 256, 256]
    - [3, 3651.0]
  - - [128, 256, 36, 12544, 128, 128, 128, 256]
    - [35, 18530.0]
  - - [256, 512, 36, 3136, 256, 256, 256, 512]
    - [4, 20215.0]
  - - [144, 288, 36, 512, 144, 144, 144, 288]
    - [3, 9263.0]
  - - [384, 384, 36, 800, 384, 384, 384, 384]
    - [5, 20079.0]
  - - [512, 512, 64, 1600, 512, 512, 512, 512]
    - [37, 20436.0]
  - - [512, 512, 36, 4, 512, 512, 512, 512]
    - [3, 1952.0]
  - - [192, 384, 64, 450, 192, 192, 192, 384]
    - [38, 14330.0]
  - - [256, 256, 36, 1024, 256, 256, 256, 256]
    - [38, 19508.0]
  - - [256, 512, 64, 400, 256, 256, 256, 512]
    - [33, 19240.0]
  - - [128, 256, 36, 6272, 128, 128, 128, 256]
    - [2, 18244.0]
  - - [256, 256, 36, 512, 256, 256, 256, 256]
    - [5, 18775.0]
  - - [256, 256, 64, 112, 256, 256, 256, 256]
    - [33, 17411.0]
  - - [512, 512, 64, 18, 512, 512, 512, 512]
    - [13, 8473.0]
  - - [256, 256, 64, 18, 256, 256, 256, 256]
    - [0, 6765.0]
  - - [256, 256, 64, 1568, 256, 256, 256, 256]
    - [3, 18409.0]
  - - [384, 256, 36, 4096, 384, 384, 384, 256]
    - [5, 20076.0]
  - - [256, 512, 64, 800, 256, 256, 256, 512]
    - [20, 19256.0]
  - - [256, 384, 36, 2048, 256, 256, 256, 384]
    - [47, 19890.0]
  - - [384, 384, 64, 2304, 384, 384, 384, 384]
    - [37, 20583.0]
  - - [160, 320, 64, 128, 160, 160, 160, 320]
    - [17, 10613.0]
  - - [512, 512, 36, 528, 512, 512, 512, 512]
    - [1, 20346.0]
  - - [160, 320, 36, 128, 160, 160, 160, 320]
    - [0, 10666.0]
  - - [256, 512, 36, 49, 256, 256, 256, 512]
    - [9, 15072.0]
  - - [384, 384, 64, 450, 384, 384, 384, 384]
    - [1, 20167.0]
  - - [256, 256, 64, 3200, 256, 256, 256, 256]
    - [3, 18547.0]
  - - [512, 512, 64, 8, 512, 512, 512, 512]
    - [9, 4048.0]
  - - [512, 512, 64, 288, 512, 512, 512, 512]
    - [1, 19850.0]
  - - [384, 384, 36, 1024, 384, 384, 384, 384]
    - [5, 20078.0]
  - - [128, 256, 36, 16, 128, 128, 128, 256]
    - [17, 3932.0]
  - - [256, 256, 64, 288, 256, 256, 256, 256]
    - [17, 18132.0]
  - - [256, 384, 36, 1024, 256, 256, 256, 384]
    - [22, 19879.0]
  - - [256, 324, 36, 3200, 256, 256, 256, 324]
    - [5, 16853.0]
  - - [192, 384, 64, 512, 192, 192, 192, 384]
    - [22, 14392.0]
  - - [128, 256, 64, 1600, 128, 128, 128, 256]
    - [22, 17520.0]
  - - [512, 512, 36, 32, 512, 512, 512, 512]
    - [9, 13187.0]
  - - [512, 512, 36, 3136, 512, 512, 512, 512]
    - [21, 20666.0]
  - - [128, 256, 64, 6400, 128, 128, 128, 256]
    - [27, 17312.0]
  - - [256, 256, 36, 2048, 256, 256, 256, 256]
    - [5, 19719.0]
  - - [256, 256, 64, 6400, 256, 256, 256, 256]
    - [36, 18573.0]
  - - [256, 256, 36, 1680, 256, 256, 256, 256]
    - [22, 19694.0]
  - - [192, 384, 36, 2048, 192, 192, 192, 384]
    - [5, 14914.0]
  - - [256, 256, 64, 144, 256, 256, 256, 256]
    - [33, 17466.0]
  - - [384, 384, 36, 4096, 384, 384, 384, 384]
    - [38, 20278.0]
  - - [160, 320, 64, 1152, 160, 160, 160, 320]
    - [3, 11993.0]
  - - [384, 256, 36, 2048, 384, 384, 384, 256]
    - [38, 19945.0]
  - - [256, 512, 36, 392, 256, 256, 256, 512]
    - [22, 19381.0]
  - - [256, 512, 64, 50, 256, 256, 256, 512]
    - [0, 16346.0]
  - - [384, 384, 36, 2048, 384, 384, 384, 384]
    - [5, 20191.0]
  - - [256, 384, 64, 450, 256, 256, 256, 384]
    - [1, 19184.0]
  - - [192, 320, 64, 128, 192, 192, 192, 320]
    - [17, 12866.0]
  - - [128, 256, 36, 32, 128, 128, 128, 256]
    - [19, 7316.0]
  - - [512, 512, 64, 256, 512, 512, 512, 512]
    - [1, 19945.0]
  - - [256, 512, 64, 32, 256, 256, 256, 512]
    - [33, 13184.0]
  - - [384, 384, 64, 576, 384, 384, 384, 384]
    - [4, 20206.0]
  - - [512, 486, 36, 288, 512, 512, 512, 486]
    - [22, 18271.0]
  - - [144, 288, 64, 242, 144, 144, 144, 288]
    - [13, 9132.0]
  - - [384, 256, 64, 576, 384, 384, 384, 256]
    - [18, 19563.0]
  - - [512, 512, 36, 64, 512, 512, 512, 512]
    - [33, 18269.0]
  - - [448, 384, 64, 128, 448, 448, 448, 384]
    - [17, 16429.0]
  - - [144, 288, 64, 288, 144, 144, 144, 288]
    - [13, 9320.0]
  - - [512, 512, 64, 224, 512, 512, 512, 512]
    - [10, 19897.0]
  - - [384, 384, 64, 1152, 384, 384, 384, 384]
    - [21, 20465.0]
  - - [448, 384, 36, 128, 448, 448, 448, 384]
    - [33, 15611.0]
  - - [256, 486, 36, 128, 256, 256, 256, 486]
    - [0, 16503.0]
  - - [256, 256, 36, 800, 256, 256, 256, 256]
    - [5, 19434.0]
  - - [192, 384, 36, 800, 192, 192, 192, 384]
    - [5, 14727.0]
  - - [256, 256, 36, 256, 256, 256, 256, 256]
    - [0, 18127.0]
  - - [192, 384, 64, 1152, 192, 192, 192, 384]
    - [5, 14617.0]
  - - [128, 256, 64, 200, 128, 128, 128, 256]
    - [33, 15780.0]
  - - [512, 512, 64, 28, 512, 512, 512, 512]
    - [26, 12447.0]
  - - [144, 288, 64, 1152, 144, 144, 144, 288]
    - [3, 9720.0]
  - - [256, 256, 64, 576, 256, 256, 256, 256]
    - [33, 18327.0]
  - - [256, 256, 64, 2304, 256, 256, 256, 256]
    - [36, 18495.0]
  - - [192, 384, 36, 512, 192, 192, 192, 384]
    - [5, 14350.0]
  - - [256, 512, 36, 32, 256, 256, 256, 512]
    - [33, 12731.0]
  - - [512, 512, 64, 128, 512, 512, 512, 512]
    - [1, 19469.0]
  - - [512, 512, 64, 32, 512, 512, 512, 512]
    - [9, 15252.0]
  - - [128, 256, 36, 196, 128, 128, 128, 256]
    - [0, 15435.0]
  - - [196, 528, 32, 32, 196, 196, 196, 528]
    - [33, 6353.0]
  - - [196, 512, 32, 24, 196, 196, 196, 512]
    - [0, 5070.0]
  - - [1225, 192, 32, 32, 1225, 1225, 1225, 192]
    - [42, 12402.0]
  - - [1001, 1536, 1, 32, 1001, 1001, 1001, 1536]
    - [19, 6853.0]
  - - [196, 480, 32, 64, 196, 196, 196, 480]
    - [33, 9263.0]
  - - [289, 1024, 32, 384, 289, 289, 289, 1024]
    - [1, 14734.0]
  - - [784, 192, 32, 96, 784, 784, 784, 192]
    - [9, 15033.0]
  - - [50176, 256, 1, 128, 50176, 50176, 50176, 256]
    - [38, 19262.0]
  - - [289, 1024, 32, 256, 289, 289, 289, 1024]
    - [33, 14627.0]
  - - [289, 1024, 32, 192, 289, 289, 289, 1024]
    - [33, 14541.0]
  - - [12544, 512, 1, 256, 12544, 12544, 12544, 512]
    - [38, 19527.0]
  - - [1225, 1728, 1, 192, 1225, 1225, 1225, 1728]
    - [33, 15802.0]
  - - [196, 480, 32, 96, 196, 196, 196, 480]
    - [0, 10816.0]
  - - [196, 512, 32, 144, 196, 196, 196, 512]
    - [0, 13041.0]
  - - [289, 768, 32, 128, 289, 289, 289, 768]
    - [17, 13935.0]
  - - [5329, 576, 1, 96, 5329, 5329, 5329, 576]
    - [9, 16191.0]
  - - [196, 528, 32, 128, 196, 196, 196, 528]
    - [9, 11914.0]
  - - [5329, 448, 1, 64, 5329, 5329, 5329, 448]
    - [9, 12754.0]
  - - [784, 256, 32, 64, 784, 784, 784, 256]
    - [9, 15224.0]
  - - [784, 192, 32, 32, 784, 784, 784, 192]
    - [0, 11731.0]
  - - [21609, 288, 1, 32, 21609, 21609, 21609, 288]
    - [33, 11315.0]
  - - [784, 256, 32, 32, 784, 784, 784, 256]
    - [24, 12718.0]
  - - [5041, 720, 1, 192, 5041, 5041, 5041, 720]
    - [0, 16343.0]
  - - [196, 512, 32, 128, 196, 196, 196, 512]
    - [0, 12687.0]
  - - [289, 768, 32, 160, 289, 289, 289, 768]
    - [33, 14054.0]
  - - [1001, 4096, 1, 512, 1001, 1001, 1001, 4096]
    - [0, 17948.0]
  - - [1225, 192, 32, 64, 1225, 1225, 1225, 192]
    - [0, 16429.0]
  - - [784, 192, 32, 16, 784, 784, 784, 192]
    - [17, 6644.0]
  - - [3136, 1024, 1, 2048, 3136, 3136, 3136, 1024]
    - [22, 18201.0]
  - - [784, 256, 32, 128, 784, 784, 784, 256]
    - [5, 16013.0]
  - - [196, 512, 32, 32, 196, 196, 196, 512]
    - [33, 6439.0]
  - - [1225, 384, 32, 96, 1225, 1225, 1225, 384]
    - [0, 18163.0]
  - - [5041, 576, 1, 96, 5041, 5041, 5041, 576]
    - [17, 15838.0]
  - - [5329, 160, 32, 64, 5329, 5329, 5329, 160]
    - [0, 13447.0]
  - - [1225, 288, 32, 48, 1225, 1225, 1225, 288]
    - [9, 13367.0]
  - - [4096, 9216, 1, 512, 4096, 4096, 4096, 9216]
    - [21, 20721.0]
  - - [196, 480, 32, 192, 196, 196, 196, 480]
    - [33, 12436.0]
  - - [3136, 1024, 1, 512, 3136, 3136, 3136, 1024]
    - [5, 17604.0]
  - - [784, 192, 32, 64, 784, 784, 784, 192]
    - [17, 14638.0]
  - - [289, 1024, 32, 128, 289, 289, 289, 1024]
    - [0, 14167.0]
  - - [289, 768, 32, 192, 289, 289, 289, 768]
    - [33, 14120.0]
  - - [196, 512, 32, 112, 196, 196, 196, 512]
    - [0, 12567.0]
  - - [1001, 2048, 1, 32, 1001, 1001, 1001, 2048]
    - [33, 7885.0]
  - - [1225, 288, 32, 64, 1225, 1225, 1225, 288]
    - [9, 14941.0]
  - - [1225, 384, 32, 192, 1225, 1225, 1225, 384]
    - [38, 18777.0]
  - - [50176, 256, 1, 512, 50176, 50176, 50176, 256]
    - [4, 20134.0]
  - - [196, 512, 32, 160, 196, 196, 196, 512]
    - [9, 12923.0]
  - - [4096, 4096, 1, 512, 4096, 4096, 4096, 4096]
    - [37, 20256.0]
  - - [1225, 256, 32, 64, 1225, 1225, 1225, 256]
    - [9, 16937.0]
  - - [196, 480, 32, 16, 196, 196, 196, 480]
    - [33, 3431.0]
  - - [1225, 256, 32, 48, 1225, 1225, 1225, 256]
    - [0, 15845.0]
  - - [1225, 1200, 1, 64, 1225, 1225, 1225, 1200]
    - [33, 10453.0]
  - - [1225, 384, 32, 64, 1225, 1225, 1225, 384]
    - [0, 17503.0]
  - - [12544, 512, 1, 1024, 12544, 12544, 12544, 512]
    - [1, 20088.0]
  - - [196, 512, 32, 64, 196, 196, 196, 512]
    - [33, 9843.0]
  - - [196, 528, 32, 256, 196, 196, 196, 528]
    - [0, 12706.0]
  - - [196, 528, 32, 160, 196, 196, 196, 528]
    - [0, 12260.0]
  - - [1225, 192, 32, 48, 1225, 1225, 1225, 192]
    - [0, 15465.0]
  - - [1001, 2048, 1, 64, 1001, 1001, 1001, 2048]
    - [33, 11993.0]
  - - [289, 768, 128, 128, 289, 289, 289, 768]
    - [0, 14649.0]
  - - [1225, 192, 128, 64, 1225, 1225, 1225, 192]
    - [40, 8201.0]
  - - [1225, 288, 128, 48, 1225, 1225, 1225, 288]
    - [16, 6826.0]
  - - [289, 768, 128, 192, 289, 289, 289, 768]
    - [17, 14734.0]
  - - [289, 768, 128, 160, 289, 289, 289, 768]
    - [0, 14467.0]
  - - [1225, 256, 128, 48, 1225, 1225, 1225, 256]
    - [0, 6901.0]
  - - [1225, 192, 128, 48, 1225, 1225, 1225, 192]
    - [40, 7408.0]
  - - [1225, 288, 128, 64, 1225, 1225, 1225, 288]
    - [8, 8433.0]
  - - [1225, 256, 128, 64, 1225, 1225, 1225, 256]
    - [7, 7484.0]
  - - [1001, 2048, 1, 128, 1001, 1001, 1001, 2048]
    - [17, 14230.0]
  - - [1225, 192, 128, 32, 1225, 1225, 1225, 192]
    - [45, 7979.0]
  - - [1001, 1536, 1, 64, 1001, 1001, 1001, 1536]
    - [26, 9498.0]
  - - [1024, 4096, 1, 64, 1024, 1024, 1024, 4096]
    - [9, 16151.0]
  - - [1024, 4096, 1, 6336, 1024, 1024, 1024, 4096]
    - [33, 18654.0]
  - - [512, 33708, 1, 3780, 512, 512, 512, 33708]
    - [4, 20383.0]
  - - [512, 33708, 1, 3968, 512, 512, 512, 33708]
    - [4, 20394.0]
  - - [512, 33708, 1, 4030, 512, 512, 512, 33708]
    - [37, 20379.0]
  - - [196, 256, 64, 1024, 196, 196, 196, 256]
    - [17, 14086.0]
  - - [196, 1024, 64, 256, 196, 196, 196, 1024]
    - [17, 14886.0]
  - - [289, 768, 64, 128, 289, 289, 289, 768]
    - [17, 14378.0]
  - - [289, 768, 64, 160, 289, 289, 289, 768]
    - [17, 14508.0]
  - - [289, 768, 64, 192, 289, 289, 289, 768]
    - [17, 14541.0]
  - - [784, 128, 64, 512, 784, 784, 784, 128]
    - [9, 16841.0]
  - - [784, 512, 64, 128, 784, 784, 784, 512]
    - [0, 17091.0]
  - - [1225, 192, 64, 32, 1225, 1225, 1225, 192]
    - [9, 12811.0]
  - - [1225, 192, 64, 48, 1225, 1225, 1225, 192]
    - [9, 16679.0]
  - - [1225, 192, 64, 64, 1225, 1225, 1225, 192]
    - [17, 17497.0]
  - - [1225, 256, 64, 48, 1225, 1225, 1225, 256]
    - [9, 16949.0]
  - - [1225, 256, 64, 64, 1225, 1225, 1225, 256]
    - [9, 17801.0]
  - - [1225, 288, 64, 48, 1225, 1225, 1225, 288]
    - [33, 14548.0]
  - - [1225, 288, 64, 64, 1225, 1225, 1225, 288]
    - [0, 15595.0]
  - - [3136, 256, 64, 64, 3136, 3136, 3136, 256]
    - [0, 13888.0]
  - - [256, 44505, 1, 8976, 256, 256, 256, 44505]
    - [21, 20128.0]
  - - [512, 33708, 1, 3796, 512, 512, 512, 33708]
    - [21, 20344.0]
  - - [512, 33708, 1, 3822, 512, 512, 512, 33708]
    - [21, 20360.0]
  - - [512, 33708, 1, 3840, 512, 512, 512, 33708]
    - [37, 20351.0]
  - - [512, 33708, 1, 3859, 512, 512, 512, 33708]
    - [21, 20363.0]
  - - [512, 33708, 1, 3870, 512, 512, 512, 33708]
    - [4, 20338.0]
  - - [512, 33708, 1, 3876, 512, 512, 512, 33708]
    - [4, 20343.0]
  - - [512, 33708, 1, 3906, 512, 512, 512, 33708]
    - [4, 20345.0]
  - - [512, 33708, 1, 3910, 512, 512, 512, 33708]
    - [4, 20346.0]
  - - [512, 33708, 1, 3925, 512, 512, 512, 33708]
    - [21, 20345.0]
  - - [512, 33708, 1, 3942, 512, 512, 512, 33708]
    - [4, 20341.0]
  - - [512, 33708, 1, 3944, 512, 512, 512, 33708]
    - [4, 20347.0]
  - - [512, 33708, 1, 3955, 512, 512, 512, 33708]
    - [4, 20344.0]
  - - [512, 33708, 1, 3969, 512, 512, 512, 33708]
    - [4, 20347.0]
  - - [512, 33708, 1, 3976, 512, 512, 512, 33708]
    - [4, 20340.0]
  - - [512, 33708, 1, 3977, 512, 512, 512, 33708]
    - [4, 20344.0]
  - - [512, 33708, 1, 3978, 512, 512, 512, 33708]
    - [4, 20346.0]
  - - [512, 33708, 1, 3990, 512, 512, 512, 33708]
    - [4, 20346.0]
  - - [512, 33708, 1, 3995, 512, 512, 512, 33708]
    - [21, 20346.0]
  - - [512, 33708, 1, 3996, 512, 512, 512, 33708]
    - [4, 20343.0]
  - - [512, 33708, 1, 3999, 512, 512, 512, 33708]
    - [4, 20342.0]
  - - [512, 33708, 1, 4005, 512, 512, 512, 33708]
    - [4, 20345.0]
  - - [512, 33708, 1, 4012, 512, 512, 512, 33708]
    - [21, 20342.0]
  - - [512, 33708, 1, 4020, 512, 512, 512, 33708]
    - [4, 20345.0]
  - - [512, 33708, 1, 4026, 512, 512, 512, 33708]
    - [37, 20339.0]
  - - [512, 33708, 1, 4032, 512, 512, 512, 33708]
    - [4, 20351.0]
  - - [1024, 3072, 1, 2048, 1024, 1024, 1024, 3072]
    - [17, 18739.0]
  - - [1024, 3072, 1, 3072, 1024, 1024, 1024, 3072]
    - [33, 18832.0]
  - - [1024, 30522, 1, 20, 1024, 1024, 1024, 30522]
    - [3, 10151.0]
  - - [1024, 30522, 1, 80, 1024, 1024, 1024, 30522]
    - [9, 18774.0]
  - - [1024, 30522, 1, 120, 1024, 1024, 1024, 30522]
    - [9, 19163.0]
  - - [1024, 4096, 1, 3840, 1024, 1024, 1024, 4096]
    - [17, 18606.0]
  - - [1024, 4096, 1, 3968, 1024, 1024, 1024, 4096]
    - [33, 18608.0]
  - - [1024, 4096, 1, 7200, 1024, 1024, 1024, 4096]
    - [33, 18624.0]
  - - [1024, 4096, 1, 8160, 1024, 1024, 1024, 4096]
    - [17, 18613.0]
  - - [1024, 4096, 1, 9520, 1024, 1024, 1024, 4096]
    - [33, 18638.0]
  - - [1024, 4096, 1, 10200, 1024, 1024, 1024, 4096]
    - [33, 18619.0]
  - - [1024, 42720, 1, 3968, 1024, 1024, 1024, 42720]
    - [37, 20839.0]
  - - [1024, 42720, 1, 7200, 1024, 1024, 1024, 42720]
    - [21, 20841.0]
  - - [1024, 42720, 1, 9520, 1024, 1024, 1024, 42720]
    - [37, 20847.0]
  - - [4096, 1024, 1, 3840, 4096, 4096, 4096, 1024]
    - [0, 18599.0]
  - - [4096, 1024, 1, 3968, 4096, 4096, 4096, 1024]
    - [17, 18596.0]
  - - [4096, 1024, 1, 7200, 4096, 4096, 4096, 1024]
    - [36, 18591.0]
  - - [4096, 1024, 1, 8160, 4096, 4096, 4096, 1024]
    - [3, 18606.0]
  - - [4096, 1024, 1, 9520, 4096, 4096, 4096, 1024]
    - [20, 18605.0]
  - - [4096, 1024, 1, 10200, 4096, 4096, 4096, 1024]
    - [36, 18600.0]
  - - [5760, 5760, 1, 5760, 5760, 5760, 5760, 5760]
    - [4, 20775.0]
  - - [7744, 7744, 1, 7744, 7744, 7744, 7744, 7744]
    - [4, 20634.0]
  - - [1152, 1152, 1, 384, 1152, 1152, 1152, 1152]
    - [17, 15546.0]
  - - [1536, 1536, 1, 384, 1536, 1536, 1536, 1536]
    - [38, 19113.0]
  - - [1920, 1920, 1, 384, 1920, 1920, 1920, 1920]
    - [33, 18365.0]
  - - [2304, 2304, 1, 384, 2304, 2304, 2304, 2304]
    - [22, 19741.0]
  - - [2688, 2688, 1, 384, 2688, 2688, 2688, 2688]
    - [17, 19106.0]
  - - [3072, 3072, 1, 384, 3072, 3072, 3072, 3072]
    - [10, 20137.0]
  - - [3456, 3456, 1, 384, 3456, 3456, 3456, 3456]
    - [37, 19717.0]
  - - [3840, 3840, 1, 384, 3840, 3840, 3840, 3840]
    - [38, 20201.0]
  - - [4224, 4224, 1, 384, 4224, 4224, 4224, 4224]
    - [4, 20092.0]
  - - [4608, 4608, 1, 384, 4608, 4608, 4608, 4608]
    - [4, 20574.0]
  - - [4992, 4992, 1, 384, 4992, 4992, 4992, 4992]
    - [37, 20335.0]
  - - [5376, 5376, 1, 384, 5376, 5376, 5376, 5376]
    - [38, 20308.0]
  - - [5760, 5760, 1, 384, 5760, 5760, 5760, 5760]
    - [34, 20427.0]
  - - [6144, 6144, 1, 384, 6144, 6144, 6144, 6144]
    - [4, 20562.0]
  - - [6528, 6528, 1, 384, 6528, 6528, 6528, 6528]
    - [21, 20539.0]
  - - [6912, 6912, 1, 384, 6912, 6912, 6912, 6912]
    - [37, 20530.0]
  - - [7296, 7296, 1, 384, 7296, 7296, 7296, 7296]
    - [21, 20627.0]
  - - [7680, 7680, 1, 384, 7680, 7680, 7680, 7680]
    - [37, 20716.0]
  - - [1536, 768, 1, 384, 1536, 1536, 1536, 768]
    - [19, 16581.0]
  - - [1920, 960, 1, 384, 1920, 1920, 1920, 960]
    - [17, 16560.0]
  - - [2304, 1152, 1, 384, 2304, 2304, 2304, 1152]
    - [5, 17393.0]
  - - [2688, 1344, 1, 384, 2688, 2688, 2688, 1344]
    - [17, 18049.0]
  - - [3072, 1536, 1, 384, 3072, 3072, 3072, 1536]
    - [47, 19648.0]
  - - [3456, 1728, 1, 384, 3456, 3456, 3456, 1728]
    - [33, 18766.0]
  - - [3840, 1920, 1, 384, 3840, 3840, 3840, 1920]
    - [34, 19368.0]
  - - [4224, 2112, 1, 384, 4224, 4224, 4224, 2112]
    - [17, 19134.0]
  - - [4608, 2304, 1, 384, 4608, 4608, 4608, 2304]
    - [4, 20217.0]
  - - [4992, 2496, 1, 384, 4992, 4992, 4992, 2496]
    - [1, 19501.0]
  - - [5376, 2688, 1, 384, 5376, 5376, 5376, 2688]
    - [37, 20065.0]
  - - [5760, 2880, 1, 384, 5760, 5760, 5760, 2880]
    - [18, 19850.0]
  - - [6144, 3072, 1, 384, 6144, 6144, 6144, 3072]
    - [37, 20503.0]
  - - [6528, 3264, 1, 384, 6528, 6528, 6528, 3264]
    - [37, 20046.0]
  - - [6912, 3456, 1, 384, 6912, 6912, 6912, 3456]
    - [4, 20397.0]
  - - [7296, 3648, 1, 384, 7296, 7296, 7296, 3648]
    - [18, 20175.0]
  - - [7680, 3840, 1, 384, 7680, 7680, 7680, 3840]
    - [37, 20711.0]
  - - [768, 1536, 1, 384, 768, 768, 768, 1536]
    - [35, 17422.0]
  - - [1152, 2304, 1, 384, 1152, 1152, 1152, 2304]
    - [5, 17488.0]
  - - [1536, 3072, 1, 384, 1536, 1536, 1536, 3072]
    - [38, 19742.0]
  - - [1920, 3840, 1, 384, 1920, 1920, 1920, 3840]
    - [18, 19391.0]
  - - [2304, 4608, 1, 384, 2304, 2304, 2304, 4608]
    - [4, 20265.0]
  - - [2688, 5376, 1, 384, 2688, 2688, 2688, 5376]
    - [18, 20111.0]
  - - [3072, 6144, 1, 384, 3072, 3072, 3072, 6144]
    - [14, 20531.0]
  - - [3456, 6912, 1, 384, 3456, 3456, 3456, 6912]
    - [4, 20442.0]
  - - [3840, 7680, 1, 384, 3840, 3840, 3840, 7680]
    - [37, 20583.0]
  - - [4224, 8448, 1, 384, 4224, 4224, 4224, 8448]
    - [4, 20521.0]
  - - [4608, 9216, 1, 384, 4608, 4608, 4608, 9216]
    - [37, 20628.0]
  - - [4992, 9984, 1, 384, 4992, 4992, 4992, 9984]
    - [37, 20664.0]
  - - [5376, 10752, 1, 384, 5376, 5376, 5376, 10752]
    - [37, 20729.0]
  - - [5760, 11520, 1, 384, 5760, 5760, 5760, 11520]
    - [21, 20738.0]
  - - [6144, 12288, 1, 384, 6144, 6144, 6144, 12288]
    - [21, 20737.0]
  - - [6528, 13056, 1, 384, 6528, 6528, 6528, 13056]
    - [21, 20785.0]
  - - [6912, 13824, 1, 384, 6912, 6912, 6912, 13824]
    - [37, 20819.0]
  - - [7296, 14592, 1, 384, 7296, 7296, 7296, 14592]
    - [4, 20831.0]
  - - [7680, 15360, 1, 384, 7680, 7680, 7680, 15360]
    - [37, 20840.0]
  - - [2048, 2048, 1, 1024, 2048, 2048, 2048, 2048]
    - [33, 18438.0]
  - - [256, 10240, 1, 8976, 256, 256, 256, 10240]
    - [3, 19032.0]
  - - [256, 10496, 1, 8976, 256, 256, 256, 10496]
    - [22, 18342.0]
  - - [256, 11008, 1, 8976, 256, 256, 256, 11008]
    - [38, 19203.0]
  - - [256, 11264, 1, 8976, 256, 256, 256, 11264]
    - [22, 19592.0]
  - - [256, 11520, 1, 8976, 256, 256, 256, 11520]
    - [22, 20060.0]
  - - [256, 11776, 1, 8976, 256, 256, 256, 11776]
    - [33, 18127.0]
  - - [256, 12544, 1, 8976, 256, 256, 256, 12544]
    - [20, 19261.0]
  - - [256, 12800, 1, 8976, 256, 256, 256, 12800]
    - [23, 18793.0]
  - - [256, 13312, 1, 8976, 256, 256, 256, 13312]
    - [23, 19521.0]
  - - [256, 13568, 1, 8976, 256, 256, 256, 13568]
    - [39, 19908.0]
  - - [256, 14336, 1, 8976, 256, 256, 256, 14336]
    - [36, 18736.0]
  - - [256, 14848, 1, 8976, 256, 256, 256, 14848]
    - [36, 19395.0]
  - - [256, 15104, 1, 8976, 256, 256, 256, 15104]
    - [5, 18970.0]
  - - [256, 15872, 1, 8976, 256, 256, 256, 15872]
    - [22, 19946.0]
  - - [256, 16128, 1, 8976, 256, 256, 256, 16128]
    - [5, 20247.0]
  - - [256, 17152, 1, 8976, 256, 256, 256, 17152]
    - [20, 19485.0]
  - - [256, 17408, 1, 8976, 256, 256, 256, 17408]
    - [23, 19324.0]
  - - [256, 18688, 1, 8976, 256, 256, 256, 18688]
    - [13, 18781.0]
  - - [256, 19968, 1, 8976, 256, 256, 256, 19968]
    - [21, 19673.0]
  - - [256, 20480, 1, 8976, 256, 256, 256, 20480]
    - [37, 20201.0]
  - - [256, 20992, 1, 8976, 256, 256, 256, 20992]
    - [33, 18927.0]
  - - [256, 21248, 1, 8976, 256, 256, 256, 21248]
    - [3, 19138.0]
  - - [256, 22016, 1, 8976, 256, 256, 256, 22016]
    - [23, 19642.0]
  - - [256, 26112, 1, 8976, 256, 256, 256, 26112]
    - [31, 19491.0]
  - - [256, 32512, 1, 8976, 256, 256, 256, 32512]
    - [37, 19490.0]
  - - [256, 33536, 1, 8976, 256, 256, 256, 33536]
    - [4, 20099.0]
  - - [256, 4864, 1, 8976, 256, 256, 256, 4864]
    - [3, 15776.0]
  - - [256, 5120, 1, 8976, 256, 256, 256, 5120]
    - [3, 16570.0]
  - - [256, 5632, 1, 8976, 256, 256, 256, 5632]
    - [3, 18169.0]
  - - [256, 5888, 1, 8976, 256, 256, 256, 5888]
    - [22, 16891.0]
  - - [256, 6144, 1, 8976, 256, 256, 256, 6144]
    - [38, 17606.0]
  - - [256, 7168, 1, 8976, 256, 256, 256, 7168]
    - [33, 17103.0]
  - - [256, 8192, 1, 8976, 256, 256, 256, 8192]
    - [23, 17851.0]
  - - [256, 8960, 1, 8976, 256, 256, 256, 8960]
    - [23, 19448.0]
  - - [256, 9728, 1, 8976, 256, 256, 256, 9728]
    - [28, 18124.0]
  - - [256, 9984, 1, 8976, 256, 256, 256, 9984]
    - [3, 18616.0]
  - - [3200, 2048, 1, 1024, 3200, 3200, 3200, 2048]
    - [33, 18985.0]
  - - [4096, 4096, 1, 1024, 4096, 4096, 4096, 4096]
    - [37, 20367.0]
  - - [512, 3280, 1, 1600, 512, 512, 512, 3280]
    - [2, 18126.0]
  - - [512, 3280, 1, 200, 512, 512, 512, 3280]
    - [5, 15813.0]
  - - [768, 2048, 1, 256, 768, 768, 768, 2048]
    - [22, 16223.0]
  - - [1600, 1024, 1, 960, 1600, 1600, 1600, 1024]
    - [22, 17609.0]
  - - [2048, 2048, 1, 960, 2048, 2048, 2048, 2048]
    - [17, 18504.0]
  - - [1024, 3072, 1, 1024, 1024, 1024, 1024, 3072]
    - [33, 18700.0]
  - - [1024, 3072, 1, 512, 1024, 1024, 1024, 3072]
    - [0, 18517.0]
  - - [1024, 4096, 1, 2048, 1024, 1024, 1024, 4096]
    - [17, 18593.0]
  - - [1024, 30528, 1, 2048, 1024, 1024, 1024, 30528]
    - [37, 20562.0]
  - - [1024, 4096, 1, 4096, 1024, 1024, 1024, 4096]
    - [33, 18648.0]
  - - [1024, 30528, 1, 4096, 1024, 1024, 1024, 30528]
    - [37, 20628.0]
  - - [9216, 128, 1, 128, 9216, 9216, 9216, 128]
    - [0, 12884.0]
  - - [9600, 128, 1, 128, 9600, 9600, 9600, 128]
    - [0, 13240.0]
  - - [9984, 128, 1, 128, 9984, 9984, 9984, 128]
    - [0, 13746.0]
  - - [10368, 128, 1, 128, 10368, 10368, 10368, 128]
    - [0, 14203.0]
  - - [10752, 128, 1, 128, 10752, 10752, 10752, 128]
    - [0, 14416.0]
  - - [11136, 128, 1, 128, 11136, 11136, 11136, 128]
    - [17, 14980.0]
  - - [11520, 128, 1, 128, 11520, 11520, 11520, 128]
    - [33, 13919.0]
  - - [11904, 128, 1, 128, 11904, 11904, 11904, 128]
    - [33, 14362.0]
  - - [12288, 128, 1, 128, 12288, 12288, 12288, 128]
    - [0, 14695.0]
  - - [12672, 128, 1, 128, 12672, 12672, 12672, 128]
    - [33, 15067.0]
  - - [13056, 128, 1, 128, 13056, 13056, 13056, 128]
    - [0, 15367.0]
  - - [13440, 128, 1, 128, 13440, 13440, 13440, 128]
    - [5, 15888.0]
  - - [13824, 128, 1, 128, 13824, 13824, 13824, 128]
    - [0, 15950.0]
  - - [14208, 128, 1, 128, 14208, 14208, 14208, 128]
    - [17, 15057.0]
  - - [14592, 128, 1, 128, 14592, 14592, 14592, 128]
    - [0, 15208.0]
  - - [14976, 128, 1, 128, 14976, 14976, 14976, 128]
    - [33, 15589.0]
  - - [15360, 128, 1, 128, 15360, 15360, 15360, 128]
    - [0, 15908.0]
  - - [15744, 128, 1, 128, 15744, 15744, 15744, 128]
    - [0, 16326.0]
  - - [16128, 128, 1, 128, 16128, 16128, 16128, 128]
    - [33, 15292.0]
  - - [16512, 128, 1, 128, 16512, 16512, 16512, 128]
    - [15, 15638.0]
  - - [16896, 128, 1, 128, 16896, 16896, 16896, 128]
    - [33, 15711.0]
  - - [17280, 128, 1, 128, 17280, 17280, 17280, 128]
    - [38, 16252.0]
  - - [17664, 128, 1, 128, 17664, 17664, 17664, 128]
    - [0, 16314.0]
  - - [18048, 128, 1, 128, 18048, 18048, 18048, 128]
    - [5, 17033.0]
  - - [18432, 128, 1, 128, 18432, 18432, 18432, 128]
    - [0, 16890.0]
  - - [18816, 128, 1, 128, 18816, 18816, 18816, 128]
    - [0, 15842.0]
  - - [19200, 128, 1, 128, 19200, 19200, 19200, 128]
    - [0, 15968.0]
  - - [19584, 128, 1, 128, 19584, 19584, 19584, 128]
    - [17, 16337.0]
  - - [19968, 128, 1, 128, 19968, 19968, 19968, 128]
    - [0, 16490.0]
  - - [20352, 128, 1, 128, 20352, 20352, 20352, 128]
    - [33, 16926.0]
  - - [20736, 128, 1, 128, 20736, 20736, 20736, 128]
    - [17, 16086.0]
  - - [21120, 128, 1, 128, 21120, 21120, 21120, 128]
    - [38, 16400.0]
  - - [21504, 128, 1, 128, 21504, 21504, 21504, 128]
    - [0, 16372.0]
  - - [21888, 128, 1, 128, 21888, 21888, 21888, 128]
    - [5, 16820.0]
  - - [22272, 128, 1, 128, 22272, 22272, 22272, 128]
    - [5, 16847.0]
  - - [22656, 128, 1, 128, 22656, 22656, 22656, 128]
    - [5, 17329.0]
  - - [23040, 128, 1, 128, 23040, 23040, 23040, 128]
    - [0, 17268.0]
  - - [9216, 128, 1, 256, 9216, 9216, 9216, 128]
    - [3, 16377.0]
  - - [9600, 128, 1, 256, 9600, 9600, 9600, 128]
    - [0, 14390.0]
  - - [9984, 128, 1, 256, 9984, 9984, 9984, 128]
    - [33, 14911.0]
  - - [10368, 128, 1, 256, 10368, 10368, 10368, 128]
    - [0, 15485.0]
  - - [10752, 128, 1, 256, 10752, 10752, 10752, 128]
    - [0, 15885.0]
  - - [11136, 128, 1, 256, 11136, 11136, 11136, 128]
    - [17, 16497.0]
  - - [11520, 128, 1, 256, 11520, 11520, 11520, 128]
    - [15, 14992.0]
  - - [11904, 128, 1, 256, 11904, 11904, 11904, 128]
    - [5, 15628.0]
  - - [12288, 128, 1, 256, 12288, 12288, 12288, 128]
    - [22, 15790.0]
  - - [12672, 128, 1, 256, 12672, 12672, 12672, 128]
    - [38, 16556.0]
  - - [13056, 128, 1, 256, 13056, 13056, 13056, 128]
    - [30, 16660.0]
  - - [13440, 128, 1, 256, 13440, 13440, 13440, 128]
    - [38, 17462.0]
  - - [13824, 128, 1, 256, 13824, 13824, 13824, 128]
    - [5, 17558.0]
  - - [14208, 128, 1, 256, 14208, 14208, 14208, 128]
    - [33, 15988.0]
  - - [14592, 128, 1, 256, 14592, 14592, 14592, 128]
    - [0, 16231.0]
  - - [14976, 128, 1, 256, 14976, 14976, 14976, 128]
    - [33, 16749.0]
  - - [15360, 128, 1, 256, 15360, 15360, 15360, 128]
    - [0, 17050.0]
  - - [15744, 128, 1, 256, 15744, 15744, 15744, 128]
    - [17, 17548.0]
  - - [16128, 128, 1, 256, 16128, 16128, 16128, 128]
    - [22, 16251.0]
  - - [16512, 128, 1, 256, 16512, 16512, 16512, 128]
    - [5, 16762.0]
  - - [16896, 128, 1, 256, 16896, 16896, 16896, 128]
    - [15, 16880.0]
  - - [17280, 128, 1, 256, 17280, 17280, 17280, 128]
    - [47, 17476.0]
  - - [17664, 128, 1, 256, 17664, 17664, 17664, 128]
    - [15, 17519.0]
  - - [18048, 128, 1, 256, 18048, 18048, 18048, 128]
    - [38, 18197.0]
  - - [18432, 128, 1, 256, 18432, 18432, 18432, 128]
    - [22, 18225.0]
  - - [18816, 128, 1, 256, 18816, 18816, 18816, 128]
    - [33, 16682.0]
  - - [19200, 128, 1, 256, 19200, 19200, 19200, 128]
    - [33, 16958.0]
  - - [19584, 128, 1, 256, 19584, 19584, 19584, 128]
    - [33, 17279.0]
  - - [19968, 128, 1, 256, 19968, 19968, 19968, 128]
    - [33, 17532.0]
  - - [20352, 128, 1, 256, 20352, 20352, 20352, 128]
    - [33, 17908.0]
  - - [20736, 128, 1, 256, 20736, 20736, 20736, 128]
    - [5, 17038.0]
  - - [21120, 128, 1, 256, 21120, 21120, 21120, 128]
    - [5, 17362.0]
  - - [21504, 128, 1, 256, 21504, 21504, 21504, 128]
    - [38, 17537.0]
  - - [21888, 128, 1, 256, 21888, 21888, 21888, 128]
    - [22, 17922.0]
  - - [22272, 128, 1, 256, 22272, 22272, 22272, 128]
    - [5, 18047.0]
  - - [22656, 128, 1, 256, 22656, 22656, 22656, 128]
    - [5, 18551.0]
  - - [23040, 128, 1, 256, 23040, 23040, 23040, 128]
    - [15, 18559.0]
  - - [8064, 8064, 1, 384, 8064, 8064, 8064, 8064]
    - [37, 20737.0]
  - - [8448, 8448, 1, 384, 8448, 8448, 8448, 8448]
    - [21, 20706.0]
  - - [8832, 8832, 1, 384, 8832, 8832, 8832, 8832]
    - [37, 20778.0]
  - - [9216, 9216, 1, 384, 9216, 9216, 9216, 9216]
    - [21, 20759.0]
  - - [9600, 9600, 1, 384, 9600, 9600, 9600, 9600]
    - [14, 20794.0]
  - - [9984, 9984, 1, 384, 9984, 9984, 9984, 9984]
    - [21, 20802.0]
  - - [10368, 10368, 1, 384, 10368, 10368, 10368, 10368]
    - [18, 20806.0]
  - - [10752, 10752, 1, 384, 10752, 10752, 10752, 10752]
    - [14, 20830.0]
  - - [11136, 11136, 1, 384, 11136, 11136, 11136, 11136]
    - [37, 20846.0]
  - - [11520, 11520, 1, 384, 11520, 11520, 11520, 11520]
    - [21, 20809.0]
  - - [11904, 11904, 1, 384, 11904, 11904, 11904, 11904]
    - [4, 20879.0]
  - - [12288, 12288, 1, 384, 12288, 12288, 12288, 12288]
    - [21, 20846.0]
  - - [12672, 12672, 1, 384, 12672, 12672, 12672, 12672]
    - [21, 20870.0]
  - - [13056, 13056, 1, 384, 13056, 13056, 13056, 13056]
    - [4, 20856.0]
  - - [13440, 13440, 1, 384, 13440, 13440, 13440, 13440]
    - [21, 20886.0]
  - - [13824, 13824, 1, 384, 13824, 13824, 13824, 13824]
    - [37, 20884.0]
  - - [14208, 14208, 1, 384, 14208, 14208, 14208, 14208]
    - [37, 20899.0]
  - - [14592, 14592, 1, 384, 14592, 14592, 14592, 14592]
    - [37, 20882.0]
  - - [14976, 14976, 1, 384, 14976, 14976, 14976, 14976]
    - [21, 20903.0]
  - - [15360, 15360, 1, 384, 15360, 15360, 15360, 15360]
    - [21, 20889.0]
  - - [15744, 15744, 1, 384, 15744, 15744, 15744, 15744]
    - [21, 20911.0]
  - - [16128, 16128, 1, 384, 16128, 16128, 16128, 16128]
    - [4, 20900.0]
  - - [16512, 16512, 1, 384, 16512, 16512, 16512, 16512]
    - [21, 20919.0]
  - - [16896, 16896, 1, 384, 16896, 16896, 16896, 16896]
    - [37, 20908.0]
  - - [17280, 17280, 1, 384, 17280, 17280, 17280, 17280]
    - [21, 20922.0]
  - - [17664, 17664, 1, 384, 17664, 17664, 17664, 17664]
    - [37, 20914.0]
  - - [18048, 18048, 1, 384, 18048, 18048, 18048, 18048]
    - [21, 20924.0]
  - - [18432, 18432, 1, 384, 18432, 18432, 18432, 18432]
    - [21, 20901.0]
  - - [18816, 18816, 1, 384, 18816, 18816, 18816, 18816]
    - [37, 20933.0]
  - - [19200, 19200, 1, 384, 19200, 19200, 19200, 19200]
    - [37, 20925.0]
  - - [19584, 19584, 1, 384, 19584, 19584, 19584, 19584]
    - [21, 20938.0]
  - - [19968, 19968, 1, 384, 19968, 19968, 19968, 19968]
    - [37, 20925.0]
  - - [20352, 20352, 1, 384, 20352, 20352, 20352, 20352]
    - [21, 20940.0]
  - - [20736, 20736, 1, 384, 20736, 20736, 20736, 20736]
    - [4, 20929.0]
  - - [21120, 21120, 1, 384, 21120, 21120, 21120, 21120]
    - [37, 20950.0]
  - - [21504, 21504, 1, 384, 21504, 21504, 21504, 21504]
    - [21, 20952.0]
  - - [21888, 21888, 1, 384, 21888, 21888, 21888, 21888]
    - [37, 20946.0]
  - - [22272, 22272, 1, 384, 22272, 22272, 22272, 22272]
    - [4, 20937.0]
  - - [22656, 22656, 1, 384, 22656, 22656, 22656, 22656]
    - [37, 20960.0]
  - - [23040, 23040, 1, 384, 23040, 23040, 23040, 23040]
    - [4, 20935.0]
  - - [1152, 1152, 1, 1152, 1152, 1152, 1152, 1152]
    - [33, 16439.0]
  - - [1536, 1536, 1, 1536, 1536, 1536, 1536, 1536]
    - [38, 19755.0]
  - - [1920, 1920, 1, 1920, 1920, 1920, 1920, 1920]
    - [17, 18693.0]
  - - [2304, 2304, 1, 2304, 2304, 2304, 2304, 2304]
    - [38, 20224.0]
  - - [2688, 2688, 1, 2688, 2688, 2688, 2688, 2688]
    - [37, 19394.0]
  - - [3072, 3072, 1, 3072, 3072, 3072, 3072, 3072]
    - [4, 20659.0]
  - - [3456, 3456, 1, 3456, 3456, 3456, 3456, 3456]
    - [37, 20030.0]
  - - [3840, 3840, 1, 3840, 3840, 3840, 3840, 3840]
    - [22, 20473.0]
  - - [4224, 4224, 1, 4224, 4224, 4224, 4224, 4224]
    - [37, 20426.0]
  - - [4608, 4608, 1, 4608, 4608, 4608, 4608, 4608]
    - [21, 20906.0]
  - - [4992, 4992, 1, 4992, 4992, 4992, 4992, 4992]
    - [37, 20632.0]
  - - [5376, 5376, 1, 5376, 5376, 5376, 5376, 5376]
    - [37, 20562.0]
  - - [6144, 6144, 1, 6144, 6144, 6144, 6144, 6144]
    - [4, 21022.0]
  - - [6528, 6528, 1, 6528, 6528, 6528, 6528, 6528]
    - [37, 20865.0]
  - - [6912, 6912, 1, 6912, 6912, 6912, 6912, 6912]
    - [4, 20830.0]
  - - [7296, 7296, 1, 7296, 7296, 7296, 7296, 7296]
    - [21, 20912.0]
  - - [7680, 7680, 1, 7680, 7680, 7680, 7680, 7680]
    - [4, 21050.0]
  - - [8064, 4032, 1, 384, 8064, 8064, 8064, 4032]
    - [4, 20238.0]
  - - [8448, 4224, 1, 384, 8448, 8448, 8448, 4224]
    - [37, 20519.0]
  - - [8832, 4416, 1, 384, 8832, 8832, 8832, 4416]
    - [4, 20127.0]
  - - [9216, 4608, 1, 384, 9216, 9216, 9216, 4608]
    - [4, 20607.0]
  - - [9600, 4800, 1, 384, 9600, 9600, 9600, 4800]
    - [4, 20249.0]
  - - [9984, 4992, 1, 384, 9984, 9984, 9984, 4992]
    - [37, 20636.0]
  - - [10368, 5184, 1, 384, 10368, 10368, 10368, 5184]
    - [37, 20352.0]
  - - [10752, 5376, 1, 384, 10752, 10752, 10752, 5376]
    - [4, 20717.0]
  - - [11136, 5568, 1, 384, 11136, 11136, 11136, 5568]
    - [21, 20429.0]
  - - [11520, 5760, 1, 384, 11520, 11520, 11520, 5760]
    - [37, 20714.0]
  - - [11904, 5952, 1, 384, 11904, 11904, 11904, 5952]
    - [4, 20491.0]
  - - [12288, 6144, 1, 384, 12288, 12288, 12288, 6144]
    - [21, 20745.0]
  - - [12672, 6336, 1, 384, 12672, 12672, 12672, 6336]
    - [4, 20545.0]
  - - [13056, 6528, 1, 384, 13056, 13056, 13056, 6528]
    - [4, 20770.0]
  - - [13440, 6720, 1, 384, 13440, 13440, 13440, 6720]
    - [21, 20599.0]
  - - [13824, 6912, 1, 384, 13824, 13824, 13824, 6912]
    - [37, 20809.0]
  - - [14208, 7104, 1, 384, 14208, 14208, 14208, 7104]
    - [4, 20627.0]
  - - [14592, 7296, 1, 384, 14592, 14592, 14592, 7296]
    - [37, 20808.0]
  - - [14976, 7488, 1, 384, 14976, 14976, 14976, 7488]
    - [4, 20659.0]
  - - [15360, 7680, 1, 384, 15360, 15360, 15360, 7680]
    - [21, 20816.0]
  - - [15744, 7872, 1, 384, 15744, 15744, 15744, 7872]
    - [4, 20673.0]
  - - [16128, 8064, 1, 384, 16128, 16128, 16128, 8064]
    - [4, 20837.0]
  - - [16512, 8256, 1, 384, 16512, 16512, 16512, 8256]
    - [37, 20722.0]
  - - [16896, 8448, 1, 384, 16896, 16896, 16896, 8448]
    - [37, 20860.0]
  - - [17280, 8640, 1, 384, 17280, 17280, 17280, 8640]
    - [4, 20677.0]
  - - [17664, 8832, 1, 384, 17664, 17664, 17664, 8832]
    - [4, 20859.0]
  - - [18048, 9024, 1, 384, 18048, 18048, 18048, 9024]
    - [4, 20698.0]
  - - [18432, 9216, 1, 384, 18432, 18432, 18432, 9216]
    - [21, 20851.0]
  - - [18816, 9408, 1, 384, 18816, 18816, 18816, 9408]
    - [37, 20711.0]
  - - [19200, 9600, 1, 384, 19200, 19200, 19200, 9600]
    - [37, 20886.0]
  - - [19584, 9792, 1, 384, 19584, 19584, 19584, 9792]
    - [21, 20733.0]
  - - [19968, 9984, 1, 384, 19968, 19968, 19968, 9984]
    - [21, 20874.0]
  - - [20352, 10176, 1, 384, 20352, 20352, 20352, 10176]
    - [4, 20749.0]
  - - [20736, 10368, 1, 384, 20736, 20736, 20736, 10368]
    - [37, 20903.0]
  - - [21120, 10560, 1, 384, 21120, 21120, 21120, 10560]
    - [21, 20764.0]
  - - [21504, 10752, 1, 384, 21504, 21504, 21504, 10752]
    - [21, 20883.0]
  - - [21888, 10944, 1, 384, 21888, 21888, 21888, 10944]
    - [37, 20773.0]
  - - [22272, 11136, 1, 384, 22272, 22272, 22272, 11136]
    - [37, 20911.0]
  - - [22656, 11328, 1, 384, 22656, 22656, 22656, 11328]
    - [21, 20796.0]
  - - [23040, 11520, 1, 384, 23040, 23040, 23040, 11520]
    - [37, 20909.0]
  - - [8064, 16128, 1, 384, 8064, 8064, 8064, 16128]
    - [37, 20857.0]
  - - [8448, 16896, 1, 384, 8448, 8448, 8448, 16896]
    - [37, 20857.0]
  - - [8832, 17664, 1, 384, 8832, 8832, 8832, 17664]
    - [21, 20876.0]
  - - [9216, 18432, 1, 384, 9216, 9216, 9216, 18432]
    - [21, 20847.0]
  - - [9600, 19200, 1, 384, 9600, 9600, 9600, 19200]
    - [21, 20893.0]
  - - [9984, 19968, 1, 384, 9984, 9984, 9984, 19968]
    - [37, 20882.0]
  - - [10368, 20736, 1, 384, 10368, 10368, 10368, 20736]
    - [37, 20910.0]
  - - [10752, 21504, 1, 384, 10752, 10752, 10752, 21504]
    - [37, 20892.0]
  - - [11136, 22272, 1, 384, 11136, 11136, 11136, 22272]
    - [37, 20918.0]
  - - [11520, 23040, 1, 384, 11520, 11520, 11520, 23040]
    - [37, 20905.0]
  - - [11904, 23808, 1, 384, 11904, 11904, 11904, 23808]
    - [21, 20931.0]
  - - [12288, 24576, 1, 384, 12288, 12288, 12288, 24576]
    - [21, 20908.0]
  - - [12672, 25344, 1, 384, 12672, 12672, 12672, 25344]
    - [21, 20933.0]
  - - [13056, 26112, 1, 384, 13056, 13056, 13056, 26112]
    - [21, 20914.0]
  - - [13440, 26880, 1, 384, 13440, 13440, 13440, 26880]
    - [21, 20938.0]
  - - [13824, 27648, 1, 384, 13824, 13824, 13824, 27648]
    - [37, 20928.0]
  - - [14208, 28416, 1, 384, 14208, 14208, 14208, 28416]
    - [4, 20976.0]
  - - [14592, 29184, 1, 384, 14592, 14592, 14592, 29184]
    - [37, 20930.0]
  - - [14976, 29952, 1, 384, 14976, 14976, 14976, 29952]
    - [21, 20948.0]
  - - [15360, 30720, 1, 384, 15360, 15360, 15360, 30720]
    - [21, 20927.0]
  - - [15744, 31488, 1, 384, 15744, 15744, 15744, 31488]
    - [21, 20950.0]
  - - [16128, 32256, 1, 384, 16128, 16128, 16128, 32256]
    - [37, 20940.0]
  - - [16512, 33024, 1, 384, 16512, 16512, 16512, 33024]
    - [21, 20957.0]
  - - [16896, 33792, 1, 384, 16896, 16896, 16896, 33792]
    - [37, 20944.0]
  - - [17280, 34560, 1, 384, 17280, 17280, 17280, 34560]
    - [37, 20960.0]
  - - [17664, 35328, 1, 384, 17664, 17664, 17664, 35328]
    - [37, 20966.0]
  - - [18048, 36096, 1, 384, 18048, 18048, 18048, 36096]
    - [37, 20957.0]
  - - [18432, 36864, 1, 384, 18432, 18432, 18432, 36864]
    - [21, 20935.0]
  - - [18816, 37632, 1, 384, 18816, 18816, 18816, 37632]
    - [37, 20975.0]
  - - [19200, 38400, 1, 384, 19200, 19200, 19200, 38400]
    - [37, 20950.0]
  - - [19584, 39168, 1, 384, 19584, 19584, 19584, 39168]
    - [21, 20973.0]
  - - [19968, 39936, 1, 384, 19968, 19968, 19968, 39936]
    - [4, 20963.0]
  - - [20352, 40704, 1, 384, 20352, 20352, 20352, 40704]
    - [37, 20978.0]
  - - [20736, 41472, 1, 384, 20736, 20736, 20736, 41472]
    - [37, 20976.0]
  - - [21120, 42240, 1, 384, 21120, 21120, 21120, 42240]
    - [37, 20980.0]
  - - [21504, 43008, 1, 384, 21504, 21504, 21504, 43008]
    - [4, 20970.0]
  - - [21888, 43776, 1, 384, 21888, 21888, 21888, 43776]
    - [37, 20973.0]
  - - [22272, 44544, 1, 384, 22272, 22272, 22272, 44544]
    - [21, 20973.0]
  - - [22656, 45312, 1, 384, 22656, 22656, 22656, 45312]
    - [37, 20990.0]
  - - [23040, 46080, 1, 384, 23040, 23040, 23040, 46080]
    - [21, 20979.0]
  - - [1152, 1536, 1, 384, 1152, 1152, 1152, 1536]
    - [38, 18062.0]
  - - [1920, 1536, 1, 384, 1920, 1920, 1920, 1536]
    - [5, 19319.0]
  - - [2304, 1536, 1, 384, 2304, 2304, 2304, 1536]
    - [38, 19469.0]
  - - [2688, 1536, 1, 384, 2688, 2688, 2688, 1536]
    - [5, 19622.0]
  - - [3456, 1536, 1, 384, 3456, 3456, 3456, 1536]
    - [5, 19825.0]
  - - [3840, 1536, 1, 384, 3840, 3840, 3840, 1536]
    - [22, 19826.0]
  - - [4224, 1536, 1, 384, 4224, 4224, 4224, 1536]
    - [38, 19915.0]
  - - [4608, 1536, 1, 384, 4608, 4608, 4608, 1536]
    - [4, 19970.0]
  - - [4992, 1536, 1, 384, 4992, 4992, 4992, 1536]
    - [5, 19976.0]
  - - [5376, 1536, 1, 384, 5376, 5376, 5376, 1536]
    - [4, 20061.0]
  - - [5760, 1536, 1, 384, 5760, 5760, 5760, 1536]
    - [5, 20039.0]
  - - [6144, 1536, 1, 384, 6144, 6144, 6144, 1536]
    - [1, 20135.0]
  - - [6528, 1536, 1, 384, 6528, 6528, 6528, 1536]
    - [38, 20098.0]
  - - [6912, 1536, 1, 384, 6912, 6912, 6912, 1536]
    - [4, 20239.0]
  - - [7296, 1536, 1, 384, 7296, 7296, 7296, 1536]
    - [38, 20132.0]
  - - [7680, 1536, 1, 384, 7680, 7680, 7680, 1536]
    - [4, 20299.0]
  - - [8064, 1536, 1, 384, 8064, 8064, 8064, 1536]
    - [38, 20171.0]
  - - [8448, 1536, 1, 384, 8448, 8448, 8448, 1536]
    - [4, 20340.0]
  - - [8832, 1536, 1, 384, 8832, 8832, 8832, 1536]
    - [38, 20179.0]
  - - [9216, 1536, 1, 384, 9216, 9216, 9216, 1536]
    - [4, 20380.0]
  - - [9600, 1536, 1, 384, 9600, 9600, 9600, 1536]
    - [38, 20207.0]
  - - [9984, 1536, 1, 384, 9984, 9984, 9984, 1536]
    - [4, 20403.0]
  - - [10368, 1536, 1, 384, 10368, 10368, 10368, 1536]
    - [5, 20221.0]
  - - [10752, 1536, 1, 384, 10752, 10752, 10752, 1536]
    - [4, 20471.0]
  - - [11136, 1536, 1, 384, 11136, 11136, 11136, 1536]
    - [38, 20240.0]
  - - [11520, 1536, 1, 384, 11520, 11520, 11520, 1536]
    - [37, 20486.0]
  - - [11904, 1536, 1, 384, 11904, 11904, 11904, 1536]
    - [38, 20256.0]
  - - [12288, 1536, 1, 384, 12288, 12288, 12288, 1536]
    - [4, 20562.0]
  - - [12672, 1536, 1, 384, 12672, 12672, 12672, 1536]
    - [22, 20266.0]
  - - [13056, 1536, 1, 384, 13056, 13056, 13056, 1536]
    - [4, 20536.0]
  - - [13440, 1536, 1, 384, 13440, 13440, 13440, 1536]
    - [22, 20279.0]
  - - [13824, 1536, 1, 384, 13824, 13824, 13824, 1536]
    - [46, 20569.0]
  - - [14208, 1536, 1, 384, 14208, 14208, 14208, 1536]
    - [38, 20287.0]
  - - [14592, 1536, 1, 384, 14592, 14592, 14592, 1536]
    - [4, 20569.0]
  - - [14976, 1536, 1, 384, 14976, 14976, 14976, 1536]
    - [22, 20296.0]
  - - [15360, 1536, 1, 384, 15360, 15360, 15360, 1536]
    - [4, 20572.0]
  - - [15744, 1536, 1, 384, 15744, 15744, 15744, 1536]
    - [38, 20299.0]
  - - [16128, 1536, 1, 384, 16128, 16128, 16128, 1536]
    - [4, 20597.0]
  - - [16512, 1536, 1, 384, 16512, 16512, 16512, 1536]
    - [38, 20321.0]
  - - [16896, 1536, 1, 384, 16896, 16896, 16896, 1536]
    - [37, 20618.0]
  - - [17280, 1536, 1, 384, 17280, 17280, 17280, 1536]
    - [38, 20293.0]
  - - [17664, 1536, 1, 384, 17664, 17664, 17664, 1536]
    - [46, 20598.0]
  - - [18048, 1536, 1, 384, 18048, 18048, 18048, 1536]
    - [22, 20280.0]
  - - [18432, 1536, 1, 384, 18432, 18432, 18432, 1536]
    - [4, 20551.0]
  - - [18816, 1536, 1, 384, 18816, 18816, 18816, 1536]
    - [38, 20288.0]
  - - [19200, 1536, 1, 384, 19200, 19200, 19200, 1536]
    - [4, 20564.0]
  - - [19584, 1536, 1, 384, 19584, 19584, 19584, 1536]
    - [22, 20292.0]
  - - [19968, 1536, 1, 384, 19968, 19968, 19968, 1536]
    - [4, 20597.0]
  - - [20352, 1536, 1, 384, 20352, 20352, 20352, 1536]
    - [34, 20325.0]
  - - [20736, 1536, 1, 384, 20736, 20736, 20736, 1536]
    - [37, 20585.0]
  - - [21120, 1536, 1, 384, 21120, 21120, 21120, 1536]
    - [37, 20327.0]
  - - [21504, 1536, 1, 384, 21504, 21504, 21504, 1536]
    - [4, 20556.0]
  - - [21888, 1536, 1, 384, 21888, 21888, 21888, 1536]
    - [37, 20357.0]
  - - [22272, 1536, 1, 384, 22272, 22272, 22272, 1536]
    - [37, 20610.0]
  - - [22656, 1536, 1, 384, 22656, 22656, 22656, 1536]
    - [34, 20364.0]
  - - [23040, 1536, 1, 384, 23040, 23040, 23040, 1536]
    - [37, 20598.0]
  - - [768, 1920, 1, 384, 768, 768, 768, 1920]
    - [38, 15156.0]
  - - [1152, 1920, 1, 384, 1152, 1152, 1152, 1920]
    - [38, 17979.0]
  - - [1536, 1920, 1, 384, 1536, 1536, 1536, 1920]
    - [22, 19168.0]
  - - [2304, 1920, 1, 384, 2304, 2304, 2304, 1920]
    - [38, 18549.0]
  - - [2688, 1920, 1, 384, 2688, 2688, 2688, 1920]
    - [5, 19297.0]
  - - [3072, 1920, 1, 384, 3072, 3072, 3072, 1920]
    - [1, 19816.0]
  - - [3456, 1920, 1, 384, 3456, 3456, 3456, 1920]
    - [17, 19058.0]
  - - [4224, 1920, 1, 384, 4224, 4224, 4224, 1920]
    - [34, 19831.0]
  - - [4608, 1920, 1, 384, 4608, 4608, 4608, 1920]
    - [38, 20077.0]
  - - [4992, 1920, 1, 384, 4992, 4992, 4992, 1920]
    - [37, 19471.0]
  - - [5376, 1920, 1, 384, 5376, 5376, 5376, 1920]
    - [37, 19761.0]
  - - [5760, 1920, 1, 384, 5760, 5760, 5760, 1920]
    - [37, 20073.0]
  - - [6144, 1920, 1, 384, 6144, 6144, 6144, 1920]
    - [4, 20313.0]
  - - [6528, 1920, 1, 384, 6528, 6528, 6528, 1920]
    - [21, 19763.0]
  - - [6912, 1920, 1, 384, 6912, 6912, 6912, 1920]
    - [4, 19986.0]
  - - [7296, 1920, 1, 384, 7296, 7296, 7296, 1920]
    - [34, 20241.0]
  - - [7680, 1920, 1, 384, 7680, 7680, 7680, 1920]
    - [30, 20233.0]
  - - [8064, 1920, 1, 384, 8064, 8064, 8064, 1920]
    - [18, 19966.0]
  - - [8448, 1920, 1, 384, 8448, 8448, 8448, 1920]
    - [4, 20144.0]
  - - [8832, 1920, 1, 384, 8832, 8832, 8832, 1920]
    - [4, 20376.0]
  - - [9216, 1920, 1, 384, 9216, 9216, 9216, 1920]
    - [4, 20501.0]
  - - [9600, 1920, 1, 384, 9600, 9600, 9600, 1920]
    - [37, 20136.0]
  - - [9984, 1920, 1, 384, 9984, 9984, 9984, 1920]
    - [37, 20255.0]
  - - [10368, 1920, 1, 384, 10368, 10368, 10368, 1920]
    - [21, 20438.0]
  - - [10752, 1920, 1, 384, 10752, 10752, 10752, 1920]
    - [22, 20273.0]
  - - [11136, 1920, 1, 384, 11136, 11136, 11136, 1920]
    - [37, 20227.0]
  - - [11520, 1920, 1, 384, 11520, 11520, 11520, 1920]
    - [37, 20351.0]
  - - [11904, 1920, 1, 384, 11904, 11904, 11904, 1920]
    - [21, 20507.0]
  - - [12288, 1920, 1, 384, 12288, 12288, 12288, 1920]
    - [4, 20590.0]
  - - [12672, 1920, 1, 384, 12672, 12672, 12672, 1920]
    - [37, 20319.0]
  - - [13056, 1920, 1, 384, 13056, 13056, 13056, 1920]
    - [37, 20417.0]
  - - [13440, 1920, 1, 384, 13440, 13440, 13440, 1920]
    - [37, 20560.0]
  - - [13824, 1920, 1, 384, 13824, 13824, 13824, 1920]
    - [47, 20318.0]
  - - [14208, 1920, 1, 384, 14208, 14208, 14208, 1920]
    - [46, 20345.0]
  - - [14592, 1920, 1, 384, 14592, 14592, 14592, 1920]
    - [34, 20386.0]
  - - [14976, 1920, 1, 384, 14976, 14976, 14976, 1920]
    - [21, 20518.0]
  - - [15360, 1920, 1, 384, 15360, 15360, 15360, 1920]
    - [4, 20565.0]
  - - [15744, 1920, 1, 384, 15744, 15744, 15744, 1920]
    - [34, 20374.0]
  - - [16128, 1920, 1, 384, 16128, 16128, 16128, 1920]
    - [37, 20444.0]
  - - [16512, 1920, 1, 384, 16512, 16512, 16512, 1920]
    - [21, 20551.0]
  - - [16896, 1920, 1, 384, 16896, 16896, 16896, 1920]
    - [22, 20331.0]
  - - [17280, 1920, 1, 384, 17280, 17280, 17280, 1920]
    - [21, 20425.0]
  - - [17664, 1920, 1, 384, 17664, 17664, 17664, 1920]
    - [37, 20487.0]
  - - [18048, 1920, 1, 384, 18048, 18048, 18048, 1920]
    - [37, 20601.0]
  - - [18432, 1920, 1, 384, 18432, 18432, 18432, 1920]
    - [4, 20605.0]
  - - [18816, 1920, 1, 384, 18816, 18816, 18816, 1920]
    - [21, 20462.0]
  - - [19200, 1920, 1, 384, 19200, 19200, 19200, 1920]
    - [37, 20515.0]
  - - [19584, 1920, 1, 384, 19584, 19584, 19584, 1920]
    - [21, 20609.0]
  - - [19968, 1920, 1, 384, 19968, 19968, 19968, 1920]
    - [21, 20417.0]
  - - [20352, 1920, 1, 384, 20352, 20352, 20352, 1920]
    - [37, 20498.0]
  - - [20736, 1920, 1, 384, 20736, 20736, 20736, 1920]
    - [37, 20564.0]
  - - [21120, 1920, 1, 384, 21120, 21120, 21120, 1920]
    - [21, 20650.0]
  - - [21504, 1920, 1, 384, 21504, 21504, 21504, 1920]
    - [4, 20611.0]
  - - [21888, 1920, 1, 384, 21888, 21888, 21888, 1920]
    - [21, 20538.0]
  - - [22272, 1920, 1, 384, 22272, 22272, 22272, 1920]
    - [46, 20553.0]
  - - [22656, 1920, 1, 384, 22656, 22656, 22656, 1920]
    - [37, 20665.0]
  - - [23040, 1920, 1, 384, 23040, 23040, 23040, 1920]
    - [37, 20483.0]
  - - [768, 2304, 1, 384, 768, 768, 768, 2304]
    - [35, 17881.0]
  - - [1536, 2304, 1, 384, 1536, 1536, 1536, 2304]
    - [22, 19391.0]
  - - [1920, 2304, 1, 384, 1920, 1920, 1920, 2304]
    - [38, 18593.0]
  - - [2688, 2304, 1, 384, 2688, 2688, 2688, 2304]
    - [34, 19136.0]
  - - [3072, 2304, 1, 384, 3072, 3072, 3072, 2304]
    - [1, 19985.0]
  - - [3456, 2304, 1, 384, 3456, 3456, 3456, 2304]
    - [34, 19498.0]
  - - [3840, 2304, 1, 384, 3840, 3840, 3840, 2304]
    - [5, 19987.0]
  - - [4224, 2304, 1, 384, 4224, 4224, 4224, 2304]
    - [21, 19738.0]
  - - [4992, 2304, 1, 384, 4992, 4992, 4992, 2304]
    - [4, 19884.0]
  - - [5376, 2304, 1, 384, 5376, 5376, 5376, 2304]
    - [22, 20108.0]
  - - [5760, 2304, 1, 384, 5760, 5760, 5760, 2304]
    - [37, 20016.0]
  - - [6144, 2304, 1, 384, 6144, 6144, 6144, 2304]
    - [4, 20391.0]
  - - [6528, 2304, 1, 384, 6528, 6528, 6528, 2304]
    - [37, 20158.0]
  - - [6912, 2304, 1, 384, 6912, 6912, 6912, 2304]
    - [47, 20198.0]
  - - [7296, 2304, 1, 384, 7296, 7296, 7296, 2304]
    - [21, 20225.0]
  - - [7680, 2304, 1, 384, 7680, 7680, 7680, 2304]
    - [37, 20491.0]
  - - [8064, 2304, 1, 384, 8064, 8064, 8064, 2304]
    - [21, 20266.0]
  - - [8448, 2304, 1, 384, 8448, 8448, 8448, 2304]
    - [22, 20270.0]
  - - [8832, 2304, 1, 384, 8832, 8832, 8832, 2304]
    - [37, 20329.0]
  - - [9216, 2304, 1, 384, 9216, 9216, 9216, 2304]
    - [4, 20546.0]
  - - [9600, 2304, 1, 384, 9600, 9600, 9600, 2304]
    - [37, 20374.0]
  - - [9984, 2304, 1, 384, 9984, 9984, 9984, 2304]
    - [38, 20281.0]
  - - [10368, 2304, 1, 384, 10368, 10368, 10368, 2304]
    - [37, 20430.0]
  - - [10752, 2304, 1, 384, 10752, 10752, 10752, 2304]
    - [37, 20614.0]
  - - [11136, 2304, 1, 384, 11136, 11136, 11136, 2304]
    - [34, 20439.0]
  - - [11520, 2304, 1, 384, 11520, 11520, 11520, 2304]
    - [47, 20280.0]
  - - [11904, 2304, 1, 384, 11904, 11904, 11904, 2304]
    - [46, 20423.0]
  - - [12288, 2304, 1, 384, 12288, 12288, 12288, 2304]
    - [4, 20531.0]
  - - [12672, 2304, 1, 384, 12672, 12672, 12672, 2304]
    - [37, 20435.0]
  - - [13056, 2304, 1, 384, 13056, 13056, 13056, 2304]
    - [22, 20298.0]
  - - [13440, 2304, 1, 384, 13440, 13440, 13440, 2304]
    - [37, 20470.0]
  - - [13824, 2304, 1, 384, 13824, 13824, 13824, 2304]
    - [37, 20589.0]
  - - [14208, 2304, 1, 384, 14208, 14208, 14208, 2304]
    - [18, 20508.0]
  - - [14592, 2304, 1, 384, 14592, 14592, 14592, 2304]
    - [37, 20340.0]
  - - [14976, 2304, 1, 384, 14976, 14976, 14976, 2304]
    - [37, 20514.0]
  - - [15360, 2304, 1, 384, 15360, 15360, 15360, 2304]
    - [4, 20581.0]
  - - [15744, 2304, 1, 384, 15744, 15744, 15744, 2304]
    - [21, 20527.0]
  - - [16128, 2304, 1, 384, 16128, 16128, 16128, 2304]
    - [37, 20401.0]
  - - [16512, 2304, 1, 384, 16512, 16512, 16512, 2304]
    - [21, 20562.0]
  - - [16896, 2304, 1, 384, 16896, 16896, 16896, 2304]
    - [37, 20651.0]
  - - [17280, 2304, 1, 384, 17280, 17280, 17280, 2304]
    - [37, 20574.0]
  - - [17664, 2304, 1, 384, 17664, 17664, 17664, 2304]
    - [37, 20440.0]
  - - [18048, 2304, 1, 384, 18048, 18048, 18048, 2304]
    - [37, 20588.0]
  - - [18432, 2304, 1, 384, 18432, 18432, 18432, 2304]
    - [4, 20594.0]
  - - [18816, 2304, 1, 384, 18816, 18816, 18816, 2304]
    - [21, 20608.0]
  - - [19200, 2304, 1, 384, 19200, 19200, 19200, 2304]
    - [37, 20487.0]
  - - [19584, 2304, 1, 384, 19584, 19584, 19584, 2304]
    - [37, 20626.0]
  - - [19968, 2304, 1, 384, 19968, 19968, 19968, 2304]
    - [37, 20664.0]
  - - [20352, 2304, 1, 384, 20352, 20352, 20352, 2304]
    - [21, 20633.0]
  - - [20736, 2304, 1, 384, 20736, 20736, 20736, 2304]
    - [37, 20526.0]
  - - [21120, 2304, 1, 384, 21120, 21120, 21120, 2304]
    - [21, 20640.0]
  - - [21504, 2304, 1, 384, 21504, 21504, 21504, 2304]
    - [4, 20666.0]
  - - [21888, 2304, 1, 384, 21888, 21888, 21888, 2304]
    - [37, 20658.0]
  - - [22272, 2304, 1, 384, 22272, 22272, 22272, 2304]
    - [4, 20541.0]
  - - [22656, 2304, 1, 384, 22656, 22656, 22656, 2304]
    - [37, 20659.0]
  - - [23040, 2304, 1, 384, 23040, 23040, 23040, 2304]
    - [37, 20707.0]
  - - [256, 32768, 1, 1, 256, 256, 256, 32768]
    - [9, 543.0]
  - - [289, 128, 64, 768, 289, 289, 289, 128]
    - [17, 13878.0]
  - - [289, 160, 64, 768, 289, 289, 289, 160]
    - [17, 12163.0]
  - - [289, 192, 64, 768, 289, 289, 289, 192]
    - [17, 14561.0]
  - - [3136, 256, 32, 64, 3136, 3136, 3136, 256]
    - [33, 18486.0]
  - - [784, 512, 32, 128, 784, 784, 784, 512]
    - [9, 16695.0]
  - - [784, 128, 32, 512, 784, 784, 784, 128]
    - [17, 16034.0]
  - - [196, 1024, 32, 256, 196, 196, 196, 1024]
    - [33, 14504.0]
  - - [1444, 128, 120, 256, 1444, 1444, 1444, 128]
    - [0, 17640.0]
  - - [1444, 128, 18, 256, 1444, 1444, 1444, 128]
    - [33, 17318.0]
  - - [1444, 128, 19, 256, 1444, 1444, 1444, 128]
    - [17, 17144.0]
  - - [1444, 256, 120, 256, 1444, 1444, 1444, 256]
    - [0, 18635.0]
  - - [1444, 256, 18, 256, 1444, 1444, 1444, 256]
    - [5, 18336.0]
  - - [1444, 256, 19, 256, 1444, 1444, 1444, 256]
    - [5, 18085.0]
  - - [361, 512, 120, 256, 361, 361, 361, 512]
    - [0, 18341.0]
  - - [361, 512, 18, 256, 361, 361, 361, 512]
    - [19, 16933.0]
  - - [361, 512, 19, 256, 361, 361, 361, 512]
    - [33, 16924.0]
  - - [7680, 8192, 1, 8192, 7680, 7680, 7680, 8192]
    - [21, 21041.0]
  - - [3840, 4096, 1, 4096, 3840, 3840, 3840, 4096]
    - [37, 20592.0]
  - - [1920, 2048, 1, 2048, 1920, 1920, 1920, 2048]
    - [34, 19118.0]
  - - [8192, 7680, 1, 8192, 8192, 8192, 8192, 7680]
    - [4, 21037.0]
  - - [4096, 3840, 1, 4096, 4096, 4096, 4096, 3840]
    - [37, 20588.0]
  - - [2048, 1920, 1, 2048, 2048, 2048, 2048, 1920]
    - [22, 19147.0]
  - - [8192, 8192, 1, 8192, 8192, 8192, 8192, 8192]
    - [21, 21062.0]
  - - [4096, 4096, 1, 4096, 4096, 4096, 4096, 4096]
    - [37, 20468.0]
  - - [2048, 2048, 1, 2048, 2048, 2048, 2048, 2048]
    - [17, 18540.0]
  - - [1024, 4096, 1, 512, 1024, 1024, 1024, 4096]
    - [33, 18336.0]
  - - [1024, 30522, 1, 77, 1024, 1024, 1024, 30522]
    - [0, 18604.0]
  - - [4096, 1024, 1, 512, 4096, 4096, 4096, 1024]
    - [33, 18227.0]
  - - [1024, 4096, 1, 1280, 1024, 1024, 1024, 4096]
    - [33, 18509.0]
  - - [1024, 30522, 1, 200, 1024, 1024, 1024, 30522]
    - [1, 19524.0]
  - - [4096, 1024, 1, 1280, 4096, 4096, 4096, 1024]
    - [17, 18485.0]
  - - [1024, 4096, 1, 4992, 1024, 1024, 1024, 4096]
    - [33, 18618.0]
  - - [1024, 30522, 1, 780, 1024, 1024, 1024, 30522]
    - [1, 20382.0]
  - - [4096, 1024, 1, 4992, 4096, 4096, 4096, 1024]
    - [33, 18613.0]
  - - [1024, 30522, 1, 308, 1024, 1024, 1024, 30522]
    - [1, 19981.0]
  - - [1024, 4096, 1, 5120, 1024, 1024, 1024, 4096]
    - [33, 18616.0]
  - - [1024, 30522, 1, 800, 1024, 1024, 1024, 30522]
    - [21, 20431.0]
  - - [4096, 1024, 1, 5120, 4096, 4096, 4096, 1024]
    - [17, 18612.0]
  - - [1024, 4096, 1, 5248, 1024, 1024, 1024, 4096]
    - [17, 18642.0]
  - - [1024, 30522, 1, 820, 1024, 1024, 1024, 30522]
    - [21, 20401.0]
  - - [4096, 1024, 1, 5248, 4096, 4096, 4096, 1024]
    - [33, 18615.0]
  - - [1024, 4096, 1, 2560, 1024, 1024, 1024, 4096]
    - [33, 18564.0]
  - - [1024, 30522, 1, 385, 1024, 1024, 1024, 30522]
    - [1, 20144.0]
  - - [4096, 1024, 1, 2560, 4096, 4096, 4096, 1024]
    - [17, 18556.0]
  - - [1024, 30522, 1, 462, 1024, 1024, 1024, 30522]
    - [4, 20196.0]
  - - [1024, 4096, 1, 1024, 1024, 1024, 1024, 4096]
    - [33, 18449.0]
  - - [1024, 30522, 1, 160, 1024, 1024, 1024, 30522]
    - [38, 19348.0]
  - - [4096, 1024, 1, 1024, 4096, 4096, 4096, 1024]
    - [33, 18438.0]
  - - [1024, 4096, 1, 1152, 1024, 1024, 1024, 4096]
    - [42, 18501.0]
  - - [1024, 30522, 1, 180, 1024, 1024, 1024, 30522]
    - [42, 19418.0]
  - - [4096, 1024, 1, 1152, 4096, 4096, 4096, 1024]
    - [33, 18477.0]
  - - [1024, 4096, 1, 8192, 1024, 1024, 1024, 4096]
    - [33, 18625.0]
  - - [1024, 4096, 1, 9600, 1024, 1024, 1024, 4096]
    - [33, 18617.0]
  - - [1024, 33712, 1, 8192, 1024, 1024, 1024, 33712]
    - [21, 20887.0]
  - - [1024, 33712, 1, 9600, 1024, 1024, 1024, 33712]
    - [4, 20873.0]
  - - [4096, 1024, 1, 8192, 4096, 4096, 4096, 1024]
    - [3, 18651.0]
  - - [4096, 1024, 1, 9600, 4096, 4096, 4096, 1024]
    - [36, 18603.0]
  - - [1024, 4096, 1, 10064, 1024, 1024, 1024, 4096]
    - [36, 18611.0]
  - - [1024, 4096, 1, 10080, 1024, 1024, 1024, 4096]
    - [33, 18620.0]
  - - [1024, 4096, 1, 6528, 1024, 1024, 1024, 4096]
    - [33, 18634.0]
  - - [1024, 4096, 1, 7104, 1024, 1024, 1024, 4096]
    - [33, 18618.0]
  - - [1024, 4096, 1, 8064, 1024, 1024, 1024, 4096]
    - [33, 18626.0]
  - - [1024, 4096, 1, 9216, 1024, 1024, 1024, 4096]
    - [33, 18619.0]
  - - [1024, 42720, 1, 10080, 1024, 1024, 1024, 42720]
    - [37, 20848.0]
  - - [1024, 42720, 1, 6528, 1024, 1024, 1024, 42720]
    - [4, 20838.0]
  - - [1024, 42720, 1, 7104, 1024, 1024, 1024, 42720]
    - [37, 20843.0]
  - - [4096, 1024, 1, 10064, 4096, 4096, 4096, 1024]
    - [36, 18623.0]
  - - [4096, 1024, 1, 10080, 4096, 4096, 4096, 1024]
    - [36, 18604.0]
  - - [4096, 1024, 1, 6528, 4096, 4096, 4096, 1024]
    - [20, 18584.0]
  - - [4096, 1024, 1, 7104, 4096, 4096, 4096, 1024]
    - [36, 18597.0]
  - - [4096, 1024, 1, 8064, 4096, 4096, 4096, 1024]
    - [36, 18597.0]
  - - [4096, 1024, 1, 9216, 4096, 4096, 4096, 1024]
    - [20, 18602.0]
  - - [1024, 1600, 1, 1, 1024, 1024, 1024, 1600]
    - [9, 355.0]
  - - [2048, 960, 1, 1, 2048, 2048, 2048, 960]
    - [9, 413.0]
  - - [2048, 2048, 1, 2, 2048, 2048, 2048, 2048]
    - [9, 949.0]
  - - [2048, 30592, 1, 1024, 2048, 2048, 2048, 30592]
    - [4, 20850.0]
  - - [2048, 6144, 1, 1024, 2048, 2048, 2048, 6144]
    - [18, 19984.0]
  - - [2048, 8192, 1, 1024, 2048, 2048, 2048, 8192]
    - [4, 20360.0]
  - - [8192, 2048, 1, 1024, 8192, 8192, 8192, 2048]
    - [21, 20335.0]
  - - [1024, 30592, 1, 8192, 1024, 1024, 1024, 30592]
    - [21, 20670.0]
  - - [1024, 3072, 1, 8192, 1024, 1024, 1024, 3072]
    - [17, 18837.0]
  - - [1024, 30592, 1, 2048, 1024, 1024, 1024, 30592]
    - [4, 20598.0]
  - - [1024, 30592, 1, 4096, 1024, 1024, 1024, 30592]
    - [37, 20632.0]
  - - [1024, 3072, 1, 4096, 1024, 1024, 1024, 3072]
    - [33, 18843.0]
  - - [2560, 1920, 1, 2048, 2560, 2560, 2560, 1920]
    - [36, 19201.0]
  - - [2560, 2560, 1, 2048, 2560, 2560, 2560, 2560]
    - [0, 19062.0]
  - - [2560, 2560, 1, 4, 2560, 2560, 2560, 2560]
    - [3, 1925.0]
  - - [2560, 7680, 1, 2048, 2560, 2560, 2560, 7680]
    - [37, 20447.0]
  - - [640, 2560, 1, 2048, 640, 640, 640, 2560]
    - [38, 18028.0]
  - - [1536, 1536, 1, 4096, 1536, 1536, 1536, 1536]
    - [38, 19919.0]
  - - [1536, 4608, 1, 4096, 1536, 1536, 1536, 4608]
    - [37, 20523.0]
  - - [1536, 50304, 1, 4096, 1536, 1536, 1536, 50304]
    - [21, 20950.0]
  - - [1536, 6144, 1, 4096, 1536, 1536, 1536, 6144]
    - [37, 20661.0]
  - - [6144, 1536, 1, 4096, 6144, 6144, 6144, 1536]
    - [21, 20666.0]
  - - [1536, 1536, 1, 8192, 1536, 1536, 1536, 1536]
    - [23, 19970.0]
  - - [1536, 4608, 1, 8192, 1536, 1536, 1536, 4608]
    - [23, 20574.0]
  - - [1536, 50304, 1, 8192, 1536, 1536, 1536, 50304]
    - [4, 20949.0]
  - - [1536, 6144, 1, 8192, 1536, 1536, 1536, 6144]
    - [21, 20704.0]
  - - [6144, 1536, 1, 8192, 6144, 6144, 6144, 1536]
    - [21, 20699.0]
  - - [1024, 3072, 1, 16384, 1024, 1024, 1024, 3072]
    - [36, 18869.0]
  - - [1024, 4096, 1, 16384, 1024, 1024, 1024, 4096]
    - [13, 18627.0]
  - - [1024, 50304, 1, 16384, 1024, 1024, 1024, 50304]
    - [21, 20929.0]
  - - [4096, 1024, 1, 16384, 4096, 4096, 4096, 1024]
    - [28, 18617.0]
  - - [1024, 50304, 1, 2048, 1024, 1024, 1024, 50304]
    - [4, 20883.0]
  - - [1024, 50304, 1, 4096, 1024, 1024, 1024, 50304]
    - [4, 20905.0]
  - - [1024, 50304, 1, 8192, 1024, 1024, 1024, 50304]
    - [37, 20937.0]
  - - [1024, 30528, 1, 8192, 1024, 1024, 1024, 30528]
    - [37, 20626.0]
  - - [256, 6912, 1, 1, 256, 256, 256, 6912]
    - [9, 336.0]
  - - [30528, 1024, 1, 640, 30528, 30528, 30528, 1024]
    - [21, 20396.0]
  - - [30528, 1024, 1, 1280, 30528, 30528, 30528, 1024]
    - [37, 20519.0]
  - - [4096, 1024, 1, 10240, 4096, 4096, 4096, 1024]
    - [20, 18610.0]
  - - [1024, 4096, 1, 10240, 1024, 1024, 1024, 4096]
    - [33, 18625.0]
  - - [30528, 1024, 1, 1600, 30528, 30528, 30528, 1024]
    - [37, 20541.0]
  - - [1024, 4096, 1, 10496, 1024, 1024, 1024, 4096]
    - [33, 18619.0]
  - - [30528, 1024, 1, 1640, 30528, 30528, 30528, 1024]
    - [18, 20532.0]
  - - [4096, 1024, 1, 10496, 4096, 4096, 4096, 1024]
    - [45, 18607.0]
  - - [30528, 1024, 1, 160, 30528, 30528, 30528, 1024]
    - [18, 19673.0]
  - - [1024, 4096, 1, 6144, 1024, 1024, 1024, 4096]
    - [33, 18620.0]
  - - [30528, 1024, 1, 240, 30528, 30528, 30528, 1024]
    - [25, 19976.0]
  - - [4096, 1024, 1, 6144, 4096, 4096, 4096, 1024]
    - [42, 18594.0]
  - - [3136, 128, 64, 256, 3136, 3136, 3136, 128]
    - [0, 17848.0]
  - - [784, 256, 64, 512, 784, 784, 784, 256]
    - [18, 17626.0]
  - - [3136, 256, 64, 128, 3136, 3136, 3136, 256]
    - [0, 17521.0]
  - - [3136, 256, 64, 256, 3136, 3136, 3136, 256]
    - [21, 19850.0]
  - - [196, 512, 64, 1024, 196, 196, 196, 512]
    - [3, 14717.0]
  - - [784, 512, 64, 256, 784, 784, 784, 512]
    - [1, 17574.0]
  - - [784, 512, 64, 512, 784, 784, 784, 512]
    - [18, 17943.0]
  - - [196, 1024, 64, 512, 196, 196, 196, 1024]
    - [34, 15167.0]
  - - [196, 1024, 64, 1024, 196, 196, 196, 1024]
    - [37, 15466.0]
  - - [3136, 128, 32, 256, 3136, 3136, 3136, 128]
    - [33, 18591.0]
  - - [784, 256, 32, 512, 784, 784, 784, 256]
    - [33, 16957.0]
  - - [3136, 256, 32, 128, 3136, 3136, 3136, 256]
    - [0, 19012.0]
  - - [3136, 256, 32, 256, 3136, 3136, 3136, 256]
    - [37, 19399.0]
  - - [196, 512, 32, 1024, 196, 196, 196, 512]
    - [33, 14100.0]
  - - [784, 512, 32, 256, 784, 784, 784, 512]
    - [5, 17380.0]
  - - [784, 512, 32, 512, 784, 784, 784, 512]
    - [10, 17750.0]
  - - [196, 1024, 32, 512, 196, 196, 196, 1024]
    - [33, 14654.0]
  - - [196, 1024, 32, 1024, 196, 196, 196, 1024]
    - [4, 14736.0]
  - - [1024, 4096, 1, 10224, 1024, 1024, 1024, 4096]
    - [33, 18642.0]
  - - [4096, 1024, 1, 10224, 4096, 4096, 4096, 1024]
    - [28, 18641.0]
  - - [1024, 3072, 1, 10224, 1024, 1024, 1024, 3072]
    - [3, 18850.0]
  - - [1024, 3072, 1, 10240, 1024, 1024, 1024, 3072]
    - [3, 18853.0]
  - - [4096, 1024, 1, 10192, 4096, 4096, 4096, 1024]
    - [20, 18645.0]
  - - [1024, 3072, 1, 10192, 1024, 1024, 1024, 3072]
    - [3, 18861.0]
  - - [1024, 4096, 1, 10192, 1024, 1024, 1024, 4096]
    - [20, 18644.0]
  - - [1024, 3072, 1, 10200, 1024, 1024, 1024, 3072]
    - [3, 18842.0]
  - - [4096, 1024, 1, 10208, 4096, 4096, 4096, 1024]
    - [45, 18638.0]
  - - [1024, 3072, 1, 10208, 1024, 1024, 1024, 3072]
    - [28, 18861.0]
  - - [1024, 4096, 1, 10208, 1024, 1024, 1024, 4096]
    - [33, 18640.0]
  - - [1024, 2048, 1, 10224, 1024, 1024, 1024, 2048]
    - [23, 17874.0]
  - - [1024, 2048, 1, 10240, 1024, 1024, 1024, 2048]
    - [23, 17867.0]
  - - [1024, 2048, 1, 10192, 1024, 1024, 1024, 2048]
    - [23, 17862.0]
  - - [1024, 3072, 1, 10080, 1024, 1024, 1024, 3072]
    - [36, 18885.0]
  - - [100352, 256, 1, 512, 100352, 100352, 100352, 256]
    - [21, 20381.0]
  - - [12544, 1024, 1, 2048, 12544, 12544, 12544, 1024]
    - [21, 20525.0]
  - - [12544, 147, 1, 64, 12544, 12544, 12544, 147]
    - [17, 9022.0]
  - - [200704, 256, 1, 512, 200704, 200704, 200704, 256]
    - [21, 20625.0]
  - - [25088, 512, 1, 1024, 25088, 25088, 25088, 512]
    - [21, 20382.0]
  - - [3136, 576, 1, 64, 3136, 3136, 3136, 576]
    - [9, 10510.0]
  - - [50176, 512, 1, 1024, 50176, 50176, 50176, 512]
    - [37, 20614.0]
  - - [6272, 1024, 1, 2048, 6272, 6272, 6272, 1024]
    - [37, 20186.0]
  - - [196, 1024, 128, 512, 196, 196, 196, 1024]
    - [1, 15626.0]
  - - [196, 1024, 256, 512, 196, 196, 196, 1024]
    - [1, 15714.0]
  - - [3136, 256, 128, 128, 3136, 3136, 3136, 256]
    - [0, 16319.0]
  - - [3136, 256, 256, 128, 3136, 3136, 3136, 256]
    - [36, 15447.0]
  - - [784, 512, 128, 256, 784, 784, 784, 512]
    - [4, 17797.0]
  - - [784, 512, 256, 256, 784, 784, 784, 512]
    - [1, 17934.0]
  - - [30528, 1024, 1, 2560, 30528, 30528, 30528, 1024]
    - [21, 20574.0]
  - - [1024, 4096, 1, 12288, 1024, 1024, 1024, 4096]
    - [20, 18646.0]
  - - [30528, 1024, 1, 1920, 30528, 30528, 30528, 1024]
    - [37, 20583.0]
  - - [4096, 1024, 1, 12288, 4096, 4096, 4096, 1024]
    - [45, 18629.0]
  - - [25600, 128, 25, 128, 25600, 25600, 25600, 128]
    - [36, 12300.0]
  - - [12544, 128, 36, 128, 12544, 12544, 12544, 128]
    - [36, 12353.0]
  - - [9216, 128, 49, 128, 9216, 9216, 9216, 128]
    - [45, 12443.0]
  - - [6400, 128, 64, 128, 6400, 6400, 6400, 128]
    - [36, 12452.0]
  - - [6400, 256, 25, 256, 6400, 6400, 6400, 256]
    - [21, 20267.0]
  - - [4096, 256, 36, 256, 4096, 4096, 4096, 256]
    - [21, 20000.0]
  - - [2304, 256, 49, 256, 2304, 2304, 2304, 256]
    - [37, 19867.0]
  - - [2304, 256, 64, 256, 2304, 2304, 2304, 256]
    - [37, 20018.0]
  - - [2304, 512, 25, 512, 2304, 2304, 2304, 512]
    - [4, 20700.0]
  - - [1024, 512, 36, 512, 1024, 1024, 1024, 512]
    - [4, 20502.0]
  - - [1024, 512, 49, 512, 1024, 1024, 1024, 512]
    - [4, 20427.0]
  - - [1024, 512, 64, 512, 1024, 1024, 1024, 512]
    - [37, 20629.0]
  - - [3072, 768, 1, 2048, 3072, 3072, 3072, 768]
    - [38, 19781.0]
  - - [768, 3072, 1, 2048, 768, 768, 768, 3072]
    - [38, 19869.0]
  - - [3072, 768, 1, 4608, 3072, 3072, 3072, 768]
    - [22, 19960.0]
  - - [768, 3072, 1, 4608, 768, 768, 768, 3072]
    - [5, 19956.0]
  - - [4096, 1024, 1, 4608, 4096, 4096, 4096, 1024]
    - [33, 18650.0]
  - - [1024, 4096, 1, 4608, 1024, 1024, 1024, 4096]
    - [17, 18644.0]
  - - [4880, 256, 49, 256, 4880, 4880, 4880, 256]
    - [1, 19697.0]
  - - [3128, 256, 64, 256, 3128, 3128, 3128, 256]
    - [21, 19591.0]
  - - [4680, 256, 49, 256, 4680, 4680, 4680, 256]
    - [21, 19764.0]
  - - [5280, 256, 36, 256, 5280, 5280, 5280, 256]
    - [37, 19722.0]
  - - [2640, 256, 64, 256, 2640, 2640, 2640, 256]
    - [4, 19619.0]
  - - [5304, 256, 49, 256, 5304, 5304, 5304, 256]
    - [37, 19814.0]
  - - [4524, 256, 49, 256, 4524, 4524, 4524, 256]
    - [18, 19420.0]
  - - [2760, 256, 64, 256, 2760, 2760, 2760, 256]
    - [21, 19478.0]
  - - [6440, 256, 36, 256, 6440, 6440, 6440, 256]
    - [21, 19892.0]
  - - [5704, 256, 36, 256, 5704, 5704, 5704, 256]
    - [37, 19755.0]
  - - [2666, 256, 64, 256, 2666, 2666, 2666, 256]
    - [17, 19354.0]
  - - [2128, 256, 64, 256, 2128, 2128, 2128, 256]
    - [37, 19402.0]
  - - [1160, 256, 49, 256, 1160, 1160, 1160, 256]
    - [1, 17716.0]
  - - [4056, 256, 49, 256, 4056, 4056, 4056, 256]
    - [21, 19708.0]
  - - [6144, 256, 36, 256, 6144, 6144, 6144, 256]
    - [37, 20281.0]
  - - [950, 2048, 2, 512, 950, 950, 950, 2048]
    - [33, 16907.0]
  - - [6336, 256, 36, 256, 6336, 6336, 6336, 256]
    - [37, 20142.0]
  - - [13600, 512, 2, 128, 13600, 13600, 13600, 512]
    - [11, 18875.0]
  - - [15200, 512, 2, 128, 15200, 15200, 15200, 512]
    - [33, 19040.0]
  - - [15200, 128, 2, 512, 15200, 15200, 15200, 128]
    - [38, 18268.0]
  - - [13600, 128, 2, 512, 13600, 13600, 13600, 128]
    - [30, 18907.0]
  - - [5632, 256, 36, 256, 5632, 5632, 5632, 256]
    - [37, 20355.0]
  - - [12288, 128, 2, 512, 12288, 12288, 12288, 128]
    - [33, 18315.0]
  - - [12880, 128, 2, 512, 12880, 12880, 12880, 128]
    - [30, 17914.0]
  - - [3220, 1024, 2, 256, 3220, 3220, 3220, 1024]
    - [1, 18326.0]
  - - [11408, 128, 2, 512, 11408, 11408, 11408, 128]
    - [38, 18742.0]
  - - [782, 128, 64, 128, 782, 782, 782, 128]
    - [0, 15953.0]
  - - [13824, 512, 2, 128, 13824, 13824, 13824, 512]
    - [38, 19618.0]
  - - [13824, 128, 2, 512, 13824, 13824, 13824, 128]
    - [22, 19521.0]
  - - [10560, 128, 2, 512, 10560, 10560, 10560, 128]
    - [38, 17402.0]
  - - [10752, 128, 2, 512, 10752, 10752, 10752, 128]
    - [38, 18189.0]
  - - [13600, 512, 2, 256, 13600, 13600, 13600, 512]
    - [5, 19784.0]
  - - [15200, 512, 2, 256, 15200, 15200, 15200, 512]
    - [15, 19617.0]
  - - [850, 2048, 2, 512, 850, 850, 850, 2048]
    - [33, 17357.0]
  - - [768, 2048, 2, 512, 768, 768, 768, 2048]
    - [33, 18504.0]
  - - [12880, 512, 2, 128, 12880, 12880, 12880, 512]
    - [0, 19123.0]
  - - [11616, 128, 2, 512, 11616, 11616, 11616, 128]
    - [17, 17219.0]
  - - [14208, 512, 2, 128, 14208, 14208, 14208, 512]
    - [22, 19472.0]
  - - [11408, 512, 2, 128, 11408, 11408, 11408, 512]
    - [5, 19264.0]
  - - [805, 2048, 2, 512, 805, 805, 805, 2048]
    - [17, 16483.0]
  - - [6912, 256, 36, 256, 6912, 6912, 6912, 256]
    - [37, 20427.0]
  - - [713, 2048, 2, 512, 713, 713, 713, 2048]
    - [33, 16930.0]
  - - [13824, 512, 2, 256, 13824, 13824, 13824, 512]
    - [14, 20108.0]
  - - [11616, 512, 2, 128, 11616, 11616, 11616, 512]
    - [5, 18783.0]
  - - [12288, 512, 2, 128, 12288, 12288, 12288, 512]
    - [42, 19169.0]
  - - [14208, 128, 2, 512, 14208, 14208, 14208, 128]
    - [33, 18240.0]
  - - [11968, 128, 2, 512, 11968, 11968, 11968, 128]
    - [17, 17621.0]
  - - [864, 2048, 2, 512, 864, 864, 864, 2048]
    - [33, 17629.0]
  - - [10560, 512, 2, 128, 10560, 10560, 10560, 512]
    - [33, 18589.0]
  - - [672, 2048, 2, 512, 672, 672, 672, 2048]
    - [33, 16080.0]
  - - [660, 2048, 2, 512, 660, 660, 660, 2048]
    - [17, 15761.0]
  - - [9408, 128, 2, 512, 9408, 9408, 9408, 128]
    - [9, 16718.0]
  - - [10752, 512, 2, 128, 10752, 10752, 10752, 512]
    - [22, 19200.0]
  - - [726, 2048, 2, 512, 726, 726, 726, 2048]
    - [17, 17298.0]
  - - [11968, 512, 2, 128, 11968, 11968, 11968, 512]
    - [10, 19005.0]
  - - [1240, 256, 49, 256, 1240, 1240, 1240, 256]
    - [1, 18976.0]
  - - [4032, 256, 2, 1024, 4032, 4032, 4032, 256]
    - [38, 16895.0]
  - - [888, 2048, 2, 512, 888, 888, 888, 2048]
    - [17, 18158.0]
  - - [12880, 512, 2, 256, 12880, 12880, 12880, 512]
    - [33, 19374.0]
  - - [12288, 512, 2, 256, 12288, 12288, 12288, 512]
    - [1, 19603.0]
  - - [13440, 128, 2, 512, 13440, 13440, 13440, 128]
    - [38, 19102.0]
  - - [864, 2048, 2, 256, 864, 864, 864, 2048]
    - [17, 17276.0]
  - - [12672, 128, 2, 512, 12672, 12672, 12672, 128]
    - [38, 18069.0]
  - - [11264, 128, 2, 512, 11264, 11264, 11264, 128]
    - [38, 18933.0]
  - - [11776, 128, 2, 512, 11776, 11776, 11776, 128]
    - [33, 17786.0]
  - - [16128, 128, 2, 512, 16128, 16128, 16128, 128]
    - [5, 19668.0]
  - - [4032, 1024, 2, 256, 4032, 4032, 4032, 1024]
    - [0, 18707.0]
  - - [14000, 128, 2, 512, 14000, 14000, 14000, 128]
    - [33, 17678.0]
  - - [13440, 512, 2, 128, 13440, 13440, 13440, 512]
    - [33, 19286.0]
  - - [805, 2048, 2, 256, 805, 805, 805, 2048]
    - [0, 16048.0]
  - - [768, 2048, 2, 256, 768, 768, 768, 2048]
    - [0, 18162.0]
  - - [3264, 1024, 2, 256, 3264, 3264, 3264, 1024]
    - [1, 18369.0]
  - - [1251, 256, 49, 256, 1251, 1251, 1251, 256]
    - [0, 19021.0]
  - - [4200, 256, 2, 1024, 4200, 4200, 4200, 256]
    - [38, 17593.0]
  - - [2352, 1024, 2, 256, 2352, 2352, 2352, 1024]
    - [0, 18263.0]
  - - [2400, 1024, 2, 256, 2400, 2400, 2400, 1024]
    - [0, 18575.0]
  - - [15200, 256, 2, 12, 15200, 15200, 15200, 256]
    - [22, 5392.0]
  - - [12880, 256, 2, 12, 12880, 12880, 12880, 256]
    - [5, 5276.0]
  - - [2520, 1024, 2, 256, 2520, 2520, 2520, 1024]
    - [5, 18826.0]
  - - [13600, 256, 2, 12, 13600, 13600, 13600, 256]
    - [47, 5343.0]
  - - [15200, 256, 2, 3, 15200, 15200, 15200, 256]
    - [35, 1497.0]
  - - [12880, 256, 2, 3, 12880, 12880, 12880, 256]
    - [19, 1476.0]
  - - [4200, 1024, 2, 256, 4200, 4200, 4200, 1024]
    - [15, 19175.0]
  - - [12288, 256, 2, 12, 12288, 12288, 12288, 256]
    - [13, 5347.0]
  - - [13824, 256, 2, 12, 13824, 13824, 13824, 256]
    - [3, 5438.0]
  - - [13600, 256, 2, 3, 13600, 13600, 13600, 256]
    - [5, 1505.0]
  - - [1900, 1024, 1, 2048, 1900, 1900, 1900, 1024]
    - [33, 17939.0]
  - - [7600, 512, 1, 256, 7600, 7600, 7600, 512]
    - [2, 17968.0]
  - - [1610, 1024, 1, 2048, 1610, 1610, 1610, 1024]
    - [15, 18056.0]
  - - [6144, 512, 1, 256, 6144, 6144, 6144, 512]
    - [0, 18089.0]
  - - [1900, 1024, 1, 512, 1900, 1900, 1900, 1024]
    - [0, 17336.0]
  - - [12544, 1024, 1, 1024, 12544, 12544, 12544, 1024]
    - [37, 20517.0]
  - - [3220, 256, 2, 12, 3220, 3220, 3220, 256]
    - [5, 3691.0]
  - - [3220, 256, 2, 3, 3220, 3220, 3220, 256]
    - [19, 1066.0]
  - - [3800, 256, 2, 3, 3800, 3800, 3800, 256]
    - [33, 1089.0]
  - - [13824, 256, 2, 3, 13824, 13824, 13824, 256]
    - [3, 1506.0]
  - - [12288, 256, 2, 3, 12288, 12288, 12288, 256]
    - [0, 1547.0]
  - - [2688, 256, 2, 1024, 2688, 2688, 2688, 256]
    - [17, 17174.0]
  - - [3072, 256, 2, 12, 3072, 3072, 3072, 256]
    - [0, 3630.0]
  - - [3800, 256, 2, 12, 3800, 3800, 3800, 256]
    - [38, 3865.0]
  - - [3072, 256, 2, 3, 3072, 3072, 3072, 256]
    - [0, 1102.0]
  - - [2520, 256, 2, 1024, 2520, 2520, 2520, 256]
    - [33, 15933.0]
  - - [16128, 512, 2, 128, 16128, 16128, 16128, 512]
    - [47, 19731.0]
  - - [2400, 256, 2, 1024, 2400, 2400, 2400, 256]
    - [17, 15234.0]
  - - [2352, 256, 2, 1024, 2352, 2352, 2352, 256]
    - [17, 14929.0]
  - - [3036, 1024, 2, 256, 3036, 3036, 3036, 1024]
    - [5, 18731.0]
  - - [2944, 256, 2, 1024, 2944, 2944, 2944, 256]
    - [38, 16579.0]
  - - [2992, 1024, 2, 256, 2992, 2992, 2992, 1024]
    - [5, 18648.0]
  - - [2816, 256, 2, 1024, 2816, 2816, 2816, 256]
    - [0, 17961.0]
  - - [3036, 256, 2, 1024, 3036, 3036, 3036, 256]
    - [5, 16980.0]
  - - [2904, 1024, 2, 256, 2904, 2904, 2904, 1024]
    - [17, 18450.0]
  - - [3456, 256, 2, 3, 3456, 3456, 3456, 256]
    - [35, 1129.0]
  - - [3400, 256, 2, 3, 3400, 3400, 3400, 256]
    - [19, 1079.0]
  - - [2816, 1024, 2, 256, 2816, 2816, 2816, 1024]
    - [38, 19249.0]
  - - [3456, 256, 2, 12, 3456, 3456, 3456, 256]
    - [5, 4006.0]
  - - [2944, 1024, 2, 256, 2944, 2944, 2944, 1024]
    - [33, 18796.0]
  - - [3168, 256, 2, 1024, 3168, 3168, 3168, 256]
    - [19, 17418.0]
  - - [850, 2048, 2, 256, 850, 850, 850, 2048]
    - [0, 16983.0]
  - - [2992, 256, 2, 1024, 2992, 2992, 2992, 256]
    - [5, 16763.0]
  - - [2852, 1024, 2, 256, 2852, 2852, 2852, 1024]
    - [0, 18142.0]
  - - [51520, 256, 2, 12, 51520, 51520, 51520, 256]
    - [10, 7483.0]
  - - [3072, 256, 2, 1024, 3072, 3072, 3072, 256]
    - [38, 16993.0]
  - - [2640, 1024, 2, 256, 2640, 2640, 2640, 1024]
    - [9, 18338.0]
  - - [2688, 1024, 2, 256, 2688, 2688, 2688, 1024]
    - [17, 18881.0]
  - - [2904, 256, 2, 1024, 2904, 2904, 2904, 256]
    - [5, 16054.0]
  - - [3264, 256, 2, 1024, 3264, 3264, 3264, 256]
    - [5, 17882.0]
  - - [54400, 256, 2, 12, 54400, 54400, 54400, 256]
    - [19, 7712.0]
  - - [950, 2048, 2, 256, 950, 950, 950, 2048]
    - [33, 16602.0]
  - - [55296, 256, 2, 3, 55296, 55296, 55296, 256]
    - [14, 1972.0]
  - - [60800, 256, 2, 12, 60800, 60800, 60800, 256]
    - [43, 8391.0]
  - - [51520, 256, 2, 3, 51520, 51520, 51520, 256]
    - [15, 1755.0]
  - - [3700, 1024, 2, 256, 3700, 3700, 3700, 1024]
    - [5, 19048.0]
  - - [55296, 256, 2, 12, 55296, 55296, 55296, 256]
    - [13, 6814.0]
  - - [2852, 256, 2, 1024, 2852, 2852, 2852, 256]
    - [22, 15680.0]
  - - [3600, 1024, 2, 256, 3600, 3600, 3600, 1024]
    - [5, 18837.0]
  - - [3700, 256, 2, 1024, 3700, 3700, 3700, 256]
    - [33, 17161.0]
  - - [60800, 256, 2, 3, 60800, 60800, 60800, 256]
    - [35, 2308.0]
  - - [1269, 256, 49, 256, 1269, 1269, 1269, 256]
    - [33, 19226.0]
  - - [1467, 256, 49, 256, 1467, 1467, 1467, 256]
    - [1, 18736.0]
  - - [3500, 256, 2, 1024, 3500, 3500, 3500, 256]
    - [0, 16185.0]
  - - [952, 256, 64, 256, 952, 952, 952, 256]
    - [38, 18231.0]
  - - [49152, 256, 2, 12, 49152, 49152, 49152, 256]
    - [4, 5952.0]
  - - [1449, 256, 49, 256, 1449, 1449, 1449, 256]
    - [38, 18525.0]
  - - [1278, 256, 49, 256, 1278, 1278, 1278, 256]
    - [17, 19331.0]
  - - [3360, 256, 2, 1024, 3360, 3360, 3360, 256]
    - [19, 18285.0]
  - - [736, 256, 64, 256, 736, 736, 736, 256]
    - [1, 18626.0]
  - - [1413, 256, 49, 256, 1413, 1413, 1413, 256]
    - [38, 18166.0]
  - - [600, 256, 64, 256, 600, 600, 600, 256]
    - [5, 18255.0]
  - - [1341, 256, 49, 256, 1341, 1341, 1341, 256]
    - [5, 18884.0]
  - - [1287, 256, 49, 256, 1287, 1287, 1287, 256]
    - [38, 18207.0]
  - - [1332, 256, 49, 256, 1332, 1332, 1332, 256]
    - [38, 18888.0]
  - - [1359, 256, 49, 256, 1359, 1359, 1359, 256]
    - [5, 19144.0]
  - - [1440, 256, 49, 256, 1440, 1440, 1440, 256]
    - [22, 18603.0]
  - - [1395, 256, 49, 256, 1395, 1395, 1395, 256]
    - [47, 19337.0]
  - - [1323, 256, 49, 256, 1323, 1323, 1323, 256]
    - [22, 18765.0]
  - - [1404, 256, 49, 256, 1404, 1404, 1404, 256]
    - [38, 19759.0]
  - - [1386, 256, 49, 256, 1386, 1386, 1386, 256]
    - [22, 19475.0]
  - - [3168, 1024, 2, 256, 3168, 3168, 3168, 1024]
    - [17, 18353.0]
  - - [1350, 256, 49, 256, 1350, 1350, 1350, 256]
    - [47, 18806.0]
  - - [1368, 256, 49, 256, 1368, 1368, 1368, 256]
    - [38, 19271.0]
  - - [49152, 256, 2, 3, 49152, 49152, 49152, 256]
    - [9, 1497.0]
  - - [3600, 256, 2, 1024, 3600, 3600, 3600, 256]
    - [33, 16685.0]
  - - [3500, 1024, 2, 256, 3500, 3500, 3500, 1024]
    - [0, 18748.0]
  - - [3360, 1024, 2, 256, 3360, 3360, 3360, 1024]
    - [5, 18946.0]
  - - [3220, 256, 2, 1024, 3220, 3220, 3220, 256]
    - [5, 17670.0]
  - - [690, 256, 64, 256, 690, 690, 690, 256]
    - [38, 17396.0]
  - - [54400, 256, 2, 3, 54400, 54400, 54400, 256]
    - [11, 1960.0]
  - - [3072, 1024, 2, 256, 3072, 3072, 3072, 1024]
    - [22, 19015.0]
  - - [2640, 256, 2, 1024, 2640, 2640, 2640, 256]
    - [0, 16470.0]
  - - [616, 256, 64, 256, 616, 616, 616, 256]
    - [38, 18823.0]
  - - [3008, 256, 64, 256, 3008, 3008, 3008, 256]
    - [1, 19714.0]
  - - [896, 256, 64, 256, 896, 896, 896, 256]
    - [18, 19935.0]
  - - [768, 256, 64, 256, 768, 768, 768, 256]
    - [1, 19454.0]
  - - [660, 256, 64, 256, 660, 660, 660, 256]
    - [0, 16658.0]
  - - [3552, 256, 2, 1024, 3552, 3552, 3552, 256]
    - [3, 16542.0]
  - - [3552, 1024, 2, 256, 3552, 3552, 3552, 1024]
    - [9, 19007.0]
  - - [800, 256, 64, 256, 800, 800, 800, 256]
    - [34, 17884.0]
  - - [1120, 256, 49, 256, 1120, 1120, 1120, 256]
    - [18, 19219.0]
  - - [2408, 256, 64, 256, 2408, 2408, 2408, 256]
    - [21, 19559.0]
  - - [3456, 256, 2, 1024, 3456, 3456, 3456, 256]
    - [5, 19069.0]
  - - [672, 256, 64, 256, 672, 672, 672, 256]
    - [17, 17008.0]
  - - [782, 256, 64, 256, 782, 782, 782, 256]
    - [30, 17267.0]
  - - [884, 256, 64, 256, 884, 884, 884, 256]
    - [22, 19398.0]
  - - [3456, 1024, 2, 256, 3456, 3456, 3456, 1024]
    - [43, 19580.0]
  - - [1064, 256, 49, 256, 1064, 1064, 1064, 256]
    - [1, 18138.0]
  - - [3400, 256, 2, 1024, 3400, 3400, 3400, 256]
    - [19, 18569.0]
  - - [704, 256, 64, 256, 704, 704, 704, 256]
    - [0, 17805.0]
  - - [3400, 1024, 2, 256, 3400, 3400, 3400, 1024]
    - [5, 19250.0]
  - - [3264, 256, 64, 256, 3264, 3264, 3264, 256]
    - [37, 19926.0]
  - - [3800, 1024, 2, 256, 3800, 3800, 3800, 1024]
    - [17, 18665.0]
  - - [3800, 256, 2, 1024, 3800, 3800, 3800, 256]
    - [17, 17628.0]
  - - [6440, 512, 1, 256, 6440, 6440, 6440, 512]
    - [5, 17542.0]
  - - [6912, 512, 1, 256, 6912, 6912, 6912, 512]
    - [38, 19097.0]
  - - [6800, 512, 1, 256, 6800, 6800, 6800, 512]
    - [5, 18257.0]
  - - [6800, 512, 1, 1024, 6800, 6800, 6800, 512]
    - [22, 19391.0]
  - - [6440, 512, 1, 1024, 6440, 6440, 6440, 512]
    - [22, 18398.0]
  - - [6912, 512, 1, 1024, 6912, 6912, 6912, 512]
    - [38, 19898.0]
  - - [1728, 1024, 1, 512, 1728, 1728, 1728, 1024]
    - [33, 15811.0]
  - - [1536, 1024, 1, 512, 1536, 1536, 1536, 1024]
    - [38, 16918.0]
  - - [1610, 1024, 1, 512, 1610, 1610, 1610, 1024]
    - [5, 17157.0]
  - - [7600, 512, 1, 1024, 7600, 7600, 7600, 512]
    - [5, 18904.0]
  - - [6144, 512, 1, 1024, 6144, 6144, 6144, 512]
    - [33, 18704.0]
  - - [1700, 1024, 1, 512, 1700, 1700, 1700, 1024]
    - [33, 15539.0]
  - - [1728, 1024, 1, 2048, 1728, 1728, 1728, 1024]
    - [33, 16347.0]
  - - [1536, 1024, 1, 2048, 1536, 1536, 1536, 1024]
    - [38, 17482.0]
  - - [1700, 1024, 1, 2048, 1700, 1700, 1700, 1024]
    - [33, 16077.0]
  - - [1920, 25216, 1, 16384, 1920, 1920, 1920, 25216]
    - [21, 20862.0]
  - - [3840, 1920, 1, 16384, 3840, 3840, 3840, 1920]
    - [4, 19894.0]
  - - [1920, 3840, 1, 16384, 1920, 1920, 1920, 3840]
    - [29, 19868.0]
  - - [960, 1920, 1, 16384, 960, 960, 960, 1920]
    - [33, 17113.0]
  - - [1920, 2880, 1, 16384, 1920, 1920, 1920, 2880]
    - [20, 19500.0]
  - - [1920, 25216, 1, 4096, 1920, 1920, 1920, 25216]
    - [37, 20856.0]
  - - [3840, 1920, 1, 4096, 3840, 3840, 3840, 1920]
    - [4, 19810.0]
  - - [1920, 3840, 1, 4096, 1920, 1920, 1920, 3840]
    - [37, 19798.0]
  - - [960, 1920, 1, 4096, 960, 960, 960, 1920]
    - [33, 17109.0]
  - - [1920, 2880, 1, 4096, 1920, 1920, 1920, 2880]
    - [0, 19463.0]
  - - [1920, 25216, 1, 8192, 1920, 1920, 1920, 25216]
    - [37, 20858.0]
  - - [3840, 1920, 1, 8192, 3840, 3840, 3840, 1920]
    - [4, 19857.0]
  - - [1920, 3840, 1, 8192, 1920, 1920, 1920, 3840]
    - [37, 19878.0]
  - - [960, 1920, 1, 8192, 960, 960, 960, 1920]
    - [42, 17159.0]
  - - [1920, 2880, 1, 8192, 1920, 1920, 1920, 2880]
    - [36, 19475.0]
  - - [2304, 12672, 1, 16384, 2304, 2304, 2304, 12672]
    - [37, 20789.0]
  - - [2304, 2304, 1, 16384, 2304, 2304, 2304, 2304]
    - [5, 20356.0]
  - - [576, 2304, 1, 16384, 576, 576, 576, 2304]
    - [5, 14873.0]
  - - [2304, 1728, 1, 16384, 2304, 2304, 2304, 1728]
    - [5, 19535.0]
  - - [2304, 12672, 1, 4096, 2304, 2304, 2304, 12672]
    - [21, 20758.0]
  - - [2304, 2304, 1, 4096, 2304, 2304, 2304, 2304]
    - [38, 20257.0]
  - - [576, 2304, 1, 4096, 576, 576, 576, 2304]
    - [38, 14777.0]
  - - [2304, 1728, 1, 4096, 2304, 2304, 2304, 1728]
    - [38, 19418.0]
  - - [2304, 12672, 1, 8192, 2304, 2304, 2304, 12672]
    - [21, 20789.0]
  - - [2304, 2304, 1, 8192, 2304, 2304, 2304, 2304]
    - [22, 20301.0]
  - - [576, 2304, 1, 8192, 576, 576, 576, 2304]
    - [22, 14816.0]
  - - [2304, 1728, 1, 8192, 2304, 2304, 2304, 1728]
    - [38, 19480.0]
  - - [3072, 6400, 1, 4096, 3072, 3072, 3072, 6400]
    - [37, 20497.0]
  - - [1536, 3072, 1, 4096, 1536, 1536, 1536, 3072]
    - [39, 20318.0]
  - - [3072, 1536, 1, 4096, 3072, 3072, 3072, 1536]
    - [6, 20314.0]
  - - [384, 3072, 1, 4096, 384, 384, 384, 3072]
    - [41, 19157.0]
  - - [3072, 1152, 1, 4096, 3072, 3072, 3072, 1152]
    - [5, 20099.0]
  - - [3072, 6400, 1, 8192, 3072, 3072, 3072, 6400]
    - [21, 20524.0]
  - - [1536, 3072, 1, 8192, 1536, 1536, 1536, 3072]
    - [23, 20419.0]
  - - [3072, 1536, 1, 8192, 3072, 3072, 3072, 1536]
    - [39, 20392.0]
  - - [384, 3072, 1, 8192, 384, 384, 384, 3072]
    - [41, 19204.0]
  - - [3072, 1152, 1, 8192, 3072, 3072, 3072, 1152]
    - [22, 20130.0]
  - - [2048, 2048, 1, 4096, 2048, 2048, 2048, 2048]
    - [0, 18613.0]
  - - [2048, 2048, 1, 8, 2048, 2048, 2048, 2048]
    - [0, 3631.0]
  - - [2048, 29000, 1, 199, 2048, 2048, 2048, 29000]
    - [1, 19965.0]
  - - [2048, 29000, 1, 221, 2048, 2048, 2048, 29000]
    - [21, 20037.0]
  - - [2048, 29000, 1, 224, 2048, 2048, 2048, 29000]
    - [21, 20131.0]
  - - [2048, 29000, 1, 229, 2048, 2048, 2048, 29000]
    - [21, 20135.0]
  - - [2048, 29000, 1, 234, 2048, 2048, 2048, 29000]
    - [21, 20128.0]
  - - [2048, 29000, 1, 242, 2048, 2048, 2048, 29000]
    - [21, 20187.0]
  - - [2048, 29000, 1, 246, 2048, 2048, 2048, 29000]
    - [21, 20220.0]
  - - [2048, 29000, 1, 247, 2048, 2048, 2048, 29000]
    - [21, 20241.0]
  - - [2048, 29000, 1, 256, 2048, 2048, 2048, 29000]
    - [21, 20362.0]
  - - [2048, 29000, 1, 262, 2048, 2048, 2048, 29000]
    - [21, 20282.0]
  - - [2048, 29000, 1, 264, 2048, 2048, 2048, 29000]
    - [21, 20291.0]
  - - [2048, 29000, 1, 265, 2048, 2048, 2048, 29000]
    - [21, 20273.0]
  - - [2048, 29000, 1, 274, 2048, 2048, 2048, 29000]
    - [21, 20309.0]
  - - [2048, 29000, 1, 277, 2048, 2048, 2048, 29000]
    - [21, 20296.0]
  - - [2048, 29000, 1, 279, 2048, 2048, 2048, 29000]
    - [21, 20340.0]
  - - [2048, 29000, 1, 288, 2048, 2048, 2048, 29000]
    - [21, 20456.0]
  - - [2048, 29000, 1, 296, 2048, 2048, 2048, 29000]
    - [21, 20401.0]
  - - [2048, 29000, 1, 315, 2048, 2048, 2048, 29000]
    - [4, 20402.0]
  - - [2048, 29000, 1, 335, 2048, 2048, 2048, 29000]
    - [4, 20459.0]
  - - [2048, 4096, 1, 4096, 2048, 2048, 2048, 4096]
    - [37, 19597.0]
  - - [4096, 2048, 1, 4096, 4096, 4096, 4096, 2048]
    - [4, 19622.0]
  - - [1024, 29000, 1, 2283, 1024, 1024, 1024, 29000]
    - [21, 20703.0]
  - - [1024, 29000, 1, 2296, 1024, 1024, 1024, 29000]
    - [37, 20681.0]
  - - [1024, 29000, 1, 2306, 1024, 1024, 1024, 29000]
    - [21, 20720.0]
  - - [1024, 29000, 1, 2309, 1024, 1024, 1024, 29000]
    - [21, 20689.0]
  - - [1024, 29000, 1, 2318, 1024, 1024, 1024, 29000]
    - [37, 20684.0]
  - - [1024, 29000, 1, 2320, 1024, 1024, 1024, 29000]
    - [37, 20687.0]
  - - [1024, 29000, 1, 2324, 1024, 1024, 1024, 29000]
    - [37, 20688.0]
  - - [1024, 29000, 1, 2325, 1024, 1024, 1024, 29000]
    - [21, 20688.0]
  - - [1024, 29000, 1, 2329, 1024, 1024, 1024, 29000]
    - [37, 20686.0]
  - - [1024, 29000, 1, 2338, 1024, 1024, 1024, 29000]
    - [21, 20686.0]
  - - [1024, 29000, 1, 2345, 1024, 1024, 1024, 29000]
    - [21, 20688.0]
  - - [1024, 29000, 1, 2350, 1024, 1024, 1024, 29000]
    - [21, 20704.0]
  - - [1024, 29000, 1, 2362, 1024, 1024, 1024, 29000]
    - [37, 20690.0]
  - - [1024, 29000, 1, 2366, 1024, 1024, 1024, 29000]
    - [21, 20689.0]
  - - [1024, 29000, 1, 2368, 1024, 1024, 1024, 29000]
    - [37, 20694.0]
  - - [1024, 29000, 1, 2374, 1024, 1024, 1024, 29000]
    - [37, 20687.0]
  - - [1024, 29000, 1, 2390, 1024, 1024, 1024, 29000]
    - [21, 20689.0]
  - - [1024, 29000, 1, 561, 1024, 1024, 1024, 29000]
    - [21, 20391.0]
  - - [1024, 29000, 1, 574, 1024, 1024, 1024, 29000]
    - [21, 20397.0]
  - - [1024, 29000, 1, 600, 1024, 1024, 1024, 29000]
    - [21, 20433.0]
  - - [1024, 29000, 1, 608, 1024, 1024, 1024, 29000]
    - [21, 20432.0]
  - - [1024, 29000, 1, 615, 1024, 1024, 1024, 29000]
    - [21, 20434.0]
  - - [1024, 29000, 1, 622, 1024, 1024, 1024, 29000]
    - [21, 20426.0]
  - - [1024, 29000, 1, 625, 1024, 1024, 1024, 29000]
    - [21, 20410.0]
  - - [1024, 29000, 1, 626, 1024, 1024, 1024, 29000]
    - [21, 20442.0]
  - - [1024, 29000, 1, 628, 1024, 1024, 1024, 29000]
    - [21, 20443.0]
  - - [1024, 29000, 1, 636, 1024, 1024, 1024, 29000]
    - [21, 20436.0]
  - - [1024, 29000, 1, 651, 1024, 1024, 1024, 29000]
    - [21, 20427.0]
  - - [1024, 29000, 1, 658, 1024, 1024, 1024, 29000]
    - [21, 20451.0]
  - - [1024, 29000, 1, 669, 1024, 1024, 1024, 29000]
    - [21, 20452.0]
  - - [1024, 29000, 1, 670, 1024, 1024, 1024, 29000]
    - [21, 20451.0]
  - - [1024, 29000, 1, 672, 1024, 1024, 1024, 29000]
    - [21, 20470.0]
  - - [1024, 29000, 1, 684, 1024, 1024, 1024, 29000]
    - [21, 20450.0]
  - - [1024, 29000, 1, 716, 1024, 1024, 1024, 29000]
    - [21, 20469.0]
  - - [1024, 29000, 1, 730, 1024, 1024, 1024, 29000]
    - [21, 20476.0]
  - - [2560, 2560, 1, 1024, 2560, 2560, 2560, 2560]
    - [33, 18987.0]
  - - [2560, 2560, 1, 2, 2560, 2560, 2560, 2560]
    - [3, 980.0]
  - - [2560, 29000, 1, 109, 2560, 2560, 2560, 29000]
    - [0, 19111.0]
  - - [2560, 29000, 1, 121, 2560, 2560, 2560, 29000]
    - [15, 19117.0]
  - - [2560, 29000, 1, 27, 2560, 2560, 2560, 29000]
    - [32, 5335.0]
  - - [2560, 29000, 1, 35, 2560, 2560, 2560, 29000]
    - [17, 6709.0]
  - - [2560, 29000, 1, 36, 2560, 2560, 2560, 29000]
    - [8, 6896.0]
  - - [2560, 29000, 1, 39, 2560, 2560, 2560, 29000]
    - [20, 7463.0]
  - - [2560, 29000, 1, 40, 2560, 2560, 2560, 29000]
    - [16, 7625.0]
  - - [2560, 29000, 1, 42, 2560, 2560, 2560, 29000]
    - [16, 8005.0]
  - - [2560, 29000, 1, 43, 2560, 2560, 2560, 29000]
    - [11, 8168.0]
  - - [2560, 29000, 1, 44, 2560, 2560, 2560, 29000]
    - [28, 8354.0]
  - - [2560, 29000, 1, 46, 2560, 2560, 2560, 29000]
    - [2, 8731.0]
  - - [2560, 29000, 1, 48, 2560, 2560, 2560, 29000]
    - [17, 9072.0]
  - - [2560, 29000, 1, 49, 2560, 2560, 2560, 29000]
    - [20, 9295.0]
  - - [2560, 29000, 1, 50, 2560, 2560, 2560, 29000]
    - [20, 9482.0]
  - - [2560, 29000, 1, 51, 2560, 2560, 2560, 29000]
    - [3, 9653.0]
  - - [2560, 29000, 1, 53, 2560, 2560, 2560, 29000]
    - [11, 10008.0]
  - - [2560, 29000, 1, 54, 2560, 2560, 2560, 29000]
    - [8, 10168.0]
  - - [2560, 29000, 1, 55, 2560, 2560, 2560, 29000]
    - [13, 10367.0]
  - - [2560, 29000, 1, 56, 2560, 2560, 2560, 29000]
    - [3, 10557.0]
  - - [2560, 29000, 1, 57, 2560, 2560, 2560, 29000]
    - [13, 10721.0]
  - - [2560, 29000, 1, 58, 2560, 2560, 2560, 29000]
    - [13, 10913.0]
  - - [2560, 29000, 1, 59, 2560, 2560, 2560, 29000]
    - [2, 11095.0]
  - - [2560, 29000, 1, 61, 2560, 2560, 2560, 29000]
    - [13, 11472.0]
  - - [2560, 29000, 1, 63, 2560, 2560, 2560, 29000]
    - [2, 11792.0]
  - - [2560, 29000, 1, 65, 2560, 2560, 2560, 29000]
    - [2, 12136.0]
  - - [2560, 29000, 1, 66, 2560, 2560, 2560, 29000]
    - [2, 12345.0]
  - - [2560, 29000, 1, 67, 2560, 2560, 2560, 29000]
    - [13, 12466.0]
  - - [2560, 29000, 1, 69, 2560, 2560, 2560, 29000]
    - [2, 12871.0]
  - - [2560, 29000, 1, 70, 2560, 2560, 2560, 29000]
    - [13, 13012.0]
  - - [2560, 29000, 1, 71, 2560, 2560, 2560, 29000]
    - [2, 13217.0]
  - - [2560, 29000, 1, 73, 2560, 2560, 2560, 29000]
    - [2, 13558.0]
  - - [2560, 29000, 1, 74, 2560, 2560, 2560, 29000]
    - [2, 13762.0]
  - - [2560, 29000, 1, 75, 2560, 2560, 2560, 29000]
    - [0, 13831.0]
  - - [2560, 29000, 1, 77, 2560, 2560, 2560, 29000]
    - [17, 14093.0]
  - - [2560, 29000, 1, 78, 2560, 2560, 2560, 29000]
    - [2, 14297.0]
  - - [2560, 29000, 1, 80, 2560, 2560, 2560, 29000]
    - [2, 14787.0]
  - - [2560, 29000, 1, 81, 2560, 2560, 2560, 29000]
    - [5, 14846.0]
  - - [2560, 29000, 1, 82, 2560, 2560, 2560, 29000]
    - [5, 15008.0]
  - - [2560, 29000, 1, 83, 2560, 2560, 2560, 29000]
    - [5, 15253.0]
  - - [2560, 29000, 1, 84, 2560, 2560, 2560, 29000]
    - [5, 15391.0]
  - - [2560, 29000, 1, 88, 2560, 2560, 2560, 29000]
    - [0, 16042.0]
  - - [2560, 29000, 1, 89, 2560, 2560, 2560, 29000]
    - [5, 16175.0]
  - - [2560, 29000, 1, 90, 2560, 2560, 2560, 29000]
    - [5, 16289.0]
  - - [2560, 29000, 1, 92, 2560, 2560, 2560, 29000]
    - [5, 16598.0]
  - - [2560, 29000, 1, 95, 2560, 2560, 2560, 29000]
    - [15, 16915.0]
  - - [2560, 29000, 1, 98, 2560, 2560, 2560, 29000]
    - [5, 17675.0]
  - - [2560, 4096, 1, 1024, 2560, 2560, 2560, 4096]
    - [37, 20303.0]
  - - [4096, 2560, 1, 1024, 4096, 4096, 4096, 2560]
    - [46, 20348.0]
  - - [1024, 3072, 1, 32768, 1024, 1024, 1024, 3072]
    - [20, 18912.0]
  - - [1024, 4096, 1, 32768, 1024, 1024, 1024, 4096]
    - [20, 18660.0]
  - - [1024, 50304, 1, 32768, 1024, 1024, 1024, 50304]
    - [6, 20559.0]
  - - [4096, 1024, 1, 32768, 4096, 4096, 4096, 1024]
    - [45, 18639.0]
  - - [1024, 128, 24, 1024, 1024, 1024, 1024, 128]
    - [17, 18566.0]
  - - [128, 1024, 24, 1024, 128, 128, 128, 1024]
    - [33, 18622.0]
  - - [1024, 256, 1, 33536, 1024, 1024, 1024, 256]
    - [52, 16310.0]
  - - [1024, 1024, 1, 9520, 1024, 1024, 1024, 1024]
    - [54, 18032.0]
  - - [1024, 1024, 1, 10200, 1024, 1024, 1024, 1024]
    - [48, 18126.0]
  - - [1024, 256, 1, 21248, 1024, 1024, 1024, 256]
    - [58, 15943.0]
  - - [1024, 256, 1, 21504, 1024, 1024, 1024, 256]
    - [51, 16054.0]
  - - [1024, 256, 1, 22016, 1024, 1024, 1024, 256]
    - [51, 16140.0]
  - - [1024, 256, 1, 28672, 1024, 1024, 1024, 256]
    - [53, 16310.0]
  - - [256, 2560, 1, 8976, 256, 256, 256, 2560]
    - [49, 17941.0]
  - - [256, 2816, 1, 8976, 256, 256, 256, 2816]
    - [57, 18211.0]
  - - [256, 3328, 1, 8976, 256, 256, 256, 3328]
    - [55, 18330.0]
  - - [256, 3584, 1, 8976, 256, 256, 256, 3584]
    - [54, 17952.0]
  - - [256, 3840, 1, 8976, 256, 256, 256, 3840]
    - [55, 18345.0]
  - - [256, 4096, 1, 8976, 256, 256, 256, 4096]
    - [56, 17923.0]
  - - [256, 4352, 1, 8976, 256, 256, 256, 4352]
    - [55, 18345.0]
  - - [1024, 1024, 1, 32768, 1024, 1024, 1024, 1024]
    - [56, 18184.0]
  - - [1024, 512, 1, 32768, 1024, 1024, 1024, 512]
    - [50, 17448.0]
  - - [479, 1024, 1, 32768, 479, 479, 479, 1024]
    - [55, 16390.0]
  - - [512, 256, 1, 55296, 512, 512, 512, 256]
    - [55, 14661.0]
  - - [1024, 1024, 1, 8192, 1024, 1024, 1024, 1024]
    - [48, 17929.0]
  - - [1024, 1024, 1, 9600, 1024, 1024, 1024, 1024]
    - [48, 18066.0]
  - - [1024, 1024, 1, 10064, 1024, 1024, 1024, 1024]
    - [48, 18058.0]
  - - [1024, 1024, 1, 10080, 1024, 1024, 1024, 1024]
    - [48, 18111.0]
  - - [1024, 1024, 1, 9216, 1024, 1024, 1024, 1024]
    - [48, 18006.0]
  - - [480, 1024, 1, 32768, 480, 480, 480, 1024]
    - [50, 16473.0]
  - - [1024, 1024, 1, 16384, 1024, 1024, 1024, 1024]
    - [54, 18262.0]
  - - [1024, 1024, 1, 10240, 1024, 1024, 1024, 1024]
    - [48, 18090.0]
  - - [1024, 1024, 1, 10496, 1024, 1024, 1024, 1024]
    - [54, 18111.0]
  - - [1024, 1024, 1, 10224, 1024, 1024, 1024, 1024]
    - [48, 18099.0]
  - - [1024, 1024, 1, 10192, 1024, 1024, 1024, 1024]
    - [48, 18100.0]
  - - [1024, 1024, 1, 10208, 1024, 1024, 1024, 1024]
    - [48, 18089.0]
  - - [1024, 1024, 1, 10184, 1024, 1024, 1024, 1024]
    - [48, 18120.0]
  - - [1024, 1024, 1, 10120, 1024, 1024, 1024, 1024]
    - [48, 18127.0]
  - - [1024, 1024, 1, 10152, 1024, 1024, 1024, 1024]
    - [54, 18099.0]
  - - [1024, 1024, 1, 12288, 1024, 1024, 1024, 1024]
    - [48, 18189.0]
  - - [1024, 1024, 1, 512, 1024, 1024, 1024, 1024]
    - [88, 15157.0]
  - - [1024, 1024, 1, 200, 1024, 1024, 1024, 1024]
    - [63, 14094.0]
  - - [1024, 1024, 1, 4096, 1024, 1024, 1024, 1024]
    - [74, 17007.0]
  - - [1024, 1024, 1, 2048, 1024, 1024, 1024, 1024]
    - [96, 16838.0]
  - - [768, 768, 1, 16, 768, 768, 768, 768]
    - [92, 3775.0]
  - - [768, 768, 1, 320, 768, 768, 768, 768]
    - [63, 13579.0]
  - - [768, 768, 1, 4096, 768, 768, 768, 768]
    - [116, 16815.0]
  - - [768, 768, 1, 32, 768, 768, 768, 768]
    - [95, 5519.0]
  - - [768, 768, 1, 640, 768, 768, 768, 768]
    - [63, 15063.0]
  - - [768, 768, 1, 64, 768, 768, 768, 768]
    - [92, 7316.0]
  - - [768, 768, 1, 1280, 768, 768, 768, 768]
    - [63, 15975.0]
  - - [1024, 1024, 1, 3072, 1024, 1024, 1024, 1024]
    - [96, 17006.0]
  - - [1024, 1024, 1, 120, 1024, 1024, 1024, 1024]
    - [63, 12710.0]
  - - [1024, 1024, 1, 1, 1024, 1024, 1024, 1024]
    - [92, 324.0]
  - - [1024, 1024, 1, 20, 1024, 1024, 1024, 1024]
    - [107, 4810.0]
  - - [1024, 1024, 1, 4, 1024, 1024, 1024, 1024]
    - [107, 1279.0]
  - - [1024, 1024, 1, 6, 1024, 1024, 1024, 1024]
    - [107, 1829.0]
  - - [1024, 1024, 1, 80, 1024, 1024, 1024, 1024]
    - [61, 11367.0]
  - - [128, 64, 512, 128, 128, 128, 128, 64]
    - [63, 16798.0]
  - - [512, 64, 64, 512, 512, 512, 512, 64]
    - [87, 16720.0]
  - - [64, 64, 768, 64, 64, 64, 64, 64]
    - [62, 11001.0]
  - - [1856, 448, 1, 3328, 1856, 1856, 1856, 448]
    - [63, 16648.0]
  - - [128, 6784, 1, 3328, 128, 128, 128, 6784]
    - [88, 13981.0]
  - - [2368, 448, 1, 128, 2368, 2368, 2368, 448]
    - [61, 12883.0]
  - - [256, 4288, 1, 3328, 256, 256, 256, 4288]
    - [103, 17547.0]
  - - [704, 1856, 1, 3328, 704, 704, 704, 1856]
    - [63, 16495.0]
  - - [448, 1024, 1, 1280, 448, 448, 448, 1024]
    - [61, 12290.0]
  - - [256, 1408, 1, 3328, 256, 256, 256, 1408]
    - [65, 10850.0]
  - - [704, 1856, 1, 1280, 704, 704, 704, 1856]
    - [63, 16272.0]
  - - [128, 5056, 1, 128, 128, 128, 128, 5056]
    - [87, 9655.0]
  - - [2368, 128, 1, 256, 2368, 2368, 2368, 128]
    - [60, 7682.0]
  - - [64, 5056, 1, 256, 64, 64, 64, 5056]
    - [108, 8169.0]
  - - [256, 2944, 1, 256, 256, 256, 256, 2944]
    - [63, 13036.0]
  - - [256, 1856, 1, 1280, 256, 256, 256, 1856]
    - [110, 12956.0]
  - - [128, 3584, 1, 1280, 128, 128, 128, 3584]
    - [63, 12494.0]
  - - [4288, 256, 1, 256, 4288, 4288, 4288, 256]
    - [86, 14884.0]
  - - [2944, 128, 1, 128, 2944, 2944, 2944, 128]
    - [62, 7780.0]
  - - [5888, 64, 1, 3328, 5888, 5888, 5888, 64]
    - [104, 11211.0]
  - - [2944, 256, 1, 3328, 2944, 2944, 2944, 256]
    - [110, 15225.0]
  - - [704, 1024, 1, 128, 704, 704, 704, 1024]
    - [68, 10730.0]
  - - [1408, 448, 1, 1280, 1408, 1408, 1408, 448]
    - [87, 12530.0]
  - - [1408, 704, 1, 3328, 1408, 1408, 1408, 704]
    - [118, 15926.0]
  - - [6784, 64, 1, 256, 6784, 6784, 6784, 64]
    - [87, 9565.0]
  - - [2944, 256, 1, 256, 2944, 2944, 2944, 256]
    - [87, 12949.0]
  - - [704, 1408, 1, 3328, 704, 704, 704, 1408]
    - [71, 15899.0]
  - - [2944, 256, 1, 128, 2944, 2944, 2944, 256]
    - [63, 11012.0]
  - - [448, 2944, 1, 128, 448, 448, 448, 2944]
    - [86, 13998.0]
  - - [2368, 128, 1, 3328, 2368, 2368, 2368, 128]
    - [89, 9179.0]
  - - [2944, 128, 1, 256, 2944, 2944, 2944, 128]
    - [62, 9384.0]
  - - [448, 1408, 1, 256, 448, 448, 448, 1408]
    - [109, 10970.0]
  - - [64, 5056, 1, 3328, 64, 64, 64, 5056]
    - [65, 9756.0]
  - - [1024, 448, 1, 128, 1024, 1024, 1024, 448]
    - [89, 8247.0]
  - - [256, 3584, 1, 3328, 256, 256, 256, 3584]
    - [96, 14934.0]
  - - [5056, 64, 1, 1280, 5056, 5056, 5056, 64]
    - [65, 9487.0]
  - - [1024, 704, 1, 256, 1024, 1024, 1024, 704]
    - [63, 12486.0]
  - - [128, 4288, 1, 128, 128, 128, 128, 4288]
    - [87, 9571.0]
  - - [3584, 256, 1, 128, 3584, 3584, 3584, 256]
    - [63, 11514.0]
  - - [4288, 128, 1, 1280, 4288, 4288, 4288, 128]
    - [109, 14485.0]
  - - [5888, 64, 1, 256, 5888, 5888, 5888, 64]
    - [62, 9050.0]
  - - [1856, 256, 1, 1280, 1856, 1856, 1856, 256]
    - [86, 12581.0]
  - - [64, 5888, 1, 3328, 64, 64, 64, 5888]
    - [72, 11286.0]
  - - [704, 1024, 1, 1280, 704, 704, 704, 1024]
    - [87, 14144.0]
  - - [448, 1856, 1, 128, 448, 448, 448, 1856]
    - [86, 11852.0]
  - - [1024, 704, 1, 1280, 1024, 1024, 1024, 704]
    - [63, 14231.0]
  - - [128, 5888, 1, 256, 128, 128, 128, 5888]
    - [63, 12880.0]
  - - [704, 704, 1, 3328, 704, 704, 704, 704]
    - [71, 13870.0]
  - - [704, 1408, 1, 1280, 704, 704, 704, 1408]
    - [64, 15537.0]
  - - [3584, 256, 1, 3328, 3584, 3584, 3584, 256]
    - [74, 14883.0]
  - - [704, 1856, 1, 128, 704, 704, 704, 1856]
    - [61, 13937.0]
  - - [128, 3584, 1, 3328, 128, 128, 128, 3584]
    - [71, 13051.0]
  - - [128, 2944, 1, 1280, 128, 128, 128, 2944]
    - [72, 10893.0]
  - - [3584, 128, 1, 256, 3584, 3584, 3584, 128]
    - [63, 10212.0]
  - - [448, 1408, 1, 3328, 448, 448, 448, 1408]
    - [63, 12740.0]
  - - [256, 3584, 1, 256, 256, 256, 256, 3584]
    - [88, 13034.0]
  - - [256, 2944, 1, 3328, 256, 256, 256, 2944]
    - [63, 15253.0]
  - - [448, 2368, 1, 128, 448, 448, 448, 2368]
    - [109, 12982.0]
  - - [1408, 704, 1, 256, 1408, 1408, 1408, 704]
    - [63, 13851.0]
  - - [448, 2944, 1, 3328, 448, 448, 448, 2944]
    - [61, 16337.0]
  - - [64, 5888, 1, 256, 64, 64, 64, 5888]
    - [62, 9205.0]
  - - [6784, 128, 1, 3328, 6784, 6784, 6784, 128]
    - [84, 14074.0]
  - - [704, 704, 1, 256, 704, 704, 704, 704]
    - [61, 10844.0]
  - - [448, 704, 1, 1280, 448, 448, 448, 704]
    - [85, 9328.0]
  - - [1024, 448, 1, 3328, 1024, 1024, 1024, 448]
    - [88, 12899.0]
  - - [1856, 704, 1, 1280, 1856, 1856, 1856, 704]
    - [87, 16187.0]
  - - [448, 1408, 1, 1280, 448, 448, 448, 1408]
    - [63, 12414.0]
  - - [1024, 1024, 1, 1280, 1024, 1024, 1024, 1024]
    - [96, 16558.0]
  - - [448, 1024, 1, 128, 448, 448, 448, 1024]
    - [62, 8270.0]
  - - [448, 2368, 1, 3328, 448, 448, 448, 2368]
    - [61, 16044.0]
  - - [5056, 64, 1, 128, 5056, 5056, 5056, 64]
    - [62, 6973.0]
  - - [704, 1024, 1, 256, 704, 704, 704, 1024]
    - [86, 12419.0]
  - - [128, 6784, 1, 1280, 128, 128, 128, 6784]
    - [88, 13773.0]
  - - [1856, 256, 1, 256, 1856, 1856, 1856, 256]
    - [61, 10450.0]
  - - [256, 4288, 1, 1280, 256, 256, 256, 4288]
    - [111, 16978.0]
  - - [256, 1856, 1, 128, 256, 256, 256, 1856]
    - [63, 8494.0]
  - - [448, 1408, 1, 128, 448, 448, 448, 1408]
    - [68, 9477.0]
  - - [6784, 128, 1, 256, 6784, 6784, 6784, 128]
    - [87, 12161.0]
  - - [704, 448, 1, 256, 704, 704, 704, 448]
    - [85, 8026.0]
  - - [704, 1408, 1, 128, 704, 704, 704, 1408]
    - [61, 12318.0]
  - - [2944, 448, 1, 128, 2944, 2944, 2944, 448]
    - [61, 14022.0]
  - - [128, 2944, 1, 128, 128, 128, 128, 2944]
    - [62, 7907.0]
  - - [1024, 704, 1, 3328, 1024, 1024, 1024, 704]
    - [69, 14583.0]
  - - [128, 4288, 1, 256, 128, 128, 128, 4288]
    - [87, 12030.0]
  - - [704, 448, 1, 3328, 704, 704, 704, 448]
    - [112, 9539.0]
  - - [1024, 1024, 1, 3328, 1024, 1024, 1024, 1024]
    - [96, 17021.0]
  - - [448, 2368, 1, 1280, 448, 448, 448, 2368]
    - [61, 15845.0]
  - - [64, 6784, 1, 3328, 64, 64, 64, 6784]
    - [109, 11861.0]
  - - [2944, 256, 1, 1280, 2944, 2944, 2944, 256]
    - [87, 14892.0]
  - - [256, 2368, 1, 128, 256, 256, 256, 2368]
    - [63, 9237.0]
  - - [1856, 704, 1, 256, 1856, 1856, 1856, 704]
    - [86, 15040.0]
  - - [1408, 448, 1, 3328, 1408, 1408, 1408, 448]
    - [110, 12805.0]
  - - [2368, 256, 1, 256, 2368, 2368, 2368, 256]
    - [61, 10528.0]
  - - [1856, 448, 1, 1280, 1856, 1856, 1856, 448]
    - [87, 16077.0]
  - - [128, 5888, 1, 128, 128, 128, 128, 5888]
    - [87, 10962.0]
  - - [1024, 1024, 1, 256, 1024, 1024, 1024, 1024]
    - [88, 14636.0]
  - - [704, 1856, 1, 256, 704, 704, 704, 1856]
    - [61, 15040.0]
  - - [128, 4288, 1, 3328, 128, 128, 128, 4288]
    - [63, 15422.0]
  - - [256, 2368, 1, 1280, 256, 256, 256, 2368]
    - [63, 12109.0]
  - - [2944, 448, 1, 256, 2944, 2944, 2944, 448]
    - [63, 15375.0]
  - - [1856, 448, 1, 128, 1856, 1856, 1856, 448]
    - [86, 11932.0]
  - - [2368, 128, 1, 1280, 2368, 2368, 2368, 128]
    - [60, 8948.0]
  - - [64, 6784, 1, 256, 64, 64, 64, 6784]
    - [61, 9403.0]
  - - [64, 5056, 1, 1280, 64, 64, 64, 5056]
    - [65, 9491.0]
  - - [2368, 256, 1, 1280, 2368, 2368, 2368, 256]
    - [63, 11854.0]
  - - [2368, 448, 1, 1280, 2368, 2368, 2368, 448]
    - [91, 16097.0]
  - - [128, 3584, 1, 256, 128, 128, 128, 3584]
    - [63, 10194.0]
  - - [704, 448, 1, 1280, 704, 704, 704, 448]
    - [60, 9328.0]
  - - [128, 5056, 1, 256, 128, 128, 128, 5056]
    - [87, 11270.0]
  - - [4288, 256, 1, 1280, 4288, 4288, 4288, 256]
    - [111, 16957.0]
  - - [4288, 128, 1, 3328, 4288, 4288, 4288, 128]
    - [88, 15399.0]
  - - [1408, 256, 1, 128, 1408, 1408, 1408, 256]
    - [62, 7715.0]
  - - [256, 1408, 1, 1280, 256, 256, 256, 1408]
    - [85, 10611.0]
  - - [128, 2368, 1, 256, 128, 128, 128, 2368]
    - [60, 7698.0]
  - - [6784, 64, 1, 3328, 6784, 6784, 6784, 64]
    - [87, 12235.0]
  - - [128, 2944, 1, 3328, 128, 128, 128, 2944]
    - [72, 11312.0]
  - - [2944, 448, 1, 3328, 2944, 2944, 2944, 448]
    - [87, 16725.0]
  - - [256, 4288, 1, 256, 256, 256, 256, 4288]
    - [63, 15157.0]
  - - [5888, 128, 1, 256, 5888, 5888, 5888, 128]
    - [63, 12897.0]
  - - [2368, 448, 1, 3328, 2368, 2368, 2368, 448]
    - [114, 16520.0]
  - - [5056, 64, 1, 256, 5056, 5056, 5056, 64]
    - [85, 8121.0]
  - - [1024, 704, 1, 128, 1024, 1024, 1024, 704]
    - [63, 10680.0]
  - - [128, 5056, 1, 3328, 128, 128, 128, 5056]
    - [87, 13130.0]
  - - [4288, 128, 1, 256, 4288, 4288, 4288, 128]
    - [61, 11989.0]
  - - [1408, 448, 1, 128, 1408, 1408, 1408, 448]
    - [62, 9477.0]
  - - [128, 5888, 1, 1280, 128, 128, 128, 5888]
    - [87, 14883.0]
  - - [704, 448, 1, 128, 704, 704, 704, 448]
    - [62, 6889.0]
  - - [3584, 256, 1, 256, 3584, 3584, 3584, 256]
    - [110, 12835.0]
  - - [128, 2944, 1, 256, 128, 128, 128, 2944]
    - [62, 9348.0]
  - - [128, 6784, 1, 128, 128, 128, 128, 6784]
    - [68, 11049.0]
  - - [448, 1856, 1, 256, 448, 448, 448, 1856]
    - [61, 14022.0]
  - - [3584, 128, 1, 3328, 3584, 3584, 3584, 128]
    - [111, 13047.0]
  - - [1024, 448, 1, 1280, 1024, 1024, 1024, 448]
    - [63, 12446.0]
  - - [5888, 128, 1, 3328, 5888, 5888, 5888, 128]
    - [91, 15220.0]
  - - [1408, 704, 1, 1280, 1408, 1408, 1408, 704]
    - [111, 15492.0]
  - - [448, 2944, 1, 256, 448, 448, 448, 2944]
    - [61, 15209.0]
  - - [448, 2368, 1, 256, 448, 448, 448, 2368]
    - [61, 14508.0]
  - - [128, 2368, 1, 3328, 128, 128, 128, 2368]
    - [89, 9200.0]
  - - [5056, 128, 1, 1280, 5056, 5056, 5056, 128]
    - [77, 12670.0]
  - - [5056, 64, 1, 3328, 5056, 5056, 5056, 64]
    - [112, 9769.0]
  - - [64, 5888, 1, 128, 64, 64, 64, 5888]
    - [62, 7959.0]
  - - [5056, 128, 1, 3328, 5056, 5056, 5056, 128]
    - [63, 12986.0]
  - - [448, 704, 1, 256, 448, 448, 448, 704]
    - [108, 8042.0]
  - - [2944, 128, 1, 3328, 2944, 2944, 2944, 128]
    - [72, 11308.0]
  - - [128, 5056, 1, 1280, 128, 128, 128, 5056]
    - [87, 12871.0]
  - - [704, 704, 1, 128, 704, 704, 704, 704]
    - [62, 8885.0]
  - - [64, 6784, 1, 1280, 64, 64, 64, 6784]
    - [86, 11525.0]
  - - [2368, 128, 1, 128, 2368, 2368, 2368, 128]
    - [62, 6643.0]
  - - [5056, 128, 1, 128, 5056, 5056, 5056, 128]
    - [90, 9677.0]
  - - [1024, 1024, 1, 1024, 1024, 1024, 1024, 1024]
    - [93, 16368.0]
  - - [448, 1024, 1, 3328, 448, 448, 448, 1024]
    - [88, 12925.0]
  - - [256, 2368, 1, 3328, 256, 256, 256, 2368]
    - [91, 12332.0]
  - - [256, 3584, 1, 128, 256, 256, 256, 3584]
    - [63, 11582.0]
  - - [4288, 256, 1, 128, 4288, 4288, 4288, 256]
    - [61, 13331.0]
  - - [2368, 256, 1, 128, 2368, 2368, 2368, 256]
    - [62, 9129.0]
  - - [256, 1856, 1, 256, 256, 256, 256, 1856]
    - [63, 10707.0]
  - - [256, 2944, 1, 128, 256, 256, 256, 2944]
    - [63, 11165.0]
  - - [1408, 256, 1, 3328, 1408, 1408, 1408, 256]
    - [65, 10856.0]
  - - [2368, 448, 1, 256, 2368, 2368, 2368, 448]
    - [61, 14508.0]
  - - [4288, 256, 1, 3328, 4288, 4288, 4288, 256]
    - [93, 17554.0]
  - - [1856, 704, 1, 128, 1856, 1856, 1856, 704]
    - [86, 13799.0]
  - - [4288, 128, 1, 128, 4288, 4288, 4288, 128]
    - [61, 9650.0]
  - - [1408, 448, 1, 256, 1408, 1408, 1408, 448]
    - [63, 10985.0]
  - - [6784, 64, 1, 1280, 6784, 6784, 6784, 64]
    - [63, 11804.0]
  - - [3584, 128, 1, 128, 3584, 3584, 3584, 128]
    - [62, 8247.0]
  - - [256, 2368, 1, 256, 256, 256, 256, 2368]
    - [63, 10673.0]
  - - [2944, 448, 1, 1280, 2944, 2944, 2944, 448]
    - [110, 16519.0]
  - - [448, 1856, 1, 1280, 448, 448, 448, 1856]
    - [86, 16116.0]
  - - [1856, 256, 1, 128, 1856, 1856, 1856, 256]
    - [62, 8494.0]
  - - [5056, 128, 1, 256, 5056, 5056, 5056, 128]
    - [61, 10986.0]
  - - [448, 1024, 1, 256, 448, 448, 448, 1024]
    - [61, 10106.0]
  - - [64, 6784, 1, 128, 64, 64, 64, 6784]
    - [73, 8008.0]
  - - [5888, 64, 1, 1280, 5888, 5888, 5888, 64]
    - [117, 10854.0]
  - - [128, 3584, 1, 128, 128, 128, 128, 3584]
    - [62, 8247.0]
  - - [1408, 256, 1, 256, 1408, 1408, 1408, 256]
    - [60, 9047.0]
  - - [128, 5888, 1, 3328, 128, 128, 128, 5888]
    - [110, 15223.0]
  - - [1408, 256, 1, 1280, 1408, 1408, 1408, 256]
    - [89, 10563.0]
  - - [64, 5056, 1, 128, 64, 64, 64, 5056]
    - [62, 6949.0]
  - - [5888, 64, 1, 128, 5888, 5888, 5888, 64]
    - [108, 7656.0]
  - - [448, 704, 1, 128, 448, 448, 448, 704]
    - [62, 6819.0]
  - - [1408, 704, 1, 128, 1408, 1408, 1408, 704]
    - [63, 12342.0]
  - - [2368, 256, 1, 3328, 2368, 2368, 2368, 256]
    - [110, 12221.0]
  - - [5888, 128, 1, 1280, 5888, 5888, 5888, 128]
    - [69, 14800.0]
  - - [256, 3584, 1, 1280, 256, 256, 256, 3584]
    - [88, 14556.0]
  - - [256, 1408, 1, 128, 256, 256, 256, 1408]
    - [108, 7588.0]
  - - [256, 4288, 1, 128, 256, 256, 256, 4288]
    - [63, 13537.0]
  - - [5888, 128, 1, 128, 5888, 5888, 5888, 128]
    - [63, 11038.0]
  - - [1856, 256, 1, 3328, 1856, 1856, 1856, 256]
    - [88, 13385.0]
  - - [64, 5888, 1, 1280, 64, 64, 64, 5888]
    - [72, 10854.0]
  - - [6784, 64, 1, 128, 6784, 6784, 6784, 64]
    - [62, 7894.0]
  - - [704, 704, 1, 1280, 704, 704, 704, 704]
    - [61, 13227.0]
  - - [128, 2368, 1, 1280, 128, 128, 128, 2368]
    - [108, 8960.0]
  - - [3584, 256, 1, 1280, 3584, 3584, 3584, 256]
    - [93, 14495.0]
  - - [3584, 128, 1, 1280, 3584, 3584, 3584, 128]
    - [64, 12388.0]
  - - [448, 1856, 1, 3328, 448, 448, 448, 1856]
    - [86, 16310.0]
  - - [1024, 448, 1, 256, 1024, 1024, 1024, 448]
    - [61, 10177.0]
  - - [2944, 128, 1, 1280, 2944, 2944, 2944, 128]
    - [72, 10898.0]
  - - [128, 2368, 1, 128, 128, 128, 128, 2368]
    - [62, 6598.0]
  - - [256, 2944, 1, 1280, 256, 256, 256, 2944]
    - [110, 14919.0]
  - - [704, 1024, 1, 3328, 704, 704, 704, 1024]
    - [63, 14533.0]
  - - [128, 6784, 1, 256, 128, 128, 128, 6784]
    - [63, 12309.0]
  - - [256, 1856, 1, 3328, 256, 256, 256, 1856]
    - [110, 13407.0]
  - - [6784, 128, 1, 128, 6784, 6784, 6784, 128]
    - [68, 10983.0]
  - - [704, 1408, 1, 256, 704, 704, 704, 1408]
    - [109, 13657.0]
  - - [256, 1408, 1, 256, 256, 256, 256, 1408]
    - [108, 9028.0]
  - - [448, 2944, 1, 1280, 448, 448, 448, 2944]
    - [61, 16180.0]
  - - [6784, 128, 1, 1280, 6784, 6784, 6784, 128]
    - [88, 13777.0]
  - - [1856, 448, 1, 256, 1856, 1856, 1856, 448]
    - [61, 14041.0]
  - - [128, 4288, 1, 1280, 128, 128, 128, 4288]
    - [87, 14859.0]
  - - [448, 704, 1, 3328, 448, 448, 448, 704]
    - [65, 9535.0]
  - - [1856, 704, 1, 3328, 1856, 1856, 1856, 704]
    - [110, 16480.0]
  - - [3136, 64, 128, 64, 3136, 3136, 3136, 64]
    - [59, 9674.0]
  - - [3136, 64, 128, 256, 3136, 3136, 3136, 64]
    - [90, 10273.0]
  - - [3136, 64, 256, 256, 3136, 3136, 3136, 64]
    - [90, 10268.0]
  - - [3136, 64, 256, 64, 3136, 3136, 3136, 64]
    - [59, 6134.0]
  - - [64, 1536, 64, 384, 64, 64, 64, 1536]
    - [98, 12118.0]
  - - [64, 1536, 64, 256, 64, 64, 64, 1536]
    - [109, 18228.0]
  - - [64, 92, 688, 92, 64, 64, 64, 92]
    - [61, 10734.0]
  - - [1024, 1024, 1, 3975, 1024, 1024, 1024, 1024]
    - [93, 16909.0]
  - - [64, 123, 528, 123, 64, 64, 64, 123]
    - [61, 14091.0]
  - - [64, 102, 624, 100, 64, 64, 64, 102]
    - [61, 11974.0]
  - - [64, 112, 576, 111, 64, 64, 64, 112]
    - [86, 12859.0]
  - - [64, 102, 624, 102, 64, 64, 64, 102]
    - [109, 11892.0]
  - - [64, 133, 480, 135, 64, 64, 64, 133]
    - [61, 11944.0]
  - - [1024, 1024, 1, 4026, 1024, 1024, 1024, 1024]
    - [96, 16995.0]
  - - [64, 160, 400, 159, 64, 64, 64, 160]
    - [61, 14421.0]
  - - [1024, 1024, 1, 3780, 1024, 1024, 1024, 1024]
    - [96, 16963.0]
  - - [64, 228, 272, 232, 64, 64, 64, 228]
    - [61, 15644.0]
  - - [1024, 1024, 1, 3822, 1024, 1024, 1024, 1024]
    - [96, 16971.0]
  - - [64, 77, 816, 77, 64, 64, 64, 77]
    - [61, 9713.0]
  - - [64, 159, 400, 159, 64, 64, 64, 159]
    - [61, 14057.0]
  - - [64, 135, 480, 134, 64, 64, 64, 135]
    - [61, 11839.0]
  - - [64, 99, 624, 99, 64, 64, 64, 99]
    - [109, 11684.0]
  - - [1024, 1024, 1, 3942, 1024, 1024, 1024, 1024]
    - [96, 16992.0]
  - - [1024, 1024, 1, 3861, 1024, 1024, 1024, 1024]
    - [96, 16992.0]
  - - [1024, 1024, 1, 4000, 1024, 1024, 1024, 1024]
    - [96, 17078.0]
  - - [1024, 1024, 1, 3870, 1024, 1024, 1024, 1024]
    - [96, 16983.0]
  - - [64, 65, 992, 65, 64, 64, 64, 65]
    - [61, 8163.0]
  - - [64, 133, 480, 133, 64, 64, 64, 133]
    - [109, 11860.0]
  - - [64, 232, 272, 232, 64, 64, 64, 232]
    - [61, 15849.0]
  - - [64, 148, 432, 148, 64, 64, 64, 148]
    - [109, 12985.0]
  - - [1024, 1024, 1, 4032, 1024, 1024, 1024, 1024]
    - [74, 17048.0]
  - - [1024, 1024, 1, 4012, 1024, 1024, 1024, 1024]
    - [96, 17002.0]
  - - [1024, 1024, 1, 3681, 1024, 1024, 1024, 1024]
    - [96, 16957.0]
  - - [1024, 1024, 1, 3927, 1024, 1024, 1024, 1024]
    - [96, 16978.0]
  - - [1024, 1024, 1, 3894, 1024, 1024, 1024, 1024]
    - [96, 16989.0]
  - - [64, 132, 480, 135, 64, 64, 64, 132]
    - [61, 11539.0]
  - - [64, 135, 480, 135, 64, 64, 64, 135]
    - [109, 12082.0]
  - - [1024, 1024, 1, 3876, 1024, 1024, 1024, 1024]
    - [96, 16981.0]
  - - [64, 84, 752, 85, 64, 64, 64, 84]
    - [61, 10438.0]
  - - [1024, 1024, 1, 4050, 1024, 1024, 1024, 1024]
    - [96, 16995.0]
  - - [64, 132, 480, 132, 64, 64, 64, 132]
    - [109, 11826.0]
  - - [64, 99, 624, 102, 64, 64, 64, 99]
    - [109, 11854.0]
  - - [64, 143, 432, 148, 64, 64, 64, 143]
    - [86, 12600.0]
  - - [1024, 1024, 1, 3584, 1024, 1024, 1024, 1024]
    - [96, 17040.0]
  - - [64, 162, 400, 162, 64, 64, 64, 162]
    - [61, 14295.0]
  - - [64, 148, 432, 147, 64, 64, 64, 148]
    - [86, 13082.0]
  - - [1024, 1024, 1, 3960, 1024, 1024, 1024, 1024]
    - [118, 16982.0]
  - - [64, 123, 528, 122, 64, 64, 64, 123]
    - [86, 14086.0]
  - - [64, 102, 624, 101, 64, 64, 64, 102]
    - [86, 11918.0]
  - - [1024, 1024, 1, 3978, 1024, 1024, 1024, 1024]
    - [96, 16994.0]
  - - [64, 160, 400, 160, 64, 64, 64, 160]
    - [61, 14315.0]
  - - [1024, 1024, 1, 3995, 1024, 1024, 1024, 1024]
    - [96, 16971.0]
  - - [64, 132, 480, 134, 64, 64, 64, 132]
    - [61, 11843.0]
  - - [64, 111, 576, 111, 64, 64, 64, 111]
    - [61, 12962.0]
  - - [64, 100, 624, 100, 64, 64, 64, 100]
    - [109, 11767.0]
  - - [1024, 1024, 1, 3977, 1024, 1024, 1024, 1024]
    - [96, 16996.0]
  - - [64, 112, 576, 112, 64, 64, 64, 112]
    - [86, 13167.0]
  - - [64, 159, 400, 162, 64, 64, 64, 159]
    - [61, 14054.0]
  - - [64, 122, 528, 122, 64, 64, 64, 122]
    - [109, 13787.0]
  - - [64, 228, 272, 228, 64, 64, 64, 228]
    - [109, 15608.0]
  - - [1024, 1024, 1, 3925, 1024, 1024, 1024, 1024]
    - [96, 16979.0]
  - - [64, 93, 688, 93, 64, 64, 64, 93]
    - [86, 11247.0]
  - - [1024, 1024, 1, 3956, 1024, 1024, 1024, 1024]
    - [96, 16987.0]
  - - [1024, 1024, 1, 3976, 1024, 1024, 1024, 1024]
    - [96, 16989.0]
  - - [64, 111, 576, 112, 64, 64, 64, 111]
    - [86, 13117.0]
  - - [64, 100, 624, 102, 64, 64, 64, 100]
    - [61, 11848.0]
  - - [1024, 1024, 1, 3955, 1024, 1024, 1024, 1024]
    - [96, 17010.0]
  - - [1024, 1024, 1, 4030, 1024, 1024, 1024, 1024]
    - [96, 17015.0]
  - - [1024, 1024, 1, 3906, 1024, 1024, 1024, 1024]
    - [96, 16995.0]
  - - [64, 101, 624, 102, 64, 64, 64, 101]
    - [61, 11816.0]
  - - [1024, 1024, 1, 3796, 1024, 1024, 1024, 1024]
    - [96, 16986.0]
  - - [1024, 1024, 1, 3859, 1024, 1024, 1024, 1024]
    - [96, 16982.0]
  - - [64, 71, 896, 71, 64, 64, 64, 71]
    - [109, 8829.0]
  - - [1024, 1024, 1, 3860, 1024, 1024, 1024, 1024]
    - [96, 16966.0]
  - - [1024, 1024, 1, 4005, 1024, 1024, 1024, 1024]
    - [96, 17004.0]
  - - [64, 84, 752, 84, 64, 64, 64, 84]
    - [86, 10423.0]
  - - [1024, 1024, 1, 3990, 1024, 1024, 1024, 1024]
    - [96, 16998.0]
  - - [64, 134, 480, 134, 64, 64, 64, 134]
    - [61, 11802.0]
  - - [64, 78, 816, 78, 64, 64, 64, 78]
    - [61, 9935.0]
  - - [1024, 1024, 1, 3999, 1024, 1024, 1024, 1024]
    - [96, 16993.0]
  - - [1024, 1024, 1, 4020, 1024, 1024, 1024, 1024]
    - [96, 16990.0]
  - - [1024, 1024, 1, 3939, 1024, 1024, 1024, 1024]
    - [96, 17001.0]
  - - [64, 77, 816, 78, 64, 64, 64, 77]
    - [109, 9705.0]
  - - [1024, 1024, 1, 4059, 1024, 1024, 1024, 1024]
    - [96, 17017.0]
  - - [1024, 1024, 1, 3944, 1024, 1024, 1024, 1024]
    - [96, 16995.0]
  - - [64, 193, 320, 193, 64, 64, 64, 193]
    - [61, 13166.0]
  - - [1024, 1024, 1, 3720, 1024, 1024, 1024, 1024]
    - [96, 16986.0]
  - - [1024, 1024, 1, 3910, 1024, 1024, 1024, 1024]
    - [96, 16997.0]
  - - [64, 143, 432, 143, 64, 64, 64, 143]
    - [86, 12399.0]
  - - [64, 92, 688, 93, 64, 64, 64, 92]
    - [109, 11280.0]
  - - [64, 101, 624, 101, 64, 64, 64, 101]
    - [86, 11877.0]
  - - [1024, 1024, 1, 3969, 1024, 1024, 1024, 1024]
    - [96, 17006.0]
  - - [1024, 1024, 1, 3948, 1024, 1024, 1024, 1024]
    - [96, 16990.0]
  - - [1024, 1024, 1, 3996, 1024, 1024, 1024, 1024]
    - [96, 17009.0]
  - - [1024, 1024, 1, 3900, 1024, 1024, 1024, 1024]
    - [96, 16998.0]
  - - [1024, 1024, 1, 3640, 1024, 1024, 1024, 1024]
    - [96, 16964.0]
  - - [64, 147, 432, 147, 64, 64, 64, 147]
    - [86, 12977.0]
  - - [1024, 1024, 1, 3751, 1024, 1024, 1024, 1024]
    - [96, 16978.0]
  - - [64, 177, 352, 177, 64, 64, 64, 177]
    - [86, 16004.0]
  - - [64, 85, 752, 85, 64, 64, 64, 85]
    - [61, 10474.0]
  - - [1024, 1024, 1, 3712, 1024, 1024, 1024, 1024]
    - [96, 17051.0]
  - - [1024, 1024, 1, 128, 1024, 1024, 1024, 1024]
    - [61, 12807.0]
  - - [64, 256, 192, 256, 64, 64, 64, 256]
    - [86, 16890.0]
  - - [64, 128, 384, 128, 64, 64, 64, 128]
    - [61, 15865.0]
  - - [64, 192, 36, 25088, 64, 64, 64, 192]
    - [73, 10415.0]
  - - [128, 128, 64, 25, 128, 128, 128, 128]
    - [75, 5160.0]
  - - [64, 192, 64, 3200, 64, 64, 64, 192]
    - [79, 11264.0]
  - - [64, 128, 64, 23104, 64, 64, 64, 128]
    - [76, 9224.0]
  - - [128, 128, 64, 1600, 128, 128, 128, 128]
    - [111, 16400.0]
  - - [80, 192, 64, 4608, 80, 80, 80, 192]
    - [123, 10407.0]
  - - [64, 128, 36, 30, 64, 64, 64, 128]
    - [95, 2528.0]
  - - [64, 128, 64, 11552, 64, 64, 64, 128]
    - [102, 9564.0]
  - - [128, 192, 64, 946, 128, 128, 128, 192]
    - [63, 16351.0]
  - - [64, 192, 64, 12800, 64, 64, 64, 192]
    - [113, 9738.0]
  - - [224, 224, 64, 128, 224, 224, 224, 224]
    - [86, 12255.0]
  - - [128, 128, 64, 3360, 128, 128, 128, 128]
    - [103, 15029.0]
  - - [128, 128, 64, 420, 128, 128, 128, 128]
    - [88, 14690.0]
  - - [64, 128, 64, 361, 64, 64, 64, 128]
    - [61, 11859.0]
  - - [64, 128, 36, 53824, 64, 64, 64, 128]
    - [124, 9545.0]
  - - [128, 160, 36, 512, 128, 128, 128, 160]
    - [64, 10439.0]
  - - [147, 64, 36, 18816, 147, 147, 147, 64]
    - [69, 9291.0]
  - - [96, 128, 64, 946, 96, 96, 96, 128]
    - [111, 11610.0]
  - - [128, 128, 64, 50, 128, 128, 128, 128]
    - [62, 8244.0]
  - - [160, 224, 36, 128, 160, 160, 160, 224]
    - [109, 11039.0]
  - - [192, 224, 64, 1152, 192, 192, 192, 224]
    - [109, 15408.0]
  - - [128, 128, 36, 784, 128, 128, 128, 128]
    - [87, 15272.0]
  - - [96, 128, 64, 288, 96, 96, 96, 128]
    - [85, 10623.0]
  - - [128, 128, 64, 400, 128, 128, 128, 128]
    - [111, 15353.0]
  - - [128, 128, 64, 800, 128, 128, 128, 128]
    - [111, 16151.0]
  - - [96, 128, 36, 512, 96, 96, 96, 128]
    - [61, 10554.0]
  - - [96, 128, 64, 800, 96, 96, 96, 128]
    - [103, 11764.0]
  - - [192, 224, 64, 128, 192, 192, 192, 224]
    - [109, 13489.0]
  - - [128, 128, 64, 288, 128, 128, 128, 128]
    - [88, 14660.0]
  - - [96, 208, 36, 512, 96, 96, 96, 208]
    - [63, 10235.0]
  - - [64, 128, 36, 1568, 64, 64, 64, 128]
    - [62, 12331.0]
  - - [192, 192, 36, 512, 192, 192, 192, 192]
    - [109, 15736.0]
  - - [128, 128, 36, 512, 128, 128, 128, 128]
    - [110, 14519.0]
  - - [96, 208, 64, 1152, 96, 96, 96, 208]
    - [116, 10614.0]
  - - [128, 192, 64, 3200, 128, 128, 128, 192]
    - [77, 15101.0]
  - - [160, 160, 64, 288, 160, 160, 160, 160]
    - [86, 11898.0]
  - - [128, 128, 36, 440, 128, 128, 128, 128]
    - [110, 14197.0]
  - - [96, 128, 36, 1568, 96, 96, 96, 128]
    - [110, 11829.0]
  - - [112, 224, 36, 2048, 112, 112, 112, 224]
    - [116, 14051.0]
  - - [128, 128, 36, 7040, 128, 128, 128, 128]
    - [125, 13779.0]
  - - [128, 128, 36, 1568, 128, 128, 128, 128]
    - [63, 15649.0]
  - - [160, 224, 64, 128, 160, 160, 160, 224]
    - [86, 10700.0]
  - - [192, 224, 36, 2592, 192, 192, 192, 224]
    - [61, 15615.0]
  - - [64, 128, 64, 2888, 64, 64, 64, 128]
    - [66, 13656.0]
  - - [64, 128, 36, 480, 64, 64, 64, 128]
    - [62, 10991.0]
  - - [147, 64, 64, 9702, 147, 147, 147, 64]
    - [109, 8768.0]
  - - [64, 192, 64, 3698, 64, 64, 64, 192]
    - [101, 10746.0]
  - - [73, 192, 64, 10439, 73, 73, 73, 192]
    - [81, 9604.0]
  - - [128, 128, 36, 880, 128, 128, 128, 128]
    - [87, 14796.0]
  - - [192, 224, 36, 128, 192, 192, 192, 224]
    - [86, 13427.0]
  - - [64, 128, 36, 12544, 64, 64, 64, 128]
    - [124, 9482.0]
  - - [160, 160, 36, 512, 160, 160, 160, 160]
    - [86, 10518.0]
  - - [128, 128, 36, 3136, 128, 128, 128, 128]
    - [71, 16548.0]
  - - [112, 224, 36, 512, 112, 112, 112, 224]
    - [61, 12655.0]
  - - [128, 128, 36, 49, 128, 128, 128, 128]
    - [67, 6229.0]
  - - [112, 224, 64, 1152, 112, 112, 112, 224]
    - [93, 13282.0]
  - - [128, 192, 36, 1568, 128, 128, 128, 192]
    - [63, 13779.0]
  - - [128, 192, 36, 512, 128, 128, 128, 192]
    - [87, 13115.0]
  - - [192, 192, 64, 288, 192, 192, 192, 192]
    - [61, 17797.0]
  - - [96, 208, 64, 242, 96, 96, 96, 208]
    - [71, 9640.0]
  - - [64, 128, 64, 5776, 64, 64, 64, 128]
    - [83, 9402.0]
  - - [128, 192, 64, 288, 128, 128, 128, 192]
    - [110, 15150.0]
  - - [96, 128, 36, 6272, 96, 96, 96, 128]
    - [103, 12147.0]
  - - [96, 128, 64, 3200, 96, 96, 96, 128]
    - [125, 12343.0]
  - - [128, 192, 64, 800, 128, 128, 128, 192]
    - [110, 16312.0]
  - - [64, 128, 64, 10, 64, 64, 64, 128]
    - [82, 1736.0]
  - - [96, 208, 64, 288, 96, 96, 96, 208]
    - [93, 9883.0]
  - - [64, 128, 64, 160, 64, 64, 64, 128]
    - [61, 9642.0]
  - - [128, 128, 64, 1568, 128, 128, 128, 128]
    - [88, 16578.0]
  - - [112, 224, 64, 242, 112, 112, 112, 224]
    - [61, 11971.0]
  - - [160, 192, 64, 288, 160, 160, 160, 192]
    - [61, 14662.0]
  - - [128, 160, 64, 288, 128, 128, 128, 160]
    - [110, 12981.0]
  - - [128, 128, 64, 210, 128, 128, 128, 128]
    - [64, 13884.0]
  - - [73, 192, 36, 23360, 73, 73, 73, 192]
    - [108, 8693.0]
  - - [160, 192, 36, 512, 160, 160, 160, 192]
    - [109, 12633.0]
  - - [64, 128, 64, 722, 64, 64, 64, 128]
    - [61, 13116.0]
  - - [112, 224, 64, 288, 112, 112, 112, 224]
    - [61, 12220.0]
  - - [64, 192, 36, 6272, 64, 64, 64, 192]
    - [73, 10298.0]
  - - [64, 128, 36, 6272, 64, 64, 64, 128]
    - [80, 11172.0]
  - - [128, 128, 36, 3200, 128, 128, 128, 128]
    - [88, 16193.0]
  - - [128, 128, 36, 392, 128, 128, 128, 128]
    - [87, 13945.0]
  - - [80, 192, 36, 10368, 80, 80, 80, 192]
    - [97, 9554.0]
  - - [224, 224, 36, 128, 224, 224, 224, 224]
    - [61, 11537.0]
  - - [64, 128, 36, 784, 64, 64, 64, 128]
    - [62, 11749.0]
  - - [128, 128, 64, 200, 128, 128, 128, 128]
    - [63, 13907.0]
  - - [5329, 64, 32, 80, 5329, 5329, 5329, 64]
    - [63, 17899.0]
  - - [64, 2048, 32, 384, 64, 64, 64, 2048]
    - [109, 17746.0]
  - - [289, 1792, 1, 320, 289, 289, 289, 1792]
    - [61, 10720.0]
  - - [1001, 1024, 1, 32, 1001, 1001, 1001, 1024]
    - [60, 6694.0]
  - - [784, 400, 1, 32, 784, 784, 784, 400]
    - [107, 3323.0]
  - - [64, 1536, 32, 256, 64, 64, 64, 1536]
    - [98, 16862.0]
  - - [289, 2592, 1, 384, 289, 289, 289, 2592]
    - [86, 12650.0]
  - - [64, 2048, 32, 448, 64, 64, 64, 2048]
    - [86, 17814.0]
  - - [289, 2016, 1, 256, 289, 289, 289, 2016]
    - [62, 8815.0]
  - - [64, 1536, 32, 384, 64, 64, 64, 1536]
    - [61, 17188.0]
  - - [64, 1280, 32, 320, 64, 64, 64, 1280]
    - [86, 16397.0]
  - - [289, 3456, 1, 384, 289, 289, 289, 3456]
    - [109, 13639.0]
  - - [64, 1280, 32, 384, 64, 64, 64, 1280]
    - [119, 16289.0]
  - - [729, 1600, 1, 192, 729, 729, 729, 1600]
    - [63, 12856.0]
  - - [289, 1344, 1, 192, 289, 289, 289, 1344]
    - [62, 8417.0]
  - - [64, 2048, 32, 320, 64, 64, 64, 2048]
    - [98, 17796.0]
  - - [64, 1280, 32, 448, 64, 64, 64, 1280]
    - [61, 15892.0]
  - - [64, 1280, 32, 192, 64, 64, 64, 1280]
    - [119, 15612.0]
  - - [289, 1792, 1, 256, 289, 289, 289, 1792]
    - [61, 10293.0]
  - - [64, 2048, 32, 192, 64, 64, 64, 2048]
    - [61, 17575.0]
  - - [5329, 64, 128, 80, 5329, 5329, 5329, 64]
    - [59, 6942.0]
  - - [64, 1280, 128, 448, 64, 64, 64, 1280]
    - [124, 10988.0]
  - - [64, 2048, 128, 192, 64, 64, 64, 2048]
    - [98, 9388.0]
  - - [64, 1280, 128, 384, 64, 64, 64, 1280]
    - [115, 10767.0]
  - - [64, 1280, 128, 320, 64, 64, 64, 1280]
    - [90, 10340.0]
  - - [64, 1280, 128, 192, 64, 64, 64, 1280]
    - [98, 11135.0]
  - - [256, 4096, 1, 6400, 256, 256, 256, 4096]
    - [127, 16977.0]
  - - [512, 2048, 1, 3427, 512, 512, 512, 2048]
    - [96, 16880.0]
  - - [512, 2048, 1, 3552, 512, 512, 512, 2048]
    - [96, 17007.0]
  - - [512, 2048, 1, 3840, 512, 512, 512, 2048]
    - [96, 17064.0]
  - - [2048, 512, 1, 3427, 2048, 2048, 2048, 512]
    - [118, 16888.0]
  - - [2048, 512, 1, 3452, 2048, 2048, 2048, 512]
    - [118, 16970.0]
  - - [2048, 512, 1, 3472, 2048, 2048, 2048, 512]
    - [118, 16954.0]
  - - [2048, 512, 1, 3475, 2048, 2048, 2048, 512]
    - [118, 16948.0]
  - - [64, 64, 496, 64, 64, 64, 64, 64]
    - [61, 10126.0]
  - - [64, 64, 496, 65, 64, 64, 64, 64]
    - [109, 10986.0]
  - - [64, 65, 496, 65, 64, 64, 64, 65]
    - [109, 7418.0]
  - - [64, 71, 448, 71, 64, 64, 64, 71]
    - [61, 7567.0]
  - - [64, 77, 408, 77, 64, 64, 64, 77]
    - [86, 7843.0]
  - - [64, 77, 408, 78, 64, 64, 64, 77]
    - [61, 7993.0]
  - - [64, 78, 408, 78, 64, 64, 64, 78]
    - [86, 8032.0]
  - - [64, 85, 376, 85, 64, 64, 64, 85]
    - [86, 8383.0]
  - - [64, 93, 344, 93, 64, 64, 64, 93]
    - [109, 9298.0]
  - - [64, 112, 288, 112, 64, 64, 64, 112]
    - [61, 11549.0]
  - - [64, 122, 264, 122, 64, 64, 64, 122]
    - [61, 11896.0]
  - - [64, 123, 264, 122, 64, 64, 64, 123]
    - [61, 11903.0]
  - - [64, 123, 264, 123, 64, 64, 64, 123]
    - [61, 11780.0]
  - - [64, 134, 240, 134, 64, 64, 64, 134]
    - [61, 10140.0]
  - - [64, 135, 240, 134, 64, 64, 64, 135]
    - [61, 10261.0]
  - - [64, 135, 240, 135, 64, 64, 64, 135]
    - [109, 10337.0]
  - - [64, 1280, 64, 192, 64, 64, 64, 1280]
    - [61, 18210.0]
  - - [64, 1280, 64, 320, 64, 64, 64, 1280]
    - [61, 18320.0]
  - - [64, 1280, 64, 384, 64, 64, 64, 1280]
    - [61, 18111.0]
  - - [64, 1280, 64, 448, 64, 64, 64, 1280]
    - [119, 13459.0]
  - - [64, 2048, 64, 192, 64, 64, 64, 2048]
    - [86, 18474.0]
  - - [64, 2048, 64, 320, 64, 64, 64, 2048]
    - [119, 10848.0]
  - - [64, 2048, 64, 384, 64, 64, 64, 2048]
    - [115, 10971.0]
  - - [64, 2048, 64, 448, 64, 64, 64, 2048]
    - [90, 11227.0]
  - - [3136, 64, 64, 64, 3136, 3136, 3136, 64]
    - [61, 17084.0]
  - - [3136, 64, 64, 256, 3136, 3136, 3136, 64]
    - [90, 10226.0]
  - - [5329, 64, 64, 80, 5329, 5329, 5329, 64]
    - [59, 7991.0]
  - - [257, 4096, 1, 1024, 257, 257, 257, 4096]
    - [61, 12607.0]
  - - [512, 2048, 1, 2790, 512, 512, 512, 2048]
    - [118, 16856.0]
  - - [512, 2048, 1, 2864, 512, 512, 512, 2048]
    - [118, 16887.0]
  - - [512, 2048, 1, 3092, 512, 512, 512, 2048]
    - [118, 16906.0]
  - - [512, 2048, 1, 3113, 512, 512, 512, 2048]
    - [118, 16911.0]
  - - [512, 2048, 1, 3137, 512, 512, 512, 2048]
    - [96, 16896.0]
  - - [512, 2048, 1, 3165, 512, 512, 512, 2048]
    - [118, 16932.0]
  - - [512, 2048, 1, 3166, 512, 512, 512, 2048]
    - [118, 16939.0]
  - - [512, 2048, 1, 3194, 512, 512, 512, 2048]
    - [118, 16923.0]
  - - [512, 2048, 1, 3219, 512, 512, 512, 2048]
    - [118, 16934.0]
  - - [512, 2048, 1, 3222, 512, 512, 512, 2048]
    - [118, 16943.0]
  - - [512, 2048, 1, 3234, 512, 512, 512, 2048]
    - [118, 16949.0]
  - - [512, 2048, 1, 3237, 512, 512, 512, 2048]
    - [118, 16932.0]
  - - [512, 2048, 1, 3242, 512, 512, 512, 2048]
    - [118, 16941.0]
  - - [512, 2048, 1, 3246, 512, 512, 512, 2048]
    - [118, 16942.0]
  - - [512, 2048, 1, 3249, 512, 512, 512, 2048]
    - [118, 16946.0]
  - - [512, 2048, 1, 3251, 512, 512, 512, 2048]
    - [118, 16950.0]
  - - [512, 2048, 1, 3257, 512, 512, 512, 2048]
    - [118, 16930.0]
  - - [512, 2048, 1, 3262, 512, 512, 512, 2048]
    - [118, 16933.0]
  - - [512, 2048, 1, 3268, 512, 512, 512, 2048]
    - [118, 16932.0]
  - - [512, 2048, 1, 3282, 512, 512, 512, 2048]
    - [96, 16936.0]
  - - [512, 2048, 1, 3286, 512, 512, 512, 2048]
    - [118, 16943.0]
  - - [512, 2048, 1, 3287, 512, 512, 512, 2048]
    - [118, 16934.0]
  - - [512, 2048, 1, 3293, 512, 512, 512, 2048]
    - [96, 16933.0]
  - - [512, 2048, 1, 3297, 512, 512, 512, 2048]
    - [118, 16947.0]
  - - [512, 2048, 1, 3307, 512, 512, 512, 2048]
    - [118, 16924.0]
  - - [512, 2048, 1, 3314, 512, 512, 512, 2048]
    - [96, 16956.0]
  - - [512, 2048, 1, 3315, 512, 512, 512, 2048]
    - [96, 16940.0]
  - - [512, 2048, 1, 3319, 512, 512, 512, 2048]
    - [96, 16950.0]
  - - [512, 2048, 1, 3322, 512, 512, 512, 2048]
    - [118, 16957.0]
  - - [512, 2048, 1, 3323, 512, 512, 512, 2048]
    - [96, 16938.0]
  - - [512, 2048, 1, 3324, 512, 512, 512, 2048]
    - [118, 16949.0]
  - - [512, 2048, 1, 3325, 512, 512, 512, 2048]
    - [118, 16953.0]
  - - [512, 2048, 1, 3327, 512, 512, 512, 2048]
    - [118, 16942.0]
  - - [512, 2048, 1, 3329, 512, 512, 512, 2048]
    - [96, 16927.0]
  - - [512, 2048, 1, 3332, 512, 512, 512, 2048]
    - [118, 16942.0]
  - - [512, 2048, 1, 3336, 512, 512, 512, 2048]
    - [118, 16941.0]
  - - [512, 2048, 1, 3339, 512, 512, 512, 2048]
    - [118, 16950.0]
  - - [512, 2048, 1, 3342, 512, 512, 512, 2048]
    - [118, 16960.0]
  - - [512, 2048, 1, 3344, 512, 512, 512, 2048]
    - [96, 16957.0]
  - - [512, 2048, 1, 3358, 512, 512, 512, 2048]
    - [118, 16954.0]
  - - [512, 2048, 1, 3360, 512, 512, 512, 2048]
    - [96, 17029.0]
  - - [512, 2048, 1, 3364, 512, 512, 512, 2048]
    - [118, 16949.0]
  - - [512, 2048, 1, 3365, 512, 512, 512, 2048]
    - [118, 16956.0]
  - - [512, 2048, 1, 3369, 512, 512, 512, 2048]
    - [118, 16950.0]
  - - [512, 2048, 1, 3371, 512, 512, 512, 2048]
    - [118, 16960.0]
  - - [512, 2048, 1, 3374, 512, 512, 512, 2048]
    - [118, 16947.0]
  - - [512, 2048, 1, 3376, 512, 512, 512, 2048]
    - [118, 16959.0]
  - - [512, 2048, 1, 3377, 512, 512, 512, 2048]
    - [118, 16946.0]
  - - [512, 2048, 1, 3378, 512, 512, 512, 2048]
    - [118, 16953.0]
  - - [512, 2048, 1, 3381, 512, 512, 512, 2048]
    - [118, 16955.0]
  - - [512, 2048, 1, 3382, 512, 512, 512, 2048]
    - [118, 16947.0]
  - - [512, 2048, 1, 3383, 512, 512, 512, 2048]
    - [118, 16960.0]
  - - [512, 2048, 1, 3384, 512, 512, 512, 2048]
    - [118, 16955.0]
  - - [512, 2048, 1, 3385, 512, 512, 512, 2048]
    - [118, 16947.0]
  - - [512, 2048, 1, 3386, 512, 512, 512, 2048]
    - [118, 16951.0]
  - - [512, 2048, 1, 3388, 512, 512, 512, 2048]
    - [118, 16962.0]
  - - [512, 2048, 1, 3390, 512, 512, 512, 2048]
    - [118, 16950.0]
  - - [512, 2048, 1, 3391, 512, 512, 512, 2048]
    - [118, 16966.0]
  - - [512, 2048, 1, 3396, 512, 512, 512, 2048]
    - [118, 16960.0]
  - - [512, 2048, 1, 3399, 512, 512, 512, 2048]
    - [118, 16969.0]
  - - [512, 2048, 1, 3402, 512, 512, 512, 2048]
    - [118, 16956.0]
  - - [512, 2048, 1, 3410, 512, 512, 512, 2048]
    - [118, 16967.0]
  - - [512, 2048, 1, 3412, 512, 512, 512, 2048]
    - [118, 16969.0]
  - - [512, 2048, 1, 3414, 512, 512, 512, 2048]
    - [118, 16969.0]
  - - [512, 2048, 1, 3415, 512, 512, 512, 2048]
    - [118, 16969.0]
  - - [512, 2048, 1, 3418, 512, 512, 512, 2048]
    - [118, 16962.0]
  - - [512, 2048, 1, 3420, 512, 512, 512, 2048]
    - [118, 16967.0]
  - - [512, 2048, 1, 3422, 512, 512, 512, 2048]
    - [118, 16958.0]
  - - [512, 2048, 1, 3425, 512, 512, 512, 2048]
    - [118, 16966.0]
  - - [512, 2048, 1, 3426, 512, 512, 512, 2048]
    - [118, 16961.0]
  - - [512, 2048, 1, 3428, 512, 512, 512, 2048]
    - [96, 16955.0]
  - - [512, 2048, 1, 3430, 512, 512, 512, 2048]
    - [118, 16967.0]
  - - [512, 2048, 1, 3431, 512, 512, 512, 2048]
    - [118, 16959.0]
  - - [512, 2048, 1, 3432, 512, 512, 512, 2048]
    - [118, 16969.0]
  - - [512, 2048, 1, 3438, 512, 512, 512, 2048]
    - [118, 16952.0]
  - - [512, 2048, 1, 3439, 512, 512, 512, 2048]
    - [118, 16944.0]
  - - [512, 2048, 1, 3440, 512, 512, 512, 2048]
    - [118, 16971.0]
  - - [512, 2048, 1, 3443, 512, 512, 512, 2048]
    - [118, 16965.0]
  - - [512, 2048, 1, 3445, 512, 512, 512, 2048]
    - [118, 16953.0]
  - - [512, 2048, 1, 3447, 512, 512, 512, 2048]
    - [118, 16963.0]
  - - [512, 2048, 1, 3448, 512, 512, 512, 2048]
    - [118, 16952.0]
  - - [512, 2048, 1, 3450, 512, 512, 512, 2048]
    - [118, 16951.0]
  - - [512, 2048, 1, 3451, 512, 512, 512, 2048]
    - [118, 16943.0]
  - - [512, 2048, 1, 3452, 512, 512, 512, 2048]
    - [118, 16957.0]
  - - [512, 2048, 1, 3453, 512, 512, 512, 2048]
    - [96, 16951.0]
  - - [512, 2048, 1, 3455, 512, 512, 512, 2048]
    - [96, 16934.0]
  - - [512, 2048, 1, 3456, 512, 512, 512, 2048]
    - [96, 17029.0]
  - - [512, 2048, 1, 3457, 512, 512, 512, 2048]
    - [118, 16944.0]
  - - [512, 2048, 1, 3458, 512, 512, 512, 2048]
    - [96, 16947.0]
  - - [512, 2048, 1, 3459, 512, 512, 512, 2048]
    - [118, 16961.0]
  - - [512, 2048, 1, 3460, 512, 512, 512, 2048]
    - [118, 16936.0]
  - - [512, 2048, 1, 3461, 512, 512, 512, 2048]
    - [118, 16957.0]
  - - [512, 2048, 1, 3462, 512, 512, 512, 2048]
    - [118, 16955.0]
  - - [512, 2048, 1, 3466, 512, 512, 512, 2048]
    - [118, 16966.0]
  - - [512, 2048, 1, 3467, 512, 512, 512, 2048]
    - [118, 16956.0]
  - - [512, 2048, 1, 3468, 512, 512, 512, 2048]
    - [118, 16947.0]
  - - [512, 2048, 1, 3470, 512, 512, 512, 2048]
    - [118, 16944.0]
  - - [512, 2048, 1, 3471, 512, 512, 512, 2048]
    - [118, 16962.0]
  - - [512, 2048, 1, 3472, 512, 512, 512, 2048]
    - [118, 16954.0]
  - - [512, 2048, 1, 3475, 512, 512, 512, 2048]
    - [118, 16946.0]
  - - [512, 2048, 1, 3476, 512, 512, 512, 2048]
    - [118, 16958.0]
  - - [512, 2048, 1, 3477, 512, 512, 512, 2048]
    - [96, 16958.0]
  - - [512, 2048, 1, 3478, 512, 512, 512, 2048]
    - [118, 16969.0]
  - - [512, 2048, 1, 3479, 512, 512, 512, 2048]
    - [118, 16963.0]
  - - [512, 2048, 1, 3480, 512, 512, 512, 2048]
    - [118, 16952.0]
  - - [512, 2048, 1, 3481, 512, 512, 512, 2048]
    - [118, 16961.0]
  - - [512, 2048, 1, 3483, 512, 512, 512, 2048]
    - [118, 16965.0]
  - - [512, 2048, 1, 3484, 512, 512, 512, 2048]
    - [118, 16970.0]
  - - [512, 2048, 1, 3487, 512, 512, 512, 2048]
    - [118, 16965.0]
  - - [512, 2048, 1, 3489, 512, 512, 512, 2048]
    - [118, 16958.0]
  - - [512, 2048, 1, 3490, 512, 512, 512, 2048]
    - [96, 16953.0]
  - - [512, 2048, 1, 3491, 512, 512, 512, 2048]
    - [118, 16963.0]
  - - [512, 2048, 1, 3493, 512, 512, 512, 2048]
    - [118, 16947.0]
  - - [512, 2048, 1, 3494, 512, 512, 512, 2048]
    - [118, 16944.0]
  - - [512, 2048, 1, 3495, 512, 512, 512, 2048]
    - [118, 16938.0]
  - - [512, 2048, 1, 3497, 512, 512, 512, 2048]
    - [96, 16950.0]
  - - [512, 2048, 1, 3498, 512, 512, 512, 2048]
    - [96, 16967.0]
  - - [512, 2048, 1, 3499, 512, 512, 512, 2048]
    - [96, 16970.0]
  - - [512, 2048, 1, 3501, 512, 512, 512, 2048]
    - [118, 16956.0]
  - - [512, 2048, 1, 3503, 512, 512, 512, 2048]
    - [118, 16944.0]
  - - [512, 2048, 1, 3507, 512, 512, 512, 2048]
    - [118, 16967.0]
  - - [512, 2048, 1, 3508, 512, 512, 512, 2048]
    - [118, 16972.0]
  - - [512, 2048, 1, 3509, 512, 512, 512, 2048]
    - [118, 16978.0]
  - - [512, 2048, 1, 3511, 512, 512, 512, 2048]
    - [118, 16972.0]
  - - [512, 2048, 1, 3514, 512, 512, 512, 2048]
    - [96, 16960.0]
  - - [512, 2048, 1, 3515, 512, 512, 512, 2048]
    - [118, 16974.0]
  - - [512, 2048, 1, 3517, 512, 512, 512, 2048]
    - [118, 16974.0]
  - - [512, 2048, 1, 3518, 512, 512, 512, 2048]
    - [96, 16967.0]
  - - [512, 2048, 1, 3519, 512, 512, 512, 2048]
    - [118, 16951.0]
  - - [512, 2048, 1, 3520, 512, 512, 512, 2048]
    - [96, 17028.0]
  - - [512, 2048, 1, 3523, 512, 512, 512, 2048]
    - [96, 16958.0]
  - - [512, 2048, 1, 3528, 512, 512, 512, 2048]
    - [96, 16974.0]
  - - [512, 2048, 1, 3529, 512, 512, 512, 2048]
    - [118, 16979.0]
  - - [512, 2048, 1, 3530, 512, 512, 512, 2048]
    - [118, 16978.0]
  - - [512, 2048, 1, 3532, 512, 512, 512, 2048]
    - [118, 16950.0]
  - - [512, 2048, 1, 3533, 512, 512, 512, 2048]
    - [96, 16975.0]
  - - [512, 2048, 1, 3534, 512, 512, 512, 2048]
    - [118, 16980.0]
  - - [512, 2048, 1, 3538, 512, 512, 512, 2048]
    - [118, 16963.0]
  - - [512, 2048, 1, 3539, 512, 512, 512, 2048]
    - [96, 16962.0]
  - - [512, 2048, 1, 3541, 512, 512, 512, 2048]
    - [96, 16975.0]
  - - [512, 2048, 1, 3547, 512, 512, 512, 2048]
    - [96, 16951.0]
  - - [512, 2048, 1, 3548, 512, 512, 512, 2048]
    - [118, 16966.0]
  - - [512, 2048, 1, 3564, 512, 512, 512, 2048]
    - [118, 16973.0]
  - - [512, 2048, 1, 3575, 512, 512, 512, 2048]
    - [118, 16979.0]
  - - [512, 2048, 1, 3598, 512, 512, 512, 2048]
    - [96, 16973.0]
  - - [512, 2048, 1, 3599, 512, 512, 512, 2048]
    - [118, 16990.0]
  - - [512, 2048, 1, 3608, 512, 512, 512, 2048]
    - [118, 16985.0]
  - - [512, 2048, 1, 3780, 512, 512, 512, 2048]
    - [74, 16957.0]
  - - [512, 2048, 1, 3796, 512, 512, 512, 2048]
    - [118, 17007.0]
  - - [512, 2048, 1, 3822, 512, 512, 512, 2048]
    - [96, 16973.0]
  - - [512, 2048, 1, 3859, 512, 512, 512, 2048]
    - [118, 16980.0]
  - - [512, 2048, 1, 3870, 512, 512, 512, 2048]
    - [118, 17006.0]
  - - [512, 2048, 1, 3876, 512, 512, 512, 2048]
    - [96, 17007.0]
  - - [512, 2048, 1, 3906, 512, 512, 512, 2048]
    - [118, 17014.0]
  - - [512, 2048, 1, 3910, 512, 512, 512, 2048]
    - [118, 17023.0]
  - - [512, 2048, 1, 3925, 512, 512, 512, 2048]
    - [118, 16990.0]
  - - [512, 2048, 1, 3942, 512, 512, 512, 2048]
    - [118, 17009.0]
  - - [512, 2048, 1, 3944, 512, 512, 512, 2048]
    - [118, 16985.0]
  - - [512, 2048, 1, 3955, 512, 512, 512, 2048]
    - [118, 17014.0]
  - - [512, 2048, 1, 3968, 512, 512, 512, 2048]
    - [96, 17082.0]
  - - [512, 2048, 1, 3969, 512, 512, 512, 2048]
    - [118, 17008.0]
  - - [512, 2048, 1, 3976, 512, 512, 512, 2048]
    - [118, 17009.0]
  - - [512, 2048, 1, 3977, 512, 512, 512, 2048]
    - [118, 17028.0]
  - - [512, 2048, 1, 3978, 512, 512, 512, 2048]
    - [118, 17017.0]
  - - [512, 2048, 1, 3990, 512, 512, 512, 2048]
    - [96, 17006.0]
  - - [512, 2048, 1, 3995, 512, 512, 512, 2048]
    - [118, 17016.0]
  - - [512, 2048, 1, 3996, 512, 512, 512, 2048]
    - [118, 16996.0]
  - - [512, 2048, 1, 3999, 512, 512, 512, 2048]
    - [118, 17010.0]
  - - [512, 2048, 1, 4005, 512, 512, 512, 2048]
    - [118, 17012.0]
  - - [512, 2048, 1, 4012, 512, 512, 512, 2048]
    - [96, 16996.0]
  - - [512, 2048, 1, 4020, 512, 512, 512, 2048]
    - [96, 16998.0]
  - - [512, 2048, 1, 4026, 512, 512, 512, 2048]
    - [96, 17002.0]
  - - [512, 2048, 1, 4030, 512, 512, 512, 2048]
    - [96, 17017.0]
  - - [512, 2048, 1, 4032, 512, 512, 512, 2048]
    - [96, 17062.0]
  - - [2048, 512, 1, 2790, 2048, 2048, 2048, 512]
    - [118, 16852.0]
  - - [2048, 512, 1, 2864, 2048, 2048, 2048, 512]
    - [118, 16908.0]
  - - [2048, 512, 1, 3092, 2048, 2048, 2048, 512]
    - [118, 16938.0]
  - - [2048, 512, 1, 3113, 2048, 2048, 2048, 512]
    - [96, 16915.0]
  - - [2048, 512, 1, 3137, 2048, 2048, 2048, 512]
    - [96, 16891.0]
  - - [2048, 512, 1, 3165, 2048, 2048, 2048, 512]
    - [118, 16922.0]
  - - [2048, 512, 1, 3166, 2048, 2048, 2048, 512]
    - [118, 16939.0]
  - - [2048, 512, 1, 3194, 2048, 2048, 2048, 512]
    - [96, 16932.0]
  - - [2048, 512, 1, 3219, 2048, 2048, 2048, 512]
    - [118, 16921.0]
  - - [2048, 512, 1, 3222, 2048, 2048, 2048, 512]
    - [118, 16915.0]
  - - [2048, 512, 1, 3234, 2048, 2048, 2048, 512]
    - [118, 16937.0]
  - - [2048, 512, 1, 3237, 2048, 2048, 2048, 512]
    - [118, 16934.0]
  - - [2048, 512, 1, 3242, 2048, 2048, 2048, 512]
    - [118, 16943.0]
  - - [2048, 512, 1, 3246, 2048, 2048, 2048, 512]
    - [118, 16942.0]
  - - [2048, 512, 1, 3249, 2048, 2048, 2048, 512]
    - [118, 16939.0]
  - - [2048, 512, 1, 3251, 2048, 2048, 2048, 512]
    - [118, 16941.0]
  - - [2048, 512, 1, 3257, 2048, 2048, 2048, 512]
    - [118, 16927.0]
  - - [2048, 512, 1, 3262, 2048, 2048, 2048, 512]
    - [96, 16926.0]
  - - [2048, 512, 1, 3268, 2048, 2048, 2048, 512]
    - [118, 16931.0]
  - - [2048, 512, 1, 3282, 2048, 2048, 2048, 512]
    - [118, 16923.0]
  - - [2048, 512, 1, 3286, 2048, 2048, 2048, 512]
    - [118, 16947.0]
  - - [2048, 512, 1, 3287, 2048, 2048, 2048, 512]
    - [118, 16934.0]
  - - [2048, 512, 1, 3293, 2048, 2048, 2048, 512]
    - [118, 16936.0]
  - - [2048, 512, 1, 3297, 2048, 2048, 2048, 512]
    - [96, 16940.0]
  - - [2048, 512, 1, 3307, 2048, 2048, 2048, 512]
    - [96, 16924.0]
  - - [2048, 512, 1, 3314, 2048, 2048, 2048, 512]
    - [96, 16935.0]
  - - [2048, 512, 1, 3315, 2048, 2048, 2048, 512]
    - [118, 16917.0]
  - - [2048, 512, 1, 3319, 2048, 2048, 2048, 512]
    - [96, 16932.0]
  - - [2048, 512, 1, 3322, 2048, 2048, 2048, 512]
    - [96, 16937.0]
  - - [2048, 512, 1, 3323, 2048, 2048, 2048, 512]
    - [118, 16949.0]
  - - [2048, 512, 1, 3324, 2048, 2048, 2048, 512]
    - [118, 16948.0]
  - - [2048, 512, 1, 3325, 2048, 2048, 2048, 512]
    - [118, 16963.0]
  - - [2048, 512, 1, 3327, 2048, 2048, 2048, 512]
    - [118, 16943.0]
  - - [2048, 512, 1, 3329, 2048, 2048, 2048, 512]
    - [96, 16942.0]
  - - [2048, 512, 1, 3332, 2048, 2048, 2048, 512]
    - [96, 16944.0]
  - - [2048, 512, 1, 3336, 2048, 2048, 2048, 512]
    - [118, 16936.0]
  - - [2048, 512, 1, 3339, 2048, 2048, 2048, 512]
    - [118, 16947.0]
  - - [2048, 512, 1, 3342, 2048, 2048, 2048, 512]
    - [118, 16946.0]
  - - [2048, 512, 1, 3344, 2048, 2048, 2048, 512]
    - [118, 16954.0]
  - - [2048, 512, 1, 3358, 2048, 2048, 2048, 512]
    - [118, 16943.0]
  - - [2048, 512, 1, 3360, 2048, 2048, 2048, 512]
    - [96, 17017.0]
  - - [2048, 512, 1, 3364, 2048, 2048, 2048, 512]
    - [118, 16965.0]
  - - [2048, 512, 1, 3365, 2048, 2048, 2048, 512]
    - [118, 16967.0]
  - - [2048, 512, 1, 3369, 2048, 2048, 2048, 512]
    - [118, 16946.0]
  - - [2048, 512, 1, 3371, 2048, 2048, 2048, 512]
    - [118, 16955.0]
  - - [2048, 512, 1, 3374, 2048, 2048, 2048, 512]
    - [118, 16978.0]
  - - [2048, 512, 1, 3376, 2048, 2048, 2048, 512]
    - [118, 16957.0]
  - - [2048, 512, 1, 3377, 2048, 2048, 2048, 512]
    - [118, 16959.0]
  - - [2048, 512, 1, 3378, 2048, 2048, 2048, 512]
    - [118, 16966.0]
  - - [2048, 512, 1, 3381, 2048, 2048, 2048, 512]
    - [118, 16956.0]
  - - [2048, 512, 1, 3382, 2048, 2048, 2048, 512]
    - [118, 16948.0]
  - - [2048, 512, 1, 3383, 2048, 2048, 2048, 512]
    - [96, 16958.0]
