library/src/blas3/Tensile/Logic/asm_full/navi22_Cijk_Ailk_Bljk_HB_GB.yaml
---
- {MinimumRequiredVersion: 4.28.0}
- navi22
- gfx1031
    SolutionIndex: 0
    SolutionNameMin: Cijk_Ailk_Bljk_HB_GB_MT128x64x8_SN_SU0_SUM0_TT8_8_WG16_8_1_WGM1
    SolutionIndex: 1
    SolutionNameMin: Cijk_Ailk_Bljk_HB_GB_MT128x128x8_SN_SU0_SUM0_TT8_16_WG16_8_1_WGM1
    SolutionIndex: 2
    SolutionNameMin: Cijk_Ailk_Bljk_HB_GB_MT256x128x8_SN_SU0_SUM0_TT16_16_WG16_8_1_WGM1
    SolutionIndex: 3
    SolutionNameMin: Cijk_Ailk_Bljk_HB_GB_MT128x64x16_SN_SU0_SUM0_TT8_8_WG16_8_1_WGM1
    SolutionIndex: 4
    SolutionNameMin: Cijk_Ailk_Bljk_HB_GB_MT128x128x16_SN_SU0_SUM0_TT8_16_WG16_8_1_WGM1
    SolutionIndex: 5
    SolutionNameMin: Cijk_Ailk_Bljk_HB_GB_MT256x128x16_SN_SU0_SUM0_TT16_16_WG16_8_1_WGM1
    SolutionIndex: 6
    SolutionNameMin: Cijk_Ailk_Bljk_HB_GB_MT128x128x16_SN_SU0_SUM0_TT8_8_WG16_16_1_WGM1
    SolutionIndex: 7
    SolutionNameMin: Cijk_Ailk_Bljk_HB_GB_MT128x256x16_SN_SU0_SUM0_TT8_16_WG16_16_1_WGM1
    SolutionIndex: 8
    SolutionNameMin: Cijk_Ailk_Bljk_HB_GB_MT256x128x8_SN_SU32_SUM3_TT16_16_WG16_8_1_WGM1
    SolutionIndex: 9
    SolutionNameMin: Cijk_Ailk_Bljk_HB_GB_MT128x64x16_SN_SU32_SUM3_TT8_8_WG16_8_1_WGM1
    SolutionIndex: 10
    SolutionNameMin: Cijk_Ailk_Bljk_HB_GB_MT128x128x16_SN_SU32_SUM3_TT8_16_WG16_8_1_WGM1
    SolutionIndex: 11
    SolutionNameMin: Cijk_Ailk_Bljk_HB_GB_MT256x128x16_SN_SU32_SUM3_TT16_16_WG16_8_1_WGM1
    SolutionIndex: 12
    SolutionNameMin: Cijk_Ailk_Bljk_HB_GB_MT128x128x16_SN_SU32_SUM3_TT8_8_WG16_16_1_WGM1
    SolutionIndex: 13
    SolutionNameMin: Cijk_Ailk_Bljk_HB_GB_MT128x256x16_SN_SU32_SUM3_TT8_16_WG16_16_1_WGM1
    SolutionIndex: 14
    SolutionNameMin: Cijk_Ailk_Bljk_HB_GB_MT128x64x8_SN_SU0_SUM0_TT8_8_WG16_8_1_WGM4
    SolutionIndex: 15
    SolutionNameMin: Cijk_Ailk_Bljk_HB_GB_MT128x128x8_SN_SU0_SUM0_TT8_16_WG16_8_1_WGM4
    SolutionIndex: 16
    SolutionNameMin: Cijk_Ailk_Bljk_HB_GB_MT256x128x8_SN_SU0_SUM0_TT16_16_WG16_8_1_WGM4
    SolutionIndex: 17
    SolutionNameMin: Cijk_Ailk_Bljk_HB_GB_MT128x64x16_SN_SU0_SUM0_TT8_8_WG16_8_1_WGM4
    SolutionIndex: 18
    SolutionNameMin: Cijk_Ailk_Bljk_HB_GB_MT128x128x16_SN_SU0_SUM0_TT8_16_WG16_8_1_WGM4
    SolutionIndex: 19
    SolutionNameMin: Cijk_Ailk_Bljk_HB_GB_MT256x128x16_SN_SU0_SUM0_TT16_16_WG16_8_1_WGM4
    SolutionIndex: 20
    SolutionNameMin: Cijk_Ailk_Bljk_HB_GB_MT128x128x16_SN_SU0_SUM0_TT8_8_WG16_16_1_WGM4
    SolutionIndex: 21
    SolutionNameMin: Cijk_Ailk_Bljk_HB_GB_MT128x256x16_SN_SU0_SUM0_TT8_16_WG16_16_1_WGM4
    SolutionIndex: 22
    SolutionNameMin: Cijk_Ailk_Bljk_HB_GB_MT128x64x16_SN_SU32_SUM3_TT8_8_WG16_8_1_WGM4
    SolutionIndex: 23
    SolutionNameMin: Cijk_Ailk_Bljk_HB_GB_MT128x128x16_SN_SU32_SUM3_TT8_16_WG16_8_1_WGM4
    SolutionIndex: 24
    SolutionNameMin: Cijk_Ailk_Bljk_HB_GB_MT128x256x16_SN_SU32_SUM3_TT8_16_WG16_16_1_WGM4
    SolutionIndex: 25
    SolutionNameMin: Cijk_Ailk_Bljk_HB_GB_MT128x64x8_SN_SU0_SUM0_TT8_8_WG16_8_1_WGM8
    SolutionIndex: 26
    SolutionNameMin: Cijk_Ailk_Bljk_HB_GB_MT256x128x8_SN_SU0_SUM0_TT16_16_WG16_8_1_WGM8
    SolutionIndex: 27
    SolutionNameMin: Cijk_Ailk_Bljk_HB_GB_MT128x64x16_SN_SU0_SUM0_TT8_8_WG16_8_1_WGM8
    SolutionIndex: 28
    SolutionNameMin: Cijk_Ailk_Bljk_HB_GB_MT128x128x16_SN_SU0_SUM0_TT8_16_WG16_8_1_WGM8
    SolutionIndex: 29
    SolutionNameMin: Cijk_Ailk_Bljk_HB_GB_MT256x128x16_SN_SU0_SUM0_TT16_16_WG16_8_1_WGM8
    SolutionIndex: 30
    SolutionNameMin: Cijk_Ailk_Bljk_HB_GB_MT128x128x16_SN_SU0_SUM0_TT8_8_WG16_16_1_WGM8
    SolutionIndex: 31
    SolutionNameMin: Cijk_Ailk_Bljk_HB_GB_MT128x256x16_SN_SU0_SUM0_TT8_16_WG16_16_1_WGM8
    SolutionIndex: 32
    SolutionNameMin: Cijk_Ailk_Bljk_HB_GB_MT128x128x32_SN_SU0_SUM0_TT8_16_WG16_8_1_WGM8
    SolutionIndex: 33
    SolutionNameMin: Cijk_Ailk_Bljk_HB_GB_MT128x64x8_SN_SU32_SUM3_TT8_8_WG16_8_1_WGM8
    SolutionIndex: 34
    SolutionNameMin: Cijk_Ailk_Bljk_HB_GB_MT128x64x16_SN_SU32_SUM3_TT8_8_WG16_8_1_WGM8
    SolutionIndex: 35
    SolutionNameMin: Cijk_Ailk_Bljk_HB_GB_MT128x128x16_SN_SU32_SUM3_TT8_16_WG16_8_1_WGM8
    SolutionIndex: 36
    SolutionNameMin: Cijk_Ailk_Bljk_HB_GB_MT128x256x16_SN_SU32_SUM3_TT8_16_WG16_16_1_WGM8
    SolutionIndex: 37
    SolutionNameMin: Cijk_Ailk_Bljk_HB_GB_MT64x64x8_SN_SU0_SUM0_TT8_8_WG8_8_1_WGM1
    SolutionIndex: 38
    SolutionNameMin: Cijk_Ailk_Bljk_HB_GB_MT128x64x8_SN_SU0_SUM0_TT8_8_WG16_8_1_WGM1
    SolutionIndex: 39
    SolutionNameMin: Cijk_Ailk_Bljk_HB_GB_MT64x64x16_SN_SU0_SUM0_TT8_8_WG8_8_1_WGM1
    SolutionIndex: 40
    SolutionNameMin: Cijk_Ailk_Bljk_HB_GB_MT128x64x16_SN_SU0_SUM0_TT8_8_WG16_8_1_WGM1
    SolutionIndex: 41
    SolutionNameMin: Cijk_Ailk_Bljk_HB_GB_MT128x128x16_SN_SU0_SUM0_TT8_8_WG16_16_1_WGM1
    SolutionIndex: 42
    SolutionNameMin: Cijk_Ailk_Bljk_HB_GB_MT128x64x32_SN_SU0_SUM0_TT8_8_WG16_8_1_WGM1
    SolutionIndex: 43
    SolutionNameMin: Cijk_Ailk_Bljk_HB_GB_MT128x64x8_SN_SU32_SUM3_TT8_8_WG16_8_1_WGM1
    SolutionIndex: 44
    SolutionNameMin: Cijk_Ailk_Bljk_HB_GB_MT64x64x16_SN_SU32_SUM3_TT8_8_WG8_8_1_WGM1
    SolutionIndex: 45
    SolutionNameMin: Cijk_Ailk_Bljk_HB_GB_MT128x64x16_SN_SU32_SUM3_TT8_8_WG16_8_1_WGM1
    SolutionIndex: 46
    SolutionNameMin: Cijk_Ailk_Bljk_HB_GB_MT128x128x16_SN_SU32_SUM3_TT8_8_WG16_16_1_WGM1
    SolutionIndex: 47
    SolutionNameMin: Cijk_Ailk_Bljk_HB_GB_MT64x64x32_SN_SU32_SUM3_TT8_8_WG8_8_1_WGM1
    SolutionIndex: 48
    SolutionNameMin: Cijk_Ailk_Bljk_HB_GB_MT128x64x8_SN_SU0_SUM0_TT8_8_WG16_8_1_WGM4
    SolutionIndex: 49
    SolutionNameMin: Cijk_Ailk_Bljk_HB_GB_MT64x64x16_SN_SU0_SUM0_TT8_8_WG8_8_1_WGM4
    SolutionIndex: 50
    SolutionNameMin: Cijk_Ailk_Bljk_HB_GB_MT128x64x16_SN_SU0_SUM0_TT8_8_WG16_8_1_WGM4
    SolutionIndex: 51
    SolutionNameMin: Cijk_Ailk_Bljk_HB_GB_MT128x128x16_SN_SU0_SUM0_TT8_8_WG16_16_1_WGM4
    SolutionIndex: 52
    SolutionNameMin: Cijk_Ailk_Bljk_HB_GB_MT128x64x8_SN_SU32_SUM3_TT8_8_WG16_8_1_WGM4
    SolutionIndex: 53
    SolutionNameMin: Cijk_Ailk_Bljk_HB_GB_MT64x64x16_SN_SU32_SUM3_TT8_8_WG8_8_1_WGM4
    SolutionIndex: 54
    SolutionNameMin: Cijk_Ailk_Bljk_HB_GB_MT128x64x16_SN_SU32_SUM3_TT8_8_WG16_8_1_WGM4
    SolutionIndex: 55
    SolutionNameMin: Cijk_Ailk_Bljk_HB_GB_MT128x64x8_SN_SU0_SUM0_TT8_8_WG16_8_1_WGM8
    SolutionIndex: 56
    SolutionNameMin: Cijk_Ailk_Bljk_HB_GB_MT64x64x16_SN_SU0_SUM0_TT8_8_WG8_8_1_WGM8
    SolutionIndex: 57
    SolutionNameMin: Cijk_Ailk_Bljk_HB_GB_MT128x64x16_SN_SU0_SUM0_TT8_8_WG16_8_1_WGM8
    SolutionIndex: 58
    SolutionNameMin: Cijk_Ailk_Bljk_HB_GB_MT128x128x16_SN_SU0_SUM0_TT8_8_WG16_16_1_WGM8
    SolutionIndex: 59
    SolutionNameMin: Cijk_Ailk_Bljk_HB_GB_MT128x64x32_SN_SU0_SUM0_TT8_8_WG16_8_1_WGM8
    SolutionIndex: 60
    SolutionNameMin: Cijk_Ailk_Bljk_HB_GB_MT128x64x8_SN_SU32_SUM3_TT8_8_WG16_8_1_WGM8
    SolutionIndex: 61
    SolutionNameMin: Cijk_Ailk_Bljk_HB_GB_MT64x64x16_SN_SU32_SUM3_TT8_8_WG8_8_1_WGM8
    SolutionIndex: 62
    SolutionNameMin: Cijk_Ailk_Bljk_HB_GB_MT128x64x16_SN_SU32_SUM3_TT8_8_WG16_8_1_WGM8
    SolutionIndex: 63
    SolutionNameMin: Cijk_Ailk_Bljk_HB_GB_MT32x16x8_SN_SU0_SUM0_TT2_2_WG16_8_1_WGM1
    SolutionIndex: 64
    SolutionNameMin: Cijk_Ailk_Bljk_HB_GB_MT64x32x8_SN_SU0_SUM0_TT4_4_WG16_8_1_WGM1
    SolutionIndex: 65
    SolutionNameMin: Cijk_Ailk_Bljk_HB_GB_MT64x64x8_SN_SU0_SUM0_TT4_4_WG16_16_1_WGM1
    SolutionIndex: 66
    SolutionNameMin: Cijk_Ailk_Bljk_HB_GB_MT32x16x16_SN_SU0_SUM0_TT2_2_WG16_8_1_WGM1
    SolutionIndex: 67
    SolutionNameMin: Cijk_Ailk_Bljk_HB_GB_MT64x32x16_SN_SU0_SUM0_TT4_4_WG16_8_1_WGM1
    SolutionIndex: 68
    SolutionNameMin: Cijk_Ailk_Bljk_HB_GB_MT16x16x32_SN_SU0_SUM0_TT2_2_WG8_8_1_WGM1
    SolutionIndex: 69
    SolutionNameMin: Cijk_Ailk_Bljk_HB_GB_MT32x16x32_SN_SU0_SUM0_TT2_2_WG16_8_1_WGM1
    SolutionIndex: 70
    SolutionNameMin: Cijk_Ailk_Bljk_HB_GB_MT64x32x8_SN_SU32_SUM3_TT4_4_WG16_8_1_WGM1
    SolutionIndex: 71
    SolutionNameMin: Cijk_Ailk_Bljk_HB_GB_MT64x64x8_SN_SU32_SUM3_TT4_4_WG16_16_1_WGM1
    SolutionIndex: 72
    SolutionNameMin: Cijk_Ailk_Bljk_HB_GB_MT32x16x16_SN_SU32_SUM3_TT2_2_WG16_8_1_WGM1
    SolutionIndex: 73
    SolutionNameMin: Cijk_Ailk_Bljk_HB_GB_MT64x32x8_SN_SU0_SUM0_TT4_4_WG16_8_1_WGM4
    SolutionIndex: 74
    SolutionNameMin: Cijk_Ailk_Bljk_HB_GB_MT64x64x8_SN_SU0_SUM0_TT4_4_WG16_16_1_WGM4
    SolutionIndex: 75
    SolutionNameMin: Cijk_Ailk_Bljk_HB_GB_MT64x32x16_SN_SU0_SUM0_TT4_4_WG16_8_1_WGM4
    SolutionIndex: 76
    SolutionNameMin: Cijk_Ailk_Bljk_HB_GB_MT16x16x32_SN_SU0_SUM0_TT2_2_WG8_8_1_WGM4
    SolutionIndex: 77
    SolutionNameMin: Cijk_Ailk_Bljk_HB_GB_MT32x16x32_SN_SU0_SUM0_TT2_2_WG16_8_1_WGM4
    SolutionIndex: 78
    SolutionNameMin: Cijk_Ailk_Bljk_HB_GB_MT32x16x8_SN_SU32_SUM3_TT2_2_WG16_8_1_WGM4
    SolutionIndex: 79
    SolutionNameMin: Cijk_Ailk_Bljk_HB_GB_MT64x32x8_SN_SU32_SUM3_TT4_4_WG16_8_1_WGM4
    SolutionIndex: 80
    SolutionNameMin: Cijk_Ailk_Bljk_HB_GB_MT32x16x16_SN_SU32_SUM3_TT2_2_WG16_8_1_WGM4
    SolutionIndex: 81
    SolutionNameMin: Cijk_Ailk_Bljk_HB_GB_MT64x32x16_SN_SU32_SUM3_TT4_4_WG16_8_1_WGM4
    SolutionIndex: 82
    SolutionNameMin: Cijk_Ailk_Bljk_HB_GB_MT32x16x32_SN_SU32_SUM3_TT2_2_WG16_8_1_WGM4
    SolutionIndex: 83
    SolutionNameMin: Cijk_Ailk_Bljk_HB_GB_MT64x32x8_SN_SU0_SUM0_TT4_4_WG16_8_1_WGM8
    SolutionIndex: 84
    SolutionNameMin: Cijk_Ailk_Bljk_HB_GB_MT64x64x8_SN_SU0_SUM0_TT4_4_WG16_16_1_WGM8
    SolutionIndex: 85
    SolutionNameMin: Cijk_Ailk_Bljk_HB_GB_MT32x16x16_SN_SU0_SUM0_TT2_2_WG16_8_1_WGM8
    SolutionIndex: 86
    SolutionNameMin: Cijk_Ailk_Bljk_HB_GB_MT64x32x16_SN_SU0_SUM0_TT4_4_WG16_8_1_WGM8
    SolutionIndex: 87
    SolutionNameMin: Cijk_Ailk_Bljk_HB_GB_MT64x64x16_SN_SU0_SUM0_TT4_4_WG16_16_1_WGM8
    SolutionIndex: 88
    SolutionNameMin: Cijk_Ailk_Bljk_HB_GB_MT64x32x8_SN_SU32_SUM3_TT4_4_WG16_8_1_WGM8
    SolutionIndex: 89
    SolutionNameMin: Cijk_Ailk_Bljk_HB_GB_MT64x64x8_SN_SU32_SUM3_TT4_4_WG16_16_1_WGM8
    SolutionIndex: 90
    SolutionNameMin: Cijk_Ailk_Bljk_HB_GB_MT16x16x16_SN_SU32_SUM3_TT2_2_WG8_8_1_WGM8
    SolutionIndex: 91
    SolutionNameMin: Cijk_Ailk_Bljk_HB_GB_MT64x16x8_SN_SU0_SUM0_TT4_2_WG16_8_1_WGM1
    SolutionIndex: 92
    SolutionNameMin: Cijk_Ailk_Bljk_HB_GB_MT64x16x16_SN_SU0_SUM0_TT4_2_WG16_8_1_WGM1
    SolutionIndex: 93
    SolutionNameMin: Cijk_Ailk_Bljk_HB_GB_MT64x8x32_SN_SU0_SUM0_TT2_2_WG32_4_1_WGM1
    SolutionIndex: 94
    SolutionNameMin: Cijk_Ailk_Bljk_HB_GB_MT128x8x32_SN_SU0_SUM0_TT4_2_WG32_4_1_WGM1
    SolutionIndex: 95
    SolutionNameMin: Cijk_Ailk_Bljk_HB_GB_MT64x8x32_SN_SU32_SUM3_TT2_2_WG32_4_1_WGM1
    SolutionIndex: 96
    SolutionNameMin: Cijk_Ailk_Bljk_HB_GB_MT64x8x16_SN_SU0_SUM0_TT2_2_WG32_4_1_WGM4
    SolutionIndex: 97
    SolutionNameMin: Cijk_Ailk_Bljk_HB_GB_MT128x8x16_SN_SU0_SUM0_TT4_2_WG32_4_1_WGM4
    SolutionIndex: 98
    SolutionNameMin: Cijk_Ailk_Bljk_HB_GB_MT64x8x32_SN_SU0_SUM0_TT2_2_WG32_4_1_WGM4
    SolutionIndex: 99
    SolutionNameMin: Cijk_Ailk_Bljk_HB_GB_MT128x8x32_SN_SU0_SUM0_TT4_2_WG32_4_1_WGM4
    SolutionIndex: 100
    SolutionNameMin: Cijk_Ailk_Bljk_HB_GB_MT64x16x16_SN_SU32_SUM3_TT4_2_WG16_8_1_WGM4
    SolutionIndex: 101
    SolutionNameMin: Cijk_Ailk_Bljk_HB_GB_MT64x8x32_SN_SU32_SUM3_TT2_2_WG32_4_1_WGM4
    SolutionIndex: 102
    SolutionNameMin: Cijk_Ailk_Bljk_HB_GB_MT64x8x16_SN_SU0_SUM0_TT2_2_WG32_4_1_WGM8
    SolutionIndex: 103
    SolutionNameMin: Cijk_Ailk_Bljk_HB_GB_MT64x8x32_SN_SU0_SUM0_TT2_2_WG32_4_1_WGM8
- - - [2944, 4288, 1, 1280, 2944, 2944, 2944, 1280]
    - [28, 24222.0]
  - - [2368, 5888, 1, 256, 2368, 2368, 2368, 256]
    - [18, 23461.0]
  - - [512, 24000, 1, 1536, 512, 512, 512, 1536]
    - [23, 24683.0]
  - - [5888, 1856, 1, 3328, 5888, 5888, 5888, 3328]
    - [4, 24013.0]
  - - [5888, 2944, 1, 3328, 5888, 5888, 5888, 3328]
    - [4, 25272.0]
  - - [1856, 4288, 1, 256, 1856, 1856, 1856, 256]
    - [28, 21587.0]
  - - [5056, 5056, 1, 3328, 5056, 5056, 5056, 3328]
    - [16, 24867.0]
  - - [1408, 5888, 1, 1280, 1408, 1408, 1408, 1280]
    - [31, 24303.0]
  - - [6144, 6000, 1, 2560, 6144, 6144, 6144, 2560]
    - [18, 25298.0]
  - - [1024, 3584, 1, 3328, 1024, 1024, 1024, 3328]
    - [21, 23152.0]
  - - [512, 48000, 1, 2048, 512, 512, 512, 2048]
    - [10, 25263.0]
  - - [448, 3584, 1, 3328, 448, 448, 448, 3328]
    - [7, 19394.0]
  - - [5888, 1408, 1, 1280, 5888, 5888, 5888, 1280]
    - [4, 24327.0]
  - - [1024, 2368, 1, 256, 1024, 1024, 1024, 256]
    - [17, 20339.0]
  - - [5056, 6784, 1, 1280, 5056, 5056, 5056, 1280]
    - [2, 25059.0]
  - - [5056, 5056, 1, 1280, 5056, 5056, 5056, 1280]
    - [16, 24697.0]
  - - [4288, 6784, 1, 256, 4288, 4288, 4288, 256]
    - [18, 24035.0]
  - - [6784, 448, 1, 256, 6784, 6784, 6784, 256]
    - [27, 20475.0]
  - - [5056, 256, 1, 1280, 5056, 5056, 5056, 1280]
    - [6, 21405.0]
  - - [5888, 704, 1, 1280, 5888, 5888, 5888, 1280]
    - [4, 21820.0]
  - - [3584, 1024, 1, 256, 3584, 3584, 3584, 256]
    - [4, 21569.0]
  - - [6784, 4288, 1, 3328, 6784, 6784, 6784, 3328]
    - [4, 24838.0]
  - - [1856, 2368, 1, 3328, 1856, 1856, 1856, 3328]
    - [28, 22135.0]
  - - [5888, 2944, 1, 1280, 5888, 5888, 5888, 1280]
    - [4, 25231.0]
  - - [5888, 1024, 1, 256, 5888, 5888, 5888, 256]
    - [4, 23072.0]
  - - [1408, 2944, 1, 256, 1408, 1408, 1408, 256]
    - [4, 22530.0]
  - - [6784, 5056, 1, 3328, 6784, 6784, 6784, 3328]
    - [18, 25127.0]
  - - [5056, 5056, 1, 256, 5056, 5056, 5056, 256]
    - [4, 23709.0]
  - - [1024, 3584, 1, 1280, 1024, 1024, 1024, 1280]
    - [7, 22837.0]
  - - [2368, 2944, 1, 1280, 2368, 2368, 2368, 1280]
    - [4, 23919.0]
  - - [6784, 6784, 1, 1280, 6784, 6784, 6784, 1280]
    - [4, 25369.0]
  - - [1408, 4288, 1, 1280, 1408, 1408, 1408, 1280]
    - [18, 23730.0]
  - - [3584, 4288, 1, 1280, 3584, 3584, 3584, 1280]
    - [4, 24663.0]
  - - [512, 6000, 1, 2560, 512, 512, 512, 2560]
    - [24, 22665.0]
  - - [2368, 704, 1, 1280, 2368, 2368, 2368, 1280]
    - [25, 19714.0]
  - - [5056, 4288, 1, 3328, 5056, 5056, 5056, 3328]
    - [16, 24767.0]
  - - [3584, 2368, 1, 3328, 3584, 3584, 3584, 3328]
    - [18, 24077.0]
  - - [5888, 6784, 1, 1280, 5888, 5888, 5888, 1280]
    - [16, 25524.0]
  - - [6784, 448, 1, 1280, 6784, 6784, 6784, 1280]
    - [27, 21344.0]
  - - [2944, 5888, 1, 256, 2944, 2944, 2944, 256]
    - [18, 24672.0]
  - - [4288, 2944, 1, 256, 4288, 4288, 4288, 256]
    - [10, 23196.0]
  - - [6144, 24000, 1, 2560, 6144, 6144, 6144, 2560]
    - [5, 25603.0]
  - - [5056, 2368, 1, 1280, 5056, 5056, 5056, 1280]
    - [18, 24083.0]
  - - [448, 3584, 1, 1280, 448, 448, 448, 1280]
    - [28, 18779.0]
  - - [6784, 5888, 1, 256, 6784, 6784, 6784, 256]
    - [18, 24993.0]
  - - [1024, 1408, 1, 256, 1024, 1024, 1024, 256]
    - [3, 18717.0]
  - - [2368, 2368, 1, 3328, 2368, 2368, 2368, 3328]
    - [4, 22547.0]
  - - [5056, 704, 1, 3328, 5056, 5056, 5056, 3328]
    - [21, 22269.0]
  - - [1408, 1856, 1, 256, 1408, 1408, 1408, 256]
    - [3, 20789.0]
  - - [5888, 1856, 1, 256, 5888, 5888, 5888, 256]
    - [23, 22871.0]
  - - [704, 5888, 1, 256, 704, 704, 704, 256]
    - [28, 20174.0]
  - - [3584, 704, 1, 3328, 3584, 3584, 3584, 3328]
    - [3, 21288.0]
  - - [1408, 1408, 1, 256, 1408, 1408, 1408, 256]
    - [3, 19297.0]
  - - [448, 4288, 1, 256, 448, 448, 448, 256]
    - [20, 16888.0]
  - - [704, 2368, 1, 1280, 704, 704, 704, 1280]
    - [28, 19434.0]
  - - [1856, 2368, 1, 1280, 1856, 1856, 1856, 1280]
    - [18, 21886.0]
  - - [1408, 1408, 1, 3328, 1408, 1408, 1408, 3328]
    - [4, 20932.0]
  - - [256, 193600, 1, 64, 256, 256, 256, 64]
    - [0, 21806.0]
  - - [1408, 1024, 1, 1280, 1408, 1408, 1408, 1280]
    - [17, 20680.0]
  - - [704, 6784, 1, 256, 704, 704, 704, 256]
    - [4, 20136.0]
  - - [6784, 704, 1, 256, 6784, 6784, 6784, 256]
    - [27, 21095.0]
  - - [2048, 7000, 1, 2048, 2048, 2048, 2048, 2048]
    - [23, 25047.0]
  - - [5056, 704, 1, 256, 5056, 5056, 5056, 256]
    - [33, 20249.0]
  - - [1408, 3584, 1, 256, 1408, 1408, 1408, 256]
    - [28, 22712.0]
  - - [3584, 4288, 1, 3328, 3584, 3584, 3584, 3328]
    - [16, 24787.0]
  - - [5888, 1856, 1, 1280, 5888, 5888, 5888, 1280]
    - [4, 23880.0]
  - - [2368, 3584, 1, 1280, 2368, 2368, 2368, 1280]
    - [4, 23923.0]
  - - [2944, 3584, 1, 3328, 2944, 2944, 2944, 3328]
    - [18, 24695.0]
  - - [6784, 2944, 1, 256, 6784, 6784, 6784, 256]
    - [10, 24750.0]
  - - [1024, 1500, 1, 2560, 1024, 1024, 1024, 2560]
    - [18, 21410.0]
  - - [1856, 2368, 1, 256, 1856, 1856, 1856, 256]
    - [0, 20435.0]
  - - [3584, 6784, 1, 3328, 3584, 3584, 3584, 3328]
    - [28, 25193.0]
  - - [5056, 4288, 1, 1280, 5056, 5056, 5056, 1280]
    - [16, 24635.0]
  - - [6784, 1856, 1, 3328, 6784, 6784, 6784, 3328]
    - [18, 24300.0]
  - - [1408, 5056, 1, 1280, 1408, 1408, 1408, 1280]
    - [28, 24346.0]
  - - [196, 1024, 64, 256, 196, 196, 196, 256]
    - [28, 17236.0]
  - - [6784, 5888, 1, 3328, 6784, 6784, 6784, 3328]
    - [21, 25465.0]
  - - [2368, 5056, 1, 1280, 2368, 2368, 2368, 1280]
    - [28, 24069.0]
  - - [1024, 5056, 1, 1280, 1024, 1024, 1024, 1280]
    - [35, 24056.0]
  - - [4288, 1024, 1, 256, 4288, 4288, 4288, 256]
    - [4, 21493.0]
  - - [2368, 1408, 1, 256, 2368, 2368, 2368, 256]
    - [3, 20420.0]
  - - [5888, 448, 1, 1280, 5888, 5888, 5888, 1280]
    - [17, 20824.0]
  - - [704, 5888, 1, 3328, 704, 704, 704, 3328]
    - [31, 22403.0]
  - - [1024, 6784, 1, 1280, 1024, 1024, 1024, 1280]
    - [18, 24052.0]
  - - [3584, 2944, 1, 1280, 3584, 3584, 3584, 1280]
    - [4, 24564.0]
  - - [512, 6000, 1, 2816, 512, 512, 512, 2816]
    - [24, 22863.0]
  - - [512, 24000, 1, 2048, 512, 512, 512, 2048]
    - [35, 24793.0]
  - - [1408, 5056, 1, 3328, 1408, 1408, 1408, 3328]
    - [31, 24715.0]
  - - [1856, 1856, 1, 3328, 1856, 1856, 1856, 3328]
    - [31, 21644.0]
  - - [2368, 2368, 1, 256, 2368, 2368, 2368, 256]
    - [10, 20962.0]
  - - [4288, 4288, 1, 1280, 4288, 4288, 4288, 1280]
    - [4, 24450.0]
  - - [5888, 1024, 1, 1280, 5888, 5888, 5888, 1280]
    - [4, 23997.0]
  - - [1024, 12544, 1, 256, 1024, 1024, 1024, 256]
    - [4, 24034.0]
  - - [512, 48000, 1, 2560, 512, 512, 512, 2560]
    - [10, 25354.0]
  - - [704, 6784, 1, 3328, 704, 704, 704, 3328]
    - [4, 22534.0]
  - - [5888, 5888, 1, 3328, 5888, 5888, 5888, 3328]
    - [16, 25589.0]
  - - [5056, 1024, 1, 1280, 5056, 5056, 5056, 1280]
    - [7, 23964.0]
  - - [448, 5888, 1, 3328, 448, 448, 448, 3328]
    - [31, 19767.0]
  - - [1024, 2944, 1, 1280, 1024, 1024, 1024, 1280]
    - [28, 22274.0]
  - - [5056, 5888, 1, 1280, 5056, 5056, 5056, 1280]
    - [16, 25089.0]
  - - [448, 6784, 1, 256, 448, 448, 448, 256]
    - [20, 17788.0]
  - - [3584, 5888, 1, 256, 3584, 3584, 3584, 256]
    - [18, 24574.0]
  - - [2944, 3584, 1, 256, 2944, 2944, 2944, 256]
    - [4, 23857.0]
  - - [3072, 1500, 1, 1024, 3072, 3072, 3072, 1024]
    - [18, 22749.0]
  - - [6784, 1024, 1, 3328, 6784, 6784, 6784, 3328]
    - [21, 24257.0]
  - - [6784, 2944, 1, 3328, 6784, 6784, 6784, 3328]
    - [4, 25378.0]
  - - [6784, 2368, 1, 1280, 6784, 6784, 6784, 1280]
    - [4, 24286.0]
  - - [4288, 3584, 1, 256, 4288, 4288, 4288, 256]
    - [4, 23706.0]
  - - [4288, 5888, 1, 1280, 4288, 4288, 4288, 1280]
    - [4, 24735.0]
  - - [1024, 6000, 1, 1536, 1024, 1024, 1024, 1536]
    - [23, 24225.0]
  - - [4288, 1856, 1, 1280, 4288, 4288, 4288, 1280]
    - [4, 23298.0]
  - - [1856, 2944, 1, 3328, 1856, 1856, 1856, 3328]
    - [21, 23144.0]
  - - [256, 6784, 1, 3328, 256, 256, 256, 3328]
    - [4, 20990.0]
  - - [512, 3000, 1, 1536, 512, 512, 512, 1536]
    - [35, 20569.0]
  - - [5056, 1024, 1, 256, 5056, 5056, 5056, 256]
    - [12, 21551.0]
  - - [5056, 1856, 1, 3328, 5056, 5056, 5056, 3328]
    - [18, 24018.0]
  - - [4096, 7000, 1, 4096, 4096, 4096, 4096, 4096]
    - [19, 25424.0]
  - - [5056, 256, 1, 3328, 5056, 5056, 5056, 3328]
    - [4, 21866.0]
  - - [1024, 5888, 1, 1280, 1024, 1024, 1024, 1280]
    - [28, 24041.0]
  - - [5056, 3584, 1, 256, 5056, 5056, 5056, 256]
    - [10, 23875.0]
  - - [1856, 1024, 1, 1280, 1856, 1856, 1856, 1280]
    - [4, 21984.0]
  - - [1856, 1856, 1, 1280, 1856, 1856, 1856, 1280]
    - [4, 21203.0]
  - - [3072, 24000, 1, 1024, 3072, 3072, 3072, 1024]
    - [19, 25452.0]
  - - [1856, 1024, 1, 3328, 1856, 1856, 1856, 3328]
    - [7, 22698.0]
  - - [6784, 1024, 1, 256, 6784, 6784, 6784, 256]
    - [18, 23138.0]
  - - [5056, 5888, 1, 3328, 5056, 5056, 5056, 3328]
    - [16, 25247.0]
  - - [1856, 1024, 1, 256, 1856, 1856, 1856, 256]
    - [6, 19170.0]
  - - [512, 48000, 1, 1536, 512, 512, 512, 1536]
    - [23, 25294.0]
  - - [5056, 1408, 1, 3328, 5056, 5056, 5056, 3328]
    - [28, 24647.0]
  - - [448, 5888, 1, 256, 448, 448, 448, 256]
    - [22, 17531.0]
  - - [1408, 6784, 1, 3328, 1408, 1408, 1408, 3328]
    - [28, 24531.0]
  - - [1024, 24000, 1, 2560, 1024, 1024, 1024, 2560]
    - [29, 25131.0]
  - - [2944, 1408, 1, 3328, 2944, 2944, 2944, 3328]
    - [4, 24004.0]
  - - [2944, 4288, 1, 3328, 2944, 2944, 2944, 3328]
    - [4, 24400.0]
  - - [5056, 2944, 1, 256, 5056, 5056, 5056, 256]
    - [18, 23557.0]
  - - [2368, 1856, 1, 256, 2368, 2368, 2368, 256]
    - [3, 20554.0]
  - - [1408, 3584, 1, 3328, 1408, 1408, 1408, 3328]
    - [7, 24108.0]
  - - [2368, 6784, 1, 256, 2368, 2368, 2368, 256]
    - [10, 23684.0]
  - - [4288, 2368, 1, 3328, 4288, 4288, 4288, 3328]
    - [28, 23715.0]
  - - [704, 3584, 1, 1280, 704, 704, 704, 1280]
    - [28, 20276.0]
  - - [1408, 5888, 1, 3328, 1408, 1408, 1408, 3328]
    - [31, 24571.0]
  - - [1856, 5056, 1, 256, 1856, 1856, 1856, 256]
    - [24, 21859.0]
  - - [6784, 6784, 1, 256, 6784, 6784, 6784, 256]
    - [4, 24957.0]
  - - [2368, 4288, 1, 1280, 2368, 2368, 2368, 1280]
    - [4, 23493.0]
  - - [3584, 1856, 1, 1280, 3584, 3584, 3584, 1280]
    - [18, 23846.0]
  - - [8448, 48000, 1, 2816, 8448, 8448, 8448, 2816]
    - [19, 25767.0]
  - - [512, 6000, 1, 2048, 512, 512, 512, 2048]
    - [36, 22414.0]
  - - [3584, 448, 1, 256, 3584, 3584, 3584, 256]
    - [14, 19280.0]
  - - [3584, 3584, 1, 1280, 3584, 3584, 3584, 1280]
    - [4, 24762.0]
  - - [256, 6784, 1, 256, 256, 256, 256, 256]
    - [3, 19432.0]
  - - [1856, 3584, 1, 3328, 1856, 1856, 1856, 3328]
    - [4, 24171.0]
  - - [3584, 3584, 1, 256, 3584, 3584, 3584, 256]
    - [23, 23992.0]
  - - [6784, 4288, 1, 1280, 6784, 6784, 6784, 1280]
    - [4, 24802.0]
  - - [3584, 5056, 1, 256, 3584, 3584, 3584, 256]
    - [18, 23782.0]
  - - [2944, 2368, 1, 1280, 2944, 2944, 2944, 1280]
    - [28, 23935.0]
  - - [6784, 3584, 1, 256, 6784, 6784, 6784, 256]
    - [4, 24678.0]
  - - [1856, 1408, 1, 256, 1856, 1856, 1856, 256]
    - [9, 19092.0]
  - - [2944, 2944, 1, 3328, 2944, 2944, 2944, 3328]
    - [18, 24668.0]
  - - [5056, 6784, 1, 256, 5056, 5056, 5056, 256]
    - [18, 24266.0]
  - - [1408, 4288, 1, 3328, 1408, 1408, 1408, 3328]
    - [18, 24126.0]
  - - [6784, 256, 1, 1280, 6784, 6784, 6784, 1280]
    - [13, 20691.0]
  - - [2368, 704, 1, 3328, 2368, 2368, 2368, 3328]
    - [31, 20153.0]
  - - [3584, 6784, 1, 256, 3584, 3584, 3584, 256]
    - [4, 24631.0]
  - - [5056, 1856, 1, 256, 5056, 5056, 5056, 256]
    - [23, 22548.0]
  - - [1024, 3000, 1, 2816, 1024, 1024, 1024, 2816]
    - [21, 22847.0]
  - - [704, 4288, 1, 256, 704, 704, 704, 256]
    - [3, 18712.0]
  - - [1408, 6784, 1, 1280, 1408, 1408, 1408, 1280]
    - [4, 24435.0]
  - - [7680, 24000, 1, 2560, 7680, 7680, 7680, 2560]
    - [19, 25695.0]
  - - [4608, 48000, 1, 1536, 4608, 4608, 4608, 1536]
    - [5, 25712.0]
  - - [1024, 24000, 1, 1536, 1024, 1024, 1024, 1536]
    - [19, 25030.0]
  - - [5056, 2368, 1, 3328, 5056, 5056, 5056, 3328]
    - [16, 24274.0]
  - - [2944, 4288, 1, 256, 2944, 2944, 2944, 256]
    - [23, 23160.0]
  - - [1408, 3584, 1, 1280, 1408, 1408, 1408, 1280]
    - [21, 23890.0]
  - - [1024, 1500, 1, 2816, 1024, 1024, 1024, 2816]
    - [18, 21479.0]
  - - [1024, 6000, 1, 2048, 1024, 1024, 1024, 2048]
    - [23, 24326.0]
  - - [512, 24000, 1, 2560, 512, 512, 512, 2560]
    - [23, 24804.0]
  - - [6144, 3000, 1, 2560, 6144, 6144, 6144, 2560]
    - [2, 24627.0]
  - - [2368, 6784, 1, 3328, 2368, 2368, 2368, 3328]
    - [18, 24370.0]
  - - [5056, 704, 1, 1280, 5056, 5056, 5056, 1280]
    - [3, 21601.0]
  - - [1856, 4288, 1, 3328, 1856, 1856, 1856, 3328]
    - [21, 23500.0]
  - - [1408, 5888, 1, 256, 1408, 1408, 1408, 256]
    - [4, 23519.0]
  - - [704, 2944, 1, 1280, 704, 704, 704, 1280]
    - [18, 20982.0]
  - - [3584, 704, 1, 1280, 3584, 3584, 3584, 1280]
    - [27, 21043.0]
  - - [5888, 5056, 1, 256, 5888, 5888, 5888, 256]
    - [10, 24206.0]
  - - [3584, 448, 1, 3328, 3584, 3584, 3584, 3328]
    - [27, 20932.0]
  - - [704, 2368, 1, 3328, 704, 704, 704, 3328]
    - [7, 20112.0]
  - - [448, 5056, 1, 3328, 448, 448, 448, 3328]
    - [21, 20924.0]
  - - [4288, 448, 1, 256, 4288, 4288, 4288, 256]
    - [0, 19270.0]
  - - [5888, 2368, 1, 256, 5888, 5888, 5888, 256]
    - [18, 23473.0]
  - - [6784, 704, 1, 3328, 6784, 6784, 6784, 3328]
    - [21, 22617.0]
  - - [1408, 2944, 1, 3328, 1408, 1408, 1408, 3328]
    - [4, 24017.0]
  - - [4288, 4288, 1, 256, 4288, 4288, 4288, 256]
    - [4, 23616.0]
  - - [2368, 704, 1, 256, 2368, 2368, 2368, 256]
    - [3, 18767.0]
  - - [3584, 2368, 1, 256, 3584, 3584, 3584, 256]
    - [23, 22599.0]
  - - [5888, 5056, 1, 1280, 5888, 5888, 5888, 1280]
    - [16, 25135.0]
  - - [8448, 24000, 1, 2816, 8448, 8448, 8448, 2816]
    - [29, 25636.0]
  - - [3584, 3584, 1, 3328, 3584, 3584, 3584, 3328]
    - [16, 24859.0]
  - - [3072, 1500, 1, 128, 3072, 3072, 3072, 128]
    - [33, 19338.0]
  - - [2048, 3136, 1, 512, 2048, 2048, 2048, 512]
    - [18, 22986.0]
  - - [5888, 6784, 1, 256, 5888, 5888, 5888, 256]
    - [26, 25004.0]
  - - [4288, 2944, 1, 3328, 4288, 4288, 4288, 3328]
    - [4, 24374.0]
  - - [256, 5056, 1, 1280, 256, 256, 256, 1280]
    - [17, 20735.0]
  - - [6784, 5888, 1, 1280, 6784, 6784, 6784, 1280]
    - [7, 25418.0]
  - - [5888, 4288, 1, 1280, 5888, 5888, 5888, 1280]
    - [4, 24752.0]
  - - [1024, 24000, 1, 2048, 1024, 1024, 1024, 2048]
    - [23, 25040.0]
  - - [1408, 1856, 1, 1280, 1408, 1408, 1408, 1280]
    - [27, 21619.0]
  - - [5888, 448, 1, 3328, 5888, 5888, 5888, 3328]
    - [17, 21025.0]
  - - [704, 5888, 1, 1280, 704, 704, 704, 1280]
    - [7, 21932.0]
  - - [5056, 2944, 1, 3328, 5056, 5056, 5056, 3328]
    - [16, 25014.0]
  - - [448, 4288, 1, 1280, 448, 448, 448, 1280]
    - [18, 19252.0]
  - - [3584, 704, 1, 256, 3584, 3584, 3584, 256]
    - [17, 20135.0]
  - - [3584, 1408, 1, 3328, 3584, 3584, 3584, 3328]
    - [18, 24011.0]
  - - [2368, 1024, 1, 1280, 2368, 2368, 2368, 1280]
    - [7, 21647.0]
  - - [2944, 6784, 1, 1280, 2944, 2944, 2944, 1280]
    - [28, 25288.0]
  - - [1856, 6784, 1, 256, 1856, 1856, 1856, 256]
    - [4, 22896.0]
  - - [4288, 448, 1, 3328, 4288, 4288, 4288, 3328]
    - [17, 21119.0]
  - - [6784, 704, 1, 1280, 6784, 6784, 6784, 1280]
    - [4, 22303.0]
  - - [5888, 1024, 1, 3328, 5888, 5888, 5888, 3328]
    - [4, 24229.0]
  - - [704, 6784, 1, 1280, 704, 704, 704, 1280]
    - [29, 21314.0]
  - - [512, 3000, 1, 2048, 512, 512, 512, 2048]
    - [35, 21061.0]
  - - [5056, 1024, 1, 3328, 5056, 5056, 5056, 3328]
    - [7, 24589.0]
  - - [704, 5056, 1, 1280, 704, 704, 704, 1280]
    - [28, 21801.0]
  - - [2944, 1856, 1, 256, 2944, 2944, 2944, 256]
    - [28, 21474.0]
  - - [5888, 5056, 1, 3328, 5888, 5888, 5888, 3328]
    - [16, 25254.0]
  - - [3584, 6784, 1, 1280, 3584, 3584, 3584, 1280]
    - [4, 25128.0]
  - - [1856, 5888, 1, 256, 1856, 1856, 1856, 256]
    - [4, 22616.0]
  - - [4288, 4288, 1, 3328, 4288, 4288, 4288, 3328]
    - [16, 24609.0]
  - - [4288, 1408, 1, 1280, 4288, 4288, 4288, 1280]
    - [18, 23703.0]
  - - [4288, 2368, 1, 256, 4288, 4288, 4288, 256]
    - [10, 22525.0]
  - - [2944, 5056, 1, 1280, 2944, 2944, 2944, 1280]
    - [18, 24889.0]
  - - [6784, 2368, 1, 3328, 6784, 6784, 6784, 3328]
    - [18, 24398.0]
  - - [4288, 1856, 1, 3328, 4288, 4288, 4288, 3328]
    - [4, 23498.0]
  - - [1856, 2944, 1, 1280, 1856, 1856, 1856, 1280]
    - [28, 22812.0]
  - - [4288, 6784, 1, 3328, 4288, 4288, 4288, 3328]
    - [4, 24852.0]
  - - [3584, 1024, 1, 1280, 3584, 3584, 3584, 1280]
    - [21, 22694.0]
  - - [1024, 4288, 1, 256, 1024, 1024, 1024, 256]
    - [17, 21370.0]
  - - [5888, 3584, 1, 3328, 5888, 5888, 5888, 3328]
    - [18, 25202.0]
  - - [5056, 3584, 1, 3328, 5056, 5056, 5056, 3328]
    - [16, 25085.0]
  - - [2368, 1408, 1, 1280, 2368, 2368, 2368, 1280]
    - [4, 22145.0]
  - - [5056, 2944, 1, 1280, 5056, 5056, 5056, 1280]
    - [28, 24848.0]
  - - [8448, 6000, 1, 2816, 8448, 8448, 8448, 2816]
    - [16, 25454.0]
  - - [1024, 6784, 1, 256, 1024, 1024, 1024, 256]
    - [18, 22511.0]
  - - [2944, 5056, 1, 3328, 2944, 2944, 2944, 3328]
    - [18, 25004.0]
  - - [3584, 2944, 1, 256, 3584, 3584, 3584, 256]
    - [4, 23431.0]
  - - [5056, 6784, 1, 3328, 5056, 5056, 5056, 3328]
    - [16, 25271.0]
  - - [3584, 4288, 1, 256, 3584, 3584, 3584, 256]
    - [35, 23269.0]
  - - [1856, 6784, 1, 3328, 1856, 1856, 1856, 3328]
    - [18, 24279.0]
  - - [512, 6000, 1, 1536, 512, 512, 512, 1536]
    - [8, 20910.0]
  - - [5056, 1408, 1, 1280, 5056, 5056, 5056, 1280]
    - [18, 24238.0]
  - - [5888, 5888, 1, 256, 5888, 5888, 5888, 256]
    - [4, 24849.0]
  - - [4288, 1024, 1, 1280, 4288, 4288, 4288, 1280]
    - [7, 23465.0]
  - - [448, 6784, 1, 3328, 448, 448, 448, 3328]
    - [4, 20429.0]
  - - [2944, 1408, 1, 1280, 2944, 2944, 2944, 1280]
    - [18, 23255.0]
  - - [3072, 6000, 1, 1024, 3072, 3072, 3072, 1024]
    - [18, 24777.0]
  - - [2944, 1856, 1, 3328, 2944, 2944, 2944, 3328]
    - [4, 23093.0]
  - - [448, 5056, 1, 256, 448, 448, 448, 256]
    - [17, 16107.0]
  - - [3584, 5888, 1, 1280, 3584, 3584, 3584, 1280]
    - [4, 25090.0]
  - - [6784, 1856, 1, 1280, 6784, 6784, 6784, 1280]
    - [18, 24125.0]
  - - [5888, 256, 1, 3328, 5888, 5888, 5888, 3328]
    - [4, 21256.0]
  - - [1856, 5888, 1, 3328, 1856, 1856, 1856, 3328]
    - [4, 24016.0]
  - - [3584, 1408, 1, 256, 3584, 3584, 3584, 256]
    - [4, 22436.0]
  - - [704, 3584, 1, 3328, 704, 704, 704, 3328]
    - [4, 20595.0]
  - - [5056, 448, 1, 1280, 5056, 5056, 5056, 1280]
    - [17, 20429.0]
  - - [3584, 1856, 1, 3328, 3584, 3584, 3584, 3328]
    - [28, 24070.0]
  - - [1024, 3000, 1, 2048, 1024, 1024, 1024, 2048]
    - [24, 22004.0]
  - - [2944, 1024, 1, 256, 2944, 2944, 2944, 256]
    - [0, 20098.0]
  - - [2368, 4288, 1, 3328, 2368, 2368, 2368, 3328]
    - [18, 23679.0]
  - - [1024, 1408, 1, 1280, 1024, 1024, 1024, 1280]
    - [25, 20343.0]
  - - [6784, 5056, 1, 256, 6784, 6784, 6784, 256]
    - [10, 24326.0]
  - - [4288, 5888, 1, 256, 4288, 4288, 4288, 256]
    - [4, 24080.0]
  - - [2944, 6784, 1, 256, 2944, 2944, 2944, 256]
    - [4, 24707.0]
  - - [2368, 2368, 1, 1280, 2368, 2368, 2368, 1280]
    - [4, 22275.0]
  - - [1856, 3584, 1, 1280, 1856, 1856, 1856, 1280]
    - [18, 23682.0]
  - - [3584, 1408, 1, 1280, 3584, 3584, 3584, 1280]
    - [18, 23658.0]
  - - [5056, 3584, 1, 1280, 5056, 5056, 5056, 1280]
    - [26, 24859.0]
  - - [256, 5888, 1, 256, 256, 256, 256, 256]
    - [30, 18393.0]
  - - [1856, 1408, 1, 3328, 1856, 1856, 1856, 3328]
    - [4, 21390.0]
  - - [1024, 4288, 1, 3328, 1024, 1024, 1024, 3328]
    - [35, 23512.0]
  - - [2944, 2368, 1, 3328, 2944, 2944, 2944, 3328]
    - [28, 24062.0]
  - - [704, 4288, 1, 3328, 704, 704, 704, 3328]
    - [4, 20316.0]
  - - [1024, 48000, 1, 2816, 1024, 1024, 1024, 2816]
    - [19, 25569.0]
  - - [1024, 1856, 1, 1280, 1024, 1024, 1024, 1280]
    - [18, 21106.0]
  - - [6784, 1856, 1, 256, 6784, 6784, 6784, 256]
    - [18, 23060.0]
  - - [512, 48000, 1, 2816, 512, 512, 512, 2816]
    - [18, 25392.0]
  - - [512, 3000, 1, 2816, 512, 512, 512, 2816]
    - [28, 20987.0]
  - - [1024, 5888, 1, 256, 1024, 1024, 1024, 256]
    - [23, 21727.0]
  - - [1408, 2368, 1, 256, 1408, 1408, 1408, 256]
    - [34, 19302.0]
  - - [2944, 704, 1, 3328, 2944, 2944, 2944, 3328]
    - [4, 21326.0]
  - - [2944, 2944, 1, 1280, 2944, 2944, 2944, 1280]
    - [18, 24499.0]
  - - [6784, 256, 1, 3328, 6784, 6784, 6784, 3328]
    - [7, 21190.0]
  - - [1408, 5056, 1, 256, 1408, 1408, 1408, 256]
    - [4, 21315.0]
  - - [512, 50176, 1, 128, 512, 512, 512, 128]
    - [28, 23128.0]
  - - [1408, 4288, 1, 256, 1408, 1408, 1408, 256]
    - [3, 21557.0]
  - - [5888, 2368, 1, 1280, 5888, 5888, 5888, 1280]
    - [4, 24343.0]
  - - [2368, 5888, 1, 1280, 2368, 2368, 2368, 1280]
    - [7, 24316.0]
  - - [5888, 256, 1, 1280, 5888, 5888, 5888, 1280]
    - [4, 20822.0]
  - - [2368, 1856, 1, 3328, 2368, 2368, 2368, 3328]
    - [10, 21952.0]
  - - [2944, 704, 1, 256, 2944, 2944, 2944, 256]
    - [0, 18146.0]
  - - [2368, 6784, 1, 1280, 2368, 2368, 2368, 1280]
    - [18, 24255.0]
  - - [2368, 1024, 1, 3328, 2368, 2368, 2368, 3328]
    - [4, 22189.0]
  - - [1856, 4288, 1, 1280, 1856, 1856, 1856, 1280]
    - [18, 23195.0]
  - - [704, 3584, 1, 256, 704, 704, 704, 256]
    - [22, 18465.0]
  - - [704, 2944, 1, 3328, 704, 704, 704, 3328]
    - [4, 21429.0]
  - - [1856, 5056, 1, 3328, 1856, 1856, 1856, 3328]
    - [31, 24005.0]
  - - [196, 256, 64, 1024, 196, 196, 196, 1024]
    - [12, 16157.0]
  - - [3584, 5056, 1, 1280, 3584, 3584, 3584, 1280]
    - [18, 24886.0]
  - - [2944, 1024, 1, 3328, 2944, 2944, 2944, 3328]
    - [7, 22657.0]
  - - [1408, 6784, 1, 256, 1408, 1408, 1408, 256]
    - [18, 23467.0]
  - - [6784, 1408, 1, 3328, 6784, 6784, 6784, 3328]
    - [4, 24509.0]
  - - [1024, 2368, 1, 1280, 1024, 1024, 1024, 1280]
    - [7, 21506.0]
  - - [6784, 2944, 1, 1280, 6784, 6784, 6784, 1280]
    - [18, 25271.0]
  - - [3584, 448, 1, 1280, 3584, 3584, 3584, 1280]
    - [3, 20606.0]
  - - [2944, 6784, 1, 3328, 2944, 2944, 2944, 3328]
    - [4, 25326.0]
  - - [448, 5056, 1, 1280, 448, 448, 448, 1280]
    - [18, 19777.0]
  - - [4288, 5056, 1, 1280, 4288, 4288, 4288, 1280]
    - [16, 24590.0]
  - - [4288, 704, 1, 256, 4288, 4288, 4288, 256]
    - [0, 20136.0]
  - - [5888, 704, 1, 256, 5888, 5888, 5888, 256]
    - [3, 20807.0]
  - - [256, 5888, 1, 3328, 256, 256, 256, 3328]
    - [4, 21267.0]
  - - [6784, 4288, 1, 256, 6784, 6784, 6784, 256]
    - [28, 24001.0]
  - - [5888, 256, 1, 256, 5888, 5888, 5888, 256]
    - [20, 18696.0]
  - - [6784, 1024, 1, 1280, 6784, 6784, 6784, 1280]
    - [31, 24040.0]
  - - [2944, 704, 1, 1280, 2944, 2944, 2944, 1280]
    - [17, 20985.0]
  - - [6784, 3584, 1, 1280, 6784, 6784, 6784, 1280]
    - [4, 25101.0]
  - - [1408, 2944, 1, 1280, 1408, 1408, 1408, 1280]
    - [18, 23678.0]
  - - [1408, 2368, 1, 3328, 1408, 1408, 1408, 3328]
    - [18, 22344.0]
  - - [2368, 2944, 1, 256, 2368, 2368, 2368, 256]
    - [18, 21297.0]
  - - [3584, 1856, 1, 256, 3584, 3584, 3584, 256]
    - [18, 21207.0]
  - - [4288, 3584, 1, 1280, 4288, 4288, 4288, 1280]
    - [4, 24581.0]
  - - [4288, 2944, 1, 1280, 4288, 4288, 4288, 1280]
    - [28, 24165.0]
  - - [5056, 448, 1, 3328, 5056, 5056, 5056, 3328]
    - [3, 21404.0]
  - - [5124, 1500, 1, 2048, 5124, 5124, 5124, 2048]
    - [23, 23324.0]
  - - [4288, 5056, 1, 3328, 4288, 4288, 4288, 3328]
    - [26, 24716.0]
  - - [256, 5056, 1, 3328, 256, 256, 256, 3328]
    - [6, 21138.0]
  - - [5056, 2368, 1, 256, 5056, 5056, 5056, 256]
    - [35, 22819.0]
  - - [4288, 704, 1, 3328, 4288, 4288, 4288, 3328]
    - [3, 21361.0]
  - - [448, 3584, 1, 256, 448, 448, 448, 256]
    - [17, 15969.0]
  - - [6144, 1500, 1, 2560, 6144, 6144, 6144, 2560]
    - [18, 24066.0]
  - - [1024, 1408, 1, 3328, 1024, 1024, 1024, 3328]
    - [3, 20729.0]
  - - [2944, 5888, 1, 1280, 2944, 2944, 2944, 1280]
    - [4, 25208.0]
  - - [5888, 3584, 1, 256, 5888, 5888, 5888, 256]
    - [10, 24451.0]
  - - [1408, 1856, 1, 3328, 1408, 1408, 1408, 3328]
    - [3, 21879.0]
  - - [7680, 6000, 1, 2560, 7680, 7680, 7680, 2560]
    - [23, 25338.0]
  - - [6784, 1408, 1, 1280, 6784, 6784, 6784, 1280]
    - [10, 24194.0]
  - - [512, 3000, 1, 2560, 512, 512, 512, 2560]
    - [10, 20457.0]
  - - [704, 2944, 1, 256, 704, 704, 704, 256]
    - [0, 17604.0]
  - - [2944, 5888, 1, 3328, 2944, 2944, 2944, 3328]
    - [18, 25259.0]
  - - [1024, 1500, 1, 1536, 1024, 1024, 1024, 1536]
    - [18, 19508.0]
  - - [1408, 1408, 1, 1280, 1408, 1408, 1408, 1280]
    - [28, 19881.0]
  - - [3072, 3000, 1, 1024, 3072, 3072, 3072, 1024]
    - [18, 24050.0]
  - - [448, 4288, 1, 3328, 448, 448, 448, 3328]
    - [4, 19802.0]
  - - [704, 2368, 1, 256, 704, 704, 704, 256]
    - [34, 15220.0]
  - - [5888, 2368, 1, 3328, 5888, 5888, 5888, 3328]
    - [2, 24443.0]
  - - [5124, 9124, 1, 1760, 5124, 5124, 5124, 1760]
    - [4, 24494.0]
  - - [4288, 5056, 1, 256, 4288, 4288, 4288, 256]
    - [18, 23444.0]
  - - [4288, 448, 1, 1280, 4288, 4288, 4288, 1280]
    - [3, 20849.0]
  - - [5888, 704, 1, 3328, 5888, 5888, 5888, 3328]
    - [4, 22277.0]
  - - [4288, 3584, 1, 3328, 4288, 4288, 4288, 3328]
    - [21, 24724.0]
  - - [1024, 6784, 1, 3328, 1024, 1024, 1024, 3328]
    - [4, 24073.0]
  - - [512, 3136, 1, 2048, 512, 512, 512, 2048]
    - [22, 20166.0]
  - - [1408, 1024, 1, 256, 1408, 1408, 1408, 256]
    - [22, 16947.0]
  - - [8448, 1500, 1, 2816, 8448, 8448, 8448, 2816]
    - [26, 24350.0]
  - - [2560, 7000, 1, 2560, 2560, 2560, 2560, 2560]
    - [23, 25058.0]
  - - [6784, 6784, 1, 3328, 6784, 6784, 6784, 3328]
    - [23, 25359.0]
  - - [704, 5056, 1, 3328, 704, 704, 704, 3328]
    - [7, 22110.0]
  - - [3584, 5056, 1, 3328, 3584, 3584, 3584, 3328]
    - [16, 25015.0]
  - - [2368, 2944, 1, 3328, 2368, 2368, 2368, 3328]
    - [28, 24123.0]
  - - [2368, 3584, 1, 256, 2368, 2368, 2368, 256]
    - [4, 22297.0]
  - - [4608, 3000, 1, 1536, 4608, 4608, 4608, 1536]
    - [28, 24170.0]
  - - [5124, 9124, 1, 4096, 5124, 5124, 5124, 4096]
    - [35, 24558.0]
  - - [7680, 48000, 1, 2560, 7680, 7680, 7680, 2560]
    - [19, 25758.0]
  - - [4608, 1500, 1, 1536, 4608, 4608, 4608, 1536]
    - [28, 23717.0]
  - - [3584, 2368, 1, 1280, 3584, 3584, 3584, 1280]
    - [18, 23928.0]
  - - [5124, 9124, 1, 2560, 5124, 5124, 5124, 2560]
    - [4, 24583.0]
  - - [1856, 1856, 1, 256, 1856, 1856, 1856, 256]
    - [14, 19755.0]
  - - [4288, 1408, 1, 3328, 4288, 4288, 4288, 3328]
    - [4, 24207.0]
  - - [5124, 9124, 1, 2048, 5124, 5124, 5124, 2048]
    - [4, 24556.0]
  - - [5124, 700, 1, 2048, 5124, 5124, 5124, 2048]
    - [17, 21032.0]
  - - [256, 12544, 1, 1024, 256, 256, 256, 1024]
    - [24, 23525.0]
  - - [5888, 1408, 1, 3328, 5888, 5888, 5888, 3328]
    - [18, 24501.0]
  - - [256, 5056, 1, 256, 256, 256, 256, 256]
    - [22, 18999.0]
  - - [2368, 5056, 1, 256, 2368, 2368, 2368, 256]
    - [28, 22785.0]
  - - [1024, 6000, 1, 2560, 1024, 1024, 1024, 2560]
    - [35, 24437.0]
  - - [1024, 5056, 1, 256, 1024, 1024, 1024, 256]
    - [18, 22164.0]
  - - [4224, 1500, 1, 176, 4224, 4224, 4224, 176]
    - [1, 21355.0]
  - - [2368, 1408, 1, 3328, 2368, 2368, 2368, 3328]
    - [18, 22629.0]
  - - [1024, 48000, 1, 1536, 1024, 1024, 1024, 1536]
    - [19, 25587.0]
  - - [5888, 448, 1, 256, 5888, 5888, 5888, 256]
    - [14, 19757.0]
  - - [6784, 5056, 1, 1280, 6784, 6784, 6784, 1280]
    - [4, 25091.0]
  - - [1024, 48000, 1, 2560, 1024, 1024, 1024, 2560]
    - [19, 25654.0]
  - - [4288, 6784, 1, 1280, 4288, 4288, 4288, 1280]
    - [28, 24779.0]
  - - [3072, 48000, 1, 1024, 3072, 3072, 3072, 1024]
    - [5, 25674.0]
  - - [6784, 1408, 1, 256, 6784, 6784, 6784, 256]
    - [4, 23218.0]
  - - [5888, 4288, 1, 256, 5888, 5888, 5888, 256]
    - [28, 24072.0]
  - - [5056, 5888, 1, 256, 5056, 5056, 5056, 256]
    - [4, 24391.0]
  - - [2368, 1024, 1, 256, 2368, 2368, 2368, 256]
    - [6, 19619.0]
  - - [1856, 6784, 1, 1280, 1856, 1856, 1856, 1280]
    - [28, 24122.0]
  - - [8448, 3000, 1, 2816, 8448, 8448, 8448, 2816]
    - [2, 24712.0]
  - - [6784, 448, 1, 3328, 6784, 6784, 6784, 3328]
    - [27, 21614.0]
  - - [5056, 1856, 1, 1280, 5056, 5056, 5056, 1280]
    - [18, 23812.0]
  - - [1408, 1024, 1, 3328, 1408, 1408, 1408, 3328]
    - [17, 21185.0]
  - - [7680, 1500, 1, 2560, 7680, 7680, 7680, 2560]
    - [23, 24576.0]
  - - [5888, 3584, 1, 1280, 5888, 5888, 5888, 1280]
    - [18, 25121.0]
  - - [1024, 2944, 1, 256, 1024, 1024, 1024, 256]
    - [4, 20352.0]
  - - [448, 6784, 1, 1280, 448, 448, 448, 1280]
    - [18, 20255.0]
  - - [704, 5056, 1, 256, 704, 704, 704, 256]
    - [30, 19297.0]
  - - [3584, 1024, 1, 3328, 3584, 3584, 3584, 3328]
    - [7, 23193.0]
  - - [2944, 1856, 1, 1280, 2944, 2944, 2944, 1280]
    - [4, 22897.0]
  - - [5056, 256, 1, 256, 5056, 5056, 5056, 256]
    - [3, 18805.0]
  - - [2368, 3584, 1, 3328, 2368, 2368, 2368, 3328]
    - [28, 24120.0]
  - - [3584, 5888, 1, 3328, 3584, 3584, 3584, 3328]
    - [4, 25203.0]
  - - [2944, 3584, 1, 1280, 2944, 2944, 2944, 1280]
    - [18, 24488.0]
  - - [1856, 5888, 1, 1280, 1856, 1856, 1856, 1280]
    - [4, 23925.0]
  - - [4608, 24000, 1, 1536, 4608, 4608, 4608, 1536]
    - [5, 25522.0]
  - - [4288, 1408, 1, 256, 4288, 4288, 4288, 256]
    - [10, 21593.0]
  - - [4288, 2368, 1, 1280, 4288, 4288, 4288, 1280]
    - [4, 23589.0]
  - - [2944, 5056, 1, 256, 2944, 2944, 2944, 256]
    - [4, 23879.0]
  - - [6784, 2368, 1, 256, 6784, 6784, 6784, 256]
    - [28, 23567.0]
  - - [1024, 24000, 1, 2816, 1024, 1024, 1024, 2816]
    - [16, 25166.0]
  - - [4288, 1856, 1, 256, 4288, 4288, 4288, 256]
    - [4, 21647.0]
  - - [1856, 2944, 1, 256, 1856, 1856, 1856, 256]
    - [18, 21220.0]
  - - [4608, 6000, 1, 1536, 4608, 4608, 4608, 1536]
    - [18, 25204.0]
  - - [7680, 3000, 1, 2560, 7680, 7680, 7680, 2560]
    - [2, 24880.0]
  - - [5124, 700, 1, 2560, 5124, 5124, 5124, 2560]
    - [27, 21063.0]
  - - [1856, 1408, 1, 1280, 1856, 1856, 1856, 1280]
    - [10, 20768.0]
  - - [1024, 4288, 1, 1280, 1024, 1024, 1024, 1280]
    - [18, 23196.0]
  - - [2368, 5056, 1, 3328, 2368, 2368, 2368, 3328]
    - [21, 24307.0]
  - - [4288, 1024, 1, 3328, 4288, 4288, 4288, 3328]
    - [7, 23814.0]
  - - [6144, 48000, 1, 2560, 6144, 6144, 6144, 2560]
    - [19, 25755.0]
  - - [1024, 5056, 1, 3328, 1024, 1024, 1024, 3328]
    - [21, 24496.0]
  - - [1024, 1856, 1, 3328, 1024, 1024, 1024, 3328]
    - [28, 22602.0]
  - - [5124, 1500, 1, 2560, 5124, 5124, 5124, 2560]
    - [18, 23492.0]
  - - [3584, 2944, 1, 3328, 3584, 3584, 3584, 3328]
    - [28, 24655.0]
  - - [5888, 2944, 1, 256, 5888, 5888, 5888, 256]
    - [18, 24528.0]
  - - [5056, 4288, 1, 256, 5056, 5056, 5056, 256]
    - [28, 23874.0]
  - - [1024, 3584, 1, 256, 1024, 1024, 1024, 256]
    - [35, 21363.0]
  - - [5056, 1408, 1, 256, 5056, 5056, 5056, 256]
    - [4, 22718.0]
  - - [5888, 5888, 1, 1280, 5888, 5888, 5888, 1280]
    - [16, 25519.0]
  - - [448, 5888, 1, 1280, 448, 448, 448, 1280]
    - [21, 19104.0]
  - - [1024, 3000, 1, 2560, 1024, 1024, 1024, 2560]
    - [24, 22719.0]
  - - [4288, 704, 1, 1280, 4288, 4288, 4288, 1280]
    - [17, 21025.0]
  - - [2944, 1408, 1, 256, 2944, 2944, 2944, 256]
    - [18, 22588.0]
  - - [2368, 5888, 1, 3328, 2368, 2368, 2368, 3328]
    - [21, 24505.0]
  - - [2368, 1856, 1, 1280, 2368, 2368, 2368, 1280]
    - [28, 21861.0]
  - - [1024, 6000, 1, 2816, 1024, 1024, 1024, 2816]
    - [28, 24514.0]
  - - [5888, 4288, 1, 3328, 5888, 5888, 5888, 3328]
    - [18, 24853.0]
  - - [5056, 448, 1, 256, 5056, 5056, 5056, 256]
    - [0, 19550.0]
  - - [1856, 5056, 1, 1280, 1856, 1856, 1856, 1280]
    - [18, 23836.0]
  - - [2944, 1024, 1, 1280, 2944, 2944, 2944, 1280]
    - [21, 22456.0]
  - - [2368, 4288, 1, 256, 2368, 2368, 2368, 256]
    - [4, 22518.0]
  - - [1024, 2368, 1, 3328, 1024, 1024, 1024, 3328]
    - [21, 22456.0]
  - - [4288, 5888, 1, 3328, 4288, 4288, 4288, 3328]
    - [4, 24836.0]
  - - [1024, 2944, 1, 3328, 1024, 1024, 1024, 3328]
    - [28, 22497.0]
  - - [256, 6784, 1, 1280, 256, 256, 256, 1280]
    - [22, 20671.0]
  - - [1856, 3584, 1, 256, 1856, 1856, 1856, 256]
    - [10, 22115.0]
  - - [1024, 1500, 1, 2048, 1024, 1024, 1024, 2048]
    - [35, 21127.0]
  - - [512, 24000, 1, 2816, 512, 512, 512, 2816]
    - [18, 24896.0]
  - - [256, 5888, 1, 1280, 256, 256, 256, 1280]
    - [10, 20530.0]
  - - [2944, 2368, 1, 256, 2944, 2944, 2944, 256]
    - [23, 22398.0]
  - - [1024, 1856, 1, 256, 1024, 1024, 1024, 256]
    - [3, 19730.0]
  - - [6784, 3584, 1, 3328, 6784, 6784, 6784, 3328]
    - [4, 25204.0]
  - - [1760, 7000, 1, 1760, 1760, 1760, 1760, 1760]
    - [4, 24254.0]
  - - [1024, 5888, 1, 3328, 1024, 1024, 1024, 3328]
    - [4, 24222.0]
  - - [1408, 2368, 1, 1280, 1408, 1408, 1408, 1280]
    - [28, 22158.0]
  - - [2944, 2944, 1, 256, 2944, 2944, 2944, 256]
    - [4, 23705.0]
  - - [6784, 256, 1, 256, 6784, 6784, 6784, 256]
    - [27, 19500.0]
  - - [1024, 3000, 1, 1536, 1024, 1024, 1024, 1536]
    - [23, 22534.0]
  - - [5888, 1408, 1, 256, 5888, 5888, 5888, 256]
    - [4, 23623.0]
  - - [5888, 6784, 1, 3328, 5888, 5888, 5888, 3328]
    - [19, 25646.0]
  - - [704, 4288, 1, 1280, 704, 704, 704, 1280]
    - [28, 20033.0]
  - - [128, 50176, 1, 512, 128, 128, 128, 512]
    - [24, 23787.0]
  - - [1024, 48000, 1, 2048, 1024, 1024, 1024, 2048]
    - [11, 25592.0]
  - - [784, 512, 64, 128, 784, 784, 784, 128]
    - [15, 20568.0]
  - - [3136, 256, 64, 64, 3136, 3136, 3136, 64]
    - [0, 20836.0]
  - - [12544, 1024, 1, 256, 12544, 12544, 12544, 256]
    - [15, 23760.0]
  - - [784, 128, 128, 512, 784, 784, 784, 512]
    - [32, 19076.0]
  - - [784, 512, 256, 128, 784, 784, 784, 128]
    - [4, 21187.0]
  - - [3136, 512, 1, 2048, 3136, 3136, 3136, 2048]
    - [4, 21603.0]
  - - [12544, 256, 1, 1024, 12544, 12544, 12544, 1024]
    - [31, 23559.0]
  - - [3136, 2048, 1, 512, 3136, 3136, 3136, 512]
    - [21, 23322.0]
  - - [3136, 256, 256, 64, 3136, 3136, 3136, 64]
    - [0, 16139.0]
  - - [784, 128, 64, 512, 784, 784, 784, 512]
    - [35, 20281.0]
  - - [784, 512, 128, 128, 784, 784, 784, 128]
    - [28, 20889.0]
  - - [784, 128, 256, 512, 784, 784, 784, 512]
    - [18, 19807.0]
  - - [3136, 256, 128, 64, 3136, 3136, 3136, 64]
    - [0, 18150.0]
  - - [1024, 1024, 1, 3328, 1024, 1024, 1024, 3328]
    - [40, 19323.0]
  - - [128, 6784, 1, 3328, 128, 128, 128, 3328]
    - [41, 19336.0]
  - - [256, 4288, 1, 3328, 256, 256, 256, 3328]
    - [40, 20380.0]
  - - [704, 1856, 1, 3328, 704, 704, 704, 3328]
    - [40, 19188.0]
  - - [448, 1024, 1, 1280, 448, 448, 448, 1280]
    - [39, 16275.0]
  - - [1024, 704, 1, 256, 1024, 1024, 1024, 256]
    - [43, 14955.0]
  - - [256, 1856, 1, 1280, 256, 256, 256, 1280]
    - [38, 17762.0]
  - - [256, 2944, 1, 3328, 256, 256, 256, 3328]
    - [38, 18976.0]
  - - [128, 3584, 1, 1280, 128, 128, 128, 1280]
    - [54, 16806.0]
  - - [4288, 256, 1, 256, 4288, 4288, 4288, 256]
    - [38, 17011.0]
  - - [5888, 64, 1, 3328, 5888, 5888, 5888, 3328]
    - [40, 14838.0]
  - - [2944, 256, 1, 3328, 2944, 2944, 2944, 3328]
    - [57, 18981.0]
  - - [1408, 448, 1, 1280, 1408, 1408, 1408, 1280]
    - [38, 18655.0]
  - - [1408, 256, 1, 1280, 1408, 1408, 1408, 1280]
    - [38, 13715.0]
  - - [3072, 128, 1, 1024, 3072, 3072, 3072, 1024]
    - [38, 14631.0]
  - - [6784, 64, 1, 256, 6784, 6784, 6784, 256]
    - [45, 11319.0]
  - - [2368, 128, 1, 3328, 2368, 2368, 2368, 3328]
    - [51, 16052.0]
  - - [2944, 128, 1, 256, 2944, 2944, 2944, 256]
    - [38, 11114.0]
  - - [448, 1408, 1, 256, 448, 448, 448, 256]
    - [56, 13547.0]
  - - [64, 5056, 1, 3328, 64, 64, 64, 3328]
    - [53, 15851.0]
  - - [512, 1500, 1, 2816, 512, 512, 512, 2816]
    - [38, 18978.0]
  - - [256, 3584, 1, 3328, 256, 256, 256, 3328]
    - [51, 20414.0]
  - - [256, 1408, 1, 256, 256, 256, 256, 256]
    - [52, 10558.0]
  - - [5056, 64, 1, 1280, 5056, 5056, 5056, 1280]
    - [56, 15039.0]
  - - [2368, 128, 1, 256, 2368, 2368, 2368, 256]
    - [39, 8898.0]
  - - [4288, 128, 1, 1280, 4288, 4288, 4288, 1280]
    - [38, 16293.0]
  - - [5888, 64, 1, 256, 5888, 5888, 5888, 256]
    - [55, 10395.0]
  - - [1856, 256, 1, 1280, 1856, 1856, 1856, 1280]
    - [38, 17307.0]
  - - [64, 5888, 1, 3328, 64, 64, 64, 3328]
    - [44, 14148.0]
  - - [1024, 704, 1, 1280, 1024, 1024, 1024, 1280]
    - [38, 17766.0]
  - - [256, 1408, 1, 3328, 256, 256, 256, 3328]
    - [40, 14257.0]
  - - [6784, 128, 1, 3328, 6784, 6784, 6784, 3328]
    - [41, 19338.0]
  - - [704, 704, 1, 3328, 704, 704, 704, 3328]
    - [49, 15748.0]
  - - [3584, 256, 1, 3328, 3584, 3584, 3584, 3328]
    - [58, 20422.0]
  - - [128, 3584, 1, 3328, 128, 128, 128, 3328]
    - [50, 17873.0]
  - - [128, 2944, 1, 1280, 128, 128, 128, 1280]
    - [52, 14087.0]
  - - [448, 1856, 1, 1280, 448, 448, 448, 1280]
    - [56, 18051.0]
  - - [3584, 128, 1, 256, 3584, 3584, 3584, 256]
    - [38, 12849.0]
  - - [448, 1408, 1, 3328, 448, 448, 448, 3328]
    - [56, 17541.0]
  - - [704, 1024, 1, 256, 704, 704, 704, 256]
    - [43, 14262.0]
  - - [256, 3584, 1, 256, 256, 256, 256, 256]
    - [38, 16777.0]
  - - [1408, 704, 1, 256, 1408, 1408, 1408, 256]
    - [48, 16478.0]
  - - [448, 2944, 1, 3328, 448, 448, 448, 3328]
    - [41, 18084.0]
  - - [64, 5888, 1, 256, 64, 64, 64, 256]
    - [53, 9551.0]
  - - [512, 1500, 1, 2048, 512, 512, 512, 2048]
    - [62, 18596.0]
  - - [448, 2368, 1, 1280, 448, 448, 448, 1280]
    - [51, 17298.0]
  - - [704, 704, 1, 256, 704, 704, 704, 256]
    - [38, 11662.0]
  - - [64, 193600, 1, 64, 64, 64, 64, 64]
    - [49, 16694.0]
  - - [128, 4288, 1, 3328, 128, 128, 128, 3328]
    - [51, 17317.0]
  - - [256, 2368, 1, 256, 256, 256, 256, 256]
    - [48, 14585.0]
  - - [1024, 448, 1, 3328, 1024, 1024, 1024, 3328]
    - [50, 17924.0]
  - - [1856, 704, 1, 1280, 1856, 1856, 1856, 1280]
    - [45, 18830.0]
  - - [1024, 1024, 1, 1280, 1024, 1024, 1024, 1280]
    - [56, 19384.0]
  - - [256, 2944, 1, 256, 256, 256, 256, 256]
    - [38, 15789.0]
  - - [1024, 700, 1, 512, 1024, 1024, 1024, 512]
    - [52, 15498.0]
  - - [128, 6784, 1, 1280, 128, 128, 128, 1280]
    - [46, 18649.0]
  - - [1408, 704, 1, 3328, 1408, 1408, 1408, 3328]
    - [56, 18709.0]
  - - [128, 5888, 1, 1280, 128, 128, 128, 1280]
    - [45, 18278.0]
  - - [704, 1408, 1, 3328, 704, 704, 704, 3328]
    - [56, 18392.0]
  - - [7680, 64, 1, 2560, 7680, 7680, 7680, 2560]
    - [50, 18888.0]
  - - [448, 704, 1, 1280, 448, 448, 448, 1280]
    - [39, 14490.0]
  - - [6784, 128, 1, 256, 6784, 6784, 6784, 256]
    - [38, 16016.0]
  - - [704, 448, 1, 256, 704, 704, 704, 256]
    - [39, 9238.0]
  - - [256, 1856, 1, 3328, 256, 256, 256, 3328]
    - [40, 18551.0]
  - - [1024, 704, 1, 3328, 1024, 1024, 1024, 3328]
    - [40, 18206.0]
  - - [128, 4288, 1, 256, 128, 128, 128, 256]
    - [60, 13181.0]
  - - [64, 6784, 1, 3328, 64, 64, 64, 3328]
    - [44, 15607.0]
  - - [2944, 256, 1, 1280, 2944, 2944, 2944, 1280]
    - [57, 18340.0]
  - - [1856, 704, 1, 256, 1856, 1856, 1856, 256]
    - [39, 17207.0]
  - - [704, 1856, 1, 256, 704, 704, 704, 256]
    - [43, 16175.0]
  - - [2944, 448, 1, 256, 2944, 2944, 2944, 256]
    - [38, 17827.0]
  - - [2368, 128, 1, 1280, 2368, 2368, 2368, 1280]
    - [53, 14531.0]
  - - [64, 6784, 1, 256, 64, 64, 64, 256]
    - [44, 10876.0]
  - - [64, 5056, 1, 1280, 64, 64, 64, 1280]
    - [53, 14656.0]
  - - [704, 448, 1, 3328, 704, 704, 704, 3328]
    - [49, 15666.0]
  - - [2368, 256, 1, 1280, 2368, 2368, 2368, 1280]
    - [58, 17539.0]
  - - [2368, 448, 1, 1280, 2368, 2368, 2368, 1280]
    - [40, 18849.0]
  - - [128, 3584, 1, 256, 128, 128, 128, 256]
    - [43, 12906.0]
  - - [1856, 448, 1, 3328, 1856, 1856, 1856, 3328]
    - [51, 18232.0]
  - - [128, 5056, 1, 256, 128, 128, 128, 256]
    - [52, 15284.0]
  - - [4288, 256, 1, 1280, 4288, 4288, 4288, 1280]
    - [40, 19445.0]
  - - [4288, 128, 1, 3328, 4288, 4288, 4288, 3328]
    - [58, 17370.0]
  - - [7680, 128, 1, 2560, 7680, 7680, 7680, 2560]
    - [58, 21590.0]
  - - [448, 2368, 1, 3328, 448, 448, 448, 3328]
    - [41, 17836.0]
  - - [256, 1408, 1, 1280, 256, 256, 256, 1280]
    - [38, 13674.0]
  - - [128, 2368, 1, 256, 128, 128, 128, 256]
    - [43, 10318.0]
  - - [6784, 64, 1, 3328, 6784, 6784, 6784, 3328]
    - [50, 17007.0]
  - - [128, 2944, 1, 3328, 128, 128, 128, 3328]
    - [45, 14827.0]
  - - [2944, 448, 1, 3328, 2944, 2944, 2944, 3328]
    - [57, 19436.0]
  - - [5888, 128, 1, 256, 5888, 5888, 5888, 256]
    - [38, 15737.0]
  - - [5056, 64, 1, 256, 5056, 5056, 5056, 256]
    - [61, 9266.0]
  - - [512, 1500, 1, 1536, 512, 512, 512, 1536]
    - [60, 18369.0]
  - - [128, 5056, 1, 3328, 128, 128, 128, 3328]
    - [58, 20200.0]
  - - [256, 4288, 1, 1280, 256, 256, 256, 1280]
    - [40, 19857.0]
  - - [4288, 128, 1, 256, 4288, 4288, 4288, 256]
    - [38, 12456.0]
  - - [3584, 256, 1, 256, 3584, 3584, 3584, 256]
    - [38, 16564.0]
  - - [128, 2944, 1, 256, 128, 128, 128, 256]
    - [43, 10815.0]
  - - [3584, 128, 1, 3328, 3584, 3584, 3584, 3328]
    - [50, 17890.0]
  - - [5888, 128, 1, 3328, 5888, 5888, 5888, 3328]
    - [50, 18990.0]
  - - [64, 193600, 1, 256, 64, 64, 64, 256]
    - [47, 15387.0]
  - - [1408, 704, 1, 1280, 1408, 1408, 1408, 1280]
    - [38, 17880.0]
  - - [448, 1408, 1, 1280, 448, 448, 448, 1280]
    - [39, 16744.0]
  - - [704, 1408, 1, 1280, 704, 704, 704, 1280]
    - [48, 17905.0]
  - - [448, 2944, 1, 256, 448, 448, 448, 256]
    - [56, 17174.0]
  - - [448, 2368, 1, 256, 448, 448, 448, 256]
    - [39, 15644.0]
  - - [64, 6784, 1, 1280, 64, 64, 64, 1280]
    - [56, 14836.0]
  - - [128, 2368, 1, 3328, 128, 128, 128, 3328]
    - [57, 15991.0]
  - - [5056, 64, 1, 3328, 5056, 5056, 5056, 3328]
    - [50, 16376.0]
  - - [5056, 128, 1, 3328, 5056, 5056, 5056, 3328]
    - [58, 20307.0]
  - - [448, 704, 1, 256, 448, 448, 448, 256]
    - [39, 9072.0]
  - - [1856, 256, 1, 3328, 1856, 1856, 1856, 3328]
    - [57, 17997.0]
  - - [2944, 128, 1, 3328, 2944, 2944, 2944, 3328]
    - [50, 14862.0]
  - - [1024, 1024, 1, 256, 1024, 1024, 1024, 256]
    - [39, 17033.0]
  - - [704, 1024, 1, 1280, 704, 704, 704, 1280]
    - [38, 17496.0]
  - - [256, 4288, 1, 256, 256, 256, 256, 256]
    - [38, 17831.0]
  - - [2368, 256, 1, 256, 2368, 2368, 2368, 256]
    - [38, 13332.0]
  - - [256, 2368, 1, 3328, 256, 256, 256, 3328]
    - [58, 19029.0]
  - - [704, 448, 1, 1280, 704, 704, 704, 1280]
    - [56, 14439.0]
  - - [256, 1856, 1, 256, 256, 256, 256, 256]
    - [52, 13545.0]
  - - [64, 5056, 1, 256, 64, 64, 64, 256]
    - [53, 9004.0]
  - - [1408, 256, 1, 3328, 1408, 1408, 1408, 3328]
    - [40, 14257.0]
  - - [2368, 448, 1, 256, 2368, 2368, 2368, 256]
    - [38, 16459.0]
  - - [4288, 256, 1, 3328, 4288, 4288, 4288, 3328]
    - [50, 20097.0]
  - - [2944, 256, 1, 256, 2944, 2944, 2944, 256]
    - [38, 15763.0]
  - - [6784, 64, 1, 1280, 6784, 6784, 6784, 1280]
    - [40, 15942.0]
  - - [704, 1856, 1, 1280, 704, 704, 704, 1280]
    - [40, 18758.0]
  - - [448, 1024, 1, 3328, 448, 448, 448, 3328]
    - [53, 16881.0]
  - - [2944, 448, 1, 1280, 2944, 2944, 2944, 1280]
    - [57, 19136.0]
  - - [448, 1024, 1, 256, 448, 448, 448, 256]
    - [56, 11628.0]
  - - [1024, 448, 1, 1280, 1024, 1024, 1024, 1280]
    - [38, 17170.0]
  - - [256, 2368, 1, 1280, 256, 256, 256, 1280]
    - [38, 18037.0]
  - - [128, 5056, 1, 1280, 128, 128, 128, 1280]
    - [45, 18844.0]
  - - [1408, 256, 1, 256, 1408, 1408, 1408, 256]
    - [52, 10415.0]
  - - [128, 5888, 1, 3328, 128, 128, 128, 3328]
    - [57, 18927.0]
  - - [2368, 448, 1, 3328, 2368, 2368, 2368, 3328]
    - [50, 19448.0]
  - - [3584, 128, 1, 1280, 3584, 3584, 3584, 1280]
    - [52, 16883.0]
  - - [1408, 448, 1, 256, 1408, 1408, 1408, 256]
    - [52, 15148.0]
  - - [2368, 256, 1, 3328, 2368, 2368, 2368, 3328]
    - [51, 19069.0]
  - - [5888, 128, 1, 1280, 5888, 5888, 5888, 1280]
    - [57, 18298.0]
  - - [256, 3584, 1, 1280, 256, 256, 256, 1280]
    - [51, 19758.0]
  - - [128, 5888, 1, 256, 128, 128, 128, 256]
    - [43, 15460.0]
  - - [1024, 1024, 1, 1024, 1024, 1024, 1024, 1024]
    - [45, 18838.0]
  - - [1408, 448, 1, 3328, 1408, 1408, 1408, 3328]
    - [40, 19327.0]
  - - [64, 5888, 1, 1280, 64, 64, 64, 1280]
    - [53, 13186.0]
  - - [704, 704, 1, 1280, 704, 704, 704, 1280]
    - [39, 15177.0]
  - - [128, 2368, 1, 1280, 128, 128, 128, 1280]
    - [45, 14640.0]
  - - [3584, 256, 1, 1280, 3584, 3584, 3584, 1280]
    - [58, 19791.0]
  - - [5888, 64, 1, 1280, 5888, 5888, 5888, 1280]
    - [45, 13957.0]
  - - [5056, 128, 1, 1280, 5056, 5056, 5056, 1280]
    - [38, 19008.0]
  - - [448, 1856, 1, 3328, 448, 448, 448, 3328]
    - [41, 18215.0]
  - - [1024, 448, 1, 256, 1024, 1024, 1024, 256]
    - [48, 13020.0]
  - - [2944, 128, 1, 1280, 2944, 2944, 2944, 1280]
    - [38, 14347.0]
  - - [256, 2944, 1, 1280, 256, 256, 256, 1280]
    - [38, 18466.0]
  - - [2560, 128, 1, 2560, 2560, 2560, 2560, 2560]
    - [40, 16926.0]
  - - [704, 1024, 1, 3328, 704, 704, 704, 3328]
    - [40, 18022.0]
  - - [1856, 448, 1, 1280, 1856, 1856, 1856, 1280]
    - [39, 18051.0]
  - - [128, 6784, 1, 256, 128, 128, 128, 256]
    - [52, 15480.0]
  - - [704, 1408, 1, 256, 704, 704, 704, 256]
    - [39, 16040.0]
  - - [4096, 128, 1, 4096, 4096, 4096, 4096, 4096]
    - [41, 17084.0]
  - - [448, 2944, 1, 1280, 448, 448, 448, 1280]
    - [56, 18613.0]
  - - [1856, 256, 1, 256, 1856, 1856, 1856, 256]
    - [38, 12212.0]
  - - [5056, 128, 1, 256, 5056, 5056, 5056, 256]
    - [38, 14953.0]
  - - [6784, 128, 1, 1280, 6784, 6784, 6784, 1280]
    - [41, 18782.0]
  - - [1856, 448, 1, 256, 1856, 1856, 1856, 256]
    - [38, 14823.0]
  - - [128, 4288, 1, 1280, 128, 128, 128, 1280]
    - [60, 16255.0]
  - - [448, 704, 1, 3328, 448, 448, 448, 3328]
    - [49, 15680.0]
  - - [448, 1856, 1, 256, 448, 448, 448, 256]
    - [56, 15161.0]
  - - [1856, 704, 1, 3328, 1856, 1856, 1856, 3328]
    - [40, 19212.0]
  - - [512, 1500, 1, 2560, 512, 512, 512, 2560]
    - [57, 18850.0]
  - - [3136, 64, 128, 64, 3136, 3136, 3136, 64]
    - [50, 18334.0]
  - - [3136, 64, 64, 256, 3136, 3136, 3136, 256]
    - [42, 16397.0]
  - - [3136, 64, 128, 256, 3136, 3136, 3136, 256]
    - [59, 16232.0]
  - - [3136, 64, 256, 64, 3136, 3136, 3136, 64]
    - [37, 11742.0]
  - - [3136, 64, 64, 64, 3136, 3136, 3136, 64]
    - [55, 19217.0]
  - - [3136, 64, 256, 256, 3136, 3136, 3136, 256]
    - [42, 16413.0]
  - - [2368, 64, 1, 3328, 2368, 2368, 2368, 3328]
    - [83, 8750.0]
  - - [256, 704, 1, 1280, 256, 256, 256, 1280]
    - [83, 9183.0]
  - - [1408, 64, 1, 1280, 1408, 1408, 1408, 1280]
    - [67, 5952.0]
  - - [4096, 32, 1, 4096, 4096, 4096, 4096, 4096]
    - [67, 7371.0]
  - - [3072, 64, 1, 1024, 3072, 3072, 3072, 1024]
    - [73, 9569.0]
  - - [1024, 256, 1, 3328, 1024, 1024, 1024, 3328]
    - [73, 9259.0]
  - - [6144, 32, 1, 2560, 6144, 6144, 6144, 2560]
    - [73, 9979.0]
  - - [704, 128, 1, 1280, 704, 704, 704, 1280]
    - [67, 5946.0]
  - - [64, 3584, 1, 3328, 64, 64, 64, 3328]
    - [89, 9987.0]
  - - [1024, 256, 1, 256, 1024, 1024, 1024, 256]
    - [73, 8085.0]
  - - [448, 448, 1, 256, 448, 448, 448, 256]
    - [83, 8260.0]
  - - [7680, 32, 1, 2560, 7680, 7680, 7680, 2560]
    - [83, 10531.0]
  - - [128, 1024, 1, 3328, 128, 128, 128, 3328]
    - [70, 7899.0]
  - - [64, 1856, 1, 1280, 64, 64, 64, 1280]
    - [79, 7797.0]
  - - [448, 256, 1, 256, 448, 448, 448, 256]
    - [79, 5825.0]
  - - [256, 1024, 1, 256, 256, 256, 256, 256]
    - [83, 8164.0]
  - - [1024, 128, 1, 1280, 1024, 1024, 1024, 1280]
    - [73, 7263.0]
  - - [3072, 32, 1, 1024, 3072, 3072, 3072, 1024]
    - [75, 6229.0]
  - - [448, 256, 1, 3328, 448, 448, 448, 3328]
    - [86, 7948.0]
  - - [128, 704, 1, 1280, 128, 128, 128, 1280]
    - [79, 6317.0]
  - - [1856, 128, 1, 3328, 1856, 1856, 1856, 3328]
    - [64, 10297.0]
  - - [256, 448, 1, 256, 256, 256, 256, 256]
    - [75, 5300.0]
  - - [8448, 32, 1, 2816, 8448, 8448, 8448, 2816]
    - [79, 9445.0]
  - - [448, 448, 1, 3328, 448, 448, 448, 3328]
    - [73, 10559.0]
  - - [1408, 128, 1, 1280, 1408, 1408, 1408, 1280]
    - [73, 9213.0]
  - - [128, 1856, 1, 1280, 128, 128, 128, 1280]
    - [74, 10076.0]
  - - [2048, 128, 1, 2048, 2048, 2048, 2048, 2048]
    - [79, 9158.0]
  - - [64, 1408, 1, 3328, 64, 64, 64, 3328]
    - [67, 6277.0]
  - - [256, 704, 1, 256, 256, 256, 256, 256]
    - [83, 7300.0]
  - - [128, 1408, 1, 256, 128, 128, 128, 256]
    - [73, 7254.0]
  - - [256, 448, 1, 3328, 256, 256, 256, 3328]
    - [67, 7978.0]
  - - [64, 2368, 1, 1280, 64, 64, 64, 1280]
    - [88, 8874.0]
  - - [2368, 64, 1, 256, 2368, 2368, 2368, 256]
    - [79, 6621.0]
  - - [704, 128, 1, 3328, 704, 704, 704, 3328]
    - [86, 6332.0]
  - - [4288, 64, 1, 1280, 4288, 4288, 4288, 1280]
    - [70, 9377.0]
  - - [2560, 64, 1, 2560, 2560, 2560, 2560, 2560]
    - [83, 9051.0]
  - - [128, 1024, 1, 1280, 128, 128, 128, 1280]
    - [88, 8020.0]
  - - [128, 1024, 1, 256, 128, 128, 128, 256]
    - [88, 5928.0]
  - - [1856, 64, 1, 256, 1856, 1856, 1856, 256]
    - [67, 5529.0]
  - - [704, 128, 1, 256, 704, 704, 704, 256]
    - [79, 4689.0]
  - - [448, 256, 1, 1280, 448, 448, 448, 1280]
    - [70, 7670.0]
  - - [1856, 128, 1, 1280, 1856, 1856, 1856, 1280]
    - [64, 10157.0]
  - - [64, 3584, 1, 256, 64, 64, 64, 256]
    - [71, 8066.0]
  - - [64, 1856, 1, 256, 64, 64, 64, 256]
    - [79, 5695.0]
  - - [256, 1024, 1, 1280, 256, 256, 256, 1280]
    - [83, 9394.0]
  - - [3584, 64, 1, 1280, 3584, 3584, 3584, 1280]
    - [64, 9754.0]
  - - [1408, 128, 1, 3328, 1408, 1408, 1408, 3328]
    - [73, 9560.0]
  - - [64, 2944, 1, 3328, 64, 64, 64, 3328]
    - [79, 9713.0]
  - - [64, 4288, 1, 3328, 64, 64, 64, 3328]
    - [70, 9884.0]
  - - [128, 1500, 1, 1280, 128, 128, 128, 1280]
    - [64, 9416.0]
  - - [64, 2944, 1, 256, 64, 64, 64, 256]
    - [79, 7375.0]
  - - [64, 1408, 1, 1280, 64, 64, 64, 1280]
    - [88, 6289.0]
  - - [64, 2944, 1, 1280, 64, 64, 64, 1280]
    - [70, 9233.0]
  - - [704, 256, 1, 256, 704, 704, 704, 256]
    - [73, 7442.0]
  - - [256, 448, 1, 1280, 256, 256, 256, 1280]
    - [67, 7497.0]
  - - [704, 256, 1, 1280, 704, 704, 704, 1280]
    - [64, 9140.0]
  - - [64, 2368, 1, 3328, 64, 64, 64, 3328]
    - [79, 8741.0]
  - - [256, 704, 1, 3328, 256, 256, 256, 3328]
    - [83, 9545.0]
  - - [4096, 64, 1, 4096, 4096, 4096, 4096, 4096]
    - [79, 9266.0]
  - - [1760, 128, 1, 1760, 1760, 1760, 1760, 1760]
    - [65, 9858.0]
  - - [2944, 64, 1, 1280, 2944, 2944, 2944, 1280]
    - [83, 9586.0]
  - - [128, 1408, 1, 3328, 128, 128, 128, 3328]
    - [64, 9472.0]
  - - [1408, 64, 1, 256, 1408, 1408, 1408, 256]
    - [63, 4436.0]
  - - [64, 2368, 1, 256, 64, 64, 64, 256]
    - [71, 6736.0]
  - - [1024, 128, 1, 3328, 1024, 1024, 1024, 3328]
    - [65, 7523.0]
  - - [2368, 64, 1, 1280, 2368, 2368, 2368, 1280]
    - [83, 8398.0]
  - - [4288, 64, 1, 256, 4288, 4288, 4288, 256]
    - [64, 8526.0]
  - - [64, 4288, 1, 1280, 64, 64, 64, 1280]
    - [70, 9709.0]
  - - [1408, 64, 1, 3328, 1408, 1408, 1408, 3328]
    - [86, 6324.0]
  - - [2944, 64, 1, 256, 2944, 2944, 2944, 256]
    - [73, 7656.0]
  - - [448, 448, 1, 1280, 448, 448, 448, 1280]
    - [73, 10154.0]
  - - [1024, 256, 1, 1280, 1024, 1024, 1024, 1280]
    - [73, 9383.0]
  - - [3584, 64, 1, 3328, 3584, 3584, 3584, 3328]
    - [84, 9857.0]
  - - [256, 1024, 1, 3328, 256, 256, 256, 3328]
    - [70, 9535.0]
  - - [1856, 64, 1, 3328, 1856, 1856, 1856, 3328]
    - [75, 8243.0]
  - - [1856, 64, 1, 1280, 1856, 1856, 1856, 1280]
    - [75, 7718.0]
  - - [4608, 32, 1, 1536, 4608, 4608, 4608, 1536]
    - [67, 7919.0]
  - - [1024, 128, 1, 256, 1024, 1024, 1024, 256]
    - [83, 5649.0]
  - - [64, 3584, 1, 1280, 64, 64, 64, 1280]
    - [71, 9671.0]
  - - [3584, 64, 1, 256, 3584, 3584, 3584, 256]
    - [70, 8022.0]
  - - [64, 1856, 1, 3328, 64, 64, 64, 3328]
    - [75, 8185.0]
  - - [1408, 128, 1, 256, 1408, 1408, 1408, 256]
    - [73, 7418.0]
  - - [128, 704, 1, 256, 128, 128, 128, 256]
    - [78, 4453.0]
  - - [128, 704, 1, 3328, 128, 128, 128, 3328]
    - [67, 6300.0]
  - - [128, 1856, 1, 256, 128, 128, 128, 256]
    - [71, 8400.0]
  - - [64, 4288, 1, 256, 64, 64, 64, 256]
    - [79, 8265.0]
  - - [2560, 32, 1, 2560, 2560, 2560, 2560, 2560]
    - [81, 6275.0]
  - - [704, 256, 1, 3328, 704, 704, 704, 3328]
    - [73, 9560.0]
  - - [176, 1500, 1, 1408, 176, 176, 176, 1408]
    - [65, 8681.0]
  - - [1856, 128, 1, 256, 1856, 1856, 1856, 256]
    - [64, 8354.0]
  - - [4288, 64, 1, 3328, 4288, 4288, 4288, 3328]
    - [83, 9474.0]
  - - [2048, 64, 1, 2048, 2048, 2048, 2048, 2048]
    - [87, 7228.0]
  - - [64, 1408, 1, 256, 64, 64, 64, 256]
    - [79, 4402.0]
  - - [2944, 64, 1, 3328, 2944, 2944, 2944, 3328]
    - [83, 9900.0]
  - - [128, 1408, 1, 1280, 128, 128, 128, 1280]
    - [73, 9104.0]
  - - [128, 1856, 1, 3328, 128, 128, 128, 3328]
    - [74, 10392.0]
  - - [1760, 64, 1, 1760, 1760, 1760, 1760, 1760]
    - [67, 7442.0]
  - - [1760, 32, 1, 1760, 1760, 1760, 1760, 1760]
    - [94, 5387.0]
  - - [2560, 16, 1, 2560, 2560, 2560, 2560, 2560]
    - [93, 4749.0]
  - - [1760, 16, 1, 1760, 1760, 1760, 1760, 1760]
    - [93, 3210.0]
  - - [8448, 4, 1, 2816, 8448, 8448, 8448, 2816]
    - [94, 3021.0]
  - - [7680, 16, 1, 2560, 7680, 7680, 7680, 2560]
    - [97, 7508.0]
  - - [4608, 1, 1, 1536, 4608, 4608, 4608, 1536]
    - [98, 506.0]
  - - [7680, 4, 1, 2560, 7680, 7680, 7680, 2560]
    - [103, 2823.0]
  - - [8448, 16, 1, 2816, 8448, 8448, 8448, 2816]
    - [91, 7499.0]
  - - [3072, 2, 1, 1024, 3072, 3072, 3072, 1024]
    - [103, 655.0]
  - - [6144, 16, 1, 2560, 6144, 6144, 6144, 2560]
    - [92, 7236.0]
  - - [7680, 1, 1, 2560, 7680, 7680, 7680, 2560]
    - [94, 723.0]
  - - [4608, 4, 1, 1536, 4608, 4608, 4608, 1536]
    - [103, 2025.0]
  - - [3072, 1, 1, 128, 3072, 3072, 3072, 128]
    - [102, 141.0]
  - - [2048, 32, 1, 2048, 2048, 2048, 2048, 2048]
    - [92, 5971.0]
  - - [2048, 16, 1, 2048, 2048, 2048, 2048, 2048]
    - [103, 3753.0]
  - - [8448, 1, 1, 2816, 8448, 8448, 8448, 2816]
    - [94, 758.0]
  - - [6144, 4, 1, 2560, 6144, 6144, 6144, 2560]
    - [103, 2587.0]
  - - [3072, 1, 1, 1024, 3072, 3072, 3072, 1024]
    - [98, 326.0]
  - - [3072, 16, 1, 1024, 3072, 3072, 3072, 1024]
    - [66, 4686.0]
  - - [4096, 16, 1, 4096, 4096, 4096, 4096, 4096]
    - [92, 6092.0]
  - - [6144, 1, 1, 2560, 6144, 6144, 6144, 2560]
    - [101, 646.0]
  - - [3072, 4, 1, 1024, 3072, 3072, 3072, 1024]
    - [103, 1287.0]
  - - [7680, 2, 1, 2560, 7680, 7680, 7680, 2560]
    - [99, 1403.0]
  - - [4224, 1, 1, 128, 4224, 4224, 4224, 128]
    - [96, 183.0]
  - - [8448, 2, 1, 2816, 8448, 8448, 8448, 2816]
    - [94, 1515.0]
  - - [4608, 2, 1, 1536, 4608, 4608, 4608, 1536]
    - [98, 1005.0]
  - - [4608, 16, 1, 1536, 4608, 4608, 4608, 1536]
    - [100, 6391.0]
  - - [6144, 2, 1, 2560, 6144, 6144, 6144, 2560]
    - [95, 1290.0]
  - - [1024, 1, 1, 500000, 1024, 1024, 1024, 500000]
    - [69, 136.0]
  - - [1024, 16, 1, 500000, 1024, 1024, 1024, 500000]
    - [77, 2172.0]
  - - [1024, 2, 1, 500000, 1024, 1024, 1024, 500000]
    - [69, 272.0]
  - - [512, 1, 1, 500000, 512, 512, 512, 500000]
    - [69, 73.0]
  - - [1024, 8, 1, 500000, 1024, 1024, 1024, 500000]
    - [69, 1086.0]
  - - [1024, 4, 1, 500000, 1024, 1024, 1024, 500000]
    - [69, 543.0]
  - - [512, 16, 1, 500000, 512, 512, 512, 500000]
    - [82, 1164.0]
  - - [512, 2, 1, 500000, 512, 512, 512, 500000]
    - [69, 147.0]
  - - [512, 8, 1, 500000, 512, 512, 512, 500000]
    - [69, 587.0]
  - - [512, 4, 1, 500000, 512, 512, 512, 500000]
    - [69, 294.0]
  - - [512, 4, 1, 512, 512, 512, 512, 512]
    - [72, 189.0]
  - - [448, 64, 1, 1280, 448, 448, 448, 1280]
    - [66, 3180.0]
  - - [64, 1024, 1, 1280, 64, 64, 64, 1280]
    - [75, 4987.0]
  - - [64, 704, 1, 1280, 64, 64, 64, 1280]
    - [66, 4450.0]
  - - [256, 128, 1, 256, 256, 256, 256, 256]
    - [66, 2356.0]
  - - [64, 1024, 1, 3328, 64, 64, 64, 3328]
    - [67, 5367.0]
  - - [128, 1, 1, 1408, 128, 128, 128, 1408]
    - [66, 15.0]
  - - [1024, 64, 1, 1280, 1024, 1024, 1024, 1280]
    - [85, 4946.0]
  - - [256, 256, 1, 3328, 256, 256, 256, 3328]
    - [75, 5388.0]
  - - [64, 448, 1, 1280, 64, 64, 64, 1280]
    - [80, 3186.0]
  - - [512, 32, 1, 512, 512, 512, 512, 512]
    - [66, 1520.0]
  - - [64, 64, 1, 3328, 64, 64, 64, 3328]
    - [68, 547.0]
  - - [512, 1, 1, 512, 512, 512, 512, 512]
    - [66, 47.0]
  - - [512, 2, 1, 512, 512, 512, 512, 512]
    - [66, 94.0]
  - - [704, 64, 1, 3328, 704, 704, 704, 3328]
    - [85, 4689.0]
  - - [64, 128, 1, 256, 64, 64, 64, 256]
    - [72, 617.0]
  - - [704, 64, 1, 1280, 704, 704, 704, 1280]
    - [66, 4464.0]
  - - [128, 448, 1, 256, 128, 128, 128, 256]
    - [66, 3688.0]
  - - [448, 64, 1, 3328, 448, 448, 448, 3328]
    - [66, 3389.0]
  - - [64, 128, 1, 3328, 64, 64, 64, 3328]
    - [76, 1082.0]
  - - [128, 128, 1, 3328, 128, 128, 128, 3328]
    - [69, 2022.0]
  - - [64, 1, 1, 1216, 64, 64, 64, 1216]
    - [66, 7.0]
  - - [256, 256, 1, 256, 256, 256, 256, 256]
    - [66, 3796.0]
  - - [128, 64, 1, 1280, 128, 128, 128, 1280]
    - [69, 953.0]
  - - [64, 1024, 1, 256, 64, 64, 64, 256]
    - [66, 3762.0]
  - - [64, 704, 1, 256, 64, 64, 64, 256]
    - [66, 3051.0]
  - - [1024, 2, 1, 512, 1024, 1024, 1024, 512]
    - [72, 183.0]
  - - [256, 64, 1, 3328, 256, 256, 256, 3328]
    - [69, 2019.0]
  - - [448, 128, 1, 256, 448, 448, 448, 256]
    - [66, 3634.0]
  - - [64, 704, 1, 3328, 64, 64, 64, 3328]
    - [66, 4772.0]
  - - [64, 448, 1, 3328, 64, 64, 64, 3328]
    - [66, 3437.0]
  - - [448, 128, 1, 3328, 448, 448, 448, 3328]
    - [85, 5249.0]
  - - [128, 256, 1, 1280, 128, 128, 128, 1280]
    - [85, 3537.0]
  - - [64, 448, 1, 256, 64, 64, 64, 256]
    - [66, 2073.0]
  - - [64, 256, 1, 1280, 64, 64, 64, 1280]
    - [72, 1872.0]
  - - [64, 128, 1, 1280, 64, 64, 64, 1280]
    - [69, 953.0]
  - - [1024, 32, 1, 512, 1024, 1024, 1024, 512]
    - [72, 2913.0]
  - - [64, 64, 1, 256, 64, 64, 64, 256]
    - [72, 301.0]
  - - [256, 128, 1, 1280, 256, 256, 256, 1280]
    - [85, 3542.0]
  - - [128, 256, 1, 3328, 128, 128, 128, 3328]
    - [66, 3829.0]
  - - [256, 64, 1, 256, 256, 256, 256, 256]
    - [72, 1198.0]
  - - [128, 128, 1, 1280, 128, 128, 128, 1280]
    - [80, 1872.0]
  - - [128, 256, 1, 256, 128, 128, 128, 256]
    - [66, 2343.0]
  - - [256, 64, 1, 1280, 256, 256, 256, 1280]
    - [72, 1846.0]
  - - [704, 64, 1, 256, 704, 704, 704, 256]
    - [66, 3101.0]
  - - [128, 448, 1, 1280, 128, 128, 128, 1280]
    - [66, 4959.0]
  - - [64, 64, 1, 1280, 64, 64, 64, 1280]
    - [68, 481.0]
  - - [128, 64, 1, 3328, 128, 128, 128, 3328]
    - [69, 1076.0]
  - - [448, 64, 1, 256, 448, 448, 448, 256]
    - [72, 2062.0]
  - - [1024, 16, 1, 512, 1024, 1024, 1024, 512]
    - [72, 1503.0]
  - - [512, 16, 1, 512, 512, 512, 512, 512]
    - [66, 765.0]
  - - [1024, 64, 1, 256, 1024, 1024, 1024, 256]
    - [66, 3796.0]
  - - [128, 1, 1, 1024, 128, 128, 128, 1024]
    - [66, 14.0]
  - - [448, 128, 1, 1280, 448, 448, 448, 1280]
    - [66, 4939.0]
  - - [1024, 64, 1, 3328, 1024, 1024, 1024, 3328]
    - [67, 5271.0]
  - - [128, 64, 1, 256, 128, 128, 128, 256]
    - [72, 603.0]
  - - [64, 256, 1, 3328, 64, 64, 64, 3328]
    - [69, 2022.0]
  - - [256, 256, 1, 1280, 256, 256, 256, 1280]
    - [75, 4975.0]
  - - [256, 128, 1, 3328, 256, 256, 256, 3328]
    - [66, 3824.0]
  - - [64, 256, 1, 256, 64, 64, 64, 256]
    - [72, 1205.0]
  - - [1024, 4, 1, 512, 1024, 1024, 1024, 512]
    - [72, 368.0]
  - - [128, 448, 1, 3328, 128, 128, 128, 3328]
    - [66, 5249.0]
  - - [1024, 1, 1, 512, 1024, 1024, 1024, 512]
    - [90, 93.0]
  - - [128, 128, 1, 256, 128, 128, 128, 256]
    - [72, 1205.0]
- null
- null
- DeviceEfficiency
...
