library/src/blas3/Tensile/Logic/asm_full/navi21_Cijk_Alik_Bljk_SB.yaml
- {MinimumRequiredVersion: 4.26.0}
- navi21
- gfx1030
- [Device 73a2]
    SolutionIndex: 0
    SolutionNameMin: Cijk_Alik_Bljk_SB_MT128x64x8_SN_SU0_SUM0_TT8_8_WG16_8_1_WGM1
    SolutionIndex: 1
    SolutionNameMin: Cijk_Alik_Bljk_SB_MT128x128x8_SN_SU0_SUM0_TT8_16_WG16_8_1_WGM1
    SolutionIndex: 2
    SolutionNameMin: Cijk_Alik_Bljk_SB_MT128x128x8_SN_SU0_SUM0_TT8_8_WG16_16_1_WGM1
    SolutionIndex: 3
    SolutionNameMin: Cijk_Alik_Bljk_SB_MT128x256x8_SN_SU0_SUM0_TT8_16_WG16_16_1_WGM1
    SolutionIndex: 4
    SolutionNameMin: Cijk_Alik_Bljk_SB_MT128x64x16_SN_SU0_SUM0_TT8_8_WG16_8_1_WGM1
    SolutionIndex: 5
    SolutionNameMin: Cijk_Alik_Bljk_SB_MT128x128x16_SN_SU0_SUM0_TT8_16_WG16_8_1_WGM1
    SolutionIndex: 6
    SolutionNameMin: Cijk_Alik_Bljk_SB_MT128x128x16_SN_SU0_SUM0_TT8_8_WG16_16_1_WGM1
    SolutionIndex: 7
    SolutionNameMin: Cijk_Alik_Bljk_SB_MT128x256x16_SN_SU0_SUM0_TT8_16_WG16_16_1_WGM1
    SolutionIndex: 8
    SolutionNameMin: Cijk_Alik_Bljk_SB_MT128x64x8_SN_SU32_SUM3_TT8_8_WG16_8_1_WGM1
    SolutionIndex: 9
    SolutionNameMin: Cijk_Alik_Bljk_SB_MT128x128x8_SN_SU32_SUM3_TT8_16_WG16_8_1_WGM1
    SolutionIndex: 10
    SolutionNameMin: Cijk_Alik_Bljk_SB_MT128x128x8_SN_SU32_SUM3_TT8_8_WG16_16_1_WGM1
    SolutionIndex: 11
    SolutionNameMin: Cijk_Alik_Bljk_SB_MT128x256x8_SN_SU32_SUM3_TT8_16_WG16_16_1_WGM1
    SolutionIndex: 12
    SolutionNameMin: Cijk_Alik_Bljk_SB_MT128x64x16_SN_SU32_SUM3_TT8_8_WG16_8_1_WGM1
    SolutionIndex: 13
    SolutionNameMin: Cijk_Alik_Bljk_SB_MT128x128x16_SN_SU32_SUM3_TT8_16_WG16_8_1_WGM1
    SolutionIndex: 14
    SolutionNameMin: Cijk_Alik_Bljk_SB_MT128x128x16_SN_SU32_SUM3_TT8_8_WG16_16_1_WGM1
    SolutionIndex: 15
    SolutionNameMin: Cijk_Alik_Bljk_SB_MT128x256x16_SN_SU32_SUM3_TT8_16_WG16_16_1_WGM1
    SolutionIndex: 16
    SolutionNameMin: Cijk_Alik_Bljk_SB_MT128x128x32_SN_SU32_SUM3_TT8_16_WG16_8_1_WGM1
    SolutionIndex: 17
    SolutionNameMin: Cijk_Alik_Bljk_SB_MT128x64x8_SN_SU0_SUM0_TT8_8_WG16_8_1_WGM4
    SolutionIndex: 18
    SolutionNameMin: Cijk_Alik_Bljk_SB_MT128x128x8_SN_SU0_SUM0_TT8_16_WG16_8_1_WGM4
    SolutionIndex: 19
    SolutionNameMin: Cijk_Alik_Bljk_SB_MT128x128x8_SN_SU0_SUM0_TT8_8_WG16_16_1_WGM4
    SolutionIndex: 20
    SolutionNameMin: Cijk_Alik_Bljk_SB_MT128x256x8_SN_SU0_SUM0_TT8_16_WG16_16_1_WGM4
    SolutionIndex: 21
    SolutionNameMin: Cijk_Alik_Bljk_SB_MT128x64x16_SN_SU0_SUM0_TT8_8_WG16_8_1_WGM4
    SolutionIndex: 22
    SolutionNameMin: Cijk_Alik_Bljk_SB_MT128x128x16_SN_SU0_SUM0_TT8_16_WG16_8_1_WGM4
    SolutionIndex: 23
    SolutionNameMin: Cijk_Alik_Bljk_SB_MT128x128x16_SN_SU0_SUM0_TT8_8_WG16_16_1_WGM4
    SolutionIndex: 24
    SolutionNameMin: Cijk_Alik_Bljk_SB_MT128x256x16_SN_SU0_SUM0_TT8_16_WG16_16_1_WGM4
    SolutionIndex: 25
    SolutionNameMin: Cijk_Alik_Bljk_SB_MT128x64x8_SN_SU32_SUM3_TT8_8_WG16_8_1_WGM4
    SolutionIndex: 26
    SolutionNameMin: Cijk_Alik_Bljk_SB_MT128x128x8_SN_SU32_SUM3_TT8_16_WG16_8_1_WGM4
    SolutionIndex: 27
    SolutionNameMin: Cijk_Alik_Bljk_SB_MT128x128x8_SN_SU32_SUM3_TT8_8_WG16_16_1_WGM4
    SolutionIndex: 28
    SolutionNameMin: Cijk_Alik_Bljk_SB_MT128x256x8_SN_SU32_SUM3_TT8_16_WG16_16_1_WGM4
    SolutionIndex: 29
    SolutionNameMin: Cijk_Alik_Bljk_SB_MT128x64x16_SN_SU32_SUM3_TT8_8_WG16_8_1_WGM4
    SolutionIndex: 30
    SolutionNameMin: Cijk_Alik_Bljk_SB_MT128x128x16_SN_SU32_SUM3_TT8_16_WG16_8_1_WGM4
    SolutionIndex: 31
    SolutionNameMin: Cijk_Alik_Bljk_SB_MT128x128x16_SN_SU32_SUM3_TT8_8_WG16_16_1_WGM4
    SolutionIndex: 32
    SolutionNameMin: Cijk_Alik_Bljk_SB_MT128x256x16_SN_SU32_SUM3_TT8_16_WG16_16_1_WGM4
    SolutionIndex: 33
    SolutionNameMin: Cijk_Alik_Bljk_SB_MT128x64x32_SN_SU32_SUM3_TT8_8_WG16_8_1_WGM4
    SolutionIndex: 34
    SolutionNameMin: Cijk_Alik_Bljk_SB_MT128x128x32_SN_SU32_SUM3_TT8_16_WG16_8_1_WGM4
    SolutionIndex: 35
    SolutionNameMin: Cijk_Alik_Bljk_SB_MT128x128x32_SN_SU32_SUM3_TT8_8_WG16_16_1_WGM4
    SolutionIndex: 36
    SolutionNameMin: Cijk_Alik_Bljk_SB_MT128x64x8_SN_SU0_SUM0_TT8_8_WG16_8_1_WGM8
    SolutionIndex: 37
    SolutionNameMin: Cijk_Alik_Bljk_SB_MT128x128x8_SN_SU0_SUM0_TT8_16_WG16_8_1_WGM8
    SolutionIndex: 38
    SolutionNameMin: Cijk_Alik_Bljk_SB_MT128x128x8_SN_SU0_SUM0_TT8_8_WG16_16_1_WGM8
    SolutionIndex: 39
    SolutionNameMin: Cijk_Alik_Bljk_SB_MT128x256x8_SN_SU0_SUM0_TT8_16_WG16_16_1_WGM8
    SolutionIndex: 40
    SolutionNameMin: Cijk_Alik_Bljk_SB_MT128x64x16_SN_SU0_SUM0_TT8_8_WG16_8_1_WGM8
    SolutionIndex: 41
    SolutionNameMin: Cijk_Alik_Bljk_SB_MT128x128x16_SN_SU0_SUM0_TT8_16_WG16_8_1_WGM8
    SolutionIndex: 42
    SolutionNameMin: Cijk_Alik_Bljk_SB_MT128x128x16_SN_SU0_SUM0_TT8_8_WG16_16_1_WGM8
    SolutionIndex: 43
    SolutionNameMin: Cijk_Alik_Bljk_SB_MT128x256x16_SN_SU0_SUM0_TT8_16_WG16_16_1_WGM8
    SolutionIndex: 44
    SolutionNameMin: Cijk_Alik_Bljk_SB_MT128x128x32_SN_SU0_SUM0_TT8_16_WG16_8_1_WGM8
    SolutionIndex: 45
    SolutionNameMin: Cijk_Alik_Bljk_SB_MT128x64x8_SN_SU32_SUM3_TT8_8_WG16_8_1_WGM8
    SolutionIndex: 46
    SolutionNameMin: Cijk_Alik_Bljk_SB_MT128x128x8_SN_SU32_SUM3_TT8_16_WG16_8_1_WGM8
    SolutionIndex: 47
    SolutionNameMin: Cijk_Alik_Bljk_SB_MT128x128x8_SN_SU32_SUM3_TT8_8_WG16_16_1_WGM8
    SolutionIndex: 48
    SolutionNameMin: Cijk_Alik_Bljk_SB_MT128x64x16_SN_SU32_SUM3_TT8_8_WG16_8_1_WGM8
    SolutionIndex: 49
    SolutionNameMin: Cijk_Alik_Bljk_SB_MT128x128x16_SN_SU32_SUM3_TT8_16_WG16_8_1_WGM8
    SolutionIndex: 50
    SolutionNameMin: Cijk_Alik_Bljk_SB_MT128x128x16_SN_SU32_SUM3_TT8_8_WG16_16_1_WGM8
    SolutionIndex: 51
    SolutionNameMin: Cijk_Alik_Bljk_SB_MT128x256x16_SN_SU32_SUM3_TT8_16_WG16_16_1_WGM8
    SolutionIndex: 52
    SolutionNameMin: Cijk_Alik_Bljk_SB_MT128x64x32_SN_SU32_SUM3_TT8_8_WG16_8_1_WGM8
    SolutionIndex: 53
    SolutionNameMin: Cijk_Alik_Bljk_SB_MT128x128x32_SN_SU32_SUM3_TT8_16_WG16_8_1_WGM8
    SolutionIndex: 54
    SolutionNameMin: Cijk_Alik_Bljk_SB_MT128x128x16_SN_SU0_SUM0_TT8_16_WG16_8_1_WGM1
    SolutionIndex: 55
    SolutionNameMin: Cijk_Alik_Bljk_SB_MT128x256x16_SN_SU0_SUM0_TT8_16_WG16_16_1_WGM1
    SolutionIndex: 56
    SolutionNameMin: Cijk_Alik_Bljk_SB_MT128x256x16_SN_SU32_SUM3_TT8_16_WG16_16_1_WGM1
    SolutionIndex: 57
    SolutionNameMin: Cijk_Alik_Bljk_SB_MT128x128x32_SN_SU32_SUM3_TT8_8_WG16_16_1_WGM1
    SolutionIndex: 58
    SolutionNameMin: Cijk_Alik_Bljk_SB_MT128x128x16_SN_SU32_SUM3_TT8_16_WG16_8_1_WGM4
    SolutionIndex: 59
    SolutionNameMin: Cijk_Alik_Bljk_SB_MT128x128x16_SN_SU32_SUM3_TT8_8_WG16_16_1_WGM4
    SolutionIndex: 60
    SolutionNameMin: Cijk_Alik_Bljk_SB_MT128x256x16_SN_SU32_SUM3_TT8_16_WG16_16_1_WGM4
    SolutionIndex: 61
    SolutionNameMin: Cijk_Alik_Bljk_SB_MT128x64x32_SN_SU32_SUM3_TT8_8_WG16_8_1_WGM4
    SolutionIndex: 62
    SolutionNameMin: Cijk_Alik_Bljk_SB_MT128x128x32_SN_SU32_SUM3_TT8_8_WG16_16_1_WGM4
    SolutionIndex: 63
    SolutionNameMin: Cijk_Alik_Bljk_SB_MT128x256x16_SN_SU0_SUM0_TT8_16_WG16_16_1_WGM8
    SolutionIndex: 64
    SolutionNameMin: Cijk_Alik_Bljk_SB_MT128x64x32_SN_SU0_SUM0_TT8_8_WG16_8_1_WGM8
    SolutionIndex: 65
    SolutionNameMin: Cijk_Alik_Bljk_SB_MT128x128x32_SN_SU0_SUM0_TT8_16_WG16_8_1_WGM8
    SolutionIndex: 66
    SolutionNameMin: Cijk_Alik_Bljk_SB_MT128x128x16_SN_SU32_SUM3_TT8_8_WG16_16_1_WGM8
    SolutionIndex: 67
    SolutionNameMin: Cijk_Alik_Bljk_SB_MT128x256x16_SN_SU32_SUM3_TT8_16_WG16_16_1_WGM8
    SolutionIndex: 68
    SolutionNameMin: Cijk_Alik_Bljk_SB_MT128x128x32_SN_SU32_SUM3_TT8_8_WG16_16_1_WGM8
    SolutionIndex: 71
    SolutionNameMin: Cijk_Alik_Bljk_SB_MT64x64x8_SN_SU0_SUM0_TT8_8_WG8_8_1_WGM1
    SolutionIndex: 72
    SolutionNameMin: Cijk_Alik_Bljk_SB_MT64x64x8_SN_SU0_SUM0_TT4_8_WG16_8_1_WGM1
    SolutionIndex: 73
    SolutionNameMin: Cijk_Alik_Bljk_SB_MT128x64x8_SN_SU0_SUM0_TT8_8_WG16_8_1_WGM1
    SolutionIndex: 74
    SolutionNameMin: Cijk_Alik_Bljk_SB_MT128x128x8_SN_SU0_SUM0_TT8_8_WG16_16_1_WGM1
    SolutionIndex: 76
    SolutionNameMin: Cijk_Alik_Bljk_SB_MT64x64x16_SN_SU0_SUM0_TT4_8_WG16_8_1_WGM1
    SolutionIndex: 78
    SolutionNameMin: Cijk_Alik_Bljk_SB_MT128x128x16_SN_SU0_SUM0_TT8_8_WG16_16_1_WGM1
    SolutionIndex: 79
    SolutionNameMin: Cijk_Alik_Bljk_SB_MT64x64x8_SN_SU32_SUM3_TT8_8_WG8_8_1_WGM1
    SolutionIndex: 80
    SolutionNameMin: Cijk_Alik_Bljk_SB_MT64x64x8_SN_SU32_SUM3_TT4_8_WG16_8_1_WGM1
    SolutionIndex: 81
    SolutionNameMin: Cijk_Alik_Bljk_SB_MT128x64x8_SN_SU32_SUM3_TT8_8_WG16_8_1_WGM1
    SolutionIndex: 82
    SolutionNameMin: Cijk_Alik_Bljk_SB_MT128x128x8_SN_SU32_SUM3_TT8_8_WG16_16_1_WGM1
    SolutionIndex: 83
    SolutionNameMin: Cijk_Alik_Bljk_SB_MT64x64x16_SN_SU32_SUM3_TT8_8_WG8_8_1_WGM1
    SolutionIndex: 84
    SolutionNameMin: Cijk_Alik_Bljk_SB_MT64x64x16_SN_SU32_SUM3_TT4_8_WG16_8_1_WGM1
    SolutionIndex: 85
    SolutionNameMin: Cijk_Alik_Bljk_SB_MT128x64x16_SN_SU32_SUM3_TT8_8_WG16_8_1_WGM1
    SolutionIndex: 86
    SolutionNameMin: Cijk_Alik_Bljk_SB_MT64x128x16_SN_SU32_SUM3_TT4_8_WG16_16_1_WGM1
    SolutionIndex: 87
    SolutionNameMin: Cijk_Alik_Bljk_SB_MT128x128x16_SN_SU32_SUM3_TT8_8_WG16_16_1_WGM1
    SolutionIndex: 90
    SolutionNameMin: Cijk_Alik_Bljk_SB_MT128x128x32_SN_SU32_SUM3_TT8_8_WG16_16_1_WGM1
    SolutionIndex: 95
    SolutionNameMin: Cijk_Alik_Bljk_SB_MT128x64x8_SN_SU0_SUM0_TT8_8_WG16_8_1_WGM4
    SolutionIndex: 96
    SolutionNameMin: Cijk_Alik_Bljk_SB_MT128x128x8_SN_SU0_SUM0_TT8_8_WG16_16_1_WGM4
    SolutionIndex: 97
    SolutionNameMin: Cijk_Alik_Bljk_SB_MT64x64x16_SN_SU0_SUM0_TT8_8_WG8_8_1_WGM4
    SolutionIndex: 100
    SolutionNameMin: Cijk_Alik_Bljk_SB_MT128x128x16_SN_SU0_SUM0_TT8_8_WG16_16_1_WGM4
    SolutionIndex: 101
    SolutionNameMin: Cijk_Alik_Bljk_SB_MT64x64x8_SN_SU32_SUM3_TT8_8_WG8_8_1_WGM4
    SolutionIndex: 102
    SolutionNameMin: Cijk_Alik_Bljk_SB_MT64x64x8_SN_SU32_SUM3_TT4_8_WG16_8_1_WGM4
    SolutionIndex: 103
    SolutionNameMin: Cijk_Alik_Bljk_SB_MT128x64x8_SN_SU32_SUM3_TT8_8_WG16_8_1_WGM4
    SolutionIndex: 104
    SolutionNameMin: Cijk_Alik_Bljk_SB_MT64x128x8_SN_SU32_SUM3_TT4_8_WG16_16_1_WGM4
    SolutionIndex: 105
    SolutionNameMin: Cijk_Alik_Bljk_SB_MT128x128x8_SN_SU32_SUM3_TT8_8_WG16_16_1_WGM4
    SolutionIndex: 106
    SolutionNameMin: Cijk_Alik_Bljk_SB_MT64x64x16_SN_SU32_SUM3_TT8_8_WG8_8_1_WGM4
    SolutionIndex: 107
    SolutionNameMin: Cijk_Alik_Bljk_SB_MT64x64x16_SN_SU32_SUM3_TT4_8_WG16_8_1_WGM4
    SolutionIndex: 108
    SolutionNameMin: Cijk_Alik_Bljk_SB_MT128x64x16_SN_SU32_SUM3_TT8_8_WG16_8_1_WGM4
    SolutionIndex: 110
    SolutionNameMin: Cijk_Alik_Bljk_SB_MT128x128x16_SN_SU32_SUM3_TT8_8_WG16_16_1_WGM4
    SolutionIndex: 114
    SolutionNameMin: Cijk_Alik_Bljk_SB_MT32x32x8_SN_SU0_SUM0_TT4_4_WG8_8_1_WGM8
    SolutionIndex: 117
    SolutionNameMin: Cijk_Alik_Bljk_SB_MT64x64x8_SN_SU0_SUM0_TT4_8_WG16_8_1_WGM8
    SolutionIndex: 120
    SolutionNameMin: Cijk_Alik_Bljk_SB_MT64x128x8_SN_SU0_SUM0_TT4_8_WG16_16_1_WGM8
    SolutionIndex: 121
    SolutionNameMin: Cijk_Alik_Bljk_SB_MT128x128x8_SN_SU0_SUM0_TT8_8_WG16_16_1_WGM8
    SolutionIndex: 125
    SolutionNameMin: Cijk_Alik_Bljk_SB_MT128x64x16_SN_SU0_SUM0_TT8_8_WG16_8_1_WGM8
    SolutionIndex: 126
    SolutionNameMin: Cijk_Alik_Bljk_SB_MT128x128x16_SN_SU0_SUM0_TT8_8_WG16_16_1_WGM8
    SolutionIndex: 128
    SolutionNameMin: Cijk_Alik_Bljk_SB_MT32x32x8_SN_SU32_SUM3_TT4_4_WG8_8_1_WGM8
    SolutionIndex: 129
    SolutionNameMin: Cijk_Alik_Bljk_SB_MT64x64x8_SN_SU32_SUM3_TT4_8_WG16_8_1_WGM8
    SolutionIndex: 130
    SolutionNameMin: Cijk_Alik_Bljk_SB_MT128x64x8_SN_SU32_SUM3_TT8_8_WG16_8_1_WGM8
    SolutionIndex: 131
    SolutionNameMin: Cijk_Alik_Bljk_SB_MT128x128x8_SN_SU32_SUM3_TT8_8_WG16_16_1_WGM8
    SolutionIndex: 132
    SolutionNameMin: Cijk_Alik_Bljk_SB_MT64x64x16_SN_SU32_SUM3_TT8_8_WG8_8_1_WGM8
    SolutionIndex: 133
    SolutionNameMin: Cijk_Alik_Bljk_SB_MT64x64x16_SN_SU32_SUM3_TT4_8_WG16_8_1_WGM8
    SolutionIndex: 134
    SolutionNameMin: Cijk_Alik_Bljk_SB_MT128x64x16_SN_SU32_SUM3_TT8_8_WG16_8_1_WGM8
    SolutionIndex: 136
    SolutionNameMin: Cijk_Alik_Bljk_SB_MT128x128x16_SN_SU32_SUM3_TT8_8_WG16_16_1_WGM8
- - - [1024, 4096, 1, 1024, 1024, 1024, 1024, 1024]
    - [32, 17279.0]
  - - [4096, 4096, 1, 1024, 4096, 4096, 1024, 1024]
    - [13, 19284.0]
  - - [1024, 4096, 1, 4096, 1024, 1024, 4096, 4096]
    - [32, 17921.0]
  - - [30528, 4096, 1, 1024, 30528, 30528, 1024, 1024]
    - [51, 20009.0]
  - - [1024, 2048, 1, 1024, 1024, 1024, 1024, 1024]
    - [32, 16681.0]
  - - [4096, 2048, 1, 1024, 4096, 4096, 1024, 1024]
    - [13, 18346.0]
  - - [1024, 2048, 1, 4096, 1024, 1024, 4096, 4096]
    - [32, 17576.0]
  - - [30528, 2048, 1, 1024, 30528, 30528, 1024, 1024]
    - [51, 19860.0]
  - - [30522, 320, 1, 768, 30522, 30522, 768, 768]
    - [30, 15999.0]
  - - [3072, 4096, 1, 768, 3072, 3072, 768, 768]
    - [15, 19154.0]
  - - [768, 4096, 1, 3072, 768, 768, 3072, 3072]
    - [32, 17701.0]
  - - [768, 4096, 1, 768, 768, 768, 768, 768]
    - [32, 17107.0]
  - - [30522, 160, 1, 768, 30522, 30522, 768, 768]
    - [29, 13210.0]
  - - [30522, 640, 1, 768, 30522, 30522, 768, 768]
    - [49, 19094.0]
  - - [30522, 1280, 1, 768, 30522, 30522, 768, 768]
    - [43, 19560.0]
  - - [1024, 3072, 1, 1024, 1024, 1024, 1024, 1024]
    - [32, 16988.0]
  - - [1024, 2048, 1, 3072, 1024, 1024, 3072, 3072]
    - [32, 17488.0]
  - - [1024, 3072, 1, 3072, 1024, 1024, 3072, 3072]
    - [15, 17668.0]
  - - [3072, 2048, 1, 1024, 3072, 3072, 1024, 1024]
    - [30, 18520.0]
  - - [3072, 3072, 1, 1024, 3072, 3072, 1024, 1024]
    - [32, 19755.0]
  - - [3072, 512, 1, 1024, 3072, 3072, 1024, 1024]
    - [13, 15564.0]
  - - [30522, 160, 1, 1024, 30522, 30522, 1024, 1024]
    - [12, 12911.0]
  - - [128, 128, 512, 64, 128, 128, 64, 64]
    - [38, 13823.0]
  - - [512, 512, 64, 64, 512, 512, 64, 64]
    - [38, 17330.0]
  - - [256, 256, 192, 64, 256, 256, 64, 64]
    - [1, 16536.0]
  - - [256, 256, 96, 64, 256, 256, 64, 64]
    - [5, 14432.0]
  - - [128, 128, 384, 64, 128, 128, 64, 64]
    - [21, 13377.0]
  - - [128, 128, 96, 64, 128, 128, 64, 64]
    - [19, 10663.0]
  - - [512, 512, 16, 64, 512, 512, 64, 64]
    - [0, 14432.0]
  - - [512, 512, 96, 64, 512, 512, 64, 64]
    - [38, 17583.0]
  - - [512, 512, 128, 64, 512, 512, 64, 64]
    - [0, 14851.0]
  - - [2944, 4288, 1, 1280, 2944, 2944, 1280, 1280]
    - [15, 19429.0]
  - - [2368, 5888, 1, 256, 2368, 2368, 256, 256]
    - [30, 17944.0]
  - - [5888, 1856, 1, 256, 5888, 5888, 256, 256]
    - [30, 17573.0]
  - - [512, 24000, 1, 1536, 512, 512, 1536, 1536]
    - [49, 19309.0]
  - - [5888, 1408, 1, 256, 5888, 5888, 256, 256]
    - [13, 17422.0]
  - - [5888, 1856, 1, 3328, 5888, 5888, 3328, 3328]
    - [30, 18303.0]
  - - [5056, 704, 1, 256, 5056, 5056, 256, 256]
    - [27, 14603.0]
  - - [5888, 2944, 1, 3328, 5888, 5888, 3328, 3328]
    - [13, 19450.0]
  - - [1856, 4288, 1, 256, 1856, 1856, 256, 256]
    - [13, 16113.0]
  - - [1024, 5056, 1, 128, 1024, 1024, 128, 128]
    - [49, 15809.0]
  - - [5056, 5056, 1, 3328, 5056, 5056, 3328, 3328]
    - [30, 19188.0]
  - - [1408, 5888, 1, 1280, 1408, 1408, 1280, 1280]
    - [13, 18305.0]
  - - [2368, 6784, 1, 128, 2368, 2368, 128, 128]
    - [22, 17714.0]
  - - [1024, 3584, 1, 3328, 1024, 1024, 3328, 3328]
    - [49, 17033.0]
  - - [512, 48000, 1, 2048, 512, 512, 2048, 2048]
    - [51, 19922.0]
  - - [5888, 1408, 1, 1280, 5888, 5888, 1280, 1280]
    - [49, 18276.0]
  - - [1024, 2368, 1, 256, 1024, 1024, 256, 256]
    - [29, 13906.0]
  - - [1408, 1856, 1, 1280, 1408, 1408, 1280, 1280]
    - [49, 16208.0]
  - - [6144, 24000, 1, 2048, 6144, 6144, 2048, 2048]
    - [13, 19854.0]
  - - [5056, 5056, 1, 1280, 5056, 5056, 1280, 1280]
    - [13, 19078.0]
  - - [448, 5056, 1, 256, 448, 448, 256, 256]
    - [10, 12795.0]
  - - [1760, 6400, 1, 1760, 1760, 1760, 1760, 1760]
    - [37, 19494.0]
  - - [1856, 1408, 1, 128, 1856, 1856, 128, 128]
    - [27, 13996.0]
  - - [6784, 256, 1, 3328, 6784, 6784, 3328, 3328]
    - [14, 16794.0]
  - - [6784, 4288, 1, 3328, 6784, 6784, 3328, 3328]
    - [7, 19479.0]
  - - [4288, 448, 1, 256, 4288, 4288, 256, 256]
    - [27, 12989.0]
  - - [1856, 2368, 1, 3328, 1856, 1856, 3328, 3328]
    - [13, 17872.0]
  - - [4288, 2944, 1, 1280, 4288, 4288, 1280, 1280]
    - [30, 19081.0]
  - - [704, 5056, 1, 1280, 704, 704, 1280, 1280]
    - [49, 16253.0]
  - - [2368, 704, 1, 3328, 2368, 2368, 3328, 3328]
    - [29, 14694.0]
  - - [256, 5888, 1, 256, 256, 256, 256, 256]
    - [10, 13821.0]
  - - [1856, 4288, 1, 3328, 1856, 1856, 3328, 3328]
    - [30, 17605.0]
  - - [5888, 1024, 1, 256, 5888, 5888, 256, 256]
    - [13, 17093.0]
  - - [16384, 3200, 1, 4096, 16384, 16384, 4096, 4096]
    - [43, 17671.0]
  - - [1408, 2944, 1, 256, 1408, 1408, 256, 256]
    - [47, 15569.0]
  - - [6784, 5056, 1, 3328, 6784, 6784, 3328, 3328]
    - [32, 19877.0]
  - - [5056, 5056, 1, 256, 5056, 5056, 256, 256]
    - [30, 18533.0]
  - - [1408, 6784, 1, 128, 1408, 1408, 128, 128]
    - [22, 17511.0]
  - - [704, 5056, 1, 128, 704, 704, 128, 128]
    - [10, 14264.0]
  - - [2368, 2944, 1, 1280, 2368, 2368, 1280, 1280]
    - [49, 17590.0]
  - - [6784, 6784, 1, 1280, 6784, 6784, 1280, 1280]
    - [41, 19751.0]
  - - [1408, 4288, 1, 1280, 1408, 1408, 1280, 1280]
    - [49, 17797.0]
  - - [3584, 4288, 1, 1280, 3584, 3584, 1280, 1280]
    - [30, 18979.0]
  - - [2368, 704, 1, 1280, 2368, 2368, 1280, 1280]
    - [48, 14404.0]
  - - [5056, 4288, 1, 3328, 5056, 5056, 3328, 3328]
    - [24, 19606.0]
  - - [3584, 2368, 1, 3328, 3584, 3584, 3328, 3328]
    - [49, 18746.0]
  - - [6784, 448, 1, 1280, 6784, 6784, 1280, 1280]
    - [30, 15951.0]
  - - [1408, 2944, 1, 128, 1408, 1408, 128, 128]
    - [46, 15451.0]
  - - [4288, 2944, 1, 256, 4288, 4288, 256, 256]
    - [13, 18269.0]
  - - [5888, 704, 1, 1280, 5888, 5888, 1280, 1280]
    - [49, 16629.0]
  - - [448, 5888, 1, 128, 448, 448, 128, 128]
    - [25, 13046.0]
  - - [5056, 2368, 1, 1280, 5056, 5056, 1280, 1280]
    - [30, 18157.0]
  - - [448, 3584, 1, 1280, 448, 448, 1280, 1280]
    - [15, 13161.0]
  - - [6784, 5888, 1, 256, 6784, 6784, 256, 256]
    - [13, 19175.0]
  - - [1024, 1408, 1, 256, 1024, 1024, 256, 256]
    - [12, 13229.0]
  - - [2368, 2368, 1, 3328, 2368, 2368, 3328, 3328]
    - [30, 16900.0]
  - - [1856, 6784, 1, 128, 1856, 1856, 128, 128]
    - [26, 17233.0]
  - - [5056, 704, 1, 3328, 5056, 5056, 3328, 3328]
    - [30, 16468.0]
  - - [1408, 1856, 1, 256, 1408, 1408, 256, 256]
    - [29, 14821.0]
  - - [2368, 5056, 1, 256, 2368, 2368, 256, 256]
    - [30, 17486.0]
  - - [3584, 2368, 1, 1280, 3584, 3584, 1280, 1280]
    - [49, 18623.0]
  - - [704, 5888, 1, 256, 704, 704, 256, 256]
    - [15, 15560.0]
  - - [6784, 2944, 1, 128, 6784, 6784, 128, 128]
    - [41, 18830.0]
  - - [2560, 1600, 1, 2560, 2560, 2560, 2560, 2560]
    - [32, 17309.0]
  - - [4288, 6784, 1, 3328, 4288, 4288, 3328, 3328]
    - [7, 19450.0]
  - - [2944, 6784, 1, 3328, 2944, 2944, 3328, 3328]
    - [30, 19735.0]
  - - [6144, 5984, 1, 2048, 6144, 6144, 2048, 2048]
    - [13, 19579.0]
  - - [3584, 704, 1, 3328, 3584, 3584, 3328, 3328]
    - [13, 15952.0]
  - - [2048, 1600, 1, 512, 2048, 2048, 512, 512]
    - [30, 16276.0]
  - - [448, 4288, 1, 256, 448, 448, 256, 256]
    - [10, 13451.0]
  - - [1856, 4288, 1, 128, 1856, 1856, 128, 128]
    - [46, 16088.0]
  - - [704, 2368, 1, 1280, 704, 704, 1280, 1280]
    - [24, 13495.0]
  - - [1856, 2368, 1, 1280, 1856, 1856, 1280, 1280]
    - [30, 17612.0]
  - - [1856, 4288, 1, 1280, 1856, 1856, 1280, 1280]
    - [30, 17484.0]
  - - [704, 2944, 1, 128, 704, 704, 128, 128]
    - [10, 13535.0]
  - - [1408, 1024, 1, 1280, 1408, 1408, 1280, 1280]
    - [29, 14835.0]
  - - [704, 6784, 1, 256, 704, 704, 256, 256]
    - [49, 15924.0]
  - - [6784, 704, 1, 256, 6784, 6784, 256, 256]
    - [30, 15903.0]
  - - [5056, 1408, 1, 128, 5056, 5056, 128, 128]
    - [9, 16793.0]
  - - [2048, 7000, 1, 2048, 2048, 2048, 2048, 2048]
    - [13, 19075.0]
  - - [3584, 4288, 1, 3328, 3584, 3584, 3328, 3328]
    - [49, 19105.0]
  - - [5888, 1856, 1, 1280, 5888, 5888, 1280, 1280]
    - [49, 18127.0]
  - - [2368, 3584, 1, 1280, 2368, 2368, 1280, 1280]
    - [49, 18621.0]
  - - [2368, 6784, 1, 1280, 2368, 2368, 1280, 1280]
    - [30, 19136.0]
  - - [2944, 3584, 1, 3328, 2944, 2944, 3328, 3328]
    - [13, 19507.0]
  - - [6784, 2944, 1, 256, 6784, 6784, 256, 256]
    - [30, 19018.0]
  - - [4288, 2368, 1, 3328, 4288, 4288, 3328, 3328]
    - [49, 18764.0]
  - - [1856, 2368, 1, 256, 1856, 1856, 256, 256]
    - [13, 15404.0]
  - - [3584, 6784, 1, 3328, 3584, 3584, 3328, 3328]
    - [24, 20044.0]
  - - [1024, 5888, 1, 3328, 1024, 1024, 3328, 3328]
    - [30, 18051.0]
  - - [6144, 24000, 1, 2560, 6144, 6144, 2560, 2560]
    - [15, 20300.0]
  - - [5056, 4288, 1, 1280, 5056, 5056, 1280, 1280]
    - [24, 19434.0]
  - - [6784, 1856, 1, 3328, 6784, 6784, 3328, 3328]
    - [49, 18381.0]
  - - [1408, 5056, 1, 1280, 1408, 1408, 1280, 1280]
    - [49, 17901.0]
  - - [2368, 2368, 1, 1280, 2368, 2368, 1280, 1280]
    - [49, 16732.0]
  - - [2944, 5888, 1, 128, 2944, 2944, 128, 128]
    - [41, 18511.0]
  - - [704, 5888, 1, 1280, 704, 704, 1280, 1280]
    - [32, 17210.0]
  - - [2368, 3584, 1, 128, 2368, 2368, 128, 128]
    - [5, 16780.0]
  - - [1856, 5056, 1, 128, 1856, 1856, 128, 128]
    - [46, 16692.0]
  - - [8192, 3200, 1, 2048, 8192, 8192, 2048, 2048]
    - [13, 19524.0]
  - - [1024, 5056, 1, 1280, 1024, 1024, 1280, 1280]
    - [13, 18280.0]
  - - [4288, 1024, 1, 256, 4288, 4288, 256, 256]
    - [13, 16324.0]
  - - [2944, 2368, 1, 128, 2944, 2944, 128, 128]
    - [41, 16343.0]
  - - [5888, 448, 1, 1280, 5888, 5888, 1280, 1280]
    - [48, 14298.0]
  - - [704, 5888, 1, 3328, 704, 704, 3328, 3328]
    - [32, 17577.0]
  - - [3584, 2944, 1, 256, 3584, 3584, 256, 256]
    - [49, 18616.0]
  - - [512, 24000, 1, 2048, 512, 512, 2048, 2048]
    - [49, 19341.0]
  - - [1408, 5056, 1, 3328, 1408, 1408, 3328, 3328]
    - [49, 18099.0]
  - - [1856, 1856, 1, 3328, 1856, 1856, 3328, 3328]
    - [30, 15948.0]
  - - [2560, 800, 1, 2560, 2560, 2560, 2560, 2560]
    - [13, 15955.0]
  - - [2368, 2368, 1, 256, 2368, 2368, 256, 256]
    - [30, 16050.0]
  - - [4288, 4288, 1, 1280, 4288, 4288, 1280, 1280]
    - [30, 18700.0]
  - - [5888, 1024, 1, 1280, 5888, 5888, 1280, 1280]
    - [30, 17881.0]
  - - [1408, 4288, 1, 256, 1408, 1408, 256, 256]
    - [30, 16892.0]
  - - [5888, 448, 1, 128, 5888, 5888, 128, 128]
    - [12, 13335.0]
  - - [512, 48000, 1, 2560, 512, 512, 2560, 2560]
    - [32, 20160.0]
  - - [704, 6784, 1, 3328, 704, 704, 3328, 3328]
    - [49, 17334.0]
  - - [2560, 6400, 1, 2560, 2560, 2560, 2560, 2560]
    - [32, 20075.0]
  - - [5056, 1024, 1, 1280, 5056, 5056, 1280, 1280]
    - [30, 18407.0]
  - - [448, 5888, 1, 3328, 448, 448, 3328, 3328]
    - [15, 14857.0]
  - - [1024, 2944, 1, 1280, 1024, 1024, 1280, 1280]
    - [32, 16431.0]
  - - [5056, 5888, 1, 1280, 5056, 5056, 1280, 1280]
    - [7, 19593.0]
  - - [4288, 5888, 1, 128, 4288, 4288, 128, 128]
    - [46, 18203.0]
  - - [1408, 3584, 1, 128, 1408, 1408, 128, 128]
    - [26, 16503.0]
  - - [448, 3584, 1, 128, 448, 448, 128, 128]
    - [8, 11624.0]
  - - [5888, 2944, 1, 1280, 5888, 5888, 1280, 1280]
    - [49, 19364.0]
  - - [2368, 5888, 1, 128, 2368, 2368, 128, 128]
    - [22, 17439.0]
  - - [3584, 5888, 1, 256, 3584, 3584, 256, 256]
    - [13, 19225.0]
  - - [2368, 1024, 1, 128, 2368, 2368, 128, 128]
    - [27, 13030.0]
  - - [2368, 704, 1, 128, 2368, 2368, 128, 128]
    - [12, 12138.0]
  - - [3584, 2944, 1, 1280, 3584, 3584, 1280, 1280]
    - [13, 19408.0]
  - - [3584, 2368, 1, 128, 3584, 3584, 128, 128]
    - [41, 16790.0]
  - - [5056, 704, 1, 128, 5056, 5056, 128, 128]
    - [45, 14309.0]
  - - [5056, 1408, 1, 3328, 5056, 5056, 3328, 3328]
    - [13, 18137.0]
  - - [6784, 1024, 1, 3328, 6784, 6784, 3328, 3328]
    - [15, 19225.0]
  - - [6784, 2944, 1, 3328, 6784, 6784, 3328, 3328]
    - [30, 19729.0]
  - - [2944, 5056, 1, 3328, 2944, 2944, 3328, 3328]
    - [32, 19671.0]
  - - [1856, 1856, 1, 256, 1856, 1856, 256, 256]
    - [47, 14391.0]
  - - [1024, 5888, 1, 128, 1024, 1024, 128, 128]
    - [9, 16533.0]
  - - [6784, 2368, 1, 1280, 6784, 6784, 1280, 1280]
    - [13, 19122.0]
  - - [4288, 5888, 1, 1280, 4288, 4288, 1280, 1280]
    - [24, 19594.0]
  - - [4288, 4288, 1, 256, 4288, 4288, 256, 256]
    - [13, 18042.0]
  - - [4288, 1856, 1, 1280, 4288, 4288, 1280, 1280]
    - [49, 17514.0]
  - - [1856, 2944, 1, 3328, 1856, 1856, 3328, 3328]
    - [13, 17946.0]
  - - [256, 6784, 1, 3328, 256, 256, 3328, 3328]
    - [14, 16803.0]
  - - [256, 5056, 1, 128, 256, 256, 128, 128]
    - [8, 12327.0]
  - - [5056, 1024, 1, 256, 5056, 5056, 256, 256]
    - [13, 17217.0]
  - - [5056, 1856, 1, 3328, 5056, 5056, 3328, 3328]
    - [30, 18348.0]
  - - [1856, 1408, 1, 256, 1856, 1856, 256, 256]
    - [47, 14282.0]
  - - [8448, 12000, 1, 2816, 8448, 8448, 2816, 2816]
    - [7, 20329.0]
  - - [4288, 1408, 1, 128, 4288, 4288, 128, 128]
    - [10, 15974.0]
  - - [1856, 5888, 1, 3328, 1856, 1856, 3328, 3328]
    - [51, 18842.0]
  - - [4288, 5056, 1, 256, 4288, 4288, 256, 256]
    - [15, 18430.0]
  - - [4096, 800, 1, 1024, 4096, 4096, 1024, 1024]
    - [13, 14825.0]
  - - [5056, 256, 1, 3328, 5056, 5056, 3328, 3328]
    - [12, 13527.0]
  - - [1024, 5888, 1, 1280, 1024, 1024, 1280, 1280]
    - [30, 17931.0]
  - - [6784, 2368, 1, 128, 6784, 6784, 128, 128]
    - [9, 17656.0]
  - - [1856, 1024, 1, 1280, 1856, 1856, 1280, 1280]
    - [43, 15350.0]
  - - [6784, 4288, 1, 1280, 6784, 6784, 1280, 1280]
    - [7, 19335.0]
  - - [1856, 1856, 1, 1280, 1856, 1856, 1280, 1280]
    - [30, 15568.0]
  - - [4096, 400, 1, 1024, 4096, 4096, 1024, 1024]
    - [32, 12817.0]
  - - [3072, 24000, 1, 1024, 3072, 3072, 1024, 1024]
    - [30, 19620.0]
  - - [5888, 1856, 1, 128, 5888, 5888, 128, 128]
    - [47, 16441.0]
  - - [5056, 3584, 1, 128, 5056, 5056, 128, 128]
    - [46, 17958.0]
  - - [5888, 5888, 1, 3328, 5888, 5888, 3328, 3328]
    - [24, 20111.0]
  - - [6784, 1024, 1, 256, 6784, 6784, 256, 256]
    - [13, 17798.0]
  - - [2944, 2368, 1, 256, 2944, 2944, 256, 256]
    - [30, 16818.0]
  - - [5056, 5888, 1, 3328, 5056, 5056, 3328, 3328]
    - [24, 19778.0]
  - - [1856, 1024, 1, 256, 1856, 1856, 256, 256]
    - [27, 12919.0]
  - - [512, 48000, 1, 1536, 512, 512, 1536, 1536]
    - [32, 20012.0]
  - - [3584, 448, 1, 1280, 3584, 3584, 1280, 1280]
    - [12, 13962.0]
  - - [8448, 5984, 1, 2816, 8448, 8448, 2816, 2816]
    - [13, 19712.0]
  - - [448, 5888, 1, 256, 448, 448, 256, 256]
    - [10, 13072.0]
  - - [1408, 6784, 1, 3328, 1408, 1408, 3328, 3328]
    - [49, 18715.0]
  - - [4288, 704, 1, 128, 4288, 4288, 128, 128]
    - [47, 13702.0]
  - - [5056, 2944, 1, 256, 5056, 5056, 256, 256]
    - [30, 18408.0]
  - - [6784, 5888, 1, 128, 6784, 6784, 128, 128]
    - [49, 18598.0]
  - - [2944, 704, 1, 128, 2944, 2944, 128, 128]
    - [47, 13264.0]
  - - [1408, 3584, 1, 3328, 1408, 1408, 3328, 3328]
    - [30, 18364.0]
  - - [2368, 6784, 1, 256, 2368, 2368, 256, 256]
    - [49, 18107.0]
  - - [5056, 1408, 1, 1280, 5056, 5056, 1280, 1280]
    - [13, 17975.0]
  - - [5056, 4288, 1, 128, 5056, 5056, 128, 128]
    - [22, 18128.0]
  - - [1408, 1856, 1, 128, 1408, 1408, 128, 128]
    - [12, 14222.0]
  - - [1408, 5888, 1, 3328, 1408, 1408, 3328, 3328]
    - [49, 18427.0]
  - - [6784, 6784, 1, 256, 6784, 6784, 256, 256]
    - [30, 19256.0]
  - - [4288, 2368, 1, 128, 4288, 4288, 128, 128]
    - [27, 16727.0]
  - - [2368, 2944, 1, 256, 2368, 2368, 256, 256]
    - [30, 16540.0]
  - - [3584, 1856, 1, 1280, 3584, 3584, 1280, 1280]
    - [49, 18107.0]
  - - [6784, 6784, 1, 128, 6784, 6784, 128, 128]
    - [13, 18611.0]
  - - [5888, 5056, 1, 256, 5888, 5888, 256, 256]
    - [13, 18786.0]
  - - [8448, 48000, 1, 2816, 8448, 8448, 2816, 2816]
    - [7, 20434.0]
  - - [3584, 448, 1, 256, 3584, 3584, 256, 256]
    - [48, 12797.0]
  - - [448, 4288, 1, 128, 448, 448, 128, 128]
    - [8, 12356.0]
  - - [256, 6784, 1, 256, 256, 256, 256, 256]
    - [10, 15611.0]
  - - [1408, 4288, 1, 128, 1408, 1408, 128, 128]
    - [27, 16020.0]
  - - [2944, 704, 1, 3328, 2944, 2944, 3328, 3328]
    - [32, 17201.0]
  - - [5056, 256, 1, 1280, 5056, 5056, 1280, 1280]
    - [48, 13197.0]
  - - [3584, 3584, 1, 256, 3584, 3584, 256, 256]
    - [49, 18940.0]
  - - [3584, 5056, 1, 256, 3584, 3584, 256, 256]
    - [30, 18504.0]
  - - [2944, 2368, 1, 1280, 2944, 2944, 1280, 1280]
    - [49, 17671.0]
  - - [1408, 3584, 1, 256, 1408, 1408, 256, 256]
    - [30, 17052.0]
  - - [6784, 3584, 1, 256, 6784, 6784, 256, 256]
    - [24, 19253.0]
  - - [5056, 2368, 1, 128, 5056, 5056, 128, 128]
    - [46, 17138.0]
  - - [2944, 2944, 1, 3328, 2944, 2944, 3328, 3328]
    - [13, 19157.0]
  - - [5056, 6784, 1, 256, 5056, 5056, 256, 256]
    - [30, 19052.0]
  - - [1856, 3584, 1, 128, 1856, 1856, 128, 128]
    - [27, 16095.0]
  - - [6784, 448, 1, 256, 6784, 6784, 256, 256]
    - [30, 14641.0]
  - - [3584, 6784, 1, 128, 3584, 3584, 128, 128]
    - [41, 18800.0]
  - - [5056, 1856, 1, 256, 5056, 5056, 256, 256]
    - [30, 17566.0]
  - - [4608, 5984, 1, 1536, 4608, 4608, 1536, 1536]
    - [32, 19563.0]
  - - [1760, 3200, 1, 1760, 1760, 1760, 1760, 1760]
    - [18, 19102.0]
  - - [1024, 1856, 1, 256, 1024, 1024, 256, 256]
    - [12, 13799.0]
  - - [4096, 1600, 1, 1024, 4096, 4096, 1024, 1024]
    - [13, 17631.0]
  - - [1408, 6784, 1, 1280, 1408, 1408, 1280, 1280]
    - [30, 18624.0]
  - - [3584, 3584, 1, 1280, 3584, 3584, 1280, 1280]
    - [32, 19925.0]
  - - [7680, 24000, 1, 2560, 7680, 7680, 2560, 2560]
    - [32, 20413.0]
  - - [4608, 48000, 1, 1536, 4608, 4608, 1536, 1536]
    - [32, 20361.0]
  - - [5888, 5888, 1, 128, 5888, 5888, 128, 128]
    - [49, 18805.0]
  - - [5056, 2368, 1, 3328, 5056, 5056, 3328, 3328]
    - [30, 18205.0]
  - - [2944, 4288, 1, 256, 2944, 2944, 256, 256]
    - [30, 18091.0]
  - - [1408, 3584, 1, 1280, 1408, 1408, 1280, 1280]
    - [49, 18236.0]
  - - [8192, 1600, 1, 2048, 8192, 8192, 2048, 2048]
    - [13, 18324.0]
  - - [512, 24000, 1, 2560, 512, 512, 2560, 2560]
    - [30, 19467.0]
  - - [2368, 6784, 1, 3328, 2368, 2368, 3328, 3328]
    - [13, 19225.0]
  - - [1856, 1408, 1, 1280, 1856, 1856, 1280, 1280]
    - [13, 15971.0]
  - - [6784, 704, 1, 128, 6784, 6784, 128, 128]
    - [46, 14939.0]
  - - [1408, 5888, 1, 256, 1408, 1408, 256, 256]
    - [49, 17707.0]
  - - [704, 2944, 1, 1280, 704, 704, 1280, 1280]
    - [15, 16591.0]
  - - [704, 6784, 1, 128, 704, 704, 128, 128]
    - [27, 15199.0]
  - - [3584, 704, 1, 1280, 3584, 3584, 1280, 1280]
    - [13, 15617.0]
  - - [5888, 2368, 1, 256, 5888, 5888, 256, 256]
    - [49, 18027.0]
  - - [2944, 6784, 1, 128, 2944, 2944, 128, 128]
    - [22, 18861.0]
  - - [3584, 448, 1, 3328, 3584, 3584, 3328, 3328]
    - [12, 14238.0]
  - - [704, 2368, 1, 3328, 704, 704, 3328, 3328]
    - [15, 13906.0]
  - - [256, 5888, 1, 128, 256, 256, 128, 128]
    - [27, 12897.0]
  - - [2048, 3200, 1, 512, 2048, 2048, 512, 512]
    - [30, 17703.0]
  - - [2944, 2944, 1, 1280, 2944, 2944, 1280, 1280]
    - [49, 19081.0]
  - - [5056, 448, 1, 3328, 5056, 5056, 3328, 3328]
    - [12, 15209.0]
  - - [6784, 704, 1, 3328, 6784, 6784, 3328, 3328]
    - [49, 17330.0]
  - - [5888, 4288, 1, 128, 5888, 5888, 128, 128]
    - [37, 18026.0]
  - - [1408, 2944, 1, 3328, 1408, 1408, 3328, 3328]
    - [32, 17567.0]
  - - [3584, 704, 1, 128, 3584, 3584, 128, 128]
    - [12, 13593.0]
  - - [4608, 12000, 1, 1536, 4608, 4608, 1536, 1536]
    - [32, 20199.0]
  - - [5056, 5056, 1, 128, 5056, 5056, 128, 128]
    - [26, 18110.0]
  - - [8192, 800, 1, 2048, 8192, 8192, 2048, 2048]
    - [13, 16601.0]
  - - [448, 5056, 1, 128, 448, 448, 128, 128]
    - [8, 12443.0]
  - - [5056, 3584, 1, 256, 5056, 5056, 256, 256]
    - [13, 18445.0]
  - - [1408, 5056, 1, 128, 1408, 1408, 128, 128]
    - [46, 16622.0]
  - - [2944, 3584, 1, 128, 2944, 2944, 128, 128]
    - [22, 18266.0]
  - - [3584, 2368, 1, 256, 3584, 3584, 256, 256]
    - [30, 17779.0]
  - - [8448, 24000, 1, 2816, 8448, 8448, 2816, 2816]
    - [7, 20422.0]
  - - [3584, 3584, 1, 3328, 3584, 3584, 3328, 3328]
    - [51, 20104.0]
  - - [5888, 6784, 1, 256, 5888, 5888, 256, 256]
    - [13, 19161.0]
  - - [4288, 2944, 1, 3328, 4288, 4288, 3328, 3328]
    - [30, 19167.0]
  - - [256, 5056, 1, 1280, 256, 256, 1280, 1280]
    - [48, 13294.0]
  - - [2944, 5888, 1, 3328, 2944, 2944, 3328, 3328]
    - [24, 19984.0]
  - - [6784, 5888, 1, 1280, 6784, 6784, 1280, 1280]
    - [32, 20033.0]
  - - [2048, 800, 1, 512, 2048, 2048, 512, 512]
    - [12, 13034.0]
  - - [5888, 4288, 1, 1280, 5888, 5888, 1280, 1280]
    - [24, 19624.0]
  - - [1024, 24000, 1, 2048, 1024, 1024, 2048, 2048]
    - [15, 19749.0]
  - - [5888, 3584, 1, 128, 5888, 5888, 128, 128]
    - [41, 18368.0]
  - - [1024, 2944, 1, 128, 1024, 1024, 128, 128]
    - [8, 14773.0]
  - - [704, 3584, 1, 128, 704, 704, 128, 128]
    - [47, 13434.0]
  - - [5888, 448, 1, 3328, 5888, 5888, 3328, 3328]
    - [12, 14414.0]
  - - [2368, 4288, 1, 1280, 2368, 2368, 1280, 1280]
    - [13, 18578.0]
  - - [4288, 2944, 1, 128, 4288, 4288, 128, 128]
    - [13, 17446.0]
  - - [1024, 6784, 1, 3328, 1024, 1024, 3328, 3328]
    - [15, 19678.0]
  - - [5056, 2944, 1, 3328, 5056, 5056, 3328, 3328]
    - [13, 19232.0]
  - - [2944, 3584, 1, 256, 2944, 2944, 256, 256]
    - [30, 18506.0]
  - - [1408, 1408, 1, 3328, 1408, 1408, 3328, 3328]
    - [51, 16546.0]
  - - [3584, 3584, 1, 128, 3584, 3584, 128, 128]
    - [41, 18240.0]
  - - [3584, 704, 1, 256, 3584, 3584, 256, 256]
    - [29, 14424.0]
  - - [3584, 1408, 1, 3328, 3584, 3584, 3328, 3328]
    - [30, 18379.0]
  - - [704, 3584, 1, 1280, 704, 704, 1280, 1280]
    - [49, 15693.0]
  - - [2944, 6784, 1, 1280, 2944, 2944, 1280, 1280]
    - [13, 19636.0]
  - - [1856, 6784, 1, 256, 1856, 1856, 256, 256]
    - [30, 17403.0]
  - - [4288, 448, 1, 3328, 4288, 4288, 3328, 3328]
    - [32, 15827.0]
  - - [6784, 4288, 1, 128, 6784, 6784, 128, 128]
    - [46, 18400.0]
  - - [6784, 704, 1, 1280, 6784, 6784, 1280, 1280]
    - [30, 17092.0]
  - - [3584, 6784, 1, 256, 3584, 3584, 256, 256]
    - [30, 19000.0]
  - - [6144, 12000, 1, 2048, 6144, 6144, 2048, 2048]
    - [13, 19789.0]
  - - [5888, 1024, 1, 3328, 5888, 5888, 3328, 3328]
    - [30, 18044.0]
  - - [704, 6784, 1, 1280, 704, 704, 1280, 1280]
    - [49, 17054.0]
  - - [1856, 5056, 1, 3328, 1856, 1856, 3328, 3328]
    - [49, 18373.0]
  - - [1024, 3584, 1, 128, 1024, 1024, 128, 128]
    - [8, 14735.0]
  - - [1024, 1408, 1, 128, 1024, 1024, 128, 128]
    - [8, 13530.0]
  - - [2368, 2944, 1, 128, 2368, 2368, 128, 128]
    - [27, 16003.0]
  - - [5056, 2944, 1, 128, 5056, 5056, 128, 128]
    - [5, 17863.0]
  - - [5888, 5056, 1, 3328, 5888, 5888, 3328, 3328]
    - [7, 19890.0]
  - - [5888, 2368, 1, 128, 5888, 5888, 128, 128]
    - [46, 17088.0]
  - - [3584, 6784, 1, 1280, 3584, 3584, 1280, 1280]
    - [7, 19669.0]
  - - [1856, 5888, 1, 256, 1856, 1856, 256, 256]
    - [15, 17119.0]
  - - [4288, 4288, 1, 3328, 4288, 4288, 3328, 3328]
    - [49, 18808.0]
  - - [4288, 1408, 1, 1280, 4288, 4288, 1280, 1280]
    - [30, 17775.0]
  - - [3584, 5056, 1, 128, 3584, 3584, 128, 128]
    - [41, 17897.0]
  - - [4288, 2368, 1, 256, 4288, 4288, 256, 256]
    - [30, 17829.0]
  - - [2944, 5056, 1, 1280, 2944, 2944, 1280, 1280]
    - [15, 19454.0]
  - - [448, 6784, 1, 256, 448, 448, 256, 256]
    - [10, 14592.0]
  - - [1856, 2368, 1, 128, 1856, 1856, 128, 128]
    - [47, 15354.0]
  - - [6784, 2368, 1, 3328, 6784, 6784, 3328, 3328]
    - [13, 19213.0]
  - - [4288, 1856, 1, 3328, 4288, 4288, 3328, 3328]
    - [49, 17602.0]
  - - [3584, 448, 1, 128, 3584, 3584, 128, 128]
    - [25, 12781.0]
  - - [2048, 1600, 1, 2048, 2048, 2048, 2048, 2048]
    - [13, 17371.0]
  - - [3584, 1024, 1, 1280, 3584, 3584, 1280, 1280]
    - [30, 16874.0]
  - - [1856, 5056, 1, 256, 1856, 1856, 256, 256]
    - [49, 17350.0]
  - - [1024, 4288, 1, 256, 1024, 1024, 256, 256]
    - [13, 15953.0]
  - - [5888, 3584, 1, 3328, 5888, 5888, 3328, 3328]
    - [51, 20212.0]
  - - [5056, 3584, 1, 3328, 5056, 5056, 3328, 3328]
    - [43, 19396.0]
  - - [2368, 1408, 1, 1280, 2368, 2368, 1280, 1280]
    - [13, 17344.0]
  - - [5056, 2944, 1, 1280, 5056, 5056, 1280, 1280]
    - [13, 19090.0]
  - - [1024, 6784, 1, 256, 1024, 1024, 256, 256]
    - [30, 18103.0]
  - - [5124, 9124, 1, 2048, 5124, 5124, 2048, 2048]
    - [32, 19301.0]
  - - [2944, 1408, 1, 128, 2944, 2944, 128, 128]
    - [47, 15229.0]
  - - [3584, 1408, 1, 1280, 3584, 3584, 1280, 1280]
    - [30, 18212.0]
  - - [5056, 6784, 1, 3328, 5056, 5056, 3328, 3328]
    - [7, 19769.0]
  - - [3584, 4288, 1, 256, 3584, 3584, 256, 256]
    - [49, 18265.0]
  - - [1856, 6784, 1, 3328, 1856, 1856, 3328, 3328]
    - [30, 18388.0]
  - - [5888, 4288, 1, 256, 5888, 5888, 256, 256]
    - [13, 18707.0]
  - - [5056, 1408, 1, 256, 5056, 5056, 256, 256]
    - [13, 16981.0]
  - - [3584, 1024, 1, 256, 3584, 3584, 256, 256]
    - [49, 16110.0]
  - - [5888, 5888, 1, 256, 5888, 5888, 256, 256]
    - [49, 19209.0]
  - - [4288, 1024, 1, 1280, 4288, 4288, 1280, 1280]
    - [15, 17542.0]
  - - [448, 6784, 1, 3328, 448, 448, 3328, 3328]
    - [51, 16953.0]
  - - [2944, 1408, 1, 1280, 2944, 2944, 1280, 1280]
    - [51, 17263.0]
  - - [2944, 1856, 1, 3328, 2944, 2944, 3328, 3328]
    - [13, 17907.0]
  - - [3584, 5888, 1, 1280, 3584, 3584, 1280, 1280]
    - [32, 20119.0]
  - - [6784, 1856, 1, 1280, 6784, 6784, 1280, 1280]
    - [13, 18278.0]
  - - [2944, 5056, 1, 256, 2944, 2944, 256, 256]
    - [30, 18496.0]
  - - [5888, 256, 1, 3328, 5888, 5888, 3328, 3328]
    - [49, 15305.0]
  - - [2944, 4288, 1, 128, 2944, 2944, 128, 128]
    - [26, 17552.0]
  - - [3584, 1408, 1, 256, 3584, 3584, 256, 256]
    - [49, 17420.0]
  - - [704, 3584, 1, 3328, 704, 704, 3328, 3328]
    - [49, 16028.0]
  - - [4096, 3200, 1, 1024, 4096, 4096, 1024, 1024]
    - [13, 18950.0]
  - - [5056, 448, 1, 1280, 5056, 5056, 1280, 1280]
    - [12, 14980.0]
  - - [3584, 1856, 1, 3328, 3584, 3584, 3328, 3328]
    - [49, 18266.0]
  - - [4288, 6784, 1, 1280, 4288, 4288, 1280, 1280]
    - [7, 19283.0]
  - - [2560, 7000, 1, 2560, 2560, 2560, 2560, 2560]
    - [30, 19387.0]
  - - [2944, 1024, 1, 256, 2944, 2944, 256, 256]
    - [26, 14490.0]
  - - [2368, 4288, 1, 3328, 2368, 2368, 3328, 3328]
    - [49, 18766.0]
  - - [1024, 1408, 1, 1280, 1024, 1024, 1280, 1280]
    - [12, 14740.0]
  - - [6784, 5056, 1, 256, 6784, 6784, 256, 256]
    - [13, 18915.0]
  - - [1856, 1856, 1, 128, 1856, 1856, 128, 128]
    - [47, 13617.0]
  - - [3584, 5056, 1, 3328, 3584, 3584, 3328, 3328]
    - [7, 19398.0]
  - - [448, 6784, 1, 128, 448, 448, 128, 128]
    - [47, 13508.0]
  - - [2944, 6784, 1, 256, 2944, 2944, 256, 256]
    - [30, 19139.0]
  - - [2944, 2944, 1, 128, 2944, 2944, 128, 128]
    - [41, 17813.0]
  - - [1856, 3584, 1, 1280, 1856, 1856, 1280, 1280]
    - [51, 18632.0]
  - - [4288, 448, 1, 128, 4288, 4288, 128, 128]
    - [12, 12597.0]
  - - [4608, 24000, 1, 1536, 4608, 4608, 1536, 1536]
    - [32, 20309.0]
  - - [1856, 1408, 1, 3328, 1856, 1856, 3328, 3328]
    - [13, 16522.0]
  - - [1024, 4288, 1, 3328, 1024, 1024, 3328, 3328]
    - [32, 18573.0]
  - - [5056, 448, 1, 256, 5056, 5056, 256, 256]
    - [12, 14033.0]
  - - [2944, 2368, 1, 3328, 2944, 2944, 3328, 3328]
    - [30, 17751.0]
  - - [704, 4288, 1, 3328, 704, 704, 3328, 3328]
    - [15, 16906.0]
  - - [1024, 1856, 1, 1280, 1024, 1024, 1280, 1280]
    - [43, 15335.0]
  - - [2048, 6400, 1, 2048, 2048, 2048, 2048, 2048]
    - [13, 19082.0]
  - - [512, 48000, 1, 2816, 512, 512, 2816, 2816]
    - [24, 20207.0]
  - - [5124, 9124, 1, 2560, 5124, 5124, 2560, 2560]
    - [15, 19378.0]
  - - [1024, 5888, 1, 256, 1024, 1024, 256, 256]
    - [13, 16839.0]
  - - [1408, 2368, 1, 256, 1408, 1408, 256, 256]
    - [30, 15519.0]
  - - [1408, 1408, 1, 256, 1408, 1408, 256, 256]
    - [29, 14248.0]
  - - [2368, 2368, 1, 128, 2368, 2368, 128, 128]
    - [46, 15583.0]
  - - [6784, 1408, 1, 128, 6784, 6784, 128, 128]
    - [41, 17607.0]
  - - [4288, 5888, 1, 256, 4288, 4288, 256, 256]
    - [15, 18898.0]
  - - [1408, 5056, 1, 256, 1408, 1408, 256, 256]
    - [49, 17032.0]
  - - [4288, 3584, 1, 128, 4288, 4288, 128, 128]
    - [5, 17735.0]
  - - [3584, 5056, 1, 1280, 3584, 3584, 1280, 1280]
    - [32, 19214.0]
  - - [1856, 1024, 1, 128, 1856, 1856, 128, 128]
    - [27, 12225.0]
  - - [1024, 24000, 1, 1536, 1024, 1024, 1536, 1536]
    - [15, 19841.0]
  - - [704, 4288, 1, 256, 704, 704, 256, 256]
    - [47, 14112.0]
  - - [5888, 2368, 1, 1280, 5888, 5888, 1280, 1280]
    - [13, 18651.0]
  - - [2368, 5888, 1, 1280, 2368, 2368, 1280, 1280]
    - [30, 18635.0]
  - - [5888, 256, 1, 1280, 5888, 5888, 1280, 1280]
    - [30, 15064.0]
  - - [2368, 1856, 1, 3328, 2368, 2368, 3328, 3328]
    - [49, 17905.0]
  - - [2944, 704, 1, 256, 2944, 2944, 256, 256]
    - [51, 14513.0]
  - - [2368, 1024, 1, 3328, 2368, 2368, 3328, 3328]
    - [30, 15457.0]
  - - [704, 3584, 1, 256, 704, 704, 256, 256]
    - [27, 14297.0]
  - - [704, 2944, 1, 3328, 704, 704, 3328, 3328]
    - [32, 17162.0]
  - - [6784, 1024, 1, 128, 6784, 6784, 128, 128]
    - [46, 17615.0]
  - - [2944, 1024, 1, 3328, 2944, 2944, 3328, 3328]
    - [13, 16214.0]
  - - [2944, 5056, 1, 128, 2944, 2944, 128, 128]
    - [22, 17900.0]
  - - [1408, 6784, 1, 256, 1408, 1408, 256, 256]
    - [49, 18116.0]
  - - [6784, 1408, 1, 3328, 6784, 6784, 3328, 3328]
    - [49, 18707.0]
  - - [4288, 6784, 1, 128, 4288, 4288, 128, 128]
    - [46, 18382.0]
  - - [6784, 2944, 1, 1280, 6784, 6784, 1280, 1280]
    - [30, 19652.0]
  - - [4288, 1856, 1, 128, 4288, 4288, 128, 128]
    - [26, 15843.0]
  - - [1856, 2944, 1, 128, 1856, 1856, 128, 128]
    - [27, 15845.0]
  - - [6784, 448, 1, 128, 6784, 6784, 128, 128]
    - [21, 13874.0]
  - - [448, 5056, 1, 1280, 448, 448, 1280, 1280]
    - [30, 14147.0]
  - - [2368, 1856, 1, 128, 2368, 2368, 128, 128]
    - [47, 15421.0]
  - - [4288, 704, 1, 256, 4288, 4288, 256, 256]
    - [30, 14505.0]
  - - [5888, 704, 1, 256, 5888, 5888, 256, 256]
    - [30, 15370.0]
  - - [3584, 1024, 1, 128, 3584, 3584, 128, 128]
    - [27, 15272.0]
  - - [256, 5888, 1, 3328, 256, 256, 3328, 3328]
    - [49, 15401.0]
  - - [1408, 4288, 1, 3328, 1408, 1408, 3328, 3328]
    - [49, 18079.0]
  - - [6784, 4288, 1, 256, 6784, 6784, 256, 256]
    - [30, 18762.0]
  - - [5888, 256, 1, 256, 5888, 5888, 256, 256]
    - [47, 13616.0]
  - - [6784, 1024, 1, 1280, 6784, 6784, 1280, 1280]
    - [32, 19036.0]
  - - [5888, 1024, 1, 128, 5888, 5888, 128, 128]
    - [49, 16547.0]
  - - [6784, 3584, 1, 1280, 6784, 6784, 1280, 1280]
    - [32, 19932.0]
  - - [1024, 6784, 1, 1280, 1024, 1024, 1280, 1280]
    - [32, 19139.0]
  - - [1408, 2944, 1, 1280, 1408, 1408, 1280, 1280]
    - [32, 17240.0]
  - - [2048, 800, 1, 2048, 2048, 2048, 2048, 2048]
    - [12, 14223.0]
  - - [1408, 2368, 1, 3328, 1408, 1408, 3328, 3328]
    - [13, 17858.0]
  - - [2944, 1856, 1, 128, 2944, 2944, 128, 128]
    - [27, 15874.0]
  - - [256, 6784, 1, 128, 256, 256, 128, 128]
    - [27, 14510.0]
  - - [5056, 6784, 1, 128, 5056, 5056, 128, 128]
    - [22, 18461.0]
  - - [4288, 5056, 1, 128, 4288, 4288, 128, 128]
    - [22, 17787.0]
  - - [1856, 5888, 1, 128, 1856, 1856, 128, 128]
    - [30, 16800.0]
  - - [2944, 5888, 1, 256, 2944, 2944, 256, 256]
    - [15, 18964.0]
  - - [3584, 1856, 1, 256, 3584, 3584, 256, 256]
    - [49, 17149.0]
  - - [4288, 3584, 1, 1280, 4288, 4288, 1280, 1280]
    - [30, 19037.0]
  - - [704, 5888, 1, 128, 704, 704, 128, 128]
    - [10, 14862.0]
  - - [6784, 3584, 1, 128, 6784, 6784, 128, 128]
    - [46, 18660.0]
  - - [4288, 5056, 1, 3328, 4288, 4288, 3328, 3328]
    - [7, 19754.0]
  - - [1408, 1408, 1, 128, 1408, 1408, 128, 128]
    - [47, 13134.0]
  - - [5056, 2368, 1, 256, 5056, 5056, 256, 256]
    - [13, 17603.0]
  - - [4288, 704, 1, 3328, 4288, 4288, 3328, 3328]
    - [13, 16168.0]
  - - [448, 3584, 1, 256, 448, 448, 256, 256]
    - [26, 11818.0]
  - - [2368, 1024, 1, 1280, 2368, 2368, 1280, 1280]
    - [30, 15058.0]
  - - [2944, 1408, 1, 3328, 2944, 2944, 3328, 3328]
    - [51, 17591.0]
  - - [1024, 1408, 1, 3328, 1024, 1024, 3328, 3328]
    - [29, 15056.0]
  - - [2944, 5888, 1, 1280, 2944, 2944, 1280, 1280]
    - [15, 19813.0]
  - - [5888, 3584, 1, 256, 5888, 5888, 256, 256]
    - [13, 19139.0]
  - - [2368, 5056, 1, 128, 2368, 2368, 128, 128]
    - [22, 16807.0]
  - - [1408, 1856, 1, 3328, 1408, 1408, 3328, 3328]
    - [30, 16597.0]
  - - [6784, 1408, 1, 1280, 6784, 6784, 1280, 1280]
    - [13, 18619.0]
  - - [4096, 7000, 1, 4096, 4096, 4096, 4096, 4096]
    - [13, 19219.0]
  - - [704, 2944, 1, 256, 704, 704, 256, 256]
    - [27, 14278.0]
  - - [6784, 5888, 1, 3328, 6784, 6784, 3328, 3328]
    - [7, 20145.0]
  - - [2368, 4288, 1, 128, 2368, 2368, 128, 128]
    - [27, 16710.0]
  - - [1024, 6784, 1, 128, 1024, 1024, 128, 128]
    - [5, 17279.0]
  - - [1408, 1408, 1, 1280, 1408, 1408, 1280, 1280]
    - [51, 16165.0]
  - - [16384, 400, 1, 4096, 16384, 16384, 4096, 4096]
    - [32, 13458.0]
  - - [448, 4288, 1, 3328, 448, 448, 3328, 3328]
    - [51, 15864.0]
  - - [2368, 1408, 1, 256, 2368, 2368, 256, 256]
    - [30, 15877.0]
  - - [5888, 5056, 1, 128, 5888, 5888, 128, 128]
    - [13, 18168.0]
  - - [704, 2368, 1, 256, 704, 704, 256, 256]
    - [27, 11921.0]
  - - [1024, 24000, 1, 2560, 1024, 1024, 2560, 2560]
    - [15, 20126.0]
  - - [5888, 2368, 1, 3328, 5888, 5888, 3328, 3328]
    - [13, 18735.0]
  - - [5124, 9124, 1, 1760, 5124, 5124, 1760, 1760]
    - [37, 19942.0]
  - - [4288, 448, 1, 1280, 4288, 4288, 1280, 1280]
    - [32, 15100.0]
  - - [5888, 704, 1, 3328, 5888, 5888, 3328, 3328]
    - [30, 16852.0]
  - - [5056, 256, 1, 128, 5056, 5056, 128, 128]
    - [8, 11363.0]
  - - [1408, 5888, 1, 128, 1408, 1408, 128, 128]
    - [22, 17283.0]
  - - [7680, 12000, 1, 2560, 7680, 7680, 2560, 2560]
    - [15, 20272.0]
  - - [1408, 1024, 1, 256, 1408, 1408, 256, 256]
    - [29, 13126.0]
  - - [8192, 400, 1, 2048, 8192, 8192, 2048, 2048]
    - [12, 13677.0]
  - - [1024, 1856, 1, 128, 1024, 1024, 128, 128]
    - [8, 13823.0]
  - - [5056, 6784, 1, 1280, 5056, 5056, 1280, 1280]
    - [24, 19636.0]
  - - [704, 5056, 1, 3328, 704, 704, 3328, 3328]
    - [13, 16451.0]
  - - [2368, 2944, 1, 3328, 2368, 2368, 3328, 3328]
    - [49, 17751.0]
  - - [2368, 3584, 1, 256, 2368, 2368, 256, 256]
    - [13, 17412.0]
  - - [5056, 3584, 1, 1280, 5056, 5056, 1280, 1280]
    - [32, 19259.0]
  - - [5124, 9124, 1, 4096, 5124, 5124, 4096, 4096]
    - [32, 19305.0]
  - - [7680, 48000, 1, 2560, 7680, 7680, 2560, 2560]
    - [32, 20423.0]
  - - [1856, 2944, 1, 1280, 1856, 1856, 1280, 1280]
    - [49, 17655.0]
  - - [1024, 48000, 1, 2816, 1024, 1024, 2816, 2816]
    - [7, 20310.0]
  - - [2944, 1408, 1, 256, 2944, 2944, 256, 256]
    - [30, 15437.0]
  - - [4288, 1408, 1, 3328, 4288, 4288, 3328, 3328]
    - [30, 18073.0]
  - - [5888, 2944, 1, 128, 5888, 5888, 128, 128]
    - [41, 18151.0]
  - - [2944, 1024, 1, 128, 2944, 2944, 128, 128]
    - [27, 14518.0]
  - - [4288, 5056, 1, 1280, 4288, 4288, 1280, 1280]
    - [15, 19542.0]
  - - [5888, 6784, 1, 1280, 5888, 5888, 1280, 1280]
    - [49, 19815.0]
  - - [6784, 5056, 1, 128, 6784, 6784, 128, 128]
    - [46, 18324.0]
  - - [1760, 1600, 1, 1760, 1760, 1760, 1760, 1760]
    - [17, 16952.0]
  - - [5888, 1408, 1, 3328, 5888, 5888, 3328, 3328]
    - [49, 18437.0]
  - - [2368, 1856, 1, 256, 2368, 2368, 256, 256]
    - [30, 16189.0]
  - - [256, 5056, 1, 256, 256, 256, 256, 256]
    - [29, 12570.0]
  - - [448, 3584, 1, 3328, 448, 448, 3328, 3328]
    - [15, 13466.0]
  - - [704, 2368, 1, 128, 704, 704, 128, 128]
    - [25, 12363.0]
  - - [5888, 256, 1, 128, 5888, 5888, 128, 128]
    - [9, 12384.0]
  - - [3584, 1856, 1, 128, 3584, 3584, 128, 128]
    - [41, 16274.0]
  - - [4288, 4288, 1, 128, 4288, 4288, 128, 128]
    - [46, 17838.0]
  - - [1856, 1024, 1, 3328, 1856, 1856, 3328, 3328]
    - [43, 15855.0]
  - - [1024, 5056, 1, 256, 1024, 1024, 256, 256]
    - [49, 16962.0]
  - - [5888, 5888, 1, 1280, 5888, 5888, 1280, 1280]
    - [7, 19950.0]
  - - [5056, 5888, 1, 128, 5056, 5056, 128, 128]
    - [26, 18546.0]
  - - [2368, 1408, 1, 3328, 2368, 2368, 3328, 3328]
    - [13, 17817.0]
  - - [1024, 48000, 1, 1536, 1024, 1024, 1536, 1536]
    - [15, 20027.0]
  - - [5888, 448, 1, 256, 5888, 5888, 256, 256]
    - [12, 13398.0]
  - - [2560, 3200, 1, 2560, 2560, 2560, 2560, 2560]
    - [13, 19345.0]
  - - [5888, 6784, 1, 128, 5888, 5888, 128, 128]
    - [49, 18217.0]
  - - [6144, 48000, 1, 2048, 6144, 6144, 2048, 2048]
    - [13, 19923.0]
  - - [6784, 5056, 1, 1280, 6784, 6784, 1280, 1280]
    - [7, 19727.0]
  - - [5056, 704, 1, 1280, 5056, 5056, 1280, 1280]
    - [49, 16092.0]
  - - [1024, 48000, 1, 2560, 1024, 1024, 2560, 2560]
    - [32, 20251.0]
  - - [1024, 2368, 1, 128, 1024, 1024, 128, 128]
    - [8, 13844.0]
  - - [16384, 800, 1, 4096, 16384, 16384, 4096, 4096]
    - [41, 15652.0]
  - - [5888, 5056, 1, 1280, 5888, 5888, 1280, 1280]
    - [7, 19692.0]
  - - [3072, 48000, 1, 1024, 3072, 3072, 1024, 1024]
    - [30, 19810.0]
  - - [6784, 1408, 1, 256, 6784, 6784, 256, 256]
    - [30, 17812.0]
  - - [3584, 5888, 1, 128, 3584, 3584, 128, 128]
    - [41, 18805.0]
  - - [5056, 5888, 1, 256, 5056, 5056, 256, 256]
    - [13, 18798.0]
  - - [2368, 1024, 1, 256, 2368, 2368, 256, 256]
    - [14, 13390.0]
  - - [2944, 1856, 1, 256, 2944, 2944, 256, 256]
    - [30, 16613.0]
  - - [1856, 6784, 1, 1280, 1856, 1856, 1280, 1280]
    - [30, 18298.0]
  - - [4288, 3584, 1, 256, 4288, 4288, 256, 256]
    - [13, 18343.0]
  - - [6784, 448, 1, 3328, 6784, 6784, 3328, 3328]
    - [13, 16232.0]
  - - [5056, 1856, 1, 1280, 5056, 5056, 1280, 1280]
    - [30, 18215.0]
  - - [1408, 1024, 1, 3328, 1408, 1408, 3328, 3328]
    - [29, 15049.0]
  - - [5888, 3584, 1, 1280, 5888, 5888, 1280, 1280]
    - [51, 20087.0]
  - - [1856, 3584, 1, 3328, 1856, 1856, 3328, 3328]
    - [15, 18942.0]
  - - [1024, 2944, 1, 256, 1024, 1024, 256, 256]
    - [13, 15085.0]
  - - [448, 6784, 1, 1280, 448, 448, 1280, 1280]
    - [32, 16613.0]
  - - [704, 5056, 1, 256, 704, 704, 256, 256]
    - [49, 14967.0]
  - - [3584, 1024, 1, 3328, 3584, 3584, 3328, 3328]
    - [30, 17028.0]
  - - [2944, 1856, 1, 1280, 2944, 2944, 1280, 1280]
    - [49, 17746.0]
  - - [5056, 256, 1, 256, 5056, 5056, 256, 256]
    - [12, 12040.0]
  - - [2944, 4288, 1, 3328, 2944, 2944, 3328, 3328]
    - [51, 19667.0]
  - - [2368, 3584, 1, 3328, 2368, 2368, 3328, 3328]
    - [49, 18772.0]
  - - [2944, 704, 1, 1280, 2944, 2944, 1280, 1280]
    - [32, 16710.0]
  - - [2944, 3584, 1, 1280, 2944, 2944, 1280, 1280]
    - [49, 19429.0]
  - - [1856, 5888, 1, 1280, 1856, 1856, 1280, 1280]
    - [15, 18650.0]
  - - [2048, 3200, 1, 2048, 2048, 2048, 2048, 2048]
    - [15, 18503.0]
  - - [4288, 1408, 1, 256, 4288, 4288, 256, 256]
    - [13, 16933.0]
  - - [5888, 1408, 1, 128, 5888, 5888, 128, 128]
    - [49, 17255.0]
  - - [4288, 2368, 1, 1280, 4288, 4288, 1280, 1280]
    - [49, 18648.0]
  - - [6784, 2368, 1, 256, 6784, 6784, 256, 256]
    - [13, 18348.0]
  - - [1024, 24000, 1, 2816, 1024, 1024, 2816, 2816]
    - [7, 20196.0]
  - - [7680, 5984, 1, 2560, 7680, 7680, 2560, 2560]
    - [32, 19820.0]
  - - [4288, 1856, 1, 256, 4288, 4288, 256, 256]
    - [30, 16436.0]
  - - [1856, 2944, 1, 256, 1856, 1856, 256, 256]
    - [30, 16609.0]
  - - [5056, 1024, 1, 128, 5056, 5056, 128, 128]
    - [9, 16584.0]
  - - [1760, 800, 1, 1760, 1760, 1760, 1760, 1760]
    - [18, 14696.0]
  - - [6784, 256, 1, 128, 6784, 6784, 128, 128]
    - [27, 14663.0]
  - - [5888, 704, 1, 128, 5888, 5888, 128, 128]
    - [47, 14473.0]
  - - [1408, 2368, 1, 128, 1408, 1408, 128, 128]
    - [27, 15275.0]
  - - [1024, 4288, 1, 1280, 1024, 1024, 1280, 1280]
    - [32, 18049.0]
  - - [2368, 5056, 1, 3328, 2368, 2368, 3328, 3328]
    - [32, 18722.0]
  - - [4288, 1024, 1, 3328, 4288, 4288, 3328, 3328]
    - [30, 17866.0]
  - - [6144, 48000, 1, 2560, 6144, 6144, 2560, 2560]
    - [15, 20366.0]
  - - [1024, 5056, 1, 3328, 1024, 1024, 3328, 3328]
    - [30, 18750.0]
  - - [1024, 1856, 1, 3328, 1024, 1024, 3328, 3328]
    - [32, 15815.0]
  - - [4288, 6784, 1, 256, 4288, 4288, 256, 256]
    - [13, 18727.0]
  - - [3584, 2944, 1, 3328, 3584, 3584, 3328, 3328]
    - [13, 19497.0]
  - - [5888, 2944, 1, 256, 5888, 5888, 256, 256]
    - [13, 18714.0]
  - - [448, 4288, 1, 1280, 448, 448, 1280, 1280]
    - [51, 15430.0]
  - - [1024, 4288, 1, 128, 1024, 1024, 128, 128]
    - [8, 15612.0]
  - - [5056, 4288, 1, 256, 5056, 5056, 256, 256]
    - [30, 18626.0]
  - - [1024, 3584, 1, 256, 1024, 1024, 256, 256]
    - [13, 16016.0]
  - - [6784, 6784, 1, 3328, 6784, 6784, 3328, 3328]
    - [7, 19889.0]
  - - [448, 5888, 1, 1280, 448, 448, 1280, 1280]
    - [15, 14435.0]
  - - [5056, 448, 1, 128, 5056, 5056, 128, 128]
    - [25, 13939.0]
  - - [4288, 704, 1, 1280, 4288, 4288, 1280, 1280]
    - [49, 15883.0]
  - - [3584, 2944, 1, 128, 3584, 3584, 128, 128]
    - [49, 18065.0]
  - - [6784, 256, 1, 1280, 6784, 6784, 1280, 1280]
    - [50, 16612.0]
  - - [2368, 5888, 1, 3328, 2368, 2368, 3328, 3328]
    - [30, 18706.0]
  - - [2368, 1856, 1, 1280, 2368, 2368, 1280, 1280]
    - [49, 17491.0]
  - - [448, 5056, 1, 3328, 448, 448, 3328, 3328]
    - [49, 14428.0]
  - - [3584, 4288, 1, 128, 3584, 3584, 128, 128]
    - [49, 17601.0]
  - - [5888, 4288, 1, 3328, 5888, 5888, 3328, 3328]
    - [7, 19866.0]
  - - [2368, 704, 1, 256, 2368, 2368, 256, 256]
    - [27, 11466.0]
  - - [3584, 1408, 1, 128, 3584, 3584, 128, 128]
    - [41, 16453.0]
  - - [1856, 5056, 1, 1280, 1856, 1856, 1280, 1280]
    - [49, 18257.0]
  - - [2944, 1024, 1, 1280, 2944, 2944, 1280, 1280]
    - [49, 16053.0]
  - - [3584, 5888, 1, 3328, 3584, 3584, 3328, 3328]
    - [24, 20282.0]
  - - [2368, 4288, 1, 256, 2368, 2368, 256, 256]
    - [30, 17509.0]
  - - [1024, 2368, 1, 3328, 1024, 1024, 3328, 3328]
    - [30, 15447.0]
  - - [1024, 3584, 1, 1280, 1024, 1024, 1280, 1280]
    - [30, 16887.0]
  - - [4288, 5888, 1, 3328, 4288, 4288, 3328, 3328]
    - [32, 19752.0]
  - - [1024, 2944, 1, 3328, 1024, 1024, 3328, 3328]
    - [32, 16844.0]
  - - [6784, 1856, 1, 256, 6784, 6784, 256, 256]
    - [13, 17748.0]
  - - [256, 6784, 1, 1280, 256, 256, 1280, 1280]
    - [31, 16599.0]
  - - [1856, 3584, 1, 256, 1856, 1856, 256, 256]
    - [24, 17032.0]
  - - [6784, 1856, 1, 128, 6784, 6784, 128, 128]
    - [9, 17255.0]
  - - [512, 24000, 1, 2816, 512, 512, 2816, 2816]
    - [49, 19476.0]
  - - [256, 5888, 1, 1280, 256, 256, 1280, 1280]
    - [49, 14851.0]
  - - [16384, 1600, 1, 4096, 16384, 16384, 4096, 4096]
    - [51, 17233.0]
  - - [2368, 1408, 1, 128, 2368, 2368, 128, 128]
    - [47, 15177.0]
  - - [1408, 1024, 1, 128, 1408, 1408, 128, 128]
    - [40, 12763.0]
  - - [6784, 3584, 1, 3328, 6784, 6784, 3328, 3328]
    - [24, 20085.0]
  - - [1760, 7000, 1, 1760, 1760, 1760, 1760, 1760]
    - [37, 19414.0]
  - - [2368, 5056, 1, 1280, 2368, 2368, 1280, 1280]
    - [32, 18583.0]
  - - [1408, 2368, 1, 1280, 1408, 1408, 1280, 1280]
    - [30, 17465.0]
  - - [704, 4288, 1, 128, 704, 704, 128, 128]
    - [27, 13741.0]
  - - [2944, 2944, 1, 256, 2944, 2944, 256, 256]
    - [30, 18496.0]
  - - [6784, 256, 1, 256, 6784, 6784, 256, 256]
    - [47, 16028.0]
  - - [256, 5056, 1, 3328, 256, 256, 3328, 3328]
    - [29, 13585.0]
  - - [5056, 1856, 1, 128, 5056, 5056, 128, 128]
    - [26, 16999.0]
  - - [5056, 1024, 1, 3328, 5056, 5056, 3328, 3328]
    - [30, 18743.0]
  - - [4288, 3584, 1, 3328, 4288, 4288, 3328, 3328]
    - [49, 19097.0]
  - - [1024, 2368, 1, 1280, 1024, 1024, 1280, 1280]
    - [49, 14919.0]
  - - [5888, 6784, 1, 3328, 5888, 5888, 3328, 3328]
    - [13, 19896.0]
  - - [704, 4288, 1, 1280, 704, 704, 1280, 1280]
    - [15, 16257.0]
  - - [1024, 48000, 1, 2048, 1024, 1024, 2048, 2048]
    - [32, 20016.0]
  - - [4288, 1024, 1, 128, 4288, 4288, 128, 128]
    - [27, 15441.0]
  - - [4096, 512, 1, 32, 4096, 4096, 32, 32]
    - [0, 9670.0]
  - - [2048, 1024, 1, 1664, 2048, 2048, 1664, 1664]
    - [24, 17403.0]
  - - [4096, 512, 1, 1408, 4096, 4096, 1408, 1408]
    - [24, 17225.0]
  - - [4096, 1024, 1, 1280, 4096, 4096, 1280, 1280]
    - [30, 17018.0]
  - - [2048, 1024, 1, 640, 2048, 2048, 640, 640]
    - [43, 16761.0]
  - - [4096, 1024, 1, 13312, 4096, 4096, 13312, 13312]
    - [49, 16466.0]
  - - [2048, 1024, 1, 13312, 2048, 2048, 13312, 13312]
    - [13, 15939.0]
  - - [2048, 1024, 1, 3584, 2048, 2048, 3584, 3584]
    - [15, 17407.0]
  - - [4096, 1024, 1, 1920, 4096, 4096, 1920, 1920]
    - [46, 17318.0]
  - - [4096, 1024, 1, 12288, 4096, 4096, 12288, 12288]
    - [32, 16165.0]
  - - [4096, 1024, 1, 8320, 4096, 4096, 8320, 8320]
    - [24, 17227.0]
  - - [4096, 1024, 1, 15360, 4096, 4096, 15360, 15360]
    - [49, 16042.0]
  - - [4096, 512, 1, 3072, 4096, 4096, 3072, 3072]
    - [15, 17341.0]
  - - [4096, 512, 1, 13312, 4096, 4096, 13312, 13312]
    - [13, 14645.0]
  - - [4096, 1024, 1, 3840, 4096, 4096, 3840, 3840]
    - [49, 17132.0]
  - - [2048, 1024, 1, 3200, 2048, 2048, 3200, 3200]
    - [24, 17601.0]
  - - [4096, 512, 1, 3840, 4096, 4096, 3840, 3840]
    - [43, 17573.0]
  - - [4096, 512, 1, 5632, 4096, 4096, 5632, 5632]
    - [32, 17621.0]
  - - [4096, 512, 1, 64, 4096, 4096, 64, 64]
    - [0, 12662.0]
  - - [2048, 1024, 1, 512, 2048, 2048, 512, 512]
    - [32, 16146.0]
  - - [4096, 512, 1, 8192, 4096, 4096, 8192, 8192]
    - [15, 16401.0]
  - - [4096, 512, 1, 2304, 4096, 4096, 2304, 2304]
    - [15, 17227.0]
  - - [4096, 512, 1, 2816, 4096, 4096, 2816, 2816]
    - [15, 17456.0]
  - - [2048, 1024, 1, 7680, 2048, 2048, 7680, 7680]
    - [15, 17642.0]
  - - [4096, 512, 1, 1920, 4096, 4096, 1920, 1920]
    - [24, 17384.0]
  - - [4096, 1024, 1, 32, 4096, 4096, 32, 32]
    - [8, 12005.0]
  - - [4096, 512, 1, 16640, 4096, 4096, 16640, 16640]
    - [51, 17690.0]
  - - [2048, 1024, 1, 1024, 2048, 2048, 1024, 1024]
    - [51, 16702.0]
  - - [4096, 512, 1, 1792, 4096, 4096, 1792, 1792]
    - [51, 17239.0]
  - - [4096, 1024, 1, 8192, 4096, 4096, 8192, 8192]
    - [32, 15605.0]
  - - [2048, 1024, 1, 4160, 2048, 2048, 4160, 4160]
    - [43, 17593.0]
  - - [4096, 512, 1, 10240, 4096, 4096, 10240, 10240]
    - [51, 15771.0]
  - - [4096, 512, 1, 512, 4096, 4096, 512, 512]
    - [28, 15698.0]
  - - [2048, 1024, 1, 6656, 2048, 2048, 6656, 6656]
    - [15, 17600.0]
  - - [2048, 1024, 1, 14336, 2048, 2048, 14336, 14336]
    - [13, 15901.0]
  - - [4096, 512, 1, 11264, 4096, 4096, 11264, 11264]
    - [13, 15197.0]
  - - [4096, 512, 1, 128, 4096, 4096, 128, 128]
    - [27, 13489.0]
  - - [4096, 512, 1, 768, 4096, 4096, 768, 768]
    - [15, 16697.0]
  - - [4096, 1024, 1, 11264, 4096, 4096, 11264, 11264]
    - [49, 16050.0]
  - - [4096, 1024, 1, 16640, 4096, 4096, 16640, 16640]
    - [49, 17218.0]
  - - [2048, 1024, 1, 5632, 2048, 2048, 5632, 5632]
    - [15, 17537.0]
  - - [4096, 512, 1, 12288, 4096, 4096, 12288, 12288]
    - [14, 14291.0]
  - - [4096, 1024, 1, 5632, 4096, 4096, 5632, 5632]
    - [30, 17170.0]
  - - [2048, 1024, 1, 10240, 2048, 2048, 10240, 10240]
    - [15, 17600.0]
  - - [4096, 1024, 1, 640, 4096, 4096, 640, 640]
    - [46, 16891.0]
  - - [2048, 1024, 1, 12288, 2048, 2048, 12288, 12288]
    - [15, 16936.0]
  - - [4096, 1024, 1, 10240, 4096, 4096, 10240, 10240]
    - [51, 16264.0]
  - - [2048, 1024, 1, 4608, 2048, 2048, 4608, 4608]
    - [15, 17481.0]
  - - [4096, 512, 1, 3584, 4096, 4096, 3584, 3584]
    - [15, 17475.0]
  - - [4096, 1024, 1, 4608, 4096, 4096, 4608, 4608]
    - [30, 17165.0]
  - - [4096, 1024, 1, 3328, 4096, 4096, 3328, 3328]
    - [30, 17166.0]
  - - [2048, 1024, 1, 9216, 2048, 2048, 9216, 9216]
    - [15, 17661.0]
  - - [2048, 1024, 1, 2304, 2048, 2048, 2304, 2304]
    - [32, 17408.0]
  - - [4096, 512, 1, 6144, 4096, 4096, 6144, 6144]
    - [15, 17574.0]
  - - [4096, 512, 1, 15360, 4096, 4096, 15360, 15360]
    - [30, 14780.0]
  - - [4096, 1024, 1, 7168, 4096, 4096, 7168, 7168]
    - [15, 17186.0]
  - - [4096, 1024, 1, 9216, 4096, 4096, 9216, 9216]
    - [32, 16138.0]
  - - [4096, 1024, 1, 7680, 4096, 4096, 7680, 7680]
    - [32, 17153.0]
  - - [2048, 1024, 1, 8192, 2048, 2048, 8192, 8192]
    - [15, 17446.0]
  - - [4096, 1024, 1, 64, 4096, 4096, 64, 64]
    - [0, 14653.0]
  - - [2048, 1024, 1, 1280, 2048, 2048, 1280, 1280]
    - [24, 17199.0]
  - - [2048, 1024, 1, 3328, 2048, 2048, 3328, 3328]
    - [51, 17544.0]
  - - [4096, 512, 1, 14336, 4096, 4096, 14336, 14336]
    - [30, 15083.0]
  - - [4096, 512, 1, 8320, 4096, 4096, 8320, 8320]
    - [24, 17658.0]
  - - [4096, 1024, 1, 6656, 4096, 4096, 6656, 6656]
    - [30, 17186.0]
  - - [2048, 1024, 1, 256, 2048, 2048, 256, 256]
    - [11, 14378.0]
  - - [4096, 512, 1, 1024, 4096, 4096, 1024, 1024]
    - [15, 16912.0]
  - - [4096, 1024, 1, 1536, 4096, 4096, 1536, 1536]
    - [30, 17025.0]
  - - [2048, 1024, 1, 32, 2048, 2048, 32, 32]
    - [0, 9020.0]
  - - [4096, 512, 1, 640, 4096, 4096, 640, 640]
    - [15, 16599.0]
  - - [4096, 512, 1, 16384, 4096, 4096, 16384, 16384]
    - [51, 15218.0]
  - - [4096, 1024, 1, 512, 4096, 4096, 512, 512]
    - [30, 16443.0]
  - - [2048, 1024, 1, 1152, 2048, 2048, 1152, 1152]
    - [43, 17274.0]
  - - [4096, 1024, 1, 2080, 4096, 4096, 2080, 2080]
    - [37, 17786.0]
  - - [4096, 1024, 1, 768, 4096, 4096, 768, 768]
    - [30, 16881.0]
  - - [4096, 1024, 1, 2560, 4096, 4096, 2560, 2560]
    - [30, 17073.0]
  - - [2048, 1024, 1, 64, 2048, 2048, 64, 64]
    - [8, 12980.0]
  - - [4096, 1024, 1, 16384, 4096, 4096, 16384, 16384]
    - [51, 15342.0]
  - - [4096, 512, 1, 6656, 4096, 4096, 6656, 6656]
    - [32, 17597.0]
  - - [2048, 1024, 1, 128, 2048, 2048, 128, 128]
    - [10, 13422.0]
  - - [2048, 1024, 1, 2080, 2048, 2048, 2080, 2080]
    - [43, 17485.0]
  - - [2048, 1024, 1, 16640, 2048, 2048, 16640, 16640]
    - [15, 17632.0]
  - - [2048, 1024, 1, 3072, 2048, 2048, 3072, 3072]
    - [15, 17333.0]
  - - [4096, 1024, 1, 1408, 4096, 4096, 1408, 1408]
    - [26, 17283.0]
  - - [4096, 1024, 1, 2048, 4096, 4096, 2048, 2048]
    - [13, 17026.0]
  - - [2048, 1024, 1, 2560, 2048, 2048, 2560, 2560]
    - [51, 17414.0]
  - - [4096, 1024, 1, 128, 4096, 4096, 128, 128]
    - [9, 15322.0]
  - - [4096, 1024, 1, 14336, 4096, 4096, 14336, 14336]
    - [51, 16465.0]
  - - [4096, 512, 1, 9216, 4096, 4096, 9216, 9216]
    - [13, 16001.0]
  - - [2048, 1024, 1, 2048, 2048, 2048, 2048, 2048]
    - [51, 17179.0]
  - - [4096, 512, 1, 1536, 4096, 4096, 1536, 1536]
    - [51, 17156.0]
  - - [2048, 1024, 1, 16384, 2048, 2048, 16384, 16384]
    - [32, 15760.0]
  - - [4096, 1024, 1, 1024, 4096, 4096, 1024, 1024]
    - [13, 16687.0]
  - - [4096, 1024, 1, 1664, 4096, 4096, 1664, 1664]
    - [26, 17389.0]
  - - [4096, 512, 1, 384, 4096, 4096, 384, 384]
    - [7, 15890.0]
  - - [4096, 512, 1, 3328, 4096, 4096, 3328, 3328]
    - [15, 17488.0]
  - - [4096, 1024, 1, 256, 4096, 4096, 256, 256]
    - [13, 16225.0]
  - - [2048, 1024, 1, 7168, 2048, 2048, 7168, 7168]
    - [15, 17647.0]
  - - [2048, 1024, 1, 1536, 2048, 2048, 1536, 1536]
    - [32, 17206.0]
  - - [4096, 512, 1, 7168, 4096, 4096, 7168, 7168]
    - [15, 17576.0]
  - - [4096, 1024, 1, 896, 4096, 4096, 896, 896]
    - [26, 17037.0]
  - - [4096, 1024, 1, 4096, 4096, 4096, 4096, 4096]
    - [15, 17091.0]
  - - [2048, 1024, 1, 6144, 2048, 2048, 6144, 6144]
    - [15, 17624.0]
  - - [4096, 512, 1, 4160, 4096, 4096, 4160, 4160]
    - [7, 17625.0]
  - - [4096, 512, 1, 2080, 4096, 4096, 2080, 2080]
    - [24, 17439.0]
  - - [4096, 1024, 1, 5120, 4096, 4096, 5120, 5120]
    - [15, 17146.0]
  - - [2048, 1024, 1, 1920, 2048, 2048, 1920, 1920]
    - [43, 17411.0]
  - - [2048, 1024, 1, 15360, 2048, 2048, 15360, 15360]
    - [13, 15384.0]
  - - [4096, 1024, 1, 2816, 4096, 4096, 2816, 2816]
    - [13, 17080.0]
  - - [4096, 512, 1, 256, 4096, 4096, 256, 256]
    - [30, 14971.0]
  - - [2048, 1024, 1, 5120, 2048, 2048, 5120, 5120]
    - [15, 17579.0]
  - - [2048, 1024, 1, 4096, 2048, 2048, 4096, 4096]
    - [15, 17542.0]
  - - [4096, 512, 1, 4608, 4096, 4096, 4608, 4608]
    - [51, 17568.0]
  - - [4096, 512, 1, 1664, 4096, 4096, 1664, 1664]
    - [24, 17320.0]
  - - [2048, 1024, 1, 896, 2048, 2048, 896, 896]
    - [24, 17073.0]
  - - [4096, 1024, 1, 4160, 4096, 4096, 4160, 4160]
    - [37, 17823.0]
  - - [2048, 1024, 1, 11264, 2048, 2048, 11264, 11264]
    - [51, 17600.0]
  - - [2048, 1024, 1, 384, 2048, 2048, 384, 384]
    - [9, 15475.0]
  - - [2048, 1024, 1, 3840, 2048, 2048, 3840, 3840]
    - [43, 17609.0]
  - - [4096, 512, 1, 1280, 4096, 4096, 1280, 1280]
    - [43, 17093.0]
  - - [4096, 1024, 1, 1152, 4096, 4096, 1152, 1152]
    - [26, 17270.0]
  - - [2048, 1024, 1, 1408, 2048, 2048, 1408, 1408]
    - [24, 17337.0]
  - - [4096, 512, 1, 896, 4096, 4096, 896, 896]
    - [43, 16987.0]
  - - [4096, 1024, 1, 3072, 4096, 4096, 3072, 3072]
    - [13, 17131.0]
  - - [2048, 1024, 1, 2816, 2048, 2048, 2816, 2816]
    - [51, 17488.0]
  - - [4096, 1024, 1, 1792, 4096, 4096, 1792, 1792]
    - [13, 17069.0]
  - - [4096, 512, 1, 1152, 4096, 4096, 1152, 1152]
    - [24, 17117.0]
  - - [4096, 512, 1, 7680, 4096, 4096, 7680, 7680]
    - [51, 17615.0]
  - - [4096, 1024, 1, 384, 4096, 4096, 384, 384]
    - [26, 16580.0]
  - - [2048, 1024, 1, 1792, 2048, 2048, 1792, 1792]
    - [51, 17320.0]
  - - [4096, 1024, 1, 3584, 4096, 4096, 3584, 3584]
    - [13, 17162.0]
  - - [2048, 1024, 1, 768, 2048, 2048, 768, 768]
    - [32, 16865.0]
  - - [2048, 1024, 1, 8320, 2048, 2048, 8320, 8320]
    - [24, 17714.0]
  - - [4096, 512, 1, 2048, 4096, 4096, 2048, 2048]
    - [15, 17296.0]
  - - [4096, 512, 1, 2560, 4096, 4096, 2560, 2560]
    - [51, 17400.0]
  - - [4096, 1024, 1, 2304, 4096, 4096, 2304, 2304]
    - [43, 17132.0]
  - - [4096, 512, 1, 5120, 4096, 4096, 5120, 5120]
    - [15, 17575.0]
  - - [4096, 1024, 1, 6144, 4096, 4096, 6144, 6144]
    - [13, 17123.0]
  - - [1024, 3392, 1, 4096, 1024, 1024, 4096, 4096]
    - [31, 16875.0]
  - - [1024, 3301, 1, 4096, 1024, 1024, 4096, 4096]
    - [32, 18907.0]
  - - [1024, 3443, 1, 4096, 1024, 1024, 4096, 4096]
    - [31, 16647.0]
  - - [132, 134, 480, 64, 132, 132, 64, 64]
    - [36, 6269.0]
  - - [162, 162, 400, 64, 162, 162, 64, 64]
    - [0, 8762.0]
  - - [4096, 3548, 1, 1024, 4096, 4096, 1024, 1024]
    - [13, 19133.0]
  - - [4096, 2977, 1, 1024, 4096, 4096, 1024, 1024]
    - [15, 18504.0]
  - - [132, 135, 480, 64, 132, 132, 64, 64]
    - [36, 6310.0]
  - - [1024, 2985, 1, 4096, 1024, 1024, 4096, 4096]
    - [15, 17166.0]
  - - [33708, 3681, 1, 1024, 33708, 33708, 1024, 1024]
    - [49, 19573.0]
  - - [4096, 3443, 1, 1024, 4096, 4096, 1024, 1024]
    - [13, 19312.0]
  - - [1024, 3400, 1, 4096, 1024, 1024, 4096, 4096]
    - [13, 17451.0]
  - - [4096, 3995, 1, 1024, 4096, 4096, 1024, 1024]
    - [13, 18779.0]
  - - [4096, 3190, 1, 1024, 4096, 4096, 1024, 1024]
    - [13, 18837.0]
  - - [4096, 3594, 1, 1024, 4096, 4096, 1024, 1024]
    - [13, 18748.0]
  - - [159, 162, 400, 64, 159, 159, 64, 64]
    - [0, 8692.0]
  - - [1024, 3565, 1, 4096, 1024, 1024, 4096, 4096]
    - [30, 15579.0]
  - - [4096, 3422, 1, 1024, 4096, 4096, 1024, 1024]
    - [13, 19126.0]
  - - [1024, 3214, 1, 4096, 1024, 1024, 4096, 4096]
    - [51, 18421.0]
  - - [33708, 3584, 1, 1024, 33708, 33708, 1024, 1024]
    - [51, 19851.0]
  - - [33708, 3640, 1, 1024, 33708, 33708, 1024, 1024]
    - [49, 19364.0]
  - - [4096, 3263, 1, 1024, 4096, 4096, 1024, 1024]
    - [15, 18597.0]
  - - [4096, 3296, 1, 1024, 4096, 4096, 1024, 1024]
    - [15, 18867.0]
  - - [1024, 3557, 1, 4096, 1024, 1024, 4096, 4096]
    - [13, 16706.0]
  - - [4096, 3463, 1, 1024, 4096, 4096, 1024, 1024]
    - [13, 18677.0]
  - - [4096, 3528, 1, 1024, 4096, 4096, 1024, 1024]
    - [13, 19074.0]
  - - [4096, 3226, 1, 1024, 4096, 4096, 1024, 1024]
    - [15, 18442.0]
  - - [4096, 3439, 1, 1024, 4096, 4096, 1024, 1024]
    - [13, 19331.0]
  - - [1024, 3523, 1, 4096, 1024, 1024, 4096, 4096]
    - [13, 16153.0]
  - - [1024, 3098, 1, 4096, 1024, 1024, 4096, 4096]
    - [51, 17820.0]
  - - [4096, 3121, 1, 1024, 4096, 4096, 1024, 1024]
    - [13, 18346.0]
  - - [33708, 3894, 1, 1024, 33708, 33708, 1024, 1024]
    - [49, 19333.0]
  - - [1024, 3548, 1, 4096, 1024, 1024, 4096, 4096]
    - [13, 16055.0]
  - - [1024, 3451, 1, 4096, 1024, 1024, 4096, 4096]
    - [30, 16207.0]
  - - [4096, 3353, 1, 1024, 4096, 4096, 1024, 1024]
    - [13, 18716.0]
  - - [4096, 3402, 1, 1024, 4096, 4096, 1024, 1024]
    - [13, 19133.0]
  - - [4096, 3939, 1, 1024, 4096, 4096, 1024, 1024]
    - [13, 19120.0]
  - - [133, 133, 480, 64, 133, 133, 64, 64]
    - [17, 6259.0]
  - - [1024, 3559, 1, 4096, 1024, 1024, 4096, 4096]
    - [13, 16813.0]
  - - [1024, 2977, 1, 4096, 1024, 1024, 4096, 4096]
    - [32, 17141.0]
  - - [1024, 3478, 1, 4096, 1024, 1024, 4096, 4096]
    - [30, 16516.0]
  - - [134, 134, 480, 64, 134, 134, 64, 64]
    - [17, 6374.0]
  - - [1024, 3368, 1, 4096, 1024, 1024, 4096, 4096]
    - [31, 16770.0]
  - - [4096, 4012, 1, 1024, 4096, 4096, 1024, 1024]
    - [13, 18866.0]
  - - [4096, 3486, 1, 1024, 4096, 4096, 1024, 1024]
    - [13, 18874.0]
  - - [1024, 3479, 1, 4096, 1024, 1024, 4096, 4096]
    - [30, 15892.0]
  - - [1024, 3505, 1, 4096, 1024, 1024, 4096, 4096]
    - [13, 16304.0]
  - - [4096, 3381, 1, 1024, 4096, 4096, 1024, 1024]
    - [13, 18954.0]
  - - [4096, 3430, 1, 1024, 4096, 4096, 1024, 1024]
    - [13, 19286.0]
  - - [1024, 3554, 1, 4096, 1024, 1024, 4096, 4096]
    - [30, 15518.0]
  - - [4096, 3271, 1, 1024, 4096, 4096, 1024, 1024]
    - [15, 18697.0]
  - - [1024, 3063, 1, 4096, 1024, 1024, 4096, 4096]
    - [15, 17595.0]
  - - [1024, 3209, 1, 4096, 1024, 1024, 4096, 4096]
    - [32, 18433.0]
  - - [4096, 3503, 1, 1024, 4096, 4096, 1024, 1024]
    - [13, 18907.0]
  - - [4096, 3344, 1, 1024, 4096, 4096, 1024, 1024]
    - [13, 18740.0]
  - - [1024, 3147, 1, 4096, 1024, 1024, 4096, 4096]
    - [15, 18072.0]
  - - [1024, 3322, 1, 4096, 1024, 1024, 4096, 4096]
    - [32, 19022.0]
  - - [1024, 3341, 1, 4096, 1024, 1024, 4096, 4096]
    - [31, 16497.0]
  - - [1024, 3516, 1, 4096, 1024, 1024, 4096, 4096]
    - [13, 14942.0]
  - - [1024, 3454, 1, 4096, 1024, 1024, 4096, 4096]
    - [31, 17128.0]
  - - [4096, 3969, 1, 1024, 4096, 4096, 1024, 1024]
    - [13, 18671.0]
  - - [4096, 3466, 1, 1024, 4096, 4096, 1024, 1024]
    - [13, 18778.0]
  - - [1024, 3999, 1, 1024, 1024, 1024, 1024, 1024]
    - [32, 16835.0]
  - - [1024, 4032, 1, 1024, 1024, 1024, 1024, 1024]
    - [32, 17001.0]
  - - [1024, 3403, 1, 4096, 1024, 1024, 4096, 4096]
    - [30, 17967.0]
  - - [4096, 3361, 1, 1024, 4096, 4096, 1024, 1024]
    - [13, 18927.0]
  - - [1024, 3527, 1, 4096, 1024, 1024, 4096, 4096]
    - [13, 16697.0]
  - - [1024, 3822, 1, 4096, 1024, 1024, 4096, 4096]
    - [13, 17305.0]
  - - [4096, 3315, 1, 1024, 4096, 4096, 1024, 1024]
    - [15, 18953.0]
  - - [232, 232, 272, 64, 232, 232, 64, 64]
    - [42, 10547.0]
  - - [1024, 3336, 1, 4096, 1024, 1024, 4096, 4096]
    - [13, 17214.0]
  - - [228, 232, 272, 64, 228, 228, 64, 64]
    - [6, 10020.0]
  - - [4096, 3547, 1, 1024, 4096, 4096, 1024, 1024]
    - [13, 19186.0]
  - - [4096, 3340, 1, 1024, 4096, 4096, 1024, 1024]
    - [13, 18822.0]
  - - [1024, 3906, 1, 1024, 1024, 1024, 1024, 1024]
    - [30, 18005.0]
  - - [1024, 3295, 1, 4096, 1024, 1024, 4096, 4096]
    - [15, 18864.0]
  - - [4096, 3294, 1, 1024, 4096, 4096, 1024, 1024]
    - [15, 18797.0]
  - - [33708, 3968, 1, 1024, 33708, 33708, 1024, 1024]
    - [49, 19731.0]
  - - [1024, 3473, 1, 4096, 1024, 1024, 4096, 4096]
    - [13, 15992.0]
  - - [1024, 3072, 1, 4096, 1024, 1024, 4096, 4096]
    - [15, 17743.0]
  - - [4096, 3189, 1, 1024, 4096, 4096, 1024, 1024]
    - [13, 18789.0]
  - - [4096, 3494, 1, 1024, 4096, 4096, 1024, 1024]
    - [13, 18862.0]
  - - [1024, 3522, 1, 4096, 1024, 1024, 4096, 4096]
    - [30, 16720.0]
  - - [33708, 3944, 1, 1024, 33708, 33708, 1024, 1024]
    - [49, 19587.0]
  - - [135, 135, 480, 64, 135, 135, 64, 64]
    - [45, 6394.0]
  - - [4096, 3421, 1, 1024, 4096, 4096, 1024, 1024]
    - [13, 19264.0]
  - - [4096, 3311, 1, 1024, 4096, 4096, 1024, 1024]
    - [15, 18942.0]
  - - [1024, 3990, 1, 1024, 1024, 1024, 1024, 1024]
    - [32, 16813.0]
  - - [1024, 3290, 1, 4096, 1024, 1024, 4096, 4096]
    - [51, 18835.0]
  - - [4096, 3565, 1, 1024, 4096, 4096, 1024, 1024]
    - [13, 19222.0]
  - - [1024, 3484, 1, 4096, 1024, 1024, 4096, 4096]
    - [13, 16113.0]
  - - [4096, 3384, 1, 1024, 4096, 4096, 1024, 1024]
    - [13, 18989.0]
  - - [1024, 3422, 1, 4096, 1024, 1024, 4096, 4096]
    - [13, 17275.0]
  - - [4096, 3681, 1, 1024, 4096, 4096, 1024, 1024]
    - [13, 19154.0]
  - - [1024, 3584, 1, 1024, 1024, 1024, 1024, 1024]
    - [30, 16791.0]
  - - [4096, 4050, 1, 1024, 4096, 4096, 1024, 1024]
    - [13, 19004.0]
  - - [1024, 3996, 1, 4096, 1024, 1024, 4096, 4096]
    - [32, 17372.0]
  - - [4096, 3169, 1, 1024, 4096, 4096, 1024, 1024]
    - [13, 18663.0]
  - - [4096, 3538, 1, 1024, 4096, 4096, 1024, 1024]
    - [13, 19133.0]
  - - [1024, 3495, 1, 4096, 1024, 1024, 4096, 4096]
    - [13, 15288.0]
  - - [4096, 3401, 1, 1024, 4096, 4096, 1024, 1024]
    - [13, 19085.0]
  - - [1024, 3560, 1, 4096, 1024, 1024, 4096, 4096]
    - [13, 16881.0]
  - - [133, 135, 480, 64, 133, 133, 64, 64]
    - [17, 6331.0]
  - - [1024, 3263, 1, 4096, 1024, 1024, 4096, 4096]
    - [51, 18718.0]
  - - [1024, 3870, 1, 4096, 1024, 1024, 4096, 4096]
    - [13, 17676.0]
  - - [4096, 3555, 1, 1024, 4096, 4096, 1024, 1024]
    - [13, 19229.0]
  - - [4096, 3412, 1, 1024, 4096, 4096, 1024, 1024]
    - [13, 19223.0]
  - - [1024, 3296, 1, 4096, 1024, 1024, 4096, 4096]
    - [51, 18877.0]
  - - [1024, 3379, 1, 4096, 1024, 1024, 4096, 4096]
    - [31, 16650.0]
  - - [4096, 3302, 1, 1024, 4096, 4096, 1024, 1024]
    - [15, 18847.0]
  - - [1024, 3490, 1, 4096, 1024, 1024, 4096, 4096]
    - [13, 15965.0]
  - - [1024, 3428, 1, 4096, 1024, 1024, 4096, 4096]
    - [13, 16949.0]
  - - [1024, 3976, 1, 4096, 1024, 1024, 4096, 4096]
    - [32, 17333.0]
  - - [4096, 3485, 1, 1024, 4096, 4096, 1024, 1024]
    - [13, 18818.0]
  - - [4096, 3534, 1, 1024, 4096, 4096, 1024, 1024]
    - [13, 19116.0]
  - - [1024, 3064, 1, 4096, 1024, 1024, 4096, 4096]
    - [32, 17591.0]
  - - [4096, 3216, 1, 1024, 4096, 4096, 1024, 1024]
    - [15, 18403.0]
  - - [1024, 3450, 1, 4096, 1024, 1024, 4096, 4096]
    - [14, 16951.0]
  - - [1024, 3533, 1, 4096, 1024, 1024, 4096, 4096]
    - [13, 15784.0]
  - - [1024, 4030, 1, 1024, 1024, 1024, 1024, 1024]
    - [32, 16976.0]
  - - [1024, 3311, 1, 4096, 1024, 1024, 4096, 4096]
    - [15, 18965.0]
  - - [1024, 3468, 1, 4096, 1024, 1024, 4096, 4096]
    - [30, 15495.0]
  - - [4096, 3359, 1, 1024, 4096, 4096, 1024, 1024]
    - [13, 18868.0]
  - - [4096, 3392, 1, 1024, 4096, 4096, 1024, 1024]
    - [13, 19084.0]
  - - [1024, 3925, 1, 1024, 1024, 1024, 1024, 1024]
    - [30, 18116.0]
  - - [4096, 3233, 1, 1024, 4096, 4096, 1024, 1024]
    - [15, 18475.0]
  - - [4096, 3956, 1, 1024, 4096, 4096, 1024, 1024]
    - [13, 19212.0]
  - - [1024, 3463, 1, 4096, 1024, 1024, 4096, 4096]
    - [30, 16477.0]
  - - [1024, 3126, 1, 4096, 1024, 1024, 4096, 4096]
    - [32, 17985.0]
  - - [1024, 3363, 1, 4096, 1024, 1024, 4096, 4096]
    - [30, 18028.0]
  - - [4096, 3465, 1, 1024, 4096, 4096, 1024, 1024]
    - [13, 18714.0]
  - - [33708, 3996, 1, 1024, 33708, 33708, 1024, 1024]
    - [51, 19510.0]
  - - [1024, 3231, 1, 4096, 1024, 1024, 4096, 4096]
    - [51, 18440.0]
  - - [33708, 3978, 1, 1024, 33708, 33708, 1024, 1024]
    - [51, 19344.0]
  - - [4096, 3476, 1, 1024, 4096, 4096, 1024, 1024]
    - [13, 18743.0]
  - - [4096, 3339, 1, 1024, 4096, 4096, 1024, 1024]
    - [13, 18743.0]
  - - [4096, 3452, 1, 1024, 4096, 4096, 1024, 1024]
    - [13, 19401.0]
  - - [1024, 3396, 1, 4096, 1024, 1024, 4096, 4096]
    - [13, 18110.0]
  - - [4096, 3293, 1, 1024, 4096, 4096, 1024, 1024]
    - [15, 18747.0]
  - - [1024, 3432, 1, 4096, 1024, 1024, 4096, 4096]
    - [13, 17580.0]
  - - [4096, 3493, 1, 1024, 4096, 4096, 1024, 1024]
    - [13, 18896.0]
  - - [4096, 3350, 1, 1024, 4096, 4096, 1024, 1024]
    - [13, 18863.0]
  - - [1024, 3079, 1, 4096, 1024, 1024, 4096, 4096]
    - [51, 17702.0]
  - - [1024, 3101, 1, 4096, 1024, 1024, 4096, 4096]
    - [32, 17846.0]
  - - [33708, 3939, 1, 1024, 33708, 33708, 1024, 1024]
    - [49, 19552.0]
  - - [4096, 3256, 1, 1024, 4096, 4096, 1024, 1024]
    - [15, 18539.0]
  - - [1024, 3439, 1, 4096, 1024, 1024, 4096, 4096]
    - [13, 16950.0]
  - - [1024, 3510, 1, 4096, 1024, 1024, 4096, 4096]
    - [13, 15764.0]
  - - [4096, 3900, 1, 1024, 4096, 4096, 1024, 1024]
    - [13, 18888.0]
  - - [1024, 3470, 1, 4096, 1024, 1024, 4096, 4096]
    - [30, 15344.0]
  - - [4096, 3456, 1, 1024, 4096, 4096, 1024, 1024]
    - [13, 19389.0]
  - - [4096, 3014, 1, 1024, 4096, 4096, 1024, 1024]
    - [15, 18719.0]
  - - [4096, 3367, 1, 1024, 4096, 4096, 1024, 1024]
    - [13, 18927.0]
  - - [4096, 3432, 1, 1024, 4096, 4096, 1024, 1024]
    - [13, 19247.0]
  - - [33708, 4026, 1, 1024, 33708, 33708, 1024, 1024]
    - [51, 19556.0]
  - - [4096, 3273, 1, 1024, 4096, 4096, 1024, 1024]
    - [15, 18610.0]
  - - [4096, 3130, 1, 1024, 4096, 4096, 1024, 1024]
    - [13, 18459.0]
  - - [1024, 3496, 1, 4096, 1024, 1024, 4096, 4096]
    - [13, 16338.0]
  - - [1024, 3995, 1, 4096, 1024, 1024, 4096, 4096]
    - [32, 17413.0]
  - - [1024, 3939, 1, 4096, 1024, 1024, 4096, 4096]
    - [13, 17418.0]
  - - [1024, 3121, 1, 4096, 1024, 1024, 4096, 4096]
    - [32, 17937.0]
  - - [1024, 3232, 1, 4096, 1024, 1024, 4096, 4096]
    - [15, 18549.0]
  - - [4096, 3147, 1, 1024, 4096, 4096, 1024, 1024]
    - [13, 18565.0]
  - - [4096, 3516, 1, 1024, 4096, 4096, 1024, 1024]
    - [13, 19005.0]
  - - [1024, 3969, 1, 1024, 1024, 1024, 1024, 1024]
    - [32, 16662.0]
  - - [1024, 3364, 1, 4096, 1024, 1024, 4096, 4096]
    - [31, 16558.0]
  - - [4096, 3411, 1, 1024, 4096, 4096, 1024, 1024]
    - [13, 19139.0]
  - - [147, 147, 432, 64, 147, 147, 64, 64]
    - [0, 7511.0]
  - - [4096, 3301, 1, 1024, 4096, 4096, 1024, 1024]
    - [15, 18817.0]
  - - [1024, 3513, 1, 4096, 1024, 1024, 4096, 4096]
    - [30, 15804.0]
  - - [1024, 3469, 1, 4096, 1024, 1024, 4096, 4096]
    - [13, 15864.0]
  - - [1024, 3095, 1, 4096, 1024, 1024, 4096, 4096]
    - [15, 17791.0]
  - - [4096, 3533, 1, 1024, 4096, 4096, 1024, 1024]
    - [13, 18980.0]
  - - [4096, 3390, 1, 1024, 4096, 4096, 1024, 1024]
    - [13, 19035.0]
  - - [4096, 3582, 1, 1024, 4096, 4096, 1024, 1024]
    - [13, 19421.0]
  - - [1024, 3956, 1, 1024, 1024, 1024, 1024, 1024]
    - [30, 18234.0]
  - - [4096, 3585, 1, 1024, 4096, 4096, 1024, 1024]
    - [13, 18718.0]
  - - [4096, 3231, 1, 1024, 4096, 4096, 1024, 1024]
    - [15, 18441.0]
  - - [1024, 3205, 1, 4096, 1024, 1024, 4096, 4096]
    - [15, 18387.0]
  - - [4096, 3496, 1, 1024, 4096, 4096, 1024, 1024]
    - [13, 18876.0]
  - - [1024, 3143, 1, 4096, 1024, 1024, 4096, 4096]
    - [15, 18056.0]
  - - [1024, 3318, 1, 4096, 1024, 1024, 4096, 4096]
    - [32, 19014.0]
  - - [1024, 3353, 1, 4096, 1024, 1024, 4096, 4096]
    - [13, 17705.0]
  - - [1024, 3464, 1, 4096, 1024, 1024, 4096, 4096]
    - [30, 15981.0]
  - - [4096, 2736, 1, 1024, 4096, 4096, 1024, 1024]
    - [15, 18666.0]
  - - [1024, 3402, 1, 4096, 1024, 1024, 4096, 4096]
    - [13, 18150.0]
  - - [4096, 3138, 1, 1024, 4096, 4096, 1024, 1024]
    - [13, 18560.0]
  - - [1024, 3860, 1, 4096, 1024, 1024, 4096, 4096]
    - [32, 16826.0]
  - - [148, 148, 432, 64, 148, 148, 64, 64]
    - [0, 7593.0]
  - - [1024, 3539, 1, 4096, 1024, 1024, 4096, 4096]
    - [13, 16191.0]
  - - [4096, 3211, 1, 1024, 4096, 4096, 1024, 1024]
    - [15, 18343.0]
  - - [1024, 3332, 1, 4096, 1024, 1024, 4096, 4096]
    - [13, 16992.0]
  - - [1024, 3466, 1, 4096, 1024, 1024, 4096, 4096]
    - [13, 15888.0]
  - - [4096, 3475, 1, 1024, 4096, 4096, 1024, 1024]
    - [13, 18733.0]
  - - [4096, 3524, 1, 1024, 4096, 4096, 1024, 1024]
    - [13, 19009.0]
  - - [4096, 2985, 1, 1024, 4096, 4096, 1024, 1024]
    - [15, 18510.0]
  - - [4096, 3222, 1, 1024, 4096, 4096, 1024, 1024]
    - [15, 18416.0]
  - - [4096, 3451, 1, 1024, 4096, 4096, 1024, 1024]
    - [13, 19355.0]
  - - [1024, 3181, 1, 4096, 1024, 1024, 4096, 4096]
    - [32, 18247.0]
  - - [1024, 3640, 1, 4096, 1024, 1024, 4096, 4096]
    - [13, 16779.0]
  - - [1024, 3375, 1, 4096, 1024, 1024, 4096, 4096]
    - [30, 18378.0]
  - - [1024, 3550, 1, 4096, 1024, 1024, 4096, 4096]
    - [13, 16834.0]
  - - [1024, 4020, 1, 1024, 1024, 1024, 1024, 1024]
    - [15, 16873.0]
  - - [4096, 3349, 1, 1024, 4096, 4096, 1024, 1024]
    - [13, 18828.0]
  - - [4096, 3398, 1, 1024, 4096, 4096, 1024, 1024]
    - [13, 19138.0]
  - - [33708, 3976, 1, 1024, 33708, 33708, 1024, 1024]
    - [51, 19345.0]
  - - [1024, 2917, 1, 4096, 1024, 1024, 4096, 4096]
    - [32, 16746.0]
  - - [33708, 3910, 1, 1024, 33708, 33708, 1024, 1024]
    - [49, 19431.0]
  - - [4096, 3860, 1, 1024, 4096, 4096, 1024, 1024]
    - [13, 18671.0]
  - - [4096, 3304, 1, 1024, 4096, 4096, 1024, 1024]
    - [15, 18837.0]
  - - [1024, 3286, 1, 4096, 1024, 1024, 4096, 4096]
    - [51, 18874.0]
  - - [1024, 3460, 1, 4096, 1024, 1024, 4096, 4096]
    - [13, 16349.0]
  - - [1024, 4026, 1, 4096, 1024, 1024, 4096, 4096]
    - [32, 17562.0]
  - - [4096, 3471, 1, 1024, 4096, 4096, 1024, 1024]
    - [13, 18745.0]
  - - [193, 193, 320, 64, 193, 193, 64, 64]
    - [37, 8610.0]
  - - [1024, 3894, 1, 1024, 1024, 1024, 1024, 1024]
    - [30, 17953.0]
  - - [1024, 3506, 1, 4096, 1024, 1024, 4096, 4096]
    - [13, 16598.0]
  - - [1024, 4000, 1, 1024, 1024, 1024, 1024, 1024]
    - [32, 16835.0]
  - - [1024, 3900, 1, 4096, 1024, 1024, 4096, 4096]
    - [13, 18013.0]
  - - [1024, 3445, 1, 4096, 1024, 1024, 4096, 4096]
    - [13, 18478.0]
  - - [4096, 3442, 1, 1024, 4096, 4096, 1024, 1024]
    - [13, 19332.0]
  - - [1024, 3358, 1, 4096, 1024, 1024, 4096, 4096]
    - [30, 16251.0]
  - - [1024, 3211, 1, 4096, 1024, 1024, 4096, 4096]
    - [32, 18458.0]
  - - [4096, 3515, 1, 1024, 4096, 4096, 1024, 1024]
    - [13, 18959.0]
  - - [1024, 3564, 1, 4096, 1024, 1024, 4096, 4096]
    - [30, 15824.0]
  - - [4096, 3057, 1, 1024, 4096, 4096, 1024, 1024]
    - [15, 18978.0]
  - - [1024, 3343, 1, 4096, 1024, 1024, 4096, 4096]
    - [13, 17846.0]
  - - [4096, 3262, 1, 1024, 4096, 4096, 1024, 1024]
    - [15, 18634.0]
  - - [1024, 3518, 1, 4096, 1024, 1024, 4096, 4096]
    - [13, 15737.0]
  - - [33708, 3876, 1, 1024, 33708, 33708, 1024, 1024]
    - [49, 19262.0]
  - - [4096, 3462, 1, 1024, 4096, 4096, 1024, 1024]
    - [13, 18720.0]
  - - [1024, 3265, 1, 4096, 1024, 1024, 4096, 4096]
    - [51, 18743.0]
  - - [4096, 3389, 1, 1024, 4096, 4096, 1024, 1024]
    - [13, 18944.0]
  - - [4096, 3438, 1, 1024, 4096, 4096, 1024, 1024]
    - [13, 19338.0]
  - - [1024, 3955, 1, 1024, 1024, 1024, 1024, 1024]
    - [30, 18239.0]
  - - [1024, 3545, 1, 4096, 1024, 1024, 4096, 4096]
    - [13, 16101.0]
  - - [1024, 3144, 1, 4096, 1024, 1024, 4096, 4096]
    - [15, 18058.0]
  - - [1024, 3417, 1, 4096, 1024, 1024, 4096, 4096]
    - [13, 18344.0]
  - - [4096, 3543, 1, 1024, 4096, 4096, 1024, 1024]
    - [13, 19203.0]
  - - [4096, 3352, 1, 1024, 4096, 4096, 1024, 1024]
    - [13, 18839.0]
  - - [33708, 3975, 1, 1024, 33708, 33708, 1024, 1024]
    - [32, 19329.0]
  - - [148, 147, 432, 64, 148, 148, 64, 64]
    - [36, 7511.0]
  - - [4096, 3137, 1, 1024, 4096, 4096, 1024, 1024]
    - [13, 18488.0]
  - - [4096, 3506, 1, 1024, 4096, 4096, 1024, 1024]
    - [13, 18901.0]
  - - [1024, 3975, 1, 1024, 1024, 1024, 1024, 1024]
    - [32, 16781.0]
  - - [1024, 3859, 1, 4096, 1024, 1024, 4096, 4096]
    - [32, 16805.0]
  - - [4096, 3369, 1, 1024, 4096, 4096, 1024, 1024]
    - [13, 18877.0]
  - - [1024, 3434, 1, 4096, 1024, 1024, 4096, 4096]
    - [31, 17112.0]
  - - [1024, 3292, 1, 4096, 1024, 1024, 4096, 4096]
    - [15, 18840.0]
  - - [4096, 3523, 1, 1024, 4096, 4096, 1024, 1024]
    - [13, 18947.0]
  - - [4096, 3380, 1, 1024, 4096, 4096, 1024, 1024]
    - [13, 19045.0]
  - - [1024, 3408, 1, 4096, 1024, 1024, 4096, 4096]
    - [30, 18221.0]
  - - [4096, 3221, 1, 1024, 4096, 4096, 1024, 1024]
    - [15, 18412.0]
  - - [4096, 3270, 1, 1024, 4096, 4096, 1024, 1024]
    - [15, 18710.0]
  - - [143, 143, 432, 64, 143, 143, 64, 64]
    - [0, 7149.0]
  - - [1024, 3303, 1, 4096, 1024, 1024, 4096, 4096]
    - [32, 18941.0]
  - - [4096, 3502, 1, 1024, 4096, 4096, 1024, 1024]
    - [13, 18929.0]
  - - [1024, 3222, 1, 4096, 1024, 1024, 4096, 4096]
    - [51, 18465.0]
  - - [4096, 2505, 1, 1024, 4096, 4096, 1024, 1024]
    - [15, 18962.0]
  - - [4096, 3397, 1, 1024, 4096, 4096, 1024, 1024]
    - [13, 19084.0]
  - - [4096, 3562, 1, 1024, 4096, 4096, 1024, 1024]
    - [13, 19214.0]
  - - [4096, 3095, 1, 1024, 4096, 4096, 1024, 1024]
    - [13, 18287.0]
  - - [1024, 3226, 1, 4096, 1024, 1024, 4096, 4096]
    - [32, 18504.0]
  - - [177, 177, 352, 64, 177, 177, 64, 64]
    - [17, 9318.0]
  - - [4096, 3360, 1, 1024, 4096, 4096, 1024, 1024]
    - [13, 18905.0]
  - - [1024, 3942, 1, 1024, 1024, 1024, 1024, 1024]
    - [30, 18152.0]
  - - [1024, 3298, 1, 4096, 1024, 1024, 4096, 4096]
    - [51, 18868.0]
  - - [1024, 3381, 1, 4096, 1024, 1024, 4096, 4096]
    - [13, 17006.0]
  - - [4096, 3314, 1, 1024, 4096, 4096, 1024, 1024]
    - [15, 18943.0]
  - - [1024, 3492, 1, 4096, 1024, 1024, 4096, 4096]
    - [13, 15377.0]
  - - [1024, 3430, 1, 4096, 1024, 1024, 4096, 4096]
    - [31, 17045.0]
  - - [4096, 3977, 1, 1024, 4096, 4096, 1024, 1024]
    - [13, 18599.0]
  - - [4096, 3546, 1, 1024, 4096, 4096, 1024, 1024]
    - [13, 19134.0]
  - - [4096, 3640, 1, 1024, 4096, 4096, 1024, 1024]
    - [13, 18973.0]
  - - [4096, 3441, 1, 1024, 4096, 4096, 1024, 1024]
    - [13, 19290.0]
  - - [33708, 4059, 1, 1024, 33708, 33708, 1024, 1024]
    - [32, 19725.0]
  - - [1024, 3978, 1, 1024, 1024, 1024, 1024, 1024]
    - [32, 16595.0]
  - - [1024, 3376, 1, 4096, 1024, 1024, 4096, 4096]
    - [13, 16927.0]
  - - [1024, 3482, 1, 4096, 1024, 1024, 4096, 4096]
    - [13, 15942.0]
  - - [1024, 3563, 1, 4096, 1024, 1024, 4096, 4096]
    - [30, 16411.0]
  - - [4096, 4020, 1, 1024, 4096, 4096, 1024, 1024]
    - [13, 18818.0]
  - - [1024, 3271, 1, 4096, 1024, 1024, 4096, 4096]
    - [51, 18753.0]
  - - [1024, 3291, 1, 4096, 1024, 1024, 4096, 4096]
    - [32, 18873.0]
  - - [1024, 3431, 1, 4096, 1024, 1024, 4096, 4096]
    - [14, 16880.0]
  - - [1024, 3481, 1, 4096, 1024, 1024, 4096, 4096]
    - [13, 16340.0]
  - - [4096, 3461, 1, 1024, 4096, 4096, 1024, 1024]
    - [13, 18591.0]
  - - [1024, 3574, 1, 4096, 1024, 1024, 4096, 4096]
    - [49, 15533.0]
  - - [1024, 4059, 1, 1024, 1024, 1024, 1024, 1024]
    - [32, 17021.0]
  - - [1024, 3421, 1, 4096, 1024, 1024, 4096, 4096]
    - [13, 16844.0]
  - - [4096, 3224, 1, 1024, 4096, 4096, 1024, 1024]
    - [15, 18420.0]
  - - [4096, 3437, 1, 1024, 4096, 4096, 1024, 1024]
    - [13, 19305.0]
  - - [4096, 3168, 1, 1024, 4096, 4096, 1024, 1024]
    - [13, 18702.0]
  - - [33708, 3990, 1, 1024, 33708, 33708, 1024, 1024]
    - [51, 19432.0]
  - - [1024, 3349, 1, 4096, 1024, 1024, 4096, 4096]
    - [30, 16753.0]
  - - [4096, 3335, 1, 1024, 4096, 4096, 1024, 1024]
    - [13, 18773.0]
  - - [4096, 3400, 1, 1024, 4096, 4096, 1024, 1024]
    - [13, 19150.0]
  - - [160, 159, 400, 64, 160, 160, 64, 64]
    - [17, 8798.0]
  - - [1024, 3398, 1, 4096, 1024, 1024, 4096, 4096]
    - [14, 16981.0]
  - - [1024, 3780, 1, 4096, 1024, 1024, 4096, 4096]
    - [30, 17039.0]
  - - [4096, 3098, 1, 1024, 4096, 4096, 1024, 1024]
    - [13, 18279.0]
  - - [1024, 4012, 1, 4096, 1024, 1024, 4096, 4096]
    - [15, 17457.0]
  - - [4096, 3505, 1, 1024, 4096, 4096, 1024, 1024]
    - [13, 18920.0]
  - - [4096, 3554, 1, 1024, 4096, 4096, 1024, 1024]
    - [13, 19208.0]
  - - [4096, 3063, 1, 1024, 4096, 4096, 1024, 1024]
    - [15, 19051.0]
  - - [1024, 3503, 1, 4096, 1024, 1024, 4096, 4096]
    - [13, 15718.0]
  - - [1024, 3166, 1, 4096, 1024, 1024, 4096, 4096]
    - [32, 18200.0]
  - - [1024, 3425, 1, 4096, 1024, 1024, 4096, 4096]
    - [31, 17047.0]
  - - [1024, 3344, 1, 4096, 1024, 1024, 4096, 4096]
    - [49, 16196.0]
  - - [4096, 3484, 1, 1024, 4096, 4096, 1024, 1024]
    - [13, 18776.0]
  - - [1024, 3681, 1, 1024, 1024, 1024, 1024, 1024]
    - [30, 17005.0]
  - - [1024, 4050, 1, 1024, 1024, 1024, 1024, 1024]
    - [32, 17009.0]
  - - [4096, 3379, 1, 1024, 4096, 4096, 1024, 1024]
    - [13, 18959.0]
  - - [4096, 3428, 1, 1024, 4096, 4096, 1024, 1024]
    - [13, 19268.0]
  - - [1024, 3304, 1, 4096, 1024, 1024, 4096, 4096]
    - [32, 18920.0]
  - - [1024, 3387, 1, 4096, 1024, 1024, 4096, 4096]
    - [30, 17568.0]
  - - [4096, 3126, 1, 1024, 4096, 4096, 1024, 1024]
    - [13, 18488.0]
  - - [1024, 3498, 1, 4096, 1024, 1024, 4096, 4096]
    - [30, 16581.0]
  - - [1024, 3436, 1, 4096, 1024, 1024, 4096, 4096]
    - [13, 18307.0]
  - - [4096, 3501, 1, 1024, 4096, 4096, 1024, 1024]
    - [13, 18940.0]
  - - [4096, 3358, 1, 1024, 4096, 4096, 1024, 1024]
    - [13, 18929.0]
  - - [4096, 3232, 1, 1024, 4096, 4096, 1024, 1024]
    - [15, 18496.0]
  - - [1024, 3585, 1, 4096, 1024, 1024, 4096, 4096]
    - [13, 16901.0]
  - - [4096, 3143, 1, 1024, 4096, 4096, 1024, 1024]
    - [13, 18557.0]
  - - [4096, 3464, 1, 1024, 4096, 4096, 1024, 1024]
    - [13, 18723.0]
  - - [1024, 3366, 1, 4096, 1024, 1024, 4096, 4096]
    - [13, 17042.0]
  - - [4096, 3375, 1, 1024, 4096, 4096, 1024, 1024]
    - [13, 18985.0]
  - - [4096, 2917, 1, 1024, 4096, 4096, 1024, 1024]
    - [13, 18808.0]
  - - [4096, 4026, 1, 1024, 4096, 4096, 1024, 1024]
    - [13, 18932.0]
  - - [1024, 3277, 1, 4096, 1024, 1024, 4096, 4096]
    - [51, 18770.0]
  - - [1024, 3103, 1, 4096, 1024, 1024, 4096, 4096]
    - [15, 17856.0]
  - - [33708, 3995, 1, 1024, 33708, 33708, 1024, 1024]
    - [32, 19433.0]
  - - [1024, 3297, 1, 4096, 1024, 1024, 4096, 4096]
    - [32, 18752.0]
  - - [4096, 3545, 1, 1024, 4096, 4096, 1024, 1024]
    - [13, 19165.0]
  - - [1024, 3399, 1, 4096, 1024, 1024, 4096, 4096]
    - [30, 18531.0]
  - - [33708, 3796, 1, 1024, 33708, 33708, 1024, 1024]
    - [51, 19636.0]
  - - [4096, 3292, 1, 1024, 4096, 4096, 1024, 1024]
    - [15, 18739.0]
  - - [33708, 3859, 1, 1024, 33708, 33708, 1024, 1024]
    - [49, 19200.0]
  - - [4096, 3566, 1, 1024, 4096, 4096, 1024, 1024]
    - [13, 19205.0]
  - - [4096, 3894, 1, 1024, 4096, 4096, 1024, 1024]
    - [13, 18876.0]
  - - [4096, 3492, 1, 1024, 4096, 4096, 1024, 1024]
    - [13, 18859.0]
  - - [1024, 3977, 1, 1024, 1024, 1024, 1024, 1024]
    - [32, 16817.0]
  - - [1024, 3272, 1, 4096, 1024, 1024, 4096, 4096]
    - [32, 18718.0]
  - - [135, 134, 480, 64, 135, 135, 64, 64]
    - [17, 6361.0]
  - - [1024, 3355, 1, 4096, 1024, 1024, 4096, 4096]
    - [13, 16462.0]
  - - [4096, 3419, 1, 1024, 4096, 4096, 1024, 1024]
    - [13, 19148.0]
  - - [1024, 3404, 1, 4096, 1024, 1024, 4096, 4096]
    - [30, 17592.0]
  - - [4096, 3999, 1, 1024, 4096, 4096, 1024, 1024]
    - [13, 18753.0]
  - - [4096, 3166, 1, 1024, 4096, 4096, 1024, 1024]
    - [13, 18734.0]
  - - [33708, 3840, 1, 1024, 33708, 33708, 1024, 1024]
    - [51, 19902.0]
  - - [4096, 4032, 1, 1024, 4096, 4096, 1024, 1024]
    - [13, 18915.0]
  - - [1024, 3573, 1, 4096, 1024, 1024, 4096, 4096]
    - [30, 16311.0]
  - - [4096, 3366, 1, 1024, 4096, 4096, 1024, 1024]
    - [13, 18880.0]
  - - [1024, 3541, 1, 4096, 1024, 1024, 4096, 4096]
    - [13, 16468.0]
  - - [4096, 3207, 1, 1024, 4096, 4096, 1024, 1024]
    - [15, 18285.0]
  - - [4096, 3272, 1, 1024, 4096, 4096, 1024, 1024]
    - [15, 18727.0]
  - - [1024, 3334, 1, 4096, 1024, 1024, 4096, 4096]
    - [13, 16579.0]
  - - [228, 228, 272, 64, 228, 228, 64, 64]
    - [4, 10209.0]
  - - [4096, 3183, 1, 1024, 4096, 4096, 1024, 1024]
    - [13, 18774.0]
  - - [4096, 3536, 1, 1024, 4096, 4096, 1024, 1024]
    - [13, 19017.0]
  - - [1024, 4005, 1, 1024, 1024, 1024, 1024, 1024]
    - [32, 16851.0]
  - - [1024, 3245, 1, 4096, 1024, 1024, 4096, 4096]
    - [15, 18589.0]
  - - [4096, 3447, 1, 1024, 4096, 4096, 1024, 1024]
    - [13, 19267.0]
  - - [1024, 3183, 1, 4096, 1024, 1024, 4096, 4096]
    - [32, 18244.0]
  - - [1024, 3361, 1, 4096, 1024, 1024, 4096, 4096]
    - [49, 16124.0]
  - - [33708, 3870, 1, 1024, 33708, 33708, 1024, 1024]
    - [30, 19201.0]
  - - [1024, 3321, 1, 4096, 1024, 1024, 4096, 4096]
    - [15, 18925.0]
  - - [1024, 3486, 1, 4096, 1024, 1024, 4096, 4096]
    - [30, 16514.0]
  - - [4096, 4005, 1, 1024, 4096, 4096, 1024, 1024]
    - [13, 18833.0]
  - - [4096, 3410, 1, 1024, 4096, 4096, 1024, 1024]
    - [13, 19135.0]
  - - [1024, 3944, 1, 1024, 1024, 1024, 1024, 1024]
    - [30, 18222.0]
  - - [4096, 3300, 1, 1024, 4096, 4096, 1024, 1024]
    - [15, 18891.0]
  - - [4096, 3579, 1, 1024, 4096, 4096, 1024, 1024]
    - [13, 19309.0]
  - - [4096, 3483, 1, 1024, 4096, 4096, 1024, 1024]
    - [13, 18839.0]
  - - [4096, 3532, 1, 1024, 4096, 4096, 1024, 1024]
    - [13, 19036.0]
  - - [1024, 3140, 1, 4096, 1024, 1024, 4096, 4096]
    - [15, 18028.0]
  - - [1024, 3372, 1, 4096, 1024, 1024, 4096, 4096]
    - [13, 17160.0]
  - - [1024, 3224, 1, 4096, 1024, 1024, 4096, 4096]
    - [32, 18515.0]
  - - [4096, 3230, 1, 1024, 4096, 4096, 1024, 1024]
    - [15, 18488.0]
  - - [4096, 3427, 1, 1024, 4096, 4096, 1024, 1024]
    - [13, 19227.0]
  - - [1024, 3796, 1, 1024, 1024, 1024, 1024, 1024]
    - [30, 17526.0]
  - - [143, 148, 432, 64, 143, 143, 64, 64]
    - [17, 7336.0]
  - - [1024, 3616, 1, 4096, 1024, 1024, 4096, 4096]
    - [13, 16360.0]
  - - [1024, 3315, 1, 4096, 1024, 1024, 4096, 4096]
    - [32, 18984.0]
  - - [1024, 3476, 1, 4096, 1024, 1024, 4096, 4096]
    - [49, 15749.0]
  - - [1024, 3509, 1, 4096, 1024, 1024, 4096, 4096]
    - [13, 16649.0]
  - - [4096, 3357, 1, 1024, 4096, 4096, 1024, 1024]
    - [13, 18883.0]
  - - [4096, 3406, 1, 1024, 4096, 4096, 1024, 1024]
    - [13, 19212.0]
  - - [1024, 3558, 1, 4096, 1024, 1024, 4096, 4096]
    - [13, 16836.0]
  - - [4096, 3593, 1, 1024, 4096, 4096, 1024, 1024]
    - [13, 18720.0]
  - - [4096, 3247, 1, 1024, 4096, 4096, 1024, 1024]
    - [15, 18586.0]
  - - [4096, 3088, 1, 1024, 4096, 4096, 1024, 1024]
    - [13, 18261.0]
  - - [1024, 3213, 1, 4096, 1024, 1024, 4096, 4096]
    - [32, 18437.0]
  - - [4096, 3511, 1, 1024, 4096, 4096, 1024, 1024]
    - [13, 18974.0]
  - - [1024, 3365, 1, 4096, 1024, 1024, 4096, 4096]
    - [13, 16809.0]
  - - [1024, 3504, 1, 4096, 1024, 1024, 4096, 4096]
    - [30, 15836.0]
  - - [1024, 3442, 1, 4096, 1024, 1024, 4096, 4096]
    - [13, 18681.0]
  - - [4096, 3474, 1, 1024, 4096, 4096, 1024, 1024]
    - [13, 18746.0]
  - - [4096, 2984, 1, 1024, 4096, 4096, 1024, 1024]
    - [15, 18548.0]
  - - [1024, 3876, 1, 4096, 1024, 1024, 4096, 4096]
    - [32, 16897.0]
  - - [4096, 3337, 1, 1024, 4096, 4096, 1024, 1024]
    - [13, 18685.0]
  - - [4096, 3450, 1, 1024, 4096, 4096, 1024, 1024]
    - [13, 19334.0]
  - - [1024, 3547, 1, 4096, 1024, 1024, 4096, 4096]
    - [13, 15909.0]
  - - [4096, 3291, 1, 1024, 4096, 4096, 1024, 1024]
    - [15, 18762.0]
  - - [1024, 3340, 1, 4096, 1024, 1024, 4096, 4096]
    - [30, 16367.0]
  - - [4096, 3491, 1, 1024, 4096, 4096, 1024, 1024]
    - [13, 18836.0]
  - - [4096, 3348, 1, 1024, 4096, 4096, 1024, 1024]
    - [13, 18820.0]
  - - [4096, 3906, 1, 1024, 4096, 4096, 1024, 1024]
    - [13, 18937.0]
  - - [1024, 3477, 1, 4096, 1024, 1024, 4096, 4096]
    - [49, 15784.0]
  - - [1024, 3397, 1, 4096, 1024, 1024, 4096, 4096]
    - [13, 18430.0]
  - - [4096, 3165, 1, 1024, 4096, 4096, 1024, 1024]
    - [13, 18612.0]
  - - [4096, 3470, 1, 1024, 4096, 4096, 1024, 1024]
    - [13, 18779.0]
  - - [1024, 3526, 1, 4096, 1024, 1024, 4096, 4096]
    - [30, 16141.0]
  - - [4096, 3365, 1, 1024, 4096, 4096, 1024, 1024]
    - [13, 18920.0]
  - - [4096, 3319, 1, 1024, 4096, 4096, 1024, 1024]
    - [15, 18953.0]
  - - [1024, 3401, 1, 4096, 1024, 1024, 4096, 4096]
    - [30, 18538.0]
  - - [1024, 3294, 1, 4096, 1024, 1024, 4096, 4096]
    - [15, 18875.0]
  - - [159, 159, 400, 64, 159, 159, 64, 64]
    - [0, 8595.0]
  - - [1024, 3472, 1, 4096, 1024, 1024, 4096, 4096]
    - [13, 15687.0]
  - - [4096, 3328, 1, 1024, 4096, 4096, 1024, 1024]
    - [15, 19058.0]
  - - [1024, 3861, 1, 1024, 1024, 1024, 1024, 1024]
    - [30, 17679.0]
  - - [1024, 3910, 1, 1024, 1024, 1024, 1024, 1024]
    - [30, 18047.0]
  - - [1024, 3410, 1, 4096, 1024, 1024, 4096, 4096]
    - [31, 16949.0]
  - - [1024, 3395, 1, 4096, 1024, 1024, 4096, 4096]
    - [13, 17591.0]
  - - [4096, 3282, 1, 1024, 4096, 4096, 1024, 1024]
    - [15, 18728.0]
  - - [1024, 3751, 1, 1024, 1024, 1024, 1024, 1024]
    - [49, 17315.0]
  - - [4096, 3145, 1, 1024, 4096, 4096, 1024, 1024]
    - [13, 18510.0]
  - - [4096, 3514, 1, 1024, 4096, 4096, 1024, 1024]
    - [13, 18957.0]
  - - [4096, 3944, 1, 1024, 4096, 4096, 1024, 1024]
    - [13, 19147.0]
  - - [1024, 3515, 1, 4096, 1024, 1024, 4096, 4096]
    - [13, 15669.0]
  - - [4096, 3409, 1, 1024, 4096, 4096, 1024, 1024]
    - [13, 19073.0]
  - - [4096, 3564, 1, 1024, 4096, 4096, 1024, 1024]
    - [13, 19243.0]
  - - [4096, 3299, 1, 1024, 4096, 4096, 1024, 1024]
    - [15, 18846.0]
  - - [1024, 3057, 1, 4096, 1024, 1024, 4096, 4096]
    - [51, 17541.0]
  - - [4096, 3531, 1, 1024, 4096, 4096, 1024, 1024]
    - [13, 19016.0]
  - - [4096, 3388, 1, 1024, 4096, 4096, 1024, 1024]
    - [13, 19061.0]
  - - [1024, 3189, 1, 4096, 1024, 1024, 4096, 4096]
    - [32, 18316.0]
  - - [1024, 3300, 1, 4096, 1024, 1024, 4096, 4096]
    - [15, 18913.0]
  - - [1024, 3720, 1, 4096, 1024, 1024, 4096, 4096]
    - [13, 17607.0]
  - - [1024, 3383, 1, 4096, 1024, 1024, 4096, 4096]
    - [30, 17100.0]
  - - [1024, 3494, 1, 4096, 1024, 1024, 4096, 4096]
    - [30, 16352.0]
  - - [1024, 3448, 1, 4096, 1024, 1024, 4096, 4096]
    - [13, 18661.0]
  - - [4096, 3542, 1, 1024, 4096, 4096, 1024, 1024]
    - [13, 19137.0]
  - - [1024, 3488, 1, 4096, 1024, 1024, 4096, 4096]
    - [13, 16427.0]
  - - [4096, 3405, 1, 1024, 4096, 4096, 1024, 1024]
    - [13, 19110.0]
  - - [1024, 3262, 1, 4096, 1024, 1024, 4096, 4096]
    - [51, 18706.0]
  - - [33708, 4005, 1, 1024, 33708, 33708, 1024, 1024]
    - [51, 19497.0]
  - - [1024, 3594, 1, 4096, 1024, 1024, 4096, 4096]
    - [30, 15764.0]
  - - [4096, 3103, 1, 1024, 4096, 4096, 1024, 1024]
    - [13, 18255.0]
  - - [4096, 3136, 1, 1024, 4096, 4096, 1024, 1024]
    - [13, 18507.0]
  - - [1024, 3378, 1, 4096, 1024, 1024, 4096, 4096]
    - [31, 16693.0]
  - - [4096, 3559, 1, 1024, 4096, 4096, 1024, 1024]
    - [13, 19217.0]
  - - [4096, 3368, 1, 1024, 4096, 4096, 1024, 1024]
    - [13, 18946.0]
  - - [4096, 3209, 1, 1024, 4096, 4096, 1024, 1024]
    - [15, 18351.0]
  - - [4096, 3322, 1, 1024, 4096, 4096, 1024, 1024]
    - [15, 18995.0]
  - - [1024, 3483, 1, 4096, 1024, 1024, 4096, 4096]
    - [13, 16274.0]
  - - [4096, 3473, 1, 1024, 4096, 4096, 1024, 1024]
    - [13, 18731.0]
  - - [4096, 3522, 1, 1024, 4096, 4096, 1024, 1024]
    - [13, 19027.0]
  - - [1024, 3532, 1, 4096, 1024, 1024, 4096, 4096]
    - [30, 16133.0]
  - - [4096, 3449, 1, 1024, 4096, 4096, 1024, 1024]
    - [13, 19365.0]
  - - [1024, 3351, 1, 4096, 1024, 1024, 4096, 4096]
    - [31, 16500.0]
  - - [1024, 3462, 1, 4096, 1024, 1024, 4096, 4096]
    - [13, 16178.0]
  - - [4096, 3396, 1, 1024, 4096, 4096, 1024, 1024]
    - [13, 19103.0]
  - - [132, 132, 480, 64, 132, 132, 64, 64]
    - [0, 6152.0]
  - - [1024, 3416, 1, 4096, 1024, 1024, 4096, 4096]
    - [13, 17344.0]
  - - [4096, 3469, 1, 1024, 4096, 4096, 1024, 1024]
    - [13, 18711.0]
  - - [1024, 3582, 1, 4096, 1024, 1024, 4096, 4096]
    - [13, 16590.0]
  - - [1024, 3230, 1, 4096, 1024, 1024, 4096, 4096]
    - [32, 18555.0]
  - - [1024, 3489, 1, 4096, 1024, 1024, 4096, 4096]
    - [30, 15756.0]
  - - [1024, 3427, 1, 4096, 1024, 1024, 4096, 4096]
    - [14, 16922.0]
  - - [1024, 3346, 1, 4096, 1024, 1024, 4096, 4096]
    - [13, 16355.0]
  - - [33708, 3977, 1, 1024, 33708, 33708, 1024, 1024]
    - [51, 19322.0]
  - - [4096, 3796, 1, 1024, 4096, 4096, 1024, 1024]
    - [13, 19056.0]
  - - [4096, 3176, 1, 1024, 4096, 4096, 1024, 1024]
    - [13, 18740.0]
  - - [4096, 3990, 1, 1024, 4096, 4096, 1024, 1024]
    - [13, 18728.0]
  - - [1024, 3257, 1, 4096, 1024, 1024, 4096, 4096]
    - [51, 18626.0]
  - - [4096, 3343, 1, 1024, 4096, 4096, 1024, 1024]
    - [13, 18704.0]
  - - [4096, 3440, 1, 1024, 4096, 4096, 1024, 1024]
    - [13, 19364.0]
  - - [33708, 4030, 1, 1024, 33708, 33708, 1024, 1024]
    - [32, 19577.0]
  - - [1024, 3190, 1, 4096, 1024, 1024, 4096, 4096]
    - [51, 18220.0]
  - - [1024, 3389, 1, 4096, 1024, 1024, 4096, 4096]
    - [30, 16628.0]
  - - [1024, 3500, 1, 4096, 1024, 1024, 4096, 4096]
    - [13, 15985.0]
  - - [1024, 3471, 1, 4096, 1024, 1024, 4096, 4096]
    - [30, 15212.0]
  - - [1024, 3438, 1, 4096, 1024, 1024, 4096, 4096]
    - [13, 17899.0]
  - - [4096, 3513, 1, 1024, 4096, 4096, 1024, 1024]
    - [13, 18951.0]
  - - [1024, 3562, 1, 4096, 1024, 1024, 4096, 4096]
    - [13, 16084.0]
  - - [4096, 3616, 1, 1024, 4096, 4096, 1024, 1024]
    - [13, 18764.0]
  - - [4096, 3955, 1, 1024, 4096, 4096, 1024, 1024]
    - [13, 19155.0]
  - - [1024, 3441, 1, 4096, 1024, 1024, 4096, 4096]
    - [30, 18707.0]
  - - [1024, 3236, 1, 4096, 1024, 1024, 4096, 4096]
    - [32, 18571.0]
  - - [1024, 3524, 1, 4096, 1024, 1024, 4096, 4096]
    - [30, 16660.0]
  - - [4096, 3460, 1, 1024, 4096, 4096, 1024, 1024]
    - [13, 18706.0]
  - - [1024, 3384, 1, 4096, 1024, 1024, 4096, 4096]
    - [30, 17725.0]
  - - [4096, 3387, 1, 1024, 4096, 4096, 1024, 1024]
    - [13, 19077.0]
  - - [4096, 3436, 1, 1024, 4096, 4096, 1024, 1024]
    - [13, 19298.0]
  - - [4096, 3277, 1, 1024, 4096, 4096, 1024, 1024]
    - [15, 18741.0]
  - - [1024, 3457, 1, 4096, 1024, 1024, 4096, 4096]
    - [13, 16302.0]
  - - [1024, 3999, 1, 4096, 1024, 1024, 4096, 4096]
    - [32, 17435.0]
  - - [1024, 4032, 1, 4096, 1024, 1024, 4096, 4096]
    - [32, 17577.0]
  - - [4096, 3541, 1, 1024, 4096, 4096, 1024, 1024]
    - [13, 19102.0]
  - - [4096, 3334, 1, 1024, 4096, 4096, 1024, 1024]
    - [13, 18762.0]
  - - [1024, 3393, 1, 4096, 1024, 1024, 4096, 4096]
    - [31, 16949.0]
  - - [1024, 3411, 1, 4096, 1024, 1024, 4096, 4096]
    - [31, 16972.0]
  - - [1024, 3822, 1, 1024, 1024, 1024, 1024, 1024]
    - [30, 17611.0]
  - - [1024, 3593, 1, 4096, 1024, 1024, 4096, 4096]
    - [32, 15693.0]
  - - [33708, 3822, 1, 1024, 33708, 33708, 1024, 1024]
    - [51, 19800.0]
  - - [4096, 3504, 1, 1024, 4096, 4096, 1024, 1024]
    - [13, 18903.0]
  - - [1024, 3163, 1, 4096, 1024, 1024, 4096, 4096]
    - [51, 18137.0]
  - - [1024, 3357, 1, 4096, 1024, 1024, 4096, 4096]
    - [13, 18104.0]
  - - [1024, 3906, 1, 4096, 1024, 1024, 4096, 4096]
    - [32, 17072.0]
  - - [4096, 3415, 1, 1024, 4096, 4096, 1024, 1024]
    - [13, 19217.0]
  - - [1024, 3406, 1, 4096, 1024, 1024, 4096, 4096]
    - [30, 18339.0]
  - - [4096, 3321, 1, 1024, 4096, 4096, 1024, 1024]
    - [15, 18929.0]
  - - [4096, 3584, 1, 1024, 4096, 4096, 1024, 1024]
    - [13, 19385.0]
  - - [1024, 2736, 1, 4096, 1024, 1024, 4096, 4096]
    - [13, 16407.0]
  - - [1024, 3110, 1, 4096, 1024, 1024, 4096, 4096]
    - [15, 17886.0]
  - - [33708, 3999, 1, 1024, 33708, 33708, 1024, 1024]
    - [51, 19463.0]
  - - [1024, 3093, 1, 4096, 1024, 1024, 4096, 4096]
    - [51, 17705.0]
  - - [4096, 3378, 1, 1024, 4096, 4096, 1024, 1024]
    - [13, 18937.0]
  - - [1024, 3543, 1, 4096, 1024, 1024, 4096, 4096]
    - [13, 16271.0]
  - - [33708, 3925, 1, 1024, 33708, 33708, 1024, 1024]
    - [49, 19480.0]
  - - [1024, 3352, 1, 4096, 1024, 1024, 4096, 4096]
    - [14, 16191.0]
  - - [4096, 3780, 1, 1024, 4096, 4096, 1024, 1024]
    - [13, 18905.0]
  - - [1024, 3990, 1, 4096, 1024, 1024, 4096, 4096]
    - [32, 17361.0]
  - - [4096, 3500, 1, 1024, 4096, 4096, 1024, 1024]
    - [13, 18843.0]
  - - [4096, 3996, 1, 1024, 4096, 4096, 1024, 1024]
    - [13, 18776.0]
  - - [1024, 3247, 1, 4096, 1024, 1024, 4096, 4096]
    - [15, 18587.0]
  - - [4096, 3395, 1, 1024, 4096, 4096, 1024, 1024]
    - [13, 19104.0]
  - - [1024, 3169, 1, 4096, 1024, 1024, 4096, 4096]
    - [15, 18187.0]
  - - [1024, 3088, 1, 4096, 1024, 1024, 4096, 4096]
    - [15, 17767.0]
  - - [1024, 3584, 1, 4096, 1024, 1024, 4096, 4096]
    - [30, 15795.0]
  - - [4096, 3093, 1, 1024, 4096, 4096, 1024, 1024]
    - [13, 18229.0]
  - - [1024, 3538, 1, 4096, 1024, 1024, 4096, 4096]
    - [30, 15865.0]
  - - [1024, 3996, 1, 1024, 1024, 1024, 1024, 1024]
    - [32, 16856.0]
  - - [1024, 3581, 1, 4096, 1024, 1024, 4096, 4096]
    - [13, 16519.0]
  - - [4096, 3374, 1, 1024, 4096, 4096, 1024, 1024]
    - [13, 18927.0]
  - - [33708, 3751, 1, 1024, 33708, 33708, 1024, 1024]
    - [51, 19441.0]
  - - [4096, 3215, 1, 1024, 4096, 4096, 1024, 1024]
    - [15, 18334.0]
  - - [4096, 3312, 1, 1024, 4096, 4096, 1024, 1024]
    - [15, 18942.0]
  - - [4096, 3581, 1, 1024, 4096, 4096, 1024, 1024]
    - [13, 19375.0]
  - - [4096, 3479, 1, 1024, 4096, 4096, 1024, 1024]
    - [13, 18874.0]
  - - [4096, 3544, 1, 1024, 4096, 4096, 1024, 1024]
    - [13, 19185.0]
  - - [1024, 3870, 1, 1024, 1024, 1024, 1024, 1024]
    - [30, 17834.0]
  - - [1024, 3374, 1, 4096, 1024, 1024, 4096, 4096]
    - [14, 16865.0]
  - - [1024, 2967, 1, 4096, 1024, 1024, 4096, 4096]
    - [15, 17088.0]
  - - [4096, 3455, 1, 1024, 4096, 4096, 1024, 1024]
    - [13, 19402.0]
  - - [4096, 3942, 1, 1024, 4096, 4096, 1024, 1024]
    - [13, 19152.0]
  - - [1024, 3528, 1, 4096, 1024, 1024, 4096, 4096]
    - [13, 16189.0]
  - - [4096, 3186, 1, 1024, 4096, 4096, 1024, 1024]
    - [13, 18776.0]
  - - [1024, 3976, 1, 1024, 1024, 1024, 1024, 1024]
    - [32, 16761.0]
  - - [1024, 3511, 1, 4096, 1024, 1024, 4096, 4096]
    - [13, 15773.0]
  - - [4096, 3573, 1, 1024, 4096, 4096, 1024, 1024]
    - [13, 19243.0]
  - - [4096, 3561, 1, 1024, 4096, 4096, 1024, 1024]
    - [13, 19224.0]
  - - [4096, 3418, 1, 1024, 4096, 4096, 1024, 1024]
    - [13, 19184.0]
  - - [33708, 3906, 1, 1024, 33708, 33708, 1024, 1024]
    - [49, 19420.0]
  - - [4096, 3259, 1, 1024, 4096, 4096, 1024, 1024]
    - [15, 18594.0]
  - - [4096, 3308, 1, 1024, 4096, 4096, 1024, 1024]
    - [15, 18904.0]
  - - [1024, 3419, 1, 4096, 1024, 1024, 4096, 4096]
    - [13, 17934.0]
  - - [1024, 3215, 1, 4096, 1024, 1024, 4096, 4096]
    - [15, 18458.0]
  - - [1024, 4030, 1, 4096, 1024, 1024, 4096, 4096]
    - [32, 17566.0]
  - - [4096, 3459, 1, 1024, 4096, 4096, 1024, 1024]
    - [13, 18671.0]
  - - [1024, 3572, 1, 4096, 1024, 1024, 4096, 4096]
    - [30, 16303.0]
  - - [1024, 3137, 1, 4096, 1024, 1024, 4096, 4096]
    - [51, 18029.0]
  - - [1024, 3312, 1, 4096, 1024, 1024, 4096, 4096]
    - [32, 18962.0]
  - - [1024, 3925, 1, 4096, 1024, 1024, 4096, 4096]
    - [30, 17825.0]
  - - [1024, 3453, 1, 4096, 1024, 1024, 4096, 4096]
    - [13, 18066.0]
  - - [4096, 3435, 1, 1024, 4096, 4096, 1024, 1024]
    - [13, 19227.0]
  - - [1024, 3176, 1, 4096, 1024, 1024, 4096, 4096]
    - [32, 18225.0]
  - - [1024, 3444, 1, 4096, 1024, 1024, 4096, 4096]
    - [13, 17299.0]
  - - [4096, 3975, 1, 1024, 4096, 4096, 1024, 1024]
    - [13, 18658.0]
  - - [4096, 3182, 1, 1024, 4096, 4096, 1024, 1024]
    - [13, 18722.0]
  - - [1024, 3475, 1, 4096, 1024, 1024, 4096, 4096]
    - [13, 15872.0]
  - - [33708, 3955, 1, 1024, 33708, 33708, 1024, 1024]
    - [49, 19627.0]
  - - [4096, 3446, 1, 1024, 4096, 4096, 1024, 1024]
    - [13, 19314.0]
  - - [1024, 3138, 1, 4096, 1024, 1024, 4096, 4096]
    - [51, 17990.0]
  - - [1024, 3549, 1, 4096, 1024, 1024, 4096, 4096]
    - [13, 16668.0]
  - - [4096, 3287, 1, 1024, 4096, 4096, 1024, 1024]
    - [15, 18779.0]
  - - [1024, 3342, 1, 4096, 1024, 1024, 4096, 4096]
    - [13, 17555.0]
  - - [4096, 3519, 1, 1024, 4096, 4096, 1024, 1024]
    - [13, 18988.0]
  - - [4096, 3552, 1, 1024, 4096, 4096, 1024, 1024]
    - [13, 19193.0]
  - - [4096, 3859, 1, 1024, 4096, 4096, 1024, 1024]
    - [13, 18740.0]
  - - [33708, 3969, 1, 1024, 33708, 33708, 1024, 1024]
    - [51, 19328.0]
  - - [1024, 3369, 1, 4096, 1024, 1024, 4096, 4096]
    - [31, 16479.0]
  - - [4096, 3482, 1, 1024, 4096, 4096, 1024, 1024]
    - [13, 18762.0]
  - - [1024, 3306, 1, 4096, 1024, 1024, 4096, 4096]
    - [32, 18858.0]
  - - [1024, 3474, 1, 4096, 1024, 1024, 4096, 4096]
    - [30, 15583.0]
  - - [4096, 3377, 1, 1024, 4096, 4096, 1024, 1024]
    - [13, 18942.0]
  - - [4096, 3426, 1, 1024, 4096, 4096, 1024, 1024]
    - [13, 19189.0]
  - - [4096, 2935, 1, 1024, 4096, 4096, 1024, 1024]
    - [13, 18809.0]
  - - [4096, 3267, 1, 1024, 4096, 4096, 1024, 1024]
    - [15, 18680.0]
  - - [1024, 3299, 1, 4096, 1024, 1024, 4096, 4096]
    - [51, 18925.0]
  - - [1024, 3456, 1, 4096, 1024, 1024, 4096, 4096]
    - [13, 18724.0]
  - - [1024, 3280, 1, 4096, 1024, 1024, 4096, 4096]
    - [32, 18800.0]
  - - [1024, 3555, 1, 4096, 1024, 1024, 4096, 4096]
    - [13, 16671.0]
  - - [4096, 3499, 1, 1024, 4096, 4096, 1024, 1024]
    - [13, 18883.0]
  - - [4096, 3356, 1, 1024, 4096, 4096, 1024, 1024]
    - [13, 18877.0]
  - - [1024, 3412, 1, 4096, 1024, 1024, 4096, 4096]
    - [14, 17004.0]
  - - [1024, 2984, 1, 4096, 1024, 1024, 4096, 4096]
    - [32, 17188.0]
  - - [4096, 3141, 1, 1024, 4096, 4096, 1024, 1024]
    - [13, 18549.0]
  - - [4096, 3510, 1, 1024, 4096, 4096, 1024, 1024]
    - [13, 18935.0]
  - - [1024, 3995, 1, 1024, 1024, 1024, 1024, 1024]
    - [32, 16752.0]
  - - [1024, 3517, 1, 4096, 1024, 1024, 4096, 4096]
    - [13, 16541.0]
  - - [1024, 3455, 1, 4096, 1024, 1024, 4096, 4096]
    - [13, 17741.0]
  - - [1024, 3939, 1, 1024, 1024, 1024, 1024, 1024]
    - [30, 18179.0]
  - - [1024, 3447, 1, 4096, 1024, 1024, 4096, 4096]
    - [31, 17110.0]
  - - [1024, 3969, 1, 4096, 1024, 1024, 4096, 4096]
    - [15, 17287.0]
  - - [4096, 3527, 1, 1024, 4096, 4096, 1024, 1024]
    - [13, 19000.0]
  - - [4096, 3336, 1, 1024, 4096, 4096, 1024, 1024]
    - [13, 18760.0]
  - - [1024, 3191, 1, 4096, 1024, 1024, 4096, 4096]
    - [32, 18308.0]
  - - [1024, 3302, 1, 4096, 1024, 1024, 4096, 4096]
    - [15, 18892.0]
  - - [1024, 3337, 1, 4096, 1024, 1024, 4096, 4096]
    - [31, 16676.0]
  - - [4096, 3290, 1, 1024, 4096, 4096, 1024, 1024]
    - [15, 18743.0]
  - - [1024, 3512, 1, 4096, 1024, 1024, 4096, 4096]
    - [13, 15976.0]
  - - [1024, 3433, 1, 4096, 1024, 1024, 4096, 4096]
    - [31, 16597.0]
  - - [4096, 3876, 1, 1024, 4096, 4096, 1024, 1024]
    - [13, 18826.0]
  - - [4096, 3490, 1, 1024, 4096, 4096, 1024, 1024]
    - [13, 18882.0]
  - - [4096, 3064, 1, 1024, 4096, 4096, 1024, 1024]
    - [15, 19040.0]
  - - [1024, 3508, 1, 4096, 1024, 1024, 4096, 4096]
    - [13, 16380.0]
  - - [1024, 3956, 1, 4096, 1024, 1024, 4096, 4096]
    - [13, 17863.0]
  - - [4096, 3417, 1, 1024, 4096, 4096, 1024, 1024]
    - [13, 19203.0]
  - - [1024, 3248, 1, 4096, 1024, 1024, 4096, 4096]
    - [51, 18626.0]
  - - [1024, 2499, 1, 4096, 1024, 1024, 4096, 4096]
    - [13, 15684.0]
  - - [1024, 3186, 1, 4096, 1024, 1024, 4096, 4096]
    - [51, 18307.0]
  - - [1024, 3180, 1, 4096, 1024, 1024, 4096, 4096]
    - [15, 18286.0]
  - - [4096, 3364, 1, 1024, 4096, 4096, 1024, 1024]
    - [13, 18836.0]
  - - [4096, 3976, 1, 1024, 4096, 4096, 1024, 1024]
    - [13, 18680.0]
  - - [4096, 3205, 1, 1024, 4096, 4096, 1024, 1024]
    - [15, 18348.0]
  - - [4096, 3318, 1, 1024, 4096, 4096, 1024, 1024]
    - [15, 18996.0]
  - - [1024, 3377, 1, 4096, 1024, 1024, 4096, 4096]
    - [31, 16575.0]
  - - [1024, 3485, 1, 4096, 1024, 1024, 4096, 4096]
    - [49, 15458.0]
  - - [4096, 3181, 1, 1024, 4096, 4096, 1024, 1024]
    - [13, 18718.0]
  - - [4096, 3550, 1, 1024, 4096, 4096, 1024, 1024]
    - [13, 19140.0]
  - - [1024, 3534, 1, 4096, 1024, 1024, 4096, 4096]
    - [30, 15514.0]
  - - [1024, 3860, 1, 1024, 1024, 1024, 1024, 1024]
    - [30, 17769.0]
  - - [160, 160, 400, 64, 160, 160, 64, 64]
    - [36, 8868.0]
  - - [4096, 3445, 1, 1024, 4096, 4096, 1024, 1024]
    - [13, 19356.0]
  - - [1024, 3391, 1, 4096, 1024, 1024, 4096, 4096]
    - [13, 16817.0]
  - - [1024, 3221, 1, 4096, 1024, 1024, 4096, 4096]
    - [15, 18484.0]
  - - [4096, 3079, 1, 1024, 4096, 4096, 1024, 1024]
    - [13, 18150.0]
  - - [4096, 3144, 1, 1024, 4096, 4096, 1024, 1024]
    - [13, 18531.0]
  - - [1024, 3270, 1, 4096, 1024, 1024, 4096, 4096]
    - [32, 18733.0]
  - - [1024, 3561, 1, 4096, 1024, 1024, 4096, 4096]
    - [13, 16275.0]
  - - [1024, 3480, 1, 4096, 1024, 1024, 4096, 4096]
    - [13, 16354.0]
  - - [4096, 3408, 1, 1024, 4096, 4096, 1024, 1024]
    - [13, 19140.0]
  - - [1024, 3418, 1, 4096, 1024, 1024, 4096, 4096]
    - [30, 17656.0]
  - - [4096, 3298, 1, 1024, 4096, 4096, 1024, 1024]
    - [15, 18819.0]
  - - [1024, 3640, 1, 1024, 1024, 1024, 1024, 1024]
    - [49, 16856.0]
  - - [1024, 3449, 1, 4096, 1024, 1024, 4096, 4096]
    - [31, 17146.0]
  - - [1024, 4020, 1, 4096, 1024, 1024, 4096, 4096]
    - [32, 17524.0]
  - - [4096, 3481, 1, 1024, 4096, 4096, 1024, 1024]
    - [13, 18789.0]
  - - [4096, 3530, 1, 1024, 4096, 4096, 1024, 1024]
    - [13, 19110.0]
  - - [1024, 3216, 1, 4096, 1024, 1024, 4096, 4096]
    - [32, 18411.0]
  - - [1024, 3491, 1, 4096, 1024, 1024, 4096, 4096]
    - [30, 16035.0]
  - - [1024, 3154, 1, 4096, 1024, 1024, 4096, 4096]
    - [51, 18118.0]
  - - [4096, 3425, 1, 1024, 4096, 4096, 1024, 1024]
    - [13, 19214.0]
  - - [1024, 3348, 1, 4096, 1024, 1024, 4096, 4096]
    - [13, 16789.0]
  - - [1024, 3415, 1, 4096, 1024, 1024, 4096, 4096]
    - [13, 17089.0]
  - - [1024, 4026, 1, 1024, 1024, 1024, 1024, 1024]
    - [32, 16869.0]
  - - [1024, 3367, 1, 4096, 1024, 1024, 4096, 4096]
    - [13, 17237.0]
  - - [1024, 3259, 1, 4096, 1024, 1024, 4096, 4096]
    - [32, 18702.0]
  - - [1024, 3894, 1, 4096, 1024, 1024, 4096, 4096]
    - [13, 17353.0]
  - - [4096, 3355, 1, 1024, 4096, 4096, 1024, 1024]
    - [13, 18787.0]
  - - [4096, 3404, 1, 1024, 4096, 4096, 1024, 1024]
    - [13, 19123.0]
  - - [1024, 3308, 1, 4096, 1024, 1024, 4096, 4096]
    - [15, 18926.0]
  - - [4096, 3245, 1, 1024, 4096, 4096, 1024, 1024]
    - [15, 18542.0]
  - - [1024, 3502, 1, 4096, 1024, 1024, 4096, 4096]
    - [13, 16593.0]
  - - [33708, 4032, 1, 1024, 33708, 33708, 1024, 1024]
    - [51, 19617.0]
  - - [1024, 3424, 1, 4096, 1024, 1024, 4096, 4096]
    - [13, 17246.0]
  - - [4096, 3509, 1, 1024, 4096, 4096, 1024, 1024]
    - [13, 18941.0]
  - - [4096, 3558, 1, 1024, 4096, 4096, 1024, 1024]
    - [13, 19223.0]
  - - [1024, 3900, 1, 1024, 1024, 1024, 1024, 1024]
    - [30, 17969.0]
  - - [1024, 2505, 1, 4096, 1024, 1024, 4096, 4096]
    - [13, 15864.0]
  - - [4096, 3472, 1, 1024, 4096, 4096, 1024, 1024]
    - [13, 18755.0]
  - - [1024, 3386, 1, 4096, 1024, 1024, 4096, 4096]
    - [31, 16802.0]
  - - [4096, 3383, 1, 1024, 4096, 4096, 1024, 1024]
    - [13, 18993.0]
  - - [4096, 3448, 1, 1024, 4096, 4096, 1024, 1024]
    - [13, 19316.0]
  - - [4096, 4030, 1, 1024, 4096, 4096, 1024, 1024]
    - [13, 18947.0]
  - - [4096, 3289, 1, 1024, 4096, 4096, 1024, 1024]
    - [15, 18785.0]
  - - [1024, 3459, 1, 4096, 1024, 1024, 4096, 4096]
    - [13, 15445.0]
  - - [1024, 2918, 1, 4096, 1024, 1024, 4096, 4096]
    - [15, 16827.0]
  - - [4096, 3489, 1, 1024, 4096, 4096, 1024, 1024]
    - [13, 18831.0]
  - - [4096, 3346, 1, 1024, 4096, 4096, 1024, 1024]
    - [13, 18818.0]
  - - [4096, 3572, 1, 1024, 4096, 4096, 1024, 1024]
    - [13, 19328.0]
  - - [1024, 3955, 1, 4096, 1024, 1024, 4096, 4096]
    - [13, 18579.0]
  - - [4096, 3236, 1, 1024, 4096, 4096, 1024, 1024]
    - [15, 18488.0]
  - - [4096, 3163, 1, 1024, 4096, 4096, 1024, 1024]
    - [13, 18697.0]
  - - [4096, 3468, 1, 1024, 4096, 4096, 1024, 1024]
    - [13, 18768.0]
  - - [1024, 3165, 1, 4096, 1024, 1024, 4096, 4096]
    - [15, 18172.0]
  - - [1024, 3276, 1, 4096, 1024, 1024, 4096, 4096]
    - [32, 18818.0]
  - - [1024, 3359, 1, 4096, 1024, 1024, 4096, 4096]
    - [14, 16775.0]
  - - [4096, 3363, 1, 1024, 4096, 4096, 1024, 1024]
    - [13, 18853.0]
  - - [1024, 3385, 1, 4096, 1024, 1024, 4096, 4096]
    - [30, 17681.0]
  - - [1024, 3207, 1, 4096, 1024, 1024, 4096, 4096]
    - [32, 18418.0]
  - - [1024, 3458, 1, 4096, 1024, 1024, 4096, 4096]
    - [13, 15696.0]
  - - [4096, 3110, 1, 1024, 4096, 4096, 1024, 1024]
    - [13, 18329.0]
  - - [4096, 3925, 1, 1024, 4096, 4096, 1024, 1024]
    - [13, 19047.0]
  - - [1024, 3975, 1, 4096, 1024, 1024, 4096, 4096]
    - [32, 17319.0]
  - - [4096, 3549, 1, 1024, 4096, 4096, 1024, 1024]
    - [13, 19124.0]
  - - [4096, 3342, 1, 1024, 4096, 4096, 1024, 1024]
    - [13, 18776.0]
  - - [1024, 3859, 1, 1024, 1024, 1024, 1024, 1024]
    - [30, 17810.0]
  - - [1024, 3497, 1, 4096, 1024, 1024, 4096, 4096]
    - [13, 15824.0]
  - - [4096, 3280, 1, 1024, 4096, 4096, 1024, 1024]
    - [15, 18659.0]
  - - [1024, 3435, 1, 4096, 1024, 1024, 4096, 4096]
    - [31, 17084.0]
  - - [1024, 3354, 1, 4096, 1024, 1024, 4096, 4096]
    - [31, 16725.0]
  - - [4096, 3191, 1, 1024, 4096, 4096, 1024, 1024]
    - [13, 18804.0]
  - - [4096, 3512, 1, 1024, 4096, 4096, 1024, 1024]
    - [13, 18998.0]
  - - [1024, 3055, 1, 4096, 1024, 1024, 4096, 4096]
    - [32, 17530.0]
  - - [4096, 2499, 1, 1024, 4096, 4096, 1024, 1024]
    - [15, 18863.0]
  - - [1024, 3233, 1, 4096, 1024, 1024, 4096, 4096]
    - [32, 18571.0]
  - - [4096, 3423, 1, 1024, 4096, 4096, 1024, 1024]
    - [13, 19208.0]
  - - [1024, 3319, 1, 4096, 1024, 1024, 4096, 4096]
    - [51, 18983.0]
  - - [4096, 3297, 1, 1024, 4096, 4096, 1024, 1024]
    - [15, 18827.0]
  - - [4096, 3154, 1, 1024, 4096, 4096, 1024, 1024]
    - [13, 18600.0]
  - - [1024, 3540, 1, 4096, 1024, 1024, 4096, 4096]
    - [13, 16175.0]
  - - [1024, 3289, 1, 4096, 1024, 1024, 4096, 4096]
    - [32, 18865.0]
  - - [4096, 3529, 1, 1024, 4096, 4096, 1024, 1024]
    - [13, 19055.0]
  - - [4096, 3386, 1, 1024, 4096, 4096, 1024, 1024]
    - [13, 19022.0]
  - - [4096, 3276, 1, 1024, 4096, 4096, 1024, 1024]
    - [15, 18676.0]
  - - [1024, 3244, 1, 4096, 1024, 1024, 4096, 4096]
    - [32, 18599.0]
  - - [1024, 3182, 1, 4096, 1024, 1024, 4096, 4096]
    - [32, 18279.0]
  - - [4096, 3540, 1, 1024, 4096, 4096, 1024, 1024]
    - [13, 19103.0]
  - - [1024, 3360, 1, 4096, 1024, 1024, 4096, 4096]
    - [13, 16562.0]
  - - [1024, 3942, 1, 4096, 1024, 1024, 4096, 4096]
    - [13, 17559.0]
  - - [4096, 3403, 1, 1024, 4096, 4096, 1024, 1024]
    - [13, 19063.0]
  - - [4096, 3101, 1, 1024, 4096, 4096, 1024, 1024]
    - [13, 18310.0]
  - - [4096, 2918, 1, 1024, 4096, 4096, 1024, 1024]
    - [13, 18766.0]
  - - [1024, 3465, 1, 4096, 1024, 1024, 4096, 4096]
    - [13, 15054.0]
  - - [33708, 3780, 1, 1024, 33708, 33708, 1024, 1024]
    - [51, 19594.0]
  - - [4096, 3557, 1, 1024, 4096, 4096, 1024, 1024]
    - [13, 19182.0]
  - - [4096, 3414, 1, 1024, 4096, 4096, 1024, 1024]
    - [13, 19207.0]
  - - [1024, 3948, 1, 1024, 1024, 1024, 1024, 1024]
    - [30, 18179.0]
  - - [4096, 3320, 1, 1024, 4096, 4096, 1024, 1024]
    - [15, 18981.0]
  - - [4096, 2765, 1, 1024, 4096, 4096, 1024, 1024]
    - [15, 18813.0]
  - - [1024, 3978, 1, 4096, 1024, 1024, 4096, 4096]
    - [32, 17312.0]
  - - [4096, 3487, 1, 1024, 4096, 4096, 1024, 1024]
    - [13, 18801.0]
  - - [4096, 3520, 1, 1024, 4096, 4096, 1024, 1024]
    - [13, 19003.0]
  - - [1024, 3139, 1, 4096, 1024, 1024, 4096, 4096]
    - [51, 18041.0]
  - - [1024, 3314, 1, 4096, 1024, 1024, 4096, 4096]
    - [32, 18990.0]
  - - [4096, 3431, 1, 1024, 4096, 4096, 1024, 1024]
    - [13, 19188.0]
  - - [1024, 3446, 1, 4096, 1024, 1024, 4096, 4096]
    - [13, 17454.0]
  - - [1024, 4059, 1, 4096, 1024, 1024, 4096, 4096]
    - [32, 17664.0]
  - - [4096, 3345, 1, 1024, 4096, 4096, 1024, 1024]
    - [13, 18803.0]
  - - [4096, 3394, 1, 1024, 4096, 4096, 1024, 1024]
    - [13, 19066.0]
  - - [1024, 3927, 1, 1024, 1024, 1024, 1024, 1024]
    - [30, 18090.0]
  - - [4096, 3235, 1, 1024, 4096, 4096, 1024, 1024]
    - [15, 18495.0]
  - - [1024, 3328, 1, 4096, 1024, 1024, 4096, 4096]
    - [15, 19140.0]
  - - [33708, 3956, 1, 1024, 33708, 33708, 1024, 1024]
    - [49, 19638.0]
  - - [4096, 3467, 1, 1024, 4096, 4096, 1024, 1024]
    - [13, 18677.0]
  - - [1024, 3287, 1, 4096, 1024, 1024, 4096, 4096]
    - [51, 18818.0]
  - - [4096, 3214, 1, 1024, 4096, 4096, 1024, 1024]
    - [15, 18335.0]
  - - [4096, 3910, 1, 1024, 4096, 4096, 1024, 1024]
    - [13, 18990.0]
  - - [1024, 3780, 1, 1024, 1024, 1024, 1024, 1024]
    - [30, 17404.0]
  - - [1024, 3371, 1, 4096, 1024, 1024, 4096, 4096]
    - [14, 16754.0]
  - - [4096, 3478, 1, 1024, 4096, 4096, 1024, 1024]
    - [13, 18751.0]
  - - [1024, 3546, 1, 4096, 1024, 1024, 4096, 4096]
    - [13, 15669.0]
  - - [1024, 4012, 1, 1024, 1024, 1024, 1024, 1024]
    - [32, 16860.0]
  - - [4096, 3341, 1, 1024, 4096, 4096, 1024, 1024]
    - [13, 18732.0]
  - - [4096, 3454, 1, 1024, 4096, 4096, 1024, 1024]
    - [13, 19382.0]
  - - [4096, 3295, 1, 1024, 4096, 4096, 1024, 1024]
    - [15, 18811.0]
  - - [4096, 3072, 1, 1024, 4096, 4096, 1024, 1024]
    - [15, 19165.0]
  - - [1024, 3282, 1, 4096, 1024, 1024, 4096, 4096]
    - [15, 18788.0]
  - - [33708, 3720, 1, 1024, 33708, 33708, 1024, 1024]
    - [51, 19312.0]
  - - [1024, 3681, 1, 4096, 1024, 1024, 4096, 4096]
    - [13, 16772.0]
  - - [1024, 4050, 1, 4096, 1024, 1024, 4096, 4096]
    - [32, 17631.0]
  - - [4096, 3495, 1, 1024, 4096, 4096, 1024, 1024]
    - [13, 18888.0]
  - - [4096, 3560, 1, 1024, 4096, 4096, 1024, 1024]
    - [13, 19277.0]
  - - [4096, 3751, 1, 1024, 4096, 4096, 1024, 1024]
    - [13, 18866.0]
  - - [1024, 3414, 1, 4096, 1024, 1024, 4096, 4096]
    - [31, 17025.0]
  - - [33708, 3860, 1, 1024, 33708, 33708, 1024, 1024]
    - [49, 19192.0]
  - - [1024, 3325, 1, 4096, 1024, 1024, 4096, 4096]
    - [15, 18908.0]
  - - [4096, 3458, 1, 1024, 4096, 4096, 1024, 1024]
    - [13, 18637.0]
  - - [4096, 2967, 1, 1024, 4096, 4096, 1024, 1024]
    - [15, 18455.0]
  - - [1024, 3519, 1, 4096, 1024, 1024, 4096, 4096]
    - [13, 15932.0]
  - - [4096, 3385, 1, 1024, 4096, 4096, 1024, 1024]
    - [13, 18909.0]
  - - [4096, 3434, 1, 1024, 4096, 4096, 1024, 1024]
    - [13, 19284.0]
  - - [1024, 3552, 1, 4096, 1024, 1024, 4096, 4096]
    - [13, 16191.0]
  - - [4096, 3822, 1, 1024, 4096, 4096, 1024, 1024]
    - [13, 19142.0]
  - - [1024, 3544, 1, 4096, 1024, 1024, 4096, 4096]
    - [13, 16087.0]
  - - [4096, 3539, 1, 1024, 4096, 4096, 1024, 1024]
    - [13, 19043.0]
  - - [4096, 3332, 1, 1024, 4096, 4096, 1024, 1024]
    - [13, 18740.0]
  - - [1024, 3145, 1, 4096, 1024, 1024, 4096, 4096]
    - [51, 18073.0]
  - - [1024, 3535, 1, 4096, 1024, 1024, 4096, 4096]
    - [13, 16760.0]
  - - [1024, 3320, 1, 4096, 1024, 1024, 4096, 4096]
    - [32, 19018.0]
  - - [33708, 4012, 1, 1024, 33708, 33708, 1024, 1024]
    - [32, 19547.0]
  - - [4096, 3286, 1, 1024, 4096, 4096, 1024, 1024]
    - [15, 18700.0]
  - - [1024, 3514, 1, 4096, 1024, 1024, 4096, 4096]
    - [13, 15842.0]
  - - [1024, 2765, 1, 4096, 1024, 1024, 4096, 4096]
    - [13, 17590.0]
  - - [1024, 3452, 1, 4096, 1024, 1024, 4096, 4096]
    - [13, 17522.0]
  - - [4096, 3518, 1, 1024, 4096, 4096, 1024, 1024]
    - [13, 18955.0]
  - - [1024, 3529, 1, 4096, 1024, 1024, 4096, 4096]
    - [13, 15587.0]
  - - [4096, 3413, 1, 1024, 4096, 4096, 1024, 1024]
    - [13, 19071.0]
  - - [33708, 4050, 1, 1024, 33708, 33708, 1024, 1024]
    - [51, 19676.0]
  - - [1024, 3525, 1, 4096, 1024, 1024, 4096, 4096]
    - [30, 16672.0]
  - - [4096, 3303, 1, 1024, 4096, 4096, 1024, 1024]
    - [15, 18798.0]
  - - [1024, 3382, 1, 4096, 1024, 1024, 4096, 4096]
    - [30, 17613.0]
  - - [1024, 3390, 1, 4096, 1024, 1024, 4096, 4096]
    - [30, 17541.0]
  - - [1024, 3977, 1, 4096, 1024, 1024, 4096, 4096]
    - [32, 17335.0]
  - - [1024, 3184, 1, 4096, 1024, 1024, 4096, 4096]
    - [32, 18319.0]
  - - [4096, 3535, 1, 1024, 4096, 4096, 1024, 1024]
    - [13, 19076.0]
  - - [4096, 3376, 1, 1024, 4096, 4096, 1024, 1024]
    - [13, 18978.0]
  - - [4096, 3978, 1, 1024, 4096, 4096, 1024, 1024]
    - [13, 18710.0]
  - - [1024, 3136, 1, 4096, 1024, 1024, 4096, 4096]
    - [51, 18023.0]
  - - [1024, 3293, 1, 4096, 1024, 1024, 4096, 4096]
    - [32, 18877.0]
  - - [4096, 3266, 1, 1024, 4096, 4096, 1024, 1024]
    - [15, 18636.0]
  - - [1024, 3487, 1, 4096, 1024, 1024, 4096, 4096]
    - [13, 15670.0]
  - - [1024, 3409, 1, 4096, 1024, 1024, 4096, 4096]
    - [30, 16194.0]
  - - [4096, 3498, 1, 1024, 4096, 4096, 1024, 1024]
    - [13, 18871.0]
  - - [1024, 3520, 1, 4096, 1024, 1024, 4096, 4096]
    - [13, 16310.0]
  - - [1024, 3530, 1, 4096, 1024, 1024, 4096, 4096]
    - [14, 15247.0]
  - - [4096, 3393, 1, 1024, 4096, 4096, 1024, 1024]
    - [13, 19032.0]
  - - [4096, 3140, 1, 1024, 4096, 4096, 1024, 1024]
    - [13, 18542.0]
  - - [1024, 3536, 1, 4096, 1024, 1024, 4096, 4096]
    - [13, 15877.0]
  - - [1024, 3288, 1, 4096, 1024, 1024, 4096, 4096]
    - [15, 18833.0]
  - - [1024, 4005, 1, 4096, 1024, 1024, 4096, 4096]
    - [51, 17440.0]
  - - [1024, 3579, 1, 4096, 1024, 1024, 4096, 4096]
    - [13, 16402.0]
  - - [4096, 3372, 1, 1024, 4096, 4096, 1024, 1024]
    - [13, 19013.0]
  - - [1024, 3440, 1, 4096, 1024, 1024, 4096, 4096]
    - [30, 18800.0]
  - - [4096, 3213, 1, 1024, 4096, 4096, 1024, 1024]
    - [15, 18339.0]
  - - [4096, 3477, 1, 1024, 4096, 4096, 1024, 1024]
    - [13, 18792.0]
  - - [4096, 3526, 1, 1024, 4096, 4096, 1024, 1024]
    - [13, 19053.0]
  - - [1024, 3493, 1, 4096, 1024, 1024, 4096, 4096]
    - [13, 16181.0]
  - - [1024, 3944, 1, 4096, 1024, 1024, 4096, 4096]
    - [13, 18224.0]
  - - [4096, 3453, 1, 1024, 4096, 4096, 1024, 1024]
    - [13, 19393.0]
  - - [1024, 3350, 1, 4096, 1024, 1024, 4096, 4096]
    - [13, 17450.0]
  - - [4096, 3184, 1, 1024, 4096, 4096, 1024, 1024]
    - [13, 18806.0]
  - - [1024, 3423, 1, 4096, 1024, 1024, 4096, 4096]
    - [13, 17247.0]
  - - [4096, 3351, 1, 1024, 4096, 4096, 1024, 1024]
    - [13, 18814.0]
  - - [4096, 3416, 1, 1024, 4096, 4096, 1024, 1024]
    - [13, 19196.0]
  - - [1024, 3796, 1, 4096, 1024, 1024, 4096, 4096]
    - [30, 16622.0]
  - - [4096, 3257, 1, 1024, 4096, 4096, 1024, 1024]
    - [15, 18592.0]
  - - [4096, 3306, 1, 1024, 4096, 4096, 1024, 1024]
    - [15, 18903.0]
  - - [33708, 4020, 1, 1024, 33708, 33708, 1024, 1024]
    - [51, 19518.0]
  - - [1024, 3426, 1, 4096, 1024, 1024, 4096, 4096]
    - [30, 17365.0]
  - - [4096, 3457, 1, 1024, 4096, 4096, 1024, 1024]
    - [13, 18648.0]
  - - [1024, 2935, 1, 4096, 1024, 1024, 4096, 4096]
    - [51, 16882.0]
  - - [1024, 3046, 1, 4096, 1024, 1024, 4096, 4096]
    - [15, 17519.0]
  - - [4096, 3433, 1, 1024, 4096, 4096, 1024, 1024]
    - [13, 19265.0]
  - - [1024, 3256, 1, 4096, 1024, 1024, 4096, 4096]
    - [51, 18656.0]
  - - [1024, 3531, 1, 4096, 1024, 1024, 4096, 4096]
    - [13, 16530.0]
  - - [4096, 3180, 1, 1024, 4096, 4096, 1024, 1024]
    - [13, 18732.0]
  - - [1024, 3388, 1, 4096, 1024, 1024, 4096, 4096]
    - [13, 18392.0]
  - - [4096, 3444, 1, 1024, 4096, 4096, 1024, 1024]
    - [13, 19310.0]
  - - [1024, 3501, 1, 4096, 1024, 1024, 4096, 4096]
    - [30, 15427.0]
  - - [1024, 3266, 1, 4096, 1024, 1024, 4096, 4096]
    - [32, 18744.0]
  - - [1024, 3267, 1, 4096, 1024, 1024, 4096, 4096]
    - [32, 18731.0]
  - - [1024, 3461, 1, 4096, 1024, 1024, 4096, 4096]
    - [13, 15908.0]
  - - [4096, 3870, 1, 1024, 4096, 4096, 1024, 1024]
    - [13, 18762.0]
  - - [4096, 3517, 1, 1024, 4096, 4096, 1024, 1024]
    - [13, 19035.0]
  - - [1024, 3566, 1, 4096, 1024, 1024, 4096, 4096]
    - [30, 16109.0]
  - - [4096, 3574, 1, 1024, 4096, 4096, 1024, 1024]
    - [13, 19266.0]
  - - [1024, 3876, 1, 1024, 1024, 1024, 1024, 1024]
    - [30, 17829.0]
  - - [4096, 3720, 1, 1024, 4096, 4096, 1024, 1024]
    - [13, 18674.0]
  - - [4096, 3248, 1, 1024, 4096, 4096, 1024, 1024]
    - [15, 18599.0]
  - - [4096, 4059, 1, 1024, 4096, 4096, 1024, 1024]
    - [13, 19036.0]
  - - [1024, 3380, 1, 4096, 1024, 1024, 4096, 4096]
    - [30, 15791.0]
  - - [4096, 3480, 1, 1024, 4096, 4096, 1024, 1024]
    - [13, 18804.0]
  - - [1024, 3335, 1, 4096, 1024, 1024, 4096, 4096]
    - [31, 16692.0]
  - - [1024, 3345, 1, 4096, 1024, 1024, 4096, 4096]
    - [13, 18194.0]
  - - [4096, 3391, 1, 1024, 4096, 4096, 1024, 1024]
    - [13, 19061.0]
  - - [4096, 3424, 1, 1024, 4096, 4096, 1024, 1024]
    - [13, 19218.0]
  - - [1024, 3394, 1, 4096, 1024, 1024, 4096, 4096]
    - [13, 18533.0]
  - - [4096, 3265, 1, 1024, 4096, 4096, 1024, 1024]
    - [15, 18651.0]
  - - [1024, 3014, 1, 4096, 1024, 1024, 4096, 4096]
    - [15, 17336.0]
  - - [4096, 3497, 1, 1024, 4096, 4096, 1024, 1024]
    - [13, 18856.0]
  - - [4096, 3354, 1, 1024, 4096, 4096, 1024, 1024]
    - [13, 18873.0]
  - - [4096, 3055, 1, 1024, 4096, 4096, 1024, 1024]
    - [15, 18970.0]
  - - [1024, 3499, 1, 4096, 1024, 1024, 4096, 4096]
    - [13, 16484.0]
  - - [1024, 3162, 1, 4096, 1024, 1024, 4096, 4096]
    - [32, 18174.0]
  - - [4096, 3244, 1, 1024, 4096, 4096, 1024, 1024]
    - [15, 18526.0]
  - - [1024, 3437, 1, 4096, 1024, 1024, 4096, 4096]
    - [31, 17076.0]
  - - [1024, 3356, 1, 4096, 1024, 1024, 4096, 4096]
    - [31, 16555.0]
  - - [4096, 3139, 1, 1024, 4096, 4096, 1024, 1024]
    - [13, 18490.0]
  - - [4096, 3508, 1, 1024, 4096, 4096, 1024, 1024]
    - [13, 18948.0]
  - - [1024, 3235, 1, 4096, 1024, 1024, 4096, 4096]
    - [32, 18532.0]
  - - [1024, 3910, 1, 4096, 1024, 1024, 4096, 4096]
    - [32, 17052.0]
  - - [4096, 3371, 1, 1024, 4096, 4096, 1024, 1024]
    - [13, 18900.0]
  - - [1024, 3751, 1, 4096, 1024, 1024, 4096, 4096]
    - [13, 16408.0]
  - - [4096, 3325, 1, 1024, 4096, 4096, 1024, 1024]
    - [15, 18934.0]
  - - [1024, 3413, 1, 4096, 1024, 1024, 4096, 4096]
    - [13, 16954.0]
  - - [1024, 3542, 1, 4096, 1024, 1024, 4096, 4096]
    - [30, 15357.0]
  - - [33708, 3900, 1, 1024, 33708, 33708, 1024, 1024]
    - [30, 19335.0]
  - - [4096, 3525, 1, 1024, 4096, 4096, 1024, 1024]
    - [13, 18998.0]
  - - [4096, 3382, 1, 1024, 4096, 4096, 1024, 1024]
    - [13, 18949.0]
  - - [1024, 3339, 1, 4096, 1024, 1024, 4096, 4096]
    - [14, 16586.0]
  - - [4096, 3288, 1, 1024, 4096, 4096, 1024, 1024]
    - [15, 18748.0]
  - - [1024, 3141, 1, 4096, 1024, 1024, 4096, 4096]
    - [15, 18032.0]
  - - [1024, 3168, 1, 4096, 1024, 1024, 4096, 4096]
    - [51, 18196.0]
  - - [4096, 3488, 1, 1024, 4096, 4096, 1024, 1024]
    - [13, 18779.0]
  - - [4096, 3046, 1, 1024, 4096, 4096, 1024, 1024]
    - [15, 18863.0]
  - - [1024, 3362, 1, 4096, 1024, 1024, 4096, 4096]
    - [13, 17007.0]
  - - [33708, 3942, 1, 1024, 33708, 33708, 1024, 1024]
    - [49, 19575.0]
  - - [4096, 3399, 1, 1024, 4096, 4096, 1024, 1024]
    - [13, 19051.0]
  - - [1024, 3720, 1, 1024, 1024, 1024, 1024, 1024]
    - [30, 17138.0]
  - - [4096, 3563, 1, 1024, 4096, 4096, 1024, 1024]
    - [13, 19293.0]
  - - [1024, 3273, 1, 4096, 1024, 1024, 4096, 4096]
    - [51, 18748.0]
  - - [4096, 3162, 1, 1024, 4096, 4096, 1024, 1024]
    - [13, 18662.0]
  - - [1024, 3467, 1, 4096, 1024, 1024, 4096, 4096]
    - [30, 16400.0]
  - - [1024, 3130, 1, 4096, 1024, 1024, 4096, 4096]
    - [15, 17991.0]
  - - [1024, 3405, 1, 4096, 1024, 1024, 4096, 4096]
    - [30, 17277.0]
  - - [4096, 3362, 1, 1024, 4096, 4096, 1024, 1024]
    - [13, 18928.0]
  - - [1024, 3960, 1, 1024, 1024, 1024, 1024, 1024]
    - [30, 18236.0]
  - - [1024, 3712, 1, 36548, 1024, 1024, 36548, 36548]
    - [1, 18114.0]
  - - [1024, 3712, 1, 1024, 1024, 1024, 1024, 1024]
    - [30, 17188.0]
  - - [4032, 384, 1, 64, 4032, 4032, 64, 64]
    - [0, 10564.0]
  - - [1024, 2048, 1, 49, 1024, 1024, 49, 49]
    - [8, 11317.0]
  - - [4608, 512, 1, 49, 4608, 4608, 49, 49]
    - [36, 11514.0]
  - - [9216, 512, 1, 4096, 9216, 9216, 4096, 4096]
    - [32, 18389.0]
  - - [3456, 384, 1, 289, 3456, 3456, 289, 289]
    - [36, 14100.0]
  - - [3456, 384, 1, 169, 3456, 3456, 169, 169]
    - [36, 13626.0]
  - - [4096, 512, 1, 1001, 4096, 4096, 1001, 1001]
    - [7, 16899.0]
  - - [384, 448, 49, 512, 384, 384, 512, 512]
    - [49, 16030.0]
  - - [384, 448, 64, 256, 384, 384, 256, 256]
    - [13, 15753.0]
  - - [384, 448, 36, 256, 384, 384, 256, 256]
    - [12, 15230.0]
  - - [384, 448, 49, 256, 384, 384, 256, 256]
    - [29, 15637.0]
  - - [384, 448, 64, 512, 384, 384, 512, 512]
    - [49, 16160.0]
  - - [384, 448, 36, 512, 384, 384, 512, 512]
    - [13, 16209.0]
  - - [1024, 6400, 1, 65, 1024, 1024, 65, 65]
    - [0, 15558.0]
  - - [4096, 6400, 1, 256, 4096, 4096, 256, 256]
    - [13, 19075.0]
  - - [512, 3194, 1, 2048, 512, 512, 2048, 2048]
    - [49, 15825.0]
  - - [512, 3222, 1, 2048, 512, 512, 2048, 2048]
    - [30, 16412.0]
  - - [512, 3234, 1, 2048, 512, 512, 2048, 2048]
    - [30, 16466.0]
  - - [512, 3242, 1, 2048, 512, 512, 2048, 2048]
    - [30, 16475.0]
  - - [512, 3257, 1, 2048, 512, 512, 2048, 2048]
    - [30, 16598.0]
  - - [512, 3332, 1, 2048, 512, 512, 2048, 2048]
    - [31, 16389.0]
  - - [512, 3336, 1, 2048, 512, 512, 2048, 2048]
    - [14, 16430.0]
  - - [512, 3378, 1, 2048, 512, 512, 2048, 2048]
    - [50, 16556.0]
  - - [512, 3396, 1, 2048, 512, 512, 2048, 2048]
    - [50, 16668.0]
  - - [512, 3399, 1, 2048, 512, 512, 2048, 2048]
    - [31, 16686.0]
  - - [512, 3451, 1, 2048, 512, 512, 2048, 2048]
    - [31, 16908.0]
  - - [512, 3456, 1, 2048, 512, 512, 2048, 2048]
    - [31, 17036.0]
  - - [512, 3458, 1, 2048, 512, 512, 2048, 2048]
    - [51, 14601.0]
  - - [512, 3467, 1, 2048, 512, 512, 2048, 2048]
    - [32, 14631.0]
  - - [512, 3468, 1, 2048, 512, 512, 2048, 2048]
    - [51, 14624.0]
  - - [512, 3470, 1, 2048, 512, 512, 2048, 2048]
    - [15, 14646.0]
  - - [512, 3477, 1, 2048, 512, 512, 2048, 2048]
    - [15, 14686.0]
  - - [512, 3478, 1, 2048, 512, 512, 2048, 2048]
    - [15, 14669.0]
  - - [512, 3495, 1, 2048, 512, 512, 2048, 2048]
    - [15, 14754.0]
  - - [512, 3507, 1, 2048, 512, 512, 2048, 2048]
    - [15, 14799.0]
  - - [512, 3515, 1, 2048, 512, 512, 2048, 2048]
    - [15, 14830.0]
  - - [512, 3517, 1, 2048, 512, 512, 2048, 2048]
    - [51, 14834.0]
  - - [2048, 2864, 1, 512, 2048, 2048, 512, 512]
    - [13, 16953.0]
  - - [2048, 3287, 1, 512, 2048, 2048, 512, 512]
    - [13, 17842.0]
  - - [2048, 3412, 1, 512, 2048, 2048, 512, 512]
    - [30, 18455.0]
  - - [2048, 3456, 1, 512, 2048, 2048, 512, 512]
    - [13, 18910.0]
  - - [2048, 3466, 1, 512, 2048, 2048, 512, 512]
    - [30, 17610.0]
  - - [2048, 3476, 1, 512, 2048, 2048, 512, 512]
    - [30, 17637.0]
  - - [2048, 3999, 1, 512, 2048, 2048, 512, 512]
    - [30, 17833.0]
  - - [33708, 189, 1, 512, 33708, 33708, 512, 512]
    - [29, 15589.0]
  - - [33708, 2496, 1, 512, 33708, 33708, 512, 512]
    - [13, 19163.0]
  - - [33708, 3864, 1, 512, 33708, 33708, 512, 512]
    - [13, 19245.0]
  - - [33708, 3969, 1, 512, 33708, 33708, 512, 512]
    - [13, 19153.0]
  - - [33708, 3995, 1, 512, 33708, 33708, 512, 512]
    - [13, 19264.0]
  - - [134, 134, 240, 64, 134, 134, 64, 64]
    - [17, 5998.0]
  - - [135, 134, 240, 64, 135, 135, 64, 64]
    - [36, 6137.0]
  - - [135, 135, 240, 64, 135, 135, 64, 64]
    - [25, 6134.0]
  - - [512, 2790, 1, 2048, 512, 512, 2048, 2048]
    - [48, 14746.0]
  - - [512, 2864, 1, 2048, 512, 512, 2048, 2048]
    - [30, 14644.0]
  - - [512, 3092, 1, 2048, 512, 512, 2048, 2048]
    - [13, 15777.0]
  - - [512, 3113, 1, 2048, 512, 512, 2048, 2048]
    - [30, 15853.0]
  - - [512, 3137, 1, 2048, 512, 512, 2048, 2048]
    - [13, 15977.0]
  - - [512, 3165, 1, 2048, 512, 512, 2048, 2048]
    - [13, 16106.0]
  - - [512, 3166, 1, 2048, 512, 512, 2048, 2048]
    - [49, 16108.0]
  - - [512, 3219, 1, 2048, 512, 512, 2048, 2048]
    - [13, 16412.0]
  - - [512, 3237, 1, 2048, 512, 512, 2048, 2048]
    - [49, 16472.0]
  - - [512, 3246, 1, 2048, 512, 512, 2048, 2048]
    - [13, 16484.0]
  - - [512, 3249, 1, 2048, 512, 512, 2048, 2048]
    - [30, 16552.0]
  - - [512, 3251, 1, 2048, 512, 512, 2048, 2048]
    - [49, 16611.0]
  - - [512, 3262, 1, 2048, 512, 512, 2048, 2048]
    - [30, 16627.0]
  - - [512, 3268, 1, 2048, 512, 512, 2048, 2048]
    - [13, 16659.0]
  - - [512, 3282, 1, 2048, 512, 512, 2048, 2048]
    - [13, 16693.0]
  - - [512, 3286, 1, 2048, 512, 512, 2048, 2048]
    - [30, 16778.0]
  - - [512, 3287, 1, 2048, 512, 512, 2048, 2048]
    - [30, 16741.0]
  - - [512, 3293, 1, 2048, 512, 512, 2048, 2048]
    - [30, 16775.0]
  - - [512, 3297, 1, 2048, 512, 512, 2048, 2048]
    - [30, 16766.0]
  - - [512, 3307, 1, 2048, 512, 512, 2048, 2048]
    - [13, 16840.0]
  - - [512, 3314, 1, 2048, 512, 512, 2048, 2048]
    - [49, 16851.0]
  - - [512, 3315, 1, 2048, 512, 512, 2048, 2048]
    - [49, 16856.0]
  - - [512, 3319, 1, 2048, 512, 512, 2048, 2048]
    - [30, 16857.0]
  - - [512, 3322, 1, 2048, 512, 512, 2048, 2048]
    - [49, 16969.0]
  - - [512, 3323, 1, 2048, 512, 512, 2048, 2048]
    - [30, 16918.0]
  - - [512, 3324, 1, 2048, 512, 512, 2048, 2048]
    - [49, 16887.0]
  - - [512, 3325, 1, 2048, 512, 512, 2048, 2048]
    - [49, 16915.0]
  - - [512, 3327, 1, 2048, 512, 512, 2048, 2048]
    - [49, 16943.0]
  - - [512, 3329, 1, 2048, 512, 512, 2048, 2048]
    - [31, 16384.0]
  - - [512, 3339, 1, 2048, 512, 512, 2048, 2048]
    - [50, 16413.0]
  - - [512, 3342, 1, 2048, 512, 512, 2048, 2048]
    - [31, 16438.0]
  - - [512, 3344, 1, 2048, 512, 512, 2048, 2048]
    - [50, 16451.0]
  - - [512, 3358, 1, 2048, 512, 512, 2048, 2048]
    - [14, 16543.0]
  - - [512, 3360, 1, 2048, 512, 512, 2048, 2048]
    - [50, 16560.0]
  - - [512, 3364, 1, 2048, 512, 512, 2048, 2048]
    - [31, 16542.0]
  - - [512, 3365, 1, 2048, 512, 512, 2048, 2048]
    - [31, 16552.0]
  - - [512, 3369, 1, 2048, 512, 512, 2048, 2048]
    - [50, 16576.0]
  - - [512, 3371, 1, 2048, 512, 512, 2048, 2048]
    - [50, 16606.0]
  - - [512, 3374, 1, 2048, 512, 512, 2048, 2048]
    - [31, 16571.0]
  - - [512, 3376, 1, 2048, 512, 512, 2048, 2048]
    - [31, 16621.0]
  - - [512, 3377, 1, 2048, 512, 512, 2048, 2048]
    - [50, 16570.0]
  - - [512, 3381, 1, 2048, 512, 512, 2048, 2048]
    - [50, 16636.0]
  - - [512, 3382, 1, 2048, 512, 512, 2048, 2048]
    - [31, 16652.0]
  - - [512, 3383, 1, 2048, 512, 512, 2048, 2048]
    - [31, 16634.0]
  - - [512, 3384, 1, 2048, 512, 512, 2048, 2048]
    - [31, 16661.0]
  - - [512, 3385, 1, 2048, 512, 512, 2048, 2048]
    - [50, 16653.0]
  - - [512, 3386, 1, 2048, 512, 512, 2048, 2048]
    - [50, 16636.0]
  - - [512, 3388, 1, 2048, 512, 512, 2048, 2048]
    - [50, 16663.0]
  - - [512, 3390, 1, 2048, 512, 512, 2048, 2048]
    - [50, 16665.0]
  - - [512, 3391, 1, 2048, 512, 512, 2048, 2048]
    - [31, 16701.0]
  - - [512, 3402, 1, 2048, 512, 512, 2048, 2048]
    - [31, 16710.0]
  - - [512, 3410, 1, 2048, 512, 512, 2048, 2048]
    - [31, 16760.0]
  - - [512, 3412, 1, 2048, 512, 512, 2048, 2048]
    - [14, 16759.0]
  - - [512, 3414, 1, 2048, 512, 512, 2048, 2048]
    - [50, 16775.0]
  - - [512, 3415, 1, 2048, 512, 512, 2048, 2048]
    - [50, 16790.0]
  - - [512, 3418, 1, 2048, 512, 512, 2048, 2048]
    - [14, 16792.0]
  - - [512, 3420, 1, 2048, 512, 512, 2048, 2048]
    - [14, 16795.0]
  - - [512, 3422, 1, 2048, 512, 512, 2048, 2048]
    - [50, 16829.0]
  - - [512, 3425, 1, 2048, 512, 512, 2048, 2048]
    - [31, 16832.0]
  - - [512, 3426, 1, 2048, 512, 512, 2048, 2048]
    - [31, 16812.0]
  - - [512, 3427, 1, 2048, 512, 512, 2048, 2048]
    - [31, 16800.0]
  - - [512, 3428, 1, 2048, 512, 512, 2048, 2048]
    - [50, 16816.0]
  - - [512, 3430, 1, 2048, 512, 512, 2048, 2048]
    - [14, 16846.0]
  - - [512, 3431, 1, 2048, 512, 512, 2048, 2048]
    - [50, 16810.0]
  - - [512, 3432, 1, 2048, 512, 512, 2048, 2048]
    - [50, 16846.0]
  - - [512, 3438, 1, 2048, 512, 512, 2048, 2048]
    - [50, 16858.0]
  - - [512, 3439, 1, 2048, 512, 512, 2048, 2048]
    - [50, 16889.0]
  - - [512, 3440, 1, 2048, 512, 512, 2048, 2048]
    - [31, 16878.0]
  - - [512, 3443, 1, 2048, 512, 512, 2048, 2048]
    - [31, 16905.0]
  - - [512, 3445, 1, 2048, 512, 512, 2048, 2048]
    - [31, 16886.0]
  - - [512, 3447, 1, 2048, 512, 512, 2048, 2048]
    - [31, 16917.0]
  - - [512, 3448, 1, 2048, 512, 512, 2048, 2048]
    - [31, 16928.0]
  - - [512, 3450, 1, 2048, 512, 512, 2048, 2048]
    - [50, 16938.0]
  - - [512, 3452, 1, 2048, 512, 512, 2048, 2048]
    - [31, 16929.0]
  - - [512, 3453, 1, 2048, 512, 512, 2048, 2048]
    - [31, 16956.0]
  - - [512, 3455, 1, 2048, 512, 512, 2048, 2048]
    - [31, 16954.0]
  - - [512, 3457, 1, 2048, 512, 512, 2048, 2048]
    - [15, 14580.0]
  - - [512, 3459, 1, 2048, 512, 512, 2048, 2048]
    - [15, 14612.0]
  - - [512, 3460, 1, 2048, 512, 512, 2048, 2048]
    - [51, 14614.0]
  - - [512, 3461, 1, 2048, 512, 512, 2048, 2048]
    - [15, 14605.0]
  - - [512, 3462, 1, 2048, 512, 512, 2048, 2048]
    - [51, 14617.0]
  - - [512, 3466, 1, 2048, 512, 512, 2048, 2048]
    - [32, 14632.0]
  - - [512, 3471, 1, 2048, 512, 512, 2048, 2048]
    - [51, 14623.0]
  - - [512, 3472, 1, 2048, 512, 512, 2048, 2048]
    - [32, 14627.0]
  - - [512, 3475, 1, 2048, 512, 512, 2048, 2048]
    - [15, 14681.0]
  - - [512, 3476, 1, 2048, 512, 512, 2048, 2048]
    - [15, 14656.0]
  - - [512, 3479, 1, 2048, 512, 512, 2048, 2048]
    - [51, 14684.0]
  - - [512, 3480, 1, 2048, 512, 512, 2048, 2048]
    - [51, 14677.0]
  - - [512, 3481, 1, 2048, 512, 512, 2048, 2048]
    - [51, 14687.0]
  - - [512, 3483, 1, 2048, 512, 512, 2048, 2048]
    - [51, 14716.0]
  - - [512, 3484, 1, 2048, 512, 512, 2048, 2048]
    - [32, 14695.0]
  - - [512, 3487, 1, 2048, 512, 512, 2048, 2048]
    - [51, 14710.0]
  - - [512, 3489, 1, 2048, 512, 512, 2048, 2048]
    - [15, 14720.0]
  - - [512, 3490, 1, 2048, 512, 512, 2048, 2048]
    - [51, 14710.0]
  - - [512, 3491, 1, 2048, 512, 512, 2048, 2048]
    - [15, 14739.0]
  - - [512, 3493, 1, 2048, 512, 512, 2048, 2048]
    - [51, 14757.0]
  - - [512, 3494, 1, 2048, 512, 512, 2048, 2048]
    - [51, 14734.0]
  - - [512, 3497, 1, 2048, 512, 512, 2048, 2048]
    - [15, 14766.0]
  - - [512, 3498, 1, 2048, 512, 512, 2048, 2048]
    - [51, 14747.0]
  - - [512, 3499, 1, 2048, 512, 512, 2048, 2048]
    - [51, 14769.0]
  - - [512, 3501, 1, 2048, 512, 512, 2048, 2048]
    - [51, 14769.0]
  - - [512, 3503, 1, 2048, 512, 512, 2048, 2048]
    - [51, 14765.0]
  - - [512, 3508, 1, 2048, 512, 512, 2048, 2048]
    - [15, 14798.0]
  - - [512, 3509, 1, 2048, 512, 512, 2048, 2048]
    - [15, 14777.0]
  - - [512, 3511, 1, 2048, 512, 512, 2048, 2048]
    - [51, 14796.0]
  - - [512, 3514, 1, 2048, 512, 512, 2048, 2048]
    - [15, 14841.0]
  - - [512, 3518, 1, 2048, 512, 512, 2048, 2048]
    - [15, 14860.0]
  - - [512, 3519, 1, 2048, 512, 512, 2048, 2048]
    - [15, 14857.0]
  - - [512, 3520, 1, 2048, 512, 512, 2048, 2048]
    - [15, 14872.0]
  - - [512, 3523, 1, 2048, 512, 512, 2048, 2048]
    - [15, 14874.0]
  - - [512, 3528, 1, 2048, 512, 512, 2048, 2048]
    - [15, 14858.0]
  - - [512, 3529, 1, 2048, 512, 512, 2048, 2048]
    - [15, 14860.0]
  - - [512, 3530, 1, 2048, 512, 512, 2048, 2048]
    - [15, 14890.0]
  - - [512, 3532, 1, 2048, 512, 512, 2048, 2048]
    - [51, 14934.0]
  - - [512, 3533, 1, 2048, 512, 512, 2048, 2048]
    - [15, 14912.0]
  - - [512, 3534, 1, 2048, 512, 512, 2048, 2048]
    - [15, 14909.0]
  - - [512, 3538, 1, 2048, 512, 512, 2048, 2048]
    - [15, 14934.0]
  - - [512, 3539, 1, 2048, 512, 512, 2048, 2048]
    - [32, 14931.0]
  - - [512, 3541, 1, 2048, 512, 512, 2048, 2048]
    - [15, 14921.0]
  - - [512, 3547, 1, 2048, 512, 512, 2048, 2048]
    - [15, 14956.0]
  - - [512, 3548, 1, 2048, 512, 512, 2048, 2048]
    - [15, 14944.0]
  - - [512, 3552, 1, 2048, 512, 512, 2048, 2048]
    - [15, 14978.0]
  - - [512, 3564, 1, 2048, 512, 512, 2048, 2048]
    - [15, 15025.0]
  - - [512, 3575, 1, 2048, 512, 512, 2048, 2048]
    - [15, 15038.0]
  - - [512, 3598, 1, 2048, 512, 512, 2048, 2048]
    - [51, 15161.0]
  - - [512, 3599, 1, 2048, 512, 512, 2048, 2048]
    - [32, 15179.0]
  - - [512, 3608, 1, 2048, 512, 512, 2048, 2048]
    - [51, 15210.0]
  - - [512, 3780, 1, 512, 512, 512, 512, 512]
    - [15, 14667.0]
  - - [512, 3780, 1, 2048, 512, 512, 2048, 2048]
    - [32, 15955.0]
  - - [512, 3796, 1, 512, 512, 512, 512, 512]
    - [15, 14634.0]
  - - [512, 3796, 1, 2048, 512, 512, 2048, 2048]
    - [51, 15969.0]
  - - [512, 3822, 1, 512, 512, 512, 512, 512]
    - [15, 14751.0]
  - - [512, 3822, 1, 2048, 512, 512, 2048, 2048]
    - [15, 16103.0]
  - - [512, 3840, 1, 512, 512, 512, 512, 512]
    - [32, 15530.0]
  - - [512, 3840, 1, 2048, 512, 512, 2048, 2048]
    - [32, 16353.0]
  - - [512, 3859, 1, 512, 512, 512, 512, 512]
    - [11, 15076.0]
  - - [512, 3859, 1, 2048, 512, 512, 2048, 2048]
    - [15, 16226.0]
  - - [512, 3870, 1, 512, 512, 512, 512, 512]
    - [11, 15065.0]
  - - [512, 3870, 1, 2048, 512, 512, 2048, 2048]
    - [51, 16289.0]
  - - [512, 3876, 1, 512, 512, 512, 512, 512]
    - [11, 15143.0]
  - - [512, 3876, 1, 2048, 512, 512, 2048, 2048]
    - [32, 16312.0]
  - - [512, 3906, 1, 512, 512, 512, 512, 512]
    - [28, 15169.0]
  - - [512, 3906, 1, 2048, 512, 512, 2048, 2048]
    - [15, 16416.0]
  - - [512, 3910, 1, 512, 512, 512, 512, 512]
    - [15, 15127.0]
  - - [512, 3910, 1, 2048, 512, 512, 2048, 2048]
    - [15, 16431.0]
  - - [512, 3925, 1, 512, 512, 512, 512, 512]
    - [11, 15216.0]
  - - [512, 3925, 1, 2048, 512, 512, 2048, 2048]
    - [15, 16490.0]
  - - [512, 3927, 1, 512, 512, 512, 512, 512]
    - [51, 15228.0]
  - - [512, 3942, 1, 512, 512, 512, 512, 512]
    - [11, 15192.0]
  - - [512, 3942, 1, 2048, 512, 512, 2048, 2048]
    - [32, 16575.0]
  - - [512, 3944, 1, 512, 512, 512, 512, 512]
    - [11, 15285.0]
  - - [512, 3944, 1, 2048, 512, 512, 2048, 2048]
    - [15, 16581.0]
  - - [512, 3955, 1, 512, 512, 512, 512, 512]
    - [51, 15247.0]
  - - [512, 3955, 1, 2048, 512, 512, 2048, 2048]
    - [32, 16643.0]
  - - [512, 3968, 1, 512, 512, 512, 512, 512]
    - [26, 15558.0]
  - - [512, 3968, 1, 2048, 512, 512, 2048, 2048]
    - [51, 16686.0]
  - - [512, 3969, 1, 512, 512, 512, 512, 512]
    - [11, 15373.0]
  - - [512, 3969, 1, 2048, 512, 512, 2048, 2048]
    - [15, 16667.0]
  - - [512, 3976, 1, 512, 512, 512, 512, 512]
    - [11, 15409.0]
  - - [512, 3976, 1, 2048, 512, 512, 2048, 2048]
    - [15, 16697.0]
  - - [512, 3977, 1, 512, 512, 512, 512, 512]
    - [11, 15436.0]
  - - [512, 3977, 1, 2048, 512, 512, 2048, 2048]
    - [15, 16711.0]
  - - [512, 3978, 1, 512, 512, 512, 512, 512]
    - [15, 15344.0]
  - - [512, 3978, 1, 2048, 512, 512, 2048, 2048]
    - [15, 16698.0]
  - - [512, 3990, 1, 512, 512, 512, 512, 512]
    - [51, 15386.0]
  - - [512, 3990, 1, 2048, 512, 512, 2048, 2048]
    - [15, 16774.0]
  - - [512, 3995, 1, 512, 512, 512, 512, 512]
    - [32, 15356.0]
  - - [512, 3995, 1, 2048, 512, 512, 2048, 2048]
    - [15, 16799.0]
  - - [512, 3996, 1, 512, 512, 512, 512, 512]
    - [51, 15396.0]
  - - [512, 3996, 1, 2048, 512, 512, 2048, 2048]
    - [51, 16791.0]
  - - [512, 3999, 1, 512, 512, 512, 512, 512]
    - [11, 15554.0]
  - - [512, 3999, 1, 2048, 512, 512, 2048, 2048]
    - [15, 16774.0]
  - - [512, 4005, 1, 512, 512, 512, 512, 512]
    - [51, 15453.0]
  - - [512, 4005, 1, 2048, 512, 512, 2048, 2048]
    - [15, 16796.0]
  - - [512, 4012, 1, 512, 512, 512, 512, 512]
    - [51, 15439.0]
  - - [512, 4012, 1, 2048, 512, 512, 2048, 2048]
    - [15, 16856.0]
  - - [512, 4020, 1, 512, 512, 512, 512, 512]
    - [26, 15497.0]
  - - [512, 4020, 1, 2048, 512, 512, 2048, 2048]
    - [51, 16873.0]
  - - [512, 4026, 1, 512, 512, 512, 512, 512]
    - [11, 15548.0]
  - - [512, 4026, 1, 2048, 512, 512, 2048, 2048]
    - [15, 16912.0]
  - - [512, 4030, 1, 512, 512, 512, 512, 512]
    - [11, 15563.0]
  - - [512, 4030, 1, 2048, 512, 512, 2048, 2048]
    - [15, 16944.0]
  - - [512, 4032, 1, 512, 512, 512, 512, 512]
    - [28, 15521.0]
  - - [512, 4032, 1, 2048, 512, 512, 2048, 2048]
    - [15, 16929.0]
  - - [512, 4050, 1, 512, 512, 512, 512, 512]
    - [51, 15627.0]
  - - [512, 4059, 1, 512, 512, 512, 512, 512]
    - [15, 15606.0]
  - - [2048, 2790, 1, 512, 2048, 2048, 512, 512]
    - [13, 17913.0]
  - - [2048, 3092, 1, 512, 2048, 2048, 512, 512]
    - [15, 16929.0]
  - - [2048, 3113, 1, 512, 2048, 2048, 512, 512]
    - [30, 17106.0]
  - - [2048, 3137, 1, 512, 2048, 2048, 512, 512]
    - [13, 17235.0]
  - - [2048, 3165, 1, 512, 2048, 2048, 512, 512]
    - [30, 17334.0]
  - - [2048, 3166, 1, 512, 2048, 2048, 512, 512]
    - [30, 17385.0]
  - - [2048, 3194, 1, 512, 2048, 2048, 512, 512]
    - [30, 17511.0]
  - - [2048, 3219, 1, 512, 2048, 2048, 512, 512]
    - [30, 17476.0]
  - - [2048, 3222, 1, 512, 2048, 2048, 512, 512]
    - [30, 17513.0]
  - - [2048, 3234, 1, 512, 2048, 2048, 512, 512]
    - [15, 17565.0]
  - - [2048, 3237, 1, 512, 2048, 2048, 512, 512]
    - [30, 17656.0]
  - - [2048, 3242, 1, 512, 2048, 2048, 512, 512]
    - [30, 17676.0]
  - - [2048, 3246, 1, 512, 2048, 2048, 512, 512]
    - [30, 17623.0]
  - - [2048, 3249, 1, 512, 2048, 2048, 512, 512]
    - [30, 17740.0]
  - - [2048, 3251, 1, 512, 2048, 2048, 512, 512]
    - [30, 17733.0]
  - - [2048, 3257, 1, 512, 2048, 2048, 512, 512]
    - [15, 17716.0]
  - - [2048, 3262, 1, 512, 2048, 2048, 512, 512]
    - [30, 17745.0]
  - - [2048, 3268, 1, 512, 2048, 2048, 512, 512]
    - [30, 17801.0]
  - - [2048, 3282, 1, 512, 2048, 2048, 512, 512]
    - [30, 17835.0]
  - - [2048, 3286, 1, 512, 2048, 2048, 512, 512]
    - [30, 17892.0]
  - - [2048, 3293, 1, 512, 2048, 2048, 512, 512]
    - [30, 17937.0]
  - - [2048, 3297, 1, 512, 2048, 2048, 512, 512]
    - [30, 17954.0]
  - - [2048, 3307, 1, 512, 2048, 2048, 512, 512]
    - [30, 17969.0]
  - - [2048, 3314, 1, 512, 2048, 2048, 512, 512]
    - [13, 17916.0]
  - - [2048, 3315, 1, 512, 2048, 2048, 512, 512]
    - [30, 18061.0]
  - - [2048, 3319, 1, 512, 2048, 2048, 512, 512]
    - [30, 18010.0]
  - - [2048, 3322, 1, 512, 2048, 2048, 512, 512]
    - [30, 18024.0]
  - - [2048, 3323, 1, 512, 2048, 2048, 512, 512]
    - [30, 17983.0]
  - - [2048, 3324, 1, 512, 2048, 2048, 512, 512]
    - [30, 18095.0]
  - - [2048, 3325, 1, 512, 2048, 2048, 512, 512]
    - [30, 18039.0]
  - - [2048, 3327, 1, 512, 2048, 2048, 512, 512]
    - [13, 18027.0]
  - - [2048, 3329, 1, 512, 2048, 2048, 512, 512]
    - [13, 17986.0]
  - - [2048, 3332, 1, 512, 2048, 2048, 512, 512]
    - [13, 18039.0]
  - - [2048, 3336, 1, 512, 2048, 2048, 512, 512]
    - [30, 18115.0]
  - - [2048, 3339, 1, 512, 2048, 2048, 512, 512]
    - [13, 18003.0]
  - - [2048, 3342, 1, 512, 2048, 2048, 512, 512]
    - [30, 18077.0]
  - - [2048, 3344, 1, 512, 2048, 2048, 512, 512]
    - [13, 18101.0]
  - - [2048, 3358, 1, 512, 2048, 2048, 512, 512]
    - [30, 18218.0]
  - - [2048, 3360, 1, 512, 2048, 2048, 512, 512]
    - [30, 18240.0]
  - - [2048, 3364, 1, 512, 2048, 2048, 512, 512]
    - [13, 18209.0]
  - - [2048, 3365, 1, 512, 2048, 2048, 512, 512]
    - [30, 18197.0]
  - - [2048, 3369, 1, 512, 2048, 2048, 512, 512]
    - [30, 18262.0]
  - - [2048, 3371, 1, 512, 2048, 2048, 512, 512]
    - [30, 18273.0]
  - - [2048, 3374, 1, 512, 2048, 2048, 512, 512]
    - [13, 18252.0]
  - - [2048, 3376, 1, 512, 2048, 2048, 512, 512]
    - [30, 18329.0]
  - - [2048, 3377, 1, 512, 2048, 2048, 512, 512]
    - [30, 18289.0]
  - - [2048, 3378, 1, 512, 2048, 2048, 512, 512]
    - [30, 18347.0]
  - - [2048, 3381, 1, 512, 2048, 2048, 512, 512]
    - [30, 18320.0]
  - - [2048, 3382, 1, 512, 2048, 2048, 512, 512]
    - [30, 18340.0]
  - - [2048, 3383, 1, 512, 2048, 2048, 512, 512]
    - [30, 18325.0]
  - - [2048, 3384, 1, 512, 2048, 2048, 512, 512]
    - [30, 18420.0]
  - - [2048, 3385, 1, 512, 2048, 2048, 512, 512]
    - [30, 18364.0]
  - - [2048, 3386, 1, 512, 2048, 2048, 512, 512]
    - [13, 18286.0]
  - - [2048, 3388, 1, 512, 2048, 2048, 512, 512]
    - [30, 18419.0]
  - - [2048, 3390, 1, 512, 2048, 2048, 512, 512]
    - [30, 18391.0]
  - - [2048, 3391, 1, 512, 2048, 2048, 512, 512]
    - [30, 18387.0]
  - - [2048, 3396, 1, 512, 2048, 2048, 512, 512]
    - [30, 18439.0]
  - - [2048, 3399, 1, 512, 2048, 2048, 512, 512]
    - [13, 18374.0]
  - - [2048, 3402, 1, 512, 2048, 2048, 512, 512]
    - [30, 18493.0]
  - - [2048, 3410, 1, 512, 2048, 2048, 512, 512]
    - [13, 18452.0]
  - - [2048, 3414, 1, 512, 2048, 2048, 512, 512]
    - [30, 18589.0]
  - - [2048, 3415, 1, 512, 2048, 2048, 512, 512]
    - [30, 18567.0]
  - - [2048, 3418, 1, 512, 2048, 2048, 512, 512]
    - [13, 18522.0]
  - - [2048, 3420, 1, 512, 2048, 2048, 512, 512]
    - [30, 18546.0]
  - - [2048, 3422, 1, 512, 2048, 2048, 512, 512]
    - [30, 18573.0]
  - - [2048, 3425, 1, 512, 2048, 2048, 512, 512]
    - [30, 18554.0]
  - - [2048, 3426, 1, 512, 2048, 2048, 512, 512]
    - [30, 18541.0]
  - - [2048, 3427, 1, 512, 2048, 2048, 512, 512]
    - [13, 18525.0]
  - - [2048, 3428, 1, 512, 2048, 2048, 512, 512]
    - [30, 18576.0]
  - - [2048, 3430, 1, 512, 2048, 2048, 512, 512]
    - [13, 18516.0]
  - - [2048, 3431, 1, 512, 2048, 2048, 512, 512]
    - [30, 18631.0]
  - - [2048, 3432, 1, 512, 2048, 2048, 512, 512]
    - [13, 18546.0]
  - - [2048, 3438, 1, 512, 2048, 2048, 512, 512]
    - [30, 18550.0]
  - - [2048, 3439, 1, 512, 2048, 2048, 512, 512]
    - [13, 18592.0]
  - - [2048, 3440, 1, 512, 2048, 2048, 512, 512]
    - [13, 18540.0]
  - - [2048, 3443, 1, 512, 2048, 2048, 512, 512]
    - [13, 18560.0]
  - - [2048, 3445, 1, 512, 2048, 2048, 512, 512]
    - [30, 18561.0]
  - - [2048, 3447, 1, 512, 2048, 2048, 512, 512]
    - [30, 18685.0]
  - - [2048, 3448, 1, 512, 2048, 2048, 512, 512]
    - [30, 18638.0]
  - - [2048, 3450, 1, 512, 2048, 2048, 512, 512]
    - [30, 18588.0]
  - - [2048, 3451, 1, 512, 2048, 2048, 512, 512]
    - [30, 18659.0]
  - - [2048, 3452, 1, 512, 2048, 2048, 512, 512]
    - [30, 18681.0]
  - - [2048, 3453, 1, 512, 2048, 2048, 512, 512]
    - [30, 18639.0]
  - - [2048, 3455, 1, 512, 2048, 2048, 512, 512]
    - [30, 18732.0]
  - - [2048, 3457, 1, 512, 2048, 2048, 512, 512]
    - [30, 17508.0]
  - - [2048, 3458, 1, 512, 2048, 2048, 512, 512]
    - [30, 17527.0]
  - - [2048, 3459, 1, 512, 2048, 2048, 512, 512]
    - [30, 17527.0]
  - - [2048, 3460, 1, 512, 2048, 2048, 512, 512]
    - [30, 17441.0]
  - - [2048, 3461, 1, 512, 2048, 2048, 512, 512]
    - [30, 17551.0]
  - - [2048, 3462, 1, 512, 2048, 2048, 512, 512]
    - [13, 17434.0]
  - - [2048, 3467, 1, 512, 2048, 2048, 512, 512]
    - [30, 17564.0]
  - - [2048, 3468, 1, 512, 2048, 2048, 512, 512]
    - [30, 17600.0]
  - - [2048, 3470, 1, 512, 2048, 2048, 512, 512]
    - [30, 17629.0]
  - - [2048, 3471, 1, 512, 2048, 2048, 512, 512]
    - [30, 17522.0]
  - - [2048, 3472, 1, 512, 2048, 2048, 512, 512]
    - [30, 17595.0]
  - - [2048, 3475, 1, 512, 2048, 2048, 512, 512]
    - [30, 17579.0]
  - - [2048, 3477, 1, 512, 2048, 2048, 512, 512]
    - [30, 17622.0]
  - - [2048, 3478, 1, 512, 2048, 2048, 512, 512]
    - [30, 17750.0]
  - - [2048, 3479, 1, 512, 2048, 2048, 512, 512]
    - [13, 17527.0]
  - - [2048, 3480, 1, 512, 2048, 2048, 512, 512]
    - [30, 17644.0]
  - - [2048, 3481, 1, 512, 2048, 2048, 512, 512]
    - [30, 17637.0]
  - - [2048, 3483, 1, 512, 2048, 2048, 512, 512]
    - [30, 17591.0]
  - - [2048, 3484, 1, 512, 2048, 2048, 512, 512]
    - [30, 17664.0]
  - - [2048, 3487, 1, 512, 2048, 2048, 512, 512]
    - [30, 17643.0]
  - - [2048, 3489, 1, 512, 2048, 2048, 512, 512]
    - [30, 17594.0]
  - - [2048, 3490, 1, 512, 2048, 2048, 512, 512]
    - [30, 17713.0]
  - - [2048, 3491, 1, 512, 2048, 2048, 512, 512]
    - [30, 17606.0]
  - - [2048, 3493, 1, 512, 2048, 2048, 512, 512]
    - [30, 17761.0]
  - - [2048, 3494, 1, 512, 2048, 2048, 512, 512]
    - [30, 17730.0]
  - - [2048, 3495, 1, 512, 2048, 2048, 512, 512]
    - [30, 17733.0]
  - - [2048, 3497, 1, 512, 2048, 2048, 512, 512]
    - [30, 17750.0]
  - - [2048, 3498, 1, 512, 2048, 2048, 512, 512]
    - [30, 17735.0]
  - - [2048, 3499, 1, 512, 2048, 2048, 512, 512]
    - [30, 17694.0]
  - - [2048, 3501, 1, 512, 2048, 2048, 512, 512]
    - [13, 17651.0]
  - - [2048, 3503, 1, 512, 2048, 2048, 512, 512]
    - [30, 17753.0]
  - - [2048, 3507, 1, 512, 2048, 2048, 512, 512]
    - [30, 17738.0]
  - - [2048, 3508, 1, 512, 2048, 2048, 512, 512]
    - [30, 17842.0]
  - - [2048, 3509, 1, 512, 2048, 2048, 512, 512]
    - [30, 17868.0]
  - - [2048, 3511, 1, 512, 2048, 2048, 512, 512]
    - [30, 17842.0]
  - - [2048, 3514, 1, 512, 2048, 2048, 512, 512]
    - [30, 17768.0]
  - - [2048, 3515, 1, 512, 2048, 2048, 512, 512]
    - [30, 17835.0]
  - - [2048, 3517, 1, 512, 2048, 2048, 512, 512]
    - [30, 17821.0]
  - - [2048, 3518, 1, 512, 2048, 2048, 512, 512]
    - [30, 17845.0]
  - - [2048, 3519, 1, 512, 2048, 2048, 512, 512]
    - [30, 17848.0]
  - - [2048, 3520, 1, 512, 2048, 2048, 512, 512]
    - [30, 17836.0]
  - - [2048, 3523, 1, 512, 2048, 2048, 512, 512]
    - [30, 17894.0]
  - - [2048, 3528, 1, 512, 2048, 2048, 512, 512]
    - [30, 17863.0]
  - - [2048, 3529, 1, 512, 2048, 2048, 512, 512]
    - [30, 17863.0]
  - - [2048, 3530, 1, 512, 2048, 2048, 512, 512]
    - [30, 17906.0]
  - - [2048, 3532, 1, 512, 2048, 2048, 512, 512]
    - [30, 17885.0]
  - - [2048, 3533, 1, 512, 2048, 2048, 512, 512]
    - [30, 17914.0]
  - - [2048, 3534, 1, 512, 2048, 2048, 512, 512]
    - [30, 17807.0]
  - - [2048, 3538, 1, 512, 2048, 2048, 512, 512]
    - [30, 17884.0]
  - - [2048, 3539, 1, 512, 2048, 2048, 512, 512]
    - [30, 17879.0]
  - - [2048, 3541, 1, 512, 2048, 2048, 512, 512]
    - [30, 17875.0]
  - - [2048, 3547, 1, 512, 2048, 2048, 512, 512]
    - [30, 17994.0]
  - - [2048, 3548, 1, 512, 2048, 2048, 512, 512]
    - [30, 17864.0]
  - - [2048, 3552, 1, 512, 2048, 2048, 512, 512]
    - [30, 17972.0]
  - - [2048, 3564, 1, 512, 2048, 2048, 512, 512]
    - [30, 18059.0]
  - - [2048, 3575, 1, 512, 2048, 2048, 512, 512]
    - [30, 18116.0]
  - - [2048, 3598, 1, 512, 2048, 2048, 512, 512]
    - [30, 18046.0]
  - - [2048, 3599, 1, 512, 2048, 2048, 512, 512]
    - [13, 18063.0]
  - - [2048, 3608, 1, 512, 2048, 2048, 512, 512]
    - [13, 18097.0]
  - - [2048, 3780, 1, 512, 2048, 2048, 512, 512]
    - [30, 17820.0]
  - - [2048, 3796, 1, 512, 2048, 2048, 512, 512]
    - [13, 17897.0]
  - - [2048, 3822, 1, 512, 2048, 2048, 512, 512]
    - [30, 17935.0]
  - - [2048, 3840, 1, 512, 2048, 2048, 512, 512]
    - [15, 18314.0]
  - - [2048, 3859, 1, 512, 2048, 2048, 512, 512]
    - [30, 18149.0]
  - - [2048, 3870, 1, 512, 2048, 2048, 512, 512]
    - [30, 18176.0]
  - - [2048, 3876, 1, 512, 2048, 2048, 512, 512]
    - [30, 18186.0]
  - - [2048, 3906, 1, 512, 2048, 2048, 512, 512]
    - [30, 18378.0]
  - - [2048, 3910, 1, 512, 2048, 2048, 512, 512]
    - [13, 18289.0]
  - - [2048, 3925, 1, 512, 2048, 2048, 512, 512]
    - [13, 18362.0]
  - - [2048, 3942, 1, 512, 2048, 2048, 512, 512]
    - [13, 18420.0]
  - - [2048, 3944, 1, 512, 2048, 2048, 512, 512]
    - [30, 18514.0]
  - - [2048, 3955, 1, 512, 2048, 2048, 512, 512]
    - [30, 18562.0]
  - - [2048, 3968, 1, 512, 2048, 2048, 512, 512]
    - [30, 18722.0]
  - - [2048, 3969, 1, 512, 2048, 2048, 512, 512]
    - [30, 17529.0]
  - - [2048, 3976, 1, 512, 2048, 2048, 512, 512]
    - [30, 17611.0]
  - - [2048, 3977, 1, 512, 2048, 2048, 512, 512]
    - [30, 17631.0]
  - - [2048, 3978, 1, 512, 2048, 2048, 512, 512]
    - [30, 17609.0]
  - - [2048, 3990, 1, 512, 2048, 2048, 512, 512]
    - [30, 17749.0]
  - - [2048, 3995, 1, 512, 2048, 2048, 512, 512]
    - [30, 17704.0]
  - - [2048, 3996, 1, 512, 2048, 2048, 512, 512]
    - [30, 17827.0]
  - - [2048, 4005, 1, 512, 2048, 2048, 512, 512]
    - [30, 17745.0]
  - - [2048, 4012, 1, 512, 2048, 2048, 512, 512]
    - [30, 17772.0]
  - - [2048, 4020, 1, 512, 2048, 2048, 512, 512]
    - [30, 17789.0]
  - - [2048, 4026, 1, 512, 2048, 2048, 512, 512]
    - [30, 17873.0]
  - - [2048, 4030, 1, 512, 2048, 2048, 512, 512]
    - [30, 17836.0]
  - - [2048, 4032, 1, 512, 2048, 2048, 512, 512]
    - [30, 17841.0]
  - - [33708, 184, 1, 512, 33708, 33708, 512, 512]
    - [48, 15204.0]
  - - [33708, 208, 1, 512, 33708, 33708, 512, 512]
    - [13, 15088.0]
  - - [33708, 246, 1, 512, 33708, 33708, 512, 512]
    - [49, 17755.0]
  - - [33708, 264, 1, 512, 33708, 33708, 512, 512]
    - [30, 13257.0]
  - - [33708, 465, 1, 512, 33708, 33708, 512, 512]
    - [49, 17175.0]
  - - [33708, 468, 1, 512, 33708, 33708, 512, 512]
    - [49, 17262.0]
  - - [33708, 493, 1, 512, 33708, 33708, 512, 512]
    - [30, 18166.0]
  - - [33708, 540, 1, 512, 33708, 33708, 512, 512]
    - [30, 16306.0]
  - - [33708, 550, 1, 512, 33708, 33708, 512, 512]
    - [30, 16617.0]
  - - [33708, 560, 1, 512, 33708, 33708, 512, 512]
    - [30, 16893.0]
  - - [33708, 644, 1, 512, 33708, 33708, 512, 512]
    - [49, 16310.0]
  - - [33708, 714, 1, 512, 33708, 33708, 512, 512]
    - [49, 18040.0]
  - - [33708, 720, 1, 512, 33708, 33708, 512, 512]
    - [49, 18162.0]
  - - [33708, 781, 1, 512, 33708, 33708, 512, 512]
    - [49, 16815.0]
  - - [33708, 936, 1, 512, 33708, 33708, 512, 512]
    - [49, 17750.0]
  - - [33708, 980, 1, 512, 33708, 33708, 512, 512]
    - [30, 18544.0]
  - - [33708, 1232, 1, 512, 33708, 33708, 512, 512]
    - [13, 18652.0]
  - - [33708, 1290, 1, 512, 33708, 33708, 512, 512]
    - [13, 17870.0]
  - - [33708, 1350, 1, 512, 33708, 33708, 512, 512]
    - [13, 18684.0]
  - - [33708, 1424, 1, 512, 33708, 33708, 512, 512]
    - [13, 18066.0]
  - - [33708, 1458, 1, 512, 33708, 33708, 512, 512]
    - [13, 18546.0]
  - - [33708, 1462, 1, 512, 33708, 33708, 512, 512]
    - [13, 18574.0]
  - - [33708, 1520, 1, 512, 33708, 33708, 512, 512]
    - [13, 19274.0]
  - - [33708, 1596, 1, 512, 33708, 33708, 512, 512]
    - [13, 18727.0]
  - - [33708, 1599, 1, 512, 33708, 33708, 512, 512]
    - [13, 18752.0]
  - - [33708, 1615, 1, 512, 33708, 33708, 512, 512]
    - [13, 18936.0]
  - - [33708, 1680, 1, 512, 33708, 33708, 512, 512]
    - [13, 18346.0]
  - - [33708, 1917, 1, 512, 33708, 33708, 512, 512]
    - [13, 19587.0]
  - - [33708, 2205, 1, 512, 33708, 33708, 512, 512]
    - [13, 18817.0]
  - - [33708, 2418, 1, 512, 33708, 33708, 512, 512]
    - [13, 19558.0]
  - - [33708, 3776, 1, 512, 33708, 33708, 512, 512]
    - [13, 19454.0]
  - - [33708, 3780, 1, 512, 33708, 33708, 512, 512]
    - [13, 19470.0]
  - - [33708, 3796, 1, 512, 33708, 33708, 512, 512]
    - [13, 19558.0]
  - - [33708, 3822, 1, 512, 33708, 33708, 512, 512]
    - [13, 19665.0]
  - - [33708, 3835, 1, 512, 33708, 33708, 512, 512]
    - [13, 19749.0]
  - - [33708, 3840, 1, 512, 33708, 33708, 512, 512]
    - [13, 19764.0]
  - - [33708, 3859, 1, 512, 33708, 33708, 512, 512]
    - [13, 19229.0]
  - - [33708, 3870, 1, 512, 33708, 33708, 512, 512]
    - [13, 19271.0]
  - - [33708, 3876, 1, 512, 33708, 33708, 512, 512]
    - [13, 19302.0]
  - - [33708, 3906, 1, 512, 33708, 33708, 512, 512]
    - [13, 19427.0]
  - - [33708, 3910, 1, 512, 33708, 33708, 512, 512]
    - [13, 19472.0]
  - - [33708, 3925, 1, 512, 33708, 33708, 512, 512]
    - [13, 19551.0]
  - - [33708, 3942, 1, 512, 33708, 33708, 512, 512]
    - [13, 19628.0]
  - - [33708, 3944, 1, 512, 33708, 33708, 512, 512]
    - [13, 19634.0]
  - - [33708, 3955, 1, 512, 33708, 33708, 512, 512]
    - [13, 19701.0]
  - - [33708, 3968, 1, 512, 33708, 33708, 512, 512]
    - [30, 19754.0]
  - - [33708, 3976, 1, 512, 33708, 33708, 512, 512]
    - [13, 19206.0]
  - - [33708, 3977, 1, 512, 33708, 33708, 512, 512]
    - [13, 19191.0]
  - - [33708, 3978, 1, 512, 33708, 33708, 512, 512]
    - [13, 19158.0]
  - - [33708, 3990, 1, 512, 33708, 33708, 512, 512]
    - [13, 19255.0]
  - - [33708, 3996, 1, 512, 33708, 33708, 512, 512]
    - [13, 19281.0]
  - - [33708, 3999, 1, 512, 33708, 33708, 512, 512]
    - [13, 19303.0]
  - - [33708, 4005, 1, 512, 33708, 33708, 512, 512]
    - [13, 19348.0]
  - - [33708, 4012, 1, 512, 33708, 33708, 512, 512]
    - [13, 19378.0]
  - - [33708, 4020, 1, 512, 33708, 33708, 512, 512]
    - [13, 19413.0]
  - - [33708, 4026, 1, 512, 33708, 33708, 512, 512]
    - [13, 19440.0]
  - - [33708, 4030, 1, 512, 33708, 33708, 512, 512]
    - [13, 19467.0]
  - - [33708, 4032, 1, 512, 33708, 33708, 512, 512]
    - [13, 19467.0]
  - - [3072, 512, 1, 3072, 3072, 3072, 3072, 3072]
    - [13, 15913.0]
  - - [511, 8192, 1, 8192, 511, 511, 8192, 8192]
    - [51, 16195.0]
  - - [4096, 4096, 1, 4096, 4096, 4096, 4096, 4096]
    - [13, 19236.0]
  - - [8192, 8193, 1, 8192, 8192, 8192, 8192, 8192]
    - [51, 17970.0]
  - - [3072, 3072, 1, 3071, 3072, 3072, 3071, 3071]
    - [24, 20235.0]
  - - [8192, 8192, 1, 8193, 8192, 8192, 8193, 8193]
    - [7, 20433.0]
  - - [7681, 8192, 1, 8192, 7681, 7681, 8192, 8192]
    - [51, 19416.0]
  - - [7680, 8192, 1, 8193, 7680, 7680, 8193, 8193]
    - [24, 20232.0]
  - - [513, 4096, 1, 4096, 513, 513, 4096, 4096]
    - [13, 13124.0]
  - - [3073, 512, 1, 3072, 3073, 3073, 3072, 3072]
    - [13, 15808.0]
  - - [7680, 8192, 1, 8192, 7680, 7680, 8192, 8192]
    - [51, 19763.0]
  - - [4096, 4096, 1, 4097, 4096, 4096, 4097, 4097]
    - [41, 19445.0]
  - - [8192, 8191, 1, 8192, 8192, 8192, 8192, 8192]
    - [51, 18376.0]
  - - [8192, 512, 1, 8193, 8192, 8192, 8193, 8193]
    - [43, 17190.0]
  - - [2880, 3071, 1, 3072, 2880, 2880, 3072, 3072]
    - [51, 18849.0]
  - - [2880, 3072, 1, 3072, 2880, 2880, 3072, 3072]
    - [15, 18882.0]
  - - [4096, 511, 1, 4096, 4096, 4096, 4096, 4096]
    - [15, 17148.0]
  - - [512, 3072, 1, 3072, 512, 512, 3072, 3072]
    - [13, 16033.0]
  - - [512, 8191, 1, 8192, 512, 512, 8192, 8192]
    - [32, 15950.0]
  - - [4096, 4095, 1, 4096, 4096, 4096, 4096, 4096]
    - [13, 19332.0]
  - - [8192, 511, 1, 8192, 8192, 8192, 8192, 8192]
    - [51, 15146.0]
  - - [8192, 512, 1, 8192, 8192, 8192, 8192, 8192]
    - [51, 15828.0]
  - - [511, 3072, 1, 3072, 511, 511, 3072, 3072]
    - [49, 15755.0]
  - - [7680, 8193, 1, 8192, 7680, 7680, 8192, 8192]
    - [51, 19158.0]
  - - [2048, 2048, 1, 2048, 2048, 2048, 2048, 2048]
    - [15, 17589.0]
  - - [3072, 512, 1, 3073, 3072, 3072, 3073, 3073]
    - [37, 16345.0]
  - - [513, 8192, 1, 8192, 513, 513, 8192, 8192]
    - [32, 13936.0]
  - - [7679, 8192, 1, 8192, 7679, 7679, 8192, 8192]
    - [51, 19834.0]
  - - [3840, 4096, 1, 4097, 3840, 3840, 4097, 4097]
    - [22, 19558.0]
  - - [512, 3072, 1, 3071, 512, 512, 3071, 3071]
    - [37, 16543.0]
  - - [7680, 8192, 1, 8191, 7680, 7680, 8191, 8191]
    - [24, 20235.0]
  - - [3072, 511, 1, 3072, 3072, 3072, 3072, 3072]
    - [30, 15712.0]
  - - [8193, 8192, 1, 8192, 8193, 8193, 8192, 8192]
    - [51, 18896.0]
  - - [512, 4096, 1, 4095, 512, 512, 4095, 4095]
    - [43, 17541.0]
  - - [512, 3071, 1, 3072, 512, 512, 3072, 3072]
    - [49, 15843.0]
  - - [3073, 3072, 1, 3072, 3073, 3073, 3072, 3072]
    - [13, 18454.0]
  - - [512, 3073, 1, 3072, 512, 512, 3072, 3072]
    - [49, 15818.0]
  - - [4096, 4096, 1, 4095, 4096, 4096, 4095, 4095]
    - [22, 19485.0]
  - - [1920, 2048, 1, 2047, 1920, 1920, 2047, 2047]
    - [37, 18722.0]
  - - [1920, 2049, 1, 2048, 1920, 1920, 2048, 2048]
    - [13, 15963.0]
  - - [512, 8192, 1, 8191, 512, 512, 8191, 8191]
    - [7, 17978.0]
  - - [3840, 4096, 1, 4096, 3840, 3840, 4096, 4096]
    - [15, 19258.0]
  - - [8191, 512, 1, 8192, 8191, 8191, 8192, 8192]
    - [32, 15153.0]
  - - [2881, 3072, 1, 3072, 2881, 2881, 3072, 3072]
    - [32, 18878.0]
  - - [512, 4096, 1, 4096, 512, 512, 4096, 4096]
    - [15, 17494.0]
  - - [3841, 4096, 1, 4096, 3841, 3841, 4096, 4096]
    - [15, 19014.0]
  - - [2880, 3072, 1, 3073, 2880, 2880, 3073, 3073]
    - [7, 18877.0]
  - - [4095, 512, 1, 4096, 4095, 4095, 4096, 4096]
    - [15, 17330.0]
  - - [1919, 2048, 1, 2048, 1919, 1919, 2048, 2048]
    - [13, 18019.0]
  - - [1920, 2048, 1, 2048, 1920, 1920, 2048, 2048]
    - [13, 18102.0]
  - - [8192, 8192, 1, 8192, 8192, 8192, 8192, 8192]
    - [51, 18306.0]
  - - [511, 4096, 1, 4096, 511, 511, 4096, 4096]
    - [51, 17345.0]
  - - [8192, 513, 1, 8192, 8192, 8192, 8192, 8192]
    - [44, 12469.0]
  - - [513, 3072, 1, 3072, 513, 513, 3072, 3072]
    - [51, 13042.0]
  - - [7680, 8191, 1, 8192, 7680, 7680, 8192, 8192]
    - [51, 19791.0]
  - - [512, 4097, 1, 4096, 512, 512, 4096, 4096]
    - [32, 17282.0]
  - - [2047, 2048, 1, 2048, 2047, 2047, 2048, 2048]
    - [15, 17623.0]
  - - [2049, 2048, 1, 2048, 2049, 2049, 2048, 2048]
    - [13, 16951.0]
  - - [3840, 4095, 1, 4096, 3840, 3840, 4096, 4096]
    - [15, 18982.0]
  - - [2880, 3072, 1, 3071, 2880, 2880, 3071, 3071]
    - [24, 18900.0]
  - - [3072, 3072, 1, 3073, 3072, 3072, 3073, 3073]
    - [7, 20235.0]
  - - [2880, 3073, 1, 3072, 2880, 2880, 3072, 3072]
    - [13, 18309.0]
  - - [4096, 513, 1, 4096, 4096, 4096, 4096, 4096]
    - [13, 13372.0]
  - - [4097, 512, 1, 4096, 4097, 4097, 4096, 4096]
    - [15, 17422.0]
  - - [8192, 512, 1, 8191, 8192, 8192, 8191, 8191]
    - [24, 17192.0]
  - - [1921, 2048, 1, 2048, 1921, 1921, 2048, 2048]
    - [15, 16486.0]
  - - [512, 3072, 1, 3073, 512, 512, 3073, 3073]
    - [37, 16591.0]
  - - [2048, 2049, 1, 2048, 2048, 2048, 2048, 2048]
    - [15, 17573.0]
  - - [3072, 512, 1, 3071, 3072, 3072, 3071, 3071]
    - [18, 16599.0]
  - - [3071, 3072, 1, 3072, 3071, 3071, 3072, 3072]
    - [32, 20192.0]
  - - [3840, 4097, 1, 4096, 3840, 3840, 4096, 4096]
    - [15, 18085.0]
  - - [2048, 2047, 1, 2048, 2048, 2048, 2048, 2048]
    - [32, 17425.0]
  - - [2879, 3072, 1, 3072, 2879, 2879, 3072, 3072]
    - [32, 18891.0]
  - - [3072, 513, 1, 3072, 3072, 3072, 3072, 3072]
    - [51, 13121.0]
  - - [512, 4095, 1, 4096, 512, 512, 4096, 4096]
    - [51, 17364.0]
  - - [3071, 512, 1, 3072, 3071, 3071, 3072, 3072]
    - [13, 15867.0]
  - - [4096, 512, 1, 4096, 4096, 4096, 4096, 4096]
    - [15, 17538.0]
  - - [4097, 4096, 1, 4096, 4097, 4097, 4096, 4096]
    - [15, 18729.0]
  - - [2048, 2048, 1, 2047, 2048, 2048, 2047, 2047]
    - [24, 17700.0]
  - - [3839, 4096, 1, 4096, 3839, 3839, 4096, 4096]
    - [15, 19090.0]
  - - [512, 4096, 1, 4097, 512, 512, 4097, 4097]
    - [43, 17528.0]
  - - [3072, 3073, 1, 3072, 3072, 3072, 3072, 3072]
    - [13, 18441.0]
  - - [2048, 2048, 1, 2049, 2048, 2048, 2049, 2049]
    - [24, 17763.0]
  - - [8191, 8192, 1, 8192, 8191, 8191, 8192, 8192]
    - [51, 18268.0]
  - - [3072, 3071, 1, 3072, 3072, 3072, 3072, 3072]
    - [32, 20121.0]
  - - [4096, 512, 1, 4097, 4096, 4096, 4097, 4097]
    - [43, 17502.0]
  - - [3840, 4096, 1, 4095, 3840, 3840, 4095, 4095]
    - [5, 19560.0]
  - - [1920, 2047, 1, 2048, 1920, 1920, 2048, 2048]
    - [13, 17827.0]
  - - [8192, 8192, 1, 8191, 8192, 8192, 8191, 8191]
    - [7, 20436.0]
  - - [3072, 3072, 1, 3072, 3072, 3072, 3072, 3072]
    - [32, 20204.0]
  - - [512, 8193, 1, 8192, 512, 512, 8192, 8192]
    - [32, 16213.0]
  - - [4096, 512, 1, 4095, 4096, 4096, 4095, 4095]
    - [43, 17491.0]
  - - [8193, 512, 1, 8192, 8193, 8193, 8192, 8192]
    - [32, 15218.0]
  - - [4095, 4096, 1, 4096, 4095, 4095, 4096, 4096]
    - [13, 19253.0]
  - - [4096, 4097, 1, 4096, 4096, 4096, 4096, 4096]
    - [13, 18726.0]
  - - [512, 8192, 1, 8192, 512, 512, 8192, 8192]
    - [32, 16515.0]
  - - [512, 8192, 1, 8193, 512, 512, 8193, 8193]
    - [24, 17982.0]
  - - [1920, 2048, 1, 2049, 1920, 1920, 2049, 2049]
    - [37, 18641.0]
  - - [479, 3072, 1, 3072, 479, 479, 3072, 3072]
    - [13, 14920.0]
  - - [479, 4096, 1, 4096, 479, 479, 4096, 4096]
    - [32, 16363.0]
  - - [479, 8192, 1, 8192, 479, 479, 8192, 8192]
    - [32, 15191.0]
  - - [480, 3072, 1, 3071, 480, 480, 3071, 3071]
    - [37, 15545.0]
  - - [480, 3072, 1, 3073, 480, 480, 3073, 3073]
    - [1, 15544.0]
  - - [480, 3073, 1, 3072, 480, 480, 3072, 3072]
    - [13, 14954.0]
  - - [480, 4095, 1, 4096, 480, 480, 4096, 4096]
    - [32, 16366.0]
  - - [480, 4096, 1, 4095, 480, 480, 4095, 4095]
    - [24, 16504.0]
  - - [480, 4096, 1, 4097, 480, 480, 4097, 4097]
    - [43, 16494.0]
  - - [480, 4097, 1, 4096, 480, 480, 4096, 4096]
    - [32, 16394.0]
  - - [480, 8191, 1, 8192, 480, 480, 8192, 8192]
    - [32, 15180.0]
  - - [480, 8192, 1, 8191, 480, 480, 8191, 8191]
    - [43, 16857.0]
  - - [480, 8192, 1, 8193, 480, 480, 8193, 8193]
    - [7, 16855.0]
  - - [480, 8193, 1, 8192, 480, 480, 8192, 8192]
    - [51, 15252.0]
  - - [481, 3072, 1, 3072, 481, 481, 3072, 3072]
    - [13, 14852.0]
  - - [481, 4096, 1, 4096, 481, 481, 4096, 4096]
    - [51, 16423.0]
  - - [481, 8192, 1, 8192, 481, 481, 8192, 8192]
    - [51, 15672.0]
  - - [3072, 479, 1, 3072, 3072, 3072, 3072, 3072]
    - [30, 14801.0]
  - - [3072, 480, 1, 3071, 3072, 3072, 3071, 3071]
    - [37, 15532.0]
  - - [3072, 480, 1, 3073, 3072, 3072, 3073, 3073]
    - [18, 15452.0]
  - - [3072, 481, 1, 3072, 3072, 3072, 3072, 3072]
    - [30, 14937.0]
  - - [3073, 480, 1, 3072, 3073, 3073, 3072, 3072]
    - [49, 14901.0]
  - - [480, 3072, 1, 3072, 480, 480, 3072, 3072]
    - [30, 14909.0]
  - - [480, 4096, 1, 4096, 480, 480, 4096, 4096]
    - [51, 16423.0]
  - - [480, 8192, 1, 8192, 480, 480, 8192, 8192]
    - [32, 15450.0]
  - - [3072, 480, 1, 3072, 3072, 3072, 3072, 3072]
    - [49, 14819.0]
  - - [4096, 480, 1, 4096, 4096, 4096, 4096, 4096]
    - [15, 16178.0]
  - - [8192, 480, 1, 8192, 8192, 8192, 8192, 8192]
    - [51, 14474.0]
  - - [1024, 3840, 1, 1024, 1024, 1024, 1024, 1024]
    - [13, 17697.0]
  - - [1024, 3840, 1, 4096, 1024, 1024, 4096, 4096]
    - [32, 16777.0]
  - - [1024, 3968, 1, 1024, 1024, 1024, 1024, 1024]
    - [30, 18420.0]
  - - [1024, 3968, 1, 4096, 1024, 1024, 4096, 4096]
    - [13, 18678.0]
  - - [1024, 7200, 1, 1024, 1024, 1024, 1024, 1024]
    - [30, 18358.0]
  - - [1024, 7200, 1, 4096, 1024, 1024, 4096, 4096]
    - [13, 18284.0]
  - - [1024, 8160, 1, 1024, 1024, 1024, 1024, 1024]
    - [49, 18204.0]
  - - [1024, 8160, 1, 4096, 1024, 1024, 4096, 4096]
    - [15, 17449.0]
  - - [1024, 9520, 1, 1024, 1024, 1024, 1024, 1024]
    - [30, 18719.0]
  - - [1024, 9520, 1, 4096, 1024, 1024, 4096, 4096]
    - [15, 18345.0]
  - - [1024, 10200, 1, 1024, 1024, 1024, 1024, 1024]
    - [32, 19309.0]
  - - [1024, 10200, 1, 4096, 1024, 1024, 4096, 4096]
    - [15, 19310.0]
  - - [4096, 3840, 1, 1024, 4096, 4096, 1024, 1024]
    - [13, 19285.0]
  - - [4096, 3968, 1, 1024, 4096, 4096, 1024, 1024]
    - [13, 19306.0]
  - - [4096, 7200, 1, 1024, 4096, 4096, 1024, 1024]
    - [13, 19111.0]
  - - [4096, 8160, 1, 1024, 4096, 4096, 1024, 1024]
    - [13, 19301.0]
  - - [4096, 9520, 1, 1024, 4096, 4096, 1024, 1024]
    - [13, 19116.0]
  - - [4096, 10200, 1, 1024, 4096, 4096, 1024, 1024]
    - [13, 19242.0]
  - - [42720, 3968, 1, 1024, 42720, 42720, 1024, 1024]
    - [49, 19908.0]
  - - [42720, 7200, 1, 1024, 42720, 42720, 1024, 1024]
    - [51, 19663.0]
  - - [42720, 9520, 1, 1024, 42720, 42720, 1024, 1024]
    - [51, 19855.0]
  - - [2048, 960, 1, 2048, 2048, 2048, 2048, 2048]
    - [51, 15966.0]
  - - [2048, 960, 1, 74, 2048, 2048, 74, 74]
    - [0, 12852.0]
  - - [1600, 1024, 1, 960, 1600, 1600, 960, 960]
    - [18, 16658.0]
  - - [2048, 2048, 1, 960, 2048, 2048, 960, 960]
    - [24, 17583.0]
  - - [4096, 1024, 1, 257, 4096, 4096, 257, 257]
    - [18, 16283.0]
  - - [10240, 8976, 1, 256, 10240, 10240, 256, 256]
    - [13, 19197.0]
  - - [1024, 1600, 1, 1024, 1024, 1024, 1024, 1024]
    - [49, 15398.0]
  - - [1024, 1600, 1, 560, 1024, 1024, 560, 560]
    - [38, 16148.0]
  - - [10496, 8976, 1, 256, 10496, 10496, 256, 256]
    - [13, 19307.0]
  - - [11264, 8976, 1, 256, 11264, 11264, 256, 256]
    - [13, 19194.0]
  - - [11776, 8976, 1, 256, 11776, 11776, 256, 256]
    - [13, 19338.0]
  - - [12544, 8976, 1, 256, 12544, 12544, 256, 256]
    - [13, 19346.0]
  - - [1280, 8976, 1, 256, 1280, 1280, 256, 256]
    - [49, 17878.0]
  - - [13312, 8976, 1, 256, 13312, 13312, 256, 256]
    - [13, 19333.0]
  - - [13568, 8976, 1, 256, 13568, 13568, 256, 256]
    - [13, 19391.0]
  - - [13824, 8976, 1, 256, 13824, 13824, 256, 256]
    - [13, 19348.0]
  - - [15104, 8976, 1, 256, 15104, 15104, 256, 256]
    - [13, 19398.0]
  - - [15360, 8976, 1, 256, 15360, 15360, 256, 256]
    - [13, 19335.0]
  - - [15872, 8976, 1, 256, 15872, 15872, 256, 256]
    - [13, 19383.0]
  - - [16128, 8976, 1, 256, 16128, 16128, 256, 256]
    - [13, 19427.0]
  - - [17152, 8976, 1, 256, 17152, 17152, 256, 256]
    - [13, 19446.0]
  - - [1792, 8976, 1, 256, 1792, 1792, 256, 256]
    - [49, 18264.0]
  - - [18176, 8976, 1, 256, 18176, 18176, 256, 256]
    - [13, 19447.0]
  - - [18688, 8976, 1, 256, 18688, 18688, 256, 256]
    - [13, 19458.0]
  - - [18944, 8976, 1, 256, 18944, 18944, 256, 256]
    - [13, 19442.0]
  - - [19712, 8976, 1, 256, 19712, 19712, 256, 256]
    - [13, 19441.0]
  - - [19968, 8976, 1, 256, 19968, 19968, 256, 256]
    - [13, 19436.0]
  - - [20480, 8976, 1, 256, 20480, 20480, 256, 256]
    - [13, 19391.0]
  - - [2048, 1536, 1, 512, 2048, 2048, 512, 512]
    - [15, 16113.0]
  - - [2048, 1536, 1, 768, 2048, 2048, 768, 768]
    - [32, 17047.0]
  - - [2048, 684, 1, 512, 2048, 2048, 512, 512]
    - [29, 13788.0]
  - - [2048, 684, 1, 768, 2048, 2048, 768, 768]
    - [29, 14111.0]
  - - [2048, 8976, 1, 256, 2048, 2048, 256, 256]
    - [30, 18638.0]
  - - [20992, 8976, 1, 256, 20992, 20992, 256, 256]
    - [13, 19446.0]
  - - [21248, 8976, 1, 256, 21248, 21248, 256, 256]
    - [13, 19445.0]
  - - [2304, 8976, 1, 256, 2304, 2304, 256, 256]
    - [24, 18553.0]
  - - [23552, 8976, 1, 256, 23552, 23552, 256, 256]
    - [13, 19418.0]
  - - [2560, 8976, 1, 256, 2560, 2560, 256, 256]
    - [30, 18710.0]
  - - [256, 10496, 1, 1024, 256, 256, 1024, 1024]
    - [49, 16639.0]
  - - [256, 11264, 1, 1024, 256, 256, 1024, 1024]
    - [49, 18055.0]
  - - [256, 11520, 1, 1024, 256, 256, 1024, 1024]
    - [14, 17106.0]
  - - [256, 11776, 1, 1024, 256, 256, 1024, 1024]
    - [51, 16581.0]
  - - [256, 12544, 1, 1024, 256, 256, 1024, 1024]
    - [51, 17596.0]
  - - [256, 13312, 1, 1024, 256, 256, 1024, 1024]
    - [32, 18560.0]
  - - [256, 14336, 1, 1024, 256, 256, 1024, 1024]
    - [30, 16845.0]
  - - [256, 14592, 1, 1024, 256, 256, 1024, 1024]
    - [30, 17160.0]
  - - [256, 14848, 1, 1024, 256, 256, 1024, 1024]
    - [30, 17442.0]
  - - [256, 15104, 1, 1024, 256, 256, 1024, 1024]
    - [49, 17735.0]
  - - [256, 16128, 1, 1024, 256, 256, 1024, 1024]
    - [14, 17238.0]
  - - [256, 18176, 1, 1024, 256, 256, 1024, 1024]
    - [32, 19200.0]
  - - [256, 18944, 1, 1024, 256, 256, 1024, 1024]
    - [49, 17522.0]
  - - [256, 19200, 1, 1024, 256, 256, 1024, 1024]
    - [49, 17754.0]
  - - [256, 20480, 1, 1024, 256, 256, 1024, 1024]
    - [49, 18897.0]
  - - [256, 20992, 1, 1024, 256, 256, 1024, 1024]
    - [51, 17937.0]
  - - [256, 21248, 1, 1024, 256, 256, 1024, 1024]
    - [51, 18174.0]
  - - [256, 21504, 1, 1024, 256, 256, 1024, 1024]
    - [32, 18373.0]
  - - [256, 22016, 1, 1024, 256, 256, 1024, 1024]
    - [51, 18776.0]
  - - [256, 22344, 1, 1024, 256, 256, 1024, 1024]
    - [32, 18655.0]
  - - [256, 23296, 1, 1024, 256, 256, 1024, 1024]
    - [30, 17763.0]
  - - [256, 23552, 1, 1024, 256, 256, 1024, 1024]
    - [30, 17930.0]
  - - [256, 31488, 1, 1024, 256, 256, 1024, 1024]
    - [32, 18861.0]
  - - [256, 33536, 1, 1024, 256, 256, 1024, 1024]
    - [49, 18641.0]
  - - [256, 44505, 1, 1024, 256, 256, 1024, 1024]
    - [51, 18497.0]
  - - [256, 4608, 1, 1024, 256, 256, 1024, 1024]
    - [32, 16033.0]
  - - [256, 4864, 1, 1024, 256, 256, 1024, 1024]
    - [45, 13265.0]
  - - [256, 5376, 1, 1024, 256, 256, 1024, 1024]
    - [48, 14207.0]
  - - [256, 5888, 1, 1024, 256, 256, 1024, 1024]
    - [49, 15059.0]
  - - [256, 6144, 1, 1024, 256, 256, 1024, 1024]
    - [13, 15689.0]
  - - [256, 6400, 1, 1024, 256, 256, 1024, 1024]
    - [30, 16292.0]
  - - [256, 6656, 1, 1024, 256, 256, 1024, 1024]
    - [13, 16914.0]
  - - [256, 7168, 1, 1024, 256, 256, 1024, 1024]
    - [51, 15064.0]
  - - [256, 7424, 1, 1024, 256, 256, 1024, 1024]
    - [32, 15594.0]
  - - [256, 7936, 1, 1024, 256, 256, 1024, 1024]
    - [32, 16569.0]
  - - [256, 8192, 1, 1024, 256, 256, 1024, 1024]
    - [32, 16998.0]
  - - [256, 8448, 1, 1024, 256, 256, 1024, 1024]
    - [32, 17585.0]
  - - [256, 8960, 1, 1024, 256, 256, 1024, 1024]
    - [51, 18509.0]
  - - [256, 9984, 1, 1024, 256, 256, 1024, 1024]
    - [49, 16110.0]
  - - [2816, 8976, 1, 256, 2816, 2816, 256, 256]
    - [49, 18717.0]
  - - [28672, 8976, 1, 256, 28672, 28672, 256, 256]
    - [13, 19453.0]
  - - [3072, 8976, 1, 256, 3072, 3072, 256, 256]
    - [30, 18806.0]
  - - [31488, 8976, 1, 256, 31488, 31488, 256, 256]
    - [13, 19510.0]
  - - [3328, 8976, 1, 256, 3328, 3328, 256, 256]
    - [49, 18845.0]
  - - [33536, 8976, 1, 256, 33536, 33536, 256, 256]
    - [13, 19525.0]
  - - [3840, 8976, 1, 256, 3840, 3840, 256, 256]
    - [30, 18810.0]
  - - [4096, 8976, 1, 256, 4096, 4096, 256, 256]
    - [30, 18730.0]
  - - [4352, 8976, 1, 256, 4352, 4352, 256, 256]
    - [13, 18943.0]
  - - [44505, 8976, 1, 256, 44505, 44505, 256, 256]
    - [13, 19488.0]
  - - [4608, 8976, 1, 256, 4608, 4608, 256, 256]
    - [30, 18900.0]
  - - [4864, 8976, 1, 256, 4864, 4864, 256, 256]
    - [30, 18976.0]
  - - [5120, 8976, 1, 256, 5120, 5120, 256, 256]
    - [13, 18578.0]
  - - [5376, 8976, 1, 256, 5376, 5376, 256, 256]
    - [41, 19037.0]
  - - [5632, 8976, 1, 256, 5632, 5632, 256, 256]
    - [30, 19017.0]
  - - [5888, 8976, 1, 256, 5888, 5888, 256, 256]
    - [13, 19073.0]
  - - [6144, 8976, 1, 256, 6144, 6144, 256, 256]
    - [13, 18828.0]
  - - [6400, 8976, 1, 256, 6400, 6400, 256, 256]
    - [13, 19131.0]
  - - [684, 8976, 1, 256, 684, 684, 256, 256]
    - [49, 15415.0]
  - - [7168, 8976, 1, 256, 7168, 7168, 256, 256]
    - [13, 19001.0]
  - - [7936, 8976, 1, 256, 7936, 7936, 256, 256]
    - [13, 19183.0]
  - - [8192, 8976, 1, 256, 8192, 8192, 256, 256]
    - [5, 18744.0]
  - - [8448, 8976, 1, 256, 8448, 8448, 256, 256]
    - [13, 19270.0]
  - - [8960, 8976, 1, 256, 8960, 8960, 256, 256]
    - [13, 19279.0]
  - - [9472, 8976, 1, 256, 9472, 9472, 256, 256]
    - [13, 19281.0]
  - - [9728, 8976, 1, 256, 9728, 9728, 256, 256]
    - [13, 19268.0]
  - - [9984, 8976, 1, 256, 9984, 9984, 256, 256]
    - [13, 19291.0]
  - - [512, 32768, 1, 13, 512, 512, 13, 13]
    - [36, 6464.0]
  - - [256, 32768, 1, 512, 256, 256, 512, 512]
    - [49, 18171.0]
  - - [128, 32768, 1, 512, 128, 128, 512, 512]
    - [15, 17000.0]
  - - [1024, 32768, 1, 479, 1024, 1024, 479, 479]
    - [1, 19733.0]
  - - [1024, 32768, 1, 1024, 1024, 1024, 1024, 1024]
    - [30, 19511.0]
  - - [512, 32768, 1, 1024, 512, 512, 1024, 1024]
    - [49, 19213.0]
  - - [1023, 2048, 1, 4096, 1023, 1023, 4096, 4096]
    - [32, 17372.0]
  - - [1025, 2048, 1, 4096, 1025, 1025, 4096, 4096]
    - [32, 17483.0]
  - - [1024, 2047, 1, 4096, 1024, 1024, 4096, 4096]
    - [15, 17405.0]
  - - [1024, 2049, 1, 4096, 1024, 1024, 4096, 4096]
    - [15, 17450.0]
  - - [1024, 2048, 1, 4095, 1024, 1024, 4095, 4095]
    - [24, 17620.0]
  - - [1024, 2048, 1, 4097, 1024, 1024, 4097, 4097]
    - [24, 17606.0]
  - - [1023, 3072, 1, 1024, 1023, 1023, 1024, 1024]
    - [32, 16946.0]
  - - [1025, 3072, 1, 1024, 1025, 1025, 1024, 1024]
    - [32, 17087.0]
  - - [1024, 3071, 1, 1024, 1024, 1024, 1024, 1024]
    - [32, 16875.0]
  - - [1024, 3073, 1, 1024, 1024, 1024, 1024, 1024]
    - [15, 16949.0]
  - - [1024, 3072, 1, 1023, 1024, 1024, 1023, 1023]
    - [1, 17259.0]
  - - [1024, 3072, 1, 1025, 1024, 1024, 1025, 1025]
    - [24, 17280.0]
  - - [3071, 512, 1, 1024, 3071, 3071, 1024, 1024]
    - [13, 15124.0]
  - - [3073, 512, 1, 1024, 3073, 3073, 1024, 1024]
    - [49, 15111.0]
  - - [3072, 511, 1, 1024, 3072, 3072, 1024, 1024]
    - [49, 15148.0]
  - - [3072, 513, 1, 1024, 3072, 3072, 1024, 1024]
    - [48, 13602.0]
  - - [3072, 512, 1, 1023, 3072, 3072, 1023, 1023]
    - [37, 16230.0]
  - - [3072, 512, 1, 1025, 3072, 3072, 1025, 1025]
    - [18, 16054.0]
  - - [128, 32768, 1, 256, 128, 128, 256, 256]
    - [30, 16220.0]
  - - [1024, 4096, 1, 480, 1024, 1024, 480, 480]
    - [1, 17356.0]
  - - [512, 4096, 1, 1024, 512, 512, 1024, 1024]
    - [32, 17109.0]
  - - [512, 55296, 1, 13, 512, 512, 13, 13]
    - [39, 6783.0]
  - - [256, 55296, 1, 512, 256, 256, 512, 512]
    - [49, 19138.0]
  - - [128, 55296, 1, 256, 128, 128, 256, 256]
    - [30, 18148.0]
  - - [1024, 6912, 1, 480, 1024, 1024, 480, 480]
    - [1, 19645.0]
  - - [1024, 6912, 1, 1024, 1024, 1024, 1024, 1024]
    - [32, 19599.0]
  - - [512, 6912, 1, 1024, 512, 512, 1024, 1024]
    - [15, 19170.0]
  - - [256, 6912, 1, 512, 256, 256, 512, 512]
    - [10, 16472.0]
  - - [1151, 1152, 1, 1152, 1151, 1151, 1152, 1152]
    - [48, 13460.0]
  - - [1153, 1152, 1, 1152, 1153, 1153, 1152, 1152]
    - [46, 13413.0]
  - - [1152, 1151, 1, 1152, 1152, 1152, 1152, 1152]
    - [40, 13561.0]
  - - [1152, 1153, 1, 1152, 1152, 1152, 1152, 1152]
    - [21, 13628.0]
  - - [1152, 1152, 1, 1151, 1152, 1152, 1151, 1151]
    - [17, 15190.0]
  - - [1152, 1152, 1, 1153, 1152, 1152, 1153, 1153]
    - [17, 15250.0]
  - - [1535, 1536, 1, 1536, 1535, 1535, 1536, 1536]
    - [15, 18899.0]
  - - [1537, 1536, 1, 1536, 1537, 1537, 1536, 1536]
    - [49, 14793.0]
  - - [1536, 1535, 1, 1536, 1536, 1536, 1536, 1536]
    - [51, 18666.0]
  - - [1536, 1537, 1, 1536, 1536, 1536, 1536, 1536]
    - [49, 14829.0]
  - - [1536, 1536, 1, 1535, 1536, 1536, 1535, 1535]
    - [24, 19265.0]
  - - [1536, 1536, 1, 1537, 1536, 1536, 1537, 1537]
    - [7, 19223.0]
  - - [1919, 1920, 1, 1920, 1919, 1919, 1920, 1920]
    - [5, 17006.0]
  - - [1921, 1920, 1, 1920, 1921, 1921, 1920, 1920]
    - [49, 16998.0]
  - - [1920, 1919, 1, 1920, 1920, 1920, 1920, 1920]
    - [41, 17012.0]
  - - [1920, 1921, 1, 1920, 1920, 1920, 1920, 1920]
    - [41, 17003.0]
  - - [1920, 1920, 1, 1919, 1920, 1920, 1919, 1919]
    - [37, 17676.0]
  - - [1920, 1920, 1, 1921, 1920, 1920, 1921, 1921]
    - [18, 17619.0]
  - - [2303, 2304, 1, 2304, 2303, 2303, 2304, 2304]
    - [32, 17986.0]
  - - [2305, 2304, 1, 2304, 2305, 2305, 2304, 2304]
    - [51, 18033.0]
  - - [2304, 2303, 1, 2304, 2304, 2304, 2304, 2304]
    - [32, 17914.0]
  - - [2304, 2305, 1, 2304, 2304, 2304, 2304, 2304]
    - [51, 18020.0]
  - - [2304, 2304, 1, 2303, 2304, 2304, 2303, 2303]
    - [19, 18610.0]
  - - [2304, 2304, 1, 2305, 2304, 2304, 2305, 2305]
    - [38, 18580.0]
  - - [2687, 2688, 1, 2688, 2687, 2687, 2688, 2688]
    - [22, 18421.0]
  - - [2689, 2688, 1, 2688, 2689, 2689, 2688, 2688]
    - [41, 18419.0]
  - - [2688, 2687, 1, 2688, 2688, 2688, 2688, 2688]
    - [41, 18429.0]
  - - [2688, 2689, 1, 2688, 2688, 2688, 2688, 2688]
    - [41, 18420.0]
  - - [2688, 2688, 1, 2687, 2688, 2688, 2687, 2687]
    - [37, 19061.0]
  - - [2688, 2688, 1, 2689, 2688, 2688, 2689, 2689]
    - [37, 19011.0]
  - - [3455, 3456, 1, 3456, 3455, 3455, 3456, 3456]
    - [41, 19093.0]
  - - [3457, 3456, 1, 3456, 3457, 3457, 3456, 3456]
    - [24, 18773.0]
  - - [3456, 3455, 1, 3456, 3456, 3456, 3456, 3456]
    - [22, 19110.0]
  - - [3456, 3457, 1, 3456, 3456, 3456, 3456, 3456]
    - [24, 18644.0]
  - - [3456, 3456, 1, 3455, 3456, 3456, 3455, 3455]
    - [37, 19720.0]
  - - [3456, 3456, 1, 3457, 3456, 3456, 3457, 3457]
    - [18, 19695.0]
  - - [3839, 3840, 1, 3840, 3839, 3839, 3840, 3840]
    - [15, 19334.0]
  - - [3841, 3840, 1, 3840, 3841, 3841, 3840, 3840]
    - [7, 19339.0]
  - - [3840, 3839, 1, 3840, 3840, 3840, 3840, 3840]
    - [32, 19339.0]
  - - [3840, 3841, 1, 3840, 3840, 3840, 3840, 3840]
    - [41, 19009.0]
  - - [3840, 3840, 1, 3839, 3840, 3840, 3839, 3839]
    - [3, 19375.0]
  - - [3840, 3840, 1, 3841, 3840, 3840, 3841, 3841]
    - [24, 19341.0]
  - - [4223, 4224, 1, 4224, 4223, 4223, 4224, 4224]
    - [22, 19421.0]
  - - [4225, 4224, 1, 4224, 4225, 4225, 4224, 4224]
    - [22, 18844.0]
  - - [4224, 4223, 1, 4224, 4224, 4224, 4224, 4224]
    - [5, 19427.0]
  - - [4224, 4225, 1, 4224, 4224, 4224, 4224, 4224]
    - [24, 19380.0]
  - - [4224, 4224, 1, 4223, 4224, 4224, 4223, 4223]
    - [18, 20036.0]
  - - [4224, 4224, 1, 4225, 4224, 4224, 4225, 4225]
    - [18, 20023.0]
  - - [4607, 4608, 1, 4608, 4607, 4607, 4608, 4608]
    - [32, 20381.0]
  - - [4609, 4608, 1, 4608, 4609, 4609, 4608, 4608]
    - [32, 19385.0]
  - - [4608, 4607, 1, 4608, 4608, 4608, 4608, 4608]
    - [51, 20377.0]
  - - [4608, 4609, 1, 4608, 4608, 4608, 4608, 4608]
    - [32, 19353.0]
  - - [4608, 4608, 1, 4607, 4608, 4608, 4607, 4607]
    - [24, 20465.0]
  - - [4608, 4608, 1, 4609, 4608, 4608, 4609, 4609]
    - [24, 20462.0]
  - - [4991, 4992, 1, 4992, 4991, 4991, 4992, 4992]
    - [24, 19685.0]
  - - [4993, 4992, 1, 4992, 4993, 4993, 4992, 4992]
    - [22, 19169.0]
  - - [4992, 4991, 1, 4992, 4992, 4992, 4992, 4992]
    - [24, 19689.0]
  - - [4992, 4993, 1, 4992, 4992, 4992, 4992, 4992]
    - [7, 19706.0]
  - - [4992, 4992, 1, 4991, 4992, 4992, 4991, 4991]
    - [18, 20218.0]
  - - [4992, 4992, 1, 4993, 4992, 4992, 4993, 4993]
    - [18, 20191.0]
  - - [5375, 5376, 1, 5376, 5375, 5375, 5376, 5376]
    - [7, 20109.0]
  - - [5377, 5376, 1, 5376, 5377, 5377, 5376, 5376]
    - [24, 19383.0]
  - - [5376, 5375, 1, 5376, 5376, 5376, 5376, 5376]
    - [7, 20084.0]
  - - [5376, 5377, 1, 5376, 5376, 5376, 5376, 5376]
    - [51, 19273.0]
  - - [5376, 5376, 1, 5375, 5376, 5376, 5375, 5375]
    - [24, 20082.0]
  - - [5376, 5376, 1, 5377, 5376, 5376, 5377, 5377]
    - [24, 20080.0]
  - - [5759, 5760, 1, 5760, 5759, 5759, 5760, 5760]
    - [24, 19861.0]
  - - [5761, 5760, 1, 5760, 5761, 5761, 5760, 5760]
    - [30, 19382.0]
  - - [5760, 5759, 1, 5760, 5760, 5760, 5760, 5760]
    - [43, 19851.0]
  - - [5760, 5761, 1, 5760, 5760, 5760, 5760, 5760]
    - [43, 19856.0]
  - - [5760, 5760, 1, 5759, 5760, 5760, 5759, 5759]
    - [37, 20011.0]
  - - [5760, 5760, 1, 5761, 5760, 5760, 5761, 5761]
    - [24, 19818.0]
  - - [6143, 6144, 1, 6144, 6143, 6143, 6144, 6144]
    - [51, 19711.0]
  - - [6145, 6144, 1, 6144, 6145, 6145, 6144, 6144]
    - [51, 19477.0]
  - - [6144, 6143, 1, 6144, 6144, 6144, 6144, 6144]
    - [51, 19641.0]
  - - [6144, 6145, 1, 6144, 6144, 6144, 6144, 6144]
    - [51, 18858.0]
  - - [6144, 6144, 1, 6143, 6144, 6144, 6143, 6143]
    - [24, 20409.0]
  - - [6144, 6144, 1, 6145, 6144, 6144, 6145, 6145]
    - [7, 20406.0]
  - - [6527, 6528, 1, 6528, 6527, 6527, 6528, 6528]
    - [24, 19843.0]
  - - [6529, 6528, 1, 6528, 6529, 6529, 6528, 6528]
    - [22, 19532.0]
  - - [6528, 6527, 1, 6528, 6528, 6528, 6528, 6528]
    - [43, 19830.0]
  - - [6528, 6529, 1, 6528, 6528, 6528, 6528, 6528]
    - [24, 19850.0]
  - - [6528, 6528, 1, 6527, 6528, 6528, 6527, 6527]
    - [24, 19777.0]
  - - [6528, 6528, 1, 6529, 6528, 6528, 6529, 6529]
    - [7, 19775.0]
  - - [6911, 6912, 1, 6912, 6911, 6911, 6912, 6912]
    - [32, 20280.0]
  - - [6913, 6912, 1, 6912, 6913, 6913, 6912, 6912]
    - [24, 19838.0]
  - - [6912, 6911, 1, 6912, 6912, 6912, 6912, 6912]
    - [32, 20296.0]
  - - [6912, 6913, 1, 6912, 6912, 6912, 6912, 6912]
    - [30, 19532.0]
  - - [6912, 6912, 1, 6911, 6912, 6912, 6911, 6911]
    - [24, 20291.0]
  - - [6912, 6912, 1, 6913, 6912, 6912, 6913, 6913]
    - [7, 20294.0]
  - - [7295, 7296, 1, 7296, 7295, 7295, 7296, 7296]
    - [30, 19853.0]
  - - [7297, 7296, 1, 7296, 7297, 7297, 7296, 7296]
    - [24, 19692.0]
  - - [7296, 7295, 1, 7296, 7296, 7296, 7296, 7296]
    - [41, 19864.0]
  - - [7296, 7297, 1, 7296, 7296, 7296, 7296, 7296]
    - [43, 19870.0]
  - - [7296, 7296, 1, 7295, 7296, 7296, 7295, 7295]
    - [37, 19984.0]
  - - [7296, 7296, 1, 7297, 7296, 7296, 7297, 7297]
    - [5, 19835.0]
  - - [7679, 7680, 1, 7680, 7679, 7679, 7680, 7680]
    - [51, 20387.0]
  - - [7681, 7680, 1, 7680, 7681, 7681, 7680, 7680]
    - [51, 19824.0]
  - - [7680, 7679, 1, 7680, 7680, 7680, 7680, 7680]
    - [51, 20357.0]
  - - [7680, 7681, 1, 7680, 7680, 7680, 7680, 7680]
    - [51, 19607.0]
  - - [7680, 7680, 1, 7679, 7680, 7680, 7679, 7679]
    - [7, 20457.0]
  - - [7680, 7680, 1, 7681, 7680, 7680, 7681, 7681]
    - [24, 20462.0]
  - - [1152, 1152, 1, 1152, 1152, 1152, 1152, 1152]
    - [40, 13541.0]
  - - [1536, 1536, 1, 1536, 1536, 1536, 1536, 1536]
    - [32, 19170.0]
  - - [1920, 1920, 1, 1920, 1920, 1920, 1920, 1920]
    - [18, 17140.0]
  - - [2304, 2304, 1, 2304, 2304, 2304, 2304, 2304]
    - [51, 18098.0]
  - - [2688, 2688, 1, 2688, 2688, 2688, 2688, 2688]
    - [22, 18425.0]
  - - [3456, 3456, 1, 3456, 3456, 3456, 3456, 3456]
    - [41, 19097.0]
  - - [3840, 3840, 1, 3840, 3840, 3840, 3840, 3840]
    - [51, 19335.0]
  - - [4224, 4224, 1, 4224, 4224, 4224, 4224, 4224]
    - [41, 19440.0]
  - - [4608, 4608, 1, 4608, 4608, 4608, 4608, 4608]
    - [32, 20425.0]
  - - [4992, 4992, 1, 4992, 4992, 4992, 4992, 4992]
    - [24, 19687.0]
  - - [5376, 5376, 1, 5376, 5376, 5376, 5376, 5376]
    - [7, 20085.0]
  - - [5760, 5760, 1, 5760, 5760, 5760, 5760, 5760]
    - [7, 19854.0]
  - - [6144, 6144, 1, 6144, 6144, 6144, 6144, 6144]
    - [51, 19638.0]
  - - [6528, 6528, 1, 6528, 6528, 6528, 6528, 6528]
    - [43, 19853.0]
  - - [6912, 6912, 1, 6912, 6912, 6912, 6912, 6912]
    - [51, 20296.0]
  - - [7296, 7296, 1, 7296, 7296, 7296, 7296, 7296]
    - [13, 19863.0]
  - - [7680, 7680, 1, 7680, 7680, 7680, 7680, 7680]
    - [51, 20342.0]
  - - [256, 128, 49, 1152, 256, 256, 1152, 1152]
    - [13, 15675.0]
  - - [256, 128, 121, 120, 256, 256, 120, 120]
    - [2, 15133.0]
  - - [256, 128, 169, 120, 256, 256, 120, 120]
    - [26, 16075.0]
  - - [256, 128, 36, 120, 256, 256, 120, 120]
    - [17, 12203.0]
  - - [256, 128, 49, 120, 256, 256, 120, 120]
    - [17, 12897.0]
  - - [256, 128, 64, 120, 256, 256, 120, 120]
    - [18, 13722.0]
  - - [256, 128, 36, 12000, 256, 256, 12000, 12000]
    - [19, 16275.0]
  - - [256, 128, 49, 1216, 256, 256, 1216, 1216]
    - [18, 16465.0]
  - - [256, 128, 121, 18, 256, 256, 18, 18]
    - [8, 5620.0]
  - - [256, 128, 169, 18, 256, 256, 18, 18]
    - [4, 6932.0]
  - - [256, 128, 36, 18, 256, 256, 18, 18]
    - [0, 4147.0]
  - - [256, 128, 49, 18, 256, 256, 18, 18]
    - [0, 4817.0]
  - - [256, 128, 64, 18, 256, 256, 18, 18]
    - [8, 5302.0]
  - - [256, 128, 36, 1800, 256, 256, 1800, 1800]
    - [47, 17560.0]
  - - [256, 128, 121, 19, 256, 256, 19, 19]
    - [4, 6461.0]
  - - [256, 128, 169, 19, 256, 256, 19, 19]
    - [4, 7197.0]
  - - [256, 128, 36, 19, 256, 256, 19, 19]
    - [8, 4277.0]
  - - [256, 128, 49, 19, 256, 256, 19, 19]
    - [8, 5034.0]
  - - [256, 128, 64, 19, 256, 256, 19, 19]
    - [0, 5519.0]
  - - [256, 128, 36, 1900, 256, 256, 1900, 1900]
    - [19, 17590.0]
  - - [256, 128, 49, 480, 256, 256, 480, 480]
    - [37, 15754.0]
  - - [256, 128, 81, 480, 256, 256, 480, 480]
    - [22, 16197.0]
  - - [256, 128, 64, 5880, 256, 256, 5880, 5880]
    - [23, 14384.0]
  - - [256, 128, 49, 72, 256, 256, 72, 72]
    - [36, 10231.0]
  - - [256, 128, 81, 72, 256, 256, 72, 72]
    - [38, 11811.0]
  - - [256, 128, 49, 76, 256, 256, 76, 76]
    - [0, 10538.0]
  - - [256, 128, 81, 76, 256, 256, 76, 76]
    - [36, 11059.0]
  - - [256, 128, 49, 7680, 256, 256, 7680, 7680]
    - [35, 12001.0]
  - - [256, 128, 64, 882, 256, 256, 882, 882]
    - [18, 16462.0]
  - - [256, 128, 64, 931, 256, 256, 931, 931]
    - [37, 16693.0]
  - - [256, 256, 49, 1152, 256, 256, 1152, 1152]
    - [15, 17389.0]
  - - [256, 256, 36, 12000, 256, 256, 12000, 12000]
    - [7, 19742.0]
  - - [256, 256, 49, 1216, 256, 256, 1216, 1216]
    - [7, 17515.0]
  - - [256, 256, 36, 1800, 256, 256, 1800, 1800]
    - [7, 19033.0]
  - - [256, 256, 36, 1900, 256, 256, 1900, 1900]
    - [43, 19072.0]
  - - [256, 256, 64, 5880, 256, 256, 5880, 5880]
    - [24, 17854.0]
  - - [256, 256, 49, 7680, 256, 256, 7680, 7680]
    - [34, 14373.0]
  - - [256, 256, 64, 882, 256, 256, 882, 882]
    - [1, 17135.0]
  - - [256, 256, 64, 931, 256, 256, 931, 931]
    - [1, 17128.0]
  - - [340, 256, 49, 1152, 340, 340, 1152, 1152]
    - [49, 15174.0]
  - - [340, 256, 36, 120, 340, 340, 120, 120]
    - [36, 12816.0]
  - - [340, 256, 49, 120, 340, 340, 120, 120]
    - [38, 13810.0]
  - - [340, 256, 64, 120, 340, 340, 120, 120]
    - [38, 14482.0]
  - - [340, 256, 36, 12000, 340, 340, 12000, 12000]
    - [24, 17698.0]
  - - [340, 256, 49, 1216, 340, 340, 1216, 1216]
    - [1, 15507.0]
  - - [340, 256, 36, 18, 340, 340, 18, 18]
    - [36, 4215.0]
  - - [340, 256, 49, 18, 340, 340, 18, 18]
    - [19, 5244.0]
  - - [340, 256, 64, 18, 340, 340, 18, 18]
    - [45, 5473.0]
  - - [340, 256, 36, 1800, 340, 340, 1800, 1800]
    - [7, 17136.0]
  - - [340, 256, 36, 19, 340, 340, 19, 19]
    - [25, 4423.0]
  - - [340, 256, 49, 19, 340, 340, 19, 19]
    - [25, 5381.0]
  - - [340, 256, 64, 19, 340, 340, 19, 19]
    - [25, 5734.0]
  - - [340, 256, 36, 1900, 340, 340, 1900, 1900]
    - [7, 17127.0]
  - - [340, 256, 64, 5880, 340, 340, 5880, 5880]
    - [18, 17184.0]
  - - [340, 256, 49, 7680, 340, 340, 7680, 7680]
    - [16, 13056.0]
  - - [340, 256, 64, 882, 340, 340, 882, 882]
    - [18, 16581.0]
  - - [340, 256, 64, 931, 340, 340, 931, 931]
    - [37, 16558.0]
  - - [510, 256, 49, 120, 510, 510, 120, 120]
    - [47, 14307.0]
  - - [510, 256, 64, 120, 510, 510, 120, 120]
    - [19, 15257.0]
  - - [510, 256, 49, 18, 510, 510, 18, 18]
    - [38, 4300.0]
  - - [510, 256, 64, 18, 510, 510, 18, 18]
    - [36, 4500.0]
  - - [510, 256, 49, 19, 510, 510, 19, 19]
    - [25, 4472.0]
  - - [510, 256, 64, 19, 510, 510, 19, 19]
    - [17, 4731.0]
  - - [510, 256, 36, 480, 510, 510, 480, 480]
    - [1, 18556.0]
  - - [510, 256, 36, 72, 510, 510, 72, 72]
    - [19, 11333.0]
  - - [510, 256, 36, 76, 510, 510, 76, 76]
    - [50, 11219.0]
  - - [510, 512, 36, 1080, 510, 510, 1080, 1080]
    - [37, 19654.0]
  - - [510, 512, 36, 162, 510, 510, 162, 162]
    - [38, 16228.0]
  - - [510, 512, 36, 171, 510, 510, 171, 171]
    - [13, 16551.0]
  - - [510, 512, 49, 1920, 510, 510, 1920, 1920]
    - [51, 19508.0]
  - - [510, 512, 64, 1920, 510, 510, 1920, 1920]
    - [22, 19238.0]
  - - [510, 512, 49, 288, 510, 510, 288, 288]
    - [22, 18379.0]
  - - [510, 512, 64, 288, 510, 510, 288, 288]
    - [1, 18741.0]
  - - [510, 512, 36, 3000, 510, 510, 3000, 3000]
    - [24, 19964.0]
  - - [510, 512, 49, 304, 510, 510, 304, 304]
    - [37, 18380.0]
  - - [510, 512, 64, 304, 510, 510, 304, 304]
    - [18, 18794.0]
  - - [510, 512, 36, 450, 510, 510, 450, 450]
    - [22, 18521.0]
  - - [510, 512, 36, 475, 510, 510, 475, 475]
    - [41, 18714.0]
  - - [510, 512, 49, 480, 510, 510, 480, 480]
    - [1, 19363.0]
  - - [510, 512, 64, 480, 510, 510, 480, 480]
    - [1, 19005.0]
  - - [510, 512, 49, 72, 510, 510, 72, 72]
    - [19, 14199.0]
  - - [510, 512, 64, 72, 510, 510, 72, 72]
    - [50, 14699.0]
  - - [510, 512, 49, 76, 510, 510, 76, 76]
    - [23, 14887.0]
  - - [510, 512, 64, 76, 510, 510, 76, 76]
    - [23, 15298.0]
  - - [512, 256, 81, 1080, 512, 512, 1080, 1080]
    - [37, 19625.0]
  - - [512, 256, 25, 12000, 512, 512, 12000, 12000]
    - [7, 18588.0]
  - - [512, 256, 81, 162, 512, 512, 162, 162]
    - [1, 17529.0]
  - - [512, 256, 81, 171, 512, 512, 171, 171]
    - [5, 18108.0]
  - - [512, 256, 25, 1800, 512, 512, 1800, 1800]
    - [7, 18044.0]
  - - [512, 256, 25, 1900, 512, 512, 1900, 1900]
    - [43, 18087.0]
  - - [512, 256, 121, 1920, 512, 512, 1920, 1920]
    - [5, 19364.0]
  - - [512, 256, 169, 1920, 512, 512, 1920, 1920]
    - [32, 19790.0]
  - - [512, 256, 49, 1920, 512, 512, 1920, 1920]
    - [41, 18615.0]
  - - [512, 256, 121, 288, 512, 512, 288, 288]
    - [22, 17608.0]
  - - [512, 256, 169, 288, 512, 512, 288, 288]
    - [5, 17602.0]
  - - [512, 256, 49, 288, 512, 512, 288, 288]
    - [1, 18684.0]
  - - [512, 256, 25, 3000, 512, 512, 3000, 3000]
    - [7, 18280.0]
  - - [512, 256, 81, 3000, 512, 512, 3000, 3000]
    - [7, 20191.0]
  - - [512, 256, 121, 304, 512, 512, 304, 304]
    - [22, 18175.0]
  - - [512, 256, 169, 304, 512, 512, 304, 304]
    - [5, 17655.0]
  - - [512, 256, 49, 304, 512, 512, 304, 304]
    - [1, 18702.0]
  - - [512, 256, 25, 450, 512, 512, 450, 450]
    - [1, 17202.0]
  - - [512, 256, 81, 450, 512, 512, 450, 450]
    - [5, 18769.0]
  - - [512, 256, 25, 475, 512, 512, 475, 475]
    - [37, 17048.0]
  - - [512, 256, 81, 475, 512, 512, 475, 475]
    - [1, 18694.0]
  - - [512, 256, 121, 480, 512, 512, 480, 480]
    - [41, 18941.0]
  - - [512, 256, 169, 480, 512, 512, 480, 480]
    - [41, 19126.0]
  - - [512, 256, 49, 5880, 512, 512, 5880, 5880]
    - [37, 19611.0]
  - - [512, 256, 121, 72, 512, 512, 72, 72]
    - [1, 16734.0]
  - - [512, 256, 169, 72, 512, 512, 72, 72]
    - [9, 17339.0]
  - - [512, 256, 121, 76, 512, 512, 76, 76]
    - [19, 16123.0]
  - - [512, 256, 169, 76, 512, 512, 76, 76]
    - [13, 16609.0]
  - - [512, 256, 49, 882, 512, 512, 882, 882]
    - [1, 18986.0]
  - - [512, 256, 49, 931, 512, 512, 931, 931]
    - [1, 19055.0]
  - - [2304, 512, 1, 100, 2304, 2304, 100, 100]
    - [38, 11387.0]
  - - [2304, 512, 1, 361, 2304, 2304, 361, 361]
    - [38, 16291.0]
  - - [4608, 510, 1, 100, 4608, 4608, 100, 100]
    - [0, 13013.0]
  - - [4608, 510, 1, 361, 4608, 4608, 361, 361]
    - [1, 16674.0]
  - - [8192, 7680, 1, 8192, 8192, 8192, 8192, 8192]
    - [32, 18161.0]
  - - [4096, 3840, 1, 4096, 4096, 4096, 4096, 4096]
    - [15, 18714.0]
  - - [2048, 1920, 1, 2048, 2048, 2048, 2048, 2048]
    - [13, 18000.0]
  - - [30522, 616, 1, 1024, 30522, 30522, 1024, 1024]
    - [13, 18312.0]
  - - [128, 128, 128, 64, 128, 128, 64, 64]
    - [19, 10585.0]
  - - [128, 128, 160, 64, 128, 128, 64, 64]
    - [6, 11170.0]
  - - [1024, 1280, 1, 1024, 1024, 1024, 1024, 1024]
    - [29, 13497.0]
  - - [1024, 1280, 1, 4096, 1024, 1024, 4096, 4096]
    - [30, 13443.0]
  - - [4096, 1280, 1, 1024, 4096, 4096, 1024, 1024]
    - [13, 18665.0]
  - - [30522, 200, 1, 1024, 30522, 30522, 1024, 1024]
    - [15, 14225.0]
  - - [128, 128, 624, 64, 128, 128, 64, 64]
    - [27, 13564.0]
  - - [1024, 4992, 1, 1024, 1024, 1024, 1024, 1024]
    - [30, 18281.0]
  - - [1024, 4992, 1, 4096, 1024, 1024, 4096, 4096]
    - [32, 17484.0]
  - - [4096, 4992, 1, 1024, 4096, 4096, 1024, 1024]
    - [13, 19421.0]
  - - [30522, 780, 1, 1024, 30522, 30522, 1024, 1024]
    - [13, 16907.0]
  - - [30522, 308, 1, 1024, 30522, 30522, 1024, 1024]
    - [13, 15403.0]
  - - [128, 128, 640, 64, 128, 128, 64, 64]
    - [10, 14340.0]
  - - [1024, 5120, 1, 1024, 1024, 1024, 1024, 1024]
    - [30, 18728.0]
  - - [1024, 5120, 1, 4096, 1024, 1024, 4096, 4096]
    - [32, 17935.0]
  - - [4096, 5120, 1, 1024, 4096, 4096, 1024, 1024]
    - [15, 19653.0]
  - - [30522, 800, 1, 1024, 30522, 30522, 1024, 1024]
    - [13, 17321.0]
  - - [128, 128, 656, 64, 128, 128, 64, 64]
    - [4, 13594.0]
  - - [1024, 5248, 1, 1024, 1024, 1024, 1024, 1024]
    - [32, 17769.0]
  - - [1024, 5248, 1, 4096, 1024, 1024, 4096, 4096]
    - [51, 18297.0]
  - - [4096, 5248, 1, 1024, 4096, 4096, 1024, 1024]
    - [13, 19409.0]
  - - [30522, 820, 1, 1024, 30522, 30522, 1024, 1024]
    - [13, 17733.0]
  - - [512, 512, 80, 64, 512, 512, 64, 64]
    - [38, 17287.0]
  - - [1024, 2560, 1, 1024, 1024, 1024, 1024, 1024]
    - [30, 16430.0]
  - - [1024, 2560, 1, 4096, 1024, 1024, 4096, 4096]
    - [13, 16005.0]
  - - [4096, 2560, 1, 1024, 4096, 4096, 1024, 1024]
    - [15, 19493.0]
  - - [30522, 385, 1, 1024, 30522, 30522, 1024, 1024]
    - [13, 14425.0]
  - - [30522, 462, 1, 1024, 30522, 30522, 1024, 1024]
    - [13, 17229.0]
  - - [128, 128, 144, 64, 128, 128, 64, 64]
    - [50, 10216.0]
  - - [1024, 1152, 1, 1024, 1024, 1024, 1024, 1024]
    - [13, 16232.0]
  - - [1024, 1152, 1, 4096, 1024, 1024, 4096, 4096]
    - [30, 17033.0]
  - - [4096, 1152, 1, 1024, 4096, 4096, 1024, 1024]
    - [13, 18700.0]
  - - [30522, 180, 1, 1024, 30522, 30522, 1024, 1024]
    - [12, 14579.0]
  - - [1024, 8192, 1, 1024, 1024, 1024, 1024, 1024]
    - [30, 18297.0]
  - - [1024, 8192, 1, 4096, 1024, 1024, 4096, 4096]
    - [15, 17515.0]
  - - [1024, 9600, 1, 1024, 1024, 1024, 1024, 1024]
    - [13, 18974.0]
  - - [1024, 9600, 1, 4096, 1024, 1024, 4096, 4096]
    - [15, 18264.0]
  - - [4096, 8192, 1, 1024, 4096, 4096, 1024, 1024]
    - [13, 19459.0]
  - - [4096, 9600, 1, 1024, 4096, 4096, 1024, 1024]
    - [13, 19262.0]
  - - [33712, 8192, 1, 1024, 33712, 33712, 1024, 1024]
    - [51, 20159.0]
  - - [33712, 9600, 1, 1024, 33712, 33712, 1024, 1024]
    - [51, 19866.0]
  - - [1024, 10064, 1, 1024, 1024, 1024, 1024, 1024]
    - [32, 19104.0]
  - - [1024, 10064, 1, 4096, 1024, 1024, 4096, 4096]
    - [32, 19115.0]
  - - [1024, 10080, 1, 1024, 1024, 1024, 1024, 1024]
    - [32, 19131.0]
  - - [1024, 10080, 1, 4096, 1024, 1024, 4096, 4096]
    - [15, 19039.0]
  - - [1024, 6528, 1, 1024, 1024, 1024, 1024, 1024]
    - [32, 18265.0]
  - - [1024, 6528, 1, 4096, 1024, 1024, 4096, 4096]
    - [15, 18735.0]
  - - [1024, 7104, 1, 1024, 1024, 1024, 1024, 1024]
    - [30, 18034.0]
  - - [1024, 7104, 1, 4096, 1024, 1024, 4096, 4096]
    - [15, 17804.0]
  - - [1024, 8064, 1, 1024, 1024, 1024, 1024, 1024]
    - [13, 19149.0]
  - - [1024, 8064, 1, 4096, 1024, 1024, 4096, 4096]
    - [15, 17565.0]
  - - [1024, 9216, 1, 1024, 1024, 1024, 1024, 1024]
    - [32, 19658.0]
  - - [1024, 9216, 1, 4096, 1024, 1024, 4096, 4096]
    - [15, 19624.0]
  - - [4096, 10064, 1, 1024, 4096, 4096, 1024, 1024]
    - [13, 19157.0]
  - - [4096, 10080, 1, 1024, 4096, 4096, 1024, 1024]
    - [13, 19166.0]
  - - [4096, 6528, 1, 1024, 4096, 4096, 1024, 1024]
    - [13, 19349.0]
  - - [4096, 7104, 1, 1024, 4096, 4096, 1024, 1024]
    - [15, 19348.0]
  - - [4096, 8064, 1, 1024, 4096, 4096, 1024, 1024]
    - [13, 19435.0]
  - - [4096, 9216, 1, 1024, 4096, 4096, 1024, 1024]
    - [13, 19339.0]
  - - [42720, 10080, 1, 1024, 42720, 42720, 1024, 1024]
    - [51, 19970.0]
  - - [42720, 6528, 1, 1024, 42720, 42720, 1024, 1024]
    - [49, 19911.0]
  - - [42720, 7104, 1, 1024, 42720, 42720, 1024, 1024]
    - [51, 19948.0]
  - - [1024, 32768, 1, 480, 1024, 1024, 480, 480]
    - [1, 20231.0]
  - - [30592, 1024, 1, 2048, 30592, 30592, 2048, 2048]
    - [49, 19501.0]
  - - [6144, 1024, 1, 2048, 6144, 6144, 2048, 2048]
    - [13, 18696.0]
  - - [8192, 1024, 1, 2048, 8192, 8192, 2048, 2048]
    - [13, 18520.0]
  - - [30592, 8192, 1, 1024, 30592, 30592, 1024, 1024]
    - [51, 20172.0]
  - - [3072, 8192, 1, 1024, 3072, 3072, 1024, 1024]
    - [30, 19542.0]
  - - [512, 512, 256, 64, 512, 512, 64, 64]
    - [0, 9528.0]
  - - [30592, 2048, 1, 1024, 30592, 30592, 1024, 1024]
    - [51, 19830.0]
  - - [30592, 4096, 1, 1024, 30592, 30592, 1024, 1024]
    - [51, 20085.0]
  - - [3072, 4096, 1, 1024, 3072, 3072, 1024, 1024]
    - [32, 19328.0]
  - - [1920, 2048, 1, 2560, 1920, 1920, 2560, 2560]
    - [13, 18172.0]
  - - [2560, 2048, 1, 2560, 2560, 2560, 2560, 2560]
    - [30, 19030.0]
  - - [2560, 2048, 1, 640, 2560, 2560, 640, 640]
    - [41, 18775.0]
  - - [7680, 2048, 1, 2560, 7680, 7680, 2560, 2560]
    - [13, 19492.0]
  - - [512, 512, 40, 64, 512, 512, 64, 64]
    - [38, 16416.0]
  - - [1536, 4096, 1, 1536, 1536, 1536, 1536, 1536]
    - [30, 18745.0]
  - - [1536, 4096, 1, 6144, 1536, 1536, 6144, 6144]
    - [13, 18351.0]
  - - [4608, 4096, 1, 1536, 4608, 4608, 1536, 1536]
    - [32, 20255.0]
  - - [50304, 4096, 1, 1536, 50304, 50304, 1536, 1536]
    - [32, 20338.0]
  - - [6144, 4096, 1, 1536, 6144, 6144, 1536, 1536]
    - [13, 19566.0]
  - - [1024, 1024, 64, 96, 1024, 1024, 96, 96]
    - [0, 14231.0]
  - - [1536, 8192, 1, 1536, 1536, 1536, 1536, 1536]
    - [32, 19578.0]
  - - [1536, 8192, 1, 6144, 1536, 1536, 6144, 6144]
    - [32, 19582.0]
  - - [4608, 8192, 1, 1536, 4608, 4608, 1536, 1536]
    - [32, 20204.0]
  - - [50304, 8192, 1, 1536, 50304, 50304, 1536, 1536]
    - [32, 20361.0]
  - - [6144, 8192, 1, 1536, 6144, 6144, 1536, 1536]
    - [15, 19831.0]
  - - [1024, 1024, 128, 96, 1024, 1024, 96, 96]
    - [0, 13912.0]
  - - [1024, 16384, 1, 1024, 1024, 1024, 1024, 1024]
    - [30, 19250.0]
  - - [1024, 16384, 1, 4096, 1024, 1024, 4096, 4096]
    - [32, 18892.0]
  - - [3072, 16384, 1, 1024, 3072, 3072, 1024, 1024]
    - [30, 19543.0]
  - - [4096, 16384, 1, 1024, 4096, 4096, 1024, 1024]
    - [13, 19456.0]
  - - [50304, 16384, 1, 1024, 50304, 50304, 1024, 1024]
    - [51, 20258.0]
  - - [1024, 1024, 256, 64, 1024, 1024, 64, 64]
    - [12, 10691.0]
  - - [50304, 2048, 1, 1024, 50304, 50304, 1024, 1024]
    - [51, 20118.0]
  - - [1024, 1024, 32, 64, 1024, 1024, 64, 64]
    - [0, 16076.0]
  - - [50304, 4096, 1, 1024, 50304, 50304, 1024, 1024]
    - [51, 20222.0]
  - - [1024, 1024, 64, 64, 1024, 1024, 64, 64]
    - [0, 13035.0]
  - - [50304, 8192, 1, 1024, 50304, 50304, 1024, 1024]
    - [51, 20264.0]
  - - [1024, 1024, 128, 64, 1024, 1024, 64, 64]
    - [0, 11171.0]
  - - [30528, 8192, 1, 1024, 30528, 30528, 1024, 1024]
    - [51, 20141.0]
  - - [128, 128, 1024, 64, 128, 128, 64, 64]
    - [14, 15174.0]
  - - [1024, 3456, 1, 1024, 1024, 1024, 1024, 1024]
    - [30, 18299.0]
  - - [1024, 3456, 1, 480, 1024, 1024, 480, 480]
    - [1, 18988.0]
  - - [512, 3456, 1, 1024, 512, 512, 1024, 1024]
    - [14, 16874.0]
  - - [512, 3456, 1, 13, 512, 512, 13, 13]
    - [31, 4213.0]
  - - [512, 4096, 1, 13, 512, 512, 13, 13]
    - [31, 4574.0]
  - - [512, 6912, 1, 13, 512, 512, 13, 13]
    - [36, 5181.0]
  - - [30528, 640, 1, 1024, 30528, 30528, 1024, 1024]
    - [13, 19098.0]
  - - [30528, 1280, 1, 1024, 30528, 30528, 1024, 1024]
    - [13, 19589.0]
  - - [30528, 1600, 1, 1024, 30528, 30528, 1024, 1024]
    - [13, 18903.0]
  - - [1024, 10240, 1, 1024, 1024, 1024, 1024, 1024]
    - [32, 19516.0]
  - - [4096, 10240, 1, 1024, 4096, 4096, 1024, 1024]
    - [13, 19406.0]
  - - [1024, 10240, 1, 4096, 1024, 1024, 4096, 4096]
    - [32, 19280.0]
  - - [128, 128, 1280, 64, 128, 128, 64, 64]
    - [0, 6991.0]
  - - [1024, 10496, 1, 4096, 1024, 1024, 4096, 4096]
    - [15, 18349.0]
  - - [30528, 1640, 1, 1024, 30528, 30528, 1024, 1024]
    - [13, 19400.0]
  - - [4096, 10496, 1, 1024, 4096, 4096, 1024, 1024]
    - [13, 19328.0]
  - - [1024, 10496, 1, 1024, 1024, 1024, 1024, 1024]
    - [13, 18690.0]
  - - [128, 128, 1312, 64, 128, 128, 64, 64]
    - [0, 7555.0]
  - - [30528, 160, 1, 1024, 30528, 30528, 1024, 1024]
    - [12, 13148.0]
  - - [30528, 240, 1, 1024, 30528, 30528, 1024, 1024]
    - [30, 17023.0]
  - - [1024, 6144, 1, 1024, 1024, 1024, 1024, 1024]
    - [30, 18493.0]
  - - [4096, 6144, 1, 1024, 4096, 4096, 1024, 1024]
    - [13, 19502.0]
  - - [1024, 6144, 1, 4096, 1024, 1024, 4096, 4096]
    - [32, 18010.0]
  - - [512, 512, 192, 64, 512, 512, 64, 64]
    - [0, 12676.0]
  - - [1024, 10224, 1, 1024, 1024, 1024, 1024, 1024]
    - [32, 19356.0]
  - - [1024, 10192, 1, 1024, 1024, 1024, 1024, 1024]
    - [32, 19416.0]
  - - [1024, 10208, 1, 1024, 1024, 1024, 1024, 1024]
    - [32, 19476.0]
  - - [1024, 10224, 1, 4096, 1024, 1024, 4096, 4096]
    - [32, 19417.0]
  - - [4096, 10224, 1, 1024, 4096, 4096, 1024, 1024]
    - [13, 19312.0]
  - - [3072, 10224, 1, 1024, 3072, 3072, 1024, 1024]
    - [30, 19391.0]
  - - [3072, 10240, 1, 1024, 3072, 3072, 1024, 1024]
    - [30, 19373.0]
  - - [1024, 10192, 1, 4096, 1024, 1024, 4096, 4096]
    - [32, 19264.0]
  - - [4096, 10192, 1, 1024, 4096, 4096, 1024, 1024]
    - [13, 19321.0]
  - - [3072, 10192, 1, 1024, 3072, 3072, 1024, 1024]
    - [30, 19247.0]
  - - [3072, 10200, 1, 1024, 3072, 3072, 1024, 1024]
    - [32, 19334.0]
  - - [1024, 10184, 1, 1024, 1024, 1024, 1024, 1024]
    - [32, 19294.0]
  - - [3072, 10208, 1, 1024, 3072, 3072, 1024, 1024]
    - [30, 19322.0]
  - - [1024, 10208, 1, 4096, 1024, 1024, 4096, 4096]
    - [15, 18706.0]
  - - [4096, 10208, 1, 1024, 4096, 4096, 1024, 1024]
    - [13, 19245.0]
  - - [2048, 10224, 1, 1024, 2048, 2048, 1024, 1024]
    - [15, 19673.0]
  - - [2048, 10240, 1, 1024, 2048, 2048, 1024, 1024]
    - [15, 19805.0]
  - - [1024, 10120, 1, 1024, 1024, 1024, 1024, 1024]
    - [32, 19213.0]
  - - [2048, 10192, 1, 1024, 2048, 2048, 1024, 1024]
    - [15, 19623.0]
  - - [1024, 10152, 1, 1024, 1024, 1024, 1024, 1024]
    - [32, 19248.0]
  - - [3072, 10080, 1, 1024, 3072, 3072, 1024, 1024]
    - [13, 19345.0]
  - - [256, 256, 25, 12544, 256, 256, 12544, 12544]
    - [13, 15324.0]
  - - [256, 256, 49, 3200, 256, 256, 3200, 3200]
    - [32, 17155.0]
  - - [256, 256, 25, 6272, 256, 256, 6272, 6272]
    - [30, 16438.0]
  - - [256, 256, 49, 6400, 256, 256, 6400, 6400]
    - [32, 15575.0]
  - - [512, 512, 49, 1152, 512, 512, 1152, 1152]
    - [24, 19487.0]
  - - [512, 512, 25, 2048, 512, 512, 2048, 2048]
    - [13, 15352.0]
  - - [512, 512, 49, 2304, 512, 512, 2304, 2304]
    - [51, 19843.0]
  - - [512, 512, 25, 4096, 512, 512, 4096, 4096]
    - [53, 14616.0]
  - - [128, 128, 2048, 64, 128, 128, 64, 64]
    - [0, 6359.0]
  - - [30528, 2560, 1, 1024, 30528, 30528, 1024, 1024]
    - [13, 19810.0]
  - - [128, 128, 1536, 64, 128, 128, 64, 64]
    - [0, 6196.0]
  - - [1024, 12288, 1, 1024, 1024, 1024, 1024, 1024]
    - [32, 19337.0]
  - - [1024, 12288, 1, 4096, 1024, 1024, 4096, 4096]
    - [32, 19251.0]
  - - [30528, 1920, 1, 1024, 30528, 30528, 1024, 1024]
    - [13, 19728.0]
  - - [4096, 12288, 1, 1024, 4096, 4096, 1024, 1024]
    - [13, 19329.0]
  - - [128, 128, 81, 12544, 128, 128, 12544, 12544]
    - [33, 10556.0]
  - - [128, 128, 121, 9216, 128, 128, 9216, 9216]
    - [52, 9078.0]
  - - [128, 128, 169, 6400, 128, 128, 6400, 6400]
    - [52, 11285.0]
  - - [256, 256, 36, 4096, 256, 256, 4096, 4096]
    - [34, 12639.0]
  - - [256, 256, 49, 2304, 256, 256, 2304, 2304]
    - [15, 16543.0]
  - - [256, 256, 64, 2304, 256, 256, 2304, 2304]
    - [51, 15969.0]
  - - [256, 256, 81, 4096, 256, 256, 4096, 4096]
    - [53, 11935.0]
  - - [256, 256, 121, 2304, 256, 256, 2304, 2304]
    - [32, 16466.0]
  - - [256, 256, 169, 2304, 256, 256, 2304, 2304]
    - [32, 16663.0]
  - - [512, 512, 81, 1024, 512, 512, 1024, 1024]
    - [49, 17047.0]
  - - [512, 512, 121, 1024, 512, 512, 1024, 1024]
    - [13, 17177.0]
  - - [512, 512, 169, 1024, 512, 512, 1024, 1024]
    - [49, 17467.0]
  - - [512, 512, 36, 1024, 512, 512, 1024, 1024]
    - [13, 16444.0]
  - - [512, 512, 49, 1024, 512, 512, 1024, 1024]
    - [30, 15965.0]
  - - [512, 512, 64, 1024, 512, 512, 1024, 1024]
    - [30, 16374.0]
  - - [128, 128, 192, 64, 128, 128, 64, 64]
    - [42, 10356.0]
  - - [768, 2048, 1, 768, 768, 768, 768, 768]
    - [49, 15475.0]
  - - [3072, 2048, 1, 768, 3072, 3072, 768, 768]
    - [30, 18584.0]
  - - [768, 2048, 1, 3072, 768, 768, 3072, 3072]
    - [49, 16011.0]
  - - [384, 384, 144, 64, 384, 384, 64, 64]
    - [18, 17741.0]
  - - [768, 4608, 1, 768, 768, 768, 768, 768]
    - [32, 19001.0]
  - - [3072, 4608, 1, 768, 3072, 3072, 768, 768]
    - [15, 19833.0]
  - - [768, 4608, 1, 3072, 768, 768, 3072, 3072]
    - [32, 19748.0]
  - - [512, 512, 48, 64, 512, 512, 64, 64]
    - [38, 16975.0]
  - - [128, 128, 256, 64, 128, 128, 64, 64]
    - [21, 12509.0]
  - - [384, 384, 192, 64, 384, 384, 64, 64]
    - [0, 14109.0]
  - - [1024, 4608, 1, 1024, 1024, 1024, 1024, 1024]
    - [15, 19062.0]
  - - [4096, 4608, 1, 1024, 4096, 4096, 1024, 1024]
    - [15, 19972.0]
  - - [1024, 4608, 1, 4096, 1024, 1024, 4096, 4096]
    - [15, 19941.0]
  - - [256, 256, 36, 432, 256, 256, 432, 432]
    - [1, 17994.0]
  - - [256, 256, 36, 456, 256, 256, 456, 456]
    - [1, 18259.0]
  - - [256, 256, 36, 504, 256, 256, 504, 504]
    - [1, 18361.0]
  - - [256, 256, 49, 1120, 256, 256, 1120, 1120]
    - [37, 17558.0]
  - - [256, 256, 36, 442, 256, 256, 442, 442]
    - [1, 17415.0]
  - - [256, 256, 49, 950, 256, 256, 950, 950]
    - [18, 17449.0]
  - - [256, 256, 64, 616, 256, 256, 616, 616]
    - [1, 17352.0]
  - - [256, 256, 64, 660, 256, 256, 660, 660]
    - [1, 17254.0]
  - - [256, 256, 36, 408, 256, 256, 408, 408]
    - [1, 17979.0]
  - - [256, 256, 49, 1008, 256, 256, 1008, 1008]
    - [37, 17680.0]
  - - [256, 256, 36, 462, 256, 256, 462, 462]
    - [1, 17834.0]
  - - [256, 256, 36, 468, 256, 256, 468, 468]
    - [1, 18018.0]
  - - [256, 256, 36, 494, 256, 256, 494, 494]
    - [1, 18081.0]
  - - [512, 512, 64, 48, 512, 512, 48, 48]
    - [38, 16308.0]
  - - [256, 256, 64, 140, 256, 256, 140, 140]
    - [38, 15205.0]
  - - [512, 512, 64, 56, 512, 512, 56, 56]
    - [27, 17076.0]
  - - [512, 512, 49, 90, 512, 512, 90, 90]
    - [19, 17041.0]
  - - [512, 512, 49, 60, 512, 512, 60, 60]
    - [19, 16003.0]
  - - [256, 256, 49, 864, 256, 256, 864, 864]
    - [43, 17415.0]
  - - [256, 256, 64, 224, 256, 256, 224, 224]
    - [17, 16460.0]
  - - [256, 256, 64, 176, 256, 256, 176, 176]
    - [1, 16267.0]
  - - [256, 256, 64, 154, 256, 256, 154, 154]
    - [1, 15632.0]
  - - [512, 512, 49, 80, 512, 512, 80, 80]
    - [1, 17748.0]
  - - [256, 256, 49, 1200, 256, 256, 1200, 1200]
    - [18, 17575.0]
  - - [256, 256, 64, 704, 256, 256, 704, 704]
    - [37, 17234.0]
  - - [256, 256, 64, 768, 256, 256, 768, 768]
    - [51, 17118.0]
  - - [256, 256, 49, 1160, 256, 256, 1160, 1160]
    - [20, 17350.0]
  - - [256, 256, 49, 320, 256, 256, 320, 320]
    - [18, 16270.0]
  - - [512, 512, 49, 70, 512, 512, 70, 70]
    - [19, 16301.0]
  - - [256, 256, 49, 1240, 256, 256, 1240, 1240]
    - [24, 17419.0]
  - - [256, 256, 36, 384, 256, 256, 384, 384]
    - [32, 16544.0]
  - - [1024, 2048, 1, 888, 1024, 1024, 888, 888]
    - [24, 17041.0]
  - - [1024, 2048, 1, 713, 1024, 1024, 713, 713]
    - [24, 16835.0]
  - - [1024, 2048, 1, 660, 1024, 1024, 660, 660]
    - [20, 16757.0]
  - - [1024, 2048, 1, 726, 1024, 1024, 726, 726]
    - [24, 16783.0]
  - - [1024, 2048, 1, 672, 1024, 1024, 672, 672]
    - [24, 16898.0]
  - - [1024, 2048, 1, 850, 1024, 1024, 850, 850]
    - [24, 16945.0]
  - - [1024, 2048, 1, 805, 1024, 1024, 805, 805]
    - [24, 16848.0]
  - - [1024, 2048, 1, 864, 1024, 1024, 864, 864]
    - [24, 17100.0]
  - - [1024, 2048, 1, 768, 1024, 1024, 768, 768]
    - [32, 16795.0]
  - - [1024, 2048, 1, 950, 1024, 1024, 950, 950]
    - [24, 17057.0]
  - - [1024, 1024, 160, 96, 1024, 1024, 96, 96]
    - [0, 14626.0]
  - - [2880, 16384, 1, 1920, 2880, 2880, 1920, 1920]
    - [7, 19741.0]
  - - [1920, 16384, 1, 960, 1920, 1920, 960, 960]
    - [37, 20263.0]
  - - [3840, 16384, 1, 1920, 3840, 3840, 1920, 1920]
    - [24, 20284.0]
  - - [1920, 16384, 1, 3840, 1920, 1920, 3840, 3840]
    - [24, 20238.0]
  - - [25216, 16384, 1, 1920, 25216, 25216, 1920, 1920]
    - [24, 20407.0]
  - - [1024, 1024, 40, 96, 1024, 1024, 96, 96]
    - [0, 17769.0]
  - - [2880, 4096, 1, 1920, 2880, 2880, 1920, 1920]
    - [22, 18736.0]
  - - [1920, 4096, 1, 960, 1920, 1920, 960, 960]
    - [37, 19190.0]
  - - [3840, 4096, 1, 1920, 3840, 3840, 1920, 1920]
    - [5, 19518.0]
  - - [1920, 4096, 1, 3840, 1920, 1920, 3840, 3840]
    - [51, 19275.0]
  - - [25216, 4096, 1, 1920, 25216, 25216, 1920, 1920]
    - [24, 20333.0]
  - - [1024, 1024, 80, 96, 1024, 1024, 96, 96]
    - [0, 15891.0]
  - - [2880, 8192, 1, 1920, 2880, 2880, 1920, 1920]
    - [24, 19465.0]
  - - [1920, 8192, 1, 960, 1920, 1920, 960, 960]
    - [37, 20110.0]
  - - [3840, 8192, 1, 1920, 3840, 3840, 1920, 1920]
    - [24, 20167.0]
  - - [1920, 8192, 1, 3840, 1920, 1920, 3840, 3840]
    - [30, 19577.0]
  - - [25216, 8192, 1, 1920, 25216, 25216, 1920, 1920]
    - [43, 20374.0]
  - - [1024, 1024, 96, 96, 1024, 1024, 96, 96]
    - [0, 15273.0]
  - - [1728, 16384, 1, 2304, 1728, 1728, 2304, 2304]
    - [43, 19439.0]
  - - [2304, 16384, 1, 576, 2304, 2304, 576, 576]
    - [1, 20330.0]
  - - [2304, 16384, 1, 2304, 2304, 2304, 2304, 2304]
    - [51, 20403.0]
  - - [12672, 16384, 1, 2304, 12672, 12672, 2304, 2304]
    - [7, 20410.0]
  - - [1024, 1024, 24, 96, 1024, 1024, 96, 96]
    - [9, 18510.0]
  - - [1728, 4096, 1, 2304, 1728, 1728, 2304, 2304]
    - [13, 17974.0]
  - - [2304, 4096, 1, 576, 2304, 2304, 576, 576]
    - [37, 20024.0]
  - - [2304, 4096, 1, 2304, 2304, 2304, 2304, 2304]
    - [32, 20210.0]
  - - [12672, 4096, 1, 2304, 12672, 12672, 2304, 2304]
    - [7, 20094.0]
  - - [1024, 1024, 48, 96, 1024, 1024, 96, 96]
    - [0, 17452.0]
  - - [1728, 8192, 1, 2304, 1728, 1728, 2304, 2304]
    - [13, 18897.0]
  - - [2304, 8192, 1, 576, 2304, 2304, 576, 576]
    - [37, 20245.0]
  - - [2304, 8192, 1, 2304, 2304, 2304, 2304, 2304]
    - [24, 20289.0]
  - - [12672, 8192, 1, 2304, 12672, 12672, 2304, 2304]
    - [24, 20332.0]
  - - [1024, 1024, 16, 96, 1024, 1024, 96, 96]
    - [1, 18117.0]
  - - [1152, 4096, 1, 3072, 1152, 1152, 3072, 3072]
    - [32, 19930.0]
  - - [3072, 4096, 1, 384, 3072, 3072, 384, 384]
    - [24, 18925.0]
  - - [1536, 4096, 1, 3072, 1536, 1536, 3072, 3072]
    - [49, 18745.0]
  - - [3072, 4096, 1, 1536, 3072, 3072, 1536, 1536]
    - [15, 19553.0]
  - - [6400, 4096, 1, 3072, 6400, 6400, 3072, 3072]
    - [15, 19734.0]
  - - [1024, 1024, 32, 96, 1024, 1024, 96, 96]
    - [0, 17822.0]
  - - [1152, 8192, 1, 3072, 1152, 1152, 3072, 3072]
    - [51, 20211.0]
  - - [3072, 8192, 1, 384, 3072, 3072, 384, 384]
    - [5, 19369.0]
  - - [1536, 8192, 1, 3072, 1536, 1536, 3072, 3072]
    - [51, 19657.0]
  - - [3072, 8192, 1, 1536, 3072, 3072, 1536, 1536]
    - [30, 19552.0]
  - - [6400, 8192, 1, 3072, 6400, 6400, 3072, 3072]
    - [32, 20133.0]
  - - [2048, 4096, 1, 2048, 2048, 2048, 2048, 2048]
    - [13, 18467.0]
  - - [2048, 4096, 1, 4096, 2048, 2048, 4096, 4096]
    - [13, 18331.0]
  - - [29000, 199, 1, 2048, 29000, 29000, 2048, 2048]
    - [51, 13146.0]
  - - [29000, 221, 1, 2048, 29000, 29000, 2048, 2048]
    - [51, 13606.0]
  - - [29000, 224, 1, 2048, 29000, 29000, 2048, 2048]
    - [32, 14244.0]
  - - [29000, 229, 1, 2048, 29000, 29000, 2048, 2048]
    - [51, 14120.0]
  - - [29000, 234, 1, 2048, 29000, 29000, 2048, 2048]
    - [51, 14945.0]
  - - [29000, 242, 1, 2048, 29000, 29000, 2048, 2048]
    - [32, 15601.0]
  - - [29000, 246, 1, 2048, 29000, 29000, 2048, 2048]
    - [51, 15469.0]
  - - [29000, 247, 1, 2048, 29000, 29000, 2048, 2048]
    - [51, 15508.0]
  - - [29000, 256, 1, 2048, 29000, 29000, 2048, 2048]
    - [32, 15877.0]
  - - [29000, 262, 1, 2048, 29000, 29000, 2048, 2048]
    - [22, 11110.0]
  - - [29000, 264, 1, 2048, 29000, 29000, 2048, 2048]
    - [30, 11206.0]
  - - [29000, 265, 1, 2048, 29000, 29000, 2048, 2048]
    - [48, 11161.0]
  - - [29000, 274, 1, 2048, 29000, 29000, 2048, 2048]
    - [48, 11395.0]
  - - [29000, 277, 1, 2048, 29000, 29000, 2048, 2048]
    - [30, 11691.0]
  - - [29000, 279, 1, 2048, 29000, 29000, 2048, 2048]
    - [30, 11697.0]
  - - [29000, 288, 1, 2048, 29000, 29000, 2048, 2048]
    - [30, 12225.0]
  - - [29000, 296, 1, 2048, 29000, 29000, 2048, 2048]
    - [30, 12142.0]
  - - [29000, 315, 1, 2048, 29000, 29000, 2048, 2048]
    - [40, 13144.0]
  - - [29000, 335, 1, 2048, 29000, 29000, 2048, 2048]
    - [30, 13907.0]
  - - [4096, 4096, 1, 2048, 4096, 4096, 2048, 2048]
    - [13, 19427.0]
  - - [29000, 2283, 1, 1024, 29000, 29000, 1024, 1024]
    - [13, 19588.0]
  - - [29000, 2296, 1, 1024, 29000, 29000, 1024, 1024]
    - [15, 19841.0]
  - - [29000, 2306, 1, 1024, 29000, 29000, 1024, 1024]
    - [13, 18796.0]
  - - [29000, 2309, 1, 1024, 29000, 29000, 1024, 1024]
    - [13, 18809.0]
  - - [29000, 2318, 1, 1024, 29000, 29000, 1024, 1024]
    - [13, 18890.0]
  - - [29000, 2320, 1, 1024, 29000, 29000, 1024, 1024]
    - [13, 18911.0]
  - - [29000, 2324, 1, 1024, 29000, 29000, 1024, 1024]
    - [13, 18937.0]
  - - [29000, 2325, 1, 1024, 29000, 29000, 1024, 1024]
    - [13, 18941.0]
  - - [29000, 2329, 1, 1024, 29000, 29000, 1024, 1024]
    - [13, 18972.0]
  - - [29000, 2338, 1, 1024, 29000, 29000, 1024, 1024]
    - [13, 19049.0]
  - - [29000, 2345, 1, 1024, 29000, 29000, 1024, 1024]
    - [13, 19107.0]
  - - [29000, 2350, 1, 1024, 29000, 29000, 1024, 1024]
    - [13, 19149.0]
  - - [29000, 2362, 1, 1024, 29000, 29000, 1024, 1024]
    - [13, 19242.0]
  - - [29000, 2366, 1, 1024, 29000, 29000, 1024, 1024]
    - [13, 19268.0]
  - - [29000, 2368, 1, 1024, 29000, 29000, 1024, 1024]
    - [13, 19295.0]
  - - [29000, 2374, 1, 1024, 29000, 29000, 1024, 1024]
    - [13, 19341.0]
  - - [29000, 2390, 1, 1024, 29000, 29000, 1024, 1024]
    - [13, 19471.0]
  - - [512, 512, 320, 64, 512, 512, 64, 64]
    - [0, 10600.0]
  - - [29000, 561, 1, 1024, 29000, 29000, 1024, 1024]
    - [13, 16888.0]
  - - [29000, 574, 1, 1024, 29000, 29000, 1024, 1024]
    - [13, 17260.0]
  - - [29000, 600, 1, 1024, 29000, 29000, 1024, 1024]
    - [13, 17998.0]
  - - [29000, 608, 1, 1024, 29000, 29000, 1024, 1024]
    - [13, 18247.0]
  - - [29000, 615, 1, 1024, 29000, 29000, 1024, 1024]
    - [13, 18449.0]
  - - [29000, 622, 1, 1024, 29000, 29000, 1024, 1024]
    - [13, 18660.0]
  - - [29000, 625, 1, 1024, 29000, 29000, 1024, 1024]
    - [13, 18717.0]
  - - [29000, 626, 1, 1024, 29000, 29000, 1024, 1024]
    - [13, 18799.0]
  - - [29000, 628, 1, 1024, 29000, 29000, 1024, 1024]
    - [13, 18838.0]
  - - [29000, 636, 1, 1024, 29000, 29000, 1024, 1024]
    - [13, 19036.0]
  - - [29000, 651, 1, 1024, 29000, 29000, 1024, 1024]
    - [15, 16597.0]
  - - [29000, 658, 1, 1024, 29000, 29000, 1024, 1024]
    - [13, 16688.0]
  - - [29000, 669, 1, 1024, 29000, 29000, 1024, 1024]
    - [15, 17054.0]
  - - [29000, 670, 1, 1024, 29000, 29000, 1024, 1024]
    - [13, 17043.0]
  - - [29000, 672, 1, 1024, 29000, 29000, 1024, 1024]
    - [15, 17086.0]
  - - [29000, 684, 1, 1024, 29000, 29000, 1024, 1024]
    - [15, 17421.0]
  - - [29000, 716, 1, 1024, 29000, 29000, 1024, 1024]
    - [15, 18222.0]
  - - [29000, 730, 1, 1024, 29000, 29000, 1024, 1024]
    - [15, 18538.0]
  - - [2560, 1024, 1, 2560, 2560, 2560, 2560, 2560]
    - [49, 16600.0]
  - - [2560, 1024, 1, 4096, 2560, 2560, 4096, 4096]
    - [49, 16362.0]
  - - [1024, 1024, 512, 64, 1024, 1024, 64, 64]
    - [12, 10702.0]
  - - [1024, 32768, 1, 4096, 1024, 1024, 4096, 4096]
    - [32, 19878.0]
  - - [3072, 32768, 1, 1024, 3072, 3072, 1024, 1024]
    - [30, 19745.0]
  - - [4096, 32768, 1, 1024, 4096, 4096, 1024, 1024]
    - [13, 19595.0]
  - - [50304, 32768, 1, 1024, 50304, 50304, 1024, 1024]
    - [51, 19895.0]
  - - [1024, 1024, 24, 128, 1024, 1024, 128, 128]
    - [5, 18564.0]
  - - [128, 1024, 24, 1024, 128, 128, 1024, 1024]
    - [51, 16997.0]
  - - [4096, 256, 1, 12288, 4096, 4096, 12288, 12288]
    - [34, 13832.0]
  - - [2048, 256, 1, 13312, 2048, 2048, 13312, 13312]
    - [56, 16121.0]
  - - [4096, 256, 1, 15360, 4096, 4096, 15360, 15360]
    - [53, 13795.0]
  - - [2048, 512, 1, 16640, 2048, 2048, 16640, 16640]
    - [67, 16976.0]
  - - [4096, 256, 1, 14336, 4096, 4096, 14336, 14336]
    - [53, 13864.0]
  - - [1024, 1024, 1, 8192, 1024, 1024, 8192, 8192]
    - [51, 16419.0]
  - - [1024, 512, 1, 16384, 1024, 1024, 16384, 16384]
    - [56, 15075.0]
  - - [4096, 256, 1, 9216, 4096, 4096, 9216, 9216]
    - [67, 14265.0]
  - - [1024, 512, 1, 12288, 1024, 1024, 12288, 12288]
    - [56, 15704.0]
  - - [4096, 200, 1, 12288, 4096, 4096, 12288, 12288]
    - [59, 10888.0]
  - - [1024, 1024, 1, 13312, 1024, 1024, 13312, 13312]
    - [56, 16732.0]
  - - [2048, 256, 1, 16384, 2048, 2048, 16384, 16384]
    - [67, 13791.0]
  - - [2048, 512, 1, 16384, 2048, 2048, 16384, 16384]
    - [60, 14879.0]
  - - [1024, 1024, 1, 8320, 1024, 1024, 8320, 8320]
    - [24, 16450.0]
  - - [2048, 256, 1, 14336, 2048, 2048, 14336, 14336]
    - [60, 16012.0]
  - - [4096, 200, 1, 16640, 4096, 4096, 16640, 16640]
    - [58, 13084.0]
  - - [1024, 1024, 1, 16640, 1024, 1024, 16640, 16640]
    - [56, 16964.0]
  - - [1024, 1024, 1, 14336, 1024, 1024, 14336, 14336]
    - [56, 16784.0]
  - - [2048, 512, 1, 9216, 2048, 2048, 9216, 9216]
    - [32, 16439.0]
  - - [1024, 1024, 1, 15360, 1024, 1024, 15360, 15360]
    - [56, 16854.0]
  - - [2048, 512, 1, 8192, 2048, 2048, 8192, 8192]
    - [32, 16419.0]
  - - [2048, 512, 1, 13312, 2048, 2048, 13312, 13312]
    - [60, 16738.0]
  - - [1024, 1024, 1, 11264, 1024, 1024, 11264, 11264]
    - [56, 16539.0]
  - - [1024, 512, 1, 16640, 1024, 1024, 16640, 16640]
    - [55, 16275.0]
  - - [2048, 512, 1, 10240, 2048, 2048, 10240, 10240]
    - [51, 16564.0]
  - - [2048, 256, 1, 16640, 2048, 2048, 16640, 16640]
    - [56, 16246.0]
  - - [4096, 256, 1, 13312, 4096, 4096, 13312, 13312]
    - [66, 13811.0]
  - - [4096, 200, 1, 15360, 4096, 4096, 15360, 15360]
    - [59, 11097.0]
  - - [2048, 512, 1, 12288, 2048, 2048, 12288, 12288]
    - [56, 16640.0]
  - - [4096, 256, 1, 8192, 4096, 4096, 8192, 8192]
    - [51, 16375.0]
  - - [2048, 512, 1, 15360, 2048, 2048, 15360, 15360]
    - [67, 16283.0]
  - - [2048, 512, 1, 11264, 2048, 2048, 11264, 11264]
    - [56, 16565.0]
  - - [2048, 256, 1, 12288, 2048, 2048, 12288, 12288]
    - [60, 16018.0]
  - - [1024, 1024, 1, 12288, 1024, 1024, 12288, 12288]
    - [56, 16654.0]
  - - [4096, 256, 1, 16384, 4096, 4096, 16384, 16384]
    - [53, 13507.0]
  - - [2048, 256, 1, 15360, 2048, 2048, 15360, 15360]
    - [67, 16085.0]
  - - [2048, 512, 1, 8320, 2048, 2048, 8320, 8320]
    - [24, 16442.0]
  - - [1024, 1024, 1, 10240, 1024, 1024, 10240, 10240]
    - [51, 16563.0]
  - - [1024, 1024, 1, 9216, 1024, 1024, 9216, 9216]
    - [32, 16583.0]
  - - [4096, 200, 1, 16384, 4096, 4096, 16384, 16384]
    - [34, 10779.0]
  - - [2048, 512, 1, 14336, 2048, 2048, 14336, 14336]
    - [60, 16730.0]
  - - [1024, 512, 1, 13312, 1024, 1024, 13312, 13312]
    - [67, 15986.0]
  - - [4096, 256, 1, 8320, 4096, 4096, 8320, 8320]
    - [15, 16404.0]
  - - [4096, 200, 1, 13312, 4096, 4096, 13312, 13312]
    - [59, 11340.0]
  - - [1024, 512, 1, 14336, 1024, 1024, 14336, 14336]
    - [67, 16060.0]
  - - [4096, 256, 1, 11264, 4096, 4096, 11264, 11264]
    - [53, 13760.0]
  - - [4096, 256, 1, 10240, 4096, 4096, 10240, 10240]
    - [34, 13906.0]
  - - [4096, 200, 1, 14336, 4096, 4096, 14336, 14336]
    - [66, 10846.0]
  - - [4096, 256, 1, 16640, 4096, 4096, 16640, 16640]
    - [58, 16412.0]
  - - [1024, 512, 1, 15360, 1024, 1024, 15360, 15360]
    - [56, 16336.0]
  - - [1024, 1024, 1, 16384, 1024, 1024, 16384, 16384]
    - [15, 16478.0]
  - - [224, 192, 36, 10368, 224, 224, 10368, 10368]
    - [4, 13422.0]
  - - [320, 256, 9, 19584, 320, 320, 19584, 19584]
    - [56, 15948.0]
  - - [256, 256, 11, 13056, 256, 256, 13056, 13056]
    - [65, 14487.0]
  - - [320, 256, 9, 9792, 320, 320, 9792, 9792]
    - [63, 15394.0]
  - - [320, 256, 11, 13056, 320, 320, 13056, 13056]
    - [60, 14304.0]
  - - [256, 256, 9, 9792, 256, 256, 9792, 9792]
    - [54, 17274.0]
  - - [256, 224, 9, 19584, 256, 256, 19584, 19584]
    - [56, 14830.0]
  - - [256, 256, 9, 19584, 256, 256, 19584, 19584]
    - [54, 16699.0]
  - - [128, 128, 36, 12000, 128, 128, 12000, 12000]
    - [47, 12604.0]
  - - [128, 128, 49, 12800, 128, 128, 12800, 12800]
    - [57, 10993.0]
  - - [128, 128, 25, 25088, 128, 128, 25088, 25088]
    - [64, 10361.0]
  - - [128, 128, 49, 25600, 128, 128, 25600, 25600]
    - [62, 9670.0]
  - - [128, 128, 25, 50176, 128, 128, 50176, 50176]
    - [61, 9649.0]
  - - [128, 128, 36, 12544, 128, 128, 12544, 12544]
    - [35, 12493.0]
  - - [128, 128, 49, 9216, 128, 128, 9216, 9216]
    - [68, 8975.0]
  - - [1024, 1024, 1, 12544, 1024, 1024, 12544, 12544]
    - [56, 16665.0]
  - - [1024, 1000, 1, 12544, 1024, 1024, 12544, 12544]
    - [56, 16333.0]
  - - [1024, 512, 1, 1600, 1024, 1024, 1600, 1600]
    - [121, 13747.0]
  - - [2048, 512, 1, 100, 2048, 2048, 100, 100]
    - [73, 10832.0]
  - - [768, 640, 1, 768, 768, 768, 768, 768]
    - [110, 11391.0]
  - - [768, 1280, 1, 768, 768, 768, 768, 768]
    - [110, 13329.0]
  - - [1024, 512, 1, 1024, 1024, 1024, 1024, 1024]
    - [110, 12573.0]
  - - [1024, 512, 1, 3072, 1024, 1024, 3072, 3072]
    - [110, 13608.0]
  - - [30522, 120, 1, 1024, 30522, 30522, 1024, 1024]
    - [87, 15073.0]
  - - [30522, 80, 1, 1024, 30522, 30522, 1024, 1024]
    - [105, 10390.0]
  - - [64, 128, 512, 128, 64, 64, 128, 128]
    - [86, 10652.0]
  - - [64, 512, 64, 512, 64, 64, 512, 512]
    - [83, 10957.0]
  - - [64, 64, 768, 64, 64, 64, 64, 64]
    - [76, 8916.0]
  - - [64, 64, 96, 64, 64, 64, 64, 64]
    - [72, 5447.0]
  - - [1856, 448, 1, 3328, 1856, 1856, 3328, 3328]
    - [108, 14179.0]
  - - [128, 6784, 1, 3328, 128, 128, 3328, 3328]
    - [105, 12386.0]
  - - [2048, 400, 1, 512, 2048, 2048, 512, 512]
    - [82, 11305.0]
  - - [2368, 448, 1, 128, 2368, 2368, 128, 128]
    - [97, 10863.0]
  - - [256, 4288, 1, 3328, 256, 256, 3328, 3328]
    - [136, 15377.0]
  - - [704, 1856, 1, 3328, 704, 704, 3328, 3328]
    - [108, 13620.0]
  - - [448, 1024, 1, 1280, 448, 448, 1280, 1280]
    - [136, 11029.0]
  - - [256, 1408, 1, 3328, 256, 256, 3328, 3328]
    - [110, 9477.0]
  - - [704, 1856, 1, 1280, 704, 704, 1280, 1280]
    - [85, 13293.0]
  - - [128, 5056, 1, 128, 128, 128, 128, 128]
    - [103, 9043.0]
  - - [2368, 128, 1, 256, 2368, 2368, 256, 256]
    - [129, 6953.0]
  - - [64, 5056, 1, 256, 64, 64, 256, 256]
    - [133, 6790.0]
  - - [256, 2944, 1, 256, 256, 256, 256, 256]
    - [85, 11127.0]
  - - [256, 1856, 1, 1280, 256, 256, 1280, 1280]
    - [87, 11497.0]
  - - [128, 3584, 1, 1280, 128, 128, 1280, 1280]
    - [110, 11275.0]
  - - [4288, 256, 1, 256, 4288, 4288, 256, 256]
    - [105, 13550.0]
  - - [2944, 128, 1, 128, 2944, 2944, 128, 128]
    - [102, 7286.0]
  - - [5888, 64, 1, 3328, 5888, 5888, 3328, 3328]
    - [106, 9090.0]
  - - [2944, 256, 1, 3328, 2944, 2944, 3328, 3328]
    - [108, 12914.0]
  - - [704, 1024, 1, 128, 704, 704, 128, 128]
    - [129, 9672.0]
  - - [1408, 448, 1, 1280, 1408, 1408, 1280, 1280]
    - [85, 10629.0]
  - - [1408, 704, 1, 3328, 1408, 1408, 3328, 3328]
    - [136, 13924.0]
  - - [1408, 256, 1, 1280, 1408, 1408, 1280, 1280]
    - [110, 8910.0]
  - - [3072, 128, 1, 1024, 3072, 3072, 1024, 1024]
    - [87, 9417.0]
  - - [2944, 256, 1, 256, 2944, 2944, 256, 256]
    - [85, 10975.0]
  - - [704, 1408, 1, 3328, 704, 704, 3328, 3328]
    - [87, 13938.0]
  - - [2944, 256, 1, 128, 2944, 2944, 128, 128]
    - [130, 10028.0]
  - - [2368, 128, 1, 3328, 2368, 2368, 3328, 3328]
    - [110, 7915.0]
  - - [2944, 128, 1, 256, 2944, 2944, 256, 256]
    - [102, 8552.0]
  - - [448, 1408, 1, 256, 448, 448, 256, 256]
    - [103, 9477.0]
  - - [64, 5056, 1, 3328, 64, 64, 3328, 3328]
    - [106, 7931.0]
  - - [1024, 448, 1, 128, 1024, 1024, 128, 128]
    - [79, 7829.0]
  - - [256, 3584, 1, 3328, 256, 256, 3328, 3328]
    - [82, 13276.0]
  - - [256, 1408, 1, 256, 256, 256, 256, 256]
    - [102, 8038.0]
  - - [5056, 64, 1, 1280, 5056, 5056, 1280, 1280]
    - [84, 7659.0]
  - - [1024, 704, 1, 256, 1024, 1024, 256, 256]
    - [130, 10570.0]
  - - [128, 4288, 1, 128, 128, 128, 128, 128]
    - [81, 9196.0]
  - - [6784, 64, 1, 128, 6784, 6784, 128, 128]
    - [80, 7162.0]
  - - [3584, 256, 1, 128, 3584, 3584, 128, 128]
    - [103, 10561.0]
  - - [5888, 64, 1, 256, 5888, 5888, 256, 256]
    - [133, 7818.0]
  - - [1856, 256, 1, 1280, 1856, 1856, 1280, 1280]
    - [87, 11475.0]
  - - [64, 5888, 1, 3328, 64, 64, 3328, 3328]
    - [83, 9202.0]
  - - [704, 1024, 1, 1280, 704, 704, 1280, 1280]
    - [85, 12040.0]
  - - [448, 1856, 1, 128, 448, 448, 128, 128]
    - [83, 9984.0]
  - - [1024, 704, 1, 1280, 1024, 1024, 1280, 1280]
    - [85, 12122.0]
  - - [128, 5888, 1, 256, 128, 128, 256, 256]
    - [85, 10975.0]
  - - [704, 704, 1, 3328, 704, 704, 3328, 3328]
    - [136, 12760.0]
  - - [704, 1408, 1, 1280, 704, 704, 1280, 1280]
    - [105, 13725.0]
  - - [3584, 256, 1, 3328, 3584, 3584, 3328, 3328]
    - [105, 13483.0]
  - - [704, 1856, 1, 128, 704, 704, 128, 128]
    - [103, 11878.0]
  - - [2944, 448, 1, 128, 2944, 2944, 128, 128]
    - [125, 11391.0]
  - - [128, 2944, 1, 1280, 128, 128, 1280, 1280]
    - [110, 9269.0]
  - - [448, 2944, 1, 1280, 448, 448, 1280, 1280]
    - [105, 13138.0]
  - - [3584, 128, 1, 256, 3584, 3584, 256, 256]
    - [85, 8449.0]
  - - [448, 1408, 1, 3328, 448, 448, 3328, 3328]
    - [85, 10866.0]
  - - [256, 3584, 1, 256, 256, 256, 256, 256]
    - [136, 11502.0]
  - - [256, 2944, 1, 3328, 256, 256, 3328, 3328]
    - [134, 12937.0]
  - - [448, 2368, 1, 128, 448, 448, 128, 128]
    - [83, 10829.0]
  - - [1408, 704, 1, 256, 1408, 1408, 256, 256]
    - [131, 12235.0]
  - - [448, 2944, 1, 3328, 448, 448, 3328, 3328]
    - [87, 12808.0]
  - - [64, 5888, 1, 256, 64, 64, 256, 256]
    - [133, 7869.0]
  - - [6784, 128, 1, 3328, 6784, 6784, 3328, 3328]
    - [110, 12250.0]
  - - [704, 704, 1, 256, 704, 704, 256, 256]
    - [82, 8973.0]
  - - [128, 4288, 1, 3328, 128, 128, 3328, 3328]
    - [87, 14031.0]
  - - [448, 704, 1, 1280, 448, 448, 1280, 1280]
    - [136, 7606.0]
  - - [128, 5056, 1, 1280, 128, 128, 1280, 1280]
    - [85, 10917.0]
  - - [1024, 448, 1, 3328, 1024, 1024, 3328, 3328]
    - [136, 11822.0]
  - - [1856, 704, 1, 1280, 1856, 1856, 1280, 1280]
    - [85, 13242.0]
  - - [448, 1024, 1, 128, 448, 448, 128, 128]
    - [129, 7395.0]
  - - [448, 2368, 1, 3328, 448, 448, 3328, 3328]
    - [132, 12987.0]
  - - [5056, 64, 1, 128, 5056, 5056, 128, 128]
    - [80, 6472.0]
  - - [1024, 700, 1, 512, 1024, 1024, 512, 512]
    - [108, 11034.0]
  - - [704, 1024, 1, 256, 704, 704, 256, 256]
    - [85, 10345.0]
  - - [128, 6784, 1, 1280, 128, 128, 1280, 1280]
    - [82, 12539.0]
  - - [1856, 256, 1, 256, 1856, 1856, 256, 256]
    - [101, 8983.0]
  - - [256, 4288, 1, 1280, 256, 256, 1280, 1280]
    - [87, 15002.0]
  - - [256, 1856, 1, 128, 256, 256, 128, 128]
    - [130, 8196.0]
  - - [7680, 64, 1, 2560, 7680, 7680, 2560, 2560]
    - [134, 11683.0]
  - - [448, 1408, 1, 128, 448, 448, 128, 128]
    - [102, 8499.0]
  - - [6784, 128, 1, 256, 6784, 6784, 256, 256]
    - [131, 11330.0]
  - - [704, 448, 1, 256, 704, 704, 256, 256]
    - [102, 6673.0]
  - - [704, 1408, 1, 128, 704, 704, 128, 128]
    - [82, 10844.0]
  - - [4288, 128, 1, 1280, 4288, 4288, 1280, 1280]
    - [87, 13196.0]
  - - [128, 2944, 1, 128, 128, 128, 128, 128]
    - [80, 7560.0]
  - - [1024, 704, 1, 3328, 1024, 1024, 3328, 3328]
    - [85, 12401.0]
  - - [128, 4288, 1, 256, 128, 128, 256, 256]
    - [85, 10138.0]
  - - [704, 448, 1, 3328, 704, 704, 3328, 3328]
    - [87, 8210.0]
  - - [448, 2368, 1, 1280, 448, 448, 1280, 1280]
    - [132, 12806.0]
  - - [64, 6784, 1, 3328, 64, 64, 3328, 3328]
    - [132, 9866.0]
  - - [2944, 256, 1, 1280, 2944, 2944, 1280, 1280]
    - [134, 12561.0]
  - - [256, 2368, 1, 128, 256, 256, 128, 128]
    - [81, 8546.0]
  - - [1856, 704, 1, 256, 1856, 1856, 256, 256]
    - [131, 11704.0]
  - - [1408, 448, 1, 3328, 1408, 1408, 3328, 3328]
    - [108, 10875.0]
  - - [1856, 448, 1, 1280, 1856, 1856, 1280, 1280]
    - [134, 13586.0]
  - - [128, 5888, 1, 128, 128, 128, 128, 128]
    - [103, 10440.0]
  - - [704, 1856, 1, 256, 704, 704, 256, 256]
    - [134, 11921.0]
  - - [256, 2368, 1, 1280, 256, 256, 1280, 1280]
    - [103, 10413.0]
  - - [2944, 448, 1, 256, 2944, 2944, 256, 256]
    - [85, 12478.0]
  - - [1856, 448, 1, 128, 1856, 1856, 128, 128]
    - [103, 10194.0]
  - - [2368, 128, 1, 1280, 2368, 2368, 1280, 1280]
    - [102, 7539.0]
  - - [64, 6784, 1, 256, 64, 64, 256, 256]
    - [83, 7794.0]
  - - [64, 5056, 1, 1280, 64, 64, 1280, 1280]
    - [107, 7656.0]
  - - [2368, 256, 1, 1280, 2368, 2368, 1280, 1280]
    - [85, 10059.0]
  - - [2368, 448, 1, 1280, 2368, 2368, 1280, 1280]
    - [134, 13517.0]
  - - [128, 3584, 1, 256, 128, 128, 256, 256]
    - [85, 8510.0]
  - - [704, 448, 1, 1280, 704, 704, 1280, 1280]
    - [129, 7857.0]
  - - [128, 3584, 1, 3328, 128, 128, 3328, 3328]
    - [87, 11950.0]
  - - [4288, 256, 1, 1280, 4288, 4288, 1280, 1280]
    - [131, 15356.0]
  - - [4288, 128, 1, 3328, 4288, 4288, 3328, 3328]
    - [136, 14077.0]
  - - [7680, 128, 1, 2560, 7680, 7680, 2560, 2560]
    - [87, 13770.0]
  - - [1408, 256, 1, 128, 1408, 1408, 128, 128]
    - [129, 6927.0]
  - - [256, 1408, 1, 1280, 256, 256, 1280, 1280]
    - [110, 8952.0]
  - - [128, 2368, 1, 256, 128, 128, 256, 256]
    - [102, 7028.0]
  - - [6784, 64, 1, 3328, 6784, 6784, 3328, 3328]
    - [108, 10472.0]
  - - [128, 2944, 1, 3328, 128, 128, 3328, 3328]
    - [110, 9878.0]
  - - [2944, 448, 1, 3328, 2944, 2944, 3328, 3328]
    - [85, 13811.0]
  - - [256, 4288, 1, 256, 256, 256, 256, 256]
    - [82, 13589.0]
  - - [5888, 128, 1, 256, 5888, 5888, 256, 256]
    - [85, 10876.0]
  - - [5056, 64, 1, 256, 5056, 5056, 256, 256]
    - [133, 6790.0]
  - - [1024, 704, 1, 128, 1024, 1024, 128, 128]
    - [81, 9796.0]
  - - [128, 5056, 1, 3328, 128, 128, 3328, 3328]
    - [85, 11158.0]
  - - [4288, 128, 1, 256, 4288, 4288, 256, 256]
    - [104, 9771.0]
  - - [1408, 448, 1, 128, 1408, 1408, 128, 128]
    - [101, 8446.0]
  - - [704, 448, 1, 128, 704, 704, 128, 128]
    - [102, 6249.0]
  - - [3584, 256, 1, 256, 3584, 3584, 256, 256]
    - [131, 11768.0]
  - - [128, 2944, 1, 256, 128, 128, 256, 256]
    - [102, 8120.0]
  - - [128, 6784, 1, 128, 128, 128, 128, 128]
    - [81, 10235.0]
  - - [448, 1856, 1, 256, 448, 448, 256, 256]
    - [132, 11239.0]
  - - [3584, 128, 1, 3328, 3584, 3584, 3328, 3328]
    - [136, 11937.0]
  - - [5888, 128, 1, 3328, 5888, 5888, 3328, 3328]
    - [85, 12910.0]
  - - [1408, 704, 1, 1280, 1408, 1408, 1280, 1280]
    - [131, 14129.0]
  - - [6784, 64, 1, 256, 6784, 6784, 256, 256]
    - [85, 8019.0]
  - - [448, 2944, 1, 256, 448, 448, 256, 256]
    - [82, 12059.0]
  - - [448, 2368, 1, 256, 448, 448, 256, 256]
    - [132, 11798.0]
  - - [64, 6784, 1, 1280, 64, 64, 1280, 1280]
    - [106, 9588.0]
  - - [128, 2368, 1, 3328, 128, 128, 3328, 3328]
    - [87, 7913.0]
  - - [5056, 64, 1, 3328, 5056, 5056, 3328, 3328]
    - [83, 7929.0]
  - - [64, 5888, 1, 128, 64, 64, 128, 128]
    - [80, 7467.0]
  - - [5056, 128, 1, 3328, 5056, 5056, 3328, 3328]
    - [85, 11089.0]
  - - [448, 704, 1, 256, 448, 448, 256, 256]
    - [129, 6913.0]
  - - [2944, 128, 1, 3328, 2944, 2944, 3328, 3328]
    - [87, 9879.0]
  - - [704, 704, 1, 128, 704, 704, 128, 128]
    - [117, 7990.0]
  - - [2368, 128, 1, 128, 2368, 2368, 128, 128]
    - [80, 6043.0]
  - - [5056, 128, 1, 128, 5056, 5056, 128, 128]
    - [129, 8738.0]
  - - [448, 1024, 1, 3328, 448, 448, 3328, 3328]
    - [110, 11844.0]
  - - [2368, 256, 1, 256, 2368, 2368, 256, 256]
    - [129, 8950.0]
  - - [256, 2368, 1, 3328, 256, 256, 3328, 3328]
    - [85, 10469.0]
  - - [256, 3584, 1, 128, 256, 256, 128, 128]
    - [105, 10735.0]
  - - [4288, 256, 1, 128, 4288, 4288, 128, 128]
    - [82, 11768.0]
  - - [2368, 256, 1, 128, 2368, 2368, 128, 128]
    - [101, 8416.0]
  - - [256, 1856, 1, 256, 256, 256, 256, 256]
    - [85, 8944.0]
  - - [256, 2944, 1, 128, 256, 256, 128, 128]
    - [103, 10198.0]
  - - [1408, 256, 1, 3328, 1408, 1408, 3328, 3328]
    - [87, 9459.0]
  - - [2368, 448, 1, 256, 2368, 2368, 256, 256]
    - [106, 11586.0]
  - - [4288, 256, 1, 3328, 4288, 4288, 3328, 3328]
    - [87, 15429.0]
  - - [1856, 704, 1, 128, 1856, 1856, 128, 128]
    - [102, 10707.0]
  - - [4288, 128, 1, 128, 4288, 4288, 128, 128]
    - [129, 8804.0]
  - - [1408, 448, 1, 256, 1408, 1408, 256, 256]
    - [85, 9217.0]
  - - [6784, 64, 1, 1280, 6784, 6784, 1280, 1280]
    - [85, 10090.0]
  - - [3584, 128, 1, 128, 3584, 3584, 128, 128]
    - [80, 7471.0]
  - - [256, 2368, 1, 256, 256, 256, 256, 256]
    - [103, 9651.0]
  - - [2944, 448, 1, 1280, 2944, 2944, 1280, 1280]
    - [108, 13575.0]
  - - [448, 1408, 1, 1280, 448, 448, 1280, 1280]
    - [85, 10576.0]
  - - [448, 1856, 1, 1280, 448, 448, 1280, 1280]
    - [132, 12649.0]
  - - [1856, 256, 1, 128, 1856, 1856, 128, 128]
    - [101, 7837.0]
  - - [2560, 128, 1, 2560, 2560, 2560, 2560, 2560]
    - [136, 8497.0]
  - - [448, 1024, 1, 256, 448, 448, 256, 256]
    - [103, 8857.0]
  - - [1024, 448, 1, 1280, 1024, 1024, 1280, 1280]
    - [110, 10988.0]
  - - [128, 5056, 1, 256, 128, 128, 256, 256]
    - [85, 9511.0]
  - - [448, 2944, 1, 128, 448, 448, 128, 128]
    - [73, 11121.0]
  - - [128, 3584, 1, 128, 128, 128, 128, 128]
    - [103, 7850.0]
  - - [1408, 256, 1, 256, 1408, 1408, 256, 256]
    - [102, 8010.0]
  - - [128, 5888, 1, 3328, 128, 128, 3328, 3328]
    - [134, 12901.0]
  - - [2368, 448, 1, 3328, 2368, 2368, 3328, 3328]
    - [108, 13917.0]
  - - [128, 5888, 1, 1280, 128, 128, 1280, 1280]
    - [85, 12663.0]
  - - [64, 5056, 1, 128, 64, 64, 128, 128]
    - [80, 6512.0]
  - - [64, 6784, 1, 128, 64, 64, 128, 128]
    - [129, 7312.0]
  - - [448, 704, 1, 128, 448, 448, 128, 128]
    - [129, 6288.0]
  - - [1408, 704, 1, 128, 1408, 1408, 128, 128]
    - [131, 10863.0]
  - - [2368, 256, 1, 3328, 2368, 2368, 3328, 3328]
    - [108, 10408.0]
  - - [5888, 128, 1, 1280, 5888, 5888, 1280, 1280]
    - [108, 12590.0]
  - - [256, 3584, 1, 1280, 256, 256, 1280, 1280]
    - [87, 12729.0]
  - - [256, 1408, 1, 128, 256, 256, 128, 128]
    - [129, 6845.0]
  - - [256, 4288, 1, 128, 256, 256, 128, 128]
    - [81, 12155.0]
  - - [5888, 128, 1, 128, 5888, 5888, 128, 128]
    - [103, 9570.0]
  - - [1856, 256, 1, 3328, 1856, 1856, 3328, 3328]
    - [87, 12294.0]
  - - [64, 5888, 1, 1280, 64, 64, 1280, 1280]
    - [133, 8896.0]
  - - [704, 704, 1, 1280, 704, 704, 1280, 1280]
    - [87, 11907.0]
  - - [128, 2368, 1, 1280, 128, 128, 1280, 1280]
    - [129, 7794.0]
  - - [3584, 256, 1, 1280, 3584, 3584, 1280, 1280]
    - [131, 13355.0]
  - - [5888, 64, 1, 1280, 5888, 5888, 1280, 1280]
    - [133, 8873.0]
  - - [3584, 128, 1, 1280, 3584, 3584, 1280, 1280]
    - [87, 11236.0]
  - - [5056, 128, 1, 1280, 5056, 5056, 1280, 1280]
    - [85, 10744.0]
  - - [448, 1856, 1, 3328, 448, 448, 3328, 3328]
    - [106, 12848.0]
  - - [1024, 448, 1, 256, 1024, 1024, 256, 256]
    - [103, 9247.0]
  - - [2944, 128, 1, 1280, 2944, 2944, 1280, 1280]
    - [129, 9359.0]
  - - [128, 2368, 1, 128, 128, 128, 128, 128]
    - [80, 6158.0]
  - - [256, 2944, 1, 1280, 256, 256, 1280, 1280]
    - [85, 12640.0]
  - - [704, 1024, 1, 3328, 704, 704, 3328, 3328]
    - [108, 12354.0]
  - - [128, 6784, 1, 256, 128, 128, 256, 256]
    - [105, 11377.0]
  - - [256, 1856, 1, 3328, 256, 256, 3328, 3328]
    - [136, 12305.0]
  - - [6784, 128, 1, 128, 6784, 6784, 128, 128]
    - [131, 10068.0]
  - - [704, 1408, 1, 256, 704, 704, 256, 256]
    - [105, 12500.0]
  - - [4096, 128, 1, 4096, 4096, 4096, 4096, 4096]
    - [110, 13673.0]
  - - [5888, 64, 1, 128, 5888, 5888, 128, 128]
    - [129, 6871.0]
  - - [5056, 128, 1, 256, 5056, 5056, 256, 256]
    - [102, 9413.0]
  - - [6784, 128, 1, 1280, 6784, 6784, 1280, 1280]
    - [105, 12416.0]
  - - [1856, 448, 1, 256, 1856, 1856, 256, 256]
    - [106, 11251.0]
  - - [128, 4288, 1, 1280, 128, 128, 1280, 1280]
    - [136, 13201.0]
  - - [448, 704, 1, 3328, 448, 448, 3328, 3328]
    - [126, 8200.0]
  - - [1856, 704, 1, 3328, 1856, 1856, 3328, 3328]
    - [85, 13673.0]
  - - [1024, 1024, 1, 3328, 1024, 1024, 3328, 3328]
    - [87, 14767.0]
  - - [2048, 200, 1, 3200, 2048, 2048, 3200, 3200]
    - [78, 10492.0]
  - - [2048, 256, 1, 3328, 2048, 2048, 3328, 3328]
    - [110, 13602.0]
  - - [4096, 200, 1, 11264, 4096, 4096, 11264, 11264]
    - [87, 10603.0]
  - - [2048, 512, 1, 1024, 2048, 2048, 1024, 1024]
    - [105, 14263.0]
  - - [1024, 1024, 1, 64, 1024, 1024, 64, 64]
    - [71, 9898.0]
  - - [512, 1024, 1, 1536, 512, 512, 1536, 1536]
    - [110, 13077.0]
  - - [1024, 512, 1, 512, 1024, 1024, 512, 512]
    - [85, 11092.0]
  - - [2048, 512, 1, 640, 2048, 2048, 640, 640]
    - [105, 15033.0]
  - - [1024, 1024, 1, 512, 1024, 1024, 512, 512]
    - [82, 13988.0]
  - - [2048, 256, 1, 2048, 2048, 2048, 2048, 2048]
    - [110, 13266.0]
  - - [1024, 512, 1, 128, 1024, 1024, 128, 128]
    - [81, 8807.0]
  - - [2048, 512, 1, 256, 2048, 2048, 256, 256]
    - [82, 13250.0]
  - - [4096, 200, 1, 2560, 4096, 4096, 2560, 2560]
    - [105, 12051.0]
  - - [1024, 1024, 1, 1152, 1024, 1024, 1152, 1152]
    - [105, 15225.0]
  - - [2048, 200, 1, 32, 2048, 2048, 32, 32]
    - [128, 3855.0]
  - - [512, 1024, 1, 2816, 512, 512, 2816, 2816]
    - [110, 13542.0]
  - - [2048, 200, 1, 2080, 2048, 2048, 2080, 2080]
    - [74, 10837.0]
  - - [2048, 200, 1, 1024, 2048, 2048, 1024, 1024]
    - [87, 9317.0]
  - - [4096, 200, 1, 4096, 4096, 4096, 4096, 4096]
    - [105, 11526.0]
  - - [1024, 512, 1, 11264, 1024, 1024, 11264, 11264]
    - [110, 14010.0]
  - - [1024, 1024, 1, 1792, 1024, 1024, 1792, 1792]
    - [105, 14623.0]
  - - [4096, 200, 1, 768, 4096, 4096, 768, 768]
    - [131, 11303.0]
  - - [4096, 256, 1, 1024, 4096, 4096, 1024, 1024]
    - [82, 14637.0]
  - - [1024, 512, 1, 256, 1024, 1024, 256, 256]
    - [103, 10076.0]
  - - [1024, 512, 1, 1408, 1024, 1024, 1408, 1408]
    - [126, 12978.0]
  - - [1024, 512, 1, 5632, 1024, 1024, 5632, 5632]
    - [136, 13846.0]
  - - [4096, 200, 1, 256, 4096, 4096, 256, 256]
    - [108, 9691.0]
  - - [512, 1024, 1, 3072, 512, 512, 3072, 3072]
    - [110, 13589.0]
  - - [1024, 1024, 1, 4160, 1024, 1024, 4160, 4160]
    - [96, 16077.0]
  - - [2048, 256, 1, 384, 2048, 2048, 384, 384]
    - [130, 11651.0]
  - - [4096, 200, 1, 640, 4096, 4096, 640, 640]
    - [82, 11108.0]
  - - [1024, 1024, 1, 7168, 1024, 1024, 7168, 7168]
    - [87, 14855.0]
  - - [4096, 256, 1, 768, 4096, 4096, 768, 768]
    - [105, 14897.0]
  - - [2048, 256, 1, 6656, 2048, 2048, 6656, 6656]
    - [110, 13870.0]
  - - [2048, 200, 1, 3072, 2048, 2048, 3072, 3072]
    - [87, 10439.0]
  - - [1024, 512, 1, 2816, 1024, 1024, 2816, 2816]
    - [110, 13547.0]
  - - [4096, 256, 1, 7680, 4096, 4096, 7680, 7680]
    - [136, 14740.0]
  - - [4096, 200, 1, 1024, 4096, 4096, 1024, 1024]
    - [105, 11447.0]
  - - [2048, 200, 1, 1792, 2048, 2048, 1792, 1792]
    - [87, 10066.0]
  - - [1024, 1024, 1, 2816, 1024, 1024, 2816, 2816]
    - [110, 14730.0]
  - - [2048, 512, 1, 1536, 2048, 2048, 1536, 1536]
    - [136, 14563.0]
  - - [4096, 256, 1, 3072, 4096, 4096, 3072, 3072]
    - [110, 14730.0]
  - - [2048, 256, 1, 5632, 2048, 2048, 5632, 5632]
    - [136, 13824.0]
  - - [1024, 512, 1, 6656, 1024, 1024, 6656, 6656]
    - [136, 13893.0]
  - - [4096, 200, 1, 2080, 4096, 4096, 2080, 2080]
    - [74, 12290.0]
  - - [2048, 200, 1, 13312, 2048, 2048, 13312, 13312]
    - [87, 10933.0]
  - - [4096, 256, 1, 3584, 4096, 4096, 3584, 3584]
    - [131, 14852.0]
  - - [2048, 256, 1, 8192, 2048, 2048, 8192, 8192]
    - [136, 13967.0]
  - - [2048, 512, 1, 512, 2048, 2048, 512, 512]
    - [82, 13901.0]
  - - [2048, 512, 1, 1152, 2048, 2048, 1152, 1152]
    - [131, 15237.0]
  - - [2048, 200, 1, 9216, 2048, 2048, 9216, 9216]
    - [87, 10872.0]
  - - [2048, 200, 1, 2560, 2048, 2048, 2560, 2560]
    - [110, 10282.0]
  - - [2048, 256, 1, 4608, 2048, 2048, 4608, 4608]
    - [110, 13760.0]
  - - [2048, 256, 1, 3584, 2048, 2048, 3584, 3584]
    - [87, 13658.0]
  - - [1024, 512, 1, 640, 1024, 1024, 640, 640]
    - [81, 12114.0]
  - - [2048, 512, 1, 768, 2048, 2048, 768, 768]
    - [131, 14679.0]
  - - [2048, 200, 1, 1408, 2048, 2048, 1408, 1408]
    - [131, 9923.0]
  - - [4096, 200, 1, 2048, 4096, 4096, 2048, 2048]
    - [131, 11827.0]
  - - [1024, 1024, 1, 5632, 1024, 1024, 5632, 5632]
    - [110, 14843.0]
  - - [2048, 512, 1, 3584, 2048, 2048, 3584, 3584]
    - [87, 14768.0]
  - - [1024, 512, 1, 64, 1024, 1024, 64, 64]
    - [120, 6631.0]
  - - [4096, 200, 1, 7680, 4096, 4096, 7680, 7680]
    - [110, 11555.0]
  - - [1024, 1024, 1, 1280, 1024, 1024, 1280, 1280]
    - [110, 14441.0]
  - - [2048, 200, 1, 896, 2048, 2048, 896, 896]
    - [130, 9951.0]
  - - [2048, 256, 1, 32, 2048, 2048, 32, 32]
    - [114, 4766.0]
  - - [2048, 256, 1, 1280, 2048, 2048, 1280, 1280]
    - [136, 12763.0]
  - - [4096, 256, 1, 4096, 4096, 4096, 4096, 4096]
    - [87, 14747.0]
  - - [2048, 256, 1, 11264, 2048, 2048, 11264, 11264]
    - [136, 14005.0]
  - - [4096, 200, 1, 9216, 4096, 4096, 9216, 9216]
    - [87, 11377.0]
  - - [1024, 512, 1, 4096, 1024, 1024, 4096, 4096]
    - [110, 13465.0]
  - - [4096, 200, 1, 3840, 4096, 4096, 3840, 3840]
    - [131, 11595.0]
  - - [1024, 1024, 1, 1920, 1024, 1024, 1920, 1920]
    - [74, 15373.0]
  - - [2048, 200, 1, 7168, 2048, 2048, 7168, 7168]
    - [87, 10800.0]
  - - [4096, 256, 1, 1152, 4096, 4096, 1152, 1152]
    - [131, 15294.0]
  - - [2048, 256, 1, 1920, 2048, 2048, 1920, 1920]
    - [110, 13217.0]
  - - [2048, 512, 1, 4160, 2048, 2048, 4160, 4160]
    - [96, 16105.0]
  - - [2048, 512, 1, 5632, 2048, 2048, 5632, 5632]
    - [87, 14831.0]
  - - [4096, 256, 1, 7168, 4096, 4096, 7168, 7168]
    - [136, 14525.0]
  - - [4096, 200, 1, 128, 4096, 4096, 128, 128]
    - [130, 8886.0]
  - - [2048, 200, 1, 5120, 2048, 2048, 5120, 5120]
    - [110, 10666.0]
  - - [1024, 1024, 1, 6656, 1024, 1024, 6656, 6656]
    - [87, 14835.0]
  - - [512, 1024, 1, 3200, 512, 512, 3200, 3200]
    - [100, 13636.0]
  - - [2048, 256, 1, 1536, 2048, 2048, 1536, 1536]
    - [110, 13006.0]
  - - [4096, 256, 1, 256, 4096, 4096, 256, 256]
    - [131, 13276.0]
  - - [2048, 512, 1, 1408, 2048, 2048, 1408, 1408]
    - [105, 15350.0]
  - - [1024, 512, 1, 2080, 1024, 1024, 2080, 2080]
    - [96, 14379.0]
  - - [2048, 512, 1, 2304, 2048, 2048, 2304, 2304]
    - [105, 14858.0]
  - - [4096, 200, 1, 512, 4096, 4096, 512, 512]
    - [82, 10744.0]
  - - [2048, 200, 1, 1280, 2048, 2048, 1280, 1280]
    - [87, 9734.0]
  - - [1024, 1024, 1, 2304, 1024, 1024, 2304, 2304]
    - [105, 14825.0]
  - - [2048, 512, 1, 4608, 2048, 2048, 4608, 4608]
    - [110, 14805.0]
  - - [4096, 256, 1, 6144, 4096, 4096, 6144, 6144]
    - [87, 14769.0]
  - - [4096, 256, 1, 896, 4096, 4096, 896, 896]
    - [105, 15085.0]
  - - [2048, 256, 1, 640, 2048, 2048, 640, 640]
    - [130, 12354.0]
  - - [2048, 512, 1, 384, 2048, 2048, 384, 384]
    - [105, 14442.0]
  - - [2048, 200, 1, 16384, 2048, 2048, 16384, 16384]
    - [90, 9292.0]
  - - [4096, 200, 1, 10240, 4096, 4096, 10240, 10240]
    - [110, 10948.0]
  - - [1024, 512, 1, 9216, 1024, 1024, 9216, 9216]
    - [136, 13852.0]
  - - [4096, 200, 1, 1920, 4096, 4096, 1920, 1920]
    - [131, 11990.0]
  - - [2048, 512, 1, 7680, 2048, 2048, 7680, 7680]
    - [136, 14857.0]
  - - [1024, 512, 1, 3584, 1024, 1024, 3584, 3584]
    - [110, 13680.0]
  - - [1024, 1024, 1, 32, 1024, 1024, 32, 32]
    - [73, 6684.0]
  - - [2048, 512, 1, 1664, 2048, 2048, 1664, 1664]
    - [105, 15521.0]
  - - [2048, 200, 1, 2048, 2048, 2048, 2048, 2048]
    - [87, 10131.0]
  - - [1024, 1024, 1, 3584, 1024, 1024, 3584, 3584]
    - [110, 14779.0]
  - - [4096, 256, 1, 6656, 4096, 4096, 6656, 6656]
    - [110, 14836.0]
  - - [4096, 256, 1, 4160, 4096, 4096, 4160, 4160]
    - [96, 16081.0]
  - - [2048, 256, 1, 3072, 2048, 2048, 3072, 3072]
    - [110, 13573.0]
  - - [2048, 256, 1, 8320, 2048, 2048, 8320, 8320]
    - [100, 13961.0]
  - - [1024, 512, 1, 3200, 1024, 1024, 3200, 3200]
    - [126, 13636.0]
  - - [1024, 512, 1, 896, 1024, 1024, 896, 896]
    - [105, 12601.0]
  - - [2048, 512, 1, 1280, 2048, 2048, 1280, 1280]
    - [105, 14943.0]
  - - [4096, 200, 1, 64, 4096, 4096, 64, 64]
    - [95, 7162.0]
  - - [1024, 1024, 1, 5120, 1024, 1024, 5120, 5120]
    - [87, 14819.0]
  - - [2048, 512, 1, 6656, 2048, 2048, 6656, 6656]
    - [87, 14846.0]
  - - [1024, 1024, 1, 128, 1024, 1024, 128, 128]
    - [105, 11899.0]
  - - [512, 1024, 1, 1792, 512, 512, 1792, 1792]
    - [126, 13225.0]
  - - [4096, 256, 1, 2816, 4096, 4096, 2816, 2816]
    - [105, 15411.0]
  - - [1024, 1024, 1, 4096, 1024, 1024, 4096, 4096]
    - [110, 14765.0]
  - - [2048, 200, 1, 4160, 2048, 2048, 4160, 4160]
    - [74, 11298.0]
  - - [1024, 512, 1, 768, 1024, 1024, 768, 768]
    - [136, 12135.0]
  - - [4096, 200, 1, 8320, 4096, 4096, 8320, 8320]
    - [131, 11811.0]
  - - [2048, 512, 1, 896, 2048, 2048, 896, 896]
    - [105, 14946.0]
  - - [4096, 200, 1, 7168, 4096, 4096, 7168, 7168]
    - [82, 11568.0]
  - - [2048, 200, 1, 3840, 2048, 2048, 3840, 3840]
    - [126, 10440.0]
  - - [1024, 1024, 1, 768, 1024, 1024, 768, 768]
    - [105, 14589.0]
  - - [4096, 256, 1, 2304, 4096, 4096, 2304, 2304]
    - [131, 15266.0]
  - - [2048, 200, 1, 16640, 2048, 2048, 16640, 16640]
    - [85, 9996.0]
  - - [2048, 256, 1, 2816, 2048, 2048, 2816, 2816]
    - [110, 13119.0]
  - - [1024, 512, 1, 384, 1024, 1024, 384, 384]
    - [81, 11843.0]
  - - [2048, 200, 1, 7680, 2048, 2048, 7680, 7680]
    - [87, 10769.0]
  - - [1024, 512, 1, 4608, 1024, 1024, 4608, 4608]
    - [136, 13791.0]
  - - [4096, 200, 1, 32, 4096, 4096, 32, 32]
    - [114, 5350.0]
  - - [4096, 200, 1, 3328, 4096, 4096, 3328, 3328]
    - [131, 11836.0]
  - - [1024, 1024, 1, 1408, 1024, 1024, 1408, 1408]
    - [105, 15268.0]
  - - [2048, 200, 1, 15360, 2048, 2048, 15360, 15360]
    - [134, 9720.0]
  - - [512, 1024, 1, 2048, 512, 512, 2048, 2048]
    - [110, 12816.0]
  - - [4096, 256, 1, 5632, 4096, 4096, 5632, 5632]
    - [110, 14783.0]
  - - [2048, 256, 1, 1408, 2048, 2048, 1408, 1408]
    - [105, 12879.0]
  - - [2048, 256, 1, 6144, 2048, 2048, 6144, 6144]
    - [110, 13874.0]
  - - [4096, 256, 1, 3328, 4096, 4096, 3328, 3328]
    - [131, 15389.0]
  - - [2048, 512, 1, 6144, 2048, 2048, 6144, 6144]
    - [110, 14850.0]
  - - [2048, 512, 1, 3200, 2048, 2048, 3200, 3200]
    - [105, 15661.0]
  - - [2048, 200, 1, 4608, 2048, 2048, 4608, 4608]
    - [87, 10561.0]
  - - [1024, 1024, 1, 6144, 1024, 1024, 6144, 6144]
    - [110, 14840.0]
  - - [4096, 256, 1, 1664, 4096, 4096, 1664, 1664]
    - [131, 15463.0]
  - - [2048, 200, 1, 384, 2048, 2048, 384, 384]
    - [103, 8886.0]
  - - [4096, 256, 1, 1792, 4096, 4096, 1792, 1792]
    - [87, 14591.0]
  - - [2048, 512, 1, 2816, 2048, 2048, 2816, 2816]
    - [105, 14816.0]
  - - [4096, 256, 1, 384, 4096, 4096, 384, 384]
    - [131, 14218.0]
  - - [2048, 256, 1, 128, 2048, 2048, 128, 128]
    - [81, 8670.0]
  - - [1024, 1024, 1, 640, 1024, 1024, 640, 640]
    - [105, 14821.0]
  - - [4096, 200, 1, 5632, 4096, 4096, 5632, 5632]
    - [82, 11991.0]
  - - [2048, 200, 1, 1152, 2048, 2048, 1152, 1152]
    - [103, 9786.0]
  - - [4096, 256, 1, 512, 4096, 4096, 512, 512]
    - [131, 14309.0]
  - - [1024, 1024, 1, 384, 1024, 1024, 384, 384]
    - [105, 14370.0]
  - - [2048, 200, 1, 512, 2048, 2048, 512, 512]
    - [130, 8702.0]
  - - [2048, 256, 1, 9216, 2048, 2048, 9216, 9216]
    - [136, 13977.0]
  - - [2048, 256, 1, 1792, 2048, 2048, 1792, 1792]
    - [110, 13144.0]
  - - [4096, 200, 1, 1792, 4096, 4096, 1792, 1792]
    - [105, 11974.0]
  - - [2048, 200, 1, 1536, 2048, 2048, 1536, 1536]
    - [87, 9852.0]
  - - [1024, 1024, 1, 3072, 1024, 1024, 3072, 3072]
    - [87, 14738.0]
  - - [1024, 1024, 1, 2080, 1024, 1024, 2080, 2080]
    - [96, 15976.0]
  - - [2048, 200, 1, 2304, 2048, 2048, 2304, 2304]
    - [87, 10247.0]
  - - [2048, 256, 1, 7168, 2048, 2048, 7168, 7168]
    - [136, 13915.0]
  - - [2048, 512, 1, 1792, 2048, 2048, 1792, 1792]
    - [136, 14607.0]
  - - [1024, 1024, 1, 4608, 1024, 1024, 4608, 4608]
    - [110, 14822.0]
  - - [512, 1024, 1, 1280, 512, 512, 1280, 1280]
    - [136, 12876.0]
  - - [2048, 256, 1, 3200, 2048, 2048, 3200, 3200]
    - [110, 13591.0]
  - - [1024, 512, 1, 3328, 1024, 1024, 3328, 3328]
    - [110, 13646.0]
  - - [1024, 512, 1, 4160, 1024, 1024, 4160, 4160]
    - [121, 14677.0]
  - - [4096, 200, 1, 6656, 4096, 4096, 6656, 6656]
    - [82, 11728.0]
  - - [2048, 200, 1, 3328, 2048, 2048, 3328, 3328]
    - [87, 10447.0]
