library/src/blas3/Tensile/Logic/asm_full/navi22_Cijk_Alik_Bjlk_SB.yaml
---
- {MinimumRequiredVersion: 4.28.0}
- navi22
- gfx1031
    SolutionIndex: 0
    SolutionNameMin: Cijk_Alik_Bjlk_SB_MT128x64x8_SN_SU0_SUM0_TT8_8_WG16_8_1_WGM1
    SolutionIndex: 1
    SolutionNameMin: Cijk_Alik_Bjlk_SB_MT128x128x8_SN_SU0_SUM0_TT8_16_WG16_8_1_WGM1
    SolutionIndex: 2
    SolutionNameMin: Cijk_Alik_Bjlk_SB_MT128x128x8_SN_SU0_SUM0_TT8_8_WG16_16_1_WGM1
    SolutionIndex: 3
    SolutionNameMin: Cijk_Alik_Bjlk_SB_MT128x128x16_SN_SU0_SUM0_TT8_16_WG16_8_1_WGM1
    SolutionIndex: 4
    SolutionNameMin: Cijk_Alik_Bjlk_SB_MT128x128x16_SN_SU0_SUM0_TT8_8_WG16_16_1_WGM1
    SolutionIndex: 5
    SolutionNameMin: Cijk_Alik_Bjlk_SB_MT128x256x16_SN_SU0_SUM0_TT8_16_WG16_16_1_WGM1
    SolutionIndex: 6
    SolutionNameMin: Cijk_Alik_Bjlk_SB_MT128x64x8_SN_SU32_SUM3_TT8_8_WG16_8_1_WGM1
    SolutionIndex: 7
    SolutionNameMin: Cijk_Alik_Bjlk_SB_MT128x128x8_SN_SU32_SUM3_TT8_16_WG16_8_1_WGM1
    SolutionIndex: 8
    SolutionNameMin: Cijk_Alik_Bjlk_SB_MT128x128x8_SN_SU32_SUM3_TT8_8_WG16_16_1_WGM1
    SolutionIndex: 9
    SolutionNameMin: Cijk_Alik_Bjlk_SB_MT128x64x16_SN_SU32_SUM3_TT8_8_WG16_8_1_WGM1
    SolutionIndex: 10
    SolutionNameMin: Cijk_Alik_Bjlk_SB_MT128x128x16_SN_SU32_SUM3_TT8_16_WG16_8_1_WGM1
    SolutionIndex: 11
    SolutionNameMin: Cijk_Alik_Bjlk_SB_MT128x128x16_SN_SU32_SUM3_TT8_8_WG16_16_1_WGM1
    SolutionIndex: 12
    SolutionNameMin: Cijk_Alik_Bjlk_SB_MT128x64x8_SN_SU0_SUM0_TT8_8_WG16_8_1_WGM4
    SolutionIndex: 13
    SolutionNameMin: Cijk_Alik_Bjlk_SB_MT128x128x8_SN_SU0_SUM0_TT8_16_WG16_8_1_WGM4
    SolutionIndex: 14
    SolutionNameMin: Cijk_Alik_Bjlk_SB_MT128x128x8_SN_SU0_SUM0_TT8_8_WG16_16_1_WGM4
    SolutionIndex: 15
    SolutionNameMin: Cijk_Alik_Bjlk_SB_MT128x64x16_SN_SU0_SUM0_TT8_8_WG16_8_1_WGM4
    SolutionIndex: 16
    SolutionNameMin: Cijk_Alik_Bjlk_SB_MT128x128x16_SN_SU0_SUM0_TT8_16_WG16_8_1_WGM4
    SolutionIndex: 17
    SolutionNameMin: Cijk_Alik_Bjlk_SB_MT128x128x16_SN_SU0_SUM0_TT8_8_WG16_16_1_WGM4
    SolutionIndex: 18
    SolutionNameMin: Cijk_Alik_Bjlk_SB_MT128x256x16_SN_SU0_SUM0_TT8_16_WG16_16_1_WGM4
    SolutionIndex: 19
    SolutionNameMin: Cijk_Alik_Bjlk_SB_MT128x64x8_SN_SU32_SUM3_TT8_8_WG16_8_1_WGM4
    SolutionIndex: 20
    SolutionNameMin: Cijk_Alik_Bjlk_SB_MT128x128x8_SN_SU32_SUM3_TT8_16_WG16_8_1_WGM4
    SolutionIndex: 21
    SolutionNameMin: Cijk_Alik_Bjlk_SB_MT128x128x8_SN_SU32_SUM3_TT8_8_WG16_16_1_WGM4
    SolutionIndex: 22
    SolutionNameMin: Cijk_Alik_Bjlk_SB_MT128x128x16_SN_SU32_SUM3_TT8_16_WG16_8_1_WGM4
    SolutionIndex: 23
    SolutionNameMin: Cijk_Alik_Bjlk_SB_MT128x128x16_SN_SU32_SUM3_TT8_8_WG16_16_1_WGM4
    SolutionIndex: 24
    SolutionNameMin: Cijk_Alik_Bjlk_SB_MT128x256x16_SN_SU32_SUM3_TT8_16_WG16_16_1_WGM4
    SolutionIndex: 25
    SolutionNameMin: Cijk_Alik_Bjlk_SB_MT128x64x8_SN_SU0_SUM0_TT8_8_WG16_8_1_WGM8
    SolutionIndex: 26
    SolutionNameMin: Cijk_Alik_Bjlk_SB_MT128x128x8_SN_SU0_SUM0_TT8_16_WG16_8_1_WGM8
    SolutionIndex: 27
    SolutionNameMin: Cijk_Alik_Bjlk_SB_MT128x128x8_SN_SU0_SUM0_TT8_8_WG16_16_1_WGM8
    SolutionIndex: 28
    SolutionNameMin: Cijk_Alik_Bjlk_SB_MT128x64x16_SN_SU0_SUM0_TT8_8_WG16_8_1_WGM8
    SolutionIndex: 29
    SolutionNameMin: Cijk_Alik_Bjlk_SB_MT128x128x16_SN_SU0_SUM0_TT8_16_WG16_8_1_WGM8
    SolutionIndex: 30
    SolutionNameMin: Cijk_Alik_Bjlk_SB_MT128x128x16_SN_SU0_SUM0_TT8_8_WG16_16_1_WGM8
    SolutionIndex: 31
    SolutionNameMin: Cijk_Alik_Bjlk_SB_MT128x256x16_SN_SU0_SUM0_TT8_16_WG16_16_1_WGM8
    SolutionIndex: 32
    SolutionNameMin: Cijk_Alik_Bjlk_SB_MT128x64x8_SN_SU32_SUM3_TT8_8_WG16_8_1_WGM8
    SolutionIndex: 33
    SolutionNameMin: Cijk_Alik_Bjlk_SB_MT128x128x8_SN_SU32_SUM3_TT8_16_WG16_8_1_WGM8
    SolutionIndex: 34
    SolutionNameMin: Cijk_Alik_Bjlk_SB_MT128x128x8_SN_SU32_SUM3_TT8_8_WG16_16_1_WGM8
    SolutionIndex: 35
    SolutionNameMin: Cijk_Alik_Bjlk_SB_MT128x64x16_SN_SU32_SUM3_TT8_8_WG16_8_1_WGM8
    SolutionIndex: 36
    SolutionNameMin: Cijk_Alik_Bjlk_SB_MT128x128x16_SN_SU32_SUM3_TT8_16_WG16_8_1_WGM8
    SolutionIndex: 37
    SolutionNameMin: Cijk_Alik_Bjlk_SB_MT128x128x16_SN_SU32_SUM3_TT8_8_WG16_16_1_WGM8
    SolutionIndex: 38
    SolutionNameMin: Cijk_Alik_Bjlk_SB_MT64x64x8_SN_SU0_SUM0_TT8_8_WG8_8_1_WGM1
    SolutionIndex: 39
    SolutionNameMin: Cijk_Alik_Bjlk_SB_MT64x64x8_SN_SU0_SUM0_TT4_8_WG16_8_1_WGM1
    SolutionIndex: 40
    SolutionNameMin: Cijk_Alik_Bjlk_SB_MT128x64x8_SN_SU0_SUM0_TT8_8_WG16_8_1_WGM1
    SolutionIndex: 41
    SolutionNameMin: Cijk_Alik_Bjlk_SB_MT128x128x8_SN_SU0_SUM0_TT8_8_WG16_16_1_WGM1
    SolutionIndex: 42
    SolutionNameMin: Cijk_Alik_Bjlk_SB_MT32x64x16_SN_SU0_SUM0_TT4_8_WG8_8_1_WGM1
    SolutionIndex: 43
    SolutionNameMin: Cijk_Alik_Bjlk_SB_MT64x64x16_SN_SU0_SUM0_TT8_8_WG8_8_1_WGM1
    SolutionIndex: 44
    SolutionNameMin: Cijk_Alik_Bjlk_SB_MT64x64x16_SN_SU0_SUM0_TT4_8_WG16_8_1_WGM1
    SolutionIndex: 45
    SolutionNameMin: Cijk_Alik_Bjlk_SB_MT128x64x16_SN_SU0_SUM0_TT8_8_WG16_8_1_WGM1
    SolutionIndex: 46
    SolutionNameMin: Cijk_Alik_Bjlk_SB_MT128x128x16_SN_SU0_SUM0_TT8_8_WG16_16_1_WGM1
    SolutionIndex: 47
    SolutionNameMin: Cijk_Alik_Bjlk_SB_MT64x64x8_SN_SU32_SUM3_TT8_8_WG8_8_1_WGM1
    SolutionIndex: 48
    SolutionNameMin: Cijk_Alik_Bjlk_SB_MT64x64x8_SN_SU32_SUM3_TT4_8_WG16_8_1_WGM1
    SolutionIndex: 49
    SolutionNameMin: Cijk_Alik_Bjlk_SB_MT128x64x8_SN_SU32_SUM3_TT8_8_WG16_8_1_WGM1
    SolutionIndex: 50
    SolutionNameMin: Cijk_Alik_Bjlk_SB_MT64x128x8_SN_SU32_SUM3_TT4_8_WG16_16_1_WGM1
    SolutionIndex: 51
    SolutionNameMin: Cijk_Alik_Bjlk_SB_MT128x128x8_SN_SU32_SUM3_TT8_8_WG16_16_1_WGM1
    SolutionIndex: 52
    SolutionNameMin: Cijk_Alik_Bjlk_SB_MT64x64x16_SN_SU32_SUM3_TT8_8_WG8_8_1_WGM1
    SolutionIndex: 53
    SolutionNameMin: Cijk_Alik_Bjlk_SB_MT64x64x16_SN_SU32_SUM3_TT4_8_WG16_8_1_WGM1
    SolutionIndex: 54
    SolutionNameMin: Cijk_Alik_Bjlk_SB_MT128x64x16_SN_SU32_SUM3_TT8_8_WG16_8_1_WGM1
    SolutionIndex: 55
    SolutionNameMin: Cijk_Alik_Bjlk_SB_MT128x128x16_SN_SU32_SUM3_TT8_8_WG16_16_1_WGM1
    SolutionIndex: 56
    SolutionNameMin: Cijk_Alik_Bjlk_SB_MT32x64x8_SN_SU0_SUM0_TT4_8_WG8_8_1_WGM4
    SolutionIndex: 57
    SolutionNameMin: Cijk_Alik_Bjlk_SB_MT64x64x8_SN_SU0_SUM0_TT8_8_WG8_8_1_WGM4
    SolutionIndex: 58
    SolutionNameMin: Cijk_Alik_Bjlk_SB_MT64x64x8_SN_SU0_SUM0_TT4_8_WG16_8_1_WGM4
    SolutionIndex: 59
    SolutionNameMin: Cijk_Alik_Bjlk_SB_MT128x64x8_SN_SU0_SUM0_TT8_8_WG16_8_1_WGM4
    SolutionIndex: 60
    SolutionNameMin: Cijk_Alik_Bjlk_SB_MT128x128x8_SN_SU0_SUM0_TT8_8_WG16_16_1_WGM4
    SolutionIndex: 61
    SolutionNameMin: Cijk_Alik_Bjlk_SB_MT64x64x16_SN_SU0_SUM0_TT8_8_WG8_8_1_WGM4
    SolutionIndex: 62
    SolutionNameMin: Cijk_Alik_Bjlk_SB_MT64x64x16_SN_SU0_SUM0_TT4_8_WG16_8_1_WGM4
    SolutionIndex: 63
    SolutionNameMin: Cijk_Alik_Bjlk_SB_MT128x64x16_SN_SU0_SUM0_TT8_8_WG16_8_1_WGM4
    SolutionIndex: 64
    SolutionNameMin: Cijk_Alik_Bjlk_SB_MT128x128x16_SN_SU0_SUM0_TT8_8_WG16_16_1_WGM4
    SolutionIndex: 65
    SolutionNameMin: Cijk_Alik_Bjlk_SB_MT64x128x32_SN_SU0_SUM0_TT4_8_WG16_16_1_WGM4
    SolutionIndex: 66
    SolutionNameMin: Cijk_Alik_Bjlk_SB_MT32x64x8_SN_SU32_SUM3_TT4_8_WG8_8_1_WGM4
    SolutionIndex: 67
    SolutionNameMin: Cijk_Alik_Bjlk_SB_MT64x64x8_SN_SU32_SUM3_TT8_8_WG8_8_1_WGM4
    SolutionIndex: 68
    SolutionNameMin: Cijk_Alik_Bjlk_SB_MT128x64x8_SN_SU32_SUM3_TT8_8_WG16_8_1_WGM4
    SolutionIndex: 69
    SolutionNameMin: Cijk_Alik_Bjlk_SB_MT128x128x8_SN_SU32_SUM3_TT8_8_WG16_16_1_WGM4
    SolutionIndex: 70
    SolutionNameMin: Cijk_Alik_Bjlk_SB_MT64x64x16_SN_SU32_SUM3_TT8_8_WG8_8_1_WGM4
    SolutionIndex: 71
    SolutionNameMin: Cijk_Alik_Bjlk_SB_MT64x64x16_SN_SU32_SUM3_TT4_8_WG16_8_1_WGM4
    SolutionIndex: 72
    SolutionNameMin: Cijk_Alik_Bjlk_SB_MT128x64x16_SN_SU32_SUM3_TT8_8_WG16_8_1_WGM4
    SolutionIndex: 73
    SolutionNameMin: Cijk_Alik_Bjlk_SB_MT64x128x16_SN_SU32_SUM3_TT4_8_WG16_16_1_WGM4
    SolutionIndex: 74
    SolutionNameMin: Cijk_Alik_Bjlk_SB_MT128x128x16_SN_SU32_SUM3_TT8_8_WG16_16_1_WGM4
    SolutionIndex: 75
    SolutionNameMin: Cijk_Alik_Bjlk_SB_MT32x64x8_SN_SU0_SUM0_TT4_8_WG8_8_1_WGM8
    SolutionIndex: 76
    SolutionNameMin: Cijk_Alik_Bjlk_SB_MT64x64x8_SN_SU0_SUM0_TT8_8_WG8_8_1_WGM8
    SolutionIndex: 77
    SolutionNameMin: Cijk_Alik_Bjlk_SB_MT64x64x8_SN_SU0_SUM0_TT4_8_WG16_8_1_WGM8
    SolutionIndex: 78
    SolutionNameMin: Cijk_Alik_Bjlk_SB_MT128x64x8_SN_SU0_SUM0_TT8_8_WG16_8_1_WGM8
    SolutionIndex: 79
    SolutionNameMin: Cijk_Alik_Bjlk_SB_MT128x128x8_SN_SU0_SUM0_TT8_8_WG16_16_1_WGM8
    SolutionIndex: 80
    SolutionNameMin: Cijk_Alik_Bjlk_SB_MT64x64x16_SN_SU0_SUM0_TT8_8_WG8_8_1_WGM8
    SolutionIndex: 81
    SolutionNameMin: Cijk_Alik_Bjlk_SB_MT128x64x16_SN_SU0_SUM0_TT8_8_WG16_8_1_WGM8
    SolutionIndex: 82
    SolutionNameMin: Cijk_Alik_Bjlk_SB_MT128x128x16_SN_SU0_SUM0_TT8_8_WG16_16_1_WGM8
    SolutionIndex: 83
    SolutionNameMin: Cijk_Alik_Bjlk_SB_MT64x64x8_SN_SU32_SUM3_TT8_8_WG8_8_1_WGM8
    SolutionIndex: 84
    SolutionNameMin: Cijk_Alik_Bjlk_SB_MT64x64x8_SN_SU32_SUM3_TT4_8_WG16_8_1_WGM8
    SolutionIndex: 85
    SolutionNameMin: Cijk_Alik_Bjlk_SB_MT128x64x8_SN_SU32_SUM3_TT8_8_WG16_8_1_WGM8
    SolutionIndex: 86
    SolutionNameMin: Cijk_Alik_Bjlk_SB_MT128x128x8_SN_SU32_SUM3_TT8_8_WG16_16_1_WGM8
    SolutionIndex: 87
    SolutionNameMin: Cijk_Alik_Bjlk_SB_MT64x64x16_SN_SU32_SUM3_TT8_8_WG8_8_1_WGM8
    SolutionIndex: 88
    SolutionNameMin: Cijk_Alik_Bjlk_SB_MT128x64x16_SN_SU32_SUM3_TT8_8_WG16_8_1_WGM8
    SolutionIndex: 89
    SolutionNameMin: Cijk_Alik_Bjlk_SB_MT128x128x16_SN_SU32_SUM3_TT8_8_WG16_16_1_WGM8
    SolutionIndex: 90
    SolutionNameMin: Cijk_Alik_Bjlk_SB_MT16x16x8_SN_SU0_SUM0_TT2_2_WG8_8_1_WGM1
    SolutionIndex: 91
    SolutionNameMin: Cijk_Alik_Bjlk_SB_MT32x32x8_SN_SU0_SUM0_TT4_4_WG8_8_1_WGM1
    SolutionIndex: 92
    SolutionNameMin: Cijk_Alik_Bjlk_SB_MT32x16x8_SN_SU0_SUM0_TT2_2_WG16_8_1_WGM1
    SolutionIndex: 93
    SolutionNameMin: Cijk_Alik_Bjlk_SB_MT64x32x8_SN_SU0_SUM0_TT4_4_WG16_8_1_WGM1
    SolutionIndex: 94
    SolutionNameMin: Cijk_Alik_Bjlk_SB_MT32x32x8_SN_SU0_SUM0_TT2_2_WG16_16_1_WGM1
    SolutionIndex: 95
    SolutionNameMin: Cijk_Alik_Bjlk_SB_MT64x64x8_SN_SU0_SUM0_TT4_4_WG16_16_1_WGM1
    SolutionIndex: 96
    SolutionNameMin: Cijk_Alik_Bjlk_SB_MT16x16x16_SN_SU0_SUM0_TT2_2_WG8_8_1_WGM1
    SolutionIndex: 97
    SolutionNameMin: Cijk_Alik_Bjlk_SB_MT32x16x16_SN_SU0_SUM0_TT2_2_WG16_8_1_WGM1
    SolutionIndex: 98
    SolutionNameMin: Cijk_Alik_Bjlk_SB_MT32x32x16_SN_SU0_SUM0_TT2_2_WG16_16_1_WGM1
    SolutionIndex: 99
    SolutionNameMin: Cijk_Alik_Bjlk_SB_MT16x16x32_SN_SU0_SUM0_TT2_2_WG8_8_1_WGM1
    SolutionIndex: 100
    SolutionNameMin: Cijk_Alik_Bjlk_SB_MT16x16x8_SN_SU32_SUM3_TT2_2_WG8_8_1_WGM1
    SolutionIndex: 101
    SolutionNameMin: Cijk_Alik_Bjlk_SB_MT32x32x8_SN_SU32_SUM3_TT4_4_WG8_8_1_WGM1
    SolutionIndex: 102
    SolutionNameMin: Cijk_Alik_Bjlk_SB_MT32x16x8_SN_SU32_SUM3_TT2_2_WG16_8_1_WGM1
    SolutionIndex: 103
    SolutionNameMin: Cijk_Alik_Bjlk_SB_MT64x32x8_SN_SU32_SUM3_TT4_4_WG16_8_1_WGM1
    SolutionIndex: 104
    SolutionNameMin: Cijk_Alik_Bjlk_SB_MT32x32x8_SN_SU32_SUM3_TT2_2_WG16_16_1_WGM1
    SolutionIndex: 105
    SolutionNameMin: Cijk_Alik_Bjlk_SB_MT64x64x8_SN_SU32_SUM3_TT4_4_WG16_16_1_WGM1
    SolutionIndex: 106
    SolutionNameMin: Cijk_Alik_Bjlk_SB_MT16x16x16_SN_SU32_SUM3_TT2_2_WG8_8_1_WGM1
    SolutionIndex: 107
    SolutionNameMin: Cijk_Alik_Bjlk_SB_MT32x32x16_SN_SU32_SUM3_TT4_4_WG8_8_1_WGM1
    SolutionIndex: 108
    SolutionNameMin: Cijk_Alik_Bjlk_SB_MT32x32x16_SN_SU32_SUM3_TT2_2_WG16_16_1_WGM1
    SolutionIndex: 109
    SolutionNameMin: Cijk_Alik_Bjlk_SB_MT64x64x16_SN_SU32_SUM3_TT4_4_WG16_16_1_WGM1
    SolutionIndex: 110
    SolutionNameMin: Cijk_Alik_Bjlk_SB_MT16x16x32_SN_SU32_SUM3_TT2_2_WG8_8_1_WGM1
    SolutionIndex: 111
    SolutionNameMin: Cijk_Alik_Bjlk_SB_MT16x16x8_SN_SU0_SUM0_TT2_2_WG8_8_1_WGM4
    SolutionIndex: 112
    SolutionNameMin: Cijk_Alik_Bjlk_SB_MT32x32x8_SN_SU0_SUM0_TT4_4_WG8_8_1_WGM4
    SolutionIndex: 113
    SolutionNameMin: Cijk_Alik_Bjlk_SB_MT64x32x8_SN_SU0_SUM0_TT4_4_WG16_8_1_WGM4
    SolutionIndex: 114
    SolutionNameMin: Cijk_Alik_Bjlk_SB_MT32x32x8_SN_SU0_SUM0_TT2_2_WG16_16_1_WGM4
    SolutionIndex: 115
    SolutionNameMin: Cijk_Alik_Bjlk_SB_MT64x64x8_SN_SU0_SUM0_TT4_4_WG16_16_1_WGM4
    SolutionIndex: 116
    SolutionNameMin: Cijk_Alik_Bjlk_SB_MT16x16x16_SN_SU0_SUM0_TT2_2_WG8_8_1_WGM4
    SolutionIndex: 117
    SolutionNameMin: Cijk_Alik_Bjlk_SB_MT16x16x32_SN_SU0_SUM0_TT2_2_WG8_8_1_WGM4
    SolutionIndex: 118
    SolutionNameMin: Cijk_Alik_Bjlk_SB_MT32x32x32_SN_SU0_SUM0_TT2_2_WG16_16_1_WGM4
    SolutionIndex: 119
    SolutionNameMin: Cijk_Alik_Bjlk_SB_MT16x16x8_SN_SU32_SUM3_TT2_2_WG8_8_1_WGM4
    SolutionIndex: 120
    SolutionNameMin: Cijk_Alik_Bjlk_SB_MT32x32x8_SN_SU32_SUM3_TT4_4_WG8_8_1_WGM4
    SolutionIndex: 121
    SolutionNameMin: Cijk_Alik_Bjlk_SB_MT32x16x8_SN_SU32_SUM3_TT2_2_WG16_8_1_WGM4
    SolutionIndex: 122
    SolutionNameMin: Cijk_Alik_Bjlk_SB_MT64x32x8_SN_SU32_SUM3_TT4_4_WG16_8_1_WGM4
    SolutionIndex: 123
    SolutionNameMin: Cijk_Alik_Bjlk_SB_MT32x32x8_SN_SU32_SUM3_TT2_2_WG16_16_1_WGM4
    SolutionIndex: 124
    SolutionNameMin: Cijk_Alik_Bjlk_SB_MT64x64x8_SN_SU32_SUM3_TT4_4_WG16_16_1_WGM4
    SolutionIndex: 125
    SolutionNameMin: Cijk_Alik_Bjlk_SB_MT16x16x16_SN_SU32_SUM3_TT2_2_WG8_8_1_WGM4
    SolutionIndex: 126
    SolutionNameMin: Cijk_Alik_Bjlk_SB_MT32x16x16_SN_SU32_SUM3_TT2_2_WG16_8_1_WGM4
    SolutionIndex: 127
    SolutionNameMin: Cijk_Alik_Bjlk_SB_MT16x16x32_SN_SU32_SUM3_TT2_2_WG8_8_1_WGM4
    SolutionIndex: 128
    SolutionNameMin: Cijk_Alik_Bjlk_SB_MT32x32x8_SN_SU0_SUM0_TT4_4_WG8_8_1_WGM8
    SolutionIndex: 129
    SolutionNameMin: Cijk_Alik_Bjlk_SB_MT32x16x8_SN_SU0_SUM0_TT2_2_WG16_8_1_WGM8
    SolutionIndex: 130
    SolutionNameMin: Cijk_Alik_Bjlk_SB_MT64x32x8_SN_SU0_SUM0_TT4_4_WG16_8_1_WGM8
    SolutionIndex: 131
    SolutionNameMin: Cijk_Alik_Bjlk_SB_MT64x64x8_SN_SU0_SUM0_TT4_4_WG16_16_1_WGM8
    SolutionIndex: 132
    SolutionNameMin: Cijk_Alik_Bjlk_SB_MT32x32x16_SN_SU0_SUM0_TT2_2_WG16_16_1_WGM8
    SolutionIndex: 133
    SolutionNameMin: Cijk_Alik_Bjlk_SB_MT64x64x16_SN_SU0_SUM0_TT4_4_WG16_16_1_WGM8
    SolutionIndex: 134
    SolutionNameMin: Cijk_Alik_Bjlk_SB_MT16x16x32_SN_SU0_SUM0_TT2_2_WG8_8_1_WGM8
    SolutionIndex: 135
    SolutionNameMin: Cijk_Alik_Bjlk_SB_MT16x16x8_SN_SU32_SUM3_TT2_2_WG8_8_1_WGM8
    SolutionIndex: 136
    SolutionNameMin: Cijk_Alik_Bjlk_SB_MT32x32x8_SN_SU32_SUM3_TT4_4_WG8_8_1_WGM8
    SolutionIndex: 137
    SolutionNameMin: Cijk_Alik_Bjlk_SB_MT32x16x8_SN_SU32_SUM3_TT2_2_WG16_8_1_WGM8
    SolutionIndex: 138
    SolutionNameMin: Cijk_Alik_Bjlk_SB_MT64x32x8_SN_SU32_SUM3_TT4_4_WG16_8_1_WGM8
    SolutionIndex: 139
    SolutionNameMin: Cijk_Alik_Bjlk_SB_MT32x32x8_SN_SU32_SUM3_TT2_2_WG16_16_1_WGM8
    SolutionIndex: 140
    SolutionNameMin: Cijk_Alik_Bjlk_SB_MT64x64x8_SN_SU32_SUM3_TT4_4_WG16_16_1_WGM8
    SolutionIndex: 141
    SolutionNameMin: Cijk_Alik_Bjlk_SB_MT16x16x16_SN_SU32_SUM3_TT2_2_WG8_8_1_WGM8
    SolutionIndex: 142
    SolutionNameMin: Cijk_Alik_Bjlk_SB_MT32x8x8_SN_SU32_SUM3_TT2_2_WG16_4_1_WGM1
    SolutionIndex: 143
    SolutionNameMin: Cijk_Alik_Bjlk_SB_MT64x4x16_SN_SU32_SUM3_TT4_1_WG16_4_1_WGM1
    SolutionIndex: 144
    SolutionNameMin: Cijk_Alik_Bjlk_SB_MT32x8x8_SN_SU32_SUM3_TT2_2_WG16_4_1_WGM4
    SolutionIndex: 145
    SolutionNameMin: Cijk_Alik_Bjlk_SB_MT64x8x8_SN_SU32_SUM3_TT4_2_WG16_4_1_WGM4
    SolutionIndex: 146
    SolutionNameMin: Cijk_Alik_Bjlk_SB_MT64x4x16_SN_SU32_SUM3_TT4_1_WG16_4_1_WGM4
    SolutionIndex: 147
    SolutionNameMin: Cijk_Alik_Bjlk_SB_MT32x8x8_SN_SU32_SUM3_TT2_2_WG16_4_1_WGM8
    SolutionIndex: 148
    SolutionNameMin: Cijk_Alik_Bjlk_SB_MT64x8x8_SN_SU32_SUM3_TT4_2_WG16_4_1_WGM8
    SolutionIndex: 149
    SolutionNameMin: Cijk_Alik_Bjlk_SB_MT8x32x8_SN_SU0_SUM0_TT1_4_WG8_8_1_WGM1
    SolutionIndex: 150
    SolutionNameMin: Cijk_Alik_Bjlk_SB_MT8x32x16_SN_SU0_SUM0_TT1_4_WG8_8_1_WGM1
    SolutionIndex: 151
    SolutionNameMin: Cijk_Alik_Bjlk_SB_MT8x32x8_SN_SU32_SUM3_TT1_4_WG8_8_1_WGM1
    SolutionIndex: 152
    SolutionNameMin: Cijk_Alik_Bjlk_SB_MT8x32x16_SN_SU32_SUM3_TT1_4_WG8_8_1_WGM1
    SolutionIndex: 153
    SolutionNameMin: Cijk_Alik_Bjlk_SB_MT8x32x32_SN_SU32_SUM3_TT1_4_WG8_8_1_WGM1
    SolutionIndex: 154
    SolutionNameMin: Cijk_Alik_Bjlk_SB_MT8x32x8_SN_SU0_SUM0_TT1_4_WG8_8_1_WGM4
    SolutionIndex: 155
    SolutionNameMin: Cijk_Alik_Bjlk_SB_MT8x32x16_SN_SU0_SUM0_TT1_4_WG8_8_1_WGM4
    SolutionIndex: 156
    SolutionNameMin: Cijk_Alik_Bjlk_SB_MT8x32x8_SN_SU32_SUM3_TT1_4_WG8_8_1_WGM4
    SolutionIndex: 157
    SolutionNameMin: Cijk_Alik_Bjlk_SB_MT8x32x16_SN_SU32_SUM3_TT1_4_WG8_8_1_WGM4
    SolutionIndex: 158
    SolutionNameMin: Cijk_Alik_Bjlk_SB_MT8x32x32_SN_SU32_SUM3_TT1_4_WG8_8_1_WGM4
    SolutionIndex: 159
    SolutionNameMin: Cijk_Alik_Bjlk_SB_MT8x32x8_SN_SU0_SUM0_TT1_4_WG8_8_1_WGM8
    SolutionIndex: 160
    SolutionNameMin: Cijk_Alik_Bjlk_SB_MT8x32x16_SN_SU0_SUM0_TT1_4_WG8_8_1_WGM8
    SolutionIndex: 161
    SolutionNameMin: Cijk_Alik_Bjlk_SB_MT8x32x32_SN_SU0_SUM0_TT1_4_WG8_8_1_WGM8
    SolutionIndex: 162
    SolutionNameMin: Cijk_Alik_Bjlk_SB_MT8x32x8_SN_SU32_SUM3_TT1_4_WG8_8_1_WGM8
    SolutionIndex: 163
    SolutionNameMin: Cijk_Alik_Bjlk_SB_MT8x32x16_SN_SU32_SUM3_TT1_4_WG8_8_1_WGM8
- - - [2944, 4288, 1, 1280, 2944, 2944, 1280, 4288]
    - [36, 12095.0]
  - - [2368, 5888, 1, 256, 2368, 2368, 256, 5888]
    - [3, 11645.0]
  - - [5888, 1024, 1, 1280, 5888, 5888, 1280, 1024]
    - [29, 11978.0]
  - - [5888, 1856, 1, 3328, 5888, 5888, 3328, 1856]
    - [29, 11973.0]
  - - [5056, 704, 1, 256, 5056, 5056, 256, 704]
    - [32, 10058.0]
  - - [5888, 2944, 1, 3328, 5888, 5888, 3328, 2944]
    - [16, 12565.0]
  - - [1856, 4288, 1, 256, 1856, 1856, 256, 4288]
    - [29, 10901.0]
  - - [1024, 5056, 1, 128, 1024, 1024, 128, 5056]
    - [6, 10329.0]
  - - [5056, 5056, 1, 3328, 5056, 5056, 3328, 5056]
    - [16, 12297.0]
  - - [1408, 5888, 1, 1280, 1408, 1408, 1280, 5888]
    - [29, 12114.0]
  - - [1024, 3584, 1, 3328, 1024, 1024, 3328, 3584]
    - [5, 11590.0]
  - - [5888, 1408, 1, 1280, 5888, 5888, 1280, 1408]
    - [29, 12113.0]
  - - [1024, 2368, 1, 256, 1024, 1024, 256, 2368]
    - [23, 9869.0]
  - - [1408, 1856, 1, 1280, 1408, 1408, 1280, 1856]
    - [29, 10714.0]
  - - [5056, 5056, 1, 1280, 5056, 5056, 1280, 5056]
    - [29, 12263.0]
  - - [448, 5056, 1, 256, 448, 448, 256, 5056]
    - [21, 9290.0]
  - - [1856, 1408, 1, 128, 1856, 1856, 128, 1408]
    - [19, 9407.0]
  - - [6784, 256, 1, 3328, 6784, 6784, 3328, 256]
    - [22, 10632.0]
  - - [6784, 4288, 1, 3328, 6784, 6784, 3328, 4288]
    - [29, 12347.0]
  - - [4288, 448, 1, 256, 4288, 4288, 256, 448]
    - [9, 8925.0]
  - - [1856, 2368, 1, 3328, 1856, 1856, 3328, 2368]
    - [3, 11117.0]
  - - [4288, 2944, 1, 1280, 4288, 4288, 1280, 2944]
    - [29, 12107.0]
  - - [704, 5056, 1, 1280, 704, 704, 1280, 5056]
    - [10, 11003.0]
  - - [2368, 704, 1, 3328, 2368, 2368, 3328, 704]
    - [3, 10150.0]
  - - [256, 5888, 1, 256, 256, 256, 256, 5888]
    - [10, 9232.0]
  - - [1856, 4288, 1, 3328, 1856, 1856, 3328, 4288]
    - [18, 11723.0]
  - - [5888, 1024, 1, 256, 5888, 5888, 256, 1024]
    - [26, 11136.0]
  - - [448, 5056, 1, 3328, 448, 448, 3328, 5056]
    - [24, 10559.0]
  - - [1408, 2944, 1, 256, 1408, 1408, 256, 2944]
    - [29, 11361.0]
  - - [6784, 5056, 1, 3328, 6784, 6784, 3328, 5056]
    - [22, 12478.0]
  - - [5056, 5056, 1, 256, 5056, 5056, 256, 5056]
    - [36, 11969.0]
  - - [1408, 6784, 1, 128, 1408, 1408, 128, 6784]
    - [33, 11346.0]
  - - [704, 5056, 1, 128, 704, 704, 128, 5056]
    - [25, 9616.0]
  - - [2368, 2944, 1, 1280, 2368, 2368, 1280, 2944]
    - [3, 12028.0]
  - - [6784, 6784, 1, 1280, 6784, 6784, 1280, 6784]
    - [16, 12609.0]
  - - [1408, 4288, 1, 1280, 1408, 1408, 1280, 4288]
    - [16, 11963.0]
  - - [3584, 4288, 1, 1280, 3584, 3584, 1280, 4288]
    - [29, 12285.0]
  - - [2368, 704, 1, 1280, 2368, 2368, 1280, 704]
    - [29, 9901.0]
  - - [5056, 4288, 1, 3328, 5056, 5056, 3328, 4288]
    - [10, 12283.0]
  - - [3584, 2368, 1, 3328, 3584, 3584, 3328, 2368]
    - [29, 12031.0]
  - - [6784, 448, 1, 1280, 6784, 6784, 1280, 448]
    - [9, 10225.0]
  - - [1408, 2944, 1, 128, 1408, 1408, 128, 2944]
    - [34, 10620.0]
  - - [4288, 2944, 1, 256, 4288, 4288, 256, 2944]
    - [36, 11720.0]
  - - [5888, 704, 1, 1280, 5888, 5888, 1280, 704]
    - [10, 11086.0]
  - - [448, 5888, 1, 128, 448, 448, 128, 5888]
    - [12, 8918.0]
  - - [5056, 2368, 1, 1280, 5056, 5056, 1280, 2368]
    - [29, 12032.0]
  - - [448, 3584, 1, 1280, 448, 448, 1280, 3584]
    - [13, 9614.0]
  - - [6784, 5888, 1, 256, 6784, 6784, 256, 5888]
    - [29, 12431.0]
  - - [5888, 2944, 1, 128, 5888, 5888, 128, 2944]
    - [16, 11696.0]
  - - [1024, 1408, 1, 256, 1024, 1024, 256, 1408]
    - [6, 9780.0]
  - - [2368, 2368, 1, 3328, 2368, 2368, 3328, 2368]
    - [16, 11308.0]
  - - [1856, 6784, 1, 128, 1856, 1856, 128, 6784]
    - [3, 11080.0]
  - - [5056, 704, 1, 3328, 5056, 5056, 3328, 704]
    - [16, 11149.0]
  - - [1408, 1856, 1, 256, 1408, 1408, 256, 1856]
    - [27, 9908.0]
  - - [2368, 5056, 1, 256, 2368, 2368, 256, 5056]
    - [16, 11598.0]
  - - [5888, 1856, 1, 256, 5888, 5888, 256, 1856]
    - [10, 11535.0]
  - - [704, 5888, 1, 256, 704, 704, 256, 5888]
    - [1, 10465.0]
  - - [2944, 6784, 1, 3328, 2944, 2944, 3328, 6784]
    - [29, 12627.0]
  - - [3584, 704, 1, 3328, 3584, 3584, 3328, 704]
    - [16, 10240.0]
  - - [448, 4288, 1, 256, 448, 448, 256, 4288]
    - [2, 8658.0]
  - - [704, 2368, 1, 1280, 704, 704, 1280, 2368]
    - [5, 9796.0]
  - - [1856, 2368, 1, 1280, 1856, 1856, 1280, 2368]
    - [29, 11062.0]
  - - [1856, 4288, 1, 1280, 1856, 1856, 1280, 4288]
    - [16, 11668.0]
  - - [704, 2944, 1, 128, 704, 704, 128, 2944]
    - [25, 9180.0]
  - - [1408, 1024, 1, 1280, 1408, 1408, 1280, 1024]
    - [16, 10348.0]
  - - [704, 6784, 1, 256, 704, 704, 256, 6784]
    - [16, 10257.0]
  - - [6784, 704, 1, 256, 6784, 6784, 256, 704]
    - [10, 10223.0]
  - - [5056, 1408, 1, 128, 5056, 5056, 128, 1408]
    - [26, 10520.0]
  - - [3584, 4288, 1, 3328, 3584, 3584, 3328, 4288]
    - [29, 12341.0]
  - - [5888, 1856, 1, 1280, 5888, 5888, 1280, 1856]
    - [29, 11926.0]
  - - [5056, 1024, 1, 3328, 5056, 5056, 3328, 1024]
    - [16, 12258.0]
  - - [1024, 4288, 1, 128, 1024, 1024, 128, 4288]
    - [6, 10083.0]
  - - [2368, 3584, 1, 1280, 2368, 2368, 1280, 3584]
    - [16, 11982.0]
  - - [2368, 6784, 1, 1280, 2368, 2368, 1280, 6784]
    - [16, 12111.0]
  - - [2944, 3584, 1, 3328, 2944, 2944, 3328, 3584]
    - [16, 12333.0]
  - - [6784, 2944, 1, 256, 6784, 6784, 256, 2944]
    - [10, 12288.0]
  - - [4288, 2368, 1, 3328, 4288, 4288, 3328, 2368]
    - [29, 11835.0]
  - - [1856, 2368, 1, 256, 1856, 1856, 256, 2368]
    - [27, 10062.0]
  - - [3584, 6784, 1, 3328, 3584, 3584, 3328, 6784]
    - [16, 12563.0]
  - - [1024, 5888, 1, 3328, 1024, 1024, 3328, 5888]
    - [16, 12119.0]
  - - [5056, 4288, 1, 1280, 5056, 5056, 1280, 4288]
    - [29, 12245.0]
  - - [1408, 5056, 1, 1280, 1408, 1408, 1280, 5056]
    - [16, 12203.0]
  - - [2944, 5888, 1, 128, 2944, 2944, 128, 5888]
    - [33, 11706.0]
  - - [704, 5888, 1, 1280, 704, 704, 1280, 5888]
    - [5, 11121.0]
  - - [2368, 3584, 1, 128, 2368, 2368, 128, 3584]
    - [20, 10855.0]
  - - [6784, 5888, 1, 3328, 6784, 6784, 3328, 5888]
    - [3, 12630.0]
  - - [1024, 5056, 1, 1280, 1024, 1024, 1280, 5056]
    - [16, 12060.0]
  - - [4288, 1024, 1, 256, 4288, 4288, 256, 1024]
    - [26, 10765.0]
  - - [2944, 2368, 1, 128, 2944, 2944, 128, 2368]
    - [25, 10806.0]
  - - [5888, 448, 1, 1280, 5888, 5888, 1280, 448]
    - [28, 9984.0]
  - - [704, 5888, 1, 3328, 704, 704, 3328, 5888]
    - [31, 11207.0]
  - - [3584, 2944, 1, 256, 3584, 3584, 256, 2944]
    - [36, 11782.0]
  - - [2368, 1024, 1, 3328, 2368, 2368, 3328, 1024]
    - [18, 11361.0]
  - - [1408, 5056, 1, 3328, 1408, 1408, 3328, 5056]
    - [16, 12338.0]
  - - [1856, 1856, 1, 3328, 1856, 1856, 3328, 1856]
    - [3, 10828.0]
  - - [2368, 2368, 1, 256, 2368, 2368, 256, 2368]
    - [16, 10417.0]
  - - [4288, 4288, 1, 1280, 4288, 4288, 1280, 4288]
    - [16, 12176.0]
  - - [1408, 4288, 1, 256, 1408, 1408, 256, 4288]
    - [26, 10984.0]
  - - [5888, 448, 1, 128, 5888, 5888, 128, 448]
    - [25, 9753.0]
  - - [704, 6784, 1, 3328, 704, 704, 3328, 6784]
    - [3, 11324.0]
  - - [5888, 5888, 1, 1280, 5888, 5888, 1280, 5888]
    - [29, 12617.0]
  - - [5056, 1024, 1, 1280, 5056, 5056, 1280, 1024]
    - [16, 12098.0]
  - - [448, 5888, 1, 3328, 448, 448, 3328, 5888]
    - [5, 9975.0]
  - - [1024, 2944, 1, 1280, 1024, 1024, 1280, 2944]
    - [3, 11170.0]
  - - [5056, 5888, 1, 1280, 5056, 5056, 1280, 5888]
    - [29, 12451.0]
  - - [4288, 5888, 1, 128, 4288, 4288, 128, 5888]
    - [26, 11610.0]
  - - [1408, 3584, 1, 128, 1408, 1408, 128, 3584]
    - [33, 10791.0]
  - - [448, 3584, 1, 128, 448, 448, 128, 3584]
    - [23, 8535.0]
  - - [5888, 2944, 1, 1280, 5888, 5888, 1280, 2944]
    - [10, 12565.0]
  - - [2368, 5888, 1, 128, 2368, 2368, 128, 5888]
    - [1, 10953.0]
  - - [3584, 5888, 1, 256, 3584, 3584, 256, 5888]
    - [29, 12271.0]
  - - [2368, 704, 1, 128, 2368, 2368, 128, 704]
    - [25, 8943.0]
  - - [3584, 2944, 1, 1280, 3584, 3584, 1280, 2944]
    - [10, 12276.0]
  - - [3584, 2368, 1, 128, 3584, 3584, 128, 2368]
    - [25, 10747.0]
  - - [5056, 704, 1, 128, 5056, 5056, 128, 704]
    - [32, 10234.0]
  - - [5056, 1408, 1, 3328, 5056, 5056, 3328, 1408]
    - [29, 12330.0]
  - - [6784, 1024, 1, 3328, 6784, 6784, 3328, 1024]
    - [18, 12109.0]
  - - [6784, 2944, 1, 3328, 6784, 6784, 3328, 2944]
    - [29, 12639.0]
  - - [2944, 5056, 1, 3328, 2944, 2944, 3328, 5056]
    - [29, 12446.0]
  - - [1856, 1856, 1, 256, 1856, 1856, 256, 1856]
    - [14, 9805.0]
  - - [1024, 5888, 1, 128, 1024, 1024, 128, 5888]
    - [10, 10731.0]
  - - [6784, 2368, 1, 1280, 6784, 6784, 1280, 2368]
    - [29, 12102.0]
  - - [4288, 5888, 1, 1280, 4288, 4288, 1280, 5888]
    - [29, 12343.0]
  - - [4288, 4288, 1, 256, 4288, 4288, 256, 4288]
    - [10, 11845.0]
  - - [4288, 1856, 1, 1280, 4288, 4288, 1280, 1856]
    - [3, 11666.0]
  - - [1856, 2944, 1, 3328, 1856, 1856, 3328, 2944]
    - [10, 11594.0]
  - - [256, 6784, 1, 3328, 256, 256, 3328, 6784]
    - [3, 10666.0]
  - - [256, 5056, 1, 128, 256, 256, 128, 5056]
    - [25, 8775.0]
  - - [5056, 1024, 1, 256, 5056, 5056, 256, 1024]
    - [20, 11467.0]
  - - [5056, 1856, 1, 3328, 5056, 5056, 3328, 1856]
    - [29, 11970.0]
  - - [1856, 1408, 1, 256, 1856, 1856, 256, 1408]
    - [27, 9727.0]
  - - [4288, 1408, 1, 128, 4288, 4288, 128, 1408]
    - [7, 10651.0]
  - - [4288, 5056, 1, 256, 4288, 4288, 256, 5056]
    - [10, 11941.0]
  - - [5056, 256, 1, 3328, 5056, 5056, 3328, 256]
    - [5, 11584.0]
  - - [1024, 5888, 1, 1280, 1024, 1024, 1280, 5888]
    - [16, 12024.0]
  - - [6784, 2368, 1, 128, 6784, 6784, 128, 2368]
    - [20, 11328.0]
  - - [5056, 3584, 1, 256, 5056, 5056, 256, 3584]
    - [29, 12069.0]
  - - [1856, 1024, 1, 1280, 1856, 1856, 1280, 1024]
    - [18, 11384.0]
  - - [6784, 4288, 1, 1280, 6784, 6784, 1280, 4288]
    - [16, 12355.0]
  - - [1856, 1856, 1, 1280, 1856, 1856, 1280, 1856]
    - [16, 10652.0]
  - - [6784, 2944, 1, 128, 6784, 6784, 128, 2944]
    - [36, 11853.0]
  - - [5888, 1856, 1, 128, 5888, 5888, 128, 1856]
    - [25, 11084.0]
  - - [2368, 1024, 1, 128, 2368, 2368, 128, 1024]
    - [2, 9711.0]
  - - [5056, 3584, 1, 128, 5056, 5056, 128, 3584]
    - [33, 11649.0]
  - - [5888, 5888, 1, 3328, 5888, 5888, 3328, 5888]
    - [29, 12638.0]
  - - [6784, 1024, 1, 256, 6784, 6784, 256, 1024]
    - [26, 10540.0]
  - - [2944, 2368, 1, 256, 2944, 2944, 256, 2368]
    - [29, 11423.0]
  - - [5056, 5888, 1, 3328, 5056, 5056, 3328, 5888]
    - [16, 12473.0]
  - - [1856, 1024, 1, 256, 1856, 1856, 256, 1024]
    - [1, 8691.0]
  - - [3584, 448, 1, 1280, 3584, 3584, 1280, 448]
    - [15, 9796.0]
  - - [448, 5888, 1, 256, 448, 448, 256, 5888]
    - [13, 8881.0]
  - - [1408, 6784, 1, 3328, 1408, 1408, 3328, 6784]
    - [29, 12258.0]
  - - [4288, 704, 1, 128, 4288, 4288, 128, 704]
    - [25, 9293.0]
  - - [5056, 2944, 1, 256, 5056, 5056, 256, 2944]
    - [10, 11959.0]
  - - [6784, 5888, 1, 128, 6784, 6784, 128, 5888]
    - [16, 12052.0]
  - - [2368, 1856, 1, 256, 2368, 2368, 256, 1856]
    - [26, 10315.0]
  - - [1408, 3584, 1, 3328, 1408, 1408, 3328, 3584]
    - [16, 12027.0]
  - - [2368, 6784, 1, 256, 2368, 2368, 256, 6784]
    - [22, 11738.0]
  - - [5056, 1408, 1, 1280, 5056, 5056, 1280, 1408]
    - [29, 12238.0]
  - - [5056, 4288, 1, 128, 5056, 5056, 128, 4288]
    - [20, 11398.0]
  - - [1408, 1856, 1, 128, 1408, 1408, 128, 1856]
    - [25, 10350.0]
  - - [1408, 5888, 1, 3328, 1408, 1408, 3328, 5888]
    - [5, 12255.0]
  - - [6784, 6784, 1, 256, 6784, 6784, 256, 6784]
    - [16, 12421.0]
  - - [4288, 2368, 1, 128, 4288, 4288, 128, 2368]
    - [33, 10804.0]
  - - [1856, 4288, 1, 128, 1856, 1856, 128, 4288]
    - [36, 10676.0]
  - - [2368, 2944, 1, 256, 2368, 2368, 256, 2944]
    - [10, 11508.0]
  - - [3584, 1856, 1, 1280, 3584, 3584, 1280, 1856]
    - [3, 11972.0]
  - - [6784, 6784, 1, 128, 6784, 6784, 128, 6784]
    - [29, 12087.0]
  - - [5888, 5056, 1, 256, 5888, 5888, 256, 5056]
    - [10, 12170.0]
  - - [3584, 448, 1, 256, 3584, 3584, 256, 448]
    - [28, 9287.0]
  - - [448, 4288, 1, 128, 448, 448, 128, 4288]
    - [14, 8634.0]
  - - [2944, 4288, 1, 3328, 2944, 2944, 3328, 4288]
    - [16, 12181.0]
  - - [256, 6784, 1, 256, 256, 256, 256, 6784]
    - [19, 9607.0]
  - - [1408, 4288, 1, 128, 1408, 1408, 128, 4288]
    - [25, 10724.0]
  - - [2944, 704, 1, 3328, 2944, 2944, 3328, 704]
    - [3, 10895.0]
  - - [3584, 3584, 1, 256, 3584, 3584, 256, 3584]
    - [10, 11943.0]
  - - [3584, 5056, 1, 256, 3584, 3584, 256, 5056]
    - [10, 12080.0]
  - - [2944, 2368, 1, 1280, 2944, 2944, 1280, 2368]
    - [29, 12003.0]
  - - [1408, 3584, 1, 256, 1408, 1408, 256, 3584]
    - [29, 11453.0]
  - - [6784, 3584, 1, 256, 6784, 6784, 256, 3584]
    - [29, 12270.0]
  - - [5056, 2368, 1, 128, 5056, 5056, 128, 2368]
    - [7, 10855.0]
  - - [2944, 2944, 1, 3328, 2944, 2944, 3328, 2944]
    - [29, 12309.0]
  - - [5056, 6784, 1, 256, 5056, 5056, 256, 6784]
    - [16, 12174.0]
  - - [1856, 3584, 1, 128, 1856, 1856, 128, 3584]
    - [14, 10561.0]
  - - [6784, 448, 1, 256, 6784, 6784, 256, 448]
    - [15, 9901.0]
  - - [3584, 6784, 1, 128, 3584, 3584, 128, 6784]
    - [36, 11797.0]
  - - [5056, 1856, 1, 256, 5056, 5056, 256, 1856]
    - [10, 11439.0]
  - - [1024, 1856, 1, 256, 1024, 1024, 256, 1856]
    - [21, 10192.0]
  - - [1408, 6784, 1, 1280, 1408, 1408, 1280, 6784]
    - [29, 12243.0]
  - - [3584, 3584, 1, 1280, 3584, 3584, 1280, 3584]
    - [16, 12368.0]
  - - [5888, 5888, 1, 128, 5888, 5888, 128, 5888]
    - [29, 11987.0]
  - - [5056, 5888, 1, 128, 5056, 5056, 128, 5888]
    - [29, 11682.0]
  - - [5056, 2368, 1, 3328, 5056, 5056, 3328, 2368]
    - [16, 12078.0]
  - - [2944, 4288, 1, 256, 2944, 2944, 256, 4288]
    - [29, 11612.0]
  - - [1408, 3584, 1, 1280, 1408, 1408, 1280, 3584]
    - [29, 11917.0]
  - - [2368, 6784, 1, 3328, 2368, 2368, 3328, 6784]
    - [29, 12139.0]
  - - [1856, 1408, 1, 1280, 1856, 1856, 1280, 1408]
    - [29, 10590.0]
  - - [6784, 704, 1, 128, 6784, 6784, 128, 704]
    - [25, 10390.0]
  - - [1408, 5888, 1, 256, 1408, 1408, 256, 5888]
    - [29, 11785.0]
  - - [704, 2944, 1, 1280, 704, 704, 1280, 2944]
    - [29, 10673.0]
  - - [1856, 2368, 1, 128, 1856, 1856, 128, 2368]
    - [12, 9480.0]
  - - [3584, 704, 1, 1280, 3584, 3584, 1280, 704]
    - [29, 10149.0]
  - - [2944, 6784, 1, 128, 2944, 2944, 128, 6784]
    - [16, 11832.0]
  - - [3584, 448, 1, 3328, 3584, 3584, 3328, 448]
    - [15, 10117.0]
  - - [704, 2368, 1, 3328, 704, 704, 3328, 2368]
    - [5, 10311.0]
  - - [256, 5888, 1, 128, 256, 256, 128, 5888]
    - [23, 8019.0]
  - - [2944, 2944, 1, 1280, 2944, 2944, 1280, 2944]
    - [29, 12267.0]
  - - [5888, 2368, 1, 256, 5888, 5888, 256, 2368]
    - [10, 11761.0]
  - - [6784, 704, 1, 3328, 6784, 6784, 3328, 704]
    - [16, 11291.0]
  - - [5888, 4288, 1, 128, 5888, 5888, 128, 4288]
    - [16, 11549.0]
  - - [1408, 2944, 1, 3328, 1408, 1408, 3328, 2944]
    - [3, 12074.0]
  - - [3584, 704, 1, 128, 3584, 3584, 128, 704]
    - [15, 8897.0]
  - - [5056, 5056, 1, 128, 5056, 5056, 128, 5056]
    - [36, 11500.0]
  - - [448, 5056, 1, 128, 448, 448, 128, 5056]
    - [14, 8916.0]
  - - [1408, 5056, 1, 128, 1408, 1408, 128, 5056]
    - [20, 11083.0]
  - - [2944, 3584, 1, 128, 2944, 2944, 128, 3584]
    - [20, 11549.0]
  - - [3584, 2368, 1, 256, 3584, 3584, 256, 2368]
    - [16, 11551.0]
  - - [5888, 5056, 1, 1280, 5888, 5888, 1280, 5056]
    - [29, 12453.0]
  - - [2368, 5056, 1, 128, 2368, 2368, 128, 5056]
    - [13, 10906.0]
  - - [3584, 3584, 1, 3328, 3584, 3584, 3328, 3584]
    - [29, 12394.0]
  - - [5888, 6784, 1, 256, 5888, 5888, 256, 6784]
    - [16, 12390.0]
  - - [4288, 2944, 1, 3328, 4288, 4288, 3328, 2944]
    - [16, 12189.0]
  - - [4288, 704, 1, 1280, 4288, 4288, 1280, 704]
    - [16, 10152.0]
  - - [256, 5056, 1, 1280, 256, 256, 1280, 5056]
    - [5, 11199.0]
  - - [2944, 5888, 1, 3328, 2944, 2944, 3328, 5888]
    - [29, 12578.0]
  - - [6784, 5888, 1, 1280, 6784, 6784, 1280, 5888]
    - [16, 12649.0]
  - - [5888, 4288, 1, 1280, 5888, 5888, 1280, 4288]
    - [10, 12324.0]
  - - [5888, 3584, 1, 128, 5888, 5888, 128, 3584]
    - [10, 11741.0]
  - - [1856, 1856, 1, 128, 1856, 1856, 128, 1856]
    - [25, 10030.0]
  - - [3584, 1024, 1, 3328, 3584, 3584, 3328, 1024]
    - [3, 11615.0]
  - - [704, 3584, 1, 128, 704, 704, 128, 3584]
    - [25, 9238.0]
  - - [5888, 448, 1, 3328, 5888, 5888, 3328, 448]
    - [35, 10022.0]
  - - [2368, 4288, 1, 1280, 2368, 2368, 1280, 4288]
    - [36, 11777.0]
  - - [4288, 2944, 1, 128, 4288, 4288, 128, 2944]
    - [7, 11193.0]
  - - [1024, 6784, 1, 3328, 1024, 1024, 3328, 6784]
    - [16, 12105.0]
  - - [5056, 2944, 1, 3328, 5056, 5056, 3328, 2944]
    - [16, 12426.0]
  - - [2944, 3584, 1, 256, 2944, 2944, 256, 3584]
    - [29, 11736.0]
  - - [1408, 1408, 1, 3328, 1408, 1408, 3328, 1408]
    - [10, 10592.0]
  - - [3584, 3584, 1, 128, 3584, 3584, 128, 3584]
    - [36, 11148.0]
  - - [3584, 704, 1, 256, 3584, 3584, 256, 704]
    - [35, 9667.0]
  - - [3584, 1408, 1, 3328, 3584, 3584, 3328, 1408]
    - [3, 11997.0]
  - - [704, 3584, 1, 1280, 704, 704, 1280, 3584]
    - [10, 10321.0]
  - - [2944, 6784, 1, 1280, 2944, 2944, 1280, 6784]
    - [29, 12562.0]
  - - [1856, 6784, 1, 256, 1856, 1856, 256, 6784]
    - [16, 11471.0]
  - - [4288, 448, 1, 3328, 4288, 4288, 3328, 448]
    - [9, 10128.0]
  - - [6784, 4288, 1, 128, 6784, 6784, 128, 4288]
    - [36, 11627.0]
  - - [6784, 704, 1, 1280, 6784, 6784, 1280, 704]
    - [3, 11195.0]
  - - [5888, 1024, 1, 3328, 5888, 5888, 3328, 1024]
    - [29, 12112.0]
  - - [704, 6784, 1, 1280, 704, 704, 1280, 6784]
    - [3, 11180.0]
  - - [1856, 5056, 1, 3328, 1856, 1856, 3328, 5056]
    - [16, 11955.0]
  - - [1024, 3584, 1, 128, 1024, 1024, 128, 3584]
    - [6, 10008.0]
  - - [1024, 1408, 1, 128, 1024, 1024, 128, 1408]
    - [0, 8941.0]
  - - [2368, 2944, 1, 128, 2368, 2368, 128, 2944]
    - [33, 10811.0]
  - - [5056, 2944, 1, 128, 5056, 5056, 128, 2944]
    - [33, 11391.0]
  - - [5888, 5056, 1, 3328, 5888, 5888, 3328, 5056]
    - [10, 12463.0]
  - - [1408, 2368, 1, 128, 1408, 1408, 128, 2368]
    - [12, 9879.0]
  - - [5888, 2368, 1, 128, 5888, 5888, 128, 2368]
    - [22, 11115.0]
  - - [3584, 6784, 1, 1280, 3584, 3584, 1280, 6784]
    - [16, 12510.0]
  - - [1856, 5888, 1, 256, 1856, 1856, 256, 5888]
    - [29, 11442.0]
  - - [4288, 4288, 1, 3328, 4288, 4288, 3328, 4288]
    - [16, 12217.0]
  - - [4288, 1408, 1, 1280, 4288, 4288, 1280, 1408]
    - [29, 11950.0]
  - - [3584, 5056, 1, 128, 3584, 3584, 128, 5056]
    - [10, 11328.0]
  - - [4288, 2368, 1, 256, 4288, 4288, 256, 2368]
    - [10, 11394.0]
  - - [2944, 5056, 1, 1280, 2944, 2944, 1280, 5056]
    - [29, 12364.0]
  - - [448, 6784, 1, 256, 448, 448, 256, 6784]
    - [20, 9572.0]
  - - [6784, 2368, 1, 3328, 6784, 6784, 3328, 2368]
    - [10, 12179.0]
  - - [4288, 1856, 1, 3328, 4288, 4288, 3328, 1856]
    - [29, 11721.0]
  - - [3584, 448, 1, 128, 3584, 3584, 128, 448]
    - [19, 8664.0]
  - - [3584, 1024, 1, 1280, 3584, 3584, 1280, 1024]
    - [16, 11513.0]
  - - [1856, 5056, 1, 256, 1856, 1856, 256, 5056]
    - [16, 11352.0]
  - - [1024, 4288, 1, 256, 1024, 1024, 256, 4288]
    - [10, 10753.0]
  - - [5888, 3584, 1, 3328, 5888, 5888, 3328, 3584]
    - [16, 12540.0]
  - - [5056, 3584, 1, 3328, 5056, 5056, 3328, 3584]
    - [16, 12440.0]
  - - [2368, 1408, 1, 1280, 2368, 2368, 1280, 1408]
    - [16, 11174.0]
  - - [5056, 2944, 1, 1280, 5056, 5056, 1280, 2944]
    - [29, 12364.0]
  - - [1024, 6784, 1, 256, 1024, 1024, 256, 6784]
    - [10, 11362.0]
  - - [2944, 1408, 1, 128, 2944, 2944, 128, 1408]
    - [33, 10595.0]
  - - [5056, 6784, 1, 3328, 5056, 5056, 3328, 6784]
    - [29, 12489.0]
  - - [3584, 4288, 1, 256, 3584, 3584, 256, 4288]
    - [16, 11786.0]
  - - [1856, 6784, 1, 3328, 1856, 1856, 3328, 6784]
    - [29, 12108.0]
  - - [5888, 4288, 1, 256, 5888, 5888, 256, 4288]
    - [16, 12047.0]
  - - [5056, 1408, 1, 256, 5056, 5056, 256, 1408]
    - [33, 11498.0]
  - - [3584, 1024, 1, 256, 3584, 3584, 256, 1024]
    - [29, 10989.0]
  - - [5888, 5888, 1, 256, 5888, 5888, 256, 5888]
    - [16, 12395.0]
  - - [4288, 1024, 1, 1280, 4288, 4288, 1280, 1024]
    - [16, 11694.0]
  - - [448, 6784, 1, 3328, 448, 448, 3328, 6784]
    - [10, 10387.0]
  - - [2944, 1408, 1, 1280, 2944, 2944, 1280, 1408]
    - [10, 11893.0]
  - - [2944, 1856, 1, 3328, 2944, 2944, 3328, 1856]
    - [29, 11612.0]
  - - [2944, 2944, 1, 128, 2944, 2944, 128, 2944]
    - [33, 11470.0]
  - - [3584, 5888, 1, 1280, 3584, 3584, 1280, 5888]
    - [16, 12534.0]
  - - [6784, 1856, 1, 1280, 6784, 6784, 1280, 1856]
    - [3, 12064.0]
  - - [2944, 5056, 1, 256, 2944, 2944, 256, 5056]
    - [10, 11831.0]
  - - [5888, 256, 1, 3328, 5888, 5888, 3328, 256]
    - [29, 10877.0]
  - - [1856, 5888, 1, 3328, 1856, 1856, 3328, 5888]
    - [16, 12012.0]
  - - [3584, 1408, 1, 256, 3584, 3584, 256, 1408]
    - [29, 10883.0]
  - - [704, 3584, 1, 3328, 704, 704, 3328, 3584]
    - [3, 10524.0]
  - - [5056, 448, 1, 1280, 5056, 5056, 1280, 448]
    - [16, 10143.0]
  - - [3584, 1856, 1, 3328, 3584, 3584, 3328, 1856]
    - [16, 12068.0]
  - - [2944, 1024, 1, 256, 2944, 2944, 256, 1024]
    - [27, 10438.0]
  - - [1024, 2368, 1, 128, 1024, 1024, 128, 2368]
    - [0, 9349.0]
  - - [2368, 4288, 1, 3328, 2368, 2368, 3328, 4288]
    - [16, 11837.0]
  - - [1024, 1408, 1, 1280, 1024, 1024, 1280, 1408]
    - [3, 10159.0]
  - - [6784, 5056, 1, 256, 6784, 6784, 256, 5056]
    - [10, 12227.0]
  - - [448, 6784, 1, 128, 448, 448, 128, 6784]
    - [12, 8943.0]
  - - [2944, 6784, 1, 256, 2944, 2944, 256, 6784]
    - [36, 12330.0]
  - - [2368, 2368, 1, 1280, 2368, 2368, 1280, 2368]
    - [3, 11241.0]
  - - [1856, 3584, 1, 1280, 1856, 1856, 1280, 3584]
    - [29, 12001.0]
  - - [3584, 1408, 1, 1280, 3584, 3584, 1280, 1408]
    - [29, 11939.0]
  - - [4288, 448, 1, 128, 4288, 4288, 128, 448]
    - [25, 8941.0]
  - - [5056, 256, 1, 1280, 5056, 5056, 1280, 256]
    - [24, 11110.0]
  - - [1856, 1408, 1, 3328, 1856, 1856, 3328, 1408]
    - [3, 10865.0]
  - - [1024, 4288, 1, 3328, 1024, 1024, 3328, 4288]
    - [16, 11874.0]
  - - [5056, 448, 1, 256, 5056, 5056, 256, 448]
    - [19, 9716.0]
  - - [2944, 2368, 1, 3328, 2944, 2944, 3328, 2368]
    - [29, 12095.0]
  - - [1024, 1856, 1, 1280, 1024, 1024, 1280, 1856]
    - [10, 10930.0]
  - - [6784, 1856, 1, 256, 6784, 6784, 256, 1856]
    - [29, 11637.0]
  - - [1024, 5888, 1, 256, 1024, 1024, 256, 5888]
    - [10, 11548.0]
  - - [1408, 2368, 1, 256, 1408, 1408, 256, 2368]
    - [29, 10530.0]
  - - [1408, 1408, 1, 256, 1408, 1408, 256, 1408]
    - [27, 9745.0]
  - - [2368, 2368, 1, 128, 2368, 2368, 128, 2368]
    - [25, 10313.0]
  - - [6784, 1408, 1, 128, 6784, 6784, 128, 1408]
    - [33, 11325.0]
  - - [4288, 5888, 1, 256, 4288, 4288, 256, 5888]
    - [36, 12042.0]
  - - [1408, 5056, 1, 256, 1408, 1408, 256, 5056]
    - [16, 11651.0]
  - - [4288, 3584, 1, 128, 4288, 4288, 128, 3584]
    - [7, 11550.0]
  - - [3584, 5056, 1, 1280, 3584, 3584, 1280, 5056]
    - [16, 12426.0]
  - - [1856, 1024, 1, 128, 1856, 1856, 128, 1024]
    - [12, 8957.0]
  - - [704, 4288, 1, 256, 704, 704, 256, 4288]
    - [33, 9576.0]
  - - [5888, 2368, 1, 1280, 5888, 5888, 1280, 2368]
    - [16, 12126.0]
  - - [2368, 5888, 1, 1280, 2368, 2368, 1280, 5888]
    - [16, 12143.0]
  - - [5888, 256, 1, 1280, 5888, 5888, 1280, 256]
    - [16, 10593.0]
  - - [2368, 1856, 1, 3328, 2368, 2368, 3328, 1856]
    - [16, 11086.0]
  - - [2944, 704, 1, 256, 2944, 2944, 256, 704]
    - [27, 9308.0]
  - - [704, 3584, 1, 256, 704, 704, 256, 3584]
    - [1, 9318.0]
  - - [704, 2944, 1, 3328, 704, 704, 3328, 2944]
    - [3, 10936.0]
  - - [6784, 1024, 1, 128, 6784, 6784, 128, 1024]
    - [20, 10530.0]
  - - [2944, 1024, 1, 3328, 2944, 2944, 3328, 1024]
    - [10, 11279.0]
  - - [2944, 5056, 1, 128, 2944, 2944, 128, 5056]
    - [16, 11250.0]
  - - [1408, 6784, 1, 256, 1408, 1408, 256, 6784]
    - [29, 11844.0]
  - - [6784, 1408, 1, 3328, 6784, 6784, 3328, 1408]
    - [29, 12278.0]
  - - [4288, 6784, 1, 128, 4288, 4288, 128, 6784]
    - [26, 11672.0]
  - - [6784, 2944, 1, 1280, 6784, 6784, 1280, 2944]
    - [16, 12595.0]
  - - [4288, 1856, 1, 128, 4288, 4288, 128, 1856]
    - [12, 10340.0]
  - - [1856, 2944, 1, 128, 1856, 1856, 128, 2944]
    - [7, 10423.0]
  - - [6784, 448, 1, 128, 6784, 6784, 128, 448]
    - [25, 10205.0]
  - - [448, 5056, 1, 1280, 448, 448, 1280, 5056]
    - [5, 10355.0]
  - - [2368, 1856, 1, 128, 2368, 2368, 128, 1856]
    - [25, 10191.0]
  - - [4288, 704, 1, 256, 4288, 4288, 256, 704]
    - [9, 9765.0]
  - - [5888, 704, 1, 256, 5888, 5888, 256, 704]
    - [10, 10412.0]
  - - [3584, 1024, 1, 128, 3584, 3584, 128, 1024]
    - [37, 10046.0]
  - - [256, 5888, 1, 3328, 256, 256, 3328, 5888]
    - [3, 10920.0]
  - - [1408, 4288, 1, 3328, 1408, 1408, 3328, 4288]
    - [29, 12129.0]
  - - [6784, 4288, 1, 256, 6784, 6784, 256, 4288]
    - [10, 12113.0]
  - - [5888, 256, 1, 256, 5888, 5888, 256, 256]
    - [34, 9834.0]
  - - [6784, 1024, 1, 1280, 6784, 6784, 1280, 1024]
    - [16, 12053.0]
  - - [5888, 1024, 1, 128, 5888, 5888, 128, 1024]
    - [20, 10879.0]
  - - [2944, 704, 1, 1280, 2944, 2944, 1280, 704]
    - [29, 10693.0]
  - - [6784, 3584, 1, 1280, 6784, 6784, 1280, 3584]
    - [29, 12512.0]
  - - [1024, 6784, 1, 1280, 1024, 1024, 1280, 6784]
    - [16, 11991.0]
  - - [1408, 2944, 1, 1280, 1408, 1408, 1280, 2944]
    - [29, 11999.0]
  - - [1408, 2368, 1, 3328, 1408, 1408, 3328, 2368]
    - [16, 11445.0]
  - - [2944, 1856, 1, 128, 2944, 2944, 128, 1856]
    - [25, 10594.0]
  - - [256, 6784, 1, 128, 256, 256, 128, 6784]
    - [4, 9029.0]
  - - [5056, 6784, 1, 128, 5056, 5056, 128, 6784]
    - [16, 11724.0]
  - - [4288, 5056, 1, 128, 4288, 4288, 128, 5056]
    - [10, 11399.0]
  - - [1856, 5888, 1, 128, 1856, 1856, 128, 5888]
    - [7, 11086.0]
  - - [2944, 5888, 1, 256, 2944, 2944, 256, 5888]
    - [16, 12310.0]
  - - [3584, 1856, 1, 256, 3584, 3584, 256, 1856]
    - [10, 11463.0]
  - - [4288, 3584, 1, 1280, 4288, 4288, 1280, 3584]
    - [16, 12302.0]
  - - [704, 4288, 1, 3328, 704, 704, 3328, 4288]
    - [3, 10346.0]
  - - [704, 5888, 1, 128, 704, 704, 128, 5888]
    - [21, 9718.0]
  - - [6784, 3584, 1, 128, 6784, 6784, 128, 3584]
    - [33, 11882.0]
  - - [4288, 5056, 1, 3328, 4288, 4288, 3328, 5056]
    - [16, 12287.0]
  - - [1408, 1408, 1, 128, 1408, 1408, 128, 1408]
    - [12, 9187.0]
  - - [5056, 2368, 1, 256, 5056, 5056, 256, 2368]
    - [10, 11639.0]
  - - [4288, 704, 1, 3328, 4288, 4288, 3328, 704]
    - [3, 10377.0]
  - - [448, 3584, 1, 256, 448, 448, 256, 3584]
    - [13, 8955.0]
  - - [2368, 1024, 1, 1280, 2368, 2368, 1280, 1024]
    - [29, 11046.0]
  - - [2944, 1408, 1, 3328, 2944, 2944, 3328, 1408]
    - [10, 12089.0]
  - - [1024, 1408, 1, 3328, 1024, 1024, 3328, 1408]
    - [16, 10421.0]
  - - [2944, 5888, 1, 1280, 2944, 2944, 1280, 5888]
    - [16, 12557.0]
  - - [5888, 3584, 1, 256, 5888, 5888, 256, 3584]
    - [16, 12236.0]
  - - [1408, 1856, 1, 3328, 1408, 1408, 3328, 1856]
    - [22, 10864.0]
  - - [6784, 1408, 1, 1280, 6784, 6784, 1280, 1408]
    - [29, 12227.0]
  - - [704, 2944, 1, 256, 704, 704, 256, 2944]
    - [2, 9914.0]
  - - [704, 4288, 1, 128, 704, 704, 128, 4288]
    - [12, 9257.0]
  - - [2368, 4288, 1, 128, 2368, 2368, 128, 4288]
    - [33, 10806.0]
  - - [1024, 6784, 1, 128, 1024, 1024, 128, 6784]
    - [10, 10900.0]
  - - [1408, 1408, 1, 1280, 1408, 1408, 1280, 1408]
    - [16, 10470.0]
  - - [448, 4288, 1, 3328, 448, 448, 3328, 4288]
    - [16, 10144.0]
  - - [2368, 1408, 1, 256, 2368, 2368, 256, 1408]
    - [10, 9990.0]
  - - [5888, 5056, 1, 128, 5888, 5888, 128, 5056]
    - [10, 11672.0]
  - - [704, 2368, 1, 256, 704, 704, 256, 2368]
    - [34, 9135.0]
  - - [5888, 2368, 1, 3328, 5888, 5888, 3328, 2368]
    - [3, 12212.0]
  - - [4288, 448, 1, 1280, 4288, 4288, 1280, 448]
    - [15, 9962.0]
  - - [5888, 704, 1, 3328, 5888, 5888, 3328, 704]
    - [31, 11196.0]
  - - [5056, 256, 1, 128, 5056, 5056, 128, 256]
    - [6, 7727.0]
  - - [1408, 5888, 1, 128, 1408, 1408, 128, 5888]
    - [7, 11123.0]
  - - [1408, 1024, 1, 256, 1408, 1408, 256, 1024]
    - [27, 9557.0]
  - - [1024, 1856, 1, 128, 1024, 1024, 128, 1856]
    - [6, 9037.0]
  - - [5056, 6784, 1, 1280, 5056, 5056, 1280, 6784]
    - [29, 12468.0]
  - - [704, 5056, 1, 3328, 704, 704, 3328, 5056]
    - [5, 11209.0]
  - - [3584, 5056, 1, 3328, 3584, 3584, 3328, 5056]
    - [16, 12466.0]
  - - [2368, 2944, 1, 3328, 2368, 2368, 3328, 2944]
    - [16, 12104.0]
  - - [2368, 3584, 1, 256, 2368, 2368, 256, 3584]
    - [29, 11135.0]
  - - [5056, 3584, 1, 1280, 5056, 5056, 1280, 3584]
    - [16, 12410.0]
  - - [1856, 2944, 1, 1280, 1856, 1856, 1280, 2944]
    - [29, 11427.0]
  - - [3584, 2368, 1, 1280, 3584, 3584, 1280, 2368]
    - [16, 12003.0]
  - - [2944, 1408, 1, 256, 2944, 2944, 256, 1408]
    - [29, 11364.0]
  - - [4288, 1408, 1, 3328, 4288, 4288, 3328, 1408]
    - [29, 12121.0]
  - - [2944, 1024, 1, 128, 2944, 2944, 128, 1024]
    - [25, 10128.0]
  - - [4288, 5056, 1, 1280, 4288, 4288, 1280, 5056]
    - [16, 12252.0]
  - - [5888, 6784, 1, 1280, 5888, 5888, 1280, 6784]
    - [29, 12629.0]
  - - [6784, 5056, 1, 128, 6784, 6784, 128, 5056]
    - [29, 11762.0]
  - - [5888, 1408, 1, 3328, 5888, 5888, 3328, 1408]
    - [10, 12264.0]
  - - [256, 5056, 1, 256, 256, 256, 256, 5056]
    - [19, 9467.0]
  - - [448, 3584, 1, 3328, 448, 448, 3328, 3584]
    - [5, 9982.0]
  - - [704, 2368, 1, 128, 704, 704, 128, 2368]
    - [30, 8101.0]
  - - [5888, 256, 1, 128, 5888, 5888, 128, 256]
    - [11, 8032.0]
  - - [3584, 1856, 1, 128, 3584, 3584, 128, 1856]
    - [25, 10148.0]
  - - [4288, 4288, 1, 128, 4288, 4288, 128, 4288]
    - [36, 11366.0]
  - - [1856, 1024, 1, 3328, 1856, 1856, 3328, 1024]
    - [5, 11711.0]
  - - [1024, 5056, 1, 256, 1024, 1024, 256, 5056]
    - [16, 11036.0]
  - - [2368, 1408, 1, 3328, 2368, 2368, 3328, 1408]
    - [29, 11443.0]
  - - [5888, 448, 1, 256, 5888, 5888, 256, 448]
    - [28, 9633.0]
  - - [5888, 6784, 1, 128, 5888, 5888, 128, 6784]
    - [29, 12022.0]
  - - [6784, 5056, 1, 1280, 6784, 6784, 1280, 5056]
    - [3, 12475.0]
  - - [5056, 704, 1, 1280, 5056, 5056, 1280, 704]
    - [10, 10978.0]
  - - [4288, 6784, 1, 1280, 4288, 4288, 1280, 6784]
    - [29, 12350.0]
  - - [6784, 1408, 1, 256, 6784, 6784, 256, 1408]
    - [16, 11659.0]
  - - [3584, 5888, 1, 128, 3584, 3584, 128, 5888]
    - [36, 11697.0]
  - - [5056, 5888, 1, 256, 5056, 5056, 256, 5888]
    - [29, 12164.0]
  - - [2368, 1024, 1, 256, 2368, 2368, 256, 1024]
    - [7, 10084.0]
  - - [2944, 1856, 1, 256, 2944, 2944, 256, 1856]
    - [22, 10973.0]
  - - [1856, 6784, 1, 1280, 1856, 1856, 1280, 6784]
    - [16, 12070.0]
  - - [4288, 3584, 1, 256, 4288, 4288, 256, 3584]
    - [29, 11892.0]
  - - [5056, 1856, 1, 1280, 5056, 5056, 1280, 1856]
    - [3, 11925.0]
  - - [1408, 1024, 1, 3328, 1408, 1408, 3328, 1024]
    - [16, 10562.0]
  - - [5888, 3584, 1, 1280, 5888, 5888, 1280, 3584]
    - [29, 12513.0]
  - - [1856, 3584, 1, 3328, 1856, 1856, 3328, 3584]
    - [29, 12077.0]
  - - [1024, 2944, 1, 256, 1024, 1024, 256, 2944]
    - [17, 10131.0]
  - - [448, 6784, 1, 1280, 448, 448, 1280, 6784]
    - [10, 10323.0]
  - - [704, 5056, 1, 256, 704, 704, 256, 5056]
    - [7, 10336.0]
  - - [2944, 1856, 1, 1280, 2944, 2944, 1280, 1856]
    - [29, 11528.0]
  - - [5056, 256, 1, 256, 5056, 5056, 256, 256]
    - [8, 10202.0]
  - - [2368, 3584, 1, 3328, 2368, 2368, 3328, 3584]
    - [16, 12061.0]
  - - [3584, 5888, 1, 3328, 3584, 3584, 3328, 5888]
    - [16, 12551.0]
  - - [2944, 3584, 1, 1280, 2944, 2944, 1280, 3584]
    - [29, 12291.0]
  - - [1856, 5888, 1, 1280, 1856, 1856, 1280, 5888]
    - [29, 11955.0]
  - - [5056, 448, 1, 3328, 5056, 5056, 3328, 448]
    - [36, 10463.0]
  - - [4288, 1408, 1, 256, 4288, 4288, 256, 1408]
    - [29, 11190.0]
  - - [5888, 1408, 1, 128, 5888, 5888, 128, 1408]
    - [29, 11098.0]
  - - [4288, 2368, 1, 1280, 4288, 4288, 1280, 2368]
    - [10, 11788.0]
  - - [6784, 2368, 1, 256, 6784, 6784, 256, 2368]
    - [10, 11809.0]
  - - [4288, 1856, 1, 256, 4288, 4288, 256, 1856]
    - [10, 11239.0]
  - - [1856, 2944, 1, 256, 1856, 1856, 256, 2944]
    - [10, 10981.0]
  - - [5056, 1024, 1, 128, 5056, 5056, 128, 1024]
    - [7, 10914.0]
  - - [6784, 256, 1, 128, 6784, 6784, 128, 256]
    - [27, 9396.0]
  - - [5888, 704, 1, 128, 5888, 5888, 128, 704]
    - [25, 10428.0]
  - - [1024, 4288, 1, 1280, 1024, 1024, 1280, 4288]
    - [3, 11779.0]
  - - [2368, 5056, 1, 3328, 2368, 2368, 3328, 5056]
    - [16, 12095.0]
  - - [4288, 1024, 1, 3328, 4288, 4288, 3328, 1024]
    - [16, 11856.0]
  - - [1024, 5056, 1, 3328, 1024, 1024, 3328, 5056]
    - [18, 12246.0]
  - - [1024, 1856, 1, 3328, 1024, 1024, 3328, 1856]
    - [3, 11490.0]
  - - [704, 6784, 1, 128, 704, 704, 128, 6784]
    - [20, 9606.0]
  - - [4288, 6784, 1, 256, 4288, 4288, 256, 6784]
    - [29, 12112.0]
  - - [3584, 2944, 1, 3328, 3584, 3584, 3328, 2944]
    - [16, 12324.0]
  - - [5888, 2944, 1, 256, 5888, 5888, 256, 2944]
    - [16, 12229.0]
  - - [2368, 6784, 1, 128, 2368, 2368, 128, 6784]
    - [16, 11377.0]
  - - [448, 4288, 1, 1280, 448, 448, 1280, 4288]
    - [16, 9996.0]
  - - [5056, 4288, 1, 256, 5056, 5056, 256, 4288]
    - [10, 11934.0]
  - - [1024, 3584, 1, 256, 1024, 1024, 256, 3584]
    - [10, 10869.0]
  - - [1856, 5056, 1, 128, 1856, 1856, 128, 5056]
    - [20, 10813.0]
  - - [6784, 6784, 1, 3328, 6784, 6784, 3328, 6784]
    - [3, 12626.0]
  - - [448, 5888, 1, 1280, 448, 448, 1280, 5888]
    - [13, 9770.0]
  - - [5056, 448, 1, 128, 5056, 5056, 128, 448]
    - [25, 9204.0]
  - - [3584, 2944, 1, 128, 3584, 3584, 128, 2944]
    - [16, 11176.0]
  - - [6784, 256, 1, 1280, 6784, 6784, 1280, 256]
    - [10, 10473.0]
  - - [2368, 5888, 1, 3328, 2368, 2368, 3328, 5888]
    - [29, 12197.0]
  - - [2368, 1856, 1, 1280, 2368, 2368, 1280, 1856]
    - [16, 11006.0]
  - - [3584, 4288, 1, 128, 3584, 3584, 128, 4288]
    - [10, 11192.0]
  - - [5888, 4288, 1, 3328, 5888, 5888, 3328, 4288]
    - [10, 12371.0]
  - - [2368, 704, 1, 256, 2368, 2368, 256, 704]
    - [8, 8939.0]
  - - [3584, 1408, 1, 128, 3584, 3584, 128, 1408]
    - [37, 10617.0]
  - - [1856, 5056, 1, 1280, 1856, 1856, 1280, 5056]
    - [16, 11912.0]
  - - [2944, 1024, 1, 1280, 2944, 2944, 1280, 1024]
    - [29, 11236.0]
  - - [2368, 4288, 1, 256, 2368, 2368, 256, 4288]
    - [29, 11371.0]
  - - [1024, 2368, 1, 3328, 1024, 1024, 3328, 2368]
    - [5, 11269.0]
  - - [6784, 1856, 1, 3328, 6784, 6784, 3328, 1856]
    - [36, 12114.0]
  - - [1024, 2944, 1, 128, 1024, 1024, 128, 2944]
    - [6, 10054.0]
  - - [1024, 3584, 1, 1280, 1024, 1024, 1280, 3584]
    - [10, 11523.0]
  - - [4288, 5888, 1, 3328, 4288, 4288, 3328, 5888]
    - [16, 12379.0]
  - - [1024, 2944, 1, 3328, 1024, 1024, 3328, 2944]
    - [10, 11347.0]
  - - [3584, 6784, 1, 256, 3584, 3584, 256, 6784]
    - [22, 12249.0]
  - - [256, 6784, 1, 1280, 256, 256, 1280, 6784]
    - [16, 10497.0]
  - - [1856, 3584, 1, 256, 1856, 1856, 256, 3584]
    - [26, 11301.0]
  - - [6784, 1856, 1, 128, 6784, 6784, 128, 1856]
    - [25, 11113.0]
  - - [2944, 704, 1, 128, 2944, 2944, 128, 704]
    - [25, 9654.0]
  - - [256, 5888, 1, 1280, 256, 256, 1280, 5888]
    - [16, 10819.0]
  - - [4288, 6784, 1, 3328, 4288, 4288, 3328, 6784]
    - [16, 12393.0]
  - - [2368, 1408, 1, 128, 2368, 2368, 128, 1408]
    - [8, 9454.0]
  - - [1408, 1024, 1, 128, 1408, 1408, 128, 1024]
    - [25, 9209.0]
  - - [6784, 3584, 1, 3328, 6784, 6784, 3328, 3584]
    - [16, 12576.0]
  - - [2368, 5056, 1, 1280, 2368, 2368, 1280, 5056]
    - [3, 12044.0]
  - - [1408, 2368, 1, 1280, 1408, 1408, 1280, 2368]
    - [29, 11198.0]
  - - [2944, 4288, 1, 128, 2944, 2944, 128, 4288]
    - [29, 11282.0]
  - - [2944, 2944, 1, 256, 2944, 2944, 256, 2944]
    - [16, 11892.0]
  - - [6784, 256, 1, 256, 6784, 6784, 256, 256]
    - [7, 9836.0]
  - - [256, 5056, 1, 3328, 256, 256, 3328, 5056]
    - [5, 11454.0]
  - - [5056, 1856, 1, 128, 5056, 5056, 128, 1856]
    - [25, 10790.0]
  - - [5888, 1408, 1, 256, 5888, 5888, 256, 1408]
    - [10, 11833.0]
  - - [4288, 3584, 1, 3328, 4288, 4288, 3328, 3584]
    - [16, 12358.0]
  - - [1024, 2368, 1, 1280, 1024, 1024, 1280, 2368]
    - [16, 10933.0]
  - - [5888, 6784, 1, 3328, 5888, 5888, 3328, 6784]
    - [16, 12640.0]
  - - [704, 4288, 1, 1280, 704, 704, 1280, 4288]
    - [26, 10172.0]
  - - [6784, 448, 1, 3328, 6784, 6784, 3328, 448]
    - [10, 10375.0]
  - - [4288, 1024, 1, 128, 4288, 4288, 128, 1024]
    - [2, 10163.0]
  - - [1920, 2048, 1, 2048, 1920, 1920, 2048, 2048]
    - [29, 12326.0]
  - - [2880, 3072, 1, 3072, 2880, 2880, 3072, 3072]
    - [29, 12127.0]
  - - [3840, 4096, 1, 4096, 3840, 3840, 4096, 4096]
    - [29, 12599.0]
  - - [7680, 8192, 1, 8192, 7680, 7680, 8192, 8192]
    - [36, 12367.0]
  - - [2048, 2048, 1, 2048, 2048, 2048, 2048, 2048]
    - [29, 11818.0]
  - - [3072, 3072, 1, 3072, 3072, 3072, 3072, 3072]
    - [10, 12456.0]
  - - [4096, 4096, 1, 4096, 4096, 4096, 4096, 4096]
    - [29, 12466.0]
  - - [8192, 8192, 1, 8192, 8192, 8192, 8192, 8192]
    - [31, 12322.0]
  - - [1152, 1152, 1, 1152, 1152, 1152, 1152, 1152]
    - [25, 9234.0]
  - - [1536, 1536, 1, 1536, 1536, 1536, 1536, 1536]
    - [31, 10752.0]
  - - [1920, 1920, 1, 1920, 1920, 1920, 1920, 1920]
    - [29, 11607.0]
  - - [2304, 2304, 1, 2304, 2304, 2304, 2304, 2304]
    - [16, 11934.0]
  - - [2688, 2688, 1, 2688, 2688, 2688, 2688, 2688]
    - [29, 12062.0]
  - - [3456, 3456, 1, 3456, 3456, 3456, 3456, 3456]
    - [16, 12427.0]
  - - [3840, 3840, 1, 3840, 3840, 3840, 3840, 3840]
    - [29, 12596.0]
  - - [4224, 4224, 1, 4224, 4224, 4224, 4224, 4224]
    - [16, 12526.0]
  - - [4608, 4608, 1, 4608, 4608, 4608, 4608, 4608]
    - [29, 12597.0]
  - - [4992, 4992, 1, 4992, 4992, 4992, 4992, 4992]
    - [22, 12541.0]
  - - [5376, 5376, 1, 5376, 5376, 5376, 5376, 5376]
    - [16, 12613.0]
  - - [5760, 5760, 1, 5760, 5760, 5760, 5760, 5760]
    - [29, 12620.0]
  - - [6144, 6144, 1, 6144, 6144, 6144, 6144, 6144]
    - [18, 12563.0]
  - - [6528, 6528, 1, 6528, 6528, 6528, 6528, 6528]
    - [16, 12496.0]
  - - [6912, 6912, 1, 6912, 6912, 6912, 6912, 6912]
    - [18, 12551.0]
  - - [7296, 7296, 1, 7296, 7296, 7296, 7296, 7296]
    - [16, 12370.0]
  - - [7680, 7680, 1, 7680, 7680, 7680, 7680, 7680]
    - [36, 12397.0]
  - - [1856, 448, 1, 3328, 1856, 1856, 3328, 448]
    - [51, 9285.0]
  - - [128, 6784, 1, 3328, 128, 128, 3328, 6784]
    - [64, 9772.0]
  - - [2368, 448, 1, 128, 2368, 2368, 128, 448]
    - [57, 8092.0]
  - - [256, 4288, 1, 3328, 256, 256, 3328, 4288]
    - [78, 9953.0]
  - - [704, 1856, 1, 3328, 704, 704, 3328, 1856]
    - [79, 9094.0]
  - - [448, 1024, 1, 1280, 448, 448, 1280, 1024]
    - [57, 8280.0]
  - - [256, 1408, 1, 3328, 256, 256, 3328, 1408]
    - [59, 7190.0]
  - - [704, 1856, 1, 1280, 704, 704, 1280, 1856]
    - [60, 8853.0]
  - - [128, 5056, 1, 128, 128, 128, 128, 5056]
    - [44, 6333.0]
  - - [2368, 128, 1, 256, 2368, 2368, 256, 128]
    - [50, 5125.0]
  - - [64, 5056, 1, 256, 64, 64, 256, 5056]
    - [84, 5365.0]
  - - [256, 2944, 1, 256, 256, 256, 256, 2944]
    - [85, 7484.0]
  - - [256, 1856, 1, 1280, 256, 256, 1280, 1856]
    - [45, 8641.0]
  - - [128, 3584, 1, 1280, 128, 128, 1280, 3584]
    - [78, 8500.0]
  - - [4288, 256, 1, 256, 4288, 4288, 256, 256]
    - [69, 7832.0]
  - - [2944, 128, 1, 128, 2944, 2944, 128, 128]
    - [62, 4345.0]
  - - [5888, 64, 1, 3328, 5888, 5888, 3328, 64]
    - [53, 5346.0]
  - - [2944, 256, 1, 3328, 2944, 2944, 3328, 256]
    - [81, 9009.0]
  - - [1408, 448, 1, 1280, 1408, 1408, 1280, 448]
    - [81, 9048.0]
  - - [1408, 704, 1, 3328, 1408, 1408, 3328, 704]
    - [61, 8954.0]
  - - [6784, 64, 1, 256, 6784, 6784, 256, 64]
    - [72, 5801.0]
  - - [2944, 256, 1, 256, 2944, 2944, 256, 256]
    - [85, 7426.0]
  - - [704, 1408, 1, 3328, 704, 704, 3328, 1408]
    - [45, 8814.0]
  - - [2944, 256, 1, 128, 2944, 2944, 128, 256]
    - [59, 7608.0]
  - - [448, 2944, 1, 128, 448, 448, 128, 2944]
    - [57, 7702.0]
  - - [2368, 128, 1, 3328, 2368, 2368, 3328, 128]
    - [46, 8604.0]
  - - [2944, 128, 1, 256, 2944, 2944, 256, 128]
    - [48, 5414.0]
  - - [448, 1408, 1, 256, 448, 448, 256, 1408]
    - [67, 7360.0]
  - - [64, 5056, 1, 3328, 64, 64, 3328, 5056]
    - [43, 8569.0]
  - - [1024, 448, 1, 128, 1024, 1024, 128, 448]
    - [66, 5768.0]
  - - [256, 3584, 1, 3328, 256, 256, 3328, 3584]
    - [41, 10492.0]
  - - [5056, 64, 1, 1280, 5056, 5056, 1280, 64]
    - [87, 7575.0]
  - - [1024, 704, 1, 256, 1024, 1024, 256, 704]
    - [83, 7709.0]
  - - [128, 4288, 1, 128, 128, 128, 128, 4288]
    - [87, 5855.0]
  - - [3584, 256, 1, 128, 3584, 3584, 128, 256]
    - [79, 6804.0]
  - - [4288, 128, 1, 1280, 4288, 4288, 1280, 128]
    - [86, 8424.0]
  - - [5888, 64, 1, 256, 5888, 5888, 256, 64]
    - [71, 5283.0]
  - - [1856, 256, 1, 1280, 1856, 1856, 1280, 256]
    - [54, 8473.0]
  - - [64, 5888, 1, 3328, 64, 64, 3328, 5888]
    - [43, 7393.0]
  - - [704, 1024, 1, 1280, 704, 704, 1280, 1024]
    - [85, 8416.0]
  - - [448, 1856, 1, 128, 448, 448, 128, 1856]
    - [78, 6290.0]
  - - [1024, 704, 1, 1280, 1024, 1024, 1280, 704]
    - [54, 8279.0]
  - - [128, 5888, 1, 256, 128, 128, 256, 5888]
    - [49, 7824.0]
  - - [704, 704, 1, 3328, 704, 704, 3328, 704]
    - [79, 8242.0]
  - - [704, 1408, 1, 1280, 704, 704, 1280, 1408]
    - [85, 8650.0]
  - - [3584, 256, 1, 3328, 3584, 3584, 3328, 256]
    - [69, 10233.0]
  - - [704, 1856, 1, 128, 704, 704, 128, 1856]
    - [67, 7934.0]
  - - [128, 3584, 1, 3328, 128, 128, 3328, 3584]
    - [40, 9173.0]
  - - [128, 2944, 1, 1280, 128, 128, 1280, 2944]
    - [43, 7199.0]
  - - [3584, 128, 1, 256, 3584, 3584, 256, 128]
    - [68, 7058.0]
  - - [448, 1408, 1, 3328, 448, 448, 3328, 1408]
    - [52, 9131.0]
  - - [256, 3584, 1, 256, 256, 256, 256, 3584]
    - [55, 9139.0]
  - - [256, 2944, 1, 3328, 256, 256, 3328, 2944]
    - [59, 9363.0]
  - - [448, 2368, 1, 128, 448, 448, 128, 2368]
    - [76, 8092.0]
  - - [1408, 704, 1, 256, 1408, 1408, 256, 704]
    - [82, 7803.0]
  - - [448, 2944, 1, 3328, 448, 448, 3328, 2944]
    - [60, 9195.0]
  - - [64, 5888, 1, 256, 64, 64, 256, 5888]
    - [75, 6083.0]
  - - [6784, 128, 1, 3328, 6784, 6784, 3328, 128]
    - [74, 9654.0]
  - - [704, 704, 1, 256, 704, 704, 256, 704]
    - [41, 6480.0]
  - - [128, 4288, 1, 3328, 128, 128, 3328, 4288]
    - [41, 9187.0]
  - - [448, 704, 1, 1280, 448, 448, 1280, 704]
    - [43, 7631.0]
  - - [1024, 448, 1, 3328, 1024, 1024, 3328, 448]
    - [63, 8969.0]
  - - [1856, 704, 1, 1280, 1856, 1856, 1280, 704]
    - [63, 8913.0]
  - - [448, 1408, 1, 1280, 448, 448, 1280, 1408]
    - [61, 9039.0]
  - - [1024, 1024, 1, 1280, 1024, 1024, 1280, 1024]
    - [63, 9018.0]
  - - [448, 1024, 1, 128, 448, 448, 128, 1024]
    - [77, 5931.0]
  - - [448, 2368, 1, 3328, 448, 448, 3328, 2368]
    - [41, 9189.0]
  - - [5056, 64, 1, 128, 5056, 5056, 128, 64]
    - [62, 5113.0]
  - - [704, 1024, 1, 256, 704, 704, 256, 1024]
    - [85, 7226.0]
  - - [128, 6784, 1, 1280, 128, 128, 1280, 6784]
    - [60, 9555.0]
  - - [1856, 256, 1, 256, 1856, 1856, 256, 256]
    - [49, 6443.0]
  - - [256, 4288, 1, 1280, 256, 256, 1280, 4288]
    - [54, 9437.0]
  - - [256, 1856, 1, 128, 256, 256, 128, 1856]
    - [68, 5172.0]
  - - [448, 1408, 1, 128, 448, 448, 128, 1408]
    - [76, 6117.0]
  - - [6784, 128, 1, 256, 6784, 6784, 256, 128]
    - [51, 8161.0]
  - - [704, 448, 1, 256, 704, 704, 256, 448]
    - [67, 5340.0]
  - - [704, 1408, 1, 128, 704, 704, 128, 1408]
    - [38, 6866.0]
  - - [2944, 448, 1, 128, 2944, 2944, 128, 448]
    - [78, 7605.0]
  - - [128, 2944, 1, 128, 128, 128, 128, 2944]
    - [56, 4425.0]
  - - [1024, 704, 1, 3328, 1024, 1024, 3328, 704]
    - [81, 8715.0]
  - - [128, 4288, 1, 256, 128, 128, 256, 4288]
    - [59, 6439.0]
  - - [704, 448, 1, 3328, 704, 704, 3328, 448]
    - [61, 8232.0]
  - - [1024, 1024, 1, 3328, 1024, 1024, 3328, 1024]
    - [88, 9309.0]
  - - [448, 2368, 1, 1280, 448, 448, 1280, 2368]
    - [79, 8913.0]
  - - [64, 6784, 1, 3328, 64, 64, 3328, 6784]
    - [61, 8419.0]
  - - [2944, 256, 1, 1280, 2944, 2944, 1280, 256]
    - [54, 8914.0]
  - - [256, 2368, 1, 128, 256, 256, 128, 2368]
    - [59, 6965.0]
  - - [1856, 704, 1, 256, 1856, 1856, 256, 704]
    - [51, 8147.0]
  - - [1408, 448, 1, 3328, 1408, 1408, 3328, 448]
    - [81, 9445.0]
  - - [2368, 256, 1, 256, 2368, 2368, 256, 256]
    - [86, 7073.0]
  - - [1856, 448, 1, 1280, 1856, 1856, 1280, 448]
    - [69, 9003.0]
  - - [128, 5888, 1, 128, 128, 128, 128, 5888]
    - [68, 6129.0]
  - - [1024, 1024, 1, 256, 1024, 1024, 256, 1024]
    - [49, 8234.0]
  - - [704, 1856, 1, 256, 704, 704, 256, 1856]
    - [85, 8198.0]
  - - [64, 6784, 1, 256, 64, 64, 256, 6784]
    - [43, 5906.0]
  - - [256, 2368, 1, 1280, 256, 256, 1280, 2368]
    - [41, 9288.0]
  - - [2944, 448, 1, 256, 2944, 2944, 256, 448]
    - [54, 7975.0]
  - - [1856, 448, 1, 128, 1856, 1856, 128, 448]
    - [86, 6711.0]
  - - [2368, 128, 1, 1280, 2368, 2368, 1280, 128]
    - [55, 7993.0]
  - - [2368, 256, 1, 128, 2368, 2368, 128, 256]
    - [51, 6795.0]
  - - [64, 5056, 1, 1280, 64, 64, 1280, 5056]
    - [61, 7759.0]
  - - [2368, 256, 1, 1280, 2368, 2368, 1280, 256]
    - [86, 9360.0]
  - - [2368, 448, 1, 1280, 2368, 2368, 1280, 448]
    - [72, 9061.0]
  - - [128, 3584, 1, 256, 128, 128, 256, 3584]
    - [59, 6517.0]
  - - [704, 448, 1, 1280, 704, 704, 1280, 448]
    - [80, 7606.0]
  - - [128, 5056, 1, 256, 128, 128, 256, 5056]
    - [85, 7531.0]
  - - [4288, 256, 1, 1280, 4288, 4288, 1280, 256]
    - [63, 9407.0]
  - - [4288, 128, 1, 3328, 4288, 4288, 3328, 128]
    - [69, 8798.0]
  - - [1408, 256, 1, 128, 1408, 1408, 128, 256]
    - [66, 4336.0]
  - - [256, 1408, 1, 1280, 256, 256, 1280, 1408]
    - [59, 6839.0]
  - - [128, 2368, 1, 256, 128, 128, 256, 2368]
    - [49, 5503.0]
  - - [6784, 64, 1, 3328, 6784, 6784, 3328, 64]
    - [54, 8228.0]
  - - [128, 2944, 1, 3328, 128, 128, 3328, 2944]
    - [49, 7603.0]
  - - [2944, 448, 1, 3328, 2944, 2944, 3328, 448]
    - [81, 9203.0]
  - - [256, 4288, 1, 256, 256, 256, 256, 4288]
    - [49, 8145.0]
  - - [5888, 128, 1, 256, 5888, 5888, 256, 128]
    - [85, 7342.0]
  - - [2368, 448, 1, 3328, 2368, 2368, 3328, 448]
    - [63, 9343.0]
  - - [5056, 64, 1, 256, 5056, 5056, 256, 64]
    - [48, 5365.0]
  - - [1024, 704, 1, 128, 1024, 1024, 128, 704]
    - [47, 6143.0]
  - - [128, 5056, 1, 3328, 128, 128, 3328, 5056]
    - [41, 10658.0]
  - - [704, 1024, 1, 128, 704, 704, 128, 1024]
    - [48, 6554.0]
  - - [4288, 128, 1, 256, 4288, 4288, 256, 128]
    - [70, 6290.0]
  - - [1408, 448, 1, 128, 1408, 1408, 128, 448]
    - [83, 6034.0]
  - - [128, 5888, 1, 1280, 128, 128, 1280, 5888]
    - [59, 9016.0]
  - - [704, 448, 1, 128, 704, 704, 128, 448]
    - [39, 4304.0]
  - - [3584, 256, 1, 256, 3584, 3584, 256, 256]
    - [89, 8317.0]
  - - [128, 2944, 1, 256, 128, 128, 256, 2944]
    - [85, 5570.0]
  - - [128, 6784, 1, 128, 128, 128, 128, 6784]
    - [51, 6485.0]
  - - [448, 1856, 1, 256, 448, 448, 256, 1856]
    - [86, 7619.0]
  - - [3584, 128, 1, 3328, 3584, 3584, 3328, 128]
    - [88, 8795.0]
  - - [1024, 448, 1, 1280, 1024, 1024, 1280, 448]
    - [81, 8403.0]
  - - [5888, 128, 1, 3328, 5888, 5888, 3328, 128]
    - [46, 8555.0]
  - - [1408, 704, 1, 1280, 1408, 1408, 1280, 704]
    - [61, 8654.0]
  - - [448, 2944, 1, 256, 448, 448, 256, 2944]
    - [67, 8366.0]
  - - [448, 2368, 1, 256, 448, 448, 256, 2368]
    - [60, 7768.0]
  - - [128, 2368, 1, 3328, 128, 128, 3328, 2368]
    - [46, 8858.0]
  - - [5056, 128, 1, 1280, 5056, 5056, 1280, 128]
    - [86, 9940.0]
  - - [5056, 64, 1, 3328, 5056, 5056, 3328, 64]
    - [52, 8611.0]
  - - [64, 5888, 1, 128, 64, 64, 128, 5888]
    - [75, 4542.0]
  - - [5056, 128, 1, 3328, 5056, 5056, 3328, 128]
    - [86, 10427.0]
  - - [448, 704, 1, 256, 448, 448, 256, 704]
    - [67, 5426.0]
  - - [2944, 128, 1, 3328, 2944, 2944, 3328, 128]
    - [72, 7349.0]
  - - [128, 5056, 1, 1280, 128, 128, 1280, 5056]
    - [79, 9930.0]
  - - [704, 704, 1, 128, 704, 704, 128, 704]
    - [83, 5051.0]
  - - [64, 6784, 1, 1280, 64, 64, 1280, 6784]
    - [52, 7874.0]
  - - [2368, 128, 1, 128, 2368, 2368, 128, 128]
    - [65, 4522.0]
  - - [5056, 128, 1, 128, 5056, 5056, 128, 128]
    - [67, 5942.0]
  - - [1024, 1024, 1, 1024, 1024, 1024, 1024, 1024]
    - [81, 8966.0]
  - - [448, 1024, 1, 3328, 448, 448, 3328, 1024]
    - [61, 8732.0]
  - - [256, 2368, 1, 3328, 256, 256, 3328, 2368]
    - [60, 10026.0]
  - - [256, 3584, 1, 128, 256, 256, 128, 3584]
    - [69, 6892.0]
  - - [4288, 256, 1, 128, 4288, 4288, 128, 256]
    - [69, 7280.0]
  - - [256, 1856, 1, 256, 256, 256, 256, 1856]
    - [45, 6456.0]
  - - [256, 2944, 1, 128, 256, 256, 128, 2944]
    - [41, 6718.0]
  - - [1408, 256, 1, 3328, 1408, 1408, 3328, 256]
    - [76, 7258.0]
  - - [2368, 448, 1, 256, 2368, 2368, 256, 448]
    - [69, 7624.0]
  - - [4288, 256, 1, 3328, 4288, 4288, 3328, 256]
    - [81, 9641.0]
  - - [1856, 704, 1, 128, 1856, 1856, 128, 704]
    - [57, 7845.0]
  - - [4288, 128, 1, 128, 4288, 4288, 128, 128]
    - [83, 5282.0]
  - - [1408, 448, 1, 256, 1408, 1408, 256, 448]
    - [63, 7190.0]
  - - [6784, 64, 1, 1280, 6784, 6784, 1280, 64]
    - [72, 7946.0]
  - - [3584, 128, 1, 128, 3584, 3584, 128, 128]
    - [47, 5071.0]
  - - [256, 2368, 1, 256, 256, 256, 256, 2368]
    - [88, 6991.0]
  - - [2944, 448, 1, 1280, 2944, 2944, 1280, 448]
    - [81, 8991.0]
  - - [448, 1856, 1, 1280, 448, 448, 1280, 1856]
    - [79, 8972.0]
  - - [1856, 256, 1, 128, 1856, 1856, 128, 256]
    - [57, 5270.0]
  - - [5056, 128, 1, 256, 5056, 5056, 256, 128]
    - [54, 7324.0]
  - - [448, 1024, 1, 256, 448, 448, 256, 1024]
    - [67, 6561.0]
  - - [64, 6784, 1, 128, 64, 64, 128, 6784]
    - [73, 4511.0]
  - - [5888, 64, 1, 1280, 5888, 5888, 1280, 64]
    - [52, 6901.0]
  - - [128, 3584, 1, 128, 128, 128, 128, 3584]
    - [59, 5036.0]
  - - [1408, 256, 1, 256, 1408, 1408, 256, 256]
    - [85, 5291.0]
  - - [128, 5888, 1, 3328, 128, 128, 3328, 5888]
    - [45, 9069.0]
  - - [1408, 256, 1, 1280, 1408, 1408, 1280, 256]
    - [76, 6829.0]
  - - [1024, 1024, 1, 128, 1024, 1024, 128, 1024]
    - [40, 7086.0]
  - - [64, 5056, 1, 128, 64, 64, 128, 5056]
    - [70, 4542.0]
  - - [5888, 64, 1, 128, 5888, 5888, 128, 64]
    - [84, 4377.0]
  - - [448, 704, 1, 128, 448, 448, 128, 704]
    - [58, 4223.0]
  - - [1408, 704, 1, 128, 1408, 1408, 128, 704]
    - [59, 6971.0]
  - - [2368, 256, 1, 3328, 2368, 2368, 3328, 256]
    - [86, 9925.0]
  - - [5888, 128, 1, 1280, 5888, 5888, 1280, 128]
    - [54, 8632.0]
  - - [256, 3584, 1, 1280, 256, 256, 1280, 3584]
    - [41, 10045.0]
  - - [256, 1408, 1, 128, 256, 256, 128, 1408]
    - [42, 4241.0]
  - - [256, 4288, 1, 128, 256, 256, 128, 4288]
    - [78, 7206.0]
  - - [5888, 128, 1, 128, 5888, 5888, 128, 128]
    - [67, 6240.0]
  - - [1856, 256, 1, 3328, 1856, 1856, 3328, 256]
    - [72, 9078.0]
  - - [64, 5888, 1, 1280, 64, 64, 1280, 5888]
    - [80, 6948.0]
  - - [6784, 64, 1, 128, 6784, 6784, 128, 64]
    - [83, 4654.0]
  - - [704, 704, 1, 1280, 704, 704, 1280, 704]
    - [79, 7748.0]
  - - [128, 2368, 1, 1280, 128, 128, 1280, 2368]
    - [46, 7747.0]
  - - [3584, 256, 1, 1280, 3584, 3584, 1280, 256]
    - [74, 9914.0]
  - - [3584, 128, 1, 1280, 3584, 3584, 1280, 128]
    - [54, 8322.0]
  - - [448, 1856, 1, 3328, 448, 448, 3328, 1856]
    - [60, 9451.0]
  - - [1024, 448, 1, 256, 1024, 1024, 256, 448]
    - [49, 6598.0]
  - - [2944, 128, 1, 1280, 2944, 2944, 1280, 128]
    - [88, 7070.0]
  - - [128, 2368, 1, 128, 128, 128, 128, 2368]
    - [42, 5215.0]
  - - [256, 2944, 1, 1280, 256, 256, 1280, 2944]
    - [57, 9007.0]
  - - [704, 1024, 1, 3328, 704, 704, 3328, 1024]
    - [68, 8925.0]
  - - [128, 6784, 1, 256, 128, 128, 256, 6784]
    - [46, 8078.0]
  - - [256, 1856, 1, 3328, 256, 256, 3328, 1856]
    - [81, 9178.0]
  - - [6784, 128, 1, 128, 6784, 6784, 128, 128]
    - [51, 6688.0]
  - - [704, 1408, 1, 256, 704, 704, 256, 1408]
    - [68, 7827.0]
  - - [256, 1408, 1, 256, 256, 256, 256, 1408]
    - [40, 5359.0]
  - - [448, 2944, 1, 1280, 448, 448, 1280, 2944]
    - [60, 9006.0]
  - - [6784, 128, 1, 1280, 6784, 6784, 1280, 128]
    - [86, 9615.0]
  - - [1856, 448, 1, 256, 1856, 1856, 256, 448]
    - [87, 6732.0]
  - - [128, 4288, 1, 1280, 128, 128, 1280, 4288]
    - [60, 8853.0]
  - - [448, 704, 1, 3328, 448, 448, 3328, 704]
    - [70, 8304.0]
  - - [1856, 704, 1, 3328, 1856, 1856, 3328, 704]
    - [86, 9154.0]
  - - [960, 1024, 1, 1024, 960, 960, 1024, 1024]
    - [85, 8373.0]
  - - [768, 768, 1, 768, 768, 768, 768, 768]
    - [51, 8718.0]
  - - [1024, 128, 1, 128, 1024, 1024, 128, 128]
    - [115, 2589.0]
  - - [2368, 64, 1, 3328, 2368, 2368, 3328, 64]
    - [124, 4478.0]
  - - [1408, 64, 1, 128, 1408, 1408, 128, 64]
    - [107, 1797.0]
  - - [1408, 64, 1, 1280, 1408, 1408, 1280, 64]
    - [101, 3101.0]
  - - [2944, 64, 1, 256, 2944, 2944, 256, 64]
    - [124, 2941.0]
  - - [1024, 256, 1, 3328, 1024, 1024, 3328, 256]
    - [105, 3988.0]
  - - [1856, 64, 1, 1280, 1856, 1856, 1280, 64]
    - [103, 3572.0]
  - - [704, 128, 1, 1280, 704, 704, 1280, 128]
    - [128, 3039.0]
  - - [4288, 64, 1, 3328, 4288, 4288, 3328, 64]
    - [124, 4138.0]
  - - [4288, 64, 1, 256, 4288, 4288, 256, 64]
    - [140, 3831.0]
  - - [64, 3584, 1, 3328, 64, 64, 3328, 3584]
    - [95, 4549.0]
  - - [704, 256, 1, 128, 704, 704, 128, 256]
    - [95, 3036.0]
  - - [128, 1408, 1, 128, 128, 128, 128, 1408]
    - [131, 3035.0]
  - - [4288, 64, 1, 1280, 4288, 4288, 1280, 64]
    - [124, 4102.0]
  - - [1024, 256, 1, 256, 1024, 1024, 256, 256]
    - [124, 3732.0]
  - - [448, 448, 1, 256, 448, 448, 256, 448]
    - [115, 3713.0]
  - - [128, 1024, 1, 3328, 128, 128, 3328, 1024]
    - [95, 3876.0]
  - - [64, 1856, 1, 1280, 64, 64, 1280, 1856]
    - [130, 3811.0]
  - - [256, 1024, 1, 256, 256, 256, 256, 1024]
    - [115, 3741.0]
  - - [1024, 128, 1, 1280, 1024, 1024, 1280, 128]
    - [95, 3808.0]
  - - [448, 256, 1, 3328, 448, 448, 3328, 256]
    - [130, 3761.0]
  - - [128, 1024, 1, 128, 128, 128, 128, 1024]
    - [140, 2815.0]
  - - [128, 704, 1, 1280, 128, 128, 1280, 704]
    - [128, 3218.0]
  - - [1856, 128, 1, 3328, 1856, 1856, 3328, 128]
    - [140, 4697.0]
  - - [64, 2944, 1, 128, 64, 64, 128, 2944]
    - [115, 3148.0]
  - - [448, 448, 1, 3328, 448, 448, 3328, 448]
    - [105, 3965.0]
  - - [1408, 128, 1, 1280, 1408, 1408, 1280, 128]
    - [128, 3620.0]
  - - [128, 1856, 1, 1280, 128, 128, 1280, 1856]
    - [95, 4635.0]
  - - [256, 448, 1, 256, 256, 256, 256, 448]
    - [122, 3171.0]
  - - [128, 1856, 1, 128, 128, 128, 128, 1856]
    - [95, 3889.0]
  - - [64, 1408, 1, 3328, 64, 64, 3328, 1408]
    - [112, 3285.0]
  - - [128, 1408, 1, 256, 128, 128, 256, 1408]
    - [131, 3343.0]
  - - [4288, 64, 1, 128, 4288, 4288, 128, 64]
    - [105, 3563.0]
  - - [256, 448, 1, 3328, 256, 256, 3328, 448]
    - [130, 3743.0]
  - - [64, 2368, 1, 1280, 64, 64, 1280, 2368]
    - [95, 4154.0]
  - - [2368, 64, 1, 256, 2368, 2368, 256, 64]
    - [105, 3154.0]
  - - [1408, 128, 1, 128, 1408, 1408, 128, 128]
    - [103, 2349.0]
  - - [1024, 256, 1, 128, 1024, 1024, 128, 256]
    - [105, 2796.0]
  - - [2944, 64, 1, 128, 2944, 2944, 128, 64]
    - [103, 2364.0]
  - - [1856, 64, 1, 256, 1856, 1856, 256, 64]
    - [122, 2534.0]
  - - [704, 128, 1, 256, 704, 704, 256, 128]
    - [128, 2615.0]
  - - [448, 256, 1, 1280, 448, 448, 1280, 256]
    - [130, 3502.0]
  - - [1856, 128, 1, 1280, 1856, 1856, 1280, 128]
    - [124, 4512.0]
  - - [64, 3584, 1, 256, 64, 64, 256, 3584]
    - [105, 3529.0]
  - - [3584, 64, 1, 128, 3584, 3584, 128, 64]
    - [140, 2796.0]
  - - [256, 1024, 1, 1280, 256, 256, 1280, 1024]
    - [95, 3892.0]
  - - [3584, 64, 1, 1280, 3584, 3584, 1280, 64]
    - [105, 4338.0]
  - - [128, 1856, 1, 3328, 128, 128, 3328, 1856]
    - [95, 4635.0]
  - - [64, 2944, 1, 3328, 64, 64, 3328, 2944]
    - [124, 3692.0]
  - - [64, 4288, 1, 3328, 64, 64, 3328, 4288]
    - [105, 4091.0]
  - - [64, 1856, 1, 256, 64, 64, 256, 1856]
    - [122, 3249.0]
  - - [256, 704, 1, 256, 256, 256, 256, 704]
    - [128, 3358.0]
  - - [2368, 64, 1, 128, 2368, 2368, 128, 64]
    - [105, 3222.0]
  - - [64, 1408, 1, 128, 64, 64, 128, 1408]
    - [101, 1506.0]
  - - [704, 256, 1, 3328, 704, 704, 3328, 256]
    - [112, 3715.0]
  - - [64, 2944, 1, 256, 64, 64, 256, 2944]
    - [105, 2927.0]
  - - [448, 256, 1, 128, 448, 448, 128, 256]
    - [130, 1858.0]
  - - [704, 128, 1, 3328, 704, 704, 3328, 128]
    - [128, 3258.0]
  - - [128, 704, 1, 128, 128, 128, 128, 704]
    - [91, 1502.0]
  - - [256, 448, 1, 1280, 256, 256, 1280, 448]
    - [130, 3497.0]
  - - [704, 256, 1, 1280, 704, 704, 1280, 256]
    - [128, 3561.0]
  - - [64, 2368, 1, 3328, 64, 64, 3328, 2368]
    - [95, 4369.0]
  - - [1856, 64, 1, 128, 1856, 1856, 128, 64]
    - [103, 1915.0]
  - - [704, 128, 1, 128, 704, 704, 128, 128]
    - [120, 1542.0]
  - - [256, 704, 1, 3328, 256, 256, 3328, 704]
    - [91, 3670.0]
  - - [256, 448, 1, 128, 256, 256, 128, 448]
    - [138, 1887.0]
  - - [64, 3584, 1, 128, 64, 64, 128, 3584]
    - [95, 2913.0]
  - - [1024, 128, 1, 256, 1024, 1024, 256, 128]
    - [124, 2737.0]
  - - [2944, 64, 1, 1280, 2944, 2944, 1280, 64]
    - [105, 3599.0]
  - - [128, 1408, 1, 3328, 128, 128, 3328, 1408]
    - [91, 3639.0]
  - - [1408, 64, 1, 256, 1408, 1408, 256, 64]
    - [120, 2016.0]
  - - [64, 1856, 1, 128, 64, 64, 128, 1856]
    - [103, 1969.0]
  - - [64, 2368, 1, 256, 64, 64, 256, 2368]
    - [95, 3099.0]
  - - [1024, 128, 1, 3328, 1024, 1024, 3328, 128]
    - [140, 3807.0]
  - - [1856, 128, 1, 128, 1856, 1856, 128, 128]
    - [105, 3035.0]
  - - [2368, 64, 1, 1280, 2368, 2368, 1280, 64]
    - [124, 4359.0]
  - - [128, 1024, 1, 1280, 128, 128, 1280, 1024]
    - [95, 3599.0]
  - - [64, 4288, 1, 1280, 64, 64, 1280, 4288]
    - [95, 3978.0]
  - - [1408, 64, 1, 3328, 1408, 1408, 3328, 64]
    - [120, 3173.0]
  - - [64, 2944, 1, 1280, 64, 64, 1280, 2944]
    - [115, 3689.0]
  - - [256, 704, 1, 128, 256, 256, 128, 704]
    - [140, 2325.0]
  - - [256, 1024, 1, 128, 256, 256, 128, 1024]
    - [105, 2801.0]
  - - [64, 1408, 1, 1280, 64, 64, 1280, 1408]
    - [112, 2976.0]
  - - [448, 448, 1, 1280, 448, 448, 1280, 448]
    - [115, 3885.0]
  - - [1024, 256, 1, 1280, 1024, 1024, 1280, 256]
    - [115, 3999.0]
  - - [128, 1024, 1, 256, 128, 128, 256, 1024]
    - [124, 2676.0]
  - - [3584, 64, 1, 3328, 3584, 3584, 3328, 64]
    - [105, 4585.0]
  - - [1408, 128, 1, 256, 1408, 1408, 256, 128]
    - [120, 2831.0]
  - - [256, 1024, 1, 3328, 256, 256, 3328, 1024]
    - [95, 3995.0]
  - - [1856, 64, 1, 3328, 1856, 1856, 3328, 64]
    - [120, 3874.0]
  - - [448, 256, 1, 256, 448, 448, 256, 256]
    - [138, 2518.0]
  - - [128, 704, 1, 256, 128, 128, 256, 704]
    - [120, 2144.0]
  - - [64, 3584, 1, 1280, 64, 64, 1280, 3584]
    - [95, 4305.0]
  - - [3584, 64, 1, 256, 3584, 3584, 256, 64]
    - [124, 3537.0]
  - - [64, 1856, 1, 3328, 64, 64, 3328, 1856]
    - [130, 3834.0]
  - - [1408, 128, 1, 3328, 1408, 1408, 3328, 128]
    - [128, 3661.0]
  - - [128, 704, 1, 3328, 128, 128, 3328, 704]
    - [112, 3241.0]
  - - [128, 1856, 1, 256, 128, 128, 256, 1856]
    - [124, 3655.0]
  - - [64, 4288, 1, 256, 64, 64, 256, 4288]
    - [95, 3407.0]
  - - [256, 704, 1, 1280, 256, 256, 1280, 704]
    - [120, 3669.0]
  - - [64, 2368, 1, 128, 64, 64, 128, 2368]
    - [105, 2343.0]
  - - [64, 4288, 1, 128, 64, 64, 128, 4288]
    - [95, 2894.0]
  - - [1856, 128, 1, 256, 1856, 1856, 256, 128]
    - [140, 3664.0]
  - - [64, 1408, 1, 256, 64, 64, 256, 1408]
    - [120, 2063.0]
  - - [2944, 64, 1, 3328, 2944, 2944, 3328, 64]
    - [105, 3733.0]
  - - [128, 1408, 1, 1280, 128, 128, 1280, 1408]
    - [101, 3537.0]
  - - [448, 448, 1, 128, 448, 448, 128, 448]
    - [93, 2564.0]
  - - [704, 256, 1, 256, 704, 704, 256, 256]
    - [124, 2869.0]
  - - [512, 512, 1, 512, 512, 512, 512, 512]
    - [131, 3659.0]
  - - [384, 384, 1, 384, 384, 384, 384, 384]
    - [124, 3403.0]
  - - [3584, 4, 1, 1280, 3584, 3584, 1280, 4]
    - [142, 620.0]
  - - [2944, 4, 1, 256, 2944, 2944, 256, 4]
    - [142, 442.0]
  - - [2368, 4, 1, 1280, 2368, 2368, 1280, 4]
    - [142, 473.0]
  - - [6784, 4, 1, 1280, 6784, 6784, 1280, 4]
    - [148, 655.0]
  - - [1856, 4, 1, 1280, 1856, 1856, 1280, 4]
    - [144, 411.0]
  - - [2944, 4, 1, 128, 2944, 2944, 128, 4]
    - [147, 232.0]
  - - [3584, 4, 1, 128, 3584, 3584, 128, 4]
    - [144, 282.0]
  - - [4288, 4, 1, 256, 4288, 4288, 256, 4]
    - [147, 399.0]
  - - [3584, 4, 1, 3328, 3584, 3584, 3328, 4]
    - [144, 652.0]
  - - [5888, 4, 1, 128, 5888, 5888, 128, 4]
    - [144, 371.0]
  - - [2368, 4, 1, 256, 2368, 2368, 256, 4]
    - [144, 292.0]
  - - [1408, 4, 1, 256, 1408, 1408, 256, 4]
    - [145, 225.0]
  - - [5056, 4, 1, 1280, 5056, 5056, 1280, 4]
    - [145, 634.0]
  - - [1408, 4, 1, 3328, 1408, 1408, 3328, 4]
    - [137, 314.0]
  - - [6784, 4, 1, 128, 6784, 6784, 128, 4]
    - [147, 399.0]
  - - [5888, 4, 1, 3328, 5888, 5888, 3328, 4]
    - [147, 413.0]
  - - [5056, 4, 1, 128, 5056, 5056, 128, 4]
    - [144, 336.0]
  - - [5888, 4, 1, 1280, 5888, 5888, 1280, 4]
    - [144, 592.0]
  - - [2944, 4, 1, 3328, 2944, 2944, 3328, 4]
    - [147, 569.0]
  - - [2368, 4, 1, 128, 2368, 2368, 128, 4]
    - [142, 196.0]
  - - [1856, 4, 1, 128, 1856, 1856, 128, 4]
    - [144, 168.0]
  - - [1408, 4, 1, 1280, 1408, 1408, 1280, 4]
    - [147, 320.0]
  - - [6784, 4, 1, 256, 6784, 6784, 256, 4]
    - [146, 503.0]
  - - [4288, 4, 1, 128, 4288, 4288, 128, 4]
    - [142, 479.0]
  - - [1856, 4, 1, 3328, 1856, 1856, 3328, 4]
    - [144, 424.0]
  - - [3584, 4, 1, 256, 3584, 3584, 256, 4]
    - [142, 478.0]
  - - [2368, 4, 1, 3328, 2368, 2368, 3328, 4]
    - [147, 527.0]
  - - [6784, 4, 1, 3328, 6784, 6784, 3328, 4]
    - [143, 380.0]
  - - [4288, 4, 1, 1280, 4288, 4288, 1280, 4]
    - [142, 566.0]
  - - [1856, 4, 1, 256, 1856, 1856, 256, 4]
    - [147, 256.0]
  - - [1408, 4, 1, 128, 1408, 1408, 128, 4]
    - [142, 123.0]
  - - [5056, 4, 1, 256, 5056, 5056, 256, 4]
    - [147, 431.0]
  - - [4288, 4, 1, 3328, 4288, 4288, 3328, 4]
    - [147, 627.0]
  - - [2944, 4, 1, 1280, 2944, 2944, 1280, 4]
    - [144, 521.0]
  - - [5888, 4, 1, 256, 5888, 5888, 256, 4]
    - [147, 446.0]
  - - [5056, 4, 1, 3328, 5056, 5056, 3328, 4]
    - [148, 701.0]
  - - [4, 1856, 1, 3328, 4, 4, 3328, 1856]
    - [153, 708.0]
  - - [4, 2944, 1, 1280, 4, 4, 1280, 2944]
    - [158, 735.0]
  - - [4, 1408, 1, 128, 4, 4, 128, 1408]
    - [125, 205.0]
  - - [4, 2368, 1, 1280, 4, 4, 1280, 2368]
    - [161, 755.0]
  - - [4, 3584, 1, 128, 4, 4, 128, 3584]
    - [151, 480.0]
  - - [4, 5888, 1, 3328, 4, 4, 3328, 5888]
    - [163, 616.0]
  - - [4, 1408, 1, 3328, 4, 4, 3328, 1408]
    - [161, 512.0]
  - - [4, 6784, 1, 3328, 4, 4, 3328, 6784]
    - [149, 497.0]
  - - [4, 4288, 1, 128, 4, 4, 128, 4288]
    - [111, 345.0]
  - - [4, 5056, 1, 3328, 4, 4, 3328, 5056]
    - [156, 977.0]
  - - [4, 6784, 1, 1280, 4, 4, 1280, 6784]
    - [150, 847.0]
  - - [4, 2944, 1, 3328, 4, 4, 3328, 2944]
    - [161, 817.0]
  - - [4, 5056, 1, 256, 4, 4, 256, 5056]
    - [151, 787.0]
  - - [4, 5056, 1, 1280, 4, 4, 1280, 5056]
    - [152, 969.0]
  - - [4, 2368, 1, 3328, 4, 4, 3328, 2368]
    - [153, 826.0]
  - - [4, 1856, 1, 256, 4, 4, 256, 1856]
    - [106, 348.0]
  - - [4, 2368, 1, 256, 4, 4, 256, 2368]
    - [152, 452.0]
  - - [4, 2944, 1, 256, 4, 4, 256, 2944]
    - [150, 373.0]
  - - [4, 4288, 1, 1280, 4, 4, 1280, 4288]
    - [155, 801.0]
  - - [4, 6784, 1, 128, 4, 4, 128, 6784]
    - [150, 462.0]
  - - [4, 3584, 1, 1280, 4, 4, 1280, 3584]
    - [160, 780.0]
  - - [4, 5888, 1, 256, 4, 4, 256, 5888]
    - [149, 613.0]
  - - [4, 6784, 1, 256, 4, 4, 256, 6784]
    - [159, 617.0]
  - - [4, 1408, 1, 1280, 4, 4, 1280, 1408]
    - [161, 419.0]
  - - [4, 3584, 1, 256, 4, 4, 256, 3584]
    - [157, 450.0]
  - - [4, 1408, 1, 256, 4, 4, 256, 1408]
    - [125, 191.0]
  - - [4, 4288, 1, 3328, 4, 4, 3328, 4288]
    - [154, 893.0]
  - - [4, 5888, 1, 1280, 4, 4, 1280, 5888]
    - [162, 944.0]
  - - [4, 1856, 1, 1280, 4, 4, 1280, 1856]
    - [161, 552.0]
  - - [4, 1856, 1, 128, 4, 4, 128, 1856]
    - [149, 242.0]
  - - [4, 2944, 1, 128, 4, 4, 128, 2944]
    - [150, 236.0]
  - - [4, 5056, 1, 128, 4, 4, 128, 5056]
    - [156, 398.0]
  - - [4, 4288, 1, 256, 4, 4, 256, 4288]
    - [150, 496.0]
  - - [4, 3584, 1, 3328, 4, 4, 3328, 3584]
    - [155, 920.0]
  - - [4, 5888, 1, 128, 4, 4, 128, 5888]
    - [162, 442.0]
  - - [4, 2368, 1, 128, 4, 4, 128, 2368]
    - [152, 199.0]
  - - [4, 704, 1, 1280, 4, 4, 1280, 704]
    - [96, 216.0]
  - - [128, 64, 1, 256, 128, 128, 256, 64]
    - [102, 507.0]
  - - [64, 4, 1, 256, 64, 64, 256, 4]
    - [106, 14.0]
  - - [64, 704, 1, 128, 64, 64, 128, 704]
    - [108, 1182.0]
  - - [448, 64, 1, 1280, 448, 448, 1280, 64]
    - [116, 1617.0]
  - - [128, 4, 1, 1280, 128, 128, 1280, 4]
    - [99, 39.0]
  - - [64, 1024, 1, 1280, 64, 64, 1280, 1024]
    - [120, 2704.0]
  - - [64, 704, 1, 1280, 64, 64, 1280, 704]
    - [111, 2015.0]
  - - [1024, 64, 1, 128, 1024, 1024, 128, 64]
    - [122, 1202.0]
  - - [64, 1024, 1, 3328, 64, 64, 3328, 1024]
    - [133, 3015.0]
  - - [1024, 64, 1, 1280, 1024, 1024, 1280, 64]
    - [101, 2794.0]
  - - [4, 704, 1, 256, 4, 4, 256, 704]
    - [106, 102.0]
  - - [704, 4, 1, 1280, 704, 704, 1280, 4]
    - [106, 206.0]
  - - [64, 448, 1, 256, 64, 64, 256, 448]
    - [100, 1011.0]
  - - [64, 1024, 1, 128, 64, 64, 128, 1024]
    - [136, 1192.0]
  - - [4, 64, 1, 1280, 4, 4, 1280, 64]
    - [99, 20.0]
  - - [128, 256, 1, 3328, 128, 128, 3328, 256]
    - [114, 1862.0]
  - - [64, 448, 1, 1280, 64, 64, 1280, 448]
    - [96, 1611.0]
  - - [448, 4, 1, 256, 448, 448, 256, 4]
    - [100, 65.0]
  - - [448, 4, 1, 1280, 448, 448, 1280, 4]
    - [106, 137.0]
  - - [128, 4, 1, 128, 128, 128, 128, 4]
    - [92, 11.0]
  - - [256, 4, 1, 128, 256, 256, 128, 4]
    - [119, 23.0]
  - - [704, 64, 1, 3328, 704, 704, 3328, 64]
    - [136, 2152.0]
  - - [64, 128, 1, 256, 64, 64, 256, 128]
    - [119, 321.0]
  - - [704, 64, 1, 128, 704, 704, 128, 64]
    - [109, 1052.0]
  - - [1024, 4, 1, 256, 1024, 1024, 256, 4]
    - [100, 142.0]
  - - [256, 256, 1, 128, 256, 256, 128, 256]
    - [120, 1219.0]
  - - [64, 256, 1, 128, 64, 64, 128, 256]
    - [98, 373.0]
  - - [704, 64, 1, 1280, 704, 704, 1280, 64]
    - [111, 1952.0]
  - - [128, 448, 1, 256, 128, 128, 256, 448]
    - [101, 1545.0]
  - - [128, 256, 1, 1280, 128, 128, 1280, 256]
    - [119, 1686.0]
  - - [448, 64, 1, 3328, 448, 448, 3328, 64]
    - [116, 1804.0]
  - - [256, 128, 1, 128, 256, 256, 128, 128]
    - [104, 728.0]
  - - [64, 128, 1, 3328, 64, 64, 3328, 128]
    - [134, 749.0]
  - - [128, 128, 1, 3328, 128, 128, 3328, 128]
    - [98, 1300.0]
  - - [256, 128, 1, 256, 256, 256, 256, 128]
    - [100, 1046.0]
  - - [64, 448, 1, 3328, 64, 64, 3328, 448]
    - [96, 1890.0]
  - - [256, 256, 1, 3328, 256, 256, 3328, 256]
    - [91, 3122.0]
  - - [1024, 4, 1, 3328, 1024, 1024, 3328, 4]
    - [141, 312.0]
  - - [4, 4, 1, 256, 4, 4, 256, 4]
    - [90, 1.0]
  - - [256, 64, 1, 256, 256, 256, 256, 64]
    - [135, 613.0]
  - - [256, 128, 1, 1280, 256, 256, 1280, 128]
    - [119, 1722.0]
  - - [128, 64, 1, 1280, 128, 128, 1280, 64]
    - [110, 603.0]
  - - [4, 448, 1, 3328, 4, 4, 3328, 448]
    - [134, 164.0]
  - - [64, 1024, 1, 256, 64, 64, 256, 1024]
    - [124, 1691.0]
  - - [256, 4, 1, 1280, 256, 256, 1280, 4]
    - [99, 77.0]
  - - [64, 704, 1, 256, 64, 64, 256, 704]
    - [113, 1571.0]
  - - [4, 704, 1, 128, 4, 4, 128, 704]
    - [135, 105.0]
  - - [448, 128, 1, 256, 448, 448, 256, 128]
    - [125, 1642.0]
  - - [448, 64, 1, 128, 448, 448, 128, 64]
    - [94, 626.0]
  - - [4, 448, 1, 1280, 4, 4, 1280, 448]
    - [99, 132.0]
  - - [256, 256, 1, 256, 256, 256, 256, 256]
    - [120, 1781.0]
  - - [256, 64, 1, 128, 256, 256, 128, 64]
    - [119, 394.0]
  - - [4, 1024, 1, 3328, 4, 4, 3328, 1024]
    - [96, 307.0]
  - - [704, 4, 1, 128, 704, 704, 128, 4]
    - [141, 63.0]
  - - [256, 4, 1, 256, 256, 256, 256, 4]
    - [121, 38.0]
  - - [256, 4, 1, 3328, 256, 256, 3328, 4]
    - [117, 98.0]
  - - [4, 256, 1, 256, 4, 4, 256, 256]
    - [125, 37.0]
  - - [4, 4, 1, 128, 4, 4, 128, 4]
    - [114, 0.35]
  - - [4, 128, 1, 256, 4, 4, 256, 128]
    - [141, 27.0]
  - - [64, 64, 1, 1280, 64, 64, 1280, 64]
    - [117, 373.0]
  - - [448, 128, 1, 3328, 448, 448, 3328, 128]
    - [128, 2945.0]
  - - [4, 448, 1, 128, 4, 4, 128, 448]
    - [100, 68.0]
  - - [64, 256, 1, 1280, 64, 64, 1280, 256]
    - [108, 1273.0]
  - - [4, 128, 1, 3328, 4, 4, 3328, 128]
    - [99, 49.0]
  - - [64, 4, 1, 128, 64, 64, 128, 4]
    - [100, 6.0]
  - - [64, 64, 1, 256, 64, 64, 256, 64]
    - [125, 166.0]
  - - [4, 704, 1, 3328, 4, 4, 3328, 704]
    - [96, 216.0]
  - - [4, 4, 1, 1280, 4, 4, 1280, 4]
    - [90, 1.0]
  - - [128, 128, 1, 128, 128, 128, 128, 128]
    - [130, 462.0]
  - - [1024, 4, 1, 128, 1024, 1024, 128, 4]
    - [121, 94.0]
  - - [64, 64, 1, 3328, 64, 64, 3328, 64]
    - [99, 396.0]
  - - [4, 64, 1, 128, 4, 4, 128, 64]
    - [97, 6.0]
  - - [64, 128, 1, 1280, 64, 64, 1280, 128]
    - [134, 607.0]
  - - [128, 128, 1, 1280, 128, 128, 1280, 128]
    - [108, 1129.0]
  - - [128, 256, 1, 256, 128, 128, 256, 256]
    - [100, 1070.0]
  - - [256, 64, 1, 1280, 256, 256, 1280, 64]
    - [108, 1114.0]
  - - [1024, 4, 1, 1280, 1024, 1024, 1280, 4]
    - [141, 274.0]
  - - [704, 64, 1, 256, 704, 704, 256, 64]
    - [119, 1317.0]
  - - [128, 448, 1, 1280, 128, 128, 1280, 448]
    - [112, 2493.0]
  - - [128, 64, 1, 3328, 128, 128, 3328, 64]
    - [117, 749.0]
  - - [448, 64, 1, 256, 448, 448, 256, 64]
    - [135, 1014.0]
  - - [4, 256, 1, 128, 4, 4, 128, 256]
    - [90, 23.0]
  - - [1024, 64, 1, 256, 1024, 1024, 256, 64]
    - [103, 1773.0]
  - - [64, 128, 1, 128, 64, 64, 128, 128]
    - [121, 203.0]
  - - [4, 4, 1, 3328, 4, 4, 3328, 4]
    - [99, 2.0]
  - - [4, 1024, 1, 1280, 4, 4, 1280, 1024]
    - [96, 269.0]
  - - [704, 4, 1, 256, 704, 704, 256, 4]
    - [119, 103.0]
  - - [128, 4, 1, 3328, 128, 128, 3328, 4]
    - [99, 49.0]
  - - [448, 4, 1, 3328, 448, 448, 3328, 4]
    - [110, 165.0]
  - - [704, 4, 1, 3328, 704, 704, 3328, 4]
    - [125, 231.0]
  - - [448, 128, 1, 1280, 448, 448, 1280, 128]
    - [136, 2550.0]
  - - [1024, 64, 1, 3328, 1024, 1024, 3328, 64]
    - [101, 3017.0]
  - - [4, 1024, 1, 128, 4, 4, 128, 1024]
    - [118, 118.0]
  - - [64, 256, 1, 3328, 64, 64, 3328, 256]
    - [132, 1382.0]
  - - [448, 128, 1, 128, 448, 448, 128, 128]
    - [129, 1451.0]
  - - [128, 256, 1, 128, 128, 128, 128, 256]
    - [119, 713.0]
  - - [128, 4, 1, 256, 128, 128, 256, 4]
    - [106, 19.0]
  - - [256, 256, 1, 1280, 256, 256, 1280, 256]
    - [138, 3007.0]
  - - [256, 128, 1, 3328, 256, 256, 3328, 128]
    - [114, 1884.0]
  - - [448, 4, 1, 128, 448, 448, 128, 4]
    - [123, 69.0]
  - - [4, 256, 1, 3328, 4, 4, 3328, 256]
    - [127, 104.0]
  - - [4, 128, 1, 128, 4, 4, 128, 128]
    - [90, 11.0]
  - - [4, 256, 1, 1280, 4, 4, 1280, 256]
    - [134, 91.0]
  - - [64, 4, 1, 3328, 64, 64, 3328, 4]
    - [99, 24.0]
  - - [4, 64, 1, 3328, 4, 4, 3328, 64]
    - [117, 26.0]
  - - [4, 1024, 1, 256, 4, 4, 256, 1024]
    - [125, 144.0]
  - - [64, 256, 1, 256, 64, 64, 256, 256]
    - [100, 606.0]
  - - [4, 64, 1, 256, 4, 4, 256, 64]
    - [96, 9.0]
  - - [128, 448, 1, 128, 128, 128, 128, 448]
    - [139, 1079.0]
  - - [64, 448, 1, 128, 64, 64, 128, 448]
    - [126, 951.0]
  - - [64, 704, 1, 3328, 64, 64, 3328, 704]
    - [111, 2187.0]
  - - [128, 448, 1, 3328, 128, 128, 3328, 448]
    - [128, 2757.0]
  - - [4, 448, 1, 256, 4, 4, 256, 448]
    - [96, 64.0]
  - - [4, 128, 1, 1280, 4, 4, 1280, 128]
    - [127, 40.0]
  - - [128, 64, 1, 128, 128, 128, 128, 64]
    - [121, 197.0]
  - - [64, 64, 1, 128, 64, 64, 128, 64]
    - [113, 114.0]
  - - [64, 4, 1, 1280, 64, 64, 1280, 4]
    - [110, 20.0]
  - - [256, 64, 1, 3328, 256, 256, 3328, 64]
    - [98, 1296.0]
  - - [128, 128, 1, 256, 128, 128, 256, 128]
    - [98, 604.0]
- null
- null
- DeviceEfficiency
...
