library/src/blas3/Tensile/Logic/asm_full/navi22_Cijk_Alik_Bljk_HB_GB.yaml
---
- {MinimumRequiredVersion: 4.28.0}
- navi22
- gfx1031
    SolutionIndex: 0
    SolutionNameMin: Cijk_Alik_Bljk_HB_GB_MT128x256x8_SN_SU0_SUM0_TT8_16_WG16_16_1_WGM1
    SolutionIndex: 1
    SolutionNameMin: Cijk_Alik_Bljk_HB_GB_MT128x64x16_SN_SU0_SUM0_TT8_8_WG16_8_1_WGM1
    SolutionIndex: 2
    SolutionNameMin: Cijk_Alik_Bljk_HB_GB_MT128x128x16_SN_SU0_SUM0_TT8_16_WG16_8_1_WGM1
    SolutionIndex: 3
    SolutionNameMin: Cijk_Alik_Bljk_HB_GB_MT256x128x16_SN_SU0_SUM0_TT16_16_WG16_8_1_WGM1
    SolutionIndex: 4
    SolutionNameMin: Cijk_Alik_Bljk_HB_GB_MT128x128x16_SN_SU0_SUM0_TT8_8_WG16_16_1_WGM1
    SolutionIndex: 5
    SolutionNameMin: Cijk_Alik_Bljk_HB_GB_MT128x256x16_SN_SU0_SUM0_TT8_16_WG16_16_1_WGM1
    SolutionIndex: 6
    SolutionNameMin: Cijk_Alik_Bljk_HB_GB_MT128x128x32_SN_SU0_SUM0_TT8_16_WG16_8_1_WGM1
    SolutionIndex: 7
    SolutionNameMin: Cijk_Alik_Bljk_HB_GB_MT128x128x16_SN_SU32_SUM3_TT8_16_WG16_8_1_WGM1
    SolutionIndex: 8
    SolutionNameMin: Cijk_Alik_Bljk_HB_GB_MT256x128x16_SN_SU32_SUM3_TT16_16_WG16_8_1_WGM1
    SolutionIndex: 9
    SolutionNameMin: Cijk_Alik_Bljk_HB_GB_MT128x128x16_SN_SU32_SUM3_TT8_8_WG16_16_1_WGM1
    SolutionIndex: 10
    SolutionNameMin: Cijk_Alik_Bljk_HB_GB_MT128x256x16_SN_SU32_SUM3_TT8_16_WG16_16_1_WGM1
    SolutionIndex: 11
    SolutionNameMin: Cijk_Alik_Bljk_HB_GB_MT256x256x16_SN_SU32_SUM3_TT16_16_WG16_16_1_WGM1
    SolutionIndex: 12
    SolutionNameMin: Cijk_Alik_Bljk_HB_GB_MT128x128x32_SN_SU32_SUM3_TT8_16_WG16_8_1_WGM1
    SolutionIndex: 13
    SolutionNameMin: Cijk_Alik_Bljk_HB_GB_MT128x128x16_SN_SU0_SUM0_TT8_16_WG16_8_1_WGM4
    SolutionIndex: 14
    SolutionNameMin: Cijk_Alik_Bljk_HB_GB_MT256x128x16_SN_SU0_SUM0_TT16_16_WG16_8_1_WGM4
    SolutionIndex: 15
    SolutionNameMin: Cijk_Alik_Bljk_HB_GB_MT128x128x16_SN_SU0_SUM0_TT8_8_WG16_16_1_WGM4
    SolutionIndex: 16
    SolutionNameMin: Cijk_Alik_Bljk_HB_GB_MT128x256x16_SN_SU0_SUM0_TT8_16_WG16_16_1_WGM4
    SolutionIndex: 17
    SolutionNameMin: Cijk_Alik_Bljk_HB_GB_MT256x256x16_SN_SU0_SUM0_TT16_16_WG16_16_1_WGM4
    SolutionIndex: 18
    SolutionNameMin: Cijk_Alik_Bljk_HB_GB_MT128x64x16_SN_SU32_SUM3_TT8_8_WG16_8_1_WGM4
    SolutionIndex: 19
    SolutionNameMin: Cijk_Alik_Bljk_HB_GB_MT128x128x16_SN_SU32_SUM3_TT8_16_WG16_8_1_WGM4
    SolutionIndex: 20
    SolutionNameMin: Cijk_Alik_Bljk_HB_GB_MT256x128x16_SN_SU32_SUM3_TT16_16_WG16_8_1_WGM4
    SolutionIndex: 21
    SolutionNameMin: Cijk_Alik_Bljk_HB_GB_MT128x128x16_SN_SU32_SUM3_TT8_8_WG16_16_1_WGM4
    SolutionIndex: 22
    SolutionNameMin: Cijk_Alik_Bljk_HB_GB_MT128x256x16_SN_SU32_SUM3_TT8_16_WG16_16_1_WGM4
    SolutionIndex: 23
    SolutionNameMin: Cijk_Alik_Bljk_HB_GB_MT256x256x16_SN_SU32_SUM3_TT16_16_WG16_16_1_WGM4
    SolutionIndex: 24
    SolutionNameMin: Cijk_Alik_Bljk_HB_GB_MT128x128x32_SN_SU32_SUM3_TT8_16_WG16_8_1_WGM4
    SolutionIndex: 25
    SolutionNameMin: Cijk_Alik_Bljk_HB_GB_MT128x128x16_SN_SU0_SUM0_TT8_16_WG16_8_1_WGM8
    SolutionIndex: 26
    SolutionNameMin: Cijk_Alik_Bljk_HB_GB_MT256x128x16_SN_SU0_SUM0_TT16_16_WG16_8_1_WGM8
    SolutionIndex: 27
    SolutionNameMin: Cijk_Alik_Bljk_HB_GB_MT128x128x16_SN_SU0_SUM0_TT8_8_WG16_16_1_WGM8
    SolutionIndex: 28
    SolutionNameMin: Cijk_Alik_Bljk_HB_GB_MT128x256x16_SN_SU0_SUM0_TT8_16_WG16_16_1_WGM8
    SolutionIndex: 29
    SolutionNameMin: Cijk_Alik_Bljk_HB_GB_MT256x256x16_SN_SU0_SUM0_TT16_16_WG16_16_1_WGM8
    SolutionIndex: 30
    SolutionNameMin: Cijk_Alik_Bljk_HB_GB_MT128x64x16_SN_SU32_SUM3_TT8_8_WG16_8_1_WGM8
    SolutionIndex: 31
    SolutionNameMin: Cijk_Alik_Bljk_HB_GB_MT128x128x16_SN_SU32_SUM3_TT8_16_WG16_8_1_WGM8
    SolutionIndex: 32
    SolutionNameMin: Cijk_Alik_Bljk_HB_GB_MT256x128x16_SN_SU32_SUM3_TT16_16_WG16_8_1_WGM8
    SolutionIndex: 33
    SolutionNameMin: Cijk_Alik_Bljk_HB_GB_MT128x128x16_SN_SU32_SUM3_TT8_8_WG16_16_1_WGM8
    SolutionIndex: 34
    SolutionNameMin: Cijk_Alik_Bljk_HB_GB_MT128x256x16_SN_SU32_SUM3_TT8_16_WG16_16_1_WGM8
    SolutionIndex: 35
    SolutionNameMin: Cijk_Alik_Bljk_HB_GB_MT256x256x16_SN_SU32_SUM3_TT16_16_WG16_16_1_WGM8
    SolutionIndex: 36
    SolutionNameMin: Cijk_Alik_Bljk_HB_GB_MT128x256x32_SN_SU32_SUM3_TT8_16_WG16_16_1_WGM8
    SolutionIndex: 37
    SolutionNameMin: Cijk_Alik_Bljk_HB_GB_MT64x64x16_SN_SU0_SUM0_TT8_8_WG8_8_1_WGM1
    SolutionIndex: 38
    SolutionNameMin: Cijk_Alik_Bljk_HB_GB_MT128x64x16_SN_SU0_SUM0_TT8_8_WG16_8_1_WGM1
    SolutionIndex: 39
    SolutionNameMin: Cijk_Alik_Bljk_HB_GB_MT128x128x16_SN_SU0_SUM0_TT8_8_WG16_16_1_WGM1
    SolutionIndex: 40
    SolutionNameMin: Cijk_Alik_Bljk_HB_GB_MT128x128x8_SN_SU32_SUM3_TT8_8_WG16_16_1_WGM1
    SolutionIndex: 41
    SolutionNameMin: Cijk_Alik_Bljk_HB_GB_MT64x64x16_SN_SU32_SUM3_TT8_8_WG8_8_1_WGM1
    SolutionIndex: 42
    SolutionNameMin: Cijk_Alik_Bljk_HB_GB_MT128x64x16_SN_SU32_SUM3_TT8_8_WG16_8_1_WGM1
    SolutionIndex: 43
    SolutionNameMin: Cijk_Alik_Bljk_HB_GB_MT128x128x16_SN_SU32_SUM3_TT8_8_WG16_16_1_WGM1
    SolutionIndex: 44
    SolutionNameMin: Cijk_Alik_Bljk_HB_GB_MT128x64x32_SN_SU32_SUM3_TT8_8_WG16_8_1_WGM1
    SolutionIndex: 45
    SolutionNameMin: Cijk_Alik_Bljk_HB_GB_MT64x64x16_SN_SU0_SUM0_TT8_8_WG8_8_1_WGM4
    SolutionIndex: 46
    SolutionNameMin: Cijk_Alik_Bljk_HB_GB_MT128x64x16_SN_SU0_SUM0_TT8_8_WG16_8_1_WGM4
    SolutionIndex: 47
    SolutionNameMin: Cijk_Alik_Bljk_HB_GB_MT128x128x16_SN_SU0_SUM0_TT8_8_WG16_16_1_WGM4
    SolutionIndex: 48
    SolutionNameMin: Cijk_Alik_Bljk_HB_GB_MT128x128x8_SN_SU32_SUM3_TT8_8_WG16_16_1_WGM4
    SolutionIndex: 49
    SolutionNameMin: Cijk_Alik_Bljk_HB_GB_MT64x64x16_SN_SU32_SUM3_TT8_8_WG8_8_1_WGM4
    SolutionIndex: 50
    SolutionNameMin: Cijk_Alik_Bljk_HB_GB_MT128x64x16_SN_SU32_SUM3_TT8_8_WG16_8_1_WGM4
    SolutionIndex: 51
    SolutionNameMin: Cijk_Alik_Bljk_HB_GB_MT128x128x16_SN_SU32_SUM3_TT8_8_WG16_16_1_WGM4
    SolutionIndex: 52
    SolutionNameMin: Cijk_Alik_Bljk_HB_GB_MT64x64x16_SN_SU0_SUM0_TT8_8_WG8_8_1_WGM8
    SolutionIndex: 53
    SolutionNameMin: Cijk_Alik_Bljk_HB_GB_MT128x64x16_SN_SU0_SUM0_TT8_8_WG16_8_1_WGM8
    SolutionIndex: 54
    SolutionNameMin: Cijk_Alik_Bljk_HB_GB_MT128x128x16_SN_SU0_SUM0_TT8_8_WG16_16_1_WGM8
    SolutionIndex: 55
    SolutionNameMin: Cijk_Alik_Bljk_HB_GB_MT128x128x8_SN_SU32_SUM3_TT8_8_WG16_16_1_WGM8
    SolutionIndex: 56
    SolutionNameMin: Cijk_Alik_Bljk_HB_GB_MT64x64x16_SN_SU32_SUM3_TT8_8_WG8_8_1_WGM8
    SolutionIndex: 57
    SolutionNameMin: Cijk_Alik_Bljk_HB_GB_MT128x64x16_SN_SU32_SUM3_TT8_8_WG16_8_1_WGM8
    SolutionIndex: 58
    SolutionNameMin: Cijk_Alik_Bljk_HB_GB_MT128x128x16_SN_SU32_SUM3_TT8_8_WG16_16_1_WGM8
    SolutionIndex: 59
    SolutionNameMin: Cijk_Alik_Bljk_HB_GB_MT64x32x8_SN_SU0_SUM0_TT4_4_WG16_8_1_WGM1
    SolutionIndex: 60
    SolutionNameMin: Cijk_Alik_Bljk_HB_GB_MT32x32x8_SN_SU0_SUM0_TT2_2_WG16_16_1_WGM1
    SolutionIndex: 61
    SolutionNameMin: Cijk_Alik_Bljk_HB_GB_MT64x64x8_SN_SU0_SUM0_TT4_4_WG16_16_1_WGM1
    SolutionIndex: 62
    SolutionNameMin: Cijk_Alik_Bljk_HB_GB_MT16x16x16_SN_SU0_SUM0_TT2_2_WG8_8_1_WGM1
    SolutionIndex: 63
    SolutionNameMin: Cijk_Alik_Bljk_HB_GB_MT64x64x16_SN_SU0_SUM0_TT4_4_WG16_16_1_WGM1
    SolutionIndex: 64
    SolutionNameMin: Cijk_Alik_Bljk_HB_GB_MT16x16x32_SN_SU0_SUM0_TT2_2_WG8_8_1_WGM1
    SolutionIndex: 65
    SolutionNameMin: Cijk_Alik_Bljk_HB_GB_MT16x16x8_SN_SU32_SUM3_TT2_2_WG8_8_1_WGM1
    SolutionIndex: 66
    SolutionNameMin: Cijk_Alik_Bljk_HB_GB_MT32x32x8_SN_SU32_SUM3_TT2_2_WG16_16_1_WGM1
    SolutionIndex: 67
    SolutionNameMin: Cijk_Alik_Bljk_HB_GB_MT64x64x8_SN_SU32_SUM3_TT4_4_WG16_16_1_WGM1
    SolutionIndex: 68
    SolutionNameMin: Cijk_Alik_Bljk_HB_GB_MT16x16x16_SN_SU32_SUM3_TT2_2_WG8_8_1_WGM1
    SolutionIndex: 69
    SolutionNameMin: Cijk_Alik_Bljk_HB_GB_MT32x16x16_SN_SU32_SUM3_TT2_2_WG16_8_1_WGM1
    SolutionIndex: 70
    SolutionNameMin: Cijk_Alik_Bljk_HB_GB_MT64x32x16_SN_SU32_SUM3_TT4_4_WG16_8_1_WGM1
    SolutionIndex: 71
    SolutionNameMin: Cijk_Alik_Bljk_HB_GB_MT64x64x16_SN_SU32_SUM3_TT4_4_WG16_16_1_WGM1
    SolutionIndex: 72
    SolutionNameMin: Cijk_Alik_Bljk_HB_GB_MT16x16x8_SN_SU0_SUM0_TT2_2_WG8_8_1_WGM4
    SolutionIndex: 73
    SolutionNameMin: Cijk_Alik_Bljk_HB_GB_MT32x32x8_SN_SU0_SUM0_TT4_4_WG8_8_1_WGM4
    SolutionIndex: 74
    SolutionNameMin: Cijk_Alik_Bljk_HB_GB_MT64x32x8_SN_SU0_SUM0_TT4_4_WG16_8_1_WGM4
    SolutionIndex: 75
    SolutionNameMin: Cijk_Alik_Bljk_HB_GB_MT64x64x8_SN_SU0_SUM0_TT4_4_WG16_16_1_WGM4
    SolutionIndex: 76
    SolutionNameMin: Cijk_Alik_Bljk_HB_GB_MT16x16x16_SN_SU0_SUM0_TT2_2_WG8_8_1_WGM4
    SolutionIndex: 77
    SolutionNameMin: Cijk_Alik_Bljk_HB_GB_MT64x32x16_SN_SU0_SUM0_TT4_4_WG16_8_1_WGM4
    SolutionIndex: 78
    SolutionNameMin: Cijk_Alik_Bljk_HB_GB_MT64x64x16_SN_SU0_SUM0_TT4_4_WG16_16_1_WGM4
    SolutionIndex: 79
    SolutionNameMin: Cijk_Alik_Bljk_HB_GB_MT16x16x32_SN_SU0_SUM0_TT2_2_WG8_8_1_WGM4
    SolutionIndex: 80
    SolutionNameMin: Cijk_Alik_Bljk_HB_GB_MT16x16x8_SN_SU32_SUM3_TT2_2_WG8_8_1_WGM4
    SolutionIndex: 81
    SolutionNameMin: Cijk_Alik_Bljk_HB_GB_MT32x32x8_SN_SU32_SUM3_TT4_4_WG8_8_1_WGM4
    SolutionIndex: 82
    SolutionNameMin: Cijk_Alik_Bljk_HB_GB_MT32x16x8_SN_SU32_SUM3_TT2_2_WG16_8_1_WGM4
    SolutionIndex: 83
    SolutionNameMin: Cijk_Alik_Bljk_HB_GB_MT64x32x8_SN_SU32_SUM3_TT4_4_WG16_8_1_WGM4
    SolutionIndex: 84
    SolutionNameMin: Cijk_Alik_Bljk_HB_GB_MT32x32x8_SN_SU32_SUM3_TT2_2_WG16_16_1_WGM4
    SolutionIndex: 85
    SolutionNameMin: Cijk_Alik_Bljk_HB_GB_MT64x64x8_SN_SU32_SUM3_TT4_4_WG16_16_1_WGM4
    SolutionIndex: 86
    SolutionNameMin: Cijk_Alik_Bljk_HB_GB_MT16x16x16_SN_SU32_SUM3_TT2_2_WG8_8_1_WGM4
    SolutionIndex: 87
    SolutionNameMin: Cijk_Alik_Bljk_HB_GB_MT64x32x16_SN_SU32_SUM3_TT4_4_WG16_8_1_WGM4
    SolutionIndex: 88
    SolutionNameMin: Cijk_Alik_Bljk_HB_GB_MT64x64x16_SN_SU32_SUM3_TT4_4_WG16_16_1_WGM4
    SolutionIndex: 89
    SolutionNameMin: Cijk_Alik_Bljk_HB_GB_MT64x32x8_SN_SU0_SUM0_TT4_4_WG16_8_1_WGM8
    SolutionIndex: 90
    SolutionNameMin: Cijk_Alik_Bljk_HB_GB_MT64x64x8_SN_SU0_SUM0_TT4_4_WG16_16_1_WGM8
    SolutionIndex: 91
    SolutionNameMin: Cijk_Alik_Bljk_HB_GB_MT16x16x16_SN_SU0_SUM0_TT2_2_WG8_8_1_WGM8
    SolutionIndex: 92
    SolutionNameMin: Cijk_Alik_Bljk_HB_GB_MT16x16x8_SN_SU32_SUM3_TT2_2_WG8_8_1_WGM8
    SolutionIndex: 93
    SolutionNameMin: Cijk_Alik_Bljk_HB_GB_MT32x16x8_SN_SU32_SUM3_TT2_2_WG16_8_1_WGM8
    SolutionIndex: 94
    SolutionNameMin: Cijk_Alik_Bljk_HB_GB_MT64x32x8_SN_SU32_SUM3_TT4_4_WG16_8_1_WGM8
    SolutionIndex: 95
    SolutionNameMin: Cijk_Alik_Bljk_HB_GB_MT32x32x8_SN_SU32_SUM3_TT2_2_WG16_16_1_WGM8
    SolutionIndex: 96
    SolutionNameMin: Cijk_Alik_Bljk_HB_GB_MT64x64x8_SN_SU32_SUM3_TT4_4_WG16_16_1_WGM8
    SolutionIndex: 97
    SolutionNameMin: Cijk_Alik_Bljk_HB_GB_MT16x16x16_SN_SU32_SUM3_TT2_2_WG8_8_1_WGM8
    SolutionIndex: 98
    SolutionNameMin: Cijk_Alik_Bljk_HB_GB_MT32x16x16_SN_SU32_SUM3_TT2_2_WG16_8_1_WGM8
    SolutionIndex: 99
    SolutionNameMin: Cijk_Alik_Bljk_HB_GB_MT64x32x16_SN_SU32_SUM3_TT4_4_WG16_8_1_WGM8
    SolutionIndex: 100
    SolutionNameMin: Cijk_Alik_Bljk_HB_GB_MT16x16x32_SN_SU32_SUM3_TT2_2_WG8_8_1_WGM8
    SolutionIndex: 101
    SolutionNameMin: Cijk_Alik_Bljk_HB_GB_MT64x16x8_SN_SU0_SUM0_TT4_2_WG16_8_1_WGM1
    SolutionIndex: 102
    SolutionNameMin: Cijk_Alik_Bljk_HB_GB_MT64x16x16_SN_SU32_SUM3_TT4_2_WG16_8_1_WGM1
    SolutionIndex: 103
    SolutionNameMin: Cijk_Alik_Bljk_HB_GB_MT64x16x16_SN_SU32_SUM3_TT4_2_WG16_8_1_WGM4
    SolutionIndex: 104
    SolutionNameMin: Cijk_Alik_Bljk_HB_GB_MT64x16x16_SN_SU32_SUM3_TT4_2_WG16_8_1_WGM8
- - - [2944, 4288, 1, 1280, 2944, 2944, 1280, 1280]
    - [5, 23606.0]
  - - [2368, 5888, 1, 256, 2368, 2368, 256, 256]
    - [5, 22741.0]
  - - [5888, 1856, 1, 256, 5888, 5888, 256, 256]
    - [13, 21945.0]
  - - [704, 6784, 1, 256, 704, 704, 256, 256]
    - [19, 18950.0]
  - - [512, 24000, 1, 1536, 512, 512, 1536, 1536]
    - [8, 23415.0]
  - - [5888, 1856, 1, 3328, 5888, 5888, 3328, 3328]
    - [32, 22123.0]
  - - [5056, 704, 1, 256, 5056, 5056, 256, 256]
    - [33, 16874.0]
  - - [5888, 2944, 1, 3328, 5888, 5888, 3328, 3328]
    - [14, 24358.0]
  - - [1856, 4288, 1, 256, 1856, 1856, 256, 256]
    - [19, 20236.0]
  - - [5056, 5056, 1, 3328, 5056, 5056, 3328, 3328]
    - [5, 24366.0]
  - - [1408, 5888, 1, 1280, 1408, 1408, 1280, 1280]
    - [34, 23653.0]
  - - [1024, 3584, 1, 3328, 1024, 1024, 3328, 3328]
    - [16, 22299.0]
  - - [512, 48000, 1, 2048, 512, 512, 2048, 2048]
    - [35, 24361.0]
  - - [448, 3584, 1, 3328, 448, 448, 3328, 3328]
    - [5, 18980.0]
  - - [5888, 1408, 1, 1280, 5888, 5888, 1280, 1280]
    - [32, 23094.0]
  - - [1024, 2368, 1, 256, 1024, 1024, 256, 256]
    - [18, 17695.0]
  - - [5056, 6784, 1, 1280, 5056, 5056, 1280, 1280]
    - [32, 24259.0]
  - - [5056, 5056, 1, 1280, 5056, 5056, 1280, 1280]
    - [34, 24224.0]
  - - [448, 5056, 1, 256, 448, 448, 256, 256]
    - [19, 17095.0]
  - - [6784, 448, 1, 256, 6784, 6784, 256, 256]
    - [27, 15642.0]
  - - [1760, 6400, 1, 1760, 1760, 1760, 1760, 1760]
    - [25, 24086.0]
  - - [5888, 704, 1, 1280, 5888, 5888, 1280, 1280]
    - [5, 20876.0]
  - - [6784, 4288, 1, 3328, 6784, 6784, 3328, 3328]
    - [5, 24265.0]
  - - [1856, 2368, 1, 3328, 1856, 1856, 3328, 3328]
    - [5, 19992.0]
  - - [5888, 2944, 1, 1280, 5888, 5888, 1280, 1280]
    - [32, 24249.0]
  - - [5888, 1024, 1, 256, 5888, 5888, 256, 256]
    - [13, 22139.0]
  - - [16384, 3200, 1, 4096, 16384, 16384, 4096, 4096]
    - [36, 20783.0]
  - - [1408, 2944, 1, 256, 1408, 1408, 256, 256]
    - [27, 16442.0]
  - - [6784, 5056, 1, 3328, 6784, 6784, 3328, 3328]
    - [5, 24692.0]
  - - [5056, 5056, 1, 256, 5056, 5056, 256, 256]
    - [13, 22858.0]
  - - [1024, 3584, 1, 1280, 1024, 1024, 1280, 1280]
    - [5, 22121.0]
  - - [2368, 2944, 1, 1280, 2368, 2368, 1280, 1280]
    - [13, 22439.0]
  - - [6784, 6784, 1, 1280, 6784, 6784, 1280, 1280]
    - [13, 24556.0]
  - - [1408, 4288, 1, 1280, 1408, 1408, 1280, 1280]
    - [16, 22033.0]
  - - [3584, 4288, 1, 1280, 3584, 3584, 1280, 1280]
    - [10, 23975.0]
  - - [2368, 704, 1, 1280, 2368, 2368, 1280, 1280]
    - [10, 18332.0]
  - - [5056, 4288, 1, 3328, 5056, 5056, 3328, 3328]
    - [5, 24268.0]
  - - [3584, 2368, 1, 3328, 3584, 3584, 3328, 3328]
    - [16, 22439.0]
  - - [6784, 448, 1, 1280, 6784, 6784, 1280, 1280]
    - [25, 19103.0]
  - - [4288, 2944, 1, 256, 4288, 4288, 256, 256]
    - [31, 22126.0]
  - - [6144, 24000, 1, 2560, 6144, 6144, 2560, 2560]
    - [11, 23953.0]
  - - [5056, 2368, 1, 1280, 5056, 5056, 1280, 1280]
    - [32, 22984.0]
  - - [448, 3584, 1, 1280, 448, 448, 1280, 1280]
    - [5, 18334.0]
  - - [6784, 5888, 1, 256, 6784, 6784, 256, 256]
    - [28, 24440.0]
  - - [1024, 1408, 1, 256, 1024, 1024, 256, 256]
    - [18, 16963.0]
  - - [2368, 2368, 1, 3328, 2368, 2368, 3328, 3328]
    - [5, 20969.0]
  - - [5056, 704, 1, 3328, 5056, 5056, 3328, 3328]
    - [5, 21510.0]
  - - [1408, 1856, 1, 256, 1408, 1408, 256, 256]
    - [27, 16144.0]
  - - [3584, 2368, 1, 1280, 3584, 3584, 1280, 1280]
    - [13, 22525.0]
  - - [704, 5888, 1, 256, 704, 704, 256, 256]
    - [31, 19322.0]
  - - [2560, 1600, 1, 2560, 2560, 2560, 2560, 2560]
    - [6, 19277.0]
  - - [6144, 5984, 1, 2048, 6144, 6144, 2048, 2048]
    - [10, 23849.0]
  - - [3584, 704, 1, 3328, 3584, 3584, 3328, 3328]
    - [34, 18518.0]
  - - [1408, 1408, 1, 256, 1408, 1408, 256, 256]
    - [4, 16838.0]
  - - [448, 4288, 1, 256, 448, 448, 256, 256]
    - [15, 15672.0]
  - - [704, 2368, 1, 1280, 704, 704, 1280, 1280]
    - [19, 18108.0]
  - - [1856, 2368, 1, 1280, 1856, 1856, 1280, 1280]
    - [13, 20000.0]
  - - [1408, 1024, 1, 1280, 1408, 1408, 1280, 1280]
    - [31, 18492.0]
  - - [6784, 704, 1, 256, 6784, 6784, 256, 256]
    - [13, 18649.0]
  - - [2048, 1600, 1, 512, 2048, 2048, 512, 512]
    - [31, 19013.0]
  - - [2048, 7000, 1, 2048, 2048, 2048, 2048, 2048]
    - [11, 21989.0]
  - - [1408, 3584, 1, 256, 1408, 1408, 256, 256]
    - [28, 20756.0]
  - - [3584, 4288, 1, 3328, 3584, 3584, 3328, 3328]
    - [16, 24253.0]
  - - [5888, 1856, 1, 1280, 5888, 5888, 1280, 1280]
    - [13, 22717.0]
  - - [5056, 1024, 1, 3328, 5056, 5056, 3328, 3328]
    - [5, 23881.0]
  - - [2368, 3584, 1, 1280, 2368, 2368, 1280, 1280]
    - [22, 22630.0]
  - - [2944, 3584, 1, 3328, 2944, 2944, 3328, 3328]
    - [34, 23676.0]
  - - [6784, 2944, 1, 256, 6784, 6784, 256, 256]
    - [13, 23890.0]
  - - [4288, 2368, 1, 3328, 4288, 4288, 3328, 3328]
    - [26, 22390.0]
  - - [1856, 2368, 1, 256, 1856, 1856, 256, 256]
    - [5, 17657.0]
  - - [3584, 6784, 1, 3328, 3584, 3584, 3328, 3328]
    - [26, 24478.0]
  - - [5056, 4288, 1, 1280, 5056, 5056, 1280, 1280]
    - [5, 24106.0]
  - - [6784, 1856, 1, 3328, 6784, 6784, 3328, 3328]
    - [14, 21714.0]
  - - [1408, 5056, 1, 1280, 1408, 1408, 1280, 1280]
    - [22, 23707.0]
  - - [6784, 5888, 1, 3328, 6784, 6784, 3328, 3328]
    - [16, 25037.0]
  - - [8448, 12000, 1, 2816, 8448, 8448, 2816, 2816]
    - [8, 25017.0]
  - - [4096, 800, 1, 1024, 4096, 4096, 1024, 1024]
    - [21, 16582.0]
  - - [8192, 3200, 1, 2048, 8192, 8192, 2048, 2048]
    - [12, 20977.0]
  - - [2368, 5056, 1, 1280, 2368, 2368, 1280, 1280]
    - [22, 23553.0]
  - - [1024, 5056, 1, 1280, 1024, 1024, 1280, 1280]
    - [5, 23052.0]
  - - [4288, 1024, 1, 256, 4288, 4288, 256, 256]
    - [10, 19583.0]
  - - [2368, 1408, 1, 256, 2368, 2368, 256, 256]
    - [4, 17216.0]
  - - [5888, 448, 1, 1280, 5888, 5888, 1280, 1280]
    - [13, 18285.0]
  - - [704, 5888, 1, 3328, 704, 704, 3328, 3328]
    - [5, 21643.0]
  - - [1024, 6784, 1, 1280, 1024, 1024, 1280, 1280]
    - [16, 23049.0]
  - - [3584, 2944, 1, 1280, 3584, 3584, 1280, 1280]
    - [22, 23167.0]
  - - [512, 24000, 1, 2048, 512, 512, 2048, 2048]
    - [8, 23575.0]
  - - [1408, 5056, 1, 3328, 1408, 1408, 3328, 3328]
    - [16, 23609.0]
  - - [1856, 1856, 1, 3328, 1856, 1856, 3328, 3328]
    - [16, 20896.0]
  - - [2560, 800, 1, 2560, 2560, 2560, 2560, 2560]
    - [10, 18012.0]
  - - [2368, 2368, 1, 256, 2368, 2368, 256, 256]
    - [25, 19115.0]
  - - [4288, 4288, 1, 1280, 4288, 4288, 1280, 1280]
    - [5, 23978.0]
  - - [5888, 1024, 1, 1280, 5888, 5888, 1280, 1280]
    - [13, 22636.0]
  - - [512, 48000, 1, 2560, 512, 512, 2560, 2560]
    - [23, 24327.0]
  - - [704, 6784, 1, 3328, 704, 704, 3328, 3328]
    - [3, 21487.0]
  - - [2560, 6400, 1, 2560, 2560, 2560, 2560, 2560]
    - [10, 24255.0]
  - - [5056, 1024, 1, 1280, 5056, 5056, 1280, 1280]
    - [10, 23392.0]
  - - [448, 5888, 1, 3328, 448, 448, 3328, 3328]
    - [5, 19175.0]
  - - [1024, 2944, 1, 1280, 1024, 1024, 1280, 1280]
    - [28, 20467.0]
  - - [5056, 5888, 1, 1280, 5056, 5056, 1280, 1280]
    - [34, 24608.0]
  - - [448, 6784, 1, 256, 448, 448, 256, 256]
    - [19, 17555.0]
  - - [3584, 5888, 1, 256, 3584, 3584, 256, 256]
    - [19, 23761.0]
  - - [2944, 3584, 1, 256, 2944, 2944, 256, 256]
    - [25, 22821.0]
  - - [6784, 1024, 1, 3328, 6784, 6784, 3328, 3328]
    - [5, 23769.0]
  - - [6784, 2944, 1, 3328, 6784, 6784, 3328, 3328]
    - [26, 23742.0]
  - - [2944, 5056, 1, 3328, 2944, 2944, 3328, 3328]
    - [5, 24521.0]
  - - [6784, 2368, 1, 1280, 6784, 6784, 1280, 1280]
    - [13, 23146.0]
  - - [4288, 5888, 1, 1280, 4288, 4288, 1280, 1280]
    - [22, 24051.0]
  - - [4288, 4288, 1, 256, 4288, 4288, 256, 256]
    - [19, 22921.0]
  - - [4288, 1856, 1, 1280, 4288, 4288, 1280, 1280]
    - [20, 22321.0]
  - - [1856, 2944, 1, 3328, 1856, 1856, 3328, 3328]
    - [16, 22662.0]
  - - [256, 6784, 1, 3328, 256, 256, 3328, 3328]
    - [5, 20412.0]
  - - [5056, 1024, 1, 256, 5056, 5056, 256, 256]
    - [28, 19806.0]
  - - [5056, 1856, 1, 3328, 5056, 5056, 3328, 3328]
    - [26, 22842.0]
  - - [1856, 1408, 1, 256, 1856, 1856, 256, 256]
    - [27, 15966.0]
  - - [4096, 7000, 1, 4096, 4096, 4096, 4096, 4096]
    - [35, 22078.0]
  - - [5056, 256, 1, 3328, 5056, 5056, 3328, 3328]
    - [4, 20007.0]
  - - [1024, 5888, 1, 1280, 1024, 1024, 1280, 1280]
    - [31, 22720.0]
  - - [6144, 24000, 1, 2048, 6144, 6144, 2048, 2048]
    - [8, 21511.0]
  - - [5056, 3584, 1, 256, 5056, 5056, 256, 256]
    - [10, 22764.0]
  - - [1856, 1024, 1, 1280, 1856, 1856, 1280, 1280]
    - [10, 21051.0]
  - - [1856, 1856, 1, 1280, 1856, 1856, 1280, 1280]
    - [16, 20317.0]
  - - [4096, 400, 1, 1024, 4096, 4096, 1024, 1024]
    - [19, 15313.0]
  - - [3072, 24000, 1, 1024, 3072, 3072, 1024, 1024]
    - [10, 24358.0]
  - - [1856, 1024, 1, 3328, 1856, 1856, 3328, 3328]
    - [10, 20840.0]
  - - [5888, 5888, 1, 3328, 5888, 5888, 3328, 3328]
    - [26, 25029.0]
  - - [6784, 1024, 1, 256, 6784, 6784, 256, 256]
    - [16, 21525.0]
  - - [5056, 5888, 1, 3328, 5056, 5056, 3328, 3328]
    - [26, 24679.0]
  - - [1856, 1024, 1, 256, 1856, 1856, 256, 256]
    - [15, 16882.0]
  - - [512, 48000, 1, 1536, 512, 512, 1536, 1536]
    - [20, 24508.0]
  - - [5056, 1408, 1, 3328, 5056, 5056, 3328, 3328]
    - [3, 23538.0]
  - - [8448, 5984, 1, 2816, 8448, 8448, 2816, 2816]
    - [20, 24933.0]
  - - [4288, 1024, 1, 3328, 4288, 4288, 3328, 3328]
    - [5, 22466.0]
  - - [1024, 24000, 1, 2560, 1024, 1024, 2560, 2560]
    - [11, 24141.0]
  - - [2944, 1408, 1, 3328, 2944, 2944, 3328, 3328]
    - [28, 21321.0]
  - - [2944, 4288, 1, 3328, 2944, 2944, 3328, 3328]
    - [34, 23971.0]
  - - [5056, 2944, 1, 256, 5056, 5056, 256, 256]
    - [19, 23125.0]
  - - [2368, 1856, 1, 256, 2368, 2368, 256, 256]
    - [25, 19213.0]
  - - [1408, 3584, 1, 3328, 1408, 1408, 3328, 3328]
    - [16, 23304.0]
  - - [2368, 6784, 1, 256, 2368, 2368, 256, 256]
    - [13, 22552.0]
  - - [5056, 1408, 1, 1280, 5056, 5056, 1280, 1280]
    - [13, 23015.0]
  - - [704, 3584, 1, 1280, 704, 704, 1280, 1280]
    - [5, 18300.0]
  - - [1408, 5888, 1, 3328, 1408, 1408, 3328, 3328]
    - [16, 23738.0]
  - - [1856, 5056, 1, 256, 1856, 1856, 256, 256]
    - [31, 20806.0]
  - - [6784, 6784, 1, 256, 6784, 6784, 256, 256]
    - [13, 24241.0]
  - - [2368, 4288, 1, 1280, 2368, 2368, 1280, 1280]
    - [10, 22409.0]
  - - [3584, 1856, 1, 1280, 3584, 3584, 1280, 1280]
    - [13, 22177.0]
  - - [5888, 5056, 1, 256, 5888, 5888, 256, 256]
    - [13, 23496.0]
  - - [8448, 48000, 1, 2816, 8448, 8448, 2816, 2816]
    - [26, 25193.0]
  - - [3584, 448, 1, 256, 3584, 3584, 256, 256]
    - [30, 10755.0]
  - - [3584, 3584, 1, 1280, 3584, 3584, 1280, 1280]
    - [5, 24228.0]
  - - [256, 6784, 1, 256, 256, 256, 256, 256]
    - [7, 17657.0]
  - - [1856, 3584, 1, 3328, 1856, 1856, 3328, 3328]
    - [5, 22535.0]
  - - [5056, 256, 1, 1280, 5056, 5056, 1280, 1280]
    - [22, 19523.0]
  - - [3584, 3584, 1, 256, 3584, 3584, 256, 256]
    - [19, 22610.0]
  - - [6784, 4288, 1, 1280, 6784, 6784, 1280, 1280]
    - [5, 24130.0]
  - - [704, 5056, 1, 256, 704, 704, 256, 256]
    - [15, 17867.0]
  - - [2944, 2368, 1, 1280, 2944, 2944, 1280, 1280]
    - [25, 22314.0]
  - - [6784, 3584, 1, 256, 6784, 6784, 256, 256]
    - [13, 23879.0]
  - - [2944, 2944, 1, 3328, 2944, 2944, 3328, 3328]
    - [5, 23341.0]
  - - [5056, 6784, 1, 256, 5056, 5056, 256, 256]
    - [19, 23678.0]
  - - [1408, 4288, 1, 3328, 1408, 1408, 3328, 3328]
    - [28, 22482.0]
  - - [6784, 256, 1, 1280, 6784, 6784, 1280, 1280]
    - [34, 19606.0]
  - - [2368, 704, 1, 3328, 2368, 2368, 3328, 3328]
    - [22, 19349.0]
  - - [3584, 6784, 1, 256, 3584, 3584, 256, 256]
    - [13, 23781.0]
  - - [5056, 1856, 1, 256, 5056, 5056, 256, 256]
    - [19, 21887.0]
  - - [4608, 5984, 1, 1536, 4608, 4608, 1536, 1536]
    - [10, 23879.0]
  - - [1760, 3200, 1, 1760, 1760, 1760, 1760, 1760]
    - [13, 22987.0]
  - - [4096, 1600, 1, 1024, 4096, 4096, 1024, 1024]
    - [10, 19639.0]
  - - [704, 4288, 1, 256, 704, 704, 256, 256]
    - [19, 16706.0]
  - - [1408, 6784, 1, 1280, 1408, 1408, 1280, 1280]
    - [22, 23725.0]
  - - [7680, 24000, 1, 2560, 7680, 7680, 2560, 2560]
    - [35, 25035.0]
  - - [4608, 48000, 1, 1536, 4608, 4608, 1536, 1536]
    - [23, 24332.0]
  - - [6144, 48000, 1, 2048, 6144, 6144, 2048, 2048]
    - [35, 22590.0]
  - - [1024, 24000, 1, 1536, 1024, 1024, 1536, 1536]
    - [8, 23843.0]
  - - [5056, 2368, 1, 3328, 5056, 5056, 3328, 3328]
    - [14, 23541.0]
  - - [2944, 4288, 1, 256, 2944, 2944, 256, 256]
    - [25, 22581.0]
  - - [1408, 3584, 1, 1280, 1408, 1408, 1280, 1280]
    - [28, 23243.0]
  - - [8192, 1600, 1, 2048, 8192, 8192, 2048, 2048]
    - [10, 21291.0]
  - - [512, 24000, 1, 2560, 512, 512, 2560, 2560]
    - [8, 23185.0]
  - - [2368, 6784, 1, 3328, 2368, 2368, 3328, 3328]
    - [5, 23530.0]
  - - [5056, 704, 1, 1280, 5056, 5056, 1280, 1280]
    - [16, 20242.0]
  - - [1856, 4288, 1, 3328, 1856, 1856, 3328, 3328]
    - [5, 23006.0]
  - - [1408, 5888, 1, 256, 1408, 1408, 256, 256]
    - [28, 22107.0]
  - - [3584, 704, 1, 1280, 3584, 3584, 1280, 1280]
    - [13, 18018.0]
  - - [3584, 448, 1, 3328, 3584, 3584, 3328, 3328]
    - [22, 18533.0]
  - - [704, 2368, 1, 3328, 704, 704, 3328, 3328]
    - [16, 19347.0]
  - - [448, 5056, 1, 3328, 448, 448, 3328, 3328]
    - [5, 20337.0]
  - - [4288, 448, 1, 256, 4288, 4288, 256, 256]
    - [30, 14602.0]
  - - [448, 5888, 1, 256, 448, 448, 256, 256]
    - [13, 15697.0]
  - - [2048, 3200, 1, 512, 2048, 2048, 512, 512]
    - [8, 21157.0]
  - - [5888, 2368, 1, 256, 5888, 5888, 256, 256]
    - [13, 21820.0]
  - - [6784, 704, 1, 3328, 6784, 6784, 3328, 3328]
    - [5, 21917.0]
  - - [1408, 2944, 1, 3328, 1408, 1408, 3328, 3328]
    - [22, 21788.0]
  - - [4608, 12000, 1, 1536, 4608, 4608, 1536, 1536]
    - [10, 24675.0]
  - - [2368, 704, 1, 256, 2368, 2368, 256, 256]
    - [4, 14546.0]
  - - [3584, 2368, 1, 256, 3584, 3584, 256, 256]
    - [31, 20919.0]
  - - [5888, 5056, 1, 1280, 5888, 5888, 1280, 1280]
    - [22, 24594.0]
  - - [8448, 24000, 1, 2816, 8448, 8448, 2816, 2816]
    - [5, 25062.0]
  - - [3584, 3584, 1, 3328, 3584, 3584, 3328, 3328]
    - [11, 24188.0]
  - - [5888, 6784, 1, 256, 5888, 5888, 256, 256]
    - [13, 24289.0]
  - - [4288, 2944, 1, 3328, 4288, 4288, 3328, 3328]
    - [32, 23765.0]
  - - [256, 5056, 1, 1280, 256, 256, 1280, 1280]
    - [10, 19211.0]
  - - [6784, 5888, 1, 1280, 6784, 6784, 1280, 1280]
    - [34, 25001.0]
  - - [2048, 800, 1, 512, 2048, 2048, 512, 512]
    - [9, 16058.0]
  - - [5888, 4288, 1, 1280, 5888, 5888, 1280, 1280]
    - [5, 24045.0]
  - - [1024, 24000, 1, 2048, 1024, 1024, 2048, 2048]
    - [35, 23043.0]
  - - [1408, 1856, 1, 1280, 1408, 1408, 1280, 1280]
    - [5, 18361.0]
  - - [5888, 448, 1, 3328, 5888, 5888, 3328, 3328]
    - [28, 19017.0]
  - - [704, 5888, 1, 1280, 704, 704, 1280, 1280]
    - [16, 21008.0]
  - - [1024, 6784, 1, 3328, 1024, 1024, 3328, 3328]
    - [16, 23081.0]
  - - [704, 2944, 1, 1280, 704, 704, 1280, 1280]
    - [13, 18741.0]
  - - [5056, 2944, 1, 3328, 5056, 5056, 3328, 3328]
    - [14, 23833.0]
  - - [1408, 1408, 1, 3328, 1408, 1408, 3328, 3328]
    - [19, 18238.0]
  - - [448, 4288, 1, 1280, 448, 448, 1280, 1280]
    - [31, 18033.0]
  - - [3584, 704, 1, 256, 3584, 3584, 256, 256]
    - [18, 16295.0]
  - - [3584, 1408, 1, 3328, 3584, 3584, 3328, 3328]
    - [14, 22719.0]
  - - [2368, 1024, 1, 1280, 2368, 2368, 1280, 1280]
    - [10, 20530.0]
  - - [2944, 6784, 1, 1280, 2944, 2944, 1280, 1280]
    - [25, 24218.0]
  - - [1856, 6784, 1, 256, 1856, 1856, 256, 256]
    - [13, 22394.0]
  - - [4288, 448, 1, 3328, 4288, 4288, 3328, 3328]
    - [2, 17741.0]
  - - [4288, 3584, 1, 1280, 4288, 4288, 1280, 1280]
    - [5, 24235.0]
  - - [6144, 12000, 1, 2048, 6144, 6144, 2048, 2048]
    - [35, 24224.0]
  - - [8192, 800, 1, 2048, 8192, 8192, 2048, 2048]
    - [10, 17834.0]
  - - [5888, 1024, 1, 3328, 5888, 5888, 3328, 3328]
    - [28, 22424.0]
  - - [704, 6784, 1, 1280, 704, 704, 1280, 1280]
    - [26, 20867.0]
  - - [704, 5056, 1, 1280, 704, 704, 1280, 1280]
    - [5, 21185.0]
  - - [2944, 1856, 1, 256, 2944, 2944, 256, 256]
    - [13, 19230.0]
  - - [3584, 5056, 1, 256, 3584, 3584, 256, 256]
    - [19, 22935.0]
  - - [5888, 5056, 1, 3328, 5888, 5888, 3328, 3328]
    - [5, 24701.0]
  - - [3584, 6784, 1, 1280, 3584, 3584, 1280, 1280]
    - [5, 24219.0]
  - - [1856, 5888, 1, 256, 1856, 1856, 256, 256]
    - [13, 22179.0]
  - - [4288, 4288, 1, 3328, 4288, 4288, 3328, 3328]
    - [16, 24089.0]
  - - [4288, 1408, 1, 1280, 4288, 4288, 1280, 1280]
    - [13, 22123.0]
  - - [4288, 2368, 1, 256, 4288, 4288, 256, 256]
    - [19, 21734.0]
  - - [2944, 5056, 1, 1280, 2944, 2944, 1280, 1280]
    - [10, 24322.0]
  - - [6784, 2368, 1, 3328, 6784, 6784, 3328, 3328]
    - [5, 22718.0]
  - - [4288, 1856, 1, 3328, 4288, 4288, 3328, 3328]
    - [3, 22425.0]
  - - [1856, 2944, 1, 1280, 1856, 1856, 1280, 1280]
    - [16, 22224.0]
  - - [2048, 1600, 1, 2048, 2048, 2048, 2048, 2048]
    - [11, 19203.0]
  - - [4288, 6784, 1, 3328, 4288, 4288, 3328, 3328]
    - [14, 24250.0]
  - - [3584, 1024, 1, 1280, 3584, 3584, 1280, 1280]
    - [5, 20515.0]
  - - [1024, 4288, 1, 256, 1024, 1024, 256, 256]
    - [18, 17476.0]
  - - [5888, 3584, 1, 3328, 5888, 5888, 3328, 3328]
    - [5, 24383.0]
  - - [5056, 3584, 1, 3328, 5056, 5056, 3328, 3328]
    - [5, 24639.0]
  - - [2368, 1408, 1, 1280, 2368, 2368, 1280, 1280]
    - [5, 19762.0]
  - - [5056, 2944, 1, 1280, 5056, 5056, 1280, 1280]
    - [31, 23976.0]
  - - [1024, 6784, 1, 256, 1024, 1024, 256, 256]
    - [7, 22263.0]
  - - [3584, 2944, 1, 256, 3584, 3584, 256, 256]
    - [19, 22949.0]
  - - [3584, 1408, 1, 1280, 3584, 3584, 1280, 1280]
    - [26, 22204.0]
  - - [5056, 6784, 1, 3328, 5056, 5056, 3328, 3328]
    - [14, 24729.0]
  - - [3584, 4288, 1, 256, 3584, 3584, 256, 256]
    - [19, 22083.0]
  - - [1856, 6784, 1, 3328, 1856, 1856, 3328, 3328]
    - [5, 22790.0]
  - - [5056, 1408, 1, 256, 5056, 5056, 256, 256]
    - [31, 19865.0]
  - - [3584, 1024, 1, 256, 3584, 3584, 256, 256]
    - [31, 19428.0]
  - - [5888, 5888, 1, 256, 5888, 5888, 256, 256]
    - [22, 24386.0]
  - - [4288, 1024, 1, 1280, 4288, 4288, 1280, 1280]
    - [5, 22637.0]
  - - [448, 6784, 1, 3328, 448, 448, 3328, 3328]
    - [5, 18503.0]
  - - [2944, 1408, 1, 1280, 2944, 2944, 1280, 1280]
    - [25, 21244.0]
  - - [2944, 1856, 1, 3328, 2944, 2944, 3328, 3328]
    - [14, 21912.0]
  - - [3584, 5888, 1, 1280, 3584, 3584, 1280, 1280]
    - [5, 24278.0]
  - - [6784, 1856, 1, 1280, 6784, 6784, 1280, 1280]
    - [13, 23008.0]
  - - [5888, 256, 1, 3328, 5888, 5888, 3328, 3328]
    - [2, 19908.0]
  - - [1856, 5888, 1, 3328, 1856, 1856, 3328, 3328]
    - [5, 23084.0]
  - - [3584, 1408, 1, 256, 3584, 3584, 256, 256]
    - [31, 20545.0]
  - - [704, 3584, 1, 3328, 704, 704, 3328, 3328]
    - [5, 18361.0]
  - - [4096, 3200, 1, 1024, 4096, 4096, 1024, 1024]
    - [10, 22777.0]
  - - [5056, 448, 1, 1280, 5056, 5056, 1280, 1280]
    - [5, 19272.0]
  - - [3584, 1856, 1, 3328, 3584, 3584, 3328, 3328]
    - [26, 22092.0]
  - - [2944, 1024, 1, 256, 2944, 2944, 256, 256]
    - [28, 18805.0]
  - - [2368, 4288, 1, 3328, 2368, 2368, 3328, 3328]
    - [5, 22479.0]
  - - [1024, 1408, 1, 1280, 1024, 1024, 1280, 1280]
    - [13, 18422.0]
  - - [6784, 5056, 1, 256, 6784, 6784, 256, 256]
    - [13, 23710.0]
  - - [3584, 5056, 1, 3328, 3584, 3584, 3328, 3328]
    - [29, 22291.0]
  - - [4288, 5888, 1, 256, 4288, 4288, 256, 256]
    - [16, 23282.0]
  - - [2944, 6784, 1, 256, 2944, 2944, 256, 256]
    - [13, 23845.0]
  - - [2368, 2368, 1, 1280, 2368, 2368, 1280, 1280]
    - [13, 21053.0]
  - - [1856, 3584, 1, 1280, 1856, 1856, 1280, 1280]
    - [13, 22578.0]
  - - [5056, 3584, 1, 1280, 5056, 5056, 1280, 1280]
    - [22, 24555.0]
  - - [256, 5888, 1, 256, 256, 256, 256, 256]
    - [15, 17212.0]
  - - [1856, 1408, 1, 3328, 1856, 1856, 3328, 3328]
    - [28, 18941.0]
  - - [1024, 4288, 1, 3328, 1024, 1024, 3328, 3328]
    - [5, 22191.0]
  - - [2944, 2368, 1, 3328, 2944, 2944, 3328, 3328]
    - [16, 21805.0]
  - - [704, 4288, 1, 3328, 704, 704, 3328, 3328]
    - [28, 18469.0]
  - - [1024, 1856, 1, 1280, 1024, 1024, 1280, 1280]
    - [31, 20002.0]
  - - [2048, 6400, 1, 2048, 2048, 2048, 2048, 2048]
    - [11, 23990.0]
  - - [512, 48000, 1, 2816, 512, 512, 2816, 2816]
    - [26, 24636.0]
  - - [5124, 9124, 1, 2560, 5124, 5124, 2560, 2560]
    - [10, 23979.0]
  - - [1024, 5888, 1, 256, 1024, 1024, 256, 256]
    - [7, 20635.0]
  - - [1408, 2368, 1, 256, 1408, 1408, 256, 256]
    - [15, 18137.0]
  - - [2944, 704, 1, 3328, 2944, 2944, 3328, 3328]
    - [22, 18681.0]
  - - [2944, 2944, 1, 1280, 2944, 2944, 1280, 1280]
    - [5, 23124.0]
  - - [6784, 256, 1, 3328, 6784, 6784, 3328, 3328]
    - [5, 20491.0]
  - - [1408, 5056, 1, 256, 1408, 1408, 256, 256]
    - [16, 20890.0]
  - - [4608, 24000, 1, 1536, 4608, 4608, 1536, 1536]
    - [23, 24837.0]
  - - [1408, 4288, 1, 256, 1408, 1408, 256, 256]
    - [16, 19039.0]
  - - [5888, 2368, 1, 1280, 5888, 5888, 1280, 1280]
    - [32, 23546.0]
  - - [2368, 5888, 1, 1280, 2368, 2368, 1280, 1280]
    - [5, 23943.0]
  - - [5888, 256, 1, 1280, 5888, 5888, 1280, 1280]
    - [7, 20023.0]
  - - [2368, 1856, 1, 3328, 2368, 2368, 3328, 3328]
    - [5, 20370.0]
  - - [2944, 704, 1, 256, 2944, 2944, 256, 256]
    - [13, 15735.0]
  - - [2368, 6784, 1, 1280, 2368, 2368, 1280, 1280]
    - [5, 23428.0]
  - - [2368, 1024, 1, 3328, 2368, 2368, 3328, 3328]
    - [16, 21592.0]
  - - [1856, 4288, 1, 1280, 1856, 1856, 1280, 1280]
    - [5, 22807.0]
  - - [704, 3584, 1, 256, 704, 704, 256, 256]
    - [19, 17401.0]
  - - [704, 2944, 1, 3328, 704, 704, 3328, 3328]
    - [5, 18937.0]
  - - [1856, 5056, 1, 3328, 1856, 1856, 3328, 3328]
    - [5, 23498.0]
  - - [3584, 5056, 1, 1280, 3584, 3584, 1280, 1280]
    - [5, 24287.0]
  - - [2944, 1024, 1, 3328, 2944, 2944, 3328, 3328]
    - [5, 22047.0]
  - - [1408, 6784, 1, 256, 1408, 1408, 256, 256]
    - [31, 22218.0]
  - - [6784, 1408, 1, 3328, 6784, 6784, 3328, 3328]
    - [26, 23306.0]
  - - [1024, 2368, 1, 1280, 1024, 1024, 1280, 1280]
    - [22, 20108.0]
  - - [6784, 2944, 1, 1280, 6784, 6784, 1280, 1280]
    - [13, 24228.0]
  - - [3584, 448, 1, 1280, 3584, 3584, 1280, 1280]
    - [13, 17488.0]
  - - [2944, 6784, 1, 3328, 2944, 2944, 3328, 3328]
    - [5, 23877.0]
  - - [448, 5056, 1, 1280, 448, 448, 1280, 1280]
    - [5, 19163.0]
  - - [4288, 704, 1, 256, 4288, 4288, 256, 256]
    - [13, 16373.0]
  - - [5888, 704, 1, 256, 5888, 5888, 256, 256]
    - [19, 17645.0]
  - - [256, 5888, 1, 3328, 256, 256, 3328, 3328]
    - [7, 19428.0]
  - - [6784, 4288, 1, 256, 6784, 6784, 256, 256]
    - [13, 23346.0]
  - - [5888, 256, 1, 256, 5888, 5888, 256, 256]
    - [21, 17320.0]
  - - [6784, 1024, 1, 1280, 6784, 6784, 1280, 1280]
    - [5, 23632.0]
  - - [2944, 704, 1, 1280, 2944, 2944, 1280, 1280]
    - [13, 19135.0]
  - - [6784, 3584, 1, 1280, 6784, 6784, 1280, 1280]
    - [10, 24460.0]
  - - [1408, 2944, 1, 1280, 1408, 1408, 1280, 1280]
    - [5, 21117.0]
  - - [2048, 800, 1, 2048, 2048, 2048, 2048, 2048]
    - [21, 16106.0]
  - - [1408, 2368, 1, 3328, 1408, 1408, 3328, 3328]
    - [16, 20201.0]
  - - [2368, 2944, 1, 256, 2368, 2368, 256, 256]
    - [25, 20327.0]
  - - [2944, 5888, 1, 256, 2944, 2944, 256, 256]
    - [5, 23655.0]
  - - [3584, 1856, 1, 256, 3584, 3584, 256, 256]
    - [13, 21133.0]
  - - [4288, 2944, 1, 1280, 4288, 4288, 1280, 1280]
    - [20, 23438.0]
  - - [5056, 448, 1, 3328, 5056, 5056, 3328, 3328]
    - [5, 20322.0]
  - - [4288, 5056, 1, 3328, 4288, 4288, 3328, 3328]
    - [5, 24303.0]
  - - [256, 5056, 1, 3328, 256, 256, 3328, 3328]
    - [5, 20182.0]
  - - [5056, 2368, 1, 256, 5056, 5056, 256, 256]
    - [19, 21734.0]
  - - [4288, 704, 1, 3328, 4288, 4288, 3328, 3328]
    - [5, 18513.0]
  - - [448, 3584, 1, 256, 448, 448, 256, 256]
    - [31, 14058.0]
  - - [1024, 1408, 1, 3328, 1024, 1024, 3328, 3328]
    - [25, 18875.0]
  - - [2944, 5888, 1, 1280, 2944, 2944, 1280, 1280]
    - [5, 24343.0]
  - - [5888, 3584, 1, 256, 5888, 5888, 256, 256]
    - [19, 23753.0]
  - - [1408, 1856, 1, 3328, 1408, 1408, 3328, 3328]
    - [5, 19149.0]
  - - [6784, 1408, 1, 1280, 6784, 6784, 1280, 1280]
    - [32, 23217.0]
  - - [704, 2944, 1, 256, 704, 704, 256, 256]
    - [13, 17592.0]
  - - [2944, 5888, 1, 3328, 2944, 2944, 3328, 3328]
    - [5, 24464.0]
  - - [1408, 6784, 1, 3328, 1408, 1408, 3328, 3328]
    - [22, 23855.0]
  - - [1408, 1408, 1, 1280, 1408, 1408, 1280, 1280]
    - [13, 18316.0]
  - - [16384, 400, 1, 4096, 16384, 16384, 4096, 4096]
    - [10, 17608.0]
  - - [448, 4288, 1, 3328, 448, 448, 3328, 3328]
    - [2, 19041.0]
  - - [704, 2368, 1, 256, 704, 704, 256, 256]
    - [22, 14737.0]
  - - [5888, 2368, 1, 3328, 5888, 5888, 3328, 3328]
    - [14, 23189.0]
  - - [5124, 9124, 1, 1760, 5124, 5124, 1760, 1760]
    - [16, 24223.0]
  - - [4288, 5056, 1, 256, 4288, 4288, 256, 256]
    - [19, 22745.0]
  - - [4288, 448, 1, 1280, 4288, 4288, 1280, 1280]
    - [13, 18040.0]
  - - [5888, 704, 1, 3328, 5888, 5888, 3328, 3328]
    - [22, 21491.0]
  - - [4288, 3584, 1, 3328, 4288, 4288, 3328, 3328]
    - [17, 24259.0]
  - - [1408, 1024, 1, 256, 1408, 1408, 256, 256]
    - [15, 14612.0]
  - - [8192, 400, 1, 2048, 8192, 8192, 2048, 2048]
    - [10, 16710.0]
  - - [2560, 7000, 1, 2560, 2560, 2560, 2560, 2560]
    - [23, 24192.0]
  - - [6784, 6784, 1, 3328, 6784, 6784, 3328, 3328]
    - [26, 24503.0]
  - - [704, 5056, 1, 3328, 704, 704, 3328, 3328]
    - [5, 20981.0]
  - - [2368, 2944, 1, 3328, 2368, 2368, 3328, 3328]
    - [5, 21700.0]
  - - [2368, 3584, 1, 256, 2368, 2368, 256, 256]
    - [13, 21687.0]
  - - [5124, 9124, 1, 4096, 5124, 5124, 4096, 4096]
    - [11, 22100.0]
  - - [7680, 48000, 1, 2560, 7680, 7680, 2560, 2560]
    - [11, 24751.0]
  - - [1024, 48000, 1, 2816, 1024, 1024, 2816, 2816]
    - [26, 25060.0]
  - - [1856, 1856, 1, 256, 1856, 1856, 256, 256]
    - [9, 16526.0]
  - - [4288, 1408, 1, 3328, 4288, 4288, 3328, 3328]
    - [14, 22119.0]
  - - [5124, 9124, 1, 2048, 5124, 5124, 2048, 2048]
    - [10, 23573.0]
  - - [4288, 5056, 1, 1280, 4288, 4288, 1280, 1280]
    - [5, 24123.0]
  - - [5888, 6784, 1, 1280, 5888, 5888, 1280, 1280]
    - [26, 24726.0]
  - - [1760, 1600, 1, 1760, 1760, 1760, 1760, 1760]
    - [0, 20210.0]
  - - [5888, 1408, 1, 3328, 5888, 5888, 3328, 3328]
    - [14, 23331.0]
  - - [256, 5056, 1, 256, 256, 256, 256, 256]
    - [1, 14357.0]
  - - [7680, 12000, 1, 2560, 7680, 7680, 2560, 2560]
    - [35, 23793.0]
  - - [2368, 5056, 1, 256, 2368, 2368, 256, 256]
    - [13, 21424.0]
  - - [1024, 5056, 1, 256, 1024, 1024, 256, 256]
    - [19, 20801.0]
  - - [2368, 1408, 1, 3328, 2368, 2368, 3328, 3328]
    - [28, 20346.0]
  - - [1024, 48000, 1, 1536, 1024, 1024, 1536, 1536]
    - [8, 24686.0]
  - - [5888, 448, 1, 256, 5888, 5888, 256, 256]
    - [30, 16567.0]
  - - [2560, 3200, 1, 2560, 2560, 2560, 2560, 2560]
    - [10, 22579.0]
  - - [6784, 5056, 1, 1280, 6784, 6784, 1280, 1280]
    - [5, 24582.0]
  - - [1024, 48000, 1, 2560, 1024, 1024, 2560, 2560]
    - [23, 24441.0]
  - - [4288, 6784, 1, 1280, 4288, 4288, 1280, 1280]
    - [5, 24111.0]
  - - [16384, 800, 1, 4096, 16384, 16384, 4096, 4096]
    - [24, 18721.0]
  - - [3072, 48000, 1, 1024, 3072, 3072, 1024, 1024]
    - [10, 24882.0]
  - - [6784, 1408, 1, 256, 6784, 6784, 256, 256]
    - [13, 22038.0]
  - - [5888, 4288, 1, 256, 5888, 5888, 256, 256]
    - [13, 23283.0]
  - - [5056, 5888, 1, 256, 5056, 5056, 256, 256]
    - [5, 23745.0]
  - - [2368, 1024, 1, 256, 2368, 2368, 256, 256]
    - [10, 18552.0]
  - - [1856, 6784, 1, 1280, 1856, 1856, 1280, 1280]
    - [25, 22802.0]
  - - [6784, 1856, 1, 256, 6784, 6784, 256, 256]
    - [13, 22359.0]
  - - [4288, 3584, 1, 256, 4288, 4288, 256, 256]
    - [10, 23140.0]
  - - [6784, 448, 1, 3328, 6784, 6784, 3328, 3328]
    - [16, 18336.0]
  - - [5056, 1856, 1, 1280, 5056, 5056, 1280, 1280]
    - [26, 22669.0]
  - - [1408, 1024, 1, 3328, 1408, 1408, 3328, 3328]
    - [25, 18845.0]
  - - [5888, 3584, 1, 1280, 5888, 5888, 1280, 1280]
    - [5, 24385.0]
  - - [1024, 2944, 1, 256, 1024, 1024, 256, 256]
    - [19, 19860.0]
  - - [448, 6784, 1, 1280, 448, 448, 1280, 1280]
    - [2, 19525.0]
  - - [3584, 1024, 1, 3328, 3584, 3584, 3328, 3328]
    - [5, 22453.0]
  - - [2944, 1856, 1, 1280, 2944, 2944, 1280, 1280]
    - [3, 21019.0]
  - - [5056, 256, 1, 256, 5056, 5056, 256, 256]
    - [9, 15284.0]
  - - [2368, 3584, 1, 3328, 2368, 2368, 3328, 3328]
    - [22, 22747.0]
  - - [3584, 5888, 1, 3328, 3584, 3584, 3328, 3328]
    - [5, 24351.0]
  - - [2944, 3584, 1, 1280, 2944, 2944, 1280, 1280]
    - [10, 23346.0]
  - - [1856, 5888, 1, 1280, 1856, 1856, 1280, 1280]
    - [5, 22946.0]
  - - [2048, 3200, 1, 2048, 2048, 2048, 2048, 2048]
    - [12, 20240.0]
  - - [4288, 1408, 1, 256, 4288, 4288, 256, 256]
    - [13, 20209.0]
  - - [4288, 2368, 1, 1280, 4288, 4288, 1280, 1280]
    - [25, 22639.0]
  - - [2944, 5056, 1, 256, 2944, 2944, 256, 256]
    - [10, 22927.0]
  - - [6784, 2368, 1, 256, 6784, 6784, 256, 256]
    - [13, 22754.0]
  - - [1024, 24000, 1, 2816, 1024, 1024, 2816, 2816]
    - [14, 24529.0]
  - - [7680, 5984, 1, 2560, 7680, 7680, 2560, 2560]
    - [23, 24255.0]
  - - [4288, 1856, 1, 256, 4288, 4288, 256, 256]
    - [7, 20634.0]
  - - [1856, 2944, 1, 256, 1856, 1856, 256, 256]
    - [16, 20343.0]
  - - [6144, 48000, 1, 2560, 6144, 6144, 2560, 2560]
    - [11, 24336.0]
  - - [1760, 800, 1, 1760, 1760, 1760, 1760, 1760]
    - [13, 16571.0]
  - - [1856, 1408, 1, 1280, 1856, 1856, 1280, 1280]
    - [16, 18277.0]
  - - [1024, 4288, 1, 1280, 1024, 1024, 1280, 1280]
    - [5, 21788.0]
  - - [2368, 5056, 1, 3328, 2368, 2368, 3328, 3328]
    - [5, 23826.0]
  - - [1024, 5056, 1, 3328, 1024, 1024, 3328, 3328]
    - [16, 23641.0]
  - - [1024, 1856, 1, 3328, 1024, 1024, 3328, 3328]
    - [26, 20671.0]
  - - [4288, 6784, 1, 256, 4288, 4288, 256, 256]
    - [13, 23395.0]
  - - [3584, 2944, 1, 3328, 3584, 3584, 3328, 3328]
    - [5, 23117.0]
  - - [5888, 2944, 1, 256, 5888, 5888, 256, 256]
    - [13, 23832.0]
  - - [5056, 4288, 1, 256, 5056, 5056, 256, 256]
    - [31, 23028.0]
  - - [1024, 3584, 1, 256, 1024, 1024, 256, 256]
    - [19, 20416.0]
  - - [5888, 5888, 1, 1280, 5888, 5888, 1280, 1280]
    - [5, 24923.0]
  - - [448, 5888, 1, 1280, 448, 448, 1280, 1280]
    - [5, 18249.0]
  - - [4288, 704, 1, 1280, 4288, 4288, 1280, 1280]
    - [13, 18552.0]
  - - [2944, 1408, 1, 256, 2944, 2944, 256, 256]
    - [13, 18983.0]
  - - [2368, 5888, 1, 3328, 2368, 2368, 3328, 3328]
    - [5, 24034.0]
  - - [2368, 1856, 1, 1280, 2368, 2368, 1280, 1280]
    - [13, 19720.0]
  - - [5888, 4288, 1, 3328, 5888, 5888, 3328, 3328]
    - [10, 24130.0]
  - - [6784, 704, 1, 1280, 6784, 6784, 1280, 1280]
    - [22, 21388.0]
  - - [5056, 448, 1, 256, 5056, 5056, 256, 256]
    - [18, 16759.0]
  - - [1856, 5056, 1, 1280, 1856, 1856, 1280, 1280]
    - [5, 23275.0]
  - - [2944, 1024, 1, 1280, 2944, 2944, 1280, 1280]
    - [5, 21686.0]
  - - [2368, 4288, 1, 256, 2368, 2368, 256, 256]
    - [13, 21493.0]
  - - [1024, 2368, 1, 3328, 1024, 1024, 3328, 3328]
    - [5, 21868.0]
  - - [4288, 5888, 1, 3328, 4288, 4288, 3328, 3328]
    - [5, 24155.0]
  - - [1024, 2944, 1, 3328, 1024, 1024, 3328, 3328]
    - [16, 20970.0]
  - - [256, 6784, 1, 1280, 256, 256, 1280, 1280]
    - [7, 19210.0]
  - - [1856, 3584, 1, 256, 1856, 1856, 256, 256]
    - [5, 20326.0]
  - - [512, 24000, 1, 2816, 512, 512, 2816, 2816]
    - [8, 24001.0]
  - - [256, 5888, 1, 1280, 256, 256, 1280, 1280]
    - [7, 19536.0]
  - - [16384, 1600, 1, 4096, 16384, 16384, 4096, 4096]
    - [23, 20601.0]
  - - [2944, 2368, 1, 256, 2944, 2944, 256, 256]
    - [25, 20481.0]
  - - [1024, 1856, 1, 256, 1024, 1024, 256, 256]
    - [15, 17168.0]
  - - [6784, 3584, 1, 3328, 6784, 6784, 3328, 3328]
    - [5, 24498.0]
  - - [1760, 7000, 1, 1760, 1760, 1760, 1760, 1760]
    - [25, 23637.0]
  - - [1024, 5888, 1, 3328, 1024, 1024, 3328, 3328]
    - [29, 22360.0]
  - - [1408, 2368, 1, 1280, 1408, 1408, 1280, 1280]
    - [16, 19651.0]
  - - [2944, 2944, 1, 256, 2944, 2944, 256, 256]
    - [25, 22631.0]
  - - [6784, 256, 1, 256, 6784, 6784, 256, 256]
    - [5, 17545.0]
  - - [5888, 1408, 1, 256, 5888, 5888, 256, 256]
    - [31, 22655.0]
  - - [5888, 6784, 1, 3328, 5888, 5888, 3328, 3328]
    - [14, 25122.0]
  - - [704, 4288, 1, 1280, 704, 704, 1280, 1280]
    - [5, 18022.0]
  - - [1024, 48000, 1, 2048, 1024, 1024, 2048, 2048]
    - [35, 23316.0]
  - - [1024, 1024, 1, 3328, 1024, 1024, 3328, 3328]
    - [47, 16529.0]
  - - [64, 6784, 1, 256, 64, 64, 256, 256]
    - [41, 8066.0]
  - - [128, 6784, 1, 3328, 128, 128, 3328, 3328]
    - [43, 17361.0]
  - - [2048, 400, 1, 512, 2048, 2048, 512, 512]
    - [50, 12373.0]
  - - [256, 4288, 1, 3328, 256, 256, 3328, 3328]
    - [58, 16894.0]
  - - [704, 1856, 1, 3328, 704, 704, 3328, 3328]
    - [47, 16382.0]
  - - [448, 1024, 1, 1280, 448, 448, 1280, 1280]
    - [37, 12404.0]
  - - [2368, 128, 1, 256, 2368, 2368, 256, 256]
    - [49, 6532.0]
  - - [64, 5056, 1, 256, 64, 64, 256, 256]
    - [56, 6606.0]
  - - [256, 1856, 1, 1280, 256, 256, 1280, 1280]
    - [42, 15166.0]
  - - [448, 704, 1, 1280, 448, 448, 1280, 1280]
    - [52, 11627.0]
  - - [4288, 256, 1, 256, 4288, 4288, 256, 256]
    - [49, 12557.0]
  - - [128, 3584, 1, 1280, 128, 128, 1280, 1280]
    - [57, 14109.0]
  - - [5888, 64, 1, 3328, 5888, 5888, 3328, 3328]
    - [46, 12378.0]
  - - [2944, 256, 1, 3328, 2944, 2944, 3328, 3328]
    - [47, 15260.0]
  - - [256, 4288, 1, 1280, 256, 256, 1280, 1280]
    - [57, 16852.0]
  - - [1408, 448, 1, 1280, 1408, 1408, 1280, 1280]
    - [50, 14643.0]
  - - [1408, 256, 1, 1280, 1408, 1408, 1280, 1280]
    - [46, 11253.0]
  - - [3072, 128, 1, 1024, 3072, 3072, 1024, 1024]
    - [50, 10900.0]
  - - [6784, 128, 1, 1280, 6784, 6784, 1280, 1280]
    - [51, 16790.0]
  - - [6784, 64, 1, 256, 6784, 6784, 256, 256]
    - [57, 8113.0]
  - - [2368, 128, 1, 3328, 2368, 2368, 3328, 3328]
    - [51, 14120.0]
  - - [2944, 128, 1, 256, 2944, 2944, 256, 256]
    - [46, 7178.0]
  - - [448, 1408, 1, 256, 448, 448, 256, 256]
    - [56, 9919.0]
  - - [64, 5056, 1, 3328, 64, 64, 3328, 3328]
    - [41, 12540.0]
  - - [2368, 256, 1, 1280, 2368, 2368, 1280, 1280]
    - [51, 15402.0]
  - - [256, 3584, 1, 3328, 256, 256, 3328, 3328]
    - [43, 18297.0]
  - - [5056, 64, 1, 1280, 5056, 5056, 1280, 1280]
    - [42, 11875.0]
  - - [1024, 704, 1, 256, 1024, 1024, 256, 256]
    - [50, 10755.0]
  - - [4288, 128, 1, 1280, 4288, 4288, 1280, 1280]
    - [58, 14141.0]
  - - [5888, 64, 1, 256, 5888, 5888, 256, 256]
    - [42, 7083.0]
  - - [1856, 256, 1, 1280, 1856, 1856, 1280, 1280]
    - [46, 13716.0]
  - - [64, 5888, 1, 3328, 64, 64, 3328, 3328]
    - [37, 11740.0]
  - - [256, 1408, 1, 3328, 256, 256, 3328, 3328]
    - [57, 12556.0]
  - - [6784, 128, 1, 3328, 6784, 6784, 3328, 3328]
    - [54, 17495.0]
  - - [704, 704, 1, 3328, 704, 704, 3328, 3328]
    - [54, 14461.0]
  - - [3584, 256, 1, 3328, 3584, 3584, 3328, 3328]
    - [43, 18278.0]
  - - [128, 3584, 1, 3328, 128, 128, 3328, 3328]
    - [50, 15475.0]
  - - [128, 2944, 1, 1280, 128, 128, 1280, 1280]
    - [57, 11759.0]
  - - [448, 1856, 1, 1280, 448, 448, 1280, 1280]
    - [51, 15438.0]
  - - [3584, 128, 1, 256, 3584, 3584, 256, 256]
    - [57, 8610.0]
  - - [448, 1408, 1, 3328, 448, 448, 3328, 3328]
    - [37, 13692.0]
  - - [256, 3584, 1, 256, 256, 256, 256, 256]
    - [47, 12642.0]
  - - [256, 2944, 1, 3328, 256, 256, 3328, 3328]
    - [57, 15719.0]
  - - [1408, 704, 1, 256, 1408, 1408, 256, 256]
    - [50, 12223.0]
  - - [448, 2944, 1, 3328, 448, 448, 3328, 3328]
    - [39, 16545.0]
  - - [64, 5888, 1, 256, 64, 64, 256, 256]
    - [49, 7021.0]
  - - [448, 2368, 1, 1280, 448, 448, 1280, 1280]
    - [47, 15476.0]
  - - [128, 4288, 1, 3328, 128, 128, 3328, 3328]
    - [54, 15628.0]
  - - [256, 2368, 1, 256, 256, 256, 256, 256]
    - [57, 10251.0]
  - - [1024, 448, 1, 3328, 1024, 1024, 3328, 3328]
    - [53, 14814.0]
  - - [1856, 704, 1, 1280, 1856, 1856, 1280, 1280]
    - [47, 15784.0]
  - - [1024, 1024, 1, 1280, 1024, 1024, 1280, 1280]
    - [38, 15757.0]
  - - [256, 2944, 1, 256, 256, 256, 256, 256]
    - [42, 11808.0]
  - - [1024, 700, 1, 512, 1024, 1024, 512, 512]
    - [50, 13355.0]
  - - [128, 6784, 1, 1280, 128, 128, 1280, 1280]
    - [58, 17259.0]
  - - [1408, 704, 1, 3328, 1408, 1408, 3328, 3328]
    - [39, 15543.0]
  - - [128, 5888, 1, 1280, 128, 128, 1280, 1280]
    - [57, 15504.0]
  - - [704, 1408, 1, 3328, 704, 704, 3328, 3328]
    - [47, 15606.0]
  - - [7680, 64, 1, 2560, 7680, 7680, 2560, 2560]
    - [44, 13315.0]
  - - [6784, 128, 1, 256, 6784, 6784, 256, 256]
    - [43, 12188.0]
  - - [704, 448, 1, 256, 704, 704, 256, 256]
    - [49, 6554.0]
  - - [256, 1856, 1, 3328, 256, 256, 3328, 3328]
    - [50, 15681.0]
  - - [128, 4288, 1, 256, 128, 128, 256, 256]
    - [50, 11152.0]
  - - [64, 6784, 1, 3328, 64, 64, 3328, 3328]
    - [45, 12497.0]
  - - [2944, 256, 1, 1280, 2944, 2944, 1280, 1280]
    - [53, 15861.0]
  - - [1856, 704, 1, 256, 1856, 1856, 256, 256]
    - [54, 12728.0]
  - - [1408, 448, 1, 3328, 1408, 1408, 3328, 3328]
    - [50, 16010.0]
  - - [704, 1856, 1, 256, 704, 704, 256, 256]
    - [42, 13159.0]
  - - [256, 2368, 1, 1280, 256, 256, 1280, 1280]
    - [51, 15451.0]
  - - [2944, 448, 1, 256, 2944, 2944, 256, 256]
    - [47, 12858.0]
  - - [2368, 128, 1, 1280, 2368, 2368, 1280, 1280]
    - [51, 11908.0]
  - - [64, 5056, 1, 1280, 64, 64, 1280, 1280]
    - [49, 11720.0]
  - - [704, 448, 1, 3328, 704, 704, 3328, 3328]
    - [45, 13398.0]
  - - [2368, 448, 1, 1280, 2368, 2368, 1280, 1280]
    - [54, 15735.0]
  - - [128, 3584, 1, 256, 128, 128, 256, 256]
    - [50, 11164.0]
  - - [1856, 448, 1, 3328, 1856, 1856, 3328, 3328]
    - [43, 16890.0]
  - - [128, 5056, 1, 256, 128, 128, 256, 256]
    - [42, 13066.0]
  - - [4288, 256, 1, 1280, 4288, 4288, 1280, 1280]
    - [58, 15953.0]
  - - [704, 704, 1, 256, 704, 704, 256, 256]
    - [48, 9426.0]
  - - [4288, 128, 1, 3328, 4288, 4288, 3328, 3328]
    - [51, 16029.0]
  - - [7680, 128, 1, 2560, 7680, 7680, 2560, 2560]
    - [51, 19054.0]
  - - [256, 1408, 1, 1280, 256, 256, 1280, 1280]
    - [57, 11297.0]
  - - [6784, 64, 1, 3328, 6784, 6784, 3328, 3328]
    - [57, 13639.0]
  - - [128, 2944, 1, 3328, 128, 128, 3328, 3328]
    - [53, 13243.0]
  - - [2944, 448, 1, 3328, 2944, 2944, 3328, 3328]
    - [39, 16576.0]
  - - [5888, 128, 1, 256, 5888, 5888, 256, 256]
    - [42, 11050.0]
  - - [5056, 64, 1, 256, 5056, 5056, 256, 256]
    - [49, 6648.0]
  - - [128, 5056, 1, 3328, 128, 128, 3328, 3328]
    - [43, 18625.0]
  - - [256, 4288, 1, 256, 256, 256, 256, 256]
    - [50, 13446.0]
  - - [3584, 256, 1, 256, 3584, 3584, 256, 256]
    - [51, 12751.0]
  - - [128, 2944, 1, 256, 128, 128, 256, 256]
    - [50, 7253.0]
  - - [3584, 128, 1, 3328, 3584, 3584, 3328, 3328]
    - [57, 15083.0]
  - - [1024, 448, 1, 1280, 1024, 1024, 1280, 1280]
    - [53, 13922.0]
  - - [5888, 128, 1, 3328, 5888, 5888, 3328, 3328]
    - [53, 15899.0]
  - - [1408, 704, 1, 1280, 1408, 1408, 1280, 1280]
    - [54, 14819.0]
  - - [448, 1408, 1, 1280, 448, 448, 1280, 1280]
    - [37, 13363.0]
  - - [704, 1408, 1, 1280, 704, 704, 1280, 1280]
    - [57, 15047.0]
  - - [448, 2944, 1, 256, 448, 448, 256, 256]
    - [51, 13138.0]
  - - [448, 2368, 1, 256, 448, 448, 256, 256]
    - [39, 11808.0]
  - - [64, 6784, 1, 1280, 64, 64, 1280, 1280]
    - [49, 11218.0]
  - - [128, 2368, 1, 3328, 128, 128, 3328, 3328]
    - [51, 13856.0]
  - - [5056, 64, 1, 3328, 5056, 5056, 3328, 3328]
    - [57, 14022.0]
  - - [5056, 128, 1, 3328, 5056, 5056, 3328, 3328]
    - [58, 18197.0]
  - - [448, 704, 1, 256, 448, 448, 256, 256]
    - [41, 6586.0]
  - - [1856, 256, 1, 3328, 1856, 1856, 3328, 3328]
    - [57, 15503.0]
  - - [2944, 128, 1, 3328, 2944, 2944, 3328, 3328]
    - [50, 12792.0]
  - - [448, 1024, 1, 3328, 448, 448, 3328, 3328]
    - [52, 13981.0]
  - - [704, 1024, 1, 1280, 704, 704, 1280, 1280]
    - [46, 14596.0]
  - - [2368, 256, 1, 256, 2368, 2368, 256, 256]
    - [43, 9885.0]
  - - [256, 2368, 1, 3328, 256, 256, 3328, 3328]
    - [58, 17223.0]
  - - [704, 448, 1, 1280, 704, 704, 1280, 1280]
    - [45, 11695.0]
  - - [1024, 704, 1, 1280, 1024, 1024, 1280, 1280]
    - [38, 14545.0]
  - - [256, 1856, 1, 256, 256, 256, 256, 256]
    - [50, 9105.0]
  - - [704, 1856, 1, 1280, 704, 704, 1280, 1280]
    - [51, 15793.0]
  - - [1408, 256, 1, 3328, 1408, 1408, 3328, 3328]
    - [42, 12221.0]
  - - [2368, 448, 1, 256, 2368, 2368, 256, 256]
    - [47, 11859.0]
  - - [4288, 256, 1, 3328, 4288, 4288, 3328, 3328]
    - [58, 16946.0]
  - - [2944, 256, 1, 256, 2944, 2944, 256, 256]
    - [42, 11192.0]
  - - [1408, 448, 1, 256, 1408, 1408, 256, 256]
    - [42, 10486.0]
  - - [6784, 64, 1, 1280, 6784, 6784, 1280, 1280]
    - [42, 12817.0]
  - - [2944, 448, 1, 1280, 2944, 2944, 1280, 1280]
    - [47, 15923.0]
  - - [128, 2368, 1, 256, 128, 128, 256, 256]
    - [57, 6445.0]
  - - [448, 1024, 1, 256, 448, 448, 256, 256]
    - [41, 8341.0]
  - - [1856, 448, 1, 256, 1856, 1856, 256, 256]
    - [42, 11029.0]
  - - [128, 5056, 1, 1280, 128, 128, 1280, 1280]
    - [58, 16462.0]
  - - [1408, 256, 1, 256, 1408, 1408, 256, 256]
    - [42, 6917.0]
  - - [256, 1408, 1, 256, 256, 256, 256, 256]
    - [50, 6991.0]
  - - [2368, 448, 1, 3328, 2368, 2368, 3328, 3328]
    - [47, 16327.0]
  - - [128, 5888, 1, 3328, 128, 128, 3328, 3328]
    - [38, 16176.0]
  - - [3584, 128, 1, 1280, 3584, 3584, 1280, 1280]
    - [50, 13902.0]
  - - [4288, 128, 1, 256, 4288, 4288, 256, 256]
    - [52, 8995.0]
  - - [2368, 256, 1, 3328, 2368, 2368, 3328, 3328]
    - [54, 17196.0]
  - - [5888, 128, 1, 1280, 5888, 5888, 1280, 1280]
    - [46, 15298.0]
  - - [256, 3584, 1, 1280, 256, 256, 1280, 1280]
    - [51, 17450.0]
  - - [128, 5888, 1, 256, 128, 128, 256, 256]
    - [42, 11349.0]
  - - [1024, 1024, 1, 256, 1024, 1024, 256, 256]
    - [42, 13210.0]
  - - [1024, 1024, 1, 1024, 1024, 1024, 1024, 1024]
    - [43, 15392.0]
  - - [64, 5888, 1, 1280, 64, 64, 1280, 1280]
    - [52, 10057.0]
  - - [704, 1024, 1, 256, 704, 704, 256, 256]
    - [42, 10742.0]
  - - [704, 704, 1, 1280, 704, 704, 1280, 1280]
    - [39, 13000.0]
  - - [128, 2368, 1, 1280, 128, 128, 1280, 1280]
    - [50, 12056.0]
  - - [3584, 256, 1, 1280, 3584, 3584, 1280, 1280]
    - [51, 17175.0]
  - - [5888, 64, 1, 1280, 5888, 5888, 1280, 1280]
    - [50, 11392.0]
  - - [5056, 128, 1, 1280, 5056, 5056, 1280, 1280]
    - [51, 16668.0]
  - - [448, 1856, 1, 3328, 448, 448, 3328, 3328]
    - [58, 16795.0]
  - - [1024, 448, 1, 256, 1024, 1024, 256, 256]
    - [49, 10212.0]
  - - [2944, 128, 1, 1280, 2944, 2944, 1280, 1280]
    - [50, 12330.0]
  - - [256, 2944, 1, 1280, 256, 256, 1280, 1280]
    - [50, 16110.0]
  - - [2560, 128, 1, 2560, 2560, 2560, 2560, 2560]
    - [51, 14208.0]
  - - [704, 1024, 1, 3328, 704, 704, 3328, 3328]
    - [57, 15006.0]
  - - [1856, 448, 1, 1280, 1856, 1856, 1280, 1280]
    - [58, 15331.0]
  - - [128, 6784, 1, 256, 128, 128, 256, 256]
    - [58, 12228.0]
  - - [704, 1408, 1, 256, 704, 704, 256, 256]
    - [42, 12084.0]
  - - [4096, 128, 1, 4096, 4096, 4096, 4096, 4096]
    - [43, 14986.0]
  - - [448, 2944, 1, 1280, 448, 448, 1280, 1280]
    - [39, 15981.0]
  - - [1856, 256, 1, 256, 1856, 1856, 256, 256]
    - [41, 8751.0]
  - - [5056, 128, 1, 256, 5056, 5056, 256, 256]
    - [40, 10526.0]
  - - [448, 2368, 1, 3328, 448, 448, 3328, 3328]
    - [39, 16351.0]
  - - [1024, 704, 1, 3328, 1024, 1024, 3328, 3328]
    - [53, 15161.0]
  - - [128, 4288, 1, 1280, 128, 128, 1280, 1280]
    - [51, 14068.0]
  - - [448, 704, 1, 3328, 448, 448, 3328, 3328]
    - [52, 13075.0]
  - - [448, 1856, 1, 256, 448, 448, 256, 256]
    - [55, 10972.0]
  - - [1856, 704, 1, 3328, 1856, 1856, 3328, 3328]
    - [47, 16335.0]
  - - [1408, 64, 1, 1280, 1408, 1408, 1280, 1280]
    - [83, 4708.0]
  - - [4096, 32, 1, 4096, 4096, 4096, 4096, 4096]
    - [70, 4673.0]
  - - [3072, 64, 1, 1024, 3072, 3072, 1024, 1024]
    - [94, 5326.0]
  - - [2944, 64, 1, 256, 2944, 2944, 256, 256]
    - [67, 4474.0]
  - - [448, 448, 1, 3328, 448, 448, 3328, 3328]
    - [75, 6650.0]
  - - [1024, 256, 1, 3328, 1024, 1024, 3328, 3328]
    - [75, 6934.0]
  - - [6144, 32, 1, 2560, 6144, 6144, 2560, 2560]
    - [70, 5348.0]
  - - [1856, 64, 1, 1280, 1856, 1856, 1280, 1280]
    - [85, 5497.0]
  - - [704, 128, 1, 1280, 704, 704, 1280, 1280]
    - [96, 4349.0]
  - - [1856, 128, 1, 256, 1856, 1856, 256, 256]
    - [63, 5837.0]
  - - [2944, 64, 1, 1280, 2944, 2944, 1280, 1280]
    - [75, 5949.0]
  - - [64, 3584, 1, 3328, 64, 64, 3328, 3328]
    - [61, 7584.0]
  - - [1024, 256, 1, 256, 1024, 1024, 256, 256]
    - [67, 5421.0]
  - - [448, 448, 1, 256, 448, 448, 256, 256]
    - [85, 4740.0]
  - - [7680, 32, 1, 2560, 7680, 7680, 2560, 2560]
    - [99, 5608.0]
  - - [128, 1024, 1, 3328, 128, 128, 3328, 3328]
    - [75, 6809.0]
  - - [64, 1856, 1, 1280, 64, 64, 1280, 1280]
    - [67, 5422.0]
  - - [448, 256, 1, 256, 448, 448, 256, 256]
    - [96, 3390.0]
  - - [256, 1024, 1, 256, 256, 256, 256, 256]
    - [89, 5412.0]
  - - [1024, 128, 1, 1280, 1024, 1024, 1280, 1280]
    - [85, 6754.0]
  - - [3072, 32, 1, 1024, 3072, 3072, 1024, 1024]
    - [70, 4208.0]
  - - [448, 256, 1, 3328, 448, 448, 3328, 3328]
    - [75, 6095.0]
  - - [128, 704, 1, 1280, 128, 128, 1280, 1280]
    - [94, 4640.0]
  - - [1856, 128, 1, 3328, 1856, 1856, 3328, 3328]
    - [90, 7917.0]
  - - [256, 448, 1, 256, 256, 256, 256, 256]
    - [63, 3774.0]
  - - [8448, 32, 1, 2816, 8448, 8448, 2816, 2816]
    - [77, 5347.0]
  - - [1408, 128, 1, 1280, 1408, 1408, 1280, 1280]
    - [96, 6007.0]
  - - [128, 1856, 1, 1280, 128, 128, 1280, 1280]
    - [75, 7278.0]
  - - [2048, 128, 1, 2048, 2048, 2048, 2048, 2048]
    - [96, 6279.0]
  - - [2560, 32, 1, 2560, 2560, 2560, 2560, 2560]
    - [87, 4662.0]
  - - [64, 1408, 1, 3328, 64, 64, 3328, 3328]
    - [89, 4875.0]
  - - [128, 1408, 1, 256, 128, 128, 256, 256]
    - [94, 4428.0]
  - - [256, 448, 1, 3328, 256, 256, 3328, 3328]
    - [59, 6321.0]
  - - [64, 2368, 1, 1280, 64, 64, 1280, 1280]
    - [96, 6585.0]
  - - [2368, 64, 1, 256, 2368, 2368, 256, 256]
    - [67, 4419.0]
  - - [704, 128, 1, 3328, 704, 704, 3328, 3328]
    - [74, 5010.0]
  - - [4288, 64, 1, 1280, 4288, 4288, 1280, 1280]
    - [90, 6880.0]
  - - [2560, 64, 1, 2560, 2560, 2560, 2560, 2560]
    - [88, 6651.0]
  - - [128, 1024, 1, 1280, 128, 128, 1280, 1280]
    - [75, 6022.0]
  - - [1856, 64, 1, 256, 1856, 1856, 256, 256]
    - [75, 4552.0]
  - - [704, 128, 1, 256, 704, 704, 256, 256]
    - [94, 2834.0]
  - - [448, 256, 1, 1280, 448, 448, 1280, 1280]
    - [85, 5474.0]
  - - [1024, 256, 1, 1280, 1024, 1024, 1280, 1280]
    - [75, 6913.0]
  - - [1856, 128, 1, 1280, 1856, 1856, 1280, 1280]
    - [96, 7439.0]
  - - [64, 3584, 1, 256, 64, 64, 256, 256]
    - [67, 5319.0]
  - - [64, 1856, 1, 256, 64, 64, 256, 256]
    - [94, 3503.0]
  - - [256, 1024, 1, 1280, 256, 256, 1280, 1280]
    - [61, 6904.0]
  - - [3584, 64, 1, 1280, 3584, 3584, 1280, 1280]
    - [85, 6961.0]
  - - [1408, 128, 1, 3328, 1408, 1408, 3328, 3328]
    - [61, 6405.0]
  - - [64, 4288, 1, 3328, 64, 64, 3328, 3328]
    - [61, 6977.0]
  - - [2368, 64, 1, 3328, 2368, 2368, 3328, 3328]
    - [90, 7454.0]
  - - [256, 704, 1, 256, 256, 256, 256, 256]
    - [83, 4403.0]
  - - [128, 1024, 1, 256, 128, 128, 256, 256]
    - [67, 3848.0]
  - - [64, 2944, 1, 256, 64, 64, 256, 256]
    - [67, 4345.0]
  - - [64, 1408, 1, 1280, 64, 64, 1280, 1280]
    - [89, 4203.0]
  - - [1408, 128, 1, 256, 1408, 1408, 256, 256]
    - [78, 4453.0]
  - - [64, 2944, 1, 1280, 64, 64, 1280, 1280]
    - [75, 5987.0]
  - - [256, 448, 1, 1280, 256, 256, 1280, 1280]
    - [75, 5397.0]
  - - [704, 256, 1, 1280, 704, 704, 1280, 1280]
    - [75, 6158.0]
  - - [64, 2368, 1, 3328, 64, 64, 3328, 3328]
    - [75, 7413.0]
  - - [256, 704, 1, 3328, 256, 256, 3328, 3328]
    - [61, 6594.0]
  - - [4096, 64, 1, 4096, 4096, 4096, 4096, 4096]
    - [96, 5851.0]
  - - [1760, 128, 1, 1760, 1760, 1760, 1760, 1760]
    - [73, 8983.0]
  - - [64, 2944, 1, 3328, 64, 64, 3328, 3328]
    - [90, 6585.0]
  - - [128, 1408, 1, 3328, 128, 128, 3328, 3328]
    - [75, 6535.0]
  - - [1408, 64, 1, 256, 1408, 1408, 256, 256]
    - [83, 2793.0]
  - - [64, 2368, 1, 256, 64, 64, 256, 256]
    - [96, 4389.0]
  - - [1024, 128, 1, 3328, 1024, 1024, 3328, 3328]
    - [61, 6801.0]
  - - [2368, 64, 1, 1280, 2368, 2368, 1280, 1280]
    - [96, 6643.0]
  - - [4288, 64, 1, 256, 4288, 4288, 256, 256]
    - [67, 5413.0]
  - - [64, 4288, 1, 1280, 64, 64, 1280, 1280]
    - [90, 6568.0]
  - - [1408, 64, 1, 3328, 1408, 1408, 3328, 3328]
    - [74, 4879.0]
  - - [448, 448, 1, 1280, 448, 448, 1280, 1280]
    - [85, 6638.0]
  - - [3584, 64, 1, 3328, 3584, 3584, 3328, 3328]
    - [90, 7701.0]
  - - [256, 1024, 1, 3328, 256, 256, 3328, 3328]
    - [75, 7013.0]
  - - [1856, 64, 1, 3328, 1856, 1856, 3328, 3328]
    - [75, 6056.0]
  - - [1024, 128, 1, 256, 1024, 1024, 256, 256]
    - [67, 3902.0]
  - - [4608, 32, 1, 1536, 4608, 4608, 1536, 1536]
    - [70, 4795.0]
  - - [128, 704, 1, 256, 128, 128, 256, 256]
    - [94, 2800.0]
  - - [64, 3584, 1, 1280, 64, 64, 1280, 1280]
    - [75, 6921.0]
  - - [3584, 64, 1, 256, 3584, 3584, 256, 256]
    - [96, 5234.0]
  - - [64, 1856, 1, 3328, 64, 64, 3328, 3328]
    - [89, 6257.0]
  - - [2944, 64, 1, 3328, 2944, 2944, 3328, 3328]
    - [61, 6450.0]
  - - [128, 704, 1, 3328, 128, 128, 3328, 3328]
    - [89, 5228.0]
  - - [128, 1856, 1, 256, 128, 128, 256, 256]
    - [67, 5509.0]
  - - [64, 4288, 1, 256, 64, 64, 256, 256]
    - [85, 5363.0]
  - - [704, 256, 1, 3328, 704, 704, 3328, 3328]
    - [90, 6782.0]
  - - [256, 704, 1, 1280, 256, 256, 1280, 1280]
    - [61, 6129.0]
  - - [4288, 64, 1, 3328, 4288, 4288, 3328, 3328]
    - [75, 7157.0]
  - - [2048, 64, 1, 2048, 2048, 2048, 2048, 2048]
    - [96, 5432.0]
  - - [64, 1408, 1, 256, 64, 64, 256, 256]
    - [83, 2740.0]
  - - [128, 1408, 1, 1280, 128, 128, 1280, 1280]
    - [75, 6048.0]
  - - [128, 1856, 1, 3328, 128, 128, 3328, 3328]
    - [61, 7914.0]
  - - [1760, 64, 1, 1760, 1760, 1760, 1760, 1760]
    - [59, 5746.0]
  - - [704, 256, 1, 256, 704, 704, 256, 256]
    - [96, 4272.0]
  - - [1024, 256, 1, 196, 1024, 1024, 196, 196]
    - [75, 4893.0]
  - - [256, 1024, 1, 196, 256, 256, 196, 196]
    - [67, 4775.0]
  - - [1760, 32, 1, 1760, 1760, 1760, 1760, 1760]
    - [101, 3650.0]
  - - [1760, 16, 1, 1760, 1760, 1760, 1760, 1760]
    - [69, 2415.0]
  - - [7680, 16, 1, 2560, 7680, 7680, 2560, 2560]
    - [102, 3679.0]
  - - [8448, 16, 1, 2816, 8448, 8448, 2816, 2816]
    - [102, 3571.0]
  - - [6144, 16, 1, 2560, 6144, 6144, 2560, 2560]
    - [102, 3512.0]
  - - [2048, 16, 1, 2048, 2048, 2048, 2048, 2048]
    - [102, 2290.0]
  - - [3072, 16, 1, 1024, 3072, 3072, 1024, 1024]
    - [98, 2532.0]
  - - [4096, 16, 1, 4096, 4096, 4096, 4096, 4096]
    - [103, 3134.0]
  - - [2560, 16, 1, 2560, 2560, 2560, 2560, 2560]
    - [102, 2969.0]
  - - [2048, 32, 1, 2048, 2048, 2048, 2048, 2048]
    - [82, 3326.0]
  - - [4608, 16, 1, 1536, 4608, 4608, 1536, 1536]
    - [104, 3144.0]
  - - [1024, 16, 1, 500000, 1024, 1024, 500000, 500000]
    - [100, 1501.0]
  - - [1024, 8, 1, 500000, 1024, 1024, 500000, 500000]
    - [79, 759.0]
  - - [512, 16, 1, 500000, 512, 512, 500000, 500000]
    - [64, 966.0]
  - - [512, 8, 1, 500000, 512, 512, 500000, 500000]
    - [64, 482.0]
  - - [128, 256, 1, 1280, 128, 128, 1280, 1280]
    - [92, 2921.0]
  - - [448, 64, 1, 1280, 448, 448, 1280, 1280]
    - [62, 2588.0]
  - - [64, 1024, 1, 1280, 64, 64, 1280, 1280]
    - [74, 3732.0]
  - - [64, 704, 1, 1280, 64, 64, 1280, 1280]
    - [92, 3077.0]
  - - [128, 448, 1, 256, 128, 128, 256, 256]
    - [66, 2056.0]
  - - [256, 256, 1, 3328, 256, 256, 3328, 3328]
    - [89, 4709.0]
  - - [64, 448, 1, 1280, 64, 64, 1280, 1280]
    - [86, 2214.0]
  - - [64, 64, 1, 3328, 64, 64, 3328, 3328]
    - [79, 485.0]
  - - [704, 64, 1, 3328, 704, 704, 3328, 3328]
    - [72, 3212.0]
  - - [64, 128, 1, 256, 64, 64, 256, 256]
    - [97, 351.0]
  - - [128, 448, 1, 1280, 128, 128, 1280, 1280]
    - [95, 3505.0]
  - - [704, 64, 1, 1280, 704, 704, 1280, 1280]
    - [93, 2922.0]
  - - [448, 64, 1, 3328, 448, 448, 3328, 3328]
    - [91, 2632.0]
  - - [128, 64, 1, 1280, 128, 128, 1280, 1280]
    - [76, 755.0]
  - - [64, 128, 1, 3328, 64, 64, 3328, 3328]
    - [62, 916.0]
  - - [128, 128, 1, 3328, 128, 128, 3328, 3328]
    - [76, 1724.0]
  - - [256, 128, 1, 256, 256, 256, 256, 256]
    - [92, 1327.0]
  - - [256, 256, 1, 256, 256, 256, 256, 256]
    - [81, 2225.0]
  - - [256, 64, 1, 256, 256, 256, 256, 256]
    - [72, 681.0]
  - - [64, 1024, 1, 256, 64, 64, 256, 256]
    - [83, 2179.0]
  - - [64, 704, 1, 256, 64, 64, 256, 256]
    - [80, 1677.0]
  - - [448, 128, 1, 256, 448, 448, 256, 256]
    - [84, 2050.0]
  - - [64, 704, 1, 3328, 64, 64, 3328, 3328]
    - [92, 3419.0]
  - - [64, 448, 1, 3328, 64, 64, 3328, 3328]
    - [91, 2624.0]
  - - [448, 128, 1, 3328, 448, 448, 3328, 3328]
    - [60, 3996.0]
  - - [64, 256, 1, 1280, 64, 64, 1280, 1280]
    - [91, 1427.0]
  - - [64, 64, 1, 256, 64, 64, 256, 256]
    - [97, 173.0]
  - - [64, 448, 1, 256, 64, 64, 256, 256]
    - [92, 1154.0]
  - - [256, 128, 1, 1280, 256, 256, 1280, 1280]
    - [80, 2416.0]
  - - [128, 256, 1, 3328, 128, 128, 3328, 3328]
    - [92, 2886.0]
  - - [64, 128, 1, 1280, 64, 64, 1280, 1280]
    - [68, 748.0]
  - - [128, 128, 1, 1280, 128, 128, 1280, 1280]
    - [97, 1436.0]
  - - [128, 256, 1, 256, 128, 128, 256, 256]
    - [92, 1327.0]
  - - [256, 64, 1, 1280, 256, 256, 1280, 1280]
    - [68, 1436.0]
  - - [704, 64, 1, 256, 704, 704, 256, 256]
    - [82, 1681.0]
  - - [64, 64, 1, 1280, 64, 64, 1280, 1280]
    - [100, 379.0]
  - - [128, 64, 1, 3328, 128, 128, 3328, 3328]
    - [86, 918.0]
  - - [448, 64, 1, 256, 448, 448, 256, 256]
    - [97, 1165.0]
  - - [1024, 64, 1, 256, 1024, 1024, 256, 256]
    - [94, 2156.0]
  - - [128, 64, 1, 256, 128, 128, 256, 256]
    - [76, 345.0]
  - - [1024, 64, 1, 1280, 1024, 1024, 1280, 1280]
    - [83, 3844.0]
  - - [64, 1024, 1, 3328, 64, 64, 3328, 3328]
    - [89, 4479.0]
  - - [448, 128, 1, 1280, 448, 448, 1280, 1280]
    - [84, 3489.0]
  - - [1024, 64, 1, 3328, 1024, 1024, 3328, 3328]
    - [59, 4455.0]
  - - [64, 256, 1, 3328, 64, 64, 3328, 3328]
    - [91, 1733.0]
  - - [256, 256, 1, 1280, 256, 256, 1280, 1280]
    - [71, 3873.0]
  - - [256, 128, 1, 3328, 256, 256, 3328, 3328]
    - [80, 2861.0]
  - - [64, 256, 1, 256, 64, 64, 256, 256]
    - [80, 690.0]
  - - [128, 448, 1, 3328, 128, 128, 3328, 3328]
    - [89, 4104.0]
  - - [256, 64, 1, 3328, 256, 256, 3328, 3328]
    - [91, 1728.0]
  - - [128, 128, 1, 256, 128, 128, 256, 256]
    - [65, 668.0]
  - - [512, 128, 1, 784, 512, 512, 784, 784]
    - [59, 3349.0]
  - - [256, 64, 1, 3136, 256, 256, 3136, 3136]
    - [62, 1718.0]
  - - [64, 256, 1, 3136, 64, 64, 3136, 3136]
    - [91, 1716.0]
  - - [128, 512, 1, 784, 128, 128, 784, 784]
    - [74, 3336.0]
  - - [64, 64, 1, 3136, 64, 64, 3136, 3136]
    - [64, 480.0]
- null
- null
- DeviceEfficiency
...
