library/src/blas3/Tensile/Logic/asm_full/navi22_Cijk_Ailk_Bjlk_HB_GB.yaml
---
- {MinimumRequiredVersion: 4.28.0}
- navi22
- gfx1031
    SolutionIndex: 0
    SolutionNameMin: Cijk_Ailk_Bjlk_HB_GB_MT128x128x8_SN_SU0_SUM0_TT8_16_WG16_8_1_WGM1
    SolutionIndex: 1
    SolutionNameMin: Cijk_Ailk_Bjlk_HB_GB_MT128x64x16_SN_SU0_SUM0_TT8_8_WG16_8_1_WGM1
    SolutionIndex: 2
    SolutionNameMin: Cijk_Ailk_Bjlk_HB_GB_MT128x128x16_SN_SU0_SUM0_TT8_16_WG16_8_1_WGM1
    SolutionIndex: 3
    SolutionNameMin: Cijk_Ailk_Bjlk_HB_GB_MT128x128x16_SN_SU0_SUM0_TT8_8_WG16_16_1_WGM1
    SolutionIndex: 4
    SolutionNameMin: Cijk_Ailk_Bjlk_HB_GB_MT128x256x16_SN_SU0_SUM0_TT8_16_WG16_16_1_WGM1
    SolutionIndex: 5
    SolutionNameMin: Cijk_Ailk_Bjlk_HB_GB_MT128x64x32_SN_SU0_SUM0_TT8_8_WG16_8_1_WGM1
    SolutionIndex: 6
    SolutionNameMin: Cijk_Ailk_Bjlk_HB_GB_MT128x128x32_SN_SU0_SUM0_TT8_8_WG16_16_1_WGM1
    SolutionIndex: 7
    SolutionNameMin: Cijk_Ailk_Bjlk_HB_GB_MT128x128x8_SN_SU32_SUM3_TT8_16_WG16_8_1_WGM1
    SolutionIndex: 8
    SolutionNameMin: Cijk_Ailk_Bjlk_HB_GB_MT128x64x16_SN_SU32_SUM3_TT8_8_WG16_8_1_WGM1
    SolutionIndex: 9
    SolutionNameMin: Cijk_Ailk_Bjlk_HB_GB_MT128x128x16_SN_SU32_SUM3_TT8_16_WG16_8_1_WGM1
    SolutionIndex: 10
    SolutionNameMin: Cijk_Ailk_Bjlk_HB_GB_MT128x128x16_SN_SU32_SUM3_TT8_8_WG16_16_1_WGM1
    SolutionIndex: 11
    SolutionNameMin: Cijk_Ailk_Bjlk_HB_GB_MT128x256x16_SN_SU32_SUM3_TT8_16_WG16_16_1_WGM1
    SolutionIndex: 12
    SolutionNameMin: Cijk_Ailk_Bjlk_HB_GB_MT128x128x8_SN_SU0_SUM0_TT8_16_WG16_8_1_WGM4
    SolutionIndex: 13
    SolutionNameMin: Cijk_Ailk_Bjlk_HB_GB_MT256x128x8_SN_SU0_SUM0_TT16_16_WG16_8_1_WGM4
    SolutionIndex: 14
    SolutionNameMin: Cijk_Ailk_Bjlk_HB_GB_MT128x64x16_SN_SU0_SUM0_TT8_8_WG16_8_1_WGM4
    SolutionIndex: 15
    SolutionNameMin: Cijk_Ailk_Bjlk_HB_GB_MT128x128x16_SN_SU0_SUM0_TT8_16_WG16_8_1_WGM4
    SolutionIndex: 16
    SolutionNameMin: Cijk_Ailk_Bjlk_HB_GB_MT128x128x16_SN_SU0_SUM0_TT8_8_WG16_16_1_WGM4
    SolutionIndex: 17
    SolutionNameMin: Cijk_Ailk_Bjlk_HB_GB_MT128x256x16_SN_SU0_SUM0_TT8_16_WG16_16_1_WGM4
    SolutionIndex: 18
    SolutionNameMin: Cijk_Ailk_Bjlk_HB_GB_MT128x128x8_SN_SU32_SUM3_TT8_16_WG16_8_1_WGM4
    SolutionIndex: 19
    SolutionNameMin: Cijk_Ailk_Bjlk_HB_GB_MT256x128x8_SN_SU32_SUM3_TT16_16_WG16_8_1_WGM4
    SolutionIndex: 20
    SolutionNameMin: Cijk_Ailk_Bjlk_HB_GB_MT128x64x16_SN_SU32_SUM3_TT8_8_WG16_8_1_WGM4
    SolutionIndex: 21
    SolutionNameMin: Cijk_Ailk_Bjlk_HB_GB_MT128x128x16_SN_SU32_SUM3_TT8_16_WG16_8_1_WGM4
    SolutionIndex: 22
    SolutionNameMin: Cijk_Ailk_Bjlk_HB_GB_MT128x128x16_SN_SU32_SUM3_TT8_8_WG16_16_1_WGM4
    SolutionIndex: 23
    SolutionNameMin: Cijk_Ailk_Bjlk_HB_GB_MT128x256x16_SN_SU32_SUM3_TT8_16_WG16_16_1_WGM4
    SolutionIndex: 24
    SolutionNameMin: Cijk_Ailk_Bjlk_HB_GB_MT128x128x8_SN_SU0_SUM0_TT8_16_WG16_8_1_WGM8
    SolutionIndex: 25
    SolutionNameMin: Cijk_Ailk_Bjlk_HB_GB_MT256x128x8_SN_SU0_SUM0_TT16_16_WG16_8_1_WGM8
    SolutionIndex: 26
    SolutionNameMin: Cijk_Ailk_Bjlk_HB_GB_MT128x64x16_SN_SU0_SUM0_TT8_8_WG16_8_1_WGM8
    SolutionIndex: 27
    SolutionNameMin: Cijk_Ailk_Bjlk_HB_GB_MT128x128x16_SN_SU0_SUM0_TT8_16_WG16_8_1_WGM8
    SolutionIndex: 28
    SolutionNameMin: Cijk_Ailk_Bjlk_HB_GB_MT128x128x16_SN_SU0_SUM0_TT8_8_WG16_16_1_WGM8
    SolutionIndex: 29
    SolutionNameMin: Cijk_Ailk_Bjlk_HB_GB_MT128x256x16_SN_SU0_SUM0_TT8_16_WG16_16_1_WGM8
    SolutionIndex: 30
    SolutionNameMin: Cijk_Ailk_Bjlk_HB_GB_MT128x64x32_SN_SU0_SUM0_TT8_8_WG16_8_1_WGM8
    SolutionIndex: 31
    SolutionNameMin: Cijk_Ailk_Bjlk_HB_GB_MT128x128x32_SN_SU0_SUM0_TT8_8_WG16_16_1_WGM8
    SolutionIndex: 32
    SolutionNameMin: Cijk_Ailk_Bjlk_HB_GB_MT128x128x8_SN_SU32_SUM3_TT8_16_WG16_8_1_WGM8
    SolutionIndex: 33
    SolutionNameMin: Cijk_Ailk_Bjlk_HB_GB_MT128x64x16_SN_SU32_SUM3_TT8_8_WG16_8_1_WGM8
    SolutionIndex: 34
    SolutionNameMin: Cijk_Ailk_Bjlk_HB_GB_MT64x64x8_SN_SU0_SUM0_TT8_8_WG8_8_1_WGM1
    SolutionIndex: 35
    SolutionNameMin: Cijk_Ailk_Bjlk_HB_GB_MT64x64x16_SN_SU0_SUM0_TT8_8_WG8_8_1_WGM1
    SolutionIndex: 36
    SolutionNameMin: Cijk_Ailk_Bjlk_HB_GB_MT128x64x16_SN_SU0_SUM0_TT8_8_WG16_8_1_WGM1
    SolutionIndex: 37
    SolutionNameMin: Cijk_Ailk_Bjlk_HB_GB_MT128x128x16_SN_SU0_SUM0_TT8_8_WG16_16_1_WGM1
    SolutionIndex: 38
    SolutionNameMin: Cijk_Ailk_Bjlk_HB_GB_MT64x64x32_SN_SU0_SUM0_TT8_8_WG8_8_1_WGM1
    SolutionIndex: 39
    SolutionNameMin: Cijk_Ailk_Bjlk_HB_GB_MT64x64x8_SN_SU32_SUM3_TT8_8_WG8_8_1_WGM1
    SolutionIndex: 40
    SolutionNameMin: Cijk_Ailk_Bjlk_HB_GB_MT64x64x16_SN_SU32_SUM3_TT8_8_WG8_8_1_WGM1
    SolutionIndex: 41
    SolutionNameMin: Cijk_Ailk_Bjlk_HB_GB_MT128x64x16_SN_SU32_SUM3_TT8_8_WG16_8_1_WGM1
    SolutionIndex: 42
    SolutionNameMin: Cijk_Ailk_Bjlk_HB_GB_MT128x128x16_SN_SU32_SUM3_TT8_8_WG16_16_1_WGM1
    SolutionIndex: 43
    SolutionNameMin: Cijk_Ailk_Bjlk_HB_GB_MT64x64x8_SN_SU0_SUM0_TT8_8_WG8_8_1_WGM4
    SolutionIndex: 44
    SolutionNameMin: Cijk_Ailk_Bjlk_HB_GB_MT64x64x16_SN_SU0_SUM0_TT8_8_WG8_8_1_WGM4
    SolutionIndex: 45
    SolutionNameMin: Cijk_Ailk_Bjlk_HB_GB_MT128x64x16_SN_SU0_SUM0_TT8_8_WG16_8_1_WGM4
    SolutionIndex: 46
    SolutionNameMin: Cijk_Ailk_Bjlk_HB_GB_MT128x128x16_SN_SU0_SUM0_TT8_8_WG16_16_1_WGM4
    SolutionIndex: 47
    SolutionNameMin: Cijk_Ailk_Bjlk_HB_GB_MT64x64x8_SN_SU32_SUM3_TT8_8_WG8_8_1_WGM4
    SolutionIndex: 48
    SolutionNameMin: Cijk_Ailk_Bjlk_HB_GB_MT64x64x16_SN_SU32_SUM3_TT8_8_WG8_8_1_WGM4
    SolutionIndex: 49
    SolutionNameMin: Cijk_Ailk_Bjlk_HB_GB_MT128x64x16_SN_SU32_SUM3_TT8_8_WG16_8_1_WGM4
    SolutionIndex: 50
    SolutionNameMin: Cijk_Ailk_Bjlk_HB_GB_MT128x128x16_SN_SU32_SUM3_TT8_8_WG16_16_1_WGM4
    SolutionIndex: 51
    SolutionNameMin: Cijk_Ailk_Bjlk_HB_GB_MT64x64x8_SN_SU0_SUM0_TT8_8_WG8_8_1_WGM8
    SolutionIndex: 52
    SolutionNameMin: Cijk_Ailk_Bjlk_HB_GB_MT64x64x16_SN_SU0_SUM0_TT8_8_WG8_8_1_WGM8
    SolutionIndex: 53
    SolutionNameMin: Cijk_Ailk_Bjlk_HB_GB_MT128x64x16_SN_SU0_SUM0_TT8_8_WG16_8_1_WGM8
    SolutionIndex: 54
    SolutionNameMin: Cijk_Ailk_Bjlk_HB_GB_MT128x128x16_SN_SU0_SUM0_TT8_8_WG16_16_1_WGM8
    SolutionIndex: 55
    SolutionNameMin: Cijk_Ailk_Bjlk_HB_GB_MT128x64x32_SN_SU0_SUM0_TT8_8_WG16_8_1_WGM8
    SolutionIndex: 56
    SolutionNameMin: Cijk_Ailk_Bjlk_HB_GB_MT64x64x8_SN_SU32_SUM3_TT8_8_WG8_8_1_WGM8
    SolutionIndex: 57
    SolutionNameMin: Cijk_Ailk_Bjlk_HB_GB_MT64x64x16_SN_SU32_SUM3_TT8_8_WG8_8_1_WGM8
    SolutionIndex: 58
    SolutionNameMin: Cijk_Ailk_Bjlk_HB_GB_MT128x64x16_SN_SU32_SUM3_TT8_8_WG16_8_1_WGM8
    SolutionIndex: 59
    SolutionNameMin: Cijk_Ailk_Bjlk_HB_GB_MT16x16x8_SN_SU0_SUM0_TT2_2_WG8_8_1_WGM1
    SolutionIndex: 60
    SolutionNameMin: Cijk_Ailk_Bjlk_HB_GB_MT64x32x8_SN_SU0_SUM0_TT4_4_WG16_8_1_WGM1
    SolutionIndex: 61
    SolutionNameMin: Cijk_Ailk_Bjlk_HB_GB_MT32x32x8_SN_SU0_SUM0_TT2_2_WG16_16_1_WGM1
    SolutionIndex: 62
    SolutionNameMin: Cijk_Ailk_Bjlk_HB_GB_MT64x64x8_SN_SU0_SUM0_TT4_4_WG16_16_1_WGM1
    SolutionIndex: 63
    SolutionNameMin: Cijk_Ailk_Bjlk_HB_GB_MT16x16x16_SN_SU0_SUM0_TT2_2_WG8_8_1_WGM1
    SolutionIndex: 64
    SolutionNameMin: Cijk_Ailk_Bjlk_HB_GB_MT32x32x16_SN_SU0_SUM0_TT4_4_WG8_8_1_WGM1
    SolutionIndex: 65
    SolutionNameMin: Cijk_Ailk_Bjlk_HB_GB_MT32x16x16_SN_SU0_SUM0_TT2_2_WG16_8_1_WGM1
    SolutionIndex: 66
    SolutionNameMin: Cijk_Ailk_Bjlk_HB_GB_MT64x32x16_SN_SU0_SUM0_TT4_4_WG16_8_1_WGM1
    SolutionIndex: 67
    SolutionNameMin: Cijk_Ailk_Bjlk_HB_GB_MT32x32x16_SN_SU0_SUM0_TT2_2_WG16_16_1_WGM1
    SolutionIndex: 68
    SolutionNameMin: Cijk_Ailk_Bjlk_HB_GB_MT64x64x16_SN_SU0_SUM0_TT4_4_WG16_16_1_WGM1
    SolutionIndex: 69
    SolutionNameMin: Cijk_Ailk_Bjlk_HB_GB_MT32x16x32_SN_SU0_SUM0_TT2_2_WG16_8_1_WGM1
    SolutionIndex: 70
    SolutionNameMin: Cijk_Ailk_Bjlk_HB_GB_MT64x32x32_SN_SU0_SUM0_TT4_4_WG16_8_1_WGM1
    SolutionIndex: 71
    SolutionNameMin: Cijk_Ailk_Bjlk_HB_GB_MT32x32x32_SN_SU0_SUM0_TT2_2_WG16_16_1_WGM1
    SolutionIndex: 72
    SolutionNameMin: Cijk_Ailk_Bjlk_HB_GB_MT64x64x32_SN_SU0_SUM0_TT4_4_WG16_16_1_WGM1
    SolutionIndex: 73
    SolutionNameMin: Cijk_Ailk_Bjlk_HB_GB_MT32x32x8_SN_SU32_SUM3_TT4_4_WG8_8_1_WGM1
    SolutionIndex: 74
    SolutionNameMin: Cijk_Ailk_Bjlk_HB_GB_MT64x32x8_SN_SU32_SUM3_TT4_4_WG16_8_1_WGM1
    SolutionIndex: 75
    SolutionNameMin: Cijk_Ailk_Bjlk_HB_GB_MT64x64x8_SN_SU32_SUM3_TT4_4_WG16_16_1_WGM1
    SolutionIndex: 76
    SolutionNameMin: Cijk_Ailk_Bjlk_HB_GB_MT16x16x16_SN_SU32_SUM3_TT2_2_WG8_8_1_WGM1
    SolutionIndex: 77
    SolutionNameMin: Cijk_Ailk_Bjlk_HB_GB_MT32x32x16_SN_SU32_SUM3_TT4_4_WG8_8_1_WGM1
    SolutionIndex: 78
    SolutionNameMin: Cijk_Ailk_Bjlk_HB_GB_MT64x32x16_SN_SU32_SUM3_TT4_4_WG16_8_1_WGM1
    SolutionIndex: 79
    SolutionNameMin: Cijk_Ailk_Bjlk_HB_GB_MT32x32x16_SN_SU32_SUM3_TT2_2_WG16_16_1_WGM1
    SolutionIndex: 80
    SolutionNameMin: Cijk_Ailk_Bjlk_HB_GB_MT32x16x32_SN_SU32_SUM3_TT2_2_WG16_8_1_WGM1
    SolutionIndex: 81
    SolutionNameMin: Cijk_Ailk_Bjlk_HB_GB_MT64x32x32_SN_SU32_SUM3_TT4_4_WG16_8_1_WGM1
    SolutionIndex: 82
    SolutionNameMin: Cijk_Ailk_Bjlk_HB_GB_MT32x32x32_SN_SU32_SUM3_TT2_2_WG16_16_1_WGM1
    SolutionIndex: 83
    SolutionNameMin: Cijk_Ailk_Bjlk_HB_GB_MT64x32x8_SN_SU0_SUM0_TT4_4_WG16_8_1_WGM4
    SolutionIndex: 84
    SolutionNameMin: Cijk_Ailk_Bjlk_HB_GB_MT32x32x16_SN_SU0_SUM0_TT4_4_WG8_8_1_WGM4
    SolutionIndex: 85
    SolutionNameMin: Cijk_Ailk_Bjlk_HB_GB_MT32x16x16_SN_SU0_SUM0_TT2_2_WG16_8_1_WGM4
    SolutionIndex: 86
    SolutionNameMin: Cijk_Ailk_Bjlk_HB_GB_MT64x32x16_SN_SU0_SUM0_TT4_4_WG16_8_1_WGM4
    SolutionIndex: 87
    SolutionNameMin: Cijk_Ailk_Bjlk_HB_GB_MT16x16x32_SN_SU0_SUM0_TT2_2_WG8_8_1_WGM4
    SolutionIndex: 88
    SolutionNameMin: Cijk_Ailk_Bjlk_HB_GB_MT64x32x32_SN_SU0_SUM0_TT4_4_WG16_8_1_WGM4
    SolutionIndex: 89
    SolutionNameMin: Cijk_Ailk_Bjlk_HB_GB_MT32x32x32_SN_SU0_SUM0_TT2_2_WG16_16_1_WGM4
    SolutionIndex: 90
    SolutionNameMin: Cijk_Ailk_Bjlk_HB_GB_MT16x16x8_SN_SU32_SUM3_TT2_2_WG8_8_1_WGM4
    SolutionIndex: 91
    SolutionNameMin: Cijk_Ailk_Bjlk_HB_GB_MT64x32x8_SN_SU32_SUM3_TT4_4_WG16_8_1_WGM4
    SolutionIndex: 92
    SolutionNameMin: Cijk_Ailk_Bjlk_HB_GB_MT16x16x16_SN_SU32_SUM3_TT2_2_WG8_8_1_WGM4
    SolutionIndex: 93
    SolutionNameMin: Cijk_Ailk_Bjlk_HB_GB_MT32x32x16_SN_SU32_SUM3_TT4_4_WG8_8_1_WGM4
    SolutionIndex: 94
    SolutionNameMin: Cijk_Ailk_Bjlk_HB_GB_MT32x16x16_SN_SU32_SUM3_TT2_2_WG16_8_1_WGM4
    SolutionIndex: 95
    SolutionNameMin: Cijk_Ailk_Bjlk_HB_GB_MT64x32x16_SN_SU32_SUM3_TT4_4_WG16_8_1_WGM4
    SolutionIndex: 96
    SolutionNameMin: Cijk_Ailk_Bjlk_HB_GB_MT64x32x32_SN_SU32_SUM3_TT4_4_WG16_8_1_WGM4
    SolutionIndex: 97
    SolutionNameMin: Cijk_Ailk_Bjlk_HB_GB_MT32x32x32_SN_SU32_SUM3_TT2_2_WG16_16_1_WGM4
    SolutionIndex: 98
    SolutionNameMin: Cijk_Ailk_Bjlk_HB_GB_MT64x32x8_SN_SU0_SUM0_TT4_4_WG16_8_1_WGM8
    SolutionIndex: 99
    SolutionNameMin: Cijk_Ailk_Bjlk_HB_GB_MT64x64x8_SN_SU0_SUM0_TT4_4_WG16_16_1_WGM8
    SolutionIndex: 100
    SolutionNameMin: Cijk_Ailk_Bjlk_HB_GB_MT32x32x16_SN_SU0_SUM0_TT4_4_WG8_8_1_WGM8
    SolutionIndex: 101
    SolutionNameMin: Cijk_Ailk_Bjlk_HB_GB_MT32x16x16_SN_SU0_SUM0_TT2_2_WG16_8_1_WGM8
    SolutionIndex: 102
    SolutionNameMin: Cijk_Ailk_Bjlk_HB_GB_MT64x32x16_SN_SU0_SUM0_TT4_4_WG16_8_1_WGM8
    SolutionIndex: 103
    SolutionNameMin: Cijk_Ailk_Bjlk_HB_GB_MT64x64x16_SN_SU0_SUM0_TT4_4_WG16_16_1_WGM8
    SolutionIndex: 104
    SolutionNameMin: Cijk_Ailk_Bjlk_HB_GB_MT32x16x32_SN_SU0_SUM0_TT2_2_WG16_8_1_WGM8
    SolutionIndex: 105
    SolutionNameMin: Cijk_Ailk_Bjlk_HB_GB_MT64x32x32_SN_SU0_SUM0_TT4_4_WG16_8_1_WGM8
    SolutionIndex: 106
    SolutionNameMin: Cijk_Ailk_Bjlk_HB_GB_MT32x32x32_SN_SU0_SUM0_TT2_2_WG16_16_1_WGM8
    SolutionIndex: 107
    SolutionNameMin: Cijk_Ailk_Bjlk_HB_GB_MT64x64x32_SN_SU0_SUM0_TT4_4_WG16_16_1_WGM8
    SolutionIndex: 108
    SolutionNameMin: Cijk_Ailk_Bjlk_HB_GB_MT64x32x8_SN_SU32_SUM3_TT4_4_WG16_8_1_WGM8
    SolutionIndex: 109
    SolutionNameMin: Cijk_Ailk_Bjlk_HB_GB_MT32x32x16_SN_SU32_SUM3_TT4_4_WG8_8_1_WGM8
    SolutionIndex: 110
    SolutionNameMin: Cijk_Ailk_Bjlk_HB_GB_MT32x16x16_SN_SU32_SUM3_TT2_2_WG16_8_1_WGM8
    SolutionIndex: 111
    SolutionNameMin: Cijk_Ailk_Bjlk_HB_GB_MT64x32x16_SN_SU32_SUM3_TT4_4_WG16_8_1_WGM8
    SolutionIndex: 112
    SolutionNameMin: Cijk_Ailk_Bjlk_HB_GB_MT32x32x32_SN_SU32_SUM3_TT4_4_WG8_8_1_WGM8
    SolutionIndex: 113
    SolutionNameMin: Cijk_Ailk_Bjlk_HB_GB_MT32x16x32_SN_SU32_SUM3_TT2_2_WG16_8_1_WGM8
    SolutionIndex: 114
    SolutionNameMin: Cijk_Ailk_Bjlk_HB_GB_MT64x32x32_SN_SU32_SUM3_TT4_4_WG16_8_1_WGM8
    SolutionIndex: 115
    SolutionNameMin: Cijk_Ailk_Bjlk_HB_GB_MT64x64x32_SN_SU32_SUM3_TT4_4_WG16_16_1_WGM8
- - - [2944, 4288, 1, 1280, 2944, 2944, 2944, 4288]
    - [0, 24307.0]
  - - [2368, 5888, 1, 256, 2368, 2368, 2368, 5888]
    - [12, 23701.0]
  - - [1024, 5056, 1, 3328, 1024, 1024, 1024, 5056]
    - [23, 24704.0]
  - - [5888, 1024, 1, 1280, 5888, 5888, 5888, 1024]
    - [15, 24164.0]
  - - [5888, 1856, 1, 3328, 5888, 5888, 5888, 1856]
    - [27, 24224.0]
  - - [5056, 704, 1, 256, 5056, 5056, 5056, 704]
    - [8, 21280.0]
  - - [5888, 2944, 1, 3328, 5888, 5888, 5888, 2944]
    - [27, 25528.0]
  - - [1856, 4288, 1, 256, 1856, 1856, 1856, 4288]
    - [8, 22117.0]
  - - [5056, 5056, 1, 3328, 5056, 5056, 5056, 5056]
    - [17, 25021.0]
  - - [1408, 5888, 1, 1280, 1408, 1408, 1408, 5888]
    - [17, 24438.0]
  - - [448, 3584, 1, 3328, 448, 448, 448, 3584]
    - [4, 19732.0]
  - - [5888, 1408, 1, 1280, 5888, 5888, 5888, 1408]
    - [27, 24528.0]
  - - [3584, 1856, 1, 3328, 3584, 3584, 3584, 1856]
    - [15, 24354.0]
  - - [5056, 6784, 1, 1280, 5056, 5056, 5056, 6784]
    - [15, 25259.0]
  - - [5056, 5056, 1, 1280, 5056, 5056, 5056, 5056]
    - [19, 24844.0]
  - - [448, 5056, 1, 256, 448, 448, 448, 5056]
    - [18, 18076.0]
  - - [6784, 448, 1, 256, 6784, 6784, 6784, 448]
    - [26, 21697.0]
  - - [5888, 704, 1, 1280, 5888, 5888, 5888, 704]
    - [26, 22981.0]
  - - [3584, 1024, 1, 256, 3584, 3584, 3584, 1024]
    - [1, 21993.0]
  - - [6784, 4288, 1, 3328, 6784, 6784, 6784, 4288]
    - [15, 25042.0]
  - - [1856, 2368, 1, 3328, 1856, 1856, 1856, 2368]
    - [26, 22757.0]
  - - [5888, 2944, 1, 1280, 5888, 5888, 5888, 2944]
    - [2, 25429.0]
  - - [5888, 1024, 1, 256, 5888, 5888, 5888, 1024]
    - [12, 23155.0]
  - - [1408, 2944, 1, 256, 1408, 1408, 1408, 2944]
    - [12, 22772.0]
  - - [6784, 5056, 1, 3328, 6784, 6784, 6784, 5056]
    - [29, 25361.0]
  - - [5056, 5056, 1, 256, 5056, 5056, 5056, 5056]
    - [12, 24026.0]
  - - [1024, 3584, 1, 1280, 1024, 1024, 1024, 3584]
    - [17, 23050.0]
  - - [2368, 2944, 1, 1280, 2368, 2368, 2368, 2944]
    - [12, 24116.0]
  - - [1408, 4288, 1, 1280, 1408, 1408, 1408, 4288]
    - [12, 24054.0]
  - - [3584, 4288, 1, 1280, 3584, 3584, 3584, 4288]
    - [27, 24773.0]
  - - [2368, 704, 1, 1280, 2368, 2368, 2368, 704]
    - [1, 20957.0]
  - - [5056, 4288, 1, 3328, 5056, 5056, 5056, 4288]
    - [13, 24914.0]
  - - [3584, 2368, 1, 3328, 3584, 3584, 3584, 2368]
    - [15, 24315.0]
  - - [6784, 448, 1, 1280, 6784, 6784, 6784, 448]
    - [14, 22734.0]
  - - [4288, 2944, 1, 256, 4288, 4288, 4288, 2944]
    - [10, 23334.0]
  - - [5056, 2368, 1, 1280, 5056, 5056, 5056, 2368]
    - [27, 24312.0]
  - - [448, 3584, 1, 1280, 448, 448, 448, 3584]
    - [10, 19276.0]
  - - [6784, 5888, 1, 256, 6784, 6784, 6784, 5888]
    - [27, 25180.0]
  - - [1024, 1408, 1, 256, 1024, 1024, 1024, 1408]
    - [1, 20460.0]
  - - [2368, 2368, 1, 3328, 2368, 2368, 2368, 2368]
    - [14, 22909.0]
  - - [5056, 704, 1, 3328, 5056, 5056, 5056, 704]
    - [1, 23428.0]
  - - [1408, 1856, 1, 256, 1408, 1408, 1408, 1856]
    - [26, 20150.0]
  - - [5888, 1856, 1, 256, 5888, 5888, 5888, 1856]
    - [24, 22916.0]
  - - [704, 5888, 1, 256, 704, 704, 704, 5888]
    - [3, 19688.0]
  - - [4288, 6784, 1, 3328, 4288, 4288, 4288, 6784]
    - [27, 25040.0]
  - - [3584, 704, 1, 3328, 3584, 3584, 3584, 704]
    - [1, 22666.0]
  - - [1408, 1408, 1, 256, 1408, 1408, 1408, 1408]
    - [14, 18362.0]
  - - [448, 4288, 1, 256, 448, 448, 448, 4288]
    - [22, 16145.0]
  - - [704, 2368, 1, 1280, 704, 704, 704, 2368]
    - [16, 19537.0]
  - - [1856, 2368, 1, 1280, 1856, 1856, 1856, 2368]
    - [26, 22721.0]
  - - [1408, 1024, 1, 1280, 1408, 1408, 1408, 1024]
    - [1, 22224.0]
  - - [6784, 704, 1, 256, 6784, 6784, 6784, 704]
    - [33, 22246.0]
  - - [1408, 3584, 1, 256, 1408, 1408, 1408, 3584]
    - [7, 22873.0]
  - - [3584, 4288, 1, 3328, 3584, 3584, 3584, 4288]
    - [2, 24932.0]
  - - [5888, 1856, 1, 1280, 5888, 5888, 5888, 1856]
    - [1, 24000.0]
  - - [5056, 1024, 1, 3328, 5056, 5056, 5056, 1024]
    - [4, 24804.0]
  - - [2368, 3584, 1, 1280, 2368, 2368, 2368, 3584]
    - [18, 24091.0]
  - - [2944, 3584, 1, 3328, 2944, 2944, 2944, 3584]
    - [2, 24860.0]
  - - [6784, 2944, 1, 256, 6784, 6784, 6784, 2944]
    - [0, 24788.0]
  - - [1024, 2368, 1, 256, 1024, 1024, 1024, 2368]
    - [26, 21525.0]
  - - [4288, 2368, 1, 3328, 4288, 4288, 4288, 2368]
    - [9, 23887.0]
  - - [1856, 2368, 1, 256, 1856, 1856, 1856, 2368]
    - [14, 21687.0]
  - - [3584, 6784, 1, 3328, 3584, 3584, 3584, 6784]
    - [2, 25386.0]
  - - [6784, 1856, 1, 3328, 6784, 6784, 6784, 1856]
    - [15, 24466.0]
  - - [5056, 4288, 1, 1280, 5056, 5056, 5056, 4288]
    - [15, 24777.0]
  - - [1408, 5056, 1, 1280, 1408, 1408, 1408, 5056]
    - [24, 24557.0]
  - - [6784, 5888, 1, 3328, 6784, 6784, 6784, 5888]
    - [17, 25710.0]
  - - [2368, 5056, 1, 1280, 2368, 2368, 2368, 5056]
    - [24, 24238.0]
  - - [1024, 5056, 1, 1280, 1024, 1024, 1024, 5056]
    - [15, 24285.0]
  - - [4288, 1024, 1, 256, 4288, 4288, 4288, 1024]
    - [0, 21835.0]
  - - [2368, 1408, 1, 256, 2368, 2368, 2368, 1408]
    - [3, 21212.0]
  - - [5888, 448, 1, 1280, 5888, 5888, 5888, 448]
    - [14, 22269.0]
  - - [704, 5888, 1, 3328, 704, 704, 704, 5888]
    - [11, 22605.0]
  - - [1024, 6784, 1, 1280, 1024, 1024, 1024, 6784]
    - [15, 24209.0]
  - - [6784, 2368, 1, 1280, 6784, 6784, 6784, 2368]
    - [15, 24488.0]
  - - [3584, 2944, 1, 1280, 3584, 3584, 3584, 2944]
    - [9, 24734.0]
  - - [2368, 1024, 1, 3328, 2368, 2368, 2368, 1024]
    - [4, 22682.0]
  - - [1408, 5056, 1, 3328, 1408, 1408, 1408, 5056]
    - [23, 24960.0]
  - - [1856, 1856, 1, 3328, 1856, 1856, 1856, 1856]
    - [14, 22471.0]
  - - [2368, 2368, 1, 256, 2368, 2368, 2368, 2368]
    - [1, 21073.0]
  - - [4288, 4288, 1, 1280, 4288, 4288, 4288, 4288]
    - [21, 24635.0]
  - - [704, 6784, 1, 3328, 704, 704, 704, 6784]
    - [2, 22673.0]
  - - [5888, 5888, 1, 3328, 5888, 5888, 5888, 5888]
    - [13, 25730.0]
  - - [5056, 1024, 1, 1280, 5056, 5056, 5056, 1024]
    - [7, 24186.0]
  - - [448, 5888, 1, 3328, 448, 448, 448, 5888]
    - [1, 20065.0]
  - - [5056, 5888, 1, 1280, 5056, 5056, 5056, 5888]
    - [29, 25232.0]
  - - [448, 6784, 1, 256, 448, 448, 448, 6784]
    - [16, 18596.0]
  - - [3584, 5888, 1, 256, 3584, 3584, 3584, 5888]
    - [24, 24709.0]
  - - [2944, 3584, 1, 256, 2944, 2944, 2944, 3584]
    - [32, 23938.0]
  - - [6784, 2944, 1, 3328, 6784, 6784, 6784, 2944]
    - [15, 25594.0]
  - - [2944, 5056, 1, 3328, 2944, 2944, 2944, 5056]
    - [4, 25215.0]
  - - [2048, 7133, 1, 2048, 2048, 2048, 2048, 7133]
    - [15, 25187.0]
  - - [4288, 5888, 1, 1280, 4288, 4288, 4288, 5888]
    - [12, 24877.0]
  - - [4288, 4288, 1, 256, 4288, 4288, 4288, 4288]
    - [24, 23826.0]
  - - [4288, 1856, 1, 1280, 4288, 4288, 4288, 1856]
    - [1, 23384.0]
  - - [1856, 2944, 1, 3328, 1856, 1856, 1856, 2944]
    - [17, 23360.0]
  - - [256, 6784, 1, 3328, 256, 256, 256, 6784]
    - [1, 22172.0]
  - - [5056, 1024, 1, 256, 5056, 5056, 5056, 1024]
    - [26, 21433.0]
  - - [5056, 1856, 1, 3328, 5056, 5056, 5056, 1856]
    - [27, 24224.0]
  - - [1856, 1408, 1, 256, 1856, 1856, 1856, 1408]
    - [8, 20458.0]
  - - [5056, 256, 1, 3328, 5056, 5056, 5056, 256]
    - [3, 23400.0]
  - - [5056, 3584, 1, 256, 5056, 5056, 5056, 3584]
    - [32, 24351.0]
  - - [1856, 1024, 1, 1280, 1856, 1856, 1856, 1024]
    - [3, 22963.0]
  - - [1856, 1856, 1, 1280, 1856, 1856, 1856, 1856]
    - [1, 22038.0]
  - - [6784, 6784, 1, 1280, 6784, 6784, 6784, 6784]
    - [15, 25553.0]
  - - [1856, 1024, 1, 3328, 1856, 1856, 1856, 1024]
    - [3, 23174.0]
  - - [6784, 1024, 1, 256, 6784, 6784, 6784, 1024]
    - [24, 22466.0]
  - - [5056, 5888, 1, 3328, 5056, 5056, 5056, 5888]
    - [25, 25373.0]
  - - [1856, 1024, 1, 256, 1856, 1856, 1856, 1024]
    - [3, 19462.0]
  - - [5056, 1408, 1, 3328, 5056, 5056, 5056, 1408]
    - [27, 24888.0]
  - - [4288, 1024, 1, 3328, 4288, 4288, 4288, 1024]
    - [29, 23981.0]
  - - [2944, 1408, 1, 3328, 2944, 2944, 2944, 1408]
    - [2, 24311.0]
  - - [2944, 4288, 1, 3328, 2944, 2944, 2944, 4288]
    - [4, 24616.0]
  - - [5056, 2944, 1, 256, 5056, 5056, 5056, 2944]
    - [12, 24069.0]
  - - [2368, 1856, 1, 256, 2368, 2368, 2368, 1856]
    - [33, 21571.0]
  - - [1408, 3584, 1, 3328, 1408, 1408, 1408, 3584]
    - [4, 24382.0]
  - - [2368, 6784, 1, 256, 2368, 2368, 2368, 6784]
    - [12, 23742.0]
  - - [5056, 1408, 1, 1280, 5056, 5056, 5056, 1408]
    - [2, 24507.0]
  - - [1408, 5888, 1, 3328, 1408, 1408, 1408, 5888]
    - [17, 24828.0]
  - - [1856, 5056, 1, 256, 1856, 1856, 1856, 5056]
    - [32, 22923.0]
  - - [6784, 6784, 1, 256, 6784, 6784, 6784, 6784]
    - [12, 25183.0]
  - - [2368, 4288, 1, 1280, 2368, 2368, 2368, 4288]
    - [2, 23710.0]
  - - [3584, 1856, 1, 1280, 3584, 3584, 3584, 1856]
    - [12, 24013.0]
  - - [5888, 5056, 1, 256, 5888, 5888, 5888, 5056]
    - [0, 24529.0]
  - - [3584, 448, 1, 256, 3584, 3584, 3584, 448]
    - [1, 18890.0]
  - - [3072, 7435, 1, 1024, 3072, 3072, 3072, 7435]
    - [15, 24990.0]
  - - [256, 6784, 1, 256, 256, 256, 256, 6784]
    - [1, 20301.0]
  - - [1856, 3584, 1, 3328, 1856, 1856, 1856, 3584]
    - [27, 24300.0]
  - - [5056, 256, 1, 1280, 5056, 5056, 5056, 256]
    - [3, 22745.0]
  - - [3584, 3584, 1, 256, 3584, 3584, 3584, 3584]
    - [12, 24183.0]
  - - [6784, 4288, 1, 1280, 6784, 6784, 6784, 4288]
    - [2, 24987.0]
  - - [704, 5056, 1, 256, 704, 704, 704, 5056]
    - [14, 20000.0]
  - - [2944, 2368, 1, 1280, 2944, 2944, 2944, 2368]
    - [27, 24072.0]
  - - [6784, 3584, 1, 256, 6784, 6784, 6784, 3584]
    - [27, 24775.0]
  - - [704, 6784, 1, 256, 704, 704, 704, 6784]
    - [14, 20493.0]
  - - [1024, 3584, 1, 3328, 1024, 1024, 1024, 3584]
    - [4, 23355.0]
  - - [2944, 2944, 1, 3328, 2944, 2944, 2944, 2944]
    - [2, 24914.0]
  - - [5056, 6784, 1, 256, 5056, 5056, 5056, 6784]
    - [18, 24615.0]
  - - [1408, 4288, 1, 3328, 1408, 1408, 1408, 4288]
    - [27, 24377.0]
  - - [6784, 256, 1, 1280, 6784, 6784, 6784, 256]
    - [1, 21953.0]
  - - [2368, 704, 1, 3328, 2368, 2368, 2368, 704]
    - [26, 21102.0]
  - - [3584, 6784, 1, 256, 3584, 3584, 3584, 6784]
    - [2, 24767.0]
  - - [5056, 1856, 1, 256, 5056, 5056, 5056, 1856]
    - [8, 23099.0]
  - - [704, 4288, 1, 256, 704, 704, 704, 4288]
    - [8, 19664.0]
  - - [1408, 6784, 1, 1280, 1408, 1408, 1408, 6784]
    - [15, 24608.0]
  - - [3584, 3584, 1, 1280, 3584, 3584, 3584, 3584]
    - [17, 24965.0]
  - - [5056, 2368, 1, 3328, 5056, 5056, 5056, 2368]
    - [27, 24508.0]
  - - [2944, 4288, 1, 256, 2944, 2944, 2944, 4288]
    - [27, 23606.0]
  - - [1408, 3584, 1, 1280, 1408, 1408, 1408, 3584]
    - [29, 24085.0]
  - - [1024, 1408, 1, 1280, 1024, 1024, 1024, 1408]
    - [1, 22192.0]
  - - [2368, 6784, 1, 3328, 2368, 2368, 2368, 6784]
    - [27, 24571.0]
  - - [5056, 704, 1, 1280, 5056, 5056, 5056, 704]
    - [8, 22990.0]
  - - [1856, 4288, 1, 3328, 1856, 1856, 1856, 4288]
    - [29, 23734.0]
  - - [1408, 5888, 1, 256, 1408, 1408, 1408, 5888]
    - [0, 23713.0]
  - - [4096, 7133, 1, 4096, 4096, 4096, 4096, 7133]
    - [13, 25465.0]
  - - [3584, 704, 1, 1280, 3584, 3584, 3584, 704]
    - [1, 22160.0]
  - - [3584, 448, 1, 3328, 3584, 3584, 3584, 448]
    - [30, 21950.0]
  - - [704, 2368, 1, 3328, 704, 704, 704, 2368]
    - [3, 20454.0]
  - - [448, 5056, 1, 3328, 448, 448, 448, 5056]
    - [4, 21114.0]
  - - [4288, 448, 1, 256, 4288, 4288, 4288, 448]
    - [14, 17268.0]
  - - [448, 5888, 1, 256, 448, 448, 448, 5888]
    - [33, 17404.0]
  - - [5888, 2368, 1, 256, 5888, 5888, 5888, 2368]
    - [24, 23579.0]
  - - [6784, 704, 1, 3328, 6784, 6784, 6784, 704]
    - [1, 23252.0]
  - - [1408, 2944, 1, 3328, 1408, 1408, 1408, 2944]
    - [2, 24276.0]
  - - [2368, 704, 1, 256, 2368, 2368, 2368, 704]
    - [28, 17462.0]
  - - [3584, 2368, 1, 256, 3584, 3584, 3584, 2368]
    - [26, 23352.0]
  - - [5888, 5056, 1, 1280, 5888, 5888, 5888, 5056]
    - [13, 25249.0]
  - - [3584, 3584, 1, 3328, 3584, 3584, 3584, 3584]
    - [17, 25092.0]
  - - [5888, 6784, 1, 256, 5888, 5888, 5888, 6784]
    - [24, 25201.0]
  - - [4288, 2944, 1, 3328, 4288, 4288, 4288, 2944]
    - [2, 24574.0]
  - - [4288, 704, 1, 1280, 4288, 4288, 4288, 704]
    - [1, 22194.0]
  - - [256, 5056, 1, 1280, 256, 256, 256, 5056]
    - [26, 21394.0]
  - - [6784, 5888, 1, 1280, 6784, 6784, 6784, 5888]
    - [17, 25690.0]
  - - [5888, 4288, 1, 1280, 5888, 5888, 5888, 4288]
    - [27, 24952.0]
  - - [1408, 1856, 1, 1280, 1408, 1408, 1408, 1856]
    - [1, 23235.0]
  - - [5888, 448, 1, 3328, 5888, 5888, 5888, 448]
    - [1, 22392.0]
  - - [704, 5888, 1, 1280, 704, 704, 704, 5888]
    - [4, 21898.0]
  - - [1024, 6784, 1, 3328, 1024, 1024, 1024, 6784]
    - [2, 24371.0]
  - - [704, 2944, 1, 1280, 704, 704, 704, 2944]
    - [3, 20882.0]
  - - [5056, 2944, 1, 3328, 5056, 5056, 5056, 2944]
    - [27, 25174.0]
  - - [1408, 1408, 1, 3328, 1408, 1408, 1408, 1408]
    - [1, 21789.0]
  - - [448, 4288, 1, 1280, 448, 448, 448, 4288]
    - [16, 19313.0]
  - - [3584, 704, 1, 256, 3584, 3584, 3584, 704]
    - [14, 19562.0]
  - - [3584, 1408, 1, 3328, 3584, 3584, 3584, 1408]
    - [27, 23941.0]
  - - [2368, 1024, 1, 1280, 2368, 2368, 2368, 1024]
    - [6, 21444.0]
  - - [1856, 6784, 1, 256, 1856, 1856, 1856, 6784]
    - [7, 23504.0]
  - - [4288, 448, 1, 3328, 4288, 4288, 4288, 448]
    - [8, 22612.0]
  - - [4288, 3584, 1, 1280, 4288, 4288, 4288, 3584]
    - [29, 24866.0]
  - - [1760, 7133, 1, 1760, 1760, 1760, 1760, 7133]
    - [29, 24370.0]
  - - [5888, 1024, 1, 3328, 5888, 5888, 5888, 1024]
    - [9, 24446.0]
  - - [704, 6784, 1, 1280, 704, 704, 704, 6784]
    - [18, 22015.0]
  - - [1024, 2944, 1, 3328, 1024, 1024, 1024, 2944]
    - [14, 22690.0]
  - - [704, 5056, 1, 1280, 704, 704, 704, 5056]
    - [27, 21564.0]
  - - [1024, 5888, 1, 1280, 1024, 1024, 1024, 5888]
    - [2, 23910.0]
  - - [2944, 1856, 1, 256, 2944, 2944, 2944, 1856]
    - [14, 22525.0]
  - - [3584, 5056, 1, 256, 3584, 3584, 3584, 5056]
    - [15, 24194.0]
  - - [5888, 5056, 1, 3328, 5888, 5888, 5888, 5056]
    - [13, 25387.0]
  - - [3584, 6784, 1, 1280, 3584, 3584, 3584, 6784]
    - [2, 25287.0]
  - - [1856, 5888, 1, 256, 1856, 1856, 1856, 5888]
    - [18, 23151.0]
  - - [4288, 4288, 1, 3328, 4288, 4288, 4288, 4288]
    - [17, 24756.0]
  - - [4288, 1408, 1, 1280, 4288, 4288, 4288, 1408]
    - [0, 23877.0]
  - - [4288, 2368, 1, 256, 4288, 4288, 4288, 2368]
    - [14, 23106.0]
  - - [2944, 5056, 1, 1280, 2944, 2944, 2944, 5056]
    - [17, 25049.0]
  - - [6784, 2368, 1, 3328, 6784, 6784, 6784, 2368]
    - [2, 24570.0]
  - - [4288, 1856, 1, 3328, 4288, 4288, 4288, 1856]
    - [15, 23623.0]
  - - [1856, 2944, 1, 1280, 1856, 1856, 1856, 2944]
    - [9, 22988.0]
  - - [2944, 5888, 1, 1280, 2944, 2944, 2944, 5888]
    - [2, 25460.0]
  - - [3584, 1024, 1, 1280, 3584, 3584, 3584, 1024]
    - [4, 23109.0]
  - - [1024, 4288, 1, 256, 1024, 1024, 1024, 4288]
    - [20, 22339.0]
  - - [5888, 3584, 1, 3328, 5888, 5888, 5888, 3584]
    - [27, 25404.0]
  - - [5056, 3584, 1, 3328, 5056, 5056, 5056, 3584]
    - [17, 25277.0]
  - - [2368, 1408, 1, 1280, 2368, 2368, 2368, 1408]
    - [1, 22592.0]
  - - [5056, 2944, 1, 1280, 5056, 5056, 5056, 2944]
    - [18, 25029.0]
  - - [1024, 6784, 1, 256, 1024, 1024, 1024, 6784]
    - [7, 23265.0]
  - - [3584, 2944, 1, 256, 3584, 3584, 3584, 2944]
    - [12, 24010.0]
  - - [3584, 1408, 1, 1280, 3584, 3584, 3584, 1408]
    - [12, 23950.0]
  - - [5056, 6784, 1, 3328, 5056, 5056, 5056, 6784]
    - [25, 25402.0]
  - - [3584, 4288, 1, 256, 3584, 3584, 3584, 4288]
    - [26, 23553.0]
  - - [1856, 6784, 1, 3328, 1856, 1856, 1856, 6784]
    - [27, 24476.0]
  - - [5056, 1408, 1, 256, 5056, 5056, 5056, 1408]
    - [7, 23169.0]
  - - [5888, 5888, 1, 256, 5888, 5888, 5888, 5888]
    - [25, 25186.0]
  - - [4288, 1024, 1, 1280, 4288, 4288, 4288, 1024]
    - [0, 23607.0]
  - - [448, 6784, 1, 3328, 448, 448, 448, 6784]
    - [2, 20683.0]
  - - [2944, 1408, 1, 1280, 2944, 2944, 2944, 1408]
    - [27, 23575.0]
  - - [2944, 1856, 1, 3328, 2944, 2944, 2944, 1856]
    - [1, 23561.0]
  - - [3584, 5888, 1, 1280, 3584, 3584, 3584, 5888]
    - [15, 25349.0]
  - - [6784, 1856, 1, 1280, 6784, 6784, 6784, 1856]
    - [12, 24336.0]
  - - [5888, 256, 1, 3328, 5888, 5888, 5888, 256]
    - [3, 22155.0]
  - - [1856, 5888, 1, 3328, 1856, 1856, 1856, 5888]
    - [15, 24259.0]
  - - [3584, 1408, 1, 256, 3584, 3584, 3584, 1408]
    - [3, 22800.0]
  - - [704, 3584, 1, 3328, 704, 704, 704, 3584]
    - [1, 21258.0]
  - - [5056, 448, 1, 1280, 5056, 5056, 5056, 448]
    - [14, 22210.0]
  - - [4288, 704, 1, 256, 4288, 4288, 4288, 704]
    - [20, 20510.0]
  - - [2944, 1024, 1, 256, 2944, 2944, 2944, 1024]
    - [1, 21449.0]
  - - [2368, 4288, 1, 3328, 2368, 2368, 2368, 4288]
    - [15, 23918.0]
  - - [6784, 5056, 1, 256, 6784, 6784, 6784, 5056]
    - [0, 24586.0]
  - - [3584, 5056, 1, 3328, 3584, 3584, 3584, 5056]
    - [17, 25249.0]
  - - [4288, 5888, 1, 256, 4288, 4288, 4288, 5888]
    - [0, 24262.0]
  - - [2944, 6784, 1, 256, 2944, 2944, 2944, 6784]
    - [0, 24873.0]
  - - [2368, 2368, 1, 1280, 2368, 2368, 2368, 2368]
    - [14, 22735.0]
  - - [1856, 3584, 1, 1280, 1856, 1856, 1856, 3584]
    - [32, 24014.0]
  - - [5056, 3584, 1, 1280, 5056, 5056, 5056, 3584]
    - [17, 25167.0]
  - - [256, 5888, 1, 256, 256, 256, 256, 5888]
    - [16, 19688.0]
  - - [1856, 1408, 1, 3328, 1856, 1856, 1856, 1408]
    - [1, 21918.0]
  - - [1024, 4288, 1, 3328, 1024, 1024, 1024, 4288]
    - [23, 23870.0]
  - - [2944, 2368, 1, 3328, 2944, 2944, 2944, 2368]
    - [27, 24408.0]
  - - [1024, 1856, 1, 1280, 1024, 1024, 1024, 1856]
    - [3, 22463.0]
  - - [6784, 1856, 1, 256, 6784, 6784, 6784, 1856]
    - [26, 23680.0]
  - - [1024, 5888, 1, 256, 1024, 1024, 1024, 5888]
    - [7, 23162.0]
  - - [1408, 2368, 1, 256, 1408, 1408, 1408, 2368]
    - [26, 21852.0]
  - - [2944, 704, 1, 3328, 2944, 2944, 2944, 704]
    - [1, 22754.0]
  - - [2944, 2944, 1, 1280, 2944, 2944, 2944, 2944]
    - [27, 24758.0]
  - - [6784, 256, 1, 3328, 6784, 6784, 6784, 256]
    - [1, 22244.0]
  - - [1408, 5056, 1, 256, 1408, 1408, 1408, 5056]
    - [26, 22263.0]
  - - [5056, 256, 1, 256, 5056, 5056, 5056, 256]
    - [10, 16501.0]
  - - [1408, 4288, 1, 256, 1408, 1408, 1408, 4288]
    - [24, 22407.0]
  - - [5888, 2368, 1, 1280, 5888, 5888, 5888, 2368]
    - [15, 24542.0]
  - - [2368, 5888, 1, 1280, 2368, 2368, 2368, 5888]
    - [17, 24577.0]
  - - [5888, 256, 1, 1280, 5888, 5888, 5888, 256]
    - [16, 21811.0]
  - - [2368, 1856, 1, 3328, 2368, 2368, 2368, 1856]
    - [26, 22738.0]
  - - [2944, 704, 1, 256, 2944, 2944, 2944, 704]
    - [1, 19141.0]
  - - [2368, 6784, 1, 1280, 2368, 2368, 2368, 6784]
    - [2, 24485.0]
  - - [1856, 4288, 1, 1280, 1856, 1856, 1856, 4288]
    - [15, 23430.0]
  - - [704, 3584, 1, 256, 704, 704, 704, 3584]
    - [1, 19693.0]
  - - [704, 2944, 1, 3328, 704, 704, 704, 2944]
    - [3, 21818.0]
  - - [1856, 5056, 1, 3328, 1856, 1856, 1856, 5056]
    - [17, 24284.0]
  - - [3584, 5056, 1, 1280, 3584, 3584, 3584, 5056]
    - [15, 25180.0]
  - - [2944, 1024, 1, 3328, 2944, 2944, 2944, 1024]
    - [4, 23000.0]
  - - [1408, 6784, 1, 256, 1408, 1408, 1408, 6784]
    - [32, 23796.0]
  - - [6784, 1408, 1, 3328, 6784, 6784, 6784, 1408]
    - [15, 24748.0]
  - - [1024, 2368, 1, 1280, 1024, 1024, 1024, 2368]
    - [14, 22950.0]
  - - [6784, 2944, 1, 1280, 6784, 6784, 6784, 2944]
    - [2, 25496.0]
  - - [3584, 448, 1, 1280, 3584, 3584, 3584, 448]
    - [5, 21666.0]
  - - [2944, 6784, 1, 3328, 2944, 2944, 2944, 6784]
    - [27, 25587.0]
  - - [448, 5056, 1, 1280, 448, 448, 448, 5056]
    - [3, 20309.0]
  - - [5888, 704, 1, 256, 5888, 5888, 5888, 704]
    - [14, 21097.0]
  - - [256, 5888, 1, 3328, 256, 256, 256, 5888]
    - [10, 22008.0]
  - - [6784, 4288, 1, 256, 6784, 6784, 6784, 4288]
    - [27, 24318.0]
  - - [5888, 256, 1, 256, 5888, 5888, 5888, 256]
    - [16, 19809.0]
  - - [6784, 1024, 1, 1280, 6784, 6784, 6784, 1024]
    - [17, 24314.0]
  - - [2944, 704, 1, 1280, 2944, 2944, 2944, 704]
    - [14, 22471.0]
  - - [6784, 3584, 1, 1280, 6784, 6784, 6784, 3584]
    - [15, 25326.0]
  - - [1408, 2944, 1, 1280, 1408, 1408, 1408, 2944]
    - [2, 23922.0]
  - - [1408, 2368, 1, 3328, 1408, 1408, 1408, 2368]
    - [26, 22845.0]
  - - [1024, 3584, 1, 256, 1024, 1024, 1024, 3584]
    - [1, 20869.0]
  - - [2368, 2944, 1, 256, 2368, 2368, 2368, 2944]
    - [0, 22236.0]
  - - [2944, 5888, 1, 256, 2944, 2944, 2944, 5888]
    - [2, 24799.0]
  - - [3584, 1856, 1, 256, 3584, 3584, 3584, 1856]
    - [26, 23093.0]
  - - [704, 4288, 1, 3328, 704, 704, 704, 4288]
    - [1, 20894.0]
  - - [4288, 2944, 1, 1280, 4288, 4288, 4288, 2944]
    - [27, 24407.0]
  - - [4288, 5056, 1, 3328, 4288, 4288, 4288, 5056]
    - [17, 24944.0]
  - - [256, 5056, 1, 3328, 256, 256, 256, 5056]
    - [3, 22598.0]
  - - [5056, 2368, 1, 256, 5056, 5056, 5056, 2368]
    - [32, 23326.0]
  - - [4288, 704, 1, 3328, 4288, 4288, 4288, 704]
    - [8, 22695.0]
  - - [448, 3584, 1, 256, 448, 448, 448, 3584]
    - [16, 15797.0]
  - - [1024, 1408, 1, 3328, 1024, 1024, 1024, 1408]
    - [14, 22460.0]
  - - [2560, 7133, 1, 2560, 2560, 2560, 2560, 7133]
    - [13, 25398.0]
  - - [5888, 3584, 1, 256, 5888, 5888, 5888, 3584]
    - [32, 24697.0]
  - - [1408, 1856, 1, 3328, 1408, 1408, 1408, 1856]
    - [1, 23509.0]
  - - [6784, 1408, 1, 1280, 6784, 6784, 6784, 1408]
    - [27, 24608.0]
  - - [704, 2944, 1, 256, 704, 704, 704, 2944]
    - [16, 19507.0]
  - - [2944, 5888, 1, 3328, 2944, 2944, 2944, 5888]
    - [27, 25544.0]
  - - [1408, 6784, 1, 3328, 1408, 1408, 1408, 6784]
    - [15, 24740.0]
  - - [1408, 1408, 1, 1280, 1408, 1408, 1408, 1408]
    - [1, 21589.0]
  - - [448, 4288, 1, 3328, 448, 448, 448, 4288]
    - [16, 19967.0]
  - - [704, 2368, 1, 256, 704, 704, 704, 2368]
    - [14, 16364.0]
  - - [5888, 2368, 1, 3328, 5888, 5888, 5888, 2368]
    - [27, 24673.0]
  - - [4288, 5056, 1, 256, 4288, 4288, 4288, 5056]
    - [18, 23973.0]
  - - [4288, 448, 1, 1280, 4288, 4288, 4288, 448]
    - [8, 22224.0]
  - - [5888, 704, 1, 3328, 5888, 5888, 5888, 704]
    - [1, 23326.0]
  - - [4288, 3584, 1, 3328, 4288, 4288, 4288, 3584]
    - [17, 25009.0]
  - - [6784, 6784, 1, 3328, 6784, 6784, 6784, 6784]
    - [15, 25630.0]
  - - [704, 5056, 1, 3328, 704, 704, 704, 5056]
    - [12, 22354.0]
  - - [2368, 2944, 1, 3328, 2368, 2368, 2368, 2944]
    - [7, 24366.0]
  - - [2368, 3584, 1, 256, 2368, 2368, 2368, 3584]
    - [0, 22933.0]
  - - [3584, 2368, 1, 1280, 3584, 3584, 3584, 2368]
    - [24, 24071.0]
  - - [1856, 1856, 1, 256, 1856, 1856, 1856, 1856]
    - [8, 21198.0]
  - - [4288, 1408, 1, 3328, 4288, 4288, 4288, 1408]
    - [32, 24348.0]
  - - [4288, 5056, 1, 1280, 4288, 4288, 4288, 5056]
    - [29, 24774.0]
  - - [5888, 6784, 1, 1280, 5888, 5888, 5888, 6784]
    - [25, 25692.0]
  - - [5888, 1408, 1, 3328, 5888, 5888, 5888, 1408]
    - [15, 24679.0]
  - - [256, 5056, 1, 256, 256, 256, 256, 5056]
    - [26, 19700.0]
  - - [1408, 1024, 1, 256, 1408, 1408, 1408, 1024]
    - [1, 20147.0]
  - - [2368, 5056, 1, 256, 2368, 2368, 2368, 5056]
    - [32, 23404.0]
  - - [1024, 5056, 1, 256, 1024, 1024, 1024, 5056]
    - [1, 22781.0]
  - - [2368, 1408, 1, 3328, 2368, 2368, 2368, 1408]
    - [1, 22981.0]
  - - [5888, 448, 1, 256, 5888, 5888, 5888, 448]
    - [26, 19472.0]
  - - [6784, 5056, 1, 1280, 6784, 6784, 6784, 5056]
    - [17, 25251.0]
  - - [4288, 6784, 1, 1280, 4288, 4288, 4288, 6784]
    - [15, 24922.0]
  - - [6784, 1408, 1, 256, 6784, 6784, 6784, 1408]
    - [0, 23644.0]
  - - [5888, 4288, 1, 256, 5888, 5888, 5888, 4288]
    - [18, 24224.0]
  - - [5056, 5888, 1, 256, 5056, 5056, 5056, 5888]
    - [18, 24651.0]
  - - [2368, 1024, 1, 256, 2368, 2368, 2368, 1024]
    - [10, 20487.0]
  - - [1856, 6784, 1, 1280, 1856, 1856, 1856, 6784]
    - [27, 24279.0]
  - - [4288, 3584, 1, 256, 4288, 4288, 4288, 3584]
    - [0, 24140.0]
  - - [5056, 1856, 1, 1280, 5056, 5056, 5056, 1856]
    - [15, 23978.0]
  - - [1408, 1024, 1, 3328, 1408, 1408, 1408, 1024]
    - [1, 22572.0]
  - - [5888, 3584, 1, 1280, 5888, 5888, 5888, 3584]
    - [15, 25329.0]
  - - [1024, 2944, 1, 256, 1024, 1024, 1024, 2944]
    - [14, 21545.0]
  - - [448, 6784, 1, 1280, 448, 448, 448, 6784]
    - [12, 20473.0]
  - - [3584, 1024, 1, 3328, 3584, 3584, 3584, 1024]
    - [17, 23208.0]
  - - [2944, 1856, 1, 1280, 2944, 2944, 2944, 1856]
    - [14, 23456.0]
  - - [2368, 3584, 1, 3328, 2368, 2368, 2368, 3584]
    - [2, 24337.0]
  - - [3584, 5888, 1, 3328, 3584, 3584, 3584, 5888]
    - [15, 25406.0]
  - - [2944, 3584, 1, 1280, 2944, 2944, 2944, 3584]
    - [12, 24625.0]
  - - [1856, 5888, 1, 1280, 1856, 1856, 1856, 5888]
    - [2, 24063.0]
  - - [5056, 448, 1, 3328, 5056, 5056, 5056, 448]
    - [1, 23119.0]
  - - [4288, 1408, 1, 256, 4288, 4288, 4288, 1408]
    - [31, 22017.0]
  - - [4288, 2368, 1, 1280, 4288, 4288, 4288, 2368]
    - [2, 23742.0]
  - - [2944, 5056, 1, 256, 2944, 2944, 2944, 5056]
    - [32, 24163.0]
  - - [6784, 2368, 1, 256, 6784, 6784, 6784, 2368]
    - [26, 23758.0]
  - - [4288, 1856, 1, 256, 4288, 4288, 4288, 1856]
    - [14, 22718.0]
  - - [1856, 2944, 1, 256, 1856, 1856, 1856, 2944]
    - [1, 21918.0]
  - - [1856, 1408, 1, 1280, 1856, 1856, 1856, 1408]
    - [1, 21814.0]
  - - [1024, 4288, 1, 1280, 1024, 1024, 1024, 4288]
    - [26, 23125.0]
  - - [2368, 5056, 1, 3328, 2368, 2368, 2368, 5056]
    - [29, 24526.0]
  - - [1024, 1856, 1, 3328, 1024, 1024, 1024, 1856]
    - [3, 23184.0]
  - - [704, 3584, 1, 1280, 704, 704, 704, 3584]
    - [1, 20689.0]
  - - [4288, 6784, 1, 256, 4288, 4288, 4288, 6784]
    - [12, 24410.0]
  - - [3584, 2944, 1, 3328, 3584, 3584, 3584, 2944]
    - [21, 24874.0]
  - - [5888, 2944, 1, 256, 5888, 5888, 5888, 2944]
    - [7, 24788.0]
  - - [5056, 4288, 1, 256, 5056, 5056, 5056, 4288]
    - [12, 24012.0]
  - - [6784, 1024, 1, 3328, 6784, 6784, 6784, 1024]
    - [4, 24498.0]
  - - [5888, 5888, 1, 1280, 5888, 5888, 5888, 5888]
    - [13, 25657.0]
  - - [448, 5888, 1, 1280, 448, 448, 448, 5888]
    - [1, 19651.0]
  - - [2944, 1408, 1, 256, 2944, 2944, 2944, 1408]
    - [3, 21542.0]
  - - [1024, 2944, 1, 1280, 1024, 1024, 1024, 2944]
    - [14, 22238.0]
  - - [2368, 5888, 1, 3328, 2368, 2368, 2368, 5888]
    - [4, 24744.0]
  - - [2368, 1856, 1, 1280, 2368, 2368, 2368, 1856]
    - [1, 22647.0]
  - - [5888, 4288, 1, 3328, 5888, 5888, 5888, 4288]
    - [2, 25021.0]
  - - [6784, 704, 1, 1280, 6784, 6784, 6784, 704]
    - [1, 22960.0]
  - - [5056, 448, 1, 256, 5056, 5056, 5056, 448]
    - [7, 16001.0]
  - - [1856, 5056, 1, 1280, 1856, 1856, 1856, 5056]
    - [27, 23988.0]
  - - [2944, 1024, 1, 1280, 2944, 2944, 2944, 1024]
    - [14, 22672.0]
  - - [2368, 4288, 1, 256, 2368, 2368, 2368, 4288]
    - [8, 22770.0]
  - - [1024, 2368, 1, 3328, 1024, 1024, 1024, 2368]
    - [1, 23185.0]
  - - [4288, 5888, 1, 3328, 4288, 4288, 4288, 5888]
    - [27, 25019.0]
  - - [2944, 6784, 1, 1280, 2944, 2944, 2944, 6784]
    - [2, 25455.0]
  - - [256, 6784, 1, 1280, 256, 256, 256, 6784]
    - [14, 21984.0]
  - - [1856, 3584, 1, 256, 1856, 1856, 1856, 3584]
    - [29, 21469.0]
  - - [256, 5888, 1, 1280, 256, 256, 256, 5888]
    - [28, 21132.0]
  - - [7680, 5481, 1, 2560, 7680, 7680, 7680, 5481]
    - [15, 25550.0]
  - - [2944, 2368, 1, 256, 2944, 2944, 2944, 2368]
    - [1, 22625.0]
  - - [1024, 1856, 1, 256, 1024, 1024, 1024, 1856]
    - [26, 20634.0]
  - - [6784, 3584, 1, 3328, 6784, 6784, 6784, 3584]
    - [15, 25393.0]
  - - [1024, 5888, 1, 3328, 1024, 1024, 1024, 5888]
    - [2, 24393.0]
  - - [1408, 2368, 1, 1280, 1408, 1408, 1408, 2368]
    - [1, 22681.0]
  - - [2944, 2944, 1, 256, 2944, 2944, 2944, 2944]
    - [7, 23132.0]
  - - [6784, 256, 1, 256, 6784, 6784, 6784, 256]
    - [1, 17985.0]
  - - [5888, 1408, 1, 256, 5888, 5888, 5888, 1408]
    - [0, 22875.0]
  - - [5888, 6784, 1, 3328, 5888, 5888, 5888, 6784]
    - [25, 25771.0]
  - - [704, 4288, 1, 1280, 704, 704, 704, 4288]
    - [1, 20449.0]
  - - [6784, 448, 1, 3328, 6784, 6784, 6784, 448]
    - [26, 22831.0]
  - - [3136, 256, 64, 64, 3136, 3136, 3136, 256]
    - [31, 15826.0]
  - - [784, 512, 64, 128, 784, 784, 784, 512]
    - [7, 20825.0]
  - - [784, 128, 64, 512, 784, 784, 784, 128]
    - [7, 20812.0]
  - - [196, 256, 128, 1024, 196, 196, 196, 256]
    - [7, 18525.0]
  - - [196, 256, 64, 1024, 196, 196, 196, 256]
    - [12, 17987.0]
  - - [196, 1024, 128, 256, 196, 196, 196, 1024]
    - [12, 18220.0]
  - - [784, 128, 256, 512, 784, 784, 784, 128]
    - [0, 21974.0]
  - - [3136, 256, 256, 64, 3136, 3136, 3136, 256]
    - [0, 14335.0]
  - - [784, 128, 128, 512, 784, 784, 784, 128]
    - [12, 21600.0]
  - - [784, 512, 128, 128, 784, 784, 784, 512]
    - [0, 21300.0]
  - - [784, 512, 256, 128, 784, 784, 784, 512]
    - [32, 21569.0]
  - - [196, 1024, 64, 256, 196, 196, 196, 1024]
    - [12, 17817.0]
  - - [196, 1024, 256, 256, 196, 196, 196, 1024]
    - [0, 18504.0]
  - - [196, 256, 256, 1024, 196, 196, 196, 256]
    - [2, 18937.0]
  - - [3136, 256, 128, 64, 3136, 3136, 3136, 256]
    - [0, 18684.0]
  - - [1024, 1024, 1, 3328, 1024, 1024, 1024, 1024]
    - [36, 20341.0]
  - - [64, 6784, 1, 256, 64, 64, 64, 6784]
    - [51, 12029.0]
  - - [128, 6784, 1, 3328, 128, 128, 128, 6784]
    - [46, 20522.0]
  - - [256, 4288, 1, 3328, 256, 256, 256, 4288]
    - [36, 21599.0]
  - - [704, 1856, 1, 3328, 704, 704, 704, 1856]
    - [52, 21375.0]
  - - [448, 1024, 1, 1280, 448, 448, 448, 1024]
    - [51, 16348.0]
  - - [2368, 128, 1, 256, 2368, 2368, 2368, 128]
    - [39, 7791.0]
  - - [256, 1856, 1, 1280, 256, 256, 256, 1856]
    - [35, 16699.0]
  - - [448, 704, 1, 1280, 448, 448, 448, 704]
    - [44, 14306.0]
  - - [128, 3584, 1, 1280, 128, 128, 128, 3584]
    - [36, 16248.0]
  - - [4288, 256, 1, 256, 4288, 4288, 4288, 256]
    - [51, 15717.0]
  - - [5888, 64, 1, 3328, 5888, 5888, 5888, 64]
    - [52, 15560.0]
  - - [2944, 256, 1, 3328, 2944, 2944, 2944, 256]
    - [53, 20053.0]
  - - [256, 4288, 1, 1280, 256, 256, 256, 4288]
    - [36, 20997.0]
  - - [1408, 448, 1, 1280, 1408, 1408, 1408, 448]
    - [36, 19215.0]
  - - [6784, 128, 1, 1280, 6784, 6784, 6784, 128]
    - [50, 19905.0]
  - - [2368, 128, 1, 3328, 2368, 2368, 2368, 128]
    - [42, 16418.0]
  - - [2944, 128, 1, 256, 2944, 2944, 2944, 128]
    - [34, 8691.0]
  - - [448, 1408, 1, 256, 448, 448, 448, 1408]
    - [51, 12655.0]
  - - [64, 5056, 1, 3328, 64, 64, 64, 5056]
    - [52, 16722.0]
  - - [2368, 256, 1, 1280, 2368, 2368, 2368, 256]
    - [52, 17076.0]
  - - [256, 3584, 1, 3328, 256, 256, 256, 3584]
    - [46, 21172.0]
  - - [5056, 64, 1, 1280, 5056, 5056, 5056, 64]
    - [35, 14594.0]
  - - [1024, 704, 1, 256, 1024, 1024, 1024, 704]
    - [39, 12710.0]
  - - [4288, 128, 1, 1280, 4288, 4288, 4288, 128]
    - [44, 15675.0]
  - - [5888, 64, 1, 256, 5888, 5888, 5888, 64]
    - [39, 8492.0]
  - - [1856, 256, 1, 1280, 1856, 1856, 1856, 256]
    - [52, 16572.0]
  - - [64, 5888, 1, 3328, 64, 64, 64, 5888]
    - [44, 15498.0]
  - - [256, 1408, 1, 3328, 256, 256, 256, 1408]
    - [44, 14322.0]
  - - [6784, 128, 1, 3328, 6784, 6784, 6784, 128]
    - [54, 20046.0]
  - - [704, 704, 1, 3328, 704, 704, 704, 704]
    - [44, 15733.0]
  - - [3584, 256, 1, 3328, 3584, 3584, 3584, 256]
    - [54, 21152.0]
  - - [128, 3584, 1, 3328, 128, 128, 128, 3584]
    - [58, 18042.0]
  - - [128, 2944, 1, 1280, 128, 128, 128, 2944]
    - [35, 13473.0]
  - - [448, 1856, 1, 1280, 448, 448, 448, 1856]
    - [44, 17732.0]
  - - [3584, 128, 1, 256, 3584, 3584, 3584, 128]
    - [39, 10107.0]
  - - [448, 1408, 1, 3328, 448, 448, 448, 1408]
    - [52, 19838.0]
  - - [256, 3584, 1, 256, 256, 256, 256, 3584]
    - [47, 14428.0]
  - - [256, 2944, 1, 3328, 256, 256, 256, 2944]
    - [36, 19546.0]
  - - [1408, 704, 1, 256, 1408, 1408, 1408, 704]
    - [34, 14753.0]
  - - [448, 2944, 1, 3328, 448, 448, 448, 2944]
    - [35, 20734.0]
  - - [64, 5888, 1, 256, 64, 64, 64, 5888]
    - [48, 9330.0]
  - - [448, 2368, 1, 1280, 448, 448, 448, 2368]
    - [34, 18981.0]
  - - [128, 4288, 1, 3328, 128, 128, 128, 4288]
    - [46, 17496.0]
  - - [256, 2368, 1, 256, 256, 256, 256, 2368]
    - [56, 12200.0]
  - - [1024, 448, 1, 3328, 1024, 1024, 1024, 448]
    - [35, 17949.0]
  - - [1856, 704, 1, 1280, 1856, 1856, 1856, 704]
    - [48, 20653.0]
  - - [1024, 1024, 1, 1280, 1024, 1024, 1024, 1024]
    - [36, 19279.0]
  - - [256, 2944, 1, 256, 256, 256, 256, 2944]
    - [39, 13036.0]
  - - [128, 6784, 1, 1280, 128, 128, 128, 6784]
    - [46, 18788.0]
  - - [1408, 704, 1, 3328, 1408, 1408, 1408, 704]
    - [35, 19603.0]
  - - [128, 5888, 1, 1280, 128, 128, 128, 5888]
    - [58, 18168.0]
  - - [704, 1408, 1, 3328, 704, 704, 704, 1408]
    - [44, 19620.0]
  - - [6784, 128, 1, 256, 6784, 6784, 6784, 128]
    - [43, 13473.0]
  - - [704, 448, 1, 256, 704, 704, 704, 448]
    - [39, 8239.0]
  - - [256, 1856, 1, 3328, 256, 256, 256, 1856]
    - [36, 18568.0]
  - - [128, 4288, 1, 256, 128, 128, 128, 4288]
    - [56, 10629.0]
  - - [64, 6784, 1, 3328, 64, 64, 64, 6784]
    - [48, 17100.0]
  - - [2944, 256, 1, 1280, 2944, 2944, 2944, 256]
    - [41, 18298.0]
  - - [1856, 704, 1, 256, 1856, 1856, 1856, 704]
    - [43, 16843.0]
  - - [1408, 448, 1, 3328, 1408, 1408, 1408, 448]
    - [53, 19767.0]
  - - [2368, 256, 1, 256, 2368, 2368, 2368, 256]
    - [34, 12336.0]
  - - [704, 1856, 1, 256, 704, 704, 704, 1856]
    - [34, 16843.0]
  - - [5888, 64, 1, 1280, 5888, 5888, 5888, 64]
    - [48, 13413.0]
  - - [256, 2368, 1, 1280, 256, 256, 256, 2368]
    - [53, 17421.0]
  - - [2944, 448, 1, 256, 2944, 2944, 2944, 448]
    - [36, 15926.0]
  - - [2368, 128, 1, 1280, 2368, 2368, 2368, 128]
    - [46, 13886.0]
  - - [64, 5056, 1, 1280, 64, 64, 64, 5056]
    - [52, 14523.0]
  - - [704, 448, 1, 3328, 704, 704, 704, 448]
    - [52, 16524.0]
  - - [5056, 64, 1, 3328, 5056, 5056, 5056, 64]
    - [57, 16758.0]
  - - [2368, 448, 1, 1280, 2368, 2368, 2368, 448]
    - [48, 19082.0]
  - - [128, 3584, 1, 256, 128, 128, 128, 3584]
    - [51, 10393.0]
  - - [1856, 448, 1, 3328, 1856, 1856, 1856, 448]
    - [35, 18779.0]
  - - [128, 5056, 1, 256, 128, 128, 128, 5056]
    - [43, 12457.0]
  - - [4288, 256, 1, 1280, 4288, 4288, 4288, 256]
    - [36, 19768.0]
  - - [704, 704, 1, 256, 704, 704, 704, 704]
    - [39, 10006.0]
  - - [4288, 128, 1, 3328, 4288, 4288, 4288, 128]
    - [37, 17547.0]
  - - [256, 1408, 1, 1280, 256, 256, 256, 1408]
    - [51, 12916.0]
  - - [6784, 64, 1, 3328, 6784, 6784, 6784, 64]
    - [55, 17430.0]
  - - [128, 2944, 1, 3328, 128, 128, 128, 2944]
    - [52, 14908.0]
  - - [2944, 448, 1, 3328, 2944, 2944, 2944, 448]
    - [35, 20675.0]
  - - [2368, 448, 1, 3328, 2368, 2368, 2368, 448]
    - [53, 20161.0]
  - - [5056, 64, 1, 256, 5056, 5056, 5056, 64]
    - [56, 7904.0]
  - - [128, 5056, 1, 3328, 128, 128, 128, 5056]
    - [46, 20323.0]
  - - [6784, 64, 1, 256, 6784, 6784, 6784, 64]
    - [43, 9733.0]
  - - [128, 2368, 1, 256, 128, 128, 128, 2368]
    - [39, 7563.0]
  - - [3584, 256, 1, 256, 3584, 3584, 3584, 256]
    - [39, 14305.0]
  - - [128, 2944, 1, 256, 128, 128, 128, 2944]
    - [39, 8433.0]
  - - [3584, 128, 1, 3328, 3584, 3584, 3584, 128]
    - [40, 18448.0]
  - - [1024, 448, 1, 1280, 1024, 1024, 1024, 448]
    - [43, 16357.0]
  - - [5888, 128, 1, 3328, 5888, 5888, 5888, 128]
    - [53, 19546.0]
  - - [1408, 704, 1, 1280, 1408, 1408, 1408, 704]
    - [48, 18825.0]
  - - [448, 1408, 1, 1280, 448, 448, 448, 1408]
    - [51, 17895.0]
  - - [704, 1408, 1, 1280, 704, 704, 704, 1408]
    - [35, 18626.0]
  - - [448, 2944, 1, 256, 448, 448, 448, 2944]
    - [51, 16535.0]
  - - [448, 2368, 1, 256, 448, 448, 448, 2368]
    - [34, 15121.0]
  - - [64, 5056, 1, 256, 64, 64, 64, 5056]
    - [34, 7684.0]
  - - [5056, 128, 1, 3328, 5056, 5056, 5056, 128]
    - [37, 20866.0]
  - - [448, 704, 1, 256, 448, 448, 448, 704]
    - [39, 8090.0]
  - - [1856, 256, 1, 3328, 1856, 1856, 1856, 256]
    - [40, 18585.0]
  - - [2944, 128, 1, 3328, 2944, 2944, 2944, 128]
    - [49, 15084.0]
  - - [64, 6784, 1, 1280, 64, 64, 64, 6784]
    - [48, 15243.0]
  - - [704, 1024, 1, 1280, 704, 704, 704, 1024]
    - [53, 17732.0]
  - - [256, 4288, 1, 256, 256, 256, 256, 4288]
    - [57, 16707.0]
  - - [256, 2368, 1, 3328, 256, 256, 256, 2368]
    - [46, 19648.0]
  - - [1408, 256, 1, 1280, 1408, 1408, 1408, 256]
    - [35, 13756.0]
  - - [704, 448, 1, 1280, 704, 704, 704, 448]
    - [52, 15539.0]
  - - [1024, 704, 1, 1280, 1024, 1024, 1024, 704]
    - [36, 18243.0]
  - - [256, 1856, 1, 256, 256, 256, 256, 1856]
    - [39, 13515.0]
  - - [704, 1856, 1, 1280, 704, 704, 704, 1856]
    - [43, 21251.0]
  - - [1408, 256, 1, 3328, 1408, 1408, 1408, 256]
    - [52, 14701.0]
  - - [5888, 128, 1, 256, 5888, 5888, 5888, 128]
    - [39, 15361.0]
  - - [2368, 448, 1, 256, 2368, 2368, 2368, 448]
    - [56, 17276.0]
  - - [4288, 256, 1, 3328, 4288, 4288, 4288, 256]
    - [45, 21083.0]
  - - [2944, 256, 1, 256, 2944, 2944, 2944, 256]
    - [34, 13161.0]
  - - [1408, 448, 1, 256, 1408, 1408, 1408, 448]
    - [43, 12422.0]
  - - [6784, 64, 1, 1280, 6784, 6784, 6784, 64]
    - [58, 15226.0]
  - - [448, 1024, 1, 3328, 448, 448, 448, 1024]
    - [52, 17819.0]
  - - [2944, 448, 1, 1280, 2944, 2944, 2944, 448]
    - [44, 19852.0]
  - - [5056, 128, 1, 256, 5056, 5056, 5056, 128]
    - [34, 12686.0]
  - - [448, 1024, 1, 256, 448, 448, 448, 1024]
    - [39, 10393.0]
  - - [128, 5056, 1, 1280, 128, 128, 128, 5056]
    - [53, 18515.0]
  - - [1408, 256, 1, 256, 1408, 1408, 1408, 256]
    - [47, 10253.0]
  - - [128, 5888, 1, 3328, 128, 128, 128, 5888]
    - [53, 19859.0]
  - - [3584, 128, 1, 1280, 3584, 3584, 3584, 128]
    - [36, 17090.0]
  - - [4288, 128, 1, 256, 4288, 4288, 4288, 128]
    - [51, 13132.0]
  - - [2368, 256, 1, 3328, 2368, 2368, 2368, 256]
    - [37, 19637.0]
  - - [5888, 128, 1, 1280, 5888, 5888, 5888, 128]
    - [41, 19156.0]
  - - [256, 3584, 1, 1280, 256, 256, 256, 3584]
    - [46, 19865.0]
  - - [128, 5888, 1, 256, 128, 128, 128, 5888]
    - [56, 12811.0]
  - - [1024, 1024, 1, 256, 1024, 1024, 1024, 1024]
    - [43, 14847.0]
  - - [1024, 1024, 1, 1024, 1024, 1024, 1024, 1024]
    - [36, 19753.0]
  - - [64, 5888, 1, 1280, 64, 64, 64, 5888]
    - [40, 14187.0]
  - - [704, 1024, 1, 256, 704, 704, 704, 1024]
    - [43, 12816.0]
  - - [704, 704, 1, 1280, 704, 704, 704, 704]
    - [35, 14398.0]
  - - [128, 2368, 1, 1280, 128, 128, 128, 2368]
    - [53, 13748.0]
  - - [3584, 256, 1, 1280, 3584, 3584, 3584, 256]
    - [46, 19831.0]
  - - [5056, 128, 1, 1280, 5056, 5056, 5056, 128]
    - [52, 18150.0]
  - - [448, 1856, 1, 3328, 448, 448, 448, 1856]
    - [46, 18720.0]
  - - [1024, 448, 1, 256, 1024, 1024, 1024, 448]
    - [43, 10302.0]
  - - [2944, 128, 1, 1280, 2944, 2944, 2944, 128]
    - [45, 13310.0]
  - - [256, 2944, 1, 1280, 256, 256, 256, 2944]
    - [58, 18195.0]
  - - [704, 1024, 1, 3328, 704, 704, 704, 1024]
    - [36, 18615.0]
  - - [1856, 448, 1, 1280, 1856, 1856, 1856, 448]
    - [35, 18420.0]
  - - [128, 6784, 1, 256, 128, 128, 128, 6784]
    - [37, 15480.0]
  - - [704, 1408, 1, 256, 704, 704, 704, 1408]
    - [44, 15781.0]
  - - [256, 1408, 1, 256, 256, 256, 256, 1408]
    - [42, 8358.0]
  - - [448, 2944, 1, 1280, 448, 448, 448, 2944]
    - [35, 20443.0]
  - - [1856, 256, 1, 256, 1856, 1856, 1856, 256]
    - [51, 13396.0]
  - - [128, 2368, 1, 3328, 128, 128, 128, 2368]
    - [36, 16558.0]
  - - [448, 2368, 1, 3328, 448, 448, 448, 2368]
    - [34, 19797.0]
  - - [1856, 448, 1, 256, 1856, 1856, 1856, 448]
    - [41, 14115.0]
  - - [1024, 704, 1, 3328, 1024, 1024, 1024, 704]
    - [53, 18699.0]
  - - [128, 4288, 1, 1280, 128, 128, 128, 4288]
    - [53, 15873.0]
  - - [448, 704, 1, 3328, 448, 448, 448, 704]
    - [44, 16452.0]
  - - [448, 1856, 1, 256, 448, 448, 448, 1856]
    - [34, 13506.0]
  - - [1856, 704, 1, 3328, 1856, 1856, 1856, 704]
    - [52, 21368.0]
  - - [3136, 64, 128, 64, 3136, 3136, 3136, 64]
    - [51, 20870.0]
  - - [3136, 64, 64, 256, 3136, 3136, 3136, 64]
    - [34, 20655.0]
  - - [3136, 64, 256, 256, 3136, 3136, 3136, 64]
    - [38, 16696.0]
  - - [3136, 64, 128, 256, 3136, 3136, 3136, 64]
    - [34, 17461.0]
  - - [3136, 64, 64, 64, 3136, 3136, 3136, 64]
    - [43, 20593.0]
  - - [3136, 64, 256, 64, 3136, 3136, 3136, 64]
    - [34, 14664.0]
  - - [2368, 64, 1, 3328, 2368, 2368, 2368, 64]
    - [68, 11344.0]
  - - [1408, 64, 1, 1280, 1408, 1408, 1408, 64]
    - [95, 6974.0]
  - - [2944, 64, 1, 256, 2944, 2944, 2944, 64]
    - [74, 5729.0]
  - - [1024, 256, 1, 3328, 1024, 1024, 1024, 256]
    - [102, 11077.0]
  - - [1856, 64, 1, 1280, 1856, 1856, 1856, 64]
    - [109, 8933.0]
  - - [704, 128, 1, 1280, 704, 704, 704, 128]
    - [78, 6155.0]
  - - [4288, 64, 1, 3328, 4288, 4288, 4288, 64]
    - [66, 11748.0]
  - - [1856, 128, 1, 256, 1856, 1856, 1856, 128]
    - [86, 8840.0]
  - - [2944, 64, 1, 1280, 2944, 2944, 2944, 64]
    - [78, 9966.0]
  - - [64, 3584, 1, 3328, 64, 64, 64, 3584]
    - [107, 11496.0]
  - - [1024, 256, 1, 256, 1024, 1024, 1024, 256]
    - [60, 6820.0]
  - - [448, 448, 1, 256, 448, 448, 448, 448]
    - [91, 6375.0]
  - - [128, 1024, 1, 3328, 128, 128, 128, 1024]
    - [72, 9811.0]
  - - [64, 1856, 1, 1280, 64, 64, 64, 1856]
    - [112, 8590.0]
  - - [1024, 128, 1, 1280, 1024, 1024, 1024, 128]
    - [103, 8176.0]
  - - [448, 256, 1, 3328, 448, 448, 448, 256]
    - [88, 9233.0]
  - - [128, 704, 1, 1280, 128, 128, 128, 704]
    - [105, 6817.0]
  - - [1856, 128, 1, 3328, 1856, 1856, 1856, 128]
    - [83, 12277.0]
  - - [256, 448, 1, 256, 256, 256, 256, 448]
    - [100, 4813.0]
  - - [256, 1024, 1, 256, 256, 256, 256, 1024]
    - [60, 8604.0]
  - - [448, 448, 1, 3328, 448, 448, 448, 448]
    - [102, 12216.0]
  - - [1408, 128, 1, 1280, 1408, 1408, 1408, 128]
    - [109, 10720.0]
  - - [128, 1856, 1, 1280, 128, 128, 128, 1856]
    - [75, 11678.0]
  - - [64, 1408, 1, 3328, 64, 64, 64, 1408]
    - [112, 7383.0]
  - - [256, 448, 1, 3328, 256, 256, 256, 448]
    - [81, 9697.0]
  - - [64, 2368, 1, 1280, 64, 64, 64, 2368]
    - [115, 10125.0]
  - - [2368, 64, 1, 256, 2368, 2368, 2368, 64]
    - [66, 6712.0]
  - - [4288, 64, 1, 1280, 4288, 4288, 4288, 64]
    - [111, 11555.0]
  - - [128, 1024, 1, 1280, 128, 128, 128, 1024]
    - [103, 8074.0]
  - - [1856, 64, 1, 256, 1856, 1856, 1856, 64]
    - [96, 4420.0]
  - - [704, 128, 1, 256, 704, 704, 704, 128]
    - [108, 3160.0]
  - - [448, 256, 1, 1280, 448, 448, 448, 256]
    - [66, 7630.0]
  - - [1856, 128, 1, 1280, 1856, 1856, 1856, 128]
    - [62, 10938.0]
  - - [64, 3584, 1, 256, 64, 64, 64, 3584]
    - [99, 8843.0]
  - - [64, 1856, 1, 256, 64, 64, 64, 1856]
    - [68, 3949.0]
  - - [256, 1024, 1, 1280, 256, 256, 256, 1024]
    - [114, 10525.0]
  - - [3584, 64, 1, 1280, 3584, 3584, 3584, 64]
    - [78, 11301.0]
  - - [1408, 128, 1, 3328, 1408, 1408, 1408, 128]
    - [64, 11317.0]
  - - [64, 4288, 1, 3328, 64, 64, 64, 4288]
    - [70, 11354.0]
  - - [256, 704, 1, 256, 256, 256, 256, 704]
    - [111, 5532.0]
  - - [128, 1024, 1, 256, 128, 128, 128, 1024]
    - [68, 4474.0]
  - - [64, 2944, 1, 256, 64, 64, 64, 2944]
    - [75, 5661.0]
  - - [64, 1408, 1, 1280, 64, 64, 64, 1408]
    - [68, 6317.0]
  - - [704, 128, 1, 3328, 704, 704, 704, 128]
    - [88, 7293.0]
  - - [1408, 128, 1, 256, 1408, 1408, 1408, 128]
    - [60, 5402.0]
  - - [64, 2944, 1, 1280, 64, 64, 64, 2944]
    - [86, 9740.0]
  - - [704, 256, 1, 1280, 704, 704, 704, 256]
    - [84, 10030.0]
  - - [256, 448, 1, 1280, 256, 256, 256, 448]
    - [102, 7694.0]
  - - [64, 2368, 1, 3328, 64, 64, 64, 2368]
    - [68, 10763.0]
  - - [256, 704, 1, 3328, 256, 256, 256, 704]
    - [84, 11291.0]
  - - [64, 2944, 1, 3328, 64, 64, 64, 2944]
    - [66, 11013.0]
  - - [128, 1408, 1, 256, 128, 128, 128, 1408]
    - [91, 5532.0]
  - - [128, 1408, 1, 3328, 128, 128, 128, 1408]
    - [86, 10612.0]
  - - [1408, 64, 1, 256, 1408, 1408, 1408, 64]
    - [65, 3231.0]
  - - [64, 2368, 1, 256, 64, 64, 64, 2368]
    - [103, 5078.0]
  - - [1024, 128, 1, 3328, 1024, 1024, 1024, 128]
    - [93, 9617.0]
  - - [2368, 64, 1, 1280, 2368, 2368, 2368, 64]
    - [77, 9463.0]
  - - [4288, 64, 1, 256, 4288, 4288, 4288, 64]
    - [73, 7395.0]
  - - [64, 4288, 1, 1280, 64, 64, 64, 4288]
    - [86, 10523.0]
  - - [1408, 64, 1, 3328, 1408, 1408, 1408, 64]
    - [95, 7717.0]
  - - [448, 448, 1, 1280, 448, 448, 448, 448]
    - [66, 10426.0]
  - - [1024, 256, 1, 1280, 1024, 1024, 1024, 256]
    - [86, 10866.0]
  - - [3584, 64, 1, 3328, 3584, 3584, 3584, 64]
    - [115, 11809.0]
  - - [256, 1024, 1, 3328, 256, 256, 256, 1024]
    - [102, 11357.0]
  - - [1856, 64, 1, 3328, 1856, 1856, 1856, 64]
    - [66, 9553.0]
  - - [448, 256, 1, 256, 448, 448, 448, 256]
    - [108, 3894.0]
  - - [128, 704, 1, 256, 128, 128, 128, 704]
    - [92, 3373.0]
  - - [1024, 128, 1, 256, 1024, 1024, 1024, 128]
    - [85, 5008.0]
  - - [64, 3584, 1, 1280, 64, 64, 64, 3584]
    - [68, 10389.0]
  - - [3584, 64, 1, 256, 3584, 3584, 3584, 64]
    - [62, 6496.0]
  - - [64, 1856, 1, 3328, 64, 64, 64, 1856]
    - [70, 9521.0]
  - - [2944, 64, 1, 3328, 2944, 2944, 2944, 64]
    - [111, 11142.0]
  - - [128, 704, 1, 3328, 128, 128, 128, 704]
    - [112, 7475.0]
  - - [128, 1856, 1, 256, 128, 128, 128, 1856]
    - [62, 6833.0]
  - - [64, 4288, 1, 256, 64, 64, 64, 4288]
    - [98, 7125.0]
  - - [704, 256, 1, 3328, 704, 704, 704, 256]
    - [81, 11005.0]
  - - [256, 704, 1, 1280, 256, 256, 256, 704]
    - [93, 9644.0]
  - - [64, 1408, 1, 256, 64, 64, 64, 1408]
    - [90, 4076.0]
  - - [128, 1408, 1, 1280, 128, 128, 128, 1408]
    - [100, 9850.0]
  - - [128, 1856, 1, 3328, 128, 128, 128, 1856]
    - [62, 11907.0]
  - - [704, 256, 1, 256, 704, 704, 704, 256]
    - [70, 6373.0]
  - - [448, 64, 1, 1280, 448, 448, 448, 64]
    - [71, 3449.0]
  - - [64, 1024, 1, 1280, 64, 64, 64, 1024]
    - [85, 5715.0]
  - - [64, 704, 1, 1280, 64, 64, 64, 704]
    - [69, 4044.0]
  - - [64, 64, 1, 1280, 64, 64, 64, 64]
    - [71, 417.0]
  - - [128, 448, 1, 256, 128, 128, 128, 448]
    - [102, 2659.0]
  - - [256, 256, 1, 3328, 256, 256, 256, 256]
    - [72, 6133.0]
  - - [64, 448, 1, 1280, 64, 64, 64, 448]
    - [89, 2827.0]
  - - [64, 64, 1, 3328, 64, 64, 64, 64]
    - [106, 539.0]
  - - [256, 64, 1, 1280, 256, 256, 256, 64]
    - [89, 1662.0]
  - - [128, 448, 1, 1280, 128, 128, 128, 448]
    - [67, 4772.0]
  - - [704, 64, 1, 1280, 704, 704, 704, 64]
    - [63, 4234.0]
  - - [512, 32, 1, 512, 512, 512, 512, 32]
    - [97, 1059.0]
  - - [448, 64, 1, 3328, 448, 448, 448, 64]
    - [89, 3545.0]
  - - [64, 128, 1, 3328, 64, 64, 64, 128]
    - [89, 1078.0]
  - - [128, 128, 1, 3328, 128, 128, 128, 128]
    - [106, 2148.0]
  - - [256, 128, 1, 256, 256, 256, 256, 128]
    - [67, 1407.0]
  - - [64, 448, 1, 3328, 64, 64, 64, 448]
    - [89, 3550.0]
  - - [256, 64, 1, 256, 256, 256, 256, 64]
    - [65, 701.0]
  - - [256, 128, 1, 1280, 256, 256, 256, 128]
    - [110, 3507.0]
  - - [128, 64, 1, 1280, 128, 128, 128, 64]
    - [71, 828.0]
  - - [64, 1024, 1, 256, 64, 64, 64, 1024]
    - [94, 3813.0]
  - - [64, 704, 1, 256, 64, 64, 64, 704]
    - [94, 1885.0]
  - - [704, 64, 1, 3328, 704, 704, 704, 64]
    - [104, 5351.0]
  - - [512, 16, 1, 512, 512, 512, 512, 16]
    - [87, 718.0]
  - - [448, 128, 1, 256, 448, 448, 448, 128]
    - [61, 2669.0]
  - - [256, 256, 1, 256, 256, 256, 256, 256]
    - [94, 3938.0]
  - - [448, 128, 1, 3328, 448, 448, 448, 128]
    - [69, 6035.0]
  - - [128, 256, 1, 1280, 128, 128, 128, 256]
    - [89, 3905.0]
  - - [64, 256, 1, 1280, 64, 64, 64, 256]
    - [89, 1649.0]
  - - [1024, 32, 1, 512, 1024, 1024, 1024, 32]
    - [106, 2173.0]
  - - [64, 448, 1, 256, 64, 64, 64, 448]
    - [110, 1215.0]
  - - [64, 64, 1, 256, 64, 64, 64, 64]
    - [76, 172.0]
  - - [128, 256, 1, 3328, 128, 128, 128, 256]
    - [71, 4042.0]
  - - [64, 128, 1, 1280, 64, 64, 64, 128]
    - [82, 835.0]
  - - [128, 128, 1, 1280, 128, 128, 128, 128]
    - [71, 1651.0]
  - - [128, 256, 1, 256, 128, 128, 128, 256]
    - [76, 1403.0]
  - - [64, 128, 1, 256, 64, 64, 64, 128]
    - [79, 343.0]
  - - [704, 64, 1, 256, 704, 704, 704, 64]
    - [67, 1903.0]
  - - [128, 64, 1, 3328, 128, 128, 128, 64]
    - [89, 1073.0]
  - - [448, 64, 1, 256, 448, 448, 448, 64]
    - [113, 1764.0]
  - - [1024, 16, 1, 512, 1024, 1024, 1024, 16]
    - [80, 1461.0]
  - - [1024, 64, 1, 256, 1024, 1024, 1024, 64]
    - [101, 2519.0]
  - - [128, 64, 1, 256, 128, 128, 128, 64]
    - [92, 348.0]
  - - [1024, 64, 1, 1280, 1024, 1024, 1024, 64]
    - [89, 5078.0]
  - - [64, 1024, 1, 3328, 64, 64, 64, 1024]
    - [105, 6242.0]
  - - [448, 128, 1, 1280, 448, 448, 448, 128]
    - [65, 5544.0]
  - - [1024, 64, 1, 3328, 1024, 1024, 1024, 64]
    - [72, 6103.0]
  - - [64, 256, 1, 3328, 64, 64, 64, 256]
    - [89, 2125.0]
  - - [256, 256, 1, 1280, 256, 256, 256, 256]
    - [68, 4900.0]
  - - [256, 128, 1, 3328, 256, 256, 256, 128]
    - [71, 4075.0]
  - - [64, 256, 1, 256, 64, 64, 64, 256]
    - [67, 697.0]
  - - [64, 704, 1, 3328, 64, 64, 64, 704]
    - [69, 4962.0]
  - - [128, 448, 1, 3328, 128, 128, 128, 448]
    - [85, 5646.0]
  - - [256, 64, 1, 3328, 256, 256, 256, 64]
    - [89, 2135.0]
  - - [128, 128, 1, 256, 128, 128, 128, 128]
    - [59, 788.0]
- null
- null
- DeviceEfficiency
...
