library/src/blas3/Tensile/Logic/asm_full/navi22_Cijk_Ailk_Bjlk_SB.yaml
---
- {MinimumRequiredVersion: 4.28.0}
- navi22
- gfx1031
    SolutionIndex: 0
    SolutionNameMin: Cijk_Ailk_Bjlk_SB_MT128x64x8_SN_SU0_SUM0_TT8_8_WG16_8_1_WGM1
    SolutionIndex: 1
    SolutionNameMin: Cijk_Ailk_Bjlk_SB_MT128x128x8_SN_SU0_SUM0_TT8_16_WG16_8_1_WGM1
    SolutionIndex: 2
    SolutionNameMin: Cijk_Ailk_Bjlk_SB_MT128x128x8_SN_SU0_SUM0_TT8_8_WG16_16_1_WGM1
    SolutionIndex: 3
    SolutionNameMin: Cijk_Ailk_Bjlk_SB_MT128x64x16_SN_SU0_SUM0_TT8_8_WG16_8_1_WGM1
    SolutionIndex: 4
    SolutionNameMin: Cijk_Ailk_Bjlk_SB_MT128x128x16_SN_SU0_SUM0_TT8_16_WG16_8_1_WGM1
    SolutionIndex: 5
    SolutionNameMin: Cijk_Ailk_Bjlk_SB_MT128x128x16_SN_SU0_SUM0_TT8_8_WG16_16_1_WGM1
    SolutionIndex: 6
    SolutionNameMin: Cijk_Ailk_Bjlk_SB_MT128x256x16_SN_SU0_SUM0_TT8_16_WG16_16_1_WGM1
    SolutionIndex: 7
    SolutionNameMin: Cijk_Ailk_Bjlk_SB_MT128x64x32_SN_SU0_SUM0_TT8_8_WG16_8_1_WGM1
    SolutionIndex: 8
    SolutionNameMin: Cijk_Ailk_Bjlk_SB_MT128x64x8_SN_SU32_SUM3_TT8_8_WG16_8_1_WGM1
    SolutionIndex: 9
    SolutionNameMin: Cijk_Ailk_Bjlk_SB_MT128x128x8_SN_SU32_SUM3_TT8_16_WG16_8_1_WGM1
    SolutionIndex: 10
    SolutionNameMin: Cijk_Ailk_Bjlk_SB_MT128x64x16_SN_SU32_SUM3_TT8_8_WG16_8_1_WGM1
    SolutionIndex: 11
    SolutionNameMin: Cijk_Ailk_Bjlk_SB_MT128x128x16_SN_SU32_SUM3_TT8_16_WG16_8_1_WGM1
    SolutionIndex: 12
    SolutionNameMin: Cijk_Ailk_Bjlk_SB_MT128x128x16_SN_SU32_SUM3_TT8_8_WG16_16_1_WGM1
    SolutionIndex: 13
    SolutionNameMin: Cijk_Ailk_Bjlk_SB_MT128x128x32_SN_SU32_SUM3_TT8_8_WG16_16_1_WGM1
    SolutionIndex: 14
    SolutionNameMin: Cijk_Ailk_Bjlk_SB_MT128x64x8_SN_SU0_SUM0_TT8_8_WG16_8_1_WGM4
    SolutionIndex: 15
    SolutionNameMin: Cijk_Ailk_Bjlk_SB_MT128x128x8_SN_SU0_SUM0_TT8_16_WG16_8_1_WGM4
    SolutionIndex: 16
    SolutionNameMin: Cijk_Ailk_Bjlk_SB_MT128x64x16_SN_SU0_SUM0_TT8_8_WG16_8_1_WGM4
    SolutionIndex: 17
    SolutionNameMin: Cijk_Ailk_Bjlk_SB_MT128x128x16_SN_SU0_SUM0_TT8_16_WG16_8_1_WGM4
    SolutionIndex: 18
    SolutionNameMin: Cijk_Ailk_Bjlk_SB_MT128x128x16_SN_SU0_SUM0_TT8_8_WG16_16_1_WGM4
    SolutionIndex: 19
    SolutionNameMin: Cijk_Ailk_Bjlk_SB_MT128x256x16_SN_SU0_SUM0_TT8_16_WG16_16_1_WGM4
    SolutionIndex: 20
    SolutionNameMin: Cijk_Ailk_Bjlk_SB_MT128x64x8_SN_SU32_SUM3_TT8_8_WG16_8_1_WGM4
    SolutionIndex: 21
    SolutionNameMin: Cijk_Ailk_Bjlk_SB_MT128x128x8_SN_SU32_SUM3_TT8_16_WG16_8_1_WGM4
    SolutionIndex: 22
    SolutionNameMin: Cijk_Ailk_Bjlk_SB_MT128x128x8_SN_SU32_SUM3_TT8_8_WG16_16_1_WGM4
    SolutionIndex: 23
    SolutionNameMin: Cijk_Ailk_Bjlk_SB_MT128x128x16_SN_SU32_SUM3_TT8_16_WG16_8_1_WGM4
    SolutionIndex: 24
    SolutionNameMin: Cijk_Ailk_Bjlk_SB_MT128x128x16_SN_SU32_SUM3_TT8_8_WG16_16_1_WGM4
    SolutionIndex: 25
    SolutionNameMin: Cijk_Ailk_Bjlk_SB_MT128x64x8_SN_SU0_SUM0_TT8_8_WG16_8_1_WGM8
    SolutionIndex: 26
    SolutionNameMin: Cijk_Ailk_Bjlk_SB_MT128x128x8_SN_SU0_SUM0_TT8_16_WG16_8_1_WGM8
    SolutionIndex: 27
    SolutionNameMin: Cijk_Ailk_Bjlk_SB_MT128x128x8_SN_SU0_SUM0_TT8_8_WG16_16_1_WGM8
    SolutionIndex: 28
    SolutionNameMin: Cijk_Ailk_Bjlk_SB_MT128x64x16_SN_SU0_SUM0_TT8_8_WG16_8_1_WGM8
    SolutionIndex: 29
    SolutionNameMin: Cijk_Ailk_Bjlk_SB_MT128x128x16_SN_SU0_SUM0_TT8_16_WG16_8_1_WGM8
    SolutionIndex: 30
    SolutionNameMin: Cijk_Ailk_Bjlk_SB_MT128x128x16_SN_SU0_SUM0_TT8_8_WG16_16_1_WGM8
    SolutionIndex: 31
    SolutionNameMin: Cijk_Ailk_Bjlk_SB_MT128x64x8_SN_SU32_SUM3_TT8_8_WG16_8_1_WGM8
    SolutionIndex: 32
    SolutionNameMin: Cijk_Ailk_Bjlk_SB_MT128x128x8_SN_SU32_SUM3_TT8_16_WG16_8_1_WGM8
    SolutionIndex: 33
    SolutionNameMin: Cijk_Ailk_Bjlk_SB_MT128x128x8_SN_SU32_SUM3_TT8_8_WG16_16_1_WGM8
    SolutionIndex: 34
    SolutionNameMin: Cijk_Ailk_Bjlk_SB_MT128x64x16_SN_SU32_SUM3_TT8_8_WG16_8_1_WGM8
    SolutionIndex: 35
    SolutionNameMin: Cijk_Ailk_Bjlk_SB_MT128x128x16_SN_SU32_SUM3_TT8_16_WG16_8_1_WGM8
    SolutionIndex: 36
    SolutionNameMin: Cijk_Ailk_Bjlk_SB_MT128x128x16_SN_SU32_SUM3_TT8_8_WG16_16_1_WGM8
    SolutionIndex: 37
    SolutionNameMin: Cijk_Ailk_Bjlk_SB_MT128x128x8_SN_SU0_SUM0_TT8_16_WG16_8_1_WGM1
    SolutionIndex: 38
    SolutionNameMin: Cijk_Ailk_Bjlk_SB_MT128x64x16_SN_SU0_SUM0_TT8_8_WG16_8_1_WGM1
    SolutionIndex: 39
    SolutionNameMin: Cijk_Ailk_Bjlk_SB_MT128x128x16_SN_SU0_SUM0_TT8_16_WG16_8_1_WGM1
    SolutionIndex: 40
    SolutionNameMin: Cijk_Ailk_Bjlk_SB_MT128x64x8_SN_SU0_SUM0_TT8_8_WG16_8_1_WGM4
    SolutionIndex: 41
    SolutionNameMin: Cijk_Ailk_Bjlk_SB_MT128x128x8_SN_SU0_SUM0_TT8_16_WG16_8_1_WGM4
    SolutionIndex: 42
    SolutionNameMin: Cijk_Ailk_Bjlk_SB_MT128x64x16_SN_SU0_SUM0_TT8_8_WG16_8_1_WGM4
    SolutionIndex: 43
    SolutionNameMin: Cijk_Ailk_Bjlk_SB_MT128x128x16_SN_SU0_SUM0_TT8_16_WG16_8_1_WGM4
    SolutionIndex: 44
    SolutionNameMin: Cijk_Ailk_Bjlk_SB_MT128x128x16_SN_SU0_SUM0_TT8_8_WG16_16_1_WGM4
    SolutionIndex: 45
    SolutionNameMin: Cijk_Ailk_Bjlk_SB_MT128x64x16_SN_SU0_SUM0_TT8_8_WG16_8_1_WGM8
    SolutionIndex: 46
    SolutionNameMin: Cijk_Ailk_Bjlk_SB_MT128x128x32_SN_SU32_SUM3_TT8_8_WG16_16_1_WGM8
    SolutionIndex: 47
    SolutionNameMin: Cijk_Ailk_Bjlk_SB_MT32x32x8_SN_SU0_SUM0_TT4_4_WG8_8_1_WGM1
    SolutionIndex: 48
    SolutionNameMin: Cijk_Ailk_Bjlk_SB_MT32x64x8_SN_SU0_SUM0_TT4_8_WG8_8_1_WGM1
    SolutionIndex: 49
    SolutionNameMin: Cijk_Ailk_Bjlk_SB_MT64x64x8_SN_SU0_SUM0_TT8_8_WG8_8_1_WGM1
    SolutionIndex: 50
    SolutionNameMin: Cijk_Ailk_Bjlk_SB_MT64x64x8_SN_SU0_SUM0_TT4_8_WG16_8_1_WGM1
    SolutionIndex: 51
    SolutionNameMin: Cijk_Ailk_Bjlk_SB_MT128x64x8_SN_SU0_SUM0_TT8_8_WG16_8_1_WGM1
    SolutionIndex: 52
    SolutionNameMin: Cijk_Ailk_Bjlk_SB_MT128x128x8_SN_SU0_SUM0_TT8_8_WG16_16_1_WGM1
    SolutionIndex: 53
    SolutionNameMin: Cijk_Ailk_Bjlk_SB_MT64x64x16_SN_SU0_SUM0_TT8_8_WG8_8_1_WGM1
    SolutionIndex: 54
    SolutionNameMin: Cijk_Ailk_Bjlk_SB_MT64x64x16_SN_SU0_SUM0_TT4_8_WG16_8_1_WGM1
    SolutionIndex: 55
    SolutionNameMin: Cijk_Ailk_Bjlk_SB_MT128x64x16_SN_SU0_SUM0_TT8_8_WG16_8_1_WGM1
    SolutionIndex: 57
    SolutionNameMin: Cijk_Ailk_Bjlk_SB_MT128x128x16_SN_SU0_SUM0_TT8_8_WG16_16_1_WGM1
    SolutionIndex: 58
    SolutionNameMin: Cijk_Ailk_Bjlk_SB_MT64x32x32_SN_SU0_SUM0_TT4_4_WG16_8_1_WGM1
    SolutionIndex: 59
    SolutionNameMin: Cijk_Ailk_Bjlk_SB_MT128x128x32_SN_SU0_SUM0_TT8_8_WG16_16_1_WGM1
    SolutionIndex: 60
    SolutionNameMin: Cijk_Ailk_Bjlk_SB_MT32x32x8_SN_SU32_SUM3_TT4_4_WG8_8_1_WGM1
    SolutionIndex: 61
    SolutionNameMin: Cijk_Ailk_Bjlk_SB_MT64x64x8_SN_SU32_SUM3_TT8_8_WG8_8_1_WGM1
    SolutionIndex: 62
    SolutionNameMin: Cijk_Ailk_Bjlk_SB_MT64x64x8_SN_SU32_SUM3_TT4_8_WG16_8_1_WGM1
    SolutionIndex: 63
    SolutionNameMin: Cijk_Ailk_Bjlk_SB_MT128x64x8_SN_SU32_SUM3_TT8_8_WG16_8_1_WGM1
    SolutionIndex: 64
    SolutionNameMin: Cijk_Ailk_Bjlk_SB_MT128x128x8_SN_SU32_SUM3_TT8_8_WG16_16_1_WGM1
    SolutionIndex: 65
    SolutionNameMin: Cijk_Ailk_Bjlk_SB_MT64x64x16_SN_SU32_SUM3_TT8_8_WG8_8_1_WGM1
    SolutionIndex: 66
    SolutionNameMin: Cijk_Ailk_Bjlk_SB_MT128x64x16_SN_SU32_SUM3_TT8_8_WG16_8_1_WGM1
    SolutionIndex: 68
    SolutionNameMin: Cijk_Ailk_Bjlk_SB_MT128x128x16_SN_SU32_SUM3_TT8_8_WG16_16_1_WGM1
    SolutionIndex: 69
    SolutionNameMin: Cijk_Ailk_Bjlk_SB_MT32x32x8_SN_SU0_SUM0_TT4_4_WG8_8_1_WGM4
    SolutionIndex: 70
    SolutionNameMin: Cijk_Ailk_Bjlk_SB_MT32x64x8_SN_SU0_SUM0_TT4_8_WG8_8_1_WGM4
    SolutionIndex: 71
    SolutionNameMin: Cijk_Ailk_Bjlk_SB_MT64x64x8_SN_SU0_SUM0_TT8_8_WG8_8_1_WGM4
    SolutionIndex: 72
    SolutionNameMin: Cijk_Ailk_Bjlk_SB_MT64x64x8_SN_SU0_SUM0_TT4_8_WG16_8_1_WGM4
    SolutionIndex: 73
    SolutionNameMin: Cijk_Ailk_Bjlk_SB_MT128x64x8_SN_SU0_SUM0_TT8_8_WG16_8_1_WGM4
    SolutionIndex: 74
    SolutionNameMin: Cijk_Ailk_Bjlk_SB_MT128x128x8_SN_SU0_SUM0_TT8_8_WG16_16_1_WGM4
    SolutionIndex: 75
    SolutionNameMin: Cijk_Ailk_Bjlk_SB_MT64x64x16_SN_SU0_SUM0_TT8_8_WG8_8_1_WGM4
    SolutionIndex: 76
    SolutionNameMin: Cijk_Ailk_Bjlk_SB_MT64x64x16_SN_SU0_SUM0_TT4_8_WG16_8_1_WGM4
    SolutionIndex: 77
    SolutionNameMin: Cijk_Ailk_Bjlk_SB_MT128x64x16_SN_SU0_SUM0_TT8_8_WG16_8_1_WGM4
    SolutionIndex: 78
    SolutionNameMin: Cijk_Ailk_Bjlk_SB_MT64x64x16_SN_SU0_SUM0_TT4_4_WG16_16_1_WGM4
    SolutionIndex: 79
    SolutionNameMin: Cijk_Ailk_Bjlk_SB_MT128x128x16_SN_SU0_SUM0_TT8_8_WG16_16_1_WGM4
    SolutionIndex: 80
    SolutionNameMin: Cijk_Ailk_Bjlk_SB_MT64x32x32_SN_SU0_SUM0_TT4_4_WG16_8_1_WGM4
    SolutionIndex: 81
    SolutionNameMin: Cijk_Ailk_Bjlk_SB_MT64x64x32_SN_SU0_SUM0_TT4_4_WG16_16_1_WGM4
    SolutionIndex: 82
    SolutionNameMin: Cijk_Ailk_Bjlk_SB_MT128x128x32_SN_SU0_SUM0_TT8_8_WG16_16_1_WGM4
    SolutionIndex: 83
    SolutionNameMin: Cijk_Ailk_Bjlk_SB_MT32x32x8_SN_SU32_SUM3_TT4_4_WG8_8_1_WGM4
    SolutionIndex: 84
    SolutionNameMin: Cijk_Ailk_Bjlk_SB_MT64x64x8_SN_SU32_SUM3_TT8_8_WG8_8_1_WGM4
    SolutionIndex: 85
    SolutionNameMin: Cijk_Ailk_Bjlk_SB_MT64x64x8_SN_SU32_SUM3_TT4_8_WG16_8_1_WGM4
    SolutionIndex: 86
    SolutionNameMin: Cijk_Ailk_Bjlk_SB_MT128x64x8_SN_SU32_SUM3_TT8_8_WG16_8_1_WGM4
    SolutionIndex: 87
    SolutionNameMin: Cijk_Ailk_Bjlk_SB_MT64x64x16_SN_SU32_SUM3_TT8_8_WG8_8_1_WGM4
    SolutionIndex: 88
    SolutionNameMin: Cijk_Ailk_Bjlk_SB_MT128x128x16_SN_SU32_SUM3_TT8_8_WG16_16_1_WGM4
    SolutionIndex: 89
    SolutionNameMin: Cijk_Ailk_Bjlk_SB_MT64x64x32_SN_SU32_SUM3_TT8_8_WG8_8_1_WGM4
    SolutionIndex: 90
    SolutionNameMin: Cijk_Ailk_Bjlk_SB_MT32x32x8_SN_SU0_SUM0_TT4_4_WG8_8_1_WGM8
    SolutionIndex: 91
    SolutionNameMin: Cijk_Ailk_Bjlk_SB_MT64x64x8_SN_SU0_SUM0_TT8_8_WG8_8_1_WGM8
    SolutionIndex: 92
    SolutionNameMin: Cijk_Ailk_Bjlk_SB_MT128x64x8_SN_SU0_SUM0_TT8_8_WG16_8_1_WGM8
    SolutionIndex: 93
    SolutionNameMin: Cijk_Ailk_Bjlk_SB_MT128x128x8_SN_SU0_SUM0_TT8_8_WG16_16_1_WGM8
    SolutionIndex: 94
    SolutionNameMin: Cijk_Ailk_Bjlk_SB_MT32x64x16_SN_SU0_SUM0_TT4_8_WG8_8_1_WGM8
    SolutionIndex: 95
    SolutionNameMin: Cijk_Ailk_Bjlk_SB_MT64x64x16_SN_SU0_SUM0_TT8_8_WG8_8_1_WGM8
    SolutionIndex: 96
    SolutionNameMin: Cijk_Ailk_Bjlk_SB_MT128x64x16_SN_SU0_SUM0_TT8_8_WG16_8_1_WGM8
    SolutionIndex: 97
    SolutionNameMin: Cijk_Ailk_Bjlk_SB_MT64x64x16_SN_SU0_SUM0_TT4_4_WG16_16_1_WGM8
    SolutionIndex: 98
    SolutionNameMin: Cijk_Ailk_Bjlk_SB_MT128x128x16_SN_SU0_SUM0_TT8_8_WG16_16_1_WGM8
    SolutionIndex: 99
    SolutionNameMin: Cijk_Ailk_Bjlk_SB_MT64x64x32_SN_SU0_SUM0_TT8_8_WG8_8_1_WGM8
    SolutionIndex: 100
    SolutionNameMin: Cijk_Ailk_Bjlk_SB_MT64x32x32_SN_SU0_SUM0_TT4_4_WG16_8_1_WGM8
    SolutionIndex: 101
    SolutionNameMin: Cijk_Ailk_Bjlk_SB_MT64x64x32_SN_SU0_SUM0_TT4_4_WG16_16_1_WGM8
    SolutionIndex: 102
    SolutionNameMin: Cijk_Ailk_Bjlk_SB_MT128x128x32_SN_SU0_SUM0_TT8_8_WG16_16_1_WGM8
    SolutionIndex: 103
    SolutionNameMin: Cijk_Ailk_Bjlk_SB_MT32x64x8_SN_SU32_SUM3_TT4_8_WG8_8_1_WGM8
    SolutionIndex: 104
    SolutionNameMin: Cijk_Ailk_Bjlk_SB_MT64x64x8_SN_SU32_SUM3_TT8_8_WG8_8_1_WGM8
    SolutionIndex: 105
    SolutionNameMin: Cijk_Ailk_Bjlk_SB_MT64x64x8_SN_SU32_SUM3_TT4_8_WG16_8_1_WGM8
    SolutionIndex: 106
    SolutionNameMin: Cijk_Ailk_Bjlk_SB_MT128x64x8_SN_SU32_SUM3_TT8_8_WG16_8_1_WGM8
    SolutionIndex: 107
    SolutionNameMin: Cijk_Ailk_Bjlk_SB_MT128x128x8_SN_SU32_SUM3_TT8_8_WG16_16_1_WGM8
    SolutionIndex: 108
    SolutionNameMin: Cijk_Ailk_Bjlk_SB_MT64x64x16_SN_SU32_SUM3_TT8_8_WG8_8_1_WGM8
    SolutionIndex: 109
    SolutionNameMin: Cijk_Ailk_Bjlk_SB_MT128x64x16_SN_SU32_SUM3_TT8_8_WG16_8_1_WGM8
    SolutionIndex: 110
    SolutionNameMin: Cijk_Ailk_Bjlk_SB_MT128x128x16_SN_SU32_SUM3_TT8_8_WG16_16_1_WGM8
    SolutionIndex: 111
    SolutionNameMin: Cijk_Ailk_Bjlk_SB_MT128x128x32_SN_SU32_SUM3_TT8_8_WG16_16_1_WGM8
- - - [2048, 2048, 1, 512, 2048, 2048, 2048, 2048]
    - [1, 11945.0]
  - - [1600, 1024, 1, 512, 1600, 1600, 1600, 1024]
    - [0, 10421.0]
  - - [4096, 1024, 1, 4096, 4096, 4096, 4096, 1024]
    - [4, 12365.0]
  - - [4096, 1024, 1, 2048, 4096, 4096, 4096, 1024]
    - [1, 12293.0]
  - - [3072, 768, 1, 4096, 3072, 3072, 3072, 768]
    - [3, 11482.0]
  - - [3072, 1024, 1, 2048, 3072, 3072, 3072, 1024]
    - [15, 11927.0]
  - - [3072, 1024, 1, 3072, 3072, 3072, 3072, 1024]
    - [1, 11968.0]
  - - [3072, 1024, 1, 512, 3072, 3072, 3072, 1024]
    - [15, 11627.0]
  - - [2944, 4288, 1, 1280, 2944, 2944, 2944, 4288]
    - [4, 12256.0]
  - - [2368, 5888, 1, 256, 2368, 2368, 2368, 5888]
    - [15, 11950.0]
  - - [5888, 1024, 1, 1280, 5888, 5888, 5888, 1024]
    - [4, 12195.0]
  - - [5888, 1856, 1, 3328, 5888, 5888, 5888, 1856]
    - [16, 12151.0]
  - - [5056, 704, 1, 256, 5056, 5056, 5056, 704]
    - [31, 11142.0]
  - - [5888, 2944, 1, 3328, 5888, 5888, 5888, 2944]
    - [17, 12768.0]
  - - [1856, 4288, 1, 256, 1856, 1856, 1856, 4288]
    - [0, 11325.0]
  - - [1024, 5056, 1, 128, 1024, 1024, 1024, 5056]
    - [25, 11418.0]
  - - [5056, 5056, 1, 3328, 5056, 5056, 5056, 5056]
    - [29, 12492.0]
  - - [1408, 5888, 1, 1280, 1408, 1408, 1408, 5888]
    - [17, 12316.0]
  - - [1024, 3584, 1, 3328, 1024, 1024, 1024, 3584]
    - [28, 11767.0]
  - - [5888, 1408, 1, 1280, 5888, 5888, 5888, 1408]
    - [4, 12307.0]
  - - [1024, 2368, 1, 256, 1024, 1024, 1024, 2368]
    - [25, 11328.0]
  - - [1408, 1856, 1, 1280, 1408, 1408, 1408, 1856]
    - [25, 11811.0]
  - - [5056, 5056, 1, 1280, 5056, 5056, 5056, 5056]
    - [17, 12453.0]
  - - [448, 5056, 1, 256, 448, 448, 448, 5056]
    - [0, 9765.0]
  - - [1856, 1408, 1, 128, 1856, 1856, 1856, 1408]
    - [8, 10192.0]
  - - [6784, 256, 1, 3328, 6784, 6784, 6784, 256]
    - [28, 11379.0]
  - - [6784, 4288, 1, 3328, 6784, 6784, 6784, 4288]
    - [4, 12520.0]
  - - [4288, 448, 1, 256, 4288, 4288, 4288, 448]
    - [0, 10738.0]
  - - [1856, 2368, 1, 3328, 1856, 1856, 1856, 2368]
    - [16, 11598.0]
  - - [4288, 2944, 1, 1280, 4288, 4288, 4288, 2944]
    - [1, 12241.0]
  - - [704, 5056, 1, 1280, 704, 704, 704, 5056]
    - [1, 11173.0]
  - - [2368, 704, 1, 3328, 2368, 2368, 2368, 704]
    - [16, 10924.0]
  - - [256, 5888, 1, 256, 256, 256, 256, 5888]
    - [30, 10312.0]
  - - [1856, 4288, 1, 3328, 1856, 1856, 1856, 4288]
    - [4, 11870.0]
  - - [5888, 1024, 1, 256, 5888, 5888, 5888, 1024]
    - [25, 11715.0]
  - - [448, 5056, 1, 3328, 448, 448, 448, 5056]
    - [6, 10648.0]
  - - [1408, 2944, 1, 256, 1408, 1408, 1408, 2944]
    - [30, 11664.0]
  - - [6784, 5056, 1, 3328, 6784, 6784, 6784, 5056]
    - [4, 12671.0]
  - - [5056, 5056, 1, 256, 5056, 5056, 5056, 5056]
    - [26, 12048.0]
  - - [1408, 6784, 1, 128, 1408, 1408, 1408, 6784]
    - [25, 11649.0]
  - - [704, 5056, 1, 128, 704, 704, 704, 5056]
    - [8, 9970.0]
  - - [2368, 2944, 1, 1280, 2368, 2368, 2368, 2944]
    - [1, 12193.0]
  - - [6784, 6784, 1, 1280, 6784, 6784, 6784, 6784]
    - [17, 12775.0]
  - - [1408, 4288, 1, 1280, 1408, 1408, 1408, 4288]
    - [26, 12140.0]
  - - [3584, 4288, 1, 1280, 3584, 3584, 3584, 4288]
    - [17, 12448.0]
  - - [2368, 704, 1, 1280, 2368, 2368, 2368, 704]
    - [25, 10837.0]
  - - [5056, 4288, 1, 3328, 5056, 5056, 5056, 4288]
    - [17, 12462.0]
  - - [3584, 2368, 1, 3328, 3584, 3584, 3584, 2368]
    - [29, 12198.0]
  - - [6784, 448, 1, 1280, 6784, 6784, 6784, 448]
    - [25, 11643.0]
  - - [1408, 2944, 1, 128, 1408, 1408, 1408, 2944]
    - [30, 11332.0]
  - - [4288, 2944, 1, 256, 4288, 4288, 4288, 2944]
    - [1, 11933.0]
  - - [5888, 704, 1, 1280, 5888, 5888, 5888, 704]
    - [28, 11727.0]
  - - [448, 5888, 1, 128, 448, 448, 448, 5888]
    - [14, 9447.0]
  - - [5056, 2368, 1, 1280, 5056, 5056, 5056, 2368]
    - [29, 12190.0]
  - - [448, 3584, 1, 1280, 448, 448, 448, 3584]
    - [18, 9868.0]
  - - [6784, 5888, 1, 256, 6784, 6784, 6784, 5888]
    - [26, 12582.0]
  - - [5888, 2944, 1, 128, 5888, 5888, 5888, 2944]
    - [21, 11973.0]
  - - [1024, 1408, 1, 256, 1024, 1024, 1024, 1408]
    - [25, 10799.0]
  - - [2368, 2368, 1, 3328, 2368, 2368, 2368, 2368]
    - [3, 11565.0]
  - - [1856, 6784, 1, 128, 1856, 1856, 1856, 6784]
    - [18, 11429.0]
  - - [5056, 704, 1, 3328, 5056, 5056, 5056, 704]
    - [10, 11869.0]
  - - [1408, 1856, 1, 256, 1408, 1408, 1408, 1856]
    - [25, 11385.0]
  - - [2368, 5056, 1, 256, 2368, 2368, 2368, 5056]
    - [15, 11836.0]
  - - [5888, 1856, 1, 256, 5888, 5888, 5888, 1856]
    - [14, 11921.0]
  - - [704, 5888, 1, 256, 704, 704, 704, 5888]
    - [5, 10754.0]
  - - [2944, 6784, 1, 3328, 2944, 2944, 2944, 6784]
    - [17, 12795.0]
  - - [3584, 704, 1, 3328, 3584, 3584, 3584, 704]
    - [3, 11532.0]
  - - [448, 4288, 1, 256, 448, 448, 448, 4288]
    - [18, 9465.0]
  - - [704, 2368, 1, 1280, 704, 704, 704, 2368]
    - [30, 10197.0]
  - - [1856, 2368, 1, 1280, 1856, 1856, 1856, 2368]
    - [28, 11525.0]
  - - [1856, 4288, 1, 1280, 1856, 1856, 1856, 4288]
    - [15, 11821.0]
  - - [704, 2944, 1, 128, 704, 704, 704, 2944]
    - [0, 9394.0]
  - - [1408, 1024, 1, 1280, 1408, 1408, 1408, 1024]
    - [3, 11304.0]
  - - [704, 6784, 1, 256, 704, 704, 704, 6784]
    - [12, 10822.0]
  - - [6784, 704, 1, 256, 6784, 6784, 6784, 704]
    - [14, 11457.0]
  - - [5056, 1408, 1, 128, 5056, 5056, 5056, 1408]
    - [5, 11499.0]
  - - [3584, 4288, 1, 3328, 3584, 3584, 3584, 4288]
    - [17, 12491.0]
  - - [5888, 1856, 1, 1280, 5888, 5888, 5888, 1856]
    - [16, 12121.0]
  - - [5056, 1024, 1, 3328, 5056, 5056, 5056, 1024]
    - [1, 12417.0]
  - - [1024, 4288, 1, 128, 1024, 1024, 1024, 4288]
    - [14, 11263.0]
  - - [2368, 3584, 1, 1280, 2368, 2368, 2368, 3584]
    - [1, 12142.0]
  - - [2368, 6784, 1, 1280, 2368, 2368, 2368, 6784]
    - [15, 12247.0]
  - - [2944, 3584, 1, 3328, 2944, 2944, 2944, 3584]
    - [17, 12454.0]
  - - [6784, 2944, 1, 256, 6784, 6784, 6784, 2944]
    - [15, 12455.0]
  - - [4288, 2368, 1, 3328, 4288, 4288, 4288, 2368]
    - [16, 12002.0]
  - - [1856, 2368, 1, 256, 1856, 1856, 1856, 2368]
    - [20, 11146.0]
  - - [3584, 6784, 1, 3328, 3584, 3584, 3584, 6784]
    - [17, 12692.0]
  - - [1024, 5888, 1, 3328, 1024, 1024, 1024, 5888]
    - [4, 12272.0]
  - - [5056, 4288, 1, 1280, 5056, 5056, 5056, 4288]
    - [17, 12417.0]
  - - [2944, 5888, 1, 128, 2944, 2944, 2944, 5888]
    - [1, 12031.0]
  - - [704, 5888, 1, 1280, 704, 704, 704, 5888]
    - [15, 11276.0]
  - - [2368, 3584, 1, 128, 2368, 2368, 2368, 3584]
    - [12, 11323.0]
  - - [6784, 5888, 1, 3328, 6784, 6784, 6784, 5888]
    - [17, 12830.0]
  - - [1024, 5056, 1, 1280, 1024, 1024, 1024, 5056]
    - [15, 12291.0]
  - - [4288, 1024, 1, 256, 4288, 4288, 4288, 1024]
    - [30, 11218.0]
  - - [2944, 2368, 1, 128, 2944, 2944, 2944, 2368]
    - [25, 11586.0]
  - - [5888, 448, 1, 1280, 5888, 5888, 5888, 448]
    - [25, 11301.0]
  - - [704, 5888, 1, 3328, 704, 704, 704, 5888]
    - [26, 11349.0]
  - - [6784, 2368, 1, 1280, 6784, 6784, 6784, 2368]
    - [29, 12249.0]
  - - [3584, 2944, 1, 256, 3584, 3584, 3584, 2944]
    - [15, 12045.0]
  - - [2368, 1024, 1, 3328, 2368, 2368, 2368, 1024]
    - [1, 11451.0]
  - - [1408, 5056, 1, 3328, 1408, 1408, 1408, 5056]
    - [29, 12505.0]
  - - [1856, 1856, 1, 3328, 1856, 1856, 1856, 1856]
    - [16, 11499.0]
  - - [2368, 2368, 1, 256, 2368, 2368, 2368, 2368]
    - [25, 11250.0]
  - - [4288, 4288, 1, 1280, 4288, 4288, 4288, 4288]
    - [17, 12333.0]
  - - [1408, 4288, 1, 256, 1408, 1408, 1408, 4288]
    - [0, 11768.0]
  - - [5888, 448, 1, 128, 5888, 5888, 5888, 448]
    - [14, 10705.0]
  - - [704, 6784, 1, 3328, 704, 704, 704, 6784]
    - [4, 11460.0]
  - - [5888, 5888, 1, 1280, 5888, 5888, 5888, 5888]
    - [17, 12783.0]
  - - [5056, 1024, 1, 1280, 5056, 5056, 5056, 1024]
    - [1, 12312.0]
  - - [448, 5888, 1, 3328, 448, 448, 448, 5888]
    - [31, 10221.0]
  - - [1024, 2944, 1, 1280, 1024, 1024, 1024, 2944]
    - [25, 11646.0]
  - - [5056, 5888, 1, 1280, 5056, 5056, 5056, 5888]
    - [29, 12621.0]
  - - [4288, 5888, 1, 128, 4288, 4288, 4288, 5888]
    - [9, 11885.0]
  - - [1408, 3584, 1, 128, 1408, 1408, 1408, 3584]
    - [25, 11493.0]
  - - [448, 3584, 1, 128, 448, 448, 448, 3584]
    - [14, 8828.0]
  - - [5888, 2944, 1, 1280, 5888, 5888, 5888, 2944]
    - [17, 12729.0]
  - - [2368, 5888, 1, 128, 2368, 2368, 2368, 5888]
    - [5, 11574.0]
  - - [3584, 5888, 1, 256, 3584, 3584, 3584, 5888]
    - [17, 12399.0]
  - - [2368, 704, 1, 128, 2368, 2368, 2368, 704]
    - [0, 9595.0]
  - - [3584, 2944, 1, 1280, 3584, 3584, 3584, 2944]
    - [17, 12422.0]
  - - [3584, 2368, 1, 128, 3584, 3584, 3584, 2368]
    - [0, 11729.0]
  - - [5056, 704, 1, 128, 5056, 5056, 5056, 704]
    - [8, 10936.0]
  - - [5056, 1408, 1, 3328, 5056, 5056, 5056, 1408]
    - [17, 12503.0]
  - - [6784, 1024, 1, 3328, 6784, 6784, 6784, 1024]
    - [17, 12247.0]
  - - [6784, 2944, 1, 3328, 6784, 6784, 6784, 2944]
    - [17, 12799.0]
  - - [2944, 5056, 1, 3328, 2944, 2944, 2944, 5056]
    - [29, 12614.0]
  - - [1856, 1856, 1, 256, 1856, 1856, 1856, 1856]
    - [0, 11084.0]
  - - [1024, 5888, 1, 128, 1024, 1024, 1024, 5888]
    - [8, 11440.0]
  - - [2048, 7133, 1, 2048, 2048, 2048, 2048, 7133]
    - [17, 12628.0]
  - - [4288, 5888, 1, 1280, 4288, 4288, 4288, 5888]
    - [29, 12478.0]
  - - [4288, 4288, 1, 256, 4288, 4288, 4288, 4288]
    - [1, 12005.0]
  - - [4288, 1856, 1, 1280, 4288, 4288, 4288, 1856]
    - [28, 11808.0]
  - - [1856, 2944, 1, 3328, 1856, 1856, 1856, 2944]
    - [9, 11711.0]
  - - [256, 6784, 1, 3328, 256, 256, 256, 6784]
    - [28, 11398.0]
  - - [256, 5056, 1, 128, 256, 256, 256, 5056]
    - [20, 10078.0]
  - - [5056, 1024, 1, 256, 5056, 5056, 5056, 1024]
    - [24, 11823.0]
  - - [5056, 1856, 1, 3328, 5056, 5056, 5056, 1856]
    - [17, 12145.0]
  - - [1856, 1408, 1, 256, 1856, 1856, 1856, 1408]
    - [14, 10616.0]
  - - [4288, 1408, 1, 128, 4288, 4288, 4288, 1408]
    - [12, 11305.0]
  - - [4288, 5056, 1, 256, 4288, 4288, 4288, 5056]
    - [1, 12113.0]
  - - [5056, 256, 1, 3328, 5056, 5056, 5056, 256]
    - [12, 11896.0]
  - - [1024, 5888, 1, 1280, 1024, 1024, 1024, 5888]
    - [17, 12215.0]
  - - [6784, 2368, 1, 128, 6784, 6784, 6784, 2368]
    - [14, 11841.0]
  - - [5056, 3584, 1, 256, 5056, 5056, 5056, 3584]
    - [15, 12242.0]
  - - [1856, 1024, 1, 1280, 1856, 1856, 1856, 1024]
    - [12, 11621.0]
  - - [6784, 4288, 1, 1280, 6784, 6784, 6784, 4288]
    - [17, 12494.0]
  - - [1856, 1856, 1, 1280, 1856, 1856, 1856, 1856]
    - [28, 11409.0]
  - - [6784, 2944, 1, 128, 6784, 6784, 6784, 2944]
    - [26, 12093.0]
  - - [1408, 5056, 1, 1280, 1408, 1408, 1408, 5056]
    - [17, 12395.0]
  - - [5888, 1856, 1, 128, 5888, 5888, 5888, 1856]
    - [25, 11761.0]
  - - [2368, 1024, 1, 128, 2368, 2368, 2368, 1024]
    - [0, 10170.0]
  - - [5056, 3584, 1, 128, 5056, 5056, 5056, 3584]
    - [5, 11810.0]
  - - [5888, 5888, 1, 3328, 5888, 5888, 5888, 5888]
    - [17, 12811.0]
  - - [6784, 1024, 1, 256, 6784, 6784, 6784, 1024]
    - [1, 11737.0]
  - - [2944, 2368, 1, 256, 2944, 2944, 2944, 2368]
    - [25, 11726.0]
  - - [5056, 5888, 1, 3328, 5056, 5056, 5056, 5888]
    - [17, 12664.0]
  - - [1856, 1024, 1, 256, 1856, 1856, 1856, 1024]
    - [25, 10414.0]
  - - [3584, 448, 1, 1280, 3584, 3584, 3584, 448]
    - [3, 11418.0]
  - - [448, 5888, 1, 256, 448, 448, 448, 5888]
    - [31, 9801.0]
  - - [1408, 6784, 1, 3328, 1408, 1408, 1408, 6784]
    - [29, 12397.0]
  - - [4288, 704, 1, 128, 4288, 4288, 4288, 704]
    - [0, 10728.0]
  - - [5056, 2944, 1, 256, 5056, 5056, 5056, 2944]
    - [9, 12212.0]
  - - [6784, 5888, 1, 128, 6784, 6784, 6784, 5888]
    - [17, 12292.0]
  - - [2368, 1856, 1, 256, 2368, 2368, 2368, 1856]
    - [14, 11197.0]
  - - [1408, 3584, 1, 3328, 1408, 1408, 1408, 3584]
    - [15, 12163.0]
  - - [2368, 6784, 1, 256, 2368, 2368, 2368, 6784]
    - [1, 11927.0]
  - - [5056, 1408, 1, 1280, 5056, 5056, 5056, 1408]
    - [1, 12423.0]
  - - [5056, 4288, 1, 128, 5056, 5056, 5056, 4288]
    - [25, 11748.0]
  - - [1408, 1856, 1, 128, 1408, 1408, 1408, 1856]
    - [25, 11113.0]
  - - [1408, 5888, 1, 3328, 1408, 1408, 1408, 5888]
    - [4, 12389.0]
  - - [6784, 6784, 1, 256, 6784, 6784, 6784, 6784]
    - [29, 12582.0]
  - - [4288, 2368, 1, 128, 4288, 4288, 4288, 2368]
    - [0, 11561.0]
  - - [1856, 4288, 1, 128, 1856, 1856, 1856, 4288]
    - [25, 11155.0]
  - - [2368, 2944, 1, 256, 2368, 2368, 2368, 2944]
    - [1, 11758.0]
  - - [3584, 1856, 1, 1280, 3584, 3584, 3584, 1856]
    - [26, 12145.0]
  - - [6784, 6784, 1, 128, 6784, 6784, 6784, 6784]
    - [15, 12322.0]
  - - [5888, 5056, 1, 256, 5888, 5888, 5888, 5056]
    - [1, 12344.0]
  - - [3584, 448, 1, 256, 3584, 3584, 3584, 448]
    - [25, 10817.0]
  - - [448, 4288, 1, 128, 448, 448, 448, 4288]
    - [25, 9101.0]
  - - [2944, 4288, 1, 3328, 2944, 2944, 2944, 4288]
    - [17, 12313.0]
  - - [256, 6784, 1, 256, 256, 256, 256, 6784]
    - [14, 10750.0]
  - - [1408, 4288, 1, 128, 1408, 1408, 1408, 4288]
    - [31, 11565.0]
  - - [2944, 704, 1, 3328, 2944, 2944, 2944, 704]
    - [3, 11603.0]
  - - [3584, 3584, 1, 256, 3584, 3584, 3584, 3584]
    - [17, 12192.0]
  - - [3584, 5056, 1, 256, 3584, 3584, 3584, 5056]
    - [4, 12259.0]
  - - [2944, 2368, 1, 1280, 2944, 2944, 2944, 2368]
    - [29, 12170.0]
  - - [1408, 3584, 1, 256, 1408, 1408, 1408, 3584]
    - [0, 11765.0]
  - - [6784, 3584, 1, 256, 6784, 6784, 6784, 3584]
    - [15, 12428.0]
  - - [5056, 2368, 1, 128, 5056, 5056, 5056, 2368]
    - [20, 11531.0]
  - - [2944, 2944, 1, 3328, 2944, 2944, 2944, 2944]
    - [4, 12475.0]
  - - [5056, 6784, 1, 256, 5056, 5056, 5056, 6784]
    - [26, 12381.0]
  - - [1856, 3584, 1, 128, 1856, 1856, 1856, 3584]
    - [30, 10978.0]
  - - [6784, 448, 1, 256, 6784, 6784, 6784, 448]
    - [25, 11342.0]
  - - [3584, 6784, 1, 128, 3584, 3584, 3584, 6784]
    - [4, 12070.0]
  - - [5056, 1856, 1, 256, 5056, 5056, 5056, 1856]
    - [14, 11798.0]
  - - [1024, 1856, 1, 256, 1024, 1024, 1024, 1856]
    - [25, 11139.0]
  - - [1408, 6784, 1, 1280, 1408, 1408, 1408, 6784]
    - [15, 12364.0]
  - - [3584, 3584, 1, 1280, 3584, 3584, 3584, 3584]
    - [17, 12485.0]
  - - [5888, 5888, 1, 128, 5888, 5888, 5888, 5888]
    - [17, 12226.0]
  - - [5056, 5888, 1, 128, 5056, 5056, 5056, 5888]
    - [18, 11935.0]
  - - [5056, 2368, 1, 3328, 5056, 5056, 5056, 2368]
    - [29, 12270.0]
  - - [2944, 4288, 1, 256, 2944, 2944, 2944, 4288]
    - [15, 11916.0]
  - - [1408, 3584, 1, 1280, 1408, 1408, 1408, 3584]
    - [26, 12108.0]
  - - [2368, 6784, 1, 3328, 2368, 2368, 2368, 6784]
    - [29, 12301.0]
  - - [1856, 1408, 1, 1280, 1856, 1856, 1856, 1408]
    - [14, 11131.0]
  - - [6784, 704, 1, 128, 6784, 6784, 6784, 704]
    - [25, 11308.0]
  - - [1408, 5888, 1, 256, 1408, 1408, 1408, 5888]
    - [26, 11995.0]
  - - [704, 2944, 1, 1280, 704, 704, 704, 2944]
    - [5, 10978.0]
  - - [1856, 2368, 1, 128, 1856, 1856, 1856, 2368]
    - [0, 10932.0]
  - - [4096, 7133, 1, 4096, 4096, 4096, 4096, 7133]
    - [4, 12709.0]
  - - [3584, 704, 1, 1280, 3584, 3584, 3584, 704]
    - [25, 11439.0]
  - - [2944, 6784, 1, 128, 2944, 2944, 2944, 6784]
    - [1, 12111.0]
  - - [3584, 448, 1, 3328, 3584, 3584, 3584, 448]
    - [28, 11541.0]
  - - [704, 2368, 1, 3328, 704, 704, 704, 2368]
    - [36, 10369.0]
  - - [256, 5888, 1, 128, 256, 256, 256, 5888]
    - [25, 10018.0]
  - - [2944, 2944, 1, 1280, 2944, 2944, 2944, 2944]
    - [1, 12422.0]
  - - [5888, 2368, 1, 256, 5888, 5888, 5888, 2368]
    - [4, 11954.0]
  - - [6784, 704, 1, 3328, 6784, 6784, 6784, 704]
    - [16, 11800.0]
  - - [5888, 4288, 1, 128, 5888, 5888, 5888, 4288]
    - [25, 11942.0]
  - - [1408, 2944, 1, 3328, 1408, 1408, 1408, 2944]
    - [29, 12244.0]
  - - [3584, 704, 1, 128, 3584, 3584, 3584, 704]
    - [25, 10652.0]
  - - [5056, 5056, 1, 128, 5056, 5056, 5056, 5056]
    - [14, 11796.0]
  - - [448, 5056, 1, 128, 448, 448, 448, 5056]
    - [8, 9043.0]
  - - [1408, 5056, 1, 128, 1408, 1408, 1408, 5056]
    - [0, 11599.0]
  - - [2944, 3584, 1, 128, 2944, 2944, 2944, 3584]
    - [15, 11754.0]
  - - [3584, 2368, 1, 256, 3584, 3584, 3584, 2368]
    - [14, 11888.0]
  - - [5888, 5056, 1, 1280, 5888, 5888, 5888, 5056]
    - [4, 12626.0]
  - - [2368, 5056, 1, 128, 2368, 2368, 2368, 5056]
    - [0, 11364.0]
  - - [3584, 3584, 1, 3328, 3584, 3584, 3584, 3584]
    - [17, 12531.0]
  - - [5888, 6784, 1, 256, 5888, 5888, 5888, 6784]
    - [4, 12578.0]
  - - [4288, 2944, 1, 3328, 4288, 4288, 4288, 2944]
    - [29, 12312.0]
  - - [4288, 704, 1, 1280, 4288, 4288, 4288, 704]
    - [3, 11515.0]
  - - [256, 5056, 1, 1280, 256, 256, 256, 5056]
    - [18, 11641.0]
  - - [2944, 5888, 1, 3328, 2944, 2944, 2944, 5888]
    - [17, 12778.0]
  - - [6784, 5888, 1, 1280, 6784, 6784, 6784, 5888]
    - [17, 12807.0]
  - - [5888, 4288, 1, 1280, 5888, 5888, 5888, 4288]
    - [17, 12480.0]
  - - [5888, 3584, 1, 128, 5888, 5888, 5888, 3584]
    - [1, 12040.0]
  - - [1856, 1856, 1, 128, 1856, 1856, 1856, 1856]
    - [20, 10681.0]
  - - [704, 3584, 1, 128, 704, 704, 704, 3584]
    - [25, 9937.0]
  - - [5888, 448, 1, 3328, 5888, 5888, 5888, 448]
    - [3, 11378.0]
  - - [2368, 4288, 1, 1280, 2368, 2368, 2368, 4288]
    - [15, 11917.0]
  - - [4288, 2944, 1, 128, 4288, 4288, 4288, 2944]
    - [36, 11553.0]
  - - [1024, 6784, 1, 3328, 1024, 1024, 1024, 6784]
    - [29, 12247.0]
  - - [5056, 2944, 1, 3328, 5056, 5056, 5056, 2944]
    - [17, 12616.0]
  - - [2944, 3584, 1, 256, 2944, 2944, 2944, 3584]
    - [15, 12026.0]
  - - [1408, 1408, 1, 3328, 1408, 1408, 1408, 1408]
    - [16, 11124.0]
  - - [3584, 3584, 1, 128, 3584, 3584, 3584, 3584]
    - [17, 11846.0]
  - - [3584, 704, 1, 256, 3584, 3584, 3584, 704]
    - [14, 11133.0]
  - - [3584, 1408, 1, 3328, 3584, 3584, 3584, 1408]
    - [4, 12170.0]
  - - [704, 3584, 1, 1280, 704, 704, 704, 3584]
    - [0, 10734.0]
  - - [2944, 6784, 1, 1280, 2944, 2944, 2944, 6784]
    - [29, 12765.0]
  - - [1856, 6784, 1, 256, 1856, 1856, 1856, 6784]
    - [1, 11842.0]
  - - [4288, 448, 1, 3328, 4288, 4288, 4288, 448]
    - [3, 11576.0]
  - - [6784, 4288, 1, 128, 6784, 6784, 6784, 4288]
    - [25, 11973.0]
  - - [6784, 704, 1, 1280, 6784, 6784, 6784, 704]
    - [28, 11735.0]
  - - [5888, 1024, 1, 3328, 5888, 5888, 5888, 1024]
    - [17, 12276.0]
  - - [704, 6784, 1, 1280, 704, 704, 704, 6784]
    - [15, 11382.0]
  - - [1856, 5056, 1, 3328, 1856, 1856, 1856, 5056]
    - [29, 12145.0]
  - - [1024, 3584, 1, 128, 1024, 1024, 1024, 3584]
    - [14, 11007.0]
  - - [1024, 1408, 1, 128, 1024, 1024, 1024, 1408]
    - [0, 10118.0]
  - - [2368, 2944, 1, 128, 2368, 2368, 2368, 2944]
    - [5, 11341.0]
  - - [5056, 2944, 1, 128, 5056, 5056, 5056, 2944]
    - [5, 11736.0]
  - - [5888, 5056, 1, 3328, 5888, 5888, 5888, 5056]
    - [17, 12668.0]
  - - [1408, 2368, 1, 128, 1408, 1408, 1408, 2368]
    - [14, 11028.0]
  - - [5888, 2368, 1, 128, 5888, 5888, 5888, 2368]
    - [25, 11873.0]
  - - [3584, 6784, 1, 1280, 3584, 3584, 3584, 6784]
    - [17, 12671.0]
  - - [3072, 7435, 1, 1024, 3072, 3072, 3072, 7435]
    - [17, 12520.0]
  - - [1856, 5888, 1, 256, 1856, 1856, 1856, 5888]
    - [1, 11708.0]
  - - [4288, 4288, 1, 3328, 4288, 4288, 4288, 4288]
    - [4, 12385.0]
  - - [4288, 1408, 1, 1280, 4288, 4288, 4288, 1408]
    - [9, 12153.0]
  - - [3584, 5056, 1, 128, 3584, 3584, 3584, 5056]
    - [0, 11919.0]
  - - [4288, 2368, 1, 256, 4288, 4288, 4288, 2368]
    - [8, 11700.0]
  - - [2944, 5056, 1, 1280, 2944, 2944, 2944, 5056]
    - [17, 12580.0]
  - - [448, 6784, 1, 256, 448, 448, 448, 6784]
    - [30, 9916.0]
  - - [6784, 2368, 1, 3328, 6784, 6784, 6784, 2368]
    - [29, 12305.0]
  - - [4288, 1856, 1, 3328, 4288, 4288, 4288, 1856]
    - [4, 11879.0]
  - - [3584, 448, 1, 128, 3584, 3584, 3584, 448]
    - [14, 10124.0]
  - - [3584, 1024, 1, 1280, 3584, 3584, 3584, 1024]
    - [28, 11700.0]
  - - [1856, 5056, 1, 256, 1856, 1856, 1856, 5056]
    - [21, 11588.0]
  - - [1024, 4288, 1, 256, 1024, 1024, 1024, 4288]
    - [0, 11648.0]
  - - [5888, 3584, 1, 3328, 5888, 5888, 5888, 3584]
    - [17, 12704.0]
  - - [5056, 3584, 1, 3328, 5056, 5056, 5056, 3584]
    - [29, 12634.0]
  - - [2368, 1408, 1, 1280, 2368, 2368, 2368, 1408]
    - [0, 11562.0]
  - - [5056, 2944, 1, 1280, 5056, 5056, 5056, 2944]
    - [26, 12548.0]
  - - [1024, 6784, 1, 256, 1024, 1024, 1024, 6784]
    - [0, 11737.0]
  - - [2944, 1408, 1, 128, 2944, 2944, 2944, 1408]
    - [18, 11318.0]
  - - [5056, 6784, 1, 3328, 5056, 5056, 5056, 6784]
    - [17, 12672.0]
  - - [3584, 4288, 1, 256, 3584, 3584, 3584, 4288]
    - [1, 12056.0]
  - - [1856, 6784, 1, 3328, 1856, 1856, 1856, 6784]
    - [17, 12267.0]
  - - [5888, 4288, 1, 256, 5888, 5888, 5888, 4288]
    - [1, 12197.0]
  - - [5056, 1408, 1, 256, 5056, 5056, 5056, 1408]
    - [18, 11744.0]
  - - [3584, 1024, 1, 256, 3584, 3584, 3584, 1024]
    - [14, 11394.0]
  - - [5888, 5888, 1, 256, 5888, 5888, 5888, 5888]
    - [29, 12542.0]
  - - [4288, 1024, 1, 1280, 4288, 4288, 4288, 1024]
    - [9, 11907.0]
  - - [448, 6784, 1, 3328, 448, 448, 448, 6784]
    - [26, 10539.0]
  - - [2944, 1408, 1, 1280, 2944, 2944, 2944, 1408]
    - [1, 12125.0]
  - - [2944, 1856, 1, 3328, 2944, 2944, 2944, 1856]
    - [3, 11924.0]
  - - [2944, 2944, 1, 128, 2944, 2944, 2944, 2944]
    - [14, 11715.0]
  - - [3584, 5888, 1, 1280, 3584, 3584, 3584, 5888]
    - [17, 12664.0]
  - - [6784, 1856, 1, 1280, 6784, 6784, 6784, 1856]
    - [4, 12214.0]
  - - [2944, 5056, 1, 256, 2944, 2944, 2944, 5056]
    - [1, 12187.0]
  - - [2944, 5888, 1, 1280, 2944, 2944, 2944, 5888]
    - [17, 12739.0]
  - - [5888, 256, 1, 3328, 5888, 5888, 5888, 256]
    - [12, 11204.0]
  - - [1856, 5888, 1, 3328, 1856, 1856, 1856, 5888]
    - [4, 12149.0]
  - - [3584, 1408, 1, 256, 3584, 3584, 3584, 1408]
    - [0, 11653.0]
  - - [704, 3584, 1, 3328, 704, 704, 704, 3584]
    - [3, 10856.0]
  - - [5056, 448, 1, 1280, 5056, 5056, 5056, 448]
    - [0, 11638.0]
  - - [3584, 1856, 1, 3328, 3584, 3584, 3584, 1856]
    - [17, 12232.0]
  - - [2944, 1024, 1, 256, 2944, 2944, 2944, 1024]
    - [0, 11201.0]
  - - [1024, 2368, 1, 128, 1024, 1024, 1024, 2368]
    - [20, 10960.0]
  - - [2368, 4288, 1, 3328, 2368, 2368, 2368, 4288]
    - [4, 11981.0]
  - - [1024, 1408, 1, 1280, 1024, 1024, 1024, 1408]
    - [25, 11260.0]
  - - [6784, 5056, 1, 256, 6784, 6784, 6784, 5056]
    - [4, 12373.0]
  - - [448, 6784, 1, 128, 448, 448, 448, 6784]
    - [14, 9325.0]
  - - [2944, 6784, 1, 256, 2944, 2944, 2944, 6784]
    - [17, 12513.0]
  - - [2368, 2368, 1, 1280, 2368, 2368, 2368, 2368]
    - [16, 11521.0]
  - - [1856, 3584, 1, 1280, 1856, 1856, 1856, 3584]
    - [15, 12163.0]
  - - [3584, 1408, 1, 1280, 3584, 3584, 3584, 1408]
    - [26, 12108.0]
  - - [4288, 448, 1, 128, 4288, 4288, 4288, 448]
    - [14, 9613.0]
  - - [5056, 256, 1, 1280, 5056, 5056, 5056, 256]
    - [5, 11773.0]
  - - [1856, 1408, 1, 3328, 1856, 1856, 1856, 1408]
    - [28, 11260.0]
  - - [1024, 4288, 1, 3328, 1024, 1024, 1024, 4288]
    - [15, 12024.0]
  - - [5056, 448, 1, 256, 5056, 5056, 5056, 448]
    - [0, 11096.0]
  - - [2944, 2368, 1, 3328, 2944, 2944, 2944, 2368]
    - [4, 12255.0]
  - - [1024, 1856, 1, 1280, 1024, 1024, 1024, 1856]
    - [30, 11531.0]
  - - [6784, 1856, 1, 256, 6784, 6784, 6784, 1856]
    - [25, 11965.0]
  - - [1024, 5888, 1, 256, 1024, 1024, 1024, 5888]
    - [1, 11810.0]
  - - [1408, 2368, 1, 256, 1408, 1408, 1408, 2368]
    - [0, 11344.0]
  - - [1408, 1408, 1, 256, 1408, 1408, 1408, 1408]
    - [25, 10739.0]
  - - [2368, 2368, 1, 128, 2368, 2368, 2368, 2368]
    - [8, 11073.0]
  - - [6784, 1408, 1, 128, 6784, 6784, 6784, 1408]
    - [26, 11731.0]
  - - [4288, 5888, 1, 256, 4288, 4288, 4288, 5888]
    - [26, 12225.0]
  - - [1408, 5056, 1, 256, 1408, 1408, 1408, 5056]
    - [15, 11873.0]
  - - [4288, 3584, 1, 128, 4288, 4288, 4288, 3584]
    - [1, 11757.0]
  - - [3584, 5056, 1, 1280, 3584, 3584, 3584, 5056]
    - [4, 12579.0]
  - - [1856, 1024, 1, 128, 1856, 1856, 1856, 1024]
    - [0, 9754.0]
  - - [704, 4288, 1, 256, 704, 704, 704, 4288]
    - [14, 10203.0]
  - - [5888, 2368, 1, 1280, 5888, 5888, 5888, 2368]
    - [4, 12312.0]
  - - [2368, 5888, 1, 1280, 2368, 2368, 2368, 5888]
    - [15, 12304.0]
  - - [5888, 256, 1, 1280, 5888, 5888, 5888, 256]
    - [30, 11080.0]
  - - [2368, 1856, 1, 3328, 2368, 2368, 2368, 1856]
    - [0, 11627.0]
  - - [2944, 704, 1, 256, 2944, 2944, 2944, 704]
    - [25, 11170.0]
  - - [704, 3584, 1, 256, 704, 704, 704, 3584]
    - [25, 10442.0]
  - - [704, 2944, 1, 3328, 704, 704, 704, 2944]
    - [5, 11107.0]
  - - [6784, 1024, 1, 128, 6784, 6784, 6784, 1024]
    - [25, 11620.0]
  - - [2944, 1024, 1, 3328, 2944, 2944, 2944, 1024]
    - [28, 11694.0]
  - - [2944, 5056, 1, 128, 2944, 2944, 2944, 5056]
    - [0, 11871.0]
  - - [1408, 6784, 1, 256, 1408, 1408, 1408, 6784]
    - [1, 12056.0]
  - - [6784, 1408, 1, 3328, 6784, 6784, 6784, 1408]
    - [29, 12396.0]
  - - [4288, 6784, 1, 128, 4288, 4288, 4288, 6784]
    - [15, 11943.0]
  - - [6784, 2944, 1, 1280, 6784, 6784, 6784, 2944]
    - [17, 12766.0]
  - - [4288, 1856, 1, 128, 4288, 4288, 4288, 1856]
    - [0, 11377.0]
  - - [1856, 2944, 1, 128, 1856, 1856, 1856, 2944]
    - [14, 11070.0]
  - - [6784, 448, 1, 128, 6784, 6784, 6784, 448]
    - [14, 11046.0]
  - - [448, 5056, 1, 1280, 448, 448, 448, 5056]
    - [15, 10529.0]
  - - [2368, 1856, 1, 128, 2368, 2368, 2368, 1856]
    - [0, 11031.0]
  - - [4288, 704, 1, 256, 4288, 4288, 4288, 704]
    - [0, 11116.0]
  - - [5888, 704, 1, 256, 5888, 5888, 5888, 704]
    - [25, 11470.0]
  - - [3584, 1024, 1, 128, 3584, 3584, 3584, 1024]
    - [14, 11121.0]
  - - [256, 5888, 1, 3328, 256, 256, 256, 5888]
    - [5, 11214.0]
  - - [1408, 4288, 1, 3328, 1408, 1408, 1408, 4288]
    - [29, 12256.0]
  - - [6784, 4288, 1, 256, 6784, 6784, 6784, 4288]
    - [1, 12235.0]
  - - [5888, 256, 1, 256, 5888, 5888, 5888, 256]
    - [25, 10230.0]
  - - [6784, 1024, 1, 1280, 6784, 6784, 6784, 1024]
    - [15, 12181.0]
  - - [5888, 1024, 1, 128, 5888, 5888, 5888, 1024]
    - [25, 11570.0]
  - - [6784, 3584, 1, 1280, 6784, 6784, 6784, 3584]
    - [17, 12660.0]
  - - [1024, 6784, 1, 1280, 1024, 1024, 1024, 6784]
    - [15, 12175.0]
  - - [1408, 2944, 1, 1280, 1408, 1408, 1408, 2944]
    - [15, 12129.0]
  - - [1408, 2368, 1, 3328, 1408, 1408, 1408, 2368]
    - [28, 11708.0]
  - - [2944, 1856, 1, 128, 2944, 2944, 2944, 1856]
    - [31, 11372.0]
  - - [256, 6784, 1, 128, 256, 256, 256, 6784]
    - [25, 10447.0]
  - - [5056, 6784, 1, 128, 5056, 5056, 5056, 6784]
    - [32, 11987.0]
  - - [4288, 5056, 1, 128, 4288, 4288, 4288, 5056]
    - [14, 11696.0]
  - - [1856, 5888, 1, 128, 1856, 1856, 1856, 5888]
    - [18, 11423.0]
  - - [2944, 5888, 1, 256, 2944, 2944, 2944, 5888]
    - [17, 12475.0]
  - - [3584, 1856, 1, 256, 3584, 3584, 3584, 1856]
    - [25, 11759.0]
  - - [4288, 3584, 1, 1280, 4288, 4288, 4288, 3584]
    - [15, 12443.0]
  - - [704, 4288, 1, 3328, 704, 704, 704, 4288]
    - [3, 10584.0]
  - - [704, 5888, 1, 128, 704, 704, 704, 5888]
    - [31, 10251.0]
  - - [6784, 3584, 1, 128, 6784, 6784, 6784, 3584]
    - [1, 12132.0]
  - - [4288, 5056, 1, 3328, 4288, 4288, 4288, 5056]
    - [17, 12464.0]
  - - [1408, 1408, 1, 128, 1408, 1408, 1408, 1408]
    - [25, 10126.0]
  - - [5056, 2368, 1, 256, 5056, 5056, 5056, 2368]
    - [14, 11828.0]
  - - [4288, 704, 1, 3328, 4288, 4288, 4288, 704]
    - [3, 11655.0]
  - - [448, 3584, 1, 256, 448, 448, 448, 3584]
    - [18, 9363.0]
  - - [2368, 1024, 1, 1280, 2368, 2368, 2368, 1024]
    - [1, 11333.0]
  - - [2944, 1408, 1, 3328, 2944, 2944, 2944, 1408]
    - [29, 12251.0]
  - - [1024, 1408, 1, 3328, 1024, 1024, 1024, 1408]
    - [16, 11442.0]
  - - [2560, 7133, 1, 2560, 2560, 2560, 2560, 7133]
    - [17, 12721.0]
  - - [5888, 3584, 1, 256, 5888, 5888, 5888, 3584]
    - [26, 12392.0]
  - - [1408, 1856, 1, 3328, 1408, 1408, 1408, 1856]
    - [16, 11941.0]
  - - [6784, 1408, 1, 1280, 6784, 6784, 6784, 1408]
    - [29, 12338.0]
  - - [704, 2944, 1, 256, 704, 704, 704, 2944]
    - [0, 10271.0]
  - - [704, 4288, 1, 128, 704, 704, 704, 4288]
    - [0, 9908.0]
  - - [2368, 4288, 1, 128, 2368, 2368, 2368, 4288]
    - [0, 11385.0]
  - - [1024, 6784, 1, 128, 1024, 1024, 1024, 6784]
    - [31, 11503.0]
  - - [1408, 1408, 1, 1280, 1408, 1408, 1408, 1408]
    - [14, 11027.0]
  - - [448, 4288, 1, 3328, 448, 448, 448, 4288]
    - [15, 10311.0]
  - - [2368, 1408, 1, 256, 2368, 2368, 2368, 1408]
    - [0, 11213.0]
  - - [5888, 5056, 1, 128, 5888, 5888, 5888, 5056]
    - [25, 11984.0]
  - - [704, 2368, 1, 256, 704, 704, 704, 2368]
    - [0, 9467.0]
  - - [5888, 2368, 1, 3328, 5888, 5888, 5888, 2368]
    - [17, 12358.0]
  - - [4288, 448, 1, 1280, 4288, 4288, 4288, 448]
    - [8, 11367.0]
  - - [5888, 704, 1, 3328, 5888, 5888, 5888, 704]
    - [16, 11780.0]
  - - [5056, 256, 1, 128, 5056, 5056, 5056, 256]
    - [8, 9489.0]
  - - [1408, 5888, 1, 128, 1408, 1408, 1408, 5888]
    - [0, 11669.0]
  - - [1408, 1024, 1, 256, 1408, 1408, 1408, 1024]
    - [25, 10837.0]
  - - [1024, 1856, 1, 128, 1024, 1024, 1024, 1856]
    - [14, 10568.0]
  - - [5056, 6784, 1, 1280, 5056, 5056, 5056, 6784]
    - [29, 12635.0]
  - - [704, 5056, 1, 3328, 704, 704, 704, 5056]
    - [15, 11322.0]
  - - [3584, 5056, 1, 3328, 3584, 3584, 3584, 5056]
    - [17, 12630.0]
  - - [2368, 2944, 1, 3328, 2368, 2368, 2368, 2944]
    - [1, 12257.0]
  - - [2368, 3584, 1, 256, 2368, 2368, 2368, 3584]
    - [26, 11719.0]
  - - [5056, 3584, 1, 1280, 5056, 5056, 5056, 3584]
    - [15, 12579.0]
  - - [1856, 2944, 1, 1280, 1856, 1856, 1856, 2944]
    - [26, 11628.0]
  - - [3584, 2368, 1, 1280, 3584, 3584, 3584, 2368]
    - [1, 12125.0]
  - - [2944, 1408, 1, 256, 2944, 2944, 2944, 1408]
    - [18, 11689.0]
  - - [4288, 1408, 1, 3328, 4288, 4288, 4288, 1408]
    - [4, 12254.0]
  - - [2944, 1024, 1, 128, 2944, 2944, 2944, 1024]
    - [14, 10833.0]
  - - [4288, 5056, 1, 1280, 4288, 4288, 4288, 5056]
    - [17, 12420.0]
  - - [5888, 6784, 1, 1280, 5888, 5888, 5888, 6784]
    - [17, 12800.0]
  - - [6784, 5056, 1, 128, 6784, 6784, 6784, 5056]
    - [1, 12018.0]
  - - [5888, 1408, 1, 3328, 5888, 5888, 5888, 1408]
    - [17, 12390.0]
  - - [256, 5056, 1, 256, 256, 256, 256, 5056]
    - [14, 10758.0]
  - - [448, 3584, 1, 3328, 448, 448, 448, 3584]
    - [6, 10018.0]
  - - [704, 2368, 1, 128, 704, 704, 704, 2368]
    - [25, 9158.0]
  - - [5888, 256, 1, 128, 5888, 5888, 5888, 256]
    - [18, 9986.0]
  - - [3584, 1856, 1, 128, 3584, 3584, 3584, 1856]
    - [0, 11594.0]
  - - [4288, 4288, 1, 128, 4288, 4288, 4288, 4288]
    - [0, 11727.0]
  - - [1856, 1024, 1, 3328, 1856, 1856, 1856, 1024]
    - [6, 11815.0]
  - - [1024, 5056, 1, 256, 1024, 1024, 1024, 5056]
    - [18, 11657.0]
  - - [2368, 1408, 1, 3328, 2368, 2368, 2368, 1408]
    - [10, 11665.0]
  - - [5888, 448, 1, 256, 5888, 5888, 5888, 448]
    - [25, 11009.0]
  - - [5888, 6784, 1, 128, 5888, 5888, 5888, 6784]
    - [1, 12268.0]
  - - [6784, 5056, 1, 1280, 6784, 6784, 6784, 5056]
    - [4, 12641.0]
  - - [5056, 704, 1, 1280, 5056, 5056, 5056, 704]
    - [0, 11768.0]
  - - [4288, 6784, 1, 1280, 4288, 4288, 4288, 6784]
    - [29, 12493.0]
  - - [6784, 1408, 1, 256, 6784, 6784, 6784, 1408]
    - [1, 11961.0]
  - - [3584, 5888, 1, 128, 3584, 3584, 3584, 5888]
    - [23, 12074.0]
  - - [5056, 5888, 1, 256, 5056, 5056, 5056, 5888]
    - [26, 12370.0]
  - - [2368, 1024, 1, 256, 2368, 2368, 2368, 1024]
    - [0, 10622.0]
  - - [2944, 1856, 1, 256, 2944, 2944, 2944, 1856]
    - [0, 11639.0]
  - - [1856, 6784, 1, 1280, 1856, 1856, 1856, 6784]
    - [15, 12219.0]
  - - [4288, 3584, 1, 256, 4288, 4288, 4288, 3584]
    - [26, 12114.0]
  - - [5056, 1856, 1, 1280, 5056, 5056, 5056, 1856]
    - [1, 12065.0]
  - - [1408, 1024, 1, 3328, 1408, 1408, 1408, 1024]
    - [16, 11486.0]
  - - [5888, 3584, 1, 1280, 5888, 5888, 5888, 3584]
    - [17, 12673.0]
  - - [1856, 3584, 1, 3328, 1856, 1856, 1856, 3584]
    - [26, 12241.0]
  - - [1024, 2944, 1, 256, 1024, 1024, 1024, 2944]
    - [25, 11273.0]
  - - [448, 6784, 1, 1280, 448, 448, 448, 6784]
    - [1, 10425.0]
  - - [704, 5056, 1, 256, 704, 704, 704, 5056]
    - [14, 10549.0]
  - - [3584, 1024, 1, 3328, 3584, 3584, 3584, 1024]
    - [28, 11783.0]
  - - [2944, 1856, 1, 1280, 2944, 2944, 2944, 1856]
    - [16, 11851.0]
  - - [5056, 256, 1, 256, 5056, 5056, 5056, 256]
    - [12, 10886.0]
  - - [2368, 3584, 1, 3328, 2368, 2368, 2368, 3584]
    - [17, 12191.0]
  - - [2944, 704, 1, 1280, 2944, 2944, 2944, 704]
    - [14, 11471.0]
  - - [2944, 3584, 1, 1280, 2944, 2944, 2944, 3584]
    - [17, 12417.0]
  - - [1856, 5888, 1, 1280, 1856, 1856, 1856, 5888]
    - [21, 12094.0]
  - - [5056, 448, 1, 3328, 5056, 5056, 5056, 448]
    - [3, 11746.0]
  - - [4288, 1408, 1, 256, 4288, 4288, 4288, 1408]
    - [1, 11720.0]
  - - [5888, 1408, 1, 128, 5888, 5888, 5888, 1408]
    - [36, 11587.0]
  - - [4288, 2368, 1, 1280, 4288, 4288, 4288, 2368]
    - [16, 11974.0]
  - - [6784, 2368, 1, 256, 6784, 6784, 6784, 2368]
    - [1, 11956.0]
  - - [4288, 1856, 1, 256, 4288, 4288, 4288, 1856]
    - [0, 11545.0]
  - - [1856, 2944, 1, 256, 1856, 1856, 1856, 2944]
    - [0, 11243.0]
  - - [5056, 1024, 1, 128, 5056, 5056, 5056, 1024]
    - [12, 11410.0]
  - - [1760, 7133, 1, 1760, 1760, 1760, 1760, 7133]
    - [29, 12195.0]
  - - [6784, 256, 1, 128, 6784, 6784, 6784, 256]
    - [25, 10339.0]
  - - [5888, 704, 1, 128, 5888, 5888, 5888, 704]
    - [0, 11161.0]
  - - [1024, 4288, 1, 1280, 1024, 1024, 1024, 4288]
    - [28, 11952.0]
  - - [2368, 5056, 1, 3328, 2368, 2368, 2368, 5056]
    - [17, 12265.0]
  - - [4288, 1024, 1, 3328, 4288, 4288, 4288, 1024]
    - [1, 12021.0]
  - - [1024, 5056, 1, 3328, 1024, 1024, 1024, 5056]
    - [15, 12418.0]
  - - [1024, 1856, 1, 3328, 1024, 1024, 1024, 1856]
    - [30, 11760.0]
  - - [704, 6784, 1, 128, 704, 704, 704, 6784]
    - [25, 10439.0]
  - - [4288, 6784, 1, 256, 4288, 4288, 4288, 6784]
    - [26, 12246.0]
  - - [3584, 2944, 1, 3328, 3584, 3584, 3584, 2944]
    - [17, 12458.0]
  - - [5888, 2944, 1, 256, 5888, 5888, 5888, 2944]
    - [15, 12395.0]
  - - [2368, 6784, 1, 128, 2368, 2368, 2368, 6784]
    - [15, 11632.0]
  - - [448, 4288, 1, 1280, 448, 448, 448, 4288]
    - [15, 10158.0]
  - - [5056, 4288, 1, 256, 5056, 5056, 5056, 4288]
    - [4, 12074.0]
  - - [1024, 3584, 1, 256, 1024, 1024, 1024, 3584]
    - [14, 11339.0]
  - - [1856, 5056, 1, 128, 1856, 1856, 1856, 5056]
    - [8, 11251.0]
  - - [6784, 6784, 1, 3328, 6784, 6784, 6784, 6784]
    - [17, 12803.0]
  - - [448, 5888, 1, 1280, 448, 448, 448, 5888]
    - [14, 10105.0]
  - - [5056, 448, 1, 128, 5056, 5056, 5056, 448]
    - [0, 10613.0]
  - - [3584, 2944, 1, 128, 3584, 3584, 3584, 2944]
    - [23, 11730.0]
  - - [6784, 256, 1, 1280, 6784, 6784, 6784, 256]
    - [25, 11309.0]
  - - [2368, 5888, 1, 3328, 2368, 2368, 2368, 5888]
    - [17, 12354.0]
  - - [2368, 1856, 1, 1280, 2368, 2368, 2368, 1856]
    - [14, 11515.0]
  - - [3584, 4288, 1, 128, 3584, 3584, 3584, 4288]
    - [25, 11827.0]
  - - [5888, 4288, 1, 3328, 5888, 5888, 5888, 4288]
    - [17, 12513.0]
  - - [2368, 704, 1, 256, 2368, 2368, 2368, 704]
    - [25, 10259.0]
  - - [3584, 1408, 1, 128, 3584, 3584, 3584, 1408]
    - [25, 11465.0]
  - - [1856, 5056, 1, 1280, 1856, 1856, 1856, 5056]
    - [17, 12087.0]
  - - [2944, 1024, 1, 1280, 2944, 2944, 2944, 1024]
    - [0, 11550.0]
  - - [3584, 5888, 1, 3328, 3584, 3584, 3584, 5888]
    - [17, 12702.0]
  - - [2368, 4288, 1, 256, 2368, 2368, 2368, 4288]
    - [0, 11593.0]
  - - [1024, 2368, 1, 3328, 1024, 1024, 1024, 2368]
    - [3, 11808.0]
  - - [6784, 1856, 1, 3328, 6784, 6784, 6784, 1856]
    - [4, 12265.0]
  - - [1024, 2944, 1, 128, 1024, 1024, 1024, 2944]
    - [14, 10737.0]
  - - [1024, 3584, 1, 1280, 1024, 1024, 1024, 3584]
    - [14, 11685.0]
  - - [4288, 5888, 1, 3328, 4288, 4288, 4288, 5888]
    - [29, 12508.0]
  - - [1024, 2944, 1, 3328, 1024, 1024, 1024, 2944]
    - [3, 11656.0]
  - - [3584, 6784, 1, 256, 3584, 3584, 3584, 6784]
    - [15, 12416.0]
  - - [256, 6784, 1, 1280, 256, 256, 256, 6784]
    - [25, 11345.0]
  - - [1856, 3584, 1, 256, 1856, 1856, 1856, 3584]
    - [30, 11709.0]
  - - [6784, 1856, 1, 128, 6784, 6784, 6784, 1856]
    - [25, 11896.0]
  - - [2944, 704, 1, 128, 2944, 2944, 2944, 704]
    - [25, 10855.0]
  - - [256, 5888, 1, 1280, 256, 256, 256, 5888]
    - [18, 11149.0]
  - - [4288, 6784, 1, 3328, 4288, 4288, 4288, 6784]
    - [4, 12526.0]
  - - [7680, 5481, 1, 2560, 7680, 7680, 7680, 5481]
    - [17, 12776.0]
  - - [2368, 1408, 1, 128, 2368, 2368, 2368, 1408]
    - [0, 10465.0]
  - - [1408, 1024, 1, 128, 1408, 1408, 1408, 1024]
    - [25, 10207.0]
  - - [6784, 3584, 1, 3328, 6784, 6784, 6784, 3584]
    - [17, 12691.0]
  - - [2368, 5056, 1, 1280, 2368, 2368, 2368, 5056]
    - [15, 12202.0]
  - - [1408, 2368, 1, 1280, 1408, 1408, 1408, 2368]
    - [25, 11598.0]
  - - [2944, 4288, 1, 128, 2944, 2944, 2944, 4288]
    - [31, 11767.0]
  - - [2944, 2944, 1, 256, 2944, 2944, 2944, 2944]
    - [1, 12088.0]
  - - [6784, 256, 1, 256, 6784, 6784, 6784, 256]
    - [14, 10881.0]
  - - [256, 5056, 1, 3328, 256, 256, 256, 5056]
    - [5, 11852.0]
  - - [5056, 1856, 1, 128, 5056, 5056, 5056, 1856]
    - [8, 11565.0]
  - - [5888, 1408, 1, 256, 5888, 5888, 5888, 1408]
    - [9, 11978.0]
  - - [4288, 3584, 1, 3328, 4288, 4288, 4288, 3584]
    - [4, 12494.0]
  - - [1024, 2368, 1, 1280, 1024, 1024, 1024, 2368]
    - [25, 11664.0]
  - - [5888, 6784, 1, 3328, 5888, 5888, 5888, 6784]
    - [4, 12831.0]
  - - [704, 4288, 1, 1280, 704, 704, 704, 4288]
    - [31, 10552.0]
  - - [6784, 448, 1, 3328, 6784, 6784, 6784, 448]
    - [3, 11734.0]
  - - [4288, 1024, 1, 128, 4288, 4288, 4288, 1024]
    - [0, 10842.0]
  - - [196, 256, 256, 1024, 196, 196, 196, 256]
    - [4, 9549.0]
  - - [784, 512, 256, 128, 784, 784, 784, 512]
    - [4, 10718.0]
  - - [784, 128, 128, 512, 784, 784, 784, 128]
    - [29, 10870.0]
  - - [3136, 256, 256, 64, 3136, 3136, 3136, 256]
    - [34, 8330.0]
  - - [784, 128, 256, 512, 784, 784, 784, 128]
    - [4, 11013.0]
  - - [196, 256, 128, 1024, 196, 196, 196, 256]
    - [17, 9415.0]
  - - [3136, 256, 128, 64, 3136, 3136, 3136, 256]
    - [0, 9104.0]
  - - [784, 512, 128, 128, 784, 784, 784, 512]
    - [4, 10606.0]
  - - [196, 1024, 128, 256, 196, 196, 196, 1024]
    - [17, 9296.0]
  - - [196, 1024, 256, 256, 196, 196, 196, 1024]
    - [17, 9386.0]
  - - [5329, 160, 64, 64, 5329, 5329, 5329, 160]
    - [28, 7084.0]
  - - [1225, 384, 64, 192, 1225, 1225, 1225, 384]
    - [1, 11562.0]
  - - [289, 1024, 64, 256, 289, 289, 289, 1024]
    - [26, 9210.0]
  - - [1225, 384, 64, 64, 1225, 1225, 1225, 384]
    - [0, 10346.0]
  - - [1225, 384, 64, 96, 1225, 1225, 1225, 384]
    - [3, 10381.0]
  - - [289, 1024, 64, 384, 289, 289, 289, 1024]
    - [26, 9357.0]
  - - [289, 1024, 64, 192, 289, 289, 289, 1024]
    - [30, 9088.0]
  - - [289, 1024, 64, 128, 289, 289, 289, 1024]
    - [14, 8858.0]
  - - [4096, 1024, 1, 2984, 4096, 4096, 4096, 1024]
    - [15, 12357.0]
  - - [1024, 4096, 1, 3437, 1024, 1024, 1024, 4096]
    - [23, 12366.0]
  - - [1024, 4096, 1, 3235, 1024, 1024, 1024, 4096]
    - [29, 12376.0]
  - - [4096, 1024, 1, 4032, 4096, 4096, 4096, 1024]
    - [17, 12380.0]
  - - [1024, 4096, 1, 3334, 1024, 1024, 1024, 4096]
    - [4, 12362.0]
  - - [4096, 1024, 1, 3288, 4096, 4096, 4096, 1024]
    - [17, 12360.0]
  - - [1024, 4096, 1, 3515, 1024, 1024, 1024, 4096]
    - [4, 12365.0]
  - - [4096, 1024, 1, 3437, 4096, 4096, 4096, 1024]
    - [17, 12362.0]
  - - [1024, 4096, 1, 3259, 1024, 1024, 1024, 4096]
    - [15, 12360.0]
  - - [1024, 4096, 1, 3384, 1024, 1024, 1024, 4096]
    - [11, 12371.0]
  - - [4096, 1024, 1, 3458, 4096, 4096, 4096, 1024]
    - [17, 12365.0]
  - - [1024, 4096, 1, 3412, 1024, 1024, 1024, 4096]
    - [4, 12365.0]
  - - [1024, 4096, 1, 3529, 1024, 1024, 1024, 4096]
    - [23, 12368.0]
  - - [1024, 4096, 1, 4032, 1024, 1024, 1024, 4096]
    - [17, 12380.0]
  - - [4096, 1024, 1, 3999, 4096, 4096, 4096, 1024]
    - [17, 12375.0]
  - - [1024, 4096, 1, 3079, 1024, 1024, 1024, 4096]
    - [15, 12355.0]
  - - [1024, 4096, 1, 3876, 1024, 1024, 1024, 4096]
    - [4, 12365.0]
  - - [1024, 4096, 1, 3450, 1024, 1024, 1024, 4096]
    - [17, 12359.0]
  - - [1024, 4096, 1, 3256, 1024, 1024, 1024, 4096]
    - [1, 12359.0]
  - - [4096, 1024, 1, 3403, 4096, 4096, 4096, 1024]
    - [17, 12358.0]
  - - [1024, 4096, 1, 3359, 1024, 1024, 1024, 4096]
    - [15, 12364.0]
  - - [4096, 1024, 1, 3549, 4096, 4096, 4096, 1024]
    - [4, 12355.0]
  - - [4096, 1024, 1, 3176, 4096, 4096, 4096, 1024]
    - [15, 12353.0]
  - - [1024, 4096, 1, 3504, 1024, 1024, 1024, 4096]
    - [15, 12366.0]
  - - [4096, 1024, 1, 3314, 4096, 4096, 4096, 1024]
    - [17, 12357.0]
  - - [4096, 1024, 1, 3183, 4096, 4096, 4096, 1024]
    - [17, 12354.0]
  - - [1024, 4096, 1, 3209, 1024, 1024, 1024, 4096]
    - [15, 12355.0]
  - - [1024, 4096, 1, 3720, 1024, 1024, 1024, 4096]
    - [15, 12367.0]
  - - [1024, 4096, 1, 3859, 1024, 1024, 1024, 4096]
    - [4, 12368.0]
  - - [1024, 33708, 1, 4059, 1024, 1024, 1024, 33708]
    - [4, 12746.0]
  - - [4096, 1024, 1, 3477, 4096, 4096, 4096, 1024]
    - [17, 12360.0]
  - - [4096, 1024, 1, 3233, 4096, 4096, 4096, 1024]
    - [29, 12371.0]
  - - [4096, 1024, 1, 3409, 4096, 4096, 4096, 1024]
    - [35, 12363.0]
  - - [4096, 1024, 1, 3564, 4096, 4096, 4096, 1024]
    - [17, 12370.0]
  - - [4096, 1024, 1, 3190, 4096, 4096, 4096, 1024]
    - [17, 12358.0]
  - - [1024, 4096, 1, 3288, 1024, 1024, 1024, 4096]
    - [15, 12369.0]
  - - [4096, 1024, 1, 3451, 4096, 4096, 4096, 1024]
    - [4, 12357.0]
  - - [1024, 4096, 1, 3348, 1024, 1024, 1024, 4096]
    - [4, 12357.0]
  - - [1024, 4096, 1, 3465, 1024, 1024, 1024, 4096]
    - [23, 12361.0]
  - - [1024, 33708, 1, 4032, 1024, 1024, 1024, 33708]
    - [29, 12753.0]
  - - [1024, 33708, 1, 3840, 1024, 1024, 1024, 33708]
    - [17, 12749.0]
  - - [4096, 1024, 1, 3391, 4096, 4096, 4096, 1024]
    - [17, 12357.0]
  - - [1024, 4096, 1, 3530, 1024, 1024, 1024, 4096]
    - [15, 12364.0]
  - - [4096, 1024, 1, 3209, 4096, 4096, 4096, 1024]
    - [17, 12352.0]
  - - [1024, 4096, 1, 3457, 1024, 1024, 1024, 4096]
    - [15, 12360.0]
  - - [1024, 4096, 1, 3386, 1024, 1024, 1024, 4096]
    - [4, 12374.0]
  - - [4096, 1024, 1, 3350, 4096, 4096, 4096, 1024]
    - [17, 12361.0]
  - - [1024, 4096, 1, 3184, 1024, 1024, 1024, 4096]
    - [15, 12361.0]
  - - [1024, 4096, 1, 3093, 1024, 1024, 1024, 4096]
    - [17, 12374.0]
  - - [1024, 4096, 1, 3400, 1024, 1024, 1024, 4096]
    - [29, 12371.0]
  - - [1024, 4096, 1, 3214, 1024, 1024, 1024, 4096]
    - [17, 12356.0]
  - - [4096, 1024, 1, 3406, 4096, 4096, 4096, 1024]
    - [17, 12356.0]
  - - [1024, 4096, 1, 3565, 1024, 1024, 1024, 4096]
    - [17, 12362.0]
  - - [4096, 1024, 1, 3536, 4096, 4096, 4096, 1024]
    - [17, 12367.0]
  - - [1024, 4096, 1, 3183, 1024, 1024, 1024, 4096]
    - [17, 12352.0]
  - - [1024, 4096, 1, 3462, 1024, 1024, 1024, 4096]
    - [15, 12368.0]
  - - [4096, 1024, 1, 3130, 4096, 4096, 4096, 1024]
    - [17, 12351.0]
  - - [4096, 1024, 1, 3381, 4096, 4096, 4096, 1024]
    - [23, 12371.0]
  - - [4096, 1024, 1, 3298, 4096, 4096, 4096, 1024]
    - [29, 12378.0]
  - - [1024, 4096, 1, 3292, 1024, 1024, 1024, 4096]
    - [4, 12354.0]
  - - [4096, 1024, 1, 3289, 4096, 4096, 4096, 1024]
    - [15, 12353.0]
  - - [1024, 4096, 1, 3379, 1024, 1024, 1024, 4096]
    - [15, 12359.0]
  - - [1024, 4096, 1, 3990, 1024, 1024, 1024, 4096]
    - [17, 12379.0]
  - - [1024, 4096, 1, 3540, 1024, 1024, 1024, 4096]
    - [15, 12367.0]
  - - [4096, 1024, 1, 3412, 4096, 4096, 4096, 1024]
    - [17, 12361.0]
  - - [1024, 4096, 1, 3555, 1024, 1024, 1024, 4096]
    - [17, 12356.0]
  - - [1024, 4096, 1, 3518, 1024, 1024, 1024, 4096]
    - [15, 12372.0]
  - - [4096, 1024, 1, 3189, 4096, 4096, 4096, 1024]
    - [17, 12354.0]
  - - [1024, 4096, 1, 3298, 1024, 1024, 1024, 4096]
    - [17, 12362.0]
  - - [4096, 1024, 1, 3072, 4096, 4096, 4096, 1024]
    - [17, 12357.0]
  - - [1024, 4096, 1, 3393, 1024, 1024, 1024, 4096]
    - [17, 12364.0]
  - - [1024, 4096, 1, 3207, 1024, 1024, 1024, 4096]
    - [1, 12357.0]
  - - [4096, 1024, 1, 3487, 4096, 4096, 4096, 1024]
    - [4, 12358.0]
  - - [4096, 1024, 1, 3431, 4096, 4096, 4096, 1024]
    - [4, 12358.0]
  - - [4096, 1024, 1, 3378, 4096, 4096, 4096, 1024]
    - [15, 12360.0]
  - - [4096, 1024, 1, 3529, 4096, 4096, 4096, 1024]
    - [17, 12382.0]
  - - [4096, 1024, 1, 3460, 4096, 4096, 4096, 1024]
    - [17, 12362.0]
  - - [1024, 4096, 1, 3336, 1024, 1024, 1024, 4096]
    - [17, 12361.0]
  - - [1024, 4096, 1, 3501, 1024, 1024, 1024, 4096]
    - [4, 12356.0]
  - - [1024, 4096, 1, 3584, 1024, 1024, 1024, 4096]
    - [17, 12369.0]
  - - [4096, 1024, 1, 2499, 4096, 4096, 4096, 1024]
    - [17, 12341.0]
  - - [4096, 1024, 1, 3352, 4096, 4096, 4096, 1024]
    - [4, 12367.0]
  - - [1024, 4096, 1, 3543, 1024, 1024, 1024, 4096]
    - [17, 12364.0]
  - - [1024, 4096, 1, 3476, 1024, 1024, 1024, 4096]
    - [17, 12357.0]
  - - [1024, 33708, 1, 3822, 1024, 1024, 1024, 33708]
    - [17, 12747.0]
  - - [1024, 4096, 1, 3436, 1024, 1024, 1024, 4096]
    - [15, 12359.0]
  - - [1024, 4096, 1, 3594, 1024, 1024, 1024, 4096]
    - [4, 12371.0]
  - - [4096, 1024, 1, 3514, 4096, 4096, 4096, 1024]
    - [4, 12359.0]
  - - [1024, 4096, 1, 3064, 1024, 1024, 1024, 4096]
    - [15, 12356.0]
  - - [4096, 1024, 1, 3371, 4096, 4096, 4096, 1024]
    - [4, 12365.0]
  - - [4096, 1024, 1, 3558, 4096, 4096, 4096, 1024]
    - [11, 12363.0]
  - - [4096, 1024, 1, 3517, 4096, 4096, 4096, 1024]
    - [17, 12365.0]
  - - [4096, 1024, 1, 3144, 4096, 4096, 4096, 1024]
    - [17, 12378.0]
  - - [1024, 4096, 1, 3312, 1024, 1024, 1024, 4096]
    - [4, 12358.0]
  - - [4096, 1024, 1, 3079, 4096, 4096, 4096, 1024]
    - [17, 12356.0]
  - - [1024, 4096, 1, 3415, 1024, 1024, 1024, 4096]
    - [17, 12359.0]
  - - [1024, 4096, 1, 3221, 1024, 1024, 1024, 4096]
    - [17, 12358.0]
  - - [1024, 4096, 1, 3978, 1024, 1024, 1024, 4096]
    - [4, 12380.0]
  - - [4096, 1024, 1, 3876, 4096, 4096, 4096, 1024]
    - [17, 12366.0]
  - - [1024, 4096, 1, 3528, 1024, 1024, 1024, 4096]
    - [17, 12362.0]
  - - [1024, 4096, 1, 3181, 1024, 1024, 1024, 4096]
    - [17, 12357.0]
  - - [4096, 1024, 1, 3445, 4096, 4096, 4096, 1024]
    - [29, 12357.0]
  - - [4096, 1024, 1, 3450, 4096, 4096, 4096, 1024]
    - [17, 12380.0]
  - - [4096, 1024, 1, 3377, 4096, 4096, 4096, 1024]
    - [15, 12350.0]
  - - [1024, 4096, 1, 3532, 1024, 1024, 1024, 4096]
    - [17, 12361.0]
  - - [1024, 33708, 1, 3944, 1024, 1024, 1024, 33708]
    - [17, 12749.0]
  - - [4096, 1024, 1, 3483, 4096, 4096, 4096, 1024]
    - [17, 12364.0]
  - - [1024, 4096, 1, 3358, 1024, 1024, 1024, 4096]
    - [4, 12354.0]
  - - [4096, 1024, 1, 3464, 4096, 4096, 4096, 1024]
    - [17, 12363.0]
  - - [4096, 1024, 1, 3282, 4096, 4096, 4096, 1024]
    - [4, 12353.0]
  - - [4096, 1024, 1, 3256, 4096, 4096, 4096, 1024]
    - [1, 12365.0]
  - - [1024, 4096, 1, 3057, 1024, 1024, 1024, 4096]
    - [15, 12351.0]
  - - [4096, 1024, 1, 3481, 4096, 4096, 4096, 1024]
    - [15, 12359.0]
  - - [4096, 1024, 1, 3340, 4096, 4096, 4096, 1024]
    - [17, 12355.0]
  - - [1024, 4096, 1, 3273, 1024, 1024, 1024, 4096]
    - [15, 12357.0]
  - - [4096, 1024, 1, 3392, 4096, 4096, 4096, 1024]
    - [17, 12365.0]
  - - [4096, 1024, 1, 3337, 4096, 4096, 4096, 1024]
    - [1, 12352.0]
  - - [4096, 1024, 1, 3359, 4096, 4096, 4096, 1024]
    - [1, 12354.0]
  - - [4096, 1024, 1, 3498, 4096, 4096, 4096, 1024]
    - [17, 12361.0]
  - - [4096, 1024, 1, 3169, 4096, 4096, 4096, 1024]
    - [17, 12354.0]
  - - [1024, 33708, 1, 3859, 1024, 1024, 1024, 33708]
    - [4, 12746.0]
  - - [1024, 4096, 1, 3103, 1024, 1024, 1024, 4096]
    - [4, 12349.0]
  - - [4096, 1024, 1, 3900, 4096, 4096, 4096, 1024]
    - [17, 12367.0]
  - - [1024, 4096, 1, 3442, 1024, 1024, 1024, 4096]
    - [15, 12365.0]
  - - [1024, 4096, 1, 3248, 1024, 1024, 1024, 4096]
    - [17, 12364.0]
  - - [1024, 4096, 1, 3351, 1024, 1024, 1024, 4096]
    - [17, 12359.0]
  - - [4096, 1024, 1, 3593, 4096, 4096, 4096, 1024]
    - [29, 12359.0]
  - - [1024, 4096, 1, 3780, 1024, 1024, 1024, 4096]
    - [17, 12367.0]
  - - [1024, 33708, 1, 3681, 1024, 1024, 1024, 33708]
    - [4, 12747.0]
  - - [4096, 1024, 1, 3374, 4096, 4096, 4096, 1024]
    - [4, 12356.0]
  - - [1024, 4096, 1, 3557, 1024, 1024, 1024, 4096]
    - [17, 12361.0]
  - - [4096, 1024, 1, 3906, 4096, 4096, 4096, 1024]
    - [17, 12367.0]
  - - [4096, 1024, 1, 3504, 4096, 4096, 4096, 1024]
    - [4, 12362.0]
  - - [1024, 4096, 1, 3270, 1024, 1024, 1024, 4096]
    - [4, 12351.0]
  - - [4096, 1024, 1, 3098, 4096, 4096, 4096, 1024]
    - [4, 12351.0]
  - - [4096, 1024, 1, 3216, 4096, 4096, 4096, 1024]
    - [17, 12364.0]
  - - [1024, 4096, 1, 3550, 1024, 1024, 1024, 4096]
    - [4, 12361.0]
  - - [4096, 1024, 1, 3449, 4096, 4096, 4096, 1024]
    - [17, 12358.0]
  - - [1024, 4096, 1, 3403, 1024, 1024, 1024, 4096]
    - [17, 12362.0]
  - - [1024, 4096, 1, 3523, 1024, 1024, 1024, 4096]
    - [17, 12384.0]
  - - [1024, 4096, 1, 3486, 1024, 1024, 1024, 4096]
    - [4, 12361.0]
  - - [1024, 4096, 1, 3564, 1024, 1024, 1024, 4096]
    - [17, 12367.0]
  - - [1024, 33708, 1, 4005, 1024, 1024, 1024, 33708]
    - [17, 12747.0]
  - - [4096, 1024, 1, 3296, 4096, 4096, 4096, 1024]
    - [17, 12363.0]
  - - [1024, 4096, 1, 3263, 1024, 1024, 1024, 4096]
    - [17, 12351.0]
  - - [1024, 4096, 1, 3130, 1024, 1024, 1024, 4096]
    - [17, 12350.0]
  - - [1024, 4096, 1, 3295, 1024, 1024, 1024, 4096]
    - [17, 12359.0]
  - - [1024, 33708, 1, 3925, 1024, 1024, 1024, 33708]
    - [17, 12747.0]
  - - [1024, 4096, 1, 3378, 1024, 1024, 1024, 4096]
    - [15, 12360.0]
  - - [4096, 1024, 1, 3720, 4096, 4096, 4096, 1024]
    - [17, 12367.0]
  - - [4096, 1024, 1, 3399, 4096, 4096, 4096, 1024]
    - [15, 12352.0]
  - - [4096, 1024, 1, 3543, 4096, 4096, 4096, 1024]
    - [17, 12364.0]
  - - [4096, 1024, 1, 3497, 4096, 4096, 4096, 1024]
    - [17, 12382.0]
  - - [4096, 1024, 1, 3594, 4096, 4096, 4096, 1024]
    - [17, 12365.0]
  - - [1024, 4096, 1, 3144, 1024, 1024, 1024, 4096]
    - [15, 12363.0]
  - - [1024, 4096, 1, 3975, 1024, 1024, 1024, 4096]
    - [17, 12376.0]
  - - [4096, 1024, 1, 3205, 4096, 4096, 4096, 1024]
    - [17, 12353.0]
  - - [1024, 33708, 1, 3995, 1024, 1024, 1024, 33708]
    - [4, 12746.0]
  - - [1024, 4096, 1, 3392, 1024, 1024, 1024, 4096]
    - [15, 12363.0]
  - - [1024, 4096, 1, 3055, 1024, 1024, 1024, 4096]
    - [17, 12349.0]
  - - [1024, 4096, 1, 4026, 1024, 1024, 1024, 4096]
    - [17, 12377.0]
  - - [4096, 1024, 1, 3557, 4096, 4096, 4096, 1024]
    - [17, 12368.0]
  - - [4096, 1024, 1, 3515, 4096, 4096, 4096, 1024]
    - [17, 12358.0]
  - - [4096, 1024, 1, 3486, 4096, 4096, 4096, 1024]
    - [1, 12360.0]
  - - [4096, 1024, 1, 3457, 4096, 4096, 4096, 1024]
    - [4, 12367.0]
  - - [1024, 4096, 1, 3511, 1024, 1024, 1024, 4096]
    - [17, 12357.0]
  - - [4096, 1024, 1, 3138, 4096, 4096, 4096, 1024]
    - [11, 12356.0]
  - - [1024, 4096, 1, 3339, 1024, 1024, 1024, 4096]
    - [17, 12360.0]
  - - [1024, 4096, 1, 3939, 1024, 1024, 1024, 4096]
    - [17, 12375.0]
  - - [4096, 1024, 1, 3500, 4096, 4096, 4096, 1024]
    - [1, 12353.0]
  - - [4096, 1024, 1, 3395, 4096, 4096, 4096, 1024]
    - [23, 12366.0]
  - - [4096, 1024, 1, 4020, 4096, 4096, 4096, 1024]
    - [17, 12374.0]
  - - [4096, 1024, 1, 3942, 4096, 4096, 4096, 1024]
    - [17, 12369.0]
  - - [4096, 1024, 1, 3349, 4096, 4096, 4096, 1024]
    - [17, 12361.0]
  - - [1024, 4096, 1, 3322, 1024, 1024, 1024, 4096]
    - [17, 12352.0]
  - - [4096, 1024, 1, 3452, 4096, 4096, 4096, 1024]
    - [17, 12357.0]
  - - [1024, 4096, 1, 3417, 1024, 1024, 1024, 4096]
    - [4, 12357.0]
  - - [1024, 4096, 1, 3526, 1024, 1024, 1024, 4096]
    - [17, 12359.0]
  - - [4096, 1024, 1, 3485, 4096, 4096, 4096, 1024]
    - [17, 12363.0]
  - - [4096, 1024, 1, 3303, 4096, 4096, 4096, 1024]
    - [4, 12368.0]
  - - [4096, 1024, 1, 3344, 4096, 4096, 4096, 1024]
    - [4, 12356.0]
  - - [1024, 4096, 1, 3479, 1024, 1024, 1024, 4096]
    - [15, 12359.0]
  - - [4096, 1024, 1, 3300, 4096, 4096, 4096, 1024]
    - [1, 12349.0]
  - - [1024, 4096, 1, 3439, 1024, 1024, 1024, 4096]
    - [4, 12355.0]
  - - [4096, 1024, 1, 3280, 4096, 4096, 4096, 1024]
    - [4, 12359.0]
  - - [1024, 4096, 1, 3245, 1024, 1024, 1024, 4096]
    - [15, 12352.0]
  - - [1024, 4096, 1, 3328, 1024, 1024, 1024, 4096]
    - [4, 12363.0]
  - - [4096, 1024, 1, 3418, 4096, 4096, 4096, 1024]
    - [17, 12355.0]
  - - [1024, 4096, 1, 3493, 1024, 1024, 1024, 4096]
    - [15, 12357.0]
  - - [1024, 4096, 1, 3500, 1024, 1024, 1024, 4096]
    - [11, 12370.0]
  - - [1024, 4096, 1, 3166, 1024, 1024, 1024, 4096]
    - [15, 12367.0]
  - - [4096, 1024, 1, 3126, 4096, 4096, 4096, 1024]
    - [17, 12352.0]
  - - [1024, 4096, 1, 3277, 1024, 1024, 1024, 4096]
    - [4, 12353.0]
  - - [1024, 4096, 1, 3315, 1024, 1024, 1024, 4096]
    - [15, 12354.0]
  - - [1024, 4096, 1, 3414, 1024, 1024, 1024, 4096]
    - [17, 12360.0]
  - - [4096, 1024, 1, 3531, 4096, 4096, 4096, 1024]
    - [17, 12359.0]
  - - [4096, 1024, 1, 3484, 4096, 4096, 4096, 1024]
    - [17, 12363.0]
  - - [1024, 4096, 1, 3180, 1024, 1024, 1024, 4096]
    - [15, 12356.0]
  - - [4096, 1024, 1, 3360, 4096, 4096, 4096, 1024]
    - [17, 12367.0]
  - - [1024, 33708, 1, 3990, 1024, 1024, 1024, 33708]
    - [29, 12750.0]
  - - [4096, 1024, 1, 3466, 4096, 4096, 4096, 1024]
    - [29, 12357.0]
  - - [1024, 4096, 1, 3428, 1024, 1024, 1024, 4096]
    - [15, 12361.0]
  - - [1024, 4096, 1, 3137, 1024, 1024, 1024, 4096]
    - [23, 12357.0]
  - - [4096, 1024, 1, 4059, 4096, 4096, 4096, 1024]
    - [4, 12369.0]
  - - [1024, 4096, 1, 3353, 1024, 1024, 1024, 4096]
    - [17, 12356.0]
  - - [1024, 4096, 1, 3942, 1024, 1024, 1024, 4096]
    - [17, 12373.0]
  - - [4096, 1024, 1, 3506, 4096, 4096, 4096, 1024]
    - [17, 12366.0]
  - - [4096, 1024, 1, 3508, 4096, 4096, 4096, 1024]
    - [17, 12366.0]
  - - [4096, 1024, 1, 3956, 4096, 4096, 4096, 1024]
    - [17, 12371.0]
  - - [1024, 4096, 1, 3272, 1024, 1024, 1024, 4096]
    - [17, 12365.0]
  - - [1024, 4096, 1, 3443, 1024, 1024, 1024, 4096]
    - [17, 12362.0]
  - - [1024, 4096, 1, 3375, 1024, 1024, 1024, 4096]
    - [17, 12359.0]
  - - [1024, 4096, 1, 3525, 1024, 1024, 1024, 4096]
    - [4, 12375.0]
  - - [4096, 1024, 1, 3472, 4096, 4096, 4096, 1024]
    - [17, 12370.0]
  - - [1024, 4096, 1, 3520, 1024, 1024, 1024, 4096]
    - [17, 12366.0]
  - - [4096, 1024, 1, 3322, 4096, 4096, 4096, 1024]
    - [29, 12356.0]
  - - [4096, 1024, 1, 3387, 4096, 4096, 4096, 1024]
    - [17, 12357.0]
  - - [1024, 33708, 1, 3939, 1024, 1024, 1024, 33708]
    - [4, 12750.0]
  - - [4096, 1024, 1, 3345, 4096, 4096, 4096, 1024]
    - [17, 12361.0]
  - - [4096, 1024, 1, 2967, 4096, 4096, 4096, 1024]
    - [29, 12366.0]
  - - [1024, 4096, 1, 3453, 1024, 1024, 1024, 4096]
    - [17, 12358.0]
  - - [1024, 4096, 1, 3640, 1024, 1024, 1024, 4096]
    - [17, 12368.0]
  - - [4096, 1024, 1, 3291, 4096, 4096, 4096, 1024]
    - [4, 12358.0]
  - - [1024, 4096, 1, 3350, 1024, 1024, 1024, 4096]
    - [17, 12362.0]
  - - [4096, 1024, 1, 3417, 4096, 4096, 4096, 1024]
    - [17, 12360.0]
  - - [1024, 4096, 1, 3467, 1024, 1024, 1024, 4096]
    - [17, 12362.0]
  - - [1024, 4096, 1, 3491, 1024, 1024, 1024, 4096]
    - [23, 12366.0]
  - - [1024, 4096, 1, 3822, 1024, 1024, 1024, 4096]
    - [17, 12368.0]
  - - [4096, 1024, 1, 3292, 4096, 4096, 4096, 1024]
    - [17, 12359.0]
  - - [1024, 4096, 1, 3231, 1024, 1024, 1024, 4096]
    - [17, 12360.0]
  - - [1024, 4096, 1, 3364, 1024, 1024, 1024, 4096]
    - [17, 12360.0]
  - - [1024, 4096, 1, 3995, 1024, 1024, 1024, 4096]
    - [17, 12369.0]
  - - [1024, 4096, 1, 3545, 1024, 1024, 1024, 4096]
    - [4, 12362.0]
  - - [1024, 4096, 1, 3186, 1024, 1024, 1024, 4096]
    - [4, 12352.0]
  - - [4096, 1024, 1, 3432, 4096, 4096, 4096, 1024]
    - [1, 12358.0]
  - - [4096, 1024, 1, 3367, 4096, 4096, 4096, 1024]
    - [17, 12364.0]
  - - [4096, 1024, 1, 3503, 4096, 4096, 4096, 1024]
    - [17, 12383.0]
  - - [1024, 4096, 1, 3095, 1024, 1024, 1024, 4096]
    - [17, 12356.0]
  - - [4096, 1024, 1, 3465, 4096, 4096, 4096, 1024]
    - [17, 12360.0]
  - - [1024, 4096, 1, 3402, 1024, 1024, 1024, 4096]
    - [17, 12361.0]
  - - [4096, 1024, 1, 3140, 4096, 4096, 4096, 1024]
    - [17, 12353.0]
  - - [4096, 1024, 1, 3424, 4096, 4096, 4096, 1024]
    - [1, 12367.0]
  - - [4096, 1024, 1, 3257, 4096, 4096, 4096, 1024]
    - [4, 12373.0]
  - - [4096, 1024, 1, 2917, 4096, 4096, 4096, 1024]
    - [15, 12362.0]
  - - [1024, 33708, 1, 3640, 1024, 1024, 1024, 33708]
    - [4, 12747.0]
  - - [1024, 4096, 1, 3456, 1024, 1024, 1024, 4096]
    - [17, 12367.0]
  - - [1024, 4096, 1, 3014, 1024, 1024, 1024, 4096]
    - [11, 12363.0]
  - - [4096, 1024, 1, 3372, 4096, 4096, 4096, 1024]
    - [17, 12358.0]
  - - [1024, 4096, 1, 3294, 1024, 1024, 1024, 4096]
    - [4, 12357.0]
  - - [4096, 1024, 1, 3446, 4096, 4096, 4096, 1024]
    - [17, 12356.0]
  - - [1024, 4096, 1, 3389, 1024, 1024, 1024, 4096]
    - [15, 12356.0]
  - - [4096, 1024, 1, 3259, 4096, 4096, 4096, 1024]
    - [15, 12355.0]
  - - [4096, 1024, 1, 3544, 4096, 4096, 4096, 1024]
    - [17, 12367.0]
  - - [4096, 1024, 1, 3479, 4096, 4096, 4096, 1024]
    - [4, 12373.0]
  - - [4096, 1024, 1, 3542, 4096, 4096, 4096, 1024]
    - [17, 12366.0]
  - - [4096, 1024, 1, 3321, 4096, 4096, 4096, 1024]
    - [17, 12363.0]
  - - [1024, 4096, 1, 3147, 1024, 1024, 1024, 4096]
    - [15, 12356.0]
  - - [1024, 4096, 1, 3944, 1024, 1024, 1024, 4096]
    - [4, 12366.0]
  - - [4096, 1024, 1, 3870, 4096, 4096, 4096, 1024]
    - [17, 12370.0]
  - - [1024, 4096, 1, 3308, 1024, 1024, 1024, 4096]
    - [17, 12355.0]
  - - [4096, 1024, 1, 3401, 4096, 4096, 4096, 1024]
    - [17, 12361.0]
  - - [1024, 4096, 1, 3395, 1024, 1024, 1024, 4096]
    - [4, 12366.0]
  - - [1024, 4096, 1, 3563, 1024, 1024, 1024, 4096]
    - [17, 12363.0]
  - - [1024, 33708, 1, 3870, 1024, 1024, 1024, 33708]
    - [17, 12750.0]
  - - [4096, 1024, 1, 3494, 4096, 4096, 4096, 1024]
    - [17, 12362.0]
  - - [1024, 4096, 1, 3271, 1024, 1024, 1024, 4096]
    - [17, 12357.0]
  - - [1024, 33708, 1, 3910, 1024, 1024, 1024, 33708]
    - [17, 12750.0]
  - - [1024, 4096, 1, 3287, 1024, 1024, 1024, 4096]
    - [17, 12357.0]
  - - [1024, 33708, 1, 3860, 1024, 1024, 1024, 33708]
    - [17, 12747.0]
  - - [4096, 1024, 1, 3341, 4096, 4096, 4096, 1024]
    - [17, 12360.0]
  - - [1024, 4096, 1, 3136, 1024, 1024, 1024, 4096]
    - [4, 12361.0]
  - - [4096, 1024, 1, 3439, 4096, 4096, 4096, 1024]
    - [17, 12362.0]
  - - [1024, 4096, 1, 3751, 1024, 1024, 1024, 4096]
    - [17, 12366.0]
  - - [1024, 4096, 1, 3301, 1024, 1024, 1024, 4096]
    - [15, 12362.0]
  - - [4096, 1024, 1, 3468, 4096, 4096, 4096, 1024]
    - [17, 12357.0]
  - - [1024, 4096, 1, 3416, 1024, 1024, 1024, 4096]
    - [17, 12357.0]
  - - [4096, 1024, 1, 3163, 4096, 4096, 4096, 1024]
    - [29, 12354.0]
  - - [1024, 4096, 1, 3230, 1024, 1024, 1024, 4096]
    - [17, 12350.0]
  - - [1024, 4096, 1, 3581, 1024, 1024, 1024, 4096]
    - [23, 12365.0]
  - - [4096, 1024, 1, 3463, 4096, 4096, 4096, 1024]
    - [17, 12361.0]
  - - [1024, 4096, 1, 3478, 1024, 1024, 1024, 4096]
    - [4, 12362.0]
  - - [4096, 1024, 1, 3262, 4096, 4096, 4096, 1024]
    - [17, 12350.0]
  - - [1024, 4096, 1, 3438, 1024, 1024, 1024, 4096]
    - [17, 12358.0]
  - - [1024, 4096, 1, 3244, 1024, 1024, 1024, 4096]
    - [17, 12358.0]
  - - [1024, 4096, 1, 3445, 1024, 1024, 1024, 4096]
    - [4, 12376.0]
  - - [4096, 1024, 1, 3328, 4096, 4096, 4096, 1024]
    - [4, 12359.0]
  - - [1024, 4096, 1, 3492, 1024, 1024, 1024, 4096]
    - [17, 12361.0]
  - - [4096, 1024, 1, 3211, 4096, 4096, 4096, 1024]
    - [17, 12362.0]
  - - [1024, 4096, 1, 3910, 1024, 1024, 1024, 4096]
    - [4, 12367.0]
  - - [1024, 4096, 1, 3314, 1024, 1024, 1024, 4096]
    - [29, 12372.0]
  - - [4096, 1024, 1, 3859, 4096, 4096, 4096, 1024]
    - [4, 12371.0]
  - - [4096, 1024, 1, 3383, 4096, 4096, 4096, 1024]
    - [29, 12358.0]
  - - [1024, 4096, 1, 3409, 1024, 1024, 1024, 4096]
    - [15, 12362.0]
  - - [1024, 4096, 1, 4020, 1024, 1024, 1024, 4096]
    - [4, 12371.0]
  - - [4096, 1024, 1, 3530, 4096, 4096, 4096, 1024]
    - [17, 12359.0]
  - - [4096, 1024, 1, 3411, 4096, 4096, 4096, 1024]
    - [17, 12355.0]
  - - [1024, 4096, 1, 3566, 1024, 1024, 1024, 4096]
    - [17, 12361.0]
  - - [4096, 1024, 1, 3493, 4096, 4096, 4096, 1024]
    - [17, 12360.0]
  - - [4096, 1024, 1, 3184, 4096, 4096, 4096, 1024]
    - [11, 12361.0]
  - - [1024, 4096, 1, 3072, 1024, 1024, 1024, 4096]
    - [4, 12351.0]
  - - [1024, 4096, 1, 3431, 1024, 1024, 1024, 4096]
    - [15, 12355.0]
  - - [4096, 1024, 1, 3306, 4096, 4096, 4096, 1024]
    - [17, 12352.0]
  - - [1024, 4096, 1, 3352, 1024, 1024, 1024, 4096]
    - [15, 12362.0]
  - - [4096, 1024, 1, 3295, 4096, 4096, 4096, 1024]
    - [17, 12359.0]
  - - [1024, 4096, 1, 3517, 1024, 1024, 1024, 4096]
    - [17, 12361.0]
  - - [4096, 1024, 1, 3426, 4096, 4096, 4096, 1024]
    - [17, 12361.0]
  - - [4096, 1024, 1, 3385, 4096, 4096, 4096, 1024]
    - [17, 12356.0]
  - - [4096, 1024, 1, 3572, 4096, 4096, 4096, 1024]
    - [17, 12366.0]
  - - [4096, 1024, 1, 3459, 4096, 4096, 4096, 1024]
    - [17, 12360.0]
  - - [1024, 4096, 1, 3374, 1024, 1024, 1024, 4096]
    - [17, 12357.0]
  - - [4096, 1024, 1, 3166, 4096, 4096, 4096, 1024]
    - [4, 12353.0]
  - - [4096, 1024, 1, 3093, 4096, 4096, 4096, 1024]
    - [4, 12352.0]
  - - [4096, 1024, 1, 3523, 4096, 4096, 4096, 1024]
    - [17, 12360.0]
  - - [4096, 1024, 1, 3413, 4096, 4096, 4096, 1024]
    - [17, 12361.0]
  - - [1024, 4096, 1, 3996, 1024, 1024, 1024, 4096]
    - [17, 12368.0]
  - - [1024, 4096, 1, 3452, 1024, 1024, 1024, 4096]
    - [17, 12360.0]
  - - [4096, 1024, 1, 3232, 4096, 4096, 4096, 1024]
    - [17, 12359.0]
  - - [4096, 1024, 1, 3400, 4096, 4096, 4096, 1024]
    - [4, 12371.0]
  - - [4096, 1024, 1, 3334, 4096, 4096, 4096, 1024]
    - [17, 12356.0]
  - - [1024, 4096, 1, 3345, 1024, 1024, 1024, 4096]
    - [15, 12351.0]
  - - [1024, 4096, 1, 3538, 1024, 1024, 1024, 4096]
    - [17, 12361.0]
  - - [1024, 4096, 1, 3466, 1024, 1024, 1024, 4096]
    - [23, 12364.0]
  - - [4096, 1024, 1, 3315, 4096, 4096, 4096, 1024]
    - [17, 12356.0]
  - - [4096, 1024, 1, 3214, 4096, 4096, 4096, 1024]
    - [29, 12364.0]
  - - [1024, 33708, 1, 3900, 1024, 1024, 1024, 33708]
    - [4, 12744.0]
  - - [1024, 4096, 1, 3367, 1024, 1024, 1024, 4096]
    - [17, 12355.0]
  - - [1024, 4096, 1, 2917, 1024, 1024, 1024, 4096]
    - [4, 12362.0]
  - - [1024, 4096, 1, 3544, 1024, 1024, 1024, 4096]
    - [11, 12363.0]
  - - [4096, 1024, 1, 3414, 4096, 4096, 4096, 1024]
    - [17, 12356.0]
  - - [4096, 1024, 1, 3565, 4096, 4096, 4096, 1024]
    - [17, 12359.0]
  - - [1024, 4096, 1, 3512, 1024, 1024, 1024, 4096]
    - [15, 12361.0]
  - - [1024, 4096, 1, 3191, 1024, 1024, 1024, 4096]
    - [23, 12358.0]
  - - [1024, 4096, 1, 3289, 1024, 1024, 1024, 4096]
    - [17, 12359.0]
  - - [4096, 1024, 1, 3290, 4096, 4096, 4096, 1024]
    - [4, 12353.0]
  - - [1024, 4096, 1, 3211, 1024, 1024, 1024, 4096]
    - [17, 12353.0]
  - - [1024, 33708, 1, 3969, 1024, 1024, 1024, 33708]
    - [17, 12747.0]
  - - [4096, 1024, 1, 3566, 4096, 4096, 4096, 1024]
    - [17, 12357.0]
  - - [1024, 4096, 1, 3459, 1024, 1024, 1024, 4096]
    - [17, 12368.0]
  - - [1024, 4096, 1, 3372, 1024, 1024, 1024, 4096]
    - [11, 12361.0]
  - - [4096, 1024, 1, 3339, 4096, 4096, 4096, 1024]
    - [29, 12351.0]
  - - [4096, 1024, 1, 3425, 4096, 4096, 4096, 1024]
    - [17, 12386.0]
  - - [4096, 1024, 1, 3388, 4096, 4096, 4096, 1024]
    - [23, 12370.0]
  - - [1024, 4096, 1, 3531, 1024, 1024, 1024, 4096]
    - [15, 12365.0]
  - - [4096, 1024, 1, 3286, 4096, 4096, 4096, 1024]
    - [17, 12355.0]
  - - [4096, 1024, 1, 3462, 4096, 4096, 4096, 1024]
    - [29, 12355.0]
  - - [1024, 4096, 1, 3388, 1024, 1024, 1024, 4096]
    - [17, 12358.0]
  - - [4096, 1024, 1, 3165, 4096, 4096, 4096, 1024]
    - [17, 12350.0]
  - - [4096, 1024, 1, 3304, 4096, 4096, 4096, 1024]
    - [4, 12367.0]
  - - [1024, 4096, 1, 2736, 1024, 1024, 1024, 4096]
    - [15, 12357.0]
  - - [4096, 1024, 1, 3397, 4096, 4096, 4096, 1024]
    - [17, 12358.0]
  - - [1024, 4096, 1, 3311, 1024, 1024, 1024, 4096]
    - [15, 12355.0]
  - - [1024, 4096, 1, 3394, 1024, 1024, 1024, 4096]
    - [4, 12362.0]
  - - [4096, 1024, 1, 2736, 4096, 4096, 4096, 1024]
    - [17, 12349.0]
  - - [1024, 4096, 1, 3559, 1024, 1024, 1024, 4096]
    - [17, 12368.0]
  - - [4096, 1024, 1, 3180, 4096, 4096, 4096, 1024]
    - [17, 12354.0]
  - - [1024, 4096, 1, 3480, 1024, 1024, 1024, 4096]
    - [15, 12371.0]
  - - [4096, 1024, 1, 3318, 4096, 4096, 4096, 1024]
    - [17, 12360.0]
  - - [4096, 1024, 1, 3213, 4096, 4096, 4096, 1024]
    - [23, 12357.0]
  - - [1024, 4096, 1, 3286, 1024, 1024, 1024, 4096]
    - [17, 12355.0]
  - - [4096, 1024, 1, 3471, 4096, 4096, 4096, 1024]
    - [17, 12354.0]
  - - [1024, 4096, 1, 3381, 1024, 1024, 1024, 4096]
    - [4, 12358.0]
  - - [4096, 1024, 1, 3502, 4096, 4096, 4096, 1024]
    - [17, 12362.0]
  - - [1024, 4096, 1, 3552, 1024, 1024, 1024, 4096]
    - [15, 12368.0]
  - - [4096, 1024, 1, 3519, 4096, 4096, 4096, 1024]
    - [17, 12360.0]
  - - [1024, 4096, 1, 3300, 1024, 1024, 1024, 4096]
    - [4, 12359.0]
  - - [1024, 4096, 1, 3419, 1024, 1024, 1024, 4096]
    - [15, 12373.0]
  - - [4096, 1024, 1, 4030, 4096, 4096, 4096, 1024]
    - [29, 12363.0]
  - - [4096, 1024, 1, 3976, 4096, 4096, 4096, 1024]
    - [17, 12371.0]
  - - [1024, 4096, 1, 3473, 1024, 1024, 1024, 4096]
    - [17, 12357.0]
  - - [4096, 1024, 1, 3428, 4096, 4096, 4096, 1024]
    - [17, 12365.0]
  - - [1024, 4096, 1, 3433, 1024, 1024, 1024, 4096]
    - [17, 12355.0]
  - - [4096, 1024, 1, 3534, 4096, 4096, 4096, 1024]
    - [4, 12359.0]
  - - [4096, 1024, 1, 3461, 4096, 4096, 4096, 1024]
    - [17, 12353.0]
  - - [4096, 1024, 1, 3681, 4096, 4096, 4096, 1024]
    - [17, 12363.0]
  - - [4096, 1024, 1, 3495, 4096, 4096, 4096, 1024]
    - [29, 12369.0]
  - - [4096, 1024, 1, 3351, 4096, 4096, 4096, 1024]
    - [17, 12352.0]
  - - [1024, 4096, 1, 4059, 1024, 1024, 1024, 4096]
    - [4, 12370.0]
  - - [4096, 1024, 1, 3990, 4096, 4096, 4096, 1024]
    - [17, 12370.0]
  - - [1024, 4096, 1, 3325, 1024, 1024, 1024, 4096]
    - [4, 12359.0]
  - - [1024, 4096, 1, 3408, 1024, 1024, 1024, 4096]
    - [17, 12371.0]
  - - [4096, 1024, 1, 3394, 4096, 4096, 4096, 1024]
    - [17, 12362.0]
  - - [1024, 4096, 1, 3573, 1024, 1024, 1024, 4096]
    - [15, 12360.0]
  - - [4096, 1024, 1, 3386, 4096, 4096, 4096, 1024]
    - [17, 12358.0]
  - - [4096, 1024, 1, 3540, 4096, 4096, 4096, 1024]
    - [17, 12363.0]
  - - [1024, 4096, 1, 3182, 1024, 1024, 1024, 4096]
    - [15, 12357.0]
  - - [1024, 4096, 1, 3430, 1024, 1024, 1024, 4096]
    - [17, 12379.0]
  - - [1024, 4096, 1, 3236, 1024, 1024, 1024, 4096]
    - [23, 12361.0]
  - - [4096, 1024, 1, 2977, 4096, 4096, 4096, 1024]
    - [17, 12354.0]
  - - [1024, 4096, 1, 3355, 1024, 1024, 1024, 4096]
    - [17, 12359.0]
  - - [4096, 1024, 1, 3139, 4096, 4096, 4096, 1024]
    - [4, 12356.0]
  - - [4096, 1024, 1, 3516, 4096, 4096, 4096, 1024]
    - [17, 12362.0]
  - - [4096, 1024, 1, 3368, 4096, 4096, 4096, 1024]
    - [17, 12359.0]
  - - [4096, 1024, 1, 3559, 4096, 4096, 4096, 1024]
    - [17, 12379.0]
  - - [1024, 4096, 1, 3506, 1024, 1024, 1024, 4096]
    - [17, 12363.0]
  - - [1024, 4096, 1, 3145, 1024, 1024, 1024, 4096]
    - [23, 12357.0]
  - - [1024, 4096, 1, 3369, 1024, 1024, 1024, 4096]
    - [29, 12362.0]
  - - [4096, 1024, 1, 3522, 4096, 4096, 4096, 1024]
    - [17, 12359.0]
  - - [1024, 33708, 1, 3894, 1024, 1024, 1024, 33708]
    - [4, 12749.0]
  - - [4096, 1024, 1, 3336, 4096, 4096, 4096, 1024]
    - [15, 12360.0]
  - - [1024, 4096, 1, 3382, 1024, 1024, 1024, 4096]
    - [17, 12359.0]
  - - [4096, 1024, 1, 3533, 4096, 4096, 4096, 1024]
    - [17, 12359.0]
  - - [4096, 1024, 1, 4050, 4096, 4096, 4096, 1024]
    - [17, 12375.0]
  - - [4096, 1024, 1, 3480, 4096, 4096, 4096, 1024]
    - [15, 12361.0]
  - - [1024, 4096, 1, 3344, 1024, 1024, 1024, 4096]
    - [4, 12361.0]
  - - [1024, 4096, 1, 3509, 1024, 1024, 1024, 4096]
    - [17, 12382.0]
  - - [1024, 4096, 1, 3956, 1024, 1024, 1024, 4096]
    - [17, 12364.0]
  - - [4096, 1024, 1, 3616, 4096, 4096, 4096, 1024]
    - [4, 12368.0]
  - - [1024, 4096, 1, 3366, 1024, 1024, 1024, 4096]
    - [15, 12359.0]
  - - [4096, 1024, 1, 2935, 4096, 4096, 4096, 1024]
    - [4, 12353.0]
  - - [4096, 1024, 1, 3393, 4096, 4096, 4096, 1024]
    - [17, 12366.0]
  - - [4096, 1024, 1, 3547, 4096, 4096, 4096, 1024]
    - [17, 12363.0]
  - - [1024, 4096, 1, 3499, 1024, 1024, 1024, 4096]
    - [4, 12360.0]
  - - [4096, 1024, 1, 3357, 4096, 4096, 4096, 1024]
    - [4, 12355.0]
  - - [4096, 1024, 1, 3272, 4096, 4096, 4096, 1024]
    - [4, 12373.0]
  - - [4096, 1024, 1, 3207, 4096, 4096, 4096, 1024]
    - [17, 12355.0]
  - - [4096, 1024, 1, 3894, 4096, 4096, 4096, 1024]
    - [17, 12373.0]
  - - [1024, 4096, 1, 3444, 1024, 1024, 1024, 4096]
    - [15, 12363.0]
  - - [4096, 1024, 1, 3561, 4096, 4096, 4096, 1024]
    - [17, 12366.0]
  - - [4096, 1024, 1, 3376, 4096, 4096, 4096, 1024]
    - [4, 12364.0]
  - - [1024, 4096, 1, 3458, 1024, 1024, 1024, 4096]
    - [17, 12361.0]
  - - [4096, 1024, 1, 3231, 4096, 4096, 4096, 1024]
    - [17, 12360.0]
  - - [1024, 4096, 1, 3505, 1024, 1024, 1024, 4096]
    - [15, 12364.0]
  - - [4096, 1024, 1, 3277, 4096, 4096, 4096, 1024]
    - [17, 12359.0]
  - - [1024, 4096, 1, 3391, 1024, 1024, 1024, 4096]
    - [17, 12362.0]
  - - [1024, 4096, 1, 3536, 1024, 1024, 1024, 4096]
    - [4, 12383.0]
  - - [1024, 4096, 1, 3063, 1024, 1024, 1024, 4096]
    - [11, 12356.0]
  - - [1024, 4096, 1, 3189, 1024, 1024, 1024, 4096]
    - [17, 12373.0]
  - - [1024, 4096, 1, 2505, 1024, 1024, 1024, 4096]
    - [23, 12347.0]
  - - [4096, 1024, 1, 3454, 4096, 4096, 4096, 1024]
    - [17, 12365.0]
  - - [1024, 4096, 1, 3405, 1024, 1024, 1024, 4096]
    - [15, 12360.0]
  - - [1024, 33708, 1, 4050, 1024, 1024, 1024, 33708]
    - [17, 12749.0]
  - - [4096, 1024, 1, 3520, 4096, 4096, 4096, 1024]
    - [17, 12372.0]
  - - [1024, 4096, 1, 3487, 1024, 1024, 1024, 4096]
    - [15, 12363.0]
  - - [1024, 4096, 1, 3558, 1024, 1024, 1024, 4096]
    - [4, 12366.0]
  - - [4096, 1024, 1, 3297, 4096, 4096, 4096, 1024]
    - [17, 12365.0]
  - - [1024, 4096, 1, 3483, 1024, 1024, 1024, 4096]
    - [4, 12364.0]
  - - [1024, 33708, 1, 3751, 1024, 1024, 1024, 33708]
    - [4, 12750.0]
  - - [4096, 1024, 1, 3380, 4096, 4096, 4096, 1024]
    - [17, 12355.0]
  - - [1024, 4096, 1, 3380, 1024, 1024, 1024, 4096]
    - [4, 12356.0]
  - - [1024, 4096, 1, 3396, 1024, 1024, 1024, 4096]
    - [4, 12359.0]
  - - [1024, 4096, 1, 3497, 1024, 1024, 1024, 4096]
    - [15, 12363.0]
  - - [1024, 4096, 1, 3502, 1024, 1024, 1024, 4096]
    - [15, 12363.0]
  - - [1024, 4096, 1, 3138, 1024, 1024, 1024, 4096]
    - [15, 12351.0]
  - - [4096, 1024, 1, 3939, 4096, 4096, 4096, 1024]
    - [4, 12364.0]
  - - [1024, 4096, 1, 3303, 1024, 1024, 1024, 4096]
    - [17, 12356.0]
  - - [1024, 4096, 1, 3418, 1024, 1024, 1024, 4096]
    - [17, 12383.0]
  - - [1024, 4096, 1, 3224, 1024, 1024, 1024, 4096]
    - [15, 12364.0]
  - - [4096, 1024, 1, 3978, 4096, 4096, 4096, 1024]
    - [17, 12372.0]
  - - [1024, 4096, 1, 3472, 1024, 1024, 1024, 4096]
    - [4, 12367.0]
  - - [4096, 1024, 1, 3353, 4096, 4096, 4096, 1024]
    - [17, 12358.0]
  - - [4096, 1024, 1, 3362, 4096, 4096, 4096, 1024]
    - [17, 12355.0]
  - - [1024, 33708, 1, 3978, 1024, 1024, 1024, 33708]
    - [4, 12753.0]
  - - [1024, 4096, 1, 3432, 1024, 1024, 1024, 4096]
    - [15, 12362.0]
  - - [1024, 4096, 1, 3139, 1024, 1024, 1024, 4096]
    - [17, 12351.0]
  - - [1024, 4096, 1, 3341, 1024, 1024, 1024, 4096]
    - [4, 12371.0]
  - - [1024, 4096, 1, 3494, 1024, 1024, 1024, 4096]
    - [15, 12371.0]
  - - [1024, 4096, 1, 3969, 1024, 1024, 1024, 4096]
    - [4, 12369.0]
  - - [1024, 4096, 1, 3163, 1024, 1024, 1024, 4096]
    - [15, 12353.0]
  - - [4096, 1024, 1, 3405, 4096, 4096, 4096, 1024]
    - [4, 12355.0]
  - - [4096, 1024, 1, 3453, 4096, 4096, 4096, 1024]
    - [17, 12358.0]
  - - [1024, 4096, 1, 3411, 1024, 1024, 1024, 4096]
    - [15, 12360.0]
  - - [1024, 4096, 1, 3527, 1024, 1024, 1024, 4096]
    - [17, 12361.0]
  - - [4096, 1024, 1, 3474, 4096, 4096, 4096, 1024]
    - [17, 12365.0]
  - - [1024, 4096, 1, 3572, 1024, 1024, 1024, 4096]
    - [17, 12362.0]
  - - [4096, 1024, 1, 3293, 4096, 4096, 4096, 1024]
    - [17, 12358.0]
  - - [4096, 1024, 1, 3247, 4096, 4096, 4096, 1024]
    - [4, 12370.0]
  - - [1024, 4096, 1, 3425, 1024, 1024, 1024, 4096]
    - [15, 12363.0]
  - - [1024, 4096, 1, 3354, 1024, 1024, 1024, 4096]
    - [17, 12373.0]
  - - [4096, 1024, 1, 3382, 4096, 4096, 4096, 1024]
    - [4, 12356.0]
  - - [4096, 1024, 1, 3236, 4096, 4096, 4096, 1024]
    - [29, 12362.0]
  - - [1024, 4096, 1, 3519, 1024, 1024, 1024, 4096]
    - [4, 12360.0]
  - - [4096, 1024, 1, 3354, 4096, 4096, 4096, 1024]
    - [17, 12357.0]
  - - [4096, 1024, 1, 3501, 4096, 4096, 4096, 1024]
    - [17, 12360.0]
  - - [4096, 1024, 1, 3266, 4096, 4096, 4096, 1024]
    - [4, 12372.0]
  - - [1024, 4096, 1, 3368, 1024, 1024, 1024, 4096]
    - [15, 12363.0]
  - - [1024, 4096, 1, 4030, 1024, 1024, 1024, 4096]
    - [29, 12367.0]
  - - [1024, 4096, 1, 3533, 1024, 1024, 1024, 4096]
    - [15, 12364.0]
  - - [4096, 1024, 1, 3332, 4096, 4096, 4096, 1024]
    - [4, 12353.0]
  - - [4096, 1024, 1, 3584, 4096, 4096, 4096, 1024]
    - [17, 12369.0]
  - - [1024, 4096, 1, 3616, 1024, 1024, 1024, 4096]
    - [17, 12373.0]
  - - [4096, 1024, 1, 3265, 4096, 4096, 4096, 1024]
    - [17, 12361.0]
  - - [4096, 1024, 1, 3361, 4096, 4096, 4096, 1024]
    - [29, 12371.0]
  - - [4096, 1024, 1, 3467, 4096, 4096, 4096, 1024]
    - [17, 12357.0]
  - - [1024, 4096, 1, 3454, 1024, 1024, 1024, 4096]
    - [17, 12355.0]
  - - [1024, 4096, 1, 3101, 1024, 1024, 1024, 4096]
    - [1, 12353.0]
  - - [1024, 4096, 1, 3508, 1024, 1024, 1024, 4096]
    - [4, 12363.0]
  - - [4096, 1024, 1, 3267, 4096, 4096, 4096, 1024]
    - [17, 12358.0]
  - - [4096, 1024, 1, 3419, 4096, 4096, 4096, 1024]
    - [17, 12379.0]
  - - [4096, 1024, 1, 3822, 4096, 4096, 4096, 1024]
    - [17, 12370.0]
  - - [1024, 4096, 1, 3266, 1024, 1024, 1024, 4096]
    - [17, 12354.0]
  - - [4096, 1024, 1, 3440, 4096, 4096, 4096, 1024]
    - [17, 12362.0]
  - - [1024, 4096, 1, 3361, 1024, 1024, 1024, 4096]
    - [17, 12358.0]
  - - [1024, 4096, 1, 3546, 1024, 1024, 1024, 4096]
    - [17, 12366.0]
  - - [4096, 1024, 1, 3473, 4096, 4096, 4096, 1024]
    - [17, 12363.0]
  - - [4096, 1024, 1, 3546, 4096, 4096, 4096, 1024]
    - [1, 12360.0]
  - - [1024, 4096, 1, 3088, 1024, 1024, 1024, 4096]
    - [4, 12358.0]
  - - [1024, 4096, 1, 3535, 1024, 1024, 1024, 4096]
    - [11, 12364.0]
  - - [1024, 4096, 1, 3447, 1024, 1024, 1024, 4096]
    - [17, 12381.0]
  - - [1024, 4096, 1, 3560, 1024, 1024, 1024, 4096]
    - [15, 12367.0]
  - - [1024, 4096, 1, 3422, 1024, 1024, 1024, 4096]
    - [23, 12366.0]
  - - [1024, 4096, 1, 3469, 1024, 1024, 1024, 4096]
    - [17, 12359.0]
  - - [4096, 1024, 1, 3488, 4096, 4096, 4096, 1024]
    - [17, 12366.0]
  - - [1024, 4096, 1, 3110, 1024, 1024, 1024, 4096]
    - [4, 12348.0]
  - - [1024, 4096, 1, 3265, 1024, 1024, 1024, 4096]
    - [17, 12361.0]
  - - [1024, 4096, 1, 3291, 1024, 1024, 1024, 4096]
    - [4, 12352.0]
  - - [1024, 4096, 1, 3390, 1024, 1024, 1024, 4096]
    - [15, 12367.0]
  - - [4096, 1024, 1, 3046, 4096, 4096, 4096, 1024]
    - [17, 12356.0]
  - - [1024, 4096, 1, 3539, 1024, 1024, 1024, 4096]
    - [17, 12364.0]
  - - [4096, 1024, 1, 3221, 4096, 4096, 4096, 1024]
    - [17, 12355.0]
  - - [4096, 1024, 1, 3433, 4096, 4096, 4096, 1024]
    - [17, 12358.0]
  - - [4096, 1024, 1, 3364, 4096, 4096, 4096, 1024]
    - [17, 12364.0]
  - - [4096, 1024, 1, 3470, 4096, 4096, 4096, 1024]
    - [15, 12352.0]
  - - [1024, 4096, 1, 3404, 1024, 1024, 1024, 4096]
    - [17, 12364.0]
  - - [1024, 33708, 1, 3968, 1024, 1024, 1024, 33708]
    - [17, 12752.0]
  - - [4096, 1024, 1, 3088, 4096, 4096, 4096, 1024]
    - [17, 12359.0]
  - - [1024, 4096, 1, 3247, 1024, 1024, 1024, 4096]
    - [15, 12357.0]
  - - [1024, 33708, 1, 3996, 1024, 1024, 1024, 33708]
    - [17, 12748.0]
  - - [4096, 1024, 1, 3482, 4096, 4096, 4096, 1024]
    - [17, 12359.0]
  - - [4096, 1024, 1, 3995, 4096, 4096, 4096, 1024]
    - [17, 12370.0]
  - - [1024, 4096, 1, 3280, 1024, 1024, 1024, 4096]
    - [4, 12361.0]
  - - [4096, 1024, 1, 3271, 4096, 4096, 4096, 1024]
    - [17, 12359.0]
  - - [4096, 1024, 1, 3545, 4096, 4096, 4096, 1024]
    - [29, 12372.0]
  - - [4096, 1024, 1, 3476, 4096, 4096, 4096, 1024]
    - [17, 12361.0]
  - - [4096, 1024, 1, 3496, 4096, 4096, 4096, 1024]
    - [4, 12359.0]
  - - [4096, 1024, 1, 3191, 4096, 4096, 4096, 1024]
    - [17, 12356.0]
  - - [4096, 1024, 1, 3311, 4096, 4096, 4096, 1024]
    - [4, 12360.0]
  - - [1024, 4096, 1, 3302, 1024, 1024, 1024, 4096]
    - [4, 12355.0]
  - - [1024, 4096, 1, 3681, 1024, 1024, 1024, 4096]
    - [11, 12367.0]
  - - [4096, 1024, 1, 3582, 4096, 4096, 4096, 1024]
    - [17, 12358.0]
  - - [4096, 1024, 1, 3421, 4096, 4096, 4096, 1024]
    - [17, 12372.0]
  - - [4096, 1024, 1, 3560, 4096, 4096, 4096, 1024]
    - [17, 12363.0]
  - - [1024, 4096, 1, 3495, 1024, 1024, 1024, 4096]
    - [17, 12360.0]
  - - [4096, 1024, 1, 3186, 4096, 4096, 4096, 1024]
    - [17, 12353.0]
  - - [4096, 1024, 1, 3925, 4096, 4096, 4096, 1024]
    - [17, 12365.0]
  - - [1024, 4096, 1, 3435, 1024, 1024, 1024, 4096]
    - [17, 12360.0]
  - - [4096, 1024, 1, 3434, 4096, 4096, 4096, 1024]
    - [17, 12357.0]
  - - [1024, 33708, 1, 4012, 1024, 1024, 1024, 33708]
    - [4, 12748.0]
  - - [1024, 4096, 1, 3340, 1024, 1024, 1024, 4096]
    - [17, 12359.0]
  - - [4096, 1024, 1, 3489, 4096, 4096, 4096, 1024]
    - [17, 12361.0]
  - - [1024, 4096, 1, 3162, 1024, 1024, 1024, 4096]
    - [4, 12355.0]
  - - [4096, 1024, 1, 3436, 4096, 4096, 4096, 1024]
    - [17, 12363.0]
  - - [4096, 1024, 1, 3574, 4096, 4096, 4096, 1024]
    - [11, 12358.0]
  - - [4096, 1024, 1, 3469, 4096, 4096, 4096, 1024]
    - [17, 12365.0]
  - - [1024, 4096, 1, 3410, 1024, 1024, 1024, 4096]
    - [17, 12368.0]
  - - [1024, 4096, 1, 3216, 1024, 1024, 1024, 4096]
    - [17, 12367.0]
  - - [4096, 1024, 1, 3095, 4096, 4096, 4096, 1024]
    - [17, 12351.0]
  - - [4096, 1024, 1, 3448, 4096, 4096, 4096, 1024]
    - [4, 12359.0]
  - - [1024, 4096, 1, 3176, 1024, 1024, 1024, 4096]
    - [15, 12355.0]
  - - [4096, 1024, 1, 2918, 4096, 4096, 4096, 1024]
    - [1, 12354.0]
  - - [1024, 4096, 1, 3424, 1024, 1024, 1024, 4096]
    - [17, 12366.0]
  - - [4096, 1024, 1, 3402, 4096, 4096, 4096, 1024]
    - [1, 12350.0]
  - - [4096, 1024, 1, 3145, 4096, 4096, 4096, 1024]
    - [17, 12355.0]
  - - [1024, 33708, 1, 3976, 1024, 1024, 1024, 33708]
    - [4, 12754.0]
  - - [4096, 1024, 1, 3518, 4096, 4096, 4096, 1024]
    - [15, 12348.0]
  - - [4096, 1024, 1, 3110, 4096, 4096, 4096, 1024]
    - [29, 12371.0]
  - - [4096, 1024, 1, 3325, 4096, 4096, 4096, 1024]
    - [17, 12355.0]
  - - [1024, 33708, 1, 3999, 1024, 1024, 1024, 33708]
    - [29, 12749.0]
  - - [4096, 1024, 1, 2985, 4096, 4096, 4096, 1024]
    - [4, 12350.0]
  - - [1024, 4096, 1, 3371, 1024, 1024, 1024, 4096]
    - [17, 12360.0]
  - - [4096, 1024, 1, 3342, 4096, 4096, 4096, 1024]
    - [17, 12356.0]
  - - [4096, 1024, 1, 3141, 4096, 4096, 4096, 1024]
    - [17, 12354.0]
  - - [4096, 1024, 1, 3532, 4096, 4096, 4096, 1024]
    - [17, 12374.0]
  - - [1024, 4096, 1, 3169, 1024, 1024, 1024, 4096]
    - [17, 12354.0]
  - - [1024, 4096, 1, 3514, 1024, 1024, 1024, 4096]
    - [4, 12358.0]
  - - [4096, 1024, 1, 3780, 4096, 4096, 4096, 1024]
    - [17, 12367.0]
  - - [1024, 4096, 1, 3098, 1024, 1024, 1024, 4096]
    - [17, 12348.0]
  - - [1024, 4096, 1, 3449, 1024, 1024, 1024, 4096]
    - [17, 12362.0]
  - - [1024, 4096, 1, 3222, 1024, 1024, 1024, 4096]
    - [15, 12356.0]
  - - [1024, 4096, 1, 3346, 1024, 1024, 1024, 4096]
    - [4, 12370.0]
  - - [4096, 1024, 1, 3064, 4096, 4096, 4096, 1024]
    - [1, 12352.0]
  - - [4096, 1024, 1, 3511, 4096, 4096, 4096, 1024]
    - [17, 12361.0]
  - - [4096, 1024, 1, 3384, 4096, 4096, 4096, 1024]
    - [23, 12364.0]
  - - [4096, 1024, 1, 3356, 4096, 4096, 4096, 1024]
    - [1, 12355.0]
  - - [1024, 4096, 1, 3796, 1024, 1024, 1024, 4096]
    - [17, 12367.0]
  - - [4096, 1024, 1, 3427, 4096, 4096, 4096, 1024]
    - [17, 12356.0]
  - - [4096, 1024, 1, 3390, 4096, 4096, 4096, 1024]
    - [35, 12359.0]
  - - [4096, 1024, 1, 3573, 4096, 4096, 4096, 1024]
    - [17, 12363.0]
  - - [4096, 1024, 1, 3456, 4096, 4096, 4096, 1024]
    - [4, 12361.0]
  - - [1024, 4096, 1, 3360, 1024, 1024, 1024, 4096]
    - [17, 12365.0]
  - - [1024, 33708, 1, 3977, 1024, 1024, 1024, 33708]
    - [17, 12746.0]
  - - [1024, 4096, 1, 2918, 1024, 1024, 1024, 4096]
    - [15, 12342.0]
  - - [4096, 1024, 1, 3975, 4096, 4096, 4096, 1024]
    - [17, 12370.0]
  - - [4096, 1024, 1, 3525, 4096, 4096, 4096, 1024]
    - [17, 12362.0]
  - - [4096, 1024, 1, 3398, 4096, 4096, 4096, 1024]
    - [17, 12376.0]
  - - [4096, 1024, 1, 3640, 4096, 4096, 4096, 1024]
    - [17, 12365.0]
  - - [4096, 1024, 1, 3014, 4096, 4096, 4096, 1024]
    - [23, 12361.0]
  - - [1024, 4096, 1, 3446, 1024, 1024, 1024, 4096]
    - [15, 12356.0]
  - - [1024, 33708, 1, 3796, 1024, 1024, 1024, 33708]
    - [17, 12747.0]
  - - [4096, 1024, 1, 3101, 4096, 4096, 4096, 1024]
    - [4, 12350.0]
  - - [4096, 1024, 1, 3563, 4096, 4096, 4096, 1024]
    - [17, 12356.0]
  - - [4096, 1024, 1, 3539, 4096, 4096, 4096, 1024]
    - [29, 12353.0]
  - - [4096, 1024, 1, 3182, 4096, 4096, 4096, 1024]
    - [17, 12368.0]
  - - [1024, 4096, 1, 3468, 1024, 1024, 1024, 4096]
    - [17, 12360.0]
  - - [4096, 1024, 1, 3312, 4096, 4096, 4096, 1024]
    - [17, 12363.0]
  - - [4096, 1024, 1, 3215, 4096, 4096, 4096, 1024]
    - [17, 12351.0]
  - - [4096, 1024, 1, 3910, 4096, 4096, 4096, 1024]
    - [17, 12373.0]
  - - [1024, 33708, 1, 3780, 1024, 1024, 1024, 33708]
    - [17, 12746.0]
  - - [1024, 4096, 1, 3290, 1024, 1024, 1024, 4096]
    - [15, 12356.0]
  - - [1024, 4096, 1, 4012, 1024, 1024, 1024, 4096]
    - [4, 12368.0]
  - - [1024, 4096, 1, 3385, 1024, 1024, 1024, 4096]
    - [17, 12356.0]
  - - [1024, 33708, 1, 3975, 1024, 1024, 1024, 33708]
    - [17, 12743.0]
  - - [4096, 1024, 1, 3996, 4096, 4096, 4096, 1024]
    - [17, 12365.0]
  - - [4096, 1024, 1, 2765, 4096, 4096, 4096, 1024]
    - [15, 12341.0]
  - - [4096, 1024, 1, 3538, 4096, 4096, 4096, 1024]
    - [23, 12366.0]
  - - [4096, 1024, 1, 3415, 4096, 4096, 4096, 1024]
    - [17, 12356.0]
  - - [1024, 4096, 1, 3554, 1024, 1024, 1024, 4096]
    - [17, 12360.0]
  - - [4096, 1024, 1, 3513, 4096, 4096, 4096, 1024]
    - [17, 12356.0]
  - - [1024, 4096, 1, 3304, 1024, 1024, 1024, 4096]
    - [15, 12359.0]
  - - [4096, 1024, 1, 3294, 4096, 4096, 4096, 1024]
    - [17, 12355.0]
  - - [4096, 1024, 1, 3396, 4096, 4096, 4096, 1024]
    - [4, 12369.0]
  - - [1024, 4096, 1, 3213, 1024, 1024, 1024, 4096]
    - [17, 12350.0]
  - - [4096, 1024, 1, 3137, 4096, 4096, 4096, 1024]
    - [17, 12355.0]
  - - [4096, 1024, 1, 3552, 4096, 4096, 4096, 1024]
    - [23, 12376.0]
  - - [1024, 4096, 1, 3461, 1024, 1024, 1024, 4096]
    - [17, 12360.0]
  - - [4096, 1024, 1, 3263, 4096, 4096, 4096, 1024]
    - [4, 12350.0]
  - - [4096, 1024, 1, 3430, 4096, 4096, 4096, 1024]
    - [17, 12355.0]
  - - [4096, 1024, 1, 3389, 4096, 4096, 4096, 1024]
    - [1, 12360.0]
  - - [4096, 1024, 1, 3528, 4096, 4096, 4096, 1024]
    - [4, 12374.0]
  - - [1024, 4096, 1, 3463, 1024, 1024, 1024, 4096]
    - [4, 12361.0]
  - - [4096, 1024, 1, 3526, 4096, 4096, 4096, 1024]
    - [17, 12361.0]
  - - [4096, 1024, 1, 3154, 4096, 4096, 4096, 1024]
    - [17, 12379.0]
  - - [4096, 1024, 1, 3499, 4096, 4096, 4096, 1024]
    - [17, 12363.0]
  - - [4096, 1024, 1, 3955, 4096, 4096, 4096, 1024]
    - [17, 12372.0]
  - - [1024, 4096, 1, 3297, 1024, 1024, 1024, 4096]
    - [17, 12357.0]
  - - [1024, 4096, 1, 3233, 1024, 1024, 1024, 4096]
    - [29, 12358.0]
  - - [1024, 4096, 1, 3226, 1024, 1024, 1024, 4096]
    - [17, 12356.0]
  - - [4096, 1024, 1, 3404, 4096, 4096, 4096, 1024]
    - [17, 12357.0]
  - - [4096, 1024, 1, 3355, 4096, 4096, 4096, 1024]
    - [1, 12360.0]
  - - [1024, 4096, 1, 3542, 1024, 1024, 1024, 4096]
    - [4, 12358.0]
  - - [4096, 1024, 1, 3181, 4096, 4096, 4096, 1024]
    - [17, 12348.0]
  - - [1024, 4096, 1, 3474, 1024, 1024, 1024, 4096]
    - [17, 12362.0]
  - - [4096, 1024, 1, 3319, 4096, 4096, 4096, 1024]
    - [17, 12356.0]
  - - [1024, 4096, 1, 3434, 1024, 1024, 1024, 4096]
    - [15, 12356.0]
  - - [1024, 4096, 1, 3860, 1024, 1024, 1024, 4096]
    - [4, 12366.0]
  - - [1024, 4096, 1, 3343, 1024, 1024, 1024, 4096]
    - [15, 12354.0]
  - - [1024, 4096, 1, 3488, 1024, 1024, 1024, 4096]
    - [4, 12369.0]
  - - [1024, 4096, 1, 3046, 1024, 1024, 1024, 4096]
    - [17, 12354.0]
  - - [1024, 4096, 1, 3141, 1024, 1024, 1024, 4096]
    - [4, 12371.0]
  - - [1024, 4096, 1, 3516, 1024, 1024, 1024, 4096]
    - [29, 12360.0]
  - - [4096, 1024, 1, 3147, 4096, 4096, 4096, 1024]
    - [15, 12358.0]
  - - [1024, 4096, 1, 3421, 1024, 1024, 1024, 4096]
    - [15, 12359.0]
  - - [4096, 1024, 1, 3944, 4096, 4096, 4096, 1024]
    - [15, 12369.0]
  - - [1024, 4096, 1, 3574, 1024, 1024, 1024, 4096]
    - [15, 12365.0]
  - - [1024, 4096, 1, 3977, 1024, 1024, 1024, 4096]
    - [4, 12374.0]
  - - [1024, 4096, 1, 2985, 1024, 1024, 1024, 4096]
    - [17, 12349.0]
  - - [1024, 4096, 1, 3427, 1024, 1024, 1024, 4096]
    - [17, 12385.0]
  - - [1024, 4096, 1, 3482, 1024, 1024, 1024, 4096]
    - [23, 12363.0]
  - - [1024, 4096, 1, 3332, 1024, 1024, 1024, 4096]
    - [17, 12358.0]
  - - [4096, 1024, 1, 3308, 4096, 4096, 4096, 1024]
    - [17, 12356.0]
  - - [1024, 4096, 1, 3513, 1024, 1024, 1024, 4096]
    - [17, 12365.0]
  - - [1024, 4096, 1, 3154, 1024, 1024, 1024, 4096]
    - [4, 12355.0]
  - - [1024, 4096, 1, 3955, 1024, 1024, 1024, 4096]
    - [4, 12378.0]
  - - [1024, 4096, 1, 2967, 1024, 1024, 1024, 4096]
    - [17, 12350.0]
  - - [1024, 33708, 1, 3942, 1024, 1024, 1024, 33708]
    - [4, 12749.0]
  - - [1024, 4096, 1, 3319, 1024, 1024, 1024, 4096]
    - [17, 12354.0]
  - - [4096, 1024, 1, 3860, 4096, 4096, 4096, 1024]
    - [4, 12364.0]
  - - [1024, 4096, 1, 3548, 1024, 1024, 1024, 4096]
    - [17, 12370.0]
  - - [4096, 1024, 1, 3977, 4096, 4096, 4096, 1024]
    - [4, 12361.0]
  - - [4096, 1024, 1, 3535, 4096, 4096, 4096, 1024]
    - [17, 12363.0]
  - - [1024, 4096, 1, 3541, 1024, 1024, 1024, 4096]
    - [17, 12363.0]
  - - [1024, 33708, 1, 3584, 1024, 1024, 1024, 33708]
    - [29, 12749.0]
  - - [1024, 4096, 1, 3168, 1024, 1024, 1024, 4096]
    - [17, 12365.0]
  - - [1024, 4096, 1, 3448, 1024, 1024, 1024, 4096]
    - [17, 12381.0]
  - - [4096, 1024, 1, 3343, 4096, 4096, 4096, 1024]
    - [17, 12354.0]
  - - [1024, 4096, 1, 3357, 1024, 1024, 1024, 4096]
    - [17, 12357.0]
  - - [4096, 1024, 1, 3510, 4096, 4096, 4096, 1024]
    - [17, 12362.0]
  - - [4096, 1024, 1, 3369, 4096, 4096, 4096, 1024]
    - [17, 12355.0]
  - - [4096, 1024, 1, 3379, 4096, 4096, 4096, 1024]
    - [17, 12359.0]
  - - [1024, 4096, 1, 3276, 1024, 1024, 1024, 4096]
    - [17, 12358.0]
  - - [1024, 4096, 1, 3363, 1024, 1024, 1024, 4096]
    - [4, 12373.0]
  - - [4096, 1024, 1, 3055, 4096, 4096, 4096, 1024]
    - [15, 12352.0]
  - - [1024, 4096, 1, 3524, 1024, 1024, 1024, 4096]
    - [4, 12360.0]
  - - [4096, 1024, 1, 3057, 4096, 4096, 4096, 1024]
    - [17, 12351.0]
  - - [1024, 33708, 1, 3720, 1024, 1024, 1024, 33708]
    - [17, 12747.0]
  - - [1024, 4096, 1, 3383, 1024, 1024, 1024, 4096]
    - [17, 12356.0]
  - - [1024, 4096, 1, 3522, 1024, 1024, 1024, 4096]
    - [15, 12368.0]
  - - [1024, 33708, 1, 3956, 1024, 1024, 1024, 33708]
    - [29, 12753.0]
  - - [1024, 4096, 1, 3481, 1024, 1024, 1024, 4096]
    - [15, 12358.0]
  - - [4096, 1024, 1, 3562, 4096, 4096, 4096, 1024]
    - [17, 12362.0]
  - - [4096, 1024, 1, 3299, 4096, 4096, 4096, 1024]
    - [17, 12364.0]
  - - [1024, 4096, 1, 3262, 1024, 1024, 1024, 4096]
    - [15, 12352.0]
  - - [1024, 33708, 1, 4026, 1024, 1024, 1024, 33708]
    - [17, 12748.0]
  - - [4096, 1024, 1, 3168, 4096, 4096, 4096, 1024]
    - [17, 12359.0]
  - - [1024, 4096, 1, 3999, 1024, 1024, 1024, 4096]
    - [17, 12373.0]
  - - [1024, 4096, 1, 3549, 1024, 1024, 1024, 4096]
    - [17, 12363.0]
  - - [4096, 1024, 1, 3375, 4096, 4096, 4096, 1024]
    - [4, 12353.0]
  - - [1024, 4096, 1, 3496, 1024, 1024, 1024, 4096]
    - [4, 12362.0]
  - - [1024, 4096, 1, 3190, 1024, 1024, 1024, 4096]
    - [17, 12354.0]
  - - [4096, 1024, 1, 3273, 4096, 4096, 4096, 1024]
    - [17, 12357.0]
  - - [1024, 4096, 1, 3406, 1024, 1024, 1024, 4096]
    - [15, 12358.0]
  - - [4096, 1024, 1, 4005, 4096, 4096, 4096, 1024]
    - [17, 12373.0]
  - - [4096, 1024, 1, 3555, 4096, 4096, 4096, 1024]
    - [17, 12362.0]
  - - [4096, 1024, 1, 2505, 4096, 4096, 4096, 1024]
    - [17, 12363.0]
  - - [1024, 4096, 1, 3460, 1024, 1024, 1024, 4096]
    - [17, 12365.0]
  - - [1024, 4096, 1, 3579, 1024, 1024, 1024, 4096]
    - [29, 12378.0]
  - - [1024, 33708, 1, 4030, 1024, 1024, 1024, 33708]
    - [17, 12747.0]
  - - [1024, 4096, 1, 3510, 1024, 1024, 1024, 4096]
    - [4, 12361.0]
  - - [1024, 4096, 1, 3282, 1024, 1024, 1024, 4096]
    - [29, 12367.0]
  - - [1024, 4096, 1, 3377, 1024, 1024, 1024, 4096]
    - [17, 12361.0]
  - - [1024, 4096, 1, 2935, 1024, 1024, 1024, 4096]
    - [4, 12349.0]
  - - [1024, 4096, 1, 3498, 1024, 1024, 1024, 4096]
    - [4, 12376.0]
  - - [1024, 4096, 1, 3593, 1024, 1024, 1024, 4096]
    - [11, 12369.0]
  - - [4096, 1024, 1, 3226, 4096, 4096, 4096, 1024]
    - [4, 12352.0]
  - - [1024, 4096, 1, 2499, 1024, 1024, 1024, 4096]
    - [17, 12347.0]
  - - [1024, 4096, 1, 3296, 1024, 1024, 1024, 4096]
    - [15, 12362.0]
  - - [1024, 4096, 1, 3455, 1024, 1024, 1024, 4096]
    - [4, 12358.0]
  - - [1024, 4096, 1, 3399, 1024, 1024, 1024, 4096]
    - [17, 12362.0]
  - - [1024, 4096, 1, 3205, 1024, 1024, 1024, 4096]
    - [4, 12369.0]
  - - [4096, 1024, 1, 4026, 4096, 4096, 4096, 1024]
    - [17, 12369.0]
  - - [1024, 4096, 1, 3484, 1024, 1024, 1024, 4096]
    - [17, 12364.0]
  - - [4096, 1024, 1, 3302, 4096, 4096, 4096, 1024]
    - [17, 12362.0]
  - - [1024, 4096, 1, 3485, 1024, 1024, 1024, 4096]
    - [17, 12369.0]
  - - [1024, 4096, 1, 3126, 1024, 1024, 1024, 4096]
    - [23, 12353.0]
  - - [1024, 4096, 1, 4050, 1024, 1024, 1024, 4096]
    - [17, 12373.0]
  - - [4096, 1024, 1, 3235, 4096, 4096, 4096, 1024]
    - [17, 12356.0]
  - - [1024, 33708, 1, 3955, 1024, 1024, 1024, 33708]
    - [17, 12749.0]
  - - [1024, 4096, 1, 3342, 1024, 1024, 1024, 4096]
    - [15, 12355.0]
  - - [1024, 4096, 1, 3397, 1024, 1024, 1024, 4096]
    - [1, 12364.0]
  - - [4096, 1024, 1, 3491, 4096, 4096, 4096, 1024]
    - [1, 12355.0]
  - - [1024, 4096, 1, 3503, 1024, 1024, 1024, 4096]
    - [17, 12357.0]
  - - [1024, 4096, 1, 3140, 1024, 1024, 1024, 4096]
    - [4, 12364.0]
  - - [4096, 1024, 1, 3121, 4096, 4096, 4096, 1024]
    - [17, 12350.0]
  - - [4096, 1024, 1, 3276, 4096, 4096, 4096, 1024]
    - [17, 12356.0]
  - - [1024, 4096, 1, 3321, 1024, 1024, 1024, 4096]
    - [17, 12354.0]
  - - [1024, 4096, 1, 3870, 1024, 1024, 1024, 4096]
    - [4, 12363.0]
  - - [4096, 1024, 1, 3475, 4096, 4096, 4096, 1024]
    - [17, 12360.0]
  - - [1024, 4096, 1, 2984, 1024, 1024, 1024, 4096]
    - [15, 12355.0]
  - - [4096, 1024, 1, 3363, 4096, 4096, 4096, 1024]
    - [17, 12355.0]
  - - [1024, 4096, 1, 3582, 1024, 1024, 1024, 4096]
    - [17, 12363.0]
  - - [4096, 1024, 1, 3509, 4096, 4096, 4096, 1024]
    - [17, 12357.0]
  - - [1024, 4096, 1, 3426, 1024, 1024, 1024, 4096]
    - [4, 12357.0]
  - - [4096, 1024, 1, 3136, 4096, 4096, 4096, 1024]
    - [17, 12361.0]
  - - [1024, 4096, 1, 3232, 1024, 1024, 1024, 4096]
    - [17, 12361.0]
  - - [4096, 1024, 1, 3103, 4096, 4096, 4096, 1024]
    - [29, 12347.0]
  - - [1024, 4096, 1, 3335, 1024, 1024, 1024, 4096]
    - [17, 12356.0]
  - - [1024, 4096, 1, 3900, 1024, 1024, 1024, 4096]
    - [17, 12368.0]
  - - [4096, 1024, 1, 3512, 4096, 4096, 4096, 1024]
    - [17, 12362.0]
  - - [4096, 1024, 1, 3222, 4096, 4096, 4096, 1024]
    - [17, 12356.0]
  - - [1024, 4096, 1, 3165, 1024, 1024, 1024, 4096]
    - [4, 12360.0]
  - - [4096, 1024, 1, 3408, 4096, 4096, 4096, 1024]
    - [17, 12364.0]
  - - [4096, 1024, 1, 3751, 4096, 4096, 4096, 1024]
    - [1, 12360.0]
  - - [1024, 4096, 1, 3318, 1024, 1024, 1024, 4096]
    - [4, 12354.0]
  - - [4096, 1024, 1, 3442, 4096, 4096, 4096, 1024]
    - [29, 12357.0]
  - - [1024, 4096, 1, 3413, 1024, 1024, 1024, 4096]
    - [17, 12355.0]
  - - [4096, 1024, 1, 3524, 4096, 4096, 4096, 1024]
    - [17, 12369.0]
  - - [1024, 4096, 1, 3976, 1024, 1024, 1024, 4096]
    - [17, 12368.0]
  - - [1024, 4096, 1, 3475, 1024, 1024, 1024, 4096]
    - [17, 12360.0]
  - - [1024, 4096, 1, 3534, 1024, 1024, 1024, 4096]
    - [15, 12364.0]
  - - [4096, 1024, 1, 3301, 4096, 4096, 4096, 1024]
    - [17, 12358.0]
  - - [4096, 1024, 1, 3248, 4096, 4096, 4096, 1024]
    - [1, 12366.0]
  - - [1024, 4096, 1, 2977, 1024, 1024, 1024, 4096]
    - [4, 12354.0]
  - - [4096, 1024, 1, 3346, 4096, 4096, 4096, 1024]
    - [17, 12365.0]
  - - [1024, 4096, 1, 3451, 1024, 1024, 1024, 4096]
    - [15, 12360.0]
  - - [1024, 4096, 1, 3257, 1024, 1024, 1024, 4096]
    - [17, 12355.0]
  - - [1024, 4096, 1, 3356, 1024, 1024, 1024, 4096]
    - [29, 12363.0]
  - - [4096, 1024, 1, 3348, 4096, 4096, 4096, 1024]
    - [29, 12357.0]
  - - [4096, 1024, 1, 3335, 4096, 4096, 4096, 1024]
    - [17, 12356.0]
  - - [4096, 1024, 1, 3505, 4096, 4096, 4096, 1024]
    - [17, 12361.0]
  - - [1024, 4096, 1, 3490, 1024, 1024, 1024, 4096]
    - [17, 12364.0]
  - - [4096, 1024, 1, 3447, 4096, 4096, 4096, 1024]
    - [17, 12360.0]
  - - [1024, 4096, 1, 3267, 1024, 1024, 1024, 4096]
    - [15, 12361.0]
  - - [4096, 1024, 1, 3230, 4096, 4096, 4096, 1024]
    - [29, 12352.0]
  - - [4096, 1024, 1, 3455, 4096, 4096, 4096, 1024]
    - [23, 12369.0]
  - - [1024, 4096, 1, 3925, 1024, 1024, 1024, 4096]
    - [4, 12370.0]
  - - [1024, 4096, 1, 3362, 1024, 1024, 1024, 4096]
    - [17, 12358.0]
  - - [4096, 1024, 1, 3969, 4096, 4096, 4096, 1024]
    - [4, 12372.0]
  - - [4096, 1024, 1, 3527, 4096, 4096, 4096, 1024]
    - [17, 12363.0]
  - - [1024, 4096, 1, 3585, 1024, 1024, 1024, 4096]
    - [17, 12364.0]
  - - [4096, 1024, 1, 3063, 4096, 4096, 4096, 1024]
    - [15, 12347.0]
  - - [4096, 1024, 1, 3435, 4096, 4096, 4096, 1024]
    - [17, 12362.0]
  - - [4096, 1024, 1, 3366, 4096, 4096, 4096, 1024]
    - [4, 12368.0]
  - - [4096, 1024, 1, 3581, 4096, 4096, 4096, 1024]
    - [23, 12355.0]
  - - [1024, 33708, 1, 3906, 1024, 1024, 1024, 33708]
    - [4, 12750.0]
  - - [1024, 4096, 1, 3464, 1024, 1024, 1024, 4096]
    - [15, 12358.0]
  - - [1024, 4096, 1, 3440, 1024, 1024, 1024, 4096]
    - [4, 12369.0]
  - - [4096, 1024, 1, 3143, 4096, 4096, 4096, 1024]
    - [4, 12354.0]
  - - [1024, 4096, 1, 3349, 1024, 1024, 1024, 4096]
    - [17, 12359.0]
  - - [4096, 1024, 1, 3416, 4096, 4096, 4096, 1024]
    - [15, 12360.0]
  - - [4096, 1024, 1, 3365, 4096, 4096, 4096, 1024]
    - [17, 12363.0]
  - - [1024, 4096, 1, 3470, 1024, 1024, 1024, 4096]
    - [15, 12361.0]
  - - [4096, 1024, 1, 3287, 4096, 4096, 4096, 1024]
    - [17, 12358.0]
  - - [1024, 4096, 1, 3441, 1024, 1024, 1024, 4096]
    - [17, 12366.0]
  - - [4096, 1024, 1, 3224, 4096, 4096, 4096, 1024]
    - [15, 12357.0]
  - - [1024, 4096, 1, 3387, 1024, 1024, 1024, 4096]
    - [17, 12361.0]
  - - [1024, 4096, 1, 3547, 1024, 1024, 1024, 4096]
    - [4, 12363.0]
  - - [4096, 1024, 1, 3478, 4096, 4096, 4096, 1024]
    - [17, 12362.0]
  - - [4096, 1024, 1, 3548, 4096, 4096, 4096, 1024]
    - [17, 12364.0]
  - - [1024, 33708, 1, 4020, 1024, 1024, 1024, 33708]
    - [17, 12750.0]
  - - [4096, 1024, 1, 3320, 4096, 4096, 4096, 1024]
    - [17, 12359.0]
  - - [1024, 4096, 1, 3906, 1024, 1024, 1024, 4096]
    - [17, 12378.0]
  - - [4096, 1024, 1, 3796, 4096, 4096, 4096, 1024]
    - [17, 12373.0]
  - - [1024, 4096, 1, 3306, 1024, 1024, 1024, 4096]
    - [17, 12356.0]
  - - [1024, 4096, 1, 3401, 1024, 1024, 1024, 4096]
    - [4, 12363.0]
  - - [1024, 4096, 1, 3215, 1024, 1024, 1024, 4096]
    - [4, 12358.0]
  - - [4096, 1024, 1, 4012, 4096, 4096, 4096, 1024]
    - [17, 12372.0]
  - - [1024, 4096, 1, 2765, 1024, 1024, 1024, 4096]
    - [15, 12340.0]
  - - [4096, 1024, 1, 3554, 4096, 4096, 4096, 1024]
    - [17, 12360.0]
  - - [4096, 1024, 1, 3423, 4096, 4096, 4096, 1024]
    - [15, 12362.0]
  - - [1024, 4096, 1, 3562, 1024, 1024, 1024, 4096]
    - [17, 12362.0]
  - - [1024, 4096, 1, 3489, 1024, 1024, 1024, 4096]
    - [17, 12361.0]
  - - [4096, 1024, 1, 3358, 4096, 4096, 4096, 1024]
    - [17, 12363.0]
  - - [4096, 1024, 1, 3270, 4096, 4096, 4096, 1024]
    - [29, 12378.0]
  - - [1024, 4096, 1, 3293, 1024, 1024, 1024, 4096]
    - [15, 12356.0]
  - - [1024, 4096, 1, 3376, 1024, 1024, 1024, 4096]
    - [15, 12364.0]
  - - [4096, 1024, 1, 3245, 4096, 4096, 4096, 1024]
    - [17, 12357.0]
  - - [4096, 1024, 1, 3541, 4096, 4096, 4096, 1024]
    - [17, 12363.0]
  - - [4096, 1024, 1, 3443, 4096, 4096, 4096, 1024]
    - [17, 12366.0]
  - - [4096, 1024, 1, 3438, 4096, 4096, 4096, 1024]
    - [15, 12361.0]
  - - [4096, 1024, 1, 3244, 4096, 4096, 4096, 1024]
    - [17, 12355.0]
  - - [1024, 4096, 1, 3365, 1024, 1024, 1024, 4096]
    - [17, 12362.0]
  - - [1024, 4096, 1, 3299, 1024, 1024, 1024, 4096]
    - [29, 12360.0]
  - - [1024, 4096, 1, 3471, 1024, 1024, 1024, 4096]
    - [15, 12358.0]
  - - [1024, 4096, 1, 3398, 1024, 1024, 1024, 4096]
    - [17, 12361.0]
  - - [4096, 1024, 1, 3162, 4096, 4096, 4096, 1024]
    - [17, 12351.0]
  - - [1024, 4096, 1, 4005, 1024, 1024, 1024, 4096]
    - [4, 12376.0]
  - - [4096, 1024, 1, 3579, 4096, 4096, 4096, 1024]
    - [17, 12365.0]
  - - [1024, 4096, 1, 3121, 1024, 1024, 1024, 4096]
    - [15, 12350.0]
  - - [4096, 1024, 1, 3441, 4096, 4096, 4096, 1024]
    - [17, 12365.0]
  - - [4096, 1024, 1, 3422, 4096, 4096, 4096, 1024]
    - [17, 12363.0]
  - - [4096, 1024, 1, 3444, 4096, 4096, 4096, 1024]
    - [23, 12368.0]
  - - [1024, 4096, 1, 3337, 1024, 1024, 1024, 4096]
    - [17, 12359.0]
  - - [4096, 1024, 1, 3550, 4096, 4096, 4096, 1024]
    - [17, 12362.0]
  - - [1024, 4096, 1, 3477, 1024, 1024, 1024, 4096]
    - [17, 12366.0]
  - - [4096, 1024, 1, 3490, 4096, 4096, 4096, 1024]
    - [17, 12365.0]
  - - [4096, 1024, 1, 3585, 4096, 4096, 4096, 1024]
    - [17, 12369.0]
  - - [1024, 4096, 1, 3143, 1024, 1024, 1024, 4096]
    - [17, 12355.0]
  - - [1024, 33708, 1, 3876, 1024, 1024, 1024, 33708]
    - [29, 12750.0]
  - - [1024, 4096, 1, 3320, 1024, 1024, 1024, 4096]
    - [15, 12364.0]
  - - [1024, 4096, 1, 3423, 1024, 1024, 1024, 4096]
    - [17, 12376.0]
  - - [1024, 4096, 1, 3894, 1024, 1024, 1024, 4096]
    - [15, 12368.0]
  - - [4096, 1024, 1, 3410, 4096, 4096, 4096, 1024]
    - [17, 12353.0]
  - - [1024, 4096, 1, 3561, 1024, 1024, 1024, 4096]
    - [17, 12365.0]
  - - [4096, 1024, 1, 3492, 4096, 4096, 4096, 1024]
    - [29, 12356.0]
  - - [36548, 1024, 1, 3712, 36548, 36548, 36548, 1024]
    - [17, 12741.0]
  - - [4096, 2048, 1, 128, 4096, 4096, 4096, 2048]
    - [0, 11541.0]
  - - [4096, 3072, 1, 128, 4096, 4096, 4096, 3072]
    - [11, 11855.0]
  - - [768, 3072, 1, 4096, 768, 768, 768, 3072]
    - [3, 11512.0]
  - - [768, 30522, 1, 1280, 768, 768, 768, 30522]
    - [17, 12674.0]
  - - [768, 30522, 1, 320, 768, 768, 768, 30522]
    - [17, 12439.0]
  - - [768, 30522, 1, 640, 768, 768, 768, 30522]
    - [29, 12609.0]
  - - [256, 512, 36, 98, 256, 256, 256, 512]
    - [14, 10968.0]
  - - [256, 256, 64, 56, 256, 256, 256, 256]
    - [0, 10203.0]
  - - [512, 486, 36, 800, 512, 512, 512, 486]
    - [1, 11764.0]
  - - [512, 512, 36, 1568, 512, 512, 512, 512]
    - [29, 12600.0]
  - - [256, 384, 36, 4096, 256, 256, 256, 384]
    - [29, 12279.0]
  - - [128, 256, 64, 32, 128, 128, 128, 256]
    - [14, 5202.0]
  - - [128, 256, 64, 9, 128, 128, 128, 256]
    - [18, 1774.0]
  - - [256, 512, 36, 784, 256, 256, 256, 512]
    - [4, 11907.0]
  - - [256, 324, 36, 32, 256, 256, 256, 324]
    - [0, 6253.0]
  - - [512, 512, 36, 33, 512, 512, 512, 512]
    - [0, 7732.0]
  - - [192, 384, 64, 128, 192, 192, 192, 384]
    - [0, 8379.0]
  - - [512, 512, 64, 72, 512, 512, 512, 512]
    - [14, 11617.0]
  - - [512, 512, 36, 128, 512, 512, 512, 512]
    - [18, 11792.0]
  - - [192, 384, 64, 2304, 192, 192, 192, 384]
    - [29, 9083.0]
  - - [384, 256, 64, 450, 384, 384, 384, 256]
    - [29, 11787.0]
  - - [384, 256, 64, 2304, 384, 384, 384, 256]
    - [17, 12148.0]
  - - [512, 512, 64, 144, 512, 512, 512, 512]
    - [18, 11913.0]
  - - [256, 256, 36, 6272, 256, 256, 256, 256]
    - [3, 11519.0]
  - - [256, 384, 64, 2304, 256, 256, 256, 384]
    - [4, 12149.0]
  - - [512, 512, 36, 66, 512, 512, 512, 512]
    - [0, 10731.0]
  - - [128, 256, 64, 800, 128, 128, 128, 256]
    - [28, 11457.0]
  - - [192, 256, 36, 512, 192, 192, 192, 256]
    - [14, 8415.0]
  - - [256, 512, 64, 200, 256, 256, 256, 512]
    - [15, 11975.0]
  - - [256, 512, 64, 25, 256, 256, 256, 512]
    - [20, 5650.0]
  - - [128, 256, 36, 1568, 128, 128, 128, 256]
    - [30, 10822.0]
  - - [128, 256, 64, 288, 128, 128, 128, 256]
    - [25, 11256.0]
  - - [256, 384, 64, 1152, 256, 256, 256, 384]
    - [4, 12070.0]
  - - [160, 320, 64, 288, 160, 160, 160, 320]
    - [25, 7168.0]
  - - [128, 256, 36, 128, 128, 128, 128, 256]
    - [5, 9508.0]
  - - [512, 512, 36, 16, 512, 512, 512, 512]
    - [8, 3821.0]
  - - [384, 256, 36, 800, 384, 384, 384, 256]
    - [15, 12055.0]
  - - [192, 384, 36, 4096, 192, 192, 192, 384]
    - [17, 9173.0]
  - - [256, 384, 64, 576, 256, 256, 256, 384]
    - [17, 11897.0]
  - - [512, 512, 64, 14, 512, 512, 512, 512]
    - [0, 3928.0]
  - - [512, 512, 36, 8, 512, 512, 512, 512]
    - [0, 1989.0]
  - - [512, 486, 64, 128, 512, 512, 512, 486]
    - [8, 11144.0]
  - - [256, 256, 36, 128, 256, 256, 256, 256]
    - [25, 10724.0]
  - - [256, 256, 36, 32, 256, 256, 256, 256]
    - [14, 6198.0]
  - - [192, 256, 64, 288, 192, 192, 192, 256]
    - [5, 8668.0]
  - - [256, 256, 36, 16, 256, 256, 256, 256]
    - [3, 3288.0]
  - - [128, 256, 36, 3200, 128, 128, 128, 256]
    - [30, 10882.0]
  - - [160, 320, 64, 512, 160, 160, 160, 320]
    - [14, 7437.0]
  - - [160, 320, 36, 512, 160, 160, 160, 320]
    - [0, 7332.0]
  - - [256, 512, 36, 4, 256, 256, 256, 512]
    - [27, 953.0]
  - - [256, 324, 64, 1568, 256, 256, 256, 324]
    - [29, 10182.0]
  - - [256, 256, 36, 3200, 256, 256, 256, 256]
    - [3, 11474.0]
  - - [256, 256, 36, 210, 256, 256, 256, 256]
    - [14, 10794.0]
  - - [192, 384, 64, 576, 192, 192, 192, 384]
    - [1, 8883.0]
  - - [512, 512, 64, 800, 512, 512, 512, 512]
    - [17, 12522.0]
  - - [256, 256, 64, 1152, 256, 256, 256, 256]
    - [29, 12180.0]
  - - [512, 486, 64, 512, 512, 512, 512, 486]
    - [1, 11719.0]
  - - [256, 512, 64, 1600, 256, 256, 256, 512]
    - [17, 12475.0]
  - - [512, 512, 64, 9, 512, 512, 512, 512]
    - [0, 2489.0]
  - - [256, 512, 36, 1568, 256, 256, 256, 512]
    - [29, 12029.0]
  - - [128, 256, 64, 3200, 128, 128, 128, 256]
    - [28, 11672.0]
  - - [256, 512, 64, 4, 256, 256, 256, 512]
    - [0, 1084.0]
  - - [256, 256, 64, 450, 256, 256, 256, 256]
    - [9, 11908.0]
  - - [256, 256, 64, 72, 256, 256, 256, 256]
    - [25, 10824.0]
  - - [128, 256, 36, 3136, 128, 128, 128, 256]
    - [36, 10874.0]
  - - [160, 320, 64, 242, 160, 160, 160, 320]
    - [0, 7097.0]
  - - [512, 512, 36, 512, 512, 512, 512, 512]
    - [4, 12407.0]
  - - [512, 512, 36, 256, 512, 512, 512, 512]
    - [15, 12161.0]
  - - [512, 512, 36, 1024, 512, 512, 512, 512]
    - [4, 12552.0]
  - - [256, 256, 36, 4096, 256, 256, 256, 256]
    - [3, 11497.0]
  - - [256, 256, 64, 896, 256, 256, 256, 256]
    - [4, 12106.0]
  - - [128, 256, 64, 242, 128, 128, 128, 256]
    - [14, 10999.0]
  - - [192, 384, 36, 1024, 192, 192, 192, 384]
    - [18, 9007.0]
  - - [128, 256, 64, 100, 128, 128, 128, 256]
    - [31, 10073.0]
  - - [384, 256, 64, 1152, 384, 384, 384, 256]
    - [17, 12072.0]
  - - [192, 384, 36, 128, 192, 192, 192, 384]
    - [0, 7778.0]
  - - [128, 256, 64, 1568, 128, 128, 128, 256]
    - [3, 11549.0]
  - - [128, 256, 64, 72, 128, 128, 128, 256]
    - [25, 9298.0]
  - - [256, 256, 36, 12544, 256, 256, 256, 256]
    - [28, 11535.0]
  - - [256, 256, 36, 105, 256, 256, 256, 256]
    - [25, 10128.0]
  - - [128, 256, 36, 392, 128, 128, 128, 256]
    - [5, 10331.0]
  - - [384, 256, 36, 1024, 384, 384, 384, 256]
    - [17, 12053.0]
  - - [128, 256, 64, 1152, 128, 128, 128, 256]
    - [28, 11490.0]
  - - [256, 324, 64, 32, 256, 256, 256, 324]
    - [0, 7119.0]
  - - [256, 384, 36, 800, 256, 256, 256, 384]
    - [15, 12075.0]
  - - [512, 512, 64, 4, 512, 512, 512, 512]
    - [0, 1058.0]
  - - [192, 320, 36, 128, 192, 192, 192, 320]
    - [8, 7693.0]
  - - [192, 384, 64, 242, 192, 192, 192, 384]
    - [25, 8684.0]
  - - [256, 486, 64, 32, 256, 256, 256, 486]
    - [0, 7194.0]
  - - [512, 512, 64, 64, 512, 512, 512, 512]
    - [0, 11467.0]
  - - [128, 256, 36, 512, 128, 128, 128, 256]
    - [18, 10537.0]
  - - [512, 512, 64, 576, 512, 512, 512, 512]
    - [17, 12470.0]
  - - [256, 256, 64, 9, 256, 256, 256, 256]
    - [0, 2226.0]
  - - [128, 256, 36, 12544, 128, 128, 128, 256]
    - [6, 11059.0]
  - - [256, 512, 36, 3136, 256, 256, 256, 512]
    - [17, 12103.0]
  - - [144, 288, 36, 512, 144, 144, 144, 288]
    - [25, 5909.0]
  - - [384, 384, 36, 800, 384, 384, 384, 384]
    - [4, 11852.0]
  - - [512, 512, 64, 1600, 512, 512, 512, 512]
    - [29, 12580.0]
  - - [512, 512, 36, 4, 512, 512, 512, 512]
    - [0, 1050.0]
  - - [192, 384, 64, 450, 192, 192, 192, 384]
    - [9, 8800.0]
  - - [256, 256, 36, 1024, 256, 256, 256, 256]
    - [28, 11316.0]
  - - [256, 512, 64, 400, 256, 256, 256, 512]
    - [1, 12164.0]
  - - [128, 256, 36, 6272, 128, 128, 128, 256]
    - [6, 10996.0]
  - - [256, 256, 36, 512, 256, 256, 256, 256]
    - [25, 11195.0]
  - - [256, 256, 64, 112, 256, 256, 256, 256]
    - [25, 11265.0]
  - - [512, 512, 64, 18, 512, 512, 512, 512]
    - [1, 4800.0]
  - - [256, 256, 64, 18, 256, 256, 256, 256]
    - [0, 3888.0]
  - - [256, 256, 64, 1568, 256, 256, 256, 256]
    - [4, 12248.0]
  - - [384, 256, 36, 4096, 384, 384, 384, 256]
    - [29, 12282.0]
  - - [256, 512, 64, 800, 256, 256, 256, 512]
    - [4, 12376.0]
  - - [256, 384, 36, 2048, 256, 256, 256, 384]
    - [17, 12193.0]
  - - [384, 384, 64, 2304, 384, 384, 384, 384]
    - [17, 12628.0]
  - - [160, 320, 64, 128, 160, 160, 160, 320]
    - [20, 6831.0]
  - - [512, 512, 36, 528, 512, 512, 512, 512]
    - [29, 12401.0]
  - - [160, 320, 36, 128, 160, 160, 160, 320]
    - [25, 6514.0]
  - - [256, 512, 36, 49, 256, 256, 256, 512]
    - [25, 8990.0]
  - - [384, 384, 64, 450, 384, 384, 384, 384]
    - [29, 12307.0]
  - - [256, 256, 64, 3200, 256, 256, 256, 256]
    - [4, 12353.0]
  - - [512, 512, 64, 8, 512, 512, 512, 512]
    - [0, 2170.0]
  - - [512, 512, 64, 288, 512, 512, 512, 512]
    - [29, 12287.0]
  - - [384, 384, 36, 1024, 384, 384, 384, 384]
    - [29, 11903.0]
  - - [128, 256, 36, 16, 128, 128, 128, 256]
    - [2, 2483.0]
  - - [256, 256, 64, 288, 256, 256, 256, 256]
    - [1, 11820.0]
  - - [256, 384, 36, 1024, 256, 256, 256, 384]
    - [4, 12073.0]
  - - [256, 324, 36, 3200, 256, 256, 256, 324]
    - [29, 10303.0]
  - - [192, 384, 64, 512, 192, 192, 192, 384]
    - [26, 8844.0]
  - - [128, 256, 64, 1600, 128, 128, 128, 256]
    - [3, 11552.0]
  - - [512, 512, 36, 32, 512, 512, 512, 512]
    - [0, 8166.0]
  - - [512, 512, 36, 3136, 512, 512, 512, 512]
    - [4, 12644.0]
  - - [128, 256, 64, 6400, 128, 128, 128, 256]
    - [28, 11758.0]
  - - [256, 256, 36, 2048, 256, 256, 256, 256]
    - [16, 11463.0]
  - - [256, 256, 64, 6400, 256, 256, 256, 256]
    - [17, 12380.0]
  - - [256, 256, 36, 1680, 256, 256, 256, 256]
    - [28, 11415.0]
  - - [192, 384, 36, 2048, 192, 192, 192, 384]
    - [29, 9096.0]
  - - [256, 256, 64, 144, 256, 256, 256, 256]
    - [14, 11260.0]
  - - [384, 384, 36, 4096, 384, 384, 384, 384]
    - [4, 12061.0]
  - - [160, 320, 64, 1152, 160, 160, 160, 320]
    - [3, 7501.0]
  - - [384, 256, 36, 2048, 384, 384, 384, 256]
    - [4, 12197.0]
  - - [256, 512, 36, 392, 256, 256, 256, 512]
    - [14, 11765.0]
  - - [256, 512, 64, 50, 256, 256, 256, 512]
    - [24, 9629.0]
  - - [384, 384, 36, 2048, 384, 384, 384, 384]
    - [29, 12018.0]
  - - [256, 384, 64, 450, 256, 256, 256, 384]
    - [1, 11782.0]
  - - [192, 320, 64, 128, 192, 192, 192, 320]
    - [25, 8240.0]
  - - [128, 256, 36, 32, 128, 128, 128, 256]
    - [27, 5272.0]
  - - [512, 512, 64, 256, 512, 512, 512, 512]
    - [4, 12251.0]
  - - [256, 512, 64, 32, 256, 256, 256, 512]
    - [0, 7781.0]
  - - [384, 384, 64, 576, 384, 384, 384, 384]
    - [17, 12430.0]
  - - [512, 486, 36, 288, 512, 512, 512, 486]
    - [30, 11294.0]
  - - [144, 288, 64, 242, 144, 144, 144, 288]
    - [31, 5755.0]
  - - [384, 256, 64, 576, 384, 384, 384, 256]
    - [29, 11904.0]
  - - [512, 512, 36, 64, 512, 512, 512, 512]
    - [14, 11098.0]
  - - [448, 384, 64, 128, 448, 448, 448, 384]
    - [20, 10180.0]
  - - [144, 288, 64, 288, 144, 144, 144, 288]
    - [3, 5862.0]
  - - [512, 512, 64, 224, 512, 512, 512, 512]
    - [1, 12202.0]
  - - [384, 384, 64, 1152, 384, 384, 384, 384]
    - [4, 12560.0]
  - - [448, 384, 36, 128, 448, 448, 448, 384]
    - [31, 9867.0]
  - - [256, 486, 36, 128, 256, 256, 256, 486]
    - [14, 10692.0]
  - - [256, 256, 36, 800, 256, 256, 256, 256]
    - [14, 11337.0]
  - - [192, 384, 36, 800, 192, 192, 192, 384]
    - [36, 8935.0]
  - - [256, 256, 36, 256, 256, 256, 256, 256]
    - [25, 11066.0]
  - - [192, 384, 64, 1152, 192, 192, 192, 384]
    - [17, 9005.0]
  - - [128, 256, 64, 200, 128, 128, 128, 256]
    - [25, 10951.0]
  - - [512, 512, 64, 28, 512, 512, 512, 512]
    - [1, 7144.0]
  - - [144, 288, 64, 1152, 144, 144, 144, 288]
    - [16, 6074.0]
  - - [256, 256, 64, 576, 256, 256, 256, 256]
    - [18, 11978.0]
  - - [256, 256, 64, 2304, 256, 256, 256, 256]
    - [4, 12304.0]
  - - [192, 384, 36, 512, 192, 192, 192, 384]
    - [30, 8824.0]
  - - [256, 512, 36, 32, 256, 256, 256, 512]
    - [20, 6693.0]
  - - [512, 512, 64, 128, 512, 512, 512, 512]
    - [4, 11942.0]
  - - [512, 512, 64, 32, 512, 512, 512, 512]
    - [0, 8996.0]
  - - [128, 256, 36, 196, 128, 128, 128, 256]
    - [5, 9780.0]
  - - [196, 528, 32, 32, 196, 196, 196, 528]
    - [8, 3984.0]
  - - [196, 512, 32, 24, 196, 196, 196, 512]
    - [14, 3339.0]
  - - [1225, 192, 32, 32, 1225, 1225, 1225, 192]
    - [25, 8044.0]
  - - [1001, 1536, 1, 32, 1001, 1001, 1001, 1536]
    - [25, 5360.0]
  - - [196, 480, 32, 64, 196, 196, 196, 480]
    - [31, 5928.0]
  - - [289, 1024, 32, 384, 289, 289, 289, 1024]
    - [26, 9157.0]
  - - [784, 192, 32, 96, 784, 784, 784, 192]
    - [14, 9814.0]
  - - [50176, 256, 1, 128, 50176, 50176, 50176, 256]
    - [30, 11800.0]
  - - [289, 1024, 32, 256, 289, 289, 289, 1024]
    - [15, 9049.0]
  - - [289, 1024, 32, 192, 289, 289, 289, 1024]
    - [12, 8907.0]
  - - [12544, 512, 1, 256, 12544, 12544, 12544, 512]
    - [26, 11940.0]
  - - [1225, 1728, 1, 192, 1225, 1225, 1225, 1728]
    - [8, 10258.0]
  - - [196, 480, 32, 96, 196, 196, 196, 480]
    - [0, 6918.0]
  - - [196, 512, 32, 144, 196, 196, 196, 512]
    - [31, 8205.0]
  - - [289, 768, 32, 128, 289, 289, 289, 768]
    - [18, 8648.0]
  - - [5329, 576, 1, 96, 5329, 5329, 5329, 576]
    - [14, 10615.0]
  - - [196, 528, 32, 128, 196, 196, 196, 528]
    - [14, 7481.0]
  - - [5329, 448, 1, 64, 5329, 5329, 5329, 448]
    - [0, 8967.0]
  - - [784, 256, 32, 64, 784, 784, 784, 256]
    - [14, 9617.0]
  - - [784, 192, 32, 32, 784, 784, 784, 192]
    - [20, 7638.0]
  - - [21609, 288, 1, 32, 21609, 21609, 21609, 288]
    - [31, 7398.0]
  - - [784, 256, 32, 32, 784, 784, 784, 256]
    - [14, 8003.0]
  - - [5041, 720, 1, 192, 5041, 5041, 5041, 720]
    - [0, 10552.0]
  - - [196, 512, 32, 128, 196, 196, 196, 512]
    - [31, 8063.0]
  - - [289, 768, 32, 160, 289, 289, 289, 768]
    - [30, 8823.0]
  - - [1001, 4096, 1, 512, 1001, 1001, 1001, 4096]
    - [1, 11712.0]
  - - [1225, 192, 32, 64, 1225, 1225, 1225, 192]
    - [25, 10368.0]
  - - [784, 192, 32, 16, 784, 784, 784, 192]
    - [0, 4660.0]
  - - [3136, 1024, 1, 2048, 3136, 3136, 3136, 1024]
    - [26, 12099.0]
  - - [784, 256, 32, 128, 784, 784, 784, 256]
    - [20, 10099.0]
  - - [196, 512, 32, 32, 196, 196, 196, 512]
    - [33, 4114.0]
  - - [1225, 384, 32, 96, 1225, 1225, 1225, 384]
    - [0, 11089.0]
  - - [5041, 576, 1, 96, 5041, 5041, 5041, 576]
    - [25, 10503.0]
  - - [5329, 160, 32, 64, 5329, 5329, 5329, 160]
    - [0, 8100.0]
  - - [1225, 288, 32, 48, 1225, 1225, 1225, 288]
    - [31, 8198.0]
  - - [4096, 9216, 1, 512, 4096, 4096, 4096, 9216]
    - [17, 12651.0]
  - - [196, 480, 32, 192, 196, 196, 196, 480]
    - [8, 7977.0]
  - - [3136, 1024, 1, 512, 3136, 3136, 3136, 1024]
    - [5, 11823.0]
  - - [784, 192, 32, 64, 784, 784, 784, 192]
    - [25, 9568.0]
  - - [289, 1024, 32, 128, 289, 289, 289, 1024]
    - [14, 8739.0]
  - - [289, 768, 32, 192, 289, 289, 289, 768]
    - [5, 8911.0]
  - - [196, 512, 32, 112, 196, 196, 196, 512]
    - [31, 7912.0]
  - - [1001, 2048, 1, 32, 1001, 1001, 1001, 2048]
    - [20, 6063.0]
  - - [1225, 288, 32, 64, 1225, 1225, 1225, 288]
    - [25, 9125.0]
  - - [1225, 384, 32, 192, 1225, 1225, 1225, 384]
    - [1, 11356.0]
  - - [50176, 256, 1, 512, 50176, 50176, 50176, 256]
    - [29, 12309.0]
  - - [196, 512, 32, 160, 196, 196, 196, 512]
    - [25, 8365.0]
  - - [4096, 4096, 1, 512, 4096, 4096, 4096, 4096]
    - [17, 12481.0]
  - - [1225, 256, 32, 64, 1225, 1225, 1225, 256]
    - [25, 10457.0]
  - - [196, 480, 32, 16, 196, 196, 196, 480]
    - [25, 2230.0]
  - - [1225, 256, 32, 48, 1225, 1225, 1225, 256]
    - [0, 9818.0]
  - - [1225, 1200, 1, 64, 1225, 1225, 1225, 1200]
    - [25, 7599.0]
  - - [1225, 384, 32, 64, 1225, 1225, 1225, 384]
    - [0, 10659.0]
  - - [12544, 512, 1, 1024, 12544, 12544, 12544, 512]
    - [26, 12334.0]
  - - [196, 512, 32, 64, 196, 196, 196, 512]
    - [8, 6324.0]
  - - [196, 528, 32, 256, 196, 196, 196, 528]
    - [25, 7876.0]
  - - [196, 528, 32, 160, 196, 196, 196, 528]
    - [20, 7708.0]
  - - [1225, 192, 32, 48, 1225, 1225, 1225, 192]
    - [20, 9603.0]
  - - [1001, 2048, 1, 64, 1001, 1001, 1001, 2048]
    - [31, 8553.0]
  - - [289, 768, 128, 128, 289, 289, 289, 768]
    - [0, 8941.0]
  - - [1225, 192, 128, 64, 1225, 1225, 1225, 192]
    - [0, 7830.0]
  - - [1225, 288, 128, 48, 1225, 1225, 1225, 288]
    - [13, 5445.0]
  - - [289, 768, 128, 192, 289, 289, 289, 768]
    - [15, 9113.0]
  - - [289, 768, 128, 160, 289, 289, 289, 768]
    - [25, 9022.0]
  - - [1225, 256, 128, 48, 1225, 1225, 1225, 256]
    - [0, 7280.0]
  - - [1225, 192, 128, 48, 1225, 1225, 1225, 192]
    - [7, 5535.0]
  - - [1225, 288, 128, 64, 1225, 1225, 1225, 288]
    - [3, 6933.0]
  - - [1225, 256, 128, 64, 1225, 1225, 1225, 256]
    - [3, 6231.0]
  - - [1001, 2048, 1, 128, 1001, 1001, 1001, 2048]
    - [14, 9828.0]
  - - [1225, 192, 128, 32, 1225, 1225, 1225, 192]
    - [0, 4204.0]
  - - [1001, 1536, 1, 64, 1001, 1001, 1001, 1536]
    - [14, 7225.0]
  - - [1024, 4096, 1, 64, 1024, 1024, 1024, 4096]
    - [0, 10421.0]
  - - [1024, 4096, 1, 6336, 1024, 1024, 1024, 4096]
    - [4, 12394.0]
  - - [512, 33708, 1, 3780, 512, 512, 512, 33708]
    - [4, 12704.0]
  - - [512, 33708, 1, 3968, 512, 512, 512, 33708]
    - [29, 12703.0]
  - - [512, 33708, 1, 4030, 512, 512, 512, 33708]
    - [4, 12704.0]
  - - [196, 256, 64, 1024, 196, 196, 196, 256]
    - [11, 9202.0]
  - - [196, 1024, 64, 256, 196, 196, 196, 1024]
    - [18, 9120.0]
  - - [289, 768, 64, 128, 289, 289, 289, 768]
    - [14, 8828.0]
  - - [289, 768, 64, 160, 289, 289, 289, 768]
    - [5, 8933.0]
  - - [289, 768, 64, 192, 289, 289, 289, 768]
    - [18, 9023.0]
  - - [784, 128, 64, 512, 784, 784, 784, 128]
    - [26, 10478.0]
  - - [784, 512, 64, 128, 784, 784, 784, 512]
    - [5, 10503.0]
  - - [1225, 192, 64, 32, 1225, 1225, 1225, 192]
    - [14, 8137.0]
  - - [1225, 192, 64, 48, 1225, 1225, 1225, 192]
    - [25, 10005.0]
  - - [1225, 192, 64, 64, 1225, 1225, 1225, 192]
    - [14, 10680.0]
  - - [1225, 256, 64, 48, 1225, 1225, 1225, 256]
    - [0, 10084.0]
  - - [1225, 256, 64, 64, 1225, 1225, 1225, 256]
    - [0, 10505.0]
  - - [1225, 288, 64, 48, 1225, 1225, 1225, 288]
    - [0, 8167.0]
  - - [1225, 288, 64, 64, 1225, 1225, 1225, 288]
    - [25, 8888.0]
  - - [3136, 256, 64, 64, 3136, 3136, 3136, 256]
    - [0, 9628.0]
  - - [256, 44505, 1, 8976, 256, 256, 256, 44505]
    - [17, 12673.0]
  - - [512, 33708, 1, 3796, 512, 512, 512, 33708]
    - [17, 12703.0]
  - - [512, 33708, 1, 3822, 512, 512, 512, 33708]
    - [17, 12704.0]
  - - [512, 33708, 1, 3840, 512, 512, 512, 33708]
    - [29, 12706.0]
  - - [512, 33708, 1, 3859, 512, 512, 512, 33708]
    - [29, 12709.0]
  - - [512, 33708, 1, 3870, 512, 512, 512, 33708]
    - [4, 12706.0]
  - - [512, 33708, 1, 3876, 512, 512, 512, 33708]
    - [17, 12706.0]
  - - [512, 33708, 1, 3906, 512, 512, 512, 33708]
    - [17, 12708.0]
  - - [512, 33708, 1, 3910, 512, 512, 512, 33708]
    - [29, 12705.0]
  - - [512, 33708, 1, 3925, 512, 512, 512, 33708]
    - [17, 12709.0]
  - - [512, 33708, 1, 3942, 512, 512, 512, 33708]
    - [4, 12709.0]
  - - [512, 33708, 1, 3944, 512, 512, 512, 33708]
    - [29, 12704.0]
  - - [512, 33708, 1, 3955, 512, 512, 512, 33708]
    - [29, 12706.0]
  - - [512, 33708, 1, 3969, 512, 512, 512, 33708]
    - [29, 12709.0]
  - - [512, 33708, 1, 3976, 512, 512, 512, 33708]
    - [4, 12707.0]
  - - [512, 33708, 1, 3977, 512, 512, 512, 33708]
    - [4, 12708.0]
  - - [512, 33708, 1, 3978, 512, 512, 512, 33708]
    - [29, 12708.0]
  - - [512, 33708, 1, 3990, 512, 512, 512, 33708]
    - [29, 12707.0]
  - - [512, 33708, 1, 3995, 512, 512, 512, 33708]
    - [29, 12710.0]
  - - [512, 33708, 1, 3996, 512, 512, 512, 33708]
    - [17, 12716.0]
  - - [512, 33708, 1, 3999, 512, 512, 512, 33708]
    - [17, 12708.0]
  - - [512, 33708, 1, 4005, 512, 512, 512, 33708]
    - [29, 12707.0]
  - - [512, 33708, 1, 4012, 512, 512, 512, 33708]
    - [17, 12709.0]
  - - [512, 33708, 1, 4020, 512, 512, 512, 33708]
    - [4, 12708.0]
  - - [512, 33708, 1, 4026, 512, 512, 512, 33708]
    - [29, 12707.0]
  - - [512, 33708, 1, 4032, 512, 512, 512, 33708]
    - [29, 12708.0]
  - - [1024, 3072, 1, 2048, 1024, 1024, 1024, 3072]
    - [1, 11929.0]
  - - [1024, 3072, 1, 3072, 1024, 1024, 1024, 3072]
    - [1, 11993.0]
  - - [1024, 30522, 1, 20, 1024, 1024, 1024, 30522]
    - [0, 5014.0]
  - - [1024, 30522, 1, 80, 1024, 1024, 1024, 30522]
    - [20, 10582.0]
  - - [1024, 30522, 1, 120, 1024, 1024, 1024, 30522]
    - [8, 11768.0]
  - - [1024, 4096, 1, 3840, 1024, 1024, 1024, 4096]
    - [4, 12376.0]
  - - [1024, 4096, 1, 3968, 1024, 1024, 1024, 4096]
    - [4, 12376.0]
  - - [1024, 4096, 1, 7200, 1024, 1024, 1024, 4096]
    - [4, 12402.0]
  - - [1024, 4096, 1, 8160, 1024, 1024, 1024, 4096]
    - [4, 12408.0]
  - - [1024, 4096, 1, 9520, 1024, 1024, 1024, 4096]
    - [29, 12407.0]
  - - [1024, 4096, 1, 10200, 1024, 1024, 1024, 4096]
    - [4, 12406.0]
  - - [1024, 42720, 1, 3968, 1024, 1024, 1024, 42720]
    - [4, 12798.0]
  - - [1024, 42720, 1, 7200, 1024, 1024, 1024, 42720]
    - [29, 12795.0]
  - - [1024, 42720, 1, 9520, 1024, 1024, 1024, 42720]
    - [4, 12800.0]
  - - [4096, 1024, 1, 3840, 4096, 4096, 4096, 1024]
    - [17, 12373.0]
  - - [4096, 1024, 1, 3968, 4096, 4096, 4096, 1024]
    - [17, 12378.0]
  - - [4096, 1024, 1, 7200, 4096, 4096, 4096, 1024]
    - [17, 12394.0]
  - - [4096, 1024, 1, 8160, 4096, 4096, 4096, 1024]
    - [29, 12403.0]
  - - [4096, 1024, 1, 9520, 4096, 4096, 4096, 1024]
    - [29, 12408.0]
  - - [4096, 1024, 1, 10200, 4096, 4096, 4096, 1024]
    - [29, 12406.0]
  - - [5760, 5760, 1, 5760, 5760, 5760, 5760, 5760]
    - [17, 12749.0]
  - - [7744, 7744, 1, 7744, 7744, 7744, 7744, 7744]
    - [17, 12582.0]
  - - [1152, 1152, 1, 384, 1152, 1152, 1152, 1152]
    - [14, 10111.0]
  - - [1536, 1536, 1, 384, 1536, 1536, 1536, 1536]
    - [0, 11185.0]
  - - [1920, 1920, 1, 384, 1920, 1920, 1920, 1920]
    - [25, 11561.0]
  - - [2304, 2304, 1, 384, 2304, 2304, 2304, 2304]
    - [1, 11726.0]
  - - [2688, 2688, 1, 384, 2688, 2688, 2688, 2688]
    - [26, 11954.0]
  - - [3072, 3072, 1, 384, 3072, 3072, 3072, 3072]
    - [11, 12382.0]
  - - [3456, 3456, 1, 384, 3456, 3456, 3456, 3456]
    - [29, 12382.0]
  - - [3840, 3840, 1, 384, 3840, 3840, 3840, 3840]
    - [4, 12586.0]
  - - [4224, 4224, 1, 384, 4224, 4224, 4224, 4224]
    - [29, 12509.0]
  - - [4608, 4608, 1, 384, 4608, 4608, 4608, 4608]
    - [4, 12588.0]
  - - [4992, 4992, 1, 384, 4992, 4992, 4992, 4992]
    - [26, 12511.0]
  - - [5376, 5376, 1, 384, 5376, 5376, 5376, 5376]
    - [4, 12562.0]
  - - [5760, 5760, 1, 384, 5760, 5760, 5760, 5760]
    - [4, 12603.0]
  - - [6144, 6144, 1, 384, 6144, 6144, 6144, 6144]
    - [17, 12621.0]
  - - [6528, 6528, 1, 384, 6528, 6528, 6528, 6528]
    - [17, 12633.0]
  - - [6912, 6912, 1, 384, 6912, 6912, 6912, 6912]
    - [29, 12695.0]
  - - [7296, 7296, 1, 384, 7296, 7296, 7296, 7296]
    - [17, 12688.0]
  - - [7680, 7680, 1, 384, 7680, 7680, 7680, 7680]
    - [4, 12722.0]
  - - [1536, 768, 1, 384, 1536, 1536, 1536, 768]
    - [18, 10258.0]
  - - [1920, 960, 1, 384, 1920, 1920, 1920, 960]
    - [25, 10869.0]
  - - [2304, 1152, 1, 384, 2304, 2304, 2304, 1152]
    - [14, 11159.0]
  - - [2688, 1344, 1, 384, 2688, 2688, 2688, 1344]
    - [25, 11393.0]
  - - [3072, 1536, 1, 384, 3072, 3072, 3072, 1536]
    - [25, 11778.0]
  - - [3456, 1728, 1, 384, 3456, 3456, 3456, 1728]
    - [25, 11773.0]
  - - [3840, 1920, 1, 384, 3840, 3840, 3840, 1920]
    - [4, 12133.0]
  - - [4224, 2112, 1, 384, 4224, 4224, 4224, 2112]
    - [0, 11895.0]
  - - [4608, 2304, 1, 384, 4608, 4608, 4608, 2304]
    - [4, 12295.0]
  - - [4992, 2496, 1, 384, 4992, 4992, 4992, 2496]
    - [1, 12109.0]
  - - [5376, 2688, 1, 384, 5376, 5376, 5376, 2688]
    - [4, 12370.0]
  - - [5760, 2880, 1, 384, 5760, 5760, 5760, 2880]
    - [4, 12244.0]
  - - [6144, 3072, 1, 384, 6144, 6144, 6144, 3072]
    - [23, 12532.0]
  - - [6528, 3264, 1, 384, 6528, 6528, 6528, 3264]
    - [4, 12255.0]
  - - [6912, 3456, 1, 384, 6912, 6912, 6912, 3456]
    - [29, 12618.0]
  - - [7296, 3648, 1, 384, 7296, 7296, 7296, 3648]
    - [17, 12360.0]
  - - [7680, 3840, 1, 384, 7680, 7680, 7680, 3840]
    - [17, 12652.0]
  - - [768, 1536, 1, 384, 768, 768, 768, 1536]
    - [30, 10291.0]
  - - [1152, 2304, 1, 384, 1152, 1152, 1152, 2304]
    - [0, 11198.0]
  - - [1536, 3072, 1, 384, 1536, 1536, 1536, 3072]
    - [14, 11781.0]
  - - [1920, 3840, 1, 384, 1920, 1920, 1920, 3840]
    - [17, 12151.0]
  - - [2304, 4608, 1, 384, 2304, 2304, 2304, 4608]
    - [4, 12303.0]
  - - [2688, 5376, 1, 384, 2688, 2688, 2688, 5376]
    - [4, 12358.0]
  - - [3072, 6144, 1, 384, 3072, 3072, 3072, 6144]
    - [4, 12515.0]
  - - [3456, 6912, 1, 384, 3456, 3456, 3456, 6912]
    - [17, 12630.0]
  - - [3840, 7680, 1, 384, 3840, 3840, 3840, 7680]
    - [4, 12657.0]
  - - [4224, 8448, 1, 384, 4224, 4224, 4224, 8448]
    - [29, 12683.0]
  - - [4608, 9216, 1, 384, 4608, 4608, 4608, 9216]
    - [4, 12664.0]
  - - [4992, 9984, 1, 384, 4992, 4992, 4992, 9984]
    - [29, 12662.0]
  - - [5376, 10752, 1, 384, 5376, 5376, 5376, 10752]
    - [17, 12682.0]
  - - [5760, 11520, 1, 384, 5760, 5760, 5760, 11520]
    - [4, 12706.0]
  - - [6144, 12288, 1, 384, 6144, 6144, 6144, 12288]
    - [17, 12704.0]
  - - [6528, 13056, 1, 384, 6528, 6528, 6528, 13056]
    - [17, 12716.0]
  - - [6912, 13824, 1, 384, 6912, 6912, 6912, 13824]
    - [4, 12729.0]
  - - [7296, 14592, 1, 384, 7296, 7296, 7296, 14592]
    - [17, 12751.0]
  - - [7680, 15360, 1, 384, 7680, 7680, 7680, 15360]
    - [29, 12753.0]
  - - [2048, 2048, 1, 1024, 2048, 2048, 2048, 2048]
    - [15, 12197.0]
  - - [256, 10240, 1, 8976, 256, 256, 256, 10240]
    - [19, 12467.0]
  - - [256, 10496, 1, 8976, 256, 256, 256, 10496]
    - [16, 11671.0]
  - - [256, 11008, 1, 8976, 256, 256, 256, 11008]
    - [5, 11925.0]
  - - [256, 11264, 1, 8976, 256, 256, 256, 11264]
    - [17, 12186.0]
  - - [256, 11520, 1, 8976, 256, 256, 256, 11520]
    - [17, 12446.0]
  - - [256, 11776, 1, 8976, 256, 256, 256, 11776]
    - [28, 11688.0]
  - - [256, 12544, 1, 8976, 256, 256, 256, 12544]
    - [19, 12289.0]
  - - [256, 12800, 1, 8976, 256, 256, 256, 12800]
    - [19, 12527.0]
  - - [256, 13312, 1, 8976, 256, 256, 256, 13312]
    - [28, 11963.0]
  - - [256, 13568, 1, 8976, 256, 256, 256, 13568]
    - [17, 12100.0]
  - - [256, 14336, 1, 8976, 256, 256, 256, 14336]
    - [28, 11794.0]
  - - [256, 14848, 1, 8976, 256, 256, 256, 14848]
    - [19, 12177.0]
  - - [256, 15104, 1, 8976, 256, 256, 256, 15104]
    - [19, 12368.0]
  - - [256, 15872, 1, 8976, 256, 256, 256, 15872]
    - [17, 12036.0]
  - - [256, 16128, 1, 8976, 256, 256, 256, 16128]
    - [17, 12220.0]
  - - [256, 17152, 1, 8976, 256, 256, 256, 17152]
    - [4, 12090.0]
  - - [256, 17408, 1, 8976, 256, 256, 256, 17408]
    - [29, 12265.0]
  - - [256, 18688, 1, 8976, 256, 256, 256, 18688]
    - [17, 12308.0]
  - - [256, 19968, 1, 8976, 256, 256, 256, 19968]
    - [4, 12339.0]
  - - [256, 20480, 1, 8976, 256, 256, 256, 20480]
    - [29, 12641.0]
  - - [256, 20992, 1, 8976, 256, 256, 256, 20992]
    - [4, 12231.0]
  - - [256, 21248, 1, 8976, 256, 256, 256, 21248]
    - [4, 12375.0]
  - - [256, 22016, 1, 8976, 256, 256, 256, 22016]
    - [17, 12130.0]
  - - [256, 26112, 1, 8976, 256, 256, 256, 26112]
    - [17, 12352.0]
  - - [256, 32512, 1, 8976, 256, 256, 256, 32512]
    - [4, 12453.0]
  - - [256, 33536, 1, 8976, 256, 256, 256, 33536]
    - [17, 12381.0]
  - - [256, 4864, 1, 8976, 256, 256, 256, 4864]
    - [19, 11619.0]
  - - [256, 5120, 1, 8976, 256, 256, 256, 5120]
    - [6, 12194.0]
  - - [256, 5632, 1, 8976, 256, 256, 256, 5632]
    - [3, 11525.0]
  - - [256, 5888, 1, 8976, 256, 256, 256, 5888]
    - [18, 11278.0]
  - - [256, 6144, 1, 8976, 256, 256, 256, 6144]
    - [5, 11744.0]
  - - [256, 7168, 1, 8976, 256, 256, 256, 7168]
    - [19, 11586.0]
  - - [256, 8192, 1, 8976, 256, 256, 256, 8192]
    - [3, 11763.0]
  - - [256, 8960, 1, 8976, 256, 256, 256, 8960]
    - [29, 12339.0]
  - - [256, 9728, 1, 8976, 256, 256, 256, 9728]
    - [19, 11878.0]
  - - [256, 9984, 1, 8976, 256, 256, 256, 9984]
    - [19, 12174.0]
  - - [3200, 2048, 1, 1024, 3200, 3200, 3200, 2048]
    - [15, 12559.0]
  - - [4096, 4096, 1, 1024, 4096, 4096, 4096, 4096]
    - [17, 12569.0]
  - - [512, 3280, 1, 1600, 512, 512, 512, 3280]
    - [25, 10919.0]
  - - [512, 3280, 1, 200, 512, 512, 512, 3280]
    - [14, 10190.0]
  - - [768, 2048, 1, 256, 768, 768, 768, 2048]
    - [18, 10918.0]
  - - [1600, 1024, 1, 960, 1600, 1600, 1600, 1024]
    - [0, 10609.0]
  - - [2048, 2048, 1, 960, 2048, 2048, 2048, 2048]
    - [1, 12226.0]
  - - [1024, 3072, 1, 1024, 1024, 1024, 1024, 3072]
    - [1, 11800.0]
  - - [1024, 3072, 1, 512, 1024, 1024, 1024, 3072]
    - [1, 11676.0]
  - - [1024, 4096, 1, 2048, 1024, 1024, 1024, 4096]
    - [4, 12347.0]
  - - [1024, 30528, 1, 2048, 1024, 1024, 1024, 30528]
    - [17, 12734.0]
  - - [1024, 4096, 1, 4096, 1024, 1024, 1024, 4096]
    - [4, 12379.0]
  - - [1024, 30528, 1, 4096, 1024, 1024, 1024, 30528]
    - [17, 12754.0]
  - - [9216, 128, 1, 128, 9216, 9216, 9216, 128]
    - [14, 9020.0]
  - - [9600, 128, 1, 128, 9600, 9600, 9600, 128]
    - [5, 9781.0]
  - - [9984, 128, 1, 128, 9984, 9984, 9984, 128]
    - [0, 10023.0]
  - - [10368, 128, 1, 128, 10368, 10368, 10368, 128]
    - [25, 9501.0]
  - - [10752, 128, 1, 128, 10752, 10752, 10752, 128]
    - [8, 9690.0]
  - - [11136, 128, 1, 128, 11136, 11136, 11136, 128]
    - [14, 10003.0]
  - - [11520, 128, 1, 128, 11520, 11520, 11520, 128]
    - [3, 9790.0]
  - - [11904, 128, 1, 128, 11904, 11904, 11904, 128]
    - [5, 10002.0]
  - - [12288, 128, 1, 128, 12288, 12288, 12288, 128]
    - [0, 10107.0]
  - - [12672, 128, 1, 128, 12672, 12672, 12672, 128]
    - [5, 10475.0]
  - - [13056, 128, 1, 128, 13056, 13056, 13056, 128]
    - [0, 10043.0]
  - - [13440, 128, 1, 128, 13440, 13440, 13440, 128]
    - [25, 10261.0]
  - - [13824, 128, 1, 128, 13824, 13824, 13824, 128]
    - [0, 10390.0]
  - - [14208, 128, 1, 128, 14208, 14208, 14208, 128]
    - [12, 10201.0]
  - - [14592, 128, 1, 128, 14592, 14592, 14592, 128]
    - [25, 10323.0]
  - - [14976, 128, 1, 128, 14976, 14976, 14976, 128]
    - [5, 10677.0]
  - - [15360, 128, 1, 128, 15360, 15360, 15360, 128]
    - [25, 10574.0]
  - - [15744, 128, 1, 128, 15744, 15744, 15744, 128]
    - [25, 10435.0]
  - - [16128, 128, 1, 128, 16128, 16128, 16128, 128]
    - [14, 10570.0]
  - - [16512, 128, 1, 128, 16512, 16512, 16512, 128]
    - [14, 10761.0]
  - - [16896, 128, 1, 128, 16896, 16896, 16896, 128]
    - [25, 10430.0]
  - - [17280, 128, 1, 128, 17280, 17280, 17280, 128]
    - [5, 10740.0]
  - - [17664, 128, 1, 128, 17664, 17664, 17664, 128]
    - [0, 10783.0]
  - - [18048, 128, 1, 128, 18048, 18048, 18048, 128]
    - [14, 10531.0]
  - - [18432, 128, 1, 128, 18432, 18432, 18432, 128]
    - [25, 10619.0]
  - - [18816, 128, 1, 128, 18816, 18816, 18816, 128]
    - [25, 10848.0]
  - - [19200, 128, 1, 128, 19200, 19200, 19200, 128]
    - [25, 10923.0]
  - - [19584, 128, 1, 128, 19584, 19584, 19584, 128]
    - [5, 10804.0]
  - - [19968, 128, 1, 128, 19968, 19968, 19968, 128]
    - [25, 10804.0]
  - - [20352, 128, 1, 128, 20352, 20352, 20352, 128]
    - [5, 11145.0]
  - - [20736, 128, 1, 128, 20736, 20736, 20736, 128]
    - [14, 10670.0]
  - - [21120, 128, 1, 128, 21120, 21120, 21120, 128]
    - [25, 10895.0]
  - - [21504, 128, 1, 128, 21504, 21504, 21504, 128]
    - [0, 10921.0]
  - - [21888, 128, 1, 128, 21888, 21888, 21888, 128]
    - [36, 10802.0]
  - - [22272, 128, 1, 128, 22272, 22272, 22272, 128]
    - [25, 10880.0]
  - - [22656, 128, 1, 128, 22656, 22656, 22656, 128]
    - [5, 11161.0]
  - - [23040, 128, 1, 128, 23040, 23040, 23040, 128]
    - [31, 10980.0]
  - - [9216, 128, 1, 256, 9216, 9216, 9216, 128]
    - [24, 10066.0]
  - - [9600, 128, 1, 256, 9600, 9600, 9600, 128]
    - [12, 10599.0]
  - - [9984, 128, 1, 256, 9984, 9984, 9984, 128]
    - [5, 10833.0]
  - - [10368, 128, 1, 256, 10368, 10368, 10368, 128]
    - [25, 10063.0]
  - - [10752, 128, 1, 256, 10752, 10752, 10752, 128]
    - [25, 10350.0]
  - - [11136, 128, 1, 256, 11136, 11136, 11136, 128]
    - [14, 10663.0]
  - - [11520, 128, 1, 256, 11520, 11520, 11520, 128]
    - [3, 10823.0]
  - - [11904, 128, 1, 256, 11904, 11904, 11904, 128]
    - [5, 10663.0]
  - - [12288, 128, 1, 256, 12288, 12288, 12288, 128]
    - [24, 10841.0]
  - - [12672, 128, 1, 256, 12672, 12672, 12672, 128]
    - [5, 11321.0]
  - - [13056, 128, 1, 256, 13056, 13056, 13056, 128]
    - [14, 10512.0]
  - - [13440, 128, 1, 256, 13440, 13440, 13440, 128]
    - [14, 10794.0]
  - - [13824, 128, 1, 256, 13824, 13824, 13824, 128]
    - [0, 10963.0]
  - - [14208, 128, 1, 256, 14208, 14208, 14208, 128]
    - [5, 10767.0]
  - - [14592, 128, 1, 256, 14592, 14592, 14592, 128]
    - [18, 10952.0]
  - - [14976, 128, 1, 256, 14976, 14976, 14976, 128]
    - [5, 11276.0]
  - - [15360, 128, 1, 256, 15360, 15360, 15360, 128]
    - [5, 11418.0]
  - - [15744, 128, 1, 256, 15744, 15744, 15744, 128]
    - [0, 10775.0]
  - - [16128, 128, 1, 256, 16128, 16128, 16128, 128]
    - [25, 11052.0]
  - - [16512, 128, 1, 256, 16512, 16512, 16512, 128]
    - [25, 11301.0]
  - - [16896, 128, 1, 256, 16896, 16896, 16896, 128]
    - [5, 11029.0]
  - - [17280, 128, 1, 256, 17280, 17280, 17280, 128]
    - [5, 11284.0]
  - - [17664, 128, 1, 256, 17664, 17664, 17664, 128]
    - [18, 11403.0]
  - - [18048, 128, 1, 256, 18048, 18048, 18048, 128]
    - [25, 10843.0]
  - - [18432, 128, 1, 256, 18432, 18432, 18432, 128]
    - [14, 11054.0]
  - - [18816, 128, 1, 256, 18816, 18816, 18816, 128]
    - [25, 11235.0]
  - - [19200, 128, 1, 256, 19200, 19200, 19200, 128]
    - [0, 11377.0]
  - - [19584, 128, 1, 256, 19584, 19584, 19584, 128]
    - [5, 11282.0]
  - - [19968, 128, 1, 256, 19968, 19968, 19968, 128]
    - [12, 11399.0]
  - - [20352, 128, 1, 256, 20352, 20352, 20352, 128]
    - [5, 11680.0]
  - - [20736, 128, 1, 256, 20736, 20736, 20736, 128]
    - [25, 11070.0]
  - - [21120, 128, 1, 256, 21120, 21120, 21120, 128]
    - [25, 11235.0]
  - - [21504, 128, 1, 256, 21504, 21504, 21504, 128]
    - [25, 11238.0]
  - - [21888, 128, 1, 256, 21888, 21888, 21888, 128]
    - [24, 11238.0]
  - - [22272, 128, 1, 256, 22272, 22272, 22272, 128]
    - [12, 11368.0]
  - - [22656, 128, 1, 256, 22656, 22656, 22656, 128]
    - [5, 11614.0]
  - - [23040, 128, 1, 256, 23040, 23040, 23040, 128]
    - [5, 11683.0]
  - - [8064, 8064, 1, 384, 8064, 8064, 8064, 8064]
    - [4, 12706.0]
  - - [8448, 8448, 1, 384, 8448, 8448, 8448, 8448]
    - [17, 12722.0]
  - - [8832, 8832, 1, 384, 8832, 8832, 8832, 8832]
    - [17, 12706.0]
  - - [9216, 9216, 1, 384, 9216, 9216, 9216, 9216]
    - [17, 12712.0]
  - - [9600, 9600, 1, 384, 9600, 9600, 9600, 9600]
    - [29, 12723.0]
  - - [9984, 9984, 1, 384, 9984, 9984, 9984, 9984]
    - [4, 12719.0]
  - - [10368, 10368, 1, 384, 10368, 10368, 10368, 10368]
    - [17, 12734.0]
  - - [10752, 10752, 1, 384, 10752, 10752, 10752, 10752]
    - [17, 12748.0]
  - - [11136, 11136, 1, 384, 11136, 11136, 11136, 11136]
    - [17, 12743.0]
  - - [11520, 11520, 1, 384, 11520, 11520, 11520, 11520]
    - [17, 12754.0]
  - - [11904, 11904, 1, 384, 11904, 11904, 11904, 11904]
    - [17, 12751.0]
  - - [12288, 12288, 1, 384, 12288, 12288, 12288, 12288]
    - [17, 12761.0]
  - - [12672, 12672, 1, 384, 12672, 12672, 12672, 12672]
    - [17, 12755.0]
  - - [13056, 13056, 1, 384, 13056, 13056, 13056, 13056]
    - [17, 12749.0]
  - - [13440, 13440, 1, 384, 13440, 13440, 13440, 13440]
    - [17, 12754.0]
  - - [13824, 13824, 1, 384, 13824, 13824, 13824, 13824]
    - [17, 12754.0]
  - - [14208, 14208, 1, 384, 14208, 14208, 14208, 14208]
    - [17, 12762.0]
  - - [14592, 14592, 1, 384, 14592, 14592, 14592, 14592]
    - [4, 12758.0]
  - - [14976, 14976, 1, 384, 14976, 14976, 14976, 14976]
    - [17, 12760.0]
  - - [15360, 15360, 1, 384, 15360, 15360, 15360, 15360]
    - [17, 12766.0]
  - - [15744, 15744, 1, 384, 15744, 15744, 15744, 15744]
    - [17, 12767.0]
  - - [16128, 16128, 1, 384, 16128, 16128, 16128, 16128]
    - [29, 12765.0]
  - - [16512, 16512, 1, 384, 16512, 16512, 16512, 16512]
    - [4, 12767.0]
  - - [16896, 16896, 1, 384, 16896, 16896, 16896, 16896]
    - [29, 12768.0]
  - - [17280, 17280, 1, 384, 17280, 17280, 17280, 17280]
    - [4, 12770.0]
  - - [17664, 17664, 1, 384, 17664, 17664, 17664, 17664]
    - [23, 12759.0]
  - - [18048, 18048, 1, 384, 18048, 18048, 18048, 18048]
    - [29, 12767.0]
  - - [18432, 18432, 1, 384, 18432, 18432, 18432, 18432]
    - [17, 12767.0]
  - - [18816, 18816, 1, 384, 18816, 18816, 18816, 18816]
    - [29, 12770.0]
  - - [19200, 19200, 1, 384, 19200, 19200, 19200, 19200]
    - [4, 12768.0]
  - - [19584, 19584, 1, 384, 19584, 19584, 19584, 19584]
    - [17, 12770.0]
  - - [19968, 19968, 1, 384, 19968, 19968, 19968, 19968]
    - [17, 12777.0]
  - - [20352, 20352, 1, 384, 20352, 20352, 20352, 20352]
    - [17, 12775.0]
  - - [20736, 20736, 1, 384, 20736, 20736, 20736, 20736]
    - [17, 12765.0]
  - - [21120, 21120, 1, 384, 21120, 21120, 21120, 21120]
    - [17, 12770.0]
  - - [21504, 21504, 1, 384, 21504, 21504, 21504, 21504]
    - [23, 12769.0]
  - - [21888, 21888, 1, 384, 21888, 21888, 21888, 21888]
    - [29, 12767.0]
  - - [22272, 22272, 1, 384, 22272, 22272, 22272, 22272]
    - [17, 12772.0]
  - - [22656, 22656, 1, 384, 22656, 22656, 22656, 22656]
    - [17, 12773.0]
  - - [23040, 23040, 1, 384, 23040, 23040, 23040, 23040]
    - [29, 12773.0]
  - - [1152, 1152, 1, 1152, 1152, 1152, 1152, 1152]
    - [0, 10461.0]
  - - [1536, 1536, 1, 1536, 1536, 1536, 1536, 1536]
    - [25, 11407.0]
  - - [1920, 1920, 1, 1920, 1920, 1920, 1920, 1920]
    - [28, 11798.0]
  - - [2304, 2304, 1, 2304, 2304, 2304, 2304, 2304]
    - [4, 12056.0]
  - - [2688, 2688, 1, 2688, 2688, 2688, 2688, 2688]
    - [4, 12184.0]
  - - [3072, 3072, 1, 3072, 3072, 3072, 3072, 3072]
    - [4, 12641.0]
  - - [3456, 3456, 1, 3456, 3456, 3456, 3456, 3456]
    - [17, 12583.0]
  - - [3840, 3840, 1, 3840, 3840, 3840, 3840, 3840]
    - [17, 12785.0]
  - - [4224, 4224, 1, 4224, 4224, 4224, 4224, 4224]
    - [4, 12680.0]
  - - [4608, 4608, 1, 4608, 4608, 4608, 4608, 4608]
    - [17, 12777.0]
  - - [4992, 4992, 1, 4992, 4992, 4992, 4992, 4992]
    - [29, 12677.0]
  - - [5376, 5376, 1, 5376, 5376, 5376, 5376, 5376]
    - [4, 12727.0]
  - - [6144, 6144, 1, 6144, 6144, 6144, 6144, 6144]
    - [29, 12758.0]
  - - [6528, 6528, 1, 6528, 6528, 6528, 6528, 6528]
    - [17, 12758.0]
  - - [6912, 6912, 1, 6912, 6912, 6912, 6912, 6912]
    - [17, 12829.0]
  - - [7296, 7296, 1, 7296, 7296, 7296, 7296, 7296]
    - [17, 12801.0]
  - - [7680, 7680, 1, 7680, 7680, 7680, 7680, 7680]
    - [17, 12844.0]
  - - [8064, 4032, 1, 384, 8064, 8064, 8064, 4032]
    - [4, 12437.0]
  - - [8448, 4224, 1, 384, 8448, 8448, 8448, 4224]
    - [4, 12665.0]
  - - [8832, 4416, 1, 384, 8832, 8832, 8832, 4416]
    - [4, 12472.0]
  - - [9216, 4608, 1, 384, 9216, 9216, 9216, 4608]
    - [4, 12660.0]
  - - [9600, 4800, 1, 384, 9600, 9600, 9600, 4800]
    - [4, 12490.0]
  - - [9984, 4992, 1, 384, 9984, 9984, 9984, 4992]
    - [29, 12651.0]
  - - [10368, 5184, 1, 384, 10368, 10368, 10368, 5184]
    - [4, 12493.0]
  - - [10752, 5376, 1, 384, 10752, 10752, 10752, 5376]
    - [29, 12679.0]
  - - [11136, 5568, 1, 384, 11136, 11136, 11136, 5568]
    - [4, 12536.0]
  - - [11520, 5760, 1, 384, 11520, 11520, 11520, 5760]
    - [4, 12701.0]
  - - [11904, 5952, 1, 384, 11904, 11904, 11904, 5952]
    - [4, 12573.0]
  - - [12288, 6144, 1, 384, 12288, 12288, 12288, 6144]
    - [17, 12717.0]
  - - [12672, 6336, 1, 384, 12672, 12672, 12672, 6336]
    - [4, 12581.0]
  - - [13056, 6528, 1, 384, 13056, 13056, 13056, 6528]
    - [29, 12709.0]
  - - [13440, 6720, 1, 384, 13440, 13440, 13440, 6720]
    - [4, 12593.0]
  - - [13824, 6912, 1, 384, 13824, 13824, 13824, 6912]
    - [4, 12731.0]
  - - [14208, 7104, 1, 384, 14208, 14208, 14208, 7104]
    - [11, 12618.0]
  - - [14592, 7296, 1, 384, 14592, 14592, 14592, 7296]
    - [17, 12748.0]
  - - [14976, 7488, 1, 384, 14976, 14976, 14976, 7488]
    - [4, 12615.0]
  - - [15360, 7680, 1, 384, 15360, 15360, 15360, 7680]
    - [4, 12750.0]
  - - [15744, 7872, 1, 384, 15744, 15744, 15744, 7872]
    - [4, 12628.0]
  - - [16128, 8064, 1, 384, 16128, 16128, 16128, 8064]
    - [29, 12753.0]
  - - [16512, 8256, 1, 384, 16512, 16512, 16512, 8256]
    - [17, 12641.0]
  - - [16896, 8448, 1, 384, 16896, 16896, 16896, 8448]
    - [17, 12749.0]
  - - [17280, 8640, 1, 384, 17280, 17280, 17280, 8640]
    - [4, 12664.0]
  - - [17664, 8832, 1, 384, 17664, 17664, 17664, 8832]
    - [17, 12746.0]
  - - [18048, 9024, 1, 384, 18048, 18048, 18048, 9024]
    - [4, 12655.0]
  - - [18432, 9216, 1, 384, 18432, 18432, 18432, 9216]
    - [4, 12748.0]
  - - [18816, 9408, 1, 384, 18816, 18816, 18816, 9408]
    - [4, 12676.0]
  - - [19200, 9600, 1, 384, 19200, 19200, 19200, 9600]
    - [17, 12758.0]
  - - [19584, 9792, 1, 384, 19584, 19584, 19584, 9792]
    - [17, 12668.0]
  - - [19968, 9984, 1, 384, 19968, 19968, 19968, 9984]
    - [29, 12755.0]
  - - [20352, 10176, 1, 384, 20352, 20352, 20352, 10176]
    - [4, 12678.0]
  - - [20736, 10368, 1, 384, 20736, 20736, 20736, 10368]
    - [17, 12756.0]
  - - [21120, 10560, 1, 384, 21120, 21120, 21120, 10560]
    - [17, 12680.0]
  - - [21504, 10752, 1, 384, 21504, 21504, 21504, 10752]
    - [17, 12766.0]
  - - [21888, 10944, 1, 384, 21888, 21888, 21888, 10944]
    - [17, 12681.0]
  - - [22272, 11136, 1, 384, 22272, 22272, 22272, 11136]
    - [17, 12764.0]
  - - [22656, 11328, 1, 384, 22656, 22656, 22656, 11328]
    - [17, 12689.0]
  - - [23040, 11520, 1, 384, 23040, 23040, 23040, 11520]
    - [29, 12769.0]
  - - [8064, 16128, 1, 384, 8064, 8064, 8064, 16128]
    - [29, 12760.0]
  - - [8448, 16896, 1, 384, 8448, 8448, 8448, 16896]
    - [17, 12750.0]
  - - [8832, 17664, 1, 384, 8832, 8832, 8832, 17664]
    - [4, 12753.0]
  - - [9216, 18432, 1, 384, 9216, 9216, 9216, 18432]
    - [17, 12756.0]
  - - [9600, 19200, 1, 384, 9600, 9600, 9600, 19200]
    - [17, 12759.0]
  - - [9984, 19968, 1, 384, 9984, 9984, 9984, 19968]
    - [29, 12757.0]
  - - [10368, 20736, 1, 384, 10368, 10368, 10368, 20736]
    - [17, 12761.0]
  - - [10752, 21504, 1, 384, 10752, 10752, 10752, 21504]
    - [17, 12762.0]
  - - [11136, 22272, 1, 384, 11136, 11136, 11136, 22272]
    - [29, 12772.0]
  - - [11520, 23040, 1, 384, 11520, 11520, 11520, 23040]
    - [4, 12768.0]
  - - [11904, 23808, 1, 384, 11904, 11904, 11904, 23808]
    - [17, 12774.0]
  - - [12288, 24576, 1, 384, 12288, 12288, 12288, 24576]
    - [17, 12769.0]
  - - [12672, 25344, 1, 384, 12672, 12672, 12672, 25344]
    - [17, 12769.0]
  - - [13056, 26112, 1, 384, 13056, 13056, 13056, 26112]
    - [29, 12770.0]
  - - [13440, 26880, 1, 384, 13440, 13440, 13440, 26880]
    - [4, 12778.0]
  - - [13824, 27648, 1, 384, 13824, 13824, 13824, 27648]
    - [17, 12769.0]
  - - [14208, 28416, 1, 384, 14208, 14208, 14208, 28416]
    - [17, 12765.0]
  - - [14592, 29184, 1, 384, 14592, 14592, 14592, 29184]
    - [17, 12769.0]
  - - [14976, 29952, 1, 384, 14976, 14976, 14976, 29952]
    - [29, 12774.0]
  - - [15360, 30720, 1, 384, 15360, 15360, 15360, 30720]
    - [17, 12772.0]
  - - [15744, 31488, 1, 384, 15744, 15744, 15744, 31488]
    - [17, 12775.0]
  - - [16128, 32256, 1, 384, 16128, 16128, 16128, 32256]
    - [4, 12768.0]
  - - [16512, 33024, 1, 384, 16512, 16512, 16512, 33024]
    - [17, 12774.0]
  - - [16896, 33792, 1, 384, 16896, 16896, 16896, 33792]
    - [35, 12771.0]
  - - [17280, 34560, 1, 384, 17280, 17280, 17280, 34560]
    - [17, 12766.0]
  - - [17664, 35328, 1, 384, 17664, 17664, 17664, 35328]
    - [17, 12767.0]
  - - [18048, 36096, 1, 384, 18048, 18048, 18048, 36096]
    - [29, 12769.0]
  - - [18432, 36864, 1, 384, 18432, 18432, 18432, 36864]
    - [17, 12768.0]
  - - [18816, 37632, 1, 384, 18816, 18816, 18816, 37632]
    - [29, 12769.0]
  - - [19200, 38400, 1, 384, 19200, 19200, 19200, 38400]
    - [17, 12767.0]
  - - [19584, 39168, 1, 384, 19584, 19584, 19584, 39168]
    - [17, 12768.0]
  - - [19968, 39936, 1, 384, 19968, 19968, 19968, 39936]
    - [35, 12766.0]
  - - [20352, 40704, 1, 384, 20352, 20352, 20352, 40704]
    - [17, 12770.0]
  - - [20736, 41472, 1, 384, 20736, 20736, 20736, 41472]
    - [17, 12765.0]
  - - [21120, 42240, 1, 384, 21120, 21120, 21120, 42240]
    - [17, 12767.0]
  - - [21504, 43008, 1, 384, 21504, 21504, 21504, 43008]
    - [17, 12769.0]
  - - [21888, 43776, 1, 384, 21888, 21888, 21888, 43776]
    - [17, 12771.0]
  - - [22272, 44544, 1, 384, 22272, 22272, 22272, 44544]
    - [17, 12772.0]
  - - [22656, 45312, 1, 384, 22656, 22656, 22656, 45312]
    - [29, 12763.0]
  - - [23040, 46080, 1, 384, 23040, 23040, 23040, 46080]
    - [29, 12764.0]
  - - [1152, 1536, 1, 384, 1152, 1152, 1152, 1536]
    - [14, 11139.0]
  - - [1920, 1536, 1, 384, 1920, 1920, 1920, 1536]
    - [30, 11986.0]
  - - [2304, 1536, 1, 384, 2304, 2304, 2304, 1536]
    - [15, 11856.0]
  - - [2688, 1536, 1, 384, 2688, 2688, 2688, 1536]
    - [15, 11814.0]
  - - [3456, 1536, 1, 384, 3456, 3456, 3456, 1536]
    - [26, 11779.0]
  - - [3840, 1536, 1, 384, 3840, 3840, 3840, 1536]
    - [1, 12203.0]
  - - [4224, 1536, 1, 384, 4224, 4224, 4224, 1536]
    - [26, 12239.0]
  - - [4608, 1536, 1, 384, 4608, 4608, 4608, 1536]
    - [17, 12160.0]
  - - [4992, 1536, 1, 384, 4992, 4992, 4992, 1536]
    - [17, 12136.0]
  - - [5376, 1536, 1, 384, 5376, 5376, 5376, 1536]
    - [29, 12087.0]
  - - [5760, 1536, 1, 384, 5760, 5760, 5760, 1536]
    - [4, 12446.0]
  - - [6144, 1536, 1, 384, 6144, 6144, 6144, 1536]
    - [17, 12394.0]
  - - [6528, 1536, 1, 384, 6528, 6528, 6528, 1536]
    - [29, 12356.0]
  - - [6912, 1536, 1, 384, 6912, 6912, 6912, 1536]
    - [17, 12311.0]
  - - [7296, 1536, 1, 384, 7296, 7296, 7296, 1536]
    - [11, 12247.0]
  - - [7680, 1536, 1, 384, 7680, 7680, 7680, 1536]
    - [17, 12532.0]
  - - [8064, 1536, 1, 384, 8064, 8064, 8064, 1536]
    - [29, 12493.0]
  - - [8448, 1536, 1, 384, 8448, 8448, 8448, 1536]
    - [17, 12439.0]
  - - [8832, 1536, 1, 384, 8832, 8832, 8832, 1536]
    - [29, 12416.0]
  - - [9216, 1536, 1, 384, 9216, 9216, 9216, 1536]
    - [17, 12379.0]
  - - [9600, 1536, 1, 384, 9600, 9600, 9600, 1536]
    - [11, 12584.0]
  - - [9984, 1536, 1, 384, 9984, 9984, 9984, 1536]
    - [29, 12552.0]
  - - [10368, 1536, 1, 384, 10368, 10368, 10368, 1536]
    - [29, 12518.0]
  - - [10752, 1536, 1, 384, 10752, 10752, 10752, 1536]
    - [4, 12478.0]
  - - [11136, 1536, 1, 384, 11136, 11136, 11136, 1536]
    - [17, 12451.0]
  - - [11520, 1536, 1, 384, 11520, 11520, 11520, 1536]
    - [17, 12596.0]
  - - [11904, 1536, 1, 384, 11904, 11904, 11904, 1536]
    - [29, 12591.0]
  - - [12288, 1536, 1, 384, 12288, 12288, 12288, 1536]
    - [17, 12546.0]
  - - [12672, 1536, 1, 384, 12672, 12672, 12672, 1536]
    - [17, 12487.0]
  - - [13056, 1536, 1, 384, 13056, 13056, 13056, 1536]
    - [17, 12475.0]
  - - [13440, 1536, 1, 384, 13440, 13440, 13440, 1536]
    - [17, 12622.0]
  - - [13824, 1536, 1, 384, 13824, 13824, 13824, 1536]
    - [4, 12577.0]
  - - [14208, 1536, 1, 384, 14208, 14208, 14208, 1536]
    - [17, 12560.0]
  - - [14592, 1536, 1, 384, 14592, 14592, 14592, 1536]
    - [4, 12528.0]
  - - [14976, 1536, 1, 384, 14976, 14976, 14976, 1536]
    - [17, 12511.0]
  - - [15360, 1536, 1, 384, 15360, 15360, 15360, 1536]
    - [4, 12629.0]
  - - [15744, 1536, 1, 384, 15744, 15744, 15744, 1536]
    - [29, 12611.0]
  - - [16128, 1536, 1, 384, 16128, 16128, 16128, 1536]
    - [29, 12583.0]
  - - [16512, 1536, 1, 384, 16512, 16512, 16512, 1536]
    - [17, 12562.0]
  - - [16896, 1536, 1, 384, 16896, 16896, 16896, 1536]
    - [17, 12540.0]
  - - [17280, 1536, 1, 384, 17280, 17280, 17280, 1536]
    - [11, 12658.0]
  - - [17664, 1536, 1, 384, 17664, 17664, 17664, 1536]
    - [29, 12621.0]
  - - [18048, 1536, 1, 384, 18048, 18048, 18048, 1536]
    - [4, 12611.0]
  - - [18432, 1536, 1, 384, 18432, 18432, 18432, 1536]
    - [4, 12588.0]
  - - [18816, 1536, 1, 384, 18816, 18816, 18816, 1536]
    - [29, 12572.0]
  - - [19200, 1536, 1, 384, 19200, 19200, 19200, 1536]
    - [4, 12668.0]
  - - [19584, 1536, 1, 384, 19584, 19584, 19584, 1536]
    - [17, 12653.0]
  - - [19968, 1536, 1, 384, 19968, 19968, 19968, 1536]
    - [4, 12620.0]
  - - [20352, 1536, 1, 384, 20352, 20352, 20352, 1536]
    - [17, 12608.0]
  - - [20736, 1536, 1, 384, 20736, 20736, 20736, 1536]
    - [17, 12592.0]
  - - [21120, 1536, 1, 384, 21120, 21120, 21120, 1536]
    - [29, 12682.0]
  - - [21504, 1536, 1, 384, 21504, 21504, 21504, 1536]
    - [4, 12648.0]
  - - [21888, 1536, 1, 384, 21888, 21888, 21888, 1536]
    - [17, 12642.0]
  - - [22272, 1536, 1, 384, 22272, 22272, 22272, 1536]
    - [17, 12611.0]
  - - [22656, 1536, 1, 384, 22656, 22656, 22656, 1536]
    - [17, 12609.0]
  - - [23040, 1536, 1, 384, 23040, 23040, 23040, 1536]
    - [29, 12681.0]
  - - [768, 1920, 1, 384, 768, 768, 768, 1920]
    - [25, 11116.0]
  - - [1152, 1920, 1, 384, 1152, 1152, 1152, 1920]
    - [5, 11478.0]
  - - [1536, 1920, 1, 384, 1536, 1536, 1536, 1920]
    - [30, 11956.0]
  - - [2304, 1920, 1, 384, 2304, 2304, 2304, 1920]
    - [25, 11831.0]
  - - [2688, 1920, 1, 384, 2688, 2688, 2688, 1920]
    - [15, 12098.0]
  - - [3072, 1920, 1, 384, 3072, 3072, 3072, 1920]
    - [17, 12279.0]
  - - [3456, 1920, 1, 384, 3456, 3456, 3456, 1920]
    - [1, 11956.0]
  - - [4224, 1920, 1, 384, 4224, 4224, 4224, 1920]
    - [26, 12307.0]
  - - [4608, 1920, 1, 384, 4608, 4608, 4608, 1920]
    - [17, 12446.0]
  - - [4992, 1920, 1, 384, 4992, 4992, 4992, 1920]
    - [17, 12206.0]
  - - [5376, 1920, 1, 384, 5376, 5376, 5376, 1920]
    - [4, 12309.0]
  - - [5760, 1920, 1, 384, 5760, 5760, 5760, 1920]
    - [29, 12438.0]
  - - [6144, 1920, 1, 384, 6144, 6144, 6144, 1920]
    - [17, 12527.0]
  - - [6528, 1920, 1, 384, 6528, 6528, 6528, 1920]
    - [17, 12346.0]
  - - [6912, 1920, 1, 384, 6912, 6912, 6912, 1920]
    - [1, 12381.0]
  - - [7296, 1920, 1, 384, 7296, 7296, 7296, 1920]
    - [17, 12520.0]
  - - [7680, 1920, 1, 384, 7680, 7680, 7680, 1920]
    - [4, 12581.0]
  - - [8064, 1920, 1, 384, 8064, 8064, 8064, 1920]
    - [29, 12381.0]
  - - [8448, 1920, 1, 384, 8448, 8448, 8448, 1920]
    - [17, 12499.0]
  - - [8832, 1920, 1, 384, 8832, 8832, 8832, 1920]
    - [17, 12570.0]
  - - [9216, 1920, 1, 384, 9216, 9216, 9216, 1920]
    - [23, 12597.0]
  - - [9600, 1920, 1, 384, 9600, 9600, 9600, 1920]
    - [17, 12480.0]
  - - [9984, 1920, 1, 384, 9984, 9984, 9984, 1920]
    - [29, 12493.0]
  - - [10368, 1920, 1, 384, 10368, 10368, 10368, 1920]
    - [17, 12602.0]
  - - [10752, 1920, 1, 384, 10752, 10752, 10752, 1920]
    - [17, 12600.0]
  - - [11136, 1920, 1, 384, 11136, 11136, 11136, 1920]
    - [17, 12513.0]
  - - [11520, 1920, 1, 384, 11520, 11520, 11520, 1920]
    - [35, 12533.0]
  - - [11904, 1920, 1, 384, 11904, 11904, 11904, 1920]
    - [17, 12603.0]
  - - [12288, 1920, 1, 384, 12288, 12288, 12288, 1920]
    - [4, 12622.0]
  - - [12672, 1920, 1, 384, 12672, 12672, 12672, 1920]
    - [4, 12541.0]
  - - [13056, 1920, 1, 384, 13056, 13056, 13056, 1920]
    - [17, 12562.0]
  - - [13440, 1920, 1, 384, 13440, 13440, 13440, 1920]
    - [17, 12616.0]
  - - [13824, 1920, 1, 384, 13824, 13824, 13824, 1920]
    - [4, 12647.0]
  - - [14208, 1920, 1, 384, 14208, 14208, 14208, 1920]
    - [17, 12562.0]
  - - [14592, 1920, 1, 384, 14592, 14592, 14592, 1920]
    - [4, 12590.0]
  - - [14976, 1920, 1, 384, 14976, 14976, 14976, 1920]
    - [17, 12634.0]
  - - [15360, 1920, 1, 384, 15360, 15360, 15360, 1920]
    - [4, 12657.0]
  - - [15744, 1920, 1, 384, 15744, 15744, 15744, 1920]
    - [4, 12581.0]
  - - [16128, 1920, 1, 384, 16128, 16128, 16128, 1920]
    - [4, 12605.0]
  - - [16512, 1920, 1, 384, 16512, 16512, 16512, 1920]
    - [4, 12650.0]
  - - [16896, 1920, 1, 384, 16896, 16896, 16896, 1920]
    - [4, 12669.0]
  - - [17280, 1920, 1, 384, 17280, 17280, 17280, 1920]
    - [17, 12601.0]
  - - [17664, 1920, 1, 384, 17664, 17664, 17664, 1920]
    - [4, 12630.0]
  - - [18048, 1920, 1, 384, 18048, 18048, 18048, 1920]
    - [17, 12662.0]
  - - [18432, 1920, 1, 384, 18432, 18432, 18432, 1920]
    - [4, 12678.0]
  - - [18816, 1920, 1, 384, 18816, 18816, 18816, 1920]
    - [17, 12620.0]
  - - [19200, 1920, 1, 384, 19200, 19200, 19200, 1920]
    - [17, 12643.0]
  - - [19584, 1920, 1, 384, 19584, 19584, 19584, 1920]
    - [17, 12671.0]
  - - [19968, 1920, 1, 384, 19968, 19968, 19968, 1920]
    - [17, 12690.0]
  - - [20352, 1920, 1, 384, 20352, 20352, 20352, 1920]
    - [17, 12631.0]
  - - [20736, 1920, 1, 384, 20736, 20736, 20736, 1920]
    - [29, 12650.0]
  - - [21120, 1920, 1, 384, 21120, 21120, 21120, 1920]
    - [29, 12683.0]
  - - [21504, 1920, 1, 384, 21504, 21504, 21504, 1920]
    - [17, 12695.0]
  - - [21888, 1920, 1, 384, 21888, 21888, 21888, 1920]
    - [29, 12642.0]
  - - [22272, 1920, 1, 384, 22272, 22272, 22272, 1920]
    - [17, 12659.0]
  - - [22656, 1920, 1, 384, 22656, 22656, 22656, 1920]
    - [17, 12690.0]
  - - [23040, 1920, 1, 384, 23040, 23040, 23040, 1920]
    - [17, 12701.0]
  - - [768, 2304, 1, 384, 768, 768, 768, 2304]
    - [14, 11157.0]
  - - [1536, 2304, 1, 384, 1536, 1536, 1536, 2304]
    - [18, 11856.0]
  - - [1920, 2304, 1, 384, 1920, 1920, 1920, 2304]
    - [25, 11834.0]
  - - [2688, 2304, 1, 384, 2688, 2688, 2688, 2304]
    - [26, 12190.0]
  - - [3072, 2304, 1, 384, 3072, 3072, 3072, 2304]
    - [4, 12156.0]
  - - [3456, 2304, 1, 384, 3456, 3456, 3456, 2304]
    - [29, 12122.0]
  - - [3840, 2304, 1, 384, 3840, 3840, 3840, 2304]
    - [17, 12425.0]
  - - [4224, 2304, 1, 384, 4224, 4224, 4224, 2304]
    - [26, 12371.0]
  - - [4992, 2304, 1, 384, 4992, 4992, 4992, 2304]
    - [35, 12238.0]
  - - [5376, 2304, 1, 384, 5376, 5376, 5376, 2304]
    - [17, 12471.0]
  - - [5760, 2304, 1, 384, 5760, 5760, 5760, 2304]
    - [17, 12436.0]
  - - [6144, 2304, 1, 384, 6144, 6144, 6144, 2304]
    - [4, 12371.0]
  - - [6528, 2304, 1, 384, 6528, 6528, 6528, 2304]
    - [17, 12568.0]
  - - [6912, 2304, 1, 384, 6912, 6912, 6912, 2304]
    - [4, 12507.0]
  - - [7296, 2304, 1, 384, 7296, 7296, 7296, 2304]
    - [32, 12437.0]
  - - [7680, 2304, 1, 384, 7680, 7680, 7680, 2304]
    - [17, 12619.0]
  - - [8064, 2304, 1, 384, 8064, 8064, 8064, 2304]
    - [4, 12573.0]
  - - [8448, 2304, 1, 384, 8448, 8448, 8448, 2304]
    - [29, 12520.0]
  - - [8832, 2304, 1, 384, 8832, 8832, 8832, 2304]
    - [4, 12465.0]
  - - [9216, 2304, 1, 384, 9216, 9216, 9216, 2304]
    - [17, 12581.0]
  - - [9600, 2304, 1, 384, 9600, 9600, 9600, 2304]
    - [4, 12552.0]
  - - [9984, 2304, 1, 384, 9984, 9984, 9984, 2304]
    - [17, 12522.0]
  - - [10368, 2304, 1, 384, 10368, 10368, 10368, 2304]
    - [17, 12626.0]
  - - [10752, 2304, 1, 384, 10752, 10752, 10752, 2304]
    - [11, 12584.0]
  - - [11136, 2304, 1, 384, 11136, 11136, 11136, 2304]
    - [17, 12547.0]
  - - [11520, 2304, 1, 384, 11520, 11520, 11520, 2304]
    - [4, 12657.0]
  - - [11904, 2304, 1, 384, 11904, 11904, 11904, 2304]
    - [29, 12622.0]
  - - [12288, 2304, 1, 384, 12288, 12288, 12288, 2304]
    - [4, 12572.0]
  - - [12672, 2304, 1, 384, 12672, 12672, 12672, 2304]
    - [17, 12557.0]
  - - [13056, 2304, 1, 384, 13056, 13056, 13056, 2304]
    - [17, 12640.0]
  - - [13440, 2304, 1, 384, 13440, 13440, 13440, 2304]
    - [4, 12618.0]
  - - [13824, 2304, 1, 384, 13824, 13824, 13824, 2304]
    - [4, 12580.0]
  - - [14208, 2304, 1, 384, 14208, 14208, 14208, 2304]
    - [17, 12671.0]
  - - [14592, 2304, 1, 384, 14592, 14592, 14592, 2304]
    - [29, 12629.0]
  - - [14976, 2304, 1, 384, 14976, 14976, 14976, 2304]
    - [29, 12617.0]
  - - [15360, 2304, 1, 384, 15360, 15360, 15360, 2304]
    - [17, 12683.0]
  - - [15744, 2304, 1, 384, 15744, 15744, 15744, 2304]
    - [4, 12671.0]
  - - [16128, 2304, 1, 384, 16128, 16128, 16128, 2304]
    - [17, 12635.0]
  - - [16512, 2304, 1, 384, 16512, 16512, 16512, 2304]
    - [17, 12624.0]
  - - [16896, 2304, 1, 384, 16896, 16896, 16896, 2304]
    - [17, 12681.0]
  - - [17280, 2304, 1, 384, 17280, 17280, 17280, 2304]
    - [29, 12662.0]
  - - [17664, 2304, 1, 384, 17664, 17664, 17664, 2304]
    - [11, 12628.0]
  - - [18048, 2304, 1, 384, 18048, 18048, 18048, 2304]
    - [4, 12694.0]
  - - [18432, 2304, 1, 384, 18432, 18432, 18432, 2304]
    - [4, 12665.0]
  - - [18816, 2304, 1, 384, 18816, 18816, 18816, 2304]
    - [29, 12652.0]
  - - [19200, 2304, 1, 384, 19200, 19200, 19200, 2304]
    - [29, 12699.0]
  - - [19584, 2304, 1, 384, 19584, 19584, 19584, 2304]
    - [29, 12684.0]
  - - [19968, 2304, 1, 384, 19968, 19968, 19968, 2304]
    - [4, 12662.0]
  - - [20352, 2304, 1, 384, 20352, 20352, 20352, 2304]
    - [17, 12649.0]
  - - [20736, 2304, 1, 384, 20736, 20736, 20736, 2304]
    - [4, 12693.0]
  - - [21120, 2304, 1, 384, 21120, 21120, 21120, 2304]
    - [17, 12683.0]
  - - [21504, 2304, 1, 384, 21504, 21504, 21504, 2304]
    - [4, 12657.0]
  - - [21888, 2304, 1, 384, 21888, 21888, 21888, 2304]
    - [17, 12711.0]
  - - [22272, 2304, 1, 384, 22272, 22272, 22272, 2304]
    - [17, 12685.0]
  - - [22656, 2304, 1, 384, 22656, 22656, 22656, 2304]
    - [29, 12673.0]
  - - [23040, 2304, 1, 384, 23040, 23040, 23040, 2304]
    - [4, 12710.0]
  - - [256, 32768, 1, 1, 256, 256, 256, 32768]
    - [0, 261.0]
  - - [289, 128, 64, 768, 289, 289, 289, 128]
    - [18, 8780.0]
  - - [289, 160, 64, 768, 289, 289, 289, 160]
    - [25, 7414.0]
  - - [289, 192, 64, 768, 289, 289, 289, 192]
    - [25, 8895.0]
  - - [3136, 256, 32, 64, 3136, 3136, 3136, 256]
    - [0, 11317.0]
  - - [784, 512, 32, 128, 784, 784, 784, 512]
    - [18, 10358.0]
  - - [784, 128, 32, 512, 784, 784, 784, 128]
    - [25, 10093.0]
  - - [196, 1024, 32, 256, 196, 196, 196, 1024]
    - [30, 8978.0]
  - - [1444, 128, 120, 256, 1444, 1444, 1444, 128]
    - [29, 11452.0]
  - - [1444, 128, 18, 256, 1444, 1444, 1444, 128]
    - [5, 10825.0]
  - - [1444, 128, 19, 256, 1444, 1444, 1444, 128]
    - [25, 10863.0]
  - - [1444, 256, 120, 256, 1444, 1444, 1444, 256]
    - [17, 11702.0]
  - - [1444, 256, 18, 256, 1444, 1444, 1444, 256]
    - [30, 11128.0]
  - - [1444, 256, 19, 256, 1444, 1444, 1444, 256]
    - [1, 11300.0]
  - - [361, 512, 120, 256, 361, 361, 361, 512]
    - [4, 11289.0]
  - - [361, 512, 18, 256, 361, 361, 361, 512]
    - [14, 10588.0]
  - - [361, 512, 19, 256, 361, 361, 361, 512]
    - [3, 10505.0]
  - - [7680, 8192, 1, 8192, 7680, 7680, 7680, 8192]
    - [4, 12841.0]
  - - [3840, 4096, 1, 4096, 3840, 3840, 3840, 4096]
    - [29, 12788.0]
  - - [1920, 2048, 1, 2048, 1920, 1920, 1920, 2048]
    - [15, 12491.0]
  - - [8192, 7680, 1, 8192, 8192, 8192, 8192, 7680]
    - [17, 12850.0]
  - - [4096, 3840, 1, 4096, 4096, 4096, 4096, 3840]
    - [17, 12790.0]
  - - [2048, 1920, 1, 2048, 2048, 2048, 2048, 1920]
    - [15, 12472.0]
  - - [8192, 8192, 1, 8192, 8192, 8192, 8192, 8192]
    - [17, 12839.0]
  - - [4096, 4096, 1, 4096, 4096, 4096, 4096, 4096]
    - [4, 12608.0]
  - - [2048, 2048, 1, 2048, 2048, 2048, 2048, 2048]
    - [15, 12319.0]
  - - [1024, 4096, 1, 512, 1024, 1024, 1024, 4096]
    - [17, 12062.0]
  - - [1024, 30522, 1, 77, 1024, 1024, 1024, 30522]
    - [0, 11476.0]
  - - [4096, 1024, 1, 512, 4096, 4096, 4096, 1024]
    - [1, 11969.0]
  - - [1024, 4096, 1, 1280, 1024, 1024, 1024, 4096]
    - [4, 12290.0]
  - - [1024, 30522, 1, 200, 1024, 1024, 1024, 30522]
    - [21, 12275.0]
  - - [4096, 1024, 1, 1280, 4096, 4096, 4096, 1024]
    - [15, 12270.0]
  - - [1024, 4096, 1, 4992, 1024, 1024, 1024, 4096]
    - [4, 12388.0]
  - - [1024, 30522, 1, 780, 1024, 1024, 1024, 30522]
    - [4, 12637.0]
  - - [4096, 1024, 1, 4992, 4096, 4096, 4096, 1024]
    - [17, 12386.0]
  - - [1024, 30522, 1, 308, 1024, 1024, 1024, 30522]
    - [17, 12447.0]
  - - [1024, 4096, 1, 5120, 1024, 1024, 1024, 4096]
    - [17, 12387.0]
  - - [1024, 30522, 1, 800, 1024, 1024, 1024, 30522]
    - [17, 12663.0]
  - - [4096, 1024, 1, 5120, 4096, 4096, 4096, 1024]
    - [17, 12387.0]
  - - [1024, 4096, 1, 5248, 1024, 1024, 1024, 4096]
    - [4, 12389.0]
  - - [1024, 30522, 1, 820, 1024, 1024, 1024, 30522]
    - [17, 12650.0]
  - - [4096, 1024, 1, 5248, 4096, 4096, 4096, 1024]
    - [17, 12392.0]
  - - [1024, 4096, 1, 2560, 1024, 1024, 1024, 4096]
    - [15, 12341.0]
  - - [1024, 30522, 1, 385, 1024, 1024, 1024, 30522]
    - [17, 12517.0]
  - - [4096, 1024, 1, 2560, 4096, 4096, 4096, 1024]
    - [15, 12341.0]
  - - [1024, 30522, 1, 462, 1024, 1024, 1024, 30522]
    - [17, 12559.0]
  - - [1024, 4096, 1, 1024, 1024, 1024, 1024, 4096]
    - [1, 12206.0]
  - - [1024, 30522, 1, 160, 1024, 1024, 1024, 30522]
    - [18, 12071.0]
  - - [4096, 1024, 1, 1024, 4096, 4096, 4096, 1024]
    - [15, 12205.0]
  - - [1024, 4096, 1, 1152, 1024, 1024, 1024, 4096]
    - [23, 12251.0]
  - - [1024, 30522, 1, 180, 1024, 1024, 1024, 30522]
    - [17, 12127.0]
  - - [4096, 1024, 1, 1152, 4096, 4096, 4096, 1024]
    - [1, 12227.0]
  - - [1024, 4096, 1, 8192, 1024, 1024, 1024, 4096]
    - [17, 12405.0]
  - - [1024, 4096, 1, 9600, 1024, 1024, 1024, 4096]
    - [29, 12405.0]
  - - [1024, 33712, 1, 8192, 1024, 1024, 1024, 33712]
    - [29, 12759.0]
  - - [1024, 33712, 1, 9600, 1024, 1024, 1024, 33712]
    - [17, 12761.0]
  - - [4096, 1024, 1, 8192, 4096, 4096, 4096, 1024]
    - [17, 12402.0]
  - - [4096, 1024, 1, 9600, 4096, 4096, 4096, 1024]
    - [17, 12406.0]
  - - [1024, 4096, 1, 10064, 1024, 1024, 1024, 4096]
    - [4, 12408.0]
  - - [1024, 4096, 1, 10080, 1024, 1024, 1024, 4096]
    - [29, 12408.0]
  - - [1024, 4096, 1, 6528, 1024, 1024, 1024, 4096]
    - [17, 12398.0]
  - - [1024, 4096, 1, 7104, 1024, 1024, 1024, 4096]
    - [4, 12399.0]
  - - [1024, 4096, 1, 8064, 1024, 1024, 1024, 4096]
    - [29, 12400.0]
  - - [1024, 4096, 1, 9216, 1024, 1024, 1024, 4096]
    - [29, 12403.0]
  - - [1024, 42720, 1, 10080, 1024, 1024, 1024, 42720]
    - [4, 12798.0]
  - - [1024, 42720, 1, 6528, 1024, 1024, 1024, 42720]
    - [29, 12799.0]
  - - [1024, 42720, 1, 7104, 1024, 1024, 1024, 42720]
    - [17, 12794.0]
  - - [4096, 1024, 1, 10064, 4096, 4096, 4096, 1024]
    - [17, 12407.0]
  - - [4096, 1024, 1, 10080, 4096, 4096, 4096, 1024]
    - [17, 12407.0]
  - - [4096, 1024, 1, 6528, 4096, 4096, 4096, 1024]
    - [17, 12397.0]
  - - [4096, 1024, 1, 7104, 4096, 4096, 4096, 1024]
    - [17, 12400.0]
  - - [4096, 1024, 1, 8064, 4096, 4096, 4096, 1024]
    - [17, 12402.0]
  - - [4096, 1024, 1, 9216, 4096, 4096, 4096, 1024]
    - [4, 12402.0]
  - - [1024, 1600, 1, 1, 1024, 1024, 1024, 1600]
    - [20, 211.0]
  - - [2048, 960, 1, 1, 2048, 2048, 2048, 960]
    - [20, 236.0]
  - - [2048, 2048, 1, 2, 2048, 2048, 2048, 2048]
    - [8, 525.0]
  - - [2048, 30592, 1, 1024, 2048, 2048, 2048, 30592]
    - [4, 12770.0]
  - - [2048, 6144, 1, 1024, 2048, 2048, 2048, 6144]
    - [17, 12507.0]
  - - [2048, 8192, 1, 1024, 2048, 2048, 2048, 8192]
    - [4, 12552.0]
  - - [8192, 2048, 1, 1024, 8192, 8192, 8192, 2048]
    - [17, 12546.0]
  - - [1024, 30592, 1, 8192, 1024, 1024, 1024, 30592]
    - [17, 12791.0]
  - - [1024, 3072, 1, 8192, 1024, 1024, 1024, 3072]
    - [6, 12045.0]
  - - [1024, 30592, 1, 2048, 1024, 1024, 1024, 30592]
    - [4, 12769.0]
  - - [1024, 30592, 1, 4096, 1024, 1024, 1024, 30592]
    - [17, 12784.0]
  - - [1024, 3072, 1, 4096, 1024, 1024, 1024, 3072]
    - [6, 12000.0]
  - - [2560, 1920, 1, 2048, 2560, 2560, 2560, 1920]
    - [17, 12549.0]
  - - [2560, 2560, 1, 2048, 2560, 2560, 2560, 2560]
    - [17, 12654.0]
  - - [2560, 2560, 1, 4, 2560, 2560, 2560, 2560]
    - [22, 1050.0]
  - - [2560, 7680, 1, 2048, 2560, 2560, 2560, 7680]
    - [17, 12793.0]
  - - [640, 2560, 1, 2048, 640, 640, 640, 2560]
    - [30, 12060.0]
  - - [1536, 1536, 1, 4096, 1536, 1536, 1536, 1536]
    - [25, 11506.0]
  - - [1536, 4608, 1, 4096, 1536, 1536, 1536, 4608]
    - [4, 12473.0]
  - - [1536, 50304, 1, 4096, 1536, 1536, 1536, 50304]
    - [29, 12838.0]
  - - [1536, 6144, 1, 4096, 1536, 1536, 1536, 6144]
    - [17, 12650.0]
  - - [6144, 1536, 1, 4096, 6144, 6144, 6144, 1536]
    - [17, 12650.0]
  - - [1536, 1536, 1, 8192, 1536, 1536, 1536, 1536]
    - [28, 11532.0]
  - - [1536, 4608, 1, 8192, 1536, 1536, 1536, 4608]
    - [17, 12488.0]
  - - [1536, 50304, 1, 8192, 1536, 1536, 1536, 50304]
    - [17, 12842.0]
  - - [1536, 6144, 1, 8192, 1536, 1536, 1536, 6144]
    - [17, 12668.0]
  - - [6144, 1536, 1, 8192, 6144, 6144, 6144, 1536]
    - [17, 12667.0]
  - - [1024, 3072, 1, 16384, 1024, 1024, 1024, 3072]
    - [6, 12071.0]
  - - [1024, 4096, 1, 16384, 1024, 1024, 1024, 4096]
    - [17, 12417.0]
  - - [1024, 50304, 1, 16384, 1024, 1024, 1024, 50304]
    - [29, 12778.0]
  - - [4096, 1024, 1, 16384, 4096, 4096, 4096, 1024]
    - [17, 12416.0]
  - - [1024, 50304, 1, 2048, 1024, 1024, 1024, 50304]
    - [4, 12785.0]
  - - [1024, 50304, 1, 4096, 1024, 1024, 1024, 50304]
    - [4, 12781.0]
  - - [1024, 50304, 1, 8192, 1024, 1024, 1024, 50304]
    - [29, 12780.0]
  - - [1024, 30528, 1, 8192, 1024, 1024, 1024, 30528]
    - [17, 12755.0]
  - - [256, 6912, 1, 1, 256, 256, 256, 6912]
    - [3, 207.0]
  - - [30528, 1024, 1, 640, 30528, 30528, 30528, 1024]
    - [4, 12628.0]
  - - [30528, 1024, 1, 1280, 30528, 30528, 30528, 1024]
    - [17, 12695.0]
  - - [4096, 1024, 1, 10240, 4096, 4096, 4096, 1024]
    - [29, 12406.0]
  - - [1024, 4096, 1, 10240, 1024, 1024, 1024, 4096]
    - [4, 12407.0]
  - - [30528, 1024, 1, 1600, 30528, 30528, 30528, 1024]
    - [29, 12712.0]
  - - [1024, 4096, 1, 10496, 1024, 1024, 1024, 4096]
    - [29, 12407.0]
  - - [30528, 1024, 1, 1640, 30528, 30528, 30528, 1024]
    - [29, 12714.0]
  - - [4096, 1024, 1, 10496, 4096, 4096, 4096, 1024]
    - [29, 12408.0]
  - - [30528, 1024, 1, 160, 30528, 30528, 30528, 1024]
    - [21, 12180.0]
  - - [1024, 4096, 1, 6144, 1024, 1024, 1024, 4096]
    - [17, 12397.0]
  - - [30528, 1024, 1, 240, 30528, 30528, 30528, 1024]
    - [9, 12427.0]
  - - [4096, 1024, 1, 6144, 4096, 4096, 4096, 1024]
    - [29, 12393.0]
  - - [3136, 128, 64, 256, 3136, 3136, 3136, 128]
    - [29, 12056.0]
  - - [784, 256, 64, 512, 784, 784, 784, 256]
    - [15, 10908.0]
  - - [3136, 256, 64, 128, 3136, 3136, 3136, 256]
    - [1, 11898.0]
  - - [3136, 256, 64, 256, 3136, 3136, 3136, 256]
    - [23, 12269.0]
  - - [196, 512, 64, 1024, 196, 196, 196, 512]
    - [17, 9429.0]
  - - [784, 512, 64, 256, 784, 784, 784, 512]
    - [26, 10852.0]
  - - [784, 512, 64, 512, 784, 784, 784, 512]
    - [29, 11022.0]
  - - [196, 1024, 64, 512, 196, 196, 196, 1024]
    - [15, 9411.0]
  - - [196, 1024, 64, 1024, 196, 196, 196, 1024]
    - [17, 9545.0]
  - - [3136, 128, 32, 256, 3136, 3136, 3136, 128]
    - [30, 11894.0]
  - - [784, 256, 32, 512, 784, 784, 784, 256]
    - [15, 10556.0]
  - - [3136, 256, 32, 128, 3136, 3136, 3136, 256]
    - [5, 11751.0]
  - - [3136, 256, 32, 256, 3136, 3136, 3136, 256]
    - [1, 12114.0]
  - - [196, 512, 32, 1024, 196, 196, 196, 512]
    - [29, 9224.0]
  - - [784, 512, 32, 256, 784, 784, 784, 512]
    - [1, 10722.0]
  - - [784, 512, 32, 512, 784, 784, 784, 512]
    - [26, 10931.0]
  - - [196, 1024, 32, 512, 196, 196, 196, 1024]
    - [1, 9271.0]
  - - [196, 1024, 32, 1024, 196, 196, 196, 1024]
    - [1, 9436.0]
  - - [1024, 4096, 1, 10224, 1024, 1024, 1024, 4096]
    - [17, 12408.0]
  - - [4096, 1024, 1, 10224, 4096, 4096, 4096, 1024]
    - [17, 12408.0]
  - - [1024, 3072, 1, 10224, 1024, 1024, 1024, 3072]
    - [6, 12060.0]
  - - [1024, 3072, 1, 10240, 1024, 1024, 1024, 3072]
    - [6, 12056.0]
  - - [4096, 1024, 1, 10192, 4096, 4096, 4096, 1024]
    - [17, 12410.0]
  - - [1024, 3072, 1, 10192, 1024, 1024, 1024, 3072]
    - [6, 12057.0]
  - - [1024, 4096, 1, 10192, 1024, 1024, 1024, 4096]
    - [29, 12409.0]
  - - [1024, 3072, 1, 10200, 1024, 1024, 1024, 3072]
    - [6, 12053.0]
  - - [4096, 1024, 1, 10208, 4096, 4096, 4096, 1024]
    - [17, 12404.0]
  - - [1024, 3072, 1, 10208, 1024, 1024, 1024, 3072]
    - [6, 12061.0]
  - - [1024, 4096, 1, 10208, 1024, 1024, 1024, 4096]
    - [17, 12407.0]
  - - [1024, 2048, 1, 10224, 1024, 1024, 1024, 2048]
    - [3, 11767.0]
  - - [1024, 2048, 1, 10240, 1024, 1024, 1024, 2048]
    - [16, 11769.0]
  - - [1024, 2048, 1, 10192, 1024, 1024, 1024, 2048]
    - [3, 11770.0]
  - - [1024, 3072, 1, 10080, 1024, 1024, 1024, 3072]
    - [6, 12057.0]
  - - [100352, 256, 1, 512, 100352, 100352, 100352, 256]
    - [4, 12582.0]
  - - [12544, 1024, 1, 2048, 12544, 12544, 12544, 1024]
    - [29, 12508.0]
  - - [12544, 147, 1, 64, 12544, 12544, 12544, 147]
    - [14, 6751.0]
  - - [200704, 256, 1, 512, 200704, 200704, 200704, 256]
    - [35, 12710.0]
  - - [25088, 512, 1, 1024, 25088, 25088, 25088, 512]
    - [29, 12461.0]
  - - [3136, 576, 1, 64, 3136, 3136, 3136, 576]
    - [20, 8141.0]
  - - [50176, 512, 1, 1024, 50176, 50176, 50176, 512]
    - [29, 12680.0]
  - - [6272, 1024, 1, 2048, 6272, 6272, 6272, 1024]
    - [17, 12395.0]
  - - [196, 1024, 128, 512, 196, 196, 196, 1024]
    - [1, 9563.0]
  - - [196, 1024, 256, 512, 196, 196, 196, 1024]
    - [1, 9631.0]
  - - [3136, 256, 128, 128, 3136, 3136, 3136, 256]
    - [29, 12015.0]
  - - [3136, 256, 256, 128, 3136, 3136, 3136, 256]
    - [17, 12098.0]
  - - [784, 512, 128, 256, 784, 784, 784, 512]
    - [1, 10945.0]
  - - [784, 512, 256, 256, 784, 784, 784, 512]
    - [1, 11000.0]
  - - [30528, 1024, 1, 2560, 30528, 30528, 30528, 1024]
    - [17, 12735.0]
  - - [1024, 4096, 1, 12288, 1024, 1024, 1024, 4096]
    - [17, 12406.0]
  - - [30528, 1024, 1, 1920, 30528, 30528, 30528, 1024]
    - [29, 12721.0]
  - - [4096, 1024, 1, 12288, 4096, 4096, 4096, 1024]
    - [17, 12410.0]
  - - [25600, 128, 25, 128, 25600, 25600, 25600, 128]
    - [16, 10673.0]
  - - [12544, 128, 36, 128, 12544, 12544, 12544, 128]
    - [1, 11167.0]
  - - [9216, 128, 49, 128, 9216, 9216, 9216, 128]
    - [21, 11078.0]
  - - [6400, 128, 64, 128, 6400, 6400, 6400, 128]
    - [16, 11195.0]
  - - [6400, 256, 25, 256, 6400, 6400, 6400, 256]
    - [11, 12550.0]
  - - [4096, 256, 36, 256, 4096, 4096, 4096, 256]
    - [4, 12510.0]
  - - [2304, 256, 49, 256, 2304, 2304, 2304, 256]
    - [17, 12427.0]
  - - [2304, 256, 64, 256, 2304, 2304, 2304, 256]
    - [29, 12510.0]
  - - [2304, 512, 25, 512, 2304, 2304, 2304, 512]
    - [29, 12697.0]
  - - [1024, 512, 36, 512, 1024, 1024, 1024, 512]
    - [17, 12557.0]
  - - [1024, 512, 49, 512, 1024, 1024, 1024, 512]
    - [17, 12593.0]
  - - [1024, 512, 64, 512, 1024, 1024, 1024, 512]
    - [29, 12644.0]
  - - [3072, 768, 1, 2048, 3072, 3072, 3072, 768]
    - [14, 11442.0]
  - - [768, 3072, 1, 2048, 768, 768, 768, 3072]
    - [3, 11461.0]
  - - [3072, 768, 1, 4608, 3072, 3072, 3072, 768]
    - [16, 11528.0]
  - - [768, 3072, 1, 4608, 768, 768, 768, 3072]
    - [28, 11505.0]
  - - [4096, 1024, 1, 4608, 4096, 4096, 4096, 1024]
    - [29, 12381.0]
  - - [1024, 4096, 1, 4608, 1024, 1024, 1024, 4096]
    - [17, 12386.0]
  - - [4880, 256, 49, 256, 4880, 4880, 4880, 256]
    - [29, 12267.0]
  - - [3128, 256, 64, 256, 3128, 3128, 3128, 256]
    - [17, 12214.0]
  - - [4680, 256, 49, 256, 4680, 4680, 4680, 256]
    - [29, 12357.0]
  - - [5280, 256, 36, 256, 5280, 5280, 5280, 256]
    - [11, 12285.0]
  - - [2640, 256, 64, 256, 2640, 2640, 2640, 256]
    - [4, 12249.0]
  - - [5304, 256, 49, 256, 5304, 5304, 5304, 256]
    - [29, 12367.0]
  - - [4524, 256, 49, 256, 4524, 4524, 4524, 256]
    - [29, 12266.0]
  - - [2760, 256, 64, 256, 2760, 2760, 2760, 256]
    - [29, 12199.0]
  - - [6440, 256, 36, 256, 6440, 6440, 6440, 256]
    - [29, 12358.0]
  - - [5704, 256, 36, 256, 5704, 5704, 5704, 256]
    - [4, 12349.0]
  - - [2666, 256, 64, 256, 2666, 2666, 2666, 256]
    - [29, 12258.0]
  - - [2128, 256, 64, 256, 2128, 2128, 2128, 256]
    - [29, 12179.0]
  - - [1160, 256, 49, 256, 1160, 1160, 1160, 256]
    - [29, 11038.0]
  - - [4056, 256, 49, 256, 4056, 4056, 4056, 256]
    - [4, 12379.0]
  - - [6144, 256, 36, 256, 6144, 6144, 6144, 256]
    - [4, 12594.0]
  - - [950, 2048, 2, 512, 950, 950, 950, 2048]
    - [5, 11054.0]
  - - [6336, 256, 36, 256, 6336, 6336, 6336, 256]
    - [1, 12402.0]
  - - [13600, 512, 2, 128, 13600, 13600, 13600, 512]
    - [5, 11811.0]
  - - [15200, 512, 2, 128, 15200, 15200, 15200, 512]
    - [1, 11950.0]
  - - [15200, 128, 2, 512, 15200, 15200, 15200, 128]
    - [18, 11843.0]
  - - [13600, 128, 2, 512, 13600, 13600, 13600, 128]
    - [30, 11587.0]
  - - [5632, 256, 36, 256, 5632, 5632, 5632, 256]
    - [4, 12568.0]
  - - [12288, 128, 2, 512, 12288, 12288, 12288, 128]
    - [12, 11536.0]
  - - [12880, 128, 2, 512, 12880, 12880, 12880, 128]
    - [25, 11207.0]
  - - [3220, 1024, 2, 256, 3220, 3220, 3220, 1024]
    - [5, 11541.0]
  - - [11408, 128, 2, 512, 11408, 11408, 11408, 128]
    - [18, 11918.0]
  - - [782, 128, 64, 128, 782, 782, 782, 128]
    - [25, 10081.0]
  - - [13824, 512, 2, 128, 13824, 13824, 13824, 512]
    - [35, 11886.0]
  - - [13824, 128, 2, 512, 13824, 13824, 13824, 128]
    - [26, 11902.0]
  - - [10560, 128, 2, 512, 10560, 10560, 10560, 128]
    - [20, 11191.0]
  - - [10752, 128, 2, 512, 10752, 10752, 10752, 128]
    - [25, 11590.0]
  - - [13600, 512, 2, 256, 13600, 13600, 13600, 512]
    - [9, 12253.0]
  - - [15200, 512, 2, 256, 15200, 15200, 15200, 512]
    - [21, 12202.0]
  - - [850, 2048, 2, 512, 850, 850, 850, 2048]
    - [14, 10912.0]
  - - [768, 2048, 2, 512, 768, 768, 768, 2048]
    - [1, 11681.0]
  - - [12880, 512, 2, 128, 12880, 12880, 12880, 512]
    - [9, 11742.0]
  - - [11616, 128, 2, 512, 11616, 11616, 11616, 128]
    - [20, 11092.0]
  - - [14208, 512, 2, 128, 14208, 14208, 14208, 512]
    - [9, 11956.0]
  - - [11408, 512, 2, 128, 11408, 11408, 11408, 512]
    - [26, 11768.0]
  - - [805, 2048, 2, 512, 805, 805, 805, 2048]
    - [14, 10363.0]
  - - [6912, 256, 36, 256, 6912, 6912, 6912, 256]
    - [4, 12596.0]
  - - [713, 2048, 2, 512, 713, 713, 713, 2048]
    - [5, 10688.0]
  - - [13824, 512, 2, 256, 13824, 13824, 13824, 512]
    - [17, 12225.0]
  - - [11616, 512, 2, 128, 11616, 11616, 11616, 512]
    - [0, 11735.0]
  - - [12288, 512, 2, 128, 12288, 12288, 12288, 512]
    - [18, 11829.0]
  - - [14208, 128, 2, 512, 14208, 14208, 14208, 128]
    - [25, 11431.0]
  - - [11968, 128, 2, 512, 11968, 11968, 11968, 128]
    - [25, 11427.0]
  - - [864, 2048, 2, 512, 864, 864, 864, 2048]
    - [25, 11109.0]
  - - [10560, 512, 2, 128, 10560, 10560, 10560, 512]
    - [8, 11585.0]
  - - [672, 2048, 2, 512, 672, 672, 672, 2048]
    - [5, 10196.0]
  - - [660, 2048, 2, 512, 660, 660, 660, 2048]
    - [5, 9988.0]
  - - [9408, 128, 2, 512, 9408, 9408, 9408, 128]
    - [0, 11239.0]
  - - [10752, 512, 2, 128, 10752, 10752, 10752, 512]
    - [36, 11835.0]
  - - [726, 2048, 2, 512, 726, 726, 726, 2048]
    - [1, 10952.0]
  - - [11968, 512, 2, 128, 11968, 11968, 11968, 512]
    - [12, 11673.0]
  - - [1240, 256, 49, 256, 1240, 1240, 1240, 256]
    - [29, 11778.0]
  - - [1024, 256, 1, 33536, 1024, 1024, 1024, 256]
    - [45, 10576.0]
  - - [1024, 1024, 1, 9520, 1024, 1024, 1024, 1024]
    - [39, 11951.0]
  - - [1024, 1024, 1, 10200, 1024, 1024, 1024, 1024]
    - [37, 11969.0]
  - - [1024, 256, 1, 21248, 1024, 1024, 1024, 256]
    - [38, 10457.0]
  - - [1024, 256, 1, 21504, 1024, 1024, 1024, 256]
    - [38, 10467.0]
  - - [1024, 256, 1, 22016, 1024, 1024, 1024, 256]
    - [42, 10468.0]
  - - [1024, 256, 1, 28672, 1024, 1024, 1024, 256]
    - [42, 10538.0]
  - - [256, 2560, 1, 8976, 256, 256, 256, 2560]
    - [44, 11735.0]
  - - [256, 2816, 1, 8976, 256, 256, 256, 2816]
    - [44, 11606.0]
  - - [256, 3328, 1, 8976, 256, 256, 256, 3328]
    - [38, 11535.0]
  - - [256, 3584, 1, 8976, 256, 256, 256, 3584]
    - [40, 11412.0]
  - - [256, 3840, 1, 8976, 256, 256, 256, 3840]
    - [18, 12003.0]
  - - [256, 4096, 1, 8976, 256, 256, 256, 4096]
    - [39, 11845.0]
  - - [256, 4352, 1, 8976, 256, 256, 256, 4352]
    - [39, 11744.0]
  - - [1024, 1024, 1, 32768, 1024, 1024, 1024, 1024]
    - [39, 12262.0]
  - - [1024, 512, 1, 32768, 1024, 1024, 1024, 512]
    - [42, 11633.0]
  - - [479, 1024, 1, 32768, 479, 479, 479, 1024]
    - [38, 10880.0]
  - - [512, 256, 1, 55296, 512, 512, 512, 256]
    - [46, 9355.0]
  - - [1024, 1024, 1, 8192, 1024, 1024, 1024, 1024]
    - [37, 11866.0]
  - - [1024, 1024, 1, 9600, 1024, 1024, 1024, 1024]
    - [41, 11936.0]
  - - [1024, 1024, 1, 10064, 1024, 1024, 1024, 1024]
    - [37, 11955.0]
  - - [1024, 1024, 1, 10080, 1024, 1024, 1024, 1024]
    - [37, 11954.0]
  - - [1024, 1024, 1, 9216, 1024, 1024, 1024, 1024]
    - [39, 11936.0]
  - - [480, 1024, 1, 32768, 480, 480, 480, 1024]
    - [38, 10914.0]
  - - [1024, 1024, 1, 16384, 1024, 1024, 1024, 1024]
    - [43, 12105.0]
  - - [1024, 1024, 1, 10240, 1024, 1024, 1024, 1024]
    - [37, 11967.0]
  - - [1024, 1024, 1, 10496, 1024, 1024, 1024, 1024]
    - [39, 11960.0]
  - - [1024, 1024, 1, 10224, 1024, 1024, 1024, 1024]
    - [39, 11970.0]
  - - [1024, 1024, 1, 10192, 1024, 1024, 1024, 1024]
    - [37, 11966.0]
  - - [1024, 1024, 1, 10208, 1024, 1024, 1024, 1024]
    - [37, 11960.0]
  - - [1024, 1024, 1, 10184, 1024, 1024, 1024, 1024]
    - [37, 11961.0]
  - - [1024, 1024, 1, 10120, 1024, 1024, 1024, 1024]
    - [37, 11962.0]
  - - [1024, 1024, 1, 10152, 1024, 1024, 1024, 1024]
    - [37, 11969.0]
  - - [1024, 1024, 1, 12288, 1024, 1024, 1024, 1024]
    - [39, 12021.0]
  - - [1024, 1024, 1, 512, 1024, 1024, 1024, 1024]
    - [51, 10187.0]
  - - [1024, 1024, 1, 200, 1024, 1024, 1024, 1024]
    - [73, 9883.0]
  - - [1024, 1024, 1, 4096, 1024, 1024, 1024, 1024]
    - [92, 10663.0]
  - - [1024, 1024, 1, 2048, 1024, 1024, 1024, 1024]
    - [92, 10574.0]
  - - [768, 768, 1, 16, 768, 768, 768, 768]
    - [78, 2931.0]
  - - [768, 768, 1, 320, 768, 768, 768, 768]
    - [74, 9153.0]
  - - [768, 768, 1, 4096, 768, 768, 768, 768]
    - [82, 10477.0]
  - - [768, 768, 1, 32, 768, 768, 768, 768]
    - [103, 4309.0]
  - - [768, 768, 1, 640, 768, 768, 768, 768]
    - [93, 9805.0]
  - - [768, 768, 1, 64, 768, 768, 768, 768]
    - [49, 6312.0]
  - - [768, 768, 1, 1280, 768, 768, 768, 768]
    - [74, 10131.0]
  - - [1024, 1024, 1, 3072, 1024, 1024, 1024, 1024]
    - [92, 10637.0]
  - - [1024, 1024, 1, 120, 1024, 1024, 1024, 1024]
    - [86, 9145.0]
  - - [1024, 1024, 1, 1, 1024, 1024, 1024, 1024]
    - [65, 217.0]
  - - [1024, 1024, 1, 20, 1024, 1024, 1024, 1024]
    - [69, 3318.0]
  - - [1024, 1024, 1, 4, 1024, 1024, 1024, 1024]
    - [53, 874.0]
  - - [1024, 1024, 1, 6, 1024, 1024, 1024, 1024]
    - [69, 1300.0]
  - - [1024, 1024, 1, 80, 1024, 1024, 1024, 1024]
    - [49, 7626.0]
  - - [128, 64, 512, 128, 128, 128, 128, 64]
    - [92, 11176.0]
  - - [512, 64, 64, 512, 512, 512, 512, 64]
    - [92, 11317.0]
  - - [64, 64, 768, 64, 64, 64, 64, 64]
    - [71, 7737.0]
  - - [1856, 448, 1, 3328, 1856, 1856, 1856, 448]
    - [57, 9937.0]
  - - [128, 6784, 1, 3328, 128, 128, 128, 6784]
    - [79, 10519.0]
  - - [2368, 448, 1, 128, 2368, 2368, 2368, 448]
    - [49, 8783.0]
  - - [256, 4288, 1, 3328, 256, 256, 256, 4288]
    - [51, 11139.0]
  - - [704, 1856, 1, 3328, 704, 704, 704, 1856]
    - [91, 11204.0]
  - - [448, 1024, 1, 1280, 448, 448, 448, 1024]
    - [49, 9471.0]
  - - [256, 1408, 1, 3328, 256, 256, 256, 1408]
    - [92, 8023.0]
  - - [704, 1856, 1, 1280, 704, 704, 704, 1856]
    - [49, 11190.0]
  - - [128, 5056, 1, 128, 128, 128, 128, 5056]
    - [92, 8334.0]
  - - [2368, 128, 1, 256, 2368, 2368, 2368, 128]
    - [49, 7265.0]
  - - [64, 5056, 1, 256, 64, 64, 64, 5056]
    - [49, 7476.0]
  - - [256, 2944, 1, 256, 256, 256, 256, 2944]
    - [51, 9628.0]
  - - [256, 1856, 1, 1280, 256, 256, 256, 1856]
    - [92, 10211.0]
  - - [128, 3584, 1, 1280, 128, 128, 128, 3584]
    - [73, 9869.0]
  - - [4288, 256, 1, 256, 4288, 4288, 4288, 256]
    - [51, 10160.0]
  - - [2944, 128, 1, 128, 2944, 2944, 2944, 128]
    - [72, 6060.0]
  - - [5888, 64, 1, 3328, 5888, 5888, 5888, 64]
    - [77, 8346.0]
  - - [2944, 256, 1, 3328, 2944, 2944, 2944, 256]
    - [73, 10437.0]
  - - [704, 1024, 1, 128, 704, 704, 704, 1024]
    - [91, 8313.0]
  - - [1408, 448, 1, 1280, 1408, 1408, 1408, 448]
    - [96, 10541.0]
  - - [1408, 704, 1, 3328, 1408, 1408, 1408, 704]
    - [51, 10131.0]
  - - [6784, 64, 1, 256, 6784, 6784, 6784, 64]
    - [92, 7985.0]
  - - [2944, 256, 1, 256, 2944, 2944, 2944, 256]
    - [51, 9533.0]
  - - [704, 1408, 1, 3328, 704, 704, 704, 1408]
    - [49, 10089.0]
  - - [2944, 256, 1, 128, 2944, 2944, 2944, 256]
    - [92, 8691.0]
  - - [448, 2944, 1, 128, 448, 448, 448, 2944]
    - [49, 9691.0]
  - - [2368, 128, 1, 3328, 2368, 2368, 2368, 128]
    - [74, 9254.0]
  - - [2944, 128, 1, 256, 2944, 2944, 2944, 128]
    - [51, 7146.0]
  - - [448, 1408, 1, 256, 448, 448, 448, 1408]
    - [91, 9249.0]
  - - [64, 5056, 1, 3328, 64, 64, 64, 5056]
    - [71, 9522.0]
  - - [1024, 448, 1, 128, 1024, 1024, 1024, 448]
    - [49, 7232.0]
  - - [256, 3584, 1, 3328, 256, 256, 256, 3584]
    - [79, 11129.0]
  - - [5056, 64, 1, 1280, 5056, 5056, 5056, 64]
    - [91, 9212.0]
  - - [1024, 704, 1, 256, 1024, 1024, 1024, 704]
    - [51, 9182.0]
  - - [128, 4288, 1, 128, 128, 128, 128, 4288]
    - [92, 7458.0]
  - - [3584, 256, 1, 128, 3584, 3584, 3584, 256]
    - [51, 9233.0]
  - - [4288, 128, 1, 1280, 4288, 4288, 4288, 128]
    - [74, 9251.0]
  - - [5888, 64, 1, 256, 5888, 5888, 5888, 64]
    - [51, 6991.0]
  - - [1856, 256, 1, 1280, 1856, 1856, 1856, 256]
    - [71, 9753.0]
  - - [64, 5888, 1, 3328, 64, 64, 64, 5888]
    - [75, 8115.0]
  - - [704, 1024, 1, 1280, 704, 704, 704, 1024]
    - [51, 9748.0]
  - - [448, 1856, 1, 128, 448, 448, 448, 1856]
    - [91, 8460.0]
  - - [1024, 704, 1, 1280, 1024, 1024, 1024, 704]
    - [51, 9758.0]
  - - [128, 5888, 1, 256, 128, 128, 128, 5888]
    - [92, 9523.0]
  - - [704, 704, 1, 3328, 704, 704, 704, 704]
    - [98, 8624.0]
  - - [704, 1408, 1, 1280, 704, 704, 704, 1408]
    - [91, 10020.0]
  - - [3584, 256, 1, 3328, 3584, 3584, 3584, 256]
    - [98, 11138.0]
  - - [704, 1856, 1, 128, 704, 704, 704, 1856]
    - [49, 10286.0]
  - - [128, 3584, 1, 3328, 128, 128, 128, 3584]
    - [92, 10069.0]
  - - [128, 2944, 1, 1280, 128, 128, 128, 2944]
    - [73, 8170.0]
  - - [3584, 128, 1, 256, 3584, 3584, 3584, 128]
    - [51, 8377.0]
  - - [448, 1408, 1, 3328, 448, 448, 448, 1408]
    - [75, 10483.0]
  - - [256, 3584, 1, 256, 256, 256, 256, 3584]
    - [92, 10089.0]
  - - [256, 2944, 1, 3328, 256, 256, 256, 2944]
    - [51, 10445.0]
  - - [448, 2368, 1, 128, 448, 448, 448, 2368]
    - [49, 9456.0]
  - - [1408, 704, 1, 256, 1408, 1408, 1408, 704]
    - [73, 9619.0]
  - - [448, 2944, 1, 3328, 448, 448, 448, 2944]
    - [71, 10596.0]
  - - [64, 5888, 1, 256, 64, 64, 64, 5888]
    - [104, 6881.0]
  - - [6784, 128, 1, 3328, 6784, 6784, 6784, 128]
    - [79, 10526.0]
  - - [704, 704, 1, 256, 704, 704, 704, 704]
    - [91, 7120.0]
  - - [448, 704, 1, 1280, 448, 448, 448, 704]
    - [71, 9142.0]
  - - [1024, 448, 1, 3328, 1024, 1024, 1024, 448]
    - [55, 10089.0]
  - - [1856, 704, 1, 1280, 1856, 1856, 1856, 704]
    - [91, 11101.0]
  - - [448, 1408, 1, 1280, 448, 448, 448, 1408]
    - [95, 10254.0]
  - - [1024, 1024, 1, 1280, 1024, 1024, 1024, 1024]
    - [92, 10562.0]
  - - [448, 1024, 1, 128, 448, 448, 448, 1024]
    - [91, 7214.0]
  - - [448, 2368, 1, 3328, 448, 448, 448, 2368]
    - [91, 10410.0]
  - - [5056, 64, 1, 128, 5056, 5056, 5056, 64]
    - [85, 6109.0]
  - - [704, 1024, 1, 256, 704, 704, 704, 1024]
    - [71, 9029.0]
  - - [128, 6784, 1, 1280, 128, 128, 128, 6784]
    - [57, 10396.0]
  - - [1856, 256, 1, 256, 1856, 1856, 1856, 256]
    - [91, 8566.0]
  - - [256, 4288, 1, 1280, 256, 256, 256, 4288]
    - [73, 11034.0]
  - - [256, 1856, 1, 128, 256, 256, 256, 1856]
    - [51, 7564.0]
  - - [448, 1408, 1, 128, 448, 448, 448, 1408]
    - [91, 8290.0]
  - - [6784, 128, 1, 256, 6784, 6784, 6784, 128]
    - [68, 9533.0]
  - - [704, 448, 1, 256, 704, 704, 704, 448]
    - [104, 7261.0]
  - - [704, 1408, 1, 128, 704, 704, 704, 1408]
    - [49, 9102.0]
  - - [2944, 448, 1, 128, 2944, 2944, 2944, 448]
    - [49, 9647.0]
  - - [128, 2944, 1, 128, 128, 128, 128, 2944]
    - [50, 6216.0]
  - - [1024, 704, 1, 3328, 1024, 1024, 1024, 704]
    - [92, 9996.0]
  - - [128, 4288, 1, 256, 128, 128, 128, 4288]
    - [92, 7815.0]
  - - [704, 448, 1, 3328, 704, 704, 704, 448]
    - [91, 9347.0]
  - - [1024, 1024, 1, 3328, 1024, 1024, 1024, 1024]
    - [73, 10652.0]
  - - [448, 2368, 1, 1280, 448, 448, 448, 2368]
    - [91, 10390.0]
  - - [64, 6784, 1, 3328, 64, 64, 64, 6784]
    - [75, 9262.0]
  - - [2944, 256, 1, 1280, 2944, 2944, 2944, 256]
    - [92, 10157.0]
  - - [256, 2368, 1, 128, 256, 256, 256, 2368]
    - [92, 8134.0]
  - - [1856, 704, 1, 256, 1856, 1856, 1856, 704]
    - [49, 10735.0]
  - - [1408, 448, 1, 3328, 1408, 1408, 1408, 448]
    - [77, 10775.0]
  - - [2368, 256, 1, 256, 2368, 2368, 2368, 256]
    - [104, 8738.0]
  - - [1856, 448, 1, 1280, 1856, 1856, 1856, 448]
    - [79, 9683.0]
  - - [128, 5888, 1, 128, 128, 128, 128, 5888]
    - [92, 8660.0]
  - - [1024, 1024, 1, 256, 1024, 1024, 1024, 1024]
    - [51, 10046.0]
  - - [704, 1856, 1, 256, 704, 704, 704, 1856]
    - [49, 10755.0]
  - - [128, 4288, 1, 3328, 128, 128, 128, 4288]
    - [57, 9576.0]
  - - [256, 2368, 1, 1280, 256, 256, 256, 2368]
    - [93, 10175.0]
  - - [2944, 448, 1, 256, 2944, 2944, 2944, 448]
    - [71, 10091.0]
  - - [1856, 448, 1, 128, 1856, 1856, 1856, 448]
    - [71, 8460.0]
  - - [2368, 128, 1, 1280, 2368, 2368, 2368, 128]
    - [71, 8680.0]
  - - [64, 6784, 1, 256, 64, 64, 64, 6784]
    - [49, 7827.0]
  - - [64, 5056, 1, 1280, 64, 64, 64, 5056]
    - [91, 9184.0]
  - - [2368, 256, 1, 1280, 2368, 2368, 2368, 256]
    - [93, 10170.0]
  - - [2368, 448, 1, 1280, 2368, 2368, 2368, 448]
    - [73, 10518.0]
  - - [128, 3584, 1, 256, 128, 128, 128, 3584]
    - [51, 8585.0]
  - - [704, 448, 1, 1280, 704, 704, 704, 448]
    - [49, 9096.0]
  - - [128, 5056, 1, 256, 128, 128, 128, 5056]
    - [51, 9014.0]
  - - [4288, 256, 1, 1280, 4288, 4288, 4288, 256]
    - [51, 10779.0]
  - - [4288, 128, 1, 3328, 4288, 4288, 4288, 128]
    - [52, 9579.0]
  - - [1408, 256, 1, 128, 1408, 1408, 1408, 256]
    - [50, 5946.0]
  - - [256, 1408, 1, 1280, 256, 256, 256, 1408]
    - [92, 7825.0]
  - - [128, 2368, 1, 256, 128, 128, 128, 2368]
    - [92, 7211.0]
  - - [6784, 64, 1, 3328, 6784, 6784, 6784, 64]
    - [77, 9525.0]
  - - [128, 2944, 1, 3328, 128, 128, 128, 2944]
    - [55, 8302.0]
  - - [2944, 448, 1, 3328, 2944, 2944, 2944, 448]
    - [91, 10604.0]
  - - [256, 4288, 1, 256, 256, 256, 256, 4288]
    - [106, 10355.0]
  - - [5888, 128, 1, 256, 5888, 5888, 5888, 128]
    - [92, 9476.0]
  - - [2368, 448, 1, 3328, 2368, 2368, 2368, 448]
    - [51, 10736.0]
  - - [5056, 64, 1, 256, 5056, 5056, 5056, 64]
    - [91, 7449.0]
  - - [1024, 704, 1, 128, 1024, 1024, 1024, 704]
    - [51, 8404.0]
  - - [128, 5056, 1, 3328, 128, 128, 128, 5056]
    - [64, 11159.0]
  - - [4288, 128, 1, 256, 4288, 4288, 4288, 128]
    - [49, 7546.0]
  - - [1408, 448, 1, 128, 1408, 1408, 1408, 448]
    - [73, 8376.0]
  - - [128, 5888, 1, 1280, 128, 128, 128, 5888]
    - [51, 10282.0]
  - - [704, 448, 1, 128, 704, 704, 704, 448]
    - [50, 6154.0]
  - - [3584, 256, 1, 256, 3584, 3584, 3584, 256]
    - [98, 10089.0]
  - - [128, 2944, 1, 256, 128, 128, 128, 2944]
    - [51, 7146.0]
  - - [128, 6784, 1, 128, 128, 128, 128, 6784]
    - [49, 8752.0]
  - - [448, 1856, 1, 256, 448, 448, 448, 1856]
    - [49, 9050.0]
  - - [3584, 128, 1, 3328, 3584, 3584, 3584, 128]
    - [96, 10068.0]
  - - [1024, 448, 1, 1280, 1024, 1024, 1024, 448]
    - [55, 9761.0]
  - - [5888, 128, 1, 3328, 5888, 5888, 5888, 128]
    - [77, 10329.0]
  - - [1408, 704, 1, 1280, 1408, 1408, 1408, 704]
    - [92, 9940.0]
  - - [448, 2944, 1, 256, 448, 448, 448, 2944]
    - [49, 10182.0]
  - - [448, 2368, 1, 256, 448, 448, 448, 2368]
    - [49, 9948.0]
  - - [128, 2368, 1, 3328, 128, 128, 128, 2368]
    - [74, 9232.0]
  - - [5056, 128, 1, 1280, 5056, 5056, 5056, 128]
    - [93, 10767.0]
  - - [5056, 64, 1, 3328, 5056, 5056, 5056, 64]
    - [73, 9574.0]
  - - [64, 5888, 1, 128, 64, 64, 64, 5888]
    - [50, 6137.0]
  - - [5056, 128, 1, 3328, 5056, 5056, 5056, 128]
    - [52, 11185.0]
  - - [448, 704, 1, 256, 448, 448, 448, 704]
    - [71, 7340.0]
  - - [2944, 128, 1, 3328, 2944, 2944, 2944, 128]
    - [96, 8357.0]
  - - [128, 5056, 1, 1280, 128, 128, 128, 5056]
    - [74, 10764.0]
  - - [704, 704, 1, 128, 704, 704, 704, 704]
    - [104, 6706.0]
  - - [64, 6784, 1, 1280, 64, 64, 64, 6784]
    - [91, 9016.0]
  - - [2368, 128, 1, 128, 2368, 2368, 2368, 128]
    - [50, 6006.0]
  - - [5056, 128, 1, 128, 5056, 5056, 5056, 128]
    - [49, 8284.0]
  - - [1024, 1024, 1, 1024, 1024, 1024, 1024, 1024]
    - [51, 10504.0]
  - - [448, 1024, 1, 3328, 448, 448, 448, 1024]
    - [49, 9795.0]
  - - [256, 2368, 1, 3328, 256, 256, 256, 2368]
    - [93, 10538.0]
  - - [256, 3584, 1, 128, 256, 256, 256, 3584]
    - [92, 9321.0]
  - - [4288, 256, 1, 128, 4288, 4288, 4288, 256]
    - [49, 9559.0]
  - - [2368, 256, 1, 128, 2368, 2368, 2368, 256]
    - [49, 8100.0]
  - - [256, 1856, 1, 256, 256, 256, 256, 1856]
    - [109, 8286.0]
  - - [256, 2944, 1, 128, 256, 256, 256, 2944]
    - [73, 8722.0]
  - - [1408, 256, 1, 3328, 1408, 1408, 1408, 256]
    - [73, 8013.0]
  - - [2368, 448, 1, 256, 2368, 2368, 2368, 448]
    - [49, 9583.0]
  - - [4288, 256, 1, 3328, 4288, 4288, 4288, 256]
    - [51, 11062.0]
  - - [1856, 704, 1, 128, 1856, 1856, 1856, 704]
    - [104, 10087.0]
  - - [4288, 128, 1, 128, 4288, 4288, 4288, 128]
    - [49, 7380.0]
  - - [1408, 448, 1, 256, 1408, 1408, 1408, 448]
    - [51, 9533.0]
  - - [6784, 64, 1, 1280, 6784, 6784, 6784, 64]
    - [55, 9259.0]
  - - [3584, 128, 1, 128, 3584, 3584, 3584, 128]
    - [49, 6129.0]
  - - [256, 2368, 1, 256, 256, 256, 256, 2368]
    - [92, 9226.0]
  - - [2944, 448, 1, 1280, 2944, 2944, 2944, 448]
    - [91, 10571.0]
  - - [448, 1856, 1, 1280, 448, 448, 448, 1856]
    - [57, 9754.0]
  - - [1856, 256, 1, 128, 1856, 1856, 1856, 256]
    - [50, 6362.0]
  - - [5056, 128, 1, 256, 5056, 5056, 5056, 128]
    - [51, 9424.0]
  - - [448, 1024, 1, 256, 448, 448, 448, 1024]
    - [91, 8473.0]
  - - [64, 6784, 1, 128, 64, 64, 64, 6784]
    - [49, 6696.0]
  - - [5888, 64, 1, 1280, 5888, 5888, 5888, 64]
    - [51, 8104.0]
  - - [128, 3584, 1, 128, 128, 128, 128, 3584]
    - [92, 7161.0]
  - - [1408, 256, 1, 256, 1408, 1408, 1408, 256]
    - [49, 6825.0]
  - - [128, 5888, 1, 3328, 128, 128, 128, 5888]
    - [63, 10382.0]
  - - [1408, 256, 1, 1280, 1408, 1408, 1408, 256]
    - [73, 7812.0]
  - - [64, 5056, 1, 128, 64, 64, 64, 5056]
    - [50, 6200.0]
  - - [5888, 64, 1, 128, 5888, 5888, 5888, 64]
    - [92, 6090.0]
  - - [448, 704, 1, 128, 448, 448, 448, 704]
    - [50, 6098.0]
  - - [1408, 704, 1, 128, 1408, 1408, 1408, 704]
    - [51, 9089.0]
  - - [2368, 256, 1, 3328, 2368, 2368, 2368, 256]
    - [111, 10474.0]
  - - [5888, 128, 1, 1280, 5888, 5888, 5888, 128]
    - [92, 10285.0]
  - - [256, 3584, 1, 1280, 256, 256, 256, 3584]
    - [79, 10968.0]
  - - [256, 1408, 1, 128, 256, 256, 256, 1408]
    - [94, 5961.0]
  - - [256, 4288, 1, 128, 256, 256, 256, 4288]
    - [92, 9704.0]
  - - [5888, 128, 1, 128, 5888, 5888, 5888, 128]
    - [51, 8644.0]
  - - [1856, 256, 1, 3328, 1856, 1856, 1856, 256]
    - [51, 10320.0]
  - - [64, 5888, 1, 1280, 64, 64, 64, 5888]
    - [91, 7920.0]
  - - [6784, 64, 1, 128, 6784, 6784, 6784, 64]
    - [73, 6777.0]
  - - [704, 704, 1, 1280, 704, 704, 704, 704]
    - [92, 8338.0]
  - - [128, 2368, 1, 1280, 128, 128, 128, 2368]
    - [92, 8907.0]
  - - [3584, 256, 1, 1280, 3584, 3584, 3584, 256]
    - [98, 10972.0]
  - - [3584, 128, 1, 1280, 3584, 3584, 3584, 128]
    - [73, 9757.0]
  - - [448, 1856, 1, 3328, 448, 448, 448, 1856]
    - [57, 9994.0]
  - - [1024, 448, 1, 256, 1024, 1024, 1024, 448]
    - [86, 8461.0]
  - - [2944, 128, 1, 1280, 2944, 2944, 2944, 128]
    - [92, 8137.0]
  - - [128, 2368, 1, 128, 128, 128, 128, 2368]
    - [50, 5932.0]
  - - [256, 2944, 1, 1280, 256, 256, 256, 2944]
    - [51, 10293.0]
  - - [704, 1024, 1, 3328, 704, 704, 704, 1024]
    - [92, 9924.0]
  - - [128, 6784, 1, 256, 128, 128, 128, 6784]
    - [73, 9508.0]
  - - [256, 1856, 1, 3328, 256, 256, 256, 1856]
    - [55, 10441.0]
  - - [6784, 128, 1, 128, 6784, 6784, 6784, 128]
    - [73, 8752.0]
  - - [704, 1408, 1, 256, 704, 704, 704, 1408]
    - [91, 9455.0]
  - - [256, 1408, 1, 256, 256, 256, 256, 1408]
    - [51, 6886.0]
  - - [448, 2944, 1, 1280, 448, 448, 448, 2944]
    - [71, 10555.0]
  - - [6784, 128, 1, 1280, 6784, 6784, 6784, 128]
    - [110, 10370.0]
  - - [1856, 448, 1, 256, 1856, 1856, 1856, 448]
    - [71, 9043.0]
  - - [128, 4288, 1, 1280, 128, 128, 128, 4288]
    - [74, 9256.0]
  - - [448, 704, 1, 3328, 448, 448, 448, 704]
    - [49, 9338.0]
  - - [1856, 704, 1, 3328, 1856, 1856, 1856, 704]
    - [91, 11195.0]
  - - [3136, 64, 128, 64, 3136, 3136, 3136, 64]
    - [47, 6085.0]
  - - [3136, 64, 128, 256, 3136, 3136, 3136, 64]
    - [92, 8839.0]
  - - [3136, 64, 256, 256, 3136, 3136, 3136, 64]
    - [73, 8787.0]
  - - [3136, 64, 256, 64, 3136, 3136, 3136, 64]
    - [49, 5669.0]
  - - [64, 1536, 64, 384, 64, 64, 64, 1536]
    - [91, 9742.0]
  - - [64, 1536, 64, 256, 64, 64, 64, 1536]
    - [91, 9892.0]
  - - [64, 92, 688, 92, 64, 64, 64, 92]
    - [71, 7209.0]
  - - [1024, 1024, 1, 3975, 1024, 1024, 1024, 1024]
    - [92, 10665.0]
  - - [64, 123, 528, 123, 64, 64, 64, 123]
    - [91, 9222.0]
  - - [64, 102, 624, 100, 64, 64, 64, 102]
    - [71, 7825.0]
  - - [64, 112, 576, 111, 64, 64, 64, 112]
    - [91, 8468.0]
  - - [64, 102, 624, 102, 64, 64, 64, 102]
    - [49, 7960.0]
  - - [64, 133, 480, 135, 64, 64, 64, 133]
    - [71, 7612.0]
  - - [1024, 1024, 1, 4026, 1024, 1024, 1024, 1024]
    - [92, 10646.0]
  - - [64, 160, 400, 159, 64, 64, 64, 160]
    - [91, 9088.0]
  - - [1024, 1024, 1, 3780, 1024, 1024, 1024, 1024]
    - [92, 10650.0]
  - - [64, 228, 272, 232, 64, 64, 64, 228]
    - [49, 9838.0]
  - - [1024, 1024, 1, 3822, 1024, 1024, 1024, 1024]
    - [86, 10651.0]
  - - [64, 77, 816, 77, 64, 64, 64, 77]
    - [91, 6218.0]
  - - [64, 159, 400, 159, 64, 64, 64, 159]
    - [91, 8981.0]
  - - [64, 135, 480, 134, 64, 64, 64, 135]
    - [91, 7693.0]
  - - [64, 99, 624, 99, 64, 64, 64, 99]
    - [91, 7568.0]
  - - [1024, 1024, 1, 3942, 1024, 1024, 1024, 1024]
    - [73, 10674.0]
  - - [1024, 1024, 1, 3861, 1024, 1024, 1024, 1024]
    - [73, 10652.0]
  - - [1024, 1024, 1, 4000, 1024, 1024, 1024, 1024]
    - [92, 10669.0]
  - - [1024, 1024, 1, 3870, 1024, 1024, 1024, 1024]
    - [92, 10636.0]
  - - [64, 65, 992, 65, 64, 64, 64, 65]
    - [104, 5147.0]
  - - [64, 133, 480, 133, 64, 64, 64, 133]
    - [91, 7562.0]
  - - [64, 232, 272, 232, 64, 64, 64, 232]
    - [71, 10010.0]
  - - [64, 148, 432, 148, 64, 64, 64, 148]
    - [49, 8344.0]
  - - [1024, 1024, 1, 4032, 1024, 1024, 1024, 1024]
    - [73, 10698.0]
  - - [1024, 1024, 1, 4012, 1024, 1024, 1024, 1024]
    - [92, 10652.0]
  - - [1024, 1024, 1, 3681, 1024, 1024, 1024, 1024]
    - [92, 10647.0]
  - - [1024, 1024, 1, 3927, 1024, 1024, 1024, 1024]
    - [92, 10655.0]
  - - [1024, 1024, 1, 3894, 1024, 1024, 1024, 1024]
    - [92, 10656.0]
  - - [64, 132, 480, 135, 64, 64, 64, 132]
    - [91, 7444.0]
  - - [64, 135, 480, 135, 64, 64, 64, 135]
    - [49, 7699.0]
  - - [1024, 1024, 1, 3876, 1024, 1024, 1024, 1024]
    - [73, 10680.0]
  - - [64, 84, 752, 85, 64, 64, 64, 84]
    - [91, 6639.0]
  - - [1024, 1024, 1, 4050, 1024, 1024, 1024, 1024]
    - [92, 10693.0]
  - - [64, 132, 480, 132, 64, 64, 64, 132]
    - [49, 7476.0]
  - - [64, 99, 624, 102, 64, 64, 64, 99]
    - [71, 7797.0]
  - - [64, 143, 432, 148, 64, 64, 64, 143]
    - [49, 8195.0]
  - - [1024, 1024, 1, 3584, 1024, 1024, 1024, 1024]
    - [92, 10655.0]
  - - [64, 162, 400, 162, 64, 64, 64, 162]
    - [71, 9148.0]
  - - [64, 148, 432, 147, 64, 64, 64, 148]
    - [49, 8368.0]
  - - [1024, 1024, 1, 3960, 1024, 1024, 1024, 1024]
    - [73, 10687.0]
  - - [64, 123, 528, 122, 64, 64, 64, 123]
    - [91, 9193.0]
  - - [64, 102, 624, 101, 64, 64, 64, 102]
    - [71, 7912.0]
  - - [1024, 1024, 1, 3978, 1024, 1024, 1024, 1024]
    - [92, 10661.0]
  - - [64, 160, 400, 160, 64, 64, 64, 160]
    - [71, 9080.0]
  - - [1024, 1024, 1, 3995, 1024, 1024, 1024, 1024]
    - [106, 10662.0]
  - - [64, 132, 480, 134, 64, 64, 64, 132]
    - [49, 7448.0]
  - - [64, 111, 576, 111, 64, 64, 64, 111]
    - [91, 8480.0]
  - - [64, 100, 624, 100, 64, 64, 64, 100]
    - [91, 7877.0]
  - - [1024, 1024, 1, 3977, 1024, 1024, 1024, 1024]
    - [92, 10651.0]
  - - [64, 112, 576, 112, 64, 64, 64, 112]
    - [71, 8712.0]
  - - [64, 159, 400, 162, 64, 64, 64, 159]
    - [91, 8837.0]
  - - [64, 122, 528, 122, 64, 64, 64, 122]
    - [71, 9235.0]
  - - [64, 228, 272, 228, 64, 64, 64, 228]
    - [49, 9836.0]
  - - [1024, 1024, 1, 3925, 1024, 1024, 1024, 1024]
    - [92, 10659.0]
  - - [64, 93, 688, 93, 64, 64, 64, 93]
    - [91, 7429.0]
  - - [1024, 1024, 1, 3956, 1024, 1024, 1024, 1024]
    - [73, 10675.0]
  - - [1024, 1024, 1, 3976, 1024, 1024, 1024, 1024]
    - [92, 10679.0]
  - - [64, 111, 576, 112, 64, 64, 64, 111]
    - [49, 8465.0]
  - - [64, 100, 624, 102, 64, 64, 64, 100]
    - [71, 7828.0]
  - - [1024, 1024, 1, 3955, 1024, 1024, 1024, 1024]
    - [73, 10658.0]
  - - [1024, 1024, 1, 4030, 1024, 1024, 1024, 1024]
    - [73, 10656.0]
  - - [1024, 1024, 1, 3906, 1024, 1024, 1024, 1024]
    - [92, 10666.0]
  - - [64, 101, 624, 102, 64, 64, 64, 101]
    - [91, 7810.0]
  - - [1024, 1024, 1, 3796, 1024, 1024, 1024, 1024]
    - [92, 10655.0]
  - - [1024, 1024, 1, 3859, 1024, 1024, 1024, 1024]
    - [92, 10660.0]
  - - [64, 71, 896, 71, 64, 64, 64, 71]
    - [71, 5749.0]
  - - [1024, 1024, 1, 3860, 1024, 1024, 1024, 1024]
    - [92, 10661.0]
  - - [1024, 1024, 1, 4005, 1024, 1024, 1024, 1024]
    - [92, 10700.0]
  - - [64, 84, 752, 84, 64, 64, 64, 84]
    - [91, 6688.0]
  - - [1024, 1024, 1, 3990, 1024, 1024, 1024, 1024]
    - [92, 10719.0]
  - - [64, 134, 480, 134, 64, 64, 64, 134]
    - [71, 7632.0]
  - - [64, 78, 816, 78, 64, 64, 64, 78]
    - [71, 6322.0]
  - - [1024, 1024, 1, 3999, 1024, 1024, 1024, 1024]
    - [51, 10693.0]
  - - [1024, 1024, 1, 4020, 1024, 1024, 1024, 1024]
    - [92, 10660.0]
  - - [1024, 1024, 1, 3939, 1024, 1024, 1024, 1024]
    - [92, 10655.0]
  - - [64, 77, 816, 78, 64, 64, 64, 77]
    - [91, 6216.0]
  - - [1024, 1024, 1, 4059, 1024, 1024, 1024, 1024]
    - [73, 10662.0]
  - - [1024, 1024, 1, 3944, 1024, 1024, 1024, 1024]
    - [92, 10649.0]
  - - [64, 193, 320, 193, 64, 64, 64, 193]
    - [61, 8374.0]
  - - [1024, 1024, 1, 3720, 1024, 1024, 1024, 1024]
    - [73, 10693.0]
  - - [1024, 1024, 1, 3910, 1024, 1024, 1024, 1024]
    - [92, 10671.0]
  - - [64, 143, 432, 143, 64, 64, 64, 143]
    - [91, 8081.0]
  - - [64, 92, 688, 93, 64, 64, 64, 92]
    - [49, 7298.0]
  - - [64, 101, 624, 101, 64, 64, 64, 101]
    - [91, 7859.0]
  - - [1024, 1024, 1, 3969, 1024, 1024, 1024, 1024]
    - [63, 10660.0]
  - - [1024, 1024, 1, 3948, 1024, 1024, 1024, 1024]
    - [73, 10660.0]
  - - [1024, 1024, 1, 3996, 1024, 1024, 1024, 1024]
    - [92, 10648.0]
  - - [1024, 1024, 1, 3900, 1024, 1024, 1024, 1024]
    - [92, 10668.0]
  - - [1024, 1024, 1, 3640, 1024, 1024, 1024, 1024]
    - [73, 10671.0]
  - - [64, 147, 432, 147, 64, 64, 64, 147]
    - [71, 8382.0]
  - - [1024, 1024, 1, 3751, 1024, 1024, 1024, 1024]
    - [73, 10652.0]
  - - [64, 177, 352, 177, 64, 64, 64, 177]
    - [91, 9827.0]
  - - [64, 85, 752, 85, 64, 64, 64, 85]
    - [71, 6877.0]
  - - [1024, 1024, 1, 3712, 1024, 1024, 1024, 1024]
    - [73, 10659.0]
  - - [1024, 1024, 1, 128, 1024, 1024, 1024, 1024]
    - [91, 8960.0]
  - - [64, 256, 192, 256, 64, 64, 64, 256]
    - [71, 11225.0]
  - - [64, 128, 384, 128, 64, 64, 64, 128]
    - [49, 10807.0]
  - - [64, 192, 36, 25088, 64, 64, 64, 192]
    - [65, 8530.0]
  - - [128, 128, 64, 25, 128, 128, 128, 128]
    - [90, 3651.0]
  - - [64, 192, 64, 3200, 64, 64, 64, 192]
    - [61, 8990.0]
  - - [64, 128, 64, 23104, 64, 64, 64, 128]
    - [49, 7423.0]
  - - [128, 128, 64, 1600, 128, 128, 128, 128]
    - [66, 10372.0]
  - - [80, 192, 64, 4608, 80, 80, 80, 192]
    - [77, 7054.0]
  - - [64, 128, 36, 30, 64, 64, 64, 128]
    - [101, 2404.0]
  - - [64, 128, 64, 11552, 64, 64, 64, 128]
    - [84, 7404.0]
  - - [128, 192, 64, 946, 128, 128, 128, 192]
    - [51, 11073.0]
  - - [64, 192, 64, 12800, 64, 64, 64, 192]
    - [104, 8857.0]
  - - [224, 224, 64, 128, 224, 224, 224, 224]
    - [71, 8069.0]
  - - [128, 128, 64, 3360, 128, 128, 128, 128]
    - [96, 10397.0]
  - - [128, 128, 64, 420, 128, 128, 128, 128]
    - [92, 9932.0]
  - - [64, 128, 64, 361, 64, 64, 64, 128]
    - [91, 7906.0]
  - - [64, 128, 36, 53824, 64, 64, 64, 128]
    - [108, 7850.0]
  - - [128, 160, 36, 512, 128, 128, 128, 160]
    - [51, 8042.0]
  - - [147, 64, 36, 18816, 147, 147, 147, 64]
    - [75, 7310.0]
  - - [96, 128, 64, 946, 96, 96, 96, 128]
    - [92, 7670.0]
  - - [128, 128, 64, 50, 128, 128, 128, 128]
    - [49, 6242.0]
  - - [160, 224, 36, 128, 160, 160, 160, 224]
    - [49, 6802.0]
  - - [192, 224, 64, 1152, 192, 192, 192, 224]
    - [84, 9913.0]
  - - [128, 128, 36, 784, 128, 128, 128, 128]
    - [74, 9606.0]
  - - [96, 128, 64, 288, 96, 96, 96, 128]
    - [106, 7056.0]
  - - [128, 128, 64, 400, 128, 128, 128, 128]
    - [51, 10210.0]
  - - [128, 128, 64, 800, 128, 128, 128, 128]
    - [73, 10441.0]
  - - [96, 128, 36, 512, 96, 96, 96, 128]
    - [86, 6814.0]
  - - [96, 128, 64, 800, 96, 96, 96, 128]
    - [73, 7737.0]
  - - [192, 224, 64, 128, 192, 192, 192, 224]
    - [49, 9113.0]
  - - [128, 128, 64, 288, 128, 128, 128, 128]
    - [92, 10013.0]
  - - [96, 208, 36, 512, 96, 96, 96, 208]
    - [57, 6232.0]
  - - [64, 128, 36, 1568, 64, 64, 64, 128]
    - [91, 8454.0]
  - - [192, 192, 36, 512, 192, 192, 192, 192]
    - [49, 10386.0]
  - - [128, 128, 36, 512, 128, 128, 128, 128]
    - [93, 9587.0]
  - - [96, 208, 64, 1152, 96, 96, 96, 208]
    - [51, 6967.0]
  - - [128, 192, 64, 3200, 128, 128, 128, 192]
    - [55, 11247.0]
  - - [160, 160, 64, 288, 160, 160, 160, 160]
    - [49, 7224.0]
  - - [128, 128, 36, 440, 128, 128, 128, 128]
    - [74, 9465.0]
  - - [96, 128, 36, 1568, 96, 96, 96, 128]
    - [52, 7417.0]
  - - [112, 224, 36, 2048, 112, 112, 112, 224]
    - [88, 8180.0]
  - - [128, 128, 36, 7040, 128, 128, 128, 128]
    - [111, 10395.0]
  - - [128, 128, 36, 1568, 128, 128, 128, 128]
    - [74, 10018.0]
  - - [160, 224, 64, 128, 160, 160, 160, 224]
    - [104, 7513.0]
  - - [192, 224, 36, 2592, 192, 192, 192, 224]
    - [91, 9747.0]
  - - [64, 128, 64, 2888, 64, 64, 64, 128]
    - [87, 8330.0]
  - - [64, 128, 36, 480, 64, 64, 64, 128]
    - [71, 7085.0]
  - - [147, 64, 64, 9702, 147, 147, 147, 64]
    - [104, 7617.0]
  - - [64, 192, 64, 3698, 64, 64, 64, 192]
    - [84, 8918.0]
  - - [73, 192, 64, 10439, 73, 73, 73, 192]
    - [77, 6485.0]
  - - [128, 128, 36, 880, 128, 128, 128, 128]
    - [93, 9687.0]
  - - [192, 224, 36, 128, 192, 192, 192, 224]
    - [61, 8063.0]
  - - [64, 128, 36, 12544, 64, 64, 64, 128]
    - [65, 7850.0]
  - - [160, 160, 36, 512, 160, 160, 160, 160]
    - [91, 7066.0]
  - - [128, 128, 36, 3136, 128, 128, 128, 128]
    - [57, 10225.0]
  - - [112, 224, 36, 512, 112, 112, 112, 224]
    - [51, 7674.0]
  - - [128, 128, 36, 49, 128, 128, 128, 128]
    - [69, 4327.0]
  - - [112, 224, 64, 1152, 112, 112, 112, 224]
    - [63, 8763.0]
  - - [128, 192, 36, 1568, 128, 128, 128, 192]
    - [73, 10241.0]
  - - [128, 192, 36, 512, 128, 128, 128, 192]
    - [73, 9796.0]
  - - [192, 192, 64, 288, 192, 192, 192, 192]
    - [71, 10984.0]
  - - [96, 208, 64, 242, 96, 96, 96, 208]
    - [51, 6561.0]
  - - [64, 128, 64, 5776, 64, 64, 64, 128]
    - [104, 7397.0]
  - - [128, 192, 64, 288, 128, 128, 128, 192]
    - [51, 10539.0]
  - - [96, 128, 36, 6272, 96, 96, 96, 128]
    - [111, 7747.0]
  - - [96, 128, 64, 3200, 96, 96, 96, 128]
    - [55, 7855.0]
  - - [128, 192, 64, 800, 128, 128, 128, 192]
    - [92, 10978.0]
  - - [64, 128, 64, 10, 64, 64, 64, 128]
    - [97, 1618.0]
  - - [96, 208, 64, 288, 96, 96, 96, 208]
    - [73, 6694.0]
  - - [64, 128, 64, 160, 64, 64, 64, 128]
    - [49, 7219.0]
  - - [128, 128, 64, 1568, 128, 128, 128, 128]
    - [109, 10354.0]
  - - [112, 224, 64, 242, 112, 112, 112, 224]
    - [91, 7891.0]
  - - [160, 192, 64, 288, 160, 160, 160, 192]
    - [49, 8937.0]
  - - [128, 160, 64, 288, 128, 128, 128, 160]
    - [51, 8861.0]
  - - [128, 128, 64, 210, 128, 128, 128, 128]
    - [92, 9283.0]
  - - [73, 192, 36, 23360, 73, 73, 73, 192]
    - [96, 5968.0]
  - - [160, 192, 36, 512, 160, 160, 160, 192]
    - [49, 8320.0]
  - - [64, 128, 64, 722, 64, 64, 64, 128]
    - [95, 8312.0]
  - - [112, 224, 64, 288, 112, 112, 112, 224]
    - [91, 8240.0]
  - - [64, 192, 36, 6272, 64, 64, 64, 192]
    - [75, 8679.0]
  - - [64, 128, 36, 6272, 64, 64, 64, 128]
    - [99, 8310.0]
  - - [128, 128, 36, 3200, 128, 128, 128, 128]
    - [88, 10213.0]
  - - [128, 128, 36, 392, 128, 128, 128, 128]
    - [74, 8900.0]
  - - [80, 192, 36, 10368, 80, 80, 80, 192]
    - [77, 6513.0]
  - - [224, 224, 36, 128, 224, 224, 224, 224]
    - [49, 7631.0]
  - - [64, 128, 36, 784, 64, 64, 64, 128]
    - [71, 8090.0]
  - - [128, 128, 64, 200, 128, 128, 128, 128]
    - [51, 9691.0]
  - - [5329, 64, 32, 80, 5329, 5329, 5329, 64]
    - [51, 10668.0]
  - - [64, 2048, 32, 384, 64, 64, 64, 2048]
    - [91, 11155.0]
  - - [289, 1792, 1, 320, 289, 289, 289, 1792]
    - [49, 7218.0]
  - - [1001, 1024, 1, 32, 1001, 1001, 1001, 1024]
    - [70, 4955.0]
  - - [784, 400, 1, 32, 784, 784, 784, 400]
    - [60, 2987.0]
  - - [64, 1536, 32, 256, 64, 64, 64, 1536]
    - [104, 11222.0]
  - - [289, 2592, 1, 384, 289, 289, 289, 2592]
    - [49, 7973.0]
  - - [64, 2048, 32, 448, 64, 64, 64, 2048]
    - [61, 10613.0]
  - - [289, 2016, 1, 256, 289, 289, 289, 2016]
    - [49, 7610.0]
  - - [64, 1536, 32, 384, 64, 64, 64, 1536]
    - [71, 11268.0]
  - - [64, 1280, 32, 320, 64, 64, 64, 1280]
    - [49, 11087.0]
  - - [289, 3456, 1, 384, 289, 289, 289, 3456]
    - [49, 9260.0]
  - - [64, 1280, 32, 384, 64, 64, 64, 1280]
    - [71, 11072.0]
  - - [729, 1600, 1, 192, 729, 729, 729, 1600]
    - [106, 9339.0]
  - - [289, 1344, 1, 192, 289, 289, 289, 1344]
    - [49, 6396.0]
  - - [64, 2048, 32, 320, 64, 64, 64, 2048]
    - [71, 11357.0]
  - - [64, 1280, 32, 448, 64, 64, 64, 1280]
    - [49, 11164.0]
  - - [64, 1280, 32, 192, 64, 64, 64, 1280]
    - [49, 10654.0]
  - - [289, 1792, 1, 256, 289, 289, 289, 1792]
    - [71, 7448.0]
  - - [64, 2048, 32, 192, 64, 64, 64, 2048]
    - [49, 11132.0]
  - - [5329, 64, 128, 80, 5329, 5329, 5329, 64]
    - [47, 5886.0]
  - - [64, 1280, 128, 448, 64, 64, 64, 1280]
    - [71, 9664.0]
  - - [64, 2048, 128, 192, 64, 64, 64, 2048]
    - [61, 8299.0]
  - - [64, 1280, 128, 384, 64, 64, 64, 1280]
    - [61, 9391.0]
  - - [64, 1280, 128, 320, 64, 64, 64, 1280]
    - [104, 9507.0]
  - - [64, 1280, 128, 192, 64, 64, 64, 1280]
    - [61, 8134.0]
  - - [256, 4096, 1, 6400, 256, 256, 256, 4096]
    - [92, 10681.0]
  - - [512, 2048, 1, 3427, 512, 512, 512, 2048]
    - [92, 10631.0]
  - - [512, 2048, 1, 3552, 512, 512, 512, 2048]
    - [106, 10646.0]
  - - [512, 2048, 1, 3840, 512, 512, 512, 2048]
    - [92, 10670.0]
  - - [2048, 512, 1, 3427, 2048, 2048, 2048, 512]
    - [73, 10664.0]
  - - [2048, 512, 1, 3452, 2048, 2048, 2048, 512]
    - [92, 10626.0]
  - - [2048, 512, 1, 3472, 2048, 2048, 2048, 512]
    - [55, 10633.0]
  - - [2048, 512, 1, 3475, 2048, 2048, 2048, 512]
    - [106, 10625.0]
  - - [64, 64, 496, 64, 64, 64, 64, 64]
    - [105, 7128.0]
  - - [64, 64, 496, 65, 64, 64, 64, 64]
    - [91, 7419.0]
  - - [64, 65, 496, 65, 64, 64, 64, 65]
    - [49, 4924.0]
  - - [64, 71, 448, 71, 64, 64, 64, 71]
    - [49, 5298.0]
  - - [64, 77, 408, 77, 64, 64, 64, 77]
    - [71, 5721.0]
  - - [64, 77, 408, 78, 64, 64, 64, 77]
    - [49, 5804.0]
  - - [64, 78, 408, 78, 64, 64, 64, 78]
    - [49, 5773.0]
  - - [64, 85, 376, 85, 64, 64, 64, 85]
    - [71, 6071.0]
  - - [64, 93, 344, 93, 64, 64, 64, 93]
    - [91, 6677.0]
  - - [64, 112, 288, 112, 64, 64, 64, 112]
    - [49, 7881.0]
  - - [64, 122, 264, 122, 64, 64, 64, 122]
    - [91, 8311.0]
  - - [64, 123, 264, 122, 64, 64, 64, 123]
    - [49, 7998.0]
  - - [64, 123, 264, 123, 64, 64, 64, 123]
    - [49, 8375.0]
  - - [64, 134, 240, 134, 64, 64, 64, 134]
    - [91, 7105.0]
  - - [64, 135, 240, 134, 64, 64, 64, 135]
    - [49, 7154.0]
  - - [64, 135, 240, 135, 64, 64, 64, 135]
    - [49, 7200.0]
  - - [64, 1280, 64, 192, 64, 64, 64, 1280]
    - [71, 11333.0]
  - - [64, 1280, 64, 320, 64, 64, 64, 1280]
    - [49, 10719.0]
  - - [64, 1280, 64, 384, 64, 64, 64, 1280]
    - [71, 9894.0]
  - - [64, 1280, 64, 448, 64, 64, 64, 1280]
    - [49, 9790.0]
  - - [64, 2048, 64, 192, 64, 64, 64, 2048]
    - [61, 9048.0]
  - - [64, 2048, 64, 320, 64, 64, 64, 2048]
    - [61, 9510.0]
  - - [64, 2048, 64, 384, 64, 64, 64, 2048]
    - [49, 10092.0]
  - - [64, 2048, 64, 448, 64, 64, 64, 2048]
    - [71, 9991.0]
  - - [3136, 64, 64, 64, 3136, 3136, 3136, 64]
    - [61, 10425.0]
  - - [3136, 64, 64, 256, 3136, 3136, 3136, 64]
    - [55, 8927.0]
  - - [5329, 64, 64, 80, 5329, 5329, 5329, 64]
    - [47, 5999.0]
  - - [257, 4096, 1, 1024, 257, 257, 257, 4096]
    - [49, 8914.0]
  - - [512, 2048, 1, 2790, 512, 512, 512, 2048]
    - [92, 10653.0]
  - - [512, 2048, 1, 2864, 512, 512, 512, 2048]
    - [51, 10645.0]
  - - [512, 2048, 1, 3092, 512, 512, 512, 2048]
    - [92, 10636.0]
  - - [512, 2048, 1, 3113, 512, 512, 512, 2048]
    - [92, 10663.0]
  - - [512, 2048, 1, 3137, 512, 512, 512, 2048]
    - [92, 10628.0]
  - - [512, 2048, 1, 3165, 512, 512, 512, 2048]
    - [73, 10621.0]
  - - [512, 2048, 1, 3166, 512, 512, 512, 2048]
    - [63, 10632.0]
  - - [512, 2048, 1, 3194, 512, 512, 512, 2048]
    - [92, 10636.0]
  - - [512, 2048, 1, 3219, 512, 512, 512, 2048]
    - [92, 10681.0]
  - - [512, 2048, 1, 3222, 512, 512, 512, 2048]
    - [92, 10646.0]
  - - [512, 2048, 1, 3234, 512, 512, 512, 2048]
    - [92, 10630.0]
  - - [512, 2048, 1, 3237, 512, 512, 512, 2048]
    - [51, 10638.0]
  - - [512, 2048, 1, 3242, 512, 512, 512, 2048]
    - [92, 10633.0]
  - - [512, 2048, 1, 3246, 512, 512, 512, 2048]
    - [92, 10642.0]
  - - [512, 2048, 1, 3249, 512, 512, 512, 2048]
    - [86, 10604.0]
  - - [512, 2048, 1, 3251, 512, 512, 512, 2048]
    - [92, 10644.0]
  - - [512, 2048, 1, 3257, 512, 512, 512, 2048]
    - [92, 10645.0]
  - - [512, 2048, 1, 3262, 512, 512, 512, 2048]
    - [92, 10660.0]
  - - [512, 2048, 1, 3268, 512, 512, 512, 2048]
    - [63, 10667.0]
  - - [512, 2048, 1, 3282, 512, 512, 512, 2048]
    - [92, 10690.0]
  - - [512, 2048, 1, 3286, 512, 512, 512, 2048]
    - [73, 10646.0]
  - - [512, 2048, 1, 3287, 512, 512, 512, 2048]
    - [92, 10657.0]
  - - [512, 2048, 1, 3293, 512, 512, 512, 2048]
    - [106, 10642.0]
  - - [512, 2048, 1, 3297, 512, 512, 512, 2048]
    - [92, 10652.0]
  - - [512, 2048, 1, 3307, 512, 512, 512, 2048]
    - [92, 10627.0]
  - - [512, 2048, 1, 3314, 512, 512, 512, 2048]
    - [73, 10638.0]
  - - [512, 2048, 1, 3315, 512, 512, 512, 2048]
    - [92, 10638.0]
  - - [512, 2048, 1, 3319, 512, 512, 512, 2048]
    - [92, 10681.0]
  - - [512, 2048, 1, 3322, 512, 512, 512, 2048]
    - [92, 10651.0]
  - - [512, 2048, 1, 3323, 512, 512, 512, 2048]
    - [73, 10643.0]
  - - [512, 2048, 1, 3324, 512, 512, 512, 2048]
    - [92, 10653.0]
  - - [512, 2048, 1, 3325, 512, 512, 512, 2048]
    - [92, 10637.0]
  - - [512, 2048, 1, 3327, 512, 512, 512, 2048]
    - [73, 10677.0]
  - - [512, 2048, 1, 3329, 512, 512, 512, 2048]
    - [92, 10649.0]
  - - [512, 2048, 1, 3332, 512, 512, 512, 2048]
    - [92, 10670.0]
  - - [512, 2048, 1, 3336, 512, 512, 512, 2048]
    - [106, 10658.0]
  - - [512, 2048, 1, 3339, 512, 512, 512, 2048]
    - [106, 10635.0]
  - - [512, 2048, 1, 3342, 512, 512, 512, 2048]
    - [51, 10635.0]
  - - [512, 2048, 1, 3344, 512, 512, 512, 2048]
    - [63, 10648.0]
  - - [512, 2048, 1, 3358, 512, 512, 512, 2048]
    - [92, 10645.0]
  - - [512, 2048, 1, 3360, 512, 512, 512, 2048]
    - [86, 10626.0]
  - - [512, 2048, 1, 3364, 512, 512, 512, 2048]
    - [92, 10656.0]
  - - [512, 2048, 1, 3365, 512, 512, 512, 2048]
    - [92, 10640.0]
  - - [512, 2048, 1, 3369, 512, 512, 512, 2048]
    - [92, 10631.0]
  - - [512, 2048, 1, 3371, 512, 512, 512, 2048]
    - [51, 10645.0]
  - - [512, 2048, 1, 3374, 512, 512, 512, 2048]
    - [92, 10645.0]
  - - [512, 2048, 1, 3376, 512, 512, 512, 2048]
    - [73, 10645.0]
  - - [512, 2048, 1, 3377, 512, 512, 512, 2048]
    - [92, 10654.0]
  - - [512, 2048, 1, 3378, 512, 512, 512, 2048]
    - [92, 10675.0]
  - - [512, 2048, 1, 3381, 512, 512, 512, 2048]
    - [92, 10656.0]
  - - [512, 2048, 1, 3382, 512, 512, 512, 2048]
    - [73, 10654.0]
  - - [512, 2048, 1, 3383, 512, 512, 512, 2048]
    - [73, 10655.0]
  - - [512, 2048, 1, 3384, 512, 512, 512, 2048]
    - [92, 10647.0]
  - - [512, 2048, 1, 3385, 512, 512, 512, 2048]
    - [63, 10632.0]
  - - [512, 2048, 1, 3386, 512, 512, 512, 2048]
    - [51, 10635.0]
  - - [512, 2048, 1, 3388, 512, 512, 512, 2048]
    - [86, 10630.0]
  - - [512, 2048, 1, 3390, 512, 512, 512, 2048]
    - [92, 10675.0]
  - - [512, 2048, 1, 3391, 512, 512, 512, 2048]
    - [106, 10655.0]
  - - [512, 2048, 1, 3396, 512, 512, 512, 2048]
    - [92, 10644.0]
  - - [512, 2048, 1, 3399, 512, 512, 512, 2048]
    - [51, 10640.0]
  - - [512, 2048, 1, 3402, 512, 512, 512, 2048]
    - [92, 10633.0]
  - - [512, 2048, 1, 3410, 512, 512, 512, 2048]
    - [92, 10643.0]
  - - [512, 2048, 1, 3412, 512, 512, 512, 2048]
    - [92, 10637.0]
  - - [512, 2048, 1, 3414, 512, 512, 512, 2048]
    - [92, 10637.0]
  - - [512, 2048, 1, 3415, 512, 512, 512, 2048]
    - [92, 10645.0]
  - - [512, 2048, 1, 3418, 512, 512, 512, 2048]
    - [92, 10640.0]
  - - [512, 2048, 1, 3420, 512, 512, 512, 2048]
    - [92, 10628.0]
  - - [512, 2048, 1, 3422, 512, 512, 512, 2048]
    - [92, 10649.0]
  - - [512, 2048, 1, 3425, 512, 512, 512, 2048]
    - [92, 10633.0]
  - - [512, 2048, 1, 3426, 512, 512, 512, 2048]
    - [73, 10661.0]
  - - [512, 2048, 1, 3428, 512, 512, 512, 2048]
    - [92, 10645.0]
  - - [512, 2048, 1, 3430, 512, 512, 512, 2048]
    - [92, 10687.0]
  - - [512, 2048, 1, 3431, 512, 512, 512, 2048]
    - [92, 10645.0]
  - - [512, 2048, 1, 3432, 512, 512, 512, 2048]
    - [106, 10658.0]
  - - [512, 2048, 1, 3438, 512, 512, 512, 2048]
    - [92, 10652.0]
  - - [512, 2048, 1, 3439, 512, 512, 512, 2048]
    - [92, 10646.0]
  - - [512, 2048, 1, 3440, 512, 512, 512, 2048]
    - [92, 10674.0]
  - - [512, 2048, 1, 3443, 512, 512, 512, 2048]
    - [73, 10651.0]
  - - [512, 2048, 1, 3445, 512, 512, 512, 2048]
    - [92, 10651.0]
  - - [512, 2048, 1, 3447, 512, 512, 512, 2048]
    - [92, 10645.0]
  - - [512, 2048, 1, 3448, 512, 512, 512, 2048]
    - [92, 10668.0]
  - - [512, 2048, 1, 3450, 512, 512, 512, 2048]
    - [92, 10656.0]
  - - [512, 2048, 1, 3451, 512, 512, 512, 2048]
    - [73, 10647.0]
  - - [512, 2048, 1, 3452, 512, 512, 512, 2048]
    - [92, 10660.0]
  - - [512, 2048, 1, 3453, 512, 512, 512, 2048]
    - [92, 10652.0]
  - - [512, 2048, 1, 3455, 512, 512, 512, 2048]
    - [92, 10651.0]
  - - [512, 2048, 1, 3456, 512, 512, 512, 2048]
    - [92, 10675.0]
  - - [512, 2048, 1, 3457, 512, 512, 512, 2048]
    - [51, 10685.0]
  - - [512, 2048, 1, 3458, 512, 512, 512, 2048]
    - [92, 10709.0]
  - - [512, 2048, 1, 3459, 512, 512, 512, 2048]
    - [106, 10677.0]
  - - [512, 2048, 1, 3460, 512, 512, 512, 2048]
    - [92, 10638.0]
  - - [512, 2048, 1, 3461, 512, 512, 512, 2048]
    - [92, 10676.0]
  - - [512, 2048, 1, 3462, 512, 512, 512, 2048]
    - [92, 10631.0]
  - - [512, 2048, 1, 3466, 512, 512, 512, 2048]
    - [92, 10650.0]
  - - [512, 2048, 1, 3467, 512, 512, 512, 2048]
    - [73, 10665.0]
  - - [512, 2048, 1, 3468, 512, 512, 512, 2048]
    - [92, 10637.0]
  - - [512, 2048, 1, 3470, 512, 512, 512, 2048]
    - [63, 10625.0]
  - - [512, 2048, 1, 3471, 512, 512, 512, 2048]
    - [92, 10681.0]
  - - [512, 2048, 1, 3472, 512, 512, 512, 2048]
    - [92, 10672.0]
  - - [512, 2048, 1, 3475, 512, 512, 512, 2048]
    - [92, 10645.0]
  - - [512, 2048, 1, 3476, 512, 512, 512, 2048]
    - [92, 10666.0]
  - - [512, 2048, 1, 3477, 512, 512, 512, 2048]
    - [92, 10649.0]
  - - [512, 2048, 1, 3478, 512, 512, 512, 2048]
    - [92, 10650.0]
  - - [512, 2048, 1, 3479, 512, 512, 512, 2048]
    - [73, 10644.0]
  - - [512, 2048, 1, 3480, 512, 512, 512, 2048]
    - [92, 10649.0]
  - - [512, 2048, 1, 3481, 512, 512, 512, 2048]
    - [92, 10642.0]
  - - [512, 2048, 1, 3483, 512, 512, 512, 2048]
    - [92, 10678.0]
  - - [512, 2048, 1, 3484, 512, 512, 512, 2048]
    - [73, 10663.0]
  - - [512, 2048, 1, 3487, 512, 512, 512, 2048]
    - [63, 10629.0]
  - - [512, 2048, 1, 3489, 512, 512, 512, 2048]
    - [51, 10688.0]
  - - [512, 2048, 1, 3490, 512, 512, 512, 2048]
    - [92, 10663.0]
  - - [512, 2048, 1, 3491, 512, 512, 512, 2048]
    - [92, 10641.0]
  - - [512, 2048, 1, 3493, 512, 512, 512, 2048]
    - [73, 10677.0]
  - - [512, 2048, 1, 3494, 512, 512, 512, 2048]
    - [92, 10639.0]
  - - [512, 2048, 1, 3495, 512, 512, 512, 2048]
    - [73, 10624.0]
  - - [512, 2048, 1, 3497, 512, 512, 512, 2048]
    - [92, 10667.0]
  - - [512, 2048, 1, 3498, 512, 512, 512, 2048]
    - [92, 10643.0]
  - - [512, 2048, 1, 3499, 512, 512, 512, 2048]
    - [92, 10650.0]
  - - [512, 2048, 1, 3501, 512, 512, 512, 2048]
    - [92, 10646.0]
  - - [512, 2048, 1, 3503, 512, 512, 512, 2048]
    - [92, 10652.0]
  - - [512, 2048, 1, 3507, 512, 512, 512, 2048]
    - [92, 10645.0]
  - - [512, 2048, 1, 3508, 512, 512, 512, 2048]
    - [73, 10669.0]
  - - [512, 2048, 1, 3509, 512, 512, 512, 2048]
    - [92, 10650.0]
  - - [512, 2048, 1, 3511, 512, 512, 512, 2048]
    - [51, 10652.0]
  - - [512, 2048, 1, 3514, 512, 512, 512, 2048]
    - [92, 10679.0]
  - - [512, 2048, 1, 3515, 512, 512, 512, 2048]
    - [106, 10650.0]
  - - [512, 2048, 1, 3517, 512, 512, 512, 2048]
    - [92, 10643.0]
  - - [512, 2048, 1, 3518, 512, 512, 512, 2048]
    - [92, 10639.0]
  - - [512, 2048, 1, 3519, 512, 512, 512, 2048]
    - [92, 10641.0]
  - - [512, 2048, 1, 3520, 512, 512, 512, 2048]
    - [92, 10672.0]
  - - [512, 2048, 1, 3523, 512, 512, 512, 2048]
    - [51, 10640.0]
  - - [512, 2048, 1, 3528, 512, 512, 512, 2048]
    - [92, 10665.0]
  - - [512, 2048, 1, 3529, 512, 512, 512, 2048]
    - [92, 10629.0]
  - - [512, 2048, 1, 3530, 512, 512, 512, 2048]
    - [92, 10643.0]
  - - [512, 2048, 1, 3532, 512, 512, 512, 2048]
    - [92, 10684.0]
  - - [512, 2048, 1, 3533, 512, 512, 512, 2048]
    - [92, 10653.0]
  - - [512, 2048, 1, 3534, 512, 512, 512, 2048]
    - [92, 10644.0]
  - - [512, 2048, 1, 3538, 512, 512, 512, 2048]
    - [92, 10654.0]
  - - [512, 2048, 1, 3539, 512, 512, 512, 2048]
    - [92, 10661.0]
  - - [512, 2048, 1, 3541, 512, 512, 512, 2048]
    - [63, 10664.0]
  - - [512, 2048, 1, 3547, 512, 512, 512, 2048]
    - [73, 10641.0]
  - - [512, 2048, 1, 3548, 512, 512, 512, 2048]
    - [73, 10685.0]
  - - [512, 2048, 1, 3564, 512, 512, 512, 2048]
    - [92, 10630.0]
  - - [512, 2048, 1, 3575, 512, 512, 512, 2048]
    - [92, 10641.0]
  - - [512, 2048, 1, 3598, 512, 512, 512, 2048]
    - [92, 10668.0]
  - - [512, 2048, 1, 3599, 512, 512, 512, 2048]
    - [92, 10655.0]
  - - [512, 2048, 1, 3608, 512, 512, 512, 2048]
    - [92, 10643.0]
  - - [512, 2048, 1, 3780, 512, 512, 512, 2048]
    - [51, 10670.0]
  - - [512, 2048, 1, 3796, 512, 512, 512, 2048]
    - [63, 10638.0]
  - - [512, 2048, 1, 3822, 512, 512, 512, 2048]
    - [73, 10645.0]
  - - [512, 2048, 1, 3859, 512, 512, 512, 2048]
    - [92, 10668.0]
  - - [512, 2048, 1, 3870, 512, 512, 512, 2048]
    - [92, 10668.0]
  - - [512, 2048, 1, 3876, 512, 512, 512, 2048]
    - [92, 10677.0]
  - - [512, 2048, 1, 3906, 512, 512, 512, 2048]
    - [92, 10708.0]
  - - [512, 2048, 1, 3910, 512, 512, 512, 2048]
    - [73, 10690.0]
  - - [512, 2048, 1, 3925, 512, 512, 512, 2048]
    - [92, 10680.0]
  - - [512, 2048, 1, 3942, 512, 512, 512, 2048]
    - [51, 10662.0]
  - - [512, 2048, 1, 3944, 512, 512, 512, 2048]
    - [92, 10681.0]
  - - [512, 2048, 1, 3955, 512, 512, 512, 2048]
    - [92, 10651.0]
  - - [512, 2048, 1, 3968, 512, 512, 512, 2048]
    - [92, 10672.0]
  - - [512, 2048, 1, 3969, 512, 512, 512, 2048]
    - [92, 10670.0]
  - - [512, 2048, 1, 3976, 512, 512, 512, 2048]
    - [92, 10649.0]
  - - [512, 2048, 1, 3977, 512, 512, 512, 2048]
    - [92, 10656.0]
  - - [512, 2048, 1, 3978, 512, 512, 512, 2048]
    - [92, 10669.0]
  - - [512, 2048, 1, 3990, 512, 512, 512, 2048]
    - [92, 10677.0]
  - - [512, 2048, 1, 3995, 512, 512, 512, 2048]
    - [92, 10668.0]
  - - [512, 2048, 1, 3996, 512, 512, 512, 2048]
    - [73, 10678.0]
  - - [512, 2048, 1, 3999, 512, 512, 512, 2048]
    - [92, 10666.0]
  - - [512, 2048, 1, 4005, 512, 512, 512, 2048]
    - [92, 10669.0]
  - - [512, 2048, 1, 4012, 512, 512, 512, 2048]
    - [92, 10663.0]
  - - [512, 2048, 1, 4020, 512, 512, 512, 2048]
    - [92, 10667.0]
  - - [512, 2048, 1, 4026, 512, 512, 512, 2048]
    - [106, 10650.0]
  - - [512, 2048, 1, 4030, 512, 512, 512, 2048]
    - [92, 10653.0]
  - - [512, 2048, 1, 4032, 512, 512, 512, 2048]
    - [92, 10685.0]
  - - [2048, 512, 1, 2790, 2048, 2048, 2048, 512]
    - [106, 10629.0]
  - - [2048, 512, 1, 2864, 2048, 2048, 2048, 512]
    - [55, 10616.0]
  - - [2048, 512, 1, 3092, 2048, 2048, 2048, 512]
    - [73, 10642.0]
  - - [2048, 512, 1, 3113, 2048, 2048, 2048, 512]
    - [92, 10640.0]
  - - [2048, 512, 1, 3137, 2048, 2048, 2048, 512]
    - [92, 10658.0]
  - - [2048, 512, 1, 3165, 2048, 2048, 2048, 512]
    - [92, 10636.0]
  - - [2048, 512, 1, 3166, 2048, 2048, 2048, 512]
    - [92, 10626.0]
  - - [2048, 512, 1, 3194, 2048, 2048, 2048, 512]
    - [92, 10635.0]
  - - [2048, 512, 1, 3219, 2048, 2048, 2048, 512]
    - [73, 10630.0]
  - - [2048, 512, 1, 3222, 2048, 2048, 2048, 512]
    - [92, 10644.0]
  - - [2048, 512, 1, 3234, 2048, 2048, 2048, 512]
    - [106, 10645.0]
  - - [2048, 512, 1, 3237, 2048, 2048, 2048, 512]
    - [92, 10640.0]
  - - [2048, 512, 1, 3242, 2048, 2048, 2048, 512]
    - [92, 10638.0]
  - - [2048, 512, 1, 3246, 2048, 2048, 2048, 512]
    - [92, 10646.0]
  - - [2048, 512, 1, 3249, 2048, 2048, 2048, 512]
    - [73, 10636.0]
  - - [2048, 512, 1, 3251, 2048, 2048, 2048, 512]
    - [86, 10630.0]
  - - [2048, 512, 1, 3257, 2048, 2048, 2048, 512]
    - [92, 10665.0]
  - - [2048, 512, 1, 3262, 2048, 2048, 2048, 512]
    - [92, 10638.0]
  - - [2048, 512, 1, 3268, 2048, 2048, 2048, 512]
    - [92, 10640.0]
  - - [2048, 512, 1, 3282, 2048, 2048, 2048, 512]
    - [92, 10635.0]
  - - [2048, 512, 1, 3286, 2048, 2048, 2048, 512]
    - [73, 10642.0]
  - - [2048, 512, 1, 3287, 2048, 2048, 2048, 512]
    - [86, 10629.0]
  - - [2048, 512, 1, 3293, 2048, 2048, 2048, 512]
    - [92, 10671.0]
  - - [2048, 512, 1, 3297, 2048, 2048, 2048, 512]
    - [92, 10644.0]
  - - [2048, 512, 1, 3307, 2048, 2048, 2048, 512]
    - [92, 10640.0]
  - - [2048, 512, 1, 3314, 2048, 2048, 2048, 512]
    - [92, 10625.0]
  - - [2048, 512, 1, 3315, 2048, 2048, 2048, 512]
    - [73, 10639.0]
  - - [2048, 512, 1, 3319, 2048, 2048, 2048, 512]
    - [92, 10649.0]
  - - [2048, 512, 1, 3322, 2048, 2048, 2048, 512]
    - [92, 10638.0]
  - - [2048, 512, 1, 3323, 2048, 2048, 2048, 512]
    - [92, 10650.0]
  - - [2048, 512, 1, 3324, 2048, 2048, 2048, 512]
    - [92, 10643.0]
  - - [2048, 512, 1, 3325, 2048, 2048, 2048, 512]
    - [92, 10632.0]
  - - [2048, 512, 1, 3327, 2048, 2048, 2048, 512]
    - [92, 10628.0]
  - - [2048, 512, 1, 3329, 2048, 2048, 2048, 512]
    - [92, 10653.0]
  - - [2048, 512, 1, 3332, 2048, 2048, 2048, 512]
    - [92, 10655.0]
  - - [2048, 512, 1, 3336, 2048, 2048, 2048, 512]
    - [92, 10640.0]
  - - [2048, 512, 1, 3339, 2048, 2048, 2048, 512]
    - [92, 10669.0]
  - - [2048, 512, 1, 3342, 2048, 2048, 2048, 512]
    - [92, 10643.0]
  - - [2048, 512, 1, 3344, 2048, 2048, 2048, 512]
    - [92, 10641.0]
  - - [2048, 512, 1, 3358, 2048, 2048, 2048, 512]
    - [92, 10641.0]
  - - [2048, 512, 1, 3360, 2048, 2048, 2048, 512]
    - [92, 10665.0]
  - - [2048, 512, 1, 3364, 2048, 2048, 2048, 512]
    - [73, 10654.0]
  - - [2048, 512, 1, 3365, 2048, 2048, 2048, 512]
    - [86, 10637.0]
  - - [2048, 512, 1, 3369, 2048, 2048, 2048, 512]
    - [92, 10680.0]
  - - [2048, 512, 1, 3371, 2048, 2048, 2048, 512]
    - [106, 10635.0]
  - - [2048, 512, 1, 3374, 2048, 2048, 2048, 512]
    - [92, 10650.0]
  - - [2048, 512, 1, 3376, 2048, 2048, 2048, 512]
    - [73, 10679.0]
  - - [2048, 512, 1, 3377, 2048, 2048, 2048, 512]
    - [73, 10650.0]
  - - [2048, 512, 1, 3378, 2048, 2048, 2048, 512]
    - [92, 10645.0]
  - - [2048, 512, 1, 3381, 2048, 2048, 2048, 512]
    - [73, 10670.0]
  - - [2048, 512, 1, 3382, 2048, 2048, 2048, 512]
    - [86, 10649.0]
  - - [2048, 512, 1, 3383, 2048, 2048, 2048, 512]
    - [92, 10673.0]
  - - [2048, 512, 1, 3384, 2048, 2048, 2048, 512]
    - [106, 10655.0]
  - - [2048, 512, 1, 3385, 2048, 2048, 2048, 512]
    - [92, 10647.0]
  - - [2048, 512, 1, 3386, 2048, 2048, 2048, 512]
    - [92, 10643.0]
  - - [2048, 512, 1, 3388, 2048, 2048, 2048, 512]
    - [106, 10659.0]
  - - [2048, 512, 1, 3390, 2048, 2048, 2048, 512]
    - [92, 10652.0]
  - - [2048, 512, 1, 3391, 2048, 2048, 2048, 512]
    - [92, 10633.0]
  - - [2048, 512, 1, 3396, 2048, 2048, 2048, 512]
    - [86, 10642.0]
  - - [2048, 512, 1, 3399, 2048, 2048, 2048, 512]
    - [92, 10651.0]
  - - [2048, 512, 1, 3402, 2048, 2048, 2048, 512]
    - [106, 10657.0]
  - - [2048, 512, 1, 3410, 2048, 2048, 2048, 512]
    - [92, 10639.0]
  - - [2048, 512, 1, 3412, 2048, 2048, 2048, 512]
    - [51, 10635.0]
  - - [2048, 512, 1, 3414, 2048, 2048, 2048, 512]
    - [92, 10656.0]
  - - [2048, 512, 1, 3415, 2048, 2048, 2048, 512]
    - [92, 10642.0]
  - - [2048, 512, 1, 3418, 2048, 2048, 2048, 512]
    - [73, 10633.0]
  - - [2048, 512, 1, 3420, 2048, 2048, 2048, 512]
    - [92, 10655.0]
  - - [2048, 512, 1, 3422, 2048, 2048, 2048, 512]
    - [92, 10679.0]
  - - [2048, 512, 1, 3425, 2048, 2048, 2048, 512]
    - [106, 10651.0]
  - - [2048, 512, 1, 3426, 2048, 2048, 2048, 512]
    - [92, 10635.0]
  - - [2048, 512, 1, 3428, 2048, 2048, 2048, 512]
    - [92, 10621.0]
  - - [2048, 512, 1, 3430, 2048, 2048, 2048, 512]
    - [92, 10637.0]
  - - [2048, 512, 1, 3431, 2048, 2048, 2048, 512]
    - [73, 10635.0]
  - - [2048, 512, 1, 3432, 2048, 2048, 2048, 512]
    - [92, 10646.0]
  - - [2048, 512, 1, 3438, 2048, 2048, 2048, 512]
    - [92, 10634.0]
  - - [2048, 512, 1, 3439, 2048, 2048, 2048, 512]
    - [73, 10620.0]
  - - [2048, 512, 1, 3440, 2048, 2048, 2048, 512]
    - [92, 10662.0]
  - - [2048, 512, 1, 3443, 2048, 2048, 2048, 512]
    - [92, 10661.0]
  - - [2048, 512, 1, 3445, 2048, 2048, 2048, 512]
    - [92, 10629.0]
  - - [2048, 512, 1, 3447, 2048, 2048, 2048, 512]
    - [92, 10650.0]
  - - [2048, 512, 1, 3448, 2048, 2048, 2048, 512]
    - [92, 10644.0]
  - - [2048, 512, 1, 3450, 2048, 2048, 2048, 512]
    - [92, 10639.0]
  - - [2048, 512, 1, 3451, 2048, 2048, 2048, 512]
    - [73, 10637.0]
  - - [2048, 512, 1, 3453, 2048, 2048, 2048, 512]
    - [86, 10651.0]
  - - [2048, 512, 1, 3455, 2048, 2048, 2048, 512]
    - [73, 10629.0]
  - - [2048, 512, 1, 3456, 2048, 2048, 2048, 512]
    - [92, 10687.0]
  - - [2048, 512, 1, 3457, 2048, 2048, 2048, 512]
    - [92, 10653.0]
  - - [2048, 512, 1, 3458, 2048, 2048, 2048, 512]
    - [92, 10637.0]
  - - [2048, 512, 1, 3459, 2048, 2048, 2048, 512]
    - [92, 10640.0]
  - - [2048, 512, 1, 3460, 2048, 2048, 2048, 512]
    - [73, 10650.0]
  - - [2048, 512, 1, 3461, 2048, 2048, 2048, 512]
    - [106, 10632.0]
  - - [2048, 512, 1, 3462, 2048, 2048, 2048, 512]
    - [73, 10666.0]
  - - [2048, 512, 1, 3466, 2048, 2048, 2048, 512]
    - [92, 10656.0]
  - - [2048, 512, 1, 3467, 2048, 2048, 2048, 512]
    - [73, 10644.0]
  - - [2048, 512, 1, 3468, 2048, 2048, 2048, 512]
    - [92, 10677.0]
  - - [2048, 512, 1, 3470, 2048, 2048, 2048, 512]
    - [106, 10658.0]
  - - [2048, 512, 1, 3471, 2048, 2048, 2048, 512]
    - [92, 10647.0]
  - - [2048, 512, 1, 3476, 2048, 2048, 2048, 512]
    - [92, 10638.0]
  - - [2048, 512, 1, 3477, 2048, 2048, 2048, 512]
    - [106, 10617.0]
  - - [2048, 512, 1, 3478, 2048, 2048, 2048, 512]
    - [92, 10649.0]
  - - [2048, 512, 1, 3479, 2048, 2048, 2048, 512]
    - [73, 10657.0]
  - - [2048, 512, 1, 3480, 2048, 2048, 2048, 512]
    - [73, 10637.0]
  - - [2048, 512, 1, 3481, 2048, 2048, 2048, 512]
    - [106, 10631.0]
  - - [2048, 512, 1, 3483, 2048, 2048, 2048, 512]
    - [92, 10660.0]
  - - [2048, 512, 1, 3484, 2048, 2048, 2048, 512]
    - [92, 10660.0]
  - - [2048, 512, 1, 3487, 2048, 2048, 2048, 512]
    - [106, 10647.0]
  - - [2048, 512, 1, 3489, 2048, 2048, 2048, 512]
    - [92, 10628.0]
  - - [2048, 512, 1, 3490, 2048, 2048, 2048, 512]
    - [92, 10639.0]
  - - [2048, 512, 1, 3491, 2048, 2048, 2048, 512]
    - [92, 10652.0]
  - - [2048, 512, 1, 3493, 2048, 2048, 2048, 512]
    - [92, 10646.0]
  - - [2048, 512, 1, 3494, 2048, 2048, 2048, 512]
    - [73, 10637.0]
  - - [2048, 512, 1, 3495, 2048, 2048, 2048, 512]
    - [106, 10669.0]
  - - [2048, 512, 1, 3497, 2048, 2048, 2048, 512]
    - [73, 10664.0]
  - - [2048, 512, 1, 3498, 2048, 2048, 2048, 512]
    - [92, 10669.0]
  - - [2048, 512, 1, 3499, 2048, 2048, 2048, 512]
    - [92, 10655.0]
  - - [2048, 512, 1, 3501, 2048, 2048, 2048, 512]
    - [92, 10675.0]
  - - [2048, 512, 1, 3503, 2048, 2048, 2048, 512]
    - [92, 10657.0]
  - - [2048, 512, 1, 3507, 2048, 2048, 2048, 512]
    - [51, 10654.0]
  - - [2048, 512, 1, 3508, 2048, 2048, 2048, 512]
    - [92, 10649.0]
  - - [2048, 512, 1, 3509, 2048, 2048, 2048, 512]
    - [73, 10645.0]
  - - [2048, 512, 1, 3511, 2048, 2048, 2048, 512]
    - [92, 10637.0]
  - - [2048, 512, 1, 3514, 2048, 2048, 2048, 512]
    - [92, 10635.0]
  - - [2048, 512, 1, 3515, 2048, 2048, 2048, 512]
    - [92, 10654.0]
  - - [2048, 512, 1, 3517, 2048, 2048, 2048, 512]
    - [73, 10630.0]
  - - [2048, 512, 1, 3518, 2048, 2048, 2048, 512]
    - [92, 10650.0]
  - - [2048, 512, 1, 3519, 2048, 2048, 2048, 512]
    - [92, 10644.0]
  - - [2048, 512, 1, 3520, 2048, 2048, 2048, 512]
    - [92, 10644.0]
  - - [2048, 512, 1, 3523, 2048, 2048, 2048, 512]
    - [92, 10640.0]
  - - [2048, 512, 1, 3528, 2048, 2048, 2048, 512]
    - [92, 10649.0]
  - - [2048, 512, 1, 3529, 2048, 2048, 2048, 512]
    - [92, 10638.0]
  - - [2048, 512, 1, 3530, 2048, 2048, 2048, 512]
    - [106, 10630.0]
  - - [2048, 512, 1, 3532, 2048, 2048, 2048, 512]
    - [73, 10645.0]
  - - [2048, 512, 1, 3533, 2048, 2048, 2048, 512]
    - [73, 10644.0]
  - - [2048, 512, 1, 3534, 2048, 2048, 2048, 512]
    - [92, 10650.0]
  - - [2048, 512, 1, 3538, 2048, 2048, 2048, 512]
    - [92, 10680.0]
  - - [2048, 512, 1, 3539, 2048, 2048, 2048, 512]
    - [92, 10632.0]
  - - [2048, 512, 1, 3541, 2048, 2048, 2048, 512]
    - [106, 10653.0]
  - - [2048, 512, 1, 3547, 2048, 2048, 2048, 512]
    - [92, 10653.0]
  - - [2048, 512, 1, 3548, 2048, 2048, 2048, 512]
    - [92, 10630.0]
  - - [2048, 512, 1, 3552, 2048, 2048, 2048, 512]
    - [92, 10647.0]
  - - [2048, 512, 1, 3564, 2048, 2048, 2048, 512]
    - [92, 10647.0]
  - - [2048, 512, 1, 3575, 2048, 2048, 2048, 512]
    - [92, 10618.0]
  - - [2048, 512, 1, 3598, 2048, 2048, 2048, 512]
    - [73, 10651.0]
  - - [2048, 512, 1, 3599, 2048, 2048, 2048, 512]
    - [73, 10640.0]
  - - [2048, 512, 1, 3608, 2048, 2048, 2048, 512]
    - [92, 10655.0]
  - - [2048, 512, 1, 3780, 2048, 2048, 2048, 512]
    - [92, 10644.0]
  - - [2048, 512, 1, 3796, 2048, 2048, 2048, 512]
    - [92, 10646.0]
  - - [2048, 512, 1, 3822, 2048, 2048, 2048, 512]
    - [106, 10633.0]
  - - [2048, 512, 1, 3840, 2048, 2048, 2048, 512]
    - [73, 10631.0]
  - - [2048, 512, 1, 3859, 2048, 2048, 2048, 512]
    - [92, 10663.0]
  - - [2048, 512, 1, 3870, 2048, 2048, 2048, 512]
    - [73, 10620.0]
  - - [2048, 512, 1, 3876, 2048, 2048, 2048, 512]
    - [92, 10645.0]
  - - [2048, 512, 1, 3906, 2048, 2048, 2048, 512]
    - [92, 10632.0]
  - - [2048, 512, 1, 3910, 2048, 2048, 2048, 512]
    - [106, 10646.0]
  - - [2048, 512, 1, 3925, 2048, 2048, 2048, 512]
    - [73, 10635.0]
  - - [2048, 512, 1, 3942, 2048, 2048, 2048, 512]
    - [86, 10647.0]
  - - [2048, 512, 1, 3944, 2048, 2048, 2048, 512]
    - [73, 10658.0]
  - - [2048, 512, 1, 3955, 2048, 2048, 2048, 512]
    - [73, 10664.0]
  - - [2048, 512, 1, 3968, 2048, 2048, 2048, 512]
    - [73, 10661.0]
  - - [2048, 512, 1, 3969, 2048, 2048, 2048, 512]
    - [73, 10654.0]
  - - [2048, 512, 1, 3976, 2048, 2048, 2048, 512]
    - [106, 10646.0]
  - - [2048, 512, 1, 3977, 2048, 2048, 2048, 512]
    - [92, 10651.0]
  - - [2048, 512, 1, 3978, 2048, 2048, 2048, 512]
    - [92, 10645.0]
  - - [2048, 512, 1, 3990, 2048, 2048, 2048, 512]
    - [92, 10658.0]
  - - [2048, 512, 1, 3995, 2048, 2048, 2048, 512]
    - [92, 10651.0]
  - - [2048, 512, 1, 3996, 2048, 2048, 2048, 512]
    - [73, 10680.0]
  - - [2048, 512, 1, 3999, 2048, 2048, 2048, 512]
    - [92, 10647.0]
  - - [2048, 512, 1, 4005, 2048, 2048, 2048, 512]
    - [92, 10660.0]
  - - [2048, 512, 1, 4012, 2048, 2048, 2048, 512]
    - [92, 10627.0]
  - - [2048, 512, 1, 4020, 2048, 2048, 2048, 512]
    - [92, 10652.0]
  - - [2048, 512, 1, 4026, 2048, 2048, 2048, 512]
    - [92, 10643.0]
  - - [2048, 512, 1, 4030, 2048, 2048, 2048, 512]
    - [92, 10649.0]
  - - [2048, 512, 1, 4032, 2048, 2048, 2048, 512]
    - [92, 10663.0]
  - - [64, 102, 312, 102, 64, 64, 64, 102]
    - [71, 7164.0]
  - - [64, 512, 16, 512, 64, 64, 64, 512]
    - [71, 8239.0]
  - - [64, 512, 96, 512, 64, 64, 64, 512]
    - [71, 10467.0]
  - - [1024, 1024, 1, 3840, 1024, 1024, 1024, 1024]
    - [92, 10661.0]
  - - [1024, 1024, 1, 3968, 1024, 1024, 1024, 1024]
    - [73, 10687.0]
  - - [1024, 1024, 1, 7200, 1024, 1024, 1024, 1024]
    - [92, 10759.0]
  - - [1024, 1024, 1, 8160, 1024, 1024, 1024, 1024]
    - [92, 10728.0]
  - - [768, 768, 1, 384, 768, 768, 768, 768]
    - [107, 9260.0]
  - - [768, 384, 1, 384, 768, 768, 768, 384]
    - [51, 7683.0]
  - - [1152, 576, 1, 384, 1152, 1152, 1152, 576]
    - [49, 8841.0]
  - - [384, 768, 1, 384, 384, 384, 384, 768]
    - [51, 7641.0]
  - - [1024, 1024, 1, 32, 1024, 1024, 1024, 1024]
    - [70, 5146.0]
  - - [64, 128, 512, 128, 64, 64, 64, 128]
    - [49, 10890.0]
  - - [64, 512, 64, 512, 64, 64, 64, 512]
    - [49, 10941.0]
  - - [1024, 1024, 1, 1600, 1024, 1024, 1024, 1024]
    - [73, 10566.0]
  - - [2048, 256, 1, 1024, 2048, 2048, 2048, 256]
    - [93, 8990.0]
  - - [256, 1280, 1, 8976, 256, 256, 256, 1280]
    - [52, 10307.0]
  - - [512, 2048, 1, 256, 512, 512, 512, 2048]
    - [73, 10024.0]
  - - [560, 1024, 1, 1600, 560, 560, 560, 1024]
    - [57, 9834.0]
  - - [560, 1024, 1, 200, 560, 560, 560, 1024]
    - [106, 7987.0]
  - - [1024, 1024, 1, 960, 1024, 1024, 1024, 1024]
    - [92, 10501.0]
  - - [2304, 128, 1, 128, 2304, 2304, 2304, 128]
    - [49, 5720.0]
  - - [2688, 128, 1, 128, 2688, 2688, 2688, 128]
    - [50, 5734.0]
  - - [3072, 128, 1, 128, 3072, 3072, 3072, 128]
    - [49, 6339.0]
  - - [3456, 128, 1, 128, 3456, 3456, 3456, 128]
    - [49, 7025.0]
  - - [3840, 128, 1, 128, 3840, 3840, 3840, 128]
    - [49, 7635.0]
  - - [4224, 128, 1, 128, 4224, 4224, 4224, 128]
    - [51, 7316.0]
  - - [4608, 128, 1, 128, 4608, 4608, 4608, 128]
    - [51, 7848.0]
  - - [4992, 128, 1, 128, 4992, 4992, 4992, 128]
    - [106, 8195.0]
  - - [5376, 128, 1, 128, 5376, 5376, 5376, 128]
    - [51, 8022.0]
  - - [5760, 128, 1, 128, 5760, 5760, 5760, 128]
    - [51, 8456.0]
  - - [6144, 128, 1, 128, 6144, 6144, 6144, 128]
    - [63, 8769.0]
  - - [6528, 128, 1, 128, 6528, 6528, 6528, 128]
    - [49, 8502.0]
  - - [6912, 128, 1, 128, 6912, 6912, 6912, 128]
    - [51, 8988.0]
  - - [7296, 128, 1, 128, 7296, 7296, 7296, 128]
    - [51, 9266.0]
  - - [7680, 128, 1, 128, 7680, 7680, 7680, 128]
    - [49, 9533.0]
  - - [8064, 128, 1, 128, 8064, 8064, 8064, 128]
    - [51, 9150.0]
  - - [8448, 128, 1, 128, 8448, 8448, 8448, 128]
    - [51, 9454.0]
  - - [8832, 128, 1, 128, 8832, 8832, 8832, 128]
    - [51, 9777.0]
  - - [2304, 128, 1, 256, 2304, 2304, 2304, 128]
    - [106, 6705.0]
  - - [2688, 128, 1, 256, 2688, 2688, 2688, 128]
    - [51, 6573.0]
  - - [3072, 128, 1, 256, 3072, 3072, 3072, 128]
    - [51, 7369.0]
  - - [3456, 128, 1, 256, 3456, 3456, 3456, 128]
    - [51, 8230.0]
  - - [3840, 128, 1, 256, 3840, 3840, 3840, 128]
    - [51, 8937.0]
  - - [4224, 128, 1, 256, 4224, 4224, 4224, 128]
    - [73, 8239.0]
  - - [4608, 128, 1, 256, 4608, 4608, 4608, 128]
    - [51, 8810.0]
  - - [4992, 128, 1, 256, 4992, 4992, 4992, 128]
    - [52, 9588.0]
  - - [5376, 128, 1, 256, 5376, 5376, 5376, 128]
    - [51, 8764.0]
  - - [5760, 128, 1, 256, 5760, 5760, 5760, 128]
    - [92, 9362.0]
  - - [6144, 128, 1, 256, 6144, 6144, 6144, 128]
    - [51, 9811.0]
  - - [6528, 128, 1, 256, 6528, 6528, 6528, 128]
    - [49, 8876.0]
  - - [6912, 128, 1, 256, 6912, 6912, 6912, 128]
    - [73, 9638.0]
  - - [7296, 128, 1, 256, 7296, 7296, 7296, 128]
    - [98, 10226.0]
  - - [7680, 128, 1, 256, 7680, 7680, 7680, 128]
    - [51, 10521.0]
  - - [8064, 128, 1, 256, 8064, 8064, 8064, 128]
    - [73, 9874.0]
  - - [8448, 128, 1, 256, 8448, 8448, 8448, 128]
    - [51, 10200.0]
  - - [8832, 128, 1, 256, 8832, 8832, 8832, 128]
    - [51, 10648.0]
  - - [768, 768, 1, 768, 768, 768, 768, 768]
    - [74, 9899.0]
  - - [384, 1536, 1, 384, 384, 384, 384, 1536]
    - [93, 9437.0]
  - - [384, 1920, 1, 384, 384, 384, 384, 1920]
    - [73, 9282.0]
  - - [384, 2304, 1, 384, 384, 384, 384, 2304]
    - [79, 10111.0]
  - - [64, 192, 64, 1280, 64, 64, 64, 192]
    - [49, 10052.0]
  - - [64, 320, 64, 1280, 64, 64, 64, 320]
    - [71, 10734.0]
  - - [64, 384, 64, 1280, 64, 64, 64, 384]
    - [61, 9913.0]
  - - [64, 448, 64, 1280, 64, 64, 64, 448]
    - [71, 9895.0]
  - - [64, 192, 64, 2048, 64, 64, 64, 192]
    - [61, 9850.0]
  - - [64, 320, 64, 2048, 64, 64, 64, 320]
    - [71, 10211.0]
  - - [64, 384, 64, 2048, 64, 64, 64, 384]
    - [65, 8520.0]
  - - [64, 448, 64, 2048, 64, 64, 64, 448]
    - [71, 9728.0]
  - - [1225, 64, 64, 192, 1225, 1225, 1225, 64]
    - [51, 10735.0]
  - - [1225, 64, 64, 256, 1225, 1225, 1225, 64]
    - [92, 10783.0]
  - - [1225, 64, 64, 288, 1225, 1225, 1225, 64]
    - [73, 10774.0]
  - - [5329, 80, 64, 64, 5329, 5329, 5329, 80]
    - [96, 5077.0]
  - - [64, 192, 32, 1280, 64, 64, 64, 192]
    - [91, 8063.0]
  - - [64, 320, 32, 1280, 64, 64, 64, 320]
    - [53, 10562.0]
  - - [64, 384, 32, 1280, 64, 64, 64, 384]
    - [71, 10119.0]
  - - [64, 448, 32, 1280, 64, 64, 64, 448]
    - [71, 10021.0]
  - - [64, 192, 32, 2048, 64, 64, 64, 192]
    - [71, 8345.0]
  - - [64, 320, 32, 2048, 64, 64, 64, 320]
    - [53, 10578.0]
  - - [64, 384, 32, 2048, 64, 64, 64, 384]
    - [91, 9979.0]
  - - [64, 448, 32, 2048, 64, 64, 64, 448]
    - [71, 9954.0]
  - - [1225, 64, 32, 192, 1225, 1225, 1225, 64]
    - [49, 10167.0]
  - - [1225, 64, 32, 256, 1225, 1225, 1225, 64]
    - [51, 10602.0]
  - - [1225, 64, 32, 288, 1225, 1225, 1225, 64]
    - [92, 10901.0]
  - - [5329, 80, 32, 64, 5329, 5329, 5329, 80]
    - [71, 6380.0]
  - - [289, 128, 32, 768, 289, 289, 289, 128]
    - [49, 9903.0]
  - - [289, 160, 32, 768, 289, 289, 289, 160]
    - [71, 8201.0]
  - - [289, 192, 32, 768, 289, 289, 289, 192]
    - [91, 9828.0]
  - - [3136, 64, 32, 64, 3136, 3136, 3136, 64]
    - [71, 10513.0]
  - - [3136, 64, 32, 256, 3136, 3136, 3136, 64]
    - [49, 10028.0]
  - - [196, 256, 32, 1024, 196, 196, 196, 256]
    - [92, 8806.0]
  - - [1024, 1024, 1, 6912, 1024, 1024, 1024, 1024]
    - [92, 10715.0]
  - - [1024, 512, 1, 4096, 1024, 1024, 1024, 512]
    - [102, 9361.0]
  - - [480, 1024, 1, 4096, 480, 480, 480, 1024]
    - [52, 8638.0]
  - - [1024, 512, 1, 6912, 1024, 1024, 1024, 512]
    - [59, 9435.0]
  - - [480, 1024, 1, 6912, 480, 480, 480, 1024]
    - [82, 8764.0]
  - - [100, 512, 120, 128, 100, 100, 100, 512]
    - [91, 8356.0]
  - - [100, 512, 18, 128, 100, 100, 100, 512]
    - [104, 6255.0]
  - - [100, 512, 19, 128, 100, 100, 100, 512]
    - [91, 6485.0]
  - - [1444, 576, 1, 128, 1444, 1444, 1444, 576]
    - [86, 8330.0]
  - - [173280, 64, 1, 128, 173280, 173280, 173280, 64]
    - [54, 7961.0]
  - - [25992, 64, 1, 128, 25992, 25992, 25992, 64]
    - [71, 9045.0]
  - - [27436, 64, 1, 128, 27436, 27436, 27436, 64]
    - [84, 9540.0]
  - - [361, 2304, 1, 512, 361, 361, 361, 2304]
    - [57, 9372.0]
  - - [960, 1024, 1, 1024, 960, 960, 960, 1024]
    - [49, 10985.0]
  - - [1024, 960, 1, 1024, 1024, 1024, 1024, 960]
    - [92, 11275.0]
  - - [1024, 1024, 1, 77, 1024, 1024, 1024, 1024]
    - [49, 7518.0]
  - - [64, 128, 160, 128, 64, 64, 64, 128]
    - [49, 9720.0]
  - - [1024, 1024, 1, 10, 1024, 1024, 1024, 1024]
    - [49, 2158.0]
  - - [64, 128, 624, 128, 64, 64, 64, 128]
    - [49, 10909.0]
  - - [1024, 1024, 1, 39, 1024, 1024, 1024, 1024]
    - [49, 5190.0]
  - - [1024, 1024, 1, 780, 1024, 1024, 1024, 1024]
    - [92, 10443.0]
  - - [1024, 1024, 1, 4992, 1024, 1024, 1024, 1024]
    - [92, 10690.0]
  - - [1024, 1024, 1, 308, 1024, 1024, 1024, 1024]
    - [92, 10024.0]
  - - [64, 128, 640, 128, 64, 64, 64, 128]
    - [49, 10991.0]
  - - [1024, 1024, 1, 40, 1024, 1024, 1024, 1024]
    - [49, 5730.0]
  - - [1024, 1024, 1, 800, 1024, 1024, 1024, 1024]
    - [73, 10321.0]
  - - [1024, 1024, 1, 5120, 1024, 1024, 1024, 1024]
    - [73, 10690.0]
  - - [64, 128, 656, 128, 64, 64, 64, 128]
    - [49, 10894.0]
  - - [1024, 1024, 1, 41, 1024, 1024, 1024, 1024]
    - [51, 5321.0]
  - - [1024, 1024, 1, 820, 1024, 1024, 1024, 1024]
    - [51, 10442.0]
  - - [1024, 1024, 1, 5248, 1024, 1024, 1024, 1024]
    - [92, 10698.0]
  - - [64, 512, 80, 512, 64, 64, 64, 512]
    - [71, 11047.0]
  - - [1024, 1024, 1, 5, 1024, 1024, 1024, 1024]
    - [49, 1070.0]
  - - [1024, 1024, 1, 385, 1024, 1024, 1024, 1024]
    - [51, 10225.0]
  - - [1024, 1024, 1, 2560, 1024, 1024, 1024, 1024]
    - [73, 10648.0]
  - - [1024, 1024, 1, 462, 1024, 1024, 1024, 1024]
    - [51, 10272.0]
  - - [64, 128, 128, 128, 64, 64, 64, 128]
    - [49, 9008.0]
  - - [1024, 1024, 1, 8, 1024, 1024, 1024, 1024]
    - [83, 1848.0]
  - - [1024, 1024, 1, 160, 1024, 1024, 1024, 1024]
    - [86, 9425.0]
  - - [64, 128, 144, 128, 64, 64, 64, 128]
    - [49, 9118.0]
  - - [1024, 1024, 1, 9, 1024, 1024, 1024, 1024]
    - [55, 1774.0]
  - - [1024, 1024, 1, 180, 1024, 1024, 1024, 1024]
    - [51, 9689.0]
  - - [1024, 1024, 1, 1152, 1024, 1024, 1024, 1024]
    - [92, 10537.0]
  - - [1024, 1024, 1, 6528, 1024, 1024, 1024, 1024]
    - [73, 10706.0]
  - - [1024, 1024, 1, 7104, 1024, 1024, 1024, 1024]
    - [92, 10713.0]
  - - [1024, 1024, 1, 8064, 1024, 1024, 1024, 1024]
    - [92, 10721.0]
  - - [2048, 512, 1, 1, 2048, 2048, 2048, 512]
    - [61, 228.0]
  - - [1024, 1024, 1, 16, 1024, 1024, 1024, 1024]
    - [83, 3142.0]
  - - [512, 64, 256, 512, 512, 512, 512, 64]
    - [92, 9180.0]
  - - [64, 512, 256, 512, 64, 64, 64, 512]
    - [49, 9201.0]
  - - [512, 64, 128, 512, 512, 512, 512, 64]
    - [55, 9062.0]
  - - [64, 512, 128, 512, 64, 64, 64, 512]
    - [91, 9141.0]
  - - [512, 64, 40, 512, 512, 512, 512, 64]
    - [73, 11041.0]
  - - [64, 512, 40, 512, 64, 64, 64, 512]
    - [71, 10856.0]
  - - [1024, 96, 64, 1024, 1024, 1024, 1024, 96]
    - [98, 9075.0]
  - - [96, 1024, 64, 1024, 96, 96, 96, 1024]
    - [79, 9129.0]
  - - [1024, 96, 128, 1024, 1024, 1024, 1024, 96]
    - [79, 9166.0]
  - - [96, 1024, 128, 1024, 96, 96, 96, 1024]
    - [110, 9233.0]
  - - [1024, 64, 256, 1024, 1024, 1024, 1024, 64]
    - [73, 10231.0]
  - - [64, 1024, 256, 1024, 64, 64, 64, 1024]
    - [71, 10251.0]
  - - [1024, 64, 32, 1024, 1024, 1024, 1024, 64]
    - [106, 10751.0]
  - - [64, 1024, 32, 1024, 64, 64, 64, 1024]
    - [91, 10621.0]
  - - [1024, 64, 64, 1024, 1024, 1024, 1024, 64]
    - [55, 10094.0]
  - - [64, 1024, 64, 1024, 64, 64, 64, 1024]
    - [71, 10144.0]
  - - [1024, 64, 128, 1024, 1024, 1024, 1024, 64]
    - [51, 10220.0]
  - - [64, 1024, 128, 1024, 64, 64, 64, 1024]
    - [91, 10274.0]
  - - [1024, 1024, 1, 64, 1024, 1024, 1024, 1024]
    - [49, 6738.0]
  - - [64, 128, 1024, 128, 64, 64, 64, 128]
    - [89, 6194.0]
  - - [128, 64, 1024, 128, 128, 128, 128, 64]
    - [58, 5548.0]
  - - [1024, 1024, 1, 3456, 1024, 1024, 1024, 1024]
    - [92, 10647.0]
  - - [1024, 1024, 1, 864, 1024, 1024, 1024, 1024]
    - [92, 10493.0]
  - - [1024, 512, 1, 3456, 1024, 1024, 1024, 512]
    - [82, 9328.0]
  - - [1024, 512, 1, 864, 1024, 1024, 1024, 512]
    - [93, 8900.0]
  - - [256, 3456, 1, 1, 256, 256, 256, 3456]
    - [90, 206.0]
  - - [256, 4096, 1, 1, 256, 256, 256, 4096]
    - [61, 234.0]
  - - [480, 1024, 1, 3456, 480, 480, 480, 1024]
    - [57, 8662.0]
  - - [480, 1024, 1, 864, 480, 480, 480, 1024]
    - [52, 8092.0]
  - - [64, 128, 1280, 128, 64, 64, 64, 128]
    - [47, 5909.0]
  - - [128, 64, 1280, 128, 128, 128, 128, 64]
    - [80, 5980.0]
  - - [1024, 1024, 1, 82, 1024, 1024, 1024, 1024]
    - [49, 7299.0]
  - - [128, 64, 1312, 128, 128, 128, 128, 64]
    - [73, 5374.0]
  - - [64, 128, 1312, 128, 64, 64, 64, 128]
    - [62, 6380.0]
  - - [1024, 1024, 1, 12, 1024, 1024, 1024, 1024]
    - [55, 2104.0]
  - - [1024, 1024, 1, 6144, 1024, 1024, 1024, 1024]
    - [73, 10705.0]
  - - [64, 512, 192, 512, 64, 64, 64, 512]
    - [91, 9244.0]
  - - [512, 64, 192, 512, 512, 512, 512, 64]
    - [49, 9377.0]
  - - [3136, 64, 64, 128, 3136, 3136, 3136, 64]
    - [48, 7583.0]
  - - [3136, 64, 32, 128, 3136, 3136, 3136, 64]
    - [49, 11097.0]
  - - [196, 2304, 1, 256, 196, 196, 196, 2304]
    - [49, 6583.0]
  - - [784, 1152, 1, 128, 784, 784, 784, 1152]
    - [71, 8602.0]
  - - [64, 128, 2048, 128, 64, 64, 64, 128]
    - [81, 5726.0]
  - - [128, 64, 2048, 128, 128, 128, 128, 64]
    - [76, 5370.0]
  - - [128, 64, 1536, 128, 128, 128, 128, 64]
    - [99, 6030.0]
  - - [64, 128, 1536, 128, 64, 64, 64, 128]
    - [81, 5788.0]
  - - [1024, 1024, 1, 96, 1024, 1024, 1024, 1024]
    - [51, 8211.0]
  - - [92416, 64, 25, 64, 92416, 92416, 92416, 64]
    - [100, 5065.0]
  - - [50176, 64, 36, 64, 50176, 50176, 50176, 64]
    - [73, 5235.0]
  - - [36864, 64, 49, 64, 36864, 36864, 36864, 64]
    - [54, 5068.0]
  - - [25600, 64, 64, 64, 25600, 25600, 25600, 64]
    - [92, 5293.0]
  - - [64, 128, 192, 128, 64, 64, 64, 128]
    - [49, 8956.0]
  - - [128, 64, 192, 128, 128, 128, 128, 64]
    - [86, 9381.0]
  - - [768, 768, 1, 2048, 768, 768, 768, 768]
    - [102, 10288.0]
  - - [64, 384, 144, 384, 64, 64, 64, 384]
    - [91, 11077.0]
  - - [384, 64, 144, 384, 384, 384, 384, 64]
    - [106, 11250.0]
  - - [768, 768, 1, 4608, 768, 768, 768, 768]
    - [111, 10394.0]
  - - [64, 512, 48, 512, 64, 64, 64, 512]
    - [71, 10630.0]
  - - [512, 64, 48, 512, 512, 512, 512, 64]
    - [73, 10933.0]
  - - [64, 128, 256, 128, 64, 64, 64, 128]
    - [49, 10099.0]
  - - [128, 64, 256, 128, 128, 128, 128, 64]
    - [86, 10486.0]
  - - [64, 384, 192, 384, 64, 64, 64, 384]
    - [104, 8516.0]
  - - [384, 64, 192, 384, 384, 384, 384, 64]
    - [106, 8544.0]
  - - [1024, 1024, 1, 4608, 1024, 1024, 1024, 1024]
    - [92, 10686.0]
  - - [768, 512, 2, 2048, 768, 768, 768, 512]
    - [92, 10716.0]
  - - [713, 512, 2, 2048, 713, 713, 713, 512]
    - [73, 9975.0]
  - - [672, 512, 2, 2048, 672, 672, 672, 512]
    - [51, 9438.0]
  - - [660, 512, 2, 2048, 660, 660, 660, 512]
    - [92, 9242.0]
  - - [726, 512, 2, 2048, 726, 726, 726, 512]
    - [51, 10138.0]
  - - [1008, 512, 2, 2048, 1008, 1008, 1008, 512]
    - [51, 10361.0]
  - - [748, 512, 2, 2048, 748, 748, 748, 512]
    - [92, 10422.0]
  - - [864, 512, 2, 2048, 864, 864, 864, 512]
    - [52, 10424.0]
  - - [888, 512, 2, 2048, 888, 888, 888, 512]
    - [98, 10785.0]
  - - [805, 512, 2, 2048, 805, 805, 805, 512]
    - [57, 9807.0]
