library/src/blas3/Tensile/Logic/asm_full/navi21_Cijk_Alik_Bjlk_HBH.yaml
- {MinimumRequiredVersion: 4.26.0}
- navi21
- gfx1030
- [Device 73a2]
    SolutionIndex: 0
    SolutionNameMin: Cijk_Alik_Bjlk_HBH_MT64x64x16_SN_SU0_SUM0_TT8_8_WG8_8_1_WGM1
    SolutionIndex: 1
    SolutionNameMin: Cijk_Alik_Bjlk_HBH_MT64x64x16_SN_SU32_SUM3_TT8_8_WG8_8_1_WGM1
    SolutionIndex: 2
    SolutionNameMin: Cijk_Alik_Bjlk_HBH_MT64x64x16_SN_SU0_SUM0_TT8_8_WG8_8_1_WGM4
    SolutionIndex: 3
    SolutionNameMin: Cijk_Alik_Bjlk_HBH_MT64x64x16_SN_SU32_SUM3_TT8_8_WG8_8_1_WGM4
    SolutionIndex: 4
    SolutionNameMin: Cijk_Alik_Bjlk_HBH_MT128x128x16_SN_SU32_SUM3_TT8_8_WG16_16_1_WGM4
    SolutionIndex: 5
    SolutionNameMin: Cijk_Alik_Bjlk_HBH_MT64x64x16_SN_SU0_SUM0_TT8_8_WG8_8_1_WGM8
    SolutionIndex: 6
    SolutionNameMin: Cijk_Alik_Bjlk_HBH_MT64x64x16_SN_SU32_SUM3_TT8_8_WG8_8_1_WGM8
    SolutionIndex: 7
    SolutionNameMin: Cijk_Alik_Bjlk_HBH_MT16x16x8_SN_SU0_SUM0_TT2_2_WG8_8_1_WGM1
    SolutionIndex: 8
    SolutionNameMin: Cijk_Alik_Bjlk_HBH_MT32x32x8_SN_SU0_SUM0_TT4_4_WG8_8_1_WGM1
    SolutionIndex: 9
    SolutionNameMin: Cijk_Alik_Bjlk_HBH_MT32x16x8_SN_SU0_SUM0_TT2_2_WG16_8_1_WGM1
    SolutionIndex: 10
    SolutionNameMin: Cijk_Alik_Bjlk_HBH_MT64x64x8_SN_SU0_SUM0_TT4_4_WG16_16_1_WGM1
    SolutionIndex: 11
    SolutionNameMin: Cijk_Alik_Bjlk_HBH_MT16x16x16_SN_SU0_SUM0_TT2_2_WG8_8_1_WGM1
    SolutionIndex: 12
    SolutionNameMin: Cijk_Alik_Bjlk_HBH_MT32x32x16_SN_SU0_SUM0_TT4_4_WG8_8_1_WGM1
    SolutionIndex: 13
    SolutionNameMin: Cijk_Alik_Bjlk_HBH_MT32x32x16_SN_SU0_SUM0_TT2_2_WG16_16_1_WGM1
    SolutionIndex: 14
    SolutionNameMin: Cijk_Alik_Bjlk_HBH_MT16x16x32_SN_SU0_SUM0_TT2_2_WG8_8_1_WGM1
    SolutionIndex: 15
    SolutionNameMin: Cijk_Alik_Bjlk_HBH_MT16x16x8_SN_SU32_SUM3_TT2_2_WG8_8_1_WGM1
    SolutionIndex: 16
    SolutionNameMin: Cijk_Alik_Bjlk_HBH_MT32x32x8_SN_SU32_SUM3_TT4_4_WG8_8_1_WGM1
    SolutionIndex: 17
    SolutionNameMin: Cijk_Alik_Bjlk_HBH_MT32x16x8_SN_SU32_SUM3_TT2_2_WG16_8_1_WGM1
    SolutionIndex: 18
    SolutionNameMin: Cijk_Alik_Bjlk_HBH_MT64x64x8_SN_SU32_SUM3_TT4_4_WG16_16_1_WGM1
    SolutionIndex: 19
    SolutionNameMin: Cijk_Alik_Bjlk_HBH_MT16x16x16_SN_SU32_SUM3_TT2_2_WG8_8_1_WGM1
    SolutionIndex: 20
    SolutionNameMin: Cijk_Alik_Bjlk_HBH_MT32x32x16_SN_SU32_SUM3_TT2_2_WG16_16_1_WGM1
    SolutionIndex: 21
    SolutionNameMin: Cijk_Alik_Bjlk_HBH_MT16x16x32_SN_SU32_SUM3_TT2_2_WG8_8_1_WGM1
    SolutionIndex: 22
    SolutionNameMin: Cijk_Alik_Bjlk_HBH_MT16x16x8_SN_SU0_SUM0_TT2_2_WG8_8_1_WGM4
    SolutionIndex: 23
    SolutionNameMin: Cijk_Alik_Bjlk_HBH_MT32x32x8_SN_SU0_SUM0_TT4_4_WG8_8_1_WGM4
    SolutionIndex: 24
    SolutionNameMin: Cijk_Alik_Bjlk_HBH_MT16x16x16_SN_SU0_SUM0_TT2_2_WG8_8_1_WGM4
    SolutionIndex: 25
    SolutionNameMin: Cijk_Alik_Bjlk_HBH_MT32x32x16_SN_SU0_SUM0_TT4_4_WG8_8_1_WGM4
    SolutionIndex: 26
    SolutionNameMin: Cijk_Alik_Bjlk_HBH_MT16x16x16_SN_SU32_SUM3_TT2_2_WG8_8_1_WGM4
    SolutionIndex: 27
    SolutionNameMin: Cijk_Alik_Bjlk_HBH_MT32x16x16_SN_SU32_SUM3_TT2_2_WG16_8_1_WGM4
    SolutionIndex: 28
    SolutionNameMin: Cijk_Alik_Bjlk_HBH_MT16x16x32_SN_SU32_SUM3_TT2_2_WG8_8_1_WGM4
    SolutionIndex: 29
    SolutionNameMin: Cijk_Alik_Bjlk_HBH_MT32x32x16_SN_SU0_SUM0_TT4_4_WG8_8_1_WGM8
    SolutionIndex: 30
    SolutionNameMin: Cijk_Alik_Bjlk_HBH_MT32x16x8_SN_SU32_SUM3_TT2_2_WG16_8_1_WGM8
    SolutionIndex: 31
    SolutionNameMin: Cijk_Alik_Bjlk_HBH_MT16x16x16_SN_SU32_SUM3_TT2_2_WG8_8_1_WGM8
    SolutionIndex: 32
    SolutionNameMin: Cijk_Alik_Bjlk_HBH_MT32x32x16_SN_SU32_SUM3_TT4_4_WG8_8_1_WGM8
    SolutionIndex: 33
    SolutionNameMin: Cijk_Alik_Bjlk_HBH_MT16x16x32_SN_SU32_SUM3_TT2_2_WG8_8_1_WGM8
    SolutionIndex: 34
    SolutionNameMin: Cijk_Alik_Bjlk_HBH_MT16x32x32_SN_SU0_SUM0_TT2_4_WG8_8_1_WGM1
    SolutionIndex: 35
    SolutionNameMin: Cijk_Alik_Bjlk_HBH_MT16x32x16_SN_SU0_SUM0_TT2_4_WG8_8_1_WGM4
    SolutionIndex: 36
    SolutionNameMin: Cijk_Alik_Bjlk_HBH_MT16x32x32_SN_SU0_SUM0_TT2_4_WG8_8_1_WGM4
    SolutionIndex: 37
    SolutionNameMin: Cijk_Alik_Bjlk_HBH_MT16x32x16_SN_SU0_SUM0_TT2_4_WG8_8_1_WGM8
- - - [64, 5056, 1, 256, 64, 64, 256, 5056]
    - [5, 10005.0]
  - - [64, 6784, 1, 3328, 64, 64, 3328, 6784]
    - [2, 16912.0]
  - - [64, 5056, 1, 3328, 64, 64, 3328, 5056]
    - [6, 13670.0]
  - - [64, 6784, 1, 1280, 64, 64, 1280, 6784]
    - [3, 16221.0]
  - - [64, 6784, 1, 256, 64, 64, 256, 6784]
    - [0, 12835.0]
  - - [64, 5056, 1, 1280, 64, 64, 1280, 5056]
    - [3, 13057.0]
  - - [64, 5888, 1, 3328, 64, 64, 3328, 5888]
    - [0, 16021.0]
  - - [64, 5888, 1, 1280, 64, 64, 1280, 5888]
    - [1, 15226.0]
  - - [64, 5888, 1, 256, 64, 64, 256, 5888]
    - [1, 11651.0]
  - - [1024, 1024, 1, 1024, 1024, 1024, 1024, 1024]
    - [4, 25675.0]
  - - [64, 1408, 1, 3328, 64, 64, 3328, 1408]
    - [12, 7181.0]
  - - [64, 1856, 1, 256, 64, 64, 256, 1856]
    - [22, 5652.0]
  - - [64, 2368, 1, 3328, 64, 64, 3328, 2368]
    - [12, 7759.0]
  - - [64, 3584, 1, 1280, 64, 64, 1280, 3584]
    - [8, 9926.0]
  - - [64, 2944, 1, 256, 64, 64, 256, 2944]
    - [16, 7421.0]
  - - [64, 1408, 1, 1280, 64, 64, 1280, 1408]
    - [25, 6683.0]
  - - [64, 2368, 1, 1280, 64, 64, 1280, 2368]
    - [23, 7376.0]
  - - [64, 3584, 1, 3328, 64, 64, 3328, 3584]
    - [8, 10417.0]
  - - [64, 1856, 1, 3328, 64, 64, 3328, 1856]
    - [12, 7881.0]
  - - [64, 1856, 1, 1280, 64, 64, 1280, 1856]
    - [25, 7431.0]
  - - [64, 4288, 1, 256, 64, 64, 256, 4288]
    - [10, 9758.0]
  - - [64, 2944, 1, 3328, 64, 64, 3328, 2944]
    - [16, 9192.0]
  - - [64, 4288, 1, 1280, 64, 64, 1280, 4288]
    - [18, 11601.0]
  - - [64, 2944, 1, 1280, 64, 64, 1280, 2944]
    - [16, 8528.0]
  - - [64, 1408, 1, 256, 64, 64, 256, 1408]
    - [15, 4887.0]
  - - [64, 2368, 1, 256, 64, 64, 256, 2368]
    - [16, 6278.0]
  - - [64, 3584, 1, 256, 64, 64, 256, 3584]
    - [10, 8224.0]
  - - [64, 4288, 1, 3328, 64, 64, 3328, 4288]
    - [18, 11983.0]
  - - [1, 2944, 1, 3328, 1, 1, 3328, 2944]
    - [34, 323.0]
  - - [1, 2368, 1, 1280, 1, 1, 1280, 2368]
    - [11, 240.0]
  - - [1, 1408, 1, 1280, 1, 1, 1280, 1408]
    - [14, 173.0]
  - - [1, 2368, 1, 3328, 1, 1, 3328, 2368]
    - [36, 262.0]
  - - [1, 3584, 1, 1280, 1, 1, 1280, 3584]
    - [35, 336.0]
  - - [1, 2944, 1, 1, 1, 1, 1, 2944]
    - [7, 2.0]
  - - [1, 1408, 1, 3328, 1, 1, 3328, 1408]
    - [14, 190.0]
  - - [1, 2944, 1, 256, 1, 1, 256, 2944]
    - [24, 194.0]
  - - [1, 5056, 1, 256, 1, 1, 256, 5056]
    - [37, 297.0]
  - - [1, 1856, 1, 256, 1, 1, 256, 1856]
    - [19, 133.0]
  - - [1, 1856, 1, 1280, 1, 1, 1280, 1856]
    - [34, 200.0]
  - - [1, 4288, 1, 1280, 1, 1, 1280, 4288]
    - [37, 395.0]
  - - [1, 1408, 1, 1, 1, 1, 1, 1408]
    - [7, 1.0]
  - - [1, 1408, 1, 256, 1, 1, 256, 1408]
    - [31, 106.0]
  - - [1, 2368, 1, 256, 1, 1, 256, 2368]
    - [19, 163.0]
  - - [1, 4288, 1, 1, 1, 1, 1, 4288]
    - [7, 3.0]
  - - [1, 1856, 1, 3328, 1, 1, 3328, 1856]
    - [34, 227.0]
  - - [1, 4288, 1, 3328, 1, 1, 3328, 4288]
    - [37, 430.0]
  - - [1, 2368, 1, 1, 1, 1, 1, 2368]
    - [9, 2.0]
  - - [1, 3584, 1, 3328, 1, 1, 3328, 3584]
    - [37, 362.0]
  - - [1, 5056, 1, 1, 1, 1, 1, 5056]
    - [7, 3.0]
  - - [1, 3584, 1, 256, 1, 1, 256, 3584]
    - [11, 233.0]
  - - [1, 5056, 1, 1280, 1, 1, 1280, 5056]
    - [35, 425.0]
  - - [1, 3584, 1, 1, 1, 1, 1, 3584]
    - [7, 2.0]
  - - [1, 2944, 1, 1280, 1, 1, 1280, 2944]
    - [34, 292.0]
  - - [1, 1856, 1, 1, 1, 1, 1, 1856]
    - [7, 1.0]
  - - [1, 4288, 1, 256, 1, 1, 256, 4288]
    - [11, 261.0]
  - - [64, 448, 1, 3328, 64, 64, 3328, 448]
    - [20, 3488.0]
  - - [1, 64, 1, 1280, 1, 1, 1280, 64]
    - [21, 9.0]
  - - [64, 128, 1, 256, 64, 64, 256, 128]
    - [19, 651.0]
  - - [128, 64, 1, 1280, 128, 128, 1280, 64]
    - [21, 1200.0]
  - - [1, 128, 1, 1, 1, 1, 1, 128]
    - [9, 0.08]
  - - [64, 1024, 1, 3328, 64, 64, 3328, 1024]
    - [29, 6267.0]
  - - [1, 64, 1, 3328, 1, 1, 3328, 64]
    - [14, 10.0]
  - - [64, 448, 1, 1280, 64, 64, 1280, 448]
    - [26, 3482.0]
  - - [1, 256, 1, 1280, 1, 1, 1280, 256]
    - [14, 34.0]
  - - [64, 64, 1, 1280, 64, 64, 1280, 64]
    - [21, 604.0]
  - - [1, 1, 1, 3328, 1, 1, 3328, 1]
    - [9, 0.12]
  - - [1, 64, 1, 1, 1, 1, 1, 64]
    - [9, 0.04]
  - - [1, 128, 1, 1280, 1, 1, 1280, 128]
    - [21, 18.0]
  - - [64, 1024, 1, 1280, 64, 64, 1280, 1024]
    - [32, 5834.0]
  - - [64, 256, 1, 1280, 64, 64, 1280, 256]
    - [28, 2265.0]
  - - [1, 1024, 1, 256, 1, 1, 256, 1024]
    - [19, 76.0]
  - - [1, 704, 1, 3328, 1, 1, 3328, 704]
    - [14, 109.0]
  - - [1, 256, 1, 1, 1, 1, 1, 256]
    - [24, 0.16]
  - - [128, 64, 1, 256, 128, 128, 256, 64]
    - [19, 659.0]
  - - [64, 128, 1, 3328, 64, 64, 3328, 128]
    - [21, 1320.0]
  - - [64, 256, 1, 3328, 64, 64, 3328, 256]
    - [33, 2587.0]
  - - [1, 1, 1, 256, 1, 1, 256, 1]
    - [30, 0.07]
  - - [1, 704, 1, 1, 1, 1, 1, 704]
    - [9, 0.46]
  - - [1, 704, 1, 1280, 1, 1, 1280, 704]
    - [14, 94.0]
  - - [64, 448, 1, 256, 64, 64, 256, 448]
    - [19, 2198.0]
  - - [1, 448, 1, 1280, 1, 1, 1280, 448]
    - [21, 61.0]
  - - [64, 128, 1, 1280, 64, 64, 1280, 128]
    - [21, 1200.0]
  - - [1, 1, 1, 1, 1, 1, 1, 1]
    - [9, 0.0005882352863190291]
  - - [256, 64, 1, 256, 256, 256, 256, 64]
    - [19, 1311.0]
  - - [1, 448, 1, 3328, 1, 1, 3328, 448]
    - [21, 70.0]
  - - [1, 128, 1, 256, 1, 1, 256, 128]
    - [19, 10.0]
  - - [1, 1024, 1, 3328, 1, 1, 3328, 1024]
    - [21, 152.0]
  - - [64, 1024, 1, 256, 64, 64, 256, 1024]
    - [13, 4153.0]
  - - [64, 256, 1, 256, 64, 64, 256, 256]
    - [27, 1303.0]
  - - [1, 1024, 1, 1280, 1, 1, 1280, 1024]
    - [21, 135.0]
  - - [1, 1, 1, 1280, 1, 1, 1280, 1]
    - [17, 0.11]
  - - [64, 704, 1, 256, 64, 64, 256, 704]
    - [19, 3204.0]
  - - [64, 64, 1, 256, 64, 64, 256, 64]
    - [19, 330.0]
  - - [128, 64, 1, 3328, 128, 128, 3328, 64]
    - [14, 1274.0]
  - - [1, 448, 1, 256, 1, 1, 256, 448]
    - [19, 34.0]
  - - [1, 1024, 1, 1, 1, 1, 1, 1024]
    - [7, 1.0]
  - - [64, 704, 1, 3328, 64, 64, 3328, 704]
    - [24, 4982.0]
  - - [1, 256, 1, 256, 1, 1, 256, 256]
    - [19, 19.0]
  - - [1, 704, 1, 256, 1, 1, 256, 704]
    - [19, 53.0]
  - - [1, 128, 1, 3328, 1, 1, 3328, 128]
    - [14, 20.0]
  - - [64, 64, 1, 3328, 64, 64, 3328, 64]
    - [21, 659.0]
  - - [1, 448, 1, 1, 1, 1, 1, 448]
    - [24, 0.28]
  - - [1, 64, 1, 256, 1, 1, 256, 64]
    - [19, 5.0]
  - - [64, 704, 1, 1280, 64, 64, 1280, 704]
    - [26, 4830.0]
  - - [1, 256, 1, 3328, 1, 1, 3328, 256]
    - [21, 40.0]
- null
