library/src/blas3/Tensile/Logic/asm_full/navi21_Cijk_Alik_Bjlk_HB_GB.yaml
- {MinimumRequiredVersion: 4.26.0}
- navi21
- gfx1030
- [Device 73a2]
    SolutionIndex: 0
    SolutionNameMin: Cijk_Alik_Bjlk_HB_MT128x128x8_SN_SU0_SUM0_TT8_16_WG16_8_1_WGM1
    SolutionIndex: 1
    SolutionNameMin: Cijk_Alik_Bjlk_HB_MT128x256x8_SN_SU0_SUM0_TT8_16_WG16_16_1_WGM1
    SolutionIndex: 2
    SolutionNameMin: Cijk_Alik_Bjlk_HB_MT128x64x16_SN_SU0_SUM0_TT8_8_WG16_8_1_WGM1
    SolutionIndex: 3
    SolutionNameMin: Cijk_Alik_Bjlk_HB_MT128x128x16_SN_SU0_SUM0_TT8_16_WG16_8_1_WGM1
    SolutionIndex: 4
    SolutionNameMin: Cijk_Alik_Bjlk_HB_MT128x128x16_SN_SU0_SUM0_TT8_8_WG16_16_1_WGM1
    SolutionIndex: 5
    SolutionNameMin: Cijk_Alik_Bjlk_HB_MT128x256x16_SN_SU0_SUM0_TT8_16_WG16_16_1_WGM1
    SolutionIndex: 6
    SolutionNameMin: Cijk_Alik_Bjlk_HB_MT128x128x8_SN_SU32_SUM3_TT8_16_WG16_8_1_WGM1
    SolutionIndex: 7
    SolutionNameMin: Cijk_Alik_Bjlk_HB_MT128x256x8_SN_SU32_SUM3_TT8_16_WG16_16_1_WGM1
    SolutionIndex: 8
    SolutionNameMin: Cijk_Alik_Bjlk_HB_MT128x64x16_SN_SU32_SUM3_TT8_8_WG16_8_1_WGM1
    SolutionIndex: 9
    SolutionNameMin: Cijk_Alik_Bjlk_HB_MT128x128x16_SN_SU32_SUM3_TT8_16_WG16_8_1_WGM1
    SolutionIndex: 10
    SolutionNameMin: Cijk_Alik_Bjlk_HB_MT128x128x16_SN_SU32_SUM3_TT8_8_WG16_16_1_WGM1
    SolutionIndex: 11
    SolutionNameMin: Cijk_Alik_Bjlk_HB_MT128x256x16_SN_SU32_SUM3_TT8_16_WG16_16_1_WGM1
    SolutionIndex: 12
    SolutionNameMin: Cijk_Alik_Bjlk_HB_MT128x128x8_SN_SU0_SUM0_TT8_16_WG16_8_1_WGM4
    SolutionIndex: 13
    SolutionNameMin: Cijk_Alik_Bjlk_HB_MT128x256x8_SN_SU0_SUM0_TT8_16_WG16_16_1_WGM4
    SolutionIndex: 14
    SolutionNameMin: Cijk_Alik_Bjlk_HB_MT128x64x16_SN_SU0_SUM0_TT8_8_WG16_8_1_WGM4
    SolutionIndex: 15
    SolutionNameMin: Cijk_Alik_Bjlk_HB_MT128x128x16_SN_SU0_SUM0_TT8_16_WG16_8_1_WGM4
    SolutionIndex: 16
    SolutionNameMin: Cijk_Alik_Bjlk_HB_MT128x128x16_SN_SU0_SUM0_TT8_8_WG16_16_1_WGM4
    SolutionIndex: 17
    SolutionNameMin: Cijk_Alik_Bjlk_HB_MT128x256x16_SN_SU0_SUM0_TT8_16_WG16_16_1_WGM4
    SolutionIndex: 18
    SolutionNameMin: Cijk_Alik_Bjlk_HB_MT128x64x16_SN_SU32_SUM3_TT8_8_WG16_8_1_WGM4
    SolutionIndex: 19
    SolutionNameMin: Cijk_Alik_Bjlk_HB_MT128x128x16_SN_SU32_SUM3_TT8_16_WG16_8_1_WGM4
    SolutionIndex: 20
    SolutionNameMin: Cijk_Alik_Bjlk_HB_MT128x256x16_SN_SU32_SUM3_TT8_16_WG16_16_1_WGM4
    SolutionIndex: 21
    SolutionNameMin: Cijk_Alik_Bjlk_HB_MT128x256x8_SN_SU0_SUM0_TT8_16_WG16_16_1_WGM8
    SolutionIndex: 22
    SolutionNameMin: Cijk_Alik_Bjlk_HB_MT128x64x16_SN_SU0_SUM0_TT8_8_WG16_8_1_WGM8
    SolutionIndex: 23
    SolutionNameMin: Cijk_Alik_Bjlk_HB_MT128x128x16_SN_SU0_SUM0_TT8_16_WG16_8_1_WGM8
    SolutionIndex: 24
    SolutionNameMin: Cijk_Alik_Bjlk_HB_MT128x128x16_SN_SU0_SUM0_TT8_8_WG16_16_1_WGM8
    SolutionIndex: 25
    SolutionNameMin: Cijk_Alik_Bjlk_HB_MT128x256x16_SN_SU0_SUM0_TT8_16_WG16_16_1_WGM8
    SolutionIndex: 26
    SolutionNameMin: Cijk_Alik_Bjlk_HB_MT128x256x8_SN_SU32_SUM3_TT8_16_WG16_16_1_WGM8
    SolutionIndex: 27
    SolutionNameMin: Cijk_Alik_Bjlk_HB_MT128x64x16_SN_SU32_SUM3_TT8_8_WG16_8_1_WGM8
    SolutionIndex: 28
    SolutionNameMin: Cijk_Alik_Bjlk_HB_MT128x128x16_SN_SU32_SUM3_TT8_16_WG16_8_1_WGM8
    SolutionIndex: 29
    SolutionNameMin: Cijk_Alik_Bjlk_HB_MT128x128x16_SN_SU32_SUM3_TT8_8_WG16_16_1_WGM8
    SolutionIndex: 30
    SolutionNameMin: Cijk_Alik_Bjlk_HB_MT128x256x16_SN_SU32_SUM3_TT8_16_WG16_16_1_WGM8
    SolutionIndex: 31
    SolutionNameMin: Cijk_Alik_Bjlk_HB_MT64x64x16_SN_SU0_SUM0_TT8_8_WG8_8_1_WGM1
    SolutionIndex: 32
    SolutionNameMin: Cijk_Alik_Bjlk_HB_MT128x64x16_SN_SU0_SUM0_TT8_8_WG16_8_1_WGM1
    SolutionIndex: 33
    SolutionNameMin: Cijk_Alik_Bjlk_HB_MT128x128x16_SN_SU0_SUM0_TT8_8_WG16_16_1_WGM1
    SolutionIndex: 34
    SolutionNameMin: Cijk_Alik_Bjlk_HB_MT64x64x8_SN_SU32_SUM3_TT8_8_WG8_8_1_WGM1
    SolutionIndex: 35
    SolutionNameMin: Cijk_Alik_Bjlk_HB_MT64x64x16_SN_SU32_SUM3_TT8_8_WG8_8_1_WGM1
    SolutionIndex: 36
    SolutionNameMin: Cijk_Alik_Bjlk_HB_MT128x64x16_SN_SU32_SUM3_TT8_8_WG16_8_1_WGM1
    SolutionIndex: 37
    SolutionNameMin: Cijk_Alik_Bjlk_HB_MT128x128x16_SN_SU32_SUM3_TT8_8_WG16_16_1_WGM1
    SolutionIndex: 38
    SolutionNameMin: Cijk_Alik_Bjlk_HB_MT64x64x8_SN_SU0_SUM0_TT8_8_WG8_8_1_WGM4
    SolutionIndex: 39
    SolutionNameMin: Cijk_Alik_Bjlk_HB_MT64x64x16_SN_SU0_SUM0_TT8_8_WG8_8_1_WGM4
    SolutionIndex: 40
    SolutionNameMin: Cijk_Alik_Bjlk_HB_MT128x64x16_SN_SU0_SUM0_TT8_8_WG16_8_1_WGM4
    SolutionIndex: 41
    SolutionNameMin: Cijk_Alik_Bjlk_HB_MT128x128x16_SN_SU0_SUM0_TT8_8_WG16_16_1_WGM4
    SolutionIndex: 42
    SolutionNameMin: Cijk_Alik_Bjlk_HB_MT64x64x8_SN_SU32_SUM3_TT8_8_WG8_8_1_WGM4
    SolutionIndex: 43
    SolutionNameMin: Cijk_Alik_Bjlk_HB_MT64x64x16_SN_SU32_SUM3_TT8_8_WG8_8_1_WGM4
    SolutionIndex: 44
    SolutionNameMin: Cijk_Alik_Bjlk_HB_MT128x128x16_SN_SU32_SUM3_TT8_8_WG16_16_1_WGM4
    SolutionIndex: 45
    SolutionNameMin: Cijk_Alik_Bjlk_HB_MT64x64x8_SN_SU0_SUM0_TT8_8_WG8_8_1_WGM8
    SolutionIndex: 46
    SolutionNameMin: Cijk_Alik_Bjlk_HB_MT64x64x16_SN_SU0_SUM0_TT8_8_WG8_8_1_WGM8
    SolutionIndex: 47
    SolutionNameMin: Cijk_Alik_Bjlk_HB_MT128x64x16_SN_SU0_SUM0_TT8_8_WG16_8_1_WGM8
    SolutionIndex: 48
    SolutionNameMin: Cijk_Alik_Bjlk_HB_MT128x128x16_SN_SU0_SUM0_TT8_8_WG16_16_1_WGM8
    SolutionIndex: 49
    SolutionNameMin: Cijk_Alik_Bjlk_HB_MT64x64x8_SN_SU32_SUM3_TT8_8_WG8_8_1_WGM8
    SolutionIndex: 50
    SolutionNameMin: Cijk_Alik_Bjlk_HB_MT64x64x16_SN_SU32_SUM3_TT8_8_WG8_8_1_WGM8
    SolutionIndex: 51
    SolutionNameMin: Cijk_Alik_Bjlk_HB_MT128x128x16_SN_SU32_SUM3_TT8_8_WG16_16_1_WGM8
    SolutionIndex: 52
    SolutionNameMin: Cijk_Alik_Bjlk_HB_MT64x32x8_SN_SU0_SUM0_TT4_4_WG16_8_1_WGM1
    SolutionIndex: 53
    SolutionNameMin: Cijk_Alik_Bjlk_HB_MT64x64x8_SN_SU0_SUM0_TT4_4_WG16_16_1_WGM1
    SolutionIndex: 54
    SolutionNameMin: Cijk_Alik_Bjlk_HB_MT16x16x16_SN_SU0_SUM0_TT2_2_WG8_8_1_WGM1
    SolutionIndex: 55
    SolutionNameMin: Cijk_Alik_Bjlk_HB_MT32x32x16_SN_SU0_SUM0_TT2_2_WG16_16_1_WGM1
    SolutionIndex: 56
    SolutionNameMin: Cijk_Alik_Bjlk_HB_MT64x64x16_SN_SU0_SUM0_TT4_4_WG16_16_1_WGM1
    SolutionIndex: 57
    SolutionNameMin: Cijk_Alik_Bjlk_HB_MT16x16x32_SN_SU0_SUM0_TT2_2_WG8_8_1_WGM1
    SolutionIndex: 58
    SolutionNameMin: Cijk_Alik_Bjlk_HB_MT16x16x8_SN_SU32_SUM3_TT2_2_WG8_8_1_WGM1
    SolutionIndex: 59
    SolutionNameMin: Cijk_Alik_Bjlk_HB_MT32x32x8_SN_SU32_SUM3_TT4_4_WG8_8_1_WGM1
    SolutionIndex: 60
    SolutionNameMin: Cijk_Alik_Bjlk_HB_MT64x32x8_SN_SU32_SUM3_TT4_4_WG16_8_1_WGM1
    SolutionIndex: 61
    SolutionNameMin: Cijk_Alik_Bjlk_HB_MT64x64x8_SN_SU32_SUM3_TT4_4_WG16_16_1_WGM1
    SolutionIndex: 62
    SolutionNameMin: Cijk_Alik_Bjlk_HB_MT16x16x16_SN_SU32_SUM3_TT2_2_WG8_8_1_WGM1
    SolutionIndex: 63
    SolutionNameMin: Cijk_Alik_Bjlk_HB_MT64x64x16_SN_SU32_SUM3_TT4_4_WG16_16_1_WGM1
    SolutionIndex: 64
    SolutionNameMin: Cijk_Alik_Bjlk_HB_MT16x16x8_SN_SU0_SUM0_TT2_2_WG8_8_1_WGM4
    SolutionIndex: 65
    SolutionNameMin: Cijk_Alik_Bjlk_HB_MT64x32x8_SN_SU0_SUM0_TT4_4_WG16_8_1_WGM4
    SolutionIndex: 66
    SolutionNameMin: Cijk_Alik_Bjlk_HB_MT64x64x8_SN_SU0_SUM0_TT4_4_WG16_16_1_WGM4
    SolutionIndex: 67
    SolutionNameMin: Cijk_Alik_Bjlk_HB_MT16x16x16_SN_SU0_SUM0_TT2_2_WG8_8_1_WGM4
    SolutionIndex: 68
    SolutionNameMin: Cijk_Alik_Bjlk_HB_MT16x16x32_SN_SU0_SUM0_TT2_2_WG8_8_1_WGM4
    SolutionIndex: 69
    SolutionNameMin: Cijk_Alik_Bjlk_HB_MT32x32x8_SN_SU32_SUM3_TT4_4_WG8_8_1_WGM4
    SolutionIndex: 70
    SolutionNameMin: Cijk_Alik_Bjlk_HB_MT64x32x8_SN_SU32_SUM3_TT4_4_WG16_8_1_WGM4
    SolutionIndex: 71
    SolutionNameMin: Cijk_Alik_Bjlk_HB_MT64x64x8_SN_SU32_SUM3_TT4_4_WG16_16_1_WGM4
    SolutionIndex: 72
    SolutionNameMin: Cijk_Alik_Bjlk_HB_MT16x16x16_SN_SU32_SUM3_TT2_2_WG8_8_1_WGM4
    SolutionIndex: 73
    SolutionNameMin: Cijk_Alik_Bjlk_HB_MT64x32x8_SN_SU0_SUM0_TT4_4_WG16_8_1_WGM8
    SolutionIndex: 74
    SolutionNameMin: Cijk_Alik_Bjlk_HB_MT64x64x8_SN_SU0_SUM0_TT4_4_WG16_16_1_WGM8
    SolutionIndex: 75
    SolutionNameMin: Cijk_Alik_Bjlk_HB_MT16x16x16_SN_SU0_SUM0_TT2_2_WG8_8_1_WGM8
    SolutionIndex: 76
    SolutionNameMin: Cijk_Alik_Bjlk_HB_MT32x32x16_SN_SU0_SUM0_TT2_2_WG16_16_1_WGM8
    SolutionIndex: 77
    SolutionNameMin: Cijk_Alik_Bjlk_HB_MT16x16x32_SN_SU0_SUM0_TT2_2_WG8_8_1_WGM8
    SolutionIndex: 78
    SolutionNameMin: Cijk_Alik_Bjlk_HB_MT32x32x8_SN_SU32_SUM3_TT4_4_WG8_8_1_WGM8
    SolutionIndex: 79
    SolutionNameMin: Cijk_Alik_Bjlk_HB_MT64x32x8_SN_SU32_SUM3_TT4_4_WG16_8_1_WGM8
    SolutionIndex: 80
    SolutionNameMin: Cijk_Alik_Bjlk_HB_MT64x64x8_SN_SU32_SUM3_TT4_4_WG16_16_1_WGM8
    SolutionIndex: 81
    SolutionNameMin: Cijk_Alik_Bjlk_HB_MT16x16x16_SN_SU32_SUM3_TT2_2_WG8_8_1_WGM8
- - - [2944, 4288, 1, 1280, 2944, 2944, 1280, 4288]
    - [15, 39243.0]
  - - [2368, 5888, 1, 256, 2368, 2368, 256, 5888]
    - [3, 37501.0]
  - - [1024, 5056, 1, 3328, 1024, 1024, 3328, 5056]
    - [3, 38501.0]
  - - [5888, 1024, 1, 1280, 5888, 5888, 1280, 1024]
    - [23, 37036.0]
  - - [5888, 1856, 1, 3328, 5888, 5888, 3328, 1856]
    - [23, 37965.0]
  - - [5056, 704, 1, 256, 5056, 5056, 256, 704]
    - [8, 28854.0]
  - - [5888, 2944, 1, 3328, 5888, 5888, 3328, 2944]
    - [15, 40533.0]
  - - [1856, 4288, 1, 256, 1856, 1856, 256, 4288]
    - [3, 33312.0]
  - - [5056, 5056, 1, 3328, 5056, 5056, 3328, 5056]
    - [15, 40016.0]
  - - [1408, 5888, 1, 1280, 1408, 1408, 1280, 5888]
    - [3, 37898.0]
  - - [448, 3584, 1, 3328, 448, 448, 3328, 3584]
    - [13, 26020.0]
  - - [5888, 1408, 1, 1280, 5888, 5888, 1280, 1408]
    - [23, 37858.0]
  - - [3584, 1856, 1, 3328, 3584, 3584, 3328, 1856]
    - [15, 37743.0]
  - - [5056, 6784, 1, 1280, 5056, 5056, 1280, 6784]
    - [28, 40835.0]
  - - [5056, 5056, 1, 1280, 5056, 5056, 1280, 5056]
    - [19, 39784.0]
  - - [448, 5056, 1, 256, 448, 448, 256, 5056]
    - [2, 25410.0]
  - - [6784, 448, 1, 256, 6784, 6784, 256, 448]
    - [19, 26664.0]
  - - [5888, 704, 1, 1280, 5888, 5888, 1280, 704]
    - [23, 33968.0]
  - - [3584, 1024, 1, 256, 3584, 3584, 256, 1024]
    - [19, 31913.0]
  - - [6784, 4288, 1, 3328, 6784, 6784, 3328, 4288]
    - [15, 40259.0]
  - - [1856, 2368, 1, 3328, 1856, 1856, 3328, 2368]
    - [15, 36651.0]
  - - [5888, 2944, 1, 1280, 5888, 5888, 1280, 2944]
    - [15, 40309.0]
  - - [5888, 1024, 1, 256, 5888, 5888, 256, 1024]
    - [28, 35016.0]
  - - [1408, 2944, 1, 256, 1408, 1408, 256, 2944]
    - [3, 32471.0]
  - - [6784, 5056, 1, 3328, 6784, 6784, 3328, 5056]
    - [15, 41023.0]
  - - [5056, 5056, 1, 256, 5056, 5056, 256, 5056]
    - [19, 38003.0]
  - - [1024, 3584, 1, 1280, 1024, 1024, 1280, 3584]
    - [3, 34618.0]
  - - [2368, 2944, 1, 1280, 2368, 2368, 1280, 2944]
    - [9, 36309.0]
  - - [1408, 4288, 1, 1280, 1408, 1408, 1280, 4288]
    - [28, 36594.0]
  - - [3584, 4288, 1, 1280, 3584, 3584, 1280, 4288]
    - [3, 39399.0]
  - - [2368, 704, 1, 1280, 2368, 2368, 1280, 704]
    - [14, 29327.0]
  - - [5056, 4288, 1, 3328, 5056, 5056, 3328, 4288]
    - [5, 40430.0]
  - - [3584, 2368, 1, 3328, 3584, 3584, 3328, 2368]
    - [23, 38844.0]
  - - [6784, 448, 1, 1280, 6784, 6784, 1280, 448]
    - [15, 32119.0]
  - - [1024, 1408, 1, 3328, 1024, 1024, 3328, 1408]
    - [27, 30739.0]
  - - [4288, 2944, 1, 256, 4288, 4288, 256, 2944]
    - [9, 37300.0]
  - - [5056, 2368, 1, 1280, 5056, 5056, 1280, 2368]
    - [9, 37618.0]
  - - [448, 3584, 1, 1280, 448, 448, 1280, 3584]
    - [2, 25143.0]
  - - [6784, 5888, 1, 256, 6784, 6784, 256, 5888]
    - [25, 40740.0]
  - - [1024, 1408, 1, 256, 1024, 1024, 256, 1408]
    - [2, 26177.0]
  - - [2368, 2368, 1, 3328, 2368, 2368, 3328, 2368]
    - [3, 34834.0]
  - - [5056, 704, 1, 3328, 5056, 5056, 3328, 704]
    - [3, 33658.0]
  - - [1408, 1856, 1, 256, 1408, 1408, 256, 1856]
    - [18, 29707.0]
  - - [5888, 1856, 1, 256, 5888, 5888, 256, 1856]
    - [9, 35620.0]
  - - [704, 5888, 1, 256, 704, 704, 256, 5888]
    - [26, 30776.0]
  - - [4288, 6784, 1, 3328, 4288, 4288, 3328, 6784]
    - [23, 40245.0]
  - - [3584, 704, 1, 3328, 3584, 3584, 3328, 704]
    - [23, 32346.0]
  - - [1408, 1408, 1, 256, 1408, 1408, 256, 1408]
    - [18, 28101.0]
  - - [448, 4288, 1, 256, 448, 448, 256, 4288]
    - [16, 24178.0]
  - - [704, 2368, 1, 1280, 704, 704, 1280, 2368]
    - [14, 26189.0]
  - - [1856, 2368, 1, 1280, 1856, 1856, 1280, 2368]
    - [3, 35882.0]
  - - [1408, 1024, 1, 1280, 1408, 1408, 1280, 1024]
    - [18, 29843.0]
  - - [6784, 704, 1, 256, 6784, 6784, 256, 704]
    - [27, 30535.0]
  - - [1408, 3584, 1, 256, 1408, 1408, 256, 3584]
    - [9, 34971.0]
  - - [3584, 4288, 1, 3328, 3584, 3584, 3328, 4288]
    - [15, 39757.0]
  - - [5888, 1856, 1, 1280, 5888, 5888, 1280, 1856]
    - [19, 37527.0]
  - - [5056, 1024, 1, 3328, 5056, 5056, 3328, 1024]
    - [15, 38520.0]
  - - [2368, 3584, 1, 1280, 2368, 2368, 1280, 3584]
    - [3, 38343.0]
  - - [2944, 3584, 1, 3328, 2944, 2944, 3328, 3584]
    - [25, 41208.0]
  - - [6784, 2944, 1, 256, 6784, 6784, 256, 2944]
    - [28, 39925.0]
  - - [1024, 2368, 1, 256, 1024, 1024, 256, 2368]
    - [14, 28190.0]
  - - [4288, 2368, 1, 3328, 4288, 4288, 3328, 2368]
    - [23, 39005.0]
  - - [1856, 2368, 1, 256, 1856, 1856, 256, 2368]
    - [3, 31587.0]
  - - [3584, 6784, 1, 3328, 3584, 3584, 3328, 6784]
    - [17, 41120.0]
  - - [6784, 1856, 1, 3328, 6784, 6784, 3328, 1856]
    - [15, 38199.0]
  - - [5056, 4288, 1, 1280, 5056, 5056, 1280, 4288]
    - [17, 40027.0]
  - - [1408, 5056, 1, 1280, 1408, 1408, 1280, 5056]
    - [28, 37138.0]
  - - [6784, 5888, 1, 3328, 6784, 6784, 3328, 5888]
    - [25, 41936.0]
  - - [2368, 5056, 1, 1280, 2368, 2368, 1280, 5056]
    - [25, 37650.0]
  - - [1024, 5056, 1, 1280, 1024, 1024, 1280, 5056]
    - [23, 37666.0]
  - - [4288, 1024, 1, 256, 4288, 4288, 256, 1024]
    - [7, 32043.0]
  - - [2368, 1408, 1, 256, 2368, 2368, 256, 1408]
    - [4, 30375.0]
  - - [5888, 448, 1, 1280, 5888, 5888, 1280, 448]
    - [9, 28226.0]
  - - [704, 5888, 1, 3328, 704, 704, 3328, 5888]
    - [5, 35602.0]
  - - [1024, 6784, 1, 1280, 1024, 1024, 1280, 6784]
    - [3, 39293.0]
  - - [3584, 2944, 1, 1280, 3584, 3584, 1280, 2944]
    - [28, 40344.0]
  - - [2368, 1024, 1, 3328, 2368, 2368, 3328, 1024]
    - [23, 31007.0]
  - - [1408, 5056, 1, 3328, 1408, 1408, 3328, 5056]
    - [23, 37614.0]
  - - [1856, 1856, 1, 3328, 1856, 1856, 3328, 1856]
    - [3, 32719.0]
  - - [2368, 2368, 1, 256, 2368, 2368, 256, 2368]
    - [28, 31508.0]
  - - [4288, 4288, 1, 1280, 4288, 4288, 1280, 4288]
    - [23, 38915.0]
  - - [704, 6784, 1, 3328, 704, 704, 3328, 6784]
    - [3, 35645.0]
  - - [5888, 5888, 1, 3328, 5888, 5888, 3328, 5888]
    - [23, 41515.0]
  - - [5056, 1024, 1, 1280, 5056, 5056, 1280, 1024]
    - [19, 37143.0]
  - - [448, 5888, 1, 3328, 448, 448, 3328, 5888]
    - [13, 29602.0]
  - - [5056, 5888, 1, 1280, 5056, 5056, 1280, 5888]
    - [5, 40581.0]
  - - [448, 6784, 1, 256, 448, 448, 256, 6784]
    - [16, 28375.0]
  - - [3584, 5888, 1, 256, 3584, 3584, 256, 5888]
    - [9, 39904.0]
  - - [2944, 3584, 1, 256, 2944, 2944, 256, 3584]
    - [17, 39158.0]
  - - [6784, 2944, 1, 3328, 6784, 6784, 3328, 2944]
    - [15, 41267.0]
  - - [2944, 5056, 1, 3328, 2944, 2944, 3328, 5056]
    - [17, 40397.0]
  - - [6784, 2368, 1, 1280, 6784, 6784, 1280, 2368]
    - [23, 39725.0]
  - - [4288, 5888, 1, 1280, 4288, 4288, 1280, 5888]
    - [5, 40566.0]
  - - [4288, 4288, 1, 256, 4288, 4288, 256, 4288]
    - [19, 37298.0]
  - - [4288, 1856, 1, 1280, 4288, 4288, 1280, 1856]
    - [23, 36075.0]
  - - [1856, 2944, 1, 3328, 1856, 1856, 3328, 2944]
    - [5, 37524.0]
  - - [256, 6784, 1, 3328, 256, 256, 3328, 6784]
    - [4, 34617.0]
  - - [5056, 1024, 1, 256, 5056, 5056, 256, 1024]
    - [6, 33932.0]
  - - [1408, 1408, 1, 1280, 1408, 1408, 1280, 1408]
    - [18, 30736.0]
  - - [5056, 1856, 1, 3328, 5056, 5056, 3328, 1856]
    - [3, 38099.0]
  - - [1856, 1408, 1, 256, 1856, 1856, 256, 1408]
    - [4, 27759.0]
  - - [5056, 256, 1, 3328, 5056, 5056, 3328, 256]
    - [18, 27246.0]
  - - [5056, 3584, 1, 256, 5056, 5056, 256, 3584]
    - [9, 38548.0]
  - - [1856, 1024, 1, 1280, 1856, 1856, 1280, 1024]
    - [21, 29366.0]
  - - [1856, 1856, 1, 1280, 1856, 1856, 1280, 1856]
    - [3, 31891.0]
  - - [6784, 6784, 1, 1280, 6784, 6784, 1280, 6784]
    - [15, 41151.0]
  - - [1856, 1024, 1, 3328, 1856, 1856, 3328, 1024]
    - [1, 30624.0]
  - - [6784, 1024, 1, 256, 6784, 6784, 256, 1024]
    - [17, 37487.0]
  - - [5056, 5888, 1, 3328, 5056, 5056, 3328, 5888]
    - [17, 40791.0]
  - - [1856, 1024, 1, 256, 1856, 1856, 256, 1024]
    - [8, 24254.0]
  - - [5056, 1408, 1, 3328, 5056, 5056, 3328, 1408]
    - [28, 37458.0]
  - - [4288, 1024, 1, 3328, 4288, 4288, 3328, 1024]
    - [17, 37458.0]
  - - [2944, 1408, 1, 3328, 2944, 2944, 3328, 1408]
    - [25, 35419.0]
  - - [2944, 4288, 1, 3328, 2944, 2944, 3328, 4288]
    - [17, 40275.0]
  - - [5056, 2944, 1, 256, 5056, 5056, 256, 2944]
    - [3, 38251.0]
  - - [2368, 1856, 1, 256, 2368, 2368, 256, 1856]
    - [9, 31463.0]
  - - [1408, 3584, 1, 3328, 1408, 1408, 3328, 3584]
    - [3, 37920.0]
  - - [2368, 6784, 1, 256, 2368, 2368, 256, 6784]
    - [19, 36903.0]
  - - [5056, 1408, 1, 1280, 5056, 5056, 1280, 1408]
    - [9, 37108.0]
  - - [1408, 5888, 1, 3328, 1408, 1408, 3328, 5888]
    - [3, 38248.0]
  - - [1856, 5056, 1, 256, 1856, 1856, 256, 5056]
    - [9, 35029.0]
  - - [6784, 6784, 1, 256, 6784, 6784, 256, 6784]
    - [15, 40269.0]
  - - [2368, 4288, 1, 1280, 2368, 2368, 1280, 4288]
    - [17, 38816.0]
  - - [3584, 1856, 1, 1280, 3584, 3584, 1280, 1856]
    - [23, 37210.0]
  - - [5888, 5056, 1, 256, 5888, 5888, 256, 5056]
    - [9, 38946.0]
  - - [3584, 448, 1, 256, 3584, 3584, 256, 448]
    - [27, 25658.0]
  - - [3584, 3584, 1, 1280, 3584, 3584, 1280, 3584]
    - [25, 40889.0]
  - - [256, 6784, 1, 256, 256, 256, 256, 6784]
    - [16, 29522.0]
  - - [1856, 3584, 1, 3328, 1856, 1856, 3328, 3584]
    - [25, 38421.0]
  - - [5056, 256, 1, 1280, 5056, 5056, 1280, 256]
    - [8, 26381.0]
  - - [3584, 3584, 1, 256, 3584, 3584, 256, 3584]
    - [19, 38952.0]
  - - [6784, 4288, 1, 1280, 6784, 6784, 1280, 4288]
    - [23, 40095.0]
  - - [704, 5056, 1, 256, 704, 704, 256, 5056]
    - [29, 28565.0]
  - - [2944, 2368, 1, 1280, 2944, 2944, 1280, 2368]
    - [23, 36389.0]
  - - [6784, 3584, 1, 256, 6784, 6784, 256, 3584]
    - [25, 40013.0]
  - - [704, 6784, 1, 256, 704, 704, 256, 6784]
    - [12, 30766.0]
  - - [1024, 3584, 1, 3328, 1024, 1024, 3328, 3584]
    - [3, 35150.0]
  - - [2944, 2944, 1, 3328, 2944, 2944, 3328, 2944]
    - [15, 39880.0]
  - - [5056, 6784, 1, 256, 5056, 5056, 256, 6784]
    - [28, 39510.0]
  - - [1408, 4288, 1, 3328, 1408, 1408, 3328, 4288]
    - [15, 37304.0]
  - - [6784, 256, 1, 1280, 6784, 6784, 1280, 256]
    - [24, 33753.0]
  - - [2368, 704, 1, 3328, 2368, 2368, 3328, 704]
    - [14, 30215.0]
  - - [3584, 6784, 1, 256, 3584, 3584, 256, 6784]
    - [28, 39706.0]
  - - [5056, 1856, 1, 256, 5056, 5056, 256, 1856]
    - [28, 35060.0]
  - - [704, 4288, 1, 256, 704, 704, 256, 4288]
    - [24, 27502.0]
  - - [1408, 6784, 1, 1280, 1408, 1408, 1280, 6784]
    - [3, 38735.0]
  - - [5056, 2368, 1, 3328, 5056, 5056, 3328, 2368]
    - [3, 37934.0]
  - - [2944, 4288, 1, 256, 2944, 2944, 256, 4288]
    - [19, 37138.0]
  - - [1408, 3584, 1, 1280, 1408, 1408, 1280, 3584]
    - [3, 37501.0]
  - - [1024, 1408, 1, 1280, 1024, 1024, 1280, 1408]
    - [2, 30224.0]
  - - [2368, 6784, 1, 3328, 2368, 2368, 3328, 6784]
    - [23, 40082.0]
  - - [5056, 704, 1, 1280, 5056, 5056, 1280, 704]
    - [19, 32792.0]
  - - [1856, 4288, 1, 3328, 1856, 1856, 3328, 4288]
    - [3, 36600.0]
  - - [1408, 5888, 1, 256, 1408, 1408, 256, 5888]
    - [3, 36504.0]
  - - [3584, 704, 1, 1280, 3584, 3584, 1280, 704]
    - [28, 31374.0]
  - - [3584, 448, 1, 3328, 3584, 3584, 3328, 448]
    - [22, 28649.0]
  - - [704, 2368, 1, 3328, 704, 704, 3328, 2368]
    - [21, 26948.0]
  - - [448, 5056, 1, 3328, 448, 448, 3328, 5056]
    - [3, 29074.0]
  - - [4288, 448, 1, 256, 4288, 4288, 256, 448]
    - [18, 25091.0]
  - - [448, 5888, 1, 256, 448, 448, 256, 5888]
    - [0, 25443.0]
  - - [5888, 2368, 1, 256, 5888, 5888, 256, 2368]
    - [9, 36661.0]
  - - [6784, 704, 1, 3328, 6784, 6784, 3328, 704]
    - [15, 35572.0]
  - - [1408, 2944, 1, 3328, 1408, 1408, 3328, 2944]
    - [17, 35366.0]
  - - [2368, 704, 1, 256, 2368, 2368, 256, 704]
    - [8, 24415.0]
  - - [3584, 2368, 1, 256, 3584, 3584, 256, 2368]
    - [19, 35420.0]
  - - [5888, 5056, 1, 1280, 5888, 5888, 1280, 5056]
    - [17, 40434.0]
  - - [3584, 3584, 1, 3328, 3584, 3584, 3328, 3584]
    - [25, 41233.0]
  - - [5888, 6784, 1, 256, 5888, 5888, 256, 6784]
    - [19, 40630.0]
  - - [4288, 2944, 1, 3328, 4288, 4288, 3328, 2944]
    - [23, 39892.0]
  - - [4288, 704, 1, 1280, 4288, 4288, 1280, 704]
    - [13, 32432.0]
  - - [256, 5056, 1, 1280, 256, 256, 1280, 5056]
    - [14, 27294.0]
  - - [6784, 5888, 1, 1280, 6784, 6784, 1280, 5888]
    - [25, 41821.0]
  - - [5888, 4288, 1, 1280, 5888, 5888, 1280, 4288]
    - [5, 40329.0]
  - - [3584, 1024, 1, 3328, 3584, 3584, 3328, 1024]
    - [15, 35041.0]
  - - [1408, 1856, 1, 1280, 1408, 1408, 1280, 1856]
    - [15, 32206.0]
  - - [5888, 448, 1, 3328, 5888, 5888, 3328, 448]
    - [30, 29018.0]
  - - [704, 5888, 1, 1280, 704, 704, 1280, 5888]
    - [5, 34870.0]
  - - [1024, 6784, 1, 3328, 1024, 1024, 3328, 6784]
    - [5, 39980.0]
  - - [704, 2944, 1, 1280, 704, 704, 1280, 2944]
    - [13, 31748.0]
  - - [5056, 2944, 1, 3328, 5056, 5056, 3328, 2944]
    - [3, 39961.0]
  - - [1408, 1408, 1, 3328, 1408, 1408, 3328, 1408]
    - [21, 32015.0]
  - - [448, 4288, 1, 1280, 448, 448, 1280, 4288]
    - [13, 29434.0]
  - - [3584, 704, 1, 256, 3584, 3584, 256, 704]
    - [18, 28887.0]
  - - [3584, 1408, 1, 3328, 3584, 3584, 3328, 1408]
    - [3, 37867.0]
  - - [2368, 1024, 1, 1280, 2368, 2368, 1280, 1024]
    - [3, 30151.0]
  - - [1856, 6784, 1, 256, 1856, 1856, 256, 6784]
    - [9, 36479.0]
  - - [4288, 448, 1, 3328, 4288, 4288, 3328, 448]
    - [17, 30444.0]
  - - [4288, 3584, 1, 1280, 4288, 4288, 1280, 3584]
    - [3, 39459.0]
  - - [5888, 1024, 1, 3328, 5888, 5888, 3328, 1024]
    - [23, 37452.0]
  - - [704, 6784, 1, 1280, 704, 704, 1280, 6784]
    - [28, 34980.0]
  - - [1024, 2944, 1, 3328, 1024, 1024, 3328, 2944]
    - [25, 33608.0]
  - - [704, 5056, 1, 1280, 704, 704, 1280, 5056]
    - [23, 32796.0]
  - - [1024, 5888, 1, 1280, 1024, 1024, 1280, 5888]
    - [3, 37168.0]
  - - [2944, 1856, 1, 256, 2944, 2944, 256, 1856]
    - [9, 32365.0]
  - - [3584, 5056, 1, 256, 3584, 3584, 256, 5056]
    - [28, 37881.0]
  - - [5888, 5056, 1, 3328, 5888, 5888, 3328, 5056]
    - [17, 40768.0]
  - - [3584, 6784, 1, 1280, 3584, 3584, 1280, 6784]
    - [17, 40748.0]
  - - [4288, 1856, 1, 256, 4288, 4288, 256, 1856]
    - [15, 33378.0]
  - - [1856, 5888, 1, 256, 1856, 1856, 256, 5888]
    - [1, 35638.0]
  - - [4288, 4288, 1, 3328, 4288, 4288, 3328, 4288]
    - [23, 39150.0]
  - - [4288, 1408, 1, 1280, 4288, 4288, 1280, 1408]
    - [3, 36653.0]
  - - [4288, 2368, 1, 256, 4288, 4288, 256, 2368]
    - [3, 35032.0]
  - - [2944, 5056, 1, 1280, 2944, 2944, 1280, 5056]
    - [17, 39881.0]
  - - [6784, 2368, 1, 3328, 6784, 6784, 3328, 2368]
    - [23, 40086.0]
  - - [4288, 1856, 1, 3328, 4288, 4288, 3328, 1856]
    - [23, 36535.0]
  - - [1856, 2944, 1, 1280, 1856, 1856, 1280, 2944]
    - [5, 36572.0]
  - - [3584, 1024, 1, 1280, 3584, 3584, 1280, 1024]
    - [28, 34607.0]
  - - [1024, 4288, 1, 256, 1024, 1024, 256, 4288]
    - [2, 31771.0]
  - - [5888, 3584, 1, 3328, 5888, 5888, 3328, 3584]
    - [25, 41654.0]
  - - [5056, 3584, 1, 3328, 5056, 5056, 3328, 3584]
    - [25, 40179.0]
  - - [2368, 1408, 1, 1280, 2368, 2368, 1280, 1408]
    - [3, 35050.0]
  - - [5056, 2944, 1, 1280, 5056, 5056, 1280, 2944]
    - [9, 39628.0]
  - - [1024, 6784, 1, 256, 1024, 1024, 256, 6784]
    - [28, 37158.0]
  - - [3584, 2944, 1, 256, 3584, 3584, 256, 2944]
    - [28, 38643.0]
  - - [3584, 1408, 1, 1280, 3584, 3584, 1280, 1408]
    - [3, 37414.0]
  - - [5056, 6784, 1, 3328, 5056, 5056, 3328, 6784]
    - [23, 41038.0]
  - - [3584, 4288, 1, 256, 3584, 3584, 256, 4288]
    - [3, 35942.0]
  - - [1856, 6784, 1, 3328, 1856, 1856, 3328, 6784]
    - [23, 38170.0]
  - - [5056, 1408, 1, 256, 5056, 5056, 256, 1408]
    - [9, 35318.0]
  - - [5888, 5888, 1, 256, 5888, 5888, 256, 5888]
    - [9, 40563.0]
  - - [4288, 1024, 1, 1280, 4288, 4288, 1280, 1024]
    - [7, 36482.0]
  - - [448, 6784, 1, 3328, 448, 448, 3328, 6784]
    - [25, 33864.0]
  - - [2944, 1408, 1, 1280, 2944, 2944, 1280, 1408]
    - [3, 34624.0]
  - - [2944, 1856, 1, 3328, 2944, 2944, 3328, 1856]
    - [3, 36918.0]
  - - [3584, 5888, 1, 1280, 3584, 3584, 1280, 5888]
    - [17, 41431.0]
  - - [6784, 1856, 1, 1280, 6784, 6784, 1280, 1856]
    - [15, 37916.0]
  - - [5888, 256, 1, 3328, 5888, 5888, 3328, 256]
    - [19, 30432.0]
  - - [1856, 5888, 1, 3328, 1856, 1856, 3328, 5888]
    - [5, 38447.0]
  - - [3584, 1408, 1, 256, 3584, 3584, 256, 1408]
    - [19, 34915.0]
  - - [704, 3584, 1, 3328, 704, 704, 3328, 3584]
    - [15, 32451.0]
  - - [5056, 448, 1, 1280, 5056, 5056, 1280, 448]
    - [27, 30385.0]
  - - [4288, 704, 1, 256, 4288, 4288, 256, 704]
    - [27, 27307.0]
  - - [2944, 1024, 1, 256, 2944, 2944, 256, 1024]
    - [21, 30100.0]
  - - [2368, 4288, 1, 3328, 2368, 2368, 3328, 4288]
    - [5, 39492.0]
  - - [6784, 5056, 1, 256, 6784, 6784, 256, 5056]
    - [15, 39539.0]
  - - [3584, 5056, 1, 3328, 3584, 3584, 3328, 5056]
    - [25, 40112.0]
  - - [4288, 5888, 1, 256, 4288, 4288, 256, 5888]
    - [11, 39445.0]
  - - [2944, 6784, 1, 256, 2944, 2944, 256, 6784]
    - [3, 40044.0]
  - - [2368, 2368, 1, 1280, 2368, 2368, 1280, 2368]
    - [23, 34156.0]
  - - [1856, 3584, 1, 1280, 1856, 1856, 1280, 3584]
    - [7, 37805.0]
  - - [5056, 3584, 1, 1280, 5056, 5056, 1280, 3584]
    - [17, 39832.0]
  - - [256, 5888, 1, 256, 256, 256, 256, 5888]
    - [24, 25898.0]
  - - [1856, 1408, 1, 3328, 1856, 1856, 3328, 1408]
    - [15, 33470.0]
  - - [1024, 4288, 1, 3328, 1024, 1024, 3328, 4288]
    - [5, 37166.0]
  - - [2944, 2368, 1, 3328, 2944, 2944, 3328, 2368]
    - [3, 36751.0]
  - - [1024, 1856, 1, 1280, 1024, 1024, 1280, 1856]
    - [2, 29783.0]
  - - [6784, 1856, 1, 256, 6784, 6784, 256, 1856]
    - [15, 36152.0]
  - - [1024, 5888, 1, 256, 1024, 1024, 256, 5888]
    - [19, 35128.0]
  - - [1408, 2368, 1, 256, 1408, 1408, 256, 2368]
    - [24, 30118.0]
  - - [2944, 704, 1, 3328, 2944, 2944, 3328, 704]
    - [17, 33117.0]
  - - [2944, 2944, 1, 1280, 2944, 2944, 1280, 2944]
    - [3, 39553.0]
  - - [6784, 256, 1, 3328, 6784, 6784, 3328, 256]
    - [16, 34494.0]
  - - [1408, 5056, 1, 256, 1408, 1408, 256, 5056]
    - [28, 34846.0]
  - - [5056, 256, 1, 256, 5056, 5056, 256, 256]
    - [8, 21377.0]
  - - [1408, 4288, 1, 256, 1408, 1408, 256, 4288]
    - [3, 33096.0]
  - - [5888, 2368, 1, 1280, 5888, 5888, 1280, 2368]
    - [23, 38643.0]
  - - [2368, 5888, 1, 1280, 2368, 2368, 1280, 5888]
    - [3, 38653.0]
  - - [5888, 256, 1, 1280, 5888, 5888, 1280, 256]
    - [10, 29402.0]
  - - [2368, 1856, 1, 3328, 2368, 2368, 3328, 1856]
    - [3, 36708.0]
  - - [2944, 704, 1, 256, 2944, 2944, 256, 704]
    - [8, 26450.0]
  - - [2368, 6784, 1, 1280, 2368, 2368, 1280, 6784]
    - [23, 39681.0]
  - - [1856, 4288, 1, 1280, 1856, 1856, 1280, 4288]
    - [3, 36075.0]
  - - [704, 3584, 1, 256, 704, 704, 256, 3584]
    - [4, 27722.0]
  - - [704, 2944, 1, 3328, 704, 704, 3328, 2944]
    - [1, 33241.0]
  - - [1856, 5056, 1, 3328, 1856, 1856, 3328, 5056]
    - [3, 38134.0]
  - - [3584, 5056, 1, 1280, 3584, 3584, 1280, 5056]
    - [17, 39592.0]
  - - [2944, 1024, 1, 3328, 2944, 2944, 3328, 1024]
    - [5, 34102.0]
  - - [1408, 6784, 1, 256, 1408, 1408, 256, 6784]
    - [3, 37253.0]
  - - [6784, 1408, 1, 3328, 6784, 6784, 3328, 1408]
    - [15, 38957.0]
  - - [1024, 2368, 1, 1280, 1024, 1024, 1280, 2368]
    - [28, 30070.0]
  - - [6784, 2944, 1, 1280, 6784, 6784, 1280, 2944]
    - [23, 41050.0]
  - - [3584, 448, 1, 1280, 3584, 3584, 1280, 448]
    - [27, 28138.0]
  - - [2944, 6784, 1, 3328, 2944, 2944, 3328, 6784]
    - [3, 41255.0]
  - - [448, 5056, 1, 1280, 448, 448, 1280, 5056]
    - [23, 28023.0]
  - - [5888, 704, 1, 256, 5888, 5888, 256, 704]
    - [28, 29959.0]
  - - [256, 5888, 1, 3328, 256, 256, 3328, 5888]
    - [3, 30576.0]
  - - [6784, 4288, 1, 256, 6784, 6784, 256, 4288]
    - [3, 38993.0]
  - - [5888, 256, 1, 256, 5888, 5888, 256, 256]
    - [29, 25487.0]
  - - [6784, 1024, 1, 1280, 6784, 6784, 1280, 1024]
    - [17, 39856.0]
  - - [2944, 704, 1, 1280, 2944, 2944, 1280, 704]
    - [20, 31284.0]
  - - [6784, 3584, 1, 1280, 6784, 6784, 1280, 3584]
    - [17, 41061.0]
  - - [1408, 2944, 1, 1280, 1408, 1408, 1280, 2944]
    - [3, 34678.0]
  - - [1408, 2368, 1, 3328, 1408, 1408, 3328, 2368]
    - [15, 36141.0]
  - - [1024, 3584, 1, 256, 1024, 1024, 256, 3584]
    - [3, 32000.0]
  - - [2368, 2944, 1, 256, 2368, 2368, 256, 2944]
    - [9, 33534.0]
  - - [2944, 5888, 1, 256, 2944, 2944, 256, 5888]
    - [5, 39515.0]
  - - [3584, 1856, 1, 256, 3584, 3584, 256, 1856]
    - [28, 33787.0]
  - - [704, 4288, 1, 3328, 704, 704, 3328, 4288]
    - [13, 33665.0]
  - - [4288, 2944, 1, 1280, 4288, 4288, 1280, 2944]
    - [3, 39405.0]
  - - [4288, 5056, 1, 3328, 4288, 4288, 3328, 5056]
    - [17, 40484.0]
  - - [256, 5056, 1, 3328, 256, 256, 3328, 5056]
    - [14, 27837.0]
  - - [5056, 2368, 1, 256, 5056, 5056, 256, 2368]
    - [3, 35548.0]
  - - [4288, 704, 1, 3328, 4288, 4288, 3328, 704]
    - [25, 33580.0]
  - - [448, 3584, 1, 256, 448, 448, 256, 3584]
    - [14, 22412.0]
  - - [2944, 5888, 1, 1280, 2944, 2944, 1280, 5888]
    - [17, 40824.0]
  - - [5888, 3584, 1, 256, 5888, 5888, 256, 3584]
    - [25, 40088.0]
  - - [1408, 1856, 1, 3328, 1408, 1408, 3328, 1856]
    - [3, 33398.0]
  - - [6784, 1408, 1, 1280, 6784, 6784, 1280, 1408]
    - [23, 38640.0]
  - - [704, 2944, 1, 256, 704, 704, 256, 2944]
    - [4, 27209.0]
  - - [2944, 5888, 1, 3328, 2944, 2944, 3328, 5888]
    - [17, 41030.0]
  - - [1408, 6784, 1, 3328, 1408, 1408, 3328, 6784]
    - [3, 38985.0]
  - - [448, 4288, 1, 3328, 448, 448, 3328, 4288]
    - [13, 30921.0]
  - - [704, 2368, 1, 256, 704, 704, 256, 2368]
    - [14, 23552.0]
  - - [5888, 2368, 1, 3328, 5888, 5888, 3328, 2368]
    - [15, 38957.0]
  - - [4288, 5056, 1, 256, 4288, 4288, 256, 5056]
    - [19, 38255.0]
  - - [4288, 448, 1, 1280, 4288, 4288, 1280, 448]
    - [9, 28276.0]
  - - [5888, 704, 1, 3328, 5888, 5888, 3328, 704]
    - [17, 35215.0]
  - - [4288, 3584, 1, 3328, 4288, 4288, 3328, 3584]
    - [15, 39785.0]
  - - [6784, 6784, 1, 3328, 6784, 6784, 3328, 6784]
    - [23, 41273.0]
  - - [704, 5056, 1, 3328, 704, 704, 3328, 5056]
    - [23, 33463.0]
  - - [2368, 2944, 1, 3328, 2368, 2368, 3328, 2944]
    - [23, 36768.0]
  - - [2368, 3584, 1, 256, 2368, 2368, 256, 3584]
    - [7, 34774.0]
  - - [3584, 2368, 1, 1280, 3584, 3584, 1280, 2368]
    - [15, 38305.0]
  - - [1856, 1856, 1, 256, 1856, 1856, 256, 1856]
    - [27, 27819.0]
  - - [4288, 1408, 1, 3328, 4288, 4288, 3328, 1408]
    - [3, 37236.0]
  - - [4288, 5056, 1, 1280, 4288, 4288, 1280, 5056]
    - [11, 40041.0]
  - - [5888, 6784, 1, 1280, 5888, 5888, 1280, 6784]
    - [15, 41404.0]
  - - [5888, 1408, 1, 3328, 5888, 5888, 3328, 1408]
    - [23, 38151.0]
  - - [256, 5056, 1, 256, 256, 256, 256, 5056]
    - [2, 23941.0]
  - - [1408, 1024, 1, 256, 1408, 1408, 256, 1024]
    - [18, 26103.0]
  - - [2368, 5056, 1, 256, 2368, 2368, 256, 5056]
    - [3, 35548.0]
  - - [1024, 5056, 1, 256, 1024, 1024, 256, 5056]
    - [28, 33102.0]
  - - [2368, 1408, 1, 3328, 2368, 2368, 3328, 1408]
    - [3, 36186.0]
  - - [5888, 448, 1, 256, 5888, 5888, 256, 448]
    - [27, 27163.0]
  - - [6784, 5056, 1, 1280, 6784, 6784, 1280, 5056]
    - [15, 40852.0]
  - - [4288, 6784, 1, 1280, 4288, 4288, 1280, 6784]
    - [3, 40015.0]
  - - [6784, 1408, 1, 256, 6784, 6784, 256, 1408]
    - [9, 37117.0]
  - - [5888, 4288, 1, 256, 5888, 5888, 256, 4288]
    - [9, 38657.0]
  - - [5056, 5888, 1, 256, 5056, 5056, 256, 5888]
    - [3, 39102.0]
  - - [2368, 1024, 1, 256, 2368, 2368, 256, 1024]
    - [8, 26126.0]
  - - [1856, 6784, 1, 1280, 1856, 1856, 1280, 6784]
    - [3, 38013.0]
  - - [4288, 3584, 1, 256, 4288, 4288, 256, 3584]
    - [9, 37483.0]
  - - [5056, 1856, 1, 1280, 5056, 5056, 1280, 1856]
    - [19, 37651.0]
  - - [1408, 1024, 1, 3328, 1408, 1408, 3328, 1024]
    - [27, 30676.0]
  - - [5888, 3584, 1, 1280, 5888, 5888, 1280, 3584]
    - [25, 41474.0]
  - - [1024, 2944, 1, 256, 1024, 1024, 256, 2944]
    - [3, 29867.0]
  - - [448, 6784, 1, 1280, 448, 448, 1280, 6784]
    - [21, 32845.0]
  - - [2944, 1856, 1, 1280, 2944, 2944, 1280, 1856]
    - [23, 36216.0]
  - - [2368, 3584, 1, 3328, 2368, 2368, 3328, 3584]
    - [15, 38896.0]
  - - [3584, 5888, 1, 3328, 3584, 3584, 3328, 5888]
    - [25, 41583.0]
  - - [2944, 3584, 1, 1280, 2944, 2944, 1280, 3584]
    - [5, 40887.0]
  - - [1856, 5888, 1, 1280, 1856, 1856, 1280, 5888]
    - [17, 38015.0]
  - - [5056, 448, 1, 3328, 5056, 5056, 3328, 448]
    - [22, 29708.0]
  - - [4288, 1408, 1, 256, 4288, 4288, 256, 1408]
    - [9, 33239.0]
  - - [4288, 2368, 1, 1280, 4288, 4288, 1280, 2368]
    - [15, 38517.0]
  - - [2944, 5056, 1, 256, 2944, 2944, 256, 5056]
    - [28, 37885.0]
  - - [6784, 2368, 1, 256, 6784, 6784, 256, 2368]
    - [28, 37785.0]
  - - [1856, 2944, 1, 256, 1856, 1856, 256, 2944]
    - [3, 32606.0]
  - - [1856, 1408, 1, 1280, 1856, 1856, 1280, 1408]
    - [3, 32368.0]
  - - [1024, 4288, 1, 1280, 1024, 1024, 1280, 4288]
    - [3, 35717.0]
  - - [2368, 5056, 1, 3328, 2368, 2368, 3328, 5056]
    - [17, 38358.0]
  - - [1024, 1856, 1, 3328, 1024, 1024, 3328, 1856]
    - [21, 30494.0]
  - - [704, 3584, 1, 1280, 704, 704, 1280, 3584]
    - [3, 31484.0]
  - - [4288, 6784, 1, 256, 4288, 4288, 256, 6784]
    - [9, 39232.0]
  - - [3584, 2944, 1, 3328, 3584, 3584, 3328, 2944]
    - [3, 40644.0]
  - - [5888, 2944, 1, 256, 5888, 5888, 256, 2944]
    - [19, 39208.0]
  - - [5056, 4288, 1, 256, 5056, 5056, 256, 4288]
    - [28, 38324.0]
  - - [6784, 1024, 1, 3328, 6784, 6784, 3328, 1024]
    - [17, 40229.0]
  - - [5888, 5888, 1, 1280, 5888, 5888, 1280, 5888]
    - [28, 41280.0]
  - - [448, 5888, 1, 1280, 448, 448, 1280, 5888]
    - [1, 28648.0]
  - - [2944, 1408, 1, 256, 2944, 2944, 256, 1408]
    - [3, 32412.0]
  - - [1024, 2944, 1, 1280, 1024, 1024, 1280, 2944]
    - [3, 32746.0]
  - - [2368, 5888, 1, 3328, 2368, 2368, 3328, 5888]
    - [15, 38943.0]
  - - [2368, 1856, 1, 1280, 2368, 2368, 1280, 1856]
    - [3, 35814.0]
  - - [5888, 4288, 1, 3328, 5888, 5888, 3328, 4288]
    - [20, 40676.0]
  - - [6784, 704, 1, 1280, 6784, 6784, 1280, 704]
    - [15, 34825.0]
  - - [5056, 448, 1, 256, 5056, 5056, 256, 448]
    - [18, 27020.0]
  - - [1856, 5056, 1, 1280, 1856, 1856, 1280, 5056]
    - [3, 37679.0]
  - - [2944, 1024, 1, 1280, 2944, 2944, 1280, 1024]
    - [17, 33537.0]
  - - [2368, 4288, 1, 256, 2368, 2368, 256, 4288]
    - [19, 35165.0]
  - - [1024, 2368, 1, 3328, 1024, 1024, 3328, 2368]
    - [15, 31143.0]
  - - [4288, 5888, 1, 3328, 4288, 4288, 3328, 5888]
    - [25, 40821.0]
  - - [2944, 6784, 1, 1280, 2944, 2944, 1280, 6784]
    - [23, 41053.0]
  - - [256, 6784, 1, 1280, 256, 256, 1280, 6784]
    - [24, 33876.0]
  - - [1856, 3584, 1, 256, 1856, 1856, 256, 3584]
    - [5, 34653.0]
  - - [256, 5888, 1, 1280, 256, 256, 1280, 5888]
    - [24, 29610.0]
  - - [2944, 2368, 1, 256, 2944, 2944, 256, 2368]
    - [28, 33483.0]
  - - [1024, 1856, 1, 256, 1024, 1024, 256, 1856]
    - [2, 27272.0]
  - - [6784, 3584, 1, 3328, 6784, 6784, 3328, 3584]
    - [5, 41150.0]
  - - [1024, 5888, 1, 3328, 1024, 1024, 3328, 5888]
    - [19, 37373.0]
  - - [1408, 2368, 1, 1280, 1408, 1408, 1280, 2368]
    - [15, 35067.0]
  - - [2944, 2944, 1, 256, 2944, 2944, 256, 2944]
    - [19, 37812.0]
  - - [6784, 256, 1, 256, 6784, 6784, 256, 256]
    - [10, 29443.0]
  - - [5888, 1408, 1, 256, 5888, 5888, 256, 1408]
    - [9, 36354.0]
  - - [5888, 6784, 1, 3328, 5888, 5888, 3328, 6784]
    - [15, 41540.0]
  - - [704, 4288, 1, 1280, 704, 704, 1280, 4288]
    - [13, 32373.0]
  - - [6784, 448, 1, 3328, 6784, 6784, 3328, 448]
    - [25, 33421.0]
  - - [1024, 1024, 1, 3328, 1024, 1024, 3328, 1024]
    - [41, 30419.0]
  - - [64, 6784, 1, 256, 64, 64, 256, 6784]
    - [31, 11875.0]
  - - [128, 6784, 1, 3328, 128, 128, 3328, 6784]
    - [48, 25332.0]
  - - [256, 4288, 1, 3328, 256, 256, 3328, 4288]
    - [33, 31353.0]
  - - [704, 1856, 1, 3328, 704, 704, 3328, 1856]
    - [40, 27708.0]
  - - [448, 1024, 1, 1280, 448, 448, 1280, 1024]
    - [31, 19534.0]
  - - [2368, 128, 1, 256, 2368, 2368, 256, 128]
    - [34, 9371.0]
  - - [256, 1856, 1, 1280, 256, 256, 1280, 1856]
    - [31, 20232.0]
  - - [448, 704, 1, 1280, 448, 448, 1280, 704]
    - [31, 14155.0]
  - - [128, 3584, 1, 1280, 128, 128, 1280, 3584]
    - [37, 20207.0]
  - - [4288, 256, 1, 256, 4288, 4288, 256, 256]
    - [39, 21751.0]
  - - [5888, 64, 1, 3328, 5888, 5888, 3328, 64]
    - [43, 17860.0]
  - - [2944, 256, 1, 3328, 2944, 2944, 3328, 256]
    - [47, 25228.0]
  - - [256, 4288, 1, 1280, 256, 256, 1280, 4288]
    - [37, 29079.0]
  - - [1408, 448, 1, 1280, 1408, 1408, 1280, 448]
    - [46, 20472.0]
  - - [6784, 128, 1, 1280, 6784, 6784, 1280, 128]
    - [37, 24079.0]
  - - [2368, 128, 1, 3328, 2368, 2368, 3328, 128]
    - [41, 14847.0]
  - - [2944, 128, 1, 256, 2944, 2944, 256, 128]
    - [49, 11063.0]
  - - [448, 1408, 1, 256, 448, 448, 256, 1408]
    - [39, 15205.0]
  - - [64, 5056, 1, 3328, 64, 64, 3328, 5056]
    - [39, 15662.0]
  - - [2368, 256, 1, 1280, 2368, 2368, 1280, 256]
    - [39, 19795.0]
  - - [256, 3584, 1, 3328, 256, 256, 3328, 3584]
    - [48, 26705.0]
  - - [5056, 64, 1, 1280, 5056, 5056, 1280, 64]
    - [43, 14136.0]
  - - [1024, 704, 1, 256, 1024, 1024, 256, 704]
    - [46, 16962.0]
  - - [4288, 128, 1, 1280, 4288, 4288, 1280, 128]
    - [44, 23019.0]
  - - [5888, 64, 1, 256, 5888, 5888, 256, 64]
    - [42, 10440.0]
  - - [1856, 256, 1, 1280, 1856, 1856, 1280, 256]
    - [46, 20245.0]
  - - [64, 5888, 1, 3328, 64, 64, 3328, 5888]
    - [31, 18324.0]
  - - [256, 1408, 1, 3328, 256, 256, 3328, 1408]
    - [41, 17958.0]
  - - [6784, 128, 1, 3328, 6784, 6784, 3328, 128]
    - [48, 25248.0]
  - - [704, 704, 1, 3328, 704, 704, 3328, 704]
    - [41, 23911.0]
  - - [3584, 256, 1, 3328, 3584, 3584, 3328, 256]
    - [41, 26654.0]
  - - [128, 3584, 1, 3328, 128, 128, 3328, 3584]
    - [37, 22719.0]
  - - [128, 2944, 1, 1280, 128, 128, 1280, 2944]
    - [31, 16842.0]
  - - [448, 1856, 1, 1280, 448, 448, 1280, 1856]
    - [46, 26137.0]
  - - [3584, 128, 1, 256, 3584, 3584, 256, 128]
    - [34, 13285.0]
  - - [448, 1408, 1, 3328, 448, 448, 3328, 1408]
    - [46, 21673.0]
  - - [256, 3584, 1, 256, 256, 256, 256, 3584]
    - [34, 19738.0]
  - - [256, 2944, 1, 3328, 256, 256, 3328, 2944]
    - [40, 25304.0]
  - - [1408, 704, 1, 256, 1408, 1408, 256, 704]
    - [39, 19887.0]
  - - [448, 2944, 1, 3328, 448, 448, 3328, 2944]
    - [39, 27872.0]
  - - [64, 5888, 1, 256, 64, 64, 256, 5888]
    - [34, 10601.0]
  - - [448, 2368, 1, 1280, 448, 448, 1280, 2368]
    - [31, 26144.0]
  - - [128, 4288, 1, 3328, 128, 128, 3328, 4288]
    - [37, 26404.0]
  - - [256, 2368, 1, 256, 256, 256, 256, 2368]
    - [34, 15155.0]
  - - [1024, 448, 1, 3328, 1024, 1024, 3328, 448]
    - [51, 22120.0]
  - - [1856, 704, 1, 1280, 1856, 1856, 1280, 704]
    - [46, 26820.0]
  - - [1024, 1024, 1, 1280, 1024, 1024, 1280, 1024]
    - [41, 29014.0]
  - - [256, 2944, 1, 256, 256, 256, 256, 2944]
    - [49, 18516.0]
  - - [128, 6784, 1, 1280, 128, 128, 1280, 6784]
    - [41, 24184.0]
  - - [1408, 704, 1, 3328, 1408, 1408, 3328, 704]
    - [48, 28468.0]
  - - [128, 5888, 1, 1280, 128, 128, 1280, 5888]
    - [32, 23997.0]
  - - [704, 1408, 1, 3328, 704, 704, 3328, 1408]
    - [33, 28512.0]
  - - [6784, 128, 1, 256, 6784, 6784, 256, 128]
    - [37, 18162.0]
  - - [704, 448, 1, 256, 704, 704, 256, 448]
    - [34, 9031.0]
  - - [256, 1856, 1, 3328, 256, 256, 3328, 1856]
    - [48, 23044.0]
  - - [128, 4288, 1, 256, 128, 128, 256, 4288]
    - [36, 14980.0]
  - - [64, 6784, 1, 3328, 64, 64, 3328, 6784]
    - [46, 20147.0]
  - - [2944, 256, 1, 1280, 2944, 2944, 1280, 256]
    - [47, 23950.0]
  - - [1856, 704, 1, 256, 1856, 1856, 256, 704]
    - [39, 22632.0]
  - - [1408, 448, 1, 3328, 1408, 1408, 3328, 448]
    - [39, 21642.0]
  - - [2368, 256, 1, 256, 2368, 2368, 256, 256]
    - [46, 14668.0]
  - - [704, 1856, 1, 256, 704, 704, 256, 1856]
    - [46, 22755.0]
  - - [5888, 64, 1, 1280, 5888, 5888, 1280, 64]
    - [35, 16428.0]
  - - [256, 2368, 1, 1280, 256, 256, 1280, 2368]
    - [39, 19805.0]
  - - [2944, 448, 1, 256, 2944, 2944, 256, 448]
    - [43, 22783.0]
  - - [2368, 128, 1, 1280, 2368, 2368, 1280, 128]
    - [31, 13556.0]
  - - [64, 5056, 1, 1280, 64, 64, 1280, 5056]
    - [43, 14332.0]
  - - [704, 448, 1, 3328, 704, 704, 3328, 448]
    - [41, 15431.0]
  - - [5056, 64, 1, 3328, 5056, 5056, 3328, 64]
    - [43, 15446.0]
  - - [2368, 448, 1, 1280, 2368, 2368, 1280, 448]
    - [39, 26104.0]
  - - [1408, 256, 1, 1280, 1408, 1408, 1280, 256]
    - [39, 16121.0]
  - - [1856, 448, 1, 3328, 1856, 1856, 3328, 448]
    - [46, 27512.0]
  - - [128, 5056, 1, 256, 128, 128, 256, 5056]
    - [31, 15426.0]
  - - [4288, 256, 1, 1280, 4288, 4288, 1280, 256]
    - [41, 28840.0]
  - - [704, 704, 1, 256, 704, 704, 256, 704]
    - [31, 13613.0]
  - - [4288, 128, 1, 3328, 4288, 4288, 3328, 128]
    - [48, 26457.0]
  - - [256, 1408, 1, 1280, 256, 256, 1280, 1408]
    - [31, 16143.0]
  - - [6784, 64, 1, 3328, 6784, 6784, 3328, 64]
    - [43, 19854.0]
  - - [128, 2944, 1, 3328, 128, 128, 3328, 2944]
    - [37, 18740.0]
  - - [2944, 448, 1, 3328, 2944, 2944, 3328, 448]
    - [39, 27848.0]
  - - [2368, 448, 1, 3328, 2368, 2368, 3328, 448]
    - [46, 27091.0]
  - - [5056, 64, 1, 256, 5056, 5056, 256, 64]
    - [49, 9287.0]
  - - [128, 5056, 1, 3328, 128, 128, 3328, 5056]
    - [39, 22231.0]
  - - [6784, 64, 1, 256, 6784, 6784, 256, 64]
    - [43, 11774.0]
  - - [128, 2368, 1, 256, 128, 128, 256, 2368]
    - [34, 8453.0]
  - - [3584, 256, 1, 256, 3584, 3584, 256, 256]
    - [41, 19003.0]
  - - [128, 2944, 1, 256, 128, 128, 256, 2944]
    - [34, 10486.0]
  - - [3584, 128, 1, 3328, 3584, 3584, 3328, 128]
    - [37, 22458.0]
  - - [1024, 448, 1, 1280, 1024, 1024, 1280, 448]
    - [50, 19444.0]
  - - [5888, 128, 1, 3328, 5888, 5888, 3328, 128]
    - [40, 25203.0]
  - - [1408, 704, 1, 1280, 1408, 1408, 1280, 704]
    - [48, 26779.0]
  - - [448, 1408, 1, 1280, 448, 448, 1280, 1408]
    - [31, 20555.0]
  - - [704, 1408, 1, 1280, 704, 704, 1280, 1408]
    - [33, 26927.0]
  - - [448, 2944, 1, 256, 448, 448, 256, 2944]
    - [31, 22969.0]
  - - [448, 2368, 1, 256, 448, 448, 256, 2368]
    - [46, 21052.0]
  - - [64, 5056, 1, 256, 64, 64, 256, 5056]
    - [35, 8869.0]
  - - [5056, 128, 1, 3328, 5056, 5056, 3328, 128]
    - [46, 22163.0]
  - - [448, 704, 1, 256, 448, 448, 256, 704]
    - [34, 8991.0]
  - - [1856, 256, 1, 3328, 1856, 1856, 3328, 256]
    - [41, 23091.0]
  - - [2944, 128, 1, 3328, 2944, 2944, 3328, 128]
    - [37, 18695.0]
  - - [64, 6784, 1, 1280, 64, 64, 1280, 6784]
    - [31, 18537.0]
  - - [704, 1024, 1, 1280, 704, 704, 1280, 1024]
    - [39, 23337.0]
  - - [256, 4288, 1, 256, 256, 256, 256, 4288]
    - [32, 21852.0]
  - - [256, 2368, 1, 3328, 256, 256, 3328, 2368]
    - [31, 20876.0]
  - - [128, 3584, 1, 256, 128, 128, 256, 3584]
    - [34, 12963.0]
  - - [704, 448, 1, 1280, 704, 704, 1280, 448]
    - [31, 14155.0]
  - - [1024, 704, 1, 1280, 1024, 1024, 1280, 704]
    - [46, 23337.0]
  - - [256, 1856, 1, 256, 256, 256, 256, 1856]
    - [34, 13455.0]
  - - [704, 1856, 1, 1280, 704, 704, 1280, 1856]
    - [46, 26880.0]
  - - [1408, 256, 1, 3328, 1408, 1408, 3328, 256]
    - [41, 17985.0]
  - - [5888, 128, 1, 256, 5888, 5888, 256, 128]
    - [35, 17382.0]
  - - [2368, 448, 1, 256, 2368, 2368, 256, 448]
    - [46, 21020.0]
  - - [4288, 256, 1, 3328, 4288, 4288, 3328, 256]
    - [41, 31369.0]
  - - [2944, 256, 1, 256, 2944, 2944, 256, 256]
    - [40, 17766.0]
  - - [1408, 448, 1, 256, 1408, 1408, 256, 448]
    - [31, 15063.0]
  - - [6784, 64, 1, 1280, 6784, 6784, 1280, 64]
    - [50, 18269.0]
  - - [448, 1024, 1, 3328, 448, 448, 3328, 1024]
    - [41, 22288.0]
  - - [2944, 448, 1, 1280, 2944, 2944, 1280, 448]
    - [40, 27107.0]
  - - [5056, 128, 1, 256, 5056, 5056, 256, 128]
    - [46, 15284.0]
  - - [448, 1024, 1, 256, 448, 448, 256, 1024]
    - [45, 13315.0]
  - - [128, 5056, 1, 1280, 128, 128, 1280, 5056]
    - [31, 21035.0]
  - - [1408, 256, 1, 256, 1408, 1408, 256, 256]
    - [42, 11281.0]
  - - [128, 5888, 1, 3328, 128, 128, 3328, 5888]
    - [32, 25330.0]
  - - [3584, 128, 1, 1280, 3584, 3584, 1280, 128]
    - [37, 19771.0]
  - - [4288, 128, 1, 256, 4288, 4288, 256, 128]
    - [46, 14822.0]
  - - [2368, 256, 1, 3328, 2368, 2368, 3328, 256]
    - [39, 20863.0]
  - - [5888, 128, 1, 1280, 5888, 5888, 1280, 128]
    - [40, 23855.0]
  - - [256, 3584, 1, 1280, 256, 256, 1280, 3584]
    - [41, 25530.0]
  - - [128, 5888, 1, 256, 128, 128, 256, 5888]
    - [31, 17898.0]
  - - [1024, 1024, 1, 256, 1024, 1024, 256, 1024]
    - [34, 22482.0]
  - - [1024, 1024, 1, 1024, 1024, 1024, 1024, 1024]
    - [51, 28212.0]
  - - [64, 5888, 1, 1280, 64, 64, 1280, 5888]
    - [31, 16818.0]
  - - [704, 1024, 1, 256, 704, 704, 256, 1024]
    - [31, 17312.0]
  - - [704, 704, 1, 1280, 704, 704, 1280, 704]
    - [31, 20951.0]
  - - [128, 2368, 1, 1280, 128, 128, 1280, 2368]
    - [31, 13632.0]
  - - [3584, 256, 1, 1280, 3584, 3584, 1280, 256]
    - [41, 25300.0]
  - - [5056, 128, 1, 1280, 5056, 5056, 1280, 128]
    - [39, 20887.0]
  - - [448, 1856, 1, 3328, 448, 448, 3328, 1856]
    - [46, 27529.0]
  - - [1024, 448, 1, 256, 1024, 1024, 256, 448]
    - [34, 13078.0]
  - - [2944, 128, 1, 1280, 2944, 2944, 1280, 128]
    - [31, 16667.0]
  - - [256, 2944, 1, 1280, 256, 256, 1280, 2944]
    - [32, 24009.0]
  - - [704, 1024, 1, 3328, 704, 704, 3328, 1024]
    - [46, 24667.0]
  - - [1856, 448, 1, 1280, 1856, 1856, 1280, 448]
    - [39, 26060.0]
  - - [128, 6784, 1, 256, 128, 128, 256, 6784]
    - [41, 18402.0]
  - - [704, 1408, 1, 256, 704, 704, 256, 1408]
    - [39, 20044.0]
  - - [256, 1408, 1, 256, 256, 256, 256, 1408]
    - [34, 10856.0]
  - - [448, 2944, 1, 1280, 448, 448, 1280, 2944]
    - [46, 27115.0]
  - - [1856, 256, 1, 256, 1856, 1856, 256, 256]
    - [38, 13791.0]
  - - [128, 2368, 1, 3328, 128, 128, 3328, 2368]
    - [41, 14821.0]
  - - [448, 2368, 1, 3328, 448, 448, 3328, 2368]
    - [39, 27120.0]
  - - [1856, 448, 1, 256, 1856, 1856, 256, 448]
    - [46, 19351.0]
  - - [1024, 704, 1, 3328, 1024, 1024, 3328, 704]
    - [31, 24652.0]
  - - [128, 4288, 1, 1280, 128, 128, 1280, 4288]
    - [31, 23202.0]
  - - [448, 704, 1, 3328, 448, 448, 3328, 704]
    - [41, 15418.0]
  - - [448, 1856, 1, 256, 448, 448, 256, 1856]
    - [31, 19316.0]
  - - [1856, 704, 1, 3328, 1856, 1856, 3328, 704]
    - [39, 27595.0]
  - - [2368, 64, 1, 3328, 2368, 2368, 3328, 64]
    - [70, 8353.0]
  - - [1408, 64, 1, 1280, 1408, 1408, 1280, 64]
    - [58, 6473.0]
  - - [2944, 64, 1, 256, 2944, 2944, 256, 64]
    - [70, 7584.0]
  - - [1024, 256, 1, 3328, 1024, 1024, 3328, 256]
    - [53, 14108.0]
  - - [1856, 64, 1, 1280, 1856, 1856, 1280, 64]
    - [56, 7789.0]
  - - [704, 128, 1, 1280, 704, 704, 1280, 128]
    - [58, 6248.0]
  - - [4288, 64, 1, 3328, 4288, 4288, 3328, 64]
    - [74, 14342.0]
  - - [1856, 128, 1, 256, 1856, 1856, 256, 128]
    - [74, 9503.0]
  - - [2944, 64, 1, 1280, 2944, 2944, 1280, 64]
    - [65, 9852.0]
  - - [64, 3584, 1, 3328, 64, 64, 3328, 3584]
    - [74, 12029.0]
  - - [1024, 256, 1, 256, 1024, 1024, 256, 256]
    - [53, 10519.0]
  - - [448, 448, 1, 256, 448, 448, 256, 448]
    - [66, 8234.0]
  - - [128, 1024, 1, 3328, 128, 128, 3328, 1024]
    - [56, 9369.0]
  - - [64, 1856, 1, 1280, 64, 64, 1280, 1856]
    - [56, 7837.0]
  - - [1024, 128, 1, 1280, 1024, 1024, 1280, 128]
    - [56, 8613.0]
  - - [448, 256, 1, 3328, 448, 448, 3328, 256]
    - [56, 8212.0]
  - - [128, 704, 1, 1280, 128, 128, 1280, 704]
    - [58, 6584.0]
  - - [1856, 128, 1, 3328, 1856, 1856, 3328, 128]
    - [53, 12740.0]
  - - [256, 448, 1, 256, 256, 256, 256, 448]
    - [58, 5498.0]
  - - [448, 448, 1, 3328, 448, 448, 3328, 448]
    - [74, 10836.0]
  - - [1408, 128, 1, 1280, 1408, 1408, 1280, 128]
    - [79, 9800.0]
  - - [128, 1856, 1, 1280, 128, 128, 1280, 1856]
    - [53, 12019.0]
  - - [64, 1408, 1, 3328, 64, 64, 3328, 1408]
    - [54, 6559.0]
  - - [256, 448, 1, 3328, 256, 256, 3328, 448]
    - [56, 8194.0]
  - - [64, 2368, 1, 1280, 64, 64, 1280, 2368]
    - [73, 7822.0]
  - - [2368, 64, 1, 256, 2368, 2368, 256, 64]
    - [69, 6198.0]
  - - [4288, 64, 1, 1280, 4288, 4288, 1280, 64]
    - [61, 13469.0]
  - - [128, 1024, 1, 1280, 128, 128, 1280, 1024]
    - [56, 8657.0]
  - - [1856, 64, 1, 256, 1856, 1856, 256, 64]
    - [61, 5590.0]
  - - [704, 128, 1, 256, 704, 704, 256, 128]
    - [58, 4972.0]
  - - [448, 256, 1, 1280, 448, 448, 1280, 256]
    - [56, 7583.0]
  - - [256, 1024, 1, 256, 256, 256, 256, 1024]
    - [74, 10618.0]
  - - [1856, 128, 1, 1280, 1856, 1856, 1280, 128]
    - [74, 12038.0]
  - - [64, 3584, 1, 256, 64, 64, 256, 3584]
    - [74, 9175.0]
  - - [64, 1856, 1, 256, 64, 64, 256, 1856]
    - [64, 5652.0]
  - - [256, 1024, 1, 1280, 256, 256, 1280, 1024]
    - [53, 13519.0]
  - - [3584, 64, 1, 1280, 3584, 3584, 1280, 64]
    - [61, 11487.0]
  - - [1408, 128, 1, 3328, 1408, 1408, 3328, 128]
    - [73, 10249.0]
  - - [64, 4288, 1, 3328, 64, 64, 3328, 4288]
    - [66, 13722.0]
  - - [256, 704, 1, 256, 256, 256, 256, 704]
    - [70, 7588.0]
  - - [128, 1024, 1, 256, 128, 128, 256, 1024]
    - [60, 6035.0]
  - - [64, 2944, 1, 256, 64, 64, 256, 2944]
    - [60, 7755.0]
  - - [64, 1408, 1, 1280, 64, 64, 1280, 1408]
    - [54, 6235.0]
  - - [704, 128, 1, 3328, 704, 704, 3328, 128]
    - [67, 6565.0]
  - - [1408, 128, 1, 256, 1408, 1408, 256, 128]
    - [78, 7539.0]
  - - [64, 2944, 1, 1280, 64, 64, 1280, 2944]
    - [74, 9450.0]
  - - [704, 256, 1, 1280, 704, 704, 1280, 256]
    - [52, 9875.0]
  - - [256, 448, 1, 1280, 256, 256, 1280, 448]
    - [56, 7559.0]
  - - [64, 2368, 1, 3328, 64, 64, 3328, 2368]
    - [60, 7950.0]
  - - [256, 704, 1, 3328, 256, 256, 3328, 704]
    - [73, 10138.0]
  - - [64, 2944, 1, 3328, 64, 64, 3328, 2944]
    - [66, 9792.0]
  - - [128, 1408, 1, 256, 128, 128, 256, 1408]
    - [60, 7664.0]
  - - [1408, 64, 1, 256, 1408, 1408, 256, 64]
    - [58, 4846.0]
  - - [64, 2368, 1, 256, 64, 64, 256, 2368]
    - [70, 6198.0]
  - - [1024, 128, 1, 3328, 1024, 1024, 3328, 128]
    - [56, 9329.0]
  - - [2368, 64, 1, 1280, 2368, 2368, 1280, 64]
    - [59, 8023.0]
  - - [4288, 64, 1, 256, 4288, 4288, 256, 64]
    - [80, 10549.0]
  - - [64, 4288, 1, 1280, 64, 64, 1280, 4288]
    - [66, 13117.0]
  - - [1408, 64, 1, 3328, 1408, 1408, 3328, 64]
    - [75, 6565.0]
  - - [448, 448, 1, 1280, 448, 448, 1280, 448]
    - [74, 10384.0]
  - - [1024, 256, 1, 1280, 1024, 1024, 1280, 256]
    - [53, 13465.0]
  - - [3584, 64, 1, 3328, 3584, 3584, 3328, 64]
    - [66, 12063.0]
  - - [256, 1024, 1, 3328, 256, 256, 3328, 1024]
    - [53, 14172.0]
  - - [1856, 64, 1, 3328, 1856, 1856, 3328, 64]
    - [63, 8436.0]
  - - [448, 256, 1, 256, 448, 448, 256, 256]
    - [61, 5624.0]
  - - [128, 704, 1, 256, 128, 128, 256, 704]
    - [58, 4950.0]
  - - [1024, 128, 1, 256, 1024, 1024, 256, 128]
    - [61, 6101.0]
  - - [64, 3584, 1, 1280, 64, 64, 1280, 3584]
    - [74, 11586.0]
  - - [3584, 64, 1, 256, 3584, 3584, 256, 64]
    - [61, 8951.0]
  - - [64, 1856, 1, 3328, 64, 64, 3328, 1856]
    - [56, 8516.0]
  - - [2944, 64, 1, 3328, 2944, 2944, 3328, 64]
    - [65, 10388.0]
  - - [128, 1408, 1, 3328, 128, 128, 3328, 1408]
    - [79, 9947.0]
  - - [128, 704, 1, 3328, 128, 128, 3328, 704]
    - [54, 6565.0]
  - - [128, 1856, 1, 256, 128, 128, 256, 1856]
    - [61, 9385.0]
  - - [64, 4288, 1, 256, 64, 64, 256, 4288]
    - [74, 10612.0]
  - - [704, 256, 1, 3328, 704, 704, 3328, 256]
    - [52, 10612.0]
  - - [256, 704, 1, 1280, 256, 256, 1280, 704]
    - [59, 9580.0]
  - - [64, 1408, 1, 256, 64, 64, 256, 1408]
    - [58, 4929.0]
  - - [128, 1408, 1, 1280, 128, 128, 1280, 1408]
    - [79, 9317.0]
  - - [128, 1856, 1, 3328, 128, 128, 3328, 1856]
    - [71, 12522.0]
  - - [704, 256, 1, 256, 704, 704, 256, 256]
    - [78, 7715.0]
  - - [704, 64, 1, 3328, 704, 704, 3328, 64]
    - [62, 4760.0]
  - - [448, 64, 1, 1280, 448, 448, 1280, 64]
    - [72, 2936.0]
  - - [64, 1024, 1, 1280, 64, 64, 1280, 1024]
    - [54, 5440.0]
  - - [64, 704, 1, 1280, 64, 64, 1280, 704]
    - [75, 4464.0]
  - - [128, 448, 1, 256, 128, 128, 256, 448]
    - [67, 3495.0]
  - - [256, 256, 1, 3328, 256, 256, 3328, 256]
    - [75, 5788.0]
  - - [64, 448, 1, 1280, 64, 64, 1280, 448]
    - [62, 2936.0]
  - - [64, 64, 1, 3328, 64, 64, 3328, 64]
    - [77, 496.0]
  - - [256, 64, 1, 1280, 256, 256, 1280, 64]
    - [62, 1739.0]
  - - [128, 448, 1, 1280, 128, 128, 1280, 448]
    - [67, 5014.0]
  - - [704, 64, 1, 1280, 704, 704, 1280, 64]
    - [62, 4343.0]
  - - [448, 64, 1, 3328, 448, 448, 3328, 64]
    - [62, 3243.0]
  - - [64, 128, 1, 3328, 64, 64, 3328, 128]
    - [57, 990.0]
  - - [128, 128, 1, 3328, 128, 128, 3328, 128]
    - [68, 1871.0]
  - - [256, 128, 1, 256, 256, 256, 256, 128]
    - [55, 2140.0]
  - - [64, 448, 1, 3328, 64, 64, 3328, 448]
    - [62, 3155.0]
  - - [256, 64, 1, 256, 256, 256, 256, 64]
    - [81, 1104.0]
  - - [256, 128, 1, 1280, 256, 256, 1280, 128]
    - [72, 3350.0]
  - - [128, 64, 1, 1280, 128, 128, 1280, 64]
    - [68, 874.0]
  - - [64, 1024, 1, 256, 64, 64, 256, 1024]
    - [76, 3866.0]
  - - [64, 704, 1, 256, 64, 64, 256, 704]
    - [67, 2927.0]
  - - [448, 128, 1, 256, 448, 448, 256, 128]
    - [75, 3414.0]
  - - [256, 256, 1, 256, 256, 256, 256, 256]
    - [55, 3884.0]
  - - [448, 128, 1, 3328, 448, 448, 3328, 128]
    - [75, 5364.0]
  - - [128, 256, 1, 1280, 128, 128, 1280, 256]
    - [62, 3355.0]
  - - [64, 256, 1, 1280, 64, 64, 1280, 256]
    - [62, 1730.0]
  - - [64, 448, 1, 256, 64, 64, 256, 448]
    - [54, 1892.0]
  - - [64, 64, 1, 256, 64, 64, 256, 64]
    - [62, 276.0]
  - - [128, 256, 1, 3328, 128, 128, 3328, 256]
    - [54, 3642.0]
  - - [64, 128, 1, 1280, 64, 64, 1280, 128]
    - [57, 877.0]
  - - [128, 128, 1, 1280, 128, 128, 1280, 128]
    - [62, 1739.0]
  - - [128, 256, 1, 256, 128, 128, 256, 256]
    - [54, 2173.0]
  - - [64, 128, 1, 256, 64, 64, 256, 128]
    - [62, 555.0]
  - - [704, 64, 1, 256, 704, 704, 256, 64]
    - [62, 2841.0]
  - - [64, 64, 1, 1280, 64, 64, 1280, 64]
    - [81, 440.0]
  - - [128, 64, 1, 3328, 128, 128, 3328, 64]
    - [57, 991.0]
  - - [448, 64, 1, 256, 448, 448, 256, 64]
    - [55, 1902.0]
  - - [1024, 64, 1, 256, 1024, 1024, 256, 64]
    - [55, 3848.0]
  - - [128, 64, 1, 256, 128, 128, 256, 64]
    - [62, 555.0]
  - - [1024, 64, 1, 1280, 1024, 1024, 1280, 64]
    - [54, 5419.0]
  - - [64, 1024, 1, 3328, 64, 64, 3328, 1024]
    - [54, 5788.0]
  - - [448, 128, 1, 1280, 448, 448, 1280, 128]
    - [54, 5021.0]
  - - [1024, 64, 1, 3328, 1024, 1024, 3328, 64]
    - [81, 5807.0]
  - - [64, 256, 1, 3328, 64, 64, 3328, 256]
    - [57, 1871.0]
  - - [256, 256, 1, 1280, 256, 256, 1280, 256]
    - [67, 5433.0]
  - - [256, 128, 1, 3328, 256, 256, 3328, 128]
    - [55, 3538.0]
  - - [64, 256, 1, 256, 64, 64, 256, 256]
    - [54, 1104.0]
  - - [64, 704, 1, 3328, 64, 64, 3328, 704]
    - [67, 4825.0]
  - - [128, 448, 1, 3328, 128, 128, 3328, 448]
    - [75, 5364.0]
  - - [256, 64, 1, 3328, 256, 256, 3328, 64]
    - [57, 1872.0]
  - - [128, 128, 1, 256, 128, 128, 256, 128]
    - [62, 1104.0]
- null
