library/src/blas3/Tensile/Logic/asm_full/navi21_Cijk_Alik_Bljk_HHS_BH.yaml
- {MinimumRequiredVersion: 4.26.0}
- navi21
- gfx1030
- [Device 73a2]
    SolutionIndex: 0
    SolutionNameMin: Cijk_Alik_Bljk_HHS_BH_MT128x64x8_SN_SU0_SUM0_TT8_8_WG16_8_1_WGM1
    SolutionIndex: 1
    SolutionNameMin: Cijk_Alik_Bljk_HHS_BH_MT128x128x8_SN_SU0_SUM0_TT8_16_WG16_8_1_WGM1
    SolutionIndex: 2
    SolutionNameMin: Cijk_Alik_Bljk_HHS_BH_MT128x128x8_SN_SU0_SUM0_TT8_8_WG16_16_1_WGM1
    SolutionIndex: 3
    SolutionNameMin: Cijk_Alik_Bljk_HHS_BH_MT128x256x8_SN_SU0_SUM0_TT8_16_WG16_16_1_WGM1
    SolutionIndex: 4
    SolutionNameMin: Cijk_Alik_Bljk_HHS_BH_MT128x64x16_SN_SU0_SUM0_TT8_8_WG16_8_1_WGM1
    SolutionIndex: 5
    SolutionNameMin: Cijk_Alik_Bljk_HHS_BH_MT128x128x16_SN_SU0_SUM0_TT8_16_WG16_8_1_WGM1
    SolutionIndex: 6
    SolutionNameMin: Cijk_Alik_Bljk_HHS_BH_MT128x128x16_SN_SU0_SUM0_TT8_8_WG16_16_1_WGM1
    SolutionIndex: 7
    SolutionNameMin: Cijk_Alik_Bljk_HHS_BH_MT128x256x16_SN_SU0_SUM0_TT8_16_WG16_16_1_WGM1
    SolutionIndex: 8
    SolutionNameMin: Cijk_Alik_Bljk_HHS_BH_MT128x64x8_SN_SU32_SUM3_TT8_8_WG16_8_1_WGM1
    SolutionIndex: 9
    SolutionNameMin: Cijk_Alik_Bljk_HHS_BH_MT128x128x8_SN_SU32_SUM3_TT8_16_WG16_8_1_WGM1
    SolutionIndex: 10
    SolutionNameMin: Cijk_Alik_Bljk_HHS_BH_MT128x256x8_SN_SU32_SUM3_TT8_16_WG16_16_1_WGM1
    SolutionIndex: 11
    SolutionNameMin: Cijk_Alik_Bljk_HHS_BH_MT128x64x16_SN_SU32_SUM3_TT8_8_WG16_8_1_WGM1
    SolutionIndex: 12
    SolutionNameMin: Cijk_Alik_Bljk_HHS_BH_MT128x128x16_SN_SU32_SUM3_TT8_16_WG16_8_1_WGM1
    SolutionIndex: 13
    SolutionNameMin: Cijk_Alik_Bljk_HHS_BH_MT128x128x16_SN_SU32_SUM3_TT8_8_WG16_16_1_WGM1
    SolutionIndex: 14
    SolutionNameMin: Cijk_Alik_Bljk_HHS_BH_MT128x256x16_SN_SU32_SUM3_TT8_16_WG16_16_1_WGM1
    SolutionIndex: 15
    SolutionNameMin: Cijk_Alik_Bljk_HHS_BH_MT128x128x32_SN_SU32_SUM3_TT8_16_WG16_8_1_WGM1
    SolutionIndex: 16
    SolutionNameMin: Cijk_Alik_Bljk_HHS_BH_MT128x256x32_SN_SU32_SUM3_TT8_16_WG16_16_1_WGM1
    SolutionIndex: 17
    SolutionNameMin: Cijk_Alik_Bljk_HHS_BH_MT128x64x8_SN_SU0_SUM0_TT8_8_WG16_8_1_WGM4
    SolutionIndex: 18
    SolutionNameMin: Cijk_Alik_Bljk_HHS_BH_MT128x128x8_SN_SU0_SUM0_TT8_8_WG16_16_1_WGM4
    SolutionIndex: 19
    SolutionNameMin: Cijk_Alik_Bljk_HHS_BH_MT128x256x8_SN_SU0_SUM0_TT8_16_WG16_16_1_WGM4
    SolutionIndex: 20
    SolutionNameMin: Cijk_Alik_Bljk_HHS_BH_MT128x128x16_SN_SU0_SUM0_TT8_16_WG16_8_1_WGM4
    SolutionIndex: 21
    SolutionNameMin: Cijk_Alik_Bljk_HHS_BH_MT128x128x16_SN_SU0_SUM0_TT8_8_WG16_16_1_WGM4
    SolutionIndex: 22
    SolutionNameMin: Cijk_Alik_Bljk_HHS_BH_MT128x256x16_SN_SU0_SUM0_TT8_16_WG16_16_1_WGM4
    SolutionIndex: 23
    SolutionNameMin: Cijk_Alik_Bljk_HHS_BH_MT128x64x8_SN_SU32_SUM3_TT8_8_WG16_8_1_WGM4
    SolutionIndex: 24
    SolutionNameMin: Cijk_Alik_Bljk_HHS_BH_MT128x128x8_SN_SU32_SUM3_TT8_8_WG16_16_1_WGM4
    SolutionIndex: 25
    SolutionNameMin: Cijk_Alik_Bljk_HHS_BH_MT128x256x8_SN_SU32_SUM3_TT8_16_WG16_16_1_WGM4
    SolutionIndex: 26
    SolutionNameMin: Cijk_Alik_Bljk_HHS_BH_MT128x64x16_SN_SU32_SUM3_TT8_8_WG16_8_1_WGM4
    SolutionIndex: 27
    SolutionNameMin: Cijk_Alik_Bljk_HHS_BH_MT128x128x16_SN_SU32_SUM3_TT8_16_WG16_8_1_WGM4
    SolutionIndex: 28
    SolutionNameMin: Cijk_Alik_Bljk_HHS_BH_MT128x128x16_SN_SU32_SUM3_TT8_8_WG16_16_1_WGM4
    SolutionIndex: 29
    SolutionNameMin: Cijk_Alik_Bljk_HHS_BH_MT128x256x16_SN_SU32_SUM3_TT8_16_WG16_16_1_WGM4
    SolutionIndex: 30
    SolutionNameMin: Cijk_Alik_Bljk_HHS_BH_MT128x64x32_SN_SU32_SUM3_TT8_8_WG16_8_1_WGM4
    SolutionIndex: 31
    SolutionNameMin: Cijk_Alik_Bljk_HHS_BH_MT128x128x32_SN_SU32_SUM3_TT8_16_WG16_8_1_WGM4
    SolutionIndex: 32
    SolutionNameMin: Cijk_Alik_Bljk_HHS_BH_MT128x256x32_SN_SU32_SUM3_TT8_16_WG16_16_1_WGM4
    SolutionIndex: 33
    SolutionNameMin: Cijk_Alik_Bljk_HHS_BH_MT128x64x8_SN_SU0_SUM0_TT8_8_WG16_8_1_WGM8
    SolutionIndex: 34
    SolutionNameMin: Cijk_Alik_Bljk_HHS_BH_MT128x128x8_SN_SU0_SUM0_TT8_16_WG16_8_1_WGM8
    SolutionIndex: 35
    SolutionNameMin: Cijk_Alik_Bljk_HHS_BH_MT128x256x8_SN_SU0_SUM0_TT8_16_WG16_16_1_WGM8
    SolutionIndex: 36
    SolutionNameMin: Cijk_Alik_Bljk_HHS_BH_MT128x64x16_SN_SU0_SUM0_TT8_8_WG16_8_1_WGM8
    SolutionIndex: 37
    SolutionNameMin: Cijk_Alik_Bljk_HHS_BH_MT128x128x16_SN_SU0_SUM0_TT8_16_WG16_8_1_WGM8
    SolutionIndex: 38
    SolutionNameMin: Cijk_Alik_Bljk_HHS_BH_MT128x128x16_SN_SU0_SUM0_TT8_8_WG16_16_1_WGM8
    SolutionIndex: 39
    SolutionNameMin: Cijk_Alik_Bljk_HHS_BH_MT128x256x16_SN_SU0_SUM0_TT8_16_WG16_16_1_WGM8
    SolutionIndex: 40
    SolutionNameMin: Cijk_Alik_Bljk_HHS_BH_MT128x64x8_SN_SU32_SUM3_TT8_8_WG16_8_1_WGM8
    SolutionIndex: 41
    SolutionNameMin: Cijk_Alik_Bljk_HHS_BH_MT128x128x8_SN_SU32_SUM3_TT8_16_WG16_8_1_WGM8
    SolutionIndex: 42
    SolutionNameMin: Cijk_Alik_Bljk_HHS_BH_MT128x128x8_SN_SU32_SUM3_TT8_8_WG16_16_1_WGM8
    SolutionIndex: 43
    SolutionNameMin: Cijk_Alik_Bljk_HHS_BH_MT128x128x16_SN_SU32_SUM3_TT8_16_WG16_8_1_WGM8
    SolutionIndex: 44
    SolutionNameMin: Cijk_Alik_Bljk_HHS_BH_MT128x128x16_SN_SU32_SUM3_TT8_8_WG16_16_1_WGM8
    SolutionIndex: 45
    SolutionNameMin: Cijk_Alik_Bljk_HHS_BH_MT128x256x16_SN_SU32_SUM3_TT8_16_WG16_16_1_WGM8
    SolutionIndex: 46
    SolutionNameMin: Cijk_Alik_Bljk_HHS_BH_MT128x128x32_SN_SU32_SUM3_TT8_16_WG16_8_1_WGM8
    SolutionIndex: 47
    SolutionNameMin: Cijk_Alik_Bljk_HHS_BH_MT128x256x32_SN_SU32_SUM3_TT8_16_WG16_16_1_WGM8
    SolutionIndex: 48
    SolutionNameMin: Cijk_Alik_Bljk_HHS_BH_MT128x256x16_SN_SU0_SUM0_TT8_16_WG16_16_1_WGM1
    SolutionIndex: 49
    SolutionNameMin: Cijk_Alik_Bljk_HHS_BH_MT128x128x32_SN_SU32_SUM3_TT8_16_WG16_8_1_WGM1
    SolutionIndex: 50
    SolutionNameMin: Cijk_Alik_Bljk_HHS_BH_MT128x128x32_SN_SU32_SUM3_TT8_16_WG16_8_1_WGM4
    SolutionIndex: 51
    SolutionNameMin: Cijk_Alik_Bljk_HHS_BH_MT128x128x32_SN_SU32_SUM3_TT8_16_WG16_8_1_WGM8
    SolutionIndex: 52
    SolutionNameMin: Cijk_Alik_Bljk_HHS_BH_MT64x64x8_SN_SU0_SUM0_TT8_8_WG8_8_1_WGM1
    SolutionIndex: 53
    SolutionNameMin: Cijk_Alik_Bljk_HHS_BH_MT128x64x8_SN_SU0_SUM0_TT8_8_WG16_8_1_WGM1
    SolutionIndex: 54
    SolutionNameMin: Cijk_Alik_Bljk_HHS_BH_MT128x128x8_SN_SU0_SUM0_TT8_8_WG16_16_1_WGM1
    SolutionIndex: 55
    SolutionNameMin: Cijk_Alik_Bljk_HHS_BH_MT64x64x16_SN_SU0_SUM0_TT8_8_WG8_8_1_WGM1
    SolutionIndex: 56
    SolutionNameMin: Cijk_Alik_Bljk_HHS_BH_MT128x64x16_SN_SU0_SUM0_TT8_8_WG16_8_1_WGM1
    SolutionIndex: 57
    SolutionNameMin: Cijk_Alik_Bljk_HHS_BH_MT128x128x16_SN_SU0_SUM0_TT8_8_WG16_16_1_WGM1
    SolutionIndex: 58
    SolutionNameMin: Cijk_Alik_Bljk_HHS_BH_MT64x64x32_SN_SU0_SUM0_TT8_8_WG8_8_1_WGM1
    SolutionIndex: 59
    SolutionNameMin: Cijk_Alik_Bljk_HHS_BH_MT128x64x32_SN_SU0_SUM0_TT8_8_WG16_8_1_WGM1
    SolutionIndex: 60
    SolutionNameMin: Cijk_Alik_Bljk_HHS_BH_MT64x64x8_SN_SU32_SUM3_TT8_8_WG8_8_1_WGM1
    SolutionIndex: 61
    SolutionNameMin: Cijk_Alik_Bljk_HHS_BH_MT128x64x8_SN_SU32_SUM3_TT8_8_WG16_8_1_WGM1
    SolutionIndex: 62
    SolutionNameMin: Cijk_Alik_Bljk_HHS_BH_MT64x64x16_SN_SU32_SUM3_TT8_8_WG8_8_1_WGM1
    SolutionIndex: 63
    SolutionNameMin: Cijk_Alik_Bljk_HHS_BH_MT128x64x16_SN_SU32_SUM3_TT8_8_WG16_8_1_WGM1
    SolutionIndex: 64
    SolutionNameMin: Cijk_Alik_Bljk_HHS_BH_MT128x128x16_SN_SU32_SUM3_TT8_8_WG16_16_1_WGM1
    SolutionIndex: 65
    SolutionNameMin: Cijk_Alik_Bljk_HHS_BH_MT64x64x32_SN_SU32_SUM3_TT8_8_WG8_8_1_WGM1
    SolutionIndex: 66
    SolutionNameMin: Cijk_Alik_Bljk_HHS_BH_MT128x64x32_SN_SU32_SUM3_TT8_8_WG16_8_1_WGM1
    SolutionIndex: 67
    SolutionNameMin: Cijk_Alik_Bljk_HHS_BH_MT64x64x8_SN_SU0_SUM0_TT8_8_WG8_8_1_WGM4
    SolutionIndex: 68
    SolutionNameMin: Cijk_Alik_Bljk_HHS_BH_MT128x64x8_SN_SU0_SUM0_TT8_8_WG16_8_1_WGM4
    SolutionIndex: 69
    SolutionNameMin: Cijk_Alik_Bljk_HHS_BH_MT128x128x8_SN_SU0_SUM0_TT8_8_WG16_16_1_WGM4
    SolutionIndex: 70
    SolutionNameMin: Cijk_Alik_Bljk_HHS_BH_MT64x64x16_SN_SU0_SUM0_TT8_8_WG8_8_1_WGM4
    SolutionIndex: 71
    SolutionNameMin: Cijk_Alik_Bljk_HHS_BH_MT128x64x16_SN_SU0_SUM0_TT8_8_WG16_8_1_WGM4
    SolutionIndex: 72
    SolutionNameMin: Cijk_Alik_Bljk_HHS_BH_MT128x128x16_SN_SU0_SUM0_TT8_8_WG16_16_1_WGM4
    SolutionIndex: 73
    SolutionNameMin: Cijk_Alik_Bljk_HHS_BH_MT64x64x32_SN_SU0_SUM0_TT8_8_WG8_8_1_WGM4
    SolutionIndex: 74
    SolutionNameMin: Cijk_Alik_Bljk_HHS_BH_MT64x64x16_SN_SU32_SUM3_TT8_8_WG8_8_1_WGM4
    SolutionIndex: 75
    SolutionNameMin: Cijk_Alik_Bljk_HHS_BH_MT128x64x16_SN_SU32_SUM3_TT8_8_WG16_8_1_WGM4
    SolutionIndex: 76
    SolutionNameMin: Cijk_Alik_Bljk_HHS_BH_MT128x128x16_SN_SU32_SUM3_TT8_8_WG16_16_1_WGM4
    SolutionIndex: 77
    SolutionNameMin: Cijk_Alik_Bljk_HHS_BH_MT64x64x32_SN_SU32_SUM3_TT8_8_WG8_8_1_WGM4
    SolutionIndex: 78
    SolutionNameMin: Cijk_Alik_Bljk_HHS_BH_MT128x64x32_SN_SU32_SUM3_TT8_8_WG16_8_1_WGM4
    SolutionIndex: 79
    SolutionNameMin: Cijk_Alik_Bljk_HHS_BH_MT64x64x8_SN_SU0_SUM0_TT8_8_WG8_8_1_WGM8
    SolutionIndex: 80
    SolutionNameMin: Cijk_Alik_Bljk_HHS_BH_MT128x64x8_SN_SU0_SUM0_TT8_8_WG16_8_1_WGM8
    SolutionIndex: 81
    SolutionNameMin: Cijk_Alik_Bljk_HHS_BH_MT128x128x8_SN_SU0_SUM0_TT8_8_WG16_16_1_WGM8
    SolutionIndex: 82
    SolutionNameMin: Cijk_Alik_Bljk_HHS_BH_MT64x64x16_SN_SU0_SUM0_TT8_8_WG8_8_1_WGM8
    SolutionIndex: 83
    SolutionNameMin: Cijk_Alik_Bljk_HHS_BH_MT128x64x16_SN_SU0_SUM0_TT8_8_WG16_8_1_WGM8
    SolutionIndex: 84
    SolutionNameMin: Cijk_Alik_Bljk_HHS_BH_MT128x128x16_SN_SU0_SUM0_TT8_8_WG16_16_1_WGM8
    SolutionIndex: 85
    SolutionNameMin: Cijk_Alik_Bljk_HHS_BH_MT128x64x32_SN_SU0_SUM0_TT8_8_WG16_8_1_WGM8
    SolutionIndex: 86
    SolutionNameMin: Cijk_Alik_Bljk_HHS_BH_MT64x64x8_SN_SU32_SUM3_TT8_8_WG8_8_1_WGM8
    SolutionIndex: 87
    SolutionNameMin: Cijk_Alik_Bljk_HHS_BH_MT128x64x8_SN_SU32_SUM3_TT8_8_WG16_8_1_WGM8
    SolutionIndex: 88
    SolutionNameMin: Cijk_Alik_Bljk_HHS_BH_MT64x64x16_SN_SU32_SUM3_TT8_8_WG8_8_1_WGM8
    SolutionIndex: 89
    SolutionNameMin: Cijk_Alik_Bljk_HHS_BH_MT128x64x16_SN_SU32_SUM3_TT8_8_WG16_8_1_WGM8
    SolutionIndex: 90
    SolutionNameMin: Cijk_Alik_Bljk_HHS_BH_MT128x128x16_SN_SU32_SUM3_TT8_8_WG16_16_1_WGM8
    SolutionIndex: 91
    SolutionNameMin: Cijk_Alik_Bljk_HHS_BH_MT64x64x32_SN_SU32_SUM3_TT8_8_WG8_8_1_WGM8
    SolutionIndex: 92
    SolutionNameMin: Cijk_Alik_Bljk_HHS_BH_MT64x64x16_SN_SU0_SUM0_TT8_8_WG8_8_1_WGM1
    SolutionIndex: 93
    SolutionNameMin: Cijk_Alik_Bljk_HHS_BH_MT128x64x16_SN_SU0_SUM0_TT8_8_WG16_8_1_WGM1
    SolutionIndex: 94
    SolutionNameMin: Cijk_Alik_Bljk_HHS_BH_MT128x128x16_SN_SU0_SUM0_TT8_8_WG16_16_1_WGM1
    SolutionIndex: 95
    SolutionNameMin: Cijk_Alik_Bljk_HHS_BH_MT128x64x16_SN_SU32_SUM3_TT8_8_WG16_8_1_WGM1
    SolutionIndex: 96
    SolutionNameMin: Cijk_Alik_Bljk_HHS_BH_MT64x64x32_SN_SU32_SUM3_TT8_8_WG8_8_1_WGM1
    SolutionIndex: 97
    SolutionNameMin: Cijk_Alik_Bljk_HHS_BH_MT128x64x32_SN_SU32_SUM3_TT8_8_WG16_8_1_WGM1
    SolutionIndex: 98
    SolutionNameMin: Cijk_Alik_Bljk_HHS_BH_MT128x64x16_SN_SU0_SUM0_TT8_8_WG16_8_1_WGM4
    SolutionIndex: 99
    SolutionNameMin: Cijk_Alik_Bljk_HHS_BH_MT128x128x16_SN_SU0_SUM0_TT8_8_WG16_16_1_WGM4
    SolutionIndex: 100
    SolutionNameMin: Cijk_Alik_Bljk_HHS_BH_MT128x64x16_SN_SU32_SUM3_TT8_8_WG16_8_1_WGM4
    SolutionIndex: 101
    SolutionNameMin: Cijk_Alik_Bljk_HHS_BH_MT128x64x32_SN_SU32_SUM3_TT8_8_WG16_8_1_WGM4
    SolutionIndex: 102
    SolutionNameMin: Cijk_Alik_Bljk_HHS_BH_MT64x64x16_SN_SU0_SUM0_TT8_8_WG8_8_1_WGM8
    SolutionIndex: 103
    SolutionNameMin: Cijk_Alik_Bljk_HHS_BH_MT128x64x16_SN_SU0_SUM0_TT8_8_WG16_8_1_WGM8
    SolutionIndex: 104
    SolutionNameMin: Cijk_Alik_Bljk_HHS_BH_MT128x64x32_SN_SU0_SUM0_TT8_8_WG16_8_1_WGM8
    SolutionIndex: 105
    SolutionNameMin: Cijk_Alik_Bljk_HHS_BH_MT64x64x16_SN_SU32_SUM3_TT8_8_WG8_8_1_WGM8
    SolutionIndex: 106
    SolutionNameMin: Cijk_Alik_Bljk_HHS_BH_MT128x64x16_SN_SU32_SUM3_TT8_8_WG16_8_1_WGM8
    SolutionIndex: 107
    SolutionNameMin: Cijk_Alik_Bljk_HHS_BH_MT64x64x32_SN_SU32_SUM3_TT8_8_WG8_8_1_WGM8
    SolutionIndex: 108
    SolutionNameMin: Cijk_Alik_Bljk_HHS_BH_MT128x64x32_SN_SU32_SUM3_TT8_8_WG16_8_1_WGM8
    SolutionIndex: 109
    SolutionNameMin: Cijk_Alik_Bljk_HHS_BH_MT16x16x8_SN_SU0_SUM0_TT2_2_WG8_8_1_WGM1
    SolutionIndex: 110
    SolutionNameMin: Cijk_Alik_Bljk_HHS_BH_MT32x32x8_SN_SU0_SUM0_TT4_4_WG8_8_1_WGM1
    SolutionIndex: 111
    SolutionNameMin: Cijk_Alik_Bljk_HHS_BH_MT32x16x8_SN_SU0_SUM0_TT2_2_WG16_8_1_WGM1
    SolutionIndex: 112
    SolutionNameMin: Cijk_Alik_Bljk_HHS_BH_MT64x32x8_SN_SU0_SUM0_TT4_4_WG16_8_1_WGM1
    SolutionIndex: 113
    SolutionNameMin: Cijk_Alik_Bljk_HHS_BH_MT32x32x8_SN_SU0_SUM0_TT2_2_WG16_16_1_WGM1
    SolutionIndex: 114
    SolutionNameMin: Cijk_Alik_Bljk_HHS_BH_MT64x64x8_SN_SU0_SUM0_TT4_4_WG16_16_1_WGM1
    SolutionIndex: 115
    SolutionNameMin: Cijk_Alik_Bljk_HHS_BH_MT16x16x16_SN_SU0_SUM0_TT2_2_WG8_8_1_WGM1
    SolutionIndex: 116
    SolutionNameMin: Cijk_Alik_Bljk_HHS_BH_MT32x32x16_SN_SU0_SUM0_TT4_4_WG8_8_1_WGM1
    SolutionIndex: 117
    SolutionNameMin: Cijk_Alik_Bljk_HHS_BH_MT16x16x32_SN_SU0_SUM0_TT2_2_WG8_8_1_WGM1
    SolutionIndex: 118
    SolutionNameMin: Cijk_Alik_Bljk_HHS_BH_MT16x16x8_SN_SU32_SUM3_TT2_2_WG8_8_1_WGM1
    SolutionIndex: 119
    SolutionNameMin: Cijk_Alik_Bljk_HHS_BH_MT32x32x8_SN_SU32_SUM3_TT4_4_WG8_8_1_WGM1
    SolutionIndex: 120
    SolutionNameMin: Cijk_Alik_Bljk_HHS_BH_MT32x16x8_SN_SU32_SUM3_TT2_2_WG16_8_1_WGM1
    SolutionIndex: 121
    SolutionNameMin: Cijk_Alik_Bljk_HHS_BH_MT32x32x8_SN_SU32_SUM3_TT2_2_WG16_16_1_WGM1
    SolutionIndex: 122
    SolutionNameMin: Cijk_Alik_Bljk_HHS_BH_MT64x64x8_SN_SU32_SUM3_TT4_4_WG16_16_1_WGM1
    SolutionIndex: 123
    SolutionNameMin: Cijk_Alik_Bljk_HHS_BH_MT16x16x16_SN_SU32_SUM3_TT2_2_WG8_8_1_WGM1
    SolutionIndex: 124
    SolutionNameMin: Cijk_Alik_Bljk_HHS_BH_MT32x32x16_SN_SU32_SUM3_TT4_4_WG8_8_1_WGM1
    SolutionIndex: 125
    SolutionNameMin: Cijk_Alik_Bljk_HHS_BH_MT32x16x16_SN_SU32_SUM3_TT2_2_WG16_8_1_WGM1
    SolutionIndex: 126
    SolutionNameMin: Cijk_Alik_Bljk_HHS_BH_MT16x16x32_SN_SU32_SUM3_TT2_2_WG8_8_1_WGM1
    SolutionIndex: 127
    SolutionNameMin: Cijk_Alik_Bljk_HHS_BH_MT16x16x8_SN_SU0_SUM0_TT2_2_WG8_8_1_WGM4
    SolutionIndex: 128
    SolutionNameMin: Cijk_Alik_Bljk_HHS_BH_MT32x32x8_SN_SU0_SUM0_TT4_4_WG8_8_1_WGM4
    SolutionIndex: 129
    SolutionNameMin: Cijk_Alik_Bljk_HHS_BH_MT32x16x8_SN_SU0_SUM0_TT2_2_WG16_8_1_WGM4
    SolutionIndex: 130
    SolutionNameMin: Cijk_Alik_Bljk_HHS_BH_MT64x32x8_SN_SU0_SUM0_TT4_4_WG16_8_1_WGM4
    SolutionIndex: 131
    SolutionNameMin: Cijk_Alik_Bljk_HHS_BH_MT32x32x8_SN_SU0_SUM0_TT2_2_WG16_16_1_WGM4
    SolutionIndex: 132
    SolutionNameMin: Cijk_Alik_Bljk_HHS_BH_MT64x64x8_SN_SU0_SUM0_TT4_4_WG16_16_1_WGM4
    SolutionIndex: 133
    SolutionNameMin: Cijk_Alik_Bljk_HHS_BH_MT16x16x16_SN_SU0_SUM0_TT2_2_WG8_8_1_WGM4
    SolutionIndex: 134
    SolutionNameMin: Cijk_Alik_Bljk_HHS_BH_MT32x32x16_SN_SU0_SUM0_TT4_4_WG8_8_1_WGM4
    SolutionIndex: 135
    SolutionNameMin: Cijk_Alik_Bljk_HHS_BH_MT16x16x32_SN_SU0_SUM0_TT2_2_WG8_8_1_WGM4
    SolutionIndex: 136
    SolutionNameMin: Cijk_Alik_Bljk_HHS_BH_MT16x16x8_SN_SU32_SUM3_TT2_2_WG8_8_1_WGM4
    SolutionIndex: 137
    SolutionNameMin: Cijk_Alik_Bljk_HHS_BH_MT32x32x8_SN_SU32_SUM3_TT4_4_WG8_8_1_WGM4
    SolutionIndex: 138
    SolutionNameMin: Cijk_Alik_Bljk_HHS_BH_MT32x16x8_SN_SU32_SUM3_TT2_2_WG16_8_1_WGM4
    SolutionIndex: 139
    SolutionNameMin: Cijk_Alik_Bljk_HHS_BH_MT64x32x8_SN_SU32_SUM3_TT4_4_WG16_8_1_WGM4
    SolutionIndex: 140
    SolutionNameMin: Cijk_Alik_Bljk_HHS_BH_MT64x64x8_SN_SU32_SUM3_TT4_4_WG16_16_1_WGM4
    SolutionIndex: 141
    SolutionNameMin: Cijk_Alik_Bljk_HHS_BH_MT16x16x16_SN_SU32_SUM3_TT2_2_WG8_8_1_WGM4
    SolutionIndex: 142
    SolutionNameMin: Cijk_Alik_Bljk_HHS_BH_MT32x32x16_SN_SU32_SUM3_TT4_4_WG8_8_1_WGM4
    SolutionIndex: 143
    SolutionNameMin: Cijk_Alik_Bljk_HHS_BH_MT32x16x16_SN_SU32_SUM3_TT2_2_WG16_8_1_WGM4
    SolutionIndex: 144
    SolutionNameMin: Cijk_Alik_Bljk_HHS_BH_MT16x16x8_SN_SU0_SUM0_TT2_2_WG8_8_1_WGM8
    SolutionIndex: 145
    SolutionNameMin: Cijk_Alik_Bljk_HHS_BH_MT32x32x8_SN_SU0_SUM0_TT4_4_WG8_8_1_WGM8
    SolutionIndex: 146
    SolutionNameMin: Cijk_Alik_Bljk_HHS_BH_MT32x16x8_SN_SU0_SUM0_TT2_2_WG16_8_1_WGM8
    SolutionIndex: 147
    SolutionNameMin: Cijk_Alik_Bljk_HHS_BH_MT64x32x8_SN_SU0_SUM0_TT4_4_WG16_8_1_WGM8
    SolutionIndex: 148
    SolutionNameMin: Cijk_Alik_Bljk_HHS_BH_MT32x32x8_SN_SU0_SUM0_TT2_2_WG16_16_1_WGM8
    SolutionIndex: 149
    SolutionNameMin: Cijk_Alik_Bljk_HHS_BH_MT64x64x8_SN_SU0_SUM0_TT4_4_WG16_16_1_WGM8
    SolutionIndex: 150
    SolutionNameMin: Cijk_Alik_Bljk_HHS_BH_MT16x16x16_SN_SU0_SUM0_TT2_2_WG8_8_1_WGM8
    SolutionIndex: 151
    SolutionNameMin: Cijk_Alik_Bljk_HHS_BH_MT32x32x16_SN_SU0_SUM0_TT4_4_WG8_8_1_WGM8
    SolutionIndex: 152
    SolutionNameMin: Cijk_Alik_Bljk_HHS_BH_MT32x16x16_SN_SU0_SUM0_TT2_2_WG16_8_1_WGM8
    SolutionIndex: 153
    SolutionNameMin: Cijk_Alik_Bljk_HHS_BH_MT16x16x32_SN_SU0_SUM0_TT2_2_WG8_8_1_WGM8
    SolutionIndex: 154
    SolutionNameMin: Cijk_Alik_Bljk_HHS_BH_MT16x16x8_SN_SU32_SUM3_TT2_2_WG8_8_1_WGM8
    SolutionIndex: 155
    SolutionNameMin: Cijk_Alik_Bljk_HHS_BH_MT32x32x8_SN_SU32_SUM3_TT4_4_WG8_8_1_WGM8
    SolutionIndex: 156
    SolutionNameMin: Cijk_Alik_Bljk_HHS_BH_MT32x16x8_SN_SU32_SUM3_TT2_2_WG16_8_1_WGM8
    SolutionIndex: 157
    SolutionNameMin: Cijk_Alik_Bljk_HHS_BH_MT64x32x8_SN_SU32_SUM3_TT4_4_WG16_8_1_WGM8
    SolutionIndex: 158
    SolutionNameMin: Cijk_Alik_Bljk_HHS_BH_MT32x32x8_SN_SU32_SUM3_TT2_2_WG16_16_1_WGM8
    SolutionIndex: 159
    SolutionNameMin: Cijk_Alik_Bljk_HHS_BH_MT64x64x8_SN_SU32_SUM3_TT4_4_WG16_16_1_WGM8
    SolutionIndex: 160
    SolutionNameMin: Cijk_Alik_Bljk_HHS_BH_MT16x16x16_SN_SU32_SUM3_TT2_2_WG8_8_1_WGM8
    SolutionIndex: 161
    SolutionNameMin: Cijk_Alik_Bljk_HHS_BH_MT32x32x16_SN_SU32_SUM3_TT4_4_WG8_8_1_WGM8
    SolutionIndex: 162
    SolutionNameMin: Cijk_Alik_Bljk_HHS_BH_MT32x16x16_SN_SU32_SUM3_TT2_2_WG16_8_1_WGM8
    SolutionIndex: 163
    SolutionNameMin: Cijk_Alik_Bljk_HHS_BH_MT32x32x32_SN_SU32_SUM3_TT2_2_WG16_16_1_WGM8
    SolutionIndex: 164
    SolutionNameMin: Cijk_Alik_Bljk_HHS_BH_MT32x32x8_SN_SU0_SUM0_TT4_4_WG8_8_1_WGM1
    SolutionIndex: 165
    SolutionNameMin: Cijk_Alik_Bljk_HHS_BH_MT64x64x8_SN_SU0_SUM0_TT4_4_WG16_16_1_WGM1
    SolutionIndex: 166
    SolutionNameMin: Cijk_Alik_Bljk_HHS_BH_MT16x16x16_SN_SU0_SUM0_TT2_2_WG8_8_1_WGM1
    SolutionIndex: 167
    SolutionNameMin: Cijk_Alik_Bljk_HHS_BH_MT16x16x32_SN_SU0_SUM0_TT2_2_WG8_8_1_WGM1
    SolutionIndex: 168
    SolutionNameMin: Cijk_Alik_Bljk_HHS_BH_MT32x32x16_SN_SU32_SUM3_TT4_4_WG8_8_1_WGM1
    SolutionIndex: 169
    SolutionNameMin: Cijk_Alik_Bljk_HHS_BH_MT32x32x8_SN_SU0_SUM0_TT4_4_WG8_8_1_WGM4
    SolutionIndex: 170
    SolutionNameMin: Cijk_Alik_Bljk_HHS_BH_MT16x16x16_SN_SU0_SUM0_TT2_2_WG8_8_1_WGM4
    SolutionIndex: 171
    SolutionNameMin: Cijk_Alik_Bljk_HHS_BH_MT32x32x16_SN_SU0_SUM0_TT4_4_WG8_8_1_WGM4
    SolutionIndex: 172
    SolutionNameMin: Cijk_Alik_Bljk_HHS_BH_MT16x16x32_SN_SU0_SUM0_TT2_2_WG8_8_1_WGM4
    SolutionIndex: 173
    SolutionNameMin: Cijk_Alik_Bljk_HHS_BH_MT64x64x8_SN_SU32_SUM3_TT4_4_WG16_16_1_WGM4
    SolutionIndex: 174
    SolutionNameMin: Cijk_Alik_Bljk_HHS_BH_MT32x32x8_SN_SU0_SUM0_TT4_4_WG8_8_1_WGM8
    SolutionIndex: 175
    SolutionNameMin: Cijk_Alik_Bljk_HHS_BH_MT64x64x8_SN_SU0_SUM0_TT4_4_WG16_16_1_WGM8
    SolutionIndex: 176
    SolutionNameMin: Cijk_Alik_Bljk_HHS_BH_MT16x16x16_SN_SU0_SUM0_TT2_2_WG8_8_1_WGM8
    SolutionIndex: 177
    SolutionNameMin: Cijk_Alik_Bljk_HHS_BH_MT32x32x16_SN_SU0_SUM0_TT4_4_WG8_8_1_WGM8
    SolutionIndex: 178
    SolutionNameMin: Cijk_Alik_Bljk_HHS_BH_MT16x16x32_SN_SU0_SUM0_TT2_2_WG8_8_1_WGM8
    SolutionIndex: 179
    SolutionNameMin: Cijk_Alik_Bljk_HHS_BH_MT64x64x8_SN_SU32_SUM3_TT4_4_WG16_16_1_WGM8
    SolutionIndex: 180
    SolutionNameMin: Cijk_Alik_Bljk_HHS_BH_MT16x16x32_SN_SU32_SUM3_TT2_2_WG8_8_1_WGM8
    SolutionIndex: 181
    SolutionNameMin: Cijk_Alik_Bljk_HHS_BH_MT32x8x8_SN_SU0_SUM0_TT2_2_WG16_4_1_WGM1
    SolutionIndex: 182
    SolutionNameMin: Cijk_Alik_Bljk_HHS_BH_MT32x8x16_SN_SU0_SUM0_TT2_2_WG16_4_1_WGM1
    SolutionIndex: 183
    SolutionNameMin: Cijk_Alik_Bljk_HHS_BH_MT32x8x8_SN_SU32_SUM3_TT2_2_WG16_4_1_WGM1
    SolutionIndex: 184
    SolutionNameMin: Cijk_Alik_Bljk_HHS_BH_MT32x8x16_SN_SU32_SUM3_TT2_2_WG16_4_1_WGM1
    SolutionIndex: 185
    SolutionNameMin: Cijk_Alik_Bljk_HHS_BH_MT32x8x16_SN_SU0_SUM0_TT2_2_WG16_4_1_WGM4
    SolutionIndex: 186
    SolutionNameMin: Cijk_Alik_Bljk_HHS_BH_MT32x8x8_SN_SU32_SUM3_TT2_2_WG16_4_1_WGM4
    SolutionIndex: 187
    SolutionNameMin: Cijk_Alik_Bljk_HHS_BH_MT32x8x16_SN_SU32_SUM3_TT2_2_WG16_4_1_WGM4
    SolutionIndex: 188
    SolutionNameMin: Cijk_Alik_Bljk_HHS_BH_MT32x8x8_SN_SU32_SUM3_TT2_2_WG16_4_1_WGM8
    SolutionIndex: 189
    SolutionNameMin: Cijk_Alik_Bljk_HHS_BH_MT32x8x16_SN_SU32_SUM3_TT2_2_WG16_4_1_WGM8
    SolutionIndex: 190
    SolutionNameMin: Cijk_Alik_Bljk_HHS_BH_MT16x32x8_SN_SU32_SUM3_TT2_4_WG8_8_1_WGM1
    SolutionIndex: 191
    SolutionNameMin: Cijk_Alik_Bljk_HHS_BH_MT32x32x8_SN_SU32_SUM3_TT2_4_WG16_8_1_WGM4
    SolutionIndex: 192
    SolutionNameMin: Cijk_Alik_Bljk_HHS_BH_MT32x32x8_SN_SU32_SUM3_TT2_4_WG16_8_1_WGM8
    SolutionIndex: 193
    SolutionNameMin: Cijk_Alik_Bljk_HHS_BH_MT16x16x8_SN_SU0_SUM0_SUS0_TT2_2_WG8_8_1_WGM4
    SolutionIndex: 194
    SolutionNameMin: Cijk_Alik_Bljk_HHS_BH_MT16x16x8_SN_SU0_SUM0_SUS0_TT2_2_WG8_8_1_WGM8
    SolutionIndex: 195
    SolutionNameMin: Cijk_Alik_Bljk_HHS_BH_MT16x16x16_SN_SU0_SUM0_SUS0_TT2_2_WG8_8_1_WGM1
    SolutionIndex: 196
    SolutionNameMin: Cijk_Alik_Bljk_HHS_BH_MT16x16x16_SN_SU0_SUM0_SUS0_TT2_2_WG8_8_1_WGM8
    SolutionIndex: 197
    SolutionNameMin: Cijk_Alik_Bljk_HHS_BH_MT16x16x16_SN_SU0_SUM0_SUS0_TT2_2_WG8_8_1_WGM4
    SolutionIndex: 198
    SolutionNameMin: Cijk_Alik_Bljk_HHS_BH_MT32x16x8_SN_SU0_SUM0_SUS0_TT2_2_WG16_8_1_WGM8
    SolutionIndex: 199
    SolutionNameMin: Cijk_Alik_Bljk_HHS_BH_MT32x16x8_SN_SU0_SUM0_SUS0_TT2_2_WG16_8_1_WGM1
    SolutionIndex: 200
    SolutionNameMin: Cijk_Alik_Bljk_HHS_BH_MT32x32x8_SN_SU0_SUM0_SUS0_TT2_2_WG16_16_1_WGM8
    SolutionIndex: 201
    SolutionNameMin: Cijk_Alik_Bljk_HHS_BH_MT32x32x8_SN_SU0_SUM0_SUS0_TT4_4_WG8_8_1_WGM4
    SolutionIndex: 202
    SolutionNameMin: Cijk_Alik_Bljk_HHS_BH_MT32x16x8_SN_SU32_SUM3_SUS128_TT2_2_WG16_8_1_WGM8
    SolutionIndex: 203
    SolutionNameMin: Cijk_Alik_Bljk_HHS_BH_MT32x32x8_SN_SU32_SUM3_SUS128_TT4_4_WG8_8_1_WGM8
    SolutionIndex: 204
    SolutionNameMin: Cijk_Alik_Bljk_HHS_BH_MT32x32x8_SN_SU32_SUM3_SUS128_TT2_2_WG16_16_1_WGM8
    SolutionIndex: 205
    SolutionNameMin: Cijk_Alik_Bljk_HHS_BH_MT32x32x8_SN_SU32_SUM3_SUS128_TT2_2_WG16_16_1_WGM4
    SolutionIndex: 206
    SolutionNameMin: Cijk_Alik_Bljk_HHS_BH_MT32x32x8_SN_SU32_SUM3_SUS128_TT2_2_WG16_16_1_WGM1
    SolutionIndex: 207
    SolutionNameMin: Cijk_Alik_Bljk_HHS_BH_MT32x32x8_SN_SU0_SUM0_SUS0_TT2_2_WG16_16_1_WGM4
    SolutionIndex: 208
    SolutionNameMin: Cijk_Alik_Bljk_HHS_BH_MT32x32x16_SN_SU32_SUM3_SUS128_TT4_4_WG8_8_1_WGM1
    SolutionIndex: 209
    SolutionNameMin: Cijk_Alik_Bljk_HHS_BH_MT16x16x8_SN_SU0_SUM0_SUS0_TT2_2_WG8_8_1_WGM1
    SolutionIndex: 210
    SolutionNameMin: Cijk_Alik_Bljk_HHS_BH_MT32x32x8_SN_SU0_SUM0_SUS0_TT2_2_WG16_16_1_WGM1
    SolutionIndex: 211
    SolutionNameMin: Cijk_Alik_Bljk_HHS_BH_MT32x32x8_SN_SU0_SUM0_SUS0_TT4_4_WG8_8_1_WGM8
    SolutionIndex: 212
    SolutionNameMin: Cijk_Alik_Bljk_HHS_BH_MT64x64x8_SN_SU0_SUM0_SUS0_TT4_4_WG16_16_1_WGM4
    SolutionIndex: 213
    SolutionNameMin: Cijk_Alik_Bljk_HHS_BH_MT64x64x8_SN_SU32_SUM3_SUS128_TT4_4_WG16_16_1_WGM1
    SolutionIndex: 214
    SolutionNameMin: Cijk_Alik_Bljk_HHS_BH_MT64x64x8_SN_SU0_SUM0_SUS0_TT4_4_WG16_16_1_WGM8
    SolutionIndex: 215
    SolutionNameMin: Cijk_Alik_Bljk_HHS_BH_MT64x64x8_SN_SU0_SUM0_SUS0_TT4_4_WG16_16_1_WGM1
    SolutionIndex: 216
    SolutionNameMin: Cijk_Alik_Bljk_HHS_BH_MT32x32x8_SN_SU32_SUM3_SUS128_TT4_4_WG8_8_1_WGM1
    SolutionIndex: 217
    SolutionNameMin: Cijk_Alik_Bljk_HHS_BH_MT64x64x8_SN_SU32_SUM3_SUS128_TT4_4_WG16_16_1_WGM8
    SolutionIndex: 218
    SolutionNameMin: Cijk_Alik_Bljk_HHS_BH_MT64x64x8_SN_SU32_SUM3_SUS128_TT4_4_WG16_16_1_WGM4
- - - [2368, 1024, 1, 1]
    - [40, 1.155]
  - - [5056, 1408, 1, 3328]
    - [12, 72.979]
  - - [5056, 1856, 1, 3328]
    - [22, 73.852]
  - - [448, 3584, 1, 3328]
    - [22, 55.821]
  - - [5056, 4288, 1, 32]
    - [17, 60.176]
  - - [3584, 1024, 1, 256]
    - [37, 64.875]
  - - [1408, 3584, 1, 3328]
    - [43, 74.12]
  - - [1024, 2368, 1, 3328]
    - [27, 62.633]
  - - [448, 3584, 1, 32]
    - [18, 20.857]
  - - [4288, 6784, 1, 3328]
    - [7, 80.792]
  - - [5888, 4288, 1, 3328]
    - [22, 82.728]
  - - [2368, 1408, 1, 32]
    - [17, 37.502]
  - - [1024, 2944, 1, 1]
    - [33, 1.587]
  - - [2944, 3584, 1, 3328]
    - [22, 79.965]
  - - [2368, 2944, 1, 1280]
    - [27, 72.75]
  - - [6784, 5888, 1, 3328]
    - [22, 83.673]
  - - [3584, 1408, 1, 32]
    - [40, 41.778]
  - - [5056, 256, 1, 256]
    - [11, 43.996]
  - - [1856, 2368, 1, 256]
    - [27, 63.327]
  - - [2368, 1024, 1, 3328]
    - [27, 62.387]
  - - [3584, 4288, 1, 32]
    - [40, 58.936]
  - - [3584, 3584, 1, 1]
    - [24, 2.421]
  - - [1408, 2368, 1, 1]
    - [8, 1.869]
  - - [5056, 6784, 1, 1280]
    - [7, 81.419]
  - - [4288, 5056, 1, 1]
    - [8, 2.551]
  - - [5056, 4288, 1, 1]
    - [40, 2.534]
  - - [1408, 4288, 1, 1280]
    - [27, 71.742]
  - - [4288, 1024, 1, 3328]
    - [39, 74.134]
  - - [1024, 5056, 1, 1]
    - [33, 1.994]
  - - [704, 3584, 1, 1280]
    - [43, 63.334]
  - - [1856, 5056, 1, 256]
    - [22, 68.68]
  - - [1408, 1024, 1, 1280]
    - [37, 59.459]
  - - [5056, 5888, 1, 3328]
    - [22, 82.296]
  - - [3584, 3584, 1, 1280]
    - [22, 83.078]
  - - [2368, 3584, 1, 32]
    - [40, 51.239]
  - - [2944, 2368, 1, 1]
    - [0, 2.271]
  - - [704, 4288, 1, 1]
    - [40, 1.319]
  - - [1024, 6784, 1, 1280]
    - [22, 80.266]
  - - [1024, 3584, 1, 1]
    - [40, 1.828]
  - - [256, 5056, 1, 32]
    - [8, 26.992]
  - - [2368, 5056, 1, 32]
    - [17, 54.794]
  - - [6784, 1856, 1, 32]
    - [17, 59.529]
  - - [5056, 704, 1, 1]
    - [17, 1.601]
  - - [2944, 4288, 1, 256]
    - [14, 73.722]
  - - [5056, 704, 1, 32]
    - [8, 38.901]
  - - [1856, 4288, 1, 3328]
    - [43, 72.929]
  - - [6784, 4288, 1, 32]
    - [17, 63.838]
  - - [5888, 5056, 1, 256]
    - [22, 77.011]
  - - [3584, 2368, 1, 3328]
    - [22, 75.969]
  - - [4288, 1856, 1, 1]
    - [40, 2.197]
  - - [1856, 2944, 1, 1]
    - [23, 1.939]
  - - [1856, 2368, 1, 32]
    - [0, 42.39]
  - - [4288, 1856, 1, 32]
    - [0, 51.603]
  - - [5056, 2368, 1, 256]
    - [37, 70.238]
  - - [1408, 5888, 1, 256]
    - [43, 71.373]
  - - [5056, 6784, 1, 1]
    - [40, 2.64]
  - - [1024, 1408, 1, 3328]
    - [27, 60.557]
  - - [256, 5056, 1, 1280]
    - [37, 52.508]
  - - [704, 2368, 1, 1]
    - [40, 0.962]
  - - [3584, 4288, 1, 1280]
    - [22, 77.242]
  - - [3584, 2368, 1, 1]
    - [40, 2.305]
  - - [4288, 448, 1, 3328]
    - [39, 65.979]
  - - [704, 6784, 1, 1280]
    - [27, 68.779]
  - - [2368, 4288, 1, 32]
    - [17, 53.516]
  - - [704, 5056, 1, 1280]
    - [43, 65.331]
  - - [3584, 6784, 1, 32]
    - [34, 62.37]
  - - [3584, 6784, 1, 1280]
    - [22, 82.4]
  - - [4288, 4288, 1, 3328]
    - [29, 79.217]
  - - [1408, 3584, 1, 1]
    - [8, 2.134]
  - - [4288, 1856, 1, 3328]
    - [43, 72.849]
  - - [1856, 2944, 1, 1280]
    - [29, 73.165]
  - - [5056, 1024, 1, 3328]
    - [27, 75.781]
  - - [3584, 704, 1, 1]
    - [40, 1.577]
  - - [448, 5056, 1, 1]
    - [18, 0.892]
  - - [5888, 5888, 1, 256]
    - [45, 80.411]
  - - [3584, 704, 1, 32]
    - [33, 37.013]
  - - [448, 6784, 1, 3328]
    - [29, 70.149]
  - - [6784, 4288, 1, 1]
    - [8, 2.703]
  - - [3584, 6784, 1, 1]
    - [33, 2.595]
  - - [1408, 2368, 1, 32]
    - [17, 43.603]
  - - [448, 5056, 1, 32]
    - [33, 25.183]
  - - [4288, 4288, 1, 1280]
    - [7, 78.496]
  - - [6784, 1408, 1, 1]
    - [8, 2.431]
  - - [1856, 5888, 1, 3328]
    - [22, 78.279]
  - - [3584, 1856, 1, 3328]
    - [27, 73.134]
  - - [5056, 5888, 1, 1]
    - [40, 2.597]
  - - [2944, 1024, 1, 256]
    - [37, 58.483]
  - - [2368, 4288, 1, 3328]
    - [22, 76.777]
  - - [2944, 6784, 1, 256]
    - [37, 76.206]
  - - [2368, 2368, 1, 1280]
    - [12, 67.028]
  - - [3584, 3584, 1, 32]
    - [33, 57.962]
  - - [2944, 2944, 1, 1280]
    - [43, 76.543]
  - - [1408, 5056, 1, 1]
    - [0, 2.32]
  - - [2368, 6784, 1, 1]
    - [0, 2.474]
  - - [6784, 4288, 1, 1280]
    - [22, 81.245]
  - - [2944, 704, 1, 256]
    - [43, 55.24]
  - - [2368, 6784, 1, 1280]
    - [43, 76.49]
  - - [704, 2944, 1, 3328]
    - [22, 71.345]
  - - [5888, 256, 1, 1]
    - [0, 1.307]
  - - [5056, 6784, 1, 32]
    - [34, 63.467]
  - - [448, 5056, 1, 1280]
    - [27, 57.427]
  - - [256, 5888, 1, 3328]
    - [27, 63.296]
  - - [5888, 1024, 1, 1]
    - [40, 2.242]
  - - [5888, 448, 1, 32]
    - [40, 40.707]
  - - [6784, 2944, 1, 256]
    - [20, 76.871]
  - - [4288, 2944, 1, 256]
    - [27, 72.42]
  - - [448, 5888, 1, 3328]
    - [39, 61.538]
  - - [1408, 4288, 1, 1]
    - [40, 2.24]
  - - [1408, 1856, 1, 3328]
    - [43, 67.33]
  - - [3584, 1024, 1, 3328]
    - [12, 68.733]
  - - [2944, 5888, 1, 3328]
    - [14, 82.636]
  - - [448, 4288, 1, 3328]
    - [22, 66.293]
  - - [704, 2368, 1, 256]
    - [14, 47.509]
  - - [4288, 3584, 1, 3328]
    - [22, 78.853]
  - - [1408, 1024, 1, 1]
    - [23, 1.259]
  - - [1408, 1024, 1, 256]
    - [37, 53.166]
  - - [5056, 3584, 1, 1]
    - [24, 2.474]
  - - [6784, 6784, 1, 3328]
    - [22, 82.473]
  - - [2368, 2944, 1, 3328]
    - [27, 73.491]
  - - [5056, 3584, 1, 32]
    - [17, 58.748]
  - - [5056, 3584, 1, 1280]
    - [22, 80.097]
  - - [1856, 1856, 1, 256]
    - [43, 57.533]
  - - [5888, 4288, 1, 1]
    - [8, 2.657]
  - - [5056, 704, 1, 256]
    - [27, 59.286]
  - - [2368, 5056, 1, 256]
    - [29, 71.947]
  - - [1024, 5056, 1, 256]
    - [43, 68.699]
  - - [5888, 448, 1, 256]
    - [26, 51.956]
  - - [6784, 5056, 1, 1280]
    - [22, 82.014]
  - - [4288, 6784, 1, 1280]
    - [22, 80.252]
  - - [704, 6784, 1, 3328]
    - [43, 69.946]
  - - [2944, 1856, 1, 1]
    - [40, 2.168]
  - - [5888, 4288, 1, 1280]
    - [22, 81.896]
  - - [5888, 3584, 1, 1280]
    - [22, 83.104]
  - - [3584, 1408, 1, 1280]
    - [27, 73.329]
  - - [1024, 2944, 1, 256]
    - [12, 62.071]
  - - [2944, 1856, 1, 1280]
    - [43, 71.393]
  - - [1024, 2368, 1, 1]
    - [40, 1.642]
  - - [2944, 3584, 1, 1280]
    - [22, 79.685]
  - - [1856, 4288, 1, 256]
    - [43, 67.761]
  - - [448, 3584, 1, 1]
    - [24, 0.764]
  - - [2368, 2944, 1, 32]
    - [23, 49.441]
  - - [4288, 704, 1, 256]
    - [20, 57.514]
  - - [1856, 1024, 1, 256]
    - [14, 53.668]
  - - [704, 6784, 1, 32]
    - [33, 39.54]
  - - [1024, 4288, 1, 1]
    - [33, 1.989]
  - - [1408, 5888, 1, 1280]
    - [12, 75.54]
  - - [5056, 1856, 1, 256]
    - [27, 69.572]
  - - [6784, 704, 1, 1280]
    - [27, 68.721]
  - - [5888, 1024, 1, 256]
    - [37, 70.038]
  - - [6784, 1856, 1, 3328]
    - [12, 75.957]
  - - [2368, 5888, 1, 1280]
    - [29, 76.063]
  - - [5888, 6784, 1, 32]
    - [9, 68.039]
  - - [6784, 6784, 1, 32]
    - [41, 70.098]
  - - [6784, 256, 1, 256]
    - [21, 59.558]
  - - [2368, 3584, 1, 3328]
    - [22, 75.69]
  - - [5888, 1024, 1, 1280]
    - [27, 72.348]
  - - [5888, 6784, 1, 3328]
    - [22, 82.436]
  - - [6784, 448, 1, 1]
    - [8, 1.449]
  - - [6784, 1856, 1, 1]
    - [8, 2.522]
  - - [2944, 2368, 1, 1280]
    - [27, 70.648]
  - - [6784, 448, 1, 32]
    - [17, 42.33]
  - - [6784, 448, 1, 3328]
    - [27, 65.902]
  - - [448, 3584, 1, 1280]
    - [39, 53.971]
  - - [1408, 6784, 1, 1280]
    - [22, 75.195]
  - - [5056, 5888, 1, 1280]
    - [29, 81.819]
  - - [5888, 704, 1, 1]
    - [8, 1.953]
  - - [3584, 1856, 1, 1]
    - [40, 2.139]
  - - [5056, 2944, 1, 32]
    - [23, 56.858]
  - - [4288, 6784, 1, 1]
    - [0, 2.619]
  - - [1024, 6784, 1, 1]
    - [33, 2.264]
  - - [2368, 5888, 1, 32]
    - [0, 56.091]
  - - [3584, 4288, 1, 1]
    - [40, 2.493]
  - - [5888, 1024, 1, 3328]
    - [27, 72.967]
  - - [6784, 5888, 1, 256]
    - [39, 80.826]
  - - [5056, 1024, 1, 1]
    - [40, 1.83]
  - - [4288, 2368, 1, 32]
    - [33, 53.443]
  - - [704, 3584, 1, 1]
    - [40, 1.203]
  - - [6784, 704, 1, 32]
    - [17, 48.874]
  - - [704, 5888, 1, 256]
    - [22, 63.303]
  - - [2368, 3584, 1, 1280]
    - [22, 75.084]
  - - [3584, 5056, 1, 32]
    - [33, 59.905]
  - - [6784, 1856, 1, 1280]
    - [39, 74.197]
  - - [5056, 5056, 1, 3328]
    - [22, 79.933]
  - - [2368, 5056, 1, 1]
    - [40, 2.303]
  - - [5888, 1408, 1, 256]
    - [20, 72.856]
  - - [2368, 1024, 1, 32]
    - [17, 32.94]
  - - [4288, 1024, 1, 256]
    - [14, 68.306]
  - - [4288, 5888, 1, 1280]
    - [22, 81.674]
  - - [1856, 2944, 1, 3328]
    - [22, 73.835]
  - - [5056, 5888, 1, 256]
    - [14, 78.499]
  - - [5056, 256, 1, 3328]
    - [5, 53.928]
  - - [1024, 5888, 1, 1280]
    - [43, 72.509]
  - - [5888, 5056, 1, 1280]
    - [22, 81.708]
  - - [5888, 2944, 1, 1]
    - [0, 2.587]
  - - [1408, 4288, 1, 3328]
    - [43, 72.685]
  - - [704, 2944, 1, 32]
    - [33, 28.971]
  - - [2944, 4288, 1, 3328]
    - [45, 81.397]
  - - [5056, 2944, 1, 256]
    - [27, 73.765]
  - - [2368, 1856, 1, 256]
    - [27, 62.51]
  - - [2368, 4288, 1, 1280]
    - [14, 75.719]
  - - [3584, 448, 1, 256]
    - [26, 50.21]
  - - [256, 6784, 1, 256]
    - [21, 59.558]
  - - [1024, 1408, 1, 1]
    - [21, 1.198]
  - - [256, 5888, 1, 1]
    - [1, 1.114]
  - - [2944, 2944, 1, 1]
    - [8, 2.414]
  - - [6784, 3584, 1, 256]
    - [22, 80.216]
  - - [1408, 1856, 1, 256]
    - [12, 53.877]
  - - [2944, 2944, 1, 32]
    - [17, 56.484]
  - - [2944, 2944, 1, 3328]
    - [27, 77.16]
  - - [6784, 1408, 1, 32]
    - [33, 56.783]
  - - [2368, 6784, 1, 3328]
    - [7, 76.997]
  - - [4288, 3584, 1, 32]
    - [17, 57.453]
  - - [3584, 704, 1, 1280]
    - [27, 62.823]
  - - [448, 5056, 1, 3328]
    - [43, 58.495]
  - - [4288, 448, 1, 256]
    - [20, 51.828]
  - - [5056, 256, 1, 1280]
    - [5, 52.03]
  - - [2944, 5888, 1, 32]
    - [17, 61.75]
  - - [3584, 5056, 1, 256]
    - [43, 74.076]
  - - [3584, 2368, 1, 256]
    - [27, 70.624]
  - - [4288, 4288, 1, 256]
    - [7, 74.484]
  - - [448, 5056, 1, 256]
    - [27, 50.403]
  - - [4288, 704, 1, 1280]
    - [43, 63.807]
  - - [2368, 704, 1, 1]
    - [0, 1.128]
  - - [1408, 1856, 1, 1280]
    - [27, 65.119]
  - - [3584, 4288, 1, 3328]
    - [29, 78.2]
  - - [448, 4288, 1, 32]
    - [40, 23.529]
  - - [448, 4288, 1, 1280]
    - [22, 64.53]
  - - [5056, 1024, 1, 256]
    - [12, 69.507]
  - - [4288, 3584, 1, 1280]
    - [22, 78.033]
  - - [1856, 3584, 1, 32]
    - [17, 48.79]
  - - [5056, 3584, 1, 3328]
    - [22, 80.594]
  - - [4288, 5056, 1, 256]
    - [14, 76.464]
  - - [1856, 5888, 1, 256]
    - [29, 72.786]
  - - [2368, 3584, 1, 1]
    - [0, 2.197]
  - - [4288, 2368, 1, 256]
    - [43, 70.985]
  - - [1408, 2944, 1, 3328]
    - [39, 73.09]
  - - [5888, 3584, 1, 1]
    - [0, 2.664]
  - - [6784, 5056, 1, 3328]
    - [22, 82.653]
  - - [6784, 5056, 1, 1]
    - [17, 2.679]
  - - [5888, 3584, 1, 32]
    - [8, 60.397]
  - - [5888, 3584, 1, 3328]
    - [7, 83.693]
  - - [1024, 6784, 1, 256]
    - [5, 73.252]
  - - [6784, 5888, 1, 32]
    - [34, 66.915]
  - - [2368, 6784, 1, 32]
    - [8, 56.964]
  - - [5056, 1408, 1, 1280]
    - [12, 72.333]
  - - [3584, 1408, 1, 3328]
    - [12, 73.939]
  - - [2944, 3584, 1, 1]
    - [0, 2.438]
  - - [2944, 1408, 1, 1280]
    - [22, 70.862]
  - - [3584, 1024, 1, 1]
    - [24, 1.828]
  - - [2944, 1856, 1, 3328]
    - [43, 72.333]
  - - [2944, 3584, 1, 32]
    - [0, 57.989]
  - - [5888, 256, 1, 32]
    - [0, 29.671]
  - - [6784, 5056, 1, 256]
    - [14, 78.077]
  - - [1856, 3584, 1, 1280]
    - [22, 77.638]
  - - [256, 5888, 1, 256]
    - [5, 55.317]
  - - [1024, 4288, 1, 3328]
    - [22, 76.669]
  - - [2368, 1408, 1, 1]
    - [8, 1.616]
  - - [1024, 1856, 1, 32]
    - [33, 32.019]
  - - [5888, 2368, 1, 1]
    - [40, 2.558]
  - - [2368, 2368, 1, 1]
    - [8, 2.011]
  - - [704, 4288, 1, 256]
    - [45, 57.798]
  - - [5888, 2368, 1, 32]
    - [8, 59.635]
  - - [5888, 2368, 1, 1280]
    - [22, 76.179]
  - - [2944, 5056, 1, 3328]
    - [22, 81.532]
  - - [6784, 704, 1, 3328]
    - [27, 69.852]
  - - [1856, 1856, 1, 32]
    - [17, 38.409]
  - - [4288, 2944, 1, 32]
    - [0, 55.471]
  - - [256, 5056, 1, 1]
    - [0, 0.974]
  - - [5056, 5056, 1, 256]
    - [14, 75.791]
  - - [5888, 256, 1, 256]
    - [12, 54.861]
  - - [6784, 6784, 1, 256]
    - [29, 78.913]
  - - [3584, 704, 1, 3328]
    - [27, 64.644]
  - - [4288, 704, 1, 3328]
    - [43, 65.145]
  - - [4288, 2944, 1, 1280]
    - [12, 76.389]
  - - [448, 3584, 1, 256]
    - [22, 45.216]
  - - [6784, 256, 1, 32]
    - [40, 33.668]
  - - [6784, 1408, 1, 1280]
    - [12, 74.889]
  - - [2368, 5056, 1, 1280]
    - [22, 77.235]
  - - [1408, 1408, 1, 1280]
    - [45, 66.061]
  - - [5888, 1856, 1, 32]
    - [33, 57.914]
  - - [5888, 704, 1, 3328]
    - [7, 70.168]
  - - [448, 6784, 1, 256]
    - [39, 59.107]
  - - [2944, 5888, 1, 256]
    - [29, 78.887]
  - - [1856, 1408, 1, 32]
    - [0, 34.766]
  - - [5888, 2944, 1, 1280]
    - [27, 77.527]
  - - [448, 5888, 1, 1]
    - [40, 0.904]
  - - [3584, 1408, 1, 1]
    - [40, 1.97]
  - - [448, 5888, 1, 32]
    - [36, 26.782]
  - - [5056, 704, 1, 1280]
    - [43, 65.541]
  - - [1856, 6784, 1, 1]
    - [17, 2.351]
  - - [2368, 1024, 1, 256]
    - [21, 50.704]
  - - [1856, 6784, 1, 32]
    - [17, 54.704]
  - - [1856, 6784, 1, 1280]
    - [12, 75.193]
  - - [5888, 5056, 1, 3328]
    - [22, 82.311]
  - - [1408, 6784, 1, 32]
    - [17, 53.176]
  - - [3584, 5888, 1, 3328]
    - [22, 84.252]
  - - [4288, 1408, 1, 256]
    - [12, 67.272]
  - - [6784, 2368, 1, 256]
    - [20, 73.302]
  - - [1856, 1408, 1, 1280]
    - [27, 65.381]
  - - [1856, 2368, 1, 1]
    - [8, 1.84]
  - - [1408, 5056, 1, 3328]
    - [27, 73.032]
  - - [5056, 4288, 1, 256]
    - [45, 76.22]
  - - [5056, 5056, 1, 32]
    - [17, 60.578]
  - - [448, 5888, 1, 1280]
    - [22, 59.556]
  - - [5056, 448, 1, 256]
    - [26, 52.25]
  - - [4288, 5888, 1, 1]
    - [40, 2.59]
  - - [1856, 5056, 1, 1280]
    - [29, 73.787]
  - - [2368, 4288, 1, 1]
    - [0, 2.283]
  - - [3584, 1856, 1, 256]
    - [27, 67.916]
  - - [4288, 5888, 1, 32]
    - [0, 60.88]
  - - [4288, 5888, 1, 3328]
    - [22, 82.239]
  - - [1024, 2944, 1, 3328]
    - [22, 70.252]
  - - [2944, 2368, 1, 256]
    - [37, 68.133]
  - - [1024, 1856, 1, 256]
    - [29, 54.063]
  - - [1024, 5888, 1, 32]
    - [33, 50.024]
  - - [1024, 5888, 1, 3328]
    - [27, 73.052]
  - - [5056, 2368, 1, 32]
    - [23, 56.192]
  - - [1408, 2368, 1, 1280]
    - [43, 70.32]
  - - [5056, 6784, 1, 3328]
    - [22, 82.318]
  - - [1408, 2944, 1, 256]
    - [27, 62.929]
  - - [704, 5056, 1, 32]
    - [40, 33.907]
  - - [5056, 4288, 1, 1280]
    - [22, 81.337]
  - - [4288, 448, 1, 1]
    - [0, 1.201]
  - - [5888, 5888, 1, 1]
    - [33, 2.727]
  - - [2944, 704, 1, 1280]
    - [45, 67.978]
  - - [1024, 3584, 1, 1280]
    - [43, 68.285]
  - - [2368, 2944, 1, 1]
    - [0, 2.127]
  - - [5056, 256, 1, 32]
    - [8, 21.523]
  - - [5056, 1024, 1, 1280]
    - [43, 74.303]
  - - [3584, 6784, 1, 256]
    - [29, 77.211]
  - - [1856, 1408, 1, 256]
    - [38, 55.206]
  - - [4288, 4288, 1, 32]
    - [33, 58.673]
  - - [5888, 448, 1, 1]
    - [8, 1.758]
  - - [5056, 5056, 1, 1280]
    - [22, 79.304]
  - - [6784, 1408, 1, 3328]
    - [27, 75.465]
  - - [5888, 5888, 1, 3328]
    - [7, 83.439]
  - - [5888, 1408, 1, 32]
    - [0, 50.687]
  - - [256, 6784, 1, 3328]
    - [28, 66.037]
  - - [6784, 2368, 1, 1280]
    - [27, 76.425]
  - - [2944, 1408, 1, 1]
    - [24, 1.915]
  - - [6784, 1024, 1, 256]
    - [39, 74.318]
  - - [5056, 1408, 1, 32]
    - [17, 49.397]
  - - [1408, 6784, 1, 3328]
    - [22, 76.141]
  - - [2944, 1408, 1, 3328]
    - [22, 72.96]
  - - [704, 2368, 1, 32]
    - [40, 24.643]
  - - [704, 6784, 1, 1]
    - [40, 1.591]
  - - [2368, 6784, 1, 256]
    - [12, 73.194]
  - - [1856, 3584, 1, 3328]
    - [22, 78.858]
  - - [704, 6784, 1, 256]
    - [43, 63.51]
  - - [6784, 2944, 1, 32]
    - [34, 62.493]
  - - [5888, 2368, 1, 3328]
    - [22, 76.89]
  - - [2368, 704, 1, 1280]
    - [29, 55.36]
  - - [1024, 1408, 1, 1280]
    - [12, 59.269]
  - - [2944, 5056, 1, 32]
    - [0, 60.513]
  - - [704, 2368, 1, 3328]
    - [22, 57.952]
  - - [3584, 2944, 1, 256]
    - [43, 75.436]
  - - [3584, 1024, 1, 1280]
    - [43, 68.311]
  - - [5056, 3584, 1, 256]
    - [14, 76.929]
  - - [2368, 704, 1, 256]
    - [26, 48.131]
  - - [1856, 1856, 1, 1280]
    - [43, 63.414]
  - - [4288, 704, 1, 1]
    - [0, 1.57]
  - - [1856, 1024, 1, 1]
    - [17, 1.244]
  - - [4288, 2944, 1, 3328]
    - [27, 76.936]
  - - [4288, 704, 1, 32]
    - [17, 37.208]
  - - [1856, 1024, 1, 32]
    - [8, 28.868]
  - - [2944, 6784, 1, 1]
    - [8, 2.655]
  - - [6784, 2368, 1, 32]
    - [0, 60.761]
  - - [5888, 5056, 1, 1]
    - [4, 2.674]
  - - [704, 5888, 1, 1]
    - [33, 1.473]
  - - [6784, 6784, 1, 1]
    - [8, 2.771]
  - - [5888, 448, 1, 3328]
    - [43, 57.586]
  - - [704, 5888, 1, 32]
    - [40, 36.765]
  - - [704, 5888, 1, 1280]
    - [22, 71.424]
  - - [1024, 6784, 1, 3328]
    - [22, 81.841]
  - - [704, 2944, 1, 1280]
    - [22, 69.066]
  - - [4288, 6784, 1, 256]
    - [45, 76.758]
  - - [1408, 1408, 1, 32]
    - [17, 36.42]
  - - [1408, 1408, 1, 3328]
    - [22, 68.306]
  - - [2944, 1856, 1, 256]
    - [37, 66.237]
  - - [4288, 2944, 1, 1]
    - [8, 2.368]
  - - [6784, 5056, 1, 32]
    - [33, 64.427]
  - - [2944, 4288, 1, 1280]
    - [22, 80.457]
  - - [1024, 4288, 1, 256]
    - [27, 64.781]
  - - [2368, 5888, 1, 1]
    - [8, 2.397]
  - - [1408, 1856, 1, 32]
    - [17, 42.361]
  - - [1856, 6784, 1, 3328]
    - [29, 75.292]
  - - [1024, 2368, 1, 32]
    - [33, 35.038]
  - - [2368, 2368, 1, 3328]
    - [27, 70.665]
  - - [3584, 5888, 1, 32]
    - [33, 60.441]
  - - [3584, 5888, 1, 1280]
    - [22, 83.316]
  - - [6784, 704, 1, 256]
    - [20, 63.619]
  - - [3584, 1024, 1, 32]
    - [33, 42.648]
  - - [2368, 5888, 1, 256]
    - [14, 72.569]
  - - [5888, 5888, 1, 32]
    - [34, 68.031]
  - - [1856, 1408, 1, 3328]
    - [27, 67.028]
  - - [4288, 1024, 1, 1]
    - [0, 1.818]
  - - [704, 4288, 1, 3328]
    - [22, 70.286]
  - - [2944, 5056, 1, 1280]
    - [7, 80.674]
  - - [6784, 2944, 1, 1280]
    - [7, 79.222]
  - - [6784, 256, 1, 3328]
    - [21, 65.967]
  - - [1408, 5056, 1, 32]
    - [17, 54.386]
  - - [5888, 1856, 1, 1280]
    - [43, 72.931]
  - - [5888, 256, 1, 1280]
    - [12, 61.866]
  - - [1856, 5056, 1, 1]
    - [0, 2.245]
  - - [3584, 1856, 1, 1280]
    - [43, 72.948]
  - - [6784, 448, 1, 256]
    - [12, 54.538]
  - - [704, 3584, 1, 256]
    - [43, 55.505]
  - - [1856, 5056, 1, 32]
    - [0, 51.794]
  - - [1856, 5056, 1, 3328]
    - [22, 74.928]
  - - [1024, 2944, 1, 32]
    - [18, 36.806]
  - - [1408, 6784, 1, 256]
    - [27, 72.649]
  - - [1024, 2368, 1, 1280]
    - [43, 61.215]
  - - [1856, 3584, 1, 1]
    - [8, 2.045]
  - - [2944, 5888, 1, 1280]
    - [22, 81.973]
  - - [3584, 3584, 1, 256]
    - [29, 78.865]
  - - [1856, 2368, 1, 3328]
    - [43, 72.029]
  - - [5888, 704, 1, 256]
    - [20, 61.302]
  - - [6784, 4288, 1, 256]
    - [14, 77.021]
  - - [1408, 2368, 1, 3328]
    - [43, 71.861]
  - - [1024, 3584, 1, 256]
    - [5, 64.986]
  - - [4288, 1024, 1, 32]
    - [8, 43.661]
  - - [5888, 1856, 1, 3328]
    - [43, 73.281]
  - - [2368, 3584, 1, 256]
    - [37, 70.643]
  - - [4288, 1408, 1, 3328]
    - [43, 72.731]
  - - [256, 5056, 1, 256]
    - [36, 47.22]
  - - [5888, 2944, 1, 3328]
    - [29, 77.951]
  - - [2368, 1408, 1, 3328]
    - [27, 72.037]
  - - [5888, 704, 1, 32]
    - [40, 47.174]
  - - [2944, 704, 1, 1]
    - [40, 1.572]
  - - [6784, 1856, 1, 256]
    - [20, 70.542]
  - - [1856, 1856, 1, 1]
    - [40, 1.616]
  - - [2944, 704, 1, 3328]
    - [45, 70.853]
  - - [2368, 1856, 1, 32]
    - [33, 42.496]
  - - [5056, 4288, 1, 3328]
    - [22, 81.959]
  - - [3584, 448, 1, 3328]
    - [39, 54.847]
  - - [256, 6784, 1, 1]
    - [1, 1.225]
  - - [1024, 3584, 1, 32]
    - [40, 42.776]
  - - [256, 6784, 1, 32]
    - [18, 32.844]
  - - [2944, 1408, 1, 32]
    - [17, 46.897]
  - - [4288, 3584, 1, 1]
    - [0, 2.447]
  - - [5056, 448, 1, 3328]
    - [43, 58.271]
  - - [6784, 3584, 1, 32]
    - [41, 65.642]
  - - [4288, 1856, 1, 256]
    - [27, 68.364]
  - - [1856, 2944, 1, 256]
    - [29, 66.083]
  - - [2944, 5888, 1, 1]
    - [0, 2.626]
  - - [1024, 1856, 1, 3328]
    - [22, 65.784]
  - - [5888, 1024, 1, 32]
    - [33, 51.577]
  - - [1408, 5056, 1, 1280]
    - [29, 72.08]
  - - [5056, 6784, 1, 256]
    - [29, 78.077]
  - - [2944, 5056, 1, 1]
    - [23, 2.57]
  - - [5888, 5888, 1, 1280]
    - [22, 83.042]
  - - [5056, 2944, 1, 1280]
    - [12, 76.454]
  - - [2368, 1856, 1, 1280]
    - [43, 70.872]
  - - [6784, 2944, 1, 1]
    - [0, 2.655]
  - - [2944, 1024, 1, 32]
    - [17, 41.838]
  - - [2944, 1024, 1, 1280]
    - [27, 64.976]
  - - [5056, 5056, 1, 1]
    - [33, 2.566]
  - - [2368, 4288, 1, 256]
    - [37, 70.71]
  - - [2944, 6784, 1, 1280]
    - [22, 79.478]
  - - [256, 6784, 1, 1280]
    - [6, 65.384]
  - - [3584, 2368, 1, 32]
    - [33, 54.121]
  - - [6784, 3584, 1, 3328]
    - [22, 83.492]
  - - [2944, 2944, 1, 256]
    - [37, 73.835]
  - - [1408, 1024, 1, 3328]
    - [27, 60.284]
  - - [5056, 2368, 1, 1280]
    - [27, 72.977]
  - - [2944, 1024, 1, 1]
    - [40, 1.739]
  - - [3584, 704, 1, 256]
    - [43, 54.497]
  - - [2368, 5888, 1, 3328]
    - [39, 76.71]
  - - [4288, 2368, 1, 1]
    - [0, 2.298]
  - - [1408, 3584, 1, 32]
    - [8, 49.665]
  - - [2944, 4288, 1, 32]
    - [8, 59.035]
  - - [5888, 1408, 1, 1280]
    - [27, 76.027]
  - - [3584, 5056, 1, 1280]
    - [29, 79.765]
  - - [5888, 6784, 1, 1280]
    - [22, 81.985]
  - - [3584, 2944, 1, 1]
    - [40, 2.3]
  - - [1024, 1856, 1, 1]
    - [40, 1.432]
  - - [704, 5056, 1, 3328]
    - [43, 66.52]
  - - [1024, 3584, 1, 3328]
    - [27, 69.174]
  - - [5888, 256, 1, 3328]
    - [27, 63.105]
  - - [1856, 1408, 1, 1]
    - [0, 1.406]
  - - [4288, 5056, 1, 1280]
    - [22, 81.264]
  - - [1856, 1856, 1, 3328]
    - [43, 64.595]
  - - [1024, 2368, 1, 256]
    - [43, 53.764]
  - - [4288, 2368, 1, 3328]
    - [27, 75.282]
  - - [5888, 3584, 1, 256]
    - [22, 80.112]
  - - [1024, 5056, 1, 32]
    - [40, 47.557]
  - - [5888, 448, 1, 1280]
    - [43, 56.655]
  - - [704, 5888, 1, 3328]
    - [22, 73.073]
  - - [1024, 1408, 1, 256]
    - [43, 52.725]
  - - [3584, 2944, 1, 1280]
    - [43, 77.853]
  - - [4288, 1856, 1, 1280]
    - [22, 70.312]
  - - [3584, 5888, 1, 1]
    - [33, 2.587]
  - - [5888, 4288, 1, 256]
    - [45, 76.804]
  - - [1024, 2944, 1, 1280]
    - [39, 68.475]
  - - [2944, 3584, 1, 256]
    - [29, 75.523]
  - - [5888, 1856, 1, 1]
    - [0, 2.472]
  - - [6784, 2368, 1, 3328]
    - [43, 76.98]
  - - [1408, 4288, 1, 32]
    - [17, 51.876]
  - - [1856, 1024, 1, 1280]
    - [39, 64.038]
  - - [5888, 1856, 1, 256]
    - [27, 70.093]
  - - [5056, 1856, 1, 1]
    - [40, 2.23]
  - - [5888, 2368, 1, 256]
    - [37, 71.675]
  - - [1408, 1024, 1, 32]
    - [17, 31.076]
  - - [5056, 1856, 1, 32]
    - [40, 52.165]
  - - [5056, 1856, 1, 1280]
    - [39, 73.286]
  - - [1408, 5888, 1, 3328]
    - [43, 76.29]
  - - [5056, 704, 1, 3328]
    - [43, 66.469]
  - - [5888, 6784, 1, 1]
    - [33, 2.742]
  - - [5888, 4288, 1, 32]
    - [33, 62.601]
  - - [1408, 3584, 1, 256]
    - [27, 69.811]
  - - [6784, 256, 1, 1]
    - [40, 1.406]
  - - [6784, 256, 1, 1280]
    - [38, 65.369]
  - - [2368, 704, 1, 3328]
    - [29, 57.617]
  - - [2944, 1856, 1, 32]
    - [17, 51.415]
  - - [2368, 1408, 1, 256]
    - [38, 60.038]
  - - [2368, 1856, 1, 1]
    - [8, 1.833]
  - - [4288, 1408, 1, 1]
    - [0, 2.062]
  - - [3584, 2368, 1, 1280]
    - [22, 74.935]
  - - [1408, 2944, 1, 1]
    - [40, 1.992]
  - - [4288, 1408, 1, 32]
    - [0, 47.635]
  - - [5888, 2944, 1, 256]
    - [27, 75.514]
  - - [1408, 2944, 1, 32]
    - [0, 47.454]
  - - [5888, 6784, 1, 256]
    - [45, 78.619]
  - - [6784, 5888, 1, 1]
    - [42, 2.758]
  - - [6784, 5888, 1, 1280]
    - [22, 83.355]
  - - [1024, 4288, 1, 32]
    - [33, 44.346]
  - - [3584, 5888, 1, 256]
    - [29, 80.054]
  - - [5056, 2368, 1, 1]
    - [40, 2.339]
  - - [5056, 448, 1, 1]
    - [40, 1.353]
  - - [2368, 1024, 1, 1280]
    - [27, 60.766]
  - - [1856, 6784, 1, 256]
    - [27, 71.07]
  - - [5056, 448, 1, 32]
    - [0, 31.322]
  - - [3584, 2944, 1, 32]
    - [33, 55.459]
  - - [3584, 1856, 1, 32]
    - [33, 50.518]
  - - [4288, 1408, 1, 1280]
    - [27, 71.764]
  - - [6784, 2368, 1, 1]
    - [40, 2.599]
  - - [704, 5056, 1, 1]
    - [40, 1.411]
  - - [2368, 1408, 1, 1280]
    - [27, 70.243]
  - - [5888, 1408, 1, 1]
    - [8, 2.38]
  - - [1024, 4288, 1, 1280]
    - [29, 74.154]
  - - [1856, 4288, 1, 1]
    - [0, 2.175]
  - - [3584, 4288, 1, 256]
    - [12, 72.738]
  - - [2368, 2944, 1, 256]
    - [37, 66.471]
  - - [704, 5056, 1, 256]
    - [27, 59.095]
  - - [1856, 4288, 1, 32]
    - [8, 50.417]
  - - [4288, 1024, 1, 1280]
    - [39, 73.358]
  - - [4288, 6784, 1, 32]
    - [0, 61.562]
  - - [3584, 1408, 1, 256]
    - [43, 70.127]
  - - [704, 3584, 1, 3328]
    - [43, 65.025]
  - - [5056, 448, 1, 1280]
    - [27, 57.005]
  - - [1408, 2944, 1, 1280]
    - [39, 71.369]
  - - [5888, 704, 1, 1280]
    - [45, 68.834]
  - - [4288, 5888, 1, 256]
    - [14, 78.569]
  - - [3584, 3584, 1, 3328]
    - [22, 84.069]
  - - [2944, 6784, 1, 32]
    - [9, 63.055]
  - - [5056, 256, 1, 1]
    - [40, 0.919]
  - - [2944, 2368, 1, 3328]
    - [27, 71.619]
  - - [1024, 1856, 1, 1280]
    - [22, 63.899]
  - - [448, 5888, 1, 256]
    - [22, 52.322]
  - - [1024, 5888, 1, 256]
    - [12, 69.514]
  - - [6784, 2944, 1, 3328]
    - [22, 79.914]
  - - [1408, 2368, 1, 256]
    - [27, 62.71]
  - - [1408, 5056, 1, 256]
    - [27, 68.109]
  - - [1024, 1408, 1, 32]
    - [18, 28.525]
  - - [6784, 704, 1, 1]
    - [40, 2.103]
  - - [704, 3584, 1, 32]
    - [0, 30.23]
  - - [4288, 4288, 1, 1]
    - [0, 2.517]
  - - [5056, 2944, 1, 1]
    - [23, 2.406]
  - - [6784, 4288, 1, 3328]
    - [22, 81.303]
  - - [5056, 2944, 1, 3328]
    - [27, 76.907]
  - - [2368, 1856, 1, 3328]
    - [43, 72.157]
  - - [1856, 4288, 1, 1280]
    - [22, 70.771]
  - - [3584, 448, 1, 1]
    - [40, 1.317]
  - - [2944, 1024, 1, 3328]
    - [43, 66.245]
  - - [5888, 5056, 1, 32]
    - [33, 64.055]
  - - [704, 2944, 1, 1]
    - [40, 1.049]
  - - [3584, 448, 1, 32]
    - [33, 31.604]
  - - [3584, 448, 1, 1280]
    - [26, 53.356]
  - - [2944, 6784, 1, 3328]
    - [22, 80.126]
  - - [1856, 2368, 1, 1280]
    - [27, 70.693]
  - - [6784, 1024, 1, 1280]
    - [22, 79.374]
  - - [6784, 3584, 1, 1280]
    - [7, 83.049]
  - - [1408, 1408, 1, 1]
    - [8, 1.476]
  - - [1408, 4288, 1, 256]
    - [27, 67.031]
  - - [256, 5056, 1, 3328]
    - [43, 53.655]
  - - [448, 6784, 1, 1]
    - [24, 1.022]
  - - [704, 2944, 1, 256]
    - [22, 55.336]
  - - [1408, 1408, 1, 256]
    - [43, 57.615]
  - - [448, 6784, 1, 32]
    - [33, 29.461]
  - - [1408, 1856, 1, 1]
    - [40, 1.731]
  - - [4288, 448, 1, 32]
    - [0, 29.885]
  - - [4288, 448, 1, 1280]
    - [7, 62.782]
  - - [2944, 704, 1, 32]
    - [17, 37.895]
  - - [448, 4288, 1, 1]
    - [24, 0.825]
  - - [3584, 5056, 1, 1]
    - [33, 2.537]
  - - [1408, 3584, 1, 1280]
    - [27, 73.233]
  - - [6784, 448, 1, 1280]
    - [43, 64.54]
  - - [3584, 5056, 1, 3328]
    - [22, 81.043]
  - - [2368, 2368, 1, 32]
    - [8, 45.737]
  - - [5888, 2944, 1, 32]
    - [40, 61.019]
  - - [1856, 2944, 1, 32]
    - [8, 45.433]
  - - [5056, 1408, 1, 1]
    - [40, 2.098]
  - - [5888, 1408, 1, 3328]
    - [27, 76.418]
  - - [448, 4288, 1, 256]
    - [29, 53.033]
  - - [6784, 1024, 1, 1]
    - [40, 2.288]
  - - [6784, 1024, 1, 32]
    - [17, 53.494]
  - - [6784, 3584, 1, 1]
    - [23, 2.684]
  - - [2944, 2368, 1, 32]
    - [17, 54.008]
  - - [3584, 6784, 1, 3328]
    - [22, 83.468]
  - - [6784, 1408, 1, 256]
    - [37, 72.577]
  - - [5056, 1024, 1, 32]
    - [17, 45.604]
  - - [1024, 5056, 1, 1280]
    - [43, 74.831]
  - - [4288, 3584, 1, 256]
    - [14, 74.708]
  - - [448, 6784, 1, 1280]
    - [29, 68.61]
  - - [1856, 5888, 1, 1]
    - [40, 2.308]
  - - [256, 5888, 1, 32]
    - [8, 28.933]
  - - [4288, 5056, 1, 32]
    - [0, 59.959]
  - - [4288, 5056, 1, 3328]
    - [22, 82.301]
  - - [1856, 5888, 1, 32]
    - [8, 54.053]
  - - [1856, 5888, 1, 1280]
    - [22, 77.645]
  - - [704, 2368, 1, 1280]
    - [22, 56.344]
  - - [4288, 2368, 1, 1280]
    - [43, 74.65]
  - - [2944, 5056, 1, 256]
    - [14, 75.203]
  - - [2944, 4288, 1, 1]
    - [0, 2.532]
  - - [5056, 5888, 1, 32]
    - [40, 61.321]
  - - [2368, 5056, 1, 3328]
    - [22, 77.761]
  - - [1024, 5056, 1, 3328]
    - [43, 75.943]
  - - [1024, 6784, 1, 32]
    - [33, 52.04]
  - - [3584, 2944, 1, 3328]
    - [27, 78.294]
  - - [1408, 5888, 1, 1]
    - [23, 2.368]
  - - [704, 4288, 1, 32]
    - [33, 33.087]
  - - [1408, 5888, 1, 32]
    - [0, 56.211]
  - - [6784, 1024, 1, 3328]
    - [39, 79.955]
  - - [5056, 1408, 1, 256]
    - [12, 69.729]
  - - [2944, 1408, 1, 256]
    - [37, 64.943]
  - - [2368, 2368, 1, 256]
    - [37, 64.967]
  - - [1408, 6784, 1, 1]
    - [40, 2.431]
  - - [6784, 6784, 1, 1280]
    - [22, 82.06]
  - - [1024, 5888, 1, 1]
    - [40, 1.97]
  - - [1856, 3584, 1, 256]
    - [29, 70.674]
  - - [2368, 704, 1, 32]
    - [0, 26.91]
  - - [256, 5888, 1, 1280]
    - [27, 61.897]
  - - [1856, 1024, 1, 3328]
    - [39, 66.16]
  - - [5056, 2368, 1, 3328]
    - [27, 73.729]
  - - [704, 4288, 1, 1280]
    - [22, 68.56]
  - - [2560, 7000, 1, 2560]
    - [29, 80.083]
  - - [7680, 12000, 1, 2560]
    - [14, 83.683]
  - - [5124, 9124, 1, 1760]
    - [19, 85.516]
  - - [512, 24000, 1, 1536]
    - [29, 78.537]
  - - [3072, 24000, 1, 1024]
    - [14, 81.682]
  - - [512, 48000, 1, 2816]
    - [7, 82.921]
  - - [512, 48000, 1, 2048]
    - [27, 77.725]
  - - [2048, 1600, 1, 2048]
    - [28, 58.847]
  - - [512, 48000, 1, 1536]
    - [29, 80.546]
  - - [8448, 5984, 1, 2816]
    - [7, 81.843]
  - - [4096, 3200, 1, 1024]
    - [27, 75.605]
  - - [1024, 24000, 1, 2560]
    - [14, 81.723]
  - - [1760, 6400, 1, 1760]
    - [19, 84.729]
  - - [5124, 9124, 1, 2048]
    - [14, 79.446]
  - - [16384, 3200, 1, 4096]
    - [12, 74.544]
  - - [1024, 48000, 1, 2560]
    - [14, 82.658]
  - - [8448, 48000, 1, 2816]
    - [22, 84.905]
  - - [2560, 3200, 1, 2560]
    - [27, 75.716]
  - - [16384, 800, 1, 4096]
    - [12, 64.103]
  - - [4608, 24000, 1, 1536]
    - [29, 83.62]
  - - [7680, 48000, 1, 2560]
    - [14, 84.245]
  - - [3072, 48000, 1, 1024]
    - [14, 82.644]
  - - [8192, 3200, 1, 2048]
    - [14, 79.574]
  - - [512, 24000, 1, 2816]
    - [39, 79.017]
  - - [4096, 400, 1, 1024]
    - [29, 51.208]
  - - [6144, 48000, 1, 2560]
    - [14, 84.09]
  - - [4608, 48000, 1, 1536]
    - [29, 83.126]
  - - [2048, 800, 1, 512]
    - [45, 50.849]
  - - [4608, 5984, 1, 1536]
    - [29, 81.776]
  - - [4096, 1600, 1, 1024]
    - [27, 69.355]
  - - [6144, 5984, 1, 2048]
    - [14, 81.539]
  - - [7680, 24000, 1, 2560]
    - [14, 84.057]
  - - [6144, 48000, 1, 2048]
    - [14, 81.098]
  - - [2048, 3200, 1, 2048]
    - [14, 74.981]
  - - [5124, 9124, 1, 2560]
    - [14, 80.119]
  - - [1024, 24000, 1, 1536]
    - [29, 82.673]
  - - [2560, 6400, 1, 2560]
    - [29, 83.42]
  - - [512, 24000, 1, 2560]
    - [29, 78.016]
  - - [1024, 24000, 1, 2816]
    - [22, 83.398]
  - - [7680, 5984, 1, 2560]
    - [14, 81.8]
  - - [2048, 1600, 1, 512]
    - [43, 62.953]
  - - [2048, 7000, 1, 2048]
    - [14, 78.067]
  - - [1760, 800, 1, 1760]
    - [34, 62.23]
  - - [2560, 1600, 1, 2560]
    - [45, 71.562]
  - - [2048, 3200, 1, 512]
    - [27, 71.487]
  - - [2560, 800, 1, 2560]
    - [43, 65.333]
  - - [4608, 12000, 1, 1536]
    - [29, 82.798]
  - - [6144, 24000, 1, 2048]
    - [14, 80.809]
  - - [8192, 800, 1, 2048]
    - [12, 62.155]
  - - [5124, 9124, 1, 4096]
    - [29, 73.628]
  - - [8448, 24000, 1, 2816]
    - [22, 84.78]
  - - [1024, 48000, 1, 1536]
    - [14, 81.479]
  - - [8192, 1600, 1, 2048]
    - [14, 70.284]
  - - [4096, 800, 1, 1024]
    - [27, 59.922]
  - - [2048, 800, 1, 2048]
    - [14, 55.493]
  - - [1760, 3200, 1, 1760]
    - [5, 74.144]
  - - [512, 48000, 1, 2560]
    - [14, 81.093]
  - - [512, 24000, 1, 2048]
    - [29, 78.841]
  - - [16384, 1600, 1, 4096]
    - [12, 70.382]
  - - [1024, 24000, 1, 2048]
    - [14, 81.228]
  - - [8192, 400, 1, 2048]
    - [29, 54.348]
  - - [2048, 6400, 1, 2048]
    - [14, 75.716]
  - - [6144, 12000, 1, 2048]
    - [14, 81.137]
  - - [1760, 7000, 1, 1760]
    - [19, 83.321]
  - - [1024, 48000, 1, 2816]
    - [22, 84.033]
  - - [4096, 7000, 1, 4096]
    - [14, 76.493]
  - - [6144, 24000, 1, 2560]
    - [14, 83.69]
  - - [8448, 12000, 1, 2816]
    - [22, 84.385]
  - - [16384, 400, 1, 4096]
    - [14, 57.511]
  - - [1760, 1600, 1, 1760]
    - [19, 61.907]
  - - [1024, 48000, 1, 2048]
    - [29, 78.554]
  - - [4096, 4096, 1, 4096]
    - [14, 77.274]
  - - [2048, 2048, 1, 2049]
    - [22, 73.611]
  - - [8192, 8191, 1, 8192]
    - [16, 68.974]
  - - [8192, 8192, 1, 8192]
    - [14, 68.972]
  - - [2047, 2048, 1, 2048]
    - [14, 71.152]
  - - [2048, 2049, 1, 2048]
    - [14, 72.326]
  - - [8192, 8192, 1, 8191]
    - [22, 85.004]
  - - [3072, 513, 1, 3072]
    - [45, 54.034]
  - - [8191, 8192, 1, 8192]
    - [14, 70.127]
  - - [8192, 8193, 1, 8192]
    - [14, 66.804]
  - - [4096, 4097, 1, 4096]
    - [14, 71.959]
  - - [8192, 8192, 1, 8193]
    - [7, 84.414]
  - - [4096, 4095, 1, 4096]
    - [14, 79.921]
  - - [4096, 4096, 1, 4097]
    - [7, 79.408]
  - - [2048, 2048, 1, 2048]
    - [14, 72.413]
  - - [4095, 4096, 1, 4096]
    - [14, 77.206]
  - - [8193, 8192, 1, 8192]
    - [16, 67.373]
  - - [4096, 4096, 1, 4095]
    - [22, 79.389]
  - - [3072, 511, 1, 3072]
    - [27, 63.209]
  - - [2049, 2048, 1, 2048]
    - [29, 64.255]
  - - [2048, 2047, 1, 2048]
    - [14, 69.982]
  - - [2048, 2048, 1, 2047]
    - [22, 73.843]
  - - [4097, 4096, 1, 4096]
    - [14, 69.355]
  - - [128, 128, 512, 64]
    - [215, 5.805]
  - - [512, 512, 64, 64]
    - [212, 5.994]
  - - [1024, 2048, 1, 1024]
    - [29, 70.527]
  - - [1024, 2048, 1, 4096]
    - [29, 72.049]
  - - [1024, 4096, 1, 1024]
    - [29, 72.28]
  - - [1024, 4096, 1, 4096]
    - [29, 66.211]
  - - [4096, 2048, 1, 1024]
    - [27, 73.915]
  - - [4096, 4096, 1, 1024]
    - [14, 77.575]
  - - [30528, 2048, 1, 1024]
    - [14, 82.391]
  - - [30528, 4096, 1, 1024]
    - [14, 83.239]
  - - [128, 32768, 1, 256]
    - [14, 64.308]
  - - [256, 4608, 1, 1024]
    - [14, 67.737]
  - - [256, 4864, 1, 1024]
    - [43, 51.5]
  - - [256, 5376, 1, 1024]
    - [27, 56.354]
  - - [256, 5888, 1, 1024]
    - [43, 61.456]
  - - [256, 6144, 1, 1024]
    - [27, 63.896]
  - - [256, 6400, 1, 1024]
    - [43, 66.189]
  - - [256, 6656, 1, 1024]
    - [43, 68.634]
  - - [256, 7168, 1, 1024]
    - [14, 61.644]
  - - [256, 7424, 1, 1024]
    - [14, 63.467]
  - - [256, 7936, 1, 1024]
    - [14, 68.121]
  - - [256, 8192, 1, 1024]
    - [14, 70.088]
  - - [256, 8448, 1, 1024]
    - [14, 72.258]
  - - [256, 8960, 1, 1024]
    - [14, 76.432]
  - - [256, 9984, 1, 1024]
    - [43, 64.767]
  - - [256, 10496, 1, 1024]
    - [43, 68.13]
  - - [256, 11264, 1, 1024]
    - [43, 72.741]
  - - [256, 11520, 1, 1024]
    - [14, 67.002]
  - - [256, 11776, 1, 1024]
    - [14, 68.227]
  - - [256, 12544, 1, 1024]
    - [14, 71.861]
  - - [256, 13312, 1, 1024]
    - [14, 75.345]
  - - [256, 14336, 1, 1024]
    - [27, 68.268]
  - - [256, 14592, 1, 1024]
    - [43, 69.454]
  - - [256, 14848, 1, 1024]
    - [27, 70.366]
  - - [256, 15104, 1, 1024]
    - [27, 71.578]
  - - [256, 16128, 1, 1024]
    - [14, 70.923]
  - - [256, 18176, 1, 1024]
    - [14, 79.519]
  - - [256, 18944, 1, 1024]
    - [27, 70.563]
  - - [256, 19200, 1, 1024]
    - [43, 71.364]
  - - [256, 20480, 1, 1024]
    - [43, 75.863]
  - - [256, 20992, 1, 1024]
    - [14, 74.219]
  - - [256, 21248, 1, 1024]
    - [14, 75.352]
  - - [256, 21504, 1, 1024]
    - [14, 75.75]
  - - [256, 22016, 1, 1024]
    - [14, 77.667]
  - - [256, 22344, 1, 1024]
    - [14, 76.825]
  - - [256, 23296, 1, 1024]
    - [43, 71.67]
  - - [256, 23552, 1, 1024]
    - [43, 72.492]
  - - [256, 31488, 1, 1024]
    - [14, 80.083]
  - - [256, 32768, 1, 512]
    - [27, 73.544]
  - - [256, 33536, 1, 1024]
    - [43, 75.815]
  - - [256, 44505, 1, 1024]
    - [14, 79.159]
  - - [512, 32768, 1, 13]
    - [44, 28.737]
  - - [512, 32768, 1, 1024]
    - [29, 79.302]
  - - [684, 8976, 1, 256]
    - [45, 64.805]
  - - [1024, 1600, 1, 560]
    - [34, 65.299]
  - - [1024, 1600, 1, 1024]
    - [43, 63.708]
  - - [1024, 32768, 1, 480]
    - [19, 86.444]
  - - [1024, 32768, 1, 1024]
    - [29, 82.01]
  - - [1280, 8976, 1, 256]
    - [45, 72.266]
  - - [1792, 8976, 1, 256]
    - [29, 74.913]
  - - [2048, 684, 1, 512]
    - [43, 52.92]
  - - [2048, 684, 1, 768]
    - [43, 55.218]
  - - [2048, 960, 1, 74]
    - [4, 42.166]
  - - [2048, 960, 1, 2048]
    - [29, 64.892]
  - - [2048, 1536, 1, 512]
    - [29, 68.494]
  - - [2048, 1536, 1, 768]
    - [22, 70.561]
  - - [2048, 8976, 1, 256]
    - [29, 74.633]
  - - [2304, 8976, 1, 256]
    - [29, 78.405]
  - - [2560, 8976, 1, 256]
    - [29, 78.072]
  - - [2816, 8976, 1, 256]
    - [29, 76.425]
  - - [3072, 8976, 1, 256]
    - [29, 78.149]
  - - [3328, 8976, 1, 256]
    - [45, 77.165]
  - - [3840, 8976, 1, 256]
    - [22, 77.556]
  - - [4096, 8976, 1, 256]
    - [22, 76.931]
  - - [4352, 8976, 1, 256]
    - [22, 78.123]
  - - [4608, 8976, 1, 256]
    - [29, 79.0]
  - - [4864, 8976, 1, 256]
    - [29, 78.103]
  - - [5120, 8976, 1, 256]
    - [29, 78.819]
  - - [5376, 8976, 1, 256]
    - [39, 78.431]
  - - [5632, 8976, 1, 256]
    - [29, 79.073]
  - - [5888, 8976, 1, 256]
    - [22, 78.672]
  - - [6144, 8976, 1, 256]
    - [22, 77.054]
  - - [6400, 8976, 1, 256]
    - [45, 78.68]
  - - [7168, 8976, 1, 256]
    - [29, 78.696]
  - - [7936, 8976, 1, 256]
    - [22, 78.967]
  - - [8192, 8976, 1, 256]
    - [12, 76.406]
  - - [8448, 8976, 1, 256]
    - [29, 78.463]
  - - [8960, 8976, 1, 256]
    - [14, 78.629]
  - - [9472, 8976, 1, 256]
    - [22, 78.429]
  - - [9728, 8976, 1, 256]
    - [22, 77.578]
  - - [9984, 8976, 1, 256]
    - [29, 78.598]
  - - [10240, 8976, 1, 256]
    - [12, 76.418]
  - - [10496, 8976, 1, 256]
    - [14, 78.798]
  - - [11264, 8976, 1, 256]
    - [20, 76.823]
  - - [11776, 8976, 1, 256]
    - [22, 77.426]
  - - [12544, 8976, 1, 256]
    - [14, 79.085]
  - - [13312, 8976, 1, 256]
    - [12, 76.96]
  - - [13568, 8976, 1, 256]
    - [14, 79.121]
  - - [13824, 8976, 1, 256]
    - [27, 77.274]
  - - [15104, 8976, 1, 256]
    - [14, 79.304]
  - - [15360, 8976, 1, 256]
    - [12, 77.023]
  - - [15872, 8976, 1, 256]
    - [22, 77.785]
  - - [16128, 8976, 1, 256]
    - [45, 78.798]
  - - [17152, 8976, 1, 256]
    - [14, 79.492]
  - - [18176, 8976, 1, 256]
    - [14, 79.427]
  - - [18688, 8976, 1, 256]
    - [22, 79.355]
  - - [18944, 8976, 1, 256]
    - [22, 78.463]
  - - [19712, 8976, 1, 256]
    - [14, 79.478]
  - - [19968, 8976, 1, 256]
    - [20, 77.452]
  - - [20480, 8976, 1, 256]
    - [12, 77.204]
  - - [20992, 8976, 1, 256]
    - [29, 77.592]
  - - [21248, 8976, 1, 256]
    - [14, 79.572]
  - - [23552, 8976, 1, 256]
    - [20, 77.479]
  - - [28672, 8976, 1, 256]
    - [12, 77.438]
  - - [31488, 8976, 1, 256]
    - [14, 79.924]
  - - [33536, 8976, 1, 256]
    - [14, 79.965]
  - - [44505, 8976, 1, 256]
    - [20, 77.645]
  - - [1024, 3840, 1, 1024]
    - [27, 71.369]
  - - [1024, 3840, 1, 4096]
    - [29, 67.983]
  - - [1024, 3968, 1, 1024]
    - [27, 73.478]
  - - [1024, 3968, 1, 4096]
    - [14, 64.692]
  - - [1024, 6528, 1, 1024]
    - [29, 76.413]
  - - [1024, 6528, 1, 4096]
    - [29, 67.978]
  - - [1024, 7104, 1, 1024]
    - [27, 73.242]
  - - [1024, 7104, 1, 4096]
    - [29, 68.007]
  - - [1024, 7200, 1, 1024]
    - [29, 73.387]
  - - [1024, 7200, 1, 4096]
    - [14, 66.983]
  - - [1024, 8064, 1, 1024]
    - [27, 77.365]
  - - [1024, 8064, 1, 4096]
    - [14, 68.056]
  - - [1024, 8160, 1, 1024]
    - [27, 73.802]
  - - [1024, 8160, 1, 4096]
    - [29, 66.098]
  - - [1024, 9216, 1, 1024]
    - [29, 82.13]
  - - [1024, 9216, 1, 4096]
    - [14, 82.022]
  - - [1024, 9520, 1, 1024]
    - [29, 75.974]
  - - [1024, 9520, 1, 4096]
    - [45, 69.731]
  - - [1024, 10064, 1, 1024]
    - [29, 79.683]
  - - [1024, 10064, 1, 4096]
    - [14, 70.011]
  - - [1024, 10080, 1, 1024]
    - [29, 79.873]
  - - [1024, 10080, 1, 4096]
    - [14, 71.193]
  - - [1024, 10200, 1, 1024]
    - [29, 80.228]
  - - [1024, 10200, 1, 4096]
    - [29, 71.089]
  - - [4096, 3840, 1, 1024]
    - [14, 77.894]
  - - [4096, 3968, 1, 1024]
    - [27, 76.483]
  - - [4096, 6528, 1, 1024]
    - [14, 78.841]
  - - [4096, 7104, 1, 1024]
    - [14, 80.946]
  - - [4096, 7200, 1, 1024]
    - [14, 79.393]
  - - [4096, 8064, 1, 1024]
    - [14, 79.702]
  - - [4096, 8160, 1, 1024]
    - [14, 80.389]
  - - [4096, 9216, 1, 1024]
    - [14, 82.342]
  - - [4096, 9520, 1, 1024]
    - [14, 80.126]
  - - [4096, 10064, 1, 1024]
    - [14, 80.852]
  - - [4096, 10080, 1, 1024]
    - [14, 80.828]
  - - [4096, 10200, 1, 1024]
    - [14, 81.578]
  - - [42720, 3968, 1, 1024]
    - [14, 80.946]
  - - [42720, 6528, 1, 1024]
    - [14, 82.128]
  - - [42720, 7104, 1, 1024]
    - [14, 83.037]
  - - [42720, 7200, 1, 1024]
    - [14, 81.308]
  - - [42720, 9520, 1, 1024]
    - [14, 82.026]
  - - [42720, 10080, 1, 1024]
    - [14, 82.528]
  - - [1024, 3240, 1, 1024]
    - [14, 70.766]
  - - [1024, 3240, 1, 4096]
    - [29, 75.569]
  - - [1024, 3960, 1, 1024]
    - [27, 73.664]
  - - [1024, 3960, 1, 4096]
    - [29, 68.364]
  - - [4096, 3240, 1, 1024]
    - [14, 75.883]
  - - [4096, 3960, 1, 1024]
    - [27, 76.464]
  - - [42720, 3960, 1, 1024]
    - [14, 80.799]
  - - [7680, 8192, 1, 8192]
    - [16, 68.955]
  - - [3840, 4096, 1, 4096]
    - [14, 72.172]
  - - [1920, 2048, 1, 2048]
    - [14, 66.004]
  - - [8192, 7680, 1, 8192]
    - [16, 68.924]
  - - [4096, 3840, 1, 4096]
    - [14, 74.414]
  - - [2048, 1920, 1, 2048]
    - [14, 67.578]
  - - [512, 512, 16, 64]
    - [213, 5.336]
  - - [512, 512, 128, 64]
    - [214, 6.108]
  - - [4096, 512, 1, 1024]
    - [29, 70.701]
  - - [30522, 616, 1, 1024]
    - [27, 73.744]
  - - [128, 128, 128, 64]
    - [212, 4.67]
  - - [128, 128, 160, 64]
    - [6, 38.824]
  - - [1024, 1280, 1, 1024]
    - [27, 53.581]
  - - [1024, 1280, 1, 4096]
    - [43, 53.8]
  - - [4096, 1280, 1, 1024]
    - [14, 70.134]
  - - [30522, 160, 1, 1024]
    - [29, 47.029]
  - - [30522, 200, 1, 1024]
    - [45, 57.776]
  - - [128, 128, 624, 64]
    - [6, 51.425]
  - - [1024, 4992, 1, 1024]
    - [27, 74.035]
  - - [1024, 4992, 1, 4096]
    - [29, 66.182]
  - - [4096, 4992, 1, 1024]
    - [14, 78.554]
  - - [30522, 780, 1, 1024]
    - [27, 67.836]
  - - [30522, 308, 1, 1024]
    - [43, 62.001]
  - - [128, 128, 640, 64]
    - [13, 52.233]
  - - [1024, 5120, 1, 1024]
    - [27, 75.694]
  - - [1024, 5120, 1, 4096]
    - [14, 73.859]
  - - [4096, 5120, 1, 1024]
    - [14, 81.023]
  - - [30522, 800, 1, 1024]
    - [27, 69.502]
  - - [128, 128, 656, 64]
    - [13, 52.028]
  - - [1024, 5248, 1, 1024]
    - [29, 73.758]
  - - [1024, 5248, 1, 4096]
    - [14, 74.224]
  - - [4096, 5248, 1, 1024]
    - [14, 78.557]
  - - [30522, 820, 1, 1024]
    - [27, 71.096]
  - - [512, 512, 80, 64]
    - [5, 67.339]
  - - [1024, 2560, 1, 1024]
    - [27, 66.413]
  - - [1024, 2560, 1, 4096]
    - [14, 60.923]
  - - [4096, 2560, 1, 1024]
    - [14, 80.686]
  - - [30522, 385, 1, 1024]
    - [14, 59.119]
  - - [512, 512, 96, 64]
    - [215, 6.069]
  - - [1024, 3072, 1, 1024]
    - [29, 71.376]
  - - [1024, 3072, 1, 4096]
    - [29, 70.788]
  - - [4096, 3072, 1, 1024]
    - [14, 78.25]
  - - [30522, 462, 1, 1024]
    - [14, 70.083]
  - - [4096, 1024, 1, 1024]
    - [14, 68.511]
  - - [128, 128, 144, 64]
    - [36, 41.469]
  - - [1024, 1152, 1, 1024]
    - [27, 64.928]
  - - [1024, 1152, 1, 4096]
    - [27, 67.667]
  - - [4096, 1152, 1, 1024]
    - [27, 74.19]
  - - [30522, 180, 1, 1024]
    - [29, 52.457]
  - - [1024, 32768, 1, 479]
    - [19, 84.732]
  - - [1024, 8192, 1, 1024]
    - [27, 74.091]
  - - [1024, 8192, 1, 4096]
    - [14, 68.053]
  - - [1024, 9600, 1, 1024]
    - [27, 76.493]
  - - [1024, 9600, 1, 4096]
    - [29, 70.855]
  - - [4096, 8192, 1, 1024]
    - [14, 80.929]
  - - [4096, 9600, 1, 1024]
    - [14, 81.088]
  - - [33712, 8192, 1, 1024]
    - [14, 83.905]
  - - [33712, 9600, 1, 1024]
    - [14, 82.731]
  - - [1024, 1024, 128, 96]
    - [5, 65.777]
  - - [30592, 4096, 1, 1024]
    - [14, 83.611]
  - - [1536, 8192, 1, 1536]
    - [29, 80.973]
  - - [3072, 8192, 1, 1024]
    - [29, 80.949]
  - - [3072, 2048, 1, 1024]
    - [27, 74.691]
  - - [50304, 8192, 1, 1024]
    - [14, 83.717]
  - - [2048, 1024, 1, 8192]
    - [14, 71.308]
  - - [50304, 2048, 1, 1024]
    - [14, 83.116]
  - - [1536, 8192, 1, 6144]
    - [45, 73.503]
  - - [50304, 4096, 1, 1536]
    - [45, 83.731]
  - - [8192, 1024, 1, 2048]
    - [14, 72.955]
  - - [2560, 2048, 1, 640]
    - [37, 75.658]
  - - [1024, 1024, 128, 64]
    - [0, 60.954]
  - - [2048, 1024, 1, 2048]
    - [45, 70.973]
  - - [1536, 4096, 1, 1536]
    - [27, 75.309]
  - - [1024, 1024, 64, 64]
    - [0, 59.117]
  - - [30592, 8192, 1, 1024]
    - [14, 83.847]
  - - [50304, 16384, 1, 1024]
    - [14, 83.763]
  - - [4608, 4096, 1, 1536]
    - [29, 83.628]
  - - [2560, 2048, 1, 2560]
    - [29, 70.257]
  - - [7680, 2048, 1, 2560]
    - [29, 79.167]
  - - [50304, 4096, 1, 1024]
    - [14, 83.439]
  - - [1920, 2048, 1, 2560]
    - [43, 71.47]
  - - [1024, 1024, 64, 96]
    - [1, 69.387]
  - - [6144, 4096, 1, 1536]
    - [29, 80.31]
  - - [1536, 4096, 1, 6144]
    - [45, 66.551]
  - - [512, 512, 256, 64]
    - [217, 5.772]
  - - [50304, 8192, 1, 1536]
    - [45, 84.008]
  - - [6144, 8192, 1, 1536]
    - [14, 82.82]
  - - [4096, 16384, 1, 1024]
    - [14, 81.901]
  - - [30592, 1024, 1, 2048]
    - [14, 80.802]
  - - [1024, 16384, 1, 4096]
    - [14, 76.136]
  - - [512, 512, 40, 64]
    - [21, 60.651]
  - - [6144, 1024, 1, 2048]
    - [14, 72.012]
  - - [4608, 8192, 1, 1536]
    - [29, 84.312]
  - - [30592, 2048, 1, 1024]
    - [14, 82.81]
  - - [3072, 16384, 1, 1024]
    - [29, 82.916]
  - - [1024, 1024, 256, 64]
    - [12, 54.36]
  - - [1024, 16384, 1, 1024]
    - [29, 79.429]
  - - [1024, 1024, 32, 64]
    - [19, 71.012]
  - - [3072, 4096, 1, 1024]
    - [29, 80.594]
  - - [30528, 8192, 1, 1024]
    - [14, 83.62]
  - - [128, 128, 1024, 64]
    - [212, 6.007]
  - - [1024, 3456, 1, 1024]
    - [27, 74.609]
  - - [1024, 3456, 1, 480]
    - [37, 74.175]
  - - [1024, 4096, 1, 480]
    - [19, 74.479]
  - - [1024, 6912, 1, 1024]
    - [29, 80.84]
  - - [1024, 6912, 1, 480]
    - [19, 84.211]
  - - [128, 55296, 1, 256]
    - [14, 76.811]
  - - [256, 55296, 1, 512]
    - [14, 80.594]
  - - [256, 6912, 1, 512]
    - [13, 63.428]
  - - [512, 3456, 1, 1024]
    - [28, 65.62]
  - - [512, 3456, 1, 13]
    - [21, 13.53]
  - - [512, 4096, 1, 1024]
    - [29, 70.508]
  - - [512, 4096, 1, 13]
    - [28, 16.435]
  - - [512, 55296, 1, 13]
    - [40, 31.469]
  - - [512, 6912, 1, 1024]
    - [45, 78.822]
  - - [512, 6912, 1, 13]
    - [28, 19.126]
  - - [30528, 640, 1, 1024]
    - [27, 77.069]
  - - [30528, 1280, 1, 1024]
    - [14, 81.645]
  - - [30528, 1600, 1, 1024]
    - [27, 75.673]
  - - [1024, 10240, 1, 1024]
    - [29, 80.883]
  - - [4096, 10240, 1, 1024]
    - [14, 81.588]
  - - [1024, 10240, 1, 4096]
    - [14, 70.824]
  - - [128, 128, 1280, 64]
    - [5, 61.786]
  - - [1024, 10496, 1, 4096]
    - [14, 74.995]
  - - [30528, 1640, 1, 1024]
    - [12, 77.496]
  - - [4096, 10496, 1, 1024]
    - [14, 82.12]
  - - [1024, 10496, 1, 1024]
    - [27, 75.217]
  - - [128, 128, 1312, 64]
    - [43, 65.975]
  - - [30528, 160, 1, 1024]
    - [14, 47.184]
  - - [30528, 240, 1, 1024]
    - [43, 68.75]
  - - [1024, 6144, 1, 1024]
    - [27, 74.13]
  - - [4096, 6144, 1, 1024]
    - [14, 79.719]
  - - [1024, 6144, 1, 4096]
    - [14, 74.426]
  - - [512, 512, 192, 64]
    - [214, 6.144]
  - - [1024, 10224, 1, 1024]
    - [29, 79.593]
  - - [1024, 10192, 1, 1024]
    - [29, 80.109]
  - - [1024, 10208, 1, 1024]
    - [29, 80.006]
  - - [1024, 10224, 1, 4096]
    - [29, 76.999]
  - - [4096, 10224, 1, 1024]
    - [14, 80.874]
  - - [3072, 10224, 1, 1024]
    - [29, 81.944]
  - - [3072, 10240, 1, 1024]
    - [29, 82.815]
  - - [1024, 10192, 1, 4096]
    - [14, 81.207]
  - - [4096, 10192, 1, 1024]
    - [14, 80.951]
  - - [3072, 10192, 1, 1024]
    - [29, 81.983]
  - - [3072, 10200, 1, 1024]
    - [29, 81.954]
  - - [1024, 10184, 1, 1024]
    - [29, 80.336]
  - - [3072, 10208, 1, 1024]
    - [29, 81.807]
  - - [1024, 10208, 1, 4096]
    - [29, 81.821]
  - - [4096, 10208, 1, 1024]
    - [14, 80.98]
  - - [2048, 10224, 1, 1024]
    - [14, 80.117]
  - - [2048, 10240, 1, 1024]
    - [14, 81.146]
  - - [1024, 10120, 1, 1024]
    - [29, 80.131]
  - - [2048, 10192, 1, 1024]
    - [14, 80.04]
  - - [1024, 10152, 1, 1024]
    - [29, 79.943]
  - - [3072, 10080, 1, 1024]
    - [29, 81.467]
  - - [1024, 2048, 1, 49]
    - [19, 38.238]
  - - [4608, 512, 1, 49]
    - [18, 41.358]
  - - [256, 256, 25, 12544]
    - [5, 60.904]
  - - [256, 256, 49, 3200]
    - [45, 73.72]
  - - [256, 256, 25, 6272]
    - [27, 68.142]
  - - [256, 256, 49, 6400]
    - [45, 63.624]
  - - [512, 512, 49, 1152]
    - [22, 82.624]
  - - [512, 512, 25, 2048]
    - [32, 62.999]
  - - [512, 512, 49, 2304]
    - [45, 78.41]
  - - [512, 512, 25, 4096]
    - [32, 62.206]
  - - [128, 128, 2048, 64]
    - [212, 6.111]
  - - [30528, 2560, 1, 1024]
    - [14, 82.866]
  - - [128, 128, 1536, 64]
    - [215, 6.076]
  - - [1024, 12288, 1, 1024]
    - [29, 80.218]
  - - [1024, 12288, 1, 4096]
    - [14, 71.771]
  - - [30528, 1920, 1, 1024]
    - [12, 78.718]
  - - [4096, 12288, 1, 1024]
    - [14, 82.041]
  - - [128, 128, 81, 12544]
    - [15, 43.106]
  - - [128, 128, 121, 9216]
    - [30, 40.63]
  - - [128, 128, 169, 6400]
    - [46, 41.751]
  - - [256, 256, 36, 4096]
    - [32, 63.628]
  - - [256, 256, 49, 2304]
    - [45, 73.392]
  - - [256, 256, 64, 2304]
    - [29, 67.65]
  - - [256, 256, 81, 4096]
    - [31, 51.413]
  - - [256, 256, 121, 2304]
    - [14, 70.228]
  - - [256, 256, 169, 2304]
    - [45, 69.62]
  - - [512, 512, 81, 1024]
    - [45, 74.149]
  - - [512, 512, 121, 1024]
    - [14, 75.559]
  - - [512, 512, 169, 1024]
    - [29, 76.054]
  - - [512, 512, 36, 1024]
    - [45, 80.462]
  - - [512, 512, 49, 1024]
    - [45, 79.234]
  - - [512, 512, 64, 1024]
    - [45, 74.848]
  - - [128, 128, 192, 64]
    - [215, 5.117]
  - - [768, 2048, 1, 768]
    - [43, 63.375]
  - - [3072, 2048, 1, 768]
    - [27, 75.002]
  - - [768, 2048, 1, 3072]
    - [27, 65.374]
  - - [384, 384, 144, 64]
    - [5, 68.668]
  - - [768, 4608, 1, 768]
    - [22, 80.117]
  - - [3072, 4608, 1, 768]
    - [22, 82.989]
  - - [768, 4608, 1, 3072]
    - [29, 81.06]
  - - [512, 512, 48, 64]
    - [212, 5.9]
  - - [128, 128, 256, 64]
    - [215, 5.372]
  - - [384, 384, 192, 64]
    - [212, 6.091]
  - - [1024, 4608, 1, 1024]
    - [29, 79.953]
  - - [4096, 4608, 1, 1024]
    - [14, 82.029]
  - - [1024, 4608, 1, 4096]
    - [29, 72.169]
  - - [2880, 3072, 1, 3072]
    - [45, 77.607]
  - - [3072, 3072, 1, 3072]
    - [14, 82.933]
  - - [3072, 512, 1, 3072]
    - [43, 63.609]
  - - [4096, 512, 1, 4096]
    - [14, 71.848]
  - - [512, 3072, 1, 3072]
    - [27, 65.557]
  - - [512, 4096, 1, 4096]
    - [14, 71.974]
  - - [512, 8192, 1, 8192]
    - [29, 63.117]
  - - [8192, 512, 1, 8192]
    - [14, 63.151]
  - - [256, 256, 36, 432]
    - [22, 71.029]
  - - [256, 256, 36, 456]
    - [10, 74.33]
  - - [256, 256, 36, 504]
    - [10, 74.901]
  - - [256, 256, 49, 1120]
    - [7, 73.544]
  - - [256, 256, 36, 442]
    - [14, 72.463]
  - - [256, 256, 49, 950]
    - [7, 72.374]
  - - [256, 256, 64, 616]
    - [39, 70.667]
  - - [256, 256, 64, 660]
    - [3, 71.836]
  - - [256, 256, 36, 408]
    - [19, 72.442]
  - - [256, 256, 49, 1008]
    - [19, 74.819]
  - - [256, 256, 36, 462]
    - [45, 73.457]
  - - [256, 256, 36, 468]
    - [39, 72.902]
  - - [256, 256, 36, 494]
    - [7, 73.722]
  - - [512, 512, 64, 48]
    - [28, 63.291]
  - - [256, 256, 64, 140]
    - [37, 58.654]
  - - [512, 512, 64, 56]
    - [18, 61.965]
  - - [512, 512, 49, 90]
    - [27, 64.318]
  - - [512, 512, 49, 60]
    - [21, 60.103]
  - - [256, 256, 49, 864]
    - [7, 72.483]
  - - [256, 256, 64, 224]
    - [5, 66.24]
  - - [256, 256, 64, 176]
    - [20, 64.634]
  - - [256, 256, 64, 154]
    - [5, 58.951]
  - - [512, 512, 49, 80]
    - [5, 68.487]
  - - [256, 256, 49, 1200]
    - [22, 73.862]
  - - [256, 256, 64, 704]
    - [19, 74.368]
  - - [256, 256, 64, 768]
    - [45, 70.959]
  - - [256, 256, 49, 1160]
    - [7, 73.179]
  - - [256, 256, 49, 320]
    - [39, 66.968]
  - - [512, 512, 49, 70]
    - [21, 60.393]
  - - [256, 256, 49, 1240]
    - [22, 73.418]
  - - [256, 256, 36, 384]
    - [7, 73.406]
  - - [1024, 2048, 1, 888]
    - [19, 74.05]
  - - [1024, 2048, 1, 713]
    - [19, 72.632]
  - - [1024, 2048, 1, 660]
    - [19, 72.743]
  - - [1024, 2048, 1, 726]
    - [19, 72.668]
  - - [1024, 2048, 1, 672]
    - [19, 73.553]
  - - [1024, 2048, 1, 850]
    - [19, 73.175]
  - - [1024, 2048, 1, 805]
    - [19, 73.372]
  - - [1024, 2048, 1, 864]
    - [19, 74.838]
  - - [1024, 2048, 1, 768]
    - [22, 70.816]
  - - [1024, 2048, 1, 950]
    - [19, 73.611]
  - - [256, 128, 49, 1152]
    - [5, 65.666]
  - - [256, 128, 121, 120]
    - [38, 55.802]
  - - [256, 128, 169, 120]
    - [27, 57.805]
  - - [256, 128, 36, 120]
    - [1, 44.213]
  - - [256, 128, 49, 120]
    - [34, 46.275]
  - - [256, 128, 64, 120]
    - [5, 49.096]
  - - [256, 128, 36, 12000]
    - [12, 69.555]
  - - [256, 128, 49, 1216]
    - [20, 64.402]
  - - [256, 128, 121, 18]
    - [0, 20.734]
  - - [256, 128, 169, 18]
    - [0, 28.819]
  - - [256, 128, 36, 18]
    - [0, 12.736]
  - - [256, 128, 49, 18]
    - [0, 16.358]
  - - [256, 128, 64, 18]
    - [0, 21.672]
  - - [256, 128, 36, 1800]
    - [5, 68.523]
  - - [256, 128, 121, 19]
    - [0, 26.481]
  - - [256, 128, 169, 19]
    - [0, 29.502]
  - - [256, 128, 36, 19]
    - [0, 13.443]
  - - [256, 128, 49, 19]
    - [0, 17.028]
  - - [256, 128, 64, 19]
    - [0, 22.037]
  - - [256, 128, 36, 1900]
    - [20, 68.654]
  - - [256, 128, 49, 480]
    - [37, 61.945]
  - - [256, 128, 81, 480]
    - [5, 64.511]
  - - [256, 128, 64, 5880]
    - [37, 61.557]
  - - [256, 128, 49, 72]
    - [1, 36.297]
  - - [256, 128, 81, 72]
    - [9, 48.001]
  - - [256, 128, 49, 76]
    - [6, 37.917]
  - - [256, 128, 81, 76]
    - [9, 44.953]
  - - [256, 128, 49, 7680]
    - [31, 48.809]
  - - [256, 128, 64, 882]
    - [20, 63.807]
  - - [256, 128, 64, 931]
    - [37, 64.882]
  - - [256, 256, 49, 1152]
    - [22, 73.539]
  - - [256, 256, 36, 12000]
    - [22, 82.516]
  - - [256, 256, 49, 1216]
    - [39, 73.16]
  - - [256, 256, 36, 1800]
    - [22, 80.351]
  - - [256, 256, 36, 1900]
    - [39, 80.64]
  - - [256, 256, 64, 5880]
    - [22, 74.086]
  - - [256, 256, 49, 7680]
    - [47, 60.679]
  - - [256, 256, 64, 882]
    - [19, 70.85]
  - - [256, 256, 64, 931]
    - [7, 71.822]
  - - [512, 256, 81, 1080]
    - [22, 80.818]
  - - [512, 256, 25, 12000]
    - [22, 77.23]
  - - [512, 256, 81, 162]
    - [5, 68.075]
  - - [512, 256, 81, 171]
    - [5, 70.766]
  - - [512, 256, 25, 1800]
    - [7, 75.154]
  - - [512, 256, 25, 1900]
    - [7, 75.227]
  - - [512, 256, 121, 1920]
    - [7, 80.654]
  - - [512, 256, 169, 1920]
    - [7, 83.013]
  - - [512, 256, 49, 1920]
    - [20, 76.611]
  - - [512, 256, 121, 288]
    - [20, 75.769]
  - - [512, 256, 169, 288]
    - [12, 76.326]
  - - [512, 256, 49, 288]
    - [12, 72.497]
  - - [512, 256, 25, 3000]
    - [39, 75.875]
  - - [512, 256, 81, 3000]
    - [22, 83.601]
  - - [512, 256, 121, 304]
    - [5, 76.133]
  - - [512, 256, 169, 304]
    - [5, 76.49]
  - - [512, 256, 49, 304]
    - [5, 72.697]
  - - [512, 256, 25, 450]
    - [39, 67.339]
  - - [512, 256, 81, 450]
    - [5, 75.719]
  - - [512, 256, 25, 475]
    - [39, 68.511]
  - - [512, 256, 81, 475]
    - [5, 76.153]
  - - [512, 256, 121, 480]
    - [37, 77.556]
  - - [512, 256, 169, 480]
    - [7, 77.404]
  - - [512, 256, 49, 5880]
    - [37, 77.394]
  - - [512, 256, 121, 72]
    - [38, 59.78]
  - - [512, 256, 169, 72]
    - [5, 62.797]
  - - [512, 256, 121, 76]
    - [38, 62.854]
  - - [512, 256, 169, 76]
    - [5, 64.108]
  - - [512, 256, 49, 882]
    - [37, 75.649]
  - - [512, 256, 49, 931]
    - [5, 75.716]
  - - [2304, 512, 1, 100]
    - [18, 44.307]
  - - [2304, 512, 1, 361]
    - [1, 60.689]
  - - [4608, 510, 1, 100]
    - [11, 39.627]
  - - [4608, 510, 1, 361]
    - [1, 60.846]
  - - [340, 256, 49, 1152]
    - [20, 62.269]
  - - [340, 256, 36, 120]
    - [38, 44.531]
  - - [340, 256, 49, 120]
    - [21, 48.281]
  - - [340, 256, 64, 120]
    - [12, 51.073]
  - - [340, 256, 36, 12000]
    - [22, 73.659]
  - - [340, 256, 49, 1216]
    - [3, 62.91]
  - - [340, 256, 36, 18]
    - [17, 14.815]
  - - [340, 256, 49, 18]
    - [2, 16.353]
  - - [340, 256, 64, 18]
    - [23, 18.043]
  - - [340, 256, 36, 1800]
    - [39, 71.407]
  - - [340, 256, 36, 19]
    - [17, 15.844]
  - - [340, 256, 49, 19]
    - [33, 17.323]
  - - [340, 256, 64, 19]
    - [33, 18.519]
  - - [340, 256, 36, 1900]
    - [39, 71.521]
  - - [340, 256, 64, 5880]
    - [5, 67.144]
  - - [340, 256, 49, 7680]
    - [45, 50.858]
  - - [340, 256, 64, 882]
    - [5, 64.894]
  - - [340, 256, 64, 931]
    - [20, 65.254]
  - - [510, 256, 49, 120]
    - [38, 46.463]
  - - [510, 256, 64, 120]
    - [4, 48.011]
  - - [510, 256, 49, 18]
    - [0, 12.678]
  - - [510, 256, 64, 18]
    - [8, 13.334]
  - - [510, 256, 49, 19]
    - [0, 13.421]
  - - [510, 256, 64, 19]
    - [0, 14.116]
  - - [510, 256, 36, 480]
    - [5, 71.996]
  - - [510, 256, 36, 72]
    - [11, 34.693]
  - - [510, 256, 36, 76]
    - [4, 36.222]
  - - [510, 512, 36, 1080]
    - [22, 80.216]
  - - [510, 512, 36, 162]
    - [38, 59.804]
  - - [510, 512, 36, 171]
    - [28, 61.232]
  - - [510, 512, 49, 1920]
    - [39, 81.732]
  - - [510, 512, 64, 1920]
    - [22, 79.147]
  - - [510, 512, 49, 288]
    - [20, 72.261]
  - - [510, 512, 64, 288]
    - [37, 73.777]
  - - [510, 512, 36, 3000]
    - [39, 82.651]
  - - [510, 512, 49, 304]
    - [37, 73.102]
  - - [510, 512, 64, 304]
    - [39, 74.506]
  - - [510, 512, 36, 450]
    - [22, 73.37]
  - - [510, 512, 36, 475]
    - [39, 73.968]
  - - [510, 512, 49, 480]
    - [39, 76.587]
  - - [510, 512, 64, 480]
    - [20, 75.704]
  - - [510, 512, 49, 72]
    - [28, 47.121]
  - - [510, 512, 64, 72]
    - [44, 49.325]
  - - [510, 512, 49, 76]
    - [21, 48.951]
  - - [510, 512, 64, 76]
    - [38, 50.075]
  - - [1024, 1024, 160, 96]
    - [27, 65.608]
  - - [2880, 16384, 1, 1920]
    - [19, 82.019]
  - - [1920, 16384, 1, 960]
    - [19, 85.113]
  - - [3840, 16384, 1, 1920]
    - [19, 85.655]
  - - [1920, 16384, 1, 3840]
    - [39, 83.869]
  - - [25216, 16384, 1, 1920]
    - [25, 85.057]
  - - [1024, 1024, 40, 96]
    - [22, 74.467]
  - - [2880, 4096, 1, 1920]
    - [19, 80.804]
  - - [1920, 4096, 1, 960]
    - [19, 84.124]
  - - [3840, 4096, 1, 1920]
    - [3, 84.399]
  - - [1920, 4096, 1, 3840]
    - [22, 77.701]
  - - [25216, 4096, 1, 1920]
    - [25, 84.739]
  - - [1024, 1024, 80, 96]
    - [1, 66.155]
  - - [2880, 8192, 1, 1920]
    - [19, 83.958]
  - - [1920, 8192, 1, 960]
    - [19, 85.518]
  - - [3840, 8192, 1, 1920]
    - [19, 87.746]
  - - [1920, 8192, 1, 3840]
    - [22, 81.223]
  - - [25216, 8192, 1, 1920]
    - [25, 84.971]
  - - [1024, 1024, 96, 96]
    - [5, 65.095]
  - - [1728, 16384, 1, 2304]
    - [22, 80.57]
  - - [2304, 16384, 1, 576]
    - [19, 89.217]
  - - [2304, 16384, 1, 2304]
    - [22, 85.089]
  - - [12672, 16384, 1, 2304]
    - [22, 84.799]
  - - [1024, 1024, 24, 96]
    - [35, 73.165]
  - - [1728, 4096, 1, 2304]
    - [43, 72.314]
  - - [2304, 4096, 1, 576]
    - [19, 87.218]
  - - [2304, 4096, 1, 2304]
    - [22, 84.445]
  - - [12672, 4096, 1, 2304]
    - [22, 83.596]
  - - [1024, 1024, 48, 96]
    - [22, 75.186]
  - - [1728, 8192, 1, 2304]
    - [45, 77.713]
  - - [2304, 8192, 1, 576]
    - [19, 88.597]
  - - [2304, 8192, 1, 2304]
    - [22, 85.05]
  - - [12672, 8192, 1, 2304]
    - [22, 84.508]
  - - [1024, 1024, 16, 96]
    - [34, 70.177]
  - - [1152, 4096, 1, 3072]
    - [45, 82.092]
  - - [3072, 4096, 1, 384]
    - [19, 80.618]
  - - [1536, 4096, 1, 3072]
    - [29, 74.527]
  - - [3072, 4096, 1, 1536]
    - [29, 80.939]
  - - [6400, 4096, 1, 3072]
    - [14, 81.433]
  - - [1024, 1024, 32, 96]
    - [39, 75.205]
  - - [1152, 8192, 1, 3072]
    - [29, 83.611]
  - - [3072, 8192, 1, 384]
    - [19, 81.129]
  - - [1536, 8192, 1, 3072]
    - [29, 81.633]
  - - [3072, 8192, 1, 1536]
    - [29, 80.833]
  - - [6400, 8192, 1, 3072]
    - [14, 83.408]
  - - [2048, 4096, 1, 2048]
    - [14, 71.627]
  - - [2048, 4096, 1, 4096]
    - [14, 71.716]
  - - [29000, 199, 1, 2048]
    - [27, 57.463]
  - - [29000, 221, 1, 2048]
    - [43, 62.932]
  - - [29000, 224, 1, 2048]
    - [12, 63.349]
  - - [29000, 229, 1, 2048]
    - [43, 65.198]
  - - [29000, 234, 1, 2048]
    - [43, 65.729]
  - - [29000, 242, 1, 2048]
    - [12, 68.502]
  - - [29000, 246, 1, 2048]
    - [29, 68.972]
  - - [29000, 247, 1, 2048]
    - [45, 69.235]
  - - [29000, 256, 1, 2048]
    - [45, 73.727]
  - - [29000, 262, 1, 2048]
    - [12, 51.594]
  - - [29000, 264, 1, 2048]
    - [12, 51.558]
  - - [29000, 265, 1, 2048]
    - [12, 51.739]
  - - [29000, 274, 1, 2048]
    - [12, 52.438]
  - - [29000, 277, 1, 2048]
    - [12, 53.209]
  - - [29000, 279, 1, 2048]
    - [12, 53.405]
  - - [29000, 288, 1, 2048]
    - [12, 55.085]
  - - [29000, 296, 1, 2048]
    - [12, 56.469]
  - - [29000, 315, 1, 2048]
    - [12, 61.589]
  - - [29000, 335, 1, 2048]
    - [12, 64.323]
  - - [4096, 4096, 1, 2048]
    - [14, 78.455]
  - - [29000, 2283, 1, 1024]
    - [14, 81.532]
  - - [29000, 2296, 1, 1024]
    - [14, 81.954]
  - - [29000, 2306, 1, 1024]
    - [27, 75.0]
  - - [29000, 2309, 1, 1024]
    - [27, 75.048]
  - - [29000, 2318, 1, 1024]
    - [27, 75.422]
  - - [29000, 2320, 1, 1024]
    - [27, 75.444]
  - - [29000, 2324, 1, 1024]
    - [27, 75.596]
  - - [29000, 2325, 1, 1024]
    - [27, 75.489]
  - - [29000, 2329, 1, 1024]
    - [27, 75.709]
  - - [29000, 2338, 1, 1024]
    - [27, 76.044]
  - - [29000, 2345, 1, 1024]
    - [27, 76.194]
  - - [29000, 2350, 1, 1024]
    - [27, 76.367]
  - - [29000, 2362, 1, 1024]
    - [27, 76.729]
  - - [29000, 2366, 1, 1024]
    - [27, 76.927]
  - - [29000, 2368, 1, 1024]
    - [27, 76.963]
  - - [29000, 2374, 1, 1024]
    - [27, 77.11]
  - - [29000, 2390, 1, 1024]
    - [27, 77.592]
  - - [512, 512, 320, 64]
    - [1, 49.655]
  - - [29000, 561, 1, 1024]
    - [27, 67.677]
  - - [29000, 574, 1, 1024]
    - [43, 69.362]
  - - [29000, 600, 1, 1024]
    - [27, 72.483]
  - - [29000, 608, 1, 1024]
    - [27, 72.962]
  - - [29000, 615, 1, 1024]
    - [43, 73.941]
  - - [29000, 622, 1, 1024]
    - [43, 74.86]
  - - [29000, 625, 1, 1024]
    - [43, 75.109]
  - - [29000, 626, 1, 1024]
    - [43, 75.186]
  - - [29000, 628, 1, 1024]
    - [43, 75.27]
  - - [29000, 636, 1, 1024]
    - [27, 76.239]
  - - [29000, 651, 1, 1024]
    - [14, 68.632]
  - - [29000, 658, 1, 1024]
    - [14, 69.071]
  - - [29000, 669, 1, 1024]
    - [45, 70.45]
  - - [29000, 670, 1, 1024]
    - [14, 70.486]
  - - [29000, 672, 1, 1024]
    - [14, 70.698]
  - - [29000, 684, 1, 1024]
    - [14, 71.969]
  - - [29000, 716, 1, 1024]
    - [14, 74.788]
  - - [29000, 730, 1, 1024]
    - [14, 76.145]
  - - [2560, 1024, 1, 2560]
    - [28, 61.039]
  - - [2560, 1024, 1, 4096]
    - [43, 56.045]
  - - [4096, 1024, 1, 2560]
    - [29, 69.98]
  - - [1024, 1024, 512, 64]
    - [12, 54.533]
  - - [1024, 32768, 1, 4096]
    - [14, 77.638]
  - - [3072, 32768, 1, 1024]
    - [14, 82.429]
  - - [4096, 32768, 1, 1024]
    - [14, 82.137]
  - - [50304, 32768, 1, 1024]
    - [14, 83.743]
  - - [1024, 1024, 24, 128]
    - [22, 74.973]
  - - [128, 1024, 24, 1024]
    - [14, 68.181]
  - - [128, 128, 49, 12800]
    - [50, 44.097]
  - - [128, 128, 25, 25088]
    - [49, 47.037]
  - - [128, 128, 49, 25600]
    - [50, 42.525]
  - - [128, 128, 25, 50176]
    - [51, 42.467]
  - - [128, 128, 36, 12544]
    - [49, 50.875]
  - - [128, 128, 49, 9216]
    - [50, 41.544]
  - - [1024, 1024, 1, 12544]
    - [48, 69.999]
  - - [1024, 1000, 1, 12544]
    - [48, 67.277]
  - - [128, 128, 36, 12000]
    - [6, 59.913]
  - - [5888, 128, 1, 1]
    - [53, 0.639]
  - - [1856, 256, 1, 1]
    - [52, 0.535]
  - - [256, 1856, 1, 32]
    - [67, 9.074]
  - - [128, 3584, 1, 1280]
    - [64, 43.89]
  - - [2944, 128, 1, 32]
    - [52, 9.891]
  - - [64, 6784, 1, 1]
    - [67, 0.451]
  - - [64, 5056, 1, 3328]
    - [62, 30.421]
  - - [704, 1024, 1, 1]
    - [52, 0.75]
  - - [256, 1856, 1, 1280]
    - [84, 44.71]
  - - [256, 1408, 1, 1]
    - [56, 0.403]
  - - [1024, 1024, 1, 1280]
    - [84, 58.165]
  - - [704, 1408, 1, 3328]
    - [64, 56.009]
  - - [1408, 704, 1, 256]
    - [90, 45.662]
  - - [6784, 128, 1, 3328]
    - [90, 49.385]
  - - [2944, 256, 1, 1]
    - [52, 0.803]
  - - [2944, 256, 1, 32]
    - [52, 18.174]
  - - [128, 4288, 1, 3328]
    - [72, 55.838]
  - - [5056, 128, 1, 256]
    - [62, 34.679]
  - - [1856, 704, 1, 1280]
    - [75, 50.448]
  - - [2368, 256, 1, 32]
    - [52, 14.803]
  - - [5056, 64, 1, 32]
    - [67, 8.324]
  - - [64, 6784, 1, 3328]
    - [62, 37.003]
  - - [2944, 256, 1, 1280]
    - [83, 47.355]
  - - [1024, 1024, 1, 3328]
    - [72, 59.797]
  - - [5888, 64, 1, 256]
    - [62, 27.047]
  - - [2944, 448, 1, 256]
    - [89, 44.932]
  - - [5056, 64, 1, 3328]
    - [62, 31.038]
  - - [1024, 448, 1, 32]
    - [79, 11.721]
  - - [128, 2944, 1, 3328]
    - [90, 38.621]
  - - [256, 1856, 1, 1]
    - [55, 0.511]
  - - [256, 3584, 1, 3328]
    - [57, 52.433]
  - - [256, 4288, 1, 1280]
    - [84, 59.17]
  - - [4288, 256, 1, 256]
    - [64, 48.961]
  - - [128, 5888, 1, 32]
    - [54, 16.064]
  - - [128, 5888, 1, 1280]
    - [63, 47.432]
  - - [3584, 256, 1, 256]
    - [76, 44.177]
  - - [1856, 256, 1, 256]
    - [62, 31.674]
  - - [1024, 704, 1, 1]
    - [79, 0.731]
  - - [448, 1408, 1, 3328]
    - [63, 40.521]
  - - [1024, 704, 1, 32]
    - [79, 17.168]
  - - [448, 2944, 1, 256]
    - [88, 43.584]
  - - [5888, 128, 1, 3328]
    - [89, 48.237]
  - - [2944, 448, 1, 1]
    - [52, 1.206]
  - - [5056, 64, 1, 1280]
    - [62, 29.688]
  - - [704, 704, 1, 32]
    - [52, 12.748]
  - - [256, 4288, 1, 256]
    - [83, 47.921]
  - - [5056, 128, 1, 1]
    - [52, 0.673]
  - - [704, 448, 1, 1280]
    - [72, 29.914]
  - - [1024, 704, 1, 1280]
    - [83, 45.37]
  - - [2368, 448, 1, 256]
    - [75, 41.975]
  - - [4288, 256, 1, 3328]
    - [57, 61.721]
  - - [128, 6784, 1, 32]
    - [81, 17.631]
  - - [128, 6784, 1, 3328]
    - [84, 49.568]
  - - [4288, 128, 1, 1]
    - [52, 0.612]
  - - [256, 2368, 1, 32]
    - [52, 14.005]
  - - [448, 1024, 1, 256]
    - [62, 30.915]
  - - [256, 1408, 1, 32]
    - [52, 9.209]
  - - [256, 3584, 1, 32]
    - [81, 19.449]
  - - [128, 4288, 1, 32]
    - [52, 13.235]
  - - [448, 1856, 1, 1]
    - [52, 0.856]
  - - [448, 1856, 1, 32]
    - [52, 19.924]
  - - [448, 1856, 1, 3328]
    - [62, 46.984]
  - - [1024, 448, 1, 256]
    - [75, 32.181]
  - - [704, 1856, 1, 32]
    - [52, 27.546]
  - - [704, 1408, 1, 32]
    - [52, 22.627]
  - - [5888, 128, 1, 32]
    - [52, 17.412]
  - - [128, 4288, 1, 1280]
    - [64, 51.242]
  - - [1856, 704, 1, 3328]
    - [89, 51.596]
  - - [4288, 128, 1, 256]
    - [62, 36.509]
  - - [704, 1856, 1, 3328]
    - [63, 51.389]
  - - [2944, 128, 1, 1280]
    - [90, 36.736]
  - - [1408, 448, 1, 1280]
    - [75, 39.506]
  - - [128, 2368, 1, 1]
    - [52, 0.352]
  - - [128, 2944, 1, 1280]
    - [64, 36.76]
  - - [1024, 448, 1, 1]
    - [86, 0.516]
  - - [256, 2944, 1, 256]
    - [63, 41.317]
  - - [704, 448, 1, 32]
    - [52, 8.449]
  - - [704, 1024, 1, 256]
    - [74, 38.098]
  - - [1408, 448, 1, 3328]
    - [63, 40.521]
  - - [256, 2368, 1, 1]
    - [80, 0.61]
  - - [5888, 64, 1, 3328]
    - [74, 35.786]
  - - [704, 448, 1, 3328]
    - [84, 32.75]
  - - [4288, 256, 1, 1]
    - [60, 1.042]
  - - [1856, 448, 1, 3328]
    - [75, 52.546]
  - - [4288, 256, 1, 1280]
    - [84, 59.189]
  - - [448, 2368, 1, 1280]
    - [62, 44.755]
  - - [3584, 256, 1, 1]
    - [52, 0.82]
  - - [2368, 448, 1, 32]
    - [52, 23.934]
  - - [1408, 704, 1, 1]
    - [60, 0.955]
  - - [2368, 256, 1, 256]
    - [82, 32.369]
  - - [1856, 256, 1, 1280]
    - [84, 44.71]
  - - [256, 2944, 1, 1]
    - [61, 0.716]
  - - [6784, 64, 1, 1]
    - [55, 0.504]
  - - [6784, 64, 1, 256]
    - [63, 30.457]
  - - [448, 2368, 1, 256]
    - [62, 41.447]
  - - [128, 2368, 1, 3328]
    - [90, 31.327]
  - - [64, 5056, 1, 256]
    - [62, 23.172]
  - - [2368, 448, 1, 3328]
    - [75, 51.235]
  - - [256, 2368, 1, 3328]
    - [75, 39.275]
  - - [5888, 64, 1, 1]
    - [52, 0.446]
  - - [256, 3584, 1, 1]
    - [87, 0.801]
  - - [704, 1856, 1, 1280]
    - [75, 50.779]
  - - [448, 1024, 1, 3328]
    - [72, 47.268]
  - - [128, 5056, 1, 32]
    - [52, 14.774]
  - - [128, 5056, 1, 1280]
    - [63, 40.897]
  - - [5888, 64, 1, 32]
    - [52, 9.758]
  - - [2368, 256, 1, 1]
    - [52, 0.678]
  - - [5888, 64, 1, 1280]
    - [74, 34.028]
  - - [256, 1408, 1, 256]
    - [62, 25.993]
  - - [5056, 64, 1, 1]
    - [52, 0.386]
  - - [1408, 448, 1, 32]
    - [52, 15.803]
  - - [5056, 128, 1, 1280]
    - [63, 39.885]
  - - [1856, 704, 1, 256]
    - [75, 44.268]
  - - [128, 6784, 1, 256]
    - [64, 42.074]
  - - [256, 3584, 1, 256]
    - [72, 44.878]
  - - [448, 704, 1, 1]
    - [52, 0.369]
  - - [448, 704, 1, 32]
    - [52, 8.391]
  - - [448, 704, 1, 3328]
    - [72, 32.759]
  - - [64, 5888, 1, 1]
    - [55, 0.41]
  - - [2368, 128, 1, 32]
    - [52, 8.177]
  - - [2368, 256, 1, 1280]
    - [82, 37.495]
  - - [2368, 128, 1, 3328]
    - [72, 31.506]
  - - [4288, 256, 1, 32]
    - [52, 24.339]
  - - [448, 1408, 1, 1]
    - [52, 0.68]
  - - [1408, 256, 1, 256]
    - [62, 26.177]
  - - [256, 4288, 1, 32]
    - [52, 21.943]
  - - [1408, 256, 1, 1280]
    - [90, 35.361]
  - - [448, 1408, 1, 256]
    - [62, 33.917]
  - - [128, 2944, 1, 32]
    - [52, 9.693]
  - - [1856, 448, 1, 1]
    - [52, 0.873]
  - - [704, 704, 1, 1]
    - [52, 0.543]
  - - [1856, 448, 1, 1280]
    - [75, 50.28]
  - - [128, 5888, 1, 256]
    - [75, 41.098]
  - - [3584, 256, 1, 3328]
    - [72, 52.255]
  - - [448, 2368, 1, 1]
    - [52, 1.022]
  - - [128, 6784, 1, 1]
    - [57, 0.798]
  - - [256, 2944, 1, 3328]
    - [75, 48.483]
  - - [64, 5888, 1, 256]
    - [62, 26.984]
  - - [704, 704, 1, 256]
    - [62, 33.039]
  - - [448, 1024, 1, 32]
    - [52, 12.121]
  - - [256, 2368, 1, 256]
    - [75, 33.591]
  - - [448, 704, 1, 1280]
    - [72, 29.878]
  - - [704, 1856, 1, 1]
    - [60, 1.167]
  - - [704, 448, 1, 256]
    - [62, 23.122]
  - - [2368, 448, 1, 1280]
    - [75, 49.595]
  - - [128, 5056, 1, 1]
    - [79, 0.644]
  - - [256, 2368, 1, 1280]
    - [56, 38.419]
  - - [64, 6784, 1, 256]
    - [62, 28.819]
  - - [128, 3584, 1, 256]
    - [63, 32.4]
  - - [704, 1408, 1, 1]
    - [79, 0.933]
  - - [4288, 128, 1, 3328]
    - [90, 55.124]
  - - [128, 6784, 1, 1280]
    - [64, 48.464]
  - - [3584, 256, 1, 32]
    - [53, 19.133]
  - - [1408, 256, 1, 32]
    - [52, 9.524]
  - - [5888, 128, 1, 256]
    - [83, 39.967]
  - - [128, 5056, 1, 3328]
    - [56, 41.855]
  - - [1024, 448, 1, 3328]
    - [57, 46.776]
  - - [3584, 128, 1, 1]
    - [52, 0.499]
  - - [128, 2368, 1, 256]
    - [62, 21.909]
  - - [448, 1856, 1, 256]
    - [62, 41.459]
  - - [3584, 128, 1, 256]
    - [63, 32.106]
  - - [1024, 448, 1, 1280]
    - [84, 42.853]
  - - [128, 5888, 1, 1]
    - [55, 0.704]
  - - [64, 5056, 1, 1]
    - [52, 0.364]
  - - [1856, 256, 1, 32]
    - [52, 12.471]
  - - [64, 5056, 1, 32]
    - [52, 8.16]
  - - [1408, 704, 1, 32]
    - [52, 22.9]
  - - [1408, 704, 1, 1280]
    - [84, 54.302]
  - - [1024, 1024, 1, 32]
    - [79, 23.657]
  - - [5056, 128, 1, 3328]
    - [63, 41.421]
  - - [128, 4288, 1, 1]
    - [52, 0.567]
  - - [2944, 128, 1, 3328]
    - [64, 38.759]
  - - [5888, 128, 1, 1280]
    - [89, 47.087]
  - - [2944, 128, 1, 256]
    - [62, 27.175]
  - - [6784, 128, 1, 1]
    - [52, 0.895]
  - - [1408, 256, 1, 3328]
    - [76, 37.044]
  - - [2944, 256, 1, 256]
    - [75, 40.524]
  - - [6784, 128, 1, 256]
    - [64, 42.207]
  - - [6784, 64, 1, 1280]
    - [63, 38.53]
  - - [2944, 448, 1, 1280]
    - [89, 50.936]
  - - [704, 448, 1, 1]
    - [52, 0.369]
  - - [256, 1408, 1, 3328]
    - [72, 37.064]
  - - [2944, 128, 1, 1]
    - [52, 0.446]
  - - [704, 1024, 1, 32]
    - [52, 17.383]
  - - [3584, 256, 1, 1280]
    - [84, 50.986]
  - - [3584, 128, 1, 1280]
    - [76, 44.136]
  - - [256, 1856, 1, 256]
    - [63, 33.712]
  - - [256, 2944, 1, 1280]
    - [71, 47.374]
  - - [2944, 256, 1, 3328]
    - [75, 48.237]
  - - [704, 1024, 1, 3328]
    - [75, 46.103]
  - - [448, 2944, 1, 1]
    - [52, 1.196]
  - - [448, 1856, 1, 1280]
    - [74, 46.323]
  - - [2368, 448, 1, 1]
    - [52, 1.049]
  - - [448, 2944, 1, 32]
    - [52, 27.959]
  - - [448, 2944, 1, 1280]
    - [64, 49.224]
  - - [128, 2368, 1, 1280]
    - [64, 28.733]
  - - [448, 2944, 1, 3328]
    - [57, 50.603]
  - - [2368, 128, 1, 1280]
    - [64, 28.696]
  - - [128, 3584, 1, 3328]
    - [64, 46.776]
  - - [256, 4288, 1, 3328]
    - [90, 61.818]
  - - [1856, 704, 1, 32]
    - [52, 27.85]
  - - [2944, 448, 1, 32]
    - [79, 27.959]
  - - [5056, 128, 1, 32]
    - [52, 15.225]
  - - [6784, 128, 1, 1280]
    - [64, 48.517]
  - - [1408, 704, 1, 3328]
    - [84, 56.009]
  - - [1856, 704, 1, 1]
    - [52, 1.194]
  - - [256, 1856, 1, 3328]
    - [72, 48.995]
  - - [4288, 128, 1, 1280]
    - [64, 51.271]
  - - [128, 4288, 1, 256]
    - [63, 38.501]
  - - [6784, 128, 1, 32]
    - [52, 19.478]
  - - [1408, 448, 1, 1]
    - [79, 0.697]
  - - [64, 5056, 1, 1280]
    - [74, 29.049]
  - - [448, 1408, 1, 32]
    - [52, 15.7]
  - - [128, 5056, 1, 256]
    - [63, 35.417]
  - - [1024, 1024, 1, 1]
    - [86, 1.037]
  - - [256, 1408, 1, 1280]
    - [76, 35.385]
  - - [64, 5888, 1, 3328]
    - [62, 35.253]
  - - [6784, 64, 1, 3328]
    - [63, 40.307]
  - - [2944, 448, 1, 3328]
    - [75, 51.893]
  - - [448, 1408, 1, 1280]
    - [56, 39.188]
  - - [2368, 128, 1, 1]
    - [52, 0.374]
  - - [5056, 64, 1, 256]
    - [62, 23.119]
  - - [2368, 128, 1, 256]
    - [62, 22.169]
  - - [64, 6784, 1, 32]
    - [52, 10.34]
  - - [256, 4288, 1, 1]
    - [52, 0.907]
  - - [128, 2944, 1, 256]
    - [62, 27.047]
  - - [3584, 128, 1, 32]
    - [52, 11.273]
  - - [3584, 128, 1, 3328]
    - [64, 46.706]
  - - [704, 704, 1, 3328]
    - [84, 50.885]
  - - [128, 2944, 1, 1]
    - [52, 0.424]
  - - [704, 1408, 1, 1280]
    - [57, 54.572]
  - - [6784, 64, 1, 32]
    - [52, 11.019]
  - - [64, 6784, 1, 1280]
    - [88, 35.677]
  - - [704, 1408, 1, 256]
    - [64, 45.937]
  - - [4288, 128, 1, 32]
    - [52, 14.024]
  - - [448, 704, 1, 256]
    - [62, 23.177]
  - - [1856, 256, 1, 3328]
    - [72, 48.818]
  - - [448, 1024, 1, 1280]
    - [72, 43.036]
  - - [1024, 1024, 1, 256]
    - [72, 50.41]
  - - [256, 2944, 1, 32]
    - [52, 17.004]
  - - [704, 1024, 1, 1280]
    - [71, 44.695]
  - - [256, 3584, 1, 1280]
    - [72, 51.3]
  - - [128, 2368, 1, 32]
    - [52, 7.955]
  - - [704, 1856, 1, 256]
    - [75, 45.464]
  - - [1856, 448, 1, 32]
    - [52, 19.924]
  - - [1408, 448, 1, 256]
    - [75, 34.457]
  - - [448, 1024, 1, 1]
    - [52, 0.526]
  - - [1024, 704, 1, 256]
    - [63, 39.241]
  - - [64, 5888, 1, 32]
    - [52, 9.144]
  - - [1856, 448, 1, 256]
    - [88, 40.996]
  - - [128, 5888, 1, 3328]
    - [83, 48.539]
  - - [2368, 256, 1, 3328]
    - [75, 38.578]
  - - [64, 5888, 1, 1280]
    - [62, 33.594]
  - - [1408, 256, 1, 1]
    - [52, 0.422]
  - - [704, 704, 1, 1280]
    - [72, 46.325]
  - - [128, 3584, 1, 1]
    - [67, 0.494]
  - - [128, 3584, 1, 32]
    - [52, 11.567]
  - - [448, 2368, 1, 32]
    - [52, 23.797]
  - - [448, 2368, 1, 3328]
    - [62, 44.688]
  - - [1024, 704, 1, 3328]
    - [75, 46.294]
  - - [2048, 400, 1, 512]
    - [90, 42.388]
  - - [2560, 128, 1, 2560]
    - [90, 32.562]
  - - [1024, 700, 1, 512]
    - [75, 39.969]
  - - [4096, 128, 1, 4096]
    - [76, 51.056]
  - - [3072, 128, 1, 1024]
    - [64, 36.528]
  - - [7680, 64, 1, 2560]
    - [88, 40.444]
  - - [7680, 128, 1, 2560]
    - [64, 54.777]
  - - [1024, 1024, 1, 1024]
    - [76, 57.029]
  - - [2049, 512, 1, 2048]
    - [90, 57.731]
  - - [1023, 512, 1, 1024]
    - [75, 43.487]
  - - [1024, 512, 1, 1025]
    - [84, 49.571]
  - - [1024, 1024, 1, 1023]
    - [72, 57.352]
  - - [1024, 1025, 1, 1024]
    - [64, 55.758]
  - - [1024, 1023, 1, 1024]
    - [76, 54.868]
  - - [2048, 511, 1, 2048]
    - [76, 55.956]
  - - [2047, 512, 1, 2048]
    - [64, 56.614]
  - - [1025, 1024, 1, 1024]
    - [76, 56.436]
  - - [1024, 1024, 1, 1025]
    - [72, 57.21]
  - - [1025, 512, 1, 1024]
    - [75, 41.242]
  - - [1024, 512, 1, 1023]
    - [84, 49.474]
  - - [2048, 513, 1, 2048]
    - [89, 45.964]
  - - [1024, 511, 1, 1024]
    - [89, 42.696]
  - - [2048, 512, 1, 2047]
    - [72, 58.84]
  - - [1024, 513, 1, 1024]
    - [75, 40.584]
  - - [2048, 512, 1, 2049]
    - [72, 58.818]
  - - [1023, 1024, 1, 1024]
    - [76, 55.172]
  - - [64, 128, 512, 128]
    - [73, 34.356]
  - - [64, 512, 64, 512]
    - [91, 31.949]
  - - [256, 1280, 1, 1024]
    - [64, 31.409]
  - - [256, 1536, 1, 1024]
    - [64, 37.486]
  - - [256, 2304, 1, 1024]
    - [64, 53.701]
  - - [256, 2560, 1, 1024]
    - [75, 40.905]
  - - [256, 2816, 1, 1024]
    - [75, 44.927]
  - - [256, 3328, 1, 1024]
    - [75, 52.433]
  - - [256, 3584, 1, 1024]
    - [64, 50.545]
  - - [512, 1600, 1, 512]
    - [75, 47.977]
  - - [1024, 512, 1, 1024]
    - [89, 44.517]
  - - [1024, 512, 1, 1600]
    - [53, 53.911]
  - - [1024, 960, 1, 1024]
    - [64, 51.644]
  - - [1024, 960, 1, 1600]
    - [84, 54.555]
  - - [2048, 215, 1, 512]
    - [89, 33.186]
  - - [2048, 215, 1, 768]
    - [90, 35.889]
  - - [2048, 256, 1, 512]
    - [90, 43.617]
  - - [2048, 256, 1, 768]
    - [90, 47.36]
  - - [2048, 512, 1, 67]
    - [80, 32.704]
  - - [2048, 512, 1, 74]
    - [81, 33.772]
  - - [2048, 512, 1, 100]
    - [69, 38.426]
  - - [2048, 512, 1, 2048]
    - [64, 57.87]
  - - [1024, 512, 1, 4096]
    - [64, 50.323]
  - - [30522, 77, 1, 1024]
    - [90, 38.773]
  - - [1024, 780, 1, 1024]
    - [89, 47.521]
  - - [1024, 800, 1, 1024]
    - [75, 48.529]
  - - [1024, 820, 1, 1024]
    - [75, 49.814]
  - - [1024, 385, 1, 1024]
    - [75, 32.998]
  - - [1024, 462, 1, 1024]
    - [75, 39.173]
  - - [1024, 1024, 1, 4096]
    - [76, 58.044]
  - - [480, 1024, 1, 1024]
    - [76, 44.003]
  - - [480, 2048, 1, 2048]
    - [76, 54.326]
  - - [1024, 480, 1, 1024]
    - [75, 40.864]
  - - [2048, 480, 1, 2048]
    - [90, 53.359]
  - - [64, 1024, 256, 1024]
    - [91, 37.941]
  - - [64, 512, 40, 512]
    - [62, 29.294]
  - - [96, 1024, 64, 1024]
    - [64, 48.315]
  - - [64, 1024, 128, 1024]
    - [91, 37.059]
  - - [64, 1024, 32, 1024]
    - [65, 32.149]
  - - [64, 512, 128, 512]
    - [65, 35.279]
  - - [96, 1024, 128, 1024]
    - [64, 47.123]
  - - [64, 512, 256, 512]
    - [77, 36.945]
  - - [64, 1024, 64, 1024]
    - [65, 35.532]
  - - [960, 1024, 1, 1024]
    - [64, 50.885]
  - - [64, 128, 1024, 128]
    - [73, 36.181]
  - - [1024, 864, 1, 1024]
    - [64, 46.323]
  - - [1024, 864, 1, 480]
    - [68, 44.755]
  - - [128, 3456, 1, 256]
    - [63, 31.173]
  - - [128, 4096, 1, 256]
    - [63, 36.777]
  - - [128, 6912, 1, 256]
    - [64, 42.935]
  - - [256, 3456, 1, 512]
    - [64, 46.598]
  - - [256, 4096, 1, 512]
    - [64, 54.714]
  - - [512, 864, 1, 1024]
    - [76, 39.863]
  - - [512, 864, 1, 13]
    - [55, 3.788]
  - - [64, 128, 1280, 128]
    - [73, 36.743]
  - - [64, 128, 1312, 128]
    - [58, 36.615]
  - - [64, 512, 192, 512]
    - [91, 36.309]
  - - [1024, 512, 1, 196]
    - [53, 33.485]
  - - [2048, 512, 1, 49]
    - [86, 28.414]
  - - [2304, 256, 1, 196]
    - [80, 37.977]
  - - [512, 1024, 1, 196]
    - [80, 35.911]
  - - [512, 2048, 1, 49]
    - [79, 28.68]
  - - [64, 128, 2048, 128]
    - [65, 36.719]
  - - [64, 128, 1536, 128]
    - [73, 36.309]
  - - [128, 128, 64, 6400]
    - [64, 49.161]
  - - [64, 128, 192, 128]
    - [70, 33.432]
  - - [64, 384, 144, 384]
    - [82, 37.874]
  - - [64, 512, 48, 512]
    - [91, 31.981]
  - - [64, 128, 256, 128]
    - [65, 29.475]
  - - [64, 384, 192, 384]
    - [55, 45.71]
  - - [512, 1024, 1, 1024]
    - [76, 48.375]
  - - [512, 2048, 1, 2048]
    - [76, 58.259]
  - - [128, 128, 49, 1120]
    - [56, 49.887]
  - - [128, 128, 49, 1064]
    - [68, 54.261]
  - - [128, 128, 49, 1040]
    - [68, 54.266]
  - - [128, 128, 64, 600]
    - [57, 54.258]
  - - [128, 128, 64, 616]
    - [84, 54.42]
  - - [128, 128, 49, 950]
    - [83, 48.703]
  - - [128, 128, 49, 972]
    - [56, 48.898]
  - - [128, 128, 64, 560]
    - [57, 54.753]
  - - [128, 128, 49, 1008]
    - [68, 54.627]
  - - [128, 128, 64, 532]
    - [57, 53.376]
  - - [128, 128, 49, 1080]
    - [53, 49.993]
  - - [128, 128, 64, 588]
    - [84, 54.22]
  - - [128, 128, 49, 1160]
    - [56, 49.484]
  - - [128, 128, 49, 988]
    - [80, 50.304]
  - - [128, 128, 49, 936]
    - [83, 48.891]
  - - [512, 1024, 1, 3800]
    - [80, 55.078]
  - - [512, 1024, 1, 3400]
    - [80, 55.049]
  - - [512, 1024, 1, 3456]
    - [72, 55.22]
  - - [512, 1024, 1, 3072]
    - [64, 51.519]
  - - [2048, 512, 1, 950]
    - [84, 57.325]
  - - [512, 1024, 1, 3552]
    - [72, 55.288]
  - - [512, 1024, 1, 3220]
    - [80, 54.728]
  - - [2048, 512, 1, 850]
    - [84, 56.674]
  - - [512, 2048, 1, 864]
    - [72, 57.67]
  - - [512, 2048, 1, 768]
    - [72, 56.679]
  - - [2048, 512, 1, 805]
    - [72, 56.631]
  - - [512, 1024, 1, 2852]
    - [80, 54.528]
  - - [512, 2048, 1, 888]
    - [72, 57.246]
  - - [2048, 512, 1, 864]
    - [72, 57.547]
  - - [2048, 512, 1, 768]
    - [84, 56.679]
  - - [2048, 512, 1, 888]
    - [84, 57.072]
  - - [2048, 256, 1, 950]
    - [72, 48.428]
  - - [2048, 512, 1, 713]
    - [84, 56.125]
  - - [512, 1024, 1, 2688]
    - [72, 54.579]
  - - [512, 1024, 1, 2640]
    - [72, 54.589]
  - - [512, 1024, 1, 2904]
    - [80, 54.697]
  - - [1024, 512, 1, 950]
    - [68, 50.504]
  - - [512, 2048, 1, 672]
    - [72, 56.862]
  - - [512, 2048, 1, 660]
    - [72, 55.961]
  - - [512, 2048, 1, 1008]
    - [72, 58.109]
  - - [2048, 256, 1, 850]
    - [68, 47.842]
  - - [2048, 512, 1, 726]
    - [84, 56.375]
  - - [1024, 512, 1, 850]
    - [68, 49.612]
  - - [2048, 512, 1, 660]
    - [84, 55.922]
  - - [2048, 512, 1, 672]
    - [72, 56.636]
  - - [512, 2048, 1, 840]
    - [69, 57.063]
  - - [2048, 512, 1, 1008]
    - [72, 58.136]
  - - [512, 2048, 1, 792]
    - [81, 56.92]
  - - [1024, 512, 1, 805]
    - [68, 48.739]
  - - [512, 2048, 1, 1050]
    - [72, 57.714]
  - - [2048, 512, 1, 748]
    - [84, 56.489]
  - - [2048, 256, 1, 864]
    - [53, 50.755]
  - - [1024, 512, 1, 768]
    - [90, 47.921]
  - - [1024, 512, 1, 864]
    - [53, 51.618]
  - - [2048, 512, 1, 875]
    - [72, 56.961]
  - - [2048, 512, 1, 840]
    - [84, 56.94]
  - - [2048, 512, 1, 792]
    - [84, 56.727]
  - - [512, 2048, 1, 736]
    - [72, 57.118]
  - - [2048, 256, 1, 888]
    - [52, 48.852]
  - - [512, 2048, 1, 704]
    - [84, 57.087]
  - - [512, 2048, 1, 588]
    - [72, 55.515]
  - - [1024, 512, 1, 888]
    - [53, 50.936]
  - - [512, 2048, 1, 816]
    - [84, 57.47]
  - - [1024, 512, 1, 713]
    - [68, 47.946]
  - - [2048, 512, 1, 736]
    - [84, 57.258]
  - - [2048, 512, 1, 588]
    - [84, 55.474]
  - - [2048, 512, 1, 704]
    - [84, 56.906]
  - - [1024, 512, 1, 660]
    - [68, 48.23]
  - - [2048, 256, 1, 660]
    - [68, 46.663]
  - - [2048, 256, 1, 672]
    - [53, 49.797]
  - - [1024, 512, 1, 672]
    - [53, 50.031]
  - - [1024, 512, 1, 726]
    - [68, 48.614]
  - - [512, 2048, 1, 630]
    - [72, 55.814]
  - - [512, 2048, 1, 600]
    - [81, 55.855]
  - - [2048, 256, 1, 805]
    - [68, 47.733]
  - - [2048, 256, 1, 713]
    - [68, 46.848]
  - - [2048, 256, 1, 726]
    - [80, 46.923]
  - - [320, 1024, 1, 1024]
    - [62, 29.856]
  - - [1024, 1000, 1, 1024]
    - [76, 53.957]
  - - [320, 1000, 1, 1024]
    - [64, 28.921]
  - - [128, 128, 49, 1280]
    - [63, 49.221]
  - - [128, 128, 49, 1360]
    - [68, 53.489]
  - - [128, 128, 49, 1200]
    - [56, 50.084]
  - - [128, 128, 49, 1240]
    - [80, 51.466]
  - - [2304, 256, 1, 704]
    - [68, 55.257]
  - - [2304, 256, 1, 736]
    - [80, 55.442]
  - - [2304, 256, 1, 792]
    - [68, 54.258]
  - - [2304, 256, 1, 748]
    - [68, 52.717]
  - - [2304, 256, 1, 726]
    - [80, 52.414]
  - - [2304, 256, 1, 713]
    - [68, 52.001]
  - - [2304, 256, 1, 768]
    - [90, 53.229]
  - - [512, 2048, 1, 759]
    - [72, 56.344]
  - - [512, 2048, 1, 925]
    - [72, 57.294]
  - - [2304, 256, 1, 805]
    - [68, 52.956]
  - - [512, 2048, 1, 900]
    - [72, 57.06]
  - - [512, 2048, 1, 875]
    - [72, 57.108]
  - - [512, 2048, 1, 748]
    - [84, 56.489]
  - - [512, 2048, 1, 726]
    - [72, 56.342]
  - - [512, 2048, 1, 713]
    - [72, 56.337]
  - - [512, 2048, 1, 805]
    - [72, 56.727]
  - - [512, 2048, 1, 850]
    - [72, 56.916]
  - - [512, 2048, 1, 950]
    - [72, 57.299]
  - - [128, 128, 49, 1152]
    - [83, 50.181]
  - - [128, 128, 49, 1216]
    - [68, 51.018]
  - - [128, 128, 36, 1800]
    - [57, 58.128]
  - - [128, 128, 36, 1900]
    - [72, 58.439]
  - - [128, 128, 64, 5880]
    - [76, 57.542]
  - - [128, 128, 49, 7680]
    - [66, 36.9]
  - - [128, 128, 64, 882]
    - [57, 54.606]
  - - [128, 128, 64, 931]
    - [57, 56.101]
  - - [128, 64, 121, 1152]
    - [56, 46.636]
  - - [128, 64, 81, 12000]
    - [62, 35.055]
  - - [128, 64, 121, 1216]
    - [56, 46.103]
  - - [128, 64, 81, 1800]
    - [71, 41.655]
  - - [128, 64, 81, 1900]
    - [56, 41.758]
  - - [128, 64, 49, 20280]
    - [71, 37.047]
  - - [128, 64, 49, 3042]
    - [82, 37.854]
  - - [128, 64, 49, 3211]
    - [70, 38.465]
  - - [128, 64, 169, 5880]
    - [56, 34.664]
  - - [128, 64, 121, 7680]
    - [78, 27.922]
  - - [128, 64, 169, 882]
    - [59, 37.177]
  - - [128, 64, 169, 931]
    - [85, 37.553]
  - - [256, 128, 25, 1080]
    - [71, 50.41]
  - - [256, 128, 25, 162]
    - [56, 37.295]
  - - [256, 128, 25, 171]
    - [56, 37.698]
  - - [1152, 256, 1, 1]
    - [52, 0.35]
  - - [1152, 256, 1, 1444]
    - [68, 30.707]
  - - [1152, 256, 1, 25]
    - [65, 5.809]
  - - [1152, 256, 1, 9]
    - [55, 2.884]
  - - [2304, 256, 1, 1444]
    - [72, 57.463]
  - - [2304, 340, 1, 1]
    - [52, 0.485]
  - - [2304, 340, 1, 1444]
    - [72, 43.321]
  - - [2304, 340, 1, 9]
    - [56, 4.83]
  - - [2304, 510, 1, 25]
    - [52, 14.697]
  - - [96, 1024, 160, 1024]
    - [64, 47.707]
  - - [96, 1024, 40, 1024]
    - [64, 49.636]
  - - [96, 1024, 80, 1024]
    - [90, 47.608]
  - - [96, 1024, 96, 1024]
    - [90, 47.012]
  - - [96, 1024, 24, 1024]
    - [64, 45.272]
  - - [96, 1024, 48, 1024]
    - [64, 49.947]
  - - [96, 1024, 16, 1024]
    - [64, 43.191]
  - - [96, 1024, 32, 1024]
    - [76, 45.862]
  - - [64, 512, 320, 512]
    - [77, 36.808]
  - - [64, 512, 80, 512]
    - [65, 34.103]
  - - [29000, 109, 1, 2560]
    - [64, 52.042]
  - - [29000, 121, 1, 2560]
    - [64, 57.477]
  - - [29000, 65, 1, 2560]
    - [90, 31.339]
  - - [29000, 66, 1, 2560]
    - [76, 31.997]
  - - [29000, 67, 1, 2560]
    - [76, 32.497]
  - - [29000, 69, 1, 2560]
    - [76, 32.952]
  - - [29000, 70, 1, 2560]
    - [90, 33.688]
  - - [29000, 71, 1, 2560]
    - [64, 34.245]
  - - [29000, 73, 1, 2560]
    - [76, 35.356]
  - - [29000, 74, 1, 2560]
    - [64, 35.687]
  - - [29000, 75, 1, 2560]
    - [76, 36.183]
  - - [29000, 77, 1, 2560]
    - [64, 36.767]
  - - [29000, 78, 1, 2560]
    - [76, 37.686]
  - - [29000, 80, 1, 2560]
    - [90, 38.624]
  - - [29000, 81, 1, 2560]
    - [64, 39.159]
  - - [29000, 82, 1, 2560]
    - [90, 39.562]
  - - [29000, 83, 1, 2560]
    - [76, 39.967]
  - - [29000, 84, 1, 2560]
    - [90, 40.485]
  - - [29000, 88, 1, 2560]
    - [64, 42.482]
  - - [29000, 89, 1, 2560]
    - [64, 43.015]
  - - [29000, 90, 1, 2560]
    - [64, 43.166]
  - - [29000, 92, 1, 2560]
    - [90, 44.049]
  - - [29000, 95, 1, 2560]
    - [76, 45.554]
  - - [29000, 98, 1, 2560]
    - [64, 47.008]
  - - [64, 1024, 512, 1024]
    - [91, 38.366]
  - - [64, 64, 36, 50176]
    - [107, 28.511]
  - - [64, 64, 49, 36864]
    - [96, 21.388]
  - - [64, 64, 64, 25600]
    - [91, 25.371]
  - - [256, 256, 1, 60800]
    - [103, 37.968]
  - - [256, 256, 1, 54400]
    - [93, 38.103]
  - - [256, 256, 1, 51520]
    - [103, 37.936]
  - - [256, 256, 1, 55296]
    - [108, 29.379]
  - - [256, 256, 1, 56832]
    - [104, 29.519]
  - - [256, 256, 1, 45632]
    - [103, 37.719]
  - - [256, 256, 1, 49152]
    - [97, 29.203]
  - - [256, 512, 1, 13600]
    - [99, 47.96]
  - - [256, 256, 1, 43008]
    - [101, 29.008]
  - - [256, 512, 1, 15200]
    - [99, 48.9]
  - - [256, 512, 1, 12880]
    - [99, 47.466]
  - - [256, 512, 1, 13824]
    - [98, 41.746]
  - - [512, 256, 1, 13824]
    - [106, 42.65]
  - - [256, 512, 1, 14208]
    - [99, 48.327]
  - - [512, 256, 1, 14208]
    - [99, 48.421]
  - - [512, 256, 1, 15200]
    - [94, 48.929]
  - - [256, 512, 1, 12288]
    - [100, 41.001]
  - - [512, 256, 1, 12288]
    - [95, 40.924]
  - - [128, 64, 25, 43320]
    - [95, 39.714]
  - - [64, 64, 64, 20280]
    - [92, 29.244]
  - - [64, 64, 49, 27000]
    - [102, 30.247]
  - - [64, 64, 36, 43320]
    - [105, 29.801]
  - - [32, 5056, 1, 1280]
    - [155, 15.953]
  - - [4288, 64, 1, 3328]
    - [149, 22.794]
  - - [2368, 64, 1, 1]
    - [113, 0.222]
  - - [1408, 128, 1, 32]
    - [127, 6.686]
  - - [32, 2944, 1, 3328]
    - [151, 13.631]
  - - [2368, 32, 1, 256]
    - [118, 9.91]
  - - [1024, 128, 1, 32]
    - [127, 5.324]
  - - [32, 4288, 1, 1280]
    - [137, 17.617]
  - - [32, 5056, 1, 32]
    - [109, 6.18]
  - - [5888, 32, 1, 32]
    - [144, 6.793]
  - - [64, 2368, 1, 1280]
    - [119, 16.693]
  - - [128, 704, 1, 32]
    - [111, 4.09]
  - - [32, 4288, 1, 3328]
    - [155, 17.467]
  - - [1408, 64, 1, 1]
    - [113, 0.147]
  - - [1856, 64, 1, 256]
    - [119, 13.187]
  - - [1024, 256, 1, 256]
    - [114, 18.904]
  - - [1856, 128, 1, 32]
    - [149, 8.256]
  - - [1856, 128, 1, 1280]
    - [149, 19.647]
  - - [4288, 32, 1, 3328]
    - [137, 16.997]
  - - [3584, 64, 1, 1280]
    - [119, 18.748]
  - - [64, 1856, 1, 256]
    - [119, 12.956]
  - - [3584, 64, 1, 32]
    - [127, 7.629]
  - - [1408, 128, 1, 3328]
    - [128, 18.979]
  - - [32, 6784, 1, 3328]
    - [137, 18.0]
  - - [32, 3584, 1, 256]
    - [119, 12.464]
  - - [704, 256, 1, 32]
    - [144, 6.752]
  - - [64, 2944, 1, 3328]
    - [112, 18.629]
  - - [64, 4288, 1, 3328]
    - [114, 22.835]
  - - [256, 704, 1, 256]
    - [119, 17.491]
  - - [5056, 32, 1, 3328]
    - [137, 16.481]
  - - [2944, 32, 1, 1280]
    - [119, 12.775]
  - - [64, 1408, 1, 3328]
    - [111, 14.19]
  - - [256, 448, 1, 1280]
    - [112, 15.191]
  - - [448, 448, 1, 256]
    - [137, 17.4]
  - - [1024, 256, 1, 1]
    - [113, 0.381]
  - - [1856, 64, 1, 32]
    - [127, 4.982]
  - - [4288, 64, 1, 256]
    - [122, 19.295]
  - - [1408, 64, 1, 256]
    - [118, 11.446]
  - - [6784, 32, 1, 32]
    - [144, 7.477]
  - - [448, 448, 1, 1280]
    - [157, 18.726]
  - - [32, 5888, 1, 256]
    - [119, 15.76]
  - - [1024, 128, 1, 256]
    - [119, 13.761]
  - - [1856, 64, 1, 1280]
    - [147, 14.677]
  - - [128, 1408, 1, 1]
    - [113, 0.28]
  - - [32, 2368, 1, 1280]
    - [118, 12.428]
  - - [448, 256, 1, 256]
    - [137, 12.965]
  - - [2944, 32, 1, 32]
    - [144, 4.275]
  - - [448, 448, 1, 32]
    - [112, 7.169]
  - - [704, 256, 1, 3328]
    - [145, 18.538]
  - - [64, 2944, 1, 1]
    - [113, 0.292]
  - - [64, 2944, 1, 32]
    - [109, 6.793]
  - - [64, 2944, 1, 1280]
    - [119, 18.403]
  - - [32, 3584, 1, 1280]
    - [137, 15.025]
  - - [32, 2944, 1, 32]
    - [113, 4.326]
  - - [32, 6784, 1, 256]
    - [137, 15.729]
  - - [448, 448, 1, 3328]
    - [157, 19.278]
  - - [704, 128, 1, 1280]
    - [156, 13.168]
  - - [32, 3584, 1, 3328]
    - [137, 15.765]
  - - [128, 704, 1, 1280]
    - [129, 13.754]
  - - [64, 4288, 1, 1]
    - [113, 0.408]
  - - [3584, 32, 1, 32]
    - [144, 4.81]
  - - [3584, 64, 1, 1]
    - [113, 0.342]
  - - [32, 4288, 1, 32]
    - [113, 5.572]
  - - [64, 1408, 1, 1]
    - [113, 0.147]
  - - [256, 1024, 1, 256]
    - [122, 18.861]
  - - [1408, 128, 1, 1280]
    - [130, 17.339]
  - - [64, 4288, 1, 1280]
    - [149, 22.232]
  - - [64, 3584, 1, 1]
    - [113, 0.345]
  - - [1024, 128, 1, 1280]
    - [157, 16.58]
  - - [2368, 32, 1, 32]
    - [144, 3.523]
  - - [128, 1408, 1, 256]
    - [119, 17.274]
  - - [256, 448, 1, 3328]
    - [110, 16.254]
  - - [2368, 64, 1, 256]
    - [137, 14.617]
  - - [32, 2368, 1, 3328]
    - [118, 13.127]
  - - [128, 1856, 1, 1]
    - [113, 0.357]
  - - [128, 1856, 1, 32]
    - [149, 8.256]
  - - [3584, 32, 1, 256]
    - [119, 12.29]
  - - [64, 3584, 1, 256]
    - [119, 16.657]
  - - [32, 2944, 1, 1280]
    - [119, 13.363]
  - - [4288, 32, 1, 32]
    - [144, 5.515]
  - - [1856, 64, 1, 1]
    - [113, 0.19]
  - - [128, 1024, 1, 3328]
    - [147, 18.415]
  - - [1408, 128, 1, 1]
    - [113, 0.282]
  - - [5056, 32, 1, 256]
    - [119, 14.774]
  - - [64, 1408, 1, 1280]
    - [118, 14.161]
  - - [3584, 32, 1, 1280]
    - [137, 13.959]
  - - [1856, 128, 1, 3328]
    - [149, 20.144]
  - - [704, 256, 1, 1280]
    - [147, 17.559]
  - - [1856, 128, 1, 1]
    - [113, 0.357]
  - - [256, 704, 1, 1]
    - [113, 0.28]
  - - [1024, 128, 1, 1]
    - [113, 0.207]
  - - [1856, 128, 1, 256]
    - [137, 17.171]
  - - [1024, 256, 1, 1280]
    - [114, 21.762]
  - - [64, 2368, 1, 32]
    - [109, 5.905]
  - - [32, 2368, 1, 256]
    - [118, 9.705]
  - - [32, 6784, 1, 1280]
    - [155, 16.262]
  - - [32, 6784, 1, 32]
    - [144, 7.477]
  - - [64, 3584, 1, 3328]
    - [140, 19.189]
  - - [32, 5888, 1, 1280]
    - [137, 18.14]
  - - [448, 256, 1, 1]
    - [113, 0.178]
  - - [448, 256, 1, 3328]
    - [132, 15.929]
  - - [128, 704, 1, 3328]
    - [111, 14.516]
  - - [2368, 32, 1, 3328]
    - [127, 12.36]
  - - [2944, 64, 1, 3328]
    - [147, 18.077]
  - - [128, 1024, 1, 32]
    - [109, 5.269]
  - - [32, 2368, 1, 32]
    - [144, 3.523]
  - - [64, 1856, 1, 1280]
    - [130, 15.695]
  - - [32, 3584, 1, 32]
    - [109, 4.917]
  - - [704, 256, 1, 1]
    - [113, 0.275]
  - - [1024, 256, 1, 3328]
    - [149, 22.355]
  - - [128, 1856, 1, 1280]
    - [132, 19.69]
  - - [448, 256, 1, 32]
    - [109, 4.81]
  - - [64, 4288, 1, 32]
    - [149, 9.37]
  - - [128, 704, 1, 1]
    - [113, 0.14]
  - - [4288, 64, 1, 1280]
    - [149, 22.232]
  - - [448, 448, 1, 1]
    - [113, 0.301]
  - - [32, 5888, 1, 32]
    - [144, 6.793]
  - - [1024, 128, 1, 3328]
    - [119, 18.953]
  - - [4288, 64, 1, 32]
    - [149, 9.452]
  - - [2368, 64, 1, 32]
    - [109, 5.905]
  - - [64, 1408, 1, 32]
    - [109, 4.09]
  - - [32, 2944, 1, 256]
    - [119, 10.573]
  - - [2944, 64, 1, 1]
    - [113, 0.287]
  - - [2944, 64, 1, 32]
    - [112, 6.793]
  - - [64, 2944, 1, 256]
    - [119, 16.428]
  - - [64, 2368, 1, 256]
    - [137, 14.393]
  - - [1408, 64, 1, 3328]
    - [146, 13.759]
  - - [6784, 32, 1, 1280]
    - [155, 17.745]
  - - [2944, 64, 1, 1280]
    - [147, 17.761]
  - - [2944, 32, 1, 256]
    - [118, 10.651]
  - - [256, 1024, 1, 3328]
    - [114, 22.403]
  - - [1856, 64, 1, 3328]
    - [114, 16.146]
  - - [5888, 32, 1, 256]
    - [119, 15.632]
  - - [128, 704, 1, 256]
    - [118, 11.736]
  - - [3584, 64, 1, 256]
    - [119, 16.775]
  - - [64, 1856, 1, 32]
    - [109, 4.982]
  - - [64, 1856, 1, 3328]
    - [130, 16.553]
  - - [5888, 32, 1, 1280]
    - [137, 18.207]
  - - [256, 704, 1, 32]
    - [127, 6.621]
  - - [256, 704, 1, 1280]
    - [119, 18.74]
  - - [1408, 64, 1, 32]
    - [144, 4.09]
  - - [128, 1408, 1, 1280]
    - [119, 18.227]
  - - [128, 1856, 1, 3328]
    - [114, 20.199]
  - - [2368, 64, 1, 3328]
    - [119, 15.881]
  - - [32, 5056, 1, 3328]
    - [137, 16.64]
  - - [64, 1856, 1, 1]
    - [111, 0.188]
  - - [704, 128, 1, 32]
    - [111, 4.044]
  - - [4288, 64, 1, 1]
    - [113, 0.398]
  - - [5056, 32, 1, 1280]
    - [155, 16.447]
  - - [128, 1024, 1, 1]
    - [113, 0.207]
  - - [256, 1024, 1, 1]
    - [113, 0.391]
  - - [1408, 64, 1, 1280]
    - [118, 13.727]
  - - [1024, 256, 1, 32]
    - [149, 8.871]
  - - [2368, 32, 1, 1280]
    - [118, 11.432]
  - - [704, 128, 1, 1]
    - [113, 0.142]
  - - [256, 448, 1, 256]
    - [119, 13.062]
  - - [32, 4288, 1, 256]
    - [119, 14.653]
  - - [128, 1408, 1, 32]
    - [109, 6.621]
  - - [704, 128, 1, 3328]
    - [145, 13.932]
  - - [64, 4288, 1, 256]
    - [122, 19.338]
  - - [4288, 32, 1, 1280]
    - [155, 16.727]
  - - [32, 5056, 1, 256]
    - [119, 14.687]
  - - [704, 128, 1, 256]
    - [118, 11.306]
  - - [256, 1024, 1, 32]
    - [130, 8.794]
  - - [256, 1024, 1, 1280]
    - [132, 21.832]
  - - [6784, 32, 1, 256]
    - [119, 15.765]
  - - [64, 2368, 1, 1]
    - [111, 0.236]
  - - [1408, 128, 1, 256]
    - [137, 15.239]
  - - [5888, 32, 1, 3328]
    - [137, 17.962]
  - - [64, 2368, 1, 3328]
    - [119, 16.686]
  - - [256, 704, 1, 3328]
    - [110, 19.512]
  - - [128, 1408, 1, 3328]
    - [110, 19.095]
  - - [2944, 32, 1, 3328]
    - [137, 13.795]
  - - [2368, 64, 1, 1280]
    - [137, 15.437]
  - - [128, 1024, 1, 1280]
    - [130, 17.619]
  - - [128, 1024, 1, 256]
    - [119, 14.764]
  - - [3584, 64, 1, 3328]
    - [114, 19.107]
  - - [256, 448, 1, 1]
    - [113, 0.178]
  - - [256, 448, 1, 32]
    - [111, 4.757]
  - - [64, 3584, 1, 32]
    - [149, 8.119]
  - - [64, 3584, 1, 1280]
    - [149, 18.769]
  - - [4288, 32, 1, 256]
    - [119, 14.504]
  - - [448, 256, 1, 1280]
    - [139, 14.762]
  - - [128, 1856, 1, 256]
    - [149, 17.171]
  - - [3584, 32, 1, 3328]
    - [119, 14.998]
  - - [6784, 32, 1, 3328]
    - [137, 18.22]
  - - [2944, 64, 1, 256]
    - [119, 16.199]
  - - [64, 1408, 1, 256]
    - [118, 11.352]
  - - [5056, 32, 1, 32]
    - [144, 6.18]
  - - [32, 5888, 1, 3328]
    - [137, 18.06]
  - - [704, 256, 1, 256]
    - [137, 16.958]
  - - [1024, 256, 1, 196]
    - [149, 17.8]
  - - [256, 1024, 1, 196]
    - [149, 18.06]
  - - [1760, 64, 1, 1760]
    - [110, 18.039]
  - - [2560, 32, 1, 2560]
    - [123, 11.728]
  - - [4608, 32, 1, 1536]
    - [161, 16.5]
  - - [3072, 64, 1, 1024]
    - [139, 16.423]
  - - [2048, 128, 1, 2048]
    - [159, 21.427]
  - - [4096, 64, 1, 4096]
    - [159, 20.621]
  - - [7680, 32, 1, 2560]
    - [124, 15.637]
  - - [2560, 64, 1, 2560]
    - [124, 14.497]
  - - [1760, 128, 1, 1760]
    - [110, 21.012]
  - - [3072, 32, 1, 1024]
    - [124, 12.965]
  - - [6144, 32, 1, 2560]
    - [142, 15.162]
  - - [4096, 32, 1, 4096]
    - [124, 15.234]
  - - [2048, 64, 1, 2048]
    - [124, 14.984]
  - - [8448, 32, 1, 2816]
    - [157, 18.261]
  - - [512, 512, 1, 512]
    - [122, 20.747]
  - - [511, 512, 1, 512]
    - [122, 20.038]
  - - [512, 512, 1, 511]
    - [132, 20.785]
  - - [512, 513, 1, 512]
    - [122, 20.344]
  - - [512, 511, 1, 512]
    - [122, 20.112]
  - - [513, 512, 1, 512]
    - [140, 16.766]
  - - [512, 512, 1, 513]
    - [132, 20.814]
  - - [512, 512, 1, 64]
    - [122, 12.883]
  - - [33, 33, 1600, 32]
    - [144, 7.595]
  - - [256, 684, 1, 1024]
    - [139, 16.628]
  - - [1024, 200, 1, 560]
    - [145, 17.636]
  - - [2048, 114, 1, 512]
    - [140, 17.969]
  - - [2048, 114, 1, 768]
    - [140, 18.798]
  - - [32, 32, 4608, 64]
    - [113, 16.587]
  - - [32, 35, 4608, 64]
    - [145, 12.642]
  - - [34, 34, 4736, 64]
    - [144, 8.083]
  - - [35, 35, 4608, 64]
    - [136, 8.35]
  - - [33, 33, 1920, 64]
    - [127, 7.593]
  - - [480, 512, 1, 512]
    - [122, 19.107]
  - - [512, 480, 1, 512]
    - [122, 19.01]
  - - [1024, 200, 1, 1024]
    - [122, 16.667]
  - - [1024, 308, 1, 1024]
    - [122, 17.588]
  - - [1024, 160, 1, 1024]
    - [119, 14.294]
  - - [1024, 180, 1, 1024]
    - [157, 16.708]
  - - [128, 864, 1, 256]
    - [119, 12.642]
  - - [256, 864, 1, 512]
    - [122, 17.067]
  - - [1152, 128, 1, 784]
    - [119, 19.939]
  - - [256, 512, 1, 784]
    - [145, 18.943]
  - - [512, 256, 1, 784]
    - [128, 18.629]
  - - [1024, 128, 1, 1024]
    - [140, 16.891]
  - - [1024, 96, 1, 1024]
    - [155, 14.345]
  - - [1024, 256, 1, 3800]
    - [132, 22.724]
  - - [1024, 256, 1, 3400]
    - [132, 22.704]
  - - [256, 1024, 1, 3400]
    - [114, 23.11]
  - - [1024, 256, 1, 3220]
    - [132, 22.446]
  - - [256, 1024, 1, 3220]
    - [132, 22.661]
  - - [1024, 256, 1, 3456]
    - [114, 22.642]
  - - [256, 1024, 1, 3456]
    - [132, 22.68]
  - - [1024, 256, 1, 3072]
    - [140, 21.152]
  - - [256, 1024, 1, 3072]
    - [122, 21.002]
  - - [1024, 256, 1, 3552]
    - [114, 22.632]
  - - [256, 1024, 1, 3552]
    - [132, 22.63]
  - - [256, 1024, 1, 2852]
    - [132, 22.647]
  - - [1024, 256, 1, 2852]
    - [149, 22.557]
  - - [256, 512, 1, 10752]
    - [157, 16.662]
  - - [256, 1024, 1, 3800]
    - [114, 23.136]
  - - [256, 512, 1, 10560]
    - [128, 22.615]
  - - [256, 1024, 1, 2992]
    - [149, 22.591]
  - - [256, 1024, 1, 2688]
    - [149, 22.569]
  - - [1024, 256, 1, 2688]
    - [110, 22.565]
  - - [256, 1024, 1, 2904]
    - [114, 23.025]
  - - [1024, 256, 1, 2904]
    - [149, 22.678]
  - - [256, 1024, 1, 2640]
    - [132, 22.521]
  - - [1024, 256, 1, 2640]
    - [149, 22.885]
  - - [1024, 256, 1, 4032]
    - [110, 22.714]
  - - [1024, 256, 1, 2992]
    - [149, 22.912]
  - - [256, 1024, 1, 3360]
    - [132, 22.608]
  - - [1024, 256, 1, 3360]
    - [114, 22.642]
  - - [1024, 256, 1, 3500]
    - [149, 22.794]
  - - [256, 1024, 1, 3500]
    - [132, 22.676]
  - - [1024, 256, 1, 3168]
    - [114, 22.606]
  - - [256, 1024, 1, 3168]
    - [132, 22.596]
  - - [256, 1024, 1, 3036]
    - [114, 22.989]
  - - [1024, 256, 1, 4200]
    - [132, 22.777]
  - - [1024, 256, 1, 3600]
    - [132, 22.972]
  - - [256, 1024, 1, 3600]
    - [149, 22.656]
  - - [256, 1024, 1, 2944]
    - [132, 22.61]
  - - [1024, 256, 1, 2944]
    - [128, 22.622]
  - - [1024, 256, 1, 3700]
    - [132, 22.719]
  - - [256, 1024, 1, 2352]
    - [132, 22.485]
  - - [1024, 256, 1, 2352]
    - [132, 22.83]
  - - [1024, 256, 1, 2816]
    - [132, 22.311]
  - - [256, 1024, 1, 3700]
    - [114, 23.032]
  - - [256, 1024, 1, 2816]
    - [114, 22.323]
  - - [256, 512, 1, 11408]
    - [145, 21.576]
  - - [1024, 256, 1, 3036]
    - [149, 22.509]
  - - [1024, 256, 1, 3264]
    - [110, 22.656]
  - - [256, 1024, 1, 3264]
    - [149, 22.683]
  - - [1024, 256, 1, 3864]
    - [132, 22.695]
  - - [256, 1024, 1, 4032]
    - [114, 22.755]
  - - [1024, 256, 1, 3128]
    - [149, 22.69]
  - - [256, 1024, 1, 3128]
    - [114, 23.093]
  - - [256, 1024, 1, 3200]
    - [132, 22.661]
  - - [256, 512, 1, 11616]
    - [145, 22.01]
  - - [1024, 256, 1, 3200]
    - [128, 22.656]
  - - [1024, 256, 1, 4000]
    - [110, 22.697]
  - - [256, 1024, 1, 2520]
    - [114, 22.991]
  - - [1024, 256, 1, 2520]
    - [149, 22.569]
  - - [256, 1024, 1, 2976]
    - [149, 22.589]
  - - [256, 1024, 1, 2400]
    - [149, 22.507]
  - - [1024, 256, 1, 2400]
    - [110, 22.454]
  - - [1024, 256, 1, 3696]
    - [149, 22.958]
  - - [1024, 256, 1, 3900]
    - [132, 22.704]
  - - [1024, 256, 1, 3772]
    - [149, 22.678]
  - - [256, 1024, 1, 3696]
    - [122, 22.637]
  - - [256, 1024, 1, 2728]
    - [114, 23.003]
  - - [1024, 256, 1, 2728]
    - [149, 22.618]
  - - [1024, 256, 1, 2480]
    - [132, 22.779]
  - - [256, 1024, 1, 2480]
    - [149, 22.497]
  - - [1024, 256, 1, 2880]
    - [110, 22.632]
  - - [512, 256, 1, 3220]
    - [110, 17.036]
  - - [256, 1024, 1, 2880]
    - [149, 22.642]
  - - [256, 1024, 1, 4200]
    - [114, 23.187]
  - - [1024, 256, 1, 3648]
    - [114, 22.683]
  - - [1024, 256, 1, 3312]
    - [149, 22.941]
  - - [256, 1024, 1, 3648]
    - [149, 22.719]
  - - [1024, 256, 1, 3300]
    - [132, 22.598]
  - - [1024, 256, 1, 3528]
    - [149, 22.729]
  - - [256, 1024, 1, 2604]
    - [132, 22.654]
  - - [1024, 256, 1, 2604]
    - [132, 22.61]
  - - [512, 256, 1, 11408]
    - [110, 20.985]
  - - [256, 1024, 1, 3312]
    - [149, 22.627]
  - - [256, 1024, 1, 3300]
    - [114, 23.018]
  - - [512, 256, 1, 3072]
    - [159, 15.709]
  - - [256, 1024, 1, 3528]
    - [114, 23.124]
  - - [1024, 256, 1, 2976]
    - [114, 22.603]
  - - [1024, 256, 1, 2760]
    - [149, 22.644]
  - - [512, 256, 1, 3800]
    - [110, 17.089]
  - - [256, 1024, 1, 2760]
    - [114, 23.028]
  - - [1024, 256, 1, 2160]
    - [149, 22.702]
  - - [256, 1024, 1, 2160]
    - [149, 22.449]
  - - [512, 256, 1, 11616]
    - [110, 22.008]
  - - [512, 256, 1, 2852]
    - [110, 16.937]
  - - [256, 1024, 1, 3864]
    - [114, 23.155]
  - - [512, 256, 1, 2640]
    - [128, 20.252]
  - - [256, 1024, 1, 4000]
    - [132, 22.676]
  - - [512, 256, 1, 2904]
    - [110, 17.13]
  - - [256, 1024, 1, 3900]
    - [149, 22.586]
  - - [512, 256, 1, 2688]
    - [110, 21.132]
  - - [256, 1024, 1, 3772]
    - [149, 22.579]
  - - [512, 256, 1, 3400]
    - [110, 17.132]
  - - [512, 256, 1, 3456]
    - [145, 21.301]
  - - [512, 256, 1, 3552]
    - [128, 22.063]
  - - [128, 64, 25, 6498]
    - [128, 21.933]
  - - [128, 64, 25, 6859]
    - [128, 21.706]
  - - [64, 64, 64, 3042]
    - [140, 22.184]
  - - [64, 64, 64, 3211]
    - [132, 22.128]
  - - [64, 64, 49, 4050]
    - [145, 21.998]
  - - [64, 64, 49, 4275]
    - [110, 21.911]
  - - [64, 64, 36, 6498]
    - [128, 18.61]
  - - [64, 64, 36, 6859]
    - [145, 18.656]
  - - [1152, 128, 1, 1444]
    - [110, 18.13]
  - - [512, 256, 1, 361]
    - [128, 13.879]
  - - [576, 128, 1, 1444]
    - [118, 12.56]
  - - [29000, 35, 1, 2560]
    - [140, 13.544]
  - - [29000, 36, 1, 2560]
    - [159, 13.923]
  - - [29000, 39, 1, 2560]
    - [159, 15.068]
  - - [29000, 40, 1, 2560]
    - [140, 15.42]
  - - [29000, 42, 1, 2560]
    - [140, 16.139]
  - - [29000, 43, 1, 2560]
    - [159, 16.51]
  - - [29000, 44, 1, 2560]
    - [159, 16.889]
  - - [29000, 46, 1, 2560]
    - [140, 17.532]
  - - [29000, 48, 1, 2560]
    - [159, 18.113]
  - - [29000, 49, 1, 2560]
    - [122, 18.335]
  - - [29000, 50, 1, 2560]
    - [159, 18.519]
  - - [29000, 51, 1, 2560]
    - [159, 19.338]
  - - [29000, 53, 1, 2560]
    - [122, 19.799]
  - - [29000, 54, 1, 2560]
    - [140, 19.334]
  - - [29000, 55, 1, 2560]
    - [140, 20.571]
  - - [29000, 56, 1, 2560]
    - [140, 20.026]
  - - [29000, 57, 1, 2560]
    - [159, 20.192]
  - - [29000, 58, 1, 2560]
    - [159, 20.448]
  - - [29000, 59, 1, 2560]
    - [159, 20.718]
  - - [29000, 61, 1, 2560]
    - [159, 20.865]
  - - [29000, 63, 1, 2560]
    - [122, 21.559]
  - - [256, 128, 1, 13600]
    - [164, 14.497]
  - - [256, 128, 1, 12880]
    - [169, 14.612]
  - - [128, 512, 1, 15200]
    - [165, 20.667]
  - - [512, 128, 1, 15200]
    - [169, 20.245]
  - - [128, 512, 1, 11408]
    - [165, 19.929]
  - - [256, 128, 1, 13824]
    - [177, 13.288]
  - - [128, 512, 1, 11616]
    - [165, 19.982]
  - - [256, 128, 1, 14208]
    - [174, 17.139]
  - - [128, 512, 1, 14208]
    - [175, 20.53]
  - - [256, 128, 1, 15200]
    - [164, 14.87]
  - - [512, 128, 1, 11408]
    - [169, 19.828]
  - - [512, 128, 1, 16800]
    - [174, 20.583]
  - - [128, 512, 1, 11264]
    - [179, 18.427]
  - - [512, 128, 1, 11616]
    - [174, 19.818]
  - - [512, 128, 1, 16128]
    - [165, 20.064]
  - - [512, 128, 1, 11968]
    - [165, 20.069]
  - - [128, 512, 1, 11968]
    - [175, 20.11]
  - - [512, 128, 1, 12288]
    - [175, 17.757]
  - - [128, 512, 1, 12288]
    - [173, 18.697]
  - - [128, 512, 1, 12672]
    - [175, 20.228]
  - - [512, 128, 1, 11776]
    - [165, 19.141]
  - - [512, 128, 1, 12144]
    - [174, 19.958]
  - - [512, 128, 1, 11264]
    - [165, 18.376]
  - - [128, 512, 1, 12144]
    - [175, 20.115]
  - - [512, 128, 1, 12672]
    - [169, 20.175]
  - - [128, 512, 1, 12512]
    - [165, 20.214]
  - - [128, 512, 1, 11776]
    - [175, 18.709]
  - - [256, 128, 1, 12288]
    - [168, 13.011]
  - - [40, 40, 1, 1909283]
    - [178, 2.03]
  - - [40, 40, 1, 3818566]
    - [178, 2.028]
  - - [5888, 1, 1, 3328]
    - [188, 0.931]
  - - [5056, 1, 1, 3328]
    - [186, 0.868]
  - - [6784, 1, 1, 1280]
    - [183, 0.822]
  - - [2944, 1, 1, 3328]
    - [185, 0.731]
  - - [3584, 1, 1, 1280]
    - [184, 0.728]
  - - [6784, 1, 1, 256]
    - [186, 0.769]
  - - [4288, 1, 1, 1280]
    - [184, 0.856]
  - - [5056, 1, 1, 1280]
    - [188, 0.829]
  - - [3584, 1, 1, 256]
    - [188, 0.506]
  - - [6784, 1, 1, 3328]
    - [183, 0.849]
  - - [1408, 1, 1, 1280]
    - [184, 0.354]
  - - [1408, 32, 1, 3328]
    - [146, 10.038]
  - - [4288, 1, 1, 256]
    - [184, 0.593]
  - - [2368, 1, 1, 256]
    - [189, 0.369]
  - - [1856, 32, 1, 32]
    - [181, 2.696]
  - - [5056, 1, 1, 256]
    - [186, 0.668]
  - - [5056, 1, 1, 1]
    - [181, 0.007]
  - - [1408, 1, 1, 256]
    - [120, 0.236]
  - - [1408, 1, 1, 1]
    - [181, 0.002]
  - - [4288, 1, 1, 3328]
    - [184, 0.926]
  - - [2368, 1, 1, 1280]
    - [185, 0.552]
  - - [1856, 1, 1, 1]
    - [181, 0.002]
  - - [1856, 32, 1, 256]
    - [129, 8.111]
  - - [1408, 32, 1, 32]
    - [181, 2.095]
  - - [1856, 32, 1, 1280]
    - [129, 10.323]
  - - [1408, 1, 1, 3328]
    - [184, 0.388]
  - - [5888, 1, 1, 256]
    - [188, 0.745]
  - - [5888, 1, 1, 1]
    - [181, 0.01]
  - - [1856, 32, 1, 3328]
    - [146, 11.13]
  - - [2368, 1, 1, 3328]
    - [182, 0.598]
  - - [6784, 1, 1, 1]
    - [181, 0.01]
  - - [5888, 1, 1, 1280]
    - [186, 0.873]
  - - [2944, 1, 1, 256]
    - [184, 0.456]
  - - [2944, 1, 1, 1]
    - [181, 0.005]
  - - [1408, 32, 1, 1280]
    - [120, 9.076]
  - - [1856, 1, 1, 1280]
    - [184, 0.465]
  - - [3584, 1, 1, 1]
    - [181, 0.005]
  - - [2944, 1, 1, 1280]
    - [189, 0.67]
  - - [3584, 1, 1, 3328]
    - [184, 0.779]
  - - [1856, 1, 1, 3328]
    - [184, 0.509]
  - - [4288, 1, 1, 1]
    - [181, 0.007]
  - - [1856, 1, 1, 256]
    - [120, 0.306]
  - - [1408, 32, 1, 256]
    - [120, 7.094]
  - - [2368, 1, 1, 1]
    - [181, 0.002]
  - - [1760, 32, 1, 1760]
    - [146, 10.446]
  - - [3072, 16, 1, 1024]
    - [162, 8.924]
  - - [2560, 16, 1, 2560]
    - [125, 8.114]
  - - [2048, 32, 1, 2048]
    - [138, 9.975]
  - - [1760, 16, 1, 1760]
    - [152, 6.645]
  - - [7680, 16, 1, 2560]
    - [162, 10.465]
  - - [8448, 16, 1, 2816]
    - [138, 10.79]
  - - [4608, 16, 1, 1536]
    - [143, 10.651]
  - - [6144, 16, 1, 2560]
    - [125, 9.819]
  - - [4096, 16, 1, 4096]
    - [125, 9.971]
  - - [2048, 16, 1, 2048]
    - [143, 7.296]
  - - [2048, 2, 1, 2048]
    - [187, 1.112]
  - - [2560, 4, 1, 2560]
    - [189, 2.522]
  - - [32768, 1, 1, 256]
    - [187, 0.945]
  - - [1600, 1, 1, 1024]
    - [184, 0.388]
  - - [3456, 1, 1, 256]
    - [188, 0.492]
  - - [4096, 1, 1, 256]
    - [184, 0.574]
  - - [6912, 1, 1, 256]
    - [186, 0.76]
  - - [2048, 8, 1, 2048]
    - [184, 4.526]
  - - [2560, 2, 1, 2560]
    - [189, 1.242]
  - - [29000, 27, 1, 2560]
    - [143, 9.693]
  - - [1, 4288, 1, 1280]
    - [118, 0.801]
  - - [32, 1408, 1, 32]
    - [109, 2.12]
  - - [1, 1408, 1, 3328]
    - [133, 0.446]
  - - [1, 2368, 1, 1280]
    - [123, 0.55]
  - - [1, 5888, 1, 3328]
    - [118, 0.866]
  - - [1, 1856, 1, 256]
    - [118, 0.323]
  - - [1, 3584, 1, 3328]
    - [118, 0.735]
  - - [1, 6784, 1, 3328]
    - [118, 0.965]
  - - [1, 2368, 1, 256]
    - [118, 0.374]
  - - [32, 1856, 1, 3328]
    - [191, 13.927]
  - - [1, 2944, 1, 1280]
    - [118, 0.653]
  - - [1, 1856, 1, 3328]
    - [123, 0.569]
  - - [1, 1408, 1, 1]
    - [109, 0.002]
  - - [1, 6784, 1, 256]
    - [118, 0.673]
  - - [1, 6784, 1, 1]
    - [109, 0.01]
  - - [1, 4288, 1, 3328]
    - [118, 0.849]
  - - [1, 2368, 1, 3328]
    - [123, 0.593]
  - - [1, 5888, 1, 1280]
    - [118, 0.842]
  - - [1, 2944, 1, 256]
    - [118, 0.456]
  - - [1, 6784, 1, 1280]
    - [118, 0.928]
  - - [1, 5056, 1, 1]
    - [109, 0.007]
  - - [32, 1856, 1, 32]
    - [144, 2.795]
  - - [32, 1408, 1, 256]
    - [118, 7.398]
  - - [1, 5888, 1, 1]
    - [109, 0.01]
  - - [1, 2944, 1, 3328]
    - [118, 0.692]
  - - [1, 3584, 1, 1]
    - [109, 0.005]
  - - [1, 1408, 1, 256]
    - [118, 0.253]
  - - [1, 1856, 1, 1]
    - [109, 0.002]
  - - [1, 5056, 1, 1280]
    - [118, 0.817]
  - - [1, 5888, 1, 256]
    - [190, 0.622]
  - - [32, 1856, 1, 1280]
    - [192, 12.91]
  - - [1, 2368, 1, 1]
    - [109, 0.005]
  - - [1, 1408, 1, 1280]
    - [115, 0.408]
  - - [1, 5056, 1, 256]
    - [118, 0.603]
  - - [1, 3584, 1, 1280]
    - [118, 0.709]
  - - [1, 4288, 1, 256]
    - [118, 0.567]
  - - [1, 4288, 1, 1]
    - [109, 0.007]
  - - [1, 2944, 1, 1]
    - [109, 0.005]
  - - [32, 1408, 1, 3328]
    - [115, 11.244]
  - - [1, 5056, 1, 3328]
    - [118, 0.863]
  - - [32, 1856, 1, 256]
    - [191, 9.074]
  - - [1, 1856, 1, 1280]
    - [115, 0.516]
  - - [1, 3584, 1, 256]
    - [118, 0.504]
  - - [32, 1408, 1, 1280]
    - [123, 10.378]
  - - [2, 2048, 1, 1024]
    - [123, 1.073]
  - - [32, 1600, 1, 512]
    - [118, 9.877]
  - - [1, 4096, 1, 256]
    - [118, 0.545]
  - - [1, 6912, 1, 256]
    - [118, 0.69]
  - - [2, 2048, 1, 768]
    - [160, 1.025]
  - - [2, 4608, 1, 768]
    - [118, 1.603]
  - - [2, 4608, 1, 1024]
    - [123, 1.481]
  - - [512, 16, 1, 500000]
    - [178, 7.176]
  - - [1024, 8, 1, 500000]
    - [176, 5.027]
  - - [1024, 16, 1, 500000]
    - [170, 10.055]
  - - [512, 8, 1, 500000]
    - [172, 3.61]
  - - [147, 64, 1, 12544]
    - [166, 7.128]
  - - [256, 128, 1, 10752]
    - [171, 12.806]
  - - [256, 128, 1, 10560]
    - [174, 16.536]
  - - [256, 128, 1, 11408]
    - [174, 14.28]
  - - [256, 12, 1, 11408]
    - [172, 2.787]
  - - [256, 128, 1, 11616]
    - [164, 14.275]
  - - [256, 12, 1, 11616]
    - [178, 2.819]
  - - [256, 12, 1, 12288]
    - [180, 2.848]
  - - [576, 64, 1, 5625]
    - [174, 13.081]
  - - [147, 64, 1, 22500]
    - [166, 8.232]
  - - [11, 11, 1, 1909283]
    - [167, 0.203]
  - - [11, 11, 1, 3818566]
    - [167, 0.142]
  - - [448, 1, 1, 256]
    - [111, 0.065]
  - - [704, 64, 1, 3328]
    - [115, 11.56]
  - - [256, 128, 1, 256]
    - [115, 5.881]
  - - [448, 64, 1, 1]
    - [109, 0.046]
  - - [64, 1024, 1, 1280]
    - [118, 13.238]
  - - [1024, 1, 1, 3328]
    - [115, 0.354]
  - - [1024, 64, 1, 1280]
    - [158, 12.454]
  - - [448, 128, 1, 256]
    - [118, 9.124]
  - - [1, 1024, 1, 3328]
    - [115, 0.364]
  - - [704, 64, 1, 32]
    - [111, 2.146]
  - - [32, 448, 1, 3328]
    - [115, 5.387]
  - - [448, 1, 1, 1]
    - [109, 0.001]
  - - [64, 128, 1, 3328]
    - [115, 3.142]
  - - [64, 128, 1, 1]
    - [109, 0.012]
  - - [256, 128, 1, 1]
    - [113, 0.053]
  - - [256, 32, 1, 3328]
    - [141, 3.188]
  - - [1, 1, 1, 3328]
    - [153, 0.0]
  - - [32, 448, 1, 1280]
    - [115, 4.81]
  - - [32, 448, 1, 32]
    - [144, 0.709]
  - - [64, 1024, 1, 32]
    - [111, 3.045]
  - - [128, 1, 1, 1]
    - [109, 0.0]
  - - [1024, 32, 1, 3328]
    - [115, 10.098]
  - - [448, 1, 1, 1280]
    - [115, 0.147]
  - - [64, 64, 1, 1280]
    - [141, 1.408]
  - - [448, 128, 1, 3328]
    - [148, 12.102]
  - - [128, 256, 1, 1280]
    - [150, 9.399]
  - - [256, 256, 1, 32]
    - [113, 3.009]
  - - [1024, 1, 1, 256]
    - [115, 0.188]
  - - [128, 32, 1, 32]
    - [127, 0.2]
  - - [448, 64, 1, 256]
    - [115, 5.269]
  - - [128, 256, 1, 3328]
    - [133, 10.561]
  - - [1, 64, 1, 3328]
    - [115, 0.024]
  - - [64, 1024, 1, 1]
    - [113, 0.109]
  - - [64, 1024, 1, 3328]
    - [113, 13.725]
  - - [32, 704, 1, 3328]
    - [115, 7.337]
  - - [32, 1024, 1, 3328]
    - [123, 10.192]
  - - [64, 1, 1, 256]
    - [109, 0.012]
  - - [1024, 64, 1, 32]
    - [111, 3.284]
  - - [1024, 64, 1, 3328]
    - [113, 13.819]
  - - [32, 1024, 1, 256]
    - [118, 5.949]
  - - [64, 1, 1, 1]
    - [109, 0.0]
  - - [256, 1, 1, 256]
    - [115, 0.051]
  - - [256, 128, 1, 3328]
    - [115, 10.679]
  - - [64, 64, 1, 1]
    - [109, 0.007]
  - - [32, 704, 1, 1280]
    - [123, 6.648]
  - - [256, 1, 1, 1280]
    - [115, 0.084]
  - - [128, 32, 1, 1280]
    - [160, 1.432]
  - - [128, 256, 1, 1]
    - [113, 0.053]
  - - [1, 256, 1, 256]
    - [109, 0.046]
  - - [1, 256, 1, 1]
    - [109, 0.0]
  - - [1024, 1, 1, 1280]
    - [115, 0.318]
  - - [64, 448, 1, 256]
    - [115, 5.175]
  - - [1024, 32, 1, 1280]
    - [115, 9.03]
  - - [256, 256, 1, 3328]
    - [113, 14.024]
  - - [704, 32, 1, 1280]
    - [115, 7.079]
  - - [64, 64, 1, 3328]
    - [115, 1.572]
  - - [32, 32, 1, 32]
    - [155, 0.055]
  - - [1024, 32, 1, 32]
    - [115, 1.664]
  - - [128, 64, 1, 32]
    - [111, 0.4]
  - - [64, 1, 1, 1280]
    - [115, 0.022]
  - - [448, 32, 1, 1280]
    - [115, 4.873]
  - - [704, 32, 1, 3328]
    - [115, 7.943]
  - - [128, 128, 1, 256]
    - [115, 3.221]
  - - [64, 448, 1, 1280]
    - [115, 8.509]
  - - [64, 256, 1, 1]
    - [109, 0.027]
  - - [256, 256, 1, 256]
    - [118, 10.062]
  - - [448, 1, 1, 3328]
    - [115, 0.171]
  - - [256, 1, 1, 1]
    - [109, 0.0]
  - - [32, 1024, 1, 1280]
    - [150, 9.062]
  - - [1, 256, 1, 3328]
    - [115, 0.096]
  - - [256, 32, 1, 256]
    - [115, 1.62]
  - - [256, 128, 1, 1280]
    - [123, 9.558]
  - - [256, 64, 1, 256]
    - [115, 3.2]
  - - [1, 1, 1, 1]
    - [109, 0.0]
  - - [32, 1024, 1, 32]
    - [113, 1.601]
  - - [128, 256, 1, 256]
    - [118, 5.949]
  - - [704, 64, 1, 256]
    - [118, 7.598]
  - - [704, 1, 1, 1]
    - [109, 0.001]
  - - [128, 448, 1, 1280]
    - [118, 12.43]
  - - [448, 32, 1, 32]
    - [111, 0.699]
  - - [704, 64, 1, 1]
    - [109, 0.072]
  - - [704, 32, 1, 256]
    - [115, 4.319]
  - - [32, 704, 1, 32]
    - [113, 1.114]
  - - [128, 64, 1, 256]
    - [115, 1.62]
  - - [448, 32, 1, 3328]
    - [115, 5.37]
  - - [64, 704, 1, 32]
    - [113, 2.173]
  - - [64, 704, 1, 3328]
    - [150, 11.56]
  - - [448, 64, 1, 1280]
    - [115, 8.427]
  - - [128, 448, 1, 32]
    - [111, 2.664]
  - - [64, 256, 1, 256]
    - [115, 3.241]
  - - [64, 704, 1, 1]
    - [109, 0.072]
  - - [1, 1024, 1, 1]
    - [109, 0.002]
  - - [256, 1, 1, 3328]
    - [115, 0.096]
  - - [32, 64, 1, 32]
    - [109, 0.099]
  - - [256, 256, 1, 1]
    - [109, 0.111]
  - - [32, 256, 1, 32]
    - [111, 0.405]
  - - [128, 1, 1, 256]
    - [115, 0.024]
  - - [32, 64, 1, 3328]
    - [133, 0.786]
  - - [1, 128, 1, 3328]
    - [115, 0.048]
  - - [32, 256, 1, 256]
    - [123, 1.664]
  - - [1, 448, 1, 1]
    - [109, 0.001]
  - - [1, 704, 1, 3328]
    - [115, 0.251]
  - - [64, 1, 1, 3328]
    - [115, 0.024]
  - - [448, 64, 1, 3328]
    - [115, 9.462]
  - - [256, 32, 1, 1280]
    - [115, 2.778]
  - - [128, 448, 1, 3328]
    - [118, 12.782]
  - - [64, 1024, 1, 256]
    - [118, 9.963]
  - - [64, 32, 1, 32]
    - [163, 0.101]
  - - [1, 448, 1, 3328]
    - [115, 0.171]
  - - [1024, 64, 1, 256]
    - [118, 9.963]
  - - [64, 704, 1, 1280]
    - [150, 10.73]
  - - [64, 32, 1, 3328]
    - [115, 0.784]
  - - [64, 448, 1, 1]
    - [109, 0.051]
  - - [128, 128, 1, 1280]
    - [123, 5.498]
  - - [64, 128, 1, 256]
    - [115, 1.62]
  - - [64, 448, 1, 32]
    - [111, 1.382]
  - - [128, 64, 1, 3328]
    - [141, 3.154]
  - - [32, 64, 1, 1280]
    - [141, 0.702]
  - - [448, 32, 1, 256]
    - [115, 2.91]
  - - [1024, 32, 1, 256]
    - [118, 5.915]
  - - [1, 128, 1, 256]
    - [115, 0.024]
  - - [32, 256, 1, 1280]
    - [150, 2.797]
  - - [32, 128, 1, 3328]
    - [115, 1.57]
  - - [32, 128, 1, 32]
    - [144, 0.205]
  - - [1, 128, 1, 1]
    - [109, 0.0]
  - - [128, 64, 1, 1]
    - [109, 0.014]
  - - [32, 448, 1, 256]
    - [123, 2.93]
  - - [1, 704, 1, 256]
    - [115, 0.13]
  - - [32, 256, 1, 3328]
    - [115, 3.139]
  - - [256, 32, 1, 32]
    - [111, 0.4]
  - - [64, 256, 1, 3328]
    - [115, 6.149]
  - - [1, 704, 1, 1]
    - [113, 0.001]
  - - [128, 448, 1, 1]
    - [113, 0.094]
  - - [64, 128, 1, 32]
    - [111, 0.405]
  - - [704, 1, 1, 1280]
    - [115, 0.219]
  - - [1024, 1, 1, 1]
    - [109, 0.002]
  - - [256, 128, 1, 32]
    - [111, 1.56]
  - - [448, 128, 1, 1]
    - [113, 0.092]
  - - [704, 32, 1, 32]
    - [111, 1.087]
  - - [128, 32, 1, 256]
    - [115, 0.81]
  - - [64, 32, 1, 1280]
    - [160, 0.728]
  - - [448, 128, 1, 32]
    - [109, 2.91]
  - - [128, 448, 1, 256]
    - [118, 9.218]
  - - [32, 32, 1, 256]
    - [141, 0.207]
  - - [256, 64, 1, 32]
    - [115, 0.878]
  - - [1, 1024, 1, 1280]
    - [115, 0.323]
  - - [32, 32, 1, 3328]
    - [115, 0.393]
  - - [1, 256, 1, 1280]
    - [115, 0.089]
  - - [1, 128, 1, 1280]
    - [115, 0.043]
  - - [1, 64, 1, 256]
    - [109, 0.012]
  - - [256, 64, 1, 1280]
    - [150, 5.449]
  - - [32, 704, 1, 256]
    - [123, 4.266]
  - - [1, 64, 1, 1]
    - [109, 0.0]
  - - [704, 64, 1, 1280]
    - [115, 10.747]
  - - [1, 704, 1, 1280]
    - [123, 0.224]
  - - [128, 128, 1, 32]
    - [111, 0.791]
  - - [1024, 64, 1, 1]
    - [113, 0.106]
  - - [704, 1, 1, 256]
    - [160, 0.13]
  - - [128, 64, 1, 1280]
    - [123, 2.867]
  - - [64, 64, 1, 32]
    - [154, 0.205]
  - - [1, 1, 1, 1280]
    - [150, 0.0]
  - - [64, 704, 1, 256]
    - [118, 7.641]
  - - [1, 448, 1, 1280]
    - [115, 0.149]
  - - [64, 256, 1, 32]
    - [111, 0.801]
  - - [32, 128, 1, 1280]
    - [115, 1.399]
  - - [128, 128, 1, 3328]
    - [115, 6.214]
  - - [64, 448, 1, 3328]
    - [115, 9.438]
  - - [32, 64, 1, 256]
    - [141, 0.415]
  - - [128, 256, 1, 32]
    - [111, 1.579]
  - - [64, 256, 1, 1280]
    - [115, 5.486]
  - - [64, 64, 1, 256]
    - [115, 0.805]
  - - [448, 64, 1, 32]
    - [144, 1.382]
  - - [64, 128, 1, 1280]
    - [123, 2.816]
  - - [1, 1024, 1, 256]
    - [115, 0.188]
  - - [128, 1, 1, 3328]
    - [115, 0.048]
  - - [128, 128, 1, 1]
    - [111, 0.027]
  - - [32, 128, 1, 256]
    - [123, 0.827]
  - - [1, 64, 1, 1280]
    - [115, 0.022]
  - - [448, 128, 1, 1280]
    - [158, 10.858]
  - - [256, 64, 1, 1]
    - [109, 0.027]
  - - [256, 256, 1, 1280]
    - [118, 13.378]
  - - [704, 1, 1, 3328]
    - [115, 0.246]
  - - [128, 32, 1, 3328]
    - [123, 1.572]
  - - [32, 32, 1, 1280]
    - [160, 0.352]
  - - [1, 1, 1, 256]
    - [123, 0.0]
  - - [1, 448, 1, 256]
    - [115, 0.089]
  - - [256, 64, 1, 3328]
    - [115, 6.127]
  - - [64, 32, 1, 256]
    - [115, 0.405]
  - - [128, 1, 1, 1280]
    - [115, 0.043]
  - - [512, 128, 1, 784]
    - [109, 11.982]
  - - [256, 64, 1, 3136]
    - [115, 6.127]
  - - [64, 256, 1, 3136]
    - [115, 6.139]
  - - [128, 512, 1, 784]
    - [144, 12.266]
  - - [64, 64, 1, 3136]
    - [150, 1.562]
  - - [14, 14, 1, 64]
    - [160, 0.017]
  - - [15, 14, 1, 64]
    - [115, 0.024]
  - - [15, 15, 1, 64]
    - [115, 0.024]
  - - [17, 15, 1, 64]
    - [111, 0.027]
  - - [17, 17, 1, 64]
    - [109, 0.027]
  - - [21, 17, 1, 64]
    - [138, 0.034]
  - - [21, 21, 1, 64]
    - [138, 0.041]
  - - [24, 24, 1, 64]
    - [143, 0.055]
  - - [30, 30, 1, 64]
    - [143, 0.087]
  - - [30, 31, 1, 64]
    - [143, 0.089]
  - - [31, 31, 1, 64]
    - [138, 0.092]
  - - [32, 32, 1, 64]
    - [109, 0.106]
  - - [32, 35, 1, 64]
    - [115, 0.094]
  - - [34, 24, 1, 64]
    - [127, 0.063]
  - - [34, 34, 1, 64]
    - [111, 0.089]
  - - [35, 35, 1, 64]
    - [127, 0.104]
  - - [27, 27, 1, 64]
    - [127, 0.06]
  - - [27, 33, 1, 64]
    - [144, 0.075]
  - - [33, 33, 1, 64]
    - [129, 0.084]
  - - [2, 4, 1, 1024]
    - [109, 0.002]
  - - [2, 32, 1, 1024]
    - [115, 0.019]
  - - [64, 512, 1, 512]
    - [115, 7.605]
  - - [1024, 4, 1, 1024]
    - [160, 1.218]
  - - [1024, 32, 1, 1024]
    - [160, 8.608]
  - - [3, 3, 512, 64]
    - [144, 0.265]
  - - [5, 5, 512, 64]
    - [144, 0.721]
  - - [5, 5, 960, 64]
    - [109, 0.965]
  - - [9, 9, 512, 64]
    - [144, 2.177]
  - - [27, 27, 32768, 128]
    - [134, 10.643]
  - - [64, 512, 1, 1024]
    - [115, 8.324]
  - - [64, 960, 1, 1024]
    - [118, 12.394]
  - - [14, 14, 10880, 64]
    - [150, 9.387]
  - - [15, 14, 10880, 64]
    - [115, 10.041]
  - - [15, 15, 7680, 64]
    - [150, 10.376]
  - - [15, 15, 10880, 64]
    - [115, 10.689]
  - - [17, 15, 7680, 64]
    - [111, 7.636]
  - - [17, 17, 7680, 64]
    - [119, 6.494]
  - - [21, 17, 6144, 64]
    - [128, 6.756]
  - - [21, 21, 6144, 64]
    - [161, 7.764]
  - - [24, 24, 4736, 64]
    - [124, 9.66]
  - - [30, 30, 2048, 64]
    - [131, 13.624]
  - - [30, 31, 2048, 64]
    - [121, 13.93]
  - - [31, 31, 2048, 64]
    - [158, 14.299]
  - - [34, 24, 4736, 64]
    - [110, 9.368]
  - - [27, 27, 1920, 64]
    - [113, 11.145]
  - - [27, 33, 1920, 64]
    - [119, 9.428]
  - - [2, 8, 1, 1024]
    - [109, 0.005]
  - - [1024, 77, 1, 1024]
    - [154, 11.943]
  - - [2, 10, 1, 1024]
    - [115, 0.007]
  - - [1024, 10, 1, 1024]
    - [141, 3.038]
  - - [2, 39, 1, 1024]
    - [115, 0.024]
  - - [1024, 39, 1, 1024]
    - [118, 8.948]
  - - [2, 40, 1, 1024]
    - [115, 0.024]
  - - [1024, 40, 1, 1024]
    - [118, 9.245]
  - - [2, 41, 1, 1024]
    - [115, 0.027]
  - - [1024, 41, 1, 1024]
    - [118, 9.44]
  - - [2, 5, 1, 1024]
    - [109, 0.002]
  - - [1024, 5, 1, 1024]
    - [160, 1.519]
  - - [2, 6, 1, 1024]
    - [115, 0.005]
  - - [1024, 6, 1, 1024]
    - [160, 1.828]
  - - [1024, 8, 1, 1024]
    - [160, 2.426]
  - - [2, 9, 1, 1024]
    - [109, 0.005]
  - - [1024, 9, 1, 1024]
    - [160, 2.73]
  - - [4, 4, 32768, 64]
    - [109, 1.075]
  - - [4, 4, 38400, 64]
    - [127, 1.08]
  - - [17, 17, 6144, 64]
    - [137, 6.359]
  - - [128, 128, 1, 64]
    - [111, 1.389]
  - - [64, 128, 1, 128]
    - [144, 1.119]
  - - [2, 1024, 1, 1024]
    - [160, 0.622]
  - - [5, 5, 1, 64]
    - [109, 0.002]
  - - [33, 33, 1, 32]
    - [109, 0.043]
  - - [1024, 16, 1, 1024]
    - [141, 4.946]
  - - [2, 4, 1, 2560]
    - [109, 0.002]
  - - [2, 16, 1, 1024]
    - [115, 0.012]
  - - [2, 2, 1, 2048]
    - [109, 0.002]
  - - [1024, 1, 1, 1024]
    - [160, 0.304]
  - - [512, 1, 1, 2048]
    - [123, 0.181]
  - - [200, 1, 1, 1024]
    - [115, 0.063]
  - - [960, 1, 1, 2048]
    - [123, 0.318]
  - - [1024, 64, 1, 1024]
    - [158, 12.095]
  - - [864, 1, 1, 256]
    - [115, 0.157]
  - - [1024, 80, 1, 1024]
    - [154, 12.85]
  - - [1024, 82, 1, 1024]
    - [155, 12.445]
  - - [1024, 12, 1, 1024]
    - [160, 3.655]
  - - [2, 64, 1, 1024]
    - [115, 0.039]
  - - [2, 80, 1, 1024]
    - [115, 0.048]
  - - [2, 82, 1, 1024]
    - [115, 0.051]
  - - [2, 12, 1, 1024]
    - [109, 0.007]
  - - [2, 1, 1, 1024]
    - [115, 0.001]
  - - [24, 24, 6816, 64]
    - [116, 9.951]
  - - [256, 128, 1, 3136]
    - [133, 10.446]
  - - [576, 64, 1, 3136]
    - [115, 11.176]
  - - [768, 16, 1, 768]
    - [160, 3.523]
  - - [768, 12, 1, 768]
    - [141, 2.57]
  - - [768, 4, 1, 768]
    - [160, 0.858]
  - - [64, 1024, 1, 1024]
    - [118, 12.662]
  - - [26, 26, 6272, 64]
    - [134, 11.434]
  - - [2, 128, 1, 1024]
    - [115, 0.08]
  - - [2, 96, 1, 1024]
    - [115, 0.06]
  - - [256, 80, 1, 784]
    - [150, 4.888]
  - - [256, 12, 1, 3800]
    - [135, 1.167]
  - - [256, 3, 1, 3800]
    - [117, 0.292]
  - - [256, 12, 1, 950]
    - [135, 0.887]
  - - [256, 3, 1, 950]
    - [117, 0.224]
  - - [256, 12, 1, 3220]
    - [135, 1.148]
  - - [256, 3, 1, 3220]
    - [135, 0.289]
  - - [256, 12, 1, 3072]
    - [126, 1.153]
  - - [256, 3, 1, 3072]
    - [126, 0.287]
  - - [256, 12, 1, 850]
    - [135, 0.868]
  - - [256, 3, 1, 850]
    - [135, 0.217]
  - - [256, 12, 1, 2852]
    - [117, 1.136]
  - - [256, 3, 1, 2852]
    - [117, 0.285]
  - - [256, 12, 1, 805]
    - [126, 0.858]
  - - [256, 3, 1, 805]
    - [135, 0.217]
  - - [256, 3, 1, 864]
    - [117, 0.227]
  - - [256, 3, 1, 768]
    - [115, 0.224]
  - - [256, 12, 1, 864]
    - [135, 0.904]
  - - [256, 12, 1, 768]
    - [115, 0.895]
  - - [256, 12, 1, 2904]
    - [135, 1.131]
  - - [256, 3, 1, 2904]
    - [117, 0.285]
  - - [256, 3, 1, 713]
    - [135, 0.207]
  - - [256, 12, 1, 888]
    - [126, 0.873]
  - - [256, 3, 1, 888]
    - [135, 0.219]
  - - [256, 12, 1, 713]
    - [117, 0.817]
  - - [256, 3, 1, 660]
    - [135, 0.198]
  - - [256, 3, 1, 672]
    - [117, 0.207]
  - - [256, 12, 1, 660]
    - [153, 0.788]
  - - [256, 3, 1, 726]
    - [117, 0.203]
  - - [256, 12, 1, 672]
    - [135, 0.832]
  - - [256, 3, 1, 247]
    - [115, 0.123]
  - - [256, 12, 1, 726]
    - [135, 0.81]
  - - [256, 3, 1, 216]
    - [115, 0.116]
  - - [256, 3, 1, 3400]
    - [135, 0.292]
  - - [256, 3, 1, 221]
    - [115, 0.116]
  - - [256, 12, 1, 3552]
    - [135, 1.177]
  - - [256, 3, 1, 3456]
    - [117, 0.294]
  - - [256, 3, 1, 204]
    - [115, 0.111]
  - - [256, 12, 1, 3400]
    - [117, 1.157]
  - - [256, 12, 1, 3456]
    - [135, 1.172]
  - - [256, 12, 1, 221]
    - [115, 0.463]
  - - [256, 3, 1, 3552]
    - [135, 0.297]
  - - [256, 3, 1, 228]
    - [115, 0.118]
  - - [256, 3, 1, 234]
    - [115, 0.121]
  - - [256, 12, 1, 234]
    - [150, 0.487]
  - - [256, 12, 1, 228]
    - [115, 0.477]
  - - [256, 3, 1, 252]
    - [150, 0.125]
  - - [256, 12, 1, 252]
    - [115, 0.494]
  - - [256, 12, 1, 247]
    - [150, 0.492]
  - - [128, 256, 1, 1444]
    - [123, 8.427]
  - - [256, 128, 1, 25]
    - [129, 1.162]
  - - [256, 128, 1, 9]
    - [129, 0.439]
  - - [256, 256, 1, 1444]
    - [151, 11.535]
  - - [512, 128, 1, 100]
    - [144, 6.221]
  - - [64, 128, 1, 1444]
    - [126, 2.696]
  - - [81, 1024, 1, 1024]
    - [158, 11.253]
  - - [81, 1000, 1, 1024]
    - [158, 11.051]
  - - [1024, 20, 1, 1024]
    - [141, 5.404]
  - - [2, 8, 1, 2048]
    - [109, 0.005]
  - - [2, 20, 1, 1024]
    - [109, 0.012]
  - - [2, 2, 1, 2560]
    - [109, 0.002]
  - - [16, 16, 12, 64]
    - [193, 0.035]
  - - [16, 16, 16, 64]
    - [194, 0.048]
  - - [16, 16, 24, 64]
    - [194, 0.073]
  - - [16, 16, 32, 64]
    - [194, 0.096]
  - - [16, 16, 48, 64]
    - [194, 0.145]
  - - [16, 16, 64, 64]
    - [194, 0.192]
  - - [16, 16, 96, 64]
    - [194, 0.286]
  - - [16, 16, 128, 64]
    - [195, 0.377]
  - - [16, 16, 192, 64]
    - [195, 0.558]
  - - [16, 16, 256, 64]
    - [195, 0.72]
  - - [16, 16, 384, 64]
    - [196, 0.866]
  - - [16, 16, 512, 64]
    - [195, 1.034]
  - - [16, 16, 768, 64]
    - [195, 1.216]
  - - [16, 16, 1024, 64]
    - [197, 1.401]
  - - [16, 16, 1536, 64]
    - [197, 1.6]
  - - [16, 16, 2048, 64]
    - [195, 1.969]
  - - [16, 16, 3072, 64]
    - [196, 2.157]
  - - [32, 32, 12, 64]
    - [198, 0.143]
  - - [32, 32, 16, 64]
    - [199, 0.191]
  - - [32, 32, 24, 64]
    - [195, 0.286]
  - - [32, 32, 32, 64]
    - [195, 0.381]
  - - [32, 32, 48, 64]
    - [193, 0.557]
  - - [32, 32, 64, 64]
    - [200, 0.712]
  - - [32, 32, 96, 64]
    - [201, 0.972]
  - - [32, 32, 128, 64]
    - [201, 1.256]
  - - [32, 32, 192, 64]
    - [201, 1.631]
  - - [32, 32, 256, 64]
    - [202, 1.642]
  - - [32, 32, 384, 64]
    - [203, 2.04]
  - - [32, 32, 512, 64]
    - [204, 2.326]
  - - [32, 32, 768, 64]
    - [205, 2.758]
  - - [32, 32, 1024, 64]
    - [205, 2.965]
  - - [32, 32, 1536, 64]
    - [206, 3.255]
  - - [32, 32, 2048, 64]
    - [207, 3.433]
  - - [32, 32, 3072, 64]
    - [208, 3.661]
  - - [64, 64, 12, 64]
    - [209, 0.558]
  - - [64, 64, 16, 64]
    - [210, 0.72]
  - - [64, 64, 24, 64]
    - [207, 0.972]
  - - [64, 64, 32, 64]
    - [211, 1.253]
  - - [64, 64, 48, 64]
    - [201, 1.701]
  - - [64, 64, 64, 64]
    - [212, 2.045]
  - - [64, 64, 96, 64]
    - [213, 2.369]
  - - [64, 64, 128, 64]
    - [212, 2.737]
  - - [64, 64, 192, 64]
    - [214, 3.264]
  - - [64, 64, 256, 64]
    - [212, 3.661]
  - - [64, 64, 384, 64]
    - [213, 4.156]
  - - [64, 64, 512, 64]
    - [215, 4.643]
  - - [64, 64, 768, 64]
    - [214, 5.077]
  - - [64, 64, 1024, 64]
    - [212, 5.348]
  - - [64, 64, 1536, 64]
    - [214, 5.625]
  - - [64, 64, 2048, 64]
    - [212, 5.781]
  - - [64, 64, 3072, 64]
    - [213, 5.895]
  - - [128, 128, 12, 64]
    - [216, 1.71]
  - - [128, 128, 16, 64]
    - [215, 2.081]
  - - [128, 128, 24, 64]
    - [215, 2.427]
  - - [128, 128, 32, 64]
    - [215, 2.792]
  - - [128, 128, 48, 64]
    - [214, 3.331]
  - - [128, 128, 64, 64]
    - [214, 3.725]
  - - [128, 128, 96, 64]
    - [215, 4.431]
  - - [128, 128, 384, 64]
    - [215, 5.645]
  - - [128, 128, 768, 64]
    - [217, 5.915]
  - - [128, 128, 3072, 64]
    - [215, 6.143]
  - - [256, 256, 12, 64]
    - [214, 3.229]
  - - [256, 256, 16, 64]
    - [212, 3.684]
  - - [256, 256, 24, 64]
    - [214, 4.388]
  - - [256, 256, 32, 64]
    - [215, 4.645]
  - - [256, 256, 48, 64]
    - [215, 5.101]
  - - [256, 256, 64, 64]
    - [215, 5.36]
  - - [256, 256, 96, 64]
    - [215, 5.637]
  - - [256, 256, 128, 64]
    - [212, 5.795]
  - - [256, 256, 192, 64]
    - [215, 5.906]
  - - [256, 256, 256, 64]
    - [215, 6.007]
  - - [256, 256, 384, 64]
    - [215, 6.077]
  - - [256, 256, 512, 64]
    - [214, 6.11]
  - - [256, 256, 768, 64]
    - [214, 6.139]
  - - [256, 256, 1024, 64]
    - [218, 5.765]
  - - [256, 256, 1536, 64]
    - [214, 5.598]
  - - [256, 256, 2048, 64]
    - [214, 5.272]
  - - [256, 256, 3072, 64]
    - [218, 5.587]
  - - [384, 384, 12, 64]
    - [214, 4.568]
  - - [384, 384, 16, 64]
    - [212, 4.96]
  - - [384, 384, 24, 64]
    - [215, 5.303]
  - - [384, 384, 32, 64]
    - [212, 5.512]
  - - [384, 384, 48, 64]
    - [215, 5.728]
  - - [384, 384, 64, 64]
    - [215, 5.839]
  - - [384, 384, 96, 64]
    - [215, 5.961]
  - - [384, 384, 128, 64]
    - [214, 6.029]
  - - [384, 384, 256, 64]
    - [212, 6.124]
  - - [384, 384, 384, 64]
    - [215, 6.15]
  - - [384, 384, 512, 64]
    - [217, 5.808]
  - - [384, 384, 768, 64]
    - [212, 5.108]
  - - [384, 384, 1024, 64]
    - [218, 5.217]
  - - [384, 384, 1536, 64]
    - [201, 5.877]
  - - [384, 384, 2048, 64]
    - [217, 7.256]
  - - [384, 384, 3072, 64]
    - [213, 9.392]
  - - [512, 512, 12, 64]
    - [215, 5.072]
  - - [512, 512, 24, 64]
    - [215, 5.63]
  - - [512, 512, 32, 64]
    - [212, 5.787]
  - - [512, 512, 384, 64]
    - [215, 5.602]
  - - [512, 512, 512, 64]
    - [215, 5.312]
  - - [512, 512, 768, 64]
    - [215, 5.692]
  - - [512, 512, 1024, 64]
    - [214, 6.767]
  - - [512, 512, 1536, 64]
    - [212, 8.923]
  - - [512, 512, 2048, 64]
    - [218, 10.705]
  - - [512, 512, 3072, 64]
    - [215, 13.525]
- null
