library/src/blas3/Tensile/Logic/asm_full/navi21_Cijk_Ailk_Bljk_HHS_BH_GB.yaml
- {MinimumRequiredVersion: 4.26.0}
- navi21
- gfx1030
- [Device 73a2]
    SolutionIndex: 0
    SolutionNameMin: Cijk_Ailk_Bljk_HHS_BH_MT128x64x8_SN_SU0_SUM0_TT8_8_WG16_8_1_WGM1
    SolutionIndex: 1
    SolutionNameMin: Cijk_Ailk_Bljk_HHS_BH_MT128x128x8_SN_SU0_SUM0_TT8_16_WG16_8_1_WGM1
    SolutionIndex: 2
    SolutionNameMin: Cijk_Ailk_Bljk_HHS_BH_MT128x64x16_SN_SU0_SUM0_TT8_8_WG16_8_1_WGM1
    SolutionIndex: 3
    SolutionNameMin: Cijk_Ailk_Bljk_HHS_BH_MT128x128x16_SN_SU0_SUM0_TT8_16_WG16_8_1_WGM1
    SolutionIndex: 4
    SolutionNameMin: Cijk_Ailk_Bljk_HHS_BH_MT128x128x16_SN_SU0_SUM0_TT8_8_WG16_16_1_WGM1
    SolutionIndex: 5
    SolutionNameMin: Cijk_Ailk_Bljk_HHS_BH_MT128x256x16_SN_SU0_SUM0_TT8_16_WG16_16_1_WGM1
    SolutionIndex: 6
    SolutionNameMin: Cijk_Ailk_Bljk_HHS_BH_MT128x128x32_SN_SU0_SUM0_TT8_16_WG16_8_1_WGM1
    SolutionIndex: 7
    SolutionNameMin: Cijk_Ailk_Bljk_HHS_BH_MT128x64x8_SN_SU32_SUM3_TT8_8_WG16_8_1_WGM1
    SolutionIndex: 8
    SolutionNameMin: Cijk_Ailk_Bljk_HHS_BH_MT128x128x8_SN_SU32_SUM3_TT8_16_WG16_8_1_WGM1
    SolutionIndex: 9
    SolutionNameMin: Cijk_Ailk_Bljk_HHS_BH_MT128x64x16_SN_SU32_SUM3_TT8_8_WG16_8_1_WGM1
    SolutionIndex: 10
    SolutionNameMin: Cijk_Ailk_Bljk_HHS_BH_MT128x128x16_SN_SU32_SUM3_TT8_16_WG16_8_1_WGM1
    SolutionIndex: 11
    SolutionNameMin: Cijk_Ailk_Bljk_HHS_BH_MT128x256x16_SN_SU32_SUM3_TT8_16_WG16_16_1_WGM1
    SolutionIndex: 12
    SolutionNameMin: Cijk_Ailk_Bljk_HHS_BH_MT128x128x32_SN_SU32_SUM3_TT8_16_WG16_8_1_WGM1
    SolutionIndex: 13
    SolutionNameMin: Cijk_Ailk_Bljk_HHS_BH_MT128x128x8_SN_SU0_SUM0_TT8_16_WG16_8_1_WGM4
    SolutionIndex: 14
    SolutionNameMin: Cijk_Ailk_Bljk_HHS_BH_MT128x64x16_SN_SU0_SUM0_TT8_8_WG16_8_1_WGM4
    SolutionIndex: 15
    SolutionNameMin: Cijk_Ailk_Bljk_HHS_BH_MT128x128x16_SN_SU0_SUM0_TT8_16_WG16_8_1_WGM4
    SolutionIndex: 16
    SolutionNameMin: Cijk_Ailk_Bljk_HHS_BH_MT128x128x16_SN_SU0_SUM0_TT8_8_WG16_16_1_WGM4
    SolutionIndex: 17
    SolutionNameMin: Cijk_Ailk_Bljk_HHS_BH_MT128x256x16_SN_SU0_SUM0_TT8_16_WG16_16_1_WGM4
    SolutionIndex: 18
    SolutionNameMin: Cijk_Ailk_Bljk_HHS_BH_MT128x128x8_SN_SU32_SUM3_TT8_16_WG16_8_1_WGM4
    SolutionIndex: 19
    SolutionNameMin: Cijk_Ailk_Bljk_HHS_BH_MT128x64x16_SN_SU32_SUM3_TT8_8_WG16_8_1_WGM4
    SolutionIndex: 20
    SolutionNameMin: Cijk_Ailk_Bljk_HHS_BH_MT128x128x16_SN_SU32_SUM3_TT8_16_WG16_8_1_WGM4
    SolutionIndex: 21
    SolutionNameMin: Cijk_Ailk_Bljk_HHS_BH_MT128x256x16_SN_SU32_SUM3_TT8_16_WG16_16_1_WGM4
    SolutionIndex: 22
    SolutionNameMin: Cijk_Ailk_Bljk_HHS_BH_MT128x64x8_SN_SU0_SUM0_TT8_8_WG16_8_1_WGM8
    SolutionIndex: 23
    SolutionNameMin: Cijk_Ailk_Bljk_HHS_BH_MT128x128x8_SN_SU0_SUM0_TT8_16_WG16_8_1_WGM8
    SolutionIndex: 24
    SolutionNameMin: Cijk_Ailk_Bljk_HHS_BH_MT128x64x16_SN_SU0_SUM0_TT8_8_WG16_8_1_WGM8
    SolutionIndex: 25
    SolutionNameMin: Cijk_Ailk_Bljk_HHS_BH_MT128x128x16_SN_SU0_SUM0_TT8_16_WG16_8_1_WGM8
    SolutionIndex: 26
    SolutionNameMin: Cijk_Ailk_Bljk_HHS_BH_MT128x128x16_SN_SU0_SUM0_TT8_8_WG16_16_1_WGM8
    SolutionIndex: 27
    SolutionNameMin: Cijk_Ailk_Bljk_HHS_BH_MT128x256x16_SN_SU0_SUM0_TT8_16_WG16_16_1_WGM8
    SolutionIndex: 28
    SolutionNameMin: Cijk_Ailk_Bljk_HHS_BH_MT128x64x8_SN_SU32_SUM3_TT8_8_WG16_8_1_WGM8
    SolutionIndex: 29
    SolutionNameMin: Cijk_Ailk_Bljk_HHS_BH_MT128x128x8_SN_SU32_SUM3_TT8_16_WG16_8_1_WGM8
    SolutionIndex: 30
    SolutionNameMin: Cijk_Ailk_Bljk_HHS_BH_MT128x128x16_SN_SU32_SUM3_TT8_16_WG16_8_1_WGM8
    SolutionIndex: 31
    SolutionNameMin: Cijk_Ailk_Bljk_HHS_BH_MT128x128x16_SN_SU32_SUM3_TT8_8_WG16_16_1_WGM8
    SolutionIndex: 32
    SolutionNameMin: Cijk_Ailk_Bljk_HHS_BH_MT128x256x16_SN_SU32_SUM3_TT8_16_WG16_16_1_WGM8
    SolutionIndex: 33
    SolutionNameMin: Cijk_Ailk_Bljk_HHS_BH_MT128x128x8_SN_SU0_SUM0_TT8_16_WG16_8_1_WGM1
    SolutionIndex: 34
    SolutionNameMin: Cijk_Ailk_Bljk_HHS_BH_MT128x64x16_SN_SU0_SUM0_TT8_8_WG16_8_1_WGM1
    SolutionIndex: 35
    SolutionNameMin: Cijk_Ailk_Bljk_HHS_BH_MT128x128x16_SN_SU0_SUM0_TT8_16_WG16_8_1_WGM1
    SolutionIndex: 36
    SolutionNameMin: Cijk_Ailk_Bljk_HHS_BH_MT128x256x16_SN_SU0_SUM0_TT8_16_WG16_16_1_WGM1
    SolutionIndex: 37
    SolutionNameMin: Cijk_Ailk_Bljk_HHS_BH_MT128x128x16_SN_SU32_SUM3_TT8_16_WG16_8_1_WGM1
    SolutionIndex: 38
    SolutionNameMin: Cijk_Ailk_Bljk_HHS_BH_MT128x128x8_SN_SU0_SUM0_TT8_16_WG16_8_1_WGM4
    SolutionIndex: 39
    SolutionNameMin: Cijk_Ailk_Bljk_HHS_BH_MT128x64x16_SN_SU0_SUM0_TT8_8_WG16_8_1_WGM4
    SolutionIndex: 40
    SolutionNameMin: Cijk_Ailk_Bljk_HHS_BH_MT128x256x16_SN_SU0_SUM0_TT8_16_WG16_16_1_WGM4
    SolutionIndex: 41
    SolutionNameMin: Cijk_Ailk_Bljk_HHS_BH_MT128x128x8_SN_SU0_SUM0_TT8_16_WG16_8_1_WGM8
    SolutionIndex: 42
    SolutionNameMin: Cijk_Ailk_Bljk_HHS_BH_MT128x256x16_SN_SU0_SUM0_TT8_16_WG16_16_1_WGM8
    SolutionIndex: 43
    SolutionNameMin: Cijk_Ailk_Bljk_HHS_BH_MT128x128x8_SN_SU32_SUM3_TT8_16_WG16_8_1_WGM8
    SolutionIndex: 44
    SolutionNameMin: Cijk_Ailk_Bljk_HHS_BH_MT64x64x8_SN_SU0_SUM0_TT8_8_WG8_8_1_WGM1
    SolutionIndex: 45
    SolutionNameMin: Cijk_Ailk_Bljk_HHS_BH_MT128x64x8_SN_SU0_SUM0_TT8_8_WG16_8_1_WGM1
    SolutionIndex: 46
    SolutionNameMin: Cijk_Ailk_Bljk_HHS_BH_MT64x64x16_SN_SU0_SUM0_TT8_8_WG8_8_1_WGM1
    SolutionIndex: 47
    SolutionNameMin: Cijk_Ailk_Bljk_HHS_BH_MT128x64x16_SN_SU0_SUM0_TT8_8_WG16_8_1_WGM1
    SolutionIndex: 48
    SolutionNameMin: Cijk_Ailk_Bljk_HHS_BH_MT128x128x16_SN_SU0_SUM0_TT8_8_WG16_16_1_WGM1
    SolutionIndex: 49
    SolutionNameMin: Cijk_Ailk_Bljk_HHS_BH_MT64x64x32_SN_SU0_SUM0_TT8_8_WG8_8_1_WGM1
    SolutionIndex: 50
    SolutionNameMin: Cijk_Ailk_Bljk_HHS_BH_MT128x64x32_SN_SU0_SUM0_TT8_8_WG16_8_1_WGM1
    SolutionIndex: 51
    SolutionNameMin: Cijk_Ailk_Bljk_HHS_BH_MT64x64x8_SN_SU32_SUM3_TT8_8_WG8_8_1_WGM1
    SolutionIndex: 52
    SolutionNameMin: Cijk_Ailk_Bljk_HHS_BH_MT128x64x8_SN_SU32_SUM3_TT8_8_WG16_8_1_WGM1
    SolutionIndex: 53
    SolutionNameMin: Cijk_Ailk_Bljk_HHS_BH_MT64x64x16_SN_SU32_SUM3_TT8_8_WG8_8_1_WGM1
    SolutionIndex: 54
    SolutionNameMin: Cijk_Ailk_Bljk_HHS_BH_MT128x64x16_SN_SU32_SUM3_TT8_8_WG16_8_1_WGM1
    SolutionIndex: 55
    SolutionNameMin: Cijk_Ailk_Bljk_HHS_BH_MT128x128x16_SN_SU32_SUM3_TT8_8_WG16_16_1_WGM1
    SolutionIndex: 56
    SolutionNameMin: Cijk_Ailk_Bljk_HHS_BH_MT64x64x32_SN_SU32_SUM3_TT8_8_WG8_8_1_WGM1
    SolutionIndex: 57
    SolutionNameMin: Cijk_Ailk_Bljk_HHS_BH_MT128x64x8_SN_SU0_SUM0_TT8_8_WG16_8_1_WGM4
    SolutionIndex: 58
    SolutionNameMin: Cijk_Ailk_Bljk_HHS_BH_MT64x64x16_SN_SU0_SUM0_TT8_8_WG8_8_1_WGM4
    SolutionIndex: 59
    SolutionNameMin: Cijk_Ailk_Bljk_HHS_BH_MT128x64x16_SN_SU0_SUM0_TT8_8_WG16_8_1_WGM4
    SolutionIndex: 60
    SolutionNameMin: Cijk_Ailk_Bljk_HHS_BH_MT128x128x16_SN_SU0_SUM0_TT8_8_WG16_16_1_WGM4
    SolutionIndex: 61
    SolutionNameMin: Cijk_Ailk_Bljk_HHS_BH_MT64x64x32_SN_SU0_SUM0_TT8_8_WG8_8_1_WGM4
    SolutionIndex: 62
    SolutionNameMin: Cijk_Ailk_Bljk_HHS_BH_MT128x64x8_SN_SU32_SUM3_TT8_8_WG16_8_1_WGM4
    SolutionIndex: 63
    SolutionNameMin: Cijk_Ailk_Bljk_HHS_BH_MT64x64x16_SN_SU32_SUM3_TT8_8_WG8_8_1_WGM4
    SolutionIndex: 64
    SolutionNameMin: Cijk_Ailk_Bljk_HHS_BH_MT128x64x16_SN_SU32_SUM3_TT8_8_WG16_8_1_WGM4
    SolutionIndex: 65
    SolutionNameMin: Cijk_Ailk_Bljk_HHS_BH_MT128x128x16_SN_SU32_SUM3_TT8_8_WG16_16_1_WGM4
    SolutionIndex: 66
    SolutionNameMin: Cijk_Ailk_Bljk_HHS_BH_MT64x64x32_SN_SU32_SUM3_TT8_8_WG8_8_1_WGM4
    SolutionIndex: 67
    SolutionNameMin: Cijk_Ailk_Bljk_HHS_BH_MT64x64x8_SN_SU0_SUM0_TT8_8_WG8_8_1_WGM8
    SolutionIndex: 68
    SolutionNameMin: Cijk_Ailk_Bljk_HHS_BH_MT128x64x8_SN_SU0_SUM0_TT8_8_WG16_8_1_WGM8
    SolutionIndex: 69
    SolutionNameMin: Cijk_Ailk_Bljk_HHS_BH_MT64x64x16_SN_SU0_SUM0_TT8_8_WG8_8_1_WGM8
    SolutionIndex: 70
    SolutionNameMin: Cijk_Ailk_Bljk_HHS_BH_MT128x64x16_SN_SU0_SUM0_TT8_8_WG16_8_1_WGM8
    SolutionIndex: 71
    SolutionNameMin: Cijk_Ailk_Bljk_HHS_BH_MT128x128x16_SN_SU0_SUM0_TT8_8_WG16_16_1_WGM8
    SolutionIndex: 72
    SolutionNameMin: Cijk_Ailk_Bljk_HHS_BH_MT64x64x32_SN_SU0_SUM0_TT8_8_WG8_8_1_WGM8
    SolutionIndex: 73
    SolutionNameMin: Cijk_Ailk_Bljk_HHS_BH_MT128x64x32_SN_SU0_SUM0_TT8_8_WG16_8_1_WGM8
    SolutionIndex: 74
    SolutionNameMin: Cijk_Ailk_Bljk_HHS_BH_MT64x64x8_SN_SU32_SUM3_TT8_8_WG8_8_1_WGM8
    SolutionIndex: 75
    SolutionNameMin: Cijk_Ailk_Bljk_HHS_BH_MT128x64x8_SN_SU32_SUM3_TT8_8_WG16_8_1_WGM8
    SolutionIndex: 76
    SolutionNameMin: Cijk_Ailk_Bljk_HHS_BH_MT64x64x16_SN_SU32_SUM3_TT8_8_WG8_8_1_WGM8
    SolutionIndex: 77
    SolutionNameMin: Cijk_Ailk_Bljk_HHS_BH_MT128x64x16_SN_SU32_SUM3_TT8_8_WG16_8_1_WGM8
    SolutionIndex: 78
    SolutionNameMin: Cijk_Ailk_Bljk_HHS_BH_MT128x128x16_SN_SU32_SUM3_TT8_8_WG16_16_1_WGM8
    SolutionIndex: 79
    SolutionNameMin: Cijk_Ailk_Bljk_HHS_BH_MT64x64x32_SN_SU32_SUM3_TT8_8_WG8_8_1_WGM8
    SolutionIndex: 80
    SolutionNameMin: Cijk_Ailk_Bljk_HHS_BH_MT128x64x16_SN_SU0_SUM0_TT8_8_WG16_8_1_WGM1
    SolutionIndex: 81
    SolutionNameMin: Cijk_Ailk_Bljk_HHS_BH_MT128x128x16_SN_SU0_SUM0_TT8_8_WG16_16_1_WGM1
    SolutionIndex: 82
    SolutionNameMin: Cijk_Ailk_Bljk_HHS_BH_MT128x64x16_SN_SU32_SUM3_TT8_8_WG16_8_1_WGM1
    SolutionIndex: 83
    SolutionNameMin: Cijk_Ailk_Bljk_HHS_BH_MT16x16x8_SN_SU0_SUM0_TT2_2_WG8_8_1_WGM1
    SolutionIndex: 84
    SolutionNameMin: Cijk_Ailk_Bljk_HHS_BH_MT32x16x8_SN_SU0_SUM0_TT2_2_WG16_8_1_WGM1
    SolutionIndex: 85
    SolutionNameMin: Cijk_Ailk_Bljk_HHS_BH_MT64x32x8_SN_SU0_SUM0_TT4_4_WG16_8_1_WGM1
    SolutionIndex: 86
    SolutionNameMin: Cijk_Ailk_Bljk_HHS_BH_MT32x32x8_SN_SU0_SUM0_TT2_2_WG16_16_1_WGM1
    SolutionIndex: 87
    SolutionNameMin: Cijk_Ailk_Bljk_HHS_BH_MT64x64x8_SN_SU0_SUM0_TT4_4_WG16_16_1_WGM1
    SolutionIndex: 88
    SolutionNameMin: Cijk_Ailk_Bljk_HHS_BH_MT16x16x16_SN_SU0_SUM0_TT2_2_WG8_8_1_WGM1
    SolutionIndex: 89
    SolutionNameMin: Cijk_Ailk_Bljk_HHS_BH_MT32x16x16_SN_SU0_SUM0_TT2_2_WG16_8_1_WGM1
    SolutionIndex: 90
    SolutionNameMin: Cijk_Ailk_Bljk_HHS_BH_MT64x32x16_SN_SU0_SUM0_TT4_4_WG16_8_1_WGM1
    SolutionIndex: 91
    SolutionNameMin: Cijk_Ailk_Bljk_HHS_BH_MT32x32x16_SN_SU0_SUM0_TT2_2_WG16_16_1_WGM1
    SolutionIndex: 92
    SolutionNameMin: Cijk_Ailk_Bljk_HHS_BH_MT16x16x32_SN_SU0_SUM0_TT2_2_WG8_8_1_WGM1
    SolutionIndex: 93
    SolutionNameMin: Cijk_Ailk_Bljk_HHS_BH_MT32x16x32_SN_SU0_SUM0_TT2_2_WG16_8_1_WGM1
    SolutionIndex: 94
    SolutionNameMin: Cijk_Ailk_Bljk_HHS_BH_MT64x32x32_SN_SU0_SUM0_TT4_4_WG16_8_1_WGM1
    SolutionIndex: 95
    SolutionNameMin: Cijk_Ailk_Bljk_HHS_BH_MT32x32x8_SN_SU32_SUM3_TT4_4_WG8_8_1_WGM1
    SolutionIndex: 96
    SolutionNameMin: Cijk_Ailk_Bljk_HHS_BH_MT32x16x8_SN_SU32_SUM3_TT2_2_WG16_8_1_WGM1
    SolutionIndex: 97
    SolutionNameMin: Cijk_Ailk_Bljk_HHS_BH_MT64x32x8_SN_SU32_SUM3_TT4_4_WG16_8_1_WGM1
    SolutionIndex: 98
    SolutionNameMin: Cijk_Ailk_Bljk_HHS_BH_MT64x64x8_SN_SU32_SUM3_TT4_4_WG16_16_1_WGM1
    SolutionIndex: 99
    SolutionNameMin: Cijk_Ailk_Bljk_HHS_BH_MT16x16x16_SN_SU32_SUM3_TT2_2_WG8_8_1_WGM1
    SolutionIndex: 100
    SolutionNameMin: Cijk_Ailk_Bljk_HHS_BH_MT32x32x16_SN_SU32_SUM3_TT4_4_WG8_8_1_WGM1
    SolutionIndex: 101
    SolutionNameMin: Cijk_Ailk_Bljk_HHS_BH_MT32x16x16_SN_SU32_SUM3_TT2_2_WG16_8_1_WGM1
    SolutionIndex: 102
    SolutionNameMin: Cijk_Ailk_Bljk_HHS_BH_MT64x32x16_SN_SU32_SUM3_TT4_4_WG16_8_1_WGM1
    SolutionIndex: 103
    SolutionNameMin: Cijk_Ailk_Bljk_HHS_BH_MT32x16x32_SN_SU32_SUM3_TT2_2_WG16_8_1_WGM1
    SolutionIndex: 104
    SolutionNameMin: Cijk_Ailk_Bljk_HHS_BH_MT64x32x8_SN_SU0_SUM0_TT4_4_WG16_8_1_WGM4
    SolutionIndex: 105
    SolutionNameMin: Cijk_Ailk_Bljk_HHS_BH_MT32x32x8_SN_SU0_SUM0_TT2_2_WG16_16_1_WGM4
    SolutionIndex: 106
    SolutionNameMin: Cijk_Ailk_Bljk_HHS_BH_MT32x16x16_SN_SU0_SUM0_TT2_2_WG16_8_1_WGM4
    SolutionIndex: 107
    SolutionNameMin: Cijk_Ailk_Bljk_HHS_BH_MT64x32x16_SN_SU0_SUM0_TT4_4_WG16_8_1_WGM4
    SolutionIndex: 108
    SolutionNameMin: Cijk_Ailk_Bljk_HHS_BH_MT32x16x32_SN_SU0_SUM0_TT2_2_WG16_8_1_WGM4
    SolutionIndex: 109
    SolutionNameMin: Cijk_Ailk_Bljk_HHS_BH_MT64x32x8_SN_SU32_SUM3_TT4_4_WG16_8_1_WGM4
    SolutionIndex: 110
    SolutionNameMin: Cijk_Ailk_Bljk_HHS_BH_MT32x32x8_SN_SU32_SUM3_TT2_2_WG16_16_1_WGM4
    SolutionIndex: 111
    SolutionNameMin: Cijk_Ailk_Bljk_HHS_BH_MT16x16x16_SN_SU32_SUM3_TT2_2_WG8_8_1_WGM4
    SolutionIndex: 112
    SolutionNameMin: Cijk_Ailk_Bljk_HHS_BH_MT32x16x16_SN_SU32_SUM3_TT2_2_WG16_8_1_WGM4
    SolutionIndex: 113
    SolutionNameMin: Cijk_Ailk_Bljk_HHS_BH_MT64x32x16_SN_SU32_SUM3_TT4_4_WG16_8_1_WGM4
    SolutionIndex: 114
    SolutionNameMin: Cijk_Ailk_Bljk_HHS_BH_MT32x16x32_SN_SU32_SUM3_TT2_2_WG16_8_1_WGM4
    SolutionIndex: 115
    SolutionNameMin: Cijk_Ailk_Bljk_HHS_BH_MT32x32x8_SN_SU0_SUM0_TT4_4_WG8_8_1_WGM8
    SolutionIndex: 116
    SolutionNameMin: Cijk_Ailk_Bljk_HHS_BH_MT64x32x8_SN_SU0_SUM0_TT4_4_WG16_8_1_WGM8
    SolutionIndex: 117
    SolutionNameMin: Cijk_Ailk_Bljk_HHS_BH_MT32x32x8_SN_SU0_SUM0_TT2_2_WG16_16_1_WGM8
    SolutionIndex: 118
    SolutionNameMin: Cijk_Ailk_Bljk_HHS_BH_MT16x16x16_SN_SU0_SUM0_TT2_2_WG8_8_1_WGM8
    SolutionIndex: 119
    SolutionNameMin: Cijk_Ailk_Bljk_HHS_BH_MT32x16x16_SN_SU0_SUM0_TT2_2_WG16_8_1_WGM8
    SolutionIndex: 120
    SolutionNameMin: Cijk_Ailk_Bljk_HHS_BH_MT64x32x16_SN_SU0_SUM0_TT4_4_WG16_8_1_WGM8
    SolutionIndex: 121
    SolutionNameMin: Cijk_Ailk_Bljk_HHS_BH_MT32x32x16_SN_SU0_SUM0_TT2_2_WG16_16_1_WGM8
    SolutionIndex: 122
    SolutionNameMin: Cijk_Ailk_Bljk_HHS_BH_MT32x16x32_SN_SU0_SUM0_TT2_2_WG16_8_1_WGM8
    SolutionIndex: 123
    SolutionNameMin: Cijk_Ailk_Bljk_HHS_BH_MT64x32x8_SN_SU32_SUM3_TT4_4_WG16_8_1_WGM8
    SolutionIndex: 124
    SolutionNameMin: Cijk_Ailk_Bljk_HHS_BH_MT32x32x8_SN_SU32_SUM3_TT2_2_WG16_16_1_WGM8
    SolutionIndex: 125
    SolutionNameMin: Cijk_Ailk_Bljk_HHS_BH_MT16x16x16_SN_SU32_SUM3_TT2_2_WG8_8_1_WGM8
    SolutionIndex: 126
    SolutionNameMin: Cijk_Ailk_Bljk_HHS_BH_MT32x16x16_SN_SU32_SUM3_TT2_2_WG16_8_1_WGM8
    SolutionIndex: 127
    SolutionNameMin: Cijk_Ailk_Bljk_HHS_BH_MT64x32x16_SN_SU32_SUM3_TT4_4_WG16_8_1_WGM8
    SolutionIndex: 128
    SolutionNameMin: Cijk_Ailk_Bljk_HHS_BH_MT32x16x32_SN_SU32_SUM3_TT2_2_WG16_8_1_WGM8
    SolutionIndex: 129
    SolutionNameMin: Cijk_Ailk_Bljk_HHS_BH_MT32x8x8_SN_SU0_SUM0_TT2_2_WG16_4_1_WGM1
    SolutionIndex: 130
    SolutionNameMin: Cijk_Ailk_Bljk_HHS_BH_MT64x8x8_SN_SU0_SUM0_TT4_2_WG16_4_1_WGM1
    SolutionIndex: 131
    SolutionNameMin: Cijk_Ailk_Bljk_HHS_BH_MT32x8x16_SN_SU0_SUM0_TT2_2_WG16_4_1_WGM1
    SolutionIndex: 132
    SolutionNameMin: Cijk_Ailk_Bljk_HHS_BH_MT64x16x16_SN_SU0_SUM0_TT4_2_WG16_8_1_WGM1
    SolutionIndex: 133
    SolutionNameMin: Cijk_Ailk_Bljk_HHS_BH_MT64x8x16_SN_SU0_SUM0_TT2_2_WG32_4_1_WGM1
    SolutionIndex: 134
    SolutionNameMin: Cijk_Ailk_Bljk_HHS_BH_MT128x8x16_SN_SU0_SUM0_TT4_2_WG32_4_1_WGM1
    SolutionIndex: 135
    SolutionNameMin: Cijk_Ailk_Bljk_HHS_BH_MT32x8x32_SN_SU0_SUM0_TT2_2_WG16_4_1_WGM1
    SolutionIndex: 136
    SolutionNameMin: Cijk_Ailk_Bljk_HHS_BH_MT64x8x32_SN_SU0_SUM0_TT4_2_WG16_4_1_WGM1
    SolutionIndex: 137
    SolutionNameMin: Cijk_Ailk_Bljk_HHS_BH_MT64x16x32_SN_SU0_SUM0_TT4_2_WG16_8_1_WGM1
    SolutionIndex: 138
    SolutionNameMin: Cijk_Ailk_Bljk_HHS_BH_MT64x8x32_SN_SU0_SUM0_TT2_2_WG32_4_1_WGM1
    SolutionIndex: 139
    SolutionNameMin: Cijk_Ailk_Bljk_HHS_BH_MT128x8x32_SN_SU0_SUM0_TT4_2_WG32_4_1_WGM1
    SolutionIndex: 140
    SolutionNameMin: Cijk_Ailk_Bljk_HHS_BH_MT64x8x8_SN_SU32_SUM3_TT4_2_WG16_4_1_WGM1
    SolutionIndex: 141
    SolutionNameMin: Cijk_Ailk_Bljk_HHS_BH_MT64x8x16_SN_SU32_SUM3_TT4_2_WG16_4_1_WGM1
    SolutionIndex: 142
    SolutionNameMin: Cijk_Ailk_Bljk_HHS_BH_MT64x16x16_SN_SU32_SUM3_TT4_2_WG16_8_1_WGM1
    SolutionIndex: 143
    SolutionNameMin: Cijk_Ailk_Bljk_HHS_BH_MT128x8x16_SN_SU32_SUM3_TT4_2_WG32_4_1_WGM1
    SolutionIndex: 144
    SolutionNameMin: Cijk_Ailk_Bljk_HHS_BH_MT64x8x32_SN_SU32_SUM3_TT2_2_WG32_4_1_WGM1
    SolutionIndex: 145
    SolutionNameMin: Cijk_Ailk_Bljk_HHS_BH_MT64x8x16_SN_SU0_SUM0_TT2_2_WG32_4_1_WGM4
    SolutionIndex: 146
    SolutionNameMin: Cijk_Ailk_Bljk_HHS_BH_MT128x8x16_SN_SU0_SUM0_TT4_2_WG32_4_1_WGM4
    SolutionIndex: 147
    SolutionNameMin: Cijk_Ailk_Bljk_HHS_BH_MT64x8x32_SN_SU0_SUM0_TT4_2_WG16_4_1_WGM4
    SolutionIndex: 148
    SolutionNameMin: Cijk_Ailk_Bljk_HHS_BH_MT64x8x32_SN_SU0_SUM0_TT2_2_WG32_4_1_WGM4
    SolutionIndex: 149
    SolutionNameMin: Cijk_Ailk_Bljk_HHS_BH_MT64x8x16_SN_SU32_SUM3_TT4_2_WG16_4_1_WGM4
    SolutionIndex: 150
    SolutionNameMin: Cijk_Ailk_Bljk_HHS_BH_MT64x8x8_SN_SU0_SUM0_TT4_2_WG16_4_1_WGM8
    SolutionIndex: 151
    SolutionNameMin: Cijk_Ailk_Bljk_HHS_BH_MT32x8x16_SN_SU0_SUM0_TT2_2_WG16_4_1_WGM8
    SolutionIndex: 152
    SolutionNameMin: Cijk_Ailk_Bljk_HHS_BH_MT64x8x32_SN_SU0_SUM0_TT4_2_WG16_4_1_WGM8
    SolutionIndex: 153
    SolutionNameMin: Cijk_Ailk_Bljk_HHS_BH_MT64x16x32_SN_SU0_SUM0_TT4_2_WG16_8_1_WGM8
    SolutionIndex: 154
    SolutionNameMin: Cijk_Ailk_Bljk_HHS_BH_MT64x8x32_SN_SU0_SUM0_TT2_2_WG32_4_1_WGM8
    SolutionIndex: 155
    SolutionNameMin: Cijk_Ailk_Bljk_HHS_BH_MT32x16x32_SN_SU32_SUM3_TT2_2_WG16_8_1_WGM1
    SolutionIndex: 156
    SolutionNameMin: Cijk_Ailk_Bljk_HHS_BH_MT32x16x32_SN_SU0_SUM0_TT2_2_WG16_8_1_WGM4
    SolutionIndex: 157
    SolutionNameMin: Cijk_Ailk_Bljk_HHS_BH_MT32x16x32_SN_SU32_SUM3_TT2_2_WG16_8_1_WGM4
    SolutionIndex: 158
    SolutionNameMin: Cijk_Ailk_Bljk_HHS_BH_MT32x16x32_SN_SU0_SUM0_TT2_2_WG16_8_1_WGM8
    SolutionIndex: 159
    SolutionNameMin: Cijk_Ailk_Bljk_HHS_BH_MT64x32x16_SN_SU32_SUM3_TT4_4_WG16_8_1_WGM8
    SolutionIndex: 160
    SolutionNameMin: Cijk_Ailk_Bljk_HHS_BH_MT32x16x32_SN_SU32_SUM3_TT2_2_WG16_8_1_WGM8
    SolutionIndex: 161
    SolutionNameMin: Cijk_Ailk_Bljk_HHS_BH_GB_MT128x64x8_SN_SU0_SUM0_SUS0_TT8_8_WG16_8_1_WGM8
    SolutionIndex: 162
    SolutionNameMin: Cijk_Ailk_Bljk_HHS_BH_GB_MT128x128x16_SN_SU0_SUM0_SUS0_TT8_8_WG16_16_1_WGM8
    SolutionIndex: 163
    SolutionNameMin: Cijk_Ailk_Bljk_HHS_BH_GB_MT128x128x16_SN_SU0_SUM0_SUS0_TT8_8_WG16_16_1_WGM1
    SolutionIndex: 164
    SolutionNameMin: Cijk_Ailk_Bljk_HHS_BH_GB_MT128x64x8_SN_SU32_SUM3_SUS128_TT8_8_WG16_8_1_WGM4
    SolutionIndex: 165
    SolutionNameMin: Cijk_Ailk_Bljk_HHS_BH_GB_MT128x64x8_SN_SU0_SUM0_SUS0_TT8_8_WG16_8_1_WGM1
    SolutionIndex: 166
    SolutionNameMin: Cijk_Ailk_Bljk_HHS_BH_GB_MT128x64x8_SN_SU32_SUM3_SUS128_TT8_8_WG16_8_1_WGM8
    SolutionIndex: 167
    SolutionNameMin: Cijk_Ailk_Bljk_HHS_BH_GB_MT128x128x16_SN_SU0_SUM0_SUS0_TT8_8_WG16_16_1_WGM4
    SolutionIndex: 168
    SolutionNameMin: Cijk_Ailk_Bljk_HHS_BH_GB_MT128x128x8_SN_SU0_SUM0_SUS0_TT8_16_WG16_8_1_WGM1
    SolutionIndex: 169
    SolutionNameMin: Cijk_Ailk_Bljk_HHS_BH_GB_MT128x64x8_SN_SU0_SUM0_SUS0_TT8_8_WG16_8_1_WGM4
    SolutionIndex: 170
    SolutionNameMin: Cijk_Ailk_Bljk_HHS_BH_GB_MT128x64x16_SN_SU0_SUM0_SUS0_TT8_8_WG16_8_1_WGM8
    SolutionIndex: 171
    SolutionNameMin: Cijk_Ailk_Bljk_HHS_BH_GB_MT128x64x8_SN_SU32_SUM3_SUS128_TT8_8_WG16_8_1_WGM1
    SolutionIndex: 172
    SolutionNameMin: Cijk_Ailk_Bljk_HHS_BH_GB_MT128x64x16_SN_SU0_SUM0_SUS0_TT8_8_WG16_8_1_WGM1
    SolutionIndex: 173
    SolutionNameMin: Cijk_Ailk_Bljk_HHS_BH_GB_MT128x64x16_SN_SU32_SUM3_SUS128_TT8_8_WG16_8_1_WGM1
    SolutionIndex: 174
    SolutionNameMin: Cijk_Ailk_Bljk_HHS_BH_GB_MT128x64x16_SN_SU32_SUM3_SUS128_TT8_8_WG16_8_1_WGM8
    SolutionIndex: 175
    SolutionNameMin: Cijk_Ailk_Bljk_HHS_BH_GB_MT128x64x16_SN_SU32_SUM3_SUS128_TT8_8_WG16_8_1_WGM4
    SolutionIndex: 176
    SolutionNameMin: Cijk_Ailk_Bljk_HHS_BH_GB_MT128x128x16_SN_SU0_SUM0_SUS0_TT8_16_WG16_8_1_WGM8
    SolutionIndex: 177
    SolutionNameMin: Cijk_Ailk_Bljk_HHS_BH_GB_MT128x256x16_SN_SU32_SUM3_SUS128_TT8_16_WG16_16_1_WGM4
    SolutionIndex: 178
    SolutionNameMin: Cijk_Ailk_Bljk_HHS_BH_GB_MT128x256x16_SN_SU0_SUM0_SUS0_TT8_16_WG16_16_1_WGM4
    SolutionIndex: 179
    SolutionNameMin: Cijk_Ailk_Bljk_HHS_BH_GB_MT128x64x16_SN_SU0_SUM0_SUS0_TT8_8_WG16_8_1_WGM4
    SolutionIndex: 180
    SolutionNameMin: Cijk_Ailk_Bljk_HHS_BH_GB_MT128x128x16_SN_SU32_SUM3_SUS128_TT8_8_WG16_16_1_WGM8
    SolutionIndex: 181
    SolutionNameMin: Cijk_Ailk_Bljk_HHS_BH_GB_MT128x128x16_SN_SU32_SUM3_SUS128_TT8_16_WG16_8_1_WGM4
    SolutionIndex: 182
    SolutionNameMin: Cijk_Ailk_Bljk_HHS_BH_GB_MT128x256x16_SN_SU32_SUM3_SUS128_TT8_16_WG16_16_1_WGM1
    SolutionIndex: 183
    SolutionNameMin: Cijk_Ailk_Bljk_HHS_BH_GB_MT128x256x16_SN_SU32_SUM3_SUS128_TT8_16_WG16_16_1_WGM8
    SolutionIndex: 184
    SolutionNameMin: Cijk_Ailk_Bljk_HHS_BH_GB_MT128x128x16_SN_SU32_SUM3_SUS128_TT8_8_WG16_16_1_WGM4
    SolutionIndex: 185
    SolutionNameMin: Cijk_Ailk_Bljk_HHS_BH_GB_MT128x128x16_SN_SU32_SUM3_SUS128_TT8_8_WG16_16_1_WGM1
    SolutionIndex: 186
    SolutionNameMin: Cijk_Ailk_Bljk_HHS_BH_GB_MT128x64x32_SN_SU0_SUM0_SUS0_TT8_8_WG16_8_1_WGM8
    SolutionIndex: 187
    SolutionNameMin: Cijk_Ailk_Bljk_HHS_BH_GB_MT128x128x8_SN_SU32_SUM3_SUS128_TT8_16_WG16_8_1_WGM4
    SolutionIndex: 188
    SolutionNameMin: Cijk_Ailk_Bljk_HHS_BH_GB_MT128x128x16_SN_SU0_SUM0_SUS0_TT8_16_WG16_8_1_WGM1
    SolutionIndex: 189
    SolutionNameMin: Cijk_Ailk_Bljk_HHS_BH_GB_MT128x128x32_SN_SU0_SUM0_SUS0_TT8_8_WG16_16_1_WGM4
    SolutionIndex: 190
    SolutionNameMin: Cijk_Ailk_Bljk_HHS_BH_GB_MT128x128x16_SN_SU0_SUM0_SUS0_TT8_16_WG16_8_1_WGM4
    SolutionIndex: 191
    SolutionNameMin: Cijk_Ailk_Bljk_HHS_BH_GB_MT128x128x16_SN_SU32_SUM3_SUS128_TT8_16_WG16_8_1_WGM1
    SolutionIndex: 192
    SolutionNameMin: Cijk_Ailk_Bljk_HHS_BH_GB_MT128x128x16_SN_SU32_SUM3_SUS128_TT8_16_WG16_8_1_WGM8
- - - [2944, 4288, 1, 1280]
    - [5, 84.134]
  - - [2368, 5888, 1, 256]
    - [20, 79.427]
  - - [5888, 1856, 1, 3328]
    - [25, 82.002]
  - - [5888, 2944, 1, 3328]
    - [25, 87.153]
  - - [1856, 4288, 1, 256]
    - [25, 73.148]
  - - [5056, 5056, 1, 3328]
    - [15, 84.387]
  - - [1408, 5888, 1, 1280]
    - [10, 82.694]
  - - [1024, 3584, 1, 3328]
    - [20, 76.526]
  - - [448, 3584, 1, 3328]
    - [11, 57.716]
  - - [5888, 1408, 1, 1280]
    - [10, 82.796]
  - - [1024, 2368, 1, 256]
    - [2, 60.501]
  - - [5056, 6784, 1, 1280]
    - [3, 86.036]
  - - [5056, 5056, 1, 1280]
    - [15, 83.886]
  - - [4288, 6784, 1, 256]
    - [3, 83.263]
  - - [6784, 448, 1, 256]
    - [2, 63.168]
  - - [5056, 256, 1, 1280]
    - [2, 57.812]
  - - [5888, 704, 1, 1280]
    - [25, 73.266]
  - - [3584, 1024, 1, 256]
    - [25, 70.838]
  - - [6784, 4288, 1, 3328]
    - [25, 86.222]
  - - [1856, 2368, 1, 3328]
    - [3, 78.535]
  - - [5888, 2944, 1, 1280]
    - [15, 86.581]
  - - [5888, 1024, 1, 256]
    - [3, 76.833]
  - - [1408, 2944, 1, 256]
    - [25, 71.472]
  - - [6784, 5056, 1, 3328]
    - [5, 86.779]
  - - [5056, 5056, 1, 256]
    - [3, 80.394]
  - - [1024, 3584, 1, 1280]
    - [25, 75.687]
  - - [2368, 2944, 1, 1280]
    - [25, 78.776]
  - - [6784, 6784, 1, 1280]
    - [25, 87.411]
  - - [1408, 4288, 1, 1280]
    - [15, 78.631]
  - - [3584, 4288, 1, 1280]
    - [15, 83.497]
  - - [2368, 704, 1, 1280]
    - [2, 63.932]
  - - [5056, 4288, 1, 3328]
    - [17, 85.863]
  - - [3584, 2368, 1, 3328]
    - [15, 82.552]
  - - [5888, 6784, 1, 1280]
    - [20, 87.568]
  - - [6784, 448, 1, 1280]
    - [20, 70.243]
  - - [2944, 5888, 1, 256]
    - [15, 83.7]
  - - [4288, 2944, 1, 256]
    - [10, 80.02]
  - - [5056, 2368, 1, 1280]
    - [3, 81.043]
  - - [448, 3584, 1, 1280]
    - [5, 56.021]
  - - [6784, 5888, 1, 256]
    - [20, 85.188]
  - - [1024, 1408, 1, 256]
    - [2, 59.491]
  - - [2368, 2368, 1, 3328]
    - [30, 76.213]
  - - [5056, 704, 1, 3328]
    - [15, 72.507]
  - - [1408, 1856, 1, 256]
    - [2, 64.783]
  - - [5888, 1856, 1, 256]
    - [20, 77.378]
  - - [704, 5888, 1, 256]
    - [20, 65.912]
  - - [3584, 704, 1, 3328]
    - [15, 70.626]
  - - [1408, 1408, 1, 256]
    - [10, 63.014]
  - - [448, 4288, 1, 256]
    - [27, 54.849]
  - - [704, 2368, 1, 1280]
    - [5, 58.061]
  - - [1856, 2368, 1, 1280]
    - [3, 77.31]
  - - [1408, 1408, 1, 3328]
    - [27, 70.939]
  - - [1408, 1024, 1, 1280]
    - [24, 65.287]
  - - [704, 6784, 1, 256]
    - [30, 68.528]
  - - [6784, 704, 1, 256]
    - [15, 68.4]
  - - [5056, 704, 1, 256]
    - [15, 63.575]
  - - [1408, 3584, 1, 256]
    - [3, 76.124]
  - - [3584, 4288, 1, 3328]
    - [3, 84.045]
  - - [5888, 1856, 1, 1280]
    - [25, 81.431]
  - - [2368, 3584, 1, 1280]
    - [3, 81.932]
  - - [2944, 3584, 1, 3328]
    - [3, 85.802]
  - - [6784, 2944, 1, 256]
    - [10, 83.9]
  - - [1856, 2368, 1, 256]
    - [3, 69.599]
  - - [3584, 6784, 1, 3328]
    - [17, 87.705]
  - - [5056, 4288, 1, 1280]
    - [17, 85.195]
  - - [6784, 1856, 1, 3328]
    - [3, 82.581]
  - - [1408, 5056, 1, 1280]
    - [30, 80.773]
  - - [6784, 5888, 1, 3328]
    - [11, 87.886]
  - - [2368, 5056, 1, 1280]
    - [15, 80.77]
  - - [1024, 5056, 1, 1280]
    - [15, 81.255]
  - - [4288, 1024, 1, 256]
    - [5, 70.843]
  - - [2368, 1408, 1, 256]
    - [3, 67.88]
  - - [5888, 448, 1, 1280]
    - [9, 63.556]
  - - [704, 5888, 1, 3328]
    - [5, 76.162]
  - - [1024, 6784, 1, 1280]
    - [27, 84.168]
  - - [3584, 2944, 1, 1280]
    - [25, 85.241]
  - - [1408, 5056, 1, 3328]
    - [15, 81.506]
  - - [1856, 1856, 1, 3328]
    - [20, 71.513]
  - - [2368, 2368, 1, 256]
    - [20, 69.42]
  - - [4288, 4288, 1, 1280]
    - [30, 83.801]
  - - [5888, 1024, 1, 1280]
    - [3, 80.734]
  - - [704, 6784, 1, 3328]
    - [10, 76.336]
  - - [5888, 5888, 1, 3328]
    - [11, 87.681]
  - - [5056, 1024, 1, 1280]
    - [10, 81.105]
  - - [448, 5888, 1, 3328]
    - [5, 63.901]
  - - [1024, 2944, 1, 1280]
    - [3, 70.831]
  - - [5056, 5888, 1, 1280]
    - [17, 86.121]
  - - [448, 6784, 1, 256]
    - [3, 62.329]
  - - [3584, 5888, 1, 256]
    - [23, 84.631]
  - - [2944, 3584, 1, 256]
    - [3, 82.258]
  - - [6784, 1024, 1, 3328]
    - [3, 84.158]
  - - [6784, 2944, 1, 3328]
    - [3, 86.871]
  - - [6784, 2368, 1, 1280]
    - [25, 83.823]
  - - [4288, 3584, 1, 256]
    - [3, 81.318]
  - - [4288, 5888, 1, 1280]
    - [17, 86.246]
  - - [4288, 1856, 1, 1280]
    - [15, 78.381]
  - - [1856, 2944, 1, 3328]
    - [10, 78.921]
  - - [256, 6784, 1, 3328]
    - [16, 72.046]
  - - [5056, 1024, 1, 256]
    - [3, 75.948]
  - - [5056, 1856, 1, 3328]
    - [15, 80.758]
  - - [5056, 256, 1, 3328]
    - [14, 59.317]
  - - [1024, 5888, 1, 1280]
    - [3, 80.669]
  - - [5056, 3584, 1, 256]
    - [3, 81.718]
  - - [1856, 1024, 1, 1280]
    - [3, 65.835]
  - - [1856, 1856, 1, 1280]
    - [20, 69.982]
  - - [1856, 1024, 1, 3328]
    - [17, 68.311]
  - - [6784, 1024, 1, 256]
    - [3, 79.823]
  - - [5056, 5888, 1, 3328]
    - [17, 86.649]
  - - [1856, 1024, 1, 256]
    - [2, 56.402]
  - - [5056, 1408, 1, 3328]
    - [3, 81.45]
  - - [448, 5888, 1, 256]
    - [15, 54.936]
  - - [1408, 6784, 1, 3328]
    - [15, 84.245]
  - - [2944, 1408, 1, 3328]
    - [25, 76.423]
  - - [2944, 4288, 1, 3328]
    - [17, 85.168]
  - - [5056, 2944, 1, 256]
    - [10, 81.24]
  - - [2368, 1856, 1, 256]
    - [25, 69.741]
  - - [1408, 3584, 1, 3328]
    - [3, 80.951]
  - - [2368, 6784, 1, 256]
    - [3, 80.49]
  - - [4288, 2368, 1, 3328]
    - [25, 82.506]
  - - [704, 3584, 1, 1280]
    - [25, 69.319]
  - - [1408, 5888, 1, 3328]
    - [20, 83.406]
  - - [1856, 5056, 1, 256]
    - [20, 75.562]
  - - [6784, 6784, 1, 256]
    - [25, 85.163]
  - - [2368, 4288, 1, 1280]
    - [15, 81.571]
  - - [3584, 1856, 1, 1280]
    - [25, 79.854]
  - - [3584, 448, 1, 256]
    - [24, 57.224]
  - - [3584, 3584, 1, 1280]
    - [17, 87.293]
  - - [256, 6784, 1, 256]
    - [16, 64.195]
  - - [1856, 3584, 1, 3328]
    - [17, 82.603]
  - - [3584, 3584, 1, 256]
    - [23, 83.746]
  - - [6784, 4288, 1, 1280]
    - [10, 85.725]
  - - [3584, 5056, 1, 256]
    - [23, 82.357]
  - - [2944, 2368, 1, 1280]
    - [15, 79.053]
  - - [6784, 3584, 1, 256]
    - [25, 84.708]
  - - [1856, 1408, 1, 256]
    - [23, 62.963]
  - - [2944, 2944, 1, 3328]
    - [3, 84.423]
  - - [5056, 6784, 1, 256]
    - [3, 83.415]
  - - [1408, 4288, 1, 3328]
    - [3, 79.736]
  - - [6784, 256, 1, 1280]
    - [16, 71.222]
  - - [2368, 704, 1, 3328]
    - [14, 64.701]
  - - [3584, 6784, 1, 256]
    - [23, 84.918]
  - - [5056, 1856, 1, 256]
    - [20, 75.82]
  - - [704, 4288, 1, 256]
    - [3, 61.176]
  - - [1408, 6784, 1, 1280]
    - [25, 83.772]
  - - [5056, 2368, 1, 3328]
    - [3, 81.889]
  - - [2944, 4288, 1, 256]
    - [20, 79.191]
  - - [1408, 3584, 1, 1280]
    - [25, 80.406]
  - - [2368, 6784, 1, 3328]
    - [15, 84.445]
  - - [5056, 704, 1, 1280]
    - [20, 71.115]
  - - [1856, 4288, 1, 3328]
    - [15, 79.171]
  - - [1408, 5888, 1, 256]
    - [30, 79.022]
  - - [704, 2944, 1, 1280]
    - [17, 71.14]
  - - [3584, 704, 1, 1280]
    - [30, 68.818]
  - - [5888, 5056, 1, 256]
    - [23, 85.479]
  - - [3584, 448, 1, 3328]
    - [2, 62.748]
  - - [704, 2368, 1, 3328]
    - [17, 59.925]
  - - [448, 5056, 1, 3328]
    - [3, 63.679]
  - - [4288, 448, 1, 256]
    - [2, 57.065]
  - - [5888, 2368, 1, 256]
    - [23, 80.001]
  - - [6784, 704, 1, 3328]
    - [25, 76.215]
  - - [1408, 2944, 1, 3328]
    - [15, 76.391]
  - - [4288, 4288, 1, 256]
    - [20, 80.245]
  - - [2368, 704, 1, 256]
    - [9, 56.05]
  - - [3584, 2368, 1, 256]
    - [23, 77.199]
  - - [5888, 5056, 1, 1280]
    - [5, 86.145]
  - - [3584, 3584, 1, 3328]
    - [17, 88.151]
  - - [5888, 6784, 1, 256]
    - [23, 86.972]
  - - [4288, 2944, 1, 3328]
    - [3, 84.228]
  - - [256, 5056, 1, 1280]
    - [2, 58.782]
  - - [6784, 5888, 1, 1280]
    - [17, 87.512]
  - - [5888, 4288, 1, 1280]
    - [17, 86.063]
  - - [1408, 1856, 1, 1280]
    - [30, 71.962]
  - - [5888, 448, 1, 3328]
    - [19, 63.903]
  - - [704, 5888, 1, 1280]
    - [17, 74.564]
  - - [5056, 2944, 1, 3328]
    - [10, 84.505]
  - - [448, 4288, 1, 1280]
    - [27, 65.996]
  - - [3584, 704, 1, 256]
    - [2, 62.601]
  - - [3584, 1408, 1, 3328]
    - [20, 81.002]
  - - [2368, 1024, 1, 1280]
    - [10, 67.05]
  - - [2944, 6784, 1, 1280]
    - [25, 86.386]
  - - [1856, 6784, 1, 256]
    - [20, 78.144]
  - - [4288, 448, 1, 3328]
    - [27, 68.33]
  - - [6784, 704, 1, 1280]
    - [25, 75.292]
  - - [5888, 1024, 1, 3328]
    - [25, 81.445]
  - - [704, 6784, 1, 1280]
    - [25, 75.408]
  - - [5056, 1024, 1, 3328]
    - [3, 83.003]
  - - [704, 5056, 1, 1280]
    - [25, 71.125]
  - - [2944, 1856, 1, 256]
    - [25, 72.41]
  - - [5888, 5056, 1, 3328]
    - [5, 86.844]
  - - [3584, 6784, 1, 1280]
    - [3, 87.085]
  - - [1856, 5888, 1, 256]
    - [3, 77.573]
  - - [4288, 4288, 1, 3328]
    - [20, 84.305]
  - - [4288, 1408, 1, 1280]
    - [10, 80.507]
  - - [4288, 2368, 1, 256]
    - [30, 77.021]
  - - [2944, 5056, 1, 1280]
    - [5, 85.2]
  - - [6784, 2368, 1, 3328]
    - [25, 84.467]
  - - [4288, 1856, 1, 3328]
    - [3, 79.198]
  - - [1856, 2944, 1, 1280]
    - [3, 78.185]
  - - [4288, 6784, 1, 3328]
    - [3, 86.302]
  - - [3584, 1024, 1, 1280]
    - [15, 75.475]
  - - [1024, 4288, 1, 256]
    - [2, 67.964]
  - - [5888, 3584, 1, 3328]
    - [17, 88.257]
  - - [5056, 3584, 1, 3328]
    - [3, 85.619]
  - - [2368, 1408, 1, 1280]
    - [15, 77.013]
  - - [5056, 2944, 1, 1280]
    - [30, 83.736]
  - - [1024, 6784, 1, 256]
    - [3, 79.883]
  - - [2944, 5056, 1, 3328]
    - [5, 86.15]
  - - [3584, 2944, 1, 256]
    - [10, 82.113]
  - - [5056, 6784, 1, 3328]
    - [27, 86.548]
  - - [3584, 4288, 1, 256]
    - [23, 80.068]
  - - [1856, 6784, 1, 3328]
    - [3, 82.516]
  - - [5056, 1408, 1, 1280]
    - [3, 80.635]
  - - [5888, 5888, 1, 256]
    - [23, 86.388]
  - - [4288, 1024, 1, 1280]
    - [25, 77.211]
  - - [448, 6784, 1, 3328]
    - [17, 72.934]
  - - [2944, 1408, 1, 1280]
    - [3, 75.747]
  - - [2944, 1856, 1, 3328]
    - [25, 79.039]
  - - [448, 5056, 1, 256]
    - [2, 54.152]
  - - [3584, 5888, 1, 1280]
    - [17, 88.255]
  - - [6784, 1856, 1, 1280]
    - [10, 81.776]
  - - [5888, 256, 1, 3328]
    - [3, 68.415]
  - - [1856, 5888, 1, 3328]
    - [17, 82.222]
  - - [3584, 1408, 1, 256]
    - [3, 76.049]
  - - [704, 3584, 1, 3328]
    - [15, 70.855]
  - - [5056, 448, 1, 1280]
    - [2, 66.544]
  - - [3584, 1856, 1, 3328]
    - [30, 80.483]
  - - [2944, 1024, 1, 256]
    - [15, 67.277]
  - - [2368, 4288, 1, 3328]
    - [15, 82.451]
  - - [1024, 1408, 1, 1280]
    - [2, 65.249]
  - - [6784, 5056, 1, 256]
    - [10, 83.03]
  - - [4288, 5888, 1, 256]
    - [3, 82.444]
  - - [2944, 6784, 1, 256]
    - [25, 83.866]
  - - [2368, 2368, 1, 1280]
    - [10, 75.046]
  - - [1856, 3584, 1, 1280]
    - [17, 81.361]
  - - [3584, 1408, 1, 1280]
    - [15, 80.266]
  - - [5056, 3584, 1, 1280]
    - [15, 84.889]
  - - [256, 5888, 1, 256]
    - [3, 58.591]
  - - [1856, 1408, 1, 3328]
    - [3, 73.736]
  - - [1024, 4288, 1, 3328]
    - [17, 80.206]
  - - [2944, 2368, 1, 3328]
    - [3, 79.888]
  - - [704, 4288, 1, 3328]
    - [27, 72.767]
  - - [1024, 1856, 1, 1280]
    - [17, 65.91]
  - - [6784, 1856, 1, 256]
    - [3, 78.366]
  - - [1024, 5888, 1, 256]
    - [15, 76.77]
  - - [1408, 2368, 1, 256]
    - [20, 67.477]
  - - [2944, 704, 1, 3328]
    - [27, 73.913]
  - - [2944, 2944, 1, 1280]
    - [15, 83.861]
  - - [6784, 256, 1, 3328]
    - [16, 72.188]
  - - [1408, 5056, 1, 256]
    - [25, 75.608]
  - - [1408, 4288, 1, 256]
    - [25, 72.62]
  - - [5888, 2368, 1, 1280]
    - [15, 83.437]
  - - [2368, 5888, 1, 1280]
    - [15, 83.237]
  - - [5888, 256, 1, 1280]
    - [15, 66.823]
  - - [2368, 1856, 1, 3328]
    - [15, 78.627]
  - - [2944, 704, 1, 256]
    - [30, 60.923]
  - - [2368, 6784, 1, 1280]
    - [15, 83.927]
  - - [2368, 1024, 1, 3328]
    - [15, 69.01]
  - - [1856, 4288, 1, 1280]
    - [25, 78.352]
  - - [704, 3584, 1, 256]
    - [29, 60.043]
  - - [704, 2944, 1, 3328]
    - [5, 73.978]
  - - [1856, 5056, 1, 3328]
    - [25, 80.686]
  - - [3584, 5056, 1, 1280]
    - [25, 85.079]
  - - [2944, 1024, 1, 3328]
    - [25, 72.883]
  - - [1408, 6784, 1, 256]
    - [25, 80.329]
  - - [6784, 1408, 1, 3328]
    - [3, 84.315]
  - - [1024, 2368, 1, 1280]
    - [25, 67.327]
  - - [6784, 2944, 1, 1280]
    - [3, 86.391]
  - - [3584, 448, 1, 1280]
    - [14, 62.039]
  - - [2944, 6784, 1, 3328]
    - [3, 86.89]
  - - [448, 5056, 1, 1280]
    - [3, 62.165]
  - - [4288, 5056, 1, 1280]
    - [27, 85.385]
  - - [4288, 704, 1, 256]
    - [9, 61.581]
  - - [5888, 704, 1, 256]
    - [30, 67.086]
  - - [256, 5888, 1, 3328]
    - [10, 68.246]
  - - [6784, 4288, 1, 256]
    - [15, 83.01]
  - - [5888, 256, 1, 256]
    - [10, 58.666]
  - - [6784, 1024, 1, 1280]
    - [3, 83.538]
  - - [2944, 704, 1, 1280]
    - [17, 71.313]
  - - [6784, 3584, 1, 1280]
    - [10, 87.174]
  - - [1408, 2944, 1, 1280]
    - [3, 75.827]
  - - [1408, 2368, 1, 3328]
    - [3, 78.586]
  - - [2368, 2944, 1, 256]
    - [3, 75.338]
  - - [3584, 1856, 1, 256]
    - [15, 74.684]
  - - [4288, 3584, 1, 1280]
    - [3, 83.709]
  - - [4288, 2944, 1, 1280]
    - [3, 83.832]
  - - [5056, 448, 1, 3328]
    - [14, 67.103]
  - - [4288, 5056, 1, 3328]
    - [27, 86.35]
  - - [256, 5056, 1, 3328]
    - [2, 59.578]
  - - [5056, 2368, 1, 256]
    - [20, 77.339]
  - - [4288, 704, 1, 3328]
    - [3, 71.287]
  - - [448, 3584, 1, 256]
    - [2, 48.633]
  - - [1024, 1408, 1, 3328]
    - [24, 66.189]
  - - [2944, 5888, 1, 1280]
    - [15, 86.654]
  - - [5888, 3584, 1, 256]
    - [23, 86.335]
  - - [1408, 1856, 1, 3328]
    - [25, 73.611]
  - - [6784, 1408, 1, 1280]
    - [25, 83.791]
  - - [704, 2944, 1, 256]
    - [3, 61.273]
  - - [2944, 5888, 1, 3328]
    - [5, 87.488]
  - - [1408, 1408, 1, 1280]
    - [3, 68.719]
  - - [448, 4288, 1, 3328]
    - [17, 68.733]
  - - [704, 2368, 1, 256]
    - [19, 51.196]
  - - [5888, 2368, 1, 3328]
    - [15, 84.021]
  - - [4288, 5056, 1, 256]
    - [15, 80.804]
  - - [4288, 448, 1, 1280]
    - [17, 65.155]
  - - [5888, 704, 1, 3328]
    - [25, 74.489]
  - - [4288, 3584, 1, 3328]
    - [3, 85.667]
  - - [1024, 6784, 1, 3328]
    - [17, 85.848]
  - - [1408, 1024, 1, 256]
    - [2, 59.57]
  - - [6784, 6784, 1, 3328]
    - [3, 87.765]
  - - [704, 5056, 1, 3328]
    - [15, 72.345]
  - - [3584, 5056, 1, 3328]
    - [25, 85.453]
  - - [2368, 2944, 1, 3328]
    - [25, 79.7]
  - - [2368, 3584, 1, 256]
    - [10, 77.315]
  - - [3584, 2368, 1, 1280]
    - [25, 81.713]
  - - [1856, 1856, 1, 256]
    - [3, 62.319]
  - - [4288, 1408, 1, 3328]
    - [30, 80.908]
  - - [5888, 1408, 1, 3328]
    - [10, 83.406]
  - - [256, 5056, 1, 256]
    - [2, 53.986]
  - - [2368, 5056, 1, 256]
    - [10, 76.84]
  - - [1024, 5056, 1, 256]
    - [25, 73.98]
  - - [2368, 1408, 1, 3328]
    - [3, 78.605]
  - - [5888, 448, 1, 256]
    - [14, 60.306]
  - - [6784, 5056, 1, 1280]
    - [25, 86.2]
  - - [4288, 6784, 1, 1280]
    - [25, 85.841]
  - - [6784, 1408, 1, 256]
    - [10, 80.394]
  - - [5888, 4288, 1, 256]
    - [23, 83.656]
  - - [5056, 5888, 1, 256]
    - [3, 83.331]
  - - [2368, 1024, 1, 256]
    - [1, 59.209]
  - - [1856, 6784, 1, 1280]
    - [3, 82.007]
  - - [6784, 448, 1, 3328]
    - [30, 71.656]
  - - [5056, 1856, 1, 1280]
    - [15, 79.999]
  - - [1408, 1024, 1, 3328]
    - [2, 66.182]
  - - [5888, 3584, 1, 1280]
    - [5, 87.671]
  - - [1024, 2944, 1, 256]
    - [25, 67.228]
  - - [448, 6784, 1, 1280]
    - [17, 71.289]
  - - [704, 5056, 1, 256]
    - [25, 63.173]
  - - [3584, 1024, 1, 3328]
    - [3, 76.695]
  - - [2944, 1856, 1, 1280]
    - [30, 78.019]
  - - [5056, 256, 1, 256]
    - [2, 51.215]
  - - [2368, 3584, 1, 3328]
    - [3, 82.554]
  - - [3584, 5888, 1, 3328]
    - [17, 88.903]
  - - [2944, 3584, 1, 1280]
    - [15, 85.33]
  - - [1856, 5888, 1, 1280]
    - [3, 81.419]
  - - [4288, 1408, 1, 256]
    - [10, 73.565]
  - - [4288, 2368, 1, 1280]
    - [3, 81.72]
  - - [2944, 5056, 1, 256]
    - [20, 80.57]
  - - [6784, 2368, 1, 256]
    - [15, 80.177]
  - - [4288, 1856, 1, 256]
    - [15, 74.052]
  - - [1856, 2944, 1, 256]
    - [10, 71.733]
  - - [1856, 1408, 1, 1280]
    - [3, 72.234]
  - - [1024, 4288, 1, 1280]
    - [17, 77.546]
  - - [2368, 5056, 1, 3328]
    - [3, 81.872]
  - - [4288, 1024, 1, 3328]
    - [3, 79.092]
  - - [1024, 5056, 1, 3328]
    - [30, 82.825]
  - - [1024, 1856, 1, 3328]
    - [17, 68.232]
  - - [3584, 2944, 1, 3328]
    - [3, 85.846]
  - - [5888, 2944, 1, 256]
    - [20, 83.765]
  - - [5056, 4288, 1, 256]
    - [15, 80.657]
  - - [1024, 3584, 1, 256]
    - [3, 70.619]
  - - [5056, 1408, 1, 256]
    - [10, 77.175]
  - - [5888, 5888, 1, 1280]
    - [15, 87.382]
  - - [448, 5888, 1, 1280]
    - [17, 61.97]
  - - [4288, 704, 1, 1280]
    - [3, 69.842]
  - - [2944, 1408, 1, 256]
    - [25, 71.393]
  - - [2368, 5888, 1, 3328]
    - [20, 83.895]
  - - [2368, 1856, 1, 1280]
    - [15, 77.221]
  - - [5888, 4288, 1, 3328]
    - [17, 86.765]
  - - [5056, 448, 1, 256]
    - [2, 59.65]
  - - [1856, 5056, 1, 1280]
    - [15, 80.042]
  - - [2944, 1024, 1, 1280]
    - [3, 71.984]
  - - [2368, 4288, 1, 256]
    - [25, 77.001]
  - - [1024, 2368, 1, 3328]
    - [15, 69.302]
  - - [4288, 5888, 1, 3328]
    - [17, 86.965]
  - - [1024, 2944, 1, 3328]
    - [17, 72.972]
  - - [256, 6784, 1, 1280]
    - [26, 70.903]
  - - [1856, 3584, 1, 256]
    - [3, 74.549]
  - - [256, 5888, 1, 1280]
    - [3, 66.823]
  - - [2944, 2368, 1, 256]
    - [25, 73.16]
  - - [1024, 1856, 1, 256]
    - [2, 59.614]
  - - [6784, 3584, 1, 3328]
    - [5, 87.712]
  - - [1024, 5888, 1, 3328]
    - [3, 81.436]
  - - [1408, 2368, 1, 1280]
    - [3, 76.739]
  - - [2944, 2944, 1, 256]
    - [25, 80.744]
  - - [6784, 256, 1, 256]
    - [16, 64.894]
  - - [5888, 1408, 1, 256]
    - [23, 79.613]
  - - [5888, 6784, 1, 3328]
    - [20, 87.992]
  - - [704, 4288, 1, 1280]
    - [27, 70.17]
  - - [4096, 7000, 1, 4096]
    - [10, 86.753]
  - - [5124, 9124, 1, 1760]
    - [23, 90.251]
  - - [1024, 1500, 1, 1536]
    - [15, 65.466]
  - - [512, 24000, 1, 2048]
    - [30, 85.139]
  - - [3072, 24000, 1, 1024]
    - [10, 87.486]
  - - [1024, 3000, 1, 2560]
    - [17, 73.363]
  - - [512, 3136, 1, 2048]
    - [20, 70.293]
  - - [8448, 1500, 1, 2816]
    - [15, 84.496]
  - - [2560, 7000, 1, 2560]
    - [15, 85.323]
  - - [512, 48000, 1, 2048]
    - [20, 86.065]
  - - [196, 256, 64, 1024]
    - [10, 55.838]
  - - [512, 48000, 1, 1536]
    - [21, 86.186]
  - - [4608, 1500, 1, 1536]
    - [30, 82.205]
  - - [1024, 24000, 1, 2560]
    - [17, 87.546]
  - - [4608, 3000, 1, 1536]
    - [17, 84.869]
  - - [5124, 9124, 1, 2048]
    - [21, 84.915]
  - - [5124, 700, 1, 2560]
    - [15, 72.261]
  - - [6144, 6000, 1, 2560]
    - [25, 87.466]
  - - [1024, 1500, 1, 2816]
    - [30, 67.716]
  - - [8448, 48000, 1, 2816]
    - [21, 89.294]
  - - [512, 6000, 1, 2048]
    - [32, 72.591]
  - - [4224, 1500, 1, 176]
    - [23, 72.321]
  - - [1024, 6000, 1, 2816]
    - [25, 80.821]
  - - [1024, 48000, 1, 1536]
    - [15, 87.565]
  - - [1024, 48000, 1, 2560]
    - [17, 88.192]
  - - [4608, 24000, 1, 1536]
    - [17, 89.0]
  - - [7680, 48000, 1, 2560]
    - [5, 89.509]
  - - [3072, 48000, 1, 1024]
    - [15, 87.992]
  - - [1024, 1500, 1, 2048]
    - [30, 66.421]
  - - [1024, 3000, 1, 2048]
    - [32, 72.823]
  - - [1024, 6000, 1, 2048]
    - [30, 80.343]
  - - [512, 24000, 1, 2816]
    - [20, 85.371]
  - - [6144, 48000, 1, 2560]
    - [5, 89.226]
  - - [1760, 7000, 1, 1760]
    - [23, 87.056]
  - - [8448, 3000, 1, 2816]
    - [15, 85.212]
  - - [4608, 48000, 1, 1536]
    - [21, 89.026]
  - - [7680, 1500, 1, 2560]
    - [21, 84.341]
  - - [512, 3000, 1, 1536]
    - [30, 66.52]
  - - [1024, 3000, 1, 2816]
    - [27, 74.007]
  - - [5124, 9124, 1, 2560]
    - [17, 84.739]
  - - [512, 48000, 1, 2816]
    - [17, 87.905]
  - - [512, 3000, 1, 2816]
    - [30, 67.646]
  - - [1024, 24000, 1, 1536]
    - [21, 87.102]
  - - [7680, 6000, 1, 2560]
    - [3, 87.42]
  - - [512, 6000, 1, 2560]
    - [32, 73.035]
  - - [512, 24000, 1, 2560]
    - [30, 85.204]
  - - [6144, 3000, 1, 2560]
    - [17, 85.798]
  - - [1024, 24000, 1, 2816]
    - [17, 87.91]
  - - [2048, 7000, 1, 2048]
    - [20, 84.086]
  - - [7680, 3000, 1, 2560]
    - [17, 86.249]
  - - [5124, 700, 1, 2048]
    - [20, 72.126]
  - - [5124, 9124, 1, 4096]
    - [32, 84.751]
  - - [256, 193600, 1, 64]
    - [8, 76.591]
  - - [8448, 6000, 1, 2816]
    - [20, 87.382]
  - - [5124, 1500, 1, 2560]
    - [17, 80.466]
  - - [1024, 1500, 1, 2560]
    - [20, 67.928]
  - - [1024, 6000, 1, 2560]
    - [25, 80.625]
  - - [196, 1024, 64, 256]
    - [3, 60.853]
  - - [512, 50176, 1, 128]
    - [23, 85.812]
  - - [7680, 24000, 1, 2560]
    - [17, 89.253]
  - - [512, 3000, 1, 2560]
    - [25, 66.922]
  - - [8448, 24000, 1, 2816]
    - [5, 89.029]
  - - [512, 6000, 1, 1536]
    - [32, 71.603]
  - - [3072, 6000, 1, 1024]
    - [21, 85.197]
  - - [3072, 1500, 1, 128]
    - [24, 62.324]
  - - [2048, 3136, 1, 512]
    - [20, 75.948]
  - - [1024, 3000, 1, 1536]
    - [17, 72.692]
  - - [512, 6000, 1, 2816]
    - [17, 73.968]
  - - [128, 50176, 1, 512]
    - [20, 81.843]
  - - [256, 12544, 1, 1024]
    - [21, 75.788]
  - - [1024, 12544, 1, 256]
    - [23, 82.94]
  - - [512, 48000, 1, 2560]
    - [21, 87.141]
  - - [512, 24000, 1, 1536]
    - [10, 84.59]
  - - [1024, 24000, 1, 2048]
    - [21, 86.941]
  - - [5124, 1500, 1, 2048]
    - [21, 79.926]
  - - [3072, 1500, 1, 1024]
    - [25, 80.068]
  - - [6144, 1500, 1, 2560]
    - [25, 83.724]
  - - [1024, 48000, 1, 2816]
    - [17, 88.747]
  - - [1024, 6000, 1, 1536]
    - [20, 79.48]
  - - [512, 3000, 1, 2048]
    - [10, 67.351]
  - - [6144, 24000, 1, 2560]
    - [5, 88.964]
  - - [4608, 6000, 1, 1536]
    - [3, 86.514]
  - - [3072, 3000, 1, 1024]
    - [20, 82.752]
  - - [1024, 48000, 1, 2048]
    - [20, 86.625]
  - - [784, 512, 64, 128]
    - [1, 72.984]
  - - [3136, 256, 64, 64]
    - [8, 77.071]
  - - [12544, 1024, 1, 256]
    - [23, 84.476]
  - - [784, 128, 128, 512]
    - [10, 70.978]
  - - [784, 512, 256, 128]
    - [3, 68.019]
  - - [3136, 512, 1, 2048]
    - [10, 68.625]
  - - [12544, 256, 1, 1024]
    - [3, 75.084]
  - - [3136, 2048, 1, 512]
    - [3, 76.066]
  - - [3136, 256, 256, 64]
    - [0, 45.879]
  - - [784, 128, 64, 512]
    - [20, 68.154]
  - - [784, 512, 128, 128]
    - [1, 70.662]
  - - [784, 128, 256, 512]
    - [10, 67.33]
  - - [3136, 256, 128, 64]
    - [0, 57.791]
  - - [128, 128, 512, 64]
    - [7, 58.259]
  - - [512, 512, 64, 64]
    - [8, 72.039]
  - - [1024, 2048, 1, 2]
    - [22, 2.703]
  - - [1024, 2048, 1, 1024]
    - [177, 70.337]
  - - [1024, 2048, 1, 4096]
    - [182, 77.471]
  - - [1024, 2048, 1, 30528]
    - [5, 76.616]
  - - [1024, 4096, 1, 1024]
    - [181, 76.094]
  - - [1024, 4096, 1, 4096]
    - [177, 80.77]
  - - [1024, 4096, 1, 30528]
    - [5, 78.243]
  - - [4096, 2048, 1, 1024]
    - [191, 85.421]
  - - [4096, 4096, 1, 1024]
    - [10, 84.828]
  - - [256, 8976, 1, 1536]
    - [11, 76.992]
  - - [256, 8976, 1, 2048]
    - [11, 80.811]
  - - [256, 8976, 1, 2304]
    - [17, 81.178]
  - - [256, 8976, 1, 2560]
    - [32, 80.729]
  - - [256, 8976, 1, 2816]
    - [32, 81.407]
  - - [256, 8976, 1, 3072]
    - [21, 81.58]
  - - [256, 8976, 1, 4352]
    - [5, 82.494]
  - - [256, 8976, 1, 4864]
    - [27, 82.649]
  - - [256, 8976, 1, 5376]
    - [11, 82.434]
  - - [256, 8976, 1, 5632]
    - [11, 82.405]
  - - [256, 8976, 1, 5888]
    - [21, 82.538]
  - - [256, 8976, 1, 6144]
    - [32, 82.255]
  - - [256, 8976, 1, 6656]
    - [21, 82.419]
  - - [256, 8976, 1, 7168]
    - [32, 81.004]
  - - [256, 8976, 1, 7424]
    - [11, 81.776]
  - - [256, 8976, 1, 8192]
    - [10, 77.908]
  - - [256, 8976, 1, 8448]
    - [32, 81.269]
  - - [256, 8976, 1, 8960]
    - [21, 80.994]
  - - [256, 8976, 1, 9472]
    - [32, 81.243]
  - - [256, 8976, 1, 9728]
    - [32, 80.341]
  - - [256, 8976, 1, 9984]
    - [32, 81.084]
  - - [256, 8976, 1, 10240]
    - [20, 76.215]
  - - [256, 8976, 1, 10496]
    - [21, 81.074]
  - - [256, 8976, 1, 11008]
    - [32, 80.541]
  - - [256, 8976, 1, 11520]
    - [11, 80.657]
  - - [256, 8976, 1, 12288]
    - [30, 73.346]
  - - [256, 8976, 1, 14336]
    - [30, 73.57]
  - - [256, 8976, 1, 14848]
    - [30, 79.984]
  - - [256, 8976, 1, 15104]
    - [5, 80.97]
  - - [256, 8976, 1, 15872]
    - [20, 79.844]
  - - [256, 8976, 1, 17152]
    - [21, 80.65]
  - - [256, 8976, 1, 19712]
    - [11, 80.797]
  - - [256, 8976, 1, 19968]
    - [10, 80.177]
  - - [256, 8976, 1, 20480]
    - [20, 73.259]
  - - [256, 8976, 1, 20992]
    - [10, 79.958]
  - - [256, 8976, 1, 22016]
    - [10, 80.107]
  - - [256, 8976, 1, 26112]
    - [30, 79.376]
  - - [256, 8976, 1, 33536]
    - [20, 79.982]
  - - [256, 8976, 1, 44505]
    - [27, 83.49]
  - - [256, 32768, 1, 128]
    - [23, 76.418]
  - - [480, 32768, 1, 1024]
    - [30, 78.933]
  - - [512, 32768, 1, 256]
    - [25, 82.441]
  - - [1024, 1600, 1, 1]
    - [22, 1.189]
  - - [1024, 1600, 1, 1024]
    - [30, 68.591]
  - - [1024, 1792, 1, 256]
    - [17, 58.75]
  - - [1024, 2048, 1, 256]
    - [17, 66.319]
  - - [1024, 2560, 1, 256]
    - [25, 67.144]
  - - [1024, 3072, 1, 256]
    - [3, 69.348]
  - - [1024, 3328, 1, 256]
    - [15, 73.761]
  - - [1024, 3840, 1, 256]
    - [25, 74.638]
  - - [1024, 4096, 1, 256]
    - [25, 71.012]
  - - [1024, 4608, 1, 256]
    - [17, 79.063]
  - - [1024, 4864, 1, 256]
    - [3, 75.171]
  - - [1024, 5120, 1, 256]
    - [3, 78.438]
  - - [1024, 5632, 1, 256]
    - [25, 78.586]
  - - [1024, 6144, 1, 256]
    - [25, 78.424]
  - - [1024, 6400, 1, 256]
    - [3, 76.997]
  - - [1024, 7168, 1, 256]
    - [3, 78.308]
  - - [1024, 7424, 1, 256]
    - [3, 80.712]
  - - [1024, 7680, 1, 256]
    - [23, 79.27]
  - - [1024, 7936, 1, 256]
    - [3, 80.493]
  - - [1024, 8192, 1, 256]
    - [23, 78.648]
  - - [1024, 8448, 1, 256]
    - [3, 80.179]
  - - [1024, 8704, 1, 256]
    - [15, 79.574]
  - - [1024, 8960, 1, 256]
    - [23, 80.38]
  - - [1024, 9728, 1, 256]
    - [3, 82.031]
  - - [1024, 9984, 1, 256]
    - [23, 80.271]
  - - [1024, 10240, 1, 256]
    - [23, 81.624]
  - - [1024, 10496, 1, 256]
    - [23, 81.047]
  - - [1024, 11008, 1, 256]
    - [15, 81.192]
  - - [1024, 11264, 1, 256]
    - [23, 82.084]
  - - [1024, 11520, 1, 256]
    - [17, 83.068]
  - - [1024, 12288, 1, 256]
    - [23, 82.386]
  - - [1024, 13312, 1, 256]
    - [23, 82.591]
  - - [1024, 13568, 1, 256]
    - [23, 82.306]
  - - [1024, 14336, 1, 256]
    - [15, 83.119]
  - - [1024, 14592, 1, 256]
    - [23, 83.184]
  - - [1024, 14848, 1, 256]
    - [23, 83.813]
  - - [1024, 15104, 1, 256]
    - [23, 82.774]
  - - [1024, 16128, 1, 256]
    - [17, 84.141]
  - - [1024, 17152, 1, 256]
    - [17, 83.577]
  - - [1024, 18944, 1, 256]
    - [23, 84.457]
  - - [1024, 19712, 1, 256]
    - [23, 84.91]
  - - [1024, 19968, 1, 256]
    - [23, 84.778]
  - - [1024, 20480, 1, 256]
    - [23, 85.077]
  - - [1024, 20992, 1, 256]
    - [23, 84.527]
  - - [1024, 21504, 1, 256]
    - [23, 85.219]
  - - [1024, 22016, 1, 256]
    - [23, 84.949]
  - - [1024, 23552, 1, 256]
    - [23, 85.217]
  - - [1024, 28672, 1, 256]
    - [23, 85.585]
  - - [1024, 32768, 1, 512]
    - [25, 86.07]
  - - [1024, 32768, 1, 1024]
    - [20, 86.639]
  - - [1024, 33536, 1, 256]
    - [23, 85.863]
  - - [1024, 40448, 1, 256]
    - [23, 86.644]
  - - [2048, 960, 1, 2048]
    - [27, 68.936]
  - - [2048, 1024, 1, 1]
    - [16, 1.374]
  - - [2048, 1024, 1, 256]
    - [3, 65.914]
  - - [3200, 1024, 1, 2048]
    - [30, 77.079]
  - - [4096, 1024, 1, 1]
    - [22, 1.56]
  - - [1024, 3840, 1, 1024]
    - [20, 78.846]
  - - [1024, 3840, 1, 4096]
    - [20, 80.302]
  - - [1024, 3968, 1, 1024]
    - [30, 81.421]
  - - [1024, 3968, 1, 4096]
    - [20, 82.948]
  - - [1024, 3968, 1, 42720]
    - [8, 84.664]
  - - [1024, 6528, 1, 1024]
    - [10, 79.627]
  - - [1024, 6528, 1, 4096]
    - [21, 82.697]
  - - [1024, 6528, 1, 42720]
    - [23, 84.903]
  - - [1024, 7104, 1, 1024]
    - [10, 79.266]
  - - [1024, 7104, 1, 4096]
    - [20, 81.293]
  - - [1024, 7104, 1, 42720]
    - [13, 85.571]
  - - [1024, 7200, 1, 1024]
    - [30, 79.169]
  - - [1024, 7200, 1, 4096]
    - [20, 82.554]
  - - [1024, 7200, 1, 42720]
    - [13, 86.263]
  - - [1024, 8064, 1, 1024]
    - [10, 84.286]
  - - [1024, 8064, 1, 4096]
    - [20, 85.918]
  - - [1024, 8160, 1, 1024]
    - [30, 80.396]
  - - [1024, 8160, 1, 4096]
    - [10, 81.233]
  - - [1024, 9216, 1, 1024]
    - [21, 86.244]
  - - [1024, 9216, 1, 4096]
    - [21, 88.272]
  - - [1024, 9520, 1, 1024]
    - [30, 82.54]
  - - [1024, 9520, 1, 4096]
    - [20, 83.97]
  - - [1024, 9520, 1, 42720]
    - [23, 87.994]
  - - [1024, 10064, 1, 1024]
    - [21, 83.357]
  - - [1024, 10064, 1, 4096]
    - [21, 85.831]
  - - [1024, 10080, 1, 1024]
    - [21, 83.666]
  - - [1024, 10080, 1, 4096]
    - [21, 85.904]
  - - [1024, 10080, 1, 42720]
    - [13, 88.491]
  - - [1024, 10200, 1, 1024]
    - [21, 83.695]
  - - [1024, 10200, 1, 4096]
    - [21, 86.753]
  - - [4096, 3840, 1, 1024]
    - [25, 84.84]
  - - [4096, 3968, 1, 1024]
    - [20, 84.896]
  - - [4096, 6528, 1, 1024]
    - [10, 85.675]
  - - [4096, 7104, 1, 1024]
    - [15, 85.525]
  - - [4096, 7200, 1, 1024]
    - [20, 85.012]
  - - [4096, 8064, 1, 1024]
    - [10, 86.808]
  - - [4096, 8160, 1, 1024]
    - [20, 86.159]
  - - [4096, 9216, 1, 1024]
    - [17, 87.367]
  - - [4096, 9520, 1, 1024]
    - [15, 85.831]
  - - [4096, 10064, 1, 1024]
    - [15, 86.56]
  - - [4096, 10080, 1, 1024]
    - [20, 86.516]
  - - [4096, 10200, 1, 1024]
    - [20, 86.654]
  - - [1024, 3240, 1, 1024]
    - [20, 75.612]
  - - [1024, 3240, 1, 4096]
    - [21, 79.48]
  - - [1024, 3960, 1, 1024]
    - [30, 79.767]
  - - [1024, 3960, 1, 4096]
    - [20, 82.487]
  - - [1024, 3960, 1, 42720]
    - [1, 84.688]
  - - [4096, 3240, 1, 1024]
    - [20, 81.911]
  - - [4096, 3960, 1, 1024]
    - [20, 84.553]
  - - [289, 128, 64, 768]
    - [15, 53.479]
  - - [289, 160, 64, 768]
    - [2, 43.827]
  - - [289, 192, 64, 768]
    - [2, 52.561]
  - - [3136, 256, 32, 64]
    - [8, 76.21]
  - - [784, 512, 32, 128]
    - [1, 68.972]
  - - [784, 128, 32, 512]
    - [30, 61.83]
  - - [196, 1024, 32, 256]
    - [3, 57.34]
  - - [3136, 128, 64, 64]
    - [29, 75.687]
  - - [3136, 256, 64, 128]
    - [1, 76.037]
  - - [784, 512, 64, 256]
    - [15, 72.254]
  - - [3136, 128, 64, 256]
    - [10, 76.358]
  - - [3136, 256, 64, 256]
    - [3, 81.674]
  - - [196, 1024, 64, 512]
    - [30, 62.69]
  - - [784, 256, 64, 512]
    - [30, 72.258]
  - - [784, 512, 64, 512]
    - [27, 74.293]
  - - [196, 512, 64, 1024]
    - [10, 60.954]
  - - [196, 1024, 64, 1024]
    - [30, 62.536]
  - - [3136, 128, 32, 64]
    - [29, 66.696]
  - - [3136, 256, 32, 128]
    - [1, 82.422]
  - - [784, 512, 32, 256]
    - [15, 71.369]
  - - [3136, 128, 32, 256]
    - [10, 77.857]
  - - [3136, 256, 32, 256]
    - [3, 81.24]
  - - [196, 1024, 32, 512]
    - [10, 59.814]
  - - [784, 256, 32, 512]
    - [20, 68.948]
  - - [784, 512, 32, 512]
    - [20, 73.322]
  - - [196, 512, 32, 1024]
    - [10, 56.855]
  - - [196, 1024, 32, 1024]
    - [20, 61.285]
  - - [7680, 8192, 1, 8192]
    - [21, 88.325]
  - - [3840, 4096, 1, 4096]
    - [30, 85.95]
  - - [1920, 2048, 1, 2048]
    - [30, 79.757]
  - - [8192, 7680, 1, 8192]
    - [5, 87.838]
  - - [4096, 3840, 1, 4096]
    - [10, 85.93]
  - - [2048, 1920, 1, 2048]
    - [20, 79.806]
  - - [8192, 8192, 1, 8192]
    - [11, 88.127]
  - - [4096, 4096, 1, 4096]
    - [10, 85.525]
  - - [2048, 2048, 1, 2048]
    - [11, 76.43]
  - - [1024, 4096, 1, 2]
    - [22, 3.359]
  - - [4096, 512, 1, 1024]
    - [177, 69.975]
  - - [1024, 1280, 1, 2]
    - [16, 2.04]
  - - [1024, 1280, 1, 1024]
    - [24, 58.972]
  - - [1024, 1280, 1, 4096]
    - [9, 60.323]
  - - [4096, 1024, 1, 1024]
    - [191, 76.139]
  - - [4096, 1280, 1, 1024]
    - [10, 82.35]
  - - [1024, 4992, 1, 2]
    - [28, 3.964]
  - - [1024, 4992, 1, 1024]
    - [20, 80.609]
  - - [1024, 4992, 1, 4096]
    - [20, 82.038]
  - - [4096, 4992, 1, 1024]
    - [20, 85.733]
  - - [1024, 5120, 1, 2]
    - [22, 3.926]
  - - [1024, 5120, 1, 1024]
    - [20, 82.718]
  - - [1024, 5120, 1, 4096]
    - [30, 83.989]
  - - [4096, 5120, 1, 1024]
    - [10, 85.472]
  - - [1024, 5248, 1, 2]
    - [22, 4.012]
  - - [1024, 5248, 1, 1024]
    - [30, 78.34]
  - - [1024, 5248, 1, 4096]
    - [30, 79.497]
  - - [4096, 5248, 1, 1024]
    - [3, 85.441]
  - - [1024, 2560, 1, 2]
    - [22, 3.274]
  - - [1024, 2560, 1, 1024]
    - [20, 72.256]
  - - [1024, 2560, 1, 4096]
    - [10, 73.978]
  - - [4096, 2560, 1, 1024]
    - [17, 84.86]
  - - [1024, 3072, 1, 2]
    - [22, 3.328]
  - - [1024, 3072, 1, 1024]
    - [181, 73.042]
  - - [1024, 3072, 1, 4096]
    - [177, 79.424]
  - - [4096, 3072, 1, 1024]
    - [188, 88.743]
  - - [1024, 1152, 1, 2]
    - [16, 1.91]
  - - [1024, 1152, 1, 1024]
    - [20, 71.354]
  - - [1024, 1152, 1, 4096]
    - [20, 75.557]
  - - [4096, 1152, 1, 1024]
    - [20, 83.16]
  - - [479, 32768, 1, 1024]
    - [30, 78.566]
  - - [1024, 8192, 1, 1024]
    - [30, 81.016]
  - - [1024, 8192, 1, 4096]
    - [30, 82.079]
  - - [1024, 8192, 1, 33712]
    - [13, 86.331]
  - - [1024, 9600, 1, 1024]
    - [10, 83.353]
  - - [1024, 9600, 1, 4096]
    - [10, 84.662]
  - - [1024, 9600, 1, 33712]
    - [13, 89.164]
  - - [4096, 8192, 1, 1024]
    - [10, 86.683]
  - - [4096, 9600, 1, 1024]
    - [10, 86.69]
  - - [1024, 1024, 64, 64]
    - [1, 72.128]
  - - [1024, 16384, 1, 3072]
    - [20, 85.38]
  - - [1024, 2048, 1, 30592]
    - [17, 76.637]
  - - [640, 2048, 1, 2560]
    - [24, 59.843]
  - - [1024, 1024, 64, 96]
    - [1, 79.258]
  - - [1536, 4096, 1, 4608]
    - [30, 82.989]
  - - [512, 512, 256, 64]
    - [0, 59.334]
  - - [2048, 1024, 1, 8192]
    - [11, 75.711]
  - - [4096, 16384, 1, 1024]
    - [5, 87.22]
  - - [1024, 8192, 1, 50304]
    - [25, 82.231]
  - - [1536, 8192, 1, 50304]
    - [17, 86.726]
  - - [6144, 8192, 1, 1536]
    - [11, 87.823]
  - - [1024, 4096, 1, 30592]
    - [17, 78.055]
  - - [1536, 4096, 1, 6144]
    - [30, 82.986]
  - - [1024, 16384, 1, 4096]
    - [20, 85.397]
  - - [1024, 16384, 1, 50304]
    - [25, 85.641]
  - - [1024, 4096, 1, 3072]
    - [21, 76.854]
  - - [1536, 8192, 1, 1536]
    - [21, 85.354]
  - - [1024, 2048, 1, 3072]
    - [21, 75.309]
  - - [2560, 2048, 1, 7680]
    - [30, 84.264]
  - - [2048, 1024, 1, 2048]
    - [11, 74.144]
  - - [2048, 1024, 1, 30592]
    - [17, 76.603]
  - - [8192, 1024, 1, 2048]
    - [3, 81.332]
  - - [2560, 2048, 1, 2560]
    - [3, 83.77]
  - - [1536, 8192, 1, 4608]
    - [32, 86.297]
  - - [1024, 2048, 1, 50304]
    - [5, 76.642]
  - - [1024, 1024, 32, 64]
    - [23, 79.396]
  - - [1536, 8192, 1, 6144]
    - [32, 86.193]
  - - [1024, 1024, 256, 64]
    - [0, 57.709]
  - - [512, 512, 40, 64]
    - [31, 64.417]
  - - [1536, 4096, 1, 50304]
    - [3, 83.348]
  - - [1024, 1024, 128, 96]
    - [6, 68.813]
  - - [1024, 8192, 1, 3072]
    - [10, 81.547]
  - - [1024, 1024, 128, 64]
    - [0, 60.245]
  - - [1024, 4096, 1, 50304]
    - [27, 78.277]
  - - [6144, 4096, 1, 1536]
    - [3, 86.331]
  - - [1024, 16384, 1, 1024]
    - [30, 84.715]
  - - [2560, 2048, 1, 1920]
    - [23, 87.187]
  - - [2048, 1024, 1, 6144]
    - [11, 75.567]
  - - [512, 512, 128, 64]
    - [1, 75.815]
  - - [1024, 8192, 1, 30592]
    - [3, 82.041]
  - - [1536, 4096, 1, 1536]
    - [10, 81.94]
  - - [128, 128, 1024, 64]
    - [29, 67.144]
  - - [1024, 8192, 1, 30528]
    - [13, 86.27]
  - - [1024, 3456, 1, 1024]
    - [30, 80.818]
  - - [1024, 3456, 1, 512]
    - [30, 79.408]
  - - [1024, 4096, 1, 512]
    - [21, 73.785]
  - - [1024, 6912, 1, 1024]
    - [21, 85.684]
  - - [1024, 6912, 1, 512]
    - [30, 83.157]
  - - [256, 55296, 1, 128]
    - [1, 83.89]
  - - [256, 6912, 1, 128]
    - [16, 59.105]
  - - [480, 3456, 1, 1024]
    - [31, 65.62]
  - - [480, 4096, 1, 1024]
    - [21, 66.102]
  - - [480, 6912, 1, 1024]
    - [21, 75.965]
  - - [512, 3456, 1, 256]
    - [16, 65.642]
  - - [512, 4096, 1, 256]
    - [17, 66.522]
  - - [512, 55296, 1, 256]
    - [17, 84.869]
  - - [512, 6912, 1, 256]
    - [25, 76.435]
  - - [1024, 1280, 1, 30528]
    - [14, 60.853]
  - - [1024, 1600, 1, 30528]
    - [20, 74.793]
  - - [1024, 10240, 1, 1024]
    - [21, 85.06]
  - - [1024, 10240, 1, 4096]
    - [21, 87.44]
  - - [4096, 10240, 1, 1024]
    - [11, 86.839]
  - - [128, 128, 1280, 64]
    - [20, 68.711]
  - - [1024, 1640, 1, 30528]
    - [20, 76.62]
  - - [1024, 10496, 1, 1024]
    - [10, 82.002]
  - - [1024, 10496, 1, 4096]
    - [20, 83.256]
  - - [4096, 10496, 1, 1024]
    - [3, 86.839]
  - - [128, 128, 1312, 64]
    - [13, 69.514]
  - - [1024, 6144, 1, 4096]
    - [20, 82.882]
  - - [4096, 6144, 1, 1024]
    - [15, 85.966]
  - - [1024, 6144, 1, 1024]
    - [181, 85.694]
  - - [512, 512, 192, 64]
    - [18, 76.061]
  - - [256, 6912, 1, 1]
    - [29, 0.969]
  - - [1024, 10224, 1, 1024]
    - [17, 83.673]
  - - [1024, 10192, 1, 1024]
    - [21, 84.201]
  - - [1024, 10208, 1, 1024]
    - [21, 84.402]
  - - [1024, 10224, 1, 4096]
    - [21, 86.851]
  - - [1024, 10224, 1, 3072]
    - [21, 86.613]
  - - [4096, 10224, 1, 1024]
    - [11, 86.087]
  - - [1024, 10240, 1, 3072]
    - [21, 87.044]
  - - [1024, 10192, 1, 3072]
    - [32, 86.398]
  - - [4096, 10192, 1, 1024]
    - [11, 85.817]
  - - [1024, 10192, 1, 4096]
    - [21, 86.567]
  - - [1024, 10200, 1, 3072]
    - [32, 86.388]
  - - [1024, 10184, 1, 1024]
    - [21, 84.484]
  - - [4096, 10208, 1, 1024]
    - [11, 86.051]
  - - [1024, 10208, 1, 3072]
    - [21, 86.321]
  - - [1024, 10208, 1, 4096]
    - [21, 86.888]
  - - [1024, 10224, 1, 2048]
    - [21, 86.065]
  - - [1024, 10240, 1, 2048]
    - [21, 86.507]
  - - [1024, 10120, 1, 1024]
    - [21, 83.794]
  - - [1024, 10192, 1, 2048]
    - [21, 85.639]
  - - [1024, 10152, 1, 1024]
    - [21, 83.714]
  - - [1024, 10080, 1, 3072]
    - [21, 85.641]
  - - [100352, 512, 1, 256]
    - [15, 84.339]
  - - [12544, 2048, 1, 1024]
    - [17, 86.671]
  - - [200704, 512, 1, 256]
    - [15, 84.662]
  - - [25088, 1024, 1, 512]
    - [17, 85.788]
  - - [50176, 1024, 1, 512]
    - [17, 86.813]
  - - [6272, 2048, 1, 1024]
    - [3, 84.816]
  - - [3136, 128, 128, 256]
    - [30, 70.093]
  - - [3136, 128, 256, 256]
    - [25, 70.059]
  - - [784, 256, 128, 512]
    - [10, 72.254]
  - - [784, 256, 256, 512]
    - [3, 73.773]
  - - [128, 128, 2048, 64]
    - [23, 72.89]
  - - [1024, 2560, 1, 30528]
    - [13, 76.141]
  - - [128, 128, 1536, 64]
    - [13, 71.733]
  - - [1024, 12288, 1, 4096]
    - [21, 85.805]
  - - [1024, 12288, 1, 1024]
    - [21, 84.399]
  - - [4096, 12288, 1, 1024]
    - [11, 87.338]
  - - [1024, 1920, 1, 30528]
    - [17, 71.841]
  - - [128, 128, 192, 64]
    - [7, 46.058]
  - - [768, 2048, 1, 2]
    - [22, 2.257]
  - - [3072, 2048, 1, 768]
    - [188, 84.025]
  - - [768, 2048, 1, 3072]
    - [181, 71.857]
  - - [768, 2048, 1, 768]
    - [176, 61.867]
  - - [384, 384, 144, 64]
    - [8, 77.611]
  - - [768, 4608, 1, 2]
    - [7, 3.414]
  - - [3072, 4608, 1, 768]
    - [17, 87.353]
  - - [768, 4608, 1, 3072]
    - [21, 85.204]
  - - [768, 4608, 1, 768]
    - [17, 83.21]
  - - [512, 512, 48, 64]
    - [8, 70.255]
  - - [128, 128, 256, 64]
    - [0, 52.795]
  - - [384, 384, 192, 64]
    - [8, 79.466]
  - - [1024, 4608, 1, 2]
    - [22, 3.923]
  - - [4096, 4608, 1, 1024]
    - [17, 86.482]
  - - [1024, 4608, 1, 4096]
    - [21, 86.695]
  - - [1024, 4608, 1, 1024]
    - [21, 84.353]
  - - [8192, 1024, 1, 1024]
    - [10, 81.168]
  - - [8192, 4096, 1, 1024]
    - [3, 86.856]
  - - [196, 1024, 128, 256]
    - [3, 61.627]
  - - [196, 1024, 256, 256]
    - [3, 58.329]
  - - [196, 256, 128, 1024]
    - [10, 61.116]
  - - [196, 256, 256, 1024]
    - [20, 58.177]
  - - [196, 512, 128, 1024]
    - [20, 60.88]
  - - [196, 512, 256, 1024]
    - [30, 62.319]
  - - [3072, 256, 2, 1024]
    - [10, 67.12]
  - - [768, 2048, 2, 512]
    - [32, 72.239]
  - - [2904, 256, 2, 1024]
    - [3, 63.122]
  - - [864, 2048, 2, 512]
    - [25, 68.138]
  - - [2992, 256, 2, 1024]
    - [3, 65.989]
  - - [3400, 256, 2, 1024]
    - [26, 69.529]
  - - [4032, 256, 2, 1024]
    - [5, 69.37]
  - - [15200, 128, 2, 512]
    - [3, 72.654]
  - - [12288, 128, 2, 512]
    - [3, 71.918]
  - - [888, 2048, 2, 512]
    - [25, 70.12]
  - - [13600, 128, 2, 512]
    - [3, 74.571]
  - - [12880, 128, 2, 512]
    - [3, 70.353]
  - - [3456, 256, 2, 1024]
    - [16, 71.788]
  - - [2944, 256, 2, 1024]
    - [3, 66.059]
  - - [2688, 256, 2, 1024]
    - [2, 61.897]
  - - [13824, 128, 2, 512]
    - [20, 80.314]
  - - [3168, 256, 2, 1024]
    - [10, 68.135]
  - - [3360, 256, 2, 1024]
    - [26, 68.89]
  - - [3552, 256, 2, 1024]
    - [17, 61.564]
  - - [11616, 128, 2, 512]
    - [20, 64.318]
  - - [4200, 256, 2, 1024]
    - [10, 73.035]
  - - [840, 2048, 2, 512]
    - [25, 65.938]
  - - [14208, 128, 2, 512]
    - [3, 72.239]
  - - [11968, 128, 2, 512]
    - [15, 66.476]
  - - [3264, 256, 2, 1024]
    - [25, 70.32]
  - - [13600, 256, 2, 512]
    - [25, 79.774]
  - - [12880, 256, 2, 512]
    - [17, 76.893]
  - - [12288, 256, 2, 512]
    - [3, 80.741]
  - - [2816, 256, 2, 1024]
    - [24, 64.75]
  - - [672, 2048, 2, 512]
    - [17, 61.359]
  - - [13440, 128, 2, 512]
    - [3, 78.4]
  - - [13824, 256, 2, 512]
    - [3, 83.538]
  - - [15200, 256, 2, 512]
    - [17, 78.766]
  - - [3600, 256, 2, 1024]
    - [17, 62.601]
  - - [4032, 1024, 2, 256]
    - [3, 75.47]
  - - [16128, 128, 2, 512]
    - [10, 73.744]
  - - [15200, 128, 1, 512]
    - [24, 60.747]
  - - [13600, 128, 1, 512]
    - [16, 65.085]
  - - [2904, 1024, 2, 256]
    - [3, 71.284]
  - - [2992, 1024, 2, 256]
    - [3, 74.633]
  - - [1536, 2048, 1, 1024]
    - [21, 74.498]
  - - [24576, 128, 1, 256]
    - [3, 69.006]
  - - [24576, 512, 1, 256]
    - [13, 81.349]
  - - [25760, 128, 1, 256]
    - [15, 63.764]
  - - [25760, 512, 1, 256]
    - [25, 79.569]
  - - [6144, 256, 1, 512]
    - [3, 66.047]
  - - [6440, 256, 1, 512]
    - [4, 65.068]
  - - [13600, 512, 1, 128]
    - [1, 72.557]
  - - [9408, 512, 2, 128]
    - [1, 76.242]
  - - [56000, 256, 2, 64]
    - [1, 76.42]
  - - [2816, 1024, 2, 256]
    - [23, 78.971]
  - - [60800, 256, 1, 64]
    - [13, 77.233]
  - - [2944, 1024, 2, 256]
    - [15, 75.615]
  - - [11776, 512, 2, 128]
    - [13, 81.05]
  - - [11616, 512, 2, 128]
    - [1, 77.028]
  - - [4200, 1024, 2, 256]
    - [10, 78.453]
  - - [54400, 256, 1, 64]
    - [1, 76.264]
  - - [15200, 512, 1, 128]
    - [8, 71.443]
  - - [2688, 1024, 2, 256]
    - [3, 75.313]
  - - [12672, 512, 2, 128]
    - [23, 84.209]
  - - [11968, 512, 2, 128]
    - [1, 79.331]
  - - [46464, 256, 2, 64]
    - [23, 79.741]
  - - [2400, 256, 2, 1024]
    - [2, 55.184]
  - - [2520, 256, 2, 1024]
    - [2, 57.072]
  - - [2400, 1024, 2, 256]
    - [10, 71.863]
  - - [10752, 128, 2, 512]
    - [3, 74.067]
  - - [45632, 256, 2, 64]
    - [1, 74.802]
  - - [2520, 1024, 2, 256]
    - [3, 73.949]
  - - [53760, 256, 2, 64]
    - [1, 77.997]
  - - [2352, 256, 2, 1024]
    - [2, 53.248]
  - - [47872, 256, 2, 64]
    - [8, 79.331]
  - - [47104, 256, 2, 64]
    - [1, 77.312]
  - - [50688, 256, 2, 64]
    - [8, 77.949]
  - - [45056, 256, 2, 64]
    - [1, 76.857]
  - - [13440, 512, 2, 128]
    - [23, 82.769]
  - - [2352, 1024, 2, 256]
    - [10, 69.213]
  - - [11264, 512, 2, 128]
    - [18, 81.614]
  - - [10560, 128, 2, 512]
    - [10, 68.644]
  - - [16128, 512, 2, 128]
    - [23, 85.012]
  - - [37632, 256, 2, 64]
    - [1, 78.66]
  - - [51520, 256, 2, 64]
    - [1, 78.014]
  - - [14000, 512, 2, 128]
    - [1, 79.012]
  - - [10560, 512, 2, 128]
    - [1, 79.88]
  - - [64512, 256, 2, 64]
    - [8, 78.928]
  - - [54400, 256, 2, 64]
    - [1, 80.462]
  - - [3264, 1024, 2, 256]
    - [3, 75.299]
  - - [10752, 512, 2, 128]
    - [13, 81.257]
  - - [3168, 1024, 2, 256]
    - [10, 73.782]
  - - [55296, 256, 2, 256]
    - [3, 84.069]
  - - [51520, 256, 2, 256]
    - [15, 82.697]
  - - [11408, 128, 2, 512]
    - [4, 69.044]
  - - [60800, 256, 2, 256]
    - [25, 84.324]
  - - [54400, 256, 2, 256]
    - [5, 84.238]
  - - [60800, 256, 2, 64]
    - [23, 81.339]
  - - [3800, 1024, 1, 256]
    - [3, 70.481]
  - - [3400, 1024, 1, 256]
    - [20, 70.602]
  - - [3072, 1024, 2, 256]
    - [3, 78.424]
  - - [3600, 1024, 2, 256]
    - [3, 75.851]
  - - [12288, 512, 2, 128]
    - [13, 80.908]
  - - [49152, 256, 2, 256]
    - [3, 83.924]
  - - [12880, 512, 2, 128]
    - [8, 78.494]
  - - [11408, 512, 2, 128]
    - [1, 79.138]
  - - [42240, 256, 2, 64]
    - [1, 79.087]
  - - [1008, 2048, 2, 512]
    - [10, 71.371]
  - - [3360, 1024, 2, 256]
    - [10, 75.637]
  - - [14208, 512, 2, 128]
    - [13, 83.996]
  - - [56832, 256, 2, 64]
    - [8, 78.586]
  - - [43008, 256, 2, 64]
    - [8, 76.5]
  - - [13600, 512, 2, 128]
    - [1, 79.449]
  - - [2640, 1024, 2, 256]
    - [3, 71.651]
  - - [13824, 512, 2, 128]
    - [18, 83.379]
  - - [3800, 256, 2, 1024]
    - [17, 65.753]
  - - [55296, 256, 2, 64]
    - [8, 78.13]
  - - [2640, 256, 2, 1024]
    - [2, 59.855]
  - - [15200, 512, 2, 128]
    - [1, 79.721]
  - - [3552, 1024, 2, 256]
    - [10, 77.341]
  - - [3456, 1024, 2, 256]
    - [25, 81.088]
  - - [49152, 256, 2, 64]
    - [8, 76.811]
  - - [3400, 1024, 2, 256]
    - [10, 76.319]
  - - [3800, 1024, 2, 256]
    - [3, 75.892]
  - - [6912, 256, 1, 512]
    - [16, 69.261]
  - - [6800, 256, 1, 512]
    - [4, 66.867]
  - - [27648, 128, 1, 256]
    - [15, 76.543]
  - - [27200, 128, 1, 256]
    - [25, 67.583]
  - - [30400, 128, 1, 256]
    - [10, 66.722]
  - - [7600, 256, 1, 512]
    - [2, 61.589]
  - - [6144, 1024, 1, 512]
    - [3, 81.043]
  - - [6912, 1024, 1, 512]
    - [3, 83.538]
  - - [6440, 1024, 1, 512]
    - [5, 77.141]
  - - [27648, 512, 1, 256]
    - [30, 83.283]
  - - [1728, 2048, 1, 1024]
    - [25, 70.175]
  - - [27200, 512, 1, 256]
    - [27, 79.924]
  - - [6800, 1024, 1, 512]
    - [10, 79.938]
  - - [7600, 1024, 1, 512]
    - [15, 78.164]
  - - [30400, 512, 1, 256]
    - [25, 79.839]
  - - [12544, 1024, 1, 1024]
    - [3, 85.18]
  - - [173280, 128, 1, 64]
    - [23, 74.12]
  - - [231040, 128, 1, 64]
    - [8, 80.462]
  - - [25992, 128, 1, 64]
    - [7, 49.462]
  - - [2852, 256, 2, 1024]
    - [3, 61.779]
  - - [3220, 256, 2, 1024]
    - [3, 68.555]
  - - [850, 2048, 2, 512]
    - [10, 67.055]
  - - [805, 2048, 2, 512]
    - [20, 63.368]
  - - [3036, 256, 2, 1024]
    - [10, 66.913]
  - - [713, 2048, 2, 512]
    - [17, 64.94]
  - - [850, 2048, 1, 512]
    - [10, 57.036]
  - - [660, 2048, 2, 512]
    - [17, 60.004]
  - - [726, 2048, 2, 512]
    - [17, 65.697]
  - - [3500, 256, 2, 1024]
    - [10, 60.679]
  - - [3700, 256, 2, 1024]
    - [5, 63.641]
  - - [748, 2048, 2, 512]
    - [30, 67.785]
  - - [3036, 1024, 2, 256]
    - [3, 75.463]
  - - [2852, 1024, 2, 256]
    - [3, 73.312]
  - - [950, 2048, 1, 512]
    - [11, 62.003]
  - - [3700, 1024, 2, 256]
    - [3, 77.698]
  - - [3500, 1024, 2, 256]
    - [3, 74.793]
  - - [3220, 1024, 2, 256]
    - [10, 73.452]
  - - [950, 2048, 2, 512]
    - [10, 67.151]
  - - [1610, 2048, 1, 1024]
    - [20, 74.911]
  - - [1700, 2048, 1, 1024]
    - [10, 68.772]
  - - [1900, 2048, 1, 1024]
    - [10, 76.678]
  - - [1444, 256, 120, 128]
    - [3, 74.718]
  - - [1444, 256, 139, 128]
    - [3, 69.259]
  - - [1444, 256, 160, 128]
    - [2, 63.255]
  - - [1444, 256, 18, 128]
    - [8, 67.115]
  - - [1444, 256, 19, 128]
    - [13, 70.566]
  - - [1444, 256, 120, 256]
    - [3, 77.052]
  - - [1444, 256, 139, 256]
    - [3, 77.025]
  - - [1444, 256, 160, 256]
    - [3, 77.479]
  - - [1444, 256, 18, 256]
    - [25, 70.476]
  - - [1444, 256, 19, 256]
    - [15, 72.55]
  - - [361, 256, 120, 512]
    - [20, 77.703]
  - - [361, 256, 139, 512]
    - [30, 76.063]
  - - [361, 256, 160, 512]
    - [10, 77.052]
  - - [361, 256, 18, 512]
    - [31, 61.157]
  - - [361, 256, 19, 512]
    - [10, 56.074]
  - - [200716, 128, 1, 64]
    - [18, 74.219]
  - - [27436, 128, 1, 64]
    - [2, 48.823]
  - - [1024, 1024, 160, 96]
    - [12, 69.124]
  - - [1920, 16384, 1, 25216]
    - [1, 91.577]
  - - [3840, 16384, 1, 1920]
    - [23, 93.412]
  - - [1920, 16384, 1, 3840]
    - [27, 88.173]
  - - [960, 16384, 1, 1920]
    - [23, 84.763]
  - - [1920, 16384, 1, 2880]
    - [23, 92.513]
  - - [1024, 1024, 40, 96]
    - [23, 84.705]
  - - [1920, 4096, 1, 25216]
    - [13, 86.015]
  - - [3840, 4096, 1, 1920]
    - [23, 90.861]
  - - [1920, 4096, 1, 3840]
    - [5, 84.023]
  - - [960, 4096, 1, 1920]
    - [13, 72.946]
  - - [1920, 4096, 1, 2880]
    - [23, 86.69]
  - - [1024, 1024, 80, 96]
    - [1, 75.863]
  - - [1920, 8192, 1, 25216]
    - [1, 90.637]
  - - [3840, 8192, 1, 1920]
    - [23, 92.279]
  - - [1920, 8192, 1, 3840]
    - [25, 86.022]
  - - [960, 8192, 1, 1920]
    - [13, 80.5]
  - - [1920, 8192, 1, 2880]
    - [23, 91.534]
  - - [1024, 1024, 96, 96]
    - [1, 70.457]
  - - [2304, 16384, 1, 12672]
    - [23, 92.776]
  - - [2304, 16384, 1, 2304]
    - [27, 89.475]
  - - [576, 16384, 1, 2304]
    - [11, 76.611]
  - - [2304, 16384, 1, 1728]
    - [23, 93.463]
  - - [1024, 1024, 24, 96]
    - [23, 82.772]
  - - [2304, 4096, 1, 12672]
    - [23, 90.246]
  - - [2304, 4096, 1, 2304]
    - [17, 88.231]
  - - [576, 4096, 1, 2304]
    - [3, 65.844]
  - - [2304, 4096, 1, 1728]
    - [23, 91.107]
  - - [1024, 1024, 48, 96]
    - [23, 85.718]
  - - [2304, 8192, 1, 12672]
    - [23, 91.999]
  - - [2304, 8192, 1, 2304]
    - [17, 89.157]
  - - [576, 8192, 1, 2304]
    - [10, 75.07]
  - - [2304, 8192, 1, 1728]
    - [1, 92.646]
  - - [1024, 1024, 16, 96]
    - [23, 81.281]
  - - [3072, 4096, 1, 6400]
    - [17, 86.671]
  - - [1536, 4096, 1, 3072]
    - [20, 82.812]
  - - [3072, 4096, 1, 1536]
    - [21, 85.4]
  - - [384, 4096, 1, 3072]
    - [30, 70.903]
  - - [3072, 4096, 1, 1152]
    - [23, 88.848]
  - - [1024, 1024, 32, 96]
    - [23, 84.537]
  - - [3072, 8192, 1, 6400]
    - [15, 86.892]
  - - [1536, 8192, 1, 3072]
    - [21, 85.79]
  - - [3072, 8192, 1, 1536]
    - [25, 86.429]
  - - [384, 8192, 1, 3072]
    - [21, 75.986]
  - - [3072, 8192, 1, 1152]
    - [23, 91.961]
  - - [2048, 4096, 1, 2048]
    - [20, 81.6]
  - - [2048, 4096, 1, 4096]
    - [10, 81.778]
  - - [4096, 4096, 1, 2048]
    - [10, 85.27]
  - - [1024, 2283, 1, 29000]
    - [5, 84.799]
  - - [1024, 2296, 1, 29000]
    - [17, 85.323]
  - - [1024, 2306, 1, 29000]
    - [1, 68.921]
  - - [1024, 2309, 1, 29000]
    - [1, 68.953]
  - - [1024, 2318, 1, 29000]
    - [1, 69.124]
  - - [1024, 2320, 1, 29000]
    - [1, 69.162]
  - - [1024, 2324, 1, 29000]
    - [1, 69.3]
  - - [1024, 2325, 1, 29000]
    - [1, 69.37]
  - - [1024, 2329, 1, 29000]
    - [1, 69.36]
  - - [1024, 2338, 1, 29000]
    - [8, 69.606]
  - - [1024, 2345, 1, 29000]
    - [18, 69.736]
  - - [1024, 2350, 1, 29000]
    - [13, 69.823]
  - - [1024, 2362, 1, 29000]
    - [13, 70.394]
  - - [1024, 2366, 1, 29000]
    - [18, 70.39]
  - - [1024, 2368, 1, 29000]
    - [23, 70.438]
  - - [1024, 2374, 1, 29000]
    - [23, 70.947]
  - - [1024, 2390, 1, 29000]
    - [23, 71.388]
  - - [512, 512, 320, 64]
    - [0, 66.79]
  - - [512, 512, 80, 64]
    - [8, 71.475]
  - - [2560, 1024, 1, 2560]
    - [15, 73.688]
  - - [2560, 1024, 1, 4096]
    - [20, 73.814]
  - - [4096, 1024, 1, 2560]
    - [3, 75.545]
  - - [1024, 1024, 512, 64]
    - [2, 54.675]
  - - [1024, 32768, 1, 3072]
    - [20, 87.165]
  - - [1024, 32768, 1, 4096]
    - [20, 87.107]
  - - [1024, 32768, 1, 50304]
    - [17, 88.202]
  - - [4096, 32768, 1, 1024]
    - [3, 87.384]
  - - [1024, 1024, 24, 128]
    - [23, 84.98]
  - - [128, 1024, 24, 1024]
    - [21, 73.847]
  - - [1024, 780, 1, 30522]
    - [38, 65.292]
  - - [1024, 308, 1, 30522]
    - [39, 56.665]
  - - [1024, 800, 1, 30522]
    - [38, 67.106]
  - - [1024, 820, 1, 30522]
    - [33, 68.791]
  - - [1024, 385, 1, 30522]
    - [36, 55.064]
  - - [1024, 462, 1, 30522]
    - [36, 65.244]
  - - [1024, 640, 1, 30528]
    - [33, 74.617]
  - - [2048, 199, 1, 29000]
    - [35, 55.503]
  - - [2048, 221, 1, 29000]
    - [35, 61.54]
  - - [2048, 224, 1, 29000]
    - [36, 62.382]
  - - [2048, 229, 1, 29000]
    - [35, 63.525]
  - - [2048, 234, 1, 29000]
    - [40, 64.824]
  - - [2048, 242, 1, 29000]
    - [35, 66.968]
  - - [2048, 246, 1, 29000]
    - [37, 68.015]
  - - [2048, 247, 1, 29000]
    - [40, 68.234]
  - - [2048, 256, 1, 29000]
    - [36, 73.165]
  - - [2048, 262, 1, 29000]
    - [34, 55.107]
  - - [2048, 264, 1, 29000]
    - [34, 55.57]
  - - [2048, 265, 1, 29000]
    - [34, 55.753]
  - - [2048, 274, 1, 29000]
    - [34, 57.608]
  - - [2048, 277, 1, 29000]
    - [34, 58.179]
  - - [2048, 279, 1, 29000]
    - [34, 58.654]
  - - [2048, 288, 1, 29000]
    - [34, 60.426]
  - - [2048, 296, 1, 29000]
    - [34, 62.071]
  - - [2048, 315, 1, 29000]
    - [34, 65.866]
  - - [2048, 335, 1, 29000]
    - [35, 63.546]
  - - [1024, 561, 1, 29000]
    - [34, 66.643]
  - - [1024, 574, 1, 29000]
    - [39, 68.154]
  - - [1024, 600, 1, 29000]
    - [41, 69.91]
  - - [1024, 608, 1, 29000]
    - [33, 70.703]
  - - [1024, 615, 1, 29000]
    - [33, 71.612]
  - - [1024, 622, 1, 29000]
    - [43, 72.155]
  - - [1024, 625, 1, 29000]
    - [41, 72.454]
  - - [1024, 626, 1, 29000]
    - [33, 72.801]
  - - [1024, 628, 1, 29000]
    - [33, 72.755]
  - - [1024, 636, 1, 29000]
    - [33, 73.79]
  - - [1024, 651, 1, 29000]
    - [36, 63.25]
  - - [1024, 658, 1, 29000]
    - [41, 63.954]
  - - [1024, 669, 1, 29000]
    - [36, 64.943]
  - - [1024, 670, 1, 29000]
    - [41, 65.056]
  - - [1024, 672, 1, 29000]
    - [41, 65.273]
  - - [1024, 684, 1, 29000]
    - [41, 66.358]
  - - [1024, 716, 1, 29000]
    - [40, 69.297]
  - - [1024, 730, 1, 29000]
    - [42, 70.404]
  - - [1024, 1024, 1, 3328]
    - [71, 63.824]
  - - [128, 6784, 1, 3328]
    - [71, 53.552]
  - - [256, 4288, 1, 3328]
    - [48, 65.668]
  - - [704, 1856, 1, 3328]
    - [47, 59.739]
  - - [448, 1024, 1, 1280]
    - [60, 46.241]
  - - [1024, 704, 1, 256]
    - [70, 43.456]
  - - [256, 1856, 1, 1280]
    - [70, 47.987]
  - - [256, 2944, 1, 3328]
    - [47, 55.732]
  - - [128, 3584, 1, 1280]
    - [78, 47.673]
  - - [4288, 256, 1, 256]
    - [55, 52.527]
  - - [5888, 64, 1, 3328]
    - [58, 40.148]
  - - [2944, 256, 1, 3328]
    - [62, 56.197]
  - - [1408, 448, 1, 1280]
    - [70, 45.573]
  - - [1408, 256, 1, 1280]
    - [71, 38.387]
  - - [6784, 64, 1, 256]
    - [70, 33.584]
  - - [2368, 128, 1, 3328]
    - [71, 33.914]
  - - [2944, 128, 1, 256]
    - [52, 29.671]
  - - [448, 1408, 1, 256]
    - [69, 36.391]
  - - [64, 5056, 1, 3328]
    - [53, 33.854]
  - - [256, 3584, 1, 3328]
    - [71, 56.609]
  - - [256, 1408, 1, 256]
    - [75, 28.971]
  - - [5056, 64, 1, 1280]
    - [46, 33.247]
  - - [2368, 128, 1, 256]
    - [46, 23.565]
  - - [4288, 128, 1, 1280]
    - [71, 55.143]
  - - [5888, 64, 1, 256]
    - [45, 29.222]
  - - [1856, 256, 1, 1280]
    - [71, 47.83]
  - - [64, 5888, 1, 3328]
    - [53, 39.2]
  - - [1024, 704, 1, 1280]
    - [70, 51.864]
  - - [256, 1408, 1, 3328]
    - [71, 41.146]
  - - [6784, 128, 1, 3328]
    - [48, 53.627]
  - - [704, 704, 1, 3328]
    - [71, 54.736]
  - - [3584, 256, 1, 3328]
    - [60, 56.619]
  - - [128, 3584, 1, 3328]
    - [78, 51.473]
  - - [128, 2944, 1, 1280]
    - [65, 39.318]
  - - [448, 1856, 1, 1280]
    - [46, 52.631]
  - - [3584, 128, 1, 256]
    - [45, 34.79]
  - - [448, 1408, 1, 3328]
    - [47, 46.354]
  - - [704, 1024, 1, 256]
    - [58, 41.51]
  - - [256, 3584, 1, 256]
    - [60, 47.914]
  - - [1408, 704, 1, 256]
    - [47, 49.108]
  - - [448, 2944, 1, 3328]
    - [60, 54.533]
  - - [64, 5888, 1, 256]
    - [53, 28.436]
  - - [448, 2368, 1, 1280]
    - [46, 51.208]
  - - [704, 704, 1, 256]
    - [58, 35.658]
  - - [128, 4288, 1, 3328]
    - [71, 60.566]
  - - [256, 2368, 1, 256]
    - [68, 37.196]
  - - [1024, 448, 1, 3328]
    - [60, 50.861]
  - - [1856, 704, 1, 1280]
    - [59, 58.227]
  - - [1024, 1024, 1, 1280]
    - [60, 63.112]
  - - [256, 2944, 1, 256]
    - [45, 45.609]
  - - [128, 6784, 1, 1280]
    - [60, 52.163]
  - - [1408, 704, 1, 3328]
    - [71, 60.6]
  - - [128, 5888, 1, 1280]
    - [70, 54.046]
  - - [704, 1408, 1, 3328]
    - [48, 60.6]
  - - [448, 704, 1, 1280]
    - [53, 31.978]
  - - [6784, 128, 1, 256]
    - [48, 45.349]
  - - [704, 448, 1, 256]
    - [58, 24.457]
  - - [256, 1856, 1, 3328]
    - [48, 52.838]
  - - [1024, 704, 1, 3328]
    - [70, 53.385]
  - - [128, 4288, 1, 256]
    - [52, 41.317]
  - - [64, 6784, 1, 3328]
    - [53, 41.233]
  - - [2944, 256, 1, 1280]
    - [70, 54.222]
  - - [1856, 704, 1, 256]
    - [70, 50.159]
  - - [704, 1856, 1, 256]
    - [47, 51.44]
  - - [2944, 448, 1, 256]
    - [70, 54.567]
  - - [2368, 128, 1, 1280]
    - [63, 30.915]
  - - [64, 6784, 1, 256]
    - [53, 31.236]
  - - [64, 5056, 1, 1280]
    - [63, 32.176]
  - - [704, 448, 1, 3328]
    - [60, 35.27]
  - - [2368, 256, 1, 1280]
    - [75, 43.051]
  - - [2368, 448, 1, 1280]
    - [47, 57.463]
  - - [128, 3584, 1, 256]
    - [62, 35.048]
  - - [1856, 448, 1, 3328]
    - [59, 60.636]
  - - [128, 5056, 1, 256]
    - [64, 38.858]
  - - [4288, 256, 1, 1280]
    - [48, 63.59]
  - - [4288, 128, 1, 3328]
    - [60, 60.802]
  - - [448, 2368, 1, 3328]
    - [46, 52.069]
  - - [256, 1408, 1, 1280]
    - [60, 38.44]
  - - [128, 2368, 1, 256]
    - [70, 23.565]
  - - [6784, 64, 1, 3328]
    - [47, 45.99]
  - - [128, 2944, 1, 3328]
    - [78, 42.46]
  - - [2944, 448, 1, 3328]
    - [70, 60.617]
  - - [5888, 128, 1, 256]
    - [45, 46.246]
  - - [5056, 64, 1, 256]
    - [58, 25.094]
  - - [128, 5056, 1, 3328]
    - [47, 47.936]
  - - [256, 4288, 1, 1280]
    - [48, 63.518]
  - - [4288, 128, 1, 256]
    - [58, 39.487]
  - - [3584, 256, 1, 256]
    - [60, 47.434]
  - - [128, 2944, 1, 256]
    - [70, 29.15]
  - - [3584, 128, 1, 3328]
    - [60, 51.763]
  - - [5888, 128, 1, 3328]
    - [47, 55.65]
  - - [1408, 704, 1, 1280]
    - [71, 58.608]
  - - [448, 1408, 1, 1280]
    - [47, 44.469]
  - - [704, 1408, 1, 1280]
    - [48, 58.697]
  - - [448, 2944, 1, 256]
    - [46, 49.045]
  - - [448, 2368, 1, 256]
    - [69, 46.709]
  - - [64, 6784, 1, 1280]
    - [53, 39.576]
  - - [128, 2368, 1, 3328]
    - [71, 33.857]
  - - [5056, 64, 1, 3328]
    - [69, 35.024]
  - - [5056, 128, 1, 3328]
    - [62, 48.112]
  - - [448, 704, 1, 256]
    - [46, 24.274]
  - - [1856, 256, 1, 3328]
    - [71, 52.809]
  - - [2944, 128, 1, 3328]
    - [48, 42.759]
  - - [1024, 1024, 1, 256]
    - [60, 54.668]
  - - [704, 1024, 1, 1280]
    - [59, 50.798]
  - - [256, 4288, 1, 256]
    - [47, 54.123]
  - - [2368, 256, 1, 256]
    - [58, 35.301]
  - - [256, 2368, 1, 3328]
    - [47, 45.001]
  - - [704, 448, 1, 1280]
    - [76, 32.041]
  - - [256, 1856, 1, 256]
    - [75, 37.601]
  - - [64, 5056, 1, 256]
    - [53, 24.419]
  - - [1408, 256, 1, 3328]
    - [60, 41.076]
  - - [2368, 448, 1, 256]
    - [47, 47.938]
  - - [4288, 256, 1, 3328]
    - [71, 66.684]
  - - [2944, 256, 1, 256]
    - [45, 45.79]
  - - [6784, 64, 1, 1280]
    - [70, 43.793]
  - - [704, 1856, 1, 1280]
    - [47, 58.514]
  - - [448, 1024, 1, 3328]
    - [60, 50.861]
  - - [2944, 448, 1, 1280]
    - [70, 59.811]
  - - [448, 1024, 1, 256]
    - [69, 33.316]
  - - [1024, 448, 1, 1280]
    - [57, 46.759]
  - - [256, 2368, 1, 1280]
    - [47, 43.777]
  - - [128, 5056, 1, 1280]
    - [47, 46.494]
  - - [1408, 256, 1, 256]
    - [75, 28.672]
  - - [128, 5888, 1, 3328]
    - [70, 55.669]
  - - [2368, 448, 1, 3328]
    - [59, 59.119]
  - - [3584, 128, 1, 1280]
    - [48, 47.704]
  - - [1408, 448, 1, 256]
    - [68, 38.706]
  - - [2368, 256, 1, 3328]
    - [62, 44.784]
  - - [5888, 128, 1, 1280]
    - [47, 54.121]
  - - [256, 3584, 1, 1280]
    - [60, 55.351]
  - - [128, 5888, 1, 256]
    - [75, 44.905]
  - - [1408, 448, 1, 3328]
    - [70, 46.834]
  - - [64, 5888, 1, 1280]
    - [63, 37.23]
  - - [704, 704, 1, 1280]
    - [71, 49.761]
  - - [128, 2368, 1, 1280]
    - [46, 30.773]
  - - [3584, 256, 1, 1280]
    - [71, 55.331]
  - - [5888, 64, 1, 1280]
    - [58, 38.233]
  - - [5056, 128, 1, 1280]
    - [52, 46.301]
  - - [448, 1856, 1, 3328]
    - [69, 53.783]
  - - [1024, 448, 1, 256]
    - [57, 35.576]
  - - [2944, 128, 1, 1280]
    - [48, 39.668]
  - - [256, 2944, 1, 1280]
    - [70, 54.196]
  - - [704, 1024, 1, 3328]
    - [59, 52.879]
  - - [1856, 448, 1, 1280]
    - [45, 58.087]
  - - [128, 6784, 1, 256]
    - [55, 44.818]
  - - [704, 1408, 1, 256]
    - [55, 48.102]
  - - [448, 2944, 1, 1280]
    - [60, 53.142]
  - - [1856, 256, 1, 256]
    - [46, 34.344]
  - - [5056, 128, 1, 256]
    - [46, 37.266]
  - - [6784, 128, 1, 1280]
    - [48, 52.488]
  - - [1856, 448, 1, 256]
    - [58, 45.826]
  - - [128, 4288, 1, 1280]
    - [47, 54.895]
  - - [448, 704, 1, 3328]
    - [71, 35.132]
  - - [448, 1856, 1, 256]
    - [46, 45.421]
  - - [1856, 704, 1, 3328]
    - [59, 59.799]
  - - [64, 193600, 1, 64]
    - [53, 52.616]
  - - [1024, 700, 1, 512]
    - [70, 44.922]
  - - [2560, 128, 1, 2560]
    - [60, 36.697]
  - - [64, 193600, 1, 256]
    - [76, 51.693]
  - - [4096, 128, 1, 4096]
    - [78, 57.844]
  - - [512, 1500, 1, 2816]
    - [70, 55.536]
  - - [3072, 128, 1, 1024]
    - [175, 33.572]
  - - [7680, 64, 1, 2560]
    - [59, 51.459]
  - - [7680, 128, 1, 2560]
    - [48, 59.867]
  - - [512, 1500, 1, 2560]
    - [70, 55.331]
  - - [1024, 1024, 1, 1024]
    - [181, 57.767]
  - - [512, 1500, 1, 2048]
    - [54, 54.367]
  - - [512, 1500, 1, 1536]
    - [70, 54.304]
  - - [3136, 64, 128, 64]
    - [74, 67.954]
  - - [3136, 64, 64, 256]
    - [59, 68.661]
  - - [3136, 64, 128, 256]
    - [50, 46.055]
  - - [3136, 64, 256, 64]
    - [44, 37.105]
  - - [3136, 64, 64, 64]
    - [67, 64.443]
  - - [3136, 64, 256, 256]
    - [73, 46.67]
  - - [64, 128, 512, 128]
    - [58, 39.229]
  - - [64, 512, 64, 512]
    - [79, 40.671]
  - - [512, 1600, 1, 32]
    - [67, 18.702]
  - - [512, 1600, 1, 512]
    - [70, 54.258]
  - - [560, 1600, 1, 1024]
    - [55, 51.69]
  - - [1024, 512, 1, 1]
    - [67, 0.497]
  - - [1024, 512, 1, 64]
    - [67, 20.853]
  - - [1024, 512, 1, 1024]
    - [180, 44.763]
  - - [1024, 960, 1, 64]
    - [67, 32.14]
  - - [1024, 960, 1, 1024]
    - [71, 56.737]
  - - [1600, 512, 1, 1024]
    - [59, 55.939]
  - - [2048, 512, 1, 1]
    - [67, 0.957]
  - - [2048, 512, 1, 2048]
    - [60, 63.583]
  - - [64, 192, 64, 1280]
    - [53, 49.274]
  - - [64, 320, 64, 1280]
    - [63, 51.917]
  - - [64, 384, 64, 1280]
    - [63, 49.728]
  - - [64, 448, 64, 1280]
    - [53, 44.006]
  - - [64, 192, 64, 2048]
    - [53, 49.957]
  - - [64, 320, 64, 2048]
    - [76, 50.229]
  - - [64, 384, 64, 2048]
    - [76, 45.792]
  - - [64, 448, 64, 2048]
    - [79, 42.277]
  - - [1225, 64, 64, 192]
    - [47, 63.055]
  - - [1225, 64, 64, 256]
    - [47, 64.525]
  - - [1225, 64, 64, 288]
    - [70, 64.598]
  - - [5329, 80, 64, 64]
    - [59, 41.722]
  - - [64, 192, 32, 1280]
    - [53, 38.527]
  - - [64, 320, 32, 1280]
    - [76, 43.538]
  - - [64, 384, 32, 1280]
    - [53, 49.236]
  - - [64, 448, 32, 1280]
    - [76, 45.631]
  - - [64, 192, 32, 2048]
    - [76, 39.484]
  - - [64, 320, 32, 2048]
    - [53, 44.442]
  - - [64, 384, 32, 2048]
    - [63, 49.93]
  - - [64, 448, 32, 2048]
    - [63, 46.357]
  - - [1225, 64, 32, 192]
    - [59, 56.935]
  - - [1225, 64, 32, 256]
    - [70, 59.701]
  - - [1225, 64, 32, 288]
    - [47, 59.828]
  - - [5329, 80, 32, 64]
    - [54, 40.239]
  - - [289, 128, 32, 768]
    - [48, 47.0]
  - - [289, 160, 32, 768]
    - [47, 42.431]
  - - [289, 192, 32, 768]
    - [47, 50.868]
  - - [3136, 64, 32, 64]
    - [44, 61.181]
  - - [3136, 64, 32, 256]
    - [64, 65.702]
  - - [196, 256, 32, 1024]
    - [55, 48.312]
  - - [960, 1024, 1, 1024]
    - [60, 56.633]
  - - [64, 512, 16, 512]
    - [76, 42.472]
  - - [64, 512, 128, 512]
    - [79, 45.358]
  - - [1024, 512, 1, 2]
    - [71, 0.996]
  - - [1024, 512, 1, 4096]
    - [184, 57.497]
  - - [1024, 616, 1, 1024]
    - [70, 43.287]
  - - [64, 128, 128, 128]
    - [69, 39.087]
  - - [64, 128, 160, 128]
    - [69, 41.705]
  - - [1024, 1024, 1, 2]
    - [67, 1.946]
  - - [1024, 1024, 1, 4096]
    - [181, 68.089]
  - - [64, 128, 624, 128]
    - [61, 42.826]
  - - [1024, 780, 1, 1024]
    - [77, 54.239]
  - - [64, 128, 640, 128]
    - [56, 41.944]
  - - [1024, 800, 1, 1024]
    - [77, 55.599]
  - - [64, 128, 656, 128]
    - [61, 42.617]
  - - [1024, 820, 1, 1024]
    - [70, 56.928]
  - - [64, 512, 80, 512]
    - [66, 42.383]
  - - [1024, 385, 1, 1024]
    - [48, 38.597]
  - - [64, 512, 96, 512]
    - [56, 44.362]
  - - [1024, 462, 1, 1024]
    - [71, 45.882]
  - - [64, 128, 144, 128]
    - [69, 42.634]
  - - [64, 1024, 32, 1024]
    - [79, 43.412]
  - - [96, 1024, 64, 1024]
    - [65, 52.956]
  - - [64, 1024, 256, 1024]
    - [79, 45.573]
  - - [64, 512, 256, 512]
    - [56, 46.135]
  - - [64, 1024, 64, 1024]
    - [66, 44.505]
  - - [64, 1024, 128, 1024]
    - [66, 44.84]
  - - [96, 1024, 128, 1024]
    - [54, 52.144]
  - - [64, 512, 40, 512]
    - [53, 43.639]
  - - [64, 128, 1024, 128]
    - [49, 44.594]
  - - [1024, 864, 1, 1024]
    - [78, 50.803]
  - - [1024, 864, 1, 512]
    - [78, 46.757]
  - - [256, 3456, 1, 128]
    - [60, 39.921]
  - - [256, 4096, 1, 128]
    - [60, 46.234]
  - - [480, 864, 1, 1024]
    - [65, 39.969]
  - - [512, 864, 1, 256]
    - [52, 29.237]
  - - [64, 128, 1280, 128]
    - [66, 45.802]
  - - [64, 128, 1312, 128]
    - [56, 45.894]
  - - [64, 512, 192, 512]
    - [66, 46.605]
  - - [256, 4096, 1, 1]
    - [71, 0.747]
  - - [12544, 64, 1, 147]
    - [68, 39.967]
  - - [64, 128, 2048, 128]
    - [49, 46.036]
  - - [64, 128, 1536, 128]
    - [49, 44.898]
  - - [64, 128, 192, 128]
    - [69, 43.345]
  - - [64, 384, 144, 384]
    - [72, 44.497]
  - - [64, 512, 48, 512]
    - [53, 39.921]
  - - [64, 128, 256, 128]
    - [46, 39.709]
  - - [64, 384, 192, 384]
    - [69, 53.634]
  - - [3400, 256, 1, 1024]
    - [71, 49.932]
  - - [3800, 256, 1, 1024]
    - [71, 55.628]
  - - [864, 512, 2, 2048]
    - [55, 52.78]
  - - [888, 512, 2, 2048]
    - [78, 54.075]
  - - [51520, 64, 2, 256]
    - [54, 66.254]
  - - [46464, 64, 2, 256]
    - [47, 67.238]
  - - [49152, 64, 2, 256]
    - [77, 67.942]
  - - [1536, 512, 1, 1024]
    - [70, 55.671]
  - - [1728, 512, 1, 1024]
    - [48, 51.28]
  - - [1024, 1024, 1, 320]
    - [60, 56.498]
  - - [51520, 64, 2, 64]
    - [51, 60.648]
  - - [55296, 64, 2, 64]
    - [44, 61.709]
  - - [49152, 64, 2, 64]
    - [44, 60.156]
  - - [54400, 64, 2, 64]
    - [51, 61.403]
  - - [42240, 64, 2, 256]
    - [77, 67.154]
  - - [672, 512, 2, 2048]
    - [54, 49.421]
  - - [54400, 64, 2, 256]
    - [54, 69.059]
  - - [56832, 64, 2, 256]
    - [47, 69.254]
  - - [55296, 64, 2, 256]
    - [70, 69.951]
  - - [60800, 64, 2, 64]
    - [67, 62.293]
  - - [768, 512, 2, 2048]
    - [77, 57.063]
  - - [43008, 64, 2, 256]
    - [47, 68.318]
  - - [864, 256, 2, 2048]
    - [65, 46.918]
  - - [768, 256, 2, 2048]
    - [55, 43.113]
  - - [45632, 64, 2, 256]
    - [47, 66.447]
  - - [60800, 64, 2, 256]
    - [47, 69.061]
  - - [1024, 1024, 1, 81]
    - [67, 37.237]
  - - [950, 512, 2, 2048]
    - [55, 57.711]
  - - [850, 512, 2, 2048]
    - [55, 51.811]
  - - [805, 512, 2, 2048]
    - [63, 51.399]
  - - [950, 256, 2, 2048]
    - [78, 51.15]
  - - [1900, 512, 1, 1024]
    - [48, 56.279]
  - - [1700, 512, 1, 1024]
    - [48, 50.448]
  - - [1610, 512, 1, 1024]
    - [47, 56.195]
  - - [660, 512, 2, 2048]
    - [54, 48.466]
  - - [726, 512, 2, 2048]
    - [54, 53.376]
  - - [713, 512, 2, 2048]
    - [54, 52.361]
  - - [805, 256, 2, 2048]
    - [55, 43.733]
  - - [850, 256, 2, 2048]
    - [55, 46.118]
  - - [100, 128, 120, 512]
    - [77, 47.408]
  - - [100, 128, 139, 512]
    - [77, 48.597]
  - - [100, 128, 160, 512]
    - [77, 50.106]
  - - [22500, 64, 1, 147]
    - [45, 45.819]
  - - [96, 1024, 160, 1024]
    - [77, 52.812]
  - - [96, 1024, 40, 1024]
    - [55, 54.502]
  - - [96, 1024, 80, 1024]
    - [64, 52.315]
  - - [96, 1024, 96, 1024]
    - [54, 51.767]
  - - [96, 1024, 24, 1024]
    - [64, 50.039]
  - - [96, 1024, 48, 1024]
    - [55, 54.514]
  - - [96, 1024, 16, 1024]
    - [65, 47.258]
  - - [96, 1024, 32, 1024]
    - [54, 49.911]
  - - [64, 512, 320, 512]
    - [66, 44.141]
  - - [64, 1024, 512, 1024]
    - [79, 46.414]
  - - [1024, 77, 1, 30522]
    - [81, 33.292]
  - - [1024, 200, 1, 30522]
    - [81, 48.452]
  - - [1024, 160, 1, 30522]
    - [80, 46.668]
  - - [1024, 180, 1, 30522]
    - [80, 52.428]
  - - [1024, 160, 1, 30528]
    - [80, 46.766]
  - - [1024, 240, 1, 30528]
    - [81, 57.489]
  - - [2560, 109, 1, 29000]
    - [80, 49.144]
  - - [2560, 121, 1, 29000]
    - [80, 54.562]
  - - [2560, 65, 1, 29000]
    - [82, 29.622]
  - - [2560, 66, 1, 29000]
    - [80, 30.131]
  - - [2560, 67, 1, 29000]
    - [80, 30.604]
  - - [2560, 69, 1, 29000]
    - [80, 31.453]
  - - [2560, 70, 1, 29000]
    - [80, 31.99]
  - - [2560, 71, 1, 29000]
    - [80, 32.366]
  - - [2560, 73, 1, 29000]
    - [80, 33.29]
  - - [2560, 74, 1, 29000]
    - [80, 33.724]
  - - [2560, 75, 1, 29000]
    - [80, 34.254]
  - - [2560, 77, 1, 29000]
    - [80, 35.258]
  - - [2560, 78, 1, 29000]
    - [80, 35.706]
  - - [2560, 80, 1, 29000]
    - [80, 36.545]
  - - [2560, 81, 1, 29000]
    - [80, 36.912]
  - - [2560, 82, 1, 29000]
    - [80, 37.459]
  - - [2560, 83, 1, 29000]
    - [80, 37.828]
  - - [2560, 84, 1, 29000]
    - [80, 38.288]
  - - [2560, 88, 1, 29000]
    - [80, 40.082]
  - - [2560, 89, 1, 29000]
    - [82, 40.369]
  - - [2560, 90, 1, 29000]
    - [80, 40.917]
  - - [2560, 92, 1, 29000]
    - [80, 41.845]
  - - [2560, 95, 1, 29000]
    - [80, 43.244]
  - - [2560, 98, 1, 29000]
    - [80, 44.522]
  - - [2368, 64, 1, 3328]
    - [90, 20.882]
  - - [256, 704, 1, 1280]
    - [97, 24.291]
  - - [1408, 64, 1, 1280]
    - [90, 17.125]
  - - [1024, 256, 1, 3328]
    - [123, 31.257]
  - - [704, 128, 1, 1280]
    - [90, 17.253]
  - - [64, 3584, 1, 3328]
    - [97, 26.266]
  - - [1024, 256, 1, 256]
    - [123, 24.371]
  - - [448, 448, 1, 256]
    - [90, 20.788]
  - - [128, 1024, 1, 3328]
    - [107, 26.818]
  - - [64, 1856, 1, 1280]
    - [90, 22.437]
  - - [448, 256, 1, 256]
    - [102, 14.75]
  - - [256, 1024, 1, 256]
    - [109, 24.079]
  - - [1024, 128, 1, 1280]
    - [127, 23.63]
  - - [448, 256, 1, 3328]
    - [90, 23.442]
  - - [128, 704, 1, 1280]
    - [120, 17.106]
  - - [1856, 128, 1, 3328]
    - [85, 28.547]
  - - [256, 448, 1, 256]
    - [107, 14.627]
  - - [448, 448, 1, 3328]
    - [90, 27.961]
  - - [1408, 128, 1, 1280]
    - [90, 24.019]
  - - [128, 1856, 1, 1280]
    - [97, 26.702]
  - - [64, 1408, 1, 3328]
    - [127, 18.456]
  - - [256, 704, 1, 256]
    - [107, 18.791]
  - - [128, 1408, 1, 256]
    - [107, 18.728]
  - - [256, 448, 1, 3328]
    - [90, 23.442]
  - - [64, 2368, 1, 1280]
    - [97, 20.498]
  - - [2368, 64, 1, 256]
    - [90, 15.91]
  - - [704, 128, 1, 3328]
    - [90, 18.465]
  - - [4288, 64, 1, 1280]
    - [116, 30.802]
  - - [128, 1024, 1, 1280]
    - [90, 24.728]
  - - [128, 1024, 1, 256]
    - [102, 16.512]
  - - [1856, 64, 1, 256]
    - [102, 14.547]
  - - [704, 128, 1, 256]
    - [89, 12.876]
  - - [448, 256, 1, 1280]
    - [90, 21.769]
  - - [1856, 128, 1, 1280]
    - [104, 27.399]
  - - [64, 3584, 1, 256]
    - [109, 20.52]
  - - [64, 1856, 1, 256]
    - [102, 14.904]
  - - [256, 1024, 1, 1280]
    - [104, 29.989]
  - - [3584, 64, 1, 1280]
    - [85, 26.456]
  - - [1408, 128, 1, 3328]
    - [90, 24.978]
  - - [64, 2944, 1, 3328]
    - [107, 26.186]
  - - [64, 4288, 1, 3328]
    - [97, 31.202]
  - - [64, 2944, 1, 256]
    - [97, 19.384]
  - - [64, 1408, 1, 1280]
    - [102, 16.98]
  - - [64, 2944, 1, 1280]
    - [109, 25.217]
  - - [704, 256, 1, 256]
    - [90, 18.791]
  - - [256, 448, 1, 1280]
    - [107, 21.795]
  - - [704, 256, 1, 1280]
    - [90, 24.101]
  - - [64, 2368, 1, 3328]
    - [107, 21.128]
  - - [256, 704, 1, 3328]
    - [107, 25.178]
  - - [2944, 64, 1, 1280]
    - [90, 25.087]
  - - [128, 1408, 1, 3328]
    - [107, 25.152]
  - - [1408, 64, 1, 256]
    - [89, 12.758]
  - - [64, 2368, 1, 256]
    - [109, 16.129]
  - - [1024, 128, 1, 3328]
    - [113, 25.543]
  - - [2368, 64, 1, 1280]
    - [90, 20.32]
  - - [4288, 64, 1, 256]
    - [104, 25.21]
  - - [64, 4288, 1, 1280]
    - [123, 29.866]
  - - [1408, 64, 1, 3328]
    - [90, 18.437]
  - - [2944, 64, 1, 256]
    - [90, 19.514]
  - - [448, 448, 1, 1280]
    - [97, 26.934]
  - - [1024, 256, 1, 1280]
    - [123, 30.167]
  - - [3584, 64, 1, 3328]
    - [85, 27.327]
  - - [256, 1024, 1, 3328]
    - [97, 30.505]
  - - [1856, 64, 1, 3328]
    - [90, 21.634]
  - - [1856, 64, 1, 1280]
    - [90, 20.322]
  - - [1024, 128, 1, 256]
    - [120, 16.312]
  - - [64, 3584, 1, 1280]
    - [109, 25.248]
  - - [3584, 64, 1, 256]
    - [104, 21.195]
  - - [64, 1856, 1, 3328]
    - [102, 24.255]
  - - [1408, 128, 1, 256]
    - [107, 18.791]
  - - [128, 704, 1, 256]
    - [89, 12.816]
  - - [128, 704, 1, 3328]
    - [120, 18.391]
  - - [128, 1856, 1, 256]
    - [123, 21.504]
  - - [64, 4288, 1, 256]
    - [109, 24.199]
  - - [704, 256, 1, 3328]
    - [90, 25.142]
  - - [1856, 128, 1, 256]
    - [104, 22.355]
  - - [4288, 64, 1, 3328]
    - [104, 31.824]
  - - [64, 1408, 1, 256]
    - [89, 12.584]
  - - [2944, 64, 1, 3328]
    - [90, 26.005]
  - - [128, 1408, 1, 1280]
    - [97, 24.31]
  - - [128, 1856, 1, 3328]
    - [123, 27.71]
  - - [1760, 64, 1, 1760]
    - [90, 20.086]
  - - [2560, 32, 1, 2560]
    - [89, 15.842]
  - - [2048, 128, 1, 2048]
    - [116, 30.375]
  - - [4608, 32, 1, 1536]
    - [90, 26.589]
  - - [3072, 64, 1, 1024]
    - [172, 21.75]
  - - [128, 1500, 1, 1280]
    - [97, 25.856]
  - - [4096, 32, 1, 4096]
    - [107, 24.612]
  - - [1760, 128, 1, 1760]
    - [85, 26.367]
  - - [4096, 64, 1, 4096]
    - [85, 30.881]
  - - [7680, 32, 1, 2560]
    - [116, 28.313]
  - - [2560, 64, 1, 2560]
    - [90, 22.717]
  - - [3072, 32, 1, 1024]
    - [179, 9.981]
  - - [6144, 32, 1, 2560]
    - [107, 26.673]
  - - [176, 1500, 1, 1408]
    - [104, 29.757]
  - - [2048, 64, 1, 2048]
    - [102, 22.68]
  - - [8448, 32, 1, 2816]
    - [104, 30.924]
  - - [512, 512, 1, 64]
    - [116, 13.761]
  - - [32, 33, 1600, 33]
    - [95, 12.449]
  - - [256, 1024, 1, 1]
    - [105, 0.359]
  - - [257, 1024, 1, 4096]
    - [109, 24.969]
  - - [512, 200, 1, 1]
    - [96, 0.149]
  - - [512, 200, 1, 32]
    - [124, 3.872]
  - - [512, 215, 1, 2048]
    - [90, 21.2]
  - - [512, 256, 1, 2048]
    - [90, 25.625]
  - - [560, 200, 1, 1024]
    - [90, 19.753]
  - - [768, 215, 1, 2048]
    - [107, 22.328]
  - - [768, 256, 1, 2048]
    - [97, 26.956]
  - - [1024, 200, 1, 1]
    - [117, 0.285]
  - - [64, 32, 4608, 32]
    - [116, 32.193]
  - - [64, 34, 4736, 34]
    - [109, 18.521]
  - - [64, 35, 4608, 32]
    - [85, 19.792]
  - - [64, 35, 4608, 35]
    - [97, 18.839]
  - - [64, 33, 1920, 27]
    - [85, 16.196]
  - - [64, 33, 1920, 33]
    - [97, 16.445]
  - - [1225, 32, 64, 192]
    - [104, 33.608]
  - - [1225, 48, 64, 192]
    - [123, 26.191]
  - - [1225, 48, 64, 256]
    - [104, 26.35]
  - - [1225, 48, 64, 288]
    - [109, 26.461]
  - - [1225, 32, 32, 192]
    - [104, 31.46]
  - - [1225, 48, 32, 192]
    - [109, 25.323]
  - - [1225, 48, 32, 256]
    - [85, 25.528]
  - - [1225, 48, 32, 288]
    - [85, 25.733]
  - - [49, 2048, 64, 512]
    - [102, 25.822]
  - - [49, 512, 64, 2048]
    - [102, 25.005]
  - - [49, 2048, 32, 512]
    - [102, 25.448]
  - - [49, 512, 32, 2048]
    - [127, 23.58]
  - - [49, 2048, 64, 1024]
    - [127, 25.962]
  - - [49, 1024, 64, 2048]
    - [102, 25.803]
  - - [49, 2048, 32, 1024]
    - [102, 25.612]
  - - [49, 1024, 32, 2048]
    - [127, 25.022]
  - - [480, 512, 1, 512]
    - [116, 22.95]
  - - [512, 480, 1, 512]
    - [116, 25.711]
  - - [512, 512, 1, 512]
    - [116, 27.474]
  - - [1024, 160, 1, 1024]
    - [107, 21.472]
  - - [1024, 200, 1, 1024]
    - [109, 23.175]
  - - [1024, 308, 1, 1024]
    - [116, 28.525]
  - - [1024, 180, 1, 1024]
    - [127, 23.58]
  - - [256, 864, 1, 128]
    - [109, 16.732]
  - - [3136, 64, 1, 576]
    - [90, 24.539]
  - - [784, 128, 1, 1152]
    - [90, 18.437]
  - - [1024, 128, 1, 1024]
    - [173, 14.474]
  - - [1024, 128, 1, 2]
    - [86, 0.4]
  - - [1024, 96, 1, 1024]
    - [90, 17.928]
  - - [1024, 96, 1, 2]
    - [86, 0.299]
  - - [49, 2048, 128, 512]
    - [102, 26.112]
  - - [49, 2048, 256, 512]
    - [97, 26.685]
  - - [49, 512, 128, 2048]
    - [127, 25.552]
  - - [49, 512, 256, 2048]
    - [113, 26.194]
  - - [100, 128, 18, 512]
    - [109, 21.581]
  - - [100, 128, 19, 512]
    - [109, 20.481]
  - - [1444, 128, 1, 576]
    - [90, 22.053]
  - - [361, 512, 1, 2304]
    - [123, 25.557]
  - - [2560, 35, 1, 29000]
    - [120, 12.483]
  - - [2560, 36, 1, 29000]
    - [120, 12.787]
  - - [2560, 39, 1, 29000]
    - [120, 13.884]
  - - [2560, 40, 1, 29000]
    - [120, 14.217]
  - - [2560, 42, 1, 29000]
    - [120, 14.984]
  - - [2560, 43, 1, 29000]
    - [120, 15.319]
  - - [2560, 44, 1, 29000]
    - [120, 15.673]
  - - [2560, 46, 1, 29000]
    - [120, 16.399]
  - - [2560, 48, 1, 29000]
    - [120, 17.113]
  - - [2560, 49, 1, 29000]
    - [107, 17.402]
  - - [2560, 50, 1, 29000]
    - [120, 17.742]
  - - [2560, 51, 1, 29000]
    - [107, 18.097]
  - - [2560, 53, 1, 29000]
    - [127, 18.796]
  - - [2560, 54, 1, 29000]
    - [107, 19.191]
  - - [2560, 55, 1, 29000]
    - [120, 19.541]
  - - [2560, 56, 1, 29000]
    - [120, 19.922]
  - - [2560, 57, 1, 29000]
    - [120, 20.247]
  - - [2560, 58, 1, 29000]
    - [107, 20.59]
  - - [2560, 59, 1, 29000]
    - [120, 21.009]
  - - [2560, 61, 1, 29000]
    - [113, 21.644]
  - - [2560, 63, 1, 29000]
    - [127, 22.415]
  - - [1909283, 40, 1, 40]
    - [98, 18.362]
  - - [3818566, 40, 1, 40]
    - [87, 17.327]
  - - [1760, 32, 1, 1760]
    - [131, 13.612]
  - - [7680, 4, 1, 2560]
    - [136, 7.178]
  - - [3072, 16, 1, 1024]
    - [172, 5.087]
  - - [2048, 16, 1, 2048]
    - [154, 10.889]
  - - [3072, 1, 1, 128]
    - [101, 0.335]
  - - [8448, 16, 1, 2816]
    - [139, 22.651]
  - - [7680, 2, 1, 2560]
    - [147, 3.605]
  - - [4224, 1, 1, 128]
    - [133, 0.453]
  - - [7680, 1, 1, 2560]
    - [152, 1.789]
  - - [6144, 2, 1, 2560]
    - [138, 3.395]
  - - [1760, 16, 1, 1760]
    - [93, 9.365]
  - - [6144, 4, 1, 2560]
    - [138, 6.802]
  - - [3072, 4, 1, 1024]
    - [135, 3.504]
  - - [2048, 32, 1, 2048]
    - [137, 16.874]
  - - [4608, 16, 1, 1536]
    - [139, 17.894]
  - - [3072, 2, 1, 1024]
    - [135, 1.765]
  - - [8448, 1, 1, 2816]
    - [136, 2.12]
  - - [6144, 1, 1, 2560]
    - [144, 1.717]
  - - [4608, 1, 1, 1536]
    - [148, 1.343]
  - - [8448, 4, 1, 2816]
    - [147, 8.473]
  - - [4608, 2, 1, 1536]
    - [148, 2.691]
  - - [2560, 16, 1, 2560]
    - [138, 12.418]
  - - [6144, 16, 1, 2560]
    - [139, 20.199]
  - - [4096, 16, 1, 4096]
    - [153, 17.704]
  - - [7680, 16, 1, 2560]
    - [139, 20.11]
  - - [3072, 1, 1, 1024]
    - [154, 0.88]
  - - [8448, 2, 1, 2816]
    - [152, 4.239]
  - - [4608, 4, 1, 1536]
    - [148, 5.367]
  - - [2048, 2, 1, 2048]
    - [138, 1.391]
  - - [2048, 2, 1, 2]
    - [129, 0.012]
  - - [2560, 4, 1, 2]
    - [129, 0.029]
  - - [2560, 4, 1, 2560]
    - [138, 3.489]
  - - [2048, 1, 1, 512]
    - [93, 0.48]
  - - [12288, 12, 2, 256]
    - [134, 16.37]
  - - [12288, 3, 2, 256]
    - [134, 6.252]
  - - [51520, 12, 2, 256]
    - [142, 19.743]
  - - [51520, 3, 2, 256]
    - [149, 8.017]
  - - [15200, 12, 2, 256]
    - [132, 16.582]
  - - [15200, 3, 2, 256]
    - [130, 6.749]
  - - [3456, 3, 2, 256]
    - [138, 3.091]
  - - [13600, 12, 2, 256]
    - [132, 16.763]
  - - [12880, 3, 2, 256]
    - [130, 6.412]
  - - [3400, 3, 2, 256]
    - [151, 3.012]
  - - [12880, 12, 2, 256]
    - [132, 16.061]
  - - [13824, 12, 2, 256]
    - [132, 17.151]
  - - [13824, 3, 2, 256]
    - [130, 6.846]
  - - [13600, 3, 2, 256]
    - [130, 6.807]
  - - [3456, 12, 2, 256]
    - [148, 10.241]
  - - [3800, 3, 2, 256]
    - [145, 3.335]
  - - [3400, 12, 2, 256]
    - [133, 9.995]
  - - [3800, 12, 2, 256]
    - [132, 10.622]
  - - [55296, 3, 2, 256]
    - [134, 7.846]
  - - [3072, 3, 2, 256]
    - [131, 2.816]
  - - [3072, 12, 2, 256]
    - [132, 9.522]
  - - [54400, 3, 2, 256]
    - [143, 8.143]
  - - [60800, 12, 2, 256]
    - [146, 19.813]
  - - [60800, 3, 2, 256]
    - [141, 8.329]
  - - [3220, 3, 2, 256]
    - [131, 2.894]
  - - [3220, 12, 2, 256]
    - [132, 9.98]
  - - [2048, 8, 1, 2]
    - [129, 0.048]
  - - [2048, 8, 1, 2048]
    - [138, 5.597]
  - - [2560, 2, 1, 2]
    - [129, 0.014]
  - - [2560, 2, 1, 2560]
    - [148, 1.743]
  - - [2560, 27, 1, 29000]
    - [139, 15.09]
  - - [1909283, 11, 1, 11]
    - [150, 9.696]
  - - [3818566, 11, 1, 11]
    - [140, 7.641]
  - - [512, 16, 1, 500000]
    - [160, 9.462]
  - - [512, 2, 1, 500000]
    - [157, 1.182]
  - - [1024, 16, 1, 500000]
    - [158, 11.844]
  - - [1024, 4, 1, 500000]
    - [158, 2.915]
  - - [512, 8, 1, 500000]
    - [157, 4.741]
  - - [512, 1, 1, 500000]
    - [155, 0.588]
  - - [512, 4, 1, 500000]
    - [157, 2.363]
  - - [1024, 1, 1, 500000]
    - [155, 0.721]
  - - [1024, 2, 1, 500000]
    - [156, 1.449]
  - - [1024, 8, 1, 500000]
    - [160, 5.811]
  - - [49, 512, 1, 4608]
    - [159, 10.59]
  - - [448, 64, 1, 1280]
    - [93, 8.396]
  - - [64, 1024, 1, 1280]
    - [89, 14.984]
  - - [64, 704, 1, 1280]
    - [101, 12.437]
  - - [256, 128, 1, 256]
    - [99, 6.129]
  - - [64, 1024, 1, 3328]
    - [89, 16.033]
  - - [1024, 64, 1, 1280]
    - [106, 14.938]
  - - [256, 256, 1, 3328]
    - [89, 15.994]
  - - [64, 448, 1, 1280]
    - [93, 9.124]
  - - [64, 64, 1, 3328]
    - [103, 1.632]
  - - [704, 64, 1, 3328]
    - [108, 12.425]
  - - [64, 128, 1, 256]
    - [101, 1.632]
  - - [704, 64, 1, 1280]
    - [101, 11.926]
  - - [128, 448, 1, 256]
    - [89, 9.414]
  - - [448, 64, 1, 3328]
    - [93, 10.243]
  - - [64, 128, 1, 3328]
    - [114, 3.25]
  - - [128, 128, 1, 3328]
    - [103, 6.503]
  - - [256, 256, 1, 256]
    - [89, 10.701]
  - - [128, 64, 1, 1280]
    - [103, 2.84]
  - - [64, 1024, 1, 256]
    - [89, 10.59]
  - - [64, 704, 1, 256]
    - [101, 8.179]
  - - [1, 1, 1, 1280]
    - [86, 0.0]
  - - [256, 64, 1, 3328]
    - [108, 6.522]
  - - [448, 128, 1, 256]
    - [89, 9.515]
  - - [64, 704, 1, 3328]
    - [112, 13.906]
  - - [64, 448, 1, 3328]
    - [108, 10.19]
  - - [448, 128, 1, 3328]
    - [89, 14.065]
  - - [128, 256, 1, 1280]
    - [108, 10.361]
  - - [64, 448, 1, 256]
    - [112, 5.565]
  - - [64, 256, 1, 1280]
    - [103, 5.657]
  - - [64, 128, 1, 1280]
    - [103, 2.848]
  - - [64, 64, 1, 256]
    - [101, 0.815]
  - - [256, 128, 1, 1280]
    - [108, 10.383]
  - - [128, 256, 1, 3328]
    - [93, 11.707]
  - - [256, 64, 1, 256]
    - [99, 3.241]
  - - [128, 128, 1, 1280]
    - [103, 5.645]
  - - [128, 256, 1, 256]
    - [99, 6.168]
  - - [256, 64, 1, 1280]
    - [122, 5.681]
  - - [704, 64, 1, 256]
    - [101, 8.133]
  - - [128, 448, 1, 1280]
    - [89, 13.209]
  - - [64, 64, 1, 1280]
    - [103, 1.408]
  - - [128, 64, 1, 3328]
    - [93, 3.238]
  - - [448, 64, 1, 256]
    - [101, 5.43]
  - - [1024, 64, 1, 256]
    - [89, 10.646]
  - - [1, 1, 1, 1]
    - [110, 0.0]
  - - [448, 128, 1, 1280]
    - [89, 13.247]
  - - [1024, 64, 1, 3328]
    - [119, 15.926]
  - - [128, 64, 1, 256]
    - [99, 1.632]
  - - [64, 256, 1, 3328]
    - [114, 6.496]
  - - [256, 256, 1, 1280]
    - [89, 14.916]
  - - [256, 128, 1, 3328]
    - [93, 11.719]
  - - [64, 256, 1, 256]
    - [101, 3.241]
  - - [1, 1, 1, 256]
    - [86, 0.0]
  - - [128, 448, 1, 3328]
    - [106, 14.082]
  - - [128, 128, 1, 256]
    - [99, 3.241]
  - - [1024, 16, 1, 512]
    - [93, 4.285]
  - - [512, 16, 1, 512]
    - [108, 2.144]
  - - [128, 1, 1, 1408]
    - [92, 0.041]
  - - [64, 1, 1, 1216]
    - [92, 0.022]
  - - [1024, 2, 1, 512]
    - [93, 0.506]
  - - [512, 1, 1, 512]
    - [92, 0.125]
  - - [1024, 4, 1, 512]
    - [93, 1.015]
  - - [512, 4, 1, 512]
    - [92, 0.497]
  - - [1024, 32, 1, 512]
    - [108, 8.09]
  - - [512, 2, 1, 512]
    - [92, 0.251]
  - - [1024, 1, 1, 512]
    - [93, 0.251]
  - - [512, 32, 1, 512]
    - [108, 4.268]
  - - [128, 1, 1, 1024]
    - [103, 0.041]
  - - [64, 14, 1, 14]
    - [121, 0.019]
  - - [64, 14, 1, 15]
    - [88, 0.017]
  - - [64, 15, 1, 15]
    - [91, 0.022]
  - - [64, 15, 1, 17]
    - [83, 0.022]
  - - [64, 17, 1, 17]
    - [86, 0.029]
  - - [64, 17, 1, 21]
    - [83, 0.029]
  - - [64, 21, 1, 21]
    - [83, 0.036]
  - - [64, 24, 1, 24]
    - [86, 0.046]
  - - [64, 24, 1, 34]
    - [88, 0.06]
  - - [64, 30, 1, 30]
    - [83, 0.068]
  - - [64, 31, 1, 30]
    - [83, 0.07]
  - - [64, 31, 1, 31]
    - [83, 0.072]
  - - [64, 32, 1, 32]
    - [88, 0.094]
  - - [64, 34, 1, 34]
    - [92, 0.094]
  - - [64, 35, 1, 32]
    - [91, 0.084]
  - - [64, 35, 1, 35]
    - [88, 0.089]
  - - [64, 512, 1, 512]
    - [112, 8.124]
  - - [1024, 4, 1, 2]
    - [83, 0.012]
  - - [1024, 4, 1, 1024]
    - [93, 1.304]
  - - [1024, 32, 1, 2]
    - [86, 0.101]
  - - [1024, 32, 1, 1024]
    - [170, 3.423]
  - - [32, 200, 1, 1]
    - [83, 0.01]
  - - [64, 3, 512, 3]
    - [115, 0.292]
  - - [64, 5, 512, 5]
    - [115, 0.767]
  - - [64, 5, 960, 5]
    - [115, 0.996]
  - - [64, 9, 512, 9]
    - [104, 2.337]
  - - [64, 512, 1, 1]
    - [118, 0.051]
  - - [67, 512, 1, 2048]
    - [126, 10.096]
  - - [74, 512, 1, 2048]
    - [126, 11.176]
  - - [74, 960, 1, 2048]
    - [102, 13.682]
  - - [100, 512, 1, 2048]
    - [101, 12.109]
  - - [128, 27, 32768, 27]
    - [94, 10.945]
  - - [64, 14, 10880, 14]
    - [97, 10.513]
  - - [64, 14, 10880, 15]
    - [97, 10.998]
  - - [64, 15, 7680, 15]
    - [97, 11.434]
  - - [64, 15, 10880, 15]
    - [97, 11.777]
  - - [64, 15, 7680, 17]
    - [109, 12.592]
  - - [64, 17, 6144, 17]
    - [109, 13.937]
  - - [64, 17, 7680, 17]
    - [109, 14.33]
  - - [64, 17, 6144, 21]
    - [85, 15.085]
  - - [64, 21, 6144, 21]
    - [109, 18.306]
  - - [64, 24, 4736, 24]
    - [109, 23.259]
  - - [64, 24, 4736, 34]
    - [85, 24.421]
  - - [64, 30, 2048, 30]
    - [85, 24.436]
  - - [64, 31, 2048, 30]
    - [85, 24.993]
  - - [64, 31, 2048, 31]
    - [104, 25.311]
  - - [64, 27, 1920, 27]
    - [109, 20.768]
  - - [1024, 8, 1, 1024]
    - [103, 2.426]
  - - [1024, 77, 1, 1024]
    - [89, 14.294]
  - - [1024, 10, 1, 2]
    - [84, 0.029]
  - - [1024, 10, 1, 1024]
    - [103, 3.224]
  - - [1024, 39, 1, 2]
    - [86, 0.118]
  - - [1024, 39, 1, 1024]
    - [108, 9.725]
  - - [1024, 40, 1, 2]
    - [86, 0.123]
  - - [1024, 40, 1, 1024]
    - [108, 9.973]
  - - [1024, 41, 1, 2]
    - [96, 0.125]
  - - [1024, 41, 1, 1024]
    - [122, 10.202]
  - - [1024, 5, 1, 2]
    - [83, 0.014]
  - - [1024, 5, 1, 1024]
    - [93, 1.62]
  - - [1024, 6, 1, 2]
    - [86, 0.019]
  - - [1024, 6, 1, 1024]
    - [93, 1.946]
  - - [1024, 8, 1, 2]
    - [86, 0.024]
  - - [1024, 9, 1, 2]
    - [84, 0.027]
  - - [1024, 9, 1, 1024]
    - [93, 2.903]
  - - [64, 4, 32768, 4]
    - [85, 1.28]
  - - [64, 4, 38400, 4]
    - [85, 1.283]
  - - [128, 128, 1, 64]
    - [89, 1.304]
  - - [64, 128, 1, 128]
    - [101, 1.063]
  - - [64, 5, 1, 5]
    - [83, 0.002]
  - - [32, 33, 1, 33]
    - [86, 0.046]
  - - [1024, 16, 1, 2]
    - [86, 0.055]
  - - [1024, 16, 1, 1024]
    - [170, 1.71]
  - - [1024, 1, 1, 2]
    - [83, 0.002]
  - - [1024, 1, 1, 1024]
    - [93, 0.326]
  - - [1024, 1, 1, 200]
    - [101, 0.152]
  - - [1024, 1, 1, 1600]
    - [93, 0.357]
  - - [1024, 64, 1, 2]
    - [124, 0.2]
  - - [1024, 64, 1, 1024]
    - [172, 7.322]
  - - [1024, 80, 1, 1024]
    - [89, 15.005]
  - - [1024, 80, 1, 2]
    - [124, 0.246]
  - - [1024, 82, 1, 1024]
    - [90, 14.873]
  - - [1024, 82, 1, 2]
    - [110, 0.253]
  - - [1024, 12, 1, 1024]
    - [93, 3.87]
  - - [1024, 12, 1, 2]
    - [86, 0.036]
  - - [64, 24, 6816, 24]
    - [97, 24.831]
  - - [64, 26, 6272, 26]
    - [116, 25.518]
  - - [196, 256, 1, 2304]
    - [125, 13.074]
  - - [768, 3, 2, 256]
    - [99, 0.796]
  - - [768, 12, 2, 256]
    - [99, 3.161]
  - - [864, 12, 2, 256]
    - [93, 3.496]
  - - [864, 3, 2, 256]
    - [93, 0.88]
  - - [216, 3, 2, 256]
    - [101, 0.227]
  - - [176, 12, 2, 256]
    - [111, 0.728]
  - - [176, 3, 2, 256]
    - [99, 0.183]
  - - [192, 12, 2, 256]
    - [125, 0.822]
  - - [192, 3, 2, 256]
    - [99, 0.205]
  - - [216, 12, 2, 256]
    - [101, 0.904]
  - - [850, 3, 2, 256]
    - [101, 0.87]
  - - [850, 12, 2, 256]
    - [101, 3.46]
  - - [805, 12, 2, 256]
    - [93, 3.277]
  - - [805, 3, 2, 256]
    - [93, 0.82]
  - - [247, 3, 2, 256]
    - [99, 0.26]
  - - [950, 3, 2, 256]
    - [93, 0.962]
  - - [187, 12, 2, 256]
    - [99, 0.784]
  - - [247, 12, 2, 256]
    - [125, 1.051]
  - - [187, 3, 2, 256]
    - [99, 0.195]
  - - [228, 12, 2, 256]
    - [125, 0.96]
  - - [221, 12, 2, 256]
    - [101, 0.936]
  - - [950, 12, 2, 256]
    - [93, 3.824]
  - - [228, 3, 2, 256]
    - [99, 0.239]
  - - [221, 3, 2, 256]
    - [101, 0.231]
  - - [25, 128, 120, 256]
    - [100, 15.678]
  - - [25, 128, 139, 256]
    - [100, 15.926]
  - - [25, 128, 160, 256]
    - [100, 15.963]
  - - [25, 128, 18, 256]
    - [101, 8.345]
  - - [25, 128, 19, 256]
    - [89, 8.124]
  - - [9, 128, 120, 256]
    - [111, 6.928]
  - - [9, 128, 139, 256]
    - [99, 6.402]
  - - [9, 128, 160, 256]
    - [111, 6.6]
  - - [9, 128, 18, 256]
    - [99, 3.332]
  - - [9, 128, 19, 256]
    - [125, 3.537]
  - - [100, 512, 1, 2304]
    - [89, 12.346]
  - - [25, 256, 1, 1152]
    - [128, 2.057]
  - - [9, 256, 1, 1152]
    - [93, 0.74]
  - - [1024, 20, 1, 1024]
    - [108, 6.021]
  - - [1024, 20, 1, 2]
    - [86, 0.06]
  - - [768, 1, 1, 1]
    - [161, 0.0]
  - - [768, 2, 1, 1]
    - [162, 0.001]
  - - [768, 4, 1, 1]
    - [163, 0.001]
  - - [768, 8, 1, 1]
    - [164, 0.002]
  - - [768, 16, 1, 1]
    - [165, 0.004]
  - - [768, 32, 1, 1]
    - [161, 0.009]
  - - [768, 64, 1, 1]
    - [161, 0.019]
  - - [768, 128, 1, 1]
    - [161, 0.04]
  - - [768, 256, 1, 1]
    - [164, 0.082]
  - - [768, 384, 1, 1]
    - [166, 0.122]
  - - [768, 512, 1, 1]
    - [162, 0.161]
  - - [768, 768, 1, 1]
    - [167, 0.222]
  - - [768, 1024, 1, 1]
    - [166, 0.287]
  - - [768, 1536, 1, 1]
    - [162, 0.404]
  - - [768, 2048, 1, 1]
    - [168, 0.491]
  - - [768, 3072, 1, 1]
    - [169, 0.624]
  - - [768, 4096, 1, 1]
    - [170, 0.772]
  - - [768, 6144, 1, 1]
    - [171, 0.998]
  - - [768, 8192, 1, 1]
    - [172, 1.148]
  - - [768, 12288, 1, 1]
    - [173, 1.388]
  - - [768, 16384, 1, 1]
    - [174, 1.525]
  - - [768, 16, 1, 768]
    - [172, 0.854]
  - - [768, 32, 1, 768]
    - [175, 2.076]
  - - [768, 64, 1, 768]
    - [172, 4.141]
  - - [768, 128, 1, 768]
    - [172, 10.849]
  - - [768, 256, 1, 768]
    - [172, 21.62]
  - - [768, 384, 1, 768]
    - [167, 23.46]
  - - [768, 512, 1, 768]
    - [167, 31.145]
  - - [768, 768, 1, 768]
    - [162, 45.701]
  - - [768, 1024, 1, 768]
    - [172, 47.594]
  - - [768, 1536, 1, 768]
    - [176, 61.09]
  - - [768, 3072, 1, 768]
    - [177, 75.199]
  - - [768, 4096, 1, 768]
    - [178, 72.619]
  - - [768, 6144, 1, 768]
    - [178, 84.738]
  - - [768, 16, 1, 3072]
    - [179, 1.786]
  - - [768, 32, 1, 3072]
    - [179, 3.567]
  - - [768, 64, 1, 3072]
    - [172, 7.349]
  - - [768, 128, 1, 3072]
    - [170, 14.25]
  - - [768, 256, 1, 3072]
    - [170, 28.312]
  - - [768, 384, 1, 3072]
    - [167, 32.003]
  - - [768, 512, 1, 3072]
    - [162, 42.621]
  - - [768, 768, 1, 3072]
    - [180, 62.648]
  - - [768, 1024, 1, 3072]
    - [174, 59.07]
  - - [768, 1536, 1, 3072]
    - [181, 75.148]
  - - [768, 3072, 1, 3072]
    - [182, 85.879]
  - - [768, 4096, 1, 3072]
    - [183, 78.914]
  - - [768, 6144, 1, 3072]
    - [182, 90.631]
  - - [1024, 1, 1, 1]
    - [171, 0.0]
  - - [1024, 2, 1, 1]
    - [167, 0.001]
  - - [1024, 4, 1, 1]
    - [164, 0.001]
  - - [1024, 8, 1, 1]
    - [164, 0.003]
  - - [1024, 16, 1, 1]
    - [161, 0.006]
  - - [1024, 32, 1, 1]
    - [169, 0.011]
  - - [1024, 64, 1, 1]
    - [161, 0.027]
  - - [1024, 128, 1, 1]
    - [165, 0.054]
  - - [1024, 256, 1, 1024]
    - [173, 28.464]
  - - [1024, 384, 1, 1024]
    - [184, 33.829]
  - - [1024, 768, 1, 1024]
    - [175, 50.7]
  - - [1024, 1536, 1, 1024]
    - [181, 65.031]
  - - [1024, 16, 1, 4096]
    - [179, 2.506]
  - - [1024, 32, 1, 4096]
    - [179, 5.013]
  - - [1024, 64, 1, 4096]
    - [170, 10.219]
  - - [1024, 128, 1, 4096]
    - [170, 19.8]
  - - [1024, 256, 1, 4096]
    - [173, 39.943]
  - - [1024, 384, 1, 4096]
    - [185, 43.597]
  - - [1024, 768, 1, 4096]
    - [173, 60.427]
  - - [1024, 1536, 1, 4096]
    - [181, 72.789]
  - - [2304, 16, 1, 1]
    - [166, 0.013]
  - - [2304, 32, 1, 1]
    - [166, 0.025]
  - - [2304, 64, 1, 1]
    - [164, 0.061]
  - - [2304, 128, 1, 1]
    - [172, 0.119]
  - - [2304, 256, 1, 1]
    - [165, 0.224]
  - - [2304, 384, 1, 1]
    - [172, 0.314]
  - - [2304, 512, 1, 1]
    - [166, 0.403]
  - - [2304, 768, 1, 1]
    - [161, 0.528]
  - - [2304, 1024, 1, 1]
    - [172, 0.66]
  - - [2304, 1536, 1, 1]
    - [174, 0.848]
  - - [2304, 2048, 1, 1]
    - [164, 1.005]
  - - [2304, 3072, 1, 1]
    - [173, 1.237]
  - - [2304, 4096, 1, 1]
    - [165, 1.428]
  - - [2304, 6144, 1, 1]
    - [184, 1.514]
  - - [2304, 8192, 1, 1]
    - [171, 1.639]
  - - [2304, 12288, 1, 1]
    - [186, 2.121]
  - - [2304, 16384, 1, 1]
    - [161, 2.32]
  - - [2304, 24576, 1, 1]
    - [176, 2.696]
  - - [2304, 32768, 1, 1]
    - [165, 2.355]
  - - [2304, 49152, 1, 1]
    - [187, 1.163]
  - - [2304, 65536, 1, 1]
    - [172, 1.174]
  - - [2304, 98304, 1, 1]
    - [172, 1.182]
  - - [2304, 131072, 1, 1]
    - [173, 1.186]
  - - [2304, 16, 1, 768]
    - [172, 2.992]
  - - [2304, 32, 1, 768]
    - [170, 6.641]
  - - [2304, 64, 1, 768]
    - [172, 12.278]
  - - [2304, 128, 1, 768]
    - [179, 23.46]
  - - [2304, 256, 1, 768]
    - [173, 45.36]
  - - [2304, 384, 1, 768]
    - [163, 46.625]
  - - [2304, 512, 1, 768]
    - [162, 61.295]
  - - [2304, 768, 1, 768]
    - [184, 66.657]
  - - [2304, 1024, 1, 768]
    - [178, 75.773]
  - - [2304, 1536, 1, 768]
    - [188, 81.009]
  - - [2304, 2048, 1, 768]
    - [178, 84.787]
  - - [2304, 3072, 1, 768]
    - [178, 88.063]
  - - [2304, 4096, 1, 768]
    - [178, 89.844]
  - - [2304, 6144, 1, 768]
    - [178, 91.666]
  - - [3072, 16, 1, 1]
    - [164, 0.017]
  - - [3072, 32, 1, 1]
    - [179, 0.033]
  - - [3072, 64, 1, 1]
    - [164, 0.075]
  - - [3072, 128, 1, 1]
    - [165, 0.156]
  - - [3072, 256, 1, 1]
    - [171, 0.281]
  - - [3072, 384, 1, 1]
    - [166, 0.398]
  - - [3072, 512, 1, 1]
    - [184, 0.48]
  - - [3072, 768, 1, 1]
    - [168, 0.654]
  - - [3072, 1024, 1, 1]
    - [166, 0.782]
  - - [3072, 1536, 1, 1]
    - [161, 1.003]
  - - [3072, 2048, 1, 1]
    - [165, 1.163]
  - - [3072, 3072, 1, 1]
    - [165, 1.413]
  - - [3072, 4096, 1, 1]
    - [168, 1.502]
  - - [3072, 6144, 1, 1]
    - [189, 1.881]
  - - [3072, 8192, 1, 1]
    - [166, 2.116]
  - - [3072, 12288, 1, 1]
    - [161, 2.334]
  - - [3072, 16384, 1, 1]
    - [161, 2.451]
  - - [3072, 24576, 1, 1]
    - [165, 1.916]
  - - [3072, 32768, 1, 1]
    - [172, 1.157]
  - - [3072, 49152, 1, 1]
    - [173, 1.173]
  - - [3072, 65536, 1, 1]
    - [173, 1.181]
  - - [3072, 16, 1, 768]
    - [172, 4.02]
  - - [3072, 32, 1, 768]
    - [173, 9.694]
  - - [3072, 64, 1, 768]
    - [179, 16.595]
  - - [3072, 128, 1, 768]
    - [175, 30.751]
  - - [3072, 256, 1, 768]
    - [170, 47.594]
  - - [3072, 384, 1, 768]
    - [180, 61.124]
  - - [3072, 512, 1, 768]
    - [190, 61.606]
  - - [3072, 768, 1, 768]
    - [191, 75.173]
  - - [3072, 1024, 1, 768]
    - [188, 72.384]
  - - [3072, 1536, 1, 768]
    - [191, 84.134]
  - - [3072, 3072, 1, 768]
    - [178, 89.074]
  - - [3072, 4096, 1, 768]
    - [178, 88.231]
  - - [3072, 6144, 1, 768]
    - [178, 92.487]
  - - [3072, 256, 1, 1024]
    - [175, 50.516]
  - - [3072, 384, 1, 1024]
    - [180, 64.756]
  - - [3072, 512, 1, 1024]
    - [181, 64.771]
  - - [3072, 768, 1, 1024]
    - [183, 77.548]
  - - [3072, 1024, 1, 1024]
    - [181, 74.016]
  - - [3072, 1536, 1, 1024]
    - [181, 85.405]
  - - [3072, 2048, 1, 1024]
    - [181, 85.562]
  - - [3072, 3072, 1, 1024]
    - [181, 90.024]
  - - [3072, 4096, 1, 1024]
    - [181, 89.12]
  - - [4096, 16, 1, 1024]
    - [179, 6.771]
  - - [4096, 32, 1, 1024]
    - [172, 13.253]
  - - [4096, 64, 1, 1024]
    - [179, 28.793]
  - - [4096, 128, 1, 1024]
    - [173, 44.062]
  - - [4096, 256, 1, 1024]
    - [184, 57.869]
  - - [4096, 384, 1, 1024]
    - [191, 64.771]
  - - [4096, 768, 1, 1024]
    - [192, 72.51]
  - - [4096, 1536, 1, 1024]
    - [181, 84.721]
- null
