library/src/blas3/Tensile/Logic/asm_full/navi22_Cijk_Ailk_Bjlk_HBH_GB.yaml
---
- {MinimumRequiredVersion: 4.28.0}
- navi22
- gfx1031
    SolutionIndex: 0
    SolutionNameMin: Cijk_Ailk_Bjlk_HBH_GB_MT128x128x8_SN_SU0_SUM0_TT8_16_WG16_8_1_WGM1
    SolutionIndex: 1
    SolutionNameMin: Cijk_Ailk_Bjlk_HBH_GB_MT128x64x16_SN_SU0_SUM0_TT8_8_WG16_8_1_WGM1
    SolutionIndex: 2
    SolutionNameMin: Cijk_Ailk_Bjlk_HBH_GB_MT128x128x16_SN_SU0_SUM0_TT8_16_WG16_8_1_WGM1
    SolutionIndex: 3
    SolutionNameMin: Cijk_Ailk_Bjlk_HBH_GB_MT128x128x16_SN_SU0_SUM0_TT8_8_WG16_16_1_WGM1
    SolutionIndex: 4
    SolutionNameMin: Cijk_Ailk_Bjlk_HBH_GB_MT128x128x32_SN_SU0_SUM0_TT8_16_WG16_8_1_WGM1
    SolutionIndex: 5
    SolutionNameMin: Cijk_Ailk_Bjlk_HBH_GB_MT128x128x32_SN_SU0_SUM0_TT8_8_WG16_16_1_WGM1
    SolutionIndex: 6
    SolutionNameMin: Cijk_Ailk_Bjlk_HBH_GB_MT128x128x8_SN_SU32_SUM3_TT8_16_WG16_8_1_WGM1
    SolutionIndex: 7
    SolutionNameMin: Cijk_Ailk_Bjlk_HBH_GB_MT128x64x16_SN_SU32_SUM3_TT8_8_WG16_8_1_WGM1
    SolutionIndex: 8
    SolutionNameMin: Cijk_Ailk_Bjlk_HBH_GB_MT128x128x16_SN_SU32_SUM3_TT8_16_WG16_8_1_WGM1
    SolutionIndex: 9
    SolutionNameMin: Cijk_Ailk_Bjlk_HBH_GB_MT128x128x16_SN_SU32_SUM3_TT8_8_WG16_16_1_WGM1
    SolutionIndex: 10
    SolutionNameMin: Cijk_Ailk_Bjlk_HBH_GB_MT128x128x32_SN_SU32_SUM3_TT8_16_WG16_8_1_WGM1
    SolutionIndex: 11
    SolutionNameMin: Cijk_Ailk_Bjlk_HBH_GB_MT128x128x32_SN_SU32_SUM3_TT8_8_WG16_16_1_WGM1
    SolutionIndex: 12
    SolutionNameMin: Cijk_Ailk_Bjlk_HBH_GB_MT128x64x16_SN_SU0_SUM0_TT8_8_WG16_8_1_WGM4
    SolutionIndex: 13
    SolutionNameMin: Cijk_Ailk_Bjlk_HBH_GB_MT128x128x16_SN_SU0_SUM0_TT8_16_WG16_8_1_WGM4
    SolutionIndex: 14
    SolutionNameMin: Cijk_Ailk_Bjlk_HBH_GB_MT128x128x16_SN_SU0_SUM0_TT8_8_WG16_16_1_WGM4
    SolutionIndex: 15
    SolutionNameMin: Cijk_Ailk_Bjlk_HBH_GB_MT128x128x32_SN_SU0_SUM0_TT8_16_WG16_8_1_WGM4
    SolutionIndex: 16
    SolutionNameMin: Cijk_Ailk_Bjlk_HBH_GB_MT128x128x32_SN_SU0_SUM0_TT8_8_WG16_16_1_WGM4
    SolutionIndex: 17
    SolutionNameMin: Cijk_Ailk_Bjlk_HBH_GB_MT128x128x8_SN_SU32_SUM3_TT8_16_WG16_8_1_WGM4
    SolutionIndex: 18
    SolutionNameMin: Cijk_Ailk_Bjlk_HBH_GB_MT128x64x16_SN_SU32_SUM3_TT8_8_WG16_8_1_WGM4
    SolutionIndex: 19
    SolutionNameMin: Cijk_Ailk_Bjlk_HBH_GB_MT128x128x16_SN_SU32_SUM3_TT8_16_WG16_8_1_WGM4
    SolutionIndex: 20
    SolutionNameMin: Cijk_Ailk_Bjlk_HBH_GB_MT128x128x16_SN_SU32_SUM3_TT8_8_WG16_16_1_WGM4
    SolutionIndex: 21
    SolutionNameMin: Cijk_Ailk_Bjlk_HBH_GB_MT128x128x8_SN_SU0_SUM0_TT8_16_WG16_8_1_WGM8
    SolutionIndex: 22
    SolutionNameMin: Cijk_Ailk_Bjlk_HBH_GB_MT128x64x16_SN_SU0_SUM0_TT8_8_WG16_8_1_WGM8
    SolutionIndex: 23
    SolutionNameMin: Cijk_Ailk_Bjlk_HBH_GB_MT128x128x16_SN_SU0_SUM0_TT8_16_WG16_8_1_WGM8
    SolutionIndex: 24
    SolutionNameMin: Cijk_Ailk_Bjlk_HBH_GB_MT128x128x16_SN_SU0_SUM0_TT8_8_WG16_16_1_WGM8
    SolutionIndex: 25
    SolutionNameMin: Cijk_Ailk_Bjlk_HBH_GB_MT128x64x32_SN_SU0_SUM0_TT8_8_WG16_8_1_WGM8
    SolutionIndex: 26
    SolutionNameMin: Cijk_Ailk_Bjlk_HBH_GB_MT128x128x32_SN_SU0_SUM0_TT8_16_WG16_8_1_WGM8
    SolutionIndex: 27
    SolutionNameMin: Cijk_Ailk_Bjlk_HBH_GB_MT128x128x32_SN_SU0_SUM0_TT8_8_WG16_16_1_WGM8
    SolutionIndex: 28
    SolutionNameMin: Cijk_Ailk_Bjlk_HBH_GB_MT128x128x8_SN_SU32_SUM3_TT8_16_WG16_8_1_WGM8
    SolutionIndex: 29
    SolutionNameMin: Cijk_Ailk_Bjlk_HBH_GB_MT128x64x16_SN_SU32_SUM3_TT8_8_WG16_8_1_WGM8
    SolutionIndex: 30
    SolutionNameMin: Cijk_Ailk_Bjlk_HBH_GB_MT128x128x16_SN_SU32_SUM3_TT8_16_WG16_8_1_WGM8
    SolutionIndex: 31
    SolutionNameMin: Cijk_Ailk_Bjlk_HBH_GB_MT128x128x16_SN_SU32_SUM3_TT8_8_WG16_16_1_WGM8
    SolutionIndex: 32
    SolutionNameMin: Cijk_Ailk_Bjlk_HBH_GB_MT128x64x32_SN_SU32_SUM3_TT8_8_WG16_8_1_WGM8
    SolutionIndex: 33
    SolutionNameMin: Cijk_Ailk_Bjlk_HBH_GB_MT128x128x32_SN_SU32_SUM3_TT8_16_WG16_8_1_WGM8
    SolutionIndex: 34
    SolutionNameMin: Cijk_Ailk_Bjlk_HBH_GB_MT128x128x32_SN_SU32_SUM3_TT8_8_WG16_16_1_WGM8
    SolutionIndex: 35
    SolutionNameMin: Cijk_Ailk_Bjlk_HBH_GB_MT128x256x32_SN_SU32_SUM3_TT8_16_WG16_16_1_WGM8
    SolutionIndex: 36
    SolutionNameMin: Cijk_Ailk_Bjlk_HBH_GB_MT128x128x16_SN_SU0_SUM0_TT8_16_WG16_8_1_WGM1
    SolutionIndex: 37
    SolutionNameMin: Cijk_Ailk_Bjlk_HBH_GB_MT128x128x32_SN_SU0_SUM0_TT8_8_WG16_16_1_WGM1
    SolutionIndex: 38
    SolutionNameMin: Cijk_Ailk_Bjlk_HBH_GB_MT128x128x16_SN_SU32_SUM3_TT8_16_WG16_8_1_WGM1
    SolutionIndex: 39
    SolutionNameMin: Cijk_Ailk_Bjlk_HBH_GB_MT128x128x16_SN_SU0_SUM0_TT8_16_WG16_8_1_WGM4
    SolutionIndex: 40
    SolutionNameMin: Cijk_Ailk_Bjlk_HBH_GB_MT128x128x16_SN_SU32_SUM3_TT8_16_WG16_8_1_WGM4
    SolutionIndex: 41
    SolutionNameMin: Cijk_Ailk_Bjlk_HBH_GB_MT128x128x16_SN_SU32_SUM3_TT8_16_WG16_8_1_WGM8
    SolutionIndex: 42
    SolutionNameMin: Cijk_Ailk_Bjlk_HBH_GB_MT64x64x8_SN_SU0_SUM0_TT8_8_WG8_8_1_WGM1
    SolutionIndex: 43
    SolutionNameMin: Cijk_Ailk_Bjlk_HBH_GB_MT64x64x16_SN_SU0_SUM0_TT8_8_WG8_8_1_WGM1
    SolutionIndex: 44
    SolutionNameMin: Cijk_Ailk_Bjlk_HBH_GB_MT128x64x16_SN_SU0_SUM0_TT8_8_WG16_8_1_WGM1
    SolutionIndex: 45
    SolutionNameMin: Cijk_Ailk_Bjlk_HBH_GB_MT128x128x16_SN_SU0_SUM0_TT8_8_WG16_16_1_WGM1
    SolutionIndex: 46
    SolutionNameMin: Cijk_Ailk_Bjlk_HBH_GB_MT64x64x32_SN_SU0_SUM0_TT8_8_WG8_8_1_WGM1
    SolutionIndex: 47
    SolutionNameMin: Cijk_Ailk_Bjlk_HBH_GB_MT128x64x32_SN_SU0_SUM0_TT8_8_WG16_8_1_WGM1
    SolutionIndex: 48
    SolutionNameMin: Cijk_Ailk_Bjlk_HBH_GB_MT128x128x32_SN_SU0_SUM0_TT8_8_WG16_16_1_WGM1
    SolutionIndex: 49
    SolutionNameMin: Cijk_Ailk_Bjlk_HBH_GB_MT64x64x8_SN_SU32_SUM3_TT8_8_WG8_8_1_WGM1
    SolutionIndex: 50
    SolutionNameMin: Cijk_Ailk_Bjlk_HBH_GB_MT64x64x16_SN_SU32_SUM3_TT8_8_WG8_8_1_WGM1
    SolutionIndex: 51
    SolutionNameMin: Cijk_Ailk_Bjlk_HBH_GB_MT128x64x16_SN_SU32_SUM3_TT8_8_WG16_8_1_WGM1
    SolutionIndex: 52
    SolutionNameMin: Cijk_Ailk_Bjlk_HBH_GB_MT128x128x16_SN_SU32_SUM3_TT8_8_WG16_16_1_WGM1
    SolutionIndex: 53
    SolutionNameMin: Cijk_Ailk_Bjlk_HBH_GB_MT64x64x8_SN_SU0_SUM0_TT8_8_WG8_8_1_WGM4
    SolutionIndex: 54
    SolutionNameMin: Cijk_Ailk_Bjlk_HBH_GB_MT64x64x16_SN_SU0_SUM0_TT8_8_WG8_8_1_WGM4
    SolutionIndex: 55
    SolutionNameMin: Cijk_Ailk_Bjlk_HBH_GB_MT128x64x16_SN_SU0_SUM0_TT8_8_WG16_8_1_WGM4
    SolutionIndex: 56
    SolutionNameMin: Cijk_Ailk_Bjlk_HBH_GB_MT128x128x16_SN_SU0_SUM0_TT8_8_WG16_16_1_WGM4
    SolutionIndex: 57
    SolutionNameMin: Cijk_Ailk_Bjlk_HBH_GB_MT128x64x32_SN_SU0_SUM0_TT8_8_WG16_8_1_WGM4
    SolutionIndex: 58
    SolutionNameMin: Cijk_Ailk_Bjlk_HBH_GB_MT128x128x32_SN_SU0_SUM0_TT8_8_WG16_16_1_WGM4
    SolutionIndex: 59
    SolutionNameMin: Cijk_Ailk_Bjlk_HBH_GB_MT64x64x8_SN_SU32_SUM3_TT8_8_WG8_8_1_WGM4
    SolutionIndex: 60
    SolutionNameMin: Cijk_Ailk_Bjlk_HBH_GB_MT64x64x16_SN_SU32_SUM3_TT8_8_WG8_8_1_WGM4
    SolutionIndex: 61
    SolutionNameMin: Cijk_Ailk_Bjlk_HBH_GB_MT128x64x16_SN_SU32_SUM3_TT8_8_WG16_8_1_WGM4
    SolutionIndex: 62
    SolutionNameMin: Cijk_Ailk_Bjlk_HBH_GB_MT128x128x16_SN_SU32_SUM3_TT8_8_WG16_16_1_WGM4
    SolutionIndex: 63
    SolutionNameMin: Cijk_Ailk_Bjlk_HBH_GB_MT64x64x32_SN_SU32_SUM3_TT8_8_WG8_8_1_WGM4
    SolutionIndex: 64
    SolutionNameMin: Cijk_Ailk_Bjlk_HBH_GB_MT64x64x8_SN_SU0_SUM0_TT8_8_WG8_8_1_WGM8
    SolutionIndex: 65
    SolutionNameMin: Cijk_Ailk_Bjlk_HBH_GB_MT64x64x16_SN_SU0_SUM0_TT8_8_WG8_8_1_WGM8
    SolutionIndex: 66
    SolutionNameMin: Cijk_Ailk_Bjlk_HBH_GB_MT128x64x16_SN_SU0_SUM0_TT8_8_WG16_8_1_WGM8
    SolutionIndex: 67
    SolutionNameMin: Cijk_Ailk_Bjlk_HBH_GB_MT128x128x16_SN_SU0_SUM0_TT8_8_WG16_16_1_WGM8
    SolutionIndex: 68
    SolutionNameMin: Cijk_Ailk_Bjlk_HBH_GB_MT128x64x32_SN_SU0_SUM0_TT8_8_WG16_8_1_WGM8
    SolutionIndex: 69
    SolutionNameMin: Cijk_Ailk_Bjlk_HBH_GB_MT128x128x32_SN_SU0_SUM0_TT8_8_WG16_16_1_WGM8
    SolutionIndex: 70
    SolutionNameMin: Cijk_Ailk_Bjlk_HBH_GB_MT64x64x8_SN_SU32_SUM3_TT8_8_WG8_8_1_WGM8
    SolutionIndex: 71
    SolutionNameMin: Cijk_Ailk_Bjlk_HBH_GB_MT64x64x16_SN_SU32_SUM3_TT8_8_WG8_8_1_WGM8
    SolutionIndex: 72
    SolutionNameMin: Cijk_Ailk_Bjlk_HBH_GB_MT128x64x16_SN_SU32_SUM3_TT8_8_WG16_8_1_WGM8
    SolutionIndex: 73
    SolutionNameMin: Cijk_Ailk_Bjlk_HBH_GB_MT128x128x16_SN_SU32_SUM3_TT8_8_WG16_16_1_WGM8
    SolutionIndex: 74
    SolutionNameMin: Cijk_Ailk_Bjlk_HBH_GB_MT128x64x32_SN_SU32_SUM3_TT8_8_WG16_8_1_WGM8
    SolutionIndex: 75
    SolutionNameMin: Cijk_Ailk_Bjlk_HBH_GB_MT128x128x32_SN_SU32_SUM3_TT8_8_WG16_16_1_WGM8
    SolutionIndex: 76
    SolutionNameMin: Cijk_Ailk_Bjlk_HBH_GB_MT64x64x16_SN_SU0_SUM0_TT8_8_WG8_8_1_WGM1
    SolutionIndex: 77
    SolutionNameMin: Cijk_Ailk_Bjlk_HBH_GB_MT128x64x16_SN_SU0_SUM0_TT8_8_WG16_8_1_WGM1
    SolutionIndex: 78
    SolutionNameMin: Cijk_Ailk_Bjlk_HBH_GB_MT128x128x16_SN_SU0_SUM0_TT8_8_WG16_16_1_WGM1
    SolutionIndex: 79
    SolutionNameMin: Cijk_Ailk_Bjlk_HBH_GB_MT64x64x8_SN_SU32_SUM3_TT8_8_WG8_8_1_WGM1
    SolutionIndex: 80
    SolutionNameMin: Cijk_Ailk_Bjlk_HBH_GB_MT128x64x16_SN_SU0_SUM0_TT8_8_WG16_8_1_WGM4
    SolutionIndex: 81
    SolutionNameMin: Cijk_Ailk_Bjlk_HBH_GB_MT128x64x32_SN_SU32_SUM3_TT8_8_WG16_8_1_WGM4
    SolutionIndex: 82
    SolutionNameMin: Cijk_Ailk_Bjlk_HBH_GB_MT128x64x16_SN_SU0_SUM0_TT8_8_WG16_8_1_WGM8
    SolutionIndex: 83
    SolutionNameMin: Cijk_Ailk_Bjlk_HBH_GB_MT64x64x16_SN_SU32_SUM3_TT8_8_WG8_8_1_WGM8
    SolutionIndex: 84
    SolutionNameMin: Cijk_Ailk_Bjlk_HBH_GB_MT16x16x8_SN_SU0_SUM0_TT2_2_WG8_8_1_WGM1
    SolutionIndex: 85
    SolutionNameMin: Cijk_Ailk_Bjlk_HBH_GB_MT32x32x8_SN_SU0_SUM0_TT4_4_WG8_8_1_WGM1
    SolutionIndex: 86
    SolutionNameMin: Cijk_Ailk_Bjlk_HBH_GB_MT32x16x8_SN_SU0_SUM0_TT2_2_WG16_8_1_WGM1
    SolutionIndex: 87
    SolutionNameMin: Cijk_Ailk_Bjlk_HBH_GB_MT64x32x8_SN_SU0_SUM0_TT4_4_WG16_8_1_WGM1
    SolutionIndex: 88
    SolutionNameMin: Cijk_Ailk_Bjlk_HBH_GB_MT32x32x8_SN_SU0_SUM0_TT2_2_WG16_16_1_WGM1
    SolutionIndex: 89
    SolutionNameMin: Cijk_Ailk_Bjlk_HBH_GB_MT16x16x16_SN_SU0_SUM0_TT2_2_WG8_8_1_WGM1
    SolutionIndex: 90
    SolutionNameMin: Cijk_Ailk_Bjlk_HBH_GB_MT32x32x16_SN_SU0_SUM0_TT4_4_WG8_8_1_WGM1
    SolutionIndex: 91
    SolutionNameMin: Cijk_Ailk_Bjlk_HBH_GB_MT32x16x16_SN_SU0_SUM0_TT2_2_WG16_8_1_WGM1
    SolutionIndex: 92
    SolutionNameMin: Cijk_Ailk_Bjlk_HBH_GB_MT64x32x16_SN_SU0_SUM0_TT4_4_WG16_8_1_WGM1
    SolutionIndex: 93
    SolutionNameMin: Cijk_Ailk_Bjlk_HBH_GB_MT32x32x16_SN_SU0_SUM0_TT2_2_WG16_16_1_WGM1
    SolutionIndex: 94
    SolutionNameMin: Cijk_Ailk_Bjlk_HBH_GB_MT64x64x16_SN_SU0_SUM0_TT4_4_WG16_16_1_WGM1
    SolutionIndex: 95
    SolutionNameMin: Cijk_Ailk_Bjlk_HBH_GB_MT16x16x32_SN_SU0_SUM0_TT2_2_WG8_8_1_WGM1
    SolutionIndex: 96
    SolutionNameMin: Cijk_Ailk_Bjlk_HBH_GB_MT32x32x32_SN_SU0_SUM0_TT4_4_WG8_8_1_WGM1
    SolutionIndex: 97
    SolutionNameMin: Cijk_Ailk_Bjlk_HBH_GB_MT32x16x32_SN_SU0_SUM0_TT2_2_WG16_8_1_WGM1
    SolutionIndex: 98
    SolutionNameMin: Cijk_Ailk_Bjlk_HBH_GB_MT64x32x32_SN_SU0_SUM0_TT4_4_WG16_8_1_WGM1
    SolutionIndex: 99
    SolutionNameMin: Cijk_Ailk_Bjlk_HBH_GB_MT32x32x32_SN_SU0_SUM0_TT2_2_WG16_16_1_WGM1
    SolutionIndex: 100
    SolutionNameMin: Cijk_Ailk_Bjlk_HBH_GB_MT64x64x32_SN_SU0_SUM0_TT4_4_WG16_16_1_WGM1
    SolutionIndex: 101
    SolutionNameMin: Cijk_Ailk_Bjlk_HBH_GB_MT32x32x8_SN_SU32_SUM3_TT4_4_WG8_8_1_WGM1
    SolutionIndex: 102
    SolutionNameMin: Cijk_Ailk_Bjlk_HBH_GB_MT64x32x8_SN_SU32_SUM3_TT4_4_WG16_8_1_WGM1
    SolutionIndex: 103
    SolutionNameMin: Cijk_Ailk_Bjlk_HBH_GB_MT16x16x16_SN_SU32_SUM3_TT2_2_WG8_8_1_WGM1
    SolutionIndex: 104
    SolutionNameMin: Cijk_Ailk_Bjlk_HBH_GB_MT32x32x16_SN_SU32_SUM3_TT4_4_WG8_8_1_WGM1
    SolutionIndex: 105
    SolutionNameMin: Cijk_Ailk_Bjlk_HBH_GB_MT32x16x16_SN_SU32_SUM3_TT2_2_WG16_8_1_WGM1
    SolutionIndex: 106
    SolutionNameMin: Cijk_Ailk_Bjlk_HBH_GB_MT64x32x16_SN_SU32_SUM3_TT4_4_WG16_8_1_WGM1
    SolutionIndex: 107
    SolutionNameMin: Cijk_Ailk_Bjlk_HBH_GB_MT64x64x16_SN_SU32_SUM3_TT4_4_WG16_16_1_WGM1
    SolutionIndex: 108
    SolutionNameMin: Cijk_Ailk_Bjlk_HBH_GB_MT16x16x32_SN_SU32_SUM3_TT2_2_WG8_8_1_WGM1
    SolutionIndex: 109
    SolutionNameMin: Cijk_Ailk_Bjlk_HBH_GB_MT32x16x32_SN_SU32_SUM3_TT2_2_WG16_8_1_WGM1
    SolutionIndex: 110
    SolutionNameMin: Cijk_Ailk_Bjlk_HBH_GB_MT64x32x32_SN_SU32_SUM3_TT4_4_WG16_8_1_WGM1
    SolutionIndex: 111
    SolutionNameMin: Cijk_Ailk_Bjlk_HBH_GB_MT32x32x32_SN_SU32_SUM3_TT2_2_WG16_16_1_WGM1
    SolutionIndex: 112
    SolutionNameMin: Cijk_Ailk_Bjlk_HBH_GB_MT64x64x32_SN_SU32_SUM3_TT4_4_WG16_16_1_WGM1
    SolutionIndex: 113
    SolutionNameMin: Cijk_Ailk_Bjlk_HBH_GB_MT32x32x8_SN_SU0_SUM0_TT4_4_WG8_8_1_WGM4
    SolutionIndex: 114
    SolutionNameMin: Cijk_Ailk_Bjlk_HBH_GB_MT32x16x8_SN_SU0_SUM0_TT2_2_WG16_8_1_WGM4
    SolutionIndex: 115
    SolutionNameMin: Cijk_Ailk_Bjlk_HBH_GB_MT64x32x8_SN_SU0_SUM0_TT4_4_WG16_8_1_WGM4
    SolutionIndex: 116
    SolutionNameMin: Cijk_Ailk_Bjlk_HBH_GB_MT32x32x8_SN_SU0_SUM0_TT2_2_WG16_16_1_WGM4
    SolutionIndex: 117
    SolutionNameMin: Cijk_Ailk_Bjlk_HBH_GB_MT16x16x16_SN_SU0_SUM0_TT2_2_WG8_8_1_WGM4
    SolutionIndex: 118
    SolutionNameMin: Cijk_Ailk_Bjlk_HBH_GB_MT32x32x16_SN_SU0_SUM0_TT4_4_WG8_8_1_WGM4
    SolutionIndex: 119
    SolutionNameMin: Cijk_Ailk_Bjlk_HBH_GB_MT32x16x16_SN_SU0_SUM0_TT2_2_WG16_8_1_WGM4
    SolutionIndex: 120
    SolutionNameMin: Cijk_Ailk_Bjlk_HBH_GB_MT64x32x16_SN_SU0_SUM0_TT4_4_WG16_8_1_WGM4
    SolutionIndex: 121
    SolutionNameMin: Cijk_Ailk_Bjlk_HBH_GB_MT64x64x16_SN_SU0_SUM0_TT4_4_WG16_16_1_WGM4
    SolutionIndex: 122
    SolutionNameMin: Cijk_Ailk_Bjlk_HBH_GB_MT32x32x32_SN_SU0_SUM0_TT4_4_WG8_8_1_WGM4
    SolutionIndex: 123
    SolutionNameMin: Cijk_Ailk_Bjlk_HBH_GB_MT32x16x32_SN_SU0_SUM0_TT2_2_WG16_8_1_WGM4
    SolutionIndex: 124
    SolutionNameMin: Cijk_Ailk_Bjlk_HBH_GB_MT64x32x32_SN_SU0_SUM0_TT4_4_WG16_8_1_WGM4
    SolutionIndex: 125
    SolutionNameMin: Cijk_Ailk_Bjlk_HBH_GB_MT32x32x32_SN_SU0_SUM0_TT2_2_WG16_16_1_WGM4
    SolutionIndex: 126
    SolutionNameMin: Cijk_Ailk_Bjlk_HBH_GB_MT64x64x32_SN_SU0_SUM0_TT4_4_WG16_16_1_WGM4
    SolutionIndex: 127
    SolutionNameMin: Cijk_Ailk_Bjlk_HBH_GB_MT64x32x8_SN_SU32_SUM3_TT4_4_WG16_8_1_WGM4
    SolutionIndex: 128
    SolutionNameMin: Cijk_Ailk_Bjlk_HBH_GB_MT32x32x8_SN_SU32_SUM3_TT2_2_WG16_16_1_WGM4
    SolutionIndex: 129
    SolutionNameMin: Cijk_Ailk_Bjlk_HBH_GB_MT16x16x16_SN_SU32_SUM3_TT2_2_WG8_8_1_WGM4
    SolutionIndex: 130
    SolutionNameMin: Cijk_Ailk_Bjlk_HBH_GB_MT32x32x16_SN_SU32_SUM3_TT4_4_WG8_8_1_WGM4
    SolutionIndex: 131
    SolutionNameMin: Cijk_Ailk_Bjlk_HBH_GB_MT64x32x16_SN_SU32_SUM3_TT4_4_WG16_8_1_WGM4
    SolutionIndex: 132
    SolutionNameMin: Cijk_Ailk_Bjlk_HBH_GB_MT32x32x16_SN_SU32_SUM3_TT2_2_WG16_16_1_WGM4
    SolutionIndex: 133
    SolutionNameMin: Cijk_Ailk_Bjlk_HBH_GB_MT32x16x32_SN_SU32_SUM3_TT2_2_WG16_8_1_WGM4
    SolutionIndex: 134
    SolutionNameMin: Cijk_Ailk_Bjlk_HBH_GB_MT32x32x32_SN_SU32_SUM3_TT2_2_WG16_16_1_WGM4
    SolutionIndex: 135
    SolutionNameMin: Cijk_Ailk_Bjlk_HBH_GB_MT64x64x32_SN_SU32_SUM3_TT4_4_WG16_16_1_WGM4
    SolutionIndex: 136
    SolutionNameMin: Cijk_Ailk_Bjlk_HBH_GB_MT16x16x8_SN_SU0_SUM0_TT2_2_WG8_8_1_WGM8
    SolutionIndex: 137
    SolutionNameMin: Cijk_Ailk_Bjlk_HBH_GB_MT32x32x8_SN_SU0_SUM0_TT4_4_WG8_8_1_WGM8
    SolutionIndex: 138
    SolutionNameMin: Cijk_Ailk_Bjlk_HBH_GB_MT32x16x8_SN_SU0_SUM0_TT2_2_WG16_8_1_WGM8
    SolutionIndex: 139
    SolutionNameMin: Cijk_Ailk_Bjlk_HBH_GB_MT64x32x8_SN_SU0_SUM0_TT4_4_WG16_8_1_WGM8
    SolutionIndex: 140
    SolutionNameMin: Cijk_Ailk_Bjlk_HBH_GB_MT32x32x8_SN_SU0_SUM0_TT2_2_WG16_16_1_WGM8
    SolutionIndex: 141
    SolutionNameMin: Cijk_Ailk_Bjlk_HBH_GB_MT32x32x16_SN_SU0_SUM0_TT4_4_WG8_8_1_WGM8
    SolutionIndex: 142
    SolutionNameMin: Cijk_Ailk_Bjlk_HBH_GB_MT32x16x16_SN_SU0_SUM0_TT2_2_WG16_8_1_WGM8
    SolutionIndex: 143
    SolutionNameMin: Cijk_Ailk_Bjlk_HBH_GB_MT64x32x16_SN_SU0_SUM0_TT4_4_WG16_8_1_WGM8
    SolutionIndex: 144
    SolutionNameMin: Cijk_Ailk_Bjlk_HBH_GB_MT32x32x16_SN_SU0_SUM0_TT2_2_WG16_16_1_WGM8
    SolutionIndex: 145
    SolutionNameMin: Cijk_Ailk_Bjlk_HBH_GB_MT32x32x32_SN_SU0_SUM0_TT4_4_WG8_8_1_WGM8
    SolutionIndex: 146
    SolutionNameMin: Cijk_Ailk_Bjlk_HBH_GB_MT32x16x32_SN_SU0_SUM0_TT2_2_WG16_8_1_WGM8
    SolutionIndex: 147
    SolutionNameMin: Cijk_Ailk_Bjlk_HBH_GB_MT64x32x32_SN_SU0_SUM0_TT4_4_WG16_8_1_WGM8
    SolutionIndex: 148
    SolutionNameMin: Cijk_Ailk_Bjlk_HBH_GB_MT32x32x32_SN_SU0_SUM0_TT2_2_WG16_16_1_WGM8
    SolutionIndex: 149
    SolutionNameMin: Cijk_Ailk_Bjlk_HBH_GB_MT64x64x32_SN_SU0_SUM0_TT4_4_WG16_16_1_WGM8
    SolutionIndex: 150
    SolutionNameMin: Cijk_Ailk_Bjlk_HBH_GB_MT16x16x8_SN_SU32_SUM3_TT2_2_WG8_8_1_WGM8
    SolutionIndex: 151
    SolutionNameMin: Cijk_Ailk_Bjlk_HBH_GB_MT32x32x8_SN_SU32_SUM3_TT4_4_WG8_8_1_WGM8
    SolutionIndex: 152
    SolutionNameMin: Cijk_Ailk_Bjlk_HBH_GB_MT32x32x16_SN_SU32_SUM3_TT4_4_WG8_8_1_WGM8
    SolutionIndex: 153
    SolutionNameMin: Cijk_Ailk_Bjlk_HBH_GB_MT32x16x16_SN_SU32_SUM3_TT2_2_WG16_8_1_WGM8
    SolutionIndex: 154
    SolutionNameMin: Cijk_Ailk_Bjlk_HBH_GB_MT64x32x16_SN_SU32_SUM3_TT4_4_WG16_8_1_WGM8
    SolutionIndex: 155
    SolutionNameMin: Cijk_Ailk_Bjlk_HBH_GB_MT32x32x16_SN_SU32_SUM3_TT2_2_WG16_16_1_WGM8
    SolutionIndex: 156
    SolutionNameMin: Cijk_Ailk_Bjlk_HBH_GB_MT32x32x32_SN_SU32_SUM3_TT4_4_WG8_8_1_WGM8
    SolutionIndex: 157
    SolutionNameMin: Cijk_Ailk_Bjlk_HBH_GB_MT32x16x32_SN_SU32_SUM3_TT2_2_WG16_8_1_WGM8
    SolutionIndex: 158
    SolutionNameMin: Cijk_Ailk_Bjlk_HBH_GB_MT64x32x32_SN_SU32_SUM3_TT4_4_WG16_8_1_WGM8
    SolutionIndex: 159
    SolutionNameMin: Cijk_Ailk_Bjlk_HBH_GB_MT32x32x32_SN_SU32_SUM3_TT2_2_WG16_16_1_WGM8
    SolutionIndex: 160
    SolutionNameMin: Cijk_Ailk_Bjlk_HBH_GB_MT64x64x32_SN_SU32_SUM3_TT4_4_WG16_16_1_WGM8
    SolutionIndex: 161
    SolutionNameMin: Cijk_Ailk_Bjlk_HBH_GB_MT32x32x16_SN_SU0_SUM0_TT4_4_WG8_8_1_WGM1
    SolutionIndex: 162
    SolutionNameMin: Cijk_Ailk_Bjlk_HBH_GB_MT16x16x32_SN_SU0_SUM0_TT2_2_WG8_8_1_WGM1
    SolutionIndex: 163
    SolutionNameMin: Cijk_Ailk_Bjlk_HBH_GB_MT32x16x32_SN_SU0_SUM0_TT2_2_WG16_8_1_WGM1
    SolutionIndex: 164
    SolutionNameMin: Cijk_Ailk_Bjlk_HBH_GB_MT16x16x32_SN_SU32_SUM3_TT2_2_WG8_8_1_WGM1
    SolutionIndex: 165
    SolutionNameMin: Cijk_Ailk_Bjlk_HBH_GB_MT32x32x32_SN_SU0_SUM0_TT4_4_WG8_8_1_WGM4
    SolutionIndex: 166
    SolutionNameMin: Cijk_Ailk_Bjlk_HBH_GB_MT32x16x32_SN_SU0_SUM0_TT2_2_WG16_8_1_WGM4
    SolutionIndex: 167
    SolutionNameMin: Cijk_Ailk_Bjlk_HBH_GB_MT32x16x32_SN_SU0_SUM0_TT2_2_WG16_8_1_WGM8
    SolutionIndex: 168
    SolutionNameMin: Cijk_Ailk_Bjlk_HBH_GB_MT16x16x32_SN_SU32_SUM3_TT2_2_WG8_8_1_WGM8
    SolutionIndex: 169
    SolutionNameMin: Cijk_Ailk_Bjlk_HBH_GB_MT32x8x8_SN_SU0_SUM0_TT2_2_WG16_4_1_WGM1
    SolutionIndex: 170
    SolutionNameMin: Cijk_Ailk_Bjlk_HBH_GB_MT64x8x32_SN_SU0_SUM0_TT2_2_WG32_4_1_WGM1
    SolutionIndex: 171
    SolutionNameMin: Cijk_Ailk_Bjlk_HBH_GB_MT32x8x8_SN_SU0_SUM0_TT2_2_WG16_4_1_WGM8
- - - [4096, 7133, 1, 4096, 4096, 4096, 4096, 7133]
    - [19, 23740.0]
  - - [2048, 7133, 1, 2048, 2048, 2048, 2048, 7133]
    - [13, 23537.0]
  - - [2560, 7133, 1, 2560, 2560, 2560, 2560, 7133]
    - [19, 23743.0]
  - - [3072, 7435, 1, 1024, 3072, 3072, 3072, 7435]
    - [23, 23301.0]
  - - [1760, 7133, 1, 1760, 1760, 1760, 1760, 7133]
    - [30, 22742.0]
  - - [7680, 5481, 1, 2560, 7680, 7680, 7680, 5481]
    - [13, 23836.0]
  - - [3136, 256, 64, 64, 3136, 3136, 3136, 256]
    - [0, 14882.0]
  - - [784, 512, 64, 128, 784, 784, 784, 512]
    - [30, 18756.0]
  - - [784, 128, 64, 512, 784, 784, 784, 128]
    - [2, 19357.0]
  - - [196, 256, 128, 1024, 196, 196, 196, 256]
    - [23, 17341.0]
  - - [196, 256, 64, 1024, 196, 196, 196, 256]
    - [19, 16908.0]
  - - [196, 1024, 128, 256, 196, 196, 196, 1024]
    - [19, 16755.0]
  - - [784, 128, 256, 512, 784, 784, 784, 128]
    - [23, 20264.0]
  - - [3136, 256, 256, 64, 3136, 3136, 3136, 256]
    - [0, 15396.0]
  - - [784, 128, 128, 512, 784, 784, 784, 128]
    - [23, 19958.0]
  - - [784, 512, 128, 128, 784, 784, 784, 512]
    - [8, 18985.0]
  - - [784, 512, 256, 128, 784, 784, 784, 512]
    - [8, 19256.0]
  - - [196, 1024, 64, 256, 196, 196, 196, 1024]
    - [23, 16448.0]
  - - [196, 1024, 256, 256, 196, 196, 196, 1024]
    - [30, 17003.0]
  - - [196, 256, 256, 1024, 196, 196, 196, 256]
    - [2, 17674.0]
  - - [3136, 256, 128, 64, 3136, 3136, 3136, 256]
    - [0, 18124.0]
  - - [1024, 4096, 1, 2048, 1024, 1024, 1024, 4096]
    - [2, 22848.0]
  - - [1024, 4096, 1, 4096, 1024, 1024, 1024, 4096]
    - [2, 23077.0]
  - - [1024, 30528, 1, 2048, 1024, 1024, 1024, 30528]
    - [13, 23772.0]
  - - [1024, 30528, 1, 4096, 1024, 1024, 1024, 30528]
    - [19, 23839.0]
  - - [4096, 1024, 1, 2048, 4096, 4096, 4096, 1024]
    - [2, 22810.0]
  - - [4096, 1024, 1, 4096, 4096, 4096, 4096, 1024]
    - [8, 23053.0]
  - - [256, 4864, 1, 8976, 256, 256, 256, 4864]
    - [19, 21204.0]
  - - [256, 5120, 1, 8976, 256, 256, 256, 5120]
    - [19, 22161.0]
  - - [256, 5632, 1, 8976, 256, 256, 256, 5632]
    - [30, 19684.0]
  - - [256, 5888, 1, 8976, 256, 256, 256, 5888]
    - [30, 20692.0]
  - - [256, 6144, 1, 8976, 256, 256, 256, 6144]
    - [19, 21617.0]
  - - [256, 7168, 1, 8976, 256, 256, 256, 7168]
    - [30, 21277.0]
  - - [256, 8192, 1, 8976, 256, 256, 256, 8192]
    - [30, 21159.0]
  - - [256, 8960, 1, 8976, 256, 256, 256, 8960]
    - [30, 23017.0]
  - - [256, 9728, 1, 8976, 256, 256, 256, 9728]
    - [8, 22038.0]
  - - [256, 9984, 1, 8976, 256, 256, 256, 9984]
    - [8, 22611.0]
  - - [256, 10240, 1, 8976, 256, 256, 256, 10240]
    - [19, 23107.0]
  - - [256, 10496, 1, 8976, 256, 256, 256, 10496]
    - [8, 21327.0]
  - - [256, 11008, 1, 8976, 256, 256, 256, 11008]
    - [13, 22267.0]
  - - [256, 11264, 1, 8976, 256, 256, 256, 11264]
    - [30, 22679.0]
  - - [256, 11520, 1, 8976, 256, 256, 256, 11520]
    - [19, 23279.0]
  - - [256, 11776, 1, 8976, 256, 256, 256, 11776]
    - [8, 21658.0]
  - - [256, 12544, 1, 8976, 256, 256, 256, 12544]
    - [19, 22899.0]
  - - [256, 12800, 1, 8976, 256, 256, 256, 12800]
    - [19, 23319.0]
  - - [256, 13312, 1, 8976, 256, 256, 256, 13312]
    - [13, 22253.0]
  - - [256, 13568, 1, 8976, 256, 256, 256, 13568]
    - [13, 22634.0]
  - - [256, 14336, 1, 8976, 256, 256, 256, 14336]
    - [2, 22013.0]
  - - [256, 14848, 1, 8976, 256, 256, 256, 14848]
    - [8, 22780.0]
  - - [256, 15104, 1, 8976, 256, 256, 256, 15104]
    - [19, 23126.0]
  - - [256, 15872, 1, 8976, 256, 256, 256, 15872]
    - [23, 22585.0]
  - - [256, 16128, 1, 8976, 256, 256, 256, 16128]
    - [30, 22912.0]
  - - [256, 17152, 1, 8976, 256, 256, 256, 17152]
    - [8, 22695.0]
  - - [256, 17408, 1, 8976, 256, 256, 256, 17408]
    - [30, 23009.0]
  - - [256, 18688, 1, 8976, 256, 256, 256, 18688]
    - [8, 23053.0]
  - - [256, 19968, 1, 8976, 256, 256, 256, 19968]
    - [19, 23144.0]
  - - [256, 20480, 1, 8976, 256, 256, 256, 20480]
    - [30, 23642.0]
  - - [256, 20992, 1, 8976, 256, 256, 256, 20992]
    - [13, 22974.0]
  - - [256, 21248, 1, 8976, 256, 256, 256, 21248]
    - [8, 23216.0]
  - - [256, 22016, 1, 8976, 256, 256, 256, 22016]
    - [2, 22794.0]
  - - [256, 26112, 1, 8976, 256, 256, 256, 26112]
    - [19, 23225.0]
  - - [256, 32512, 1, 8976, 256, 256, 256, 32512]
    - [23, 23412.0]
  - - [256, 32768, 1, 1, 256, 256, 256, 32768]
    - [1, 437.0]
  - - [256, 33536, 1, 8976, 256, 256, 256, 33536]
    - [2, 23299.0]
  - - [256, 44505, 1, 8976, 256, 256, 256, 44505]
    - [19, 23739.0]
  - - [768, 2048, 1, 256, 768, 768, 768, 2048]
    - [3, 18154.0]
  - - [1600, 1024, 1, 512, 1600, 1600, 1600, 1024]
    - [2, 17282.0]
  - - [1600, 1024, 1, 960, 1600, 1600, 1600, 1024]
    - [8, 18075.0]
  - - [2048, 960, 1, 1, 2048, 2048, 2048, 960]
    - [1, 284.0]
  - - [2048, 2048, 1, 512, 2048, 2048, 2048, 2048]
    - [13, 22148.0]
  - - [2048, 2048, 1, 960, 2048, 2048, 2048, 2048]
    - [13, 22613.0]
  - - [2048, 2048, 1, 1024, 2048, 2048, 2048, 2048]
    - [2, 22608.0]
  - - [3200, 2048, 1, 1024, 3200, 3200, 3200, 2048]
    - [30, 23320.0]
  - - [4096, 4096, 1, 1024, 4096, 4096, 4096, 4096]
    - [2, 23570.0]
  - - [1024, 4096, 1, 3840, 1024, 1024, 1024, 4096]
    - [2, 23113.0]
  - - [1024, 4096, 1, 3968, 1024, 1024, 1024, 4096]
    - [23, 22936.0]
  - - [1024, 4096, 1, 6528, 1024, 1024, 1024, 4096]
    - [2, 23136.0]
  - - [1024, 4096, 1, 7104, 1024, 1024, 1024, 4096]
    - [23, 22694.0]
  - - [1024, 4096, 1, 7200, 1024, 1024, 1024, 4096]
    - [23, 22689.0]
  - - [1024, 4096, 1, 8064, 1024, 1024, 1024, 4096]
    - [33, 22182.0]
  - - [1024, 4096, 1, 8160, 1024, 1024, 1024, 4096]
    - [26, 22131.0]
  - - [1024, 4096, 1, 9216, 1024, 1024, 1024, 4096]
    - [30, 23194.0]
  - - [1024, 4096, 1, 9520, 1024, 1024, 1024, 4096]
    - [23, 23185.0]
  - - [1024, 4096, 1, 10064, 1024, 1024, 1024, 4096]
    - [30, 23187.0]
  - - [1024, 4096, 1, 10080, 1024, 1024, 1024, 4096]
    - [30, 23179.0]
  - - [1024, 4096, 1, 10200, 1024, 1024, 1024, 4096]
    - [13, 23164.0]
  - - [1024, 42720, 1, 3968, 1024, 1024, 1024, 42720]
    - [2, 23989.0]
  - - [1024, 42720, 1, 6528, 1024, 1024, 1024, 42720]
    - [13, 24011.0]
  - - [1024, 42720, 1, 7104, 1024, 1024, 1024, 42720]
    - [8, 24051.0]
  - - [1024, 42720, 1, 7200, 1024, 1024, 1024, 42720]
    - [8, 24026.0]
  - - [1024, 42720, 1, 9520, 1024, 1024, 1024, 42720]
    - [2, 23520.0]
  - - [1024, 42720, 1, 10080, 1024, 1024, 1024, 42720]
    - [2, 23506.0]
  - - [4096, 1024, 1, 3840, 4096, 4096, 4096, 1024]
    - [2, 22918.0]
  - - [4096, 1024, 1, 3968, 4096, 4096, 4096, 1024]
    - [19, 22914.0]
  - - [4096, 1024, 1, 6528, 4096, 4096, 4096, 1024]
    - [2, 23045.0]
  - - [4096, 1024, 1, 7104, 4096, 4096, 4096, 1024]
    - [2, 23104.0]
  - - [4096, 1024, 1, 7200, 4096, 4096, 4096, 1024]
    - [15, 22558.0]
  - - [4096, 1024, 1, 8064, 4096, 4096, 4096, 1024]
    - [2, 23107.0]
  - - [4096, 1024, 1, 8160, 4096, 4096, 4096, 1024]
    - [2, 23105.0]
  - - [4096, 1024, 1, 9216, 4096, 4096, 4096, 1024]
    - [13, 23121.0]
  - - [4096, 1024, 1, 9520, 4096, 4096, 4096, 1024]
    - [19, 23105.0]
  - - [4096, 1024, 1, 10064, 4096, 4096, 4096, 1024]
    - [13, 23110.0]
  - - [4096, 1024, 1, 10080, 4096, 4096, 4096, 1024]
    - [2, 23102.0]
  - - [4096, 1024, 1, 10200, 4096, 4096, 4096, 1024]
    - [2, 23098.0]
  - - [1024, 4096, 1, 3240, 1024, 1024, 1024, 4096]
    - [13, 22945.0]
  - - [1024, 4096, 1, 3960, 1024, 1024, 1024, 4096]
    - [19, 22735.0]
  - - [1024, 42720, 1, 3960, 1024, 1024, 1024, 42720]
    - [30, 24060.0]
  - - [4096, 1024, 1, 3240, 4096, 4096, 4096, 1024]
    - [8, 22939.0]
  - - [4096, 1024, 1, 3960, 4096, 4096, 4096, 1024]
    - [19, 22870.0]
  - - [1225, 192, 64, 32, 1225, 1225, 1225, 192]
    - [29, 9144.0]
  - - [1225, 192, 64, 48, 1225, 1225, 1225, 192]
    - [29, 15327.0]
  - - [1225, 192, 64, 64, 1225, 1225, 1225, 192]
    - [18, 15971.0]
  - - [1225, 256, 64, 48, 1225, 1225, 1225, 256]
    - [7, 15819.0]
  - - [1225, 256, 64, 64, 1225, 1225, 1225, 256]
    - [7, 16924.0]
  - - [1225, 288, 64, 48, 1225, 1225, 1225, 288]
    - [7, 12608.0]
  - - [1225, 288, 64, 64, 1225, 1225, 1225, 288]
    - [22, 14387.0]
  - - [289, 768, 64, 128, 289, 289, 289, 768]
    - [19, 15354.0]
  - - [289, 768, 64, 160, 289, 289, 289, 768]
    - [19, 15907.0]
  - - [289, 768, 64, 192, 289, 289, 289, 768]
    - [19, 16221.0]
  - - [1225, 192, 32, 32, 1225, 1225, 1225, 192]
    - [25, 8967.0]
  - - [1225, 192, 32, 48, 1225, 1225, 1225, 192]
    - [7, 13156.0]
  - - [1225, 192, 32, 64, 1225, 1225, 1225, 192]
    - [1, 15579.0]
  - - [1225, 256, 32, 48, 1225, 1225, 1225, 256]
    - [7, 12663.0]
  - - [1225, 256, 32, 64, 1225, 1225, 1225, 256]
    - [22, 15858.0]
  - - [1225, 288, 32, 48, 1225, 1225, 1225, 288]
    - [29, 12053.0]
  - - [1225, 288, 32, 64, 1225, 1225, 1225, 288]
    - [1, 14497.0]
  - - [289, 768, 32, 128, 289, 289, 289, 768]
    - [2, 14677.0]
  - - [289, 768, 32, 160, 289, 289, 289, 768]
    - [2, 15432.0]
  - - [289, 768, 32, 192, 289, 289, 289, 768]
    - [2, 15596.0]
  - - [3136, 256, 32, 64, 3136, 3136, 3136, 256]
    - [8, 19339.0]
  - - [784, 128, 32, 512, 784, 784, 784, 128]
    - [19, 18120.0]
  - - [784, 512, 32, 128, 784, 784, 784, 512]
    - [13, 18285.0]
  - - [196, 1024, 32, 256, 196, 196, 196, 1024]
    - [30, 15794.0]
  - - [3136, 128, 64, 256, 3136, 3136, 3136, 128]
    - [19, 22160.0]
  - - [784, 256, 64, 512, 784, 784, 784, 256]
    - [2, 20063.0]
  - - [3136, 256, 64, 128, 3136, 3136, 3136, 256]
    - [2, 21516.0]
  - - [3136, 256, 64, 256, 3136, 3136, 3136, 256]
    - [2, 22506.0]
  - - [196, 512, 64, 1024, 196, 196, 196, 512]
    - [23, 17469.0]
  - - [784, 512, 64, 256, 784, 784, 784, 512]
    - [2, 19774.0]
  - - [784, 512, 64, 512, 784, 784, 784, 512]
    - [13, 20322.0]
  - - [196, 1024, 64, 512, 196, 196, 196, 1024]
    - [23, 17258.0]
  - - [196, 1024, 64, 1024, 196, 196, 196, 1024]
    - [2, 17719.0]
  - - [3136, 128, 32, 256, 3136, 3136, 3136, 128]
    - [2, 21867.0]
  - - [784, 256, 32, 512, 784, 784, 784, 256]
    - [23, 19460.0]
  - - [3136, 256, 32, 128, 3136, 3136, 3136, 256]
    - [2, 21109.0]
  - - [3136, 256, 32, 256, 3136, 3136, 3136, 256]
    - [8, 22309.0]
  - - [196, 512, 32, 1024, 196, 196, 196, 512]
    - [13, 17042.0]
  - - [784, 512, 32, 256, 784, 784, 784, 512]
    - [2, 19490.0]
  - - [784, 512, 32, 512, 784, 784, 784, 512]
    - [13, 20115.0]
  - - [196, 1024, 32, 512, 196, 196, 196, 1024]
    - [8, 16973.0]
  - - [196, 1024, 32, 1024, 196, 196, 196, 1024]
    - [19, 17401.0]
  - - [7680, 8192, 1, 8192, 7680, 7680, 7680, 8192]
    - [13, 23875.0]
  - - [3840, 4096, 1, 4096, 3840, 3840, 3840, 4096]
    - [2, 23913.0]
  - - [1920, 2048, 1, 2048, 1920, 1920, 1920, 2048]
    - [23, 22808.0]
  - - [8192, 7680, 1, 8192, 8192, 8192, 8192, 7680]
    - [19, 23892.0]
  - - [4096, 3840, 1, 4096, 4096, 4096, 4096, 3840]
    - [2, 23894.0]
  - - [2048, 1920, 1, 2048, 2048, 2048, 2048, 1920]
    - [2, 22737.0]
  - - [8192, 8192, 1, 8192, 8192, 8192, 8192, 8192]
    - [13, 23880.0]
  - - [4096, 4096, 1, 4096, 4096, 4096, 4096, 4096]
    - [2, 23758.0]
  - - [2048, 2048, 1, 2048, 2048, 2048, 2048, 2048]
    - [13, 22421.0]
  - - [1024, 4096, 1, 512, 1024, 1024, 1024, 4096]
    - [2, 21424.0]
  - - [1024, 30522, 1, 77, 1024, 1024, 1024, 30522]
    - [12, 17346.0]
  - - [4096, 1024, 1, 512, 4096, 4096, 4096, 1024]
    - [19, 22217.0]
  - - [1024, 4096, 1, 1280, 1024, 1024, 1024, 4096]
    - [8, 22842.0]
  - - [1024, 30522, 1, 200, 1024, 1024, 1024, 30522]
    - [17, 22416.0]
  - - [4096, 1024, 1, 1280, 4096, 4096, 4096, 1024]
    - [2, 22861.0]
  - - [1024, 4096, 1, 4992, 1024, 1024, 1024, 4096]
    - [2, 23104.0]
  - - [1024, 30522, 1, 780, 1024, 1024, 1024, 30522]
    - [8, 23458.0]
  - - [4096, 1024, 1, 4992, 4096, 4096, 4096, 1024]
    - [8, 23159.0]
  - - [1024, 30522, 1, 308, 1024, 1024, 1024, 30522]
    - [23, 22737.0]
  - - [1024, 4096, 1, 5120, 1024, 1024, 1024, 4096]
    - [2, 23169.0]
  - - [1024, 30522, 1, 800, 1024, 1024, 1024, 30522]
    - [19, 23658.0]
  - - [4096, 1024, 1, 5120, 4096, 4096, 4096, 1024]
    - [8, 23185.0]
  - - [1024, 4096, 1, 5248, 1024, 1024, 1024, 4096]
    - [2, 23158.0]
  - - [1024, 30522, 1, 820, 1024, 1024, 1024, 30522]
    - [8, 23502.0]
  - - [4096, 1024, 1, 5248, 4096, 4096, 4096, 1024]
    - [8, 23186.0]
  - - [1024, 4096, 1, 2560, 1024, 1024, 1024, 4096]
    - [19, 23111.0]
  - - [1024, 30522, 1, 385, 1024, 1024, 1024, 30522]
    - [13, 22852.0]
  - - [4096, 1024, 1, 2560, 4096, 4096, 4096, 1024]
    - [13, 23059.0]
  - - [1024, 4096, 1, 3072, 1024, 1024, 1024, 4096]
    - [13, 22851.0]
  - - [1024, 30522, 1, 462, 1024, 1024, 1024, 30522]
    - [30, 23093.0]
  - - [4096, 1024, 1, 3072, 4096, 4096, 4096, 1024]
    - [13, 23103.0]
  - - [1024, 4096, 1, 1024, 1024, 1024, 1024, 4096]
    - [2, 22192.0]
  - - [1024, 30522, 1, 160, 1024, 1024, 1024, 30522]
    - [19, 21897.0]
  - - [4096, 1024, 1, 1024, 4096, 4096, 4096, 1024]
    - [8, 22689.0]
  - - [1024, 4096, 1, 1152, 1024, 1024, 1024, 4096]
    - [19, 22790.0]
  - - [1024, 30522, 1, 180, 1024, 1024, 1024, 30522]
    - [19, 21853.0]
  - - [4096, 1024, 1, 1152, 4096, 4096, 4096, 1024]
    - [2, 22854.0]
  - - [1024, 4096, 1, 8192, 1024, 1024, 1024, 4096]
    - [13, 23217.0]
  - - [1024, 4096, 1, 9600, 1024, 1024, 1024, 4096]
    - [30, 23233.0]
  - - [1024, 33712, 1, 8192, 1024, 1024, 1024, 33712]
    - [13, 24032.0]
  - - [1024, 33712, 1, 9600, 1024, 1024, 1024, 33712]
    - [8, 24041.0]
  - - [4096, 1024, 1, 8192, 4096, 4096, 4096, 1024]
    - [2, 23163.0]
  - - [4096, 1024, 1, 9600, 4096, 4096, 4096, 1024]
    - [2, 23197.0]
  - - [1024, 1600, 1, 1, 1024, 1024, 1024, 1600]
    - [12, 251.0]
  - - [2560, 1920, 1, 2048, 2560, 2560, 2560, 1920]
    - [23, 23410.0]
  - - [1024, 3072, 1, 4096, 1024, 1024, 1024, 3072]
    - [2, 22384.0]
  - - [2560, 2560, 1, 2048, 2560, 2560, 2560, 2560]
    - [19, 23601.0]
  - - [2048, 2048, 1, 2, 2048, 2048, 2048, 2048]
    - [18, 625.0]
  - - [1024, 30592, 1, 2048, 1024, 1024, 1024, 30592]
    - [13, 24003.0]
  - - [1024, 3072, 1, 16384, 1024, 1024, 1024, 3072]
    - [13, 22474.0]
  - - [6144, 1536, 1, 4096, 6144, 6144, 6144, 1536]
    - [2, 23708.0]
  - - [1536, 4608, 1, 8192, 1536, 1536, 1536, 4608]
    - [13, 23472.0]
  - - [640, 2560, 1, 2048, 640, 640, 640, 2560]
    - [19, 21520.0]
  - - [1024, 4096, 1, 16384, 1024, 1024, 1024, 4096]
    - [30, 23280.0]
  - - [1536, 6144, 1, 4096, 1536, 1536, 1536, 6144]
    - [2, 23799.0]
  - - [1024, 30592, 1, 4096, 1024, 1024, 1024, 30592]
    - [13, 24064.0]
  - - [2560, 2560, 1, 4, 2560, 2560, 2560, 2560]
    - [14, 1270.0]
  - - [1536, 1536, 1, 4096, 1536, 1536, 1536, 1536]
    - [2, 20871.0]
  - - [2560, 7680, 1, 2048, 2560, 2560, 2560, 7680]
    - [2, 23922.0]
  - - [1536, 50304, 1, 4096, 1536, 1536, 1536, 50304]
    - [19, 24158.0]
  - - [2048, 8192, 1, 1024, 2048, 2048, 2048, 8192]
    - [19, 23500.0]
  - - [1024, 30592, 1, 8192, 1024, 1024, 1024, 30592]
    - [2, 24071.0]
  - - [4096, 1024, 1, 16384, 4096, 4096, 4096, 1024]
    - [19, 23172.0]
  - - [8192, 2048, 1, 1024, 8192, 8192, 8192, 2048]
    - [19, 23580.0]
  - - [1024, 50304, 1, 4096, 1024, 1024, 1024, 50304]
    - [2, 24110.0]
  - - [1536, 4608, 1, 4096, 1536, 1536, 1536, 4608]
    - [2, 23280.0]
  - - [6144, 1536, 1, 8192, 6144, 6144, 6144, 1536]
    - [2, 23796.0]
  - - [1024, 3072, 1, 8192, 1024, 1024, 1024, 3072]
    - [2, 22468.0]
  - - [1536, 1536, 1, 8192, 1536, 1536, 1536, 1536]
    - [13, 20901.0]
  - - [1536, 50304, 1, 8192, 1536, 1536, 1536, 50304]
    - [23, 23848.0]
  - - [2048, 6144, 1, 1024, 2048, 2048, 2048, 6144]
    - [13, 23351.0]
  - - [2048, 30592, 1, 1024, 2048, 2048, 2048, 30592]
    - [13, 23959.0]
  - - [1536, 6144, 1, 8192, 1536, 1536, 1536, 6144]
    - [2, 23742.0]
  - - [1024, 50304, 1, 2048, 1024, 1024, 1024, 50304]
    - [2, 24076.0]
  - - [1024, 50304, 1, 8192, 1024, 1024, 1024, 50304]
    - [21, 23613.0]
  - - [1024, 3072, 1, 2048, 1024, 1024, 1024, 3072]
    - [8, 21985.0]
  - - [1024, 50304, 1, 16384, 1024, 1024, 1024, 50304]
    - [2, 23839.0]
  - - [1024, 30528, 1, 8192, 1024, 1024, 1024, 30528]
    - [19, 23979.0]
  - - [256, 6912, 1, 1, 256, 256, 256, 6912]
    - [1, 251.0]
  - - [30528, 1024, 1, 640, 30528, 30528, 30528, 1024]
    - [2, 23545.0]
  - - [30528, 1024, 1, 1280, 30528, 30528, 30528, 1024]
    - [13, 23822.0]
  - - [4096, 1024, 1, 10240, 4096, 4096, 4096, 1024]
    - [8, 23147.0]
  - - [1024, 4096, 1, 10240, 1024, 1024, 1024, 4096]
    - [2, 23107.0]
  - - [30528, 1024, 1, 1600, 30528, 30528, 30528, 1024]
    - [30, 23874.0]
  - - [1024, 4096, 1, 10496, 1024, 1024, 1024, 4096]
    - [19, 23177.0]
  - - [30528, 1024, 1, 1640, 30528, 30528, 30528, 1024]
    - [23, 23798.0]
  - - [4096, 1024, 1, 10496, 4096, 4096, 4096, 1024]
    - [19, 23170.0]
  - - [30528, 1024, 1, 160, 30528, 30528, 30528, 1024]
    - [19, 22083.0]
  - - [1024, 4096, 1, 6144, 1024, 1024, 1024, 4096]
    - [2, 23121.0]
  - - [30528, 1024, 1, 240, 30528, 30528, 30528, 1024]
    - [13, 22785.0]
  - - [4096, 1024, 1, 6144, 4096, 4096, 4096, 1024]
    - [2, 23125.0]
  - - [1024, 4096, 1, 10224, 1024, 1024, 1024, 4096]
    - [19, 23183.0]
  - - [4096, 1024, 1, 10224, 4096, 4096, 4096, 1024]
    - [19, 23093.0]
  - - [1024, 3072, 1, 10224, 1024, 1024, 1024, 3072]
    - [2, 22305.0]
  - - [1024, 3072, 1, 10240, 1024, 1024, 1024, 3072]
    - [23, 21999.0]
  - - [4096, 1024, 1, 10192, 4096, 4096, 4096, 1024]
    - [2, 23080.0]
  - - [1024, 3072, 1, 10192, 1024, 1024, 1024, 3072]
    - [2, 22272.0]
  - - [1024, 4096, 1, 10192, 1024, 1024, 1024, 4096]
    - [30, 23212.0]
  - - [1024, 3072, 1, 10200, 1024, 1024, 1024, 3072]
    - [2, 22456.0]
  - - [4096, 1024, 1, 10208, 4096, 4096, 4096, 1024]
    - [23, 23199.0]
  - - [1024, 3072, 1, 10208, 1024, 1024, 1024, 3072]
    - [2, 22437.0]
  - - [1024, 4096, 1, 10208, 1024, 1024, 1024, 4096]
    - [13, 23171.0]
  - - [1024, 2048, 1, 10224, 1024, 1024, 1024, 2048]
    - [2, 21109.0]
  - - [1024, 2048, 1, 10240, 1024, 1024, 1024, 2048]
    - [8, 21004.0]
  - - [1024, 2048, 1, 10192, 1024, 1024, 1024, 2048]
    - [8, 20992.0]
  - - [1024, 3072, 1, 10080, 1024, 1024, 1024, 3072]
    - [23, 22073.0]
  - - [100352, 256, 1, 512, 100352, 100352, 100352, 256]
    - [13, 23289.0]
  - - [12544, 1024, 1, 2048, 12544, 12544, 12544, 1024]
    - [2, 23445.0]
  - - [12544, 147, 1, 64, 12544, 12544, 12544, 147]
    - [12, 10156.0]
  - - [200704, 256, 1, 512, 200704, 200704, 200704, 256]
    - [23, 23597.0]
  - - [25088, 512, 1, 1024, 25088, 25088, 25088, 512]
    - [8, 23270.0]
  - - [3136, 576, 1, 64, 3136, 3136, 3136, 576]
    - [1, 13107.0]
  - - [50176, 512, 1, 1024, 50176, 50176, 50176, 512]
    - [13, 23678.0]
  - - [6272, 1024, 1, 2048, 6272, 6272, 6272, 1024]
    - [8, 23087.0]
  - - [3136, 256, 128, 128, 3136, 3136, 3136, 256]
    - [2, 21710.0]
  - - [3136, 256, 256, 128, 3136, 3136, 3136, 256]
    - [8, 21915.0]
  - - [784, 512, 128, 256, 784, 784, 784, 512]
    - [8, 20019.0]
  - - [784, 512, 256, 256, 784, 784, 784, 512]
    - [2, 20172.0]
  - - [30528, 1024, 1, 2560, 30528, 30528, 30528, 1024]
    - [13, 23848.0]
  - - [1024, 4096, 1, 12288, 1024, 1024, 1024, 4096]
    - [19, 23233.0]
  - - [30528, 1024, 1, 1920, 30528, 30528, 30528, 1024]
    - [23, 23809.0]
  - - [4096, 1024, 1, 12288, 4096, 4096, 4096, 1024]
    - [30, 23215.0]
  - - [25600, 128, 25, 128, 25600, 25600, 25600, 128]
    - [0, 20662.0]
  - - [12544, 128, 36, 128, 12544, 12544, 12544, 128]
    - [26, 21307.0]
  - - [9216, 128, 49, 128, 9216, 9216, 9216, 128]
    - [4, 20813.0]
  - - [6400, 128, 64, 128, 6400, 6400, 6400, 128]
    - [33, 21449.0]
  - - [6400, 256, 25, 256, 6400, 6400, 6400, 256]
    - [23, 23106.0]
  - - [4096, 256, 36, 256, 4096, 4096, 4096, 256]
    - [2, 22932.0]
  - - [2304, 256, 49, 256, 2304, 2304, 2304, 256]
    - [19, 22830.0]
  - - [2304, 256, 64, 256, 2304, 2304, 2304, 256]
    - [8, 23007.0]
  - - [2304, 512, 25, 512, 2304, 2304, 2304, 512]
    - [23, 23553.0]
  - - [1024, 512, 36, 512, 1024, 1024, 1024, 512]
    - [13, 23273.0]
  - - [1024, 512, 49, 512, 1024, 1024, 1024, 512]
    - [13, 23382.0]
  - - [1024, 512, 64, 512, 1024, 1024, 1024, 512]
    - [2, 23488.0]
  - - [3072, 768, 1, 2048, 3072, 3072, 3072, 768]
    - [8, 20622.0]
  - - [768, 3072, 1, 2048, 768, 768, 768, 3072]
    - [13, 20679.0]
  - - [3072, 768, 1, 4608, 3072, 3072, 3072, 768]
    - [8, 20940.0]
  - - [768, 3072, 1, 4608, 768, 768, 768, 3072]
    - [8, 20924.0]
  - - [4096, 1024, 1, 4608, 4096, 4096, 4096, 1024]
    - [2, 23105.0]
  - - [1024, 4096, 1, 4608, 1024, 1024, 1024, 4096]
    - [30, 22902.0]
  - - [196, 1024, 128, 512, 196, 196, 196, 1024]
    - [13, 17563.0]
  - - [196, 1024, 256, 512, 196, 196, 196, 1024]
    - [19, 17714.0]
  - - [4880, 256, 49, 256, 4880, 4880, 4880, 256]
    - [23, 22548.0]
  - - [3128, 256, 64, 256, 3128, 3128, 3128, 256]
    - [13, 22495.0]
  - - [4680, 256, 49, 256, 4680, 4680, 4680, 256]
    - [19, 22763.0]
  - - [5280, 256, 36, 256, 5280, 5280, 5280, 256]
    - [23, 22525.0]
  - - [2640, 256, 64, 256, 2640, 2640, 2640, 256]
    - [23, 22427.0]
  - - [5304, 256, 49, 256, 5304, 5304, 5304, 256]
    - [2, 22754.0]
  - - [2760, 256, 64, 256, 2760, 2760, 2760, 256]
    - [2, 22445.0]
  - - [6440, 256, 36, 256, 6440, 6440, 6440, 256]
    - [30, 22715.0]
  - - [5704, 256, 36, 256, 5704, 5704, 5704, 256]
    - [19, 22768.0]
  - - [2128, 256, 64, 256, 2128, 2128, 2128, 256]
    - [2, 22273.0]
  - - [1160, 256, 49, 256, 1160, 1160, 1160, 256]
    - [8, 20203.0]
  - - [4056, 256, 49, 256, 4056, 4056, 4056, 256]
    - [8, 22753.0]
  - - [6144, 256, 36, 256, 6144, 6144, 6144, 256]
    - [2, 23123.0]
  - - [6336, 256, 36, 256, 6336, 6336, 6336, 256]
    - [2, 22819.0]
  - - [13600, 512, 2, 128, 13600, 13600, 13600, 512]
    - [8, 20570.0]
  - - [15200, 512, 2, 128, 15200, 15200, 15200, 512]
    - [8, 21132.0]
  - - [15200, 128, 2, 512, 15200, 15200, 15200, 128]
    - [2, 21367.0]
  - - [13600, 128, 2, 512, 13600, 13600, 13600, 128]
    - [2, 20723.0]
  - - [5632, 256, 36, 256, 5632, 5632, 5632, 256]
    - [30, 23101.0]
  - - [12288, 128, 2, 512, 12288, 12288, 12288, 128]
    - [8, 21137.0]
  - - [12880, 128, 2, 512, 12880, 12880, 12880, 128]
    - [23, 20538.0]
  - - [11408, 128, 2, 512, 11408, 11408, 11408, 128]
    - [8, 20585.0]
  - - [13824, 512, 2, 128, 13824, 13824, 13824, 512]
    - [13, 21479.0]
  - - [13824, 128, 2, 512, 13824, 13824, 13824, 128]
    - [2, 22086.0]
  - - [10560, 128, 2, 512, 10560, 10560, 10560, 128]
    - [2, 19245.0]
  - - [10752, 128, 2, 512, 10752, 10752, 10752, 128]
    - [8, 20658.0]
  - - [13600, 512, 2, 256, 13600, 13600, 13600, 512]
    - [13, 21451.0]
  - - [15200, 512, 2, 256, 15200, 15200, 15200, 512]
    - [23, 21601.0]
  - - [768, 2048, 2, 512, 768, 768, 768, 2048]
    - [30, 20559.0]
  - - [12880, 512, 2, 128, 12880, 12880, 12880, 512]
    - [8, 19585.0]
  - - [11616, 128, 2, 512, 11616, 11616, 11616, 128]
    - [2, 18649.0]
  - - [14208, 512, 2, 128, 14208, 14208, 14208, 512]
    - [30, 20784.0]
  - - [11408, 512, 2, 128, 11408, 11408, 11408, 512]
    - [3, 19170.0]
  - - [6912, 256, 36, 256, 6912, 6912, 6912, 256]
    - [2, 23191.0]
  - - [13824, 512, 2, 256, 13824, 13824, 13824, 512]
    - [2, 22306.0]
  - - [11616, 512, 2, 128, 11616, 11616, 11616, 512]
    - [2, 20920.0]
  - - [12288, 512, 2, 128, 12288, 12288, 12288, 512]
    - [2, 21521.0]
  - - [14208, 128, 2, 512, 14208, 14208, 14208, 128]
    - [30, 20948.0]
  - - [11968, 128, 2, 512, 11968, 11968, 11968, 128]
    - [30, 20034.0]
  - - [864, 2048, 2, 512, 864, 864, 864, 2048]
    - [23, 19890.0]
  - - [10560, 512, 2, 128, 10560, 10560, 10560, 512]
    - [8, 19870.0]
  - - [672, 2048, 2, 512, 672, 672, 672, 2048]
    - [23, 18322.0]
  - - [9408, 128, 2, 512, 9408, 9408, 9408, 128]
    - [2, 19377.0]
  - - [10752, 512, 2, 128, 10752, 10752, 10752, 512]
    - [10, 20484.0]
  - - [11968, 512, 2, 128, 11968, 11968, 11968, 512]
    - [14, 19419.0]
  - - [1240, 256, 49, 256, 1240, 1240, 1240, 256]
    - [8, 21499.0]
  - - [4032, 256, 2, 1024, 4032, 4032, 4032, 256]
    - [8, 19480.0]
  - - [888, 2048, 2, 512, 888, 888, 888, 2048]
    - [2, 20747.0]
  - - [12880, 512, 2, 256, 12880, 12880, 12880, 512]
    - [13, 21800.0]
  - - [12288, 512, 2, 256, 12288, 12288, 12288, 512]
    - [19, 22382.0]
  - - [13440, 128, 2, 512, 13440, 13440, 13440, 128]
    - [8, 21494.0]
  - - [864, 2048, 2, 256, 864, 864, 864, 2048]
    - [23, 18851.0]
  - - [12672, 128, 2, 512, 12672, 12672, 12672, 128]
    - [30, 22105.0]
  - - [11264, 128, 2, 512, 11264, 11264, 11264, 128]
    - [8, 21667.0]
  - - [11776, 128, 2, 512, 11776, 11776, 11776, 128]
    - [19, 20449.0]
  - - [16128, 128, 2, 512, 16128, 16128, 16128, 128]
    - [30, 21593.0]
  - - [4032, 1024, 2, 256, 4032, 4032, 4032, 1024]
    - [8, 20636.0]
  - - [14000, 128, 2, 512, 14000, 14000, 14000, 128]
    - [2, 20303.0]
  - - [13440, 512, 2, 128, 13440, 13440, 13440, 512]
    - [19, 20803.0]
  - - [768, 2048, 2, 256, 768, 768, 768, 2048]
    - [2, 19083.0]
  - - [3264, 1024, 2, 256, 3264, 3264, 3264, 1024]
    - [2, 20368.0]
  - - [4200, 256, 2, 1024, 4200, 4200, 4200, 256]
    - [13, 19580.0]
  - - [2352, 1024, 2, 256, 2352, 2352, 2352, 1024]
    - [30, 18735.0]
  - - [2400, 1024, 2, 256, 2400, 2400, 2400, 1024]
    - [2, 19187.0]
  - - [15200, 256, 2, 12, 15200, 15200, 15200, 256]
    - [31, 4268.0]
  - - [12880, 256, 2, 12, 12880, 12880, 12880, 256]
    - [1, 4441.0]
  - - [2520, 1024, 2, 256, 2520, 2520, 2520, 1024]
    - [30, 19940.0]
  - - [13600, 256, 2, 12, 13600, 13600, 13600, 256]
    - [7, 4571.0]
  - - [15200, 256, 2, 3, 15200, 15200, 15200, 256]
    - [7, 1207.0]
  - - [12880, 256, 2, 3, 12880, 12880, 12880, 256]
    - [5, 1113.0]
  - - [4200, 1024, 2, 256, 4200, 4200, 4200, 1024]
    - [8, 21379.0]
  - - [12288, 256, 2, 12, 12288, 12288, 12288, 256]
    - [1, 3544.0]
  - - [13824, 256, 2, 12, 13824, 13824, 13824, 256]
    - [34, 4217.0]
  - - [13600, 256, 2, 3, 13600, 13600, 13600, 256]
    - [1, 1070.0]
  - - [7600, 512, 1, 256, 7600, 7600, 7600, 512]
    - [2, 20430.0]
  - - [6144, 512, 1, 256, 6144, 6144, 6144, 512]
    - [19, 20295.0]
  - - [12544, 1024, 1, 1024, 12544, 12544, 12544, 1024]
    - [19, 23327.0]
  - - [3800, 256, 2, 3, 3800, 3800, 3800, 256]
    - [7, 817.0]
  - - [13824, 256, 2, 3, 13824, 13824, 13824, 256]
    - [27, 988.0]
  - - [12288, 256, 2, 3, 12288, 12288, 12288, 256]
    - [1, 887.0]
  - - [2688, 256, 2, 1024, 2688, 2688, 2688, 256]
    - [13, 18317.0]
  - - [3072, 256, 2, 12, 3072, 3072, 3072, 256]
    - [20, 3457.0]
  - - [3800, 256, 2, 12, 3800, 3800, 3800, 256]
    - [32, 2527.0]
  - - [3072, 256, 2, 3, 3072, 3072, 3072, 256]
    - [14, 600.0]
  - - [2520, 256, 2, 1024, 2520, 2520, 2520, 256]
    - [8, 19602.0]
  - - [16128, 512, 2, 128, 16128, 16128, 16128, 512]
    - [19, 21739.0]
  - - [2400, 256, 2, 1024, 2400, 2400, 2400, 256]
    - [2, 19193.0]
  - - [2352, 256, 2, 1024, 2352, 2352, 2352, 256]
    - [2, 18925.0]
  - - [2944, 256, 2, 1024, 2944, 2944, 2944, 256]
    - [23, 19983.0]
  - - [2992, 1024, 2, 256, 2992, 2992, 2992, 1024]
    - [2, 20668.0]
  - - [2816, 256, 2, 1024, 2816, 2816, 2816, 256]
    - [13, 19184.0]
  - - [2904, 1024, 2, 256, 2904, 2904, 2904, 1024]
    - [2, 20743.0]
  - - [3456, 256, 2, 3, 3456, 3456, 3456, 256]
    - [3, 882.0]
  - - [3400, 256, 2, 3, 3400, 3400, 3400, 256]
    - [1, 811.0]
  - - [2816, 1024, 2, 256, 2816, 2816, 2816, 1024]
    - [23, 21623.0]
  - - [3456, 256, 2, 12, 3456, 3456, 3456, 256]
    - [1, 3349.0]
  - - [2944, 1024, 2, 256, 2944, 2944, 2944, 1024]
    - [30, 21503.0]
  - - [3168, 256, 2, 1024, 3168, 3168, 3168, 256]
    - [2, 20526.0]
  - - [2992, 256, 2, 1024, 2992, 2992, 2992, 256]
    - [2, 19747.0]
  - - [51520, 256, 2, 12, 51520, 51520, 51520, 256]
    - [16, 7430.0]
  - - [3072, 256, 2, 1024, 3072, 3072, 3072, 256]
    - [23, 19499.0]
  - - [2640, 1024, 2, 256, 2640, 2640, 2640, 1024]
    - [8, 20391.0]
  - - [2688, 1024, 2, 256, 2688, 2688, 2688, 1024]
    - [33, 20947.0]
  - - [2904, 256, 2, 1024, 2904, 2904, 2904, 256]
    - [8, 18876.0]
  - - [3264, 256, 2, 1024, 3264, 3264, 3264, 256]
    - [19, 17886.0]
  - - [54400, 256, 2, 12, 54400, 54400, 54400, 256]
    - [6, 6774.0]
  - - [55296, 256, 2, 3, 55296, 55296, 55296, 256]
    - [29, 2109.0]
  - - [60800, 256, 2, 12, 60800, 60800, 60800, 256]
    - [24, 8881.0]
  - - [51520, 256, 2, 3, 51520, 51520, 51520, 256]
    - [18, 1644.0]
  - - [55296, 256, 2, 12, 55296, 55296, 55296, 256]
    - [22, 6195.0]
  - - [3600, 1024, 2, 256, 3600, 3600, 3600, 1024]
    - [13, 20551.0]
  - - [60800, 256, 2, 3, 60800, 60800, 60800, 256]
    - [22, 2796.0]
  - - [952, 256, 64, 256, 952, 952, 952, 256]
    - [8, 20644.0]
  - - [49152, 256, 2, 12, 49152, 49152, 49152, 256]
    - [12, 5653.0]
  - - [3360, 256, 2, 1024, 3360, 3360, 3360, 256]
    - [8, 19082.0]
  - - [736, 256, 64, 256, 736, 736, 736, 256]
    - [8, 21009.0]
  - - [600, 256, 64, 256, 600, 600, 600, 256]
    - [13, 20302.0]
  - - [1440, 256, 49, 256, 1440, 1440, 1440, 256]
    - [8, 21102.0]
  - - [3168, 1024, 2, 256, 3168, 3168, 3168, 1024]
    - [2, 21432.0]
  - - [1368, 256, 49, 256, 1368, 1368, 1368, 256]
    - [19, 21647.0]
  - - [49152, 256, 2, 3, 49152, 49152, 49152, 256]
    - [12, 1480.0]
  - - [3600, 256, 2, 1024, 3600, 3600, 3600, 256]
    - [2, 20502.0]
  - - [3360, 1024, 2, 256, 3360, 3360, 3360, 1024]
    - [2, 20867.0]
  - - [54400, 256, 2, 3, 54400, 54400, 54400, 256]
    - [14, 2110.0]
  - - [3072, 1024, 2, 256, 3072, 3072, 3072, 1024]
    - [2, 21344.0]
  - - [2640, 256, 2, 1024, 2640, 2640, 2640, 256]
    - [2, 17578.0]
  - - [616, 256, 64, 256, 616, 616, 616, 256]
    - [23, 20643.0]
  - - [3008, 256, 64, 256, 3008, 3008, 3008, 256]
    - [19, 22452.0]
  - - [896, 256, 64, 256, 896, 896, 896, 256]
    - [23, 22560.0]
  - - [768, 256, 64, 256, 768, 768, 768, 256]
    - [2, 22451.0]
  - - [3552, 256, 2, 1024, 3552, 3552, 3552, 256]
    - [2, 20124.0]
  - - [3552, 1024, 2, 256, 3552, 3552, 3552, 1024]
    - [0, 21014.0]
  - - [800, 256, 64, 256, 800, 800, 800, 256]
    - [30, 19815.0]
  - - [1120, 256, 49, 256, 1120, 1120, 1120, 256]
    - [19, 21460.0]
  - - [2408, 256, 64, 256, 2408, 2408, 2408, 256]
    - [2, 22587.0]
  - - [3456, 256, 2, 1024, 3456, 3456, 3456, 256]
    - [19, 19734.0]
  - - [672, 256, 64, 256, 672, 672, 672, 256]
    - [2, 19216.0]
  - - [3456, 1024, 2, 256, 3456, 3456, 3456, 1024]
    - [2, 22016.0]
  - - [1064, 256, 49, 256, 1064, 1064, 1064, 256]
    - [8, 20514.0]
  - - [3400, 256, 2, 1024, 3400, 3400, 3400, 256]
    - [2, 19351.0]
  - - [704, 256, 64, 256, 704, 704, 704, 256]
    - [8, 20156.0]
  - - [3400, 1024, 2, 256, 3400, 3400, 3400, 1024]
    - [2, 21166.0]
  - - [3264, 256, 64, 256, 3264, 3264, 3264, 256]
    - [19, 22528.0]
  - - [3800, 1024, 2, 256, 3800, 3800, 3800, 1024]
    - [28, 21235.0]
  - - [3800, 256, 2, 1024, 3800, 3800, 3800, 256]
    - [30, 21427.0]
  - - [6440, 512, 1, 256, 6440, 6440, 6440, 512]
    - [2, 18326.0]
  - - [6912, 512, 1, 256, 6912, 6912, 6912, 512]
    - [19, 21001.0]
  - - [6800, 512, 1, 256, 6800, 6800, 6800, 512]
    - [2, 19675.0]
  - - [6800, 512, 1, 1024, 6800, 6800, 6800, 512]
    - [13, 21578.0]
  - - [6440, 512, 1, 1024, 6440, 6440, 6440, 512]
    - [13, 20167.0]
  - - [6912, 512, 1, 1024, 6912, 6912, 6912, 512]
    - [13, 21944.0]
  - - [1728, 1024, 1, 512, 1728, 1728, 1728, 1024]
    - [2, 17463.0]
  - - [1536, 1024, 1, 512, 1536, 1536, 1536, 1024]
    - [8, 18711.0]
  - - [7600, 512, 1, 1024, 7600, 7600, 7600, 512]
    - [13, 21738.0]
  - - [6144, 512, 1, 1024, 6144, 6144, 6144, 512]
    - [30, 21395.0]
  - - [1728, 1024, 1, 2048, 1728, 1728, 1728, 1024]
    - [8, 19661.0]
  - - [1536, 1024, 1, 2048, 1536, 1536, 1536, 1024]
    - [13, 20774.0]
  - - [4524, 256, 49, 256, 4524, 4524, 4524, 256]
    - [2, 22566.0]
  - - [2666, 256, 64, 256, 2666, 2666, 2666, 256]
    - [2, 22659.0]
  - - [950, 2048, 2, 512, 950, 950, 950, 2048]
    - [8, 20003.0]
  - - [3220, 1024, 2, 256, 3220, 3220, 3220, 1024]
    - [0, 20889.0]
  - - [782, 128, 64, 128, 782, 782, 782, 128]
    - [23, 17097.0]
  - - [850, 2048, 2, 512, 850, 850, 850, 2048]
    - [2, 19615.0]
  - - [805, 2048, 2, 512, 805, 805, 805, 2048]
    - [2, 18658.0]
  - - [713, 2048, 2, 512, 713, 713, 713, 2048]
    - [2, 19419.0]
  - - [660, 2048, 2, 512, 660, 660, 660, 2048]
    - [2, 17276.0]
  - - [726, 2048, 2, 512, 726, 726, 726, 2048]
    - [2, 18965.0]
  - - [805, 2048, 2, 256, 805, 805, 805, 2048]
    - [2, 16429.0]
  - - [1251, 256, 49, 256, 1251, 1251, 1251, 256]
    - [8, 21636.0]
  - - [1900, 1024, 1, 2048, 1900, 1900, 1900, 1024]
    - [2, 21762.0]
  - - [1610, 1024, 1, 2048, 1610, 1610, 1610, 1024]
    - [2, 18743.0]
  - - [1900, 1024, 1, 512, 1900, 1900, 1900, 1024]
    - [8, 18746.0]
  - - [3220, 256, 2, 12, 3220, 3220, 3220, 256]
    - [31, 1940.0]
  - - [3220, 256, 2, 3, 3220, 3220, 3220, 256]
    - [31, 574.0]
  - - [3036, 1024, 2, 256, 3036, 3036, 3036, 1024]
    - [2, 20246.0]
  - - [3036, 256, 2, 1024, 3036, 3036, 3036, 256]
    - [8, 18859.0]
  - - [850, 2048, 2, 256, 850, 850, 850, 2048]
    - [6, 17367.0]
  - - [2852, 1024, 2, 256, 2852, 2852, 2852, 1024]
    - [2, 19837.0]
  - - [950, 2048, 2, 256, 950, 950, 950, 2048]
    - [2, 18225.0]
  - - [3700, 1024, 2, 256, 3700, 3700, 3700, 1024]
    - [23, 20275.0]
  - - [2852, 256, 2, 1024, 2852, 2852, 2852, 256]
    - [2, 17998.0]
  - - [3700, 256, 2, 1024, 3700, 3700, 3700, 256]
    - [2, 20028.0]
  - - [1269, 256, 49, 256, 1269, 1269, 1269, 256]
    - [13, 21867.0]
  - - [1467, 256, 49, 256, 1467, 1467, 1467, 256]
    - [13, 21332.0]
  - - [3500, 256, 2, 1024, 3500, 3500, 3500, 256]
    - [8, 19782.0]
  - - [1449, 256, 49, 256, 1449, 1449, 1449, 256]
    - [13, 21082.0]
  - - [1278, 256, 49, 256, 1278, 1278, 1278, 256]
    - [2, 22205.0]
  - - [1413, 256, 49, 256, 1413, 1413, 1413, 256]
    - [8, 20655.0]
  - - [1341, 256, 49, 256, 1341, 1341, 1341, 256]
    - [30, 21118.0]
  - - [1287, 256, 49, 256, 1287, 1287, 1287, 256]
    - [13, 20323.0]
  - - [1332, 256, 49, 256, 1332, 1332, 1332, 256]
    - [8, 21038.0]
  - - [1359, 256, 49, 256, 1359, 1359, 1359, 256]
    - [2, 21675.0]
  - - [1395, 256, 49, 256, 1395, 1395, 1395, 256]
    - [2, 22129.0]
  - - [1323, 256, 49, 256, 1323, 1323, 1323, 256]
    - [23, 20830.0]
  - - [1404, 256, 49, 256, 1404, 1404, 1404, 256]
    - [19, 22151.0]
  - - [1386, 256, 49, 256, 1386, 1386, 1386, 256]
    - [8, 21962.0]
  - - [1350, 256, 49, 256, 1350, 1350, 1350, 256]
    - [30, 21354.0]
  - - [3500, 1024, 2, 256, 3500, 3500, 3500, 1024]
    - [2, 20786.0]
  - - [3220, 256, 2, 1024, 3220, 3220, 3220, 256]
    - [13, 17865.0]
  - - [690, 256, 64, 256, 690, 690, 690, 256]
    - [2, 19682.0]
  - - [660, 256, 64, 256, 660, 660, 660, 256]
    - [2, 18950.0]
  - - [782, 256, 64, 256, 782, 782, 782, 256]
    - [2, 19500.0]
  - - [884, 256, 64, 256, 884, 884, 884, 256]
    - [2, 21960.0]
  - - [1610, 1024, 1, 512, 1610, 1610, 1610, 1024]
    - [2, 17361.0]
  - - [1700, 1024, 1, 512, 1700, 1700, 1700, 1024]
    - [2, 18461.0]
  - - [1700, 1024, 1, 2048, 1700, 1700, 1700, 1024]
    - [8, 19372.0]
  - - [1444, 128, 120, 256, 1444, 1444, 1444, 128]
    - [23, 20908.0]
  - - [1444, 128, 18, 256, 1444, 1444, 1444, 128]
    - [23, 18532.0]
  - - [1444, 128, 19, 256, 1444, 1444, 1444, 128]
    - [8, 18871.0]
  - - [1444, 256, 120, 256, 1444, 1444, 1444, 256]
    - [19, 21365.0]
  - - [1444, 256, 18, 256, 1444, 1444, 1444, 256]
    - [2, 19830.0]
  - - [1444, 256, 19, 256, 1444, 1444, 1444, 256]
    - [8, 20377.0]
  - - [361, 512, 120, 256, 361, 361, 361, 512]
    - [30, 20650.0]
  - - [361, 512, 18, 256, 361, 361, 361, 512]
    - [19, 18459.0]
  - - [361, 512, 19, 256, 361, 361, 361, 512]
    - [19, 18544.0]
  - - [1920, 25216, 1, 16384, 1920, 1920, 1920, 25216]
    - [23, 23879.0]
  - - [3840, 1920, 1, 16384, 3840, 3840, 3840, 1920]
    - [8, 23448.0]
  - - [1920, 3840, 1, 16384, 1920, 1920, 1920, 3840]
    - [19, 23419.0]
  - - [960, 1920, 1, 16384, 960, 960, 960, 1920]
    - [2, 21274.0]
  - - [1920, 2880, 1, 16384, 1920, 1920, 1920, 2880]
    - [30, 22434.0]
  - - [1920, 25216, 1, 4096, 1920, 1920, 1920, 25216]
    - [13, 24132.0]
  - - [3840, 1920, 1, 4096, 3840, 3840, 3840, 1920]
    - [2, 23346.0]
  - - [1920, 3840, 1, 4096, 1920, 1920, 1920, 3840]
    - [2, 23346.0]
  - - [960, 1920, 1, 4096, 960, 960, 960, 1920]
    - [2, 20767.0]
  - - [1920, 2880, 1, 4096, 1920, 1920, 1920, 2880]
    - [13, 22103.0]
  - - [1920, 25216, 1, 8192, 1920, 1920, 1920, 25216]
    - [13, 23847.0]
  - - [3840, 1920, 1, 8192, 3840, 3840, 3840, 1920]
    - [23, 23407.0]
  - - [1920, 3840, 1, 8192, 1920, 1920, 1920, 3840]
    - [19, 23419.0]
  - - [960, 1920, 1, 8192, 960, 960, 960, 1920]
    - [2, 21116.0]
  - - [1920, 2880, 1, 8192, 1920, 1920, 1920, 2880]
    - [13, 22069.0]
  - - [2304, 12672, 1, 16384, 2304, 2304, 2304, 12672]
    - [8, 23619.0]
  - - [2304, 2304, 1, 16384, 2304, 2304, 2304, 2304]
    - [13, 22762.0]
  - - [576, 2304, 1, 16384, 576, 576, 576, 2304]
    - [2, 18401.0]
  - - [2304, 1728, 1, 16384, 2304, 2304, 2304, 1728]
    - [13, 22080.0]
  - - [2304, 12672, 1, 4096, 2304, 2304, 2304, 12672]
    - [2, 23982.0]
  - - [2304, 2304, 1, 4096, 2304, 2304, 2304, 2304]
    - [8, 22603.0]
  - - [576, 2304, 1, 4096, 576, 576, 576, 2304]
    - [30, 17928.0]
  - - [2304, 1728, 1, 4096, 2304, 2304, 2304, 1728]
    - [23, 21787.0]
  - - [2304, 12672, 1, 8192, 2304, 2304, 2304, 12672]
    - [2, 23568.0]
  - - [2304, 2304, 1, 8192, 2304, 2304, 2304, 2304]
    - [2, 22653.0]
  - - [576, 2304, 1, 8192, 576, 576, 576, 2304]
    - [2, 18175.0]
  - - [2304, 1728, 1, 8192, 2304, 2304, 2304, 1728]
    - [13, 21895.0]
  - - [3072, 6400, 1, 4096, 3072, 3072, 3072, 6400]
    - [8, 23970.0]
  - - [1536, 3072, 1, 4096, 1536, 1536, 1536, 3072]
    - [2, 22651.0]
  - - [3072, 1536, 1, 4096, 3072, 3072, 3072, 1536]
    - [23, 22536.0]
  - - [384, 3072, 1, 4096, 384, 384, 384, 3072]
    - [19, 19667.0]
  - - [3072, 1152, 1, 4096, 3072, 3072, 3072, 1152]
    - [30, 22712.0]
  - - [3072, 6400, 1, 8192, 3072, 3072, 3072, 6400]
    - [2, 24000.0]
  - - [1536, 3072, 1, 8192, 1536, 1536, 1536, 3072]
    - [2, 22736.0]
  - - [3072, 1536, 1, 8192, 3072, 3072, 3072, 1536]
    - [2, 22752.0]
  - - [384, 3072, 1, 8192, 384, 384, 384, 3072]
    - [35, 19765.0]
  - - [3072, 1152, 1, 8192, 3072, 3072, 3072, 1152]
    - [2, 23005.0]
  - - [2048, 2048, 1, 4096, 2048, 2048, 2048, 2048]
    - [19, 22954.0]
  - - [2048, 2048, 1, 8, 2048, 2048, 2048, 2048]
    - [6, 2561.0]
  - - [2048, 29000, 1, 199, 2048, 2048, 2048, 29000]
    - [19, 22132.0]
  - - [2048, 29000, 1, 221, 2048, 2048, 2048, 29000]
    - [19, 22282.0]
  - - [2048, 29000, 1, 224, 2048, 2048, 2048, 29000]
    - [13, 23018.0]
  - - [2048, 29000, 1, 229, 2048, 2048, 2048, 29000]
    - [13, 22420.0]
  - - [2048, 29000, 1, 234, 2048, 2048, 2048, 29000]
    - [8, 22488.0]
  - - [2048, 29000, 1, 242, 2048, 2048, 2048, 29000]
    - [8, 22583.0]
  - - [2048, 29000, 1, 246, 2048, 2048, 2048, 29000]
    - [13, 22646.0]
  - - [2048, 29000, 1, 247, 2048, 2048, 2048, 29000]
    - [8, 22516.0]
  - - [2048, 29000, 1, 256, 2048, 2048, 2048, 29000]
    - [19, 23189.0]
  - - [2048, 29000, 1, 262, 2048, 2048, 2048, 29000]
    - [8, 22671.0]
  - - [2048, 29000, 1, 264, 2048, 2048, 2048, 29000]
    - [6, 22925.0]
  - - [2048, 29000, 1, 265, 2048, 2048, 2048, 29000]
    - [13, 22595.0]
  - - [2048, 29000, 1, 274, 2048, 2048, 2048, 29000]
    - [8, 22775.0]
  - - [2048, 29000, 1, 277, 2048, 2048, 2048, 29000]
    - [13, 22673.0]
  - - [2048, 29000, 1, 279, 2048, 2048, 2048, 29000]
    - [19, 22711.0]
  - - [2048, 29000, 1, 288, 2048, 2048, 2048, 29000]
    - [19, 23330.0]
  - - [2048, 29000, 1, 296, 2048, 2048, 2048, 29000]
    - [6, 23041.0]
  - - [2048, 29000, 1, 315, 2048, 2048, 2048, 29000]
    - [8, 22862.0]
  - - [2048, 29000, 1, 335, 2048, 2048, 2048, 29000]
    - [13, 22935.0]
  - - [2048, 4096, 1, 4096, 2048, 2048, 2048, 4096]
    - [2, 23558.0]
  - - [4096, 2048, 1, 4096, 4096, 4096, 4096, 2048]
    - [2, 23536.0]
  - - [1024, 29000, 1, 2283, 1024, 1024, 1024, 29000]
    - [13, 23850.0]
  - - [1024, 29000, 1, 2296, 1024, 1024, 1024, 29000]
    - [23, 23885.0]
  - - [1024, 29000, 1, 2306, 1024, 1024, 1024, 29000]
    - [2, 23897.0]
  - - [1024, 29000, 1, 2309, 1024, 1024, 1024, 29000]
    - [2, 23890.0]
  - - [1024, 29000, 1, 2318, 1024, 1024, 1024, 29000]
    - [2, 23893.0]
  - - [1024, 29000, 1, 2320, 1024, 1024, 1024, 29000]
    - [2, 23961.0]
  - - [1024, 29000, 1, 2324, 1024, 1024, 1024, 29000]
    - [2, 23899.0]
  - - [1024, 29000, 1, 2325, 1024, 1024, 1024, 29000]
    - [23, 23890.0]
  - - [1024, 29000, 1, 2329, 1024, 1024, 1024, 29000]
    - [13, 23889.0]
  - - [1024, 29000, 1, 2338, 1024, 1024, 1024, 29000]
    - [19, 23905.0]
  - - [1024, 29000, 1, 2345, 1024, 1024, 1024, 29000]
    - [23, 23890.0]
  - - [1024, 29000, 1, 2350, 1024, 1024, 1024, 29000]
    - [2, 23904.0]
  - - [1024, 29000, 1, 2362, 1024, 1024, 1024, 29000]
    - [2, 23912.0]
  - - [1024, 29000, 1, 2366, 1024, 1024, 1024, 29000]
    - [2, 23900.0]
  - - [1024, 29000, 1, 2368, 1024, 1024, 1024, 29000]
    - [13, 23969.0]
  - - [1024, 29000, 1, 2374, 1024, 1024, 1024, 29000]
    - [8, 23905.0]
  - - [1024, 29000, 1, 2390, 1024, 1024, 1024, 29000]
    - [13, 23912.0]
  - - [1024, 29000, 1, 561, 1024, 1024, 1024, 29000]
    - [2, 23261.0]
  - - [1024, 29000, 1, 574, 1024, 1024, 1024, 29000]
    - [8, 23332.0]
  - - [1024, 29000, 1, 600, 1024, 1024, 1024, 29000]
    - [13, 23393.0]
  - - [1024, 29000, 1, 608, 1024, 1024, 1024, 29000]
    - [13, 23641.0]
  - - [1024, 29000, 1, 615, 1024, 1024, 1024, 29000]
    - [19, 23370.0]
  - - [1024, 29000, 1, 622, 1024, 1024, 1024, 29000]
    - [13, 23418.0]
  - - [1024, 29000, 1, 625, 1024, 1024, 1024, 29000]
    - [19, 23388.0]
  - - [1024, 29000, 1, 626, 1024, 1024, 1024, 29000]
    - [23, 23423.0]
  - - [1024, 29000, 1, 628, 1024, 1024, 1024, 29000]
    - [19, 23432.0]
  - - [1024, 29000, 1, 636, 1024, 1024, 1024, 29000]
    - [8, 23422.0]
  - - [1024, 29000, 1, 651, 1024, 1024, 1024, 29000]
    - [23, 23416.0]
  - - [1024, 29000, 1, 658, 1024, 1024, 1024, 29000]
    - [23, 23459.0]
  - - [1024, 29000, 1, 669, 1024, 1024, 1024, 29000]
    - [8, 23414.0]
  - - [1024, 29000, 1, 670, 1024, 1024, 1024, 29000]
    - [8, 23440.0]
  - - [1024, 29000, 1, 672, 1024, 1024, 1024, 29000]
    - [23, 23677.0]
  - - [1024, 29000, 1, 684, 1024, 1024, 1024, 29000]
    - [23, 23461.0]
  - - [1024, 29000, 1, 716, 1024, 1024, 1024, 29000]
    - [19, 23471.0]
  - - [1024, 29000, 1, 730, 1024, 1024, 1024, 29000]
    - [13, 23495.0]
  - - [2560, 2560, 1, 1024, 2560, 2560, 2560, 2560]
    - [13, 23329.0]
  - - [2560, 2560, 1, 2, 2560, 2560, 2560, 2560]
    - [12, 611.0]
  - - [2560, 29000, 1, 109, 2560, 2560, 2560, 29000]
    - [13, 20438.0]
  - - [2560, 29000, 1, 121, 2560, 2560, 2560, 29000]
    - [19, 20854.0]
  - - [2560, 29000, 1, 27, 2560, 2560, 2560, 29000]
    - [0, 9017.0]
  - - [2560, 29000, 1, 35, 2560, 2560, 2560, 29000]
    - [27, 11189.0]
  - - [2560, 29000, 1, 36, 2560, 2560, 2560, 29000]
    - [34, 11395.0]
  - - [2560, 29000, 1, 39, 2560, 2560, 2560, 29000]
    - [27, 12186.0]
  - - [2560, 29000, 1, 40, 2560, 2560, 2560, 29000]
    - [34, 12471.0]
  - - [2560, 29000, 1, 42, 2560, 2560, 2560, 29000]
    - [27, 12939.0]
  - - [2560, 29000, 1, 43, 2560, 2560, 2560, 29000]
    - [16, 13074.0]
  - - [2560, 29000, 1, 44, 2560, 2560, 2560, 29000]
    - [16, 13454.0]
  - - [2560, 29000, 1, 46, 2560, 2560, 2560, 29000]
    - [12, 13710.0]
  - - [2560, 29000, 1, 48, 2560, 2560, 2560, 29000]
    - [24, 14354.0]
  - - [2560, 29000, 1, 49, 2560, 2560, 2560, 29000]
    - [12, 14530.0]
  - - [2560, 29000, 1, 50, 2560, 2560, 2560, 29000]
    - [12, 14782.0]
  - - [2560, 29000, 1, 51, 2560, 2560, 2560, 29000]
    - [12, 14892.0]
  - - [2560, 29000, 1, 53, 2560, 2560, 2560, 29000]
    - [5, 15282.0]
  - - [2560, 29000, 1, 54, 2560, 2560, 2560, 29000]
    - [11, 15539.0]
  - - [2560, 29000, 1, 55, 2560, 2560, 2560, 29000]
    - [11, 15593.0]
  - - [2560, 29000, 1, 56, 2560, 2560, 2560, 29000]
    - [9, 15829.0]
  - - [2560, 29000, 1, 57, 2560, 2560, 2560, 29000]
    - [9, 15875.0]
  - - [2560, 29000, 1, 58, 2560, 2560, 2560, 29000]
    - [18, 16275.0]
  - - [2560, 29000, 1, 59, 2560, 2560, 2560, 29000]
    - [3, 16192.0]
  - - [2560, 29000, 1, 61, 2560, 2560, 2560, 29000]
    - [5, 16139.0]
  - - [2560, 29000, 1, 63, 2560, 2560, 2560, 29000]
    - [9, 16423.0]
  - - [2560, 29000, 1, 65, 2560, 2560, 2560, 29000]
    - [12, 17754.0]
  - - [2560, 29000, 1, 66, 2560, 2560, 2560, 29000]
    - [18, 17944.0]
  - - [2560, 29000, 1, 67, 2560, 2560, 2560, 29000]
    - [12, 17808.0]
  - - [2560, 29000, 1, 69, 2560, 2560, 2560, 29000]
    - [12, 17890.0]
  - - [2560, 29000, 1, 70, 2560, 2560, 2560, 29000]
    - [18, 18121.0]
  - - [2560, 29000, 1, 71, 2560, 2560, 2560, 29000]
    - [12, 17989.0]
  - - [2560, 29000, 1, 73, 2560, 2560, 2560, 29000]
    - [5, 17974.0]
  - - [2560, 29000, 1, 74, 2560, 2560, 2560, 29000]
    - [12, 18320.0]
  - - [2560, 29000, 1, 75, 2560, 2560, 2560, 29000]
    - [5, 17967.0]
  - - [2560, 29000, 1, 77, 2560, 2560, 2560, 29000]
    - [18, 18007.0]
  - - [2560, 29000, 1, 78, 2560, 2560, 2560, 29000]
    - [4, 18158.0]
  - - [2560, 29000, 1, 80, 2560, 2560, 2560, 29000]
    - [8, 20217.0]
  - - [2560, 29000, 1, 81, 2560, 2560, 2560, 29000]
    - [19, 19019.0]
  - - [2560, 29000, 1, 82, 2560, 2560, 2560, 29000]
    - [13, 19217.0]
  - - [2560, 29000, 1, 83, 2560, 2560, 2560, 29000]
    - [13, 19153.0]
  - - [2560, 29000, 1, 84, 2560, 2560, 2560, 29000]
    - [13, 19375.0]
  - - [2560, 29000, 1, 88, 2560, 2560, 2560, 29000]
    - [13, 19600.0]
  - - [2560, 29000, 1, 89, 2560, 2560, 2560, 29000]
    - [13, 19411.0]
  - - [2560, 29000, 1, 90, 2560, 2560, 2560, 29000]
    - [13, 19689.0]
  - - [2560, 29000, 1, 92, 2560, 2560, 2560, 29000]
    - [19, 19763.0]
  - - [2560, 29000, 1, 95, 2560, 2560, 2560, 29000]
    - [19, 19755.0]
  - - [2560, 29000, 1, 98, 2560, 2560, 2560, 29000]
    - [13, 20163.0]
  - - [2560, 4096, 1, 1024, 2560, 2560, 2560, 4096]
    - [2, 23583.0]
  - - [4096, 2560, 1, 1024, 4096, 4096, 4096, 2560]
    - [13, 23563.0]
  - - [1024, 3072, 1, 32768, 1024, 1024, 1024, 3072]
    - [13, 22588.0]
  - - [1024, 4096, 1, 32768, 1024, 1024, 1024, 4096]
    - [2, 23311.0]
  - - [1024, 50304, 1, 32768, 1024, 1024, 1024, 50304]
    - [2, 23979.0]
  - - [4096, 1024, 1, 32768, 4096, 4096, 4096, 1024]
    - [30, 23266.0]
  - - [1024, 128, 24, 1024, 1024, 1024, 1024, 128]
    - [23, 21821.0]
  - - [128, 1024, 24, 1024, 128, 128, 128, 1024]
    - [30, 21800.0]
  - - [256, 2560, 1, 8976, 256, 256, 256, 2560]
    - [36, 21154.0]
  - - [256, 2816, 1, 8976, 256, 256, 256, 2816]
    - [36, 21046.0]
  - - [256, 3328, 1, 8976, 256, 256, 256, 3328]
    - [38, 20597.0]
  - - [256, 3584, 1, 8976, 256, 256, 256, 3584]
    - [36, 20401.0]
  - - [256, 3840, 1, 8976, 256, 256, 256, 3840]
    - [38, 21243.0]
  - - [256, 4096, 1, 8976, 256, 256, 256, 4096]
    - [40, 20989.0]
  - - [256, 4352, 1, 8976, 256, 256, 256, 4352]
    - [39, 21113.0]
  - - [480, 1024, 1, 32768, 480, 480, 480, 1024]
    - [36, 19271.0]
  - - [1024, 256, 1, 21248, 1024, 1024, 1024, 256]
    - [36, 17128.0]
  - - [1024, 256, 1, 21504, 1024, 1024, 1024, 256]
    - [39, 17064.0]
  - - [1024, 256, 1, 22016, 1024, 1024, 1024, 256]
    - [38, 17024.0]
  - - [1024, 256, 1, 28672, 1024, 1024, 1024, 256]
    - [36, 17308.0]
  - - [1024, 256, 1, 33536, 1024, 1024, 1024, 256]
    - [36, 17398.0]
  - - [1024, 512, 1, 32768, 1024, 1024, 1024, 512]
    - [41, 20388.0]
  - - [1024, 1024, 1, 32768, 1024, 1024, 1024, 1024]
    - [39, 22645.0]
  - - [1024, 1024, 1, 9216, 1024, 1024, 1024, 1024]
    - [36, 21829.0]
  - - [1024, 1024, 1, 9520, 1024, 1024, 1024, 1024]
    - [36, 21811.0]
  - - [1024, 1024, 1, 10064, 1024, 1024, 1024, 1024]
    - [36, 21844.0]
  - - [1024, 1024, 1, 10080, 1024, 1024, 1024, 1024]
    - [36, 21853.0]
  - - [1024, 1024, 1, 10200, 1024, 1024, 1024, 1024]
    - [36, 21869.0]
  - - [479, 1024, 1, 32768, 479, 479, 479, 1024]
    - [41, 19038.0]
  - - [1024, 1024, 1, 8192, 1024, 1024, 1024, 1024]
    - [36, 21198.0]
  - - [1024, 1024, 1, 9600, 1024, 1024, 1024, 1024]
    - [36, 21751.0]
  - - [1024, 1024, 1, 16384, 1024, 1024, 1024, 1024]
    - [36, 22196.0]
  - - [512, 256, 1, 55296, 512, 512, 512, 256]
    - [37, 15457.0]
  - - [1024, 1024, 1, 10240, 1024, 1024, 1024, 1024]
    - [38, 21613.0]
  - - [1024, 1024, 1, 10496, 1024, 1024, 1024, 1024]
    - [36, 21914.0]
  - - [1024, 1024, 1, 10224, 1024, 1024, 1024, 1024]
    - [36, 21864.0]
  - - [1024, 1024, 1, 10192, 1024, 1024, 1024, 1024]
    - [36, 21852.0]
  - - [1024, 1024, 1, 10208, 1024, 1024, 1024, 1024]
    - [36, 21837.0]
  - - [1024, 1024, 1, 10184, 1024, 1024, 1024, 1024]
    - [36, 21827.0]
  - - [1024, 1024, 1, 10120, 1024, 1024, 1024, 1024]
    - [36, 21834.0]
  - - [1024, 1024, 1, 10152, 1024, 1024, 1024, 1024]
    - [36, 21853.0]
  - - [1024, 1024, 1, 12288, 1024, 1024, 1024, 1024]
    - [36, 22026.0]
  - - [64, 5888, 1, 1280, 64, 64, 64, 5888]
    - [63, 12496.0]
  - - [64, 5056, 1, 256, 64, 64, 64, 5056]
    - [65, 10620.0]
  - - [5888, 64, 1, 1280, 5888, 5888, 5888, 64]
    - [44, 13172.0]
  - - [5888, 64, 1, 3328, 5888, 5888, 5888, 64]
    - [44, 13724.0]
  - - [6784, 64, 1, 256, 6784, 6784, 6784, 64]
    - [44, 12055.0]
  - - [64, 6784, 1, 3328, 64, 64, 64, 6784]
    - [64, 14409.0]
  - - [64, 5056, 1, 3328, 64, 64, 64, 5056]
    - [43, 15301.0]
  - - [5056, 64, 1, 1280, 5056, 5056, 5056, 64]
    - [65, 14372.0]
  - - [64, 6784, 1, 1280, 64, 64, 64, 6784]
    - [46, 14013.0]
  - - [64, 6784, 1, 256, 64, 64, 64, 6784]
    - [53, 9372.0]
  - - [64, 5056, 1, 1280, 64, 64, 64, 5056]
    - [43, 13233.0]
  - - [5888, 64, 1, 256, 5888, 5888, 5888, 64]
    - [43, 8537.0]
  - - [64, 5888, 1, 3328, 64, 64, 64, 5888]
    - [43, 14203.0]
  - - [5056, 64, 1, 3328, 5056, 5056, 5056, 64]
    - [51, 15735.0]
  - - [6784, 64, 1, 3328, 6784, 6784, 6784, 64]
    - [66, 15611.0]
  - - [64, 5888, 1, 256, 64, 64, 64, 5888]
    - [59, 10285.0]
  - - [6784, 64, 1, 1280, 6784, 6784, 6784, 64]
    - [44, 15053.0]
  - - [5056, 64, 1, 256, 5056, 5056, 5056, 64]
    - [65, 8058.0]
  - - [1024, 1024, 1, 1024, 1024, 1024, 1024, 1024]
    - [68, 16746.0]
  - - [3136, 64, 128, 64, 3136, 3136, 3136, 64]
    - [70, 15043.0]
  - - [3136, 64, 64, 256, 3136, 3136, 3136, 64]
    - [53, 18578.0]
  - - [3136, 64, 256, 256, 3136, 3136, 3136, 64]
    - [53, 16909.0]
  - - [3136, 64, 128, 256, 3136, 3136, 3136, 64]
    - [64, 17622.0]
  - - [3136, 64, 64, 64, 3136, 3136, 3136, 64]
    - [53, 17314.0]
  - - [3136, 64, 256, 64, 3136, 3136, 3136, 64]
    - [42, 14820.0]
  - - [64, 128, 512, 128, 64, 64, 64, 128]
    - [43, 17065.0]
  - - [64, 512, 64, 512, 64, 64, 64, 512]
    - [54, 17539.0]
  - - [128, 64, 512, 128, 128, 128, 128, 64]
    - [72, 18101.0]
  - - [512, 64, 64, 512, 512, 512, 512, 64]
    - [61, 18674.0]
  - - [1024, 1024, 1, 4, 1024, 1024, 1024, 1024]
    - [67, 1241.0]
  - - [1024, 1024, 1, 32, 1024, 1024, 1024, 1024]
    - [59, 8560.0]
  - - [1024, 1024, 1, 2048, 1024, 1024, 1024, 1024]
    - [65, 17533.0]
  - - [1024, 1024, 1, 4096, 1024, 1024, 1024, 1024]
    - [66, 17595.0]
  - - [256, 1280, 1, 8976, 256, 256, 256, 1280]
    - [56, 17819.0]
  - - [257, 4096, 1, 1024, 257, 257, 257, 4096]
    - [50, 12802.0]
  - - [512, 2048, 1, 256, 512, 512, 512, 2048]
    - [44, 13654.0]
  - - [560, 1024, 1, 200, 560, 560, 560, 1024]
    - [42, 9324.0]
  - - [560, 1024, 1, 1600, 560, 560, 560, 1024]
    - [58, 15945.0]
  - - [1024, 1024, 1, 200, 1024, 1024, 1024, 1024]
    - [44, 12819.0]
  - - [1024, 1024, 1, 512, 1024, 1024, 1024, 1024]
    - [44, 15534.0]
  - - [1024, 1024, 1, 960, 1024, 1024, 1024, 1024]
    - [44, 16384.0]
  - - [1024, 1024, 1, 1600, 1024, 1024, 1024, 1024]
    - [55, 16851.0]
  - - [2048, 256, 1, 1024, 2048, 2048, 2048, 256]
    - [43, 14589.0]
  - - [1024, 1024, 1, 3840, 1024, 1024, 1024, 1024]
    - [55, 17308.0]
  - - [1024, 1024, 1, 3968, 1024, 1024, 1024, 1024]
    - [55, 17325.0]
  - - [1024, 1024, 1, 6528, 1024, 1024, 1024, 1024]
    - [55, 17478.0]
  - - [1024, 1024, 1, 7104, 1024, 1024, 1024, 1024]
    - [55, 17482.0]
  - - [1024, 1024, 1, 7200, 1024, 1024, 1024, 1024]
    - [66, 17507.0]
  - - [1024, 1024, 1, 8064, 1024, 1024, 1024, 1024]
    - [44, 17524.0]
  - - [1024, 1024, 1, 8160, 1024, 1024, 1024, 1024]
    - [72, 17516.0]
  - - [1024, 1024, 1, 3240, 1024, 1024, 1024, 1024]
    - [61, 17272.0]
  - - [1024, 1024, 1, 3960, 1024, 1024, 1024, 1024]
    - [65, 17662.0]
  - - [64, 1280, 64, 192, 64, 64, 64, 1280]
    - [65, 19351.0]
  - - [64, 1280, 64, 320, 64, 64, 64, 1280]
    - [64, 20064.0]
  - - [64, 1280, 64, 384, 64, 64, 64, 1280]
    - [60, 21108.0]
  - - [64, 1280, 64, 448, 64, 64, 64, 1280]
    - [43, 21066.0]
  - - [64, 2048, 64, 192, 64, 64, 64, 2048]
    - [49, 18646.0]
  - - [64, 2048, 64, 320, 64, 64, 64, 2048]
    - [71, 19628.0]
  - - [64, 2048, 64, 384, 64, 64, 64, 2048]
    - [53, 19501.0]
  - - [64, 2048, 64, 448, 64, 64, 64, 2048]
    - [42, 20073.0]
  - - [5329, 64, 64, 80, 5329, 5329, 5329, 64]
    - [51, 18103.0]
  - - [64, 1280, 32, 192, 64, 64, 64, 1280]
    - [54, 16981.0]
  - - [64, 1280, 32, 320, 64, 64, 64, 1280]
    - [71, 18316.0]
  - - [64, 1280, 32, 384, 64, 64, 64, 1280]
    - [49, 18229.0]
  - - [64, 1280, 32, 448, 64, 64, 64, 1280]
    - [50, 18809.0]
  - - [64, 2048, 32, 192, 64, 64, 64, 2048]
    - [71, 18763.0]
  - - [64, 2048, 32, 320, 64, 64, 64, 2048]
    - [64, 19773.0]
  - - [64, 2048, 32, 384, 64, 64, 64, 2048]
    - [43, 19243.0]
  - - [64, 2048, 32, 448, 64, 64, 64, 2048]
    - [43, 18513.0]
  - - [5329, 64, 32, 80, 5329, 5329, 5329, 64]
    - [51, 18039.0]
  - - [3136, 64, 32, 256, 3136, 3136, 3136, 64]
    - [54, 20179.0]
  - - [3136, 64, 32, 64, 3136, 3136, 3136, 64]
    - [64, 14504.0]
  - - [196, 256, 32, 1024, 196, 196, 196, 256]
    - [54, 14597.0]
  - - [3136, 64, 64, 128, 3136, 3136, 3136, 64]
    - [65, 19508.0]
  - - [3136, 64, 32, 128, 3136, 3136, 3136, 64]
    - [71, 19235.0]
  - - [960, 1024, 1, 1024, 960, 960, 960, 1024]
    - [43, 16347.0]
  - - [1024, 960, 1, 1024, 1024, 1024, 1024, 960]
    - [44, 18518.0]
  - - [64, 512, 16, 512, 64, 64, 64, 512]
    - [43, 14479.0]
  - - [1024, 1024, 1, 1, 1024, 1024, 1024, 1024]
    - [67, 157.0]
  - - [1024, 1024, 1, 77, 1024, 1024, 1024, 1024]
    - [49, 8393.0]
  - - [64, 128, 160, 128, 64, 64, 64, 128]
    - [54, 11230.0]
  - - [1024, 1024, 1, 10, 1024, 1024, 1024, 1024]
    - [73, 2351.0]
  - - [1024, 1024, 1, 1280, 1024, 1024, 1024, 1024]
    - [44, 17190.0]
  - - [64, 128, 624, 128, 64, 64, 64, 128]
    - [54, 19267.0]
  - - [1024, 1024, 1, 39, 1024, 1024, 1024, 1024]
    - [70, 8082.0]
  - - [1024, 1024, 1, 780, 1024, 1024, 1024, 1024]
    - [44, 17047.0]
  - - [1024, 1024, 1, 4992, 1024, 1024, 1024, 1024]
    - [44, 17645.0]
  - - [1024, 1024, 1, 308, 1024, 1024, 1024, 1024]
    - [44, 16020.0]
  - - [64, 128, 640, 128, 64, 64, 64, 128]
    - [65, 18579.0]
  - - [1024, 1024, 1, 40, 1024, 1024, 1024, 1024]
    - [53, 9118.0]
  - - [1024, 1024, 1, 800, 1024, 1024, 1024, 1024]
    - [44, 17134.0]
  - - [1024, 1024, 1, 5120, 1024, 1024, 1024, 1024]
    - [44, 17598.0]
  - - [64, 128, 656, 128, 64, 64, 64, 128]
    - [54, 16185.0]
  - - [1024, 1024, 1, 41, 1024, 1024, 1024, 1024]
    - [42, 8598.0]
  - - [1024, 1024, 1, 820, 1024, 1024, 1024, 1024]
    - [66, 16217.0]
  - - [1024, 1024, 1, 5248, 1024, 1024, 1024, 1024]
    - [55, 17413.0]
  - - [64, 512, 80, 512, 64, 64, 64, 512]
    - [60, 18809.0]
  - - [1024, 1024, 1, 5, 1024, 1024, 1024, 1024]
    - [64, 1507.0]
  - - [1024, 1024, 1, 385, 1024, 1024, 1024, 1024]
    - [44, 16252.0]
  - - [1024, 1024, 1, 2560, 1024, 1024, 1024, 1024]
    - [66, 17527.0]
  - - [64, 512, 96, 512, 64, 64, 64, 512]
    - [60, 18109.0]
  - - [1024, 1024, 1, 6, 1024, 1024, 1024, 1024]
    - [67, 1005.0]
  - - [1024, 1024, 1, 462, 1024, 1024, 1024, 1024]
    - [44, 15177.0]
  - - [1024, 1024, 1, 3072, 1024, 1024, 1024, 1024]
    - [55, 17189.0]
  - - [64, 128, 128, 128, 64, 64, 64, 128]
    - [54, 10153.0]
  - - [1024, 1024, 1, 8, 1024, 1024, 1024, 1024]
    - [59, 1531.0]
  - - [1024, 1024, 1, 160, 1024, 1024, 1024, 1024]
    - [56, 13640.0]
  - - [64, 128, 144, 128, 64, 64, 64, 128]
    - [65, 10258.0]
  - - [1024, 1024, 1, 9, 1024, 1024, 1024, 1024]
    - [54, 1470.0]
  - - [1024, 1024, 1, 180, 1024, 1024, 1024, 1024]
    - [55, 12288.0]
  - - [1024, 1024, 1, 1152, 1024, 1024, 1024, 1024]
    - [55, 16570.0]
  - - [2048, 512, 1, 1, 2048, 2048, 2048, 512]
    - [53, 188.0]
  - - [64, 1024, 32, 1024, 64, 64, 64, 1024]
    - [64, 18497.0]
  - - [1024, 64, 128, 1024, 1024, 1024, 1024, 64]
    - [53, 19536.0]
  - - [1024, 64, 32, 1024, 1024, 1024, 1024, 64]
    - [60, 21484.0]
  - - [1024, 96, 64, 1024, 1024, 1024, 1024, 96]
    - [42, 15756.0]
  - - [1024, 1024, 1, 16, 1024, 1024, 1024, 1024]
    - [54, 4033.0]
  - - [64, 512, 40, 512, 64, 64, 64, 512]
    - [65, 16210.0]
  - - [64, 1024, 256, 1024, 64, 64, 64, 1024]
    - [59, 19290.0]
  - - [96, 1024, 64, 1024, 96, 96, 96, 1024]
    - [45, 15753.0]
  - - [512, 64, 256, 512, 512, 512, 512, 64]
    - [66, 17959.0]
  - - [1024, 96, 128, 1024, 1024, 1024, 1024, 96]
    - [65, 16200.0]
  - - [64, 512, 128, 512, 64, 64, 64, 512]
    - [54, 20214.0]
  - - [64, 1024, 64, 1024, 64, 64, 64, 1024]
    - [53, 18261.0]
  - - [512, 64, 128, 512, 512, 512, 512, 64]
    - [71, 20021.0]
  - - [64, 1024, 128, 1024, 64, 64, 64, 1024]
    - [54, 18909.0]
  - - [1024, 64, 64, 1024, 1024, 1024, 1024, 64]
    - [55, 18999.0]
  - - [96, 1024, 128, 1024, 96, 96, 96, 1024]
    - [58, 15926.0]
  - - [64, 512, 256, 512, 64, 64, 64, 512]
    - [64, 17605.0]
  - - [1024, 64, 256, 1024, 1024, 1024, 1024, 64]
    - [44, 19740.0]
  - - [512, 64, 40, 512, 512, 512, 512, 64]
    - [44, 17972.0]
  - - [1024, 1024, 1, 64, 1024, 1024, 1024, 1024]
    - [61, 12070.0]
  - - [64, 128, 1024, 128, 64, 64, 64, 128]
    - [64, 18911.0]
  - - [128, 64, 1024, 128, 128, 128, 128, 64]
    - [65, 19473.0]
  - - [1024, 1024, 1, 3456, 1024, 1024, 1024, 1024]
    - [51, 17597.0]
  - - [1024, 1024, 1, 6912, 1024, 1024, 1024, 1024]
    - [44, 17696.0]
  - - [1024, 1024, 1, 864, 1024, 1024, 1024, 1024]
    - [74, 16550.0]
  - - [1024, 512, 1, 3456, 1024, 1024, 1024, 512]
    - [62, 15897.0]
  - - [1024, 512, 1, 4096, 1024, 1024, 1024, 512]
    - [48, 16120.0]
  - - [1024, 512, 1, 6912, 1024, 1024, 1024, 512]
    - [69, 16128.0]
  - - [1024, 512, 1, 864, 1024, 1024, 1024, 512]
    - [52, 14930.0]
  - - [256, 3456, 1, 1, 256, 256, 256, 3456]
    - [52, 178.0]
  - - [256, 4096, 1, 1, 256, 256, 256, 4096]
    - [59, 273.0]
  - - [480, 1024, 1, 3456, 480, 480, 480, 1024]
    - [48, 14748.0]
  - - [480, 1024, 1, 4096, 480, 480, 480, 1024]
    - [48, 14841.0]
  - - [480, 1024, 1, 6912, 480, 480, 480, 1024]
    - [48, 15086.0]
  - - [480, 1024, 1, 864, 480, 480, 480, 1024]
    - [52, 13664.0]
  - - [1024, 1024, 1, 80, 1024, 1024, 1024, 1024]
    - [53, 9598.0]
  - - [64, 128, 1280, 128, 64, 64, 64, 128]
    - [54, 17905.0]
  - - [128, 64, 1280, 128, 128, 128, 128, 64]
    - [66, 18579.0]
  - - [1024, 1024, 1, 82, 1024, 1024, 1024, 1024]
    - [64, 11975.0]
  - - [128, 64, 1312, 128, 128, 128, 128, 64]
    - [65, 19139.0]
  - - [64, 128, 1312, 128, 64, 64, 64, 128]
    - [54, 18825.0]
  - - [1024, 1024, 1, 12, 1024, 1024, 1024, 1024]
    - [55, 3226.0]
  - - [1024, 1024, 1, 6144, 1024, 1024, 1024, 1024]
    - [60, 17840.0]
  - - [64, 512, 192, 512, 64, 64, 64, 512]
    - [53, 18722.0]
  - - [512, 64, 192, 512, 512, 512, 512, 64]
    - [55, 18977.0]
  - - [784, 1152, 1, 128, 784, 784, 784, 1152]
    - [42, 11312.0]
  - - [64, 128, 2048, 128, 64, 64, 64, 128]
    - [42, 13874.0]
  - - [128, 64, 2048, 128, 128, 128, 128, 64]
    - [42, 12743.0]
  - - [1024, 1024, 1, 128, 1024, 1024, 1024, 1024]
    - [55, 13289.0]
  - - [128, 64, 1536, 128, 128, 128, 128, 64]
    - [61, 18407.0]
  - - [64, 128, 1536, 128, 64, 64, 64, 128]
    - [43, 18378.0]
  - - [1024, 1024, 1, 96, 1024, 1024, 1024, 1024]
    - [55, 13006.0]
  - - [92416, 64, 25, 64, 92416, 92416, 92416, 64]
    - [51, 9887.0]
  - - [50176, 64, 36, 64, 50176, 50176, 50176, 64]
    - [51, 9959.0]
  - - [36864, 64, 49, 64, 36864, 36864, 36864, 64]
    - [44, 10077.0]
  - - [25600, 64, 64, 64, 25600, 25600, 25600, 64]
    - [66, 10101.0]
  - - [64, 128, 192, 128, 64, 64, 64, 128]
    - [53, 13771.0]
  - - [128, 64, 192, 128, 128, 128, 128, 64]
    - [55, 14717.0]
  - - [768, 768, 1, 2048, 768, 768, 768, 768]
    - [48, 17896.0]
  - - [64, 384, 144, 384, 64, 64, 64, 384]
    - [54, 17820.0]
  - - [384, 64, 144, 384, 384, 384, 384, 64]
    - [71, 21240.0]
  - - [768, 768, 1, 4608, 768, 768, 768, 768]
    - [69, 18185.0]
  - - [64, 512, 48, 512, 64, 64, 64, 512]
    - [49, 17683.0]
  - - [512, 64, 48, 512, 512, 512, 512, 64]
    - [61, 17723.0]
  - - [64, 128, 256, 128, 64, 64, 64, 128]
    - [65, 13223.0]
  - - [128, 64, 256, 128, 128, 128, 128, 64]
    - [44, 13503.0]
  - - [64, 384, 192, 384, 64, 64, 64, 384]
    - [70, 19317.0]
  - - [384, 64, 192, 384, 384, 384, 384, 64]
    - [70, 19964.0]
  - - [1024, 1024, 1, 4608, 1024, 1024, 1024, 1024]
    - [55, 17642.0]
  - - [196, 2304, 1, 256, 196, 196, 196, 2304]
    - [52, 8706.0]
  - - [768, 512, 2, 2048, 768, 768, 768, 512]
    - [61, 17610.0]
  - - [672, 512, 2, 2048, 672, 672, 672, 512]
    - [64, 15332.0]
  - - [1008, 512, 2, 2048, 1008, 1008, 1008, 512]
    - [57, 16690.0]
  - - [864, 512, 2, 2048, 864, 864, 864, 512]
    - [58, 17799.0]
  - - [888, 512, 2, 2048, 888, 888, 888, 512]
    - [58, 18091.0]
  - - [840, 512, 2, 2048, 840, 840, 840, 512]
    - [69, 17223.0]
  - - [768, 256, 2, 12, 768, 768, 768, 256]
    - [67, 774.0]
  - - [864, 256, 2, 3, 864, 864, 864, 256]
    - [43, 219.0]
  - - [864, 256, 2, 12, 864, 864, 864, 256]
    - [42, 1301.0]
  - - [768, 256, 2, 3, 768, 768, 768, 256]
    - [42, 230.0]
  - - [1024, 320, 1, 1024, 1024, 1024, 1024, 320]
    - [44, 13741.0]
  - - [173280, 64, 1, 128, 173280, 173280, 173280, 64]
    - [51, 9593.0]
  - - [25992, 64, 1, 128, 25992, 25992, 25992, 64]
    - [61, 11472.0]
  - - [713, 512, 2, 2048, 713, 713, 713, 512]
    - [44, 15945.0]
  - - [660, 512, 2, 2048, 660, 660, 660, 512]
    - [44, 14826.0]
  - - [726, 512, 2, 2048, 726, 726, 726, 512]
    - [44, 16228.0]
  - - [748, 512, 2, 2048, 748, 748, 748, 512]
    - [44, 16763.0]
  - - [805, 512, 2, 2048, 805, 805, 805, 512]
    - [58, 16532.0]
  - - [850, 512, 2, 2048, 850, 850, 850, 512]
    - [69, 17411.0]
  - - [850, 256, 2, 3, 850, 850, 850, 256]
    - [71, 326.0]
  - - [805, 256, 2, 12, 805, 805, 805, 256]
    - [47, 790.0]
  - - [805, 256, 2, 3, 805, 805, 805, 256]
    - [55, 203.0]
  - - [850, 256, 2, 12, 850, 850, 850, 256]
    - [43, 876.0]
  - - [950, 256, 2, 12, 950, 950, 950, 256]
    - [45, 1474.0]
  - - [950, 256, 2, 3, 950, 950, 950, 256]
    - [53, 245.0]
  - - [100, 512, 120, 128, 100, 100, 100, 512]
    - [65, 13934.0]
  - - [100, 512, 18, 128, 100, 100, 100, 512]
    - [64, 9560.0]
  - - [100, 512, 19, 128, 100, 100, 100, 512]
    - [64, 9491.0]
  - - [1444, 576, 1, 128, 1444, 1444, 1444, 576]
    - [44, 12237.0]
  - - [27436, 64, 1, 128, 27436, 27436, 27436, 64]
    - [53, 14557.0]
  - - [361, 2304, 1, 512, 361, 361, 361, 2304]
    - [45, 15588.0]
  - - [96, 1024, 160, 1024, 96, 96, 96, 1024]
    - [56, 16145.0]
  - - [1024, 96, 160, 1024, 1024, 1024, 1024, 96]
    - [75, 16032.0]
  - - [96, 1024, 40, 1024, 96, 96, 96, 1024]
    - [45, 15773.0]
  - - [1024, 96, 40, 1024, 1024, 1024, 1024, 96]
    - [58, 15575.0]
  - - [96, 1024, 80, 1024, 96, 96, 96, 1024]
    - [48, 16030.0]
  - - [1024, 96, 80, 1024, 1024, 1024, 1024, 96]
    - [58, 15852.0]
  - - [96, 1024, 96, 1024, 96, 96, 96, 1024]
    - [48, 15863.0]
  - - [1024, 96, 96, 1024, 1024, 1024, 1024, 96]
    - [65, 16455.0]
  - - [96, 1024, 24, 1024, 96, 96, 96, 1024]
    - [67, 15019.0]
  - - [1024, 96, 24, 1024, 1024, 1024, 1024, 96]
    - [54, 14937.0]
  - - [96, 1024, 48, 1024, 96, 96, 96, 1024]
    - [49, 15918.0]
  - - [1024, 96, 48, 1024, 1024, 1024, 1024, 96]
    - [70, 15469.0]
  - - [96, 1024, 16, 1024, 96, 96, 96, 1024]
    - [60, 14291.0]
  - - [1024, 96, 16, 1024, 1024, 1024, 1024, 96]
    - [58, 14146.0]
  - - [96, 1024, 32, 1024, 96, 96, 96, 1024]
    - [58, 15511.0]
  - - [1024, 96, 32, 1024, 1024, 1024, 1024, 96]
    - [58, 15212.0]
  - - [512, 64, 320, 512, 512, 512, 512, 64]
    - [57, 17986.0]
  - - [64, 512, 320, 512, 64, 64, 64, 512]
    - [42, 17575.0]
  - - [1024, 1024, 1, 20, 1024, 1024, 1024, 1024]
    - [58, 4211.0]
  - - [512, 64, 80, 512, 512, 512, 512, 64]
    - [44, 18920.0]
  - - [1024, 64, 512, 1024, 1024, 1024, 1024, 64]
    - [66, 19907.0]
  - - [64, 1024, 512, 1024, 64, 64, 64, 1024]
    - [59, 19836.0]
  - - [512, 256, 1, 32768, 512, 512, 512, 256]
    - [78, 15720.0]
  - - [1024, 256, 1, 8192, 1024, 1024, 1024, 256]
    - [82, 15465.0]
  - - [1024, 256, 1, 8448, 1024, 1024, 1024, 256]
    - [82, 15556.0]
  - - [1024, 256, 1, 9728, 1024, 1024, 1024, 256]
    - [80, 15744.0]
  - - [1024, 256, 1, 9984, 1024, 1024, 1024, 256]
    - [82, 15831.0]
  - - [1024, 256, 1, 10496, 1024, 1024, 1024, 256]
    - [80, 15906.0]
  - - [1024, 256, 1, 11520, 1024, 1024, 1024, 256]
    - [79, 16391.0]
  - - [1024, 256, 1, 12032, 1024, 1024, 1024, 256]
    - [83, 16135.0]
  - - [1024, 256, 1, 13568, 1024, 1024, 1024, 256]
    - [80, 16284.0]
  - - [1024, 256, 1, 14336, 1024, 1024, 1024, 256]
    - [82, 16320.0]
  - - [1024, 256, 1, 14848, 1024, 1024, 1024, 256]
    - [80, 16349.0]
  - - [1024, 256, 1, 15104, 1024, 1024, 1024, 256]
    - [82, 16382.0]
  - - [1024, 256, 1, 15872, 1024, 1024, 1024, 256]
    - [82, 16457.0]
  - - [1024, 256, 1, 16128, 1024, 1024, 1024, 256]
    - [76, 18424.0]
  - - [1024, 256, 1, 17152, 1024, 1024, 1024, 256]
    - [82, 16601.0]
  - - [1024, 256, 1, 17408, 1024, 1024, 1024, 256]
    - [77, 16743.0]
  - - [1024, 256, 1, 18944, 1024, 1024, 1024, 256]
    - [77, 16684.0]
  - - [1024, 256, 1, 19712, 1024, 1024, 1024, 256]
    - [77, 16708.0]
  - - [1024, 256, 1, 19968, 1024, 1024, 1024, 256]
    - [77, 16905.0]
  - - [256, 128, 1, 55296, 256, 256, 256, 128]
    - [81, 10215.0]
  - - [3584, 64, 1, 1280, 3584, 3584, 3584, 64]
    - [126, 10209.0]
  - - [64, 4288, 1, 1280, 64, 64, 64, 4288]
    - [98, 10756.0]
  - - [3584, 64, 1, 3328, 3584, 3584, 3584, 64]
    - [126, 11329.0]
  - - [64, 4288, 1, 3328, 64, 64, 64, 4288]
    - [98, 10752.0]
  - - [1856, 64, 1, 3328, 1856, 1856, 1856, 64]
    - [131, 10252.0]
  - - [2944, 64, 1, 256, 2944, 2944, 2944, 64]
    - [92, 5531.0]
  - - [64, 1856, 1, 256, 64, 64, 64, 1856]
    - [143, 4283.0]
  - - [2368, 64, 1, 256, 2368, 2368, 2368, 64]
    - [120, 5013.0]
  - - [2368, 64, 1, 3328, 2368, 2368, 2368, 64]
    - [158, 10464.0]
  - - [64, 1408, 1, 3328, 64, 64, 64, 1408]
    - [152, 7627.0]
  - - [1856, 64, 1, 1280, 1856, 1856, 1856, 64]
    - [104, 8523.0]
  - - [64, 3584, 1, 1280, 64, 64, 64, 3584]
    - [100, 9953.0]
  - - [4288, 64, 1, 3328, 4288, 4288, 4288, 64]
    - [147, 10775.0]
  - - [64, 2944, 1, 256, 64, 64, 64, 2944]
    - [120, 5481.0]
  - - [64, 2368, 1, 1280, 64, 64, 64, 2368]
    - [126, 9014.0]
  - - [64, 3584, 1, 3328, 64, 64, 64, 3584]
    - [135, 10893.0]
  - - [3584, 64, 1, 256, 3584, 3584, 3584, 64]
    - [126, 6397.0]
  - - [64, 1856, 1, 3328, 64, 64, 64, 1856]
    - [98, 9670.0]
  - - [4288, 64, 1, 1280, 4288, 4288, 4288, 64]
    - [98, 10788.0]
  - - [1408, 64, 1, 256, 1408, 1408, 1408, 64]
    - [106, 3240.0]
  - - [64, 1408, 1, 256, 64, 64, 64, 1408]
    - [92, 3204.0]
  - - [64, 2368, 1, 3328, 64, 64, 64, 2368]
    - [149, 10331.0]
  - - [64, 1856, 1, 1280, 64, 64, 64, 1856]
    - [130, 8768.0]
  - - [64, 4288, 1, 256, 64, 64, 64, 4288]
    - [98, 6901.0]
  - - [64, 1408, 1, 1280, 64, 64, 64, 1408]
    - [141, 6380.0]
  - - [64, 2944, 1, 3328, 64, 64, 64, 2944]
    - [124, 9975.0]
  - - [1856, 64, 1, 256, 1856, 1856, 1856, 64]
    - [118, 4283.0]
  - - [2944, 64, 1, 1280, 2944, 2944, 2944, 64]
    - [92, 9458.0]
  - - [4288, 64, 1, 256, 4288, 4288, 4288, 64]
    - [149, 8505.0]
  - - [64, 2944, 1, 1280, 64, 64, 64, 2944]
    - [98, 8919.0]
  - - [1408, 64, 1, 1280, 1408, 1408, 1408, 64]
    - [96, 6324.0]
  - - [64, 2368, 1, 256, 64, 64, 64, 2368]
    - [121, 5026.0]
  - - [64, 3584, 1, 256, 64, 64, 64, 3584]
    - [106, 8156.0]
  - - [2944, 64, 1, 3328, 2944, 2944, 2944, 64]
    - [147, 10068.0]
  - - [2368, 64, 1, 1280, 2368, 2368, 2368, 64]
    - [100, 8898.0]
  - - [1408, 64, 1, 3328, 1408, 1408, 1408, 64]
    - [110, 7520.0]
  - - [33, 32, 200, 33, 33, 33, 33, 32]
    - [136, 924.0]
  - - [33, 32, 1600, 33, 33, 33, 33, 32]
    - [130, 3104.0]
  - - [67, 2048, 1, 512, 67, 67, 67, 2048]
    - [101, 5388.0]
  - - [74, 2048, 1, 512, 74, 74, 74, 2048]
    - [101, 5960.0]
  - - [74, 2048, 1, 960, 74, 74, 74, 2048]
    - [90, 7476.0]
  - - [100, 2048, 1, 512, 100, 100, 100, 2048]
    - [143, 6264.0]
  - - [512, 512, 1, 200, 512, 512, 512, 512]
    - [92, 5787.0]
  - - [512, 512, 1, 1600, 512, 512, 512, 512]
    - [92, 9864.0]
  - - [1024, 256, 1, 1024, 1024, 1024, 1024, 256]
    - [106, 9406.0]
  - - [1024, 256, 1, 1280, 1024, 1024, 1024, 256]
    - [92, 9592.0]
  - - [1024, 256, 1, 2304, 1024, 1024, 1024, 256]
    - [147, 10100.0]
  - - [1024, 256, 1, 2816, 1024, 1024, 1024, 256]
    - [98, 10276.0]
  - - [1024, 256, 1, 3072, 1024, 1024, 1024, 256]
    - [124, 10269.0]
  - - [1024, 256, 1, 3328, 1024, 1024, 1024, 256]
    - [98, 10557.0]
  - - [1024, 256, 1, 3584, 1024, 1024, 1024, 256]
    - [124, 10398.0]
  - - [1024, 256, 1, 4096, 1024, 1024, 1024, 256]
    - [124, 10457.0]
  - - [1024, 256, 1, 4352, 1024, 1024, 1024, 256]
    - [147, 10472.0]
  - - [1024, 256, 1, 4608, 1024, 1024, 1024, 256]
    - [124, 10513.0]
  - - [1024, 256, 1, 5120, 1024, 1024, 1024, 256]
    - [98, 10537.0]
  - - [1024, 256, 1, 5376, 1024, 1024, 1024, 256]
    - [147, 10536.0]
  - - [1024, 256, 1, 5632, 1024, 1024, 1024, 256]
    - [152, 11868.0]
  - - [1024, 256, 1, 6144, 1024, 1024, 1024, 256]
    - [147, 10553.0]
  - - [1024, 256, 1, 6400, 1024, 1024, 1024, 256]
    - [147, 10570.0]
  - - [1024, 256, 1, 7680, 1024, 1024, 1024, 256]
    - [98, 10648.0]
  - - [1024, 256, 1, 7936, 1024, 1024, 1024, 256]
    - [98, 10650.0]
  - - [32, 64, 4608, 32, 32, 32, 32, 64]
    - [152, 9190.0]
  - - [32, 64, 4608, 35, 32, 32, 32, 64]
    - [151, 7761.0]
  - - [34, 64, 4736, 24, 34, 34, 34, 64]
    - [113, 4332.0]
  - - [34, 64, 4736, 34, 34, 34, 34, 64]
    - [104, 5639.0]
  - - [35, 64, 4608, 35, 35, 35, 35, 64]
    - [141, 5509.0]
  - - [64, 32, 4608, 32, 64, 64, 64, 32]
    - [154, 10958.0]
  - - [64, 32, 4608, 35, 64, 64, 64, 32]
    - [139, 10717.0]
  - - [64, 34, 4736, 24, 64, 64, 64, 34]
    - [87, 5760.0]
  - - [64, 34, 4736, 34, 64, 64, 64, 34]
    - [87, 6050.0]
  - - [64, 35, 4608, 35, 64, 64, 64, 35]
    - [87, 6100.0]
  - - [33, 64, 1920, 33, 33, 33, 33, 64]
    - [152, 4986.0]
  - - [64, 33, 1920, 33, 64, 64, 64, 33]
    - [87, 5239.0]
  - - [49, 512, 64, 2048, 49, 49, 49, 512]
    - [149, 9862.0]
  - - [49, 2048, 64, 512, 49, 49, 49, 2048]
    - [100, 9983.0]
  - - [49, 512, 32, 2048, 49, 49, 49, 512]
    - [100, 9714.0]
  - - [49, 2048, 32, 512, 49, 49, 49, 2048]
    - [90, 10290.0]
  - - [49, 1024, 64, 2048, 49, 49, 49, 1024]
    - [113, 9975.0]
  - - [49, 2048, 64, 1024, 49, 49, 49, 2048]
    - [135, 10077.0]
  - - [49, 1024, 32, 2048, 49, 49, 49, 1024]
    - [135, 9855.0]
  - - [49, 2048, 32, 1024, 49, 49, 49, 2048]
    - [160, 9896.0]
  - - [480, 512, 1, 512, 480, 480, 480, 512]
    - [141, 8631.0]
  - - [512, 480, 1, 512, 512, 512, 512, 480]
    - [143, 10180.0]
  - - [512, 512, 1, 512, 512, 512, 512, 512]
    - [120, 9684.0]
  - - [256, 864, 1, 1, 256, 256, 256, 864]
    - [115, 103.0]
  - - [512, 256, 1, 3456, 512, 512, 512, 256]
    - [126, 9031.0]
  - - [512, 256, 1, 4096, 512, 512, 512, 256]
    - [149, 9152.0]
  - - [512, 256, 1, 6912, 512, 512, 512, 256]
    - [149, 9445.0]
  - - [512, 256, 1, 864, 512, 512, 512, 256]
    - [107, 7149.0]
  - - [49, 4608, 1, 512, 49, 49, 49, 4608]
    - [100, 6554.0]
  - - [49, 2048, 128, 512, 49, 49, 49, 2048]
    - [149, 10091.0]
  - - [49, 2048, 256, 512, 49, 49, 49, 2048]
    - [100, 10122.0]
  - - [49, 512, 128, 2048, 49, 49, 49, 512]
    - [135, 9970.0]
  - - [49, 512, 256, 2048, 49, 49, 49, 512]
    - [112, 10116.0]
  - - [56, 512, 64, 512, 56, 56, 56, 512]
    - [100, 10973.0]
  - - [176, 256, 2, 3, 176, 176, 176, 256]
    - [116, 165.0]
  - - [176, 256, 2, 12, 176, 176, 176, 256]
    - [88, 575.0]
  - - [216, 256, 2, 3, 216, 216, 216, 256]
    - [93, 81.0]
  - - [192, 256, 2, 12, 192, 192, 192, 256]
    - [109, 527.0]
  - - [192, 256, 2, 3, 192, 192, 192, 256]
    - [142, 155.0]
  - - [216, 256, 2, 12, 216, 216, 216, 256]
    - [140, 644.0]
  - - [228, 256, 2, 12, 228, 228, 228, 256]
    - [116, 707.0]
  - - [228, 256, 2, 3, 228, 228, 228, 256]
    - [119, 181.0]
  - - [187, 256, 2, 12, 187, 187, 187, 256]
    - [114, 580.0]
  - - [247, 256, 2, 12, 247, 247, 247, 256]
    - [86, 723.0]
  - - [187, 256, 2, 3, 187, 187, 187, 256]
    - [119, 151.0]
  - - [221, 256, 2, 3, 221, 221, 221, 256]
    - [128, 84.0]
  - - [221, 256, 2, 12, 221, 221, 221, 256]
    - [116, 314.0]
  - - [247, 256, 2, 3, 247, 247, 247, 256]
    - [103, 162.0]
  - - [100, 2304, 1, 512, 100, 100, 100, 2304]
    - [126, 6703.0]
  - - [256, 128, 1, 32768, 256, 256, 256, 128]
    - [165, 9285.0]
  - - [2048, 2, 1, 2, 2048, 2048, 2048, 2]
    - [169, 4.0]
  - - [2560, 2, 1, 4, 2560, 2560, 2560, 2]
    - [169, 5.0]
  - - [2048, 2, 1, 8, 2048, 2048, 2048, 2]
    - [171, 19.0]
  - - [2560, 2, 1, 2, 2560, 2560, 2560, 2]
    - [170, 3.0]
  - - [25, 1152, 1, 256, 25, 25, 25, 1152]
    - [155, 1241.0]
  - - [9, 1152, 1, 256, 9, 9, 9, 1152]
    - [155, 453.0]
  - - [13, 512, 1, 32768, 13, 13, 13, 512]
    - [162, 3107.0]
  - - [1024, 2, 1, 4992, 1024, 1024, 1024, 2]
    - [163, 413.0]
  - - [1024, 2, 1, 5120, 1024, 1024, 1024, 2]
    - [166, 418.0]
  - - [1024, 2, 1, 5248, 1024, 1024, 1024, 2]
    - [167, 421.0]
  - - [256, 128, 1, 6912, 256, 256, 256, 128]
    - [161, 6905.0]
  - - [13, 512, 1, 55296, 13, 13, 13, 512]
    - [164, 3369.0]
  - - [13, 512, 1, 6912, 13, 13, 13, 512]
    - [168, 1935.0]
  - - [768, 2, 1, 4608, 768, 768, 768, 2]
    - [166, 404.0]
  - - [1024, 2, 1, 4608, 1024, 1024, 1024, 2]
    - [166, 393.0]
  - - [64, 448, 1, 3328, 64, 64, 64, 448]
    - [146, 4484.0]
  - - [1, 64, 1, 256, 1, 1, 1, 64]
    - [88, 3.0]
  - - [64, 128, 1, 256, 64, 64, 64, 128]
    - [153, 718.0]
  - - [64, 1024, 1, 3328, 64, 64, 64, 1024]
    - [100, 7669.0]
  - - [1, 64, 1, 1280, 1, 1, 1, 64]
    - [88, 4.0]
  - - [704, 64, 1, 3328, 704, 704, 704, 64]
    - [112, 5295.0]
  - - [64, 448, 1, 1280, 64, 64, 64, 448]
    - [97, 4078.0]
  - - [64, 704, 1, 3328, 64, 64, 64, 704]
    - [149, 5299.0]
  - - [64, 64, 1, 1280, 64, 64, 64, 64]
    - [111, 679.0]
  - - [1, 64, 1, 1, 1, 1, 1, 64]
    - [140, 0.04]
  - - [448, 64, 1, 1280, 448, 448, 448, 64]
    - [95, 3760.0]
  - - [64, 1024, 1, 1280, 64, 64, 64, 1024]
    - [126, 6483.0]
  - - [64, 256, 1, 1280, 64, 64, 64, 256]
    - [125, 2615.0]
  - - [704, 64, 1, 1280, 704, 704, 704, 64]
    - [146, 4751.0]
  - - [64, 128, 1, 1280, 64, 64, 64, 128]
    - [99, 1413.0]
  - - [448, 64, 1, 3328, 448, 448, 448, 64]
    - [97, 4728.0]
  - - [128, 64, 1, 256, 128, 128, 128, 64]
    - [129, 690.0]
  - - [64, 128, 1, 3328, 64, 64, 64, 128]
    - [111, 1572.0]
  - - [64, 256, 1, 3328, 64, 64, 64, 256]
    - [111, 3098.0]
  - - [1024, 64, 1, 1280, 1024, 1024, 1024, 64]
    - [100, 5555.0]
  - - [448, 64, 1, 256, 448, 448, 448, 64]
    - [148, 1325.0]
  - - [256, 64, 1, 256, 256, 256, 256, 64]
    - [111, 752.0]
  - - [1, 1, 1, 1, 1, 1, 1, 1]
    - [88, 0.00019011406824717656]
  - - [1024, 64, 1, 3328, 1024, 1024, 1024, 64]
    - [112, 7100.0]
  - - [64, 448, 1, 256, 64, 64, 64, 448]
    - [111, 1301.0]
  - - [128, 64, 1, 1280, 128, 128, 128, 64]
    - [109, 1024.0]
  - - [64, 1024, 1, 256, 64, 64, 64, 1024]
    - [123, 2460.0]
  - - [256, 64, 1, 1280, 256, 256, 256, 64]
    - [125, 2048.0]
  - - [64, 256, 1, 256, 64, 64, 64, 256]
    - [153, 768.0]
  - - [704, 64, 1, 256, 704, 704, 704, 64]
    - [105, 1982.0]
  - - [1, 1, 1, 256, 1, 1, 1, 1]
    - [88, 0.04]
  - - [64, 704, 1, 256, 64, 64, 64, 704]
    - [146, 1929.0]
  - - [64, 64, 1, 256, 64, 64, 64, 64]
    - [84, 203.0]
  - - [128, 64, 1, 3328, 128, 128, 128, 64]
    - [148, 1380.0]
  - - [1, 1, 1, 1280, 1, 1, 1, 1]
    - [88, 0.1]
  - - [1024, 64, 1, 256, 1024, 1024, 1024, 64]
    - [91, 2482.0]
  - - [256, 64, 1, 3328, 256, 256, 256, 64]
    - [159, 2759.0]
  - - [64, 64, 1, 3328, 64, 64, 64, 64]
    - [125, 691.0]
  - - [1, 1, 1, 3328, 1, 1, 1, 1]
    - [88, 0.12]
  - - [64, 704, 1, 1280, 64, 64, 64, 704]
    - [146, 3923.0]
  - - [512, 16, 1, 512, 512, 512, 512, 16]
    - [157, 601.0]
  - - [1024, 32, 1, 512, 1024, 1024, 1024, 32]
    - [99, 2292.0]
  - - [1024, 16, 1, 512, 1024, 1024, 1024, 16]
    - [109, 1216.0]
  - - [512, 32, 1, 512, 512, 512, 512, 32]
    - [117, 1384.0]
  - - [14, 64, 1, 14, 14, 14, 14, 64]
    - [88, 3.0]
  - - [15, 64, 1, 14, 15, 15, 15, 64]
    - [84, 3.0]
  - - [15, 64, 1, 15, 15, 15, 15, 64]
    - [84, 7.0]
  - - [17, 64, 1, 15, 17, 17, 17, 64]
    - [126, 6.0]
  - - [17, 64, 1, 17, 17, 17, 17, 64]
    - [84, 4.0]
  - - [21, 64, 1, 17, 21, 21, 21, 64]
    - [84, 5.0]
  - - [21, 64, 1, 21, 21, 21, 21, 64]
    - [84, 6.0]
  - - [24, 64, 1, 24, 24, 24, 24, 64]
    - [84, 8.0]
  - - [30, 64, 1, 30, 30, 30, 30, 64]
    - [88, 27.0]
  - - [30, 64, 1, 31, 30, 30, 30, 64]
    - [116, 27.0]
  - - [31, 64, 1, 31, 31, 31, 31, 64]
    - [108, 25.0]
  - - [32, 64, 1, 32, 32, 32, 32, 64]
    - [142, 17.0]
  - - [32, 64, 1, 35, 32, 32, 32, 64]
    - [88, 16.0]
  - - [34, 64, 1, 24, 34, 34, 34, 64]
    - [84, 12.0]
  - - [34, 64, 1, 34, 34, 34, 34, 64]
    - [117, 17.0]
  - - [35, 64, 1, 35, 35, 35, 35, 64]
    - [155, 18.0]
  - - [64, 14, 1, 14, 64, 64, 64, 14]
    - [84, 3.0]
  - - [64, 15, 1, 14, 64, 64, 64, 15]
    - [84, 3.0]
  - - [64, 15, 1, 15, 64, 64, 64, 15]
    - [103, 7.0]
  - - [64, 17, 1, 15, 64, 64, 64, 17]
    - [105, 8.0]
  - - [64, 17, 1, 17, 64, 64, 64, 17]
    - [95, 8.0]
  - - [64, 21, 1, 17, 64, 64, 64, 21]
    - [144, 11.0]
  - - [64, 21, 1, 21, 64, 64, 64, 21]
    - [150, 13.0]
  - - [64, 24, 1, 24, 64, 64, 64, 24]
    - [89, 17.0]
  - - [64, 30, 1, 30, 64, 64, 64, 30]
    - [138, 26.0]
  - - [64, 30, 1, 31, 64, 64, 64, 30]
    - [142, 24.0]
  - - [64, 31, 1, 31, 64, 64, 64, 31]
    - [128, 27.0]
  - - [64, 32, 1, 32, 64, 64, 64, 32]
    - [125, 36.0]
  - - [64, 32, 1, 35, 64, 64, 64, 32]
    - [144, 16.0]
  - - [64, 34, 1, 24, 64, 64, 64, 34]
    - [85, 18.0]
  - - [64, 34, 1, 34, 64, 64, 64, 34]
    - [86, 16.0]
  - - [64, 35, 1, 35, 64, 64, 64, 35]
    - [88, 17.0]
  - - [64, 512, 1, 512, 64, 64, 64, 512]
    - [134, 2273.0]
  - - [512, 64, 1, 512, 512, 512, 512, 64]
    - [132, 2873.0]
  - - [1024, 2, 1, 4, 1024, 1024, 1024, 2]
    - [138, 5.0]
  - - [1024, 2, 1, 32, 1024, 1024, 1024, 2]
    - [157, 29.0]
  - - [1024, 2, 1, 2048, 1024, 1024, 1024, 2]
    - [123, 319.0]
  - - [3, 64, 512, 3, 3, 3, 3, 64]
    - [96, 54.0]
  - - [5, 64, 512, 5, 5, 5, 5, 64]
    - [89, 130.0]
  - - [5, 64, 960, 5, 5, 5, 5, 64]
    - [85, 195.0]
  - - [9, 64, 512, 9, 9, 9, 9, 64]
    - [116, 442.0]
  - - [27, 128, 32768, 27, 27, 27, 27, 128]
    - [156, 3963.0]
  - - [512, 32, 1, 200, 512, 512, 512, 32]
    - [105, 876.0]
  - - [512, 32, 1, 1600, 512, 512, 512, 32]
    - [99, 2893.0]
  - - [1024, 64, 1, 512, 1024, 1024, 1024, 64]
    - [110, 4821.0]
  - - [1024, 64, 1, 960, 1024, 1024, 1024, 64]
    - [112, 5992.0]
  - - [14, 64, 10880, 14, 14, 14, 14, 64]
    - [141, 2327.0]
  - - [15, 64, 10880, 14, 15, 15, 15, 64]
    - [90, 2485.0]
  - - [15, 64, 7680, 15, 15, 15, 15, 64]
    - [90, 2479.0]
  - - [15, 64, 10880, 15, 15, 15, 15, 64]
    - [90, 2543.0]
  - - [17, 64, 7680, 15, 17, 17, 17, 64]
    - [90, 2305.0]
  - - [17, 64, 6144, 17, 17, 17, 17, 64]
    - [90, 2549.0]
  - - [17, 64, 7680, 17, 17, 17, 17, 64]
    - [141, 2605.0]
  - - [21, 64, 6144, 17, 21, 21, 21, 64]
    - [94, 2356.0]
  - - [21, 64, 6144, 21, 21, 21, 21, 64]
    - [137, 2753.0]
  - - [24, 64, 4736, 24, 24, 24, 24, 64]
    - [85, 3776.0]
  - - [30, 64, 2048, 30, 30, 30, 30, 64]
    - [122, 4216.0]
  - - [30, 64, 2048, 31, 30, 30, 30, 64]
    - [145, 4320.0]
  - - [31, 64, 2048, 31, 31, 31, 31, 64]
    - [122, 4460.0]
  - - [64, 14, 10880, 14, 64, 64, 64, 14]
    - [115, 2754.0]
  - - [64, 15, 10880, 14, 64, 64, 64, 15]
    - [139, 2900.0]
  - - [64, 15, 7680, 15, 64, 64, 64, 15]
    - [102, 2709.0]
  - - [64, 15, 10880, 15, 64, 64, 64, 15]
    - [139, 2975.0]
  - - [64, 17, 7680, 15, 64, 64, 64, 17]
    - [87, 3273.0]
  - - [64, 17, 6144, 17, 64, 64, 64, 17]
    - [120, 3529.0]
  - - [64, 17, 7680, 17, 64, 64, 64, 17]
    - [143, 3076.0]
  - - [64, 21, 6144, 17, 64, 64, 64, 21]
    - [131, 3447.0]
  - - [64, 21, 6144, 21, 64, 64, 64, 21]
    - [90, 4088.0]
  - - [64, 24, 4736, 24, 64, 64, 64, 24]
    - [87, 5709.0]
  - - [64, 30, 2048, 30, 64, 64, 64, 30]
    - [115, 6056.0]
  - - [64, 30, 2048, 31, 64, 64, 64, 30]
    - [87, 6058.0]
  - - [64, 31, 2048, 31, 64, 64, 64, 31]
    - [87, 6079.0]
  - - [27, 64, 1920, 27, 27, 27, 27, 64]
    - [104, 3575.0]
  - - [27, 64, 1920, 33, 27, 27, 27, 64]
    - [94, 4182.0]
  - - [64, 27, 1920, 27, 64, 64, 64, 27]
    - [102, 5208.0]
  - - [64, 27, 1920, 33, 64, 64, 64, 27]
    - [139, 5756.0]
  - - [1024, 2, 1, 1, 1024, 1024, 1024, 2]
    - [84, 1.0]
  - - [1024, 2, 1, 512, 1024, 1024, 1024, 2]
    - [109, 212.0]
  - - [1024, 2, 1, 10, 1024, 1024, 1024, 2]
    - [84, 5.0]
  - - [1024, 2, 1, 1280, 1024, 1024, 1024, 2]
    - [109, 232.0]
  - - [1024, 2, 1, 39, 1024, 1024, 1024, 2]
    - [84, 17.0]
  - - [1024, 2, 1, 40, 1024, 1024, 1024, 2]
    - [88, 19.0]
  - - [1024, 2, 1, 41, 1024, 1024, 1024, 2]
    - [130, 25.0]
  - - [1024, 2, 1, 5, 1024, 1024, 1024, 2]
    - [126, 4.0]
  - - [1024, 2, 1, 2560, 1024, 1024, 1024, 2]
    - [109, 288.0]
  - - [1024, 2, 1, 6, 1024, 1024, 1024, 2]
    - [84, 3.0]
  - - [1024, 2, 1, 3072, 1024, 1024, 1024, 2]
    - [157, 303.0]
  - - [1024, 2, 1, 8, 1024, 1024, 1024, 2]
    - [84, 4.0]
  - - [1024, 2, 1, 1024, 1024, 1024, 1024, 2]
    - [157, 219.0]
  - - [1024, 2, 1, 9, 1024, 1024, 1024, 2]
    - [119, 10.0]
  - - [1024, 2, 1, 1152, 1024, 1024, 1024, 2]
    - [123, 229.0]
  - - [4, 64, 32768, 4, 4, 4, 4, 64]
    - [85, 302.0]
  - - [4, 64, 38400, 4, 4, 4, 4, 64]
    - [85, 301.0]
  - - [64, 4, 32768, 4, 64, 64, 64, 4]
    - [87, 308.0]
  - - [64, 4, 38400, 4, 64, 64, 64, 4]
    - [87, 309.0]
  - - [64, 128, 1, 128, 64, 64, 64, 128]
    - [153, 448.0]
  - - [128, 64, 1, 128, 128, 128, 128, 64]
    - [105, 437.0]
  - - [5, 64, 1, 5, 5, 5, 5, 64]
    - [116, 0.39]
  - - [33, 32, 1, 33, 33, 33, 33, 32]
    - [89, 8.0]
  - - [1024, 2, 1, 16, 1024, 1024, 1024, 2]
    - [86, 8.0]
  - - [1024, 2, 1, 64, 1024, 1024, 1024, 2]
    - [108, 49.0]
  - - [256, 128, 1, 3456, 256, 256, 256, 128]
    - [148, 4303.0]
  - - [256, 128, 1, 4096, 256, 256, 256, 128]
    - [99, 4433.0]
  - - [256, 128, 1, 864, 256, 256, 256, 128]
    - [99, 2993.0]
  - - [1024, 2, 1, 80, 1024, 1024, 1024, 2]
    - [144, 35.0]
  - - [1024, 2, 1, 82, 1024, 1024, 1024, 2]
    - [89, 35.0]
  - - [1024, 2, 1, 12, 1024, 1024, 1024, 2]
    - [84, 6.0]
  - - [13, 512, 1, 3456, 13, 13, 13, 512]
    - [123, 1113.0]
  - - [13, 512, 1, 4096, 13, 13, 13, 512]
    - [125, 1142.0]
  - - [13, 512, 1, 864, 13, 13, 13, 512]
    - [159, 928.0]
  - - [64, 24, 6816, 24, 64, 64, 64, 24]
    - [127, 5408.0]
  - - [64, 26, 6272, 26, 64, 64, 64, 26]
    - [143, 6379.0]
  - - [1024, 2, 1, 128, 1024, 1024, 1024, 2]
    - [155, 99.0]
  - - [1024, 2, 1, 96, 1024, 1024, 1024, 2]
    - [91, 77.0]
  - - [768, 2, 1, 2048, 768, 768, 768, 2]
    - [109, 208.0]
  - - [1024, 81, 1, 1024, 1024, 1024, 1024, 81]
    - [92, 5355.0]
  - - [25, 256, 120, 128, 25, 25, 25, 256]
    - [85, 4990.0]
  - - [25, 256, 18, 128, 25, 25, 25, 256]
    - [133, 2150.0]
  - - [25, 256, 19, 128, 25, 25, 25, 256]
    - [99, 2243.0]
  - - [9, 256, 120, 128, 9, 9, 9, 256]
    - [84, 2198.0]
  - - [9, 256, 18, 128, 9, 9, 9, 256]
    - [117, 938.0]
  - - [9, 256, 19, 128, 9, 9, 9, 256]
    - [89, 950.0]
  - - [1024, 2, 1, 20, 1024, 1024, 1024, 2]
    - [84, 9.0]
- null
- null
- DeviceEfficiency
...
