library/src/blas3/Tensile/Logic/asm_full/navi22_Cijk_Alik_Bljk_SB_GB.yaml
---
- {MinimumRequiredVersion: 4.28.0}
- navi22
- gfx1031
    SolutionIndex: 0
    SolutionNameMin: Cijk_Alik_Bljk_SB_GB_MT128x64x8_SN_SU0_SUM0_TT8_8_WG16_8_1_WGM1
    SolutionIndex: 1
    SolutionNameMin: Cijk_Alik_Bljk_SB_GB_MT128x128x8_SN_SU0_SUM0_TT8_16_WG16_8_1_WGM1
    SolutionIndex: 2
    SolutionNameMin: Cijk_Alik_Bljk_SB_GB_MT128x128x8_SN_SU0_SUM0_TT8_8_WG16_16_1_WGM1
    SolutionIndex: 3
    SolutionNameMin: Cijk_Alik_Bljk_SB_GB_MT128x256x8_SN_SU0_SUM0_TT8_16_WG16_16_1_WGM1
    SolutionIndex: 4
    SolutionNameMin: Cijk_Alik_Bljk_SB_GB_MT128x64x16_SN_SU0_SUM0_TT8_8_WG16_8_1_WGM1
    SolutionIndex: 5
    SolutionNameMin: Cijk_Alik_Bljk_SB_GB_MT128x128x16_SN_SU0_SUM0_TT8_16_WG16_8_1_WGM1
    SolutionIndex: 6
    SolutionNameMin: Cijk_Alik_Bljk_SB_GB_MT128x128x16_SN_SU0_SUM0_TT8_8_WG16_16_1_WGM1
    SolutionIndex: 7
    SolutionNameMin: Cijk_Alik_Bljk_SB_GB_MT128x256x16_SN_SU0_SUM0_TT8_16_WG16_16_1_WGM1
    SolutionIndex: 8
    SolutionNameMin: Cijk_Alik_Bljk_SB_GB_MT128x64x32_SN_SU0_SUM0_TT8_8_WG16_8_1_WGM1
    SolutionIndex: 9
    SolutionNameMin: Cijk_Alik_Bljk_SB_GB_MT128x128x32_SN_SU0_SUM0_TT8_16_WG16_8_1_WGM1
    SolutionIndex: 10
    SolutionNameMin: Cijk_Alik_Bljk_SB_GB_MT128x128x32_SN_SU0_SUM0_TT8_8_WG16_16_1_WGM1
    SolutionIndex: 11
    SolutionNameMin: Cijk_Alik_Bljk_SB_GB_MT128x64x8_SN_SU32_SUM3_TT8_8_WG16_8_1_WGM1
    SolutionIndex: 12
    SolutionNameMin: Cijk_Alik_Bljk_SB_GB_MT128x128x8_SN_SU32_SUM3_TT8_16_WG16_8_1_WGM1
    SolutionIndex: 13
    SolutionNameMin: Cijk_Alik_Bljk_SB_GB_MT128x128x8_SN_SU32_SUM3_TT8_8_WG16_16_1_WGM1
    SolutionIndex: 14
    SolutionNameMin: Cijk_Alik_Bljk_SB_GB_MT128x256x8_SN_SU32_SUM3_TT8_16_WG16_16_1_WGM1
    SolutionIndex: 15
    SolutionNameMin: Cijk_Alik_Bljk_SB_GB_MT128x64x16_SN_SU32_SUM3_TT8_8_WG16_8_1_WGM1
    SolutionIndex: 16
    SolutionNameMin: Cijk_Alik_Bljk_SB_GB_MT128x128x16_SN_SU32_SUM3_TT8_16_WG16_8_1_WGM1
    SolutionIndex: 17
    SolutionNameMin: Cijk_Alik_Bljk_SB_GB_MT128x128x16_SN_SU32_SUM3_TT8_8_WG16_16_1_WGM1
    SolutionIndex: 18
    SolutionNameMin: Cijk_Alik_Bljk_SB_GB_MT128x256x16_SN_SU32_SUM3_TT8_16_WG16_16_1_WGM1
    SolutionIndex: 19
    SolutionNameMin: Cijk_Alik_Bljk_SB_GB_MT128x64x32_SN_SU32_SUM3_TT8_8_WG16_8_1_WGM1
    SolutionIndex: 20
    SolutionNameMin: Cijk_Alik_Bljk_SB_GB_MT128x128x32_SN_SU32_SUM3_TT8_16_WG16_8_1_WGM1
    SolutionIndex: 21
    SolutionNameMin: Cijk_Alik_Bljk_SB_GB_MT128x128x32_SN_SU32_SUM3_TT8_8_WG16_16_1_WGM1
    SolutionIndex: 22
    SolutionNameMin: Cijk_Alik_Bljk_SB_GB_MT128x64x8_SN_SU0_SUM0_TT8_8_WG16_8_1_WGM4
    SolutionIndex: 23
    SolutionNameMin: Cijk_Alik_Bljk_SB_GB_MT128x128x8_SN_SU0_SUM0_TT8_16_WG16_8_1_WGM4
    SolutionIndex: 24
    SolutionNameMin: Cijk_Alik_Bljk_SB_GB_MT128x128x8_SN_SU0_SUM0_TT8_8_WG16_16_1_WGM4
    SolutionIndex: 25
    SolutionNameMin: Cijk_Alik_Bljk_SB_GB_MT128x256x8_SN_SU0_SUM0_TT8_16_WG16_16_1_WGM4
    SolutionIndex: 26
    SolutionNameMin: Cijk_Alik_Bljk_SB_GB_MT128x64x16_SN_SU0_SUM0_TT8_8_WG16_8_1_WGM4
    SolutionIndex: 27
    SolutionNameMin: Cijk_Alik_Bljk_SB_GB_MT128x128x16_SN_SU0_SUM0_TT8_16_WG16_8_1_WGM4
    SolutionIndex: 28
    SolutionNameMin: Cijk_Alik_Bljk_SB_GB_MT128x128x16_SN_SU0_SUM0_TT8_8_WG16_16_1_WGM4
    SolutionIndex: 29
    SolutionNameMin: Cijk_Alik_Bljk_SB_GB_MT128x256x16_SN_SU0_SUM0_TT8_16_WG16_16_1_WGM4
    SolutionIndex: 30
    SolutionNameMin: Cijk_Alik_Bljk_SB_GB_MT128x64x32_SN_SU0_SUM0_TT8_8_WG16_8_1_WGM4
    SolutionIndex: 31
    SolutionNameMin: Cijk_Alik_Bljk_SB_GB_MT128x128x32_SN_SU0_SUM0_TT8_16_WG16_8_1_WGM4
    SolutionIndex: 32
    SolutionNameMin: Cijk_Alik_Bljk_SB_GB_MT128x128x32_SN_SU0_SUM0_TT8_8_WG16_16_1_WGM4
    SolutionIndex: 33
    SolutionNameMin: Cijk_Alik_Bljk_SB_GB_MT128x64x8_SN_SU32_SUM3_TT8_8_WG16_8_1_WGM4
    SolutionIndex: 34
    SolutionNameMin: Cijk_Alik_Bljk_SB_GB_MT128x128x8_SN_SU32_SUM3_TT8_16_WG16_8_1_WGM4
    SolutionIndex: 35
    SolutionNameMin: Cijk_Alik_Bljk_SB_GB_MT128x128x8_SN_SU32_SUM3_TT8_8_WG16_16_1_WGM4
    SolutionIndex: 36
    SolutionNameMin: Cijk_Alik_Bljk_SB_GB_MT128x256x8_SN_SU32_SUM3_TT8_16_WG16_16_1_WGM4
    SolutionIndex: 37
    SolutionNameMin: Cijk_Alik_Bljk_SB_GB_MT128x64x16_SN_SU32_SUM3_TT8_8_WG16_8_1_WGM4
    SolutionIndex: 38
    SolutionNameMin: Cijk_Alik_Bljk_SB_GB_MT128x128x16_SN_SU32_SUM3_TT8_16_WG16_8_1_WGM4
    SolutionIndex: 39
    SolutionNameMin: Cijk_Alik_Bljk_SB_GB_MT128x128x16_SN_SU32_SUM3_TT8_8_WG16_16_1_WGM4
    SolutionIndex: 40
    SolutionNameMin: Cijk_Alik_Bljk_SB_GB_MT128x256x16_SN_SU32_SUM3_TT8_16_WG16_16_1_WGM4
    SolutionIndex: 41
    SolutionNameMin: Cijk_Alik_Bljk_SB_GB_MT128x64x32_SN_SU32_SUM3_TT8_8_WG16_8_1_WGM4
    SolutionIndex: 42
    SolutionNameMin: Cijk_Alik_Bljk_SB_GB_MT128x128x32_SN_SU32_SUM3_TT8_16_WG16_8_1_WGM4
    SolutionIndex: 43
    SolutionNameMin: Cijk_Alik_Bljk_SB_GB_MT128x128x32_SN_SU32_SUM3_TT8_8_WG16_16_1_WGM4
    SolutionIndex: 44
    SolutionNameMin: Cijk_Alik_Bljk_SB_GB_MT128x64x8_SN_SU0_SUM0_TT8_8_WG16_8_1_WGM8
    SolutionIndex: 45
    SolutionNameMin: Cijk_Alik_Bljk_SB_GB_MT128x128x8_SN_SU0_SUM0_TT8_16_WG16_8_1_WGM8
    SolutionIndex: 46
    SolutionNameMin: Cijk_Alik_Bljk_SB_GB_MT128x128x8_SN_SU0_SUM0_TT8_8_WG16_16_1_WGM8
    SolutionIndex: 47
    SolutionNameMin: Cijk_Alik_Bljk_SB_GB_MT128x256x8_SN_SU0_SUM0_TT8_16_WG16_16_1_WGM8
    SolutionIndex: 48
    SolutionNameMin: Cijk_Alik_Bljk_SB_GB_MT128x64x16_SN_SU0_SUM0_TT8_8_WG16_8_1_WGM8
    SolutionIndex: 49
    SolutionNameMin: Cijk_Alik_Bljk_SB_GB_MT128x128x16_SN_SU0_SUM0_TT8_16_WG16_8_1_WGM8
    SolutionIndex: 50
    SolutionNameMin: Cijk_Alik_Bljk_SB_GB_MT128x128x16_SN_SU0_SUM0_TT8_8_WG16_16_1_WGM8
    SolutionIndex: 51
    SolutionNameMin: Cijk_Alik_Bljk_SB_GB_MT128x256x16_SN_SU0_SUM0_TT8_16_WG16_16_1_WGM8
    SolutionIndex: 52
    SolutionNameMin: Cijk_Alik_Bljk_SB_GB_MT128x128x32_SN_SU0_SUM0_TT8_8_WG16_16_1_WGM8
    SolutionIndex: 53
    SolutionNameMin: Cijk_Alik_Bljk_SB_GB_MT128x64x8_SN_SU32_SUM3_TT8_8_WG16_8_1_WGM8
    SolutionIndex: 54
    SolutionNameMin: Cijk_Alik_Bljk_SB_GB_MT128x128x8_SN_SU32_SUM3_TT8_16_WG16_8_1_WGM8
    SolutionIndex: 55
    SolutionNameMin: Cijk_Alik_Bljk_SB_GB_MT128x128x8_SN_SU32_SUM3_TT8_8_WG16_16_1_WGM8
    SolutionIndex: 56
    SolutionNameMin: Cijk_Alik_Bljk_SB_GB_MT128x256x8_SN_SU32_SUM3_TT8_16_WG16_16_1_WGM8
    SolutionIndex: 57
    SolutionNameMin: Cijk_Alik_Bljk_SB_GB_MT128x64x16_SN_SU32_SUM3_TT8_8_WG16_8_1_WGM8
    SolutionIndex: 58
    SolutionNameMin: Cijk_Alik_Bljk_SB_GB_MT128x128x16_SN_SU32_SUM3_TT8_16_WG16_8_1_WGM8
    SolutionIndex: 59
    SolutionNameMin: Cijk_Alik_Bljk_SB_GB_MT128x128x16_SN_SU32_SUM3_TT8_8_WG16_16_1_WGM8
    SolutionIndex: 60
    SolutionNameMin: Cijk_Alik_Bljk_SB_GB_MT128x256x16_SN_SU32_SUM3_TT8_16_WG16_16_1_WGM8
    SolutionIndex: 61
    SolutionNameMin: Cijk_Alik_Bljk_SB_GB_MT128x64x32_SN_SU32_SUM3_TT8_8_WG16_8_1_WGM8
    SolutionIndex: 62
    SolutionNameMin: Cijk_Alik_Bljk_SB_GB_MT128x128x32_SN_SU32_SUM3_TT8_16_WG16_8_1_WGM8
    SolutionIndex: 63
    SolutionNameMin: Cijk_Alik_Bljk_SB_GB_MT128x128x32_SN_SU32_SUM3_TT8_8_WG16_16_1_WGM8
    SolutionIndex: 64
    SolutionNameMin: Cijk_Alik_Bljk_SB_GB_MT128x128x16_SN_SU0_SUM0_TT8_16_WG16_8_1_WGM1
    SolutionIndex: 65
    SolutionNameMin: Cijk_Alik_Bljk_SB_GB_MT128x256x16_SN_SU0_SUM0_TT8_16_WG16_16_1_WGM1
    SolutionIndex: 66
    SolutionNameMin: Cijk_Alik_Bljk_SB_GB_MT128x64x32_SN_SU0_SUM0_TT8_8_WG16_8_1_WGM1
    SolutionIndex: 67
    SolutionNameMin: Cijk_Alik_Bljk_SB_GB_MT128x128x32_SN_SU0_SUM0_TT8_8_WG16_16_1_WGM1
    SolutionIndex: 68
    SolutionNameMin: Cijk_Alik_Bljk_SB_GB_MT128x128x16_SN_SU32_SUM3_TT8_16_WG16_8_1_WGM1
    SolutionIndex: 69
    SolutionNameMin: Cijk_Alik_Bljk_SB_GB_MT128x256x16_SN_SU32_SUM3_TT8_16_WG16_16_1_WGM1
    SolutionIndex: 70
    SolutionNameMin: Cijk_Alik_Bljk_SB_GB_MT128x64x32_SN_SU32_SUM3_TT8_8_WG16_8_1_WGM1
    SolutionIndex: 71
    SolutionNameMin: Cijk_Alik_Bljk_SB_GB_MT128x128x32_SN_SU32_SUM3_TT8_16_WG16_8_1_WGM1
    SolutionIndex: 72
    SolutionNameMin: Cijk_Alik_Bljk_SB_GB_MT128x128x32_SN_SU32_SUM3_TT8_8_WG16_16_1_WGM1
    SolutionIndex: 73
    SolutionNameMin: Cijk_Alik_Bljk_SB_GB_MT128x64x16_SN_SU0_SUM0_TT8_8_WG16_8_1_WGM4
    SolutionIndex: 74
    SolutionNameMin: Cijk_Alik_Bljk_SB_GB_MT128x128x16_SN_SU0_SUM0_TT8_16_WG16_8_1_WGM4
    SolutionIndex: 75
    SolutionNameMin: Cijk_Alik_Bljk_SB_GB_MT128x128x32_SN_SU0_SUM0_TT8_8_WG16_16_1_WGM4
    SolutionIndex: 76
    SolutionNameMin: Cijk_Alik_Bljk_SB_GB_MT128x128x32_SN_SU32_SUM3_TT8_16_WG16_8_1_WGM4
    SolutionIndex: 77
    SolutionNameMin: Cijk_Alik_Bljk_SB_GB_MT128x128x32_SN_SU32_SUM3_TT8_8_WG16_16_1_WGM4
    SolutionIndex: 78
    SolutionNameMin: Cijk_Alik_Bljk_SB_GB_MT128x128x16_SN_SU0_SUM0_TT8_16_WG16_8_1_WGM8
    SolutionIndex: 79
    SolutionNameMin: Cijk_Alik_Bljk_SB_GB_MT128x128x16_SN_SU0_SUM0_TT8_8_WG16_16_1_WGM8
    SolutionIndex: 80
    SolutionNameMin: Cijk_Alik_Bljk_SB_GB_MT128x128x32_SN_SU0_SUM0_TT8_16_WG16_8_1_WGM8
    SolutionIndex: 81
    SolutionNameMin: Cijk_Alik_Bljk_SB_GB_MT128x128x32_SN_SU0_SUM0_TT8_8_WG16_16_1_WGM8
    SolutionIndex: 82
    SolutionNameMin: Cijk_Alik_Bljk_SB_GB_MT128x128x8_SN_SU32_SUM3_TT8_8_WG16_16_1_WGM8
    SolutionIndex: 83
    SolutionNameMin: Cijk_Alik_Bljk_SB_GB_MT128x128x16_SN_SU32_SUM3_TT8_16_WG16_8_1_WGM8
    SolutionIndex: 84
    SolutionNameMin: Cijk_Alik_Bljk_SB_GB_MT128x128x16_SN_SU32_SUM3_TT8_8_WG16_16_1_WGM8
    SolutionIndex: 85
    SolutionNameMin: Cijk_Alik_Bljk_SB_GB_MT128x256x16_SN_SU32_SUM3_TT8_16_WG16_16_1_WGM8
    SolutionIndex: 86
    SolutionNameMin: Cijk_Alik_Bljk_SB_GB_MT128x64x32_SN_SU32_SUM3_TT8_8_WG16_8_1_WGM8
    SolutionIndex: 87
    SolutionNameMin: Cijk_Alik_Bljk_SB_GB_MT128x128x32_SN_SU32_SUM3_TT8_8_WG16_16_1_WGM8
    SolutionIndex: 92
    SolutionNameMin: Cijk_Alik_Bljk_SB_GB_MT64x64x8_SN_SU0_SUM0_TT4_8_WG16_8_1_WGM1
    SolutionIndex: 93
    SolutionNameMin: Cijk_Alik_Bljk_SB_GB_MT128x64x8_SN_SU0_SUM0_TT8_8_WG16_8_1_WGM1
    SolutionIndex: 95
    SolutionNameMin: Cijk_Alik_Bljk_SB_GB_MT128x128x8_SN_SU0_SUM0_TT8_8_WG16_16_1_WGM1
    SolutionIndex: 97
    SolutionNameMin: Cijk_Alik_Bljk_SB_GB_MT64x64x16_SN_SU0_SUM0_TT8_8_WG8_8_1_WGM1
    SolutionIndex: 99
    SolutionNameMin: Cijk_Alik_Bljk_SB_GB_MT128x64x16_SN_SU0_SUM0_TT8_8_WG16_8_1_WGM1
    SolutionIndex: 100
    SolutionNameMin: Cijk_Alik_Bljk_SB_GB_MT128x128x16_SN_SU0_SUM0_TT8_8_WG16_16_1_WGM1
    SolutionIndex: 102
    SolutionNameMin: Cijk_Alik_Bljk_SB_GB_MT64x64x32_SN_SU0_SUM0_TT4_8_WG16_8_1_WGM1
    SolutionIndex: 104
    SolutionNameMin: Cijk_Alik_Bljk_SB_GB_MT128x128x32_SN_SU0_SUM0_TT8_8_WG16_16_1_WGM1
    SolutionIndex: 107
    SolutionNameMin: Cijk_Alik_Bljk_SB_GB_MT64x64x8_SN_SU32_SUM3_TT4_8_WG16_8_1_WGM1
    SolutionIndex: 108
    SolutionNameMin: Cijk_Alik_Bljk_SB_GB_MT128x64x8_SN_SU32_SUM3_TT8_8_WG16_8_1_WGM1
    SolutionIndex: 109
    SolutionNameMin: Cijk_Alik_Bljk_SB_GB_MT128x128x8_SN_SU32_SUM3_TT8_8_WG16_16_1_WGM1
    SolutionIndex: 110
    SolutionNameMin: Cijk_Alik_Bljk_SB_GB_MT64x64x16_SN_SU32_SUM3_TT8_8_WG8_8_1_WGM1
    SolutionIndex: 112
    SolutionNameMin: Cijk_Alik_Bljk_SB_GB_MT64x64x16_SN_SU32_SUM3_TT4_8_WG16_8_1_WGM1
    SolutionIndex: 113
    SolutionNameMin: Cijk_Alik_Bljk_SB_GB_MT128x64x16_SN_SU32_SUM3_TT8_8_WG16_8_1_WGM1
    SolutionIndex: 114
    SolutionNameMin: Cijk_Alik_Bljk_SB_GB_MT64x128x16_SN_SU32_SUM3_TT4_8_WG16_16_1_WGM1
    SolutionIndex: 115
    SolutionNameMin: Cijk_Alik_Bljk_SB_GB_MT128x128x16_SN_SU32_SUM3_TT8_8_WG16_16_1_WGM1
    SolutionIndex: 118
    SolutionNameMin: Cijk_Alik_Bljk_SB_GB_MT128x64x32_SN_SU32_SUM3_TT8_8_WG16_8_1_WGM1
    SolutionIndex: 120
    SolutionNameMin: Cijk_Alik_Bljk_SB_GB_MT128x128x32_SN_SU32_SUM3_TT8_8_WG16_16_1_WGM1
    SolutionIndex: 121
    SolutionNameMin: Cijk_Alik_Bljk_SB_GB_MT32x64x8_SN_SU0_SUM0_TT4_8_WG8_8_1_WGM4
    SolutionIndex: 124
    SolutionNameMin: Cijk_Alik_Bljk_SB_GB_MT64x64x8_SN_SU0_SUM0_TT4_8_WG16_8_1_WGM4
    SolutionIndex: 125
    SolutionNameMin: Cijk_Alik_Bljk_SB_GB_MT128x64x8_SN_SU0_SUM0_TT8_8_WG16_8_1_WGM4
    SolutionIndex: 127
    SolutionNameMin: Cijk_Alik_Bljk_SB_GB_MT64x128x8_SN_SU0_SUM0_TT4_8_WG16_16_1_WGM4
    SolutionIndex: 128
    SolutionNameMin: Cijk_Alik_Bljk_SB_GB_MT128x128x8_SN_SU0_SUM0_TT8_8_WG16_16_1_WGM4
    SolutionIndex: 131
    SolutionNameMin: Cijk_Alik_Bljk_SB_GB_MT128x64x16_SN_SU0_SUM0_TT8_8_WG16_8_1_WGM4
    SolutionIndex: 132
    SolutionNameMin: Cijk_Alik_Bljk_SB_GB_MT128x128x16_SN_SU0_SUM0_TT8_8_WG16_16_1_WGM4
    SolutionIndex: 136
    SolutionNameMin: Cijk_Alik_Bljk_SB_GB_MT128x128x32_SN_SU0_SUM0_TT8_8_WG16_16_1_WGM4
    SolutionIndex: 138
    SolutionNameMin: Cijk_Alik_Bljk_SB_GB_MT64x64x8_SN_SU32_SUM3_TT8_8_WG8_8_1_WGM4
    SolutionIndex: 139
    SolutionNameMin: Cijk_Alik_Bljk_SB_GB_MT64x64x8_SN_SU32_SUM3_TT4_8_WG16_8_1_WGM4
    SolutionIndex: 140
    SolutionNameMin: Cijk_Alik_Bljk_SB_GB_MT128x64x8_SN_SU32_SUM3_TT8_8_WG16_8_1_WGM4
    SolutionIndex: 141
    SolutionNameMin: Cijk_Alik_Bljk_SB_GB_MT64x64x8_SN_SU32_SUM3_TT4_4_WG16_16_1_WGM4
    SolutionIndex: 142
    SolutionNameMin: Cijk_Alik_Bljk_SB_GB_MT64x128x8_SN_SU32_SUM3_TT4_8_WG16_16_1_WGM4
    SolutionIndex: 143
    SolutionNameMin: Cijk_Alik_Bljk_SB_GB_MT128x128x8_SN_SU32_SUM3_TT8_8_WG16_16_1_WGM4
    SolutionIndex: 144
    SolutionNameMin: Cijk_Alik_Bljk_SB_GB_MT64x64x16_SN_SU32_SUM3_TT8_8_WG8_8_1_WGM4
    SolutionIndex: 145
    SolutionNameMin: Cijk_Alik_Bljk_SB_GB_MT64x64x16_SN_SU32_SUM3_TT4_8_WG16_8_1_WGM4
    SolutionIndex: 146
    SolutionNameMin: Cijk_Alik_Bljk_SB_GB_MT128x64x16_SN_SU32_SUM3_TT8_8_WG16_8_1_WGM4
    SolutionIndex: 148
    SolutionNameMin: Cijk_Alik_Bljk_SB_GB_MT128x128x16_SN_SU32_SUM3_TT8_8_WG16_16_1_WGM4
    SolutionIndex: 151
    SolutionNameMin: Cijk_Alik_Bljk_SB_GB_MT128x64x32_SN_SU32_SUM3_TT8_8_WG16_8_1_WGM4
    SolutionIndex: 153
    SolutionNameMin: Cijk_Alik_Bljk_SB_GB_MT32x32x8_SN_SU0_SUM0_TT4_4_WG8_8_1_WGM8
    SolutionIndex: 156
    SolutionNameMin: Cijk_Alik_Bljk_SB_GB_MT64x64x8_SN_SU0_SUM0_TT4_8_WG16_8_1_WGM8
    SolutionIndex: 157
    SolutionNameMin: Cijk_Alik_Bljk_SB_GB_MT128x64x8_SN_SU0_SUM0_TT8_8_WG16_8_1_WGM8
    SolutionIndex: 158
    SolutionNameMin: Cijk_Alik_Bljk_SB_GB_MT64x128x8_SN_SU0_SUM0_TT4_8_WG16_16_1_WGM8
    SolutionIndex: 159
    SolutionNameMin: Cijk_Alik_Bljk_SB_GB_MT128x128x8_SN_SU0_SUM0_TT8_8_WG16_16_1_WGM8
    SolutionIndex: 161
    SolutionNameMin: Cijk_Alik_Bljk_SB_GB_MT64x64x16_SN_SU0_SUM0_TT8_8_WG8_8_1_WGM8
    SolutionIndex: 162
    SolutionNameMin: Cijk_Alik_Bljk_SB_GB_MT64x64x16_SN_SU0_SUM0_TT4_8_WG16_8_1_WGM8
    SolutionIndex: 163
    SolutionNameMin: Cijk_Alik_Bljk_SB_GB_MT128x64x16_SN_SU0_SUM0_TT8_8_WG16_8_1_WGM8
    SolutionIndex: 165
    SolutionNameMin: Cijk_Alik_Bljk_SB_GB_MT128x128x16_SN_SU0_SUM0_TT8_8_WG16_16_1_WGM8
    SolutionIndex: 166
    SolutionNameMin: Cijk_Alik_Bljk_SB_GB_MT64x128x32_SN_SU0_SUM0_TT4_8_WG16_16_1_WGM8
    SolutionIndex: 169
    SolutionNameMin: Cijk_Alik_Bljk_SB_GB_MT64x64x8_SN_SU32_SUM3_TT8_8_WG8_8_1_WGM8
    SolutionIndex: 170
    SolutionNameMin: Cijk_Alik_Bljk_SB_GB_MT64x32x8_SN_SU32_SUM3_TT4_4_WG16_8_1_WGM8
    SolutionIndex: 171
    SolutionNameMin: Cijk_Alik_Bljk_SB_GB_MT64x64x8_SN_SU32_SUM3_TT4_8_WG16_8_1_WGM8
    SolutionIndex: 172
    SolutionNameMin: Cijk_Alik_Bljk_SB_GB_MT128x64x8_SN_SU32_SUM3_TT8_8_WG16_8_1_WGM8
    SolutionIndex: 173
    SolutionNameMin: Cijk_Alik_Bljk_SB_GB_MT64x128x8_SN_SU32_SUM3_TT4_8_WG16_16_1_WGM8
    SolutionIndex: 174
    SolutionNameMin: Cijk_Alik_Bljk_SB_GB_MT128x128x8_SN_SU32_SUM3_TT8_8_WG16_16_1_WGM8
    SolutionIndex: 175
    SolutionNameMin: Cijk_Alik_Bljk_SB_GB_MT64x64x16_SN_SU32_SUM3_TT8_8_WG8_8_1_WGM8
    SolutionIndex: 176
    SolutionNameMin: Cijk_Alik_Bljk_SB_GB_MT64x32x16_SN_SU32_SUM3_TT4_4_WG16_8_1_WGM8
    SolutionIndex: 177
    SolutionNameMin: Cijk_Alik_Bljk_SB_GB_MT64x64x16_SN_SU32_SUM3_TT4_8_WG16_8_1_WGM8
    SolutionIndex: 178
    SolutionNameMin: Cijk_Alik_Bljk_SB_GB_MT128x64x16_SN_SU32_SUM3_TT8_8_WG16_8_1_WGM8
    SolutionIndex: 179
    SolutionNameMin: Cijk_Alik_Bljk_SB_GB_MT64x128x16_SN_SU32_SUM3_TT4_8_WG16_16_1_WGM8
    SolutionIndex: 180
    SolutionNameMin: Cijk_Alik_Bljk_SB_GB_MT128x128x16_SN_SU32_SUM3_TT8_8_WG16_16_1_WGM8
    SolutionIndex: 183
    SolutionNameMin: Cijk_Alik_Bljk_SB_GB_MT64x64x32_SN_SU32_SUM3_TT4_8_WG16_8_1_WGM8
    SolutionIndex: 187
    SolutionNameMin: Cijk_Alik_Bljk_SB_GB_MT128x128x32_SN_SU32_SUM3_TT8_8_WG16_16_1_WGM8
- - - [1024, 4096, 1, 1024, 1024, 1024, 1024, 1024]
    - [16, 10800.0]
  - - [4096, 4096, 1, 1024, 4096, 4096, 1024, 1024]
    - [16, 8798.0]
  - - [1024, 4096, 1, 4096, 1024, 1024, 4096, 4096]
    - [62, 7704.0]
  - - [30528, 4096, 1, 1024, 30528, 30528, 1024, 1024]
    - [60, 10973.0]
  - - [1024, 2048, 1, 1024, 1024, 1024, 1024, 1024]
    - [38, 9500.0]
  - - [4096, 2048, 1, 1024, 4096, 4096, 1024, 1024]
    - [16, 11431.0]
  - - [1024, 2048, 1, 4096, 1024, 1024, 4096, 4096]
    - [38, 10175.0]
  - - [30528, 2048, 1, 1024, 30528, 30528, 1024, 1024]
    - [60, 10252.0]
  - - [30522, 320, 1, 768, 30522, 30522, 768, 768]
    - [58, 9801.0]
  - - [3072, 4096, 1, 768, 3072, 3072, 768, 768]
    - [16, 11748.0]
  - - [768, 4096, 1, 3072, 768, 768, 3072, 3072]
    - [40, 11400.0]
  - - [768, 4096, 1, 768, 768, 768, 768, 768]
    - [40, 10903.0]
  - - [30522, 160, 1, 768, 30522, 30522, 768, 768]
    - [57, 8104.0]
  - - [30522, 640, 1, 768, 30522, 30522, 768, 768]
    - [16, 11743.0]
  - - [30522, 1280, 1, 768, 30522, 30522, 768, 768]
    - [46, 9655.0]
  - - [1024, 3072, 1, 1024, 1024, 1024, 1024, 1024]
    - [40, 10278.0]
  - - [1024, 2048, 1, 3072, 1024, 1024, 3072, 3072]
    - [16, 10523.0]
  - - [1024, 3072, 1, 3072, 1024, 1024, 3072, 3072]
    - [40, 11377.0]
  - - [3072, 2048, 1, 1024, 3072, 3072, 1024, 1024]
    - [38, 11225.0]
  - - [3072, 3072, 1, 1024, 3072, 3072, 1024, 1024]
    - [38, 11447.0]
  - - [3072, 512, 1, 1024, 3072, 3072, 1024, 1024]
    - [58, 10135.0]
  - - [30522, 160, 1, 1024, 30522, 30522, 1024, 1024]
    - [58, 7355.0]
  - - [128, 128, 512, 64, 128, 128, 64, 64]
    - [59, 9168.0]
  - - [512, 512, 64, 64, 512, 512, 64, 64]
    - [5, 10616.0]
  - - [256, 256, 192, 64, 256, 256, 64, 64]
    - [46, 10303.0]
  - - [256, 256, 96, 64, 256, 256, 64, 64]
    - [46, 9806.0]
  - - [128, 128, 384, 64, 128, 128, 64, 64]
    - [6, 9222.0]
  - - [128, 128, 96, 64, 128, 128, 64, 64]
    - [2, 7252.0]
  - - [512, 512, 16, 64, 512, 512, 64, 64]
    - [17, 7354.0]
  - - [512, 512, 96, 64, 512, 512, 64, 64]
    - [0, 8094.0]
  - - [512, 512, 128, 64, 512, 512, 64, 64]
    - [4, 7621.0]
  - - [2944, 4288, 1, 1280, 2944, 2944, 1280, 1280]
    - [49, 9890.0]
  - - [2368, 5888, 1, 256, 2368, 2368, 256, 256]
    - [49, 11075.0]
  - - [5888, 1856, 1, 256, 5888, 5888, 256, 256]
    - [16, 11052.0]
  - - [512, 24000, 1, 1536, 512, 512, 1536, 1536]
    - [41, 7598.0]
  - - [5888, 1408, 1, 256, 5888, 5888, 256, 256]
    - [16, 10019.0]
  - - [5888, 1856, 1, 3328, 5888, 5888, 3328, 3328]
    - [16, 9555.0]
  - - [5056, 704, 1, 256, 5056, 5056, 256, 256]
    - [13, 8358.0]
  - - [5888, 2944, 1, 3328, 5888, 5888, 3328, 3328]
    - [38, 10478.0]
  - - [1856, 4288, 1, 256, 1856, 1856, 256, 256]
    - [14, 9516.0]
  - - [1024, 5056, 1, 128, 1024, 1024, 128, 128]
    - [38, 9076.0]
  - - [5056, 5056, 1, 3328, 5056, 5056, 3328, 3328]
    - [51, 11685.0]
  - - [1408, 5888, 1, 1280, 1408, 1408, 1280, 1280]
    - [18, 11604.0]
  - - [2368, 6784, 1, 128, 2368, 2368, 128, 128]
    - [34, 9359.0]
  - - [1024, 3584, 1, 3328, 1024, 1024, 3328, 3328]
    - [29, 10948.0]
  - - [512, 48000, 1, 2048, 512, 512, 2048, 2048]
    - [49, 9808.0]
  - - [5888, 1408, 1, 1280, 5888, 5888, 1280, 1280]
    - [58, 11414.0]
  - - [1024, 2368, 1, 256, 1024, 1024, 256, 256]
    - [37, 8901.0]
  - - [1408, 1856, 1, 1280, 1408, 1408, 1280, 1280]
    - [16, 10141.0]
  - - [6144, 24000, 1, 2048, 6144, 6144, 2048, 2048]
    - [38, 11123.0]
  - - [5056, 5056, 1, 1280, 5056, 5056, 1280, 1280]
    - [18, 9817.0]
  - - [448, 5056, 1, 256, 448, 448, 256, 256]
    - [39, 8530.0]
  - - [1760, 6400, 1, 1760, 1760, 1760, 1760, 1760]
    - [51, 10062.0]
  - - [1856, 1408, 1, 128, 1856, 1856, 128, 128]
    - [35, 8460.0]
  - - [6784, 256, 1, 3328, 6784, 6784, 3328, 3328]
    - [58, 10079.0]
  - - [6784, 4288, 1, 3328, 6784, 6784, 3328, 3328]
    - [58, 11003.0]
  - - [4288, 448, 1, 256, 4288, 4288, 256, 256]
    - [13, 7202.0]
  - - [1856, 2368, 1, 3328, 1856, 1856, 3328, 3328]
    - [16, 10515.0]
  - - [4288, 2944, 1, 1280, 4288, 4288, 1280, 1280]
    - [16, 10492.0]
  - - [704, 5056, 1, 1280, 704, 704, 1280, 1280]
    - [60, 10440.0]
  - - [2368, 704, 1, 3328, 2368, 2368, 3328, 3328]
    - [16, 9652.0]
  - - [256, 5888, 1, 256, 256, 256, 256, 256]
    - [38, 8652.0]
  - - [1856, 4288, 1, 3328, 1856, 1856, 3328, 3328]
    - [28, 9926.0]
  - - [5888, 1024, 1, 256, 5888, 5888, 256, 256]
    - [38, 10850.0]
  - - [16384, 3200, 1, 4096, 16384, 16384, 4096, 4096]
    - [18, 10127.0]
  - - [1408, 2944, 1, 256, 1408, 1408, 256, 256]
    - [35, 9443.0]
  - - [6784, 5056, 1, 3328, 6784, 6784, 3328, 3328]
    - [40, 11861.0]
  - - [5056, 5056, 1, 256, 5056, 5056, 256, 256]
    - [16, 11535.0]
  - - [1408, 6784, 1, 128, 1408, 1408, 128, 128]
    - [23, 11051.0]
  - - [704, 5056, 1, 128, 704, 704, 128, 128]
    - [34, 8958.0]
  - - [2368, 2944, 1, 1280, 2368, 2368, 1280, 1280]
    - [16, 11545.0]
  - - [6784, 6784, 1, 1280, 6784, 6784, 1280, 1280]
    - [16, 10927.0]
  - - [1408, 4288, 1, 1280, 1408, 1408, 1280, 1280]
    - [38, 11124.0]
  - - [3584, 4288, 1, 1280, 3584, 3584, 1280, 1280]
    - [40, 11816.0]
  - - [2368, 704, 1, 1280, 2368, 2368, 1280, 1280]
    - [16, 9409.0]
  - - [5056, 4288, 1, 3328, 5056, 5056, 3328, 3328]
    - [16, 10742.0]
  - - [3584, 2368, 1, 3328, 3584, 3584, 3328, 3328]
    - [40, 9398.0]
  - - [6784, 448, 1, 1280, 6784, 6784, 1280, 1280]
    - [16, 9364.0]
  - - [1408, 2944, 1, 128, 1408, 1408, 128, 128]
    - [34, 9689.0]
  - - [4288, 2944, 1, 256, 4288, 4288, 256, 256]
    - [27, 11149.0]
  - - [5888, 704, 1, 1280, 5888, 5888, 1280, 1280]
    - [29, 10649.0]
  - - [448, 5888, 1, 128, 448, 448, 128, 128]
    - [46, 7823.0]
  - - [5056, 2368, 1, 1280, 5056, 5056, 1280, 1280]
    - [27, 10203.0]
  - - [448, 3584, 1, 1280, 448, 448, 1280, 1280]
    - [40, 9207.0]
  - - [6784, 5888, 1, 256, 6784, 6784, 256, 256]
    - [60, 11946.0]
  - - [1024, 1408, 1, 256, 1024, 1024, 256, 256]
    - [28, 8254.0]
  - - [2368, 2368, 1, 3328, 2368, 2368, 3328, 3328]
    - [16, 10590.0]
  - - [1856, 6784, 1, 128, 1856, 1856, 128, 128]
    - [35, 9512.0]
  - - [5056, 704, 1, 3328, 5056, 5056, 3328, 3328]
    - [51, 9099.0]
  - - [1408, 1856, 1, 256, 1408, 1408, 256, 256]
    - [49, 8492.0]
  - - [2368, 5056, 1, 256, 2368, 2368, 256, 256]
    - [27, 10985.0]
  - - [3584, 2368, 1, 1280, 3584, 3584, 1280, 1280]
    - [38, 11345.0]
  - - [704, 5888, 1, 256, 704, 704, 256, 256]
    - [58, 9236.0]
  - - [6784, 2944, 1, 128, 6784, 6784, 128, 128]
    - [58, 9355.0]
  - - [2560, 1600, 1, 2560, 2560, 2560, 2560, 2560]
    - [58, 11058.0]
  - - [4288, 6784, 1, 3328, 4288, 4288, 3328, 3328]
    - [58, 11191.0]
  - - [2944, 6784, 1, 3328, 2944, 2944, 3328, 3328]
    - [16, 10964.0]
  - - [6144, 5984, 1, 2048, 6144, 6144, 2048, 2048]
    - [58, 9364.0]
  - - [3584, 704, 1, 3328, 3584, 3584, 3328, 3328]
    - [16, 9852.0]
  - - [2048, 1600, 1, 512, 2048, 2048, 512, 512]
    - [38, 9761.0]
  - - [448, 4288, 1, 256, 448, 448, 256, 256]
    - [38, 8307.0]
  - - [1856, 4288, 1, 128, 1856, 1856, 128, 128]
    - [27, 9842.0]
  - - [704, 2368, 1, 1280, 704, 704, 1280, 1280]
    - [60, 9421.0]
  - - [1856, 2368, 1, 1280, 1856, 1856, 1280, 1280]
    - [38, 10449.0]
  - - [1856, 4288, 1, 1280, 1856, 1856, 1280, 1280]
    - [18, 11088.0]
  - - [704, 2944, 1, 128, 704, 704, 128, 128]
    - [53, 8029.0]
  - - [1408, 1024, 1, 1280, 1408, 1408, 1280, 1280]
    - [58, 9666.0]
  - - [704, 6784, 1, 256, 704, 704, 256, 256]
    - [58, 9462.0]
  - - [6784, 704, 1, 256, 6784, 6784, 256, 256]
    - [16, 9794.0]
  - - [5056, 1408, 1, 128, 5056, 5056, 128, 128]
    - [34, 10051.0]
  - - [2048, 7000, 1, 2048, 2048, 2048, 2048, 2048]
    - [35, 8473.0]
  - - [3584, 4288, 1, 3328, 3584, 3584, 3328, 3328]
    - [38, 10297.0]
  - - [5888, 1856, 1, 1280, 5888, 5888, 1280, 1280]
    - [16, 10834.0]
  - - [2368, 3584, 1, 1280, 2368, 2368, 1280, 1280]
    - [7, 11239.0]
  - - [2368, 6784, 1, 1280, 2368, 2368, 1280, 1280]
    - [18, 10536.0]
  - - [2944, 3584, 1, 3328, 2944, 2944, 3328, 3328]
    - [16, 9743.0]
  - - [6784, 2944, 1, 256, 6784, 6784, 256, 256]
    - [16, 11699.0]
  - - [4288, 2368, 1, 3328, 4288, 4288, 3328, 3328]
    - [58, 9749.0]
  - - [1856, 2368, 1, 256, 1856, 1856, 256, 256]
    - [35, 8769.0]
  - - [3584, 6784, 1, 3328, 3584, 3584, 3328, 3328]
    - [38, 11008.0]
  - - [1024, 5888, 1, 3328, 1024, 1024, 3328, 3328]
    - [52, 8860.0]
  - - [6144, 24000, 1, 2560, 6144, 6144, 2560, 2560]
    - [49, 11207.0]
  - - [5056, 4288, 1, 1280, 5056, 5056, 1280, 1280]
    - [60, 11430.0]
  - - [6784, 1856, 1, 3328, 6784, 6784, 3328, 3328]
    - [47, 9651.0]
  - - [1408, 5056, 1, 1280, 1408, 1408, 1280, 1280]
    - [38, 11698.0]
  - - [2368, 2368, 1, 1280, 2368, 2368, 1280, 1280]
    - [58, 10772.0]
  - - [2944, 5888, 1, 128, 2944, 2944, 128, 128]
    - [23, 11178.0]
  - - [704, 5888, 1, 1280, 704, 704, 1280, 1280]
    - [18, 10598.0]
  - - [2368, 3584, 1, 128, 2368, 2368, 128, 128]
    - [23, 10204.0]
  - - [1856, 5056, 1, 128, 1856, 1856, 128, 128]
    - [12, 10068.0]
  - - [8192, 3200, 1, 2048, 8192, 8192, 2048, 2048]
    - [48, 9040.0]
  - - [1024, 5056, 1, 1280, 1024, 1024, 1280, 1280]
    - [40, 11019.0]
  - - [4288, 1024, 1, 256, 4288, 4288, 256, 256]
    - [27, 10277.0]
  - - [2944, 2368, 1, 128, 2944, 2944, 128, 128]
    - [54, 10065.0]
  - - [5888, 448, 1, 1280, 5888, 5888, 1280, 1280]
    - [60, 8999.0]
  - - [704, 5888, 1, 3328, 704, 704, 3328, 3328]
    - [21, 8241.0]
  - - [3584, 2944, 1, 256, 3584, 3584, 256, 256]
    - [58, 10727.0]
  - - [512, 24000, 1, 2048, 512, 512, 2048, 2048]
    - [15, 8397.0]
  - - [1408, 5056, 1, 3328, 1408, 1408, 3328, 3328]
    - [16, 8712.0]
  - - [1856, 1856, 1, 3328, 1856, 1856, 3328, 3328]
    - [16, 10303.0]
  - - [2560, 800, 1, 2560, 2560, 2560, 2560, 2560]
    - [38, 9976.0]
  - - [2368, 2368, 1, 256, 2368, 2368, 256, 256]
    - [27, 10109.0]
  - - [4288, 4288, 1, 1280, 4288, 4288, 1280, 1280]
    - [29, 11076.0]
  - - [5888, 1024, 1, 1280, 5888, 5888, 1280, 1280]
    - [49, 11395.0]
  - - [1408, 4288, 1, 256, 1408, 1408, 256, 256]
    - [48, 9223.0]
  - - [5888, 448, 1, 128, 5888, 5888, 128, 128]
    - [53, 8089.0]
  - - [512, 48000, 1, 2560, 512, 512, 2560, 2560]
    - [29, 10852.0]
  - - [704, 6784, 1, 3328, 704, 704, 3328, 3328]
    - [58, 7571.0]
  - - [2560, 6400, 1, 2560, 2560, 2560, 2560, 2560]
    - [58, 9684.0]
  - - [5056, 1024, 1, 1280, 5056, 5056, 1280, 1280]
    - [18, 11317.0]
  - - [448, 5888, 1, 3328, 448, 448, 3328, 3328]
    - [18, 9467.0]
  - - [1024, 2944, 1, 1280, 1024, 1024, 1280, 1280]
    - [16, 10620.0]
  - - [5056, 5888, 1, 1280, 5056, 5056, 1280, 1280]
    - [18, 10254.0]
  - - [4288, 5888, 1, 128, 4288, 4288, 128, 128]
    - [54, 11224.0]
  - - [1408, 3584, 1, 128, 1408, 1408, 128, 128]
    - [34, 10322.0]
  - - [448, 3584, 1, 128, 448, 448, 128, 128]
    - [28, 7862.0]
  - - [5888, 2944, 1, 1280, 5888, 5888, 1280, 1280]
    - [18, 9296.0]
  - - [2368, 5888, 1, 128, 2368, 2368, 128, 128]
    - [55, 9700.0]
  - - [3584, 5888, 1, 256, 3584, 3584, 256, 256]
    - [16, 11600.0]
  - - [2368, 1024, 1, 128, 2368, 2368, 128, 128]
    - [35, 8699.0]
  - - [2368, 704, 1, 128, 2368, 2368, 128, 128]
    - [53, 8114.0]
  - - [3584, 2944, 1, 1280, 3584, 3584, 1280, 1280]
    - [5, 11417.0]
  - - [3584, 2368, 1, 128, 3584, 3584, 128, 128]
    - [53, 8948.0]
  - - [5056, 704, 1, 128, 5056, 5056, 128, 128]
    - [55, 8507.0]
  - - [5056, 1408, 1, 3328, 5056, 5056, 3328, 3328]
    - [16, 9063.0]
  - - [6784, 1024, 1, 3328, 6784, 6784, 3328, 3328]
    - [58, 8653.0]
  - - [6784, 2944, 1, 3328, 6784, 6784, 3328, 3328]
    - [58, 10461.0]
  - - [2944, 5056, 1, 3328, 2944, 2944, 3328, 3328]
    - [18, 10068.0]
  - - [1856, 1856, 1, 256, 1856, 1856, 256, 256]
    - [35, 8465.0]
  - - [1024, 5888, 1, 128, 1024, 1024, 128, 128]
    - [16, 9686.0]
  - - [6784, 2368, 1, 1280, 6784, 6784, 1280, 1280]
    - [60, 11111.0]
  - - [4288, 5888, 1, 1280, 4288, 4288, 1280, 1280]
    - [17, 10658.0]
  - - [4288, 4288, 1, 256, 4288, 4288, 256, 256]
    - [27, 11251.0]
  - - [4288, 1856, 1, 1280, 4288, 4288, 1280, 1280]
    - [16, 11198.0]
  - - [1856, 2944, 1, 3328, 1856, 1856, 3328, 3328]
    - [58, 10371.0]
  - - [256, 6784, 1, 3328, 256, 256, 3328, 3328]
    - [60, 10403.0]
  - - [256, 5056, 1, 128, 256, 256, 128, 128]
    - [0, 6886.0]
  - - [5056, 1024, 1, 256, 5056, 5056, 256, 256]
    - [38, 10821.0]
  - - [5056, 1856, 1, 3328, 5056, 5056, 3328, 3328]
    - [16, 9321.0]
  - - [1856, 1408, 1, 256, 1856, 1856, 256, 256]
    - [35, 7989.0]
  - - [8448, 12000, 1, 2816, 8448, 8448, 2816, 2816]
    - [7, 11770.0]
  - - [4288, 1408, 1, 128, 4288, 4288, 128, 128]
    - [35, 8532.0]
  - - [1856, 5888, 1, 3328, 1856, 1856, 3328, 3328]
    - [16, 9603.0]
  - - [4288, 5056, 1, 256, 4288, 4288, 256, 256]
    - [16, 11390.0]
  - - [4096, 800, 1, 1024, 4096, 4096, 1024, 1024]
    - [16, 9264.0]
  - - [5056, 256, 1, 3328, 5056, 5056, 3328, 3328]
    - [40, 10629.0]
  - - [1024, 5888, 1, 1280, 1024, 1024, 1280, 1280]
    - [5, 11177.0]
  - - [6784, 2368, 1, 128, 6784, 6784, 128, 128]
    - [34, 9330.0]
  - - [1856, 1024, 1, 1280, 1856, 1856, 1280, 1280]
    - [14, 10762.0]
  - - [6784, 4288, 1, 1280, 6784, 6784, 1280, 1280]
    - [60, 10444.0]
  - - [1856, 1856, 1, 1280, 1856, 1856, 1280, 1280]
    - [16, 9897.0]
  - - [4096, 400, 1, 1024, 4096, 4096, 1024, 1024]
    - [38, 8004.0]
  - - [3072, 24000, 1, 1024, 3072, 3072, 1024, 1024]
    - [58, 11801.0]
  - - [5888, 1856, 1, 128, 5888, 5888, 128, 128]
    - [55, 9208.0]
  - - [5056, 3584, 1, 128, 5056, 5056, 128, 128]
    - [45, 11126.0]
  - - [5888, 5888, 1, 3328, 5888, 5888, 3328, 3328]
    - [18, 11461.0]
  - - [6784, 1024, 1, 256, 6784, 6784, 256, 256]
    - [13, 9853.0]
  - - [2944, 2368, 1, 256, 2944, 2944, 256, 256]
    - [35, 9651.0]
  - - [5056, 5888, 1, 3328, 5056, 5056, 3328, 3328]
    - [16, 11070.0]
  - - [1856, 1024, 1, 256, 1856, 1856, 256, 256]
    - [17, 8964.0]
  - - [512, 48000, 1, 1536, 512, 512, 1536, 1536]
    - [60, 11235.0]
  - - [3584, 448, 1, 1280, 3584, 3584, 1280, 1280]
    - [37, 8809.0]
  - - [8448, 5984, 1, 2816, 8448, 8448, 2816, 2816]
    - [40, 11253.0]
  - - [448, 5888, 1, 256, 448, 448, 256, 256]
    - [13, 7814.0]
  - - [1408, 6784, 1, 3328, 1408, 1408, 3328, 3328]
    - [17, 10591.0]
  - - [4288, 704, 1, 128, 4288, 4288, 128, 128]
    - [46, 6692.0]
  - - [5056, 2944, 1, 256, 5056, 5056, 256, 256]
    - [38, 11387.0]
  - - [6784, 5888, 1, 128, 6784, 6784, 128, 128]
    - [16, 11721.0]
  - - [2944, 704, 1, 128, 2944, 2944, 128, 128]
    - [53, 8525.0]
  - - [1408, 3584, 1, 3328, 1408, 1408, 3328, 3328]
    - [60, 10993.0]
  - - [2368, 6784, 1, 256, 2368, 2368, 256, 256]
    - [38, 11154.0]
  - - [5056, 1408, 1, 1280, 5056, 5056, 1280, 1280]
    - [16, 11689.0]
  - - [5056, 4288, 1, 128, 5056, 5056, 128, 128]
    - [27, 10898.0]
  - - [1408, 1856, 1, 128, 1408, 1408, 128, 128]
    - [46, 8973.0]
  - - [1408, 5888, 1, 3328, 1408, 1408, 3328, 3328]
    - [40, 9249.0]
  - - [6784, 6784, 1, 256, 6784, 6784, 256, 256]
    - [38, 11970.0]
  - - [4288, 2368, 1, 128, 4288, 4288, 128, 128]
    - [34, 10149.0]
  - - [2368, 2944, 1, 256, 2368, 2368, 256, 256]
    - [16, 10971.0]
  - - [3584, 1856, 1, 1280, 3584, 3584, 1280, 1280]
    - [16, 11365.0]
  - - [6784, 6784, 1, 128, 6784, 6784, 128, 128]
    - [23, 11769.0]
  - - [5888, 5056, 1, 256, 5888, 5888, 256, 256]
    - [58, 11702.0]
  - - [8448, 48000, 1, 2816, 8448, 8448, 2816, 2816]
    - [60, 12210.0]
  - - [3584, 448, 1, 256, 3584, 3584, 256, 256]
    - [57, 6545.0]
  - - [448, 4288, 1, 128, 448, 448, 128, 128]
    - [34, 7456.0]
  - - [256, 6784, 1, 256, 256, 256, 256, 256]
    - [16, 8643.0]
  - - [1408, 4288, 1, 128, 1408, 1408, 128, 128]
    - [34, 10008.0]
  - - [2944, 704, 1, 3328, 2944, 2944, 3328, 3328]
    - [16, 10433.0]
  - - [5056, 256, 1, 1280, 5056, 5056, 1280, 1280]
    - [36, 10831.0]
  - - [3584, 3584, 1, 256, 3584, 3584, 256, 256]
    - [58, 11457.0]
  - - [3584, 5056, 1, 256, 3584, 3584, 256, 256]
    - [38, 11504.0]
  - - [2944, 2368, 1, 1280, 2944, 2944, 1280, 1280]
    - [5, 11303.0]
  - - [1408, 3584, 1, 256, 1408, 1408, 256, 256]
    - [49, 10634.0]
  - - [6784, 3584, 1, 256, 6784, 6784, 256, 256]
    - [27, 11832.0]
  - - [5056, 2368, 1, 128, 5056, 5056, 128, 128]
    - [54, 10445.0]
  - - [2944, 2944, 1, 3328, 2944, 2944, 3328, 3328]
    - [25, 9896.0]
  - - [5056, 6784, 1, 256, 5056, 5056, 256, 256]
    - [38, 11715.0]
  - - [1856, 3584, 1, 128, 1856, 1856, 128, 128]
    - [35, 8552.0]
  - - [6784, 448, 1, 256, 6784, 6784, 256, 256]
    - [38, 8902.0]
  - - [3584, 6784, 1, 128, 3584, 3584, 128, 128]
    - [49, 11226.0]
  - - [5056, 1856, 1, 256, 5056, 5056, 256, 256]
    - [16, 10670.0]
  - - [4608, 5984, 1, 1536, 4608, 4608, 1536, 1536]
    - [38, 10169.0]
  - - [1760, 3200, 1, 1760, 1760, 1760, 1760, 1760]
    - [23, 11559.0]
  - - [1024, 1856, 1, 256, 1024, 1024, 256, 256]
    - [39, 8954.0]
  - - [4096, 1600, 1, 1024, 4096, 4096, 1024, 1024]
    - [16, 11118.0]
  - - [1408, 6784, 1, 1280, 1408, 1408, 1280, 1280]
    - [51, 11493.0]
  - - [3584, 3584, 1, 1280, 3584, 3584, 1280, 1280]
    - [14, 10889.0]
  - - [7680, 24000, 1, 2560, 7680, 7680, 2560, 2560]
    - [58, 12074.0]
  - - [4608, 48000, 1, 1536, 4608, 4608, 1536, 1536]
    - [40, 11958.0]
  - - [5888, 5888, 1, 128, 5888, 5888, 128, 128]
    - [16, 11644.0]
  - - [5056, 2368, 1, 3328, 5056, 5056, 3328, 3328]
    - [58, 11329.0]
  - - [2944, 4288, 1, 256, 2944, 2944, 256, 256]
    - [49, 11133.0]
  - - [1408, 3584, 1, 1280, 1408, 1408, 1280, 1280]
    - [7, 11309.0]
  - - [8192, 1600, 1, 2048, 8192, 8192, 2048, 2048]
    - [18, 9251.0]
  - - [512, 24000, 1, 2560, 512, 512, 2560, 2560]
    - [48, 8716.0]
  - - [2368, 6784, 1, 3328, 2368, 2368, 3328, 3328]
    - [27, 10324.0]
  - - [1856, 1408, 1, 1280, 1856, 1856, 1280, 1280]
    - [38, 10179.0]
  - - [6784, 704, 1, 128, 6784, 6784, 128, 128]
    - [46, 8974.0]
  - - [1408, 5888, 1, 256, 1408, 1408, 256, 256]
    - [38, 11065.0]
  - - [704, 2944, 1, 1280, 704, 704, 1280, 1280]
    - [58, 10072.0]
  - - [704, 6784, 1, 128, 704, 704, 128, 128]
    - [13, 9041.0]
  - - [3584, 704, 1, 1280, 3584, 3584, 1280, 1280]
    - [5, 9660.0]
  - - [5888, 2368, 1, 256, 5888, 5888, 256, 256]
    - [27, 11295.0]
  - - [2944, 6784, 1, 128, 2944, 2944, 128, 128]
    - [58, 11300.0]
  - - [3584, 448, 1, 3328, 3584, 3584, 3328, 3328]
    - [15, 9267.0]
  - - [704, 2368, 1, 3328, 704, 704, 3328, 3328]
    - [18, 9970.0]
  - - [256, 5888, 1, 128, 256, 256, 128, 128]
    - [28, 7467.0]
  - - [2048, 3200, 1, 512, 2048, 2048, 512, 512]
    - [16, 11050.0]
  - - [2944, 2944, 1, 1280, 2944, 2944, 1280, 1280]
    - [16, 11508.0]
  - - [5056, 448, 1, 3328, 5056, 5056, 3328, 3328]
    - [51, 9161.0]
  - - [6784, 704, 1, 3328, 6784, 6784, 3328, 3328]
    - [27, 10698.0]
  - - [5888, 4288, 1, 128, 5888, 5888, 128, 128]
    - [49, 11143.0]
  - - [1408, 2944, 1, 3328, 1408, 1408, 3328, 3328]
    - [58, 11151.0]
  - - [3584, 704, 1, 128, 3584, 3584, 128, 128]
    - [53, 8256.0]
  - - [4608, 12000, 1, 1536, 4608, 4608, 1536, 1536]
    - [40, 11306.0]
  - - [5056, 5056, 1, 128, 5056, 5056, 128, 128]
    - [58, 11020.0]
  - - [8192, 800, 1, 2048, 8192, 8192, 2048, 2048]
    - [50, 8830.0]
  - - [448, 5056, 1, 128, 448, 448, 128, 128]
    - [55, 6437.0]
  - - [5056, 3584, 1, 256, 5056, 5056, 256, 256]
    - [49, 11474.0]
  - - [1408, 5056, 1, 128, 1408, 1408, 128, 128]
    - [58, 10131.0]
  - - [2944, 3584, 1, 128, 2944, 2944, 128, 128]
    - [54, 11136.0]
  - - [3584, 2368, 1, 256, 3584, 3584, 256, 256]
    - [38, 11078.0]
  - - [8448, 24000, 1, 2816, 8448, 8448, 2816, 2816]
    - [18, 12083.0]
  - - [3584, 3584, 1, 3328, 3584, 3584, 3328, 3328]
    - [16, 10109.0]
  - - [5888, 6784, 1, 256, 5888, 5888, 256, 256]
    - [58, 11954.0]
  - - [4288, 2944, 1, 3328, 4288, 4288, 3328, 3328]
    - [38, 10227.0]
  - - [256, 5056, 1, 1280, 256, 256, 1280, 1280]
    - [14, 8892.0]
  - - [2944, 5888, 1, 3328, 2944, 2944, 3328, 3328]
    - [16, 10737.0]
  - - [6784, 5888, 1, 1280, 6784, 6784, 1280, 1280]
    - [16, 10810.0]
  - - [2048, 800, 1, 512, 2048, 2048, 512, 512]
    - [13, 7814.0]
  - - [5888, 4288, 1, 1280, 5888, 5888, 1280, 1280]
    - [18, 10063.0]
  - - [1024, 24000, 1, 2048, 1024, 1024, 2048, 2048]
    - [38, 9336.0]
  - - [5888, 3584, 1, 128, 5888, 5888, 128, 128]
    - [58, 11147.0]
  - - [1024, 2944, 1, 128, 1024, 1024, 128, 128]
    - [11, 8830.0]
  - - [704, 3584, 1, 128, 704, 704, 128, 128]
    - [12, 8715.0]
  - - [5888, 448, 1, 3328, 5888, 5888, 3328, 3328]
    - [25, 8444.0]
  - - [2368, 4288, 1, 1280, 2368, 2368, 1280, 1280]
    - [60, 11149.0]
  - - [4288, 2944, 1, 128, 4288, 4288, 128, 128]
    - [13, 9566.0]
  - - [1024, 6784, 1, 3328, 1024, 1024, 3328, 3328]
    - [16, 11522.0]
  - - [5056, 2944, 1, 3328, 5056, 5056, 3328, 3328]
    - [59, 10401.0]
  - - [2944, 3584, 1, 256, 2944, 2944, 256, 256]
    - [27, 10381.0]
  - - [1408, 1408, 1, 3328, 1408, 1408, 3328, 3328]
    - [16, 10119.0]
  - - [3584, 3584, 1, 128, 3584, 3584, 128, 128]
    - [49, 10382.0]
  - - [3584, 704, 1, 256, 3584, 3584, 256, 256]
    - [57, 8686.0]
  - - [3584, 1408, 1, 3328, 3584, 3584, 3328, 3328]
    - [49, 10341.0]
  - - [704, 3584, 1, 1280, 704, 704, 1280, 1280]
    - [38, 9824.0]
  - - [2944, 6784, 1, 1280, 2944, 2944, 1280, 1280]
    - [40, 11742.0]
  - - [1856, 6784, 1, 256, 1856, 1856, 256, 256]
    - [5, 10215.0]
  - - [4288, 448, 1, 3328, 4288, 4288, 3328, 3328]
    - [16, 9566.0]
  - - [6784, 4288, 1, 128, 6784, 6784, 128, 128]
    - [49, 11152.0]
  - - [6784, 704, 1, 1280, 6784, 6784, 1280, 1280]
    - [5, 10686.0]
  - - [3584, 6784, 1, 256, 3584, 3584, 256, 256]
    - [38, 11733.0]
  - - [6144, 12000, 1, 2048, 6144, 6144, 2048, 2048]
    - [38, 11767.0]
  - - [5888, 1024, 1, 3328, 5888, 5888, 3328, 3328]
    - [27, 8319.0]
  - - [704, 6784, 1, 1280, 704, 704, 1280, 1280]
    - [5, 10313.0]
  - - [1856, 5056, 1, 3328, 1856, 1856, 3328, 3328]
    - [58, 9414.0]
  - - [1024, 3584, 1, 128, 1024, 1024, 128, 128]
    - [11, 7981.0]
  - - [1024, 1408, 1, 128, 1024, 1024, 128, 128]
    - [28, 7364.0]
  - - [2368, 2944, 1, 128, 2368, 2368, 128, 128]
    - [46, 9981.0]
  - - [5056, 2944, 1, 128, 5056, 5056, 128, 128]
    - [54, 11151.0]
  - - [5888, 5056, 1, 3328, 5888, 5888, 3328, 3328]
    - [49, 11651.0]
  - - [5888, 2368, 1, 128, 5888, 5888, 128, 128]
    - [13, 9199.0]
  - - [3584, 6784, 1, 1280, 3584, 3584, 1280, 1280]
    - [6, 10314.0]
  - - [1856, 5888, 1, 256, 1856, 1856, 256, 256]
    - [27, 9945.0]
  - - [4288, 4288, 1, 3328, 4288, 4288, 3328, 3328]
    - [58, 10722.0]
  - - [4288, 1408, 1, 1280, 4288, 4288, 1280, 1280]
    - [16, 11139.0]
  - - [3584, 5056, 1, 128, 3584, 3584, 128, 128]
    - [58, 10798.0]
  - - [4288, 2368, 1, 256, 4288, 4288, 256, 256]
    - [58, 10875.0]
  - - [2944, 5056, 1, 1280, 2944, 2944, 1280, 1280]
    - [20, 9626.0]
  - - [448, 6784, 1, 256, 448, 448, 256, 256]
    - [55, 8195.0]
  - - [1856, 2368, 1, 128, 1856, 1856, 128, 128]
    - [54, 8981.0]
  - - [6784, 2368, 1, 3328, 6784, 6784, 3328, 3328]
    - [58, 10037.0]
  - - [4288, 1856, 1, 3328, 4288, 4288, 3328, 3328]
    - [27, 11107.0]
  - - [3584, 448, 1, 128, 3584, 3584, 128, 128]
    - [53, 6172.0]
  - - [2048, 1600, 1, 2048, 2048, 2048, 2048, 2048]
    - [16, 10665.0]
  - - [3584, 1024, 1, 1280, 3584, 3584, 1280, 1280]
    - [60, 10846.0]
  - - [1856, 5056, 1, 256, 1856, 1856, 256, 256]
    - [38, 10605.0]
  - - [1024, 4288, 1, 256, 1024, 1024, 256, 256]
    - [39, 9576.0]
  - - [5888, 3584, 1, 3328, 5888, 5888, 3328, 3328]
    - [58, 10745.0]
  - - [5056, 3584, 1, 3328, 5056, 5056, 3328, 3328]
    - [18, 11972.0]
  - - [2368, 1408, 1, 1280, 2368, 2368, 1280, 1280]
    - [38, 10271.0]
  - - [5056, 2944, 1, 1280, 5056, 5056, 1280, 1280]
    - [13, 8991.0]
  - - [1024, 6784, 1, 256, 1024, 1024, 256, 256]
    - [38, 9614.0]
  - - [5124, 9124, 1, 2048, 5124, 5124, 2048, 2048]
    - [58, 10652.0]
  - - [2944, 1408, 1, 128, 2944, 2944, 128, 128]
    - [55, 8727.0]
  - - [3584, 1408, 1, 1280, 3584, 3584, 1280, 1280]
    - [16, 11330.0]
  - - [5056, 6784, 1, 3328, 5056, 5056, 3328, 3328]
    - [16, 11280.0]
  - - [3584, 4288, 1, 256, 3584, 3584, 256, 256]
    - [38, 11303.0]
  - - [1856, 6784, 1, 3328, 1856, 1856, 3328, 3328]
    - [56, 10376.0]
  - - [5888, 4288, 1, 256, 5888, 5888, 256, 256]
    - [16, 11534.0]
  - - [5056, 1408, 1, 256, 5056, 5056, 256, 256]
    - [38, 10827.0]
  - - [3584, 1024, 1, 256, 3584, 3584, 256, 256]
    - [16, 10432.0]
  - - [5888, 5888, 1, 256, 5888, 5888, 256, 256]
    - [60, 11900.0]
  - - [4288, 1024, 1, 1280, 4288, 4288, 1280, 1280]
    - [18, 10821.0]
  - - [448, 6784, 1, 3328, 448, 448, 3328, 3328]
    - [48, 8219.0]
  - - [2944, 1408, 1, 1280, 2944, 2944, 1280, 1280]
    - [58, 11361.0]
  - - [2944, 1856, 1, 3328, 2944, 2944, 3328, 3328]
    - [16, 10590.0]
  - - [3584, 5888, 1, 1280, 3584, 3584, 1280, 1280]
    - [60, 11772.0]
  - - [6784, 1856, 1, 1280, 6784, 6784, 1280, 1280]
    - [28, 10130.0]
  - - [2944, 5056, 1, 256, 2944, 2944, 256, 256]
    - [58, 11355.0]
  - - [5888, 256, 1, 3328, 5888, 5888, 3328, 3328]
    - [49, 8434.0]
  - - [2944, 4288, 1, 128, 2944, 2944, 128, 128]
    - [55, 9463.0]
  - - [3584, 1408, 1, 256, 3584, 3584, 256, 256]
    - [38, 10539.0]
  - - [704, 3584, 1, 3328, 704, 704, 3328, 3328]
    - [16, 9993.0]
  - - [4096, 3200, 1, 1024, 4096, 4096, 1024, 1024]
    - [16, 11736.0]
  - - [5056, 448, 1, 1280, 5056, 5056, 1280, 1280]
    - [60, 9649.0]
  - - [3584, 1856, 1, 3328, 3584, 3584, 3328, 3328]
    - [27, 9595.0]
  - - [4288, 6784, 1, 1280, 4288, 4288, 1280, 1280]
    - [29, 11258.0]
  - - [2560, 7000, 1, 2560, 2560, 2560, 2560, 2560]
    - [50, 10020.0]
  - - [2944, 1024, 1, 256, 2944, 2944, 256, 256]
    - [35, 8754.0]
  - - [2368, 4288, 1, 3328, 2368, 2368, 3328, 3328]
    - [16, 9766.0]
  - - [1024, 1408, 1, 1280, 1024, 1024, 1280, 1280]
    - [16, 9003.0]
  - - [6784, 5056, 1, 256, 6784, 6784, 256, 256]
    - [16, 11759.0]
  - - [1856, 1856, 1, 128, 1856, 1856, 128, 128]
    - [33, 8940.0]
  - - [3584, 5056, 1, 3328, 3584, 3584, 3328, 3328]
    - [38, 10640.0]
  - - [448, 6784, 1, 128, 448, 448, 128, 128]
    - [22, 6691.0]
  - - [2944, 6784, 1, 256, 2944, 2944, 256, 256]
    - [16, 11703.0]
  - - [2944, 2944, 1, 128, 2944, 2944, 128, 128]
    - [58, 10637.0]
  - - [1856, 3584, 1, 1280, 1856, 1856, 1280, 1280]
    - [16, 11510.0]
  - - [4288, 448, 1, 128, 4288, 4288, 128, 128]
    - [53, 8009.0]
  - - [4608, 24000, 1, 1536, 4608, 4608, 1536, 1536]
    - [49, 11866.0]
  - - [1856, 1408, 1, 3328, 1856, 1856, 3328, 3328]
    - [38, 10221.0]
  - - [1024, 4288, 1, 3328, 1024, 1024, 3328, 3328]
    - [29, 10329.0]
  - - [5056, 448, 1, 256, 5056, 5056, 256, 256]
    - [58, 8392.0]
  - - [2944, 2368, 1, 3328, 2944, 2944, 3328, 3328]
    - [27, 9576.0]
  - - [704, 4288, 1, 3328, 704, 704, 3328, 3328]
    - [27, 9536.0]
  - - [1024, 1856, 1, 1280, 1024, 1024, 1280, 1280]
    - [16, 10408.0]
  - - [2048, 6400, 1, 2048, 2048, 2048, 2048, 2048]
    - [62, 7303.0]
  - - [512, 48000, 1, 2816, 512, 512, 2816, 2816]
    - [58, 10107.0]
  - - [5124, 9124, 1, 2560, 5124, 5124, 2560, 2560]
    - [60, 10791.0]
  - - [1024, 5888, 1, 256, 1024, 1024, 256, 256]
    - [13, 9480.0]
  - - [1408, 2368, 1, 256, 1408, 1408, 256, 256]
    - [15, 8832.0]
  - - [1408, 1408, 1, 256, 1408, 1408, 256, 256]
    - [35, 9037.0]
  - - [2368, 2368, 1, 128, 2368, 2368, 128, 128]
    - [54, 9580.0]
  - - [6784, 1408, 1, 128, 6784, 6784, 128, 128]
    - [49, 10701.0]
  - - [4288, 5888, 1, 256, 4288, 4288, 256, 256]
    - [58, 11512.0]
  - - [1408, 5056, 1, 256, 1408, 1408, 256, 256]
    - [38, 10980.0]
  - - [4288, 3584, 1, 128, 4288, 4288, 128, 128]
    - [54, 11097.0]
  - - [3584, 5056, 1, 1280, 3584, 3584, 1280, 1280]
    - [40, 9185.0]
  - - [1856, 1024, 1, 128, 1856, 1856, 128, 128]
    - [53, 6016.0]
  - - [1024, 24000, 1, 1536, 1024, 1024, 1536, 1536]
    - [16, 9128.0]
  - - [704, 4288, 1, 256, 704, 704, 256, 256]
    - [55, 8387.0]
  - - [5888, 2368, 1, 1280, 5888, 5888, 1280, 1280]
    - [27, 9012.0]
  - - [2368, 5888, 1, 1280, 2368, 2368, 1280, 1280]
    - [36, 10761.0]
  - - [5888, 256, 1, 1280, 5888, 5888, 1280, 1280]
    - [16, 10146.0]
  - - [2368, 1856, 1, 3328, 2368, 2368, 3328, 3328]
    - [27, 10603.0]
  - - [2944, 704, 1, 256, 2944, 2944, 256, 256]
    - [55, 8718.0]
  - - [2368, 1024, 1, 3328, 2368, 2368, 3328, 3328]
    - [7, 11039.0]
  - - [704, 3584, 1, 256, 704, 704, 256, 256]
    - [34, 8786.0]
  - - [704, 2944, 1, 3328, 704, 704, 3328, 3328]
    - [5, 10204.0]
  - - [6784, 1024, 1, 128, 6784, 6784, 128, 128]
    - [58, 10256.0]
  - - [2944, 1024, 1, 3328, 2944, 2944, 3328, 3328]
    - [7, 11060.0]
  - - [2944, 5056, 1, 128, 2944, 2944, 128, 128]
    - [54, 10745.0]
  - - [1408, 6784, 1, 256, 1408, 1408, 256, 256]
    - [38, 11364.0]
  - - [6784, 1408, 1, 3328, 6784, 6784, 3328, 3328]
    - [56, 9496.0]
  - - [4288, 6784, 1, 128, 4288, 4288, 128, 128]
    - [45, 11438.0]
  - - [6784, 2944, 1, 1280, 6784, 6784, 1280, 1280]
    - [16, 9617.0]
  - - [4288, 1856, 1, 128, 4288, 4288, 128, 128]
    - [13, 8837.0]
  - - [1856, 2944, 1, 128, 1856, 1856, 128, 128]
    - [2, 9485.0]
  - - [6784, 448, 1, 128, 6784, 6784, 128, 128]
    - [48, 8370.0]
  - - [448, 5056, 1, 1280, 448, 448, 1280, 1280]
    - [7, 9916.0]
  - - [2368, 1856, 1, 128, 2368, 2368, 128, 128]
    - [34, 9050.0]
  - - [4288, 704, 1, 256, 4288, 4288, 256, 256]
    - [16, 8895.0]
  - - [5888, 704, 1, 256, 5888, 5888, 256, 256]
    - [16, 9541.0]
  - - [3584, 1024, 1, 128, 3584, 3584, 128, 128]
    - [35, 9100.0]
  - - [256, 5888, 1, 3328, 256, 256, 3328, 3328]
    - [20, 8043.0]
  - - [1408, 4288, 1, 3328, 1408, 1408, 3328, 3328]
    - [62, 9756.0]
  - - [6784, 4288, 1, 256, 6784, 6784, 256, 256]
    - [16, 11694.0]
  - - [5888, 256, 1, 256, 5888, 5888, 256, 256]
    - [55, 7626.0]
  - - [6784, 1024, 1, 1280, 6784, 6784, 1280, 1280]
    - [18, 11749.0]
  - - [5888, 1024, 1, 128, 5888, 5888, 128, 128]
    - [58, 10041.0]
  - - [6784, 3584, 1, 1280, 6784, 6784, 1280, 1280]
    - [60, 10452.0]
  - - [1024, 6784, 1, 1280, 1024, 1024, 1280, 1280]
    - [27, 11398.0]
  - - [1408, 2944, 1, 1280, 1408, 1408, 1280, 1280]
    - [58, 11307.0]
  - - [2048, 800, 1, 2048, 2048, 2048, 2048, 2048]
    - [16, 8891.0]
  - - [1408, 2368, 1, 3328, 1408, 1408, 3328, 3328]
    - [16, 10849.0]
  - - [2944, 1856, 1, 128, 2944, 2944, 128, 128]
    - [54, 9557.0]
  - - [256, 6784, 1, 128, 256, 256, 128, 128]
    - [59, 8221.0]
  - - [5056, 6784, 1, 128, 5056, 5056, 128, 128]
    - [23, 11451.0]
  - - [4288, 5056, 1, 128, 4288, 4288, 128, 128]
    - [54, 11122.0]
  - - [1856, 5888, 1, 128, 1856, 1856, 128, 128]
    - [23, 10925.0]
  - - [2944, 5888, 1, 256, 2944, 2944, 256, 256]
    - [27, 11804.0]
  - - [3584, 1856, 1, 256, 3584, 3584, 256, 256]
    - [58, 10672.0]
  - - [4288, 3584, 1, 1280, 4288, 4288, 1280, 1280]
    - [40, 9380.0]
  - - [704, 5888, 1, 128, 704, 704, 128, 128]
    - [53, 7979.0]
  - - [6784, 3584, 1, 128, 6784, 6784, 128, 128]
    - [23, 11482.0]
  - - [4288, 5056, 1, 3328, 4288, 4288, 3328, 3328]
    - [18, 10775.0]
  - - [1408, 1408, 1, 128, 1408, 1408, 128, 128]
    - [53, 6807.0]
  - - [5056, 2368, 1, 256, 5056, 5056, 256, 256]
    - [38, 10903.0]
  - - [4288, 704, 1, 3328, 4288, 4288, 3328, 3328]
    - [38, 9695.0]
  - - [448, 3584, 1, 256, 448, 448, 256, 256]
    - [58, 7657.0]
  - - [2368, 1024, 1, 1280, 2368, 2368, 1280, 1280]
    - [60, 10643.0]
  - - [2944, 1408, 1, 3328, 2944, 2944, 3328, 3328]
    - [58, 11228.0]
  - - [1024, 1408, 1, 3328, 1024, 1024, 3328, 3328]
    - [58, 9941.0]
  - - [2944, 5888, 1, 1280, 2944, 2944, 1280, 1280]
    - [51, 11934.0]
  - - [5888, 3584, 1, 256, 5888, 5888, 256, 256]
    - [38, 11619.0]
  - - [2368, 5056, 1, 128, 2368, 2368, 128, 128]
    - [54, 10328.0]
  - - [1408, 1856, 1, 3328, 1408, 1408, 3328, 3328]
    - [38, 10306.0]
  - - [6784, 1408, 1, 1280, 6784, 6784, 1280, 1280]
    - [38, 11523.0]
  - - [4096, 7000, 1, 4096, 4096, 4096, 4096, 4096]
    - [16, 10300.0]
  - - [704, 2944, 1, 256, 704, 704, 256, 256]
    - [35, 8020.0]
  - - [6784, 5888, 1, 3328, 6784, 6784, 3328, 3328]
    - [58, 11323.0]
  - - [2368, 4288, 1, 128, 2368, 2368, 128, 128]
    - [45, 10286.0]
  - - [1024, 6784, 1, 128, 1024, 1024, 128, 128]
    - [5, 10139.0]
  - - [1408, 1408, 1, 1280, 1408, 1408, 1280, 1280]
    - [38, 9950.0]
  - - [16384, 400, 1, 4096, 16384, 16384, 4096, 4096]
    - [60, 5797.0]
  - - [448, 4288, 1, 3328, 448, 448, 3328, 3328]
    - [58, 9451.0]
  - - [2368, 1408, 1, 256, 2368, 2368, 256, 256]
    - [49, 9482.0]
  - - [5888, 5056, 1, 128, 5888, 5888, 128, 128]
    - [58, 11156.0]
  - - [704, 2368, 1, 256, 704, 704, 256, 256]
    - [13, 8322.0]
  - - [1024, 24000, 1, 2560, 1024, 1024, 2560, 2560]
    - [7, 11367.0]
  - - [5888, 2368, 1, 3328, 5888, 5888, 3328, 3328]
    - [17, 10271.0]
  - - [5124, 9124, 1, 1760, 5124, 5124, 1760, 1760]
    - [23, 11450.0]
  - - [4288, 448, 1, 1280, 4288, 4288, 1280, 1280]
    - [49, 8925.0]
  - - [5888, 704, 1, 3328, 5888, 5888, 3328, 3328]
    - [18, 10967.0]
  - - [5056, 256, 1, 128, 5056, 5056, 128, 128]
    - [55, 5896.0]
  - - [1408, 5888, 1, 128, 1408, 1408, 128, 128]
    - [34, 10574.0]
  - - [7680, 12000, 1, 2560, 7680, 7680, 2560, 2560]
    - [38, 11665.0]
  - - [1408, 1024, 1, 256, 1408, 1408, 256, 256]
    - [28, 6708.0]
  - - [8192, 400, 1, 2048, 8192, 8192, 2048, 2048]
    - [27, 8136.0]
  - - [1024, 1856, 1, 128, 1024, 1024, 128, 128]
    - [35, 7733.0]
  - - [5056, 6784, 1, 1280, 5056, 5056, 1280, 1280]
    - [27, 10243.0]
  - - [704, 5056, 1, 3328, 704, 704, 3328, 3328]
    - [16, 8908.0]
  - - [2368, 2944, 1, 3328, 2368, 2368, 3328, 3328]
    - [27, 9763.0]
  - - [2368, 3584, 1, 256, 2368, 2368, 256, 256]
    - [49, 9936.0]
  - - [5056, 3584, 1, 1280, 5056, 5056, 1280, 1280]
    - [49, 11545.0]
  - - [5124, 9124, 1, 4096, 5124, 5124, 4096, 4096]
    - [16, 10633.0]
  - - [7680, 48000, 1, 2560, 7680, 7680, 2560, 2560]
    - [58, 11947.0]
  - - [1856, 2944, 1, 1280, 1856, 1856, 1280, 1280]
    - [16, 10726.0]
  - - [1024, 48000, 1, 2816, 1024, 1024, 2816, 2816]
    - [18, 11470.0]
  - - [2944, 1408, 1, 256, 2944, 2944, 256, 256]
    - [35, 9366.0]
  - - [4288, 1408, 1, 3328, 4288, 4288, 3328, 3328]
    - [16, 9498.0]
  - - [5888, 2944, 1, 128, 5888, 5888, 128, 128]
    - [54, 9860.0]
  - - [2944, 1024, 1, 128, 2944, 2944, 128, 128]
    - [45, 9024.0]
  - - [4288, 5056, 1, 1280, 4288, 4288, 1280, 1280]
    - [51, 10805.0]
  - - [5888, 6784, 1, 1280, 5888, 5888, 1280, 1280]
    - [18, 10676.0]
  - - [6784, 5056, 1, 128, 6784, 6784, 128, 128]
    - [58, 11448.0]
  - - [1760, 1600, 1, 1760, 1760, 1760, 1760, 1760]
    - [1, 10509.0]
  - - [5888, 1408, 1, 3328, 5888, 5888, 3328, 3328]
    - [40, 10720.0]
  - - [2368, 1856, 1, 256, 2368, 2368, 256, 256]
    - [13, 8848.0]
  - - [256, 5056, 1, 256, 256, 256, 256, 256]
    - [55, 8406.0]
  - - [448, 3584, 1, 3328, 448, 448, 3328, 3328]
    - [18, 9714.0]
  - - [704, 2368, 1, 128, 704, 704, 128, 128]
    - [46, 7389.0]
  - - [5888, 256, 1, 128, 5888, 5888, 128, 128]
    - [50, 7761.0]
  - - [3584, 1856, 1, 128, 3584, 3584, 128, 128]
    - [38, 9580.0]
  - - [4288, 4288, 1, 128, 4288, 4288, 128, 128]
    - [34, 9915.0]
  - - [1856, 1024, 1, 3328, 1856, 1856, 3328, 3328]
    - [18, 11081.0]
  - - [1024, 5056, 1, 256, 1024, 1024, 256, 256]
    - [38, 10363.0]
  - - [5888, 5888, 1, 1280, 5888, 5888, 1280, 1280]
    - [18, 11123.0]
  - - [5056, 5888, 1, 128, 5056, 5056, 128, 128]
    - [49, 11080.0]
  - - [2368, 1408, 1, 3328, 2368, 2368, 3328, 3328]
    - [38, 10753.0]
  - - [1024, 48000, 1, 1536, 1024, 1024, 1536, 1536]
    - [16, 10543.0]
  - - [5888, 448, 1, 256, 5888, 5888, 256, 256]
    - [55, 7350.0]
  - - [2560, 3200, 1, 2560, 2560, 2560, 2560, 2560]
    - [60, 10161.0]
  - - [5888, 6784, 1, 128, 5888, 5888, 128, 128]
    - [38, 11736.0]
  - - [6144, 48000, 1, 2048, 6144, 6144, 2048, 2048]
    - [18, 11807.0]
  - - [6784, 5056, 1, 1280, 6784, 6784, 1280, 1280]
    - [60, 10646.0]
  - - [5056, 704, 1, 1280, 5056, 5056, 1280, 1280]
    - [18, 10147.0]
  - - [1024, 48000, 1, 2560, 1024, 1024, 2560, 2560]
    - [16, 11189.0]
  - - [1024, 2368, 1, 128, 1024, 1024, 128, 128]
    - [53, 7099.0]
  - - [16384, 800, 1, 4096, 16384, 16384, 4096, 4096]
    - [59, 8976.0]
  - - [5888, 5056, 1, 1280, 5888, 5888, 1280, 1280]
    - [18, 10439.0]
  - - [3072, 48000, 1, 1024, 3072, 3072, 1024, 1024]
    - [16, 11354.0]
  - - [6784, 1408, 1, 256, 6784, 6784, 256, 256]
    - [38, 10337.0]
  - - [3584, 5888, 1, 128, 3584, 3584, 128, 128]
    - [38, 6229.0]
  - - [5056, 5888, 1, 256, 5056, 5056, 256, 256]
    - [38, 11625.0]
  - - [2368, 1024, 1, 256, 2368, 2368, 256, 256]
    - [12, 9360.0]
  - - [2944, 1856, 1, 256, 2944, 2944, 256, 256]
    - [16, 10517.0]
  - - [1856, 6784, 1, 1280, 1856, 1856, 1280, 1280]
    - [16, 8443.0]
  - - [4288, 3584, 1, 256, 4288, 4288, 256, 256]
    - [27, 11345.0]
  - - [6784, 448, 1, 3328, 6784, 6784, 3328, 3328]
    - [54, 7800.0]
  - - [5056, 1856, 1, 1280, 5056, 5056, 1280, 1280]
    - [16, 11143.0]
  - - [1408, 1024, 1, 3328, 1408, 1408, 3328, 3328]
    - [49, 9907.0]
  - - [5888, 3584, 1, 1280, 5888, 5888, 1280, 1280]
    - [60, 10114.0]
  - - [1856, 3584, 1, 3328, 1856, 1856, 3328, 3328]
    - [60, 9253.0]
  - - [1024, 2944, 1, 256, 1024, 1024, 256, 256]
    - [13, 8409.0]
  - - [448, 6784, 1, 1280, 448, 448, 1280, 1280]
    - [38, 9804.0]
  - - [704, 5056, 1, 256, 704, 704, 256, 256]
    - [34, 9346.0]
  - - [3584, 1024, 1, 3328, 3584, 3584, 3328, 3328]
    - [27, 11006.0]
  - - [2944, 1856, 1, 1280, 2944, 2944, 1280, 1280]
    - [38, 10704.0]
  - - [5056, 256, 1, 256, 5056, 5056, 256, 256]
    - [35, 8761.0]
  - - [2944, 4288, 1, 3328, 2944, 2944, 3328, 3328]
    - [60, 10150.0]
  - - [2368, 3584, 1, 3328, 2368, 2368, 3328, 3328]
    - [50, 10133.0]
  - - [2944, 704, 1, 1280, 2944, 2944, 1280, 1280]
    - [58, 9511.0]
  - - [2944, 3584, 1, 1280, 2944, 2944, 1280, 1280]
    - [40, 11345.0]
  - - [1856, 5888, 1, 1280, 1856, 1856, 1280, 1280]
    - [60, 10921.0]
  - - [2048, 3200, 1, 2048, 2048, 2048, 2048, 2048]
    - [16, 11011.0]
  - - [4288, 1408, 1, 256, 4288, 4288, 256, 256]
    - [13, 9644.0]
  - - [5888, 1408, 1, 128, 5888, 5888, 128, 128]
    - [49, 10453.0]
  - - [4288, 2368, 1, 1280, 4288, 4288, 1280, 1280]
    - [58, 11138.0]
  - - [6784, 2368, 1, 256, 6784, 6784, 256, 256]
    - [16, 11201.0]
  - - [1024, 24000, 1, 2816, 1024, 1024, 2816, 2816]
    - [60, 12052.0]
  - - [7680, 5984, 1, 2560, 7680, 7680, 2560, 2560]
    - [38, 11130.0]
  - - [4288, 1856, 1, 256, 4288, 4288, 256, 256]
    - [13, 9594.0]
  - - [1856, 2944, 1, 256, 1856, 1856, 256, 256]
    - [49, 10132.0]
  - - [5056, 1024, 1, 128, 5056, 5056, 128, 128]
    - [35, 9841.0]
  - - [1760, 800, 1, 1760, 1760, 1760, 1760, 1760]
    - [1, 9949.0]
  - - [6784, 256, 1, 128, 6784, 6784, 128, 128]
    - [28, 7861.0]
  - - [5888, 704, 1, 128, 5888, 5888, 128, 128]
    - [54, 9132.0]
  - - [1408, 2368, 1, 128, 1408, 1408, 128, 128]
    - [23, 9123.0]
  - - [1024, 4288, 1, 1280, 1024, 1024, 1280, 1280]
    - [18, 11129.0]
  - - [2368, 5056, 1, 3328, 2368, 2368, 3328, 3328]
    - [18, 9785.0]
  - - [4288, 1024, 1, 3328, 4288, 4288, 3328, 3328]
    - [40, 10238.0]
  - - [6144, 48000, 1, 2560, 6144, 6144, 2560, 2560]
    - [29, 12256.0]
  - - [1024, 5056, 1, 3328, 1024, 1024, 3328, 3328]
    - [16, 8432.0]
  - - [1024, 1856, 1, 3328, 1024, 1024, 3328, 3328]
    - [58, 10780.0]
  - - [4288, 6784, 1, 256, 4288, 4288, 256, 256]
    - [16, 11651.0]
  - - [3584, 2944, 1, 3328, 3584, 3584, 3328, 3328]
    - [51, 11080.0]
  - - [5888, 2944, 1, 256, 5888, 5888, 256, 256]
    - [38, 11609.0]
  - - [448, 4288, 1, 1280, 448, 448, 1280, 1280]
    - [5, 9464.0]
  - - [1024, 4288, 1, 128, 1024, 1024, 128, 128]
    - [17, 9024.0]
  - - [5056, 4288, 1, 256, 5056, 5056, 256, 256]
    - [16, 11418.0]
  - - [1024, 3584, 1, 256, 1024, 1024, 256, 256]
    - [16, 10179.0]
  - - [6784, 6784, 1, 3328, 6784, 6784, 3328, 3328]
    - [58, 11493.0]
  - - [448, 5888, 1, 1280, 448, 448, 1280, 1280]
    - [7, 9065.0]
  - - [5056, 448, 1, 128, 5056, 5056, 128, 128]
    - [53, 8036.0]
  - - [4288, 704, 1, 1280, 4288, 4288, 1280, 1280]
    - [58, 9790.0]
  - - [3584, 2944, 1, 128, 3584, 3584, 128, 128]
    - [16, 10387.0]
  - - [6784, 256, 1, 1280, 6784, 6784, 1280, 1280]
    - [38, 9927.0]
  - - [2368, 5888, 1, 3328, 2368, 2368, 3328, 3328]
    - [18, 10251.0]
  - - [2368, 1856, 1, 1280, 2368, 2368, 1280, 1280]
    - [58, 10529.0]
  - - [448, 5056, 1, 3328, 448, 448, 3328, 3328]
    - [16, 9047.0]
  - - [3584, 4288, 1, 128, 3584, 3584, 128, 128]
    - [38, 10399.0]
  - - [5888, 4288, 1, 3328, 5888, 5888, 3328, 3328]
    - [18, 10913.0]
  - - [2368, 704, 1, 256, 2368, 2368, 256, 256]
    - [13, 6935.0]
  - - [3584, 1408, 1, 128, 3584, 3584, 128, 128]
    - [5, 9772.0]
  - - [1856, 5056, 1, 1280, 1856, 1856, 1280, 1280]
    - [38, 11379.0]
  - - [2944, 1024, 1, 1280, 2944, 2944, 1280, 1280]
    - [51, 10815.0]
  - - [3584, 5888, 1, 3328, 3584, 3584, 3328, 3328]
    - [58, 11035.0]
  - - [2368, 4288, 1, 256, 2368, 2368, 256, 256]
    - [49, 10756.0]
  - - [1024, 2368, 1, 3328, 1024, 1024, 3328, 3328]
    - [60, 10908.0]
  - - [1024, 3584, 1, 1280, 1024, 1024, 1280, 1280]
    - [18, 10575.0]
  - - [4288, 5888, 1, 3328, 4288, 4288, 3328, 3328]
    - [58, 11058.0]
  - - [1024, 2944, 1, 3328, 1024, 1024, 3328, 3328]
    - [51, 10860.0]
  - - [6784, 1856, 1, 256, 6784, 6784, 256, 256]
    - [49, 10560.0]
  - - [256, 6784, 1, 1280, 256, 256, 1280, 1280]
    - [5, 10021.0]
  - - [1856, 3584, 1, 256, 1856, 1856, 256, 256]
    - [49, 10153.0]
  - - [6784, 1856, 1, 128, 6784, 6784, 128, 128]
    - [49, 10588.0]
  - - [512, 24000, 1, 2816, 512, 512, 2816, 2816]
    - [16, 8690.0]
  - - [256, 5888, 1, 1280, 256, 256, 1280, 1280]
    - [38, 9365.0]
  - - [16384, 1600, 1, 4096, 16384, 16384, 4096, 4096]
    - [40, 10327.0]
  - - [2368, 1408, 1, 128, 2368, 2368, 128, 128]
    - [33, 7348.0]
  - - [1408, 1024, 1, 128, 1408, 1408, 128, 128]
    - [46, 7658.0]
  - - [6784, 3584, 1, 3328, 6784, 6784, 3328, 3328]
    - [38, 10742.0]
  - - [1760, 7000, 1, 1760, 1760, 1760, 1760, 1760]
    - [25, 11472.0]
  - - [2368, 5056, 1, 1280, 2368, 2368, 1280, 1280]
    - [29, 10522.0]
  - - [1408, 2368, 1, 1280, 1408, 1408, 1280, 1280]
    - [16, 10725.0]
  - - [704, 4288, 1, 128, 704, 704, 128, 128]
    - [24, 8173.0]
  - - [2944, 2944, 1, 256, 2944, 2944, 256, 256]
    - [27, 11405.0]
  - - [6784, 256, 1, 256, 6784, 6784, 256, 256]
    - [58, 8731.0]
  - - [256, 5056, 1, 3328, 256, 256, 3328, 3328]
    - [5, 10110.0]
  - - [5056, 1856, 1, 128, 5056, 5056, 128, 128]
    - [23, 9745.0]
  - - [5056, 1024, 1, 3328, 5056, 5056, 3328, 3328]
    - [42, 9670.0]
  - - [4288, 3584, 1, 3328, 4288, 4288, 3328, 3328]
    - [16, 10493.0]
  - - [1024, 2368, 1, 1280, 1024, 1024, 1280, 1280]
    - [38, 9800.0]
  - - [5888, 6784, 1, 3328, 5888, 5888, 3328, 3328]
    - [38, 11778.0]
  - - [704, 4288, 1, 1280, 704, 704, 1280, 1280]
    - [38, 9337.0]
  - - [1024, 48000, 1, 2048, 1024, 1024, 2048, 2048]
    - [38, 10643.0]
  - - [4288, 1024, 1, 128, 4288, 4288, 128, 128]
    - [35, 9494.0]
  - - [4096, 512, 1, 32, 4096, 4096, 32, 32]
    - [46, 3875.0]
  - - [2048, 1024, 1, 1664, 2048, 2048, 1664, 1664]
    - [5, 10524.0]
  - - [4096, 512, 1, 1408, 4096, 4096, 1408, 1408]
    - [49, 10466.0]
  - - [4096, 1024, 1, 1280, 4096, 4096, 1280, 1280]
    - [38, 11526.0]
  - - [2048, 1024, 1, 640, 2048, 2048, 640, 640]
    - [38, 10093.0]
  - - [4096, 1024, 1, 13312, 4096, 4096, 13312, 13312]
    - [42, 8808.0]
  - - [2048, 1024, 1, 13312, 2048, 2048, 13312, 13312]
    - [41, 7076.0]
  - - [2048, 1024, 1, 3584, 2048, 2048, 3584, 3584]
    - [16, 10412.0]
  - - [4096, 1024, 1, 1920, 4096, 4096, 1920, 1920]
    - [38, 11332.0]
  - - [4096, 1024, 1, 12288, 4096, 4096, 12288, 12288]
    - [17, 7157.0]
  - - [4096, 1024, 1, 8320, 4096, 4096, 8320, 8320]
    - [58, 9514.0]
  - - [4096, 1024, 1, 15360, 4096, 4096, 15360, 15360]
    - [18, 7399.0]
  - - [4096, 512, 1, 3072, 4096, 4096, 3072, 3072]
    - [16, 10344.0]
  - - [4096, 512, 1, 13312, 4096, 4096, 13312, 13312]
    - [17, 5527.0]
  - - [4096, 1024, 1, 3840, 4096, 4096, 3840, 3840]
    - [38, 8012.0]
  - - [2048, 1024, 1, 3200, 2048, 2048, 3200, 3200]
    - [27, 10649.0]
  - - [4096, 512, 1, 3840, 4096, 4096, 3840, 3840]
    - [27, 10474.0]
  - - [4096, 512, 1, 5632, 4096, 4096, 5632, 5632]
    - [16, 6436.0]
  - - [4096, 512, 1, 64, 4096, 4096, 64, 64]
    - [55, 5483.0]
  - - [2048, 1024, 1, 512, 2048, 2048, 512, 512]
    - [38, 9538.0]
  - - [4096, 512, 1, 8192, 4096, 4096, 8192, 8192]
    - [17, 4620.0]
  - - [4096, 512, 1, 2304, 4096, 4096, 2304, 2304]
    - [58, 10191.0]
  - - [4096, 512, 1, 2816, 4096, 4096, 2816, 2816]
    - [16, 10329.0]
  - - [2048, 1024, 1, 7680, 2048, 2048, 7680, 7680]
    - [58, 8043.0]
  - - [4096, 512, 1, 1920, 4096, 4096, 1920, 1920]
    - [34, 10206.0]
  - - [4096, 1024, 1, 32, 4096, 4096, 32, 32]
    - [11, 5815.0]
  - - [4096, 512, 1, 16640, 4096, 4096, 16640, 16640]
    - [58, 8039.0]
  - - [2048, 1024, 1, 1024, 2048, 2048, 1024, 1024]
    - [16, 9511.0]
  - - [4096, 512, 1, 1792, 4096, 4096, 1792, 1792]
    - [58, 10410.0]
  - - [4096, 1024, 1, 8192, 4096, 4096, 8192, 8192]
    - [16, 5794.0]
  - - [2048, 1024, 1, 4160, 2048, 2048, 4160, 4160]
    - [23, 10822.0]
  - - [4096, 512, 1, 10240, 4096, 4096, 10240, 10240]
    - [61, 5869.0]
  - - [4096, 512, 1, 512, 4096, 4096, 512, 512]
    - [13, 8772.0]
  - - [2048, 1024, 1, 6656, 2048, 2048, 6656, 6656]
    - [31, 8551.0]
  - - [2048, 1024, 1, 14336, 2048, 2048, 14336, 14336]
    - [20, 5778.0]
  - - [4096, 512, 1, 11264, 4096, 4096, 11264, 11264]
    - [7, 6557.0]
  - - [4096, 512, 1, 128, 4096, 4096, 128, 128]
    - [33, 6862.0]
  - - [4096, 512, 1, 768, 4096, 4096, 768, 768]
    - [38, 10141.0]
  - - [4096, 1024, 1, 11264, 4096, 4096, 11264, 11264]
    - [17, 6884.0]
  - - [4096, 1024, 1, 16640, 4096, 4096, 16640, 16640]
    - [49, 11269.0]
  - - [2048, 1024, 1, 5632, 2048, 2048, 5632, 5632]
    - [16, 10341.0]
  - - [4096, 512, 1, 12288, 4096, 4096, 12288, 12288]
    - [17, 5137.0]
  - - [4096, 1024, 1, 5632, 4096, 4096, 5632, 5632]
    - [16, 7699.0]
  - - [2048, 1024, 1, 10240, 2048, 2048, 10240, 10240]
    - [58, 9344.0]
  - - [4096, 1024, 1, 640, 4096, 4096, 640, 640]
    - [34, 10662.0]
  - - [2048, 1024, 1, 12288, 2048, 2048, 12288, 12288]
    - [16, 5737.0]
  - - [4096, 1024, 1, 10240, 4096, 4096, 10240, 10240]
    - [17, 6746.0]
  - - [2048, 1024, 1, 4608, 2048, 2048, 4608, 4608]
    - [16, 10465.0]
  - - [4096, 512, 1, 3584, 4096, 4096, 3584, 3584]
    - [16, 10437.0]
  - - [4096, 1024, 1, 4608, 4096, 4096, 4608, 4608]
    - [16, 7756.0]
  - - [4096, 1024, 1, 3328, 4096, 4096, 3328, 3328]
    - [38, 11029.0]
  - - [2048, 1024, 1, 9216, 2048, 2048, 9216, 9216]
    - [15, 5912.0]
  - - [2048, 1024, 1, 2304, 2048, 2048, 2304, 2304]
    - [38, 10172.0]
  - - [4096, 512, 1, 6144, 4096, 4096, 6144, 6144]
    - [16, 5388.0]
  - - [4096, 512, 1, 15360, 4096, 4096, 15360, 15360]
    - [17, 5872.0]
  - - [4096, 1024, 1, 7168, 4096, 4096, 7168, 7168]
    - [17, 6773.0]
  - - [4096, 1024, 1, 9216, 4096, 4096, 9216, 9216]
    - [42, 8168.0]
  - - [4096, 1024, 1, 7680, 4096, 4096, 7680, 7680]
    - [18, 6708.0]
  - - [2048, 1024, 1, 8192, 2048, 2048, 8192, 8192]
    - [41, 5269.0]
  - - [4096, 1024, 1, 64, 4096, 4096, 64, 64]
    - [33, 6704.0]
  - - [2048, 1024, 1, 1280, 2048, 2048, 1280, 1280]
    - [16, 10280.0]
  - - [2048, 1024, 1, 3328, 2048, 2048, 3328, 3328]
    - [16, 10616.0]
  - - [4096, 512, 1, 14336, 4096, 4096, 14336, 14336]
    - [17, 5660.0]
  - - [4096, 512, 1, 8320, 4096, 4096, 8320, 8320]
    - [27, 9775.0]
  - - [4096, 1024, 1, 6656, 4096, 4096, 6656, 6656]
    - [50, 7075.0]
  - - [2048, 1024, 1, 256, 2048, 2048, 256, 256]
    - [35, 8117.0]
  - - [4096, 512, 1, 1024, 4096, 4096, 1024, 1024]
    - [58, 9933.0]
  - - [4096, 1024, 1, 1536, 4096, 4096, 1536, 1536]
    - [16, 11493.0]
  - - [2048, 1024, 1, 32, 2048, 2048, 32, 32]
    - [59, 3521.0]
  - - [4096, 512, 1, 640, 4096, 4096, 640, 640]
    - [54, 10049.0]
  - - [4096, 512, 1, 16384, 4096, 4096, 16384, 16384]
    - [18, 5675.0]
  - - [4096, 1024, 1, 512, 4096, 4096, 512, 512]
    - [16, 9914.0]
  - - [2048, 1024, 1, 1152, 2048, 2048, 1152, 1152]
    - [27, 10293.0]
  - - [4096, 1024, 1, 2080, 4096, 4096, 2080, 2080]
    - [23, 11927.0]
  - - [4096, 1024, 1, 768, 4096, 4096, 768, 768]
    - [58, 10953.0]
  - - [4096, 1024, 1, 2560, 4096, 4096, 2560, 2560]
    - [16, 11529.0]
  - - [2048, 1024, 1, 64, 2048, 2048, 64, 64]
    - [33, 6848.0]
  - - [4096, 1024, 1, 16384, 4096, 4096, 16384, 16384]
    - [18, 7192.0]
  - - [4096, 512, 1, 6656, 4096, 4096, 6656, 6656]
    - [16, 9562.0]
  - - [2048, 1024, 1, 128, 2048, 2048, 128, 128]
    - [53, 6799.0]
  - - [2048, 1024, 1, 2080, 2048, 2048, 2080, 2080]
    - [12, 10877.0]
  - - [2048, 1024, 1, 16640, 2048, 2048, 16640, 16640]
    - [28, 8876.0]
  - - [2048, 1024, 1, 3072, 2048, 2048, 3072, 3072]
    - [16, 10376.0]
  - - [4096, 1024, 1, 1408, 4096, 4096, 1408, 1408]
    - [5, 11450.0]
  - - [4096, 1024, 1, 2048, 4096, 4096, 2048, 2048]
    - [16, 11303.0]
  - - [2048, 1024, 1, 2560, 2048, 2048, 2560, 2560]
    - [16, 10176.0]
  - - [4096, 1024, 1, 128, 4096, 4096, 128, 128]
    - [17, 9180.0]
  - - [4096, 1024, 1, 14336, 4096, 4096, 14336, 14336]
    - [18, 7358.0]
  - - [4096, 512, 1, 9216, 4096, 4096, 9216, 9216]
    - [17, 5072.0]
  - - [2048, 1024, 1, 2048, 2048, 2048, 2048, 2048]
    - [16, 10010.0]
  - - [4096, 512, 1, 1536, 4096, 4096, 1536, 1536]
    - [58, 9867.0]
  - - [2048, 1024, 1, 16384, 2048, 2048, 16384, 16384]
    - [20, 5872.0]
  - - [4096, 1024, 1, 1024, 4096, 4096, 1024, 1024]
    - [16, 10765.0]
  - - [4096, 1024, 1, 1664, 4096, 4096, 1664, 1664]
    - [38, 11505.0]
  - - [4096, 512, 1, 384, 4096, 4096, 384, 384]
    - [38, 9677.0]
  - - [4096, 512, 1, 3328, 4096, 4096, 3328, 3328]
    - [16, 10409.0]
  - - [4096, 1024, 1, 256, 4096, 4096, 256, 256]
    - [27, 10201.0]
  - - [2048, 1024, 1, 7168, 2048, 2048, 7168, 7168]
    - [38, 7012.0]
  - - [2048, 1024, 1, 1536, 2048, 2048, 1536, 1536]
    - [16, 9874.0]
  - - [4096, 512, 1, 7168, 4096, 4096, 7168, 7168]
    - [39, 8332.0]
  - - [4096, 1024, 1, 896, 4096, 4096, 896, 896]
    - [34, 11487.0]
  - - [4096, 1024, 1, 4096, 4096, 4096, 4096, 4096]
    - [39, 8085.0]
  - - [2048, 1024, 1, 6144, 2048, 2048, 6144, 6144]
    - [42, 8648.0]
  - - [4096, 512, 1, 4160, 4096, 4096, 4160, 4160]
    - [38, 10116.0]
  - - [4096, 512, 1, 2080, 4096, 4096, 2080, 2080]
    - [23, 10855.0]
  - - [4096, 1024, 1, 5120, 4096, 4096, 5120, 5120]
    - [15, 7271.0]
  - - [2048, 1024, 1, 1920, 2048, 2048, 1920, 1920]
    - [27, 10098.0]
  - - [2048, 1024, 1, 15360, 2048, 2048, 15360, 15360]
    - [38, 8845.0]
  - - [4096, 1024, 1, 2816, 4096, 4096, 2816, 2816]
    - [16, 11404.0]
  - - [4096, 512, 1, 256, 4096, 4096, 256, 256]
    - [16, 9097.0]
  - - [2048, 1024, 1, 5120, 2048, 2048, 5120, 5120]
    - [16, 10538.0]
  - - [2048, 1024, 1, 4096, 2048, 2048, 4096, 4096]
    - [16, 9399.0]
  - - [4096, 512, 1, 4608, 4096, 4096, 4608, 4608]
    - [42, 7871.0]
  - - [4096, 512, 1, 1664, 4096, 4096, 1664, 1664]
    - [54, 10373.0]
  - - [2048, 1024, 1, 896, 2048, 2048, 896, 896]
    - [38, 10185.0]
  - - [4096, 1024, 1, 4160, 4096, 4096, 4160, 4160]
    - [38, 11642.0]
  - - [2048, 1024, 1, 11264, 2048, 2048, 11264, 11264]
    - [8, 6333.0]
  - - [2048, 1024, 1, 384, 2048, 2048, 384, 384]
    - [53, 8631.0]
  - - [2048, 1024, 1, 3840, 2048, 2048, 3840, 3840]
    - [16, 10607.0]
  - - [4096, 512, 1, 1280, 4096, 4096, 1280, 1280]
    - [58, 10341.0]
  - - [4096, 1024, 1, 1152, 4096, 4096, 1152, 1152]
    - [27, 11497.0]
  - - [2048, 1024, 1, 1408, 2048, 2048, 1408, 1408]
    - [38, 10356.0]
  - - [4096, 512, 1, 896, 4096, 4096, 896, 896]
    - [54, 10197.0]
  - - [4096, 1024, 1, 3072, 4096, 4096, 3072, 3072]
    - [16, 11070.0]
  - - [2048, 1024, 1, 2816, 2048, 2048, 2816, 2816]
    - [16, 10262.0]
  - - [4096, 1024, 1, 1792, 4096, 4096, 1792, 1792]
    - [58, 11396.0]
  - - [4096, 512, 1, 1152, 4096, 4096, 1152, 1152]
    - [34, 10091.0]
  - - [4096, 512, 1, 7680, 4096, 4096, 7680, 7680]
    - [52, 6396.0]
  - - [4096, 1024, 1, 384, 4096, 4096, 384, 384]
    - [34, 10004.0]
  - - [2048, 1024, 1, 1792, 2048, 2048, 1792, 1792]
    - [38, 10409.0]
  - - [4096, 1024, 1, 3584, 4096, 4096, 3584, 3584]
    - [16, 9500.0]
  - - [2048, 1024, 1, 768, 2048, 2048, 768, 768]
    - [58, 9861.0]
  - - [2048, 1024, 1, 8320, 2048, 2048, 8320, 8320]
    - [16, 10681.0]
  - - [4096, 512, 1, 2048, 4096, 4096, 2048, 2048]
    - [16, 9947.0]
  - - [4096, 512, 1, 2560, 4096, 4096, 2560, 2560]
    - [58, 10300.0]
  - - [4096, 1024, 1, 2304, 4096, 4096, 2304, 2304]
    - [16, 11553.0]
  - - [4096, 512, 1, 5120, 4096, 4096, 5120, 5120]
    - [17, 6024.0]
  - - [4096, 1024, 1, 6144, 4096, 4096, 6144, 6144]
    - [16, 6752.0]
  - - [1024, 3392, 1, 4096, 1024, 1024, 4096, 4096]
    - [59, 9315.0]
  - - [1024, 3301, 1, 4096, 1024, 1024, 4096, 4096]
    - [62, 8439.0]
  - - [1024, 3443, 1, 4096, 1024, 1024, 4096, 4096]
    - [62, 8651.0]
  - - [132, 134, 480, 64, 132, 132, 64, 64]
    - [44, 3813.0]
  - - [162, 162, 400, 64, 162, 162, 64, 64]
    - [0, 5403.0]
  - - [4096, 3548, 1, 1024, 4096, 4096, 1024, 1024]
    - [16, 10935.0]
  - - [4096, 2977, 1, 1024, 4096, 4096, 1024, 1024]
    - [16, 10941.0]
  - - [132, 135, 480, 64, 132, 132, 64, 64]
    - [44, 3654.0]
  - - [1024, 2985, 1, 4096, 1024, 1024, 4096, 4096]
    - [60, 9222.0]
  - - [33708, 3681, 1, 1024, 33708, 33708, 1024, 1024]
    - [58, 10533.0]
  - - [4096, 3443, 1, 1024, 4096, 4096, 1024, 1024]
    - [18, 10447.0]
  - - [1024, 3400, 1, 4096, 1024, 1024, 4096, 4096]
    - [42, 8566.0]
  - - [4096, 3995, 1, 1024, 4096, 4096, 1024, 1024]
    - [51, 9497.0]
  - - [4096, 3190, 1, 1024, 4096, 4096, 1024, 1024]
    - [16, 11199.0]
  - - [4096, 3594, 1, 1024, 4096, 4096, 1024, 1024]
    - [16, 10259.0]
  - - [159, 162, 400, 64, 159, 159, 64, 64]
    - [53, 5062.0]
  - - [1024, 3565, 1, 4096, 1024, 1024, 4096, 4096]
    - [42, 8155.0]
  - - [4096, 3422, 1, 1024, 4096, 4096, 1024, 1024]
    - [16, 10886.0]
  - - [1024, 3214, 1, 4096, 1024, 1024, 4096, 4096]
    - [38, 8320.0]
  - - [33708, 3584, 1, 1024, 33708, 33708, 1024, 1024]
    - [60, 10825.0]
  - - [33708, 3640, 1, 1024, 33708, 33708, 1024, 1024]
    - [58, 10544.0]
  - - [4096, 3263, 1, 1024, 4096, 4096, 1024, 1024]
    - [16, 10960.0]
  - - [4096, 3296, 1, 1024, 4096, 4096, 1024, 1024]
    - [18, 11100.0]
  - - [1024, 3557, 1, 4096, 1024, 1024, 4096, 4096]
    - [42, 8307.0]
  - - [4096, 3463, 1, 1024, 4096, 4096, 1024, 1024]
    - [16, 10563.0]
  - - [4096, 3528, 1, 1024, 4096, 4096, 1024, 1024]
    - [16, 10707.0]
  - - [4096, 3226, 1, 1024, 4096, 4096, 1024, 1024]
    - [16, 10949.0]
  - - [4096, 3439, 1, 1024, 4096, 4096, 1024, 1024]
    - [16, 10878.0]
  - - [1024, 3523, 1, 4096, 1024, 1024, 4096, 4096]
    - [62, 8460.0]
  - - [1024, 3098, 1, 4096, 1024, 1024, 4096, 4096]
    - [42, 8741.0]
  - - [4096, 3121, 1, 1024, 4096, 4096, 1024, 1024]
    - [16, 10978.0]
  - - [33708, 3894, 1, 1024, 33708, 33708, 1024, 1024]
    - [58, 10660.0]
  - - [1024, 3548, 1, 4096, 1024, 1024, 4096, 4096]
    - [62, 8450.0]
  - - [1024, 3451, 1, 4096, 1024, 1024, 4096, 4096]
    - [59, 8527.0]
  - - [4096, 3353, 1, 1024, 4096, 4096, 1024, 1024]
    - [16, 10715.0]
  - - [4096, 3402, 1, 1024, 4096, 4096, 1024, 1024]
    - [16, 10748.0]
  - - [4096, 3939, 1, 1024, 4096, 4096, 1024, 1024]
    - [21, 8927.0]
  - - [133, 133, 480, 64, 133, 133, 64, 64]
    - [53, 3351.0]
  - - [1024, 3559, 1, 4096, 1024, 1024, 4096, 4096]
    - [58, 8238.0]
  - - [1024, 2977, 1, 4096, 1024, 1024, 4096, 4096]
    - [40, 9787.0]
  - - [1024, 3478, 1, 4096, 1024, 1024, 4096, 4096]
    - [42, 8210.0]
  - - [134, 134, 480, 64, 134, 134, 64, 64]
    - [44, 3503.0]
  - - [1024, 3368, 1, 4096, 1024, 1024, 4096, 4096]
    - [62, 8432.0]
  - - [4096, 4012, 1, 1024, 4096, 4096, 1024, 1024]
    - [16, 8620.0]
  - - [4096, 3486, 1, 1024, 4096, 4096, 1024, 1024]
    - [18, 10667.0]
  - - [1024, 3479, 1, 4096, 1024, 1024, 4096, 4096]
    - [62, 8409.0]
  - - [1024, 3505, 1, 4096, 1024, 1024, 4096, 4096]
    - [62, 8336.0]
  - - [4096, 3381, 1, 1024, 4096, 4096, 1024, 1024]
    - [16, 10802.0]
  - - [4096, 3430, 1, 1024, 4096, 4096, 1024, 1024]
    - [16, 10938.0]
  - - [1024, 3554, 1, 4096, 1024, 1024, 4096, 4096]
    - [62, 8429.0]
  - - [4096, 3271, 1, 1024, 4096, 4096, 1024, 1024]
    - [16, 11020.0]
  - - [1024, 3063, 1, 4096, 1024, 1024, 4096, 4096]
    - [62, 8994.0]
  - - [1024, 3209, 1, 4096, 1024, 1024, 4096, 4096]
    - [31, 7923.0]
  - - [4096, 3503, 1, 1024, 4096, 4096, 1024, 1024]
    - [18, 10827.0]
  - - [4096, 3344, 1, 1024, 4096, 4096, 1024, 1024]
    - [16, 10693.0]
  - - [1024, 3147, 1, 4096, 1024, 1024, 4096, 4096]
    - [42, 8620.0]
  - - [1024, 3322, 1, 4096, 1024, 1024, 4096, 4096]
    - [62, 8316.0]
  - - [1024, 3341, 1, 4096, 1024, 1024, 4096, 4096]
    - [60, 9159.0]
  - - [1024, 3516, 1, 4096, 1024, 1024, 4096, 4096]
    - [62, 8323.0]
  - - [1024, 3454, 1, 4096, 1024, 1024, 4096, 4096]
    - [62, 8765.0]
  - - [4096, 3969, 1, 1024, 4096, 4096, 1024, 1024]
    - [16, 8958.0]
  - - [4096, 3466, 1, 1024, 4096, 4096, 1024, 1024]
    - [16, 10439.0]
  - - [1024, 3999, 1, 1024, 1024, 1024, 1024, 1024]
    - [38, 10418.0]
  - - [1024, 4032, 1, 1024, 1024, 1024, 1024, 1024]
    - [38, 10418.0]
  - - [1024, 3403, 1, 4096, 1024, 1024, 4096, 4096]
    - [62, 8566.0]
  - - [4096, 3361, 1, 1024, 4096, 4096, 1024, 1024]
    - [16, 10207.0]
  - - [1024, 3527, 1, 4096, 1024, 1024, 4096, 4096]
    - [62, 8361.0]
  - - [1024, 3822, 1, 4096, 1024, 1024, 4096, 4096]
    - [62, 8177.0]
  - - [4096, 3315, 1, 1024, 4096, 4096, 1024, 1024]
    - [18, 11086.0]
  - - [232, 232, 272, 64, 232, 232, 64, 64]
    - [48, 6102.0]
  - - [1024, 3336, 1, 4096, 1024, 1024, 4096, 4096]
    - [62, 8488.0]
  - - [228, 232, 272, 64, 228, 228, 64, 64]
    - [57, 5893.0]
  - - [4096, 3547, 1, 1024, 4096, 4096, 1024, 1024]
    - [16, 10621.0]
  - - [4096, 3340, 1, 1024, 4096, 4096, 1024, 1024]
    - [18, 10396.0]
  - - [1024, 3906, 1, 1024, 1024, 1024, 1024, 1024]
    - [38, 10182.0]
  - - [1024, 3295, 1, 4096, 1024, 1024, 4096, 4096]
    - [62, 8371.0]
  - - [4096, 3294, 1, 1024, 4096, 4096, 1024, 1024]
    - [16, 11131.0]
  - - [33708, 3968, 1, 1024, 33708, 33708, 1024, 1024]
    - [60, 10797.0]
  - - [1024, 3473, 1, 4096, 1024, 1024, 4096, 4096]
    - [62, 8170.0]
  - - [1024, 3072, 1, 4096, 1024, 1024, 4096, 4096]
    - [38, 9108.0]
  - - [4096, 3189, 1, 1024, 4096, 4096, 1024, 1024]
    - [18, 11313.0]
  - - [4096, 3494, 1, 1024, 4096, 4096, 1024, 1024]
    - [16, 10717.0]
  - - [1024, 3522, 1, 4096, 1024, 1024, 4096, 4096]
    - [62, 8262.0]
  - - [33708, 3944, 1, 1024, 33708, 33708, 1024, 1024]
    - [60, 10684.0]
  - - [135, 135, 480, 64, 135, 135, 64, 64]
    - [22, 3915.0]
  - - [4096, 3421, 1, 1024, 4096, 4096, 1024, 1024]
    - [16, 10937.0]
  - - [4096, 3311, 1, 1024, 4096, 4096, 1024, 1024]
    - [18, 11024.0]
  - - [1024, 3990, 1, 1024, 1024, 1024, 1024, 1024]
    - [38, 10354.0]
  - - [1024, 3290, 1, 4096, 1024, 1024, 4096, 4096]
    - [62, 8553.0]
  - - [4096, 3565, 1, 1024, 4096, 4096, 1024, 1024]
    - [18, 10646.0]
  - - [1024, 3484, 1, 4096, 1024, 1024, 4096, 4096]
    - [62, 8297.0]
  - - [4096, 3384, 1, 1024, 4096, 4096, 1024, 1024]
    - [16, 10791.0]
  - - [1024, 3422, 1, 4096, 1024, 1024, 4096, 4096]
    - [62, 8534.0]
  - - [4096, 3681, 1, 1024, 4096, 4096, 1024, 1024]
    - [16, 10156.0]
  - - [1024, 3584, 1, 1024, 1024, 1024, 1024, 1024]
    - [18, 10360.0]
  - - [4096, 4050, 1, 1024, 4096, 4096, 1024, 1024]
    - [58, 10167.0]
  - - [1024, 3996, 1, 4096, 1024, 1024, 4096, 4096]
    - [42, 7713.0]
  - - [4096, 3169, 1, 1024, 4096, 4096, 1024, 1024]
    - [16, 11167.0]
  - - [4096, 3538, 1, 1024, 4096, 4096, 1024, 1024]
    - [16, 10458.0]
  - - [1024, 3495, 1, 4096, 1024, 1024, 4096, 4096]
    - [58, 8292.0]
  - - [4096, 3401, 1, 1024, 4096, 4096, 1024, 1024]
    - [16, 10849.0]
  - - [1024, 3560, 1, 4096, 1024, 1024, 4096, 4096]
    - [62, 8334.0]
  - - [133, 135, 480, 64, 133, 133, 64, 64]
    - [44, 3414.0]
  - - [1024, 3263, 1, 4096, 1024, 1024, 4096, 4096]
    - [62, 8363.0]
  - - [1024, 3870, 1, 4096, 1024, 1024, 4096, 4096]
    - [63, 8031.0]
  - - [4096, 3555, 1, 1024, 4096, 4096, 1024, 1024]
    - [16, 10649.0]
  - - [4096, 3412, 1, 1024, 4096, 4096, 1024, 1024]
    - [16, 10879.0]
  - - [1024, 3296, 1, 4096, 1024, 1024, 4096, 4096]
    - [62, 8256.0]
  - - [1024, 3379, 1, 4096, 1024, 1024, 4096, 4096]
    - [20, 9404.0]
  - - [4096, 3302, 1, 1024, 4096, 4096, 1024, 1024]
    - [18, 11083.0]
  - - [1024, 3490, 1, 4096, 1024, 1024, 4096, 4096]
    - [58, 8183.0]
  - - [1024, 3428, 1, 4096, 1024, 1024, 4096, 4096]
    - [62, 8622.0]
  - - [1024, 3976, 1, 4096, 1024, 1024, 4096, 4096]
    - [42, 7611.0]
  - - [4096, 3485, 1, 1024, 4096, 4096, 1024, 1024]
    - [18, 10720.0]
  - - [4096, 3534, 1, 1024, 4096, 4096, 1024, 1024]
    - [16, 10614.0]
  - - [1024, 3064, 1, 4096, 1024, 1024, 4096, 4096]
    - [62, 8918.0]
  - - [4096, 3216, 1, 1024, 4096, 4096, 1024, 1024]
    - [18, 10854.0]
  - - [1024, 3450, 1, 4096, 1024, 1024, 4096, 4096]
    - [62, 8805.0]
  - - [1024, 3533, 1, 4096, 1024, 1024, 4096, 4096]
    - [17, 8781.0]
  - - [1024, 4030, 1, 1024, 1024, 1024, 1024, 1024]
    - [38, 10471.0]
  - - [1024, 3311, 1, 4096, 1024, 1024, 4096, 4096]
    - [62, 8475.0]
  - - [1024, 3468, 1, 4096, 1024, 1024, 4096, 4096]
    - [62, 7990.0]
  - - [4096, 3359, 1, 1024, 4096, 4096, 1024, 1024]
    - [18, 10414.0]
  - - [4096, 3392, 1, 1024, 4096, 4096, 1024, 1024]
    - [16, 10667.0]
  - - [1024, 3925, 1, 1024, 1024, 1024, 1024, 1024]
    - [38, 10268.0]
  - - [4096, 3233, 1, 1024, 4096, 4096, 1024, 1024]
    - [16, 10866.0]
  - - [4096, 3956, 1, 1024, 4096, 4096, 1024, 1024]
    - [16, 8954.0]
  - - [1024, 3463, 1, 4096, 1024, 1024, 4096, 4096]
    - [62, 8181.0]
  - - [1024, 3126, 1, 4096, 1024, 1024, 4096, 4096]
    - [43, 8867.0]
  - - [1024, 3363, 1, 4096, 1024, 1024, 4096, 4096]
    - [62, 8322.0]
  - - [4096, 3465, 1, 1024, 4096, 4096, 1024, 1024]
    - [16, 10675.0]
  - - [33708, 3996, 1, 1024, 33708, 33708, 1024, 1024]
    - [60, 10785.0]
  - - [1024, 3231, 1, 4096, 1024, 1024, 4096, 4096]
    - [42, 8135.0]
  - - [33708, 3978, 1, 1024, 33708, 33708, 1024, 1024]
    - [60, 10670.0]
  - - [4096, 3476, 1, 1024, 4096, 4096, 1024, 1024]
    - [17, 10471.0]
  - - [4096, 3339, 1, 1024, 4096, 4096, 1024, 1024]
    - [16, 10723.0]
  - - [4096, 3452, 1, 1024, 4096, 4096, 1024, 1024]
    - [16, 10867.0]
  - - [1024, 3396, 1, 4096, 1024, 1024, 4096, 4096]
    - [42, 8431.0]
  - - [4096, 3293, 1, 1024, 4096, 4096, 1024, 1024]
    - [16, 11110.0]
  - - [1024, 3432, 1, 4096, 1024, 1024, 4096, 4096]
    - [62, 8382.0]
  - - [4096, 3493, 1, 1024, 4096, 4096, 1024, 1024]
    - [16, 10774.0]
  - - [4096, 3350, 1, 1024, 4096, 4096, 1024, 1024]
    - [16, 10661.0]
  - - [1024, 3079, 1, 4096, 1024, 1024, 4096, 4096]
    - [62, 8715.0]
  - - [1024, 3101, 1, 4096, 1024, 1024, 4096, 4096]
    - [62, 8607.0]
  - - [33708, 3939, 1, 1024, 33708, 33708, 1024, 1024]
    - [60, 10700.0]
  - - [4096, 3256, 1, 1024, 4096, 4096, 1024, 1024]
    - [16, 10955.0]
  - - [1024, 3439, 1, 4096, 1024, 1024, 4096, 4096]
    - [62, 8526.0]
  - - [1024, 3510, 1, 4096, 1024, 1024, 4096, 4096]
    - [62, 8364.0]
  - - [4096, 3900, 1, 1024, 4096, 4096, 1024, 1024]
    - [12, 9887.0]
  - - [1024, 3470, 1, 4096, 1024, 1024, 4096, 4096]
    - [63, 8194.0]
  - - [4096, 3456, 1, 1024, 4096, 4096, 1024, 1024]
    - [16, 11010.0]
  - - [4096, 3014, 1, 1024, 4096, 4096, 1024, 1024]
    - [16, 11419.0]
  - - [4096, 3367, 1, 1024, 4096, 4096, 1024, 1024]
    - [16, 10753.0]
  - - [4096, 3432, 1, 1024, 4096, 4096, 1024, 1024]
    - [29, 10063.0]
  - - [33708, 4026, 1, 1024, 33708, 33708, 1024, 1024]
    - [60, 10893.0]
  - - [4096, 3273, 1, 1024, 4096, 4096, 1024, 1024]
    - [18, 11045.0]
  - - [4096, 3130, 1, 1024, 4096, 4096, 1024, 1024]
    - [16, 10909.0]
  - - [1024, 3496, 1, 4096, 1024, 1024, 4096, 4096]
    - [62, 8296.0]
  - - [1024, 3995, 1, 4096, 1024, 1024, 4096, 4096]
    - [60, 8729.0]
  - - [1024, 3939, 1, 4096, 1024, 1024, 4096, 4096]
    - [62, 8025.0]
  - - [1024, 3121, 1, 4096, 1024, 1024, 4096, 4096]
    - [42, 8655.0]
  - - [1024, 3232, 1, 4096, 1024, 1024, 4096, 4096]
    - [18, 9153.0]
  - - [4096, 3147, 1, 1024, 4096, 4096, 1024, 1024]
    - [16, 11019.0]
  - - [4096, 3516, 1, 1024, 4096, 4096, 1024, 1024]
    - [16, 10766.0]
  - - [1024, 3969, 1, 1024, 1024, 1024, 1024, 1024]
    - [58, 10458.0]
  - - [1024, 3364, 1, 4096, 1024, 1024, 4096, 4096]
    - [62, 8586.0]
  - - [4096, 3411, 1, 1024, 4096, 4096, 1024, 1024]
    - [16, 10820.0]
  - - [147, 147, 432, 64, 147, 147, 64, 64]
    - [53, 4577.0]
  - - [4096, 3301, 1, 1024, 4096, 4096, 1024, 1024]
    - [16, 11005.0]
  - - [1024, 3513, 1, 4096, 1024, 1024, 4096, 4096]
    - [62, 8417.0]
  - - [1024, 3469, 1, 4096, 1024, 1024, 4096, 4096]
    - [62, 8379.0]
  - - [1024, 3095, 1, 4096, 1024, 1024, 4096, 4096]
    - [62, 8684.0]
  - - [4096, 3533, 1, 1024, 4096, 4096, 1024, 1024]
    - [18, 10578.0]
  - - [4096, 3390, 1, 1024, 4096, 4096, 1024, 1024]
    - [16, 10882.0]
  - - [4096, 3582, 1, 1024, 4096, 4096, 1024, 1024]
    - [18, 10451.0]
  - - [1024, 3956, 1, 1024, 1024, 1024, 1024, 1024]
    - [58, 10392.0]
  - - [4096, 3585, 1, 1024, 4096, 4096, 1024, 1024]
    - [17, 10300.0]
  - - [4096, 3231, 1, 1024, 4096, 4096, 1024, 1024]
    - [16, 10961.0]
  - - [1024, 3205, 1, 4096, 1024, 1024, 4096, 4096]
    - [62, 8331.0]
  - - [4096, 3496, 1, 1024, 4096, 4096, 1024, 1024]
    - [29, 10781.0]
  - - [1024, 3143, 1, 4096, 1024, 1024, 4096, 4096]
    - [62, 8630.0]
  - - [1024, 3318, 1, 4096, 1024, 1024, 4096, 4096]
    - [62, 8543.0]
  - - [1024, 3353, 1, 4096, 1024, 1024, 4096, 4096]
    - [62, 8500.0]
  - - [1024, 3464, 1, 4096, 1024, 1024, 4096, 4096]
    - [62, 8434.0]
  - - [4096, 2736, 1, 1024, 4096, 4096, 1024, 1024]
    - [18, 11049.0]
  - - [1024, 3402, 1, 4096, 1024, 1024, 4096, 4096]
    - [62, 8514.0]
  - - [4096, 3138, 1, 1024, 4096, 4096, 1024, 1024]
    - [16, 11104.0]
  - - [1024, 3860, 1, 4096, 1024, 1024, 4096, 4096]
    - [49, 8166.0]
  - - [148, 148, 432, 64, 148, 148, 64, 64]
    - [22, 3958.0]
  - - [1024, 3539, 1, 4096, 1024, 1024, 4096, 4096]
    - [62, 8431.0]
  - - [4096, 3211, 1, 1024, 4096, 4096, 1024, 1024]
    - [18, 10885.0]
  - - [1024, 3332, 1, 4096, 1024, 1024, 4096, 4096]
    - [62, 8338.0]
  - - [1024, 3466, 1, 4096, 1024, 1024, 4096, 4096]
    - [17, 8448.0]
  - - [4096, 3475, 1, 1024, 4096, 4096, 1024, 1024]
    - [16, 10418.0]
  - - [4096, 3524, 1, 1024, 4096, 4096, 1024, 1024]
    - [18, 10772.0]
  - - [4096, 2985, 1, 1024, 4096, 4096, 1024, 1024]
    - [16, 11015.0]
  - - [4096, 3222, 1, 1024, 4096, 4096, 1024, 1024]
    - [18, 10939.0]
  - - [4096, 3451, 1, 1024, 4096, 4096, 1024, 1024]
    - [16, 10991.0]
  - - [1024, 3181, 1, 4096, 1024, 1024, 4096, 4096]
    - [62, 8471.0]
  - - [1024, 3640, 1, 4096, 1024, 1024, 4096, 4096]
    - [62, 8361.0]
  - - [1024, 3375, 1, 4096, 1024, 1024, 4096, 4096]
    - [43, 8667.0]
  - - [1024, 3550, 1, 4096, 1024, 1024, 4096, 4096]
    - [62, 8541.0]
  - - [1024, 4020, 1, 1024, 1024, 1024, 1024, 1024]
    - [38, 10433.0]
  - - [4096, 3349, 1, 1024, 4096, 4096, 1024, 1024]
    - [16, 10645.0]
  - - [4096, 3398, 1, 1024, 4096, 4096, 1024, 1024]
    - [16, 10790.0]
  - - [33708, 3976, 1, 1024, 33708, 33708, 1024, 1024]
    - [40, 10604.0]
  - - [1024, 2917, 1, 4096, 1024, 1024, 4096, 4096]
    - [40, 9719.0]
  - - [33708, 3910, 1, 1024, 33708, 33708, 1024, 1024]
    - [60, 10613.0]
  - - [4096, 3860, 1, 1024, 4096, 4096, 1024, 1024]
    - [50, 9687.0]
  - - [4096, 3304, 1, 1024, 4096, 4096, 1024, 1024]
    - [18, 11029.0]
  - - [1024, 3286, 1, 4096, 1024, 1024, 4096, 4096]
    - [62, 8473.0]
  - - [1024, 3460, 1, 4096, 1024, 1024, 4096, 4096]
    - [62, 8260.0]
  - - [1024, 4026, 1, 4096, 1024, 1024, 4096, 4096]
    - [21, 7936.0]
  - - [4096, 3471, 1, 1024, 4096, 4096, 1024, 1024]
    - [16, 10517.0]
  - - [193, 193, 320, 64, 193, 193, 64, 64]
    - [50, 3769.0]
  - - [1024, 3894, 1, 1024, 1024, 1024, 1024, 1024]
    - [16, 10405.0]
  - - [1024, 3506, 1, 4096, 1024, 1024, 4096, 4096]
    - [42, 8313.0]
  - - [1024, 4000, 1, 1024, 1024, 1024, 1024, 1024]
    - [38, 10349.0]
  - - [1024, 3900, 1, 4096, 1024, 1024, 4096, 4096]
    - [42, 7904.0]
  - - [1024, 3445, 1, 4096, 1024, 1024, 4096, 4096]
    - [62, 8775.0]
  - - [4096, 3442, 1, 1024, 4096, 4096, 1024, 1024]
    - [49, 9909.0]
  - - [1024, 3358, 1, 4096, 1024, 1024, 4096, 4096]
    - [21, 8667.0]
  - - [1024, 3211, 1, 4096, 1024, 1024, 4096, 4096]
    - [62, 8181.0]
  - - [4096, 3515, 1, 1024, 4096, 4096, 1024, 1024]
    - [18, 10737.0]
  - - [1024, 3564, 1, 4096, 1024, 1024, 4096, 4096]
    - [58, 8780.0]
  - - [4096, 3057, 1, 1024, 4096, 4096, 1024, 1024]
    - [16, 11283.0]
  - - [1024, 3343, 1, 4096, 1024, 1024, 4096, 4096]
    - [62, 8561.0]
  - - [4096, 3262, 1, 1024, 4096, 4096, 1024, 1024]
    - [18, 11078.0]
  - - [1024, 3518, 1, 4096, 1024, 1024, 4096, 4096]
    - [62, 8346.0]
  - - [33708, 3876, 1, 1024, 33708, 33708, 1024, 1024]
    - [51, 11175.0]
  - - [4096, 3462, 1, 1024, 4096, 4096, 1024, 1024]
    - [16, 10589.0]
  - - [1024, 3265, 1, 4096, 1024, 1024, 4096, 4096]
    - [62, 8361.0]
  - - [4096, 3389, 1, 1024, 4096, 4096, 1024, 1024]
    - [16, 10856.0]
  - - [4096, 3438, 1, 1024, 4096, 4096, 1024, 1024]
    - [16, 10801.0]
  - - [1024, 3955, 1, 1024, 1024, 1024, 1024, 1024]
    - [38, 10405.0]
  - - [1024, 3545, 1, 4096, 1024, 1024, 4096, 4096]
    - [62, 8288.0]
  - - [1024, 3144, 1, 4096, 1024, 1024, 4096, 4096]
    - [62, 8696.0]
  - - [1024, 3417, 1, 4096, 1024, 1024, 4096, 4096]
    - [62, 8593.0]
  - - [4096, 3543, 1, 1024, 4096, 4096, 1024, 1024]
    - [16, 10621.0]
  - - [4096, 3352, 1, 1024, 4096, 4096, 1024, 1024]
    - [16, 11383.0]
  - - [33708, 3975, 1, 1024, 33708, 33708, 1024, 1024]
    - [60, 10880.0]
  - - [148, 147, 432, 64, 148, 148, 64, 64]
    - [22, 4586.0]
  - - [4096, 3137, 1, 1024, 4096, 4096, 1024, 1024]
    - [16, 11191.0]
  - - [4096, 3506, 1, 1024, 4096, 4096, 1024, 1024]
    - [18, 10562.0]
  - - [1024, 3975, 1, 1024, 1024, 1024, 1024, 1024]
    - [40, 9933.0]
  - - [1024, 3859, 1, 4096, 1024, 1024, 4096, 4096]
    - [62, 7989.0]
  - - [4096, 3369, 1, 1024, 4096, 4096, 1024, 1024]
    - [18, 11021.0]
  - - [1024, 3434, 1, 4096, 1024, 1024, 4096, 4096]
    - [62, 8513.0]
  - - [1024, 3292, 1, 4096, 1024, 1024, 4096, 4096]
    - [62, 8422.0]
  - - [4096, 3523, 1, 1024, 4096, 4096, 1024, 1024]
    - [16, 10688.0]
  - - [4096, 3380, 1, 1024, 4096, 4096, 1024, 1024]
    - [16, 10865.0]
  - - [1024, 3408, 1, 4096, 1024, 1024, 4096, 4096]
    - [62, 8736.0]
  - - [4096, 3221, 1, 1024, 4096, 4096, 1024, 1024]
    - [16, 10876.0]
  - - [4096, 3270, 1, 1024, 4096, 4096, 1024, 1024]
    - [16, 11000.0]
  - - [143, 143, 432, 64, 143, 143, 64, 64]
    - [33, 4158.0]
  - - [1024, 3303, 1, 4096, 1024, 1024, 4096, 4096]
    - [62, 8464.0]
  - - [4096, 3502, 1, 1024, 4096, 4096, 1024, 1024]
    - [18, 10710.0]
  - - [1024, 3222, 1, 4096, 1024, 1024, 4096, 4096]
    - [40, 8830.0]
  - - [4096, 2505, 1, 1024, 4096, 4096, 1024, 1024]
    - [18, 11063.0]
  - - [4096, 3397, 1, 1024, 4096, 4096, 1024, 1024]
    - [16, 10820.0]
  - - [4096, 3562, 1, 1024, 4096, 4096, 1024, 1024]
    - [16, 11696.0]
  - - [4096, 3095, 1, 1024, 4096, 4096, 1024, 1024]
    - [16, 10909.0]
  - - [1024, 3226, 1, 4096, 1024, 1024, 4096, 4096]
    - [39, 8935.0]
  - - [177, 177, 352, 64, 177, 177, 64, 64]
    - [33, 4157.0]
  - - [4096, 3360, 1, 1024, 4096, 4096, 1024, 1024]
    - [16, 10718.0]
  - - [1024, 3942, 1, 1024, 1024, 1024, 1024, 1024]
    - [38, 10225.0]
  - - [1024, 3298, 1, 4096, 1024, 1024, 4096, 4096]
    - [62, 8518.0]
  - - [1024, 3381, 1, 4096, 1024, 1024, 4096, 4096]
    - [62, 8516.0]
  - - [4096, 3314, 1, 1024, 4096, 4096, 1024, 1024]
    - [16, 11024.0]
  - - [1024, 3492, 1, 4096, 1024, 1024, 4096, 4096]
    - [62, 8177.0]
  - - [1024, 3430, 1, 4096, 1024, 1024, 4096, 4096]
    - [62, 8645.0]
  - - [4096, 3977, 1, 1024, 4096, 4096, 1024, 1024]
    - [18, 8369.0]
  - - [4096, 3546, 1, 1024, 4096, 4096, 1024, 1024]
    - [16, 10693.0]
  - - [4096, 3640, 1, 1024, 4096, 4096, 1024, 1024]
    - [16, 10254.0]
  - - [4096, 3441, 1, 1024, 4096, 4096, 1024, 1024]
    - [16, 10889.0]
  - - [33708, 4059, 1, 1024, 33708, 33708, 1024, 1024]
    - [60, 10954.0]
  - - [1024, 3978, 1, 1024, 1024, 1024, 1024, 1024]
    - [38, 10321.0]
  - - [1024, 3376, 1, 4096, 1024, 1024, 4096, 4096]
    - [62, 8456.0]
  - - [1024, 3482, 1, 4096, 1024, 1024, 4096, 4096]
    - [62, 8198.0]
  - - [1024, 3563, 1, 4096, 1024, 1024, 4096, 4096]
    - [17, 8695.0]
  - - [4096, 4020, 1, 1024, 4096, 4096, 1024, 1024]
    - [16, 8752.0]
  - - [1024, 3271, 1, 4096, 1024, 1024, 4096, 4096]
    - [62, 8418.0]
  - - [1024, 3291, 1, 4096, 1024, 1024, 4096, 4096]
    - [62, 8399.0]
  - - [1024, 3431, 1, 4096, 1024, 1024, 4096, 4096]
    - [38, 10100.0]
  - - [1024, 3481, 1, 4096, 1024, 1024, 4096, 4096]
    - [62, 8325.0]
  - - [4096, 3461, 1, 1024, 4096, 4096, 1024, 1024]
    - [16, 10719.0]
  - - [1024, 3574, 1, 4096, 1024, 1024, 4096, 4096]
    - [62, 8592.0]
  - - [1024, 4059, 1, 1024, 1024, 1024, 1024, 1024]
    - [38, 10395.0]
  - - [1024, 3421, 1, 4096, 1024, 1024, 4096, 4096]
    - [62, 8725.0]
  - - [4096, 3224, 1, 1024, 4096, 4096, 1024, 1024]
    - [18, 10991.0]
  - - [4096, 3437, 1, 1024, 4096, 4096, 1024, 1024]
    - [16, 10764.0]
  - - [4096, 3168, 1, 1024, 4096, 4096, 1024, 1024]
    - [16, 11660.0]
  - - [33708, 3990, 1, 1024, 33708, 33708, 1024, 1024]
    - [58, 11429.0]
  - - [1024, 3349, 1, 4096, 1024, 1024, 4096, 4096]
    - [62, 8323.0]
  - - [4096, 3335, 1, 1024, 4096, 4096, 1024, 1024]
    - [16, 10686.0]
  - - [4096, 3400, 1, 1024, 4096, 4096, 1024, 1024]
    - [16, 10863.0]
  - - [160, 159, 400, 64, 160, 160, 64, 64]
    - [53, 4126.0]
  - - [1024, 3398, 1, 4096, 1024, 1024, 4096, 4096]
    - [62, 8499.0]
  - - [1024, 3780, 1, 4096, 1024, 1024, 4096, 4096]
    - [62, 8476.0]
  - - [4096, 3098, 1, 1024, 4096, 4096, 1024, 1024]
    - [16, 11023.0]
  - - [1024, 4012, 1, 4096, 1024, 1024, 4096, 4096]
    - [58, 9063.0]
  - - [4096, 3505, 1, 1024, 4096, 4096, 1024, 1024]
    - [16, 10710.0]
  - - [4096, 3554, 1, 1024, 4096, 4096, 1024, 1024]
    - [18, 10531.0]
  - - [4096, 3063, 1, 1024, 4096, 4096, 1024, 1024]
    - [16, 11231.0]
  - - [1024, 3503, 1, 4096, 1024, 1024, 4096, 4096]
    - [62, 8258.0]
  - - [1024, 3166, 1, 4096, 1024, 1024, 4096, 4096]
    - [62, 9206.0]
  - - [1024, 3425, 1, 4096, 1024, 1024, 4096, 4096]
    - [63, 8794.0]
  - - [1024, 3344, 1, 4096, 1024, 1024, 4096, 4096]
    - [62, 8379.0]
  - - [4096, 3484, 1, 1024, 4096, 4096, 1024, 1024]
    - [16, 10814.0]
  - - [1024, 3681, 1, 1024, 1024, 1024, 1024, 1024]
    - [40, 10891.0]
  - - [1024, 4050, 1, 1024, 1024, 1024, 1024, 1024]
    - [38, 10498.0]
  - - [4096, 3379, 1, 1024, 4096, 4096, 1024, 1024]
    - [16, 10781.0]
  - - [4096, 3428, 1, 1024, 4096, 4096, 1024, 1024]
    - [16, 10927.0]
  - - [1024, 3304, 1, 4096, 1024, 1024, 4096, 4096]
    - [62, 8491.0]
  - - [1024, 3387, 1, 4096, 1024, 1024, 4096, 4096]
    - [62, 8531.0]
  - - [4096, 3126, 1, 1024, 4096, 4096, 1024, 1024]
    - [16, 11075.0]
  - - [1024, 3498, 1, 4096, 1024, 1024, 4096, 4096]
    - [62, 8333.0]
  - - [1024, 3436, 1, 4096, 1024, 1024, 4096, 4096]
    - [62, 8740.0]
  - - [4096, 3501, 1, 1024, 4096, 4096, 1024, 1024]
    - [16, 10779.0]
  - - [4096, 3358, 1, 1024, 4096, 4096, 1024, 1024]
    - [16, 10833.0]
  - - [4096, 3232, 1, 1024, 4096, 4096, 1024, 1024]
    - [16, 10871.0]
  - - [1024, 3585, 1, 4096, 1024, 1024, 4096, 4096]
    - [16, 8563.0]
  - - [4096, 3143, 1, 1024, 4096, 4096, 1024, 1024]
    - [16, 11113.0]
  - - [4096, 3464, 1, 1024, 4096, 4096, 1024, 1024]
    - [16, 10639.0]
  - - [1024, 3366, 1, 4096, 1024, 1024, 4096, 4096]
    - [62, 8485.0]
  - - [4096, 3375, 1, 1024, 4096, 4096, 1024, 1024]
    - [16, 10827.0]
  - - [4096, 2917, 1, 1024, 4096, 4096, 1024, 1024]
    - [16, 11207.0]
  - - [4096, 4026, 1, 1024, 4096, 4096, 1024, 1024]
    - [16, 8613.0]
  - - [1024, 3277, 1, 4096, 1024, 1024, 4096, 4096]
    - [62, 8426.0]
  - - [1024, 3103, 1, 4096, 1024, 1024, 4096, 4096]
    - [42, 8756.0]
  - - [33708, 3995, 1, 1024, 33708, 33708, 1024, 1024]
    - [60, 10914.0]
  - - [1024, 3297, 1, 4096, 1024, 1024, 4096, 4096]
    - [62, 8412.0]
  - - [4096, 3545, 1, 1024, 4096, 4096, 1024, 1024]
    - [18, 10391.0]
  - - [1024, 3399, 1, 4096, 1024, 1024, 4096, 4096]
    - [18, 9641.0]
  - - [33708, 3796, 1, 1024, 33708, 33708, 1024, 1024]
    - [60, 10910.0]
  - - [4096, 3292, 1, 1024, 4096, 4096, 1024, 1024]
    - [16, 11088.0]
  - - [33708, 3859, 1, 1024, 33708, 33708, 1024, 1024]
    - [58, 10460.0]
  - - [4096, 3566, 1, 1024, 4096, 4096, 1024, 1024]
    - [16, 10699.0]
  - - [4096, 3894, 1, 1024, 4096, 4096, 1024, 1024]
    - [16, 8756.0]
  - - [4096, 3492, 1, 1024, 4096, 4096, 1024, 1024]
    - [16, 10672.0]
  - - [1024, 3977, 1, 1024, 1024, 1024, 1024, 1024]
    - [38, 10461.0]
  - - [1024, 3272, 1, 4096, 1024, 1024, 4096, 4096]
    - [62, 8361.0]
  - - [135, 134, 480, 64, 135, 135, 64, 64]
    - [53, 3542.0]
  - - [1024, 3355, 1, 4096, 1024, 1024, 4096, 4096]
    - [62, 8520.0]
  - - [4096, 3419, 1, 1024, 4096, 4096, 1024, 1024]
    - [16, 10949.0]
  - - [1024, 3404, 1, 4096, 1024, 1024, 4096, 4096]
    - [62, 8679.0]
  - - [4096, 3999, 1, 1024, 4096, 4096, 1024, 1024]
    - [16, 11492.0]
  - - [4096, 3166, 1, 1024, 4096, 4096, 1024, 1024]
    - [16, 11243.0]
  - - [33708, 3840, 1, 1024, 33708, 33708, 1024, 1024]
    - [60, 11933.0]
  - - [4096, 4032, 1, 1024, 4096, 4096, 1024, 1024]
    - [29, 9606.0]
  - - [1024, 3573, 1, 4096, 1024, 1024, 4096, 4096]
    - [62, 8418.0]
  - - [4096, 3366, 1, 1024, 4096, 4096, 1024, 1024]
    - [16, 10778.0]
  - - [1024, 3541, 1, 4096, 1024, 1024, 4096, 4096]
    - [62, 8298.0]
  - - [4096, 3207, 1, 1024, 4096, 4096, 1024, 1024]
    - [18, 10939.0]
  - - [4096, 3272, 1, 1024, 4096, 4096, 1024, 1024]
    - [16, 11024.0]
  - - [1024, 3334, 1, 4096, 1024, 1024, 4096, 4096]
    - [62, 8452.0]
  - - [228, 228, 272, 64, 228, 228, 64, 64]
    - [57, 5968.0]
  - - [4096, 3183, 1, 1024, 4096, 4096, 1024, 1024]
    - [16, 11234.0]
  - - [4096, 3536, 1, 1024, 4096, 4096, 1024, 1024]
    - [16, 10716.0]
  - - [1024, 4005, 1, 1024, 1024, 1024, 1024, 1024]
    - [38, 10335.0]
  - - [1024, 3245, 1, 4096, 1024, 1024, 4096, 4096]
    - [62, 8391.0]
  - - [4096, 3447, 1, 1024, 4096, 4096, 1024, 1024]
    - [16, 10761.0]
  - - [1024, 3183, 1, 4096, 1024, 1024, 4096, 4096]
    - [62, 8667.0]
  - - [1024, 3361, 1, 4096, 1024, 1024, 4096, 4096]
    - [62, 8525.0]
  - - [33708, 3870, 1, 1024, 33708, 33708, 1024, 1024]
    - [60, 10613.0]
  - - [1024, 3321, 1, 4096, 1024, 1024, 4096, 4096]
    - [62, 8447.0]
  - - [1024, 3486, 1, 4096, 1024, 1024, 4096, 4096]
    - [62, 8285.0]
  - - [4096, 4005, 1, 1024, 4096, 4096, 1024, 1024]
    - [16, 8519.0]
  - - [4096, 3410, 1, 1024, 4096, 4096, 1024, 1024]
    - [16, 10852.0]
  - - [1024, 3944, 1, 1024, 1024, 1024, 1024, 1024]
    - [38, 10229.0]
  - - [4096, 3300, 1, 1024, 4096, 4096, 1024, 1024]
    - [18, 11105.0]
  - - [4096, 3579, 1, 1024, 4096, 4096, 1024, 1024]
    - [18, 9801.0]
  - - [4096, 3483, 1, 1024, 4096, 4096, 1024, 1024]
    - [16, 10654.0]
  - - [4096, 3532, 1, 1024, 4096, 4096, 1024, 1024]
    - [18, 10704.0]
  - - [1024, 3140, 1, 4096, 1024, 1024, 4096, 4096]
    - [62, 8564.0]
  - - [1024, 3372, 1, 4096, 1024, 1024, 4096, 4096]
    - [18, 9362.0]
  - - [1024, 3224, 1, 4096, 1024, 1024, 4096, 4096]
    - [20, 8536.0]
  - - [4096, 3230, 1, 1024, 4096, 4096, 1024, 1024]
    - [16, 10850.0]
  - - [4096, 3427, 1, 1024, 4096, 4096, 1024, 1024]
    - [16, 10826.0]
  - - [1024, 3796, 1, 1024, 1024, 1024, 1024, 1024]
    - [40, 10819.0]
  - - [143, 148, 432, 64, 143, 143, 64, 64]
    - [53, 4430.0]
  - - [1024, 3616, 1, 4096, 1024, 1024, 4096, 4096]
    - [42, 8568.0]
  - - [1024, 3315, 1, 4096, 1024, 1024, 4096, 4096]
    - [62, 8358.0]
  - - [1024, 3476, 1, 4096, 1024, 1024, 4096, 4096]
    - [62, 8250.0]
  - - [1024, 3509, 1, 4096, 1024, 1024, 4096, 4096]
    - [62, 8198.0]
  - - [4096, 3357, 1, 1024, 4096, 4096, 1024, 1024]
    - [16, 10788.0]
  - - [4096, 3406, 1, 1024, 4096, 4096, 1024, 1024]
    - [16, 10843.0]
  - - [1024, 3558, 1, 4096, 1024, 1024, 4096, 4096]
    - [62, 8306.0]
  - - [4096, 3593, 1, 1024, 4096, 4096, 1024, 1024]
    - [18, 9835.0]
  - - [4096, 3247, 1, 1024, 4096, 4096, 1024, 1024]
    - [18, 10972.0]
  - - [4096, 3088, 1, 1024, 4096, 4096, 1024, 1024]
    - [16, 10924.0]
  - - [1024, 3213, 1, 4096, 1024, 1024, 4096, 4096]
    - [62, 8369.0]
  - - [4096, 3511, 1, 1024, 4096, 4096, 1024, 1024]
    - [18, 11295.0]
  - - [1024, 3365, 1, 4096, 1024, 1024, 4096, 4096]
    - [62, 8568.0]
  - - [1024, 3504, 1, 4096, 1024, 1024, 4096, 4096]
    - [62, 8390.0]
  - - [1024, 3442, 1, 4096, 1024, 1024, 4096, 4096]
    - [21, 8648.0]
  - - [4096, 3474, 1, 1024, 4096, 4096, 1024, 1024]
    - [16, 10715.0]
  - - [4096, 2984, 1, 1024, 4096, 4096, 1024, 1024]
    - [16, 10996.0]
  - - [1024, 3876, 1, 4096, 1024, 1024, 4096, 4096]
    - [42, 8045.0]
  - - [4096, 3337, 1, 1024, 4096, 4096, 1024, 1024]
    - [16, 10666.0]
  - - [4096, 3450, 1, 1024, 4096, 4096, 1024, 1024]
    - [18, 10187.0]
  - - [1024, 3547, 1, 4096, 1024, 1024, 4096, 4096]
    - [62, 8487.0]
  - - [4096, 3291, 1, 1024, 4096, 4096, 1024, 1024]
    - [18, 11137.0]
  - - [1024, 3340, 1, 4096, 1024, 1024, 4096, 4096]
    - [62, 8384.0]
  - - [4096, 3491, 1, 1024, 4096, 4096, 1024, 1024]
    - [16, 10762.0]
  - - [4096, 3348, 1, 1024, 4096, 4096, 1024, 1024]
    - [16, 10676.0]
  - - [4096, 3906, 1, 1024, 4096, 4096, 1024, 1024]
    - [16, 9518.0]
  - - [1024, 3477, 1, 4096, 1024, 1024, 4096, 4096]
    - [58, 8358.0]
  - - [1024, 3397, 1, 4096, 1024, 1024, 4096, 4096]
    - [62, 8523.0]
  - - [4096, 3165, 1, 1024, 4096, 4096, 1024, 1024]
    - [16, 11088.0]
  - - [4096, 3470, 1, 1024, 4096, 4096, 1024, 1024]
    - [16, 10629.0]
  - - [1024, 3526, 1, 4096, 1024, 1024, 4096, 4096]
    - [62, 8459.0]
  - - [4096, 3365, 1, 1024, 4096, 4096, 1024, 1024]
    - [16, 10847.0]
  - - [4096, 3319, 1, 1024, 4096, 4096, 1024, 1024]
    - [18, 11611.0]
  - - [1024, 3401, 1, 4096, 1024, 1024, 4096, 4096]
    - [59, 8846.0]
  - - [1024, 3294, 1, 4096, 1024, 1024, 4096, 4096]
    - [62, 8351.0]
  - - [159, 159, 400, 64, 159, 159, 64, 64]
    - [33, 3782.0]
  - - [1024, 3472, 1, 4096, 1024, 1024, 4096, 4096]
    - [62, 8293.0]
  - - [4096, 3328, 1, 1024, 4096, 4096, 1024, 1024]
    - [16, 11077.0]
  - - [1024, 3861, 1, 1024, 1024, 1024, 1024, 1024]
    - [38, 10108.0]
  - - [1024, 3910, 1, 1024, 1024, 1024, 1024, 1024]
    - [38, 10717.0]
  - - [1024, 3410, 1, 4096, 1024, 1024, 4096, 4096]
    - [31, 8426.0]
  - - [1024, 3395, 1, 4096, 1024, 1024, 4096, 4096]
    - [62, 8571.0]
  - - [4096, 3282, 1, 1024, 4096, 4096, 1024, 1024]
    - [18, 11112.0]
  - - [1024, 3751, 1, 1024, 1024, 1024, 1024, 1024]
    - [18, 11025.0]
  - - [4096, 3145, 1, 1024, 4096, 4096, 1024, 1024]
    - [16, 11249.0]
  - - [4096, 3514, 1, 1024, 4096, 4096, 1024, 1024]
    - [16, 10749.0]
  - - [4096, 3944, 1, 1024, 4096, 4096, 1024, 1024]
    - [16, 9019.0]
  - - [1024, 3515, 1, 4096, 1024, 1024, 4096, 4096]
    - [62, 8281.0]
  - - [4096, 3409, 1, 1024, 4096, 4096, 1024, 1024]
    - [16, 10878.0]
  - - [4096, 3564, 1, 1024, 4096, 4096, 1024, 1024]
    - [18, 10607.0]
  - - [4096, 3299, 1, 1024, 4096, 4096, 1024, 1024]
    - [16, 10986.0]
  - - [1024, 3057, 1, 4096, 1024, 1024, 4096, 4096]
    - [40, 9083.0]
  - - [4096, 3531, 1, 1024, 4096, 4096, 1024, 1024]
    - [16, 10717.0]
  - - [4096, 3388, 1, 1024, 4096, 4096, 1024, 1024]
    - [16, 10817.0]
  - - [1024, 3189, 1, 4096, 1024, 1024, 4096, 4096]
    - [62, 8603.0]
  - - [1024, 3300, 1, 4096, 1024, 1024, 4096, 4096]
    - [62, 8370.0]
  - - [1024, 3720, 1, 4096, 1024, 1024, 4096, 4096]
    - [62, 8523.0]
  - - [1024, 3383, 1, 4096, 1024, 1024, 4096, 4096]
    - [62, 8462.0]
  - - [1024, 3494, 1, 4096, 1024, 1024, 4096, 4096]
    - [62, 8295.0]
  - - [1024, 3448, 1, 4096, 1024, 1024, 4096, 4096]
    - [62, 8512.0]
  - - [4096, 3542, 1, 1024, 4096, 4096, 1024, 1024]
    - [16, 10697.0]
  - - [1024, 3488, 1, 4096, 1024, 1024, 4096, 4096]
    - [62, 8330.0]
  - - [4096, 3405, 1, 1024, 4096, 4096, 1024, 1024]
    - [16, 10854.0]
  - - [1024, 3262, 1, 4096, 1024, 1024, 4096, 4096]
    - [42, 8216.0]
  - - [33708, 4005, 1, 1024, 33708, 33708, 1024, 1024]
    - [40, 11931.0]
  - - [1024, 3594, 1, 4096, 1024, 1024, 4096, 4096]
    - [62, 8481.0]
  - - [4096, 3103, 1, 1024, 4096, 4096, 1024, 1024]
    - [16, 11031.0]
  - - [4096, 3136, 1, 1024, 4096, 4096, 1024, 1024]
    - [16, 11079.0]
  - - [1024, 3378, 1, 4096, 1024, 1024, 4096, 4096]
    - [58, 9427.0]
  - - [4096, 3559, 1, 1024, 4096, 4096, 1024, 1024]
    - [18, 10711.0]
  - - [4096, 3368, 1, 1024, 4096, 4096, 1024, 1024]
    - [16, 10753.0]
  - - [4096, 3209, 1, 1024, 4096, 4096, 1024, 1024]
    - [18, 10868.0]
  - - [4096, 3322, 1, 1024, 4096, 4096, 1024, 1024]
    - [18, 10983.0]
  - - [1024, 3483, 1, 4096, 1024, 1024, 4096, 4096]
    - [58, 8190.0]
  - - [4096, 3473, 1, 1024, 4096, 4096, 1024, 1024]
    - [16, 10668.0]
  - - [4096, 3522, 1, 1024, 4096, 4096, 1024, 1024]
    - [18, 10643.0]
  - - [1024, 3532, 1, 4096, 1024, 1024, 4096, 4096]
    - [42, 8414.0]
  - - [4096, 3449, 1, 1024, 4096, 4096, 1024, 1024]
    - [16, 10870.0]
  - - [1024, 3351, 1, 4096, 1024, 1024, 4096, 4096]
    - [62, 8286.0]
  - - [1024, 3462, 1, 4096, 1024, 1024, 4096, 4096]
    - [62, 8341.0]
  - - [4096, 3396, 1, 1024, 4096, 4096, 1024, 1024]
    - [16, 10843.0]
  - - [132, 132, 480, 64, 132, 132, 64, 64]
    - [44, 3756.0]
  - - [1024, 3416, 1, 4096, 1024, 1024, 4096, 4096]
    - [62, 8531.0]
  - - [4096, 3469, 1, 1024, 4096, 4096, 1024, 1024]
    - [16, 10733.0]
  - - [1024, 3582, 1, 4096, 1024, 1024, 4096, 4096]
    - [60, 10323.0]
  - - [1024, 3230, 1, 4096, 1024, 1024, 4096, 4096]
    - [62, 8426.0]
  - - [1024, 3489, 1, 4096, 1024, 1024, 4096, 4096]
    - [62, 8343.0]
  - - [1024, 3427, 1, 4096, 1024, 1024, 4096, 4096]
    - [62, 8629.0]
  - - [1024, 3346, 1, 4096, 1024, 1024, 4096, 4096]
    - [62, 8410.0]
  - - [33708, 3977, 1, 1024, 33708, 33708, 1024, 1024]
    - [58, 10564.0]
  - - [4096, 3796, 1, 1024, 4096, 4096, 1024, 1024]
    - [16, 9231.0]
  - - [4096, 3176, 1, 1024, 4096, 4096, 1024, 1024]
    - [16, 11226.0]
  - - [4096, 3990, 1, 1024, 4096, 4096, 1024, 1024]
    - [42, 8552.0]
  - - [1024, 3257, 1, 4096, 1024, 1024, 4096, 4096]
    - [62, 8396.0]
  - - [4096, 3343, 1, 1024, 4096, 4096, 1024, 1024]
    - [16, 10706.0]
  - - [4096, 3440, 1, 1024, 4096, 4096, 1024, 1024]
    - [16, 10700.0]
  - - [33708, 4030, 1, 1024, 33708, 33708, 1024, 1024]
    - [60, 10846.0]
  - - [1024, 3190, 1, 4096, 1024, 1024, 4096, 4096]
    - [62, 8404.0]
  - - [1024, 3389, 1, 4096, 1024, 1024, 4096, 4096]
    - [17, 8511.0]
  - - [1024, 3500, 1, 4096, 1024, 1024, 4096, 4096]
    - [62, 8294.0]
  - - [1024, 3471, 1, 4096, 1024, 1024, 4096, 4096]
    - [62, 8136.0]
  - - [1024, 3438, 1, 4096, 1024, 1024, 4096, 4096]
    - [62, 8467.0]
  - - [4096, 3513, 1, 1024, 4096, 4096, 1024, 1024]
    - [16, 10758.0]
  - - [1024, 3562, 1, 4096, 1024, 1024, 4096, 4096]
    - [62, 8448.0]
  - - [4096, 3616, 1, 1024, 4096, 4096, 1024, 1024]
    - [16, 10326.0]
  - - [4096, 3955, 1, 1024, 4096, 4096, 1024, 1024]
    - [16, 9179.0]
  - - [1024, 3441, 1, 4096, 1024, 1024, 4096, 4096]
    - [58, 9584.0]
  - - [1024, 3236, 1, 4096, 1024, 1024, 4096, 4096]
    - [62, 8320.0]
  - - [1024, 3524, 1, 4096, 1024, 1024, 4096, 4096]
    - [42, 8329.0]
  - - [4096, 3460, 1, 1024, 4096, 4096, 1024, 1024]
    - [18, 10695.0]
  - - [1024, 3384, 1, 4096, 1024, 1024, 4096, 4096]
    - [31, 8339.0]
  - - [4096, 3387, 1, 1024, 4096, 4096, 1024, 1024]
    - [16, 10854.0]
  - - [4096, 3436, 1, 1024, 4096, 4096, 1024, 1024]
    - [16, 10764.0]
  - - [4096, 3277, 1, 1024, 4096, 4096, 1024, 1024]
    - [16, 11041.0]
  - - [1024, 3457, 1, 4096, 1024, 1024, 4096, 4096]
    - [62, 8097.0]
  - - [1024, 3999, 1, 4096, 1024, 1024, 4096, 4096]
    - [49, 7660.0]
  - - [1024, 4032, 1, 4096, 1024, 1024, 4096, 4096]
    - [31, 8163.0]
  - - [4096, 3541, 1, 1024, 4096, 4096, 1024, 1024]
    - [16, 10628.0]
  - - [4096, 3334, 1, 1024, 4096, 4096, 1024, 1024]
    - [16, 10724.0]
  - - [1024, 3393, 1, 4096, 1024, 1024, 4096, 4096]
    - [31, 8509.0]
  - - [1024, 3411, 1, 4096, 1024, 1024, 4096, 4096]
    - [62, 8613.0]
  - - [1024, 3822, 1, 1024, 1024, 1024, 1024, 1024]
    - [40, 10813.0]
  - - [1024, 3593, 1, 4096, 1024, 1024, 4096, 4096]
    - [62, 8292.0]
  - - [33708, 3822, 1, 1024, 33708, 33708, 1024, 1024]
    - [60, 10968.0]
  - - [4096, 3504, 1, 1024, 4096, 4096, 1024, 1024]
    - [16, 10705.0]
  - - [1024, 3163, 1, 4096, 1024, 1024, 4096, 4096]
    - [62, 8686.0]
  - - [1024, 3357, 1, 4096, 1024, 1024, 4096, 4096]
    - [63, 8569.0]
  - - [1024, 3906, 1, 4096, 1024, 1024, 4096, 4096]
    - [62, 7855.0]
  - - [4096, 3415, 1, 1024, 4096, 4096, 1024, 1024]
    - [18, 11162.0]
  - - [1024, 3406, 1, 4096, 1024, 1024, 4096, 4096]
    - [62, 8497.0]
  - - [4096, 3321, 1, 1024, 4096, 4096, 1024, 1024]
    - [16, 10934.0]
  - - [4096, 3584, 1, 1024, 4096, 4096, 1024, 1024]
    - [16, 10587.0]
  - - [1024, 2736, 1, 4096, 1024, 1024, 4096, 4096]
    - [40, 9847.0]
  - - [1024, 3110, 1, 4096, 1024, 1024, 4096, 4096]
    - [62, 8683.0]
  - - [33708, 3999, 1, 1024, 33708, 33708, 1024, 1024]
    - [60, 10721.0]
  - - [1024, 3093, 1, 4096, 1024, 1024, 4096, 4096]
    - [62, 8723.0]
  - - [4096, 3378, 1, 1024, 4096, 4096, 1024, 1024]
    - [16, 10845.0]
  - - [1024, 3543, 1, 4096, 1024, 1024, 4096, 4096]
    - [62, 8396.0]
  - - [33708, 3925, 1, 1024, 33708, 33708, 1024, 1024]
    - [60, 10655.0]
  - - [1024, 3352, 1, 4096, 1024, 1024, 4096, 4096]
    - [62, 8453.0]
  - - [4096, 3780, 1, 1024, 4096, 4096, 1024, 1024]
    - [17, 10361.0]
  - - [1024, 3990, 1, 4096, 1024, 1024, 4096, 4096]
    - [32, 8586.0]
  - - [4096, 3500, 1, 1024, 4096, 4096, 1024, 1024]
    - [16, 10751.0]
  - - [4096, 3996, 1, 1024, 4096, 4096, 1024, 1024]
    - [16, 8797.0]
  - - [1024, 3247, 1, 4096, 1024, 1024, 4096, 4096]
    - [42, 8286.0]
  - - [4096, 3395, 1, 1024, 4096, 4096, 1024, 1024]
    - [18, 10442.0]
  - - [1024, 3169, 1, 4096, 1024, 1024, 4096, 4096]
    - [62, 8405.0]
  - - [1024, 3088, 1, 4096, 1024, 1024, 4096, 4096]
    - [62, 8737.0]
  - - [1024, 3584, 1, 4096, 1024, 1024, 4096, 4096]
    - [42, 8446.0]
  - - [4096, 3093, 1, 1024, 4096, 4096, 1024, 1024]
    - [16, 10910.0]
  - - [1024, 3538, 1, 4096, 1024, 1024, 4096, 4096]
    - [62, 8359.0]
  - - [1024, 3996, 1, 1024, 1024, 1024, 1024, 1024]
    - [40, 10016.0]
  - - [1024, 3581, 1, 4096, 1024, 1024, 4096, 4096]
    - [58, 8629.0]
  - - [4096, 3374, 1, 1024, 4096, 4096, 1024, 1024]
    - [16, 10720.0]
  - - [33708, 3751, 1, 1024, 33708, 33708, 1024, 1024]
    - [60, 10595.0]
  - - [4096, 3215, 1, 1024, 4096, 4096, 1024, 1024]
    - [18, 10797.0]
  - - [4096, 3312, 1, 1024, 4096, 4096, 1024, 1024]
    - [16, 11000.0]
  - - [4096, 3581, 1, 1024, 4096, 4096, 1024, 1024]
    - [49, 10730.0]
  - - [4096, 3479, 1, 1024, 4096, 4096, 1024, 1024]
    - [18, 10609.0]
  - - [4096, 3544, 1, 1024, 4096, 4096, 1024, 1024]
    - [16, 10625.0]
  - - [1024, 3870, 1, 1024, 1024, 1024, 1024, 1024]
    - [38, 10026.0]
  - - [1024, 3374, 1, 4096, 1024, 1024, 4096, 4096]
    - [62, 8540.0]
  - - [1024, 2967, 1, 4096, 1024, 1024, 4096, 4096]
    - [58, 9256.0]
  - - [4096, 3455, 1, 1024, 4096, 4096, 1024, 1024]
    - [16, 11009.0]
  - - [4096, 3942, 1, 1024, 4096, 4096, 1024, 1024]
    - [16, 9008.0]
  - - [1024, 3528, 1, 4096, 1024, 1024, 4096, 4096]
    - [62, 8403.0]
  - - [4096, 3186, 1, 1024, 4096, 4096, 1024, 1024]
    - [16, 11192.0]
  - - [1024, 3976, 1, 1024, 1024, 1024, 1024, 1024]
    - [38, 10284.0]
  - - [1024, 3511, 1, 4096, 1024, 1024, 4096, 4096]
    - [58, 8027.0]
  - - [4096, 3573, 1, 1024, 4096, 4096, 1024, 1024]
    - [51, 10816.0]
  - - [4096, 3561, 1, 1024, 4096, 4096, 1024, 1024]
    - [16, 10699.0]
  - - [4096, 3418, 1, 1024, 4096, 4096, 1024, 1024]
    - [16, 10888.0]
  - - [33708, 3906, 1, 1024, 33708, 33708, 1024, 1024]
    - [58, 10578.0]
  - - [4096, 3259, 1, 1024, 4096, 4096, 1024, 1024]
    - [16, 10904.0]
  - - [4096, 3308, 1, 1024, 4096, 4096, 1024, 1024]
    - [16, 11008.0]
  - - [1024, 3419, 1, 4096, 1024, 1024, 4096, 4096]
    - [62, 8656.0]
  - - [1024, 3215, 1, 4096, 1024, 1024, 4096, 4096]
    - [62, 8283.0]
  - - [1024, 4030, 1, 4096, 1024, 1024, 4096, 4096]
    - [42, 7690.0]
  - - [4096, 3459, 1, 1024, 4096, 4096, 1024, 1024]
    - [18, 10617.0]
  - - [1024, 3572, 1, 4096, 1024, 1024, 4096, 4096]
    - [59, 8571.0]
  - - [1024, 3137, 1, 4096, 1024, 1024, 4096, 4096]
    - [62, 8697.0]
  - - [1024, 3312, 1, 4096, 1024, 1024, 4096, 4096]
    - [42, 8539.0]
  - - [1024, 3925, 1, 4096, 1024, 1024, 4096, 4096]
    - [62, 7994.0]
  - - [1024, 3453, 1, 4096, 1024, 1024, 4096, 4096]
    - [20, 9138.0]
  - - [4096, 3435, 1, 1024, 4096, 4096, 1024, 1024]
    - [16, 10921.0]
  - - [1024, 3176, 1, 4096, 1024, 1024, 4096, 4096]
    - [62, 8330.0]
  - - [1024, 3444, 1, 4096, 1024, 1024, 4096, 4096]
    - [62, 8685.0]
  - - [4096, 3975, 1, 1024, 4096, 4096, 1024, 1024]
    - [16, 8872.0]
  - - [4096, 3182, 1, 1024, 4096, 4096, 1024, 1024]
    - [16, 11717.0]
  - - [1024, 3475, 1, 4096, 1024, 1024, 4096, 4096]
    - [62, 8110.0]
  - - [33708, 3955, 1, 1024, 33708, 33708, 1024, 1024]
    - [40, 10614.0]
  - - [4096, 3446, 1, 1024, 4096, 4096, 1024, 1024]
    - [16, 10921.0]
  - - [1024, 3138, 1, 4096, 1024, 1024, 4096, 4096]
    - [62, 8644.0]
  - - [1024, 3549, 1, 4096, 1024, 1024, 4096, 4096]
    - [42, 8272.0]
  - - [4096, 3287, 1, 1024, 4096, 4096, 1024, 1024]
    - [16, 11065.0]
  - - [1024, 3342, 1, 4096, 1024, 1024, 4096, 4096]
    - [62, 8502.0]
  - - [4096, 3519, 1, 1024, 4096, 4096, 1024, 1024]
    - [18, 10794.0]
  - - [4096, 3552, 1, 1024, 4096, 4096, 1024, 1024]
    - [16, 10764.0]
  - - [4096, 3859, 1, 1024, 4096, 4096, 1024, 1024]
    - [16, 8771.0]
  - - [33708, 3969, 1, 1024, 33708, 33708, 1024, 1024]
    - [60, 10838.0]
  - - [1024, 3369, 1, 4096, 1024, 1024, 4096, 4096]
    - [62, 8656.0]
  - - [4096, 3482, 1, 1024, 4096, 4096, 1024, 1024]
    - [18, 11263.0]
  - - [1024, 3306, 1, 4096, 1024, 1024, 4096, 4096]
    - [62, 8370.0]
  - - [1024, 3474, 1, 4096, 1024, 1024, 4096, 4096]
    - [62, 8316.0]
  - - [4096, 3377, 1, 1024, 4096, 4096, 1024, 1024]
    - [16, 10841.0]
  - - [4096, 3426, 1, 1024, 4096, 4096, 1024, 1024]
    - [16, 10931.0]
  - - [4096, 2935, 1, 1024, 4096, 4096, 1024, 1024]
    - [16, 11386.0]
  - - [4096, 3267, 1, 1024, 4096, 4096, 1024, 1024]
    - [16, 11051.0]
  - - [1024, 3299, 1, 4096, 1024, 1024, 4096, 4096]
    - [62, 8442.0]
  - - [1024, 3456, 1, 4096, 1024, 1024, 4096, 4096]
    - [62, 8863.0]
  - - [1024, 3280, 1, 4096, 1024, 1024, 4096, 4096]
    - [62, 8370.0]
  - - [1024, 3555, 1, 4096, 1024, 1024, 4096, 4096]
    - [42, 8380.0]
  - - [4096, 3499, 1, 1024, 4096, 4096, 1024, 1024]
    - [18, 10748.0]
  - - [4096, 3356, 1, 1024, 4096, 4096, 1024, 1024]
    - [16, 10847.0]
  - - [1024, 3412, 1, 4096, 1024, 1024, 4096, 4096]
    - [39, 9334.0]
  - - [1024, 2984, 1, 4096, 1024, 1024, 4096, 4096]
    - [40, 9629.0]
  - - [4096, 3141, 1, 1024, 4096, 4096, 1024, 1024]
    - [16, 11053.0]
  - - [4096, 3510, 1, 1024, 4096, 4096, 1024, 1024]
    - [16, 10761.0]
  - - [1024, 3995, 1, 1024, 1024, 1024, 1024, 1024]
    - [38, 10314.0]
  - - [1024, 3517, 1, 4096, 1024, 1024, 4096, 4096]
    - [62, 8417.0]
  - - [1024, 3455, 1, 4096, 1024, 1024, 4096, 4096]
    - [62, 8651.0]
  - - [1024, 3939, 1, 1024, 1024, 1024, 1024, 1024]
    - [38, 10168.0]
  - - [1024, 3447, 1, 4096, 1024, 1024, 4096, 4096]
    - [38, 9784.0]
  - - [1024, 3969, 1, 4096, 1024, 1024, 4096, 4096]
    - [42, 7681.0]
  - - [4096, 3527, 1, 1024, 4096, 4096, 1024, 1024]
    - [18, 10614.0]
  - - [4096, 3336, 1, 1024, 4096, 4096, 1024, 1024]
    - [16, 10697.0]
  - - [1024, 3191, 1, 4096, 1024, 1024, 4096, 4096]
    - [31, 8247.0]
  - - [1024, 3302, 1, 4096, 1024, 1024, 4096, 4096]
    - [62, 8474.0]
  - - [1024, 3337, 1, 4096, 1024, 1024, 4096, 4096]
    - [38, 9653.0]
  - - [4096, 3290, 1, 1024, 4096, 4096, 1024, 1024]
    - [18, 11079.0]
  - - [1024, 3512, 1, 4096, 1024, 1024, 4096, 4096]
    - [16, 8668.0]
  - - [1024, 3433, 1, 4096, 1024, 1024, 4096, 4096]
    - [62, 8522.0]
  - - [4096, 3876, 1, 1024, 4096, 4096, 1024, 1024]
    - [16, 9467.0]
  - - [4096, 3490, 1, 1024, 4096, 4096, 1024, 1024]
    - [16, 10718.0]
  - - [4096, 3064, 1, 1024, 4096, 4096, 1024, 1024]
    - [16, 11260.0]
  - - [1024, 3508, 1, 4096, 1024, 1024, 4096, 4096]
    - [62, 8415.0]
  - - [1024, 3956, 1, 4096, 1024, 1024, 4096, 4096]
    - [62, 7822.0]
  - - [4096, 3417, 1, 1024, 4096, 4096, 1024, 1024]
    - [16, 10849.0]
  - - [1024, 3248, 1, 4096, 1024, 1024, 4096, 4096]
    - [62, 8335.0]
  - - [1024, 2499, 1, 4096, 1024, 1024, 4096, 4096]
    - [40, 11201.0]
  - - [1024, 3186, 1, 4096, 1024, 1024, 4096, 4096]
    - [62, 8440.0]
  - - [1024, 3180, 1, 4096, 1024, 1024, 4096, 4096]
    - [62, 8412.0]
  - - [4096, 3364, 1, 1024, 4096, 4096, 1024, 1024]
    - [16, 10743.0]
  - - [4096, 3976, 1, 1024, 4096, 4096, 1024, 1024]
    - [21, 8744.0]
  - - [4096, 3205, 1, 1024, 4096, 4096, 1024, 1024]
    - [18, 10655.0]
  - - [4096, 3318, 1, 1024, 4096, 4096, 1024, 1024]
    - [18, 11002.0]
  - - [1024, 3377, 1, 4096, 1024, 1024, 4096, 4096]
    - [38, 9469.0]
  - - [1024, 3485, 1, 4096, 1024, 1024, 4096, 4096]
    - [39, 9090.0]
  - - [4096, 3181, 1, 1024, 4096, 4096, 1024, 1024]
    - [16, 11213.0]
  - - [4096, 3550, 1, 1024, 4096, 4096, 1024, 1024]
    - [16, 10731.0]
  - - [1024, 3534, 1, 4096, 1024, 1024, 4096, 4096]
    - [59, 8460.0]
  - - [1024, 3860, 1, 1024, 1024, 1024, 1024, 1024]
    - [38, 10061.0]
  - - [160, 160, 400, 64, 160, 160, 64, 64]
    - [22, 4231.0]
  - - [4096, 3445, 1, 1024, 4096, 4096, 1024, 1024]
    - [16, 10899.0]
  - - [1024, 3391, 1, 4096, 1024, 1024, 4096, 4096]
    - [62, 8653.0]
  - - [1024, 3221, 1, 4096, 1024, 1024, 4096, 4096]
    - [62, 8364.0]
  - - [4096, 3079, 1, 1024, 4096, 4096, 1024, 1024]
    - [16, 11002.0]
  - - [4096, 3144, 1, 1024, 4096, 4096, 1024, 1024]
    - [16, 11148.0]
  - - [1024, 3270, 1, 4096, 1024, 1024, 4096, 4096]
    - [62, 8365.0]
  - - [1024, 3561, 1, 4096, 1024, 1024, 4096, 4096]
    - [62, 8394.0]
  - - [1024, 3480, 1, 4096, 1024, 1024, 4096, 4096]
    - [62, 8152.0]
  - - [4096, 3408, 1, 1024, 4096, 4096, 1024, 1024]
    - [16, 10532.0]
  - - [1024, 3418, 1, 4096, 1024, 1024, 4096, 4096]
    - [62, 8662.0]
  - - [4096, 3298, 1, 1024, 4096, 4096, 1024, 1024]
    - [16, 11067.0]
  - - [1024, 3640, 1, 1024, 1024, 1024, 1024, 1024]
    - [18, 10709.0]
  - - [1024, 3449, 1, 4096, 1024, 1024, 4096, 4096]
    - [62, 8683.0]
  - - [1024, 4020, 1, 4096, 1024, 1024, 4096, 4096]
    - [62, 7748.0]
  - - [4096, 3481, 1, 1024, 4096, 4096, 1024, 1024]
    - [18, 10623.0]
  - - [4096, 3530, 1, 1024, 4096, 4096, 1024, 1024]
    - [16, 10772.0]
  - - [1024, 3216, 1, 4096, 1024, 1024, 4096, 4096]
    - [62, 8189.0]
  - - [1024, 3491, 1, 4096, 1024, 1024, 4096, 4096]
    - [62, 8319.0]
  - - [1024, 3154, 1, 4096, 1024, 1024, 4096, 4096]
    - [62, 8615.0]
  - - [4096, 3425, 1, 1024, 4096, 4096, 1024, 1024]
    - [16, 10872.0]
  - - [1024, 3348, 1, 4096, 1024, 1024, 4096, 4096]
    - [62, 8405.0]
  - - [1024, 3415, 1, 4096, 1024, 1024, 4096, 4096]
    - [62, 8409.0]
  - - [1024, 4026, 1, 1024, 1024, 1024, 1024, 1024]
    - [38, 10302.0]
  - - [1024, 3367, 1, 4096, 1024, 1024, 4096, 4096]
    - [62, 8525.0]
  - - [1024, 3259, 1, 4096, 1024, 1024, 4096, 4096]
    - [62, 8493.0]
  - - [1024, 3894, 1, 4096, 1024, 1024, 4096, 4096]
    - [62, 7907.0]
  - - [4096, 3355, 1, 1024, 4096, 4096, 1024, 1024]
    - [16, 10774.0]
  - - [4096, 3404, 1, 1024, 4096, 4096, 1024, 1024]
    - [16, 10984.0]
  - - [1024, 3308, 1, 4096, 1024, 1024, 4096, 4096]
    - [42, 8547.0]
  - - [4096, 3245, 1, 1024, 4096, 4096, 1024, 1024]
    - [18, 10965.0]
  - - [1024, 3502, 1, 4096, 1024, 1024, 4096, 4096]
    - [62, 8277.0]
  - - [33708, 4032, 1, 1024, 33708, 33708, 1024, 1024]
    - [40, 10713.0]
  - - [1024, 3424, 1, 4096, 1024, 1024, 4096, 4096]
    - [62, 8634.0]
  - - [4096, 3509, 1, 1024, 4096, 4096, 1024, 1024]
    - [18, 10587.0]
  - - [4096, 3558, 1, 1024, 4096, 4096, 1024, 1024]
    - [16, 10512.0]
  - - [1024, 3900, 1, 1024, 1024, 1024, 1024, 1024]
    - [38, 10237.0]
  - - [1024, 2505, 1, 4096, 1024, 1024, 4096, 4096]
    - [18, 11042.0]
  - - [4096, 3472, 1, 1024, 4096, 4096, 1024, 1024]
    - [16, 10677.0]
  - - [1024, 3386, 1, 4096, 1024, 1024, 4096, 4096]
    - [62, 8425.0]
  - - [4096, 3383, 1, 1024, 4096, 4096, 1024, 1024]
    - [16, 10833.0]
  - - [4096, 3448, 1, 1024, 4096, 4096, 1024, 1024]
    - [16, 10902.0]
  - - [4096, 4030, 1, 1024, 4096, 4096, 1024, 1024]
    - [16, 8939.0]
  - - [4096, 3289, 1, 1024, 4096, 4096, 1024, 1024]
    - [18, 11106.0]
  - - [1024, 3459, 1, 4096, 1024, 1024, 4096, 4096]
    - [62, 8317.0]
  - - [1024, 2918, 1, 4096, 1024, 1024, 4096, 4096]
    - [60, 9503.0]
  - - [4096, 3489, 1, 1024, 4096, 4096, 1024, 1024]
    - [16, 10759.0]
  - - [4096, 3346, 1, 1024, 4096, 4096, 1024, 1024]
    - [16, 10575.0]
  - - [4096, 3572, 1, 1024, 4096, 4096, 1024, 1024]
    - [18, 10566.0]
  - - [1024, 3955, 1, 4096, 1024, 1024, 4096, 4096]
    - [62, 7876.0]
  - - [4096, 3236, 1, 1024, 4096, 4096, 1024, 1024]
    - [18, 10859.0]
  - - [4096, 3163, 1, 1024, 4096, 4096, 1024, 1024]
    - [16, 11236.0]
  - - [4096, 3468, 1, 1024, 4096, 4096, 1024, 1024]
    - [49, 10691.0]
  - - [1024, 3165, 1, 4096, 1024, 1024, 4096, 4096]
    - [58, 8283.0]
  - - [1024, 3276, 1, 4096, 1024, 1024, 4096, 4096]
    - [62, 8423.0]
  - - [1024, 3359, 1, 4096, 1024, 1024, 4096, 4096]
    - [62, 8690.0]
  - - [4096, 3363, 1, 1024, 4096, 4096, 1024, 1024]
    - [16, 10765.0]
  - - [1024, 3385, 1, 4096, 1024, 1024, 4096, 4096]
    - [62, 8398.0]
  - - [1024, 3207, 1, 4096, 1024, 1024, 4096, 4096]
    - [62, 8282.0]
  - - [1024, 3458, 1, 4096, 1024, 1024, 4096, 4096]
    - [62, 8197.0]
  - - [4096, 3110, 1, 1024, 4096, 4096, 1024, 1024]
    - [16, 11074.0]
  - - [4096, 3925, 1, 1024, 4096, 4096, 1024, 1024]
    - [16, 8952.0]
  - - [1024, 3975, 1, 4096, 1024, 1024, 4096, 4096]
    - [21, 8247.0]
  - - [4096, 3549, 1, 1024, 4096, 4096, 1024, 1024]
    - [16, 10676.0]
  - - [4096, 3342, 1, 1024, 4096, 4096, 1024, 1024]
    - [49, 9789.0]
  - - [1024, 3859, 1, 1024, 1024, 1024, 1024, 1024]
    - [38, 10060.0]
  - - [1024, 3497, 1, 4096, 1024, 1024, 4096, 4096]
    - [62, 8206.0]
  - - [4096, 3280, 1, 1024, 4096, 4096, 1024, 1024]
    - [18, 11000.0]
  - - [1024, 3435, 1, 4096, 1024, 1024, 4096, 4096]
    - [62, 8584.0]
  - - [1024, 3354, 1, 4096, 1024, 1024, 4096, 4096]
    - [62, 8412.0]
  - - [4096, 3191, 1, 1024, 4096, 4096, 1024, 1024]
    - [16, 11059.0]
  - - [4096, 3512, 1, 1024, 4096, 4096, 1024, 1024]
    - [18, 10726.0]
  - - [1024, 3055, 1, 4096, 1024, 1024, 4096, 4096]
    - [58, 9099.0]
  - - [4096, 2499, 1, 1024, 4096, 4096, 1024, 1024]
    - [18, 11272.0]
  - - [1024, 3233, 1, 4096, 1024, 1024, 4096, 4096]
    - [62, 8475.0]
  - - [4096, 3423, 1, 1024, 4096, 4096, 1024, 1024]
    - [18, 11143.0]
  - - [1024, 3319, 1, 4096, 1024, 1024, 4096, 4096]
    - [58, 9316.0]
  - - [4096, 3297, 1, 1024, 4096, 4096, 1024, 1024]
    - [16, 11083.0]
  - - [4096, 3154, 1, 1024, 4096, 4096, 1024, 1024]
    - [16, 10881.0]
  - - [1024, 3540, 1, 4096, 1024, 1024, 4096, 4096]
    - [62, 8251.0]
  - - [1024, 3289, 1, 4096, 1024, 1024, 4096, 4096]
    - [62, 8538.0]
  - - [4096, 3529, 1, 1024, 4096, 4096, 1024, 1024]
    - [27, 9865.0]
  - - [4096, 3386, 1, 1024, 4096, 4096, 1024, 1024]
    - [16, 10889.0]
  - - [4096, 3276, 1, 1024, 4096, 4096, 1024, 1024]
    - [18, 11113.0]
  - - [1024, 3244, 1, 4096, 1024, 1024, 4096, 4096]
    - [42, 8413.0]
  - - [1024, 3182, 1, 4096, 1024, 1024, 4096, 4096]
    - [60, 9354.0]
  - - [4096, 3540, 1, 1024, 4096, 4096, 1024, 1024]
    - [18, 10728.0]
  - - [1024, 3360, 1, 4096, 1024, 1024, 4096, 4096]
    - [62, 8375.0]
  - - [1024, 3942, 1, 4096, 1024, 1024, 4096, 4096]
    - [62, 8163.0]
  - - [4096, 3403, 1, 1024, 4096, 4096, 1024, 1024]
    - [16, 10082.0]
  - - [4096, 3101, 1, 1024, 4096, 4096, 1024, 1024]
    - [16, 10989.0]
  - - [4096, 2918, 1, 1024, 4096, 4096, 1024, 1024]
    - [16, 11521.0]
  - - [1024, 3465, 1, 4096, 1024, 1024, 4096, 4096]
    - [60, 10220.0]
  - - [33708, 3780, 1, 1024, 33708, 33708, 1024, 1024]
    - [40, 10667.0]
  - - [4096, 3557, 1, 1024, 4096, 4096, 1024, 1024]
    - [18, 10672.0]
  - - [4096, 3414, 1, 1024, 4096, 4096, 1024, 1024]
    - [16, 10880.0]
  - - [1024, 3948, 1, 1024, 1024, 1024, 1024, 1024]
    - [38, 10846.0]
  - - [4096, 3320, 1, 1024, 4096, 4096, 1024, 1024]
    - [16, 10926.0]
  - - [4096, 2765, 1, 1024, 4096, 4096, 1024, 1024]
    - [16, 11092.0]
  - - [1024, 3978, 1, 4096, 1024, 1024, 4096, 4096]
    - [17, 7973.0]
  - - [4096, 3487, 1, 1024, 4096, 4096, 1024, 1024]
    - [18, 10806.0]
  - - [4096, 3520, 1, 1024, 4096, 4096, 1024, 1024]
    - [18, 10364.0]
  - - [1024, 3139, 1, 4096, 1024, 1024, 4096, 4096]
    - [43, 8459.0]
  - - [1024, 3314, 1, 4096, 1024, 1024, 4096, 4096]
    - [62, 8419.0]
  - - [4096, 3431, 1, 1024, 4096, 4096, 1024, 1024]
    - [16, 10919.0]
  - - [1024, 3446, 1, 4096, 1024, 1024, 4096, 4096]
    - [42, 8534.0]
  - - [1024, 4059, 1, 4096, 1024, 1024, 4096, 4096]
    - [42, 7985.0]
  - - [4096, 3345, 1, 1024, 4096, 4096, 1024, 1024]
    - [16, 10723.0]
  - - [4096, 3394, 1, 1024, 4096, 4096, 1024, 1024]
    - [16, 10779.0]
  - - [1024, 3927, 1, 1024, 1024, 1024, 1024, 1024]
    - [38, 10312.0]
  - - [4096, 3235, 1, 1024, 4096, 4096, 1024, 1024]
    - [16, 11371.0]
  - - [1024, 3328, 1, 4096, 1024, 1024, 4096, 4096]
    - [62, 8457.0]
  - - [33708, 3956, 1, 1024, 33708, 33708, 1024, 1024]
    - [58, 10641.0]
  - - [4096, 3467, 1, 1024, 4096, 4096, 1024, 1024]
    - [16, 10628.0]
  - - [1024, 3287, 1, 4096, 1024, 1024, 4096, 4096]
    - [62, 8451.0]
  - - [4096, 3214, 1, 1024, 4096, 4096, 1024, 1024]
    - [16, 10894.0]
  - - [4096, 3910, 1, 1024, 4096, 4096, 1024, 1024]
    - [16, 9101.0]
  - - [1024, 3780, 1, 1024, 1024, 1024, 1024, 1024]
    - [40, 11202.0]
  - - [1024, 3371, 1, 4096, 1024, 1024, 4096, 4096]
    - [62, 8497.0]
  - - [4096, 3478, 1, 1024, 4096, 4096, 1024, 1024]
    - [16, 10660.0]
  - - [1024, 3546, 1, 4096, 1024, 1024, 4096, 4096]
    - [42, 8180.0]
  - - [1024, 4012, 1, 1024, 1024, 1024, 1024, 1024]
    - [38, 10389.0]
  - - [4096, 3341, 1, 1024, 4096, 4096, 1024, 1024]
    - [27, 10131.0]
  - - [4096, 3454, 1, 1024, 4096, 4096, 1024, 1024]
    - [16, 10893.0]
  - - [4096, 3295, 1, 1024, 4096, 4096, 1024, 1024]
    - [16, 11068.0]
  - - [4096, 3072, 1, 1024, 4096, 4096, 1024, 1024]
    - [16, 11282.0]
  - - [1024, 3282, 1, 4096, 1024, 1024, 4096, 4096]
    - [62, 8347.0]
  - - [33708, 3720, 1, 1024, 33708, 33708, 1024, 1024]
    - [60, 10694.0]
  - - [1024, 3681, 1, 4096, 1024, 1024, 4096, 4096]
    - [62, 8688.0]
  - - [1024, 4050, 1, 4096, 1024, 1024, 4096, 4096]
    - [42, 9490.0]
  - - [4096, 3495, 1, 1024, 4096, 4096, 1024, 1024]
    - [18, 10544.0]
  - - [4096, 3560, 1, 1024, 4096, 4096, 1024, 1024]
    - [16, 10615.0]
  - - [4096, 3751, 1, 1024, 4096, 4096, 1024, 1024]
    - [51, 10787.0]
  - - [1024, 3414, 1, 4096, 1024, 1024, 4096, 4096]
    - [62, 8798.0]
  - - [33708, 3860, 1, 1024, 33708, 33708, 1024, 1024]
    - [58, 10455.0]
  - - [1024, 3325, 1, 4096, 1024, 1024, 4096, 4096]
    - [62, 8543.0]
  - - [4096, 3458, 1, 1024, 4096, 4096, 1024, 1024]
    - [16, 10562.0]
  - - [4096, 2967, 1, 1024, 4096, 4096, 1024, 1024]
    - [16, 10932.0]
  - - [1024, 3519, 1, 4096, 1024, 1024, 4096, 4096]
    - [38, 9370.0]
  - - [4096, 3385, 1, 1024, 4096, 4096, 1024, 1024]
    - [16, 10725.0]
  - - [4096, 3434, 1, 1024, 4096, 4096, 1024, 1024]
    - [16, 10889.0]
  - - [1024, 3552, 1, 4096, 1024, 1024, 4096, 4096]
    - [62, 8443.0]
  - - [4096, 3822, 1, 1024, 4096, 4096, 1024, 1024]
    - [16, 9754.0]
  - - [1024, 3544, 1, 4096, 1024, 1024, 4096, 4096]
    - [62, 8358.0]
  - - [4096, 3539, 1, 1024, 4096, 4096, 1024, 1024]
    - [18, 10626.0]
  - - [4096, 3332, 1, 1024, 4096, 4096, 1024, 1024]
    - [16, 10576.0]
  - - [1024, 3145, 1, 4096, 1024, 1024, 4096, 4096]
    - [42, 8686.0]
  - - [1024, 3535, 1, 4096, 1024, 1024, 4096, 4096]
    - [62, 8253.0]
  - - [1024, 3320, 1, 4096, 1024, 1024, 4096, 4096]
    - [62, 8744.0]
  - - [33708, 4012, 1, 1024, 33708, 33708, 1024, 1024]
    - [58, 11744.0]
  - - [4096, 3286, 1, 1024, 4096, 4096, 1024, 1024]
    - [16, 11149.0]
  - - [1024, 3514, 1, 4096, 1024, 1024, 4096, 4096]
    - [62, 8280.0]
  - - [1024, 2765, 1, 4096, 1024, 1024, 4096, 4096]
    - [40, 9700.0]
  - - [1024, 3452, 1, 4096, 1024, 1024, 4096, 4096]
    - [20, 9043.0]
  - - [4096, 3518, 1, 1024, 4096, 4096, 1024, 1024]
    - [16, 10834.0]
  - - [1024, 3529, 1, 4096, 1024, 1024, 4096, 4096]
    - [62, 8393.0]
  - - [4096, 3413, 1, 1024, 4096, 4096, 1024, 1024]
    - [16, 10910.0]
  - - [33708, 4050, 1, 1024, 33708, 33708, 1024, 1024]
    - [60, 10923.0]
  - - [1024, 3525, 1, 4096, 1024, 1024, 4096, 4096]
    - [38, 9239.0]
  - - [4096, 3303, 1, 1024, 4096, 4096, 1024, 1024]
    - [18, 11083.0]
  - - [1024, 3382, 1, 4096, 1024, 1024, 4096, 4096]
    - [62, 8488.0]
  - - [1024, 3390, 1, 4096, 1024, 1024, 4096, 4096]
    - [17, 8674.0]
  - - [1024, 3977, 1, 4096, 1024, 1024, 4096, 4096]
    - [37, 7898.0]
  - - [1024, 3184, 1, 4096, 1024, 1024, 4096, 4096]
    - [31, 9372.0]
  - - [4096, 3535, 1, 1024, 4096, 4096, 1024, 1024]
    - [16, 10868.0]
  - - [4096, 3376, 1, 1024, 4096, 4096, 1024, 1024]
    - [16, 10698.0]
  - - [4096, 3978, 1, 1024, 4096, 4096, 1024, 1024]
    - [16, 8750.0]
  - - [1024, 3136, 1, 4096, 1024, 1024, 4096, 4096]
    - [62, 8516.0]
  - - [1024, 3293, 1, 4096, 1024, 1024, 4096, 4096]
    - [62, 8414.0]
  - - [4096, 3266, 1, 1024, 4096, 4096, 1024, 1024]
    - [16, 11481.0]
  - - [1024, 3487, 1, 4096, 1024, 1024, 4096, 4096]
    - [62, 8312.0]
  - - [1024, 3409, 1, 4096, 1024, 1024, 4096, 4096]
    - [62, 8573.0]
  - - [4096, 3498, 1, 1024, 4096, 4096, 1024, 1024]
    - [16, 10703.0]
  - - [1024, 3520, 1, 4096, 1024, 1024, 4096, 4096]
    - [9, 8801.0]
  - - [1024, 3530, 1, 4096, 1024, 1024, 4096, 4096]
    - [62, 8400.0]
  - - [4096, 3393, 1, 1024, 4096, 4096, 1024, 1024]
    - [18, 10578.0]
  - - [4096, 3140, 1, 1024, 4096, 4096, 1024, 1024]
    - [16, 11078.0]
  - - [1024, 3536, 1, 4096, 1024, 1024, 4096, 4096]
    - [62, 8396.0]
  - - [1024, 3288, 1, 4096, 1024, 1024, 4096, 4096]
    - [62, 8444.0]
  - - [1024, 4005, 1, 4096, 1024, 1024, 4096, 4096]
    - [7, 8421.0]
  - - [1024, 3579, 1, 4096, 1024, 1024, 4096, 4096]
    - [18, 8467.0]
  - - [4096, 3372, 1, 1024, 4096, 4096, 1024, 1024]
    - [16, 10727.0]
  - - [1024, 3440, 1, 4096, 1024, 1024, 4096, 4096]
    - [62, 8515.0]
  - - [4096, 3213, 1, 1024, 4096, 4096, 1024, 1024]
    - [18, 10900.0]
  - - [4096, 3477, 1, 1024, 4096, 4096, 1024, 1024]
    - [16, 10672.0]
  - - [4096, 3526, 1, 1024, 4096, 4096, 1024, 1024]
    - [18, 10788.0]
  - - [1024, 3493, 1, 4096, 1024, 1024, 4096, 4096]
    - [60, 10299.0]
  - - [1024, 3944, 1, 4096, 1024, 1024, 4096, 4096]
    - [62, 7909.0]
  - - [4096, 3453, 1, 1024, 4096, 4096, 1024, 1024]
    - [16, 10950.0]
  - - [1024, 3350, 1, 4096, 1024, 1024, 4096, 4096]
    - [10, 8531.0]
  - - [4096, 3184, 1, 1024, 4096, 4096, 1024, 1024]
    - [16, 10828.0]
  - - [1024, 3423, 1, 4096, 1024, 1024, 4096, 4096]
    - [62, 8678.0]
  - - [4096, 3351, 1, 1024, 4096, 4096, 1024, 1024]
    - [16, 10548.0]
  - - [4096, 3416, 1, 1024, 4096, 4096, 1024, 1024]
    - [16, 10795.0]
  - - [1024, 3796, 1, 4096, 1024, 1024, 4096, 4096]
    - [40, 10563.0]
  - - [4096, 3257, 1, 1024, 4096, 4096, 1024, 1024]
    - [16, 11011.0]
  - - [4096, 3306, 1, 1024, 4096, 4096, 1024, 1024]
    - [16, 10989.0]
  - - [33708, 4020, 1, 1024, 33708, 33708, 1024, 1024]
    - [60, 10792.0]
  - - [1024, 3426, 1, 4096, 1024, 1024, 4096, 4096]
    - [62, 8497.0]
  - - [4096, 3457, 1, 1024, 4096, 4096, 1024, 1024]
    - [18, 11167.0]
  - - [1024, 2935, 1, 4096, 1024, 1024, 4096, 4096]
    - [60, 9697.0]
  - - [1024, 3046, 1, 4096, 1024, 1024, 4096, 4096]
    - [58, 9226.0]
  - - [4096, 3433, 1, 1024, 4096, 4096, 1024, 1024]
    - [16, 10897.0]
  - - [1024, 3256, 1, 4096, 1024, 1024, 4096, 4096]
    - [63, 8406.0]
  - - [1024, 3531, 1, 4096, 1024, 1024, 4096, 4096]
    - [62, 8924.0]
  - - [4096, 3180, 1, 1024, 4096, 4096, 1024, 1024]
    - [16, 11263.0]
  - - [1024, 3388, 1, 4096, 1024, 1024, 4096, 4096]
    - [62, 8580.0]
  - - [4096, 3444, 1, 1024, 4096, 4096, 1024, 1024]
    - [16, 10670.0]
  - - [1024, 3501, 1, 4096, 1024, 1024, 4096, 4096]
    - [62, 8293.0]
  - - [1024, 3266, 1, 4096, 1024, 1024, 4096, 4096]
    - [62, 8337.0]
  - - [1024, 3267, 1, 4096, 1024, 1024, 4096, 4096]
    - [62, 8341.0]
  - - [1024, 3461, 1, 4096, 1024, 1024, 4096, 4096]
    - [62, 8155.0]
  - - [4096, 3870, 1, 1024, 4096, 4096, 1024, 1024]
    - [16, 9046.0]
  - - [4096, 3517, 1, 1024, 4096, 4096, 1024, 1024]
    - [16, 10663.0]
  - - [1024, 3566, 1, 4096, 1024, 1024, 4096, 4096]
    - [62, 8438.0]
  - - [4096, 3574, 1, 1024, 4096, 4096, 1024, 1024]
    - [18, 10358.0]
  - - [1024, 3876, 1, 1024, 1024, 1024, 1024, 1024]
    - [38, 10172.0]
  - - [4096, 3720, 1, 1024, 4096, 4096, 1024, 1024]
    - [16, 9169.0]
  - - [4096, 3248, 1, 1024, 4096, 4096, 1024, 1024]
    - [16, 10935.0]
  - - [4096, 4059, 1, 1024, 4096, 4096, 1024, 1024]
    - [16, 8705.0]
  - - [1024, 3380, 1, 4096, 1024, 1024, 4096, 4096]
    - [42, 8318.0]
  - - [4096, 3480, 1, 1024, 4096, 4096, 1024, 1024]
    - [16, 10665.0]
  - - [1024, 3335, 1, 4096, 1024, 1024, 4096, 4096]
    - [62, 8321.0]
  - - [1024, 3345, 1, 4096, 1024, 1024, 4096, 4096]
    - [62, 8367.0]
  - - [4096, 3391, 1, 1024, 4096, 4096, 1024, 1024]
    - [16, 10803.0]
  - - [4096, 3424, 1, 1024, 4096, 4096, 1024, 1024]
    - [16, 10811.0]
  - - [1024, 3394, 1, 4096, 1024, 1024, 4096, 4096]
    - [62, 8446.0]
  - - [4096, 3265, 1, 1024, 4096, 4096, 1024, 1024]
    - [18, 11060.0]
  - - [1024, 3014, 1, 4096, 1024, 1024, 4096, 4096]
    - [40, 9348.0]
  - - [4096, 3497, 1, 1024, 4096, 4096, 1024, 1024]
    - [17, 10185.0]
  - - [4096, 3354, 1, 1024, 4096, 4096, 1024, 1024]
    - [16, 10693.0]
  - - [4096, 3055, 1, 1024, 4096, 4096, 1024, 1024]
    - [18, 11248.0]
  - - [1024, 3499, 1, 4096, 1024, 1024, 4096, 4096]
    - [62, 8505.0]
  - - [1024, 3162, 1, 4096, 1024, 1024, 4096, 4096]
    - [31, 8459.0]
  - - [4096, 3244, 1, 1024, 4096, 4096, 1024, 1024]
    - [18, 11002.0]
  - - [1024, 3437, 1, 4096, 1024, 1024, 4096, 4096]
    - [62, 8746.0]
  - - [1024, 3356, 1, 4096, 1024, 1024, 4096, 4096]
    - [62, 8299.0]
  - - [4096, 3139, 1, 1024, 4096, 4096, 1024, 1024]
    - [16, 11169.0]
  - - [4096, 3508, 1, 1024, 4096, 4096, 1024, 1024]
    - [16, 10623.0]
  - - [1024, 3235, 1, 4096, 1024, 1024, 4096, 4096]
    - [62, 8296.0]
  - - [1024, 3910, 1, 4096, 1024, 1024, 4096, 4096]
    - [62, 7939.0]
  - - [4096, 3371, 1, 1024, 4096, 4096, 1024, 1024]
    - [16, 10695.0]
  - - [1024, 3751, 1, 4096, 1024, 1024, 4096, 4096]
    - [42, 8554.0]
  - - [4096, 3325, 1, 1024, 4096, 4096, 1024, 1024]
    - [16, 11028.0]
  - - [1024, 3413, 1, 4096, 1024, 1024, 4096, 4096]
    - [62, 8782.0]
  - - [1024, 3542, 1, 4096, 1024, 1024, 4096, 4096]
    - [62, 8289.0]
  - - [33708, 3900, 1, 1024, 33708, 33708, 1024, 1024]
    - [58, 10674.0]
  - - [4096, 3525, 1, 1024, 4096, 4096, 1024, 1024]
    - [16, 10774.0]
  - - [4096, 3382, 1, 1024, 4096, 4096, 1024, 1024]
    - [18, 11033.0]
  - - [1024, 3339, 1, 4096, 1024, 1024, 4096, 4096]
    - [62, 8370.0]
  - - [4096, 3288, 1, 1024, 4096, 4096, 1024, 1024]
    - [18, 11061.0]
  - - [1024, 3141, 1, 4096, 1024, 1024, 4096, 4096]
    - [39, 9268.0]
  - - [1024, 3168, 1, 4096, 1024, 1024, 4096, 4096]
    - [31, 8493.0]
  - - [4096, 3488, 1, 1024, 4096, 4096, 1024, 1024]
    - [17, 10270.0]
  - - [4096, 3046, 1, 1024, 4096, 4096, 1024, 1024]
    - [18, 11227.0]
  - - [1024, 3362, 1, 4096, 1024, 1024, 4096, 4096]
    - [62, 8563.0]
  - - [33708, 3942, 1, 1024, 33708, 33708, 1024, 1024]
    - [60, 11661.0]
  - - [4096, 3399, 1, 1024, 4096, 4096, 1024, 1024]
    - [16, 10782.0]
  - - [1024, 3720, 1, 1024, 1024, 1024, 1024, 1024]
    - [40, 10604.0]
  - - [4096, 3563, 1, 1024, 4096, 4096, 1024, 1024]
    - [16, 10707.0]
  - - [1024, 3273, 1, 4096, 1024, 1024, 4096, 4096]
    - [39, 9091.0]
  - - [4096, 3162, 1, 1024, 4096, 4096, 1024, 1024]
    - [16, 11056.0]
  - - [1024, 3467, 1, 4096, 1024, 1024, 4096, 4096]
    - [62, 8351.0]
  - - [1024, 3130, 1, 4096, 1024, 1024, 4096, 4096]
    - [62, 8778.0]
  - - [1024, 3405, 1, 4096, 1024, 1024, 4096, 4096]
    - [62, 8658.0]
  - - [4096, 3362, 1, 1024, 4096, 4096, 1024, 1024]
    - [16, 10739.0]
  - - [1024, 3960, 1, 1024, 1024, 1024, 1024, 1024]
    - [38, 10280.0]
  - - [1024, 3712, 1, 36548, 1024, 1024, 36548, 36548]
    - [3, 11677.0]
  - - [1024, 3712, 1, 1024, 1024, 1024, 1024, 1024]
    - [40, 10552.0]
  - - [4032, 384, 1, 64, 4032, 4032, 64, 64]
    - [55, 5586.0]
  - - [1024, 2048, 1, 49, 1024, 1024, 49, 49]
    - [0, 5677.0]
  - - [4608, 512, 1, 49, 4608, 4608, 49, 49]
    - [24, 5928.0]
  - - [9216, 512, 1, 4096, 9216, 9216, 4096, 4096]
    - [62, 5739.0]
  - - [3456, 384, 1, 289, 3456, 3456, 289, 289]
    - [22, 7378.0]
  - - [3456, 384, 1, 169, 3456, 3456, 169, 169]
    - [44, 8108.0]
  - - [4096, 512, 1, 1001, 4096, 4096, 1001, 1001]
    - [34, 10597.0]
  - - [384, 448, 49, 512, 384, 384, 512, 512]
    - [38, 9787.0]
  - - [384, 448, 64, 256, 384, 384, 256, 256]
    - [58, 9874.0]
  - - [384, 448, 36, 256, 384, 384, 256, 256]
    - [58, 9670.0]
  - - [384, 448, 49, 256, 384, 384, 256, 256]
    - [49, 9869.0]
  - - [384, 448, 64, 512, 384, 384, 512, 512]
    - [38, 10128.0]
  - - [384, 448, 36, 512, 384, 384, 512, 512]
    - [16, 9852.0]
  - - [1024, 6400, 1, 65, 1024, 1024, 65, 65]
    - [11, 7585.0]
  - - [4096, 6400, 1, 256, 4096, 4096, 256, 256]
    - [16, 11680.0]
  - - [512, 3194, 1, 2048, 512, 512, 2048, 2048]
    - [58, 9813.0]
  - - [512, 3222, 1, 2048, 512, 512, 2048, 2048]
    - [18, 9777.0]
  - - [512, 3234, 1, 2048, 512, 512, 2048, 2048]
    - [40, 9821.0]
  - - [512, 3242, 1, 2048, 512, 512, 2048, 2048]
    - [40, 9822.0]
  - - [512, 3257, 1, 2048, 512, 512, 2048, 2048]
    - [60, 9763.0]
  - - [512, 3332, 1, 2048, 512, 512, 2048, 2048]
    - [18, 10145.0]
  - - [512, 3336, 1, 2048, 512, 512, 2048, 2048]
    - [60, 9666.0]
  - - [512, 3378, 1, 2048, 512, 512, 2048, 2048]
    - [18, 10238.0]
  - - [512, 3396, 1, 2048, 512, 512, 2048, 2048]
    - [16, 9825.0]
  - - [512, 3399, 1, 2048, 512, 512, 2048, 2048]
    - [18, 10276.0]
  - - [512, 3451, 1, 2048, 512, 512, 2048, 2048]
    - [18, 10461.0]
  - - [512, 3456, 1, 2048, 512, 512, 2048, 2048]
    - [40, 10463.0]
  - - [512, 3458, 1, 2048, 512, 512, 2048, 2048]
    - [40, 10438.0]
  - - [512, 3467, 1, 2048, 512, 512, 2048, 2048]
    - [60, 10390.0]
  - - [512, 3468, 1, 2048, 512, 512, 2048, 2048]
    - [40, 10441.0]
  - - [512, 3470, 1, 2048, 512, 512, 2048, 2048]
    - [60, 10121.0]
  - - [512, 3477, 1, 2048, 512, 512, 2048, 2048]
    - [60, 10469.0]
  - - [512, 3478, 1, 2048, 512, 512, 2048, 2048]
    - [60, 10012.0]
  - - [512, 3495, 1, 2048, 512, 512, 2048, 2048]
    - [18, 10533.0]
  - - [512, 3507, 1, 2048, 512, 512, 2048, 2048]
    - [18, 10633.0]
  - - [512, 3515, 1, 2048, 512, 512, 2048, 2048]
    - [40, 10488.0]
  - - [512, 3517, 1, 2048, 512, 512, 2048, 2048]
    - [40, 10586.0]
  - - [2048, 2864, 1, 512, 2048, 2048, 512, 512]
    - [49, 10270.0]
  - - [2048, 3287, 1, 512, 2048, 2048, 512, 512]
    - [16, 10832.0]
  - - [2048, 3412, 1, 512, 2048, 2048, 512, 512]
    - [38, 9778.0]
  - - [2048, 3456, 1, 512, 2048, 2048, 512, 512]
    - [16, 11006.0]
  - - [2048, 3466, 1, 512, 2048, 2048, 512, 512]
    - [16, 10572.0]
  - - [2048, 3476, 1, 512, 2048, 2048, 512, 512]
    - [27, 10671.0]
  - - [2048, 3999, 1, 512, 2048, 2048, 512, 512]
    - [18, 10942.0]
  - - [33708, 189, 1, 512, 33708, 33708, 512, 512]
    - [57, 9292.0]
  - - [33708, 2496, 1, 512, 33708, 33708, 512, 512]
    - [16, 8803.0]
  - - [33708, 3864, 1, 512, 33708, 33708, 512, 512]
    - [38, 9603.0]
  - - [33708, 3969, 1, 512, 33708, 33708, 512, 512]
    - [18, 11083.0]
  - - [33708, 3995, 1, 512, 33708, 33708, 512, 512]
    - [18, 9808.0]
  - - [134, 134, 240, 64, 134, 134, 64, 64]
    - [44, 3022.0]
  - - [135, 134, 240, 64, 135, 135, 64, 64]
    - [44, 3709.0]
  - - [135, 135, 240, 64, 135, 135, 64, 64]
    - [44, 3681.0]
  - - [512, 2790, 1, 2048, 512, 512, 2048, 2048]
    - [38, 9603.0]
  - - [512, 2864, 1, 2048, 512, 512, 2048, 2048]
    - [58, 9850.0]
  - - [512, 3092, 1, 2048, 512, 512, 2048, 2048]
    - [38, 10565.0]
  - - [512, 3113, 1, 2048, 512, 512, 2048, 2048]
    - [38, 9532.0]
  - - [512, 3137, 1, 2048, 512, 512, 2048, 2048]
    - [38, 10755.0]
  - - [512, 3165, 1, 2048, 512, 512, 2048, 2048]
    - [16, 10696.0]
  - - [512, 3166, 1, 2048, 512, 512, 2048, 2048]
    - [58, 10762.0]
  - - [512, 3219, 1, 2048, 512, 512, 2048, 2048]
    - [60, 9843.0]
  - - [512, 3237, 1, 2048, 512, 512, 2048, 2048]
    - [60, 9352.0]
  - - [512, 3246, 1, 2048, 512, 512, 2048, 2048]
    - [18, 9837.0]
  - - [512, 3249, 1, 2048, 512, 512, 2048, 2048]
    - [18, 9871.0]
  - - [512, 3251, 1, 2048, 512, 512, 2048, 2048]
    - [40, 9780.0]
  - - [512, 3262, 1, 2048, 512, 512, 2048, 2048]
    - [40, 9857.0]
  - - [512, 3268, 1, 2048, 512, 512, 2048, 2048]
    - [60, 9808.0]
  - - [512, 3282, 1, 2048, 512, 512, 2048, 2048]
    - [18, 9924.0]
  - - [512, 3286, 1, 2048, 512, 512, 2048, 2048]
    - [60, 9414.0]
  - - [512, 3287, 1, 2048, 512, 512, 2048, 2048]
    - [60, 9901.0]
  - - [512, 3293, 1, 2048, 512, 512, 2048, 2048]
    - [18, 9974.0]
  - - [512, 3297, 1, 2048, 512, 512, 2048, 2048]
    - [60, 9949.0]
  - - [512, 3307, 1, 2048, 512, 512, 2048, 2048]
    - [18, 9767.0]
  - - [512, 3314, 1, 2048, 512, 512, 2048, 2048]
    - [60, 9925.0]
  - - [512, 3315, 1, 2048, 512, 512, 2048, 2048]
    - [60, 10025.0]
  - - [512, 3319, 1, 2048, 512, 512, 2048, 2048]
    - [60, 9930.0]
  - - [512, 3322, 1, 2048, 512, 512, 2048, 2048]
    - [60, 10000.0]
  - - [512, 3323, 1, 2048, 512, 512, 2048, 2048]
    - [60, 9530.0]
  - - [512, 3324, 1, 2048, 512, 512, 2048, 2048]
    - [18, 10075.0]
  - - [512, 3325, 1, 2048, 512, 512, 2048, 2048]
    - [18, 10033.0]
  - - [512, 3327, 1, 2048, 512, 512, 2048, 2048]
    - [60, 10005.0]
  - - [512, 3329, 1, 2048, 512, 512, 2048, 2048]
    - [40, 10064.0]
  - - [512, 3339, 1, 2048, 512, 512, 2048, 2048]
    - [60, 10033.0]
  - - [512, 3342, 1, 2048, 512, 512, 2048, 2048]
    - [18, 10149.0]
  - - [512, 3344, 1, 2048, 512, 512, 2048, 2048]
    - [60, 9730.0]
  - - [512, 3358, 1, 2048, 512, 512, 2048, 2048]
    - [40, 10147.0]
  - - [512, 3360, 1, 2048, 512, 512, 2048, 2048]
    - [16, 9774.0]
  - - [512, 3364, 1, 2048, 512, 512, 2048, 2048]
    - [40, 10156.0]
  - - [512, 3365, 1, 2048, 512, 512, 2048, 2048]
    - [18, 10214.0]
  - - [512, 3369, 1, 2048, 512, 512, 2048, 2048]
    - [40, 10159.0]
  - - [512, 3371, 1, 2048, 512, 512, 2048, 2048]
    - [40, 10198.0]
  - - [512, 3374, 1, 2048, 512, 512, 2048, 2048]
    - [60, 10137.0]
  - - [512, 3376, 1, 2048, 512, 512, 2048, 2048]
    - [18, 10215.0]
  - - [512, 3377, 1, 2048, 512, 512, 2048, 2048]
    - [60, 9747.0]
  - - [512, 3381, 1, 2048, 512, 512, 2048, 2048]
    - [18, 10232.0]
  - - [512, 3382, 1, 2048, 512, 512, 2048, 2048]
    - [18, 10234.0]
  - - [512, 3383, 1, 2048, 512, 512, 2048, 2048]
    - [40, 10199.0]
  - - [512, 3384, 1, 2048, 512, 512, 2048, 2048]
    - [18, 10216.0]
  - - [512, 3385, 1, 2048, 512, 512, 2048, 2048]
    - [40, 10211.0]
  - - [512, 3386, 1, 2048, 512, 512, 2048, 2048]
    - [18, 10218.0]
  - - [512, 3388, 1, 2048, 512, 512, 2048, 2048]
    - [60, 10210.0]
  - - [512, 3390, 1, 2048, 512, 512, 2048, 2048]
    - [60, 10253.0]
  - - [512, 3391, 1, 2048, 512, 512, 2048, 2048]
    - [60, 9785.0]
  - - [512, 3402, 1, 2048, 512, 512, 2048, 2048]
    - [60, 10270.0]
  - - [512, 3410, 1, 2048, 512, 512, 2048, 2048]
    - [18, 10350.0]
  - - [512, 3412, 1, 2048, 512, 512, 2048, 2048]
    - [40, 10289.0]
  - - [512, 3414, 1, 2048, 512, 512, 2048, 2048]
    - [18, 10324.0]
  - - [512, 3415, 1, 2048, 512, 512, 2048, 2048]
    - [40, 10301.0]
  - - [512, 3418, 1, 2048, 512, 512, 2048, 2048]
    - [18, 10332.0]
  - - [512, 3420, 1, 2048, 512, 512, 2048, 2048]
    - [40, 10240.0]
  - - [512, 3422, 1, 2048, 512, 512, 2048, 2048]
    - [40, 10353.0]
  - - [512, 3425, 1, 2048, 512, 512, 2048, 2048]
    - [60, 10342.0]
  - - [512, 3426, 1, 2048, 512, 512, 2048, 2048]
    - [18, 10400.0]
  - - [512, 3427, 1, 2048, 512, 512, 2048, 2048]
    - [60, 9853.0]
  - - [512, 3428, 1, 2048, 512, 512, 2048, 2048]
    - [18, 10371.0]
  - - [512, 3430, 1, 2048, 512, 512, 2048, 2048]
    - [18, 10415.0]
  - - [512, 3431, 1, 2048, 512, 512, 2048, 2048]
    - [40, 10329.0]
  - - [512, 3432, 1, 2048, 512, 512, 2048, 2048]
    - [40, 10357.0]
  - - [512, 3438, 1, 2048, 512, 512, 2048, 2048]
    - [60, 10353.0]
  - - [512, 3439, 1, 2048, 512, 512, 2048, 2048]
    - [18, 10398.0]
  - - [512, 3440, 1, 2048, 512, 512, 2048, 2048]
    - [60, 10338.0]
  - - [512, 3443, 1, 2048, 512, 512, 2048, 2048]
    - [18, 10404.0]
  - - [512, 3445, 1, 2048, 512, 512, 2048, 2048]
    - [60, 9942.0]
  - - [512, 3447, 1, 2048, 512, 512, 2048, 2048]
    - [40, 10455.0]
  - - [512, 3448, 1, 2048, 512, 512, 2048, 2048]
    - [18, 10373.0]
  - - [512, 3450, 1, 2048, 512, 512, 2048, 2048]
    - [40, 10430.0]
  - - [512, 3452, 1, 2048, 512, 512, 2048, 2048]
    - [40, 10404.0]
  - - [512, 3453, 1, 2048, 512, 512, 2048, 2048]
    - [60, 10320.0]
  - - [512, 3455, 1, 2048, 512, 512, 2048, 2048]
    - [18, 10437.0]
  - - [512, 3457, 1, 2048, 512, 512, 2048, 2048]
    - [60, 10392.0]
  - - [512, 3459, 1, 2048, 512, 512, 2048, 2048]
    - [18, 10482.0]
  - - [512, 3460, 1, 2048, 512, 512, 2048, 2048]
    - [60, 9943.0]
  - - [512, 3461, 1, 2048, 512, 512, 2048, 2048]
    - [18, 10471.0]
  - - [512, 3462, 1, 2048, 512, 512, 2048, 2048]
    - [18, 10513.0]
  - - [512, 3466, 1, 2048, 512, 512, 2048, 2048]
    - [40, 10501.0]
  - - [512, 3471, 1, 2048, 512, 512, 2048, 2048]
    - [18, 10315.0]
  - - [512, 3472, 1, 2048, 512, 512, 2048, 2048]
    - [60, 10411.0]
  - - [512, 3475, 1, 2048, 512, 512, 2048, 2048]
    - [40, 10488.0]
  - - [512, 3476, 1, 2048, 512, 512, 2048, 2048]
    - [60, 10434.0]
  - - [512, 3479, 1, 2048, 512, 512, 2048, 2048]
    - [40, 10468.0]
  - - [512, 3480, 1, 2048, 512, 512, 2048, 2048]
    - [60, 9996.0]
  - - [512, 3481, 1, 2048, 512, 512, 2048, 2048]
    - [18, 10525.0]
  - - [512, 3483, 1, 2048, 512, 512, 2048, 2048]
    - [18, 10576.0]
  - - [512, 3484, 1, 2048, 512, 512, 2048, 2048]
    - [40, 10499.0]
  - - [512, 3487, 1, 2048, 512, 512, 2048, 2048]
    - [18, 10514.0]
  - - [512, 3489, 1, 2048, 512, 512, 2048, 2048]
    - [40, 10544.0]
  - - [512, 3490, 1, 2048, 512, 512, 2048, 2048]
    - [40, 10541.0]
  - - [512, 3491, 1, 2048, 512, 512, 2048, 2048]
    - [60, 10391.0]
  - - [512, 3493, 1, 2048, 512, 512, 2048, 2048]
    - [18, 10551.0]
  - - [512, 3494, 1, 2048, 512, 512, 2048, 2048]
    - [60, 10008.0]
  - - [512, 3497, 1, 2048, 512, 512, 2048, 2048]
    - [60, 10255.0]
  - - [512, 3498, 1, 2048, 512, 512, 2048, 2048]
    - [18, 10403.0]
  - - [512, 3499, 1, 2048, 512, 512, 2048, 2048]
    - [60, 10550.0]
  - - [512, 3501, 1, 2048, 512, 512, 2048, 2048]
    - [18, 10535.0]
  - - [512, 3503, 1, 2048, 512, 512, 2048, 2048]
    - [60, 10421.0]
  - - [512, 3508, 1, 2048, 512, 512, 2048, 2048]
    - [18, 10561.0]
  - - [512, 3509, 1, 2048, 512, 512, 2048, 2048]
    - [60, 10460.0]
  - - [512, 3511, 1, 2048, 512, 512, 2048, 2048]
    - [40, 10565.0]
  - - [512, 3514, 1, 2048, 512, 512, 2048, 2048]
    - [60, 10102.0]
  - - [512, 3518, 1, 2048, 512, 512, 2048, 2048]
    - [40, 10635.0]
  - - [512, 3519, 1, 2048, 512, 512, 2048, 2048]
    - [16, 10172.0]
  - - [512, 3520, 1, 2048, 512, 512, 2048, 2048]
    - [60, 10546.0]
  - - [512, 3523, 1, 2048, 512, 512, 2048, 2048]
    - [18, 10606.0]
  - - [512, 3528, 1, 2048, 512, 512, 2048, 2048]
    - [40, 10589.0]
  - - [512, 3529, 1, 2048, 512, 512, 2048, 2048]
    - [18, 10649.0]
  - - [512, 3530, 1, 2048, 512, 512, 2048, 2048]
    - [40, 10578.0]
  - - [512, 3532, 1, 2048, 512, 512, 2048, 2048]
    - [18, 10606.0]
  - - [512, 3533, 1, 2048, 512, 512, 2048, 2048]
    - [60, 10542.0]
  - - [512, 3534, 1, 2048, 512, 512, 2048, 2048]
    - [18, 10647.0]
  - - [512, 3538, 1, 2048, 512, 512, 2048, 2048]
    - [60, 10586.0]
  - - [512, 3539, 1, 2048, 512, 512, 2048, 2048]
    - [60, 10601.0]
  - - [512, 3541, 1, 2048, 512, 512, 2048, 2048]
    - [60, 10148.0]
  - - [512, 3547, 1, 2048, 512, 512, 2048, 2048]
    - [18, 10648.0]
  - - [512, 3548, 1, 2048, 512, 512, 2048, 2048]
    - [18, 10637.0]
  - - [512, 3552, 1, 2048, 512, 512, 2048, 2048]
    - [60, 10584.0]
  - - [512, 3564, 1, 2048, 512, 512, 2048, 2048]
    - [18, 10495.0]
  - - [512, 3575, 1, 2048, 512, 512, 2048, 2048]
    - [40, 10690.0]
  - - [512, 3598, 1, 2048, 512, 512, 2048, 2048]
    - [40, 10853.0]
  - - [512, 3599, 1, 2048, 512, 512, 2048, 2048]
    - [60, 10794.0]
  - - [512, 3608, 1, 2048, 512, 512, 2048, 2048]
    - [18, 10796.0]
  - - [512, 3780, 1, 512, 512, 512, 512, 512]
    - [58, 9815.0]
  - - [512, 3780, 1, 2048, 512, 512, 2048, 2048]
    - [18, 11227.0]
  - - [512, 3796, 1, 512, 512, 512, 512, 512]
    - [18, 9991.0]
  - - [512, 3796, 1, 2048, 512, 512, 2048, 2048]
    - [18, 11360.0]
  - - [512, 3822, 1, 512, 512, 512, 512, 512]
    - [34, 9898.0]
  - - [512, 3822, 1, 2048, 512, 512, 2048, 2048]
    - [40, 11426.0]
  - - [512, 3840, 1, 512, 512, 512, 512, 512]
    - [40, 10451.0]
  - - [512, 3840, 1, 2048, 512, 512, 2048, 2048]
    - [60, 11455.0]
  - - [512, 3859, 1, 512, 512, 512, 512, 512]
    - [59, 8533.0]
  - - [512, 3859, 1, 2048, 512, 512, 2048, 2048]
    - [16, 9772.0]
  - - [512, 3870, 1, 512, 512, 512, 512, 512]
    - [38, 9203.0]
  - - [512, 3870, 1, 2048, 512, 512, 2048, 2048]
    - [38, 9820.0]
  - - [512, 3876, 1, 512, 512, 512, 512, 512]
    - [34, 9219.0]
  - - [512, 3876, 1, 2048, 512, 512, 2048, 2048]
    - [58, 9723.0]
  - - [512, 3906, 1, 512, 512, 512, 512, 512]
    - [38, 9307.0]
  - - [512, 3906, 1, 2048, 512, 512, 2048, 2048]
    - [16, 9836.0]
  - - [512, 3910, 1, 512, 512, 512, 512, 512]
    - [34, 9313.0]
  - - [512, 3910, 1, 2048, 512, 512, 2048, 2048]
    - [38, 9896.0]
  - - [512, 3925, 1, 512, 512, 512, 512, 512]
    - [34, 9354.0]
  - - [512, 3925, 1, 2048, 512, 512, 2048, 2048]
    - [58, 9811.0]
  - - [512, 3927, 1, 512, 512, 512, 512, 512]
    - [38, 9398.0]
  - - [512, 3942, 1, 512, 512, 512, 512, 512]
    - [54, 9359.0]
  - - [512, 3942, 1, 2048, 512, 512, 2048, 2048]
    - [38, 9711.0]
  - - [512, 3944, 1, 512, 512, 512, 512, 512]
    - [38, 9338.0]
  - - [512, 3944, 1, 2048, 512, 512, 2048, 2048]
    - [38, 9995.0]
  - - [512, 3955, 1, 512, 512, 512, 512, 512]
    - [58, 9344.0]
  - - [512, 3955, 1, 2048, 512, 512, 2048, 2048]
    - [58, 9923.0]
  - - [512, 3968, 1, 512, 512, 512, 512, 512]
    - [34, 9606.0]
  - - [512, 3968, 1, 2048, 512, 512, 2048, 2048]
    - [16, 10139.0]
  - - [512, 3969, 1, 512, 512, 512, 512, 512]
    - [39, 8828.0]
  - - [512, 3969, 1, 2048, 512, 512, 2048, 2048]
    - [38, 10065.0]
  - - [512, 3976, 1, 512, 512, 512, 512, 512]
    - [58, 9119.0]
  - - [512, 3976, 1, 2048, 512, 512, 2048, 2048]
    - [38, 10084.0]
  - - [512, 3977, 1, 512, 512, 512, 512, 512]
    - [34, 9660.0]
  - - [512, 3977, 1, 2048, 512, 512, 2048, 2048]
    - [38, 9737.0]
  - - [512, 3978, 1, 512, 512, 512, 512, 512]
    - [38, 9378.0]
  - - [512, 3978, 1, 2048, 512, 512, 2048, 2048]
    - [38, 10101.0]
  - - [512, 3990, 1, 512, 512, 512, 512, 512]
    - [58, 9167.0]
  - - [512, 3990, 1, 2048, 512, 512, 2048, 2048]
    - [16, 10056.0]
  - - [512, 3995, 1, 512, 512, 512, 512, 512]
    - [34, 9437.0]
  - - [512, 3995, 1, 2048, 512, 512, 2048, 2048]
    - [16, 10038.0]
  - - [512, 3996, 1, 512, 512, 512, 512, 512]
    - [58, 9386.0]
  - - [512, 3996, 1, 2048, 512, 512, 2048, 2048]
    - [58, 10123.0]
  - - [512, 3999, 1, 512, 512, 512, 512, 512]
    - [58, 9297.0]
  - - [512, 3999, 1, 2048, 512, 512, 2048, 2048]
    - [38, 10124.0]
  - - [512, 4005, 1, 512, 512, 512, 512, 512]
    - [38, 9474.0]
  - - [512, 4005, 1, 2048, 512, 512, 2048, 2048]
    - [16, 10008.0]
  - - [512, 4012, 1, 512, 512, 512, 512, 512]
    - [34, 9379.0]
  - - [512, 4012, 1, 2048, 512, 512, 2048, 2048]
    - [16, 10105.0]
  - - [512, 4020, 1, 512, 512, 512, 512, 512]
    - [55, 8479.0]
  - - [512, 4020, 1, 2048, 512, 512, 2048, 2048]
    - [58, 10207.0]
  - - [512, 4026, 1, 512, 512, 512, 512, 512]
    - [38, 9443.0]
  - - [512, 4026, 1, 2048, 512, 512, 2048, 2048]
    - [16, 10104.0]
  - - [512, 4030, 1, 512, 512, 512, 512, 512]
    - [58, 9526.0]
  - - [512, 4030, 1, 2048, 512, 512, 2048, 2048]
    - [58, 10216.0]
  - - [512, 4032, 1, 512, 512, 512, 512, 512]
    - [5, 9205.0]
  - - [512, 4032, 1, 2048, 512, 512, 2048, 2048]
    - [58, 10198.0]
  - - [512, 4050, 1, 512, 512, 512, 512, 512]
    - [34, 9561.0]
  - - [512, 4059, 1, 512, 512, 512, 512, 512]
    - [34, 9694.0]
  - - [2048, 2790, 1, 512, 2048, 2048, 512, 512]
    - [27, 10745.0]
  - - [2048, 3092, 1, 512, 2048, 2048, 512, 512]
    - [27, 10551.0]
  - - [2048, 3113, 1, 512, 2048, 2048, 512, 512]
    - [38, 10737.0]
  - - [2048, 3137, 1, 512, 2048, 2048, 512, 512]
    - [58, 10404.0]
  - - [2048, 3165, 1, 512, 2048, 2048, 512, 512]
    - [16, 10855.0]
  - - [2048, 3166, 1, 512, 2048, 2048, 512, 512]
    - [18, 10220.0]
  - - [2048, 3194, 1, 512, 2048, 2048, 512, 512]
    - [27, 10830.0]
  - - [2048, 3219, 1, 512, 2048, 2048, 512, 512]
    - [16, 10580.0]
  - - [2048, 3222, 1, 512, 2048, 2048, 512, 512]
    - [58, 10065.0]
  - - [2048, 3234, 1, 512, 2048, 2048, 512, 512]
    - [27, 10840.0]
  - - [2048, 3237, 1, 512, 2048, 2048, 512, 512]
    - [16, 11010.0]
  - - [2048, 3242, 1, 512, 2048, 2048, 512, 512]
    - [16, 10576.0]
  - - [2048, 3246, 1, 512, 2048, 2048, 512, 512]
    - [16, 10742.0]
  - - [2048, 3249, 1, 512, 2048, 2048, 512, 512]
    - [16, 10841.0]
  - - [2048, 3251, 1, 512, 2048, 2048, 512, 512]
    - [16, 10737.0]
  - - [2048, 3257, 1, 512, 2048, 2048, 512, 512]
    - [16, 10705.0]
  - - [2048, 3262, 1, 512, 2048, 2048, 512, 512]
    - [27, 10363.0]
  - - [2048, 3268, 1, 512, 2048, 2048, 512, 512]
    - [27, 10737.0]
  - - [2048, 3282, 1, 512, 2048, 2048, 512, 512]
    - [58, 10350.0]
  - - [2048, 3286, 1, 512, 2048, 2048, 512, 512]
    - [38, 10764.0]
  - - [2048, 3293, 1, 512, 2048, 2048, 512, 512]
    - [27, 10921.0]
  - - [2048, 3297, 1, 512, 2048, 2048, 512, 512]
    - [16, 11063.0]
  - - [2048, 3307, 1, 512, 2048, 2048, 512, 512]
    - [16, 10873.0]
  - - [2048, 3314, 1, 512, 2048, 2048, 512, 512]
    - [16, 11220.0]
  - - [2048, 3315, 1, 512, 2048, 2048, 512, 512]
    - [16, 10907.0]
  - - [2048, 3319, 1, 512, 2048, 2048, 512, 512]
    - [38, 11007.0]
  - - [2048, 3322, 1, 512, 2048, 2048, 512, 512]
    - [16, 11182.0]
  - - [2048, 3323, 1, 512, 2048, 2048, 512, 512]
    - [16, 10911.0]
  - - [2048, 3324, 1, 512, 2048, 2048, 512, 512]
    - [16, 11253.0]
  - - [2048, 3325, 1, 512, 2048, 2048, 512, 512]
    - [16, 10848.0]
  - - [2048, 3327, 1, 512, 2048, 2048, 512, 512]
    - [16, 10941.0]
  - - [2048, 3329, 1, 512, 2048, 2048, 512, 512]
    - [49, 10284.0]
  - - [2048, 3332, 1, 512, 2048, 2048, 512, 512]
    - [16, 10581.0]
  - - [2048, 3336, 1, 512, 2048, 2048, 512, 512]
    - [16, 10849.0]
  - - [2048, 3339, 1, 512, 2048, 2048, 512, 512]
    - [16, 10555.0]
  - - [2048, 3342, 1, 512, 2048, 2048, 512, 512]
    - [16, 10606.0]
  - - [2048, 3344, 1, 512, 2048, 2048, 512, 512]
    - [16, 10773.0]
  - - [2048, 3358, 1, 512, 2048, 2048, 512, 512]
    - [16, 10597.0]
  - - [2048, 3360, 1, 512, 2048, 2048, 512, 512]
    - [16, 10905.0]
  - - [2048, 3364, 1, 512, 2048, 2048, 512, 512]
    - [16, 10555.0]
  - - [2048, 3365, 1, 512, 2048, 2048, 512, 512]
    - [27, 10755.0]
  - - [2048, 3369, 1, 512, 2048, 2048, 512, 512]
    - [16, 10897.0]
  - - [2048, 3371, 1, 512, 2048, 2048, 512, 512]
    - [16, 10679.0]
  - - [2048, 3374, 1, 512, 2048, 2048, 512, 512]
    - [16, 10997.0]
  - - [2048, 3376, 1, 512, 2048, 2048, 512, 512]
    - [38, 10723.0]
  - - [2048, 3377, 1, 512, 2048, 2048, 512, 512]
    - [16, 10625.0]
  - - [2048, 3378, 1, 512, 2048, 2048, 512, 512]
    - [49, 10556.0]
  - - [2048, 3381, 1, 512, 2048, 2048, 512, 512]
    - [16, 10625.0]
  - - [2048, 3382, 1, 512, 2048, 2048, 512, 512]
    - [16, 11011.0]
  - - [2048, 3383, 1, 512, 2048, 2048, 512, 512]
    - [16, 10646.0]
  - - [2048, 3384, 1, 512, 2048, 2048, 512, 512]
    - [16, 10698.0]
  - - [2048, 3385, 1, 512, 2048, 2048, 512, 512]
    - [49, 10561.0]
  - - [2048, 3386, 1, 512, 2048, 2048, 512, 512]
    - [27, 10684.0]
  - - [2048, 3388, 1, 512, 2048, 2048, 512, 512]
    - [16, 11039.0]
  - - [2048, 3390, 1, 512, 2048, 2048, 512, 512]
    - [16, 10745.0]
  - - [2048, 3391, 1, 512, 2048, 2048, 512, 512]
    - [16, 10700.0]
  - - [2048, 3396, 1, 512, 2048, 2048, 512, 512]
    - [38, 10616.0]
  - - [2048, 3399, 1, 512, 2048, 2048, 512, 512]
    - [38, 10757.0]
  - - [2048, 3402, 1, 512, 2048, 2048, 512, 512]
    - [38, 9781.0]
  - - [2048, 3410, 1, 512, 2048, 2048, 512, 512]
    - [16, 10820.0]
  - - [2048, 3414, 1, 512, 2048, 2048, 512, 512]
    - [27, 10877.0]
  - - [2048, 3415, 1, 512, 2048, 2048, 512, 512]
    - [38, 10724.0]
  - - [2048, 3418, 1, 512, 2048, 2048, 512, 512]
    - [16, 10825.0]
  - - [2048, 3420, 1, 512, 2048, 2048, 512, 512]
    - [16, 11052.0]
  - - [2048, 3422, 1, 512, 2048, 2048, 512, 512]
    - [16, 10838.0]
  - - [2048, 3425, 1, 512, 2048, 2048, 512, 512]
    - [27, 11007.0]
  - - [2048, 3426, 1, 512, 2048, 2048, 512, 512]
    - [38, 10713.0]
  - - [2048, 3427, 1, 512, 2048, 2048, 512, 512]
    - [38, 10834.0]
  - - [2048, 3428, 1, 512, 2048, 2048, 512, 512]
    - [49, 10575.0]
  - - [2048, 3430, 1, 512, 2048, 2048, 512, 512]
    - [38, 10270.0]
  - - [2048, 3431, 1, 512, 2048, 2048, 512, 512]
    - [16, 11207.0]
  - - [2048, 3432, 1, 512, 2048, 2048, 512, 512]
    - [49, 10822.0]
  - - [2048, 3438, 1, 512, 2048, 2048, 512, 512]
    - [27, 11018.0]
  - - [2048, 3439, 1, 512, 2048, 2048, 512, 512]
    - [16, 11166.0]
  - - [2048, 3440, 1, 512, 2048, 2048, 512, 512]
    - [16, 10866.0]
  - - [2048, 3443, 1, 512, 2048, 2048, 512, 512]
    - [16, 11251.0]
  - - [2048, 3445, 1, 512, 2048, 2048, 512, 512]
    - [27, 10959.0]
  - - [2048, 3447, 1, 512, 2048, 2048, 512, 512]
    - [16, 10877.0]
  - - [2048, 3448, 1, 512, 2048, 2048, 512, 512]
    - [27, 10732.0]
  - - [2048, 3450, 1, 512, 2048, 2048, 512, 512]
    - [16, 10972.0]
  - - [2048, 3451, 1, 512, 2048, 2048, 512, 512]
    - [58, 10331.0]
  - - [2048, 3452, 1, 512, 2048, 2048, 512, 512]
    - [16, 10969.0]
  - - [2048, 3453, 1, 512, 2048, 2048, 512, 512]
    - [16, 11087.0]
  - - [2048, 3455, 1, 512, 2048, 2048, 512, 512]
    - [38, 10888.0]
  - - [2048, 3457, 1, 512, 2048, 2048, 512, 512]
    - [38, 10435.0]
  - - [2048, 3458, 1, 512, 2048, 2048, 512, 512]
    - [49, 10266.0]
  - - [2048, 3459, 1, 512, 2048, 2048, 512, 512]
    - [27, 10516.0]
  - - [2048, 3460, 1, 512, 2048, 2048, 512, 512]
    - [16, 10721.0]
  - - [2048, 3461, 1, 512, 2048, 2048, 512, 512]
    - [27, 10656.0]
  - - [2048, 3462, 1, 512, 2048, 2048, 512, 512]
    - [38, 10713.0]
  - - [2048, 3467, 1, 512, 2048, 2048, 512, 512]
    - [16, 10851.0]
  - - [2048, 3468, 1, 512, 2048, 2048, 512, 512]
    - [27, 10685.0]
  - - [2048, 3470, 1, 512, 2048, 2048, 512, 512]
    - [38, 9984.0]
  - - [2048, 3471, 1, 512, 2048, 2048, 512, 512]
    - [27, 10438.0]
  - - [2048, 3472, 1, 512, 2048, 2048, 512, 512]
    - [16, 10548.0]
  - - [2048, 3475, 1, 512, 2048, 2048, 512, 512]
    - [27, 10531.0]
  - - [2048, 3477, 1, 512, 2048, 2048, 512, 512]
    - [16, 10564.0]
  - - [2048, 3478, 1, 512, 2048, 2048, 512, 512]
    - [16, 10853.0]
  - - [2048, 3479, 1, 512, 2048, 2048, 512, 512]
    - [49, 10559.0]
  - - [2048, 3480, 1, 512, 2048, 2048, 512, 512]
    - [16, 10895.0]
  - - [2048, 3481, 1, 512, 2048, 2048, 512, 512]
    - [16, 10578.0]
  - - [2048, 3483, 1, 512, 2048, 2048, 512, 512]
    - [16, 10541.0]
  - - [2048, 3484, 1, 512, 2048, 2048, 512, 512]
    - [38, 10653.0]
  - - [2048, 3487, 1, 512, 2048, 2048, 512, 512]
    - [16, 10623.0]
  - - [2048, 3489, 1, 512, 2048, 2048, 512, 512]
    - [16, 11022.0]
  - - [2048, 3490, 1, 512, 2048, 2048, 512, 512]
    - [5, 10588.0]
  - - [2048, 3491, 1, 512, 2048, 2048, 512, 512]
    - [16, 10698.0]
  - - [2048, 3493, 1, 512, 2048, 2048, 512, 512]
    - [16, 10935.0]
  - - [2048, 3494, 1, 512, 2048, 2048, 512, 512]
    - [16, 10794.0]
  - - [2048, 3495, 1, 512, 2048, 2048, 512, 512]
    - [58, 10078.0]
  - - [2048, 3497, 1, 512, 2048, 2048, 512, 512]
    - [27, 10453.0]
  - - [2048, 3498, 1, 512, 2048, 2048, 512, 512]
    - [16, 10877.0]
  - - [2048, 3499, 1, 512, 2048, 2048, 512, 512]
    - [16, 10700.0]
  - - [2048, 3501, 1, 512, 2048, 2048, 512, 512]
    - [16, 10667.0]
  - - [2048, 3503, 1, 512, 2048, 2048, 512, 512]
    - [58, 10338.0]
  - - [2048, 3507, 1, 512, 2048, 2048, 512, 512]
    - [16, 10667.0]
  - - [2048, 3508, 1, 512, 2048, 2048, 512, 512]
    - [16, 10880.0]
  - - [2048, 3509, 1, 512, 2048, 2048, 512, 512]
    - [16, 10705.0]
  - - [2048, 3511, 1, 512, 2048, 2048, 512, 512]
    - [16, 10764.0]
  - - [2048, 3514, 1, 512, 2048, 2048, 512, 512]
    - [38, 10620.0]
  - - [2048, 3515, 1, 512, 2048, 2048, 512, 512]
    - [27, 10812.0]
  - - [2048, 3517, 1, 512, 2048, 2048, 512, 512]
    - [16, 10980.0]
  - - [2048, 3518, 1, 512, 2048, 2048, 512, 512]
    - [27, 10706.0]
  - - [2048, 3519, 1, 512, 2048, 2048, 512, 512]
    - [16, 10979.0]
  - - [2048, 3520, 1, 512, 2048, 2048, 512, 512]
    - [16, 10753.0]
  - - [2048, 3523, 1, 512, 2048, 2048, 512, 512]
    - [5, 10780.0]
  - - [2048, 3528, 1, 512, 2048, 2048, 512, 512]
    - [38, 10384.0]
  - - [2048, 3529, 1, 512, 2048, 2048, 512, 512]
    - [16, 10821.0]
  - - [2048, 3530, 1, 512, 2048, 2048, 512, 512]
    - [16, 11084.0]
  - - [2048, 3532, 1, 512, 2048, 2048, 512, 512]
    - [16, 10674.0]
  - - [2048, 3533, 1, 512, 2048, 2048, 512, 512]
    - [16, 10772.0]
  - - [2048, 3534, 1, 512, 2048, 2048, 512, 512]
    - [27, 10724.0]
  - - [2048, 3538, 1, 512, 2048, 2048, 512, 512]
    - [27, 10920.0]
  - - [2048, 3539, 1, 512, 2048, 2048, 512, 512]
    - [49, 10656.0]
  - - [2048, 3541, 1, 512, 2048, 2048, 512, 512]
    - [27, 10749.0]
  - - [2048, 3547, 1, 512, 2048, 2048, 512, 512]
    - [16, 11118.0]
  - - [2048, 3548, 1, 512, 2048, 2048, 512, 512]
    - [27, 10966.0]
  - - [2048, 3552, 1, 512, 2048, 2048, 512, 512]
    - [16, 10801.0]
  - - [2048, 3564, 1, 512, 2048, 2048, 512, 512]
    - [58, 10505.0]
  - - [2048, 3575, 1, 512, 2048, 2048, 512, 512]
    - [16, 10824.0]
  - - [2048, 3598, 1, 512, 2048, 2048, 512, 512]
    - [58, 10218.0]
  - - [2048, 3599, 1, 512, 2048, 2048, 512, 512]
    - [16, 10946.0]
  - - [2048, 3608, 1, 512, 2048, 2048, 512, 512]
    - [16, 10934.0]
  - - [2048, 3780, 1, 512, 2048, 2048, 512, 512]
    - [16, 10944.0]
  - - [2048, 3796, 1, 512, 2048, 2048, 512, 512]
    - [27, 11261.0]
  - - [2048, 3822, 1, 512, 2048, 2048, 512, 512]
    - [16, 11218.0]
  - - [2048, 3840, 1, 512, 2048, 2048, 512, 512]
    - [27, 11283.0]
  - - [2048, 3859, 1, 512, 2048, 2048, 512, 512]
    - [49, 10180.0]
  - - [2048, 3870, 1, 512, 2048, 2048, 512, 512]
    - [27, 11059.0]
  - - [2048, 3876, 1, 512, 2048, 2048, 512, 512]
    - [58, 10385.0]
  - - [2048, 3906, 1, 512, 2048, 2048, 512, 512]
    - [16, 10926.0]
  - - [2048, 3910, 1, 512, 2048, 2048, 512, 512]
    - [16, 11144.0]
  - - [2048, 3925, 1, 512, 2048, 2048, 512, 512]
    - [27, 10975.0]
  - - [2048, 3942, 1, 512, 2048, 2048, 512, 512]
    - [16, 11262.0]
  - - [2048, 3944, 1, 512, 2048, 2048, 512, 512]
    - [27, 11069.0]
  - - [2048, 3955, 1, 512, 2048, 2048, 512, 512]
    - [27, 11164.0]
  - - [2048, 3968, 1, 512, 2048, 2048, 512, 512]
    - [27, 11034.0]
  - - [2048, 3969, 1, 512, 2048, 2048, 512, 512]
    - [18, 10813.0]
  - - [2048, 3976, 1, 512, 2048, 2048, 512, 512]
    - [49, 10571.0]
  - - [2048, 3977, 1, 512, 2048, 2048, 512, 512]
    - [16, 10752.0]
  - - [2048, 3978, 1, 512, 2048, 2048, 512, 512]
    - [58, 10313.0]
  - - [2048, 3990, 1, 512, 2048, 2048, 512, 512]
    - [18, 10861.0]
  - - [2048, 3995, 1, 512, 2048, 2048, 512, 512]
    - [58, 10299.0]
  - - [2048, 3996, 1, 512, 2048, 2048, 512, 512]
    - [18, 10788.0]
  - - [2048, 4005, 1, 512, 2048, 2048, 512, 512]
    - [58, 10580.0]
  - - [2048, 4012, 1, 512, 2048, 2048, 512, 512]
    - [18, 10843.0]
  - - [2048, 4020, 1, 512, 2048, 2048, 512, 512]
    - [16, 11073.0]
  - - [2048, 4026, 1, 512, 2048, 2048, 512, 512]
    - [16, 10908.0]
  - - [2048, 4030, 1, 512, 2048, 2048, 512, 512]
    - [16, 11150.0]
  - - [2048, 4032, 1, 512, 2048, 2048, 512, 512]
    - [18, 10926.0]
  - - [33708, 184, 1, 512, 33708, 33708, 512, 512]
    - [37, 9055.0]
  - - [33708, 208, 1, 512, 33708, 33708, 512, 512]
    - [16, 9216.0]
  - - [33708, 246, 1, 512, 33708, 33708, 512, 512]
    - [16, 10777.0]
  - - [33708, 264, 1, 512, 33708, 33708, 512, 512]
    - [58, 8033.0]
  - - [33708, 465, 1, 512, 33708, 33708, 512, 512]
    - [16, 10727.0]
  - - [33708, 468, 1, 512, 33708, 33708, 512, 512]
    - [38, 10763.0]
  - - [33708, 493, 1, 512, 33708, 33708, 512, 512]
    - [38, 11325.0]
  - - [33708, 540, 1, 512, 33708, 33708, 512, 512]
    - [15, 9079.0]
  - - [33708, 550, 1, 512, 33708, 33708, 512, 512]
    - [38, 9837.0]
  - - [33708, 560, 1, 512, 33708, 33708, 512, 512]
    - [16, 10288.0]
  - - [33708, 644, 1, 512, 33708, 33708, 512, 512]
    - [58, 9937.0]
  - - [33708, 714, 1, 512, 33708, 33708, 512, 512]
    - [16, 11061.0]
  - - [33708, 720, 1, 512, 33708, 33708, 512, 512]
    - [58, 10914.0]
  - - [33708, 781, 1, 512, 33708, 33708, 512, 512]
    - [52, 7841.0]
  - - [33708, 936, 1, 512, 33708, 33708, 512, 512]
    - [43, 7579.0]
  - - [33708, 980, 1, 512, 33708, 33708, 512, 512]
    - [43, 7902.0]
  - - [33708, 1232, 1, 512, 33708, 33708, 512, 512]
    - [40, 9807.0]
  - - [33708, 1290, 1, 512, 33708, 33708, 512, 512]
    - [54, 8137.0]
  - - [33708, 1350, 1, 512, 33708, 33708, 512, 512]
    - [38, 10468.0]
  - - [33708, 1424, 1, 512, 33708, 33708, 512, 512]
    - [16, 7555.0]
  - - [33708, 1458, 1, 512, 33708, 33708, 512, 512]
    - [51, 10630.0]
  - - [33708, 1462, 1, 512, 33708, 33708, 512, 512]
    - [38, 10440.0]
  - - [33708, 1520, 1, 512, 33708, 33708, 512, 512]
    - [50, 8997.0]
  - - [33708, 1596, 1, 512, 33708, 33708, 512, 512]
    - [59, 9780.0]
  - - [33708, 1599, 1, 512, 33708, 33708, 512, 512]
    - [46, 8386.0]
  - - [33708, 1615, 1, 512, 33708, 33708, 512, 512]
    - [16, 7773.0]
  - - [33708, 1680, 1, 512, 33708, 33708, 512, 512]
    - [36, 9086.0]
  - - [33708, 1917, 1, 512, 33708, 33708, 512, 512]
    - [38, 8311.0]
  - - [33708, 2205, 1, 512, 33708, 33708, 512, 512]
    - [18, 10580.0]
  - - [33708, 2418, 1, 512, 33708, 33708, 512, 512]
    - [18, 10346.0]
  - - [33708, 3776, 1, 512, 33708, 33708, 512, 512]
    - [58, 9915.0]
  - - [33708, 3780, 1, 512, 33708, 33708, 512, 512]
    - [18, 9910.0]
  - - [33708, 3796, 1, 512, 33708, 33708, 512, 512]
    - [18, 9738.0]
  - - [33708, 3822, 1, 512, 33708, 33708, 512, 512]
    - [16, 9976.0]
  - - [33708, 3835, 1, 512, 33708, 33708, 512, 512]
    - [14, 10890.0]
  - - [33708, 3840, 1, 512, 33708, 33708, 512, 512]
    - [60, 11055.0]
  - - [33708, 3859, 1, 512, 33708, 33708, 512, 512]
    - [16, 9771.0]
  - - [33708, 3870, 1, 512, 33708, 33708, 512, 512]
    - [16, 9649.0]
  - - [33708, 3876, 1, 512, 33708, 33708, 512, 512]
    - [38, 9907.0]
  - - [33708, 3906, 1, 512, 33708, 33708, 512, 512]
    - [5, 10017.0]
  - - [33708, 3910, 1, 512, 33708, 33708, 512, 512]
    - [59, 10090.0]
  - - [33708, 3925, 1, 512, 33708, 33708, 512, 512]
    - [46, 10100.0]
  - - [33708, 3942, 1, 512, 33708, 33708, 512, 512]
    - [16, 9807.0]
  - - [33708, 3944, 1, 512, 33708, 33708, 512, 512]
    - [38, 11735.0]
  - - [33708, 3955, 1, 512, 33708, 33708, 512, 512]
    - [38, 9917.0]
  - - [33708, 3968, 1, 512, 33708, 33708, 512, 512]
    - [16, 10232.0]
  - - [33708, 3976, 1, 512, 33708, 33708, 512, 512]
    - [59, 9916.0]
  - - [33708, 3977, 1, 512, 33708, 33708, 512, 512]
    - [60, 10436.0]
  - - [33708, 3978, 1, 512, 33708, 33708, 512, 512]
    - [12, 9920.0]
  - - [33708, 3990, 1, 512, 33708, 33708, 512, 512]
    - [58, 9772.0]
  - - [33708, 3996, 1, 512, 33708, 33708, 512, 512]
    - [16, 9869.0]
  - - [33708, 3999, 1, 512, 33708, 33708, 512, 512]
    - [36, 10003.0]
  - - [33708, 4005, 1, 512, 33708, 33708, 512, 512]
    - [16, 9958.0]
  - - [33708, 4012, 1, 512, 33708, 33708, 512, 512]
    - [18, 9910.0]
  - - [33708, 4020, 1, 512, 33708, 33708, 512, 512]
    - [14, 10253.0]
  - - [33708, 4026, 1, 512, 33708, 33708, 512, 512]
    - [16, 10056.0]
  - - [33708, 4030, 1, 512, 33708, 33708, 512, 512]
    - [18, 9938.0]
  - - [33708, 4032, 1, 512, 33708, 33708, 512, 512]
    - [39, 9856.0]
  - - [3072, 512, 1, 3072, 3072, 3072, 3072, 3072]
    - [38, 10429.0]
  - - [511, 8192, 1, 8192, 511, 511, 8192, 8192]
    - [38, 8551.0]
  - - [4096, 4096, 1, 4096, 4096, 4096, 4096, 4096]
    - [49, 10556.0]
  - - [8192, 8193, 1, 8192, 8192, 8192, 8192, 8192]
    - [18, 10576.0]
  - - [3072, 3072, 1, 3071, 3072, 3072, 3071, 3071]
    - [2, 10849.0]
  - - [8192, 8192, 1, 8193, 8192, 8192, 8193, 8193]
    - [40, 12143.0]
  - - [7681, 8192, 1, 8192, 7681, 7681, 8192, 8192]
    - [18, 10636.0]
  - - [7680, 8192, 1, 8193, 7680, 7680, 8193, 8193]
    - [29, 12385.0]
  - - [513, 4096, 1, 4096, 513, 513, 4096, 4096]
    - [60, 7838.0]
  - - [3073, 512, 1, 3072, 3073, 3073, 3072, 3072]
    - [16, 10299.0]
  - - [7680, 8192, 1, 8192, 7680, 7680, 8192, 8192]
    - [60, 10815.0]
  - - [4096, 4096, 1, 4097, 4096, 4096, 4097, 4097]
    - [18, 11451.0]
  - - [8192, 8191, 1, 8192, 8192, 8192, 8192, 8192]
    - [18, 10881.0]
  - - [8192, 512, 1, 8193, 8192, 8192, 8193, 8193]
    - [29, 8628.0]
  - - [2880, 3071, 1, 3072, 2880, 2880, 3072, 3072]
    - [59, 9898.0]
  - - [2880, 3072, 1, 3072, 2880, 2880, 3072, 3072]
    - [42, 8917.0]
  - - [4096, 511, 1, 4096, 4096, 4096, 4096, 4096]
    - [18, 8725.0]
  - - [512, 3072, 1, 3072, 512, 512, 3072, 3072]
    - [58, 10317.0]
  - - [512, 8191, 1, 8192, 512, 512, 8192, 8192]
    - [40, 8498.0]
  - - [4096, 4095, 1, 4096, 4096, 4096, 4096, 4096]
    - [15, 9233.0]
  - - [8192, 511, 1, 8192, 8192, 8192, 8192, 8192]
    - [49, 7805.0]
  - - [8192, 512, 1, 8192, 8192, 8192, 8192, 8192]
    - [40, 6145.0]
  - - [511, 3072, 1, 3072, 511, 511, 3072, 3072]
    - [58, 10280.0]
  - - [7680, 8193, 1, 8192, 7680, 7680, 8192, 8192]
    - [60, 10598.0]
  - - [2048, 2048, 1, 2048, 2048, 2048, 2048, 2048]
    - [16, 11301.0]
  - - [3072, 512, 1, 3073, 3072, 3072, 3073, 3073]
    - [45, 10925.0]
  - - [513, 8192, 1, 8192, 513, 513, 8192, 8192]
    - [38, 6579.0]
  - - [7679, 8192, 1, 8192, 7679, 7679, 8192, 8192]
    - [18, 10663.0]
  - - [3840, 4096, 1, 4097, 3840, 3840, 4097, 4097]
    - [29, 11503.0]
  - - [512, 3072, 1, 3071, 512, 512, 3071, 3071]
    - [45, 10905.0]
  - - [7680, 8192, 1, 8191, 7680, 7680, 8191, 8191]
    - [40, 12033.0]
  - - [3072, 511, 1, 3072, 3072, 3072, 3072, 3072]
    - [38, 10319.0]
  - - [8193, 8192, 1, 8192, 8193, 8193, 8192, 8192]
    - [18, 10808.0]
  - - [512, 4096, 1, 4095, 512, 512, 4095, 4095]
    - [49, 10083.0]
  - - [512, 3071, 1, 3072, 512, 512, 3072, 3072]
    - [58, 10162.0]
  - - [3073, 3072, 1, 3072, 3073, 3073, 3072, 3072]
    - [62, 7649.0]
  - - [512, 3073, 1, 3072, 512, 512, 3072, 3072]
    - [16, 9896.0]
  - - [4096, 4096, 1, 4095, 4096, 4096, 4095, 4095]
    - [1, 11660.0]
  - - [1920, 2048, 1, 2047, 1920, 1920, 2047, 2047]
    - [23, 11998.0]
  - - [1920, 2049, 1, 2048, 1920, 1920, 2048, 2048]
    - [38, 10468.0]
  - - [512, 8192, 1, 8191, 512, 512, 8191, 8191]
    - [60, 10297.0]
  - - [3840, 4096, 1, 4096, 3840, 3840, 4096, 4096]
    - [58, 9594.0]
  - - [8191, 512, 1, 8192, 8191, 8191, 8192, 8192]
    - [18, 6101.0]
  - - [2881, 3072, 1, 3072, 2881, 2881, 3072, 3072]
    - [42, 8071.0]
  - - [512, 4096, 1, 4096, 512, 512, 4096, 4096]
    - [42, 8543.0]
  - - [3841, 4096, 1, 4096, 3841, 3841, 4096, 4096]
    - [38, 8830.0]
  - - [2880, 3072, 1, 3073, 2880, 2880, 3073, 3073]
    - [51, 10682.0]
  - - [4095, 512, 1, 4096, 4095, 4095, 4096, 4096]
    - [18, 8864.0]
  - - [1919, 2048, 1, 2048, 1919, 1919, 2048, 2048]
    - [16, 11457.0]
  - - [1920, 2048, 1, 2048, 1920, 1920, 2048, 2048]
    - [38, 11461.0]
  - - [8192, 8192, 1, 8192, 8192, 8192, 8192, 8192]
    - [18, 10783.0]
  - - [511, 4096, 1, 4096, 511, 511, 4096, 4096]
    - [58, 8376.0]
  - - [8192, 513, 1, 8192, 8192, 8192, 8192, 8192]
    - [62, 6255.0]
  - - [513, 3072, 1, 3072, 513, 513, 3072, 3072]
    - [18, 9167.0]
  - - [7680, 8191, 1, 8192, 7680, 7680, 8192, 8192]
    - [18, 10635.0]
  - - [512, 4097, 1, 4096, 512, 512, 4096, 4096]
    - [62, 8286.0]
  - - [2047, 2048, 1, 2048, 2047, 2047, 2048, 2048]
    - [16, 11308.0]
  - - [2049, 2048, 1, 2048, 2049, 2049, 2048, 2048]
    - [18, 10751.0]
  - - [3840, 4095, 1, 4096, 3840, 3840, 4096, 4096]
    - [20, 9678.0]
  - - [2880, 3072, 1, 3071, 2880, 2880, 3071, 3071]
    - [1, 11517.0]
  - - [3072, 3072, 1, 3073, 3072, 3072, 3073, 3073]
    - [29, 10630.0]
  - - [2880, 3073, 1, 3072, 2880, 2880, 3072, 3072]
    - [56, 8018.0]
  - - [4096, 513, 1, 4096, 4096, 4096, 4096, 4096]
    - [20, 7451.0]
  - - [4097, 512, 1, 4096, 4097, 4097, 4096, 4096]
    - [18, 8364.0]
  - - [8192, 512, 1, 8191, 8192, 8192, 8191, 8191]
    - [31, 9821.0]
  - - [1921, 2048, 1, 2048, 1921, 1921, 2048, 2048]
    - [16, 10604.0]
  - - [512, 3072, 1, 3073, 512, 512, 3073, 3073]
    - [45, 10861.0]
  - - [2048, 2049, 1, 2048, 2048, 2048, 2048, 2048]
    - [16, 10553.0]
  - - [3072, 512, 1, 3071, 3072, 3072, 3071, 3071]
    - [45, 11058.0]
  - - [3071, 3072, 1, 3072, 3071, 3071, 3072, 3072]
    - [37, 9022.0]
  - - [3840, 4097, 1, 4096, 3840, 3840, 4096, 4096]
    - [42, 9635.0]
  - - [2048, 2047, 1, 2048, 2048, 2048, 2048, 2048]
    - [16, 11457.0]
  - - [2879, 3072, 1, 3072, 2879, 2879, 3072, 3072]
    - [62, 8463.0]
  - - [3072, 513, 1, 3072, 3072, 3072, 3072, 3072]
    - [38, 8940.0]
  - - [512, 4095, 1, 4096, 512, 512, 4096, 4096]
    - [59, 8737.0]
  - - [3071, 512, 1, 3072, 3071, 3071, 3072, 3072]
    - [38, 9992.0]
  - - [4096, 512, 1, 4096, 4096, 4096, 4096, 4096]
    - [18, 8860.0]
  - - [4097, 4096, 1, 4096, 4097, 4097, 4096, 4096]
    - [60, 8510.0]
  - - [2048, 2048, 1, 2047, 2048, 2048, 2047, 2047]
    - [23, 11675.0]
  - - [3839, 4096, 1, 4096, 3839, 3839, 4096, 4096]
    - [42, 9724.0]
  - - [512, 4096, 1, 4097, 512, 512, 4097, 4097]
    - [27, 10064.0]
  - - [3072, 3073, 1, 3072, 3072, 3072, 3072, 3072]
    - [43, 8578.0]
  - - [2048, 2048, 1, 2049, 2048, 2048, 2049, 2049]
    - [23, 11518.0]
  - - [8191, 8192, 1, 8192, 8191, 8191, 8192, 8192]
    - [18, 10822.0]
  - - [3072, 3071, 1, 3072, 3072, 3072, 3072, 3072]
    - [59, 9954.0]
  - - [4096, 512, 1, 4097, 4096, 4096, 4097, 4097]
    - [5, 10049.0]
  - - [3840, 4096, 1, 4095, 3840, 3840, 4095, 4095]
    - [7, 11400.0]
  - - [1920, 2047, 1, 2048, 1920, 1920, 2048, 2048]
    - [38, 11367.0]
  - - [8192, 8192, 1, 8191, 8192, 8192, 8191, 8191]
    - [29, 12105.0]
  - - [3072, 3072, 1, 3072, 3072, 3072, 3072, 3072]
    - [62, 7850.0]
  - - [512, 8193, 1, 8192, 512, 512, 8192, 8192]
    - [42, 7275.0]
  - - [4096, 512, 1, 4095, 4096, 4096, 4095, 4095]
    - [5, 10018.0]
  - - [8193, 512, 1, 8192, 8193, 8193, 8192, 8192]
    - [62, 8433.0]
  - - [4095, 4096, 1, 4096, 4095, 4095, 4096, 4096]
    - [20, 8328.0]
  - - [4096, 4097, 1, 4096, 4096, 4096, 4096, 4096]
    - [40, 9110.0]
  - - [512, 8192, 1, 8192, 512, 512, 8192, 8192]
    - [58, 8920.0]
  - - [512, 8192, 1, 8193, 512, 512, 8193, 8193]
    - [18, 8674.0]
  - - [1920, 2048, 1, 2049, 1920, 1920, 2049, 2049]
    - [45, 11804.0]
  - - [479, 3072, 1, 3072, 479, 479, 3072, 3072]
    - [38, 9746.0]
  - - [479, 4096, 1, 4096, 479, 479, 4096, 4096]
    - [59, 8507.0]
  - - [479, 8192, 1, 8192, 479, 479, 8192, 8192]
    - [62, 6727.0]
  - - [480, 3072, 1, 3071, 480, 480, 3071, 3071]
    - [23, 10217.0]
  - - [480, 3072, 1, 3073, 480, 480, 3073, 3073]
    - [23, 10157.0]
  - - [480, 3073, 1, 3072, 480, 480, 3072, 3072]
    - [38, 9882.0]
  - - [480, 4095, 1, 4096, 480, 480, 4096, 4096]
    - [59, 8584.0]
  - - [480, 4096, 1, 4095, 480, 480, 4095, 4095]
    - [49, 9599.0]
  - - [480, 4096, 1, 4097, 480, 480, 4097, 4097]
    - [27, 9620.0]
  - - [480, 4097, 1, 4096, 480, 480, 4096, 4096]
    - [58, 9151.0]
  - - [480, 8191, 1, 8192, 480, 480, 8192, 8192]
    - [52, 8078.0]
  - - [480, 8192, 1, 8191, 480, 480, 8191, 8191]
    - [32, 8454.0]
  - - [480, 8192, 1, 8193, 480, 480, 8193, 8193]
    - [58, 9709.0]
  - - [480, 8193, 1, 8192, 480, 480, 8192, 8192]
    - [42, 6894.0]
  - - [481, 3072, 1, 3072, 481, 481, 3072, 3072]
    - [58, 9708.0]
  - - [481, 4096, 1, 4096, 481, 481, 4096, 4096]
    - [58, 8697.0]
  - - [481, 8192, 1, 8192, 481, 481, 8192, 8192]
    - [62, 6735.0]
  - - [3072, 479, 1, 3072, 3072, 3072, 3072, 3072]
    - [58, 9641.0]
  - - [3072, 480, 1, 3071, 3072, 3072, 3071, 3071]
    - [23, 10210.0]
  - - [3072, 480, 1, 3073, 3072, 3072, 3073, 3073]
    - [23, 10329.0]
  - - [3072, 481, 1, 3072, 3072, 3072, 3072, 3072]
    - [58, 10005.0]
  - - [3073, 480, 1, 3072, 3073, 3073, 3072, 3072]
    - [16, 9992.0]
  - - [480, 3072, 1, 3072, 480, 480, 3072, 3072]
    - [58, 9959.0]
  - - [480, 4096, 1, 4096, 480, 480, 4096, 4096]
    - [59, 8547.0]
  - - [480, 8192, 1, 8192, 480, 480, 8192, 8192]
    - [49, 7109.0]
  - - [3072, 480, 1, 3072, 3072, 3072, 3072, 3072]
    - [38, 9740.0]
  - - [4096, 480, 1, 4096, 4096, 4096, 4096, 4096]
    - [38, 8100.0]
  - - [8192, 480, 1, 8192, 8192, 8192, 8192, 8192]
    - [63, 5877.0]
  - - [1024, 3840, 1, 1024, 1024, 1024, 1024, 1024]
    - [18, 10994.0]
  - - [1024, 3840, 1, 4096, 1024, 1024, 4096, 4096]
    - [58, 8775.0]
  - - [1024, 3968, 1, 1024, 1024, 1024, 1024, 1024]
    - [16, 10472.0]
  - - [1024, 3968, 1, 4096, 1024, 1024, 4096, 4096]
    - [5, 8148.0]
  - - [1024, 7200, 1, 1024, 1024, 1024, 1024, 1024]
    - [58, 10796.0]
  - - [1024, 7200, 1, 4096, 1024, 1024, 4096, 4096]
    - [16, 9475.0]
  - - [1024, 8160, 1, 1024, 1024, 1024, 1024, 1024]
    - [38, 11297.0]
  - - [1024, 8160, 1, 4096, 1024, 1024, 4096, 4096]
    - [62, 9352.0]
  - - [1024, 9520, 1, 1024, 1024, 1024, 1024, 1024]
    - [16, 10365.0]
  - - [1024, 9520, 1, 4096, 1024, 1024, 4096, 4096]
    - [38, 8375.0]
  - - [1024, 10200, 1, 1024, 1024, 1024, 1024, 1024]
    - [38, 10773.0]
  - - [1024, 10200, 1, 4096, 1024, 1024, 4096, 4096]
    - [57, 9437.0]
  - - [4096, 3840, 1, 1024, 4096, 4096, 1024, 1024]
    - [18, 8828.0]
  - - [4096, 3968, 1, 1024, 4096, 4096, 1024, 1024]
    - [16, 9189.0]
  - - [4096, 7200, 1, 1024, 4096, 4096, 1024, 1024]
    - [16, 8877.0]
  - - [4096, 8160, 1, 1024, 4096, 4096, 1024, 1024]
    - [16, 9365.0]
  - - [4096, 9520, 1, 1024, 4096, 4096, 1024, 1024]
    - [40, 9660.0]
  - - [4096, 10200, 1, 1024, 4096, 4096, 1024, 1024]
    - [16, 10127.0]
  - - [42720, 3968, 1, 1024, 42720, 42720, 1024, 1024]
    - [60, 11194.0]
  - - [42720, 7200, 1, 1024, 42720, 42720, 1024, 1024]
    - [60, 11450.0]
  - - [42720, 9520, 1, 1024, 42720, 42720, 1024, 1024]
    - [60, 11709.0]
  - - [2048, 960, 1, 2048, 2048, 2048, 2048, 2048]
    - [16, 9341.0]
  - - [2048, 960, 1, 74, 2048, 2048, 74, 74]
    - [24, 6239.0]
  - - [1600, 1024, 1, 960, 1600, 1600, 960, 960]
    - [45, 9573.0]
  - - [2048, 2048, 1, 960, 2048, 2048, 960, 960]
    - [23, 11677.0]
  - - [4096, 1024, 1, 257, 4096, 4096, 257, 257]
    - [27, 10323.0]
  - - [10240, 8976, 1, 256, 10240, 10240, 256, 256]
    - [16, 10954.0]
  - - [1024, 1600, 1, 1024, 1024, 1024, 1024, 1024]
    - [15, 8609.0]
  - - [1024, 1600, 1, 560, 1024, 1024, 560, 560]
    - [44, 9876.0]
  - - [10496, 8976, 1, 256, 10496, 10496, 256, 256]
    - [38, 10961.0]
  - - [11264, 8976, 1, 256, 11264, 11264, 256, 256]
    - [16, 11031.0]
  - - [11776, 8976, 1, 256, 11776, 11776, 256, 256]
    - [7, 10127.0]
  - - [12544, 8976, 1, 256, 12544, 12544, 256, 256]
    - [58, 10627.0]
  - - [1280, 8976, 1, 256, 1280, 1280, 256, 256]
    - [50, 9643.0]
  - - [13312, 8976, 1, 256, 13312, 13312, 256, 256]
    - [18, 10518.0]
  - - [13568, 8976, 1, 256, 13568, 13568, 256, 256]
    - [58, 10695.0]
  - - [13824, 8976, 1, 256, 13824, 13824, 256, 256]
    - [59, 10120.0]
  - - [15104, 8976, 1, 256, 15104, 15104, 256, 256]
    - [38, 10780.0]
  - - [15360, 8976, 1, 256, 15360, 15360, 256, 256]
    - [5, 8169.0]
  - - [15872, 8976, 1, 256, 15872, 15872, 256, 256]
    - [3, 10361.0]
  - - [16128, 8976, 1, 256, 16128, 16128, 256, 256]
    - [3, 10484.0]
  - - [17152, 8976, 1, 256, 17152, 17152, 256, 256]
    - [58, 8881.0]
  - - [1792, 8976, 1, 256, 1792, 1792, 256, 256]
    - [38, 10085.0]
  - - [18176, 8976, 1, 256, 18176, 18176, 256, 256]
    - [23, 10179.0]
  - - [18688, 8976, 1, 256, 18688, 18688, 256, 256]
    - [60, 9253.0]
  - - [18944, 8976, 1, 256, 18944, 18944, 256, 256]
    - [16, 9011.0]
  - - [19712, 8976, 1, 256, 19712, 19712, 256, 256]
    - [60, 11362.0]
  - - [19968, 8976, 1, 256, 19968, 19968, 256, 256]
    - [16, 9052.0]
  - - [20480, 8976, 1, 256, 20480, 20480, 256, 256]
    - [18, 9472.0]
  - - [2048, 1536, 1, 512, 2048, 2048, 512, 512]
    - [14, 9461.0]
  - - [2048, 1536, 1, 768, 2048, 2048, 768, 768]
    - [40, 10833.0]
  - - [2048, 684, 1, 512, 2048, 2048, 512, 512]
    - [58, 8412.0]
  - - [2048, 684, 1, 768, 2048, 2048, 768, 768]
    - [15, 8430.0]
  - - [2048, 8976, 1, 256, 2048, 2048, 256, 256]
    - [27, 11331.0]
  - - [20992, 8976, 1, 256, 20992, 20992, 256, 256]
    - [16, 9149.0]
  - - [21248, 8976, 1, 256, 21248, 21248, 256, 256]
    - [45, 10024.0]
  - - [2304, 8976, 1, 256, 2304, 2304, 256, 256]
    - [58, 11494.0]
  - - [23552, 8976, 1, 256, 23552, 23552, 256, 256]
    - [5, 9478.0]
  - - [2560, 8976, 1, 256, 2560, 2560, 256, 256]
    - [38, 11544.0]
  - - [256, 10496, 1, 1024, 256, 256, 1024, 1024]
    - [58, 10389.0]
  - - [256, 11264, 1, 1024, 256, 256, 1024, 1024]
    - [16, 10869.0]
  - - [256, 11520, 1, 1024, 256, 256, 1024, 1024]
    - [58, 11026.0]
  - - [256, 11776, 1, 1024, 256, 256, 1024, 1024]
    - [40, 10608.0]
  - - [256, 12544, 1, 1024, 256, 256, 1024, 1024]
    - [40, 11080.0]
  - - [256, 13312, 1, 1024, 256, 256, 1024, 1024]
    - [58, 10868.0]
  - - [256, 14336, 1, 1024, 256, 256, 1024, 1024]
    - [16, 10818.0]
  - - [256, 14592, 1, 1024, 256, 256, 1024, 1024]
    - [60, 11158.0]
  - - [256, 14848, 1, 1024, 256, 256, 1024, 1024]
    - [40, 11214.0]
  - - [256, 15104, 1, 1024, 256, 256, 1024, 1024]
    - [58, 11299.0]
  - - [256, 16128, 1, 1024, 256, 256, 1024, 1024]
    - [58, 10038.0]
  - - [256, 18176, 1, 1024, 256, 256, 1024, 1024]
    - [58, 11159.0]
  - - [256, 18944, 1, 1024, 256, 256, 1024, 1024]
    - [58, 11476.0]
  - - [256, 19200, 1, 1024, 256, 256, 1024, 1024]
    - [58, 11409.0]
  - - [256, 20480, 1, 1024, 256, 256, 1024, 1024]
    - [16, 11550.0]
  - - [256, 20992, 1, 1024, 256, 256, 1024, 1024]
    - [38, 4325.0]
  - - [256, 21248, 1, 1024, 256, 256, 1024, 1024]
    - [37, 4127.0]
  - - [256, 21504, 1, 1024, 256, 256, 1024, 1024]
    - [37, 4083.0]
  - - [256, 22016, 1, 1024, 256, 256, 1024, 1024]
    - [38, 10927.0]
  - - [256, 22344, 1, 1024, 256, 256, 1024, 1024]
    - [16, 11093.0]
  - - [256, 23296, 1, 1024, 256, 256, 1024, 1024]
    - [58, 11286.0]
  - - [256, 23552, 1, 1024, 256, 256, 1024, 1024]
    - [58, 11336.0]
  - - [256, 31488, 1, 1024, 256, 256, 1024, 1024]
    - [38, 11764.0]
  - - [256, 33536, 1, 1024, 256, 256, 1024, 1024]
    - [60, 11469.0]
  - - [256, 44505, 1, 1024, 256, 256, 1024, 1024]
    - [49, 7782.0]
  - - [256, 4608, 1, 1024, 256, 256, 1024, 1024]
    - [18, 8931.0]
  - - [256, 4864, 1, 1024, 256, 256, 1024, 1024]
    - [60, 10392.0]
  - - [256, 5376, 1, 1024, 256, 256, 1024, 1024]
    - [58, 9025.0]
  - - [256, 5888, 1, 1024, 256, 256, 1024, 1024]
    - [58, 9854.0]
  - - [256, 6144, 1, 1024, 256, 256, 1024, 1024]
    - [38, 10273.0]
  - - [256, 6400, 1, 1024, 256, 256, 1024, 1024]
    - [16, 10471.0]
  - - [256, 6656, 1, 1024, 256, 256, 1024, 1024]
    - [40, 9813.0]
  - - [256, 7168, 1, 1024, 256, 256, 1024, 1024]
    - [40, 10507.0]
  - - [256, 7424, 1, 1024, 256, 256, 1024, 1024]
    - [60, 10738.0]
  - - [256, 7936, 1, 1024, 256, 256, 1024, 1024]
    - [58, 9764.0]
  - - [256, 8192, 1, 1024, 256, 256, 1024, 1024]
    - [58, 10104.0]
  - - [256, 8448, 1, 1024, 256, 256, 1024, 1024]
    - [16, 10388.0]
  - - [256, 8960, 1, 1024, 256, 256, 1024, 1024]
    - [16, 10765.0]
  - - [256, 9984, 1, 1024, 256, 256, 1024, 1024]
    - [40, 11103.0]
  - - [2816, 8976, 1, 256, 2816, 2816, 256, 256]
    - [16, 11562.0]
  - - [28672, 8976, 1, 256, 28672, 28672, 256, 256]
    - [18, 9518.0]
  - - [3072, 8976, 1, 256, 3072, 3072, 256, 256]
    - [16, 11626.0]
  - - [31488, 8976, 1, 256, 31488, 31488, 256, 256]
    - [18, 10000.0]
  - - [3328, 8976, 1, 256, 3328, 3328, 256, 256]
    - [16, 11652.0]
  - - [33536, 8976, 1, 256, 33536, 33536, 256, 256]
    - [34, 10489.0]
  - - [3840, 8976, 1, 256, 3840, 3840, 256, 256]
    - [27, 11686.0]
  - - [4096, 8976, 1, 256, 4096, 4096, 256, 256]
    - [16, 11736.0]
  - - [4352, 8976, 1, 256, 4352, 4352, 256, 256]
    - [16, 11766.0]
  - - [44505, 8976, 1, 256, 44505, 44505, 256, 256]
    - [59, 10392.0]
  - - [4608, 8976, 1, 256, 4608, 4608, 256, 256]
    - [18, 11578.0]
  - - [4864, 8976, 1, 256, 4864, 4864, 256, 256]
    - [58, 11645.0]
  - - [5120, 8976, 1, 256, 5120, 5120, 256, 256]
    - [18, 10378.0]
  - - [5376, 8976, 1, 256, 5376, 5376, 256, 256]
    - [38, 11637.0]
  - - [5632, 8976, 1, 256, 5632, 5632, 256, 256]
    - [38, 11709.0]
  - - [5888, 8976, 1, 256, 5888, 5888, 256, 256]
    - [5, 11623.0]
  - - [6144, 8976, 1, 256, 6144, 6144, 256, 256]
    - [16, 11680.0]
  - - [6400, 8976, 1, 256, 6400, 6400, 256, 256]
    - [16, 11764.0]
  - - [684, 8976, 1, 256, 684, 684, 256, 256]
    - [13, 8785.0]
  - - [7168, 8976, 1, 256, 7168, 7168, 256, 256]
    - [16, 10586.0]
  - - [7936, 8976, 1, 256, 7936, 7936, 256, 256]
    - [16, 11884.0]
  - - [8192, 8976, 1, 256, 8192, 8192, 256, 256]
    - [29, 8160.0]
  - - [8448, 8976, 1, 256, 8448, 8448, 256, 256]
    - [58, 10990.0]
  - - [8960, 8976, 1, 256, 8960, 8960, 256, 256]
    - [18, 10901.0]
  - - [9472, 8976, 1, 256, 9472, 9472, 256, 256]
    - [16, 10883.0]
  - - [9728, 8976, 1, 256, 9728, 9728, 256, 256]
    - [38, 10932.0]
  - - [9984, 8976, 1, 256, 9984, 9984, 256, 256]
    - [16, 11121.0]
  - - [512, 32768, 1, 13, 512, 512, 13, 13]
    - [39, 2906.0]
  - - [256, 32768, 1, 512, 256, 256, 512, 512]
    - [16, 11453.0]
  - - [128, 32768, 1, 512, 128, 128, 512, 512]
    - [58, 11334.0]
  - - [1024, 32768, 1, 479, 1024, 1024, 479, 479]
    - [7, 11731.0]
  - - [1024, 32768, 1, 1024, 1024, 1024, 1024, 1024]
    - [16, 8199.0]
  - - [512, 32768, 1, 1024, 512, 512, 1024, 1024]
    - [38, 6431.0]
  - - [1023, 2048, 1, 4096, 1023, 1023, 4096, 4096]
    - [38, 10303.0]
  - - [1025, 2048, 1, 4096, 1025, 1025, 4096, 4096]
    - [40, 9400.0]
  - - [1024, 2047, 1, 4096, 1024, 1024, 4096, 4096]
    - [38, 10068.0]
  - - [1024, 2049, 1, 4096, 1024, 1024, 4096, 4096]
    - [18, 9323.0]
  - - [1024, 2048, 1, 4095, 1024, 1024, 4095, 4095]
    - [23, 10778.0]
  - - [1024, 2048, 1, 4097, 1024, 1024, 4097, 4097]
    - [45, 10676.0]
  - - [1023, 3072, 1, 1024, 1023, 1023, 1024, 1024]
    - [40, 10685.0]
  - - [1025, 3072, 1, 1024, 1025, 1025, 1024, 1024]
    - [16, 9843.0]
  - - [1024, 3071, 1, 1024, 1024, 1024, 1024, 1024]
    - [18, 10813.0]
  - - [1024, 3073, 1, 1024, 1024, 1024, 1024, 1024]
    - [16, 10715.0]
  - - [1024, 3072, 1, 1023, 1024, 1024, 1023, 1023]
    - [51, 10942.0]
  - - [1024, 3072, 1, 1025, 1024, 1024, 1025, 1025]
    - [7, 11100.0]
  - - [3071, 512, 1, 1024, 3071, 3071, 1024, 1024]
    - [16, 10009.0]
  - - [3073, 512, 1, 1024, 3073, 3073, 1024, 1024]
    - [58, 9967.0]
  - - [3072, 511, 1, 1024, 3072, 3072, 1024, 1024]
    - [38, 9982.0]
  - - [3072, 513, 1, 1024, 3072, 3072, 1024, 1024]
    - [16, 8690.0]
  - - [3072, 512, 1, 1023, 3072, 3072, 1023, 1023]
    - [23, 10646.0]
  - - [3072, 512, 1, 1025, 3072, 3072, 1025, 1025]
    - [58, 10052.0]
  - - [128, 32768, 1, 256, 128, 128, 256, 256]
    - [16, 9714.0]
  - - [1024, 4096, 1, 480, 1024, 1024, 480, 480]
    - [1, 11207.0]
  - - [512, 4096, 1, 1024, 512, 512, 1024, 1024]
    - [38, 10172.0]
  - - [512, 55296, 1, 13, 512, 512, 13, 13]
    - [7, 2486.0]
  - - [256, 55296, 1, 512, 256, 256, 512, 512]
    - [60, 11750.0]
  - - [128, 55296, 1, 256, 128, 128, 256, 256]
    - [38, 11270.0]
  - - [1024, 6912, 1, 480, 1024, 1024, 480, 480]
    - [1, 11975.0]
  - - [1024, 6912, 1, 1024, 1024, 1024, 1024, 1024]
    - [18, 11449.0]
  - - [512, 6912, 1, 1024, 512, 512, 1024, 1024]
    - [58, 11017.0]
  - - [256, 6912, 1, 512, 256, 256, 512, 512]
    - [60, 9489.0]
  - - [1151, 1152, 1, 1152, 1151, 1151, 1152, 1152]
    - [49, 8850.0]
  - - [1153, 1152, 1, 1152, 1153, 1153, 1152, 1152]
    - [38, 8886.0]
  - - [1152, 1151, 1, 1152, 1152, 1152, 1152, 1152]
    - [58, 8805.0]
  - - [1152, 1153, 1, 1152, 1152, 1152, 1152, 1152]
    - [27, 8856.0]
  - - [1152, 1152, 1, 1151, 1152, 1152, 1151, 1151]
    - [1, 9179.0]
  - - [1152, 1152, 1, 1153, 1152, 1152, 1153, 1153]
    - [44, 9268.0]
  - - [1535, 1536, 1, 1536, 1535, 1535, 1536, 1536]
    - [18, 10426.0]
  - - [1537, 1536, 1, 1536, 1537, 1537, 1536, 1536]
    - [60, 10417.0]
  - - [1536, 1535, 1, 1536, 1536, 1536, 1536, 1536]
    - [18, 10405.0]
  - - [1536, 1537, 1, 1536, 1536, 1536, 1536, 1536]
    - [58, 10115.0]
  - - [1536, 1536, 1, 1535, 1536, 1536, 1535, 1535]
    - [29, 10654.0]
  - - [1536, 1536, 1, 1537, 1536, 1536, 1537, 1537]
    - [29, 10652.0]
  - - [1919, 1920, 1, 1920, 1919, 1919, 1920, 1920]
    - [49, 10940.0]
  - - [1921, 1920, 1, 1920, 1921, 1921, 1920, 1920]
    - [5, 10932.0]
  - - [1920, 1919, 1, 1920, 1920, 1920, 1920, 1920]
    - [27, 10983.0]
  - - [1920, 1921, 1, 1920, 1920, 1920, 1920, 1920]
    - [58, 10905.0]
  - - [1920, 1920, 1, 1919, 1920, 1920, 1919, 1919]
    - [1, 11270.0]
  - - [1920, 1920, 1, 1921, 1920, 1920, 1921, 1921]
    - [45, 11396.0]
  - - [2303, 2304, 1, 2304, 2303, 2303, 2304, 2304]
    - [16, 11114.0]
  - - [2305, 2304, 1, 2304, 2305, 2305, 2304, 2304]
    - [60, 10823.0]
  - - [2304, 2303, 1, 2304, 2304, 2304, 2304, 2304]
    - [58, 11137.0]
  - - [2304, 2305, 1, 2304, 2304, 2304, 2304, 2304]
    - [60, 10794.0]
  - - [2304, 2304, 1, 2303, 2304, 2304, 2303, 2303]
    - [45, 11514.0]
  - - [2304, 2304, 1, 2305, 2304, 2304, 2305, 2305]
    - [23, 11504.0]
  - - [2687, 2688, 1, 2688, 2687, 2687, 2688, 2688]
    - [49, 11202.0]
  - - [2689, 2688, 1, 2688, 2689, 2689, 2688, 2688]
    - [27, 10710.0]
  - - [2688, 2687, 1, 2688, 2688, 2688, 2688, 2688]
    - [27, 11052.0]
  - - [2688, 2689, 1, 2688, 2688, 2688, 2688, 2688]
    - [49, 10746.0]
  - - [2688, 2688, 1, 2687, 2688, 2688, 2687, 2687]
    - [49, 11159.0]
  - - [2688, 2688, 1, 2689, 2688, 2688, 2689, 2689]
    - [49, 11176.0]
  - - [3455, 3456, 1, 3456, 3455, 3455, 3456, 3456]
    - [27, 10811.0]
  - - [3457, 3456, 1, 3456, 3457, 3457, 3456, 3456]
    - [27, 10542.0]
  - - [3456, 3455, 1, 3456, 3456, 3456, 3456, 3456]
    - [27, 11861.0]
  - - [3456, 3457, 1, 3456, 3456, 3456, 3456, 3456]
    - [27, 10392.0]
  - - [3456, 3456, 1, 3455, 3456, 3456, 3455, 3455]
    - [27, 10914.0]
  - - [3456, 3456, 1, 3457, 3456, 3456, 3457, 3457]
    - [18, 11825.0]
  - - [3839, 3840, 1, 3840, 3839, 3839, 3840, 3840]
    - [38, 10134.0]
  - - [3841, 3840, 1, 3840, 3841, 3841, 3840, 3840]
    - [29, 10870.0]
  - - [3840, 3839, 1, 3840, 3840, 3840, 3840, 3840]
    - [38, 10066.0]
  - - [3840, 3841, 1, 3840, 3840, 3840, 3840, 3840]
    - [59, 10178.0]
  - - [3840, 3840, 1, 3839, 3840, 3840, 3839, 3839]
    - [18, 11299.0]
  - - [3840, 3840, 1, 3841, 3840, 3840, 3841, 3841]
    - [27, 12041.0]
  - - [4223, 4224, 1, 4224, 4223, 4223, 4224, 4224]
    - [38, 11175.0]
  - - [4225, 4224, 1, 4224, 4225, 4225, 4224, 4224]
    - [27, 10940.0]
  - - [4224, 4223, 1, 4224, 4224, 4224, 4224, 4224]
    - [58, 11268.0]
  - - [4224, 4225, 1, 4224, 4224, 4224, 4224, 4224]
    - [47, 10884.0]
  - - [4224, 4224, 1, 4223, 4224, 4224, 4223, 4223]
    - [49, 11475.0]
  - - [4224, 4224, 1, 4225, 4224, 4224, 4225, 4225]
    - [27, 11450.0]
  - - [4607, 4608, 1, 4608, 4607, 4607, 4608, 4608]
    - [16, 10872.0]
  - - [4609, 4608, 1, 4608, 4609, 4609, 4608, 4608]
    - [16, 10621.0]
  - - [4608, 4607, 1, 4608, 4608, 4608, 4608, 4608]
    - [58, 11802.0]
  - - [4608, 4609, 1, 4608, 4608, 4608, 4608, 4608]
    - [58, 10664.0]
  - - [4608, 4608, 1, 4607, 4608, 4608, 4607, 4607]
    - [18, 11602.0]
  - - [4608, 4608, 1, 4609, 4608, 4608, 4609, 4609]
    - [18, 11623.0]
  - - [4991, 4992, 1, 4992, 4991, 4991, 4992, 4992]
    - [58, 11280.0]
  - - [4993, 4992, 1, 4992, 4993, 4993, 4992, 4992]
    - [40, 10953.0]
  - - [4992, 4991, 1, 4992, 4992, 4992, 4992, 4992]
    - [58, 11189.0]
  - - [4992, 4993, 1, 4992, 4992, 4992, 4992, 4992]
    - [58, 11043.0]
  - - [4992, 4992, 1, 4991, 4992, 4992, 4991, 4991]
    - [49, 12062.0]
  - - [4992, 4992, 1, 4993, 4992, 4992, 4993, 4993]
    - [25, 11510.0]
  - - [5375, 5376, 1, 5376, 5375, 5375, 5376, 5376]
    - [60, 11156.0]
  - - [5377, 5376, 1, 5376, 5377, 5377, 5376, 5376]
    - [38, 10992.0]
  - - [5376, 5375, 1, 5376, 5376, 5376, 5376, 5376]
    - [58, 12048.0]
  - - [5376, 5377, 1, 5376, 5376, 5376, 5376, 5376]
    - [16, 11420.0]
  - - [5376, 5376, 1, 5375, 5376, 5376, 5375, 5375]
    - [40, 11716.0]
  - - [5376, 5376, 1, 5377, 5376, 5376, 5377, 5377]
    - [40, 11658.0]
  - - [5759, 5760, 1, 5760, 5759, 5759, 5760, 5760]
    - [49, 11477.0]
  - - [5761, 5760, 1, 5760, 5761, 5761, 5760, 5760]
    - [40, 11206.0]
  - - [5760, 5759, 1, 5760, 5760, 5760, 5760, 5760]
    - [60, 11518.0]
  - - [5760, 5761, 1, 5760, 5760, 5760, 5760, 5760]
    - [40, 11368.0]
  - - [5760, 5760, 1, 5759, 5760, 5760, 5759, 5759]
    - [29, 11663.0]
  - - [5760, 5760, 1, 5761, 5760, 5760, 5761, 5761]
    - [40, 11625.0]
  - - [6143, 6144, 1, 6144, 6143, 6143, 6144, 6144]
    - [18, 10526.0]
  - - [6145, 6144, 1, 6144, 6145, 6145, 6144, 6144]
    - [18, 10619.0]
  - - [6144, 6143, 1, 6144, 6144, 6144, 6144, 6144]
    - [18, 10678.0]
  - - [6144, 6145, 1, 6144, 6144, 6144, 6144, 6144]
    - [18, 10249.0]
  - - [6144, 6144, 1, 6143, 6144, 6144, 6143, 6143]
    - [51, 11900.0]
  - - [6144, 6144, 1, 6145, 6144, 6144, 6145, 6145]
    - [38, 12039.0]
  - - [6527, 6528, 1, 6528, 6527, 6527, 6528, 6528]
    - [58, 11607.0]
  - - [6529, 6528, 1, 6528, 6529, 6529, 6528, 6528]
    - [58, 11473.0]
  - - [6528, 6527, 1, 6528, 6528, 6528, 6528, 6528]
    - [58, 11657.0]
  - - [6528, 6529, 1, 6528, 6528, 6528, 6528, 6528]
    - [38, 11756.0]
  - - [6528, 6528, 1, 6527, 6528, 6528, 6527, 6527]
    - [49, 11659.0]
  - - [6528, 6528, 1, 6529, 6528, 6528, 6529, 6529]
    - [49, 11802.0]
  - - [6911, 6912, 1, 6912, 6911, 6911, 6912, 6912]
    - [60, 11830.0]
  - - [6913, 6912, 1, 6912, 6913, 6913, 6912, 6912]
    - [60, 11588.0]
  - - [6912, 6911, 1, 6912, 6912, 6912, 6912, 6912]
    - [40, 11845.0]
  - - [6912, 6913, 1, 6912, 6912, 6912, 6912, 6912]
    - [58, 11466.0]
  - - [6912, 6912, 1, 6911, 6912, 6912, 6911, 6911]
    - [25, 12093.0]
  - - [6912, 6912, 1, 6913, 6912, 6912, 6913, 6913]
    - [29, 12117.0]
  - - [7295, 7296, 1, 7296, 7295, 7295, 7296, 7296]
    - [60, 12119.0]
  - - [7297, 7296, 1, 7296, 7297, 7297, 7296, 7296]
    - [58, 11641.0]
  - - [7296, 7295, 1, 7296, 7296, 7296, 7296, 7296]
    - [51, 11762.0]
  - - [7296, 7297, 1, 7296, 7296, 7296, 7296, 7296]
    - [60, 11790.0]
  - - [7296, 7296, 1, 7295, 7296, 7296, 7295, 7295]
    - [5, 11951.0]
  - - [7296, 7296, 1, 7297, 7296, 7296, 7297, 7297]
    - [29, 11979.0]
  - - [7679, 7680, 1, 7680, 7679, 7679, 7680, 7680]
    - [18, 11346.0]
  - - [7681, 7680, 1, 7680, 7681, 7681, 7680, 7680]
    - [29, 11859.0]
  - - [7680, 7679, 1, 7680, 7680, 7680, 7680, 7680]
    - [60, 11756.0]
  - - [7680, 7681, 1, 7680, 7680, 7680, 7680, 7680]
    - [60, 11452.0]
  - - [7680, 7680, 1, 7679, 7680, 7680, 7679, 7679]
    - [40, 12066.0]
  - - [7680, 7680, 1, 7681, 7680, 7680, 7681, 7681]
    - [51, 12046.0]
  - - [1152, 1152, 1, 1152, 1152, 1152, 1152, 1152]
    - [13, 8578.0]
  - - [1536, 1536, 1, 1536, 1536, 1536, 1536, 1536]
    - [18, 10604.0]
  - - [1920, 1920, 1, 1920, 1920, 1920, 1920, 1920]
    - [58, 10948.0]
  - - [2304, 2304, 1, 2304, 2304, 2304, 2304, 2304]
    - [5, 11251.0]
  - - [2688, 2688, 1, 2688, 2688, 2688, 2688, 2688]
    - [49, 11140.0]
  - - [3456, 3456, 1, 3456, 3456, 3456, 3456, 3456]
    - [27, 10725.0]
  - - [3840, 3840, 1, 3840, 3840, 3840, 3840, 3840]
    - [58, 10311.0]
  - - [4224, 4224, 1, 4224, 4224, 4224, 4224, 4224]
    - [27, 11267.0]
  - - [4608, 4608, 1, 4608, 4608, 4608, 4608, 4608]
    - [38, 10852.0]
  - - [4992, 4992, 1, 4992, 4992, 4992, 4992, 4992]
    - [49, 12138.0]
  - - [5376, 5376, 1, 5376, 5376, 5376, 5376, 5376]
    - [60, 11426.0]
  - - [5760, 5760, 1, 5760, 5760, 5760, 5760, 5760]
    - [38, 11411.0]
  - - [6144, 6144, 1, 6144, 6144, 6144, 6144, 6144]
    - [38, 10632.0]
  - - [6528, 6528, 1, 6528, 6528, 6528, 6528, 6528]
    - [58, 12076.0]
  - - [6912, 6912, 1, 6912, 6912, 6912, 6912, 6912]
    - [60, 11818.0]
  - - [7296, 7296, 1, 7296, 7296, 7296, 7296, 7296]
    - [38, 12015.0]
  - - [7680, 7680, 1, 7680, 7680, 7680, 7680, 7680]
    - [60, 11731.0]
  - - [256, 128, 49, 1152, 256, 256, 1152, 1152]
    - [58, 10226.0]
  - - [256, 128, 121, 120, 256, 256, 120, 120]
    - [22, 8368.0]
  - - [256, 128, 169, 120, 256, 256, 120, 120]
    - [22, 8906.0]
  - - [256, 128, 36, 120, 256, 256, 120, 120]
    - [0, 7538.0]
  - - [256, 128, 49, 120, 256, 256, 120, 120]
    - [44, 7462.0]
  - - [256, 128, 64, 120, 256, 256, 120, 120]
    - [44, 7186.0]
  - - [256, 128, 36, 12000, 256, 256, 12000, 12000]
    - [38, 8942.0]
  - - [256, 128, 49, 1216, 256, 256, 1216, 1216]
    - [27, 10750.0]
  - - [256, 128, 121, 18, 256, 256, 18, 18]
    - [0, 2741.0]
  - - [256, 128, 169, 18, 256, 256, 18, 18]
    - [0, 3090.0]
  - - [256, 128, 36, 18, 256, 256, 18, 18]
    - [15, 2397.0]
  - - [256, 128, 49, 18, 256, 256, 18, 18]
    - [4, 2396.0]
  - - [256, 128, 64, 18, 256, 256, 18, 18]
    - [15, 2658.0]
  - - [256, 128, 36, 1800, 256, 256, 1800, 1800]
    - [16, 9906.0]
  - - [256, 128, 121, 19, 256, 256, 19, 19]
    - [4, 3157.0]
  - - [256, 128, 169, 19, 256, 256, 19, 19]
    - [11, 2792.0]
  - - [256, 128, 36, 19, 256, 256, 19, 19]
    - [0, 2379.0]
  - - [256, 128, 49, 19, 256, 256, 19, 19]
    - [15, 2538.0]
  - - [256, 128, 64, 19, 256, 256, 19, 19]
    - [15, 2737.0]
  - - [256, 128, 36, 1900, 256, 256, 1900, 1900]
    - [49, 9875.0]
  - - [256, 128, 49, 480, 256, 256, 480, 480]
    - [1, 10067.0]
  - - [256, 128, 81, 480, 256, 256, 480, 480]
    - [27, 8142.0]
  - - [256, 128, 64, 5880, 256, 256, 5880, 5880]
    - [58, 9388.0]
  - - [256, 128, 49, 72, 256, 256, 72, 72]
    - [2, 5984.0]
  - - [256, 128, 81, 72, 256, 256, 72, 72]
    - [44, 5987.0]
  - - [256, 128, 49, 76, 256, 256, 76, 76]
    - [28, 5347.0]
  - - [256, 128, 81, 76, 256, 256, 76, 76]
    - [44, 5777.0]
  - - [256, 128, 49, 7680, 256, 256, 7680, 7680]
    - [21, 3512.0]
  - - [256, 128, 64, 882, 256, 256, 882, 882]
    - [5, 9866.0]
  - - [256, 128, 64, 931, 256, 256, 931, 931]
    - [5, 9818.0]
  - - [256, 256, 49, 1152, 256, 256, 1152, 1152]
    - [18, 10896.0]
  - - [256, 256, 36, 12000, 256, 256, 12000, 12000]
    - [31, 8650.0]
  - - [256, 256, 49, 1216, 256, 256, 1216, 1216]
    - [51, 11642.0]
  - - [256, 256, 36, 1800, 256, 256, 1800, 1800]
    - [7, 10794.0]
  - - [256, 256, 36, 1900, 256, 256, 1900, 1900]
    - [7, 10809.0]
  - - [256, 256, 64, 5880, 256, 256, 5880, 5880]
    - [0, 10277.0]
  - - [256, 256, 49, 7680, 256, 256, 7680, 7680]
    - [32, 7876.0]
  - - [256, 256, 64, 882, 256, 256, 882, 882]
    - [49, 11172.0]
  - - [256, 256, 64, 931, 256, 256, 931, 931]
    - [49, 11361.0]
  - - [340, 256, 49, 1152, 340, 340, 1152, 1152]
    - [49, 10135.0]
  - - [340, 256, 36, 120, 340, 340, 120, 120]
    - [2, 8660.0]
  - - [340, 256, 49, 120, 340, 340, 120, 120]
    - [12, 8988.0]
  - - [340, 256, 64, 120, 340, 340, 120, 120]
    - [1, 9092.0]
  - - [340, 256, 36, 12000, 340, 340, 12000, 12000]
    - [60, 8409.0]
  - - [340, 256, 49, 1216, 340, 340, 1216, 1216]
    - [23, 10441.0]
  - - [340, 256, 36, 18, 340, 340, 18, 18]
    - [2, 2869.0]
  - - [340, 256, 49, 18, 340, 340, 18, 18]
    - [28, 3039.0]
  - - [340, 256, 64, 18, 340, 340, 18, 18]
    - [11, 3199.0]
  - - [340, 256, 36, 1800, 340, 340, 1800, 1800]
    - [1, 10422.0]
  - - [340, 256, 36, 19, 340, 340, 19, 19]
    - [2, 3038.0]
  - - [340, 256, 49, 19, 340, 340, 19, 19]
    - [6, 3143.0]
  - - [340, 256, 64, 19, 340, 340, 19, 19]
    - [6, 3310.0]
  - - [340, 256, 36, 1900, 340, 340, 1900, 1900]
    - [23, 10364.0]
  - - [340, 256, 64, 5880, 340, 340, 5880, 5880]
    - [0, 9242.0]
  - - [340, 256, 49, 7680, 340, 340, 7680, 7680]
    - [20, 5954.0]
  - - [340, 256, 64, 882, 340, 340, 882, 882]
    - [7, 10158.0]
  - - [340, 256, 64, 931, 340, 340, 931, 931]
    - [51, 10164.0]
  - - [510, 256, 49, 120, 510, 510, 120, 120]
    - [46, 9785.0]
  - - [510, 256, 64, 120, 510, 510, 120, 120]
    - [46, 10019.0]
  - - [510, 256, 49, 18, 510, 510, 18, 18]
    - [50, 3500.0]
  - - [510, 256, 64, 18, 510, 510, 18, 18]
    - [53, 3557.0]
  - - [510, 256, 49, 19, 510, 510, 19, 19]
    - [44, 3626.0]
  - - [510, 256, 64, 19, 510, 510, 19, 19]
    - [50, 3750.0]
  - - [510, 256, 36, 480, 510, 510, 480, 480]
    - [1, 11253.0]
  - - [510, 256, 36, 72, 510, 510, 72, 72]
    - [46, 7231.0]
  - - [510, 256, 36, 76, 510, 510, 76, 76]
    - [35, 7433.0]
  - - [510, 512, 36, 1080, 510, 510, 1080, 1080]
    - [45, 12072.0]
  - - [510, 512, 36, 162, 510, 510, 162, 162]
    - [27, 10355.0]
  - - [510, 512, 36, 171, 510, 510, 171, 171]
    - [45, 10668.0]
  - - [510, 512, 49, 1920, 510, 510, 1920, 1920]
    - [51, 10168.0]
  - - [510, 512, 64, 1920, 510, 510, 1920, 1920]
    - [4, 9444.0]
  - - [510, 512, 49, 288, 510, 510, 288, 288]
    - [45, 11432.0]
  - - [510, 512, 64, 288, 510, 510, 288, 288]
    - [23, 11718.0]
  - - [510, 512, 36, 3000, 510, 510, 3000, 3000]
    - [1, 10777.0]
  - - [510, 512, 49, 304, 510, 510, 304, 304]
    - [23, 11609.0]
  - - [510, 512, 64, 304, 510, 510, 304, 304]
    - [45, 11718.0]
  - - [510, 512, 36, 450, 510, 510, 450, 450]
    - [27, 11535.0]
  - - [510, 512, 36, 475, 510, 510, 475, 475]
    - [1, 11612.0]
  - - [510, 512, 49, 480, 510, 510, 480, 480]
    - [23, 11843.0]
  - - [510, 512, 64, 480, 510, 510, 480, 480]
    - [23, 11939.0]
  - - [510, 512, 49, 72, 510, 510, 72, 72]
    - [46, 8944.0]
  - - [510, 512, 64, 72, 510, 510, 72, 72]
    - [46, 9118.0]
  - - [510, 512, 49, 76, 510, 510, 76, 76]
    - [39, 8905.0]
  - - [510, 512, 64, 76, 510, 510, 76, 76]
    - [27, 9269.0]
  - - [512, 256, 81, 1080, 512, 512, 1080, 1080]
    - [49, 11732.0]
  - - [512, 256, 25, 12000, 512, 512, 12000, 12000]
    - [36, 8730.0]
  - - [512, 256, 81, 162, 512, 512, 162, 162]
    - [5, 10481.0]
  - - [512, 256, 81, 171, 512, 512, 171, 171]
    - [5, 10813.0]
  - - [512, 256, 25, 1800, 512, 512, 1800, 1800]
    - [29, 12024.0]
  - - [512, 256, 25, 1900, 512, 512, 1900, 1900]
    - [7, 12034.0]
  - - [512, 256, 121, 1920, 512, 512, 1920, 1920]
    - [18, 7685.0]
  - - [512, 256, 169, 1920, 512, 512, 1920, 1920]
    - [29, 11275.0]
  - - [512, 256, 49, 1920, 512, 512, 1920, 1920]
    - [40, 11258.0]
  - - [512, 256, 121, 288, 512, 512, 288, 288]
    - [5, 11689.0]
  - - [512, 256, 169, 288, 512, 512, 288, 288]
    - [1, 11880.0]
  - - [512, 256, 49, 288, 512, 512, 288, 288]
    - [1, 11566.0]
  - - [512, 256, 25, 3000, 512, 512, 3000, 3000]
    - [51, 12168.0]
  - - [512, 256, 81, 3000, 512, 512, 3000, 3000]
    - [1, 10411.0]
  - - [512, 256, 121, 304, 512, 512, 304, 304]
    - [5, 11712.0]
  - - [512, 256, 169, 304, 512, 512, 304, 304]
    - [5, 11849.0]
  - - [512, 256, 49, 304, 512, 512, 304, 304]
    - [1, 11572.0]
  - - [512, 256, 25, 450, 512, 512, 450, 450]
    - [1, 11618.0]
  - - [512, 256, 81, 450, 512, 512, 450, 450]
    - [5, 11476.0]
  - - [512, 256, 25, 475, 512, 512, 475, 475]
    - [1, 11516.0]
  - - [512, 256, 81, 475, 512, 512, 475, 475]
    - [27, 11519.0]
  - - [512, 256, 121, 480, 512, 512, 480, 480]
    - [1, 12053.0]
  - - [512, 256, 169, 480, 512, 512, 480, 480]
    - [51, 12093.0]
  - - [512, 256, 49, 5880, 512, 512, 5880, 5880]
    - [60, 12146.0]
  - - [512, 256, 121, 72, 512, 512, 72, 72]
    - [24, 10381.0]
  - - [512, 256, 169, 72, 512, 512, 72, 72]
    - [0, 9630.0]
  - - [512, 256, 121, 76, 512, 512, 76, 76]
    - [24, 9971.0]
  - - [512, 256, 169, 76, 512, 512, 76, 76]
    - [1, 9225.0]
  - - [512, 256, 49, 882, 512, 512, 882, 882]
    - [29, 11697.0]
  - - [512, 256, 49, 931, 512, 512, 931, 931]
    - [7, 11701.0]
  - - [2304, 512, 1, 100, 2304, 2304, 100, 100]
    - [0, 7843.0]
  - - [2304, 512, 1, 361, 2304, 2304, 361, 361]
    - [45, 9150.0]
  - - [4608, 510, 1, 100, 4608, 4608, 100, 100]
    - [53, 7079.0]
  - - [4608, 510, 1, 361, 4608, 4608, 361, 361]
    - [45, 9599.0]
  - - [8192, 7680, 1, 8192, 8192, 8192, 8192, 8192]
    - [60, 12062.0]
  - - [4096, 3840, 1, 4096, 4096, 4096, 4096, 4096]
    - [18, 12105.0]
  - - [2048, 1920, 1, 2048, 2048, 2048, 2048, 2048]
    - [16, 11800.0]
  - - [30522, 616, 1, 1024, 30522, 30522, 1024, 1024]
    - [58, 11432.0]
  - - [128, 128, 128, 64, 128, 128, 64, 64]
    - [22, 7279.0]
  - - [128, 128, 160, 64, 128, 128, 64, 64]
    - [50, 8248.0]
  - - [1024, 1280, 1, 1024, 1024, 1024, 1024, 1024]
    - [18, 11440.0]
  - - [1024, 1280, 1, 4096, 1024, 1024, 4096, 4096]
    - [18, 11962.0]
  - - [4096, 1280, 1, 1024, 4096, 4096, 1024, 1024]
    - [18, 11856.0]
  - - [30522, 200, 1, 1024, 30522, 30522, 1024, 1024]
    - [58, 9179.0]
  - - [128, 128, 624, 64, 128, 128, 64, 64]
    - [59, 9499.0]
  - - [1024, 4992, 1, 1024, 1024, 1024, 1024, 1024]
    - [16, 11584.0]
  - - [1024, 4992, 1, 4096, 1024, 1024, 4096, 4096]
    - [18, 11787.0]
  - - [4096, 4992, 1, 1024, 4096, 4096, 1024, 1024]
    - [16, 11975.0]
  - - [30522, 780, 1, 1024, 30522, 30522, 1024, 1024]
    - [58, 10470.0]
  - - [30522, 308, 1, 1024, 30522, 30522, 1024, 1024]
    - [58, 9473.0]
  - - [128, 128, 640, 64, 128, 128, 64, 64]
    - [28, 9423.0]
  - - [1024, 5120, 1, 1024, 1024, 1024, 1024, 1024]
    - [18, 11944.0]
  - - [1024, 5120, 1, 4096, 1024, 1024, 4096, 4096]
    - [40, 12040.0]
  - - [4096, 5120, 1, 1024, 4096, 4096, 1024, 1024]
    - [18, 12202.0]
  - - [30522, 800, 1, 1024, 30522, 30522, 1024, 1024]
    - [58, 10836.0]
  - - [128, 128, 656, 64, 128, 128, 64, 64]
    - [50, 9672.0]
  - - [1024, 5248, 1, 1024, 1024, 1024, 1024, 1024]
    - [16, 11564.0]
  - - [1024, 5248, 1, 4096, 1024, 1024, 4096, 4096]
    - [18, 11252.0]
  - - [4096, 5248, 1, 1024, 4096, 4096, 1024, 1024]
    - [16, 12012.0]
  - - [30522, 820, 1, 1024, 30522, 30522, 1024, 1024]
    - [58, 10988.0]
  - - [512, 512, 80, 64, 512, 512, 64, 64]
    - [5, 10562.0]
  - - [1024, 2560, 1, 1024, 1024, 1024, 1024, 1024]
    - [18, 11623.0]
  - - [1024, 2560, 1, 4096, 1024, 1024, 4096, 4096]
    - [18, 12167.0]
  - - [4096, 2560, 1, 1024, 4096, 4096, 1024, 1024]
    - [18, 12126.0]
  - - [30522, 385, 1, 1024, 30522, 30522, 1024, 1024]
    - [58, 8945.0]
  - - [30522, 462, 1, 1024, 30522, 30522, 1024, 1024]
    - [38, 10632.0]
  - - [128, 128, 144, 64, 128, 128, 64, 64]
    - [22, 7402.0]
  - - [1024, 1152, 1, 1024, 1024, 1024, 1024, 1024]
    - [60, 10160.0]
  - - [1024, 1152, 1, 4096, 1024, 1024, 4096, 4096]
    - [60, 10721.0]
  - - [4096, 1152, 1, 1024, 4096, 4096, 1024, 1024]
    - [16, 11390.0]
  - - [30522, 180, 1, 1024, 30522, 30522, 1024, 1024]
    - [38, 8235.0]
  - - [1024, 8192, 1, 1024, 1024, 1024, 1024, 1024]
    - [18, 11957.0]
  - - [1024, 8192, 1, 4096, 1024, 1024, 4096, 4096]
    - [40, 11941.0]
  - - [1024, 9600, 1, 1024, 1024, 1024, 1024, 1024]
    - [16, 11965.0]
  - - [1024, 9600, 1, 4096, 1024, 1024, 4096, 4096]
    - [40, 11517.0]
  - - [4096, 8192, 1, 1024, 4096, 4096, 1024, 1024]
    - [18, 12171.0]
  - - [4096, 9600, 1, 1024, 4096, 4096, 1024, 1024]
    - [16, 12122.0]
  - - [33712, 8192, 1, 1024, 33712, 33712, 1024, 1024]
    - [40, 12418.0]
  - - [33712, 9600, 1, 1024, 33712, 33712, 1024, 1024]
    - [40, 12242.0]
  - - [1024, 10064, 1, 1024, 1024, 1024, 1024, 1024]
    - [18, 11879.0]
  - - [1024, 10064, 1, 4096, 1024, 1024, 4096, 4096]
    - [40, 11786.0]
  - - [1024, 10080, 1, 1024, 1024, 1024, 1024, 1024]
    - [40, 11909.0]
  - - [1024, 10080, 1, 4096, 1024, 1024, 4096, 4096]
    - [40, 11976.0]
  - - [1024, 6528, 1, 1024, 1024, 1024, 1024, 1024]
    - [16, 11590.0]
  - - [1024, 6528, 1, 4096, 1024, 1024, 4096, 4096]
    - [40, 11288.0]
  - - [1024, 7104, 1, 1024, 1024, 1024, 1024, 1024]
    - [38, 11502.0]
  - - [1024, 7104, 1, 4096, 1024, 1024, 4096, 4096]
    - [40, 11243.0]
  - - [1024, 8064, 1, 1024, 1024, 1024, 1024, 1024]
    - [18, 11684.0]
  - - [1024, 8064, 1, 4096, 1024, 1024, 4096, 4096]
    - [18, 11786.0]
  - - [1024, 9216, 1, 1024, 1024, 1024, 1024, 1024]
    - [16, 11911.0]
  - - [1024, 9216, 1, 4096, 1024, 1024, 4096, 4096]
    - [40, 11667.0]
  - - [4096, 10064, 1, 1024, 4096, 4096, 1024, 1024]
    - [16, 12023.0]
  - - [4096, 10080, 1, 1024, 4096, 4096, 1024, 1024]
    - [16, 12049.0]
  - - [4096, 6528, 1, 1024, 4096, 4096, 1024, 1024]
    - [16, 12157.0]
  - - [4096, 7104, 1, 1024, 4096, 4096, 1024, 1024]
    - [18, 12043.0]
  - - [4096, 8064, 1, 1024, 4096, 4096, 1024, 1024]
    - [18, 11987.0]
  - - [4096, 9216, 1, 1024, 4096, 4096, 1024, 1024]
    - [18, 12185.0]
  - - [42720, 10080, 1, 1024, 42720, 42720, 1024, 1024]
    - [60, 12239.0]
  - - [42720, 6528, 1, 1024, 42720, 42720, 1024, 1024]
    - [38, 12206.0]
  - - [42720, 7104, 1, 1024, 42720, 42720, 1024, 1024]
    - [60, 12313.0]
  - - [1024, 32768, 1, 480, 1024, 1024, 480, 480]
    - [1, 12400.0]
  - - [30592, 1024, 1, 2048, 30592, 30592, 2048, 2048]
    - [40, 12317.0]
  - - [6144, 1024, 1, 2048, 6144, 6144, 2048, 2048]
    - [18, 11825.0]
  - - [8192, 1024, 1, 2048, 8192, 8192, 2048, 2048]
    - [18, 12136.0]
  - - [30592, 8192, 1, 1024, 30592, 30592, 1024, 1024]
    - [60, 12407.0]
  - - [3072, 8192, 1, 1024, 3072, 3072, 1024, 1024]
    - [40, 12121.0]
  - - [512, 512, 256, 64, 512, 512, 64, 64]
    - [0, 8699.0]
  - - [30592, 2048, 1, 1024, 30592, 30592, 1024, 1024]
    - [60, 12358.0]
  - - [30592, 4096, 1, 1024, 30592, 30592, 1024, 1024]
    - [60, 12418.0]
  - - [3072, 4096, 1, 1024, 3072, 3072, 1024, 1024]
    - [16, 11923.0]
  - - [1920, 2048, 1, 2560, 1920, 1920, 2560, 2560]
    - [16, 11864.0]
  - - [2560, 2048, 1, 2560, 2560, 2560, 2560, 2560]
    - [40, 12308.0]
  - - [2560, 2048, 1, 640, 2560, 2560, 640, 640]
    - [29, 11986.0]
  - - [7680, 2048, 1, 2560, 7680, 7680, 2560, 2560]
    - [18, 12262.0]
  - - [512, 512, 40, 64, 512, 512, 64, 64]
    - [11, 10085.0]
  - - [1536, 4096, 1, 1536, 1536, 1536, 1536, 1536]
    - [40, 11814.0]
  - - [1536, 4096, 1, 6144, 1536, 1536, 6144, 6144]
    - [40, 11930.0]
  - - [4608, 4096, 1, 1536, 4608, 4608, 1536, 1536]
    - [40, 12279.0]
  - - [50304, 4096, 1, 1536, 50304, 50304, 1536, 1536]
    - [40, 12448.0]
  - - [6144, 4096, 1, 1536, 6144, 6144, 1536, 1536]
    - [18, 12254.0]
  - - [1024, 1024, 64, 96, 1024, 1024, 96, 96]
    - [16, 11089.0]
  - - [1536, 8192, 1, 1536, 1536, 1536, 1536, 1536]
    - [16, 11918.0]
  - - [1536, 8192, 1, 6144, 1536, 1536, 6144, 6144]
    - [58, 11948.0]
  - - [4608, 8192, 1, 1536, 4608, 4608, 1536, 1536]
    - [40, 12364.0]
  - - [50304, 8192, 1, 1536, 50304, 50304, 1536, 1536]
    - [51, 12465.0]
  - - [6144, 8192, 1, 1536, 6144, 6144, 1536, 1536]
    - [7, 12434.0]
  - - [1024, 1024, 128, 96, 1024, 1024, 96, 96]
    - [16, 11078.0]
  - - [1024, 16384, 1, 1024, 1024, 1024, 1024, 1024]
    - [40, 12003.0]
  - - [1024, 16384, 1, 4096, 1024, 1024, 4096, 4096]
    - [40, 12073.0]
  - - [3072, 16384, 1, 1024, 3072, 3072, 1024, 1024]
    - [60, 12249.0]
  - - [4096, 16384, 1, 1024, 4096, 4096, 1024, 1024]
    - [18, 12171.0]
  - - [50304, 16384, 1, 1024, 50304, 50304, 1024, 1024]
    - [51, 12399.0]
  - - [1024, 1024, 256, 64, 1024, 1024, 64, 64]
    - [0, 8598.0]
  - - [50304, 2048, 1, 1024, 50304, 50304, 1024, 1024]
    - [60, 12356.0]
  - - [1024, 1024, 32, 64, 1024, 1024, 64, 64]
    - [0, 10106.0]
  - - [50304, 4096, 1, 1024, 50304, 50304, 1024, 1024]
    - [60, 12401.0]
  - - [1024, 1024, 64, 64, 1024, 1024, 64, 64]
    - [0, 10016.0]
  - - [50304, 8192, 1, 1024, 50304, 50304, 1024, 1024]
    - [60, 11939.0]
  - - [1024, 1024, 128, 64, 1024, 1024, 64, 64]
    - [26, 6068.0]
  - - [30528, 8192, 1, 1024, 30528, 30528, 1024, 1024]
    - [60, 11634.0]
  - - [128, 128, 1024, 64, 128, 128, 64, 64]
    - [57, 6956.0]
  - - [1024, 3456, 1, 1024, 1024, 1024, 1024, 1024]
    - [38, 10354.0]
  - - [1024, 3456, 1, 480, 1024, 1024, 480, 480]
    - [5, 11082.0]
  - - [512, 3456, 1, 1024, 512, 512, 1024, 1024]
    - [18, 10022.0]
  - - [512, 3456, 1, 13, 512, 512, 13, 13]
    - [6, 1638.0]
  - - [512, 4096, 1, 13, 512, 512, 13, 13]
    - [0, 2147.0]
  - - [512, 6912, 1, 13, 512, 512, 13, 13]
    - [16, 2142.0]
  - - [30528, 640, 1, 1024, 30528, 30528, 1024, 1024]
    - [58, 6159.0]
  - - [30528, 1280, 1, 1024, 30528, 30528, 1024, 1024]
    - [43, 8380.0]
  - - [30528, 1600, 1, 1024, 30528, 30528, 1024, 1024]
    - [60, 8829.0]
  - - [1024, 10240, 1, 1024, 1024, 1024, 1024, 1024]
    - [16, 10244.0]
  - - [4096, 10240, 1, 1024, 4096, 4096, 1024, 1024]
    - [50, 10048.0]
  - - [1024, 10240, 1, 4096, 1024, 1024, 4096, 4096]
    - [38, 8614.0]
  - - [128, 128, 1280, 64, 128, 128, 64, 64]
    - [26, 5162.0]
  - - [1024, 10496, 1, 4096, 1024, 1024, 4096, 4096]
    - [38, 8493.0]
  - - [30528, 1640, 1, 1024, 30528, 30528, 1024, 1024]
    - [58, 9036.0]
  - - [4096, 10496, 1, 1024, 4096, 4096, 1024, 1024]
    - [16, 9708.0]
  - - [1024, 10496, 1, 1024, 1024, 1024, 1024, 1024]
    - [16, 9851.0]
  - - [128, 128, 1312, 64, 128, 128, 64, 64]
    - [15, 6886.0]
  - - [30528, 160, 1, 1024, 30528, 30528, 1024, 1024]
    - [60, 7061.0]
  - - [30528, 240, 1, 1024, 30528, 30528, 1024, 1024]
    - [60, 6646.0]
  - - [1024, 6144, 1, 1024, 1024, 1024, 1024, 1024]
    - [16, 10929.0]
  - - [4096, 6144, 1, 1024, 4096, 4096, 1024, 1024]
    - [58, 10774.0]
  - - [1024, 6144, 1, 4096, 1024, 1024, 4096, 4096]
    - [40, 7218.0]
  - - [512, 512, 192, 64, 512, 512, 64, 64]
    - [63, 7486.0]
  - - [1024, 10224, 1, 1024, 1024, 1024, 1024, 1024]
    - [16, 9735.0]
  - - [1024, 10192, 1, 1024, 1024, 1024, 1024, 1024]
    - [58, 10656.0]
  - - [1024, 10208, 1, 1024, 1024, 1024, 1024, 1024]
    - [16, 10065.0]
  - - [1024, 10224, 1, 4096, 1024, 1024, 4096, 4096]
    - [38, 8787.0]
  - - [4096, 10224, 1, 1024, 4096, 4096, 1024, 1024]
    - [16, 9839.0]
  - - [3072, 10224, 1, 1024, 3072, 3072, 1024, 1024]
    - [16, 9380.0]
  - - [3072, 10240, 1, 1024, 3072, 3072, 1024, 1024]
    - [16, 9390.0]
  - - [1024, 10192, 1, 4096, 1024, 1024, 4096, 4096]
    - [38, 8419.0]
  - - [4096, 10192, 1, 1024, 4096, 4096, 1024, 1024]
    - [16, 9823.0]
  - - [3072, 10192, 1, 1024, 3072, 3072, 1024, 1024]
    - [59, 10539.0]
  - - [3072, 10200, 1, 1024, 3072, 3072, 1024, 1024]
    - [16, 8891.0]
  - - [1024, 10184, 1, 1024, 1024, 1024, 1024, 1024]
    - [16, 9922.0]
  - - [3072, 10208, 1, 1024, 3072, 3072, 1024, 1024]
    - [16, 9420.0]
  - - [1024, 10208, 1, 4096, 1024, 1024, 4096, 4096]
    - [38, 8613.0]
  - - [4096, 10208, 1, 1024, 4096, 4096, 1024, 1024]
    - [40, 9763.0]
  - - [2048, 10224, 1, 1024, 2048, 2048, 1024, 1024]
    - [16, 7680.0]
  - - [2048, 10240, 1, 1024, 2048, 2048, 1024, 1024]
    - [16, 8065.0]
  - - [1024, 10120, 1, 1024, 1024, 1024, 1024, 1024]
    - [16, 9951.0]
  - - [2048, 10192, 1, 1024, 2048, 2048, 1024, 1024]
    - [49, 10139.0]
  - - [1024, 10152, 1, 1024, 1024, 1024, 1024, 1024]
    - [16, 10198.0]
  - - [3072, 10080, 1, 1024, 3072, 3072, 1024, 1024]
    - [16, 9227.0]
  - - [256, 256, 25, 12544, 256, 256, 12544, 12544]
    - [10, 7208.0]
  - - [256, 256, 49, 3200, 256, 256, 3200, 3200]
    - [60, 10559.0]
  - - [256, 256, 25, 6272, 256, 256, 6272, 6272]
    - [20, 9652.0]
  - - [256, 256, 49, 6400, 256, 256, 6400, 6400]
    - [62, 5554.0]
  - - [512, 512, 49, 1152, 512, 512, 1152, 1152]
    - [27, 11679.0]
  - - [512, 512, 25, 2048, 512, 512, 2048, 2048]
    - [12, 6240.0]
  - - [512, 512, 49, 2304, 512, 512, 2304, 2304]
    - [58, 7474.0]
  - - [512, 512, 25, 4096, 512, 512, 4096, 4096]
    - [9, 8709.0]
  - - [128, 128, 2048, 64, 128, 128, 64, 64]
    - [19, 5090.0]
  - - [30528, 2560, 1, 1024, 30528, 30528, 1024, 1024]
    - [60, 9930.0]
  - - [128, 128, 1536, 64, 128, 128, 64, 64]
    - [8, 5099.0]
  - - [1024, 12288, 1, 1024, 1024, 1024, 1024, 1024]
    - [58, 10519.0]
  - - [1024, 12288, 1, 4096, 1024, 1024, 4096, 4096]
    - [20, 9533.0]
  - - [30528, 1920, 1, 1024, 30528, 30528, 1024, 1024]
    - [58, 11160.0]
  - - [4096, 12288, 1, 1024, 4096, 4096, 1024, 1024]
    - [16, 10163.0]
  - - [128, 128, 81, 12544, 128, 128, 12544, 12544]
    - [19, 3973.0]
  - - [128, 128, 121, 9216, 128, 128, 9216, 9216]
    - [57, 4583.0]
  - - [128, 128, 169, 6400, 128, 128, 6400, 6400]
    - [42, 4517.0]
  - - [256, 256, 36, 4096, 256, 256, 4096, 4096]
    - [42, 7283.0]
  - - [256, 256, 49, 2304, 256, 256, 2304, 2304]
    - [20, 9448.0]
  - - [256, 256, 64, 2304, 256, 256, 2304, 2304]
    - [20, 9567.0]
  - - [256, 256, 81, 4096, 256, 256, 4096, 4096]
    - [42, 4984.0]
  - - [256, 256, 121, 2304, 256, 256, 2304, 2304]
    - [20, 8063.0]
  - - [256, 256, 169, 2304, 256, 256, 2304, 2304]
    - [38, 6181.0]
  - - [512, 512, 81, 1024, 512, 512, 1024, 1024]
    - [35, 7519.0]
  - - [512, 512, 121, 1024, 512, 512, 1024, 1024]
    - [16, 7087.0]
  - - [512, 512, 169, 1024, 512, 512, 1024, 1024]
    - [39, 7710.0]
  - - [512, 512, 36, 1024, 512, 512, 1024, 1024]
    - [58, 7617.0]
  - - [512, 512, 49, 1024, 512, 512, 1024, 1024]
    - [43, 8559.0]
  - - [512, 512, 64, 1024, 512, 512, 1024, 1024]
    - [17, 7843.0]
  - - [128, 128, 192, 64, 128, 128, 64, 64]
    - [13, 5013.0]
  - - [768, 2048, 1, 768, 768, 768, 768, 768]
    - [38, 10060.0]
  - - [3072, 2048, 1, 768, 3072, 3072, 768, 768]
    - [27, 11092.0]
  - - [768, 2048, 1, 3072, 768, 768, 3072, 3072]
    - [58, 10698.0]
  - - [384, 384, 144, 64, 384, 384, 64, 64]
    - [57, 7151.0]
  - - [768, 4608, 1, 768, 768, 768, 768, 768]
    - [16, 11196.0]
  - - [3072, 4608, 1, 768, 3072, 3072, 768, 768]
    - [18, 11448.0]
  - - [768, 4608, 1, 3072, 768, 768, 3072, 3072]
    - [60, 9637.0]
  - - [512, 512, 48, 64, 512, 512, 64, 64]
    - [15, 7970.0]
  - - [128, 128, 256, 64, 128, 128, 64, 64]
    - [4, 6129.0]
  - - [384, 384, 192, 64, 384, 384, 64, 64]
    - [0, 7324.0]
  - - [1024, 4608, 1, 1024, 1024, 1024, 1024, 1024]
    - [16, 10576.0]
  - - [4096, 4608, 1, 1024, 4096, 4096, 1024, 1024]
    - [17, 8126.0]
  - - [1024, 4608, 1, 4096, 1024, 1024, 4096, 4096]
    - [5, 8321.0]
  - - [256, 256, 36, 432, 256, 256, 432, 432]
    - [45, 8722.0]
  - - [256, 256, 36, 456, 256, 256, 456, 456]
    - [23, 9337.0]
  - - [256, 256, 36, 504, 256, 256, 504, 504]
    - [25, 9663.0]
  - - [256, 256, 49, 1120, 256, 256, 1120, 1120]
    - [18, 11365.0]
  - - [256, 256, 36, 442, 256, 256, 442, 442]
    - [44, 9979.0]
  - - [256, 256, 49, 950, 256, 256, 950, 950]
    - [18, 11089.0]
  - - [256, 256, 64, 616, 256, 256, 616, 616]
    - [5, 10883.0]
  - - [256, 256, 64, 660, 256, 256, 660, 660]
    - [49, 11005.0]
  - - [256, 256, 36, 408, 256, 256, 408, 408]
    - [44, 10175.0]
  - - [256, 256, 49, 1008, 256, 256, 1008, 1008]
    - [60, 11390.0]
  - - [256, 256, 36, 462, 256, 256, 462, 462]
    - [1, 9971.0]
  - - [256, 256, 36, 468, 256, 256, 468, 468]
    - [44, 10177.0]
  - - [256, 256, 36, 494, 256, 256, 494, 494]
    - [44, 10220.0]
  - - [512, 512, 64, 48, 512, 512, 48, 48]
    - [1, 7596.0]
  - - [256, 256, 64, 140, 256, 256, 140, 140]
    - [44, 9265.0]
  - - [512, 512, 64, 56, 512, 512, 56, 56]
    - [17, 7861.0]
  - - [512, 512, 49, 90, 512, 512, 90, 90]
    - [6, 9543.0]
  - - [512, 512, 49, 60, 512, 512, 60, 60]
    - [50, 7911.0]
  - - [256, 256, 49, 864, 256, 256, 864, 864]
    - [51, 11276.0]
  - - [256, 256, 64, 224, 256, 256, 224, 224]
    - [5, 10710.0]
  - - [256, 256, 64, 176, 256, 256, 176, 176]
    - [0, 10299.0]
  - - [256, 256, 64, 154, 256, 256, 154, 154]
    - [28, 9578.0]
  - - [512, 512, 49, 80, 512, 512, 80, 80]
    - [16, 10484.0]
  - - [256, 256, 49, 1200, 256, 256, 1200, 1200]
    - [7, 11489.0]
  - - [256, 256, 64, 704, 256, 256, 704, 704]
    - [5, 11293.0]
  - - [256, 256, 64, 768, 256, 256, 768, 768]
    - [60, 2353.0]
  - - [256, 256, 49, 1160, 256, 256, 1160, 1160]
    - [60, 11417.0]
  - - [256, 256, 49, 320, 256, 256, 320, 320]
    - [1, 11005.0]
  - - [512, 512, 49, 70, 512, 512, 70, 70]
    - [6, 8306.0]
  - - [256, 256, 49, 1240, 256, 256, 1240, 1240]
    - [29, 11541.0]
  - - [256, 256, 36, 384, 256, 256, 384, 384]
    - [5, 9828.0]
  - - [1024, 2048, 1, 888, 1024, 1024, 888, 888]
    - [1, 10807.0]
  - - [1024, 2048, 1, 713, 1024, 1024, 713, 713]
    - [12, 10106.0]
  - - [1024, 2048, 1, 660, 1024, 1024, 660, 660]
    - [23, 10170.0]
  - - [1024, 2048, 1, 726, 1024, 1024, 726, 726]
    - [1, 10336.0]
  - - [1024, 2048, 1, 672, 1024, 1024, 672, 672]
    - [1, 10424.0]
  - - [1024, 2048, 1, 850, 1024, 1024, 850, 850]
    - [1, 10281.0]
  - - [1024, 2048, 1, 805, 1024, 1024, 805, 805]
    - [1, 10360.0]
  - - [1024, 2048, 1, 864, 1024, 1024, 864, 864]
    - [23, 10568.0]
  - - [1024, 2048, 1, 768, 1024, 1024, 768, 768]
    - [16, 9994.0]
  - - [1024, 2048, 1, 950, 1024, 1024, 950, 950]
    - [23, 10327.0]
  - - [1024, 1024, 160, 96, 1024, 1024, 96, 96]
    - [7, 6669.0]
  - - [2880, 16384, 1, 1920, 2880, 2880, 1920, 1920]
    - [36, 11623.0]
  - - [1920, 16384, 1, 960, 1920, 1920, 960, 960]
    - [54, 12358.0]
  - - [3840, 16384, 1, 1920, 3840, 3840, 1920, 1920]
    - [40, 11879.0]
  - - [1920, 16384, 1, 3840, 1920, 1920, 3840, 3840]
    - [5, 11971.0]
  - - [25216, 16384, 1, 1920, 25216, 25216, 1920, 1920]
    - [40, 12235.0]
  - - [1024, 1024, 40, 96, 1024, 1024, 96, 96]
    - [16, 10954.0]
  - - [2880, 4096, 1, 1920, 2880, 2880, 1920, 1920]
    - [23, 10775.0]
  - - [1920, 4096, 1, 960, 1920, 1920, 960, 960]
    - [23, 12280.0]
  - - [3840, 4096, 1, 1920, 3840, 3840, 1920, 1920]
    - [18, 12210.0]
  - - [1920, 4096, 1, 3840, 1920, 1920, 3840, 3840]
    - [60, 8933.0]
  - - [25216, 4096, 1, 1920, 25216, 25216, 1920, 1920]
    - [40, 11744.0]
  - - [1024, 1024, 80, 96, 1024, 1024, 96, 96]
    - [16, 10989.0]
  - - [2880, 8192, 1, 1920, 2880, 2880, 1920, 1920]
    - [16, 11723.0]
  - - [1920, 8192, 1, 960, 1920, 1920, 960, 960]
    - [49, 9808.0]
  - - [3840, 8192, 1, 1920, 3840, 3840, 1920, 1920]
    - [40, 11349.0]
  - - [1920, 8192, 1, 3840, 1920, 1920, 3840, 3840]
    - [40, 11969.0]
  - - [25216, 8192, 1, 1920, 25216, 25216, 1920, 1920]
    - [40, 12110.0]
  - - [1024, 1024, 96, 96, 1024, 1024, 96, 96]
    - [15, 8288.0]
  - - [1728, 16384, 1, 2304, 1728, 1728, 2304, 2304]
    - [40, 10591.0]
  - - [2304, 16384, 1, 576, 2304, 2304, 576, 576]
    - [25, 10803.0]
  - - [2304, 16384, 1, 2304, 2304, 2304, 2304, 2304]
    - [7, 11222.0]
  - - [12672, 16384, 1, 2304, 12672, 12672, 2304, 2304]
    - [60, 12029.0]
  - - [1024, 1024, 24, 96, 1024, 1024, 96, 96]
    - [16, 9417.0]
  - - [1728, 4096, 1, 2304, 1728, 1728, 2304, 2304]
    - [38, 10189.0]
  - - [2304, 4096, 1, 576, 2304, 2304, 576, 576]
    - [12, 12089.0]
  - - [2304, 4096, 1, 2304, 2304, 2304, 2304, 2304]
    - [40, 9841.0]
  - - [12672, 4096, 1, 2304, 12672, 12672, 2304, 2304]
    - [60, 11314.0]
  - - [1024, 1024, 48, 96, 1024, 1024, 96, 96]
    - [16, 10991.0]
  - - [1728, 8192, 1, 2304, 1728, 1728, 2304, 2304]
    - [58, 9461.0]
  - - [2304, 8192, 1, 576, 2304, 2304, 576, 576]
    - [34, 12076.0]
  - - [2304, 8192, 1, 2304, 2304, 2304, 2304, 2304]
    - [29, 11828.0]
  - - [12672, 8192, 1, 2304, 12672, 12672, 2304, 2304]
    - [60, 11838.0]
  - - [1024, 1024, 16, 96, 1024, 1024, 96, 96]
    - [11, 10556.0]
  - - [1152, 4096, 1, 3072, 1152, 1152, 3072, 3072]
    - [27, 9991.0]
  - - [3072, 4096, 1, 384, 3072, 3072, 384, 384]
    - [16, 11579.0]
  - - [1536, 4096, 1, 3072, 1536, 1536, 3072, 3072]
    - [62, 8920.0]
  - - [3072, 4096, 1, 1536, 3072, 3072, 1536, 1536]
    - [40, 9303.0]
  - - [6400, 4096, 1, 3072, 6400, 6400, 3072, 3072]
    - [38, 10196.0]
  - - [1024, 1024, 32, 96, 1024, 1024, 96, 96]
    - [16, 10911.0]
  - - [1152, 8192, 1, 3072, 1152, 1152, 3072, 3072]
    - [38, 8223.0]
  - - [3072, 8192, 1, 384, 3072, 3072, 384, 384]
    - [5, 11903.0]
  - - [1536, 8192, 1, 3072, 1536, 1536, 3072, 3072]
    - [38, 8898.0]
  - - [3072, 8192, 1, 1536, 3072, 3072, 1536, 1536]
    - [58, 9808.0]
  - - [6400, 8192, 1, 3072, 6400, 6400, 3072, 3072]
    - [16, 11260.0]
  - - [2048, 4096, 1, 2048, 2048, 2048, 2048, 2048]
    - [18, 10766.0]
  - - [2048, 4096, 1, 4096, 2048, 2048, 4096, 4096]
    - [58, 6550.0]
  - - [29000, 199, 1, 2048, 29000, 29000, 2048, 2048]
    - [18, 4026.0]
  - - [29000, 221, 1, 2048, 29000, 29000, 2048, 2048]
    - [43, 7011.0]
  - - [29000, 224, 1, 2048, 29000, 29000, 2048, 2048]
    - [60, 7768.0]
  - - [29000, 229, 1, 2048, 29000, 29000, 2048, 2048]
    - [43, 6895.0]
  - - [29000, 234, 1, 2048, 29000, 29000, 2048, 2048]
    - [63, 7315.0]
  - - [29000, 242, 1, 2048, 29000, 29000, 2048, 2048]
    - [43, 7355.0]
  - - [29000, 246, 1, 2048, 29000, 29000, 2048, 2048]
    - [18, 8926.0]
  - - [29000, 247, 1, 2048, 29000, 29000, 2048, 2048]
    - [40, 7197.0]
  - - [29000, 256, 1, 2048, 29000, 29000, 2048, 2048]
    - [21, 7151.0]
  - - [29000, 262, 1, 2048, 29000, 29000, 2048, 2048]
    - [29, 4902.0]
  - - [29000, 264, 1, 2048, 29000, 29000, 2048, 2048]
    - [61, 5750.0]
  - - [29000, 265, 1, 2048, 29000, 29000, 2048, 2048]
    - [59, 4358.0]
  - - [29000, 274, 1, 2048, 29000, 29000, 2048, 2048]
    - [39, 4343.0]
  - - [29000, 277, 1, 2048, 29000, 29000, 2048, 2048]
    - [28, 6057.0]
  - - [4096, 256, 1, 12288, 4096, 4096, 12288, 12288]
    - [63, 3963.0]
  - - [2048, 256, 1, 13312, 2048, 2048, 13312, 13312]
    - [67, 4118.0]
  - - [4096, 256, 1, 15360, 4096, 4096, 15360, 15360]
    - [17, 6271.0]
  - - [2048, 512, 1, 16640, 2048, 2048, 16640, 16640]
    - [64, 6470.0]
  - - [4096, 256, 1, 14336, 4096, 4096, 14336, 14336]
    - [13, 4465.0]
  - - [1024, 1024, 1, 8192, 1024, 1024, 8192, 8192]
    - [68, 9863.0]
  - - [1024, 512, 1, 16384, 1024, 1024, 16384, 16384]
    - [20, 7581.0]
  - - [4096, 256, 1, 9216, 4096, 4096, 9216, 9216]
    - [79, 3974.0]
  - - [1024, 512, 1, 12288, 1024, 1024, 12288, 12288]
    - [42, 7410.0]
  - - [4096, 200, 1, 12288, 4096, 4096, 12288, 12288]
    - [42, 5666.0]
  - - [1024, 1024, 1, 13312, 1024, 1024, 13312, 13312]
    - [76, 6277.0]
  - - [2048, 256, 1, 16384, 2048, 2048, 16384, 16384]
    - [77, 6475.0]
  - - [2048, 512, 1, 16384, 2048, 2048, 16384, 16384]
    - [85, 7119.0]
  - - [1024, 1024, 1, 8320, 1024, 1024, 8320, 8320]
    - [64, 10759.0]
  - - [2048, 256, 1, 14336, 2048, 2048, 14336, 14336]
    - [72, 6414.0]
  - - [4096, 200, 1, 16640, 4096, 4096, 16640, 16640]
    - [14, 5797.0]
  - - [1024, 1024, 1, 16640, 1024, 1024, 16640, 16640]
    - [48, 7395.0]
  - - [1024, 1024, 1, 14336, 1024, 1024, 14336, 14336]
    - [66, 6680.0]
  - - [2048, 512, 1, 9216, 2048, 2048, 9216, 9216]
    - [80, 8187.0]
  - - [1024, 1024, 1, 15360, 1024, 1024, 15360, 15360]
    - [27, 6865.0]
  - - [2048, 512, 1, 8192, 2048, 2048, 8192, 8192]
    - [20, 6108.0]
  - - [2048, 512, 1, 13312, 2048, 2048, 13312, 13312]
    - [71, 8496.0]
  - - [1024, 1024, 1, 11264, 1024, 1024, 11264, 11264]
    - [30, 6808.0]
  - - [1024, 512, 1, 16640, 1024, 1024, 16640, 16640]
    - [71, 6863.0]
  - - [2048, 512, 1, 10240, 2048, 2048, 10240, 10240]
    - [75, 7547.0]
  - - [2048, 256, 1, 16640, 2048, 2048, 16640, 16640]
    - [76, 8562.0]
  - - [4096, 256, 1, 13312, 4096, 4096, 13312, 13312]
    - [59, 7121.0]
  - - [4096, 200, 1, 15360, 4096, 4096, 15360, 15360]
    - [81, 5088.0]
  - - [2048, 512, 1, 12288, 2048, 2048, 12288, 12288]
    - [83, 6284.0]
  - - [4096, 256, 1, 8192, 4096, 4096, 8192, 8192]
    - [86, 5539.0]
  - - [2048, 512, 1, 15360, 2048, 2048, 15360, 15360]
    - [83, 5020.0]
  - - [2048, 512, 1, 11264, 2048, 2048, 11264, 11264]
    - [72, 8610.0]
  - - [2048, 256, 1, 12288, 2048, 2048, 12288, 12288]
    - [71, 8378.0]
  - - [1024, 1024, 1, 12288, 1024, 1024, 12288, 12288]
    - [72, 5843.0]
  - - [4096, 256, 1, 16384, 4096, 4096, 16384, 16384]
    - [73, 5684.0]
  - - [2048, 256, 1, 15360, 2048, 2048, 15360, 15360]
    - [87, 6407.0]
  - - [2048, 512, 1, 8320, 2048, 2048, 8320, 8320]
    - [78, 11130.0]
  - - [1024, 1024, 1, 10240, 1024, 1024, 10240, 10240]
    - [50, 8055.0]
  - - [1024, 1024, 1, 9216, 1024, 1024, 9216, 9216]
    - [85, 9267.0]
  - - [4096, 200, 1, 16384, 4096, 4096, 16384, 16384]
    - [52, 3959.0]
  - - [2048, 512, 1, 14336, 2048, 2048, 14336, 14336]
    - [72, 5896.0]
  - - [1024, 512, 1, 13312, 1024, 1024, 13312, 13312]
    - [50, 7702.0]
  - - [4096, 256, 1, 8320, 4096, 4096, 8320, 8320]
    - [83, 10842.0]
  - - [4096, 200, 1, 13312, 4096, 4096, 13312, 13312]
    - [59, 5885.0]
  - - [1024, 512, 1, 14336, 1024, 1024, 14336, 14336]
    - [35, 6629.0]
  - - [4096, 256, 1, 11264, 4096, 4096, 11264, 11264]
    - [84, 5747.0]
  - - [4096, 256, 1, 10240, 4096, 4096, 10240, 10240]
    - [82, 4222.0]
  - - [4096, 200, 1, 14336, 4096, 4096, 14336, 14336]
    - [38, 3515.0]
  - - [4096, 256, 1, 16640, 4096, 4096, 16640, 16640]
    - [39, 7871.0]
  - - [1024, 512, 1, 15360, 1024, 1024, 15360, 15360]
    - [70, 6071.0]
  - - [1024, 1024, 1, 16384, 1024, 1024, 16384, 16384]
    - [69, 7874.0]
  - - [224, 192, 36, 10368, 224, 224, 10368, 10368]
    - [68, 6055.0]
  - - [320, 256, 9, 19584, 320, 320, 19584, 19584]
    - [50, 7376.0]
  - - [256, 256, 11, 13056, 256, 256, 13056, 13056]
    - [80, 8945.0]
  - - [320, 256, 9, 9792, 320, 320, 9792, 9792]
    - [74, 9376.0]
  - - [320, 256, 11, 13056, 320, 320, 13056, 13056]
    - [71, 7487.0]
  - - [256, 256, 9, 9792, 256, 256, 9792, 9792]
    - [64, 10177.0]
  - - [256, 224, 9, 19584, 256, 256, 19584, 19584]
    - [65, 7703.0]
  - - [256, 256, 9, 19584, 256, 256, 19584, 19584]
    - [78, 8805.0]
  - - [128, 128, 36, 12000, 128, 128, 12000, 12000]
    - [38, 9415.0]
  - - [128, 128, 49, 12800, 128, 128, 12800, 12800]
    - [77, 6415.0]
  - - [128, 128, 25, 25088, 128, 128, 25088, 25088]
    - [77, 4777.0]
  - - [128, 128, 49, 25600, 128, 128, 25600, 25600]
    - [87, 4455.0]
  - - [128, 128, 25, 50176, 128, 128, 50176, 50176]
    - [87, 4520.0]
  - - [128, 128, 36, 12544, 128, 128, 12544, 12544]
    - [75, 7684.0]
  - - [128, 128, 49, 9216, 128, 128, 9216, 9216]
    - [87, 5611.0]
  - - [1024, 1024, 1, 12544, 1024, 1024, 12544, 12544]
    - [16, 9089.0]
  - - [1024, 1000, 1, 12544, 1024, 1024, 12544, 12544]
    - [18, 7785.0]
  - - [1024, 512, 1, 1600, 1024, 1024, 1600, 1600]
    - [93, 8105.0]
  - - [2048, 512, 1, 100, 2048, 2048, 100, 100]
    - [140, 5377.0]
  - - [768, 640, 1, 768, 768, 768, 768, 768]
    - [113, 8011.0]
  - - [768, 1280, 1, 768, 768, 768, 768, 768]
    - [136, 7799.0]
  - - [1024, 512, 1, 1024, 1024, 1024, 1024, 1024]
    - [148, 7241.0]
  - - [1024, 512, 1, 3072, 1024, 1024, 3072, 3072]
    - [115, 7785.0]
  - - [30522, 120, 1, 1024, 30522, 30522, 1024, 1024]
    - [115, 9332.0]
  - - [30522, 80, 1, 1024, 30522, 30522, 1024, 1024]
    - [115, 6417.0]
  - - [64, 128, 512, 128, 64, 64, 128, 128]
    - [110, 7239.0]
  - - [64, 512, 64, 512, 64, 64, 512, 512]
    - [114, 6809.0]
  - - [64, 64, 768, 64, 64, 64, 64, 64]
    - [177, 5265.0]
  - - [64, 64, 96, 64, 64, 64, 64, 64]
    - [92, 4072.0]
  - - [1856, 448, 1, 3328, 1856, 1856, 3328, 3328]
    - [132, 8582.0]
  - - [128, 6784, 1, 3328, 128, 128, 3328, 3328]
    - [115, 8963.0]
  - - [2048, 400, 1, 512, 2048, 2048, 512, 512]
    - [172, 6359.0]
  - - [2368, 448, 1, 128, 2368, 2368, 128, 128]
    - [140, 6516.0]
  - - [256, 4288, 1, 3328, 256, 256, 3328, 3328]
    - [99, 8585.0]
  - - [704, 1856, 1, 3328, 704, 704, 3328, 3328]
    - [113, 8271.0]
  - - [448, 1024, 1, 1280, 448, 448, 1280, 1280]
    - [148, 6533.0]
  - - [256, 1408, 1, 3328, 256, 256, 3328, 3328]
    - [146, 6688.0]
  - - [704, 1856, 1, 1280, 704, 704, 1280, 1280]
    - [115, 8204.0]
  - - [128, 5056, 1, 128, 128, 128, 128, 128]
    - [140, 5809.0]
  - - [2368, 128, 1, 256, 2368, 2368, 256, 256]
    - [173, 4936.0]
  - - [64, 5056, 1, 256, 64, 64, 256, 256]
    - [110, 4972.0]
  - - [256, 2944, 1, 256, 256, 256, 256, 256]
    - [148, 4555.0]
  - - [256, 1856, 1, 1280, 256, 256, 1280, 1280]
    - [146, 8157.0]
  - - [128, 3584, 1, 1280, 128, 128, 1280, 1280]
    - [146, 7991.0]
  - - [4288, 256, 1, 256, 4288, 4288, 256, 256]
    - [109, 7763.0]
  - - [2944, 128, 1, 128, 2944, 2944, 128, 128]
    - [139, 4158.0]
  - - [5888, 64, 1, 3328, 5888, 5888, 3328, 3328]
    - [151, 5194.0]
  - - [2944, 256, 1, 3328, 2944, 2944, 3328, 3328]
    - [113, 8119.0]
  - - [704, 1024, 1, 128, 704, 704, 128, 128]
    - [171, 5402.0]
  - - [1408, 448, 1, 1280, 1408, 1408, 1280, 1280]
    - [113, 8288.0]
  - - [1408, 704, 1, 3328, 1408, 1408, 3328, 3328]
    - [113, 8076.0]
  - - [1408, 256, 1, 1280, 1408, 1408, 1280, 1280]
    - [97, 5587.0]
  - - [3072, 128, 1, 1024, 3072, 3072, 1024, 1024]
    - [178, 6666.0]
  - - [2944, 256, 1, 256, 2944, 2944, 256, 256]
    - [178, 6713.0]
  - - [704, 1408, 1, 3328, 704, 704, 3328, 3328]
    - [113, 7874.0]
  - - [2944, 256, 1, 128, 2944, 2944, 128, 128]
    - [172, 5882.0]
  - - [2368, 128, 1, 3328, 2368, 2368, 3328, 3328]
    - [113, 7473.0]
  - - [2944, 128, 1, 256, 2944, 2944, 256, 256]
    - [145, 5538.0]
  - - [448, 1408, 1, 256, 448, 448, 256, 256]
    - [172, 5859.0]
  - - [64, 5056, 1, 3328, 64, 64, 3328, 3328]
    - [144, 7371.0]
  - - [1024, 448, 1, 128, 1024, 1024, 128, 128]
    - [169, 4559.0]
  - - [256, 3584, 1, 3328, 256, 256, 3328, 3328]
    - [115, 9498.0]
  - - [256, 1408, 1, 256, 256, 256, 256, 256]
    - [172, 4882.0]
  - - [5056, 64, 1, 1280, 5056, 5056, 1280, 1280]
    - [110, 7117.0]
  - - [1024, 704, 1, 256, 1024, 1024, 256, 256]
    - [146, 5889.0]
  - - [128, 4288, 1, 128, 128, 128, 128, 128]
    - [108, 3789.0]
  - - [6784, 64, 1, 128, 6784, 6784, 128, 128]
    - [172, 4662.0]
  - - [3584, 256, 1, 128, 3584, 3584, 128, 128]
    - [140, 6703.0]
  - - [5888, 64, 1, 256, 5888, 5888, 256, 256]
    - [113, 4993.0]
  - - [1856, 256, 1, 1280, 1856, 1856, 1280, 1280]
    - [113, 6679.0]
  - - [64, 5888, 1, 3328, 64, 64, 3328, 3328]
    - [112, 4387.0]
  - - [704, 1024, 1, 1280, 704, 704, 1280, 1280]
    - [178, 7245.0]
  - - [448, 1856, 1, 128, 448, 448, 128, 128]
    - [172, 6047.0]
  - - [1024, 704, 1, 1280, 1024, 1024, 1280, 1280]
    - [113, 7044.0]
  - - [128, 5888, 1, 256, 128, 128, 256, 256]
    - [180, 4460.0]
  - - [704, 704, 1, 3328, 704, 704, 3328, 3328]
    - [115, 7414.0]
  - - [704, 1408, 1, 1280, 704, 704, 1280, 1280]
    - [146, 7969.0]
  - - [3584, 256, 1, 3328, 3584, 3584, 3328, 3328]
    - [115, 9262.0]
  - - [704, 1856, 1, 128, 704, 704, 128, 128]
    - [144, 5973.0]
  - - [2944, 448, 1, 128, 2944, 2944, 128, 128]
    - [140, 7052.0]
  - - [128, 2944, 1, 1280, 128, 128, 1280, 1280]
    - [178, 6620.0]
  - - [448, 2944, 1, 1280, 448, 448, 1280, 1280]
    - [100, 8191.0]
  - - [3584, 128, 1, 256, 3584, 3584, 256, 256]
    - [175, 5576.0]
  - - [448, 1408, 1, 3328, 448, 448, 3328, 3328]
    - [110, 8303.0]
  - - [256, 3584, 1, 256, 256, 256, 256, 256]
    - [148, 7358.0]
  - - [256, 2944, 1, 3328, 256, 256, 3328, 3328]
    - [113, 8459.0]
  - - [448, 2368, 1, 128, 448, 448, 128, 128]
    - [139, 5620.0]
  - - [1408, 704, 1, 256, 1408, 1408, 256, 256]
    - [174, 6392.0]
  - - [448, 2944, 1, 3328, 448, 448, 3328, 3328]
    - [115, 8325.0]
  - - [64, 5888, 1, 256, 64, 64, 256, 256]
    - [177, 4213.0]
  - - [6784, 128, 1, 3328, 6784, 6784, 3328, 3328]
    - [100, 8845.0]
  - - [704, 704, 1, 256, 704, 704, 256, 256]
    - [162, 4682.0]
  - - [128, 4288, 1, 3328, 128, 128, 3328, 3328]
    - [143, 7811.0]
  - - [448, 704, 1, 1280, 448, 448, 1280, 1280]
    - [175, 6877.0]
  - - [128, 5056, 1, 1280, 128, 128, 1280, 1280]
    - [115, 8683.0]
  - - [1024, 448, 1, 3328, 1024, 1024, 3328, 3328]
    - [146, 8422.0]
  - - [1856, 704, 1, 1280, 1856, 1856, 1280, 1280]
    - [180, 8152.0]
  - - [448, 1024, 1, 128, 448, 448, 128, 128]
    - [127, 5097.0]
  - - [448, 2368, 1, 3328, 448, 448, 3328, 3328]
    - [132, 8335.0]
  - - [5056, 64, 1, 128, 5056, 5056, 128, 128]
    - [92, 4226.0]
  - - [1024, 700, 1, 512, 1024, 1024, 512, 512]
    - [146, 6191.0]
  - - [704, 1024, 1, 256, 704, 704, 256, 256]
    - [110, 5938.0]
  - - [128, 6784, 1, 1280, 128, 128, 1280, 1280]
    - [148, 8777.0]
  - - [1856, 256, 1, 256, 1856, 1856, 256, 256]
    - [173, 6231.0]
  - - [256, 4288, 1, 1280, 256, 256, 1280, 1280]
    - [178, 8799.0]
  - - [256, 1856, 1, 128, 256, 256, 128, 128]
    - [180, 3673.0]
  - - [7680, 64, 1, 2560, 7680, 7680, 2560, 2560]
    - [138, 4895.0]
  - - [448, 1408, 1, 128, 448, 448, 128, 128]
    - [158, 4899.0]
  - - [6784, 128, 1, 256, 6784, 6784, 256, 256]
    - [180, 7420.0]
  - - [704, 448, 1, 256, 704, 704, 256, 256]
    - [110, 4823.0]
  - - [704, 1408, 1, 128, 704, 704, 128, 128]
    - [172, 5726.0]
  - - [4288, 128, 1, 1280, 4288, 4288, 1280, 1280]
    - [174, 7913.0]
  - - [128, 2944, 1, 128, 128, 128, 128, 128]
    - [140, 3665.0]
  - - [1024, 704, 1, 3328, 1024, 1024, 3328, 3328]
    - [113, 7729.0]
  - - [128, 4288, 1, 256, 128, 128, 256, 256]
    - [108, 6168.0]
  - - [704, 448, 1, 3328, 704, 704, 3328, 3328]
    - [175, 7441.0]
  - - [448, 2368, 1, 1280, 448, 448, 1280, 1280]
    - [115, 8142.0]
  - - [64, 6784, 1, 3328, 64, 64, 3328, 3328]
    - [175, 7067.0]
  - - [2944, 256, 1, 1280, 2944, 2944, 1280, 1280]
    - [146, 7804.0]
  - - [256, 2368, 1, 128, 256, 256, 128, 128]
    - [93, 5187.0]
  - - [1856, 704, 1, 256, 1856, 1856, 256, 256]
    - [143, 6793.0]
  - - [1408, 448, 1, 3328, 1408, 1408, 3328, 3328]
    - [113, 8827.0]
  - - [1856, 448, 1, 1280, 1856, 1856, 1280, 1280]
    - [143, 8564.0]
  - - [128, 5888, 1, 128, 128, 128, 128, 128]
    - [172, 4572.0]
  - - [704, 1856, 1, 256, 704, 704, 256, 256]
    - [174, 7400.0]
  - - [256, 2368, 1, 1280, 256, 256, 1280, 1280]
    - [109, 8709.0]
  - - [2944, 448, 1, 256, 2944, 2944, 256, 256]
    - [113, 7503.0]
  - - [1856, 448, 1, 128, 1856, 1856, 128, 128]
    - [143, 5492.0]
  - - [2368, 128, 1, 1280, 2368, 2368, 1280, 1280]
    - [148, 7365.0]
  - - [64, 6784, 1, 256, 64, 64, 256, 256]
    - [175, 2579.0]
  - - [64, 5056, 1, 1280, 64, 64, 1280, 1280]
    - [110, 7087.0]
  - - [2368, 256, 1, 1280, 2368, 2368, 1280, 1280]
    - [174, 8544.0]
  - - [2368, 448, 1, 1280, 2368, 2368, 1280, 1280]
    - [113, 8481.0]
  - - [128, 3584, 1, 256, 128, 128, 256, 256]
    - [178, 4382.0]
  - - [704, 448, 1, 1280, 704, 704, 1280, 1280]
    - [175, 6915.0]
  - - [128, 3584, 1, 3328, 128, 128, 3328, 3328]
    - [113, 8420.0]
  - - [4288, 256, 1, 1280, 4288, 4288, 1280, 1280]
    - [109, 8123.0]
  - - [4288, 128, 1, 3328, 4288, 4288, 3328, 3328]
    - [143, 7760.0]
  - - [7680, 128, 1, 2560, 7680, 7680, 2560, 2560]
    - [180, 6210.0]
  - - [1408, 256, 1, 128, 1408, 1408, 128, 128]
    - [139, 3813.0]
  - - [256, 1408, 1, 1280, 256, 256, 1280, 1280]
    - [113, 6276.0]
  - - [128, 2368, 1, 256, 128, 128, 256, 256]
    - [113, 5488.0]
  - - [6784, 64, 1, 3328, 6784, 6784, 3328, 3328]
    - [113, 7608.0]
  - - [128, 2944, 1, 3328, 128, 128, 3328, 3328]
    - [163, 6705.0]
  - - [2944, 448, 1, 3328, 2944, 2944, 3328, 3328]
    - [178, 8265.0]
  - - [256, 4288, 1, 256, 256, 256, 256, 256]
    - [180, 6935.0]
  - - [5888, 128, 1, 256, 5888, 5888, 256, 256]
    - [180, 6536.0]
  - - [5056, 64, 1, 256, 5056, 5056, 256, 256]
    - [110, 4990.0]
  - - [1024, 704, 1, 128, 1024, 1024, 128, 128]
    - [108, 6980.0]
  - - [128, 5056, 1, 3328, 128, 128, 3328, 3328]
    - [180, 9021.0]
  - - [4288, 128, 1, 256, 4288, 4288, 256, 256]
    - [142, 4595.0]
  - - [1408, 448, 1, 128, 1408, 1408, 128, 128]
    - [140, 5902.0]
  - - [704, 448, 1, 128, 704, 704, 128, 128]
    - [141, 4205.0]
  - - [3584, 256, 1, 256, 3584, 3584, 256, 256]
    - [132, 8099.0]
  - - [128, 2944, 1, 256, 128, 128, 256, 256]
    - [146, 4762.0]
  - - [128, 6784, 1, 128, 128, 128, 128, 128]
    - [174, 6632.0]
  - - [448, 1856, 1, 256, 448, 448, 256, 256]
    - [175, 4779.0]
  - - [3584, 128, 1, 3328, 3584, 3584, 3328, 3328]
    - [146, 8478.0]
  - - [5888, 128, 1, 3328, 5888, 5888, 3328, 3328]
    - [151, 6569.0]
  - - [1408, 704, 1, 1280, 1408, 1408, 1280, 1280]
    - [146, 7967.0]
  - - [6784, 64, 1, 256, 6784, 6784, 256, 256]
    - [178, 5497.0]
  - - [448, 2944, 1, 256, 448, 448, 256, 256]
    - [148, 7221.0]
  - - [448, 2368, 1, 256, 448, 448, 256, 256]
    - [180, 7449.0]
  - - [64, 6784, 1, 1280, 64, 64, 1280, 1280]
    - [110, 7101.0]
  - - [128, 2368, 1, 3328, 128, 128, 3328, 3328]
    - [148, 7970.0]
  - - [5056, 64, 1, 3328, 5056, 5056, 3328, 3328]
    - [110, 7180.0]
  - - [64, 5888, 1, 128, 64, 64, 128, 128]
    - [179, 2722.0]
  - - [5056, 128, 1, 3328, 5056, 5056, 3328, 3328]
    - [115, 9214.0]
  - - [448, 704, 1, 256, 448, 448, 256, 256]
    - [175, 4603.0]
  - - [2944, 128, 1, 3328, 2944, 2944, 3328, 3328]
    - [113, 6954.0]
  - - [704, 704, 1, 128, 704, 704, 128, 128]
    - [156, 4571.0]
  - - [2368, 128, 1, 128, 2368, 2368, 128, 128]
    - [171, 3967.0]
  - - [5056, 128, 1, 128, 5056, 5056, 128, 128]
    - [108, 5643.0]
  - - [448, 1024, 1, 3328, 448, 448, 3328, 3328]
    - [110, 7868.0]
  - - [2368, 256, 1, 256, 2368, 2368, 256, 256]
    - [143, 6771.0]
  - - [256, 2368, 1, 3328, 256, 256, 3328, 3328]
    - [115, 9005.0]
  - - [256, 3584, 1, 128, 256, 256, 128, 128]
    - [140, 6267.0]
  - - [4288, 256, 1, 128, 4288, 4288, 128, 128]
    - [159, 6295.0]
  - - [2368, 256, 1, 128, 2368, 2368, 128, 128]
    - [169, 5344.0]
  - - [256, 1856, 1, 256, 256, 256, 256, 256]
    - [113, 6162.0]
  - - [256, 2944, 1, 128, 256, 256, 128, 128]
    - [140, 4771.0]
  - - [1408, 256, 1, 3328, 1408, 1408, 3328, 3328]
    - [146, 6658.0]
  - - [2368, 448, 1, 256, 2368, 2368, 256, 256]
    - [143, 7087.0]
  - - [4288, 256, 1, 3328, 4288, 4288, 3328, 3328]
    - [115, 8180.0]
  - - [1856, 704, 1, 128, 1856, 1856, 128, 128]
    - [174, 6462.0]
  - - [4288, 128, 1, 128, 4288, 4288, 128, 128]
    - [107, 5259.0]
  - - [1408, 448, 1, 256, 1408, 1408, 256, 256]
    - [146, 5615.0]
  - - [6784, 64, 1, 1280, 6784, 6784, 1280, 1280]
    - [146, 7458.0]
  - - [3584, 128, 1, 128, 3584, 3584, 128, 128]
    - [140, 4902.0]
  - - [256, 2368, 1, 256, 256, 256, 256, 256]
    - [146, 4844.0]
  - - [2944, 448, 1, 1280, 2944, 2944, 1280, 1280]
    - [174, 7940.0]
  - - [448, 1408, 1, 1280, 448, 448, 1280, 1280]
    - [110, 7407.0]
  - - [448, 1856, 1, 1280, 448, 448, 1280, 1280]
    - [148, 8298.0]
  - - [1856, 256, 1, 128, 1856, 1856, 128, 128]
    - [169, 5001.0]
  - - [2560, 128, 1, 2560, 2560, 2560, 2560, 2560]
    - [180, 7373.0]
  - - [448, 1024, 1, 256, 448, 448, 256, 256]
    - [110, 5837.0]
  - - [1024, 448, 1, 1280, 1024, 1024, 1280, 1280]
    - [113, 7955.0]
  - - [128, 5056, 1, 256, 128, 128, 256, 256]
    - [140, 6863.0]
  - - [448, 2944, 1, 128, 448, 448, 128, 128]
    - [179, 5128.0]
  - - [128, 3584, 1, 128, 128, 128, 128, 128]
    - [146, 4016.0]
  - - [1408, 256, 1, 256, 1408, 1408, 256, 256]
    - [113, 4708.0]
  - - [128, 5888, 1, 3328, 128, 128, 3328, 3328]
    - [163, 5879.0]
  - - [2368, 448, 1, 3328, 2368, 2368, 3328, 3328]
    - [113, 8549.0]
  - - [128, 5888, 1, 1280, 128, 128, 1280, 1280]
    - [178, 7365.0]
  - - [64, 5056, 1, 128, 64, 64, 128, 128]
    - [139, 4907.0]
  - - [64, 6784, 1, 128, 64, 64, 128, 128]
    - [169, 4185.0]
  - - [448, 704, 1, 128, 448, 448, 128, 128]
    - [156, 4086.0]
  - - [1408, 704, 1, 128, 1408, 1408, 128, 128]
    - [172, 6770.0]
  - - [2368, 256, 1, 3328, 2368, 2368, 3328, 3328]
    - [174, 8520.0]
  - - [5888, 128, 1, 1280, 5888, 5888, 1280, 1280]
    - [113, 8066.0]
  - - [256, 3584, 1, 1280, 256, 256, 1280, 1280]
    - [115, 9259.0]
  - - [256, 1408, 1, 128, 256, 256, 128, 128]
    - [124, 4377.0]
  - - [256, 4288, 1, 128, 256, 256, 128, 128]
    - [157, 4613.0]
  - - [5888, 128, 1, 128, 5888, 5888, 128, 128]
    - [140, 5444.0]
  - - [1856, 256, 1, 3328, 1856, 1856, 3328, 3328]
    - [113, 8606.0]
  - - [64, 5888, 1, 1280, 64, 64, 1280, 1280]
    - [175, 6267.0]
  - - [704, 704, 1, 1280, 704, 704, 1280, 1280]
    - [143, 7149.0]
  - - [128, 2368, 1, 1280, 128, 128, 1280, 1280]
    - [115, 7354.0]
  - - [3584, 256, 1, 1280, 3584, 3584, 1280, 1280]
    - [148, 9243.0]
  - - [5888, 64, 1, 1280, 5888, 5888, 1280, 1280]
    - [146, 6564.0]
  - - [3584, 128, 1, 1280, 3584, 3584, 1280, 1280]
    - [113, 6668.0]
  - - [5056, 128, 1, 1280, 5056, 5056, 1280, 1280]
    - [113, 8259.0]
  - - [448, 1856, 1, 3328, 448, 448, 3328, 3328]
    - [100, 8593.0]
  - - [1024, 448, 1, 256, 1024, 1024, 256, 256]
    - [178, 5854.0]
  - - [2944, 128, 1, 1280, 2944, 2944, 1280, 1280]
    - [113, 6566.0]
  - - [128, 2368, 1, 128, 128, 128, 128, 128]
    - [161, 4000.0]
  - - [256, 2944, 1, 1280, 256, 256, 1280, 1280]
    - [113, 8171.0]
  - - [704, 1024, 1, 3328, 704, 704, 3328, 3328]
    - [143, 7792.0]
  - - [128, 6784, 1, 256, 128, 128, 256, 256]
    - [180, 6964.0]
  - - [256, 1856, 1, 3328, 256, 256, 3328, 3328]
    - [113, 8635.0]
  - - [6784, 128, 1, 128, 6784, 6784, 128, 128]
    - [143, 6196.0]
  - - [704, 1408, 1, 256, 704, 704, 256, 256]
    - [174, 6814.0]
  - - [4096, 128, 1, 4096, 4096, 4096, 4096, 4096]
    - [180, 7361.0]
  - - [5888, 64, 1, 128, 5888, 5888, 128, 128]
    - [177, 3986.0]
  - - [5056, 128, 1, 256, 5056, 5056, 256, 256]
    - [174, 7147.0]
  - - [6784, 128, 1, 1280, 6784, 6784, 1280, 1280]
    - [109, 8824.0]
  - - [1856, 448, 1, 256, 1856, 1856, 256, 256]
    - [171, 5896.0]
  - - [128, 4288, 1, 1280, 128, 128, 1280, 1280]
    - [109, 7903.0]
  - - [448, 704, 1, 3328, 448, 448, 3328, 3328]
    - [110, 7586.0]
  - - [1856, 704, 1, 3328, 1856, 1856, 3328, 3328]
    - [113, 8238.0]
  - - [1024, 1024, 1, 3328, 1024, 1024, 3328, 3328]
    - [113, 8423.0]
  - - [2048, 200, 1, 3200, 2048, 2048, 3200, 3200]
    - [159, 6188.0]
  - - [2048, 256, 1, 3328, 2048, 2048, 3328, 3328]
    - [100, 7793.0]
  - - [4096, 200, 1, 11264, 4096, 4096, 11264, 11264]
    - [180, 3154.0]
  - - [2048, 512, 1, 1024, 2048, 2048, 1024, 1024]
    - [172, 7648.0]
  - - [1024, 1024, 1, 64, 1024, 1024, 64, 64]
    - [157, 4942.0]
  - - [512, 1024, 1, 1536, 512, 512, 1536, 1536]
    - [109, 7687.0]
  - - [1024, 512, 1, 512, 1024, 1024, 512, 512]
    - [174, 6674.0]
  - - [2048, 512, 1, 640, 2048, 2048, 640, 640]
    - [131, 8196.0]
  - - [1024, 1024, 1, 512, 1024, 1024, 512, 512]
    - [113, 8049.0]
  - - [2048, 256, 1, 2048, 2048, 2048, 2048, 2048]
    - [109, 7384.0]
  - - [1024, 512, 1, 128, 1024, 1024, 128, 128]
    - [143, 5053.0]
  - - [2048, 512, 1, 256, 2048, 2048, 256, 256]
    - [109, 7566.0]
  - - [4096, 200, 1, 2560, 4096, 4096, 2560, 2560]
    - [143, 6488.0]
  - - [1024, 1024, 1, 1152, 1024, 1024, 1152, 1152]
    - [178, 8278.0]
  - - [2048, 200, 1, 32, 2048, 2048, 32, 32]
    - [170, 1928.0]
  - - [512, 1024, 1, 2816, 512, 512, 2816, 2816]
    - [100, 7739.0]
  - - [2048, 200, 1, 2080, 2048, 2048, 2080, 2080]
    - [159, 6553.0]
  - - [2048, 200, 1, 1024, 2048, 2048, 1024, 1024]
    - [143, 5133.0]
  - - [4096, 200, 1, 4096, 4096, 4096, 4096, 4096]
    - [109, 6386.0]
  - - [1024, 512, 1, 11264, 1024, 1024, 11264, 11264]
    - [180, 7685.0]
  - - [1024, 1024, 1, 1792, 1024, 1024, 1792, 1792]
    - [165, 8218.0]
  - - [4096, 200, 1, 768, 4096, 4096, 768, 768]
    - [174, 6335.0]
  - - [4096, 256, 1, 1024, 4096, 4096, 1024, 1024]
    - [113, 8243.0]
  - - [1024, 512, 1, 256, 1024, 1024, 256, 256]
    - [174, 5965.0]
  - - [1024, 512, 1, 1408, 1024, 1024, 1408, 1408]
    - [109, 7885.0]
  - - [1024, 512, 1, 5632, 1024, 1024, 5632, 5632]
    - [180, 8038.0]
  - - [4096, 200, 1, 256, 4096, 4096, 256, 256]
    - [180, 4702.0]
  - - [512, 1024, 1, 3072, 512, 512, 3072, 3072]
    - [180, 7883.0]
  - - [1024, 1024, 1, 4160, 1024, 1024, 4160, 4160]
    - [95, 8741.0]
  - - [2048, 256, 1, 384, 2048, 2048, 384, 384]
    - [159, 6834.0]
  - - [4096, 200, 1, 640, 4096, 4096, 640, 640]
    - [109, 6471.0]
  - - [1024, 1024, 1, 7168, 1024, 1024, 7168, 7168]
    - [178, 8352.0]
  - - [4096, 256, 1, 768, 4096, 4096, 768, 768]
    - [109, 7470.0]
  - - [2048, 256, 1, 6656, 2048, 2048, 6656, 6656]
    - [115, 7795.0]
  - - [2048, 200, 1, 3072, 2048, 2048, 3072, 3072]
    - [109, 5802.0]
  - - [1024, 512, 1, 2816, 1024, 1024, 2816, 2816]
    - [109, 8019.0]
  - - [4096, 256, 1, 7680, 4096, 4096, 7680, 7680]
    - [148, 7061.0]
  - - [4096, 200, 1, 1024, 4096, 4096, 1024, 1024]
    - [113, 6559.0]
  - - [2048, 200, 1, 1792, 2048, 2048, 1792, 1792]
    - [174, 6113.0]
  - - [1024, 1024, 1, 2816, 1024, 1024, 2816, 2816]
    - [113, 8306.0]
  - - [2048, 512, 1, 1536, 2048, 2048, 1536, 1536]
    - [165, 8039.0]
  - - [4096, 256, 1, 3072, 4096, 4096, 3072, 3072]
    - [178, 8332.0]
  - - [2048, 256, 1, 5632, 2048, 2048, 5632, 5632]
    - [115, 7745.0]
  - - [1024, 512, 1, 6656, 1024, 1024, 6656, 6656]
    - [115, 7810.0]
  - - [4096, 200, 1, 2080, 4096, 4096, 2080, 2080]
    - [125, 7300.0]
  - - [2048, 200, 1, 13312, 2048, 2048, 13312, 13312]
    - [118, 4538.0]
  - - [4096, 256, 1, 3584, 4096, 4096, 3584, 3584]
    - [115, 7425.0]
  - - [2048, 256, 1, 8192, 2048, 2048, 8192, 8192]
    - [104, 6424.0]
  - - [2048, 512, 1, 512, 2048, 2048, 512, 512]
    - [172, 7401.0]
  - - [2048, 512, 1, 1152, 2048, 2048, 1152, 1152]
    - [113, 8347.0]
  - - [2048, 200, 1, 9216, 2048, 2048, 9216, 9216]
    - [120, 4129.0]
  - - [2048, 200, 1, 2560, 2048, 2048, 2560, 2560]
    - [109, 5781.0]
  - - [2048, 256, 1, 4608, 2048, 2048, 4608, 4608]
    - [109, 7803.0]
  - - [2048, 256, 1, 3584, 2048, 2048, 3584, 3584]
    - [115, 7533.0]
  - - [1024, 512, 1, 640, 1024, 1024, 640, 640]
    - [109, 7207.0]
  - - [2048, 512, 1, 768, 2048, 2048, 768, 768]
    - [100, 7860.0]
  - - [2048, 200, 1, 1408, 2048, 2048, 1408, 1408]
    - [174, 6087.0]
  - - [4096, 200, 1, 2048, 4096, 4096, 2048, 2048]
    - [143, 6366.0]
  - - [1024, 1024, 1, 5632, 1024, 1024, 5632, 5632]
    - [113, 8654.0]
  - - [2048, 512, 1, 3584, 2048, 2048, 3584, 3584]
    - [113, 8439.0]
  - - [1024, 512, 1, 64, 1024, 1024, 64, 64]
    - [174, 3517.0]
  - - [4096, 200, 1, 7680, 4096, 4096, 7680, 7680]
    - [115, 6341.0]
  - - [1024, 1024, 1, 1280, 1024, 1024, 1280, 1280]
    - [113, 7793.0]
  - - [2048, 200, 1, 896, 2048, 2048, 896, 896]
    - [143, 5881.0]
  - - [2048, 256, 1, 32, 2048, 2048, 32, 32]
    - [121, 2363.0]
  - - [2048, 256, 1, 1280, 2048, 2048, 1280, 1280]
    - [115, 7544.0]
  - - [4096, 256, 1, 4096, 4096, 4096, 4096, 4096]
    - [148, 7844.0]
  - - [2048, 256, 1, 11264, 2048, 2048, 11264, 11264]
    - [113, 6935.0]
  - - [4096, 200, 1, 9216, 4096, 4096, 9216, 9216]
    - [115, 6235.0]
  - - [1024, 512, 1, 4096, 1024, 1024, 4096, 4096]
    - [115, 7482.0]
  - - [4096, 200, 1, 3840, 4096, 4096, 3840, 3840]
    - [180, 6284.0]
  - - [1024, 1024, 1, 1920, 1024, 1024, 1920, 1920]
    - [143, 8201.0]
  - - [2048, 200, 1, 7168, 2048, 2048, 7168, 7168]
    - [115, 5458.0]
  - - [4096, 256, 1, 1152, 4096, 4096, 1152, 1152]
    - [143, 7984.0]
  - - [2048, 256, 1, 1920, 2048, 2048, 1920, 1920]
    - [95, 7776.0]
  - - [2048, 512, 1, 4160, 2048, 2048, 4160, 4160]
    - [95, 8759.0]
  - - [2048, 512, 1, 5632, 2048, 2048, 5632, 5632]
    - [113, 8659.0]
  - - [4096, 256, 1, 7168, 4096, 4096, 7168, 7168]
    - [115, 7696.0]
  - - [4096, 200, 1, 128, 4096, 4096, 128, 128]
    - [171, 3603.0]
  - - [2048, 200, 1, 5120, 2048, 2048, 5120, 5120]
    - [115, 6140.0]
  - - [1024, 1024, 1, 6656, 1024, 1024, 6656, 6656]
    - [113, 8643.0]
  - - [512, 1024, 1, 3200, 512, 512, 3200, 3200]
    - [128, 7998.0]
  - - [2048, 256, 1, 1536, 2048, 2048, 1536, 1536]
    - [109, 7674.0]
  - - [4096, 256, 1, 256, 4096, 4096, 256, 256]
    - [143, 7354.0]
  - - [2048, 512, 1, 1408, 2048, 2048, 1408, 1408]
    - [163, 8595.0]
  - - [1024, 512, 1, 2080, 1024, 1024, 2080, 2080]
    - [93, 8230.0]
  - - [2048, 512, 1, 2304, 2048, 2048, 2304, 2304]
    - [113, 8563.0]
  - - [4096, 200, 1, 512, 4096, 4096, 512, 512]
    - [140, 6419.0]
  - - [2048, 200, 1, 1280, 2048, 2048, 1280, 1280]
    - [109, 5532.0]
  - - [1024, 1024, 1, 2304, 1024, 1024, 2304, 2304]
    - [113, 8585.0]
  - - [2048, 512, 1, 4608, 2048, 2048, 4608, 4608]
    - [113, 8545.0]
  - - [4096, 256, 1, 6144, 4096, 4096, 6144, 6144]
    - [120, 7031.0]
  - - [4096, 256, 1, 896, 4096, 4096, 896, 896]
    - [159, 7914.0]
  - - [2048, 256, 1, 640, 2048, 2048, 640, 640]
    - [174, 7633.0]
  - - [2048, 512, 1, 384, 2048, 2048, 384, 384]
    - [174, 7415.0]
  - - [2048, 200, 1, 16384, 2048, 2048, 16384, 16384]
    - [120, 5569.0]
  - - [4096, 200, 1, 10240, 4096, 4096, 10240, 10240]
    - [115, 4806.0]
  - - [1024, 512, 1, 9216, 1024, 1024, 9216, 9216]
    - [148, 7855.0]
  - - [4096, 200, 1, 1920, 4096, 4096, 1920, 1920]
    - [143, 6515.0]
  - - [2048, 512, 1, 7680, 2048, 2048, 7680, 7680]
    - [115, 7383.0]
  - - [1024, 512, 1, 3584, 1024, 1024, 3584, 3584]
    - [109, 7646.0]
  - - [1024, 1024, 1, 32, 1024, 1024, 32, 32]
    - [183, 2289.0]
  - - [2048, 512, 1, 1664, 2048, 2048, 1664, 1664]
    - [131, 8377.0]
  - - [2048, 200, 1, 2048, 2048, 2048, 2048, 2048]
    - [143, 5724.0]
  - - [1024, 1024, 1, 3584, 1024, 1024, 3584, 3584]
    - [113, 8729.0]
  - - [4096, 256, 1, 6656, 4096, 4096, 6656, 6656]
    - [115, 7019.0]
  - - [4096, 256, 1, 4160, 4096, 4096, 4160, 4160]
    - [143, 8819.0]
  - - [2048, 256, 1, 3072, 2048, 2048, 3072, 3072]
    - [115, 7903.0]
  - - [2048, 256, 1, 8320, 2048, 2048, 8320, 8320]
    - [159, 8050.0]
  - - [1024, 512, 1, 3200, 1024, 1024, 3200, 3200]
    - [128, 7985.0]
  - - [1024, 512, 1, 896, 1024, 1024, 896, 896]
    - [165, 7587.0]
  - - [2048, 512, 1, 1280, 2048, 2048, 1280, 1280]
    - [146, 8448.0]
  - - [4096, 200, 1, 64, 4096, 4096, 64, 64]
    - [153, 3369.0]
  - - [1024, 1024, 1, 5120, 1024, 1024, 5120, 5120]
    - [178, 8268.0]
  - - [2048, 512, 1, 6656, 2048, 2048, 6656, 6656]
    - [113, 8769.0]
  - - [1024, 1024, 1, 128, 1024, 1024, 128, 128]
    - [178, 5716.0]
  - - [512, 1024, 1, 1792, 512, 512, 1792, 1792]
    - [109, 7832.0]
  - - [4096, 256, 1, 2816, 4096, 4096, 2816, 2816]
    - [146, 8309.0]
  - - [1024, 1024, 1, 4096, 1024, 1024, 4096, 4096]
    - [115, 8336.0]
  - - [2048, 200, 1, 4160, 2048, 2048, 4160, 4160]
    - [128, 6523.0]
  - - [1024, 512, 1, 768, 1024, 1024, 768, 768]
    - [180, 7219.0]
  - - [4096, 200, 1, 8320, 4096, 4096, 8320, 8320]
    - [178, 6897.0]
  - - [2048, 512, 1, 896, 2048, 2048, 896, 896]
    - [109, 8504.0]
  - - [4096, 200, 1, 7168, 4096, 4096, 7168, 7168]
    - [115, 6388.0]
  - - [2048, 200, 1, 3840, 2048, 2048, 3840, 3840]
    - [180, 5875.0]
  - - [1024, 1024, 1, 768, 1024, 1024, 768, 768]
    - [146, 8037.0]
  - - [4096, 256, 1, 2304, 4096, 4096, 2304, 2304]
    - [178, 8222.0]
  - - [2048, 200, 1, 16640, 2048, 2048, 16640, 16640]
    - [115, 6013.0]
  - - [2048, 256, 1, 2816, 2048, 2048, 2816, 2816]
    - [109, 7682.0]
  - - [1024, 512, 1, 384, 1024, 1024, 384, 384]
    - [172, 6825.0]
  - - [2048, 200, 1, 7680, 2048, 2048, 7680, 7680]
    - [187, 5562.0]
  - - [1024, 512, 1, 4608, 1024, 1024, 4608, 4608]
    - [148, 7644.0]
  - - [4096, 200, 1, 32, 4096, 4096, 32, 32]
    - [176, 2225.0]
  - - [4096, 200, 1, 3328, 4096, 4096, 3328, 3328]
    - [113, 6699.0]
  - - [1024, 1024, 1, 1408, 1024, 1024, 1408, 1408]
    - [131, 8529.0]
  - - [2048, 200, 1, 15360, 2048, 2048, 15360, 15360]
    - [120, 5565.0]
  - - [512, 1024, 1, 2048, 512, 512, 2048, 2048]
    - [180, 7017.0]
  - - [4096, 256, 1, 5632, 4096, 4096, 5632, 5632]
    - [166, 5605.0]
  - - [2048, 256, 1, 1408, 2048, 2048, 1408, 1408]
    - [180, 7585.0]
  - - [2048, 256, 1, 6144, 2048, 2048, 6144, 6144]
    - [115, 7747.0]
  - - [4096, 256, 1, 3328, 4096, 4096, 3328, 3328]
    - [178, 8302.0]
  - - [2048, 512, 1, 6144, 2048, 2048, 6144, 6144]
    - [178, 8548.0]
  - - [2048, 512, 1, 3200, 2048, 2048, 3200, 3200]
    - [131, 8476.0]
  - - [2048, 200, 1, 4608, 2048, 2048, 4608, 4608]
    - [109, 6208.0]
  - - [1024, 1024, 1, 6144, 1024, 1024, 6144, 6144]
    - [178, 8447.0]
  - - [4096, 256, 1, 1664, 4096, 4096, 1664, 1664]
    - [143, 8223.0]
  - - [2048, 200, 1, 384, 2048, 2048, 384, 384]
    - [169, 4640.0]
  - - [4096, 256, 1, 1792, 4096, 4096, 1792, 1792]
    - [146, 8554.0]
  - - [2048, 512, 1, 2816, 2048, 2048, 2816, 2816]
    - [113, 8283.0]
  - - [4096, 256, 1, 384, 4096, 4096, 384, 384]
    - [172, 7958.0]
  - - [2048, 256, 1, 128, 2048, 2048, 128, 128]
    - [177, 5023.0]
  - - [1024, 1024, 1, 640, 1024, 1024, 640, 640]
    - [180, 8022.0]
  - - [4096, 200, 1, 5632, 4096, 4096, 5632, 5632]
    - [104, 4522.0]
  - - [2048, 200, 1, 1152, 2048, 2048, 1152, 1152]
    - [159, 5477.0]
  - - [4096, 256, 1, 512, 4096, 4096, 512, 512]
    - [178, 7940.0]
  - - [1024, 1024, 1, 384, 1024, 1024, 384, 384]
    - [95, 8040.0]
  - - [2048, 200, 1, 512, 2048, 2048, 512, 512]
    - [174, 5293.0]
  - - [2048, 256, 1, 9216, 2048, 2048, 9216, 9216]
    - [102, 4993.0]
  - - [2048, 256, 1, 1792, 2048, 2048, 1792, 1792]
    - [174, 7239.0]
  - - [4096, 200, 1, 1792, 4096, 4096, 1792, 1792]
    - [178, 6692.0]
  - - [2048, 200, 1, 1536, 2048, 2048, 1536, 1536]
    - [109, 5684.0]
  - - [1024, 1024, 1, 3072, 1024, 1024, 3072, 3072]
    - [113, 8215.0]
  - - [1024, 1024, 1, 2080, 1024, 1024, 2080, 2080]
    - [108, 9696.0]
  - - [2048, 200, 1, 2304, 2048, 2048, 2304, 2304]
    - [109, 6186.0]
  - - [2048, 256, 1, 7168, 2048, 2048, 7168, 7168]
    - [187, 6574.0]
  - - [2048, 512, 1, 1792, 2048, 2048, 1792, 1792]
    - [146, 8054.0]
  - - [1024, 1024, 1, 4608, 1024, 1024, 4608, 4608]
    - [113, 8524.0]
  - - [512, 1024, 1, 1280, 512, 512, 1280, 1280]
    - [180, 7309.0]
  - - [2048, 256, 1, 3200, 2048, 2048, 3200, 3200]
    - [95, 8225.0]
  - - [1024, 512, 1, 3328, 1024, 1024, 3328, 3328]
    - [115, 7924.0]
  - - [1024, 512, 1, 4160, 1024, 1024, 4160, 4160]
    - [143, 8552.0]
  - - [4096, 200, 1, 6656, 4096, 4096, 6656, 6656]
    - [146, 6496.0]
  - - [2048, 200, 1, 3328, 2048, 2048, 3328, 3328]
    - [109, 6071.0]
  - - [1024, 1024, 1, 256, 1024, 1024, 256, 256]
    - [109, 7279.0]
  - - [2048, 256, 1, 64, 2048, 2048, 64, 64]
    - [125, 3624.0]
  - - [2048, 256, 1, 2304, 2048, 2048, 2304, 2304]
    - [100, 7765.0]
  - - [4096, 200, 1, 8192, 4096, 4096, 8192, 8192]
    - [180, 5305.0]
  - - [1024, 512, 1, 7168, 1024, 1024, 7168, 7168]
    - [180, 7815.0]
  - - [1024, 512, 1, 1792, 1024, 1024, 1792, 1792]
    - [180, 7419.0]
  - - [4096, 200, 1, 2816, 4096, 4096, 2816, 2816]
    - [113, 6677.0]
  - - [1024, 1024, 1, 896, 1024, 1024, 896, 896]
    - [115, 7962.0]
  - - [4096, 256, 1, 5120, 4096, 4096, 5120, 5120]
    - [115, 8384.0]
  - - [4096, 256, 1, 2048, 4096, 4096, 2048, 2048]
    - [146, 8149.0]
