library/src/blas3/Tensile/Logic/asm_full/r9nano_Cijk_Ailk_Bljk_SB.yaml
- {MinimumRequiredVersion: 4.4.0}
- r9nano
- gfx803
- [Device 7300]
- - - [4096, 7000, 1, 4096]
    - [59, 6931.44]
  - - [5124, 9124, 1, 1760]
    - [63, 6984.42]
  - - [5124, 9124, 1, 2560]
    - [63, 7009.08]
  - - [1760, 32, 1, 1760]
    - [18, 2415.34]
  - - [1024, 1500, 1, 1536]
    - [62, 5345.6]
  - - [512, 24000, 1, 1536]
    - [59, 6539.36]
  - - [3072, 24000, 1, 1024]
    - [59, 6557.44]
  - - [1024, 3000, 1, 2560]
    - [59, 6211.26]
  - - [7680, 4, 1, 2560]
    - [21, 788.34]
  - - [35, 1500, 1, 2048]
    - [13, 1329.39]
  - - [8448, 1500, 1, 2816]
    - [64, 6756.87]
  - - [2560, 7000, 1, 2560]
    - [63, 6791.76]
  - - [3072, 16, 1, 1024]
    - [43, 1443.02]
  - - [512, 48000, 1, 2048]
    - [59, 6591.81]
  - - [1760, 64, 1, 1760]
    - [31, 3235.14]
  - - [1024, 16, 1, 512]
    - [23, 501.726]
  - - [512, 48000, 1, 1536]
    - [59, 6730.76]
  - - [2560, 32, 1, 2560]
    - [39, 2733.55]
  - - [4608, 1500, 1, 1536]
    - [62, 6197.75]
  - - [2048, 128, 1, 2048]
    - [22, 3215.62]
  - - [1024, 24000, 1, 2560]
    - [63, 6940.83]
  - - [4608, 3000, 1, 1536]
    - [59, 6545.46]
  - - [5124, 9124, 1, 2048]
    - [63, 6770.65]
  - - [1024, 700, 1, 512]
    - [54, 3561.79]
  - - [3072, 1, 1, 128]
    - [29, 29.6096]
  - - [5124, 700, 1, 2560]
    - [56, 5991.51]
  - - [8448, 16, 1, 2816]
    - [48, 2842.3]
  - - [6144, 6000, 1, 2560]
    - [63, 7081.17]
  - - [4608, 32, 1, 1536]
    - [31, 2859.81]
  - - [35, 8457, 1, 2560]
    - [15, 2346.88]
  - - [3072, 64, 1, 1024]
    - [26, 2429.18]
  - - [512, 16, 1, 512]
    - [17, 280.368]
  - - [7680, 2, 1, 2560]
    - [3, 402.561]
  - - [4224, 1, 1, 128]
    - [42, 36.9311]
  - - [7680, 1, 1, 2560]
    - [3, 203.784]
  - - [128, 1500, 1, 1280]
    - [46, 3176.88]
  - - [35, 8457, 1, 4096]
    - [35, 2221.84]
  - - [1024, 1500, 1, 2816]
    - [57, 5971.07]
  - - [6144, 2, 1, 2560]
    - [21, 350.154]
  - - [8448, 48000, 1, 2816]
    - [63, 7486.04]
  - - [512, 6000, 1, 1536]
    - [59, 5872.5]
  - - [4224, 1500, 1, 176]
    - [56, 4295.66]
  - - [1024, 6000, 1, 2816]
    - [64, 6786.72]
  - - [512, 6000, 1, 2560]
    - [59, 6212.83]
  - - [512, 32, 1, 512]
    - [17, 501.726]
  - - [2560, 128, 1, 2560]
    - [46, 4267.78]
  - - [4608, 24000, 1, 1536]
    - [63, 7157.88]
  - - [512, 2, 1, 500000]
    - [7, 487.219]
  - - [7680, 48000, 1, 2560]
    - [63, 7322.47]
  - - [3072, 48000, 1, 1024]
    - [63, 6717.01]
  - - [1760, 16, 1, 1760]
    - [51, 1548.82]
  - - [512, 3000, 1, 2816]
    - [59, 5995.58]
  - - [1760, 7000, 1, 1760]
    - [64, 6567.43]
  - - [1024, 3000, 1, 2048]
    - [57, 5582.77]
  - - [6144, 4, 1, 2560]
    - [22, 695.969]
  - - [1024, 6000, 1, 2048]
    - [59, 5910.23]
  - - [512, 24000, 1, 2816]
    - [64, 7037.02]
  - - [6144, 48000, 1, 2560]
    - [63, 7331.33]
  - - [8448, 3000, 1, 2816]
    - [64, 7110.08]
  - - [35, 1500, 1, 2560]
    - [10, 1676.68]
  - - [3072, 4, 1, 1024]
    - [16, 429.752]
  - - [4608, 48000, 1, 1536]
    - [63, 7195.38]
  - - [2048, 32, 1, 2048]
    - [26, 2383.17]
  - - [7680, 1500, 1, 2560]
    - [59, 6536.04]
  - - [4096, 128, 1, 4096]
    - [57, 4746.1]
  - - [4608, 16, 1, 1536]
    - [20, 2042.72]
  - - [1024, 1500, 1, 2048]
    - [52, 4343.08]
  - - [3072, 3000, 1, 1024]
    - [59, 5996.98]
  - - [3072, 2, 1, 1024]
    - [1, 217.852]
  - - [8448, 1, 1, 2816]
    - [3, 210.308]
  - - [1024, 48000, 1, 2560]
    - [63, 7182.7]
  - - [1024, 3000, 1, 2816]
    - [64, 6476.77]
  - - [128, 1, 1, 1408]
    - [41, 12.0475]
  - - [35, 8457, 1, 1760]
    - [9, 2356.01]
  - - [1024, 2, 1, 512]
    - [30, 74.4727]
  - - [1024, 4, 1, 500000]
    - [6, 884.879]
  - - [6144, 1, 1, 2560]
    - [6, 177.287]
  - - [1024, 48000, 1, 2816]
    - [63, 7328.75]
  - - [512, 48000, 1, 2816]
    - [64, 7155.94]
  - - [2048, 16, 1, 2048]
    - [51, 1701.56]
  - - [1024, 24000, 1, 1536]
    - [59, 6672.61]
  - - [7680, 6000, 1, 2560]
    - [63, 7098.96]
  - - [1760, 128, 1, 1760]
    - [32, 3797.88]
  - - [35, 8457, 1, 2048]
    - [14, 2150.89]
  - - [512, 1500, 1, 2816]
    - [54, 5552.27]
  - - [512, 1, 1, 512]
    - [8, 19.9805]
  - - [512, 16, 1, 500000]
    - [0, 3520.9]
  - - [512, 8, 1, 500000]
    - [2, 1885.02]
  - - [512, 24000, 1, 2560]
    - [59, 6704.44]
  - - [6144, 3000, 1, 2560]
    - [63, 6871.63]
  - - [1024, 24000, 1, 2816]
    - [63, 7131.11]
  - - [2048, 7000, 1, 2048]
    - [59, 6547.86]
  - - [7680, 3000, 1, 2560]
    - [63, 6854.76]
  - - [1024, 4, 1, 512]
    - [30, 143.248]
  - - [5124, 700, 1, 2048]
    - [59, 5599.34]
  - - [5124, 9124, 1, 4096]
    - [63, 6961.61]
  - - [4096, 64, 1, 4096]
    - [28, 3719.04]
  - - [512, 6000, 1, 2048]
    - [59, 4805.36]
  - - [7680, 32, 1, 2560]
    - [15, 3851.35]
  - - [2560, 64, 1, 2560]
    - [44, 3564.22]
  - - [3072, 128, 1, 1024]
    - [54, 3052.3]
  - - [8448, 6000, 1, 2816]
    - [64, 7316.32]
  - - [7680, 64, 1, 2560]
    - [46, 4275.32]
  - - [5124, 1500, 1, 2560]
    - [63, 6306.88]
  - - [1024, 1500, 1, 2560]
    - [59, 5805.9]
  - - [512, 4, 1, 512]
    - [36, 75.7642]
  - - [1024, 6000, 1, 2560]
    - [59, 6495.68]
  - - [3072, 32, 1, 1024]
    - [18, 1903.65]
  - - [35, 700, 1, 2560]
    - [11, 1428.08]
  - - [4608, 1, 1, 1536]
    - [3, 154.406]
  - - [4096, 32, 1, 4096]
    - [28, 3363.91]
  - - [7680, 24000, 1, 2560]
    - [63, 7359.05]
  - - [8448, 4, 1, 2816]
    - [3, 815.843]
  - - [64, 1, 1, 1216]
    - [34, 5.34524]
  - - [512, 1, 1, 500000]
    - [7, 244.242]
  - - [176, 1500, 1, 1408]
    - [46, 3197.85]
  - - [512, 3000, 1, 1536]
    - [59, 5549.81]
  - - [8448, 24000, 1, 2816]
    - [63, 7443.7]
  - - [4608, 2, 1, 1536]
    - [37, 313.74]
  - - [1024, 48000, 1, 1536]
    - [63, 6944.02]
  - - [7680, 128, 1, 2560]
    - [59, 5420.95]
  - - [3072, 6000, 1, 1024]
    - [59, 6303.66]
  - - [3072, 1500, 1, 128]
    - [61, 3040.38]
  - - [1024, 3000, 1, 1536]
    - [59, 5876.01]
  - - [512, 4, 1, 500000]
    - [7, 967.588]
  - - [35, 700, 1, 2048]
    - [12, 1018.2]
  - - [1024, 16, 1, 500000]
    - [4, 3295.1]
  - - [512, 24000, 1, 2048]
    - [57, 6312.01]
  - - [1024, 32, 1, 512]
    - [24, 856.002]
  - - [512, 48000, 1, 2560]
    - [59, 6881.73]
  - - [2560, 16, 1, 2560]
    - [48, 2048.04]
  - - [2048, 64, 1, 2048]
    - [22, 2721.42]
  - - [512, 2, 1, 512]
    - [36, 39.2446]
  - - [1024, 1, 1, 512]
    - [36, 37.2377]
  - - [512, 1500, 1, 2560]
    - [54, 5294.36]
  - - [6144, 32, 1, 2560]
    - [32, 3487.56]
  - - [1024, 1, 1, 500000]
    - [6, 218.002]
  - - [6144, 16, 1, 2560]
    - [22, 2565.89]
  - - [1024, 24000, 1, 2048]
    - [59, 6643.53]
  - - [4096, 16, 1, 4096]
    - [40, 2410.56]
  - - [5124, 1500, 1, 2048]
    - [59, 6117.73]
  - - [3072, 1500, 1, 1024]
    - [57, 5642.72]
  - - [1024, 2, 1, 500000]
    - [6, 438.724]
  - - [1024, 8, 1, 500000]
    - [6, 1767.56]
  - - [7680, 16, 1, 2560]
    - [21, 2893.46]
  - - [6144, 1500, 1, 2560]
    - [63, 6661.32]
  - - [3072, 1, 1, 1024]
    - [1, 109.839]
  - - [512, 6000, 1, 2816]
    - [64, 6452.42]
  - - [8448, 2, 1, 2816]
    - [3, 415.909]
  - - [4608, 4, 1, 1536]
    - [3, 592.794]
  - - [1024, 6000, 1, 1536]
    - [59, 6237.33]
  - - [8448, 32, 1, 2816]
    - [46, 3838.64]
  - - [512, 3000, 1, 2048]
    - [65, 3635.23]
  - - [6144, 24000, 1, 2560]
    - [63, 7253.8]
  - - [512, 3000, 1, 2560]
    - [57, 5871.09]
  - - [4608, 6000, 1, 1536]
    - [63, 6848.79]
  - - [512, 1500, 1, 2048]
    - [57, 3977.57]
  - - [512, 1500, 1, 1536]
    - [54, 5019.01]
  - - [128, 1, 1, 1024]
    - [5, 9.20449]
  - - [1024, 48000, 1, 2048]
    - [59, 6777.76]
- - - -1
    - - - -1
        - - - 4
            - - [-1, 71]
          - - 64
            - - [4, 71]
              - [128, 41]
              - [256, 50]
              - [704, 25]
              - [1408, 18]
              - [1856, 15]
              - [2368, 31]
              - [2944, 15]
              - [4288, 18]
              - [-1, 15]
          - - 128
            - - [4, 71]
              - [64, 41]
              - [128, 17]
              - [256, 16]
              - [448, 45]
              - [704, 18]
              - [1408, 46]
              - [1856, 15]
              - [2944, 46]
              - [3584, 56]
              - [5056, 46]
              - [5888, 56]
              - [-1, 58]
          - - 256
            - - [4, 71]
              - [64, 17]
              - [128, 19]
              - [256, 38]
              - [448, 46]
              - [2944, 56]
              - [3584, 58]
              - [5056, 56]
              - [5888, 58]
              - [-1, 54]
          - - 448
            - - [4, 71]
              - [64, 25]
              - [128, 45]
              - [256, 46]
              - [448, 31]
              - [1408, 56]
              - [1856, 58]
              - [2368, 56]
              - [2944, 57]
              - [3584, 56]
              - [4288, 53]
              - [5056, 56]
              - [5888, 63]
              - [-1, 53]
          - - 704
            - - [4, 71]
              - [64, 45]
              - [128, 18]
              - [1024, 56]
              - [1408, 53]
              - [2368, 56]
              - [2944, 55]
              - [5888, 53]
              - [-1, 63]
          - - 1024
            - - [4, 30]
              - [64, 45]
              - [128, 46]
              - [256, 54]
              - [448, 56]
              - [704, 54]
              - [1024, 60]
              - [1408, 57]
              - [1856, 64]
              - [2368, 57]
              - [2944, 64]
              - [4288, 58]
              - [5056, 63]
              - [-1, 64]
          - - 1408
            - - [4, 49]
              - [64, 18]
              - [128, 46]
              - [448, 56]
              - [1024, 58]
              - [1408, 64]
              - [1856, 58]
              - [2368, 56]
              - [4288, 64]
              - [5888, 63]
              - [-1, 58]
          - - 1856
            - - [4, 66]
              - [64, 46]
              - [128, 44]
              - [256, 56]
              - [448, 58]
              - [704, 54]
              - [1024, 64]
              - [1408, 53]
              - [2944, 58]
              - [3584, 63]
              - [4288, 64]
              - [5056, 58]
              - [5888, 64]
              - [-1, 63]
          - - 2368
            - - [4, 66]
              - [64, 32]
              - [128, 44]
              - [704, 54]
              - [1024, 58]
              - [1408, 54]
              - [2368, 58]
              - [2944, 63]
              - [4288, 58]
              - [5056, 64]
              - [5888, 63]
              - [-1, 64]
          - - 2944
            - - [4, 69]
              - [128, 44]
              - [256, 54]
              - [704, 58]
              - [1408, 63]
              - [1856, 58]
              - [2368, 64]
              - [2944, 58]
              - [4288, 64]
              - [5056, 63]
              - [5888, 64]
              - [-1, 63]
          - - 3584
            - - [4, 69]
              - [64, 39]
              - [128, 56]
              - [256, 58]
              - [448, 54]
              - [1024, 58]
              - [1408, 63]
              - [2368, 58]
              - [-1, 63]
          - - 4288
            - - [4, 69]
              - [64, 47]
              - [128, 44]
              - [256, 54]
              - [1024, 58]
              - [1408, 63]
              - [1856, 64]
              - [2368, 58]
              - [3584, 63]
              - [5056, 64]
              - [-1, 63]
          - - 5056
            - - [4, 72]
              - [128, 46]
              - [448, 54]
              - [704, 60]
              - [1408, 63]
              - [2368, 64]
              - [3584, 63]
              - [5056, 64]
              - [-1, 63]
          - - 5888
            - - [4, 68]
              - [64, 46]
              - [128, 56]
              - [256, 60]
              - [448, 64]
              - [704, 57]
              - [1024, 64]
              - [1856, 63]
              - [2368, 64]
              - [2944, 63]
              - [-1, 64]
          - - -1
            - - [4, 67]
              - [64, 56]
              - [128, 58]
              - [256, 54]
              - [448, 57]
              - [2368, 64]
              - [2944, 63]
              - [5056, 64]
              - [5888, 63]
              - [-1, 64]
