library/src/blas3/Tensile/Logic/asm_full/r9nano_Cijk_Ailk_Bjlk_SB.yaml
- {MinimumRequiredVersion: 4.4.0}
- r9nano
- gfx803
- [Device 7300]
- - - [4096, 7133, 1, 4096]
    - [31, 7471.44]
  - - [512, 16, 1, 512]
    - [7, 292.909]
  - - [1760, 7133, 1, 1760]
    - [32, 6747.64]
  - - [2560, 7133, 1, 2560]
    - [31, 7142.02]
  - - [1024, 32, 1, 512]
    - [5, 888.647]
  - - [3072, 7435, 1, 1024]
    - [31, 6717.7]
  - - [512, 32, 1, 512]
    - [7, 566.817]
  - - [2048, 7133, 1, 2048]
    - [31, 7137.32]
  - - [7680, 5481, 1, 2560]
    - [31, 7337.54]
  - - [1024, 16, 1, 512]
    - [12, 499.337]
- - - -1
    - - - -1
        - - - 4
            - - [-1, 37]
          - - 64
            - - [4, 37]
              - [128, 13]
              - [256, 7]
              - [448, 17]
              - [1408, 2]
              - [1856, 0]
              - [2944, 2]
              - [3584, 1]
              - [4288, 2]
              - [5056, 3]
              - [5888, 2]
              - [-1, 26]
          - - 128
            - - [4, 37]
              - [64, 14]
              - [128, 7]
              - [256, 17]
              - [704, 2]
              - [1024, 1]
              - [1408, 20]
              - [1856, 2]
              - [2368, 20]
              - [2944, 0]
              - [3584, 26]
              - [4288, 2]
              - [5056, 0]
              - [5888, 26]
              - [-1, 22]
          - - 256
            - - [4, 37]
              - [64, 8]
              - [128, 18]
              - [256, 16]
              - [448, 20]
              - [2944, 26]
              - [3584, 22]
              - [5056, 26]
              - [5888, 21]
              - [-1, 26]
          - - 448
            - - [4, 37]
              - [64, 17]
              - [128, 2]
              - [256, 10]
              - [448, 9]
              - [1408, 26]
              - [1856, 28]
              - [2368, 26]
              - [2944, 22]
              - [3584, 26]
              - [4288, 22]
              - [5888, 26]
              - [-1, 22]
          - - 704
            - - [4, 15]
              - [64, 4]
              - [128, 3]
              - [1024, 26]
              - [1408, 22]
              - [1856, 23]
              - [2368, 26]
              - [3584, 22]
              - [5888, 24]
              - [-1, 31]
          - - 1024
            - - [4, 7]
              - [64, 2]
              - [128, 6]
              - [256, 23]
              - [704, 26]
              - [1408, 24]
              - [1856, 32]
              - [2368, 27]
              - [2944, 32]
              - [3584, 21]
              - [4288, 28]
              - [-1, 32]
          - - 1408
            - - [4, 39]
              - [64, 2]
              - [128, 20]
              - [256, 26]
              - [448, 23]
              - [704, 28]
              - [1024, 24]
              - [1408, 32]
              - [1856, 27]
              - [2368, 23]
              - [5888, 32]
              - [-1, 27]
          - - 1856
            - - [4, 36]
              - [64, 1]
              - [128, 3]
              - [256, 26]
              - [448, 25]
              - [704, 23]
              - [1024, 32]
              - [1856, 24]
              - [2368, 23]
              - [3584, 24]
              - [4288, 32]
              - [5888, 24]
              - [-1, 32]
          - - 2368
            - - [4, 39]
              - [64, 3]
              - [128, 19]
              - [704, 23]
              - [1024, 24]
              - [1408, 22]
              - [2368, 27]
              - [2944, 31]
              - [3584, 29]
              - [4288, 24]
              - [-1, 32]
          - - 2944
            - - [4, 35]
              - [64, 19]
              - [128, 1]
              - [256, 23]
              - [448, 24]
              - [704, 27]
              - [1408, 32]
              - [1856, 24]
              - [2368, 32]
              - [3584, 24]
              - [4288, 27]
              - [-1, 32]
          - - 3584
            - - [4, 35]
              - [64, 0]
              - [128, 23]
              - [256, 22]
              - [448, 23]
              - [704, 27]
              - [1024, 24]
              - [1408, 31]
              - [1856, 27]
              - [2368, 30]
              - [2944, 27]
              - [3584, 31]
              - [5888, 32]
              - [-1, 31]
          - - 4288
            - - [4, 39]
              - [128, 3]
              - [256, 23]
              - [704, 27]
              - [1024, 24]
              - [1408, 32]
              - [1856, 31]
              - [2944, 24]
              - [3584, 32]
              - [5056, 24]
              - [-1, 32]
          - - 5056
            - - [4, 38]
              - [64, 19]
              - [128, 1]
              - [448, 23]
              - [704, 27]
              - [1408, 31]
              - [1856, 24]
              - [2368, 32]
              - [3584, 31]
              - [4288, 27]
              - [5056, 32]
              - [-1, 31]
          - - 5888
            - - [4, 38]
              - [64, 20]
              - [128, 23]
              - [256, 25]
              - [448, 32]
              - [704, 27]
              - [1024, 31]
              - [1408, 32]
              - [1856, 27]
              - [-1, 32]
          - - -1
            - - [4, 33]
              - [64, 23]
              - [128, 25]
              - [256, 23]
              - [448, 27]
              - [1024, 32]
              - [1408, 24]
              - [1856, 27]
              - [-1, 32]
