library/src/blas3/Tensile/Logic/asm_full/r9nano_Cijk_Alik_Bljk_SB.yaml
- {MinimumRequiredVersion: 4.4.0}
- r9nano
- gfx803
- [Device 7300]
- - - [8448, 48000, 1, 2816]
    - [48, 6082.95]
  - - [2048, 7000, 1, 2048]
    - [46, 4904.75]
  - - [7680, 64, 1, 2560]
    - [10, 3115.25]
  - - [7680, 128, 1, 2560]
    - [27, 3569.08]
  - - [4096, 64, 1, 4096]
    - [29, 2168.34]
  - - [512, 24000, 1, 2048]
    - [46, 4939.83]
  - - [5124, 9124, 1, 2560]
    - [48, 5915.09]
  - - [1024, 48000, 1, 2560]
    - [46, 5780.28]
  - - [2048, 32, 1, 2048]
    - [6, 989.241]
  - - [3072, 48000, 1, 1024]
    - [48, 5824.55]
  - - [5124, 9124, 1, 4096]
    - [49, 5597.27]
  - - [5124, 9124, 1, 1760]
    - [38, 6332.64]
  - - [4096, 32, 1, 4096]
    - [6, 1478.2]
  - - [512, 48000, 1, 2560]
    - [46, 5681.96]
  - - [1760, 64, 1, 1760]
    - [30, 2673.28]
  - - [512, 24000, 1, 1536]
    - [51, 5491.94]
  - - [4096, 128, 1, 4096]
    - [27, 2538.68]
  - - [4608, 24000, 1, 1536]
    - [39, 6280.14]
  - - [7680, 48000, 1, 2560]
    - [46, 5893.84]
  - - [8448, 16, 1, 2816]
    - [10, 1524.51]
  - - [4608, 16, 1, 1536]
    - [9, 1070.81]
  - - [6144, 24000, 1, 2560]
    - [48, 6110.34]
  - - [3072, 24000, 1, 1024]
    - [50, 5684.46]
  - - [2560, 64, 1, 2560]
    - [22, 2489.53]
  - - [1024, 16, 1, 500000]
    - [0, 2118.76]
  - - [3072, 16, 1, 1024]
    - [20, 606.709]
  - - [3072, 128, 1, 1024]
    - [10, 1767.29]
  - - [2560, 7000, 1, 2560]
    - [48, 5721.62]
  - - [8448, 24000, 1, 2816]
    - [48, 6150.66]
  - - [512, 48000, 1, 2048]
    - [49, 5303.25]
  - - [2048, 64, 1, 2048]
    - [19, 1479.5]
  - - [512, 24000, 1, 2816]
    - [39, 6312.5]
  - - [2560, 128, 1, 2560]
    - [8, 3053.56]
  - - [2560, 16, 1, 2560]
    - [26, 1144.75]
  - - [6144, 48000, 1, 2560]
    - [46, 5864.33]
  - - [1024, 24000, 1, 2048]
    - [46, 5277.58]
  - - [1760, 7000, 1, 1760]
    - [52, 6521.45]
  - - [4096, 16, 1, 4096]
    - [5, 803.136]
  - - [512, 48000, 1, 1536]
    - [51, 5746.07]
  - - [35, 8457, 1, 2048]
    - [4, 2070.95]
  - - [6144, 32, 1, 2560]
    - [10, 2543.07]
  - - [8448, 32, 1, 2816]
    - [9, 2935.22]
  - - [1024, 8, 1, 500000]
    - [0, 1064.11]
  - - [7680, 16, 1, 2560]
    - [26, 1428.34]
  - - [1024, 24000, 1, 2560]
    - [46, 5680.36]
  - - [1760, 16, 1, 1760]
    - [34, 1171.13]
  - - [5124, 9124, 1, 2048]
    - [49, 5294.01]
  - - [35, 8457, 1, 1760]
    - [2, 2216.47]
  - - [1024, 700, 1, 512]
    - [42, 2783.74]
  - - [2560, 32, 1, 2560]
    - [9, 2025.87]
  - - [1760, 32, 1, 1760]
    - [9, 2100.11]
  - - [6144, 16, 1, 2560]
    - [9, 1364.77]
  - - [7680, 24000, 1, 2560]
    - [49, 5835.31]
  - - [4096, 7000, 1, 4096]
    - [49, 5260.78]
  - - [3072, 32, 1, 1024]
    - [36, 1065.46]
  - - [4608, 32, 1, 1536]
    - [10, 1848.04]
  - - [35, 8457, 1, 2560]
    - [4, 2202.79]
  - - [4608, 48000, 1, 1536]
    - [39, 6328.18]
  - - [1024, 48000, 1, 2816]
    - [51, 6085.41]
  - - [3072, 64, 1, 1024]
    - [36, 1516.96]
  - - [512, 48000, 1, 2816]
    - [39, 6477.94]
  - - [2048, 16, 1, 2048]
    - [13, 583.769]
  - - [1024, 24000, 1, 1536]
    - [50, 5728.91]
  - - [1024, 48000, 1, 1536]
    - [50, 5847.87]
  - - [1760, 128, 1, 1760]
    - [18, 3586.29]
  - - [2048, 128, 1, 2048]
    - [10, 1991.4]
  - - [35, 8457, 1, 4096]
    - [3, 2105.47]
  - - [512, 8, 1, 500000]
    - [1, 1263.47]
  - - [512, 24000, 1, 2560]
    - [50, 5721.18]
  - - [7680, 32, 1, 2560]
    - [9, 2710.01]
  - - [1024, 48000, 1, 2048]
    - [46, 5436.65]
  - - [512, 16, 1, 500000]
    - [0, 2019.36]
  - - [1024, 24000, 1, 2816]
    - [39, 6229.72]
- - - -1
    - - - -1
        - - - 4
            - - [-1, 58]
          - - 64
            - - [4, 58]
              - [64, 21]
              - [128, 23]
              - [256, 37]
              - [448, 12]
              - [1024, 31]
              - [1408, 28]
              - [1856, 32]
              - [2368, 17]
              - [2944, 32]
              - [3584, 17]
              - [4288, 27]
              - [5056, 7]
              - [5888, 32]
              - [-1, 27]
          - - 128
            - - [4, 58]
              - [64, 23]
              - [128, 24]
              - [256, 12]
              - [704, 28]
              - [2368, 32]
              - [2944, 30]
              - [3584, 44]
              - [4288, 32]
              - [5888, 44]
              - [-1, 40]
          - - 256
            - - [4, 58]
              - [64, 25]
              - [128, 35]
              - [256, 11]
              - [448, 32]
              - [2944, 44]
              - [3584, 40]
              - [5056, 44]
              - [5888, 40]
              - [-1, 52]
          - - 448
            - - [4, 23]
              - [64, 14]
              - [256, 33]
              - [448, 17]
              - [1408, 44]
              - [1856, 45]
              - [2368, 44]
              - [2944, 45]
              - [3584, 52]
              - [4288, 40]
              - [5056, 44]
              - [5888, 52]
              - [-1, 40]
          - - 704
            - - [4, 59]
              - [64, 33]
              - [128, 27]
              - [1024, 44]
              - [1408, 40]
              - [1856, 44]
              - [2368, 53]
              - [5888, 40]
              - [-1, 52]
          - - 1024
            - - [4, 59]
              - [64, 9]
              - [128, 32]
              - [256, 41]
              - [704, 44]
              - [1408, 38]
              - [1856, 53]
              - [2368, 45]
              - [2944, 53]
              - [4288, 47]
              - [5056, 53]
              - [-1, 52]
          - - 1408
            - - [4, 57]
              - [64, 27]
              - [128, 30]
              - [448, 44]
              - [704, 45]
              - [1024, 40]
              - [1408, 52]
              - [1856, 38]
              - [2368, 40]
              - [-1, 52]
          - - 1856
            - - [4, 54]
              - [128, 30]
              - [256, 44]
              - [448, 43]
              - [704, 44]
              - [1024, 52]
              - [1408, 40]
              - [2944, 45]
              - [5056, 52]
              - [5888, 53]
              - [-1, 52]
          - - 2368
            - - [4, 15]
              - [64, 18]
              - [128, 30]
              - [448, 41]
              - [704, 53]
              - [1024, 40]
              - [2368, 45]
              - [3584, 52]
              - [4288, 45]
              - [5056, 53]
              - [-1, 52]
          - - 2944
            - - [4, 54]
              - [128, 30]
              - [256, 41]
              - [448, 43]
              - [704, 45]
              - [1408, 52]
              - [1856, 40]
              - [-1, 52]
          - - 3584
            - - [4, 15]
              - [128, 41]
              - [256, 45]
              - [448, 53]
              - [704, 38]
              - [1024, 40]
              - [2368, 52]
              - [-1, 53]
          - - 4288
            - - [4, 55]
              - [64, 14]
              - [128, 27]
              - [256, 41]
              - [448, 45]
              - [704, 38]
              - [1024, 43]
              - [1408, 52]
              - [1856, 53]
              - [5056, 52]
              - [5888, 53]
              - [-1, 52]
          - - 5056
            - - [4, 55]
              - [64, 8]
              - [448, 41]
              - [704, 38]
              - [1408, 52]
              - [1856, 53]
              - [3584, 52]
              - [-1, 53]
          - - 5888
            - - [4, 16]
              - [64, 8]
              - [128, 41]
              - [256, 43]
              - [448, 53]
              - [704, 38]
              - [1408, 52]
              - [-1, 53]
          - - -1
            - - [4, 55]
              - [64, 41]
              - [128, 43]
              - [256, 53]
              - [448, 38]
              - [-1, 53]
