library/src/blas3/Tensile/Logic/asm_full/vega20_Cijk_Alik_Bljk_HB.yaml
- {MinimumRequiredVersion: 4.6.0}
- vega20
- gfx906
- [Device 66a0, Device 66a1, Device 66a7]
    SolutionIndex: 0
    SolutionNameMin: Cijk_Alik_Bljk_HB_MT032x016x08_PGR1_PLR1_TT02_02
    SolutionIndex: 1
    SolutionNameMin: Cijk_Alik_Bljk_HB_MT016x016x16_PGR1_PLR1_TT02_02
    SolutionIndex: 2
    SolutionNameMin: Cijk_Alik_Bljk_HB_MT032x032x16_PGR1_PLR1_TT04_04
    SolutionIndex: 3
    SolutionNameMin: Cijk_Alik_Bljk_HB_MT064x064x16_PGR1_PLR1_TT08_08
    SolutionIndex: 4
    SolutionNameMin: Cijk_Alik_Bljk_HB_MT128x032x16_PGR1_PLR1_TT08_08
    SolutionIndex: 5
    SolutionNameMin: Cijk_Alik_Bljk_HB_MT032x016x16_PGR1_PLR1_TT02_02
    SolutionIndex: 6
    SolutionNameMin: Cijk_Alik_Bljk_HB_MT064x032x16_PGR1_PLR1_TT04_04
    SolutionIndex: 7
    SolutionNameMin: Cijk_Alik_Bljk_HB_MT064x064x16_PGR1_PLR1_TT04_04
    SolutionIndex: 8
    SolutionNameMin: Cijk_Alik_Bljk_HB_MT128x032x16_PGR1_PLR1_TT04_04
    SolutionIndex: 9
    SolutionNameMin: Cijk_Alik_Bljk_HB_MT016x016x32_PGR1_PLR1_TT02_02
    SolutionIndex: 10
    SolutionNameMin: Cijk_Alik_Bljk_HB_MT032x032x32_PGR1_PLR1_TT04_04
    SolutionIndex: 11
    SolutionNameMin: Cijk_Alik_Bljk_HB_MT064x032x32_PGR1_PLR1_TT04_04
    SolutionIndex: 12
    SolutionNameMin: Cijk_Alik_Bljk_HB_MT128x064x32_PGR1_PLR1_TT08_08
    SolutionIndex: 13
    SolutionNameMin: Cijk_Alik_Bljk_HB_MT016x016x64_PGR1_PLR1_TT02_02
    SolutionIndex: 14
    SolutionNameMin: Cijk_Alik_Bljk_HB_MT128x032x64_PGR1_PLR1_TT04_04
    SolutionIndex: 15
    SolutionNameMin: Cijk_Alik_Bljk_HB_MT032x016x08_PGR1_PLR1_TT04_02
    SolutionIndex: 16
    SolutionNameMin: Cijk_Alik_Bljk_HB_MT128x032x16_PGR1_PLR1_TT08_04
    SolutionIndex: 17
    SolutionNameMin: Cijk_Alik_Bljk_HB_MT016x016x16_PGR1_PLR1_TT02_02
    SolutionIndex: 18
    SolutionNameMin: Cijk_Alik_Bljk_HB_MT032x032x16_PGR1_PLR1_TT04_04
    SolutionIndex: 19
    SolutionNameMin: Cijk_Alik_Bljk_HB_MT064x032x16_PGR1_PLR1_TT08_04
    SolutionIndex: 20
    SolutionNameMin: Cijk_Alik_Bljk_HB_MT064x064x16_PGR1_PLR1_TT08_08
    SolutionIndex: 21
    SolutionNameMin: Cijk_Alik_Bljk_HB_MT064x032x16_PGR1_PLR1_TT04_04
    SolutionIndex: 22
    SolutionNameMin: Cijk_Alik_Bljk_HB_MT128x032x16_PGR1_PLR1_TT04_04
    SolutionIndex: 23
    SolutionNameMin: Cijk_Alik_Bljk_HB_MT256x032x16_PGR1_PLR1_TT08_04
    SolutionIndex: 24
    SolutionNameMin: Cijk_Alik_Bljk_HB_MT016x016x24_PGR1_PLR1_TT02_02
    SolutionIndex: 25
    SolutionNameMin: Cijk_Alik_Bljk_HB_MT032x016x24_PGR1_PLR1_TT04_02
    SolutionIndex: 26
    SolutionNameMin: Cijk_Alik_Bljk_HB_MT032x032x24_PGR1_PLR1_TT04_04
    SolutionIndex: 27
    SolutionNameMin: Cijk_Alik_Bljk_HB_MT016x016x24_PGR1_PLR1_TT02_02
    SolutionIndex: 28
    SolutionNameMin: Cijk_Alik_Bljk_HB_MT032x016x24_PGR1_PLR1_TT04_02
    SolutionIndex: 29
    SolutionNameMin: Cijk_Alik_Bljk_HB_MT032x032x24_PGR1_PLR1_TT04_04
    SolutionIndex: 30
    SolutionNameMin: Cijk_Alik_Bljk_HB_MT064x032x24_PGR1_PLR1_TT08_04
    SolutionIndex: 31
    SolutionNameMin: Cijk_Alik_Bljk_HB_MT064x064x24_PGR1_PLR1_TT08_08
    SolutionIndex: 32
    SolutionNameMin: Cijk_Alik_Bljk_HB_MT032x032x32_PGR1_PLR1_TT04_04
    SolutionIndex: 33
    SolutionNameMin: Cijk_Alik_Bljk_HB_MT064x064x32_PGR1_PLR1_TT08_08
    SolutionIndex: 34
    SolutionNameMin: Cijk_Alik_Bljk_HB_MT064x032x32_PGR1_PLR1_TT04_04
    SolutionIndex: 35
    SolutionNameMin: Cijk_Alik_Bljk_HB_MT064x016x32_PGR1_PLR1_TT02_02
    SolutionIndex: 36
    SolutionNameMin: Cijk_Alik_Bljk_HB_MT128x032x32_PGR1_PLR1_TT04_04
    SolutionIndex: 37
    SolutionNameMin: Cijk_Alik_Bljk_HB_MT256x064x32_PGR1_PLR1_TT08_08
    SolutionIndex: 38
    SolutionNameMin: Cijk_Alik_Bljk_HB_MT064x128x08_PGR1_PLR1_TT04_08
    SolutionIndex: 39
    SolutionNameMin: Cijk_Alik_Bljk_HB_MT128x064x08_PGR1_PLR1_TT08_04
    SolutionIndex: 40
    SolutionNameMin: Cijk_Alik_Bljk_HB_MT032x064x16_PGR1_PLR1_TT04_08
    SolutionIndex: 41
    SolutionNameMin: Cijk_Alik_Bljk_HB_MT048x064x16_PGR1_PLR1_TT06_08
    SolutionIndex: 42
    SolutionNameMin: Cijk_Alik_Bljk_HB_MT064x064x16_PGR1_PLR1_TT04_04
    SolutionIndex: 43
    SolutionNameMin: Cijk_Alik_Bljk_HB_MT064x128x16_PGR1_PLR1_TT04_08
    SolutionIndex: 44
    SolutionNameMin: Cijk_Alik_Bljk_HB_MT096x128x16_PGR1_PLR1_TT06_08
    SolutionIndex: 45
    SolutionNameMin: Cijk_Alik_Bljk_HB_MT128x064x16_PGR1_PLR1_TT08_04
    SolutionIndex: 46
    SolutionNameMin: Cijk_Alik_Bljk_HB_MT128x096x16_PGR1_PLR1_TT08_06
    SolutionIndex: 47
    SolutionNameMin: Cijk_Alik_Bljk_HB_MT128x128x16_PGR1_PLR1_TT08_08
    SolutionIndex: 48
    SolutionNameMin: Cijk_Alik_Bljk_HB_MT064x048x24_PGR1_PLR1_TT08_06
    SolutionIndex: 49
    SolutionNameMin: Cijk_Alik_Bljk_HB_MT064x064x32_PGR1_PLR1_TT04_04
    SolutionIndex: 50
    SolutionNameMin: Cijk_Alik_Bljk_HB_MT064x128x32_PGR1_PLR1_TT04_08
    SolutionIndex: 51
    SolutionNameMin: Cijk_Alik_Bljk_HB_MT128x064x32_PGR1_PLR1_TT08_04
    SolutionIndex: 52
    SolutionNameMin: Cijk_Alik_Bljk_HB_MT128x128x32_PGR1_PLR1_TT08_08
    SolutionIndex: 53
    SolutionNameMin: Cijk_Alik_Bljk_HB_MT064x128x04_PGR0_PLR0_TT04_08
    SolutionIndex: 54
    SolutionNameMin: Cijk_Alik_Bljk_HB_MT064x064x04_PGR0_PLR0_TT04_04
    SolutionIndex: 55
    SolutionNameMin: Cijk_Alik_Bljk_HB_MT064x128x04_PGR1_PLR0_TT04_08
    SolutionIndex: 56
    SolutionNameMin: Cijk_Alik_Bljk_HB_MT064x064x04_PGR1_PLR0_TT04_04
    SolutionIndex: 57
    SolutionNameMin: Cijk_Alik_Bljk_HB_MT128x128x04_PGR0_PLR1_TT08_08
    SolutionIndex: 58
    SolutionNameMin: Cijk_Alik_Bljk_HB_MT064x128x04_PGR0_PLR1_TT04_08
    SolutionIndex: 59
    SolutionNameMin: Cijk_Alik_Bljk_HB_MT064x064x04_PGR0_PLR1_TT04_04
    SolutionIndex: 60
    SolutionNameMin: Cijk_Alik_Bljk_HB_MT064x128x04_PGR1_PLR1_TT04_08
    SolutionIndex: 61
    SolutionNameMin: Cijk_Alik_Bljk_HB_MT064x064x04_PGR1_PLR1_TT04_04
    SolutionIndex: 62
    SolutionNameMin: Cijk_Alik_Bljk_HB_MT064x128x08_PGR0_PLR0_TT04_08
    SolutionIndex: 63
    SolutionNameMin: Cijk_Alik_Bljk_HB_MT064x064x08_PGR0_PLR0_TT04_04
    SolutionIndex: 64
    SolutionNameMin: Cijk_Alik_Bljk_HB_MT064x064x08_PGR1_PLR0_TT04_04
    SolutionIndex: 65
    SolutionNameMin: Cijk_Alik_Bljk_HB_MT064x128x08_PGR0_PLR1_TT04_08
    SolutionIndex: 66
    SolutionNameMin: Cijk_Alik_Bljk_HB_MT064x064x08_PGR0_PLR1_TT04_04
    SolutionIndex: 67
    SolutionNameMin: Cijk_Alik_Bljk_HB_MT064x128x08_PGR1_PLR1_TT04_08
    SolutionIndex: 68
    SolutionNameMin: Cijk_Alik_Bljk_HB_MT064x064x08_PGR1_PLR1_TT04_04
    SolutionIndex: 69
    SolutionNameMin: Cijk_Alik_Bljk_HB_MT064x128x16_PGR0_PLR0_TT04_08
    SolutionIndex: 70
    SolutionNameMin: Cijk_Alik_Bljk_HB_MT064x064x16_PGR0_PLR0_TT04_04
    SolutionIndex: 71
    SolutionNameMin: Cijk_Alik_Bljk_HB_MT064x064x16_PGR1_PLR0_TT04_04
    SolutionIndex: 72
    SolutionNameMin: Cijk_Alik_Bljk_HB_MT064x128x16_PGR0_PLR1_TT04_08
    SolutionIndex: 73
    SolutionNameMin: Cijk_Alik_Bljk_HB_MT064x064x16_PGR0_PLR1_TT04_04
    SolutionIndex: 74
    SolutionNameMin: Cijk_Alik_Bljk_HB_MT064x064x16_PGR1_PLR1_TT04_04
    SolutionIndex: 75
    SolutionNameMin: Cijk_Alik_Bljk_HB_MT064x064x32_PGR1_PLR0_TT04_04
    SolutionIndex: 76
    SolutionNameMin: Cijk_Alik_Bljk_HB_MT064x064x32_PGR0_PLR1_TT04_04
    SolutionIndex: 77
    SolutionNameMin: Cijk_Alik_Bljk_HB_MT064x128x32_PGR1_PLR1_TT04_08
    SolutionIndex: 78
    SolutionNameMin: Cijk_Alik_Bljk_HB_MT064x064x32_PGR1_PLR1_TT04_04
    SolutionIndex: 79
    SolutionNameMin: Cijk_Alik_Bljk_HB_MT064x128x04_PGR0_PLR0_TT04_08
    SolutionIndex: 80
    SolutionNameMin: Cijk_Alik_Bljk_HB_MT064x064x04_PGR0_PLR0_TT04_04
    SolutionIndex: 81
    SolutionNameMin: Cijk_Alik_Bljk_HB_MT064x128x04_PGR1_PLR0_TT04_08
    SolutionIndex: 82
    SolutionNameMin: Cijk_Alik_Bljk_HB_MT064x064x04_PGR1_PLR0_TT04_04
    SolutionIndex: 83
    SolutionNameMin: Cijk_Alik_Bljk_HB_MT064x128x04_PGR0_PLR1_TT04_08
    SolutionIndex: 84
    SolutionNameMin: Cijk_Alik_Bljk_HB_MT064x064x04_PGR0_PLR1_TT04_04
    SolutionIndex: 85
    SolutionNameMin: Cijk_Alik_Bljk_HB_MT064x128x04_PGR1_PLR1_TT04_08
    SolutionIndex: 86
    SolutionNameMin: Cijk_Alik_Bljk_HB_MT064x064x04_PGR1_PLR1_TT04_04
    SolutionIndex: 87
    SolutionNameMin: Cijk_Alik_Bljk_HB_MT064x128x08_PGR0_PLR0_TT04_08
    SolutionIndex: 88
    SolutionNameMin: Cijk_Alik_Bljk_HB_MT064x064x08_PGR0_PLR0_TT04_04
    SolutionIndex: 89
    SolutionNameMin: Cijk_Alik_Bljk_HB_MT064x064x08_PGR1_PLR0_TT04_04
    SolutionIndex: 90
    SolutionNameMin: Cijk_Alik_Bljk_HB_MT064x064x08_PGR0_PLR1_TT04_04
    SolutionIndex: 91
    SolutionNameMin: Cijk_Alik_Bljk_HB_MT064x128x08_PGR1_PLR1_TT04_08
    SolutionIndex: 92
    SolutionNameMin: Cijk_Alik_Bljk_HB_MT064x064x08_PGR1_PLR1_TT04_04
    SolutionIndex: 93
    SolutionNameMin: Cijk_Alik_Bljk_HB_MT064x064x16_PGR0_PLR0_TT04_04
    SolutionIndex: 94
    SolutionNameMin: Cijk_Alik_Bljk_HB_MT064x064x16_PGR1_PLR0_TT04_04
    SolutionIndex: 95
    SolutionNameMin: Cijk_Alik_Bljk_HB_MT064x064x16_PGR0_PLR1_TT04_04
    SolutionIndex: 96
    SolutionNameMin: Cijk_Alik_Bljk_HB_MT064x064x16_PGR1_PLR1_TT04_04
    SolutionIndex: 97
    SolutionNameMin: Cijk_Alik_Bljk_HB_MT064x064x32_PGR0_PLR0_TT04_04
    SolutionIndex: 98
    SolutionNameMin: Cijk_Alik_Bljk_HB_MT064x064x32_PGR1_PLR0_TT04_04
- - - [2368, 1024, 1, 1]
    - [80, 100.034]
  - - [1760, 32, 1, 1760]
    - [24, 2373.64]
  - - [448, 1, 1, 256]
    - [92, 3.23612]
  - - [5056, 1408, 1, 3328]
    - [52, 16044.2]
  - - [3072, 24000, 1, 1024]
    - [44, 12729.2]
  - - [5056, 1856, 1, 3328]
    - [47, 14946.4]
  - - [5888, 128, 1, 1]
    - [95, 58.1531]
  - - [448, 3584, 1, 3328]
    - [47, 12586.0]
  - - [704, 64, 1, 3328]
    - [24, 2050.69]
  - - [2560, 32, 1, 2560]
    - [28, 2771.08]
  - - [4096, 3200, 1, 1024]
    - [52, 12499.8]
  - - [5056, 4288, 1, 32]
    - [65, 4094.45]
  - - [3584, 1024, 1, 256]
    - [52, 8863.43]
  - - [32, 5056, 1, 1280]
    - [73, 1238.01]
  - - [1856, 256, 1, 1]
    - [86, 39.8604]
  - - [256, 1856, 1, 32]
    - [66, 984.738]
  - - [1408, 3584, 1, 3328]
    - [47, 17757.1]
  - - [128, 3584, 1, 1280]
    - [21, 8030.67]
  - - [1024, 2368, 1, 3328]
    - [51, 10401.4]
  - - [4288, 64, 1, 3328]
    - [29, 6124.66]
  - - [1, 4288, 1, 1280]
    - [92, 34.6855]
  - - [2368, 64, 1, 1]
    - [80, 9.71487]
  - - [6144, 32, 1, 2560]
    - [2, 4880.88]
  - - [256, 128, 1, 256]
    - [1, 873.813]
  - - [448, 64, 1, 1]
    - [84, 2.37351]
  - - [32, 1408, 1, 32]
    - [63, 102.4]
  - - [448, 3584, 1, 32]
    - [66, 1883.44]
  - - [64, 1024, 1, 1280]
    - [24, 2661.36]
  - - [1, 1408, 1, 3328]
    - [86, 15.5077]
  - - [1408, 128, 1, 32]
    - [70, 360.448]
  - - [4288, 6784, 1, 3328]
    - [52, 15412.4]
  - - [1024, 1, 1, 3328]
    - [86, 11.1865]
  - - [2944, 128, 1, 32]
    - [63, 717.775]
  - - [64, 6784, 1, 1]
    - [92, 33.92]
  - - [1024, 64, 1, 1280]
    - [24, 2668.13]
  - - [448, 128, 1, 256]
    - [17, 1433.6]
  - - [64, 5056, 1, 3328]
    - [6, 7000.05]
  - - [5888, 4288, 1, 3328]
    - [42, 13387.3]
  - - [1, 2368, 1, 1280]
    - [86, 24.1018]
  - - [704, 1024, 1, 1]
    - [89, 50.6247]
  - - [2368, 1408, 1, 32]
    - [62, 2772.68]
  - - [256, 1856, 1, 1280]
    - [42, 9126.26]
  - - [1024, 2944, 1, 1]
    - [80, 120.394]
  - - [2944, 3584, 1, 3328]
    - [43, 14204.5]
  - - [2368, 2944, 1, 1280]
    - [47, 16892.6]
  - - [256, 1408, 1, 1]
    - [90, 30.8603]
  - - [1, 1024, 1, 3328]
    - [92, 12.2128]
  - - [6784, 5888, 1, 3328]
    - [52, 14531.9]
  - - [3584, 1408, 1, 32]
    - [65, 2990.38]
  - - [8192, 800, 1, 2048]
    - [49, 7563.76]
  - - [5056, 256, 1, 256]
    - [42, 9722.71]
  - - [1856, 2368, 1, 256]
    - [43, 12113.7]
  - - [2368, 1024, 1, 3328]
    - [43, 13892.4]
  - - [3584, 4288, 1, 32]
    - [62, 4224.91]
  - - [1024, 1024, 1, 1280]
    - [47, 10064.3]
  - - [3584, 3584, 1, 1]
    - [79, 219.649]
  - - [512, 48000, 1, 2560]
    - [47, 17119.4]
  - - [32, 2944, 1, 3328]
    - [71, 928.244]
  - - [704, 1408, 1, 3328]
    - [31, 12257.8]
  - - [1408, 704, 1, 256]
    - [45, 9440.3]
  - - [704, 64, 1, 32]
    - [56, 91.951]
  - - [5888, 1, 1, 3328]
    - [86, 49.1256]
  - - [2368, 32, 1, 256]
    - [68, 557.433]
  - - [6784, 128, 1, 3328]
    - [47, 11690.4]
  - - [2944, 256, 1, 1]
    - [80, 64.526]
  - - [1408, 2368, 1, 1]
    - [84, 149.917]
  - - [32, 448, 1, 3328]
    - [70, 156.365]
  - - [5056, 1, 1, 3328]
    - [96, 34.5085]
  - - [2944, 256, 1, 32]
    - [64, 1245.73]
  - - [5056, 6784, 1, 1280]
    - [47, 17215.6]
  - - [4288, 5056, 1, 1]
    - [84, 242.616]
  - - [5056, 4288, 1, 1]
    - [80, 236.683]
  - - [128, 4288, 1, 3328]
    - [42, 8204.36]
  - - [5056, 128, 1, 256]
    - [18, 6658.96]
  - - [1408, 4288, 1, 1280]
    - [43, 15000.0]
  - - [1856, 704, 1, 1280]
    - [49, 9221.87]
  - - [4288, 1024, 1, 3328]
    - [47, 9935.36]
  - - [1, 5888, 1, 3328]
    - [89, 43.8411]
  - - [1024, 128, 1, 32]
    - [59, 267.494]
  - - [32, 4288, 1, 1280]
    - [74, 1147.65]
  - - [1024, 5056, 1, 1]
    - [84, 160.19]
  - - [704, 3584, 1, 1280]
    - [43, 14061.3]
  - - [1856, 5056, 1, 256]
    - [52, 13067.2]
  - - [1408, 1024, 1, 1280]
    - [45, 11704.0]
  - - [5056, 5888, 1, 3328]
    - [20, 13242.3]
  - - [448, 1, 1, 1]
    - [86, 0.04]
  - - [3584, 3584, 1, 1280]
    - [52, 15137.4]
  - - [2368, 3584, 1, 32]
    - [65, 3338.02]
  - - [2944, 2368, 1, 1]
    - [80, 201.719]
  - - [704, 4288, 1, 1]
    - [90, 112.977]
  - - [2368, 256, 1, 32]
    - [66, 1160.21]
  - - [1024, 6784, 1, 1280]
    - [43, 14089.1]
  - - [1024, 3584, 1, 1]
    - [84, 149.431]
  - - [32, 5056, 1, 32]
    - [54, 355.587]
  - - [5888, 32, 1, 32]
    - [63, 409.6]
  - - [64, 128, 1, 3328]
    - [1, 382.907]
  - - [256, 5056, 1, 32]
    - [59, 1835.94]
  - - [5056, 64, 1, 32]
    - [54, 677.663]
  - - [2368, 5056, 1, 32]
    - [62, 3925.45]
  - - [6784, 1856, 1, 32]
    - [62, 4009.91]
  - - [64, 128, 1, 1]
    - [84, 0.506931]
  - - [64, 2368, 1, 1280]
    - [24, 4314.65]
  - - [128, 704, 1, 32]
    - [66, 176.69]
  - - [64, 6784, 1, 3328]
    - [42, 8696.04]
  - - [2944, 256, 1, 1280]
    - [47, 9398.77]
  - - [5124, 9124, 1, 4096]
    - [33, 11327.0]
  - - [5056, 704, 1, 1]
    - [84, 142.605]
  - - [2944, 4288, 1, 256]
    - [47, 16748.1]
  - - [1024, 1024, 1, 3328]
    - [47, 13981.0]
  - - [5056, 704, 1, 32]
    - [62, 2813.77]
  - - [1856, 4288, 1, 3328]
    - [52, 11614.2]
  - - [1, 1856, 1, 256]
    - [86, 13.5598]
  - - [6784, 4288, 1, 32]
    - [62, 4463.34]
  - - [5888, 64, 1, 256]
    - [18, 5220.18]
  - - [256, 128, 1, 1]
    - [90, 2.45269]
  - - [5888, 5056, 1, 256]
    - [52, 12980.4]
  - - [2944, 448, 1, 256]
    - [45, 9635.89]
  - - [3584, 2368, 1, 3328]
    - [47, 15619.1]
  - - [4288, 1856, 1, 1]
    - [92, 158.158]
  - - [1856, 2944, 1, 1]
    - [80, 182.135]
  - - [32, 4288, 1, 3328]
    - [71, 1206.04]
  - - [1, 3584, 1, 3328]
    - [92, 43.2784]
  - - [256, 32, 1, 3328]
    - [68, 102.154]
  - - [1856, 2368, 1, 32]
    - [53, 2781.65]
  - - [4288, 1856, 1, 32]
    - [69, 3148.77]
  - - [5056, 64, 1, 3328]
    - [21, 6974.66]
  - - [6784, 1, 1, 1280]
    - [96, 46.6054]
  - - [1024, 448, 1, 32]
    - [54, 960.737]
  - - [1408, 64, 1, 1]
    - [84, 6.51098]
  - - [1, 1, 1, 3328]
    - [89, 0.011416]
  - - [5056, 2368, 1, 256]
    - [43, 14561.9]
  - - [1408, 5888, 1, 256]
    - [47, 11017.0]
  - - [5056, 6784, 1, 1]
    - [84, 261.592]
  - - [32, 448, 1, 1280]
    - [68, 167.184]
  - - [32, 448, 1, 32]
    - [70, 28.8161]
  - - [1856, 64, 1, 256]
    - [17, 2551.07]
  - - [1024, 1408, 1, 3328]
    - [52, 10598.8]
  - - [7680, 128, 1, 2560]
    - [3, 7815.46]
  - - [256, 5056, 1, 1280]
    - [47, 9745.59]
  - - [704, 2368, 1, 1]
    - [83, 94.72]
  - - [2048, 800, 1, 512]
    - [52, 9818.13]
  - - [64, 1024, 1, 32]
    - [59, 127.875]
  - - [1024, 256, 1, 256]
    - [29, 3956.89]
  - - [128, 1, 1, 1]
    - [88, 0.0116788]
  - - [3584, 4288, 1, 1280]
    - [47, 16023.1]
  - - [1856, 128, 1, 32]
    - [63, 500.143]
  - - [1856, 128, 1, 1280]
    - [29, 6453.46]
  - - [128, 2944, 1, 3328]
    - [26, 7917.28]
  - - [1, 6784, 1, 3328]
    - [86, 56.9669]
  - - [3584, 2368, 1, 1]
    - [80, 205.594]
  - - [4288, 448, 1, 3328]
    - [45, 13563.2]
  - - [4288, 32, 1, 3328]
    - [71, 1209.36]
  - - [4608, 12000, 1, 1536]
    - [47, 15686.3]
  - - [256, 1856, 1, 1]
    - [84, 42.122]
  - - [704, 6784, 1, 1280]
    - [39, 10129.2]
  - - [2368, 4288, 1, 32]
    - [62, 3626.42]
  - - [704, 5056, 1, 1280]
    - [47, 9472.83]
  - - [256, 3584, 1, 3328]
    - [47, 12304.3]
  - - [1024, 32, 1, 3328]
    - [68, 409.722]
  - - [3584, 6784, 1, 32]
    - [65, 4485.94]
  - - [3584, 6784, 1, 1280]
    - [52, 14930.8]
  - - [4288, 4288, 1, 3328]
    - [52, 15637.2]
  - - [3584, 64, 1, 1280]
    - [29, 5977.22]
  - - [64, 1856, 1, 256]
    - [0, 2754.41]
  - - [3584, 64, 1, 32]
    - [66, 493.282]
  - - [448, 1, 1, 1280]
    - [94, 4.37874]
  - - [256, 4288, 1, 1280]
    - [45, 9660.97]
  - - [1408, 3584, 1, 1]
    - [83, 155.749]
  - - [4288, 1856, 1, 3328]
    - [47, 17205.8]
  - - [1856, 2944, 1, 1280]
    - [50, 10746.8]
  - - [4288, 256, 1, 256]
    - [49, 5330.39]
  - - [128, 5888, 1, 32]
    - [66, 1456.36]
  - - [128, 5888, 1, 1280]
    - [20, 9261.62]
  - - [1408, 128, 1, 3328]
    - [18, 5328.58]
  - - [3584, 256, 1, 256]
    - [43, 8584.83]
  - - [32, 6784, 1, 3328]
    - [71, 1898.03]
  - - [64, 64, 1, 1280]
    - [24, 177.604]
  - - [32, 3584, 1, 256]
    - [68, 775.902]
  - - [704, 256, 1, 32]
    - [68, 308.075]
  - - [448, 128, 1, 3328]
    - [24, 2581.72]
  - - [64, 2944, 1, 3328]
    - [29, 5915.55]
  - - [64, 4288, 1, 3328]
    - [26, 6154.38]
  - - [5056, 1024, 1, 3328]
    - [47, 16573.8]
  - - [128, 256, 1, 1280]
    - [24, 1390.68]
  - - [1856, 256, 1, 256]
    - [42, 6757.49]
  - - [3584, 704, 1, 1]
    - [84, 123.683]
  - - [256, 704, 1, 256]
    - [42, 3276.8]
  - - [448, 5056, 1, 1]
    - [92, 108.067]
  - - [5888, 5888, 1, 256]
    - [47, 18623.3]
  - - [3584, 704, 1, 32]
    - [61, 2391.6]
  - - [448, 6784, 1, 3328]
    - [43, 14359.1]
  - - [6784, 4288, 1, 1]
    - [79, 261.411]
  - - [3584, 6784, 1, 1]
    - [79, 216.315]
  - - [1408, 2368, 1, 32]
    - [73, 2497.49]
  - - [448, 5056, 1, 32]
    - [73, 2248.23]
  - - [4288, 4288, 1, 1280]
    - [47, 16114.7]
  - - [6784, 1408, 1, 1]
    - [80, 219.08]
  - - [1856, 5888, 1, 3328]
    - [43, 15984.9]
  - - [1024, 704, 1, 1]
    - [95, 57.7641]
  - - [3584, 1856, 1, 3328]
    - [20, 11550.6]
  - - [5056, 5888, 1, 1]
    - [80, 250.25]
  - - [2944, 1024, 1, 256]
    - [47, 14186.6]
  - - [448, 1408, 1, 3328]
    - [45, 8066.57]
  - - [5056, 32, 1, 3328]
    - [68, 1472.12]
  - - [2368, 4288, 1, 3328]
    - [50, 11375.2]
  - - [1024, 704, 1, 32]
    - [63, 1393.04]
  - - [448, 2944, 1, 256]
    - [20, 7618.26]
  - - [2944, 6784, 1, 256]
    - [47, 17952.4]
  - - [2368, 2368, 1, 1280]
    - [47, 14960.6]
  - - [5888, 128, 1, 3328]
    - [20, 10192.6]
  - - [256, 256, 1, 32]
    - [61, 123.653]
  - - [1024, 1, 1, 256]
    - [92, 7.23355]
  - - [3584, 3584, 1, 32]
    - [65, 3825.78]
  - - [2944, 448, 1, 1]
    - [85, 84.9814]
  - - [4608, 32, 1, 1536]
    - [26, 4056.1]
  - - [512, 48000, 1, 2816]
    - [47, 17805.4]
  - - [128, 32, 1, 32]
    - [59, 8.7615]
  - - [5056, 64, 1, 1280]
    - [29, 6455.54]
  - - [2944, 2944, 1, 1280]
    - [47, 12523.6]
  - - [1, 2368, 1, 256]
    - [96, 15.7538]
  - - [1408, 5056, 1, 1]
    - [84, 186.945]
  - - [2944, 32, 1, 1280]
    - [71, 981.973]
  - - [64, 1408, 1, 3328]
    - [24, 3628.91]
  - - [256, 448, 1, 1280]
    - [24, 3989.15]
  - - [4096, 64, 1, 4096]
    - [14, 3076.27]
  - - [2368, 6784, 1, 1]
    - [81, 180.581]
  - - [6784, 4288, 1, 1280]
    - [47, 11610.4]
  - - [2944, 704, 1, 256]
    - [45, 11127.9]
  - - [2368, 6784, 1, 1280]
    - [47, 10657.7]
  - - [704, 2944, 1, 3328]
    - [45, 11910.3]
  - - [5888, 256, 1, 1]
    - [80, 84.8721]
  - - [704, 704, 1, 32]
    - [66, 1071.6]
  - - [256, 4288, 1, 256]
    - [45, 8265.25]
  - - [5056, 6784, 1, 32]
    - [65, 4742.47]
  - - [5056, 128, 1, 1]
    - [84, 55.4082]
  - - [448, 5056, 1, 1280]
    - [43, 12605.7]
  - - [448, 448, 1, 256]
    - [8, 3345.07]
  - - [256, 5888, 1, 3328]
    - [52, 11078.6]
  - - [704, 448, 1, 1280]
    - [18, 6094.53]
  - - [448, 64, 1, 256]
    - [1, 777.546]
  - - [1024, 704, 1, 1280]
    - [42, 10298.5]
  - - [5888, 1024, 1, 1]
    - [85, 163.84]
  - - [5888, 448, 1, 32]
    - [68, 2465.26]
  - - [6784, 2944, 1, 256]
    - [43, 15289.6]
  - - [1024, 256, 1, 1]
    - [80, 18.7246]
  - - [2368, 448, 1, 256]
    - [45, 7363.91]
  - - [4288, 256, 1, 3328]
    - [41, 8638.94]
  - - [4288, 2944, 1, 256]
    - [47, 16713.4]
  - - [4096, 16, 1, 4096]
    - [35, 1275.83]
  - - [448, 5888, 1, 3328]
    - [52, 9820.41]
  - - [128, 256, 1, 3328]
    - [24, 1448.62]
  - - [128, 6784, 1, 32]
    - [61, 1490.73]
  - - [1856, 64, 1, 32]
    - [54, 246.184]
  - - [1408, 4288, 1, 1]
    - [83, 196.023]
  - - [1408, 1856, 1, 3328]
    - [52, 11256.0]
  - - [4288, 64, 1, 256]
    - [6, 4181.82]
  - - [3584, 1024, 1, 3328]
    - [52, 11701.7]
  - - [2944, 5888, 1, 3328]
    - [47, 11396.9]
  - - [128, 6784, 1, 3328]
    - [45, 10425.2]
  - - [448, 4288, 1, 3328]
    - [45, 10908.3]
  - - [704, 2368, 1, 256]
    - [43, 7833.52]
  - - [1, 64, 1, 3328]
    - [94, 0.714929]
  - - [4288, 128, 1, 1]
    - [94, 42.6137]
  - - [256, 2368, 1, 32]
    - [63, 1182.84]
  - - [4288, 3584, 1, 3328]
    - [52, 12085.4]
  - - [1408, 64, 1, 256]
    - [17, 2104.81]
  - - [1024, 24000, 1, 2560]
    - [52, 15670.3]
  - - [1408, 1024, 1, 1]
    - [84, 79.0456]
  - - [64, 1024, 1, 1]
    - [90, 4.35745]
  - - [1408, 1024, 1, 256]
    - [43, 7065.44]
  - - [8192, 400, 1, 2048]
    - [51, 7999.04]
  - - [5056, 3584, 1, 1]
    - [84, 235.701]
  - - [448, 1024, 1, 256]
    - [42, 6796.33]
  - - [6784, 6784, 1, 3328]
    - [43, 14787.5]
  - - [6784, 32, 1, 32]
    - [71, 372.683]
  - - [64, 1024, 1, 3328]
    - [27, 2940.99]
  - - [2368, 2944, 1, 3328]
    - [43, 11540.4]
  - - [448, 448, 1, 1280]
    - [42, 4994.19]
  - - [5056, 3584, 1, 32]
    - [62, 4379.63]
  - - [5056, 3584, 1, 1280]
    - [47, 13892.9]
  - - [7680, 48000, 1, 2560]
    - [47, 7994.06]
  - - [1856, 1856, 1, 256]
    - [47, 13060.6]
  - - [32, 5888, 1, 256]
    - [63, 1063.37]
  - - [256, 1408, 1, 32]
    - [59, 731.874]
  - - [2944, 1, 1, 3328]
    - [89, 29.661]
  - - [32, 704, 1, 3328]
    - [68, 274.828]
  - - [5888, 4288, 1, 1]
    - [85, 245.41]
  - - [1024, 128, 1, 256]
    - [0, 2933.08]
  - - [32, 1856, 1, 3328]
    - [71, 678.392]
  - - [5056, 704, 1, 256]
    - [47, 13368.7]
  - - [2368, 5056, 1, 256]
    - [47, 17111.4]
  - - [1024, 5056, 1, 256]
    - [52, 11970.7]
  - - [32, 1024, 1, 3328]
    - [68, 403.298]
  - - [5888, 448, 1, 256]
    - [47, 10684.9]
  - - [6784, 5056, 1, 1280]
    - [20, 15226.2]
  - - [1024, 48000, 1, 2560]
    - [47, 16742.7]
  - - [8448, 32, 1, 2816]
    - [21, 5767.17]
  - - [4288, 6784, 1, 1280]
    - [47, 11686.1]
  - - [64, 1, 1, 256]
    - [86, 0.439485]
  - - [1856, 64, 1, 1280]
    - [28, 3647.88]
  - - [128, 1408, 1, 1]
    - [95, 14.8211]
  - - [1024, 64, 1, 32]
    - [66, 140.184]
  - - [1024, 64, 1, 3328]
    - [24, 2966.59]
  - - [704, 6784, 1, 3328]
    - [47, 15842.3]
  - - [2944, 1856, 1, 1]
    - [84, 143.791]
  - - [5888, 4288, 1, 1280]
    - [52, 13480.3]
  - - [5888, 3584, 1, 1280]
    - [52, 15713.7]
  - - [32, 2368, 1, 1280]
    - [68, 835.573]
  - - [3584, 1408, 1, 1280]
    - [47, 15748.0]
  - - [1024, 2944, 1, 256]
    - [47, 9032.68]
  - - [1, 2944, 1, 1280]
    - [92, 30.0984]
  - - [32, 1024, 1, 256]
    - [68, 242.726]
  - - [2944, 1856, 1, 1280]
    - [43, 14750.3]
  - - [3584, 1, 1, 1280]
    - [90, 31.7519]
  - - [256, 3584, 1, 32]
    - [63, 1602.63]
  - - [1024, 2368, 1, 1]
    - [80, 123.213]
  - - [2944, 3584, 1, 1280]
    - [47, 16052.1]
  - - [2048, 3200, 1, 2048]
    - [33, 8093.97]
  - - [64, 1, 1, 1]
    - [84, 0.00597015]
  - - [1856, 4288, 1, 256]
    - [47, 12894.8]
  - - [256, 1, 1, 256]
    - [92, 1.8963]
  - - [256, 128, 1, 3328]
    - [1, 1427.38]
  - - [1024, 1024, 1, 1024]
    - [52, 9062.6]
  - - [1, 1856, 1, 3328]
    - [90, 17.7086]
  - - [448, 3584, 1, 1]
    - [79, 92.9185]
  - - [2368, 2944, 1, 32]
    - [65, 3438.42]
  - - [128, 4288, 1, 32]
    - [56, 1076.2]
  - - [448, 256, 1, 256]
    - [17, 2479.74]
  - - [64, 64, 1, 1]
    - [88, 0.270899]
  - - [1, 1408, 1, 1]
    - [90, 0.105389]
  - - [2944, 32, 1, 32]
    - [61, 187.479]
  - - [448, 1856, 1, 1]
    - [80, 64.5565]
  - - [4288, 704, 1, 256]
    - [45, 12561.8]
  - - [1856, 1024, 1, 256]
    - [43, 11283.4]
  - - [448, 1856, 1, 32]
    - [68, 1433.6]
  - - [448, 1856, 1, 3328]
    - [45, 8283.01]
  - - [448, 448, 1, 32]
    - [66, 409.6]
  - - [1024, 448, 1, 256]
    - [45, 5437.06]
  - - [6784, 1, 1, 256]
    - [92, 44.0341]
  - - [704, 6784, 1, 32]
    - [65, 2877.07]
  - - [1024, 4288, 1, 1]
    - [80, 159.553]
  - - [704, 256, 1, 3328]
    - [42, 4083.51]
  - - [704, 1856, 1, 32]
    - [54, 2010.19]
  - - [1408, 5888, 1, 1280]
    - [52, 15016.9]
  - - [32, 704, 1, 1280]
    - [68, 254.914]
  - - [5056, 1856, 1, 256]
    - [47, 14734.3]
  - - [6784, 704, 1, 1280]
    - [47, 12253.8]
  - - [704, 1408, 1, 32]
    - [73, 1709.02]
  - - [5888, 1024, 1, 256]
    - [52, 12180.4]
  - - [64, 2944, 1, 1]
    - [95, 10.1082]
  - - [7680, 16, 1, 2560]
    - [25, 3191.69]
  - - [64, 2944, 1, 32]
    - [66, 378.726]
  - - [64, 2944, 1, 1280]
    - [26, 5242.88]
  - - [6784, 1856, 1, 3328]
    - [42, 12168.7]
  - - [512, 24000, 1, 2816]
    - [47, 11885.8]
  - - [2368, 5888, 1, 1280]
    - [47, 13591.1]
  - - [5888, 6784, 1, 32]
    - [62, 4700.69]
  - - [1, 6784, 1, 256]
    - [86, 43.5046]
  - - [6784, 6784, 1, 32]
    - [62, 4683.04]
  - - [256, 1, 1, 1280]
    - [96, 2.45858]
  - - [5888, 128, 1, 32]
    - [74, 1277.4]
  - - [6784, 256, 1, 256]
    - [47, 9631.63]
  - - [2368, 3584, 1, 3328]
    - [47, 15821.4]
  - - [128, 4288, 1, 1280]
    - [29, 7093.56]
  - - [32, 3584, 1, 1280]
    - [68, 1264.65]
  - - [5888, 1024, 1, 1280]
    - [20, 12113.1]
  - - [1856, 704, 1, 3328]
    - [42, 12223.0]
  - - [5888, 6784, 1, 3328]
    - [47, 19017.7]
  - - [6784, 448, 1, 1]
    - [80, 127.485]
  - - [6784, 1856, 1, 1]
    - [83, 217.388]
  - - [128, 32, 1, 1280]
    - [68, 43.4877]
  - - [2944, 2368, 1, 1280]
    - [52, 14046.4]
  - - [128, 256, 1, 1]
    - [80, 2.92571]
  - - [6784, 448, 1, 32]
    - [65, 2527.43]
  - - [6784, 448, 1, 3328]
    - [52, 10107.3]
  - - [1, 6784, 1, 1]
    - [84, 0.601418]
  - - [448, 3584, 1, 1280]
    - [47, 11976.7]
  - - [1408, 6784, 1, 1280]
    - [52, 15027.5]
  - - [5056, 5888, 1, 1280]
    - [47, 18458.2]
  - - [32, 2944, 1, 32]
    - [54, 182.928]
  - - [5888, 704, 1, 1]
    - [88, 144.733]
  - - [3584, 1856, 1, 1]
    - [85, 165.966]
  - - [1, 256, 1, 256]
    - [86, 1.76933]
  - - [5056, 2944, 1, 32]
    - [65, 3917.07]
  - - [32, 6784, 1, 256]
    - [68, 1315.68]
  - - [4288, 6784, 1, 1]
    - [80, 246.691]
  - - [512, 48000, 1, 2048]
    - [52, 15407.7]
  - - [1, 4288, 1, 3328]
    - [91, 34.5632]
  - - [1024, 6784, 1, 1]
    - [79, 164.461]
  - - [2368, 5888, 1, 32]
    - [62, 4026.8]
  - - [448, 448, 1, 3328]
    - [29, 5959.52]
  - - [4608, 24000, 1, 1536]
    - [52, 15146.2]
  - - [1760, 16, 1, 1760]
    - [27, 1254.09]
  - - [1, 256, 1, 1]
    - [84, 0.0240602]
  - - [3584, 4288, 1, 1]
    - [83, 243.168]
  - - [5888, 1024, 1, 3328]
    - [52, 12235.1]
  - - [6784, 5888, 1, 256]
    - [52, 15588.0]
  - - [704, 128, 1, 1280]
    - [27, 3261.97]
  - - [4288, 128, 1, 256]
    - [21, 5702.48]
  - - [5056, 1024, 1, 1]
    - [80, 170.307]
  - - [32, 3584, 1, 3328]
    - [71, 1298.94]
  - - [1024, 1, 1, 1280]
    - [92, 11.2066]
  - - [4288, 2368, 1, 32]
    - [62, 3958.67]
  - - [704, 3584, 1, 1]
    - [84, 113.86]
  - - [704, 1856, 1, 3328]
    - [43, 11783.1]
  - - [2944, 128, 1, 1280]
    - [29, 7212.1]
  - - [4096, 7000, 1, 4096]
    - [45, 9698.75]
  - - [1, 2368, 1, 3328]
    - [92, 27.9695]
  - - [6784, 704, 1, 32]
    - [65, 2890.13]
  - - [4288, 1, 1, 1280]
    - [86, 33.6478]
  - - [704, 5888, 1, 256]
    - [43, 13452.8]
  - - [2368, 3584, 1, 1280]
    - [50, 10938.5]
  - - [64, 448, 1, 256]
    - [1, 771.012]
  - - [1408, 448, 1, 1280]
    - [42, 8923.56]
  - - [3584, 5056, 1, 32]
    - [72, 3707.55]
  - - [1024, 32, 1, 1280]
    - [68, 380.194]
  - - [128, 2368, 1, 1]
    - [80, 22.5524]
  - - [6784, 1856, 1, 1280]
    - [47, 13852.5]
  - - [6144, 48000, 1, 2560]
    - [47, 15923.2]
  - - [5056, 5056, 1, 3328]
    - [47, 17883.8]
  - - [128, 704, 1, 1280]
    - [24, 3276.8]
  - - [128, 2944, 1, 1280]
    - [26, 7397.93]
  - - [2368, 5056, 1, 1]
    - [88, 217.842]
  - - [5888, 1408, 1, 256]
    - [47, 13378.2]
  - - [2368, 1024, 1, 32]
    - [59, 2389.0]
  - - [256, 256, 1, 3328]
    - [27, 2922.08]
  - - [64, 4288, 1, 1]
    - [94, 19.7149]
  - - [6144, 16, 1, 2560]
    - [25, 2833.99]
  - - [4288, 1024, 1, 256]
    - [45, 12071.2]
  - - [3584, 32, 1, 32]
    - [61, 227.105]
  - - [3584, 64, 1, 1]
    - [86, 17.0667]
  - - [704, 32, 1, 1280]
    - [68, 257.278]
  - - [32, 4288, 1, 32]
    - [73, 266.439]
  - - [64, 64, 1, 3328]
    - [24, 200.699]
  - - [64, 1408, 1, 1]
    - [83, 4.91878]
  - - [4288, 5888, 1, 1280]
    - [47, 15699.5]
  - - [1856, 2944, 1, 3328]
    - [52, 12608.4]
  - - [256, 1024, 1, 256]
    - [42, 3165.51]
  - - [5056, 5888, 1, 256]
    - [20, 13114.4]
  - - [1408, 128, 1, 1280]
    - [29, 5041.23]
  - - [5056, 256, 1, 3328]
    - [43, 7316.79]
  - - [1024, 5888, 1, 1280]
    - [43, 14921.7]
  - - [1024, 448, 1, 1]
    - [80, 36.5248]
  - - [32, 32, 1, 32]
    - [66, 2.02772]
  - - [5056, 1, 1, 1280]
    - [86, 40.7331]
  - - [5888, 5056, 1, 1280]
    - [47, 19031.3]
  - - [5888, 2944, 1, 1]
    - [79, 243.733]
  - - [64, 4288, 1, 1280]
    - [26, 5687.71]
  - - [4096, 400, 1, 1024]
    - [52, 10387.1]
  - - [1408, 4288, 1, 3328]
    - [47, 17852.0]
  - - [704, 2944, 1, 32]
    - [68, 2302.86]
  - - [2048, 128, 1, 2048]
    - [10, 3310.75]
  - - [1, 5888, 1, 1280]
    - [86, 44.1255]
  - - [2944, 4288, 1, 3328]
    - [42, 11959.7]
  - - [256, 2944, 1, 256]
    - [42, 6812.78]
  - - [704, 448, 1, 32]
    - [61, 671.047]
  - - [5056, 2944, 1, 256]
    - [47, 17421.9]
  - - [1024, 700, 1, 512]
    - [47, 7340.03]
  - - [704, 1024, 1, 256]
    - [20, 6135.29]
  - - [2368, 1856, 1, 256]
    - [47, 8534.0]
  - - [64, 3584, 1, 1]
    - [79, 12.3586]
  - - [1024, 128, 1, 1280]
    - [24, 4549.14]
  - - [2368, 4288, 1, 1280]
    - [52, 11258.7]
  - - [3584, 448, 1, 256]
    - [52, 7350.53]
  - - [256, 6784, 1, 256]
    - [43, 10178.5]
  - - [1024, 32, 1, 32]
    - [73, 67.2164]
  - - [1024, 1408, 1, 1]
    - [84, 91.951]
  - - [128, 64, 1, 32]
    - [66, 17.523]
  - - [64, 1, 1, 1280]
    - [86, 0.539231]
  - - [2368, 32, 1, 32]
    - [63, 170.283]
  - - [256, 5888, 1, 1]
    - [87, 95.1596]
  - - [2944, 2944, 1, 1]
    - [79, 207.15]
  - - [6784, 3584, 1, 256]
    - [20, 11355.0]
  - - [1408, 1856, 1, 256]
    - [42, 11164.7]
  - - [128, 1408, 1, 256]
    - [15, 3333.62]
  - - [2944, 2944, 1, 32]
    - [73, 3372.43]
  - - [2944, 2944, 1, 3328]
    - [47, 17407.0]
  - - [1, 2944, 1, 256]
    - [86, 21.0756]
  - - [448, 32, 1, 1280]
    - [73, 156.678]
  - - [3584, 1, 1, 256]
    - [86, 25.3735]
  - - [704, 32, 1, 3328]
    - [68, 280.756]
  - - [256, 448, 1, 3328]
    - [25, 3869.44]
  - - [128, 128, 1, 256]
    - [1, 440.578]
  - - [5124, 9124, 1, 2048]
    - [47, 12861.8]
  - - [1024, 24000, 1, 1536]
    - [44, 12509.8]
  - - [2368, 64, 1, 256]
    - [2, 2819.57]
  - - [64, 448, 1, 1280]
    - [1, 1158.46]
  - - [6784, 1408, 1, 32]
    - [62, 3894.75]
  - - [1408, 448, 1, 3328]
    - [31, 8448.35]
  - - [2368, 6784, 1, 3328]
    - [42, 13331.3]
  - - [256, 2368, 1, 1]
    - [80, 51.2]
  - - [4288, 3584, 1, 32]
    - [65, 4178.98]
  - - [5888, 64, 1, 3328]
    - [42, 7639.48]
  - - [3584, 704, 1, 1280]
    - [52, 12040.0]
  - - [448, 5056, 1, 3328]
    - [45, 11747.6]
  - - [4288, 448, 1, 256]
    - [45, 10996.9]
  - - [5056, 256, 1, 1280]
    - [42, 11780.1]
  - - [704, 448, 1, 3328]
    - [29, 6756.08]
  - - [2944, 5888, 1, 32]
    - [72, 3795.12]
  - - [3584, 5056, 1, 256]
    - [43, 15263.5]
  - - [6784, 1, 1, 3328]
    - [92, 56.8751]
  - - [32, 2368, 1, 3328]
    - [68, 935.671]
  - - [4288, 256, 1, 1]
    - [90, 74.5739]
  - - [64, 256, 1, 1]
    - [94, 1.01891]
  - - [1856, 448, 1, 3328]
    - [47, 11100.7]
  - - [3584, 2368, 1, 256]
    - [47, 14546.4]
  - - [4288, 4288, 1, 256]
    - [47, 15829.5]
  - - [4288, 256, 1, 1280]
    - [43, 9639.73]
  - - [448, 5056, 1, 256]
    - [45, 11100.0]
  - - [128, 1856, 1, 1]
    - [94, 17.9976]
  - - [4288, 704, 1, 1280]
    - [45, 8987.71]
  - - [128, 1856, 1, 32]
    - [66, 500.143]
  - - [2368, 704, 1, 1]
    - [79, 87.9257]
  - - [3584, 32, 1, 256]
    - [71, 808.374]
  - - [448, 2368, 1, 1280]
    - [43, 9326.28]
  - - [3584, 256, 1, 1]
    - [84, 72.5873]
  - - [2048, 16, 1, 2048]
    - [27, 1029.28]
  - - [1408, 1856, 1, 1280]
    - [52, 12484.9]
  - - [3584, 4288, 1, 3328]
    - [52, 13968.3]
  - - [1024, 24000, 1, 2048]
    - [46, 12075.7]
  - - [448, 4288, 1, 32]
    - [62, 2486.76]
  - - [448, 4288, 1, 1280]
    - [43, 13237.0]
  - - [64, 3584, 1, 256]
    - [42, 4100.58]
  - - [2048, 6400, 1, 2048]
    - [33, 9635.69]
  - - [1, 6784, 1, 1280]
    - [92, 53.0778]
  - - [5056, 1024, 1, 256]
    - [47, 16163.4]
  - - [2368, 448, 1, 32]
    - [62, 1473.42]
  - - [4288, 3584, 1, 1280]
    - [47, 11341.8]
  - - [32, 2944, 1, 1280]
    - [68, 1054.08]
  - - [1408, 704, 1, 1]
    - [92, 63.2163]
  - - [2368, 256, 1, 256]
    - [45, 4585.97]
  - - [1, 5056, 1, 1]
    - [95, 0.438889]
  - - [4288, 32, 1, 32]
    - [66, 263.877]
  - - [1856, 3584, 1, 32]
    - [65, 3524.19]
  - - [5056, 3584, 1, 3328]
    - [44, 13796.6]
  - - [4288, 5056, 1, 256]
    - [47, 17608.2]
  - - [1856, 5888, 1, 256]
    - [43, 11695.6]
  - - [256, 256, 1, 256]
    - [1, 1762.31]
  - - [2368, 3584, 1, 1]
    - [84, 196.821]
  - - [4288, 2368, 1, 256]
    - [47, 15780.8]
  - - [448, 1, 1, 3328]
    - [96, 4.84701]
  - - [1856, 256, 1, 1280]
    - [19, 7725.79]
  - - [256, 2944, 1, 1]
    - [86, 58.1531]
  - - [1408, 2944, 1, 3328]
    - [52, 15922.3]
  - - [32, 1856, 1, 32]
    - [56, 127.725]
  - - [5888, 3584, 1, 1]
    - [79, 252.907]
  - - [256, 1, 1, 1]
    - [80, 0.0248062]
  - - [6784, 5056, 1, 3328]
    - [52, 15434.7]
  - - [6784, 5056, 1, 1]
    - [83, 289.109]
  - - [5888, 3584, 1, 32]
    - [62, 4410.16]
  - - [5888, 3584, 1, 3328]
    - [52, 14335.1]
  - - [32, 1024, 1, 1280]
    - [74, 360.088]
  - - [1, 256, 1, 3328]
    - [86, 2.80178]
  - - [1024, 6784, 1, 256]
    - [47, 12797.8]
  - - [6784, 5888, 1, 32]
    - [62, 4656.85]
  - - [1408, 1, 1, 1280]
    - [92, 15.6771]
  - - [2368, 6784, 1, 32]
    - [65, 4261.14]
  - - [6784, 64, 1, 1]
    - [84, 38.2197]
  - - [1760, 6400, 1, 1760]
    - [47, 15751.8]
  - - [5056, 1408, 1, 1280]
    - [45, 15260.1]
  - - [3584, 1408, 1, 3328]
    - [52, 15241.7]
  - - [2944, 3584, 1, 1]
    - [79, 225.455]
  - - [2944, 1408, 1, 1280]
    - [20, 10750.9]
  - - [1856, 64, 1, 1]
    - [82, 9.64156]
  - - [3584, 1024, 1, 1]
    - [87, 123.653]
  - - [256, 32, 1, 256]
    - [74, 56.6186]
  - - [2944, 1856, 1, 3328]
    - [45, 14849.7]
  - - [128, 1024, 1, 3328]
    - [27, 4733.16]
  - - [1408, 128, 1, 1]
    - [80, 12.3104]
  - - [2944, 3584, 1, 32]
    - [62, 4077.8]
  - - [5888, 256, 1, 32]
    - [58, 2108.15]
  - - [8192, 3200, 1, 2048]
    - [52, 15436.2]
  - - [6784, 64, 1, 256]
    - [42, 6202.51]
  - - [256, 128, 1, 1280]
    - [27, 1372.48]
  - - [6784, 5056, 1, 256]
    - [52, 15259.2]
  - - [1408, 32, 1, 3328]
    - [74, 547.568]
  - - [2560, 3200, 1, 2560]
    - [52, 15666.3]
  - - [1856, 3584, 1, 1280]
    - [43, 15342.4]
  - - [256, 5888, 1, 256]
    - [45, 11037.6]
  - - [5056, 32, 1, 256]
    - [68, 1025.22]
  - - [1024, 4288, 1, 3328]
    - [47, 15503.4]
  - - [448, 2368, 1, 256]
    - [45, 7840.1]
  - - [64, 1408, 1, 1280]
    - [24, 3400.45]
  - - [1024, 48000, 1, 2816]
    - [47, 19769.0]
  - - [3584, 32, 1, 1280]
    - [71, 1191.56]
  - - [128, 2368, 1, 3328]
    - [29, 6580.96]
  - - [64, 5056, 1, 256]
    - [2, 4816.13]
  - - [256, 64, 1, 256]
    - [17, 444.312]
  - - [32, 1408, 1, 256]
    - [71, 286.07]
  - - [2368, 448, 1, 3328]
    - [20, 7558.12]
  - - [2368, 1408, 1, 1]
    - [84, 129.03]
  - - [1, 1, 1, 1]
    - [90, 9.4697e-05]
  - - [1024, 1856, 1, 32]
    - [63, 2222.86]
  - - [32, 1024, 1, 32]
    - [63, 72.4155]
  - - [4288, 1, 1, 256]
    - [90, 26.0867]
  - - [1856, 128, 1, 3328]
    - [2, 6227.37]
  - - [5888, 2368, 1, 1]
    - [81, 210.999]
  - - [2368, 2368, 1, 1]
    - [90, 135.314]
  - - [704, 256, 1, 1280]
    - [42, 4854.52]
  - - [704, 4288, 1, 256]
    - [43, 11652.6]
  - - [5888, 2368, 1, 32]
    - [60, 3331.61]
  - - [5888, 2368, 1, 1280]
    - [47, 16306.1]
  - - [128, 256, 1, 256]
    - [5, 859.489]
  - - [2944, 5056, 1, 3328]
    - [50, 11551.8]
  - - [6784, 704, 1, 3328]
    - [52, 14842.3]
  - - [1856, 1856, 1, 32]
    - [62, 2619.57]
  - - [4288, 2944, 1, 32]
    - [53, 3553.52]
  - - [256, 5056, 1, 1]
    - [80, 75.9587]
  - - [704, 64, 1, 256]
    - [1, 1221.86]
  - - [256, 2368, 1, 3328]
    - [48, 8111.35]
  - - [5124, 9124, 1, 2560]
    - [47, 14881.2]
  - - [704, 1, 1, 1]
    - [80, 0.0647059]
  - - [128, 448, 1, 1280]
    - [24, 2340.57]
  - - [5056, 5056, 1, 256]
    - [47, 16475.7]
  - - [5888, 256, 1, 256]
    - [42, 7754.74]
  - - [5888, 64, 1, 1]
    - [80, 31.827]
  - - [6784, 6784, 1, 256]
    - [52, 15899.0]
  - - [256, 3584, 1, 1]
    - [92, 58.8144]
  - - [2368, 1, 1, 256]
    - [92, 18.5271]
  - - [448, 32, 1, 32]
    - [66, 31.6818]
  - - [704, 64, 1, 1]
    - [80, 3.77987]
  - - [3584, 704, 1, 3328]
    - [45, 13130.1]
  - - [4288, 704, 1, 3328]
    - [52, 11172.6]
  - - [4288, 2944, 1, 1280]
    - [52, 11717.2]
  - - [448, 3584, 1, 256]
    - [43, 9585.86]
  - - [704, 32, 1, 256]
    - [61, 164.965]
  - - [6784, 256, 1, 32]
    - [62, 2001.96]
  - - [1856, 128, 1, 1]
    - [86, 19.7973]
  - - [1856, 32, 1, 32]
    - [70, 110.497]
  - - [6784, 1408, 1, 1280]
    - [51, 11055.4]
  - - [2368, 5056, 1, 1280]
    - [20, 13281.7]
  - - [704, 1856, 1, 1280]
    - [42, 11778.0]
  - - [1408, 1408, 1, 1280]
    - [52, 13660.4]
  - - [448, 1024, 1, 3328]
    - [45, 8678.53]
  - - [32, 704, 1, 32]
    - [54, 47.6783]
  - - [256, 704, 1, 1]
    - [80, 15.7538]
  - - [5888, 1856, 1, 32]
    - [65, 3882.11]
  - - [5888, 704, 1, 3328]
    - [47, 11379.0]
  - - [5056, 1, 1, 256]
    - [86, 32.8846]
  - - [448, 6784, 1, 256]
    - [43, 12597.9]
  - - [1024, 128, 1, 1]
    - [84, 11.4573]
  - - [16384, 400, 1, 4096]
    - [33, 8316.45]
  - - [128, 64, 1, 256]
    - [1, 229.951]
  - - [2560, 128, 1, 2560]
    - [34, 5388.37]
  - - [1856, 128, 1, 256]
    - [42, 4200.1]
  - - [2944, 5888, 1, 256]
    - [52, 14879.2]
  - - [1024, 256, 1, 1280]
    - [18, 6278.9]
  - - [128, 5056, 1, 32]
    - [66, 1275.21]
  - - [128, 5056, 1, 1280]
    - [42, 9303.4]
  - - [448, 32, 1, 3328]
    - [68, 179.631]
  - - [1856, 1408, 1, 32]
    - [68, 2155.26]
  - - [64, 704, 1, 32]
    - [61, 93.3803]
  - - [64, 704, 1, 3328]
    - [24, 2035.1]
  - - [64, 2368, 1, 32]
    - [54, 314.097]
  - - [5888, 64, 1, 32]
    - [66, 789.177]
  - - [2368, 256, 1, 1]
    - [86, 42.5708]
  - - [5888, 64, 1, 1280]
    - [42, 7238.07]
  - - [5056, 1, 1, 1]
    - [90, 0.390123]
  - - [5888, 2944, 1, 1280]
    - [47, 18895.5]
  - - [32, 2368, 1, 256]
    - [68, 556.154]
  - - [256, 1408, 1, 256]
    - [42, 5172.35]
  - - [448, 5888, 1, 1]
    - [90, 95.8512]
  - - [3584, 1408, 1, 1]
    - [83, 163.416]
  - - [32, 6784, 1, 1280]
    - [68, 1842.66]
  - - [32, 6784, 1, 32]
    - [70, 447.604]
  - - [7680, 32, 1, 2560]
    - [18, 5177.3]
  - - [448, 5888, 1, 32]
    - [70, 2244.96]
  - - [5056, 704, 1, 1280]
    - [47, 15102.3]
  - - [1856, 6784, 1, 1]
    - [84, 232.824]
  - - [5056, 64, 1, 1]
    - [84, 23.5163]
  - - [3072, 48000, 1, 1024]
    - [52, 15489.3]
  - - [1, 5888, 1, 1]
    - [98, 0.432941]
  - - [2368, 1024, 1, 256]
    - [43, 11792.5]
  - - [1856, 6784, 1, 32]
    - [72, 3490.26]
  - - [1856, 6784, 1, 1280]
    - [47, 16386.6]
  - - [64, 3584, 1, 3328]
    - [42, 6365.6]
  - - [5888, 5056, 1, 3328]
    - [45, 13194.3]
  - - [4096, 128, 1, 4096]
    - [12, 3892.62]
  - - [1, 2944, 1, 3328]
    - [86, 32.5286]
  - - [1408, 6784, 1, 32]
    - [72, 3498.85]
  - - [32, 5888, 1, 1280]
    - [67, 1448.66]
  - - [448, 256, 1, 1]
    - [84, 8.63614]
  - - [3584, 5888, 1, 3328]
    - [47, 15510.8]
  - - [4288, 1408, 1, 256]
    - [52, 10309.5]
  - - [448, 64, 1, 1280]
    - [24, 1223.34]
  - - [128, 448, 1, 32]
    - [66, 102.4]
  - - [6784, 2368, 1, 256]
    - [52, 10788.3]
  - - [1024, 24000, 1, 2816]
    - [52, 13838.3]
  - - [7680, 5984, 1, 2560]
    - [47, 17879.9]
  - - [1408, 448, 1, 32]
    - [66, 1230.8]
  - - [1856, 1408, 1, 1280]
    - [38, 8791.4]
  - - [448, 256, 1, 3328]
    - [17, 3798.58]
  - - [1856, 2368, 1, 1]
    - [84, 152.182]
  - - [1408, 5056, 1, 3328]
    - [47, 13194.8]
  - - [128, 704, 1, 3328]
    - [24, 3435.98]
  - - [5056, 128, 1, 1280]
    - [42, 9253.52]
  - - [5056, 4288, 1, 256]
    - [47, 17568.1]
  - - [5056, 5056, 1, 32]
    - [65, 4540.52]
  - - [1856, 704, 1, 256]
    - [43, 7714.39]
  - - [3072, 32, 1, 1024]
    - [9, 2374.13]
  - - [64, 256, 1, 256]
    - [1, 455.903]
  - - [448, 5888, 1, 1280]
    - [43, 9261.6]
  - - [16384, 3200, 1, 4096]
    - [52, 11194.1]
  - - [128, 6784, 1, 256]
    - [45, 8172.72]
  - - [5056, 448, 1, 256]
    - [41, 7518.96]
  - - [4288, 5888, 1, 1]
    - [80, 235.872]
  - - [1856, 5056, 1, 1280]
    - [52, 14165.7]
  - - [2368, 4288, 1, 1]
    - [84, 189.44]
  - - [2368, 32, 1, 3328]
    - [68, 944.361]
  - - [3584, 1856, 1, 256]
    - [47, 15324.8]
  - - [256, 3584, 1, 256]
    - [45, 6924.56]
  - - [64, 704, 1, 1]
    - [93, 2.73398]
  - - [4288, 5888, 1, 32]
    - [62, 4557.34]
  - - [4288, 5888, 1, 3328]
    - [45, 13269.6]
  - - [1, 1024, 1, 1]
    - [95, 0.0766467]
  - - [1024, 2944, 1, 3328]
    - [47, 16701.2]
  - - [6144, 24000, 1, 2560]
    - [52, 12734.1]
  - - [2944, 2368, 1, 256]
    - [47, 14065.8]
  - - [1024, 1856, 1, 256]
    - [47, 8750.71]
  - - [1760, 7000, 1, 1760]
    - [52, 13596.8]
  - - [2944, 64, 1, 3328]
    - [26, 5849.33]
  - - [1024, 5888, 1, 32]
    - [65, 3358.95]
  - - [1024, 5888, 1, 3328]
    - [47, 16349.6]
  - - [5056, 2368, 1, 32]
    - [65, 3709.56]
  - - [1408, 2368, 1, 1280]
    - [47, 14225.7]
  - - [256, 1, 1, 3328]
    - [86, 2.92089]
  - - [128, 1024, 1, 32]
    - [73, 221.219]
  - - [5056, 6784, 1, 3328]
    - [43, 16222.0]
  - - [448, 704, 1, 1]
    - [89, 23.1906]
  - - [32, 64, 1, 32]
    - [54, 4.26667]
  - - [448, 704, 1, 32]
    - [59, 650.293]
  - - [448, 704, 1, 3328]
    - [29, 6639.83]
  - - [1408, 2944, 1, 256]
    - [47, 15828.7]
  - - [1760, 1600, 1, 1760]
    - [42, 12085.8]
  - - [64, 5888, 1, 1]
    - [88, 29.8127]
  - - [2368, 128, 1, 32]
    - [63, 628.195]
  - - [2368, 256, 1, 1280]
    - [42, 8096.27]
  - - [1760, 800, 1, 1760]
    - [45, 12400.3]
  - - [2368, 128, 1, 3328]
    - [29, 6601.64]
  - - [704, 5056, 1, 32]
    - [63, 2651.34]
  - - [32, 2368, 1, 32]
    - [59, 165.631]
  - - [1408, 1, 1, 256]
    - [89, 9.13915]
  - - [4288, 256, 1, 32]
    - [59, 1708.53]
  - - [448, 1408, 1, 1]
    - [95, 51.5346]
  - - [5056, 4288, 1, 1280]
    - [45, 15101.5]
  - - [1408, 256, 1, 256]
    - [42, 5315.36]
  - - [4288, 448, 1, 1]
    - [84, 113.268]
  - - [256, 4288, 1, 32]
    - [66, 1632.31]
  - - [1408, 256, 1, 1280]
    - [19, 6561.06]
  - - [256, 256, 1, 1]
    - [80, 4.90539]
  - - [1408, 1, 1, 1]
    - [86, 0.112821]
  - - [448, 1408, 1, 256]
    - [42, 6865.68]
  - - [5888, 5888, 1, 1]
    - [85, 234.627]
  - - [4608, 16, 1, 1536]
    - [24, 2602.16]
  - - [128, 2944, 1, 32]
    - [63, 761.277]
  - - [6144, 5984, 1, 2048]
    - [33, 10757.7]
  - - [32, 256, 1, 32]
    - [66, 15.4566]
  - - [2944, 704, 1, 1280]
    - [45, 14299.8]
  - - [1024, 3584, 1, 1280]
    - [42, 11889.1]
  - - [1856, 448, 1, 1]
    - [88, 65.7823]
  - - [2368, 2944, 1, 1]
    - [79, 205.041]
  - - [5056, 256, 1, 32]
    - [54, 1803.95]
  - - [4288, 1, 1, 3328]
    - [92, 36.6285]
  - - [5056, 1024, 1, 1280]
    - [43, 11953.4]
  - - [704, 704, 1, 1]
    - [92, 40.2286]
  - - [1856, 448, 1, 1280]
    - [45, 7757.32]
  - - [3584, 6784, 1, 256]
    - [47, 18191.3]
  - - [64, 1856, 1, 1280]
    - [27, 4069.69]
  - - [1856, 1408, 1, 256]
    - [47, 12207.9]
  - - [4608, 5984, 1, 1536]
    - [20, 13442.6]
  - - [4288, 4288, 1, 32]
    - [72, 3503.93]
  - - [128, 1, 1, 256]
    - [90, 0.8587]
  - - [32, 64, 1, 3328]
    - [74, 24.6875]
  - - [5888, 448, 1, 1]
    - [92, 95.5733]
  - - [128, 5888, 1, 256]
    - [16, 6448.46]
  - - [3584, 256, 1, 3328]
    - [43, 11697.2]
  - - [5056, 5056, 1, 1280]
    - [20, 14556.5]
  - - [6784, 1408, 1, 3328]
    - [47, 17501.6]
  - - [512, 24000, 1, 2048]
    - [47, 10273.8]
  - - [448, 2368, 1, 1]
    - [80, 73.6711]
  - - [2560, 800, 1, 2560]
    - [43, 10745.3]
  - - [2368, 1, 1, 1280]
    - [86, 22.7283]
  - - [32, 3584, 1, 32]
    - [61, 234.057]
  - - [128, 6784, 1, 1]
    - [86, 68.6987]
  - - [1, 3584, 1, 1]
    - [92, 0.32]
  - - [5888, 5888, 1, 3328]
    - [31, 11376.7]
  - - [256, 2944, 1, 3328]
    - [47, 10199.2]
  - - [512, 24000, 1, 2560]
    - [47, 15126.6]
  - - [1, 128, 1, 3328]
    - [94, 1.46406]
  - - [32, 256, 1, 256]
    - [73, 59.1747]
  - - [5888, 1408, 1, 32]
    - [62, 3660.18]
  - - [704, 256, 1, 1]
    - [90, 14.6286]
  - - [1, 448, 1, 1]
    - [93, 0.0341463]
  - - [256, 6784, 1, 3328]
    - [43, 11667.8]
  - - [64, 5888, 1, 256]
    - [2, 5407.45]
  - - [1856, 1, 1, 1]
    - [92, 0.166906]
  - - [1024, 256, 1, 3328]
    - [42, 7484.69]
  - - [704, 704, 1, 256]
    - [42, 5684.48]
  - - [448, 1024, 1, 32]
    - [56, 931.476]
  - - [6784, 2368, 1, 1280]
    - [47, 17080.8]
  - - [128, 1856, 1, 1280]
    - [26, 6442.52]
  - - [256, 2368, 1, 256]
    - [42, 5639.14]
  - - [2944, 1408, 1, 1]
    - [86, 149.753]
  - - [6784, 1024, 1, 256]
    - [52, 10436.5]
  - - [5056, 1408, 1, 32]
    - [65, 3385.9]
  - - [1408, 6784, 1, 3328]
    - [52, 14085.7]
  - - [2944, 1408, 1, 3328]
    - [47, 13773.0]
  - - [1856, 32, 1, 256]
    - [70, 383.174]
  - - [704, 2368, 1, 32]
    - [62, 2186.32]
  - - [448, 256, 1, 32]
    - [56, 217.418]
  - - [704, 6784, 1, 1]
    - [79, 149.998]
  - - [2368, 6784, 1, 256]
    - [47, 10813.3]
  - - [8448, 48000, 1, 2816]
    - [47, 8005.28]
  - - [7680, 64, 1, 2560]
    - [34, 6779.59]
  - - [1856, 3584, 1, 3328]
    - [43, 15398.1]
  - - [1, 704, 1, 3328]
    - [92, 7.17275]
  - - [4096, 32, 1, 4096]
    - [11, 2095.18]
  - - [64, 1, 1, 3328]
    - [92, 0.762427]
  - - [448, 704, 1, 1280]
    - [18, 5473.18]
  - - [704, 1856, 1, 1]
    - [82, 79.2854]
  - - [704, 448, 1, 256]
    - [18, 4153.31]
  - - [448, 64, 1, 3328]
    - [24, 1364.71]
  - - [704, 6784, 1, 256]
    - [47, 14695.2]
  - - [256, 32, 1, 1280]
    - [75, 75.7204]
  - - [2368, 448, 1, 1280]
    - [42, 8831.33]
  - - [6784, 2944, 1, 32]
    - [72, 3627.99]
  - - [4096, 1600, 1, 1024]
    - [52, 10562.3]
  - - [64, 4288, 1, 32]
    - [61, 577.752]
  - - [128, 704, 1, 1]
    - [94, 6.74491]
  - - [6144, 48000, 1, 2048]
    - [52, 13199.2]
  - - [128, 448, 1, 3328]
    - [24, 2524.35]
  - - [5888, 2368, 1, 3328]
    - [52, 16017.3]
  - - [2368, 704, 1, 1280]
    - [47, 12522.6]
  - - [1024, 1408, 1, 1280]
    - [42, 11101.4]
  - - [4288, 64, 1, 1280]
    - [29, 5622.17]
  - - [128, 5056, 1, 1]
    - [84, 54.2926]
  - - [2944, 5056, 1, 32]
    - [53, 3686.65]
  - - [2048, 1600, 1, 512]
    - [47, 9114.06]
  - - [448, 448, 1, 1]
    - [86, 14.4184]
  - - [256, 2368, 1, 1280]
    - [42, 8746.01]
  - - [704, 2368, 1, 3328]
    - [20, 11361.4]
  - - [3584, 2944, 1, 256]
    - [45, 13441.1]
  - - [64, 6784, 1, 256]
    - [42, 5837.66]
  - - [3584, 1024, 1, 1280]
    - [45, 15060.3]
  - - [2048, 3200, 1, 512]
    - [52, 10459.6]
  - - [6144, 12000, 1, 2048]
    - [52, 13201.3]
  - - [64, 1024, 1, 256]
    - [1, 1718.98]
  - - [1408, 32, 1, 32]
    - [56, 94.8547]
  - - [128, 3584, 1, 256]
    - [22, 6066.14]
  - - [704, 1408, 1, 1]
    - [90, 65.5577]
  - - [5056, 3584, 1, 256]
    - [47, 13928.9]
  - - [2368, 704, 1, 256]
    - [43, 9897.27]
  - - [1856, 1856, 1, 1280]
    - [47, 14689.7]
  - - [32, 5888, 1, 32]
    - [61, 350.541]
  - - [64, 32, 1, 32]
    - [63, 4.42811]
  - - [4288, 704, 1, 1]
    - [86, 91.3666]
  - - [1856, 1024, 1, 1]
    - [79, 112.06]
  - - [4288, 2944, 1, 3328]
    - [42, 13220.4]
  - - [1024, 128, 1, 3328]
    - [29, 4060.01]
  - - [4288, 128, 1, 3328]
    - [6, 7711.16]
  - - [4288, 704, 1, 32]
    - [62, 2547.47]
  - - [1856, 1024, 1, 32]
    - [53, 2331.96]
  - - [1, 448, 1, 3328]
    - [86, 5.17401]
  - - [2944, 6784, 1, 1]
    - [83, 265.023]
  - - [6784, 2368, 1, 32]
    - [57, 3243.72]
  - - [5888, 5056, 1, 1]
    - [83, 231.996]
  - - [128, 6784, 1, 1280]
    - [47, 10761.9]
  - - [704, 5888, 1, 1]
    - [84, 145.956]
  - - [6784, 6784, 1, 1]
    - [79, 274.074]
  - - [1856, 32, 1, 1280]
    - [74, 649.093]
  - - [3072, 16, 1, 1024]
    - [1, 1452.99]
  - - [5888, 448, 1, 3328]
    - [45, 10023.1]
  - - [704, 5888, 1, 32]
    - [62, 2992.89]
  - - [704, 5888, 1, 1280]
    - [43, 11763.5]
  - - [1024, 6784, 1, 3328]
    - [47, 10256.1]
  - - [704, 2944, 1, 1280]
    - [43, 14256.7]
  - - [4288, 6784, 1, 256]
    - [43, 15623.9]
  - - [3584, 256, 1, 32]
    - [73, 1433.6]
  - - [1408, 1408, 1, 32]
    - [65, 2591.46]
  - - [1408, 1408, 1, 3328]
    - [52, 10455.2]
  - - [1024, 64, 1, 256]
    - [1, 1691.25]
  - - [4288, 64, 1, 32]
    - [56, 515.365]
  - - [1408, 256, 1, 32]
    - [56, 750.933]
  - - [5888, 128, 1, 256]
    - [43, 7177.75]
  - - [64, 704, 1, 1280]
    - [1, 1815.86]
  - - [2944, 1856, 1, 256]
    - [47, 9092.57]
  - - [128, 5056, 1, 3328]
    - [21, 9207.3]
  - - [4288, 2944, 1, 1]
    - [80, 209.838]
  - - [6784, 5056, 1, 32]
    - [65, 4673.0]
  - - [1024, 448, 1, 3328]
    - [42, 9313.82]
  - - [3584, 128, 1, 1]
    - [97, 32.768]
  - - [2944, 4288, 1, 1280]
    - [20, 11378.6]
  - - [64, 32, 1, 3328]
    - [68, 25.0948]
  - - [1024, 4288, 1, 256]
    - [43, 11837.3]
  - - [128, 2368, 1, 256]
    - [6, 4754.57]
  - - [2368, 64, 1, 32]
    - [63, 285.947]
  - - [1408, 1, 1, 3328]
    - [92, 17.022]
  - - [64, 1408, 1, 32]
    - [66, 186.761]
  - - [2368, 5888, 1, 1]
    - [80, 226.344]
  - - [1408, 1856, 1, 32]
    - [54, 2408.52]
  - - [448, 1856, 1, 256]
    - [45, 6320.1]
  - - [1856, 6784, 1, 3328]
    - [42, 13193.0]
  - - [3584, 128, 1, 256]
    - [42, 6612.64]
  - - [1024, 448, 1, 1280]
    - [40, 6977.22]
  - - [1024, 2368, 1, 32]
    - [63, 2443.16]
  - - [32, 2944, 1, 256]
    - [70, 771.012]
  - - [128, 5888, 1, 1]
    - [80, 54.7721]
  - - [64, 5056, 1, 1]
    - [96, 23.9337]
  - - [1856, 256, 1, 32]
    - [56, 945.544]
  - - [2368, 2368, 1, 3328]
    - [47, 15994.8]
  - - [64, 448, 1, 1]
    - [84, 1.95847]
  - - [3584, 5888, 1, 32]
    - [65, 4071.89]
  - - [3584, 5888, 1, 1280]
    - [47, 18544.6]
  - - [64, 5056, 1, 32]
    - [66, 667.184]
  - - [2944, 64, 1, 1]
    - [80, 16.8229]
  - - [6784, 704, 1, 256]
    - [51, 9118.73]
  - - [3584, 1024, 1, 32]
    - [65, 2645.06]
  - - [1408, 704, 1, 32]
    - [56, 1542.77]
  - - [1408, 704, 1, 1280]
    - [49, 8614.73]
  - - [2368, 5888, 1, 256]
    - [44, 11993.8]
  - - [2944, 64, 1, 32]
    - [59, 352.179]
  - - [1, 1408, 1, 256]
    - [92, 9.10222]
  - - [64, 2944, 1, 256]
    - [7, 3525.91]
  - - [5888, 5888, 1, 32]
    - [62, 4479.13]
  - - [1856, 1408, 1, 3328]
    - [43, 13787.1]
  - - [1024, 1024, 1, 32]
    - [73, 1784.81]
  - - [4288, 1024, 1, 1]
    - [84, 157.268]
  - - [704, 4288, 1, 3328]
    - [47, 13090.8]
  - - [2944, 5056, 1, 1280]
    - [33, 11227.5]
  - - [6784, 2944, 1, 1280]
    - [43, 15856.3]
  - - [6784, 256, 1, 3328]
    - [47, 13654.7]
  - - [5056, 128, 1, 3328]
    - [4, 8474.09]
  - - [128, 128, 1, 1280]
    - [1, 686.241]
  - - [128, 4288, 1, 1]
    - [93, 44.2632]
  - - [1408, 5056, 1, 32]
    - [70, 3163.93]
  - - [2944, 128, 1, 3328]
    - [29, 7791.36]
  - - [5888, 1856, 1, 1280]
    - [47, 13625.0]
  - - [64, 128, 1, 256]
    - [1, 259.549]
  - - [5888, 256, 1, 1280]
    - [45, 13015.2]
  - - [1856, 5056, 1, 1]
    - [92, 193.244]
  - - [3584, 1856, 1, 1280]
    - [47, 16067.4]
  - - [6784, 448, 1, 256]
    - [52, 9013.48]
  - - [704, 3584, 1, 256]
    - [47, 11701.5]
  - - [1856, 5056, 1, 32]
    - [62, 3588.5]
  - - [1856, 5056, 1, 3328]
    - [47, 17187.1]
  - - [1024, 2944, 1, 32]
    - [62, 2638.65]
  - - [1408, 6784, 1, 256]
    - [52, 13435.6]
  - - [1024, 2368, 1, 1280]
    - [45, 8054.24]
  - - [1856, 3584, 1, 1]
    - [84, 197.503]
  - - [5888, 128, 1, 1280]
    - [8, 8958.86]
  - - [2944, 5888, 1, 1280]
    - [47, 16171.9]
  - - [1, 1856, 1, 1]
    - [88, 0.173134]
  - - [3584, 3584, 1, 256]
    - [47, 17270.6]
  - - [1856, 2368, 1, 3328]
    - [52, 13700.4]
  - - [5888, 704, 1, 256]
    - [45, 13549.0]
  - - [64, 448, 1, 32]
    - [73, 49.012]
  - - [6784, 4288, 1, 256]
    - [45, 15323.0]
  - - [128, 64, 1, 3328]
    - [24, 391.709]
  - - [1, 5056, 1, 1280]
    - [92, 40.3671]
  - - [32, 64, 1, 1280]
    - [68, 23.7967]
  - - [1408, 2368, 1, 3328]
    - [43, 14037.1]
  - - [1024, 3584, 1, 256]
    - [47, 11379.9]
  - - [2944, 128, 1, 256]
    - [42, 5582.7]
  - - [6784, 128, 1, 1]
    - [88, 63.8494]
  - - [1408, 256, 1, 3328]
    - [29, 7212.43]
  - - [448, 32, 1, 256]
    - [73, 109.227]
  - - [512, 24000, 1, 1536]
    - [52, 15294.3]
  - - [1024, 32, 1, 256]
    - [74, 225.016]
  - - [1, 5888, 1, 256]
    - [86, 36.3737]
  - - [64, 2368, 1, 256]
    - [0, 3169.72]
  - - [2944, 256, 1, 256]
    - [42, 8552.22]
  - - [1, 128, 1, 256]
    - [92, 0.798441]
  - - [32, 256, 1, 1280]
    - [73, 84.7266]
  - - [5888, 1, 1, 256]
    - [86, 30.587]
  - - [32, 128, 1, 3328]
    - [68, 51.2307]
  - - [6784, 128, 1, 256]
    - [23, 6553.6]
  - - [6784, 64, 1, 1280]
    - [7, 8279.88]
  - - [4288, 1024, 1, 32]
    - [65, 2971.85]
  - - [1408, 64, 1, 3328]
    - [24, 3529.81]
  - - [2944, 448, 1, 1280]
    - [45, 9025.89]
  - - [6784, 32, 1, 1280]
    - [74, 1798.76]
  - - [2944, 64, 1, 1280]
    - [18, 5118.26]
  - - [704, 448, 1, 1]
    - [90, 24.64]
  - - [32, 128, 1, 32]
    - [70, 7.9534]
  - - [1, 128, 1, 1]
    - [90, 0.0107383]
  - - [2560, 7000, 1, 2560]
    - [43, 15288.8]
  - - [5888, 1, 1, 1]
    - [80, 0.541176]
  - - [5888, 1856, 1, 3328]
    - [20, 12498.5]
  - - [2368, 3584, 1, 256]
    - [52, 12969.5]
  - - [4288, 1408, 1, 3328]
    - [38, 10703.6]
  - - [1856, 32, 1, 3328]
    - [74, 718.854]
  - - [2944, 32, 1, 256]
    - [68, 699.456]
  - - [128, 64, 1, 1]
    - [86, 0.687248]
  - - [256, 1024, 1, 3328]
    - [42, 7323.83]
  - - [32, 448, 1, 256]
    - [70, 108.709]
  - - [1856, 64, 1, 3328]
    - [27, 4451.72]
  - - [256, 5056, 1, 256]
    - [45, 9456.34]
  - - [5888, 2944, 1, 3328]
    - [52, 16296.5]
  - - [2368, 1408, 1, 3328]
    - [52, 12837.9]
  - - [5888, 704, 1, 32]
    - [62, 2982.12]
  - - [2944, 704, 1, 1]
    - [84, 115.657]
  - - [6784, 1856, 1, 256]
    - [52, 10764.5]
  - - [1, 704, 1, 256]
    - [92, 5.07387]
  - - [1856, 1856, 1, 1]
    - [84, 138.454]
  - - [5888, 32, 1, 256]
    - [68, 1222.98]
  - - [128, 704, 1, 256]
    - [1, 2120.28]
  - - [256, 1408, 1, 3328]
    - [29, 7765.22]
  - - [2944, 128, 1, 1]
    - [82, 30.9895]
  - - [32, 256, 1, 3328]
    - [68, 103.237]
  - - [2944, 704, 1, 3328]
    - [45, 14638.2]
  - - [704, 1024, 1, 32]
    - [61, 1366.63]
  - - [2368, 1856, 1, 32]
    - [62, 2949.67]
  - - [5056, 4288, 1, 3328]
    - [43, 15030.5]
  - - [3584, 448, 1, 3328]
    - [38, 9602.38]
  - - [256, 32, 1, 32]
    - [63, 17.523]
  - - [64, 256, 1, 3328]
    - [24, 777.166]
  - - [256, 6784, 1, 1]
    - [79, 96.9143]
  - - [1024, 3584, 1, 32]
    - [73, 2723.57]
  - - [256, 6784, 1, 32]
    - [65, 2233.7]
  - - [2944, 1408, 1, 32]
    - [66, 2796.06]
  - - [2048, 800, 1, 2048]
    - [49, 5701.87]
  - - [4288, 3584, 1, 1]
    - [84, 232.851]
  - - [1, 704, 1, 1]
    - [80, 0.0633094]
  - - [5056, 448, 1, 3328]
    - [45, 10108.1]
  - - [3584, 64, 1, 256]
    - [42, 4123.61]
  - - [64, 1856, 1, 32]
    - [63, 218.957]
  - - [64, 1856, 1, 3328]
    - [27, 4451.72]
  - - [2560, 6400, 1, 2560]
    - [43, 15321.5]
  - - [6784, 3584, 1, 32]
    - [65, 4459.2]
  - - [4288, 1856, 1, 256]
    - [52, 13347.6]
  - - [1856, 2944, 1, 256]
    - [47, 14607.4]
  - - [128, 448, 1, 1]
    - [86, 5.1942]
  - - [64, 128, 1, 32]
    - [63, 14.8271]
  - - [704, 1, 1, 1280]
    - [86, 7.0665]
  - - [2560, 1600, 1, 2560]
    - [47, 13062.8]
  - - [2944, 5888, 1, 1]
    - [83, 246.506]
  - - [1024, 1856, 1, 3328]
    - [42, 11562.2]
  - - [5888, 1024, 1, 32]
    - [65, 3588.88]
  - - [3584, 256, 1, 1280]
    - [47, 10493.3]
  - - [1024, 1, 1, 1]
    - [93, 0.0785276]
  - - [1408, 5056, 1, 1280]
    - [43, 14091.5]
  - - [3584, 128, 1, 1280]
    - [21, 7926.6]
  - - [5056, 6784, 1, 256]
    - [52, 14248.9]
  - - [256, 1856, 1, 256]
    - [42, 6942.63]
  - - [5888, 32, 1, 1280]
    - [68, 1605.24]
  - - [256, 128, 1, 32]
    - [64, 62.4152]
  - - [32, 1856, 1, 1280]
    - [74, 646.004]
  - - [2944, 5056, 1, 1]
    - [81, 220.713]
  - - [448, 128, 1, 1]
    - [90, 4.11954]
  - - [256, 704, 1, 32]
    - [61, 373.521]
  - - [256, 704, 1, 1280]
    - [29, 5014.93]
  - - [1, 2368, 1, 1]
    - [80, 0.187342]
  - - [5888, 5888, 1, 1280]
    - [47, 19113.6]
  - - [256, 2944, 1, 1280]
    - [42, 9957.58]
  - - [2944, 256, 1, 3328]
    - [42, 11213.3]
  - - [5056, 2944, 1, 1280]
    - [47, 11476.9]
  - - [704, 1024, 1, 3328]
    - [20, 9822.87]
  - - [2368, 1856, 1, 1280]
    - [47, 15184.6]
  - - [448, 2944, 1, 1]
    - [84, 79.2615]
  - - [6784, 2944, 1, 1]
    - [85, 247.67]
  - - [2944, 1024, 1, 32]
    - [54, 2593.25]
  - - [2944, 1024, 1, 1280]
    - [45, 13564.2]
  - - [1408, 64, 1, 32]
    - [61, 192.753]
  - - [5056, 5056, 1, 1]
    - [80, 216.637]
  - - [2368, 4288, 1, 256]
    - [47, 15826.9]
  - - [448, 1856, 1, 1280]
    - [43, 9382.09]
  - - [2368, 448, 1, 1]
    - [88, 69.7937]
  - - [448, 2944, 1, 32]
    - [55, 1819.19]
  - - [448, 2944, 1, 1280]
    - [46, 9259.58]
  - - [2944, 6784, 1, 1280]
    - [47, 18164.7]
  - - [2048, 64, 1, 2048]
    - [32, 2325.32]
  - - [256, 6784, 1, 1280]
    - [52, 12008.3]
  - - [128, 2368, 1, 1280]
    - [6, 6170.06]
  - - [3584, 2368, 1, 32]
    - [62, 3611.45]
  - - [16384, 1600, 1, 4096]
    - [52, 12712.4]
  - - [704, 32, 1, 32]
    - [76, 38.8414]
  - - [6784, 3584, 1, 3328]
    - [42, 12452.7]
  - - [128, 32, 1, 256]
    - [71, 36.0088]
  - - [128, 1408, 1, 1280]
    - [26, 5085.69]
  - - [64, 32, 1, 1280]
    - [74, 21.8599]
  - - [128, 1856, 1, 3328]
    - [29, 7298.99]
  - - [2944, 2944, 1, 256]
    - [52, 13366.1]
  - - [1408, 1024, 1, 3328]
    - [51, 9851.91]
  - - [1760, 64, 1, 1760]
    - [1, 3649.6]
  - - [5056, 2368, 1, 1280]
    - [52, 15660.7]
  - - [448, 128, 1, 32]
    - [56, 114.688]
  - - [2368, 64, 1, 3328]
    - [26, 4761.75]
  - - [32, 5056, 1, 3328]
    - [68, 1474.7]
  - - [448, 2944, 1, 3328]
    - [45, 11840.0]
  - - [2944, 1024, 1, 1]
    - [80, 146.627]
  - - [2048, 400, 1, 512]
    - [47, 7436.71]
  - - [2368, 128, 1, 1280]
    - [29, 6233.5]
  - - [2048, 1600, 1, 2048]
    - [52, 6126.64]
  - - [3584, 704, 1, 256]
    - [47, 11735.5]
  - - [2368, 5888, 1, 3328]
    - [52, 16024.4]
  - - [4288, 2368, 1, 1]
    - [87, 189.158]
  - - [1408, 3584, 1, 32]
    - [65, 3219.31]
  - - [2944, 4288, 1, 32]
    - [65, 4149.18]
  - - [5888, 1408, 1, 1280]
    - [52, 12563.4]
  - - [3584, 5056, 1, 1280]
    - [47, 14538.7]
  - - [5888, 6784, 1, 1280]
    - [52, 16499.9]
  - - [64, 1856, 1, 1]
    - [84, 8.58266]
  - - [704, 128, 1, 32]
    - [66, 132.518]
  - - [3584, 2944, 1, 1]
    - [83, 204.482]
  - - [128, 3584, 1, 3328]
    - [30, 8627.52]
  - - [256, 4288, 1, 3328]
    - [39, 8875.68]
  - - [4288, 64, 1, 1]
    - [97, 16.2578]
  - - [1, 1408, 1, 1280]
    - [94, 13.8378]
  - - [5056, 32, 1, 1280]
    - [68, 1389.52]
  - - [1856, 704, 1, 32]
    - [54, 1935.74]
  - - [1024, 1856, 1, 1]
    - [84, 111.534]
  - - [704, 5056, 1, 3328]
    - [52, 11099.8]
  - - [1024, 3584, 1, 3328]
    - [52, 14135.0]
  - - [5888, 256, 1, 3328]
    - [52, 11084.4]
  - - [2048, 7000, 1, 2048]
    - [52, 15378.9]
  - - [1856, 1408, 1, 1]
    - [86, 121.887]
  - - [2944, 448, 1, 32]
    - [72, 1800.56]
  - - [128, 448, 1, 256]
    - [17, 1516.54]
  - - [128, 1024, 1, 1]
    - [80, 11.6199]
  - - [32, 32, 1, 256]
    - [70, 7.91498]
  - - [4288, 5056, 1, 1280]
    - [47, 16859.4]
  - - [1856, 1856, 1, 3328]
    - [47, 13602.4]
  - - [1024, 2368, 1, 256]
    - [45, 11721.2]
  - - [4288, 2368, 1, 3328]
    - [47, 16998.2]
  - - [256, 64, 1, 32]
    - [63, 34.312]
  - - [1, 1024, 1, 1280]
    - [92, 11.2219]
  - - [8448, 12000, 1, 2816]
    - [52, 14853.2]
  - - [5056, 128, 1, 32]
    - [61, 1238.6]
  - - [5888, 3584, 1, 256]
    - [47, 18050.8]
  - - [1024, 5056, 1, 32]
    - [62, 3318.81]
  - - [5888, 448, 1, 1280]
    - [43, 9135.31]
  - - [704, 5888, 1, 3328]
    - [52, 12936.1]
  - - [1024, 48000, 1, 1536]
    - [43, 14700.6]
  - - [1024, 1408, 1, 256]
    - [42, 9209.05]
  - - [8192, 1600, 1, 2048]
    - [52, 8762.3]
  - - [3584, 2944, 1, 1280]
    - [52, 14803.6]
  - - [1, 5056, 1, 256]
    - [86, 33.777]
  - - [256, 1024, 1, 1]
    - [86, 21.8453]
  - - [32, 32, 1, 3328]
    - [68, 12.8231]
  - - [4096, 800, 1, 1024]
    - [52, 9892.2]
  - - [2368, 1, 1, 3328]
    - [92, 28.3071]
  - - [4288, 1856, 1, 1280]
    - [52, 14820.3]
  - - [3584, 5888, 1, 1]
    - [83, 265.642]
  - - [8448, 16, 1, 2816]
    - [25, 3513.97]
  - - [5888, 4288, 1, 256]
    - [47, 16223.4]
  - - [1024, 2944, 1, 1280]
    - [47, 16262.5]
  - - [6784, 1, 1, 1]
    - [82, 0.614493]
  - - [1408, 64, 1, 1280]
    - [28, 2906.84]
  - - [1, 256, 1, 1280]
    - [86, 2.77883]
  - - [2944, 3584, 1, 256]
    - [45, 14503.5]
  - - [1, 128, 1, 1280]
    - [86, 1.38098]
  - - [1024, 256, 1, 32]
    - [54, 537.731]
  - - [5888, 1, 1, 1280]
    - [92, 47.2694]
  - - [2368, 32, 1, 1280]
    - [74, 823.093]
  - - [5888, 1856, 1, 1]
    - [85, 197.687]
  - - [6784, 128, 1, 1280]
    - [37, 9134.54]
  - - [6784, 2368, 1, 3328]
    - [42, 13347.2]
  - - [1, 64, 1, 256]
    - [92, 0.460225]
  - - [704, 128, 1, 1]
    - [84, 6.4]
  - - [1408, 4288, 1, 32]
    - [65, 3237.27]
  - - [256, 64, 1, 1280]
    - [24, 708.497]
  - - [256, 448, 1, 256]
    - [1, 2678.84]
  - - [1856, 1024, 1, 1280]
    - [47, 14243.0]
  - - [5888, 1856, 1, 256]
    - [52, 13833.1]
  - - [512, 48000, 1, 1536]
    - [43, 15294.7]
  - - [8448, 5984, 1, 2816]
    - [47, 18211.8]
  - - [5056, 1856, 1, 1]
    - [81, 183.28]
  - - [5888, 2368, 1, 256]
    - [52, 14186.6]
  - - [1408, 1024, 1, 32]
    - [63, 1954.97]
  - - [32, 704, 1, 256]
    - [61, 144.179]
  - - [2944, 1, 1, 256]
    - [92, 22.7556]
  - - [32, 4288, 1, 256]
    - [70, 786.902]
  - - [5056, 1856, 1, 32]
    - [62, 3742.35]
  - - [5056, 1856, 1, 1280]
    - [20, 12844.8]
  - - [1, 64, 1, 1]
    - [88, 0.0057554]
  - - [1408, 5888, 1, 3328]
    - [47, 17252.4]
  - - [1408, 704, 1, 3328]
    - [45, 10721.6]
  - - [5056, 704, 1, 3328]
    - [52, 12996.7]
  - - [704, 64, 1, 1280]
    - [1, 1825.05]
  - - [1, 704, 1, 1280]
    - [86, 7.07982]
  - - [5888, 6784, 1, 1]
    - [83, 281.456]
  - - [5888, 4288, 1, 32]
    - [62, 4168.01]
  - - [1408, 3584, 1, 256]
    - [52, 12856.7]
  - - [1856, 704, 1, 1]
    - [85, 82.4889]
  - - [6784, 256, 1, 1]
    - [79, 94.3861]
  - - [2944, 1, 1, 1]
    - [95, 0.189691]
  - - [256, 1856, 1, 3328]
    - [42, 9632.39]
  - - [4288, 128, 1, 1280]
    - [16, 7008.64]
  - - [6784, 256, 1, 1280]
    - [52, 12003.1]
  - - [2048, 32, 1, 2048]
    - [24, 1966.85]
  - - [128, 4288, 1, 256]
    - [22, 5647.48]
  - - [128, 128, 1, 32]
    - [63, 33.4367]
  - - [128, 1408, 1, 32]
    - [54, 367.804]
  - - [1760, 3200, 1, 1760]
    - [39, 13406.6]
  - - [6784, 128, 1, 32]
    - [54, 1320.69]
  - - [1408, 448, 1, 1]
    - [89, 43.0863]
  - - [2368, 704, 1, 3328]
    - [20, 12565.7]
  - - [704, 128, 1, 3328]
    - [24, 3461.37]
  - - [2944, 1856, 1, 32]
    - [62, 3326.68]
  - - [1024, 64, 1, 1]
    - [80, 5.31948]
  - - [1408, 32, 1, 1280]
    - [68, 464.495]
  - - [704, 1, 1, 256]
    - [94, 4.67386]
  - - [2368, 1408, 1, 256]
    - [47, 12747.0]
  - - [2368, 1856, 1, 1]
    - [80, 151.343]
  - - [4288, 1408, 1, 1]
    - [85, 149.74]
  - - [3584, 2368, 1, 1280]
    - [47, 15900.5]
  - - [64, 5056, 1, 1280]
    - [29, 6561.91]
  - - [1408, 2944, 1, 1]
    - [84, 150.187]
  - - [4288, 1408, 1, 32]
    - [53, 3181.82]
  - - [5888, 2944, 1, 256]
    - [43, 11797.0]
  - - [128, 64, 1, 1280]
    - [24, 358.12]
  - - [1408, 2944, 1, 32]
    - [65, 2908.88]
  - - [1, 3584, 1, 1280]
    - [92, 39.0893]
  - - [64, 64, 1, 32]
    - [70, 7.76493]
  - - [448, 1408, 1, 32]
    - [73, 1207.24]
  - - [128, 5056, 1, 256]
    - [2, 6880.19]
  - - [1, 1, 1, 1280]
    - [92, 0.0111188]
  - - [8448, 24000, 1, 2816]
    - [47, 14356.9]
  - - [64, 704, 1, 256]
    - [0, 1162.74]
  - - [3072, 128, 1, 1024]
    - [36, 4953.9]
  - - [5888, 6784, 1, 256]
    - [47, 11802.5]
  - - [6784, 5888, 1, 1]
    - [83, 259.648]
  - - [1024, 16, 1, 500000]
    - [9, 784.24]
  - - [64, 4288, 1, 256]
    - [6, 4181.82]
  - - [1, 448, 1, 1280]
    - [92, 4.9847]
  - - [1024, 1024, 1, 1]
    - [84, 79.4376]
  - - [6784, 5888, 1, 1280]
    - [45, 16176.6]
  - - [1024, 4288, 1, 32]
    - [62, 3108.61]
  - - [1856, 1, 1, 1280]
    - [92, 20.6941]
  - - [3584, 5888, 1, 256]
    - [47, 14100.7]
  - - [5056, 2368, 1, 1]
    - [84, 209.604]
  - - [256, 1408, 1, 1280]
    - [29, 5626.51]
  - - [2560, 16, 1, 2560]
    - [24, 1825.52]
  - - [64, 256, 1, 32]
    - [73, 31.2076]
  - - [64, 5888, 1, 3328]
    - [21, 7814.66]
  - - [6784, 64, 1, 3328]
    - [42, 8750.83]
  - - [5056, 448, 1, 1]
    - [84, 107.656]
  - - [2944, 448, 1, 3328]
    - [45, 11881.0]
  - - [2368, 1024, 1, 1280]
    - [47, 12658.2]
  - - [1856, 6784, 1, 256]
    - [47, 15556.6]
  - - [4288, 32, 1, 1280]
    - [71, 1136.36]
  - - [448, 1408, 1, 1280]
    - [20, 7733.75]
  - - [5056, 448, 1, 32]
    - [54, 2226.13]
  - - [3584, 2944, 1, 32]
    - [65, 3929.72]
  - - [2368, 128, 1, 1]
    - [84, 18.944]
  - - [32, 128, 1, 1280]
    - [68, 46.3808]
  - - [3584, 1856, 1, 32]
    - [62, 3359.55]
  - - [128, 128, 1, 3328]
    - [24, 778.942]
  - - [5056, 64, 1, 256]
    - [7, 4771.75]
  - - [64, 448, 1, 3328]
    - [1, 1255.53]
  - - [4288, 1408, 1, 1280]
    - [19, 10302.9]
  - - [6784, 2368, 1, 1]
    - [83, 233.496]
  - - [32, 5056, 1, 256]
    - [74, 1007.27]
  - - [704, 128, 1, 256]
    - [17, 2089.55]
  - - [704, 5056, 1, 1]
    - [84, 146.358]
  - - [256, 1024, 1, 32]
    - [54, 532.272]
  - - [256, 1024, 1, 1280]
    - [49, 5949.37]
  - - [2368, 128, 1, 256]
    - [18, 4408.79]
  - - [32, 64, 1, 256]
    - [61, 14.0936]
  - - [2368, 1408, 1, 1280]
    - [52, 10482.7]
  - - [128, 256, 1, 32]
    - [63, 61.8264]
  - - [64, 6784, 1, 32]
    - [70, 943.861]
  - - [6784, 32, 1, 256]
    - [64, 1099.18]
  - - [256, 4288, 1, 1]
    - [84, 76.657]
  - - [5888, 1408, 1, 1]
    - [84, 191.197]
  - - [1024, 4288, 1, 1280]
    - [45, 14291.0]
  - - [1856, 4288, 1, 1]
    - [84, 204.695]
  - - [128, 2944, 1, 256]
    - [18, 5359.39]
  - - [3584, 4288, 1, 256]
    - [47, 13983.0]
  - - [2368, 2944, 1, 256]
    - [43, 14065.8]
  - - [3584, 128, 1, 32]
    - [61, 955.733]
  - - [3584, 128, 1, 3328]
    - [30, 8770.26]
  - - [704, 5056, 1, 256]
    - [47, 13447.6]
  - - [1856, 4288, 1, 32]
    - [65, 3281.87]
  - - [64, 256, 1, 1280]
    - [24, 700.92]
  - - [4288, 1024, 1, 1280]
    - [43, 11079.4]
  - - [1, 4288, 1, 256]
    - [86, 27.8894]
  - - [64, 2368, 1, 1]
    - [95, 9.76495]
  - - [4288, 6784, 1, 32]
    - [69, 4139.42]
  - - [704, 704, 1, 3328]
    - [42, 10062.3]
  - - [128, 2944, 1, 1]
    - [89, 26.7636]
  - - [3584, 1408, 1, 256]
    - [47, 15893.8]
  - - [704, 3584, 1, 3328]
    - [43, 13296.5]
  - - [5056, 448, 1, 1280]
    - [47, 12157.4]
  - - [1408, 2944, 1, 1280]
    - [39, 9998.84]
  - - [5888, 704, 1, 1280]
    - [47, 10814.0]
  - - [64, 64, 1, 256]
    - [1, 108.324]
  - - [704, 1408, 1, 1280]
    - [43, 9429.08]
  - - [4288, 5888, 1, 256]
    - [43, 13684.4]
  - - [6784, 64, 1, 32]
    - [59, 877.123]
  - - [3584, 3584, 1, 3328]
    - [42, 13413.2]
  - - [2944, 6784, 1, 32]
    - [65, 4288.16]
  - - [448, 64, 1, 32]
    - [66, 59.4238]
  - - [5056, 256, 1, 1]
    - [90, 80.896]
  - - [64, 6784, 1, 1280]
    - [29, 7710.12]
  - - [2944, 2368, 1, 3328]
    - [52, 15439.2]
  - - [1, 4288, 1, 1]
    - [88, 0.397037]
  - - [1408, 128, 1, 256]
    - [42, 3295.52]
  - - [1024, 1856, 1, 1280]
    - [47, 14209.7]
  - - [448, 5888, 1, 256]
    - [45, 11254.7]
  - - [1024, 5888, 1, 256]
    - [52, 12172.7]
  - - [704, 1408, 1, 256]
    - [43, 9440.3]
  - - [6784, 2944, 1, 3328]
    - [52, 15055.2]
  - - [1408, 2368, 1, 256]
    - [47, 12581.7]
  - - [64, 128, 1, 1280]
    - [24, 362.077]
  - - [1024, 8, 1, 500000]
    - [9, 383.954]
  - - [5888, 32, 1, 3328]
    - [68, 1695.09]
  - - [1408, 5056, 1, 256]
    - [47, 15116.3]
  - - [1024, 1408, 1, 32]
    - [65, 2074.52]
  - - [4288, 128, 1, 32]
    - [70, 1035.59]
  - - [6784, 704, 1, 1]
    - [83, 150.756]
  - - [448, 704, 1, 256]
    - [42, 4587.52]
  - - [704, 3584, 1, 32]
    - [66, 2455.61]
  - - [1856, 256, 1, 3328]
    - [30, 7947.59]
  - - [448, 1024, 1, 1280]
    - [42, 8822.15]
  - - [4288, 4288, 1, 1]
    - [79, 210.281]
  - - [5056, 2944, 1, 1]
    - [84, 236.719]
  - - [64, 2368, 1, 3328]
    - [26, 4783.43]
  - - [256, 704, 1, 3328]
    - [42, 5224.61]
  - - [1, 2944, 1, 1]
    - [88, 0.193684]
  - - [1024, 1024, 1, 256]
    - [45, 9956.8]
  - - [2560, 64, 1, 2560]
    - [2, 4279.9]
  - - [3584, 1, 1, 1]
    - [90, 0.341985]
  - - [256, 2944, 1, 32]
    - [70, 1428.75]
  - - [6784, 4288, 1, 3328]
    - [52, 13655.6]
  - - [5056, 2944, 1, 3328]
    - [47, 14381.5]
  - - [1760, 128, 1, 1760]
    - [26, 6512.69]
  - - [704, 1024, 1, 1280]
    - [42, 8082.93]
  - - [256, 3584, 1, 1280]
    - [45, 11197.6]
  - - [2368, 1856, 1, 3328]
    - [50, 10768.8]
  - - [1856, 4288, 1, 1280]
    - [52, 11907.3]
  - - [1, 1024, 1, 256]
    - [89, 6.30154]
  - - [3584, 448, 1, 1]
    - [79, 101.366]
  - - [2944, 1024, 1, 3328]
    - [52, 15107.8]
  - - [32, 1408, 1, 3328]
    - [68, 563.368]
  - - [128, 1, 1, 3328]
    - [86, 1.39028]
  - - [5888, 5056, 1, 32]
    - [62, 4592.32]
  - - [704, 2944, 1, 1]
    - [79, 111.669]
  - - [3584, 448, 1, 32]
    - [62, 1824.58]
  - - [3584, 448, 1, 1280]
    - [47, 11877.1]
  - - [2944, 6784, 1, 3328]
    - [47, 17789.8]
  - - [1856, 2368, 1, 1280]
    - [45, 14386.3]
  - - [6784, 1024, 1, 1280]
    - [47, 11136.0]
  - - [512, 16, 1, 500000]
    - [13, 348.645]
  - - [6784, 3584, 1, 1280]
    - [20, 14129.8]
  - - [1, 5056, 1, 3328]
    - [86, 38.9499]
  - - [128, 128, 1, 1]
    - [82, 1.41241]
  - - [128, 2368, 1, 32]
    - [61, 624.957]
  - - [128, 1408, 1, 3328]
    - [29, 5684.09]
  - - [2944, 32, 1, 3328]
    - [75, 975.13]
  - - [704, 1856, 1, 256]
    - [43, 9769.15]
  - - [1408, 1408, 1, 1]
    - [86, 98.3365]
  - - [1408, 4288, 1, 256]
    - [47, 12602.7]
  - - [6144, 24000, 1, 2048]
    - [52, 12863.7]
  - - [256, 5056, 1, 3328]
    - [39, 9526.6]
  - - [2368, 64, 1, 1280]
    - [26, 4209.78]
  - - [1856, 448, 1, 32]
    - [73, 1409.3]
  - - [1408, 448, 1, 256]
    - [43, 5817.03]
  - - [32, 128, 1, 256]
    - [68, 31.5836]
  - - [448, 1024, 1, 1]
    - [93, 34.5446]
  - - [128, 1024, 1, 1280]
    - [28, 4040.76]
  - - [448, 6784, 1, 1]
    - [79, 127.485]
  - - [704, 2944, 1, 256]
    - [47, 9653.92]
  - - [1408, 1408, 1, 256]
    - [43, 11661.6]
  - - [448, 6784, 1, 32]
    - [72, 2436.26]
  - - [7680, 12000, 1, 2560]
    - [47, 14826.5]
  - - [5124, 9124, 1, 1760]
    - [45, 12276.0]
  - - [1, 64, 1, 1280]
    - [86, 0.662354]
  - - [1408, 1856, 1, 1]
    - [86, 121.887]
  - - [4288, 448, 1, 32]
    - [64, 1921.02]
  - - [4288, 448, 1, 1280]
    - [45, 13231.3]
  - - [2944, 704, 1, 32]
    - [63, 2375.45]
  - - [1024, 704, 1, 256]
    - [42, 7900.23]
  - - [448, 4288, 1, 1]
    - [83, 98.4131]
  - - [3584, 5056, 1, 1]
    - [79, 221.416]
  - - [1408, 3584, 1, 1280]
    - [38, 9636.01]
  - - [6784, 448, 1, 1280]
    - [43, 9829.71]
  - - [3584, 5056, 1, 3328]
    - [52, 15970.1]
  - - [2368, 2368, 1, 32]
    - [68, 2728.67]
  - - [64, 5888, 1, 32]
    - [66, 866.28]
  - - [1856, 448, 1, 256]
    - [43, 7895.43]
  - - [128, 1024, 1, 256]
    - [0, 2974.68]
  - - [3584, 64, 1, 3328]
    - [26, 6733.97]
  - - [5888, 2944, 1, 32]
    - [69, 3766.27]
  - - [2944, 1, 1, 1280]
    - [86, 29.8883]
  - - [1856, 2944, 1, 32]
    - [53, 2957.54]
  - - [5056, 1408, 1, 1]
    - [85, 161.206]
  - - [5888, 1408, 1, 3328]
    - [42, 13199.5]
  - - [448, 4288, 1, 256]
    - [42, 9726.7]
  - - [6784, 1024, 1, 1]
    - [83, 189.183]
  - - [256, 448, 1, 1]
    - [90, 9.68649]
  - - [128, 5888, 1, 3328]
    - [3, 10172.8]
  - - [6784, 1024, 1, 32]
    - [65, 3460.43]
  - - [256, 448, 1, 32]
    - [70, 223.781]
  - - [6784, 3584, 1, 1]
    - [85, 240.066]
  - - [2944, 2368, 1, 32]
    - [62, 3455.46]
  - - [3584, 6784, 1, 3328]
    - [52, 16432.0]
  - - [16384, 800, 1, 4096]
    - [52, 11605.9]
  - - [448, 128, 1, 1280]
    - [27, 2316.93]
  - - [64, 3584, 1, 32]
    - [70, 447.563]
  - - [64, 3584, 1, 1280]
    - [29, 5977.22]
  - - [6784, 1408, 1, 256]
    - [47, 16003.1]
  - - [5056, 1024, 1, 32]
    - [62, 3351.03]
  - - [1024, 5056, 1, 1280]
    - [43, 15191.2]
  - - [4288, 3584, 1, 256]
    - [47, 17974.5]
  - - [4608, 48000, 1, 1536]
    - [47, 19223.7]
  - - [2368, 256, 1, 3328]
    - [48, 8074.99]
  - - [448, 6784, 1, 1280]
    - [43, 9084.19]
  - - [1856, 5888, 1, 1]
    - [84, 226.913]
  - - [256, 5888, 1, 32]
    - [60, 1926.3]
  - - [3584, 1, 1, 3328]
    - [92, 41.209]
  - - [4288, 32, 1, 256]
    - [68, 912.872]
  - - [256, 64, 1, 1]
    - [80, 1.17701]
  - - [4288, 5056, 1, 32]
    - [62, 4426.76]
  - - [4288, 5056, 1, 3328]
    - [44, 12898.0]
  - - [1856, 5888, 1, 32]
    - [65, 3885.56]
  - - [1856, 5888, 1, 1280]
    - [52, 15560.2]
  - - [256, 256, 1, 1280]
    - [1, 2438.55]
  - - [704, 2368, 1, 1280]
    - [47, 12499.1]
  - - [4288, 2368, 1, 1280]
    - [42, 12667.7]
  - - [2944, 5056, 1, 256]
    - [43, 15082.8]
  - - [512, 8, 1, 500000]
    - [13, 177.833]
  - - [32, 1856, 1, 256]
    - [74, 392.674]
  - - [64, 5888, 1, 1280]
    - [29, 7220.73]
  - - [1, 1856, 1, 1280]
    - [92, 20.3119]
  - - [2944, 4288, 1, 1]
    - [79, 222.251]
  - - [5056, 5888, 1, 32]
    - [65, 4619.04]
  - - [704, 1, 1, 3328]
    - [94, 7.2205]
  - - [448, 256, 1, 1280]
    - [28, 3501.92]
  - - [1408, 256, 1, 1]
    - [84, 25.4554]
  - - [2368, 5056, 1, 3328]
    - [43, 14322.8]
  - - [1024, 5056, 1, 3328]
    - [47, 14204.1]
  - - [704, 704, 1, 1280]
    - [49, 7495.14]
  - - [128, 32, 1, 3328]
    - [68, 51.2924]
  - - [1024, 6784, 1, 32]
    - [53, 3033.54]
  - - [3072, 64, 1, 1024]
    - [36, 3554.49]
  - - [3584, 2944, 1, 3328]
    - [42, 12410.1]
  - - [128, 1856, 1, 256]
    - [42, 4177.02]
  - - [32, 32, 1, 1280]
    - [68, 11.933]
  - - [1408, 5888, 1, 1]
    - [81, 180.538]
  - - [1, 3584, 1, 256]
    - [93, 21.7212]
  - - [704, 4288, 1, 32]
    - [66, 2625.0]
  - - [1408, 5888, 1, 32]
    - [62, 3883.05]
  - - [6784, 1024, 1, 3328]
    - [31, 11162.1]
  - - [7680, 24000, 1, 2560]
    - [52, 12145.3]
  - - [1856, 1, 1, 3328]
    - [86, 20.1486]
  - - [5056, 1408, 1, 256]
    - [52, 13408.1]
  - - [1, 1, 1, 256]
    - [86, 0.00727273]
  - - [2944, 1408, 1, 256]
    - [47, 15772.3]
  - - [4288, 1, 1, 1]
    - [84, 0.388406]
  - - [2368, 2368, 1, 256]
    - [47, 13604.1]
  - - [1, 448, 1, 256]
    - [86, 3.18578]
  - - [1408, 6784, 1, 1]
    - [87, 188.029]
  - - [3584, 32, 1, 3328]
    - [68, 1434.03]
  - - [128, 3584, 1, 1]
    - [86, 37.7263]
  - - [1856, 1, 1, 256]
    - [86, 13.4676]
  - - [6784, 6784, 1, 1280]
    - [47, 18444.5]
  - - [1024, 5888, 1, 1]
    - [80, 155.716]
  - - [6784, 32, 1, 3328]
    - [78, 1553.83]
  - - [1408, 32, 1, 256]
    - [73, 311.402]
  - - [128, 3584, 1, 32]
    - [68, 882.215]
  - - [1856, 3584, 1, 256]
    - [45, 12397.3]
  - - [2944, 64, 1, 256]
    - [2, 3445.32]
  - - [2368, 704, 1, 32]
    - [62, 2064.49]
  - - [256, 5888, 1, 1280]
    - [45, 13178.8]
  - - [448, 2368, 1, 32]
    - [59, 1554.38]
  - - [448, 2368, 1, 3328]
    - [45, 7371.29]
  - - [64, 1408, 1, 256]
    - [1, 2218.14]
  - - [5056, 32, 1, 32]
    - [54, 355.587]
  - - [1024, 704, 1, 3328]
    - [42, 8379.22]
  - - [32, 5888, 1, 3328]
    - [77, 1479.17]
  - - [256, 64, 1, 3328]
    - [24, 779.833]
  - - [32, 1408, 1, 1280]
    - [74, 494.442]
  - - [64, 32, 1, 256]
    - [73, 12.775]
  - - [1856, 1024, 1, 3328]
    - [47, 13688.1]
  - - [2368, 1, 1, 1]
    - [80, 0.219259]
  - - [5056, 2368, 1, 3328]
    - [47, 16028.2]
  - - [128, 1, 1, 1280]
    - [92, 1.39415]
  - - [704, 4288, 1, 1280]
    - [43, 14285.7]
  - - [704, 256, 1, 256]
    - [18, 3203.98]
  - - [1024, 48000, 1, 2048]
    - [45, 12207.0]
- null
