library/src/blas3/Tensile/Logic/asm_full/vega10_Cijk_Alik_Bljk_HBH.yaml
- {MinimumRequiredVersion: 4.6.0}
- vega10
- gfx900
- [Device 6863, Device 6862, Device 687f, Device 6860, Device 6861, 'Vega 10 XTX [Radeon
    SolutionIndex: 0
    SolutionNameMin: Cijk_Alik_Bljk_HBH_MT032x016x08_PGR1_PLR1_TT04_02
    SolutionIndex: 1
    SolutionNameMin: Cijk_Alik_Bljk_HBH_MT032x016x08_PGR1_PLR1_TT02_02
    SolutionIndex: 2
    SolutionNameMin: Cijk_Alik_Bljk_HBH_MT032x032x08_PGR1_PLR1_TT02_02
    SolutionIndex: 3
    SolutionNameMin: Cijk_Alik_Bljk_HBH_MT016x016x16_PGR1_PLR1_TT02_02
    SolutionIndex: 4
    SolutionNameMin: Cijk_Alik_Bljk_HBH_MT032x032x16_PGR1_PLR1_TT04_04
    SolutionIndex: 5
    SolutionNameMin: Cijk_Alik_Bljk_HBH_MT064x064x16_PGR1_PLR1_TT08_08
    SolutionIndex: 6
    SolutionNameMin: Cijk_Alik_Bljk_HBH_MT032x016x16_PGR1_PLR1_TT02_02
    SolutionIndex: 7
    SolutionNameMin: Cijk_Alik_Bljk_HBH_MT064x032x16_PGR1_PLR1_TT04_04
    SolutionIndex: 8
    SolutionNameMin: Cijk_Alik_Bljk_HBH_MT032x032x16_PGR1_PLR1_TT02_02
    SolutionIndex: 9
    SolutionNameMin: Cijk_Alik_Bljk_HBH_MT064x064x16_PGR1_PLR1_TT04_04
    SolutionIndex: 10
    SolutionNameMin: Cijk_Alik_Bljk_HBH_MT016x016x32_PGR1_PLR1_TT02_02
    SolutionIndex: 11
    SolutionNameMin: Cijk_Alik_Bljk_HBH_MT032x032x32_PGR1_PLR1_TT04_04
    SolutionIndex: 12
    SolutionNameMin: Cijk_Alik_Bljk_HBH_MT032x016x32_PGR1_PLR1_TT02_02
    SolutionIndex: 13
    SolutionNameMin: Cijk_Alik_Bljk_HBH_MT016x016x64_PGR1_PLR1_TT02_02
    SolutionIndex: 14
    SolutionNameMin: Cijk_Alik_Bljk_HBH_MT032x016x08_PGR1_PLR1_TT04_02
    SolutionIndex: 15
    SolutionNameMin: Cijk_Alik_Bljk_HBH_MT016x016x16_PGR1_PLR1_TT02_02
    SolutionIndex: 16
    SolutionNameMin: Cijk_Alik_Bljk_HBH_MT032x016x16_PGR1_PLR1_TT04_02
    SolutionIndex: 17
    SolutionNameMin: Cijk_Alik_Bljk_HBH_MT032x032x16_PGR1_PLR1_TT04_04
    SolutionIndex: 18
    SolutionNameMin: Cijk_Alik_Bljk_HBH_MT064x064x16_PGR1_PLR1_TT08_08
    SolutionIndex: 19
    SolutionNameMin: Cijk_Alik_Bljk_HBH_MT032x016x16_PGR1_PLR1_TT02_02
    SolutionIndex: 20
    SolutionNameMin: Cijk_Alik_Bljk_HBH_MT064x032x16_PGR1_PLR1_TT04_04
    SolutionIndex: 21
    SolutionNameMin: Cijk_Alik_Bljk_HBH_MT016x016x24_PGR1_PLR1_TT02_02
    SolutionIndex: 22
    SolutionNameMin: Cijk_Alik_Bljk_HBH_MT032x016x24_PGR1_PLR1_TT04_02
    SolutionIndex: 23
    SolutionNameMin: Cijk_Alik_Bljk_HBH_MT032x032x24_PGR1_PLR1_TT04_04
    SolutionIndex: 24
    SolutionNameMin: Cijk_Alik_Bljk_HBH_MT016x016x24_PGR1_PLR1_TT02_02
    SolutionIndex: 25
    SolutionNameMin: Cijk_Alik_Bljk_HBH_MT032x016x24_PGR1_PLR1_TT04_02
    SolutionIndex: 26
    SolutionNameMin: Cijk_Alik_Bljk_HBH_MT032x032x24_PGR1_PLR1_TT04_04
    SolutionIndex: 27
    SolutionNameMin: Cijk_Alik_Bljk_HBH_MT064x064x24_PGR1_PLR1_TT08_08
    SolutionIndex: 28
    SolutionNameMin: Cijk_Alik_Bljk_HBH_MT032x032x32_PGR1_PLR1_TT04_04
    SolutionIndex: 29
    SolutionNameMin: Cijk_Alik_Bljk_HBH_MT064x032x32_PGR1_PLR1_TT04_04
    SolutionIndex: 30
    SolutionNameMin: Cijk_Alik_Bljk_HBH_MT064x064x08_PGR1_PLR1_TT04_04
    SolutionIndex: 31
    SolutionNameMin: Cijk_Alik_Bljk_HBH_MT064x128x08_PGR1_PLR1_TT04_08
    SolutionIndex: 32
    SolutionNameMin: Cijk_Alik_Bljk_HBH_MT128x064x08_PGR1_PLR1_TT08_04
    SolutionIndex: 33
    SolutionNameMin: Cijk_Alik_Bljk_HBH_MT064x064x16_PGR1_PLR1_TT04_04
    SolutionIndex: 34
    SolutionNameMin: Cijk_Alik_Bljk_HBH_MT064x128x16_PGR1_PLR1_TT04_08
    SolutionIndex: 35
    SolutionNameMin: Cijk_Alik_Bljk_HBH_MT128x064x16_PGR1_PLR1_TT08_04
    SolutionIndex: 36
    SolutionNameMin: Cijk_Alik_Bljk_HBH_MT128x128x16_PGR1_PLR1_TT08_08
    SolutionIndex: 37
    SolutionNameMin: Cijk_Alik_Bljk_HBH_MT064x064x32_PGR1_PLR1_TT04_04
    SolutionIndex: 38
    SolutionNameMin: Cijk_Alik_Bljk_HBH_MT128x064x32_PGR1_PLR1_TT08_04
    SolutionIndex: 39
    SolutionNameMin: Cijk_Alik_Bljk_HBH_MT128x128x32_PGR1_PLR1_TT08_08
    SolutionIndex: 40
    SolutionNameMin: Cijk_Alik_Bljk_HBH_MT064x128x04_PGR0_PLR0_TT04_08
    SolutionIndex: 41
    SolutionNameMin: Cijk_Alik_Bljk_HBH_MT064x128x04_PGR1_PLR0_TT04_08
    SolutionIndex: 42
    SolutionNameMin: Cijk_Alik_Bljk_HBH_MT064x064x04_PGR1_PLR0_TT04_04
    SolutionIndex: 43
    SolutionNameMin: Cijk_Alik_Bljk_HBH_MT064x128x04_PGR0_PLR1_TT04_08
    SolutionIndex: 44
    SolutionNameMin: Cijk_Alik_Bljk_HBH_MT064x064x04_PGR1_PLR1_TT04_04
    SolutionIndex: 45
    SolutionNameMin: Cijk_Alik_Bljk_HBH_MT064x128x08_PGR0_PLR0_TT04_08
    SolutionIndex: 46
    SolutionNameMin: Cijk_Alik_Bljk_HBH_MT064x064x08_PGR0_PLR0_TT04_04
    SolutionIndex: 47
    SolutionNameMin: Cijk_Alik_Bljk_HBH_MT064x128x08_PGR1_PLR0_TT04_08
    SolutionIndex: 48
    SolutionNameMin: Cijk_Alik_Bljk_HBH_MT064x064x08_PGR1_PLR0_TT04_04
    SolutionIndex: 49
    SolutionNameMin: Cijk_Alik_Bljk_HBH_MT064x064x08_PGR0_PLR1_TT04_04
    SolutionIndex: 50
    SolutionNameMin: Cijk_Alik_Bljk_HBH_MT064x128x08_PGR1_PLR1_TT04_08
    SolutionIndex: 51
    SolutionNameMin: Cijk_Alik_Bljk_HBH_MT064x064x08_PGR1_PLR1_TT04_04
    SolutionIndex: 52
    SolutionNameMin: Cijk_Alik_Bljk_HBH_MT064x064x16_PGR0_PLR0_TT04_04
    SolutionIndex: 53
    SolutionNameMin: Cijk_Alik_Bljk_HBH_MT064x064x16_PGR1_PLR0_TT04_04
    SolutionIndex: 54
    SolutionNameMin: Cijk_Alik_Bljk_HBH_MT064x064x16_PGR1_PLR1_TT04_04
    SolutionIndex: 55
    SolutionNameMin: Cijk_Alik_Bljk_HBH_MT128x128x04_PGR0_PLR0_TT08_08
    SolutionIndex: 56
    SolutionNameMin: Cijk_Alik_Bljk_HBH_MT064x128x04_PGR0_PLR0_TT04_08
    SolutionIndex: 57
    SolutionNameMin: Cijk_Alik_Bljk_HBH_MT064x064x04_PGR0_PLR0_TT04_04
    SolutionIndex: 58
    SolutionNameMin: Cijk_Alik_Bljk_HBH_MT064x128x04_PGR1_PLR0_TT04_08
    SolutionIndex: 59
    SolutionNameMin: Cijk_Alik_Bljk_HBH_MT064x064x04_PGR1_PLR0_TT04_04
    SolutionIndex: 60
    SolutionNameMin: Cijk_Alik_Bljk_HBH_MT128x128x04_PGR0_PLR1_TT08_08
    SolutionIndex: 61
    SolutionNameMin: Cijk_Alik_Bljk_HBH_MT064x128x04_PGR0_PLR1_TT04_08
    SolutionIndex: 62
    SolutionNameMin: Cijk_Alik_Bljk_HBH_MT064x064x04_PGR0_PLR1_TT04_04
    SolutionIndex: 63
    SolutionNameMin: Cijk_Alik_Bljk_HBH_MT064x128x04_PGR1_PLR1_TT04_08
    SolutionIndex: 64
    SolutionNameMin: Cijk_Alik_Bljk_HBH_MT064x064x04_PGR1_PLR1_TT04_04
    SolutionIndex: 65
    SolutionNameMin: Cijk_Alik_Bljk_HBH_MT064x128x08_PGR0_PLR0_TT04_08
    SolutionIndex: 66
    SolutionNameMin: Cijk_Alik_Bljk_HBH_MT064x064x08_PGR1_PLR0_TT04_04
    SolutionIndex: 67
    SolutionNameMin: Cijk_Alik_Bljk_HBH_MT064x064x08_PGR0_PLR1_TT04_04
    SolutionIndex: 68
    SolutionNameMin: Cijk_Alik_Bljk_HBH_MT064x128x08_PGR1_PLR1_TT04_08
    SolutionIndex: 69
    SolutionNameMin: Cijk_Alik_Bljk_HBH_MT064x064x08_PGR1_PLR1_TT04_04
- - - [2368, 1024, 1, 1]
    - [56, 146.79]
  - - [1760, 32, 1, 1760]
    - [24, 2703.26]
  - - [448, 1, 1, 256]
    - [64, 3.89982]
  - - [5056, 1408, 1, 3328]
    - [36, 9982.05]
  - - [3072, 24000, 1, 1024]
    - [36, 9554.8]
  - - [5056, 1856, 1, 3328]
    - [33, 9673.43]
  - - [5888, 128, 1, 1]
    - [59, 82.7202]
  - - [448, 3584, 1, 3328]
    - [33, 8882.59]
  - - [704, 64, 1, 3328]
    - [21, 2271.83]
  - - [2560, 32, 1, 2560]
    - [24, 3261.59]
  - - [4096, 3200, 1, 1024]
    - [35, 9678.33]
  - - [5056, 4288, 1, 32]
    - [43, 3948.37]
  - - [3584, 1024, 1, 256]
    - [33, 10294.7]
  - - [32, 5056, 1, 1280]
    - [51, 1648.4]
  - - [1856, 256, 1, 1]
    - [59, 60.5115]
  - - [256, 1856, 1, 32]
    - [44, 1377.52]
  - - [1408, 3584, 1, 3328]
    - [33, 9982.89]
  - - [128, 3584, 1, 1280]
    - [17, 7312.7]
  - - [1024, 2368, 1, 3328]
    - [33, 9598.17]
  - - [4288, 64, 1, 3328]
    - [25, 4963.48]
  - - [1, 4288, 1, 1280]
    - [64, 40.7559]
  - - [2368, 64, 1, 1]
    - [57, 14.8253]
  - - [6144, 32, 1, 2560]
    - [23, 4145.54]
  - - [256, 128, 1, 256]
    - [6, 1155.54]
  - - [448, 64, 1, 1]
    - [60, 3.33686]
  - - [32, 1408, 1, 32]
    - [44, 108.133]
  - - [448, 3584, 1, 32]
    - [46, 2433.76]
  - - [64, 1024, 1, 1280]
    - [21, 3052.35]
  - - [1, 1408, 1, 3328]
    - [69, 17.7787]
  - - [1408, 128, 1, 32]
    - [42, 411.926]
  - - [4288, 6784, 1, 3328]
    - [18, 9495.56]
  - - [1024, 1, 1, 3328]
    - [69, 13.0436]
  - - [2944, 128, 1, 32]
    - [46, 1130.46]
  - - [64, 6784, 1, 1]
    - [64, 55.821]
  - - [1024, 64, 1, 1280]
    - [21, 3027.89]
  - - [448, 128, 1, 256]
    - [15, 1852.02]
  - - [64, 5056, 1, 3328]
    - [2, 5514.99]
  - - [5888, 4288, 1, 3328]
    - [36, 9420.96]
  - - [1, 2368, 1, 1280]
    - [64, 28.4546]
  - - [704, 1024, 1, 1]
    - [64, 79.1237]
  - - [2368, 1408, 1, 32]
    - [49, 3013.19]
  - - [256, 1856, 1, 1280]
    - [33, 7573.87]
  - - [1024, 2944, 1, 1]
    - [56, 158.971]
  - - [2944, 3584, 1, 3328]
    - [33, 9583.39]
  - - [2368, 2944, 1, 1280]
    - [33, 10776.7]
  - - [256, 1408, 1, 1]
    - [57, 48.1786]
  - - [1, 1024, 1, 3328]
    - [69, 12.9957]
  - - [6784, 5888, 1, 3328]
    - [36, 9500.33]
  - - [3584, 1408, 1, 32]
    - [46, 3234.3]
  - - [8192, 800, 1, 2048]
    - [37, 7585.86]
  - - [5056, 256, 1, 256]
    - [33, 8652.0]
  - - [1856, 2368, 1, 256]
    - [33, 10446.1]
  - - [2368, 1024, 1, 3328]
    - [34, 9184.66]
  - - [3584, 4288, 1, 32]
    - [43, 3868.8]
  - - [1024, 1024, 1, 1280]
    - [36, 9767.54]
  - - [3584, 3584, 1, 1]
    - [61, 210.696]
  - - [512, 48000, 1, 2560]
    - [36, 9736.77]
  - - [32, 2944, 1, 3328]
    - [51, 1323.05]
  - - [704, 1408, 1, 3328]
    - [27, 9391.11]
  - - [1408, 704, 1, 256]
    - [33, 8060.2]
  - - [704, 64, 1, 32]
    - [42, 105.781]
  - - [5888, 1, 1, 3328]
    - [64, 58.0487]
  - - [2368, 32, 1, 256]
    - [51, 646.6]
  - - [6784, 128, 1, 3328]
    - [27, 8230.38]
  - - [2944, 256, 1, 1]
    - [59, 82.0493]
  - - [1408, 2368, 1, 1]
    - [58, 150.031]
  - - [32, 448, 1, 3328]
    - [51, 198.664]
  - - [5056, 1, 1, 3328]
    - [64, 50.2764]
  - - [2944, 256, 1, 32]
    - [46, 1849.84]
  - - [5056, 6784, 1, 1280]
    - [18, 9838.85]
  - - [4288, 5056, 1, 1]
    - [58, 221.386]
  - - [5056, 4288, 1, 1]
    - [58, 221.722]
  - - [128, 4288, 1, 3328]
    - [23, 6630.43]
  - - [5056, 128, 1, 256]
    - [33, 6578.06]
  - - [1408, 4288, 1, 1280]
    - [33, 10461.8]
  - - [1856, 704, 1, 1280]
    - [33, 9177.95]
  - - [4288, 1024, 1, 3328]
    - [33, 10264.8]
  - - [1, 5888, 1, 3328]
    - [64, 54.4296]
  - - [1024, 128, 1, 32]
    - [42, 304.409]
  - - [32, 4288, 1, 1280]
    - [51, 1402.14]
  - - [1024, 5056, 1, 1]
    - [58, 176.943]
  - - [704, 3584, 1, 1280]
    - [33, 10525.9]
  - - [1856, 5056, 1, 256]
    - [33, 10993.2]
  - - [1408, 1024, 1, 1280]
    - [33, 9494.4]
  - - [5056, 5888, 1, 3328]
    - [36, 9564.69]
  - - [448, 1, 1, 1]
    - [55, 0.066459]
  - - [3584, 3584, 1, 1280]
    - [33, 10900.5]
  - - [2368, 3584, 1, 32]
    - [49, 3583.81]
  - - [2944, 2368, 1, 1]
    - [61, 185.991]
  - - [704, 4288, 1, 1]
    - [56, 149.273]
  - - [2368, 256, 1, 32]
    - [49, 1540.43]
  - - [1024, 6784, 1, 1280]
    - [33, 10885.7]
  - - [1024, 3584, 1, 1]
    - [61, 161.38]
  - - [32, 5056, 1, 32]
    - [49, 533.527]
  - - [5888, 32, 1, 32]
    - [46, 621.322]
  - - [64, 128, 1, 3328]
    - [21, 412.6]
  - - [256, 5056, 1, 32]
    - [51, 2329.78]
  - - [5056, 64, 1, 32]
    - [44, 970.722]
  - - [2368, 5056, 1, 32]
    - [49, 3742.41]
  - - [6784, 1856, 1, 32]
    - [46, 3745.99]
  - - [64, 128, 1, 1]
    - [62, 0.773341]
  - - [64, 2368, 1, 1280]
    - [21, 4515.04]
  - - [128, 704, 1, 32]
    - [42, 212.716]
  - - [64, 6784, 1, 3328]
    - [23, 7254.03]
  - - [2944, 256, 1, 1280]
    - [33, 8799.27]
  - - [5124, 9124, 1, 4096]
    - [36, 8799.97]
  - - [5056, 704, 1, 1]
    - [59, 149.691]
  - - [2944, 4288, 1, 256]
    - [33, 11014.0]
  - - [1024, 1024, 1, 3328]
    - [36, 9993.39]
  - - [5056, 704, 1, 32]
    - [46, 3026.8]
  - - [1856, 4288, 1, 3328]
    - [33, 10114.5]
  - - [1, 1856, 1, 256]
    - [64, 15.6061]
  - - [6784, 4288, 1, 32]
    - [40, 4022.54]
  - - [5888, 64, 1, 256]
    - [20, 5230.09]
  - - [256, 128, 1, 1]
    - [68, 3.65592]
  - - [5888, 5056, 1, 256]
    - [35, 10854.7]
  - - [2944, 448, 1, 256]
    - [33, 7778.23]
  - - [3584, 2368, 1, 3328]
    - [33, 9993.12]
  - - [4288, 1856, 1, 1]
    - [58, 189.819]
  - - [1856, 2944, 1, 1]
    - [58, 175.626]
  - - [32, 4288, 1, 3328]
    - [51, 1459.78]
  - - [1, 3584, 1, 3328]
    - [64, 45.601]
  - - [256, 32, 1, 3328]
    - [51, 114.582]
  - - [1856, 2368, 1, 32]
    - [51, 3228.92]
  - - [4288, 1856, 1, 32]
    - [51, 3540.66]
  - - [5056, 64, 1, 3328]
    - [20, 5559.28]
  - - [6784, 1, 1, 1280]
    - [64, 64.2676]
  - - [1024, 448, 1, 32]
    - [49, 1330.08]
  - - [1408, 64, 1, 1]
    - [62, 8.38954]
  - - [1, 1, 1, 3328]
    - [64, 0.0135771]
  - - [5056, 2368, 1, 256]
    - [33, 11083.8]
  - - [1408, 5888, 1, 256]
    - [33, 10885.4]
  - - [5056, 6784, 1, 1]
    - [61, 229.68]
  - - [32, 448, 1, 1280]
    - [51, 182.414]
  - - [32, 448, 1, 32]
    - [50, 43.9207]
  - - [1856, 64, 1, 256]
    - [8, 3063.54]
  - - [1024, 1408, 1, 3328]
    - [33, 9695.35]
  - - [7680, 128, 1, 2560]
    - [27, 7984.2]
  - - [256, 5056, 1, 1280]
    - [33, 9918.14]
  - - [704, 2368, 1, 1]
    - [59, 120.344]
  - - [2048, 800, 1, 512]
    - [36, 7941.28]
  - - [64, 1024, 1, 32]
    - [42, 153.863]
  - - [1024, 256, 1, 256]
    - [33, 5089.6]
  - - [128, 1, 1, 1]
    - [62, 0.0145207]
  - - [3584, 4288, 1, 1280]
    - [36, 10340.9]
  - - [1856, 128, 1, 32]
    - [51, 821.014]
  - - [1856, 128, 1, 1280]
    - [26, 5975.32]
  - - [128, 2944, 1, 3328]
    - [23, 6300.6]
  - - [1, 6784, 1, 3328]
    - [64, 67.0292]
  - - [3584, 2368, 1, 1]
    - [56, 193.205]
  - - [4288, 448, 1, 3328]
    - [18, 9918.97]
  - - [4288, 32, 1, 3328]
    - [51, 1439.67]
  - - [4608, 12000, 1, 1536]
    - [36, 9790.12]
  - - [256, 1856, 1, 1]
    - [64, 60.5115]
  - - [704, 6784, 1, 1280]
    - [33, 10418.6]
  - - [2368, 4288, 1, 32]
    - [40, 3704.71]
  - - [704, 5056, 1, 1280]
    - [33, 10899.3]
  - - [256, 3584, 1, 3328]
    - [18, 8446.78]
  - - [1024, 32, 1, 3328]
    - [51, 445.702]
  - - [3584, 6784, 1, 32]
    - [43, 4015.0]
  - - [3584, 6784, 1, 1280]
    - [33, 10030.5]
  - - [4288, 4288, 1, 3328]
    - [33, 9471.12]
  - - [3584, 64, 1, 1280]
    - [26, 5744.16]
  - - [64, 1856, 1, 256]
    - [3, 3109.91]
  - - [3584, 64, 1, 32]
    - [42, 780.232]
  - - [448, 1, 1, 1280]
    - [69, 5.29857]
  - - [256, 4288, 1, 1280]
    - [33, 7773.83]
  - - [1408, 3584, 1, 1]
    - [56, 171.162]
  - - [4288, 1856, 1, 3328]
    - [33, 10023.0]
  - - [1856, 2944, 1, 1280]
    - [33, 10663.6]
  - - [4288, 256, 1, 256]
    - [33, 7482.45]
  - - [128, 5888, 1, 32]
    - [46, 1849.84]
  - - [128, 5888, 1, 1280]
    - [4, 8528.44]
  - - [1408, 128, 1, 3328]
    - [24, 5247.47]
  - - [3584, 256, 1, 256]
    - [33, 7443.19]
  - - [32, 6784, 1, 3328]
    - [51, 2297.53]
  - - [64, 64, 1, 1280]
    - [3, 184.316]
  - - [32, 3584, 1, 256]
    - [54, 1183.14]
  - - [704, 256, 1, 32]
    - [42, 409.76]
  - - [448, 128, 1, 3328]
    - [24, 2852.99]
  - - [64, 2944, 1, 3328]
    - [21, 5572.67]
  - - [64, 4288, 1, 3328]
    - [2, 5098.97]
  - - [5056, 1024, 1, 3328]
    - [33, 10143.0]
  - - [128, 256, 1, 1280]
    - [21, 1613.13]
  - - [1856, 256, 1, 256]
    - [33, 6414.15]
  - - [3584, 704, 1, 1]
    - [57, 143.719]
  - - [256, 704, 1, 256]
    - [17, 3663.73]
  - - [448, 5056, 1, 1]
    - [62, 137.12]
  - - [5888, 5888, 1, 256]
    - [32, 10580.2]
  - - [3584, 704, 1, 32]
    - [49, 2922.15]
  - - [448, 6784, 1, 3328]
    - [33, 9958.58]
  - - [6784, 4288, 1, 1]
    - [58, 225.301]
  - - [3584, 6784, 1, 1]
    - [61, 225.586]
  - - [1408, 2368, 1, 32]
    - [46, 2988.17]
  - - [448, 5056, 1, 32]
    - [51, 2787.75]
  - - [4288, 4288, 1, 1280]
    - [33, 10415.5]
  - - [6784, 1408, 1, 1]
    - [56, 198.991]
  - - [1856, 5888, 1, 3328]
    - [33, 9665.0]
  - - [1024, 704, 1, 1]
    - [57, 79.7672]
  - - [3584, 1856, 1, 3328]
    - [33, 9985.53]
  - - [5056, 5888, 1, 1]
    - [56, 227.822]
  - - [2944, 1024, 1, 256]
    - [36, 9847.17]
  - - [448, 1408, 1, 3328]
    - [33, 7569.16]
  - - [5056, 32, 1, 3328]
    - [51, 1713.93]
  - - [2368, 4288, 1, 3328]
    - [33, 9587.71]
  - - [1024, 704, 1, 32]
    - [46, 1789.73]
  - - [448, 2944, 1, 256]
    - [33, 7660.53]
  - - [2944, 6784, 1, 256]
    - [33, 11217.5]
  - - [2368, 2368, 1, 1280]
    - [33, 11195.0]
  - - [5888, 128, 1, 3328]
    - [33, 9031.6]
  - - [256, 256, 1, 32]
    - [42, 152.205]
  - - [1024, 1, 1, 256]
    - [64, 9.05068]
  - - [3584, 3584, 1, 32]
    - [43, 3787.64]
  - - [2944, 448, 1, 1]
    - [56, 106.618]
  - - [4608, 32, 1, 1536]
    - [25, 3683.79]
  - - [512, 48000, 1, 2816]
    - [36, 9607.38]
  - - [128, 32, 1, 32]
    - [42, 10.4698]
  - - [5056, 64, 1, 1280]
    - [20, 5360.82]
  - - [2944, 2944, 1, 1280]
    - [34, 10383.6]
  - - [1, 2368, 1, 256]
    - [64, 20.5101]
  - - [1408, 5056, 1, 1]
    - [56, 189.178]
  - - [2944, 32, 1, 1280]
    - [51, 1209.41]
  - - [64, 1408, 1, 3328]
    - [21, 3980.76]
  - - [256, 448, 1, 1280]
    - [21, 4298.83]
  - - [4096, 64, 1, 4096]
    - [11, 3993.12]
  - - [2368, 6784, 1, 1]
    - [56, 217.081]
  - - [6784, 4288, 1, 1280]
    - [32, 9852.71]
  - - [2944, 704, 1, 256]
    - [33, 9436.89]
  - - [2368, 6784, 1, 1280]
    - [33, 10537.4]
  - - [704, 2944, 1, 3328]
    - [33, 10047.9]
  - - [5888, 256, 1, 1]
    - [56, 120.403]
  - - [704, 704, 1, 32]
    - [44, 1427.32]
  - - [256, 4288, 1, 256]
    - [33, 7512.05]
  - - [5056, 6784, 1, 32]
    - [40, 4105.59]
  - - [5056, 128, 1, 1]
    - [59, 73.4167]
  - - [448, 5056, 1, 1280]
    - [33, 10174.0]
  - - [448, 448, 1, 256]
    - [17, 4104.18]
  - - [256, 5888, 1, 3328]
    - [33, 9780.33]
  - - [704, 448, 1, 1280]
    - [17, 5195.21]
  - - [448, 64, 1, 256]
    - [3, 1021.51]
  - - [1024, 704, 1, 1280]
    - [33, 8456.68]
  - - [5888, 1024, 1, 1]
    - [61, 182.088]
  - - [5888, 448, 1, 32]
    - [51, 2713.11]
  - - [6784, 2944, 1, 256]
    - [36, 10769.4]
  - - [1024, 256, 1, 1]
    - [64, 38.888]
  - - [2368, 448, 1, 256]
    - [33, 7288.72]
  - - [4288, 256, 1, 3328]
    - [33, 8374.45]
  - - [4288, 2944, 1, 256]
    - [33, 11014.1]
  - - [4096, 16, 1, 4096]
    - [12, 1439.14]
  - - [448, 5888, 1, 3328]
    - [33, 9473.08]
  - - [128, 256, 1, 3328]
    - [24, 1715.8]
  - - [128, 6784, 1, 32]
    - [49, 1904.15]
  - - [1856, 64, 1, 32]
    - [42, 277.371]
  - - [1408, 4288, 1, 1]
    - [56, 182.744]
  - - [1408, 1856, 1, 3328]
    - [33, 10443.3]
  - - [4288, 64, 1, 256]
    - [7, 3902.82]
  - - [3584, 1024, 1, 3328]
    - [33, 10374.4]
  - - [2944, 5888, 1, 3328]
    - [18, 9487.22]
  - - [128, 6784, 1, 3328]
    - [7, 8337.7]
  - - [448, 4288, 1, 3328]
    - [33, 9998.25]
  - - [704, 2368, 1, 256]
    - [33, 8650.46]
  - - [1, 64, 1, 3328]
    - [69, 0.823161]
  - - [4288, 128, 1, 1]
    - [62, 63.8771]
  - - [256, 2368, 1, 32]
    - [49, 1540.43]
  - - [4288, 3584, 1, 3328]
    - [36, 9616.41]
  - - [1408, 64, 1, 256]
    - [15, 2552.69]
  - - [1024, 24000, 1, 2560]
    - [36, 9692.98]
  - - [1408, 1024, 1, 1]
    - [61, 116.551]
  - - [64, 1024, 1, 1]
    - [62, 6.23055]
  - - [1408, 1024, 1, 256]
    - [33, 8388.32]
  - - [8192, 400, 1, 2048]
    - [37, 6759.24]
  - - [5056, 3584, 1, 1]
    - [56, 219.196]
  - - [448, 1024, 1, 256]
    - [33, 6241.69]
  - - [6784, 6784, 1, 3328]
    - [36, 9598.49]
  - - [6784, 32, 1, 32]
    - [46, 694.647]
  - - [64, 1024, 1, 3328]
    - [21, 3256.98]
  - - [2368, 2944, 1, 3328]
    - [33, 9962.79]
  - - [448, 448, 1, 1280]
    - [17, 5115.11]
  - - [5056, 3584, 1, 32]
    - [40, 3937.58]
  - - [5056, 3584, 1, 1280]
    - [33, 10110.9]
  - - [7680, 48000, 1, 2560]
    - [36, 9541.04]
  - - [1856, 1856, 1, 256]
    - [33, 9781.89]
  - - [32, 5888, 1, 256]
    - [51, 1535.71]
  - - [256, 1408, 1, 32]
    - [44, 1081.31]
  - - [2944, 1, 1, 3328]
    - [64, 37.4898]
  - - [32, 704, 1, 3328]
    - [51, 309.513]
  - - [5888, 4288, 1, 1]
    - [58, 224.825]
  - - [1024, 128, 1, 256]
    - [3, 3355.28]
  - - [32, 1856, 1, 3328]
    - [51, 824.56]
  - - [5056, 704, 1, 256]
    - [35, 9864.44]
  - - [2368, 5056, 1, 256]
    - [36, 10549.7]
  - - [1024, 5056, 1, 256]
    - [33, 10574.6]
  - - [32, 1024, 1, 3328]
    - [51, 453.808]
  - - [5888, 448, 1, 256]
    - [33, 9217.43]
  - - [6784, 5056, 1, 1280]
    - [33, 9780.42]
  - - [1024, 48000, 1, 2560]
    - [36, 9657.27]
  - - [8448, 32, 1, 2816]
    - [7, 4612.56]
  - - [4288, 6784, 1, 1280]
    - [33, 10094.3]
  - - [64, 1, 1, 256]
    - [64, 0.557127]
  - - [1856, 64, 1, 1280]
    - [24, 4385.7]
  - - [128, 1408, 1, 1]
    - [62, 17.3785]
  - - [1024, 64, 1, 32]
    - [49, 143.709]
  - - [1024, 64, 1, 3328]
    - [24, 3275.1]
  - - [704, 6784, 1, 3328]
    - [33, 10008.2]
  - - [2944, 1856, 1, 1]
    - [56, 175.209]
  - - [5888, 4288, 1, 1280]
    - [33, 10165.4]
  - - [5888, 3584, 1, 1280]
    - [33, 9946.83]
  - - [32, 2368, 1, 1280]
    - [51, 975.684]
  - - [3584, 1408, 1, 1280]
    - [36, 10589.8]
  - - [1024, 2944, 1, 256]
    - [33, 9755.0]
  - - [1, 2944, 1, 1280]
    - [64, 35.6487]
  - - [32, 1024, 1, 256]
    - [51, 279.611]
  - - [2944, 1856, 1, 1280]
    - [33, 11407.0]
  - - [3584, 1, 1, 1280]
    - [69, 44.3305]
  - - [256, 3584, 1, 32]
    - [49, 2001.78]
  - - [1024, 2368, 1, 1]
    - [58, 146.136]
  - - [2944, 3584, 1, 1280]
    - [33, 10818.9]
  - - [2048, 3200, 1, 2048]
    - [37, 7805.11]
  - - [64, 1, 1, 1]
    - [64, 0.00732182]
  - - [1856, 4288, 1, 256]
    - [33, 10760.5]
  - - [256, 1, 1, 256]
    - [64, 2.63308]
  - - [256, 128, 1, 3328]
    - [21, 1711.81]
  - - [1024, 1024, 1, 1024]
    - [38, 8039.4]
  - - [1, 1856, 1, 3328]
    - [69, 23.5747]
  - - [448, 3584, 1, 1]
    - [57, 117.165]
  - - [2368, 2944, 1, 32]
    - [49, 3489.62]
  - - [128, 4288, 1, 32]
    - [46, 1394.72]
  - - [448, 256, 1, 256]
    - [15, 2980.12]
  - - [64, 64, 1, 1]
    - [57, 0.386689]
  - - [1, 1408, 1, 1]
    - [62, 0.153285]
  - - [2944, 32, 1, 32]
    - [42, 235.244]
  - - [448, 1856, 1, 1]
    - [58, 83.1488]
  - - [4288, 704, 1, 256]
    - [33, 9804.94]
  - - [1856, 1024, 1, 256]
    - [33, 8734.13]
  - - [448, 1856, 1, 32]
    - [46, 1832.61]
  - - [448, 1856, 1, 3328]
    - [36, 7880.98]
  - - [448, 448, 1, 32]
    - [42, 466.127]
  - - [1024, 448, 1, 256]
    - [33, 6121.16]
  - - [6784, 1, 1, 256]
    - [64, 52.3324]
  - - [704, 6784, 1, 32]
    - [49, 3233.74]
  - - [1024, 4288, 1, 1]
    - [63, 165.573]
  - - [704, 256, 1, 3328]
    - [26, 4898.27]
  - - [704, 1856, 1, 32]
    - [49, 2351.83]
  - - [1408, 5888, 1, 1280]
    - [36, 10758.7]
  - - [32, 704, 1, 1280]
    - [51, 289.853]
  - - [5056, 1856, 1, 256]
    - [33, 10985.7]
  - - [6784, 704, 1, 1280]
    - [36, 10247.8]
  - - [704, 1408, 1, 32]
    - [49, 2119.79]
  - - [5888, 1024, 1, 256]
    - [33, 10757.2]
  - - [64, 2944, 1, 1]
    - [62, 17.912]
  - - [7680, 16, 1, 2560]
    - [16, 2635.99]
  - - [64, 2944, 1, 32]
    - [42, 419.562]
  - - [64, 2944, 1, 1280]
    - [21, 5159.6]
  - - [6784, 1856, 1, 3328]
    - [34, 9409.73]
  - - [512, 24000, 1, 2816]
    - [36, 9825.73]
  - - [2368, 5888, 1, 1280]
    - [34, 10203.9]
  - - [5888, 6784, 1, 32]
    - [40, 4143.94]
  - - [1, 6784, 1, 256]
    - [64, 52.2152]
  - - [6784, 6784, 1, 32]
    - [40, 4172.33]
  - - [256, 1, 1, 1280]
    - [69, 3.1893]
  - - [5888, 128, 1, 32]
    - [46, 1839.4]
  - - [6784, 256, 1, 256]
    - [33, 8918.05]
  - - [2368, 3584, 1, 3328]
    - [33, 10039.7]
  - - [128, 4288, 1, 1280]
    - [7, 6425.51]
  - - [32, 3584, 1, 1280]
    - [51, 1524.42]
  - - [5888, 1024, 1, 1280]
    - [33, 10786.1]
  - - [1856, 704, 1, 3328]
    - [33, 9759.27]
  - - [5888, 6784, 1, 3328]
    - [36, 9500.87]
  - - [6784, 448, 1, 1]
    - [57, 147.057]
  - - [6784, 1856, 1, 1]
    - [58, 207.034]
  - - [128, 32, 1, 1280]
    - [51, 52.5049]
  - - [2944, 2368, 1, 1280]
    - [36, 10330.3]
  - - [128, 256, 1, 1]
    - [56, 4.1732]
  - - [6784, 448, 1, 32]
    - [46, 3018.2]
  - - [6784, 448, 1, 3328]
    - [33, 10073.9]
  - - [1, 6784, 1, 1]
    - [62, 1.06491]
  - - [448, 3584, 1, 1280]
    - [33, 8560.45]
  - - [1408, 6784, 1, 1280]
    - [33, 10720.4]
  - - [5056, 5888, 1, 1280]
    - [33, 9954.41]
  - - [32, 2944, 1, 32]
    - [42, 231.23]
  - - [5888, 704, 1, 1]
    - [62, 157.628]
  - - [3584, 1856, 1, 1]
    - [58, 183.261]
  - - [1, 256, 1, 256]
    - [64, 2.1899]
  - - [5056, 2944, 1, 32]
    - [43, 3838.84]
  - - [32, 6784, 1, 256]
    - [51, 1740.67]
  - - [4288, 6784, 1, 1]
    - [58, 226.994]
  - - [512, 48000, 1, 2048]
    - [35, 8873.3]
  - - [1, 4288, 1, 3328]
    - [64, 42.0807]
  - - [1024, 6784, 1, 1]
    - [63, 186.442]
  - - [2368, 5888, 1, 32]
    - [43, 3868.4]
  - - [448, 448, 1, 3328]
    - [23, 5380.04]
  - - [4608, 24000, 1, 1536]
    - [36, 9655.86]
  - - [1760, 16, 1, 1760]
    - [24, 1414.51]
  - - [1, 256, 1, 1]
    - [62, 0.0460763]
  - - [3584, 4288, 1, 1]
    - [61, 214.545]
  - - [5888, 1024, 1, 3328]
    - [18, 9882.74]
  - - [6784, 5888, 1, 256]
    - [33, 10924.6]
  - - [704, 128, 1, 1280]
    - [24, 3638.08]
  - - [4288, 128, 1, 256]
    - [33, 5679.09]
  - - [5056, 1024, 1, 1]
    - [56, 175.61]
  - - [32, 3584, 1, 3328]
    - [51, 1610.67]
  - - [1024, 1, 1, 1280]
    - [64, 12.2367]
  - - [4288, 2368, 1, 32]
    - [40, 3686.03]
  - - [704, 3584, 1, 1]
    - [56, 149.391]
  - - [704, 1856, 1, 3328]
    - [33, 9813.12]
  - - [2944, 128, 1, 1280]
    - [7, 6237.0]
  - - [4096, 7000, 1, 4096]
    - [36, 8708.04]
  - - [1, 2368, 1, 3328]
    - [64, 30.1549]
  - - [6784, 704, 1, 32]
    - [46, 3218.66]
  - - [4288, 1, 1, 1280]
    - [64, 40.8685]
  - - [704, 5888, 1, 256]
    - [33, 10283.7]
  - - [2368, 3584, 1, 1280]
    - [33, 10333.9]
  - - [64, 448, 1, 256]
    - [3, 1032.14]
  - - [1408, 448, 1, 1280]
    - [33, 7379.55]
  - - [3584, 5056, 1, 32]
    - [43, 3913.94]
  - - [1024, 32, 1, 1280]
    - [51, 424.13]
  - - [128, 2368, 1, 1]
    - [59, 40.5138]
  - - [6784, 1856, 1, 1280]
    - [33, 10385.1]
  - - [6144, 48000, 1, 2560]
    - [36, 9537.56]
  - - [5056, 5056, 1, 3328]
    - [36, 9454.7]
  - - [128, 704, 1, 1280]
    - [21, 3612.72]
  - - [128, 2944, 1, 1280]
    - [20, 6273.06]
  - - [2368, 5056, 1, 1]
    - [61, 204.849]
  - - [5888, 1408, 1, 256]
    - [33, 10844.2]
  - - [2368, 1024, 1, 32]
    - [46, 2778.53]
  - - [256, 256, 1, 3328]
    - [21, 3256.98]
  - - [64, 4288, 1, 1]
    - [57, 37.0479]
  - - [6144, 16, 1, 2560]
    - [19, 2560.12]
  - - [4288, 1024, 1, 256]
    - [33, 10422.0]
  - - [3584, 32, 1, 32]
    - [48, 434.604]
  - - [3584, 64, 1, 1]
    - [62, 32.9421]
  - - [704, 32, 1, 1280]
    - [51, 287.074]
  - - [32, 4288, 1, 32]
    - [46, 452.485]
  - - [64, 64, 1, 3328]
    - [21, 206.763]
  - - [64, 1408, 1, 1]
    - [62, 8.567]
  - - [4288, 5888, 1, 1280]
    - [31, 9912.44]
  - - [1856, 2944, 1, 3328]
    - [33, 10104.6]
  - - [256, 1024, 1, 256]
    - [17, 5176.76]
  - - [5056, 5888, 1, 256]
    - [36, 10884.5]
  - - [1408, 128, 1, 1280]
    - [24, 5047.3]
  - - [5056, 256, 1, 3328]
    - [33, 9742.0]
  - - [1024, 5888, 1, 1280]
    - [33, 11053.9]
  - - [1024, 448, 1, 1]
    - [57, 58.9807]
  - - [32, 32, 1, 32]
    - [42, 2.57185]
  - - [5056, 1, 1, 1280]
    - [64, 48.1615]
  - - [5888, 5056, 1, 1280]
    - [33, 9891.24]
  - - [5888, 2944, 1, 1]
    - [58, 217.276]
  - - [64, 4288, 1, 1280]
    - [14, 4908.93]
  - - [4096, 400, 1, 1024]
    - [37, 6817.72]
  - - [1408, 4288, 1, 3328]
    - [36, 9875.27]
  - - [704, 2944, 1, 32]
    - [46, 2833.32]
  - - [2048, 128, 1, 2048]
    - [11, 3466.05]
  - - [1, 5888, 1, 1280]
    - [64, 55.9636]
  - - [2944, 4288, 1, 3328]
    - [33, 9574.68]
  - - [256, 2944, 1, 256]
    - [33, 7593.59]
  - - [704, 448, 1, 32]
    - [44, 939.628]
  - - [5056, 2944, 1, 256]
    - [33, 11190.0]
  - - [1024, 700, 1, 512]
    - [33, 6614.67]
  - - [704, 1024, 1, 256]
    - [33, 7327.46]
  - - [2368, 1856, 1, 256]
    - [33, 10482.2]
  - - [64, 3584, 1, 1]
    - [62, 21.064]
  - - [1024, 128, 1, 1280]
    - [21, 4808.6]
  - - [2368, 4288, 1, 1280]
    - [33, 10884.3]
  - - [3584, 448, 1, 256]
    - [33, 8148.07]
  - - [256, 6784, 1, 256]
    - [33, 8918.05]
  - - [1024, 32, 1, 32]
    - [42, 84.7642]
  - - [1024, 1408, 1, 1]
    - [56, 117.957]
  - - [128, 64, 1, 32]
    - [42, 19.5513]
  - - [64, 1, 1, 1280]
    - [64, 0.758494]
  - - [2368, 32, 1, 32]
    - [42, 192.554]
  - - [256, 5888, 1, 1]
    - [58, 119.696]
  - - [2944, 2944, 1, 1]
    - [61, 197.638]
  - - [6784, 3584, 1, 256]
    - [33, 11327.3]
  - - [1408, 1856, 1, 256]
    - [33, 9837.82]
  - - [128, 1408, 1, 256]
    - [17, 3751.92]
  - - [2944, 2944, 1, 32]
    - [40, 3624.47]
  - - [2944, 2944, 1, 3328]
    - [33, 9868.07]
  - - [1, 2944, 1, 256]
    - [64, 25.0595]
  - - [448, 32, 1, 1280]
    - [51, 182.683]
  - - [3584, 1, 1, 256]
    - [69, 35.5918]
  - - [704, 32, 1, 3328]
    - [51, 313.54]
  - - [256, 448, 1, 3328]
    - [24, 4692.65]
  - - [128, 128, 1, 256]
    - [3, 622.208]
  - - [5124, 9124, 1, 2048]
    - [36, 8611.93]
  - - [1024, 24000, 1, 1536]
    - [36, 9770.7]
  - - [2368, 64, 1, 256]
    - [15, 3213.16]
  - - [64, 448, 1, 1280]
    - [21, 1415.55]
  - - [6784, 1408, 1, 32]
    - [40, 3645.12]
  - - [1408, 448, 1, 3328]
    - [17, 7441.96]
  - - [2368, 6784, 1, 3328]
    - [33, 9530.96]
  - - [256, 2368, 1, 1]
    - [62, 68.7701]
  - - [4288, 3584, 1, 32]
    - [43, 3866.55]
  - - [5888, 64, 1, 3328]
    - [23, 6305.31]
  - - [3584, 704, 1, 1280]
    - [33, 10258.4]
  - - [448, 5056, 1, 3328]
    - [33, 9281.52]
  - - [4288, 448, 1, 256]
    - [18, 8723.8]
  - - [5056, 256, 1, 1280]
    - [33, 9110.13]
  - - [704, 448, 1, 3328]
    - [17, 5344.95]
  - - [2944, 5888, 1, 32]
    - [43, 3873.86]
  - - [3584, 5056, 1, 256]
    - [33, 11160.8]
  - - [6784, 1, 1, 3328]
    - [64, 62.3404]
  - - [32, 2368, 1, 3328]
    - [51, 1054.96]
  - - [4288, 256, 1, 1]
    - [62, 98.7965]
  - - [64, 256, 1, 1]
    - [64, 1.51493]
  - - [1856, 448, 1, 3328]
    - [27, 7911.03]
  - - [3584, 2368, 1, 256]
    - [33, 10814.8]
  - - [4288, 4288, 1, 256]
    - [34, 10838.0]
  - - [4288, 256, 1, 1280]
    - [33, 8356.01]
  - - [448, 5056, 1, 256]
    - [33, 9252.78]
  - - [128, 1856, 1, 1]
    - [64, 34.4851]
  - - [4288, 704, 1, 1280]
    - [33, 10339.4]
  - - [128, 1856, 1, 32]
    - [51, 808.097]
  - - [2368, 704, 1, 1]
    - [62, 120.991]
  - - [3584, 32, 1, 256]
    - [53, 1082.92]
  - - [448, 2368, 1, 1280]
    - [33, 7525.09]
  - - [3584, 256, 1, 1]
    - [56, 91.0719]
  - - [2048, 16, 1, 2048]
    - [21, 876.999]
  - - [1408, 1856, 1, 1280]
    - [33, 10826.0]
  - - [3584, 4288, 1, 3328]
    - [33, 9581.85]
  - - [1024, 24000, 1, 2048]
    - [35, 8718.34]
  - - [448, 4288, 1, 32]
    - [46, 2651.35]
  - - [448, 4288, 1, 1280]
    - [33, 9809.18]
  - - [64, 3584, 1, 256]
    - [17, 4555.67]
  - - [2048, 6400, 1, 2048]
    - [39, 8305.66]
  - - [1, 6784, 1, 1280]
    - [64, 64.5507]
  - - [5056, 1024, 1, 256]
    - [33, 10524.9]
  - - [2368, 448, 1, 32]
    - [51, 2001.22]
  - - [4288, 3584, 1, 1280]
    - [33, 10626.8]
  - - [32, 2944, 1, 1280]
    - [51, 1188.22]
  - - [1408, 704, 1, 1]
    - [59, 96.2688]
  - - [2368, 256, 1, 256]
    - [33, 6216.65]
  - - [1, 5056, 1, 1]
    - [64, 0.8324]
  - - [4288, 32, 1, 32]
    - [49, 470.446]
  - - [1856, 3584, 1, 32]
    - [40, 3470.44]
  - - [5056, 3584, 1, 3328]
    - [35, 9546.2]
  - - [4288, 5056, 1, 256]
    - [33, 10997.2]
  - - [1856, 5888, 1, 256]
    - [34, 10874.3]
  - - [256, 256, 1, 256]
    - [3, 2136.68]
  - - [2368, 3584, 1, 1]
    - [58, 194.846]
  - - [4288, 2368, 1, 256]
    - [33, 10614.3]
  - - [448, 1, 1, 3328]
    - [64, 5.67601]
  - - [1856, 256, 1, 1280]
    - [33, 7546.01]
  - - [256, 2944, 1, 1]
    - [57, 82.7157]
  - - [1408, 2944, 1, 3328]
    - [33, 10546.3]
  - - [32, 1856, 1, 32]
    - [42, 149.162]
  - - [5888, 3584, 1, 1]
    - [58, 222.039]
  - - [256, 1, 1, 1]
    - [69, 0.0460763]
  - - [6784, 5056, 1, 3328]
    - [36, 9391.16]
  - - [6784, 5056, 1, 1]
    - [56, 228.209]
  - - [5888, 3584, 1, 32]
    - [43, 3980.8]
  - - [5888, 3584, 1, 3328]
    - [36, 9433.59]
  - - [32, 1024, 1, 1280]
    - [51, 413.899]
  - - [1, 256, 1, 3328]
    - [69, 3.26461]
  - - [1024, 6784, 1, 256]
    - [33, 10684.2]
  - - [6784, 5888, 1, 32]
    - [43, 4127.09]
  - - [1408, 1, 1, 1280]
    - [69, 16.9308]
  - - [2368, 6784, 1, 32]
    - [40, 3896.49]
  - - [6784, 64, 1, 1]
    - [64, 55.821]
  - - [1760, 6400, 1, 1760]
    - [31, 10398.8]
  - - [5056, 1408, 1, 1280]
    - [33, 10802.6]
  - - [3584, 1408, 1, 3328]
    - [33, 9887.97]
  - - [2944, 3584, 1, 1]
    - [61, 202.615]
  - - [2944, 1408, 1, 1280]
    - [33, 10900.3]
  - - [1856, 64, 1, 1]
    - [62, 11.1357]
  - - [3584, 1024, 1, 1]
    - [56, 161.91]
  - - [256, 32, 1, 256]
    - [54, 87.6479]
  - - [2944, 1856, 1, 3328]
    - [33, 9762.63]
  - - [128, 1024, 1, 3328]
    - [24, 5192.79]
  - - [1408, 128, 1, 1]
    - [62, 16.8955]
  - - [2944, 3584, 1, 32]
    - [43, 3687.71]
  - - [5888, 256, 1, 32]
    - [49, 2485.29]
  - - [8192, 3200, 1, 2048]
    - [39, 8694.36]
  - - [6784, 64, 1, 256]
    - [9, 5770.98]
  - - [256, 128, 1, 1280]
    - [21, 1617.74]
  - - [6784, 5056, 1, 256]
    - [33, 10927.1]
  - - [1408, 32, 1, 3328]
    - [51, 631.776]
  - - [2560, 3200, 1, 2560]
    - [36, 10178.9]
  - - [1856, 3584, 1, 1280]
    - [33, 11029.8]
  - - [256, 5888, 1, 256]
    - [33, 8711.01]
  - - [5056, 32, 1, 256]
    - [51, 1350.55]
  - - [1024, 4288, 1, 3328]
    - [33, 10232.3]
  - - [448, 2368, 1, 256]
    - [33, 7259.88]
  - - [64, 1408, 1, 1280]
    - [21, 3629.6]
  - - [1024, 48000, 1, 2816]
    - [36, 9685.77]
  - - [3584, 32, 1, 1280]
    - [51, 1475.61]
  - - [128, 2368, 1, 3328]
    - [14, 5308.94]
  - - [64, 5056, 1, 256]
    - [7, 4564.43]
  - - [256, 64, 1, 256]
    - [3, 615.452]
  - - [32, 1408, 1, 256]
    - [51, 379.775]
  - - [2368, 448, 1, 3328]
    - [33, 7980.73]
  - - [2368, 1408, 1, 1]
    - [56, 149.039]
  - - [1, 1, 1, 1]
    - [67, 0.00011157]
  - - [1024, 1856, 1, 32]
    - [46, 2623.02]
  - - [32, 1024, 1, 32]
    - [44, 78.6393]
  - - [4288, 1, 1, 256]
    - [64, 33.9103]
  - - [1856, 128, 1, 3328]
    - [26, 6391.07]
  - - [5888, 2368, 1, 1]
    - [58, 209.601]
  - - [2368, 2368, 1, 1]
    - [63, 179.38]
  - - [704, 256, 1, 1280]
    - [26, 4654.98]
  - - [704, 4288, 1, 256]
    - [33, 9722.66]
  - - [5888, 2368, 1, 32]
    - [49, 3776.23]
  - - [5888, 2368, 1, 1280]
    - [33, 10684.4]
  - - [128, 256, 1, 256]
    - [3, 1167.44]
  - - [2944, 5056, 1, 3328]
    - [33, 9552.26]
  - - [6784, 704, 1, 3328]
    - [33, 10048.1]
  - - [1856, 1856, 1, 32]
    - [46, 2988.11]
  - - [4288, 2944, 1, 32]
    - [43, 3727.52]
  - - [256, 5056, 1, 1]
    - [62, 108.531]
  - - [704, 64, 1, 256]
    - [15, 1557.01]
  - - [256, 2368, 1, 3328]
    - [17, 7193.56]
  - - [5124, 9124, 1, 2560]
    - [18, 9219.99]
  - - [704, 1, 1, 1]
    - [62, 0.08054]
  - - [128, 448, 1, 1280]
    - [21, 2663.63]
  - - [5056, 5056, 1, 256]
    - [35, 10943.0]
  - - [5888, 256, 1, 256]
    - [33, 8710.91]
  - - [5888, 64, 1, 1]
    - [62, 49.3914]
  - - [6784, 6784, 1, 256]
    - [35, 10655.1]
  - - [256, 3584, 1, 1]
    - [61, 91.0719]
  - - [2368, 1, 1, 256]
    - [64, 20.9297]
  - - [448, 32, 1, 32]
    - [45, 42.1299]
  - - [704, 64, 1, 1]
    - [57, 4.2835]
  - - [3584, 704, 1, 3328]
    - [33, 9952.21]
  - - [4288, 704, 1, 3328]
    - [33, 10012.7]
  - - [4288, 2944, 1, 1280]
    - [33, 10391.8]
  - - [448, 3584, 1, 256]
    - [33, 8208.36]
  - - [704, 32, 1, 256]
    - [51, 195.127]
  - - [6784, 256, 1, 32]
    - [46, 2578.09]
  - - [1856, 128, 1, 1]
    - [57, 35.2422]
  - - [1856, 32, 1, 32]
    - [42, 150.039]
  - - [6784, 1408, 1, 1280]
    - [33, 10539.7]
  - - [2368, 5056, 1, 1280]
    - [33, 10648.0]
  - - [704, 1856, 1, 1280]
    - [33, 10034.6]
  - - [1408, 1408, 1, 1280]
    - [36, 10213.4]
  - - [448, 1024, 1, 3328]
    - [26, 7326.73]
  - - [32, 704, 1, 32]
    - [42, 56.9113]
  - - [256, 704, 1, 1]
    - [67, 16.7791]
  - - [5888, 1856, 1, 32]
    - [49, 3705.49]
  - - [5888, 704, 1, 3328]
    - [33, 10262.1]
  - - [5056, 1, 1, 256]
    - [64, 40.4467]
  - - [448, 6784, 1, 256]
    - [33, 9716.19]
  - - [1024, 128, 1, 1]
    - [62, 12.2876]
  - - [16384, 400, 1, 4096]
    - [37, 6747.16]
  - - [128, 64, 1, 256]
    - [3, 237.894]
  - - [2560, 128, 1, 2560]
    - [17, 5446.97]
  - - [1856, 128, 1, 256]
    - [17, 4718.55]
  - - [2944, 5888, 1, 256]
    - [36, 10941.6]
  - - [1024, 256, 1, 1280]
    - [26, 6564.76]
  - - [128, 5056, 1, 32]
    - [49, 1625.41]
  - - [128, 5056, 1, 1280]
    - [33, 7540.59]
  - - [448, 32, 1, 3328]
    - [51, 197.749]
  - - [1856, 1408, 1, 32]
    - [51, 2843.58]
  - - [64, 704, 1, 32]
    - [42, 105.777]
  - - [64, 704, 1, 3328]
    - [21, 2279.51]
  - - [64, 2368, 1, 32]
    - [42, 346.392]
  - - [5888, 64, 1, 32]
    - [49, 1107.36]
  - - [2368, 256, 1, 1]
    - [57, 69.9444]
  - - [5888, 64, 1, 1280]
    - [20, 6207.31]
  - - [5056, 1, 1, 1]
    - [59, 0.853189]
  - - [5888, 2944, 1, 1280]
    - [33, 10423.0]
  - - [32, 2368, 1, 256]
    - [51, 646.6]
  - - [256, 1408, 1, 256]
    - [33, 4982.7]
  - - [448, 5888, 1, 1]
    - [62, 134.377]
  - - [3584, 1408, 1, 1]
    - [63, 173.34]
  - - [32, 6784, 1, 1280]
    - [51, 2191.1]
  - - [32, 6784, 1, 32]
    - [51, 689.544]
  - - [7680, 32, 1, 2560]
    - [11, 4687.19]
  - - [448, 5888, 1, 32]
    - [46, 2745.81]
  - - [5056, 704, 1, 1280]
    - [33, 10633.6]
  - - [1856, 6784, 1, 1]
    - [61, 207.793]
  - - [5056, 64, 1, 1]
    - [59, 43.2483]
  - - [3072, 48000, 1, 1024]
    - [36, 9550.37]
  - - [1, 5888, 1, 1]
    - [57, 0.935123]
  - - [2368, 1024, 1, 256]
    - [33, 8338.3]
  - - [1856, 6784, 1, 32]
    - [43, 3785.09]
  - - [1856, 6784, 1, 1280]
    - [33, 10124.1]
  - - [64, 3584, 1, 3328]
    - [23, 6174.41]
  - - [5888, 5056, 1, 3328]
    - [35, 9527.49]
  - - [4096, 128, 1, 4096]
    - [28, 4720.75]
  - - [1, 2944, 1, 3328]
    - [69, 37.7897]
  - - [1408, 6784, 1, 32]
    - [46, 3651.57]
  - - [32, 5888, 1, 1280]
    - [51, 1914.01]
  - - [448, 256, 1, 1]
    - [62, 10.9029]
  - - [3584, 5888, 1, 3328]
    - [36, 9483.41]
  - - [4288, 1408, 1, 256]
    - [33, 10390.9]
  - - [448, 64, 1, 1280]
    - [21, 1411.52]
  - - [128, 448, 1, 32]
    - [42, 131.764]
  - - [6784, 2368, 1, 256]
    - [35, 10967.4]
  - - [1024, 24000, 1, 2816]
    - [35, 9617.07]
  - - [7680, 5984, 1, 2560]
    - [36, 9519.07]
  - - [1408, 448, 1, 32]
    - [49, 1575.11]
  - - [1856, 1408, 1, 1280]
    - [33, 10738.5]
  - - [448, 256, 1, 3328]
    - [24, 4662.93]
  - - [1856, 2368, 1, 1]
    - [61, 163.447]
  - - [1408, 5056, 1, 3328]
    - [31, 9864.75]
  - - [128, 704, 1, 3328]
    - [21, 3980.76]
  - - [5056, 128, 1, 1280]
    - [20, 7550.79]
  - - [5056, 4288, 1, 256]
    - [35, 11002.1]
  - - [5056, 5056, 1, 32]
    - [40, 3988.06]
  - - [1856, 704, 1, 256]
    - [33, 8768.02]
  - - [3072, 32, 1, 1024]
    - [10, 2081.05]
  - - [64, 256, 1, 256]
    - [3, 622.208]
  - - [448, 5888, 1, 1280]
    - [33, 10124.4]
  - - [16384, 3200, 1, 4096]
    - [36, 8938.02]
  - - [128, 6784, 1, 256]
    - [5, 7094.36]
  - - [5056, 448, 1, 256]
    - [33, 9307.88]
  - - [4288, 5888, 1, 1]
    - [56, 223.351]
  - - [1856, 5056, 1, 1280]
    - [18, 10808.5]
  - - [2368, 4288, 1, 1]
    - [61, 200.989]
  - - [2368, 32, 1, 3328]
    - [51, 1064.86]
  - - [3584, 1856, 1, 256]
    - [33, 10647.6]
  - - [256, 3584, 1, 256]
    - [33, 7531.62]
  - - [64, 704, 1, 1]
    - [57, 4.16607]
  - - [4288, 5888, 1, 32]
    - [40, 4021.64]
  - - [4288, 5888, 1, 3328]
    - [36, 9477.4]
  - - [1, 1024, 1, 1]
    - [62, 0.112392]
  - - [1024, 2944, 1, 3328]
    - [36, 9948.44]
  - - [6144, 24000, 1, 2560]
    - [36, 9541.98]
  - - [2944, 2368, 1, 256]
    - [33, 10736.3]
  - - [1024, 1856, 1, 256]
    - [35, 8653.51]
  - - [1760, 7000, 1, 1760]
    - [30, 10314.1]
  - - [2944, 64, 1, 3328]
    - [25, 5257.67]
  - - [1024, 5888, 1, 32]
    - [49, 3400.24]
  - - [1024, 5888, 1, 3328]
    - [33, 10280.7]
  - - [5056, 2368, 1, 32]
    - [46, 3739.71]
  - - [1408, 2368, 1, 1280]
    - [33, 10948.7]
  - - [256, 1, 1, 3328]
    - [64, 3.28231]
  - - [128, 1024, 1, 32]
    - [42, 311.104]
  - - [5056, 6784, 1, 3328]
    - [18, 9467.02]
  - - [448, 704, 1, 1]
    - [59, 43.007]
  - - [32, 64, 1, 32]
    - [42, 5.05562]
  - - [448, 704, 1, 32]
    - [51, 939.628]
  - - [448, 704, 1, 3328]
    - [26, 5391.73]
  - - [1408, 2944, 1, 256]
    - [36, 10380.5]
  - - [1760, 1600, 1, 1760]
    - [30, 10927.0]
  - - [64, 5888, 1, 1]
    - [62, 48.917]
  - - [2368, 128, 1, 32]
    - [44, 922.121]
  - - [2368, 256, 1, 1280]
    - [33, 7096.83]
  - - [1760, 800, 1, 1760]
    - [32, 9365.35]
  - - [2368, 128, 1, 3328]
    - [7, 5237.48]
  - - [704, 5056, 1, 32]
    - [51, 3032.81]
  - - [32, 2368, 1, 32]
    - [42, 188.132]
  - - [1408, 1, 1, 256]
    - [64, 12.1952]
  - - [4288, 256, 1, 32]
    - [49, 2070.76]
  - - [448, 1408, 1, 1]
    - [59, 70.9583]
  - - [5056, 4288, 1, 1280]
    - [33, 10342.6]
  - - [1408, 256, 1, 256]
    - [33, 4865.91]
  - - [4288, 448, 1, 1]
    - [57, 127.749]
  - - [256, 4288, 1, 32]
    - [46, 2061.76]
  - - [1408, 256, 1, 1280]
    - [33, 5793.82]
  - - [256, 256, 1, 1]
    - [67, 6.14381]
  - - [1408, 1, 1, 1]
    - [64, 0.165287]
  - - [448, 1408, 1, 256]
    - [33, 6411.53]
  - - [5888, 5888, 1, 1]
    - [63, 229.868]
  - - [4608, 16, 1, 1536]
    - [21, 2381.27]
  - - [128, 2944, 1, 32]
    - [44, 1107.41]
  - - [6144, 5984, 1, 2048]
    - [36, 8794.62]
  - - [32, 256, 1, 32]
    - [42, 20.3378]
  - - [2944, 704, 1, 1280]
    - [33, 10611.3]
  - - [1024, 3584, 1, 1280]
    - [33, 11222.0]
  - - [1856, 448, 1, 1]
    - [58, 83.1446]
  - - [2368, 2944, 1, 1]
    - [56, 187.099]
  - - [5056, 256, 1, 32]
    - [51, 2349.33]
  - - [4288, 1, 1, 3328]
    - [64, 40.694]
  - - [5056, 1024, 1, 1280]
    - [36, 11203.7]
  - - [704, 704, 1, 1]
    - [64, 62.5265]
  - - [1856, 448, 1, 1280]
    - [33, 7703.84]
  - - [3584, 6784, 1, 256]
    - [33, 11173.7]
  - - [64, 1856, 1, 1280]
    - [21, 4404.57]
  - - [1856, 1408, 1, 256]
    - [33, 9837.82]
  - - [4608, 5984, 1, 1536]
    - [36, 9738.9]
  - - [4288, 4288, 1, 32]
    - [43, 3924.37]
  - - [128, 1, 1, 256]
    - [64, 1.09493]
  - - [32, 64, 1, 3328]
    - [51, 27.6388]
  - - [5888, 448, 1, 1]
    - [57, 139.645]
  - - [128, 5888, 1, 256]
    - [33, 7571.39]
  - - [3584, 256, 1, 3328]
    - [36, 8744.23]
  - - [5056, 5056, 1, 1280]
    - [36, 9941.4]
  - - [6784, 1408, 1, 3328]
    - [33, 9616.42]
  - - [512, 24000, 1, 2048]
    - [35, 8567.29]
  - - [448, 2368, 1, 1]
    - [62, 95.4744]
  - - [2560, 800, 1, 2560]
    - [33, 8479.28]
  - - [2368, 1, 1, 1280]
    - [64, 28.6942]
  - - [32, 3584, 1, 32]
    - [42, 423.447]
  - - [128, 6784, 1, 1]
    - [56, 86.8309]
  - - [1, 3584, 1, 1]
    - [62, 0.369332]
  - - [5888, 5888, 1, 3328]
    - [36, 9458.54]
  - - [256, 2944, 1, 3328]
    - [33, 8154.99]
  - - [512, 24000, 1, 2560]
    - [36, 9945.18]
  - - [1, 128, 1, 3328]
    - [69, 1.61398]
  - - [32, 256, 1, 256]
    - [51, 69.5596]
  - - [5888, 1408, 1, 32]
    - [40, 3650.68]
  - - [704, 256, 1, 1]
    - [62, 16.6643]
  - - [1, 448, 1, 1]
    - [56, 0.0728633]
  - - [256, 6784, 1, 3328]
    - [33, 9598.24]
  - - [64, 5888, 1, 256]
    - [7, 5188.32]
  - - [1856, 1, 1, 1]
    - [62, 0.21599]
  - - [1024, 256, 1, 3328]
    - [26, 7018.6]
  - - [704, 704, 1, 256]
    - [33, 6690.63]
  - - [448, 1024, 1, 32]
    - [49, 1357.38]
  - - [6784, 2368, 1, 1280]
    - [33, 10387.5]
  - - [128, 1856, 1, 1280]
    - [23, 6001.56]
  - - [256, 2368, 1, 256]
    - [33, 6179.88]
  - - [2944, 1408, 1, 1]
    - [56, 166.542]
  - - [6784, 1024, 1, 256]
    - [33, 10693.7]
  - - [5056, 1408, 1, 32]
    - [43, 3502.56]
  - - [1408, 6784, 1, 3328]
    - [33, 9727.14]
  - - [2944, 1408, 1, 3328]
    - [36, 10508.8]
  - - [1856, 32, 1, 256]
    - [51, 511.853]
  - - [704, 2368, 1, 32]
    - [49, 2500.53]
  - - [448, 256, 1, 32]
    - [42, 259.393]
  - - [704, 6784, 1, 1]
    - [61, 167.898]
  - - [2368, 6784, 1, 256]
    - [33, 11127.9]
  - - [8448, 48000, 1, 2816]
    - [36, 9541.04]
  - - [7680, 64, 1, 2560]
    - [26, 6927.56]
  - - [1856, 3584, 1, 3328]
    - [33, 9795.04]
  - - [1, 704, 1, 3328]
    - [69, 9.06256]
  - - [4096, 32, 1, 4096]
    - [29, 2233.44]
  - - [64, 1, 1, 3328]
    - [69, 0.809945]
  - - [448, 704, 1, 1280]
    - [17, 5180.41]
  - - [704, 1856, 1, 1]
    - [64, 108.885]
  - - [704, 448, 1, 256]
    - [17, 4325.3]
  - - [448, 64, 1, 3328]
    - [21, 1499.58]
  - - [704, 6784, 1, 256]
    - [33, 10251.6]
  - - [256, 32, 1, 1280]
    - [51, 111.635]
  - - [2368, 448, 1, 1280]
    - [33, 8179.88]
  - - [6784, 2944, 1, 32]
    - [43, 3959.46]
  - - [4096, 1600, 1, 1024]
    - [33, 9204.83]
  - - [64, 4288, 1, 32]
    - [48, 840.808]
  - - [128, 704, 1, 1]
    - [62, 8.56659]
  - - [6144, 48000, 1, 2048]
    - [36, 9373.96]
  - - [128, 448, 1, 3328]
    - [24, 2875.3]
  - - [5888, 2368, 1, 3328]
    - [35, 9517.45]
  - - [2368, 704, 1, 1280]
    - [33, 9453.89]
  - - [1024, 1408, 1, 1280]
    - [33, 9505.26]
  - - [4288, 64, 1, 1280]
    - [24, 4828.93]
  - - [128, 5056, 1, 1]
    - [62, 72.8014]
  - - [2944, 5056, 1, 32]
    - [43, 3864.22]
  - - [2048, 1600, 1, 512]
    - [33, 9335.74]
  - - [448, 448, 1, 1]
    - [62, 18.3066]
  - - [256, 2368, 1, 1280]
    - [33, 7063.34]
  - - [704, 2368, 1, 3328]
    - [33, 9190.79]
  - - [3584, 2944, 1, 256]
    - [33, 10917.4]
  - - [64, 6784, 1, 256]
    - [9, 5861.21]
  - - [3584, 1024, 1, 1280]
    - [35, 10686.9]
  - - [2048, 3200, 1, 512]
    - [33, 10536.6]
  - - [6144, 12000, 1, 2048]
    - [36, 9086.13]
  - - [64, 1024, 1, 256]
    - [21, 2116.73]
  - - [1408, 32, 1, 32]
    - [49, 115.858]
  - - [128, 3584, 1, 256]
    - [33, 6192.98]
  - - [704, 1408, 1, 1]
    - [61, 98.3902]
  - - [5056, 3584, 1, 256]
    - [33, 11162.8]
  - - [2368, 704, 1, 256]
    - [33, 8611.71]
  - - [1856, 1856, 1, 1280]
    - [33, 10424.4]
  - - [32, 5888, 1, 32]
    - [48, 607.426]
  - - [64, 32, 1, 32]
    - [42, 5.05542]
  - - [4288, 704, 1, 1]
    - [57, 149.273]
  - - [1856, 1024, 1, 1]
    - [60, 130.237]
  - - [4288, 2944, 1, 3328]
    - [33, 9638.95]
  - - [1024, 128, 1, 3328]
    - [21, 5225.04]
  - - [4288, 128, 1, 3328]
    - [7, 6616.2]
  - - [4288, 704, 1, 32]
    - [51, 2910.82]
  - - [1856, 1024, 1, 32]
    - [49, 2631.42]
  - - [1, 448, 1, 3328]
    - [69, 5.70335]
  - - [2944, 6784, 1, 1]
    - [56, 220.634]
  - - [6784, 2368, 1, 32]
    - [43, 3836.19]
  - - [5888, 5056, 1, 1]
    - [61, 225.394]
  - - [128, 6784, 1, 1280]
    - [33, 8006.73]
  - - [704, 5888, 1, 1]
    - [56, 167.538]
  - - [6784, 6784, 1, 1]
    - [56, 233.567]
  - - [1856, 32, 1, 1280]
    - [51, 774.539]
  - - [3072, 16, 1, 1024]
    - [13, 1171.47]
  - - [5888, 448, 1, 3328]
    - [33, 9753.76]
  - - [704, 5888, 1, 32]
    - [46, 3174.88]
  - - [704, 5888, 1, 1280]
    - [33, 10392.6]
  - - [1024, 6784, 1, 3328]
    - [33, 10167.0]
  - - [704, 2944, 1, 1280]
    - [33, 10573.6]
  - - [4288, 6784, 1, 256]
    - [35, 10660.8]
  - - [3584, 256, 1, 32]
    - [49, 2022.19]
  - - [1408, 1408, 1, 32]
    - [46, 2718.73]
  - - [1408, 1408, 1, 3328]
    - [33, 10309.7]
  - - [1024, 64, 1, 256]
    - [3, 2097.02]
  - - [4288, 64, 1, 32]
    - [44, 834.893]
  - - [1408, 256, 1, 32]
    - [46, 1088.92]
  - - [5888, 128, 1, 256]
    - [33, 7660.52]
  - - [64, 704, 1, 1280]
    - [21, 2127.16]
  - - [2944, 1856, 1, 256]
    - [33, 10638.4]
  - - [128, 5056, 1, 3328]
    - [20, 7778.23]
  - - [4288, 2944, 1, 1]
    - [58, 207.573]
  - - [6784, 5056, 1, 32]
    - [40, 4056.15]
  - - [1024, 448, 1, 3328]
    - [26, 7610.82]
  - - [3584, 128, 1, 1]
    - [62, 58.9807]
  - - [2944, 4288, 1, 1280]
    - [33, 10586.9]
  - - [64, 32, 1, 3328]
    - [51, 28.0946]
  - - [1024, 4288, 1, 256]
    - [33, 10436.4]
  - - [128, 2368, 1, 256]
    - [1, 4310.69]
  - - [2368, 64, 1, 32]
    - [42, 355.808]
  - - [1408, 1, 1, 3328]
    - [69, 17.9809]
  - - [64, 1408, 1, 32]
    - [42, 212.716]
  - - [2368, 5888, 1, 1]
    - [56, 212.921]
  - - [1408, 1856, 1, 32]
    - [46, 2986.46]
  - - [448, 1856, 1, 256]
    - [33, 6841.65]
  - - [1856, 6784, 1, 3328]
    - [33, 9590.3]
  - - [3584, 128, 1, 256]
    - [33, 6145.02]
  - - [1024, 448, 1, 1280]
    - [17, 7232.63]
  - - [1024, 2368, 1, 32]
    - [46, 2785.91]
  - - [32, 2944, 1, 256]
    - [51, 792.158]
  - - [128, 5888, 1, 1]
    - [57, 81.3936]
  - - [64, 5056, 1, 1]
    - [62, 43.2512]
  - - [1856, 256, 1, 32]
    - [46, 1386.82]
  - - [2368, 2368, 1, 3328]
    - [35, 9967.24]
  - - [64, 448, 1, 1]
    - [65, 3.51868]
  - - [3584, 5888, 1, 32]
    - [40, 3953.18]
  - - [3584, 5888, 1, 1280]
    - [33, 9977.04]
  - - [64, 5056, 1, 32]
    - [44, 970.722]
  - - [2944, 64, 1, 1]
    - [57, 17.9128]
  - - [6784, 704, 1, 256]
    - [33, 10251.6]
  - - [3584, 1024, 1, 32]
    - [46, 3145.63]
  - - [1408, 704, 1, 32]
    - [46, 2151.78]
  - - [1408, 704, 1, 1280]
    - [33, 9174.06]
  - - [2368, 5888, 1, 256]
    - [33, 10774.8]
  - - [2944, 64, 1, 32]
    - [49, 421.733]
  - - [1, 1408, 1, 256]
    - [64, 12.1041]
  - - [64, 2944, 1, 256]
    - [17, 3830.26]
  - - [5888, 5888, 1, 32]
    - [43, 4095.26]
  - - [1856, 1408, 1, 3328]
    - [33, 10301.3]
  - - [1024, 1024, 1, 32]
    - [46, 2264.9]
  - - [4288, 1024, 1, 1]
    - [58, 164.198]
  - - [704, 4288, 1, 3328]
    - [33, 10017.9]
  - - [2944, 5056, 1, 1280]
    - [35, 10175.7]
  - - [6784, 2944, 1, 1280]
    - [33, 10291.9]
  - - [6784, 256, 1, 3328]
    - [33, 9594.71]
  - - [5056, 128, 1, 3328]
    - [20, 7765.76]
  - - [128, 128, 1, 1280]
    - [21, 811.183]
  - - [128, 4288, 1, 1]
    - [62, 62.7919]
  - - [1408, 5056, 1, 32]
    - [43, 3510.55]
  - - [2944, 128, 1, 3328]
    - [26, 6321.79]
  - - [5888, 1856, 1, 1280]
    - [33, 10729.7]
  - - [64, 128, 1, 256]
    - [3, 248.345]
  - - [5888, 256, 1, 1280]
    - [33, 9899.59]
  - - [1856, 5056, 1, 1]
    - [61, 194.591]
  - - [3584, 1856, 1, 1280]
    - [35, 10612.2]
  - - [6784, 448, 1, 256]
    - [33, 9707.22]
  - - [704, 3584, 1, 256]
    - [33, 9582.07]
  - - [1856, 5056, 1, 32]
    - [49, 3629.12]
  - - [1856, 5056, 1, 3328]
    - [33, 9808.47]
  - - [1024, 2944, 1, 32]
    - [46, 2900.45]
  - - [1408, 6784, 1, 256]
    - [33, 10894.4]
  - - [1024, 2368, 1, 1280]
    - [33, 10155.1]
  - - [1856, 3584, 1, 1]
    - [58, 187.862]
  - - [5888, 128, 1, 1280]
    - [33, 8775.53]
  - - [2944, 5888, 1, 1280]
    - [33, 10383.6]
  - - [1, 1856, 1, 1]
    - [62, 0.202058]
  - - [3584, 3584, 1, 256]
    - [33, 11192.9]
  - - [1856, 2368, 1, 3328]
    - [33, 9639.82]
  - - [5888, 704, 1, 256]
    - [33, 10335.6]
  - - [64, 448, 1, 32]
    - [47, 78.3923]
  - - [6784, 4288, 1, 256]
    - [35, 10800.5]
  - - [128, 64, 1, 3328]
    - [21, 412.6]
  - - [1, 5056, 1, 1280]
    - [64, 48.563]
  - - [32, 64, 1, 1280]
    - [51, 25.7557]
  - - [1408, 2368, 1, 3328]
    - [33, 10123.1]
  - - [1024, 3584, 1, 256]
    - [33, 10345.2]
  - - [2944, 128, 1, 256]
    - [20, 5230.09]
  - - [6784, 128, 1, 1]
    - [61, 87.4826]
  - - [1408, 256, 1, 3328]
    - [26, 6049.18]
  - - [448, 32, 1, 256]
    - [51, 123.551]
  - - [512, 24000, 1, 1536]
    - [33, 10267.4]
  - - [1024, 32, 1, 256]
    - [51, 282.397]
  - - [1, 5888, 1, 256]
    - [64, 46.1415]
  - - [64, 2368, 1, 256]
    - [3, 3314.88]
  - - [2944, 256, 1, 256]
    - [33, 7638.08]
  - - [1, 128, 1, 256]
    - [64, 1.06848]
  - - [32, 256, 1, 1280]
    - [51, 105.166]
  - - [5888, 1, 1, 256]
    - [64, 45.8294]
  - - [32, 128, 1, 3328]
    - [51, 55.4609]
  - - [6784, 128, 1, 256]
    - [33, 7128.14]
  - - [6784, 64, 1, 1280]
    - [17, 6882.85]
  - - [4288, 1024, 1, 32]
    - [46, 3253.54]
  - - [1408, 64, 1, 3328]
    - [24, 3934.34]
  - - [2944, 448, 1, 1280]
    - [33, 8718.46]
  - - [6784, 32, 1, 1280]
    - [51, 2209.17]
  - - [2944, 64, 1, 1280]
    - [24, 5087.06]
  - - [704, 448, 1, 1]
    - [62, 42.1563]
  - - [32, 128, 1, 32]
    - [44, 9.88514]
  - - [1, 128, 1, 1]
    - [57, 0.0137133]
  - - [2560, 7000, 1, 2560]
    - [35, 9463.98]
  - - [5888, 1, 1, 1]
    - [59, 0.969378]
  - - [5888, 1856, 1, 3328]
    - [32, 9722.03]
  - - [2368, 3584, 1, 256]
    - [33, 10858.8]
  - - [4288, 1408, 1, 3328]
    - [36, 9824.83]
  - - [1856, 32, 1, 3328]
    - [51, 837.239]
  - - [2944, 32, 1, 256]
    - [51, 801.903]
  - - [128, 64, 1, 1]
    - [67, 0.80137]
  - - [256, 1024, 1, 3328]
    - [26, 7031.16]
  - - [32, 448, 1, 256]
    - [51, 122.029]
  - - [1856, 64, 1, 3328]
    - [21, 4421.35]
  - - [256, 5056, 1, 256]
    - [33, 8618.69]
  - - [5888, 2944, 1, 3328]
    - [36, 9606.12]
  - - [2368, 1408, 1, 3328]
    - [33, 10091.7]
  - - [5888, 704, 1, 32]
    - [49, 3174.92]
  - - [2944, 704, 1, 1]
    - [57, 135.822]
  - - [6784, 1856, 1, 256]
    - [33, 10993.8]
  - - [1, 704, 1, 256]
    - [64, 6.00727]
  - - [1856, 1856, 1, 1]
    - [63, 152.967]
  - - [5888, 32, 1, 256]
    - [51, 1543.01]
  - - [128, 704, 1, 256]
    - [3, 2511.42]
  - - [256, 1408, 1, 3328]
    - [26, 6044.67]
  - - [2944, 128, 1, 1]
    - [59, 50.8717]
  - - [32, 256, 1, 3328]
    - [51, 113.103]
  - - [2944, 704, 1, 3328]
    - [18, 10324.2]
  - - [704, 1024, 1, 32]
    - [46, 1779.58]
  - - [2368, 1856, 1, 32]
    - [49, 3234.41]
  - - [5056, 4288, 1, 3328]
    - [35, 9429.88]
  - - [3584, 448, 1, 3328]
    - [33, 8885.86]
  - - [256, 32, 1, 32]
    - [51, 32.1728]
  - - [64, 256, 1, 3328]
    - [21, 859.902]
  - - [256, 6784, 1, 1]
    - [62, 124.709]
  - - [1024, 3584, 1, 32]
    - [46, 3096.49]
  - - [256, 6784, 1, 32]
    - [49, 2604.97]
  - - [2944, 1408, 1, 32]
    - [43, 3209.06]
  - - [2048, 800, 1, 2048]
    - [39, 7188.86]
  - - [4288, 3584, 1, 1]
    - [58, 214.101]
  - - [1, 704, 1, 1]
    - [62, 0.0772692]
  - - [5056, 448, 1, 3328]
    - [33, 10151.9]
  - - [3584, 64, 1, 256]
    - [4, 4478.53]
  - - [64, 1856, 1, 32]
    - [42, 277.371]
  - - [64, 1856, 1, 3328]
    - [21, 4842.62]
  - - [2560, 6400, 1, 2560]
    - [36, 9820.01]
  - - [6784, 3584, 1, 32]
    - [43, 4028.87]
  - - [4288, 1856, 1, 256]
    - [33, 10739.5]
  - - [1856, 2944, 1, 256]
    - [33, 10650.4]
  - - [128, 448, 1, 1]
    - [62, 5.3388]
  - - [64, 128, 1, 32]
    - [42, 19.129]
  - - [704, 1, 1, 1280]
    - [69, 8.4185]
  - - [2560, 1600, 1, 2560]
    - [33, 10198.3]
  - - [2944, 5888, 1, 1]
    - [61, 218.902]
  - - [1024, 1856, 1, 3328]
    - [33, 9718.29]
  - - [5888, 1024, 1, 32]
    - [49, 3449.79]
  - - [3584, 256, 1, 1280]
    - [36, 8537.37]
  - - [1024, 1, 1, 1]
    - [64, 0.119174]
  - - [1408, 5056, 1, 1280]
    - [34, 10488.5]
  - - [3584, 128, 1, 1280]
    - [17, 7252.46]
  - - [5056, 6784, 1, 256]
    - [33, 10570.4]
  - - [256, 1856, 1, 256]
    - [33, 6339.93]
  - - [5888, 32, 1, 1280]
    - [51, 1909.51]
  - - [256, 128, 1, 32]
    - [50, 90.7387]
  - - [32, 1856, 1, 1280]
    - [51, 771.622]
  - - [2944, 5056, 1, 1]
    - [56, 214.22]
  - - [448, 128, 1, 1]
    - [62, 5.41364]
  - - [256, 704, 1, 32]
    - [42, 403.397]
  - - [256, 704, 1, 1280]
    - [26, 4654.98]
  - - [1, 2368, 1, 1]
    - [57, 0.257798]
  - - [5888, 5888, 1, 1280]
    - [18, 9715.73]
  - - [256, 2944, 1, 1280]
    - [33, 8763.73]
  - - [2944, 256, 1, 3328]
    - [33, 9036.42]
  - - [5056, 2944, 1, 1280]
    - [33, 10551.0]
  - - [704, 1024, 1, 3328]
    - [33, 7859.09]
  - - [2368, 1856, 1, 1280]
    - [33, 10627.4]
  - - [448, 2944, 1, 1]
    - [61, 106.618]
  - - [6784, 2944, 1, 1]
    - [56, 220.635]
  - - [2944, 1024, 1, 32]
    - [41, 2973.26]
  - - [2944, 1024, 1, 1280]
    - [18, 10464.3]
  - - [1408, 64, 1, 32]
    - [42, 212.716]
  - - [5056, 5056, 1, 1]
    - [58, 223.505]
  - - [2368, 4288, 1, 256]
    - [33, 11007.2]
  - - [448, 1856, 1, 1280]
    - [36, 7666.82]
  - - [2368, 448, 1, 1]
    - [62, 94.8428]
  - - [448, 2944, 1, 32]
    - [49, 2182.95]
  - - [448, 2944, 1, 1280]
    - [33, 8688.55]
  - - [2944, 6784, 1, 1280]
    - [33, 10231.7]
  - - [2048, 64, 1, 2048]
    - [10, 2562.76]
  - - [256, 6784, 1, 1280]
    - [33, 9115.83]
  - - [128, 2368, 1, 1280]
    - [0, 5290.39]
  - - [3584, 2368, 1, 32]
    - [46, 3583.79]
  - - [16384, 1600, 1, 4096]
    - [36, 8458.73]
  - - [704, 32, 1, 32]
    - [42, 57.2458]
  - - [6784, 3584, 1, 3328]
    - [35, 9480.21]
  - - [128, 32, 1, 256]
    - [51, 35.0378]
  - - [128, 1408, 1, 1280]
    - [24, 5022.85]
  - - [64, 32, 1, 1280]
    - [51, 25.7746]
  - - [128, 1856, 1, 3328]
    - [26, 6391.09]
  - - [2944, 2944, 1, 256]
    - [33, 10751.1]
  - - [1408, 1024, 1, 3328]
    - [32, 9395.81]
  - - [1760, 64, 1, 1760]
    - [21, 4430.88]
  - - [5056, 2368, 1, 1280]
    - [33, 10320.3]
  - - [448, 128, 1, 32]
    - [40, 133.179]
  - - [2368, 64, 1, 3328]
    - [24, 4863.37]
  - - [32, 5056, 1, 3328]
    - [51, 1715.95]
  - - [448, 2944, 1, 3328]
    - [33, 8889.01]
  - - [2944, 1024, 1, 1]
    - [56, 159.594]
  - - [2048, 400, 1, 512]
    - [36, 7113.21]
  - - [2368, 128, 1, 1280]
    - [7, 5089.87]
  - - [2048, 1600, 1, 2048]
    - [37, 7578.55]
  - - [3584, 704, 1, 256]
    - [33, 9592.6]
  - - [2368, 5888, 1, 3328]
    - [33, 9525.12]
  - - [4288, 2368, 1, 1]
    - [56, 201.876]
  - - [1408, 3584, 1, 32]
    - [46, 3263.36]
  - - [2944, 4288, 1, 32]
    - [43, 3776.55]
  - - [5888, 1408, 1, 1280]
    - [34, 10647.5]
  - - [3584, 5056, 1, 1280]
    - [33, 10071.6]
  - - [5888, 6784, 1, 1280]
    - [36, 9776.25]
  - - [64, 1856, 1, 1]
    - [62, 11.2923]
  - - [704, 128, 1, 32]
    - [42, 212.716]
  - - [3584, 2944, 1, 1]
    - [56, 201.182]
  - - [128, 3584, 1, 3328]
    - [4, 7610.84]
  - - [256, 4288, 1, 3328]
    - [33, 8248.39]
  - - [4288, 64, 1, 1]
    - [62, 37.8032]
  - - [1, 1408, 1, 1280]
    - [64, 16.5958]
  - - [5056, 32, 1, 1280]
    - [51, 1647.43]
  - - [1856, 704, 1, 32]
    - [46, 2371.64]
  - - [1024, 1856, 1, 1]
    - [61, 129.58]
  - - [704, 5056, 1, 3328]
    - [33, 9984.55]
  - - [1024, 3584, 1, 3328]
    - [33, 10349.0]
  - - [5888, 256, 1, 3328]
    - [31, 9739.54]
  - - [2048, 7000, 1, 2048]
    - [39, 8263.63]
  - - [1856, 1408, 1, 1]
    - [56, 154.051]
  - - [2944, 448, 1, 32]
    - [46, 2199.85]
  - - [128, 448, 1, 256]
    - [24, 1869.48]
  - - [128, 1024, 1, 1]
    - [62, 12.4605]
  - - [32, 32, 1, 256]
    - [51, 8.93637]
  - - [4288, 5056, 1, 1280]
    - [33, 10013.9]
  - - [1856, 1856, 1, 3328]
    - [33, 9604.07]
  - - [1024, 2368, 1, 256]
    - [33, 9198.65]
  - - [4288, 2368, 1, 3328]
    - [33, 9610.53]
  - - [256, 64, 1, 32]
    - [51, 59.4768]
  - - [1, 1024, 1, 1280]
    - [69, 12.1944]
  - - [8448, 12000, 1, 2816]
    - [36, 9552.25]
  - - [5056, 128, 1, 32]
    - [46, 1625.41]
  - - [5888, 3584, 1, 256]
    - [33, 11259.6]
  - - [1024, 5056, 1, 32]
    - [49, 3313.4]
  - - [5888, 448, 1, 1280]
    - [33, 9704.1]
  - - [704, 5888, 1, 3328]
    - [34, 10215.4]
  - - [1024, 48000, 1, 1536]
    - [36, 9770.7]
  - - [1024, 1408, 1, 256]
    - [33, 8430.86]
  - - [8192, 1600, 1, 2048]
    - [39, 8192.26]
  - - [3584, 2944, 1, 1280]
    - [33, 10600.6]
  - - [1, 5056, 1, 256]
    - [64, 39.532]
  - - [256, 1024, 1, 1]
    - [59, 38.4657]
  - - [32, 32, 1, 3328]
    - [51, 14.4533]
  - - [4096, 800, 1, 1024]
    - [34, 7820.62]
  - - [2368, 1, 1, 3328]
    - [64, 30.0696]
  - - [4288, 1856, 1, 1280]
    - [33, 10467.3]
  - - [3584, 5888, 1, 1]
    - [61, 222.212]
  - - [8448, 16, 1, 2816]
    - [22, 3402.9]
  - - [5888, 4288, 1, 256]
    - [36, 10870.0]
  - - [1024, 2944, 1, 1280]
    - [33, 10672.3]
  - - [6784, 1, 1, 1]
    - [57, 1.10336]
  - - [1408, 64, 1, 1280]
    - [24, 3621.11]
  - - [1, 256, 1, 1280]
    - [69, 3.03606]
  - - [2944, 3584, 1, 256]
    - [33, 10901.1]
  - - [1, 128, 1, 1280]
    - [69, 1.51388]
  - - [1024, 256, 1, 32]
    - [48, 905.946]
  - - [5888, 1, 1, 1280]
    - [64, 56.523]
  - - [2368, 32, 1, 1280]
    - [51, 975.684]
  - - [5888, 1856, 1, 1]
    - [56, 202.367]
  - - [6784, 128, 1, 1280]
    - [5, 8088.74]
  - - [6784, 2368, 1, 3328]
    - [35, 9440.71]
  - - [1, 64, 1, 256]
    - [64, 0.543425]
  - - [704, 128, 1, 1]
    - [62, 8.27513]
  - - [1408, 4288, 1, 32]
    - [40, 3391.56]
  - - [256, 64, 1, 1280]
    - [21, 815.87]
  - - [256, 448, 1, 256]
    - [3, 3048.82]
  - - [1856, 1024, 1, 1280]
    - [18, 9585.6]
  - - [5888, 1856, 1, 256]
    - [33, 11033.1]
  - - [512, 48000, 1, 1536]
    - [36, 9892.29]
  - - [8448, 5984, 1, 2816]
    - [36, 9549.71]
  - - [5056, 1856, 1, 1]
    - [61, 195.19]
  - - [5888, 2368, 1, 256]
    - [33, 11059.1]
  - - [1408, 1024, 1, 32]
    - [49, 2386.33]
  - - [32, 704, 1, 256]
    - [51, 192.233]
  - - [2944, 1, 1, 256]
    - [64, 25.3086]
  - - [32, 4288, 1, 256]
    - [51, 1129.06]
  - - [5056, 1856, 1, 32]
    - [49, 3622.64]
  - - [5056, 1856, 1, 1280]
    - [33, 10575.9]
  - - [1, 64, 1, 1]
    - [67, 0.00685702]
  - - [1408, 5888, 1, 3328]
    - [35, 9899.12]
  - - [1408, 704, 1, 3328]
    - [27, 9187.66]
  - - [5056, 704, 1, 3328]
    - [33, 10011.4]
  - - [704, 64, 1, 1280]
    - [21, 2132.99]
  - - [1, 704, 1, 1280]
    - [64, 8.38372]
  - - [5888, 6784, 1, 1]
    - [61, 231.628]
  - - [5888, 4288, 1, 32]
    - [43, 4015.72]
  - - [1408, 3584, 1, 256]
    - [33, 10288.7]
  - - [1856, 704, 1, 1]
    - [62, 109.556]
  - - [6784, 256, 1, 1]
    - [57, 124.705]
  - - [2944, 1, 1, 1]
    - [62, 0.336804]
  - - [256, 1856, 1, 3328]
    - [26, 7947.21]
  - - [4288, 128, 1, 1280]
    - [33, 6421.16]
  - - [6784, 256, 1, 1280]
    - [33, 10009.8]
  - - [2048, 32, 1, 2048]
    - [21, 1632.32]
  - - [128, 4288, 1, 256]
    - [33, 5662.15]
  - - [128, 128, 1, 32]
    - [52, 56.6216]
  - - [128, 1408, 1, 32]
    - [42, 401.32]
  - - [1760, 3200, 1, 1760]
    - [33, 10523.1]
  - - [6784, 128, 1, 32]
    - [49, 1913.86]
  - - [1408, 448, 1, 1]
    - [59, 71.558]
  - - [2368, 704, 1, 3328]
    - [33, 9043.19]
  - - [704, 128, 1, 3328]
    - [24, 3934.31]
  - - [2944, 1856, 1, 32]
    - [46, 3376.82]
  - - [1024, 64, 1, 1]
    - [62, 6.31916]
  - - [1408, 32, 1, 1280]
    - [51, 584.053]
  - - [704, 1, 1, 256]
    - [64, 6.14386]
  - - [2368, 1408, 1, 256]
    - [33, 10028.2]
  - - [2368, 1856, 1, 1]
    - [61, 163.895]
  - - [4288, 1408, 1, 1]
    - [61, 181.929]
  - - [3584, 2368, 1, 1280]
    - [33, 10842.0]
  - - [64, 5056, 1, 1280]
    - [0, 5412.73]
  - - [1408, 2944, 1, 1]
    - [58, 166.542]
  - - [4288, 1408, 1, 32]
    - [40, 3400.42]
  - - [5888, 2944, 1, 256]
    - [33, 11157.6]
  - - [128, 64, 1, 1280]
    - [3, 374.485]
  - - [1408, 2944, 1, 32]
    - [46, 3191.88]
  - - [1, 3584, 1, 1280]
    - [69, 42.1291]
  - - [64, 64, 1, 32]
    - [42, 9.72236]
  - - [448, 1408, 1, 32]
    - [49, 1584.26]
  - - [128, 5056, 1, 256]
    - [33, 6578.06]
  - - [1, 1, 1, 1280]
    - [64, 0.0126497]
  - - [8448, 24000, 1, 2816]
    - [36, 9511.31]
  - - [64, 704, 1, 256]
    - [3, 1541.71]
  - - [3072, 128, 1, 1024]
    - [28, 5103.89]
  - - [5888, 6784, 1, 256]
    - [33, 10895.2]
  - - [6784, 5888, 1, 1]
    - [61, 230.244]
  - - [1024, 16, 1, 500000]
    - [10, 850.706]
  - - [64, 4288, 1, 256]
    - [1, 4001.74]
  - - [1, 448, 1, 1280]
    - [64, 5.28049]
  - - [1024, 1024, 1, 1]
    - [56, 103.323]
  - - [6784, 5888, 1, 1280]
    - [36, 9725.98]
  - - [1024, 4288, 1, 32]
    - [49, 3198.7]
  - - [1856, 1, 1, 1280]
    - [64, 22.0115]
  - - [3584, 5888, 1, 256]
    - [33, 11264.8]
  - - [5056, 2368, 1, 1]
    - [63, 205.107]
  - - [256, 1408, 1, 1280]
    - [26, 5837.25]
  - - [2560, 16, 1, 2560]
    - [21, 1796.35]
  - - [64, 256, 1, 32]
    - [42, 38.4657]
  - - [64, 5888, 1, 3328]
    - [7, 6476.57]
  - - [6784, 64, 1, 3328]
    - [26, 7216.44]
  - - [5056, 448, 1, 1]
    - [57, 137.12]
  - - [2944, 448, 1, 3328]
    - [31, 8735.67]
  - - [2368, 1024, 1, 1280]
    - [33, 10164.9]
  - - [1856, 6784, 1, 256]
    - [33, 10985.5]
  - - [4288, 32, 1, 1280]
    - [51, 1402.14]
  - - [448, 1408, 1, 1280]
    - [33, 7369.54]
  - - [5056, 448, 1, 32]
    - [46, 2779.78]
  - - [3584, 2944, 1, 32]
    - [49, 3684.73]
  - - [2368, 128, 1, 1]
    - [64, 41.3314]
  - - [32, 128, 1, 1280]
    - [51, 52.3108]
  - - [3584, 1856, 1, 32]
    - [46, 3462.08]
  - - [128, 128, 1, 3328]
    - [21, 859.902]
  - - [5056, 64, 1, 256]
    - [7, 4491.05]
  - - [64, 448, 1, 3328]
    - [21, 1503.07]
  - - [4288, 1408, 1, 1280]
    - [33, 10817.6]
  - - [6784, 2368, 1, 1]
    - [61, 213.871]
  - - [32, 5056, 1, 256]
    - [51, 1334.45]
  - - [704, 128, 1, 256]
    - [24, 2511.42]
  - - [704, 5056, 1, 1]
    - [56, 156.517]
  - - [256, 1024, 1, 32]
    - [44, 905.946]
  - - [256, 1024, 1, 1280]
    - [26, 6545.8]
  - - [2368, 128, 1, 256]
    - [7, 4275.42]
  - - [32, 64, 1, 256]
    - [51, 17.137]
  - - [2368, 1408, 1, 1280]
    - [33, 10940.4]
  - - [128, 256, 1, 32]
    - [42, 76.5133]
  - - [64, 6784, 1, 32]
    - [49, 1258.82]
  - - [6784, 32, 1, 256]
    - [51, 1761.11]
  - - [256, 4288, 1, 1]
    - [62, 98.1385]
  - - [5888, 1408, 1, 1]
    - [61, 197.732]
  - - [1024, 4288, 1, 1280]
    - [35, 10325.6]
  - - [1856, 4288, 1, 1]
    - [58, 191.853]
  - - [128, 2944, 1, 256]
    - [7, 5337.3]
  - - [3584, 4288, 1, 256]
    - [33, 11162.4]
  - - [2368, 2944, 1, 256]
    - [33, 10741.1]
  - - [3584, 128, 1, 32]
    - [44, 1330.02]
  - - [3584, 128, 1, 3328]
    - [26, 7624.92]
  - - [704, 5056, 1, 256]
    - [33, 10025.2]
  - - [1856, 4288, 1, 32]
    - [49, 3555.32]
  - - [64, 256, 1, 1280]
    - [21, 811.183]
  - - [4288, 1024, 1, 1280]
    - [33, 11198.9]
  - - [1, 4288, 1, 256]
    - [64, 34.145]
  - - [64, 2368, 1, 1]
    - [62, 14.0131]
  - - [4288, 6784, 1, 32]
    - [40, 4072.07]
  - - [704, 704, 1, 3328]
    - [33, 8186.15]
  - - [128, 2944, 1, 1]
    - [57, 49.8752]
  - - [3584, 1408, 1, 256]
    - [33, 10313.0]
  - - [704, 3584, 1, 3328]
    - [33, 10113.8]
  - - [5056, 448, 1, 1280]
    - [33, 10390.1]
  - - [1408, 2944, 1, 1280]
    - [36, 11123.7]
  - - [5888, 704, 1, 1280]
    - [33, 11193.3]
  - - [64, 64, 1, 256]
    - [8, 133.543]
  - - [704, 1408, 1, 1280]
    - [27, 8981.6]
  - - [4288, 5888, 1, 256]
    - [33, 11286.2]
  - - [6784, 64, 1, 32]
    - [44, 1258.77]
  - - [3584, 3584, 1, 3328]
    - [33, 9574.5]
  - - [2944, 6784, 1, 32]
    - [43, 3983.23]
  - - [448, 64, 1, 32]
    - [45, 79.9115]
  - - [5056, 256, 1, 1]
    - [57, 108.531]
  - - [64, 6784, 1, 1280]
    - [17, 6882.85]
  - - [2944, 2368, 1, 3328]
    - [33, 10082.4]
  - - [1, 4288, 1, 1]
    - [57, 0.697406]
  - - [1408, 128, 1, 256]
    - [17, 3663.73]
  - - [1024, 1856, 1, 1280]
    - [18, 9358.88]
  - - [448, 5888, 1, 256]
    - [33, 9245.45]
  - - [1024, 5888, 1, 256]
    - [33, 10746.1]
  - - [704, 1408, 1, 256]
    - [33, 8022.49]
  - - [6784, 2944, 1, 3328]
    - [36, 9449.11]
  - - [1408, 2368, 1, 256]
    - [33, 10010.8]
  - - [64, 128, 1, 1280]
    - [3, 375.47]
  - - [1024, 8, 1, 500000]
    - [10, 425.347]
  - - [5888, 32, 1, 3328]
    - [51, 2002.58]
  - - [1408, 5056, 1, 256]
    - [33, 10636.4]
  - - [1024, 1408, 1, 32]
    - [46, 2395.5]
  - - [4288, 128, 1, 32]
    - [51, 1403.02]
  - - [6784, 704, 1, 1]
    - [61, 164.054]
  - - [448, 704, 1, 256]
    - [30, 4359.87]
  - - [704, 3584, 1, 32]
    - [42, 2780.51]
  - - [1856, 256, 1, 3328]
    - [33, 7868.12]
  - - [448, 1024, 1, 1280]
    - [33, 7305.97]
  - - [4288, 4288, 1, 1]
    - [58, 216.972]
  - - [5056, 2944, 1, 1]
    - [56, 213.311]
  - - [64, 2368, 1, 3328]
    - [21, 4880.8]
  - - [256, 704, 1, 3328]
    - [26, 4880.55]
  - - [1, 2944, 1, 1]
    - [62, 0.315423]
  - - [1024, 1024, 1, 256]
    - [36, 8546.59]
  - - [2560, 64, 1, 2560]
    - [26, 4309.08]
  - - [3584, 1, 1, 1]
    - [62, 0.604792]
  - - [256, 2944, 1, 32]
    - [49, 1860.4]
  - - [6784, 4288, 1, 3328]
    - [18, 9476.02]
  - - [5056, 2944, 1, 3328]
    - [33, 9661.0]
  - - [1760, 128, 1, 1760]
    - [26, 5888.32]
  - - [704, 1024, 1, 1280]
    - [33, 8388.34]
  - - [256, 3584, 1, 1280]
    - [36, 8523.65]
  - - [2368, 1856, 1, 3328]
    - [33, 9930.21]
  - - [1856, 4288, 1, 1280]
    - [33, 10321.1]
  - - [1, 1024, 1, 256]
    - [64, 8.80298]
  - - [3584, 448, 1, 1]
    - [64, 116.536]
  - - [2944, 1024, 1, 3328]
    - [35, 10059.3]
  - - [32, 1408, 1, 3328]
    - [51, 624.564]
  - - [128, 1, 1, 3328]
    - [69, 1.61943]
  - - [5888, 5056, 1, 32]
    - [43, 4058.1]
  - - [704, 2944, 1, 1]
    - [56, 138.513]
  - - [3584, 448, 1, 32]
    - [49, 2425.2]
  - - [3584, 448, 1, 1280]
    - [33, 8311.68]
  - - [2944, 6784, 1, 3328]
    - [36, 9367.12]
  - - [1856, 2368, 1, 1280]
    - [33, 11227.6]
  - - [6784, 1024, 1, 1280]
    - [33, 10539.7]
  - - [512, 16, 1, 500000]
    - [10, 425.226]
  - - [6784, 3584, 1, 1280]
    - [33, 9966.32]
  - - [1, 5056, 1, 3328]
    - [64, 46.4993]
  - - [128, 128, 1, 1]
    - [66, 2.51346]
  - - [128, 2368, 1, 32]
    - [49, 915.636]
  - - [128, 1408, 1, 3328]
    - [21, 5295.51]
  - - [2944, 32, 1, 3328]
    - [51, 1325.54]
  - - [704, 1856, 1, 256]
    - [33, 8683.69]
  - - [1408, 1408, 1, 1]
    - [56, 135.16]
  - - [1408, 4288, 1, 256]
    - [33, 10406.5]
  - - [6144, 24000, 1, 2048]
    - [36, 9246.28]
  - - [256, 5056, 1, 3328]
    - [33, 9709.46]
  - - [2368, 64, 1, 1280]
    - [24, 4522.83]
  - - [1856, 448, 1, 32]
    - [46, 1832.67]
  - - [1408, 448, 1, 256]
    - [33, 6430.55]
  - - [32, 128, 1, 256]
    - [51, 34.3576]
  - - [448, 1024, 1, 1]
    - [57, 58.9807]
  - - [128, 1024, 1, 1280]
    - [24, 4808.6]
  - - [448, 6784, 1, 1]
    - [56, 149.194]
  - - [704, 2944, 1, 256]
    - [34, 9375.11]
  - - [1408, 1408, 1, 256]
    - [36, 9208.55]
  - - [448, 6784, 1, 32]
    - [51, 2924.1]
  - - [7680, 12000, 1, 2560]
    - [36, 9526.76]
  - - [5124, 9124, 1, 1760]
    - [32, 9404.03]
  - - [1, 64, 1, 1280]
    - [69, 0.756421]
  - - [1408, 1856, 1, 1]
    - [57, 144.582]
  - - [4288, 448, 1, 32]
    - [46, 2634.47]
  - - [4288, 448, 1, 1280]
    - [33, 9800.48]
  - - [2944, 704, 1, 32]
    - [46, 2824.39]
  - - [1024, 704, 1, 256]
    - [33, 7284.65]
  - - [448, 4288, 1, 1]
    - [61, 130.971]
  - - [3584, 5056, 1, 1]
    - [58, 219.589]
  - - [1408, 3584, 1, 1280]
    - [18, 10822.5]
  - - [6784, 448, 1, 1280]
    - [33, 10528.5]
  - - [3584, 5056, 1, 3328]
    - [34, 9509.07]
  - - [2368, 2368, 1, 32]
    - [49, 3359.69]
  - - [64, 5888, 1, 32]
    - [44, 1099.89]
  - - [1856, 448, 1, 256]
    - [33, 6857.96]
  - - [128, 1024, 1, 256]
    - [3, 3330.63]
  - - [3584, 64, 1, 3328]
    - [26, 6144.93]
  - - [5888, 2944, 1, 32]
    - [40, 3910.28]
  - - [2944, 1, 1, 1280]
    - [64, 35.4747]
  - - [1856, 2944, 1, 32]
    - [46, 3372.0]
  - - [5056, 1408, 1, 1]
    - [61, 188.434]
  - - [5888, 1408, 1, 3328]
    - [33, 9901.75]
  - - [448, 4288, 1, 256]
    - [18, 8712.36]
  - - [6784, 1024, 1, 1]
    - [58, 186.81]
  - - [256, 448, 1, 1]
    - [62, 10.6045]
  - - [128, 5888, 1, 3328]
    - [33, 9048.5]
  - - [6784, 1024, 1, 32]
    - [49, 3489.47]
  - - [256, 448, 1, 32]
    - [42, 260.756]
  - - [6784, 3584, 1, 1]
    - [58, 225.431]
  - - [2944, 2368, 1, 32]
    - [49, 3526.41]
  - - [3584, 6784, 1, 3328]
    - [34, 9492.97]
  - - [16384, 800, 1, 4096]
    - [36, 7622.48]
  - - [448, 128, 1, 1280]
    - [21, 2607.56]
  - - [64, 3584, 1, 32]
    - [44, 774.142]
  - - [64, 3584, 1, 1280]
    - [26, 5719.32]
  - - [6784, 1408, 1, 256]
    - [33, 10912.5]
  - - [5056, 1024, 1, 32]
    - [40, 3313.4]
  - - [1024, 5056, 1, 1280]
    - [33, 11153.4]
  - - [4288, 3584, 1, 256]
    - [33, 11160.0]
  - - [4608, 48000, 1, 1536]
    - [36, 9566.81]
  - - [2368, 256, 1, 3328]
    - [33, 7305.47]
  - - [448, 6784, 1, 1280]
    - [18, 10022.2]
  - - [1856, 5888, 1, 1]
    - [61, 207.491]
  - - [256, 5888, 1, 32]
    - [46, 2475.85]
  - - [3584, 1, 1, 3328]
    - [69, 46.5098]
  - - [4288, 32, 1, 256]
    - [51, 1165.12]
  - - [256, 64, 1, 1]
    - [69, 2.51346]
  - - [4288, 5056, 1, 32]
    - [43, 3956.71]
  - - [4288, 5056, 1, 3328]
    - [18, 9475.2]
  - - [1856, 5888, 1, 32]
    - [43, 3797.93]
  - - [1856, 5888, 1, 1280]
    - [33, 10559.9]
  - - [256, 256, 1, 1280]
    - [21, 3019.82]
  - - [704, 2368, 1, 1280]
    - [33, 9602.02]
  - - [4288, 2368, 1, 1280]
    - [35, 10351.3]
  - - [2944, 5056, 1, 256]
    - [33, 11197.3]
  - - [512, 8, 1, 500000]
    - [10, 212.603]
  - - [32, 1856, 1, 256]
    - [51, 505.548]
  - - [64, 5888, 1, 1280]
    - [7, 6254.96]
  - - [1, 1856, 1, 1280]
    - [64, 22.1942]
  - - [2944, 4288, 1, 1]
    - [58, 206.816]
  - - [5056, 5888, 1, 32]
    - [40, 4070.95]
  - - [704, 1, 1, 3328]
    - [69, 8.92698]
  - - [448, 256, 1, 1280]
    - [24, 4271.0]
  - - [1408, 256, 1, 1]
    - [57, 48.1786]
  - - [2368, 5056, 1, 3328]
    - [33, 9719.86]
  - - [1024, 5056, 1, 3328]
    - [33, 10180.8]
  - - [704, 704, 1, 1280]
    - [33, 7929.61]
  - - [128, 32, 1, 3328]
    - [51, 56.172]
  - - [1024, 6784, 1, 32]
    - [46, 3469.29]
  - - [3072, 64, 1, 1024]
    - [11, 3401.51]
  - - [3584, 2944, 1, 3328]
    - [33, 9757.38]
  - - [128, 1856, 1, 256]
    - [17, 4773.36]
  - - [32, 32, 1, 1280]
    - [51, 13.5692]
  - - [1408, 5888, 1, 1]
    - [61, 198.43]
  - - [1, 3584, 1, 256]
    - [64, 29.6313]
  - - [704, 4288, 1, 32]
    - [51, 2897.9]
  - - [1408, 5888, 1, 32]
    - [40, 3654.38]
  - - [6784, 1024, 1, 3328]
    - [33, 9898.4]
  - - [7680, 24000, 1, 2560]
    - [36, 9525.36]
  - - [1856, 1, 1, 3328]
    - [69, 23.9678]
  - - [5056, 1408, 1, 256]
    - [33, 10631.8]
  - - [1, 1, 1, 256]
    - [64, 0.00888395]
  - - [2944, 1408, 1, 256]
    - [36, 10373.1]
  - - [4288, 1, 1, 1]
    - [64, 0.723591]
  - - [2368, 2368, 1, 256]
    - [33, 10463.6]
  - - [1, 448, 1, 256]
    - [64, 3.78546]
  - - [1408, 6784, 1, 1]
    - [56, 200.228]
  - - [3584, 32, 1, 3328]
    - [51, 1608.16]
  - - [128, 3584, 1, 1]
    - [62, 58.4249]
  - - [1856, 1, 1, 256]
    - [64, 16.0354]
  - - [6784, 6784, 1, 1280]
    - [36, 9792.35]
  - - [1024, 5888, 1, 1]
    - [56, 182.494]
  - - [6784, 32, 1, 3328]
    - [51, 2291.6]
  - - [1408, 32, 1, 256]
    - [51, 387.331]
  - - [128, 3584, 1, 32]
    - [42, 1321.16]
  - - [1856, 3584, 1, 256]
    - [33, 10627.9]
  - - [2944, 64, 1, 256]
    - [4, 3830.26]
  - - [2368, 704, 1, 32]
    - [49, 2518.06]
  - - [256, 5888, 1, 1280]
    - [33, 9892.05]
  - - [448, 2368, 1, 32]
    - [46, 1992.53]
  - - [448, 2368, 1, 3328]
    - [33, 8002.17]
  - - [64, 1408, 1, 256]
    - [3, 2595.05]
  - - [5056, 32, 1, 32]
    - [48, 541.79]
  - - [1024, 704, 1, 3328]
    - [33, 7828.69]
  - - [32, 5888, 1, 3328]
    - [54, 1851.46]
  - - [256, 64, 1, 3328]
    - [21, 858.9]
  - - [32, 1408, 1, 1280]
    - [51, 584.493]
  - - [64, 32, 1, 256]
    - [51, 17.3899]
  - - [1856, 1024, 1, 3328]
    - [33, 9772.79]
  - - [2368, 1, 1, 1]
    - [64, 0.275589]
  - - [5056, 2368, 1, 3328]
    - [36, 9543.1]
  - - [128, 1, 1, 1280]
    - [69, 1.51284]
  - - [704, 4288, 1, 1280]
    - [18, 10501.8]
  - - [704, 256, 1, 256]
    - [17, 3685.39]
  - - [1024, 48000, 1, 2048]
    - [36, 8896.01]
- null
