library/src/blas3/Tensile/Logic/asm_full/vega10_Cijk_Ailk_Bjlk_HB.yaml
- {MinimumRequiredVersion: 4.3.0}
- vega10
- gfx900
- [Device 6863, Device 6862, Device 687f, Device 6860, Device 6861, 'Vega 10 XTX [Radeon
    SolutionIndex: 0
    SolutionNameMin: Cijk_Ailk_Bjlk_HB_MT032x016x08_GRVW02_PBC0_TT02_02_USFGRO00_VW02_WG16_08_01
    SolutionIndex: 1
    SolutionNameMin: Cijk_Ailk_Bjlk_HB_MT016x016x08_GRVW02_PBC0_TT02_02_USFGRO00_VW02_WG08_08_01
    SolutionIndex: 2
    SolutionNameMin: Cijk_Ailk_Bjlk_HB_MT016x016x32_GRVW02_PBC1_TT02_02_USFGRO01_VW02_WG08_08_01
    SolutionIndex: 3
    SolutionNameMin: Cijk_Ailk_Bjlk_HB_MT064x064x08_GRVW08_PBC0_TT08_08_USFGRO00_VW08_WG08_08_01
    SolutionIndex: 4
    SolutionNameMin: Cijk_Ailk_Bjlk_HB_MT016x016x16_GRVW02_PBC1_TT02_02_USFGRO01_VW02_WG08_08_01
    SolutionIndex: 5
    SolutionNameMin: Cijk_Ailk_Bjlk_HB_MT064x016x32_GRVW02_PBC1_TT02_02_USFGRO01_VW02_WG32_08_01
    SolutionIndex: 6
    SolutionNameMin: Cijk_Ailk_Bjlk_HB_MT032x016x64_GRVW02_PBC1_TT02_02_USFGRO01_VW02_WG16_08_01
    SolutionIndex: 7
    SolutionNameMin: Cijk_Ailk_Bjlk_HB_MT064x064x08_GRVW04_PBC0_TT04_04_USFGRO00_VW04_WG16_16_01
    SolutionIndex: 8
    SolutionNameMin: Cijk_Ailk_Bjlk_HB_MT064x064x16_GRVW04_PBC0_TT04_04_USFGRO00_VW04_WG16_16_01
    SolutionIndex: 9
    SolutionNameMin: Cijk_Ailk_Bjlk_HB_MT064x064x32_GRVW04_PBC0_TT04_04_USFGRO00_VW04_WG16_16_01
    SolutionIndex: 10
    SolutionNameMin: Cijk_Ailk_Bjlk_HB_MT064x128x16_GRVW04_PBC0_TT04_08_USFGRO00_VW04_WG16_16_01
    SolutionIndex: 11
    SolutionNameMin: Cijk_Ailk_Bjlk_HB_MT128x064x16_GRVW04_PBC0_TT08_04_USFGRO00_VW04_WG16_16_01
    SolutionIndex: 12
    SolutionNameMin: Cijk_Ailk_Bjlk_HB_MT064x064x16_GRVW04_PBC0_TT04_04_USFGRO00_VW04_WG16_16_01
    SolutionIndex: 13
    SolutionNameMin: Cijk_Ailk_Bjlk_HB_MT128x128x16_GRVW08_PBC0_TT08_08_USFGRO00_VW08_WG16_16_01
    SolutionIndex: 14
    SolutionNameMin: Cijk_Ailk_Bjlk_HB_MT064x128x08_GRVW04_PBC0_TT04_08_USFGRO00_VW04_WG16_16_01
- - - [4096, 7133, 1, 4096]
    - [13, 24093.3]
  - - [512, 16, 1, 512]
    - [4, 370.064]
  - - [2048, 7133, 1, 2048]
    - [13, 23988.6]
  - - [2560, 7133, 1, 2560]
    - [11, 23747.4]
  - - [1024, 1024, 1, 1024]
    - [12, 18278.6]
  - - [3072, 7435, 1, 1024]
    - [3, 24051.1]
  - - [1024, 32, 1, 512]
    - [5, 1606.32]
  - - [1760, 7133, 1, 1760]
    - [14, 22840.9]
  - - [7680, 5481, 1, 2560]
    - [10, 23835.9]
  - - [1024, 16, 1, 512]
    - [4, 735.359]
  - - [512, 32, 1, 512]
    - [6, 838.819]
- - - -1
    - - - 128
        - - - 4
            - - [-1, 1]
          - - 64
            - - [4, 1]
              - [64, 0]
              - [128, 1]
              - [5888, 0]
              - [-1, 8]
          - - 128
            - - [64, 1]
              - [128, 0]
              - [256, 1]
              - [704, 0]
              - [1024, 1]
              - [2944, 0]
              - [3584, 7]
              - [-1, 8]
          - - 256
            - - [4, 1]
              - [64, 0]
              - [128, 1]
              - [448, 0]
              - [1856, 7]
              - [3584, 8]
              - [-1, 7]
          - - 448
            - - [4, 1]
              - [64, 0]
              - [128, 1]
              - [448, 0]
              - [704, 7]
              - [1856, 8]
              - [2368, 7]
              - [2944, 8]
              - [5056, 7]
              - [-1, 8]
          - - 704
            - - [4, 1]
              - [128, 0]
              - [256, 7]
              - [1408, 8]
              - [1856, 7]
              - [2368, 8]
              - [2944, 7]
              - [3584, 8]
              - [-1, 7]
          - - 1024
            - - [64, 1]
              - [128, 0]
              - [448, 7]
              - [1408, 8]
              - [1856, 7]
              - [2944, 8]
              - [-1, 7]
          - - 1408
            - - [4, 1]
              - [128, 0]
              - [704, 8]
              - [-1, 7]
          - - 1856
            - - [4, 1]
              - [128, 0]
              - [448, 8]
              - [704, 7]
              - [1024, 8]
              - [2944, 7]
              - [3584, 8]
              - [-1, 7]
          - - 2368
            - - [4, 1]
              - [128, 0]
              - [256, 8]
              - [704, 7]
              - [1024, 8]
              - [-1, 7]
          - - 2944
            - - [4, 1]
              - [128, 0]
              - [256, 8]
              - [448, 7]
              - [704, 8]
              - [-1, 7]
          - - 3584
            - - [4, 1]
              - [64, 0]
              - [128, 7]
              - [704, 8]
              - [-1, 7]
          - - 4288
            - - [4, 1]
              - [64, 0]
              - [128, 8]
              - [5888, 7]
              - [-1, 8]
          - - 5056
            - - [4, 1]
              - [64, 0]
              - [128, 8]
              - [1408, 7]
              - [1856, 8]
              - [2368, 7]
              - [2944, 8]
              - [3584, 7]
              - [4288, 8]
              - [-1, 7]
          - - 5888
            - - [4, 1]
              - [64, 0]
              - [1408, 7]
              - [1856, 8]
              - [-1, 7]
          - - -1
            - - [4, 1]
              - [128, 8]
              - [704, 7]
              - [1024, 8]
              - [3584, 7]
              - [4288, 8]
              - [-1, 7]
      - - 256
        - - - 4
            - - [4, 4]
              - [64, 2]
              - [128, 4]
              - [256, 2]
              - [448, 4]
              - [704, 2]
              - [-1, 4]
          - - 64
            - - [64, 4]
              - [256, 5]
              - [3584, 4]
              - [-1, 12]
          - - 128
            - - [4, 2]
              - [64, 4]
              - [128, 5]
              - [1408, 4]
              - [1856, 5]
              - [-1, 12]
          - - 256
            - - [4, 2]
              - [64, 4]
              - [128, 5]
              - [448, 4]
              - [-1, 12]
          - - 448
            - - [4, 2]
              - [256, 4]
              - [448, 5]
              - [5888, 12]
              - [-1, 14]
          - - 704
            - - [4, 4]
              - [64, 2]
              - [128, 4]
              - [2368, 12]
              - [4288, 14]
              - [5056, 10]
              - [-1, 3]
          - - 1024
            - - [4, 4]
              - [64, 6]
              - [128, 4]
              - [1408, 12]
              - [2944, 11]
              - [3584, 10]
              - [4288, 12]
              - [5056, 3]
              - [-1, 13]
          - - 1408
            - - [128, 4]
              - [704, 12]
              - [1024, 11]
              - [1408, 10]
              - [1856, 11]
              - [2368, 12]
              - [2944, 13]
              - [3584, 14]
              - [4288, 3]
              - [5888, 13]
              - [-1, 11]
          - - 1856
            - - [128, 4]
              - [704, 12]
              - [1024, 10]
              - [1408, 14]
              - [1856, 10]
              - [2944, 12]
              - [3584, 10]
              - [5056, 3]
              - [5888, 14]
              - [-1, 3]
          - - 2368
            - - [64, 4]
              - [704, 12]
              - [1024, 14]
              - [1856, 12]
              - [2368, 11]
              - [2944, 3]
              - [3584, 10]
              - [5888, 3]
              - [-1, 13]
          - - 2944
            - - [64, 4]
              - [448, 12]
              - [704, 11]
              - [1024, 14]
              - [1408, 3]
              - [1856, 11]
              - [2368, 13]
              - [2944, 11]
              - [3584, 14]
              - [4288, 3]
              - [5056, 10]
              - [-1, 13]
          - - 3584
            - - [4, 4]
              - [64, 5]
              - [704, 12]
              - [1024, 10]
              - [1408, 3]
              - [2944, 11]
              - [4288, 13]
              - [5056, 3]
              - [-1, 13]
          - - 4288
            - - [4, 4]
              - [1024, 12]
              - [1856, 3]
              - [2368, 11]
              - [2944, 3]
              - [3584, 13]
              - [4288, 11]
              - [5056, 3]
              - [5888, 13]
              - [-1, 3]
          - - 5056
            - - [4, 4]
              - [704, 12]
              - [1024, 10]
              - [1856, 3]
              - [2368, 12]
              - [2944, 10]
              - [3584, 13]
              - [5056, 3]
              - [-1, 13]
          - - 5888
            - - [4, 4]
              - [448, 12]
              - [704, 11]
              - [1408, 13]
              - [1856, 11]
              - [2368, 3]
              - [4288, 13]
              - [5056, 3]
              - [5888, 13]
              - [-1, 10]
          - - -1
            - - [4, 4]
              - [704, 12]
              - [1024, 13]
              - [1408, 11]
              - [1856, 13]
              - [2368, 3]
              - [4288, 13]
              - [5888, 3]
              - [-1, 13]
      - - 1280
        - - - 4
            - - [4, 4]
              - [5888, 2]
              - [-1, 4]
          - - 64
            - - [4, 2]
              - [64, 4]
              - [448, 6]
              - [1408, 2]
              - [1856, 5]
              - [2368, 2]
              - [2944, 5]
              - [5888, 12]
              - [-1, 9]
          - - 128
            - - [4, 2]
              - [128, 6]
              - [448, 2]
              - [704, 6]
              - [1408, 5]
              - [-1, 12]
          - - 256
            - - [4, 2]
              - [256, 6]
              - [448, 5]
              - [704, 9]
              - [5056, 12]
              - [5888, 11]
              - [-1, 12]
          - - 448
            - - [4, 2]
              - [128, 6]
              - [256, 5]
              - [2368, 12]
              - [2944, 11]
              - [3584, 12]
              - [4288, 10]
              - [5888, 12]
              - [-1, 10]
          - - 704
            - - [64, 2]
              - [128, 6]
              - [2368, 12]
              - [3584, 10]
              - [5056, 14]
              - [5888, 3]
              - [-1, 12]
          - - 1024
            - - [64, 2]
              - [128, 5]
              - [1024, 12]
              - [2368, 11]
              - [2944, 13]
              - [3584, 11]
              - [4288, 12]
              - [5888, 13]
              - [-1, 11]
          - - 1408
            - - [64, 2]
              - [704, 12]
              - [1408, 11]
              - [2368, 12]
              - [4288, 13]
              - [5056, 3]
              - [5888, 13]
              - [-1, 10]
          - - 1856
            - - [4, 2]
              - [64, 5]
              - [448, 12]
              - [704, 9]
              - [1024, 10]
              - [1408, 14]
              - [1856, 11]
              - [2368, 12]
              - [3584, 10]
              - [4288, 13]
              - [5056, 3]
              - [5888, 10]
              - [-1, 11]
          - - 2368
            - - [64, 2]
              - [704, 12]
              - [1024, 10]
              - [1856, 12]
              - [2368, 10]
              - [2944, 13]
              - [3584, 10]
              - [4288, 3]
              - [5056, 13]
              - [-1, 10]
          - - 2944
            - - [4, 2]
              - [64, 5]
              - [128, 12]
              - [256, 9]
              - [704, 11]
              - [1024, 10]
              - [1408, 13]
              - [1856, 12]
              - [3584, 11]
              - [4288, 10]
              - [5056, 11]
              - [5888, 13]
              - [-1, 10]
          - - 3584
            - - [4, 2]
              - [704, 12]
              - [1024, 11]
              - [1408, 13]
              - [1856, 11]
              - [3584, 10]
              - [5056, 13]
              - [5888, 3]
              - [-1, 13]
          - - 4288
            - - [4, 2]
              - [256, 12]
              - [704, 11]
              - [1408, 10]
              - [1856, 13]
              - [2944, 11]
              - [3584, 13]
              - [5056, 3]
              - [5888, 11]
              - [-1, 3]
          - - 5056
            - - [4, 2]
              - [128, 12]
              - [256, 9]
              - [448, 12]
              - [704, 11]
              - [1024, 13]
              - [1856, 3]
              - [2368, 13]
              - [2944, 10]
              - [3584, 11]
              - [4288, 3]
              - [5056, 13]
              - [-1, 3]
          - - 5888
            - - [4, 2]
              - [128, 12]
              - [256, 10]
              - [448, 12]
              - [1024, 3]
              - [1856, 13]
              - [2368, 11]
              - [2944, 13]
              - [3584, 11]
              - [4288, 10]
              - [-1, 13]
          - - -1
            - - [4, 2]
              - [64, 12]
              - [128, 11]
              - [256, 12]
              - [448, 11]
              - [704, 12]
              - [1024, 3]
              - [1856, 11]
              - [2368, 3]
              - [2944, 14]
              - [3584, 13]
              - [5056, 3]
              - [-1, 13]
      - - -1
        - - - 4
            - - [5056, 2]
              - [-1, 4]
          - - 64
            - - [64, 2]
              - [128, 6]
              - [1024, 2]
              - [1856, 6]
              - [2368, 2]
              - [2944, 12]
              - [3584, 9]
              - [5056, 12]
              - [-1, 9]
          - - 128
            - - [4, 2]
              - [64, 6]
              - [448, 2]
              - [1024, 6]
              - [1408, 12]
              - [1856, 9]
              - [5888, 12]
              - [-1, 11]
          - - 256
            - - [256, 2]
              - [448, 5]
              - [2944, 12]
              - [3584, 11]
              - [5056, 12]
              - [5888, 11]
              - [-1, 12]
          - - 448
            - - [128, 2]
              - [256, 6]
              - [1408, 12]
              - [1856, 11]
              - [2368, 12]
              - [2944, 11]
              - [5888, 12]
              - [-1, 10]
          - - 704
            - - [64, 2]
              - [128, 6]
              - [448, 12]
              - [704, 9]
              - [1024, 12]
              - [1408, 10]
              - [2368, 12]
              - [2944, 10]
              - [3584, 14]
              - [5056, 10]
              - [5888, 3]
              - [-1, 13]
          - - 1024
            - - [64, 2]
              - [128, 5]
              - [448, 12]
              - [704, 9]
              - [1024, 10]
              - [1408, 11]
              - [1856, 10]
              - [2368, 11]
              - [2944, 13]
              - [3584, 10]
              - [4288, 12]
              - [5888, 13]
              - [-1, 10]
          - - 1408
            - - [4, 2]
              - [64, 6]
              - [256, 12]
              - [448, 9]
              - [704, 11]
              - [1024, 10]
              - [1408, 13]
              - [1856, 11]
              - [2368, 9]
              - [3584, 13]
              - [4288, 3]
              - [5056, 13]
              - [5888, 3]
              - [-1, 11]
          - - 1856
            - - [4, 2]
              - [64, 5]
              - [256, 12]
              - [448, 10]
              - [704, 12]
              - [1024, 11]
              - [1856, 10]
              - [2368, 12]
              - [3584, 10]
              - [4288, 13]
              - [5056, 3]
              - [5888, 14]
              - [-1, 11]
          - - 2368
            - - [4, 2]
              - [64, 4]
              - [704, 12]
              - [1024, 10]
              - [1856, 9]
              - [2368, 11]
              - [2944, 13]
              - [3584, 10]
              - [4288, 3]
              - [5056, 13]
              - [-1, 10]
          - - 2944
            - - [4, 2]
              - [128, 12]
              - [256, 9]
              - [1024, 11]
              - [1408, 3]
              - [1856, 12]
              - [2368, 13]
              - [5056, 10]
              - [5888, 13]
              - [-1, 11]
          - - 3584
            - - [4, 2]
              - [448, 12]
              - [1024, 11]
              - [1408, 13]
              - [2944, 11]
              - [3584, 10]
              - [4288, 13]
              - [-1, 10]
          - - 4288
            - - [4, 2]
              - [64, 12]
              - [128, 9]
              - [256, 12]
              - [704, 11]
              - [1024, 10]
              - [1408, 11]
              - [1856, 13]
              - [2368, 3]
              - [2944, 10]
              - [3584, 13]
              - [5056, 3]
              - [5888, 10]
              - [-1, 3]
          - - 5056
            - - [4, 2]
              - [448, 12]
              - [704, 11]
              - [1024, 13]
              - [1856, 3]
              - [2368, 13]
              - [2944, 14]
              - [3584, 10]
              - [4288, 3]
              - [5056, 13]
              - [5888, 10]
              - [-1, 3]
          - - 5888
            - - [4, 4]
              - [64, 12]
              - [128, 9]
              - [256, 11]
              - [448, 9]
              - [704, 11]
              - [1408, 13]
              - [2368, 11]
              - [3584, 13]
              - [5056, 11]
              - [-1, 13]
          - - -1
            - - [4, 4]
              - [64, 12]
              - [128, 10]
              - [256, 12]
              - [448, 11]
              - [704, 12]
              - [1024, 13]
              - [1408, 11]
              - [1856, 10]
              - [2944, 11]
              - [3584, 10]
              - [5056, 3]
              - [-1, 13]
