library/src/blas3/Tensile/Logic/asm_full/vega20_Cijk_Alik_Bjlk_4xi8BH.yaml
- {MinimumRequiredVersion: 4.6.0}
- vega20
- gfx906
- [Device 66a0, Device 66a1, Device 66a7]
    SolutionIndex: 0
    SolutionNameMin: Cijk_Alik_Bjlk_4xi8BH_MT064x032x08_DTL0_GSU01_NLCB01_TT04_02_USFGRO01_WG16_16_01
    SolutionIndex: 1
    SolutionNameMin: Cijk_Alik_Bjlk_4xi8BH_MT032x128x16_DTL0_GSU01_NLCB01_TT02_08_USFGRO01_WG16_16_01
    SolutionIndex: 2
    SolutionNameMin: Cijk_Alik_Bjlk_4xi8BH_MT064x016x16_DTL0_GSU01_NLCB01_TT08_02_USFGRO01_WG08_08_01
- - - [128, 128, 2, 65]
    - [0, 1283.08]
  - - [128, 1, 2, 64]
    - [2, 7.7283]
  - - [127, 127, 2, 1]
    - [1, 35.063]
  - - [129, 129, 2, 63]
    - [0, 1205.04]
  - - [127, 127, 2, 65]
    - [0, 1164.87]
  - - [1, 127, 2, 64]
    - [2, 7.52593]
  - - [1, 128, 2, 64]
    - [2, 7.58562]
  - - [128, 129, 2, 1]
    - [2, 35.8957]
  - - [1, 128, 2, 63]
    - [2, 7.33091]
  - - [127, 1, 2, 63]
    - [2, 7.40833]
  - - [129, 1, 2, 64]
    - [2, 7.86286]
  - - [128, 1, 2, 63]
    - [2, 7.53645]
  - - [1, 129, 2, 65]
    - [2, 7.48661]
  - - [127, 129, 2, 1]
    - [1, 34.8574]
  - - [128, 128, 2, 64]
    - [0, 1361.79]
  - - [128, 1, 2, 65]
    - [2, 7.4955]
  - - [1, 129, 2, 64]
    - [2, 7.78868]
  - - [1, 129, 2, 63]
    - [2, 7.32162]
  - - [1, 128, 2, 65]
    - [2, 7.36283]
  - - [129, 129, 2, 65]
    - [0, 1201.85]
  - - [128, 128, 2, 1]
    - [1, 40.96]
  - - [1, 1, 2, 1]
    - [1, 0.00149254]
  - - [129, 1, 2, 65]
    - [2, 7.55405]
  - - [127, 1, 2, 64]
    - [2, 7.74095]
  - - [127, 128, 2, 1]
    - [1, 36.1244]
  - - [129, 127, 2, 1]
    - [1, 34.1313]
  - - [127, 1, 2, 65]
    - [2, 7.50455]
  - - [128, 127, 2, 1]
    - [1, 36.1244]
  - - [127, 127, 2, 64]
    - [0, 1086.59]
  - - [1, 127, 2, 65]
    - [1, 7.24162]
  - - [129, 1, 2, 63]
    - [2, 7.38818]
  - - [129, 129, 2, 1]
    - [1, 34.6688]
  - - [129, 129, 2, 64]
    - [0, 1283.16]
  - - [127, 127, 2, 63]
    - [0, 907.256]
  - - [1, 127, 2, 63]
    - [2, 5.3698]
  - - [128, 128, 2, 63]
    - [0, 1258.77]
  - - [129, 128, 2, 1]
    - [1, 35.1319]
- null
