library/src/blas3/Tensile/Logic/asm_full/vega20_Cijk_Ailk_Bljk_HH.yaml
- {MinimumRequiredVersion: 4.18.0}
- vega20
- gfx906
- [Device 66a0, Device 66a1, Device 66a7, Vega 20]
- - - [64, 192, 64, 1280]
    - [0, 2013265920.0]
  - - [64, 320, 64, 1280]
    - [0, 3355443200.0]
  - - [64, 384, 64, 1280]
    - [0, 4026531840.0]
  - - [64, 448, 64, 1280]
    - [0, 4697620480.0]
  - - [64, 192, 64, 2048]
    - [0, 3221225472.0]
  - - [64, 320, 64, 2048]
    - [0, 5368709120.0]
  - - [64, 384, 64, 2048]
    - [0, 6442450944.0]
  - - [64, 448, 64, 2048]
    - [0, 7516192768.0]
  - - [3136, 256, 64, 64]
    - [0, 6576668672.0]
  - - [3136, 64, 64, 64]
    - [0, 1644167168.0]
  - - [3136, 64, 64, 256]
    - [0, 6576668672.0]
  - - [784, 512, 64, 128]
    - [0, 6576668672.0]
  - - [784, 128, 64, 512]
    - [0, 6576668672.0]
  - - [196, 1024, 64, 256]
    - [0, 6576668672.0]
  - - [196, 256, 64, 1024]
    - [0, 6576668672.0]
  - - [1225, 32, 64, 192]
    - [1, 963379200.0]
  - - [1225, 48, 64, 192]
    - [1, 1445068800.0]
  - - [1225, 64, 64, 192]
    - [1, 1926758400.0]
  - - [1225, 48, 64, 256]
    - [1, 1926758400.0]
  - - [1225, 64, 64, 256]
    - [1, 2569011200.0]
  - - [1225, 48, 64, 288]
    - [1, 2167603200.0]
  - - [1225, 64, 64, 288]
    - [1, 2890137600.0]
  - - [5329, 80, 64, 64]
    - [1, 3492413440.0]
  - - [289, 128, 64, 768]
    - [1, 3636461568.0]
  - - [289, 160, 64, 768]
    - [1, 4545576960.0]
  - - [289, 192, 64, 768]
    - [1, 5454692352.0]
  - - [49, 2048, 64, 512]
    - [1, 6576668672.0]
  - - [49, 512, 64, 2048]
    - [1, 6576668672.0]
- null
