library/src/blas3/Tensile/Logic/asm_full/vega20_Cijk_Ailk_Bjlk_DB.yaml
- {MinimumRequiredVersion: 4.3.0}
- vega20
- gfx906
- [Device 66a0, Device 66a1, Device 66a7]
    SolutionIndex: 0
    SolutionNameMin: Cijk_Ailk_Bjlk_DB_MT064x064x08_NLCA01_NLCB01_TT04_04_WG16_16_01
    SolutionIndex: 1
    SolutionNameMin: Cijk_Ailk_Bjlk_DB_MT064x064x08_NLCA01_NLCB01_TT04_04_WG16_16_01
    SolutionIndex: 2
    SolutionNameMin: Cijk_Ailk_Bjlk_DB_MT064x064x04_NLCA01_NLCB01_TT04_04_WG16_16_01
    SolutionIndex: 3
    SolutionNameMin: Cijk_Ailk_Bjlk_DB_MT064x064x04_NLCA01_NLCB01_TT04_04_WG16_16_01
    SolutionIndex: 4
    SolutionNameMin: Cijk_Ailk_Bjlk_DB_MT096x032x08_NLCA03_NLCB01_TT06_04_WG16_08_01
    SolutionIndex: 5
    SolutionNameMin: Cijk_Ailk_Bjlk_DB_MT064x032x08_NLCA01_NLCB01_TT04_04_WG16_08_01
- - - [2084, 2084, 1, 400]
    - [1, 3946.74]
  - - [1536, 1536, 1, 384]
    - [1, 4056.77]
  - - [2688, 2688, 1, 384]
    - [1, 4239.49]
  - - [1060, 1060, 1, 400]
    - [1, 3453.99]
  - - [5760, 5760, 1, 5760]
    - [1, 4448.24]
  - - [4132, 4132, 1, 400]
    - [1, 4232.0]
  - - [3840, 3840, 1, 384]
    - [1, 4276.09]
  - - [4224, 4224, 1, 384]
    - [1, 4291.93]
  - - [1152, 1152, 1, 384]
    - [1, 3454.45]
  - - [768, 768, 1, 384]
    - [4, 2923.2]
  - - [7744, 7744, 1, 7744]
    - [1, 4464.93]
  - - [3456, 3456, 1, 384]
    - [1, 4291.81]
  - - [384, 384, 1, 384]
    - [1, 1595.89]
  - - [36, 36, 1, 400]
    - [5, 14.9135]
  - - [2304, 2304, 1, 384]
    - [1, 4119.65]
  - - [3108, 3108, 1, 400]
    - [1, 4191.96]
  - - [1920, 1920, 1, 384]
    - [1, 3994.23]
  - - [3072, 3072, 1, 384]
    - [1, 4180.7]
- - - -1
    - - - 128
        - - - 1
            - - [-1, 2]
          - - -1
            - - [1, 2]
              - [-1, 0]
      - - -1
        - - - 1
            - - [-1, 3]
          - - -1
            - - [1, 3]
              - [-1, 1]
