library/src/blas3/Tensile/Logic/asm_full/vega10_Cijk_Ailk_Bljk_HB.yaml
- {MinimumRequiredVersion: 4.4.0}
- vega10
- gfx900
- [Device 6863, Device 6862, Device 687f, Device 6860, Device 6861, 'Vega 10 XTX [Radeon
    SolutionIndex: 0
    SolutionNameMin: Cijk_Ailk_Bljk_HB_MT064x016x32_PGR1_PLR1_TT02_02
    SolutionIndex: 1
    SolutionNameMin: Cijk_Ailk_Bljk_HB_MT064x064x16_PGR1_PLR1_TT04_04
    SolutionIndex: 2
    SolutionNameMin: Cijk_Ailk_Bljk_HB_MT064x008x64_PGR1_PLR1_TT02_02
    SolutionIndex: 3
    SolutionNameMin: Cijk_Ailk_Bljk_HB_MT016x016x08_PGR1_PLR1_TT02_02
    SolutionIndex: 4
    SolutionNameMin: Cijk_Ailk_Bljk_HB_MT016x016x16_PGR1_PLR1_TT02_02
    SolutionIndex: 5
    SolutionNameMin: Cijk_Ailk_Bljk_HB_MT032x008x32_PGR1_PLR1_TT02_02
    SolutionIndex: 6
    SolutionNameMin: Cijk_Ailk_Bljk_HB_MT256x064x08_PGR1_PLR1_TT08_08
    SolutionIndex: 7
    SolutionNameMin: Cijk_Ailk_Bljk_HB_MT032x016x16_PGR1_PLR1_TT02_02
    SolutionIndex: 8
    SolutionNameMin: Cijk_Ailk_Bljk_HB_MT064x016x16_PGR1_PLR1_TT04_02
    SolutionIndex: 9
    SolutionNameMin: Cijk_Ailk_Bljk_HB_MT064x008x32_PGR1_PLR1_TT02_02
    SolutionIndex: 10
    SolutionNameMin: Cijk_Ailk_Bljk_HB_MT064x016x16_PGR1_PLR1_TT04_04
    SolutionIndex: 11
    SolutionNameMin: Cijk_Ailk_Bljk_HB_MT048x032x24_PGR1_PLR1_TT06_04
    SolutionIndex: 12
    SolutionNameMin: Cijk_Ailk_Bljk_HB_MT032x032x24_PGR1_PLR1_TT04_04
    SolutionIndex: 13
    SolutionNameMin: Cijk_Ailk_Bljk_HB_MT032x016x24_PGR1_PLR1_TT04_02
    SolutionIndex: 14
    SolutionNameMin: Cijk_Ailk_Bljk_HB_MT032x016x16_PGR1_PLR1_TT02_02
    SolutionIndex: 15
    SolutionNameMin: Cijk_Ailk_Bljk_HB_MT032x008x32_PGR1_PLR1_TT02_02
    SolutionIndex: 16
    SolutionNameMin: Cijk_Ailk_Bljk_HB_MT064x008x64_PGR1_PLR1_TT02_02
    SolutionIndex: 17
    SolutionNameMin: Cijk_Ailk_Bljk_HB_MT032x016x24_PGR1_PLR1_TT04_02
    SolutionIndex: 18
    SolutionNameMin: Cijk_Ailk_Bljk_HB_MT064x008x32_PGR1_PLR1_TT02_02
    SolutionIndex: 19
    SolutionNameMin: Cijk_Ailk_Bljk_HB_MT128x032x32_PGR1_PLR1_TT04_04
    SolutionIndex: 20
    SolutionNameMin: Cijk_Ailk_Bljk_HB_MT064x016x16_PGR1_PLR1_TT04_02
    SolutionIndex: 21
    SolutionNameMin: Cijk_Ailk_Bljk_HB_MT016x016x24_PGR1_PLR1_TT02_02
    SolutionIndex: 22
    SolutionNameMin: Cijk_Ailk_Bljk_HB_MT064x016x16_PGR1_PLR1_TT04_04
    SolutionIndex: 23
    SolutionNameMin: Cijk_Ailk_Bljk_HB_MT064x016x32_PGR1_PLR1_TT02_02
    SolutionIndex: 24
    SolutionNameMin: Cijk_Ailk_Bljk_HB_MT128x032x16_PGR1_PLR1_TT04_04
    SolutionIndex: 25
    SolutionNameMin: Cijk_Ailk_Bljk_HB_MT128x064x32_PGR0_PLR1_TT08_04
    SolutionIndex: 26
    SolutionNameMin: Cijk_Ailk_Bljk_HB_MT064x128x16_PGR1_PLR1_TT04_08
    SolutionIndex: 27
    SolutionNameMin: Cijk_Ailk_Bljk_HB_MT064x064x16_PGR1_PLR1_TT04_04
    SolutionIndex: 28
    SolutionNameMin: Cijk_Ailk_Bljk_HB_MT128x064x16_PGR1_PLR1_TT08_04
    SolutionIndex: 29
    SolutionNameMin: Cijk_Ailk_Bljk_HB_MT128x128x32_PGR0_PLR1_TT08_08
    SolutionIndex: 30
    SolutionNameMin: Cijk_Ailk_Bljk_HB_MT128x128x32_PGR1_PLR1_TT08_08
    SolutionIndex: 31
    SolutionNameMin: Cijk_Ailk_Bljk_HB_MT128x064x32_PGR1_PLR1_TT08_04
    SolutionIndex: 32
    SolutionNameMin: Cijk_Ailk_Bljk_HB_MT128x064x08_PGR1_PLR1_TT08_04
    SolutionIndex: 33
    SolutionNameMin: Cijk_Ailk_Bljk_HB_MT128x128x16_PGR1_PLR1_TT08_08
    SolutionIndex: 34
    SolutionNameMin: Cijk_Ailk_Bljk_HB_MT128x064x08_PGR1_PLR1_TT04_08
    SolutionIndex: 35
    SolutionNameMin: Cijk_Ailk_Bljk_HB_MT064x064x16_PGR1_PLR1_TT04_04
    SolutionIndex: 36
    SolutionNameMin: Cijk_Ailk_Bljk_HB_MT128x064x16_PGR1_PLR1_TT04_08
    SolutionIndex: 37
    SolutionNameMin: Cijk_Ailk_Bljk_HB_MT128x064x16_PGR1_PLR1_TT04_08
    SolutionIndex: 38
    SolutionNameMin: Cijk_Ailk_Bljk_HB_MT256x064x16_PGR1_PLR1_TT08_04
    SolutionIndex: 39
    SolutionNameMin: Cijk_Ailk_Bljk_HB_MT128x032x16_PGR1_PLR1_TT04_04
    SolutionIndex: 40
    SolutionNameMin: Cijk_Ailk_Bljk_HB_MT128x032x16_PGR1_PLR1_TT04_04
    SolutionIndex: 41
    SolutionNameMin: Cijk_Ailk_Bljk_HB_MT064x064x16_PGR1_PLR0_TT04_04
    SolutionIndex: 42
    SolutionNameMin: Cijk_Ailk_Bljk_HB_MT256x032x16_PGR0_PLR0_TT08_04
    SolutionIndex: 43
    SolutionNameMin: Cijk_Ailk_Bljk_HB_MT064x128x16_PGR0_PLR0_TT04_08
    SolutionIndex: 44
    SolutionNameMin: Cijk_Ailk_Bljk_HB_MT128x064x16_PGR0_PLR0_TT04_08
    SolutionIndex: 45
    SolutionNameMin: Cijk_Ailk_Bljk_HB_MT256x032x16_PGR0_PLR0_TT08_04
    SolutionIndex: 46
    SolutionNameMin: Cijk_Ailk_Bljk_HB_MT128x064x16_PGR0_PLR0_TT08_04
    SolutionIndex: 47
    SolutionNameMin: Cijk_Ailk_Bljk_HB_MT064x064x08_PGR0_PLR1_TT04_04
    SolutionIndex: 48
    SolutionNameMin: Cijk_Ailk_Bljk_HB_MT064x064x16_PGR1_PLR1_TT04_04
    SolutionIndex: 49
    SolutionNameMin: Cijk_Ailk_Bljk_HB_MT064x064x08_PGR0_PLR0_TT04_04
    SolutionIndex: 50
    SolutionNameMin: Cijk_Ailk_Bljk_HB_MT064x064x08_PGR1_PLR1_TT04_04
    SolutionIndex: 51
    SolutionNameMin: Cijk_Ailk_Bljk_HB_MT064x064x16_PGR1_PLR1_TT04_04
    SolutionIndex: 52
    SolutionNameMin: Cijk_Ailk_Bljk_HB_MT064x064x08_PGR0_PLR1_TT04_04
    SolutionIndex: 53
    SolutionNameMin: Cijk_Ailk_Bljk_HB_MT064x064x08_PGR1_PLR1_TT04_04
- - - [4096, 7000, 1, 4096]
    - [28, 20275.7]
  - - [5124, 9124, 1, 1760]
    - [33, 21243.9]
  - - [5124, 9124, 1, 2560]
    - [33, 21212.2]
  - - [1760, 32, 1, 1760]
    - [21, 2844.68]
  - - [1024, 1500, 1, 1536]
    - [28, 17066.1]
  - - [512, 24000, 1, 1536]
    - [33, 21222.8]
  - - [3072, 24000, 1, 1024]
    - [33, 21725.7]
  - - [1024, 3000, 1, 2560]
    - [33, 19384.5]
  - - [512, 3136, 1, 2048]
    - [38, 13861.1]
  - - [7680, 4, 1, 2560]
    - [2, 1458.95]
  - - [35, 1500, 1, 2048]
    - [11, 0.0]
  - - [8448, 1500, 1, 2816]
    - [32, 20464.0]
  - - [784, 512, 64, 128]
    - [43, 16987.8]
  - - [2560, 7000, 1, 2560]
    - [33, 20695.6]
  - - [3072, 16, 1, 1024]
    - [5, 2268.52]
  - - [512, 48000, 1, 2048]
    - [29, 18858.6]
  - - [1760, 64, 1, 1760]
    - [0, 4934.09]
  - - [1024, 16, 1, 512]
    - [5, 813.531]
  - - [196, 256, 64, 1024]
    - [45, 10185.2]
  - - [512, 48000, 1, 1536]
    - [33, 21348.8]
  - - [2560, 32, 1, 2560]
    - [7, 3885.45]
  - - [4608, 1500, 1, 1536]
    - [33, 19845.1]
  - - [2048, 128, 1, 2048]
    - [22, 8798.97]
  - - [1024, 24000, 1, 2560]
    - [33, 21680.6]
  - - [4608, 3000, 1, 1536]
    - [33, 20434.7]
  - - [5124, 9124, 1, 2048]
    - [28, 19828.7]
  - - [1024, 700, 1, 512]
    - [27, 11219.2]
  - - [3072, 1, 1, 128]
    - [3, 70.8896]
  - - [5124, 700, 1, 2560]
    - [33, 17610.5]
  - - [8448, 16, 1, 2816]
    - [13, 4879.19]
  - - [6144, 6000, 1, 2560]
    - [33, 21793.3]
  - - [4608, 32, 1, 1536]
    - [14, 5317.08]
  - - [35, 8457, 1, 2560]
    - [11, 0.0]
  - - [3072, 64, 1, 1024]
    - [20, 6405.18]
  - - [512, 16, 1, 512]
    - [5, 412.448]
  - - [7680, 2, 1, 2560]
    - [16, 737.254]
  - - [4224, 1, 1, 128]
    - [3, 96.2406]
  - - [7680, 1, 1, 2560]
    - [2, 370.109]
  - - [128, 1500, 1, 1280]
    - [10, 6423.61]
  - - [35, 8457, 1, 4096]
    - [11, 0.0]
  - - [1024, 1500, 1, 2816]
    - [28, 17625.0]
  - - [6144, 2, 1, 2560]
    - [5, 627.451]
  - - [8448, 48000, 1, 2816]
    - [33, 22634.3]
  - - [512, 6000, 1, 1536]
    - [33, 18985.2]
  - - [4224, 1500, 1, 176]
    - [32, 16628.9]
  - - [1024, 6000, 1, 2816]
    - [33, 20743.0]
  - - [512, 6000, 1, 2560]
    - [33, 19347.2]
  - - [512, 32, 1, 512]
    - [5, 802.473]
  - - [2560, 128, 1, 2560]
    - [20, 8699.25]
  - - [4608, 24000, 1, 1536]
    - [33, 22320.5]
  - - [512, 2, 1, 500000]
    - [5, 63.2459]
  - - [7680, 48000, 1, 2560]
    - [33, 22623.3]
  - - [3072, 48000, 1, 1024]
    - [33, 22185.5]
  - - [1760, 16, 1, 1760]
    - [5, 1470.34]
  - - [512, 3000, 1, 2816]
    - [28, 17584.2]
  - - [1760, 7000, 1, 1760]
    - [32, 20145.5]
  - - [64, 193600, 1, 256]
    - [1, 13447.1]
  - - [1024, 3000, 1, 2048]
    - [25, 15030.7]
  - - [6144, 4, 1, 2560]
    - [5, 1251.36]
  - - [1024, 6000, 1, 2048]
    - [25, 16354.7]
  - - [512, 24000, 1, 2816]
    - [33, 21211.2]
  - - [6144, 48000, 1, 2560]
    - [33, 22559.5]
  - - [8448, 3000, 1, 2816]
    - [33, 21474.7]
  - - [35, 1500, 1, 2560]
    - [11, 0.0]
  - - [3072, 4, 1, 1024]
    - [5, 599.803]
  - - [4608, 48000, 1, 1536]
    - [33, 22533.0]
  - - [2048, 32, 1, 2048]
    - [15, 3242.95]
  - - [7680, 1500, 1, 2560]
    - [28, 19857.9]
  - - [4096, 128, 1, 4096]
    - [19, 12866.7]
  - - [4608, 16, 1, 1536]
    - [9, 3352.61]
  - - [1024, 1500, 1, 2048]
    - [25, 12818.2]
  - - [3072, 3000, 1, 1024]
    - [28, 19336.4]
  - - [3072, 2, 1, 1024]
    - [5, 297.884]
  - - [8448, 1, 1, 2816]
    - [9, 373.776]
  - - [1024, 48000, 1, 2560]
    - [33, 22327.4]
  - - [1024, 3000, 1, 2816]
    - [33, 19432.5]
  - - [128, 1, 1, 1408]
    - [5, 7.34582]
  - - [35, 8457, 1, 1760]
    - [11, 0.0]
  - - [1024, 2, 1, 512]
    - [15, 101.691]
  - - [1024, 4, 1, 500000]
    - [5, 253.996]
  - - [6144, 1, 1, 2560]
    - [5, 316.875]
  - - [1024, 48000, 1, 2816]
    - [33, 22350.3]
  - - [512, 48000, 1, 2816]
    - [33, 21661.8]
  - - [2048, 16, 1, 2048]
    - [5, 1741.12]
  - - [1024, 24000, 1, 1536]
    - [33, 21418.3]
  - - [64, 193600, 1, 64]
    - [35, 10900.3]
  - - [7680, 6000, 1, 2560]
    - [33, 21817.9]
  - - [1760, 128, 1, 1760]
    - [22, 7754.52]
  - - [35, 8457, 1, 2048]
    - [11, 0.0]
  - - [512, 1500, 1, 2816]
    - [27, 14406.4]
  - - [512, 1, 1, 512]
    - [5, 26.1433]
  - - [512, 16, 1, 500000]
    - [5, 507.662]
  - - [512, 8, 1, 500000]
    - [5, 253.195]
  - - [512, 24000, 1, 2560]
    - [33, 21150.9]
  - - [6144, 3000, 1, 2560]
    - [33, 21086.6]
  - - [1024, 24000, 1, 2816]
    - [33, 21701.0]
  - - [2048, 7000, 1, 2048]
    - [29, 18842.8]
  - - [7680, 3000, 1, 2560]
    - [33, 21080.6]
  - - [1024, 4, 1, 512]
    - [7, 203.383]
  - - [5124, 700, 1, 2048]
    - [30, 15296.4]
  - - [5124, 9124, 1, 4096]
    - [29, 19942.1]
  - - [4096, 64, 1, 4096]
    - [22, 9223.6]
  - - [256, 193600, 1, 64]
    - [34, 17018.0]
  - - [512, 6000, 1, 2048]
    - [25, 14604.0]
  - - [7680, 32, 1, 2560]
    - [12, 8498.64]
  - - [2560, 64, 1, 2560]
    - [14, 6281.23]
  - - [3136, 2048, 1, 512]
    - [44, 17778.1]
  - - [3072, 128, 1, 1024]
    - [22, 9374.42]
  - - [8448, 6000, 1, 2816]
    - [33, 22229.6]
  - - [7680, 64, 1, 2560]
    - [24, 12111.0]
  - - [5124, 1500, 1, 2560]
    - [33, 19497.7]
  - - [1024, 1500, 1, 2560]
    - [28, 17564.9]
  - - [3025, 64, 64, 64]
    - [41, 0.0]
  - - [512, 4, 1, 512]
    - [5, 103.112]
  - - [1024, 6000, 1, 2560]
    - [33, 20657.2]
  - - [3072, 32, 1, 1024]
    - [14, 4151.13]
  - - [35, 700, 1, 2560]
    - [11, 0.0]
  - - [3136, 512, 1, 2048]
    - [42, 11361.4]
  - - [196, 1024, 64, 256]
    - [46, 14647.1]
  - - [512, 50176, 1, 128]
    - [6, 19469.8]
  - - [4608, 1, 1, 1536]
    - [5, 225.692]
  - - [49, 512, 64, 2048]
    - [41, 0.0]
  - - [4096, 32, 1, 4096]
    - [23, 6029.97]
  - - [7680, 24000, 1, 2560]
    - [33, 22507.3]
  - - [8448, 4, 1, 2816]
    - [9, 1472.09]
  - - [64, 1, 1, 1216]
    - [7, 3.23781]
  - - [512, 1, 1, 500000]
    - [5, 31.6582]
  - - [176, 1500, 1, 1408]
    - [8, 6814.92]
  - - [512, 3000, 1, 1536]
    - [28, 16970.1]
  - - [8448, 24000, 1, 2816]
    - [33, 22602.5]
  - - [4608, 2, 1, 1536]
    - [5, 453.439]
  - - [1024, 48000, 1, 1536]
    - [33, 22176.1]
  - - [7680, 128, 1, 2560]
    - [28, 15869.2]
  - - [3072, 6000, 1, 1024]
    - [33, 20004.1]
  - - [3072, 1500, 1, 128]
    - [32, 15331.1]
  - - [2048, 3136, 1, 512]
    - [36, 18623.0]
  - - [3025, 256, 64, 64]
    - [41, 0.0]
  - - [1024, 3000, 1, 1536]
    - [33, 19017.8]
  - - [512, 4, 1, 500000]
    - [5, 126.603]
  - - [35, 700, 1, 2048]
    - [11, 0.0]
  - - [1024, 16, 1, 500000]
    - [5, 1003.86]
  - - [512, 24000, 1, 2048]
    - [25, 16745.9]
  - - [128, 50176, 1, 512]
    - [39, 15429.0]
  - - [1024, 32, 1, 512]
    - [15, 1542.0]
  - - [256, 12544, 1, 1024]
    - [40, 13469.5]
  - - [1024, 12544, 1, 256]
    - [37, 19371.9]
  - - [512, 48000, 1, 2560]
    - [33, 21609.5]
  - - [2560, 16, 1, 2560]
    - [5, 2204.06]
  - - [2048, 64, 1, 2048]
    - [18, 5575.68]
  - - [512, 2, 1, 512]
    - [5, 52.6622]
  - - [1024, 1, 1, 512]
    - [4, 43.368]
  - - [512, 1500, 1, 2560]
    - [27, 13499.6]
  - - [6144, 32, 1, 2560]
    - [17, 7113.23]
  - - [1024, 1, 1, 500000]
    - [5, 63.5243]
  - - [6144, 16, 1, 2560]
    - [9, 4536.97]
  - - [1024, 24000, 1, 2048]
    - [29, 19416.8]
  - - [4096, 16, 1, 4096]
    - [5, 3514.67]
  - - [5124, 1500, 1, 2048]
    - [29, 17097.9]
  - - [3072, 1500, 1, 1024]
    - [28, 17755.7]
  - - [1024, 2, 1, 500000]
    - [5, 126.983]
  - - [1024, 8, 1, 500000]
    - [5, 507.273]
  - - [7680, 16, 1, 2560]
    - [0, 5441.02]
  - - [6144, 1500, 1, 2560]
    - [33, 20673.3]
  - - [3072, 1, 1, 1024]
    - [5, 147.947]
  - - [512, 6000, 1, 2816]
    - [33, 19435.6]
  - - [8448, 2, 1, 2816]
    - [9, 756.856]
  - - [4608, 4, 1, 1536]
    - [5, 921.571]
  - - [1024, 6000, 1, 1536]
    - [33, 20413.2]
  - - [8448, 32, 1, 2816]
    - [20, 7317.15]
  - - [512, 3000, 1, 2048]
    - [30, 12542.0]
  - - [6144, 24000, 1, 2560]
    - [33, 22393.2]
  - - [512, 3000, 1, 2560]
    - [28, 17432.0]
  - - [4608, 6000, 1, 1536]
    - [33, 21536.3]
  - - [1024, 1024, 1, 1024]
    - [31, 14032.6]
  - - [512, 1500, 1, 2048]
    - [31, 10847.4]
  - - [512, 1500, 1, 1536]
    - [27, 12407.1]
  - - [128, 1, 1, 1024]
    - [4, 6.42223]
  - - [49, 2048, 64, 512]
    - [41, 0.0]
  - - [1024, 48000, 1, 2048]
    - [29, 20583.1]
- - - -1
    - - - 1
        - - - 32
            - - [128, 52]
              - [256, 53]
              - [448, 52]
              - [704, 53]
              - [1856, 52]
              - [2368, 53]
              - [2944, 52]
              - [3584, 53]
              - [-1, 52]
          - - 64
            - - [32, 52]
              - [64, 53]
              - [128, 52]
              - [256, 53]
              - [704, 52]
              - [1856, 53]
              - [3584, 52]
              - [-1, 53]
          - - 128
            - - [32, 53]
              - [448, 52]
              - [1408, 53]
              - [1856, 52]
              - [-1, 53]
          - - 256
            - - [128, 53]
              - [448, 52]
              - [704, 53]
              - [1856, 52]
              - [3584, 53]
              - [-1, 52]
          - - 448
            - - [64, 53]
              - [128, 52]
              - [256, 53]
              - [1024, 52]
              - [1856, 53]
              - [-1, 52]
          - - 704
            - - [32, 52]
              - [64, 53]
              - [704, 52]
              - [1408, 53]
              - [1856, 52]
              - [2368, 53]
              - [-1, 52]
          - - 1024
            - - [32, 52]
              - [64, 53]
              - [448, 52]
              - [1024, 53]
              - [-1, 52]
          - - 1408
            - - [64, 53]
              - [128, 52]
              - [256, 51]
              - [704, 53]
              - [-1, 52]
          - - 1856
            - - [32, 52]
              - [256, 53]
              - [-1, 52]
          - - 2368
            - - [64, 53]
              - [128, 52]
              - [256, 53]
              - [-1, 52]
          - - 2944
            - - [64, 52]
              - [256, 53]
              - [-1, 52]
          - - 3584
            - - [32, 52]
              - [64, 53]
              - [128, 52]
              - [256, 53]
              - [-1, 52]
          - - 5056
            - - [64, 52]
              - [128, 53]
              - [-1, 52]
          - - -1
            - - [32, 53]
              - [64, 52]
              - [128, 53]
              - [-1, 52]
      - - 32
        - - - 32
            - - [32, 47]
              - [448, 50]
              - [-1, 49]
          - - 64
            - - [32, 49]
              - [64, 50]
              - [128, 48]
              - [1408, 50]
              - [1856, 48]
              - [2944, 50]
              - [3584, 48]
              - [4288, 50]
              - [5056, 47]
              - [5888, 49]
              - [-1, 47]
          - - 128
            - - [2944, 50]
              - [3584, 48]
              - [4288, 50]
              - [5056, 47]
              - [5888, 49]
              - [-1, 50]
          - - 256
            - - [1856, 50]
              - [2368, 47]
              - [2944, 49]
              - [-1, 47]
          - - 448
            - - [64, 47]
              - [1024, 50]
              - [1408, 47]
              - [1856, 50]
              - [4288, 47]
              - [5056, 49]
              - [-1, 47]
          - - 704
            - - [64, 49]
              - [256, 48]
              - [448, 50]
              - [704, 48]
              - [2944, 47]
              - [3584, 49]
              - [4288, 47]
              - [5056, 49]
              - [-1, 47]
          - - 1024
            - - [32, 47]
              - [64, 49]
              - [256, 50]
              - [448, 48]
              - [1024, 47]
              - [2368, 49]
              - [-1, 47]
          - - 1408
            - - [32, 47]
              - [256, 50]
              - [448, 48]
              - [704, 47]
              - [1408, 49]
              - [-1, 47]
          - - 1856
            - - [64, 47]
              - [128, 50]
              - [256, 48]
              - [448, 47]
              - [704, 49]
              - [5056, 47]
              - [-1, 49]
          - - 2368
            - - [64, 49]
              - [128, 50]
              - [1024, 47]
              - [1408, 49]
              - [3584, 47]
              - [4288, 49]
              - [5056, 47]
              - [-1, 49]
          - - 2944
            - - [32, 49]
              - [64, 47]
              - [128, 50]
              - [256, 47]
              - [448, 49]
              - [4288, 47]
              - [-1, 49]
          - - 3584
            - - [64, 49]
              - [128, 47]
              - [256, 50]
              - [448, 49]
              - [704, 47]
              - [1024, 49]
              - [2944, 47]
              - [-1, 49]
          - - 4288
            - - [64, 49]
              - [128, 50]
              - [2368, 47]
              - [5888, 49]
              - [-1, 47]
          - - 5056
            - - [448, 49]
              - [1408, 47]
              - [1856, 49]
              - [2368, 47]
              - [5056, 49]
              - [-1, 47]
          - - 5888
            - - [32, 50]
              - [64, 47]
              - [128, 50]
              - [256, 47]
              - [448, 49]
              - [1408, 47]
              - [4288, 49]
              - [5056, 47]
              - [-1, 49]
          - - -1
            - - [32, 49]
              - [64, 47]
              - [128, 50]
              - [1024, 47]
              - [3584, 49]
              - [-1, 47]
      - - 256
        - - - 1
            - - [-1, 53]
          - - 32
            - - [64, 50]
              - [128, 48]
              - [448, 50]
              - [704, 48]
              - [2368, 50]
              - [3584, 48]
              - [-1, 50]
          - - 64
            - - [1, 53]
              - [32, 50]
              - [128, 7]
              - [256, 14]
              - [1024, 4]
              - [2944, 7]
              - [5056, 8]
              - [-1, 1]
          - - 128
            - - [1, 53]
              - [32, 50]
              - [64, 5]
              - [448, 7]
              - [704, 14]
              - [1408, 7]
              - [2368, 8]
              - [2944, 10]
              - [3584, 22]
              - [-1, 27]
          - - 256
            - - [1, 53]
              - [32, 50]
              - [64, 4]
              - [128, 7]
              - [256, 14]
              - [448, 7]
              - [2944, 27]
              - [3584, 32]
              - [5056, 27]
              - [-1, 32]
          - - 448
            - - [1, 53]
              - [32, 50]
              - [64, 4]
              - [256, 7]
              - [448, 8]
              - [2368, 27]
              - [2944, 32]
              - [3584, 27]
              - [4288, 26]
              - [5888, 32]
              - [-1, 26]
          - - 704
            - - [1, 53]
              - [32, 50]
              - [64, 15]
              - [128, 7]
              - [1856, 27]
              - [2368, 32]
              - [5888, 26]
              - [-1, 33]
          - - 1024
            - - [1, 53]
              - [32, 50]
              - [128, 7]
              - [704, 27]
              - [2368, 32]
              - [3584, 28]
              - [4288, 32]
              - [-1, 33]
          - - 1408
            - - [1, 53]
              - [32, 48]
              - [128, 7]
              - [448, 27]
              - [1856, 32]
              - [2368, 28]
              - [5888, 33]
              - [-1, 32]
          - - 1856
            - - [1, 53]
              - [32, 48]
              - [64, 7]
              - [128, 8]
              - [704, 27]
              - [1024, 32]
              - [1408, 26]
              - [2368, 32]
              - [2944, 28]
              - [4288, 33]
              - [5056, 32]
              - [5888, 33]
              - [-1, 32]
          - - 2368
            - - [1, 53]
              - [32, 48]
              - [64, 7]
              - [128, 8]
              - [704, 27]
              - [2368, 32]
              - [2944, 33]
              - [4288, 32]
              - [-1, 33]
          - - 2944
            - - [1, 53]
              - [32, 48]
              - [64, 8]
              - [128, 10]
              - [256, 27]
              - [448, 32]
              - [704, 28]
              - [1024, 32]
              - [1408, 33]
              - [1856, 32]
              - [2368, 33]
              - [5056, 32]
              - [-1, 33]
          - - 3584
            - - [1, 53]
              - [32, 50]
              - [64, 8]
              - [128, 27]
              - [704, 32]
              - [1024, 28]
              - [1408, 33]
              - [2368, 32]
              - [-1, 33]
          - - 4288
            - - [1, 53]
              - [32, 50]
              - [64, 8]
              - [256, 27]
              - [448, 28]
              - [1024, 32]
              - [1856, 33]
              - [2944, 32]
              - [3584, 33]
              - [5056, 32]
              - [-1, 33]
          - - 5056
            - - [1, 53]
              - [32, 50]
              - [64, 8]
              - [256, 27]
              - [448, 28]
              - [704, 32]
              - [1408, 33]
              - [1856, 32]
              - [3584, 33]
              - [4288, 32]
              - [-1, 33]
          - - 5888
            - - [1, 53]
              - [32, 50]
              - [64, 1]
              - [128, 27]
              - [448, 28]
              - [704, 32]
              - [1408, 33]
              - [2368, 32]
              - [-1, 33]
          - - -1
            - - [1, 53]
              - [32, 50]
              - [64, 1]
              - [128, 32]
              - [448, 28]
              - [704, 32]
              - [1024, 33]
              - [2368, 32]
              - [-1, 33]
      - - 1280
        - - - 1
            - - [256, 53]
              - [448, 51]
              - [1024, 53]
              - [3584, 51]
              - [-1, 53]
          - - 32
            - - [5888, 48]
              - [-1, 50]
          - - 64
            - - [1, 53]
              - [32, 48]
              - [64, 5]
              - [128, 7]
              - [256, 5]
              - [448, 14]
              - [1024, 21]
              - [1408, 9]
              - [1856, 0]
              - [2368, 7]
              - [2944, 20]
              - [3584, 22]
              - [5056, 8]
              - [5888, 22]
              - [-1, 1]
          - - 128
            - - [1, 53]
              - [32, 50]
              - [448, 5]
              - [704, 14]
              - [1024, 0]
              - [1408, 10]
              - [1856, 22]
              - [2368, 8]
              - [2944, 10]
              - [3584, 22]
              - [4288, 10]
              - [5888, 27]
              - [-1, 28]
          - - 256
            - - [1, 51]
              - [32, 48]
              - [256, 5]
              - [448, 0]
              - [2944, 27]
              - [3584, 28]
              - [5056, 27]
              - [-1, 28]
          - - 448
            - - [1, 53]
              - [32, 50]
              - [64, 5]
              - [128, 21]
              - [256, 0]
              - [448, 10]
              - [1408, 27]
              - [1856, 28]
              - [2368, 27]
              - [3584, 28]
              - [4288, 26]
              - [5056, 32]
              - [5888, 33]
              - [-1, 26]
          - - 704
            - - [1, 53]
              - [32, 50]
              - [64, 5]
              - [128, 7]
              - [1024, 27]
              - [1408, 26]
              - [1856, 27]
              - [2368, 28]
              - [5888, 26]
              - [-1, 33]
          - - 1024
            - - [1, 53]
              - [32, 50]
              - [64, 9]
              - [128, 7]
              - [704, 27]
              - [1856, 28]
              - [2368, 32]
              - [2944, 33]
              - [3584, 28]
              - [4288, 32]
              - [-1, 33]
          - - 1408
            - - [1, 53]
              - [32, 50]
              - [64, 7]
              - [128, 17]
              - [448, 27]
              - [2368, 28]
              - [5888, 33]
              - [-1, 32]
          - - 1856
            - - [1, 53]
              - [32, 50]
              - [64, 0]
              - [128, 22]
              - [256, 27]
              - [448, 28]
              - [704, 27]
              - [1024, 28]
              - [1408, 26]
              - [2944, 32]
              - [4288, 33]
              - [5056, 32]
              - [5888, 33]
              - [-1, 32]
          - - 2368
            - - [1, 53]
              - [32, 50]
              - [64, 7]
              - [128, 8]
              - [448, 27]
              - [704, 28]
              - [2368, 32]
              - [2944, 33]
              - [4288, 32]
              - [-1, 33]
          - - 2944
            - - [1, 53]
              - [32, 50]
              - [128, 10]
              - [256, 27]
              - [704, 28]
              - [1408, 33]
              - [1856, 32]
              - [2368, 33]
              - [5056, 32]
              - [-1, 33]
          - - 3584
            - - [1, 53]
              - [32, 50]
              - [128, 22]
              - [1024, 28]
              - [1408, 33]
              - [3584, 32]
              - [4288, 33]
              - [5056, 32]
              - [-1, 33]
          - - 4288
            - - [1, 53]
              - [32, 48]
              - [64, 8]
              - [128, 22]
              - [256, 27]
              - [704, 28]
              - [1024, 32]
              - [1856, 33]
              - [2944, 32]
              - [3584, 33]
              - [5056, 32]
              - [-1, 33]
          - - 5056
            - - [1, 53]
              - [32, 48]
              - [64, 20]
              - [256, 27]
              - [704, 28]
              - [1408, 33]
              - [1856, 32]
              - [2368, 33]
              - [2944, 32]
              - [3584, 33]
              - [4288, 32]
              - [-1, 33]
          - - 5888
            - - [1, 53]
              - [32, 48]
              - [64, 1]
              - [128, 27]
              - [704, 28]
              - [1408, 33]
              - [2368, 32]
              - [-1, 33]
          - - -1
            - - [1, 53]
              - [32, 50]
              - [64, 22]
              - [448, 28]
              - [1024, 33]
              - [2368, 32]
              - [-1, 33]
      - - -1
        - - - 1
            - - [256, 53]
              - [3584, 51]
              - [-1, 53]
          - - 32
            - - [-1, 48]
          - - 64
            - - [1, 53]
              - [32, 50]
              - [448, 5]
              - [704, 15]
              - [1024, 5]
              - [1408, 9]
              - [1856, 0]
              - [2368, 7]
              - [3584, 22]
              - [5056, 8]
              - [-1, 1]
          - - 128
            - - [1, 53]
              - [32, 50]
              - [448, 5]
              - [704, 7]
              - [1024, 0]
              - [1408, 22]
              - [1856, 12]
              - [2368, 8]
              - [2944, 10]
              - [3584, 22]
              - [4288, 10]
              - [5888, 27]
              - [-1, 28]
          - - 256
            - - [1, 53]
              - [32, 48]
              - [256, 5]
              - [448, 0]
              - [2944, 27]
              - [3584, 28]
              - [5056, 27]
              - [-1, 28]
          - - 448
            - - [1, 53]
              - [32, 48]
              - [128, 5]
              - [256, 0]
              - [448, 10]
              - [1408, 27]
              - [1856, 28]
              - [2368, 27]
              - [3584, 28]
              - [4288, 26]
              - [5056, 28]
              - [5888, 33]
              - [-1, 26]
          - - 704
            - - [1, 53]
              - [32, 48]
              - [64, 5]
              - [128, 14]
              - [1024, 27]
              - [1408, 26]
              - [1856, 27]
              - [2368, 28]
              - [5888, 26]
              - [-1, 33]
          - - 1024
            - - [1, 53]
              - [32, 50]
              - [64, 15]
              - [128, 23]
              - [704, 27]
              - [2368, 28]
              - [2944, 33]
              - [4288, 28]
              - [-1, 33]
          - - 1408
            - - [1, 53]
              - [32, 48]
              - [64, 7]
              - [128, 20]
              - [448, 27]
              - [2368, 28]
              - [5888, 33]
              - [-1, 32]
          - - 1856
            - - [1, 53]
              - [32, 50]
              - [64, 0]
              - [128, 12]
              - [256, 27]
              - [448, 28]
              - [704, 27]
              - [1024, 28]
              - [1408, 26]
              - [1856, 28]
              - [2944, 32]
              - [4288, 33]
              - [5056, 32]
              - [5888, 33]
              - [-1, 32]
          - - 2368
            - - [1, 53]
              - [32, 50]
              - [64, 14]
              - [128, 20]
              - [448, 27]
              - [1408, 28]
              - [1856, 32]
              - [2368, 28]
              - [2944, 33]
              - [4288, 32]
              - [-1, 33]
          - - 2944
            - - [1, 53]
              - [32, 50]
              - [64, 13]
              - [128, 10]
              - [256, 27]
              - [704, 28]
              - [1408, 33]
              - [1856, 32]
              - [2368, 33]
              - [5056, 32]
              - [-1, 33]
          - - 3584
            - - [1, 53]
              - [32, 50]
              - [64, 10]
              - [128, 22]
              - [1024, 28]
              - [1408, 33]
              - [3584, 32]
              - [-1, 33]
          - - 4288
            - - [1, 53]
              - [32, 48]
              - [64, 20]
              - [128, 10]
              - [256, 27]
              - [704, 28]
              - [1024, 32]
              - [1856, 33]
              - [2944, 32]
              - [3584, 33]
              - [5056, 32]
              - [-1, 33]
          - - 5056
            - - [1, 53]
              - [32, 48]
              - [64, 20]
              - [256, 27]
              - [704, 28]
              - [1408, 33]
              - [1856, 32]
              - [3584, 33]
              - [4288, 32]
              - [-1, 33]
          - - 5888
            - - [1, 53]
              - [32, 50]
              - [64, 10]
              - [128, 27]
              - [448, 28]
              - [704, 32]
              - [1408, 33]
              - [2368, 32]
              - [-1, 33]
          - - -1
            - - [1, 53]
              - [32, 48]
              - [64, 22]
              - [448, 28]
              - [1024, 33]
              - [1856, 32]
              - [3584, 33]
              - [5056, 32]
              - [-1, 33]
