library/src/blas3/Tensile/Logic/asm_full/vega10_Cijk_Ailk_Bjlk_SB.yaml
- {MinimumRequiredVersion: 4.6.0}
- vega10
- gfx900
- [Device 6863, Device 6862, Device 687f, Device 6860, Device 6861, 'Vega 10 XTX [Radeon
    SolutionIndex: 0
    SolutionNameMin: Cijk_Ailk_Bjlk_SB_MT032x016x08_GRVW02_GSU01_SNLL0_TT04_02_VW02_WG08_08_01
    SolutionIndex: 1
    SolutionNameMin: Cijk_Ailk_Bjlk_SB_MT032x032x08_GRVW04_GSU01_SNLL0_TT04_04_VW04_WG08_08_01
    SolutionIndex: 2
    SolutionNameMin: Cijk_Ailk_Bjlk_SB_MT064x032x08_GRVW04_GSU01_SNLL0_TT08_04_VW04_WG08_08_01
    SolutionIndex: 3
    SolutionNameMin: Cijk_Ailk_Bjlk_SB_MT032x016x08_GRVW02_GSU01_SNLL0_TT02_02_VW02_WG16_08_01
    SolutionIndex: 4
    SolutionNameMin: Cijk_Ailk_Bjlk_SB_MT064x016x08_GRVW02_GSU01_SNLL0_TT04_02_VW02_WG16_08_01
    SolutionIndex: 5
    SolutionNameMin: Cijk_Ailk_Bjlk_SB_MT032x032x08_GRVW04_GSU01_SNLL0_TT04_04_VW04_WG08_08_01
    SolutionIndex: 6
    SolutionNameMin: Cijk_Ailk_Bjlk_SB_MT064x016x08_GRVW02_GSU01_SNLL0_TT04_02_VW02_WG16_08_01
    SolutionIndex: 7
    SolutionNameMin: Cijk_Ailk_Bjlk_SB_MT016x016x16_GRVW02_GSU01_SNLL0_TT02_02_VW02_WG08_08_01
    SolutionIndex: 8
    SolutionNameMin: Cijk_Ailk_Bjlk_SB_MT032x016x16_GRVW02_GSU01_SNLL0_TT02_02_VW02_WG16_08_01
    SolutionIndex: 9
    SolutionNameMin: Cijk_Ailk_Bjlk_SB_MT016x016x08_GRVW02_GSU02_SNLL0_TT02_02_VW02_WG08_08_02
    SolutionIndex: 10
    SolutionNameMin: Cijk_Ailk_Bjlk_SB_MT016x016x08_GRVW02_GSU04_SNLL0_TT02_02_VW02_WG08_08_02
    SolutionIndex: 11
    SolutionNameMin: Cijk_Ailk_Bjlk_SB_MT016x016x08_GRVW02_GSU08_SNLL0_TT02_02_VW02_WG08_08_02
    SolutionIndex: 12
    SolutionNameMin: Cijk_Ailk_Bjlk_SB_MT032x032x16_GRVW04_GSU02_SNLL0_TT04_04_VW04_WG08_08_02
    SolutionIndex: 13
    SolutionNameMin: Cijk_Ailk_Bjlk_SB_MT064x032x16_GRVW04_GSU02_SNLL0_TT08_04_VW04_WG08_08_02
    SolutionIndex: 14
    SolutionNameMin: Cijk_Ailk_Bjlk_SB_MT016x016x16_GRVW02_GSU02_SNLL0_TT02_02_VW02_WG08_08_04
    SolutionIndex: 15
    SolutionNameMin: Cijk_Ailk_Bjlk_SB_MT032x016x16_GRVW02_GSU02_SNLL0_TT04_02_VW02_WG08_08_04
    SolutionIndex: 16
    SolutionNameMin: Cijk_Ailk_Bjlk_SB_MT032x016x16_GRVW02_GSU02_SNLL0_TT02_02_VW02_WG16_08_02
    SolutionIndex: 17
    SolutionNameMin: Cijk_Ailk_Bjlk_SB_MT064x016x16_GRVW02_GSU02_SNLL0_TT04_02_VW02_WG16_08_02
    SolutionIndex: 18
    SolutionNameMin: Cijk_Ailk_Bjlk_SB_MT032x032x16_GRVW04_GSU02_SNLL0_TT04_04_VW04_WG08_08_02
    SolutionIndex: 19
    SolutionNameMin: Cijk_Ailk_Bjlk_SB_MT064x032x16_GRVW04_GSU02_SNLL0_TT08_04_VW04_WG08_08_02
    SolutionIndex: 20
    SolutionNameMin: Cijk_Ailk_Bjlk_SB_MT032x016x16_GRVW02_GSU02_SNLL0_TT04_02_VW02_WG08_08_04
    SolutionIndex: 21
    SolutionNameMin: Cijk_Ailk_Bjlk_SB_MT016x016x16_GRVW02_GSU04_SNLL0_TT02_02_VW02_WG08_08_04
    SolutionIndex: 22
    SolutionNameMin: Cijk_Ailk_Bjlk_SB_MT016x016x16_GRVW02_GSU04_SNLL0_TT02_02_VW02_WG08_08_04
    SolutionIndex: 23
    SolutionNameMin: Cijk_Ailk_Bjlk_SB_MT016x016x16_GRVW02_GSU08_SNLL0_TT02_02_VW02_WG08_08_04
    SolutionIndex: 24
    SolutionNameMin: Cijk_Ailk_Bjlk_SB_MT032x016x32_GRVW02_GSU02_SNLL0_TT04_02_VW02_WG08_08_02
    SolutionIndex: 25
    SolutionNameMin: Cijk_Ailk_Bjlk_SB_MT016x016x32_GRVW02_GSU02_SNLL0_TT02_02_VW02_WG08_08_04
    SolutionIndex: 26
    SolutionNameMin: Cijk_Ailk_Bjlk_SB_MT032x016x32_GRVW02_GSU02_SNLL0_TT04_02_VW02_WG08_08_04
    SolutionIndex: 27
    SolutionNameMin: Cijk_Ailk_Bjlk_SB_MT032x032x32_GRVW04_GSU02_SNLL0_TT04_04_VW04_WG08_08_04
    SolutionIndex: 28
    SolutionNameMin: Cijk_Ailk_Bjlk_SB_MT032x008x32_GRVW02_GSU02_SNLL0_TT02_02_VW02_WG16_04_04
    SolutionIndex: 29
    SolutionNameMin: Cijk_Ailk_Bjlk_SB_MT032x016x32_GRVW02_GSU02_SNLL0_TT04_02_VW02_WG08_08_02
    SolutionIndex: 30
    SolutionNameMin: Cijk_Ailk_Bjlk_SB_MT016x016x32_GRVW02_GSU02_SNLL0_TT02_02_VW02_WG08_08_04
    SolutionIndex: 31
    SolutionNameMin: Cijk_Ailk_Bjlk_SB_MT032x016x32_GRVW02_GSU02_SNLL0_TT04_02_VW02_WG08_08_04
    SolutionIndex: 32
    SolutionNameMin: Cijk_Ailk_Bjlk_SB_MT032x032x32_GRVW04_GSU02_SNLL0_TT04_04_VW04_WG08_08_04
    SolutionIndex: 33
    SolutionNameMin: Cijk_Ailk_Bjlk_SB_MT064x032x32_GRVW04_GSU02_SNLL0_TT08_04_VW04_WG08_08_04
    SolutionIndex: 34
    SolutionNameMin: Cijk_Ailk_Bjlk_SB_MT064x032x32_GRVW04_GSU02_SNLL0_TT04_04_VW04_WG16_08_02
    SolutionIndex: 35
    SolutionNameMin: Cijk_Ailk_Bjlk_SB_MT016x016x32_GRVW02_GSU04_SNLL0_TT02_02_VW02_WG08_08_04
    SolutionIndex: 36
    SolutionNameMin: Cijk_Ailk_Bjlk_SB_MT032x016x32_GRVW02_GSU04_SNLL0_TT04_02_VW02_WG08_08_04
    SolutionIndex: 37
    SolutionNameMin: Cijk_Ailk_Bjlk_SB_MT032x032x32_GRVW04_GSU04_SNLL0_TT04_04_VW04_WG08_08_04
    SolutionIndex: 38
    SolutionNameMin: Cijk_Ailk_Bjlk_SB_MT016x016x32_GRVW02_GSU04_SNLL0_TT02_02_VW02_WG08_08_04
    SolutionIndex: 39
    SolutionNameMin: Cijk_Ailk_Bjlk_SB_MT032x032x32_GRVW04_GSU04_SNLL0_TT04_04_VW04_WG08_08_04
    SolutionIndex: 40
    SolutionNameMin: Cijk_Ailk_Bjlk_SB_MT032x008x32_GRVW02_GSU08_SNLL0_TT02_02_VW02_WG16_04_04
    SolutionIndex: 41
    SolutionNameMin: Cijk_Ailk_Bjlk_SB_MT016x016x32_GRVW02_GSU08_SNLL0_TT02_02_VW02_WG08_08_04
    SolutionIndex: 42
    SolutionNameMin: Cijk_Ailk_Bjlk_SB_MT016x016x32_GRVW02_GSU08_SNLL0_TT02_02_VW02_WG08_08_04
    SolutionIndex: 43
    SolutionNameMin: Cijk_Ailk_Bjlk_SB_MT128x128x08_GRVW04_GSU01_SNLL0_TT08_08_VW04_WG16_16_01
    SolutionIndex: 44
    SolutionNameMin: Cijk_Ailk_Bjlk_SB_MT064x064x16_GRVW04_GSU01_SNLL0_TT04_04_VW04_WG16_16_01
    SolutionIndex: 45
    SolutionNameMin: Cijk_Ailk_Bjlk_SB_MT064x064x16_GRVW04_GSU01_SNLL0_TT04_04_VW04_WG16_16_01
    SolutionIndex: 46
    SolutionNameMin: Cijk_Ailk_Bjlk_SB_MT064x128x16_GRVW04_GSU01_SNLL0_TT04_08_VW04_WG16_16_01
    SolutionIndex: 47
    SolutionNameMin: Cijk_Ailk_Bjlk_SB_MT128x128x08_GRVW04_GSU01_SNLL1_TT08_08_VW04_WG16_16_01
    SolutionIndex: 48
    SolutionNameMin: Cijk_Ailk_Bjlk_SB_MT128x128x08_GRVW04_GSU01_SNLL1_TT08_08_VW04_WG16_16_01
    SolutionIndex: 49
    SolutionNameMin: Cijk_Ailk_Bjlk_SB_MT064x064x16_GRVW04_GSU01_SNLL1_TT04_04_VW04_WG16_16_01
    SolutionIndex: 50
    SolutionNameMin: Cijk_Ailk_Bjlk_SB_MT064x128x16_GRVW04_GSU01_SNLL1_TT04_08_VW04_WG16_16_01
    SolutionIndex: 51
    SolutionNameMin: Cijk_Ailk_Bjlk_SB_MT096x128x16_GRVW02_GSU01_SNLL1_TT06_08_VW02_WG16_16_01
    SolutionIndex: 52
    SolutionNameMin: Cijk_Ailk_Bjlk_SB_MT128x064x16_GRVW04_GSU01_SNLL1_TT08_04_VW04_WG16_16_01
    SolutionIndex: 53
    SolutionNameMin: Cijk_Ailk_Bjlk_SB_MT128x096x16_GRVW02_GSU01_SNLL1_TT08_06_VW02_WG16_16_01
    SolutionIndex: 54
    SolutionNameMin: Cijk_Ailk_Bjlk_SB_MT128x128x16_GRVW04_GSU01_SNLL1_TT08_08_VW04_WG16_16_01
    SolutionIndex: 55
    SolutionNameMin: Cijk_Ailk_Bjlk_SB_MT064x064x16_GRVW04_GSU01_SNLL1_TT04_04_VW04_WG16_16_01
    SolutionIndex: 56
    SolutionNameMin: Cijk_Ailk_Bjlk_SB_MT064x128x16_GRVW04_GSU01_SNLL1_TT04_08_VW04_WG16_16_01
    SolutionIndex: 57
    SolutionNameMin: Cijk_Ailk_Bjlk_SB_MT128x064x16_GRVW04_GSU01_SNLL1_TT08_04_VW04_WG16_16_01
    SolutionIndex: 58
    SolutionNameMin: Cijk_Ailk_Bjlk_SB_MT128x128x16_GRVW04_GSU01_SNLL1_TT08_08_VW04_WG16_16_01
    SolutionIndex: 59
    SolutionNameMin: Cijk_Ailk_Bjlk_SB_MT016x016x04_GRVW02_GSU01_SNLL0_TT02_02_VW02_WG08_08_01
    SolutionIndex: 60
    SolutionNameMin: Cijk_Ailk_Bjlk_SB_MT032x032x02_GRVW04_GSU01_SNLL0_TT04_04_VW04_WG08_08_01
    SolutionIndex: 61
    SolutionNameMin: Cijk_Ailk_Bjlk_SB_MT016x016x16_GRVW02_GSU01_SNLL1_TT02_02_VW02_WG08_08_04
    SolutionIndex: 62
    SolutionNameMin: Cijk_Ailk_Bjlk_SB_MT016x016x04_GRVW02_GSU04_SNLL0_TT02_02_VW02_WG08_08_01
    SolutionIndex: 63
    SolutionNameMin: Cijk_Ailk_Bjlk_SB_MT008x008x08_GRVW02_GSU04_SNLL0_TT02_02_VW02_WG04_04_04
    SolutionIndex: 64
    SolutionNameMin: Cijk_Ailk_Bjlk_SB_MT016x016x04_GRVW02_GSU08_SNLL0_TT02_02_VW02_WG08_08_01
    SolutionIndex: 65
    SolutionNameMin: Cijk_Ailk_Bjlk_SB_MT008x008x08_GRVW02_GSU08_SNLL0_TT02_02_VW02_WG04_04_04
    SolutionIndex: 66
    SolutionNameMin: Cijk_Ailk_Bjlk_SB_MT016x016x16_GRVW02_GSU16_SNLL0_TT02_02_VW02_WG08_08_04
    SolutionIndex: 0
    SolutionNameMin: Cijk_Ailk_Bjlk_SB_MT064x064x16_DTL0_GRVW01_GSU01_PGR1_PLR1_TT04_04_USFGRO01_VW02_WG16_16_01_WGM01
    SolutionIndex: 1
    SolutionNameMin: Cijk_Ailk_Bjlk_SB_MT064x064x16_DTL0_GRVW01_GSU01_PGR0_PLR0_TT04_04_USFGRO01_VW04_WG16_16_01_WGM01
    SolutionIndex: 2
    SolutionNameMin: Cijk_Ailk_Bjlk_SB_MT128x064x16_DTL0_GRVW01_GSU01_PGR1_PLR1_TT08_04_USFGRO01_VW04_WG16_16_01_WGM01
    SolutionIndex: 3
    SolutionNameMin: Cijk_Ailk_Bjlk_SB_MT128x064x16_DTL0_GRVW01_GSU01_PGR1_PLR1_TT04_08_USFGRO01_VW04_WG32_08_01_WGM01
    SolutionIndex: 4
    SolutionNameMin: Cijk_Ailk_Bjlk_SB_MT032x256x16_DTL1_GRVW01_GSU01_PGR0_PLR1_TT04_08_USFGRO01_VW04_WG08_32_01_WGM08
    SolutionIndex: 5
    SolutionNameMin: Cijk_Ailk_Bjlk_SB_MT064x064x16_DTL0_GRVW01_GSU01_PGR1_PLR1_TT04_04_USFGRO01_VW04_WG16_16_01_WGM08
    SolutionIndex: 6
    SolutionNameMin: Cijk_Ailk_Bjlk_SB_MT064x064x16_DTL0_GRVW01_GSU01_PGR1_PLR1_TT04_04_USFGRO01_VW04_WG16_16_01_WGM64
    SolutionIndex: 7
    SolutionNameMin: Cijk_Ailk_Bjlk_SB_MT032x128x16_DTL0_GRVW04_GSU01_PGR0_PLR1_TT04_04_USFGRO0_VW04_WG08_32_01_WGM01
    SolutionIndex: 8
    SolutionNameMin: Cijk_Ailk_Bjlk_SB_MT064x064x16_DTL0_GRVW04_GSU01_PGR1_PLR1_TT04_04_USFGRO0_VW04_WG16_16_01_WGM01
    SolutionIndex: 9
    SolutionNameMin: Cijk_Ailk_Bjlk_SB_MT064x128x16_DTL0_GRVW04_GSU01_PGR0_PLR1_TT04_08_USFGRO0_VW04_WG16_16_01_WGM01
    SolutionIndex: 10
    SolutionNameMin: Cijk_Ailk_Bjlk_SB_MT064x064x16_DTL0_GRVW04_GSU01_PGR1_PLR1_TT04_04_USFGRO0_VW04_WG16_16_01_WGM08
    SolutionIndex: 11
    SolutionNameMin: Cijk_Ailk_Bjlk_SB_MT032x128x16_DTL0_GRVW04_GSU01_PGR0_PLR1_TT04_04_USFGRO0_VW04_WG08_32_01_WGM64
    SolutionIndex: 67
    SolutionNameMin: Cijk_Ailk_Bjlk_SB_MT032x016x08_GRVW02_GSU01_SNLL0_TT04_02_VW02_WG08_08_01
    SolutionIndex: 68
    SolutionNameMin: Cijk_Ailk_Bjlk_SB_MT032x032x08_GRVW04_GSU01_SNLL0_TT04_04_VW04_WG08_08_01
    SolutionIndex: 69
    SolutionNameMin: Cijk_Ailk_Bjlk_SB_MT064x032x08_GRVW04_GSU01_SNLL0_TT08_04_VW04_WG08_08_01
    SolutionIndex: 70
    SolutionNameMin: Cijk_Ailk_Bjlk_SB_MT032x016x08_GRVW02_GSU01_SNLL0_TT02_02_VW02_WG16_08_01
    SolutionIndex: 71
    SolutionNameMin: Cijk_Ailk_Bjlk_SB_MT064x016x08_GRVW02_GSU01_SNLL0_TT04_02_VW02_WG16_08_01
    SolutionIndex: 72
    SolutionNameMin: Cijk_Ailk_Bjlk_SB_MT032x032x08_GRVW04_GSU01_SNLL0_TT04_04_VW04_WG08_08_01
    SolutionIndex: 73
    SolutionNameMin: Cijk_Ailk_Bjlk_SB_MT064x016x08_GRVW02_GSU01_SNLL0_TT04_02_VW02_WG16_08_01
    SolutionIndex: 74
    SolutionNameMin: Cijk_Ailk_Bjlk_SB_MT016x016x16_GRVW02_GSU01_SNLL0_TT02_02_VW02_WG08_08_01
    SolutionIndex: 75
    SolutionNameMin: Cijk_Ailk_Bjlk_SB_MT032x016x16_GRVW02_GSU01_SNLL0_TT02_02_VW02_WG16_08_01
    SolutionIndex: 76
    SolutionNameMin: Cijk_Ailk_Bjlk_SB_MT016x016x08_GRVW02_GSU02_SNLL0_TT02_02_VW02_WG08_08_02
    SolutionIndex: 77
    SolutionNameMin: Cijk_Ailk_Bjlk_SB_MT016x016x08_GRVW02_GSU04_SNLL0_TT02_02_VW02_WG08_08_02
    SolutionIndex: 78
    SolutionNameMin: Cijk_Ailk_Bjlk_SB_MT016x016x08_GRVW02_GSU08_SNLL0_TT02_02_VW02_WG08_08_02
    SolutionIndex: 79
    SolutionNameMin: Cijk_Ailk_Bjlk_SB_MT032x032x16_GRVW04_GSU02_SNLL0_TT04_04_VW04_WG08_08_02
    SolutionIndex: 80
    SolutionNameMin: Cijk_Ailk_Bjlk_SB_MT064x032x16_GRVW04_GSU02_SNLL0_TT08_04_VW04_WG08_08_02
    SolutionIndex: 81
    SolutionNameMin: Cijk_Ailk_Bjlk_SB_MT016x016x16_GRVW02_GSU02_SNLL0_TT02_02_VW02_WG08_08_04
    SolutionIndex: 82
    SolutionNameMin: Cijk_Ailk_Bjlk_SB_MT032x016x16_GRVW02_GSU02_SNLL0_TT04_02_VW02_WG08_08_04
    SolutionIndex: 83
    SolutionNameMin: Cijk_Ailk_Bjlk_SB_MT032x016x16_GRVW02_GSU02_SNLL0_TT02_02_VW02_WG16_08_02
    SolutionIndex: 84
    SolutionNameMin: Cijk_Ailk_Bjlk_SB_MT064x016x16_GRVW02_GSU02_SNLL0_TT04_02_VW02_WG16_08_02
    SolutionIndex: 85
    SolutionNameMin: Cijk_Ailk_Bjlk_SB_MT032x032x16_GRVW04_GSU02_SNLL0_TT04_04_VW04_WG08_08_02
    SolutionIndex: 86
    SolutionNameMin: Cijk_Ailk_Bjlk_SB_MT064x032x16_GRVW04_GSU02_SNLL0_TT08_04_VW04_WG08_08_02
    SolutionIndex: 87
    SolutionNameMin: Cijk_Ailk_Bjlk_SB_MT032x016x16_GRVW02_GSU02_SNLL0_TT04_02_VW02_WG08_08_04
    SolutionIndex: 88
    SolutionNameMin: Cijk_Ailk_Bjlk_SB_MT016x016x16_GRVW02_GSU04_SNLL0_TT02_02_VW02_WG08_08_04
    SolutionIndex: 89
    SolutionNameMin: Cijk_Ailk_Bjlk_SB_MT016x016x16_GRVW02_GSU04_SNLL0_TT02_02_VW02_WG08_08_04
    SolutionIndex: 90
    SolutionNameMin: Cijk_Ailk_Bjlk_SB_MT016x016x16_GRVW02_GSU08_SNLL0_TT02_02_VW02_WG08_08_04
    SolutionIndex: 91
    SolutionNameMin: Cijk_Ailk_Bjlk_SB_MT032x016x32_GRVW02_GSU02_SNLL0_TT04_02_VW02_WG08_08_02
    SolutionIndex: 92
    SolutionNameMin: Cijk_Ailk_Bjlk_SB_MT016x016x32_GRVW02_GSU02_SNLL0_TT02_02_VW02_WG08_08_04
    SolutionIndex: 93
    SolutionNameMin: Cijk_Ailk_Bjlk_SB_MT032x016x32_GRVW02_GSU02_SNLL0_TT04_02_VW02_WG08_08_04
    SolutionIndex: 94
    SolutionNameMin: Cijk_Ailk_Bjlk_SB_MT032x032x32_GRVW04_GSU02_SNLL0_TT04_04_VW04_WG08_08_04
    SolutionIndex: 95
    SolutionNameMin: Cijk_Ailk_Bjlk_SB_MT032x008x32_GRVW02_GSU02_SNLL0_TT02_02_VW02_WG16_04_04
    SolutionIndex: 96
    SolutionNameMin: Cijk_Ailk_Bjlk_SB_MT032x016x32_GRVW02_GSU02_SNLL0_TT04_02_VW02_WG08_08_02
    SolutionIndex: 97
    SolutionNameMin: Cijk_Ailk_Bjlk_SB_MT016x016x32_GRVW02_GSU02_SNLL0_TT02_02_VW02_WG08_08_04
    SolutionIndex: 98
    SolutionNameMin: Cijk_Ailk_Bjlk_SB_MT032x016x32_GRVW02_GSU02_SNLL0_TT04_02_VW02_WG08_08_04
    SolutionIndex: 99
    SolutionNameMin: Cijk_Ailk_Bjlk_SB_MT032x032x32_GRVW04_GSU02_SNLL0_TT04_04_VW04_WG08_08_04
    SolutionIndex: 100
    SolutionNameMin: Cijk_Ailk_Bjlk_SB_MT064x032x32_GRVW04_GSU02_SNLL0_TT08_04_VW04_WG08_08_04
    SolutionIndex: 101
    SolutionNameMin: Cijk_Ailk_Bjlk_SB_MT064x032x32_GRVW04_GSU02_SNLL0_TT04_04_VW04_WG16_08_02
    SolutionIndex: 102
    SolutionNameMin: Cijk_Ailk_Bjlk_SB_MT016x016x32_GRVW02_GSU04_SNLL0_TT02_02_VW02_WG08_08_04
    SolutionIndex: 103
    SolutionNameMin: Cijk_Ailk_Bjlk_SB_MT032x016x32_GRVW02_GSU04_SNLL0_TT04_02_VW02_WG08_08_04
    SolutionIndex: 104
    SolutionNameMin: Cijk_Ailk_Bjlk_SB_MT032x032x32_GRVW04_GSU04_SNLL0_TT04_04_VW04_WG08_08_04
    SolutionIndex: 105
    SolutionNameMin: Cijk_Ailk_Bjlk_SB_MT016x016x32_GRVW02_GSU04_SNLL0_TT02_02_VW02_WG08_08_04
    SolutionIndex: 106
    SolutionNameMin: Cijk_Ailk_Bjlk_SB_MT032x032x32_GRVW04_GSU04_SNLL0_TT04_04_VW04_WG08_08_04
    SolutionIndex: 107
    SolutionNameMin: Cijk_Ailk_Bjlk_SB_MT032x008x32_GRVW02_GSU08_SNLL0_TT02_02_VW02_WG16_04_04
    SolutionIndex: 108
    SolutionNameMin: Cijk_Ailk_Bjlk_SB_MT016x016x32_GRVW02_GSU08_SNLL0_TT02_02_VW02_WG08_08_04
    SolutionIndex: 109
    SolutionNameMin: Cijk_Ailk_Bjlk_SB_MT016x016x32_GRVW02_GSU08_SNLL0_TT02_02_VW02_WG08_08_04
    SolutionIndex: 110
    SolutionNameMin: Cijk_Ailk_Bjlk_SB_MT128x128x08_GRVW04_GSU01_SNLL0_TT08_08_VW04_WG16_16_01
    SolutionIndex: 111
    SolutionNameMin: Cijk_Ailk_Bjlk_SB_MT064x064x16_GRVW04_GSU01_SNLL0_TT04_04_VW04_WG16_16_01
    SolutionIndex: 112
    SolutionNameMin: Cijk_Ailk_Bjlk_SB_MT064x064x16_GRVW04_GSU01_SNLL0_TT04_04_VW04_WG16_16_01
    SolutionIndex: 113
    SolutionNameMin: Cijk_Ailk_Bjlk_SB_MT064x128x16_GRVW04_GSU01_SNLL0_TT04_08_VW04_WG16_16_01
    SolutionIndex: 114
    SolutionNameMin: Cijk_Ailk_Bjlk_SB_MT128x128x08_GRVW04_GSU01_SNLL1_TT08_08_VW04_WG16_16_01
    SolutionIndex: 115
    SolutionNameMin: Cijk_Ailk_Bjlk_SB_MT128x128x08_GRVW04_GSU01_SNLL1_TT08_08_VW04_WG16_16_01
    SolutionIndex: 116
    SolutionNameMin: Cijk_Ailk_Bjlk_SB_MT064x064x16_GRVW04_GSU01_SNLL1_TT04_04_VW04_WG16_16_01
    SolutionIndex: 117
    SolutionNameMin: Cijk_Ailk_Bjlk_SB_MT064x128x16_GRVW04_GSU01_SNLL1_TT04_08_VW04_WG16_16_01
    SolutionIndex: 118
    SolutionNameMin: Cijk_Ailk_Bjlk_SB_MT096x128x16_GRVW02_GSU01_SNLL1_TT06_08_VW02_WG16_16_01
    SolutionIndex: 119
    SolutionNameMin: Cijk_Ailk_Bjlk_SB_MT128x064x16_GRVW04_GSU01_SNLL1_TT08_04_VW04_WG16_16_01
    SolutionIndex: 120
    SolutionNameMin: Cijk_Ailk_Bjlk_SB_MT128x096x16_GRVW02_GSU01_SNLL1_TT08_06_VW02_WG16_16_01
    SolutionIndex: 121
    SolutionNameMin: Cijk_Ailk_Bjlk_SB_MT128x128x16_GRVW04_GSU01_SNLL1_TT08_08_VW04_WG16_16_01
    SolutionIndex: 122
    SolutionNameMin: Cijk_Ailk_Bjlk_SB_MT064x064x16_GRVW04_GSU01_SNLL1_TT04_04_VW04_WG16_16_01
    SolutionIndex: 123
    SolutionNameMin: Cijk_Ailk_Bjlk_SB_MT064x128x16_GRVW04_GSU01_SNLL1_TT04_08_VW04_WG16_16_01
    SolutionIndex: 124
    SolutionNameMin: Cijk_Ailk_Bjlk_SB_MT128x064x16_GRVW04_GSU01_SNLL1_TT08_04_VW04_WG16_16_01
    SolutionIndex: 125
    SolutionNameMin: Cijk_Ailk_Bjlk_SB_MT128x128x16_GRVW04_GSU01_SNLL1_TT08_08_VW04_WG16_16_01
    SolutionIndex: 126
    SolutionNameMin: Cijk_Ailk_Bjlk_SB_MT016x016x04_GRVW02_GSU01_SNLL0_TT02_02_VW02_WG08_08_01
    SolutionIndex: 127
    SolutionNameMin: Cijk_Ailk_Bjlk_SB_MT032x032x02_GRVW04_GSU01_SNLL0_TT04_04_VW04_WG08_08_01
    SolutionIndex: 128
    SolutionNameMin: Cijk_Ailk_Bjlk_SB_MT016x016x16_GRVW02_GSU01_SNLL1_TT02_02_VW02_WG08_08_04
    SolutionIndex: 129
    SolutionNameMin: Cijk_Ailk_Bjlk_SB_MT016x016x04_GRVW02_GSU04_SNLL0_TT02_02_VW02_WG08_08_01
    SolutionIndex: 130
    SolutionNameMin: Cijk_Ailk_Bjlk_SB_MT008x008x08_GRVW02_GSU04_SNLL0_TT02_02_VW02_WG04_04_04
    SolutionIndex: 131
    SolutionNameMin: Cijk_Ailk_Bjlk_SB_MT016x016x04_GRVW02_GSU08_SNLL0_TT02_02_VW02_WG08_08_01
    SolutionIndex: 132
    SolutionNameMin: Cijk_Ailk_Bjlk_SB_MT008x008x08_GRVW02_GSU08_SNLL0_TT02_02_VW02_WG04_04_04
    SolutionIndex: 133
    SolutionNameMin: Cijk_Ailk_Bjlk_SB_MT016x016x16_GRVW02_GSU16_SNLL0_TT02_02_VW02_WG08_08_04
    SolutionIndex: 67
    SolutionNameMin: Cijk_Ailk_Bjlk_SB_MT064x064x16_DTL0_GRVW01_GSU01_PGR1_PLR1_TT04_04_USFGRO01_VW02_WG16_16_01_WGM01
    SolutionIndex: 68
    SolutionNameMin: Cijk_Ailk_Bjlk_SB_MT064x064x16_DTL0_GRVW01_GSU01_PGR0_PLR0_TT04_04_USFGRO01_VW04_WG16_16_01_WGM01
    SolutionIndex: 69
    SolutionNameMin: Cijk_Ailk_Bjlk_SB_MT128x064x16_DTL0_GRVW01_GSU01_PGR1_PLR1_TT08_04_USFGRO01_VW04_WG16_16_01_WGM01
    SolutionIndex: 70
    SolutionNameMin: Cijk_Ailk_Bjlk_SB_MT128x064x16_DTL0_GRVW01_GSU01_PGR1_PLR1_TT04_08_USFGRO01_VW04_WG32_08_01_WGM01
    SolutionIndex: 71
    SolutionNameMin: Cijk_Ailk_Bjlk_SB_MT032x256x16_DTL1_GRVW01_GSU01_PGR0_PLR1_TT04_08_USFGRO01_VW04_WG08_32_01_WGM08
    SolutionIndex: 72
    SolutionNameMin: Cijk_Ailk_Bjlk_SB_MT064x064x16_DTL0_GRVW01_GSU01_PGR1_PLR1_TT04_04_USFGRO01_VW04_WG16_16_01_WGM08
    SolutionIndex: 73
    SolutionNameMin: Cijk_Ailk_Bjlk_SB_MT064x064x16_DTL0_GRVW01_GSU01_PGR1_PLR1_TT04_04_USFGRO01_VW04_WG16_16_01_WGM64
    SolutionIndex: 74
    SolutionNameMin: Cijk_Ailk_Bjlk_SB_MT032x128x16_DTL0_GRVW04_GSU01_PGR0_PLR1_TT04_04_USFGRO0_VW04_WG08_32_01_WGM01
    SolutionIndex: 75
    SolutionNameMin: Cijk_Ailk_Bjlk_SB_MT064x064x16_DTL0_GRVW04_GSU01_PGR1_PLR1_TT04_04_USFGRO0_VW04_WG16_16_01_WGM01
    SolutionIndex: 76
    SolutionNameMin: Cijk_Ailk_Bjlk_SB_MT064x128x16_DTL0_GRVW04_GSU01_PGR0_PLR1_TT04_08_USFGRO0_VW04_WG16_16_01_WGM01
    SolutionIndex: 77
    SolutionNameMin: Cijk_Ailk_Bjlk_SB_MT064x064x16_DTL0_GRVW04_GSU01_PGR1_PLR1_TT04_04_USFGRO0_VW04_WG16_16_01_WGM08
    SolutionIndex: 78
    SolutionNameMin: Cijk_Ailk_Bjlk_SB_MT032x128x16_DTL0_GRVW04_GSU01_PGR0_PLR1_TT04_04_USFGRO0_VW04_WG08_32_01_WGM64
- - - [1024, 128, 1, 128]
    - [8, 1551.29]
  - - [4, 704, 1, 1280]
    - [23, 408.88]
  - - [4, 1856, 1, 3328]
    - [10, 591.368]
  - - [1856, 448, 1, 3328]
    - [49, 8314.24]
  - - [2944, 4288, 1, 1280]
    - [55, 9980.03]
  - - [2368, 64, 1, 3328]
    - [32, 7012.08]
  - - [2368, 5888, 1, 256]
    - [49, 10646.2]
  - - [128, 64, 1, 256]
    - [21, 456.647]
  - - [5888, 1024, 1, 1280]
    - [58, 10594.2]
  - - [128, 6784, 1, 3328]
    - [27, 8711.95]
  - - [64, 4, 1, 256]
    - [65, 17.6933]
  - - [5888, 1856, 1, 3328]
    - [57, 9426.73]
  - - [5056, 704, 1, 256]
    - [55, 9817.25]
  - - [5888, 2944, 1, 3328]
    - [48, 9508.31]
  - - [1856, 4288, 1, 256]
    - [49, 10398.4]
  - - [1024, 5056, 1, 128]
    - [43, 4409.15]
  - - [5056, 5056, 1, 3328]
    - [48, 9395.15]
  - - [1408, 5888, 1, 1280]
    - [48, 10767.6]
  - - [2368, 448, 1, 128]
    - [44, 3566.4]
  - - [1024, 3584, 1, 3328]
    - [55, 10402.6]
  - - [4, 2944, 1, 1280]
    - [14, 620.376]
  - - [1408, 64, 1, 128]
    - [8, 1096.58]
  - - [256, 4288, 1, 3328]
    - [55, 8866.79]
  - - [5888, 1408, 1, 1280]
    - [48, 10696.0]
  - - [704, 1856, 1, 3328]
    - [55, 10537.1]
  - - [4, 1408, 1, 128]
    - [59, 64.4492]
  - - [1024, 2368, 1, 256]
    - [55, 8756.5]
  - - [1408, 1856, 1, 1280]
    - [55, 10748.8]
  - - [1408, 64, 1, 1280]
    - [32, 5071.93]
  - - [448, 1024, 1, 1280]
    - [49, 7926.97]
  - - [256, 1408, 1, 3328]
    - [49, 6686.07]
  - - [5056, 5056, 1, 1280]
    - [48, 9709.12]
  - - [448, 5056, 1, 256]
    - [55, 9230.98]
  - - [704, 1856, 1, 1280]
    - [49, 10276.6]
  - - [128, 5056, 1, 128]
    - [3, 2838.26]
  - - [2368, 128, 1, 256]
    - [49, 4258.18]
  - - [1856, 1408, 1, 128]
    - [44, 4951.27]
  - - [64, 5056, 1, 256]
    - [49, 4204.1]
  - - [6784, 256, 1, 3328]
    - [55, 9910.34]
  - - [6784, 4288, 1, 3328]
    - [58, 9155.96]
  - - [4288, 448, 1, 256]
    - [55, 8689.58]
  - - [64, 704, 1, 128]
    - [7, 540.655]
  - - [1856, 2368, 1, 3328]
    - [49, 10172.2]
  - - [4288, 2944, 1, 1280]
    - [47, 9897.61]
  - - [704, 5056, 1, 1280]
    - [49, 10249.1]
  - - [2368, 704, 1, 3328]
    - [55, 9340.96]
  - - [256, 5888, 1, 256]
    - [49, 8624.37]
  - - [1856, 4288, 1, 3328]
    - [58, 9554.77]
  - - [256, 2944, 1, 256]
    - [49, 7506.0]
  - - [5888, 1024, 1, 256]
    - [56, 9488.44]
  - - [448, 64, 1, 1280]
    - [31, 3135.69]
  - - [448, 5056, 1, 3328]
    - [49, 9778.28]
  - - [3584, 4, 1, 1280]
    - [10, 646.779]
  - - [2944, 64, 1, 256]
    - [49, 3255.79]
  - - [128, 4, 1, 1280]
    - [23, 136.108]
  - - [1408, 2944, 1, 256]
    - [49, 10073.9]
  - - [256, 1856, 1, 1280]
    - [49, 8234.82]
  - - [6784, 5056, 1, 3328]
    - [48, 9062.01]
  - - [5056, 5056, 1, 256]
    - [55, 10475.9]
  - - [1408, 6784, 1, 128]
    - [43, 5608.26]
  - - [64, 1024, 1, 1280]
    - [24, 4194.2]
  - - [2944, 4, 1, 256]
    - [14, 442.356]
  - - [704, 5056, 1, 128]
    - [44, 5212.29]
  - - [4, 2368, 1, 1280]
    - [10, 576.298]
  - - [2368, 2944, 1, 1280]
    - [49, 10206.9]
  - - [128, 3584, 1, 1280]
    - [55, 7911.17]
  - - [6784, 6784, 1, 1280]
    - [48, 9606.74]
  - - [1024, 256, 1, 3328]
    - [55, 7379.22]
  - - [1408, 4288, 1, 1280]
    - [49, 10424.1]
  - - [3584, 4288, 1, 1280]
    - [47, 10063.4]
  - - [2368, 704, 1, 1280]
    - [55, 9614.83]
  - - [5056, 4288, 1, 3328]
    - [48, 9061.77]
  - - [3584, 2368, 1, 3328]
    - [53, 9223.88]
  - - [64, 704, 1, 1280]
    - [26, 3672.42]
  - - [4288, 256, 1, 256]
    - [55, 7253.58]
  - - [2944, 128, 1, 128]
    - [0, 2563.55]
  - - [6784, 448, 1, 1280]
    - [57, 10219.2]
  - - [1408, 2944, 1, 128]
    - [44, 5325.34]
  - - [4288, 2944, 1, 256]
    - [55, 10601.9]
  - - [5888, 704, 1, 1280]
    - [57, 10583.0]
  - - [1856, 64, 1, 1280]
    - [32, 5488.04]
  - - [448, 5888, 1, 128]
    - [44, 4728.24]
  - - [5888, 64, 1, 3328]
    - [34, 7431.86]
  - - [2944, 256, 1, 3328]
    - [49, 9729.75]
  - - [1024, 64, 1, 128]
    - [8, 775.646]
  - - [5056, 2368, 1, 1280]
    - [47, 10086.3]
  - - [448, 3584, 1, 1280]
    - [55, 9248.14]
  - - [6784, 5888, 1, 256]
    - [54, 10564.2]
  - - [704, 1024, 1, 128]
    - [45, 3304.2]
  - - [704, 128, 1, 1280]
    - [32, 5022.79]
  - - [5888, 2944, 1, 128]
    - [43, 5822.84]
  - - [4, 3584, 1, 128]
    - [59, 160.86]
  - - [1408, 448, 1, 1280]
    - [49, 7813.31]
  - - [1024, 1408, 1, 256]
    - [55, 8049.52]
  - - [2368, 2368, 1, 3328]
    - [49, 9848.79]
  - - [1856, 6784, 1, 128]
    - [43, 5915.37]
  - - [5056, 704, 1, 3328]
    - [55, 9965.89]
  - - [1408, 1856, 1, 256]
    - [49, 9710.87]
  - - [1408, 704, 1, 3328]
    - [55, 9898.34]
  - - [2368, 5056, 1, 256]
    - [55, 10691.5]
  - - [5888, 1856, 1, 256]
    - [55, 10644.4]
  - - [4288, 64, 1, 3328]
    - [32, 7017.25]
  - - [2368, 4, 1, 1280]
    - [14, 574.278]
  - - [704, 5888, 1, 256]
    - [49, 10109.5]
  - - [4288, 64, 1, 256]
    - [49, 3661.76]
  - - [6784, 64, 1, 256]
    - [49, 5156.17]
  - - [2944, 256, 1, 256]
    - [55, 7378.41]
  - - [2944, 6784, 1, 3328]
    - [58, 9263.46]
  - - [704, 1408, 1, 3328]
    - [50, 9521.61]
  - - [3584, 704, 1, 3328]
    - [55, 10058.2]
  - - [2944, 256, 1, 128]
    - [45, 3391.36]
  - - [6784, 4, 1, 1280]
    - [62, 644.973]
  - - [1024, 64, 1, 1280]
    - [29, 3700.72]
  - - [448, 4288, 1, 256]
    - [49, 8689.58]
  - - [64, 3584, 1, 3328]
    - [13, 7053.45]
  - - [704, 2368, 1, 1280]
    - [49, 9621.26]
  - - [448, 2944, 1, 128]
    - [44, 3742.22]
  - - [1856, 2368, 1, 1280]
    - [49, 10852.1]
  - - [2368, 128, 1, 3328]
    - [32, 7830.6]
  - - [2944, 128, 1, 256]
    - [49, 5087.09]
  - - [448, 1408, 1, 256]
    - [49, 6526.58]
  - - [1856, 4288, 1, 1280]
    - [54, 10144.5]
  - - [64, 5056, 1, 3328]
    - [27, 7749.2]
  - - [4, 704, 1, 256]
    - [63, 162.2]
  - - [1024, 448, 1, 128]
    - [44, 2165.84]
  - - [704, 4, 1, 1280]
    - [23, 459.052]
  - - [704, 256, 1, 128]
    - [44, 1630.41]
  - - [704, 2944, 1, 128]
    - [44, 4724.66]
  - - [1408, 1024, 1, 1280]
    - [55, 9582.05]
  - - [704, 6784, 1, 256]
    - [49, 9924.91]
  - - [6784, 704, 1, 256]
    - [55, 9924.87]
  - - [5056, 1408, 1, 128]
    - [43, 5586.27]
  - - [256, 3584, 1, 3328]
    - [49, 9158.03]
  - - [4, 5888, 1, 3328]
    - [61, 680.896]
  - - [128, 1408, 1, 128]
    - [8, 1711.07]
  - - [3584, 4288, 1, 3328]
    - [58, 9477.29]
  - - [5888, 1856, 1, 1280]
    - [57, 10154.4]
  - - [5056, 1024, 1, 3328]
    - [47, 10088.9]
  - - [5056, 64, 1, 1280]
    - [32, 5973.67]
  - - [1024, 704, 1, 256]
    - [55, 6863.25]
  - - [1024, 4288, 1, 128]
    - [43, 3951.69]
  - - [4288, 64, 1, 1280]
    - [32, 5692.73]
  - - [2368, 3584, 1, 1280]
    - [49, 10265.9]
  - - [2368, 6784, 1, 1280]
    - [48, 10038.5]
  - - [1024, 256, 1, 256]
    - [49, 4507.13]
  - - [1856, 4, 1, 1280]
    - [10, 511.091]
  - - [448, 448, 1, 256]
    - [49, 3468.12]
  - - [2944, 3584, 1, 3328]
    - [55, 9160.24]
  - - [128, 4288, 1, 128]
    - [3, 2694.33]
  - - [64, 448, 1, 256]
    - [14, 1339.06]
  - - [128, 1024, 1, 3328]
    - [33, 7052.21]
  - - [4, 1408, 1, 3328]
    - [11, 632.568]
  - - [6784, 2944, 1, 256]
    - [55, 10771.1]
  - - [64, 1856, 1, 1280]
    - [32, 5131.32]
  - - [64, 1024, 1, 128]
    - [7, 814.705]
  - - [4288, 2368, 1, 3328]
    - [50, 8999.65]
  - - [1856, 2368, 1, 256]
    - [49, 10132.5]
  - - [3584, 256, 1, 128]
    - [45, 3215.79]
  - - [3584, 6784, 1, 3328]
    - [48, 9369.21]
  - - [256, 1024, 1, 256]
    - [49, 4950.49]
  - - [4, 6784, 1, 3328]
    - [10, 679.181]
  - - [1024, 5888, 1, 3328]
    - [47, 9894.3]
  - - [1024, 128, 1, 1280]
    - [27, 4322.24]
  - - [4288, 128, 1, 1280]
    - [32, 6917.61]
  - - [5056, 4288, 1, 1280]
    - [56, 9416.6]
  - - [5888, 64, 1, 256]
    - [49, 4718.35]
  - - [1856, 256, 1, 1280]
    - [49, 8276.28]
  - - [64, 5888, 1, 3328]
    - [34, 7210.29]
  - - [2944, 5888, 1, 128]
    - [43, 6124.03]
  - - [704, 5888, 1, 1280]
    - [55, 10623.8]
  - - [2368, 3584, 1, 128]
    - [43, 5492.48]
  - - [6784, 5888, 1, 3328]
    - [58, 9190.21]
  - - [704, 1024, 1, 1280]
    - [49, 8935.93]
  - - [448, 256, 1, 3328]
    - [27, 6605.83]
  - - [448, 1856, 1, 128]
    - [44, 3325.85]
  - - [128, 1024, 1, 128]
    - [8, 1530.35]
  - - [2944, 4, 1, 128]
    - [59, 131.277]
  - - [1024, 704, 1, 1280]
    - [55, 8686.64]
  - - [128, 5888, 1, 256]
    - [49, 7214.93]
  - - [1024, 5056, 1, 1280]
    - [54, 10292.4]
  - - [4288, 1024, 1, 256]
    - [55, 9898.54]
  - - [2944, 2368, 1, 128]
    - [43, 5299.68]
  - - [704, 704, 1, 3328]
    - [55, 9178.2]
  - - [704, 1408, 1, 1280]
    - [49, 9590.11]
  - - [5888, 448, 1, 1280]
    - [49, 9589.76]
  - - [3584, 256, 1, 3328]
    - [55, 9151.93]
  - - [704, 5888, 1, 3328]
    - [49, 10179.1]
  - - [704, 1856, 1, 128]
    - [44, 4188.79]
  - - [128, 3584, 1, 3328]
    - [55, 8478.05]
  - - [6784, 2368, 1, 1280]
    - [48, 9959.66]
  - - [4, 4288, 1, 128]
    - [59, 182.947]
  - - [128, 704, 1, 1280]
    - [27, 5022.9]
  - - [3584, 2944, 1, 256]
    - [49, 10469.2]
  - - [1856, 128, 1, 3328]
    - [18, 7667.46]
  - - [4, 64, 1, 1280]
    - [23, 68.054]
  - - [4, 5056, 1, 3328]
    - [9, 695.707]
  - - [128, 2944, 1, 1280]
    - [18, 6617.35]
  - - [2368, 1024, 1, 3328]
    - [52, 9556.08]
  - - [128, 256, 1, 3328]
    - [37, 4434.18]
  - - [1408, 5056, 1, 3328]
    - [55, 9601.77]
  - - [1856, 1856, 1, 3328]
    - [55, 9610.04]
  - - [3584, 128, 1, 256]
    - [49, 5893.54]
  - - [448, 1408, 1, 3328]
    - [49, 8173.91]
  - - [2368, 2368, 1, 256]
    - [49, 10151.2]
  - - [4288, 4288, 1, 1280]
    - [47, 9497.96]
  - - [64, 448, 1, 1280]
    - [26, 3175.85]
  - - [1408, 4288, 1, 256]
    - [54, 9527.37]
  - - [448, 4, 1, 256]
    - [21, 129.026]
  - - [5888, 448, 1, 128]
    - [45, 4403.89]
  - - [448, 4, 1, 1280]
    - [23, 391.962]
  - - [704, 6784, 1, 3328]
    - [49, 9857.41]
  - - [5888, 5888, 1, 1280]
    - [58, 9428.71]
  - - [5056, 1024, 1, 1280]
    - [54, 10335.2]
  - - [448, 5888, 1, 3328]
    - [49, 9246.18]
  - - [128, 4, 1, 128]
    - [59, 5.7825]
  - - [1024, 2944, 1, 1280]
    - [55, 10323.3]
  - - [5056, 5888, 1, 1280]
    - [48, 9697.87]
  - - [4288, 5888, 1, 128]
    - [43, 6301.7]
  - - [256, 3584, 1, 256]
    - [49, 7425.78]
  - - [1408, 3584, 1, 128]
    - [44, 5359.38]
  - - [256, 2944, 1, 3328]
    - [49, 9738.14]
  - - [448, 3584, 1, 128]
    - [44, 4122.5]
  - - [5888, 2944, 1, 1280]
    - [48, 9980.56]
  - - [4, 6784, 1, 1280]
    - [9, 644.088]
  - - [2368, 5888, 1, 128]
    - [43, 6111.71]
  - - [64, 2944, 1, 128]
    - [8, 1788.85]
  - - [3584, 5888, 1, 256]
    - [55, 10802.6]
  - - [2368, 704, 1, 128]
    - [44, 4254.94]
  - - [3584, 2944, 1, 1280]
    - [49, 10061.3]
  - - [3584, 2368, 1, 128]
    - [43, 5288.47]
  - - [5056, 704, 1, 128]
    - [44, 5216.71]
  - - [448, 2368, 1, 128]
    - [44, 3478.38]
  - - [5056, 1408, 1, 3328]
    - [47, 9657.73]
  - - [1408, 704, 1, 256]
    - [49, 8041.3]
  - - [6784, 1024, 1, 3328]
    - [54, 9544.23]
  - - [6784, 2944, 1, 3328]
    - [48, 9288.58]
  - - [2944, 5056, 1, 3328]
    - [58, 9199.31]
  - - [1856, 1856, 1, 256]
    - [55, 8811.69]
  - - [1024, 5888, 1, 128]
    - [44, 4399.63]
  - - [2048, 7133, 1, 2048]
    - [58, 10017.4]
  - - [256, 4, 1, 128]
    - [59, 11.1285]
  - - [4288, 5888, 1, 1280]
    - [48, 9561.39]
  - - [4288, 4288, 1, 256]
    - [49, 10444.3]
  - - [448, 2944, 1, 3328]
    - [50, 8687.02]
  - - [4288, 1856, 1, 1280]
    - [58, 10159.5]
  - - [1856, 2944, 1, 3328]
    - [55, 10022.9]
  - - [256, 6784, 1, 3328]
    - [55, 10039.1]
  - - [64, 5888, 1, 256]
    - [55, 4770.26]
  - - [256, 5056, 1, 128]
    - [44, 3527.66]
  - - [5056, 1024, 1, 256]
    - [56, 9666.3]
  - - [704, 64, 1, 3328]
    - [39, 5355.04]
  - - [5056, 1856, 1, 3328]
    - [55, 9366.12]
  - - [4, 2944, 1, 3328]
    - [14, 658.028]
  - - [4, 5056, 1, 256]
    - [61, 499.238]
  - - [1856, 1408, 1, 256]
    - [49, 9710.87]
  - - [3584, 4, 1, 128]
    - [59, 162.974]
  - - [448, 448, 1, 3328]
    - [32, 7156.29]
  - - [6784, 128, 1, 3328]
    - [32, 8993.09]
  - - [4288, 1408, 1, 128]
    - [45, 5467.75]
  - - [4288, 5056, 1, 256]
    - [48, 10364.4]
  - - [1408, 128, 1, 1280]
    - [32, 5810.02]
  - - [5056, 256, 1, 3328]
    - [55, 10445.5]
  - - [704, 704, 1, 256]
    - [49, 6537.39]
  - - [1024, 5888, 1, 1280]
    - [54, 10325.4]
  - - [6784, 2368, 1, 128]
    - [43, 5926.26]
  - - [4, 5056, 1, 1280]
    - [61, 661.853]
  - - [64, 128, 1, 256]
    - [25, 524.288]
  - - [128, 1856, 1, 1280]
    - [12, 6248.19]
  - - [5056, 3584, 1, 256]
    - [47, 10402.5]
  - - [1856, 1024, 1, 1280]
    - [58, 9420.64]
  - - [6784, 4288, 1, 1280]
    - [48, 9458.9]
  - - [1856, 1856, 1, 1280]
    - [55, 10208.1]
  - - [6784, 2944, 1, 128]
    - [43, 5852.24]
  - - [1408, 5056, 1, 1280]
    - [58, 10452.0]
  - - [4, 2368, 1, 3328]
    - [10, 670.142]
  - - [5888, 1856, 1, 128]
    - [43, 5225.02]
  - - [448, 704, 1, 1280]
    - [49, 5544.06]
  - - [2368, 1024, 1, 128]
    - [45, 4519.92]
  - - [1024, 448, 1, 3328]
    - [55, 8446.76]
  - - [1856, 704, 1, 1280]
    - [49, 10286.0]
  - - [5056, 3584, 1, 128]
    - [43, 6116.73]
  - - [5888, 5888, 1, 3328]
    - [58, 9246.02]
  - - [6784, 1024, 1, 256]
    - [58, 9731.43]
  - - [2944, 2368, 1, 256]
    - [48, 9660.11]
  - - [256, 448, 1, 256]
    - [20, 2590.45]
  - - [5056, 5888, 1, 3328]
    - [58, 9303.49]
  - - [1856, 1024, 1, 256]
    - [55, 8314.07]
  - - [448, 1408, 1, 1280]
    - [49, 7807.75]
  - - [3584, 448, 1, 1280]
    - [55, 9248.14]
  - - [1024, 1024, 1, 1280]
    - [57, 9561.37]
  - - [448, 5888, 1, 256]
    - [49, 9088.72]
  - - [704, 64, 1, 128]
    - [8, 544.432]
  - - [1408, 6784, 1, 3328]
    - [57, 9192.09]
  - - [448, 1024, 1, 128]
    - [44, 2882.47]
  - - [4288, 704, 1, 128]
    - [44, 5034.96]
  - - [128, 1856, 1, 128]
    - [3, 2105.14]
  - - [448, 2368, 1, 3328]
    - [55, 8042.69]
  - - [5056, 64, 1, 128]
    - [0, 2310.48]
  - - [5056, 2944, 1, 256]
    - [55, 10267.6]
  - - [6784, 5888, 1, 128]
    - [43, 6183.6]
  - - [704, 1024, 1, 256]
    - [49, 7200.38]
  - - [1024, 4, 1, 256]
    - [63, 221.172]
  - - [2368, 1856, 1, 256]
    - [49, 10125.8]
  - - [128, 6784, 1, 1280]
    - [55, 8299.01]
  - - [1408, 3584, 1, 3328]
    - [54, 10041.7]
  - - [2368, 6784, 1, 256]
    - [55, 10711.4]
  - - [5056, 1408, 1, 1280]
    - [48, 10345.6]
  - - [256, 256, 1, 128]
    - [8, 780.953]
  - - [5056, 4288, 1, 128]
    - [43, 6114.26]
  - - [1408, 1856, 1, 128]
    - [44, 4908.19]
  - - [1408, 5888, 1, 3328]
    - [47, 9713.0]
  - - [1856, 256, 1, 256]
    - [49, 6339.77]
  - - [6784, 6784, 1, 256]
    - [48, 10471.3]
  - - [64, 256, 1, 128]
    - [8, 246.188]
  - - [4288, 2368, 1, 128]
    - [45, 5538.36]
  - - [1856, 4288, 1, 128]
    - [44, 5827.07]
  - - [256, 4288, 1, 1280]
    - [49, 8617.95]
  - - [2368, 2944, 1, 256]
    - [49, 10389.1]
  - - [4, 1856, 1, 256]
    - [63, 356.341]
  - - [3584, 1856, 1, 1280]
    - [49, 10416.1]
  - - [6784, 6784, 1, 128]
    - [43, 6107.41]
  - - [256, 1856, 1, 128]
    - [44, 2293.31]
  - - [704, 64, 1, 1280]
    - [26, 3816.41]
  - - [5888, 5056, 1, 256]
    - [58, 10528.1]
  - - [3584, 448, 1, 256]
    - [55, 8088.75]
  - - [448, 4288, 1, 128]
    - [44, 4402.39]
  - - [2944, 4288, 1, 3328]
    - [58, 9169.57]
  - - [256, 6784, 1, 256]
    - [55, 8723.65]
  - - [1408, 4288, 1, 128]
    - [44, 5525.67]
  - - [2944, 704, 1, 3328]
    - [49, 10379.4]
  - - [128, 448, 1, 256]
    - [14, 2022.19]
  - - [512, 32, 1, 512]
    - [30, 1617.86]
  - - [3584, 3584, 1, 256]
    - [49, 10408.2]
  - - [448, 1408, 1, 128]
    - [44, 3070.33]
  - - [128, 256, 1, 1280]
    - [31, 3606.45]
  - - [3584, 5056, 1, 256]
    - [49, 10594.3]
  - - [6784, 128, 1, 256]
    - [49, 6820.32]
  - - [4288, 4, 1, 256]
    - [9, 463.103]
  - - [64, 1408, 1, 3328]
    - [27, 6540.24]
  - - [704, 448, 1, 256]
    - [49, 4308.11]
  - - [2944, 2368, 1, 1280]
    - [49, 10458.6]
  - - [448, 64, 1, 3328]
    - [39, 4038.1]
  - - [1408, 3584, 1, 256]
    - [55, 9988.18]
  - - [3584, 4, 1, 3328]
    - [14, 703.13]
  - - [6784, 3584, 1, 256]
    - [55, 10860.3]
  - - [256, 128, 1, 128]
    - [8, 456.622]
  - - [704, 1408, 1, 128]
    - [44, 3910.49]
  - - [4, 2368, 1, 256]
    - [63, 409.185]
  - - [2944, 448, 1, 128]
    - [44, 3909.11]
  - - [128, 1408, 1, 256]
    - [49, 3642.33]
  - - [4, 2944, 1, 256]
    - [14, 432.954]
  - - [64, 128, 1, 3328]
    - [40, 2389.92]
  - - [5056, 2368, 1, 128]
    - [43, 5965.39]
  - - [2944, 2944, 1, 3328]
    - [50, 9325.68]
  - - [5056, 6784, 1, 256]
    - [58, 10348.9]
  - - [1856, 3584, 1, 128]
    - [45, 5590.51]
  - - [128, 2944, 1, 128]
    - [0, 2533.66]
  - - [1024, 704, 1, 3328]
    - [55, 9214.04]
  - - [6784, 448, 1, 256]
    - [55, 8901.08]
  - - [3584, 6784, 1, 128]
    - [43, 5697.45]
  - - [128, 4288, 1, 256]
    - [49, 5595.41]
  - - [704, 448, 1, 3328]
    - [55, 5862.42]
  - - [1024, 1024, 1, 3328]
    - [52, 10040.3]
  - - [128, 128, 1, 3328]
    - [36, 3455.71]
  - - [5056, 1856, 1, 256]
    - [55, 10577.2]
  - - [256, 128, 1, 256]
    - [14, 1551.29]
  - - [1024, 1856, 1, 256]
    - [55, 8303.5]
  - - [4288, 64, 1, 128]
    - [3, 2017.88]
  - - [256, 448, 1, 3328]
    - [32, 6408.62]
  - - [1408, 6784, 1, 1280]
    - [55, 10272.7]
  - - [3584, 3584, 1, 1280]
    - [55, 10034.1]
  - - [64, 2368, 1, 1280]
    - [18, 5165.12]
  - - [448, 2368, 1, 1280]
    - [49, 8355.14]
  - - [5888, 5888, 1, 128]
    - [43, 5793.55]
  - - [64, 6784, 1, 3328]
    - [55, 7961.64]
  - - [2944, 256, 1, 1280]
    - [49, 9249.23]
  - - [5056, 5888, 1, 128]
    - [43, 6058.95]
  - - [256, 2368, 1, 128]
    - [44, 2436.06]
  - - [5056, 2368, 1, 3328]
    - [48, 9391.48]
  - - [2944, 4288, 1, 256]
    - [49, 10612.2]
  - - [1408, 3584, 1, 1280]
    - [49, 10357.1]
  - - [2368, 64, 1, 256]
    - [15, 2756.57]
  - - [64, 448, 1, 3328]
    - [37, 4025.41]
  - - [256, 256, 1, 3328]
    - [32, 5841.88]
  - - [5888, 4, 1, 128]
    - [59, 224.84]
  - - [1856, 704, 1, 256]
    - [49, 8734.14]
  - - [4, 4288, 1, 1280]
    - [9, 622.648]
  - - [1408, 448, 1, 3328]
    - [49, 8171.56]
  - - [1024, 4, 1, 3328]
    - [21, 539.647]
  - - [2368, 256, 1, 256]
    - [49, 6235.13]
  - - [2368, 6784, 1, 3328]
    - [54, 9320.13]
  - - [1856, 1408, 1, 1280]
    - [49, 10741.1]
  - - [1856, 448, 1, 1280]
    - [49, 8058.12]
  - - [6784, 704, 1, 128]
    - [45, 5276.57]
  - - [4, 4, 1, 256]
    - [21, 0.863953]
  - - [128, 5888, 1, 128]
    - [1, 3085.97]
  - - [1408, 5888, 1, 256]
    - [49, 10517.8]
  - - [704, 2944, 1, 1280]
    - [55, 10548.7]
  - - [1856, 2368, 1, 128]
    - [45, 4806.55]
  - - [4096, 7133, 1, 4096]
    - [54, 9337.93]
  - - [256, 64, 1, 256]
    - [14, 871.091]
  - - [1024, 1024, 1, 256]
    - [55, 7502.6]
  - - [704, 1856, 1, 256]
    - [49, 8683.8]
  - - [128, 4288, 1, 3328]
    - [27, 8336.24]
  - - [3584, 704, 1, 1280]
    - [57, 10055.0]
  - - [256, 128, 1, 1280]
    - [31, 3516.79]
  - - [2368, 4, 1, 256]
    - [63, 394.41]
  - - [256, 2368, 1, 1280]
    - [49, 7525.09]
  - - [2944, 6784, 1, 128]
    - [44, 5889.19]
  - - [3584, 448, 1, 3328]
    - [55, 9027.09]
  - - [1408, 4, 1, 256]
    - [63, 294.905]
  - - [704, 2368, 1, 3328]
    - [55, 9367.83]
  - - [2944, 448, 1, 256]
    - [49, 7738.48]
  - - [1856, 448, 1, 128]
    - [44, 3257.99]
  - - [2368, 128, 1, 1280]
    - [32, 6242.53]
  - - [256, 5888, 1, 128]
    - [44, 3694.47]
  - - [64, 6784, 1, 256]
    - [49, 5264.86]
  - - [64, 5056, 1, 1280]
    - [32, 6044.68]
  - - [4, 6784, 1, 128]
    - [59, 248.092]
  - - [2944, 2944, 1, 1280]
    - [49, 10106.8]
  - - [5888, 2368, 1, 256]
    - [55, 10653.3]
  - - [4, 3584, 1, 1280]
    - [14, 650.182]
  - - [1408, 128, 1, 128]
    - [8, 1711.07]
  - - [6784, 704, 1, 3328]
    - [49, 9732.66]
  - - [128, 64, 1, 1280]
    - [35, 1791.83]
  - - [2368, 256, 1, 1280]
    - [55, 7519.7]
  - - [4, 448, 1, 3328]
    - [66, 447.261]
  - - [5888, 4288, 1, 128]
    - [43, 5576.72]
  - - [4, 5888, 1, 256]
    - [9, 478.783]
  - - [1408, 2944, 1, 3328]
    - [48, 10320.7]
  - - [3584, 704, 1, 128]
    - [45, 4480.85]
  - - [64, 1024, 1, 256]
    - [15, 2097.02]
  - - [5056, 5056, 1, 128]
    - [43, 6118.81]
  - - [2368, 448, 1, 1280]
    - [49, 8320.99]
  - - [128, 3584, 1, 256]
    - [49, 5850.23]
  - - [704, 448, 1, 1280]
    - [49, 5504.86]
  - - [448, 5056, 1, 128]
    - [44, 4767.27]
  - - [256, 4, 1, 1280]
    - [23, 264.072]
  - - [128, 5056, 1, 256]
    - [49, 6335.81]
  - - [1408, 5056, 1, 128]
    - [44, 5655.61]
  - - [2944, 3584, 1, 128]
    - [43, 5669.17]
  - - [3584, 2368, 1, 256]
    - [49, 10349.3]
  - - [5888, 5056, 1, 1280]
    - [58, 9660.54]
  - - [2368, 5056, 1, 128]
    - [43, 6019.21]
  - - [64, 704, 1, 256]
    - [25, 1730.06]
  - - [4288, 256, 1, 1280]
    - [55, 8610.13]
  - - [3584, 3584, 1, 3328]
    - [58, 9326.76]
  - - [1024, 256, 1, 128]
    - [45, 1728.9]
  - - [4, 704, 1, 128]
    - [59, 31.5975]
  - - [5888, 6784, 1, 256]
    - [48, 10485.6]
  - - [4288, 2944, 1, 3328]
    - [54, 9088.02]
  - - [2944, 64, 1, 128]
    - [8, 1769.42]
  - - [1856, 64, 1, 256]
    - [14, 2648.38]
  - - [4288, 128, 1, 3328]
    - [18, 8373.03]
  - - [4288, 704, 1, 1280]
    - [55, 10434.6]
  - - [256, 5056, 1, 1280]
    - [49, 10175.3]
  - - [1408, 256, 1, 128]
    - [44, 2097.1]
  - - [2944, 5888, 1, 3328]
    - [48, 9478.46]
  - - [6784, 5888, 1, 1280]
    - [48, 9609.25]
  - - [704, 128, 1, 256]
    - [15, 2289.81]
  - - [5888, 4288, 1, 1280]
    - [48, 9625.3]
  - - [448, 256, 1, 1280]
    - [32, 5215.04]
  - - [5888, 3584, 1, 128]
    - [43, 5602.1]
  - - [1856, 1856, 1, 128]
    - [44, 5044.34]
  - - [5056, 4, 1, 1280]
    - [61, 661.853]
  - - [256, 1408, 1, 1280]
    - [49, 6297.62]
  - - [512, 16, 1, 512]
    - [22, 765.105]
  - - [704, 3584, 1, 128]
    - [44, 4828.17]
  - - [5888, 448, 1, 3328]
    - [55, 9676.52]
  - - [2368, 4288, 1, 1280]
    - [55, 10278.6]
  - - [4288, 2944, 1, 128]
    - [43, 5866.95]
  - - [1024, 6784, 1, 3328]
    - [58, 9654.06]
  - - [128, 2368, 1, 256]
    - [49, 4258.06]
  - - [6784, 64, 1, 3328]
    - [55, 7981.19]
  - - [5056, 2944, 1, 3328]
    - [54, 9228.13]
  - - [448, 128, 1, 256]
    - [14, 1981.65]
  - - [2944, 3584, 1, 256]
    - [55, 10268.7]
  - - [1408, 1408, 1, 3328]
    - [55, 9785.24]
  - - [1856, 128, 1, 1280]
    - [18, 6219.76]
  - - [3584, 3584, 1, 128]
    - [43, 5673.71]
  - - [64, 3584, 1, 256]
    - [49, 3904.92]
  - - [1408, 4, 1, 3328]
    - [11, 635.743]
  - - [128, 2944, 1, 3328]
    - [32, 7966.95]
  - - [3584, 704, 1, 256]
    - [49, 9168.98]
  - - [2944, 448, 1, 3328]
    - [55, 8838.63]
  - - [3584, 1408, 1, 3328]
    - [58, 10120.1]
  - - [704, 3584, 1, 1280]
    - [49, 10380.6]
  - - [2944, 6784, 1, 1280]
    - [52, 9547.31]
  - - [1856, 6784, 1, 256]
    - [55, 10566.6]
  - - [4288, 448, 1, 3328]
    - [55, 9644.09]
  - - [6784, 4288, 1, 128]
    - [43, 6258.94]
  - - [6784, 704, 1, 1280]
    - [55, 9974.07]
  - - [256, 4288, 1, 256]
    - [49, 7281.4]
  - - [3584, 64, 1, 128]
    - [8, 2043.01]
  - - [5888, 1024, 1, 3328]
    - [58, 9921.84]
  - - [448, 64, 1, 128]
    - [7, 361.631]
  - - [704, 6784, 1, 1280]
    - [56, 9885.66]
  - - [5888, 128, 1, 256]
    - [55, 7275.33]
  - - [2368, 448, 1, 3328]
    - [49, 8556.72]
  - - [1856, 5056, 1, 3328]
    - [55, 9334.6]
  - - [4, 6784, 1, 256]
    - [61, 512.453]
  - - [1024, 3584, 1, 128]
    - [44, 4163.87]
  - - [1024, 1408, 1, 128]
    - [45, 3177.72]
  - - [2368, 2944, 1, 128]
    - [45, 5692.91]
  - - [5056, 64, 1, 256]
    - [55, 4219.84]
  - - [4, 448, 1, 1280]
    - [21, 347.908]
  - - [5056, 2944, 1, 128]
    - [43, 5888.33]
  - - [5888, 5056, 1, 3328]
    - [48, 9336.16]
  - - [1024, 704, 1, 128]
    - [45, 2799.21]
  - - [1408, 2368, 1, 128]
    - [44, 4657.41]
  - - [5888, 2368, 1, 128]
    - [43, 5639.6]
  - - [128, 5056, 1, 3328]
    - [27, 8516.41]
  - - [3584, 6784, 1, 1280]
    - [47, 9702.77]
  - - [3072, 7435, 1, 1024]
    - [54, 9710.72]
  - - [1856, 5888, 1, 256]
    - [55, 10647.4]
  - - [256, 256, 1, 256]
    - [20, 1969.39]
  - - [256, 64, 1, 128]
    - [8, 202.213]
  - - [4288, 4288, 1, 3328]
    - [48, 8888.98]
  - - [4288, 1408, 1, 1280]
    - [58, 10441.9]
  - - [3584, 5056, 1, 128]
    - [43, 5846.07]
  - - [4, 1024, 1, 3328]
    - [21, 524.278]
  - - [4288, 2368, 1, 256]
    - [55, 10239.6]
  - - [2944, 5056, 1, 1280]
    - [58, 9846.94]
  - - [448, 6784, 1, 256]
    - [55, 9635.99]
  - - [64, 1024, 1, 3328]
    - [27, 5784.48]
  - - [6784, 2368, 1, 3328]
    - [58, 9270.57]
  - - [256, 1024, 1, 1280]
    - [49, 6781.0]
  - - [704, 4, 1, 128]
    - [59, 31.3924]
  - - [256, 4, 1, 256]
    - [21, 82.2929]
  - - [4288, 128, 1, 256]
    - [49, 5562.52]
  - - [4288, 1856, 1, 3328]
    - [48, 9500.95]
  - - [3584, 448, 1, 128]
    - [44, 3826.81]
  - - [256, 4, 1, 3328]
    - [66, 383.381]
  - - [4, 1408, 1, 1280]
    - [21, 499.063]
  - - [3584, 64, 1, 1280]
    - [55, 5863.17]
  - - [1408, 448, 1, 128]
    - [44, 2986.18]
  - - [3584, 1024, 1, 1280]
    - [56, 10516.7]
  - - [1856, 5056, 1, 256]
    - [55, 10546.3]
  - - [4, 3584, 1, 256]
    - [14, 463.006]
  - - [1024, 4288, 1, 256]
    - [49, 9665.29]
  - - [5888, 3584, 1, 3328]
    - [48, 9332.37]
  - - [4, 256, 1, 256]
    - [21, 82.2929]
  - - [5056, 3584, 1, 3328]
    - [58, 9377.53]
  - - [128, 5888, 1, 1280]
    - [55, 9223.01]
  - - [704, 448, 1, 128]
    - [44, 2088.04]
  - - [2368, 1408, 1, 1280]
    - [55, 10324.8]
  - - [5056, 2944, 1, 1280]
    - [55, 9913.36]
  - - [4, 4, 1, 128]
    - [60, 0.0602335]
  - - [3584, 256, 1, 256]
    - [49, 7443.19]
  - - [128, 1856, 1, 3328]
    - [18, 7585.73]
  - - [1024, 6784, 1, 256]
    - [55, 10134.0]
  - - [4, 128, 1, 256]
    - [21, 41.1464]
  - - [64, 64, 1, 1280]
    - [23, 852.778]
  - - [6784, 4, 1, 128]
    - [59, 246.787]
  - - [2944, 1408, 1, 128]
    - [44, 5357.2]
  - - [448, 128, 1, 3328]
    - [32, 5600.61]
  - - [64, 2944, 1, 3328]
    - [33, 6739.56]
  - - [64, 4288, 1, 3328]
    - [27, 7325.76]
  - - [5056, 6784, 1, 3328]
    - [58, 9194.59]
  - - [128, 2944, 1, 256]
    - [49, 5067.18]
  - - [128, 6784, 1, 128]
    - [0, 3178.96]
  - - [3584, 4288, 1, 256]
    - [55, 10735.9]
  - - [448, 1856, 1, 256]
    - [49, 6924.22]
  - - [1856, 6784, 1, 3328]
    - [54, 9106.9]
  - - [3584, 128, 1, 3328]
    - [55, 8422.6]
  - - [64, 1856, 1, 256]
    - [15, 2565.7]
  - - [1024, 448, 1, 1280]
    - [49, 7809.79]
  - - [5888, 4288, 1, 256]
    - [55, 10536.6]
  - - [4, 448, 1, 128]
    - [59, 19.7228]
  - - [5056, 1408, 1, 256]
    - [58, 9809.4]
  - - [64, 256, 1, 1280]
    - [25, 2597.25]
  - - [3584, 1024, 1, 256]
    - [56, 9085.38]
  - - [256, 704, 1, 256]
    - [55, 3422.14]
  - - [5888, 5888, 1, 256]
    - [48, 10520.8]
  - - [4288, 1024, 1, 1280]
    - [55, 10253.0]
  - - [5888, 128, 1, 3328]
    - [49, 9671.39]
  - - [448, 6784, 1, 3328]
    - [55, 10048.7]
  - - [2944, 1408, 1, 1280]
    - [58, 10890.4]
  - - [1024, 32, 1, 512]
    - [30, 2220.38]
  - - [2944, 1856, 1, 3328]
    - [55, 10050.4]
  - - [2368, 64, 1, 128]
    - [8, 1577.51]
  - - [2944, 2944, 1, 128]
    - [45, 5722.7]
  - - [4, 128, 1, 3328]
    - [66, 250.027]
  - - [3584, 5888, 1, 1280]
    - [58, 9770.4]
  - - [64, 4, 1, 128]
    - [59, 2.557]
  - - [6784, 1856, 1, 1280]
    - [47, 9827.77]
  - - [2944, 5056, 1, 256]
    - [49, 10781.9]
  - - [2944, 5888, 1, 1280]
    - [49, 9938.17]
  - - [5888, 256, 1, 3328]
    - [49, 10161.9]
  - - [1856, 5888, 1, 3328]
    - [58, 9373.46]
  - - [3584, 1408, 1, 256]
    - [55, 9908.73]
  - - [704, 3584, 1, 3328]
    - [56, 9901.8]
  - - [5056, 448, 1, 1280]
    - [55, 10316.1]
  - - [3584, 1856, 1, 3328]
    - [49, 9580.58]
  - - [64, 1408, 1, 128]
    - [8, 1088.86]
  - - [1408, 704, 1, 1280]
    - [49, 9579.4]
  - - [2944, 1024, 1, 256]
    - [55, 9138.89]
  - - [1024, 2368, 1, 128]
    - [45, 3778.15]
  - - [2368, 4288, 1, 3328]
    - [57, 9156.82]
  - - [4, 1408, 1, 256]
    - [63, 308.933]
  - - [1024, 1408, 1, 1280]
    - [55, 9508.91]
  - - [64, 64, 1, 256]
    - [21, 214.477]
  - - [704, 256, 1, 3328]
    - [49, 5167.11]
  - - [6784, 5056, 1, 256]
    - [47, 10472.4]
  - - [4, 4288, 1, 3328]
    - [62, 666.015]
  - - [448, 6784, 1, 128]
    - [44, 5025.47]
  - - [4, 704, 1, 3328]
    - [23, 527.134]
  - - [448, 2944, 1, 256]
    - [49, 7738.57]
  - - [2944, 6784, 1, 256]
    - [47, 10597.5]
  - - [2368, 2368, 1, 1280]
    - [55, 10409.7]
  - - [4, 4, 1, 1280]
    - [23, 3.49966]
  - - [1856, 3584, 1, 1280]
    - [55, 10411.3]
  - - [64, 2944, 1, 256]
    - [55, 3223.48]
  - - [3584, 1408, 1, 1280]
    - [54, 10161.6]
  - - [448, 256, 1, 128]
    - [8, 1348.16]
  - - [4288, 448, 1, 128]
    - [44, 4437.75]
  - - [5056, 256, 1, 1280]
    - [55, 10120.1]
  - - [1856, 1408, 1, 3328]
    - [49, 10431.3]
  - - [128, 128, 1, 128]
    - [7, 257.367]
  - - [1024, 4288, 1, 3328]
    - [55, 9678.56]
  - - [448, 2368, 1, 256]
    - [55, 7160.63]
  - - [1024, 4, 1, 128]
    - [59, 46.5641]
  - - [5056, 448, 1, 256]
    - [55, 9274.76]
  - - [2944, 2368, 1, 3328]
    - [55, 9798.24]
  - - [704, 128, 1, 3328]
    - [32, 6647.66]
  - - [64, 64, 1, 3328]
    - [42, 1821.9]
  - - [1024, 1856, 1, 1280]
    - [58, 9345.58]
  - - [6784, 1856, 1, 256]
    - [55, 10574.4]
  - - [128, 2368, 1, 3328]
    - [27, 7768.07]
  - - [1024, 5888, 1, 256]
    - [55, 9993.62]
  - - [5056, 128, 1, 1280]
    - [55, 7936.6]
  - - [5056, 64, 1, 3328]
    - [32, 7794.92]
  - - [128, 704, 1, 128]
    - [8, 1088.92]
  - - [1408, 2368, 1, 256]
    - [49, 9814.71]
  - - [1408, 1408, 1, 256]
    - [49, 8944.1]
  - - [4, 64, 1, 128]
    - [59, 2.54222]
  - - [64, 128, 1, 1280]
    - [38, 1791.83]
  - - [2368, 2368, 1, 128]
    - [45, 5455.69]
  - - [64, 5888, 1, 128]
    - [0, 2466.42]
  - - [5888, 4, 1, 3328]
    - [62, 669.266]
  - - [6784, 1408, 1, 128]
    - [43, 5568.53]
  - - [4288, 5888, 1, 256]
    - [48, 10656.3]
  - - [1408, 5056, 1, 256]
    - [55, 10250.8]
  - - [5056, 128, 1, 3328]
    - [32, 8444.69]
  - - [128, 128, 1, 1280]
    - [36, 2483.45]
  - - [448, 704, 1, 256]
    - [49, 4522.64]
  - - [4288, 3584, 1, 128]
    - [43, 6159.9]
  - - [2944, 128, 1, 3328]
    - [18, 8131.5]
  - - [128, 5056, 1, 1280]
    - [49, 7936.6]
  - - [3584, 5056, 1, 1280]
    - [57, 9685.59]
  - - [256, 448, 1, 1280]
    - [27, 5270.55]
  - - [704, 704, 1, 128]
    - [44, 3102.83]
  - - [5056, 4, 1, 128]
    - [59, 203.177]
  - - [704, 256, 1, 1280]
    - [49, 4805.77]
  - - [64, 2368, 1, 3328]
    - [27, 6891.41]
  - - [1856, 1024, 1, 128]
    - [43, 4419.99]
  - - [1856, 64, 1, 128]
    - [8, 1368.34]
  - - [64, 6784, 1, 1280]
    - [49, 7362.42]
  - - [704, 4288, 1, 256]
    - [49, 9597.44]
  - - [5888, 2368, 1, 1280]
    - [48, 10004.7]
  - - [128, 256, 1, 256]
    - [14, 1551.29]
  - - [256, 64, 1, 1280]
    - [25, 2573.67]
  - - [2368, 5888, 1, 1280]
    - [49, 9922.31]
  - - [5888, 256, 1, 1280]
    - [55, 10009.9]
  - - [4, 5888, 1, 1280]
    - [61, 667.151]
  - - [704, 128, 1, 128]
    - [8, 1112.23]
  - - [1024, 4, 1, 1280]
    - [21, 450.807]
  - - [2368, 1856, 1, 3328]
    - [49, 9873.62]
  - - [2368, 128, 1, 128]
    - [0, 2228.71]
  - - [2944, 704, 1, 256]
    - [49, 9314.13]
  - - [5056, 128, 1, 128]
    - [1, 3195.09]
  - - [256, 704, 1, 3328]
    - [49, 5200.29]
  - - [704, 3584, 1, 256]
    - [49, 9406.32]
  - - [1024, 1024, 1, 1024]
    - [55, 9406.25]
  - - [704, 2944, 1, 3328]
    - [55, 10455.2]
  - - [6784, 1024, 1, 128]
    - [43, 5180.72]
  - - [256, 448, 1, 128]
    - [8, 1338.99]
  - - [448, 1024, 1, 3328]
    - [49, 8488.53]
  - - [2944, 1024, 1, 3328]
    - [47, 9994.69]
  - - [2944, 5056, 1, 128]
    - [43, 5982.84]
  - - [1408, 6784, 1, 256]
    - [49, 10546.4]
  - - [6784, 1408, 1, 3328]
    - [55, 9315.0]
  - - [4288, 6784, 1, 128]
    - [43, 6150.95]
  - - [704, 64, 1, 256]
    - [26, 1970.84]
  - - [5888, 4, 1, 1280]
    - [61, 676.023]
  - - [256, 2368, 1, 3328]
    - [55, 7841.88]
  - - [6784, 2944, 1, 1280]
    - [54, 9532.54]
  - - [4288, 1856, 1, 128]
    - [43, 5722.79]
  - - [1856, 2944, 1, 128]
    - [44, 5600.0]
  - - [6784, 448, 1, 128]
    - [44, 4945.04]
  - - [64, 3584, 1, 128]
    - [8, 2043.01]
  - - [448, 5056, 1, 1280]
    - [49, 10316.1]
  - - [2368, 1856, 1, 128]
    - [45, 5447.87]
  - - [128, 448, 1, 1280]
    - [27, 4128.72]
  - - [4288, 704, 1, 256]
    - [55, 9484.08]
  - - [256, 3584, 1, 128]
    - [44, 2963.39]
  - - [5888, 704, 1, 256]
    - [55, 10081.1]
  - - [3584, 1024, 1, 128]
    - [45, 4625.53]
  - - [256, 5888, 1, 3328]
    - [56, 9907.69]
  - - [1408, 4288, 1, 3328]
    - [48, 9811.34]
  - - [6784, 4288, 1, 256]
    - [54, 10399.4]
  - - [4288, 256, 1, 128]
    - [44, 3552.07]
  - - [5888, 256, 1, 256]
    - [55, 8497.79]
  - - [6784, 1024, 1, 1280]
    - [48, 10221.1]
  - - [5888, 1024, 1, 128]
    - [43, 4818.83]
  - - [1024, 128, 1, 256]
    - [55, 2435.36]
  - - [128, 64, 1, 3328]
    - [41, 2453.58]
  - - [448, 64, 1, 256]
    - [14, 1357.38]
  - - [2368, 256, 1, 128]
    - [44, 2934.13]
  - - [6784, 3584, 1, 1280]
    - [58, 9670.16]
  - - [1024, 6784, 1, 1280]
    - [55, 10473.5]
  - - [2944, 64, 1, 1280]
    - [32, 5752.2]
  - - [1408, 2944, 1, 1280]
    - [54, 10888.7]
  - - [256, 1856, 1, 256]
    - [49, 6291.24]
  - - [1408, 2368, 1, 3328]
    - [55, 10298.5]
  - - [2944, 4, 1, 3328]
    - [64, 671.387]
  - - [128, 1408, 1, 3328]
    - [27, 7287.88]
  - - [2944, 1856, 1, 128]
    - [45, 5364.55]
  - - [256, 2944, 1, 128]
    - [44, 2818.83]
  - - [256, 6784, 1, 128]
    - [44, 3887.21]
  - - [2368, 4, 1, 128]
    - [59, 108.392]
  - - [1408, 256, 1, 3328]
    - [49, 6708.24]
  - - [1856, 4, 1, 128]
    - [59, 84.3974]
  - - [1024, 16, 1, 512]
    - [21, 1380.95]
  - - [5056, 6784, 1, 128]
    - [43, 6178.29]
  - - [4288, 5056, 1, 128]
    - [43, 6186.96]
  - - [1856, 5888, 1, 128]
    - [43, 5936.24]
  - - [2944, 5888, 1, 256]
    - [47, 10701.2]
  - - [3584, 1856, 1, 256]
    - [55, 9765.61]
  - - [4288, 3584, 1, 1280]
    - [58, 10219.9]
  - - [2368, 448, 1, 256]
    - [49, 7160.63]
  - - [4288, 256, 1, 3328]
    - [55, 8873.18]
  - - [1856, 704, 1, 128]
    - [44, 4300.48]
  - - [1408, 64, 1, 256]
    - [15, 2491.35]
  - - [64, 1856, 1, 128]
    - [8, 1324.19]
  - - [4, 256, 1, 128]
    - [59, 11.1285]
  - - [704, 4288, 1, 3328]
    - [49, 9956.11]
  - - [704, 5888, 1, 128]
    - [45, 5301.69]
  - - [6784, 3584, 1, 128]
    - [43, 6181.1]
  - - [1024, 64, 1, 256]
    - [15, 2097.02]
  - - [64, 2368, 1, 256]
    - [15, 2785.86]
  - - [4288, 5056, 1, 3328]
    - [58, 9028.0]
  - - [4, 1856, 1, 1280]
    - [10, 489.629]
  - - [4288, 128, 1, 128]
    - [1, 2773.13]
  - - [1408, 1408, 1, 128]
    - [44, 4472.05]
  - - [1024, 128, 1, 3328]
    - [12, 6714.5]
  - - [1856, 128, 1, 128]
    - [8, 2052.49]
  - - [5056, 2368, 1, 256]
    - [55, 10054.9]
  - - [4288, 704, 1, 3328]
    - [49, 9895.09]
  - - [448, 3584, 1, 256]
    - [49, 8184.25]
  - - [64, 128, 1, 128]
    - [8, 131.064]
  - - [2368, 64, 1, 1280]
    - [12, 5344.35]
  - - [2368, 1024, 1, 1280]
    - [57, 9645.42]
  - - [2944, 1408, 1, 3328]
    - [58, 10263.9]
  - - [1408, 448, 1, 256]
    - [49, 6487.9]
  - - [1024, 1408, 1, 3328]
    - [55, 9518.7]
  - - [2560, 7133, 1, 2560]
    - [48, 9515.98]
  - - [1408, 4, 1, 1280]
    - [21, 506.87]
  - - [5888, 3584, 1, 256]
    - [54, 10654.2]
  - - [128, 1024, 1, 1280]
    - [12, 5304.13]
  - - [1408, 1856, 1, 3328]
    - [49, 10466.6]
  - - [4, 4, 1, 3328]
    - [66, 8.55733]
  - - [6784, 1408, 1, 1280]
    - [55, 10204.7]
  - - [4, 1024, 1, 1280]
    - [21, 431.566]
  - - [704, 2944, 1, 256]
    - [49, 9387.46]
  - - [704, 4288, 1, 128]
    - [44, 5010.77]
  - - [2368, 4288, 1, 128]
    - [43, 5711.43]
  - - [64, 4288, 1, 1280]
    - [32, 5782.98]
  - - [6784, 64, 1, 1280]
    - [49, 7413.35]
  - - [3584, 128, 1, 128]
    - [4, 2687.12]
  - - [1024, 6784, 1, 128]
    - [43, 4574.58]
  - - [4, 1856, 1, 128]
    - [59, 86.0949]
  - - [1408, 64, 1, 3328]
    - [32, 6561.41]
  - - [6784, 4, 1, 256]
    - [61, 501.485]
  - - [1408, 1408, 1, 1280]
    - [55, 10081.2]
  - - [256, 2368, 1, 256]
    - [49, 6179.88]
  - - [448, 4288, 1, 3328]
    - [55, 9324.22]
  - - [2368, 1408, 1, 256]
    - [55, 9856.64]
  - - [5888, 5056, 1, 128]
    - [43, 5626.21]
  - - [704, 2368, 1, 256]
    - [49, 8484.84]
  - - [2944, 448, 1, 1280]
    - [55, 8785.68]
  - - [5888, 2368, 1, 3328]
    - [48, 9228.34]
  - - [64, 2944, 1, 1280]
    - [27, 5711.81]
  - - [448, 1856, 1, 1280]
    - [49, 8053.64]
  - - [4288, 448, 1, 1280]
    - [55, 9780.27]
  - - [5888, 704, 1, 3328]
    - [52, 9960.28]
  - - [5056, 256, 1, 128]
    - [44, 4284.61]
  - - [1856, 256, 1, 128]
    - [44, 3007.34]
  - - [5056, 128, 1, 256]
    - [49, 6371.87]
  - - [704, 4, 1, 256]
    - [21, 167.806]
  - - [1408, 5888, 1, 128]
    - [43, 5602.34]
  - - [4288, 4, 1, 128]
    - [59, 176.42]
  - - [1408, 1024, 1, 256]
    - [55, 8304.52]
  - - [1024, 1856, 1, 128]
    - [45, 3527.41]
  - - [256, 704, 1, 128]
    - [44, 1359.9]
  - - [256, 1024, 1, 128]
    - [44, 1769.42]
  - - [448, 1024, 1, 256]
    - [49, 6097.64]
  - - [128, 4, 1, 3328]
    - [66, 250.027]
  - - [5056, 6784, 1, 1280]
    - [58, 9450.72]
  - - [704, 5056, 1, 3328]
    - [49, 10005.8]
  - - [64, 1408, 1, 1280]
    - [27, 4927.52]
  - - [3584, 5056, 1, 3328]
    - [58, 9374.83]
  - - [1856, 4, 1, 3328]
    - [10, 603.141]
  - - [4, 2944, 1, 128]
    - [59, 134.757]
  - - [2368, 2944, 1, 3328]
    - [55, 9678.04]
  - - [448, 448, 1, 1280]
    - [27, 5878.0]
  - - [2368, 3584, 1, 256]
    - [55, 10433.9]
  - - [1024, 256, 1, 1280]
    - [55, 6593.46]
  - - [5056, 3584, 1, 1280]
    - [54, 9869.06]
  - - [448, 4, 1, 3328]
    - [66, 468.078]
  - - [1856, 2944, 1, 1280]
    - [49, 10231.5]
  - - [3584, 2368, 1, 1280]
    - [55, 10207.4]
  - - [128, 1024, 1, 256]
    - [17, 2696.22]
  - - [2944, 1408, 1, 256]
    - [49, 10017.6]
  - - [4288, 1408, 1, 3328]
    - [54, 9899.78]
  - - [3584, 64, 1, 3328]
    - [19, 6713.39]
  - - [1408, 128, 1, 256]
    - [49, 3441.03]
  - - [2944, 1024, 1, 128]
    - [45, 4787.81]
  - - [4288, 5056, 1, 1280]
    - [55, 9609.84]
  - - [5888, 6784, 1, 1280]
    - [48, 9452.26]
  - - [6784, 5056, 1, 128]
    - [43, 6428.23]
  - - [256, 1024, 1, 3328]
    - [55, 7421.05]
  - - [3584, 4, 1, 256]
    - [14, 480.998]
  - - [1856, 64, 1, 3328]
    - [32, 7068.31]
  - - [64, 6784, 1, 128]
    - [4, 2604.97]
  - - [5888, 1408, 1, 3328]
    - [54, 9951.5]
  - - [5888, 64, 1, 1280]
    - [49, 6479.04]
  - - [256, 5056, 1, 256]
    - [49, 8585.53]
  - - [128, 3584, 1, 128]
    - [4, 2781.37]
  - - [448, 3584, 1, 3328]
    - [55, 9048.61]
  - - [704, 2368, 1, 128]
    - [44, 4199.13]
  - - [5888, 256, 1, 128]
    - [44, 3847.22]
  - - [4, 5056, 1, 128]
    - [59, 203.177]
  - - [448, 256, 1, 256]
    - [16, 2540.68]
  - - [704, 4, 1, 3328]
    - [23, 536.074]
  - - [1408, 256, 1, 256]
    - [49, 5105.24]
  - - [3584, 1856, 1, 128]
    - [44, 5124.44]
  - - [4288, 4288, 1, 128]
    - [43, 6081.85]
  - - [1856, 1024, 1, 3328]
    - [56, 9431.67]
  - - [128, 5888, 1, 3328]
    - [49, 9710.2]
  - - [1024, 5056, 1, 256]
    - [55, 9962.34]
  - - [2368, 1408, 1, 3328]
    - [55, 10275.9]
  - - [5888, 448, 1, 256]
    - [49, 8559.64]
  - - [5888, 6784, 1, 128]
    - [43, 6002.9]
  - - [2368, 4, 1, 3328]
    - [64, 659.756]
  - - [6784, 5056, 1, 1280]
    - [48, 9459.17]
  - - [5056, 704, 1, 1280]
    - [55, 10598.8]
  - - [1408, 256, 1, 1280]
    - [49, 6284.89]
  - - [4288, 6784, 1, 1280]
    - [48, 9474.23]
  - - [128, 704, 1, 256]
    - [15, 2377.23]
  - - [1024, 1024, 1, 128]
    - [46, 3653.03]
  - - [448, 128, 1, 1280]
    - [27, 4216.59]
  - - [6784, 4, 1, 3328]
    - [61, 643.678]
  - - [4288, 4, 1, 1280]
    - [9, 617.447]
  - - [1024, 64, 1, 3328]
    - [27, 5229.68]
  - - [1856, 4, 1, 256]
    - [63, 377.317]
  - - [64, 3584, 1, 1280]
    - [49, 5889.28]
  - - [6784, 1408, 1, 256]
    - [55, 10449.6]
  - - [3584, 5888, 1, 128]
    - [43, 5616.77]
  - - [5056, 5888, 1, 256]
    - [58, 10537.8]
  - - [2368, 1024, 1, 256]
    - [56, 8379.94]
  - - [2944, 1856, 1, 256]
    - [55, 10273.8]
  - - [1856, 6784, 1, 1280]
    - [55, 10137.3]
  - - [64, 5056, 1, 128]
    - [0, 2272.95]
  - - [5888, 64, 1, 128]
    - [0, 2393.89]
  - - [448, 704, 1, 128]
    - [44, 1939.43]
  - - [4, 1024, 1, 128]
    - [59, 47.5006]
  - - [4288, 3584, 1, 256]
    - [55, 10744.6]
  - - [1408, 704, 1, 128]
    - [44, 3652.0]
  - - [64, 256, 1, 3328]
    - [36, 3271.49]
  - - [5056, 1856, 1, 1280]
    - [55, 10048.3]
  - - [1408, 1024, 1, 3328]
    - [55, 9525.7]
  - - [2368, 256, 1, 3328]
    - [49, 7848.67]
  - - [5888, 3584, 1, 1280]
    - [48, 9784.03]
  - - [1856, 3584, 1, 3328]
    - [49, 9596.27]
  - - [5888, 128, 1, 1280]
    - [55, 9151.7]
  - - [1024, 2944, 1, 256]
    - [57, 8588.86]
  - - [448, 6784, 1, 1280]
    - [49, 10513.8]
  - - [256, 3584, 1, 1280]
    - [55, 8837.22]
  - - [448, 128, 1, 128]
    - [8, 683.334]
  - - [704, 5056, 1, 256]
    - [49, 9817.25]
  - - [3584, 1024, 1, 3328]
    - [57, 10224.6]
  - - [2944, 1856, 1, 1280]
    - [49, 10131.6]
  - - [128, 256, 1, 128]
    - [8, 452.973]
  - - [5056, 256, 1, 256]
    - [55, 8652.0]
  - - [2368, 3584, 1, 3328]
    - [51, 9488.07]
  - - [2944, 704, 1, 1280]
    - [55, 10548.7]
  - - [128, 4, 1, 256]
    - [21, 40.2123]
  - - [2944, 3584, 1, 1280]
    - [55, 10161.1]
  - - [1856, 5888, 1, 1280]
    - [47, 10053.9]
  - - [256, 256, 1, 1280]
    - [27, 4641.13]
  - - [5056, 448, 1, 3328]
    - [49, 9968.91]
  - - [4288, 1408, 1, 256]
    - [55, 10021.6]
  - - [3584, 64, 1, 256]
    - [49, 3811.02]
  - - [64, 1856, 1, 3328]
    - [27, 6994.16]
  - - [256, 1408, 1, 128]
    - [44, 1922.35]
  - - [5888, 1408, 1, 128]
    - [43, 5251.17]
  - - [4288, 2368, 1, 1280]
    - [55, 9996.88]
  - - [4, 4288, 1, 256]
    - [61, 455.962]
  - - [256, 4288, 1, 128]
    - [44, 3399.32]
  - - [256, 128, 1, 3328]
    - [37, 4447.56]
  - - [6784, 2368, 1, 256]
    - [55, 10398.4]
  - - [5888, 128, 1, 128]
    - [5, 3042.71]
  - - [4288, 1856, 1, 256]
    - [55, 10382.7]
  - - [1856, 256, 1, 3328]
    - [49, 8798.94]
  - - [1856, 2944, 1, 256]
    - [55, 10313.1]
  - - [5056, 1024, 1, 128]
    - [45, 4918.18]
  - - [64, 5888, 1, 1280]
    - [49, 6498.46]
  - - [1760, 7133, 1, 1760]
    - [55, 9654.17]
  - - [6784, 256, 1, 128]
    - [44, 4232.64]
  - - [5888, 704, 1, 128]
    - [44, 4987.89]
  - - [6784, 64, 1, 128]
    - [6, 2623.17]
  - - [1024, 4288, 1, 1280]
    - [52, 9991.12]
  - - [2368, 5056, 1, 3328]
    - [58, 9370.05]
  - - [448, 4, 1, 128]
    - [59, 19.7228]
  - - [4, 256, 1, 3328]
    - [66, 359.404]
  - - [4288, 1024, 1, 3328]
    - [56, 9492.28]
  - - [1024, 5056, 1, 3328]
    - [54, 10088.9]
  - - [1024, 1856, 1, 3328]
    - [58, 9746.02]
  - - [704, 704, 1, 1280]
    - [55, 8607.01]
  - - [128, 2368, 1, 1280]
    - [32, 5742.82]
  - - [1408, 128, 1, 3328]
    - [39, 7102.51]
  - - [3584, 256, 1, 1280]
    - [55, 8827.39]
  - - [4, 128, 1, 128]
    - [59, 5.70772]
  - - [704, 6784, 1, 128]
    - [45, 5259.75]
  - - [3584, 128, 1, 1280]
    - [55, 7895.37]
  - - [4, 256, 1, 1280]
    - [23, 256.426]
  - - [128, 704, 1, 3328]
    - [27, 6325.65]
  - - [4288, 6784, 1, 256]
    - [47, 10339.5]
  - - [3584, 2944, 1, 3328]
    - [57, 9175.67]
  - - [128, 1856, 1, 256]
    - [49, 4343.95]
  - - [64, 4288, 1, 256]
    - [49, 3690.33]
  - - [4, 3584, 1, 3328]
    - [10, 684.449]
  - - [64, 4, 1, 3328]
    - [66, 130.7]
  - - [4, 64, 1, 3328]
    - [66, 129.233]
  - - [5888, 2944, 1, 256]
    - [55, 10705.0]
  - - [2368, 6784, 1, 128]
    - [43, 5947.84]
  - - [448, 4288, 1, 1280]
    - [55, 9780.27]
  - - [448, 1856, 1, 3328]
    - [49, 8319.79]
  - - [4, 1024, 1, 256]
    - [21, 221.172]
  - - [5056, 4288, 1, 256]
    - [48, 10354.4]
  - - [1024, 448, 1, 256]
    - [55, 5562.74]
  - - [1024, 3584, 1, 256]
    - [55, 9630.37]
  - - [2944, 128, 1, 1280]
    - [49, 6603.89]
  - - [1856, 5056, 1, 128]
    - [45, 5807.64]
  - - [64, 256, 1, 256]
    - [14, 913.195]
  - - [1408, 4, 1, 128]
    - [59, 63.6047]
  - - [128, 2368, 1, 128]
    - [0, 2200.58]
  - - [256, 704, 1, 1280]
    - [49, 4820.69]
  - - [64, 2368, 1, 128]
    - [3, 1626.59]
  - - [6784, 6784, 1, 3328]
    - [58, 9316.71]
  - - [448, 5888, 1, 1280]
    - [49, 9902.26]
  - - [5056, 448, 1, 128]
    - [44, 4773.12]
  - - [3584, 2944, 1, 128]
    - [43, 5585.8]
  - - [6784, 256, 1, 1280]
    - [55, 9976.49]
  - - [256, 2944, 1, 1280]
    - [49, 9268.96]
  - - [64, 4288, 1, 128]
    - [3, 2017.94]
  - - [2368, 5888, 1, 3328]
    - [47, 9269.58]
  - - [4, 64, 1, 256]
    - [21, 20.5732]
  - - [704, 1024, 1, 3328]
    - [49, 9322.78]
  - - [2368, 1856, 1, 1280]
    - [49, 10849.0]
  - - [128, 448, 1, 128]
    - [3, 697.788]
  - - [128, 6784, 1, 256]
    - [49, 6946.6]
  - - [3584, 4288, 1, 128]
    - [43, 5698.58]
  - - [64, 448, 1, 128]
    - [8, 378.196]
  - - [5888, 4288, 1, 3328]
    - [58, 9293.83]
  - - [2368, 704, 1, 256]
    - [49, 8435.2]
  - - [256, 1856, 1, 3328]
    - [49, 8806.19]
  - - [1856, 128, 1, 256]
    - [49, 4321.11]
  - - [6784, 128, 1, 128]
    - [2, 3283.29]
  - - [3584, 1408, 1, 128]
    - [45, 4985.51]
  - - [1856, 5056, 1, 1280]
    - [55, 10335.9]
  - - [2944, 1024, 1, 1280]
    - [58, 10341.8]
  - - [5056, 4, 1, 256]
    - [61, 488.751]
  - - [3584, 5888, 1, 3328]
    - [58, 9280.58]
  - - [2368, 4288, 1, 256]
    - [55, 10620.8]
  - - [1024, 2368, 1, 3328]
    - [55, 9719.78]
  - - [64, 704, 1, 3328]
    - [37, 4865.86]
  - - [704, 1408, 1, 256]
    - [49, 8136.71]
  - - [6784, 1856, 1, 3328]
    - [48, 9115.55]
  - - [1024, 2944, 1, 128]
    - [45, 3970.39]
  - - [1024, 3584, 1, 1280]
    - [52, 10601.1]
  - - [4288, 5888, 1, 3328]
    - [58, 9229.48]
  - - [4288, 4, 1, 3328]
    - [9, 666.015]
  - - [256, 1408, 1, 256]
    - [49, 4923.55]
  - - [448, 2944, 1, 1280]
    - [49, 8826.51]
  - - [4, 5888, 1, 128]
    - [59, 227.358]
  - - [1024, 2944, 1, 3328]
    - [48, 10104.3]
  - - [3584, 6784, 1, 256]
    - [47, 10771.2]
  - - [256, 6784, 1, 1280]
    - [55, 9973.18]
  - - [1856, 3584, 1, 256]
    - [55, 10253.4]
  - - [128, 448, 1, 3328]
    - [27, 5612.8]
  - - [6784, 1856, 1, 128]
    - [44, 5627.7]
  - - [4, 448, 1, 256]
    - [21, 129.008]
  - - [2944, 704, 1, 128]
    - [44, 4632.99]
  - - [256, 5888, 1, 1280]
    - [49, 10036.9]
  - - [4, 128, 1, 1280]
    - [23, 136.122]
  - - [4288, 6784, 1, 3328]
    - [58, 9158.98]
  - - [6784, 128, 1, 1280]
    - [55, 8322.06]
  - - [64, 1408, 1, 256]
    - [15, 2341.52]
  - - [7680, 5481, 1, 2560]
    - [48, 9273.5]
  - - [2368, 1408, 1, 128]
    - [44, 5180.95]
  - - [1856, 448, 1, 256]
    - [49, 6874.46]
  - - [1408, 1024, 1, 128]
    - [44, 3832.84]
  - - [128, 64, 1, 128]
    - [8, 103.323]
  - - [6784, 3584, 1, 3328]
    - [58, 9275.49]
  - - [2944, 64, 1, 3328]
    - [32, 7322.6]
  - - [64, 64, 1, 128]
    - [3, 51.6616]
  - - [2368, 5056, 1, 1280]
    - [48, 10118.4]
  - - [64, 4, 1, 1280]
    - [23, 67.0239]
  - - [1408, 2368, 1, 1280]
    - [49, 10684.8]
  - - [128, 1408, 1, 1280]
    - [27, 5693.23]
  - - [256, 64, 1, 3328]
    - [35, 3214.31]
  - - [2944, 4288, 1, 128]
    - [43, 5925.93]
  - - [2944, 2944, 1, 256]
    - [49, 10198.4]
  - - [2944, 4, 1, 1280]
    - [10, 609.231]
  - - [5888, 4, 1, 256]
    - [61, 493.296]
  - - [6784, 256, 1, 256]
    - [55, 8648.22]
  - - [256, 5056, 1, 3328]
    - [49, 10451.1]
  - - [128, 4288, 1, 1280]
    - [27, 6847.69]
  - - [5056, 1856, 1, 128]
    - [44, 5889.91]
  - - [5888, 1408, 1, 256]
    - [55, 10123.8]
  - - [128, 128, 1, 256]
    - [28, 898.812]
  - - [5056, 4, 1, 3328]
    - [61, 698.918]
  - - [4288, 3584, 1, 3328]
    - [58, 9549.26]
  - - [448, 704, 1, 3328]
    - [49, 5877.01]
  - - [448, 448, 1, 128]
    - [44, 1834.94]
  - - [1024, 2368, 1, 1280]
    - [55, 9950.07]
  - - [1856, 704, 1, 3328]
    - [55, 10546.6]
  - - [4, 2368, 1, 128]
    - [59, 107.675]
  - - [5888, 6784, 1, 3328]
    - [58, 9196.01]
  - - [704, 4288, 1, 1280]
    - [55, 10436.6]
  - - [704, 256, 1, 256]
    - [49, 3441.03]
  - - [6784, 448, 1, 3328]
    - [55, 9963.67]
  - - [4288, 1024, 1, 128]
    - [45, 4695.08]
  - - [3136, 256, 64, 64]
    - [70, 7707.9]
  - - [784, 512, 64, 128]
    - [76, 8994.9]
  - - [49, 2048, 128, 512]
    - [67, 6772.45]
  - - [784, 128, 64, 512]
    - [77, 9035.2]
  - - [196, 1024, 64, 256]
    - [71, 8030.01]
  - - [3136, 64, 128, 64]
    - [73, 5170.03]
  - - [784, 512, 128, 128]
    - [76, 9170.52]
  - - [196, 1024, 128, 256]
    - [78, 8177.2]
  - - [196, 256, 64, 1024]
    - [74, 7986.69]
  - - [3136, 64, 64, 64]
    - [68, 5023.76]
  - - [3136, 64, 64, 256]
    - [77, 7535.2]
  - - [3136, 64, 128, 256]
    - [72, 7524.34]
  - - [784, 128, 128, 512]
    - [77, 9226.75]
  - - [49, 2048, 64, 512]
    - [77, 6643.23]
  - - [196, 256, 128, 1024]
    - [78, 8251.69]
  - - [49, 512, 64, 2048]
    - [75, 6630.34]
  - - [49, 512, 128, 2048]
    - [75, 7073.56]
  - - [3136, 256, 128, 64]
    - [69, 7839.96]
  - - [1024, 128, 1, 128]
    - [75, 1551.39]
  - - [4, 704, 1, 1280]
    - [90, 408.98]
  - - [4, 1856, 1, 3328]
    - [77, 591.468]
  - - [1856, 448, 1, 3328]
    - [116, 8314.34]
  - - [2944, 4288, 1, 1280]
    - [122, 9980.13]
  - - [2368, 64, 1, 3328]
    - [99, 7012.18]
  - - [2368, 5888, 1, 256]
    - [116, 10646.3]
  - - [128, 64, 1, 256]
    - [88, 456.747]
  - - [5888, 1024, 1, 1280]
    - [125, 10594.3]
  - - [128, 6784, 1, 3328]
    - [94, 8712.05]
  - - [64, 4, 1, 256]
    - [132, 17.7933]
  - - [5888, 1856, 1, 3328]
    - [124, 9426.83]
  - - [5056, 704, 1, 256]
    - [122, 9817.35]
  - - [5888, 2944, 1, 3328]
    - [115, 9508.41]
  - - [1856, 4288, 1, 256]
    - [116, 10398.5]
  - - [1024, 5056, 1, 128]
    - [110, 4409.25]
  - - [5056, 5056, 1, 3328]
    - [115, 9395.25]
  - - [1408, 5888, 1, 1280]
    - [115, 10767.7]
  - - [2368, 448, 1, 128]
    - [111, 3566.5]
  - - [1024, 3584, 1, 3328]
    - [122, 10402.7]
  - - [4, 2944, 1, 1280]
    - [81, 620.476]
  - - [1408, 64, 1, 128]
    - [75, 1096.68]
  - - [256, 4288, 1, 3328]
    - [122, 8866.89]
  - - [5888, 1408, 1, 1280]
    - [115, 10696.1]
  - - [704, 1856, 1, 3328]
    - [122, 10537.2]
  - - [4, 1408, 1, 128]
    - [126, 64.5492]
  - - [1024, 2368, 1, 256]
    - [122, 8756.6]
  - - [1408, 1856, 1, 1280]
    - [122, 10748.9]
  - - [1408, 64, 1, 1280]
    - [99, 5072.03]
  - - [448, 1024, 1, 1280]
    - [116, 7927.07]
  - - [256, 1408, 1, 3328]
    - [116, 6686.17]
  - - [5056, 5056, 1, 1280]
    - [115, 9709.22]
  - - [448, 5056, 1, 256]
    - [122, 9231.08]
  - - [704, 1856, 1, 1280]
    - [116, 10276.7]
  - - [128, 5056, 1, 128]
    - [70, 2838.36]
  - - [2368, 128, 1, 256]
    - [116, 4258.28]
  - - [1856, 1408, 1, 128]
    - [111, 4951.37]
  - - [64, 5056, 1, 256]
    - [116, 4204.2]
  - - [6784, 256, 1, 3328]
    - [122, 9910.44]
  - - [6784, 4288, 1, 3328]
    - [125, 9156.06]
  - - [4288, 448, 1, 256]
    - [122, 8689.68]
  - - [64, 704, 1, 128]
    - [74, 540.755]
  - - [1856, 2368, 1, 3328]
    - [116, 10172.3]
  - - [4288, 2944, 1, 1280]
    - [114, 9897.71]
  - - [704, 5056, 1, 1280]
    - [116, 10249.2]
  - - [2368, 704, 1, 3328]
    - [122, 9341.06]
  - - [256, 5888, 1, 256]
    - [116, 8624.47]
  - - [1856, 4288, 1, 3328]
    - [125, 9554.87]
  - - [256, 2944, 1, 256]
    - [116, 7506.1]
  - - [5888, 1024, 1, 256]
    - [123, 9488.54]
  - - [448, 64, 1, 1280]
    - [98, 3135.79]
  - - [448, 5056, 1, 3328]
    - [116, 9778.38]
  - - [3584, 4, 1, 1280]
    - [77, 646.879]
  - - [2944, 64, 1, 256]
    - [116, 3255.89]
  - - [128, 4, 1, 1280]
    - [90, 136.208]
  - - [1408, 2944, 1, 256]
    - [116, 10074.0]
  - - [256, 1856, 1, 1280]
    - [116, 8234.92]
  - - [6784, 5056, 1, 3328]
    - [115, 9062.11]
  - - [5056, 5056, 1, 256]
    - [122, 10476.0]
  - - [1408, 6784, 1, 128]
    - [110, 5608.36]
  - - [64, 1024, 1, 1280]
    - [91, 4194.3]
  - - [2944, 4, 1, 256]
    - [81, 442.456]
  - - [704, 5056, 1, 128]
    - [111, 5212.39]
  - - [4, 2368, 1, 1280]
    - [77, 576.398]
  - - [2368, 2944, 1, 1280]
    - [116, 10207.0]
  - - [128, 3584, 1, 1280]
    - [122, 7911.27]
  - - [6784, 6784, 1, 1280]
    - [115, 9606.84]
  - - [1024, 256, 1, 3328]
    - [122, 7379.32]
  - - [1408, 4288, 1, 1280]
    - [116, 10424.2]
  - - [3584, 4288, 1, 1280]
    - [114, 10063.5]
  - - [2368, 704, 1, 1280]
    - [122, 9614.93]
  - - [5056, 4288, 1, 3328]
    - [115, 9061.87]
  - - [3584, 2368, 1, 3328]
    - [120, 9223.98]
  - - [64, 704, 1, 1280]
    - [93, 3672.52]
  - - [4288, 256, 1, 256]
    - [122, 7253.68]
  - - [2944, 128, 1, 128]
    - [67, 2563.65]
  - - [6784, 448, 1, 1280]
    - [124, 10219.3]
  - - [1408, 2944, 1, 128]
    - [111, 5325.44]
  - - [4288, 2944, 1, 256]
    - [122, 10602.0]
  - - [5888, 704, 1, 1280]
    - [124, 10583.1]
  - - [1856, 64, 1, 1280]
    - [99, 5488.14]
  - - [448, 5888, 1, 128]
    - [111, 4728.34]
  - - [5888, 64, 1, 3328]
    - [101, 7431.96]
  - - [2944, 256, 1, 3328]
    - [116, 9729.85]
  - - [1024, 64, 1, 128]
    - [75, 775.746]
  - - [5056, 2368, 1, 1280]
    - [114, 10086.4]
  - - [448, 3584, 1, 1280]
    - [122, 9248.24]
  - - [6784, 5888, 1, 256]
    - [121, 10564.3]
  - - [704, 1024, 1, 128]
    - [112, 3304.3]
  - - [704, 128, 1, 1280]
    - [99, 5022.89]
  - - [5888, 2944, 1, 128]
    - [110, 5822.94]
  - - [4, 3584, 1, 128]
    - [126, 160.96]
  - - [1408, 448, 1, 1280]
    - [116, 7813.41]
  - - [1024, 1408, 1, 256]
    - [122, 8049.62]
  - - [2368, 2368, 1, 3328]
    - [116, 9848.89]
  - - [1856, 6784, 1, 128]
    - [110, 5915.47]
  - - [5056, 704, 1, 3328]
    - [122, 9965.99]
  - - [1408, 1856, 1, 256]
    - [116, 9710.97]
  - - [1408, 704, 1, 3328]
    - [122, 9898.44]
  - - [2368, 5056, 1, 256]
    - [122, 10691.6]
  - - [5888, 1856, 1, 256]
    - [122, 10644.5]
  - - [4288, 64, 1, 3328]
    - [99, 7017.35]
  - - [2368, 4, 1, 1280]
    - [81, 574.378]
  - - [704, 5888, 1, 256]
    - [116, 10109.6]
  - - [4288, 64, 1, 256]
    - [116, 3661.86]
  - - [6784, 64, 1, 256]
    - [116, 5156.27]
  - - [2944, 256, 1, 256]
    - [122, 7378.51]
  - - [2944, 6784, 1, 3328]
    - [125, 9263.56]
  - - [704, 1408, 1, 3328]
    - [117, 9521.71]
  - - [3584, 704, 1, 3328]
    - [122, 10058.3]
  - - [2944, 256, 1, 128]
    - [112, 3391.46]
  - - [6784, 4, 1, 1280]
    - [129, 645.073]
  - - [1024, 64, 1, 1280]
    - [96, 3700.82]
  - - [448, 4288, 1, 256]
    - [116, 8689.68]
  - - [64, 3584, 1, 3328]
    - [80, 7053.55]
  - - [704, 2368, 1, 1280]
    - [116, 9621.36]
  - - [448, 2944, 1, 128]
    - [111, 3742.32]
  - - [1856, 2368, 1, 1280]
    - [116, 10852.2]
  - - [2368, 128, 1, 3328]
    - [99, 7830.7]
  - - [2944, 128, 1, 256]
    - [116, 5087.19]
  - - [448, 1408, 1, 256]
    - [116, 6526.68]
  - - [1856, 4288, 1, 1280]
    - [121, 10144.6]
  - - [64, 5056, 1, 3328]
    - [94, 7749.3]
  - - [4, 704, 1, 256]
    - [130, 162.3]
  - - [1024, 448, 1, 128]
    - [111, 2165.94]
  - - [704, 4, 1, 1280]
    - [90, 459.152]
  - - [704, 256, 1, 128]
    - [111, 1630.51]
  - - [704, 2944, 1, 128]
    - [111, 4724.76]
  - - [1408, 1024, 1, 1280]
    - [122, 9582.15]
  - - [704, 6784, 1, 256]
    - [116, 9925.01]
  - - [6784, 704, 1, 256]
    - [122, 9924.97]
  - - [5056, 1408, 1, 128]
    - [110, 5586.37]
  - - [256, 3584, 1, 3328]
    - [116, 9158.13]
  - - [4, 5888, 1, 3328]
    - [128, 680.996]
  - - [128, 1408, 1, 128]
    - [75, 1711.17]
  - - [3584, 4288, 1, 3328]
    - [125, 9477.39]
  - - [5888, 1856, 1, 1280]
    - [124, 10154.5]
  - - [5056, 1024, 1, 3328]
    - [114, 10089.0]
  - - [5056, 64, 1, 1280]
    - [99, 5973.77]
  - - [1024, 704, 1, 256]
    - [122, 6863.35]
  - - [1024, 4288, 1, 128]
    - [110, 3951.79]
  - - [4288, 64, 1, 1280]
    - [99, 5692.83]
  - - [2368, 3584, 1, 1280]
    - [116, 10266.0]
  - - [2368, 6784, 1, 1280]
    - [115, 10038.6]
  - - [1024, 256, 1, 256]
    - [116, 4507.23]
  - - [1856, 4, 1, 1280]
    - [77, 511.191]
  - - [448, 448, 1, 256]
    - [116, 3468.22]
  - - [2944, 3584, 1, 3328]
    - [122, 9160.34]
  - - [128, 4288, 1, 128]
    - [70, 2694.43]
  - - [64, 448, 1, 256]
    - [81, 1339.16]
  - - [128, 1024, 1, 3328]
    - [100, 7052.31]
  - - [4, 1408, 1, 3328]
    - [78, 632.668]
  - - [6784, 2944, 1, 256]
    - [122, 10771.2]
  - - [64, 1856, 1, 1280]
    - [99, 5131.42]
  - - [64, 1024, 1, 128]
    - [74, 814.805]
  - - [4288, 2368, 1, 3328]
    - [117, 8999.75]
  - - [1856, 2368, 1, 256]
    - [116, 10132.6]
  - - [3584, 256, 1, 128]
    - [112, 3215.89]
  - - [3584, 6784, 1, 3328]
    - [115, 9369.31]
  - - [256, 1024, 1, 256]
    - [116, 4950.59]
  - - [4, 6784, 1, 3328]
    - [77, 679.281]
  - - [1024, 5888, 1, 3328]
    - [114, 9894.4]
  - - [1024, 128, 1, 1280]
    - [94, 4322.34]
  - - [4288, 128, 1, 1280]
    - [99, 6917.71]
  - - [5056, 4288, 1, 1280]
    - [123, 9416.7]
  - - [5888, 64, 1, 256]
    - [116, 4718.45]
  - - [1856, 256, 1, 1280]
    - [116, 8276.38]
  - - [64, 5888, 1, 3328]
    - [101, 7210.39]
  - - [2944, 5888, 1, 128]
    - [110, 6124.13]
  - - [704, 5888, 1, 1280]
    - [122, 10623.9]
  - - [2368, 3584, 1, 128]
    - [110, 5492.58]
  - - [6784, 5888, 1, 3328]
    - [125, 9190.31]
  - - [704, 1024, 1, 1280]
    - [116, 8936.03]
  - - [448, 256, 1, 3328]
    - [94, 6605.93]
  - - [448, 1856, 1, 128]
    - [111, 3325.95]
  - - [128, 1024, 1, 128]
    - [75, 1530.45]
  - - [2944, 4, 1, 128]
    - [126, 131.377]
  - - [1024, 704, 1, 1280]
    - [122, 8686.74]
  - - [128, 5888, 1, 256]
    - [116, 7215.03]
  - - [1024, 5056, 1, 1280]
    - [121, 10292.5]
  - - [4288, 1024, 1, 256]
    - [122, 9898.64]
  - - [2944, 2368, 1, 128]
    - [110, 5299.78]
  - - [704, 704, 1, 3328]
    - [122, 9178.3]
  - - [704, 1408, 1, 1280]
    - [116, 9590.21]
  - - [5888, 448, 1, 1280]
    - [116, 9589.86]
  - - [3584, 256, 1, 3328]
    - [122, 9152.03]
  - - [704, 5888, 1, 3328]
    - [116, 10179.2]
  - - [704, 1856, 1, 128]
    - [111, 4188.89]
  - - [128, 3584, 1, 3328]
    - [122, 8478.15]
  - - [6784, 2368, 1, 1280]
    - [115, 9959.76]
  - - [4, 4288, 1, 128]
    - [126, 183.047]
  - - [128, 704, 1, 1280]
    - [94, 5023.0]
  - - [3584, 2944, 1, 256]
    - [116, 10469.3]
  - - [1856, 128, 1, 3328]
    - [85, 7667.56]
  - - [4, 64, 1, 1280]
    - [90, 68.154]
  - - [4, 5056, 1, 3328]
    - [76, 695.807]
  - - [128, 2944, 1, 1280]
    - [85, 6617.45]
  - - [2368, 1024, 1, 3328]
    - [119, 9556.18]
  - - [128, 256, 1, 3328]
    - [104, 4434.28]
  - - [1408, 5056, 1, 3328]
    - [122, 9601.87]
  - - [1856, 1856, 1, 3328]
    - [122, 9610.14]
  - - [3584, 128, 1, 256]
    - [116, 5893.64]
  - - [448, 1408, 1, 3328]
    - [116, 8174.01]
  - - [2368, 2368, 1, 256]
    - [116, 10151.3]
  - - [4288, 4288, 1, 1280]
    - [114, 9498.06]
  - - [64, 448, 1, 1280]
    - [93, 3175.95]
  - - [1408, 4288, 1, 256]
    - [121, 9527.47]
  - - [448, 4, 1, 256]
    - [88, 129.126]
  - - [5888, 448, 1, 128]
    - [112, 4403.99]
  - - [448, 4, 1, 1280]
    - [90, 392.062]
  - - [704, 6784, 1, 3328]
    - [116, 9857.51]
  - - [5888, 5888, 1, 1280]
    - [125, 9428.81]
  - - [5056, 1024, 1, 1280]
    - [121, 10335.3]
  - - [448, 5888, 1, 3328]
    - [116, 9246.28]
  - - [128, 4, 1, 128]
    - [126, 5.8825]
  - - [1024, 2944, 1, 1280]
    - [122, 10323.4]
  - - [5056, 5888, 1, 1280]
    - [115, 9697.97]
  - - [4288, 5888, 1, 128]
    - [110, 6301.8]
  - - [256, 3584, 1, 256]
    - [116, 7425.88]
  - - [1408, 3584, 1, 128]
    - [111, 5359.48]
  - - [256, 2944, 1, 3328]
    - [116, 9738.24]
  - - [448, 3584, 1, 128]
    - [111, 4122.6]
  - - [5888, 2944, 1, 1280]
    - [115, 9980.66]
  - - [4, 6784, 1, 1280]
    - [76, 644.188]
  - - [2368, 5888, 1, 128]
    - [110, 6111.81]
  - - [64, 2944, 1, 128]
    - [75, 1788.95]
  - - [3584, 5888, 1, 256]
    - [122, 10802.7]
  - - [2368, 704, 1, 128]
    - [111, 4255.04]
  - - [3584, 2944, 1, 1280]
    - [116, 10061.4]
  - - [3584, 2368, 1, 128]
    - [110, 5288.57]
  - - [5056, 704, 1, 128]
    - [111, 5216.81]
  - - [448, 2368, 1, 128]
    - [111, 3478.48]
  - - [5056, 1408, 1, 3328]
    - [114, 9657.83]
  - - [1408, 704, 1, 256]
    - [116, 8041.4]
  - - [6784, 1024, 1, 3328]
    - [121, 9544.33]
  - - [6784, 2944, 1, 3328]
    - [115, 9288.68]
  - - [2944, 5056, 1, 3328]
    - [125, 9199.41]
  - - [1856, 1856, 1, 256]
    - [122, 8811.79]
  - - [1024, 5888, 1, 128]
    - [111, 4399.73]
  - - [2048, 7133, 1, 2048]
    - [125, 10017.5]
  - - [256, 4, 1, 128]
    - [126, 11.2285]
  - - [4288, 5888, 1, 1280]
    - [115, 9561.49]
  - - [4288, 4288, 1, 256]
    - [116, 10444.4]
  - - [448, 2944, 1, 3328]
    - [117, 8687.12]
  - - [4288, 1856, 1, 1280]
    - [125, 10159.6]
  - - [1856, 2944, 1, 3328]
    - [122, 10023.0]
  - - [256, 6784, 1, 3328]
    - [122, 10039.2]
  - - [64, 5888, 1, 256]
    - [122, 4770.36]
  - - [256, 5056, 1, 128]
    - [111, 3527.76]
  - - [5056, 1024, 1, 256]
    - [123, 9666.4]
  - - [704, 64, 1, 3328]
    - [106, 5355.14]
  - - [5056, 1856, 1, 3328]
    - [122, 9366.22]
  - - [4, 2944, 1, 3328]
    - [81, 658.128]
  - - [4, 5056, 1, 256]
    - [128, 499.338]
  - - [1856, 1408, 1, 256]
    - [116, 9710.97]
  - - [3584, 4, 1, 128]
    - [126, 163.074]
  - - [448, 448, 1, 3328]
    - [99, 7156.39]
  - - [6784, 128, 1, 3328]
    - [99, 8993.19]
  - - [4288, 1408, 1, 128]
    - [112, 5467.85]
  - - [4288, 5056, 1, 256]
    - [115, 10364.5]
  - - [1408, 128, 1, 1280]
    - [99, 5810.12]
  - - [5056, 256, 1, 3328]
    - [122, 10445.6]
  - - [704, 704, 1, 256]
    - [116, 6537.49]
  - - [1024, 5888, 1, 1280]
    - [121, 10325.5]
  - - [6784, 2368, 1, 128]
    - [110, 5926.36]
  - - [4, 5056, 1, 1280]
    - [128, 661.953]
  - - [64, 128, 1, 256]
    - [92, 524.388]
  - - [128, 1856, 1, 1280]
    - [79, 6248.29]
  - - [5056, 3584, 1, 256]
    - [114, 10402.6]
  - - [1856, 1024, 1, 1280]
    - [125, 9420.74]
  - - [6784, 4288, 1, 1280]
    - [115, 9459.0]
  - - [1856, 1856, 1, 1280]
    - [122, 10208.2]
  - - [6784, 2944, 1, 128]
    - [110, 5852.34]
  - - [1408, 5056, 1, 1280]
    - [125, 10452.1]
  - - [4, 2368, 1, 3328]
    - [77, 670.242]
  - - [5888, 1856, 1, 128]
    - [110, 5225.12]
  - - [448, 704, 1, 1280]
    - [116, 5544.16]
  - - [2368, 1024, 1, 128]
    - [112, 4520.02]
  - - [1024, 448, 1, 3328]
    - [122, 8446.86]
  - - [1856, 704, 1, 1280]
    - [116, 10286.1]
  - - [5056, 3584, 1, 128]
    - [110, 6116.83]
  - - [5888, 5888, 1, 3328]
    - [125, 9246.12]
  - - [6784, 1024, 1, 256]
    - [125, 9731.53]
  - - [2944, 2368, 1, 256]
    - [115, 9660.21]
  - - [256, 448, 1, 256]
    - [87, 2590.55]
  - - [5056, 5888, 1, 3328]
    - [125, 9303.59]
  - - [1856, 1024, 1, 256]
    - [122, 8314.17]
  - - [448, 1408, 1, 1280]
    - [116, 7807.85]
  - - [3584, 448, 1, 1280]
    - [122, 9248.24]
  - - [1024, 1024, 1, 1280]
    - [124, 9561.47]
  - - [448, 5888, 1, 256]
    - [116, 9088.82]
  - - [704, 64, 1, 128]
    - [75, 544.532]
  - - [1408, 6784, 1, 3328]
    - [124, 9192.19]
  - - [448, 1024, 1, 128]
    - [111, 2882.57]
  - - [4288, 704, 1, 128]
    - [111, 5035.06]
  - - [128, 1856, 1, 128]
    - [70, 2105.24]
  - - [448, 2368, 1, 3328]
    - [122, 8042.79]
  - - [5056, 64, 1, 128]
    - [67, 2310.58]
  - - [5056, 2944, 1, 256]
    - [122, 10267.7]
  - - [6784, 5888, 1, 128]
    - [110, 6183.7]
  - - [704, 1024, 1, 256]
    - [116, 7200.48]
  - - [1024, 4, 1, 256]
    - [130, 221.272]
  - - [2368, 1856, 1, 256]
    - [116, 10125.9]
  - - [128, 6784, 1, 1280]
    - [122, 8299.11]
  - - [1408, 3584, 1, 3328]
    - [121, 10041.8]
  - - [2368, 6784, 1, 256]
    - [122, 10711.5]
  - - [5056, 1408, 1, 1280]
    - [115, 10345.7]
  - - [256, 256, 1, 128]
    - [75, 781.053]
  - - [5056, 4288, 1, 128]
    - [110, 6114.36]
  - - [1408, 1856, 1, 128]
    - [111, 4908.29]
  - - [1408, 5888, 1, 3328]
    - [114, 9713.1]
  - - [1856, 256, 1, 256]
    - [116, 6339.87]
  - - [6784, 6784, 1, 256]
    - [115, 10471.4]
  - - [64, 256, 1, 128]
    - [75, 246.288]
  - - [4288, 2368, 1, 128]
    - [112, 5538.46]
  - - [1856, 4288, 1, 128]
    - [111, 5827.17]
  - - [256, 4288, 1, 1280]
    - [116, 8618.05]
  - - [2368, 2944, 1, 256]
    - [116, 10389.2]
  - - [4, 1856, 1, 256]
    - [130, 356.441]
  - - [3584, 1856, 1, 1280]
    - [116, 10416.2]
  - - [6784, 6784, 1, 128]
    - [110, 6107.51]
  - - [256, 1856, 1, 128]
    - [111, 2293.41]
  - - [704, 64, 1, 1280]
    - [93, 3816.51]
  - - [5888, 5056, 1, 256]
    - [125, 10528.2]
  - - [3584, 448, 1, 256]
    - [122, 8088.85]
  - - [448, 4288, 1, 128]
    - [111, 4402.49]
  - - [2944, 4288, 1, 3328]
    - [125, 9169.67]
  - - [256, 6784, 1, 256]
    - [122, 8723.75]
  - - [1408, 4288, 1, 128]
    - [111, 5525.77]
  - - [2944, 704, 1, 3328]
    - [116, 10379.5]
  - - [128, 448, 1, 256]
    - [81, 2022.29]
  - - [512, 32, 1, 512]
    - [97, 1617.96]
  - - [3584, 3584, 1, 256]
    - [116, 10408.3]
  - - [448, 1408, 1, 128]
    - [111, 3070.43]
  - - [128, 256, 1, 1280]
    - [98, 3606.55]
  - - [3584, 5056, 1, 256]
    - [116, 10594.4]
  - - [6784, 128, 1, 256]
    - [116, 6820.42]
  - - [4288, 4, 1, 256]
    - [76, 463.203]
  - - [64, 1408, 1, 3328]
    - [94, 6540.34]
  - - [704, 448, 1, 256]
    - [116, 4308.21]
  - - [2944, 2368, 1, 1280]
    - [116, 10458.7]
  - - [448, 64, 1, 3328]
    - [106, 4038.2]
  - - [1408, 3584, 1, 256]
    - [122, 9988.28]
  - - [3584, 4, 1, 3328]
    - [81, 703.23]
  - - [6784, 3584, 1, 256]
    - [122, 10860.4]
  - - [256, 128, 1, 128]
    - [75, 456.722]
  - - [704, 1408, 1, 128]
    - [111, 3910.59]
  - - [4, 2368, 1, 256]
    - [130, 409.285]
  - - [2944, 448, 1, 128]
    - [111, 3909.21]
  - - [128, 1408, 1, 256]
    - [116, 3642.43]
  - - [4, 2944, 1, 256]
    - [81, 433.054]
  - - [64, 128, 1, 3328]
    - [107, 2390.02]
  - - [5056, 2368, 1, 128]
    - [110, 5965.49]
  - - [2944, 2944, 1, 3328]
    - [117, 9325.78]
  - - [5056, 6784, 1, 256]
    - [125, 10349.0]
  - - [1856, 3584, 1, 128]
    - [112, 5590.61]
  - - [128, 2944, 1, 128]
    - [67, 2533.76]
  - - [1024, 704, 1, 3328]
    - [122, 9214.14]
  - - [6784, 448, 1, 256]
    - [122, 8901.18]
  - - [3584, 6784, 1, 128]
    - [110, 5697.55]
  - - [128, 4288, 1, 256]
    - [116, 5595.51]
  - - [704, 448, 1, 3328]
    - [122, 5862.52]
  - - [1024, 1024, 1, 3328]
    - [119, 10040.4]
  - - [128, 128, 1, 3328]
    - [103, 3455.81]
  - - [5056, 1856, 1, 256]
    - [122, 10577.3]
  - - [256, 128, 1, 256]
    - [81, 1551.39]
  - - [1024, 1856, 1, 256]
    - [122, 8303.6]
  - - [4288, 64, 1, 128]
    - [70, 2017.98]
  - - [256, 448, 1, 3328]
    - [99, 6408.72]
  - - [1408, 6784, 1, 1280]
    - [122, 10272.8]
  - - [3584, 3584, 1, 1280]
    - [122, 10034.2]
  - - [64, 2368, 1, 1280]
    - [85, 5165.22]
  - - [448, 2368, 1, 1280]
    - [116, 8355.24]
  - - [5888, 5888, 1, 128]
    - [110, 5793.65]
  - - [64, 6784, 1, 3328]
    - [122, 7961.74]
  - - [2944, 256, 1, 1280]
    - [116, 9249.33]
  - - [5056, 5888, 1, 128]
    - [110, 6059.05]
  - - [256, 2368, 1, 128]
    - [111, 2436.16]
  - - [5056, 2368, 1, 3328]
    - [115, 9391.58]
  - - [2944, 4288, 1, 256]
    - [116, 10612.3]
  - - [1408, 3584, 1, 1280]
    - [116, 10357.2]
  - - [2368, 64, 1, 256]
    - [82, 2756.67]
  - - [64, 448, 1, 3328]
    - [104, 4025.51]
  - - [256, 256, 1, 3328]
    - [99, 5841.98]
  - - [5888, 4, 1, 128]
    - [126, 224.94]
  - - [1856, 704, 1, 256]
    - [116, 8734.24]
  - - [4, 4288, 1, 1280]
    - [76, 622.748]
  - - [1408, 448, 1, 3328]
    - [116, 8171.66]
  - - [1024, 4, 1, 3328]
    - [88, 539.747]
  - - [2368, 256, 1, 256]
    - [116, 6235.23]
  - - [2368, 6784, 1, 3328]
    - [121, 9320.23]
  - - [1856, 1408, 1, 1280]
    - [116, 10741.2]
  - - [1856, 448, 1, 1280]
    - [116, 8058.22]
  - - [6784, 704, 1, 128]
    - [112, 5276.67]
  - - [4, 4, 1, 256]
    - [88, 0.963953]
  - - [128, 5888, 1, 128]
    - [68, 3086.07]
  - - [1408, 5888, 1, 256]
    - [116, 10517.9]
  - - [704, 2944, 1, 1280]
    - [122, 10548.8]
  - - [1856, 2368, 1, 128]
    - [112, 4806.65]
  - - [4096, 7133, 1, 4096]
    - [121, 9338.03]
  - - [256, 64, 1, 256]
    - [81, 871.191]
  - - [1024, 1024, 1, 256]
    - [122, 7502.7]
  - - [704, 1856, 1, 256]
    - [116, 8683.9]
  - - [128, 4288, 1, 3328]
    - [94, 8336.34]
  - - [3584, 704, 1, 1280]
    - [124, 10055.1]
  - - [256, 128, 1, 1280]
    - [98, 3516.89]
  - - [2368, 4, 1, 256]
    - [130, 394.51]
  - - [256, 2368, 1, 1280]
    - [116, 7525.19]
  - - [2944, 6784, 1, 128]
    - [111, 5889.29]
  - - [3584, 448, 1, 3328]
    - [122, 9027.19]
  - - [1408, 4, 1, 256]
    - [130, 295.005]
  - - [704, 2368, 1, 3328]
    - [122, 9367.93]
  - - [2944, 448, 1, 256]
    - [116, 7738.58]
  - - [1856, 448, 1, 128]
    - [111, 3258.09]
  - - [2368, 128, 1, 1280]
    - [99, 6242.63]
  - - [256, 5888, 1, 128]
    - [111, 3694.57]
  - - [64, 6784, 1, 256]
    - [116, 5264.96]
  - - [64, 5056, 1, 1280]
    - [99, 6044.78]
  - - [4, 6784, 1, 128]
    - [126, 248.192]
  - - [2944, 2944, 1, 1280]
    - [116, 10106.9]
  - - [5888, 2368, 1, 256]
    - [122, 10653.4]
  - - [4, 3584, 1, 1280]
    - [81, 650.282]
  - - [1408, 128, 1, 128]
    - [75, 1711.17]
  - - [6784, 704, 1, 3328]
    - [116, 9732.76]
  - - [128, 64, 1, 1280]
    - [102, 1791.93]
  - - [2368, 256, 1, 1280]
    - [122, 7519.8]
  - - [4, 448, 1, 3328]
    - [133, 447.361]
  - - [5888, 4288, 1, 128]
    - [110, 5576.82]
  - - [4, 5888, 1, 256]
    - [76, 478.883]
  - - [1408, 2944, 1, 3328]
    - [115, 10320.8]
  - - [3584, 704, 1, 128]
    - [112, 4480.95]
  - - [64, 1024, 1, 256]
    - [82, 2097.12]
  - - [5056, 5056, 1, 128]
    - [110, 6118.91]
  - - [2368, 448, 1, 1280]
    - [116, 8321.09]
  - - [128, 3584, 1, 256]
    - [116, 5850.33]
  - - [704, 448, 1, 1280]
    - [116, 5504.96]
  - - [448, 5056, 1, 128]
    - [111, 4767.37]
  - - [256, 4, 1, 1280]
    - [90, 264.172]
  - - [128, 5056, 1, 256]
    - [116, 6335.91]
  - - [1408, 5056, 1, 128]
    - [111, 5655.71]
  - - [2944, 3584, 1, 128]
    - [110, 5669.27]
  - - [3584, 2368, 1, 256]
    - [116, 10349.4]
  - - [5888, 5056, 1, 1280]
    - [125, 9660.64]
  - - [2368, 5056, 1, 128]
    - [110, 6019.31]
  - - [64, 704, 1, 256]
    - [92, 1730.16]
  - - [4288, 256, 1, 1280]
    - [122, 8610.23]
  - - [3584, 3584, 1, 3328]
    - [125, 9326.86]
  - - [1024, 256, 1, 128]
    - [112, 1729.0]
  - - [4, 704, 1, 128]
    - [126, 31.6975]
  - - [5888, 6784, 1, 256]
    - [115, 10485.7]
  - - [4288, 2944, 1, 3328]
    - [121, 9088.12]
  - - [2944, 64, 1, 128]
    - [75, 1769.52]
  - - [1856, 64, 1, 256]
    - [81, 2648.48]
  - - [4288, 128, 1, 3328]
    - [85, 8373.13]
  - - [4288, 704, 1, 1280]
    - [122, 10434.7]
  - - [256, 5056, 1, 1280]
    - [116, 10175.4]
  - - [1408, 256, 1, 128]
    - [111, 2097.2]
  - - [2944, 5888, 1, 3328]
    - [115, 9478.56]
  - - [6784, 5888, 1, 1280]
    - [115, 9609.35]
  - - [704, 128, 1, 256]
    - [82, 2289.91]
  - - [5888, 4288, 1, 1280]
    - [115, 9625.4]
  - - [448, 256, 1, 1280]
    - [99, 5215.14]
  - - [5888, 3584, 1, 128]
    - [110, 5602.2]
  - - [1856, 1856, 1, 128]
    - [111, 5044.44]
  - - [5056, 4, 1, 1280]
    - [128, 661.953]
  - - [256, 1408, 1, 1280]
    - [116, 6297.72]
  - - [512, 16, 1, 512]
    - [89, 765.205]
  - - [704, 3584, 1, 128]
    - [111, 4828.27]
  - - [5888, 448, 1, 3328]
    - [122, 9676.62]
  - - [2368, 4288, 1, 1280]
    - [122, 10278.7]
  - - [4288, 2944, 1, 128]
    - [110, 5867.05]
  - - [1024, 6784, 1, 3328]
    - [125, 9654.16]
  - - [128, 2368, 1, 256]
    - [116, 4258.16]
  - - [6784, 64, 1, 3328]
    - [122, 7981.29]
  - - [5056, 2944, 1, 3328]
    - [121, 9228.23]
  - - [448, 128, 1, 256]
    - [81, 1981.75]
  - - [2944, 3584, 1, 256]
    - [122, 10268.8]
  - - [1408, 1408, 1, 3328]
    - [122, 9785.34]
  - - [1856, 128, 1, 1280]
    - [85, 6219.86]
  - - [3584, 3584, 1, 128]
    - [110, 5673.81]
  - - [64, 3584, 1, 256]
    - [116, 3905.02]
  - - [1408, 4, 1, 3328]
    - [78, 635.843]
  - - [128, 2944, 1, 3328]
    - [99, 7967.05]
  - - [3584, 704, 1, 256]
    - [116, 9169.08]
  - - [2944, 448, 1, 3328]
    - [122, 8838.73]
  - - [3584, 1408, 1, 3328]
    - [125, 10120.2]
  - - [704, 3584, 1, 1280]
    - [116, 10380.7]
  - - [2944, 6784, 1, 1280]
    - [119, 9547.41]
  - - [1856, 6784, 1, 256]
    - [122, 10566.7]
  - - [4288, 448, 1, 3328]
    - [122, 9644.19]
  - - [6784, 4288, 1, 128]
    - [110, 6259.04]
  - - [6784, 704, 1, 1280]
    - [122, 9974.17]
  - - [256, 4288, 1, 256]
    - [116, 7281.5]
  - - [3584, 64, 1, 128]
    - [75, 2043.11]
  - - [5888, 1024, 1, 3328]
    - [125, 9921.94]
  - - [448, 64, 1, 128]
    - [74, 361.731]
  - - [704, 6784, 1, 1280]
    - [123, 9885.76]
  - - [5888, 128, 1, 256]
    - [122, 7275.43]
  - - [2368, 448, 1, 3328]
    - [116, 8556.82]
  - - [1856, 5056, 1, 3328]
    - [122, 9334.7]
  - - [4, 6784, 1, 256]
    - [128, 512.553]
  - - [1024, 3584, 1, 128]
    - [111, 4163.97]
  - - [1024, 1408, 1, 128]
    - [112, 3177.82]
  - - [2368, 2944, 1, 128]
    - [112, 5693.01]
  - - [5056, 64, 1, 256]
    - [122, 4219.94]
  - - [4, 448, 1, 1280]
    - [88, 348.008]
  - - [5056, 2944, 1, 128]
    - [110, 5888.43]
  - - [5888, 5056, 1, 3328]
    - [115, 9336.26]
  - - [1024, 704, 1, 128]
    - [112, 2799.31]
  - - [1408, 2368, 1, 128]
    - [111, 4657.51]
  - - [5888, 2368, 1, 128]
    - [110, 5639.7]
  - - [128, 5056, 1, 3328]
    - [94, 8516.51]
  - - [3584, 6784, 1, 1280]
    - [114, 9702.87]
  - - [3072, 7435, 1, 1024]
    - [121, 9710.82]
  - - [1856, 5888, 1, 256]
    - [122, 10647.5]
  - - [256, 256, 1, 256]
    - [87, 1969.49]
  - - [256, 64, 1, 128]
    - [75, 202.313]
  - - [4288, 4288, 1, 3328]
    - [115, 8889.08]
  - - [4288, 1408, 1, 1280]
    - [125, 10442.0]
  - - [3584, 5056, 1, 128]
    - [110, 5846.17]
  - - [4, 1024, 1, 3328]
    - [88, 524.378]
  - - [4288, 2368, 1, 256]
    - [122, 10239.7]
  - - [2944, 5056, 1, 1280]
    - [125, 9847.04]
  - - [448, 6784, 1, 256]
    - [122, 9636.09]
  - - [64, 1024, 1, 3328]
    - [94, 5784.58]
  - - [6784, 2368, 1, 3328]
    - [125, 9270.67]
  - - [256, 1024, 1, 1280]
    - [116, 6781.1]
  - - [704, 4, 1, 128]
    - [126, 31.4924]
  - - [256, 4, 1, 256]
    - [88, 82.3929]
  - - [4288, 128, 1, 256]
    - [116, 5562.62]
  - - [4288, 1856, 1, 3328]
    - [115, 9501.05]
  - - [3584, 448, 1, 128]
    - [111, 3826.91]
  - - [256, 4, 1, 3328]
    - [133, 383.481]
  - - [4, 1408, 1, 1280]
    - [88, 499.163]
  - - [3584, 64, 1, 1280]
    - [122, 5863.27]
  - - [1408, 448, 1, 128]
    - [111, 2986.28]
  - - [3584, 1024, 1, 1280]
    - [123, 10516.8]
  - - [1856, 5056, 1, 256]
    - [122, 10546.4]
  - - [4, 3584, 1, 256]
    - [81, 463.106]
  - - [1024, 4288, 1, 256]
    - [116, 9665.39]
  - - [5888, 3584, 1, 3328]
    - [115, 9332.47]
  - - [4, 256, 1, 256]
    - [88, 82.3929]
  - - [5056, 3584, 1, 3328]
    - [125, 9377.63]
  - - [128, 5888, 1, 1280]
    - [122, 9223.11]
  - - [704, 448, 1, 128]
    - [111, 2088.14]
  - - [2368, 1408, 1, 1280]
    - [122, 10324.9]
  - - [5056, 2944, 1, 1280]
    - [122, 9913.46]
  - - [4, 4, 1, 128]
    - [127, 0.1602335]
  - - [3584, 256, 1, 256]
    - [116, 7443.29]
  - - [128, 1856, 1, 3328]
    - [85, 7585.83]
  - - [1024, 6784, 1, 256]
    - [122, 10134.1]
  - - [4, 128, 1, 256]
    - [88, 41.2464]
  - - [64, 64, 1, 1280]
    - [90, 852.878]
  - - [6784, 4, 1, 128]
    - [126, 246.887]
  - - [2944, 1408, 1, 128]
    - [111, 5357.3]
  - - [448, 128, 1, 3328]
    - [99, 5600.71]
  - - [64, 2944, 1, 3328]
    - [100, 6739.66]
  - - [64, 4288, 1, 3328]
    - [94, 7325.86]
  - - [5056, 6784, 1, 3328]
    - [125, 9194.69]
  - - [128, 2944, 1, 256]
    - [116, 5067.28]
  - - [128, 6784, 1, 128]
    - [67, 3179.06]
  - - [3584, 4288, 1, 256]
    - [122, 10736.0]
  - - [448, 1856, 1, 256]
    - [116, 6924.32]
  - - [1856, 6784, 1, 3328]
    - [121, 9107.0]
  - - [3584, 128, 1, 3328]
    - [122, 8422.7]
  - - [64, 1856, 1, 256]
    - [82, 2565.8]
  - - [1024, 448, 1, 1280]
    - [116, 7809.89]
  - - [5888, 4288, 1, 256]
    - [122, 10536.7]
  - - [4, 448, 1, 128]
    - [126, 19.8228]
  - - [5056, 1408, 1, 256]
    - [125, 9809.5]
  - - [64, 256, 1, 1280]
    - [92, 2597.35]
  - - [3584, 1024, 1, 256]
    - [123, 9085.48]
  - - [256, 704, 1, 256]
    - [122, 3422.24]
  - - [5888, 5888, 1, 256]
    - [115, 10520.9]
  - - [4288, 1024, 1, 1280]
    - [122, 10253.1]
  - - [5888, 128, 1, 3328]
    - [116, 9671.49]
  - - [448, 6784, 1, 3328]
    - [122, 10048.8]
  - - [2944, 1408, 1, 1280]
    - [125, 10890.5]
  - - [1024, 32, 1, 512]
    - [97, 2220.48]
  - - [2944, 1856, 1, 3328]
    - [122, 10050.5]
  - - [2368, 64, 1, 128]
    - [75, 1577.61]
  - - [2944, 2944, 1, 128]
    - [112, 5722.8]
  - - [4, 128, 1, 3328]
    - [133, 250.127]
  - - [3584, 5888, 1, 1280]
    - [125, 9770.5]
  - - [64, 4, 1, 128]
    - [126, 2.657]
  - - [6784, 1856, 1, 1280]
    - [114, 9827.87]
  - - [2944, 5056, 1, 256]
    - [116, 10782.0]
  - - [2944, 5888, 1, 1280]
    - [116, 9938.27]
  - - [5888, 256, 1, 3328]
    - [116, 10162.0]
  - - [1856, 5888, 1, 3328]
    - [125, 9373.56]
  - - [3584, 1408, 1, 256]
    - [122, 9908.83]
  - - [704, 3584, 1, 3328]
    - [123, 9901.9]
  - - [5056, 448, 1, 1280]
    - [122, 10316.2]
  - - [3584, 1856, 1, 3328]
    - [116, 9580.68]
  - - [64, 1408, 1, 128]
    - [75, 1088.96]
  - - [1408, 704, 1, 1280]
    - [116, 9579.5]
  - - [2944, 1024, 1, 256]
    - [122, 9138.99]
  - - [1024, 2368, 1, 128]
    - [112, 3778.25]
  - - [2368, 4288, 1, 3328]
    - [124, 9156.92]
  - - [4, 1408, 1, 256]
    - [130, 309.033]
  - - [1024, 1408, 1, 1280]
    - [122, 9509.01]
  - - [64, 64, 1, 256]
    - [88, 214.577]
  - - [704, 256, 1, 3328]
    - [116, 5167.21]
  - - [6784, 5056, 1, 256]
    - [114, 10472.5]
  - - [4, 4288, 1, 3328]
    - [129, 666.115]
  - - [448, 6784, 1, 128]
    - [111, 5025.57]
  - - [4, 704, 1, 3328]
    - [90, 527.234]
  - - [448, 2944, 1, 256]
    - [116, 7738.67]
  - - [2944, 6784, 1, 256]
    - [114, 10597.6]
  - - [2368, 2368, 1, 1280]
    - [122, 10409.8]
  - - [4, 4, 1, 1280]
    - [90, 3.59966]
  - - [1856, 3584, 1, 1280]
    - [122, 10411.4]
  - - [64, 2944, 1, 256]
    - [122, 3223.58]
  - - [3584, 1408, 1, 1280]
    - [121, 10161.7]
  - - [448, 256, 1, 128]
    - [75, 1348.26]
  - - [4288, 448, 1, 128]
    - [111, 4437.85]
  - - [5056, 256, 1, 1280]
    - [122, 10120.2]
  - - [1856, 1408, 1, 3328]
    - [116, 10431.4]
  - - [128, 128, 1, 128]
    - [74, 257.467]
  - - [1024, 4288, 1, 3328]
    - [122, 9678.66]
  - - [448, 2368, 1, 256]
    - [122, 7160.73]
  - - [1024, 4, 1, 128]
    - [126, 46.6641]
  - - [5056, 448, 1, 256]
    - [122, 9274.86]
  - - [2944, 2368, 1, 3328]
    - [122, 9798.34]
  - - [704, 128, 1, 3328]
    - [99, 6647.76]
  - - [64, 64, 1, 3328]
    - [109, 1822.0]
  - - [1024, 1856, 1, 1280]
    - [125, 9345.68]
  - - [6784, 1856, 1, 256]
    - [122, 10574.5]
  - - [128, 2368, 1, 3328]
    - [94, 7768.17]
  - - [1024, 5888, 1, 256]
    - [122, 9993.72]
  - - [5056, 128, 1, 1280]
    - [122, 7936.7]
  - - [5056, 64, 1, 3328]
    - [99, 7795.02]
  - - [128, 704, 1, 128]
    - [75, 1089.02]
  - - [1408, 2368, 1, 256]
    - [116, 9814.81]
  - - [1408, 1408, 1, 256]
    - [116, 8944.2]
  - - [4, 64, 1, 128]
    - [126, 2.64222]
  - - [64, 128, 1, 1280]
    - [105, 1791.93]
  - - [2368, 2368, 1, 128]
    - [112, 5455.79]
  - - [64, 5888, 1, 128]
    - [67, 2466.52]
  - - [5888, 4, 1, 3328]
    - [129, 669.366]
  - - [6784, 1408, 1, 128]
    - [110, 5568.63]
  - - [4288, 5888, 1, 256]
    - [115, 10656.4]
  - - [1408, 5056, 1, 256]
    - [122, 10250.9]
  - - [5056, 128, 1, 3328]
    - [99, 8444.79]
  - - [128, 128, 1, 1280]
    - [103, 2483.55]
  - - [448, 704, 1, 256]
    - [116, 4522.74]
  - - [4288, 3584, 1, 128]
    - [110, 6160.0]
  - - [2944, 128, 1, 3328]
    - [85, 8131.6]
  - - [128, 5056, 1, 1280]
    - [116, 7936.7]
  - - [3584, 5056, 1, 1280]
    - [124, 9685.69]
  - - [256, 448, 1, 1280]
    - [94, 5270.65]
  - - [704, 704, 1, 128]
    - [111, 3102.93]
  - - [5056, 4, 1, 128]
    - [126, 203.277]
  - - [704, 256, 1, 1280]
    - [116, 4805.87]
  - - [64, 2368, 1, 3328]
    - [94, 6891.51]
  - - [1856, 1024, 1, 128]
    - [110, 4420.09]
  - - [1856, 64, 1, 128]
    - [75, 1368.44]
  - - [64, 6784, 1, 1280]
    - [116, 7362.52]
  - - [704, 4288, 1, 256]
    - [116, 9597.54]
  - - [5888, 2368, 1, 1280]
    - [115, 10004.8]
  - - [128, 256, 1, 256]
    - [81, 1551.39]
  - - [256, 64, 1, 1280]
    - [92, 2573.77]
  - - [2368, 5888, 1, 1280]
    - [116, 9922.41]
  - - [5888, 256, 1, 1280]
    - [122, 10010.0]
  - - [4, 5888, 1, 1280]
    - [128, 667.251]
  - - [704, 128, 1, 128]
    - [75, 1112.33]
  - - [1024, 4, 1, 1280]
    - [88, 450.907]
  - - [2368, 1856, 1, 3328]
    - [116, 9873.72]
  - - [2368, 128, 1, 128]
    - [67, 2228.81]
  - - [2944, 704, 1, 256]
    - [116, 9314.23]
  - - [5056, 128, 1, 128]
    - [68, 3195.19]
  - - [256, 704, 1, 3328]
    - [116, 5200.39]
  - - [704, 3584, 1, 256]
    - [116, 9406.42]
  - - [1024, 1024, 1, 1024]
    - [122, 9406.35]
  - - [704, 2944, 1, 3328]
    - [122, 10455.3]
  - - [6784, 1024, 1, 128]
    - [110, 5180.82]
  - - [256, 448, 1, 128]
    - [75, 1339.09]
  - - [448, 1024, 1, 3328]
    - [116, 8488.63]
  - - [2944, 1024, 1, 3328]
    - [114, 9994.79]
  - - [2944, 5056, 1, 128]
    - [110, 5982.94]
  - - [1408, 6784, 1, 256]
    - [116, 10546.5]
  - - [6784, 1408, 1, 3328]
    - [122, 9315.1]
  - - [4288, 6784, 1, 128]
    - [110, 6151.05]
  - - [704, 64, 1, 256]
    - [93, 1970.94]
  - - [5888, 4, 1, 1280]
    - [128, 676.123]
  - - [256, 2368, 1, 3328]
    - [122, 7841.98]
  - - [6784, 2944, 1, 1280]
    - [121, 9532.64]
  - - [4288, 1856, 1, 128]
    - [110, 5722.89]
  - - [1856, 2944, 1, 128]
    - [111, 5600.1]
  - - [6784, 448, 1, 128]
    - [111, 4945.14]
  - - [64, 3584, 1, 128]
    - [75, 2043.11]
  - - [448, 5056, 1, 1280]
    - [116, 10316.2]
  - - [2368, 1856, 1, 128]
    - [112, 5447.97]
  - - [128, 448, 1, 1280]
    - [94, 4128.82]
  - - [4288, 704, 1, 256]
    - [122, 9484.18]
  - - [256, 3584, 1, 128]
    - [111, 2963.49]
  - - [5888, 704, 1, 256]
    - [122, 10081.2]
  - - [3584, 1024, 1, 128]
    - [112, 4625.63]
  - - [256, 5888, 1, 3328]
    - [123, 9907.79]
  - - [1408, 4288, 1, 3328]
    - [115, 9811.44]
  - - [6784, 4288, 1, 256]
    - [121, 10399.5]
  - - [4288, 256, 1, 128]
    - [111, 3552.17]
  - - [5888, 256, 1, 256]
    - [122, 8497.89]
  - - [6784, 1024, 1, 1280]
    - [115, 10221.2]
  - - [5888, 1024, 1, 128]
    - [110, 4818.93]
  - - [1024, 128, 1, 256]
    - [122, 2435.46]
  - - [128, 64, 1, 3328]
    - [108, 2453.68]
  - - [448, 64, 1, 256]
    - [81, 1357.48]
  - - [2368, 256, 1, 128]
    - [111, 2934.23]
  - - [6784, 3584, 1, 1280]
    - [125, 9670.26]
  - - [1024, 6784, 1, 1280]
    - [122, 10473.6]
  - - [2944, 64, 1, 1280]
    - [99, 5752.3]
  - - [1408, 2944, 1, 1280]
    - [121, 10888.8]
  - - [256, 1856, 1, 256]
    - [116, 6291.34]
  - - [1408, 2368, 1, 3328]
    - [122, 10298.6]
  - - [2944, 4, 1, 3328]
    - [131, 671.487]
  - - [128, 1408, 1, 3328]
    - [94, 7287.98]
  - - [2944, 1856, 1, 128]
    - [112, 5364.65]
  - - [256, 2944, 1, 128]
    - [111, 2818.93]
  - - [256, 6784, 1, 128]
    - [111, 3887.31]
  - - [2368, 4, 1, 128]
    - [126, 108.492]
  - - [1408, 256, 1, 3328]
    - [116, 6708.34]
  - - [1856, 4, 1, 128]
    - [126, 84.4974]
  - - [1024, 16, 1, 512]
    - [88, 1381.05]
  - - [5056, 6784, 1, 128]
    - [110, 6178.39]
  - - [4288, 5056, 1, 128]
    - [110, 6187.06]
  - - [1856, 5888, 1, 128]
    - [110, 5936.34]
  - - [2944, 5888, 1, 256]
    - [114, 10701.3]
  - - [3584, 1856, 1, 256]
    - [122, 9765.71]
  - - [4288, 3584, 1, 1280]
    - [125, 10220.0]
  - - [2368, 448, 1, 256]
    - [116, 7160.73]
  - - [4288, 256, 1, 3328]
    - [122, 8873.28]
  - - [1856, 704, 1, 128]
    - [111, 4300.58]
  - - [1408, 64, 1, 256]
    - [82, 2491.45]
  - - [64, 1856, 1, 128]
    - [75, 1324.29]
  - - [4, 256, 1, 128]
    - [126, 11.2285]
  - - [704, 4288, 1, 3328]
    - [116, 9956.21]
  - - [704, 5888, 1, 128]
    - [112, 5301.79]
  - - [6784, 3584, 1, 128]
    - [110, 6181.2]
  - - [1024, 64, 1, 256]
    - [82, 2097.12]
  - - [64, 2368, 1, 256]
    - [82, 2785.96]
  - - [4288, 5056, 1, 3328]
    - [125, 9028.1]
  - - [4, 1856, 1, 1280]
    - [77, 489.729]
  - - [4288, 128, 1, 128]
    - [68, 2773.23]
  - - [1408, 1408, 1, 128]
    - [111, 4472.15]
  - - [1024, 128, 1, 3328]
    - [79, 6714.6]
  - - [1856, 128, 1, 128]
    - [75, 2052.59]
  - - [5056, 2368, 1, 256]
    - [122, 10055.0]
  - - [4288, 704, 1, 3328]
    - [116, 9895.19]
  - - [448, 3584, 1, 256]
    - [116, 8184.35]
  - - [64, 128, 1, 128]
    - [75, 131.164]
  - - [2368, 64, 1, 1280]
    - [79, 5344.45]
  - - [2368, 1024, 1, 1280]
    - [124, 9645.52]
  - - [2944, 1408, 1, 3328]
    - [125, 10264.0]
  - - [1408, 448, 1, 256]
    - [116, 6488.0]
  - - [1024, 1408, 1, 3328]
    - [122, 9518.8]
  - - [2560, 7133, 1, 2560]
    - [115, 9516.08]
  - - [1408, 4, 1, 1280]
    - [88, 506.97]
  - - [5888, 3584, 1, 256]
    - [121, 10654.3]
  - - [128, 1024, 1, 1280]
    - [79, 5304.23]
  - - [1408, 1856, 1, 3328]
    - [116, 10466.7]
  - - [4, 4, 1, 3328]
    - [133, 8.65733]
  - - [6784, 1408, 1, 1280]
    - [122, 10204.8]
  - - [4, 1024, 1, 1280]
    - [88, 431.666]
  - - [704, 2944, 1, 256]
    - [116, 9387.56]
  - - [704, 4288, 1, 128]
    - [111, 5010.87]
  - - [2368, 4288, 1, 128]
    - [110, 5711.53]
  - - [64, 4288, 1, 1280]
    - [99, 5783.08]
  - - [6784, 64, 1, 1280]
    - [116, 7413.45]
  - - [3584, 128, 1, 128]
    - [71, 2687.22]
  - - [1024, 6784, 1, 128]
    - [110, 4574.68]
  - - [4, 1856, 1, 128]
    - [126, 86.1949]
  - - [1408, 64, 1, 3328]
    - [99, 6561.51]
  - - [6784, 4, 1, 256]
    - [128, 501.585]
  - - [1408, 1408, 1, 1280]
    - [122, 10081.3]
  - - [256, 2368, 1, 256]
    - [116, 6179.98]
  - - [448, 4288, 1, 3328]
    - [122, 9324.32]
  - - [2368, 1408, 1, 256]
    - [122, 9856.74]
  - - [5888, 5056, 1, 128]
    - [110, 5626.31]
  - - [704, 2368, 1, 256]
    - [116, 8484.94]
  - - [2944, 448, 1, 1280]
    - [122, 8785.78]
  - - [5888, 2368, 1, 3328]
    - [115, 9228.44]
  - - [64, 2944, 1, 1280]
    - [94, 5711.91]
  - - [448, 1856, 1, 1280]
    - [116, 8053.74]
  - - [4288, 448, 1, 1280]
    - [122, 9780.37]
  - - [5888, 704, 1, 3328]
    - [119, 9960.38]
  - - [5056, 256, 1, 128]
    - [111, 4284.71]
  - - [1856, 256, 1, 128]
    - [111, 3007.44]
  - - [5056, 128, 1, 256]
    - [116, 6371.97]
  - - [704, 4, 1, 256]
    - [88, 167.906]
  - - [1408, 5888, 1, 128]
    - [110, 5602.44]
  - - [4288, 4, 1, 128]
    - [126, 176.52]
  - - [1408, 1024, 1, 256]
    - [122, 8304.62]
  - - [1024, 1856, 1, 128]
    - [112, 3527.51]
  - - [256, 704, 1, 128]
    - [111, 1360.0]
  - - [256, 1024, 1, 128]
    - [111, 1769.52]
  - - [448, 1024, 1, 256]
    - [116, 6097.74]
  - - [128, 4, 1, 3328]
    - [133, 250.127]
  - - [5056, 6784, 1, 1280]
    - [125, 9450.82]
  - - [704, 5056, 1, 3328]
    - [116, 10005.9]
  - - [64, 1408, 1, 1280]
    - [94, 4927.62]
  - - [3584, 5056, 1, 3328]
    - [125, 9374.93]
  - - [1856, 4, 1, 3328]
    - [77, 603.241]
  - - [4, 2944, 1, 128]
    - [126, 134.857]
  - - [2368, 2944, 1, 3328]
    - [122, 9678.14]
  - - [448, 448, 1, 1280]
    - [94, 5878.1]
  - - [2368, 3584, 1, 256]
    - [122, 10434.0]
  - - [1024, 256, 1, 1280]
    - [122, 6593.56]
  - - [5056, 3584, 1, 1280]
    - [121, 9869.16]
  - - [448, 4, 1, 3328]
    - [133, 468.178]
  - - [1856, 2944, 1, 1280]
    - [116, 10231.6]
  - - [3584, 2368, 1, 1280]
    - [122, 10207.5]
  - - [128, 1024, 1, 256]
    - [84, 2696.32]
  - - [2944, 1408, 1, 256]
    - [116, 10017.7]
  - - [4288, 1408, 1, 3328]
    - [121, 9899.88]
  - - [3584, 64, 1, 3328]
    - [86, 6713.49]
  - - [1408, 128, 1, 256]
    - [116, 3441.13]
  - - [2944, 1024, 1, 128]
    - [112, 4787.91]
  - - [4288, 5056, 1, 1280]
    - [122, 9609.94]
  - - [5888, 6784, 1, 1280]
    - [115, 9452.36]
  - - [6784, 5056, 1, 128]
    - [110, 6428.33]
  - - [256, 1024, 1, 3328]
    - [122, 7421.15]
  - - [3584, 4, 1, 256]
    - [81, 481.098]
  - - [1856, 64, 1, 3328]
    - [99, 7068.41]
  - - [64, 6784, 1, 128]
    - [71, 2605.07]
  - - [5888, 1408, 1, 3328]
    - [121, 9951.6]
  - - [5888, 64, 1, 1280]
    - [116, 6479.14]
  - - [256, 5056, 1, 256]
    - [116, 8585.63]
  - - [128, 3584, 1, 128]
    - [71, 2781.47]
  - - [448, 3584, 1, 3328]
    - [122, 9048.71]
  - - [704, 2368, 1, 128]
    - [111, 4199.23]
  - - [5888, 256, 1, 128]
    - [111, 3847.32]
  - - [4, 5056, 1, 128]
    - [126, 203.277]
  - - [448, 256, 1, 256]
    - [83, 2540.78]
  - - [704, 4, 1, 3328]
    - [90, 536.174]
  - - [1408, 256, 1, 256]
    - [116, 5105.34]
  - - [3584, 1856, 1, 128]
    - [111, 5124.54]
  - - [4288, 4288, 1, 128]
    - [110, 6081.95]
  - - [1856, 1024, 1, 3328]
    - [123, 9431.77]
  - - [128, 5888, 1, 3328]
    - [116, 9710.3]
  - - [1024, 5056, 1, 256]
    - [122, 9962.44]
  - - [2368, 1408, 1, 3328]
    - [122, 10276.0]
  - - [5888, 448, 1, 256]
    - [116, 8559.74]
  - - [5888, 6784, 1, 128]
    - [110, 6003.0]
  - - [2368, 4, 1, 3328]
    - [131, 659.856]
  - - [6784, 5056, 1, 1280]
    - [115, 9459.27]
  - - [5056, 704, 1, 1280]
    - [122, 10598.9]
  - - [1408, 256, 1, 1280]
    - [116, 6284.99]
  - - [4288, 6784, 1, 1280]
    - [115, 9474.33]
  - - [128, 704, 1, 256]
    - [82, 2377.33]
  - - [1024, 1024, 1, 128]
    - [113, 3653.13]
  - - [448, 128, 1, 1280]
    - [94, 4216.69]
  - - [6784, 4, 1, 3328]
    - [128, 643.778]
  - - [4288, 4, 1, 1280]
    - [76, 617.547]
  - - [1024, 64, 1, 3328]
    - [94, 5229.78]
  - - [1856, 4, 1, 256]
    - [130, 377.417]
  - - [64, 3584, 1, 1280]
    - [116, 5889.38]
  - - [6784, 1408, 1, 256]
    - [122, 10449.7]
  - - [3584, 5888, 1, 128]
    - [110, 5616.87]
  - - [5056, 5888, 1, 256]
    - [125, 10537.9]
  - - [2368, 1024, 1, 256]
    - [123, 8380.04]
  - - [2944, 1856, 1, 256]
    - [122, 10273.9]
  - - [1856, 6784, 1, 1280]
    - [122, 10137.4]
  - - [64, 5056, 1, 128]
    - [67, 2273.05]
  - - [5888, 64, 1, 128]
    - [67, 2393.99]
  - - [448, 704, 1, 128]
    - [111, 1939.53]
  - - [4, 1024, 1, 128]
    - [126, 47.6006]
  - - [4288, 3584, 1, 256]
    - [122, 10744.7]
  - - [1408, 704, 1, 128]
    - [111, 3652.1]
  - - [64, 256, 1, 3328]
    - [103, 3271.59]
  - - [5056, 1856, 1, 1280]
    - [122, 10048.4]
  - - [1408, 1024, 1, 3328]
    - [122, 9525.8]
  - - [2368, 256, 1, 3328]
    - [116, 7848.77]
  - - [5888, 3584, 1, 1280]
    - [115, 9784.13]
  - - [1856, 3584, 1, 3328]
    - [116, 9596.37]
  - - [5888, 128, 1, 1280]
    - [122, 9151.8]
  - - [1024, 2944, 1, 256]
    - [124, 8588.96]
  - - [448, 6784, 1, 1280]
    - [116, 10513.9]
  - - [256, 3584, 1, 1280]
    - [122, 8837.32]
  - - [448, 128, 1, 128]
    - [75, 683.434]
  - - [704, 5056, 1, 256]
    - [116, 9817.35]
  - - [3584, 1024, 1, 3328]
    - [124, 10224.7]
  - - [2944, 1856, 1, 1280]
    - [116, 10131.7]
  - - [128, 256, 1, 128]
    - [75, 453.073]
  - - [5056, 256, 1, 256]
    - [122, 8652.1]
  - - [2368, 3584, 1, 3328]
    - [118, 9488.17]
  - - [2944, 704, 1, 1280]
    - [122, 10548.8]
  - - [128, 4, 1, 256]
    - [88, 40.3123]
  - - [2944, 3584, 1, 1280]
    - [122, 10161.2]
  - - [1856, 5888, 1, 1280]
    - [114, 10054.0]
  - - [256, 256, 1, 1280]
    - [94, 4641.23]
  - - [5056, 448, 1, 3328]
    - [116, 9969.01]
  - - [4288, 1408, 1, 256]
    - [122, 10021.7]
  - - [3584, 64, 1, 256]
    - [116, 3811.12]
  - - [64, 1856, 1, 3328]
    - [94, 6994.26]
  - - [256, 1408, 1, 128]
    - [111, 1922.45]
  - - [5888, 1408, 1, 128]
    - [110, 5251.27]
  - - [4288, 2368, 1, 1280]
    - [122, 9996.98]
  - - [4, 4288, 1, 256]
    - [128, 456.062]
  - - [256, 4288, 1, 128]
    - [111, 3399.42]
  - - [256, 128, 1, 3328]
    - [104, 4447.66]
  - - [6784, 2368, 1, 256]
    - [122, 10398.5]
  - - [5888, 128, 1, 128]
    - [72, 3042.81]
  - - [4288, 1856, 1, 256]
    - [122, 10382.8]
  - - [1856, 256, 1, 3328]
    - [116, 8799.04]
  - - [1856, 2944, 1, 256]
    - [122, 10313.2]
  - - [5056, 1024, 1, 128]
    - [112, 4918.28]
  - - [64, 5888, 1, 1280]
    - [116, 6498.56]
  - - [1760, 7133, 1, 1760]
    - [122, 9654.27]
  - - [6784, 256, 1, 128]
    - [111, 4232.74]
  - - [5888, 704, 1, 128]
    - [111, 4987.99]
  - - [6784, 64, 1, 128]
    - [73, 2623.27]
  - - [1024, 4288, 1, 1280]
    - [119, 9991.22]
  - - [2368, 5056, 1, 3328]
    - [125, 9370.15]
  - - [448, 4, 1, 128]
    - [126, 19.8228]
  - - [4, 256, 1, 3328]
    - [133, 359.504]
  - - [4288, 1024, 1, 3328]
    - [123, 9492.38]
  - - [1024, 5056, 1, 3328]
    - [121, 10089.0]
  - - [1024, 1856, 1, 3328]
    - [125, 9746.12]
  - - [704, 704, 1, 1280]
    - [122, 8607.11]
  - - [128, 2368, 1, 1280]
    - [99, 5742.92]
  - - [1408, 128, 1, 3328]
    - [106, 7102.61]
  - - [3584, 256, 1, 1280]
    - [122, 8827.49]
  - - [4, 128, 1, 128]
    - [126, 5.80772]
  - - [704, 6784, 1, 128]
    - [112, 5259.85]
  - - [3584, 128, 1, 1280]
    - [122, 7895.47]
  - - [4, 256, 1, 1280]
    - [90, 256.526]
  - - [128, 704, 1, 3328]
    - [94, 6325.75]
  - - [4288, 6784, 1, 256]
    - [114, 10339.6]
  - - [3584, 2944, 1, 3328]
    - [124, 9175.77]
  - - [128, 1856, 1, 256]
    - [116, 4344.05]
  - - [64, 4288, 1, 256]
    - [116, 3690.43]
  - - [4, 3584, 1, 3328]
    - [77, 684.549]
  - - [64, 4, 1, 3328]
    - [133, 130.8]
  - - [4, 64, 1, 3328]
    - [133, 129.333]
  - - [5888, 2944, 1, 256]
    - [122, 10705.1]
  - - [2368, 6784, 1, 128]
    - [110, 5947.94]
  - - [448, 4288, 1, 1280]
    - [122, 9780.37]
  - - [448, 1856, 1, 3328]
    - [116, 8319.89]
  - - [4, 1024, 1, 256]
    - [88, 221.272]
  - - [5056, 4288, 1, 256]
    - [115, 10354.5]
  - - [1024, 448, 1, 256]
    - [122, 5562.84]
  - - [1024, 3584, 1, 256]
    - [122, 9630.47]
  - - [2944, 128, 1, 1280]
    - [116, 6603.99]
  - - [1856, 5056, 1, 128]
    - [112, 5807.74]
  - - [64, 256, 1, 256]
    - [81, 913.295]
  - - [1408, 4, 1, 128]
    - [126, 63.7047]
  - - [128, 2368, 1, 128]
    - [67, 2200.68]
  - - [256, 704, 1, 1280]
    - [116, 4820.79]
  - - [64, 2368, 1, 128]
    - [70, 1626.69]
  - - [6784, 6784, 1, 3328]
    - [125, 9316.81]
  - - [448, 5888, 1, 1280]
    - [116, 9902.36]
  - - [5056, 448, 1, 128]
    - [111, 4773.22]
  - - [3584, 2944, 1, 128]
    - [110, 5585.9]
  - - [6784, 256, 1, 1280]
    - [122, 9976.59]
  - - [256, 2944, 1, 1280]
    - [116, 9269.06]
  - - [64, 4288, 1, 128]
    - [70, 2018.04]
  - - [2368, 5888, 1, 3328]
    - [114, 9269.68]
  - - [4, 64, 1, 256]
    - [88, 20.6732]
  - - [704, 1024, 1, 3328]
    - [116, 9322.88]
  - - [2368, 1856, 1, 1280]
    - [116, 10849.1]
  - - [128, 448, 1, 128]
    - [70, 697.888]
  - - [128, 6784, 1, 256]
    - [116, 6946.7]
  - - [3584, 4288, 1, 128]
    - [110, 5698.68]
  - - [64, 448, 1, 128]
    - [75, 378.296]
  - - [5888, 4288, 1, 3328]
    - [125, 9293.93]
  - - [2368, 704, 1, 256]
    - [116, 8435.3]
  - - [256, 1856, 1, 3328]
    - [116, 8806.29]
  - - [1856, 128, 1, 256]
    - [116, 4321.21]
  - - [6784, 128, 1, 128]
    - [69, 3283.39]
  - - [3584, 1408, 1, 128]
    - [112, 4985.61]
  - - [1856, 5056, 1, 1280]
    - [122, 10336.0]
  - - [2944, 1024, 1, 1280]
    - [125, 10341.9]
  - - [5056, 4, 1, 256]
    - [128, 488.851]
  - - [3584, 5888, 1, 3328]
    - [125, 9280.68]
  - - [2368, 4288, 1, 256]
    - [122, 10620.9]
  - - [1024, 2368, 1, 3328]
    - [122, 9719.88]
  - - [64, 704, 1, 3328]
    - [104, 4865.96]
  - - [704, 1408, 1, 256]
    - [116, 8136.81]
  - - [6784, 1856, 1, 3328]
    - [115, 9115.65]
  - - [1024, 2944, 1, 128]
    - [112, 3970.49]
  - - [1024, 3584, 1, 1280]
    - [119, 10601.2]
  - - [4288, 5888, 1, 3328]
    - [125, 9229.58]
  - - [4288, 4, 1, 3328]
    - [76, 666.115]
  - - [256, 1408, 1, 256]
    - [116, 4923.65]
  - - [448, 2944, 1, 1280]
    - [116, 8826.61]
  - - [4, 5888, 1, 128]
    - [126, 227.458]
  - - [1024, 2944, 1, 3328]
    - [115, 10104.4]
  - - [3584, 6784, 1, 256]
    - [114, 10771.3]
  - - [256, 6784, 1, 1280]
    - [122, 9973.28]
  - - [1856, 3584, 1, 256]
    - [122, 10253.5]
  - - [128, 448, 1, 3328]
    - [94, 5612.9]
  - - [6784, 1856, 1, 128]
    - [111, 5627.8]
  - - [4, 448, 1, 256]
    - [88, 129.108]
  - - [2944, 704, 1, 128]
    - [111, 4633.09]
  - - [256, 5888, 1, 1280]
    - [116, 10037.0]
  - - [4, 128, 1, 1280]
    - [90, 136.222]
  - - [4288, 6784, 1, 3328]
    - [125, 9159.08]
  - - [6784, 128, 1, 1280]
    - [122, 8322.16]
  - - [64, 1408, 1, 256]
    - [82, 2341.62]
  - - [7680, 5481, 1, 2560]
    - [115, 9273.6]
  - - [2368, 1408, 1, 128]
    - [111, 5181.05]
  - - [1856, 448, 1, 256]
    - [116, 6874.56]
  - - [1408, 1024, 1, 128]
    - [111, 3832.94]
  - - [128, 64, 1, 128]
    - [75, 103.423]
  - - [6784, 3584, 1, 3328]
    - [125, 9275.59]
  - - [2944, 64, 1, 3328]
    - [99, 7322.7]
  - - [64, 64, 1, 128]
    - [70, 51.7616]
  - - [2368, 5056, 1, 1280]
    - [115, 10118.5]
  - - [64, 4, 1, 1280]
    - [90, 67.1239]
  - - [1408, 2368, 1, 1280]
    - [116, 10684.9]
  - - [128, 1408, 1, 1280]
    - [94, 5693.33]
  - - [256, 64, 1, 3328]
    - [102, 3214.41]
  - - [2944, 4288, 1, 128]
    - [110, 5926.03]
  - - [2944, 2944, 1, 256]
    - [116, 10198.5]
  - - [2944, 4, 1, 1280]
    - [77, 609.331]
  - - [5888, 4, 1, 256]
    - [128, 493.396]
  - - [6784, 256, 1, 256]
    - [122, 8648.32]
  - - [256, 5056, 1, 3328]
    - [116, 10451.2]
  - - [128, 4288, 1, 1280]
    - [94, 6847.79]
  - - [5056, 1856, 1, 128]
    - [111, 5890.01]
  - - [5888, 1408, 1, 256]
    - [122, 10123.9]
  - - [128, 128, 1, 256]
    - [95, 898.912]
  - - [5056, 4, 1, 3328]
    - [128, 699.018]
  - - [4288, 3584, 1, 3328]
    - [125, 9549.36]
  - - [448, 704, 1, 3328]
    - [116, 5877.11]
  - - [448, 448, 1, 128]
    - [111, 1835.04]
  - - [1024, 2368, 1, 1280]
    - [122, 9950.17]
  - - [1856, 704, 1, 3328]
    - [122, 10546.7]
  - - [4, 2368, 1, 128]
    - [126, 107.775]
  - - [5888, 6784, 1, 3328]
    - [125, 9196.11]
  - - [704, 4288, 1, 1280]
    - [122, 10436.7]
  - - [704, 256, 1, 256]
    - [116, 3441.13]
  - - [6784, 448, 1, 3328]
    - [122, 9963.77]
  - - [4288, 1024, 1, 128]
    - [112, 4695.18]
  - - [3136, 256, 64, 64]
    - [137, 7708.0]
  - - [784, 512, 64, 128]
    - [143, 8995.0]
  - - [49, 2048, 128, 512]
    - [134, 6772.55]
  - - [784, 128, 64, 512]
    - [144, 9035.3]
  - - [196, 1024, 64, 256]
    - [138, 8030.11]
  - - [3136, 64, 128, 64]
    - [140, 5170.13]
  - - [784, 512, 128, 128]
    - [143, 9170.62]
  - - [196, 1024, 128, 256]
    - [145, 8177.3]
  - - [196, 256, 64, 1024]
    - [141, 7986.79]
  - - [3136, 64, 64, 64]
    - [135, 5023.86]
  - - [3136, 64, 64, 256]
    - [144, 7535.3]
  - - [3136, 64, 128, 256]
    - [139, 7524.44]
  - - [784, 128, 128, 512]
    - [144, 9226.85]
  - - [49, 2048, 64, 512]
    - [144, 6643.33]
  - - [196, 256, 128, 1024]
    - [145, 8251.79]
  - - [49, 512, 64, 2048]
    - [142, 6630.44]
  - - [49, 512, 128, 2048]
    - [142, 7073.66]
  - - [3136, 256, 128, 64]
    - [136, 7840.06]
- null
