library/src/blas3/Tensile/Logic/asm_full/vega10_Cijk_Ailk_Bjlk_SB.yaml
- {MinimumRequiredVersion: 4.0.2}
- vega10
- gfx900
- [Device 6863, Device 6862, Device 687f, Device 6860]
- - - [4096, 7133, 1, 4096]
    - [12, 12205.9]
  - - [512, 16, 1, 512]
    - [1, 395.951]
  - - [2048, 7133, 1, 2048]
    - [12, 11721.2]
  - - [2560, 7133, 1, 2560]
    - [7, 11888.4]
  - - [1024, 1024, 1, 1024]
    - [11, 8526.46]
  - - [3072, 7435, 1, 1024]
    - [12, 11142.5]
  - - [1024, 32, 1, 512]
    - [3, 1230.9]
  - - [1760, 7133, 1, 1760]
    - [8, 11440.9]
  - - [7680, 5481, 1, 2560]
    - [13, 12060.1]
  - - [1024, 16, 1, 512]
    - [2, 678.114]
  - - [512, 32, 1, 512]
    - [1, 740.128]
- - - -1
    - - - -1
        - - - 4
            - - [448, 4]
              - [1408, 1]
              - [2368, 4]
              - [3584, 1]
              - [5056, 4]
              - [5888, 1]
              - [-1, 4]
          - - 64
            - - [128, 4]
              - [256, 1]
              - [1856, 0]
              - [3584, 5]
              - [5056, 0]
              - [5888, 10]
              - [-1, 8]
          - - 128
            - - [64, 4]
              - [128, 1]
              - [704, 0]
              - [1024, 5]
              - [1408, 0]
              - [3584, 5]
              - [4288, 0]
              - [5056, 5]
              - [5888, 10]
              - [-1, 5]
          - - 256
            - - [4, 4]
              - [64, 2]
              - [448, 0]
              - [3584, 10]
              - [4288, 8]
              - [-1, 10]
          - - 448
            - - [4, 4]
              - [448, 0]
              - [704, 10]
              - [1408, 8]
              - [3584, 10]
              - [4288, 8]
              - [5056, 10]
              - [5888, 8]
              - [-1, 7]
          - - 704
            - - [4, 4]
              - [128, 0]
              - [1408, 10]
              - [1856, 8]
              - [3584, 10]
              - [4288, 7]
              - [5888, 9]
              - [-1, 10]
          - - 1024
            - - [4, 4]
              - [128, 0]
              - [704, 8]
              - [1024, 11]
              - [2368, 8]
              - [2944, 13]
              - [3584, 6]
              - [4288, 8]
              - [5056, 12]
              - [5888, 13]
              - [-1, 12]
          - - 1408
            - - [4, 4]
              - [128, 0]
              - [256, 8]
              - [704, 10]
              - [1024, 7]
              - [2368, 10]
              - [2944, 13]
              - [3584, 7]
              - [5056, 12]
              - [5888, 13]
              - [-1, 8]
          - - 1856
            - - [4, 4]
              - [64, 0]
              - [128, 5]
              - [256, 10]
              - [704, 8]
              - [1024, 12]
              - [1408, 8]
              - [1856, 9]
              - [2944, 8]
              - [3584, 7]
              - [5056, 8]
              - [5888, 7]
              - [-1, 9]
          - - 2368
            - - [4, 4]
              - [64, 5]
              - [128, 0]
              - [704, 8]
              - [1024, 9]
              - [1856, 8]
              - [2368, 9]
              - [5056, 8]
              - [-1, 9]
          - - 2944
            - - [4, 4]
              - [64, 5]
              - [128, 0]
              - [704, 8]
              - [1024, 9]
              - [1408, 13]
              - [2368, 8]
              - [2944, 9]
              - [3584, 8]
              - [5056, 9]
              - [5888, 13]
              - [-1, 6]
          - - 3584
            - - [4, 4]
              - [64, 5]
              - [704, 8]
              - [1408, 9]
              - [1856, 8]
              - [3584, 9]
              - [4288, 13]
              - [5056, 9]
              - [5888, 6]
              - [-1, 9]
          - - 4288
            - - [4, 4]
              - [128, 0]
              - [704, 8]
              - [1024, 9]
              - [1408, 13]
              - [2368, 8]
              - [2944, 9]
              - [3584, 13]
              - [-1, 9]
          - - 5056
            - - [4, 4]
              - [64, 0]
              - [128, 5]
              - [704, 8]
              - [1408, 13]
              - [2368, 8]
              - [4288, 9]
              - [5056, 13]
              - [-1, 9]
          - - 5888
            - - [4, 4]
              - [64, 10]
              - [704, 8]
              - [1408, 13]
              - [2368, 6]
              - [2944, 13]
              - [5888, 6]
              - [-1, 9]
          - - -1
            - - [4, 1]
              - [64, 10]
              - [128, 0]
              - [704, 8]
              - [1024, 13]
              - [1408, 8]
              - [1856, 9]
              - [2368, 6]
              - [3584, 9]
              - [5056, 6]
              - [5888, 7]
              - [-1, 13]
