library/src/blas3/Tensile/Logic/asm_full/vega10_Cijk_Ailk_Bljk_SB_GB.yaml
- {MinimumRequiredVersion: 4.26.0}
- vega10
- gfx900
- [Device 6863, Device 6862, Device 687f, Device 6860, Device 6861, 'Vega 10 XTX [Radeon
    SolutionIndex: 0
    SolutionNameMin: Cijk_Ailk_Bljk_SB_GB_MT32x32x8_SN_AMAS3_GRVW4_LRVW4_TT4_4_VW4_WG8_8_1_WGM1
    SolutionIndex: 1
    SolutionNameMin: Cijk_Ailk_Bljk_SB_GB_MT128x64x8_SN_AMAS3_GRVW4_LRVW4_TT8_4_VW4_WG16_16_1_WGM1
    SolutionIndex: 2
    SolutionNameMin: Cijk_Ailk_Bljk_SB_GB_MT128x128x8_SN_AMAS3_GRVW4_LRVW4_TT8_8_VW4_WG16_16_1_WGM1
    SolutionIndex: 3
    SolutionNameMin: Cijk_Ailk_Bljk_SB_GB_MT32x32x16_SN_AMAS3_GRVW4_LRVW4_TT4_4_VW4_WG8_8_1_WGM1
    SolutionIndex: 4
    SolutionNameMin: Cijk_Ailk_Bljk_SB_GB_MT64x64x16_SN_AMAS3_GRVW4_LRVW4_TT4_4_VW4_WG16_16_1_WGM1
    SolutionIndex: 5
    SolutionNameMin: Cijk_Ailk_Bljk_SB_GB_MT128x64x16_SN_AMAS3_GRVW4_LRVW4_TT8_4_VW4_WG16_16_1_WGM1
    SolutionIndex: 6
    SolutionNameMin: Cijk_Ailk_Bljk_SB_GB_MT32x32x32_SN_AMAS3_GRVW4_LRVW4_TT4_4_VW4_WG8_8_1_WGM1
    SolutionIndex: 7
    SolutionNameMin: Cijk_Ailk_Bljk_SB_GB_MT64x64x32_SN_AMAS3_GRVW4_LRVW4_TT4_4_VW4_WG16_16_1_WGM1
    SolutionIndex: 8
    SolutionNameMin: Cijk_Ailk_Bljk_SB_GB_MT128x64x32_SN_AMAS3_GRVW4_LRVW4_TT8_4_VW4_WG16_16_1_WGM1
    SolutionIndex: 9
    SolutionNameMin: Cijk_Ailk_Bljk_SB_GB_MT32x32x8_SN_AMAS3_GRVW4_LRVW4_TT4_4_VW4_WG8_8_1_WGM8
    SolutionIndex: 10
    SolutionNameMin: Cijk_Ailk_Bljk_SB_GB_MT128x64x8_SN_AMAS3_GRVW4_LRVW4_TT8_4_VW4_WG16_16_1_WGM8
    SolutionIndex: 11
    SolutionNameMin: Cijk_Ailk_Bljk_SB_GB_MT32x32x16_SN_AMAS3_GRVW4_LRVW4_TT4_4_VW4_WG8_8_1_WGM8
    SolutionIndex: 12
    SolutionNameMin: Cijk_Ailk_Bljk_SB_GB_MT64x64x16_SN_AMAS3_GRVW4_LRVW4_TT4_4_VW4_WG16_16_1_WGM8
    SolutionIndex: 13
    SolutionNameMin: Cijk_Ailk_Bljk_SB_GB_MT128x128x16_SN_AMAS3_GRVW4_LRVW4_TT8_8_VW4_WG16_16_1_WGM8
    SolutionIndex: 14
    SolutionNameMin: Cijk_Ailk_Bljk_SB_GB_MT32x32x32_SN_AMAS3_GRVW4_LRVW4_TT4_4_VW4_WG8_8_1_WGM8
    SolutionIndex: 15
    SolutionNameMin: Cijk_Ailk_Bljk_SB_GB_MT64x64x32_SN_AMAS3_GRVW4_LRVW4_TT4_4_VW4_WG16_16_1_WGM8
    SolutionIndex: 16
    SolutionNameMin: Cijk_Ailk_Bljk_SB_GB_MT128x64x8_SN_AMAS0_GRVW1_LRVW1_TT8_4_VW1_WG16_16_1_WGM8
- - - [32, 32, 8, 32, 32, 32, 32, 32]
    - [3, 70.0]
  - - [32, 32, 8, 64, 32, 32, 32, 64]
    - [0, 108.0]
  - - [32, 32, 8, 128, 32, 32, 32, 128]
    - [0, 145.0]
  - - [32, 32, 8, 256, 32, 32, 32, 256]
    - [3, 178.0]
  - - [32, 32, 8, 512, 32, 32, 32, 512]
    - [11, 204.0]
  - - [32, 64, 8, 32, 32, 32, 32, 32]
    - [0, 143.0]
  - - [32, 64, 8, 64, 32, 32, 32, 64]
    - [0, 213.0]
  - - [32, 64, 8, 128, 32, 32, 32, 128]
    - [11, 291.0]
  - - [32, 64, 8, 256, 32, 32, 32, 256]
    - [3, 361.0]
  - - [32, 64, 8, 512, 32, 32, 32, 512]
    - [11, 411.0]
  - - [32, 128, 8, 32, 32, 32, 32, 32]
    - [11, 284.0]
  - - [32, 128, 8, 64, 32, 32, 32, 64]
    - [0, 430.0]
  - - [32, 128, 8, 128, 32, 32, 32, 128]
    - [3, 583.0]
  - - [32, 128, 8, 256, 32, 32, 32, 256]
    - [3, 725.0]
  - - [32, 128, 8, 512, 32, 32, 32, 512]
    - [6, 808.0]
  - - [32, 256, 8, 32, 32, 32, 32, 32]
    - [0, 557.0]
  - - [32, 256, 8, 64, 32, 32, 32, 64]
    - [3, 844.0]
  - - [32, 256, 8, 128, 32, 32, 32, 128]
    - [3, 1118.0]
  - - [32, 256, 8, 256, 32, 32, 32, 256]
    - [3, 1185.0]
  - - [32, 256, 8, 512, 32, 32, 32, 512]
    - [14, 1203.0]
  - - [32, 512, 8, 32, 32, 32, 32, 32]
    - [9, 1060.0]
  - - [32, 512, 8, 64, 32, 32, 32, 64]
    - [3, 1551.0]
  - - [32, 512, 8, 128, 32, 32, 32, 128]
    - [3, 1929.0]
  - - [32, 512, 8, 256, 32, 32, 32, 256]
    - [14, 1552.0]
  - - [32, 512, 8, 512, 32, 32, 32, 512]
    - [6, 1165.0]
  - - [64, 32, 8, 32, 64, 64, 64, 32]
    - [3, 141.0]
  - - [64, 32, 8, 64, 64, 64, 64, 64]
    - [0, 215.0]
  - - [64, 32, 8, 128, 64, 64, 64, 128]
    - [11, 295.0]
  - - [64, 32, 8, 256, 64, 64, 64, 256]
    - [11, 362.0]
  - - [64, 32, 8, 512, 64, 64, 64, 512]
    - [11, 411.0]
  - - [64, 64, 8, 32, 64, 64, 64, 32]
    - [0, 288.0]
  - - [64, 64, 8, 64, 64, 64, 64, 64]
    - [0, 432.0]
  - - [64, 64, 8, 128, 64, 64, 64, 128]
    - [11, 590.0]
  - - [64, 64, 8, 256, 64, 64, 64, 256]
    - [11, 725.0]
  - - [64, 64, 8, 512, 64, 64, 64, 512]
    - [3, 821.0]
  - - [64, 128, 8, 32, 64, 64, 64, 32]
    - [3, 566.0]
  - - [64, 128, 8, 64, 64, 64, 64, 64]
    - [0, 857.0]
  - - [64, 128, 8, 128, 64, 64, 64, 128]
    - [3, 1132.0]
  - - [64, 128, 8, 256, 64, 64, 64, 256]
    - [12, 1381.0]
  - - [64, 128, 8, 512, 64, 64, 64, 512]
    - [12, 1517.0]
  - - [64, 256, 8, 32, 64, 64, 64, 32]
    - [9, 1079.0]
  - - [64, 256, 8, 64, 64, 64, 64, 64]
    - [3, 1558.0]
  - - [64, 256, 8, 128, 64, 64, 64, 128]
    - [3, 2020.0]
  - - [64, 256, 8, 256, 64, 64, 64, 256]
    - [12, 2063.0]
  - - [64, 256, 8, 512, 64, 64, 64, 512]
    - [7, 1807.0]
  - - [64, 512, 8, 32, 64, 64, 64, 32]
    - [9, 1783.0]
  - - [64, 512, 8, 64, 64, 64, 64, 64]
    - [3, 2430.0]
  - - [64, 512, 8, 128, 64, 64, 64, 128]
    - [4, 2805.0]
  - - [64, 512, 8, 256, 64, 64, 64, 256]
    - [15, 2047.0]
  - - [64, 512, 8, 512, 64, 64, 64, 512]
    - [7, 1949.0]
  - - [128, 32, 8, 32, 128, 128, 128, 32]
    - [3, 282.0]
  - - [128, 32, 8, 64, 128, 128, 128, 64]
    - [0, 433.0]
  - - [128, 32, 8, 128, 128, 128, 128, 128]
    - [11, 590.0]
  - - [128, 32, 8, 256, 128, 128, 128, 256]
    - [3, 727.0]
  - - [128, 32, 8, 512, 128, 128, 128, 512]
    - [11, 823.0]
  - - [128, 64, 8, 32, 128, 128, 128, 32]
    - [3, 564.0]
  - - [128, 64, 8, 64, 128, 128, 128, 64]
    - [3, 850.0]
  - - [128, 64, 8, 128, 128, 128, 128, 128]
    - [3, 1126.0]
  - - [128, 64, 8, 256, 128, 128, 128, 256]
    - [12, 1389.0]
  - - [128, 64, 8, 512, 128, 128, 128, 512]
    - [4, 1529.0]
  - - [128, 128, 8, 32, 128, 128, 128, 32]
    - [3, 1072.0]
  - - [128, 128, 8, 64, 128, 128, 128, 64]
    - [3, 1562.0]
  - - [128, 128, 8, 128, 128, 128, 128, 128]
    - [3, 2004.0]
  - - [128, 128, 8, 256, 128, 128, 128, 256]
    - [4, 2107.0]
  - - [128, 128, 8, 512, 128, 128, 128, 512]
    - [7, 2221.0]
  - - [128, 256, 8, 32, 128, 128, 128, 32]
    - [0, 1789.0]
  - - [128, 256, 8, 64, 128, 128, 128, 64]
    - [4, 2330.0]
  - - [128, 256, 8, 128, 128, 128, 128, 128]
    - [4, 2776.0]
  - - [128, 256, 8, 256, 128, 128, 128, 256]
    - [12, 2658.0]
  - - [128, 256, 8, 512, 128, 128, 128, 512]
    - [5, 2493.0]
  - - [128, 512, 8, 32, 128, 128, 128, 32]
    - [12, 2508.0]
  - - [128, 512, 8, 64, 128, 128, 128, 64]
    - [12, 3338.0]
  - - [128, 512, 8, 128, 128, 128, 128, 128]
    - [4, 3483.0]
  - - [128, 512, 8, 256, 128, 128, 128, 256]
    - [4, 2879.0]
  - - [128, 512, 8, 512, 128, 128, 128, 512]
    - [5, 2876.0]
  - - [256, 32, 8, 32, 256, 256, 256, 32]
    - [3, 558.0]
  - - [256, 32, 8, 64, 256, 256, 256, 64]
    - [0, 853.0]
  - - [256, 32, 8, 128, 256, 256, 256, 128]
    - [3, 1120.0]
  - - [256, 32, 8, 256, 256, 256, 256, 256]
    - [3, 1265.0]
  - - [256, 32, 8, 512, 256, 256, 256, 512]
    - [6, 1383.0]
  - - [256, 64, 8, 32, 256, 256, 256, 32]
    - [0, 1087.0]
  - - [256, 64, 8, 64, 256, 256, 256, 64]
    - [3, 1562.0]
  - - [256, 64, 8, 128, 256, 256, 256, 128]
    - [11, 2010.0]
  - - [256, 64, 8, 256, 256, 256, 256, 256]
    - [4, 2080.0]
  - - [256, 64, 8, 512, 256, 256, 256, 512]
    - [7, 2365.0]
  - - [256, 128, 8, 32, 256, 256, 256, 32]
    - [3, 1748.0]
  - - [256, 128, 8, 64, 256, 256, 256, 64]
    - [4, 2456.0]
  - - [256, 128, 8, 128, 256, 256, 256, 128]
    - [12, 2703.0]
  - - [256, 128, 8, 256, 256, 256, 256, 256]
    - [12, 2837.0]
  - - [256, 128, 8, 512, 256, 256, 256, 512]
    - [8, 2824.0]
  - - [256, 256, 8, 32, 256, 256, 256, 32]
    - [4, 2696.0]
  - - [256, 256, 8, 64, 256, 256, 256, 64]
    - [4, 3343.0]
  - - [256, 256, 8, 128, 256, 256, 256, 128]
    - [12, 3410.0]
  - - [256, 256, 8, 256, 256, 256, 256, 256]
    - [12, 3161.0]
  - - [256, 256, 8, 512, 256, 256, 256, 512]
    - [13, 3565.0]
  - - [256, 512, 8, 32, 256, 256, 256, 32]
    - [4, 3056.0]
  - - [256, 512, 8, 64, 256, 256, 256, 64]
    - [10, 3719.0]
  - - [256, 512, 8, 128, 256, 256, 256, 128]
    - [10, 3899.0]
  - - [256, 512, 8, 256, 256, 256, 256, 256]
    - [4, 4072.0]
  - - [256, 512, 8, 512, 256, 256, 256, 512]
    - [10, 3961.0]
  - - [512, 32, 8, 32, 512, 512, 512, 32]
    - [9, 1074.0]
  - - [512, 32, 8, 64, 512, 512, 512, 64]
    - [0, 1494.0]
  - - [512, 32, 8, 128, 512, 512, 512, 128]
    - [3, 1957.0]
  - - [512, 32, 8, 256, 512, 512, 512, 256]
    - [3, 1824.0]
  - - [512, 32, 8, 512, 512, 512, 512, 512]
    - [3, 2124.0]
  - - [512, 64, 8, 32, 512, 512, 512, 32]
    - [9, 1713.0]
  - - [512, 64, 8, 64, 512, 512, 512, 64]
    - [9, 2345.0]
  - - [512, 64, 8, 128, 512, 512, 512, 128]
    - [4, 2717.0]
  - - [512, 64, 8, 256, 512, 512, 512, 256]
    - [4, 2776.0]
  - - [512, 64, 8, 512, 512, 512, 512, 512]
    - [10, 2987.0]
  - - [512, 128, 8, 32, 512, 512, 512, 32]
    - [0, 2486.0]
  - - [512, 128, 8, 64, 512, 512, 512, 64]
    - [4, 3292.0]
  - - [512, 128, 8, 128, 512, 512, 512, 128]
    - [4, 3296.0]
  - - [512, 128, 8, 256, 512, 512, 512, 256]
    - [12, 3217.0]
  - - [512, 128, 8, 512, 512, 512, 512, 512]
    - [13, 3695.0]
  - - [512, 256, 8, 32, 512, 512, 512, 32]
    - [1, 3115.0]
  - - [512, 256, 8, 64, 512, 512, 512, 64]
    - [1, 3953.0]
  - - [512, 256, 8, 128, 512, 512, 512, 128]
    - [1, 3986.0]
  - - [512, 256, 8, 256, 512, 512, 512, 256]
    - [12, 4166.0]
  - - [512, 256, 8, 512, 512, 512, 512, 512]
    - [12, 4206.0]
  - - [512, 512, 8, 32, 512, 512, 512, 32]
    - [2, 2845.0]
  - - [512, 512, 8, 64, 512, 512, 512, 64]
    - [5, 3593.0]
  - - [512, 512, 8, 128, 512, 512, 512, 128]
    - [16, 4149.0]
  - - [512, 512, 8, 256, 512, 512, 512, 256]
    - [10, 4679.0]
  - - [512, 512, 8, 512, 512, 512, 512, 512]
    - [12, 4856.0]
- null
