library/src/blas3/Tensile/Logic/asm_full/vega20_Cijk_Ailk_Bljk_DB.yaml
- {MinimumRequiredVersion: 4.6.0}
- vega20
- gfx906
- [Device 66a0, Device 66a1, Device 66a7]
    SolutionIndex: 0
    SolutionNameMin: Cijk_Ailk_Bljk_DB_MT064x064x08_NLCA01_TT04_04_WG16_16_01
    SolutionIndex: 1
    SolutionNameMin: Cijk_Ailk_Bljk_DB_MT064x064x04_NLCA01_TT04_04_WG16_16_01
    SolutionIndex: 2
    SolutionNameMin: Cijk_Ailk_Bljk_DB_MT064x032x08_NLCA01_TT04_04_WG16_08_01
    SolutionIndex: 3
    SolutionNameMin: Cijk_Ailk_Bljk_DB_MT096x032x08_NLCA03_TT06_04_WG16_08_01
    SolutionIndex: 4
    SolutionNameMin: Cijk_Ailk_Bljk_DB_MT064x064x08_NLCA01_TT04_04_WG16_16_01
- - - [4296, 4296, 1, 384]
    - [3, 4343.25]
  - - [6600, 6600, 1, 384]
    - [3, 4434.11]
  - - [35784, 35784, 1, 384]
    - [3, 4467.14]
  - - [20424, 20424, 1, 384]
    - [3, 4518.36]
  - - [22728, 22728, 1, 384]
    - [3, 4463.57]
  - - [3912, 3912, 1, 384]
    - [3, 4304.99]
  - - [10056, 10056, 1, 384]
    - [3, 4444.62]
  - - [31176, 31176, 1, 384]
    - [3, 4472.24]
  - - [10824, 10824, 1, 384]
    - [3, 4515.39]
  - - [31560, 31560, 1, 384]
    - [3, 4485.88]
  - - [43848, 43848, 1, 384]
    - [3, 4537.61]
  - - [456, 456, 1, 384]
    - [4, 2425.5]
  - - [9672, 9672, 1, 384]
    - [3, 4469.82]
  - - [72, 72, 1, 384]
    - [2, 62.7571]
  - - [18504, 18504, 1, 384]
    - [3, 4506.81]
  - - [25800, 25800, 1, 384]
    - [3, 4491.93]
  - - [36552, 36552, 1, 384]
    - [3, 4525.06]
  - - [6216, 6216, 1, 384]
    - [3, 4430.68]
  - - [13896, 13896, 1, 384]
    - [3, 4497.25]
  - - [11592, 11592, 1, 384]
    - [3, 4457.52]
  - - [19272, 19272, 1, 384]
    - [3, 4477.88]
  - - [12360, 12360, 1, 384]
    - [3, 4472.9]
  - - [840, 840, 1, 384]
    - [3, 3409.04]
  - - [5064, 5064, 1, 384]
    - [3, 4388.15]
  - - [10440, 10440, 1, 384]
    - [3, 4436.67]
  - - [37704, 37704, 1, 384]
    - [3, 4535.45]
  - - [26568, 26568, 1, 384]
    - [3, 4503.24]
  - - [36936, 36936, 1, 384]
    - [3, 4481.76]
  - - [29256, 29256, 1, 384]
    - [3, 4478.94]
  - - [40008, 40008, 1, 384]
    - [3, 4499.59]
  - - [3528, 3528, 1, 384]
    - [3, 4314.32]
  - - [37320, 37320, 1, 384]
    - [3, 4453.17]
  - - [2376, 2376, 1, 384]
    - [3, 4132.66]
  - - [22344, 22344, 1, 384]
    - [3, 4511.77]
  - - [28488, 28488, 1, 384]
    - [3, 4497.36]
  - - [29640, 29640, 1, 384]
    - [3, 4490.15]
  - - [39240, 39240, 1, 384]
    - [3, 4499.51]
  - - [12744, 12744, 1, 384]
    - [3, 4513.3]
  - - [15432, 15432, 1, 384]
    - [3, 4481.4]
  - - [18120, 18120, 1, 384]
    - [3, 4432.73]
  - - [38088, 38088, 1, 384]
    - [3, 4517.91]
  - - [35016, 35016, 1, 384]
    - [3, 4498.63]
  - - [44232, 44232, 1, 384]
    - [3, 4485.68]
  - - [9288, 9288, 1, 384]
    - [3, 4459.67]
  - - [16968, 16968, 1, 384]
    - [3, 4495.35]
  - - [20040, 20040, 1, 384]
    - [3, 4491.8]
  - - [1992, 1992, 1, 384]
    - [4, 4096.95]
  - - [16584, 16584, 1, 384]
    - [3, 4486.96]
  - - [40776, 40776, 1, 384]
    - [3, 4511.36]
  - - [1608, 1608, 1, 384]
    - [4, 3846.05]
  - - [20808, 20808, 1, 384]
    - [3, 4468.27]
  - - [43464, 43464, 1, 384]
    - [3, 4509.88]
  - - [13512, 13512, 1, 384]
    - [3, 4491.94]
  - - [33864, 33864, 1, 384]
    - [3, 4506.18]
  - - [8136, 8136, 1, 384]
    - [3, 4472.36]
  - - [33096, 33096, 1, 384]
    - [3, 4516.26]
  - - [23496, 23496, 1, 384]
    - [3, 4489.36]
  - - [42696, 42696, 1, 384]
    - [3, 4499.01]
  - - [6984, 6984, 1, 384]
    - [3, 4424.45]
  - - [32712, 32712, 1, 384]
    - [3, 4421.49]
  - - [13128, 13128, 1, 384]
    - [3, 4497.86]
  - - [21960, 21960, 1, 384]
    - [3, 4491.27]
  - - [3144, 3144, 1, 384]
    - [3, 4287.62]
  - - [44616, 44616, 1, 384]
    - [3, 4522.29]
  - - [25032, 25032, 1, 384]
    - [3, 4495.54]
  - - [28872, 28872, 1, 384]
    - [3, 4492.55]
  - - [2760, 2760, 1, 384]
    - [3, 4173.08]
  - - [25416, 25416, 1, 384]
    - [3, 4476.47]
  - - [34632, 34632, 1, 384]
    - [3, 4494.79]
  - - [39624, 39624, 1, 384]
    - [3, 4503.61]
  - - [30792, 30792, 1, 384]
    - [4, 4402.95]
  - - [18888, 18888, 1, 384]
    - [3, 4477.61]
  - - [24264, 24264, 1, 384]
    - [3, 4484.05]
  - - [34248, 34248, 1, 384]
    - [3, 4503.99]
  - - [5832, 5832, 1, 384]
    - [3, 4413.72]
  - - [33480, 33480, 1, 384]
    - [3, 4509.07]
  - - [5448, 5448, 1, 384]
    - [3, 4417.4]
  - - [32328, 32328, 1, 384]
    - [3, 4485.87]
  - - [7752, 7752, 1, 384]
    - [3, 4473.47]
  - - [23880, 23880, 1, 384]
    - [3, 4468.41]
  - - [1224, 1224, 1, 384]
    - [3, 3734.75]
  - - [35400, 35400, 1, 384]
    - [3, 4525.41]
  - - [42312, 42312, 1, 384]
    - [3, 4512.43]
  - - [41544, 41544, 1, 384]
    - [3, 4460.12]
  - - [43080, 43080, 1, 384]
    - [3, 4507.25]
  - - [21576, 21576, 1, 384]
    - [3, 4488.93]
  - - [8904, 8904, 1, 384]
    - [3, 4469.15]
  - - [41928, 41928, 1, 384]
    - [3, 4533.12]
  - - [7368, 7368, 1, 384]
    - [3, 4446.99]
  - - [31944, 31944, 1, 384]
    - [3, 4501.69]
  - - [26952, 26952, 1, 384]
    - [3, 4523.92]
  - - [15816, 15816, 1, 384]
    - [3, 4482.19]
  - - [8520, 8520, 1, 384]
    - [3, 4454.75]
  - - [41160, 41160, 1, 384]
    - [3, 4526.6]
  - - [19656, 19656, 1, 384]
    - [3, 4491.79]
  - - [14664, 14664, 1, 384]
    - [3, 4451.96]
  - - [30408, 30408, 1, 384]
    - [3, 4498.88]
  - - [24648, 24648, 1, 384]
    - [3, 4473.31]
  - - [38856, 38856, 1, 384]
    - [3, 4489.35]
  - - [17352, 17352, 1, 384]
    - [3, 4517.78]
  - - [38472, 38472, 1, 384]
    - [3, 4509.82]
  - - [36168, 36168, 1, 384]
    - [3, 4502.53]
  - - [45000, 45000, 1, 384]
    - [3, 4504.74]
  - - [21192, 21192, 1, 384]
    - [3, 4487.68]
  - - [27336, 27336, 1, 384]
    - [3, 4492.02]
  - - [16200, 16200, 1, 384]
    - [3, 4472.46]
  - - [40392, 40392, 1, 384]
    - [3, 4505.48]
  - - [11976, 11976, 1, 384]
    - [3, 4498.41]
  - - [11208, 11208, 1, 384]
    - [3, 4471.31]
  - - [17736, 17736, 1, 384]
    - [3, 4492.07]
  - - [15048, 15048, 1, 384]
    - [3, 4427.45]
  - - [26184, 26184, 1, 384]
    - [3, 4490.87]
  - - [23112, 23112, 1, 384]
    - [3, 4494.79]
  - - [30024, 30024, 1, 384]
    - [3, 4452.53]
  - - [14280, 14280, 1, 384]
    - [3, 4485.81]
  - - [28104, 28104, 1, 384]
    - [3, 4482.17]
  - - [4680, 4680, 1, 384]
    - [3, 4361.95]
  - - [27720, 27720, 1, 384]
    - [3, 4477.85]
- - - -1
    - - - -1
        - - - 1
            - - [-1, 1]
          - - -1
            - - [1, 1]
              - [-1, 0]
