library/src/blas3/Tensile/Logic/asm_full/vega20_Cijk_Ailk_Bljk_DB.yaml
- {MinimumRequiredVersion: 4.2.0}
- vega20
- gfx906
- [Device 66a0, Device 66a7]
    SolutionIndex: 0
    SolutionNameMin: Cijk_Ailk_Bljk_DB_MT064x064x08_NLCA01_PBC0_TT04_04_USFGRO00_WG16_16_01
    SolutionIndex: 1
    SolutionNameMin: Cijk_Ailk_Bljk_DB_MT064x064x04_NLCA01_PBC0_TT04_04_USFGRO00_WG16_16_01
    SolutionIndex: 2
    SolutionNameMin: Cijk_Ailk_Bljk_DB_MT096x032x08_NLCA03_PBC0_TT06_04_USFGRO00_WG16_08_01
    SolutionIndex: 3
    SolutionNameMin: Cijk_Ailk_Bljk_DB_MT064x064x08_NLCA01_PBC0_TT04_04_USFGRO00_WG16_16_01
    SolutionIndex: 4
    SolutionNameMin: Cijk_Ailk_Bljk_DB_MT064x032x08_NLCA01_PBC0_TT04_04_USFGRO00_WG16_08_01
- - - [2084, 2084, 1, 384]
    - [3, 3690.93]
  - - [12324, 12324, 1, 384]
    - [3, 4048.99]
  - - [54308, 54308, 1, 384]
    - [2, 3764.91]
  - - [30756, 30756, 1, 384]
    - [2, 3769.79]
  - - [23588, 23588, 1, 384]
    - [2, 3757.01]
  - - [62500, 62500, 1, 384]
    - [2, 3780.87]
  - - [59428, 59428, 1, 384]
    - [2, 3760.21]
  - - [27684, 27684, 1, 384]
    - [2, 3763.09]
  - - [51236, 51236, 1, 384]
    - [2, 3764.43]
  - - [21540, 21540, 1, 384]
    - [2, 3755.16]
  - - [4132, 4132, 1, 384]
    - [3, 3959.76]
  - - [40996, 40996, 1, 384]
    - [2, 3785.57]
  - - [55332, 55332, 1, 384]
    - [2, 3775.83]
  - - [56356, 56356, 1, 384]
    - [2, 3766.62]
  - - [11300, 11300, 1, 384]
    - [3, 4042.05]
  - - [32804, 32804, 1, 384]
    - [2, 3776.51]
  - - [58404, 58404, 1, 384]
    - [2, 3762.76]
  - - [6180, 6180, 1, 384]
    - [3, 4022.31]
  - - [34852, 34852, 1, 384]
    - [2, 3768.81]
  - - [52260, 52260, 1, 384]
    - [2, 3772.52]
  - - [28708, 28708, 1, 384]
    - [2, 3772.7]
  - - [43044, 43044, 1, 384]
    - [2, 3760.04]
  - - [45092, 45092, 1, 384]
    - [2, 3782.43]
  - - [46116, 46116, 1, 384]
    - [2, 3785.58]
  - - [1060, 1060, 1, 384]
    - [3, 3253.82]
  - - [8228, 8228, 1, 384]
    - [3, 4035.86]
  - - [7204, 7204, 1, 384]
    - [3, 4027.31]
  - - [44068, 44068, 1, 384]
    - [2, 3759.93]
  - - [19492, 19492, 1, 384]
    - [2, 3734.21]
  - - [20516, 20516, 1, 384]
    - [2, 3762.55]
  - - [38948, 38948, 1, 384]
    - [2, 3776.43]
  - - [37924, 37924, 1, 384]
    - [2, 3778.18]
  - - [57380, 57380, 1, 384]
    - [2, 3762.38]
  - - [14372, 14372, 1, 384]
    - [3, 4050.79]
  - - [36900, 36900, 1, 384]
    - [2, 3754.12]
  - - [48164, 48164, 1, 384]
    - [2, 3757.1]
  - - [26660, 26660, 1, 384]
    - [2, 3769.21]
  - - [24612, 24612, 1, 384]
    - [2, 3757.99]
  - - [17444, 17444, 1, 384]
    - [2, 3762.42]
  - - [25636, 25636, 1, 384]
    - [2, 3758.01]
  - - [61476, 61476, 1, 384]
    - [2, 3769.6]
  - - [3108, 3108, 1, 384]
    - [3, 3925.81]
  - - [22564, 22564, 1, 384]
    - [2, 3751.97]
  - - [29732, 29732, 1, 384]
    - [2, 3771.78]
  - - [36, 36, 1, 384]
    - [4, 14.6542]
  - - [35876, 35876, 1, 384]
    - [2, 3780.04]
  - - [42020, 42020, 1, 384]
    - [2, 3745.74]
  - - [31780, 31780, 1, 384]
    - [2, 3775.19]
  - - [15396, 15396, 1, 384]
    - [3, 4054.99]
  - - [5156, 5156, 1, 384]
    - [3, 3981.13]
  - - [18468, 18468, 1, 384]
    - [2, 3732.72]
  - - [60452, 60452, 1, 384]
    - [2, 3776.48]
  - - [9252, 9252, 1, 384]
    - [3, 4035.14]
  - - [49188, 49188, 1, 384]
    - [2, 3768.61]
  - - [10276, 10276, 1, 384]
    - [3, 4040.7]
  - - [50212, 50212, 1, 384]
    - [2, 3776.69]
  - - [39972, 39972, 1, 384]
    - [2, 3767.52]
  - - [33828, 33828, 1, 384]
    - [2, 3758.41]
  - - [53284, 53284, 1, 384]
    - [2, 3771.0]
  - - [13348, 13348, 1, 384]
    - [3, 4050.79]
  - - [47140, 47140, 1, 384]
    - [2, 3777.08]
  - - [16420, 16420, 1, 384]
    - [2, 3737.12]
- - - -1
    - - - -1
        - - - 1
            - - [-1, 1]
          - - -1
            - - [1, 1]
              - [-1, 0]
