library/src/blas3/Tensile/Logic/asm_full/vega10_Cijk_Ailk_Bljk_SB.yaml
- {MinimumRequiredVersion: 3.6.0}
- vega10
- gfx900
- [Device 6863, Device 6862, Device 687f]
- - - [4096, 7000, 1, 4096]
    - [64, 11473.8]
  - - [5124, 9124, 1, 1760]
    - [61, 11440.2]
  - - [5124, 9124, 1, 2560]
    - [64, 11302.9]
  - - [1760, 32, 1, 1760]
    - [34, 2953.88]
  - - [1024, 1500, 1, 1536]
    - [69, 9202.39]
  - - [512, 24000, 1, 1536]
    - [64, 10990.2]
  - - [3072, 24000, 1, 1024]
    - [64, 11215.8]
  - - [1024, 3000, 1, 2560]
    - [65, 10479.2]
  - - [512, 3136, 1, 2048]
    - [71, 467292.0]
  - - [7680, 4, 1, 2560]
    - [23, 549.509]
  - - [35, 1500, 1, 2048]
    - [28, 2021.55]
  - - [8448, 1500, 1, 2816]
    - [61, 11362.7]
  - - [784, 512, 64, 128]
    - [82, 7259.37]
  - - [2560, 7000, 1, 2560]
    - [61, 11452.1]
  - - [3072, 16, 1, 1024]
    - [29, 1617.76]
  - - [512, 48000, 1, 2048]
    - [59, 10077.8]
  - - [1760, 64, 1, 1760]
    - [35, 4965.22]
  - - [1024, 16, 1, 512]
    - [32, 678.086]
  - - [196, 256, 64, 1024]
    - [80, 6135.6]
  - - [512, 48000, 1, 1536]
    - [64, 11328.5]
  - - [2560, 32, 1, 2560]
    - [37, 3473.69]
  - - [4608, 1500, 1, 1536]
    - [64, 10308.8]
  - - [2048, 128, 1, 2048]
    - [20, 5994.64]
  - - [1024, 24000, 1, 2560]
    - [63, 11418.5]
  - - [4608, 3000, 1, 1536]
    - [61, 10932.7]
  - - [5124, 9124, 1, 2048]
    - [64, 10077.3]
  - - [1024, 700, 1, 512]
    - [55, 5801.34]
  - - [3072, 1, 1, 128]
    - [30, 34.47]
  - - [5124, 700, 1, 2560]
    - [55, 9672.71]
  - - [8448, 16, 1, 2816]
    - [41, 2111.95]
  - - [6144, 6000, 1, 2560]
    - [64, 11613.3]
  - - [4608, 32, 1, 1536]
    - [44, 3397.29]
  - - [35, 8457, 1, 2560]
    - [9, 3623.54]
  - - [3072, 64, 1, 1024]
    - [31, 3692.68]
  - - [512, 16, 1, 512]
    - [24, 395.951]
  - - [7680, 2, 1, 2560]
    - [19, 274.186]
  - - [4224, 1, 1, 128]
    - [51, 42.6835]
  - - [7680, 1, 1, 2560]
    - [15, 137.948]
  - - [128, 1500, 1, 1280]
    - [50, 5359.74]
  - - [35, 8457, 1, 4096]
    - [10, 3373.9]
  - - [1024, 1500, 1, 2816]
    - [61, 10025.9]
  - - [6144, 2, 1, 2560]
    - [46, 263.928]
  - - [8448, 48000, 1, 2816]
    - [64, 12059.7]
  - - [512, 6000, 1, 1536]
    - [59, 9938.98]
  - - [4224, 1500, 1, 176]
    - [62, 7178.77]
  - - [1024, 6000, 1, 2816]
    - [64, 11144.9]
  - - [512, 6000, 1, 2560]
    - [58, 10422.6]
  - - [512, 32, 1, 512]
    - [24, 707.78]
  - - [2560, 128, 1, 2560]
    - [49, 6821.84]
  - - [4608, 24000, 1, 1536]
    - [64, 11704.0]
  - - [512, 2, 1, 500000]
    - [2, 307.861]
  - - [7680, 48000, 1, 2560]
    - [64, 12013.0]
  - - [3072, 48000, 1, 1024]
    - [64, 11374.0]
  - - [1760, 16, 1, 1760]
    - [22, 1660.22]
  - - [512, 3000, 1, 2816]
    - [63, 10251.2]
  - - [1760, 7000, 1, 1760]
    - [61, 11034.6]
  - - [64, 193600, 1, 256]
    - [71, 305862.0]
  - - [1024, 3000, 1, 2048]
    - [59, 9069.09]
  - - [6144, 4, 1, 2560]
    - [47, 527.199]
  - - [1024, 6000, 1, 2048]
    - [68, 9371.8]
  - - [512, 24000, 1, 2816]
    - [64, 11512.9]
  - - [6144, 48000, 1, 2560]
    - [64, 12035.1]
  - - [8448, 3000, 1, 2816]
    - [61, 11579.3]
  - - [35, 1500, 1, 2560]
    - [11, 2660.31]
  - - [3072, 4, 1, 1024]
    - [22, 417.358]
  - - [4608, 48000, 1, 1536]
    - [64, 11823.2]
  - - [2048, 32, 1, 2048]
    - [40, 3097.21]
  - - [7680, 1500, 1, 2560]
    - [61, 10781.5]
  - - [4096, 128, 1, 4096]
    - [59, 7833.04]
  - - [4608, 16, 1, 1536]
    - [37, 1892.06]
  - - [1024, 1500, 1, 2048]
    - [58, 8544.46]
  - - [3072, 3000, 1, 1024]
    - [69, 9440.38]
  - - [3072, 2, 1, 1024]
    - [38, 209.708]
  - - [8448, 1, 1, 2816]
    - [52, 137.361]
  - - [1024, 48000, 1, 2560]
    - [64, 11773.1]
  - - [1024, 3000, 1, 2816]
    - [65, 10718.8]
  - - [128, 1, 1, 1408]
    - [39, 16.2196]
  - - [35, 8457, 1, 1760]
    - [14, 3977.73]
  - - [1024, 2, 1, 512]
    - [32, 87.9235]
  - - [1024, 4, 1, 500000]
    - [4, 595.984]
  - - [6144, 1, 1, 2560]
    - [1, 133.206]
  - - [1024, 48000, 1, 2816]
    - [64, 11943.1]
  - - [512, 48000, 1, 2816]
    - [61, 11727.8]
  - - [2048, 16, 1, 2048]
    - [33, 1779.86]
  - - [1024, 24000, 1, 1536]
    - [64, 11060.3]
  - - [64, 193600, 1, 64]
    - [71, 84292.9]
  - - [7680, 6000, 1, 2560]
    - [64, 11731.9]
  - - [1760, 128, 1, 1760]
    - [36, 6187.8]
  - - [35, 8457, 1, 2048]
    - [9, 3209.18]
  - - [512, 1500, 1, 2816]
    - [55, 9233.2]
  - - [512, 1, 1, 512]
    - [15, 25.0976]
  - - [512, 16, 1, 500000]
    - [6, 2316.47]
  - - [512, 8, 1, 500000]
    - [2, 1198.4]
  - - [512, 24000, 1, 2560]
    - [65, 11110.3]
  - - [6144, 3000, 1, 2560]
    - [64, 11316.4]
  - - [1024, 24000, 1, 2816]
    - [64, 11639.6]
  - - [2048, 7000, 1, 2048]
    - [64, 10968.6]
  - - [7680, 3000, 1, 2560]
    - [61, 11447.1]
  - - [1024, 4, 1, 512]
    - [32, 173.684]
  - - [5124, 700, 1, 2048]
    - [64, 8861.1]
  - - [5124, 9124, 1, 4096]
    - [67, 9701.46]
  - - [4096, 64, 1, 4096]
    - [31, 7324.42]
  - - [256, 193600, 1, 64]
    - [72, 145646.0]
  - - [512, 6000, 1, 2048]
    - [66, 8047.37]
  - - [7680, 32, 1, 2560]
    - [49, 3994.92]
  - - [2560, 64, 1, 2560]
    - [49, 5622.77]
  - - [3072, 128, 1, 1024]
    - [55, 5211.56]
  - - [8448, 6000, 1, 2816]
    - [64, 11843.2]
  - - [7680, 64, 1, 2560]
    - [31, 6993.17]
  - - [5124, 1500, 1, 2560]
    - [64, 10426.3]
  - - [1024, 1500, 1, 2560]
    - [59, 9604.21]
  - - [3025, 64, 64, 64]
    - [78, 2963.72]
  - - [512, 4, 1, 512]
    - [24, 101.107]
  - - [1024, 6000, 1, 2560]
    - [64, 10974.2]
  - - [3072, 32, 1, 1024]
    - [25, 2790.35]
  - - [35, 700, 1, 2560]
    - [13, 2015.94]
  - - [196, 1024, 64, 256]
    - [81, 7509.91]
  - - [512, 50176, 1, 128]
    - [75, 226485.0]
  - - [4608, 1, 1, 1536]
    - [7, 125.722]
  - - [49, 512, 64, 2048]
    - [77, 3299.96]
  - - [4096, 32, 1, 4096]
    - [42, 3786.59]
  - - [7680, 24000, 1, 2560]
    - [64, 11986.0]
  - - [8448, 4, 1, 2816]
    - [52, 549.443]
  - - [64, 1, 1, 1216]
    - [45, 7.29577]
  - - [512, 1, 1, 500000]
    - [2, 157.279]
  - - [176, 1500, 1, 1408]
    - [35, 5532.46]
  - - [512, 3000, 1, 1536]
    - [58, 9040.44]
  - - [8448, 24000, 1, 2816]
    - [64, 12043.1]
  - - [4608, 2, 1, 1536]
    - [0, 252.106]
  - - [1024, 48000, 1, 1536]
    - [64, 11345.1]
  - - [7680, 128, 1, 2560]
    - [64, 8737.85]
  - - [3072, 6000, 1, 1024]
    - [64, 10403.2]
  - - [3072, 1500, 1, 128]
    - [60, 5276.58]
  - - [2048, 3136, 1, 512]
    - [71, 382676.0]
  - - [3025, 256, 64, 64]
    - [76, 4034.66]
  - - [1024, 3000, 1, 1536]
    - [65, 9756.3]
  - - [512, 4, 1, 500000]
    - [2, 599.019]
  - - [35, 700, 1, 2048]
    - [12, 1459.81]
  - - [1024, 16, 1, 500000]
    - [6, 2323.19]
  - - [512, 24000, 1, 2048]
    - [59, 9120.94]
  - - [128, 50176, 1, 512]
    - [73, 386000.0]
  - - [1024, 32, 1, 512]
    - [22, 1173.52]
  - - [256, 12544, 1, 1024]
    - [74, 435224.0]
  - - [1024, 12544, 1, 256]
    - [75, 314824.0]
  - - [512, 48000, 1, 2560]
    - [63, 11728.0]
  - - [2560, 16, 1, 2560]
    - [27, 1860.1]
  - - [2048, 64, 1, 2048]
    - [18, 5012.1]
  - - [512, 2, 1, 512]
    - [32, 50.5557]
  - - [1024, 1, 1, 512]
    - [24, 43.4211]
  - - [512, 1500, 1, 2560]
    - [57, 8702.05]
  - - [6144, 32, 1, 2560]
    - [21, 3760.13]
  - - [1024, 1, 1, 500000]
    - [8, 149.888]
  - - [6144, 16, 1, 2560]
    - [17, 2049.03]
  - - [1024, 24000, 1, 2048]
    - [53, 9895.66]
  - - [4096, 16, 1, 4096]
    - [26, 2116.69]
  - - [5124, 1500, 1, 2048]
    - [64, 9820.94]
  - - [3072, 1500, 1, 1024]
    - [69, 9008.47]
  - - [1024, 2, 1, 500000]
    - [5, 300.44]
  - - [1024, 8, 1, 500000]
    - [3, 1181.12]
  - - [7680, 16, 1, 2560]
    - [43, 2140.42]
  - - [6144, 1500, 1, 2560]
    - [64, 11052.3]
  - - [3072, 1, 1, 1024]
    - [23, 106.7]
  - - [512, 6000, 1, 2816]
    - [64, 10765.3]
  - - [8448, 2, 1, 2816]
    - [48, 274.839]
  - - [4608, 4, 1, 1536]
    - [0, 495.711]
  - - [1024, 6000, 1, 1536]
    - [65, 10459.6]
  - - [8448, 32, 1, 2816]
    - [44, 3926.93]
  - - [512, 3000, 1, 2048]
    - [66, 7827.82]
  - - [6144, 24000, 1, 2560]
    - [64, 11859.5]
  - - [512, 3000, 1, 2560]
    - [58, 9819.18]
  - - [4608, 6000, 1, 1536]
    - [61, 11271.9]
  - - [1024, 1024, 1, 1024]
    - [59, 6978.83]
  - - [512, 1500, 1, 2048]
    - [58, 6855.99]
  - - [512, 1500, 1, 1536]
    - [57, 8091.84]
  - - [128, 1, 1, 1024]
    - [45, 12.3735]
  - - [49, 2048, 64, 512]
    - [79, 4525.54]
  - - [1024, 48000, 1, 2048]
    - [60, 10240.8]
- - - -1
    - - - -1
        - - - 4
            - - [448, 70]
              - [1856, 32]
              - [3584, 29]
              - [5888, 70]
              - [-1, 29]
          - - 64
            - - [4, 70]
              - [128, 45]
              - [256, 15]
              - [448, 42]
              - [1408, 16]
              - [1856, 35]
              - [2368, 36]
              - [3584, 49]
              - [5056, 16]
              - [5888, 50]
              - [-1, 57]
          - - 128
            - - [4, 70]
              - [64, 45]
              - [128, 15]
              - [256, 42]
              - [704, 16]
              - [1024, 49]
              - [1408, 50]
              - [1856, 36]
              - [2368, 49]
              - [2944, 50]
              - [3584, 57]
              - [4288, 49]
              - [5056, 31]
              - [5888, 57]
              - [-1, 55]
          - - 256
            - - [4, 70]
              - [64, 32]
              - [128, 19]
              - [256, 16]
              - [448, 35]
              - [2944, 57]
              - [4288, 55]
              - [5056, 57]
              - [5888, 54]
              - [-1, 57]
          - - 448
            - - [4, 70]
              - [64, 42]
              - [128, 16]
              - [256, 50]
              - [448, 35]
              - [704, 57]
              - [1024, 55]
              - [1408, 57]
              - [1856, 58]
              - [2368, 55]
              - [2944, 63]
              - [3584, 55]
              - [4288, 54]
              - [5056, 55]
              - [5888, 57]
              - [-1, 56]
          - - 704
            - - [4, 70]
              - [64, 42]
              - [128, 16]
              - [256, 57]
              - [448, 55]
              - [1408, 57]
              - [2368, 55]
              - [2944, 56]
              - [5056, 54]
              - [5888, 56]
              - [-1, 63]
          - - 1024
            - - [4, 32]
              - [64, 16]
              - [128, 31]
              - [448, 55]
              - [704, 57]
              - [1024, 58]
              - [1408, 61]
              - [1856, 65]
              - [2368, 61]
              - [2944, 65]
              - [4288, 63]
              - [5888, 64]
              - [-1, 61]
          - - 1408
            - - [4, 70]
              - [64, 16]
              - [128, 49]
              - [448, 55]
              - [704, 57]
              - [1024, 63]
              - [1408, 64]
              - [1856, 63]
              - [2368, 57]
              - [5888, 64]
              - [-1, 54]
          - - 1856
            - - [4, 70]
              - [64, 35]
              - [128, 36]
              - [256, 57]
              - [448, 58]
              - [704, 55]
              - [1024, 64]
              - [1408, 56]
              - [2368, 63]
              - [2944, 61]
              - [3584, 54]
              - [5056, 61]
              - [5888, 54]
              - [-1, 61]
          - - 2368
            - - [4, 29]
              - [64, 36]
              - [128, 49]
              - [704, 55]
              - [1024, 63]
              - [5056, 61]
              - [-1, 54]
          - - 2944
            - - [4, 70]
              - [64, 49]
              - [128, 36]
              - [256, 55]
              - [448, 54]
              - [704, 61]
              - [1024, 54]
              - [1408, 64]
              - [-1, 54]
          - - 3584
            - - [4, 29]
              - [64, 31]
              - [128, 57]
              - [256, 58]
              - [448, 55]
              - [704, 63]
              - [-1, 61]
          - - 4288
            - - [4, 32]
              - [64, 16]
              - [128, 36]
              - [256, 55]
              - [5888, 61]
              - [-1, 54]
          - - 5056
            - - [4, 70]
              - [64, 16]
              - [128, 31]
              - [448, 55]
              - [5056, 61]
              - [-1, 56]
          - - 5888
            - - [4, 70]
              - [64, 57]
              - [128, 55]
              - [256, 54]
              - [448, 55]
              - [1024, 61]
              - [1408, 65]
              - [5888, 61]
              - [-1, 64]
          - - -1
            - - [4, 47]
              - [64, 57]
              - [128, 58]
              - [256, 55]
              - [448, 61]
              - [704, 56]
              - [1024, 65]
              - [1408, 61]
              - [1856, 56]
              - [2944, 61]
              - [3584, 56]
              - [5888, 61]
              - [-1, 64]
