library/src/blas3/Tensile/Logic/asm_full/vega10_Cijk_Ailk_Bjlk_HB.yaml
- {MinimumRequiredVersion: 4.6.0}
- vega10
- gfx900
- [Device 6863, Device 6862, Device 687f, Device 6860, Device 6861, 'Vega 10 XTX [Radeon
    SolutionIndex: 0
    SolutionNameMin: Cijk_Ailk_Bjlk_HB_MT032x016x08_GRVW02_TT04_02_USFGRO0_VW02_WG08_08_01
    SolutionIndex: 1
    SolutionNameMin: Cijk_Ailk_Bjlk_HB_MT032x032x08_GRVW04_TT04_04_USFGRO0_VW04_WG08_08_01
    SolutionIndex: 2
    SolutionNameMin: Cijk_Ailk_Bjlk_HB_MT032x016x08_GRVW02_TT02_02_USFGRO01_VW02_WG16_08_01
    SolutionIndex: 3
    SolutionNameMin: Cijk_Ailk_Bjlk_HB_MT064x016x08_GRVW02_TT04_02_USFGRO01_VW02_WG16_08_01
    SolutionIndex: 4
    SolutionNameMin: Cijk_Ailk_Bjlk_HB_MT128x032x08_GRVW04_TT04_04_USFGRO0_VW04_WG32_08_01
    SolutionIndex: 5
    SolutionNameMin: Cijk_Ailk_Bjlk_HB_MT032x008x08_GRVW02_TT02_02_USFGRO01_VW02_WG16_04_01
    SolutionIndex: 6
    SolutionNameMin: Cijk_Ailk_Bjlk_HB_MT032x032x08_GRVW04_TT04_04_USFGRO0_VW04_WG08_08_01
    SolutionIndex: 7
    SolutionNameMin: Cijk_Ailk_Bjlk_HB_MT064x032x08_GRVW04_TT08_04_USFGRO0_VW04_WG08_08_01
    SolutionIndex: 8
    SolutionNameMin: Cijk_Ailk_Bjlk_HB_MT064x064x08_GRVW08_TT08_08_USFGRO0_VW08_WG08_08_01
    SolutionIndex: 9
    SolutionNameMin: Cijk_Ailk_Bjlk_HB_MT016x016x16_GRVW02_TT02_02_USFGRO0_VW02_WG08_08_01
    SolutionIndex: 10
    SolutionNameMin: Cijk_Ailk_Bjlk_HB_MT032x016x16_GRVW02_TT04_02_USFGRO0_VW02_WG08_08_01
    SolutionIndex: 11
    SolutionNameMin: Cijk_Ailk_Bjlk_HB_MT032x032x16_GRVW04_TT04_04_USFGRO0_VW04_WG08_08_01
    SolutionIndex: 12
    SolutionNameMin: Cijk_Ailk_Bjlk_HB_MT032x016x16_GRVW02_TT02_02_USFGRO0_VW02_WG16_08_01
    SolutionIndex: 13
    SolutionNameMin: Cijk_Ailk_Bjlk_HB_MT064x016x16_GRVW02_TT04_02_USFGRO0_VW02_WG16_08_01
    SolutionIndex: 14
    SolutionNameMin: Cijk_Ailk_Bjlk_HB_MT064x032x16_GRVW04_TT04_04_USFGRO0_VW04_WG16_08_01
    SolutionIndex: 15
    SolutionNameMin: Cijk_Ailk_Bjlk_HB_MT064x016x16_GRVW02_TT02_02_USFGRO01_VW02_WG32_08_01
    SolutionIndex: 16
    SolutionNameMin: Cijk_Ailk_Bjlk_HB_MT032x008x16_GRVW02_TT02_02_USFGRO0_VW02_WG16_04_01
    SolutionIndex: 17
    SolutionNameMin: Cijk_Ailk_Bjlk_HB_MT032x032x16_GRVW04_TT04_04_USFGRO0_VW04_WG08_08_01
    SolutionIndex: 18
    SolutionNameMin: Cijk_Ailk_Bjlk_HB_MT064x016x16_GRVW02_TT04_02_USFGRO0_VW02_WG16_08_01
    SolutionIndex: 19
    SolutionNameMin: Cijk_Ailk_Bjlk_HB_MT064x032x16_GRVW04_TT04_04_USFGRO0_VW04_WG16_08_01
    SolutionIndex: 20
    SolutionNameMin: Cijk_Ailk_Bjlk_HB_MT016x016x32_GRVW02_TT02_02_USFGRO0_VW02_WG08_08_01
    SolutionIndex: 21
    SolutionNameMin: Cijk_Ailk_Bjlk_HB_MT032x016x32_GRVW02_TT04_02_USFGRO0_VW02_WG08_08_01
    SolutionIndex: 22
    SolutionNameMin: Cijk_Ailk_Bjlk_HB_MT032x016x32_GRVW02_TT02_02_USFGRO0_VW02_WG16_08_01
    SolutionIndex: 23
    SolutionNameMin: Cijk_Ailk_Bjlk_HB_MT064x016x32_GRVW02_TT04_02_USFGRO0_VW02_WG16_08_01
    SolutionIndex: 24
    SolutionNameMin: Cijk_Ailk_Bjlk_HB_MT064x016x32_GRVW02_TT02_02_USFGRO0_VW02_WG32_08_01
    SolutionIndex: 25
    SolutionNameMin: Cijk_Ailk_Bjlk_HB_MT032x008x32_GRVW02_TT02_02_USFGRO0_VW02_WG16_04_01
    SolutionIndex: 26
    SolutionNameMin: Cijk_Ailk_Bjlk_HB_MT032x016x32_GRVW02_TT02_02_USFGRO0_VW02_WG16_08_01
    SolutionIndex: 27
    SolutionNameMin: Cijk_Ailk_Bjlk_HB_MT064x016x32_GRVW02_TT04_02_USFGRO0_VW02_WG16_08_01
    SolutionIndex: 28
    SolutionNameMin: Cijk_Ailk_Bjlk_HB_MT064x016x32_GRVW02_TT02_02_USFGRO0_VW02_WG32_08_01
    SolutionIndex: 29
    SolutionNameMin: Cijk_Ailk_Bjlk_HB_MT016x016x64_GRVW02_TT02_02_USFGRO0_VW02_WG08_08_01
    SolutionIndex: 30
    SolutionNameMin: Cijk_Ailk_Bjlk_HB_MT032x016x64_GRVW02_TT02_02_USFGRO0_VW02_WG16_08_01
    SolutionIndex: 31
    SolutionNameMin: Cijk_Ailk_Bjlk_HB_MT032x016x64_GRVW02_TT02_02_USFGRO0_VW02_WG16_08_01
    SolutionIndex: 32
    SolutionNameMin: Cijk_Ailk_Bjlk_HB_MT064x016x64_GRVW02_TT02_02_USFGRO0_VW02_WG32_08_01
    SolutionIndex: 33
    SolutionNameMin: Cijk_Ailk_Bjlk_HB_MT032x064x08_GRVW04_TT04_08_USFGRO0_VW04_WG08_08_01
    SolutionIndex: 34
    SolutionNameMin: Cijk_Ailk_Bjlk_HB_MT064x048x08_GRVW02_TT08_06_USFGRO0_VW02_WG08_08_01
    SolutionIndex: 35
    SolutionNameMin: Cijk_Ailk_Bjlk_HB_MT064x128x08_GRVW04_TT04_08_USFGRO0_VW04_WG16_16_01
    SolutionIndex: 36
    SolutionNameMin: Cijk_Ailk_Bjlk_HB_MT064x064x16_GRVW04_TT04_04_USFGRO0_VW04_WG16_16_01
    SolutionIndex: 37
    SolutionNameMin: Cijk_Ailk_Bjlk_HB_MT064x128x16_GRVW04_TT04_08_USFGRO0_VW04_WG16_16_01
    SolutionIndex: 38
    SolutionNameMin: Cijk_Ailk_Bjlk_HB_MT096x128x16_GRVW02_TT06_08_USFGRO0_VW02_WG16_16_01
    SolutionIndex: 39
    SolutionNameMin: Cijk_Ailk_Bjlk_HB_MT128x064x16_GRVW04_TT08_04_USFGRO0_VW04_WG16_16_01
    SolutionIndex: 40
    SolutionNameMin: Cijk_Ailk_Bjlk_HB_MT128x096x16_GRVW02_TT08_06_USFGRO0_VW02_WG16_16_01
    SolutionIndex: 41
    SolutionNameMin: Cijk_Ailk_Bjlk_HB_MT128x128x16_GRVW08_TT08_08_USFGRO0_VW08_WG16_16_01
    SolutionIndex: 42
    SolutionNameMin: Cijk_Ailk_Bjlk_HB_MT064x064x32_GRVW04_TT04_04_USFGRO0_VW04_WG16_16_01
    SolutionIndex: 43
    SolutionNameMin: Cijk_Ailk_Bjlk_HB_MT032x032x16_GRVW02_TT02_02_USFGRO0_VW02_WG16_16_01
    SolutionIndex: 44
    SolutionNameMin: Cijk_Ailk_Bjlk_HB_MT064x064x16_GRVW04_TT04_04_USFGRO0_VW04_WG16_16_01
    SolutionIndex: 45
    SolutionNameMin: Cijk_Ailk_Bjlk_HB_MT032x032x32_GRVW02_TT02_02_USFGRO0_VW02_WG16_16_01
    SolutionIndex: 46
    SolutionNameMin: Cijk_Ailk_Bjlk_HB_MT064x064x32_GRVW04_TT04_04_USFGRO0_VW04_WG16_16_01
    SolutionIndex: 47
    SolutionNameMin: Cijk_Ailk_Bjlk_HB_MT032x032x64_GRVW02_TT02_02_USFGRO0_VW02_WG16_16_01
    SolutionIndex: 0
    SolutionNameMin: Cijk_Ailk_Bjlk_HB_MT256x064x08_GSU01_PGR1_PLR1_TT16_08_WG16_08_01_WGM01
    SolutionIndex: 1
    SolutionNameMin: Cijk_Ailk_Bjlk_HB_MT064x256x08_GSU01_PGR1_PLR1_TT08_08_WG08_32_01_WGM01
    SolutionIndex: 2
    SolutionNameMin: Cijk_Ailk_Bjlk_HB_MT256x064x08_GSU01_PGR1_PLR1_TT08_08_WG32_08_01_WGM08
    SolutionIndex: 3
    SolutionNameMin: Cijk_Ailk_Bjlk_HB_MT256x064x08_GSU01_PGR1_PLR1_TT08_08_WG32_08_01_WGM64
    SolutionIndex: 4
    SolutionNameMin: Cijk_Ailk_Bjlk_HB_MT128x128x16_GSU01_PGR1_PLR1_TT08_08_WG16_16_01_WGM01
    SolutionIndex: 5
    SolutionNameMin: Cijk_Ailk_Bjlk_HB_MT256x064x16_GSU01_PGR1_PLR1_TT08_08_WG32_08_01_WGM01
    SolutionIndex: 6
    SolutionNameMin: Cijk_Ailk_Bjlk_HB_MT256x064x16_GSU01_PGR1_PLR1_TT08_08_WG32_08_01_WGM64
- - - [1024, 1024, 1, 3328]
    - [39, 18598.1]
  - - [64, 6784, 1, 256]
    - [36, 7734.26]
  - - [2944, 4288, 1, 1280]
    - [39, 21885.6]
  - - [2368, 64, 1, 3328]
    - [26, 6714.71]
  - - [2368, 5888, 1, 256]
    - [35, 21339.6]
  - - [1024, 5056, 1, 3328]
    - [8, 21453.7]
  - - [5888, 1024, 1, 1280]
    - [35, 21570.1]
  - - [128, 6784, 1, 3328]
    - [19, 15462.6]
  - - [5888, 1856, 1, 3328]
    - [39, 20735.9]
  - - [5056, 704, 1, 256]
    - [36, 17423.5]
  - - [5888, 2944, 1, 3328]
    - [8, 19930.1]
  - - [1856, 4288, 1, 256]
    - [8, 19872.6]
  - - [5056, 5056, 1, 3328]
    - [41, 19808.3]
  - - [1408, 5888, 1, 1280]
    - [8, 22684.4]
  - - [448, 3584, 1, 3328]
    - [36, 17449.4]
  - - [256, 4288, 1, 3328]
    - [36, 15981.0]
  - - [5888, 1408, 1, 1280]
    - [8, 22670.0]
  - - [704, 1856, 1, 3328]
    - [36, 18972.9]
  - - [3584, 1856, 1, 3328]
    - [39, 21378.3]
  - - [5056, 6784, 1, 1280]
    - [8, 21459.3]
  - - [1408, 64, 1, 1280]
    - [20, 4349.38]
  - - [448, 1024, 1, 1280]
    - [36, 12010.7]
  - - [5056, 5056, 1, 1280]
    - [8, 21439.5]
  - - [448, 5056, 1, 256]
    - [36, 15878.2]
  - - [6784, 448, 1, 256]
    - [36, 16751.6]
  - - [2368, 128, 1, 256]
    - [3, 6054.75]
  - - [5888, 704, 1, 1280]
    - [8, 21451.3]
  - - [3584, 1024, 1, 256]
    - [35, 18381.5]
  - - [6784, 4288, 1, 3328]
    - [39, 19215.2]
  - - [1856, 2368, 1, 3328]
    - [37, 20448.7]
  - - [5888, 2944, 1, 1280]
    - [8, 21717.4]
  - - [5888, 1024, 1, 256]
    - [36, 19186.6]
  - - [448, 64, 1, 1280]
    - [29, 1668.11]
  - - [2944, 64, 1, 256]
    - [43, 4823.21]
  - - [1408, 2944, 1, 256]
    - [35, 18725.7]
  - - [256, 1856, 1, 1280]
    - [36, 12309.0]
  - - [6784, 5056, 1, 3328]
    - [8, 19211.3]
  - - [5056, 5056, 1, 256]
    - [8, 22058.3]
  - - [448, 704, 1, 1280]
    - [42, 8475.52]
  - - [64, 1024, 1, 1280]
    - [47, 3762.21]
  - - [1024, 3584, 1, 1280]
    - [39, 21395.4]
  - - [2368, 2944, 1, 1280]
    - [8, 21673.6]
  - - [128, 3584, 1, 1280]
    - [36, 11796.2]
  - - [1024, 256, 1, 3328]
    - [42, 10135.3]
  - - [1408, 4288, 1, 1280]
    - [8, 21635.2]
  - - [3584, 4288, 1, 1280]
    - [41, 21997.5]
  - - [2368, 704, 1, 1280]
    - [36, 17353.1]
  - - [5056, 4288, 1, 3328]
    - [35, 19535.4]
  - - [3584, 2368, 1, 3328]
    - [34, 20529.2]
  - - [64, 704, 1, 1280]
    - [47, 2569.41]
  - - [4288, 256, 1, 256]
    - [36, 12277.2]
  - - [6784, 448, 1, 1280]
    - [39, 20029.1]
  - - [64, 64, 1, 1280]
    - [20, 214.477]
  - - [4288, 2944, 1, 256]
    - [35, 20754.9]
  - - [1856, 64, 1, 1280]
    - [45, 5532.38]
  - - [5888, 64, 1, 3328]
    - [19, 10950.7]
  - - [2944, 256, 1, 3328]
    - [42, 16533.0]
  - - [5056, 2368, 1, 1280]
    - [36, 20924.5]
  - - [448, 3584, 1, 1280]
    - [36, 16774.1]
  - - [6784, 5888, 1, 256]
    - [41, 22275.7]
  - - [256, 4288, 1, 1280]
    - [36, 15006.5]
  - - [704, 128, 1, 1280]
    - [22, 4373.87]
  - - [1408, 448, 1, 1280]
    - [36, 12868.4]
  - - [1024, 1408, 1, 256]
    - [36, 13613.9]
  - - [2368, 2368, 1, 3328]
    - [35, 21304.2]
  - - [5056, 704, 1, 3328]
    - [39, 21318.9]
  - - [1408, 1856, 1, 256]
    - [36, 16975.8]
  - - [5888, 1856, 1, 256]
    - [39, 20480.7]
  - - [4288, 64, 1, 3328]
    - [19, 8037.36]
  - - [704, 5888, 1, 256]
    - [35, 18652.5]
  - - [6784, 128, 1, 1280]
    - [37, 14168.7]
  - - [4288, 6784, 1, 3328]
    - [37, 19019.2]
  - - [3584, 704, 1, 3328]
    - [39, 19758.8]
  - - [1408, 1408, 1, 256]
    - [7, 15224.8]
  - - [1856, 128, 1, 256]
    - [3, 5547.51]
  - - [2944, 64, 1, 1280]
    - [43, 6825.41]
  - - [448, 4288, 1, 256]
    - [36, 14852.1]
  - - [64, 3584, 1, 3328]
    - [46, 8960.98]
  - - [704, 2368, 1, 1280]
    - [42, 16855.5]
  - - [1856, 2368, 1, 1280]
    - [36, 20569.7]
  - - [2368, 128, 1, 3328]
    - [19, 8825.32]
  - - [2944, 128, 1, 256]
    - [4, 7275.46]
  - - [448, 1408, 1, 256]
    - [6, 9688.65]
  - - [64, 5056, 1, 3328]
    - [13, 9464.52]
  - - [1408, 1024, 1, 1280]
    - [36, 17110.9]
  - - [2368, 256, 1, 1280]
    - [36, 12485.0]
  - - [6784, 704, 1, 256]
    - [36, 18077.8]
  - - [256, 3584, 1, 3328]
    - [39, 16273.4]
  - - [1408, 3584, 1, 256]
    - [35, 18976.5]
  - - [3584, 4288, 1, 3328]
    - [39, 20361.6]
  - - [5888, 1856, 1, 1280]
    - [35, 21967.4]
  - - [5056, 1024, 1, 3328]
    - [35, 21157.0]
  - - [5056, 64, 1, 1280]
    - [36, 8602.11]
  - - [1024, 704, 1, 256]
    - [36, 10832.0]
  - - [128, 448, 1, 256]
    - [12, 1962.05]
  - - [2368, 3584, 1, 1280]
    - [35, 21852.1]
  - - [1024, 256, 1, 256]
    - [17, 5176.76]
  - - [448, 448, 1, 256]
    - [3, 4750.61]
  - - [2944, 3584, 1, 3328]
    - [39, 20703.8]
  - - [256, 256, 1, 3328]
    - [22, 3726.96]
  - - [128, 1024, 1, 3328]
    - [24, 6676.43]
  - - [6784, 2944, 1, 256]
    - [8, 21329.2]
  - - [64, 1856, 1, 1280]
    - [45, 5685.57]
  - - [1024, 2368, 1, 256]
    - [36, 15605.1]
  - - [4288, 2368, 1, 3328]
    - [8, 21031.0]
  - - [1856, 2368, 1, 256]
    - [36, 18190.0]
  - - [3584, 6784, 1, 3328]
    - [41, 19435.3]
  - - [6784, 1856, 1, 3328]
    - [37, 20393.5]
  - - [1024, 128, 1, 1280]
    - [24, 5898.12]
  - - [4288, 128, 1, 1280]
    - [36, 11358.2]
  - - [5056, 4288, 1, 1280]
    - [8, 21424.1]
  - - [5888, 64, 1, 256]
    - [1, 6964.01]
  - - [1408, 5056, 1, 1280]
    - [8, 22092.3]
  - - [1856, 256, 1, 1280]
    - [36, 12420.7]
  - - [64, 5888, 1, 3328]
    - [14, 10908.4]
  - - [6784, 5888, 1, 3328]
    - [41, 19068.1]
  - - [448, 256, 1, 3328]
    - [26, 5855.18]
  - - [2368, 5056, 1, 1280]
    - [35, 20648.8]
  - - [256, 1408, 1, 3328]
    - [42, 10407.3]
  - - [6784, 128, 1, 3328]
    - [37, 15462.6]
  - - [1024, 5056, 1, 1280]
    - [8, 21943.0]
  - - [4288, 1024, 1, 256]
    - [35, 17894.4]
  - - [2368, 1408, 1, 256]
    - [35, 16747.8]
  - - [704, 704, 1, 3328]
    - [36, 14264.1]
  - - [5888, 448, 1, 1280]
    - [36, 18468.5]
  - - [3584, 256, 1, 3328]
    - [39, 16292.6]
  - - [704, 5888, 1, 3328]
    - [37, 22015.3]
  - - [1024, 6784, 1, 1280]
    - [8, 21558.4]
  - - [128, 3584, 1, 3328]
    - [42, 13203.2]
  - - [6784, 2368, 1, 1280]
    - [8, 21684.7]
  - - [128, 704, 1, 1280]
    - [22, 4386.18]
  - - [3584, 2944, 1, 1280]
    - [35, 21426.8]
  - - [1856, 128, 1, 3328]
    - [42, 9248.82]
  - - [128, 2944, 1, 1280]
    - [14, 9850.91]
  - - [2368, 1024, 1, 3328]
    - [39, 19800.0]
  - - [448, 1856, 1, 1280]
    - [36, 13709.6]
  - - [1408, 5056, 1, 3328]
    - [8, 21436.0]
  - - [1856, 1856, 1, 3328]
    - [37, 20759.3]
  - - [3584, 128, 1, 256]
    - [1, 8477.93]
  - - [448, 1408, 1, 3328]
    - [36, 13980.7]
  - - [2368, 2368, 1, 256]
    - [37, 18669.2]
  - - [4288, 4288, 1, 1280]
    - [39, 21093.9]
  - - [64, 448, 1, 1280]
    - [29, 1685.16]
  - - [704, 6784, 1, 3328]
    - [39, 20015.5]
  - - [5888, 5888, 1, 3328]
    - [41, 18905.4]
  - - [5056, 1024, 1, 1280]
    - [8, 21959.2]
  - - [448, 5888, 1, 3328]
    - [36, 18985.7]
  - - [5056, 5888, 1, 1280]
    - [35, 21198.6]
  - - [448, 6784, 1, 256]
    - [36, 16698.4]
  - - [256, 3584, 1, 256]
    - [17, 11614.5]
  - - [256, 2944, 1, 3328]
    - [36, 16630.4]
  - - [256, 448, 1, 256]
    - [15, 3446.43]
  - - [3584, 5888, 1, 256]
    - [35, 21691.9]
  - - [2944, 3584, 1, 256]
    - [35, 20314.3]
  - - [1408, 704, 1, 256]
    - [36, 12547.9]
  - - [6784, 2944, 1, 3328]
    - [40, 19449.0]
  - - [2944, 5056, 1, 3328]
    - [35, 20285.3]
  - - [64, 64, 1, 3328]
    - [29, 261.392]
  - - [2048, 7133, 1, 2048]
    - [41, 21572.5]
  - - [4288, 5888, 1, 1280]
    - [35, 21568.6]
  - - [4288, 4288, 1, 256]
    - [8, 21540.1]
  - - [448, 2944, 1, 3328]
    - [37, 16621.1]
  - - [4288, 1856, 1, 1280]
    - [39, 21612.3]
  - - [1856, 2944, 1, 3328]
    - [39, 20653.0]
  - - [256, 6784, 1, 3328]
    - [36, 18846.4]
  - - [64, 5888, 1, 256]
    - [14, 6964.01]
  - - [5056, 1024, 1, 256]
    - [8, 18994.0]
  - - [256, 1024, 1, 256]
    - [36, 5297.93]
  - - [5056, 1856, 1, 3328]
    - [8, 20615.6]
  - - [1856, 1408, 1, 256]
    - [35, 17104.3]
  - - [448, 448, 1, 3328]
    - [42, 7800.11]
  - - [448, 2368, 1, 1280]
    - [36, 14479.6]
  - - [1408, 128, 1, 1280]
    - [13, 6515.01]
  - - [5056, 256, 1, 3328]
    - [36, 18855.4]
  - - [256, 64, 1, 1280]
    - [30, 979.611]
  - - [128, 1856, 1, 1280]
    - [11, 8080.76]
  - - [5056, 3584, 1, 256]
    - [8, 21264.2]
  - - [1856, 1024, 1, 1280]
    - [39, 18054.1]
  - - [1856, 1856, 1, 1280]
    - [39, 20122.8]
  - - [6784, 6784, 1, 1280]
    - [41, 20850.7]
  - - [128, 4288, 1, 3328]
    - [14, 12249.7]
  - - [1856, 1024, 1, 3328]
    - [37, 18924.0]
  - - [256, 2368, 1, 256]
    - [6, 9188.5]
  - - [1024, 448, 1, 3328]
    - [42, 13152.6]
  - - [1856, 704, 1, 1280]
    - [36, 18033.4]
  - - [6784, 1024, 1, 256]
    - [35, 19407.8]
  - - [5056, 5888, 1, 3328]
    - [41, 19825.9]
  - - [1856, 1024, 1, 256]
    - [7, 15029.9]
  - - [5056, 1408, 1, 3328]
    - [8, 21245.2]
  - - [1024, 1024, 1, 1280]
    - [36, 17125.5]
  - - [4288, 1024, 1, 3328]
    - [35, 19926.1]
  - - [2944, 1408, 1, 3328]
    - [41, 21644.3]
  - - [2944, 4288, 1, 3328]
    - [39, 19733.1]
  - - [256, 2944, 1, 256]
    - [6, 11130.9]
  - - [5056, 2944, 1, 256]
    - [35, 21195.1]
  - - [2368, 1856, 1, 256]
    - [35, 17848.0]
  - - [128, 448, 1, 1280]
    - [32, 3086.84]
  - - [128, 6784, 1, 1280]
    - [19, 14317.4]
  - - [1408, 3584, 1, 3328]
    - [35, 21013.2]
  - - [2368, 6784, 1, 256]
    - [35, 21518.3]
  - - [5056, 1408, 1, 1280]
    - [35, 21962.1]
  - - [1408, 5888, 1, 3328]
    - [8, 21369.9]
  - - [1856, 5056, 1, 256]
    - [8, 20909.0]
  - - [6784, 6784, 1, 256]
    - [41, 22815.9]
  - - [1408, 704, 1, 3328]
    - [39, 17622.7]
  - - [128, 5888, 1, 1280]
    - [42, 14815.6]
  - - [2368, 4288, 1, 1280]
    - [35, 22311.2]
  - - [3584, 1856, 1, 1280]
    - [39, 20959.4]
  - - [704, 1408, 1, 3328]
    - [37, 17601.9]
  - - [704, 64, 1, 1280]
    - [47, 2639.07]
  - - [5888, 5056, 1, 256]
    - [8, 22220.5]
  - - [3584, 448, 1, 256]
    - [36, 14012.5]
  - - [3072, 7435, 1, 1024]
    - [39, 21465.4]
  - - [256, 6784, 1, 256]
    - [36, 14967.3]
  - - [1856, 3584, 1, 3328]
    - [37, 20295.2]
  - - [5056, 256, 1, 1280]
    - [36, 17878.0]
  - - [512, 32, 1, 512]
    - [30, 838.819]
  - - [3584, 3584, 1, 256]
    - [35, 21018.5]
  - - [6784, 4288, 1, 1280]
    - [8, 21458.1]
  - - [704, 5056, 1, 256]
    - [35, 17853.4]
  - - [6784, 128, 1, 256]
    - [4, 11281.9]
  - - [64, 1408, 1, 3328]
    - [30, 4813.84]
  - - [704, 448, 1, 256]
    - [36, 5766.96]
  - - [2944, 2368, 1, 1280]
    - [8, 21650.2]
  - - [448, 64, 1, 3328]
    - [29, 1747.8]
  - - [6784, 3584, 1, 256]
    - [8, 21819.3]
  - - [256, 1856, 1, 3328]
    - [36, 13701.1]
  - - [704, 6784, 1, 256]
    - [35, 18058.1]
  - - [1024, 3584, 1, 3328]
    - [39, 22158.5]
  - - [64, 128, 1, 3328]
    - [29, 520.564]
  - - [2944, 2944, 1, 3328]
    - [35, 21098.0]
  - - [5056, 6784, 1, 256]
    - [8, 22578.4]
  - - [1408, 4288, 1, 3328]
    - [37, 20952.0]
  - - [6784, 256, 1, 1280]
    - [36, 18187.5]
  - - [2368, 704, 1, 3328]
    - [36, 18077.7]
  - - [128, 4288, 1, 256]
    - [1, 8661.38]
  - - [3584, 6784, 1, 256]
    - [35, 21893.2]
  - - [128, 128, 1, 3328]
    - [31, 1013.89]
  - - [5056, 1856, 1, 256]
    - [8, 20775.0]
  - - [256, 128, 1, 256]
    - [16, 1217.68]
  - - [704, 4288, 1, 256]
    - [35, 17046.6]
  - - [256, 448, 1, 3328]
    - [28, 5875.23]
  - - [1408, 6784, 1, 1280]
    - [35, 22095.2]
  - - [3584, 3584, 1, 1280]
    - [35, 22047.9]
  - - [64, 2368, 1, 1280]
    - [22, 5871.62]
  - - [64, 6784, 1, 3328]
    - [44, 12511.9]
  - - [2944, 256, 1, 1280]
    - [36, 15249.4]
  - - [5056, 2368, 1, 3328]
    - [8, 20326.1]
  - - [2944, 4288, 1, 256]
    - [35, 20695.8]
  - - [1408, 3584, 1, 1280]
    - [37, 21314.3]
  - - [2368, 64, 1, 256]
    - [43, 4123.86]
  - - [64, 448, 1, 3328]
    - [29, 1752.57]
  - - [1024, 1408, 1, 1280]
    - [37, 17028.9]
  - - [1856, 704, 1, 256]
    - [36, 14244.5]
  - - [1408, 448, 1, 3328]
    - [36, 13953.2]
  - - [2368, 256, 1, 256]
    - [36, 9311.17]
  - - [2368, 6784, 1, 3328]
    - [38, 19914.0]
  - - [5056, 704, 1, 1280]
    - [39, 20750.6]
  - - [1856, 4288, 1, 3328]
    - [37, 20504.1]
  - - [1408, 5888, 1, 256]
    - [8, 20523.2]
  - - [4288, 64, 1, 1280]
    - [18, 7386.36]
  - - [4096, 7133, 1, 4096]
    - [41, 19383.8]
  - - [256, 64, 1, 256]
    - [45, 707.72]
  - - [704, 1856, 1, 256]
    - [36, 14244.8]
  - - [5888, 64, 1, 1280]
    - [36, 9941.05]
  - - [3584, 704, 1, 1280]
    - [39, 19799.4]
  - - [256, 128, 1, 1280]
    - [30, 1906.46]
  - - [256, 2368, 1, 1280]
    - [36, 12338.0]
  - - [3584, 448, 1, 3328]
    - [42, 16342.5]
  - - [704, 2368, 1, 3328]
    - [36, 18103.9]
  - - [2944, 448, 1, 256]
    - [36, 12948.9]
  - - [448, 5056, 1, 3328]
    - [36, 19566.0]
  - - [2368, 128, 1, 1280]
    - [14, 8107.6]
  - - [4288, 448, 1, 256]
    - [36, 14986.0]
  - - [448, 5888, 1, 256]
    - [36, 15717.4]
  - - [64, 5056, 1, 1280]
    - [13, 8655.32]
  - - [5888, 2368, 1, 256]
    - [8, 20823.2]
  - - [704, 448, 1, 3328]
    - [42, 9135.75]
  - - [6784, 704, 1, 3328]
    - [41, 19915.2]
  - - [128, 64, 1, 1280]
    - [29, 491.505]
  - - [1408, 2944, 1, 3328]
    - [37, 21116.6]
  - - [64, 1024, 1, 256]
    - [9, 2198.99]
  - - [5056, 64, 1, 3328]
    - [18, 9464.52]
  - - [2368, 448, 1, 1280]
    - [36, 14676.7]
  - - [128, 3584, 1, 256]
    - [4, 8344.21]
  - - [1856, 448, 1, 3328]
    - [39, 14771.0]
  - - [128, 5056, 1, 256]
    - [1, 10029.4]
  - - [2368, 704, 1, 256]
    - [36, 14622.2]
  - - [3584, 2368, 1, 256]
    - [35, 19750.7]
  - - [5888, 5056, 1, 1280]
    - [39, 20999.5]
  - - [128, 1024, 1, 1280]
    - [26, 5882.72]
  - - [64, 704, 1, 256]
    - [9, 1789.8]
  - - [4288, 256, 1, 1280]
    - [36, 15126.2]
  - - [3584, 3584, 1, 3328]
    - [39, 20864.3]
  - - [704, 704, 1, 256]
    - [36, 8874.43]
  - - [5888, 6784, 1, 256]
    - [8, 22355.1]
  - - [4288, 2944, 1, 3328]
    - [35, 19825.5]
  - - [1856, 64, 1, 256]
    - [15, 3632.62]
  - - [4288, 128, 1, 3328]
    - [14, 12219.3]
  - - [4288, 704, 1, 1280]
    - [39, 19565.8]
  - - [256, 5056, 1, 1280]
    - [36, 17806.9]
  - - [6784, 5888, 1, 1280]
    - [35, 20698.6]
  - - [704, 128, 1, 256]
    - [2, 2805.55]
  - - [5888, 4288, 1, 1280]
    - [39, 21343.8]
  - - [448, 256, 1, 1280]
    - [24, 5504.85]
  - - [704, 64, 1, 3328]
    - [47, 2635.7]
  - - [256, 1408, 1, 1280]
    - [36, 9422.61]
  - - [512, 16, 1, 512]
    - [16, 341.097]
  - - [1408, 1856, 1, 1280]
    - [36, 19892.3]
  - - [5888, 448, 1, 3328]
    - [36, 18964.4]
  - - [704, 5888, 1, 1280]
    - [8, 21541.6]
  - - [1024, 6784, 1, 3328]
    - [40, 20703.0]
  - - [704, 2944, 1, 1280]
    - [7, 19337.5]
  - - [6784, 64, 1, 3328]
    - [36, 12536.1]
  - - [5056, 2944, 1, 3328]
    - [35, 20127.8]
  - - [448, 128, 1, 256]
    - [12, 1905.51]
  - - [1408, 1408, 1, 3328]
    - [37, 19827.6]
  - - [1856, 128, 1, 1280]
    - [11, 8144.93]
  - - [448, 4288, 1, 1280]
    - [37, 18228.6]
  - - [64, 3584, 1, 256]
    - [12, 5320.07]
  - - [128, 2944, 1, 3328]
    - [19, 10915.4]
  - - [3584, 704, 1, 256]
    - [36, 16237.8]
  - - [2944, 448, 1, 3328]
    - [37, 16533.0]
  - - [3584, 1408, 1, 3328]
    - [8, 20751.7]
  - - [2368, 1024, 1, 1280]
    - [37, 19045.4]
  - - [1856, 6784, 1, 256]
    - [35, 20800.0]
  - - [4288, 448, 1, 3328]
    - [39, 19174.6]
  - - [4288, 3584, 1, 1280]
    - [35, 21432.9]
  - - [1760, 7133, 1, 1760]
    - [35, 21407.9]
  - - [5888, 1024, 1, 3328]
    - [35, 20962.4]
  - - [704, 6784, 1, 1280]
    - [8, 20296.5]
  - - [1024, 2944, 1, 3328]
    - [39, 20946.2]
  - - [2368, 448, 1, 3328]
    - [36, 15434.3]
  - - [704, 5056, 1, 1280]
    - [35, 20185.4]
  - - [1024, 5888, 1, 1280]
    - [8, 21601.3]
  - - [2944, 1856, 1, 256]
    - [36, 18940.1]
  - - [5056, 64, 1, 256]
    - [43, 6354.03]
  - - [3584, 5056, 1, 256]
    - [8, 20923.2]
  - - [5888, 5056, 1, 3328]
    - [41, 19806.8]
  - - [128, 5056, 1, 3328]
    - [19, 14422.1]
  - - [3584, 6784, 1, 1280]
    - [39, 21442.9]
  - - [1856, 5888, 1, 256]
    - [35, 20993.0]
  - - [256, 256, 1, 256]
    - [12, 2311.07]
  - - [4288, 4288, 1, 3328]
    - [8, 19964.8]
  - - [4288, 1408, 1, 1280]
    - [8, 21657.7]
  - - [64, 1856, 1, 256]
    - [43, 3508.56]
  - - [4288, 2368, 1, 256]
    - [8, 20641.9]
  - - [2944, 5056, 1, 1280]
    - [39, 21736.0]
  - - [6784, 64, 1, 256]
    - [44, 7815.02]
  - - [6784, 2368, 1, 3328]
    - [39, 20468.6]
  - - [256, 1024, 1, 1280]
    - [42, 8778.6]
  - - [4288, 1856, 1, 3328]
    - [37, 20521.7]
  - - [1856, 2944, 1, 1280]
    - [35, 21141.1]
  - - [3584, 64, 1, 1280]
    - [17, 7817.59]
  - - [2944, 5888, 1, 1280]
    - [8, 22009.5]
  - - [3584, 1024, 1, 1280]
    - [39, 21518.8]
  - - [1024, 4288, 1, 256]
    - [36, 18000.7]
  - - [5888, 3584, 1, 3328]
    - [39, 19492.3]
  - - [5056, 3584, 1, 3328]
    - [37, 19882.3]
  - - [1408, 128, 1, 3328]
    - [27, 7380.88]
  - - [2368, 1408, 1, 1280]
    - [36, 20053.0]
  - - [5056, 2944, 1, 1280]
    - [37, 21543.1]
  - - [128, 2368, 1, 256]
    - [0, 6019.99]
  - - [3584, 256, 1, 256]
    - [17, 11488.4]
  - - [1024, 6784, 1, 256]
    - [36, 18993.2]
  - - [3584, 2944, 1, 256]
    - [35, 20405.2]
  - - [448, 128, 1, 3328]
    - [22, 3248.77]
  - - [3584, 1408, 1, 1280]
    - [8, 21461.2]
  - - [64, 4288, 1, 3328]
    - [13, 8079.49]
  - - [5056, 6784, 1, 3328]
    - [8, 19065.6]
  - - [128, 2944, 1, 256]
    - [4, 7039.48]
  - - [3584, 4288, 1, 256]
    - [8, 21450.3]
  - - [1856, 6784, 1, 3328]
    - [39, 20424.5]
  - - [3584, 128, 1, 3328]
    - [36, 13228.6]
  - - [128, 256, 1, 1280]
    - [30, 1906.46]
  - - [1024, 448, 1, 1280]
    - [36, 11920.2]
  - - [5056, 1408, 1, 256]
    - [8, 19824.4]
  - - [64, 256, 1, 1280]
    - [30, 969.535]
  - - [256, 704, 1, 256]
    - [36, 3707.3]
  - - [5888, 5888, 1, 256]
    - [8, 22249.0]
  - - [4288, 1024, 1, 1280]
    - [35, 20456.3]
  - - [5888, 128, 1, 3328]
    - [42, 16428.7]
  - - [448, 6784, 1, 3328]
    - [37, 21107.2]
  - - [2944, 1408, 1, 1280]
    - [8, 21502.9]
  - - [1024, 32, 1, 512]
    - [26, 1641.2]
  - - [2944, 1856, 1, 3328]
    - [39, 20557.9]
  - - [128, 1024, 1, 256]
    - [12, 3838.74]
  - - [3584, 5888, 1, 1280]
    - [35, 21720.4]
  - - [6784, 1856, 1, 1280]
    - [39, 21447.9]
  - - [5888, 256, 1, 3328]
    - [37, 18995.6]
  - - [1856, 5888, 1, 3328]
    - [35, 20982.3]
  - - [3584, 1408, 1, 256]
    - [35, 18772.2]
  - - [64, 448, 1, 256]
    - [45, 1193.89]
  - - [704, 3584, 1, 3328]
    - [35, 20234.9]
  - - [5056, 448, 1, 1280]
    - [36, 18981.3]
  - - [4288, 704, 1, 256]
    - [36, 16718.8]
  - - [1408, 704, 1, 1280]
    - [42, 15903.4]
  - - [2944, 1024, 1, 256]
    - [35, 17392.8]
  - - [448, 1408, 1, 1280]
    - [36, 12899.0]
  - - [2368, 4288, 1, 3328]
    - [39, 20461.3]
  - - [64, 64, 1, 256]
    - [43, 120.985]
  - - [704, 1408, 1, 1280]
    - [36, 16281.4]
  - - [6784, 5056, 1, 256]
    - [41, 21642.6]
  - - [3584, 5056, 1, 3328]
    - [35, 19526.6]
  - - [4288, 5888, 1, 256]
    - [35, 21890.0]
  - - [448, 2944, 1, 256]
    - [36, 13097.8]
  - - [2944, 6784, 1, 256]
    - [35, 21468.6]
  - - [2368, 2368, 1, 1280]
    - [39, 21686.0]
  - - [1856, 3584, 1, 1280]
    - [35, 22061.7]
  - - [64, 2944, 1, 256]
    - [15, 4618.17]
  - - [5056, 3584, 1, 1280]
    - [39, 21896.2]
  - - [256, 5888, 1, 256]
    - [36, 14390.0]
  - - [128, 256, 1, 3328]
    - [30, 1976.04]
  - - [1856, 1408, 1, 3328]
    - [37, 21330.7]
  - - [1024, 4288, 1, 3328]
    - [35, 19972.5]
  - - [448, 2368, 1, 256]
    - [6, 11864.9]
  - - [64, 1408, 1, 1280]
    - [45, 4398.56]
  - - [2944, 2368, 1, 3328]
    - [40, 20739.0]
  - - [704, 128, 1, 3328]
    - [30, 4819.57]
  - - [1408, 128, 1, 256]
    - [15, 4754.47]
  - - [1024, 1856, 1, 1280]
    - [39, 18143.9]
  - - [6784, 1856, 1, 256]
    - [35, 20661.7]
  - - [1024, 5888, 1, 256]
    - [36, 19222.0]
  - - [64, 2944, 1, 1280]
    - [43, 6825.41]
  - - [64, 5056, 1, 256]
    - [43, 6282.23]
  - - [1408, 2368, 1, 256]
    - [36, 17327.1]
  - - [2944, 704, 1, 3328]
    - [39, 20650.6]
  - - [64, 128, 1, 1280]
    - [29, 489.806]
  - - [2944, 2944, 1, 1280]
    - [39, 22216.8]
  - - [6784, 256, 1, 3328]
    - [36, 18869.2]
  - - [1408, 5056, 1, 256]
    - [8, 19888.4]
  - - [5056, 128, 1, 3328]
    - [19, 14358.1]
  - - [128, 128, 1, 1280]
    - [31, 969.557]
  - - [448, 704, 1, 256]
    - [36, 5860.09]
  - - [1856, 256, 1, 3328]
    - [36, 13701.1]
  - - [2944, 128, 1, 3328]
    - [14, 10936.6]
  - - [704, 256, 1, 1280]
    - [36, 6668.5]
  - - [256, 448, 1, 1280]
    - [24, 5459.4]
  - - [5056, 256, 1, 256]
    - [36, 13934.9]
  - - [64, 2368, 1, 3328]
    - [22, 6788.36]
  - - [256, 704, 1, 3328]
    - [42, 7083.84]
  - - [64, 6784, 1, 1280]
    - [36, 11214.3]
  - - [1408, 4288, 1, 256]
    - [41, 18513.7]
  - - [5888, 2368, 1, 1280]
    - [40, 21751.9]
  - - [128, 256, 1, 256]
    - [16, 1258.23]
  - - [64, 128, 1, 256]
    - [25, 353.89]
  - - [2368, 5888, 1, 1280]
    - [35, 22272.7]
  - - [5888, 256, 1, 1280]
    - [39, 17938.0]
  - - [704, 1024, 1, 1280]
    - [36, 14637.7]
  - - [2368, 1856, 1, 3328]
    - [36, 20404.3]
  - - [2944, 704, 1, 256]
    - [7, 15988.1]
  - - [2368, 6784, 1, 1280]
    - [38, 21189.8]
  - - [1856, 4288, 1, 1280]
    - [8, 21807.7]
  - - [704, 3584, 1, 256]
    - [35, 16421.3]
  - - [704, 2944, 1, 3328]
    - [37, 20682.8]
  - - [1856, 5056, 1, 3328]
    - [8, 20575.3]
  - - [3584, 5056, 1, 1280]
    - [39, 21500.8]
  - - [2944, 1024, 1, 3328]
    - [37, 20962.4]
  - - [256, 4288, 1, 256]
    - [36, 12198.0]
  - - [1408, 6784, 1, 256]
    - [35, 20364.1]
  - - [6784, 1408, 1, 3328]
    - [37, 20294.8]
  - - [1024, 2368, 1, 1280]
    - [39, 18993.6]
  - - [704, 64, 1, 256]
    - [22, 1831.86]
  - - [256, 2368, 1, 3328]
    - [17, 13240.1]
  - - [6784, 2944, 1, 1280]
    - [35, 21571.9]
  - - [3584, 448, 1, 1280]
    - [42, 16329.8]
  - - [2944, 6784, 1, 3328]
    - [41, 19541.7]
  - - [448, 5056, 1, 1280]
    - [36, 18917.1]
  - - [64, 2944, 1, 3328]
    - [27, 7653.61]
  - - [128, 1408, 1, 256]
    - [15, 4683.04]
  - - [1408, 256, 1, 1280]
    - [36, 9436.87]
  - - [5888, 704, 1, 256]
    - [8, 18389.2]
  - - [256, 5888, 1, 3328]
    - [39, 18963.6]
  - - [6784, 4288, 1, 256]
    - [8, 22470.1]
  - - [5888, 256, 1, 256]
    - [36, 14390.0]
  - - [128, 1408, 1, 3328]
    - [21, 7340.78]
  - - [6784, 1024, 1, 1280]
    - [8, 21581.7]
  - - [704, 448, 1, 1280]
    - [36, 8475.61]
  - - [128, 64, 1, 3328]
    - [29, 522.039]
  - - [448, 64, 1, 256]
    - [47, 1208.34]
  - - [2944, 704, 1, 1280]
    - [39, 19830.0]
  - - [6784, 3584, 1, 1280]
    - [39, 21381.8]
  - - [1024, 704, 1, 1280]
    - [36, 14654.9]
  - - [1408, 2944, 1, 1280]
    - [8, 21535.2]
  - - [256, 1856, 1, 256]
    - [6, 8420.84]
  - - [1408, 2368, 1, 3328]
    - [36, 20502.6]
  - - [1024, 3584, 1, 256]
    - [35, 18041.4]
  - - [2368, 2944, 1, 256]
    - [35, 19476.5]
  - - [704, 1856, 1, 1280]
    - [36, 18076.7]
  - - [1408, 256, 1, 3328]
    - [36, 10467.8]
  - - [1024, 16, 1, 512]
    - [9, 678.114]
  - - [5888, 128, 1, 256]
    - [1, 11423.5]
  - - [2944, 5888, 1, 256]
    - [35, 21341.4]
  - - [3584, 1856, 1, 256]
    - [36, 18998.7]
  - - [2368, 448, 1, 256]
    - [36, 11864.9]
  - - [4288, 256, 1, 3328]
    - [36, 15996.5]
  - - [1408, 64, 1, 256]
    - [15, 2831.03]
  - - [704, 4288, 1, 3328]
    - [35, 20440.4]
  - - [4288, 2944, 1, 1280]
    - [37, 21925.2]
  - - [1024, 64, 1, 256]
    - [24, 2544.89]
  - - [64, 2368, 1, 256]
    - [12, 4091.68]
  - - [4288, 5056, 1, 3328]
    - [8, 19774.1]
  - - [2944, 256, 1, 256]
    - [6, 11324.3]
  - - [1024, 128, 1, 3328]
    - [28, 6638.83]
  - - [256, 5056, 1, 3328]
    - [36, 18818.8]
  - - [5056, 2368, 1, 256]
    - [35, 20382.3]
  - - [4288, 704, 1, 3328]
    - [39, 20712.0]
  - - [448, 3584, 1, 256]
    - [36, 13872.3]
  - - [2368, 64, 1, 1280]
    - [22, 5938.21]
  - - [1408, 448, 1, 256]
    - [6, 9863.83]
  - - [1024, 1408, 1, 3328]
    - [39, 18174.8]
  - - [2560, 7133, 1, 2560]
    - [39, 20834.7]
  - - [5888, 3584, 1, 256]
    - [35, 21506.4]
  - - [1408, 1856, 1, 3328]
    - [36, 20407.5]
  - - [6784, 1408, 1, 1280]
    - [35, 22113.0]
  - - [704, 2944, 1, 256]
    - [35, 16168.3]
  - - [4288, 64, 1, 256]
    - [13, 5419.62]
  - - [2944, 5888, 1, 3328]
    - [41, 19724.7]
  - - [64, 4288, 1, 1280]
    - [13, 7386.36]
  - - [6784, 64, 1, 1280]
    - [36, 11264.8]
  - - [1408, 6784, 1, 3328]
    - [39, 20659.2]
  - - [1408, 64, 1, 3328]
    - [22, 4848.4]
  - - [1408, 1408, 1, 1280]
    - [39, 18905.1]
  - - [448, 1024, 1, 3328]
    - [42, 13161.0]
  - - [448, 4288, 1, 3328]
    - [37, 19178.9]
  - - [704, 2368, 1, 256]
    - [36, 14367.2]
  - - [2944, 448, 1, 1280]
    - [36, 15717.3]
  - - [5888, 2368, 1, 3328]
    - [41, 19960.5]
  - - [4288, 5056, 1, 256]
    - [8, 22088.5]
  - - [4288, 448, 1, 1280]
    - [39, 18278.7]
  - - [5888, 704, 1, 3328]
    - [39, 20430.9]
  - - [4288, 3584, 1, 3328]
    - [35, 20404.9]
  - - [5056, 128, 1, 256]
    - [1, 10166.3]
  - - [128, 64, 1, 256]
    - [5, 264.575]
  - - [448, 1024, 1, 256]
    - [36, 8344.21]
  - - [6784, 6784, 1, 3328]
    - [41, 19416.1]
  - - [704, 5056, 1, 3328]
    - [37, 21234.0]
  - - [1024, 64, 1, 1280]
    - [47, 3606.45]
  - - [64, 1024, 1, 3328]
    - [45, 3745.94]
  - - [2368, 2944, 1, 3328]
    - [33, 20536.4]
  - - [448, 448, 1, 1280]
    - [42, 7301.13]
  - - [2368, 3584, 1, 256]
    - [35, 19884.7]
  - - [1024, 256, 1, 1280]
    - [36, 8934.39]
  - - [128, 5056, 1, 1280]
    - [14, 13234.0]
  - - [3584, 2368, 1, 1280]
    - [40, 21521.8]
  - - [1856, 1856, 1, 256]
    - [35, 17278.0]
  - - [4288, 1408, 1, 3328]
    - [8, 21088.8]
  - - [3584, 64, 1, 3328]
    - [46, 8914.46]
  - - [4288, 5056, 1, 1280]
    - [8, 21507.7]
  - - [5888, 6784, 1, 1280]
    - [8, 20451.4]
  - - [256, 1024, 1, 3328]
    - [42, 10100.6]
  - - [1856, 64, 1, 3328]
    - [45, 6278.3]
  - - [5888, 1408, 1, 3328]
    - [39, 21406.7]
  - - [256, 5056, 1, 256]
    - [36, 13679.1]
  - - [1408, 1024, 1, 256]
    - [36, 14075.4]
  - - [448, 256, 1, 256]
    - [15, 3538.86]
  - - [1408, 256, 1, 256]
    - [6, 6556.16]
  - - [2368, 5056, 1, 256]
    - [8, 20729.5]
  - - [128, 5888, 1, 3328]
    - [42, 16436.7]
  - - [1024, 5056, 1, 256]
    - [35, 19075.0]
  - - [2368, 1408, 1, 3328]
    - [42, 20338.3]
  - - [5888, 448, 1, 256]
    - [36, 15854.1]
  - - [6784, 5056, 1, 1280]
    - [8, 20668.3]
  - - [4288, 6784, 1, 1280]
    - [8, 21596.4]
  - - [128, 704, 1, 256]
    - [2, 2755.78]
  - - [1024, 128, 1, 256]
    - [15, 3838.74]
  - - [448, 128, 1, 1280]
    - [22, 3125.81]
  - - [1024, 64, 1, 3328]
    - [45, 3722.29]
  - - [64, 3584, 1, 1280]
    - [17, 7771.55]
  - - [6784, 1408, 1, 256]
    - [35, 20264.2]
  - - [5888, 4288, 1, 256]
    - [8, 21731.9]
  - - [5056, 5888, 1, 256]
    - [35, 22225.3]
  - - [2368, 1024, 1, 256]
    - [35, 15901.4]
  - - [1856, 6784, 1, 1280]
    - [39, 21657.1]
  - - [3584, 128, 1, 1280]
    - [36, 12083.8]
  - - [4288, 128, 1, 256]
    - [1, 8741.12]
  - - [4288, 3584, 1, 256]
    - [8, 21415.6]
  - - [64, 256, 1, 3328]
    - [29, 1038.18]
  - - [5056, 1856, 1, 1280]
    - [8, 23003.2]
  - - [1408, 1024, 1, 3328]
    - [37, 18164.5]
  - - [2368, 256, 1, 3328]
    - [36, 13469.3]
  - - [5888, 3584, 1, 1280]
    - [35, 21331.5]
  - - [5888, 128, 1, 1280]
    - [36, 15213.6]
  - - [1024, 2944, 1, 256]
    - [35, 16885.5]
  - - [448, 6784, 1, 1280]
    - [35, 20214.1]
  - - [256, 3584, 1, 1280]
    - [39, 14942.5]
  - - [3584, 1024, 1, 3328]
    - [35, 21795.3]
  - - [2944, 1856, 1, 1280]
    - [35, 21136.4]
  - - [128, 5888, 1, 256]
    - [4, 11178.3]
  - - [2368, 3584, 1, 3328]
    - [37, 20499.4]
  - - [3584, 5888, 1, 3328]
    - [41, 19386.3]
  - - [2944, 3584, 1, 1280]
    - [33, 21847.9]
  - - [1856, 5888, 1, 1280]
    - [7, 21785.0]
  - - [256, 256, 1, 1280]
    - [24, 3572.36]
  - - [5056, 448, 1, 3328]
    - [36, 18569.8]
  - - [4288, 1408, 1, 256]
    - [37, 18646.1]
  - - [3584, 64, 1, 256]
    - [12, 5355.98]
  - - [64, 1856, 1, 3328]
    - [45, 6285.69]
  - - [1024, 1024, 1, 256]
    - [36, 12850.3]
  - - [4288, 2368, 1, 1280]
    - [35, 22114.4]
  - - [2944, 5056, 1, 256]
    - [35, 21265.2]
  - - [256, 128, 1, 3328]
    - [31, 1970.76]
  - - [6784, 2368, 1, 256]
    - [8, 21165.5]
  - - [1024, 1024, 1, 1024]
    - [36, 16584.8]
  - - [2944, 64, 1, 3328]
    - [23, 7639.81]
  - - [4288, 1856, 1, 256]
    - [36, 19355.3]
  - - [1856, 2944, 1, 256]
    - [35, 18789.3]
  - - [64, 5888, 1, 1280]
    - [14, 9850.91]
  - - [1856, 1408, 1, 1280]
    - [37, 20506.6]
  - - [704, 1024, 1, 256]
    - [6, 10926.9]
  - - [1024, 4288, 1, 1280]
    - [36, 20500.6]
  - - [2368, 5056, 1, 3328]
    - [41, 20298.5]
  - - [1024, 1856, 1, 3328]
    - [37, 18945.0]
  - - [704, 704, 1, 1280]
    - [36, 12820.3]
  - - [128, 2368, 1, 1280]
    - [13, 8107.6]
  - - [3584, 256, 1, 1280]
    - [36, 15099.1]
  - - [704, 3584, 1, 1280]
    - [35, 19630.1]
  - - [128, 704, 1, 3328]
    - [22, 4842.6]
  - - [4288, 6784, 1, 256]
    - [8, 22445.0]
  - - [3584, 2944, 1, 3328]
    - [37, 19980.4]
  - - [128, 1856, 1, 256]
    - [10, 5401.43]
  - - [64, 4288, 1, 256]
    - [12, 5514.06]
  - - [5888, 2944, 1, 256]
    - [41, 21364.2]
  - - [5056, 128, 1, 1280]
    - [19, 13234.0]
  - - [448, 1856, 1, 3328]
    - [39, 14747.7]
  - - [5056, 4288, 1, 256]
    - [8, 21984.8]
  - - [1024, 448, 1, 256]
    - [36, 8047.73]
  - - [2944, 128, 1, 1280]
    - [14, 9956.34]
  - - [6784, 1024, 1, 3328]
    - [37, 20519.2]
  - - [64, 256, 1, 256]
    - [20, 699.051]
  - - [704, 256, 1, 3328]
    - [42, 7053.02]
  - - [256, 704, 1, 1280]
    - [42, 6570.02]
  - - [5888, 5888, 1, 1280]
    - [39, 20755.8]
  - - [448, 5888, 1, 1280]
    - [36, 18254.0]
  - - [2944, 1408, 1, 256]
    - [8, 18580.0]
  - - [256, 2944, 1, 1280]
    - [36, 15231.5]
  - - [1024, 2944, 1, 1280]
    - [35, 20135.9]
  - - [2368, 5888, 1, 3328]
    - [37, 20328.5]
  - - [704, 1024, 1, 3328]
    - [42, 15798.7]
  - - [2368, 1856, 1, 1280]
    - [36, 20575.3]
  - - [1856, 448, 1, 1280]
    - [36, 13709.6]
  - - [128, 6784, 1, 256]
    - [6, 11410.1]
  - - [5888, 4288, 1, 3328]
    - [41, 19138.4]
  - - [6784, 704, 1, 1280]
    - [39, 20182.4]
  - - [5056, 448, 1, 256]
    - [36, 15750.5]
  - - [1856, 5056, 1, 1280]
    - [33, 21408.7]
  - - [2944, 1024, 1, 1280]
    - [35, 20174.9]
  - - [2368, 4288, 1, 256]
    - [8, 20702.7]
  - - [1024, 2368, 1, 3328]
    - [37, 19203.2]
  - - [64, 704, 1, 3328]
    - [47, 2625.43]
  - - [704, 1408, 1, 256]
    - [36, 12926.9]
  - - [4288, 5888, 1, 3328]
    - [41, 19465.2]
  - - [256, 1408, 1, 256]
    - [6, 6590.81]
  - - [448, 2944, 1, 1280]
    - [36, 15663.3]
  - - [2944, 6784, 1, 1280]
    - [37, 21510.0]
  - - [256, 6784, 1, 1280]
    - [42, 17508.4]
  - - [1856, 3584, 1, 256]
    - [35, 19732.4]
  - - [128, 448, 1, 3328]
    - [22, 3269.36]
  - - [1856, 256, 1, 256]
    - [36, 8687.89]
  - - [128, 2368, 1, 3328]
    - [18, 8865.54]
  - - [256, 5888, 1, 1280]
    - [36, 17937.9]
  - - [448, 2368, 1, 3328]
    - [36, 15444.3]
  - - [64, 1408, 1, 256]
    - [43, 2805.55]
  - - [7680, 5481, 1, 2560]
    - [41, 19060.4]
  - - [2944, 2368, 1, 256]
    - [35, 19413.7]
  - - [1856, 448, 1, 256]
    - [6, 11094.9]
  - - [1024, 1856, 1, 256]
    - [36, 14693.7]
  - - [6784, 3584, 1, 3328]
    - [41, 19446.0]
  - - [1024, 704, 1, 3328]
    - [36, 15946.5]
  - - [1024, 5888, 1, 3328]
    - [35, 21057.0]
  - - [1408, 2368, 1, 1280]
    - [36, 20053.0]
  - - [128, 1408, 1, 1280]
    - [13, 6501.42]
  - - [256, 64, 1, 3328]
    - [29, 1042.6]
  - - [128, 1856, 1, 3328]
    - [42, 9224.81]
  - - [2944, 2944, 1, 256]
    - [35, 20252.0]
  - - [6784, 256, 1, 256]
    - [36, 14929.9]
  - - [128, 4288, 1, 1280]
    - [14, 11331.0]
  - - [5888, 1408, 1, 256]
    - [35, 20435.4]
  - - [128, 128, 1, 256]
    - [25, 674.054]
  - - [448, 704, 1, 3328]
    - [42, 9083.02]
  - - [448, 1856, 1, 256]
    - [36, 10722.1]
  - - [1856, 704, 1, 3328]
    - [36, 18997.5]
  - - [5888, 6784, 1, 3328]
    - [41, 19270.4]
  - - [704, 4288, 1, 1280]
    - [35, 20124.4]
  - - [704, 256, 1, 256]
    - [36, 3579.45]
  - - [6784, 448, 1, 3328]
    - [39, 20285.6]
  - - [3136, 256, 64, 64]
    - [53, 14506.6]
  - - [784, 512, 64, 128]
    - [49, 17580.2]
  - - [784, 128, 128, 512]
    - [52, 17852.4]
  - - [3136, 64, 128, 64]
    - [54, 9533.95]
  - - [196, 256, 128, 1024]
    - [52, 14440.5]
  - - [196, 256, 64, 1024]
    - [52, 13785.8]
  - - [196, 1024, 128, 256]
    - [49, 15349.3]
  - - [3136, 64, 64, 256]
    - [51, 14356.4]
  - - [3136, 64, 128, 256]
    - [48, 14527.9]
  - - [784, 128, 64, 512]
    - [52, 17218.8]
  - - [784, 512, 128, 128]
    - [49, 18267.5]
  - - [196, 1024, 64, 256]
    - [49, 14582.9]
  - - [3136, 64, 64, 64]
    - [50, 8892.29]
  - - [3136, 256, 128, 64]
    - [53, 15006.8]
- null
