library/src/blas3/Tensile/Logic/asm_full/vega20_Cijk_Alik_Bljk_HBH.yaml
- {MinimumRequiredVersion: 4.5.0}
- vega20
- gfx906
- [Device 66a0, Device 66a1, Device 66a7]
    SolutionIndex: 0
    SolutionNameMin: Cijk_Alik_Bljk_HBH_MT016x016x16_PGR1_PLR1_TT02_02
    SolutionIndex: 1
    SolutionNameMin: Cijk_Alik_Bljk_HBH_MT032x032x16_PGR1_PLR1_TT04_04
    SolutionIndex: 2
    SolutionNameMin: Cijk_Alik_Bljk_HBH_MT064x032x16_PGR1_PLR1_TT04_04
    SolutionIndex: 3
    SolutionNameMin: Cijk_Alik_Bljk_HBH_MT016x016x32_PGR1_PLR1_TT02_02
    SolutionIndex: 4
    SolutionNameMin: Cijk_Alik_Bljk_HBH_MT032x032x32_PGR1_PLR1_TT04_04
    SolutionIndex: 5
    SolutionNameMin: Cijk_Alik_Bljk_HBH_MT032x016x32_PGR1_PLR1_TT02_02
    SolutionIndex: 6
    SolutionNameMin: Cijk_Alik_Bljk_HBH_MT064x032x32_PGR1_PLR1_TT04_04
    SolutionIndex: 7
    SolutionNameMin: Cijk_Alik_Bljk_HBH_MT032x032x16_PGR1_PLR1_TT04_04
    SolutionIndex: 8
    SolutionNameMin: Cijk_Alik_Bljk_HBH_MT256x064x16_PGR1_PLR1_TT08_08
    SolutionIndex: 9
    SolutionNameMin: Cijk_Alik_Bljk_HBH_MT016x016x24_PGR1_PLR1_TT02_02
    SolutionIndex: 10
    SolutionNameMin: Cijk_Alik_Bljk_HBH_MT032x016x24_PGR1_PLR1_TT04_02
    SolutionIndex: 11
    SolutionNameMin: Cijk_Alik_Bljk_HBH_MT032x032x24_PGR1_PLR1_TT04_04
    SolutionIndex: 12
    SolutionNameMin: Cijk_Alik_Bljk_HBH_MT016x016x24_PGR1_PLR1_TT02_02
    SolutionIndex: 13
    SolutionNameMin: Cijk_Alik_Bljk_HBH_MT032x032x24_PGR1_PLR1_TT04_04
    SolutionIndex: 14
    SolutionNameMin: Cijk_Alik_Bljk_HBH_MT064x032x32_PGR1_PLR1_TT08_04
    SolutionIndex: 15
    SolutionNameMin: Cijk_Alik_Bljk_HBH_MT016x016x32_PGR1_PLR1_TT02_02
    SolutionIndex: 16
    SolutionNameMin: Cijk_Alik_Bljk_HBH_MT032x032x32_PGR1_PLR1_TT04_04
    SolutionIndex: 17
    SolutionNameMin: Cijk_Alik_Bljk_HBH_MT064x128x08_PGR1_PLR1_TT04_08
    SolutionIndex: 18
    SolutionNameMin: Cijk_Alik_Bljk_HBH_MT128x064x08_PGR1_PLR1_TT08_04
    SolutionIndex: 19
    SolutionNameMin: Cijk_Alik_Bljk_HBH_MT128x128x08_PGR1_PLR1_TT08_08
    SolutionIndex: 20
    SolutionNameMin: Cijk_Alik_Bljk_HBH_MT064x064x16_PGR1_PLR1_TT04_04
    SolutionIndex: 21
    SolutionNameMin: Cijk_Alik_Bljk_HBH_MT064x128x16_PGR1_PLR1_TT04_08
    SolutionIndex: 22
    SolutionNameMin: Cijk_Alik_Bljk_HBH_MT128x064x16_PGR1_PLR1_TT08_04
    SolutionIndex: 23
    SolutionNameMin: Cijk_Alik_Bljk_HBH_MT128x128x16_PGR1_PLR1_TT08_08
    SolutionIndex: 24
    SolutionNameMin: Cijk_Alik_Bljk_HBH_MT064x064x32_PGR1_PLR1_TT04_04
    SolutionIndex: 25
    SolutionNameMin: Cijk_Alik_Bljk_HBH_MT128x128x32_PGR1_PLR1_TT08_08
    SolutionIndex: 26
    SolutionNameMin: Cijk_Alik_Bljk_HBH_MT064x064x08_PGR0_PLR0_TT04_04
    SolutionIndex: 27
    SolutionNameMin: Cijk_Alik_Bljk_HBH_MT064x064x08_PGR1_PLR1_TT04_04
    SolutionIndex: 28
    SolutionNameMin: Cijk_Alik_Bljk_HBH_MT064x064x04_PGR0_PLR0_TT04_04
    SolutionIndex: 29
    SolutionNameMin: Cijk_Alik_Bljk_HBH_MT064x064x04_PGR1_PLR1_TT04_04
    SolutionIndex: 0
    SolutionNameMin: Cijk_Alik_Bljk_HBH_MT064x032x16_GRVW04_LPB04_NLCA01_NLCB01_PBC0_PGR1_PLR1_TT04_04_USFGRO00_VW04_WG16_08_01_WGM01
    SolutionIndex: 1
    SolutionNameMin: Cijk_Alik_Bljk_HBH_MT064x064x16_GRVW04_LPB04_NLCA01_NLCB01_PBC0_PGR1_PLR1_TT04_04_USFGRO00_VW04_WG16_16_01_WGM01
    SolutionIndex: 2
    SolutionNameMin: Cijk_Alik_Bljk_HBH_MT064x032x16_GRVW04_LPB04_NLCA01_NLCB01_PBC0_PGR1_PLR1_TT04_04_USFGRO00_VW04_WG16_08_01_WGM08
    SolutionIndex: 3
    SolutionNameMin: Cijk_Alik_Bljk_HBH_MT064x064x16_GRVW04_LPB04_NLCA01_NLCB01_PBC0_PGR1_PLR1_TT04_04_USFGRO00_VW04_WG16_16_01_WGM08
    SolutionIndex: 0
    SolutionNameMin: Cijk_Alik_Bljk_HBH_MT064x032x08_GRVW04_LPB00_PGR1_PLR1_TT04_04_USFGRO0_VW04_WG16_08_01_WGM01
    SolutionIndex: 1
    SolutionNameMin: Cijk_Alik_Bljk_HBH_MT064x032x08_GRVW04_LPB04_PGR1_PLR1_TT04_04_USFGRO0_VW04_WG16_08_01_WGM01
    SolutionIndex: 2
    SolutionNameMin: Cijk_Alik_Bljk_HBH_MT064x032x16_GRVW04_LPB04_PGR1_PLR1_TT04_04_USFGRO0_VW04_WG16_08_01_WGM01
    SolutionIndex: 3
    SolutionNameMin: Cijk_Alik_Bljk_HBH_MT064x064x16_GRVW04_LPB04_PGR1_PLR1_TT04_04_USFGRO0_VW04_WG16_16_01_WGM01
    SolutionIndex: 0
    SolutionNameMin: Cijk_Alik_Bljk_HBH_MT032x032x08_PGR0_PLR1_TT04_04
    SolutionIndex: 1
    SolutionNameMin: Cijk_Alik_Bljk_HBH_MT032x032x08_PGR1_PLR1_TT04_04
    SolutionIndex: 2
    SolutionNameMin: Cijk_Alik_Bljk_HBH_MT032x032x16_PGR1_PLR1_TT04_04
    SolutionIndex: 3
    SolutionNameMin: Cijk_Alik_Bljk_HBH_MT064x032x16_PGR1_PLR1_TT04_04
    SolutionIndex: 4
    SolutionNameMin: Cijk_Alik_Bljk_HBH_MT064x064x16_PGR1_PLR1_TT04_04
    SolutionIndex: 5
    SolutionNameMin: Cijk_Alik_Bljk_HBH_MT032x032x32_PGR1_PLR1_TT04_04
    SolutionIndex: 6
    SolutionNameMin: Cijk_Alik_Bljk_HBH_MT064x064x16_PGR1_PLR1_TT08_08
    SolutionIndex: 7
    SolutionNameMin: Cijk_Alik_Bljk_HBH_MT064x064x32_PGR1_PLR1_TT08_08
    SolutionIndex: 8
    SolutionNameMin: Cijk_Alik_Bljk_HBH_MT032x032x16_PGR1_PLR1_TT04_04
    SolutionIndex: 9
    SolutionNameMin: Cijk_Alik_Bljk_HBH_MT064x032x16_PGR1_PLR1_TT04_04
    SolutionIndex: 10
    SolutionNameMin: Cijk_Alik_Bljk_HBH_MT064x016x16_PGR1_PLR1_TT04_04
    SolutionIndex: 11
    SolutionNameMin: Cijk_Alik_Bljk_HBH_MT032x032x32_PGR1_PLR1_TT04_04
    SolutionIndex: 12
    SolutionNameMin: Cijk_Alik_Bljk_HBH_MT064x064x16_PGR1_PLR1_TT08_08
    SolutionIndex: 13
    SolutionNameMin: Cijk_Alik_Bljk_HBH_MT064x064x32_PGR1_PLR1_TT08_08
    SolutionIndex: 14
    SolutionNameMin: Cijk_Alik_Bljk_HBH_MT128x064x08_PGR1_PLR1_TT08_04
    SolutionIndex: 15
    SolutionNameMin: Cijk_Alik_Bljk_HBH_MT128x128x08_PGR1_PLR1_TT08_08
    SolutionIndex: 16
    SolutionNameMin: Cijk_Alik_Bljk_HBH_MT032x064x16_PGR1_PLR1_TT04_08
    SolutionIndex: 17
    SolutionNameMin: Cijk_Alik_Bljk_HBH_MT064x064x16_PGR1_PLR1_TT04_04
    SolutionIndex: 18
    SolutionNameMin: Cijk_Alik_Bljk_HBH_MT064x128x16_PGR1_PLR1_TT04_08
    SolutionIndex: 19
    SolutionNameMin: Cijk_Alik_Bljk_HBH_MT128x064x16_PGR1_PLR1_TT08_04
    SolutionIndex: 20
    SolutionNameMin: Cijk_Alik_Bljk_HBH_MT128x128x16_PGR1_PLR1_TT08_08
    SolutionIndex: 21
    SolutionNameMin: Cijk_Alik_Bljk_HBH_MT128x128x32_PGR1_PLR1_TT08_08
    SolutionIndex: 22
    SolutionNameMin: Cijk_Alik_Bljk_HBH_MT064x064x04_PGR0_PLR0_TT04_04
    SolutionIndex: 23
    SolutionNameMin: Cijk_Alik_Bljk_HBH_MT064x064x04_PGR1_PLR0_TT04_04
    SolutionIndex: 24
    SolutionNameMin: Cijk_Alik_Bljk_HBH_MT064x064x04_PGR0_PLR1_TT04_04
    SolutionIndex: 25
    SolutionNameMin: Cijk_Alik_Bljk_HBH_MT064x128x04_PGR1_PLR1_TT04_08
    SolutionIndex: 26
    SolutionNameMin: Cijk_Alik_Bljk_HBH_MT064x064x04_PGR1_PLR1_TT04_04
    SolutionIndex: 27
    SolutionNameMin: Cijk_Alik_Bljk_HBH_MT064x064x08_PGR0_PLR0_TT04_04
    SolutionIndex: 28
    SolutionNameMin: Cijk_Alik_Bljk_HBH_MT064x064x08_PGR1_PLR0_TT04_04
    SolutionIndex: 29
    SolutionNameMin: Cijk_Alik_Bljk_HBH_MT064x064x08_PGR0_PLR1_TT04_04
    SolutionIndex: 30
    SolutionNameMin: Cijk_Alik_Bljk_HBH_MT064x064x08_PGR1_PLR1_TT04_04
    SolutionIndex: 31
    SolutionNameMin: Cijk_Alik_Bljk_HBH_MT064x064x16_PGR0_PLR0_TT04_04
    SolutionIndex: 32
    SolutionNameMin: Cijk_Alik_Bljk_HBH_MT064x064x16_PGR1_PLR0_TT04_04
    SolutionIndex: 33
    SolutionNameMin: Cijk_Alik_Bljk_HBH_MT064x064x16_PGR0_PLR1_TT04_04
    SolutionIndex: 34
    SolutionNameMin: Cijk_Alik_Bljk_HBH_MT064x064x16_PGR1_PLR1_TT04_04
    SolutionIndex: 35
    SolutionNameMin: Cijk_Alik_Bljk_HBH_MT064x128x04_PGR0_PLR0_TT04_08
    SolutionIndex: 36
    SolutionNameMin: Cijk_Alik_Bljk_HBH_MT064x064x04_PGR0_PLR0_TT04_04
    SolutionIndex: 37
    SolutionNameMin: Cijk_Alik_Bljk_HBH_MT064x128x04_PGR1_PLR0_TT04_08
    SolutionIndex: 38
    SolutionNameMin: Cijk_Alik_Bljk_HBH_MT064x064x04_PGR1_PLR0_TT04_04
    SolutionIndex: 39
    SolutionNameMin: Cijk_Alik_Bljk_HBH_MT128x128x04_PGR0_PLR1_TT08_08
    SolutionIndex: 40
    SolutionNameMin: Cijk_Alik_Bljk_HBH_MT064x128x04_PGR0_PLR1_TT04_08
    SolutionIndex: 41
    SolutionNameMin: Cijk_Alik_Bljk_HBH_MT064x064x04_PGR0_PLR1_TT04_04
    SolutionIndex: 42
    SolutionNameMin: Cijk_Alik_Bljk_HBH_MT064x128x04_PGR1_PLR1_TT04_08
    SolutionIndex: 43
    SolutionNameMin: Cijk_Alik_Bljk_HBH_MT064x064x04_PGR1_PLR1_TT04_04
    SolutionIndex: 44
    SolutionNameMin: Cijk_Alik_Bljk_HBH_MT064x064x08_PGR0_PLR0_TT04_04
    SolutionIndex: 45
    SolutionNameMin: Cijk_Alik_Bljk_HBH_MT064x128x08_PGR1_PLR0_TT04_08
    SolutionIndex: 46
    SolutionNameMin: Cijk_Alik_Bljk_HBH_MT064x064x08_PGR1_PLR0_TT04_04
    SolutionIndex: 47
    SolutionNameMin: Cijk_Alik_Bljk_HBH_MT064x064x08_PGR0_PLR1_TT04_04
    SolutionIndex: 48
    SolutionNameMin: Cijk_Alik_Bljk_HBH_MT064x128x08_PGR1_PLR1_TT04_08
    SolutionIndex: 49
    SolutionNameMin: Cijk_Alik_Bljk_HBH_MT064x064x08_PGR1_PLR1_TT04_04
    SolutionIndex: 50
    SolutionNameMin: Cijk_Alik_Bljk_HBH_MT064x064x16_PGR1_PLR0_TT04_04
    SolutionIndex: 0
    SolutionNameMin: Cijk_Alik_Bljk_HBH_MT032x128x16_EPS1_GRVW02_LPB04_PGR1_PLR1_SNLL1_TT04_04_USFGRO01_VW04_WG08_32_01_WGM01
    SolutionIndex: 1
    SolutionNameMin: Cijk_Alik_Bljk_HBH_MT064x032x16_EPS1_GRVW04_LPB04_PGR1_PLR1_SNLL1_TT04_04_USFGRO0_VW04_WG16_08_01_WGM01
    SolutionIndex: 2
    SolutionNameMin: Cijk_Alik_Bljk_HBH_MT032x128x16_EPS1_GRVW04_LPB04_PGR1_PLR1_SNLL1_TT04_04_USFGRO0_VW04_WG08_32_01_WGM64
    SolutionIndex: 3
    SolutionNameMin: Cijk_Alik_Bljk_HBH_MT032x128x32_EPS1_GRVW04_LPB04_PGR1_PLR1_SNLL1_TT04_04_USFGRO0_VW04_WG08_32_01_WGM01
    SolutionIndex: 4
    SolutionNameMin: Cijk_Alik_Bljk_HBH_MT032x128x32_EPS1_GRVW04_LPB04_PGR1_PLR1_SNLL1_TT04_04_USFGRO0_VW04_WG08_32_01_WGM08
- - - [2560, 7000, 1, 2560]
    - [58, 16117.8]
  - - [7680, 12000, 1, 2560]
    - [58, 17167.1]
  - - [5124, 9124, 1, 1760]
    - [53, 16743.7]
  - - [1760, 32, 1, 1760]
    - [40, 2051.39]
  - - [512, 24000, 1, 1536]
    - [58, 15612.1]
  - - [3072, 24000, 1, 1024]
    - [58, 15928.3]
  - - [2048, 400, 1, 512]
    - [59, 8623.16]
  - - [2560, 128, 1, 2560]
    - [46, 6328.16]
  - - [3072, 16, 1, 1024]
    - [43, 1382.74]
  - - [512, 48000, 1, 2816]
    - [58, 17045.8]
  - - [512, 48000, 1, 2048]
    - [59, 13717.0]
  - - [1760, 64, 1, 1760]
    - [40, 3908.64]
  - - [2048, 1600, 1, 2048]
    - [59, 7886.25]
  - - [512, 48000, 1, 1536]
    - [58, 16215.7]
  - - [2560, 32, 1, 2560]
    - [46, 2928.98]
  - - [8448, 5984, 1, 2816]
    - [58, 17008.1]
  - - [4096, 3200, 1, 1024]
    - [59, 13522.4]
  - - [1024, 24000, 1, 2560]
    - [58, 16591.7]
  - - [1760, 6400, 1, 1760]
    - [53, 16922.2]
  - - [5124, 9124, 1, 2048]
    - [59, 13709.0]
  - - [1024, 700, 1, 512]
    - [51, 7387.31]
  - - [4608, 32, 1, 1536]
    - [40, 4416.78]
  - - [3072, 64, 1, 1024]
    - [49, 3932.16]
  - - [16384, 3200, 1, 4096]
    - [59, 14171.3]
  - - [2560, 16, 1, 2560]
    - [40, 1494.55]
  - - [1024, 48000, 1, 2560]
    - [58, 17216.7]
  - - [8448, 48000, 1, 2816]
    - [58, 15382.5]
  - - [2048, 32, 1, 2048]
    - [49, 1588.75]
  - - [2560, 3200, 1, 2560]
    - [58, 15770.9]
  - - [16384, 800, 1, 4096]
    - [59, 11827.2]
  - - [4608, 24000, 1, 1536]
    - [58, 17228.0]
  - - [7680, 48000, 1, 2560]
    - [58, 16338.0]
  - - [3072, 48000, 1, 1024]
    - [58, 16684.4]
  - - [1760, 16, 1, 1760]
    - [43, 968.0]
  - - [8192, 3200, 1, 2048]
    - [59, 13523.7]
  - - [512, 24000, 1, 2816]
    - [58, 16868.3]
  - - [4096, 400, 1, 1024]
    - [59, 10160.6]
  - - [6144, 48000, 1, 2560]
    - [58, 17231.4]
  - - [4608, 48000, 1, 1536]
    - [58, 17440.1]
  - - [4096, 128, 1, 4096]
    - [49, 4602.01]
  - - [2048, 800, 1, 512]
    - [58, 10092.2]
  - - [4608, 5984, 1, 1536]
    - [58, 16217.7]
  - - [4096, 1600, 1, 1024]
    - [59, 12217.6]
  - - [6144, 5984, 1, 2048]
    - [59, 13986.8]
  - - [7680, 24000, 1, 2560]
    - [58, 17332.2]
  - - [6144, 48000, 1, 2048]
    - [59, 14754.7]
  - - [2048, 3200, 1, 2048]
    - [59, 11205.7]
  - - [5124, 9124, 1, 2560]
    - [58, 16553.2]
  - - [1024, 24000, 1, 1536]
    - [58, 16282.8]
  - - [7680, 16, 1, 2560]
    - [49, 2943.23]
  - - [2560, 6400, 1, 2560]
    - [58, 16396.3]
  - - [2048, 128, 1, 2048]
    - [49, 3539.5]
  - - [512, 16, 1, 500000]
    - [43, 307.34]
  - - [1024, 8, 1, 500000]
    - [40, 308.222]
  - - [512, 24000, 1, 2560]
    - [58, 16013.0]
  - - [1024, 24000, 1, 2816]
    - [58, 17008.6]
  - - [7680, 5984, 1, 2560]
    - [58, 16816.6]
  - - [2048, 1600, 1, 512]
    - [59, 10491.0]
  - - [2048, 7000, 1, 2048]
    - [59, 12899.4]
  - - [1760, 800, 1, 1760]
    - [52, 12370.6]
  - - [4096, 64, 1, 4096]
    - [43, 3829.32]
  - - [7680, 32, 1, 2560]
    - [49, 5890.88]
  - - [2560, 64, 1, 2560]
    - [46, 5185.84]
  - - [3072, 128, 1, 1024]
    - [49, 5125.42]
  - - [7680, 64, 1, 2560]
    - [45, 6673.16]
  - - [1760, 128, 1, 1760]
    - [40, 6931.69]
  - - [2560, 1600, 1, 2560]
    - [51, 12145.3]
  - - [2048, 3200, 1, 512]
    - [59, 12423.9]
  - - [2560, 800, 1, 2560]
    - [58, 10502.6]
  - - [3072, 32, 1, 1024]
    - [49, 2654.62]
  - - [6144, 32, 1, 2560]
    - [46, 5304.77]
  - - [4608, 12000, 1, 1536]
    - [58, 17020.7]
  - - [4096, 32, 1, 4096]
    - [43, 2293.54]
  - - [6144, 24000, 1, 2048]
    - [59, 14617.0]
  - - [8192, 800, 1, 2048]
    - [59, 10180.3]
  - - [5124, 9124, 1, 4096]
    - [59, 13819.5]
  - - [8448, 24000, 1, 2816]
    - [58, 17269.4]
  - - [1024, 48000, 1, 1536]
    - [58, 16865.1]
  - - [7680, 128, 1, 2560]
    - [45, 11612.1]
  - - [8192, 1600, 1, 2048]
    - [59, 12104.8]
  - - [4096, 800, 1, 1024]
    - [59, 10525.2]
  - - [1024, 16, 1, 500000]
    - [43, 614.68]
  - - [2048, 800, 1, 2048]
    - [59, 7597.0]
  - - [1760, 3200, 1, 1760]
    - [53, 15165.7]
  - - [512, 48000, 1, 2560]
    - [58, 16676.5]
  - - [8448, 16, 1, 2816]
    - [48, 3379.2]
  - - [2048, 64, 1, 2048]
    - [49, 2833.99]
  - - [512, 24000, 1, 2048]
    - [59, 12563.8]
  - - [16384, 1600, 1, 4096]
    - [59, 13120.0]
  - - [4608, 16, 1, 1536]
    - [40, 2222.26]
  - - [1024, 24000, 1, 2048]
    - [59, 13593.5]
  - - [8192, 400, 1, 2048]
    - [59, 8018.93]
  - - [2048, 6400, 1, 2048]
    - [59, 12755.4]
  - - [6144, 12000, 1, 2048]
    - [59, 14408.9]
  - - [512, 8, 1, 500000]
    - [40, 154.648]
  - - [1760, 7000, 1, 1760]
    - [53, 15763.6]
  - - [1024, 48000, 1, 2816]
    - [58, 17429.6]
  - - [6144, 16, 1, 2560]
    - [46, 2778.91]
  - - [8448, 32, 1, 2816]
    - [46, 6175.1]
  - - [4096, 7000, 1, 4096]
    - [59, 13858.0]
  - - [4096, 16, 1, 4096]
    - [49, 1144.81]
  - - [6144, 24000, 1, 2560]
    - [58, 17278.3]
  - - [1024, 1024, 1, 1024]
    - [59, 10445.0]
  - - [2048, 16, 1, 2048]
    - [49, 874.725]
  - - [8448, 12000, 1, 2816]
    - [58, 17254.0]
  - - [16384, 400, 1, 4096]
    - [59, 9386.63]
  - - [1760, 1600, 1, 1760]
    - [50, 14768.1]
  - - [1024, 48000, 1, 2048]
    - [59, 14193.6]
  - - [512, 128, 1, 784]
    - [90, 1845.55]
  - - [1024, 256, 1, 196]
    - [89, 4978.7]
  - - [256, 64, 1, 3136]
    - [92, 542.902]
  - - [256, 1024, 1, 196]
    - [91, 5017.6]
  - - [64, 256, 1, 3136]
    - [92, 544.744]
  - - [128, 512, 1, 784]
    - [90, 1824.58]
  - - [64, 64, 1, 3136]
    - [93, 134.588]
- - - -1
    - - - 1
        - - - 32
            - - [64, 28]
              - [128, 29]
              - [256, 28]
              - [448, 29]
              - [1856, 28]
              - [2368, 29]
              - [2944, 28]
              - [4288, 29]
              - [5056, 28]
              - [5888, 29]
              - [-1, 28]
          - - 64
            - - [64, 29]
              - [256, 28]
              - [448, 29]
              - [704, 28]
              - [1408, 29]
              - [2368, 28]
              - [2944, 29]
              - [5056, 28]
              - [5888, 29]
              - [-1, 28]
          - - 128
            - - [32, 28]
              - [64, 29]
              - [128, 28]
              - [256, 29]
              - [704, 28]
              - [1024, 29]
              - [1408, 28]
              - [1856, 29]
              - [3584, 28]
              - [4288, 29]
              - [5056, 28]
              - [-1, 29]
          - - 256
            - - [64, 28]
              - [128, 29]
              - [704, 28]
              - [2368, 29]
              - [2944, 28]
              - [5056, 29]
              - [-1, 28]
          - - 448
            - - [64, 28]
              - [128, 29]
              - [448, 28]
              - [1024, 29]
              - [1408, 28]
              - [1856, 29]
              - [2368, 28]
              - [2944, 29]
              - [3584, 28]
              - [4288, 29]
              - [-1, 28]
          - - 704
            - - [32, 28]
              - [64, 29]
              - [448, 28]
              - [704, 29]
              - [1024, 28]
              - [1856, 29]
              - [2368, 28]
              - [2944, 29]
              - [-1, 28]
          - - 1024
            - - [32, 28]
              - [64, 29]
              - [128, 28]
              - [256, 29]
              - [448, 28]
              - [1856, 29]
              - [5056, 28]
              - [5888, 29]
              - [-1, 28]
          - - 1408
            - - [64, 28]
              - [128, 29]
              - [256, 28]
              - [448, 29]
              - [3584, 28]
              - [4288, 29]
              - [-1, 28]
          - - 1856
            - - [32, 28]
              - [128, 29]
              - [256, 28]
              - [1408, 29]
              - [-1, 28]
          - - 2368
            - - [32, 28]
              - [128, 29]
              - [448, 28]
              - [1024, 29]
              - [-1, 28]
          - - 2944
            - - [64, 28]
              - [448, 29]
              - [-1, 28]
          - - 3584
            - - [256, 29]
              - [-1, 28]
          - - 4288
            - - [32, 28]
              - [256, 29]
              - [448, 28]
              - [704, 29]
              - [-1, 28]
          - - 5056
            - - [32, 29]
              - [64, 28]
              - [704, 29]
              - [-1, 28]
          - - 5888
            - - [64, 28]
              - [128, 29]
              - [-1, 28]
          - - -1
            - - [64, 29]
              - [-1, 28]
      - - 32
        - - - 32
            - - [1856, 26]
              - [2368, 27]
              - [3584, 26]
              - [4288, 27]
              - [5888, 26]
              - [-1, 27]
          - - 64
            - - [2944, 26]
              - [4288, 27]
              - [-1, 26]
          - - 128
            - - [1408, 26]
              - [1856, 27]
              - [2368, 26]
              - [2944, 27]
              - [3584, 26]
              - [4288, 27]
              - [-1, 26]
          - - 256
            - - [704, 26]
              - [1856, 27]
              - [2944, 26]
              - [4288, 27]
              - [5056, 26]
              - [-1, 27]
          - - 448
            - - [448, 26]
              - [1024, 27]
              - [1408, 26]
              - [1856, 27]
              - [-1, 26]
          - - 704
            - - [256, 26]
              - [704, 27]
              - [3584, 26]
              - [4288, 27]
              - [-1, 26]
          - - 1024
            - - [128, 26]
              - [256, 27]
              - [448, 26]
              - [1024, 27]
              - [-1, 26]
          - - 1408
            - - [256, 26]
              - [448, 27]
              - [2944, 26]
              - [3584, 27]
              - [-1, 26]
          - - 1856
            - - [64, 26]
              - [128, 27]
              - [448, 26]
              - [1024, 27]
              - [-1, 26]
          - - 2368
            - - [64, 26]
              - [256, 27]
              - [-1, 26]
          - - 2944
            - - [64, 26]
              - [128, 27]
              - [704, 26]
              - [1024, 27]
              - [-1, 26]
          - - 3584
            - - [32, 27]
              - [64, 26]
              - [256, 27]
              - [-1, 26]
          - - 4288
            - - [32, 26]
              - [64, 27]
              - [256, 26]
              - [448, 27]
              - [-1, 26]
          - - 5056
            - - [32, 26]
              - [128, 27]
              - [-1, 26]
          - - 5888
            - - [-1, 26]
          - - -1
            - - [32, 26]
              - [64, 27]
              - [128, 26]
              - [256, 27]
              - [-1, 26]
      - - 256
        - - - 1
            - - [-1, 29]
          - - 32
            - - [-1, 27]
          - - 64
            - - [1, 29]
              - [32, 27]
              - [64, 0]
              - [128, 9]
              - [2368, 0]
              - [3584, 1]
              - [4288, 12]
              - [5056, 2]
              - [-1, 20]
          - - 128
            - - [1, 29]
              - [32, 27]
              - [1024, 0]
              - [1856, 1]
              - [2368, 2]
              - [-1, 20]
          - - 256
            - - [1, 29]
              - [32, 27]
              - [64, 3]
              - [128, 0]
              - [256, 12]
              - [448, 0]
              - [1024, 7]
              - [-1, 20]
          - - 448
            - - [1, 29]
              - [32, 27]
              - [128, 0]
              - [256, 12]
              - [448, 1]
              - [5888, 20]
              - [-1, 21]
          - - 704
            - - [1, 29]
              - [32, 27]
              - [64, 0]
              - [128, 12]
              - [256, 7]
              - [-1, 20]
          - - 1024
            - - [1, 29]
              - [32, 27]
              - [128, 0]
              - [704, 20]
              - [1024, 23]
              - [-1, 20]
          - - 1408
            - - [1, 29]
              - [32, 27]
              - [64, 12]
              - [128, 1]
              - [1024, 20]
              - [1408, 23]
              - [-1, 20]
          - - 1856
            - - [1, 29]
              - [32, 27]
              - [64, 12]
              - [-1, 20]
          - - 2368
            - - [1, 29]
              - [32, 26]
              - [64, 12]
              - [128, 2]
              - [-1, 20]
          - - 2944
            - - [1, 29]
              - [32, 27]
              - [64, 1]
              - [-1, 20]
          - - 3584
            - - [1, 29]
              - [32, 27]
              - [64, 7]
              - [-1, 20]
          - - 4288
            - - [1, 29]
              - [32, 27]
              - [64, 12]
              - [-1, 20]
          - - 5056
            - - [1, 29]
              - [32, 27]
              - [64, 2]
              - [-1, 20]
          - - -1
            - - [1, 29]
              - [32, 27]
              - [-1, 20]
      - - 1280
        - - - 1
            - - [-1, 29]
          - - 32
            - - [-1, 27]
          - - 64
            - - [1, 29]
              - [32, 27]
              - [1856, 9]
              - [2944, 12]
              - [3584, 1]
              - [4288, 12]
              - [5888, 2]
              - [-1, 7]
          - - 128
            - - [1, 29]
              - [32, 27]
              - [64, 9]
              - [128, 12]
              - [1024, 9]
              - [1408, 12]
              - [1856, 7]
              - [2944, 2]
              - [4288, 1]
              - [5888, 20]
              - [-1, 2]
          - - 256
            - - [1, 29]
              - [32, 27]
              - [128, 9]
              - [448, 12]
              - [704, 13]
              - [1024, 7]
              - [1408, 20]
              - [2368, 7]
              - [2944, 20]
              - [3584, 23]
              - [-1, 20]
          - - 448
            - - [1, 29]
              - [32, 27]
              - [64, 9]
              - [256, 12]
              - [704, 7]
              - [-1, 20]
          - - 704
            - - [1, 29]
              - [32, 27]
              - [128, 12]
              - [256, 13]
              - [448, 7]
              - [-1, 20]
          - - 1024
            - - [1, 29]
              - [32, 27]
              - [64, 9]
              - [128, 12]
              - [256, 13]
              - [448, 7]
              - [704, 20]
              - [1024, 23]
              - [-1, 20]
          - - 1408
            - - [1, 29]
              - [32, 27]
              - [128, 12]
              - [256, 7]
              - [1024, 20]
              - [1408, 19]
              - [-1, 20]
          - - 1856
            - - [1, 29]
              - [32, 27]
              - [64, 12]
              - [128, 13]
              - [256, 20]
              - [448, 23]
              - [-1, 20]
          - - 2944
            - - [1, 29]
              - [32, 27]
              - [64, 12]
              - [128, 2]
              - [-1, 20]
          - - 3584
            - - [1, 29]
              - [32, 27]
              - [64, 1]
              - [-1, 20]
          - - 4288
            - - [1, 29]
              - [32, 27]
              - [64, 12]
              - [128, 7]
              - [-1, 20]
          - - 5056
            - - [1, 29]
              - [32, 27]
              - [128, 2]
              - [5888, 20]
              - [-1, 17]
          - - 5888
            - - [1, 29]
              - [32, 27]
              - [64, 2]
              - [2944, 20]
              - [3584, 22]
              - [5056, 20]
              - [5888, 18]
              - [-1, 20]
          - - -1
            - - [1, 29]
              - [32, 27]
              - [64, 1]
              - [128, 2]
              - [5888, 20]
              - [-1, 18]
      - - -1
        - - - 1
            - - [-1, 29]
          - - 32
            - - [-1, 27]
          - - 64
            - - [1, 29]
              - [32, 27]
              - [1408, 9]
              - [2944, 12]
              - [3584, 11]
              - [4288, 10]
              - [5888, 2]
              - [-1, 13]
          - - 128
            - - [1, 29]
              - [32, 27]
              - [256, 9]
              - [1024, 12]
              - [1408, 9]
              - [1856, 13]
              - [2944, 2]
              - [3584, 11]
              - [4288, 13]
              - [5888, 20]
              - [-1, 2]
          - - 256
            - - [1, 29]
              - [32, 27]
              - [64, 9]
              - [448, 12]
              - [1024, 13]
              - [1408, 7]
              - [1856, 13]
              - [2944, 20]
              - [3584, 23]
              - [-1, 20]
          - - 448
            - - [1, 29]
              - [32, 27]
              - [64, 9]
              - [256, 12]
              - [448, 13]
              - [704, 7]
              - [1408, 20]
              - [1856, 23]
              - [-1, 20]
          - - 704
            - - [1, 29]
              - [32, 27]
              - [128, 12]
              - [256, 13]
              - [448, 7]
              - [-1, 20]
          - - 1024
            - - [1, 29]
              - [32, 27]
              - [128, 9]
              - [256, 13]
              - [448, 7]
              - [704, 20]
              - [1024, 23]
              - [1408, 20]
              - [1856, 19]
              - [-1, 20]
          - - 1408
            - - [1, 29]
              - [32, 27]
              - [128, 12]
              - [256, 7]
              - [1024, 20]
              - [1408, 19]
              - [-1, 20]
          - - 1856
            - - [1, 29]
              - [32, 27]
              - [64, 12]
              - [256, 13]
              - [448, 23]
              - [704, 20]
              - [1024, 19]
              - [-1, 20]
          - - 2368
            - - [1, 29]
              - [32, 27]
              - [64, 12]
              - [128, 2]
              - [-1, 20]
          - - 2944
            - - [1, 29]
              - [32, 27]
              - [64, 10]
              - [128, 2]
              - [-1, 20]
          - - 3584
            - - [1, 29]
              - [32, 27]
              - [64, 11]
              - [128, 13]
              - [-1, 20]
          - - 4288
            - - [1, 29]
              - [32, 27]
              - [64, 12]
              - [128, 2]
              - [-1, 20]
          - - 5056
            - - [1, 29]
              - [32, 27]
              - [128, 2]
              - [704, 20]
              - [1024, 19]
              - [2368, 20]
              - [2944, 17]
              - [3584, 20]
              - [4288, 21]
              - [5056, 18]
              - [-1, 17]
          - - 5888
            - - [1, 29]
              - [32, 27]
              - [64, 2]
              - [448, 20]
              - [704, 18]
              - [1408, 20]
              - [2368, 22]
              - [4288, 20]
              - [5056, 22]
              - [-1, 17]
          - - -1
            - - [1, 29]
              - [32, 27]
              - [64, 20]
              - [128, 2]
              - [2368, 20]
              - [2944, 17]
              - [3584, 22]
              - [4288, 18]
              - [5056, 22]
              - [5888, 17]
              - [-1, 19]
