library/src/blas3/Tensile/Logic/asm_full/vega20_Cijk_Ailk_Bljk_HBH.yaml
- {MinimumRequiredVersion: 4.6.0}
- vega20
- gfx906
- [Device 66a0, Device 66a1, Device 66a7, Device 66af, Vega 20]
    SolutionIndex: 0
    SolutionNameMin: Cijk_Ailk_Bljk_HBH_MT032x032x16_PGR1_PLR1_TT04_04
    SolutionIndex: 1
    SolutionNameMin: Cijk_Ailk_Bljk_HBH_MT064x016x16_PGR1_PLR1_TT04_04
    SolutionIndex: 2
    SolutionNameMin: Cijk_Ailk_Bljk_HBH_MT032x016x16_PGR1_PLR1_TT02_02
    SolutionIndex: 3
    SolutionNameMin: Cijk_Ailk_Bljk_HBH_MT064x016x16_PGR1_PLR1_TT04_02
    SolutionIndex: 4
    SolutionNameMin: Cijk_Ailk_Bljk_HBH_MT064x008x16_PGR1_PLR1_TT02_02
    SolutionIndex: 5
    SolutionNameMin: Cijk_Ailk_Bljk_HBH_MT064x016x16_PGR1_PLR1_TT02_02
    SolutionIndex: 6
    SolutionNameMin: Cijk_Ailk_Bljk_HBH_MT128x016x16_PGR1_PLR1_TT04_02
    SolutionIndex: 7
    SolutionNameMin: Cijk_Ailk_Bljk_HBH_MT016x016x32_PGR1_PLR1_TT02_02
    SolutionIndex: 8
    SolutionNameMin: Cijk_Ailk_Bljk_HBH_MT032x008x32_PGR1_PLR1_TT02_02
    SolutionIndex: 9
    SolutionNameMin: Cijk_Ailk_Bljk_HBH_MT032x016x32_PGR1_PLR1_TT02_02
    SolutionIndex: 10
    SolutionNameMin: Cijk_Ailk_Bljk_HBH_MT064x016x32_PGR1_PLR1_TT04_02
    SolutionIndex: 11
    SolutionNameMin: Cijk_Ailk_Bljk_HBH_MT064x008x32_PGR1_PLR1_TT02_02
    SolutionIndex: 12
    SolutionNameMin: Cijk_Ailk_Bljk_HBH_MT064x016x32_PGR1_PLR1_TT02_02
    SolutionIndex: 13
    SolutionNameMin: Cijk_Ailk_Bljk_HBH_MT128x016x32_PGR1_PLR1_TT04_02
    SolutionIndex: 14
    SolutionNameMin: Cijk_Ailk_Bljk_HBH_MT032x008x64_PGR1_PLR1_TT02_02
    SolutionIndex: 15
    SolutionNameMin: Cijk_Ailk_Bljk_HBH_MT064x008x64_PGR1_PLR1_TT02_02
    SolutionIndex: 16
    SolutionNameMin: Cijk_Ailk_Bljk_HBH_MT032x032x08_PGR1_PLR1_TT04_04
    SolutionIndex: 17
    SolutionNameMin: Cijk_Ailk_Bljk_HBH_MT064x032x08_PGR1_PLR1_TT08_04
    SolutionIndex: 18
    SolutionNameMin: Cijk_Ailk_Bljk_HBH_MT032x016x16_PGR1_PLR1_TT04_02
    SolutionIndex: 19
    SolutionNameMin: Cijk_Ailk_Bljk_HBH_MT032x032x16_PGR1_PLR1_TT04_04
    SolutionIndex: 20
    SolutionNameMin: Cijk_Ailk_Bljk_HBH_MT064x064x16_PGR1_PLR1_TT08_08
    SolutionIndex: 21
    SolutionNameMin: Cijk_Ailk_Bljk_HBH_MT064x016x16_PGR1_PLR1_TT04_02
    SolutionIndex: 22
    SolutionNameMin: Cijk_Ailk_Bljk_HBH_MT064x016x16_PGR1_PLR1_TT02_02
    SolutionIndex: 23
    SolutionNameMin: Cijk_Ailk_Bljk_HBH_MT128x016x16_PGR1_PLR1_TT04_02
    SolutionIndex: 24
    SolutionNameMin: Cijk_Ailk_Bljk_HBH_MT064x016x16_PGR1_PLR1_TT04_04
    SolutionIndex: 25
    SolutionNameMin: Cijk_Ailk_Bljk_HBH_MT064x008x16_PGR1_PLR1_TT02_02
    SolutionIndex: 26
    SolutionNameMin: Cijk_Ailk_Bljk_HBH_MT016x016x24_PGR1_PLR1_TT02_02
    SolutionIndex: 27
    SolutionNameMin: Cijk_Ailk_Bljk_HBH_MT032x016x24_PGR1_PLR1_TT04_02
    SolutionIndex: 28
    SolutionNameMin: Cijk_Ailk_Bljk_HBH_MT032x016x24_PGR1_PLR1_TT04_02
    SolutionIndex: 29
    SolutionNameMin: Cijk_Ailk_Bljk_HBH_MT032x032x24_PGR1_PLR1_TT04_04
    SolutionIndex: 30
    SolutionNameMin: Cijk_Ailk_Bljk_HBH_MT032x032x32_PGR1_PLR1_TT04_04
    SolutionIndex: 31
    SolutionNameMin: Cijk_Ailk_Bljk_HBH_MT064x016x32_PGR1_PLR1_TT02_02
    SolutionIndex: 32
    SolutionNameMin: Cijk_Ailk_Bljk_HBH_MT128x016x32_PGR1_PLR1_TT04_02
    SolutionIndex: 33
    SolutionNameMin: Cijk_Ailk_Bljk_HBH_MT032x008x32_PGR1_PLR1_TT02_02
    SolutionIndex: 34
    SolutionNameMin: Cijk_Ailk_Bljk_HBH_MT064x008x32_PGR1_PLR1_TT02_02
    SolutionIndex: 35
    SolutionNameMin: Cijk_Ailk_Bljk_HBH_MT032x008x64_PGR1_PLR1_TT02_02
    SolutionIndex: 36
    SolutionNameMin: Cijk_Ailk_Bljk_HBH_MT064x008x64_PGR1_PLR1_TT02_02
    SolutionIndex: 37
    SolutionNameMin: Cijk_Ailk_Bljk_HBH_MT064x064x08_PGR1_PLR1_TT04_04
    SolutionIndex: 38
    SolutionNameMin: Cijk_Ailk_Bljk_HBH_MT064x128x08_PGR1_PLR1_TT04_08
    SolutionIndex: 39
    SolutionNameMin: Cijk_Ailk_Bljk_HBH_MT128x064x08_PGR1_PLR1_TT08_04
    SolutionIndex: 40
    SolutionNameMin: Cijk_Ailk_Bljk_HBH_MT064x064x16_PGR1_PLR1_TT04_04
    SolutionIndex: 41
    SolutionNameMin: Cijk_Ailk_Bljk_HBH_MT064x128x16_PGR1_PLR1_TT04_08
    SolutionIndex: 42
    SolutionNameMin: Cijk_Ailk_Bljk_HBH_MT128x064x16_PGR1_PLR1_TT08_04
    SolutionIndex: 43
    SolutionNameMin: Cijk_Ailk_Bljk_HBH_MT128x128x16_PGR1_PLR1_TT08_08
    SolutionIndex: 44
    SolutionNameMin: Cijk_Ailk_Bljk_HBH_MT064x128x16_PGR0_PLR0_TT04_08
    SolutionIndex: 45
    SolutionNameMin: Cijk_Ailk_Bljk_HBH_MT032x128x16_PGR0_PLR0_TT04_04
    SolutionIndex: 46
    SolutionNameMin: Cijk_Ailk_Bljk_HBH_MT064x064x04_PGR1_PLR1_TT04_04
    SolutionIndex: 47
    SolutionNameMin: Cijk_Ailk_Bljk_HBH_MT064x064x08_PGR1_PLR1_TT04_04
    SolutionIndex: 48
    SolutionNameMin: Cijk_Ailk_Bljk_HBH_MT064x064x16_PGR1_PLR1_TT04_04
    SolutionIndex: 49
    SolutionNameMin: Cijk_Ailk_Bljk_HBH_MT032x032x16_PGR1_PLR1_TT04_04
    SolutionIndex: 50
    SolutionNameMin: Cijk_Ailk_Bljk_HBH_MT064x016x16_PGR1_PLR1_TT04_04
    SolutionIndex: 51
    SolutionNameMin: Cijk_Ailk_Bljk_HBH_MT064x032x16_PGR1_PLR1_TT04_04
    SolutionIndex: 52
    SolutionNameMin: Cijk_Ailk_Bljk_HBH_MT032x032x32_PGR1_PLR1_TT04_04
    SolutionIndex: 53
    SolutionNameMin: Cijk_Ailk_Bljk_HBH_MT064x016x32_PGR1_PLR1_TT04_04
    SolutionIndex: 54
    SolutionNameMin: Cijk_Ailk_Bljk_HBH_MT064x032x32_PGR1_PLR1_TT04_04
    SolutionIndex: 55
    SolutionNameMin: Cijk_Ailk_Bljk_HBH_MT128x016x32_PGR1_PLR1_TT04_04
    SolutionIndex: 56
    SolutionNameMin: Cijk_Ailk_Bljk_HBH_MT128x032x32_PGR1_PLR1_TT04_04
    SolutionIndex: 57
    SolutionNameMin: Cijk_Ailk_Bljk_HBH_MT064x064x16_PGR1_PLR1_TT08_08
    SolutionIndex: 58
    SolutionNameMin: Cijk_Ailk_Bljk_HBH_MT128x128x16_PGR1_PLR1_TT08_08
    SolutionIndex: 59
    SolutionNameMin: Cijk_Ailk_Bljk_HBH_MT064x032x08_PGR1_PLR1_TT08_04
    SolutionIndex: 60
    SolutionNameMin: Cijk_Ailk_Bljk_HBH_MT064x064x08_PGR1_PLR1_TT08_08
    SolutionIndex: 61
    SolutionNameMin: Cijk_Ailk_Bljk_HBH_MT128x032x16_PGR1_PLR1_TT08_04
    SolutionIndex: 62
    SolutionNameMin: Cijk_Ailk_Bljk_HBH_MT032x032x16_PGR1_PLR1_TT04_04
    SolutionIndex: 63
    SolutionNameMin: Cijk_Ailk_Bljk_HBH_MT064x032x16_PGR1_PLR1_TT08_04
    SolutionIndex: 64
    SolutionNameMin: Cijk_Ailk_Bljk_HBH_MT064x064x16_PGR1_PLR1_TT04_04
    SolutionIndex: 65
    SolutionNameMin: Cijk_Ailk_Bljk_HBH_MT128x064x16_PGR1_PLR1_TT08_04
    SolutionIndex: 66
    SolutionNameMin: Cijk_Ailk_Bljk_HBH_MT128x128x16_PGR1_PLR1_TT08_08
    SolutionIndex: 67
    SolutionNameMin: Cijk_Ailk_Bljk_HBH_MT064x032x16_PGR1_PLR1_TT04_04
    SolutionIndex: 68
    SolutionNameMin: Cijk_Ailk_Bljk_HBH_MT128x064x32_PGR1_PLR1_TT08_04
    SolutionIndex: 69
    SolutionNameMin: Cijk_Ailk_Bljk_HBH_MT128x032x32_PGR1_PLR1_TT04_04
    SolutionIndex: 70
    SolutionNameMin: Cijk_Ailk_Bljk_HBH_MT064x016x32_PGR1_PLR1_TT04_04
    SolutionIndex: 71
    SolutionNameMin: Cijk_Ailk_Bljk_HBH_MT064x064x16_PGR1_PLR1_TT08_08
    SolutionIndex: 72
    SolutionNameMin: Cijk_Ailk_Bljk_HBH_MT128x128x16_PGR1_PLR1_TT08_08
    SolutionIndex: 73
    SolutionNameMin: Cijk_Ailk_Bljk_HBH_MT064x064x32_PGR1_PLR1_TT08_08
    SolutionIndex: 74
    SolutionNameMin: Cijk_Ailk_Bljk_HBH_MT128x128x32_PGR1_PLR1_TT08_08
    SolutionIndex: 75
    SolutionNameMin: Cijk_Ailk_Bljk_HBH_MT128x128x32_PGR0_PLR1_TT08_08
    SolutionIndex: 76
    SolutionNameMin: Cijk_Ailk_Bljk_HBH_MT064x128x16_PGR1_PLR1_TT04_08
    SolutionIndex: 77
    SolutionNameMin: Cijk_Ailk_Bljk_HBH_MT128x064x16_PGR1_PLR1_TT08_04
    SolutionIndex: 78
    SolutionNameMin: Cijk_Ailk_Bljk_HBH_MT128x128x16_PGR1_PLR1_TT08_08
    SolutionIndex: 79
    SolutionNameMin: Cijk_Ailk_Bljk_HBH_MT128x064x16_PGR1_PLR1_TT04_08
    SolutionIndex: 80
    SolutionNameMin: Cijk_Ailk_Bljk_HBH_MT128x064x16_PGR1_PLR1_TT04_08
    SolutionIndex: 81
    SolutionNameMin: Cijk_Ailk_Bljk_HBH_MT128x064x32_PGR1_PLR1_TT04_04
    SolutionIndex: 82
    SolutionNameMin: Cijk_Ailk_Bljk_HBH_MT256x128x32_PGR1_PLR1_TT08_08
    SolutionIndex: 83
    SolutionNameMin: Cijk_Ailk_Bljk_HBH_MT128x032x16_PGR0_PLR0_TT08_04
    SolutionIndex: 84
    SolutionNameMin: Cijk_Ailk_Bljk_HBH_MT128x064x16_PGR1_PLR0_TT08_04
    SolutionIndex: 85
    SolutionNameMin: Cijk_Ailk_Bljk_HBH_MT128x064x16_PGR1_PLR0_TT04_08
    SolutionIndex: 86
    SolutionNameMin: Cijk_Ailk_Bljk_HBH_MT064x064x04_PGR0_PLR0_TT04_04
    SolutionIndex: 87
    SolutionNameMin: Cijk_Ailk_Bljk_HBH_MT064x064x04_PGR0_PLR1_TT04_04
    SolutionIndex: 88
    SolutionNameMin: Cijk_Ailk_Bljk_HBH_MT064x128x08_PGR0_PLR0_TT04_08
    SolutionIndex: 89
    SolutionNameMin: Cijk_Ailk_Bljk_HBH_MT064x128x08_PGR1_PLR0_TT04_08
    SolutionIndex: 90
    SolutionNameMin: Cijk_Ailk_Bljk_HBH_MT064x128x08_PGR0_PLR1_TT04_08
    SolutionIndex: 91
    SolutionNameMin: Cijk_Ailk_Bljk_HBH_MT064x064x08_PGR1_PLR1_TT04_04
    SolutionIndex: 92
    SolutionNameMin: Cijk_Ailk_Bljk_HBH_MT064x128x16_PGR0_PLR0_TT04_08
    SolutionIndex: 93
    SolutionNameMin: Cijk_Ailk_Bljk_HBH_MT064x064x16_PGR0_PLR1_TT04_04
    SolutionIndex: 94
    SolutionNameMin: Cijk_Ailk_Bljk_HBH_MT128x128x04_PGR0_PLR0_TT08_08
    SolutionIndex: 95
    SolutionNameMin: Cijk_Ailk_Bljk_HBH_MT064x064x04_PGR0_PLR0_TT04_04
    SolutionIndex: 96
    SolutionNameMin: Cijk_Ailk_Bljk_HBH_MT064x064x04_PGR1_PLR0_TT04_04
    SolutionIndex: 97
    SolutionNameMin: Cijk_Ailk_Bljk_HBH_MT064x064x04_PGR0_PLR1_TT04_04
    SolutionIndex: 98
    SolutionNameMin: Cijk_Ailk_Bljk_HBH_MT064x064x04_PGR1_PLR1_TT04_04
    SolutionIndex: 99
    SolutionNameMin: Cijk_Ailk_Bljk_HBH_MT064x128x08_PGR1_PLR0_TT04_08
    SolutionIndex: 100
    SolutionNameMin: Cijk_Ailk_Bljk_HBH_MT064x128x08_PGR0_PLR1_TT04_08
    SolutionIndex: 101
    SolutionNameMin: Cijk_Ailk_Bljk_HBH_MT064x064x08_PGR1_PLR1_TT04_04
    SolutionIndex: 102
    SolutionNameMin: Cijk_Ailk_Bljk_HBH_MT128x128x16_PGR1_PLR0_TT08_08
    SolutionIndex: 103
    SolutionNameMin: Cijk_Ailk_Bljk_HBH_MT064x064x16_PGR1_PLR1_TT04_04
    SolutionIndex: 104
    SolutionNameMin: Cijk_Ailk_Bljk_HBH_MT128x064x16_EPS1_GRVW08_LPB00_PGR1_PLR1_SNLL1_TT08_08_VW08_WG16_08_01_WGM01
    SolutionIndex: 105
    SolutionNameMin: Cijk_Ailk_Bljk_HBH_MT064x128x16_EPS1_GRVW04_LPB04_PGR1_PLR1_SNLL1_TT08_04_VW04_WG08_32_01_WGM01
    SolutionIndex: 106
    SolutionNameMin: Cijk_Ailk_Bljk_HBH_MT128x064x16_EPS1_GRVW04_LPB04_PGR1_PLR1_SNLL1_TT08_04_VW04_WG16_16_01_WGM01
    SolutionIndex: 107
    SolutionNameMin: Cijk_Ailk_Bljk_HBH_MT128x128x16_EPS1_GRVW04_LPB04_PGR1_PLR1_SNLL1_TT08_08_VW04_WG16_16_01_WGM01
    SolutionIndex: 108
    SolutionNameMin: Cijk_Ailk_Bljk_HBH_MT064x128x16_EPS1_GRVW04_LPB04_PGR1_PLR1_SNLL1_TT08_04_VW04_WG08_32_01_WGM08
    SolutionIndex: 109
    SolutionNameMin: Cijk_Ailk_Bljk_HBH_MT128x064x16_EPS1_GRVW04_LPB04_PGR1_PLR1_SNLL1_TT08_04_VW04_WG16_16_01_WGM08
    SolutionIndex: 110
    SolutionNameMin: Cijk_Ailk_Bljk_HBH_MT256x064x16_EPS1_GRVW04_LPB04_PGR1_PLR1_SNLL1_TT08_08_VW04_WG32_08_01_WGM64
    SolutionIndex: 111
    SolutionNameMin: Cijk_Ailk_Bljk_HBH_MT064x128x32_EPS0_GRVW04_LPB04_PGR0_PLR0_SNLL0_TT08_04_VW04_WG08_32_01_WGM01
    SolutionIndex: 112
    SolutionNameMin: Cijk_Ailk_Bljk_HBH_MT064x064x32_EPS0_GRVW04_LPB04_PGR0_PLR0_SNLL0_TT04_04_VW04_WG16_16_01_WGM01
    SolutionIndex: 113
    SolutionNameMin: Cijk_Ailk_Bljk_HBH_MT128x064x32_EPS1_GRVW04_LPB04_PGR1_PLR1_SNLL1_TT08_04_VW04_WG16_16_01_WGM01
    SolutionIndex: 114
    SolutionNameMin: Cijk_Ailk_Bljk_HBH_MT064x064x32_EPS0_GRVW04_LPB04_PGR0_PLR0_SNLL0_TT04_04_VW04_WG16_16_01_WGM08
    SolutionIndex: 115
    SolutionNameMin: Cijk_Ailk_Bljk_HBH_MT128x064x32_EPS0_GRVW08_LPB08_PGR0_PLR1_SNLL0_TT08_08_VW08_WG16_08_01_WGM01
    SolutionIndex: 116
    SolutionNameMin: Cijk_Ailk_Bljk_HBH_MT64x64x16_SE_GRVW4_LRVW4_TT4_4_VW4_WG16_16_1_WGM8
    SolutionIndex: 117
    SolutionNameMin: Cijk_Ailk_Bljk_HBH_MT128x64x16_SE_GRVW4_LRVW4_TT8_4_VW4_WG16_16_1_WGM1
    SolutionIndex: 118
    SolutionNameMin: Cijk_Ailk_Bljk_HBH_MT128x64x16_SE_GRVW4_LRVW4_TT8_4_VW4_WG16_16_1_WGM8
    SolutionIndex: 119
    SolutionNameMin: Cijk_Ailk_Bljk_HBH_MT64x64x32_SE_GRVW4_LRVW4_TT4_4_VW4_WG16_16_1_WGM8
    SolutionIndex: 120
    SolutionNameMin: Cijk_Ailk_Bljk_HBH_MT64x64x32_SE_GRVW4_LRVW4_TT4_4_VW4_WG16_16_1_WGM1
    SolutionIndex: 121
    SolutionNameMin: Cijk_Ailk_Bljk_HBH_MT96x64x24_SE_GRVW2_LRVW2_TT6_4_VW2_WG16_16_1_WGM1
    SolutionIndex: 122
    SolutionNameMin: Cijk_Ailk_Bljk_HBH_MT96x64x24_SE_GRVW2_LRVW2_TT6_4_VW2_WG16_16_1_WGM8
- - - [1024, 1024, 1, 3328]
    - [19, 9231.92]
  - - [2944, 4288, 1, 1280]
    - [40, 10205.8]
  - - [2368, 64, 1, 3328]
    - [34, 4925.44]
  - - [2368, 5888, 1, 256]
    - [38, 9906.08]
  - - [256, 704, 1, 1280]
    - [19, 4055.67]
  - - [128, 6784, 1, 3328]
    - [23, 8287.11]
  - - [5888, 1856, 1, 3328]
    - [40, 10356.5]
  - - [5888, 2944, 1, 3328]
    - [40, 10362.5]
  - - [1856, 4288, 1, 256]
    - [37, 9603.07]
  - - [5056, 5056, 1, 3328]
    - [40, 10474.1]
  - - [1408, 5888, 1, 1280]
    - [42, 10182.3]
  - - [1024, 3584, 1, 3328]
    - [40, 10158.6]
  - - [448, 3584, 1, 3328]
    - [40, 8554.62]
  - - [256, 4288, 1, 3328]
    - [40, 7929.43]
  - - [5888, 1408, 1, 1280]
    - [42, 10183.9]
  - - [704, 1856, 1, 3328]
    - [40, 9428.57]
  - - [1024, 2368, 1, 256]
    - [42, 8555.09]
  - - [5056, 6784, 1, 1280]
    - [37, 10454.9]
  - - [1408, 64, 1, 1280]
    - [11, 3482.64]
  - - [448, 1024, 1, 1280]
    - [29, 7017.24]
  - - [5056, 5056, 1, 1280]
    - [40, 10399.7]
  - - [4288, 6784, 1, 256]
    - [38, 10079.9]
  - - [6784, 448, 1, 256]
    - [42, 9055.44]
  - - [5056, 256, 1, 1280]
    - [40, 9187.86]
  - - [5888, 704, 1, 1280]
    - [40, 9985.33]
  - - [3584, 1024, 1, 256]
    - [42, 9463.38]
  - - [6784, 4288, 1, 3328]
    - [40, 10521.3]
  - - [1856, 2368, 1, 3328]
    - [40, 10084.5]
  - - [5888, 2944, 1, 1280]
    - [37, 10272.9]
  - - [5888, 1024, 1, 256]
    - [37, 9675.93]
  - - [448, 64, 1, 1280]
    - [15, 1267.27]
  - - [1024, 704, 1, 256]
    - [16, 6886.17]
  - - [1408, 2944, 1, 256]
    - [42, 9461.12]
  - - [256, 1856, 1, 1280]
    - [19, 7260.91]
  - - [6784, 5056, 1, 3328]
    - [40, 10529.9]
  - - [5056, 5056, 1, 256]
    - [17, 10065.5]
  - - [256, 2944, 1, 3328]
    - [40, 8471.35]
  - - [64, 1024, 1, 1280]
    - [31, 2766.69]
  - - [1024, 3584, 1, 1280]
    - [40, 10032.5]
  - - [2368, 2944, 1, 1280]
    - [40, 10114.5]
  - - [128, 3584, 1, 1280]
    - [1, 7154.03]
  - - [6784, 6784, 1, 1280]
    - [42, 10484.1]
  - - [1024, 256, 1, 3328]
    - [29, 6220.87]
  - - [1408, 4288, 1, 1280]
    - [40, 9838.09]
  - - [3584, 4288, 1, 1280]
    - [40, 10335.5]
  - - [2368, 704, 1, 1280]
    - [40, 8745.31]
  - - [5056, 4288, 1, 3328]
    - [40, 10473.3]
  - - [3584, 2368, 1, 3328]
    - [40, 10204.8]
  - - [5888, 6784, 1, 1280]
    - [37, 10431.2]
  - - [64, 704, 1, 1280]
    - [33, 1902.1]
  - - [4288, 256, 1, 256]
    - [40, 7082.12]
  - - [6784, 448, 1, 1280]
    - [40, 9642.63]
  - - [2944, 5888, 1, 256]
    - [37, 9864.8]
  - - [256, 128, 1, 256]
    - [15, 970.904]
  - - [4288, 2944, 1, 256]
    - [37, 9764.67]
  - - [5888, 64, 1, 3328]
    - [23, 7264.23]
  - - [2944, 256, 1, 3328]
    - [19, 8494.3]
  - - [5056, 2368, 1, 1280]
    - [37, 10288.5]
  - - [448, 3584, 1, 1280]
    - [40, 8434.07]
  - - [6784, 5888, 1, 256]
    - [38, 10103.7]
  - - [64, 1024, 1, 3328]
    - [31, 2973.06]
  - - [704, 128, 1, 1280]
    - [11, 3525.16]
  - - [1408, 448, 1, 1280]
    - [19, 7018.49]
  - - [1024, 1408, 1, 256]
    - [37, 7886.73]
  - - [2368, 2368, 1, 3328]
    - [40, 10020.6]
  - - [5056, 704, 1, 3328]
    - [40, 9847.2]
  - - [1408, 1856, 1, 256]
    - [42, 9199.55]
  - - [1408, 256, 1, 1280]
    - [19, 5615.55]
  - - [5888, 1856, 1, 256]
    - [42, 9920.59]
  - - [704, 5888, 1, 256]
    - [38, 9447.64]
  - - [6784, 64, 1, 256]
    - [24, 5717.54]
  - - [3584, 704, 1, 3328]
    - [40, 9619.89]
  - - [1408, 1408, 1, 256]
    - [43, 8538.2]
  - - [1024, 64, 1, 1280]
    - [8, 2781.37]
  - - [448, 4288, 1, 256]
    - [20, 8251.38]
  - - [64, 3584, 1, 3328]
    - [27, 6054.59]
  - - [704, 2368, 1, 1280]
    - [40, 8753.92]
  - - [1856, 2368, 1, 1280]
    - [40, 9984.42]
  - - [2368, 128, 1, 3328]
    - [22, 6190.07]
  - - [1408, 1408, 1, 3328]
    - [40, 9317.67]
  - - [2944, 128, 1, 256]
    - [6, 5582.7]
  - - [448, 1408, 1, 256]
    - [40, 6079.85]
  - - [64, 5056, 1, 3328]
    - [5, 6592.13]
  - - [1408, 1024, 1, 1280]
    - [40, 8698.61]
  - - [704, 6784, 1, 256]
    - [37, 9245.61]
  - - [6784, 704, 1, 256]
    - [37, 9228.9]
  - - [256, 3584, 1, 3328]
    - [40, 8072.81]
  - - [5056, 704, 1, 256]
    - [17, 9170.82]
  - - [1408, 3584, 1, 256]
    - [42, 9339.54]
  - - [3584, 4288, 1, 3328]
    - [40, 10417.8]
  - - [5888, 1856, 1, 1280]
    - [42, 10284.1]
  - - [256, 1408, 1, 256]
    - [40, 4669.77]
  - - [5056, 64, 1, 1280]
    - [22, 6313.83]
  - - [2368, 128, 1, 256]
    - [5, 4731.52]
  - - [2368, 3584, 1, 1280]
    - [40, 10118.5]
  - - [1024, 256, 1, 256]
    - [19, 4559.03]
  - - [448, 448, 1, 256]
    - [10, 4039.33]
  - - [2944, 3584, 1, 3328]
    - [40, 10241.4]
  - - [256, 256, 1, 3328]
    - [12, 2979.56]
  - - [128, 1024, 1, 3328]
    - [11, 5105.43]
  - - [6784, 2944, 1, 256]
    - [38, 9908.66]
  - - [64, 1856, 1, 1280]
    - [11, 4349.07]
  - - [448, 256, 1, 256]
    - [12, 3033.07]
  - - [1856, 2368, 1, 256]
    - [37, 9413.67]
  - - [3584, 6784, 1, 3328]
    - [40, 10494.6]
  - - [256, 1024, 1, 256]
    - [19, 4634.59]
  - - [1024, 128, 1, 1280]
    - [11, 4766.25]
  - - [4288, 128, 1, 1280]
    - [3, 6969.7]
  - - [5056, 4288, 1, 1280]
    - [40, 10401.0]
  - - [5888, 64, 1, 256]
    - [6, 5661.33]
  - - [6784, 1856, 1, 3328]
    - [40, 10256.5]
  - - [1408, 5056, 1, 1280]
    - [40, 9972.14]
  - - [1856, 256, 1, 1280]
    - [19, 7281.78]
  - - [64, 5888, 1, 3328]
    - [5, 6636.84]
  - - [6784, 5888, 1, 3328]
    - [40, 10508.3]
  - - [448, 256, 1, 3328]
    - [11, 4484.04]
  - - [2368, 5056, 1, 1280]
    - [40, 10294.6]
  - - [1024, 704, 1, 1280]
    - [19, 7982.24]
  - - [256, 1408, 1, 3328]
    - [19, 5791.69]
  - - [6784, 128, 1, 3328]
    - [23, 8277.61]
  - - [1024, 5056, 1, 1280]
    - [40, 10047.0]
  - - [4288, 1024, 1, 256]
    - [37, 9379.79]
  - - [2368, 1408, 1, 256]
    - [37, 9166.03]
  - - [704, 704, 1, 3328]
    - [19, 7851.36]
  - - [5888, 448, 1, 1280]
    - [40, 9092.04]
  - - [3584, 256, 1, 3328]
    - [19, 8139.96]
  - - [704, 5888, 1, 3328]
    - [40, 10094.2]
  - - [1024, 6784, 1, 1280]
    - [40, 10077.9]
  - - [128, 3584, 1, 3328]
    - [1, 7388.36]
  - - [128, 704, 1, 1280]
    - [11, 3491.02]
  - - [3584, 2944, 1, 1280]
    - [40, 10159.5]
  - - [1856, 128, 1, 3328]
    - [32, 6274.81]
  - - [128, 2944, 1, 1280]
    - [6, 6986.46]
  - - [448, 1856, 1, 1280]
    - [19, 7257.97]
  - - [1408, 5056, 1, 3328]
    - [40, 10056.2]
  - - [1856, 1856, 1, 3328]
    - [40, 9540.06]
  - - [3584, 128, 1, 256]
    - [24, 5991.86]
  - - [448, 1408, 1, 3328]
    - [19, 7181.35]
  - - [2368, 2368, 1, 256]
    - [17, 9444.08]
  - - [4288, 4288, 1, 1280]
    - [37, 10295.8]
  - - [64, 448, 1, 1280]
    - [14, 1270.78]
  - - [5888, 1024, 1, 1280]
    - [40, 10224.6]
  - - [704, 1024, 1, 256]
    - [40, 6886.17]
  - - [704, 6784, 1, 3328]
    - [40, 9846.33]
  - - [5888, 5888, 1, 3328]
    - [40, 10487.0]
  - - [5056, 1024, 1, 1280]
    - [40, 10055.6]
  - - [448, 5888, 1, 3328]
    - [40, 9194.28]
  - - [1024, 2944, 1, 1280]
    - [40, 9555.18]
  - - [5056, 5888, 1, 1280]
    - [38, 10439.1]
  - - [448, 6784, 1, 256]
    - [41, 9030.22]
  - - [256, 3584, 1, 256]
    - [40, 7057.72]
  - - [256, 448, 1, 256]
    - [34, 3058.35]
  - - [3584, 5888, 1, 256]
    - [37, 9964.35]
  - - [2944, 3584, 1, 256]
    - [37, 9705.15]
  - - [1408, 704, 1, 256]
    - [42, 7588.38]
  - - [6784, 1024, 1, 3328]
    - [40, 10169.2]
  - - [6784, 2944, 1, 3328]
    - [40, 10396.9]
  - - [64, 64, 1, 3328]
    - [11, 189.748]
  - - [6784, 2368, 1, 1280]
    - [42, 10298.6]
  - - [4288, 3584, 1, 256]
    - [37, 9895.03]
  - - [4288, 5888, 1, 1280]
    - [40, 10378.3]
  - - [448, 2944, 1, 3328]
    - [40, 8086.49]
  - - [4288, 1856, 1, 1280]
    - [40, 10082.9]
  - - [1856, 2944, 1, 3328]
    - [40, 10223.3]
  - - [256, 6784, 1, 3328]
    - [40, 9236.39]
  - - [64, 5888, 1, 256]
    - [18, 5407.45]
  - - [5056, 1024, 1, 256]
    - [38, 9582.13]
  - - [704, 64, 1, 3328]
    - [35, 2068.81]
  - - [5056, 1856, 1, 3328]
    - [40, 10358.6]
  - - [448, 448, 1, 3328]
    - [27, 5324.8]
  - - [448, 2368, 1, 1280]
    - [40, 7540.59]
  - - [1408, 128, 1, 1280]
    - [5, 5252.43]
  - - [5056, 256, 1, 3328]
    - [40, 9349.62]
  - - [704, 704, 1, 256]
    - [19, 6318.61]
  - - [1024, 5888, 1, 1280]
    - [40, 10225.7]
  - - [64, 128, 1, 256]
    - [2, 216.659]
  - - [128, 1856, 1, 1280]
    - [13, 5948.55]
  - - [5056, 3584, 1, 256]
    - [38, 9980.43]
  - - [1856, 1024, 1, 1280]
    - [40, 8821.8]
  - - [1856, 1856, 1, 1280]
    - [40, 9431.18]
  - - [128, 4288, 1, 3328]
    - [3, 7099.75]
  - - [1856, 1024, 1, 3328]
    - [40, 8937.69]
  - - [256, 2368, 1, 256]
    - [40, 5896.25]
  - - [1024, 448, 1, 3328]
    - [19, 7261.84]
  - - [1856, 704, 1, 1280]
    - [40, 9254.53]
  - - [6784, 1024, 1, 256]
    - [37, 9590.11]
  - - [5056, 5888, 1, 3328]
    - [40, 10492.0]
  - - [1856, 1024, 1, 256]
    - [20, 8174.38]
  - - [5056, 1408, 1, 3328]
    - [40, 10060.3]
  - - [1024, 1024, 1, 1280]
    - [19, 9034.58]
  - - [448, 5888, 1, 256]
    - [37, 8526.3]
  - - [1408, 6784, 1, 3328]
    - [40, 10265.0]
  - - [2944, 1408, 1, 3328]
    - [40, 10091.2]
  - - [2944, 4288, 1, 3328]
    - [40, 10280.8]
  - - [256, 2944, 1, 256]
    - [40, 7199.18]
  - - [5056, 2944, 1, 256]
    - [37, 9919.12]
  - - [2368, 1856, 1, 256]
    - [37, 9407.41]
  - - [128, 6784, 1, 1280]
    - [6, 8139.21]
  - - [1408, 3584, 1, 3328]
    - [40, 9900.27]
  - - [2368, 6784, 1, 256]
    - [38, 9970.23]
  - - [4288, 2368, 1, 3328]
    - [40, 10360.5]
  - - [704, 3584, 1, 1280]
    - [40, 9501.11]
  - - [1408, 5888, 1, 3328]
    - [40, 10271.9]
  - - [1856, 5056, 1, 256]
    - [17, 9835.79]
  - - [6784, 6784, 1, 256]
    - [38, 10190.5]
  - - [1408, 704, 1, 3328]
    - [40, 8714.14]
  - - [128, 5888, 1, 1280]
    - [0, 8310.56]
  - - [2368, 4288, 1, 1280]
    - [40, 10279.3]
  - - [3584, 1856, 1, 1280]
    - [40, 10009.5]
  - - [704, 1408, 1, 3328]
    - [40, 8714.14]
  - - [704, 64, 1, 1280]
    - [14, 1897.09]
  - - [3584, 448, 1, 256]
    - [40, 7749.66]
  - - [3584, 3584, 1, 1280]
    - [40, 10378.3]
  - - [256, 6784, 1, 256]
    - [37, 8332.01]
  - - [1856, 3584, 1, 3328]
    - [40, 10106.3]
  - - [128, 448, 1, 256]
    - [31, 1683.49]
  - - [3584, 3584, 1, 256]
    - [37, 9923.77]
  - - [6784, 4288, 1, 1280]
    - [37, 10453.6]
  - - [448, 704, 1, 1280]
    - [19, 4932.82]
  - - [3584, 5056, 1, 256]
    - [42, 9970.14]
  - - [6784, 128, 1, 256]
    - [6, 7198.77]
  - - [64, 1408, 1, 3328]
    - [11, 3790.35]
  - - [704, 448, 1, 256]
    - [19, 4102.66]
  - - [2944, 2368, 1, 1280]
    - [40, 10110.8]
  - - [448, 64, 1, 3328]
    - [36, 1390.16]
  - - [6784, 3584, 1, 256]
    - [38, 10018.6]
  - - [256, 1856, 1, 3328]
    - [29, 7593.43]
  - - [256, 704, 1, 256]
    - [19, 3134.33]
  - - [128, 1408, 1, 256]
    - [5, 3819.32]
  - - [64, 128, 1, 3328]
    - [34, 379.921]
  - - [1856, 1408, 1, 256]
    - [38, 9159.25]
  - - [2944, 2944, 1, 3328]
    - [40, 10119.4]
  - - [5056, 6784, 1, 256]
    - [38, 10104.0]
  - - [1408, 4288, 1, 3328]
    - [40, 9919.46]
  - - [6784, 256, 1, 1280]
    - [40, 9104.63]
  - - [1024, 704, 1, 3328]
    - [19, 8113.99]
  - - [2368, 704, 1, 3328]
    - [40, 8870.59]
  - - [128, 4288, 1, 256]
    - [3, 6056.43]
  - - [3584, 6784, 1, 256]
    - [37, 10010.9]
  - - [128, 128, 1, 3328]
    - [14, 795.303]
  - - [5056, 1856, 1, 256]
    - [17, 9845.46]
  - - [704, 4288, 1, 256]
    - [17, 8952.74]
  - - [256, 448, 1, 3328]
    - [11, 4492.49]
  - - [1408, 6784, 1, 1280]
    - [40, 10169.7]
  - - [64, 2368, 1, 1280]
    - [11, 4609.95]
  - - [64, 6784, 1, 3328]
    - [1, 6899.07]
  - - [2944, 256, 1, 1280]
    - [40, 8276.34]
  - - [5056, 2368, 1, 3328]
    - [40, 10374.6]
  - - [2944, 4288, 1, 256]
    - [37, 9759.95]
  - - [1408, 3584, 1, 1280]
    - [40, 9802.18]
  - - [2368, 64, 1, 256]
    - [11, 3439.48]
  - - [256, 256, 1, 256]
    - [12, 1872.46]
  - - [704, 128, 1, 3328]
    - [11, 3794.19]
  - - [1856, 704, 1, 256]
    - [16, 8279.6]
  - - [2368, 6784, 1, 3328]
    - [40, 10367.1]
  - - [5056, 704, 1, 1280]
    - [40, 9750.2]
  - - [1856, 4288, 1, 3328]
    - [40, 10171.9]
  - - [1408, 5888, 1, 256]
    - [38, 9792.93]
  - - [704, 2944, 1, 1280]
    - [40, 9589.73]
  - - [4288, 64, 1, 1280]
    - [25, 5441.03]
  - - [704, 1856, 1, 256]
    - [37, 8279.6]
  - - [3584, 704, 1, 1280]
    - [40, 9507.84]
  - - [5888, 5056, 1, 256]
    - [39, 10114.0]
  - - [3584, 448, 1, 3328]
    - [40, 8550.23]
  - - [704, 2368, 1, 3328]
    - [40, 8871.73]
  - - [2944, 448, 1, 256]
    - [40, 7289.32]
  - - [448, 5056, 1, 3328]
    - [40, 9533.37]
  - - [2368, 128, 1, 1280]
    - [5, 5957.82]
  - - [4288, 448, 1, 256]
    - [20, 8240.32]
  - - [64, 6784, 1, 256]
    - [1, 5741.17]
  - - [64, 5056, 1, 1280]
    - [5, 6329.27]
  - - [5888, 2368, 1, 256]
    - [42, 9892.9]
  - - [704, 448, 1, 3328]
    - [19, 5085.4]
  - - [6784, 704, 1, 3328]
    - [40, 9847.8]
  - - [128, 64, 1, 1280]
    - [26, 338.687]
  - - [2368, 256, 1, 1280]
    - [19, 6735.64]
  - - [1408, 2944, 1, 3328]
    - [40, 10087.1]
  - - [64, 1024, 1, 256]
    - [12, 1889.33]
  - - [2368, 448, 1, 1280]
    - [19, 7584.37]
  - - [128, 3584, 1, 256]
    - [1, 5943.35]
  - - [1856, 448, 1, 3328]
    - [19, 7376.83]
  - - [128, 5056, 1, 256]
    - [6, 6903.13]
  - - [4288, 4288, 1, 256]
    - [37, 9878.84]
  - - [2368, 704, 1, 256]
    - [37, 8022.0]
  - - [3584, 2368, 1, 256]
    - [37, 9644.24]
  - - [5888, 5056, 1, 1280]
    - [42, 10444.2]
  - - [128, 1024, 1, 1280]
    - [11, 4733.98]
  - - [64, 704, 1, 256]
    - [9, 1310.72]
  - - [4288, 256, 1, 1280]
    - [40, 7813.01]
  - - [3584, 3584, 1, 3328]
    - [40, 10460.7]
  - - [128, 1024, 1, 256]
    - [34, 3302.6]
  - - [5888, 6784, 1, 256]
    - [38, 10098.1]
  - - [4288, 2944, 1, 3328]
    - [40, 10283.8]
  - - [1856, 64, 1, 256]
    - [11, 3115.65]
  - - [4288, 128, 1, 3328]
    - [3, 7095.33]
  - - [256, 5056, 1, 1280]
    - [40, 9151.32]
  - - [6784, 5888, 1, 1280]
    - [40, 10437.8]
  - - [704, 128, 1, 256]
    - [12, 2363.59]
  - - [5888, 4288, 1, 1280]
    - [40, 10379.9]
  - - [448, 256, 1, 1280]
    - [11, 4218.41]
  - - [448, 2368, 1, 3328]
    - [40, 7672.47]
  - - [1, 1, 1, 1280]
    - [48, 0.00964436]
  - - [256, 1408, 1, 1280]
    - [19, 5632.0]
  - - [1408, 1856, 1, 1280]
    - [40, 9833.5]
  - - [5888, 448, 1, 3328]
    - [40, 9199.67]
  - - [704, 5888, 1, 1280]
    - [40, 9971.82]
  - - [256, 64, 1, 3328]
    - [35, 793.451]
  - - [128, 2368, 1, 256]
    - [5, 4801.65]
  - - [6784, 64, 1, 3328]
    - [24, 6997.97]
  - - [5056, 2944, 1, 3328]
    - [40, 10438.5]
  - - [448, 128, 1, 256]
    - [31, 1699.08]
  - - [1856, 128, 1, 1280]
    - [32, 5985.97]
  - - [448, 4288, 1, 1280]
    - [40, 8919.45]
  - - [64, 3584, 1, 256]
    - [10, 4475.63]
  - - [128, 2944, 1, 3328]
    - [23, 7250.81]
  - - [3584, 704, 1, 256]
    - [42, 8853.11]
  - - [2944, 448, 1, 3328]
    - [40, 8096.04]
  - - [3584, 1408, 1, 3328]
    - [40, 9900.27]
  - - [2368, 1024, 1, 1280]
    - [40, 9128.79]
  - - [2944, 6784, 1, 1280]
    - [40, 10317.5]
  - - [1856, 6784, 1, 256]
    - [37, 9744.04]
  - - [4288, 448, 1, 3328]
    - [40, 9035.02]
  - - [6784, 704, 1, 1280]
    - [40, 9748.07]
  - - [5888, 1024, 1, 3328]
    - [40, 10321.4]
  - - [704, 6784, 1, 1280]
    - [40, 9745.58]
  - - [5888, 128, 1, 256]
    - [19, 7220.73]
  - - [5056, 1024, 1, 3328]
    - [40, 10153.6]
  - - [704, 5056, 1, 1280]
    - [40, 9731.87]
  - - [64, 704, 1, 3328]
    - [14, 2068.8]
  - - [2944, 1856, 1, 256]
    - [37, 9575.58]
  - - [5056, 64, 1, 256]
    - [5, 5051.07]
  - - [5888, 5056, 1, 3328]
    - [42, 10498.2]
  - - [128, 5056, 1, 3328]
    - [6, 8281.22]
  - - [3584, 6784, 1, 1280]
    - [37, 10422.3]
  - - [1856, 5888, 1, 256]
    - [38, 9912.15]
  - - [64, 448, 1, 3328]
    - [36, 1395.05]
  - - [4288, 4288, 1, 3328]
    - [40, 10373.2]
  - - [4288, 1408, 1, 1280]
    - [40, 9836.09]
  - - [64, 1856, 1, 256]
    - [11, 3040.87]
  - - [4288, 2368, 1, 256]
    - [37, 9807.67]
  - - [2944, 5056, 1, 1280]
    - [37, 10356.5]
  - - [256, 4288, 1, 1280]
    - [40, 7809.54]
  - - [6784, 2368, 1, 3328]
    - [40, 10369.9]
  - - [256, 1024, 1, 1280]
    - [19, 5899.16]
  - - [4288, 128, 1, 256]
    - [3, 6014.95]
  - - [4288, 1856, 1, 3328]
    - [40, 10179.4]
  - - [1856, 2944, 1, 1280]
    - [40, 10117.5]
  - - [3584, 64, 1, 1280]
    - [13, 5761.41]
  - - [4288, 6784, 1, 3328]
    - [40, 10529.9]
  - - [3584, 1024, 1, 1280]
    - [40, 10037.7]
  - - [1024, 4288, 1, 256]
    - [37, 9373.53]
  - - [5888, 3584, 1, 3328]
    - [40, 10447.6]
  - - [5056, 3584, 1, 3328]
    - [40, 10371.9]
  - - [1408, 128, 1, 3328]
    - [5, 5541.26]
  - - [2368, 1408, 1, 1280]
    - [40, 9790.12]
  - - [5056, 2944, 1, 1280]
    - [37, 10358.8]
  - - [3584, 256, 1, 256]
    - [40, 7074.73]
  - - [1024, 6784, 1, 256]
    - [37, 9561.21]
  - - [2944, 5056, 1, 3328]
    - [40, 10442.9]
  - - [3584, 2944, 1, 256]
    - [37, 9719.12]
  - - [448, 128, 1, 3328]
    - [12, 2604.27]
  - - [64, 2944, 1, 3328]
    - [22, 5806.03]
  - - [64, 4288, 1, 3328]
    - [25, 5693.95]
  - - [5056, 6784, 1, 3328]
    - [40, 10526.2]
  - - [128, 2944, 1, 256]
    - [6, 5661.33]
  - - [3584, 4288, 1, 256]
    - [37, 9908.99]
  - - [1856, 6784, 1, 3328]
    - [40, 10257.1]
  - - [3584, 128, 1, 3328]
    - [24, 7354.19]
  - - [128, 256, 1, 1280]
    - [15, 1464.49]
  - - [64, 448, 1, 256]
    - [15, 873.813]
  - - [64, 256, 1, 1280]
    - [14, 728.178]
  - - [5056, 1408, 1, 1280]
    - [42, 9962.55]
  - - [5888, 5888, 1, 256]
    - [38, 10068.0]
  - - [4288, 1024, 1, 1280]
    - [40, 9977.95]
  - - [5888, 128, 1, 3328]
    - [0, 8494.3]
  - - [448, 6784, 1, 3328]
    - [40, 9751.06]
  - - [2944, 1408, 1, 1280]
    - [40, 9979.32]
  - - [64, 128, 1, 1280]
    - [11, 337.82]
  - - [2944, 1856, 1, 3328]
    - [40, 10220.6]
  - - [448, 5056, 1, 256]
    - [37, 8753.96]
  - - [64, 64, 1, 256]
    - [2, 109.227]
  - - [3584, 5888, 1, 1280]
    - [37, 10372.1]
  - - [6784, 1856, 1, 1280]
    - [37, 10176.2]
  - - [5888, 256, 1, 3328]
    - [40, 9232.18]
  - - [1856, 5888, 1, 3328]
    - [40, 10362.4]
  - - [3584, 1408, 1, 256]
    - [42, 9328.75]
  - - [704, 3584, 1, 3328]
    - [40, 9622.54]
  - - [5056, 448, 1, 1280]
    - [40, 9410.92]
  - - [3584, 1856, 1, 3328]
    - [40, 10106.3]
  - - [1408, 704, 1, 1280]
    - [19, 8549.71]
  - - [2944, 1024, 1, 256]
    - [42, 9015.79]
  - - [448, 1408, 1, 1280]
    - [19, 7028.23]
  - - [2368, 4288, 1, 3328]
    - [40, 10356.7]
  - - [1024, 1408, 1, 1280]
    - [40, 8701.9]
  - - [256, 128, 1, 1280]
    - [15, 1448.31]
  - - [704, 1408, 1, 1280]
    - [19, 8545.1]
  - - [6784, 5056, 1, 256]
    - [39, 10082.7]
  - - [4288, 5888, 1, 256]
    - [38, 9994.17]
  - - [448, 2944, 1, 256]
    - [37, 7340.03]
  - - [2944, 6784, 1, 256]
    - [37, 9896.38]
  - - [2368, 2368, 1, 1280]
    - [40, 9922.47]
  - - [1856, 3584, 1, 1280]
    - [40, 10013.2]
  - - [64, 2944, 1, 256]
    - [5, 3966.65]
  - - [3584, 1408, 1, 1280]
    - [40, 9800.98]
  - - [5056, 3584, 1, 1280]
    - [42, 10305.4]
  - - [256, 5888, 1, 256]
    - [42, 8245.21]
  - - [128, 256, 1, 3328]
    - [15, 1596.19]
  - - [1856, 1408, 1, 3328]
    - [40, 9965.29]
  - - [1024, 4288, 1, 3328]
    - [40, 10077.4]
  - - [448, 2368, 1, 256]
    - [40, 6858.11]
  - - [64, 1408, 1, 1280]
    - [11, 3533.86]
  - - [64, 6784, 1, 1280]
    - [24, 6810.6]
  - - [2944, 2368, 1, 3328]
    - [40, 10210.6]
  - - [704, 4288, 1, 3328]
    - [40, 9683.86]
  - - [1024, 1856, 1, 1280]
    - [40, 8821.8]
  - - [6784, 1856, 1, 256]
    - [37, 9739.33]
  - - [128, 2368, 1, 3328]
    - [5, 6202.25]
  - - [1024, 5888, 1, 256]
    - [37, 9651.76]
  - - [64, 2944, 1, 1280]
    - [22, 5441.62]
  - - [5056, 64, 1, 3328]
    - [22, 6595.34]
  - - [1408, 2368, 1, 256]
    - [37, 9142.47]
  - - [2944, 704, 1, 3328]
    - [40, 9743.39]
  - - [256, 64, 1, 256]
    - [14, 489.989]
  - - [2944, 2944, 1, 1280]
    - [42, 10039.4]
  - - [6784, 256, 1, 3328]
    - [40, 9241.11]
  - - [1408, 5056, 1, 256]
    - [42, 9571.56]
  - - [5056, 128, 1, 3328]
    - [23, 8263.43]
  - - [128, 128, 1, 1280]
    - [14, 728.178]
  - - [448, 704, 1, 256]
    - [40, 4119.41]
  - - [1856, 256, 1, 3328]
    - [29, 7495.53]
  - - [2944, 128, 1, 3328]
    - [23, 7230.72]
  - - [704, 256, 1, 256]
    - [19, 3203.98]
  - - [256, 448, 1, 1280]
    - [11, 4208.79]
  - - [704, 256, 1, 1280]
    - [30, 4096.0]
  - - [64, 2368, 1, 3328]
    - [34, 4933.15]
  - - [256, 704, 1, 3328]
    - [29, 4286.63]
  - - [1024, 1024, 1, 256]
    - [19, 7951.29]
  - - [1408, 4288, 1, 256]
    - [42, 9410.62]
  - - [5888, 2368, 1, 1280]
    - [42, 10247.8]
  - - [128, 256, 1, 256]
    - [9, 953.251]
  - - [256, 64, 1, 1280]
    - [14, 726.161]
  - - [2368, 5888, 1, 1280]
    - [37, 10235.1]
  - - [5888, 256, 1, 1280]
    - [40, 9080.31]
  - - [704, 1024, 1, 1280]
    - [40, 7921.93]
  - - [2368, 1856, 1, 3328]
    - [40, 10095.1]
  - - [2944, 704, 1, 256]
    - [20, 8890.41]
  - - [2368, 6784, 1, 1280]
    - [38, 10293.7]
  - - [2368, 1024, 1, 3328]
    - [40, 9250.18]
  - - [1856, 4288, 1, 1280]
    - [40, 10084.5]
  - - [704, 3584, 1, 256]
    - [37, 8833.74]
  - - [704, 2944, 1, 3328]
    - [40, 9740.1]
  - - [1856, 5056, 1, 3328]
    - [40, 10359.4]
  - - [3584, 5056, 1, 1280]
    - [42, 10309.8]
  - - [2944, 1024, 1, 3328]
    - [40, 9672.21]
  - - [256, 4288, 1, 256]
    - [40, 7067.87]
  - - [2368, 256, 1, 256]
    - [40, 5914.22]
  - - [1408, 6784, 1, 256]
    - [37, 9703.51]
  - - [6784, 1408, 1, 3328]
    - [40, 10265.0]
  - - [1024, 2368, 1, 1280]
    - [40, 9141.7]
  - - [704, 64, 1, 256]
    - [11, 1322.74]
  - - [256, 2368, 1, 3328]
    - [19, 6916.7]
  - - [6784, 2944, 1, 1280]
    - [40, 10319.8]
  - - [3584, 448, 1, 1280]
    - [40, 8428.51]
  - - [2944, 6784, 1, 3328]
    - [40, 10398.6]
  - - [448, 5056, 1, 1280]
    - [40, 9408.48]
  - - [4288, 5056, 1, 1280]
    - [37, 10402.5]
  - - [128, 448, 1, 1280]
    - [31, 2420.85]
  - - [4288, 704, 1, 256]
    - [17, 8969.37]
  - - [64, 64, 1, 1280]
    - [31, 179.06]
  - - [5888, 704, 1, 256]
    - [42, 9467.87]
  - - [256, 5888, 1, 3328]
    - [40, 9233.54]
  - - [6784, 4288, 1, 256]
    - [39, 10061.3]
  - - [5888, 256, 1, 256]
    - [37, 8217.12]
  - - [6784, 1024, 1, 1280]
    - [40, 10077.9]
  - - [704, 448, 1, 1280]
    - [19, 4942.48]
  - - [128, 64, 1, 3328]
    - [11, 379.921]
  - - [448, 64, 1, 256]
    - [34, 873.813]
  - - [2944, 704, 1, 1280]
    - [40, 9598.05]
  - - [6784, 3584, 1, 1280]
    - [37, 10419.5]
  - - [2944, 64, 1, 1280]
    - [5, 5471.24]
  - - [1408, 2944, 1, 1280]
    - [40, 9985.33]
  - - [256, 1856, 1, 256]
    - [40, 6009.63]
  - - [1408, 2368, 1, 3328]
    - [40, 9907.19]
  - - [128, 1408, 1, 3328]
    - [5, 5561.81]
  - - [2368, 2944, 1, 256]
    - [37, 9615.71]
  - - [64, 5056, 1, 256]
    - [5, 4978.22]
  - - [1408, 256, 1, 3328]
    - [29, 5776.07]
  - - [3584, 1856, 1, 256]
    - [42, 9592.65]
  - - [4288, 3584, 1, 1280]
    - [37, 10336.8]
  - - [2368, 448, 1, 256]
    - [19, 6885.93]
  - - [4288, 256, 1, 3328]
    - [40, 7934.94]
  - - [1408, 64, 1, 256]
    - [12, 2402.99]
  - - [4288, 2944, 1, 1280]
    - [40, 10206.3]
  - - [5056, 448, 1, 3328]
    - [40, 9539.16]
  - - [1024, 64, 1, 256]
    - [12, 1889.33]
  - - [64, 2368, 1, 256]
    - [11, 3391.37]
  - - [4288, 5056, 1, 3328]
    - [40, 10478.7]
  - - [2944, 256, 1, 256]
    - [16, 7135.28]
  - - [1024, 128, 1, 3328]
    - [34, 5076.9]
  - - [256, 5056, 1, 3328]
    - [40, 9341.52]
  - - [5056, 2368, 1, 256]
    - [17, 9915.22]
  - - [4288, 704, 1, 3328]
    - [40, 9682.37]
  - - [448, 3584, 1, 256]
    - [37, 7749.66]
  - - [2368, 64, 1, 1280]
    - [11, 4609.95]
  - - [1024, 1408, 1, 3328]
    - [40, 8838.59]
  - - [2944, 5888, 1, 1280]
    - [37, 10277.5]
  - - [5888, 3584, 1, 256]
    - [38, 9952.6]
  - - [1408, 1856, 1, 3328]
    - [40, 9969.86]
  - - [6784, 1408, 1, 1280]
    - [40, 10179.2]
  - - [704, 2944, 1, 256]
    - [20, 8866.64]
  - - [4288, 64, 1, 256]
    - [4, 4435.26]
  - - [2944, 5888, 1, 3328]
    - [40, 10357.6]
  - - [64, 4288, 1, 1280]
    - [4, 5481.79]
  - - [6784, 64, 1, 1280]
    - [1, 6810.6]
  - - [704, 1856, 1, 1280]
    - [40, 9262.73]
  - - [1408, 64, 1, 3328]
    - [11, 3778.89]
  - - [1408, 1408, 1, 1280]
    - [40, 9204.72]
  - - [448, 1024, 1, 3328]
    - [29, 7272.91]
  - - [448, 4288, 1, 3328]
    - [40, 9034.0]
  - - [704, 2368, 1, 256]
    - [37, 8058.35]
  - - [2944, 448, 1, 1280]
    - [19, 7996.45]
  - - [5888, 2368, 1, 3328]
    - [40, 10315.2]
  - - [4288, 5056, 1, 256]
    - [37, 9985.11]
  - - [4288, 448, 1, 1280]
    - [40, 8909.11]
  - - [5888, 704, 1, 3328]
    - [40, 10088.9]
  - - [4288, 3584, 1, 3328]
    - [40, 10417.3]
  - - [2944, 64, 1, 256]
    - [5, 3966.65]
  - - [1024, 6784, 1, 3328]
    - [40, 10171.3]
  - - [1408, 1024, 1, 256]
    - [40, 7927.38]
  - - [448, 1024, 1, 256]
    - [40, 5872.03]
  - - [6784, 6784, 1, 3328]
    - [42, 10535.5]
  - - [1024, 448, 1, 1280]
    - [29, 7050.94]
  - - [704, 5056, 1, 3328]
    - [40, 9853.75]
  - - [256, 2368, 1, 1280]
    - [19, 6749.71]
  - - [3584, 5056, 1, 3328]
    - [42, 10366.7]
  - - [2368, 2944, 1, 3328]
    - [40, 10203.7]
  - - [448, 448, 1, 1280]
    - [27, 5057.11]
  - - [2368, 3584, 1, 256]
    - [37, 9657.96]
  - - [1024, 256, 1, 1280]
    - [40, 5890.88]
  - - [128, 5056, 1, 1280]
    - [6, 8089.6]
  - - [3584, 2368, 1, 1280]
    - [40, 10126.1]
  - - [1856, 1856, 1, 256]
    - [42, 8875.33]
  - - [4288, 1408, 1, 3328]
    - [40, 9923.77]
  - - [3584, 64, 1, 3328]
    - [27, 6066.14]
  - - [1, 1, 1, 1]
    - [46, 9.12409e-05]
  - - [256, 1024, 1, 3328]
    - [29, 6210.27]
  - - [1856, 64, 1, 3328]
    - [11, 4644.19]
  - - [5888, 1408, 1, 3328]
    - [40, 10274.9]
  - - [256, 5056, 1, 256]
    - [37, 8185.52]
  - - [1856, 64, 1, 1280]
    - [34, 4359.05]
  - - [1408, 256, 1, 256]
    - [40, 4669.77]
  - - [2368, 5056, 1, 256]
    - [17, 9912.65]
  - - [128, 5888, 1, 3328]
    - [40, 8471.35]
  - - [1024, 5056, 1, 256]
    - [42, 9576.59]
  - - [2368, 1408, 1, 3328]
    - [40, 9902.24]
  - - [5888, 448, 1, 256]
    - [37, 8526.3]
  - - [6784, 5056, 1, 1280]
    - [40, 10451.5]
  - - [4288, 6784, 1, 1280]
    - [37, 10455.5]
  - - [2368, 448, 1, 3328]
    - [40, 7671.13]
  - - [1024, 128, 1, 256]
    - [12, 3355.44]
  - - [448, 128, 1, 1280]
    - [12, 2433.7]
  - - [1024, 64, 1, 3328]
    - [31, 2976.31]
  - - [64, 3584, 1, 1280]
    - [27, 5752.38]
  - - [6784, 1408, 1, 256]
    - [37, 9706.59]
  - - [5888, 4288, 1, 256]
    - [37, 9969.51]
  - - [5056, 5888, 1, 256]
    - [38, 10134.4]
  - - [2368, 1024, 1, 256]
    - [37, 8526.88]
  - - [1856, 6784, 1, 1280]
    - [37, 10169.0]
  - - [3584, 128, 1, 1280]
    - [24, 7161.01]
  - - [128, 64, 1, 256]
    - [2, 216.648]
  - - [1408, 448, 1, 256]
    - [40, 6098.21]
  - - [64, 256, 1, 3328]
    - [14, 794.382]
  - - [6784, 448, 1, 3328]
    - [40, 9745.05]
  - - [5056, 1856, 1, 1280]
    - [40, 10275.3]
  - - [1408, 1024, 1, 3328]
    - [40, 8838.59]
  - - [2368, 256, 1, 3328]
    - [19, 6914.81]
  - - [5888, 3584, 1, 1280]
    - [37, 10370.5]
  - - [5888, 128, 1, 1280]
    - [19, 8304.84]
  - - [1024, 2944, 1, 256]
    - [42, 8965.52]
  - - [448, 6784, 1, 1280]
    - [40, 9633.09]
  - - [256, 3584, 1, 1280]
    - [19, 7965.31]
  - - [704, 5056, 1, 256]
    - [17, 9163.49]
  - - [3584, 1024, 1, 3328]
    - [40, 10156.5]
  - - [2944, 1856, 1, 1280]
    - [40, 10115.1]
  - - [5056, 256, 1, 256]
    - [16, 8234.34]
  - - [128, 5888, 1, 256]
    - [0, 7199.18]
  - - [2368, 3584, 1, 3328]
    - [40, 10205.7]
  - - [3584, 5888, 1, 3328]
    - [40, 10445.7]
  - - [2944, 3584, 1, 1280]
    - [40, 10163.2]
  - - [1856, 5888, 1, 1280]
    - [40, 10268.4]
  - - [256, 256, 1, 1280]
    - [31, 2744.96]
  - - [4288, 1408, 1, 256]
    - [38, 9392.35]
  - - [3584, 64, 1, 256]
    - [21, 4475.63]
  - - [64, 1856, 1, 3328]
    - [11, 4639.83]
  - - [1408, 128, 1, 256]
    - [22, 3844.78]
  - - [4288, 2368, 1, 1280]
    - [40, 10265.6]
  - - [2944, 5056, 1, 256]
    - [37, 9919.14]
  - - [256, 128, 1, 3328]
    - [15, 1596.19]
  - - [6784, 2368, 1, 256]
    - [39, 9949.0]
  - - [1408, 448, 1, 3328]
    - [19, 7197.11]
  - - [4288, 1856, 1, 256]
    - [37, 9613.93]
  - - [1856, 2944, 1, 256]
    - [37, 9570.37]
  - - [64, 5888, 1, 1280]
    - [18, 6669.59]
  - - [1856, 1408, 1, 1280]
    - [40, 9819.66]
  - - [128, 704, 1, 256]
    - [8, 2383.13]
  - - [1024, 4288, 1, 1280]
    - [40, 9972.28]
  - - [2368, 5056, 1, 3328]
    - [40, 10382.1]
  - - [4288, 1024, 1, 3328]
    - [40, 10081.8]
  - - [1024, 5056, 1, 3328]
    - [40, 10156.0]
  - - [1024, 1856, 1, 3328]
    - [40, 8935.67]
  - - [704, 704, 1, 1280]
    - [19, 7602.93]
  - - [128, 2368, 1, 1280]
    - [5, 5957.82]
  - - [3584, 256, 1, 1280]
    - [19, 7978.3]
  - - [5888, 64, 1, 1280]
    - [23, 6978.37]
  - - [128, 704, 1, 3328]
    - [34, 3778.89]
  - - [3584, 2944, 1, 3328]
    - [40, 10245.7]
  - - [128, 1856, 1, 256]
    - [21, 4552.2]
  - - [64, 4288, 1, 256]
    - [4, 4412.98]
  - - [5888, 2944, 1, 256]
    - [37, 9861.3]
  - - [5056, 128, 1, 1280]
    - [6, 8083.28]
  - - [448, 1856, 1, 3328]
    - [19, 7386.28]
  - - [5056, 4288, 1, 256]
    - [37, 9982.24]
  - - [1024, 448, 1, 256]
    - [19, 5848.63]
  - - [1024, 3584, 1, 256]
    - [42, 9417.84]
  - - [2944, 128, 1, 1280]
    - [23, 6994.56]
  - - [64, 256, 1, 256]
    - [8, 480.998]
  - - [704, 256, 1, 3328]
    - [30, 4255.02]
  - - [5056, 1408, 1, 256]
    - [38, 9567.54]
  - - [5888, 5888, 1, 1280]
    - [40, 10410.0]
  - - [448, 5888, 1, 1280]
    - [40, 9092.04]
  - - [1, 1, 1, 256]
    - [47, 0.00688172]
  - - [4288, 704, 1, 1280]
    - [40, 9571.96]
  - - [2944, 1408, 1, 256]
    - [39, 9420.84]
  - - [256, 2944, 1, 1280]
    - [40, 8299.16]
  - - [2368, 5888, 1, 3328]
    - [40, 10318.3]
  - - [704, 1024, 1, 3328]
    - [19, 8122.79]
  - - [2368, 1856, 1, 1280]
    - [40, 9980.17]
  - - [1856, 448, 1, 1280]
    - [19, 7261.93]
  - - [128, 6784, 1, 256]
    - [6, 7255.16]
  - - [5888, 4288, 1, 3328]
    - [40, 10453.1]
  - - [1856, 128, 1, 256]
    - [3, 4663.91]
  - - [5056, 448, 1, 256]
    - [37, 8732.87]
  - - [1856, 5056, 1, 1280]
    - [40, 10268.3]
  - - [2944, 1024, 1, 1280]
    - [40, 9558.98]
  - - [2368, 4288, 1, 256]
    - [37, 9804.71]
  - - [1024, 2368, 1, 3328]
    - [40, 9252.72]
  - - [4288, 64, 1, 3328]
    - [25, 5657.29]
  - - [704, 1408, 1, 256]
    - [40, 7606.58]
  - - [4288, 5888, 1, 3328]
    - [40, 10451.0]
  - - [448, 2944, 1, 1280]
    - [40, 7966.27]
  - - [1024, 2944, 1, 3328]
    - [40, 9671.47]
  - - [256, 6784, 1, 1280]
    - [40, 9101.64]
  - - [1856, 3584, 1, 256]
    - [38, 9588.33]
  - - [128, 448, 1, 3328]
    - [8, 2609.97]
  - - [1856, 256, 1, 256]
    - [19, 6033.47]
  - - [5056, 128, 1, 256]
    - [6, 6949.45]
  - - [256, 5888, 1, 1280]
    - [40, 9087.15]
  - - [6784, 128, 1, 1280]
    - [23, 8143.98]
  - - [64, 1408, 1, 256]
    - [11, 2443.72]
  - - [2944, 2368, 1, 256]
    - [37, 9611.57]
  - - [1856, 448, 1, 256]
    - [40, 6489.66]
  - - [1024, 1856, 1, 256]
    - [20, 8163.41]
  - - [6784, 3584, 1, 3328]
    - [40, 10489.3]
  - - [2944, 64, 1, 3328]
    - [5, 5797.42]
  - - [1024, 5888, 1, 3328]
    - [40, 10324.8]
  - - [1408, 2368, 1, 1280]
    - [40, 9795.52]
  - - [128, 1408, 1, 1280]
    - [5, 5242.88]
  - - [128, 1856, 1, 3328]
    - [32, 6290.81]
  - - [2944, 2944, 1, 256]
    - [38, 9660.36]
  - - [6784, 256, 1, 256]
    - [37, 8307.1]
  - - [128, 4288, 1, 1280]
    - [3, 6975.24]
  - - [5888, 1408, 1, 256]
    - [42, 9778.49]
  - - [128, 128, 1, 256]
    - [7, 494.611]
  - - [448, 704, 1, 3328]
    - [19, 5075.57]
  - - [448, 1856, 1, 256]
    - [37, 6442.52]
  - - [1856, 704, 1, 3328]
    - [40, 9430.19]
  - - [5888, 6784, 1, 3328]
    - [40, 10508.0]
  - - [704, 4288, 1, 1280]
    - [40, 9571.96]
  - - [4096, 7000, 1, 4096]
    - [72, 17060.9]
  - - [5124, 9124, 1, 1760]
    - [71, 17597.3]
  - - [1760, 32, 1, 1760]
    - [53, 2065.07]
  - - [1024, 1500, 1, 1536]
    - [65, 14247.0]
  - - [512, 24000, 1, 2048]
    - [74, 15569.1]
  - - [3072, 24000, 1, 1024]
    - [72, 17692.8]
  - - [1024, 3000, 1, 2560]
    - [72, 16608.2]
  - - [512, 3136, 1, 2048]
    - [82, 12702.2]
  - - [7680, 4, 1, 2560]
    - [53, 1128.63]
  - - [64, 193600, 1, 64]
    - [71, 13431.3]
  - - [8448, 1500, 1, 2816]
    - [71, 16834.1]
  - - [2560, 7000, 1, 2560]
    - [71, 17276.5]
  - - [3072, 16, 1, 1024]
    - [49, 1695.81]
  - - [512, 48000, 1, 2048]
    - [74, 15995.8]
  - - [1760, 64, 1, 1760]
    - [67, 4157.85]
  - - [1024, 16, 1, 512]
    - [51, 440.578]
  - - [196, 256, 64, 1024]
    - [83, 8949.31]
  - - [512, 48000, 1, 1536]
    - [72, 17684.6]
  - - [2560, 32, 1, 2560]
    - [53, 3037.59]
  - - [4608, 1500, 1, 1536]
    - [72, 16508.3]
  - - [2048, 128, 1, 2048]
    - [69, 8473.34]
  - - [1024, 24000, 1, 2560]
    - [71, 17746.8]
  - - [4608, 3000, 1, 1536]
    - [72, 16899.3]
  - - [5124, 9124, 1, 2048]
    - [72, 16332.6]
  - - [2048, 16, 1, 2048]
    - [52, 1217.5]
  - - [1024, 700, 1, 512]
    - [64, 9400.66]
  - - [3072, 1, 1, 128]
    - [49, 57.8259]
  - - [5124, 700, 1, 2560]
    - [72, 14715.1]
  - - [8448, 16, 1, 2816]
    - [50, 4678.38]
  - - [6144, 6000, 1, 2560]
    - [66, 16507.6]
  - - [4608, 32, 1, 1536]
    - [49, 5128.9]
  - - [3072, 64, 1, 1024]
    - [62, 6403.52]
  - - [512, 16, 1, 512]
    - [51, 220.289]
  - - [7680, 2, 1, 2560]
    - [53, 566.267]
  - - [4224, 1, 1, 128]
    - [49, 78.586]
  - - [7680, 1, 1, 2560]
    - [53, 283.46]
  - - [128, 1500, 1, 1280]
    - [49, 6536.17]
  - - [1024, 1500, 1, 2816]
    - [65, 14522.5]
  - - [6144, 2, 1, 2560]
    - [53, 450.419]
  - - [8448, 48000, 1, 2816]
    - [72, 15518.5]
  - - [512, 6000, 1, 2048]
    - [75, 12121.3]
  - - [4224, 1500, 1, 176]
    - [59, 14023.3]
  - - [1024, 6000, 1, 2816]
    - [71, 17591.4]
  - - [1024, 48000, 1, 1536]
    - [72, 18080.3]
  - - [1024, 48000, 1, 2560]
    - [71, 18254.9]
  - - [4096, 32, 1, 4096]
    - [54, 4827.98]
  - - [512, 16, 1, 500000]
    - [51, 330.658]
  - - [2560, 128, 1, 2560]
    - [67, 8673.08]
  - - [4608, 24000, 1, 1536]
    - [71, 18298.6]
  - - [512, 2, 1, 500000]
    - [51, 41.3314]
  - - [7680, 48000, 1, 2560]
    - [72, 15645.3]
  - - [3072, 48000, 1, 1024]
    - [72, 17986.4]
  - - [1760, 16, 1, 1760]
    - [49, 1035.99]
  - - [1024, 1500, 1, 2048]
    - [68, 11136.1]
  - - [1024, 16, 1, 500000]
    - [51, 661.008]
  - - [64, 193600, 1, 256]
    - [76, 15677.8]
  - - [1024, 3000, 1, 2048]
    - [73, 12173.9]
  - - [6144, 4, 1, 2560]
    - [53, 904.985]
  - - [1024, 6000, 1, 2048]
    - [74, 14556.8]
  - - [512, 24000, 1, 2816]
    - [71, 17783.8]
  - - [6144, 48000, 1, 2560]
    - [74, 14434.6]
  - - [1760, 7000, 1, 1760]
    - [60, 16687.6]
  - - [8448, 3000, 1, 2816]
    - [71, 17630.2]
  - - [3072, 4, 1, 1024]
    - [49, 423.953]
  - - [4608, 48000, 1, 1536]
    - [71, 18437.1]
  - - [2048, 32, 1, 2048]
    - [70, 2407.06]
  - - [7680, 1500, 1, 2560]
    - [72, 16260.4]
  - - [4096, 128, 1, 4096]
    - [63, 11511.0]
  - - [4608, 16, 1, 1536]
    - [53, 2655.87]
  - - [512, 3000, 1, 1536]
    - [65, 14260.7]
  - - [3072, 2, 1, 1024]
    - [49, 214.872]
  - - [8448, 1, 1, 2816]
    - [50, 289.834]
  - - [1024, 3000, 1, 2816]
    - [71, 17002.3]
  - - [128, 1, 1, 1408]
    - [49, 4.75274]
  - - [64, 1, 1, 1216]
    - [51, 2.11939]
  - - [1024, 2, 1, 512]
    - [51, 55.0723]
  - - [1024, 4, 1, 500000]
    - [51, 165.084]
  - - [6144, 1, 1, 2560]
    - [53, 226.768]
  - - [5124, 9124, 1, 2560]
    - [72, 17113.5]
  - - [512, 48000, 1, 2816]
    - [71, 18060.4]
  - - [512, 3000, 1, 2816]
    - [65, 14530.3]
  - - [1024, 24000, 1, 1536]
    - [72, 17629.1]
  - - [7680, 6000, 1, 2560]
    - [71, 17726.0]
  - - [1760, 128, 1, 1760]
    - [69, 7497.97]
  - - [512, 1500, 1, 2816]
    - [64, 11273.4]
  - - [512, 1, 1, 512]
    - [55, 16.1419]
  - - [512, 6000, 1, 2560]
    - [72, 16656.0]
  - - [512, 8, 1, 500000]
    - [51, 165.328]
  - - [512, 24000, 1, 2560]
    - [72, 17561.4]
  - - [6144, 3000, 1, 2560]
    - [74, 16106.6]
  - - [1024, 24000, 1, 2816]
    - [71, 18138.0]
  - - [2048, 7000, 1, 2048]
    - [74, 15826.5]
  - - [7680, 3000, 1, 2560]
    - [66, 16179.8]
  - - [1024, 4, 1, 512]
    - [51, 110.609]
  - - [5124, 700, 1, 2048]
    - [74, 13074.5]
  - - [5124, 9124, 1, 4096]
    - [66, 15808.6]
  - - [4096, 64, 1, 4096]
    - [70, 8409.63]
  - - [256, 193600, 1, 64]
    - [57, 14460.0]
  - - [7680, 32, 1, 2560]
    - [56, 8501.97]
  - - [2560, 64, 1, 2560]
    - [62, 5877.67]
  - - [3072, 128, 1, 1024]
    - [67, 9514.49]
  - - [8448, 6000, 1, 2816]
    - [72, 17792.5]
  - - [7680, 64, 1, 2560]
    - [51, 11163.0]
  - - [5124, 1500, 1, 2560]
    - [72, 16136.5]
  - - [1024, 1500, 1, 2560]
    - [65, 14448.0]
  - - [512, 4, 1, 512]
    - [55, 64.251]
  - - [1024, 6000, 1, 2560]
    - [72, 17205.6]
  - - [3072, 32, 1, 1024]
    - [70, 3364.41]
  - - [6144, 32, 1, 2560]
    - [62, 6883.43]
  - - [196, 1024, 64, 256]
    - [85, 12380.8]
  - - [512, 50176, 1, 128]
    - [78, 15888.7]
  - - [4608, 1, 1, 1536]
    - [53, 165.681]
  - - [1024, 32, 1, 512]
    - [51, 907.858]
  - - [7680, 24000, 1, 2560]
    - [72, 17224.8]
  - - [8448, 4, 1, 2816]
    - [53, 1155.96]
  - - [512, 1, 1, 500000]
    - [51, 20.6657]
  - - [176, 1500, 1, 1408]
    - [51, 6743.69]
  - - [512, 3000, 1, 2560]
    - [65, 14469.2]
  - - [8448, 24000, 1, 2816]
    - [72, 14526.0]
  - - [4608, 2, 1, 1536]
    - [53, 329.511]
  - - [512, 6000, 1, 1536]
    - [72, 16415.9]
  - - [7680, 128, 1, 2560]
    - [58, 13827.4]
  - - [3072, 6000, 1, 1024]
    - [72, 16775.4]
  - - [3072, 1500, 1, 128]
    - [71, 12889.5]
  - - [2048, 3136, 1, 512]
    - [80, 15706.6]
  - - [1024, 3000, 1, 1536]
    - [72, 16365.8]
  - - [512, 4, 1, 500000]
    - [51, 82.6644]
  - - [512, 6000, 1, 2816]
    - [72, 16718.4]
  - - [128, 50176, 1, 512]
    - [77, 15938.0]
  - - [256, 12544, 1, 1024]
    - [81, 14000.1]
  - - [1024, 12544, 1, 256]
    - [79, 16382.7]
  - - [512, 48000, 1, 2560]
    - [72, 17747.2]
  - - [2560, 16, 1, 2560]
    - [49, 1534.8]
  - - [2048, 64, 1, 2048]
    - [70, 4719.33]
  - - [512, 2, 1, 512]
    - [55, 32.1255]
  - - [1024, 1, 1, 512]
    - [51, 27.5361]
  - - [512, 1500, 1, 2560]
    - [64, 11050.4]
  - - [512, 24000, 1, 1536]
    - [72, 17469.8]
  - - [1024, 1, 1, 500000]
    - [51, 41.1425]
  - - [6144, 16, 1, 2560]
    - [53, 3615.78]
  - - [1024, 24000, 1, 2048]
    - [74, 15988.1]
  - - [4096, 16, 1, 4096]
    - [54, 2507.81]
  - - [512, 32, 1, 512]
    - [51, 455.903]
  - - [5124, 1500, 1, 2048]
    - [74, 14375.8]
  - - [3072, 1500, 1, 1024]
    - [65, 14683.2]
  - - [1024, 2, 1, 500000]
    - [51, 82.5046]
  - - [1024, 8, 1, 500000]
    - [51, 330.528]
  - - [7680, 16, 1, 2560]
    - [53, 4514.54]
  - - [6144, 1500, 1, 2560]
    - [72, 16981.2]
  - - [3072, 1, 1, 1024]
    - [49, 107.143]
  - - [1024, 48000, 1, 2816]
    - [71, 18584.6]
  - - [8448, 2, 1, 2816]
    - [53, 579.103]
  - - [4608, 4, 1, 1536]
    - [53, 659.021]
  - - [1024, 6000, 1, 1536]
    - [72, 17098.8]
  - - [8448, 32, 1, 2816]
    - [51, 7214.43]
  - - [512, 3000, 1, 2048]
    - [74, 11148.7]
  - - [6144, 24000, 1, 2560]
    - [74, 15954.4]
  - - [4608, 6000, 1, 1536]
    - [72, 17669.4]
  - - [1024, 1024, 1, 1024]
    - [74, 13068.9]
  - - [512, 1500, 1, 2048]
    - [74, 9265.22]
  - - [512, 1500, 1, 1536]
    - [64, 10818.5]
  - - [128, 1, 1, 1024]
    - [49, 4.64136]
  - - [3072, 3000, 1, 1024]
    - [74, 15741.2]
  - - [1024, 48000, 1, 2048]
    - [72, 16800.7]
  - - [3136, 64, 128, 64]
    - [112, 15223.8]
  - - [784, 512, 64, 128]
    - [105, 18907.2]
  - - [3136, 256, 64, 64]
    - [112, 18012.3]
  - - [12544, 1024, 1, 256]
    - [108, 20780.7]
  - - [784, 128, 128, 512]
    - [107, 19837.9]
  - - [784, 512, 256, 128]
    - [111, 18471.7]
  - - [3136, 64, 64, 256]
    - [109, 19306.8]
  - - [3136, 512, 1, 2048]
    - [110, 15558.0]
  - - [12544, 256, 1, 1024]
    - [113, 17648.9]
  - - [3136, 2048, 1, 512]
    - [106, 19499.1]
  - - [3136, 256, 256, 64]
    - [115, 18095.6]
  - - [3136, 64, 128, 256]
    - [106, 19910.0]
  - - [784, 128, 64, 512]
    - [107, 19325.0]
  - - [3136, 64, 256, 64]
    - [112, 15429.5]
  - - [784, 512, 128, 128]
    - [105, 19136.0]
  - - [3136, 64, 64, 64]
    - [114, 14680.1]
  - - [784, 128, 256, 512]
    - [107, 20166.4]
  - - [3136, 64, 256, 256]
    - [109, 20048.3]
  - - [3136, 256, 128, 64]
    - [104, 18309.2]
  - - [512, 512, 64, 64]
    - [116, 11941.1]
  - - [512, 512, 256, 64]
    - [117, 12704.0]
  - - [512, 512, 128, 64]
    - [116, 12404.6]
  - - [512, 512, 40, 64]
    - [116, 11915.6]
  - - [1024, 1024, 64, 96]
    - [117, 13306.5]
  - - [1024, 1024, 128, 96]
    - [118, 13341.7]
  - - [1024, 1024, 256, 64]
    - [117, 12881.6]
  - - [1024, 1024, 32, 64]
    - [116, 12370.3]
  - - [1024, 1024, 64, 64]
    - [117, 12692.0]
  - - [64, 512, 64, 512]
    - [119, 11355.1]
  - - [64, 512, 256, 512]
    - [116, 12874.6]
  - - [64, 512, 128, 512]
    - [120, 12223.8]
  - - [64, 512, 40, 512]
    - [119, 10070.4]
  - - [96, 1024, 64, 1024]
    - [121, 11152.3]
  - - [96, 1024, 128, 1024]
    - [122, 12198.9]
  - - [64, 1024, 256, 1024]
    - [120, 12875.4]
  - - [64, 1024, 32, 1024]
    - [120, 10364.3]
  - - [64, 1024, 64, 1024]
    - [120, 11786.4]
- null
