library/src/blas3/Tensile/Logic/asm_full/vega20_Cijk_Ailk_Bjlk_SB.yaml
- {MinimumRequiredVersion: 4.5.0}
- vega20
- gfx906
- [Device 66a0, Device 66a1, Device 66a7]
    SolutionIndex: 0
    SolutionNameMin: Cijk_Ailk_Bjlk_SB_MT016x016x16_GRVW02_GSU02_TT02_02_VW02_WG08_08_04
    SolutionIndex: 1
    SolutionNameMin: Cijk_Ailk_Bjlk_SB_MT016x016x16_GRVW02_GSU04_TT02_02_VW02_WG08_08_04
    SolutionIndex: 2
    SolutionNameMin: Cijk_Ailk_Bjlk_SB_MT016x016x32_GRVW02_GSU02_TT02_02_VW02_WG08_08_04
    SolutionIndex: 3
    SolutionNameMin: Cijk_Ailk_Bjlk_SB_MT032x032x32_GRVW04_GSU02_TT04_04_VW04_WG08_08_04
    SolutionIndex: 4
    SolutionNameMin: Cijk_Ailk_Bjlk_SB_MT016x016x32_GRVW02_GSU04_TT02_02_VW02_WG08_08_04
    SolutionIndex: 5
    SolutionNameMin: Cijk_Ailk_Bjlk_SB_MT064x064x16_GRVW04_GSU01_TT04_04_VW04_WG16_16_01
    SolutionIndex: 6
    SolutionNameMin: Cijk_Ailk_Bjlk_SB_MT064x128x08_GRVW04_GSU01_TT04_08_VW04_WG16_16_01
    SolutionIndex: 7
    SolutionNameMin: Cijk_Ailk_Bjlk_SB_MT128x064x08_GRVW04_GSU01_TT08_04_VW04_WG16_16_01
    SolutionIndex: 8
    SolutionNameMin: Cijk_Ailk_Bjlk_SB_MT128x064x08_GRVW04_GSU01_TT08_04_VW04_WG16_16_01
    SolutionIndex: 9
    SolutionNameMin: Cijk_Ailk_Bjlk_SB_MT128x128x16_GRVW04_GSU01_TT08_08_VW04_WG16_16_01
    SolutionIndex: 10
    SolutionNameMin: Cijk_Ailk_Bjlk_SB_MT064x064x16_GRVW04_GSU01_TT04_04_VW04_WG16_16_01
    SolutionIndex: 11
    SolutionNameMin: Cijk_Ailk_Bjlk_SB_MT128x064x16_GRVW04_GSU01_TT08_04_VW04_WG16_16_01
    SolutionIndex: 12
    SolutionNameMin: Cijk_Ailk_Bjlk_SB_MT032x032x02_GRVW04_GSU01_TT04_04_VW04_WG08_08_01
    SolutionIndex: 0
    SolutionNameMin: Cijk_Ailk_Bjlk_SB_MT064x128x08_DTL0_GSU01_PGR1_PLR1_TT04_08_USFGRO01_VW01_WG16_16_01_WGM01
    SolutionIndex: 1
    SolutionNameMin: Cijk_Ailk_Bjlk_SB_MT064x128x08_DTL0_GSU01_PGR1_PLR1_TT04_08_USFGRO01_VW02_WG16_16_01_WGM01
    SolutionIndex: 2
    SolutionNameMin: Cijk_Ailk_Bjlk_SB_MT064x064x08_DTL0_GSU01_PGR1_PLR1_TT04_08_USFGRO01_VW04_WG16_08_01_WGM01
    SolutionIndex: 3
    SolutionNameMin: Cijk_Ailk_Bjlk_SB_MT032x256x08_DTL1_GSU01_PGR0_PLR1_TT04_08_USFGRO01_VW04_WG08_32_01_WGM01
    SolutionIndex: 4
    SolutionNameMin: Cijk_Ailk_Bjlk_SB_MT064x128x08_DTL0_GSU01_PGR1_PLR1_TT04_08_USFGRO01_VW04_WG16_16_01_WGM01
    SolutionIndex: 5
    SolutionNameMin: Cijk_Ailk_Bjlk_SB_MT032x256x08_DTL1_GSU01_PGR0_PLR1_TT04_08_USFGRO01_VW04_WG08_32_01_WGM08
    SolutionIndex: 6
    SolutionNameMin: Cijk_Ailk_Bjlk_SB_MT064x128x08_DTL0_GSU01_PGR1_PLR1_TT04_08_USFGRO01_VW04_WG16_16_01_WGM08
    SolutionIndex: 7
    SolutionNameMin: Cijk_Ailk_Bjlk_SB_MT064x064x16_DTL0_GSU01_PGR0_PLR1_TT04_08_USFGRO01_VW04_WG16_08_01_WGM01
    SolutionIndex: 8
    SolutionNameMin: Cijk_Ailk_Bjlk_SB_MT032x256x16_DTL1_GSU01_PGR0_PLR1_TT04_08_USFGRO01_VW04_WG08_32_01_WGM01
- - - [4096, 7133, 1, 4096]
    - [9, 10190.4]
  - - [512, 16, 1, 512]
    - [1, 672.164]
  - - [2048, 7133, 1, 2048]
    - [9, 10071.8]
  - - [2560, 7133, 1, 2560]
    - [7, 10083.6]
  - - [1024, 1024, 1, 1024]
    - [11, 8489.42]
  - - [3072, 7435, 1, 1024]
    - [7, 9966.46]
  - - [1024, 32, 1, 512]
    - [0, 1733.18]
  - - [1760, 7133, 1, 1760]
    - [6, 9653.95]
  - - [7680, 5481, 1, 2560]
    - [8, 10083.2]
  - - [1024, 16, 1, 512]
    - [4, 1165.08]
  - - [512, 32, 1, 512]
    - [2, 1263.34]
  - - [3136, 256, 64, 64]
    - [20, 8910.5]
  - - [784, 512, 64, 128]
    - [16, 8832.0]
  - - [49, 2048, 128, 512]
    - [13, 6991.1]
  - - [784, 128, 64, 512]
    - [19, 8769.82]
  - - [196, 1024, 64, 256]
    - [18, 7950.51]
  - - [3136, 64, 128, 64]
    - [15, 8570.51]
  - - [784, 512, 128, 128]
    - [16, 8996.31]
  - - [196, 1024, 128, 256]
    - [18, 8118.53]
  - - [196, 256, 64, 1024]
    - [21, 7488.46]
  - - [3136, 64, 64, 64]
    - [15, 8293.82]
  - - [3136, 64, 64, 256]
    - [15, 9075.76]
  - - [3136, 64, 128, 256]
    - [15, 9202.76]
  - - [784, 128, 128, 512]
    - [17, 8916.3]
  - - [49, 2048, 64, 512]
    - [14, 6953.85]
  - - [196, 256, 128, 1024]
    - [16, 8088.18]
  - - [49, 512, 64, 2048]
    - [19, 6771.7]
  - - [49, 512, 128, 2048]
    - [19, 7095.49]
  - - [3136, 256, 128, 64]
    - [20, 9020.0]
- - - -1
    - - - 128
        - - - 4
            - - [-1, 12]
          - - -1
            - - [4, 12]
              - [-1, 5]
      - - 256
        - - - 4
            - - [704, 1]
              - [-1, 0]
          - - 64
            - - [4, 1]
              - [64, 4]
              - [704, 2]
              - [1024, 0]
              - [2368, 2]
              - [-1, 10]
          - - 128
            - - [4, 1]
              - [64, 0]
              - [256, 2]
              - [448, 0]
              - [704, 2]
              - [-1, 10]
          - - 256
            - - [128, 0]
              - [256, 2]
              - [448, 0]
              - [-1, 10]
          - - 448
            - - [4, 0]
              - [128, 2]
              - [5888, 10]
              - [-1, 6]
          - - 704
            - - [4, 1]
              - [64, 2]
              - [128, 0]
              - [2368, 10]
              - [3584, 6]
              - [4288, 10]
              - [5888, 6]
              - [-1, 10]
          - - 1024
            - - [4, 0]
              - [64, 2]
              - [704, 10]
              - [1024, 11]
              - [2368, 10]
              - [3584, 8]
              - [4288, 10]
              - [5056, 8]
              - [-1, 7]
          - - 1408
            - - [64, 0]
              - [704, 10]
              - [1024, 6]
              - [2368, 10]
              - [3584, 6]
              - [5056, 7]
              - [-1, 6]
          - - 1856
            - - [4, 1]
              - [64, 2]
              - [704, 10]
              - [1408, 6]
              - [2944, 10]
              - [3584, 6]
              - [5056, 10]
              - [-1, 6]
          - - 2368
            - - [4, 1]
              - [704, 10]
              - [1024, 6]
              - [1856, 10]
              - [2368, 6]
              - [2944, 10]
              - [4288, 6]
              - [5056, 10]
              - [-1, 6]
          - - 2944
            - - [4, 0]
              - [704, 10]
              - [1024, 8]
              - [1408, 7]
              - [2368, 10]
              - [3584, 6]
              - [5056, 7]
              - [-1, 6]
          - - 3584
            - - [4, 0]
              - [704, 10]
              - [1024, 8]
              - [-1, 7]
          - - 4288
            - - [4, 0]
              - [1024, 10]
              - [1408, 6]
              - [2368, 10]
              - [-1, 6]
          - - 5056
            - - [4, 0]
              - [704, 10]
              - [1024, 8]
              - [1408, 6]
              - [2368, 10]
              - [-1, 6]
          - - 5888
            - - [4, 0]
              - [128, 10]
              - [256, 6]
              - [448, 10]
              - [704, 7]
              - [1024, 8]
              - [1408, 6]
              - [1856, 8]
              - [2368, 7]
              - [2944, 6]
              - [5056, 7]
              - [-1, 6]
          - - -1
            - - [4, 0]
              - [256, 10]
              - [448, 7]
              - [704, 10]
              - [1024, 8]
              - [1408, 6]
              - [2368, 7]
              - [2944, 6]
              - [5056, 7]
              - [5888, 6]
              - [-1, 9]
      - - 1280
        - - - 4
            - - [1408, 1]
              - [3584, 0]
              - [5056, 1]
              - [-1, 0]
          - - 64
            - - [4, 1]
              - [128, 4]
              - [256, 2]
              - [448, 4]
              - [2944, 3]
              - [3584, 10]
              - [5056, 3]
              - [-1, 10]
          - - 128
            - - [4, 1]
              - [64, 4]
              - [128, 2]
              - [1408, 3]
              - [1856, 10]
              - [2368, 3]
              - [-1, 10]
          - - 256
            - - [4, 1]
              - [64, 2]
              - [448, 3]
              - [-1, 10]
          - - 448
            - - [4, 1]
              - [64, 4]
              - [448, 3]
              - [5888, 10]
              - [-1, 6]
          - - 704
            - - [4, 1]
              - [128, 3]
              - [2368, 10]
              - [5888, 6]
              - [-1, 10]
          - - 1024
            - - [4, 1]
              - [64, 3]
              - [704, 10]
              - [1024, 11]
              - [1856, 10]
              - [3584, 8]
              - [4288, 10]
              - [5056, 8]
              - [5888, 10]
              - [-1, 7]
          - - 1408
            - - [4, 1]
              - [128, 3]
              - [1024, 10]
              - [1408, 6]
              - [1856, 7]
              - [2368, 10]
              - [-1, 6]
          - - 1856
            - - [4, 0]
              - [64, 3]
              - [704, 10]
              - [1856, 6]
              - [2944, 10]
              - [4288, 6]
              - [5056, 10]
              - [-1, 6]
          - - 2368
            - - [4, 0]
              - [128, 3]
              - [704, 10]
              - [1024, 8]
              - [1856, 10]
              - [2368, 6]
              - [2944, 10]
              - [4288, 6]
              - [5056, 10]
              - [-1, 6]
          - - 2944
            - - [4, 0]
              - [128, 3]
              - [704, 10]
              - [1024, 9]
              - [1408, 6]
              - [2368, 10]
              - [3584, 6]
              - [4288, 7]
              - [5056, 6]
              - [5888, 9]
              - [-1, 6]
          - - 3584
            - - [4, 0]
              - [448, 10]
              - [704, 7]
              - [1024, 8]
              - [1408, 6]
              - [2368, 7]
              - [2944, 6]
              - [3584, 7]
              - [4288, 8]
              - [5056, 7]
              - [-1, 6]
          - - 4288
            - - [4, 1]
              - [128, 3]
              - [448, 10]
              - [704, 8]
              - [1024, 10]
              - [-1, 6]
          - - 5056
            - - [4, 1]
              - [64, 3]
              - [448, 10]
              - [704, 7]
              - [1024, 9]
              - [1408, 6]
              - [2368, 10]
              - [4288, 6]
              - [5056, 9]
              - [-1, 6]
          - - 5888
            - - [4, 1]
              - [448, 10]
              - [704, 7]
              - [1408, 9]
              - [1856, 7]
              - [2368, 8]
              - [2944, 9]
              - [3584, 7]
              - [4288, 8]
              - [5056, 7]
              - [-1, 6]
          - - -1
            - - [4, 0]
              - [256, 10]
              - [448, 7]
              - [704, 10]
              - [1024, 9]
              - [1408, 8]
              - [2368, 7]
              - [2944, 6]
              - [5056, 7]
              - [5888, 6]
              - [-1, 9]
      - - -1
        - - - 4
            - - [1408, 1]
              - [-1, 0]
          - - 64
            - - [4, 1]
              - [448, 4]
              - [5056, 3]
              - [5888, 10]
              - [-1, 3]
          - - 128
            - - [4, 1]
              - [128, 4]
              - [2944, 3]
              - [3584, 10]
              - [5056, 3]
              - [5888, 10]
              - [-1, 3]
          - - 256
            - - [4, 1]
              - [64, 4]
              - [448, 3]
              - [-1, 10]
          - - 448
            - - [4, 1]
              - [64, 4]
              - [448, 3]
              - [3584, 10]
              - [4288, 6]
              - [5888, 10]
              - [-1, 6]
          - - 704
            - - [4, 1]
              - [128, 3]
              - [2368, 10]
              - [5888, 6]
              - [-1, 10]
          - - 1024
            - - [4, 1]
              - [128, 3]
              - [704, 10]
              - [1024, 11]
              - [1408, 10]
              - [1856, 9]
              - [2368, 8]
              - [2944, 9]
              - [3584, 8]
              - [4288, 10]
              - [5056, 9]
              - [5888, 10]
              - [-1, 9]
          - - 1408
            - - [4, 1]
              - [128, 3]
              - [1024, 10]
              - [1408, 9]
              - [1856, 7]
              - [2368, 10]
              - [5056, 6]
              - [5888, 9]
              - [-1, 6]
          - - 1856
            - - [4, 0]
              - [128, 3]
              - [704, 10]
              - [1024, 9]
              - [1856, 6]
              - [2944, 10]
              - [4288, 6]
              - [5056, 10]
              - [-1, 6]
          - - 2368
            - - [4, 0]
              - [128, 3]
              - [704, 10]
              - [1024, 7]
              - [1856, 10]
              - [4288, 6]
              - [5056, 9]
              - [-1, 6]
          - - 2944
            - - [4, 0]
              - [128, 3]
              - [704, 10]
              - [1024, 9]
              - [1408, 6]
              - [2368, 10]
              - [5056, 6]
              - [5888, 9]
              - [-1, 6]
          - - 3584
            - - [4, 0]
              - [448, 10]
              - [1024, 7]
              - [1408, 6]
              - [1856, 7]
              - [3584, 6]
              - [4288, 9]
              - [-1, 6]
          - - 4288
            - - [4, 0]
              - [128, 3]
              - [448, 10]
              - [1024, 8]
              - [2944, 6]
              - [3584, 9]
              - [-1, 6]
          - - 5056
            - - [4, 0]
              - [128, 3]
              - [448, 10]
              - [704, 7]
              - [1024, 9]
              - [1408, 6]
              - [2368, 10]
              - [4288, 6]
              - [5056, 9]
              - [-1, 6]
          - - 5888
            - - [4, 0]
              - [64, 3]
              - [448, 10]
              - [704, 7]
              - [1408, 9]
              - [1856, 7]
              - [2368, 8]
              - [2944, 9]
              - [3584, 7]
              - [-1, 8]
          - - -1
            - - [4, 0]
              - [64, 10]
              - [128, 3]
              - [256, 10]
              - [448, 7]
              - [704, 10]
              - [1024, 9]
              - [1408, 6]
              - [2368, 8]
              - [2944, 6]
              - [5888, 8]
              - [-1, 9]
