library/src/blas3/Tensile/Logic/asm_full/vega20_Cijk_Ailk_Bjlk_HB.yaml
- {MinimumRequiredVersion: 4.5.0}
- vega20
- gfx906
- [Device 66a0, Device 66a1, Device 66a7]
    SolutionIndex: 0
    SolutionNameMin: Cijk_Ailk_Bjlk_HB_MT064x064x08_PGR1_PLR1_TT08_08
    SolutionIndex: 1
    SolutionNameMin: Cijk_Ailk_Bjlk_HB_MT032x008x16_PGR1_PLR1_TT02_02
    SolutionIndex: 2
    SolutionNameMin: Cijk_Ailk_Bjlk_HB_MT016x016x32_PGR1_PLR1_TT02_02
    SolutionIndex: 3
    SolutionNameMin: Cijk_Ailk_Bjlk_HB_MT032x016x32_PGR1_PLR1_TT02_02
    SolutionIndex: 4
    SolutionNameMin: Cijk_Ailk_Bjlk_HB_MT032x008x32_PGR1_PLR1_TT02_02
    SolutionIndex: 5
    SolutionNameMin: Cijk_Ailk_Bjlk_HB_MT064x064x16_PGR1_PLR1_TT04_04
    SolutionIndex: 6
    SolutionNameMin: Cijk_Ailk_Bjlk_HB_MT064x128x16_PGR1_PLR1_TT04_08
    SolutionIndex: 7
    SolutionNameMin: Cijk_Ailk_Bjlk_HB_MT128x064x16_PGR1_PLR1_TT08_04
    SolutionIndex: 8
    SolutionNameMin: Cijk_Ailk_Bjlk_HB_MT128x128x16_PGR1_PLR1_TT08_08
    SolutionIndex: 9
    SolutionNameMin: Cijk_Ailk_Bjlk_HB_MT064x128x08_PGR0_PLR0_TT04_08
    SolutionIndex: 10
    SolutionNameMin: Cijk_Ailk_Bjlk_HB_MT064x064x08_PGR0_PLR0_TT04_04
    SolutionIndex: 11
    SolutionNameMin: Cijk_Ailk_Bjlk_HB_MT064x064x16_PGR1_PLR1_TT04_04
    SolutionIndex: 12
    SolutionNameMin: Cijk_Ailk_Bjlk_HB_MT064x064x32_PGR1_PLR1_TT04_04
    SolutionIndex: 13
    SolutionNameMin: Cijk_Ailk_Bjlk_HB_MT064x128x04_PGR0_PLR0_TT04_08
    SolutionIndex: 14
    SolutionNameMin: Cijk_Ailk_Bjlk_HB_MT064x064x16_PGR1_PLR1_TT04_04
    SolutionIndex: 15
    SolutionNameMin: Cijk_Ailk_Bjlk_HB_MT064x064x32_PGR1_PLR1_TT04_04
    SolutionIndex: 0
    SolutionNameMin: Cijk_Ailk_Bjlk_HB_MT128x064x08_GSU01_PGR1_PLR1_TT08_08_WG16_08_01_WGM01
    SolutionIndex: 1
    SolutionNameMin: Cijk_Ailk_Bjlk_HB_MT064x256x08_GSU01_PGR1_PLR1_TT08_08_WG08_32_01_WGM01
    SolutionIndex: 2
    SolutionNameMin: Cijk_Ailk_Bjlk_HB_MT256x064x08_GSU01_PGR1_PLR1_TT08_08_WG32_08_01_WGM01
    SolutionIndex: 3
    SolutionNameMin: Cijk_Ailk_Bjlk_HB_MT128x064x08_GSU01_PGR1_PLR1_TT08_08_WG16_08_01_WGM08
    SolutionIndex: 4
    SolutionNameMin: Cijk_Ailk_Bjlk_HB_MT128x128x16_GSU01_PGR1_PLR1_TT08_08_WG16_16_01_WGM01
    SolutionIndex: 5
    SolutionNameMin: Cijk_Ailk_Bjlk_HB_MT128x128x16_GSU01_PGR1_PLR1_TT08_08_WG16_16_01_WGM64
- - - [4096, 7133, 1, 4096]
    - [8, 20538.7]
  - - [512, 16, 1, 512]
    - [1, 319.688]
  - - [2048, 7133, 1, 2048]
    - [8, 20253.2]
  - - [2560, 7133, 1, 2560]
    - [7, 19895.7]
  - - [1024, 1024, 1, 1024]
    - [7, 15827.6]
  - - [3072, 7435, 1, 1024]
    - [0, 19930.2]
  - - [1024, 32, 1, 512]
    - [3, 1327.31]
  - - [1760, 7133, 1, 1760]
    - [7, 18999.1]
  - - [7680, 5481, 1, 2560]
    - [7, 19860.7]
  - - [1024, 16, 1, 512]
    - [4, 659.482]
  - - [512, 32, 1, 512]
    - [2, 667.883]
  - - [3136, 256, 64, 64]
    - [17, 17894.7]
  - - [784, 512, 64, 128]
    - [17, 17336.2]
  - - [784, 128, 128, 512]
    - [20, 17550.9]
  - - [3136, 64, 128, 64]
    - [16, 16468.0]
  - - [196, 256, 128, 1024]
    - [20, 15123.0]
  - - [196, 256, 64, 1024]
    - [21, 14468.2]
  - - [196, 1024, 128, 256]
    - [17, 14971.5]
  - - [3136, 64, 64, 256]
    - [18, 18004.5]
  - - [3136, 64, 128, 256]
    - [19, 18469.6]
  - - [784, 128, 64, 512]
    - [20, 17041.5]
  - - [784, 512, 128, 128]
    - [17, 17809.4]
  - - [196, 1024, 64, 256]
    - [17, 14716.9]
  - - [3136, 64, 64, 64]
    - [18, 15429.5]
  - - [3136, 256, 128, 64]
    - [17, 18252.3]
- - - -1
    - - - 1
        - - - 32
            - - [32, 14]
              - [256, 15]
              - [704, 14]
              - [1408, 15]
              - [-1, 14]
          - - 64
            - - [2368, 14]
              - [2944, 15]
              - [5888, 14]
              - [-1, 13]
          - - 128
            - - [32, 14]
              - [64, 15]
              - [128, 14]
              - [256, 15]
              - [5056, 14]
              - [-1, 13]
          - - 256
            - - [64, 15]
              - [448, 14]
              - [704, 15]
              - [2368, 14]
              - [-1, 13]
          - - 448
            - - [64, 14]
              - [128, 15]
              - [256, 14]
              - [448, 15]
              - [704, 14]
              - [1024, 13]
              - [1408, 14]
              - [-1, 13]
          - - 704
            - - [32, 14]
              - [64, 15]
              - [128, 14]
              - [256, 15]
              - [704, 14]
              - [-1, 13]
          - - 1024
            - - [448, 14]
              - [-1, 13]
          - - 1408
            - - [256, 14]
              - [-1, 13]
          - - 1856
            - - [448, 14]
              - [-1, 13]
          - - 2368
            - - [32, 14]
              - [64, 15]
              - [256, 14]
              - [-1, 13]
          - - 2944
            - - [128, 14]
              - [-1, 13]
          - - 3584
            - - [32, 15]
              - [128, 14]
              - [-1, 13]
          - - 4288
            - - [128, 14]
              - [-1, 13]
          - - 5056
            - - [64, 14]
              - [-1, 13]
          - - 5888
            - - [32, 13]
              - [128, 14]
              - [-1, 13]
          - - -1
            - - [32, 13]
              - [64, 14]
              - [-1, 13]
      - - 32
        - - - 64
            - - [128, 10]
              - [256, 11]
              - [2944, 10]
              - [-1, 11]
          - - 128
            - - [32, 10]
              - [64, 11]
              - [128, 12]
              - [1408, 10]
              - [3584, 11]
              - [5056, 10]
              - [-1, 11]
          - - 256
            - - [1024, 10]
              - [1856, 11]
              - [2368, 10]
              - [2944, 11]
              - [4288, 10]
              - [-1, 9]
          - - 448
            - - [448, 10]
              - [704, 11]
              - [1024, 10]
              - [1856, 11]
              - [2368, 10]
              - [-1, 9]
          - - 704
            - - [256, 10]
              - [448, 12]
              - [1024, 11]
              - [1408, 10]
              - [-1, 9]
          - - 1024
            - - [128, 10]
              - [704, 11]
              - [1024, 10]
              - [-1, 9]
          - - 1408
            - - [256, 10]
              - [704, 11]
              - [1024, 10]
              - [-1, 9]
          - - 1856
            - - [64, 10]
              - [448, 11]
              - [-1, 9]
          - - 2368
            - - [64, 10]
              - [128, 11]
              - [448, 10]
              - [-1, 9]
          - - 2944
            - - [64, 10]
              - [256, 11]
              - [704, 10]
              - [-1, 9]
          - - 3584
            - - [64, 10]
              - [128, 12]
              - [256, 10]
              - [-1, 9]
          - - 4288
            - - [32, 11]
              - [64, 10]
              - [128, 11]
              - [-1, 9]
          - - 5056
            - - [32, 11]
              - [64, 12]
              - [128, 11]
              - [256, 10]
              - [-1, 9]
          - - 5888
            - - [128, 11]
              - [-1, 9]
          - - -1
            - - [128, 10]
              - [-1, 9]
      - - 256
        - - - 1
            - - [-1, 14]
          - - 32
            - - [128, 11]
              - [256, 12]
              - [4288, 11]
              - [5056, 12]
              - [-1, 11]
          - - 64
            - - [1, 14]
              - [32, 11]
              - [128, 1]
              - [448, 2]
              - [704, 3]
              - [1408, 2]
              - [2944, 3]
              - [-1, 5]
          - - 128
            - - [1, 14]
              - [32, 11]
              - [64, 1]
              - [128, 2]
              - [256, 3]
              - [448, 4]
              - [704, 2]
              - [1408, 3]
              - [5888, 5]
              - [-1, 6]
          - - 256
            - - [1, 14]
              - [32, 11]
              - [64, 2]
              - [128, 3]
              - [256, 1]
              - [448, 3]
              - [2944, 5]
              - [3584, 7]
              - [5056, 5]
              - [5888, 7]
              - [-1, 5]
          - - 448
            - - [1, 14]
              - [32, 11]
              - [64, 2]
              - [448, 3]
              - [1408, 5]
              - [1856, 6]
              - [2368, 5]
              - [2944, 6]
              - [3584, 5]
              - [4288, 0]
              - [5888, 5]
              - [-1, 0]
          - - 704
            - - [1, 14]
              - [32, 11]
              - [64, 2]
              - [128, 3]
              - [1024, 5]
              - [1408, 6]
              - [2368, 5]
              - [2944, 0]
              - [3584, 6]
              - [4288, 0]
              - [5056, 6]
              - [-1, 0]
          - - 1024
            - - [1, 14]
              - [32, 11]
              - [64, 2]
              - [128, 3]
              - [704, 5]
              - [2368, 7]
              - [2944, 8]
              - [3584, 7]
              - [4288, 5]
              - [5056, 0]
              - [-1, 8]
          - - 1408
            - - [1, 14]
              - [32, 11]
              - [128, 3]
              - [448, 5]
              - [704, 7]
              - [1024, 6]
              - [1408, 8]
              - [1856, 7]
              - [2368, 5]
              - [3584, 8]
              - [5056, 0]
              - [5888, 8]
              - [-1, 6]
          - - 1856
            - - [1, 14]
              - [32, 11]
              - [128, 3]
              - [704, 5]
              - [1024, 0]
              - [1856, 6]
              - [2368, 5]
              - [3584, 6]
              - [5056, 0]
              - [-1, 6]
          - - 2368
            - - [1, 14]
              - [32, 11]
              - [64, 3]
              - [704, 5]
              - [1024, 6]
              - [1856, 5]
              - [2368, 6]
              - [2944, 0]
              - [3584, 6]
              - [5056, 0]
              - [5888, 6]
              - [-1, 0]
          - - 2944
            - - [1, 14]
              - [32, 11]
              - [64, 3]
              - [256, 5]
              - [704, 7]
              - [1408, 8]
              - [1856, 7]
              - [2368, 0]
              - [2944, 6]
              - [5056, 7]
              - [-1, 8]
          - - 3584
            - - [1, 15]
              - [32, 11]
              - [64, 3]
              - [128, 5]
              - [256, 7]
              - [448, 5]
              - [704, 7]
              - [1024, 6]
              - [1408, 8]
              - [2368, 7]
              - [2944, 6]
              - [4288, 8]
              - [5056, 0]
              - [-1, 8]
          - - 4288
            - - [1, 14]
              - [32, 11]
              - [256, 5]
              - [704, 0]
              - [1024, 5]
              - [2368, 0]
              - [2944, 6]
              - [3584, 8]
              - [5056, 0]
              - [5888, 8]
              - [-1, 0]
          - - 5056
            - - [1, 14]
              - [32, 12]
              - [448, 5]
              - [704, 7]
              - [2368, 0]
              - [3584, 8]
              - [5056, 0]
              - [5888, 8]
              - [-1, 0]
          - - 5888
            - - [1, 14]
              - [32, 11]
              - [128, 5]
              - [256, 7]
              - [448, 5]
              - [704, 0]
              - [1408, 8]
              - [2368, 7]
              - [3584, 8]
              - [5056, 0]
              - [-1, 8]
          - - -1
            - - [1, 14]
              - [32, 12]
              - [64, 5]
              - [128, 6]
              - [256, 5]
              - [704, 0]
              - [1024, 8]
              - [1408, 6]
              - [1856, 7]
              - [2368, 0]
              - [3584, 8]
              - [5056, 0]
              - [-1, 8]
      - - 1280
        - - - 1
            - - [3584, 15]
              - [-1, 14]
          - - 32
            - - [128, 11]
              - [256, 12]
              - [448, 11]
              - [704, 12]
              - [2944, 11]
              - [-1, 12]
          - - 64
            - - [1, 15]
              - [32, 11]
              - [448, 2]
              - [2368, 3]
              - [-1, 5]
          - - 128
            - - [1, 15]
              - [32, 12]
              - [128, 2]
              - [1024, 3]
              - [5888, 5]
              - [-1, 6]
          - - 256
            - - [1, 15]
              - [32, 11]
              - [64, 2]
              - [448, 3]
              - [2944, 5]
              - [3584, 6]
              - [5056, 5]
              - [5888, 6]
              - [-1, 5]
          - - 448
            - - [1, 15]
              - [32, 11]
              - [256, 3]
              - [1408, 5]
              - [1856, 6]
              - [2368, 5]
              - [2944, 6]
              - [3584, 5]
              - [4288, 0]
              - [5888, 5]
              - [-1, 0]
          - - 704
            - - [1, 15]
              - [32, 11]
              - [128, 3]
              - [1024, 5]
              - [1408, 6]
              - [2368, 5]
              - [3584, 6]
              - [4288, 0]
              - [5056, 6]
              - [5888, 0]
              - [-1, 8]
          - - 1024
            - - [1, 15]
              - [32, 11]
              - [128, 3]
              - [704, 5]
              - [2368, 7]
              - [2944, 8]
              - [3584, 7]
              - [4288, 5]
              - [-1, 8]
          - - 1408
            - - [1, 15]
              - [32, 11]
              - [64, 2]
              - [448, 5]
              - [1024, 7]
              - [1408, 8]
              - [1856, 7]
              - [2368, 5]
              - [5888, 8]
              - [-1, 7]
          - - 1856
            - - [1, 15]
              - [32, 11]
              - [64, 3]
              - [256, 5]
              - [448, 7]
              - [704, 5]
              - [1408, 6]
              - [1856, 7]
              - [2368, 5]
              - [3584, 6]
              - [4288, 8]
              - [5056, 0]
              - [-1, 6]
          - - 2368
            - - [1, 15]
              - [32, 11]
              - [64, 3]
              - [704, 5]
              - [1024, 6]
              - [1856, 5]
              - [2368, 7]
              - [2944, 8]
              - [3584, 6]
              - [4288, 0]
              - [5056, 8]
              - [-1, 6]
          - - 2944
            - - [1, 15]
              - [32, 12]
              - [256, 5]
              - [704, 7]
              - [1408, 8]
              - [1856, 7]
              - [2368, 8]
              - [5056, 7]
              - [-1, 8]
          - - 3584
            - - [1, 15]
              - [32, 11]
              - [128, 5]
              - [256, 7]
              - [448, 5]
              - [1024, 7]
              - [1408, 8]
              - [2944, 7]
              - [3584, 6]
              - [4288, 8]
              - [5056, 7]
              - [-1, 8]
          - - 4288
            - - [1, 14]
              - [32, 12]
              - [256, 5]
              - [704, 0]
              - [1024, 5]
              - [1856, 8]
              - [2368, 0]
              - [2944, 6]
              - [3584, 8]
              - [5056, 0]
              - [5888, 8]
              - [-1, 0]
          - - 5056
            - - [1, 14]
              - [32, 12]
              - [448, 5]
              - [704, 7]
              - [1408, 8]
              - [1856, 0]
              - [2368, 8]
              - [3584, 6]
              - [4288, 0]
              - [5888, 8]
              - [-1, 0]
          - - 5888
            - - [1, 14]
              - [32, 12]
              - [128, 5]
              - [256, 6]
              - [448, 5]
              - [704, 0]
              - [1408, 8]
              - [2368, 7]
              - [-1, 8]
          - - -1
            - - [1, 14]
              - [32, 12]
              - [64, 5]
              - [128, 7]
              - [256, 5]
              - [448, 0]
              - [1024, 8]
              - [1408, 6]
              - [2368, 7]
              - [3584, 8]
              - [5056, 0]
              - [-1, 8]
      - - -1
        - - - 1
            - - [3584, 15]
              - [-1, 14]
          - - 32
            - - [-1, 12]
          - - 64
            - - [1, 15]
              - [32, 12]
              - [64, 2]
              - [128, 3]
              - [256, 2]
              - [2368, 3]
              - [-1, 5]
          - - 128
            - - [1, 15]
              - [32, 12]
              - [128, 2]
              - [1024, 3]
              - [5888, 5]
              - [-1, 6]
          - - 256
            - - [1, 15]
              - [32, 12]
              - [64, 2]
              - [448, 3]
              - [2944, 5]
              - [3584, 7]
              - [5056, 5]
              - [5888, 7]
              - [-1, 5]
          - - 448
            - - [1, 15]
              - [32, 12]
              - [64, 2]
              - [256, 3]
              - [1408, 5]
              - [1856, 6]
              - [2368, 5]
              - [2944, 6]
              - [3584, 5]
              - [4288, 6]
              - [5888, 5]
              - [-1, 0]
          - - 704
            - - [1, 15]
              - [32, 12]
              - [128, 3]
              - [1024, 5]
              - [1408, 6]
              - [2368, 5]
              - [3584, 6]
              - [4288, 0]
              - [5056, 6]
              - [5888, 0]
              - [-1, 8]
          - - 1024
            - - [1, 15]
              - [32, 12]
              - [128, 3]
              - [704, 5]
              - [1024, 6]
              - [2368, 7]
              - [2944, 8]
              - [3584, 6]
              - [4288, 5]
              - [-1, 8]
          - - 1408
            - - [1, 15]
              - [32, 12]
              - [64, 3]
              - [448, 5]
              - [704, 7]
              - [1024, 6]
              - [1856, 7]
              - [2368, 5]
              - [5888, 8]
              - [-1, 7]
          - - 1856
            - - [1, 15]
              - [32, 12]
              - [64, 3]
              - [256, 5]
              - [448, 7]
              - [704, 5]
              - [1856, 6]
              - [2368, 5]
              - [3584, 6]
              - [4288, 8]
              - [5056, 0]
              - [-1, 6]
          - - 2368
            - - [1, 15]
              - [32, 12]
              - [64, 3]
              - [704, 5]
              - [1024, 6]
              - [1856, 5]
              - [2368, 7]
              - [2944, 8]
              - [3584, 6]
              - [4288, 0]
              - [5056, 8]
              - [-1, 6]
          - - 2944
            - - [1, 15]
              - [32, 12]
              - [256, 5]
              - [704, 7]
              - [1408, 8]
              - [1856, 7]
              - [2368, 8]
              - [2944, 6]
              - [5056, 7]
              - [-1, 8]
          - - 3584
            - - [1, 15]
              - [32, 12]
              - [128, 5]
              - [256, 7]
              - [448, 5]
              - [1024, 7]
              - [1408, 8]
              - [3584, 7]
              - [4288, 8]
              - [5056, 7]
              - [-1, 8]
          - - 4288
            - - [1, 14]
              - [32, 12]
              - [256, 5]
              - [448, 7]
              - [704, 0]
              - [1024, 5]
              - [1856, 8]
              - [2368, 0]
              - [2944, 7]
              - [3584, 8]
              - [5056, 0]
              - [5888, 8]
              - [-1, 0]
          - - 5056
            - - [1, 14]
              - [32, 12]
              - [448, 5]
              - [704, 7]
              - [1408, 8]
              - [1856, 0]
              - [2368, 8]
              - [2944, 7]
              - [3584, 6]
              - [4288, 0]
              - [5888, 8]
              - [-1, 0]
          - - 5888
            - - [1, 14]
              - [32, 12]
              - [128, 5]
              - [256, 7]
              - [448, 5]
              - [704, 0]
              - [1408, 8]
              - [2368, 7]
              - [-1, 8]
          - - -1
            - - [1, 14]
              - [32, 12]
              - [64, 5]
              - [128, 7]
              - [256, 5]
              - [448, 7]
              - [1024, 8]
              - [2368, 7]
              - [2944, 6]
              - [3584, 7]
              - [5056, 0]
              - [5888, 8]
              - [-1, 0]
