library/src/blas3/Tensile/Logic/asm_full/vega20_Cijk_Ailk_Bljk_SB.yaml
- {MinimumRequiredVersion: 4.5.0}
- vega20
- gfx906
- [Device 66a0, Device 66a1, Device 66a7]
    SolutionIndex: 0
    SolutionNameMin: Cijk_Ailk_Bljk_SB_MT128x016x16_DTL0_GRVW02_LPB00_PBC0_PGR1_TT08_02_USFGRO00_VW02_WG16_08_02
    SolutionIndex: 1
    SolutionNameMin: Cijk_Ailk_Bljk_SB_MT128x016x16_DTL0_GRVW02_LPB00_PBC0_PGR1_TT08_02_USFGRO00_VW02_WG16_08_02
    SolutionIndex: 2
    SolutionNameMin: Cijk_Ailk_Bljk_SB_MT128x016x16_DTL0_GRVW04_LPB00_PBC0_PGR1_TT04_04_USFGRO00_VW04_WG32_04_02
    SolutionIndex: 3
    SolutionNameMin: Cijk_Ailk_Bljk_SB_MT064x008x32_DTL0_GRVW02_LPB00_PBC0_PGR0_TT04_02_USFGRO00_VW02_WG16_04_04
    SolutionIndex: 4
    SolutionNameMin: Cijk_Ailk_Bljk_SB_MT128x008x32_DTL0_GRVW02_LPB00_PBC0_PGR0_TT08_02_USFGRO00_VW02_WG16_04_04
    SolutionIndex: 5
    SolutionNameMin: Cijk_Ailk_Bljk_SB_MT064x008x32_DTL0_GRVW02_LPB00_PBC0_PGR0_TT04_02_USFGRO00_VW02_WG16_04_04
    SolutionIndex: 6
    SolutionNameMin: Cijk_Ailk_Bljk_SB_MT064x004x64_DTL0_GRVW02_LPB00_PBC0_PGR0_TT02_02_USFGRO00_VW02_WG32_02_04
    SolutionIndex: 7
    SolutionNameMin: Cijk_Ailk_Bljk_SB_MT064x004x64_DTL0_GRVW02_LPB00_PBC0_PGR0_TT04_02_USFGRO00_VW02_WG16_02_08
    SolutionIndex: 8
    SolutionNameMin: Cijk_Ailk_Bljk_SB_MT048x096x08_DTL0_GRVW02_LPB00_PBC0_PGR1_TT04_06_USFGRO00_VW02_WG12_16_01
    SolutionIndex: 9
    SolutionNameMin: Cijk_Ailk_Bljk_SB_MT036x048x16_DTL0_GRVW01_LPB00_PBC1_PGR1_TT03_03_USFGRO01_VW01_WG12_16_01
    SolutionIndex: 10
    SolutionNameMin: Cijk_Ailk_Bljk_SB_MT036x048x16_DTL0_GRVW01_LPB00_PBC1_PGR1_TT03_03_USFGRO01_VW01_WG12_16_01
    SolutionIndex: 11
    SolutionNameMin: Cijk_Ailk_Bljk_SB_MT048x036x16_DTL0_GRVW01_LPB00_PBC1_PGR1_TT06_03_USFGRO01_VW01_WG08_12_02
    SolutionIndex: 12
    SolutionNameMin: Cijk_Ailk_Bljk_SB_MT048x024x32_DTL0_GRVW02_LPB00_PBC0_PGR1_TT06_04_USFGRO00_VW02_WG08_06_04
    SolutionIndex: 13
    SolutionNameMin: Cijk_Ailk_Bljk_SB_MT032x016x08_DTL0_GRVW02_LPB00_PBC0_PGR1_TT04_02_USFGRO00_VW02_WG08_08_02
    SolutionIndex: 14
    SolutionNameMin: Cijk_Ailk_Bljk_SB_MT128x016x16_DTL0_GRVW04_LPB00_PBC0_PGR1_TT04_04_USFGRO00_VW04_WG32_04_02
    SolutionIndex: 15
    SolutionNameMin: Cijk_Ailk_Bljk_SB_MT256x016x16_DTL0_GRVW04_LPB00_PBC0_PGR1_TT08_04_USFGRO00_VW04_WG32_04_02
    SolutionIndex: 16
    SolutionNameMin: Cijk_Ailk_Bljk_SB_MT256x032x16_DTL0_GRVW04_LPB00_PBC0_PGR1_TT08_08_USFGRO00_VW04_WG32_04_02
    SolutionIndex: 17
    SolutionNameMin: Cijk_Ailk_Bljk_SB_MT032x016x16_DTL0_GRVW02_LPB00_PBC0_PGR1_TT04_02_USFGRO00_VW02_WG08_08_02
    SolutionIndex: 18
    SolutionNameMin: Cijk_Ailk_Bljk_SB_MT032x032x16_DTL0_GRVW04_LPB00_PBC0_PGR1_TT04_04_USFGRO00_VW04_WG08_08_02
    SolutionIndex: 19
    SolutionNameMin: Cijk_Ailk_Bljk_SB_MT128x032x16_DTL0_GRVW04_LPB00_PBC0_PGR1_TT08_04_USFGRO00_VW04_WG16_08_02
    SolutionIndex: 20
    SolutionNameMin: Cijk_Ailk_Bljk_SB_MT064x016x16_DTL0_GRVW04_LPB00_PBC0_PGR1_TT04_04_USFGRO00_VW04_WG16_04_04
    SolutionIndex: 21
    SolutionNameMin: Cijk_Ailk_Bljk_SB_MT032x032x16_DTL0_GRVW04_LPB00_PBC0_PGR1_TT04_04_USFGRO00_VW04_WG08_08_02
    SolutionIndex: 22
    SolutionNameMin: Cijk_Ailk_Bljk_SB_MT064x032x16_DTL0_GRVW04_LPB00_PBC0_PGR1_TT04_04_USFGRO00_VW04_WG16_08_02
    SolutionIndex: 23
    SolutionNameMin: Cijk_Ailk_Bljk_SB_MT032x016x16_DTL0_GRVW02_LPB00_PBC0_PGR1_TT04_02_USFGRO00_VW02_WG08_08_02
    SolutionIndex: 24
    SolutionNameMin: Cijk_Ailk_Bljk_SB_MT016x016x16_DTL0_GRVW02_LPB00_PBC1_PGR1_TT02_02_USFGRO01_VW02_WG08_08_04
    SolutionIndex: 25
    SolutionNameMin: Cijk_Ailk_Bljk_SB_MT064x016x16_DTL0_GRVW02_LPB00_PBC0_PGR1_TT04_02_USFGRO00_VW02_WG16_08_02
    SolutionIndex: 26
    SolutionNameMin: Cijk_Ailk_Bljk_SB_MT064x032x16_DTL0_GRVW04_LPB00_PBC0_PGR1_TT04_04_USFGRO00_VW04_WG16_08_02
    SolutionIndex: 27
    SolutionNameMin: Cijk_Ailk_Bljk_SB_MT128x032x16_DTL0_GRVW04_LPB00_PBC0_PGR1_TT08_04_USFGRO00_VW04_WG16_08_02
    SolutionIndex: 28
    SolutionNameMin: Cijk_Ailk_Bljk_SB_MT032x016x16_DTL0_GRVW02_LPB00_PBC0_PGR1_TT04_02_USFGRO00_VW02_WG08_08_02
    SolutionIndex: 29
    SolutionNameMin: Cijk_Ailk_Bljk_SB_MT032x016x16_DTL0_GRVW02_LPB00_PBC0_PGR1_TT02_02_USFGRO00_VW02_WG16_08_02
    SolutionIndex: 30
    SolutionNameMin: Cijk_Ailk_Bljk_SB_MT064x032x16_DTL0_GRVW04_LPB00_PBC0_PGR1_TT04_04_USFGRO00_VW04_WG16_08_02
    SolutionIndex: 31
    SolutionNameMin: Cijk_Ailk_Bljk_SB_MT128x032x16_DTL0_GRVW04_LPB00_PBC0_PGR1_TT08_04_USFGRO00_VW04_WG16_08_02
    SolutionIndex: 32
    SolutionNameMin: Cijk_Ailk_Bljk_SB_MT128x016x32_DTL0_GRVW04_LPB00_PBC0_PGR1_TT04_04_USFGRO00_VW04_WG32_04_02
    SolutionIndex: 33
    SolutionNameMin: Cijk_Ailk_Bljk_SB_MT032x008x32_DTL0_GRVW02_LPB00_PBC0_PGR1_TT02_02_USFGRO00_VW02_WG16_04_04
    SolutionIndex: 34
    SolutionNameMin: Cijk_Ailk_Bljk_SB_MT128x032x32_DTL0_GRVW04_LPB00_PBC0_PGR1_TT08_08_USFGRO00_VW04_WG16_04_04
    SolutionIndex: 35
    SolutionNameMin: Cijk_Ailk_Bljk_SB_MT032x032x32_DTL0_GRVW04_LPB00_PBC0_PGR1_TT04_04_USFGRO00_VW04_WG08_08_04
    SolutionIndex: 36
    SolutionNameMin: Cijk_Ailk_Bljk_SB_MT064x032x32_DTL0_GRVW04_LPB00_PBC0_PGR1_TT08_04_USFGRO00_VW04_WG08_08_04
    SolutionIndex: 37
    SolutionNameMin: Cijk_Ailk_Bljk_SB_MT032x008x32_DTL0_GRVW02_LPB00_PBC0_PGR1_TT02_02_USFGRO00_VW02_WG16_04_04
    SolutionIndex: 38
    SolutionNameMin: Cijk_Ailk_Bljk_SB_MT032x008x32_DTL0_GRVW02_LPB00_PBC0_PGR1_TT02_02_USFGRO00_VW02_WG16_04_04
    SolutionIndex: 39
    SolutionNameMin: Cijk_Ailk_Bljk_SB_MT064x008x32_DTL0_GRVW02_LPB00_PBC0_PGR1_TT04_02_USFGRO00_VW02_WG16_04_04
    SolutionIndex: 40
    SolutionNameMin: Cijk_Ailk_Bljk_SB_MT032x016x32_DTL0_GRVW02_LPB00_PBC0_PGR1_TT04_02_USFGRO00_VW02_WG08_08_04
    SolutionIndex: 41
    SolutionNameMin: Cijk_Ailk_Bljk_SB_MT064x008x32_DTL0_GRVW02_LPB00_PBC0_PGR1_TT04_02_USFGRO00_VW02_WG16_04_04
    SolutionIndex: 42
    SolutionNameMin: Cijk_Ailk_Bljk_SB_MT032x008x32_DTL0_GRVW02_LPB00_PBC0_PGR1_TT02_02_USFGRO00_VW02_WG16_04_04
    SolutionIndex: 43
    SolutionNameMin: Cijk_Ailk_Bljk_SB_MT064x064x08_DTL0_GRVW04_LPB00_PBC0_PGR1_TT04_04_USFGRO00_VW04_WG16_16_01
    SolutionIndex: 44
    SolutionNameMin: Cijk_Ailk_Bljk_SB_MT064x064x16_DTL0_GRVW04_LPB00_PBC0_PGR1_TT04_04_USFGRO00_VW04_WG16_16_01
    SolutionIndex: 45
    SolutionNameMin: Cijk_Ailk_Bljk_SB_MT128x064x08_DTL0_GRVW04_LPB00_PBC0_PGR1_TT08_04_USFGRO00_VW04_WG16_16_01
    SolutionIndex: 46
    SolutionNameMin: Cijk_Ailk_Bljk_SB_MT128x064x08_DTL0_GRVW04_LPB00_PBC0_PGR1_TT08_04_USFGRO00_VW04_WG16_16_01
    SolutionIndex: 47
    SolutionNameMin: Cijk_Ailk_Bljk_SB_MT128x128x08_DTL0_GRVW04_LPB00_PBC0_PGR1_TT08_08_USFGRO00_VW04_WG16_16_01
    SolutionIndex: 48
    SolutionNameMin: Cijk_Ailk_Bljk_SB_MT064x064x16_DTL0_GRVW04_LPB00_PBC0_PGR1_TT04_04_USFGRO00_VW04_WG16_16_01
    SolutionIndex: 49
    SolutionNameMin: Cijk_Ailk_Bljk_SB_MT128x064x16_DTL0_GRVW04_LPB00_PBC0_PGR1_TT08_04_USFGRO00_VW04_WG16_16_01
    SolutionIndex: 50
    SolutionNameMin: Cijk_Ailk_Bljk_SB_MT128x128x16_DTL0_GRVW04_LPB00_PBC0_PGR1_TT08_08_USFGRO00_VW04_WG16_16_01
    SolutionIndex: 51
    SolutionNameMin: Cijk_Ailk_Bljk_SB_MT064x064x16_DTL0_GRVW04_LPB00_PBC0_PGR1_TT04_04_USFGRO00_VW04_WG16_16_01
    SolutionIndex: 52
    SolutionNameMin: Cijk_Ailk_Bljk_SB_MT128x064x16_DTL0_GRVW04_LPB00_PBC0_PGR0_TT08_04_USFGRO00_VW04_WG16_16_01
    SolutionIndex: 53
    SolutionNameMin: Cijk_Ailk_Bljk_SB_MT128x064x16_DTL0_GRVW04_LPB00_PBC0_PGR1_TT08_04_USFGRO00_VW04_WG16_16_01
    SolutionIndex: 54
    SolutionNameMin: Cijk_Ailk_Bljk_SB_MT128x128x16_DTL0_GRVW04_LPB00_PBC0_PGR1_TT08_08_USFGRO00_VW04_WG16_16_01
    SolutionIndex: 55
    SolutionNameMin: Cijk_Ailk_Bljk_SB_MT128x128x32_DTL0_GRVW04_LPB00_PBC0_PGR0_TT08_08_USFGRO00_VW04_WG16_16_01
    SolutionIndex: 56
    SolutionNameMin: Cijk_Ailk_Bljk_SB_MT032x032x02_DTL0_GRVW04_LPB00_PBC0_PGR1_TT04_04_USFGRO00_VW04_WG08_08_01
    SolutionIndex: 57
    SolutionNameMin: Cijk_Ailk_Bljk_SB_MT128x064x08_DTL0_GRVW04_LPB00_PBC0_PGR1_TT04_08_USFGRO00_VW04_WG32_08_01
    SolutionIndex: 58
    SolutionNameMin: Cijk_Ailk_Bljk_SB_MT128x064x08_DTL0_GRVW04_LPB04_PBC0_PGR1_TT04_08_USFGRO00_VW04_WG32_08_01
    SolutionIndex: 59
    SolutionNameMin: Cijk_Ailk_Bljk_SB_MT128x032x16_DTL0_GRVW04_LPB04_PBC0_PGR1_TT04_04_USFGRO00_VW04_WG32_08_01
    SolutionIndex: 60
    SolutionNameMin: Cijk_Ailk_Bljk_SB_MT128x064x16_DTL0_GRVW04_LPB04_PBC0_PGR1_TT04_04_USFGRO00_VW04_WG32_16_01
    SolutionIndex: 61
    SolutionNameMin: Cijk_Ailk_Bljk_SB_MT064x032x16_DTL0_GRVW01_LPB02_PBC1_PGR0_TT04_04_USFGRO01_VW02_WG16_08_01
    SolutionIndex: 62
    SolutionNameMin: Cijk_Ailk_Bljk_SB_MT064x064x16_DTL0_GRVW01_LPB04_PBC1_PGR0_TT04_04_USFGRO01_VW02_WG16_16_01
    SolutionIndex: 63
    SolutionNameMin: Cijk_Ailk_Bljk_SB_MT128x032x16_DTL0_GRVW01_LPB04_PBC1_PGR0_TT04_04_USFGRO01_VW02_WG32_08_01
    SolutionIndex: 64
    SolutionNameMin: Cijk_Ailk_Bljk_SB_MT032x128x16_DTL0_GRVW01_LPB04_PBC1_PGR0_TT04_04_USFGRO01_VW04_WG08_32_01
    SolutionIndex: 65
    SolutionNameMin: Cijk_Ailk_Bljk_SB_MT064x064x16_DTL0_GRVW01_LPB04_PBC1_PGR0_TT04_04_USFGRO01_VW04_WG16_16_01
    SolutionIndex: 66
    SolutionNameMin: Cijk_Ailk_Bljk_SB_MT064x064x16_DTL0_GRVW04_LPB04_PBC0_PGR0_TT04_04_USFGRO00_VW04_WG16_16_01
    SolutionIndex: 67
    SolutionNameMin: Cijk_Ailk_Bljk_SB_MT128x032x16_DTL0_GRVW04_LPB04_PBC0_PGR0_TT04_04_USFGRO00_VW04_WG32_08_01
    SolutionIndex: 0
    SolutionNameMin: Cijk_Ailk_Bljk_SB_MT128x064x08_DTL0_GRVW01_GSU08_PGR1_PLR1_TT08_04_USFGRO01_VW01_WG16_16_01_WGM01
    SolutionIndex: 1
    SolutionNameMin: Cijk_Ailk_Bljk_SB_MT256x032x08_DTL1_GRVW01_GSU04_PGR0_PLR1_TT08_04_USFGRO01_VW01_WG32_08_01_WGM08
    SolutionIndex: 2
    SolutionNameMin: Cijk_Ailk_Bljk_SB_MT064x064x08_DTL0_GRVW01_GSU01_PGR1_PLR1_TT04_08_USFGRO01_VW04_WG16_08_01_WGM01
    SolutionIndex: 3
    SolutionNameMin: Cijk_Ailk_Bljk_SB_MT128x064x08_DTL0_GRVW01_GSU01_PGR1_PLR1_TT08_04_USFGRO01_VW04_WG16_16_01_WGM01
    SolutionIndex: 4
    SolutionNameMin: Cijk_Ailk_Bljk_SB_MT128x064x08_DTL0_GRVW01_GSU01_PGR1_PLR1_TT04_08_USFGRO01_VW04_WG32_08_01_WGM01
    SolutionIndex: 5
    SolutionNameMin: Cijk_Ailk_Bljk_SB_MT128x064x08_DTL0_GRVW01_GSU01_PGR1_PLR1_TT08_04_USFGRO01_VW04_WG16_16_01_WGM08
    SolutionIndex: 6
    SolutionNameMin: Cijk_Ailk_Bljk_SB_MT256x032x08_DTL1_GRVW01_GSU01_PGR0_PLR1_TT08_04_USFGRO01_VW04_WG32_08_01_WGM08
    SolutionIndex: 7
    SolutionNameMin: Cijk_Ailk_Bljk_SB_MT128x064x16_DTL0_GRVW01_GSU01_PGR1_PLR1_TT08_04_USFGRO01_VW04_WG16_16_01_WGM01
- - - [4096, 7000, 1, 4096]
    - [54, 9684.06]
  - - [5124, 9124, 1, 1760]
    - [46, 9725.96]
  - - [5124, 9124, 1, 2560]
    - [46, 9604.86]
  - - [1760, 32, 1, 1760]
    - [35, 3872.0]
  - - [1024, 1500, 1, 1536]
    - [53, 8435.7]
  - - [512, 24000, 1, 1536]
    - [54, 9577.41]
  - - [3072, 24000, 1, 1024]
    - [46, 9774.5]
  - - [1024, 3000, 1, 2560]
    - [54, 9182.15]
  - - [512, 3136, 1, 2048]
    - [54, 6765.0]
  - - [7680, 4, 1, 2560]
    - [14, 1227.27]
  - - [35, 1500, 1, 2048]
    - [12, 2192.52]
  - - [8448, 1500, 1, 2816]
    - [46, 9470.36]
  - - [2560, 7000, 1, 2560]
    - [46, 9746.09]
  - - [3072, 16, 1, 1024]
    - [29, 2313.04]
  - - [512, 48000, 1, 2048]
    - [49, 9314.2]
  - - [1760, 64, 1, 1760]
    - [21, 5057.31]
  - - [1024, 16, 1, 512]
    - [33, 1059.17]
  - - [196, 256, 64, 1024]
    - [63, 5813.06]
  - - [512, 48000, 1, 1536]
    - [46, 9850.93]
  - - [2560, 32, 1, 2560]
    - [30, 4435.6]
  - - [4608, 1500, 1, 1536]
    - [50, 9058.73]
  - - [2048, 128, 1, 2048]
    - [16, 5597.07]
  - - [1024, 24000, 1, 2560]
    - [46, 9871.13]
  - - [4608, 3000, 1, 1536]
    - [46, 9581.63]
  - - [5124, 9124, 1, 2048]
    - [54, 9423.3]
  - - [1024, 700, 1, 512]
    - [51, 6233.04]
  - - [3072, 1, 1, 128]
    - [33, 67.3315]
  - - [5124, 700, 1, 2560]
    - [51, 8382.21]
  - - [8448, 16, 1, 2816]
    - [25, 3998.25]
  - - [6144, 6000, 1, 2560]
    - [46, 9719.27]
  - - [4608, 32, 1, 1536]
    - [22, 3888.95]
  - - [35, 8457, 1, 2560]
    - [10, 4068.66]
  - - [3072, 64, 1, 1024]
    - [19, 3926.03]
  - - [512, 16, 1, 512]
    - [24, 689.853]
  - - [7680, 2, 1, 2560]
    - [14, 630.963]
  - - [4224, 1, 1, 128]
    - [33, 79.5106]
  - - [7680, 1, 1, 2560]
    - [14, 313.469]
  - - [128, 1500, 1, 1280]
    - [35, 4807.51]
  - - [35, 8457, 1, 4096]
    - [10, 3977.68]
  - - [1024, 1500, 1, 2816]
    - [46, 8869.3]
  - - [6144, 2, 1, 2560]
    - [14, 557.753]
  - - [8448, 48000, 1, 2816]
    - [55, 7449.5]
  - - [512, 6000, 1, 1536]
    - [54, 9038.07]
  - - [4224, 1500, 1, 176]
    - [45, 8381.96]
  - - [1024, 6000, 1, 2816]
    - [46, 9585.97]
  - - [512, 6000, 1, 2560]
    - [54, 9169.3]
  - - [512, 32, 1, 512]
    - [37, 1115.51]
  - - [2560, 128, 1, 2560]
    - [36, 6015.93]
  - - [4608, 24000, 1, 1536]
    - [46, 9984.75]
  - - [512, 2, 1, 500000]
    - [2, 718.779]
  - - [7680, 48000, 1, 2560]
    - [55, 7623.6]
  - - [3072, 48000, 1, 1024]
    - [54, 9880.21]
  - - [1760, 16, 1, 1760]
    - [23, 2670.34]
  - - [512, 3000, 1, 2816]
    - [46, 8875.12]
  - - [1760, 7000, 1, 1760]
    - [45, 9413.41]
  - - [64, 193600, 1, 256]
    - [48, 7210.26]
  - - [1024, 3000, 1, 2048]
    - [53, 8330.85]
  - - [6144, 4, 1, 2560]
    - [14, 1075.83]
  - - [1024, 6000, 1, 2048]
    - [49, 8867.71]
  - - [512, 24000, 1, 2816]
    - [46, 9776.64]
  - - [6144, 48000, 1, 2560]
    - [50, 8130.44]
  - - [8448, 3000, 1, 2816]
    - [46, 9729.72]
  - - [35, 1500, 1, 2560]
    - [9, 3054.55]
  - - [3072, 4, 1, 1024]
    - [33, 819.2]
  - - [4608, 48000, 1, 1536]
    - [47, 10018.1]
  - - [2048, 32, 1, 2048]
    - [28, 3403.09]
  - - [7680, 1500, 1, 2560]
    - [46, 9275.59]
  - - [4096, 128, 1, 4096]
    - [49, 6858.34]
  - - [4608, 16, 1, 1536]
    - [20, 3202.66]
  - - [1024, 1500, 1, 2048]
    - [53, 7478.43]
  - - [3072, 3000, 1, 1024]
    - [53, 8894.95]
  - - [3072, 2, 1, 1024]
    - [37, 413.912]
  - - [8448, 1, 1, 2816]
    - [3, 303.438]
  - - [1024, 48000, 1, 2560]
    - [45, 9963.8]
  - - [1024, 3000, 1, 2816]
    - [47, 9254.92]
  - - [128, 1, 1, 1408]
    - [42, 31.2889]
  - - [35, 8457, 1, 1760]
    - [8, 4256.14]
  - - [1024, 2, 1, 512]
    - [38, 170.223]
  - - [1024, 4, 1, 500000]
    - [4, 1297.12]
  - - [6144, 1, 1, 2560]
    - [14, 284.116]
  - - [1024, 48000, 1, 2816]
    - [45, 10009.7]
  - - [512, 48000, 1, 2816]
    - [46, 10047.3]
  - - [2048, 16, 1, 2048]
    - [40, 2489.2]
  - - [1024, 24000, 1, 1536]
    - [46, 9781.5]
  - - [64, 193600, 1, 64]
    - [48, 7419.4]
  - - [7680, 6000, 1, 2560]
    - [47, 9598.43]
  - - [1760, 128, 1, 1760]
    - [18, 5703.29]
  - - [35, 8457, 1, 2048]
    - [11, 3436.5]
  - - [512, 1500, 1, 2816]
    - [51, 8043.32]
  - - [512, 1, 1, 512]
    - [6, 48.9075]
  - - [512, 16, 1, 500000]
    - [1, 4896.25]
  - - [512, 8, 1, 500000]
    - [2, 2627.53]
  - - [512, 24000, 1, 2560]
    - [54, 9647.35]
  - - [6144, 3000, 1, 2560]
    - [46, 9522.19]
  - - [1024, 24000, 1, 2816]
    - [46, 10006.7]
  - - [2048, 7000, 1, 2048]
    - [54, 9412.23]
  - - [7680, 3000, 1, 2560]
    - [46, 9605.37]
  - - [1024, 4, 1, 512]
    - [38, 331.828]
  - - [5124, 700, 1, 2048]
    - [53, 7825.3]
  - - [5124, 9124, 1, 4096]
    - [50, 9270.03]
  - - [4096, 64, 1, 4096]
    - [16, 6563.21]
  - - [256, 193600, 1, 64]
    - [57, 8621.28]
  - - [512, 6000, 1, 2048]
    - [53, 7309.54]
  - - [7680, 32, 1, 2560]
    - [19, 6221.77]
  - - [2560, 64, 1, 2560]
    - [21, 4886.19]
  - - [3072, 128, 1, 1024]
    - [53, 4910.4]
  - - [8448, 6000, 1, 2816]
    - [45, 9790.1]
  - - [7680, 64, 1, 2560]
    - [19, 6388.56]
  - - [5124, 1500, 1, 2560]
    - [50, 8941.43]
  - - [1024, 1500, 1, 2560]
    - [53, 8626.18]
  - - [3025, 64, 64, 64]
    - [67, 7208.93]
  - - [512, 4, 1, 512]
    - [39, 184.608]
  - - [1024, 6000, 1, 2560]
    - [54, 9461.41]
  - - [3072, 32, 1, 1024]
    - [15, 2905.98]
  - - [35, 700, 1, 2560]
    - [12, 2450.0]
  - - [196, 1024, 64, 256]
    - [64, 7083.26]
  - - [512, 50176, 1, 128]
    - [58, 9132.22]
  - - [4608, 1, 1, 1536]
    - [3, 254.967]
  - - [49, 512, 64, 2048]
    - [61, 3371.13]
  - - [4096, 32, 1, 4096]
    - [31, 5876.43]
  - - [7680, 24000, 1, 2560]
    - [47, 9334.87]
  - - [8448, 4, 1, 2816]
    - [3, 1174.21]
  - - [64, 1, 1, 1216]
    - [42, 12.9707]
  - - [512, 1, 1, 500000]
    - [2, 344.161]
  - - [176, 1500, 1, 1408]
    - [18, 4922.03]
  - - [512, 3000, 1, 1536]
    - [53, 8506.26]
  - - [8448, 24000, 1, 2816]
    - [47, 9663.99]
  - - [4608, 2, 1, 1536]
    - [7, 509.934]
  - - [1024, 48000, 1, 1536]
    - [54, 9921.14]
  - - [7680, 128, 1, 2560]
    - [49, 7955.81]
  - - [3072, 6000, 1, 1024]
    - [54, 9348.56]
  - - [3072, 1500, 1, 128]
    - [45, 7561.85]
  - - [2048, 3136, 1, 512]
    - [60, 8599.2]
  - - [3025, 256, 64, 64]
    - [65, 8282.7]
  - - [1024, 3000, 1, 1536]
    - [54, 9105.04]
  - - [512, 4, 1, 500000]
    - [1, 1334.73]
  - - [35, 700, 1, 2048]
    - [12, 1861.13]
  - - [1024, 16, 1, 500000]
    - [0, 4900.47]
  - - [512, 24000, 1, 2048]
    - [53, 8984.47]
  - - [128, 50176, 1, 512]
    - [60, 8100.94]
  - - [1024, 32, 1, 512]
    - [33, 1530.77]
  - - [256, 12544, 1, 1024]
    - [59, 7412.84]
  - - [1024, 12544, 1, 256]
    - [57, 8939.58]
  - - [512, 48000, 1, 2560]
    - [45, 9942.51]
  - - [2560, 16, 1, 2560]
    - [25, 3165.99]
  - - [2048, 64, 1, 2048]
    - [34, 4628.2]
  - - [512, 2, 1, 512]
    - [41, 93.6229]
  - - [1024, 1, 1, 512]
    - [38, 84.0205]
  - - [512, 1500, 1, 2560]
    - [51, 7522.5]
  - - [6144, 32, 1, 2560]
    - [27, 5247.25]
  - - [1024, 1, 1, 500000]
    - [4, 327.182]
  - - [6144, 16, 1, 2560]
    - [17, 3645.11]
  - - [1024, 24000, 1, 2048]
    - [50, 9454.02]
  - - [4096, 16, 1, 4096]
    - [32, 3808.68]
  - - [5124, 1500, 1, 2048]
    - [50, 8592.58]
  - - [3072, 1500, 1, 1024]
    - [53, 8535.8]
  - - [1024, 2, 1, 500000]
    - [4, 651.732]
  - - [1024, 8, 1, 500000]
    - [4, 2541.7]
  - - [7680, 16, 1, 2560]
    - [14, 4292.75]
  - - [6144, 1500, 1, 2560]
    - [54, 9311.44]
  - - [3072, 1, 1, 1024]
    - [13, 191.813]
  - - [512, 6000, 1, 2816]
    - [45, 9353.39]
  - - [8448, 2, 1, 2816]
    - [5, 598.329]
  - - [4608, 4, 1, 1536]
    - [7, 991.301]
  - - [1024, 6000, 1, 1536]
    - [54, 9363.03]
  - - [8448, 32, 1, 2816]
    - [26, 5551.82]
  - - [512, 3000, 1, 2048]
    - [52, 6821.94]
  - - [6144, 24000, 1, 2560]
    - [45, 9790.68]
  - - [512, 3000, 1, 2560]
    - [49, 8635.29]
  - - [4608, 6000, 1, 1536]
    - [46, 9817.31]
  - - [1024, 1024, 1, 1024]
    - [53, 6569.64]
  - - [512, 1500, 1, 2048]
    - [49, 6138.25]
  - - [512, 1500, 1, 1536]
    - [51, 7008.37]
  - - [128, 1, 1, 1024]
    - [38, 21.0051]
  - - [49, 2048, 64, 512]
    - [62, 5747.22]
  - - [1024, 48000, 1, 2048]
    - [54, 9773.98]
  - - [3136, 64, 128, 64]
    - [71, 8110.53]
  - - [784, 512, 64, 128]
    - [70, 8186.45]
  - - [3136, 256, 64, 64]
    - [71, 8454.17]
  - - [784, 128, 128, 512]
    - [71, 7562.87]
  - - [784, 128, 64, 512]
    - [75, 7073.52]
  - - [3136, 512, 1, 2048]
    - [68, 7420.87]
  - - [12544, 256, 1, 1024]
    - [69, 7416.85]
  - - [3136, 64, 128, 256]
    - [72, 8912.43]
  - - [3136, 64, 64, 256]
    - [72, 8862.48]
  - - [3136, 2048, 1, 512]
    - [74, 8335.87]
  - - [784, 512, 128, 128]
    - [70, 8322.36]
  - - [3136, 64, 64, 64]
    - [71, 7850.3]
  - - [12544, 1024, 1, 256]
    - [73, 9004.2]
  - - [3136, 256, 128, 64]
    - [72, 8561.58]
- - - -1
    - - - 128
        - - - 4
            - - [-1, 56]
          - - 64
            - - [4, 56]
              - [64, 43]
              - [1408, 44]
              - [3584, 43]
              - [-1, 44]
          - - 128
            - - [4, 56]
              - [64, 43]
              - [448, 44]
              - [704, 43]
              - [1408, 44]
              - [4288, 43]
              - [-1, 44]
          - - 256
            - - [4, 56]
              - [64, 43]
              - [256, 44]
              - [704, 43]
              - [1856, 44]
              - [2368, 43]
              - [2944, 44]
              - [3584, 43]
              - [-1, 44]
          - - 448
            - - [4, 56]
              - [64, 43]
              - [128, 44]
              - [256, 43]
              - [2944, 44]
              - [3584, 43]
              - [5056, 44]
              - [5888, 43]
              - [-1, 44]
          - - 704
            - - [4, 56]
              - [64, 43]
              - [5888, 44]
              - [-1, 43]
          - - 1024
            - - [4, 56]
              - [64, 43]
              - [128, 44]
              - [2368, 43]
              - [-1, 44]
          - - 1408
            - - [4, 56]
              - [128, 43]
              - [448, 44]
              - [704, 43]
              - [-1, 44]
          - - 1856
            - - [4, 56]
              - [64, 43]
              - [256, 44]
              - [448, 43]
              - [1408, 44]
              - [2368, 43]
              - [2944, 44]
              - [4288, 43]
              - [5056, 44]
              - [-1, 43]
          - - 2368
            - - [4, 56]
              - [64, 43]
              - [448, 44]
              - [704, 43]
              - [1856, 44]
              - [2368, 43]
              - [4288, 44]
              - [-1, 43]
          - - 2944
            - - [4, 56]
              - [256, 44]
              - [448, 43]
              - [2368, 44]
              - [2944, 43]
              - [-1, 44]
          - - 3584
            - - [4, 56]
              - [64, 43]
              - [-1, 44]
          - - 4288
            - - [4, 56]
              - [64, 44]
              - [128, 43]
              - [1024, 44]
              - [-1, 43]
          - - 5056
            - - [4, 56]
              - [704, 44]
              - [-1, 43]
          - - 5888
            - - [4, 56]
              - [-1, 44]
          - - -1
            - - [4, 56]
              - [64, 44]
              - [128, 43]
              - [-1, 44]
      - - 256
        - - - 4
            - - [-1, 24]
          - - 64
            - - [4, 24]
              - [64, 37]
              - [448, 33]
              - [1856, 17]
              - [-1, 48]
          - - 128
            - - [4, 24]
              - [256, 33]
              - [1024, 17]
              - [-1, 48]
          - - 256
            - - [4, 24]
              - [128, 33]
              - [256, 37]
              - [5056, 48]
              - [5888, 46]
              - [-1, 48]
          - - 448
            - - [4, 24]
              - [64, 37]
              - [256, 17]
              - [448, 48]
              - [704, 51]
              - [1024, 48]
              - [1408, 51]
              - [-1, 48]
          - - 704
            - - [4, 24]
              - [128, 17]
              - [1024, 48]
              - [1856, 51]
              - [2368, 48]
              - [2944, 51]
              - [3584, 48]
              - [5056, 51]
              - [-1, 48]
          - - 1024
            - - [4, 24]
              - [64, 33]
              - [128, 48]
              - [256, 51]
              - [448, 48]
              - [704, 51]
              - [1024, 53]
              - [2944, 46]
              - [3584, 49]
              - [4288, 46]
              - [5056, 45]
              - [-1, 46]
          - - 1408
            - - [4, 24]
              - [64, 17]
              - [256, 48]
              - [448, 51]
              - [704, 49]
              - [1024, 45]
              - [1408, 50]
              - [1856, 46]
              - [2368, 51]
              - [-1, 46]
          - - 1856
            - - [4, 24]
              - [256, 48]
              - [704, 51]
              - [1024, 46]
              - [1408, 51]
              - [1856, 46]
              - [2368, 51]
              - [2944, 46]
              - [3584, 48]
              - [-1, 46]
          - - 2368
            - - [4, 24]
              - [64, 48]
              - [128, 51]
              - [256, 48]
              - [704, 51]
              - [1024, 46]
              - [1408, 48]
              - [3584, 46]
              - [4288, 45]
              - [5056, 46]
              - [5888, 45]
              - [-1, 46]
          - - 2944
            - - [4, 24]
              - [256, 48]
              - [-1, 46]
          - - 3584
            - - [4, 24]
              - [64, 48]
              - [128, 51]
              - [256, 49]
              - [448, 51]
              - [704, 46]
              - [1024, 45]
              - [1856, 46]
              - [-1, 45]
          - - 4288
            - - [4, 24]
              - [128, 48]
              - [256, 51]
              - [448, 48]
              - [704, 46]
              - [1024, 51]
              - [-1, 46]
          - - 5056
            - - [4, 24]
              - [64, 51]
              - [128, 48]
              - [256, 51]
              - [448, 48]
              - [-1, 46]
          - - 5888
            - - [4, 24]
              - [64, 48]
              - [128, 51]
              - [256, 45]
              - [448, 51]
              - [3584, 46]
              - [4288, 45]
              - [-1, 46]
          - - -1
            - - [4, 24]
              - [128, 48]
              - [256, 51]
              - [448, 49]
              - [5888, 46]
              - [-1, 50]
      - - 1280
        - - - 4
            - - [-1, 24]
          - - 64
            - - [4, 24]
              - [128, 38]
              - [256, 33]
              - [704, 25]
              - [1024, 35]
              - [1408, 20]
              - [1856, 35]
              - [2368, 18]
              - [5056, 35]
              - [5888, 48]
              - [-1, 51]
          - - 128
            - - [4, 24]
              - [64, 38]
              - [128, 39]
              - [256, 25]
              - [448, 35]
              - [704, 20]
              - [1024, 18]
              - [1408, 22]
              - [1856, 48]
              - [2368, 35]
              - [2944, 48]
              - [3584, 51]
              - [4288, 22]
              - [5888, 48]
              - [-1, 53]
          - - 256
            - - [4, 24]
              - [64, 39]
              - [128, 25]
              - [256, 20]
              - [448, 35]
              - [2944, 48]
              - [3584, 49]
              - [5056, 48]
              - [5888, 45]
              - [-1, 48]
          - - 448
            - - [4, 24]
              - [64, 23]
              - [128, 35]
              - [256, 18]
              - [448, 21]
              - [704, 51]
              - [1408, 48]
              - [1856, 49]
              - [2368, 48]
              - [2944, 45]
              - [5888, 48]
              - [-1, 51]
          - - 704
            - - [4, 24]
              - [64, 25]
              - [128, 35]
              - [1024, 48]
              - [1856, 51]
              - [2944, 48]
              - [3584, 51]
              - [4288, 48]
              - [5888, 51]
              - [-1, 46]
          - - 1024
            - - [4, 24]
              - [128, 35]
              - [704, 51]
              - [1024, 53]
              - [1856, 46]
              - [2368, 45]
              - [2944, 47]
              - [3584, 45]
              - [4288, 46]
              - [5056, 45]
              - [-1, 46]
          - - 1408
            - - [4, 24]
              - [64, 35]
              - [128, 18]
              - [448, 48]
              - [704, 49]
              - [-1, 46]
          - - 1856
            - - [4, 24]
              - [64, 21]
              - [128, 48]
              - [256, 51]
              - [448, 49]
              - [704, 51]
              - [1024, 46]
              - [1408, 51]
              - [2944, 46]
              - [3584, 45]
              - [5056, 46]
              - [-1, 45]
          - - 2368
            - - [4, 24]
              - [64, 21]
              - [128, 22]
              - [256, 51]
              - [448, 48]
              - [704, 51]
              - [2368, 46]
              - [2944, 45]
              - [5056, 46]
              - [5888, 45]
              - [-1, 46]
          - - 2944
            - - [4, 24]
              - [64, 22]
              - [128, 48]
              - [256, 51]
              - [448, 45]
              - [2368, 46]
              - [4288, 45]
              - [5056, 46]
              - [-1, 45]
          - - 3584
            - - [4, 24]
              - [64, 48]
              - [128, 51]
              - [256, 49]
              - [448, 51]
              - [704, 46]
              - [1856, 45]
              - [2368, 46]
              - [2944, 45]
              - [-1, 46]
          - - 4288
            - - [4, 24]
              - [64, 35]
              - [128, 48]
              - [256, 51]
              - [448, 45]
              - [2944, 46]
              - [-1, 45]
          - - 5056
            - - [4, 24]
              - [64, 22]
              - [256, 48]
              - [448, 51]
              - [1408, 46]
              - [2944, 45]
              - [4288, 46]
              - [5056, 45]
              - [5888, 46]
              - [-1, 45]
          - - 5888
            - - [4, 24]
              - [64, 48]
              - [128, 51]
              - [256, 46]
              - [448, 48]
              - [704, 45]
              - [1024, 46]
              - [3584, 45]
              - [4288, 46]
              - [5056, 54]
              - [5888, 50]
              - [-1, 45]
          - - -1
            - - [4, 24]
              - [64, 48]
              - [128, 49]
              - [256, 48]
              - [1408, 46]
              - [2944, 45]
              - [4288, 46]
              - [5056, 54]
              - [-1, 45]
      - - -1
        - - - 4
            - - [-1, 24]
          - - 64
            - - [4, 24]
              - [64, 42]
              - [128, 38]
              - [256, 39]
              - [704, 25]
              - [1024, 35]
              - [1408, 20]
              - [2368, 18]
              - [2944, 22]
              - [3584, 35]
              - [4288, 26]
              - [5888, 36]
              - [-1, 48]
          - - 128
            - - [4, 24]
              - [64, 38]
              - [128, 41]
              - [256, 23]
              - [448, 35]
              - [704, 20]
              - [1024, 18]
              - [1408, 36]
              - [1856, 18]
              - [2368, 36]
              - [2944, 19]
              - [3584, 48]
              - [4288, 22]
              - [5056, 19]
              - [5888, 48]
              - [-1, 53]
          - - 256
            - - [4, 24]
              - [64, 39]
              - [128, 23]
              - [256, 35]
              - [448, 36]
              - [704, 48]
              - [1856, 51]
              - [2944, 48]
              - [3584, 49]
              - [5056, 51]
              - [5888, 45]
              - [-1, 48]
          - - 448
            - - [4, 24]
              - [64, 25]
              - [128, 35]
              - [256, 18]
              - [448, 21]
              - [1024, 48]
              - [1408, 51]
              - [1856, 49]
              - [2368, 51]
              - [2944, 46]
              - [3584, 48]
              - [5056, 51]
              - [5888, 48]
              - [-1, 51]
          - - 704
            - - [4, 24]
              - [64, 25]
              - [128, 20]
              - [704, 48]
              - [1024, 51]
              - [1408, 48]
              - [5888, 51]
              - [-1, 45]
          - - 1024
            - - [4, 24]
              - [64, 31]
              - [128, 34]
              - [704, 51]
              - [1024, 49]
              - [4288, 46]
              - [5056, 47]
              - [5888, 46]
              - [-1, 45]
          - - 1408
            - - [4, 24]
              - [64, 20]
              - [128, 36]
              - [448, 48]
              - [704, 49]
              - [1024, 46]
              - [1408, 47]
              - [-1, 46]
          - - 1856
            - - [4, 24]
              - [64, 21]
              - [128, 19]
              - [256, 51]
              - [448, 49]
              - [704, 51]
              - [1024, 46]
              - [1408, 48]
              - [2944, 46]
              - [4288, 45]
              - [5888, 46]
              - [-1, 45]
          - - 2368
            - - [4, 24]
              - [64, 21]
              - [128, 36]
              - [704, 51]
              - [1408, 46]
              - [2368, 45]
              - [2944, 46]
              - [3584, 45]
              - [5056, 46]
              - [-1, 45]
          - - 2944
            - - [4, 24]
              - [64, 36]
              - [128, 21]
              - [256, 48]
              - [448, 45]
              - [3584, 46]
              - [4288, 45]
              - [5056, 46]
              - [-1, 45]
          - - 3584
            - - [4, 24]
              - [64, 19]
              - [128, 51]
              - [256, 49]
              - [448, 51]
              - [1408, 45]
              - [-1, 46]
          - - 4288
            - - [4, 24]
              - [128, 21]
              - [256, 48]
              - [448, 45]
              - [1024, 46]
              - [1408, 45]
              - [1856, 46]
              - [2368, 45]
              - [3584, 46]
              - [4288, 45]
              - [-1, 46]
          - - 5056
            - - [4, 24]
              - [64, 36]
              - [128, 19]
              - [448, 51]
              - [1856, 46]
              - [2368, 47]
              - [2944, 45]
              - [3584, 46]
              - [5056, 45]
              - [5888, 47]
              - [-1, 45]
          - - 5888
            - - [4, 24]
              - [64, 19]
              - [128, 51]
              - [256, 46]
              - [448, 45]
              - [704, 46]
              - [1408, 45]
              - [2368, 46]
              - [4288, 45]
              - [5056, 46]
              - [-1, 47]
          - - -1
            - - [4, 24]
              - [64, 48]
              - [128, 53]
              - [256, 48]
              - [448, 45]
              - [704, 46]
              - [1856, 45]
              - [2368, 47]
              - [4288, 45]
              - [5888, 47]
              - [-1, 45]
