library/src/blas3/Tensile/Logic/asm_full/vega20_Cijk_Ailk_Bjlk_SB.yaml
- {MinimumRequiredVersion: 4.3.0}
- vega20
- gfx906
- [Device 66a0, Device 66a1, Device 66a7]
    SolutionIndex: 0
    SolutionNameMin: Cijk_Ailk_Bjlk_SB_MT064x016x08_GRVW02_GSU01_TT04_02_VW02_WG16_08_01
    SolutionIndex: 1
    SolutionNameMin: Cijk_Ailk_Bjlk_SB_MT032x016x16_GRVW02_GSU01_TT02_02_VW02_WG16_08_01
    SolutionIndex: 2
    SolutionNameMin: Cijk_Ailk_Bjlk_SB_MT032x032x16_GRVW04_GSU02_TT04_04_VW04_WG08_08_02
    SolutionIndex: 3
    SolutionNameMin: Cijk_Ailk_Bjlk_SB_MT016x016x32_GRVW02_GSU02_TT02_02_VW02_WG08_08_04
    SolutionIndex: 4
    SolutionNameMin: Cijk_Ailk_Bjlk_SB_MT016x016x16_GRVW02_GSU08_TT02_02_VW02_WG08_08_04
    SolutionIndex: 5
    SolutionNameMin: Cijk_Ailk_Bjlk_SB_MT016x016x32_GRVW02_GSU04_TT02_02_VW02_WG08_08_04
    SolutionIndex: 6
    SolutionNameMin: Cijk_Ailk_Bjlk_SB_MT016x016x08_GRVW02_GSU08_TT02_02_VW02_WG08_08_02
    SolutionIndex: 7
    SolutionNameMin: Cijk_Ailk_Bjlk_SB_MT032x032x32_GRVW04_GSU02_TT04_04_VW04_WG08_08_04
    SolutionIndex: 8
    SolutionNameMin: Cijk_Ailk_Bjlk_SB_MT032x032x32_GRVW04_GSU02_TT04_04_VW04_WG08_08_04
    SolutionIndex: 9
    SolutionNameMin: Cijk_Ailk_Bjlk_SB_MT064x032x16_GRVW04_GSU02_TT04_04_VW04_WG16_08_02
    SolutionIndex: 10
    SolutionNameMin: Cijk_Ailk_Bjlk_SB_MT016x016x16_GRVW02_GSU02_TT02_02_VW02_WG08_08_04
    SolutionIndex: 11
    SolutionNameMin: Cijk_Ailk_Bjlk_SB_MT064x064x08_GRVW04_GSU01_TT04_04_VW04_WG16_16_01
    SolutionIndex: 12
    SolutionNameMin: Cijk_Ailk_Bjlk_SB_MT064x064x08_GRVW04_GSU01_TT04_04_VW04_WG16_16_01
    SolutionIndex: 13
    SolutionNameMin: Cijk_Ailk_Bjlk_SB_MT128x128x08_GRVW04_GSU01_TT08_08_VW04_WG16_16_01
    SolutionIndex: 14
    SolutionNameMin: Cijk_Ailk_Bjlk_SB_MT064x064x16_GRVW04_GSU01_TT04_04_VW04_WG16_16_01
    SolutionIndex: 15
    SolutionNameMin: Cijk_Ailk_Bjlk_SB_MT064x064x16_GRVW04_GSU01_TT04_04_VW04_WG16_16_01
    SolutionIndex: 16
    SolutionNameMin: Cijk_Ailk_Bjlk_SB_MT128x128x16_GRVW04_GSU01_TT08_08_VW04_WG16_16_01
    SolutionIndex: 17
    SolutionNameMin: Cijk_Ailk_Bjlk_SB_MT128x128x16_GRVW04_GSU01_TT08_08_VW04_WG16_16_01
    SolutionIndex: 18
    SolutionNameMin: Cijk_Ailk_Bjlk_SB_MT128x064x16_GRVW04_GSU01_TT08_04_VW04_WG16_16_01
    SolutionIndex: 19
    SolutionNameMin: Cijk_Ailk_Bjlk_SB_MT064x128x08_GRVW04_GSU01_TT04_08_VW04_WG16_16_01
    SolutionIndex: 20
    SolutionNameMin: Cijk_Ailk_Bjlk_SB_MT064x128x08_GRVW04_GSU01_TT04_08_VW04_WG16_16_01
    SolutionIndex: 21
    SolutionNameMin: Cijk_Ailk_Bjlk_SB_MT128x064x08_GRVW04_GSU01_TT08_04_VW04_WG16_16_01
    SolutionIndex: 22
    SolutionNameMin: Cijk_Ailk_Bjlk_SB_MT128x064x08_GRVW04_GSU01_TT08_04_VW04_WG16_16_01
    SolutionIndex: 23
    SolutionNameMin: Cijk_Ailk_Bjlk_SB_MT016x016x04_GRVW02_GSU01_TT02_02_VW02_WG08_08_01
    SolutionIndex: 24
    SolutionNameMin: Cijk_Ailk_Bjlk_SB_MT016x016x04_GRVW02_GSU04_TT02_02_VW02_WG08_08_01
    SolutionIndex: 0
    SolutionNameMin: Cijk_Ailk_Bjlk_SB_MT064x128x08_DTL0_GRVW04_GSU01_PGR1_PLR1_TT04_08_VW04_WG16_16_01_WGM01
    SolutionIndex: 1
    SolutionNameMin: Cijk_Ailk_Bjlk_SB_MT064x064x08_DTL0_GRVW04_GSU01_PGR1_PLR1_TT04_08_VW04_WG16_08_01_WGM01
    SolutionIndex: 2
    SolutionNameMin: Cijk_Ailk_Bjlk_SB_MT032x128x08_DTL0_GRVW04_GSU01_PGR1_PLR1_TT04_04_VW04_WG08_32_01_WGM01
    SolutionIndex: 3
    SolutionNameMin: Cijk_Ailk_Bjlk_SB_MT064x064x16_DTL0_GRVW04_GSU01_PGR1_PLR1_TT04_04_VW04_WG16_16_01_WGM01
    SolutionIndex: 4
    SolutionNameMin: Cijk_Ailk_Bjlk_SB_MT064x128x08_DTL0_GRVW04_GSU01_PGR1_PLR1_TT04_08_VW02_WG16_16_01_WGM64
    SolutionIndex: 5
    SolutionNameMin: Cijk_Ailk_Bjlk_SB_MT064x128x08_DTL0_GRVW04_GSU01_PGR1_PLR1_TT04_08_VW02_WG16_16_01_WGM01
    SolutionIndex: 6
    SolutionNameMin: Cijk_Ailk_Bjlk_SB_MT064x064x08_DTL0_GRVW01_GSU01_PGR1_PLR1_TT04_04_VW04_WG16_16_01_WGM01
    SolutionIndex: 7
    SolutionNameMin: Cijk_Ailk_Bjlk_SB_MT064x128x08_DTL0_GRVW04_GSU01_PGR1_PLR1_TT04_08_VW04_WG16_16_01_WGM64
    SolutionIndex: 8
    SolutionNameMin: Cijk_Ailk_Bjlk_SB_MT032x128x08_DTL0_GRVW04_GSU01_PGR1_PLR1_TT04_04_VW04_WG08_32_01_WGM64
    SolutionIndex: 9
    SolutionNameMin: Cijk_Ailk_Bjlk_SB_MT032x128x08_DTL0_GRVW04_GSU01_PGR1_PLR1_TT04_04_VW04_WG08_32_01_WGM08
- - - [4096, 7133, 1, 4096]
    - [16, 9389.96]
  - - [512, 16, 1, 512]
    - [3, 616.809]
  - - [2048, 7133, 1, 2048]
    - [16, 9287.47]
  - - [2560, 7133, 1, 2560]
    - [22, 9336.98]
  - - [1024, 1024, 1, 1024]
    - [18, 7899.69]
  - - [3072, 7435, 1, 1024]
    - [22, 9209.09]
  - - [1024, 32, 1, 512]
    - [10, 1664.41]
  - - [1760, 7133, 1, 1760]
    - [20, 8922.17]
  - - [7680, 5481, 1, 2560]
    - [21, 9354.04]
  - - [1024, 16, 1, 512]
    - [5, 1115.51]
  - - [512, 32, 1, 512]
    - [3, 1233.62]
  - - [3136, 256, 64, 64]
    - [26, 8023.34]
  - - [784, 512, 64, 128]
    - [25, 8118.42]
  - - [49, 2048, 128, 512]
    - [30, 6709.69]
  - - [784, 128, 64, 512]
    - [32, 8457.53]
  - - [196, 1024, 64, 256]
    - [33, 7259.55]
  - - [3136, 64, 128, 64]
    - [31, 7772.99]
  - - [784, 512, 128, 128]
    - [25, 8225.65]
  - - [196, 1024, 128, 256]
    - [34, 7369.53]
  - - [196, 256, 64, 1024]
    - [27, 7306.01]
  - - [3136, 64, 64, 64]
    - [31, 7555.78]
  - - [3136, 64, 64, 256]
    - [26, 8713.92]
  - - [3136, 64, 128, 256]
    - [26, 8912.31]
  - - [784, 128, 128, 512]
    - [25, 8609.88]
  - - [49, 2048, 64, 512]
    - [29, 6575.52]
  - - [196, 256, 128, 1024]
    - [27, 7483.58]
  - - [49, 512, 64, 2048]
    - [28, 6562.92]
  - - [49, 512, 128, 2048]
    - [26, 6808.05]
  - - [3136, 256, 128, 64]
    - [26, 8120.83]
- - - -1
    - - - 128
        - - - 4
            - - [-1, 23]
          - - 64
            - - [4, 23]
              - [3584, 1]
              - [-1, 0]
          - - 128
            - - [4, 23]
              - [1856, 1]
              - [-1, 0]
          - - 256
            - - [4, 23]
              - [448, 1]
              - [704, 12]
              - [-1, 11]
          - - 448
            - - [4, 23]
              - [448, 1]
              - [704, 12]
              - [1408, 11]
              - [2368, 12]
              - [2944, 11]
              - [-1, 12]
          - - 704
            - - [4, 23]
              - [128, 1]
              - [256, 11]
              - [448, 12]
              - [1024, 11]
              - [1408, 12]
              - [1856, 11]
              - [2368, 13]
              - [2944, 11]
              - [-1, 12]
          - - 1024
            - - [4, 23]
              - [128, 1]
              - [2944, 12]
              - [5888, 11]
              - [-1, 13]
          - - 1408
            - - [4, 23]
              - [128, 1]
              - [256, 12]
              - [704, 11]
              - [2368, 12]
              - [2944, 11]
              - [3584, 12]
              - [-1, 11]
          - - 1856
            - - [4, 23]
              - [128, 1]
              - [256, 11]
              - [448, 12]
              - [704, 11]
              - [1024, 13]
              - [1408, 12]
              - [2368, 11]
              - [4288, 12]
              - [5056, 11]
              - [5888, 13]
              - [-1, 12]
          - - 2368
            - - [4, 23]
              - [64, 1]
              - [128, 0]
              - [256, 11]
              - [1408, 12]
              - [1856, 11]
              - [4288, 12]
              - [-1, 13]
          - - 2944
            - - [4, 23]
              - [64, 1]
              - [128, 0]
              - [448, 11]
              - [1408, 12]
              - [1856, 11]
              - [2368, 12]
              - [2944, 11]
              - [5056, 12]
              - [-1, 13]
          - - 3584
            - - [4, 23]
              - [128, 0]
              - [1408, 12]
              - [1856, 11]
              - [2368, 12]
              - [2944, 11]
              - [-1, 13]
          - - 4288
            - - [4, 23]
              - [128, 0]
              - [256, 12]
              - [704, 11]
              - [1024, 12]
              - [1408, 13]
              - [2944, 12]
              - [3584, 13]
              - [5056, 12]
              - [5888, 13]
              - [-1, 12]
          - - 5056
            - - [4, 23]
              - [128, 0]
              - [256, 11]
              - [704, 12]
              - [1024, 13]
              - [4288, 12]
              - [-1, 13]
          - - 5888
            - - [4, 23]
              - [128, 0]
              - [448, 12]
              - [704, 11]
              - [1024, 13]
              - [1408, 11]
              - [-1, 13]
          - - -1
            - - [4, 23]
              - [128, 0]
              - [1408, 12]
              - [2368, 11]
              - [-1, 13]
      - - 256
        - - - 4
            - - [4, 4]
              - [-1, 10]
          - - 64
            - - [4, 10]
              - [64, 4]
              - [128, 3]
              - [256, 10]
              - [448, 3]
              - [1024, 10]
              - [1856, 3]
              - [4288, 15]
              - [5056, 14]
              - [-1, 15]
          - - 128
            - - [4, 10]
              - [128, 5]
              - [256, 10]
              - [448, 3]
              - [704, 10]
              - [1408, 15]
              - [1856, 14]
              - [2944, 15]
              - [3584, 14]
              - [-1, 15]
          - - 256
            - - [4, 10]
              - [128, 3]
              - [448, 10]
              - [704, 14]
              - [5056, 15]
              - [5888, 14]
              - [-1, 15]
          - - 448
            - - [128, 10]
              - [2944, 15]
              - [3584, 14]
              - [4288, 15]
              - [5888, 14]
              - [-1, 20]
          - - 704
            - - [4, 10]
              - [64, 3]
              - [128, 10]
              - [256, 15]
              - [448, 14]
              - [2368, 15]
              - [2944, 14]
              - [3584, 20]
              - [5056, 15]
              - [5888, 20]
              - [-1, 14]
          - - 1024
            - - [64, 10]
              - [704, 15]
              - [1024, 21]
              - [2944, 14]
              - [3584, 22]
              - [4288, 15]
              - [5056, 22]
              - [5888, 14]
              - [-1, 22]
          - - 1408
            - - [64, 10]
              - [2368, 15]
              - [5056, 22]
              - [5888, 20]
              - [-1, 22]
          - - 1856
            - - [64, 10]
              - [256, 15]
              - [1024, 14]
              - [1856, 15]
              - [2368, 14]
              - [2944, 15]
              - [3584, 20]
              - [4288, 15]
              - [5056, 14]
              - [-1, 20]
          - - 2368
            - - [4, 10]
              - [64, 14]
              - [704, 15]
              - [1024, 19]
              - [1408, 14]
              - [1856, 15]
              - [2368, 20]
              - [2944, 14]
              - [3584, 15]
              - [4288, 14]
              - [5056, 15]
              - [-1, 20]
          - - 2944
            - - [4, 10]
              - [128, 15]
              - [256, 14]
              - [704, 15]
              - [1024, 19]
              - [1408, 20]
              - [2368, 14]
              - [3584, 20]
              - [5056, 22]
              - [-1, 20]
          - - 3584
            - - [4, 10]
              - [448, 15]
              - [1856, 22]
              - [2368, 15]
              - [2944, 14]
              - [-1, 22]
          - - 4288
            - - [4, 10]
              - [448, 15]
              - [1024, 14]
              - [1408, 20]
              - [1856, 14]
              - [2368, 15]
              - [-1, 20]
          - - 5056
            - - [4, 24]
              - [128, 15]
              - [704, 14]
              - [1024, 19]
              - [1408, 20]
              - [2368, 15]
              - [-1, 20]
          - - 5888
            - - [4, 6]
              - [448, 15]
              - [704, 22]
              - [1024, 19]
              - [2368, 22]
              - [2944, 20]
              - [5056, 22]
              - [-1, 20]
          - - -1
            - - [4, 24]
              - [64, 15]
              - [128, 14]
              - [448, 15]
              - [1024, 14]
              - [1408, 15]
              - [2368, 22]
              - [2944, 20]
              - [5056, 22]
              - [5888, 20]
              - [-1, 16]
      - - 1280
        - - - 4
            - - [1024, 4]
              - [1856, 6]
              - [3584, 10]
              - [4288, 6]
              - [5056, 24]
              - [-1, 10]
          - - 64
            - - [64, 4]
              - [128, 5]
              - [256, 3]
              - [448, 5]
              - [1856, 7]
              - [2944, 8]
              - [3584, 15]
              - [5056, 7]
              - [-1, 15]
          - - 128
            - - [4, 4]
              - [64, 5]
              - [128, 3]
              - [704, 7]
              - [1024, 2]
              - [1408, 7]
              - [1856, 15]
              - [2368, 7]
              - [2944, 2]
              - [3584, 14]
              - [4288, 2]
              - [5888, 14]
              - [-1, 15]
          - - 256
            - - [4, 4]
              - [64, 3]
              - [128, 8]
              - [256, 7]
              - [448, 2]
              - [1024, 15]
              - [2368, 14]
              - [5056, 15]
              - [5888, 14]
              - [-1, 15]
          - - 448
            - - [4, 4]
              - [64, 5]
              - [128, 7]
              - [256, 8]
              - [448, 7]
              - [1856, 15]
              - [2368, 14]
              - [5888, 15]
              - [-1, 20]
          - - 704
            - - [4, 4]
              - [128, 7]
              - [1408, 15]
              - [1856, 14]
              - [2368, 15]
              - [2944, 14]
              - [3584, 19]
              - [5888, 20]
              - [-1, 14]
          - - 1024
            - - [4, 4]
              - [64, 8]
              - [128, 2]
              - [704, 14]
              - [1024, 18]
              - [2368, 14]
              - [2944, 17]
              - [3584, 22]
              - [4288, 14]
              - [5056, 21]
              - [5888, 17]
              - [-1, 14]
          - - 1408
            - - [4, 6]
              - [128, 8]
              - [448, 14]
              - [704, 15]
              - [1024, 14]
              - [1408, 16]
              - [1856, 22]
              - [2368, 15]
              - [3584, 20]
              - [5056, 22]
              - [5888, 17]
              - [-1, 22]
          - - 1856
            - - [4, 6]
              - [64, 8]
              - [128, 15]
              - [256, 14]
              - [704, 15]
              - [1024, 14]
              - [1408, 19]
              - [1856, 20]
              - [2944, 15]
              - [3584, 19]
              - [4288, 15]
              - [5056, 14]
              - [5888, 19]
              - [-1, 20]
          - - 2368
            - - [4, 4]
              - [64, 7]
              - [128, 8]
              - [448, 15]
              - [704, 14]
              - [1024, 19]
              - [1856, 15]
              - [2368, 20]
              - [2944, 15]
              - [3584, 20]
              - [4288, 19]
              - [5056, 15]
              - [-1, 19]
          - - 2944
            - - [4, 10]
              - [128, 8]
              - [256, 14]
              - [704, 15]
              - [1024, 16]
              - [1408, 22]
              - [2368, 15]
              - [2944, 22]
              - [3584, 19]
              - [5056, 22]
              - [5888, 17]
              - [-1, 19]
          - - 3584
            - - [4, 10]
              - [448, 15]
              - [704, 22]
              - [1024, 19]
              - [-1, 22]
          - - 4288
            - - [4, 4]
              - [128, 8]
              - [256, 14]
              - [448, 15]
              - [704, 22]
              - [1024, 19]
              - [1408, 20]
              - [1856, 15]
              - [2368, 22]
              - [2944, 20]
              - [3584, 19]
              - [4288, 20]
              - [5056, 22]
              - [-1, 20]
          - - 5056
            - - [4, 6]
              - [64, 8]
              - [256, 14]
              - [448, 15]
              - [704, 22]
              - [1408, 19]
              - [1856, 15]
              - [2368, 14]
              - [4288, 19]
              - [5056, 21]
              - [-1, 19]
          - - 5888
            - - [4, 24]
              - [448, 15]
              - [704, 22]
              - [1408, 19]
              - [1856, 22]
              - [2368, 21]
              - [2944, 17]
              - [3584, 19]
              - [4288, 22]
              - [5056, 21]
              - [5888, 20]
              - [-1, 19]
          - - -1
            - - [4, 24]
              - [128, 15]
              - [256, 14]
              - [448, 22]
              - [704, 15]
              - [1408, 19]
              - [1856, 21]
              - [2368, 22]
              - [2944, 20]
              - [3584, 19]
              - [5056, 21]
              - [5888, 19]
              - [-1, 17]
      - - -1
        - - - 4
            - - [1024, 4]
              - [1856, 6]
              - [2368, 4]
              - [2944, 10]
              - [4288, 6]
              - [-1, 24]
          - - 64
            - - [64, 4]
              - [448, 5]
              - [2368, 7]
              - [2944, 9]
              - [3584, 2]
              - [4288, 8]
              - [5056, 7]
              - [5888, 2]
              - [-1, 7]
          - - 128
            - - [4, 4]
              - [128, 5]
              - [704, 7]
              - [1024, 2]
              - [1408, 8]
              - [1856, 2]
              - [2368, 8]
              - [2944, 2]
              - [3584, 15]
              - [4288, 8]
              - [5056, 9]
              - [5888, 15]
              - [-1, 2]
          - - 256
            - - [4, 4]
              - [64, 5]
              - [256, 8]
              - [448, 2]
              - [3584, 15]
              - [4288, 14]
              - [-1, 15]
          - - 448
            - - [4, 4]
              - [64, 3]
              - [128, 7]
              - [256, 8]
              - [448, 7]
              - [1408, 15]
              - [1856, 14]
              - [2368, 15]
              - [2944, 14]
              - [3584, 15]
              - [4288, 14]
              - [5888, 15]
              - [-1, 19]
          - - 704
            - - [4, 4]
              - [128, 7]
              - [448, 15]
              - [704, 14]
              - [1408, 15]
              - [1856, 14]
              - [2368, 15]
              - [2944, 14]
              - [3584, 20]
              - [5888, 19]
              - [-1, 15]
          - - 1024
            - - [4, 4]
              - [64, 7]
              - [128, 2]
              - [256, 14]
              - [448, 15]
              - [704, 14]
              - [1024, 18]
              - [1408, 14]
              - [1856, 17]
              - [2368, 22]
              - [2944, 17]
              - [3584, 22]
              - [4288, 14]
              - [5056, 17]
              - [-1, 14]
          - - 1408
            - - [4, 6]
              - [128, 8]
              - [448, 14]
              - [704, 15]
              - [1024, 14]
              - [1408, 16]
              - [1856, 22]
              - [2368, 15]
              - [5888, 17]
              - [-1, 20]
          - - 1856
            - - [4, 6]
              - [64, 7]
              - [128, 2]
              - [704, 15]
              - [1024, 16]
              - [1856, 19]
              - [2944, 15]
              - [3584, 19]
              - [4288, 17]
              - [5056, 14]
              - [-1, 19]
          - - 2368
            - - [4, 4]
              - [128, 8]
              - [448, 15]
              - [704, 14]
              - [1024, 19]
              - [1856, 15]
              - [2368, 19]
              - [2944, 15]
              - [4288, 19]
              - [5056, 14]
              - [-1, 19]
          - - 2944
            - - [4, 10]
              - [128, 8]
              - [256, 14]
              - [448, 15]
              - [704, 14]
              - [1408, 16]
              - [1856, 14]
              - [2368, 15]
              - [4288, 19]
              - [5056, 22]
              - [5888, 17]
              - [-1, 19]
          - - 3584
            - - [4, 10]
              - [64, 9]
              - [448, 15]
              - [704, 22]
              - [1024, 19]
              - [1408, 17]
              - [2368, 22]
              - [3584, 19]
              - [4288, 17]
              - [5056, 22]
              - [-1, 19]
          - - 4288
            - - [4, 6]
              - [128, 8]
              - [448, 14]
              - [704, 22]
              - [1024, 19]
              - [1856, 17]
              - [2944, 19]
              - [3584, 17]
              - [4288, 19]
              - [5056, 22]
              - [-1, 19]
          - - 5056
            - - [4, 24]
              - [64, 8]
              - [128, 9]
              - [256, 14]
              - [448, 15]
              - [704, 22]
              - [1408, 17]
              - [2368, 15]
              - [4288, 19]
              - [5056, 17]
              - [-1, 19]
          - - 5888
            - - [4, 24]
              - [64, 9]
              - [448, 15]
              - [704, 22]
              - [1408, 17]
              - [2368, 22]
              - [2944, 17]
              - [3584, 19]
              - [5056, 21]
              - [-1, 19]
          - - -1
            - - [4, 24]
              - [64, 9]
              - [128, 8]
              - [256, 14]
              - [448, 22]
              - [704, 15]
              - [1024, 17]
              - [1408, 19]
              - [1856, 21]
              - [2368, 22]
              - [3584, 19]
              - [5056, 21]
              - [5888, 19]
              - [-1, 17]
