library/src/blas3/Tensile/Logic/asm_full/vega20_Cijk_Ailk_Bjlk_HB.yaml
- {MinimumRequiredVersion: 4.6.0}
- vega20
- gfx906
- [Device 66a0, Device 66a1, Device 66a7]
    SolutionIndex: 0
    SolutionNameMin: Cijk_Ailk_Bjlk_HB_MT032x016x08_PGR1_PLR1_TT04_02
    SolutionIndex: 1
    SolutionNameMin: Cijk_Ailk_Bjlk_HB_MT032x032x08_PGR1_PLR1_TT04_04
    SolutionIndex: 2
    SolutionNameMin: Cijk_Ailk_Bjlk_HB_MT064x016x08_PGR1_PLR1_TT04_02
    SolutionIndex: 3
    SolutionNameMin: Cijk_Ailk_Bjlk_HB_MT128x032x08_PGR1_PLR1_TT04_04
    SolutionIndex: 4
    SolutionNameMin: Cijk_Ailk_Bjlk_HB_MT128x016x08_PGR1_PLR1_TT04_04
    SolutionIndex: 5
    SolutionNameMin: Cijk_Ailk_Bjlk_HB_MT016x016x08_PGR1_PLR1_TT02_02
    SolutionIndex: 6
    SolutionNameMin: Cijk_Ailk_Bjlk_HB_MT032x032x08_PGR1_PLR1_TT04_04
    SolutionIndex: 7
    SolutionNameMin: Cijk_Ailk_Bjlk_HB_MT064x032x08_PGR1_PLR1_TT08_04
    SolutionIndex: 8
    SolutionNameMin: Cijk_Ailk_Bjlk_HB_MT064x064x08_PGR1_PLR1_TT08_08
    SolutionIndex: 9
    SolutionNameMin: Cijk_Ailk_Bjlk_HB_MT016x016x16_PGR1_PLR1_TT02_02
    SolutionIndex: 10
    SolutionNameMin: Cijk_Ailk_Bjlk_HB_MT032x016x16_PGR1_PLR1_TT04_02
    SolutionIndex: 11
    SolutionNameMin: Cijk_Ailk_Bjlk_HB_MT032x032x16_PGR1_PLR1_TT04_04
    SolutionIndex: 12
    SolutionNameMin: Cijk_Ailk_Bjlk_HB_MT032x016x16_PGR1_PLR1_TT02_02
    SolutionIndex: 13
    SolutionNameMin: Cijk_Ailk_Bjlk_HB_MT064x016x16_PGR1_PLR1_TT04_02
    SolutionIndex: 14
    SolutionNameMin: Cijk_Ailk_Bjlk_HB_MT064x032x16_PGR1_PLR1_TT04_04
    SolutionIndex: 15
    SolutionNameMin: Cijk_Ailk_Bjlk_HB_MT064x016x16_PGR1_PLR1_TT02_02
    SolutionIndex: 16
    SolutionNameMin: Cijk_Ailk_Bjlk_HB_MT016x016x16_PGR1_PLR1_TT02_02
    SolutionIndex: 17
    SolutionNameMin: Cijk_Ailk_Bjlk_HB_MT032x032x16_PGR1_PLR1_TT04_04
    SolutionIndex: 18
    SolutionNameMin: Cijk_Ailk_Bjlk_HB_MT064x032x16_PGR1_PLR1_TT08_04
    SolutionIndex: 19
    SolutionNameMin: Cijk_Ailk_Bjlk_HB_MT064x064x16_PGR1_PLR1_TT08_08
    SolutionIndex: 20
    SolutionNameMin: Cijk_Ailk_Bjlk_HB_MT032x016x16_PGR1_PLR1_TT02_02
    SolutionIndex: 21
    SolutionNameMin: Cijk_Ailk_Bjlk_HB_MT064x016x16_PGR1_PLR1_TT04_02
    SolutionIndex: 22
    SolutionNameMin: Cijk_Ailk_Bjlk_HB_MT064x032x16_PGR1_PLR1_TT04_04
    SolutionIndex: 23
    SolutionNameMin: Cijk_Ailk_Bjlk_HB_MT064x016x16_PGR1_PLR1_TT02_02
    SolutionIndex: 24
    SolutionNameMin: Cijk_Ailk_Bjlk_HB_MT064x008x16_PGR1_PLR1_TT02_02
    SolutionIndex: 25
    SolutionNameMin: Cijk_Ailk_Bjlk_HB_MT016x016x24_PGR1_PLR1_TT02_02
    SolutionIndex: 26
    SolutionNameMin: Cijk_Ailk_Bjlk_HB_MT016x016x32_PGR1_PLR1_TT02_02
    SolutionIndex: 27
    SolutionNameMin: Cijk_Ailk_Bjlk_HB_MT032x032x32_PGR1_PLR1_TT04_04
    SolutionIndex: 28
    SolutionNameMin: Cijk_Ailk_Bjlk_HB_MT032x016x32_PGR1_PLR1_TT02_02
    SolutionIndex: 29
    SolutionNameMin: Cijk_Ailk_Bjlk_HB_MT064x016x32_PGR1_PLR1_TT04_02
    SolutionIndex: 30
    SolutionNameMin: Cijk_Ailk_Bjlk_HB_MT064x032x32_PGR1_PLR1_TT04_04
    SolutionIndex: 31
    SolutionNameMin: Cijk_Ailk_Bjlk_HB_MT064x016x32_PGR1_PLR1_TT02_02
    SolutionIndex: 32
    SolutionNameMin: Cijk_Ailk_Bjlk_HB_MT032x016x32_PGR1_PLR1_TT02_02
    SolutionIndex: 33
    SolutionNameMin: Cijk_Ailk_Bjlk_HB_MT064x016x32_PGR1_PLR1_TT04_02
    SolutionIndex: 34
    SolutionNameMin: Cijk_Ailk_Bjlk_HB_MT064x032x32_PGR1_PLR1_TT04_04
    SolutionIndex: 35
    SolutionNameMin: Cijk_Ailk_Bjlk_HB_MT064x016x32_PGR1_PLR1_TT02_02
    SolutionIndex: 36
    SolutionNameMin: Cijk_Ailk_Bjlk_HB_MT016x016x64_PGR1_PLR1_TT02_02
    SolutionIndex: 37
    SolutionNameMin: Cijk_Ailk_Bjlk_HB_MT032x016x64_PGR1_PLR1_TT02_02
    SolutionIndex: 38
    SolutionNameMin: Cijk_Ailk_Bjlk_HB_MT032x032x64_PGR1_PLR1_TT04_04
    SolutionIndex: 39
    SolutionNameMin: Cijk_Ailk_Bjlk_HB_MT032x016x64_PGR1_PLR1_TT02_02
    SolutionIndex: 40
    SolutionNameMin: Cijk_Ailk_Bjlk_HB_MT064x016x64_PGR1_PLR1_TT02_02
    SolutionIndex: 41
    SolutionNameMin: Cijk_Ailk_Bjlk_HB_MT064x008x64_PGR1_PLR1_TT02_02
    SolutionIndex: 42
    SolutionNameMin: Cijk_Ailk_Bjlk_HB_MT032x064x08_PGR1_PLR1_TT04_08
    SolutionIndex: 43
    SolutionNameMin: Cijk_Ailk_Bjlk_HB_MT048x064x08_PGR1_PLR1_TT06_08
    SolutionIndex: 44
    SolutionNameMin: Cijk_Ailk_Bjlk_HB_MT064x048x08_PGR1_PLR1_TT08_06
    SolutionIndex: 45
    SolutionNameMin: Cijk_Ailk_Bjlk_HB_MT064x128x08_PGR1_PLR1_TT04_08
    SolutionIndex: 46
    SolutionNameMin: Cijk_Ailk_Bjlk_HB_MT032x064x16_PGR1_PLR1_TT04_08
    SolutionIndex: 47
    SolutionNameMin: Cijk_Ailk_Bjlk_HB_MT048x064x16_PGR1_PLR1_TT06_08
    SolutionIndex: 48
    SolutionNameMin: Cijk_Ailk_Bjlk_HB_MT064x064x16_PGR1_PLR1_TT04_04
    SolutionIndex: 49
    SolutionNameMin: Cijk_Ailk_Bjlk_HB_MT064x128x16_PGR1_PLR1_TT04_08
    SolutionIndex: 50
    SolutionNameMin: Cijk_Ailk_Bjlk_HB_MT096x128x16_PGR1_PLR1_TT06_08
    SolutionIndex: 51
    SolutionNameMin: Cijk_Ailk_Bjlk_HB_MT128x064x16_PGR1_PLR1_TT08_04
    SolutionIndex: 52
    SolutionNameMin: Cijk_Ailk_Bjlk_HB_MT128x096x16_PGR1_PLR1_TT08_06
    SolutionIndex: 53
    SolutionNameMin: Cijk_Ailk_Bjlk_HB_MT128x128x16_PGR1_PLR1_TT08_08
    SolutionIndex: 54
    SolutionNameMin: Cijk_Ailk_Bjlk_HB_MT064x064x32_PGR1_PLR1_TT04_04
    SolutionIndex: 55
    SolutionNameMin: Cijk_Ailk_Bjlk_HB_MT064x128x32_PGR1_PLR1_TT04_08
    SolutionIndex: 56
    SolutionNameMin: Cijk_Ailk_Bjlk_HB_MT096x128x32_PGR1_PLR1_TT06_08
    SolutionIndex: 57
    SolutionNameMin: Cijk_Ailk_Bjlk_HB_MT128x064x32_PGR1_PLR1_TT08_04
    SolutionIndex: 58
    SolutionNameMin: Cijk_Ailk_Bjlk_HB_MT128x096x32_PGR1_PLR1_TT08_06
    SolutionIndex: 59
    SolutionNameMin: Cijk_Ailk_Bjlk_HB_MT128x128x32_PGR1_PLR1_TT08_08
    SolutionIndex: 60
    SolutionNameMin: Cijk_Ailk_Bjlk_HB_MT064x064x64_PGR1_PLR1_TT04_04
    SolutionIndex: 61
    SolutionNameMin: Cijk_Ailk_Bjlk_HB_MT032x032x08_PGR1_PLR1_TT02_02
    SolutionIndex: 62
    SolutionNameMin: Cijk_Ailk_Bjlk_HB_MT032x032x16_PGR1_PLR1_TT02_02
    SolutionIndex: 63
    SolutionNameMin: Cijk_Ailk_Bjlk_HB_MT064x064x16_PGR1_PLR1_TT04_04
    SolutionIndex: 64
    SolutionNameMin: Cijk_Ailk_Bjlk_HB_MT032x032x32_PGR1_PLR1_TT02_02
    SolutionIndex: 65
    SolutionNameMin: Cijk_Ailk_Bjlk_HB_MT064x064x32_PGR1_PLR1_TT04_04
    SolutionIndex: 66
    SolutionNameMin: Cijk_Ailk_Bjlk_HB_MT032x032x64_PGR1_PLR1_TT02_02
    SolutionIndex: 67
    SolutionNameMin: Cijk_Ailk_Bjlk_HB_MT064x128x04_PGR0_PLR0_TT04_08
    SolutionIndex: 68
    SolutionNameMin: Cijk_Ailk_Bjlk_HB_MT064x064x04_PGR0_PLR0_TT04_04
    SolutionIndex: 69
    SolutionNameMin: Cijk_Ailk_Bjlk_HB_MT064x064x04_PGR1_PLR0_TT04_04
    SolutionIndex: 70
    SolutionNameMin: Cijk_Ailk_Bjlk_HB_MT064x128x04_PGR0_PLR1_TT04_08
    SolutionIndex: 71
    SolutionNameMin: Cijk_Ailk_Bjlk_HB_MT064x064x04_PGR0_PLR1_TT04_04
    SolutionIndex: 72
    SolutionNameMin: Cijk_Ailk_Bjlk_HB_MT064x128x04_PGR1_PLR1_TT04_08
    SolutionIndex: 73
    SolutionNameMin: Cijk_Ailk_Bjlk_HB_MT064x064x04_PGR1_PLR1_TT04_04
    SolutionIndex: 74
    SolutionNameMin: Cijk_Ailk_Bjlk_HB_MT064x128x08_PGR0_PLR0_TT04_08
    SolutionIndex: 75
    SolutionNameMin: Cijk_Ailk_Bjlk_HB_MT064x064x08_PGR0_PLR0_TT04_04
    SolutionIndex: 76
    SolutionNameMin: Cijk_Ailk_Bjlk_HB_MT064x128x08_PGR1_PLR0_TT04_08
    SolutionIndex: 77
    SolutionNameMin: Cijk_Ailk_Bjlk_HB_MT064x064x08_PGR1_PLR0_TT04_04
    SolutionIndex: 78
    SolutionNameMin: Cijk_Ailk_Bjlk_HB_MT064x128x08_PGR0_PLR1_TT04_08
    SolutionIndex: 79
    SolutionNameMin: Cijk_Ailk_Bjlk_HB_MT064x064x08_PGR0_PLR1_TT04_04
    SolutionIndex: 80
    SolutionNameMin: Cijk_Ailk_Bjlk_HB_MT064x064x08_PGR1_PLR1_TT04_04
    SolutionIndex: 81
    SolutionNameMin: Cijk_Ailk_Bjlk_HB_MT064x128x16_PGR0_PLR0_TT04_08
    SolutionIndex: 82
    SolutionNameMin: Cijk_Ailk_Bjlk_HB_MT064x064x16_PGR0_PLR0_TT04_04
    SolutionIndex: 83
    SolutionNameMin: Cijk_Ailk_Bjlk_HB_MT064x064x16_PGR1_PLR0_TT04_04
    SolutionIndex: 84
    SolutionNameMin: Cijk_Ailk_Bjlk_HB_MT064x128x16_PGR0_PLR1_TT04_08
    SolutionIndex: 85
    SolutionNameMin: Cijk_Ailk_Bjlk_HB_MT064x064x16_PGR0_PLR1_TT04_04
    SolutionIndex: 86
    SolutionNameMin: Cijk_Ailk_Bjlk_HB_MT064x064x16_PGR1_PLR1_TT04_04
    SolutionIndex: 87
    SolutionNameMin: Cijk_Ailk_Bjlk_HB_MT064x064x32_PGR0_PLR0_TT04_04
    SolutionIndex: 88
    SolutionNameMin: Cijk_Ailk_Bjlk_HB_MT064x064x32_PGR1_PLR0_TT04_04
    SolutionIndex: 89
    SolutionNameMin: Cijk_Ailk_Bjlk_HB_MT064x064x32_PGR0_PLR1_TT04_04
    SolutionIndex: 90
    SolutionNameMin: Cijk_Ailk_Bjlk_HB_MT064x064x32_PGR1_PLR1_TT04_04
    SolutionIndex: 91
    SolutionNameMin: Cijk_Ailk_Bjlk_HB_MT128x128x04_PGR0_PLR0_TT08_08
    SolutionIndex: 92
    SolutionNameMin: Cijk_Ailk_Bjlk_HB_MT064x128x04_PGR0_PLR0_TT04_08
    SolutionIndex: 93
    SolutionNameMin: Cijk_Ailk_Bjlk_HB_MT064x064x04_PGR0_PLR0_TT04_04
    SolutionIndex: 94
    SolutionNameMin: Cijk_Ailk_Bjlk_HB_MT064x128x04_PGR1_PLR0_TT04_08
    SolutionIndex: 95
    SolutionNameMin: Cijk_Ailk_Bjlk_HB_MT064x064x04_PGR1_PLR0_TT04_04
    SolutionIndex: 96
    SolutionNameMin: Cijk_Ailk_Bjlk_HB_MT128x128x04_PGR0_PLR1_TT08_08
    SolutionIndex: 97
    SolutionNameMin: Cijk_Ailk_Bjlk_HB_MT064x128x04_PGR0_PLR1_TT04_08
    SolutionIndex: 98
    SolutionNameMin: Cijk_Ailk_Bjlk_HB_MT064x064x04_PGR0_PLR1_TT04_04
    SolutionIndex: 99
    SolutionNameMin: Cijk_Ailk_Bjlk_HB_MT064x064x04_PGR1_PLR1_TT04_04
    SolutionIndex: 100
    SolutionNameMin: Cijk_Ailk_Bjlk_HB_MT128x128x08_PGR0_PLR0_TT08_08
    SolutionIndex: 101
    SolutionNameMin: Cijk_Ailk_Bjlk_HB_MT064x128x08_PGR0_PLR0_TT04_08
    SolutionIndex: 102
    SolutionNameMin: Cijk_Ailk_Bjlk_HB_MT064x064x08_PGR0_PLR0_TT04_04
    SolutionIndex: 103
    SolutionNameMin: Cijk_Ailk_Bjlk_HB_MT064x128x08_PGR1_PLR0_TT04_08
    SolutionIndex: 104
    SolutionNameMin: Cijk_Ailk_Bjlk_HB_MT064x064x08_PGR1_PLR0_TT04_04
    SolutionIndex: 105
    SolutionNameMin: Cijk_Ailk_Bjlk_HB_MT128x128x08_PGR0_PLR1_TT08_08
    SolutionIndex: 106
    SolutionNameMin: Cijk_Ailk_Bjlk_HB_MT064x128x08_PGR0_PLR1_TT04_08
    SolutionIndex: 107
    SolutionNameMin: Cijk_Ailk_Bjlk_HB_MT064x064x08_PGR0_PLR1_TT04_04
    SolutionIndex: 108
    SolutionNameMin: Cijk_Ailk_Bjlk_HB_MT064x064x08_PGR1_PLR1_TT04_04
    SolutionIndex: 109
    SolutionNameMin: Cijk_Ailk_Bjlk_HB_MT064x064x16_PGR0_PLR0_TT04_04
    SolutionIndex: 110
    SolutionNameMin: Cijk_Ailk_Bjlk_HB_MT064x064x16_PGR1_PLR0_TT04_04
    SolutionIndex: 111
    SolutionNameMin: Cijk_Ailk_Bjlk_HB_MT064x128x16_PGR0_PLR1_TT04_08
    SolutionIndex: 112
    SolutionNameMin: Cijk_Ailk_Bjlk_HB_MT064x064x16_PGR0_PLR1_TT04_04
    SolutionIndex: 113
    SolutionNameMin: Cijk_Ailk_Bjlk_HB_MT064x064x16_PGR1_PLR1_TT04_04
    SolutionIndex: 114
    SolutionNameMin: Cijk_Ailk_Bjlk_HB_MT064x128x32_PGR0_PLR0_TT04_08
    SolutionIndex: 115
    SolutionNameMin: Cijk_Ailk_Bjlk_HB_MT064x064x32_PGR0_PLR0_TT04_04
    SolutionIndex: 116
    SolutionNameMin: Cijk_Ailk_Bjlk_HB_MT064x064x32_PGR1_PLR0_TT04_04
    SolutionIndex: 117
    SolutionNameMin: Cijk_Ailk_Bjlk_HB_MT064x128x32_PGR0_PLR1_TT04_08
    SolutionIndex: 118
    SolutionNameMin: Cijk_Ailk_Bjlk_HB_MT064x064x32_PGR0_PLR1_TT04_04
    SolutionIndex: 119
    SolutionNameMin: Cijk_Ailk_Bjlk_HB_MT064x064x32_PGR1_PLR1_TT04_04
- - - [2368, 1024, 1, 1]
    - [93, 120.759]
  - - [128, 256, 1, 1280]
    - [9, 1394.38]
  - - [32, 5056, 1, 1280]
    - [89, 1522.75]
  - - [448, 1, 1, 256]
    - [113, 3.13698]
  - - [5056, 1408, 1, 3328]
    - [49, 19111.0]
  - - [2368, 64, 1, 1]
    - [93, 12.8]
  - - [5056, 1856, 1, 3328]
    - [51, 18746.2]
  - - [704, 64, 1, 1]
    - [107, 3.7298]
  - - [448, 3584, 1, 3328]
    - [7, 13704.2]
  - - [704, 64, 1, 3328]
    - [28, 2250.1]
  - - [5056, 4288, 1, 32]
    - [78, 4209.73]
  - - [5888, 256, 1, 256]
    - [48, 10577.7]
  - - [448, 3584, 1, 32]
    - [74, 1988.4]
  - - [5888, 704, 1, 1]
    - [93, 159.429]
  - - [6784, 6784, 1, 1280]
    - [56, 17316.4]
  - - [448, 1, 1, 1]
    - [93, 0.0414815]
  - - [1408, 3584, 1, 3328]
    - [54, 15720.0]
  - - [448, 448, 1, 3328]
    - [54, 6969.35]
  - - [1024, 2368, 1, 3328]
    - [51, 16973.4]
  - - [1, 4288, 1, 1280]
    - [112, 35.8079]
  - - [6784, 64, 1, 32]
    - [73, 877.123]
  - - [64, 64, 1, 1280]
    - [26, 189.41]
  - - [448, 3584, 1, 1]
    - [102, 85.0441]
  - - [448, 64, 1, 1]
    - [110, 2.37351]
  - - [32, 1408, 1, 32]
    - [75, 97.9478]
  - - [64, 1024, 1, 1280]
    - [28, 2945.44]
  - - [1, 1408, 1, 3328]
    - [119, 21.6936]
  - - [32, 3584, 1, 1280]
    - [82, 1193.89]
  - - [1024, 1, 1, 3328]
    - [119, 15.8831]
  - - [2944, 128, 1, 32]
    - [79, 785.067]
  - - [1408, 5056, 1, 1]
    - [97, 181.975]
  - - [1024, 64, 1, 1280]
    - [28, 2904.64]
  - - [64, 5056, 1, 3328]
    - [54, 8258.34]
  - - [5888, 4288, 1, 3328]
    - [55, 17661.1]
  - - [1, 2368, 1, 1280]
    - [119, 29.9984]
  - - [704, 1024, 1, 1]
    - [107, 56.32]
  - - [2368, 1408, 1, 32]
    - [79, 2604.8]
  - - [256, 1856, 1, 1280]
    - [54, 11033.6]
  - - [1024, 2944, 1, 1]
    - [95, 132.687]
  - - [2944, 3584, 1, 3328]
    - [56, 15698.0]
  - - [2368, 2944, 1, 1280]
    - [54, 16338.4]
  - - [256, 1408, 1, 1]
    - [104, 29.4484]
  - - [1, 1024, 1, 3328]
    - [112, 11.5693]
  - - [3584, 1408, 1, 32]
    - [78, 3271.49]
  - - [6784, 1856, 1, 32]
    - [84, 3750.14]
  - - [5056, 256, 1, 256]
    - [48, 10380.6]
  - - [1856, 2368, 1, 256]
    - [45, 16165.5]
  - - [2368, 1024, 1, 3328]
    - [55, 15483.2]
  - - [3584, 4288, 1, 32]
    - [74, 4397.19]
  - - [1024, 1024, 1, 1280]
    - [48, 15293.7]
  - - [32, 2944, 1, 3328]
    - [85, 1078.74]
  - - [704, 1408, 1, 3328]
    - [49, 15300.6]
  - - [1408, 704, 1, 256]
    - [48, 9468.49]
  - - [704, 64, 1, 32]
    - [85, 89.2198]
  - - [5888, 1, 1, 3328]
    - [108, 54.6986]
  - - [2368, 32, 1, 256]
    - [82, 560.007]
  - - [2048, 7133, 1, 2048]
    - [45, 19510.3]
  - - [7680, 5481, 1, 2560]
    - [49, 18860.6]
  - - [6784, 128, 1, 3328]
    - [49, 13463.8]
  - - [2944, 1856, 1, 1]
    - [95, 178.798]
  - - [32, 448, 1, 3328]
    - [86, 198.726]
  - - [5056, 1, 1, 3328]
    - [115, 50.2699]
  - - [2368, 3584, 1, 1280]
    - [19, 15604.5]
  - - [4288, 5056, 1, 1]
    - [96, 198.101]
  - - [128, 4288, 1, 3328]
    - [17, 10590.3]
  - - [1408, 4288, 1, 1280]
    - [48, 16121.5]
  - - [1856, 704, 1, 1280]
    - [7, 12670.3]
  - - [448, 5888, 1, 256]
    - [42, 13658.6]
  - - [1, 5888, 1, 3328]
    - [117, 60.6139]
  - - [1024, 128, 1, 32]
    - [71, 229.951]
  - - [32, 4288, 1, 1280]
    - [86, 1347.73]
  - - [1024, 5056, 1, 1]
    - [99, 159.795]
  - - [704, 3584, 1, 1280]
    - [7, 13647.8]
  - - [1856, 5056, 1, 256]
    - [8, 18547.5]
  - - [1408, 1024, 1, 1280]
    - [51, 15216.8]
  - - [5056, 5888, 1, 3328]
    - [52, 17780.6]
  - - [3584, 3584, 1, 1280]
    - [42, 19057.9]
  - - [2368, 3584, 1, 32]
    - [84, 3517.89]
  - - [5056, 5056, 1, 1]
    - [92, 220.068]
  - - [512, 32, 1, 512]
    - [32, 589.088]
  - - [1024, 6784, 1, 1280]
    - [54, 17670.7]
  - - [1024, 3584, 1, 1]
    - [95, 149.919]
  - - [256, 5056, 1, 1]
    - [99, 84.2667]
  - - [32, 5056, 1, 32]
    - [79, 296.866]
  - - [5888, 32, 1, 32]
    - [77, 358.888]
  - - [64, 128, 1, 3328]
    - [36, 433.021]
  - - [256, 5056, 1, 32]
    - [74, 1910.46]
  - - [5056, 64, 1, 32]
    - [79, 667.184]
  - - [256, 128, 1, 256]
    - [15, 919.804]
  - - [128, 6784, 1, 32]
    - [77, 1536.91]
  - - [64, 128, 1, 1]
    - [95, 0.691892]
  - - [64, 2368, 1, 1280]
    - [28, 5486.05]
  - - [128, 704, 1, 32]
    - [68, 192.753]
  - - [64, 6784, 1, 3328]
    - [63, 10979.8]
  - - [2944, 256, 1, 1280]
    - [49, 11052.8]
  - - [2944, 4288, 1, 256]
    - [54, 15073.2]
  - - [1024, 1024, 1, 3328]
    - [48, 15978.3]
  - - [5056, 704, 1, 32]
    - [77, 2686.36]
  - - [1856, 4288, 1, 3328]
    - [43, 16857.1]
  - - [1, 1856, 1, 256]
    - [115, 11.4435]
  - - [6784, 4288, 1, 32]
    - [78, 4663.68]
  - - [4288, 1024, 1, 3328]
    - [45, 17874.7]
  - - [256, 128, 1, 1]
    - [113, 2.60892]
  - - [3584, 448, 1, 3328]
    - [48, 13857.7]
  - - [2944, 448, 1, 256]
    - [51, 7365.65]
  - - [3584, 2368, 1, 3328]
    - [48, 15469.9]
  - - [4288, 1856, 1, 1]
    - [92, 177.014]
  - - [1856, 2944, 1, 1]
    - [95, 168.644]
  - - [32, 4288, 1, 3328]
    - [88, 1330.89]
  - - [1, 3584, 1, 3328]
    - [119, 54.9758]
  - - [256, 32, 1, 3328]
    - [86, 114.743]
  - - [1856, 2368, 1, 32]
    - [82, 3144.91]
  - - [4288, 1856, 1, 32]
    - [74, 3807.91]
  - - [5056, 64, 1, 3328]
    - [22, 8273.57]
  - - [6784, 1, 1, 1280]
    - [113, 67.335]
  - - [32, 2368, 1, 256]
    - [75, 578.719]
  - - [1408, 64, 1, 1]
    - [119, 5.86667]
  - - [1, 1, 1, 3328]
    - [119, 0.0151328]
  - - [5056, 2368, 1, 256]
    - [59, 14844.0]
  - - [1408, 5888, 1, 256]
    - [8, 16078.2]
  - - [5056, 6784, 1, 1]
    - [100, 221.92]
  - - [32, 448, 1, 1280]
    - [86, 173.114]
  - - [32, 448, 1, 32]
    - [68, 30.8301]
  - - [1024, 1408, 1, 3328]
    - [45, 13487.4]
  - - [256, 5056, 1, 1280]
    - [48, 15772.6]
  - - [704, 2368, 1, 1]
    - [99, 84.7089]
  - - [64, 1024, 1, 32]
    - [82, 128.502]
  - - [1024, 256, 1, 256]
    - [6, 4301.85]
  - - [128, 1, 1, 1]
    - [98, 0.0116788]
  - - [3584, 4288, 1, 1280]
    - [54, 14121.1]
  - - [1856, 128, 1, 32]
    - [68, 500.143]
  - - [1856, 128, 1, 1280]
    - [13, 6599.11]
  - - [128, 2944, 1, 3328]
    - [54, 9593.76]
  - - [1, 6784, 1, 3328]
    - [114, 69.8722]
  - - [2368, 4288, 1, 1]
    - [105, 169.008]
  - - [4288, 448, 1, 3328]
    - [57, 15201.5]
  - - [4288, 32, 1, 3328]
    - [89, 1422.42]
  - - [32, 2944, 1, 256]
    - [89, 646.922]
  - - [256, 1856, 1, 1]
    - [102, 39.3325]
  - - [704, 6784, 1, 1280]
    - [45, 17422.5]
  - - [2368, 4288, 1, 32]
    - [78, 4005.52]
  - - [3584, 6784, 1, 1]
    - [97, 264.972]
  - - [704, 5056, 1, 1280]
    - [45, 17954.2]
  - - [256, 3584, 1, 3328]
    - [51, 14167.8]
  - - [3584, 6784, 1, 32]
    - [78, 4581.04]
  - - [3584, 6784, 1, 1280]
    - [44, 19034.2]
  - - [4288, 4288, 1, 3328]
    - [45, 18183.2]
  - - [3584, 64, 1, 1280]
    - [17, 7057.72]
  - - [64, 1856, 1, 256]
    - [15, 3194.19]
  - - [3584, 64, 1, 32]
    - [68, 367.002]
  - - [448, 1, 1, 1280]
    - [119, 5.94855]
  - - [256, 4288, 1, 1280]
    - [48, 13448.4]
  - - [1408, 3584, 1, 1]
    - [106, 154.226]
  - - [4288, 1856, 1, 3328]
    - [57, 16683.0]
  - - [1856, 2944, 1, 1280]
    - [49, 18217.3]
  - - [4288, 256, 1, 256]
    - [54, 10301.3]
  - - [128, 5888, 1, 32]
    - [87, 1322.22]
  - - [128, 5888, 1, 1280]
    - [1, 12470.1]
  - - [1408, 128, 1, 3328]
    - [33, 6553.6]
  - - [3584, 256, 1, 256]
    - [17, 8412.64]
  - - [32, 6784, 1, 3328]
    - [86, 2272.48]
  - - [32, 3584, 1, 256]
    - [87, 882.215]
  - - [256, 2368, 1, 32]
    - [82, 962.235]
  - - [448, 128, 1, 3328]
    - [37, 2860.32]
  - - [64, 2944, 1, 3328]
    - [29, 6803.91]
  - - [64, 4288, 1, 3328]
    - [54, 6986.76]
  - - [5056, 1024, 1, 3328]
    - [49, 19139.5]
  - - [2368, 64, 1, 3328]
    - [28, 6010.07]
  - - [1856, 256, 1, 256]
    - [6, 7877.9]
  - - [3584, 704, 1, 1]
    - [107, 126.157]
  - - [256, 704, 1, 256]
    - [6, 3084.05]
  - - [448, 5056, 1, 1]
    - [92, 106.442]
  - - [5888, 5888, 1, 256]
    - [45, 19120.8]
  - - [3584, 704, 1, 32]
    - [77, 2594.48]
  - - [448, 6784, 1, 3328]
    - [54, 17106.2]
  - - [6784, 4288, 1, 1]
    - [97, 251.991]
  - - [5056, 704, 1, 1]
    - [104, 123.249]
  - - [1408, 2368, 1, 32]
    - [82, 2874.26]
  - - [448, 5056, 1, 32]
    - [77, 2378.05]
  - - [4288, 4288, 1, 1280]
    - [8, 18146.5]
  - - [6784, 1408, 1, 1]
    - [97, 203.404]
  - - [1856, 5888, 1, 3328]
    - [49, 19790.6]
  - - [1024, 704, 1, 1]
    - [93, 59.2842]
  - - [5056, 5888, 1, 1]
    - [91, 224.305]
  - - [2944, 1024, 1, 256]
    - [45, 15892.7]
  - - [448, 1408, 1, 3328]
    - [48, 12216.3]
  - - [5056, 32, 1, 3328]
    - [80, 1542.99]
  - - [2368, 4288, 1, 3328]
    - [49, 19270.3]
  - - [1024, 704, 1, 32]
    - [89, 1248.3]
  - - [448, 2944, 1, 256]
    - [48, 10962.4]
  - - [2944, 6784, 1, 256]
    - [45, 18681.8]
  - - [2368, 2368, 1, 1280]
    - [53, 17099.0]
  - - [5888, 128, 1, 3328]
    - [48, 14277.1]
  - - [256, 256, 1, 32]
    - [89, 95.3251]
  - - [1024, 1, 1, 256]
    - [108, 7.55023]
  - - [3584, 3584, 1, 32]
    - [84, 3907.24]
  - - [2944, 448, 1, 1]
    - [97, 84.1143]
  - - [128, 32, 1, 32]
    - [82, 8.23317]
  - - [5056, 64, 1, 1280]
    - [0, 7470.91]
  - - [2944, 2944, 1, 1280]
    - [43, 17520.4]
  - - [1, 2368, 1, 256]
    - [112, 17.0667]
  - - [64, 6784, 1, 1]
    - [98, 35.7053]
  - - [2944, 32, 1, 1280]
    - [90, 1141.92]
  - - [64, 1408, 1, 3328]
    - [64, 4255.0]
  - - [256, 448, 1, 1280]
    - [20, 4497.57]
  - - [2368, 2944, 1, 1]
    - [106, 172.218]
  - - [6784, 4288, 1, 1280]
    - [51, 19906.6]
  - - [2944, 704, 1, 256]
    - [57, 10980.5]
  - - [5888, 1856, 1, 256]
    - [8, 11365.0]
  - - [704, 2944, 1, 3328]
    - [55, 16382.1]
  - - [5888, 256, 1, 1]
    - [97, 83.3699]
  - - [704, 704, 1, 32]
    - [85, 953.108]
  - - [256, 4288, 1, 256]
    - [54, 8207.31]
  - - [5056, 6784, 1, 32]
    - [78, 4757.27]
  - - [5056, 128, 1, 1]
    - [93, 46.2263]
  - - [448, 5056, 1, 1280]
    - [54, 16171.9]
  - - [448, 448, 1, 256]
    - [2, 4225.35]
  - - [256, 5888, 1, 3328]
    - [49, 16402.0]
  - - [704, 448, 1, 1280]
    - [48, 7487.05]
  - - [448, 64, 1, 256]
    - [64, 945.88]
  - - [1024, 704, 1, 1280]
    - [48, 13257.9]
  - - [5888, 1024, 1, 1]
    - [92, 164.916]
  - - [5888, 448, 1, 32]
    - [80, 2542.48]
  - - [6784, 2944, 1, 256]
    - [45, 18519.4]
  - - [1760, 7133, 1, 1760]
    - [57, 15023.3]
  - - [1024, 256, 1, 1]
    - [119, 19.8594]
  - - [5888, 256, 1, 32]
    - [78, 2161.04]
  - - [2368, 448, 1, 256]
    - [48, 10811.4]
  - - [4288, 256, 1, 3328]
    - [48, 10816.1]
  - - [4288, 2944, 1, 256]
    - [54, 16603.5]
  - - [704, 4288, 1, 3328]
    - [55, 11614.9]
  - - [448, 5888, 1, 3328]
    - [48, 16130.1]
  - - [128, 256, 1, 3328]
    - [28, 1682.9]
  - - [2368, 5056, 1, 32]
    - [84, 3715.32]
  - - [32, 128, 1, 1280]
    - [86, 45.4165]
  - - [1408, 4288, 1, 1]
    - [106, 172.697]
  - - [1408, 1856, 1, 3328]
    - [51, 18347.8]
  - - [4288, 64, 1, 256]
    - [62, 4721.41]
  - - [2944, 5888, 1, 3328]
    - [49, 19597.4]
  - - [128, 6784, 1, 3328]
    - [51, 13468.8]
  - - [448, 4288, 1, 3328]
    - [49, 12866.6]
  - - [704, 2368, 1, 256]
    - [54, 11423.2]
  - - [1, 64, 1, 3328]
    - [113, 0.919653]
  - - [4288, 128, 1, 1]
    - [99, 46.0456]
  - - [704, 256, 1, 32]
    - [79, 375.467]
  - - [4288, 3584, 1, 3328]
    - [56, 15979.7]
  - - [2368, 1024, 1, 1280]
    - [49, 16658.4]
  - - [1408, 1024, 1, 1]
    - [93, 80.4571]
  - - [1408, 1024, 1, 256]
    - [48, 8343.1]
  - - [5056, 3584, 1, 1]
    - [92, 224.711]
  - - [448, 1024, 1, 256]
    - [48, 7645.87]
  - - [6784, 6784, 1, 3328]
    - [59, 18580.5]
  - - [1408, 256, 1, 1280]
    - [6, 8286.16]
  - - [6784, 32, 1, 32]
    - [71, 474.509]
  - - [64, 1024, 1, 3328]
    - [64, 3324.75]
  - - [2368, 2944, 1, 3328]
    - [42, 13362.0]
  - - [448, 448, 1, 1280]
    - [11, 6235.46]
  - - [5056, 3584, 1, 32]
    - [81, 3520.29]
  - - [5056, 3584, 1, 1280]
    - [42, 14381.5]
  - - [1024, 256, 1, 1280]
    - [60, 6584.46]
  - - [1856, 1856, 1, 256]
    - [6, 13442.9]
  - - [32, 5888, 1, 256]
    - [88, 1266.66]
  - - [256, 1408, 1, 32]
    - [80, 632.365]
  - - [2944, 1, 1, 3328]
    - [113, 41.6566]
  - - [32, 704, 1, 3328]
    - [86, 312.597]
  - - [5888, 4288, 1, 1]
    - [94, 240.546]
  - - [1024, 128, 1, 256]
    - [15, 3437.95]
  - - [32, 1856, 1, 3328]
    - [80, 755.105]
  - - [5056, 704, 1, 256]
    - [51, 10026.5]
  - - [448, 256, 1, 256]
    - [15, 2912.71]
  - - [2368, 5056, 1, 256]
    - [6, 12796.3]
  - - [1024, 5056, 1, 256]
    - [42, 12263.1]
  - - [32, 1024, 1, 3328]
    - [90, 458.355]
  - - [5888, 448, 1, 256]
    - [54, 13462.6]
  - - [6784, 5056, 1, 1280]
    - [43, 19579.6]
  - - [704, 6784, 1, 32]
    - [78, 3076.29]
  - - [4288, 6784, 1, 1280]
    - [48, 17260.7]
  - - [64, 1, 1, 256]
    - [113, 0.497087]
  - - [1856, 64, 1, 1280]
    - [64, 5041.23]
  - - [128, 1408, 1, 1]
    - [95, 15.1195]
  - - [1024, 64, 1, 32]
    - [82, 128.502]
  - - [1024, 64, 1, 3328]
    - [66, 3324.75]
  - - [704, 6784, 1, 3328]
    - [44, 15270.0]
  - - [5888, 4288, 1, 1280]
    - [44, 18974.3]
  - - [5888, 3584, 1, 1280]
    - [42, 19537.1]
  - - [5888, 128, 1, 1280]
    - [54, 13564.3]
  - - [1024, 2944, 1, 256]
    - [51, 15240.0]
  - - [1, 2944, 1, 1280]
    - [119, 38.7687]
  - - [32, 1024, 1, 256]
    - [87, 154.429]
  - - [2944, 1856, 1, 1280]
    - [50, 15909.9]
  - - [3584, 1, 1, 1280]
    - [119, 47.0033]
  - - [256, 3584, 1, 32]
    - [85, 1645.75]
  - - [1024, 2368, 1, 1]
    - [95, 125.25]
  - - [2944, 3584, 1, 1280]
    - [59, 16909.1]
  - - [64, 1, 1, 1]
    - [93, 0.00592593]
  - - [1856, 4288, 1, 256]
    - [8, 11116.2]
  - - [256, 128, 1, 3328]
    - [37, 1699.69]
  - - [1024, 1024, 1, 1024]
    - [49, 14863.5]
  - - [1, 1856, 1, 3328]
    - [113, 26.569]
  - - [1408, 704, 1, 1]
    - [107, 66.2588]
  - - [2368, 2944, 1, 32]
    - [78, 3455.46]
  - - [128, 4288, 1, 32]
    - [73, 1060.61]
  - - [128, 704, 1, 1280]
    - [28, 3824.38]
  - - [64, 64, 1, 1]
    - [95, 0.341333]
  - - [1, 1408, 1, 1]
    - [98, 0.126619]
  - - [128, 2368, 1, 1280]
    - [13, 7370.31]
  - - [2944, 32, 1, 32]
    - [82, 189.363]
  - - [448, 1856, 1, 1]
    - [99, 65.3686]
  - - [4288, 704, 1, 256]
    - [44, 13398.1]
  - - [1856, 1024, 1, 256]
    - [42, 10879.7]
  - - [448, 1856, 1, 32]
    - [77, 1325.08]
  - - [448, 1856, 1, 3328]
    - [7, 12473.8]
  - - [448, 448, 1, 32]
    - [73, 360.007]
  - - [1024, 448, 1, 256]
    - [54, 6827.94]
  - - [6784, 1, 1, 256]
    - [113, 45.3211]
  - - [1024, 5056, 1, 32]
    - [85, 3156.92]
  - - [1024, 4288, 1, 1]
    - [99, 157.268]
  - - [704, 256, 1, 3328]
    - [38, 5508.68]
  - - [704, 1856, 1, 32]
    - [70, 1724.92]
  - - [1408, 5888, 1, 1280]
    - [50, 17258.0]
  - - [32, 704, 1, 1280]
    - [89, 277.481]
  - - [5056, 1856, 1, 256]
    - [8, 18501.8]
  - - [6784, 704, 1, 1280]
    - [8, 17442.3]
  - - [704, 1408, 1, 32]
    - [80, 1762.19]
  - - [5888, 1024, 1, 256]
    - [54, 15853.6]
  - - [64, 2944, 1, 1]
    - [95, 16.0218]
  - - [64, 2944, 1, 32]
    - [88, 327.68]
  - - [64, 2944, 1, 1280]
    - [62, 6114.92]
  - - [6784, 1856, 1, 3328]
    - [42, 18584.6]
  - - [64, 704, 1, 3328]
    - [66, 2322.59]
  - - [2368, 5888, 1, 1280]
    - [7, 18889.4]
  - - [1, 6784, 1, 256]
    - [113, 49.5635]
  - - [6784, 6784, 1, 32]
    - [67, 4383.1]
  - - [256, 1, 1, 1280]
    - [118, 2.87237]
  - - [5888, 128, 1, 32]
    - [85, 1389.24]
  - - [6784, 256, 1, 256]
    - [54, 11774.3]
  - - [2368, 3584, 1, 3328]
    - [48, 11740.3]
  - - [128, 4288, 1, 1280]
    - [48, 10140.7]
  - - [128, 128, 1, 256]
    - [24, 444.312]
  - - [5888, 1024, 1, 1280]
    - [48, 17944.4]
  - - [1856, 704, 1, 3328]
    - [49, 14251.6]
  - - [5888, 6784, 1, 3328]
    - [59, 18238.7]
  - - [6784, 448, 1, 1]
    - [98, 135.197]
  - - [6784, 1856, 1, 1]
    - [97, 223.564]
  - - [128, 32, 1, 1280]
    - [90, 49.2382]
  - - [2944, 2368, 1, 1280]
    - [43, 18345.7]
  - - [4288, 448, 1, 1]
    - [98, 103.503]
  - - [6784, 448, 1, 32]
    - [85, 2665.99]
  - - [6784, 448, 1, 3328]
    - [49, 15505.5]
  - - [1, 6784, 1, 1]
    - [107, 0.605714]
  - - [448, 3584, 1, 1280]
    - [48, 14688.5]
  - - [1408, 6784, 1, 1280]
    - [53, 15822.5]
  - - [5056, 5888, 1, 1280]
    - [51, 19677.6]
  - - [32, 2944, 1, 32]
    - [83, 171.287]
  - - [1, 256, 1, 256]
    - [108, 1.95981]
  - - [5056, 2944, 1, 32]
    - [76, 3787.5]
  - - [32, 6784, 1, 256]
    - [89, 1444.24]
  - - [64, 5056, 1, 256]
    - [1, 5752.6]
  - - [4288, 6784, 1, 1]
    - [91, 223.218]
  - - [448, 704, 1, 1280]
    - [48, 5888.3]
  - - [64, 2368, 1, 1]
    - [95, 12.8871]
  - - [1, 4288, 1, 3328]
    - [118, 42.7054]
  - - [5056, 4288, 1, 1]
    - [107, 221.588]
  - - [2368, 5888, 1, 32]
    - [84, 3881.08]
  - - [128, 3584, 1, 1280]
    - [11, 10668.7]
  - - [2944, 6784, 1, 1]
    - [97, 273.141]
  - - [1, 256, 1, 1]
    - [93, 0.0233577]
  - - [5888, 1024, 1, 3328]
    - [44, 13678.3]
  - - [6784, 5888, 1, 256]
    - [53, 19264.7]
  - - [704, 128, 1, 1280]
    - [20, 3706.41]
  - - [4288, 128, 1, 256]
    - [1, 8131.32]
  - - [32, 3584, 1, 3328]
    - [80, 1486.76]
  - - [6784, 64, 1, 256]
    - [63, 7390.23]
  - - [1024, 1, 1, 1280]
    - [113, 13.1282]
  - - [4288, 2368, 1, 32]
    - [74, 3897.88]
  - - [704, 3584, 1, 1]
    - [93, 109.511]
  - - [704, 1856, 1, 3328]
    - [49, 14281.5]
  - - [2944, 128, 1, 1280]
    - [22, 8945.57]
  - - [1, 2368, 1, 3328]
    - [113, 33.6092]
  - - [6784, 704, 1, 32]
    - [77, 3106.3]
  - - [4288, 1, 1, 1280]
    - [118, 39.3394]
  - - [704, 5888, 1, 256]
    - [49, 16196.0]
  - - [2944, 256, 1, 1]
    - [104, 51.2]
  - - [64, 448, 1, 256]
    - [66, 955.733]
  - - [1408, 448, 1, 1280]
    - [48, 11640.8]
  - - [1408, 128, 1, 32]
    - [79, 381.426]
  - - [3584, 5056, 1, 32]
    - [77, 3779.08]
  - - [1024, 32, 1, 1280]
    - [87, 364.342]
  - - [128, 2368, 1, 1]
    - [99, 25.6]
  - - [6784, 1856, 1, 1280]
    - [55, 16959.1]
  - - [5056, 5056, 1, 3328]
    - [49, 15265.3]
  - - [128, 2944, 1, 1280]
    - [34, 8712.88]
  - - [128, 6784, 1, 1]
    - [93, 68.6987]
  - - [5888, 1408, 1, 256]
    - [48, 17182.0]
  - - [2368, 1024, 1, 32]
    - [68, 2298.42]
  - - [256, 256, 1, 3328]
    - [28, 3280.74]
  - - [64, 4288, 1, 1]
    - [95, 23.0228]
  - - [4288, 1024, 1, 256]
    - [45, 16243.8]
  - - [3584, 32, 1, 32]
    - [71, 249.322]
  - - [3584, 64, 1, 1]
    - [113, 18.0327]
  - - [704, 32, 1, 1280]
    - [89, 269.999]
  - - [32, 4288, 1, 32]
    - [75, 258.898]
  - - [32, 6784, 1, 1280]
    - [90, 2025.31]
  - - [64, 1408, 1, 1]
    - [107, 7.50933]
  - - [4288, 5888, 1, 1280]
    - [51, 19582.3]
  - - [256, 1024, 1, 256]
    - [48, 3584.88]
  - - [5056, 5888, 1, 256]
    - [49, 18826.7]
  - - [1408, 128, 1, 1280]
    - [13, 5896.9]
  - - [1024, 5888, 1, 1280]
    - [8, 18583.9]
  - - [64, 1024, 1, 1]
    - [102, 5.57279]
  - - [32, 32, 1, 32]
    - [79, 1.93208]
  - - [64, 128, 1, 256]
    - [16, 229.951]
  - - [5888, 5056, 1, 1280]
    - [6, 15886.2]
  - - [5888, 2944, 1, 1]
    - [105, 196.445]
  - - [64, 4288, 1, 1280]
    - [13, 6652.9]
  - - [704, 2944, 1, 1]
    - [93, 99.2613]
  - - [1408, 4288, 1, 3328]
    - [42, 18565.9]
  - - [704, 2944, 1, 32]
    - [78, 2550.86]
  - - [1, 5888, 1, 1280]
    - [108, 52.2797]
  - - [2944, 4288, 1, 3328]
    - [50, 18619.8]
  - - [256, 2944, 1, 256]
    - [48, 8552.22]
  - - [704, 448, 1, 32]
    - [79, 657.067]
  - - [5056, 2944, 1, 256]
    - [45, 18519.3]
  - - [704, 1024, 1, 256]
    - [48, 8180.38]
  - - [2368, 1856, 1, 256]
    - [48, 16353.5]
  - - [64, 3584, 1, 1]
    - [102, 19.373]
  - - [1024, 128, 1, 1280]
    - [28, 5377.31]
  - - [2368, 4288, 1, 1280]
    - [45, 19126.8]
  - - [3584, 448, 1, 256]
    - [54, 9444.89]
  - - [256, 6784, 1, 256]
    - [48, 13688.3]
  - - [1024, 32, 1, 32]
    - [85, 64.8871]
  - - [4288, 704, 1, 1]
    - [99, 126.625]
  - - [128, 64, 1, 32]
    - [75, 16.8907]
  - - [64, 1, 1, 1280]
    - [113, 0.823151]
  - - [6784, 5888, 1, 3328]
    - [8, 20046.0]
  - - [256, 5888, 1, 1]
    - [93, 90.5846]
  - - [6784, 3584, 1, 256]
    - [45, 18939.7]
  - - [1408, 1856, 1, 256]
    - [48, 15428.8]
  - - [128, 1408, 1, 256]
    - [15, 4061.39]
  - - [2944, 2944, 1, 32]
    - [78, 3637.83]
  - - [2944, 2944, 1, 3328]
    - [53, 14733.3]
  - - [1, 2944, 1, 256]
    - [109, 21.0286]
  - - [448, 32, 1, 1280]
    - [80, 168.041]
  - - [3584, 1, 1, 256]
    - [108, 26.6097]
  - - [704, 32, 1, 3328]
    - [87, 283.645]
  - - [256, 448, 1, 3328]
    - [40, 5185.89]
  - - [2368, 64, 1, 256]
    - [9, 3646.36]
  - - [64, 448, 1, 1280]
    - [25, 1337.47]
  - - [1408, 448, 1, 3328]
    - [48, 12210.6]
  - - [2368, 6784, 1, 3328]
    - [54, 17773.9]
  - - [4096, 7133, 1, 4096]
    - [48, 15984.2]
  - - [4288, 3584, 1, 32]
    - [67, 3875.96]
  - - [5888, 64, 1, 3328]
    - [54, 9570.34]
  - - [3584, 704, 1, 1280]
    - [51, 17296.6]
  - - [448, 5056, 1, 3328]
    - [44, 16093.5]
  - - [4288, 448, 1, 256]
    - [8, 12221.2]
  - - [5056, 256, 1, 1280]
    - [54, 15317.6]
  - - [704, 448, 1, 3328]
    - [54, 8014.85]
  - - [2944, 5888, 1, 32]
    - [78, 4402.35]
  - - [3584, 5056, 1, 256]
    - [51, 14310.5]
  - - [6784, 1, 1, 3328]
    - [116, 66.5599]
  - - [1024, 32, 1, 512]
    - [9, 1184.83]
  - - [64, 256, 1, 1]
    - [93, 1.35629]
  - - [1856, 448, 1, 3328]
    - [54, 12679.6]
  - - [3584, 2368, 1, 256]
    - [45, 17442.6]
  - - [128, 1024, 1, 1280]
    - [35, 5336.26]
  - - [4288, 256, 1, 32]
    - [79, 1498.6]
  - - [4288, 256, 1, 1280]
    - [49, 11570.3]
  - - [448, 5056, 1, 256]
    - [54, 10223.2]
  - - [128, 1856, 1, 1]
    - [102, 16.8727]
  - - [128, 1856, 1, 32]
    - [79, 429.987]
  - - [1408, 1856, 1, 1]
    - [107, 128.1]
  - - [128, 2944, 1, 1]
    - [98, 31.827]
  - - [3584, 32, 1, 256]
    - [75, 824.723]
  - - [448, 2368, 1, 1280]
    - [60, 10194.5]
  - - [3584, 256, 1, 1]
    - [104, 60.6815]
  - - [1408, 1856, 1, 1280]
    - [51, 17860.7]
  - - [3584, 4288, 1, 3328]
    - [53, 12403.8]
  - - [448, 128, 1, 256]
    - [5, 1529.17]
  - - [448, 4288, 1, 32]
    - [78, 2578.56]
  - - [448, 4288, 1, 1280]
    - [49, 16050.3]
  - - [64, 3584, 1, 256]
    - [10, 4860.95]
  - - [6784, 1408, 1, 1280]
    - [8, 14692.3]
  - - [1024, 4288, 1, 3328]
    - [53, 15900.2]
  - - [1, 6784, 1, 1280]
    - [115, 62.9241]
  - - [5056, 1024, 1, 256]
    - [49, 16974.9]
  - - [2368, 448, 1, 32]
    - [79, 1453.24]
  - - [256, 1, 1, 256]
    - [113, 1.8963]
  - - [32, 2944, 1, 1280]
    - [86, 1164.86]
  - - [5056, 1024, 1, 1]
    - [101, 149.807]
  - - [2368, 256, 1, 256]
    - [6, 8471.03]
  - - [1, 5056, 1, 1]
    - [98, 0.461314]
  - - [4288, 32, 1, 32]
    - [71, 242.86]
  - - [1856, 3584, 1, 32]
    - [74, 3473.58]
  - - [5056, 3584, 1, 3328]
    - [49, 17667.9]
  - - [1856, 256, 1, 32]
    - [68, 974.638]
  - - [4288, 5056, 1, 256]
    - [42, 18520.1]
  - - [1856, 5888, 1, 256]
    - [45, 11664.4]
  - - [256, 256, 1, 256]
    - [9, 1807.89]
  - - [2368, 3584, 1, 1]
    - [93, 191.147]
  - - [4288, 2368, 1, 256]
    - [7, 16360.8]
  - - [448, 1, 1, 3328]
    - [119, 6.77948]
  - - [1856, 256, 1, 1280]
    - [46, 9659.69]
  - - [1024, 6784, 1, 1]
    - [97, 189.183]
  - - [1408, 2944, 1, 3328]
    - [49, 18938.8]
  - - [32, 1856, 1, 32]
    - [79, 129.113]
  - - [256, 1, 1, 1]
    - [102, 0.0231884]
  - - [6784, 5056, 1, 3328]
    - [43, 15727.6]
  - - [6784, 5056, 1, 1]
    - [92, 252.502]
  - - [5888, 3584, 1, 32]
    - [78, 4489.91]
  - - [5888, 3584, 1, 3328]
    - [8, 17867.1]
  - - [1, 256, 1, 3328]
    - [119, 3.94868]
  - - [1024, 6784, 1, 256]
    - [8, 17219.0]
  - - [6784, 5888, 1, 32]
    - [81, 4495.68]
  - - [1408, 1, 1, 1280]
    - [113, 18.0224]
  - - [2368, 6784, 1, 32]
    - [74, 4263.97]
  - - [6784, 64, 1, 1]
    - [107, 37.6889]
  - - [2368, 32, 1, 32]
    - [82, 153.083]
  - - [3584, 1408, 1, 3328]
    - [56, 15467.5]
  - - [2944, 1408, 1, 1280]
    - [48, 17653.0]
  - - [1856, 64, 1, 1]
    - [111, 7.89787]
  - - [3584, 1024, 1, 1]
    - [95, 152.409]
  - - [256, 32, 1, 256]
    - [88, 56.1336]
  - - [2944, 1856, 1, 3328]
    - [45, 18365.1]
  - - [128, 1024, 1, 3328]
    - [28, 5933.18]
  - - [1408, 128, 1, 1]
    - [102, 14.9192]
  - - [2944, 3584, 1, 32]
    - [78, 4011.9]
  - - [3584, 1024, 1, 32]
    - [78, 3045.66]
  - - [4288, 6784, 1, 3328]
    - [48, 18050.4]
  - - [256, 128, 1, 1280]
    - [12, 1432.48]
  - - [6784, 5056, 1, 256]
    - [45, 18862.3]
  - - [1408, 32, 1, 3328]
    - [80, 580.107]
  - - [1856, 3584, 1, 1280]
    - [57, 15706.9]
  - - [256, 5888, 1, 256]
    - [7, 13036.4]
  - - [5056, 32, 1, 256]
    - [80, 1140.38]
  - - [2368, 1408, 1, 1]
    - [98, 140.8]
  - - [448, 2368, 1, 256]
    - [48, 8616.15]
  - - [64, 1408, 1, 1280]
    - [39, 3640.89]
  - - [3584, 32, 1, 1280]
    - [80, 1325.87]
  - - [128, 2368, 1, 3328]
    - [48, 7707.26]
  - - [3584, 1024, 1, 256]
    - [45, 16777.2]
  - - [256, 64, 1, 256]
    - [9, 494.611]
  - - [2368, 448, 1, 3328]
    - [48, 13422.1]
  - - [3584, 2368, 1, 1]
    - [92, 187.432]
  - - [1, 1, 1, 1]
    - [109, 8.80282e-05]
  - - [1024, 1856, 1, 32]
    - [75, 2043.6]
  - - [32, 1024, 1, 32]
    - [89, 30.2707]
  - - [4288, 1, 1, 256]
    - [115, 26.8]
  - - [1856, 128, 1, 3328]
    - [54, 8221.99]
  - - [5888, 2368, 1, 1]
    - [92, 215.966]
  - - [5888, 128, 1, 1]
    - [108, 61.5739]
  - - [704, 256, 1, 1280]
    - [54, 5503.02]
  - - [704, 4288, 1, 256]
    - [6, 14439.5]
  - - [5888, 2368, 1, 32]
    - [78, 4103.84]
  - - [5888, 2368, 1, 1280]
    - [44, 18990.7]
  - - [128, 256, 1, 256]
    - [12, 859.489]
  - - [2944, 5056, 1, 3328]
    - [42, 13748.0]
  - - [6784, 704, 1, 3328]
    - [7, 17441.7]
  - - [1856, 1856, 1, 32]
    - [78, 2619.57]
  - - [4288, 2944, 1, 32]
    - [78, 4039.64]
  - - [128, 448, 1, 1]
    - [102, 4.77867]
  - - [2944, 64, 1, 1]
    - [118, 15.0974]
  - - [704, 64, 1, 256]
    - [62, 1275.92]
  - - [256, 2368, 1, 3328]
    - [48, 11784.2]
  - - [704, 1, 1, 1]
    - [108, 0.0633094]
  - - [128, 448, 1, 1280]
    - [12, 2520.62]
  - - [5056, 5056, 1, 256]
    - [59, 16539.0]
  - - [5888, 64, 1, 1]
    - [93, 32.4855]
  - - [6784, 6784, 1, 256]
    - [54, 15990.5]
  - - [256, 3584, 1, 1]
    - [110, 58.8144]
  - - [2368, 2944, 1, 256]
    - [45, 16331.2]
  - - [448, 32, 1, 32]
    - [68, 31.1652]
  - - [5888, 3584, 1, 1]
    - [103, 207.376]
  - - [5888, 128, 1, 256]
    - [1, 10531.5]
  - - [3584, 704, 1, 3328]
    - [48, 13156.5]
  - - [4288, 704, 1, 3328]
    - [57, 15137.4]
  - - [4288, 2944, 1, 1280]
    - [42, 18988.6]
  - - [448, 3584, 1, 256]
    - [54, 11948.9]
  - - [704, 32, 1, 256]
    - [80, 178.44]
  - - [6784, 256, 1, 32]
    - [80, 1984.8]
  - - [1856, 128, 1, 1]
    - [110, 19.2831]
  - - [1856, 32, 1, 32]
    - [73, 125.036]
  - - [2368, 5056, 1, 1280]
    - [44, 17997.1]
  - - [704, 1856, 1, 1280]
    - [54, 15474.5]
  - - [1408, 1408, 1, 1280]
    - [49, 16650.6]
  - - [448, 1024, 1, 3328]
    - [48, 11566.1]
  - - [32, 704, 1, 32]
    - [75, 47.6783]
  - - [3584, 448, 1, 1]
    - [115, 74.6112]
  - - [6784, 1024, 1, 3328]
    - [8, 14072.9]
  - - [5888, 1856, 1, 32]
    - [74, 3882.11]
  - - [5888, 704, 1, 3328]
    - [8, 17418.0]
  - - [5056, 1, 1, 256]
    - [113, 33.4281]
  - - [448, 6784, 1, 256]
    - [45, 15969.7]
  - - [1024, 128, 1, 1]
    - [108, 10.8503]
  - - [128, 64, 1, 256]
    - [9, 229.951]
  - - [128, 5056, 1, 1]
    - [109, 53.9307]
  - - [1856, 128, 1, 256]
    - [13, 5001.43]
  - - [64, 704, 1, 1]
    - [113, 3.52]
  - - [2944, 5888, 1, 256]
    - [8, 18746.1]
  - - [1408, 64, 1, 256]
    - [62, 2485.85]
  - - [128, 5056, 1, 32]
    - [82, 1130.42]
  - - [128, 5056, 1, 1280]
    - [27, 9871.01]
  - - [448, 32, 1, 3328]
    - [90, 201.274]
  - - [1856, 1408, 1, 32]
    - [77, 2600.25]
  - - [64, 704, 1, 32]
    - [79, 80.8179]
  - - [1, 5888, 1, 256]
    - [118, 37.7587]
  - - [64, 2368, 1, 32]
    - [85, 298.625]
  - - [5888, 64, 1, 32]
    - [82, 735.282]
  - - [2368, 256, 1, 1]
    - [109, 41.4077]
  - - [5888, 64, 1, 1280]
    - [63, 8958.86]
  - - [5056, 1, 1, 1]
    - [102, 0.44507]
  - - [5888, 2944, 1, 1280]
    - [49, 17260.9]
  - - [256, 1408, 1, 256]
    - [6, 5036.83]
  - - [448, 5888, 1, 1]
    - [102, 106.022]
  - - [3584, 1408, 1, 1]
    - [97, 177.686]
  - - [32, 6784, 1, 32]
    - [68, 474.509]
  - - [32, 1856, 1, 1280]
    - [86, 696.17]
  - - [448, 5888, 1, 32]
    - [77, 2524.23]
  - - [5056, 704, 1, 1280]
    - [54, 16904.3]
  - - [1856, 6784, 1, 1]
    - [108, 187.591]
  - - [5056, 64, 1, 1]
    - [95, 26.2649]
  - - [1, 5888, 1, 1]
    - [98, 0.529496]
  - - [2368, 1024, 1, 256]
    - [45, 14723.8]
  - - [1856, 6784, 1, 32]
    - [78, 4108.03]
  - - [1856, 6784, 1, 1280]
    - [45, 19148.1]
  - - [64, 3584, 1, 3328]
    - [65, 7931.87]
  - - [5888, 5056, 1, 3328]
    - [49, 16735.2]
  - - [1, 2944, 1, 3328]
    - [108, 38.3679]
  - - [1408, 6784, 1, 32]
    - [81, 3663.23]
  - - [32, 5888, 1, 1280]
    - [87, 1739.56]
  - - [448, 256, 1, 1]
    - [112, 9.49404]
  - - [3584, 5888, 1, 3328]
    - [54, 18504.8]
  - - [4288, 1408, 1, 256]
    - [8, 17296.3]
  - - [448, 64, 1, 1280]
    - [25, 1341.38]
  - - [128, 448, 1, 32]
    - [69, 110.81]
  - - [6784, 2368, 1, 256]
    - [7, 18031.0]
  - - [1408, 448, 1, 32]
    - [85, 1224.82]
  - - [1856, 1408, 1, 1280]
    - [8, 14054.4]
  - - [448, 256, 1, 3328]
    - [40, 5169.04]
  - - [1856, 2368, 1, 1]
    - [107, 142.325]
  - - [1408, 5056, 1, 3328]
    - [8, 15513.8]
  - - [128, 704, 1, 3328]
    - [32, 4303.86]
  - - [5056, 128, 1, 1280]
    - [14, 11984.6]
  - - [5056, 4288, 1, 256]
    - [8, 19106.7]
  - - [5056, 5056, 1, 32]
    - [89, 3499.4]
  - - [1856, 704, 1, 256]
    - [48, 12865.2]
  - - [2368, 256, 1, 32]
    - [79, 1058.88]
  - - [64, 256, 1, 256]
    - [9, 514.008]
  - - [448, 5888, 1, 1280]
    - [48, 15992.8]
  - - [704, 704, 1, 3328]
    - [54, 12548.8]
  - - [128, 6784, 1, 256]
    - [14, 10485.8]
  - - [5056, 448, 1, 256]
    - [7, 13912.2]
  - - [4288, 5888, 1, 1]
    - [94, 222.095]
  - - [1856, 5056, 1, 1280]
    - [49, 18454.1]
  - - [704, 1856, 1, 1]
    - [95, 81.2577]
  - - [2368, 32, 1, 3328]
    - [86, 1041.73]
  - - [3584, 1856, 1, 256]
    - [51, 17166.2]
  - - [256, 3584, 1, 256]
    - [6, 9885.56]
  - - [2944, 1408, 1, 1]
    - [92, 161.416]
  - - [4288, 5888, 1, 32]
    - [81, 4302.98]
  - - [4288, 5888, 1, 3328]
    - [43, 18992.5]
  - - [1, 1024, 1, 1]
    - [99, 0.0920863]
  - - [32, 64, 1, 32]
    - [75, 4.38075]
  - - [1408, 2368, 1, 1]
    - [102, 125.533]
  - - [2944, 2368, 1, 256]
    - [8, 17374.2]
  - - [1024, 1856, 1, 256]
    - [45, 13308.0]
  - - [2944, 64, 1, 3328]
    - [33, 6809.82]
  - - [1024, 5888, 1, 32]
    - [74, 3245.93]
  - - [1024, 5888, 1, 3328]
    - [7, 17093.9]
  - - [5056, 2368, 1, 32]
    - [74, 4007.57]
  - - [1408, 2368, 1, 1280]
    - [48, 17247.4]
  - - [256, 1, 1, 3328]
    - [119, 4.04774]
  - - [128, 1024, 1, 32]
    - [68, 235.107]
  - - [5056, 6784, 1, 3328]
    - [49, 16647.3]
  - - [448, 704, 1, 1]
    - [102, 25.9368]
  - - [448, 704, 1, 32]
    - [68, 660.507]
  - - [448, 704, 1, 3328]
    - [54, 8014.85]
  - - [1408, 2944, 1, 256]
    - [53, 16727.0]
  - - [3584, 4288, 1, 1]
    - [94, 221.571]
  - - [2368, 128, 1, 32]
    - [68, 634.773]
  - - [5056, 1408, 1, 1280]
    - [59, 18008.1]
  - - [2368, 128, 1, 3328]
    - [48, 7697.85]
  - - [704, 5056, 1, 32]
    - [74, 2941.67]
  - - [32, 2368, 1, 32]
    - [71, 143.651]
  - - [1408, 1, 1, 256]
    - [112, 9.77354]
  - - [256, 1856, 1, 32]
    - [77, 805.315]
  - - [448, 1408, 1, 1]
    - [108, 41.4989]
  - - [5056, 4288, 1, 1280]
    - [59, 16717.2]
  - - [1408, 256, 1, 256]
    - [48, 5825.42]
  - - [128, 256, 1, 1]
    - [95, 2.74899]
  - - [256, 4288, 1, 32]
    - [75, 1632.31]
  - - [64, 64, 1, 3328]
    - [26, 219.015]
  - - [256, 256, 1, 1]
    - [98, 5.89353]
  - - [1408, 1, 1, 1]
    - [107, 0.126619]
  - - [448, 1408, 1, 256]
    - [6, 7183.31]
  - - [5888, 5888, 1, 1]
    - [94, 254.467]
  - - [128, 2944, 1, 32]
    - [79, 789.177]
  - - [32, 1024, 1, 1280]
    - [89, 391.552]
  - - [32, 256, 1, 32]
    - [75, 17.523]
  - - [2944, 704, 1, 1280]
    - [6, 15488.6]
  - - [1024, 3584, 1, 1280]
    - [51, 18547.1]
  - - [704, 6784, 1, 256]
    - [52, 14296.5]
  - - [1856, 448, 1, 1]
    - [95, 47.4594]
  - - [128, 704, 1, 1]
    - [93, 7.66258]
  - - [5056, 256, 1, 32]
    - [79, 1816.61]
  - - [4288, 1, 1, 3328]
    - [115, 42.5628]
  - - [5056, 1024, 1, 1280]
    - [53, 17337.3]
  - - [704, 704, 1, 1]
    - [110, 40.7579]
  - - [1856, 448, 1, 1280]
    - [51, 9495.94]
  - - [3584, 6784, 1, 256]
    - [8, 18866.2]
  - - [64, 1856, 1, 1280]
    - [66, 4848.33]
  - - [1856, 1408, 1, 256]
    - [45, 15867.9]
  - - [4288, 4288, 1, 32]
    - [78, 4372.64]
  - - [128, 1, 1, 256]
    - [112, 0.986988]
  - - [32, 64, 1, 3328]
    - [86, 27.9976]
  - - [5888, 448, 1, 1]
    - [102, 112.152]
  - - [128, 5888, 1, 256]
    - [1, 10671.3]
  - - [3584, 256, 1, 3328]
    - [49, 14167.8]
  - - [5056, 5056, 1, 1280]
    - [43, 19377.9]
  - - [2368, 1, 1, 256]
    - [104, 16.8766]
  - - [6784, 1408, 1, 3328]
    - [51, 19084.4]
  - - [1408, 1408, 1, 1]
    - [103, 84.8658]
  - - [32, 64, 1, 256]
    - [85, 14.6613]
  - - [2368, 1, 1, 1280]
    - [113, 30.9796]
  - - [32, 3584, 1, 32]
    - [75, 245.322]
  - - [2368, 5056, 1, 1]
    - [91, 182.509]
  - - [1, 3584, 1, 1]
    - [93, 0.327007]
  - - [256, 2944, 1, 3328]
    - [48, 14582.5]
  - - [1408, 64, 1, 3328]
    - [39, 4269.54]
  - - [1, 128, 1, 3328]
    - [119, 1.98095]
  - - [32, 256, 1, 256]
    - [86, 60.263]
  - - [5888, 1408, 1, 32]
    - [78, 3768.32]
  - - [704, 256, 1, 1]
    - [99, 15.5366]
  - - [1, 448, 1, 1]
    - [102, 0.0405797]
  - - [256, 6784, 1, 3328]
    - [42, 14732.2]
  - - [64, 5888, 1, 256]
    - [63, 6483.13]
  - - [1856, 1, 1, 1]
    - [95, 0.170588]
  - - [1024, 256, 1, 3328]
    - [60, 8421.0]
  - - [704, 704, 1, 256]
    - [17, 6691.86]
  - - [448, 1024, 1, 32]
    - [73, 837.903]
  - - [6784, 2368, 1, 1280]
    - [48, 18397.5]
  - - [128, 1856, 1, 1280]
    - [17, 7253.98]
  - - [256, 2368, 1, 256]
    - [17, 7950.27]
  - - [1024, 448, 1, 32]
    - [75, 950.781]
  - - [6784, 1024, 1, 256]
    - [49, 16904.8]
  - - [1408, 6784, 1, 3328]
    - [47, 12586.1]
  - - [2944, 1408, 1, 3328]
    - [59, 17247.2]
  - - [1856, 32, 1, 256]
    - [80, 446.137]
  - - [704, 2368, 1, 32]
    - [74, 2172.08]
  - - [448, 256, 1, 32]
    - [83, 138.178]
  - - [704, 6784, 1, 1]
    - [107, 148.876]
  - - [2368, 6784, 1, 256]
    - [49, 18366.0]
  - - [1856, 64, 1, 256]
    - [62, 3194.19]
  - - [1856, 3584, 1, 3328]
    - [43, 15808.9]
  - - [1, 704, 1, 3328]
    - [113, 10.1407]
  - - [5056, 1408, 1, 32]
    - [80, 3369.87]
  - - [64, 1, 1, 3328]
    - [113, 0.920927]
  - - [5056, 4288, 1, 3328]
    - [55, 17529.8]
  - - [4288, 2368, 1, 1]
    - [92, 187.759]
  - - [704, 448, 1, 256]
    - [6, 5229.3]
  - - [448, 64, 1, 3328]
    - [37, 1476.18]
  - - [2368, 256, 1, 1280]
    - [17, 8667.85]
  - - [256, 32, 1, 1280]
    - [90, 101.449]
  - - [2368, 448, 1, 1280]
    - [6, 12629.3]
  - - [6784, 2944, 1, 32]
    - [78, 4372.65]
  - - [64, 4288, 1, 32]
    - [71, 560.065]
  - - [3584, 1856, 1, 1]
    - [94, 168.659]
  - - [128, 448, 1, 3328]
    - [32, 2856.9]
  - - [5888, 2368, 1, 3328]
    - [49, 14739.2]
  - - [2368, 704, 1, 1280]
    - [54, 13791.7]
  - - [1024, 1408, 1, 1280]
    - [51, 15196.8]
  - - [4288, 64, 1, 1280]
    - [21, 6642.83]
  - - [2368, 6784, 1, 1]
    - [92, 221.641]
  - - [2944, 5056, 1, 32]
    - [82, 4033.84]
  - - [5056, 256, 1, 3328]
    - [6, 13278.5]
  - - [448, 448, 1, 1]
    - [93, 16.0821]
  - - [256, 2368, 1, 1280]
    - [48, 11187.2]
  - - [704, 2368, 1, 3328]
    - [6, 14548.0]
  - - [3584, 2944, 1, 256]
    - [7, 17512.5]
  - - [64, 6784, 1, 256]
    - [63, 7469.69]
  - - [3584, 1024, 1, 1280]
    - [49, 18582.3]
  - - [1408, 256, 1, 32]
    - [87, 649.456]
  - - [64, 1024, 1, 256]
    - [9, 1747.63]
  - - [1408, 32, 1, 32]
    - [71, 83.8251]
  - - [128, 3584, 1, 256]
    - [6, 8021.89]
  - - [4288, 2944, 1, 1]
    - [103, 183.7]
  - - [5056, 3584, 1, 256]
    - [51, 18338.4]
  - - [2368, 704, 1, 256]
    - [6, 12701.5]
  - - [1856, 1856, 1, 1280]
    - [57, 15529.9]
  - - [64, 32, 1, 32]
    - [68, 4.35745]
  - - [1856, 1024, 1, 1]
    - [95, 101.961]
  - - [4288, 2944, 1, 3328]
    - [43, 18345.9]
  - - [1024, 128, 1, 3328]
    - [31, 5952.61]
  - - [4288, 128, 1, 3328]
    - [54, 10614.9]
  - - [4288, 704, 1, 32]
    - [79, 2505.19]
  - - [1856, 1024, 1, 32]
    - [74, 2235.93]
  - - [1, 448, 1, 3328]
    - [119, 6.94883]
  - - [6784, 2368, 1, 32]
    - [74, 4289.59]
  - - [5888, 5056, 1, 1]
    - [97, 232.141]
  - - [128, 6784, 1, 1280]
    - [18, 12219.6]
  - - [704, 5888, 1, 1]
    - [95, 146.783]
  - - [6784, 6784, 1, 1]
    - [107, 259.253]
  - - [1856, 32, 1, 1280]
    - [88, 670.15]
  - - [3584, 1024, 1, 3328]
    - [51, 18829.9]
  - - [5888, 448, 1, 3328]
    - [53, 12097.2]
  - - [704, 5888, 1, 32]
    - [74, 3140.27]
  - - [704, 5888, 1, 1280]
    - [54, 13491.1]
  - - [1024, 6784, 1, 3328]
    - [50, 13281.9]
  - - [704, 2944, 1, 1280]
    - [7, 17102.2]
  - - [4288, 6784, 1, 256]
    - [59, 17386.5]
  - - [3584, 256, 1, 32]
    - [71, 1369.41]
  - - [1408, 1408, 1, 32]
    - [74, 2227.49]
  - - [1408, 1408, 1, 3328]
    - [45, 16667.4]
  - - [1024, 64, 1, 256]
    - [9, 1807.89]
  - - [4288, 64, 1, 32]
    - [79, 501.246]
  - - [5888, 6784, 1, 32]
    - [74, 4770.88]
  - - [1024, 2944, 1, 3328]
    - [51, 17987.6]
  - - [64, 704, 1, 1280]
    - [66, 2204.57]
  - - [2944, 1856, 1, 256]
    - [45, 10609.8]
  - - [128, 5056, 1, 3328]
    - [54, 12492.9]
  - - [704, 1408, 1, 1]
    - [98, 74.194]
  - - [6784, 5056, 1, 32]
    - [74, 4740.82]
  - - [1024, 448, 1, 3328]
    - [17, 11325.9]
  - - [5888, 1408, 1, 1]
    - [101, 189.449]
  - - [2944, 4288, 1, 1280]
    - [8, 15544.2]
  - - [64, 32, 1, 3328]
    - [86, 28.3705]
  - - [1024, 4288, 1, 256]
    - [43, 14426.0]
  - - [128, 2368, 1, 256]
    - [6, 4825.54]
  - - [2368, 64, 1, 32]
    - [68, 317.386]
  - - [1408, 1, 1, 3328]
    - [119, 20.7044]
  - - [64, 1408, 1, 32]
    - [68, 166.105]
  - - [2368, 5888, 1, 1]
    - [102, 224.016]
  - - [448, 1856, 1, 256]
    - [49, 8367.17]
  - - [1856, 6784, 1, 3328]
    - [50, 18469.3]
  - - [3584, 128, 1, 256]
    - [3, 7935.17]
  - - [1024, 448, 1, 1280]
    - [6, 10530.9]
  - - [1024, 2368, 1, 32]
    - [75, 2565.96]
  - - [128, 5888, 1, 1]
    - [93, 53.5273]
  - - [64, 5056, 1, 1]
    - [93, 26.9653]
  - - [32, 2368, 1, 1280]
    - [90, 877.291]
  - - [2368, 2368, 1, 3328]
    - [7, 17412.0]
  - - [64, 448, 1, 1]
    - [95, 2.38933]
  - - [3584, 5888, 1, 32]
    - [74, 3922.41]
  - - [3584, 5888, 1, 1280]
    - [50, 17469.9]
  - - [64, 5056, 1, 32]
    - [85, 637.604]
  - - [6784, 704, 1, 256]
    - [8, 16036.7]
  - - [1408, 704, 1, 32]
    - [78, 1490.57]
  - - [1408, 704, 1, 1280]
    - [48, 14576.9]
  - - [2368, 5888, 1, 256]
    - [49, 18218.4]
  - - [2944, 64, 1, 32]
    - [79, 396.665]
  - - [1, 1408, 1, 256]
    - [113, 10.3577]
  - - [64, 2944, 1, 256]
    - [62, 4369.07]
  - - [5888, 5888, 1, 32]
    - [74, 4694.45]
  - - [1856, 1408, 1, 3328]
    - [45, 15559.0]
  - - [1024, 1024, 1, 32]
    - [83, 1823.61]
  - - [4288, 1024, 1, 1]
    - [101, 143.307]
  - - [2944, 5056, 1, 1280]
    - [6, 15714.8]
  - - [6784, 2944, 1, 1280]
    - [8, 17437.1]
  - - [6784, 256, 1, 3328]
    - [7, 14753.3]
  - - [5056, 128, 1, 3328]
    - [14, 12586.3]
  - - [128, 128, 1, 1280]
    - [28, 755.458]
  - - [128, 4288, 1, 1]
    - [104, 45.7387]
  - - [1408, 5056, 1, 32]
    - [74, 3771.57]
  - - [2944, 128, 1, 3328]
    - [30, 9466.31]
  - - [5888, 1856, 1, 1280]
    - [43, 18988.9]
  - - [256, 64, 1, 1280]
    - [9, 738.434]
  - - [5888, 256, 1, 1280]
    - [54, 15410.4]
  - - [1856, 5056, 1, 1]
    - [94, 178.81]
  - - [3584, 1856, 1, 1280]
    - [45, 17623.8]
  - - [704, 3584, 1, 256]
    - [45, 15379.1]
  - - [1856, 5056, 1, 32]
    - [74, 3865.68]
  - - [1856, 5056, 1, 3328]
    - [49, 18173.7]
  - - [1024, 2944, 1, 32]
    - [79, 2734.38]
  - - [1408, 6784, 1, 256]
    - [51, 17436.4]
  - - [1024, 2368, 1, 1280]
    - [6, 14842.1]
  - - [1856, 3584, 1, 1]
    - [92, 181.945]
  - - [2944, 5888, 1, 1280]
    - [42, 19230.9]
  - - [1, 1856, 1, 1]
    - [99, 0.165714]
  - - [3584, 3584, 1, 256]
    - [8, 16634.6]
  - - [1856, 2368, 1, 3328]
    - [45, 17865.2]
  - - [5888, 704, 1, 256]
    - [48, 16215.8]
  - - [64, 448, 1, 32]
    - [68, 60.6815]
  - - [6784, 4288, 1, 256]
    - [49, 18404.0]
  - - [128, 64, 1, 3328]
    - [36, 447.815]
  - - [1, 5056, 1, 1280]
    - [109, 44.278]
  - - [32, 64, 1, 1280]
    - [90, 24.0411]
  - - [1408, 2368, 1, 3328]
    - [48, 15051.6]
  - - [1024, 3584, 1, 256]
    - [45, 16517.7]
  - - [2944, 128, 1, 256]
    - [22, 6346.64]
  - - [6784, 128, 1, 1]
    - [93, 66.1854]
  - - [1408, 256, 1, 3328]
    - [54, 9199.13]
  - - [1024, 16, 1, 512]
    - [9, 595.782]
  - - [448, 32, 1, 256]
    - [80, 113.552]
  - - [5056, 6784, 1, 1280]
    - [49, 17530.1]
  - - [64, 2368, 1, 256]
    - [9, 3646.36]
  - - [2944, 256, 1, 256]
    - [54, 9764.07]
  - - [1, 128, 1, 256]
    - [113, 0.979904]
  - - [32, 256, 1, 1280]
    - [89, 98.7732]
  - - [5888, 1, 1, 256]
    - [113, 40.4326]
  - - [32, 128, 1, 3328]
    - [86, 56.7599]
  - - [2560, 7133, 1, 2560]
    - [50, 19032.4]
  - - [6784, 128, 1, 256]
    - [4, 10215.9]
  - - [6784, 64, 1, 1280]
    - [63, 10306.8]
  - - [4288, 1024, 1, 32]
    - [82, 2855.88]
  - - [2944, 448, 1, 1280]
    - [54, 13553.4]
  - - [6784, 32, 1, 1280]
    - [88, 2032.42]
  - - [2944, 64, 1, 1280]
    - [13, 6127.35]
  - - [704, 448, 1, 1]
    - [99, 26.6378]
  - - [32, 128, 1, 32]
    - [68, 8.90435]
  - - [1, 128, 1, 1]
    - [118, 0.0109589]
  - - [32, 4288, 1, 256]
    - [86, 960.812]
  - - [5888, 1, 1, 1]
    - [118, 0.50411]
  - - [5888, 1856, 1, 3328]
    - [48, 18474.8]
  - - [32, 2368, 1, 3328]
    - [90, 1048.31]
  - - [2368, 3584, 1, 256]
    - [45, 17566.7]
  - - [4288, 1408, 1, 3328]
    - [8, 18838.9]
  - - [1856, 32, 1, 3328]
    - [90, 715.938]
  - - [2944, 32, 1, 256]
    - [79, 712.685]
  - - [128, 64, 1, 1]
    - [109, 0.581818]
  - - [256, 1024, 1, 3328]
    - [17, 7965.81]
  - - [32, 448, 1, 256]
    - [80, 108.967]
  - - [1856, 64, 1, 32]
    - [79, 241.186]
  - - [1856, 64, 1, 3328]
    - [64, 5608.87]
  - - [256, 5056, 1, 256]
    - [48, 12217.9]
  - - [5888, 2944, 1, 3328]
    - [58, 16809.0]
  - - [2368, 1408, 1, 3328]
    - [53, 13864.5]
  - - [5888, 704, 1, 32]
    - [85, 3059.15]
  - - [2944, 704, 1, 1]
    - [99, 115.657]
  - - [6784, 1856, 1, 256]
    - [59, 12314.0]
  - - [1, 704, 1, 256]
    - [118, 4.96211]
  - - [1856, 1856, 1, 1]
    - [93, 144.011]
  - - [5888, 32, 1, 256]
    - [86, 1325.12]
  - - [2368, 1856, 1, 1]
    - [107, 147.682]
  - - [128, 704, 1, 256]
    - [20, 2423.18]
  - - [256, 1408, 1, 3328]
    - [54, 9204.81]
  - - [2944, 128, 1, 1]
    - [98, 31.1947]
  - - [32, 256, 1, 3328]
    - [86, 113.444]
  - - [2944, 704, 1, 3328]
    - [42, 14541.9]
  - - [2368, 1856, 1, 32]
    - [79, 2925.13]
  - - [3584, 128, 1, 1280]
    - [17, 10622.3]
  - - [1024, 5056, 1, 3328]
    - [43, 17460.6]
  - - [256, 32, 1, 32]
    - [82, 16.6335]
  - - [64, 256, 1, 3328]
    - [26, 850.904]
  - - [256, 6784, 1, 1]
    - [97, 102.885]
  - - [1024, 3584, 1, 32]
    - [85, 2977.7]
  - - [256, 6784, 1, 32]
    - [74, 1996.21]
  - - [2944, 1408, 1, 32]
    - [78, 3244.74]
  - - [1024, 32, 1, 256]
    - [82, 231.474]
  - - [4288, 3584, 1, 1]
    - [101, 218.298]
  - - [1, 704, 1, 1]
    - [93, 0.0633094]
  - - [5056, 448, 1, 3328]
    - [57, 14507.7]
  - - [3584, 64, 1, 256]
    - [61, 4292.42]
  - - [64, 1856, 1, 32]
    - [73, 242.416]
  - - [64, 1856, 1, 3328]
    - [66, 5583.52]
  - - [5888, 5888, 1, 3328]
    - [49, 20041.5]
  - - [6784, 3584, 1, 32]
    - [78, 4570.27]
  - - [4288, 1856, 1, 256]
    - [8, 17587.9]
  - - [1856, 2944, 1, 256]
    - [49, 16510.9]
  - - [4288, 256, 1, 1]
    - [107, 74.5739]
  - - [64, 128, 1, 32]
    - [79, 16.6335]
  - - [704, 1, 1, 1280]
    - [113, 8.92551]
  - - [1024, 2368, 1, 256]
    - [48, 14369.4]
  - - [2944, 5888, 1, 1]
    - [97, 259.495]
  - - [1024, 1856, 1, 3328]
    - [57, 15039.5]
  - - [5888, 1024, 1, 32]
    - [78, 3340.34]
  - - [3584, 256, 1, 1280]
    - [60, 10833.9]
  - - [1024, 1, 1, 1]
    - [109, 0.0895105]
  - - [1408, 5056, 1, 1280]
    - [54, 17360.4]
  - - [5056, 6784, 1, 256]
    - [8, 19478.2]
  - - [256, 1856, 1, 256]
    - [54, 7274.81]
  - - [1856, 256, 1, 1]
    - [102, 39.8604]
  - - [5888, 32, 1, 1280]
    - [90, 1899.59]
  - - [256, 704, 1, 1]
    - [97, 10.3339]
  - - [256, 128, 1, 32]
    - [80, 63.0154]
  - - [1408, 1856, 1, 32]
    - [75, 2659.79]
  - - [2944, 5056, 1, 1]
    - [97, 235.819]
  - - [448, 128, 1, 1]
    - [95, 4.94345]
  - - [256, 704, 1, 32]
    - [75, 373.521]
  - - [256, 704, 1, 1280]
    - [48, 5503.02]
  - - [1, 2368, 1, 1]
    - [107, 0.205556]
  - - [5888, 5888, 1, 1280]
    - [50, 19526.7]
  - - [256, 2944, 1, 1280]
    - [54, 10728.3]
  - - [2944, 256, 1, 3328]
    - [51, 11694.3]
  - - [5056, 2944, 1, 1280]
    - [51, 17867.6]
  - - [704, 1024, 1, 3328]
    - [54, 12832.3]
  - - [2368, 1856, 1, 1280]
    - [49, 17663.9]
  - - [448, 2944, 1, 1]
    - [94, 82.432]
  - - [6784, 2944, 1, 1]
    - [92, 242.38]
  - - [2944, 1024, 1, 32]
    - [79, 2593.25]
  - - [2944, 1024, 1, 1280]
    - [49, 17597.4]
  - - [1408, 64, 1, 32]
    - [79, 189.709]
  - - [2368, 4288, 1, 256]
    - [54, 12919.6]
  - - [448, 1856, 1, 1280]
    - [57, 10634.5]
  - - [2368, 448, 1, 1]
    - [99, 73.2641]
  - - [448, 2944, 1, 32]
    - [72, 1735.41]
  - - [448, 2944, 1, 1280]
    - [49, 13929.1]
  - - [2944, 6784, 1, 1280]
    - [42, 19466.0]
  - - [256, 6784, 1, 1280]
    - [48, 15824.2]
  - - [5056, 128, 1, 256]
    - [17, 8926.46]
  - - [3072, 7435, 1, 1024]
    - [42, 18642.8]
  - - [3584, 2368, 1, 32]
    - [82, 3607.61]
  - - [704, 32, 1, 32]
    - [68, 48.1882]
  - - [6784, 3584, 1, 3328]
    - [53, 18432.6]
  - - [128, 32, 1, 256]
    - [85, 30.2009]
  - - [128, 1408, 1, 1280]
    - [17, 5566.76]
  - - [64, 32, 1, 1280]
    - [89, 24.2009]
  - - [128, 1856, 1, 3328]
    - [27, 8208.33]
  - - [2944, 2944, 1, 256]
    - [45, 13595.5]
  - - [5056, 2368, 1, 1280]
    - [8, 18841.5]
  - - [448, 128, 1, 32]
    - [73, 106.193]
  - - [32, 5056, 1, 3328]
    - [88, 1657.36]
  - - [448, 2944, 1, 3328]
    - [49, 14419.6]
  - - [2944, 1024, 1, 1]
    - [97, 126.879]
  - - [256, 4288, 1, 1]
    - [104, 72.6011]
  - - [2368, 128, 1, 1280]
    - [10, 7195.35]
  - - [3584, 704, 1, 256]
    - [48, 14896.7]
  - - [2368, 5888, 1, 3328]
    - [54, 15343.2]
  - - [1408, 3584, 1, 32]
    - [85, 3292.84]
  - - [2944, 4288, 1, 32]
    - [74, 4338.1]
  - - [5888, 1408, 1, 1280]
    - [51, 16668.1]
  - - [3584, 5056, 1, 1280]
    - [42, 19152.5]
  - - [5888, 6784, 1, 1280]
    - [55, 17763.8]
  - - [64, 1856, 1, 1]
    - [119, 8.99879]
  - - [704, 128, 1, 32]
    - [71, 163.099]
  - - [128, 3584, 1, 3328]
    - [54, 11636.6]
  - - [256, 4288, 1, 3328]
    - [48, 13871.6]
  - - [256, 2368, 1, 1]
    - [93, 49.8526]
  - - [1, 1408, 1, 1280]
    - [116, 15.0488]
  - - [6784, 1408, 1, 32]
    - [74, 3992.42]
  - - [1856, 704, 1, 32]
    - [78, 1921.51]
  - - [1024, 1856, 1, 1]
    - [109, 92.8]
  - - [704, 5056, 1, 3328]
    - [19, 13009.3]
  - - [1024, 3584, 1, 3328]
    - [51, 14456.2]
  - - [5888, 256, 1, 3328]
    - [19, 12768.2]
  - - [1856, 1408, 1, 1]
    - [102, 120.984]
  - - [2944, 448, 1, 32]
    - [84, 1782.31]
  - - [128, 448, 1, 256]
    - [12, 1609.66]
  - - [128, 1024, 1, 1]
    - [107, 10.9227]
  - - [32, 32, 1, 256]
    - [82, 7.39684]
  - - [4288, 5056, 1, 1280]
    - [8, 19822.9]
  - - [1856, 1856, 1, 3328]
    - [51, 13794.8]
  - - [3584, 1856, 1, 3328]
    - [7, 17785.1]
  - - [4288, 2368, 1, 3328]
    - [56, 15998.4]
  - - [256, 64, 1, 32]
    - [71, 30.0624]
  - - [1, 1024, 1, 1280]
    - [108, 12.2543]
  - - [32, 1408, 1, 256]
    - [86, 349.949]
  - - [1024, 32, 1, 3328]
    - [86, 454.382]
  - - [5888, 3584, 1, 256]
    - [45, 18241.0]
  - - [5888, 448, 1, 1280]
    - [48, 15992.8]
  - - [704, 5888, 1, 3328]
    - [55, 17137.5]
  - - [1024, 1408, 1, 256]
    - [54, 10985.1]
  - - [3584, 2944, 1, 1280]
    - [59, 16873.6]
  - - [1, 5056, 1, 256]
    - [109, 35.1722]
  - - [256, 1024, 1, 1]
    - [93, 19.0512]
  - - [32, 32, 1, 3328]
    - [90, 14.6135]
  - - [5056, 128, 1, 32]
    - [68, 1226.86]
  - - [2368, 1, 1, 3328]
    - [108, 31.1835]
  - - [4288, 1856, 1, 1280]
    - [55, 16492.2]
  - - [3584, 5888, 1, 1]
    - [106, 232.407]
  - - [5888, 4288, 1, 256]
    - [8, 18832.8]
  - - [1024, 2944, 1, 1280]
    - [45, 17438.3]
  - - [6784, 1, 1, 1]
    - [113, 0.561589]
  - - [1408, 64, 1, 1280]
    - [37, 3715.96]
  - - [1, 256, 1, 1280]
    - [119, 3.37397]
  - - [2944, 3584, 1, 256]
    - [59, 12158.5]
  - - [1, 128, 1, 1280]
    - [119, 1.5766]
  - - [1024, 256, 1, 32]
    - [85, 509.017]
  - - [5888, 1, 1, 1280]
    - [113, 52.6008]
  - - [2368, 32, 1, 1280]
    - [86, 923.394]
  - - [5888, 1856, 1, 1]
    - [103, 190.784]
  - - [6784, 128, 1, 1280]
    - [48, 12805.2]
  - - [6784, 2368, 1, 3328]
    - [60, 14180.5]
  - - [1, 64, 1, 256]
    - [108, 0.484161]
  - - [704, 128, 1, 1]
    - [95, 7.82222]
  - - [1408, 4288, 1, 32]
    - [78, 3489.89]
  - - [32, 1408, 1, 3328]
    - [83, 517.914]
  - - [256, 448, 1, 256]
    - [32, 2718.53]
  - - [1856, 1024, 1, 1280]
    - [7, 14556.6]
  - - [1024, 448, 1, 1]
    - [118, 36.2937]
  - - [4288, 3584, 1, 1280]
    - [59, 18700.3]
  - - [448, 1024, 1, 1280]
    - [48, 10762.5]
  - - [5056, 1856, 1, 1]
    - [101, 176.125]
  - - [5888, 2368, 1, 256]
    - [57, 15449.1]
  - - [1408, 1024, 1, 32]
    - [74, 1988.68]
  - - [32, 704, 1, 256]
    - [87, 161.999]
  - - [2944, 1, 1, 256]
    - [113, 23.2039]
  - - [704, 1024, 1, 32]
    - [80, 1399.8]
  - - [5056, 1856, 1, 32]
    - [84, 3521.18]
  - - [5056, 1856, 1, 1280]
    - [52, 16070.1]
  - - [1, 64, 1, 1]
    - [110, 0.00559441]
  - - [1408, 5888, 1, 3328]
    - [8, 19625.3]
  - - [1408, 704, 1, 3328]
    - [42, 14800.8]
  - - [5056, 704, 1, 3328]
    - [51, 16972.9]
  - - [704, 64, 1, 1280]
    - [64, 2042.2]
  - - [1, 704, 1, 1280]
    - [119, 9.23279]
  - - [1408, 256, 1, 1]
    - [104, 27.6417]
  - - [5888, 4288, 1, 32]
    - [78, 4643.26]
  - - [1408, 3584, 1, 256]
    - [45, 17015.9]
  - - [1408, 6784, 1, 1]
    - [92, 206.215]
  - - [6784, 256, 1, 1]
    - [107, 96.9143]
  - - [2944, 1, 1, 1]
    - [102, 0.270588]
  - - [256, 1856, 1, 3328]
    - [17, 10824.6]
  - - [4288, 128, 1, 1280]
    - [14, 10187.7]
  - - [128, 128, 1, 1]
    - [95, 1.36533]
  - - [6784, 256, 1, 1280]
    - [48, 15788.2]
  - - [128, 4288, 1, 256]
    - [1, 8093.85]
  - - [2368, 6784, 1, 1280]
    - [48, 18390.9]
  - - [128, 128, 1, 32]
    - [89, 28.7439]
  - - [128, 128, 1, 3328]
    - [37, 851.968]
  - - [128, 1408, 1, 32]
    - [79, 332.21]
  - - [6784, 128, 1, 32]
    - [75, 1564.6]
  - - [1408, 448, 1, 1]
    - [102, 49.5899]
  - - [2368, 704, 1, 3328]
    - [17, 12224.6]
  - - [704, 128, 1, 3328]
    - [28, 4298.92]
  - - [2944, 1856, 1, 32]
    - [78, 3388.57]
  - - [1024, 64, 1, 1]
    - [99, 4.73526]
  - - [1408, 32, 1, 1280]
    - [86, 544.483]
  - - [704, 1, 1, 256]
    - [115, 4.90806]
  - - [1856, 2944, 1, 3328]
    - [8, 16903.7]
  - - [3584, 2944, 1, 1]
    - [92, 202.91]
  - - [5888, 64, 1, 256]
    - [1, 6699.24]
  - - [64, 5056, 1, 1280]
    - [13, 7797.21]
  - - [1408, 2944, 1, 1]
    - [93, 146.368]
  - - [4288, 1408, 1, 32]
    - [78, 3556.7]
  - - [5888, 2944, 1, 256]
    - [8, 18752.4]
  - - [128, 64, 1, 1280]
    - [64, 387.787]
  - - [1408, 2944, 1, 32]
    - [67, 2950.29]
  - - [1, 3584, 1, 1280]
    - [108, 42.8901]
  - - [64, 64, 1, 32]
    - [68, 8.53333]
  - - [448, 1408, 1, 32]
    - [79, 1207.24]
  - - [128, 5056, 1, 256]
    - [1, 9204.17]
  - - [1, 1, 1, 1280]
    - [108, 0.0112597]
  - - [64, 704, 1, 256]
    - [62, 1275.92]
  - - [3584, 1408, 1, 1280]
    - [48, 17393.4]
  - - [5888, 6784, 1, 256]
    - [51, 17376.5]
  - - [6784, 5888, 1, 1]
    - [101, 249.402]
  - - [64, 4288, 1, 256]
    - [10, 4878.79]
  - - [1, 448, 1, 1280]
    - [113, 5.63965]
  - - [1024, 1024, 1, 1]
    - [93, 70.092]
  - - [6784, 5888, 1, 1280]
    - [48, 18688.4]
  - - [1024, 4288, 1, 32]
    - [82, 3216.79]
  - - [1856, 1, 1, 1280]
    - [119, 24.6645]
  - - [3584, 5888, 1, 256]
    - [53, 17156.6]
  - - [5056, 2368, 1, 1]
    - [92, 191.869]
  - - [256, 1408, 1, 1280]
    - [60, 6096.37]
  - - [512, 16, 1, 512]
    - [9, 306.601]
  - - [64, 256, 1, 32]
    - [79, 33.099]
  - - [64, 5888, 1, 3328]
    - [22, 9582.04]
  - - [6784, 64, 1, 3328]
    - [65, 11046.9]
  - - [5056, 448, 1, 1]
    - [93, 103.713]
  - - [2944, 448, 1, 3328]
    - [17, 11969.2]
  - - [1856, 6784, 1, 256]
    - [54, 16574.1]
  - - [4288, 32, 1, 1280]
    - [80, 1255.26]
  - - [448, 1408, 1, 1280]
    - [54, 11416.9]
  - - [5056, 448, 1, 32]
    - [85, 2073.31]
  - - [3584, 2944, 1, 32]
    - [74, 4042.64]
  - - [2368, 128, 1, 1]
    - [107, 25.0914]
  - - [128, 3584, 1, 32]
    - [75, 970.904]
  - - [3584, 1856, 1, 32]
    - [74, 3428.82]
  - - [4288, 64, 1, 3328]
    - [65, 7038.45]
  - - [5056, 64, 1, 256]
    - [0, 5883.35]
  - - [64, 448, 1, 3328]
    - [37, 1483.53]
  - - [4288, 1408, 1, 1280]
    - [45, 18254.0]
  - - [32, 5056, 1, 256]
    - [83, 1078.61]
  - - [704, 128, 1, 256]
    - [12, 2306.87]
  - - [704, 5056, 1, 1]
    - [99, 124.282]
  - - [256, 1024, 1, 32]
    - [73, 466.034]
  - - [256, 1024, 1, 1280]
    - [54, 7913.78]
  - - [2368, 128, 1, 256]
    - [2, 5542.47]
  - - [2368, 1408, 1, 1280]
    - [51, 16892.4]
  - - [128, 256, 1, 32]
    - [68, 57.4877]
  - - [64, 6784, 1, 32]
    - [71, 785.839]
  - - [6784, 32, 1, 256]
    - [89, 1547.17]
  - - [5056, 2944, 1, 1]
    - [97, 207.426]
  - - [3584, 128, 1, 1]
    - [94, 28.9616]
  - - [1024, 4288, 1, 1280]
    - [54, 17385.4]
  - - [1856, 4288, 1, 1]
    - [93, 182.871]
  - - [128, 2944, 1, 256]
    - [14, 6518.18]
  - - [3584, 4288, 1, 256]
    - [8, 18734.5]
  - - [3584, 128, 1, 32]
    - [75, 981.288]
  - - [3584, 128, 1, 3328]
    - [54, 11643.7]
  - - [704, 5056, 1, 256]
    - [45, 16271.7]
  - - [1856, 4288, 1, 32]
    - [82, 3471.55]
  - - [5056, 1, 1, 1280]
    - [118, 46.9779]
  - - [64, 256, 1, 1280]
    - [26, 759.838]
  - - [4288, 1024, 1, 1280]
    - [51, 17656.3]
  - - [1, 4288, 1, 256]
    - [115, 29.7649]
  - - [2944, 3584, 1, 1]
    - [97, 205.438]
  - - [4288, 6784, 1, 32]
    - [84, 4256.0]
  - - [4288, 4288, 1, 256]
    - [7, 18318.2]
  - - [3584, 3584, 1, 1]
    - [92, 211.546]
  - - [3584, 1408, 1, 256]
    - [6, 11908.6]
  - - [704, 3584, 1, 3328]
    - [45, 17438.5]
  - - [5056, 448, 1, 1280]
    - [48, 16480.9]
  - - [1408, 2944, 1, 1280]
    - [8, 18645.6]
  - - [5888, 704, 1, 1280]
    - [18, 13151.4]
  - - [64, 64, 1, 256]
    - [9, 105.703]
  - - [704, 1408, 1, 1280]
    - [54, 14404.8]
  - - [4288, 5888, 1, 256]
    - [54, 17005.4]
  - - [3584, 3584, 1, 3328]
    - [51, 19633.1]
  - - [2944, 6784, 1, 32]
    - [78, 4101.05]
  - - [448, 64, 1, 32]
    - [73, 58.5143]
  - - [5056, 256, 1, 1]
    - [109, 72.8793]
  - - [64, 6784, 1, 1280]
    - [63, 10322.2]
  - - [2944, 2368, 1, 3328]
    - [6, 16697.9]
  - - [1, 4288, 1, 1]
    - [104, 0.367123]
  - - [1408, 128, 1, 256]
    - [23, 3977.36]
  - - [1024, 1856, 1, 1280]
    - [45, 15578.2]
  - - [1024, 5888, 1, 256]
    - [8, 17104.4]
  - - [704, 1408, 1, 256]
    - [48, 9468.49]
  - - [6784, 2944, 1, 3328]
    - [48, 16835.3]
  - - [1408, 2368, 1, 256]
    - [45, 15241.8]
  - - [1024, 1408, 1, 1]
    - [97, 79.3938]
  - - [64, 128, 1, 1280]
    - [28, 377.729]
  - - [1408, 5056, 1, 256]
    - [8, 17700.3]
  - - [1024, 1408, 1, 32]
    - [74, 2082.01]
  - - [4288, 128, 1, 32]
    - [69, 874.684]
  - - [6784, 704, 1, 1]
    - [107, 159.624]
  - - [448, 704, 1, 256]
    - [48, 5202.34]
  - - [704, 3584, 1, 32]
    - [82, 2455.61]
  - - [1856, 256, 1, 3328]
    - [54, 12052.2]
  - - [6784, 448, 1, 256]
    - [51, 15536.0]
  - - [4288, 4288, 1, 1]
    - [93, 204.846]
  - - [256, 2944, 1, 1]
    - [109, 60.0051]
  - - [64, 2368, 1, 3328]
    - [28, 5975.89]
  - - [256, 704, 1, 3328]
    - [17, 6145.34]
  - - [1, 2944, 1, 1]
    - [104, 0.253793]
  - - [1024, 1024, 1, 256]
    - [48, 12201.6]
  - - [4288, 704, 1, 1280]
    - [57, 15406.7]
  - - [3584, 1, 1, 1]
    - [119, 0.290909]
  - - [256, 2944, 1, 32]
    - [75, 1282.83]
  - - [6784, 4288, 1, 3328]
    - [48, 18281.6]
  - - [5056, 2944, 1, 3328]
    - [56, 15459.0]
  - - [704, 1024, 1, 1280]
    - [48, 10400.7]
  - - [256, 3584, 1, 1280]
    - [60, 10826.0]
  - - [2368, 1856, 1, 3328]
    - [7, 17762.8]
  - - [1856, 4288, 1, 1280]
    - [43, 17424.2]
  - - [1, 1024, 1, 256]
    - [115, 7.62046]
  - - [2944, 1024, 1, 3328]
    - [52, 15241.8]
  - - [2944, 256, 1, 32]
    - [73, 1402.17]
  - - [128, 1, 1, 3328]
    - [108, 1.68028]
  - - [5888, 5056, 1, 32]
    - [81, 4373.07]
  - - [4288, 1408, 1, 1]
    - [97, 170.744]
  - - [3584, 448, 1, 32]
    - [78, 2133.73]
  - - [3584, 448, 1, 1280]
    - [54, 13614.3]
  - - [2944, 6784, 1, 3328]
    - [8, 19402.1]
  - - [1856, 2368, 1, 1280]
    - [8, 14870.0]
  - - [6784, 1024, 1, 1280]
    - [53, 18469.4]
  - - [6784, 3584, 1, 1280]
    - [45, 19912.0]
  - - [1, 5056, 1, 3328]
    - [114, 51.7542]
  - - [4288, 64, 1, 1]
    - [112, 22.4209]
  - - [128, 2368, 1, 32]
    - [68, 634.773]
  - - [128, 1408, 1, 3328]
    - [13, 6348.28]
  - - [2944, 32, 1, 3328]
    - [87, 1183.65]
  - - [704, 1856, 1, 256]
    - [48, 8568.03]
  - - [2944, 2944, 1, 1]
    - [97, 201.749]
  - - [1408, 4288, 1, 256]
    - [8, 17265.4]
  - - [5888, 5056, 1, 256]
    - [54, 13112.6]
  - - [256, 5056, 1, 3328]
    - [7, 13920.4]
  - - [2368, 64, 1, 1280]
    - [28, 5510.98]
  - - [1856, 448, 1, 32]
    - [79, 1335.72]
  - - [1408, 448, 1, 256]
    - [6, 9011.2]
  - - [32, 128, 1, 256]
    - [82, 29.5874]
  - - [448, 1024, 1, 1]
    - [99, 33.3395]
  - - [448, 6784, 1, 1]
    - [98, 125.796]
  - - [704, 2944, 1, 256]
    - [42, 14937.5]
  - - [1408, 1408, 1, 256]
    - [51, 14255.9]
  - - [448, 6784, 1, 32]
    - [83, 2412.09]
  - - [1, 64, 1, 1280]
    - [113, 0.798129]
  - - [2944, 2368, 1, 1]
    - [93, 174.985]
  - - [4288, 448, 1, 32]
    - [79, 2286.93]
  - - [4288, 448, 1, 1280]
    - [51, 14891.7]
  - - [2944, 704, 1, 32]
    - [85, 2265.11]
  - - [1024, 704, 1, 256]
    - [6, 8639.95]
  - - [448, 4288, 1, 1]
    - [104, 103.059]
  - - [3584, 5056, 1, 1]
    - [92, 252.237]
  - - [2368, 2368, 1, 1]
    - [92, 171.376]
  - - [64, 5888, 1, 1]
    - [98, 31.4027]
  - - [1408, 3584, 1, 1280]
    - [59, 17506.6]
  - - [6784, 448, 1, 1280]
    - [43, 16676.1]
  - - [3584, 5056, 1, 3328]
    - [45, 15355.9]
  - - [2368, 2368, 1, 32]
    - [78, 3284.0]
  - - [64, 5888, 1, 32]
    - [79, 797.528]
  - - [1856, 448, 1, 256]
    - [6, 9928.22]
  - - [3584, 2368, 1, 1280]
    - [50, 17291.5]
  - - [128, 1024, 1, 256]
    - [12, 3554.49]
  - - [3584, 64, 1, 3328]
    - [54, 7885.98]
  - - [5888, 2944, 1, 32]
    - [67, 3971.2]
  - - [2944, 1, 1, 1280]
    - [113, 36.0398]
  - - [1856, 2944, 1, 32]
    - [74, 3223.64]
  - - [5056, 1408, 1, 1]
    - [95, 160.334]
  - - [5888, 1408, 1, 3328]
    - [51, 18039.3]
  - - [448, 4288, 1, 256]
    - [7, 13876.5]
  - - [6784, 1024, 1, 1]
    - [97, 187.145]
  - - [256, 448, 1, 1]
    - [118, 9.07342]
  - - [128, 5888, 1, 3328]
    - [54, 14474.8]
  - - [6784, 1024, 1, 32]
    - [74, 3675.56]
  - - [256, 448, 1, 32]
    - [68, 234.057]
  - - [6784, 3584, 1, 1]
    - [97, 249.937]
  - - [2944, 2368, 1, 32]
    - [85, 3485.7]
  - - [3584, 6784, 1, 3328]
    - [50, 19166.9]
  - - [448, 128, 1, 1280]
    - [32, 2548.62]
  - - [64, 3584, 1, 32]
    - [85, 432.785]
  - - [64, 3584, 1, 1280]
    - [11, 7140.11]
  - - [6784, 1408, 1, 256]
    - [8, 17200.8]
  - - [5056, 1024, 1, 32]
    - [78, 3205.79]
  - - [1024, 5056, 1, 1280]
    - [52, 16590.7]
  - - [4288, 3584, 1, 256]
    - [54, 15562.7]
  - - [1408, 1024, 1, 3328]
    - [45, 15250.1]
  - - [2368, 256, 1, 3328]
    - [54, 11696.8]
  - - [448, 6784, 1, 1280]
    - [49, 17695.6]
  - - [1856, 5888, 1, 1]
    - [97, 204.493]
  - - [256, 5888, 1, 32]
    - [74, 1976.82]
  - - [3584, 1, 1, 3328]
    - [113, 51.2527]
  - - [4288, 32, 1, 256]
    - [83, 920.527]
  - - [256, 64, 1, 1]
    - [93, 1.3745]
  - - [4288, 5056, 1, 32]
    - [78, 4228.21]
  - - [4288, 5056, 1, 3328]
    - [44, 14008.4]
  - - [1856, 5888, 1, 32]
    - [74, 3984.73]
  - - [1856, 5888, 1, 1280]
    - [49, 19569.1]
  - - [256, 256, 1, 1280]
    - [41, 2647.92]
  - - [704, 2368, 1, 1280]
    - [48, 15215.7]
  - - [5056, 32, 1, 1280]
    - [86, 1581.35]
  - - [4288, 2368, 1, 1280]
    - [45, 19043.9]
  - - [2944, 5056, 1, 256]
    - [45, 18440.4]
  - - [32, 1856, 1, 256]
    - [89, 411.373]
  - - [64, 5888, 1, 1280]
    - [63, 8958.86]
  - - [1, 1856, 1, 1280]
    - [108, 22.1777]
  - - [2944, 4288, 1, 1]
    - [92, 235.169]
  - - [5056, 5888, 1, 32]
    - [84, 4357.08]
  - - [704, 4288, 1, 1]
    - [97, 116.825]
  - - [704, 1, 1, 3328]
    - [116, 8.31054]
  - - [448, 256, 1, 1280]
    - [31, 4379.49]
  - - [5888, 6784, 1, 1]
    - [101, 246.813]
  - - [2368, 5056, 1, 3328]
    - [55, 17174.5]
  - - [704, 704, 1, 1280]
    - [48, 9242.26]
  - - [128, 32, 1, 3328]
    - [88, 49.7644]
  - - [1024, 6784, 1, 32]
    - [74, 3765.21]
  - - [2368, 1408, 1, 256]
    - [54, 11302.2]
  - - [3584, 2944, 1, 3328]
    - [42, 14325.0]
  - - [128, 1856, 1, 256]
    - [13, 4968.74]
  - - [32, 32, 1, 1280]
    - [82, 11.9417]
  - - [1408, 5888, 1, 1]
    - [92, 212.354]
  - - [1, 3584, 1, 256]
    - [108, 25.3735]
  - - [704, 4288, 1, 32]
    - [79, 2415.0]
  - - [1408, 5888, 1, 32]
    - [82, 3585.0]
  - - [5888, 32, 1, 3328]
    - [86, 2008.74]
  - - [6784, 2368, 1, 1]
    - [92, 246.086]
  - - [1856, 1, 1, 3328]
    - [118, 23.0133]
  - - [5056, 1408, 1, 256]
    - [8, 17741.7]
  - - [1, 1, 1, 256]
    - [115, 0.00749415]
  - - [2944, 1408, 1, 256]
    - [45, 16984.0]
  - - [4288, 1, 1, 1]
    - [112, 0.377465]
  - - [2368, 2368, 1, 256]
    - [8, 16136.5]
  - - [1, 448, 1, 256]
    - [109, 3.21435]
  - - [1856, 704, 1, 1]
    - [106, 83.3306]
  - - [3584, 32, 1, 3328]
    - [80, 1490.48]
  - - [128, 3584, 1, 1]
    - [98, 36.9961]
  - - [1856, 1, 1, 256]
    - [109, 14.3113]
  - - [32, 5888, 1, 32]
    - [82, 345.717]
  - - [1024, 5888, 1, 1]
    - [102, 159.337]
  - - [6784, 32, 1, 3328]
    - [88, 2193.55]
  - - [2368, 704, 1, 1]
    - [93, 85.0547]
  - - [1408, 32, 1, 256]
    - [80, 324.728]
  - - [448, 2368, 1, 1]
    - [95, 65.3241]
  - - [1856, 3584, 1, 256]
    - [49, 17291.7]
  - - [2944, 64, 1, 256]
    - [66, 3889.88]
  - - [2368, 704, 1, 32]
    - [78, 2237.68]
  - - [256, 5888, 1, 1280]
    - [48, 15691.1]
  - - [448, 2368, 1, 32]
    - [75, 1613.48]
  - - [448, 2368, 1, 3328]
    - [49, 11622.8]
  - - [64, 1408, 1, 256]
    - [9, 2443.72]
  - - [5056, 32, 1, 32]
    - [80, 325.21]
  - - [1024, 704, 1, 3328]
    - [46, 10857.8]
  - - [32, 5888, 1, 3328]
    - [90, 2075.77]
  - - [256, 64, 1, 3328]
    - [37, 849.843]
  - - [32, 1408, 1, 1280]
    - [87, 524.288]
  - - [64, 32, 1, 256]
    - [86, 14.7937]
  - - [1856, 1024, 1, 3328]
    - [57, 14869.8]
  - - [2368, 1, 1, 1]
    - [102, 0.216058]
  - - [5056, 2368, 1, 3328]
    - [48, 17192.8]
  - - [128, 1, 1, 1280]
    - [113, 1.55387]
  - - [704, 4288, 1, 1280]
    - [7, 15299.3]
  - - [704, 256, 1, 256]
    - [48, 3432.84]
- null
