library/src/blas3/Tensile/Logic/asm_full/vega20_Cijk_Ailk_Bljk_DB.yaml
- {MinimumRequiredVersion: 4.3.0}
- vega20
- gfx906
- [Device 66a0, Device 66a7]
    SolutionIndex: 0
    SolutionNameMin: Cijk_Ailk_Bljk_DB_MT064x064x08_NLCA01_TT04_04_WG16_16_01
    SolutionIndex: 1
    SolutionNameMin: Cijk_Ailk_Bljk_DB_MT064x064x04_NLCA01_TT04_04_WG16_16_01
    SolutionIndex: 2
    SolutionNameMin: Cijk_Ailk_Bljk_DB_MT096x032x08_NLCA03_TT06_04_WG16_08_01
    SolutionIndex: 3
    SolutionNameMin: Cijk_Ailk_Bljk_DB_MT064x032x08_NLCA01_TT04_04_WG16_08_01
- - - [12324, 12324, 1, 384]
    - [2, 4134.51]
  - - [14372, 14372, 1, 384]
    - [2, 4138.47]
  - - [3108, 3108, 1, 384]
    - [0, 3919.83]
  - - [4132, 4132, 1, 384]
    - [0, 3953.56]
  - - [5156, 5156, 1, 384]
    - [2, 4077.23]
  - - [7204, 7204, 1, 384]
    - [2, 4070.41]
  - - [15396, 15396, 1, 384]
    - [2, 4110.87]
  - - [10276, 10276, 1, 384]
    - [0, 4050.15]
  - - [9252, 9252, 1, 384]
    - [2, 4132.06]
  - - [8228, 8228, 1, 384]
    - [2, 4144.94]
  - - [11300, 11300, 1, 384]
    - [2, 4150.82]
  - - [1060, 1060, 1, 384]
    - [0, 3246.96]
  - - [2084, 2084, 1, 384]
    - [2, 3698.46]
  - - [13348, 13348, 1, 384]
    - [2, 4101.04]
  - - [6180, 6180, 1, 384]
    - [2, 4072.3]
  - - [36, 36, 1, 384]
    - [3, 14.7236]
- - - -1
    - - - -1
        - - - 1
            - - [-1, 1]
          - - -1
            - - [1, 1]
              - [-1, 0]
