library/src/blas3/Tensile/Logic/asm_full/vega20_Cijk_Ailk_Bjlk_DB.yaml
- {MinimumRequiredVersion: 4.8.1}
- vega20
- gfx906
- [Device 66a0, Device 66a1, Device 66a7, Vega 20]
    SolutionIndex: 0
    SolutionNameMin: Cijk_Ailk_Bjlk_DB_MT064x064x08_PLR1_TT04_04_WG16_16_01
    SolutionIndex: 1
    SolutionNameMin: Cijk_Ailk_Bjlk_DB_MT064x064x04_PLR1_TT04_04_WG16_16_01
    SolutionIndex: 4
    SolutionNameMin: Cijk_Ailk_Bjlk_DB_MT064x048x04_PLR0_TT04_06_WG16_08_01
    SolutionIndex: 5
    SolutionNameMin: Cijk_Ailk_Bjlk_DB_MT064x048x04_PLR0_TT04_06_WG16_08_01
    SolutionIndex: 8
    SolutionNameMin: Cijk_Ailk_Bjlk_DB_MT064x048x04_PLR0_TT04_06_WG16_08_01
    SolutionIndex: 9
    SolutionNameMin: Cijk_Ailk_Bjlk_DB_MT064x048x04_PLR0_TT04_06_WG16_08_01
    SolutionIndex: 10
    SolutionNameMin: Cijk_Ailk_Bjlk_DB_MT064x064x04_PLR1_TT04_08_WG16_08_01
    SolutionIndex: 11
    SolutionNameMin: Cijk_Ailk_Bjlk_DB_MT064x064x04_PLR1_TT04_08_WG16_08_01
    SolutionIndex: 12
    SolutionNameMin: Cijk_Ailk_Bjlk_DB_MT064x064x04_PLR1_TT04_08_WG16_08_01
    SolutionIndex: 14
    SolutionNameMin: Cijk_Ailk_Bjlk_DB_MT048x064x04_PLR0_TT06_04_WG08_16_01
    SolutionIndex: 15
    SolutionNameMin: Cijk_Ailk_Bjlk_DB_MT064x064x04_PLR1_TT08_04_WG08_16_01
    SolutionIndex: 16
    SolutionNameMin: Cijk_Ailk_Bjlk_DB_MT096x064x04_PLR0_TT06_04_WG16_16_01
    SolutionIndex: 17
    SolutionNameMin: Cijk_Ailk_Bjlk_DB_MT096x096x04_PLR0_TT06_06_WG16_16_01
    SolutionIndex: 18
    SolutionNameMin: Cijk_Ailk_Bjlk_DB_MT064x128x04_PLR1_TT04_08_WG16_16_01
    SolutionIndex: 24
    SolutionNameMin: Cijk_Ailk_Bjlk_DB_MT064x064x08_PLR1_TT04_04_WG16_16_01
    SolutionIndex: 25
    SolutionNameMin: Cijk_Ailk_Bjlk_DB_MT064x064x08_PLR0_TT04_04_WG16_16_01
    SolutionIndex: 29
    SolutionNameMin: Cijk_Ailk_Bjlk_DB_MT064x064x08_PLR0_TT04_04_WG16_16_01
    SolutionIndex: 30
    SolutionNameMin: Cijk_Ailk_Bjlk_DB_MT064x032x04_PLR0_TT04_04_WG16_08_01
    SolutionIndex: 31
    SolutionNameMin: Cijk_Ailk_Bjlk_DB_MT096x032x04_PLR1_TT06_04_WG16_08_01
    SolutionIndex: 32
    SolutionNameMin: Cijk_Ailk_Bjlk_DB_MT064x048x04_PLR1_TT04_06_WG16_08_01
    SolutionIndex: 33
    SolutionNameMin: Cijk_Ailk_Bjlk_DB_MT032x064x04_PLR0_TT04_04_WG08_16_01
    SolutionIndex: 34
    SolutionNameMin: Cijk_Ailk_Bjlk_DB_MT048x064x04_PLR0_TT06_04_WG08_16_01
    SolutionIndex: 35
    SolutionNameMin: Cijk_Ailk_Bjlk_DB_MT096x064x04_PLR0_TT06_04_WG16_16_01
    SolutionIndex: 36
    SolutionNameMin: Cijk_Ailk_Bjlk_DB_MT064x032x08_PLR1_TT04_04_WG16_08_01
    SolutionIndex: 37
    SolutionNameMin: Cijk_Ailk_Bjlk_DB_MT064x064x08_PLR1_TT04_04_WG16_16_01
    SolutionIndex: 38
    SolutionNameMin: Cijk_Ailk_Bjlk_DB_MT064x064x08_PLR0_TT04_04_WG16_16_01
    SolutionIndex: 39
    SolutionNameMin: Cijk_Ailk_Bjlk_DB_MT064x032x12_PLR1_TT04_04_WG16_08_01
    SolutionIndex: 42
    SolutionNameMin: Cijk_Ailk_Bjlk_DB_MT064x032x04_PK00_PLR0_SNLL0_TT04_04_WG16_08_01_WGM01
    SolutionIndex: 43
    SolutionNameMin: Cijk_Ailk_Bjlk_DB_MT064x048x04_PK00_PLR0_SNLL1_TT04_06_WG16_08_01_WGM01
    SolutionIndex: 44
    SolutionNameMin: Cijk_Ailk_Bjlk_DB_MT064x048x04_PK00_PLR0_SNLL0_TT04_06_WG16_08_01_WGM01
    SolutionIndex: 45
    SolutionNameMin: Cijk_Ailk_Bjlk_DB_MT064x064x04_PK00_PLR1_SNLL1_TT04_08_WG16_08_01_WGM01
    SolutionIndex: 46
    SolutionNameMin: Cijk_Ailk_Bjlk_DB_MT096x064x04_PK00_PLR1_SNLL0_TT06_04_WG16_16_01_WGM01
    SolutionIndex: 50
    SolutionNameMin: Cijk_Ailk_Bjlk_DB_MT064x032x04_PK00_PLR0_SNLL0_TT04_04_WG16_08_01_WGM08
    SolutionIndex: 52
    SolutionNameMin: Cijk_Ailk_Bjlk_DB_MT096x032x04_PK04_PLR1_SNLL1_TT06_04_WG16_08_01_WGM08
    SolutionIndex: 53
    SolutionNameMin: Cijk_Ailk_Bjlk_DB_MT064x048x04_PK00_PLR0_SNLL1_TT04_06_WG16_08_01_WGM08
    SolutionIndex: 54
    SolutionNameMin: Cijk_Ailk_Bjlk_DB_MT064x048x04_PK00_PLR0_SNLL0_TT04_06_WG16_08_01_WGM08
    SolutionIndex: 57
    SolutionNameMin: Cijk_Ailk_Bjlk_DB_MT048x064x04_PK00_PLR0_SNLL1_TT06_04_WG08_16_01_WGM08
    SolutionIndex: 58
    SolutionNameMin: Cijk_Ailk_Bjlk_DB_MT048x064x04_PK00_PLR0_SNLL0_TT06_04_WG08_16_01_WGM08
    SolutionIndex: 59
    SolutionNameMin: Cijk_Ailk_Bjlk_DB_MT096x064x04_PK00_PLR0_SNLL1_TT06_04_WG16_16_01_WGM08
    SolutionIndex: 62
    SolutionNameMin: Cijk_Ailk_Bjlk_DB_MT064x032x08_PK00_PLR1_SNLL1_TT04_04_WG16_08_01_WGM01
    SolutionIndex: 63
    SolutionNameMin: Cijk_Ailk_Bjlk_DB_MT064x032x08_PK00_PLR1_SNLL0_TT04_04_WG16_08_01_WGM01
    SolutionIndex: 64
    SolutionNameMin: Cijk_Ailk_Bjlk_DB_MT096x032x08_PK04_PLR1_SNLL1_TT06_04_WG16_08_01_WGM01
    SolutionIndex: 65
    SolutionNameMin: Cijk_Ailk_Bjlk_DB_MT096x032x08_PK04_PLR1_SNLL0_TT06_04_WG16_08_01_WGM01
    SolutionIndex: 67
    SolutionNameMin: Cijk_Ailk_Bjlk_DB_MT064x064x08_PK00_PLR1_SNLL1_TT04_04_WG16_16_01_WGM01
    SolutionIndex: 68
    SolutionNameMin: Cijk_Ailk_Bjlk_DB_MT064x064x08_PK02_PLR1_SNLL1_TT04_04_WG16_16_01_WGM01
    SolutionIndex: 70
    SolutionNameMin: Cijk_Ailk_Bjlk_DB_MT064x064x08_PK00_PLR1_SNLL0_TT04_04_WG16_16_01_WGM01
    SolutionIndex: 72
    SolutionNameMin: Cijk_Ailk_Bjlk_DB_MT064x064x08_PK04_PLR1_SNLL0_TT04_04_WG16_16_01_WGM01
    SolutionIndex: 73
    SolutionNameMin: Cijk_Ailk_Bjlk_DB_MT064x064x08_PK04_PLR0_SNLL0_TT04_04_WG16_16_01_WGM01
    SolutionIndex: 74
    SolutionNameMin: Cijk_Ailk_Bjlk_DB_MT096x064x08_PK02_PLR1_SNLL0_TT06_04_WG16_16_01_WGM01
    SolutionIndex: 77
    SolutionNameMin: Cijk_Ailk_Bjlk_DB_MT096x032x08_PK04_PLR1_SNLL1_TT06_04_WG16_08_01_WGM08
    SolutionIndex: 78
    SolutionNameMin: Cijk_Ailk_Bjlk_DB_MT096x048x08_PK00_PLR1_SNLL1_TT06_06_WG16_08_01_WGM08
    SolutionIndex: 79
    SolutionNameMin: Cijk_Ailk_Bjlk_DB_MT064x064x08_PK00_PLR1_SNLL1_TT04_04_WG16_16_01_WGM08
    SolutionIndex: 81
    SolutionNameMin: Cijk_Ailk_Bjlk_DB_MT064x064x08_PK04_PLR1_SNLL1_TT04_04_WG16_16_01_WGM08
    SolutionIndex: 82
    SolutionNameMin: Cijk_Ailk_Bjlk_DB_MT064x064x08_PK00_PLR1_SNLL0_TT04_04_WG16_16_01_WGM08
    SolutionIndex: 84
    SolutionNameMin: Cijk_Ailk_Bjlk_DB_MT064x064x08_PK04_PLR0_SNLL0_TT04_04_WG16_16_01_WGM08
    SolutionIndex: 85
    SolutionNameMin: Cijk_Ailk_Bjlk_DB_MT096x064x08_PK02_PLR1_SNLL1_TT06_04_WG16_16_01_WGM08
    SolutionIndex: 86
    SolutionNameMin: Cijk_Ailk_Bjlk_DB_MT096x064x08_PK02_PLR1_SNLL0_TT06_04_WG16_16_01_WGM08
    SolutionIndex: 87
    SolutionNameMin: Cijk_Ailk_Bjlk_DB_MT096x064x08_PK04_PLR1_SNLL0_TT06_04_WG16_16_01_WGM08
    SolutionIndex: 93
    SolutionNameMin: Cijk_Ailk_Bjlk_DB_MT64x32x4_SE_PLR0_SNLL0_TT4_4_WG16_8_1_WGM1
    SolutionIndex: 94
    SolutionNameMin: Cijk_Ailk_Bjlk_DB_MT64x48x4_SE_PLR1_SNLL0_TT4_6_WG16_8_1_WGM1
    SolutionIndex: 95
    SolutionNameMin: Cijk_Ailk_Bjlk_DB_MT64x48x4_SE_PLR0_SNLL0_TT4_6_WG16_8_1_WGM1
    SolutionIndex: 96
    SolutionNameMin: Cijk_Ailk_Bjlk_DB_MT128x32x4_SE_PLR0_SNLL0_TT8_4_WG16_8_1_WGM1
    SolutionIndex: 97
    SolutionNameMin: Cijk_Ailk_Bjlk_DB_MT64x64x4_SE_PLR1_SNLL1_TT4_8_WG16_8_1_WGM1
    SolutionIndex: 98
    SolutionNameMin: Cijk_Ailk_Bjlk_DB_MT64x64x4_SE_PLR1_SNLL0_TT4_8_WG16_8_1_WGM1
    SolutionIndex: 99
    SolutionNameMin: Cijk_Ailk_Bjlk_DB_MT64x96x4_SE_PLR0_SNLL0_TT4_6_WG16_16_1_WGM1
    SolutionIndex: 100
    SolutionNameMin: Cijk_Ailk_Bjlk_DB_MT128x64x4_SE_PLR1_SNLL0_TT8_4_WG16_16_1_WGM1
    SolutionIndex: 101
    SolutionNameMin: Cijk_Ailk_Bjlk_DB_MT64x128x4_SE_PLR1_SNLL1_TT4_8_WG16_16_1_WGM1
    SolutionIndex: 102
    SolutionNameMin: Cijk_Ailk_Bjlk_DB_MT64x128x4_SE_PLR1_SNLL0_TT4_8_WG16_16_1_WGM1
    SolutionIndex: 103
    SolutionNameMin: Cijk_Ailk_Bjlk_DB_MT96x32x4_SE_PLR1_SNLL1_TT6_4_WG16_8_1_WGM4
    SolutionIndex: 104
    SolutionNameMin: Cijk_Ailk_Bjlk_DB_MT64x48x4_SE_PLR0_SNLL1_TT4_6_WG16_8_1_WGM4
    SolutionIndex: 105
    SolutionNameMin: Cijk_Ailk_Bjlk_DB_MT64x48x4_SE_PLR0_SNLL0_TT4_6_WG16_8_1_WGM4
    SolutionIndex: 106
    SolutionNameMin: Cijk_Ailk_Bjlk_DB_MT128x32x4_SE_PLR0_SNLL1_TT8_4_WG16_8_1_WGM4
    SolutionIndex: 107
    SolutionNameMin: Cijk_Ailk_Bjlk_DB_MT48x64x4_SE_PLR1_SNLL0_TT6_4_WG8_16_1_WGM4
    SolutionIndex: 108
    SolutionNameMin: Cijk_Ailk_Bjlk_DB_MT48x64x4_SE_PLR0_SNLL0_TT6_4_WG8_16_1_WGM4
    SolutionIndex: 109
    SolutionNameMin: Cijk_Ailk_Bjlk_DB_MT64x32x4_SE_PLR0_SNLL0_TT4_4_WG16_8_1_WGM8
    SolutionIndex: 110
    SolutionNameMin: Cijk_Ailk_Bjlk_DB_MT64x48x4_SE_PLR0_SNLL1_TT4_6_WG16_8_1_WGM8
    SolutionIndex: 111
    SolutionNameMin: Cijk_Ailk_Bjlk_DB_MT64x48x4_SE_PLR0_SNLL0_TT4_6_WG16_8_1_WGM8
    SolutionIndex: 112
    SolutionNameMin: Cijk_Ailk_Bjlk_DB_MT32x64x4_SE_PLR0_SNLL0_TT4_4_WG8_16_1_WGM8
    SolutionIndex: 113
    SolutionNameMin: Cijk_Ailk_Bjlk_DB_MT48x64x4_SE_PLR1_SNLL1_TT6_4_WG8_16_1_WGM8
    SolutionIndex: 114
    SolutionNameMin: Cijk_Ailk_Bjlk_DB_MT48x64x4_SE_PLR0_SNLL0_TT6_4_WG8_16_1_WGM8
    SolutionIndex: 115
    SolutionNameMin: Cijk_Ailk_Bjlk_DB_MT64x96x4_SE_PLR0_SNLL0_TT4_6_WG16_16_1_WGM8
    SolutionIndex: 116
    SolutionNameMin: Cijk_Ailk_Bjlk_DB_MT64x32x8_SE_PLR1_SNLL1_TT4_4_WG16_8_1_WGM1
    SolutionIndex: 117
    SolutionNameMin: Cijk_Ailk_Bjlk_DB_MT64x32x8_SE_PLR1_SNLL0_TT4_4_WG16_8_1_WGM1
    SolutionIndex: 118
    SolutionNameMin: Cijk_Ailk_Bjlk_DB_MT64x64x8_SE_PLR1_SNLL1_TT4_4_WG16_16_1_WGM1
    SolutionIndex: 119
    SolutionNameMin: Cijk_Ailk_Bjlk_DB_MT64x64x8_SE_PLR0_SNLL1_TT4_4_WG16_16_1_WGM1
    SolutionIndex: 120
    SolutionNameMin: Cijk_Ailk_Bjlk_DB_MT64x64x8_SE_PLR1_SNLL0_TT4_4_WG16_16_1_WGM1
    SolutionIndex: 121
    SolutionNameMin: Cijk_Ailk_Bjlk_DB_MT64x64x8_SE_PLR0_SNLL0_TT4_4_WG16_16_1_WGM1
    SolutionIndex: 122
    SolutionNameMin: Cijk_Ailk_Bjlk_DB_MT64x32x8_SE_PLR1_SNLL1_TT4_4_WG16_8_1_WGM4
    SolutionIndex: 123
    SolutionNameMin: Cijk_Ailk_Bjlk_DB_MT96x32x8_SE_PLR1_SNLL1_TT6_4_WG16_8_1_WGM4
    SolutionIndex: 124
    SolutionNameMin: Cijk_Ailk_Bjlk_DB_MT64x64x8_SE_PLR1_SNLL1_TT4_4_WG16_16_1_WGM4
    SolutionIndex: 125
    SolutionNameMin: Cijk_Ailk_Bjlk_DB_MT64x64x8_SE_PLR0_SNLL1_TT4_4_WG16_16_1_WGM4
    SolutionIndex: 126
    SolutionNameMin: Cijk_Ailk_Bjlk_DB_MT64x64x8_SE_PLR0_SNLL0_TT4_4_WG16_16_1_WGM4
    SolutionIndex: 127
    SolutionNameMin: Cijk_Ailk_Bjlk_DB_MT64x32x8_SE_PLR1_SNLL0_TT4_4_WG16_8_1_WGM8
    SolutionIndex: 128
    SolutionNameMin: Cijk_Ailk_Bjlk_DB_MT64x64x8_SE_PLR1_SNLL1_TT4_4_WG16_16_1_WGM8
    SolutionIndex: 129
    SolutionNameMin: Cijk_Ailk_Bjlk_DB_MT64x64x8_SE_PLR0_SNLL1_TT4_4_WG16_16_1_WGM8
    SolutionIndex: 130
    SolutionNameMin: Cijk_Ailk_Bjlk_DB_MT64x64x8_SE_PLR1_SNLL0_TT4_4_WG16_16_1_WGM8
    SolutionIndex: 131
    SolutionNameMin: Cijk_Ailk_Bjlk_DB_MT64x64x8_SE_PLR0_SNLL0_TT4_4_WG16_16_1_WGM8
    SolutionIndex: 132
    SolutionNameMin: Cijk_Ailk_Bjlk_DB_MT64x32x8_SE_AMAS1_GRVW1_USFGRO1_VW1
    SolutionIndex: 133
    SolutionNameMin: Cijk_Ailk_Bjlk_DB_MT064x064x08_PLR1_TT04_04_WG16_16_01
    SolutionIndex: 134
    SolutionNameMin: Cijk_Ailk_Bjlk_DB_MT064x064x04_PLR1_TT04_04_WG16_16_01
    SolutionIndex: 137
    SolutionNameMin: Cijk_Ailk_Bjlk_DB_MT064x048x04_PLR0_TT04_06_WG16_08_01
    SolutionIndex: 138
    SolutionNameMin: Cijk_Ailk_Bjlk_DB_MT064x048x04_PLR0_TT04_06_WG16_08_01
    SolutionIndex: 141
    SolutionNameMin: Cijk_Ailk_Bjlk_DB_MT064x048x04_PLR0_TT04_06_WG16_08_01
    SolutionIndex: 142
    SolutionNameMin: Cijk_Ailk_Bjlk_DB_MT064x048x04_PLR0_TT04_06_WG16_08_01
    SolutionIndex: 143
    SolutionNameMin: Cijk_Ailk_Bjlk_DB_MT064x064x04_PLR1_TT04_08_WG16_08_01
    SolutionIndex: 144
    SolutionNameMin: Cijk_Ailk_Bjlk_DB_MT064x064x04_PLR1_TT04_08_WG16_08_01
    SolutionIndex: 145
    SolutionNameMin: Cijk_Ailk_Bjlk_DB_MT064x064x04_PLR1_TT04_08_WG16_08_01
    SolutionIndex: 147
    SolutionNameMin: Cijk_Ailk_Bjlk_DB_MT048x064x04_PLR0_TT06_04_WG08_16_01
    SolutionIndex: 148
    SolutionNameMin: Cijk_Ailk_Bjlk_DB_MT064x064x04_PLR1_TT08_04_WG08_16_01
    SolutionIndex: 149
    SolutionNameMin: Cijk_Ailk_Bjlk_DB_MT096x064x04_PLR0_TT06_04_WG16_16_01
    SolutionIndex: 150
    SolutionNameMin: Cijk_Ailk_Bjlk_DB_MT096x096x04_PLR0_TT06_06_WG16_16_01
    SolutionIndex: 151
    SolutionNameMin: Cijk_Ailk_Bjlk_DB_MT064x128x04_PLR1_TT04_08_WG16_16_01
    SolutionIndex: 157
    SolutionNameMin: Cijk_Ailk_Bjlk_DB_MT064x064x08_PLR1_TT04_04_WG16_16_01
    SolutionIndex: 158
    SolutionNameMin: Cijk_Ailk_Bjlk_DB_MT064x064x08_PLR0_TT04_04_WG16_16_01
    SolutionIndex: 162
    SolutionNameMin: Cijk_Ailk_Bjlk_DB_MT064x064x08_PLR0_TT04_04_WG16_16_01
    SolutionIndex: 163
    SolutionNameMin: Cijk_Ailk_Bjlk_DB_MT064x032x04_PLR0_TT04_04_WG16_08_01
    SolutionIndex: 164
    SolutionNameMin: Cijk_Ailk_Bjlk_DB_MT096x032x04_PLR1_TT06_04_WG16_08_01
    SolutionIndex: 165
    SolutionNameMin: Cijk_Ailk_Bjlk_DB_MT064x048x04_PLR1_TT04_06_WG16_08_01
    SolutionIndex: 166
    SolutionNameMin: Cijk_Ailk_Bjlk_DB_MT032x064x04_PLR0_TT04_04_WG08_16_01
    SolutionIndex: 167
    SolutionNameMin: Cijk_Ailk_Bjlk_DB_MT048x064x04_PLR0_TT06_04_WG08_16_01
    SolutionIndex: 168
    SolutionNameMin: Cijk_Ailk_Bjlk_DB_MT096x064x04_PLR0_TT06_04_WG16_16_01
    SolutionIndex: 169
    SolutionNameMin: Cijk_Ailk_Bjlk_DB_MT064x032x08_PLR1_TT04_04_WG16_08_01
    SolutionIndex: 170
    SolutionNameMin: Cijk_Ailk_Bjlk_DB_MT064x064x08_PLR1_TT04_04_WG16_16_01
    SolutionIndex: 171
    SolutionNameMin: Cijk_Ailk_Bjlk_DB_MT064x064x08_PLR0_TT04_04_WG16_16_01
    SolutionIndex: 172
    SolutionNameMin: Cijk_Ailk_Bjlk_DB_MT064x032x12_PLR1_TT04_04_WG16_08_01
    SolutionIndex: 175
    SolutionNameMin: Cijk_Ailk_Bjlk_DB_MT064x032x04_PK00_PLR0_SNLL0_TT04_04_WG16_08_01_WGM01
    SolutionIndex: 176
    SolutionNameMin: Cijk_Ailk_Bjlk_DB_MT064x048x04_PK00_PLR0_SNLL1_TT04_06_WG16_08_01_WGM01
    SolutionIndex: 177
    SolutionNameMin: Cijk_Ailk_Bjlk_DB_MT064x048x04_PK00_PLR0_SNLL0_TT04_06_WG16_08_01_WGM01
    SolutionIndex: 178
    SolutionNameMin: Cijk_Ailk_Bjlk_DB_MT064x064x04_PK00_PLR1_SNLL1_TT04_08_WG16_08_01_WGM01
    SolutionIndex: 179
    SolutionNameMin: Cijk_Ailk_Bjlk_DB_MT096x064x04_PK00_PLR1_SNLL0_TT06_04_WG16_16_01_WGM01
    SolutionIndex: 183
    SolutionNameMin: Cijk_Ailk_Bjlk_DB_MT064x032x04_PK00_PLR0_SNLL0_TT04_04_WG16_08_01_WGM08
    SolutionIndex: 185
    SolutionNameMin: Cijk_Ailk_Bjlk_DB_MT096x032x04_PK04_PLR1_SNLL1_TT06_04_WG16_08_01_WGM08
    SolutionIndex: 186
    SolutionNameMin: Cijk_Ailk_Bjlk_DB_MT064x048x04_PK00_PLR0_SNLL1_TT04_06_WG16_08_01_WGM08
    SolutionIndex: 187
    SolutionNameMin: Cijk_Ailk_Bjlk_DB_MT064x048x04_PK00_PLR0_SNLL0_TT04_06_WG16_08_01_WGM08
    SolutionIndex: 190
    SolutionNameMin: Cijk_Ailk_Bjlk_DB_MT048x064x04_PK00_PLR0_SNLL1_TT06_04_WG08_16_01_WGM08
    SolutionIndex: 191
    SolutionNameMin: Cijk_Ailk_Bjlk_DB_MT048x064x04_PK00_PLR0_SNLL0_TT06_04_WG08_16_01_WGM08
    SolutionIndex: 192
    SolutionNameMin: Cijk_Ailk_Bjlk_DB_MT096x064x04_PK00_PLR0_SNLL1_TT06_04_WG16_16_01_WGM08
    SolutionIndex: 195
    SolutionNameMin: Cijk_Ailk_Bjlk_DB_MT064x032x08_PK00_PLR1_SNLL1_TT04_04_WG16_08_01_WGM01
    SolutionIndex: 196
    SolutionNameMin: Cijk_Ailk_Bjlk_DB_MT064x032x08_PK00_PLR1_SNLL0_TT04_04_WG16_08_01_WGM01
    SolutionIndex: 197
    SolutionNameMin: Cijk_Ailk_Bjlk_DB_MT096x032x08_PK04_PLR1_SNLL1_TT06_04_WG16_08_01_WGM01
    SolutionIndex: 198
    SolutionNameMin: Cijk_Ailk_Bjlk_DB_MT096x032x08_PK04_PLR1_SNLL0_TT06_04_WG16_08_01_WGM01
    SolutionIndex: 200
    SolutionNameMin: Cijk_Ailk_Bjlk_DB_MT064x064x08_PK00_PLR1_SNLL1_TT04_04_WG16_16_01_WGM01
    SolutionIndex: 201
    SolutionNameMin: Cijk_Ailk_Bjlk_DB_MT064x064x08_PK02_PLR1_SNLL1_TT04_04_WG16_16_01_WGM01
    SolutionIndex: 203
    SolutionNameMin: Cijk_Ailk_Bjlk_DB_MT064x064x08_PK00_PLR1_SNLL0_TT04_04_WG16_16_01_WGM01
    SolutionIndex: 205
    SolutionNameMin: Cijk_Ailk_Bjlk_DB_MT064x064x08_PK04_PLR1_SNLL0_TT04_04_WG16_16_01_WGM01
    SolutionIndex: 206
    SolutionNameMin: Cijk_Ailk_Bjlk_DB_MT064x064x08_PK04_PLR0_SNLL0_TT04_04_WG16_16_01_WGM01
    SolutionIndex: 207
    SolutionNameMin: Cijk_Ailk_Bjlk_DB_MT096x064x08_PK02_PLR1_SNLL0_TT06_04_WG16_16_01_WGM01
    SolutionIndex: 210
    SolutionNameMin: Cijk_Ailk_Bjlk_DB_MT096x032x08_PK04_PLR1_SNLL1_TT06_04_WG16_08_01_WGM08
    SolutionIndex: 211
    SolutionNameMin: Cijk_Ailk_Bjlk_DB_MT096x048x08_PK00_PLR1_SNLL1_TT06_06_WG16_08_01_WGM08
    SolutionIndex: 212
    SolutionNameMin: Cijk_Ailk_Bjlk_DB_MT064x064x08_PK00_PLR1_SNLL1_TT04_04_WG16_16_01_WGM08
    SolutionIndex: 214
    SolutionNameMin: Cijk_Ailk_Bjlk_DB_MT064x064x08_PK04_PLR1_SNLL1_TT04_04_WG16_16_01_WGM08
    SolutionIndex: 215
    SolutionNameMin: Cijk_Ailk_Bjlk_DB_MT064x064x08_PK00_PLR1_SNLL0_TT04_04_WG16_16_01_WGM08
    SolutionIndex: 217
    SolutionNameMin: Cijk_Ailk_Bjlk_DB_MT064x064x08_PK04_PLR0_SNLL0_TT04_04_WG16_16_01_WGM08
    SolutionIndex: 218
    SolutionNameMin: Cijk_Ailk_Bjlk_DB_MT096x064x08_PK02_PLR1_SNLL1_TT06_04_WG16_16_01_WGM08
    SolutionIndex: 219
    SolutionNameMin: Cijk_Ailk_Bjlk_DB_MT096x064x08_PK02_PLR1_SNLL0_TT06_04_WG16_16_01_WGM08
    SolutionIndex: 220
    SolutionNameMin: Cijk_Ailk_Bjlk_DB_MT096x064x08_PK04_PLR1_SNLL0_TT06_04_WG16_16_01_WGM08
    SolutionIndex: 227
    SolutionNameMin: Cijk_Ailk_Bjlk_DB_MT64x48x4_SE_PLR1_SNLL0_TT4_6_WG16_8_1_WGM1
    SolutionIndex: 231
    SolutionNameMin: Cijk_Ailk_Bjlk_DB_MT64x64x4_SE_PLR1_SNLL0_TT4_8_WG16_8_1_WGM1
    SolutionIndex: 234
    SolutionNameMin: Cijk_Ailk_Bjlk_DB_MT64x128x4_SE_PLR1_SNLL1_TT4_8_WG16_16_1_WGM1
    SolutionIndex: 235
    SolutionNameMin: Cijk_Ailk_Bjlk_DB_MT64x128x4_SE_PLR1_SNLL0_TT4_8_WG16_16_1_WGM1
    SolutionIndex: 237
    SolutionNameMin: Cijk_Ailk_Bjlk_DB_MT64x48x4_SE_PLR0_SNLL1_TT4_6_WG16_8_1_WGM4
    SolutionIndex: 238
    SolutionNameMin: Cijk_Ailk_Bjlk_DB_MT64x48x4_SE_PLR0_SNLL0_TT4_6_WG16_8_1_WGM4
    SolutionIndex: 241
    SolutionNameMin: Cijk_Ailk_Bjlk_DB_MT48x64x4_SE_PLR0_SNLL0_TT6_4_WG8_16_1_WGM4
    SolutionIndex: 243
    SolutionNameMin: Cijk_Ailk_Bjlk_DB_MT64x48x4_SE_PLR0_SNLL1_TT4_6_WG16_8_1_WGM8
    SolutionIndex: 244
    SolutionNameMin: Cijk_Ailk_Bjlk_DB_MT64x48x4_SE_PLR0_SNLL0_TT4_6_WG16_8_1_WGM8
    SolutionIndex: 247
    SolutionNameMin: Cijk_Ailk_Bjlk_DB_MT48x64x4_SE_PLR0_SNLL0_TT6_4_WG8_16_1_WGM8
    SolutionIndex: 248
    SolutionNameMin: Cijk_Ailk_Bjlk_DB_MT64x96x4_SE_PLR0_SNLL0_TT4_6_WG16_16_1_WGM8
    SolutionIndex: 249
    SolutionNameMin: Cijk_Ailk_Bjlk_DB_MT64x32x8_SE_PLR1_SNLL1_TT4_4_WG16_8_1_WGM1
    SolutionIndex: 251
    SolutionNameMin: Cijk_Ailk_Bjlk_DB_MT64x64x8_SE_PLR1_SNLL1_TT4_4_WG16_16_1_WGM1
    SolutionIndex: 252
    SolutionNameMin: Cijk_Ailk_Bjlk_DB_MT64x64x8_SE_PLR0_SNLL1_TT4_4_WG16_16_1_WGM1
    SolutionIndex: 253
    SolutionNameMin: Cijk_Ailk_Bjlk_DB_MT64x64x8_SE_PLR1_SNLL0_TT4_4_WG16_16_1_WGM1
    SolutionIndex: 254
    SolutionNameMin: Cijk_Ailk_Bjlk_DB_MT64x64x8_SE_PLR0_SNLL0_TT4_4_WG16_16_1_WGM1
    SolutionIndex: 256
    SolutionNameMin: Cijk_Ailk_Bjlk_DB_MT96x32x8_SE_PLR1_SNLL1_TT6_4_WG16_8_1_WGM4
    SolutionIndex: 258
    SolutionNameMin: Cijk_Ailk_Bjlk_DB_MT64x64x8_SE_PLR0_SNLL1_TT4_4_WG16_16_1_WGM4
    SolutionIndex: 259
    SolutionNameMin: Cijk_Ailk_Bjlk_DB_MT64x64x8_SE_PLR0_SNLL0_TT4_4_WG16_16_1_WGM4
    SolutionIndex: 262
    SolutionNameMin: Cijk_Ailk_Bjlk_DB_MT64x64x8_SE_PLR0_SNLL1_TT4_4_WG16_16_1_WGM8
    SolutionIndex: 264
    SolutionNameMin: Cijk_Ailk_Bjlk_DB_MT64x64x8_SE_PLR0_SNLL0_TT4_4_WG16_16_1_WGM8
- - - [38144, 38144, 1, 256]
    - [14, 4943.8]
  - - [29568, 128, 1, 384]
    - [37, 4500.02]
  - - [30848, 128, 1, 256]
    - [37, 4373.61]
  - - [25728, 128, 1, 384]
    - [37, 4474.18]
  - - [32256, 32256, 1, 256]
    - [14, 4916.49]
  - - [7680, 7680, 1, 256]
    - [9, 4862.77]
  - - [11648, 128, 1, 128]
    - [38, 3500.38]
  - - [41984, 41984, 1, 256]
    - [12, 4914.14]
  - - [40448, 40448, 1, 256]
    - [14, 4917.55]
  - - [25728, 128, 1, 256]
    - [37, 4361.84]
  - - [64, 64, 1, 64]
    - [0, 27.1934]
  - - [15104, 15104, 1, 256]
    - [9, 4937.66]
  - - [17280, 17280, 1, 384]
    - [9, 5028.89]
  - - [34688, 128, 1, 384]
    - [37, 4631.6]
  - - [27392, 27392, 1, 256]
    - [8, 4944.53]
  - - [6528, 128, 1, 256]
    - [33, 3504.42]
  - - [35328, 35328, 1, 256]
    - [9, 4913.01]
  - - [18432, 18432, 1, 384]
    - [14, 5016.36]
  - - [31232, 31232, 1, 256]
    - [14, 4912.53]
  - - [7808, 128, 1, 256]
    - [37, 3823.26]
  - - [38400, 38400, 1, 384]
    - [12, 5031.62]
  - - [16128, 16128, 1, 256]
    - [9, 4943.0]
  - - [9472, 9472, 1, 256]
    - [9, 4905.43]
  - - [21888, 21888, 1, 384]
    - [12, 5036.49]
  - - [37248, 128, 1, 128]
    - [37, 4144.74]
  - - [38656, 38656, 1, 256]
    - [9, 4955.08]
  - - [20224, 20224, 1, 256]
    - [9, 4937.41]
  - - [8960, 8960, 1, 256]
    - [9, 4907.66]
  - - [29952, 29952, 1, 384]
    - [12, 5037.48]
  - - [36864, 36864, 1, 384]
    - [12, 5032.98]
  - - [33408, 33408, 1, 384]
    - [12, 5043.49]
  - - [20608, 128, 1, 384]
    - [37, 4271.06]
  - - [23424, 23424, 1, 384]
    - [12, 5031.57]
  - - [4864, 4864, 1, 256]
    - [9, 4801.16]
  - - [25728, 128, 1, 128]
    - [37, 3991.74]
  - - [21504, 21504, 1, 384]
    - [9, 5021.86]
  - - [25600, 25600, 1, 256]
    - [14, 4903.23]
  - - [40960, 40960, 1, 256]
    - [10, 4912.97]
  - - [19200, 19200, 1, 384]
    - [9, 5039.59]
  - - [64, 1, 1, 64]
    - [1, 0.433898]
  - - [25088, 25088, 1, 256]
    - [14, 4917.16]
  - - [41728, 41728, 1, 256]
    - [9, 4950.97]
  - - [35840, 35840, 1, 256]
    - [12, 4913.98]
  - - [34560, 34560, 1, 256]
    - [9, 4938.35]
  - - [26368, 26368, 1, 256]
    - [9, 4930.11]
  - - [5888, 5888, 1, 256]
    - [9, 4847.58]
  - - [28032, 28032, 1, 384]
    - [8, 5039.79]
  - - [42496, 42496, 1, 256]
    - [14, 4913.66]
  - - [27008, 128, 1, 256]
    - [37, 4323.82]
  - - [38400, 38400, 1, 256]
    - [14, 4915.12]
  - - [11008, 11008, 1, 256]
    - [9, 4903.83]
  - - [19328, 128, 1, 128]
    - [37, 3802.47]
  - - [32000, 32000, 1, 256]
    - [14, 4933.59]
  - - [37248, 37248, 1, 384]
    - [12, 5048.12]
  - - [10496, 10496, 1, 256]
    - [9, 4921.39]
  - - [3328, 3328, 1, 256]
    - [9, 4642.33]
  - - [16640, 16640, 1, 256]
    - [9, 4936.05]
  - - [24960, 24960, 1, 384]
    - [9, 5038.33]
  - - [1536, 1536, 1, 384]
    - [4, 4666.1]
  - - [18688, 18688, 1, 256]
    - [9, 4946.22]
  - - [22272, 22272, 1, 384]
    - [12, 5031.77]
  - - [15488, 128, 1, 256]
    - [37, 4149.04]
  - - [28416, 28416, 1, 384]
    - [10, 5039.67]
  - - [3840, 3840, 1, 256]
    - [8, 4748.27]
  - - [19968, 19968, 1, 384]
    - [9, 5016.45]
  - - [43776, 43776, 1, 256]
    - [9, 4949.83]
  - - [35072, 35072, 1, 256]
    - [12, 4936.95]
  - - [20736, 20736, 1, 256]
    - [9, 4947.98]
  - - [7168, 7168, 1, 256]
    - [14, 4838.49]
  - - [18432, 18432, 1, 256]
    - [14, 4913.01]
  - - [38016, 38016, 1, 384]
    - [12, 5038.34]
  - - [35328, 35328, 1, 384]
    - [12, 5030.83]
  - - [38784, 38784, 1, 384]
    - [12, 5052.56]
  - - [26112, 26112, 1, 384]
    - [10, 5023.99]
  - - [43648, 128, 1, 128]
    - [38, 4199.72]
  - - [27264, 27264, 1, 384]
    - [9, 5038.76]
  - - [44928, 44928, 1, 384]
    - [12, 5044.23]
  - - [41088, 128, 1, 384]
    - [34, 4559.64]
  - - [42368, 128, 1, 256]
    - [37, 4531.65]
  - - [3072, 3072, 1, 384]
    - [16, 4787.42]
  - - [3456, 3072, 1, 384]
    - [16, 4812.85]
  - - [9216, 9216, 1, 384]
    - [14, 4982.57]
  - - [38528, 128, 1, 128]
    - [38, 4208.28]
  - - [10752, 10752, 1, 256]
    - [9, 4887.21]
  - - [9088, 128, 1, 384]
    - [34, 4442.06]
  - - [17152, 17152, 1, 256]
    - [9, 4931.31]
  - - [44928, 128, 1, 384]
    - [34, 4690.53]
  - - [18048, 128, 1, 128]
    - [37, 3789.06]
  - - [7808, 128, 1, 384]
    - [37, 4053.43]
  - - [29184, 29184, 1, 256]
    - [14, 4921.28]
  - - [11776, 11776, 1, 256]
    - [14, 4885.04]
  - - [1, 64, 1, 64]
    - [1, 0.433898]
  - - [27136, 27136, 1, 256]
    - [12, 4903.82]
  - - [30848, 128, 1, 128]
    - [37, 4062.81]
  - - [33408, 128, 1, 256]
    - [37, 4422.73]
  - - [33792, 33792, 1, 384]
    - [12, 5023.83]
  - - [4224, 4224, 1, 384]
    - [14, 4889.8]
  - - [43520, 43520, 1, 256]
    - [12, 4915.38]
  - - [14592, 14592, 1, 384]
    - [9, 5010.72]
  - - [41472, 41472, 1, 256]
    - [10, 4912.51]
  - - [14080, 14080, 1, 256]
    - [9, 4923.92]
  - - [34688, 128, 1, 256]
    - [37, 4509.11]
  - - [16896, 16896, 1, 256]
    - [14, 4908.48]
  - - [15744, 15744, 1, 384]
    - [9, 5029.34]
  - - [28416, 28416, 1, 256]
    - [9, 4935.51]
  - - [24448, 128, 1, 128]
    - [37, 3997.57]
  - - [23808, 23808, 1, 256]
    - [9, 4947.2]
  - - [27648, 27648, 1, 256]
    - [14, 4917.33]
  - - [1152, 3072, 1, 384]
    - [14, 4728.45]
  - - [21888, 128, 1, 256]
    - [37, 4327.94]
  - - [2688, 128, 1, 384]
    - [37, 2844.97]
  - - [34816, 34816, 1, 256]
    - [14, 4915.79]
  - - [43776, 43776, 1, 384]
    - [12, 5043.62]
  - - [36096, 36096, 1, 256]
    - [9, 4953.01]
  - - [24320, 24320, 1, 256]
    - [9, 4942.95]
  - - [12544, 12544, 1, 256]
    - [9, 4929.98]
  - - [29184, 29184, 1, 384]
    - [12, 5029.38]
  - - [29568, 29568, 1, 384]
    - [12, 5040.32]
  - - [12928, 128, 1, 384]
    - [37, 4086.94]
  - - [36480, 36480, 1, 384]
    - [12, 5046.82]
  - - [30720, 30720, 1, 256]
    - [14, 4918.08]
  - - [25728, 25728, 1, 384]
    - [9, 5038.88]
  - - [34048, 34048, 1, 256]
    - [9, 4947.82]
  - - [2304, 2048, 1, 256]
    - [25, 4456.76]
  - - [12928, 128, 1, 256]
    - [37, 3941.43]
  - - [9728, 9728, 1, 256]
    - [14, 4882.17]
  - - [128, 128, 1, 256]
    - [36, 186.912]
  - - [33024, 33024, 1, 256]
    - [9, 4946.58]
  - - [15488, 128, 1, 384]
    - [37, 4301.92]
  - - [23168, 128, 1, 128]
    - [37, 3897.17]
  - - [39808, 128, 1, 384]
    - [37, 4564.35]
  - - [18176, 18176, 1, 256]
    - [9, 4927.79]
  - - [21504, 21504, 1, 256]
    - [9, 4913.98]
  - - [41088, 128, 1, 128]
    - [37, 4181.28]
  - - [16384, 16384, 1, 256]
    - [9, 4903.36]
  - - [1920, 1920, 1, 384]
    - [24, 4414.31]
  - - [3968, 128, 1, 128]
    - [37, 2987.67]
  - - [27008, 128, 1, 384]
    - [34, 4595.96]
  - - [27904, 27904, 1, 256]
    - [8, 4934.31]
  - - [24448, 128, 1, 384]
    - [37, 4560.76]
  - - [7680, 7680, 1, 384]
    - [14, 4980.39]
  - - [35968, 128, 1, 384]
    - [34, 4651.88]
  - - [37632, 37632, 1, 256]
    - [9, 4941.1]
  - - [14848, 14848, 1, 256]
    - [9, 4898.96]
  - - [8832, 8832, 1, 384]
    - [9, 5012.35]
  - - [23552, 23552, 1, 256]
    - [14, 4906.6]
  - - [4608, 4608, 1, 50000]
    - [17, 5244.06]
  - - [13056, 13056, 1, 256]
    - [9, 4931.17]
  - - [38528, 128, 1, 256]
    - [37, 4508.88]
  - - [19584, 19584, 1, 384]
    - [9, 5045.62]
  - - [16768, 128, 1, 384]
    - [34, 4251.87]
  - - [22784, 22784, 1, 256]
    - [14, 4931.16]
  - - [44160, 44160, 1, 384]
    - [12, 5044.51]
  - - [28160, 28160, 1, 256]
    - [12, 4905.11]
  - - [14592, 14592, 1, 256]
    - [9, 4946.11]
  - - [20992, 20992, 1, 256]
    - [14, 4900.0]
  - - [41216, 41216, 1, 256]
    - [9, 4935.63]
  - - [21760, 21760, 1, 256]
    - [9, 4948.32]
  - - [25344, 25344, 1, 256]
    - [14, 4936.55]
  - - [35968, 128, 1, 128]
    - [38, 4143.0]
  - - [4608, 4608, 1, 256]
    - [14, 4771.78]
  - - [3456, 3456, 1, 384]
    - [8, 4829.09]
  - - [2560, 2048, 1, 256]
    - [25, 4438.42]
  - - [30464, 30464, 1, 256]
    - [9, 4943.45]
  - - [19200, 19200, 1, 256]
    - [9, 4945.89]
  - - [22272, 22272, 1, 256]
    - [14, 4936.92]
  - - [29952, 29952, 1, 256]
    - [9, 4944.13]
  - - [20480, 20480, 1, 256]
    - [14, 4908.02]
  - - [5376, 5376, 1, 384]
    - [8, 4947.28]
  - - [17408, 17408, 1, 256]
    - [14, 4913.04]
  - - [32768, 32768, 1, 256]
    - [10, 4905.13]
  - - [18816, 18816, 1, 384]
    - [10, 5032.61]
  - - [3840, 3840, 1, 384]
    - [9, 4870.39]
  - - [34944, 34944, 1, 384]
    - [12, 5043.57]
  - - [18048, 18048, 1, 384]
    - [11, 5025.03]
  - - [34560, 34560, 1, 384]
    - [12, 5042.24]
  - - [9088, 128, 1, 256]
    - [34, 4182.52]
  - - [24576, 24576, 1, 256]
    - [14, 4922.48]
  - - [32128, 128, 1, 384]
    - [37, 4573.55]
  - - [8448, 8448, 1, 256]
    - [9, 4918.8]
  - - [42752, 42752, 1, 256]
    - [8, 4942.02]
  - - [5376, 5376, 1, 256]
    - [9, 4841.23]
  - - [18048, 128, 1, 256]
    - [37, 4307.97]
  - - [3584, 3584, 1, 256]
    - [9, 4668.55]
  - - [37120, 37120, 1, 256]
    - [9, 4941.96]
  - - [39936, 39936, 1, 384]
    - [12, 5032.16]
  - - [20736, 20736, 1, 384]
    - [9, 5031.05]
  - - [35584, 35584, 1, 256]
    - [9, 4939.06]
  - - [26112, 26112, 1, 256]
    - [9, 4912.04]
  - - [16896, 16896, 1, 384]
    - [14, 5009.28]
  - - [40704, 40704, 1, 384]
    - [12, 5044.18]
  - - [33280, 33280, 1, 256]
    - [14, 4917.79]
  - - [32128, 128, 1, 128]
    - [38, 4099.57]
  - - [5632, 5632, 1, 256]
    - [9, 4794.28]
  - - [19456, 19456, 1, 256]
    - [14, 4903.62]
  - - [22016, 22016, 1, 256]
    - [14, 4909.78]
  - - [29568, 128, 1, 128]
    - [37, 4035.67]
  - - [14208, 128, 1, 256]
    - [37, 4244.78]
  - - [10368, 128, 1, 128]
    - [37, 3276.8]
  - - [13568, 13568, 1, 256]
    - [9, 4929.85]
  - - [30848, 128, 1, 384]
    - [37, 4442.81]
  - - [1408, 128, 1, 384]
    - [37, 2028.31]
  - - [5760, 5760, 1, 5760]
    - [18, 5159.55]
  - - [10752, 10752, 1, 384]
    - [14, 4998.43]
  - - [39936, 39936, 1, 256]
    - [14, 4913.67]
  - - [1920, 3072, 1, 384]
    - [5, 4825.97]
  - - [9984, 9984, 1, 256]
    - [9, 4920.05]
  - - [13056, 13056, 1, 384]
    - [9, 5023.78]
  - - [2816, 2048, 1, 256]
    - [29, 4480.45]
  - - [23168, 128, 1, 256]
    - [37, 4268.83]
  - - [19968, 19968, 1, 256]
    - [9, 4916.04]
  - - [44800, 44800, 1, 256]
    - [9, 4946.5]
  - - [11904, 11904, 1, 384]
    - [11, 5015.11]
  - - [14976, 14976, 1, 384]
    - [9, 5021.87]
  - - [35712, 35712, 1, 384]
    - [12, 5043.92]
  - - [12672, 12672, 1, 384]
    - [9, 5022.34]
  - - [43008, 43008, 1, 384]
    - [12, 5032.01]
  - - [41088, 41088, 1, 384]
    - [12, 5046.15]
  - - [10368, 128, 1, 384]
    - [31, 3879.48]
  - - [6912, 6912, 1, 384]
    - [14, 4979.18]
  - - [27008, 128, 1, 128]
    - [37, 4000.9]
  - - [16128, 16128, 1, 384]
    - [11, 5027.9]
  - - [5120, 5120, 1, 256]
    - [14, 4783.78]
  - - [25856, 25856, 1, 256]
    - [9, 4933.64]
  - - [12288, 12288, 1, 256]
    - [9, 4898.9]
  - - [6400, 6400, 1, 256]
    - [9, 4861.45]
  - - [2688, 128, 1, 256]
    - [37, 2678.84]
  - - [11648, 128, 1, 256]
    - [37, 4050.1]
  - - [43264, 43264, 1, 256]
    - [14, 4943.12]
  - - [19712, 19712, 1, 256]
    - [9, 4935.51]
  - - [34176, 34176, 1, 384]
    - [12, 5041.26]
  - - [31104, 31104, 1, 384]
    - [12, 5042.35]
  - - [36608, 36608, 1, 256]
    - [9, 4943.46]
  - - [39808, 128, 1, 256]
    - [37, 4481.34]
  - - [13824, 13824, 1, 384]
    - [14, 4995.07]
  - - [42624, 42624, 1, 384]
    - [12, 5050.28]
  - - [21120, 21120, 1, 384]
    - [12, 5030.83]
  - - [23296, 23296, 1, 256]
    - [9, 4939.59]
  - - [42240, 42240, 1, 256]
    - [9, 4947.45]
  - - [33408, 128, 1, 384]
    - [35, 4605.83]
  - - [43648, 128, 1, 256]
    - [37, 4512.42]
  - - [19328, 128, 1, 384]
    - [37, 4341.12]
  - - [33792, 33792, 1, 256]
    - [9, 4920.25]
  - - [31488, 31488, 1, 256]
    - [8, 4951.46]
  - - [1408, 128, 1, 128]
    - [37, 1624.55]
  - - [768, 3072, 1, 384]
    - [4, 4699.02]
  - - [6144, 6144, 1, 256]
    - [14, 4845.6]
  - - [20352, 20352, 1, 384]
    - [9, 5031.88]
  - - [23168, 128, 1, 384]
    - [34, 4385.22]
  - - [33536, 33536, 1, 256]
    - [8, 4934.85]
  - - [32640, 32640, 1, 384]
    - [12, 5043.9]
  - - [20608, 128, 1, 128]
    - [37, 3822.93]
  - - [10368, 10368, 1, 384]
    - [9, 5013.29]
  - - [34688, 128, 1, 128]
    - [38, 4159.31]
  - - [1536, 3072, 1, 384]
    - [14, 4745.29]
  - - [19328, 128, 1, 256]
    - [37, 4208.8]
  - - [2688, 3072, 1, 384]
    - [14, 4823.1]
  - - [24192, 24192, 1, 384]
    - [12, 5032.98]
  - - [6912, 6912, 1, 256]
    - [9, 4879.98]
  - - [28288, 128, 1, 128]
    - [38, 4052.73]
  - - [15360, 15360, 1, 256]
    - [9, 4908.22]
  - - [18944, 18944, 1, 256]
    - [14, 4911.54]
  - - [37376, 37376, 1, 256]
    - [12, 4913.61]
  - - [31488, 31488, 1, 384]
    - [12, 5043.19]
  - - [26880, 26880, 1, 256]
    - [9, 4947.07]
  - - [44928, 128, 1, 128]
    - [38, 4272.7]
  - - [24448, 128, 1, 256]
    - [37, 4426.03]
  - - [31872, 31872, 1, 384]
    - [12, 5041.26]
  - - [1408, 128, 1, 256]
    - [37, 1909.66]
  - - [38528, 128, 1, 384]
    - [37, 4629.24]
  - - [15488, 128, 1, 128]
    - [37, 3662.75]
  - - [15616, 15616, 1, 256]
    - [9, 4934.91]
  - - [39552, 39552, 1, 384]
    - [12, 5044.38]
  - - [4352, 4352, 1, 256]
    - [9, 4789.61]
  - - [28288, 128, 1, 384]
    - [37, 4562.32]
  - - [10368, 128, 1, 256]
    - [38, 3639.02]
  - - [32128, 128, 1, 256]
    - [37, 4456.36]
  - - [12288, 12288, 1, 384]
    - [14, 4999.49]
  - - [4608, 4608, 1, 4608]
    - [17, 5198.68]
  - - [5760, 5760, 1, 384]
    - [9, 4959.13]
  - - [8704, 8704, 1, 256]
    - [14, 4860.28]
  - - [17664, 17664, 1, 256]
    - [9, 4947.44]
  - - [6528, 128, 1, 128]
    - [33, 2872.04]
  - - [24576, 24576, 1, 384]
    - [12, 5023.03]
  - - [37248, 128, 1, 384]
    - [37, 4520.08]
  - - [34304, 34304, 1, 256]
    - [10, 4909.95]
  - - [14208, 128, 1, 128]
    - [38, 3718.59]
  - - [39808, 128, 1, 128]
    - [37, 4160.59]
  - - [42368, 128, 1, 384]
    - [35, 4629.78]
  - - [17664, 17664, 1, 384]
    - [9, 5030.74]
  - - [12800, 12800, 1, 256]
    - [14, 4888.6]
  - - [2304, 2304, 1, 384]
    - [5, 4626.5]
  - - [26624, 26624, 1, 256]
    - [14, 4915.5]
  - - [36864, 36864, 1, 256]
    - [12, 4910.35]
  - - [40704, 40704, 1, 256]
    - [9, 4938.45]
  - - [12032, 12032, 1, 256]
    - [9, 4919.1]
  - - [33024, 33024, 1, 384]
    - [12, 5042.28]
  - - [28800, 28800, 1, 384]
    - [9, 5039.88]
  - - [14208, 128, 1, 384]
    - [37, 4433.42]
  - - [22656, 22656, 1, 384]
    - [9, 5035.91]
  - - [41472, 41472, 1, 384]
    - [10, 5031.66]
  - - [39680, 39680, 1, 256]
    - [9, 4943.75]
  - - [44032, 44032, 1, 256]
    - [12, 4914.17]
  - - [43392, 43392, 1, 384]
    - [12, 5048.33]
  - - [42240, 42240, 1, 384]
    - [12, 5046.69]
  - - [38912, 38912, 1, 256]
    - [14, 4920.17]
  - - [23040, 23040, 1, 384]
    - [12, 5020.32]
  - - [13312, 13312, 1, 256]
    - [14, 4891.4]
  - - [128, 128, 1, 384]
    - [39, 209.995]
  - - [11136, 11136, 1, 384]
    - [14, 5012.59]
  - - [39168, 39168, 1, 256]
    - [9, 4949.46]
  - - [25344, 25344, 1, 384]
    - [9, 5040.0]
  - - [5248, 128, 1, 256]
    - [32, 3506.66]
  - - [30208, 30208, 1, 256]
    - [14, 4913.31]
  - - [40192, 40192, 1, 256]
    - [9, 4951.49]
  - - [15872, 15872, 1, 256]
    - [14, 4908.5]
  - - [44544, 44544, 1, 256]
    - [14, 4925.67]
  - - [11520, 11520, 1, 256]
    - [9, 4927.86]
  - - [15360, 15360, 1, 384]
    - [14, 5006.79]
  - - [23040, 23040, 1, 256]
    - [9, 4921.45]
  - - [26496, 26496, 1, 384]
    - [12, 5038.29]
  - - [11264, 11264, 1, 256]
    - [14, 4882.79]
  - - [18048, 128, 1, 384]
    - [34, 4501.2]
  - - [30976, 30976, 1, 256]
    - [8, 4933.07]
  - - [11648, 128, 1, 384]
    - [31, 4249.73]
  - - [2304, 3072, 1, 384]
    - [5, 4820.36]
  - - [6144, 6144, 1, 384]
    - [14, 4942.89]
  - - [28928, 28928, 1, 256]
    - [14, 4937.18]
  - - [11520, 11520, 1, 384]
    - [14, 5020.03]
  - - [43008, 43008, 1, 256]
    - [9, 4926.27]
  - - [3072, 3072, 1, 384]
    - [14, 4831.58]
  - - [29440, 29440, 1, 256]
    - [9, 4941.34]
  - - [36352, 36352, 1, 256]
    - [9, 4907.78]
  - - [32256, 32256, 1, 384]
    - [12, 5028.89]
  - - [23808, 23808, 1, 384]
    - [12, 5036.49]
  - - [9984, 9984, 1, 384]
    - [9, 5008.45]
  - - [37248, 128, 1, 256]
    - [37, 4453.89]
  - - [1, 1, 1, 64]
    - [1, 0.00647773]
  - - [6528, 6528, 1, 384]
    - [9, 4987.46]
  - - [7296, 7296, 1, 384]
    - [9, 4993.92]
  - - [37888, 37888, 1, 256]
    - [10, 4912.3]
  - - [35968, 128, 1, 256]
    - [37, 4465.07]
  - - [13824, 13824, 1, 256]
    - [14, 4909.04]
  - - [39168, 39168, 1, 384]
    - [12, 5040.56]
  - - [2688, 128, 1, 128]
    - [37, 2293.76]
  - - [37632, 37632, 1, 384]
    - [12, 5042.41]
  - - [29568, 128, 1, 256]
    - [37, 4399.23]
  - - [42368, 128, 1, 128]
    - [38, 4214.17]
  - - [14336, 14336, 1, 256]
    - [14, 4896.25]
  - - [8064, 8064, 1, 384]
    - [9, 5003.24]
  - - [28288, 128, 1, 256]
    - [37, 4432.59]
  - - [16512, 16512, 1, 384]
    - [9, 5032.46]
  - - [30720, 30720, 1, 384]
    - [12, 5032.58]
  - - [21888, 128, 1, 128]
    - [38, 3897.97]
  - - [21248, 21248, 1, 256]
    - [9, 4944.88]
  - - [12928, 128, 1, 128]
    - [38, 3495.25]
  - - [29696, 29696, 1, 256]
    - [14, 4913.27]
  - - [384, 3072, 1, 384]
    - [5, 4524.43]
  - - [28672, 28672, 1, 256]
    - [9, 4908.07]
  - - [32512, 32512, 1, 256]
    - [9, 4930.53]
  - - [2688, 2688, 1, 384]
    - [9, 4703.56]
  - - [9216, 9216, 1, 256]
    - [14, 4886.08]
  - - [6656, 6656, 1, 256]
    - [14, 4834.44]
  - - [6528, 128, 1, 384]
    - [30, 3598.75]
  - - [33408, 128, 1, 128]
    - [37, 4076.23]
  - - [30336, 30336, 1, 384]
    - [9, 5043.1]
  - - [16768, 128, 1, 128]
    - [37, 3704.52]
  - - [13440, 13440, 1, 384]
    - [9, 5026.95]
  - - [20608, 128, 1, 256]
    - [37, 4181.84]
  - - [4992, 4992, 1, 384]
    - [9, 4934.36]
  - - [7936, 7936, 1, 256]
    - [9, 4884.07]
  - - [41856, 41856, 1, 384]
    - [12, 5048.24]
  - - [44288, 44288, 1, 256]
    - [9, 4953.6]
  - - [7744, 7744, 1, 7744]
    - [15, 5184.91]
  - - [7424, 7424, 1, 256]
    - [9, 4881.42]
  - - [39424, 39424, 1, 256]
    - [10, 4913.75]
  - - [43648, 128, 1, 384]
    - [37, 4586.9]
  - - [14208, 14208, 1, 384]
    - [9, 5027.29]
  - - [36096, 36096, 1, 384]
    - [12, 5035.57]
  - - [44544, 44544, 1, 384]
    - [12, 5036.22]
  - - [22528, 22528, 1, 256]
    - [14, 4904.7]
  - - [4096, 4096, 1, 256]
    - [9, 4699.5]
  - - [4608, 4608, 1, 384]
    - [14, 4895.84]
  - - [7808, 128, 1, 128]
    - [38, 3297.07]
  - - [5248, 128, 1, 128]
    - [38, 2977.26]
  - - [9088, 128, 1, 128]
    - [35, 3396.39]
  - - [31744, 31744, 1, 256]
    - [14, 4909.71]
  - - [3968, 128, 1, 384]
    - [37, 3970.58]
  - - [17920, 17920, 1, 256]
    - [14, 4908.84]
  - - [5248, 128, 1, 384]
    - [32, 3773.4]
  - - [26880, 26880, 1, 384]
    - [12, 5036.35]
  - - [8192, 8192, 1, 256]
    - [14, 4865.66]
  - - [3968, 128, 1, 256]
    - [37, 3640.07]
  - - [41088, 128, 1, 256]
    - [37, 4463.51]
  - - [21888, 128, 1, 384]
    - [37, 4457.4]
  - - [16768, 128, 1, 256]
    - [37, 4102.86]
  - - [24064, 24064, 1, 256]
    - [14, 4908.54]
  - - [44928, 128, 1, 256]
    - [37, 4557.33]
  - - [9600, 9600, 1, 384]
    - [9, 5008.75]
  - - [27648, 27648, 1, 384]
    - [10, 5021.65]
  - - [24832, 24832, 1, 256]
    - [9, 4935.41]
  - - [8448, 8448, 1, 384]
    - [9, 4999.3]
  - - [128, 128, 1, 128]
    - [36, 153.75]
  - - [10240, 10240, 1, 256]
    - [14, 4871.33]
  - - [40320, 40320, 1, 384]
    - [12, 5041.89]
  - - [18048, 3072, 1, 384]
    - [53, 4976.0]
  - - [2304, 1153, 1, 384]
    - [73, 4220.18]
  - - [18432, 2688, 1, 384]
    - [54, 4980.46]
  - - [3840, 2304, 1, 384]
    - [53, 4762.52]
  - - [41856, 384, 1, 384]
    - [53, 4914.42]
  - - [30720, 1152, 1, 384]
    - [53, 4975.45]
  - - [43008, 2304, 1, 384]
    - [58, 5000.2]
  - - [26496, 768, 1, 384]
    - [53, 4924.0]
  - - [43776, 3072, 1, 384]
    - [54, 5014.4]
  - - [30336, 1536, 1, 384]
    - [58, 4974.95]
  - - [38400, 384, 1, 384]
    - [54, 4880.8]
  - - [28800, 384, 1, 384]
    - [53, 4796.4]
  - - [3840, 3072, 1, 384]
    - [54, 4825.56]
  - - [44160, 3072, 1, 384]
    - [54, 5014.27]
  - - [41472, 1153, 1, 384]
    - [54, 4774.86]
  - - [33408, 1920, 1, 384]
    - [54, 4993.44]
  - - [6912, 384, 1, 384]
    - [85, 4285.3]
  - - [21504, 1153, 1, 384]
    - [54, 4755.34]
  - - [24576, 1920, 1, 384]
    - [54, 4996.19]
  - - [23040, 3072, 1, 384]
    - [54, 4993.0]
  - - [28032, 1152, 1, 384]
    - [54, 4958.04]
  - - [35328, 1153, 1, 384]
    - [54, 4764.12]
  - - [33792, 2688, 1, 384]
    - [54, 5010.32]
  - - [8448, 768, 1, 384]
    - [54, 4666.98]
  - - [8064, 2688, 1, 384]
    - [54, 4918.57]
  - - [33408, 2304, 1, 384]
    - [54, 5005.26]
  - - [31872, 1536, 1, 384]
    - [53, 4961.7]
  - - [41088, 1920, 1, 384]
    - [54, 5004.32]
  - - [17280, 3072, 1, 384]
    - [58, 4974.84]
  - - [37632, 3072, 1, 384]
    - [54, 5005.85]
  - - [38016, 1153, 1, 384]
    - [54, 4766.18]
  - - [32640, 1152, 1, 384]
    - [54, 4988.29]
  - - [27264, 1153, 1, 384]
    - [54, 4754.61]
  - - [30336, 1153, 1, 384]
    - [54, 4774.67]
  - - [18048, 384, 1, 384]
    - [58, 4745.86]
  - - [26496, 3072, 1, 384]
    - [53, 4995.1]
  - - [41088, 2304, 1, 384]
    - [54, 5013.44]
  - - [3840, 1153, 1, 384]
    - [54, 4480.73]
  - - [16128, 2304, 1, 384]
    - [54, 4975.6]
  - - [5376, 1536, 1, 384]
    - [59, 4759.68]
  - - [39552, 3072, 1, 384]
    - [54, 5007.73]
  - - [23808, 3072, 1, 384]
    - [54, 4987.65]
  - - [24192, 1153, 1, 384]
    - [54, 4749.07]
  - - [16128, 1536, 1, 384]
    - [58, 4921.2]
  - - [5760, 1536, 1, 384]
    - [58, 4746.55]
  - - [36480, 2688, 1, 384]
    - [54, 5016.76]
  - - [21504, 1152, 1, 384]
    - [54, 4942.78]
  - - [38400, 1153, 1, 384]
    - [54, 4772.96]
  - - [39168, 1153, 1, 384]
    - [54, 4772.76]
  - - [21888, 1153, 1, 384]
    - [53, 4731.82]
  - - [19968, 1152, 1, 384]
    - [54, 4935.19]
  - - [28416, 2304, 1, 384]
    - [58, 4999.62]
  - - [26880, 768, 1, 384]
    - [54, 4925.95]
  - - [15360, 768, 1, 384]
    - [54, 4830.5]
  - - [42624, 768, 1, 384]
    - [58, 4943.89]
  - - [13056, 3072, 1, 384]
    - [57, 4961.56]
  - - [43008, 1920, 1, 384]
    - [54, 5006.56]
  - - [34944, 384, 1, 384]
    - [53, 4833.68]
  - - [19584, 384, 1, 384]
    - [53, 4684.91]
  - - [44160, 2688, 1, 384]
    - [54, 5024.47]
  - - [4992, 1536, 1, 384]
    - [58, 4711.65]
  - - [39168, 768, 1, 384]
    - [54, 4956.79]
  - - [16896, 1153, 1, 384]
    - [53, 4720.07]
  - - [6144, 1536, 1, 384]
    - [57, 4824.64]
  - - [26112, 1152, 1, 384]
    - [54, 4963.44]
  - - [1152, 384, 1, 384]
    - [68, 3538.94]
  - - [19968, 384, 1, 384]
    - [58, 4706.83]
  - - [43392, 1153, 1, 384]
    - [54, 4786.79]
  - - [29952, 1536, 1, 384]
    - [58, 4975.05]
  - - [17280, 1153, 1, 384]
    - [54, 4721.29]
  - - [10752, 2688, 1, 384]
    - [53, 4940.06]
  - - [33408, 1153, 1, 384]
    - [54, 4753.16]
  - - [42240, 2688, 1, 384]
    - [54, 5027.28]
  - - [36096, 1536, 1, 384]
    - [58, 4974.18]
  - - [1920, 384, 1, 384]
    - [46, 4086.56]
  - - [22272, 2304, 1, 384]
    - [54, 4978.49]
  - - [26496, 1536, 1, 384]
    - [54, 4967.0]
  - - [1536, 384, 1, 384]
    - [78, 3471.68]
  - - [42624, 2688, 1, 384]
    - [54, 5020.72]
  - - [29184, 3072, 1, 384]
    - [54, 5004.92]
  - - [9600, 1920, 1, 384]
    - [54, 4925.74]
  - - [27264, 3072, 1, 384]
    - [54, 5002.82]
  - - [7680, 1152, 1, 384]
    - [54, 4770.81]
  - - [24960, 1153, 1, 384]
    - [54, 4733.13]
  - - [18048, 1536, 1, 384]
    - [54, 4931.32]
  - - [17664, 1153, 1, 384]
    - [54, 4729.77]
  - - [20352, 1153, 1, 384]
    - [54, 4719.82]
  - - [29184, 1152, 1, 384]
    - [53, 4975.13]
  - - [17664, 2688, 1, 384]
    - [54, 4998.2]
  - - [15360, 1920, 1, 384]
    - [54, 4944.65]
  - - [3840, 384, 1, 384]
    - [46, 4211.78]
  - - [18816, 1920, 1, 384]
    - [54, 4976.13]
  - - [33024, 768, 1, 384]
    - [58, 4938.33]
  - - [40704, 1153, 1, 384]
    - [54, 4789.41]
  - - [21888, 1920, 1, 384]
    - [54, 4986.65]
  - - [18816, 3072, 1, 384]
    - [58, 4990.17]
  - - [37248, 1536, 1, 384]
    - [54, 4991.0]
  - - [34176, 2304, 1, 384]
    - [54, 5004.96]
  - - [16896, 2304, 1, 384]
    - [54, 4983.23]
  - - [40320, 3072, 1, 384]
    - [54, 5007.94]
  - - [32640, 1153, 1, 384]
    - [54, 4772.66]
  - - [6144, 1920, 1, 384]
    - [54, 4888.89]
  - - [14208, 1152, 1, 384]
    - [54, 4904.31]
  - - [8832, 1153, 1, 384]
    - [54, 4648.8]
  - - [22272, 1920, 1, 384]
    - [54, 4983.64]
  - - [32640, 3072, 1, 384]
    - [54, 5010.56]
  - - [33408, 1536, 1, 384]
    - [58, 4967.79]
  - - [5760, 3072, 1, 384]
    - [58, 4891.71]
  - - [27648, 3072, 1, 384]
    - [54, 4993.37]
  - - [17280, 384, 1, 384]
    - [53, 4769.11]
  - - [26880, 2688, 1, 384]
    - [54, 5005.72]
  - - [36864, 1153, 1, 384]
    - [54, 4769.78]
  - - [36864, 1920, 1, 384]
    - [54, 4992.34]
  - - [41088, 384, 1, 384]
    - [54, 4865.78]
  - - [4224, 1152, 1, 384]
    - [79, 4568.62]
  - - [12288, 1153, 1, 384]
    - [54, 4669.03]
  - - [384, 768, 1, 384]
    - [63, 2496.61]
  - - [27648, 1920, 1, 384]
    - [54, 5001.99]
  - - [5760, 1152, 1, 384]
    - [54, 4760.91]
  - - [33792, 1536, 1, 384]
    - [58, 4977.76]
  - - [40704, 2688, 1, 384]
    - [54, 5015.99]
  - - [37632, 2304, 1, 384]
    - [54, 5005.92]
  - - [24192, 1152, 1, 384]
    - [54, 4961.05]
  - - [42240, 3072, 1, 384]
    - [58, 5004.17]
  - - [16896, 1920, 1, 384]
    - [54, 4970.43]
  - - [18048, 1153, 1, 384]
    - [54, 4715.89]
  - - [32640, 2304, 1, 384]
    - [58, 5006.2]
  - - [13824, 384, 1, 384]
    - [54, 4631.54]
  - - [36096, 1152, 1, 384]
    - [54, 4988.85]
  - - [15744, 1920, 1, 384]
    - [54, 4952.28]
  - - [5760, 2304, 1, 384]
    - [58, 4873.84]
  - - [33408, 1152, 1, 384]
    - [54, 4965.87]
  - - [11904, 2304, 1, 384]
    - [58, 4939.36]
  - - [24576, 2304, 1, 384]
    - [58, 4975.94]
  - - [33024, 1536, 1, 384]
    - [54, 4974.96]
  - - [6528, 1152, 1, 384]
    - [53, 4680.05]
  - - [20736, 768, 1, 384]
    - [54, 4876.63]
  - - [37632, 1152, 1, 384]
    - [54, 4981.09]
  - - [12288, 1920, 1, 384]
    - [54, 4936.31]
  - - [36096, 2304, 1, 384]
    - [58, 5006.12]
  - - [6912, 1153, 1, 384]
    - [54, 4503.36]
  - - [13056, 2688, 1, 384]
    - [54, 4973.1]
  - - [20352, 2688, 1, 384]
    - [54, 4981.59]
  - - [14592, 2304, 1, 384]
    - [58, 4967.32]
  - - [16128, 1920, 1, 384]
    - [54, 4969.52]
  - - [9216, 1536, 1, 384]
    - [57, 4874.83]
  - - [16512, 1920, 1, 384]
    - [54, 4965.73]
  - - [35712, 1920, 1, 384]
    - [54, 5002.04]
  - - [9216, 2688, 1, 384]
    - [58, 4938.47]
  - - [16128, 2688, 1, 384]
    - [54, 4982.4]
  - - [19200, 3072, 1, 384]
    - [58, 4984.78]
  - - [23808, 2688, 1, 384]
    - [54, 4995.49]
  - - [18048, 768, 1, 384]
    - [58, 4844.52]
  - - [14592, 2688, 1, 384]
    - [54, 4985.88]
  - - [15360, 1152, 1, 384]
    - [54, 4899.89]
  - - [40320, 1152, 1, 384]
    - [54, 4980.48]
  - - [25344, 2688, 1, 384]
    - [54, 5000.78]
  - - [43008, 1152, 1, 384]
    - [54, 4980.46]
  - - [19200, 1152, 1, 384]
    - [54, 4923.07]
  - - [19584, 1152, 1, 384]
    - [53, 4918.1]
  - - [14208, 1920, 1, 384]
    - [54, 4945.28]
  - - [5376, 1152, 1, 384]
    - [54, 4716.35]
  - - [14976, 2688, 1, 384]
    - [54, 4967.39]
  - - [36480, 1152, 1, 384]
    - [54, 4981.47]
  - - [39936, 1920, 1, 384]
    - [54, 5004.42]
  - - [11136, 1152, 1, 384]
    - [54, 4862.99]
  - - [17280, 2304, 1, 384]
    - [58, 4970.17]
  - - [11520, 2304, 1, 384]
    - [54, 4938.06]
  - - [19968, 3072, 1, 384]
    - [58, 4982.79]
  - - [25344, 384, 1, 384]
    - [53, 4805.23]
  - - [19968, 1153, 1, 384]
    - [54, 4742.25]
  - - [26496, 1152, 1, 384]
    - [54, 4962.9]
  - - [18432, 768, 1, 384]
    - [53, 4868.36]
  - - [4608, 768, 1, 384]
    - [58, 4714.67]
  - - [34944, 1920, 1, 384]
    - [54, 5010.1]
  - - [13824, 2688, 1, 384]
    - [54, 4966.11]
  - - [8832, 3072, 1, 384]
    - [58, 4924.87]
  - - [39936, 2304, 1, 384]
    - [58, 4990.91]
  - - [16896, 3072, 1, 384]
    - [54, 4980.59]
  - - [7680, 2688, 1, 384]
    - [53, 4910.94]
  - - [19968, 2304, 1, 384]
    - [54, 4971.64]
  - - [27648, 2688, 1, 384]
    - [54, 5009.45]
  - - [4224, 768, 1, 384]
    - [79, 4421.17]
  - - [35328, 3072, 1, 384]
    - [54, 5004.8]
  - - [11520, 3072, 1, 384]
    - [54, 4953.11]
  - - [24192, 1920, 1, 384]
    - [54, 4988.39]
  - - [32640, 1920, 1, 384]
    - [53, 4990.67]
  - - [4992, 3072, 1, 384]
    - [58, 4872.74]
  - - [12672, 384, 1, 384]
    - [79, 4565.94]
  - - [34176, 2688, 1, 384]
    - [54, 5015.98]
  - - [35328, 1536, 1, 384]
    - [54, 4982.95]
  - - [20736, 1153, 1, 384]
    - [54, 4733.01]
  - - [3072, 1152, 1, 384]
    - [43, 4733.06]
  - - [20352, 3072, 1, 384]
    - [53, 4988.2]
  - - [26880, 1152, 1, 384]
    - [54, 4973.01]
  - - [8832, 2688, 1, 384]
    - [54, 4934.14]
  - - [18048, 1920, 1, 384]
    - [54, 4960.5]
  - - [31488, 768, 1, 384]
    - [58, 4934.42]
  - - [21504, 2304, 1, 384]
    - [54, 4970.73]
  - - [30720, 3072, 1, 384]
    - [54, 5006.94]
  - - [13440, 2688, 1, 384]
    - [53, 4976.92]
  - - [11136, 2688, 1, 384]
    - [54, 4947.1]
  - - [38784, 1153, 1, 384]
    - [54, 4766.9]
  - - [33024, 3072, 1, 384]
    - [58, 4997.81]
  - - [34944, 3072, 1, 384]
    - [54, 5008.65]
  - - [39552, 384, 1, 384]
    - [54, 4886.05]
  - - [31872, 1152, 1, 384]
    - [54, 4970.23]
  - - [768, 1152, 1, 384]
    - [50, 3812.15]
  - - [29184, 2688, 1, 384]
    - [54, 5006.03]
  - - [10752, 3072, 1, 384]
    - [58, 4946.18]
  - - [20352, 768, 1, 384]
    - [54, 4891.01]
  - - [4608, 2688, 1, 384]
    - [54, 4839.98]
  - - [36480, 1153, 1, 384]
    - [54, 4772.03]
  - - [7296, 1153, 1, 384]
    - [77, 4534.67]
  - - [21504, 2688, 1, 384]
    - [54, 5001.68]
  - - [34176, 768, 1, 384]
    - [54, 4961.76]
  - - [29568, 384, 1, 384]
    - [53, 4853.05]
  - - [3072, 1920, 1, 384]
    - [53, 4785.6]
  - - [21504, 1920, 1, 384]
    - [54, 4976.17]
  - - [23808, 1536, 1, 384]
    - [54, 4947.9]
  - - [15360, 1153, 1, 384]
    - [53, 4713.52]
  - - [30336, 3072, 1, 384]
    - [54, 5009.94]
  - - [26112, 3072, 1, 384]
    - [54, 4991.86]
  - - [8832, 1536, 1, 384]
    - [58, 4830.43]
  - - [11136, 1153, 1, 384]
    - [54, 4655.27]
  - - [43392, 1536, 1, 384]
    - [54, 4985.09]
  - - [42240, 384, 1, 384]
    - [53, 4864.07]
  - - [28800, 2688, 1, 384]
    - [54, 5002.11]
  - - [31488, 2688, 1, 384]
    - [54, 5003.77]
  - - [10368, 3072, 1, 384]
    - [58, 4939.74]
  - - [12672, 1920, 1, 384]
    - [54, 4953.88]
  - - [30720, 1536, 1, 384]
    - [58, 4974.52]
  - - [8064, 3072, 1, 384]
    - [53, 4916.83]
  - - [23424, 1153, 1, 384]
    - [54, 4739.18]
  - - [17280, 1152, 1, 384]
    - [54, 4912.42]
  - - [13824, 768, 1, 384]
    - [58, 4838.66]
  - - [9216, 1152, 1, 384]
    - [54, 4884.81]
  - - [6528, 1920, 1, 384]
    - [54, 4877.74]
  - - [28800, 3072, 1, 384]
    - [54, 5003.78]
  - - [10752, 384, 1, 384]
    - [79, 4575.87]
  - - [38016, 1536, 1, 384]
    - [58, 4975.98]
  - - [39552, 1152, 1, 384]
    - [54, 4977.34]
  - - [22272, 1153, 1, 384]
    - [54, 4743.23]
  - - [25344, 2304, 1, 384]
    - [58, 4997.0]
  - - [14592, 3072, 1, 384]
    - [58, 4964.13]
  - - [28032, 1920, 1, 384]
    - [54, 4998.51]
  - - [20736, 2688, 1, 384]
    - [54, 4999.38]
  - - [15744, 1536, 1, 384]
    - [54, 4925.53]
  - - [25728, 1152, 1, 384]
    - [54, 4961.4]
  - - [16512, 1536, 1, 384]
    - [58, 4916.69]
  - - [3072, 2304, 1, 384]
    - [57, 4795.53]
  - - [5760, 2688, 1, 384]
    - [53, 4885.8]
  - - [37248, 1153, 1, 384]
    - [54, 4778.69]
  - - [10368, 1153, 1, 384]
    - [54, 4650.73]
  - - [36864, 3072, 1, 384]
    - [54, 5011.29]
  - - [23040, 1152, 1, 384]
    - [54, 4941.03]
  - - [31872, 384, 1, 384]
    - [53, 4808.58]
  - - [9600, 3072, 1, 384]
    - [58, 4926.41]
  - - [10368, 1152, 1, 384]
    - [54, 4833.77]
  - - [36096, 3072, 1, 384]
    - [58, 4998.24]
  - - [24576, 1536, 1, 384]
    - [54, 4959.6]
  - - [31104, 2304, 1, 384]
    - [58, 5000.88]
  - - [2688, 1153, 1, 384]
    - [82, 4198.25]
  - - [38400, 2304, 1, 384]
    - [54, 5006.02]
  - - [32256, 384, 1, 384]
    - [54, 4850.44]
  - - [38016, 1152, 1, 384]
    - [54, 4980.77]
  - - [20352, 384, 1, 384]
    - [54, 4783.58]
  - - [15360, 2688, 1, 384]
    - [54, 4972.49]
  - - [10752, 1153, 1, 384]
    - [54, 4652.71]
  - - [29952, 2688, 1, 384]
    - [54, 4996.93]
  - - [7680, 384, 1, 384]
    - [57, 4390.07]
  - - [43008, 2688, 1, 384]
    - [54, 5016.71]
  - - [13440, 1920, 1, 384]
    - [54, 4949.38]
  - - [4992, 1152, 1, 384]
    - [58, 4706.52]
  - - [9984, 2304, 1, 384]
    - [58, 4929.36]
  - - [6528, 2688, 1, 384]
    - [54, 4895.06]
  - - [38016, 2688, 1, 384]
    - [54, 5022.4]
  - - [4608, 1152, 1, 384]
    - [54, 4639.97]
  - - [9600, 2304, 1, 384]
    - [58, 4915.54]
  - - [32640, 384, 1, 384]
    - [54, 4866.3]
  - - [7680, 3072, 1, 384]
    - [57, 4903.82]
  - - [2304, 1536, 1, 384]
    - [44, 4756.25]
  - - [40320, 1536, 1, 384]
    - [58, 4970.14]
  - - [13440, 1536, 1, 384]
    - [58, 4898.8]
  - - [18432, 1152, 1, 384]
    - [54, 4919.24]
  - - [40320, 2688, 1, 384]
    - [58, 5011.34]
  - - [30336, 2304, 1, 384]
    - [54, 5007.68]
  - - [24192, 2688, 1, 384]
    - [54, 4999.28]
  - - [16896, 1152, 1, 384]
    - [54, 4903.98]
  - - [38016, 3072, 1, 384]
    - [54, 5009.48]
  - - [43392, 2304, 1, 384]
    - [54, 5010.45]
  - - [13440, 1152, 1, 384]
    - [54, 4881.78]
  - - [1152, 769, 1, 384]
    - [45, 3758.09]
  - - [36096, 1153, 1, 384]
    - [54, 4767.94]
  - - [33792, 1920, 1, 384]
    - [54, 4995.58]
  - - [11520, 1153, 1, 384]
    - [54, 4618.18]
  - - [12288, 3072, 1, 384]
    - [58, 4967.49]
  - - [28416, 3072, 1, 384]
    - [58, 5006.26]
  - - [35328, 768, 1, 384]
    - [58, 4919.38]
  - - [22656, 2688, 1, 384]
    - [54, 5003.16]
  - - [25728, 2688, 1, 384]
    - [54, 5012.43]
  - - [23040, 768, 1, 384]
    - [58, 4897.63]
  - - [29952, 2304, 1, 384]
    - [54, 5000.57]
  - - [33024, 1920, 1, 384]
    - [54, 4997.81]
  - - [14976, 768, 1, 384]
    - [53, 4802.12]
  - - [42624, 1920, 1, 384]
    - [53, 5006.57]
  - - [32640, 2688, 1, 384]
    - [57, 4994.42]
  - - [33408, 384, 1, 384]
    - [54, 4866.26]
  - - [11520, 1536, 1, 384]
    - [58, 4894.24]
  - - [6912, 768, 1, 384]
    - [58, 4617.69]
  - - [28032, 3072, 1, 384]
    - [54, 5002.38]
  - - [39552, 1920, 1, 384]
    - [54, 5009.09]
  - - [11904, 384, 1, 384]
    - [54, 4660.46]
  - - [32256, 1920, 1, 384]
    - [58, 4980.59]
  - - [15360, 384, 1, 384]
    - [54, 4791.67]
  - - [42240, 1153, 1, 384]
    - [54, 4788.17]
  - - [10752, 1536, 1, 384]
    - [57, 4875.9]
  - - [16128, 1152, 1, 384]
    - [54, 4890.27]
  - - [6144, 1153, 1, 384]
    - [53, 4553.82]
  - - [24576, 2688, 1, 384]
    - [54, 5004.88]
  - - [12672, 2688, 1, 384]
    - [54, 4970.04]
  - - [5376, 768, 1, 384]
    - [82, 4567.96]
  - - [10752, 1920, 1, 384]
    - [54, 4908.99]
  - - [40704, 1536, 1, 384]
    - [58, 4983.48]
  - - [8832, 1152, 1, 384]
    - [54, 4844.5]
  - - [32256, 768, 1, 384]
    - [57, 4924.26]
  - - [11904, 1536, 1, 384]
    - [58, 4884.56]
  - - [35712, 1153, 1, 384]
    - [54, 4767.69]
  - - [32256, 1153, 1, 384]
    - [53, 4756.29]
  - - [18432, 1536, 1, 384]
    - [58, 4925.89]
  - - [34560, 3072, 1, 384]
    - [58, 4992.31]
  - - [18816, 2688, 1, 384]
    - [58, 4980.44]
  - - [28800, 1152, 1, 384]
    - [54, 4967.33]
  - - [28416, 1153, 1, 384]
    - [53, 4746.99]
  - - [26112, 1153, 1, 384]
    - [54, 4768.9]
  - - [11520, 2688, 1, 384]
    - [54, 4968.93]
  - - [19584, 3072, 1, 384]
    - [54, 4990.07]
  - - [28416, 384, 1, 384]
    - [54, 4851.91]
  - - [24960, 1152, 1, 384]
    - [53, 4941.95]
  - - [8448, 3072, 1, 384]
    - [58, 4934.77]
  - - [25344, 1153, 1, 384]
    - [54, 4737.68]
  - - [22272, 2688, 1, 384]
    - [54, 4997.56]
  - - [24960, 2304, 1, 384]
    - [53, 4978.18]
  - - [11520, 768, 1, 384]
    - [58, 4755.58]
  - - [35712, 2688, 1, 384]
    - [54, 5015.3]
  - - [23424, 1152, 1, 384]
    - [54, 4958.67]
  - - [24960, 3072, 1, 384]
    - [58, 4993.05]
  - - [29952, 1920, 1, 384]
    - [54, 5008.35]
  - - [30720, 384, 1, 384]
    - [54, 4814.28]
  - - [13440, 384, 1, 384]
    - [82, 4617.88]
  - - [26880, 1920, 1, 384]
    - [54, 4987.49]
  - - [25728, 3072, 1, 384]
    - [58, 4995.52]
  - - [33408, 2688, 1, 384]
    - [54, 5011.23]
  - - [40704, 3072, 1, 384]
    - [54, 5020.07]
  - - [38400, 1152, 1, 384]
    - [54, 4995.51]
  - - [3840, 1152, 1, 384]
    - [79, 4607.0]
  - - [7680, 1153, 1, 384]
    - [53, 4562.99]
  - - [35328, 2688, 1, 384]
    - [54, 5015.72]
  - - [21120, 1536, 1, 384]
    - [54, 4947.29]
  - - [21120, 2688, 1, 384]
    - [54, 4986.85]
  - - [40320, 1153, 1, 384]
    - [54, 4783.53]
  - - [38784, 1152, 1, 384]
    - [54, 4982.34]
  - - [19584, 1920, 1, 384]
    - [54, 4971.73]
  - - [11904, 1152, 1, 384]
    - [53, 4871.01]
  - - [43392, 1920, 1, 384]
    - [54, 5007.9]
  - - [17664, 1536, 1, 384]
    - [54, 4929.34]
  - - [34176, 1920, 1, 384]
    - [54, 5002.6]
  - - [16512, 2688, 1, 384]
    - [54, 4991.73]
  - - [18816, 2304, 1, 384]
    - [54, 4978.77]
  - - [36864, 768, 1, 384]
    - [58, 4945.52]
  - - [14592, 1536, 1, 384]
    - [57, 4917.67]
  - - [11136, 2304, 1, 384]
    - [54, 4927.99]
  - - [9600, 2688, 1, 384]
    - [54, 4942.66]
  - - [13824, 1153, 1, 384]
    - [54, 4659.56]
  - - [9216, 2304, 1, 384]
    - [58, 4909.87]
  - - [3456, 1920, 1, 384]
    - [54, 4778.06]
  - - [14208, 768, 1, 384]
    - [58, 4833.11]
  - - [38784, 384, 1, 384]
    - [54, 4909.29]
  - - [35712, 768, 1, 384]
    - [53, 4938.25]
  - - [21120, 768, 1, 384]
    - [58, 4857.7]
  - - [4992, 2688, 1, 384]
    - [54, 4838.95]
  - - [16128, 3072, 1, 384]
    - [53, 4973.38]
  - - [41472, 768, 1, 384]
    - [58, 4944.05]
  - - [4992, 1153, 1, 384]
    - [54, 4380.84]
  - - [3072, 1536, 1, 384]
    - [58, 4744.3]
  - - [43392, 3072, 1, 384]
    - [54, 5011.13]
  - - [44160, 1153, 1, 384]
    - [54, 4780.19]
  - - [37632, 1536, 1, 384]
    - [53, 4972.41]
  - - [15744, 1153, 1, 384]
    - [54, 4668.79]
  - - [17664, 768, 1, 384]
    - [54, 4864.53]
  - - [3456, 2304, 1, 384]
    - [58, 4725.6]
  - - [38784, 2304, 1, 384]
    - [54, 5006.74]
  - - [8448, 2688, 1, 384]
    - [54, 4950.25]
  - - [30720, 1153, 1, 384]
    - [54, 4756.85]
  - - [36864, 2304, 1, 384]
    - [54, 4996.22]
  - - [24192, 1536, 1, 384]
    - [58, 4961.97]
  - - [40704, 1920, 1, 384]
    - [54, 5013.97]
  - - [39552, 2688, 1, 384]
    - [54, 5012.93]
  - - [26112, 768, 1, 384]
    - [54, 4898.82]
  - - [31488, 384, 1, 384]
    - [54, 4885.0]
  - - [29184, 1536, 1, 384]
    - [58, 4965.74]
  - - [12288, 1152, 1, 384]
    - [58, 4860.18]
  - - [32640, 1536, 1, 384]
    - [54, 4977.11]
  - - [5376, 2688, 1, 384]
    - [54, 4891.8]
  - - [13056, 768, 1, 384]
    - [58, 4792.36]
  - - [13824, 2304, 1, 384]
    - [58, 4935.43]
  - - [29952, 768, 1, 384]
    - [54, 4924.85]
  - - [1536, 1152, 1, 384]
    - [72, 4337.83]
  - - [28032, 2304, 1, 384]
    - [53, 4997.69]
  - - [16896, 768, 1, 384]
    - [58, 4850.32]
  - - [30336, 1920, 1, 384]
    - [54, 4993.11]
  - - [14976, 384, 1, 384]
    - [82, 4675.04]
  - - [27264, 2304, 1, 384]
    - [54, 4996.78]
  - - [39552, 1153, 1, 384]
    - [54, 4779.56]
  - - [7680, 1536, 1, 384]
    - [57, 4825.15]
  - - [16896, 384, 1, 384]
    - [53, 4689.82]
  - - [30336, 1152, 1, 384]
    - [53, 4968.41]
  - - [30720, 2688, 1, 384]
    - [54, 5003.59]
  - - [37632, 1153, 1, 384]
    - [54, 4761.67]
  - - [1920, 1153, 1, 384]
    - [44, 4410.98]
  - - [36096, 2688, 1, 384]
    - [54, 5005.94]
  - - [5760, 1920, 1, 384]
    - [54, 4789.48]
  - - [39552, 1536, 1, 384]
    - [58, 4980.13]
  - - [40704, 2304, 1, 384]
    - [54, 5007.3]
  - - [9216, 1153, 1, 384]
    - [54, 4581.63]
  - - [25728, 384, 1, 384]
    - [54, 4761.95]
  - - [43776, 2304, 1, 384]
    - [54, 5018.37]
  - - [27648, 1152, 1, 384]
    - [54, 4975.02]
  - - [31488, 1152, 1, 384]
    - [54, 4966.8]
  - - [39168, 1152, 1, 384]
    - [54, 4993.91]
  - - [42240, 1536, 1, 384]
    - [58, 4989.22]
  - - [20352, 1152, 1, 384]
    - [58, 4919.18]
  - - [8448, 1920, 1, 384]
    - [54, 4868.33]
  - - [32256, 1536, 1, 384]
    - [58, 4973.64]
  - - [25344, 1152, 1, 384]
    - [54, 4952.11]
  - - [21888, 2304, 1, 384]
    - [53, 4979.92]
  - - [44160, 2304, 1, 384]
    - [58, 5006.17]
  - - [30336, 2688, 1, 384]
    - [54, 5003.67]
  - - [14208, 3072, 1, 384]
    - [58, 4960.88]
  - - [6144, 2688, 1, 384]
    - [54, 4907.9]
  - - [39168, 1536, 1, 384]
    - [58, 4985.33]
  - - [11904, 1920, 1, 384]
    - [54, 4911.57]
  - - [31104, 1920, 1, 384]
    - [54, 5006.15]
  - - [8064, 1536, 1, 384]
    - [57, 4812.75]
  - - [22272, 1152, 1, 384]
    - [54, 4946.29]
  - - [21120, 1920, 1, 384]
    - [54, 4983.79]
  - - [29952, 1152, 1, 384]
    - [54, 4972.01]
  - - [22656, 2304, 1, 384]
    - [54, 4996.56]
  - - [9600, 1152, 1, 384]
    - [54, 4791.42]
  - - [19968, 2688, 1, 384]
    - [54, 5002.09]
  - - [22656, 3072, 1, 384]
    - [53, 4993.93]
  - - [10752, 768, 1, 384]
    - [57, 4815.48]
  - - [41856, 768, 1, 384]
    - [54, 4963.18]
  - - [19584, 2688, 1, 384]
    - [54, 4996.85]
  - - [16128, 1153, 1, 384]
    - [54, 4690.92]
  - - [2304, 1152, 1, 384]
    - [70, 4291.81]
  - - [23424, 384, 1, 384]
    - [53, 4822.96]
  - - [14592, 768, 1, 384]
    - [58, 4803.5]
  - - [24576, 3072, 1, 384]
    - [53, 4985.87]
  - - [14592, 1152, 1, 384]
    - [54, 4921.5]
  - - [18432, 2304, 1, 384]
    - [58, 4958.54]
  - - [20736, 384, 1, 384]
    - [54, 4704.94]
  - - [9216, 1920, 1, 384]
    - [54, 4935.77]
  - - [31872, 2688, 1, 384]
    - [53, 5014.55]
  - - [41472, 1152, 1, 384]
    - [54, 4987.95]
  - - [14976, 1920, 1, 384]
    - [54, 4957.49]
  - - [13824, 1152, 1, 384]
    - [58, 4870.57]
  - - [33024, 2688, 1, 384]
    - [54, 5014.99]
  - - [43008, 1153, 1, 384]
    - [53, 4774.12]
  - - [1536, 768, 1, 384]
    - [58, 4513.6]
  - - [34176, 1153, 1, 384]
    - [54, 4761.81]
  - - [33024, 2304, 1, 384]
    - [54, 5008.01]
  - - [41856, 1153, 1, 384]
    - [54, 4781.96]
  - - [31488, 1153, 1, 384]
    - [54, 4765.83]
  - - [17280, 768, 1, 384]
    - [54, 4871.78]
  - - [29184, 1153, 1, 384]
    - [54, 4761.81]
  - - [21504, 3072, 1, 384]
    - [54, 4998.14]
  - - [3456, 1153, 1, 384]
    - [43, 4357.92]
  - - [37632, 2688, 1, 384]
    - [54, 5015.73]
  - - [14208, 2688, 1, 384]
    - [54, 4978.95]
  - - [38016, 2304, 1, 384]
    - [54, 5009.7]
  - - [16896, 2688, 1, 384]
    - [54, 4998.03]
  - - [4224, 1153, 1, 384]
    - [53, 4436.77]
  - - [31104, 768, 1, 384]
    - [54, 4937.32]
  - - [41472, 2304, 1, 384]
    - [54, 5011.85]
  - - [10752, 1152, 1, 384]
    - [53, 4835.45]
  - - [9216, 3072, 1, 384]
    - [57, 4928.13]
  - - [23424, 2688, 1, 384]
    - [54, 4997.16]
  - - [18048, 1152, 1, 384]
    - [53, 4933.06]
  - - [39936, 3072, 1, 384]
    - [54, 5007.46]
  - - [22656, 384, 1, 384]
    - [54, 4717.53]
  - - [10368, 2688, 1, 384]
    - [58, 4951.96]
  - - [41472, 384, 1, 384]
    - [54, 4885.2]
  - - [26496, 2688, 1, 384]
    - [54, 5010.88]
  - - [16512, 2304, 1, 384]
    - [54, 4977.77]
  - - [31104, 1153, 1, 384]
    - [54, 4761.88]
  - - [9600, 1153, 1, 384]
    - [54, 4598.23]
  - - [16512, 1153, 1, 384]
    - [54, 4701.43]
  - - [11520, 1920, 1, 384]
    - [54, 4923.98]
  - - [39552, 768, 1, 384]
    - [54, 4946.13]
  - - [5376, 1153, 1, 384]
    - [54, 4471.77]
  - - [26112, 384, 1, 384]
    - [54, 4788.78]
  - - [23808, 1152, 1, 384]
    - [54, 4955.54]
  - - [29568, 3072, 1, 384]
    - [58, 4988.31]
  - - [12672, 2304, 1, 384]
    - [54, 4937.98]
  - - [11136, 768, 1, 384]
    - [54, 4802.78]
  - - [1152, 1152, 1, 384]
    - [65, 3860.67]
  - - [6144, 2304, 1, 384]
    - [53, 4884.29]
  - - [14208, 2304, 1, 384]
    - [54, 4952.69]
  - - [19584, 2304, 1, 384]
    - [54, 4982.82]
  - - [34560, 2688, 1, 384]
    - [54, 5009.37]
  - - [38400, 3072, 1, 384]
    - [54, 5017.18]
  - - [36480, 768, 1, 384]
    - [53, 4934.23]
  - - [15744, 1152, 1, 384]
    - [53, 4883.63]
  - - [15744, 2688, 1, 384]
    - [54, 4982.54]
  - - [39168, 3072, 1, 384]
    - [54, 5013.87]
  - - [14976, 1536, 1, 384]
    - [54, 4920.57]
  - - [6144, 3072, 1, 384]
    - [58, 4887.76]
  - - [31872, 1153, 1, 384]
    - [54, 4770.65]
  - - [24576, 1153, 1, 384]
    - [54, 4744.43]
  - - [41088, 3072, 1, 384]
    - [58, 5002.19]
  - - [34176, 3072, 1, 384]
    - [58, 5001.42]
  - - [6144, 1152, 1, 384]
    - [58, 4818.3]
  - - [7296, 384, 1, 384]
    - [82, 4461.84]
  - - [36096, 384, 1, 384]
    - [54, 4861.68]
  - - [33792, 1153, 1, 384]
    - [54, 4772.04]
  - - [1920, 768, 1, 384]
    - [74, 4210.53]
  - - [34560, 1536, 1, 384]
    - [54, 4972.95]
  - - [8448, 2304, 1, 384]
    - [54, 4901.92]
  - - [9984, 2688, 1, 384]
    - [54, 4939.14]
  - - [16512, 1152, 1, 384]
    - [54, 4896.62]
  - - [8064, 1153, 1, 384]
    - [54, 4611.67]
  - - [8064, 768, 1, 384]
    - [54, 4704.03]
  - - [44160, 1152, 1, 384]
    - [54, 4989.47]
  - - [26112, 2688, 1, 384]
    - [54, 5000.26]
  - - [21120, 1152, 1, 384]
    - [54, 4958.4]
  - - [6528, 3072, 1, 384]
    - [54, 4903.31]
  - - [39936, 768, 1, 384]
    - [54, 4946.83]
  - - [20736, 1152, 1, 384]
    - [54, 4955.03]
  - - [19200, 1920, 1, 384]
    - [58, 4968.75]
  - - [38400, 768, 1, 384]
    - [58, 4947.5]
  - - [19200, 1153, 1, 384]
    - [54, 4733.84]
  - - [29952, 3072, 1, 384]
    - [54, 5005.19]
  - - [19200, 2304, 1, 384]
    - [53, 4973.81]
  - - [8448, 1536, 1, 384]
    - [58, 4863.01]
  - - [13824, 1536, 1, 384]
    - [58, 4902.08]
  - - [6912, 1152, 1, 384]
    - [58, 4722.38]
  - - [32640, 768, 1, 384]
    - [54, 4946.11]
  - - [9600, 768, 1, 384]
    - [58, 4743.89]
  - - [29568, 1152, 1, 384]
    - [54, 4970.94]
  - - [34560, 2304, 1, 384]
    - [54, 5003.32]
  - - [10368, 768, 1, 384]
    - [54, 4706.68]
  - - [28800, 1153, 1, 384]
    - [53, 4744.69]
  - - [768, 768, 1, 384]
    - [78, 3482.36]
  - - [2688, 1152, 1, 384]
    - [58, 4580.46]
  - - [20736, 1536, 1, 384]
    - [58, 4937.58]
  - - [19584, 1153, 1, 384]
    - [54, 4733.21]
  - - [28800, 768, 1, 384]
    - [54, 4919.76]
  - - [42240, 768, 1, 384]
    - [54, 4964.33]
  - - [34176, 384, 1, 384]
    - [54, 4844.7]
  - - [40320, 2304, 1, 384]
    - [53, 4996.6]
  - - [22656, 1153, 1, 384]
    - [54, 4730.71]
  - - [18816, 1153, 1, 384]
    - [54, 4724.3]
  - - [13440, 1153, 1, 384]
    - [54, 4651.66]
  - - [28416, 2688, 1, 384]
    - [58, 5004.98]
  - - [30720, 1920, 1, 384]
    - [54, 4998.82]
  - - [8064, 1152, 1, 384]
    - [58, 4796.25]
  - - [39936, 1536, 1, 384]
    - [54, 4982.15]
  - - [10368, 1536, 1, 384]
    - [53, 4857.73]
  - - [768, 769, 1, 384]
    - [42, 3419.59]
  - - [21888, 1536, 1, 384]
    - [53, 4949.57]
  - - [38784, 2688, 1, 384]
    - [53, 5006.9]
  - - [22272, 3072, 1, 384]
    - [54, 4984.17]
  - - [27648, 2304, 1, 384]
    - [58, 4997.34]
  - - [34944, 1153, 1, 384]
    - [54, 4789.65]
  - - [41088, 2688, 1, 384]
    - [54, 5018.71]
  - - [11136, 1920, 1, 384]
    - [54, 4929.72]
  - - [35712, 384, 1, 384]
    - [53, 4892.37]
  - - [22656, 1152, 1, 384]
    - [54, 4942.93]
  - - [36864, 1536, 1, 384]
    - [54, 4983.74]
  - - [14592, 1153, 1, 384]
    - [54, 4703.98]
  - - [15744, 3072, 1, 384]
    - [58, 4970.56]
  - - [14976, 1153, 1, 384]
    - [54, 4692.61]
  - - [37248, 768, 1, 384]
    - [58, 4956.36]
  - - [23424, 3072, 1, 384]
    - [58, 4997.56]
  - - [23040, 2688, 1, 384]
    - [54, 4992.59]
  - - [4224, 3072, 1, 384]
    - [58, 4867.95]
  - - [6912, 2304, 1, 384]
    - [54, 4878.5]
  - - [24192, 3072, 1, 384]
    - [58, 4992.8]
  - - [17664, 3072, 1, 384]
    - [54, 4983.33]
  - - [27648, 1153, 1, 384]
    - [54, 4756.01]
  - - [37632, 1920, 1, 384]
    - [54, 5001.9]
  - - [36096, 768, 1, 384]
    - [54, 4957.69]
  - - [4224, 2688, 1, 384]
    - [58, 4850.68]
  - - [40704, 1152, 1, 384]
    - [54, 4978.42]
  - - [8448, 1153, 1, 384]
    - [53, 4621.16]
  - - [7680, 768, 1, 384]
    - [54, 4763.85]
  - - [25344, 3072, 1, 384]
    - [54, 4995.46]
  - - [13440, 3072, 1, 384]
    - [58, 4957.5]
  - - [38016, 1920, 1, 384]
    - [54, 5010.41]
  - - [36864, 384, 1, 384]
    - [54, 4871.33]
  - - [35712, 2304, 1, 384]
    - [54, 5004.48]
  - - [34560, 1152, 1, 384]
    - [54, 4975.67]
  - - [42240, 1152, 1, 384]
    - [54, 4991.03]
  - - [31872, 3072, 1, 384]
    - [54, 5006.09]
  - - [43008, 3072, 1, 384]
    - [54, 5007.97]
  - - [37248, 2688, 1, 384]
    - [54, 5008.56]
  - - [42624, 1153, 1, 384]
    - [54, 4779.62]
  - - [29568, 1920, 1, 384]
    - [54, 4997.46]
  - - [4992, 384, 1, 384]
    - [53, 4455.81]
  - - [384, 385, 1, 384]
    - [67, 1699.72]
  - - [38400, 2688, 1, 384]
    - [54, 5028.21]
  - - [25728, 768, 1, 384]
    - [53, 4892.89]
  - - [9600, 384, 1, 384]
    - [82, 4418.71]
  - - [11136, 3072, 1, 384]
    - [54, 4953.38]
  - - [8832, 1920, 1, 384]
    - [53, 4869.19]
  - - [43776, 1920, 1, 384]
    - [54, 5004.77]
  - - [3072, 1153, 1, 384]
    - [87, 4208.86]
  - - [14976, 3072, 1, 384]
    - [53, 4964.71]
  - - [21120, 1153, 1, 384]
    - [53, 4722.78]
  - - [38784, 3072, 1, 384]
    - [58, 5003.44]
  - - [12288, 384, 1, 384]
    - [53, 4699.02]
  - - [38784, 768, 1, 384]
    - [54, 4953.34]
  - - [36480, 1536, 1, 384]
    - [58, 4979.68]
  - - [29184, 384, 1, 384]
    - [53, 4829.16]
  - - [15744, 768, 1, 384]
    - [58, 4854.56]
  - - [27264, 1920, 1, 384]
    - [54, 4996.32]
  - - [43392, 1152, 1, 384]
    - [54, 4985.1]
  - - [33792, 2304, 1, 384]
    - [54, 4992.42]
  - - [384, 384, 1, 384]
    - [79, 1705.52]
  - - [9984, 1153, 1, 384]
    - [54, 4637.86]
  - - [8832, 2304, 1, 384]
    - [58, 4918.67]
  - - [18432, 3072, 1, 384]
    - [54, 4992.21]
  - - [41088, 1152, 1, 384]
    - [54, 4977.11]
  - - [39168, 2688, 1, 384]
    - [54, 5027.17]
  - - [39936, 1152, 1, 384]
    - [54, 4980.38]
  - - [43776, 1153, 1, 384]
    - [54, 4784.95]
  - - [31104, 384, 1, 384]
    - [54, 4835.4]
  - - [16512, 3072, 1, 384]
    - [58, 4976.13]
  - - [39168, 384, 1, 384]
    - [54, 4873.07]
  - - [18816, 1152, 1, 384]
    - [54, 4909.98]
  - - [43776, 1152, 1, 384]
    - [54, 4989.26]
  - - [35328, 1920, 1, 384]
    - [54, 5000.27]
  - - [29952, 1153, 1, 384]
    - [54, 4764.22]
  - - [38016, 384, 1, 384]
    - [54, 4841.34]
  - - [41856, 1152, 1, 384]
    - [54, 4993.95]
  - - [43008, 1536, 1, 384]
    - [54, 4994.71]
  - - [35328, 2304, 1, 384]
    - [58, 4989.08]
  - - [11520, 1152, 1, 384]
    - [54, 4882.24]
  - - [36864, 1152, 1, 384]
    - [58, 4972.27]
  - - [37248, 2304, 1, 384]
    - [58, 4996.85]
  - - [26880, 3072, 1, 384]
    - [58, 4997.79]
  - - [28032, 1153, 1, 384]
    - [54, 4750.89]
  - - [29184, 768, 1, 384]
    - [54, 4918.57]
  - - [3456, 1152, 1, 384]
    - [70, 4454.1]
  - - [39936, 1153, 1, 384]
    - [53, 4763.76]
  - - [17664, 384, 1, 384]
    - [82, 4684.98]
  - - [18048, 2688, 1, 384]
    - [54, 4988.01]
  - - [7296, 2688, 1, 384]
    - [54, 4929.62]
  - - [13056, 2304, 1, 384]
    - [54, 4951.53]
  - - [42624, 1536, 1, 384]
    - [58, 4981.58]
  - - [2688, 1536, 1, 384]
    - [82, 4553.79]
  - - [29568, 1153, 1, 384]
    - [54, 4748.11]
  - - [32256, 2688, 1, 384]
    - [54, 5015.97]
  - - [18816, 1536, 1, 384]
    - [53, 4919.82]
  - - [32256, 3072, 1, 384]
    - [54, 5005.99]
  - - [33792, 3072, 1, 384]
    - [54, 5008.65]
  - - [9984, 3072, 1, 384]
    - [54, 4941.1]
  - - [34560, 1153, 1, 384]
    - [54, 4762.85]
  - - [13056, 1536, 1, 384]
    - [58, 4894.21]
  - - [35328, 384, 1, 384]
    - [54, 4863.98]
  - - [26496, 384, 1, 384]
    - [54, 4857.03]
  - - [34944, 1536, 1, 384]
    - [54, 4977.25]
  - - [23424, 768, 1, 384]
    - [58, 4900.42]
  - - [38400, 1920, 1, 384]
    - [54, 5014.41]
  - - [15360, 2304, 1, 384]
    - [54, 4941.01]
  - - [27264, 2688, 1, 384]
    - [54, 4997.74]
  - - [11136, 1536, 1, 384]
    - [58, 4862.51]
  - - [5760, 1153, 1, 384]
    - [54, 4539.43]
  - - [41472, 3072, 1, 384]
    - [54, 5016.11]
  - - [23040, 1153, 1, 384]
    - [54, 4738.31]
  - - [12288, 1536, 1, 384]
    - [58, 4905.89]
  - - [14592, 384, 1, 384]
    - [54, 4627.27]
  - - [6528, 2304, 1, 384]
    - [54, 4860.93]
  - - [25728, 1153, 1, 384]
    - [54, 4744.88]
  - - [30720, 2304, 1, 384]
    - [54, 4997.63]
  - - [24576, 1152, 1, 384]
    - [53, 4944.53]
  - - [4608, 1153, 1, 384]
    - [52, 4445.27]
  - - [4992, 768, 1, 384]
    - [86, 4537.11]
  - - [34944, 2688, 1, 384]
    - [53, 5015.17]
  - - [768, 385, 1, 384]
    - [62, 2498.7]
  - - [24960, 2688, 1, 384]
    - [54, 5006.67]
  - - [9984, 384, 1, 384]
    - [87, 4542.15]
  - - [12672, 3072, 1, 384]
    - [53, 4959.76]
  - - [18432, 1920, 1, 384]
    - [54, 4965.05]
  - - [3840, 2688, 1, 384]
    - [53, 4780.74]
  - - [26496, 1153, 1, 384]
    - [54, 4755.39]
  - - [13824, 1920, 1, 384]
    - [54, 4943.04]
  - - [26880, 1153, 1, 384]
    - [54, 4742.79]
  - - [17280, 2688, 1, 384]
    - [54, 4991.57]
  - - [5376, 3072, 1, 384]
    - [58, 4909.27]
  - - [15360, 1536, 1, 384]
    - [58, 4913.82]
  - - [43776, 2688, 1, 384]
    - [54, 5019.33]
  - - [24960, 1920, 1, 384]
    - [54, 4990.97]
  - - [31872, 768, 1, 384]
    - [54, 4936.78]
  - - [23808, 1153, 1, 384]
    - [54, 4751.73]
  - - [23040, 384, 1, 384]
    - [53, 4764.65]
  - - [1920, 1152, 1, 384]
    - [44, 4434.77]
  - - [11904, 2688, 1, 384]
    - [54, 4948.94]
  - - [17664, 1152, 1, 384]
    - [53, 4921.27]
  - - [12672, 1153, 1, 384]
    - [54, 4659.93]
  - - [7296, 1152, 1, 384]
    - [54, 4749.42]
  - - [7296, 768, 1, 384]
    - [53, 4618.53]
  - - [1152, 1153, 1, 384]
    - [64, 3859.34]
  - - [27264, 1152, 1, 384]
    - [54, 4970.13]
  - - [19200, 1536, 1, 384]
    - [58, 4924.18]
  - - [11904, 3072, 1, 384]
    - [58, 4934.55]
  - - [37248, 1152, 1, 384]
    - [54, 4983.1]
  - - [20736, 3072, 1, 384]
    - [58, 4980.86]
  - - [10368, 384, 1, 384]
    - [82, 4459.81]
  - - [11904, 1153, 1, 384]
    - [54, 4648.05]
  - - [12288, 768, 1, 384]
    - [58, 4831.07]
  - - [33792, 768, 1, 384]
    - [54, 4936.33]
  - - [21888, 2688, 1, 384]
    - [54, 4999.3]
  - - [15360, 3072, 1, 384]
    - [54, 4967.21]
  - - [2688, 1920, 1, 384]
    - [82, 4611.87]
  - - [21504, 1536, 1, 384]
    - [58, 4947.64]
  - - [19968, 768, 1, 384]
    - [58, 4886.98]
  - - [4608, 3072, 1, 384]
    - [58, 4872.38]
  - - [35328, 1152, 1, 384]
    - [54, 4964.92]
  - - [34176, 1152, 1, 384]
    - [54, 4976.68]
  - - [42624, 3072, 1, 384]
    - [54, 5009.18]
  - - [19200, 2688, 1, 384]
    - [58, 4986.14]
  - - [31104, 3072, 1, 384]
    - [58, 5003.6]
  - - [31488, 2304, 1, 384]
    - [54, 4993.86]
  - - [35712, 3072, 1, 384]
    - [58, 5009.56]
  - - [18432, 1153, 1, 384]
    - [54, 4706.24]
  - - [12288, 2688, 1, 384]
    - [53, 4956.38]
  - - [21120, 3072, 1, 384]
    - [58, 4982.52]
  - - [12288, 2304, 1, 384]
    - [53, 4931.88]
  - - [28416, 768, 1, 384]
    - [54, 4916.82]
  - - [33408, 3072, 1, 384]
    - [54, 4993.68]
  - - [36480, 384, 1, 384]
    - [54, 4863.47]
  - - [4224, 384, 1, 384]
    - [82, 4010.14]
  - - [27264, 1536, 1, 384]
    - [54, 4969.03]
  - - [12672, 1152, 1, 384]
    - [53, 4858.29]
  - - [28416, 1152, 1, 384]
    - [54, 4961.14]
  - - [6528, 1153, 1, 384]
    - [53, 4587.46]
  - - [9216, 384, 1, 384]
    - [57, 4671.87]
  - - [34944, 1152, 1, 384]
    - [58, 4972.63]
  - - [34560, 768, 1, 384]
    - [54, 4949.96]
  - - [31488, 3072, 1, 384]
    - [54, 5005.47]
  - - [39936, 2688, 1, 384]
    - [54, 5028.3]
  - - [8064, 1920, 1, 384]
    - [53, 4871.23]
  - - [13056, 1153, 1, 384]
    - [54, 4697.06]
  - - [9984, 1152, 1, 384]
    - [54, 4816.36]
  - - [26880, 1536, 1, 384]
    - [54, 4961.16]
  - - [33792, 384, 1, 384]
    - [54, 4853.35]
  - - [4608, 384, 1, 384]
    - [81, 4328.98]
  - - [28032, 2688, 1, 384]
    - [54, 5015.88]
  - - [7296, 3072, 1, 384]
    - [54, 4921.05]
  - - [41472, 2688, 1, 384]
    - [54, 5028.2]
  - - [29568, 2688, 1, 384]
    - [54, 5009.14]
  - - [37248, 1920, 1, 384]
    - [54, 4999.35]
  - - [6912, 2688, 1, 384]
    - [54, 4884.78]
  - - [33024, 1152, 1, 384]
    - [54, 4976.89]
  - - [31104, 1152, 1, 384]
    - [54, 4969.95]
  - - [31104, 2688, 1, 384]
    - [54, 5015.92]
  - - [5376, 1920, 1, 384]
    - [53, 4786.52]
  - - [21888, 1152, 1, 384]
    - [54, 4936.25]
  - - [40320, 1920, 1, 384]
    - [54, 4991.36]
  - - [41856, 3072, 1, 384]
    - [58, 5015.47]
  - - [37248, 3072, 1, 384]
    - [58, 5002.66]
  - - [41856, 2688, 1, 384]
    - [54, 5020.04]
  - - [14208, 1153, 1, 384]
    - [53, 4687.64]
  - - [9984, 768, 1, 384]
    - [58, 4729.51]
  - - [3456, 2688, 1, 384]
    - [58, 4804.52]
  - - [41088, 1153, 1, 384]
    - [54, 4777.86]
  - - [13056, 1152, 1, 384]
    - [54, 4846.24]
  - - [32256, 1152, 1, 384]
    - [54, 4982.06]
  - - [6912, 3072, 1, 384]
    - [58, 4906.92]
  - - [14976, 1152, 1, 384]
    - [54, 4920.46]
  - - [21888, 3072, 1, 384]
    - [54, 4980.16]
  - - [1536, 1153, 1, 384]
    - [44, 4196.91]
  - - [8064, 384, 1, 384]
    - [58, 4557.98]
  - - [16512, 384, 1, 384]
    - [53, 4610.65]
  - - [27648, 1536, 1, 384]
    - [54, 4974.7]
  - - [35712, 1152, 1, 384]
    - [53, 4970.19]
  - - [43392, 2688, 1, 384]
    - [54, 5026.27]
  - - [6528, 384, 1, 384]
    - [84, 4413.94]
  - - [13824, 3072, 1, 384]
    - [58, 4953.54]
  - - [11136, 384, 1, 384]
    - [54, 4702.92]
  - - [14208, 384, 1, 384]
    - [58, 4697.86]
  - - [36480, 1920, 1, 384]
    - [54, 5012.07]
  - - [36480, 3072, 1, 384]
    - [54, 4997.05]
  - - [29568, 1536, 1, 384]
    - [58, 4970.85]
  - - [33792, 1152, 1, 384]
    - [53, 4980.04]
  - - [36864, 2688, 1, 384]
    - [54, 5010.21]
  - - [23808, 768, 1, 384]
    - [54, 4895.19]
  - - [42624, 1152, 1, 384]
    - [54, 4985.64]
  - - [8448, 1152, 1, 384]
    - [53, 4837.08]
  - - [28032, 384, 1, 384]
    - [54, 4820.51]
  - - [29568, 768, 1, 384]
    - [58, 4926.64]
  - - [2304, 768, 1, 384]
    - [67, 4308.13]
  - - [33024, 1153, 1, 384]
    - [53, 4765.11]
  - - [12672, 768, 1, 384]
    - [58, 4817.37]
  - - [15744, 2304, 1, 384]
    - [54, 4966.59]
  - - [36096, 1281, 1, 256]
    - [110, 4683.17]
  - - [24064, 3072, 1, 256]
    - [114, 4851.14]
  - - [256, 512, 1, 256]
    - [116, 1414.61]
  - - [40960, 27648, 1, 256]
    - [114, 4902.92]
  - - [11264, 1792, 1, 256]
    - [108, 4758.35]
  - - [22016, 512, 1, 256]
    - [114, 4634.29]
  - - [31744, 3072, 1, 256]
    - [114, 4868.69]
  - - [13056, 1792, 1, 256]
    - [108, 4791.73]
  - - [35328, 22785, 1, 256]
    - [108, 4897.3]
  - - [28160, 15872, 1, 256]
    - [114, 4899.76]
  - - [39168, 1792, 1, 256]
    - [108, 4885.16]
  - - [2560, 2561, 1, 256]
    - [131, 4340.93]
  - - [35328, 1536, 1, 256]
    - [114, 4847.55]
  - - [37376, 3072, 1, 256]
    - [114, 4882.7]
  - - [23808, 11265, 1, 256]
    - [114, 4835.04]
  - - [36096, 2048, 1, 256]
    - [114, 4869.17]
  - - [27136, 1280, 1, 256]
    - [108, 4838.67]
  - - [28928, 3072, 1, 256]
    - [114, 4869.62]
  - - [13568, 1792, 1, 256]
    - [108, 4783.98]
  - - [16640, 4353, 1, 256]
    - [108, 4801.52]
  - - [33792, 1280, 1, 256]
    - [108, 4864.07]
  - - [12544, 2048, 1, 256]
    - [114, 4762.11]
  - - [38912, 26624, 1, 256]
    - [114, 4904.43]
  - - [6912, 3585, 1, 256]
    - [114, 4655.89]
  - - [32768, 1792, 1, 256]
    - [108, 4881.15]
  - - [30976, 18688, 1, 256]
    - [108, 4927.99]
  - - [32256, 512, 1, 256]
    - [114, 4698.46]
  - - [512, 2048, 1, 256]
    - [101, 3956.89]
  - - [13312, 2048, 1, 256]
    - [114, 4764.3]
  - - [10496, 3072, 1, 256]
    - [114, 4799.18]
  - - [15872, 3584, 1, 256]
    - [114, 4836.6]
  - - [33792, 512, 1, 256]
    - [114, 4703.89]
  - - [6400, 1792, 1, 256]
    - [114, 4632.11]
  - - [39680, 27393, 1, 256]
    - [108, 4914.19]
  - - [36864, 24577, 1, 256]
    - [114, 4847.19]
  - - [38400, 1280, 1, 256]
    - [108, 4877.02]
  - - [26112, 1536, 1, 256]
    - [114, 4828.11]
  - - [26368, 1536, 1, 256]
    - [114, 4811.11]
  - - [16896, 4353, 1, 256]
    - [108, 4789.47]
  - - [14336, 1793, 1, 256]
    - [108, 4611.18]
  - - [1280, 1025, 1, 256]
    - [94, 3505.98]
  - - [3840, 3072, 1, 256]
    - [114, 4640.01]
  - - [2560, 3072, 1, 256]
    - [121, 4517.7]
  - - [6656, 1536, 1, 256]
    - [131, 4559.98]
  - - [27136, 1792, 1, 256]
    - [108, 4865.58]
  - - [43776, 3072, 1, 256]
    - [114, 4875.0]
  - - [23296, 1792, 1, 256]
    - [108, 4851.68]
  - - [20224, 256, 1, 256]
    - [126, 4394.56]
  - - [42496, 2048, 1, 256]
    - [114, 4866.74]
  - - [11264, 7937, 1, 256]
    - [108, 4828.6]
  - - [768, 3072, 1, 256]
    - [108, 4361.5]
  - - [6912, 3841, 1, 256]
    - [108, 4732.31]
  - - [40960, 769, 1, 256]
    - [108, 4446.94]
  - - [39680, 1281, 1, 256]
    - [111, 4677.39]
  - - [9984, 1280, 1, 256]
    - [108, 4687.58]
  - - [41984, 1536, 1, 256]
    - [114, 4854.32]
  - - [34304, 1281, 1, 256]
    - [105, 4683.32]
  - - [34048, 256, 1, 256]
    - [108, 4564.25]
  - - [31232, 1024, 1, 256]
    - [114, 4805.76]
  - - [11264, 8192, 1, 256]
    - [114, 4859.68]
  - - [6400, 3072, 1, 256]
    - [114, 4706.18]
  - - [40448, 9216, 1, 256]
    - [114, 4897.2]
  - - [7680, 4353, 1, 256]
    - [108, 4741.99]
  - - [23296, 3072, 1, 256]
    - [114, 4842.7]
  - - [7936, 4609, 1, 256]
    - [114, 4702.55]
  - - [20736, 8448, 1, 256]
    - [108, 4916.88]
  - - [17408, 1792, 1, 256]
    - [108, 4832.36]
  - - [768, 1024, 1, 256]
    - [123, 3850.93]
  - - [1792, 1793, 1, 256]
    - [121, 4123.43]
  - - [38656, 3072, 1, 256]
    - [114, 4884.75]
  - - [12544, 9216, 1, 256]
    - [114, 4868.88]
  - - [28160, 1792, 1, 256]
    - [108, 4872.39]
  - - [13824, 3072, 1, 256]
    - [114, 4830.29]
  - - [42752, 1792, 1, 256]
    - [108, 4892.09]
  - - [35584, 23041, 1, 256]
    - [114, 4844.43]
  - - [13056, 3072, 1, 256]
    - [114, 4819.5]
  - - [40960, 1024, 1, 256]
    - [114, 4819.13]
  - - [2048, 2048, 1, 256]
    - [121, 4396.26]
  - - [9984, 512, 1, 256]
    - [114, 4427.01]
  - - [11264, 1024, 1, 256]
    - [114, 4618.93]
  - - [23552, 512, 1, 256]
    - [114, 4647.71]
  - - [37888, 768, 1, 256]
    - [108, 4813.19]
  - - [17664, 2048, 1, 256]
    - [114, 4808.92]
  - - [36608, 256, 1, 256]
    - [108, 4645.9]
  - - [42752, 1281, 1, 256]
    - [111, 4695.66]
  - - [19456, 3072, 1, 256]
    - [114, 4838.24]
  - - [22784, 1024, 1, 256]
    - [114, 4737.07]
  - - [15872, 9216, 1, 256]
    - [114, 4875.14]
  - - [39424, 1024, 1, 256]
    - [114, 4825.63]
  - - [30976, 1792, 1, 256]
    - [108, 4883.06]
  - - [26368, 14081, 1, 256]
    - [108, 4892.51]
  - - [21760, 1281, 1, 256]
    - [110, 4634.78]
  - - [35328, 23041, 1, 256]
    - [114, 4847.66]
  - - [16128, 1280, 1, 256]
    - [108, 4776.25]
  - - [22528, 1281, 1, 256]
    - [111, 4638.44]
  - - [27648, 15105, 1, 256]
    - [108, 4884.37]
  - - [25856, 13568, 1, 256]
    - [108, 4932.23]
  - - [36864, 768, 1, 256]
    - [108, 4832.35]
  - - [23296, 9216, 1, 256]
    - [114, 4887.25]
  - - [32000, 1281, 1, 256]
    - [111, 4669.37]
  - - [18176, 1281, 1, 256]
    - [111, 4617.16]
  - - [2048, 1024, 1, 256]
    - [98, 4125.98]
  - - [38144, 256, 1, 256]
    - [108, 4656.52]
  - - [21248, 1280, 1, 256]
    - [108, 4810.91]
  - - [19712, 1281, 1, 256]
    - [111, 4627.92]
  - - [1792, 1280, 1, 256]
    - [108, 4258.8]
  - - [12032, 1792, 1, 256]
    - [108, 4771.69]
  - - [23040, 3072, 1, 256]
    - [114, 4858.63]
  - - [11520, 1536, 1, 256]
    - [114, 4718.0]
  - - [16128, 768, 1, 256]
    - [108, 4684.85]
  - - [15360, 3072, 1, 256]
    - [114, 4834.08]
  - - [38912, 26369, 1, 256]
    - [108, 4892.03]
  - - [27392, 2048, 1, 256]
    - [114, 4850.35]
  - - [25344, 13056, 1, 256]
    - [108, 4931.37]
  - - [39168, 26880, 1, 256]
    - [108, 4936.42]
  - - [39424, 768, 1, 256]
    - [108, 4807.05]
  - - [16384, 1280, 1, 256]
    - [108, 4748.04]
  - - [10496, 1792, 1, 256]
    - [108, 4758.53]
  - - [28672, 3072, 1, 256]
    - [114, 4861.49]
  - - [5888, 1280, 1, 256]
    - [131, 4520.57]
  - - [27392, 768, 1, 256]
    - [108, 4783.53]
  - - [39680, 768, 1, 256]
    - [108, 4820.21]
  - - [11520, 8193, 1, 256]
    - [114, 4790.5]
  - - [17408, 4865, 1, 256]
    - [108, 4802.67]
  - - [35840, 1281, 1, 256]
    - [111, 4680.1]
  - - [14080, 1537, 1, 256]
    - [114, 4529.17]
  - - [29184, 768, 1, 256]
    - [114, 4792.21]
  - - [2560, 1280, 1, 256]
    - [121, 4244.39]
  - - [19200, 6913, 1, 256]
    - [108, 4858.08]
  - - [33536, 9216, 1, 256]
    - [114, 4892.07]
  - - [5632, 3072, 1, 256]
    - [114, 4691.54]
  - - [32768, 20480, 1, 256]
    - [114, 4898.68]
  - - [34560, 2048, 1, 256]
    - [114, 4860.04]
  - - [29440, 9216, 1, 256]
    - [114, 4893.91]
  - - [40960, 1792, 1, 256]
    - [108, 4890.71]
  - - [10240, 3072, 1, 256]
    - [114, 4785.4]
  - - [20992, 1792, 1, 256]
    - [108, 4846.76]
  - - [42240, 9216, 1, 256]
    - [114, 4898.87]
  - - [14080, 2048, 1, 256]
    - [114, 4774.52]
  - - [5120, 256, 1, 256]
    - [120, 3986.98]
  - - [6144, 512, 1, 256]
    - [114, 4390.98]
  - - [19200, 6912, 1, 256]
    - [108, 4915.74]
  - - [8704, 1280, 1, 256]
    - [108, 4637.3]
  - - [43264, 512, 1, 256]
    - [114, 4748.69]
  - - [27392, 1792, 1, 256]
    - [108, 4871.35]
  - - [43264, 1024, 1, 256]
    - [114, 4818.17]
  - - [2048, 2049, 1, 256]
    - [115, 4209.52]
  - - [42496, 1536, 1, 256]
    - [114, 4850.99]
  - - [20480, 512, 1, 256]
    - [114, 4585.82]
  - - [29440, 16897, 1, 256]
    - [114, 4832.96]
  - - [3584, 768, 1, 256]
    - [131, 4159.65]
  - - [20480, 8192, 1, 256]
    - [114, 4881.84]
  - - [15360, 1536, 1, 256]
    - [114, 4761.75]
  - - [11264, 8193, 1, 256]
    - [114, 4782.28]
  - - [27136, 2048, 1, 256]
    - [114, 4842.7]
  - - [19968, 1281, 1, 256]
    - [111, 4632.3]
  - - [26880, 14337, 1, 256]
    - [114, 4829.69]
  - - [28928, 16641, 1, 256]
    - [108, 4900.64]
  - - [15360, 2817, 1, 256]
    - [108, 4725.8]
  - - [15616, 1280, 1, 256]
    - [108, 4780.15]
  - - [1536, 1537, 1, 256]
    - [129, 3915.35]
  - - [44288, 1536, 1, 256]
    - [114, 4849.23]
  - - [7936, 1536, 1, 256]
    - [114, 4620.04]
  - - [18176, 5633, 1, 256]
    - [114, 4777.6]
  - - [44032, 1280, 1, 256]
    - [108, 4879.8]
  - - [38912, 1024, 1, 256]
    - [114, 4804.69]
  - - [8448, 3072, 1, 256]
    - [114, 4777.22]
  - - [17920, 5632, 1, 256]
    - [114, 4863.73]
  - - [19456, 512, 1, 256]
    - [114, 4566.54]
  - - [3328, 1281, 1, 256]
    - [108, 4152.86]
  - - [22528, 10240, 1, 256]
    - [114, 4885.18]
  - - [24576, 2048, 1, 256]
    - [114, 4835.95]
  - - [1792, 2048, 1, 256]
    - [126, 4353.68]
  - - [33280, 2048, 1, 256]
    - [114, 4854.19]
  - - [25600, 1536, 1, 256]
    - [114, 4819.84]
  - - [38400, 1281, 1, 256]
    - [111, 4685.22]
  - - [17664, 256, 1, 256]
    - [108, 4391.61]
  - - [39936, 3072, 1, 256]
    - [114, 4880.74]
  - - [7168, 4096, 1, 256]
    - [114, 4771.7]
  - - [10240, 768, 1, 256]
    - [131, 4532.34]
  - - [41216, 1280, 1, 256]
    - [108, 4876.53]
  - - [24832, 1024, 1, 256]
    - [114, 4775.63]
  - - [35328, 3072, 1, 256]
    - [114, 4872.89]
  - - [20480, 3072, 1, 256]
    - [114, 4844.01]
  - - [24832, 1792, 1, 256]
    - [108, 4848.04]
  - - [4352, 1280, 1, 256]
    - [114, 4381.42]
  - - [37376, 25088, 1, 256]
    - [114, 4899.56]
  - - [7168, 4097, 1, 256]
    - [114, 4683.2]
  - - [19200, 256, 1, 256]
    - [114, 4447.52]
  - - [21504, 768, 1, 256]
    - [108, 4749.76]
  - - [13312, 3072, 1, 256]
    - [114, 4819.62]
  - - [35072, 768, 1, 256]
    - [114, 4797.96]
  - - [22784, 2048, 1, 256]
    - [114, 4831.57]
  - - [40960, 1025, 1, 256]
    - [111, 4541.8]
  - - [28672, 256, 1, 256]
    - [114, 4574.12]
  - - [26880, 1280, 1, 256]
    - [108, 4839.8]
  - - [12032, 1536, 1, 256]
    - [114, 4727.39]
  - - [9216, 768, 1, 256]
    - [114, 4620.41]
  - - [44288, 27648, 1, 256]
    - [114, 4905.93]
  - - [23808, 1280, 1, 256]
    - [114, 4821.63]
  - - [32512, 1792, 1, 256]
    - [108, 4879.65]
  - - [39424, 256, 1, 256]
    - [108, 4643.25]
  - - [23808, 11520, 1, 256]
    - [108, 4929.53]
  - - [12032, 1281, 1, 256]
    - [111, 4563.85]
  - - [25600, 13057, 1, 256]
    - [108, 4873.35]
  - - [31744, 1281, 1, 256]
    - [104, 4676.38]
  - - [11520, 2048, 1, 256]
    - [114, 4770.47]
  - - [12032, 1280, 1, 256]
    - [108, 4710.22]
  - - [30208, 1281, 1, 256]
    - [110, 4661.17]
  - - [40448, 1792, 1, 256]
    - [108, 4894.44]
  - - [25088, 12800, 1, 256]
    - [114, 4890.29]
  - - [8448, 256, 1, 256]
    - [108, 4102.31]
  - - [22784, 10496, 1, 256]
    - [108, 4928.02]
  - - [38400, 26113, 1, 256]
    - [114, 4838.12]
  - - [32512, 2048, 1, 256]
    - [114, 4843.84]
  - - [9728, 3072, 1, 256]
    - [114, 4781.15]
  - - [5888, 1024, 1, 256]
    - [129, 4442.51]
  - - [20736, 1792, 1, 256]
    - [108, 4843.72]
  - - [11776, 1280, 1, 256]
    - [108, 4699.39]
  - - [7680, 3072, 1, 256]
    - [114, 4763.85]
  - - [5376, 2305, 1, 256]
    - [108, 4543.24]
  - - [6912, 3840, 1, 256]
    - [108, 4808.62]
  - - [18944, 1024, 1, 256]
    - [114, 4723.46]
  - - [11008, 2048, 1, 256]
    - [114, 4739.48]
  - - [35328, 256, 1, 256]
    - [108, 4662.97]
  - - [10752, 1024, 1, 256]
    - [114, 4647.74]
  - - [12800, 3072, 1, 256]
    - [114, 4814.67]
  - - [25856, 2048, 1, 256]
    - [114, 4843.22]
  - - [43520, 3584, 1, 256]
    - [114, 4883.13]
  - - [16640, 1024, 1, 256]
    - [114, 4691.21]
  - - [12288, 3072, 1, 256]
    - [114, 4811.73]
  - - [12800, 1536, 1, 256]
    - [114, 4718.36]
  - - [21504, 8961, 1, 256]
    - [108, 4860.76]
  - - [19456, 1281, 1, 256]
    - [105, 4630.4]
  - - [2816, 2816, 1, 256]
    - [108, 4514.02]
  - - [39680, 9216, 1, 256]
    - [114, 4895.08]
  - - [18432, 1281, 1, 256]
    - [111, 4622.04]
  - - [33024, 9216, 1, 256]
    - [114, 4895.78]
  - - [24576, 512, 1, 256]
    - [114, 4660.88]
  - - [3584, 513, 1, 256]
    - [98, 3686.41]
  - - [14336, 1024, 1, 256]
    - [114, 4664.73]
  - - [5888, 1281, 1, 256]
    - [111, 4384.4]
  - - [1280, 3072, 1, 256]
    - [121, 4414.29]
  - - [13056, 9216, 1, 256]
    - [114, 4881.89]
  - - [44032, 2048, 1, 256]
    - [114, 4865.79]
  - - [40448, 2048, 1, 256]
    - [114, 4863.59]
  - - [22016, 768, 1, 256]
    - [114, 4737.67]
  - - [33024, 1536, 1, 256]
    - [114, 4841.75]
  - - [36352, 1281, 1, 256]
    - [105, 4681.64]
  - - [26880, 9216, 1, 256]
    - [114, 4890.32]
  - - [23552, 1792, 1, 256]
    - [108, 4852.22]
  - - [38144, 1792, 1, 256]
    - [108, 4883.36]
  - - [44032, 27648, 1, 256]
    - [114, 4897.71]
  - - [7680, 768, 1, 256]
    - [108, 4580.05]
  - - [32000, 19712, 1, 256]
    - [108, 4930.66]
  - - [26880, 14593, 1, 256]
    - [108, 4893.08]
  - - [24064, 9216, 1, 256]
    - [114, 4879.56]
  - - [39424, 26881, 1, 256]
    - [108, 4894.82]
  - - [27392, 3072, 1, 256]
    - [114, 4860.99]
  - - [43264, 9216, 1, 256]
    - [114, 4890.94]
  - - [42752, 256, 1, 256]
    - [108, 4686.22]
  - - [10752, 1792, 1, 256]
    - [108, 4770.31]
  - - [8960, 5633, 1, 256]
    - [114, 4735.37]
  - - [4096, 1024, 1, 256]
    - [114, 4366.23]
  - - [11264, 2048, 1, 256]
    - [114, 4754.28]
  - - [5120, 2048, 1, 256]
    - [114, 4624.37]
  - - [34560, 3072, 1, 256]
    - [114, 4876.85]
  - - [23808, 9216, 1, 256]
    - [114, 4888.51]
  - - [29696, 17153, 1, 256]
    - [108, 4893.72]
  - - [24576, 256, 1, 256]
    - [108, 4520.13]
  - - [2560, 2305, 1, 256]
    - [108, 4317.5]
  - - [11776, 1536, 1, 256]
    - [114, 4698.36]
  - - [13568, 1536, 1, 256]
    - [114, 4741.69]
  - - [39936, 2048, 1, 256]
    - [114, 4869.34]
  - - [25856, 1792, 1, 256]
    - [108, 4873.73]
  - - [35072, 1281, 1, 256]
    - [111, 4681.22]
  - - [22272, 256, 1, 256]
    - [108, 4490.58]
  - - [23296, 256, 1, 256]
    - [126, 4445.91]
  - - [42752, 2048, 1, 256]
    - [114, 4871.5]
  - - [30208, 9216, 1, 256]
    - [114, 4891.99]
  - - [9728, 6656, 1, 256]
    - [114, 4845.11]
  - - [36608, 1536, 1, 256]
    - [114, 4836.59]
  - - [44288, 1280, 1, 256]
    - [108, 4879.26]
  - - [12800, 513, 1, 256]
    - [111, 4135.5]
  - - [7680, 1792, 1, 256]
    - [108, 4740.09]
  - - [42496, 2305, 1, 256]
    - [108, 4745.94]
  - - [37376, 1536, 1, 256]
    - [114, 4826.61]
  - - [20224, 1792, 1, 256]
    - [108, 4837.13]
  - - [43520, 1536, 1, 256]
    - [114, 4846.54]
  - - [9216, 1536, 1, 256]
    - [114, 4684.68]
  - - [1536, 1281, 1, 256]
    - [119, 3926.65]
  - - [26368, 768, 1, 256]
    - [114, 4763.28]
  - - [18176, 3072, 1, 256]
    - [114, 4836.18]
  - - [24320, 12033, 1, 256]
    - [108, 4887.2]
  - - [17408, 9216, 1, 256]
    - [114, 4877.42]
  - - [36352, 1792, 1, 256]
    - [108, 4879.61]
  - - [24832, 768, 1, 256]
    - [108, 4756.41]
  - - [20992, 8705, 1, 256]
    - [114, 4805.78]
  - - [19712, 7424, 1, 256]
    - [108, 4918.38]
  - - [38144, 768, 1, 256]
    - [108, 4817.45]
  - - [24576, 1280, 1, 256]
    - [108, 4838.3]
  - - [33536, 1536, 1, 256]
    - [114, 4837.31]
  - - [7168, 1281, 1, 256]
    - [110, 4466.53]
  - - [10752, 1536, 1, 256]
    - [114, 4673.11]
  - - [29696, 1280, 1, 256]
    - [108, 4849.39]
  - - [17152, 9216, 1, 256]
    - [114, 4870.71]
  - - [4096, 3072, 1, 256]
    - [114, 4622.36]
  - - [18176, 2048, 1, 256]
    - [114, 4803.83]
  - - [29696, 17409, 1, 256]
    - [114, 4835.93]
  - - [5888, 2816, 1, 256]
    - [108, 4715.85]
  - - [34304, 256, 1, 256]
    - [114, 4570.52]
  - - [36352, 1280, 1, 256]
    - [108, 4856.26]
  - - [10240, 6913, 1, 256]
    - [108, 4802.01]
  - - [17408, 1536, 1, 256]
    - [114, 4774.5]
  - - [24832, 512, 1, 256]
    - [114, 4644.11]
  - - [18944, 1536, 1, 256]
    - [114, 4789.79]
  - - [38656, 26113, 1, 256]
    - [114, 4842.22]
  - - [37376, 25089, 1, 256]
    - [114, 4840.42]
  - - [38400, 1536, 1, 256]
    - [114, 4837.72]
  - - [22528, 512, 1, 256]
    - [114, 4614.89]
  - - [8448, 1792, 1, 256]
    - [108, 4718.67]
  - - [22272, 512, 1, 256]
    - [114, 4646.98]
  - - [13056, 769, 1, 256]
    - [114, 4309.04]
  - - [24320, 11777, 1, 256]
    - [114, 4822.9]
  - - [5376, 2048, 1, 256]
    - [108, 4603.71]
  - - [17664, 9216, 1, 256]
    - [114, 4886.38]
  - - [8192, 4865, 1, 256]
    - [108, 4751.52]
  - - [17920, 1792, 1, 256]
    - [108, 4836.35]
  - - [32000, 19713, 1, 256]
    - [108, 4907.57]
  - - [8960, 768, 1, 256]
    - [108, 4526.69]
  - - [31232, 3072, 1, 256]
    - [114, 4864.43]
  - - [6656, 1024, 1, 256]
    - [131, 4444.3]
  - - [23296, 1280, 1, 256]
    - [108, 4823.96]
  - - [30208, 512, 1, 256]
    - [114, 4667.15]
  - - [12544, 257, 1, 256]
    - [110, 3602.02]
  - - [43776, 3585, 1, 256]
    - [114, 4765.28]
  - - [11008, 1792, 1, 256]
    - [108, 4749.04]
  - - [27648, 1281, 1, 256]
    - [111, 4673.11]
  - - [27648, 1536, 1, 256]
    - [114, 4826.95]
  - - [9472, 1024, 1, 256]
    - [114, 4610.49]
  - - [29696, 17408, 1, 256]
    - [114, 4900.8]
  - - [44800, 2048, 1, 256]
    - [114, 4867.27]
  - - [2560, 1281, 1, 256]
    - [111, 4135.55]
  - - [25344, 1024, 1, 256]
    - [114, 4759.7]
  - - [4096, 768, 1, 256]
    - [121, 4303.7]
  - - [34560, 22272, 1, 256]
    - [108, 4940.76]
  - - [38656, 1281, 1, 256]
    - [111, 4695.98]
  - - [256, 2048, 1, 256]
    - [118, 3611.89]
  - - [32768, 20481, 1, 256]
    - [114, 4844.52]
  - - [14336, 3072, 1, 256]
    - [114, 4824.09]
  - - [2304, 2049, 1, 256]
    - [131, 4226.29]
  - - [19456, 7168, 1, 256]
    - [114, 4884.49]
  - - [38656, 512, 1, 256]
    - [114, 4723.6]
  - - [13312, 9216, 1, 256]
    - [114, 4860.1]
  - - [10496, 7424, 1, 256]
    - [108, 4892.79]
  - - [22272, 768, 1, 256]
    - [108, 4747.24]
  - - [24064, 1792, 1, 256]
    - [108, 4850.1]
  - - [16896, 1792, 1, 256]
    - [108, 4830.53]
  - - [27904, 15616, 1, 256]
    - [108, 4921.71]
  - - [37888, 3072, 1, 256]
    - [114, 4871.17]
  - - [512, 257, 1, 256]
    - [118, 1382.82]
  - - [36096, 1792, 1, 256]
    - [108, 4891.04]
  - - [13056, 513, 1, 256]
    - [110, 4173.45]
  - - [12544, 768, 1, 256]
    - [114, 4615.34]
  - - [36608, 24065, 1, 256]
    - [114, 4840.03]
  - - [40704, 3072, 1, 256]
    - [114, 4888.03]
  - - [28928, 16640, 1, 256]
    - [108, 4934.13]
  - - [24576, 12288, 1, 256]
    - [114, 4898.05]
  - - [13056, 1536, 1, 256]
    - [114, 4747.92]
  - - [2304, 1024, 1, 256]
    - [108, 4309.22]
  - - [33280, 9216, 1, 256]
    - [114, 4891.76]
  - - [18944, 1280, 1, 256]
    - [108, 4790.38]
  - - [17152, 3072, 1, 256]
    - [114, 4836.94]
  - - [17152, 4864, 1, 256]
    - [108, 4889.87]
  - - [6912, 1280, 1, 256]
    - [114, 4604.26]
  - - [34304, 768, 1, 256]
    - [108, 4814.29]
  - - [33280, 1024, 1, 256]
    - [114, 4812.74]
  - - [13568, 1280, 1, 256]
    - [108, 4733.57]
  - - [32768, 768, 1, 256]
    - [108, 4804.93]
  - - [42496, 9216, 1, 256]
    - [114, 4886.31]
  - - [2304, 1280, 1, 256]
    - [108, 4251.95]
  - - [30464, 2048, 1, 256]
    - [114, 4850.85]
  - - [32256, 768, 1, 256]
    - [108, 4784.81]
  - - [4352, 1792, 1, 256]
    - [108, 4604.02]
  - - [5632, 768, 1, 256]
    - [131, 4336.9]
  - - [40704, 513, 1, 256]
    - [110, 4413.45]
  - - [30464, 1280, 1, 256]
    - [108, 4841.8]
  - - [27392, 1281, 1, 256]
    - [111, 4664.95]
  - - [22016, 1281, 1, 256]
    - [111, 4651.0]
  - - [20736, 768, 1, 256]
    - [108, 4729.1]
  - - [19712, 768, 1, 256]
    - [108, 4712.01]
  - - [13312, 1024, 1, 256]
    - [114, 4669.82]
  - - [33536, 20993, 1, 256]
    - [114, 4834.34]
  - - [11520, 8448, 1, 256]
    - [108, 4902.51]
  - - [25088, 1792, 1, 256]
    - [108, 4857.58]
  - - [2816, 3072, 1, 256]
    - [121, 4520.32]
  - - [3584, 3072, 1, 256]
    - [114, 4597.1]
  - - [4608, 1537, 1, 256]
    - [114, 4345.93]
  - - [24832, 1280, 1, 256]
    - [108, 4828.36]
  - - [44032, 9216, 1, 256]
    - [114, 4893.46]
  - - [41216, 1024, 1, 256]
    - [114, 4826.03]
  - - [33792, 21249, 1, 256]
    - [108, 4899.04]
  - - [15360, 1792, 1, 256]
    - [114, 4811.56]
  - - [16384, 768, 1, 256]
    - [108, 4673.05]
  - - [29184, 1280, 1, 256]
    - [108, 4853.93]
  - - [32512, 20225, 1, 256]
    - [108, 4902.47]
  - - [6400, 1281, 1, 256]
    - [108, 4398.88]
  - - [38656, 9216, 1, 256]
    - [114, 4902.8]
  - - [17664, 5377, 1, 256]
    - [108, 4837.32]
  - - [7168, 512, 1, 256]
    - [129, 4334.4]
  - - [19456, 7169, 1, 256]
    - [114, 4793.95]
  - - [32000, 2048, 1, 256]
    - [114, 4852.72]
  - - [8448, 5121, 1, 256]
    - [114, 4725.93]
  - - [23040, 9216, 1, 256]
    - [114, 4887.59]
  - - [29440, 17152, 1, 256]
    - [108, 4934.14]
  - - [19968, 2048, 1, 256]
    - [114, 4830.65]
  - - [18688, 1281, 1, 256]
    - [111, 4631.27]
  - - [40448, 513, 1, 256]
    - [111, 4409.87]
  - - [6912, 256, 1, 256]
    - [125, 4017.25]
  - - [41472, 1792, 1, 256]
    - [108, 4896.83]
  - - [17920, 3072, 1, 256]
    - [114, 4836.86]
  - - [30976, 768, 1, 256]
    - [108, 4790.55]
  - - [43008, 9216, 1, 256]
    - [114, 4901.51]
  - - [6144, 3072, 1, 256]
    - [114, 4723.02]
  - - [35072, 9216, 1, 256]
    - [114, 4891.49]
  - - [34816, 22273, 1, 256]
    - [108, 4892.51]
  - - [37120, 768, 1, 256]
    - [108, 4812.77]
  - - [35072, 22785, 1, 256]
    - [108, 4901.44]
  - - [23296, 1281, 1, 256]
    - [111, 4646.96]
  - - [39168, 9216, 1, 256]
    - [114, 4897.2]
  - - [35840, 1536, 1, 256]
    - [114, 4841.78]
  - - [42752, 2817, 1, 256]
    - [108, 4797.21]
  - - [11776, 3072, 1, 256]
    - [114, 4794.78]
  - - [17152, 1536, 1, 256]
    - [114, 4774.35]
  - - [24832, 256, 1, 256]
    - [108, 4446.42]
  - - [10752, 256, 1, 256]
    - [114, 4187.32]
  - - [21504, 2048, 1, 256]
    - [114, 4831.04]
  - - [24832, 12289, 1, 256]
    - [114, 4823.09]
  - - [35328, 2048, 1, 256]
    - [114, 4853.94]
  - - [22272, 1281, 1, 256]
    - [105, 4640.39]
  - - [6656, 3329, 1, 256]
    - [108, 4653.02]
  - - [34560, 1024, 1, 256]
    - [114, 4821.96]
  - - [24576, 12033, 1, 256]
    - [108, 4874.31]
  - - [6400, 1536, 1, 256]
    - [114, 4559.03]
  - - [32512, 3072, 1, 256]
    - [114, 4867.81]
  - - [22528, 2048, 1, 256]
    - [114, 4828.53]
  - - [41216, 256, 1, 256]
    - [114, 4678.09]
  - - [25088, 1024, 1, 256]
    - [114, 4765.98]
  - - [37120, 1024, 1, 256]
    - [114, 4811.31]
  - - [13056, 1281, 1, 256]
    - [110, 4562.98]
  - - [30976, 3072, 1, 256]
    - [114, 4860.63]
  - - [22016, 9473, 1, 256]
    - [108, 4855.58]
  - - [19968, 1792, 1, 256]
    - [108, 4844.8]
  - - [29440, 3072, 1, 256]
    - [114, 4856.15]
  - - [15872, 1280, 1, 256]
    - [108, 4759.28]
  - - [27904, 1280, 1, 256]
    - [108, 4836.85]
  - - [3840, 256, 1, 256]
    - [102, 3787.75]
  - - [39936, 1024, 1, 256]
    - [114, 4826.91]
  - - [10752, 512, 1, 256]
    - [114, 4483.6]
  - - [43776, 3840, 1, 256]
    - [108, 4923.43]
  - - [41472, 768, 1, 256]
    - [108, 4838.66]
  - - [8192, 1792, 1, 256]
    - [108, 4690.12]
  - - [35840, 3072, 1, 256]
    - [114, 4873.45]
  - - [8704, 3072, 1, 256]
    - [114, 4761.75]
  - - [34048, 512, 1, 256]
    - [114, 4719.68]
  - - [36864, 1280, 1, 256]
    - [108, 4863.2]
  - - [9728, 1792, 1, 256]
    - [108, 4736.31]
  - - [15872, 512, 1, 256]
    - [114, 4563.83]
  - - [38144, 1281, 1, 256]
    - [110, 4690.14]
  - - [22272, 9729, 1, 256]
    - [114, 4813.35]
  - - [28928, 2048, 1, 256]
    - [114, 4843.7]
  - - [21504, 1281, 1, 256]
    - [111, 4643.1]
  - - [32768, 3072, 1, 256]
    - [114, 4867.19]
  - - [3072, 2048, 1, 256]
    - [114, 4566.27]
  - - [256, 256, 1, 256]
    - [118, 632.625]
  - - [43520, 27648, 1, 256]
    - [114, 4906.5]
  - - [36864, 24576, 1, 256]
    - [114, 4903.25]
  - - [31232, 1281, 1, 256]
    - [111, 4674.37]
  - - [14080, 768, 1, 256]
    - [108, 4652.82]
  - - [27648, 2048, 1, 256]
    - [114, 4849.95]
  - - [9984, 1536, 1, 256]
    - [114, 4692.65]
  - - [31232, 2048, 1, 256]
    - [114, 4854.89]
  - - [11520, 1792, 1, 256]
    - [108, 4777.98]
  - - [10752, 2048, 1, 256]
    - [114, 4751.31]
  - - [12032, 8961, 1, 256]
    - [108, 4852.6]
  - - [11776, 256, 1, 256]
    - [108, 4288.46]
  - - [1792, 256, 1, 256]
    - [117, 3284.13]
  - - [38144, 2048, 1, 256]
    - [114, 4871.02]
  - - [37632, 2048, 1, 256]
    - [114, 4869.11]
  - - [4352, 768, 1, 256]
    - [121, 4281.62]
  - - [38400, 25857, 1, 256]
    - [108, 4897.25]
  - - [38144, 1024, 1, 256]
    - [114, 4819.18]
  - - [20224, 7937, 1, 256]
    - [108, 4859.3]
  - - [10240, 2048, 1, 256]
    - [114, 4727.81]
  - - [34304, 21761, 1, 256]
    - [108, 4892.21]
  - - [30720, 18432, 1, 256]
    - [114, 4899.21]
  - - [31744, 9216, 1, 256]
    - [114, 4889.27]
  - - [26368, 2048, 1, 256]
    - [114, 4828.31]
  - - [35072, 2048, 1, 256]
    - [114, 4855.72]
  - - [27136, 14848, 1, 256]
    - [114, 4882.42]
  - - [36096, 512, 1, 256]
    - [114, 4731.93]
  - - [29952, 2048, 1, 256]
    - [114, 4846.75]
  - - [34048, 9216, 1, 256]
    - [114, 4894.39]
  - - [20992, 2048, 1, 256]
    - [114, 4808.23]
  - - [32256, 2048, 1, 256]
    - [114, 4867.67]
  - - [3584, 257, 1, 256]
    - [96, 3504.73]
  - - [19200, 2048, 1, 256]
    - [114, 4824.74]
  - - [18688, 6145, 1, 256]
    - [114, 4780.18]
  - - [24320, 1280, 1, 256]
    - [108, 4828.99]
  - - [36352, 256, 1, 256]
    - [108, 4625.59]
  - - [36096, 768, 1, 256]
    - [108, 4816.07]
  - - [7168, 1536, 1, 256]
    - [114, 4589.61]
  - - [25344, 9216, 1, 256]
    - [114, 4882.39]
  - - [39168, 512, 1, 256]
    - [114, 4729.9]
  - - [36608, 9216, 1, 256]
    - [114, 4889.4]
  - - [14848, 1792, 1, 256]
    - [108, 4790.66]
  - - [35584, 9216, 1, 256]
    - [114, 4887.44]
  - - [29952, 17664, 1, 256]
    - [108, 4929.28]
  - - [34816, 1792, 1, 256]
    - [108, 4871.33]
  - - [38912, 1280, 1, 256]
    - [108, 4864.3]
  - - [24064, 2048, 1, 256]
    - [114, 4830.71]
  - - [24064, 11776, 1, 256]
    - [114, 4879.99]
  - - [18176, 512, 1, 256]
    - [114, 4587.47]
  - - [11264, 1280, 1, 256]
    - [108, 4714.39]
  - - [34048, 1792, 1, 256]
    - [108, 4879.05]
  - - [5376, 1792, 1, 256]
    - [108, 4617.06]
  - - [36608, 512, 1, 256]
    - [114, 4713.81]
  - - [6656, 1281, 1, 256]
    - [111, 4424.96]
  - - [18432, 1024, 1, 256]
    - [114, 4742.68]
  - - [40448, 3072, 1, 256]
    - [114, 4886.15]
  - - [18688, 6401, 1, 256]
    - [108, 4845.17]
  - - [20480, 1536, 1, 256]
    - [114, 4788.82]
  - - [18432, 3072, 1, 256]
    - [114, 4849.62]
  - - [20224, 768, 1, 256]
    - [114, 4724.12]
  - - [32512, 9216, 1, 256]
    - [114, 4888.11]
  - - [14080, 1281, 1, 256]
    - [111, 4575.97]
  - - [3072, 1536, 1, 256]
    - [108, 4476.58]
  - - [26112, 512, 1, 256]
    - [114, 4656.03]
  - - [10496, 1281, 1, 256]
    - [111, 4546.2]
  - - [15616, 2048, 1, 256]
    - [114, 4783.97]
  - - [12800, 1024, 1, 256]
    - [114, 4647.69]
  - - [12544, 256, 1, 256]
    - [129, 4123.61]
  - - [25344, 768, 1, 256]
    - [108, 4771.55]
  - - [10240, 512, 1, 256]
    - [131, 4417.96]
  - - [8448, 2048, 1, 256]
    - [114, 4719.13]
  - - [36608, 24320, 1, 256]
    - [108, 4935.73]
  - - [34816, 9216, 1, 256]
    - [114, 4895.78]
  - - [14080, 512, 1, 256]
    - [114, 4492.88]
  - - [3072, 1792, 1, 256]
    - [108, 4571.45]
  - - [41216, 27648, 1, 256]
    - [114, 4899.76]
  - - [30464, 9216, 1, 256]
    - [114, 4893.89]
  - - [33024, 1281, 1, 256]
    - [111, 4682.45]
  - - [31488, 1536, 1, 256]
    - [114, 4841.1]
  - - [7424, 3072, 1, 256]
    - [114, 4749.2]
  - - [37888, 512, 1, 256]
    - [114, 4722.38]
  - - [20480, 1792, 1, 256]
    - [108, 4838.22]
  - - [41984, 1793, 1, 256]
    - [108, 4695.02]
  - - [18688, 1792, 1, 256]
    - [108, 4831.58]
  - - [13824, 1792, 1, 256]
    - [108, 4812.84]
  - - [15360, 1280, 1, 256]
    - [108, 4782.01]
  - - [38144, 3072, 1, 256]
    - [114, 4873.64]
  - - [33280, 3072, 1, 256]
    - [114, 4869.98]
  - - [35584, 23296, 1, 256]
    - [108, 4935.36]
  - - [43520, 768, 1, 256]
    - [108, 4836.96]
  - - [25856, 256, 1, 256]
    - [114, 4573.79]
  - - [40704, 1536, 1, 256]
    - [114, 4853.38]
  - - [29696, 3072, 1, 256]
    - [114, 4868.03]
  - - [32256, 19969, 1, 256]
    - [114, 4845.33]
  - - [39424, 1281, 1, 256]
    - [111, 4689.83]
  - - [40960, 9216, 1, 256]
    - [114, 4892.67]
  - - [16640, 2048, 1, 256]
    - [114, 4795.39]
  - - [37632, 9216, 1, 256]
    - [114, 4894.44]
  - - [37888, 1281, 1, 256]
    - [111, 4682.82]
  - - [26112, 256, 1, 256]
    - [114, 4607.64]
  - - [42240, 2305, 1, 256]
    - [108, 4774.17]
  - - [43008, 1024, 1, 256]
    - [114, 4822.03]
  - - [7424, 1024, 1, 256]
    - [114, 4495.84]
  - - [17920, 5377, 1, 256]
    - [108, 4811.96]
  - - [2816, 1281, 1, 256]
    - [108, 4130.74]
  - - [37376, 1280, 1, 256]
    - [108, 4868.1]
  - - [41984, 2048, 1, 256]
    - [114, 4861.97]
  - - [27904, 9216, 1, 256]
    - [114, 4887.35]
  - - [20736, 1024, 1, 256]
    - [114, 4749.76]
  - - [34304, 22016, 1, 256]
    - [114, 4895.41]
  - - [33792, 256, 1, 256]
    - [108, 4611.04]
  - - [13824, 2048, 1, 256]
    - [114, 4787.66]
  - - [11776, 8705, 1, 256]
    - [114, 4790.23]
  - - [22272, 1536, 1, 256]
    - [114, 4811.82]
  - - [25856, 9216, 1, 256]
    - [114, 4884.75]
  - - [19712, 3072, 1, 256]
    - [114, 4843.69]
  - - [20480, 1281, 1, 256]
    - [111, 4632.71]
  - - [17408, 1280, 1, 256]
    - [108, 4780.31]
  - - [40192, 2048, 1, 256]
    - [114, 4860.72]
  - - [41472, 9216, 1, 256]
    - [114, 4899.81]
  - - [40704, 2048, 1, 256]
    - [114, 4878.57]
  - - [35840, 256, 1, 256]
    - [108, 4592.18]
  - - [42496, 27648, 1, 256]
    - [114, 4903.41]
  - - [21248, 2048, 1, 256]
    - [114, 4818.54]
  - - [35072, 3072, 1, 256]
    - [114, 4867.46]
  - - [4608, 1281, 1, 256]
    - [108, 4311.11]
  - - [44288, 4352, 1, 256]
    - [108, 4920.3]
  - - [8192, 512, 1, 256]
    - [114, 4352.07]
  - - [38400, 256, 1, 256]
    - [108, 4621.99]
  - - [5888, 512, 1, 256]
    - [114, 4218.15]
  - - [41984, 1792, 1, 256]
    - [108, 4888.54]
  - - [42496, 2561, 1, 256]
    - [114, 4719.75]
  - - [9984, 6657, 1, 256]
    - [114, 4765.05]
  - - [43008, 3073, 1, 256]
    - [114, 4743.42]
  - - [4096, 2048, 1, 256]
    - [114, 4532.86]
  - - [36352, 24065, 1, 256]
    - [114, 4842.01]
  - - [4608, 2048, 1, 256]
    - [114, 4623.6]
  - - [24832, 3072, 1, 256]
    - [114, 4858.32]
  - - [25088, 1280, 1, 256]
    - [108, 4825.0]
  - - [29184, 16641, 1, 256]
    - [108, 4889.54]
  - - [1024, 2048, 1, 256]
    - [119, 4176.03]
  - - [37888, 1024, 1, 256]
    - [114, 4803.78]
  - - [768, 768, 1, 256]
    - [93, 3218.14]
  - - [24832, 2048, 1, 256]
    - [114, 4836.66]
  - - [42240, 27648, 1, 256]
    - [114, 4904.08]
  - - [8192, 5120, 1, 256]
    - [114, 4813.69]
  - - [31744, 1280, 1, 256]
    - [108, 4847.82]
  - - [9984, 1792, 1, 256]
    - [108, 4755.76]
  - - [13312, 1280, 1, 256]
    - [108, 4718.21]
  - - [44288, 3072, 1, 256]
    - [114, 4885.06]
  - - [18432, 6144, 1, 256]
    - [114, 4875.85]
  - - [23808, 1792, 1, 256]
    - [108, 4858.7]
  - - [32512, 1280, 1, 256]
    - [108, 4850.36]
  - - [11008, 768, 1, 256]
    - [108, 4586.85]
  - - [10752, 1280, 1, 256]
    - [108, 4714.21]
  - - [28672, 16129, 1, 256]
    - [108, 4885.81]
  - - [17920, 9216, 1, 256]
    - [114, 4870.8]
  - - [33536, 256, 1, 256]
    - [108, 4648.51]
  - - [25088, 12801, 1, 256]
    - [114, 4823.45]
  - - [19712, 9216, 1, 256]
    - [114, 4879.59]
  - - [40192, 256, 1, 256]
    - [114, 4612.35]
  - - [7680, 2048, 1, 256]
    - [114, 4716.24]
  - - [15616, 1281, 1, 256]
    - [111, 4599.8]
  - - [31744, 19457, 1, 256]
    - [114, 4843.61]
  - - [36864, 1792, 1, 256]
    - [108, 4887.47]
  - - [42496, 1792, 1, 256]
    - [108, 4894.83]
  - - [41216, 3072, 1, 256]
    - [114, 4876.45]
  - - [39936, 9216, 1, 256]
    - [114, 4900.98]
  - - [3840, 512, 1, 256]
    - [108, 4238.1]
  - - [8960, 1792, 1, 256]
    - [108, 4744.25]
  - - [44288, 2048, 1, 256]
    - [114, 4861.86]
  - - [13824, 1281, 1, 256]
    - [111, 4560.02]
  - - [6144, 2048, 1, 256]
    - [114, 4659.8]
  - - [7936, 4864, 1, 256]
    - [108, 4829.9]
  - - [5632, 2048, 1, 256]
    - [114, 4601.37]
  - - [27648, 1280, 1, 256]
    - [108, 4845.38]
  - - [18176, 256, 1, 256]
    - [114, 4485.55]
  - - [17664, 5121, 1, 256]
    - [114, 4777.53]
  - - [8704, 5632, 1, 256]
    - [114, 4816.97]
  - - [38144, 25601, 1, 256]
    - [114, 4847.92]
  - - [27136, 14849, 1, 256]
    - [114, 4826.41]
  - - [31744, 19456, 1, 256]
    - [114, 4900.55]
  - - [5376, 1280, 1, 256]
    - [108, 4535.08]
  - - [33024, 3072, 1, 256]
    - [114, 4872.23]
  - - [37888, 9216, 1, 256]
    - [114, 4895.39]
  - - [17664, 1792, 1, 256]
    - [108, 4830.93]
  - - [6912, 1792, 1, 256]
    - [108, 4681.81]
  - - [28672, 768, 1, 256]
    - [108, 4788.6]
  - - [32768, 1281, 1, 256]
    - [111, 4679.42]
  - - [39168, 1024, 1, 256]
    - [114, 4816.52]
  - - [11520, 1281, 1, 256]
    - [111, 4557.96]
  - - [42240, 2049, 1, 256]
    - [114, 4679.87]
  - - [34048, 3072, 1, 256]
    - [114, 4872.45]
  - - [10752, 7680, 1, 256]
    - [114, 4863.32]
  - - [37120, 9216, 1, 256]
    - [114, 4891.69]
  - - [14080, 9216, 1, 256]
    - [114, 4872.18]
  - - [38400, 1792, 1, 256]
    - [108, 4891.83]
  - - [43776, 9216, 1, 256]
    - [114, 4902.59]
  - - [26624, 768, 1, 256]
    - [108, 4778.09]
  - - [14336, 2049, 1, 256]
    - [114, 4620.67]
  - - [32512, 1281, 1, 256]
    - [111, 4672.07]
  - - [37120, 24577, 1, 256]
    - [114, 4847.11]
  - - [38400, 1024, 1, 256]
    - [114, 4818.45]
  - - [6144, 1281, 1, 256]
    - [108, 4402.29]
  - - [32768, 2048, 1, 256]
    - [114, 4859.33]
  - - [28672, 1280, 1, 256]
    - [108, 4839.72]
  - - [30976, 18433, 1, 256]
    - [114, 4838.9]
  - - [5632, 1024, 1, 256]
    - [131, 4464.19]
  - - [37632, 3072, 1, 256]
    - [114, 4876.2]
  - - [34560, 1792, 1, 256]
    - [108, 4888.65]
  - - [5120, 3072, 1, 256]
    - [114, 4658.62]
  - - [21760, 9217, 1, 256]
    - [114, 4809.15]
  - - [5120, 1280, 1, 256]
    - [114, 4533.9]
  - - [24064, 11521, 1, 256]
    - [108, 4867.25]
  - - [10496, 512, 1, 256]
    - [114, 4436.13]
  - - [35328, 1280, 1, 256]
    - [108, 4864.56]
  - - [7936, 3072, 1, 256]
    - [114, 4747.84]
  - - [30720, 1280, 1, 256]
    - [108, 4850.59]
  - - [21760, 9472, 1, 256]
    - [108, 4918.98]
  - - [9216, 6145, 1, 256]
    - [114, 4762.4]
  - - [37376, 2048, 1, 256]
    - [114, 4854.53]
  - - [8192, 1536, 1, 256]
    - [114, 4635.92]
  - - [39936, 27648, 1, 256]
    - [114, 4907.0]
  - - [21248, 9216, 1, 256]
    - [114, 4894.56]
  - - [5376, 2049, 1, 256]
    - [114, 4484.37]
  - - [35072, 22529, 1, 256]
    - [114, 4844.15]
  - - [13312, 769, 1, 256]
    - [111, 4270.95]
  - - [35840, 9216, 1, 256]
    - [114, 4891.77]
  - - [7936, 1024, 1, 256]
    - [114, 4575.47]
  - - [12544, 512, 1, 256]
    - [114, 4439.86]
  - - [27392, 1280, 1, 256]
    - [108, 4838.5]
  - - [39424, 27136, 1, 256]
    - [114, 4889.6]
  - - [26368, 9216, 1, 256]
    - [114, 4886.88]
  - - [34048, 21505, 1, 256]
    - [114, 4847.42]
  - - [23040, 1024, 1, 256]
    - [114, 4756.65]
  - - [29440, 1536, 1, 256]
    - [114, 4828.84]
  - - [38912, 768, 1, 256]
    - [108, 4824.69]
  - - [7680, 512, 1, 256]
    - [131, 4315.87]
  - - [4096, 512, 1, 256]
    - [128, 4127.24]
  - - [38400, 2048, 1, 256]
    - [114, 4853.54]
  - - [26112, 1792, 1, 256]
    - [108, 4861.97]
  - - [23296, 768, 1, 256]
    - [108, 4740.41]
  - - [3328, 3072, 1, 256]
    - [114, 4541.0]
  - - [3584, 1281, 1, 256]
    - [110, 4312.8]
  - - [43264, 27648, 1, 256]
    - [114, 4898.14]
  - - [40960, 256, 1, 256]
    - [114, 4659.04]
  - - [18432, 9216, 1, 256]
    - [114, 4890.59]
  - - [29952, 1280, 1, 256]
    - [108, 4851.35]
  - - [43264, 1281, 1, 256]
    - [111, 4693.6]
  - - [38912, 3072, 1, 256]
    - [114, 4876.6]
  - - [9216, 6144, 1, 256]
    - [114, 4846.83]
  - - [30464, 17921, 1, 256]
    - [114, 4835.83]
  - - [37376, 9216, 1, 256]
    - [114, 4896.53]
  - - [256, 3072, 1, 256]
    - [119, 3804.38]
  - - [34048, 2048, 1, 256]
    - [114, 4850.28]
  - - [9472, 3072, 1, 256]
    - [114, 4781.43]
  - - [26624, 1280, 1, 256]
    - [108, 4830.76]
  - - [35840, 23552, 1, 256]
    - [114, 4907.63]
  - - [8960, 3072, 1, 256]
    - [114, 4780.35]
  - - [27904, 2048, 1, 256]
    - [114, 4839.6]
  - - [22016, 256, 1, 256]
    - [108, 4437.32]
  - - [34816, 3072, 1, 256]
    - [114, 4875.29]
  - - [11008, 3072, 1, 256]
    - [114, 4805.41]
  - - [36864, 1536, 1, 256]
    - [114, 4848.52]
  - - [24064, 1281, 1, 256]
    - [111, 4650.89]
  - - [23552, 9216, 1, 256]
    - [114, 4888.89]
  - - [31232, 18945, 1, 256]
    - [114, 4838.36]
  - - [27136, 9216, 1, 256]
    - [114, 4883.27]
  - - [19968, 7681, 1, 256]
    - [114, 4818.33]
  - - [31488, 18945, 1, 256]
    - [114, 4844.6]
  - - [33280, 1792, 1, 256]
    - [108, 4879.84]
  - - [38912, 1281, 1, 256]
    - [111, 4689.14]
  - - [42240, 2048, 1, 256]
    - [114, 4865.23]
  - - [14592, 3072, 1, 256]
    - [114, 4830.86]
  - - [30976, 18689, 1, 256]
    - [108, 4903.0]
  - - [4096, 769, 1, 256]
    - [108, 3969.07]
  - - [31488, 3072, 1, 256]
    - [114, 4874.33]
  - - [28416, 1281, 1, 256]
    - [111, 4667.81]
  - - [22528, 1024, 1, 256]
    - [114, 4751.83]
  - - [3584, 256, 1, 256]
    - [102, 3618.01]
  - - [33024, 1792, 1, 256]
    - [108, 4884.02]
  - - [42752, 2816, 1, 256]
    - [108, 4908.95]
  - - [11520, 8449, 1, 256]
    - [108, 4858.43]
  - - [4864, 1281, 1, 256]
    - [110, 4303.12]
  - - [14592, 768, 1, 256]
    - [108, 4650.37]
  - - [7424, 1792, 1, 256]
    - [108, 4706.71]
  - - [44544, 4353, 1, 256]
    - [108, 4823.01]
  - - [37120, 3072, 1, 256]
    - [114, 4881.63]
  - - [18176, 5889, 1, 256]
    - [108, 4839.47]
  - - [5632, 2305, 1, 256]
    - [108, 4534.62]
  - - [39936, 27393, 1, 256]
    - [108, 4895.56]
  - - [10240, 7169, 1, 256]
    - [114, 4766.24]
  - - [39168, 26625, 1, 256]
    - [114, 4841.65]
  - - [10752, 7681, 1, 256]
    - [114, 4785.3]
  - - [13824, 1536, 1, 256]
    - [114, 4727.78]
  - - [21760, 1280, 1, 256]
    - [108, 4811.41]
  - - [20480, 768, 1, 256]
    - [108, 4730.42]
  - - [18688, 768, 1, 256]
    - [108, 4713.67]
  - - [14336, 9216, 1, 256]
    - [114, 4871.65]
  - - [40960, 768, 1, 256]
    - [108, 4831.68]
  - - [37632, 25345, 1, 256]
    - [108, 4905.13]
  - - [35840, 23553, 1, 256]
    - [114, 4846.37]
  - - [21760, 1024, 1, 256]
    - [114, 4755.45]
  - - [6656, 3584, 1, 256]
    - [114, 4752.9]
  - - [44544, 2048, 1, 256]
    - [114, 4870.47]
  - - [16640, 1281, 1, 256]
    - [110, 4606.03]
  - - [4608, 3072, 1, 256]
    - [114, 4696.34]
  - - [34816, 1024, 1, 256]
    - [114, 4804.29]
  - - [35840, 1280, 1, 256]
    - [108, 4865.78]
  - - [23552, 3072, 1, 256]
    - [114, 4863.27]
  - - [2048, 512, 1, 256]
    - [97, 3963.9]
  - - [39680, 2048, 1, 256]
    - [114, 4870.29]
  - - [41984, 1280, 1, 256]
    - [108, 4871.85]
  - - [19712, 7169, 1, 256]
    - [114, 4788.68]
  - - [8448, 768, 1, 256]
    - [108, 4508.54]
  - - [5888, 2561, 1, 256]
    - [114, 4539.78]
  - - [27136, 768, 1, 256]
    - [108, 4778.89]
  - - [22272, 1792, 1, 256]
    - [108, 4859.93]
  - - [11008, 1281, 1, 256]
    - [111, 4535.76]
  - - [12800, 9216, 1, 256]
    - [114, 4872.5]
  - - [15616, 1536, 1, 256]
    - [114, 4752.68]
  - - [6912, 1281, 1, 256]
    - [110, 4462.0]
  - - [7424, 256, 1, 256]
    - [114, 4157.03]
  - - [3840, 769, 1, 256]
    - [94, 3939.75]
  - - [42240, 2304, 1, 256]
    - [108, 4900.7]
  - - [38144, 1280, 1, 256]
    - [108, 4863.51]
  - - [13056, 1280, 1, 256]
    - [108, 4745.74]
  - - [24576, 3072, 1, 256]
    - [114, 4859.2]
  - - [12288, 768, 1, 256]
    - [114, 4656.03]
  - - [36864, 2048, 1, 256]
    - [114, 4862.62]
  - - [26880, 1024, 1, 256]
    - [114, 4787.24]
  - - [27136, 1536, 1, 256]
    - [114, 4811.3]
  - - [25344, 12801, 1, 256]
    - [114, 4830.13]
  - - [32512, 20224, 1, 256]
    - [108, 4932.38]
  - - [17664, 3072, 1, 256]
    - [114, 4837.22]
  - - [7168, 1280, 1, 256]
    - [114, 4578.93]
  - - [38656, 256, 1, 256]
    - [114, 4605.1]
  - - [43520, 3329, 1, 256]
    - [108, 4800.04]
  - - [28160, 15873, 1, 256]
    - [114, 4830.4]
  - - [31488, 1281, 1, 256]
    - [111, 4682.68]
  - - [40960, 3072, 1, 256]
    - [114, 4879.34]
  - - [43520, 1024, 1, 256]
    - [114, 4829.04]
  - - [14592, 9216, 1, 256]
    - [114, 4887.21]
  - - [43008, 1281, 1, 256]
    - [111, 4685.92]
  - - [9472, 1792, 1, 256]
    - [108, 4722.95]
  - - [22784, 10497, 1, 256]
    - [108, 4876.48]
  - - [22272, 3072, 1, 256]
    - [114, 4864.26]
  - - [9728, 1280, 1, 256]
    - [108, 4686.37]
  - - [28416, 512, 1, 256]
    - [114, 4680.48]
  - - [8704, 512, 1, 256]
    - [131, 4306.4]
  - - [39680, 27137, 1, 256]
    - [114, 4847.26]
  - - [20992, 8704, 1, 256]
    - [114, 4880.72]
  - - [42240, 256, 1, 256]
    - [114, 4655.32]
  - - [24320, 1536, 1, 256]
    - [114, 4798.49]
  - - [7936, 4865, 1, 256]
    - [108, 4752.93]
  - - [17664, 5376, 1, 256]
    - [108, 4904.29]
  - - [25344, 2048, 1, 256]
    - [114, 4849.12]
  - - [3584, 2048, 1, 256]
    - [114, 4542.72]
  - - [30464, 1281, 1, 256]
    - [111, 4671.48]
  - - [37888, 25345, 1, 256]
    - [108, 4894.89]
  - - [8192, 1024, 1, 256]
    - [114, 4530.56]
  - - [23296, 10753, 1, 256]
    - [114, 4826.99]
  - - [28416, 15873, 1, 256]
    - [114, 4836.68]
  - - [27648, 15361, 1, 256]
    - [114, 4822.2]
  - - [19200, 1281, 1, 256]
    - [111, 4632.95]
  - - [30208, 1280, 1, 256]
    - [108, 4845.96]
  - - [27136, 3072, 1, 256]
    - [114, 4875.85]
  - - [29952, 1792, 1, 256]
    - [108, 4880.7]
  - - [16128, 1281, 1, 256]
    - [111, 4599.09]
  - - [18432, 1280, 1, 256]
    - [108, 4801.57]
  - - [16896, 1280, 1, 256]
    - [108, 4788.18]
  - - [26112, 1280, 1, 256]
    - [108, 4842.87]
  - - [36608, 3072, 1, 256]
    - [114, 4875.94]
  - - [39424, 1536, 1, 256]
    - [114, 4824.04]
  - - [12032, 256, 1, 256]
    - [108, 4325.92]
  - - [3584, 512, 1, 256]
    - [129, 4125.06]
  - - [15104, 2817, 1, 256]
    - [108, 4742.7]
  - - [25344, 1792, 1, 256]
    - [108, 4864.85]
  - - [19456, 9216, 1, 256]
    - [114, 4879.84]
  - - [24064, 11777, 1, 256]
    - [114, 4820.62]
  - - [13824, 256, 1, 256]
    - [108, 4455.0]
  - - [29696, 1792, 1, 256]
    - [108, 4872.77]
  - - [24576, 768, 1, 256]
    - [114, 4769.64]
  - - [42496, 512, 1, 256]
    - [114, 4725.82]
  - - [27904, 256, 1, 256]
    - [114, 4506.0]
  - - [40448, 1536, 1, 256]
    - [114, 4845.48]
  - - [22784, 1280, 1, 256]
    - [108, 4821.54]
  - - [37376, 1024, 1, 256]
    - [114, 4817.72]
  - - [4864, 1280, 1, 256]
    - [114, 4557.46]
  - - [14336, 512, 1, 256]
    - [114, 4526.95]
  - - [512, 3072, 1, 256]
    - [121, 4144.24]
  - - [34560, 1280, 1, 256]
    - [108, 4859.02]
  - - [5632, 2560, 1, 256]
    - [114, 4668.12]
  - - [38912, 9216, 1, 256]
    - [114, 4895.17]
  - - [18688, 1024, 1, 256]
    - [114, 4720.15]
  - - [35584, 256, 1, 256]
    - [108, 4579.08]
  - - [5632, 256, 1, 256]
    - [107, 3755.58]
  - - [22016, 1024, 1, 256]
    - [114, 4742.44]
  - - [20480, 2048, 1, 256]
    - [114, 4814.04]
  - - [7680, 1281, 1, 256]
    - [111, 4456.66]
  - - [19456, 6913, 1, 256]
    - [108, 4836.99]
  - - [17408, 2048, 1, 256]
    - [114, 4802.17]
  - - [43776, 1024, 1, 256]
    - [114, 4830.86]
  - - [15104, 1281, 1, 256]
    - [111, 4588.62]
  - - [22272, 9216, 1, 256]
    - [114, 4894.25]
  - - [14848, 1281, 1, 256]
    - [111, 4595.14]
  - - [19968, 1280, 1, 256]
    - [108, 4815.93]
  - - [29440, 1792, 1, 256]
    - [108, 4870.7]
  - - [41984, 9216, 1, 256]
    - [114, 4895.96]
  - - [14080, 1793, 1, 256]
    - [108, 4621.33]
  - - [20992, 8449, 1, 256]
    - [108, 4848.84]
  - - [26880, 512, 1, 256]
    - [114, 4683.38]
  - - [17920, 768, 1, 256]
    - [108, 4677.66]
  - - [34304, 1280, 1, 256]
    - [108, 4859.64]
  - - [10496, 7169, 1, 256]
    - [114, 4778.13]
  - - [40704, 1280, 1, 256]
    - [108, 4877.38]
  - - [23552, 2048, 1, 256]
    - [114, 4831.07]
  - - [3328, 2048, 1, 256]
    - [114, 4483.59]
  - - [40704, 27648, 1, 256]
    - [114, 4903.84]
  - - [19968, 1024, 1, 256]
    - [114, 4741.04]
  - - [22784, 1281, 1, 256]
    - [111, 4663.86]
  - - [29440, 2048, 1, 256]
    - [114, 4839.24]
  - - [17152, 2048, 1, 256]
    - [114, 4791.04]
  - - [16384, 2048, 1, 256]
    - [114, 4791.67]
  - - [13568, 1025, 1, 256]
    - [111, 4422.0]
  - - [38144, 9216, 1, 256]
    - [114, 4895.66]
  - - [20992, 256, 1, 256]
    - [108, 4467.24]
  - - [24064, 1280, 1, 256]
    - [108, 4817.5]
  - - [2304, 768, 1, 256]
    - [119, 4083.9]
  - - [35328, 1024, 1, 256]
    - [114, 4815.93]
  - - [27392, 15104, 1, 256]
    - [108, 4926.56]
  - - [2304, 3072, 1, 256]
    - [108, 4589.05]
  - - [9472, 6401, 1, 256]
    - [108, 4803.77]
  - - [39424, 1792, 1, 256]
    - [108, 4889.02]
  - - [40960, 512, 1, 256]
    - [114, 4744.35]
  - - [41728, 768, 1, 256]
    - [108, 4829.33]
  - - [5376, 256, 1, 256]
    - [124, 3666.96]
  - - [8960, 1280, 1, 256]
    - [108, 4636.2]
  - - [26624, 256, 1, 256]
    - [108, 4495.13]
  - - [11264, 3072, 1, 256]
    - [114, 4801.7]
  - - [25344, 3072, 1, 256]
    - [114, 4859.97]
  - - [23296, 2048, 1, 256]
    - [114, 4824.85]
  - - [22784, 768, 1, 256]
    - [108, 4745.05]
  - - [35584, 512, 1, 256]
    - [114, 4717.85]
  - - [24576, 1792, 1, 256]
    - [108, 4860.61]
  - - [27392, 14849, 1, 256]
    - [114, 4830.35]
  - - [14848, 2561, 1, 256]
    - [114, 4666.81]
  - - [28160, 3072, 1, 256]
    - [114, 4866.17]
  - - [4864, 1792, 1, 256]
    - [108, 4563.87]
  - - [20736, 1281, 1, 256]
    - [110, 4637.64]
  - - [23552, 11009, 1, 256]
    - [108, 4862.25]
  - - [11776, 8449, 1, 256]
    - [108, 4828.41]
  - - [16640, 1792, 1, 256]
    - [108, 4831.66]
  - - [24576, 12289, 1, 256]
    - [114, 4819.88]
  - - [38656, 26369, 1, 256]
    - [108, 4904.67]
  - - [25088, 512, 1, 256]
    - [114, 4657.7]
  - - [5376, 2304, 1, 256]
    - [108, 4676.84]
  - - [30720, 1024, 1, 256]
    - [114, 4798.17]
  - - [13824, 9216, 1, 256]
    - [114, 4876.66]
  - - [28928, 1792, 1, 256]
    - [108, 4883.78]
  - - [36864, 1281, 1, 256]
    - [111, 4683.64]
  - - [25600, 1280, 1, 256]
    - [108, 4829.81]
  - - [27904, 15361, 1, 256]
    - [114, 4836.82]
  - - [34816, 512, 1, 256]
    - [114, 4711.92]
  - - [3840, 1792, 1, 256]
    - [114, 4533.22]
  - - [14848, 3072, 1, 256]
    - [114, 4834.37]
  - - [14848, 1280, 1, 256]
    - [108, 4757.12]
  - - [27904, 1536, 1, 256]
    - [114, 4821.12]
  - - [39936, 1536, 1, 256]
    - [114, 4839.05]
  - - [34816, 1536, 1, 256]
    - [114, 4821.58]
  - - [14592, 2305, 1, 256]
    - [108, 4701.87]
  - - [22528, 9985, 1, 256]
    - [108, 4859.84]
  - - [22784, 3072, 1, 256]
    - [114, 4850.27]
  - - [26368, 13825, 1, 256]
    - [114, 4825.12]
  - - [4096, 1792, 1, 256]
    - [108, 4563.9]
  - - [17152, 1280, 1, 256]
    - [114, 4775.33]
  - - [30720, 18177, 1, 256]
    - [108, 4890.33]
  - - [37120, 24833, 1, 256]
    - [108, 4910.65]
  - - [3840, 768, 1, 256]
    - [108, 4237.63]
  - - [1792, 1537, 1, 256]
    - [131, 4101.34]
  - - [16128, 2048, 1, 256]
    - [114, 4804.93]
  - - [6656, 2048, 1, 256]
    - [114, 4661.09]
  - - [15360, 2048, 1, 256]
    - [114, 4787.45]
  - - [24320, 3072, 1, 256]
    - [114, 4862.62]
  - - [17664, 1280, 1, 256]
    - [108, 4786.59]
  - - [12800, 1280, 1, 256]
    - [108, 4736.54]
  - - [4352, 1536, 1, 256]
    - [131, 4462.49]
  - - [41472, 1024, 1, 256]
    - [114, 4838.2]
  - - [9984, 256, 1, 256]
    - [130, 4170.78]
  - - [14592, 1281, 1, 256]
    - [111, 4574.98]
  - - [21248, 1281, 1, 256]
    - [111, 4632.35]
  - - [2560, 1536, 1, 256]
    - [119, 4337.44]
  - - [8960, 2048, 1, 256]
    - [114, 4725.79]
  - - [44032, 4097, 1, 256]
    - [114, 4772.58]
  - - [256, 257, 1, 256]
    - [127, 717.323]
  - - [34048, 1281, 1, 256]
    - [111, 4678.36]
  - - [44544, 27648, 1, 256]
    - [114, 4895.84]
  - - [34048, 21761, 1, 256]
    - [108, 4898.42]
  - - [26368, 1280, 1, 256]
    - [108, 4836.15]
  - - [24064, 1536, 1, 256]
    - [114, 4801.18]
  - - [24832, 12545, 1, 256]
    - [108, 4886.63]
  - - [44032, 3841, 1, 256]
    - [108, 4809.8]
  - - [22528, 9216, 1, 256]
    - [114, 4887.77]
  - - [40448, 257, 1, 256]
    - [110, 4067.55]
  - - [14592, 1280, 1, 256]
    - [114, 4757.34]
  - - [26624, 14337, 1, 256]
    - [114, 4827.0]
  - - [26368, 512, 1, 256]
    - [114, 4649.8]
  - - [19456, 1280, 1, 256]
    - [108, 4792.91]
  - - [8192, 5121, 1, 256]
    - [114, 4713.79]
  - - [26880, 3072, 1, 256]
    - [114, 4869.1]
  - - [25600, 1281, 1, 256]
    - [105, 4650.44]
  - - [42240, 1536, 1, 256]
    - [114, 4852.48]
  - - [5888, 2817, 1, 256]
    - [108, 4605.56]
  - - [8704, 2048, 1, 256]
    - [114, 4702.41]
  - - [6144, 1792, 1, 256]
    - [108, 4653.57]
  - - [16384, 1792, 1, 256]
    - [108, 4813.87]
  - - [8704, 1024, 1, 256]
    - [114, 4571.45]
  - - [26880, 256, 1, 256]
    - [108, 4541.16]
  - - [35584, 23297, 1, 256]
    - [108, 4910.58]
  - - [36352, 24064, 1, 256]
    - [114, 4896.08]
  - - [38400, 512, 1, 256]
    - [114, 4726.69]
  - - [23040, 1536, 1, 256]
    - [114, 4800.91]
  - - [28160, 512, 1, 256]
    - [114, 4666.23]
  - - [8704, 1536, 1, 256]
    - [114, 4626.57]
  - - [18432, 6145, 1, 256]
    - [114, 4790.37]
  - - [19456, 256, 1, 256]
    - [108, 4463.9]
  - - [23040, 1281, 1, 256]
    - [110, 4646.77]
  - - [12032, 3072, 1, 256]
    - [114, 4794.17]
  - - [36096, 1024, 1, 256]
    - [114, 4815.64]
  - - [4864, 3072, 1, 256]
    - [114, 4661.48]
  - - [42752, 1280, 1, 256]
    - [108, 4887.85]
  - - [15104, 1024, 1, 256]
    - [114, 4690.15]
  - - [1536, 1536, 1, 256]
    - [108, 4386.84]
  - - [28416, 2048, 1, 256]
    - [114, 4850.86]
  - - [39168, 3072, 1, 256]
    - [114, 4875.8]
  - - [7680, 256, 1, 256]
    - [108, 4298.91]
  - - [24576, 1281, 1, 256]
    - [110, 4651.17]
  - - [43520, 1281, 1, 256]
    - [111, 4697.69]
  - - [28160, 1536, 1, 256]
    - [114, 4828.86]
  - - [41728, 27648, 1, 256]
    - [114, 4901.64]
  - - [28416, 1792, 1, 256]
    - [108, 4871.7]
  - - [42240, 1792, 1, 256]
    - [108, 4894.29]
  - - [4864, 1536, 1, 256]
    - [131, 4477.07]
  - - [26368, 3072, 1, 256]
    - [114, 4863.97]
  - - [41728, 1536, 1, 256]
    - [114, 4848.22]
  - - [2048, 768, 1, 256]
    - [119, 4142.53]
  - - [24320, 12032, 1, 256]
    - [108, 4928.1]
  - - [28928, 16385, 1, 256]
    - [114, 4830.22]
  - - [34816, 22528, 1, 256]
    - [114, 4900.51]
  - - [26368, 1792, 1, 256]
    - [108, 4859.39]
  - - [34816, 1281, 1, 256]
    - [111, 4677.28]
  - - [25856, 13569, 1, 256]
    - [108, 4888.86]
  - - [4608, 1536, 1, 256]
    - [114, 4574.68]
  - - [22784, 256, 1, 256]
    - [114, 4529.16]
  - - [25600, 13312, 1, 256]
    - [114, 4892.26]
  - - [31232, 18689, 1, 256]
    - [108, 4887.91]
  - - [20736, 9216, 1, 256]
    - [114, 4879.39]
  - - [34304, 9216, 1, 256]
    - [114, 4895.83]
  - - [41472, 512, 1, 256]
    - [114, 4766.42]
  - - [12288, 1024, 1, 256]
    - [114, 4659.53]
  - - [7680, 1280, 1, 256]
    - [108, 4669.68]
  - - [14080, 1280, 1, 256]
    - [108, 4756.62]
  - - [29696, 1536, 1, 256]
    - [114, 4839.26]
  - - [43264, 3073, 1, 256]
    - [114, 4737.83]
  - - [17408, 1281, 1, 256]
    - [111, 4612.73]
  - - [7424, 2048, 1, 256]
    - [114, 4680.51]
  - - [37120, 1281, 1, 256]
    - [110, 4680.91]
  - - [12800, 512, 1, 256]
    - [114, 4486.37]
  - - [6912, 2048, 1, 256]
    - [114, 4704.63]
  - - [36864, 512, 1, 256]
    - [114, 4735.8]
  - - [8704, 5633, 1, 256]
    - [114, 4717.36]
  - - [4864, 1793, 1, 256]
    - [110, 4401.5]
  - - [15872, 256, 1, 256]
    - [108, 4283.43]
  - - [41984, 3072, 1, 256]
    - [114, 4876.84]
  - - [13824, 1280, 1, 256]
    - [108, 4766.46]
  - - [34560, 256, 1, 256]
    - [114, 4610.25]
  - - [20992, 3072, 1, 256]
    - [114, 4847.2]
  - - [40192, 1281, 1, 256]
    - [111, 4695.82]
  - - [9728, 6401, 1, 256]
    - [108, 4801.63]
  - - [36608, 1024, 1, 256]
    - [114, 4802.32]
  - - [17152, 1281, 1, 256]
    - [111, 4611.97]
  - - [16640, 4097, 1, 256]
    - [114, 4752.15]
  - - [38400, 9216, 1, 256]
    - [114, 4900.26]
  - - [15616, 256, 1, 256]
    - [114, 4257.11]
  - - [33024, 768, 1, 256]
    - [108, 4811.32]
  - - [38656, 1536, 1, 256]
    - [114, 4847.85]
  - - [1536, 3072, 1, 256]
    - [114, 4514.73]
  - - [12544, 1792, 1, 256]
    - [108, 4771.31]
  - - [37632, 1792, 1, 256]
    - [108, 4892.47]
  - - [17152, 4609, 1, 256]
    - [114, 4751.08]
  - - [18944, 6656, 1, 256]
    - [114, 4871.36]
  - - [34560, 22017, 1, 256]
    - [114, 4847.94]
  - - [23296, 11008, 1, 256]
    - [108, 4916.85]
  - - [41472, 1281, 1, 256]
    - [105, 4666.6]
  - - [14848, 768, 1, 256]
    - [108, 4639.01]
  - - [38656, 1792, 1, 256]
    - [108, 4886.94]
  - - [7424, 4352, 1, 256]
    - [108, 4826.1]
  - - [8448, 5377, 1, 256]
    - [108, 4797.27]
  - - [37120, 1280, 1, 256]
    - [108, 4870.15]
  - - [29696, 1281, 1, 256]
    - [111, 4677.96]
  - - [36608, 2048, 1, 256]
    - [114, 4854.79]
  - - [14080, 256, 1, 256]
    - [131, 4281.49]
  - - [29952, 17665, 1, 256]
    - [108, 4908.92]
  - - [16128, 3072, 1, 256]
    - [114, 4834.12]
  - - [19456, 2048, 1, 256]
    - [114, 4814.39]
  - - [2304, 2304, 1, 256]
    - [108, 4449.18]
  - - [33792, 21504, 1, 256]
    - [114, 4904.66]
  - - [37376, 512, 1, 256]
    - [114, 4718.87]
  - - [27136, 512, 1, 256]
    - [114, 4668.41]
  - - [24576, 1536, 1, 256]
    - [114, 4814.7]
  - - [6400, 1024, 1, 256]
    - [114, 4506.13]
  - - [7424, 1281, 1, 256]
    - [111, 4452.77]
  - - [35840, 2048, 1, 256]
    - [114, 4853.57]
  - - [3072, 1280, 1, 256]
    - [121, 4421.27]
  - - [23808, 256, 1, 256]
    - [114, 4510.53]
  - - [11520, 1024, 1, 256]
    - [114, 4670.72]
  - - [37376, 1792, 1, 256]
    - [108, 4888.11]
  - - [42752, 768, 1, 256]
    - [108, 4833.01]
  - - [4096, 1025, 1, 256]
    - [131, 4083.55]
  - - [35840, 768, 1, 256]
    - [114, 4796.62]
  - - [2304, 2305, 1, 256]
    - [108, 4392.44]
  - - [19200, 3072, 1, 256]
    - [114, 4855.58]
  - - [43264, 768, 1, 256]
    - [108, 4827.61]
  - - [33536, 1792, 1, 256]
    - [108, 4888.13]
  - - [36864, 9216, 1, 256]
    - [114, 4878.23]
  - - [38656, 26368, 1, 256]
    - [108, 4935.58]
  - - [22016, 1280, 1, 256]
    - [108, 4812.55]
  - - [8448, 5376, 1, 256]
    - [108, 4869.25]
  - - [17920, 1281, 1, 256]
    - [111, 4618.67]
  - - [2048, 1281, 1, 256]
    - [121, 3953.46]
  - - [41472, 3072, 1, 256]
    - [114, 4889.91]
  - - [3328, 512, 1, 256]
    - [129, 3951.16]
  - - [4608, 1024, 1, 256]
    - [108, 4442.99]
  - - [44288, 9216, 1, 256]
    - [114, 4904.58]
  - - [37888, 2048, 1, 256]
    - [114, 4867.97]
  - - [15104, 1792, 1, 256]
    - [108, 4808.19]
  - - [36096, 256, 1, 256]
    - [114, 4623.54]
  - - [44288, 4097, 1, 256]
    - [114, 4776.03]
  - - [26112, 3072, 1, 256]
    - [114, 4862.46]
  - - [512, 768, 1, 256]
    - [117, 2929.69]
  - - [36096, 3072, 1, 256]
    - [114, 4876.19]
  - - [4864, 1537, 1, 256]
    - [114, 4365.93]
  - - [43264, 3329, 1, 256]
    - [108, 4807.7]
  - - [9984, 2048, 1, 256]
    - [114, 4740.01]
  - - [33792, 1536, 1, 256]
    - [114, 4846.64]
  - - [13568, 2048, 1, 256]
    - [114, 4783.18]
  - - [31232, 18944, 1, 256]
    - [114, 4897.06]
  - - [44288, 1792, 1, 256]
    - [108, 4902.9]
  - - [25344, 1536, 1, 256]
    - [114, 4819.45]
  - - [7936, 1281, 1, 256]
    - [111, 4449.63]
  - - [38656, 2048, 1, 256]
    - [114, 4852.16]
  - - [30976, 2048, 1, 256]
    - [114, 4847.05]
  - - [20224, 7681, 1, 256]
    - [114, 4807.14]
  - - [26112, 9216, 1, 256]
    - [114, 4890.77]
  - - [7936, 1280, 1, 256]
    - [108, 4650.34]
  - - [31488, 2048, 1, 256]
    - [114, 4853.87]
  - - [6912, 512, 1, 256]
    - [108, 4343.1]
  - - [20224, 1280, 1, 256]
    - [108, 4803.43]
  - - [8960, 5888, 1, 256]
    - [108, 4862.07]
  - - [32000, 1792, 1, 256]
    - [108, 4877.75]
  - - [37888, 1792, 1, 256]
    - [108, 4891.32]
  - - [21504, 3072, 1, 256]
    - [114, 4857.04]
  - - [43264, 2048, 1, 256]
    - [114, 4869.06]
  - - [40448, 1281, 1, 256]
    - [111, 4693.09]
  - - [12544, 3072, 1, 256]
    - [114, 4812.57]
  - - [32256, 19713, 1, 256]
    - [108, 4890.6]
  - - [40704, 1792, 1, 256]
    - [108, 4896.13]
  - - [7936, 256, 1, 256]
    - [97, 4030.48]
  - - [18176, 5888, 1, 256]
    - [108, 4913.17]
  - - [33792, 9216, 1, 256]
    - [114, 4892.37]
  - - [35584, 1536, 1, 256]
    - [114, 4845.41]
  - - [26624, 14336, 1, 256]
    - [114, 4892.81]
  - - [38912, 1792, 1, 256]
    - [108, 4884.84]
  - - [7936, 1792, 1, 256]
    - [114, 4674.94]
  - - [28672, 16385, 1, 256]
    - [114, 4840.83]
  - - [18944, 3072, 1, 256]
    - [114, 4836.88]
  - - [33280, 20993, 1, 256]
    - [114, 4833.4]
  - - [5888, 3072, 1, 256]
    - [114, 4699.69]
  - - [37120, 24832, 1, 256]
    - [108, 4934.35]
  - - [6400, 3329, 1, 256]
    - [108, 4657.6]
  - - [43520, 1792, 1, 256]
    - [108, 4899.17]
  - - [29184, 3072, 1, 256]
    - [114, 4874.12]
  - - [16896, 4609, 1, 256]
    - [114, 4762.69]
  - - [29440, 1024, 1, 256]
    - [114, 4773.45]
  - - [43776, 1280, 1, 256]
    - [108, 4882.01]
  - - [37632, 1536, 1, 256]
    - [114, 4843.26]
  - - [14336, 768, 1, 256]
    - [114, 4628.5]
  - - [41984, 1281, 1, 256]
    - [105, 4690.48]
  - - [41472, 1536, 1, 256]
    - [114, 4860.87]
  - - [26624, 1281, 1, 256]
    - [111, 4660.2]
  - - [39936, 768, 1, 256]
    - [108, 4827.32]
  - - [23296, 11009, 1, 256]
    - [108, 4881.27]
  - - [42496, 256, 1, 256]
    - [108, 4663.77]
  - - [21504, 512, 1, 256]
    - [114, 4642.22]
  - - [16128, 512, 1, 256]
    - [114, 4593.1]
  - - [29952, 1281, 1, 256]
    - [111, 4671.17]
  - - [26624, 9216, 1, 256]
    - [114, 4886.69]
  - - [29184, 9216, 1, 256]
    - [114, 4888.43]
  - - [5120, 1281, 1, 256]
    - [108, 4300.8]
  - - [36352, 9216, 1, 256]
    - [114, 4897.24]
  - - [37632, 25344, 1, 256]
    - [108, 4939.08]
  - - [1280, 256, 1, 256]
    - [117, 2508.55]
  - - [37888, 25600, 1, 256]
    - [114, 4902.38]
  - - [34560, 1281, 1, 256]
    - [111, 4688.21]
  - - [16640, 9216, 1, 256]
    - [114, 4875.89]
  - - [1792, 1281, 1, 256]
    - [95, 4215.66]
  - - [44544, 9216, 1, 256]
    - [114, 4902.97]
  - - [14080, 1792, 1, 256]
    - [108, 4788.44]
  - - [33536, 21249, 1, 256]
    - [108, 4906.97]
  - - [32256, 1281, 1, 256]
    - [111, 4678.17]
  - - [23552, 1280, 1, 256]
    - [108, 4812.5]
  - - [18432, 2048, 1, 256]
    - [114, 4820.65]
  - - [34048, 21760, 1, 256]
    - [108, 4931.49]
  - - [9984, 768, 1, 256]
    - [108, 4570.49]
  - - [40192, 1536, 1, 256]
    - [114, 4840.95]
  - - [11520, 256, 1, 256]
    - [114, 4239.53]
  - - [4608, 1280, 1, 256]
    - [108, 4515.4]
  - - [41728, 3072, 1, 256]
    - [114, 4873.79]
  - - [35328, 9216, 1, 256]
    - [114, 4901.96]
  - - [11264, 1536, 1, 256]
    - [114, 4704.89]
  - - [6912, 3072, 1, 256]
    - [114, 4748.44]
  - - [32512, 768, 1, 256]
    - [108, 4794.14]
  - - [14592, 2049, 1, 256]
    - [114, 4615.94]
  - - [14848, 9216, 1, 256]
    - [114, 4875.41]
  - - [36352, 512, 1, 256]
    - [114, 4700.98]
  - - [23808, 3072, 1, 256]
    - [114, 4858.77]
  - - [13568, 9216, 1, 256]
    - [114, 4861.93]
  - - [1024, 769, 1, 256]
    - [109, 3236.81]
  - - [42496, 2560, 1, 256]
    - [114, 4869.08]
  - - [18176, 1024, 1, 256]
    - [114, 4717.37]
  - - [42752, 3072, 1, 256]
    - [114, 4880.33]
  - - [39680, 27392, 1, 256]
    - [108, 4936.62]
  - - [14592, 1792, 1, 256]
    - [108, 4807.88]
  - - [25600, 13313, 1, 256]
    - [114, 4828.81]
  - - [26624, 1792, 1, 256]
    - [108, 4866.76]
  - - [20480, 8193, 1, 256]
    - [114, 4806.84]
  - - [36096, 23808, 1, 256]
    - [108, 4941.57]
  - - [20736, 2048, 1, 256]
    - [114, 4834.33]
  - - [28672, 2048, 1, 256]
    - [114, 4854.11]
  - - [15104, 2561, 1, 256]
    - [114, 4675.36]
  - - [11776, 1281, 1, 256]
    - [111, 4552.91]
  - - [43520, 3072, 1, 256]
    - [114, 4878.49]
  - - [1280, 2048, 1, 256]
    - [119, 4309.59]
  - - [33280, 1280, 1, 256]
    - [108, 4859.8]
  - - [43008, 1792, 1, 256]
    - [108, 4898.8]
  - - [19712, 512, 1, 256]
    - [114, 4611.76]
  - - [18688, 3072, 1, 256]
    - [114, 4835.25]
  - - [35328, 23040, 1, 256]
    - [114, 4899.85]
  - - [18944, 6401, 1, 256]
    - [108, 4829.32]
  - - [16640, 768, 1, 256]
    - [114, 4683.29]
  - - [16128, 3585, 1, 256]
    - [114, 4738.4]
  - - [4352, 2048, 1, 256]
    - [114, 4576.59]
  - - [24064, 256, 1, 256]
    - [108, 4539.6]
  - - [29952, 1536, 1, 256]
    - [114, 4832.83]
  - - [7936, 512, 1, 256]
    - [131, 4301.85]
  - - [24320, 512, 1, 256]
    - [114, 4658.98]
  - - [17408, 5121, 1, 256]
    - [114, 4773.85]
  - - [44032, 1536, 1, 256]
    - [114, 4846.95]
  - - [4608, 1792, 1, 256]
    - [108, 4649.68]
  - - [36608, 1792, 1, 256]
    - [108, 4881.8]
  - - [13056, 768, 1, 256]
    - [114, 4638.78]
  - - [35328, 1792, 1, 256]
    - [108, 4889.58]
  - - [40960, 1280, 1, 256]
    - [108, 4876.88]
  - - [1280, 1280, 1, 256]
    - [121, 3853.65]
  - - [26112, 13824, 1, 256]
    - [114, 4898.01]
  - - [6400, 1280, 1, 256]
    - [108, 4615.62]
  - - [43520, 3585, 1, 256]
    - [114, 4762.22]
  - - [40704, 9216, 1, 256]
    - [114, 4900.8]
  - - [20224, 1024, 1, 256]
    - [114, 4741.53]
  - - [2816, 2817, 1, 256]
    - [114, 4435.15]
  - - [27904, 15617, 1, 256]
    - [108, 4899.13]
  - - [21248, 3072, 1, 256]
    - [114, 4846.66]
  - - [32768, 512, 1, 256]
    - [114, 4711.05]
  - - [19712, 1280, 1, 256]
    - [108, 4797.12]
  - - [38912, 1536, 1, 256]
    - [114, 4850.75]
  - - [20480, 1280, 1, 256]
    - [108, 4798.29]
  - - [8960, 1536, 1, 256]
    - [114, 4643.63]
  - - [28672, 1792, 1, 256]
    - [108, 4863.39]
  - - [14592, 2048, 1, 256]
    - [114, 4792.17]
  - - [18432, 1792, 1, 256]
    - [108, 4838.36]
  - - [39680, 1280, 1, 256]
    - [108, 4872.49]
  - - [29952, 9216, 1, 256]
    - [114, 4889.77]
  - - [4352, 1025, 1, 256]
    - [110, 4127.99]
  - - [35328, 1281, 1, 256]
    - [105, 4679.43]
  - - [23808, 2048, 1, 256]
    - [114, 4844.62]
  - - [25600, 1792, 1, 256]
    - [108, 4862.72]
  - - [19712, 256, 1, 256]
    - [108, 4496.82]
  - - [34304, 22017, 1, 256]
    - [114, 4849.01]
  - - [21760, 256, 1, 256]
    - [108, 4422.18]
  - - [39168, 1281, 1, 256]
    - [111, 4683.84]
  - - [42752, 512, 1, 256]
    - [114, 4750.42]
  - - [24064, 512, 1, 256]
    - [114, 4625.08]
  - - [28160, 15617, 1, 256]
    - [108, 4887.07]
  - - [20224, 512, 1, 256]
    - [114, 4588.06]
  - - [17408, 256, 1, 256]
    - [131, 4365.72]
  - - [1536, 256, 1, 256]
    - [122, 2939.93]
  - - [11776, 8704, 1, 256]
    - [114, 4861.74]
  - - [19968, 9216, 1, 256]
    - [114, 4871.13]
  - - [5376, 512, 1, 256]
    - [131, 4152.78]
  - - [26624, 1024, 1, 256]
    - [114, 4761.96]
  - - [7424, 4353, 1, 256]
    - [108, 4750.05]
  - - [19200, 1792, 1, 256]
    - [108, 4842.56]
  - - [27648, 15360, 1, 256]
    - [114, 4904.67]
  - - [26624, 3072, 1, 256]
    - [114, 4867.76]
  - - [21248, 1536, 1, 256]
    - [114, 4793.05]
  - - [16640, 1280, 1, 256]
    - [108, 4772.76]
  - - [23040, 10497, 1, 256]
    - [108, 4876.03]
  - - [21248, 8961, 1, 256]
    - [108, 4878.05]
  - - [32256, 1792, 1, 256]
    - [108, 4880.77]
  - - [28928, 1024, 1, 256]
    - [114, 4789.01]
  - - [26112, 13569, 1, 256]
    - [108, 4881.53]
  - - [20992, 1024, 1, 256]
    - [114, 4754.4]
  - - [3840, 2048, 1, 256]
    - [108, 4573.95]
  - - [25856, 1024, 1, 256]
    - [114, 4764.11]
  - - [12288, 8961, 1, 256]
    - [108, 4850.95]
  - - [16896, 3072, 1, 256]
    - [114, 4843.96]
  - - [6656, 3585, 1, 256]
    - [114, 4638.56]
  - - [19968, 7425, 1, 256]
    - [108, 4850.95]
  - - [40960, 1281, 1, 256]
    - [104, 4698.37]
  - - [9472, 768, 1, 256]
    - [108, 4541.24]
  - - [29440, 1281, 1, 256]
    - [111, 4665.96]
  - - [33792, 3072, 1, 256]
    - [114, 4876.56]
  - - [15616, 3072, 1, 256]
    - [114, 4831.05]
  - - [26624, 2048, 1, 256]
    - [114, 4837.95]
  - - [16384, 1024, 1, 256]
    - [114, 4689.24]
  - - [8704, 5377, 1, 256]
    - [108, 4763.43]
  - - [26880, 2048, 1, 256]
    - [114, 4848.77]
  - - [11520, 3072, 1, 256]
    - [114, 4808.04]
  - - [41216, 2048, 1, 256]
    - [114, 4871.34]
  - - [3584, 1280, 1, 256]
    - [114, 4417.05]
  - - [33536, 2048, 1, 256]
    - [114, 4855.5]
  - - [25856, 1536, 1, 256]
    - [114, 4824.7]
  - - [15872, 1281, 1, 256]
    - [111, 4601.63]
  - - [33792, 2048, 1, 256]
    - [114, 4857.42]
  - - [42496, 1281, 1, 256]
    - [111, 4692.25]
  - - [35840, 1792, 1, 256]
    - [108, 4884.92]
  - - [28416, 768, 1, 256]
    - [108, 4782.9]
  - - [12800, 2048, 1, 256]
    - [114, 4772.22]
  - - [21248, 512, 1, 256]
    - [114, 4627.2]
  - - [2048, 1793, 1, 256]
    - [108, 4183.2]
  - - [13056, 1024, 1, 256]
    - [114, 4691.0]
  - - [9728, 2048, 1, 256]
    - [114, 4747.44]
  - - [34816, 2048, 1, 256]
    - [114, 4843.71]
  - - [32256, 3072, 1, 256]
    - [114, 4877.02]
  - - [18688, 1280, 1, 256]
    - [108, 4801.68]
  - - [20736, 1536, 1, 256]
    - [114, 4795.97]
  - - [25856, 1281, 1, 256]
    - [111, 4658.55]
  - - [36864, 1024, 1, 256]
    - [114, 4804.07]
  - - [22784, 10241, 1, 256]
    - [114, 4812.98]
  - - [36608, 24321, 1, 256]
    - [108, 4903.62]
  - - [36096, 9216, 1, 256]
    - [114, 4901.01]
  - - [10752, 768, 1, 256]
    - [108, 4627.69]
  - - [38400, 26112, 1, 256]
    - [114, 4898.24]
  - - [9216, 5889, 1, 256]
    - [108, 4802.06]
  - - [28160, 256, 1, 256]
    - [108, 4523.27]
  - - [9472, 256, 1, 256]
    - [131, 4014.21]
  - - [39168, 2048, 1, 256]
    - [114, 4866.6]
  - - [30976, 1281, 1, 256]
    - [111, 4682.99]
  - - [41472, 27648, 1, 256]
    - [114, 4901.13]
  - - [38144, 25856, 1, 256]
    - [108, 4938.12]
  - - [12288, 256, 1, 256]
    - [114, 4433.53]
  - - [32256, 1280, 1, 256]
    - [108, 4859.7]
  - - [8960, 256, 1, 256]
    - [114, 4240.34]
  - - [11008, 1536, 1, 256]
    - [114, 4703.48]
  - - [15360, 3073, 1, 256]
    - [114, 4704.25]
  - - [24576, 1024, 1, 256]
    - [114, 4763.01]
  - - [29184, 16896, 1, 256]
    - [114, 4898.76]
  - - [3072, 1281, 1, 256]
    - [108, 4152.6]
  - - [21760, 512, 1, 256]
    - [114, 4606.74]
  - - [15872, 2048, 1, 256]
    - [114, 4790.07]
  - - [16128, 1792, 1, 256]
    - [108, 4816.52]
  - - [32768, 20225, 1, 256]
    - [108, 4893.63]
  - - [26624, 512, 1, 256]
    - [114, 4683.1]
  - - [23040, 10752, 1, 256]
    - [114, 4891.62]
  - - [28160, 1280, 1, 256]
    - [108, 4841.28]
  - - [15872, 3585, 1, 256]
    - [114, 4718.54]
  - - [11008, 7681, 1, 256]
    - [114, 4786.9]
  - - [15360, 9216, 1, 256]
    - [114, 4877.18]
  - - [2048, 1280, 1, 256]
    - [121, 4334.08]
  - - [9728, 1024, 1, 256]
    - [114, 4567.85]
  - - [28672, 512, 1, 256]
    - [114, 4673.32]
  - - [44032, 1281, 1, 256]
    - [105, 4697.18]
  - - [512, 512, 1, 256]
    - [118, 2593.08]
  - - [28416, 16128, 1, 256]
    - [108, 4930.36]
  - - [12288, 9216, 1, 256]
    - [114, 4871.3]
  - - [30208, 1792, 1, 256]
    - [108, 4867.85]
  - - [13056, 2048, 1, 256]
    - [114, 4782.51]
  - - [41728, 1792, 1, 256]
    - [108, 4890.6]
  - - [32256, 19968, 1, 256]
    - [114, 4896.65]
  - - [15360, 1281, 1, 256]
    - [111, 4599.08]
  - - [34304, 1024, 1, 256]
    - [114, 4788.49]
  - - [27904, 1792, 1, 256]
    - [108, 4868.86]
  - - [23552, 1024, 1, 256]
    - [114, 4743.4]
  - - [10240, 7168, 1, 256]
    - [114, 4838.62]
  - - [18944, 1792, 1, 256]
    - [108, 4839.19]
  - - [19200, 1536, 1, 256]
    - [114, 4805.45]
  - - [33024, 1024, 1, 256]
    - [114, 4810.54]
  - - [10240, 1280, 1, 256]
    - [114, 4662.15]
  - - [40192, 1792, 1, 256]
    - [108, 4898.56]
  - - [41728, 1793, 1, 256]
    - [108, 4717.24]
  - - [9984, 6912, 1, 256]
    - [108, 4889.52]
  - - [12544, 1281, 1, 256]
    - [111, 4552.69]
  - - [31488, 19201, 1, 256]
    - [108, 4906.77]
  - - [40192, 257, 1, 256]
    - [111, 4082.49]
  - - [14336, 2048, 1, 256]
    - [114, 4786.77]
  - - [31488, 1280, 1, 256]
    - [108, 4862.85]
  - - [42752, 27648, 1, 256]
    - [114, 4898.35]
  - - [3328, 1280, 1, 256]
    - [108, 4438.06]
  - - [2560, 1024, 1, 256]
    - [131, 4246.32]
  - - [17920, 512, 1, 256]
    - [114, 4561.15]
  - - [40704, 768, 1, 256]
    - [108, 4831.63]
  - - [25088, 12545, 1, 256]
    - [108, 4873.51]
  - - [28928, 1280, 1, 256]
    - [108, 4850.35]
  - - [24576, 9216, 1, 256]
    - [114, 4894.34]
  - - [37376, 1281, 1, 256]
    - [111, 4677.08]
  - - [33024, 20737, 1, 256]
    - [108, 4899.25]
  - - [29696, 9216, 1, 256]
    - [114, 4890.39]
  - - [768, 769, 1, 256]
    - [93, 3170.96]
  - - [31232, 1536, 1, 256]
    - [114, 4824.45]
  - - [25600, 1024, 1, 256]
    - [114, 4767.61]
  - - [30208, 17920, 1, 256]
    - [114, 4897.89]
  - - [9216, 1792, 1, 256]
    - [108, 4758.32]
  - - [8448, 1280, 1, 256]
    - [108, 4641.9]
  - - [44544, 4609, 1, 256]
    - [114, 4788.82]
  - - [43520, 1280, 1, 256]
    - [108, 4875.96]
  - - [22016, 9728, 1, 256]
    - [114, 4886.75]
  - - [24320, 256, 1, 256]
    - [108, 4559.55]
  - - [9472, 6400, 1, 256]
    - [108, 4852.21]
  - - [16640, 3072, 1, 256]
    - [114, 4838.79]
  - - [20480, 1024, 1, 256]
    - [114, 4726.81]
  - - [30208, 17921, 1, 256]
    - [114, 4829.29]
  - - [6656, 256, 1, 256]
    - [119, 3858.88]
  - - [5376, 1281, 1, 256]
    - [110, 4372.48]
  - - [19200, 6657, 1, 256]
    - [114, 4800.91]
  - - [6400, 2048, 1, 256]
    - [114, 4632.8]
  - - [32768, 1024, 1, 256]
    - [114, 4801.31]
  - - [34560, 512, 1, 256]
    - [114, 4724.89]
  - - [22016, 9729, 1, 256]
    - [114, 4808.68]
  - - [18176, 768, 1, 256]
    - [108, 4681.58]
  - - [7168, 1792, 1, 256]
    - [108, 4698.16]
  - - [39424, 512, 1, 256]
    - [114, 4738.28]
  - - [21760, 1792, 1, 256]
    - [108, 4854.8]
  - - [19968, 512, 1, 256]
    - [114, 4635.25]
  - - [37120, 2048, 1, 256]
    - [114, 4856.36]
  - - [29184, 1792, 1, 256]
    - [108, 4874.9]
  - - [12288, 1792, 1, 256]
    - [108, 4788.44]
  - - [17664, 512, 1, 256]
    - [114, 4607.29]
  - - [15616, 3328, 1, 256]
    - [108, 4859.28]
  - - [22528, 1536, 1, 256]
    - [114, 4805.14]
  - - [14848, 2305, 1, 256]
    - [108, 4677.19]
  - - [41216, 1025, 1, 256]
    - [111, 4542.24]
  - - [10496, 2048, 1, 256]
    - [114, 4742.27]
  - - [41984, 1024, 1, 256]
    - [114, 4818.93]
  - - [25088, 256, 1, 256]
    - [114, 4475.14]
  - - [8192, 3072, 1, 256]
    - [114, 4767.24]
  - - [18432, 512, 1, 256]
    - [114, 4588.47]
  - - [5888, 1792, 1, 256]
    - [108, 4663.24]
  - - [21760, 3072, 1, 256]
    - [114, 4862.08]
  - - [22272, 9985, 1, 256]
    - [108, 4882.96]
  - - [29184, 1536, 1, 256]
    - [114, 4811.18]
  - - [19456, 1536, 1, 256]
    - [114, 4792.89]
  - - [34304, 512, 1, 256]
    - [114, 4718.64]
  - - [9728, 512, 1, 256]
    - [131, 4413.22]
  - - [26112, 1281, 1, 256]
    - [111, 4667.54]
  - - [18944, 1281, 1, 256]
    - [111, 4624.26]
  - - [22016, 3072, 1, 256]
    - [114, 4848.15]
  - - [30720, 9216, 1, 256]
    - [114, 4889.5]
  - - [13824, 512, 1, 256]
    - [131, 4450.63]
  - - [39168, 768, 1, 256]
    - [108, 4823.82]
  - - [39424, 1280, 1, 256]
    - [108, 4869.67]
  - - [39680, 1792, 1, 256]
    - [108, 4888.94]
  - - [28928, 1281, 1, 256]
    - [111, 4671.6]
  - - [12288, 2048, 1, 256]
    - [114, 4772.61]
  - - [9728, 1536, 1, 256]
    - [114, 4653.99]
  - - [5120, 1792, 1, 256]
    - [114, 4593.26]
  - - [30208, 256, 1, 256]
    - [108, 4585.64]
  - - [34560, 9216, 1, 256]
    - [114, 4897.29]
  - - [33536, 1281, 1, 256]
    - [111, 4683.76]
  - - [12032, 8705, 1, 256]
    - [114, 4790.34]
  - - [10752, 7425, 1, 256]
    - [108, 4828.48]
  - - [12288, 512, 1, 256]
    - [114, 4487.39]
  - - [44032, 1792, 1, 256]
    - [108, 4890.7]
  - - [18688, 1536, 1, 256]
    - [114, 4779.65]
  - - [16128, 3840, 1, 256]
    - [108, 4878.42]
  - - [38656, 768, 1, 256]
    - [108, 4817.86]
  - - [27136, 1024, 1, 256]
    - [114, 4783.82]
  - - [21248, 1792, 1, 256]
    - [108, 4849.53]
  - - [36352, 3072, 1, 256]
    - [114, 4882.43]
  - - [16896, 1281, 1, 256]
    - [110, 4608.89]
  - - [19968, 7680, 1, 256]
    - [114, 4881.37]
  - - [14848, 1536, 1, 256]
    - [114, 4733.18]
  - - [3840, 513, 1, 256]
    - [110, 3689.64]
  - - [21248, 256, 1, 256]
    - [114, 4524.07]
  - - [3584, 1792, 1, 256]
    - [108, 4482.47]
  - - [12032, 512, 1, 256]
    - [114, 4497.66]
  - - [38400, 3072, 1, 256]
    - [114, 4876.81]
  - - [5376, 768, 1, 256]
    - [108, 4378.48]
  - - [37888, 1280, 1, 256]
    - [108, 4866.85]
  - - [5888, 2048, 1, 256]
    - [114, 4646.87]
  - - [20224, 9216, 1, 256]
    - [114, 4872.12]
  - - [17408, 5120, 1, 256]
    - [114, 4877.14]
  - - [28928, 9216, 1, 256]
    - [114, 4888.32]
  - - [19456, 1792, 1, 256]
    - [108, 4829.8]
  - - [8192, 2048, 1, 256]
    - [114, 4707.95]
  - - [40960, 2048, 1, 256]
    - [114, 4870.2]
  - - [10752, 3072, 1, 256]
    - [114, 4806.57]
  - - [35072, 1792, 1, 256]
    - [108, 4876.33]
  - - [28672, 1281, 1, 256]
    - [111, 4669.63]
  - - [7168, 2048, 1, 256]
    - [114, 4656.18]
  - - [31488, 19200, 1, 256]
    - [108, 4934.29]
  - - [11008, 7937, 1, 256]
    - [108, 4827.77]
  - - [21248, 8705, 1, 256]
    - [114, 4804.78]
  - - [13568, 3072, 1, 256]
    - [114, 4814.95]
  - - [29696, 2048, 1, 256]
    - [114, 4846.01]
  - - [3328, 256, 1, 256]
    - [112, 3440.12]
  - - [28416, 1280, 1, 256]
    - [108, 4850.07]
  - - [39168, 1280, 1, 256]
    - [108, 4869.1]
  - - [15616, 3329, 1, 256]
    - [108, 4759.57]
  - - [36864, 3072, 1, 256]
    - [114, 4877.52]
  - - [34560, 22273, 1, 256]
    - [108, 4911.52]
  - - [11520, 1280, 1, 256]
    - [108, 4713.88]
  - - [34048, 768, 1, 256]
    - [108, 4799.61]
  - - [40448, 27648, 1, 256]
    - [114, 4900.89]
  - - [28416, 16129, 1, 256]
    - [108, 4900.77]
  - - [8960, 512, 1, 256]
    - [114, 4398.52]
  - - [34816, 22529, 1, 256]
    - [114, 4840.24]
  - - [22528, 3072, 1, 256]
    - [114, 4856.62]
  - - [27136, 14593, 1, 256]
    - [108, 4876.34]
  - - [5888, 256, 1, 256]
    - [121, 3911.96]
  - - [35584, 3072, 1, 256]
    - [114, 4864.55]
  - - [43008, 3072, 1, 256]
    - [114, 4876.39]
  - - [30208, 2048, 1, 256]
    - [114, 4837.24]
  - - [10496, 1024, 1, 256]
    - [114, 4594.35]
  - - [30464, 1792, 1, 256]
    - [108, 4874.38]
  - - [16384, 4097, 1, 256]
    - [114, 4727.13]
  - - [20992, 9216, 1, 256]
    - [114, 4884.6]
  - - [43776, 1536, 1, 256]
    - [114, 4851.31]
  - - [4864, 256, 1, 256]
    - [118, 3836.87]
  - - [14848, 2048, 1, 256]
    - [114, 4791.37]
  - - [9728, 256, 1, 256]
    - [131, 4071.1]
  - - [3072, 2817, 1, 256]
    - [108, 4463.97]
  - - [31488, 1792, 1, 256]
    - [108, 4881.85]
  - - [31488, 9216, 1, 256]
    - [114, 4891.61]
  - - [26368, 1281, 1, 256]
    - [110, 4656.34]
  - - [22272, 9984, 1, 256]
    - [108, 4927.08]
  - - [41728, 1537, 1, 256]
    - [114, 4627.73]
  - - [34560, 768, 1, 256]
    - [108, 4824.87]
  - - [26880, 1792, 1, 256]
    - [108, 4869.78]
  - - [30464, 768, 1, 256]
    - [108, 4787.28]
  - - [8448, 1281, 1, 256]
    - [111, 4505.01]
  - - [40704, 1281, 1, 256]
    - [111, 4687.89]
  - - [22784, 9216, 1, 256]
    - [114, 4883.28]
  - - [24320, 1281, 1, 256]
    - [105, 4658.09]
  - - [30720, 1281, 1, 256]
    - [111, 4674.19]
  - - [17920, 1280, 1, 256]
    - [108, 4779.91]
  - - [7936, 2048, 1, 256]
    - [114, 4689.12]
  - - [37632, 1281, 1, 256]
    - [111, 4683.16]
  - - [3328, 1792, 1, 256]
    - [131, 4468.82]
  - - [2816, 1792, 1, 256]
    - [108, 4496.82]
  - - [41472, 1537, 1, 256]
    - [114, 4634.45]
  - - [16896, 1024, 1, 256]
    - [114, 4715.71]
  - - [33536, 1280, 1, 256]
    - [108, 4858.73]
  - - [30720, 512, 1, 256]
    - [114, 4717.12]
  - - [28672, 1024, 1, 256]
    - [114, 4782.63]
  - - [43008, 27648, 1, 256]
    - [114, 4902.81]
  - - [39424, 27137, 1, 256]
    - [114, 4844.63]
  - - [24320, 1792, 1, 256]
    - [108, 4852.75]
  - - [34816, 1280, 1, 256]
    - [108, 4855.84]
  - - [21504, 256, 1, 256]
    - [108, 4569.67]
  - - [32000, 3072, 1, 256]
    - [114, 4866.95]
  - - [6144, 768, 1, 256]
    - [114, 4524.19]
  - - [12800, 1792, 1, 256]
    - [108, 4778.51]
  - - [41728, 1280, 1, 256]
    - [108, 4863.36]
  - - [15872, 3072, 1, 256]
    - [114, 4827.0]
  - - [23296, 512, 1, 256]
    - [114, 4643.05]
  - - [30720, 768, 1, 256]
    - [108, 4811.05]
  - - [43776, 27648, 1, 256]
    - [114, 4902.36]
  - - [33792, 1281, 1, 256]
    - [111, 4682.58]
  - - [22016, 2048, 1, 256]
    - [114, 4834.37]
  - - [15872, 1792, 1, 256]
    - [108, 4818.61]
  - - [36608, 1280, 1, 256]
    - [108, 4865.07]
  - - [39936, 1792, 1, 256]
    - [108, 4892.15]
  - - [10496, 7425, 1, 256]
    - [108, 4830.56]
  - - [16896, 4608, 1, 256]
    - [114, 4855.85]
  - - [9984, 6913, 1, 256]
    - [108, 4832.39]
  - - [21248, 8960, 1, 256]
    - [108, 4918.7]
  - - [37376, 256, 1, 256]
    - [108, 4598.74]
  - - [27392, 1536, 1, 256]
    - [114, 4814.66]
  - - [14336, 1792, 1, 256]
    - [114, 4788.88]
  - - [9472, 1280, 1, 256]
    - [108, 4686.8]
  - - [24832, 12544, 1, 256]
    - [108, 4925.92]
  - - [30464, 18176, 1, 256]
    - [108, 4926.11]
  - - [36096, 1280, 1, 256]
    - [108, 4867.95]
  - - [5632, 512, 1, 256]
    - [131, 4261.13]
  - - [31744, 19201, 1, 256]
    - [108, 4887.65]
  - - [11008, 1280, 1, 256]
    - [108, 4709.99]
  - - [27648, 1024, 1, 256]
    - [114, 4786.4]
  - - [41216, 768, 1, 256]
    - [108, 4826.67]
  - - [1792, 768, 1, 256]
    - [129, 3727.49]
  - - [26112, 2048, 1, 256]
    - [114, 4848.22]
  - - [20992, 1280, 1, 256]
    - [108, 4810.39]
  - - [41216, 1281, 1, 256]
    - [111, 4695.74]
  - - [35584, 2048, 1, 256]
    - [114, 4867.33]
  - - [23040, 1280, 1, 256]
    - [108, 4834.5]
  - - [33792, 1792, 1, 256]
    - [108, 4882.32]
  - - [9216, 1024, 1, 256]
    - [114, 4589.16]
  - - [16896, 9216, 1, 256]
    - [114, 4891.1]
  - - [1536, 2048, 1, 256]
    - [108, 4439.4]
  - - [31744, 256, 1, 256]
    - [108, 4593.66]
  - - [43264, 3328, 1, 256]
    - [108, 4918.88]
  - - [40192, 3072, 1, 256]
    - [114, 4880.38]
  - - [32000, 512, 1, 256]
    - [114, 4714.82]
  - - [42240, 3072, 1, 256]
    - [114, 4884.1]
  - - [7168, 256, 1, 256]
    - [114, 4076.38]
  - - [32256, 9216, 1, 256]
    - [114, 4883.17]
  - - [29952, 256, 1, 256]
    - [114, 4570.92]
  - - [41984, 2049, 1, 256]
    - [114, 4680.53]
  - - [6656, 1792, 1, 256]
    - [108, 4646.44]
  - - [13824, 1537, 1, 256]
    - [114, 4538.24]
  - - [20736, 3072, 1, 256]
    - [114, 4850.35]
  - - [8192, 768, 1, 256]
    - [131, 4483.39]
  - - [43008, 768, 1, 256]
    - [108, 4841.69]
  - - [8448, 1024, 1, 256]
    - [114, 4562.03]
  - - [36096, 23809, 1, 256]
    - [108, 4911.33]
  - - [41728, 9216, 1, 256]
    - [114, 4897.8]
  - - [28160, 1281, 1, 256]
    - [111, 4672.57]
  - - [25600, 768, 1, 256]
    - [108, 4757.07]
  - - [9216, 1281, 1, 256]
    - [111, 4503.57]
  - - [43776, 2048, 1, 256]
    - [114, 4866.1]
  - - [23040, 256, 1, 256]
    - [108, 4588.95]
  - - [44032, 4096, 1, 256]
    - [114, 4883.68]
  - - [37632, 768, 1, 256]
    - [108, 4822.8]
  - - [43008, 256, 1, 256]
    - [108, 4676.11]
  - - [34304, 2048, 1, 256]
    - [114, 4857.97]
  - - [10496, 256, 1, 256]
    - [114, 4185.12]
  - - [25600, 9216, 1, 256]
    - [114, 4876.5]
  - - [19968, 3072, 1, 256]
    - [114, 4854.06]
  - - [40448, 256, 1, 256]
    - [114, 4625.21]
  - - [18176, 1280, 1, 256]
    - [108, 4785.71]
  - - [15616, 9216, 1, 256]
    - [114, 4869.47]
  - - [29184, 16897, 1, 256]
    - [114, 4834.06]
  - - [7168, 3841, 1, 256]
    - [108, 4695.84]
  - - [40704, 769, 1, 256]
    - [108, 4462.96]
  - - [39936, 1281, 1, 256]
    - [111, 4687.48]
  - - [6144, 3073, 1, 256]
    - [114, 4615.21]
  - - [9984, 1281, 1, 256]
    - [110, 4528.26]
  - - [8192, 1281, 1, 256]
    - [110, 4464.62]
  - - [41728, 2048, 1, 256]
    - [114, 4853.12]
  - - [34304, 1792, 1, 256]
    - [108, 4885.76]
  - - [39936, 1280, 1, 256]
    - [108, 4871.87]
  - - [28160, 2048, 1, 256]
    - [114, 4840.39]
  - - [43520, 9216, 1, 256]
    - [114, 4897.44]
  - - [18688, 6400, 1, 256]
    - [108, 4909.35]
  - - [35840, 512, 1, 256]
    - [114, 4732.07]
  - - [39680, 512, 1, 256]
    - [114, 4745.03]
  - - [20992, 1536, 1, 256]
    - [114, 4787.71]
  - - [2816, 1280, 1, 256]
    - [121, 4341.93]
  - - [7680, 4608, 1, 256]
    - [114, 4806.61]
  - - [14592, 512, 1, 256]
    - [108, 4488.41]
  - - [21760, 768, 1, 256]
    - [108, 4730.63]
  - - [1536, 1280, 1, 256]
    - [114, 4290.13]
  - - [43264, 3072, 1, 256]
    - [114, 4876.04]
  - - [21760, 9216, 1, 256]
    - [114, 4883.57]
  - - [18432, 768, 1, 256]
    - [114, 4719.82]
  - - [9216, 512, 1, 256]
    - [114, 4455.44]
  - - [11264, 768, 1, 256]
    - [129, 4548.17]
  - - [42496, 3072, 1, 256]
    - [114, 4874.68]
  - - [19712, 2048, 1, 256]
    - [114, 4806.42]
  - - [34048, 1280, 1, 256]
    - [108, 4859.0]
  - - [43520, 2048, 1, 256]
    - [114, 4857.91]
  - - [12800, 1281, 1, 256]
    - [111, 4565.37]
  - - [15104, 1536, 1, 256]
    - [114, 4754.65]
  - - [30208, 17665, 1, 256]
    - [108, 4888.96]
  - - [27392, 15105, 1, 256]
    - [108, 4893.62]
  - - [512, 513, 1, 256]
    - [116, 2042.54]
  - - [17920, 256, 1, 256]
    - [114, 4425.71]
  - - [1792, 512, 1, 256]
    - [93, 3626.96]
  - - [13312, 1536, 1, 256]
    - [114, 4704.74]
  - - [29952, 17409, 1, 256]
    - [114, 4835.83]
  - - [9472, 2048, 1, 256]
    - [114, 4719.15]
  - - [43264, 1280, 1, 256]
    - [108, 4883.15]
  - - [44032, 3072, 1, 256]
    - [114, 4881.55]
  - - [28416, 256, 1, 256]
    - [108, 4565.73]
  - - [3840, 1280, 1, 256]
    - [114, 4429.98]
  - - [32768, 9216, 1, 256]
    - [114, 4890.08]
  - - [37632, 512, 1, 256]
    - [114, 4742.97]
  - - [41216, 9216, 1, 256]
    - [114, 4895.49]
  - - [8448, 1536, 1, 256]
    - [114, 4676.87]
  - - [41216, 512, 1, 256]
    - [114, 4744.82]
  - - [36352, 768, 1, 256]
    - [108, 4815.45]
  - - [2560, 2560, 1, 256]
    - [114, 4505.65]
  - - [12288, 1280, 1, 256]
    - [108, 4731.53]
  - - [768, 513, 1, 256]
    - [118, 2908.32]
  - - [36352, 2048, 1, 256]
    - [114, 4864.45]
  - - [23552, 768, 1, 256]
    - [108, 4753.14]
  - - [11264, 1281, 1, 256]
    - [111, 4539.26]
  - - [4096, 1281, 1, 256]
    - [131, 4242.12]
  - - [7168, 3072, 1, 256]
    - [114, 4736.94]
  - - [19712, 1792, 1, 256]
    - [108, 4838.89]
  - - [23040, 2048, 1, 256]
    - [114, 4827.51]
  - - [27136, 1281, 1, 256]
    - [111, 4660.66]
  - - [6144, 1024, 1, 256]
    - [131, 4485.89]
  - - [44288, 4353, 1, 256]
    - [108, 4837.39]
  - - [43776, 1281, 1, 256]
    - [111, 4694.73]
  - - [36608, 768, 1, 256]
    - [114, 4802.25]
  - - [34816, 768, 1, 256]
    - [108, 4807.9]
  - - [15616, 3073, 1, 256]
    - [114, 4702.18]
  - - [37376, 24833, 1, 256]
    - [108, 4889.54]
  - - [38144, 25857, 1, 256]
    - [108, 4908.37]
  - - [26880, 14592, 1, 256]
    - [108, 4938.53]
  - - [6144, 2817, 1, 256]
    - [108, 4615.38]
  - - [35584, 1280, 1, 256]
    - [108, 4862.7]
  - - [23808, 768, 1, 256]
    - [108, 4754.44]
  - - [33280, 1281, 1, 256]
    - [104, 4679.1]
  - - [29184, 2048, 1, 256]
    - [114, 4849.95]
  - - [35072, 1024, 1, 256]
    - [114, 4804.01]
  - - [39168, 26881, 1, 256]
    - [108, 4913.57]
  - - [20736, 1280, 1, 256]
    - [108, 4810.39]
  - - [5120, 1793, 1, 256]
    - [108, 4408.24]
  - - [32512, 19969, 1, 256]
    - [114, 4835.79]
  - - [17664, 1281, 1, 256]
    - [111, 4616.7]
  - - [3072, 256, 1, 256]
    - [113, 3847.99]
  - - [32512, 512, 1, 256]
    - [114, 4700.85]
  - - [5632, 1281, 1, 256]
    - [111, 4389.94]
  - - [25088, 9216, 1, 256]
    - [114, 4889.2]
  - - [42240, 1280, 1, 256]
    - [108, 4881.91]
  - - [43008, 2817, 1, 256]
    - [108, 4773.23]
  - - [26112, 13825, 1, 256]
    - [114, 4833.17]
  - - [38912, 512, 1, 256]
    - [114, 4734.58]
  - - [1024, 1024, 1, 256]
    - [100, 3942.96]
  - - [31744, 2048, 1, 256]
    - [114, 4853.04]
  - - [22272, 1024, 1, 256]
    - [114, 4755.69]
  - - [4352, 3072, 1, 256]
    - [114, 4641.13]
  - - [14336, 1280, 1, 256]
    - [108, 4757.95]
  - - [33536, 3072, 1, 256]
    - [114, 4862.46]
  - - [9728, 6657, 1, 256]
    - [114, 4749.98]
  - - [2048, 3072, 1, 256]
    - [121, 4491.9]
  - - [40448, 512, 1, 256]
    - [114, 4752.92]
  - - [24832, 9216, 1, 256]
    - [114, 4894.47]
  - - [37888, 1536, 1, 256]
    - [114, 4848.4]
  - - [5632, 2561, 1, 256]
    - [114, 4527.92]
  - - [41472, 1280, 1, 256]
    - [108, 4873.18]
  - - [3072, 3072, 1, 256]
    - [108, 4626.07]
  - - [29184, 1281, 1, 256]
    - [111, 4670.26]
  - - [33280, 20992, 1, 256]
    - [114, 4894.66]
  - - [25344, 1281, 1, 256]
    - [111, 4665.03]
  - - [4096, 1280, 1, 256]
    - [121, 4449.01]
  - - [20224, 7936, 1, 256]
    - [108, 4914.41]
  - - [4352, 1024, 1, 256]
    - [131, 4355.06]
  - - [28928, 512, 1, 256]
    - [114, 4687.3]
  - - [28672, 16384, 1, 256]
    - [114, 4894.96]
  - - [28416, 9216, 1, 256]
    - [114, 4893.35]
  - - [37120, 256, 1, 256]
    - [114, 4591.38]
  - - [7936, 768, 1, 256]
    - [108, 4503.76]
  - - [38912, 2048, 1, 256]
    - [114, 4860.09]
  - - [23552, 11265, 1, 256]
    - [114, 4822.78]
  - - [25088, 3072, 1, 256]
    - [114, 4848.19]
  - - [32000, 19457, 1, 256]
    - [114, 4832.33]
  - - [44800, 3072, 1, 256]
    - [114, 4869.17]
  - - [37120, 1792, 1, 256]
    - [108, 4882.97]
  - - [32512, 256, 1, 256]
    - [108, 4551.62]
  - - [30464, 18177, 1, 256]
    - [108, 4902.06]
  - - [4864, 2048, 1, 256]
    - [114, 4577.03]
  - - [44544, 4608, 1, 256]
    - [114, 4894.31]
  - - [29440, 1280, 1, 256]
    - [108, 4838.64]
  - - [7168, 768, 1, 256]
    - [131, 4462.03]
  - - [11008, 1024, 1, 256]
    - [114, 4636.08]
  - - [18944, 9216, 1, 256]
    - [114, 4885.46]
  - - [11776, 2048, 1, 256]
    - [114, 4748.51]
  - - [33280, 20737, 1, 256]
    - [108, 4890.04]
  - - [1536, 512, 1, 256]
    - [103, 3862.75]
  - - [25856, 3072, 1, 256]
    - [114, 4858.55]
  - - [9472, 1281, 1, 256]
    - [110, 4500.71]
  - - [8192, 1280, 1, 256]
    - [108, 4643.89]
  - - [24320, 768, 1, 256]
    - [108, 4763.79]
  - - [43008, 2048, 1, 256]
    - [114, 4873.77]
  - - [27648, 9216, 1, 256]
    - [114, 4892.71]
  - - [39168, 256, 1, 256]
    - [108, 4635.43]
  - - [42752, 9216, 1, 256]
    - [114, 4892.88]
  - - [5120, 2049, 1, 256]
    - [114, 4448.53]
  - - [28160, 9216, 1, 256]
    - [114, 4891.17]
  - - [37632, 25089, 1, 256]
    - [114, 4848.75]
  - - [28928, 768, 1, 256]
    - [108, 4778.91]
  - - [22016, 1792, 1, 256]
    - [108, 4846.3]
  - - [16384, 9216, 1, 256]
    - [114, 4875.89]
  - - [23040, 512, 1, 256]
    - [114, 4614.2]
  - - [21504, 9217, 1, 256]
    - [114, 4813.93]
  - - [20480, 7937, 1, 256]
    - [108, 4849.09]
  - - [33536, 21248, 1, 256]
    - [108, 4930.79]
  - - [41728, 1281, 1, 256]
    - [111, 4690.84]
  - - [12800, 768, 1, 256]
    - [114, 4593.64]
  - - [28672, 9216, 1, 256]
    - [114, 4895.61]
  - - [6144, 1280, 1, 256]
    - [108, 4641.86]
  - - [30976, 1280, 1, 256]
    - [108, 4856.28]
  - - [14592, 1024, 1, 256]
    - [114, 4694.19]
  - - [32000, 9216, 1, 256]
    - [114, 4895.58]
  - - [40448, 1280, 1, 256]
    - [108, 4873.65]
  - - [16384, 4096, 1, 256]
    - [114, 4842.78]
  - - [44544, 3072, 1, 256]
    - [114, 4888.4]
  - - [5376, 3072, 1, 256]
    - [114, 4702.01]
  - - [39680, 1024, 1, 256]
    - [114, 4818.98]
  - - [35584, 1792, 1, 256]
    - [108, 4888.78]
  - - [26368, 256, 1, 256]
    - [114, 4481.0]
  - - [35840, 23297, 1, 256]
    - [108, 4896.78]
  - - [23808, 11521, 1, 256]
    - [108, 4896.2]
  - - [13312, 1025, 1, 256]
    - [110, 4411.78]
  - - [18176, 9216, 1, 256]
    - [114, 4877.85]
  - - [17920, 5633, 1, 256]
    - [114, 4768.68]
  - - [23808, 1281, 1, 256]
    - [111, 4644.56]
  - - [33024, 1280, 1, 256]
    - [108, 4860.45]
  - - [27648, 3072, 1, 256]
    - [114, 4859.92]
  - - [27392, 1024, 1, 256]
    - [114, 4783.4]
  - - [1024, 3072, 1, 256]
    - [121, 4341.75]
  - - [22016, 9216, 1, 256]
    - [114, 4887.16]
  - - [20992, 1281, 1, 256]
    - [111, 4636.96]
  - - [3840, 1281, 1, 256]
    - [111, 4244.56]
  - - [21760, 9473, 1, 256]
    - [108, 4874.58]
  - - [10240, 256, 1, 256]
    - [129, 4196.4]
  - - [6144, 1536, 1, 256]
    - [114, 4604.21]
  - - [16896, 1536, 1, 256]
    - [114, 4777.63]
  - - [19968, 768, 1, 256]
    - [108, 4735.44]
  - - [23552, 11264, 1, 256]
    - [114, 4887.59]
  - - [27904, 3072, 1, 256]
    - [114, 4871.25]
  - - [19712, 7425, 1, 256]
    - [108, 4855.1]
  - - [26624, 14081, 1, 256]
    - [108, 4880.05]
  - - [31232, 1280, 1, 256]
    - [108, 4854.43]
  - - [3328, 257, 1, 256]
    - [106, 3325.57]
  - - [24320, 9216, 1, 256]
    - [114, 4879.89]
  - - [14080, 3072, 1, 256]
    - [114, 4820.2]
  - - [17408, 3072, 1, 256]
    - [114, 4833.43]
  - - [21504, 9216, 1, 256]
    - [114, 4893.88]
  - - [30976, 1024, 1, 256]
    - [114, 4790.44]
  - - [10752, 1281, 1, 256]
    - [111, 4544.48]
  - - [14848, 2560, 1, 256]
    - [114, 4809.98]
  - - [41728, 1024, 1, 256]
    - [114, 4833.82]
  - - [34304, 3072, 1, 256]
    - [114, 4867.98]
  - - [15104, 9216, 1, 256]
    - [114, 4880.09]
  - - [10496, 768, 1, 256]
    - [108, 4559.83]
  - - [17152, 4865, 1, 256]
    - [108, 4815.64]
  - - [41472, 2048, 1, 256]
    - [114, 4874.39]
  - - [38912, 26625, 1, 256]
    - [114, 4845.15]
  - - [25600, 2048, 1, 256]
    - [114, 4843.03]
  - - [44288, 1281, 1, 256]
    - [111, 4694.49]
  - - [41216, 1792, 1, 256]
    - [108, 4892.9]
  - - [39424, 3072, 1, 256]
    - [114, 4879.59]
  - - [30720, 18433, 1, 256]
    - [114, 4830.81]
  - - [14848, 1024, 1, 256]
    - [114, 4689.08]
  - - [39424, 2048, 1, 256]
    - [114, 4860.08]
  - - [21760, 2048, 1, 256]
    - [114, 4823.57]
  - - [18944, 6657, 1, 256]
    - [114, 4786.02]
  - - [5632, 1792, 1, 256]
    - [108, 4648.94]
  - - [24064, 1024, 1, 256]
    - [114, 4765.82]
  - - [2304, 1281, 1, 256]
    - [114, 4179.94]
  - - [18176, 1792, 1, 256]
    - [108, 4833.0]
  - - [31232, 9216, 1, 256]
    - [114, 4891.3]
  - - [31744, 1536, 1, 256]
    - [114, 4834.71]
  - - [42752, 2561, 1, 256]
    - [114, 4723.03]
  - - [18688, 9216, 1, 256]
    - [114, 4873.43]
  - - [13568, 256, 1, 256]
    - [114, 4403.69]
  - - [19968, 256, 1, 256]
    - [108, 4543.83]
  - - [12032, 2048, 1, 256]
    - [114, 4762.8]
  - - [10240, 1024, 1, 256]
    - [114, 4597.76]
  - - [18944, 2048, 1, 256]
    - [114, 4820.76]
  - - [43776, 1792, 1, 256]
    - [108, 4905.12]
  - - [25344, 1280, 1, 256]
    - [108, 4838.45]
  - - [10240, 1792, 1, 256]
    - [108, 4747.95]
  - - [33792, 21505, 1, 256]
    - [114, 4845.58]
  - - [35072, 1536, 1, 256]
    - [114, 4846.93]
  - - [43008, 512, 1, 256]
    - [114, 4767.54]
  - - [25856, 13313, 1, 256]
    - [114, 4827.17]
  - - [32000, 1280, 1, 256]
    - [108, 4851.82]
  - - [29952, 3072, 1, 256]
    - [114, 4871.69]
  - - [23296, 1536, 1, 256]
    - [114, 4799.82]
  - - [5888, 768, 1, 256]
    - [108, 4371.71]
  - - [20480, 9216, 1, 256]
    - [114, 4889.14]
  - - [21504, 1536, 1, 256]
    - [114, 4806.02]
  - - [7424, 1280, 1, 256]
    - [114, 4565.19]
  - - [33024, 2048, 1, 256]
    - [114, 4859.36]
  - - [19200, 1280, 1, 256]
    - [108, 4796.78]
  - - [11008, 7936, 1, 256]
    - [108, 4889.21]
  - - [17152, 1792, 1, 256]
    - [108, 4831.58]
  - - [38656, 1280, 1, 256]
    - [108, 4866.01]
  - - [22528, 768, 1, 256]
    - [108, 4736.29]
  - - [23040, 10753, 1, 256]
    - [114, 4824.01]
  - - [8960, 5889, 1, 256]
    - [108, 4803.27]
  - - [21504, 1280, 1, 256]
    - [108, 4812.87]
  - - [11008, 512, 1, 256]
    - [114, 4416.14]
  - - [16640, 4352, 1, 256]
    - [108, 4884.81]
  - - [30464, 3072, 1, 256]
    - [114, 4858.35]
  - - [7424, 512, 1, 256]
    - [114, 4296.53]
  - - [13312, 1281, 1, 256]
    - [111, 4576.36]
  - - [8960, 1281, 1, 256]
    - [111, 4509.09]
  - - [16128, 9216, 1, 256]
    - [114, 4881.83]
  - - [26880, 1281, 1, 256]
    - [111, 4665.95]
  - - [5632, 1280, 1, 256]
    - [114, 4508.24]
  - - [43008, 1280, 1, 256]
    - [108, 4874.13]
  - - [22528, 1280, 1, 256]
    - [108, 4809.98]
  - - [21504, 1792, 1, 256]
    - [108, 4850.43]
  - - [11776, 512, 1, 256]
    - [114, 4420.62]
  - - [6400, 768, 1, 256]
    - [108, 4413.2]
  - - [39680, 1536, 1, 256]
    - [114, 4848.85]
  - - [40704, 256, 1, 256]
    - [114, 4647.67]
  - - [25344, 13057, 1, 256]
    - [108, 4896.54]
  - - [16128, 256, 1, 256]
    - [108, 4363.3]
  - - [39424, 9216, 1, 256]
    - [114, 4898.24]
  - - [27648, 1792, 1, 256]
    - [108, 4873.95]
  - - [25600, 3072, 1, 256]
    - [114, 4857.7]
  - - [23808, 1024, 1, 256]
    - [114, 4777.2]
  - - [32000, 256, 1, 256]
    - [114, 4609.53]
  - - [28416, 3072, 1, 256]
    - [114, 4871.19]
  - - [24832, 1281, 1, 256]
    - [111, 4651.3]
  - - [12032, 8960, 1, 256]
    - [108, 4898.88]
  - - [25088, 1281, 1, 256]
    - [111, 4655.96]
  - - [12800, 257, 1, 256]
    - [110, 3664.02]
  - - [43264, 1792, 1, 256]
    - [108, 4888.68]
  - - [40192, 1280, 1, 256]
    - [108, 4867.36]
  - - [20736, 8193, 1, 256]
    - [114, 4814.18]
  - - [22272, 2048, 1, 256]
    - [114, 4832.21]
  - - [30976, 9216, 1, 256]
    - [114, 4890.09]
  - - [1280, 1281, 1, 256]
    - [121, 3814.6]
  - - [24320, 2048, 1, 256]
    - [114, 4833.61]
  - - [3840, 1024, 1, 256]
    - [131, 4338.94]
  - - [23552, 1536, 1, 256]
    - [114, 4816.73]
  - - [16384, 3072, 1, 256]
    - [114, 4834.64]
  - - [25856, 1280, 1, 256]
    - [108, 4837.78]
  - - [40192, 27648, 1, 256]
    - [114, 4899.44]
  - - [18688, 2048, 1, 256]
    - [114, 4807.04]
  - - [31232, 1792, 1, 256]
    - [108, 4884.35]
  - - [36352, 23809, 1, 256]
    - [108, 4889.75]
  - - [23552, 1281, 1, 256]
    - [111, 4645.58]
  - - [25344, 512, 1, 256]
    - [114, 4658.51]
  - - [15872, 3329, 1, 256]
    - [108, 4749.94]
  - - [1792, 1792, 1, 256]
    - [120, 4201.16]
  - - [31744, 1792, 1, 256]
    - [108, 4872.27]
  - - [14336, 1281, 1, 256]
    - [111, 4585.91]
  - - [9984, 3072, 1, 256]
    - [114, 4803.46]
  - - [11776, 1792, 1, 256]
    - [114, 4762.05]
  - - [7680, 1024, 1, 256]
    - [114, 4590.21]
  - - [37120, 1536, 1, 256]
    - [114, 4850.07]
  - - [14592, 2304, 1, 256]
    - [108, 4845.03]
  - - [16384, 1281, 1, 256]
    - [110, 4598.04]
  - - [7424, 768, 1, 256]
    - [114, 4468.58]
  - - [10240, 1536, 1, 256]
    - [114, 4677.88]
  - - [2816, 2561, 1, 256]
    - [114, 4419.32]
  - - [16896, 2048, 1, 256]
    - [114, 4807.33]
  - - [35072, 1280, 1, 256]
    - [108, 4862.24]
  - - [27392, 9216, 1, 256]
    - [114, 4892.62]
  - - [15104, 1280, 1, 256]
    - [114, 4749.24]
  - - [15104, 3072, 1, 256]
    - [114, 4829.19]
  - - [19200, 9216, 1, 256]
    - [114, 4892.23]
  - - [12544, 1024, 1, 256]
    - [114, 4652.43]
  - - [6656, 1280, 1, 256]
    - [108, 4605.62]
  - - [32256, 256, 1, 256]
    - [108, 4652.54]
  - - [36096, 23553, 1, 256]
    - [114, 4842.95]
  - - [14336, 256, 1, 256]
    - [130, 4279.12]
  - - [1024, 1025, 1, 256]
    - [95, 3821.07]
  - - [9216, 1280, 1, 256]
    - [108, 4680.56]
  - - [16128, 3841, 1, 256]
    - [108, 4789.84]
  - - [18432, 5889, 1, 256]
    - [108, 4831.48]
  - - [42496, 1280, 1, 256]
    - [108, 4874.3]
  - - [43776, 3841, 1, 256]
    - [108, 4828.55]
  - - [22528, 10241, 1, 256]
    - [114, 4822.0]
  - - [20224, 3072, 1, 256]
    - [114, 4847.43]
  - - [29184, 1024, 1, 256]
    - [114, 4804.93]
  - - [39680, 3072, 1, 256]
    - [114, 4879.87]
  - - [20736, 8449, 1, 256]
    - [108, 4871.02]
  - - [15104, 2816, 1, 256]
    - [108, 4846.88]
  - - [25088, 1536, 1, 256]
    - [114, 4798.81]
  - - [30720, 1792, 1, 256]
    - [108, 4882.78]
  - - [36864, 24321, 1, 256]
    - [108, 4898.3]
  - - [12288, 1281, 1, 256]
    - [111, 4569.0]
  - - [22784, 1536, 1, 256]
    - [114, 4806.97]
  - - [35584, 1281, 1, 256]
    - [110, 4679.24]
  - - [7424, 4097, 1, 256]
    - [114, 4677.61]
  - - [20224, 1281, 1, 256]
    - [111, 4629.47]
  - - [7680, 4609, 1, 256]
    - [114, 4717.36]
  - - [9216, 2048, 1, 256]
    - [114, 4715.83]
  - - [12032, 768, 1, 256]
    - [108, 4602.67]
  - - [1792, 3072, 1, 256]
    - [121, 4483.61]
  - - [6400, 3073, 1, 256]
    - [114, 4596.99]
  - - [29440, 17153, 1, 256]
    - [108, 4897.93]
  - - [8704, 1792, 1, 256]
    - [114, 4718.05]
  - - [20224, 2048, 1, 256]
    - [114, 4814.82]
  - - [30720, 3072, 1, 256]
    - [114, 4863.94]
  - - [37632, 256, 1, 256]
    - [114, 4629.89]
  - - [16384, 512, 1, 256]
    - [114, 4534.77]
  - - [38912, 256, 1, 256]
    - [108, 4601.14]
  - - [5120, 512, 1, 256]
    - [131, 4205.87]
  - - [17920, 2048, 1, 256]
    - [114, 4801.53]
  - - [30464, 256, 1, 256]
    - [114, 4603.6]
  - - [8704, 256, 1, 256]
    - [108, 4172.22]
  - - [16384, 3841, 1, 256]
    - [108, 4773.2]
  - - [40192, 9216, 1, 256]
    - [114, 4884.88]
  - - [15616, 1792, 1, 256]
    - [108, 4807.84]
  - - [32512, 1024, 1, 256]
    - [114, 4797.7]
  - - [23040, 1792, 1, 256]
    - [108, 4856.04]
  - - [42240, 1281, 1, 256]
    - [111, 4696.3]
  - - [6912, 1536, 1, 256]
    - [114, 4626.39]
  - - [37888, 25601, 1, 256]
    - [114, 4845.53]
  - - [26368, 14080, 1, 256]
    - [108, 4926.21]
  - - [37632, 1280, 1, 256]
    - [108, 4872.24]
  - - [30208, 3072, 1, 256]
    - [114, 4861.41]
  - - [36608, 1281, 1, 256]
    - [104, 4680.64]
  - - [30464, 512, 1, 256]
    - [114, 4691.88]
  - - [26880, 768, 1, 256]
    - [108, 4782.99]
  - - [33024, 20736, 1, 256]
    - [108, 4937.08]
  - - [35072, 22784, 1, 256]
    - [108, 4937.24]
  - - [9472, 6145, 1, 256]
    - [114, 4753.47]
  - - [22784, 1792, 1, 256]
    - [108, 4851.38]
  - - [22272, 1280, 1, 256]
    - [108, 4820.91]
  - - [13568, 1281, 1, 256]
    - [110, 4584.02]
  - - [5120, 1536, 1, 256]
    - [129, 4516.08]
  - - [25088, 2048, 1, 256]
    - [114, 4832.52]
  - - [6656, 3072, 1, 256]
    - [114, 4733.16]
  - - [32768, 1280, 1, 256]
    - [108, 4854.52]
  - - [768, 2048, 1, 256]
    - [119, 4135.73]
  - - [4352, 1281, 1, 256]
    - [108, 4300.28]
  - - [27904, 1281, 1, 256]
    - [105, 4662.46]
  - - [15104, 2048, 1, 256]
    - [114, 4793.37]
  - - [9728, 1281, 1, 256]
    - [111, 4508.42]
  - - [30720, 2048, 1, 256]
    - [114, 4850.83]
  - - [1024, 1280, 1, 256]
    - [120, 4046.62]
  - - [10496, 1280, 1, 256]
    - [108, 4685.99]
  - - [6400, 3328, 1, 256]
    - [108, 4768.92]
  - - [36352, 1024, 1, 256]
    - [114, 4816.95]
  - - [12544, 1280, 1, 256]
    - [108, 4737.03]
  - - [40704, 512, 1, 256]
    - [114, 4759.79]
  - - [10240, 1281, 1, 256]
    - [111, 4538.91]
  - - [8704, 1281, 1, 256]
    - [110, 4493.63]
  - - [40192, 1024, 1, 256]
    - [114, 4827.13]
  - - [13312, 1792, 1, 256]
    - [108, 4784.63]
  - - [41984, 27648, 1, 256]
    - [114, 4899.26]
  - - [33024, 20481, 1, 256]
    - [114, 4844.49]
  - - [33280, 1536, 1, 256]
    - [114, 4835.86]
  - - [9216, 3072, 1, 256]
    - [114, 4788.68]
  - - [2816, 1536, 1, 256]
    - [99, 4333.5]
  - - [22528, 1792, 1, 256]
    - [108, 4850.54]
  - - [25088, 768, 1, 256]
    - [108, 4756.33]
  - - [128, 1, 1, 128]
    - [132, 1.10703]
  - - [38144, 38144, 1, 256]
    - [147, 4943.9]
  - - [29568, 128, 1, 384]
    - [170, 4500.12]
  - - [30848, 128, 1, 256]
    - [170, 4373.71]
  - - [25728, 128, 1, 384]
    - [170, 4474.28]
  - - [32256, 32256, 1, 256]
    - [147, 4916.59]
  - - [7680, 7680, 1, 256]
    - [142, 4862.87]
  - - [11648, 128, 1, 128]
    - [171, 3500.48]
  - - [41984, 41984, 1, 256]
    - [145, 4914.24]
  - - [40448, 40448, 1, 256]
    - [147, 4917.65]
  - - [25728, 128, 1, 256]
    - [170, 4361.94]
  - - [64, 64, 1, 64]
    - [133, 27.2934]
  - - [15104, 15104, 1, 256]
    - [142, 4937.76]
  - - [17280, 17280, 1, 384]
    - [142, 5028.99]
  - - [34688, 128, 1, 384]
    - [170, 4631.7]
  - - [27392, 27392, 1, 256]
    - [141, 4944.63]
  - - [6528, 128, 1, 256]
    - [166, 3504.52]
  - - [35328, 35328, 1, 256]
    - [142, 4913.11]
  - - [18432, 18432, 1, 384]
    - [147, 5016.46]
  - - [31232, 31232, 1, 256]
    - [147, 4912.63]
  - - [7808, 128, 1, 256]
    - [170, 3823.36]
  - - [38400, 38400, 1, 384]
    - [145, 5031.72]
  - - [16128, 16128, 1, 256]
    - [142, 4943.1]
  - - [9472, 9472, 1, 256]
    - [142, 4905.53]
  - - [21888, 21888, 1, 384]
    - [145, 5036.59]
  - - [37248, 128, 1, 128]
    - [170, 4144.84]
  - - [38656, 38656, 1, 256]
    - [142, 4955.18]
  - - [20224, 20224, 1, 256]
    - [142, 4937.51]
  - - [8960, 8960, 1, 256]
    - [142, 4907.76]
  - - [29952, 29952, 1, 384]
    - [145, 5037.58]
  - - [36864, 36864, 1, 384]
    - [145, 5033.08]
  - - [33408, 33408, 1, 384]
    - [145, 5043.59]
  - - [20608, 128, 1, 384]
    - [170, 4271.16]
  - - [23424, 23424, 1, 384]
    - [145, 5031.67]
  - - [4864, 4864, 1, 256]
    - [142, 4801.26]
  - - [25728, 128, 1, 128]
    - [170, 3991.84]
  - - [21504, 21504, 1, 384]
    - [142, 5021.96]
  - - [25600, 25600, 1, 256]
    - [147, 4903.33]
  - - [40960, 40960, 1, 256]
    - [143, 4913.07]
  - - [19200, 19200, 1, 384]
    - [142, 5039.69]
  - - [64, 1, 1, 64]
    - [134, 0.533898]
  - - [25088, 25088, 1, 256]
    - [147, 4917.26]
  - - [41728, 41728, 1, 256]
    - [142, 4951.07]
  - - [35840, 35840, 1, 256]
    - [145, 4914.08]
  - - [34560, 34560, 1, 256]
    - [142, 4938.45]
  - - [26368, 26368, 1, 256]
    - [142, 4930.21]
  - - [5888, 5888, 1, 256]
    - [142, 4847.68]
  - - [28032, 28032, 1, 384]
    - [141, 5039.89]
  - - [42496, 42496, 1, 256]
    - [147, 4913.76]
  - - [27008, 128, 1, 256]
    - [170, 4323.92]
  - - [38400, 38400, 1, 256]
    - [147, 4915.22]
  - - [11008, 11008, 1, 256]
    - [142, 4903.93]
  - - [19328, 128, 1, 128]
    - [170, 3802.57]
  - - [32000, 32000, 1, 256]
    - [147, 4933.69]
  - - [37248, 37248, 1, 384]
    - [145, 5048.22]
  - - [10496, 10496, 1, 256]
    - [142, 4921.49]
  - - [3328, 3328, 1, 256]
    - [142, 4642.43]
  - - [16640, 16640, 1, 256]
    - [142, 4936.15]
  - - [24960, 24960, 1, 384]
    - [142, 5038.43]
  - - [1536, 1536, 1, 384]
    - [137, 4666.2]
  - - [18688, 18688, 1, 256]
    - [142, 4946.32]
  - - [22272, 22272, 1, 384]
    - [145, 5031.87]
  - - [15488, 128, 1, 256]
    - [170, 4149.14]
  - - [28416, 28416, 1, 384]
    - [143, 5039.77]
  - - [3840, 3840, 1, 256]
    - [141, 4748.37]
  - - [19968, 19968, 1, 384]
    - [142, 5016.55]
  - - [43776, 43776, 1, 256]
    - [142, 4949.93]
  - - [35072, 35072, 1, 256]
    - [145, 4937.05]
  - - [20736, 20736, 1, 256]
    - [142, 4948.08]
  - - [7168, 7168, 1, 256]
    - [147, 4838.59]
  - - [18432, 18432, 1, 256]
    - [147, 4913.11]
  - - [38016, 38016, 1, 384]
    - [145, 5038.44]
  - - [35328, 35328, 1, 384]
    - [145, 5030.93]
  - - [38784, 38784, 1, 384]
    - [145, 5052.66]
  - - [26112, 26112, 1, 384]
    - [143, 5024.09]
  - - [43648, 128, 1, 128]
    - [171, 4199.82]
  - - [27264, 27264, 1, 384]
    - [142, 5038.86]
  - - [44928, 44928, 1, 384]
    - [145, 5044.33]
  - - [41088, 128, 1, 384]
    - [167, 4559.74]
  - - [42368, 128, 1, 256]
    - [170, 4531.75]
  - - [3072, 3072, 1, 384]
    - [149, 4787.52]
  - - [3456, 3072, 1, 384]
    - [149, 4812.95]
  - - [9216, 9216, 1, 384]
    - [147, 4982.67]
  - - [38528, 128, 1, 128]
    - [171, 4208.38]
  - - [10752, 10752, 1, 256]
    - [142, 4887.31]
  - - [9088, 128, 1, 384]
    - [167, 4442.16]
  - - [17152, 17152, 1, 256]
    - [142, 4931.41]
  - - [44928, 128, 1, 384]
    - [167, 4690.63]
  - - [18048, 128, 1, 128]
    - [170, 3789.16]
  - - [7808, 128, 1, 384]
    - [170, 4053.53]
  - - [29184, 29184, 1, 256]
    - [147, 4921.38]
  - - [11776, 11776, 1, 256]
    - [147, 4885.14]
  - - [1, 64, 1, 64]
    - [134, 0.533898]
  - - [27136, 27136, 1, 256]
    - [145, 4903.92]
  - - [30848, 128, 1, 128]
    - [170, 4062.91]
  - - [33408, 128, 1, 256]
    - [170, 4422.83]
  - - [33792, 33792, 1, 384]
    - [145, 5023.93]
  - - [4224, 4224, 1, 384]
    - [147, 4889.9]
  - - [43520, 43520, 1, 256]
    - [145, 4915.48]
  - - [14592, 14592, 1, 384]
    - [142, 5010.82]
  - - [41472, 41472, 1, 256]
    - [143, 4912.61]
  - - [14080, 14080, 1, 256]
    - [142, 4924.02]
  - - [34688, 128, 1, 256]
    - [170, 4509.21]
  - - [16896, 16896, 1, 256]
    - [147, 4908.58]
  - - [15744, 15744, 1, 384]
    - [142, 5029.44]
  - - [28416, 28416, 1, 256]
    - [142, 4935.61]
  - - [24448, 128, 1, 128]
    - [170, 3997.67]
  - - [23808, 23808, 1, 256]
    - [142, 4947.3]
  - - [27648, 27648, 1, 256]
    - [147, 4917.43]
  - - [1152, 3072, 1, 384]
    - [147, 4728.55]
  - - [21888, 128, 1, 256]
    - [170, 4328.04]
  - - [2688, 128, 1, 384]
    - [170, 2845.07]
  - - [34816, 34816, 1, 256]
    - [147, 4915.89]
  - - [43776, 43776, 1, 384]
    - [145, 5043.72]
  - - [36096, 36096, 1, 256]
    - [142, 4953.11]
  - - [24320, 24320, 1, 256]
    - [142, 4943.05]
  - - [12544, 12544, 1, 256]
    - [142, 4930.08]
  - - [29184, 29184, 1, 384]
    - [145, 5029.48]
  - - [29568, 29568, 1, 384]
    - [145, 5040.42]
  - - [12928, 128, 1, 384]
    - [170, 4087.04]
  - - [36480, 36480, 1, 384]
    - [145, 5046.92]
  - - [30720, 30720, 1, 256]
    - [147, 4918.18]
  - - [25728, 25728, 1, 384]
    - [142, 5038.98]
  - - [34048, 34048, 1, 256]
    - [142, 4947.92]
  - - [2304, 2048, 1, 256]
    - [158, 4456.86]
  - - [12928, 128, 1, 256]
    - [170, 3941.53]
  - - [9728, 9728, 1, 256]
    - [147, 4882.27]
  - - [128, 128, 1, 256]
    - [169, 187.012]
  - - [33024, 33024, 1, 256]
    - [142, 4946.68]
  - - [15488, 128, 1, 384]
    - [170, 4302.02]
  - - [23168, 128, 1, 128]
    - [170, 3897.27]
  - - [39808, 128, 1, 384]
    - [170, 4564.45]
  - - [18176, 18176, 1, 256]
    - [142, 4927.89]
  - - [21504, 21504, 1, 256]
    - [142, 4914.08]
  - - [41088, 128, 1, 128]
    - [170, 4181.38]
  - - [16384, 16384, 1, 256]
    - [142, 4903.46]
  - - [1920, 1920, 1, 384]
    - [157, 4414.41]
  - - [3968, 128, 1, 128]
    - [170, 2987.77]
  - - [27008, 128, 1, 384]
    - [167, 4596.06]
  - - [27904, 27904, 1, 256]
    - [141, 4934.41]
  - - [24448, 128, 1, 384]
    - [170, 4560.86]
  - - [7680, 7680, 1, 384]
    - [147, 4980.49]
  - - [35968, 128, 1, 384]
    - [167, 4651.98]
  - - [37632, 37632, 1, 256]
    - [142, 4941.2]
  - - [14848, 14848, 1, 256]
    - [142, 4899.06]
  - - [8832, 8832, 1, 384]
    - [142, 5012.45]
  - - [23552, 23552, 1, 256]
    - [147, 4906.7]
  - - [4608, 4608, 1, 50000]
    - [150, 5244.16]
  - - [13056, 13056, 1, 256]
    - [142, 4931.27]
  - - [38528, 128, 1, 256]
    - [170, 4508.98]
  - - [19584, 19584, 1, 384]
    - [142, 5045.72]
  - - [16768, 128, 1, 384]
    - [167, 4251.97]
  - - [22784, 22784, 1, 256]
    - [147, 4931.26]
  - - [44160, 44160, 1, 384]
    - [145, 5044.61]
  - - [28160, 28160, 1, 256]
    - [145, 4905.21]
  - - [14592, 14592, 1, 256]
    - [142, 4946.21]
  - - [20992, 20992, 1, 256]
    - [147, 4900.1]
  - - [41216, 41216, 1, 256]
    - [142, 4935.73]
  - - [21760, 21760, 1, 256]
    - [142, 4948.42]
  - - [25344, 25344, 1, 256]
    - [147, 4936.65]
  - - [35968, 128, 1, 128]
    - [171, 4143.1]
  - - [4608, 4608, 1, 256]
    - [147, 4771.88]
  - - [3456, 3456, 1, 384]
    - [141, 4829.19]
  - - [2560, 2048, 1, 256]
    - [158, 4438.52]
  - - [30464, 30464, 1, 256]
    - [142, 4943.55]
  - - [19200, 19200, 1, 256]
    - [142, 4945.99]
  - - [22272, 22272, 1, 256]
    - [147, 4937.02]
  - - [29952, 29952, 1, 256]
    - [142, 4944.23]
  - - [20480, 20480, 1, 256]
    - [147, 4908.12]
  - - [5376, 5376, 1, 384]
    - [141, 4947.38]
  - - [17408, 17408, 1, 256]
    - [147, 4913.14]
  - - [32768, 32768, 1, 256]
    - [143, 4905.23]
  - - [18816, 18816, 1, 384]
    - [143, 5032.71]
  - - [3840, 3840, 1, 384]
    - [142, 4870.49]
  - - [34944, 34944, 1, 384]
    - [145, 5043.67]
  - - [18048, 18048, 1, 384]
    - [144, 5025.13]
  - - [34560, 34560, 1, 384]
    - [145, 5042.34]
  - - [9088, 128, 1, 256]
    - [167, 4182.62]
  - - [24576, 24576, 1, 256]
    - [147, 4922.58]
  - - [32128, 128, 1, 384]
    - [170, 4573.65]
  - - [8448, 8448, 1, 256]
    - [142, 4918.9]
  - - [42752, 42752, 1, 256]
    - [141, 4942.12]
  - - [5376, 5376, 1, 256]
    - [142, 4841.33]
  - - [18048, 128, 1, 256]
    - [170, 4308.07]
  - - [3584, 3584, 1, 256]
    - [142, 4668.65]
  - - [37120, 37120, 1, 256]
    - [142, 4942.06]
  - - [39936, 39936, 1, 384]
    - [145, 5032.26]
  - - [20736, 20736, 1, 384]
    - [142, 5031.15]
  - - [35584, 35584, 1, 256]
    - [142, 4939.16]
  - - [26112, 26112, 1, 256]
    - [142, 4912.14]
  - - [16896, 16896, 1, 384]
    - [147, 5009.38]
  - - [40704, 40704, 1, 384]
    - [145, 5044.28]
  - - [33280, 33280, 1, 256]
    - [147, 4917.89]
  - - [32128, 128, 1, 128]
    - [171, 4099.67]
  - - [5632, 5632, 1, 256]
    - [142, 4794.38]
  - - [19456, 19456, 1, 256]
    - [147, 4903.72]
  - - [22016, 22016, 1, 256]
    - [147, 4909.88]
  - - [29568, 128, 1, 128]
    - [170, 4035.77]
  - - [14208, 128, 1, 256]
    - [170, 4244.88]
  - - [10368, 128, 1, 128]
    - [170, 3276.9]
  - - [13568, 13568, 1, 256]
    - [142, 4929.95]
  - - [30848, 128, 1, 384]
    - [170, 4442.91]
  - - [1408, 128, 1, 384]
    - [170, 2028.41]
  - - [5760, 5760, 1, 5760]
    - [151, 5159.65]
  - - [10752, 10752, 1, 384]
    - [147, 4998.53]
  - - [39936, 39936, 1, 256]
    - [147, 4913.77]
  - - [1920, 3072, 1, 384]
    - [138, 4826.07]
  - - [9984, 9984, 1, 256]
    - [142, 4920.15]
  - - [13056, 13056, 1, 384]
    - [142, 5023.88]
  - - [2816, 2048, 1, 256]
    - [162, 4480.55]
  - - [23168, 128, 1, 256]
    - [170, 4268.93]
  - - [19968, 19968, 1, 256]
    - [142, 4916.14]
  - - [44800, 44800, 1, 256]
    - [142, 4946.6]
  - - [11904, 11904, 1, 384]
    - [144, 5015.21]
  - - [14976, 14976, 1, 384]
    - [142, 5021.97]
  - - [35712, 35712, 1, 384]
    - [145, 5044.02]
  - - [12672, 12672, 1, 384]
    - [142, 5022.44]
  - - [43008, 43008, 1, 384]
    - [145, 5032.11]
  - - [41088, 41088, 1, 384]
    - [145, 5046.25]
  - - [10368, 128, 1, 384]
    - [164, 3879.58]
  - - [6912, 6912, 1, 384]
    - [147, 4979.28]
  - - [27008, 128, 1, 128]
    - [170, 4001.0]
  - - [16128, 16128, 1, 384]
    - [144, 5028.0]
  - - [5120, 5120, 1, 256]
    - [147, 4783.88]
  - - [25856, 25856, 1, 256]
    - [142, 4933.74]
  - - [12288, 12288, 1, 256]
    - [142, 4899.0]
  - - [6400, 6400, 1, 256]
    - [142, 4861.55]
  - - [2688, 128, 1, 256]
    - [170, 2678.94]
  - - [11648, 128, 1, 256]
    - [170, 4050.2]
  - - [43264, 43264, 1, 256]
    - [147, 4943.22]
  - - [19712, 19712, 1, 256]
    - [142, 4935.61]
  - - [34176, 34176, 1, 384]
    - [145, 5041.36]
  - - [31104, 31104, 1, 384]
    - [145, 5042.45]
  - - [36608, 36608, 1, 256]
    - [142, 4943.56]
  - - [39808, 128, 1, 256]
    - [170, 4481.44]
  - - [13824, 13824, 1, 384]
    - [147, 4995.17]
  - - [42624, 42624, 1, 384]
    - [145, 5050.38]
  - - [21120, 21120, 1, 384]
    - [145, 5030.93]
  - - [23296, 23296, 1, 256]
    - [142, 4939.69]
  - - [42240, 42240, 1, 256]
    - [142, 4947.55]
  - - [33408, 128, 1, 384]
    - [168, 4605.93]
  - - [43648, 128, 1, 256]
    - [170, 4512.52]
  - - [19328, 128, 1, 384]
    - [170, 4341.22]
  - - [33792, 33792, 1, 256]
    - [142, 4920.35]
  - - [31488, 31488, 1, 256]
    - [141, 4951.56]
  - - [1408, 128, 1, 128]
    - [170, 1624.65]
  - - [768, 3072, 1, 384]
    - [137, 4699.12]
  - - [6144, 6144, 1, 256]
    - [147, 4845.7]
  - - [20352, 20352, 1, 384]
    - [142, 5031.98]
  - - [23168, 128, 1, 384]
    - [167, 4385.32]
  - - [33536, 33536, 1, 256]
    - [141, 4934.95]
  - - [32640, 32640, 1, 384]
    - [145, 5044.0]
  - - [20608, 128, 1, 128]
    - [170, 3823.03]
  - - [10368, 10368, 1, 384]
    - [142, 5013.39]
  - - [34688, 128, 1, 128]
    - [171, 4159.41]
  - - [1536, 3072, 1, 384]
    - [147, 4745.39]
  - - [19328, 128, 1, 256]
    - [170, 4208.9]
  - - [2688, 3072, 1, 384]
    - [147, 4823.2]
  - - [24192, 24192, 1, 384]
    - [145, 5033.08]
  - - [6912, 6912, 1, 256]
    - [142, 4880.08]
  - - [28288, 128, 1, 128]
    - [171, 4052.83]
  - - [15360, 15360, 1, 256]
    - [142, 4908.32]
  - - [18944, 18944, 1, 256]
    - [147, 4911.64]
  - - [37376, 37376, 1, 256]
    - [145, 4913.71]
  - - [31488, 31488, 1, 384]
    - [145, 5043.29]
  - - [26880, 26880, 1, 256]
    - [142, 4947.17]
  - - [44928, 128, 1, 128]
    - [171, 4272.8]
  - - [24448, 128, 1, 256]
    - [170, 4426.13]
  - - [31872, 31872, 1, 384]
    - [145, 5041.36]
  - - [1408, 128, 1, 256]
    - [170, 1909.76]
  - - [38528, 128, 1, 384]
    - [170, 4629.34]
  - - [15488, 128, 1, 128]
    - [170, 3662.85]
  - - [15616, 15616, 1, 256]
    - [142, 4935.01]
  - - [39552, 39552, 1, 384]
    - [145, 5044.48]
  - - [4352, 4352, 1, 256]
    - [142, 4789.71]
  - - [28288, 128, 1, 384]
    - [170, 4562.42]
  - - [10368, 128, 1, 256]
    - [171, 3639.12]
  - - [32128, 128, 1, 256]
    - [170, 4456.46]
  - - [12288, 12288, 1, 384]
    - [147, 4999.59]
  - - [4608, 4608, 1, 4608]
    - [150, 5198.78]
  - - [5760, 5760, 1, 384]
    - [142, 4959.23]
  - - [8704, 8704, 1, 256]
    - [147, 4860.38]
  - - [17664, 17664, 1, 256]
    - [142, 4947.54]
  - - [6528, 128, 1, 128]
    - [166, 2872.14]
  - - [24576, 24576, 1, 384]
    - [145, 5023.13]
  - - [37248, 128, 1, 384]
    - [170, 4520.18]
  - - [34304, 34304, 1, 256]
    - [143, 4910.05]
  - - [14208, 128, 1, 128]
    - [171, 3718.69]
  - - [39808, 128, 1, 128]
    - [170, 4160.69]
  - - [42368, 128, 1, 384]
    - [168, 4629.88]
  - - [17664, 17664, 1, 384]
    - [142, 5030.84]
  - - [12800, 12800, 1, 256]
    - [147, 4888.7]
  - - [2304, 2304, 1, 384]
    - [138, 4626.6]
  - - [26624, 26624, 1, 256]
    - [147, 4915.6]
  - - [36864, 36864, 1, 256]
    - [145, 4910.45]
  - - [40704, 40704, 1, 256]
    - [142, 4938.55]
  - - [12032, 12032, 1, 256]
    - [142, 4919.2]
  - - [33024, 33024, 1, 384]
    - [145, 5042.38]
  - - [28800, 28800, 1, 384]
    - [142, 5039.98]
  - - [14208, 128, 1, 384]
    - [170, 4433.52]
  - - [22656, 22656, 1, 384]
    - [142, 5036.01]
  - - [41472, 41472, 1, 384]
    - [143, 5031.76]
  - - [39680, 39680, 1, 256]
    - [142, 4943.85]
  - - [44032, 44032, 1, 256]
    - [145, 4914.27]
  - - [43392, 43392, 1, 384]
    - [145, 5048.43]
  - - [42240, 42240, 1, 384]
    - [145, 5046.79]
  - - [38912, 38912, 1, 256]
    - [147, 4920.27]
  - - [23040, 23040, 1, 384]
    - [145, 5020.42]
  - - [13312, 13312, 1, 256]
    - [147, 4891.5]
  - - [128, 128, 1, 384]
    - [172, 210.095]
  - - [11136, 11136, 1, 384]
    - [147, 5012.69]
  - - [39168, 39168, 1, 256]
    - [142, 4949.56]
  - - [25344, 25344, 1, 384]
    - [142, 5040.1]
  - - [5248, 128, 1, 256]
    - [165, 3506.76]
  - - [30208, 30208, 1, 256]
    - [147, 4913.41]
  - - [40192, 40192, 1, 256]
    - [142, 4951.59]
  - - [15872, 15872, 1, 256]
    - [147, 4908.6]
  - - [44544, 44544, 1, 256]
    - [147, 4925.77]
  - - [11520, 11520, 1, 256]
    - [142, 4927.96]
  - - [15360, 15360, 1, 384]
    - [147, 5006.89]
  - - [23040, 23040, 1, 256]
    - [142, 4921.55]
  - - [26496, 26496, 1, 384]
    - [145, 5038.39]
  - - [11264, 11264, 1, 256]
    - [147, 4882.89]
  - - [18048, 128, 1, 384]
    - [167, 4501.3]
  - - [30976, 30976, 1, 256]
    - [141, 4933.17]
  - - [11648, 128, 1, 384]
    - [164, 4249.83]
  - - [2304, 3072, 1, 384]
    - [138, 4820.46]
  - - [6144, 6144, 1, 384]
    - [147, 4942.99]
  - - [28928, 28928, 1, 256]
    - [147, 4937.28]
  - - [11520, 11520, 1, 384]
    - [147, 5020.13]
  - - [43008, 43008, 1, 256]
    - [142, 4926.37]
  - - [3072, 3072, 1, 384]
    - [147, 4831.68]
  - - [29440, 29440, 1, 256]
    - [142, 4941.44]
  - - [36352, 36352, 1, 256]
    - [142, 4907.88]
  - - [32256, 32256, 1, 384]
    - [145, 5028.99]
  - - [23808, 23808, 1, 384]
    - [145, 5036.59]
  - - [9984, 9984, 1, 384]
    - [142, 5008.55]
  - - [37248, 128, 1, 256]
    - [170, 4453.99]
  - - [1, 1, 1, 64]
    - [134, 0.10647773]
  - - [6528, 6528, 1, 384]
    - [142, 4987.56]
  - - [7296, 7296, 1, 384]
    - [142, 4994.02]
  - - [37888, 37888, 1, 256]
    - [143, 4912.4]
  - - [35968, 128, 1, 256]
    - [170, 4465.17]
  - - [13824, 13824, 1, 256]
    - [147, 4909.14]
  - - [39168, 39168, 1, 384]
    - [145, 5040.66]
  - - [2688, 128, 1, 128]
    - [170, 2293.86]
  - - [37632, 37632, 1, 384]
    - [145, 5042.51]
  - - [29568, 128, 1, 256]
    - [170, 4399.33]
  - - [42368, 128, 1, 128]
    - [171, 4214.27]
  - - [14336, 14336, 1, 256]
    - [147, 4896.35]
  - - [8064, 8064, 1, 384]
    - [142, 5003.34]
  - - [28288, 128, 1, 256]
    - [170, 4432.69]
  - - [16512, 16512, 1, 384]
    - [142, 5032.56]
  - - [30720, 30720, 1, 384]
    - [145, 5032.68]
  - - [21888, 128, 1, 128]
    - [171, 3898.07]
  - - [21248, 21248, 1, 256]
    - [142, 4944.98]
  - - [12928, 128, 1, 128]
    - [171, 3495.35]
  - - [29696, 29696, 1, 256]
    - [147, 4913.37]
  - - [384, 3072, 1, 384]
    - [138, 4524.53]
  - - [28672, 28672, 1, 256]
    - [142, 4908.17]
  - - [32512, 32512, 1, 256]
    - [142, 4930.63]
  - - [2688, 2688, 1, 384]
    - [142, 4703.66]
  - - [9216, 9216, 1, 256]
    - [147, 4886.18]
  - - [6656, 6656, 1, 256]
    - [147, 4834.54]
  - - [6528, 128, 1, 384]
    - [163, 3598.85]
  - - [33408, 128, 1, 128]
    - [170, 4076.33]
  - - [30336, 30336, 1, 384]
    - [142, 5043.2]
  - - [16768, 128, 1, 128]
    - [170, 3704.62]
  - - [13440, 13440, 1, 384]
    - [142, 5027.05]
  - - [20608, 128, 1, 256]
    - [170, 4181.94]
  - - [4992, 4992, 1, 384]
    - [142, 4934.46]
  - - [7936, 7936, 1, 256]
    - [142, 4884.17]
  - - [41856, 41856, 1, 384]
    - [145, 5048.34]
  - - [44288, 44288, 1, 256]
    - [142, 4953.7]
  - - [7744, 7744, 1, 7744]
    - [148, 5185.01]
  - - [7424, 7424, 1, 256]
    - [142, 4881.52]
  - - [39424, 39424, 1, 256]
    - [143, 4913.85]
  - - [43648, 128, 1, 384]
    - [170, 4587.0]
  - - [14208, 14208, 1, 384]
    - [142, 5027.39]
  - - [36096, 36096, 1, 384]
    - [145, 5035.67]
  - - [44544, 44544, 1, 384]
    - [145, 5036.32]
  - - [22528, 22528, 1, 256]
    - [147, 4904.8]
  - - [4096, 4096, 1, 256]
    - [142, 4699.6]
  - - [4608, 4608, 1, 384]
    - [147, 4895.94]
  - - [7808, 128, 1, 128]
    - [171, 3297.17]
  - - [5248, 128, 1, 128]
    - [171, 2977.36]
  - - [9088, 128, 1, 128]
    - [168, 3396.49]
  - - [31744, 31744, 1, 256]
    - [147, 4909.81]
  - - [3968, 128, 1, 384]
    - [170, 3970.68]
  - - [17920, 17920, 1, 256]
    - [147, 4908.94]
  - - [5248, 128, 1, 384]
    - [165, 3773.5]
  - - [26880, 26880, 1, 384]
    - [145, 5036.45]
  - - [8192, 8192, 1, 256]
    - [147, 4865.76]
  - - [3968, 128, 1, 256]
    - [170, 3640.17]
  - - [41088, 128, 1, 256]
    - [170, 4463.61]
  - - [21888, 128, 1, 384]
    - [170, 4457.5]
  - - [16768, 128, 1, 256]
    - [170, 4102.96]
  - - [24064, 24064, 1, 256]
    - [147, 4908.64]
  - - [44928, 128, 1, 256]
    - [170, 4557.43]
  - - [9600, 9600, 1, 384]
    - [142, 5008.85]
  - - [27648, 27648, 1, 384]
    - [143, 5021.75]
  - - [24832, 24832, 1, 256]
    - [142, 4935.51]
  - - [8448, 8448, 1, 384]
    - [142, 4999.4]
  - - [128, 128, 1, 128]
    - [169, 153.85]
  - - [10240, 10240, 1, 256]
    - [147, 4871.43]
  - - [40320, 40320, 1, 384]
    - [145, 5041.99]
  - - [18048, 3072, 1, 384]
    - [186, 4976.1]
  - - [2304, 1153, 1, 384]
    - [206, 4220.28]
  - - [18432, 2688, 1, 384]
    - [187, 4980.56]
  - - [3840, 2304, 1, 384]
    - [186, 4762.62]
  - - [41856, 384, 1, 384]
    - [186, 4914.52]
  - - [30720, 1152, 1, 384]
    - [186, 4975.55]
  - - [43008, 2304, 1, 384]
    - [191, 5000.3]
  - - [26496, 768, 1, 384]
    - [186, 4924.1]
  - - [43776, 3072, 1, 384]
    - [187, 5014.5]
  - - [30336, 1536, 1, 384]
    - [191, 4975.05]
  - - [38400, 384, 1, 384]
    - [187, 4880.9]
  - - [28800, 384, 1, 384]
    - [186, 4796.5]
  - - [3840, 3072, 1, 384]
    - [187, 4825.66]
  - - [44160, 3072, 1, 384]
    - [187, 5014.37]
  - - [41472, 1153, 1, 384]
    - [187, 4774.96]
  - - [33408, 1920, 1, 384]
    - [187, 4993.54]
  - - [6912, 384, 1, 384]
    - [218, 4285.4]
  - - [21504, 1153, 1, 384]
    - [187, 4755.44]
  - - [24576, 1920, 1, 384]
    - [187, 4996.29]
  - - [23040, 3072, 1, 384]
    - [187, 4993.1]
  - - [28032, 1152, 1, 384]
    - [187, 4958.14]
  - - [35328, 1153, 1, 384]
    - [187, 4764.22]
  - - [33792, 2688, 1, 384]
    - [187, 5010.42]
  - - [8448, 768, 1, 384]
    - [187, 4667.08]
  - - [8064, 2688, 1, 384]
    - [187, 4918.67]
  - - [33408, 2304, 1, 384]
    - [187, 5005.36]
  - - [31872, 1536, 1, 384]
    - [186, 4961.8]
  - - [41088, 1920, 1, 384]
    - [187, 5004.42]
  - - [17280, 3072, 1, 384]
    - [191, 4974.94]
  - - [37632, 3072, 1, 384]
    - [187, 5005.95]
  - - [38016, 1153, 1, 384]
    - [187, 4766.28]
  - - [32640, 1152, 1, 384]
    - [187, 4988.39]
  - - [27264, 1153, 1, 384]
    - [187, 4754.71]
  - - [30336, 1153, 1, 384]
    - [187, 4774.77]
  - - [18048, 384, 1, 384]
    - [191, 4745.96]
  - - [26496, 3072, 1, 384]
    - [186, 4995.2]
  - - [41088, 2304, 1, 384]
    - [187, 5013.54]
  - - [3840, 1153, 1, 384]
    - [187, 4480.83]
  - - [16128, 2304, 1, 384]
    - [187, 4975.7]
  - - [5376, 1536, 1, 384]
    - [192, 4759.78]
  - - [39552, 3072, 1, 384]
    - [187, 5007.83]
  - - [23808, 3072, 1, 384]
    - [187, 4987.75]
  - - [24192, 1153, 1, 384]
    - [187, 4749.17]
  - - [16128, 1536, 1, 384]
    - [191, 4921.3]
  - - [5760, 1536, 1, 384]
    - [191, 4746.65]
  - - [36480, 2688, 1, 384]
    - [187, 5016.86]
  - - [21504, 1152, 1, 384]
    - [187, 4942.88]
  - - [38400, 1153, 1, 384]
    - [187, 4773.06]
  - - [39168, 1153, 1, 384]
    - [187, 4772.86]
  - - [21888, 1153, 1, 384]
    - [186, 4731.92]
  - - [19968, 1152, 1, 384]
    - [187, 4935.29]
  - - [28416, 2304, 1, 384]
    - [191, 4999.72]
  - - [26880, 768, 1, 384]
    - [187, 4926.05]
  - - [15360, 768, 1, 384]
    - [187, 4830.6]
  - - [42624, 768, 1, 384]
    - [191, 4943.99]
  - - [13056, 3072, 1, 384]
    - [190, 4961.66]
  - - [43008, 1920, 1, 384]
    - [187, 5006.66]
  - - [34944, 384, 1, 384]
    - [186, 4833.78]
  - - [19584, 384, 1, 384]
    - [186, 4685.01]
  - - [44160, 2688, 1, 384]
    - [187, 5024.57]
  - - [4992, 1536, 1, 384]
    - [191, 4711.75]
  - - [39168, 768, 1, 384]
    - [187, 4956.89]
  - - [16896, 1153, 1, 384]
    - [186, 4720.17]
  - - [6144, 1536, 1, 384]
    - [190, 4824.74]
  - - [26112, 1152, 1, 384]
    - [187, 4963.54]
  - - [1152, 384, 1, 384]
    - [201, 3539.04]
  - - [19968, 384, 1, 384]
    - [191, 4706.93]
  - - [43392, 1153, 1, 384]
    - [187, 4786.89]
  - - [29952, 1536, 1, 384]
    - [191, 4975.15]
  - - [17280, 1153, 1, 384]
    - [187, 4721.39]
  - - [10752, 2688, 1, 384]
    - [186, 4940.16]
  - - [33408, 1153, 1, 384]
    - [187, 4753.26]
  - - [42240, 2688, 1, 384]
    - [187, 5027.38]
  - - [36096, 1536, 1, 384]
    - [191, 4974.28]
  - - [1920, 384, 1, 384]
    - [179, 4086.66]
  - - [22272, 2304, 1, 384]
    - [187, 4978.59]
  - - [26496, 1536, 1, 384]
    - [187, 4967.1]
  - - [1536, 384, 1, 384]
    - [211, 3471.78]
  - - [42624, 2688, 1, 384]
    - [187, 5020.82]
  - - [29184, 3072, 1, 384]
    - [187, 5005.02]
  - - [9600, 1920, 1, 384]
    - [187, 4925.84]
  - - [27264, 3072, 1, 384]
    - [187, 5002.92]
  - - [7680, 1152, 1, 384]
    - [187, 4770.91]
  - - [24960, 1153, 1, 384]
    - [187, 4733.23]
  - - [18048, 1536, 1, 384]
    - [187, 4931.42]
  - - [17664, 1153, 1, 384]
    - [187, 4729.87]
  - - [20352, 1153, 1, 384]
    - [187, 4719.92]
  - - [29184, 1152, 1, 384]
    - [186, 4975.23]
  - - [17664, 2688, 1, 384]
    - [187, 4998.3]
  - - [15360, 1920, 1, 384]
    - [187, 4944.75]
  - - [3840, 384, 1, 384]
    - [179, 4211.88]
  - - [18816, 1920, 1, 384]
    - [187, 4976.23]
  - - [33024, 768, 1, 384]
    - [191, 4938.43]
  - - [40704, 1153, 1, 384]
    - [187, 4789.51]
  - - [21888, 1920, 1, 384]
    - [187, 4986.75]
  - - [18816, 3072, 1, 384]
    - [191, 4990.27]
  - - [37248, 1536, 1, 384]
    - [187, 4991.1]
  - - [34176, 2304, 1, 384]
    - [187, 5005.06]
  - - [16896, 2304, 1, 384]
    - [187, 4983.33]
  - - [40320, 3072, 1, 384]
    - [187, 5008.04]
  - - [32640, 1153, 1, 384]
    - [187, 4772.76]
  - - [6144, 1920, 1, 384]
    - [187, 4888.99]
  - - [14208, 1152, 1, 384]
    - [187, 4904.41]
  - - [8832, 1153, 1, 384]
    - [187, 4648.9]
  - - [22272, 1920, 1, 384]
    - [187, 4983.74]
  - - [32640, 3072, 1, 384]
    - [187, 5010.66]
  - - [33408, 1536, 1, 384]
    - [191, 4967.89]
  - - [5760, 3072, 1, 384]
    - [191, 4891.81]
  - - [27648, 3072, 1, 384]
    - [187, 4993.47]
  - - [17280, 384, 1, 384]
    - [186, 4769.21]
  - - [26880, 2688, 1, 384]
    - [187, 5005.82]
  - - [36864, 1153, 1, 384]
    - [187, 4769.88]
  - - [36864, 1920, 1, 384]
    - [187, 4992.44]
  - - [41088, 384, 1, 384]
    - [187, 4865.88]
  - - [4224, 1152, 1, 384]
    - [212, 4568.72]
  - - [12288, 1153, 1, 384]
    - [187, 4669.13]
  - - [384, 768, 1, 384]
    - [196, 2496.71]
  - - [27648, 1920, 1, 384]
    - [187, 5002.09]
  - - [5760, 1152, 1, 384]
    - [187, 4761.01]
  - - [33792, 1536, 1, 384]
    - [191, 4977.86]
  - - [40704, 2688, 1, 384]
    - [187, 5016.09]
  - - [37632, 2304, 1, 384]
    - [187, 5006.02]
  - - [24192, 1152, 1, 384]
    - [187, 4961.15]
  - - [42240, 3072, 1, 384]
    - [191, 5004.27]
  - - [16896, 1920, 1, 384]
    - [187, 4970.53]
  - - [18048, 1153, 1, 384]
    - [187, 4715.99]
  - - [32640, 2304, 1, 384]
    - [191, 5006.3]
  - - [13824, 384, 1, 384]
    - [187, 4631.64]
  - - [36096, 1152, 1, 384]
    - [187, 4988.95]
  - - [15744, 1920, 1, 384]
    - [187, 4952.38]
  - - [5760, 2304, 1, 384]
    - [191, 4873.94]
  - - [33408, 1152, 1, 384]
    - [187, 4965.97]
  - - [11904, 2304, 1, 384]
    - [191, 4939.46]
  - - [24576, 2304, 1, 384]
    - [191, 4976.04]
  - - [33024, 1536, 1, 384]
    - [187, 4975.06]
  - - [6528, 1152, 1, 384]
    - [186, 4680.15]
  - - [20736, 768, 1, 384]
    - [187, 4876.73]
  - - [37632, 1152, 1, 384]
    - [187, 4981.19]
  - - [12288, 1920, 1, 384]
    - [187, 4936.41]
  - - [36096, 2304, 1, 384]
    - [191, 5006.22]
  - - [6912, 1153, 1, 384]
    - [187, 4503.46]
  - - [13056, 2688, 1, 384]
    - [187, 4973.2]
  - - [20352, 2688, 1, 384]
    - [187, 4981.69]
  - - [14592, 2304, 1, 384]
    - [191, 4967.42]
  - - [16128, 1920, 1, 384]
    - [187, 4969.62]
  - - [9216, 1536, 1, 384]
    - [190, 4874.93]
  - - [16512, 1920, 1, 384]
    - [187, 4965.83]
  - - [35712, 1920, 1, 384]
    - [187, 5002.14]
  - - [9216, 2688, 1, 384]
    - [191, 4938.57]
  - - [16128, 2688, 1, 384]
    - [187, 4982.5]
  - - [19200, 3072, 1, 384]
    - [191, 4984.88]
  - - [23808, 2688, 1, 384]
    - [187, 4995.59]
  - - [18048, 768, 1, 384]
    - [191, 4844.62]
  - - [14592, 2688, 1, 384]
    - [187, 4985.98]
  - - [15360, 1152, 1, 384]
    - [187, 4899.99]
  - - [40320, 1152, 1, 384]
    - [187, 4980.58]
  - - [25344, 2688, 1, 384]
    - [187, 5000.88]
  - - [43008, 1152, 1, 384]
    - [187, 4980.56]
  - - [19200, 1152, 1, 384]
    - [187, 4923.17]
  - - [19584, 1152, 1, 384]
    - [186, 4918.2]
  - - [14208, 1920, 1, 384]
    - [187, 4945.38]
  - - [5376, 1152, 1, 384]
    - [187, 4716.45]
  - - [14976, 2688, 1, 384]
    - [187, 4967.49]
  - - [36480, 1152, 1, 384]
    - [187, 4981.57]
  - - [39936, 1920, 1, 384]
    - [187, 5004.52]
  - - [11136, 1152, 1, 384]
    - [187, 4863.09]
  - - [17280, 2304, 1, 384]
    - [191, 4970.27]
  - - [11520, 2304, 1, 384]
    - [187, 4938.16]
  - - [19968, 3072, 1, 384]
    - [191, 4982.89]
  - - [25344, 384, 1, 384]
    - [186, 4805.33]
  - - [19968, 1153, 1, 384]
    - [187, 4742.35]
  - - [26496, 1152, 1, 384]
    - [187, 4963.0]
  - - [18432, 768, 1, 384]
    - [186, 4868.46]
  - - [4608, 768, 1, 384]
    - [191, 4714.77]
  - - [34944, 1920, 1, 384]
    - [187, 5010.2]
  - - [13824, 2688, 1, 384]
    - [187, 4966.21]
  - - [8832, 3072, 1, 384]
    - [191, 4924.97]
  - - [39936, 2304, 1, 384]
    - [191, 4991.01]
  - - [16896, 3072, 1, 384]
    - [187, 4980.69]
  - - [7680, 2688, 1, 384]
    - [186, 4911.04]
  - - [19968, 2304, 1, 384]
    - [187, 4971.74]
  - - [27648, 2688, 1, 384]
    - [187, 5009.55]
  - - [4224, 768, 1, 384]
    - [212, 4421.27]
  - - [35328, 3072, 1, 384]
    - [187, 5004.9]
  - - [11520, 3072, 1, 384]
    - [187, 4953.21]
  - - [24192, 1920, 1, 384]
    - [187, 4988.49]
  - - [32640, 1920, 1, 384]
    - [186, 4990.77]
  - - [4992, 3072, 1, 384]
    - [191, 4872.84]
  - - [12672, 384, 1, 384]
    - [212, 4566.04]
  - - [34176, 2688, 1, 384]
    - [187, 5016.08]
  - - [35328, 1536, 1, 384]
    - [187, 4983.05]
  - - [20736, 1153, 1, 384]
    - [187, 4733.11]
  - - [3072, 1152, 1, 384]
    - [176, 4733.16]
  - - [20352, 3072, 1, 384]
    - [186, 4988.3]
  - - [26880, 1152, 1, 384]
    - [187, 4973.11]
  - - [8832, 2688, 1, 384]
    - [187, 4934.24]
  - - [18048, 1920, 1, 384]
    - [187, 4960.6]
  - - [31488, 768, 1, 384]
    - [191, 4934.52]
  - - [21504, 2304, 1, 384]
    - [187, 4970.83]
  - - [30720, 3072, 1, 384]
    - [187, 5007.04]
  - - [13440, 2688, 1, 384]
    - [186, 4977.02]
  - - [11136, 2688, 1, 384]
    - [187, 4947.2]
  - - [38784, 1153, 1, 384]
    - [187, 4767.0]
  - - [33024, 3072, 1, 384]
    - [191, 4997.91]
  - - [34944, 3072, 1, 384]
    - [187, 5008.75]
  - - [39552, 384, 1, 384]
    - [187, 4886.15]
  - - [31872, 1152, 1, 384]
    - [187, 4970.33]
  - - [768, 1152, 1, 384]
    - [183, 3812.25]
  - - [29184, 2688, 1, 384]
    - [187, 5006.13]
  - - [10752, 3072, 1, 384]
    - [191, 4946.28]
  - - [20352, 768, 1, 384]
    - [187, 4891.11]
  - - [4608, 2688, 1, 384]
    - [187, 4840.08]
  - - [36480, 1153, 1, 384]
    - [187, 4772.13]
  - - [7296, 1153, 1, 384]
    - [210, 4534.77]
  - - [21504, 2688, 1, 384]
    - [187, 5001.78]
  - - [34176, 768, 1, 384]
    - [187, 4961.86]
  - - [29568, 384, 1, 384]
    - [186, 4853.15]
  - - [3072, 1920, 1, 384]
    - [186, 4785.7]
  - - [21504, 1920, 1, 384]
    - [187, 4976.27]
  - - [23808, 1536, 1, 384]
    - [187, 4948.0]
  - - [15360, 1153, 1, 384]
    - [186, 4713.62]
  - - [30336, 3072, 1, 384]
    - [187, 5010.04]
  - - [26112, 3072, 1, 384]
    - [187, 4991.96]
  - - [8832, 1536, 1, 384]
    - [191, 4830.53]
  - - [11136, 1153, 1, 384]
    - [187, 4655.37]
  - - [43392, 1536, 1, 384]
    - [187, 4985.19]
  - - [42240, 384, 1, 384]
    - [186, 4864.17]
  - - [28800, 2688, 1, 384]
    - [187, 5002.21]
  - - [31488, 2688, 1, 384]
    - [187, 5003.87]
  - - [10368, 3072, 1, 384]
    - [191, 4939.84]
  - - [12672, 1920, 1, 384]
    - [187, 4953.98]
  - - [30720, 1536, 1, 384]
    - [191, 4974.62]
  - - [8064, 3072, 1, 384]
    - [186, 4916.93]
  - - [23424, 1153, 1, 384]
    - [187, 4739.28]
  - - [17280, 1152, 1, 384]
    - [187, 4912.52]
  - - [13824, 768, 1, 384]
    - [191, 4838.76]
  - - [9216, 1152, 1, 384]
    - [187, 4884.91]
  - - [6528, 1920, 1, 384]
    - [187, 4877.84]
  - - [28800, 3072, 1, 384]
    - [187, 5003.88]
  - - [10752, 384, 1, 384]
    - [212, 4575.97]
  - - [38016, 1536, 1, 384]
    - [191, 4976.08]
  - - [39552, 1152, 1, 384]
    - [187, 4977.44]
  - - [22272, 1153, 1, 384]
    - [187, 4743.33]
  - - [25344, 2304, 1, 384]
    - [191, 4997.1]
  - - [14592, 3072, 1, 384]
    - [191, 4964.23]
  - - [28032, 1920, 1, 384]
    - [187, 4998.61]
  - - [20736, 2688, 1, 384]
    - [187, 4999.48]
  - - [15744, 1536, 1, 384]
    - [187, 4925.63]
  - - [25728, 1152, 1, 384]
    - [187, 4961.5]
  - - [16512, 1536, 1, 384]
    - [191, 4916.79]
  - - [3072, 2304, 1, 384]
    - [190, 4795.63]
  - - [5760, 2688, 1, 384]
    - [186, 4885.9]
  - - [37248, 1153, 1, 384]
    - [187, 4778.79]
  - - [10368, 1153, 1, 384]
    - [187, 4650.83]
  - - [36864, 3072, 1, 384]
    - [187, 5011.39]
  - - [23040, 1152, 1, 384]
    - [187, 4941.13]
  - - [31872, 384, 1, 384]
    - [186, 4808.68]
  - - [9600, 3072, 1, 384]
    - [191, 4926.51]
  - - [10368, 1152, 1, 384]
    - [187, 4833.87]
  - - [36096, 3072, 1, 384]
    - [191, 4998.34]
  - - [24576, 1536, 1, 384]
    - [187, 4959.7]
  - - [31104, 2304, 1, 384]
    - [191, 5000.98]
  - - [2688, 1153, 1, 384]
    - [215, 4198.35]
  - - [38400, 2304, 1, 384]
    - [187, 5006.12]
  - - [32256, 384, 1, 384]
    - [187, 4850.54]
  - - [38016, 1152, 1, 384]
    - [187, 4980.87]
  - - [20352, 384, 1, 384]
    - [187, 4783.68]
  - - [15360, 2688, 1, 384]
    - [187, 4972.59]
  - - [10752, 1153, 1, 384]
    - [187, 4652.81]
  - - [29952, 2688, 1, 384]
    - [187, 4997.03]
  - - [7680, 384, 1, 384]
    - [190, 4390.17]
  - - [43008, 2688, 1, 384]
    - [187, 5016.81]
  - - [13440, 1920, 1, 384]
    - [187, 4949.48]
  - - [4992, 1152, 1, 384]
    - [191, 4706.62]
  - - [9984, 2304, 1, 384]
    - [191, 4929.46]
  - - [6528, 2688, 1, 384]
    - [187, 4895.16]
  - - [38016, 2688, 1, 384]
    - [187, 5022.5]
  - - [4608, 1152, 1, 384]
    - [187, 4640.07]
  - - [9600, 2304, 1, 384]
    - [191, 4915.64]
  - - [32640, 384, 1, 384]
    - [187, 4866.4]
  - - [7680, 3072, 1, 384]
    - [190, 4903.92]
  - - [2304, 1536, 1, 384]
    - [177, 4756.35]
  - - [40320, 1536, 1, 384]
    - [191, 4970.24]
  - - [13440, 1536, 1, 384]
    - [191, 4898.9]
  - - [18432, 1152, 1, 384]
    - [187, 4919.34]
  - - [40320, 2688, 1, 384]
    - [191, 5011.44]
  - - [30336, 2304, 1, 384]
    - [187, 5007.78]
  - - [24192, 2688, 1, 384]
    - [187, 4999.38]
  - - [16896, 1152, 1, 384]
    - [187, 4904.08]
  - - [38016, 3072, 1, 384]
    - [187, 5009.58]
  - - [43392, 2304, 1, 384]
    - [187, 5010.55]
  - - [13440, 1152, 1, 384]
    - [187, 4881.88]
  - - [1152, 769, 1, 384]
    - [178, 3758.19]
  - - [36096, 1153, 1, 384]
    - [187, 4768.04]
  - - [33792, 1920, 1, 384]
    - [187, 4995.68]
  - - [11520, 1153, 1, 384]
    - [187, 4618.28]
  - - [12288, 3072, 1, 384]
    - [191, 4967.59]
  - - [28416, 3072, 1, 384]
    - [191, 5006.36]
  - - [35328, 768, 1, 384]
    - [191, 4919.48]
  - - [22656, 2688, 1, 384]
    - [187, 5003.26]
  - - [25728, 2688, 1, 384]
    - [187, 5012.53]
  - - [23040, 768, 1, 384]
    - [191, 4897.73]
  - - [29952, 2304, 1, 384]
    - [187, 5000.67]
  - - [33024, 1920, 1, 384]
    - [187, 4997.91]
  - - [14976, 768, 1, 384]
    - [186, 4802.22]
  - - [42624, 1920, 1, 384]
    - [186, 5006.67]
  - - [32640, 2688, 1, 384]
    - [190, 4994.52]
  - - [33408, 384, 1, 384]
    - [187, 4866.36]
  - - [11520, 1536, 1, 384]
    - [191, 4894.34]
  - - [6912, 768, 1, 384]
    - [191, 4617.79]
  - - [28032, 3072, 1, 384]
    - [187, 5002.48]
  - - [39552, 1920, 1, 384]
    - [187, 5009.19]
  - - [11904, 384, 1, 384]
    - [187, 4660.56]
  - - [32256, 1920, 1, 384]
    - [191, 4980.69]
  - - [15360, 384, 1, 384]
    - [187, 4791.77]
  - - [42240, 1153, 1, 384]
    - [187, 4788.27]
  - - [10752, 1536, 1, 384]
    - [190, 4876.0]
  - - [16128, 1152, 1, 384]
    - [187, 4890.37]
  - - [6144, 1153, 1, 384]
    - [186, 4553.92]
  - - [24576, 2688, 1, 384]
    - [187, 5004.98]
  - - [12672, 2688, 1, 384]
    - [187, 4970.14]
  - - [5376, 768, 1, 384]
    - [215, 4568.06]
  - - [10752, 1920, 1, 384]
    - [187, 4909.09]
  - - [40704, 1536, 1, 384]
    - [191, 4983.58]
  - - [8832, 1152, 1, 384]
    - [187, 4844.6]
  - - [32256, 768, 1, 384]
    - [190, 4924.36]
  - - [11904, 1536, 1, 384]
    - [191, 4884.66]
  - - [35712, 1153, 1, 384]
    - [187, 4767.79]
  - - [32256, 1153, 1, 384]
    - [186, 4756.39]
  - - [18432, 1536, 1, 384]
    - [191, 4925.99]
  - - [34560, 3072, 1, 384]
    - [191, 4992.41]
  - - [18816, 2688, 1, 384]
    - [191, 4980.54]
  - - [28800, 1152, 1, 384]
    - [187, 4967.43]
  - - [28416, 1153, 1, 384]
    - [186, 4747.09]
  - - [26112, 1153, 1, 384]
    - [187, 4769.0]
  - - [11520, 2688, 1, 384]
    - [187, 4969.03]
  - - [19584, 3072, 1, 384]
    - [187, 4990.17]
  - - [28416, 384, 1, 384]
    - [187, 4852.01]
  - - [24960, 1152, 1, 384]
    - [186, 4942.05]
  - - [8448, 3072, 1, 384]
    - [191, 4934.87]
  - - [25344, 1153, 1, 384]
    - [187, 4737.78]
  - - [22272, 2688, 1, 384]
    - [187, 4997.66]
  - - [24960, 2304, 1, 384]
    - [186, 4978.28]
  - - [11520, 768, 1, 384]
    - [191, 4755.68]
  - - [35712, 2688, 1, 384]
    - [187, 5015.4]
  - - [23424, 1152, 1, 384]
    - [187, 4958.77]
  - - [24960, 3072, 1, 384]
    - [191, 4993.15]
  - - [29952, 1920, 1, 384]
    - [187, 5008.45]
  - - [30720, 384, 1, 384]
    - [187, 4814.38]
  - - [13440, 384, 1, 384]
    - [215, 4617.98]
  - - [26880, 1920, 1, 384]
    - [187, 4987.59]
  - - [25728, 3072, 1, 384]
    - [191, 4995.62]
  - - [33408, 2688, 1, 384]
    - [187, 5011.33]
  - - [40704, 3072, 1, 384]
    - [187, 5020.17]
  - - [38400, 1152, 1, 384]
    - [187, 4995.61]
  - - [3840, 1152, 1, 384]
    - [212, 4607.1]
  - - [7680, 1153, 1, 384]
    - [186, 4563.09]
  - - [35328, 2688, 1, 384]
    - [187, 5015.82]
  - - [21120, 1536, 1, 384]
    - [187, 4947.39]
  - - [21120, 2688, 1, 384]
    - [187, 4986.95]
  - - [40320, 1153, 1, 384]
    - [187, 4783.63]
  - - [38784, 1152, 1, 384]
    - [187, 4982.44]
  - - [19584, 1920, 1, 384]
    - [187, 4971.83]
  - - [11904, 1152, 1, 384]
    - [186, 4871.11]
  - - [43392, 1920, 1, 384]
    - [187, 5008.0]
  - - [17664, 1536, 1, 384]
    - [187, 4929.44]
  - - [34176, 1920, 1, 384]
    - [187, 5002.7]
  - - [16512, 2688, 1, 384]
    - [187, 4991.83]
  - - [18816, 2304, 1, 384]
    - [187, 4978.87]
  - - [36864, 768, 1, 384]
    - [191, 4945.62]
  - - [14592, 1536, 1, 384]
    - [190, 4917.77]
  - - [11136, 2304, 1, 384]
    - [187, 4928.09]
  - - [9600, 2688, 1, 384]
    - [187, 4942.76]
  - - [13824, 1153, 1, 384]
    - [187, 4659.66]
  - - [9216, 2304, 1, 384]
    - [191, 4909.97]
  - - [3456, 1920, 1, 384]
    - [187, 4778.16]
  - - [14208, 768, 1, 384]
    - [191, 4833.21]
  - - [38784, 384, 1, 384]
    - [187, 4909.39]
  - - [35712, 768, 1, 384]
    - [186, 4938.35]
  - - [21120, 768, 1, 384]
    - [191, 4857.8]
  - - [4992, 2688, 1, 384]
    - [187, 4839.05]
  - - [16128, 3072, 1, 384]
    - [186, 4973.48]
  - - [41472, 768, 1, 384]
    - [191, 4944.15]
  - - [4992, 1153, 1, 384]
    - [187, 4380.94]
  - - [3072, 1536, 1, 384]
    - [191, 4744.4]
  - - [43392, 3072, 1, 384]
    - [187, 5011.23]
  - - [44160, 1153, 1, 384]
    - [187, 4780.29]
  - - [37632, 1536, 1, 384]
    - [186, 4972.51]
  - - [15744, 1153, 1, 384]
    - [187, 4668.89]
  - - [17664, 768, 1, 384]
    - [187, 4864.63]
  - - [3456, 2304, 1, 384]
    - [191, 4725.7]
  - - [38784, 2304, 1, 384]
    - [187, 5006.84]
  - - [8448, 2688, 1, 384]
    - [187, 4950.35]
  - - [30720, 1153, 1, 384]
    - [187, 4756.95]
  - - [36864, 2304, 1, 384]
    - [187, 4996.32]
  - - [24192, 1536, 1, 384]
    - [191, 4962.07]
  - - [40704, 1920, 1, 384]
    - [187, 5014.07]
  - - [39552, 2688, 1, 384]
    - [187, 5013.03]
  - - [26112, 768, 1, 384]
    - [187, 4898.92]
  - - [31488, 384, 1, 384]
    - [187, 4885.1]
  - - [29184, 1536, 1, 384]
    - [191, 4965.84]
  - - [12288, 1152, 1, 384]
    - [191, 4860.28]
  - - [32640, 1536, 1, 384]
    - [187, 4977.21]
  - - [5376, 2688, 1, 384]
    - [187, 4891.9]
  - - [13056, 768, 1, 384]
    - [191, 4792.46]
  - - [13824, 2304, 1, 384]
    - [191, 4935.53]
  - - [29952, 768, 1, 384]
    - [187, 4924.95]
  - - [1536, 1152, 1, 384]
    - [205, 4337.93]
  - - [28032, 2304, 1, 384]
    - [186, 4997.79]
  - - [16896, 768, 1, 384]
    - [191, 4850.42]
  - - [30336, 1920, 1, 384]
    - [187, 4993.21]
  - - [14976, 384, 1, 384]
    - [215, 4675.14]
  - - [27264, 2304, 1, 384]
    - [187, 4996.88]
  - - [39552, 1153, 1, 384]
    - [187, 4779.66]
  - - [7680, 1536, 1, 384]
    - [190, 4825.25]
  - - [16896, 384, 1, 384]
    - [186, 4689.92]
  - - [30336, 1152, 1, 384]
    - [186, 4968.51]
  - - [30720, 2688, 1, 384]
    - [187, 5003.69]
  - - [37632, 1153, 1, 384]
    - [187, 4761.77]
  - - [1920, 1153, 1, 384]
    - [177, 4411.08]
  - - [36096, 2688, 1, 384]
    - [187, 5006.04]
  - - [5760, 1920, 1, 384]
    - [187, 4789.58]
  - - [39552, 1536, 1, 384]
    - [191, 4980.23]
  - - [40704, 2304, 1, 384]
    - [187, 5007.4]
  - - [9216, 1153, 1, 384]
    - [187, 4581.73]
  - - [25728, 384, 1, 384]
    - [187, 4762.05]
  - - [43776, 2304, 1, 384]
    - [187, 5018.47]
  - - [27648, 1152, 1, 384]
    - [187, 4975.12]
  - - [31488, 1152, 1, 384]
    - [187, 4966.9]
  - - [39168, 1152, 1, 384]
    - [187, 4994.01]
  - - [42240, 1536, 1, 384]
    - [191, 4989.32]
  - - [20352, 1152, 1, 384]
    - [191, 4919.28]
  - - [8448, 1920, 1, 384]
    - [187, 4868.43]
  - - [32256, 1536, 1, 384]
    - [191, 4973.74]
  - - [25344, 1152, 1, 384]
    - [187, 4952.21]
  - - [21888, 2304, 1, 384]
    - [186, 4980.02]
  - - [44160, 2304, 1, 384]
    - [191, 5006.27]
  - - [30336, 2688, 1, 384]
    - [187, 5003.77]
  - - [14208, 3072, 1, 384]
    - [191, 4960.98]
  - - [6144, 2688, 1, 384]
    - [187, 4908.0]
  - - [39168, 1536, 1, 384]
    - [191, 4985.43]
  - - [11904, 1920, 1, 384]
    - [187, 4911.67]
  - - [31104, 1920, 1, 384]
    - [187, 5006.25]
  - - [8064, 1536, 1, 384]
    - [190, 4812.85]
  - - [22272, 1152, 1, 384]
    - [187, 4946.39]
  - - [21120, 1920, 1, 384]
    - [187, 4983.89]
  - - [29952, 1152, 1, 384]
    - [187, 4972.11]
  - - [22656, 2304, 1, 384]
    - [187, 4996.66]
  - - [9600, 1152, 1, 384]
    - [187, 4791.52]
  - - [19968, 2688, 1, 384]
    - [187, 5002.19]
  - - [22656, 3072, 1, 384]
    - [186, 4994.03]
  - - [10752, 768, 1, 384]
    - [190, 4815.58]
  - - [41856, 768, 1, 384]
    - [187, 4963.28]
  - - [19584, 2688, 1, 384]
    - [187, 4996.95]
  - - [16128, 1153, 1, 384]
    - [187, 4691.02]
  - - [2304, 1152, 1, 384]
    - [203, 4291.91]
  - - [23424, 384, 1, 384]
    - [186, 4823.06]
  - - [14592, 768, 1, 384]
    - [191, 4803.6]
  - - [24576, 3072, 1, 384]
    - [186, 4985.97]
  - - [14592, 1152, 1, 384]
    - [187, 4921.6]
  - - [18432, 2304, 1, 384]
    - [191, 4958.64]
  - - [20736, 384, 1, 384]
    - [187, 4705.04]
  - - [9216, 1920, 1, 384]
    - [187, 4935.87]
  - - [31872, 2688, 1, 384]
    - [186, 5014.65]
  - - [41472, 1152, 1, 384]
    - [187, 4988.05]
  - - [14976, 1920, 1, 384]
    - [187, 4957.59]
  - - [13824, 1152, 1, 384]
    - [191, 4870.67]
  - - [33024, 2688, 1, 384]
    - [187, 5015.09]
  - - [43008, 1153, 1, 384]
    - [186, 4774.22]
  - - [1536, 768, 1, 384]
    - [191, 4513.7]
  - - [34176, 1153, 1, 384]
    - [187, 4761.91]
  - - [33024, 2304, 1, 384]
    - [187, 5008.11]
  - - [41856, 1153, 1, 384]
    - [187, 4782.06]
  - - [31488, 1153, 1, 384]
    - [187, 4765.93]
  - - [17280, 768, 1, 384]
    - [187, 4871.88]
  - - [29184, 1153, 1, 384]
    - [187, 4761.91]
  - - [21504, 3072, 1, 384]
    - [187, 4998.24]
  - - [3456, 1153, 1, 384]
    - [176, 4358.02]
  - - [37632, 2688, 1, 384]
    - [187, 5015.83]
  - - [14208, 2688, 1, 384]
    - [187, 4979.05]
  - - [38016, 2304, 1, 384]
    - [187, 5009.8]
  - - [16896, 2688, 1, 384]
    - [187, 4998.13]
  - - [4224, 1153, 1, 384]
    - [186, 4436.87]
  - - [31104, 768, 1, 384]
    - [187, 4937.42]
  - - [41472, 2304, 1, 384]
    - [187, 5011.95]
  - - [10752, 1152, 1, 384]
    - [186, 4835.55]
  - - [9216, 3072, 1, 384]
    - [190, 4928.23]
  - - [23424, 2688, 1, 384]
    - [187, 4997.26]
  - - [18048, 1152, 1, 384]
    - [186, 4933.16]
  - - [39936, 3072, 1, 384]
    - [187, 5007.56]
  - - [22656, 384, 1, 384]
    - [187, 4717.63]
  - - [10368, 2688, 1, 384]
    - [191, 4952.06]
  - - [41472, 384, 1, 384]
    - [187, 4885.3]
  - - [26496, 2688, 1, 384]
    - [187, 5010.98]
  - - [16512, 2304, 1, 384]
    - [187, 4977.87]
  - - [31104, 1153, 1, 384]
    - [187, 4761.98]
  - - [9600, 1153, 1, 384]
    - [187, 4598.33]
  - - [16512, 1153, 1, 384]
    - [187, 4701.53]
  - - [11520, 1920, 1, 384]
    - [187, 4924.08]
  - - [39552, 768, 1, 384]
    - [187, 4946.23]
  - - [5376, 1153, 1, 384]
    - [187, 4471.87]
  - - [26112, 384, 1, 384]
    - [187, 4788.88]
  - - [23808, 1152, 1, 384]
    - [187, 4955.64]
  - - [29568, 3072, 1, 384]
    - [191, 4988.41]
  - - [12672, 2304, 1, 384]
    - [187, 4938.08]
  - - [11136, 768, 1, 384]
    - [187, 4802.88]
  - - [1152, 1152, 1, 384]
    - [198, 3860.77]
  - - [6144, 2304, 1, 384]
    - [186, 4884.39]
  - - [14208, 2304, 1, 384]
    - [187, 4952.79]
  - - [19584, 2304, 1, 384]
    - [187, 4982.92]
  - - [34560, 2688, 1, 384]
    - [187, 5009.47]
  - - [38400, 3072, 1, 384]
    - [187, 5017.28]
  - - [36480, 768, 1, 384]
    - [186, 4934.33]
  - - [15744, 1152, 1, 384]
    - [186, 4883.73]
  - - [15744, 2688, 1, 384]
    - [187, 4982.64]
  - - [39168, 3072, 1, 384]
    - [187, 5013.97]
  - - [14976, 1536, 1, 384]
    - [187, 4920.67]
  - - [6144, 3072, 1, 384]
    - [191, 4887.86]
  - - [31872, 1153, 1, 384]
    - [187, 4770.75]
  - - [24576, 1153, 1, 384]
    - [187, 4744.53]
  - - [41088, 3072, 1, 384]
    - [191, 5002.29]
  - - [34176, 3072, 1, 384]
    - [191, 5001.52]
  - - [6144, 1152, 1, 384]
    - [191, 4818.4]
  - - [7296, 384, 1, 384]
    - [215, 4461.94]
  - - [36096, 384, 1, 384]
    - [187, 4861.78]
  - - [33792, 1153, 1, 384]
    - [187, 4772.14]
  - - [1920, 768, 1, 384]
    - [207, 4210.63]
  - - [34560, 1536, 1, 384]
    - [187, 4973.05]
  - - [8448, 2304, 1, 384]
    - [187, 4902.02]
  - - [9984, 2688, 1, 384]
    - [187, 4939.24]
  - - [16512, 1152, 1, 384]
    - [187, 4896.72]
  - - [8064, 1153, 1, 384]
    - [187, 4611.77]
  - - [8064, 768, 1, 384]
    - [187, 4704.13]
  - - [44160, 1152, 1, 384]
    - [187, 4989.57]
  - - [26112, 2688, 1, 384]
    - [187, 5000.36]
  - - [21120, 1152, 1, 384]
    - [187, 4958.5]
  - - [6528, 3072, 1, 384]
    - [187, 4903.41]
  - - [39936, 768, 1, 384]
    - [187, 4946.93]
  - - [20736, 1152, 1, 384]
    - [187, 4955.13]
  - - [19200, 1920, 1, 384]
    - [191, 4968.85]
  - - [38400, 768, 1, 384]
    - [191, 4947.6]
  - - [19200, 1153, 1, 384]
    - [187, 4733.94]
  - - [29952, 3072, 1, 384]
    - [187, 5005.29]
  - - [19200, 2304, 1, 384]
    - [186, 4973.91]
  - - [8448, 1536, 1, 384]
    - [191, 4863.11]
  - - [13824, 1536, 1, 384]
    - [191, 4902.18]
  - - [6912, 1152, 1, 384]
    - [191, 4722.48]
  - - [32640, 768, 1, 384]
    - [187, 4946.21]
  - - [9600, 768, 1, 384]
    - [191, 4743.99]
  - - [29568, 1152, 1, 384]
    - [187, 4971.04]
  - - [34560, 2304, 1, 384]
    - [187, 5003.42]
  - - [10368, 768, 1, 384]
    - [187, 4706.78]
  - - [28800, 1153, 1, 384]
    - [186, 4744.79]
  - - [768, 768, 1, 384]
    - [211, 3482.46]
  - - [2688, 1152, 1, 384]
    - [191, 4580.56]
  - - [20736, 1536, 1, 384]
    - [191, 4937.68]
  - - [19584, 1153, 1, 384]
    - [187, 4733.31]
  - - [28800, 768, 1, 384]
    - [187, 4919.86]
  - - [42240, 768, 1, 384]
    - [187, 4964.43]
  - - [34176, 384, 1, 384]
    - [187, 4844.8]
  - - [40320, 2304, 1, 384]
    - [186, 4996.7]
  - - [22656, 1153, 1, 384]
    - [187, 4730.81]
  - - [18816, 1153, 1, 384]
    - [187, 4724.4]
  - - [13440, 1153, 1, 384]
    - [187, 4651.76]
  - - [28416, 2688, 1, 384]
    - [191, 5005.08]
  - - [30720, 1920, 1, 384]
    - [187, 4998.92]
  - - [8064, 1152, 1, 384]
    - [191, 4796.35]
  - - [39936, 1536, 1, 384]
    - [187, 4982.25]
  - - [10368, 1536, 1, 384]
    - [186, 4857.83]
  - - [768, 769, 1, 384]
    - [175, 3419.69]
  - - [21888, 1536, 1, 384]
    - [186, 4949.67]
  - - [38784, 2688, 1, 384]
    - [186, 5007.0]
  - - [22272, 3072, 1, 384]
    - [187, 4984.27]
  - - [27648, 2304, 1, 384]
    - [191, 4997.44]
  - - [34944, 1153, 1, 384]
    - [187, 4789.75]
  - - [41088, 2688, 1, 384]
    - [187, 5018.81]
  - - [11136, 1920, 1, 384]
    - [187, 4929.82]
  - - [35712, 384, 1, 384]
    - [186, 4892.47]
  - - [22656, 1152, 1, 384]
    - [187, 4943.03]
  - - [36864, 1536, 1, 384]
    - [187, 4983.84]
  - - [14592, 1153, 1, 384]
    - [187, 4704.08]
  - - [15744, 3072, 1, 384]
    - [191, 4970.66]
  - - [14976, 1153, 1, 384]
    - [187, 4692.71]
  - - [37248, 768, 1, 384]
    - [191, 4956.46]
  - - [23424, 3072, 1, 384]
    - [191, 4997.66]
  - - [23040, 2688, 1, 384]
    - [187, 4992.69]
  - - [4224, 3072, 1, 384]
    - [191, 4868.05]
  - - [6912, 2304, 1, 384]
    - [187, 4878.6]
  - - [24192, 3072, 1, 384]
    - [191, 4992.9]
  - - [17664, 3072, 1, 384]
    - [187, 4983.43]
  - - [27648, 1153, 1, 384]
    - [187, 4756.11]
  - - [37632, 1920, 1, 384]
    - [187, 5002.0]
  - - [36096, 768, 1, 384]
    - [187, 4957.79]
  - - [4224, 2688, 1, 384]
    - [191, 4850.78]
  - - [40704, 1152, 1, 384]
    - [187, 4978.52]
  - - [8448, 1153, 1, 384]
    - [186, 4621.26]
  - - [7680, 768, 1, 384]
    - [187, 4763.95]
  - - [25344, 3072, 1, 384]
    - [187, 4995.56]
  - - [13440, 3072, 1, 384]
    - [191, 4957.6]
  - - [38016, 1920, 1, 384]
    - [187, 5010.51]
  - - [36864, 384, 1, 384]
    - [187, 4871.43]
  - - [35712, 2304, 1, 384]
    - [187, 5004.58]
  - - [34560, 1152, 1, 384]
    - [187, 4975.77]
  - - [42240, 1152, 1, 384]
    - [187, 4991.13]
  - - [31872, 3072, 1, 384]
    - [187, 5006.19]
  - - [43008, 3072, 1, 384]
    - [187, 5008.07]
  - - [37248, 2688, 1, 384]
    - [187, 5008.66]
  - - [42624, 1153, 1, 384]
    - [187, 4779.72]
  - - [29568, 1920, 1, 384]
    - [187, 4997.56]
  - - [4992, 384, 1, 384]
    - [186, 4455.91]
  - - [384, 385, 1, 384]
    - [200, 1699.82]
  - - [38400, 2688, 1, 384]
    - [187, 5028.31]
  - - [25728, 768, 1, 384]
    - [186, 4892.99]
  - - [9600, 384, 1, 384]
    - [215, 4418.81]
  - - [11136, 3072, 1, 384]
    - [187, 4953.48]
  - - [8832, 1920, 1, 384]
    - [186, 4869.29]
  - - [43776, 1920, 1, 384]
    - [187, 5004.87]
  - - [3072, 1153, 1, 384]
    - [220, 4208.96]
  - - [14976, 3072, 1, 384]
    - [186, 4964.81]
  - - [21120, 1153, 1, 384]
    - [186, 4722.88]
  - - [38784, 3072, 1, 384]
    - [191, 5003.54]
  - - [12288, 384, 1, 384]
    - [186, 4699.12]
  - - [38784, 768, 1, 384]
    - [187, 4953.44]
  - - [36480, 1536, 1, 384]
    - [191, 4979.78]
  - - [29184, 384, 1, 384]
    - [186, 4829.26]
  - - [15744, 768, 1, 384]
    - [191, 4854.66]
  - - [27264, 1920, 1, 384]
    - [187, 4996.42]
  - - [43392, 1152, 1, 384]
    - [187, 4985.2]
  - - [33792, 2304, 1, 384]
    - [187, 4992.52]
  - - [384, 384, 1, 384]
    - [212, 1705.62]
  - - [9984, 1153, 1, 384]
    - [187, 4637.96]
  - - [8832, 2304, 1, 384]
    - [191, 4918.77]
  - - [18432, 3072, 1, 384]
    - [187, 4992.31]
  - - [41088, 1152, 1, 384]
    - [187, 4977.21]
  - - [39168, 2688, 1, 384]
    - [187, 5027.27]
  - - [39936, 1152, 1, 384]
    - [187, 4980.48]
  - - [43776, 1153, 1, 384]
    - [187, 4785.05]
  - - [31104, 384, 1, 384]
    - [187, 4835.5]
  - - [16512, 3072, 1, 384]
    - [191, 4976.23]
  - - [39168, 384, 1, 384]
    - [187, 4873.17]
  - - [18816, 1152, 1, 384]
    - [187, 4910.08]
  - - [43776, 1152, 1, 384]
    - [187, 4989.36]
  - - [35328, 1920, 1, 384]
    - [187, 5000.37]
  - - [29952, 1153, 1, 384]
    - [187, 4764.32]
  - - [38016, 384, 1, 384]
    - [187, 4841.44]
  - - [41856, 1152, 1, 384]
    - [187, 4994.05]
  - - [43008, 1536, 1, 384]
    - [187, 4994.81]
  - - [35328, 2304, 1, 384]
    - [191, 4989.18]
  - - [11520, 1152, 1, 384]
    - [187, 4882.34]
  - - [36864, 1152, 1, 384]
    - [191, 4972.37]
  - - [37248, 2304, 1, 384]
    - [191, 4996.95]
  - - [26880, 3072, 1, 384]
    - [191, 4997.89]
  - - [28032, 1153, 1, 384]
    - [187, 4750.99]
  - - [29184, 768, 1, 384]
    - [187, 4918.67]
  - - [3456, 1152, 1, 384]
    - [203, 4454.2]
  - - [39936, 1153, 1, 384]
    - [186, 4763.86]
  - - [17664, 384, 1, 384]
    - [215, 4685.08]
  - - [18048, 2688, 1, 384]
    - [187, 4988.11]
  - - [7296, 2688, 1, 384]
    - [187, 4929.72]
  - - [13056, 2304, 1, 384]
    - [187, 4951.63]
  - - [42624, 1536, 1, 384]
    - [191, 4981.68]
  - - [2688, 1536, 1, 384]
    - [215, 4553.89]
  - - [29568, 1153, 1, 384]
    - [187, 4748.21]
  - - [32256, 2688, 1, 384]
    - [187, 5016.07]
  - - [18816, 1536, 1, 384]
    - [186, 4919.92]
  - - [32256, 3072, 1, 384]
    - [187, 5006.09]
  - - [33792, 3072, 1, 384]
    - [187, 5008.75]
  - - [9984, 3072, 1, 384]
    - [187, 4941.2]
  - - [34560, 1153, 1, 384]
    - [187, 4762.95]
  - - [13056, 1536, 1, 384]
    - [191, 4894.31]
  - - [35328, 384, 1, 384]
    - [187, 4864.08]
  - - [26496, 384, 1, 384]
    - [187, 4857.13]
  - - [34944, 1536, 1, 384]
    - [187, 4977.35]
  - - [23424, 768, 1, 384]
    - [191, 4900.52]
  - - [38400, 1920, 1, 384]
    - [187, 5014.51]
  - - [15360, 2304, 1, 384]
    - [187, 4941.11]
  - - [27264, 2688, 1, 384]
    - [187, 4997.84]
  - - [11136, 1536, 1, 384]
    - [191, 4862.61]
  - - [5760, 1153, 1, 384]
    - [187, 4539.53]
  - - [41472, 3072, 1, 384]
    - [187, 5016.21]
  - - [23040, 1153, 1, 384]
    - [187, 4738.41]
  - - [12288, 1536, 1, 384]
    - [191, 4905.99]
  - - [14592, 384, 1, 384]
    - [187, 4627.37]
  - - [6528, 2304, 1, 384]
    - [187, 4861.03]
  - - [25728, 1153, 1, 384]
    - [187, 4744.98]
  - - [30720, 2304, 1, 384]
    - [187, 4997.73]
  - - [24576, 1152, 1, 384]
    - [186, 4944.63]
  - - [4608, 1153, 1, 384]
    - [185, 4445.37]
  - - [4992, 768, 1, 384]
    - [219, 4537.21]
  - - [34944, 2688, 1, 384]
    - [186, 5015.27]
  - - [768, 385, 1, 384]
    - [195, 2498.8]
  - - [24960, 2688, 1, 384]
    - [187, 5006.77]
  - - [9984, 384, 1, 384]
    - [220, 4542.25]
  - - [12672, 3072, 1, 384]
    - [186, 4959.86]
  - - [18432, 1920, 1, 384]
    - [187, 4965.15]
  - - [3840, 2688, 1, 384]
    - [186, 4780.84]
  - - [26496, 1153, 1, 384]
    - [187, 4755.49]
  - - [13824, 1920, 1, 384]
    - [187, 4943.14]
  - - [26880, 1153, 1, 384]
    - [187, 4742.89]
  - - [17280, 2688, 1, 384]
    - [187, 4991.67]
  - - [5376, 3072, 1, 384]
    - [191, 4909.37]
  - - [15360, 1536, 1, 384]
    - [191, 4913.92]
  - - [43776, 2688, 1, 384]
    - [187, 5019.43]
  - - [24960, 1920, 1, 384]
    - [187, 4991.07]
  - - [31872, 768, 1, 384]
    - [187, 4936.88]
  - - [23808, 1153, 1, 384]
    - [187, 4751.83]
  - - [23040, 384, 1, 384]
    - [186, 4764.75]
  - - [1920, 1152, 1, 384]
    - [177, 4434.87]
  - - [11904, 2688, 1, 384]
    - [187, 4949.04]
  - - [17664, 1152, 1, 384]
    - [186, 4921.37]
  - - [12672, 1153, 1, 384]
    - [187, 4660.03]
  - - [7296, 1152, 1, 384]
    - [187, 4749.52]
  - - [7296, 768, 1, 384]
    - [186, 4618.63]
  - - [1152, 1153, 1, 384]
    - [197, 3859.44]
  - - [27264, 1152, 1, 384]
    - [187, 4970.23]
  - - [19200, 1536, 1, 384]
    - [191, 4924.28]
  - - [11904, 3072, 1, 384]
    - [191, 4934.65]
  - - [37248, 1152, 1, 384]
    - [187, 4983.2]
  - - [20736, 3072, 1, 384]
    - [191, 4980.96]
  - - [10368, 384, 1, 384]
    - [215, 4459.91]
  - - [11904, 1153, 1, 384]
    - [187, 4648.15]
  - - [12288, 768, 1, 384]
    - [191, 4831.17]
  - - [33792, 768, 1, 384]
    - [187, 4936.43]
  - - [21888, 2688, 1, 384]
    - [187, 4999.4]
  - - [15360, 3072, 1, 384]
    - [187, 4967.31]
  - - [2688, 1920, 1, 384]
    - [215, 4611.97]
  - - [21504, 1536, 1, 384]
    - [191, 4947.74]
  - - [19968, 768, 1, 384]
    - [191, 4887.08]
  - - [4608, 3072, 1, 384]
    - [191, 4872.48]
  - - [35328, 1152, 1, 384]
    - [187, 4965.02]
  - - [34176, 1152, 1, 384]
    - [187, 4976.78]
  - - [42624, 3072, 1, 384]
    - [187, 5009.28]
  - - [19200, 2688, 1, 384]
    - [191, 4986.24]
  - - [31104, 3072, 1, 384]
    - [191, 5003.7]
  - - [31488, 2304, 1, 384]
    - [187, 4993.96]
  - - [35712, 3072, 1, 384]
    - [191, 5009.66]
  - - [18432, 1153, 1, 384]
    - [187, 4706.34]
  - - [12288, 2688, 1, 384]
    - [186, 4956.48]
  - - [21120, 3072, 1, 384]
    - [191, 4982.62]
  - - [12288, 2304, 1, 384]
    - [186, 4931.98]
  - - [28416, 768, 1, 384]
    - [187, 4916.92]
  - - [33408, 3072, 1, 384]
    - [187, 4993.78]
  - - [36480, 384, 1, 384]
    - [187, 4863.57]
  - - [4224, 384, 1, 384]
    - [215, 4010.24]
  - - [27264, 1536, 1, 384]
    - [187, 4969.13]
  - - [12672, 1152, 1, 384]
    - [186, 4858.39]
  - - [28416, 1152, 1, 384]
    - [187, 4961.24]
  - - [6528, 1153, 1, 384]
    - [186, 4587.56]
  - - [9216, 384, 1, 384]
    - [190, 4671.97]
  - - [34944, 1152, 1, 384]
    - [191, 4972.73]
  - - [34560, 768, 1, 384]
    - [187, 4950.06]
  - - [31488, 3072, 1, 384]
    - [187, 5005.57]
  - - [39936, 2688, 1, 384]
    - [187, 5028.4]
  - - [8064, 1920, 1, 384]
    - [186, 4871.33]
  - - [13056, 1153, 1, 384]
    - [187, 4697.16]
  - - [9984, 1152, 1, 384]
    - [187, 4816.46]
  - - [26880, 1536, 1, 384]
    - [187, 4961.26]
  - - [33792, 384, 1, 384]
    - [187, 4853.45]
  - - [4608, 384, 1, 384]
    - [214, 4329.08]
  - - [28032, 2688, 1, 384]
    - [187, 5015.98]
  - - [7296, 3072, 1, 384]
    - [187, 4921.15]
  - - [41472, 2688, 1, 384]
    - [187, 5028.3]
  - - [29568, 2688, 1, 384]
    - [187, 5009.24]
  - - [37248, 1920, 1, 384]
    - [187, 4999.45]
  - - [6912, 2688, 1, 384]
    - [187, 4884.88]
  - - [33024, 1152, 1, 384]
    - [187, 4976.99]
  - - [31104, 1152, 1, 384]
    - [187, 4970.05]
  - - [31104, 2688, 1, 384]
    - [187, 5016.02]
  - - [5376, 1920, 1, 384]
    - [186, 4786.62]
  - - [21888, 1152, 1, 384]
    - [187, 4936.35]
  - - [40320, 1920, 1, 384]
    - [187, 4991.46]
  - - [41856, 3072, 1, 384]
    - [191, 5015.57]
  - - [37248, 3072, 1, 384]
    - [191, 5002.76]
  - - [41856, 2688, 1, 384]
    - [187, 5020.14]
  - - [14208, 1153, 1, 384]
    - [186, 4687.74]
  - - [9984, 768, 1, 384]
    - [191, 4729.61]
  - - [3456, 2688, 1, 384]
    - [191, 4804.62]
  - - [41088, 1153, 1, 384]
    - [187, 4777.96]
  - - [13056, 1152, 1, 384]
    - [187, 4846.34]
  - - [32256, 1152, 1, 384]
    - [187, 4982.16]
  - - [6912, 3072, 1, 384]
    - [191, 4907.02]
  - - [14976, 1152, 1, 384]
    - [187, 4920.56]
  - - [21888, 3072, 1, 384]
    - [187, 4980.26]
  - - [1536, 1153, 1, 384]
    - [177, 4197.01]
  - - [8064, 384, 1, 384]
    - [191, 4558.08]
  - - [16512, 384, 1, 384]
    - [186, 4610.75]
  - - [27648, 1536, 1, 384]
    - [187, 4974.8]
  - - [35712, 1152, 1, 384]
    - [186, 4970.29]
  - - [43392, 2688, 1, 384]
    - [187, 5026.37]
  - - [6528, 384, 1, 384]
    - [217, 4414.04]
  - - [13824, 3072, 1, 384]
    - [191, 4953.64]
  - - [11136, 384, 1, 384]
    - [187, 4703.02]
  - - [14208, 384, 1, 384]
    - [191, 4697.96]
  - - [36480, 1920, 1, 384]
    - [187, 5012.17]
  - - [36480, 3072, 1, 384]
    - [187, 4997.15]
  - - [29568, 1536, 1, 384]
    - [191, 4970.95]
  - - [33792, 1152, 1, 384]
    - [186, 4980.14]
  - - [36864, 2688, 1, 384]
    - [187, 5010.31]
  - - [23808, 768, 1, 384]
    - [187, 4895.29]
  - - [42624, 1152, 1, 384]
    - [187, 4985.74]
  - - [8448, 1152, 1, 384]
    - [186, 4837.18]
  - - [28032, 384, 1, 384]
    - [187, 4820.61]
  - - [29568, 768, 1, 384]
    - [191, 4926.74]
  - - [2304, 768, 1, 384]
    - [200, 4308.23]
  - - [33024, 1153, 1, 384]
    - [186, 4765.21]
  - - [12672, 768, 1, 384]
    - [191, 4817.47]
  - - [15744, 2304, 1, 384]
    - [187, 4966.69]
  - - [36096, 1281, 1, 256]
    - [243, 4683.27]
  - - [24064, 3072, 1, 256]
    - [247, 4851.24]
  - - [256, 512, 1, 256]
    - [249, 1414.71]
  - - [40960, 27648, 1, 256]
    - [247, 4903.02]
  - - [11264, 1792, 1, 256]
    - [241, 4758.45]
  - - [22016, 512, 1, 256]
    - [247, 4634.39]
  - - [31744, 3072, 1, 256]
    - [247, 4868.79]
  - - [13056, 1792, 1, 256]
    - [241, 4791.83]
  - - [35328, 22785, 1, 256]
    - [241, 4897.4]
  - - [28160, 15872, 1, 256]
    - [247, 4899.86]
  - - [39168, 1792, 1, 256]
    - [241, 4885.26]
  - - [2560, 2561, 1, 256]
    - [264, 4341.03]
  - - [35328, 1536, 1, 256]
    - [247, 4847.65]
  - - [37376, 3072, 1, 256]
    - [247, 4882.8]
  - - [23808, 11265, 1, 256]
    - [247, 4835.14]
  - - [36096, 2048, 1, 256]
    - [247, 4869.27]
  - - [27136, 1280, 1, 256]
    - [241, 4838.77]
  - - [28928, 3072, 1, 256]
    - [247, 4869.72]
  - - [13568, 1792, 1, 256]
    - [241, 4784.08]
  - - [16640, 4353, 1, 256]
    - [241, 4801.62]
  - - [33792, 1280, 1, 256]
    - [241, 4864.17]
  - - [12544, 2048, 1, 256]
    - [247, 4762.21]
  - - [38912, 26624, 1, 256]
    - [247, 4904.53]
  - - [6912, 3585, 1, 256]
    - [247, 4655.99]
  - - [32768, 1792, 1, 256]
    - [241, 4881.25]
  - - [30976, 18688, 1, 256]
    - [241, 4928.09]
  - - [32256, 512, 1, 256]
    - [247, 4698.56]
  - - [512, 2048, 1, 256]
    - [234, 3956.99]
  - - [13312, 2048, 1, 256]
    - [247, 4764.4]
  - - [10496, 3072, 1, 256]
    - [247, 4799.28]
  - - [15872, 3584, 1, 256]
    - [247, 4836.7]
  - - [33792, 512, 1, 256]
    - [247, 4703.99]
  - - [6400, 1792, 1, 256]
    - [247, 4632.21]
  - - [39680, 27393, 1, 256]
    - [241, 4914.29]
  - - [36864, 24577, 1, 256]
    - [247, 4847.29]
  - - [38400, 1280, 1, 256]
    - [241, 4877.12]
  - - [26112, 1536, 1, 256]
    - [247, 4828.21]
  - - [26368, 1536, 1, 256]
    - [247, 4811.21]
  - - [16896, 4353, 1, 256]
    - [241, 4789.57]
  - - [14336, 1793, 1, 256]
    - [241, 4611.28]
  - - [1280, 1025, 1, 256]
    - [227, 3506.08]
  - - [3840, 3072, 1, 256]
    - [247, 4640.11]
  - - [2560, 3072, 1, 256]
    - [254, 4517.8]
  - - [6656, 1536, 1, 256]
    - [264, 4560.08]
  - - [27136, 1792, 1, 256]
    - [241, 4865.68]
  - - [43776, 3072, 1, 256]
    - [247, 4875.1]
  - - [23296, 1792, 1, 256]
    - [241, 4851.78]
  - - [20224, 256, 1, 256]
    - [259, 4394.66]
  - - [42496, 2048, 1, 256]
    - [247, 4866.84]
  - - [11264, 7937, 1, 256]
    - [241, 4828.7]
  - - [768, 3072, 1, 256]
    - [241, 4361.6]
  - - [6912, 3841, 1, 256]
    - [241, 4732.41]
  - - [40960, 769, 1, 256]
    - [241, 4447.04]
  - - [39680, 1281, 1, 256]
    - [244, 4677.49]
  - - [9984, 1280, 1, 256]
    - [241, 4687.68]
  - - [41984, 1536, 1, 256]
    - [247, 4854.42]
  - - [34304, 1281, 1, 256]
    - [238, 4683.42]
  - - [34048, 256, 1, 256]
    - [241, 4564.35]
  - - [31232, 1024, 1, 256]
    - [247, 4805.86]
  - - [11264, 8192, 1, 256]
    - [247, 4859.78]
  - - [6400, 3072, 1, 256]
    - [247, 4706.28]
  - - [40448, 9216, 1, 256]
    - [247, 4897.3]
  - - [7680, 4353, 1, 256]
    - [241, 4742.09]
  - - [23296, 3072, 1, 256]
    - [247, 4842.8]
  - - [7936, 4609, 1, 256]
    - [247, 4702.65]
  - - [20736, 8448, 1, 256]
    - [241, 4916.98]
  - - [17408, 1792, 1, 256]
    - [241, 4832.46]
  - - [768, 1024, 1, 256]
    - [256, 3851.03]
  - - [1792, 1793, 1, 256]
    - [254, 4123.53]
  - - [38656, 3072, 1, 256]
    - [247, 4884.85]
  - - [12544, 9216, 1, 256]
    - [247, 4868.98]
  - - [28160, 1792, 1, 256]
    - [241, 4872.49]
  - - [13824, 3072, 1, 256]
    - [247, 4830.39]
  - - [42752, 1792, 1, 256]
    - [241, 4892.19]
  - - [35584, 23041, 1, 256]
    - [247, 4844.53]
  - - [13056, 3072, 1, 256]
    - [247, 4819.6]
  - - [40960, 1024, 1, 256]
    - [247, 4819.23]
  - - [2048, 2048, 1, 256]
    - [254, 4396.36]
  - - [9984, 512, 1, 256]
    - [247, 4427.11]
  - - [11264, 1024, 1, 256]
    - [247, 4619.03]
  - - [23552, 512, 1, 256]
    - [247, 4647.81]
  - - [37888, 768, 1, 256]
    - [241, 4813.29]
  - - [17664, 2048, 1, 256]
    - [247, 4809.02]
  - - [36608, 256, 1, 256]
    - [241, 4646.0]
  - - [42752, 1281, 1, 256]
    - [244, 4695.76]
  - - [19456, 3072, 1, 256]
    - [247, 4838.34]
  - - [22784, 1024, 1, 256]
    - [247, 4737.17]
  - - [15872, 9216, 1, 256]
    - [247, 4875.24]
  - - [39424, 1024, 1, 256]
    - [247, 4825.73]
  - - [30976, 1792, 1, 256]
    - [241, 4883.16]
  - - [26368, 14081, 1, 256]
    - [241, 4892.61]
  - - [21760, 1281, 1, 256]
    - [243, 4634.88]
  - - [35328, 23041, 1, 256]
    - [247, 4847.76]
  - - [16128, 1280, 1, 256]
    - [241, 4776.35]
  - - [22528, 1281, 1, 256]
    - [244, 4638.54]
  - - [27648, 15105, 1, 256]
    - [241, 4884.47]
  - - [25856, 13568, 1, 256]
    - [241, 4932.33]
  - - [36864, 768, 1, 256]
    - [241, 4832.45]
  - - [23296, 9216, 1, 256]
    - [247, 4887.35]
  - - [32000, 1281, 1, 256]
    - [244, 4669.47]
  - - [18176, 1281, 1, 256]
    - [244, 4617.26]
  - - [2048, 1024, 1, 256]
    - [231, 4126.08]
  - - [38144, 256, 1, 256]
    - [241, 4656.62]
  - - [21248, 1280, 1, 256]
    - [241, 4811.01]
  - - [19712, 1281, 1, 256]
    - [244, 4628.02]
  - - [1792, 1280, 1, 256]
    - [241, 4258.9]
  - - [12032, 1792, 1, 256]
    - [241, 4771.79]
  - - [23040, 3072, 1, 256]
    - [247, 4858.73]
  - - [11520, 1536, 1, 256]
    - [247, 4718.1]
  - - [16128, 768, 1, 256]
    - [241, 4684.95]
  - - [15360, 3072, 1, 256]
    - [247, 4834.18]
  - - [38912, 26369, 1, 256]
    - [241, 4892.13]
  - - [27392, 2048, 1, 256]
    - [247, 4850.45]
  - - [25344, 13056, 1, 256]
    - [241, 4931.47]
  - - [39168, 26880, 1, 256]
    - [241, 4936.52]
  - - [39424, 768, 1, 256]
    - [241, 4807.15]
  - - [16384, 1280, 1, 256]
    - [241, 4748.14]
  - - [10496, 1792, 1, 256]
    - [241, 4758.63]
  - - [28672, 3072, 1, 256]
    - [247, 4861.59]
  - - [5888, 1280, 1, 256]
    - [264, 4520.67]
  - - [27392, 768, 1, 256]
    - [241, 4783.63]
  - - [39680, 768, 1, 256]
    - [241, 4820.31]
  - - [11520, 8193, 1, 256]
    - [247, 4790.6]
  - - [17408, 4865, 1, 256]
    - [241, 4802.77]
  - - [35840, 1281, 1, 256]
    - [244, 4680.2]
  - - [14080, 1537, 1, 256]
    - [247, 4529.27]
  - - [29184, 768, 1, 256]
    - [247, 4792.31]
  - - [2560, 1280, 1, 256]
    - [254, 4244.49]
  - - [19200, 6913, 1, 256]
    - [241, 4858.18]
  - - [33536, 9216, 1, 256]
    - [247, 4892.17]
  - - [5632, 3072, 1, 256]
    - [247, 4691.64]
  - - [32768, 20480, 1, 256]
    - [247, 4898.78]
  - - [34560, 2048, 1, 256]
    - [247, 4860.14]
  - - [29440, 9216, 1, 256]
    - [247, 4894.01]
  - - [40960, 1792, 1, 256]
    - [241, 4890.81]
  - - [10240, 3072, 1, 256]
    - [247, 4785.5]
  - - [20992, 1792, 1, 256]
    - [241, 4846.86]
  - - [42240, 9216, 1, 256]
    - [247, 4898.97]
  - - [14080, 2048, 1, 256]
    - [247, 4774.62]
  - - [5120, 256, 1, 256]
    - [253, 3987.08]
  - - [6144, 512, 1, 256]
    - [247, 4391.08]
  - - [19200, 6912, 1, 256]
    - [241, 4915.84]
  - - [8704, 1280, 1, 256]
    - [241, 4637.4]
  - - [43264, 512, 1, 256]
    - [247, 4748.79]
  - - [27392, 1792, 1, 256]
    - [241, 4871.45]
  - - [43264, 1024, 1, 256]
    - [247, 4818.27]
  - - [2048, 2049, 1, 256]
    - [248, 4209.62]
  - - [42496, 1536, 1, 256]
    - [247, 4851.09]
  - - [20480, 512, 1, 256]
    - [247, 4585.92]
  - - [29440, 16897, 1, 256]
    - [247, 4833.06]
  - - [3584, 768, 1, 256]
    - [264, 4159.75]
  - - [20480, 8192, 1, 256]
    - [247, 4881.94]
  - - [15360, 1536, 1, 256]
    - [247, 4761.85]
  - - [11264, 8193, 1, 256]
    - [247, 4782.38]
  - - [27136, 2048, 1, 256]
    - [247, 4842.8]
  - - [19968, 1281, 1, 256]
    - [244, 4632.4]
  - - [26880, 14337, 1, 256]
    - [247, 4829.79]
  - - [28928, 16641, 1, 256]
    - [241, 4900.74]
  - - [15360, 2817, 1, 256]
    - [241, 4725.9]
  - - [15616, 1280, 1, 256]
    - [241, 4780.25]
  - - [1536, 1537, 1, 256]
    - [262, 3915.45]
  - - [44288, 1536, 1, 256]
    - [247, 4849.33]
  - - [7936, 1536, 1, 256]
    - [247, 4620.14]
  - - [18176, 5633, 1, 256]
    - [247, 4777.7]
  - - [44032, 1280, 1, 256]
    - [241, 4879.9]
  - - [38912, 1024, 1, 256]
    - [247, 4804.79]
  - - [8448, 3072, 1, 256]
    - [247, 4777.32]
  - - [17920, 5632, 1, 256]
    - [247, 4863.83]
  - - [19456, 512, 1, 256]
    - [247, 4566.64]
  - - [3328, 1281, 1, 256]
    - [241, 4152.96]
  - - [22528, 10240, 1, 256]
    - [247, 4885.28]
  - - [24576, 2048, 1, 256]
    - [247, 4836.05]
  - - [1792, 2048, 1, 256]
    - [259, 4353.78]
  - - [33280, 2048, 1, 256]
    - [247, 4854.29]
  - - [25600, 1536, 1, 256]
    - [247, 4819.94]
  - - [38400, 1281, 1, 256]
    - [244, 4685.32]
  - - [17664, 256, 1, 256]
    - [241, 4391.71]
  - - [39936, 3072, 1, 256]
    - [247, 4880.84]
  - - [7168, 4096, 1, 256]
    - [247, 4771.8]
  - - [10240, 768, 1, 256]
    - [264, 4532.44]
  - - [41216, 1280, 1, 256]
    - [241, 4876.63]
  - - [24832, 1024, 1, 256]
    - [247, 4775.73]
  - - [35328, 3072, 1, 256]
    - [247, 4872.99]
  - - [20480, 3072, 1, 256]
    - [247, 4844.11]
  - - [24832, 1792, 1, 256]
    - [241, 4848.14]
  - - [4352, 1280, 1, 256]
    - [247, 4381.52]
  - - [37376, 25088, 1, 256]
    - [247, 4899.66]
  - - [7168, 4097, 1, 256]
    - [247, 4683.3]
  - - [19200, 256, 1, 256]
    - [247, 4447.62]
  - - [21504, 768, 1, 256]
    - [241, 4749.86]
  - - [13312, 3072, 1, 256]
    - [247, 4819.72]
  - - [35072, 768, 1, 256]
    - [247, 4798.06]
  - - [22784, 2048, 1, 256]
    - [247, 4831.67]
  - - [40960, 1025, 1, 256]
    - [244, 4541.9]
  - - [28672, 256, 1, 256]
    - [247, 4574.22]
  - - [26880, 1280, 1, 256]
    - [241, 4839.9]
  - - [12032, 1536, 1, 256]
    - [247, 4727.49]
  - - [9216, 768, 1, 256]
    - [247, 4620.51]
  - - [44288, 27648, 1, 256]
    - [247, 4906.03]
  - - [23808, 1280, 1, 256]
    - [247, 4821.73]
  - - [32512, 1792, 1, 256]
    - [241, 4879.75]
  - - [39424, 256, 1, 256]
    - [241, 4643.35]
  - - [23808, 11520, 1, 256]
    - [241, 4929.63]
  - - [12032, 1281, 1, 256]
    - [244, 4563.95]
  - - [25600, 13057, 1, 256]
    - [241, 4873.45]
  - - [31744, 1281, 1, 256]
    - [237, 4676.48]
  - - [11520, 2048, 1, 256]
    - [247, 4770.57]
  - - [12032, 1280, 1, 256]
    - [241, 4710.32]
  - - [30208, 1281, 1, 256]
    - [243, 4661.27]
  - - [40448, 1792, 1, 256]
    - [241, 4894.54]
  - - [25088, 12800, 1, 256]
    - [247, 4890.39]
  - - [8448, 256, 1, 256]
    - [241, 4102.41]
  - - [22784, 10496, 1, 256]
    - [241, 4928.12]
  - - [38400, 26113, 1, 256]
    - [247, 4838.22]
  - - [32512, 2048, 1, 256]
    - [247, 4843.94]
  - - [9728, 3072, 1, 256]
    - [247, 4781.25]
  - - [5888, 1024, 1, 256]
    - [262, 4442.61]
  - - [20736, 1792, 1, 256]
    - [241, 4843.82]
  - - [11776, 1280, 1, 256]
    - [241, 4699.49]
  - - [7680, 3072, 1, 256]
    - [247, 4763.95]
  - - [5376, 2305, 1, 256]
    - [241, 4543.34]
  - - [6912, 3840, 1, 256]
    - [241, 4808.72]
  - - [18944, 1024, 1, 256]
    - [247, 4723.56]
  - - [11008, 2048, 1, 256]
    - [247, 4739.58]
  - - [35328, 256, 1, 256]
    - [241, 4663.07]
  - - [10752, 1024, 1, 256]
    - [247, 4647.84]
  - - [12800, 3072, 1, 256]
    - [247, 4814.77]
  - - [25856, 2048, 1, 256]
    - [247, 4843.32]
  - - [43520, 3584, 1, 256]
    - [247, 4883.23]
  - - [16640, 1024, 1, 256]
    - [247, 4691.31]
  - - [12288, 3072, 1, 256]
    - [247, 4811.83]
  - - [12800, 1536, 1, 256]
    - [247, 4718.46]
  - - [21504, 8961, 1, 256]
    - [241, 4860.86]
  - - [19456, 1281, 1, 256]
    - [238, 4630.5]
  - - [2816, 2816, 1, 256]
    - [241, 4514.12]
  - - [39680, 9216, 1, 256]
    - [247, 4895.18]
  - - [18432, 1281, 1, 256]
    - [244, 4622.14]
  - - [33024, 9216, 1, 256]
    - [247, 4895.88]
  - - [24576, 512, 1, 256]
    - [247, 4660.98]
  - - [3584, 513, 1, 256]
    - [231, 3686.51]
  - - [14336, 1024, 1, 256]
    - [247, 4664.83]
  - - [5888, 1281, 1, 256]
    - [244, 4384.5]
  - - [1280, 3072, 1, 256]
    - [254, 4414.39]
  - - [13056, 9216, 1, 256]
    - [247, 4881.99]
  - - [44032, 2048, 1, 256]
    - [247, 4865.89]
  - - [40448, 2048, 1, 256]
    - [247, 4863.69]
  - - [22016, 768, 1, 256]
    - [247, 4737.77]
  - - [33024, 1536, 1, 256]
    - [247, 4841.85]
  - - [36352, 1281, 1, 256]
    - [238, 4681.74]
  - - [26880, 9216, 1, 256]
    - [247, 4890.42]
  - - [23552, 1792, 1, 256]
    - [241, 4852.32]
  - - [38144, 1792, 1, 256]
    - [241, 4883.46]
  - - [44032, 27648, 1, 256]
    - [247, 4897.81]
  - - [7680, 768, 1, 256]
    - [241, 4580.15]
  - - [32000, 19712, 1, 256]
    - [241, 4930.76]
  - - [26880, 14593, 1, 256]
    - [241, 4893.18]
  - - [24064, 9216, 1, 256]
    - [247, 4879.66]
  - - [39424, 26881, 1, 256]
    - [241, 4894.92]
  - - [27392, 3072, 1, 256]
    - [247, 4861.09]
  - - [43264, 9216, 1, 256]
    - [247, 4891.04]
  - - [42752, 256, 1, 256]
    - [241, 4686.32]
  - - [10752, 1792, 1, 256]
    - [241, 4770.41]
  - - [8960, 5633, 1, 256]
    - [247, 4735.47]
  - - [4096, 1024, 1, 256]
    - [247, 4366.33]
  - - [11264, 2048, 1, 256]
    - [247, 4754.38]
  - - [5120, 2048, 1, 256]
    - [247, 4624.47]
  - - [34560, 3072, 1, 256]
    - [247, 4876.95]
  - - [23808, 9216, 1, 256]
    - [247, 4888.61]
  - - [29696, 17153, 1, 256]
    - [241, 4893.82]
  - - [24576, 256, 1, 256]
    - [241, 4520.23]
  - - [2560, 2305, 1, 256]
    - [241, 4317.6]
  - - [11776, 1536, 1, 256]
    - [247, 4698.46]
  - - [13568, 1536, 1, 256]
    - [247, 4741.79]
  - - [39936, 2048, 1, 256]
    - [247, 4869.44]
  - - [25856, 1792, 1, 256]
    - [241, 4873.83]
  - - [35072, 1281, 1, 256]
    - [244, 4681.32]
  - - [22272, 256, 1, 256]
    - [241, 4490.68]
  - - [23296, 256, 1, 256]
    - [259, 4446.01]
  - - [42752, 2048, 1, 256]
    - [247, 4871.6]
  - - [30208, 9216, 1, 256]
    - [247, 4892.09]
  - - [9728, 6656, 1, 256]
    - [247, 4845.21]
  - - [36608, 1536, 1, 256]
    - [247, 4836.69]
  - - [44288, 1280, 1, 256]
    - [241, 4879.36]
  - - [12800, 513, 1, 256]
    - [244, 4135.6]
  - - [7680, 1792, 1, 256]
    - [241, 4740.19]
  - - [42496, 2305, 1, 256]
    - [241, 4746.04]
  - - [37376, 1536, 1, 256]
    - [247, 4826.71]
  - - [20224, 1792, 1, 256]
    - [241, 4837.23]
  - - [43520, 1536, 1, 256]
    - [247, 4846.64]
  - - [9216, 1536, 1, 256]
    - [247, 4684.78]
  - - [1536, 1281, 1, 256]
    - [252, 3926.75]
  - - [26368, 768, 1, 256]
    - [247, 4763.38]
  - - [18176, 3072, 1, 256]
    - [247, 4836.28]
  - - [24320, 12033, 1, 256]
    - [241, 4887.3]
  - - [17408, 9216, 1, 256]
    - [247, 4877.52]
  - - [36352, 1792, 1, 256]
    - [241, 4879.71]
  - - [24832, 768, 1, 256]
    - [241, 4756.51]
  - - [20992, 8705, 1, 256]
    - [247, 4805.88]
  - - [19712, 7424, 1, 256]
    - [241, 4918.48]
  - - [38144, 768, 1, 256]
    - [241, 4817.55]
  - - [24576, 1280, 1, 256]
    - [241, 4838.4]
  - - [33536, 1536, 1, 256]
    - [247, 4837.41]
  - - [7168, 1281, 1, 256]
    - [243, 4466.63]
  - - [10752, 1536, 1, 256]
    - [247, 4673.21]
  - - [29696, 1280, 1, 256]
    - [241, 4849.49]
  - - [17152, 9216, 1, 256]
    - [247, 4870.81]
  - - [4096, 3072, 1, 256]
    - [247, 4622.46]
  - - [18176, 2048, 1, 256]
    - [247, 4803.93]
  - - [29696, 17409, 1, 256]
    - [247, 4836.03]
  - - [5888, 2816, 1, 256]
    - [241, 4715.95]
  - - [34304, 256, 1, 256]
    - [247, 4570.62]
  - - [36352, 1280, 1, 256]
    - [241, 4856.36]
  - - [10240, 6913, 1, 256]
    - [241, 4802.11]
  - - [17408, 1536, 1, 256]
    - [247, 4774.6]
  - - [24832, 512, 1, 256]
    - [247, 4644.21]
  - - [18944, 1536, 1, 256]
    - [247, 4789.89]
  - - [38656, 26113, 1, 256]
    - [247, 4842.32]
  - - [37376, 25089, 1, 256]
    - [247, 4840.52]
  - - [38400, 1536, 1, 256]
    - [247, 4837.82]
  - - [22528, 512, 1, 256]
    - [247, 4614.99]
  - - [8448, 1792, 1, 256]
    - [241, 4718.77]
  - - [22272, 512, 1, 256]
    - [247, 4647.08]
  - - [13056, 769, 1, 256]
    - [247, 4309.14]
  - - [24320, 11777, 1, 256]
    - [247, 4823.0]
  - - [5376, 2048, 1, 256]
    - [241, 4603.81]
  - - [17664, 9216, 1, 256]
    - [247, 4886.48]
  - - [8192, 4865, 1, 256]
    - [241, 4751.62]
  - - [17920, 1792, 1, 256]
    - [241, 4836.45]
  - - [32000, 19713, 1, 256]
    - [241, 4907.67]
  - - [8960, 768, 1, 256]
    - [241, 4526.79]
  - - [31232, 3072, 1, 256]
    - [247, 4864.53]
  - - [6656, 1024, 1, 256]
    - [264, 4444.4]
  - - [23296, 1280, 1, 256]
    - [241, 4824.06]
  - - [30208, 512, 1, 256]
    - [247, 4667.25]
  - - [12544, 257, 1, 256]
    - [243, 3602.12]
  - - [43776, 3585, 1, 256]
    - [247, 4765.38]
  - - [11008, 1792, 1, 256]
    - [241, 4749.14]
  - - [27648, 1281, 1, 256]
    - [244, 4673.21]
  - - [27648, 1536, 1, 256]
    - [247, 4827.05]
  - - [9472, 1024, 1, 256]
    - [247, 4610.59]
  - - [29696, 17408, 1, 256]
    - [247, 4900.9]
  - - [44800, 2048, 1, 256]
    - [247, 4867.37]
  - - [2560, 1281, 1, 256]
    - [244, 4135.65]
  - - [25344, 1024, 1, 256]
    - [247, 4759.8]
  - - [4096, 768, 1, 256]
    - [254, 4303.8]
  - - [34560, 22272, 1, 256]
    - [241, 4940.86]
  - - [38656, 1281, 1, 256]
    - [244, 4696.08]
  - - [256, 2048, 1, 256]
    - [251, 3611.99]
  - - [32768, 20481, 1, 256]
    - [247, 4844.62]
  - - [14336, 3072, 1, 256]
    - [247, 4824.19]
  - - [2304, 2049, 1, 256]
    - [264, 4226.39]
  - - [19456, 7168, 1, 256]
    - [247, 4884.59]
  - - [38656, 512, 1, 256]
    - [247, 4723.7]
  - - [13312, 9216, 1, 256]
    - [247, 4860.2]
  - - [10496, 7424, 1, 256]
    - [241, 4892.89]
  - - [22272, 768, 1, 256]
    - [241, 4747.34]
  - - [24064, 1792, 1, 256]
    - [241, 4850.2]
  - - [16896, 1792, 1, 256]
    - [241, 4830.63]
  - - [27904, 15616, 1, 256]
    - [241, 4921.81]
  - - [37888, 3072, 1, 256]
    - [247, 4871.27]
  - - [512, 257, 1, 256]
    - [251, 1382.92]
  - - [36096, 1792, 1, 256]
    - [241, 4891.14]
  - - [13056, 513, 1, 256]
    - [243, 4173.55]
  - - [12544, 768, 1, 256]
    - [247, 4615.44]
  - - [36608, 24065, 1, 256]
    - [247, 4840.13]
  - - [40704, 3072, 1, 256]
    - [247, 4888.13]
  - - [28928, 16640, 1, 256]
    - [241, 4934.23]
  - - [24576, 12288, 1, 256]
    - [247, 4898.15]
  - - [13056, 1536, 1, 256]
    - [247, 4748.02]
  - - [2304, 1024, 1, 256]
    - [241, 4309.32]
  - - [33280, 9216, 1, 256]
    - [247, 4891.86]
  - - [18944, 1280, 1, 256]
    - [241, 4790.48]
  - - [17152, 3072, 1, 256]
    - [247, 4837.04]
  - - [17152, 4864, 1, 256]
    - [241, 4889.97]
  - - [6912, 1280, 1, 256]
    - [247, 4604.36]
  - - [34304, 768, 1, 256]
    - [241, 4814.39]
  - - [33280, 1024, 1, 256]
    - [247, 4812.84]
  - - [13568, 1280, 1, 256]
    - [241, 4733.67]
  - - [32768, 768, 1, 256]
    - [241, 4805.03]
  - - [42496, 9216, 1, 256]
    - [247, 4886.41]
  - - [2304, 1280, 1, 256]
    - [241, 4252.05]
  - - [30464, 2048, 1, 256]
    - [247, 4850.95]
  - - [32256, 768, 1, 256]
    - [241, 4784.91]
  - - [4352, 1792, 1, 256]
    - [241, 4604.12]
  - - [5632, 768, 1, 256]
    - [264, 4337.0]
  - - [40704, 513, 1, 256]
    - [243, 4413.55]
  - - [30464, 1280, 1, 256]
    - [241, 4841.9]
  - - [27392, 1281, 1, 256]
    - [244, 4665.05]
  - - [22016, 1281, 1, 256]
    - [244, 4651.1]
  - - [20736, 768, 1, 256]
    - [241, 4729.2]
  - - [19712, 768, 1, 256]
    - [241, 4712.11]
  - - [13312, 1024, 1, 256]
    - [247, 4669.92]
  - - [33536, 20993, 1, 256]
    - [247, 4834.44]
  - - [11520, 8448, 1, 256]
    - [241, 4902.61]
  - - [25088, 1792, 1, 256]
    - [241, 4857.68]
  - - [2816, 3072, 1, 256]
    - [254, 4520.42]
  - - [3584, 3072, 1, 256]
    - [247, 4597.2]
  - - [4608, 1537, 1, 256]
    - [247, 4346.03]
  - - [24832, 1280, 1, 256]
    - [241, 4828.46]
  - - [44032, 9216, 1, 256]
    - [247, 4893.56]
  - - [41216, 1024, 1, 256]
    - [247, 4826.13]
  - - [33792, 21249, 1, 256]
    - [241, 4899.14]
  - - [15360, 1792, 1, 256]
    - [247, 4811.66]
  - - [16384, 768, 1, 256]
    - [241, 4673.15]
  - - [29184, 1280, 1, 256]
    - [241, 4854.03]
  - - [32512, 20225, 1, 256]
    - [241, 4902.57]
  - - [6400, 1281, 1, 256]
    - [241, 4398.98]
  - - [38656, 9216, 1, 256]
    - [247, 4902.9]
  - - [17664, 5377, 1, 256]
    - [241, 4837.42]
  - - [7168, 512, 1, 256]
    - [262, 4334.5]
  - - [19456, 7169, 1, 256]
    - [247, 4794.05]
  - - [32000, 2048, 1, 256]
    - [247, 4852.82]
  - - [8448, 5121, 1, 256]
    - [247, 4726.03]
  - - [23040, 9216, 1, 256]
    - [247, 4887.69]
  - - [29440, 17152, 1, 256]
    - [241, 4934.24]
  - - [19968, 2048, 1, 256]
    - [247, 4830.75]
  - - [18688, 1281, 1, 256]
    - [244, 4631.37]
  - - [40448, 513, 1, 256]
    - [244, 4409.97]
  - - [6912, 256, 1, 256]
    - [258, 4017.35]
  - - [41472, 1792, 1, 256]
    - [241, 4896.93]
  - - [17920, 3072, 1, 256]
    - [247, 4836.96]
  - - [30976, 768, 1, 256]
    - [241, 4790.65]
  - - [43008, 9216, 1, 256]
    - [247, 4901.61]
  - - [6144, 3072, 1, 256]
    - [247, 4723.12]
  - - [35072, 9216, 1, 256]
    - [247, 4891.59]
  - - [34816, 22273, 1, 256]
    - [241, 4892.61]
  - - [37120, 768, 1, 256]
    - [241, 4812.87]
  - - [35072, 22785, 1, 256]
    - [241, 4901.54]
  - - [23296, 1281, 1, 256]
    - [244, 4647.06]
  - - [39168, 9216, 1, 256]
    - [247, 4897.3]
  - - [35840, 1536, 1, 256]
    - [247, 4841.88]
  - - [42752, 2817, 1, 256]
    - [241, 4797.31]
  - - [11776, 3072, 1, 256]
    - [247, 4794.88]
  - - [17152, 1536, 1, 256]
    - [247, 4774.45]
  - - [24832, 256, 1, 256]
    - [241, 4446.52]
  - - [10752, 256, 1, 256]
    - [247, 4187.42]
  - - [21504, 2048, 1, 256]
    - [247, 4831.14]
  - - [24832, 12289, 1, 256]
    - [247, 4823.19]
  - - [35328, 2048, 1, 256]
    - [247, 4854.04]
  - - [22272, 1281, 1, 256]
    - [238, 4640.49]
  - - [6656, 3329, 1, 256]
    - [241, 4653.12]
  - - [34560, 1024, 1, 256]
    - [247, 4822.06]
  - - [24576, 12033, 1, 256]
    - [241, 4874.41]
  - - [6400, 1536, 1, 256]
    - [247, 4559.13]
  - - [32512, 3072, 1, 256]
    - [247, 4867.91]
  - - [22528, 2048, 1, 256]
    - [247, 4828.63]
  - - [41216, 256, 1, 256]
    - [247, 4678.19]
  - - [25088, 1024, 1, 256]
    - [247, 4766.08]
  - - [37120, 1024, 1, 256]
    - [247, 4811.41]
  - - [13056, 1281, 1, 256]
    - [243, 4563.08]
  - - [30976, 3072, 1, 256]
    - [247, 4860.73]
  - - [22016, 9473, 1, 256]
    - [241, 4855.68]
  - - [19968, 1792, 1, 256]
    - [241, 4844.9]
  - - [29440, 3072, 1, 256]
    - [247, 4856.25]
  - - [15872, 1280, 1, 256]
    - [241, 4759.38]
  - - [27904, 1280, 1, 256]
    - [241, 4836.95]
  - - [3840, 256, 1, 256]
    - [235, 3787.85]
  - - [39936, 1024, 1, 256]
    - [247, 4827.01]
  - - [10752, 512, 1, 256]
    - [247, 4483.7]
  - - [43776, 3840, 1, 256]
    - [241, 4923.53]
  - - [41472, 768, 1, 256]
    - [241, 4838.76]
  - - [8192, 1792, 1, 256]
    - [241, 4690.22]
