library/src/blas3/Tensile/Logic/asm_full/vega20_Cijk_Ailk_Bljk_4xi8BH.yaml
- {MinimumRequiredVersion: 4.6.0}
- vega20
- gfx906
- [Device 66a0, Device 66a1, Device 66a7]
    SolutionIndex: 0
    SolutionNameMin: Cijk_Ailk_Bljk_4xi8BH_MT064x032x08_DTL0_GSU01_NLCA01_TT04_02_USFGRO0_WG16_16_01
    SolutionIndex: 1
    SolutionNameMin: Cijk_Ailk_Bljk_4xi8BH_MT128x032x16_DTL0_GSU01_NLCA01_TT08_02_USFGRO01_WG16_16_01
    SolutionIndex: 2
    SolutionNameMin: Cijk_Ailk_Bljk_4xi8BH_MT016x064x16_DTL0_GSU01_NLCA01_TT02_08_USFGRO01_WG08_08_01
- - - [128, 128, 2, 65]
    - [0, 1252.89]
  - - [128, 1, 2, 64]
    - [2, 7.65607]
  - - [127, 127, 2, 1]
    - [1, 36.6568]
  - - [129, 129, 2, 63]
    - [0, 1233.39]
  - - [127, 127, 2, 65]
    - [0, 1191.35]
  - - [1, 127, 2, 64]
    - [2, 7.74095]
  - - [1, 128, 2, 64]
    - [2, 7.8774]
  - - [128, 129, 2, 1]
    - [1, 36.6933]
  - - [1, 128, 2, 63]
    - [2, 7.53689]
  - - [127, 1, 2, 63]
    - [2, 7.20811]
  - - [129, 1, 2, 64]
    - [2, 7.93846]
  - - [128, 1, 2, 63]
    - [2, 7.39816]
  - - [1, 129, 2, 65]
    - [2, 7.48661]
  - - [127, 129, 2, 1]
    - [1, 36.4067]
  - - [128, 128, 2, 64]
    - [0, 1310.72]
  - - [128, 1, 2, 65]
    - [2, 7.56364]
  - - [1, 129, 2, 64]
    - [2, 7.71589]
  - - [1, 129, 2, 63]
    - [2, 7.32162]
  - - [1, 128, 2, 65]
    - [2, 7.49592]
  - - [129, 129, 2, 65]
    - [0, 1188.64]
  - - [128, 128, 2, 1]
    - [1, 40.96]
  - - [1, 1, 2, 1]
    - [2, 0.00149268]
  - - [129, 1, 2, 65]
    - [2, 7.48661]
  - - [127, 1, 2, 64]
    - [2, 7.66792]
  - - [127, 128, 2, 1]
    - [1, 36.9455]
  - - [129, 127, 2, 1]
    - [1, 35.6152]
  - - [127, 1, 2, 65]
    - [2, 7.37054]
  - - [128, 127, 2, 1]
    - [1, 36.1244]
  - - [127, 127, 2, 64]
    - [0, 1022.04]
  - - [1, 127, 2, 65]
    - [2, 7.30571]
  - - [129, 1, 2, 63]
    - [2, 7.32162]
  - - [129, 129, 2, 1]
    - [1, 33.9612]
  - - [129, 129, 2, 64]
    - [0, 1238.4]
  - - [127, 127, 2, 63]
    - [0, 899.227]
  - - [1, 127, 2, 63]
    - [2, 5.3698]
  - - [128, 128, 2, 63]
    - [0, 1243.6]
  - - [129, 128, 2, 1]
    - [1, 34.4]
- null
