library/src/blas3/Tensile/Logic/asm_full/vega10_Cijk_Ailk_Bljk_SB.yaml
- {MinimumRequiredVersion: 4.0.2}
- vega10
- gfx900
- [Device 6863, Device 6862, Device 687f, Device 6860]
- - - [4096, 7000, 1, 4096]
    - [58, 11560.8]
  - - [5124, 9124, 1, 1760]
    - [55, 11452.8]
  - - [5124, 9124, 1, 2560]
    - [58, 11307.3]
  - - [1760, 32, 1, 1760]
    - [27, 2980.21]
  - - [1024, 1500, 1, 1536]
    - [64, 9202.38]
  - - [512, 24000, 1, 1536]
    - [58, 11089.2]
  - - [3072, 24000, 1, 1024]
    - [58, 11239.2]
  - - [1024, 3000, 1, 2560]
    - [58, 10490.6]
  - - [512, 3136, 1, 2048]
    - [72, 448399.0]
  - - [7680, 4, 1, 2560]
    - [17, 549.507]
  - - [35, 1500, 1, 2048]
    - [13, 2021.55]
  - - [8448, 1500, 1, 2816]
    - [55, 11288.2]
  - - [784, 512, 64, 128]
    - [76, 7201.66]
  - - [2560, 7000, 1, 2560]
    - [55, 11419.4]
  - - [3072, 16, 1, 1024]
    - [23, 1613.89]
  - - [512, 48000, 1, 2048]
    - [53, 10294.9]
  - - [1760, 64, 1, 1760]
    - [28, 4830.74]
  - - [1024, 16, 1, 512]
    - [20, 686.325]
  - - [196, 256, 64, 1024]
    - [75, 6147.49]
  - - [512, 48000, 1, 1536]
    - [58, 11407.7]
  - - [2560, 32, 1, 2560]
    - [30, 3503.78]
  - - [4608, 1500, 1, 1536]
    - [58, 10328.8]
  - - [2048, 128, 1, 2048]
    - [24, 6547.01]
  - - [1024, 24000, 1, 2560]
    - [58, 11421.9]
  - - [4608, 3000, 1, 1536]
    - [55, 10802.9]
  - - [5124, 9124, 1, 2048]
    - [58, 10081.7]
  - - [1024, 700, 1, 512]
    - [49, 5629.94]
  - - [3072, 1, 1, 128]
    - [23, 35.3882]
  - - [5124, 700, 1, 2560]
    - [49, 9854.96]
  - - [8448, 16, 1, 2816]
    - [35, 2109.35]
  - - [6144, 6000, 1, 2560]
    - [58, 11598.5]
  - - [4608, 32, 1, 1536]
    - [45, 3367.34]
  - - [35, 8457, 1, 2560]
    - [9, 3633.84]
  - - [3072, 64, 1, 1024]
    - [24, 3967.61]
  - - [512, 16, 1, 512]
    - [20, 387.823]
  - - [7680, 2, 1, 2560]
    - [18, 275.466]
  - - [4224, 1, 1, 128]
    - [31, 42.6818]
  - - [7680, 1, 1, 2560]
    - [17, 137.662]
  - - [128, 1500, 1, 1280]
    - [44, 5274.5]
  - - [35, 8457, 1, 4096]
    - [10, 3356.6]
  - - [1024, 1500, 1, 2816]
    - [55, 10119.7]
  - - [6144, 2, 1, 2560]
    - [22, 264.256]
  - - [8448, 48000, 1, 2816]
    - [59, 12059.7]
  - - [512, 6000, 1, 1536]
    - [58, 9892.67]
  - - [4224, 1500, 1, 176]
    - [56, 7080.84]
  - - [1024, 6000, 1, 2816]
    - [59, 11130.0]
  - - [512, 6000, 1, 2560]
    - [58, 10443.1]
  - - [512, 32, 1, 512]
    - [25, 730.588]
  - - [2560, 128, 1, 2560]
    - [43, 6985.97]
  - - [4608, 24000, 1, 1536]
    - [58, 11725.3]
  - - [512, 2, 1, 500000]
    - [3, 315.361]
  - - [7680, 48000, 1, 2560]
    - [58, 12041.6]
  - - [3072, 48000, 1, 1024]
    - [58, 11360.3]
  - - [1760, 16, 1, 1760]
    - [17, 1639.84]
  - - [512, 3000, 1, 2816]
    - [55, 10183.2]
  - - [1760, 7000, 1, 1760]
    - [57, 11035.0]
  - - [64, 193600, 1, 256]
    - [71, 305847.0]
  - - [1024, 3000, 1, 2048]
    - [53, 9640.39]
  - - [6144, 4, 1, 2560]
    - [40, 527.528]
  - - [1024, 6000, 1, 2048]
    - [63, 9405.52]
  - - [512, 24000, 1, 2816]
    - [58, 11505.5]
  - - [6144, 48000, 1, 2560]
    - [58, 11959.5]
  - - [8448, 3000, 1, 2816]
    - [55, 11543.1]
  - - [35, 1500, 1, 2560]
    - [11, 2699.93]
  - - [3072, 4, 1, 1024]
    - [17, 422.55]
  - - [4608, 48000, 1, 1536]
    - [58, 11845.4]
  - - [2048, 32, 1, 2048]
    - [34, 3097.21]
  - - [7680, 1500, 1, 2560]
    - [55, 11052.1]
  - - [4096, 128, 1, 4096]
    - [24, 8212.49]
  - - [4608, 16, 1, 1536]
    - [36, 1864.37]
  - - [1024, 1500, 1, 2048]
    - [64, 8558.23]
  - - [3072, 3000, 1, 1024]
    - [58, 9699.85]
  - - [3072, 2, 1, 1024]
    - [17, 210.748]
  - - [8448, 1, 1, 2816]
    - [42, 137.655]
  - - [1024, 48000, 1, 2560]
    - [58, 11684.1]
  - - [1024, 3000, 1, 2816]
    - [58, 10667.9]
  - - [128, 1, 1, 1408]
    - [38, 16.6643]
  - - [35, 8457, 1, 1760]
    - [12, 4091.11]
  - - [1024, 2, 1, 512]
    - [25, 86.3132]
  - - [1024, 4, 1, 500000]
    - [1, 596.112]
  - - [6144, 1, 1, 2560]
    - [2, 132.872]
  - - [1024, 48000, 1, 2816]
    - [58, 11948.1]
  - - [512, 48000, 1, 2816]
    - [57, 11745.2]
  - - [2048, 16, 1, 2048]
    - [26, 1790.41]
  - - [1024, 24000, 1, 1536]
    - [58, 10908.3]
  - - [64, 193600, 1, 64]
    - [73, 84292.9]
  - - [7680, 6000, 1, 2560]
    - [58, 11729.5]
  - - [1760, 128, 1, 1760]
    - [29, 6274.86]
  - - [35, 8457, 1, 2048]
    - [9, 3037.63]
  - - [512, 1500, 1, 2816]
    - [51, 9175.17]
  - - [512, 1, 1, 512]
    - [20, 25.8308]
  - - [512, 16, 1, 500000]
    - [3, 2301.05]
  - - [512, 8, 1, 500000]
    - [3, 1196.27]
  - - [512, 24000, 1, 2560]
    - [58, 11166.7]
  - - [6144, 3000, 1, 2560]
    - [58, 11327.7]
  - - [1024, 24000, 1, 2816]
    - [58, 11623.1]
  - - [2048, 7000, 1, 2048]
    - [58, 10318.1]
  - - [7680, 3000, 1, 2560]
    - [58, 11266.6]
  - - [1024, 4, 1, 512]
    - [19, 172.626]
  - - [5124, 700, 1, 2048]
    - [52, 8680.37]
  - - [5124, 9124, 1, 4096]
    - [62, 9720.57]
  - - [4096, 64, 1, 4096]
    - [24, 6757.6]
  - - [256, 193600, 1, 64]
    - [72, 146142.0]
  - - [512, 6000, 1, 2048]
    - [61, 8139.92]
  - - [7680, 32, 1, 2560]
    - [28, 4044.38]
  - - [2560, 64, 1, 2560]
    - [43, 5594.98]
  - - [3072, 128, 1, 1024]
    - [49, 5061.13]
  - - [8448, 6000, 1, 2816]
    - [58, 11833.8]
  - - [7680, 64, 1, 2560]
    - [24, 6830.08]
  - - [5124, 1500, 1, 2560]
    - [58, 10481.4]
  - - [1024, 1500, 1, 2560]
    - [52, 9616.38]
  - - [3025, 64, 64, 64]
    - [69, 2967.83]
  - - [512, 4, 1, 512]
    - [15, 98.9876]
  - - [1024, 6000, 1, 2560]
    - [59, 10927.9]
  - - [3072, 32, 1, 1024]
    - [37, 2723.28]
  - - [35, 700, 1, 2560]
    - [14, 2030.43]
  - - [196, 1024, 64, 256]
    - [66, 7392.36]
  - - [512, 50176, 1, 128]
    - [70, 227645.0]
  - - [4608, 1, 1, 1536]
    - [0, 125.391]
  - - [49, 512, 64, 2048]
    - [74, 3409.97]
  - - [4096, 32, 1, 4096]
    - [21, 4139.09]
  - - [7680, 24000, 1, 2560]
    - [58, 11978.1]
  - - [8448, 4, 1, 2816]
    - [47, 549.678]
  - - [64, 1, 1, 1216]
    - [38, 7.50436]
  - - [512, 1, 1, 500000]
    - [3, 153.411]
  - - [176, 1500, 1, 1408]
    - [28, 5556.98]
  - - [512, 3000, 1, 1536]
    - [53, 9110.25]
  - - [8448, 24000, 1, 2816]
    - [58, 12074.7]
  - - [4608, 2, 1, 1536]
    - [5, 248.177]
  - - [1024, 48000, 1, 1536]
    - [58, 11322.5]
  - - [7680, 128, 1, 2560]
    - [49, 8926.09]
  - - [3072, 6000, 1, 1024]
    - [58, 10444.2]
  - - [3072, 1500, 1, 128]
    - [54, 5361.84]
  - - [2048, 3136, 1, 512]
    - [70, 382676.0]
  - - [3025, 256, 64, 64]
    - [65, 4035.8]
  - - [1024, 3000, 1, 1536]
    - [59, 9906.51]
  - - [512, 4, 1, 500000]
    - [3, 607.789]
  - - [35, 700, 1, 2048]
    - [13, 1495.25]
  - - [1024, 16, 1, 500000]
    - [7, 2288.43]
  - - [512, 24000, 1, 2048]
    - [53, 9672.51]
  - - [128, 50176, 1, 512]
    - [70, 389405.0]
  - - [1024, 32, 1, 512]
    - [18, 1173.48]
  - - [256, 12544, 1, 1024]
    - [70, 435224.0]
  - - [1024, 12544, 1, 256]
    - [68, 312624.0]
  - - [512, 48000, 1, 2560]
    - [59, 11450.8]
  - - [2560, 16, 1, 2560]
    - [39, 1874.87]
  - - [2048, 64, 1, 2048]
    - [43, 4484.84]
  - - [512, 2, 1, 512]
    - [20, 48.1484]
  - - [1024, 1, 1, 512]
    - [25, 43.6888]
  - - [512, 1500, 1, 2560]
    - [51, 8631.3]
  - - [6144, 32, 1, 2560]
    - [45, 3758.06]
  - - [1024, 1, 1, 500000]
    - [6, 150.112]
  - - [6144, 16, 1, 2560]
    - [40, 2072.77]
  - - [1024, 24000, 1, 2048]
    - [54, 9886.43]
  - - [4096, 16, 1, 4096]
    - [21, 2109.29]
  - - [5124, 1500, 1, 2048]
    - [58, 9379.21]
  - - [3072, 1500, 1, 1024]
    - [64, 8840.93]
  - - [1024, 2, 1, 500000]
    - [8, 298.816]
  - - [1024, 8, 1, 500000]
    - [4, 1182.16]
  - - [7680, 16, 1, 2560]
    - [46, 2136.11]
  - - [6144, 1500, 1, 2560]
    - [58, 11100.1]
  - - [3072, 1, 1, 1024]
    - [23, 104.854]
  - - [512, 6000, 1, 2816]
    - [55, 10799.1]
  - - [8448, 2, 1, 2816]
    - [41, 276.257]
  - - [4608, 4, 1, 1536]
    - [0, 501.569]
  - - [1024, 6000, 1, 1536]
    - [59, 10430.5]
  - - [8448, 32, 1, 2816]
    - [30, 3910.49]
  - - [512, 3000, 1, 2048]
    - [60, 7604.93]
  - - [6144, 24000, 1, 2560]
    - [58, 11898.5]
  - - [512, 3000, 1, 2560]
    - [53, 9649.59]
  - - [4608, 6000, 1, 1536]
    - [58, 11216.6]
  - - [1024, 1024, 1, 1024]
    - [52, 6972.12]
  - - [512, 1500, 1, 2048]
    - [52, 6825.13]
  - - [512, 1500, 1, 1536]
    - [51, 7887.43]
  - - [128, 1, 1, 1024]
    - [32, 12.3735]
  - - [49, 2048, 64, 512]
    - [67, 4488.03]
  - - [1024, 48000, 1, 2048]
    - [54, 10221.4]
- - - -1
    - - - -1
        - - - 4
            - - [1024, 33]
              - [1856, 25]
              - [2368, 33]
              - [3584, 23]
              - [4288, 33]
              - [5056, 25]
              - [-1, 23]
          - - 64
            - - [4, 33]
              - [64, 32]
              - [128, 38]
              - [256, 15]
              - [448, 47]
              - [1408, 16]
              - [1856, 43]
              - [2368, 28]
              - [3584, 43]
              - [5056, 16]
              - [-1, 51]
          - - 128
            - - [4, 33]
              - [64, 38]
              - [128, 15]
              - [704, 16]
              - [1024, 43]
              - [1408, 44]
              - [1856, 29]
              - [2368, 43]
              - [5056, 44]
              - [5888, 51]
              - [-1, 49]
          - - 256
            - - [4, 33]
              - [64, 25]
              - [256, 16]
              - [448, 28]
              - [1024, 51]
              - [1408, 49]
              - [5056, 51]
              - [5888, 48]
              - [-1, 51]
          - - 448
            - - [4, 33]
              - [64, 47]
              - [128, 16]
              - [256, 28]
              - [448, 29]
              - [1408, 49]
              - [1856, 52]
              - [2368, 51]
              - [2944, 57]
              - [3584, 51]
              - [4288, 48]
              - [5888, 49]
              - [-1, 50]
          - - 704
            - - [4, 25]
              - [128, 16]
              - [448, 51]
              - [704, 49]
              - [2368, 51]
              - [5056, 48]
              - [5888, 50]
              - [-1, 55]
          - - 1024
            - - [4, 33]
              - [64, 16]
              - [128, 24]
              - [256, 49]
              - [704, 51]
              - [1024, 52]
              - [4288, 55]
              - [5056, 58]
              - [5888, 59]
              - [-1, 58]
          - - 1408
            - - [4, 25]
              - [64, 16]
              - [128, 43]
              - [448, 51]
              - [704, 52]
              - [1024, 57]
              - [1408, 58]
              - [1856, 55]
              - [2368, 51]
              - [2944, 58]
              - [3584, 48]
              - [5888, 58]
              - [-1, 48]
          - - 1856
            - - [4, 23]
              - [64, 28]
              - [128, 29]
              - [256, 51]
              - [448, 52]
              - [704, 49]
              - [1024, 55]
              - [1408, 48]
              - [2368, 55]
              - [2944, 57]
              - [3584, 48]
              - [5056, 55]
              - [5888, 48]
              - [-1, 57]
          - - 2368
            - - [4, 33]
              - [64, 29]
              - [128, 43]
              - [704, 49]
              - [1408, 55]
              - [1856, 57]
              - [3584, 55]
              - [4288, 57]
              - [5056, 55]
              - [-1, 48]
          - - 2944
            - - [4, 25]
              - [64, 43]
              - [128, 29]
              - [256, 49]
              - [704, 55]
              - [1024, 48]
              - [1408, 58]
              - [1856, 48]
              - [2368, 58]
              - [5056, 48]
              - [5888, 58]
              - [-1, 48]
          - - 3584
            - - [4, 23]
              - [64, 24]
              - [128, 51]
              - [256, 53]
              - [448, 49]
              - [-1, 55]
          - - 4288
            - - [4, 33]
              - [64, 16]
              - [128, 29]
              - [256, 49]
              - [5888, 55]
              - [-1, 50]
          - - 5056
            - - [4, 33]
              - [64, 16]
              - [128, 24]
              - [448, 49]
              - [5056, 55]
              - [-1, 50]
          - - 5888
            - - [4, 40]
              - [64, 51]
              - [128, 49]
              - [256, 48]
              - [448, 49]
              - [704, 55]
              - [1024, 48]
              - [1408, 59]
              - [2368, 55]
              - [2944, 59]
              - [5888, 55]
              - [-1, 58]
          - - -1
            - - [4, 33]
              - [64, 49]
              - [128, 53]
              - [256, 49]
              - [448, 55]
              - [704, 50]
              - [1024, 59]
              - [1856, 50]
              - [2944, 55]
              - [3584, 50]
              - [5056, 55]
              - [-1, 58]
