library/src/blas3/Tensile/Logic/asm_full/vega10_Cijk_Ailk_Bljk_SB.yaml
- {MinimumRequiredVersion: 4.6.0}
- vega10
- gfx900
- [Device 6863, Device 6862, Device 687f, Device 6860, Device 6861, 'Vega 10 XTX [Radeon
    SolutionIndex: 0
    SolutionNameMin: Cijk_Ailk_Bljk_SB_MT128x016x16_DTL0_EPS0_GRVW04_LPB00_PGR0_SNLL0_TT04_04_USFGRO0_VW04_WG32_04_02
    SolutionIndex: 1
    SolutionNameMin: Cijk_Ailk_Bljk_SB_MT128x016x16_DTL0_EPS1_GRVW04_LPB00_PGR1_SNLL0_TT04_04_USFGRO0_VW04_WG32_04_02
    SolutionIndex: 2
    SolutionNameMin: Cijk_Ailk_Bljk_SB_MT128x008x32_DTL0_EPS0_GRVW02_LPB00_PGR0_SNLL0_TT08_02_USFGRO0_VW02_WG16_04_04
    SolutionIndex: 3
    SolutionNameMin: Cijk_Ailk_Bljk_SB_MT064x008x32_DTL0_EPS0_GRVW04_LPB00_PGR0_SNLL0_TT04_04_USFGRO0_VW04_WG16_02_08
    SolutionIndex: 4
    SolutionNameMin: Cijk_Ailk_Bljk_SB_MT064x008x32_DTL0_EPS1_GRVW04_LPB00_PGR1_SNLL0_TT04_04_USFGRO0_VW04_WG16_02_08
    SolutionIndex: 5
    SolutionNameMin: Cijk_Ailk_Bljk_SB_MT032x008x64_DTL0_EPS0_GRVW02_LPB00_PGR0_SNLL0_TT02_02_USFGRO0_VW02_WG16_04_04
    SolutionIndex: 6
    SolutionNameMin: Cijk_Ailk_Bljk_SB_MT064x016x64_DTL0_EPS0_GRVW04_LPB00_PGR0_SNLL0_TT04_04_USFGRO0_VW04_WG16_04_04
    SolutionIndex: 7
    SolutionNameMin: Cijk_Ailk_Bljk_SB_MT048x036x16_DTL0_EPS1_GRVW01_LPB00_PGR1_SNLL0_TT06_03_USFGRO01_VW01_WG08_12_02
    SolutionIndex: 8
    SolutionNameMin: Cijk_Ailk_Bljk_SB_MT048x036x16_DTL0_EPS1_GRVW01_LPB00_PGR1_SNLL0_TT06_03_USFGRO01_VW01_WG08_12_02
    SolutionIndex: 9
    SolutionNameMin: Cijk_Ailk_Bljk_SB_MT048x048x16_DTL0_EPS1_GRVW01_LPB00_PGR1_SNLL0_TT03_03_USFGRO01_VW01_WG16_16_01
    SolutionIndex: 10
    SolutionNameMin: Cijk_Ailk_Bljk_SB_MT024x024x24_DTL0_EPS1_GRVW01_LPB00_PGR1_SNLL0_TT03_04_USFGRO01_VW01_WG08_06_04
    SolutionIndex: 11
    SolutionNameMin: Cijk_Ailk_Bljk_SB_MT048x024x32_DTL0_EPS1_GRVW02_LPB00_PGR1_SNLL0_TT06_04_USFGRO0_VW02_WG08_06_04
    SolutionIndex: 12
    SolutionNameMin: Cijk_Ailk_Bljk_SB_MT016x016x08_DTL0_EPS0_GRVW02_LPB00_PGR1_SNLL0_TT02_02_USFGRO00_VW02_WG08_08_01
    SolutionIndex: 13
    SolutionNameMin: Cijk_Ailk_Bljk_SB_MT064x032x08_DTL0_EPS0_GRVW04_LPB00_PGR1_SNLL0_TT08_04_USFGRO00_VW04_WG08_08_01
    SolutionIndex: 14
    SolutionNameMin: Cijk_Ailk_Bljk_SB_MT032x016x08_DTL0_EPS0_GRVW02_LPB00_PGR1_SNLL0_TT02_02_USFGRO00_VW02_WG16_08_01
    SolutionIndex: 15
    SolutionNameMin: Cijk_Ailk_Bljk_SB_MT064x016x08_DTL0_EPS0_GRVW02_LPB00_PGR1_SNLL0_TT04_02_USFGRO00_VW02_WG16_08_01
    SolutionIndex: 16
    SolutionNameMin: Cijk_Ailk_Bljk_SB_MT032x016x08_DTL0_EPS0_GRVW02_LPB00_PGR1_SNLL0_TT04_02_USFGRO00_VW02_WG08_08_01
    SolutionIndex: 17
    SolutionNameMin: Cijk_Ailk_Bljk_SB_MT032x032x08_DTL0_EPS0_GRVW04_LPB00_PGR1_SNLL0_TT04_04_USFGRO00_VW04_WG08_08_01
    SolutionIndex: 18
    SolutionNameMin: Cijk_Ailk_Bljk_SB_MT032x016x08_DTL0_EPS0_GRVW02_LPB00_PGR1_SNLL0_TT02_02_USFGRO00_VW02_WG16_08_01
    SolutionIndex: 19
    SolutionNameMin: Cijk_Ailk_Bljk_SB_MT064x016x08_DTL0_EPS0_GRVW02_LPB00_PGR1_SNLL0_TT04_02_USFGRO00_VW02_WG16_08_01
    SolutionIndex: 20
    SolutionNameMin: Cijk_Ailk_Bljk_SB_MT016x016x16_DTL0_EPS0_GRVW02_LPB00_PGR1_SNLL0_TT02_02_USFGRO00_VW02_WG08_08_01
    SolutionIndex: 21
    SolutionNameMin: Cijk_Ailk_Bljk_SB_MT064x016x16_DTL0_EPS0_GRVW02_LPB00_PGR1_SNLL0_TT04_02_USFGRO00_VW02_WG16_08_01
    SolutionIndex: 22
    SolutionNameMin: Cijk_Ailk_Bljk_SB_MT016x016x16_DTL0_EPS0_GRVW02_LPB00_PGR1_SNLL0_TT02_02_USFGRO00_VW02_WG08_08_01
    SolutionIndex: 23
    SolutionNameMin: Cijk_Ailk_Bljk_SB_MT064x016x16_DTL0_EPS0_GRVW02_LPB00_PGR1_SNLL0_TT04_02_USFGRO00_VW02_WG16_08_01
    SolutionIndex: 24
    SolutionNameMin: Cijk_Ailk_Bljk_SB_MT016x016x08_DTL0_EPS1_GRVW02_LPB00_PGR1_SNLL0_TT02_02_USFGRO01_VW02_WG08_08_02
    SolutionIndex: 25
    SolutionNameMin: Cijk_Ailk_Bljk_SB_MT032x016x08_DTL0_EPS1_GRVW02_LPB00_PGR1_SNLL0_TT04_02_USFGRO0_VW02_WG08_08_02
    SolutionIndex: 26
    SolutionNameMin: Cijk_Ailk_Bljk_SB_MT128x032x08_DTL0_EPS1_GRVW04_LPB00_PGR1_SNLL0_TT08_04_USFGRO0_VW04_WG16_08_02
    SolutionIndex: 27
    SolutionNameMin: Cijk_Ailk_Bljk_SB_MT032x016x08_DTL0_EPS1_GRVW02_LPB00_PGR1_SNLL0_TT04_02_USFGRO0_VW02_WG08_08_02
    SolutionIndex: 28
    SolutionNameMin: Cijk_Ailk_Bljk_SB_MT016x016x08_DTL0_EPS1_GRVW02_LPB00_PGR1_SNLL0_TT02_02_USFGRO01_VW02_WG08_08_02
    SolutionIndex: 29
    SolutionNameMin: Cijk_Ailk_Bljk_SB_MT032x016x08_DTL0_EPS1_GRVW02_LPB00_PGR1_SNLL0_TT04_02_USFGRO0_VW02_WG08_08_02
    SolutionIndex: 30
    SolutionNameMin: Cijk_Ailk_Bljk_SB_MT016x016x08_DTL0_EPS1_GRVW02_LPB00_PGR1_SNLL0_TT02_02_USFGRO01_VW02_WG08_08_02
    SolutionIndex: 31
    SolutionNameMin: Cijk_Ailk_Bljk_SB_MT128x016x16_DTL0_EPS1_GRVW04_LPB00_PGR1_SNLL0_TT04_04_USFGRO0_VW04_WG32_04_02
    SolutionIndex: 32
    SolutionNameMin: Cijk_Ailk_Bljk_SB_MT064x016x16_DTL0_EPS1_GRVW04_LPB00_PGR1_SNLL0_TT04_04_USFGRO0_VW04_WG16_04_04
    SolutionIndex: 33
    SolutionNameMin: Cijk_Ailk_Bljk_SB_MT128x016x16_DTL0_EPS1_GRVW04_LPB00_PGR1_SNLL0_TT08_04_USFGRO0_VW04_WG16_04_04
    SolutionIndex: 34
    SolutionNameMin: Cijk_Ailk_Bljk_SB_MT032x016x16_DTL0_EPS1_GRVW02_LPB00_PGR1_SNLL0_TT04_02_USFGRO0_VW02_WG08_08_02
    SolutionIndex: 35
    SolutionNameMin: Cijk_Ailk_Bljk_SB_MT032x032x16_DTL0_EPS1_GRVW04_LPB00_PGR1_SNLL0_TT04_04_USFGRO0_VW04_WG08_08_02
    SolutionIndex: 36
    SolutionNameMin: Cijk_Ailk_Bljk_SB_MT064x032x16_DTL0_EPS1_GRVW04_LPB00_PGR1_SNLL0_TT08_04_USFGRO0_VW04_WG08_08_02
    SolutionIndex: 37
    SolutionNameMin: Cijk_Ailk_Bljk_SB_MT016x016x16_DTL0_EPS1_GRVW02_LPB00_PGR1_SNLL0_TT02_02_USFGRO01_VW02_WG08_08_04
    SolutionIndex: 38
    SolutionNameMin: Cijk_Ailk_Bljk_SB_MT032x016x16_DTL0_EPS1_GRVW02_LPB00_PGR1_SNLL0_TT04_02_USFGRO0_VW02_WG08_08_04
    SolutionIndex: 39
    SolutionNameMin: Cijk_Ailk_Bljk_SB_MT032x016x16_DTL0_EPS1_GRVW02_LPB00_PGR1_SNLL0_TT02_02_USFGRO0_VW02_WG16_08_02
    SolutionIndex: 40
    SolutionNameMin: Cijk_Ailk_Bljk_SB_MT064x016x16_DTL0_EPS1_GRVW02_LPB00_PGR1_SNLL0_TT04_02_USFGRO0_VW02_WG16_08_02
    SolutionIndex: 41
    SolutionNameMin: Cijk_Ailk_Bljk_SB_MT128x064x16_DTL0_EPS1_GRVW04_LPB00_PGR1_SNLL0_TT08_08_USFGRO0_VW04_WG16_08_02
    SolutionIndex: 42
    SolutionNameMin: Cijk_Ailk_Bljk_SB_MT256x016x16_DTL0_EPS1_GRVW04_LPB00_PGR1_SNLL0_TT08_04_USFGRO0_VW04_WG32_04_02
    SolutionIndex: 43
    SolutionNameMin: Cijk_Ailk_Bljk_SB_MT064x016x16_DTL0_EPS1_GRVW04_LPB00_PGR1_SNLL0_TT04_04_USFGRO0_VW04_WG16_04_04
    SolutionIndex: 44
    SolutionNameMin: Cijk_Ailk_Bljk_SB_MT032x016x16_DTL0_EPS1_GRVW02_LPB00_PGR1_SNLL0_TT04_02_USFGRO0_VW02_WG08_08_02
    SolutionIndex: 45
    SolutionNameMin: Cijk_Ailk_Bljk_SB_MT032x032x16_DTL0_EPS1_GRVW04_LPB00_PGR1_SNLL0_TT04_04_USFGRO0_VW04_WG08_08_02
    SolutionIndex: 46
    SolutionNameMin: Cijk_Ailk_Bljk_SB_MT064x032x16_DTL0_EPS1_GRVW04_LPB00_PGR1_SNLL0_TT08_04_USFGRO0_VW04_WG08_08_02
    SolutionIndex: 47
    SolutionNameMin: Cijk_Ailk_Bljk_SB_MT016x016x16_DTL0_EPS1_GRVW02_LPB00_PGR1_SNLL0_TT02_02_USFGRO01_VW02_WG08_08_04
    SolutionIndex: 48
    SolutionNameMin: Cijk_Ailk_Bljk_SB_MT032x016x16_DTL0_EPS1_GRVW02_LPB00_PGR1_SNLL0_TT04_02_USFGRO0_VW02_WG08_08_04
    SolutionIndex: 49
    SolutionNameMin: Cijk_Ailk_Bljk_SB_MT032x016x16_DTL0_EPS1_GRVW02_LPB00_PGR1_SNLL0_TT02_02_USFGRO0_VW02_WG16_08_02
    SolutionIndex: 50
    SolutionNameMin: Cijk_Ailk_Bljk_SB_MT128x064x16_DTL0_EPS1_GRVW04_LPB00_PGR1_SNLL0_TT08_08_USFGRO0_VW04_WG16_08_02
    SolutionIndex: 51
    SolutionNameMin: Cijk_Ailk_Bljk_SB_MT032x016x16_DTL0_EPS1_GRVW02_LPB00_PGR1_SNLL0_TT04_02_USFGRO0_VW02_WG08_08_02
    SolutionIndex: 52
    SolutionNameMin: Cijk_Ailk_Bljk_SB_MT032x032x16_DTL0_EPS1_GRVW04_LPB00_PGR1_SNLL0_TT04_04_USFGRO0_VW04_WG08_08_02
    SolutionIndex: 53
    SolutionNameMin: Cijk_Ailk_Bljk_SB_MT064x032x16_DTL0_EPS1_GRVW04_LPB00_PGR1_SNLL0_TT08_04_USFGRO0_VW04_WG08_08_02
    SolutionIndex: 54
    SolutionNameMin: Cijk_Ailk_Bljk_SB_MT016x016x16_DTL0_EPS1_GRVW02_LPB00_PGR1_SNLL0_TT02_02_USFGRO01_VW02_WG08_08_04
    SolutionIndex: 55
    SolutionNameMin: Cijk_Ailk_Bljk_SB_MT032x016x16_DTL0_EPS1_GRVW02_LPB00_PGR1_SNLL0_TT04_02_USFGRO0_VW02_WG08_08_04
    SolutionIndex: 56
    SolutionNameMin: Cijk_Ailk_Bljk_SB_MT032x016x16_DTL0_EPS1_GRVW02_LPB00_PGR1_SNLL0_TT02_02_USFGRO0_VW02_WG16_08_02
    SolutionIndex: 57
    SolutionNameMin: Cijk_Ailk_Bljk_SB_MT064x016x16_DTL0_EPS1_GRVW02_LPB00_PGR1_SNLL0_TT04_02_USFGRO0_VW02_WG16_08_02
    SolutionIndex: 58
    SolutionNameMin: Cijk_Ailk_Bljk_SB_MT032x016x16_DTL0_EPS1_GRVW02_LPB00_PGR1_SNLL0_TT04_02_USFGRO0_VW02_WG08_08_02
    SolutionIndex: 59
    SolutionNameMin: Cijk_Ailk_Bljk_SB_MT016x016x16_DTL0_EPS1_GRVW02_LPB00_PGR1_SNLL0_TT02_02_USFGRO01_VW02_WG08_08_04
    SolutionIndex: 60
    SolutionNameMin: Cijk_Ailk_Bljk_SB_MT064x016x16_DTL0_EPS1_GRVW02_LPB00_PGR1_SNLL0_TT04_02_USFGRO0_VW02_WG16_08_02
    SolutionIndex: 61
    SolutionNameMin: Cijk_Ailk_Bljk_SB_MT016x016x16_DTL0_EPS1_GRVW02_LPB00_PGR1_SNLL0_TT02_02_USFGRO01_VW02_WG08_08_04
    SolutionIndex: 62
    SolutionNameMin: Cijk_Ailk_Bljk_SB_MT064x064x24_DTL0_EPS1_GRVW04_LPB00_PGR1_SNLL0_TT08_08_USFGRO0_VW04_WG08_08_02
    SolutionIndex: 63
    SolutionNameMin: Cijk_Ailk_Bljk_SB_MT032x008x32_DTL0_EPS1_GRVW02_LPB00_PGR1_SNLL0_TT02_02_USFGRO0_VW02_WG16_04_04
    SolutionIndex: 64
    SolutionNameMin: Cijk_Ailk_Bljk_SB_MT064x008x32_DTL0_EPS1_GRVW02_LPB00_PGR1_SNLL0_TT04_02_USFGRO0_VW02_WG16_04_04
    SolutionIndex: 65
    SolutionNameMin: Cijk_Ailk_Bljk_SB_MT032x016x32_DTL0_EPS1_GRVW02_LPB00_PGR1_SNLL0_TT04_02_USFGRO0_VW02_WG08_08_04
    SolutionIndex: 66
    SolutionNameMin: Cijk_Ailk_Bljk_SB_MT032x032x32_DTL0_EPS1_GRVW04_LPB00_PGR1_SNLL0_TT04_04_USFGRO0_VW04_WG08_08_04
    SolutionIndex: 67
    SolutionNameMin: Cijk_Ailk_Bljk_SB_MT064x032x32_DTL0_EPS1_GRVW04_LPB00_PGR1_SNLL0_TT08_04_USFGRO0_VW04_WG08_08_04
    SolutionIndex: 68
    SolutionNameMin: Cijk_Ailk_Bljk_SB_MT032x016x32_DTL0_EPS1_GRVW02_LPB00_PGR1_SNLL0_TT02_02_USFGRO0_VW02_WG16_08_02
    SolutionIndex: 69
    SolutionNameMin: Cijk_Ailk_Bljk_SB_MT064x016x32_DTL0_EPS1_GRVW02_LPB00_PGR1_SNLL0_TT04_02_USFGRO0_VW02_WG16_08_02
    SolutionIndex: 70
    SolutionNameMin: Cijk_Ailk_Bljk_SB_MT032x008x32_DTL0_EPS1_GRVW02_LPB00_PGR1_SNLL0_TT02_02_USFGRO0_VW02_WG16_04_04
    SolutionIndex: 71
    SolutionNameMin: Cijk_Ailk_Bljk_SB_MT128x032x32_DTL0_EPS1_GRVW04_LPB00_PGR1_SNLL0_TT08_08_USFGRO0_VW04_WG16_04_04
    SolutionIndex: 72
    SolutionNameMin: Cijk_Ailk_Bljk_SB_MT032x032x32_DTL0_EPS1_GRVW04_LPB00_PGR1_SNLL0_TT04_04_USFGRO0_VW04_WG08_08_02
    SolutionIndex: 73
    SolutionNameMin: Cijk_Ailk_Bljk_SB_MT032x032x32_DTL0_EPS1_GRVW04_LPB00_PGR1_SNLL0_TT04_04_USFGRO0_VW04_WG08_08_04
    SolutionIndex: 74
    SolutionNameMin: Cijk_Ailk_Bljk_SB_MT064x032x32_DTL0_EPS1_GRVW04_LPB00_PGR1_SNLL0_TT08_04_USFGRO0_VW04_WG08_08_04
    SolutionIndex: 75
    SolutionNameMin: Cijk_Ailk_Bljk_SB_MT032x008x32_DTL0_EPS1_GRVW02_LPB00_PGR1_SNLL0_TT02_02_USFGRO0_VW02_WG16_04_04
    SolutionIndex: 76
    SolutionNameMin: Cijk_Ailk_Bljk_SB_MT064x008x32_DTL0_EPS1_GRVW02_LPB00_PGR1_SNLL0_TT04_02_USFGRO0_VW02_WG16_04_04
    SolutionIndex: 77
    SolutionNameMin: Cijk_Ailk_Bljk_SB_MT032x016x32_DTL0_EPS1_GRVW02_LPB00_PGR1_SNLL0_TT04_02_USFGRO0_VW02_WG08_08_04
    SolutionIndex: 78
    SolutionNameMin: Cijk_Ailk_Bljk_SB_MT032x032x32_DTL0_EPS1_GRVW04_LPB00_PGR1_SNLL0_TT04_04_USFGRO0_VW04_WG08_08_04
    SolutionIndex: 79
    SolutionNameMin: Cijk_Ailk_Bljk_SB_MT032x008x32_DTL0_EPS1_GRVW02_LPB00_PGR1_SNLL0_TT02_02_USFGRO0_VW02_WG16_04_04
    SolutionIndex: 80
    SolutionNameMin: Cijk_Ailk_Bljk_SB_MT032x016x32_DTL0_EPS1_GRVW02_LPB00_PGR1_SNLL0_TT04_02_USFGRO0_VW02_WG08_08_04
    SolutionIndex: 81
    SolutionNameMin: Cijk_Ailk_Bljk_SB_MT032x032x32_DTL0_EPS1_GRVW04_LPB00_PGR1_SNLL0_TT04_04_USFGRO0_VW04_WG08_08_04
    SolutionIndex: 82
    SolutionNameMin: Cijk_Ailk_Bljk_SB_MT032x016x32_DTL0_EPS1_GRVW02_LPB00_PGR1_SNLL0_TT02_02_USFGRO0_VW02_WG16_08_02
    SolutionIndex: 83
    SolutionNameMin: Cijk_Ailk_Bljk_SB_MT032x008x32_DTL0_EPS1_GRVW02_LPB00_PGR1_SNLL0_TT02_02_USFGRO0_VW02_WG16_04_04
    SolutionIndex: 84
    SolutionNameMin: Cijk_Ailk_Bljk_SB_MT064x064x16_DTL0_EPS0_GRVW04_LPB00_PGR0_SNLL0_TT04_04_USFGRO00_VW04_WG16_16_01
    SolutionIndex: 85
    SolutionNameMin: Cijk_Ailk_Bljk_SB_MT064x064x16_DTL0_EPS0_GRVW04_LPB00_PGR1_SNLL0_TT04_04_USFGRO00_VW04_WG16_16_01
    SolutionIndex: 86
    SolutionNameMin: Cijk_Ailk_Bljk_SB_MT064x128x16_DTL0_EPS0_GRVW04_LPB00_PGR1_SNLL0_TT04_08_USFGRO00_VW04_WG16_16_01
    SolutionIndex: 87
    SolutionNameMin: Cijk_Ailk_Bljk_SB_MT096x128x16_DTL0_EPS0_GRVW02_LPB00_PGR0_SNLL0_TT06_08_USFGRO00_VW02_WG16_16_01
    SolutionIndex: 88
    SolutionNameMin: Cijk_Ailk_Bljk_SB_MT064x064x16_DTL0_EPS0_GRVW04_LPB00_PGR0_SNLL0_TT04_04_USFGRO00_VW04_WG16_16_01
    SolutionIndex: 89
    SolutionNameMin: Cijk_Ailk_Bljk_SB_MT064x064x16_DTL0_EPS0_GRVW04_LPB00_PGR1_SNLL0_TT04_04_USFGRO00_VW04_WG16_16_01
    SolutionIndex: 90
    SolutionNameMin: Cijk_Ailk_Bljk_SB_MT064x128x16_DTL0_EPS0_GRVW04_LPB00_PGR1_SNLL0_TT04_08_USFGRO00_VW04_WG16_16_01
    SolutionIndex: 91
    SolutionNameMin: Cijk_Ailk_Bljk_SB_MT128x128x08_DTL0_EPS1_GRVW04_LPB00_PGR1_SNLL1_TT08_08_USFGRO0_VW04_WG16_16_01
    SolutionIndex: 92
    SolutionNameMin: Cijk_Ailk_Bljk_SB_MT128x128x08_DTL0_EPS1_GRVW04_LPB00_PGR1_SNLL1_TT08_08_USFGRO0_VW04_WG16_16_01
    SolutionIndex: 93
    SolutionNameMin: Cijk_Ailk_Bljk_SB_MT064x064x16_DTL0_EPS0_GRVW04_LPB00_PGR0_SNLL0_TT04_04_USFGRO0_VW04_WG16_16_01
    SolutionIndex: 94
    SolutionNameMin: Cijk_Ailk_Bljk_SB_MT064x064x16_DTL0_EPS1_GRVW04_LPB00_PGR1_SNLL1_TT04_04_USFGRO0_VW04_WG16_16_01
    SolutionIndex: 95
    SolutionNameMin: Cijk_Ailk_Bljk_SB_MT064x128x16_DTL0_EPS0_GRVW04_LPB00_PGR0_SNLL0_TT04_08_USFGRO0_VW04_WG16_16_01
    SolutionIndex: 96
    SolutionNameMin: Cijk_Ailk_Bljk_SB_MT064x128x16_DTL0_EPS1_GRVW04_LPB00_PGR1_SNLL1_TT04_08_USFGRO0_VW04_WG16_16_01
    SolutionIndex: 97
    SolutionNameMin: Cijk_Ailk_Bljk_SB_MT128x064x16_DTL0_EPS0_GRVW04_LPB00_PGR0_SNLL0_TT08_04_USFGRO0_VW04_WG16_16_01
    SolutionIndex: 98
    SolutionNameMin: Cijk_Ailk_Bljk_SB_MT128x064x16_DTL0_EPS1_GRVW04_LPB00_PGR1_SNLL1_TT08_04_USFGRO0_VW04_WG16_16_01
    SolutionIndex: 99
    SolutionNameMin: Cijk_Ailk_Bljk_SB_MT128x128x16_DTL0_EPS1_GRVW04_LPB00_PGR1_SNLL1_TT08_08_USFGRO0_VW04_WG16_16_01
    SolutionIndex: 100
    SolutionNameMin: Cijk_Ailk_Bljk_SB_MT064x064x16_DTL0_EPS0_GRVW04_LPB00_PGR0_SNLL0_TT04_04_USFGRO0_VW04_WG16_16_01
    SolutionIndex: 101
    SolutionNameMin: Cijk_Ailk_Bljk_SB_MT064x064x16_DTL0_EPS1_GRVW04_LPB00_PGR1_SNLL1_TT04_04_USFGRO0_VW04_WG16_16_01
    SolutionIndex: 102
    SolutionNameMin: Cijk_Ailk_Bljk_SB_MT064x128x16_DTL0_EPS1_GRVW04_LPB00_PGR1_SNLL1_TT04_08_USFGRO0_VW04_WG16_16_01
    SolutionIndex: 103
    SolutionNameMin: Cijk_Ailk_Bljk_SB_MT128x064x16_DTL0_EPS0_GRVW04_LPB00_PGR0_SNLL0_TT08_04_USFGRO0_VW04_WG16_16_01
    SolutionIndex: 104
    SolutionNameMin: Cijk_Ailk_Bljk_SB_MT128x064x16_DTL0_EPS1_GRVW04_LPB00_PGR1_SNLL1_TT08_04_USFGRO0_VW04_WG16_16_01
    SolutionIndex: 105
    SolutionNameMin: Cijk_Ailk_Bljk_SB_MT128x128x16_DTL0_EPS1_GRVW04_LPB00_PGR1_SNLL1_TT08_08_USFGRO0_VW04_WG16_16_01
    SolutionIndex: 106
    SolutionNameMin: Cijk_Ailk_Bljk_SB_MT064x064x32_DTL0_EPS1_GRVW04_LPB00_PGR1_SNLL1_TT04_04_USFGRO0_VW04_WG16_16_01
    SolutionIndex: 107
    SolutionNameMin: Cijk_Ailk_Bljk_SB_MT016x016x04_DTL0_EPS0_GRVW02_LPB00_PGR1_SNLL0_TT02_02_USFGRO00_VW02_WG08_08_01
    SolutionIndex: 108
    SolutionNameMin: Cijk_Ailk_Bljk_SB_MT032x032x02_DTL0_EPS0_GRVW04_LPB00_PGR1_SNLL0_TT04_04_USFGRO00_VW04_WG08_08_01
    SolutionIndex: 109
    SolutionNameMin: Cijk_Ailk_Bljk_SB_MT016x016x16_DTL0_EPS1_GRVW02_LPB00_PGR1_SNLL1_TT02_02_USFGRO01_VW02_WG08_08_04
    SolutionIndex: 110
    SolutionNameMin: Cijk_Ailk_Bljk_SB_MT016x016x04_DTL0_EPS1_GRVW02_LPB00_PGR1_SNLL0_TT02_02_USFGRO01_VW02_WG08_08_01
    SolutionIndex: 111
    SolutionNameMin: Cijk_Ailk_Bljk_SB_MT008x008x08_DTL0_EPS1_GRVW02_LPB00_PGR1_SNLL0_TT02_02_USFGRO01_VW02_WG04_04_04
    SolutionIndex: 112
    SolutionNameMin: Cijk_Ailk_Bljk_SB_MT008x008x08_DTL0_EPS1_GRVW02_LPB00_PGR1_SNLL0_TT02_02_USFGRO01_VW02_WG04_04_04
    SolutionIndex: 113
    SolutionNameMin: Cijk_Ailk_Bljk_SB_MT016x016x16_DTL0_EPS1_GRVW02_LPB00_PGR1_SNLL0_TT02_02_USFGRO01_VW02_WG08_08_04
    SolutionIndex: 114
    SolutionNameMin: Cijk_Ailk_Bljk_SB_MT064x064x16_DTL0_EPS1_GRVW04_LPB00_PGR1_SNLL1_TT02_04_USFGRO0_VW02_WG32_16_01
    SolutionIndex: 115
    SolutionNameMin: Cijk_Ailk_Bljk_SB_MT128x064x16_DTL0_EPS1_GRVW04_LPB00_PGR1_SNLL1_TT04_08_USFGRO0_VW04_WG32_08_01
    SolutionIndex: 116
    SolutionNameMin: Cijk_Ailk_Bljk_SB_MT128x032x08_DTL0_EPS1_GRVW04_LPB04_PGR1_SNLL1_TT04_04_USFGRO0_VW04_WG32_08_01
    SolutionIndex: 117
    SolutionNameMin: Cijk_Ailk_Bljk_SB_MT128x032x08_DTL0_EPS1_GRVW04_LPB04_PGR1_SNLL1_TT04_04_USFGRO0_VW04_WG32_08_01
    SolutionIndex: 118
    SolutionNameMin: Cijk_Ailk_Bljk_SB_MT128x064x32_DTL0_EPS1_GRVW04_LPB04_PGR1_SNLL1_TT04_04_USFGRO0_VW04_WG32_16_01
    SolutionIndex: 119
    SolutionNameMin: Cijk_Ailk_Bljk_SB_MT128x064x32_DTL0_EPS1_GRVW04_LPB04_PGR1_SNLL1_TT04_04_USFGRO0_VW04_WG32_16_01
    SolutionIndex: 120
    SolutionNameMin: Cijk_Ailk_Bljk_SB_MT128x032x16_DTL0_EPS0_GRVW01_LPB02_PGR0_SNLL0_TT04_04_USFGRO01_VW01_WG32_08_01
    SolutionIndex: 121
    SolutionNameMin: Cijk_Ailk_Bljk_SB_MT032x128x16_DTL0_EPS0_GRVW01_LPB02_PGR0_SNLL0_TT04_04_USFGRO01_VW02_WG08_32_01
    SolutionIndex: 122
    SolutionNameMin: Cijk_Ailk_Bljk_SB_MT256x032x16_DTL1_EPS0_GRVW01_LPB02_PGR0_SNLL0_TT08_04_USFGRO01_VW02_WG32_08_01
    SolutionIndex: 123
    SolutionNameMin: Cijk_Ailk_Bljk_SB_MT064x032x16_DTL0_EPS0_GRVW01_LPB04_PGR0_SNLL0_TT04_04_USFGRO01_VW02_WG16_08_01
    SolutionIndex: 124
    SolutionNameMin: Cijk_Ailk_Bljk_SB_MT128x032x16_DTL0_EPS0_GRVW01_LPB04_PGR0_SNLL0_TT04_04_USFGRO01_VW04_WG32_08_01
    SolutionIndex: 125
    SolutionNameMin: Cijk_Ailk_Bljk_SB_MT064x064x16_DTL0_EPS0_GRVW04_LPB04_PGR0_SNLL0_TT04_04_USFGRO0_VW04_WG16_16_01
    SolutionIndex: 126
    SolutionNameMin: Cijk_Ailk_Bljk_SB_MT128x064x16_DTL0_EPS0_GRVW04_LPB04_PGR0_SNLL0_TT04_08_USFGRO0_VW04_WG32_08_01
    SolutionIndex: 0
    SolutionNameMin: Cijk_Ailk_Bljk_SB_MT128x064x16_DTL0_GRVW04_GSU01_LPB00_PGR1_PLR1_TT08_04_USFGRO0_VW04_WG16_16_01_WGM01
    SolutionIndex: 1
    SolutionNameMin: Cijk_Ailk_Bljk_SB_MT128x064x16_DTL0_GRVW04_GSU01_LPB00_PGR1_PLR1_TT04_08_USFGRO0_VW04_WG32_08_01_WGM01
    SolutionIndex: 2
    SolutionNameMin: Cijk_Ailk_Bljk_SB_MT064x064x32_DTL0_GRVW04_GSU01_LPB00_PGR0_PLR1_TT04_04_USFGRO0_VW04_WG16_16_01_WGM64
    SolutionIndex: 3
    SolutionNameMin: Cijk_Ailk_Bljk_SB_MT128x032x16_DTL0_GRVW01_GSU05_LPB02_PGR0_PLR1_TT04_04_USFGRO01_VW02_WG32_08_01_WGM08
    SolutionIndex: 4
    SolutionNameMin: Cijk_Ailk_Bljk_SB_MT064x128x16_DTL0_GRVW01_GSU01_LPB04_PGR0_PLR1_TT04_08_USFGRO01_VW04_WG16_16_01_WGM01
    SolutionIndex: 5
    SolutionNameMin: Cijk_Ailk_Bljk_SB_MT064x064x16_DTL0_GRVW01_GSU01_LPB04_PGR0_PLR1_TT04_04_USFGRO01_VW04_WG16_16_01_WGM64
    SolutionIndex: 6
    SolutionNameMin: Cijk_Ailk_Bljk_SB_MT256x032x16_DTL1_GRVW01_GSU01_LPB04_PGR0_PLR1_TT08_04_USFGRO01_VW04_WG32_08_01_WGM64
    SolutionIndex: 7
    SolutionNameMin: Cijk_Ailk_Bljk_SB_MT064x128x16_DTL0_GRVW04_GSU01_LPB04_PGR0_PLR1_TT04_08_USFGRO0_VW04_WG16_16_01_WGM01
    SolutionIndex: 8
    SolutionNameMin: Cijk_Ailk_Bljk_SB_MT128x032x16_DTL0_GRVW04_GSU01_LPB04_PGR0_PLR0_TT04_04_USFGRO0_VW04_WG32_08_01_WGM01
    SolutionIndex: 9
    SolutionNameMin: Cijk_Ailk_Bljk_SB_MT064x064x16_DTL0_GRVW04_GSU01_LPB04_PGR0_PLR1_TT04_04_USFGRO0_VW04_WG16_16_01_WGM08
    SolutionIndex: 10
    SolutionNameMin: Cijk_Ailk_Bljk_SB_MT128x064x16_DTL0_GRVW04_GSU01_LPB04_PGR0_PLR1_TT04_08_USFGRO0_VW04_WG32_08_01_WGM08
    SolutionIndex: 11
    SolutionNameMin: Cijk_Ailk_Bljk_SB_MT128x064x16_DTL0_GRVW04_GSU01_LPB04_PGR1_PLR1_TT04_08_USFGRO0_VW04_WG32_08_01_WGM08
    SolutionIndex: 12
    SolutionNameMin: Cijk_Ailk_Bljk_SB_MT064x064x32_DTL0_GRVW04_GSU01_LPB04_PGR0_PLR1_TT04_04_USFGRO0_VW04_WG16_16_01_WGM01
    SolutionIndex: 127
    SolutionNameMin: Cijk_Ailk_Bljk_SB_MT128x016x16_DTL0_EPS0_GRVW04_LPB00_PGR0_SNLL0_TT04_04_USFGRO0_VW04_WG32_04_02
    SolutionIndex: 128
    SolutionNameMin: Cijk_Ailk_Bljk_SB_MT128x016x16_DTL0_EPS1_GRVW04_LPB00_PGR1_SNLL0_TT04_04_USFGRO0_VW04_WG32_04_02
    SolutionIndex: 129
    SolutionNameMin: Cijk_Ailk_Bljk_SB_MT128x008x32_DTL0_EPS0_GRVW02_LPB00_PGR0_SNLL0_TT08_02_USFGRO0_VW02_WG16_04_04
    SolutionIndex: 130
    SolutionNameMin: Cijk_Ailk_Bljk_SB_MT064x008x32_DTL0_EPS0_GRVW04_LPB00_PGR0_SNLL0_TT04_04_USFGRO0_VW04_WG16_02_08
    SolutionIndex: 131
    SolutionNameMin: Cijk_Ailk_Bljk_SB_MT064x008x32_DTL0_EPS1_GRVW04_LPB00_PGR1_SNLL0_TT04_04_USFGRO0_VW04_WG16_02_08
    SolutionIndex: 132
    SolutionNameMin: Cijk_Ailk_Bljk_SB_MT032x008x64_DTL0_EPS0_GRVW02_LPB00_PGR0_SNLL0_TT02_02_USFGRO0_VW02_WG16_04_04
    SolutionIndex: 133
    SolutionNameMin: Cijk_Ailk_Bljk_SB_MT064x016x64_DTL0_EPS0_GRVW04_LPB00_PGR0_SNLL0_TT04_04_USFGRO0_VW04_WG16_04_04
    SolutionIndex: 134
    SolutionNameMin: Cijk_Ailk_Bljk_SB_MT048x036x16_DTL0_EPS1_GRVW01_LPB00_PGR1_SNLL0_TT06_03_USFGRO01_VW01_WG08_12_02
    SolutionIndex: 135
    SolutionNameMin: Cijk_Ailk_Bljk_SB_MT048x036x16_DTL0_EPS1_GRVW01_LPB00_PGR1_SNLL0_TT06_03_USFGRO01_VW01_WG08_12_02
    SolutionIndex: 136
    SolutionNameMin: Cijk_Ailk_Bljk_SB_MT048x048x16_DTL0_EPS1_GRVW01_LPB00_PGR1_SNLL0_TT03_03_USFGRO01_VW01_WG16_16_01
    SolutionIndex: 137
    SolutionNameMin: Cijk_Ailk_Bljk_SB_MT024x024x24_DTL0_EPS1_GRVW01_LPB00_PGR1_SNLL0_TT03_04_USFGRO01_VW01_WG08_06_04
    SolutionIndex: 138
    SolutionNameMin: Cijk_Ailk_Bljk_SB_MT048x024x32_DTL0_EPS1_GRVW02_LPB00_PGR1_SNLL0_TT06_04_USFGRO0_VW02_WG08_06_04
    SolutionIndex: 139
    SolutionNameMin: Cijk_Ailk_Bljk_SB_MT016x016x08_DTL0_EPS0_GRVW02_LPB00_PGR1_SNLL0_TT02_02_USFGRO00_VW02_WG08_08_01
    SolutionIndex: 140
    SolutionNameMin: Cijk_Ailk_Bljk_SB_MT064x032x08_DTL0_EPS0_GRVW04_LPB00_PGR1_SNLL0_TT08_04_USFGRO00_VW04_WG08_08_01
    SolutionIndex: 141
    SolutionNameMin: Cijk_Ailk_Bljk_SB_MT032x016x08_DTL0_EPS0_GRVW02_LPB00_PGR1_SNLL0_TT02_02_USFGRO00_VW02_WG16_08_01
    SolutionIndex: 142
    SolutionNameMin: Cijk_Ailk_Bljk_SB_MT064x016x08_DTL0_EPS0_GRVW02_LPB00_PGR1_SNLL0_TT04_02_USFGRO00_VW02_WG16_08_01
    SolutionIndex: 143
    SolutionNameMin: Cijk_Ailk_Bljk_SB_MT032x016x08_DTL0_EPS0_GRVW02_LPB00_PGR1_SNLL0_TT04_02_USFGRO00_VW02_WG08_08_01
    SolutionIndex: 144
    SolutionNameMin: Cijk_Ailk_Bljk_SB_MT032x032x08_DTL0_EPS0_GRVW04_LPB00_PGR1_SNLL0_TT04_04_USFGRO00_VW04_WG08_08_01
    SolutionIndex: 145
    SolutionNameMin: Cijk_Ailk_Bljk_SB_MT032x016x08_DTL0_EPS0_GRVW02_LPB00_PGR1_SNLL0_TT02_02_USFGRO00_VW02_WG16_08_01
    SolutionIndex: 146
    SolutionNameMin: Cijk_Ailk_Bljk_SB_MT064x016x08_DTL0_EPS0_GRVW02_LPB00_PGR1_SNLL0_TT04_02_USFGRO00_VW02_WG16_08_01
    SolutionIndex: 147
    SolutionNameMin: Cijk_Ailk_Bljk_SB_MT016x016x16_DTL0_EPS0_GRVW02_LPB00_PGR1_SNLL0_TT02_02_USFGRO00_VW02_WG08_08_01
    SolutionIndex: 148
    SolutionNameMin: Cijk_Ailk_Bljk_SB_MT064x016x16_DTL0_EPS0_GRVW02_LPB00_PGR1_SNLL0_TT04_02_USFGRO00_VW02_WG16_08_01
    SolutionIndex: 149
    SolutionNameMin: Cijk_Ailk_Bljk_SB_MT016x016x16_DTL0_EPS0_GRVW02_LPB00_PGR1_SNLL0_TT02_02_USFGRO00_VW02_WG08_08_01
    SolutionIndex: 150
    SolutionNameMin: Cijk_Ailk_Bljk_SB_MT064x016x16_DTL0_EPS0_GRVW02_LPB00_PGR1_SNLL0_TT04_02_USFGRO00_VW02_WG16_08_01
    SolutionIndex: 151
    SolutionNameMin: Cijk_Ailk_Bljk_SB_MT016x016x08_DTL0_EPS1_GRVW02_LPB00_PGR1_SNLL0_TT02_02_USFGRO01_VW02_WG08_08_02
    SolutionIndex: 152
    SolutionNameMin: Cijk_Ailk_Bljk_SB_MT032x016x08_DTL0_EPS1_GRVW02_LPB00_PGR1_SNLL0_TT04_02_USFGRO0_VW02_WG08_08_02
    SolutionIndex: 153
    SolutionNameMin: Cijk_Ailk_Bljk_SB_MT128x032x08_DTL0_EPS1_GRVW04_LPB00_PGR1_SNLL0_TT08_04_USFGRO0_VW04_WG16_08_02
    SolutionIndex: 154
    SolutionNameMin: Cijk_Ailk_Bljk_SB_MT032x016x08_DTL0_EPS1_GRVW02_LPB00_PGR1_SNLL0_TT04_02_USFGRO0_VW02_WG08_08_02
    SolutionIndex: 155
    SolutionNameMin: Cijk_Ailk_Bljk_SB_MT016x016x08_DTL0_EPS1_GRVW02_LPB00_PGR1_SNLL0_TT02_02_USFGRO01_VW02_WG08_08_02
    SolutionIndex: 156
    SolutionNameMin: Cijk_Ailk_Bljk_SB_MT032x016x08_DTL0_EPS1_GRVW02_LPB00_PGR1_SNLL0_TT04_02_USFGRO0_VW02_WG08_08_02
    SolutionIndex: 157
    SolutionNameMin: Cijk_Ailk_Bljk_SB_MT016x016x08_DTL0_EPS1_GRVW02_LPB00_PGR1_SNLL0_TT02_02_USFGRO01_VW02_WG08_08_02
    SolutionIndex: 158
    SolutionNameMin: Cijk_Ailk_Bljk_SB_MT128x016x16_DTL0_EPS1_GRVW04_LPB00_PGR1_SNLL0_TT04_04_USFGRO0_VW04_WG32_04_02
    SolutionIndex: 159
    SolutionNameMin: Cijk_Ailk_Bljk_SB_MT064x016x16_DTL0_EPS1_GRVW04_LPB00_PGR1_SNLL0_TT04_04_USFGRO0_VW04_WG16_04_04
    SolutionIndex: 160
    SolutionNameMin: Cijk_Ailk_Bljk_SB_MT128x016x16_DTL0_EPS1_GRVW04_LPB00_PGR1_SNLL0_TT08_04_USFGRO0_VW04_WG16_04_04
    SolutionIndex: 161
    SolutionNameMin: Cijk_Ailk_Bljk_SB_MT032x016x16_DTL0_EPS1_GRVW02_LPB00_PGR1_SNLL0_TT04_02_USFGRO0_VW02_WG08_08_02
    SolutionIndex: 162
    SolutionNameMin: Cijk_Ailk_Bljk_SB_MT032x032x16_DTL0_EPS1_GRVW04_LPB00_PGR1_SNLL0_TT04_04_USFGRO0_VW04_WG08_08_02
    SolutionIndex: 163
    SolutionNameMin: Cijk_Ailk_Bljk_SB_MT064x032x16_DTL0_EPS1_GRVW04_LPB00_PGR1_SNLL0_TT08_04_USFGRO0_VW04_WG08_08_02
    SolutionIndex: 164
    SolutionNameMin: Cijk_Ailk_Bljk_SB_MT016x016x16_DTL0_EPS1_GRVW02_LPB00_PGR1_SNLL0_TT02_02_USFGRO01_VW02_WG08_08_04
    SolutionIndex: 165
    SolutionNameMin: Cijk_Ailk_Bljk_SB_MT032x016x16_DTL0_EPS1_GRVW02_LPB00_PGR1_SNLL0_TT04_02_USFGRO0_VW02_WG08_08_04
    SolutionIndex: 166
    SolutionNameMin: Cijk_Ailk_Bljk_SB_MT032x016x16_DTL0_EPS1_GRVW02_LPB00_PGR1_SNLL0_TT02_02_USFGRO0_VW02_WG16_08_02
    SolutionIndex: 167
    SolutionNameMin: Cijk_Ailk_Bljk_SB_MT064x016x16_DTL0_EPS1_GRVW02_LPB00_PGR1_SNLL0_TT04_02_USFGRO0_VW02_WG16_08_02
    SolutionIndex: 168
    SolutionNameMin: Cijk_Ailk_Bljk_SB_MT128x064x16_DTL0_EPS1_GRVW04_LPB00_PGR1_SNLL0_TT08_08_USFGRO0_VW04_WG16_08_02
    SolutionIndex: 169
    SolutionNameMin: Cijk_Ailk_Bljk_SB_MT256x016x16_DTL0_EPS1_GRVW04_LPB00_PGR1_SNLL0_TT08_04_USFGRO0_VW04_WG32_04_02
    SolutionIndex: 170
    SolutionNameMin: Cijk_Ailk_Bljk_SB_MT064x016x16_DTL0_EPS1_GRVW04_LPB00_PGR1_SNLL0_TT04_04_USFGRO0_VW04_WG16_04_04
    SolutionIndex: 171
    SolutionNameMin: Cijk_Ailk_Bljk_SB_MT032x016x16_DTL0_EPS1_GRVW02_LPB00_PGR1_SNLL0_TT04_02_USFGRO0_VW02_WG08_08_02
    SolutionIndex: 172
    SolutionNameMin: Cijk_Ailk_Bljk_SB_MT032x032x16_DTL0_EPS1_GRVW04_LPB00_PGR1_SNLL0_TT04_04_USFGRO0_VW04_WG08_08_02
    SolutionIndex: 173
    SolutionNameMin: Cijk_Ailk_Bljk_SB_MT064x032x16_DTL0_EPS1_GRVW04_LPB00_PGR1_SNLL0_TT08_04_USFGRO0_VW04_WG08_08_02
    SolutionIndex: 174
    SolutionNameMin: Cijk_Ailk_Bljk_SB_MT016x016x16_DTL0_EPS1_GRVW02_LPB00_PGR1_SNLL0_TT02_02_USFGRO01_VW02_WG08_08_04
    SolutionIndex: 175
    SolutionNameMin: Cijk_Ailk_Bljk_SB_MT032x016x16_DTL0_EPS1_GRVW02_LPB00_PGR1_SNLL0_TT04_02_USFGRO0_VW02_WG08_08_04
    SolutionIndex: 176
    SolutionNameMin: Cijk_Ailk_Bljk_SB_MT032x016x16_DTL0_EPS1_GRVW02_LPB00_PGR1_SNLL0_TT02_02_USFGRO0_VW02_WG16_08_02
    SolutionIndex: 177
    SolutionNameMin: Cijk_Ailk_Bljk_SB_MT128x064x16_DTL0_EPS1_GRVW04_LPB00_PGR1_SNLL0_TT08_08_USFGRO0_VW04_WG16_08_02
    SolutionIndex: 178
    SolutionNameMin: Cijk_Ailk_Bljk_SB_MT032x016x16_DTL0_EPS1_GRVW02_LPB00_PGR1_SNLL0_TT04_02_USFGRO0_VW02_WG08_08_02
    SolutionIndex: 179
    SolutionNameMin: Cijk_Ailk_Bljk_SB_MT032x032x16_DTL0_EPS1_GRVW04_LPB00_PGR1_SNLL0_TT04_04_USFGRO0_VW04_WG08_08_02
    SolutionIndex: 180
    SolutionNameMin: Cijk_Ailk_Bljk_SB_MT064x032x16_DTL0_EPS1_GRVW04_LPB00_PGR1_SNLL0_TT08_04_USFGRO0_VW04_WG08_08_02
    SolutionIndex: 181
    SolutionNameMin: Cijk_Ailk_Bljk_SB_MT016x016x16_DTL0_EPS1_GRVW02_LPB00_PGR1_SNLL0_TT02_02_USFGRO01_VW02_WG08_08_04
    SolutionIndex: 182
    SolutionNameMin: Cijk_Ailk_Bljk_SB_MT032x016x16_DTL0_EPS1_GRVW02_LPB00_PGR1_SNLL0_TT04_02_USFGRO0_VW02_WG08_08_04
    SolutionIndex: 183
    SolutionNameMin: Cijk_Ailk_Bljk_SB_MT032x016x16_DTL0_EPS1_GRVW02_LPB00_PGR1_SNLL0_TT02_02_USFGRO0_VW02_WG16_08_02
    SolutionIndex: 184
    SolutionNameMin: Cijk_Ailk_Bljk_SB_MT064x016x16_DTL0_EPS1_GRVW02_LPB00_PGR1_SNLL0_TT04_02_USFGRO0_VW02_WG16_08_02
    SolutionIndex: 185
    SolutionNameMin: Cijk_Ailk_Bljk_SB_MT032x016x16_DTL0_EPS1_GRVW02_LPB00_PGR1_SNLL0_TT04_02_USFGRO0_VW02_WG08_08_02
    SolutionIndex: 186
    SolutionNameMin: Cijk_Ailk_Bljk_SB_MT016x016x16_DTL0_EPS1_GRVW02_LPB00_PGR1_SNLL0_TT02_02_USFGRO01_VW02_WG08_08_04
    SolutionIndex: 187
    SolutionNameMin: Cijk_Ailk_Bljk_SB_MT064x016x16_DTL0_EPS1_GRVW02_LPB00_PGR1_SNLL0_TT04_02_USFGRO0_VW02_WG16_08_02
    SolutionIndex: 188
    SolutionNameMin: Cijk_Ailk_Bljk_SB_MT016x016x16_DTL0_EPS1_GRVW02_LPB00_PGR1_SNLL0_TT02_02_USFGRO01_VW02_WG08_08_04
    SolutionIndex: 189
    SolutionNameMin: Cijk_Ailk_Bljk_SB_MT064x064x24_DTL0_EPS1_GRVW04_LPB00_PGR1_SNLL0_TT08_08_USFGRO0_VW04_WG08_08_02
    SolutionIndex: 190
    SolutionNameMin: Cijk_Ailk_Bljk_SB_MT032x008x32_DTL0_EPS1_GRVW02_LPB00_PGR1_SNLL0_TT02_02_USFGRO0_VW02_WG16_04_04
    SolutionIndex: 191
    SolutionNameMin: Cijk_Ailk_Bljk_SB_MT064x008x32_DTL0_EPS1_GRVW02_LPB00_PGR1_SNLL0_TT04_02_USFGRO0_VW02_WG16_04_04
    SolutionIndex: 192
    SolutionNameMin: Cijk_Ailk_Bljk_SB_MT032x016x32_DTL0_EPS1_GRVW02_LPB00_PGR1_SNLL0_TT04_02_USFGRO0_VW02_WG08_08_04
    SolutionIndex: 193
    SolutionNameMin: Cijk_Ailk_Bljk_SB_MT032x032x32_DTL0_EPS1_GRVW04_LPB00_PGR1_SNLL0_TT04_04_USFGRO0_VW04_WG08_08_04
    SolutionIndex: 194
    SolutionNameMin: Cijk_Ailk_Bljk_SB_MT064x032x32_DTL0_EPS1_GRVW04_LPB00_PGR1_SNLL0_TT08_04_USFGRO0_VW04_WG08_08_04
    SolutionIndex: 195
    SolutionNameMin: Cijk_Ailk_Bljk_SB_MT032x016x32_DTL0_EPS1_GRVW02_LPB00_PGR1_SNLL0_TT02_02_USFGRO0_VW02_WG16_08_02
    SolutionIndex: 196
    SolutionNameMin: Cijk_Ailk_Bljk_SB_MT064x016x32_DTL0_EPS1_GRVW02_LPB00_PGR1_SNLL0_TT04_02_USFGRO0_VW02_WG16_08_02
    SolutionIndex: 197
    SolutionNameMin: Cijk_Ailk_Bljk_SB_MT032x008x32_DTL0_EPS1_GRVW02_LPB00_PGR1_SNLL0_TT02_02_USFGRO0_VW02_WG16_04_04
    SolutionIndex: 198
    SolutionNameMin: Cijk_Ailk_Bljk_SB_MT128x032x32_DTL0_EPS1_GRVW04_LPB00_PGR1_SNLL0_TT08_08_USFGRO0_VW04_WG16_04_04
    SolutionIndex: 199
    SolutionNameMin: Cijk_Ailk_Bljk_SB_MT032x032x32_DTL0_EPS1_GRVW04_LPB00_PGR1_SNLL0_TT04_04_USFGRO0_VW04_WG08_08_02
    SolutionIndex: 200
    SolutionNameMin: Cijk_Ailk_Bljk_SB_MT032x032x32_DTL0_EPS1_GRVW04_LPB00_PGR1_SNLL0_TT04_04_USFGRO0_VW04_WG08_08_04
    SolutionIndex: 201
    SolutionNameMin: Cijk_Ailk_Bljk_SB_MT064x032x32_DTL0_EPS1_GRVW04_LPB00_PGR1_SNLL0_TT08_04_USFGRO0_VW04_WG08_08_04
    SolutionIndex: 202
    SolutionNameMin: Cijk_Ailk_Bljk_SB_MT032x008x32_DTL0_EPS1_GRVW02_LPB00_PGR1_SNLL0_TT02_02_USFGRO0_VW02_WG16_04_04
    SolutionIndex: 203
    SolutionNameMin: Cijk_Ailk_Bljk_SB_MT064x008x32_DTL0_EPS1_GRVW02_LPB00_PGR1_SNLL0_TT04_02_USFGRO0_VW02_WG16_04_04
    SolutionIndex: 204
    SolutionNameMin: Cijk_Ailk_Bljk_SB_MT032x016x32_DTL0_EPS1_GRVW02_LPB00_PGR1_SNLL0_TT04_02_USFGRO0_VW02_WG08_08_04
    SolutionIndex: 205
    SolutionNameMin: Cijk_Ailk_Bljk_SB_MT032x032x32_DTL0_EPS1_GRVW04_LPB00_PGR1_SNLL0_TT04_04_USFGRO0_VW04_WG08_08_04
    SolutionIndex: 206
    SolutionNameMin: Cijk_Ailk_Bljk_SB_MT032x008x32_DTL0_EPS1_GRVW02_LPB00_PGR1_SNLL0_TT02_02_USFGRO0_VW02_WG16_04_04
    SolutionIndex: 207
    SolutionNameMin: Cijk_Ailk_Bljk_SB_MT032x016x32_DTL0_EPS1_GRVW02_LPB00_PGR1_SNLL0_TT04_02_USFGRO0_VW02_WG08_08_04
    SolutionIndex: 208
    SolutionNameMin: Cijk_Ailk_Bljk_SB_MT032x032x32_DTL0_EPS1_GRVW04_LPB00_PGR1_SNLL0_TT04_04_USFGRO0_VW04_WG08_08_04
    SolutionIndex: 209
    SolutionNameMin: Cijk_Ailk_Bljk_SB_MT032x016x32_DTL0_EPS1_GRVW02_LPB00_PGR1_SNLL0_TT02_02_USFGRO0_VW02_WG16_08_02
    SolutionIndex: 210
    SolutionNameMin: Cijk_Ailk_Bljk_SB_MT032x008x32_DTL0_EPS1_GRVW02_LPB00_PGR1_SNLL0_TT02_02_USFGRO0_VW02_WG16_04_04
    SolutionIndex: 211
    SolutionNameMin: Cijk_Ailk_Bljk_SB_MT064x064x16_DTL0_EPS0_GRVW04_LPB00_PGR0_SNLL0_TT04_04_USFGRO00_VW04_WG16_16_01
    SolutionIndex: 212
    SolutionNameMin: Cijk_Ailk_Bljk_SB_MT064x064x16_DTL0_EPS0_GRVW04_LPB00_PGR1_SNLL0_TT04_04_USFGRO00_VW04_WG16_16_01
    SolutionIndex: 213
    SolutionNameMin: Cijk_Ailk_Bljk_SB_MT064x128x16_DTL0_EPS0_GRVW04_LPB00_PGR1_SNLL0_TT04_08_USFGRO00_VW04_WG16_16_01
    SolutionIndex: 214
    SolutionNameMin: Cijk_Ailk_Bljk_SB_MT096x128x16_DTL0_EPS0_GRVW02_LPB00_PGR0_SNLL0_TT06_08_USFGRO00_VW02_WG16_16_01
    SolutionIndex: 215
    SolutionNameMin: Cijk_Ailk_Bljk_SB_MT064x064x16_DTL0_EPS0_GRVW04_LPB00_PGR0_SNLL0_TT04_04_USFGRO00_VW04_WG16_16_01
    SolutionIndex: 216
    SolutionNameMin: Cijk_Ailk_Bljk_SB_MT064x064x16_DTL0_EPS0_GRVW04_LPB00_PGR1_SNLL0_TT04_04_USFGRO00_VW04_WG16_16_01
    SolutionIndex: 217
    SolutionNameMin: Cijk_Ailk_Bljk_SB_MT064x128x16_DTL0_EPS0_GRVW04_LPB00_PGR1_SNLL0_TT04_08_USFGRO00_VW04_WG16_16_01
    SolutionIndex: 218
    SolutionNameMin: Cijk_Ailk_Bljk_SB_MT128x128x08_DTL0_EPS1_GRVW04_LPB00_PGR1_SNLL1_TT08_08_USFGRO0_VW04_WG16_16_01
    SolutionIndex: 219
    SolutionNameMin: Cijk_Ailk_Bljk_SB_MT128x128x08_DTL0_EPS1_GRVW04_LPB00_PGR1_SNLL1_TT08_08_USFGRO0_VW04_WG16_16_01
    SolutionIndex: 220
    SolutionNameMin: Cijk_Ailk_Bljk_SB_MT064x064x16_DTL0_EPS0_GRVW04_LPB00_PGR0_SNLL0_TT04_04_USFGRO0_VW04_WG16_16_01
    SolutionIndex: 221
    SolutionNameMin: Cijk_Ailk_Bljk_SB_MT064x064x16_DTL0_EPS1_GRVW04_LPB00_PGR1_SNLL1_TT04_04_USFGRO0_VW04_WG16_16_01
    SolutionIndex: 222
    SolutionNameMin: Cijk_Ailk_Bljk_SB_MT064x128x16_DTL0_EPS0_GRVW04_LPB00_PGR0_SNLL0_TT04_08_USFGRO0_VW04_WG16_16_01
    SolutionIndex: 223
    SolutionNameMin: Cijk_Ailk_Bljk_SB_MT064x128x16_DTL0_EPS1_GRVW04_LPB00_PGR1_SNLL1_TT04_08_USFGRO0_VW04_WG16_16_01
    SolutionIndex: 224
    SolutionNameMin: Cijk_Ailk_Bljk_SB_MT128x064x16_DTL0_EPS0_GRVW04_LPB00_PGR0_SNLL0_TT08_04_USFGRO0_VW04_WG16_16_01
    SolutionIndex: 225
    SolutionNameMin: Cijk_Ailk_Bljk_SB_MT128x064x16_DTL0_EPS1_GRVW04_LPB00_PGR1_SNLL1_TT08_04_USFGRO0_VW04_WG16_16_01
    SolutionIndex: 226
    SolutionNameMin: Cijk_Ailk_Bljk_SB_MT128x128x16_DTL0_EPS1_GRVW04_LPB00_PGR1_SNLL1_TT08_08_USFGRO0_VW04_WG16_16_01
    SolutionIndex: 227
    SolutionNameMin: Cijk_Ailk_Bljk_SB_MT064x064x16_DTL0_EPS0_GRVW04_LPB00_PGR0_SNLL0_TT04_04_USFGRO0_VW04_WG16_16_01
    SolutionIndex: 228
    SolutionNameMin: Cijk_Ailk_Bljk_SB_MT064x064x16_DTL0_EPS1_GRVW04_LPB00_PGR1_SNLL1_TT04_04_USFGRO0_VW04_WG16_16_01
    SolutionIndex: 229
    SolutionNameMin: Cijk_Ailk_Bljk_SB_MT064x128x16_DTL0_EPS1_GRVW04_LPB00_PGR1_SNLL1_TT04_08_USFGRO0_VW04_WG16_16_01
    SolutionIndex: 230
    SolutionNameMin: Cijk_Ailk_Bljk_SB_MT128x064x16_DTL0_EPS0_GRVW04_LPB00_PGR0_SNLL0_TT08_04_USFGRO0_VW04_WG16_16_01
    SolutionIndex: 231
    SolutionNameMin: Cijk_Ailk_Bljk_SB_MT128x064x16_DTL0_EPS1_GRVW04_LPB00_PGR1_SNLL1_TT08_04_USFGRO0_VW04_WG16_16_01
    SolutionIndex: 232
    SolutionNameMin: Cijk_Ailk_Bljk_SB_MT128x128x16_DTL0_EPS1_GRVW04_LPB00_PGR1_SNLL1_TT08_08_USFGRO0_VW04_WG16_16_01
    SolutionIndex: 233
    SolutionNameMin: Cijk_Ailk_Bljk_SB_MT064x064x32_DTL0_EPS1_GRVW04_LPB00_PGR1_SNLL1_TT04_04_USFGRO0_VW04_WG16_16_01
    SolutionIndex: 234
    SolutionNameMin: Cijk_Ailk_Bljk_SB_MT016x016x04_DTL0_EPS0_GRVW02_LPB00_PGR1_SNLL0_TT02_02_USFGRO00_VW02_WG08_08_01
    SolutionIndex: 235
    SolutionNameMin: Cijk_Ailk_Bljk_SB_MT032x032x02_DTL0_EPS0_GRVW04_LPB00_PGR1_SNLL0_TT04_04_USFGRO00_VW04_WG08_08_01
    SolutionIndex: 236
    SolutionNameMin: Cijk_Ailk_Bljk_SB_MT016x016x16_DTL0_EPS1_GRVW02_LPB00_PGR1_SNLL1_TT02_02_USFGRO01_VW02_WG08_08_04
    SolutionIndex: 237
    SolutionNameMin: Cijk_Ailk_Bljk_SB_MT016x016x04_DTL0_EPS1_GRVW02_LPB00_PGR1_SNLL0_TT02_02_USFGRO01_VW02_WG08_08_01
    SolutionIndex: 238
    SolutionNameMin: Cijk_Ailk_Bljk_SB_MT008x008x08_DTL0_EPS1_GRVW02_LPB00_PGR1_SNLL0_TT02_02_USFGRO01_VW02_WG04_04_04
    SolutionIndex: 239
    SolutionNameMin: Cijk_Ailk_Bljk_SB_MT008x008x08_DTL0_EPS1_GRVW02_LPB00_PGR1_SNLL0_TT02_02_USFGRO01_VW02_WG04_04_04
    SolutionIndex: 240
    SolutionNameMin: Cijk_Ailk_Bljk_SB_MT016x016x16_DTL0_EPS1_GRVW02_LPB00_PGR1_SNLL0_TT02_02_USFGRO01_VW02_WG08_08_04
    SolutionIndex: 241
    SolutionNameMin: Cijk_Ailk_Bljk_SB_MT064x064x16_DTL0_EPS1_GRVW04_LPB00_PGR1_SNLL1_TT02_04_USFGRO0_VW02_WG32_16_01
    SolutionIndex: 242
    SolutionNameMin: Cijk_Ailk_Bljk_SB_MT128x064x16_DTL0_EPS1_GRVW04_LPB00_PGR1_SNLL1_TT04_08_USFGRO0_VW04_WG32_08_01
    SolutionIndex: 243
    SolutionNameMin: Cijk_Ailk_Bljk_SB_MT128x032x08_DTL0_EPS1_GRVW04_LPB04_PGR1_SNLL1_TT04_04_USFGRO0_VW04_WG32_08_01
    SolutionIndex: 244
    SolutionNameMin: Cijk_Ailk_Bljk_SB_MT128x032x08_DTL0_EPS1_GRVW04_LPB04_PGR1_SNLL1_TT04_04_USFGRO0_VW04_WG32_08_01
    SolutionIndex: 245
    SolutionNameMin: Cijk_Ailk_Bljk_SB_MT128x064x32_DTL0_EPS1_GRVW04_LPB04_PGR1_SNLL1_TT04_04_USFGRO0_VW04_WG32_16_01
    SolutionIndex: 246
    SolutionNameMin: Cijk_Ailk_Bljk_SB_MT128x064x32_DTL0_EPS1_GRVW04_LPB04_PGR1_SNLL1_TT04_04_USFGRO0_VW04_WG32_16_01
    SolutionIndex: 247
    SolutionNameMin: Cijk_Ailk_Bljk_SB_MT128x032x16_DTL0_EPS0_GRVW01_LPB02_PGR0_SNLL0_TT04_04_USFGRO01_VW01_WG32_08_01
    SolutionIndex: 248
    SolutionNameMin: Cijk_Ailk_Bljk_SB_MT032x128x16_DTL0_EPS0_GRVW01_LPB02_PGR0_SNLL0_TT04_04_USFGRO01_VW02_WG08_32_01
    SolutionIndex: 249
    SolutionNameMin: Cijk_Ailk_Bljk_SB_MT256x032x16_DTL1_EPS0_GRVW01_LPB02_PGR0_SNLL0_TT08_04_USFGRO01_VW02_WG32_08_01
    SolutionIndex: 250
    SolutionNameMin: Cijk_Ailk_Bljk_SB_MT064x032x16_DTL0_EPS0_GRVW01_LPB04_PGR0_SNLL0_TT04_04_USFGRO01_VW02_WG16_08_01
    SolutionIndex: 251
    SolutionNameMin: Cijk_Ailk_Bljk_SB_MT128x032x16_DTL0_EPS0_GRVW01_LPB04_PGR0_SNLL0_TT04_04_USFGRO01_VW04_WG32_08_01
    SolutionIndex: 252
    SolutionNameMin: Cijk_Ailk_Bljk_SB_MT064x064x16_DTL0_EPS0_GRVW04_LPB04_PGR0_SNLL0_TT04_04_USFGRO0_VW04_WG16_16_01
    SolutionIndex: 253
    SolutionNameMin: Cijk_Ailk_Bljk_SB_MT128x064x16_DTL0_EPS0_GRVW04_LPB04_PGR0_SNLL0_TT04_08_USFGRO0_VW04_WG32_08_01
    SolutionIndex: 127
    SolutionNameMin: Cijk_Ailk_Bljk_SB_MT128x064x16_DTL0_GRVW04_GSU01_LPB00_PGR1_PLR1_TT08_04_USFGRO0_VW04_WG16_16_01_WGM01
    SolutionIndex: 128
    SolutionNameMin: Cijk_Ailk_Bljk_SB_MT128x064x16_DTL0_GRVW04_GSU01_LPB00_PGR1_PLR1_TT04_08_USFGRO0_VW04_WG32_08_01_WGM01
    SolutionIndex: 129
    SolutionNameMin: Cijk_Ailk_Bljk_SB_MT064x064x32_DTL0_GRVW04_GSU01_LPB00_PGR0_PLR1_TT04_04_USFGRO0_VW04_WG16_16_01_WGM64
    SolutionIndex: 130
    SolutionNameMin: Cijk_Ailk_Bljk_SB_MT128x032x16_DTL0_GRVW01_GSU05_LPB02_PGR0_PLR1_TT04_04_USFGRO01_VW02_WG32_08_01_WGM08
    SolutionIndex: 131
    SolutionNameMin: Cijk_Ailk_Bljk_SB_MT064x128x16_DTL0_GRVW01_GSU01_LPB04_PGR0_PLR1_TT04_08_USFGRO01_VW04_WG16_16_01_WGM01
    SolutionIndex: 132
    SolutionNameMin: Cijk_Ailk_Bljk_SB_MT064x064x16_DTL0_GRVW01_GSU01_LPB04_PGR0_PLR1_TT04_04_USFGRO01_VW04_WG16_16_01_WGM64
    SolutionIndex: 133
    SolutionNameMin: Cijk_Ailk_Bljk_SB_MT256x032x16_DTL1_GRVW01_GSU01_LPB04_PGR0_PLR1_TT08_04_USFGRO01_VW04_WG32_08_01_WGM64
    SolutionIndex: 134
    SolutionNameMin: Cijk_Ailk_Bljk_SB_MT064x128x16_DTL0_GRVW04_GSU01_LPB04_PGR0_PLR1_TT04_08_USFGRO0_VW04_WG16_16_01_WGM01
    SolutionIndex: 135
    SolutionNameMin: Cijk_Ailk_Bljk_SB_MT128x032x16_DTL0_GRVW04_GSU01_LPB04_PGR0_PLR0_TT04_04_USFGRO0_VW04_WG32_08_01_WGM01
    SolutionIndex: 136
    SolutionNameMin: Cijk_Ailk_Bljk_SB_MT064x064x16_DTL0_GRVW04_GSU01_LPB04_PGR0_PLR1_TT04_04_USFGRO0_VW04_WG16_16_01_WGM08
    SolutionIndex: 137
    SolutionNameMin: Cijk_Ailk_Bljk_SB_MT128x064x16_DTL0_GRVW04_GSU01_LPB04_PGR0_PLR1_TT04_08_USFGRO0_VW04_WG32_08_01_WGM08
    SolutionIndex: 138
    SolutionNameMin: Cijk_Ailk_Bljk_SB_MT128x064x16_DTL0_GRVW04_GSU01_LPB04_PGR1_PLR1_TT04_08_USFGRO0_VW04_WG32_08_01_WGM08
    SolutionIndex: 139
    SolutionNameMin: Cijk_Ailk_Bljk_SB_MT064x064x32_DTL0_GRVW04_GSU01_LPB04_PGR0_PLR1_TT04_04_USFGRO0_VW04_WG16_16_01_WGM01
- - - [704, 1024, 1, 128]
    - [84, 3348.56]
  - - [1024, 1024, 1, 3328]
    - [98, 9865.73]
  - - [4, 704, 1, 1280]
    - [61, 386.187]
  - - [4, 1856, 1, 3328]
    - [113, 527.748]
  - - [1856, 448, 1, 3328]
    - [98, 7859.43]
  - - [2944, 4288, 1, 1280]
    - [97, 9683.64]
  - - [2368, 64, 1, 3328]
    - [45, 6304.37]
  - - [1760, 32, 1, 1760]
    - [73, 3947.24]
  - - [2368, 5888, 1, 256]
    - [95, 9990.6]
  - - [5888, 1856, 1, 256]
    - [103, 10190.6]
  - - [64, 3584, 1, 1280]
    - [73, 4540.06]
  - - [512, 24000, 1, 1536]
    - [103, 9642.94]
  - - [128, 6784, 1, 3328]
    - [94, 7808.66]
  - - [5888, 1408, 1, 256]
    - [103, 9993.19]
  - - [5888, 1856, 1, 3328]
    - [105, 9143.57]
  - - [512, 4, 1, 512]
    - [54, 244.054]
  - - [35, 1500, 1, 2560]
    - [9, 3013.82]
  - - [1856, 4288, 1, 256]
    - [103, 9596.56]
  - - [1024, 5056, 1, 128]
    - [85, 4477.55]
  - - [5056, 5056, 1, 3328]
    - [92, 9201.42]
  - - [1408, 5888, 1, 1280]
    - [92, 10371.5]
  - - [2368, 448, 1, 128]
    - [85, 3357.37]
  - - [6144, 6000, 1, 2560]
    - [105, 9089.87]
  - - [2368, 6784, 1, 128]
    - [85, 5732.87]
  - - [1024, 3584, 1, 3328]
    - [98, 9916.46]
  - - [512, 48000, 1, 2048]
    - [103, 8624.93]
  - - [1408, 64, 1, 128]
    - [20, 991.774]
  - - [256, 4288, 1, 3328]
    - [94, 8185.41]
  - - [5888, 1408, 1, 1280]
    - [92, 10292.6]
  - - [704, 1856, 1, 3328]
    - [94, 9712.44]
  - - [1408, 4288, 1, 256]
    - [97, 9597.47]
  - - [1024, 2368, 1, 256]
    - [98, 8120.1]
  - - [64, 4, 1, 256]
    - [112, 17.6933]
  - - [1408, 1856, 1, 1280]
    - [104, 10151.8]
  - - [1408, 64, 1, 1280]
    - [66, 4526.38]
  - - [448, 1024, 1, 1280]
    - [94, 7401.46]
  - - [4096, 32, 1, 4096]
    - [72, 4964.04]
  - - [256, 1408, 1, 3328]
    - [94, 6152.61]
  - - [5056, 5056, 1, 1280]
    - [99, 9479.93]
  - - [448, 5056, 1, 256]
    - [101, 8372.08]
  - - [704, 1856, 1, 1280]
    - [101, 8836.68]
  - - [128, 5056, 1, 128]
    - [14, 2761.16]
  - - [2368, 128, 1, 256]
    - [94, 3982.79]
  - - [1856, 1408, 1, 128]
    - [84, 4689.05]
  - - [64, 5056, 1, 256]
    - [49, 2625.05]
  - - [6784, 256, 1, 3328]
    - [94, 8902.82]
  - - [1408, 3584, 1, 256]
    - [97, 9462.48]
  - - [4288, 448, 1, 256]
    - [94, 8086.33]
  - - [64, 704, 1, 128]
    - [20, 522.507]
  - - [1024, 1856, 1, 128]
    - [85, 3410.19]
  - - [4288, 2944, 1, 1280]
    - [98, 9602.23]
  - - [704, 5056, 1, 1280]
    - [102, 9716.4]
  - - [2368, 704, 1, 3328]
    - [94, 8380.42]
  - - [256, 5888, 1, 256]
    - [93, 7305.97]
  - - [1856, 4288, 1, 3328]
    - [105, 9292.54]
  - - [256, 2944, 1, 256]
    - [94, 6627.44]
  - - [5888, 1024, 1, 256]
    - [101, 9637.68]
  - - [448, 64, 1, 1280]
    - [58, 2783.37]
  - - [3072, 64, 1, 1024]
    - [48, 3672.7]
  - - [3584, 4, 1, 1280]
    - [28, 651.891]
  - - [2560, 16, 1, 2560]
    - [65, 2701.4]
  - - [2944, 64, 1, 256]
    - [94, 3160.85]
  - - [128, 4, 1, 1280]
    - [61, 134.048]
  - - [1408, 2944, 1, 256]
    - [97, 9424.44]
  - - [256, 1856, 1, 1280]
    - [94, 7477.31]
  - - [6784, 5056, 1, 3328]
    - [92, 8925.5]
  - - [5056, 5056, 1, 256]
    - [103, 9689.97]
  - - [128, 256, 1, 256]
    - [37, 1433.46]
  - - [64, 1024, 1, 1280]
    - [66, 3700.8]
  - - [2944, 4, 1, 256]
    - [28, 423.943]
  - - [704, 5056, 1, 128]
    - [85, 4944.1]
  - - [4, 2368, 1, 1280]
    - [61, 479.965]
  - - [2368, 2944, 1, 1280]
    - [99, 9780.12]
  - - [448, 448, 1, 3328]
    - [45, 6332.11]
  - - [6784, 6784, 1, 1280]
    - [105, 9460.81]
  - - [1024, 256, 1, 3328]
    - [101, 6915.56]
  - - [1408, 4288, 1, 1280]
    - [104, 9958.44]
  - - [3584, 4288, 1, 1280]
    - [91, 9900.24]
  - - [512, 6000, 1, 2560]
    - [98, 9616.38]
  - - [2368, 704, 1, 1280]
    - [101, 8739.71]
  - - [5056, 4288, 1, 3328]
    - [92, 8982.98]
  - - [3584, 2368, 1, 3328]
    - [97, 8884.11]
  - - [5888, 6784, 1, 1280]
    - [92, 9385.19]
  - - [64, 704, 1, 1280]
    - [38, 3139.28]
  - - [4288, 256, 1, 256]
    - [101, 6922.74]
  - - [2944, 128, 1, 128]
    - [15, 2376.43]
  - - [6144, 32, 1, 2560]
    - [26, 4718.44]
  - - [6784, 448, 1, 1280]
    - [104, 9840.06]
  - - [2944, 5888, 1, 256]
    - [105, 10242.0]
  - - [64, 64, 1, 1280]
    - [75, 1040.77]
  - - [4288, 2944, 1, 256]
    - [103, 10017.6]
  - - [5888, 704, 1, 1280]
    - [103, 9978.56]
  - - [5056, 4, 1, 3328]
    - [24, 692.002]
  - - [1856, 64, 1, 1280]
    - [45, 4933.91]
  - - [1760, 16, 1, 1760]
    - [65, 2355.81]
  - - [448, 5888, 1, 128]
    - [85, 4526.33]
  - - [5888, 64, 1, 3328]
    - [74, 6981.34]
  - - [2944, 256, 1, 3328]
    - [94, 9036.44]
  - - [1024, 64, 1, 128]
    - [14, 780.989]
  - - [5056, 2368, 1, 1280]
    - [91, 9697.21]
  - - [448, 3584, 1, 1280]
    - [94, 8526.25]
  - - [6784, 5888, 1, 256]
    - [99, 10150.2]
  - - [64, 1024, 1, 3328]
    - [66, 5032.97]
  - - [704, 128, 1, 1280]
    - [73, 4423.52]
  - - [4, 3584, 1, 128]
    - [107, 167.382]
  - - [1408, 448, 1, 1280]
    - [101, 7310.23]
  - - [1024, 1408, 1, 256]
    - [101, 7503.99]
  - - [2368, 2368, 1, 3328]
    - [97, 9273.1]
  - - [1856, 6784, 1, 128]
    - [85, 5627.7]
  - - [5056, 704, 1, 3328]
    - [104, 9628.67]
  - - [1408, 1856, 1, 256]
    - [101, 8292.99]
  - - [1408, 704, 1, 3328]
    - [98, 9379.23]
  - - [2368, 5056, 1, 256]
    - [97, 9898.57]
  - - [1408, 256, 1, 1280]
    - [101, 5870.26]
  - - [3072, 128, 1, 1024]
    - [101, 5376.49]
  - - [3584, 2368, 1, 1280]
    - [97, 9632.14]
  - - [4288, 64, 1, 3328]
    - [45, 6312.99]
  - - [2368, 4, 1, 1280]
    - [37, 551.073]
  - - [704, 5888, 1, 256]
    - [101, 9308.13]
  - - [6784, 2944, 1, 128]
    - [88, 5499.7]
  - - [6784, 64, 1, 256]
    - [101, 5103.61]
  - - [2944, 256, 1, 256]
    - [101, 7135.81]
  - - [2944, 6784, 1, 3328]
    - [99, 8974.04]
  - - [128, 1, 1, 1408]
    - [83, 41.2365]
  - - [704, 1408, 1, 3328]
    - [101, 9149.91]
  - - [3584, 704, 1, 3328]
    - [98, 9577.22]
  - - [2944, 256, 1, 128]
    - [85, 3280.37]
  - - [6784, 4, 1, 1280]
    - [110, 651.244]
  - - [1024, 64, 1, 1280]
    - [34, 3441.97]
  - - [8448, 4, 1, 2816]
    - [25, 777.599]
  - - [448, 4288, 1, 256]
    - [94, 7960.22]
  - - [64, 3584, 1, 3328]
    - [36, 6207.85]
  - - [704, 2368, 1, 1280]
    - [101, 8885.28]
  - - [1856, 2368, 1, 1280]
    - [94, 9962.39]
  - - [2368, 128, 1, 3328]
    - [81, 6429.35]
  - - [64, 193600, 1, 64]
    - [114, 5384.79]
  - - [1760, 128, 1, 1760]
    - [46, 6311.87]
  - - [448, 1408, 1, 256]
    - [94, 6106.17]
  - - [1856, 4288, 1, 1280]
    - [91, 9943.52]
  - - [64, 5056, 1, 3328]
    - [74, 6613.96]
  - - [512, 1500, 1, 2816]
    - [94, 9152.12]
  - - [1024, 448, 1, 128]
    - [85, 2165.84]
  - - [704, 4, 1, 1280]
    - [61, 415.886]
  - - [704, 256, 1, 128]
    - [85, 1359.9]
  - - [256, 193600, 1, 64]
    - [115, 8470.8]
  - - [704, 2944, 1, 128]
    - [85, 4544.81]
  - - [1408, 1024, 1, 1280]
    - [98, 9065.98]
  - - [704, 6784, 1, 256]
    - [101, 9189.95]
  - - [6784, 704, 1, 256]
    - [101, 9174.6]
  - - [5056, 1408, 1, 128]
    - [85, 5392.8]
  - - [2048, 7000, 1, 2048]
    - [97, 9153.13]
  - - [256, 3584, 1, 3328]
    - [101, 8434.67]
  - - [5056, 704, 1, 256]
    - [103, 9084.92]
  - - [128, 1408, 1, 128]
    - [15, 1656.46]
  - - [3584, 4288, 1, 3328]
    - [92, 9316.18]
  - - [5888, 1856, 1, 1280]
    - [97, 9797.26]
  - - [256, 1408, 1, 256]
    - [94, 4630.75]
  - - [5056, 64, 1, 1280]
    - [45, 5557.96]
  - - [1024, 704, 1, 256]
    - [101, 6323.22]
  - - [64, 256, 1, 128]
    - [20, 226.487]
  - - [2368, 3584, 1, 1280]
    - [103, 9758.39]
  - - [1024, 256, 1, 256]
    - [101, 4044.41]
  - - [1856, 4, 1, 1280]
    - [28, 489.629]
  - - [448, 448, 1, 256]
    - [94, 3416.69]
  - - [2944, 3584, 1, 3328]
    - [92, 8957.89]
  - - [7680, 32, 1, 2560]
    - [46, 5504.31]
  - - [128, 4288, 1, 128]
    - [14, 2649.22]
  - - [256, 256, 1, 3328]
    - [66, 5257.73]
  - - [128, 1024, 1, 3328]
    - [67, 6521.17]
  - - [4, 1408, 1, 3328]
    - [54, 508.086]
  - - [196, 256, 64, 1024]
    - [120, 6101.04]
  - - [6784, 2944, 1, 256]
    - [99, 10204.2]
  - - [64, 1856, 1, 1280]
    - [66, 4404.51]
  - - [64, 1024, 1, 128]
    - [20, 760.01]
  - - [1024, 1500, 1, 2560]
    - [98, 9672.45]
  - - [1856, 2368, 1, 256]
    - [101, 9410.56]
  - - [3584, 256, 1, 128]
    - [88, 3164.45]
  - - [3584, 6784, 1, 3328]
    - [92, 9098.73]
  - - [256, 1024, 1, 256]
    - [94, 4155.73]
  - - [4, 6784, 1, 3328]
    - [113, 618.847]
  - - [1024, 5888, 1, 3328]
    - [92, 9651.39]
  - - [1024, 128, 1, 1280]
    - [42, 4148.05]
  - - [3072, 32, 1, 1024]
    - [44, 3088.4]
  - - [6144, 24000, 1, 2560]
    - [105, 8729.7]
  - - [448, 1024, 1, 256]
    - [94, 5807.42]
  - - [5056, 4288, 1, 1280]
    - [103, 9409.99]
  - - [5888, 64, 1, 256]
    - [94, 4569.39]
  - - [1856, 256, 1, 1280]
    - [94, 7665.8]
  - - [64, 5888, 1, 3328]
    - [74, 6646.93]
  - - [2368, 2368, 1, 1280]
    - [98, 10055.3]
  - - [2944, 5888, 1, 128]
    - [86, 5683.61]
  - - [704, 5888, 1, 1280]
    - [101, 9967.41]
  - - [2368, 3584, 1, 128]
    - [84, 5451.63]
  - - [1856, 5056, 1, 128]
    - [85, 5579.8]
  - - [4608, 1, 1, 1536]
    - [51, 186.619]
  - - [448, 256, 1, 3328]
    - [45, 6112.14]
  - - [2944, 6784, 1, 1280]
    - [91, 9461.73]
  - - [448, 1856, 1, 128]
    - [84, 3221.46]
  - - [128, 1024, 1, 128]
    - [20, 1340.14]
  - - [7680, 4, 1, 2560]
    - [31, 800.639]
  - - [1024, 704, 1, 1280]
    - [101, 8179.04]
  - - [128, 5888, 1, 256]
    - [101, 4744.22]
  - - [1024, 5056, 1, 1280]
    - [103, 10240.6]
  - - [4288, 1024, 1, 256]
    - [101, 9338.17]
  - - [2944, 2368, 1, 128]
    - [88, 5150.12]
  - - [704, 704, 1, 3328]
    - [94, 8498.57]
  - - [704, 1408, 1, 1280]
    - [101, 8815.17]
  - - [5888, 448, 1, 1280]
    - [101, 9125.16]
  - - [3584, 256, 1, 3328]
    - [96, 8465.87]
  - - [704, 5888, 1, 3328]
    - [94, 9379.83]
  - - [704, 1856, 1, 128]
    - [85, 4046.16]
  - - [128, 3584, 1, 3328]
    - [94, 7500.06]
  - - [4, 4288, 1, 128]
    - [107, 187.582]
  - - [128, 704, 1, 1280]
    - [32, 4411.0]
  - - [3584, 2944, 1, 256]
    - [101, 9716.0]
  - - [1856, 128, 1, 3328]
    - [62, 6903.68]
  - - [1856, 2368, 1, 3328]
    - [94, 9282.71]
  - - [512, 6000, 1, 2816]
    - [92, 10011.3]
  - - [2944, 448, 1, 128]
    - [85, 3663.96]
  - - [64, 193600, 1, 256]
    - [106, 6410.17]
  - - [128, 2944, 1, 1280]
    - [66, 5803.41]
  - - [448, 2944, 1, 1280]
    - [96, 8070.11]
  - - [512, 24000, 1, 2048]
    - [104, 8810.13]
  - - [128, 256, 1, 3328]
    - [78, 4089.24]
  - - [1408, 5056, 1, 3328]
    - [99, 9595.42]
  - - [1856, 1856, 1, 3328]
    - [104, 9290.43]
  - - [3584, 128, 1, 256]
    - [94, 5641.97]
  - - [448, 1408, 1, 3328]
    - [94, 7587.41]
  - - [2368, 2368, 1, 256]
    - [103, 9508.64]
  - - [4288, 4288, 1, 1280]
    - [103, 9368.03]
  - - [64, 448, 1, 1280]
    - [64, 2831.15]
  - - [5888, 1024, 1, 1280]
    - [92, 10225.1]
  - - [704, 1024, 1, 256]
    - [101, 6920.39]
  - - [1024, 12544, 1, 256]
    - [117, 9919.81]
  - - [448, 4, 1, 256]
    - [54, 126.395]
  - - [5888, 448, 1, 128]
    - [89, 4110.01]
  - - [512, 48000, 1, 2560]
    - [99, 9188.87]
  - - [8448, 16, 1, 2816]
    - [25, 2861.01]
  - - [704, 6784, 1, 3328]
    - [105, 9197.4]
  - - [5888, 5888, 1, 1280]
    - [99, 9345.77]
  - - [5056, 1024, 1, 1280]
    - [103, 10271.2]
  - - [448, 5888, 1, 3328]
    - [94, 8883.0]
  - - [3072, 2, 1, 1024]
    - [55, 320.494]
  - - [1024, 2944, 1, 1280]
    - [105, 9939.22]
  - - [5056, 5888, 1, 1280]
    - [99, 9479.15]
  - - [4288, 5888, 1, 128]
    - [85, 5829.32]
  - - [256, 3584, 1, 256]
    - [94, 6592.13]
  - - [256, 4, 1, 1280]
    - [61, 252.791]
  - - [1408, 3584, 1, 128]
    - [89, 4979.82]
  - - [256, 2944, 1, 3328]
    - [101, 8952.8]
  - - [448, 3584, 1, 128]
    - [85, 3902.16]
  - - [5888, 2944, 1, 1280]
    - [91, 9834.75]
  - - [4, 6784, 1, 1280]
    - [61, 551.641]
  - - [2368, 5888, 1, 128]
    - [84, 5580.79]
  - - [35, 8457, 1, 1760]
    - [7, 4398.11]
  - - [64, 2944, 1, 128]
    - [21, 1661.08]
  - - [2368, 4, 1, 256]
    - [111, 419.666]
  - - [3584, 5888, 1, 256]
    - [99, 9991.55]
  - - [2368, 1024, 1, 128]
    - [85, 4519.92]
  - - [2368, 704, 1, 128]
    - [84, 4115.12]
  - - [512, 32, 1, 512]
    - [63, 1451.82]
  - - [3584, 2368, 1, 128]
    - [85, 5158.25]
  - - [5056, 704, 1, 128]
    - [85, 4972.08]
  - - [448, 2368, 1, 128]
    - [85, 3296.97]
  - - [4, 5056, 1, 256]
    - [37, 356.591]
  - - [5056, 1408, 1, 3328]
    - [91, 9670.88]
  - - [1408, 704, 1, 256]
    - [101, 7512.22]
  - - [6784, 1024, 1, 3328]
    - [92, 9388.92]
  - - [6784, 2944, 1, 3328]
    - [92, 9065.35]
  - - [7680, 1, 1, 2560]
    - [43, 203.693]
  - - [1856, 1856, 1, 256]
    - [94, 8805.18]
  - - [64, 64, 1, 3328]
    - [83, 1786.56]
  - - [512, 1, 1, 512]
    - [5, 61.0134]
  - - [6784, 2368, 1, 1280]
    - [103, 9801.78]
  - - [4608, 2, 1, 1536]
    - [32, 368.204]
  - - [4288, 3584, 1, 256]
    - [103, 10247.1]
  - - [4288, 5888, 1, 1280]
    - [103, 9403.33]
  - - [4608, 4, 1, 1536]
    - [34, 718.412]
  - - [1024, 6000, 1, 1536]
    - [105, 10038.4]
  - - [8448, 32, 1, 2816]
    - [74, 4863.57]
  - - [448, 2944, 1, 3328]
    - [98, 8492.78]
  - - [4288, 1856, 1, 1280]
    - [92, 9810.19]
  - - [1856, 2944, 1, 3328]
    - [104, 9202.33]
  - - [256, 6784, 1, 3328]
    - [94, 9143.8]
  - - [512, 3000, 1, 1536]
    - [98, 9231.72]
  - - [64, 5888, 1, 256]
    - [49, 2646.9]
  - - [256, 5056, 1, 128]
    - [84, 3284.21]
  - - [5056, 1024, 1, 256]
    - [103, 9562.98]
  - - [704, 64, 1, 3328]
    - [78, 4664.11]
  - - [5056, 1856, 1, 3328]
    - [91, 8731.62]
  - - [4, 2944, 1, 3328]
    - [113, 564.628]
  - - [512, 1500, 1, 2048]
    - [104, 6829.51]
  - - [1024, 1, 1, 500000]
    - [1, 213.392]
  - - [256, 4, 1, 256]
    - [54, 78.6511]
  - - [6784, 128, 1, 3328]
    - [102, 8052.04]
  - - [4288, 1408, 1, 128]
    - [85, 5260.94]
  - - [1856, 5888, 1, 3328]
    - [105, 9138.61]
  - - [4288, 5056, 1, 256]
    - [103, 10439.5]
  - - [1408, 128, 1, 1280]
    - [35, 5121.99]
  - - [4096, 7000, 1, 4096]
    - [99, 8662.62]
  - - [5056, 256, 1, 3328]
    - [94, 9233.12]
  - - [704, 704, 1, 256]
    - [101, 6274.09]
  - - [1024, 3000, 1, 2560]
    - [105, 9872.12]
  - - [1024, 5888, 1, 1280]
    - [91, 9875.17]
  - - [6784, 2368, 1, 128]
    - [89, 5512.02]
  - - [4, 5056, 1, 1280]
    - [61, 531.091]
  - - [256, 64, 1, 1280]
    - [76, 2246.79]
  - - [128, 1856, 1, 1280]
    - [66, 5387.17]
  - - [1856, 1024, 1, 1280]
    - [99, 9214.46]
  - - [6784, 4288, 1, 1280]
    - [99, 9222.71]
  - - [1856, 1856, 1, 1280]
    - [104, 9537.43]
  - - [35, 1500, 1, 2048]
    - [11, 2333.56]
  - - [3072, 24000, 1, 1024]
    - [105, 8996.08]
  - - [1408, 5056, 1, 1280]
    - [92, 10026.9]
  - - [4, 2368, 1, 3328]
    - [61, 563.637]
  - - [5888, 1856, 1, 128]
    - [85, 4990.26]
  - - [448, 704, 1, 1280]
    - [94, 5093.26]
  - - [448, 6784, 1, 128]
    - [85, 4840.17]
  - - [1024, 448, 1, 3328]
    - [101, 7783.27]
  - - [2944, 128, 1, 256]
    - [94, 4859.29]
  - - [5056, 3584, 1, 128]
    - [86, 5646.8]
  - - [5888, 5888, 1, 3328]
    - [105, 9046.95]
  - - [6784, 1024, 1, 256]
    - [100, 9451.75]
  - - [2944, 2368, 1, 256]
    - [103, 9633.07]
  - - [256, 448, 1, 256]
    - [48, 2416.77]
  - - [5056, 5888, 1, 3328]
    - [105, 9111.22]
  - - [1856, 1024, 1, 256]
    - [94, 7961.31]
  - - [512, 48000, 1, 1536]
    - [103, 9370.58]
  - - [3584, 448, 1, 1280]
    - [101, 8502.75]
  - - [1024, 1024, 1, 1280]
    - [98, 9407.47]
  - - [448, 5888, 1, 256]
    - [100, 8053.03]
  - - [2048, 128, 1, 2048]
    - [41, 5420.72]
  - - [1408, 6784, 1, 3328]
    - [98, 9028.66]
  - - [448, 1024, 1, 128]
    - [84, 2696.25]
  - - [4288, 704, 1, 128]
    - [85, 4816.46]
  - - [128, 1856, 1, 128]
    - [21, 2012.22]
  - - [448, 2368, 1, 3328]
    - [94, 7898.73]
  - - [5056, 64, 1, 128]
    - [15, 2263.69]
  - - [5056, 2944, 1, 256]
    - [103, 10251.2]
  - - [6784, 5888, 1, 128]
    - [86, 5406.65]
  - - [1024, 700, 1, 512]
    - [101, 6722.32]
  - - [3072, 1, 1, 128]
    - [70, 82.9395]
  - - [1024, 4, 1, 256]
    - [111, 221.172]
  - - [2944, 704, 1, 128]
    - [85, 4405.01]
  - - [128, 6784, 1, 1280]
    - [94, 7179.24]
  - - [1408, 3584, 1, 3328]
    - [91, 9667.86]
  - - [2368, 6784, 1, 256]
    - [97, 10070.2]
  - - [5056, 1408, 1, 1280]
    - [98, 9901.79]
  - - [5056, 4288, 1, 128]
    - [85, 5781.17]
  - - [4, 704, 1, 256]
    - [37, 156.955]
  - - [4288, 2368, 1, 3328]
    - [103, 9034.06]
  - - [1408, 1856, 1, 128]
    - [84, 4506.54]
  - - [1408, 5888, 1, 3328]
    - [105, 9682.94]
  - - [1856, 256, 1, 256]
    - [94, 6014.83]
  - - [6784, 6784, 1, 256]
    - [105, 10039.7]
  - - [5888, 5056, 1, 128]
    - [90, 5394.9]
  - - [4288, 2368, 1, 128]
    - [85, 5619.95]
  - - [128, 5888, 1, 1280]
    - [101, 7678.57]
  - - [256, 4288, 1, 1280]
    - [94, 7886.95]
  - - [2368, 2944, 1, 256]
    - [101, 9617.71]
  - - [4, 1856, 1, 256]
    - [37, 324.768]
  - - [3584, 1856, 1, 1280]
    - [98, 9991.42]
  - - [6784, 6784, 1, 128]
    - [90, 5552.22]
  - - [256, 1856, 1, 128]
    - [84, 2325.8]
  - - [49, 512, 64, 2048]
    - [123, 3299.23]
  - - [704, 64, 1, 1280]
    - [57, 3177.77]
  - - [5888, 5056, 1, 256]
    - [103, 10042.1]
  - - [8448, 48000, 1, 2816]
    - [92, 8822.58]
  - - [512, 6000, 1, 2048]
    - [104, 7747.13]
  - - [3584, 448, 1, 256]
    - [94, 7253.44]
  - - [448, 4288, 1, 128]
    - [85, 4201.79]
  - - [7680, 64, 1, 2560]
    - [41, 6682.29]
  - - [256, 6784, 1, 256]
    - [101, 7492.98]
  - - [1408, 4288, 1, 128]
    - [88, 5071.68]
  - - [2944, 704, 1, 3328]
    - [98, 9514.02]
  - - [128, 448, 1, 256]
    - [37, 1852.14]
  - - [2048, 32, 1, 2048]
    - [60, 3682.7]
  - - [3584, 3584, 1, 256]
    - [103, 10105.0]
  - - [448, 1408, 1, 128]
    - [84, 2906.58]
  - - [128, 256, 1, 1280]
    - [38, 3180.88]
  - - [3584, 5056, 1, 256]
    - [99, 10026.1]
  - - [6784, 128, 1, 256]
    - [94, 6743.66]
  - - [4288, 4, 1, 256]
    - [24, 445.687]
  - - [64, 1408, 1, 3328]
    - [73, 5347.97]
  - - [704, 448, 1, 256]
    - [94, 4067.01]
  - - [2944, 2368, 1, 1280]
    - [91, 9897.45]
  - - [448, 64, 1, 3328]
    - [81, 3845.19]
  - - [704, 6784, 1, 128]
    - [86, 4759.24]
  - - [3584, 4, 1, 3328]
    - [37, 700.837]
  - - [6784, 3584, 1, 256]
    - [99, 10425.1]
  - - [704, 448, 1, 128]
    - [89, 1974.57]
  - - [256, 128, 1, 128]
    - [20, 401.561]
  - - [704, 1408, 1, 128]
    - [84, 3644.24]
  - - [4, 448, 1, 128]
    - [107, 22.4383]
  - - [4288, 128, 1, 1280]
    - [94, 6373.72]
  - - [128, 1408, 1, 256]
    - [94, 3023.42]
  - - [4, 2944, 1, 256]
    - [37, 399.002]
  - - [64, 128, 1, 3328]
    - [79, 2244.14]
  - - [1856, 1408, 1, 256]
    - [101, 9013.08]
  - - [5056, 2368, 1, 128]
    - [85, 5638.58]
  - - [2944, 2944, 1, 3328]
    - [98, 9214.24]
  - - [5056, 6784, 1, 256]
    - [103, 9752.91]
  - - [1856, 3584, 1, 128]
    - [85, 5224.61]
  - - [5888, 4, 1, 1280]
    - [109, 645.979]
  - - [128, 2944, 1, 128]
    - [15, 2350.67]
  - - [35, 8457, 1, 2560]
    - [9, 4036.8]
  - - [3584, 6784, 1, 128]
    - [85, 5558.74]
  - - [128, 4288, 1, 256]
    - [101, 3839.73]
  - - [704, 448, 1, 3328]
    - [94, 5395.83]
  - - [2368, 6784, 1, 1280]
    - [91, 9705.12]
  - - [128, 128, 1, 3328]
    - [76, 3228.39]
  - - [5056, 1856, 1, 256]
    - [101, 9762.16]
  - - [256, 128, 1, 256]
    - [63, 1470.65]
  - - [1024, 3000, 1, 2816]
    - [105, 10076.0]
  - - [1024, 1856, 1, 256]
    - [101, 7894.26]
  - - [64, 1, 1, 1216]
    - [61, 13.6438]
  - - [4288, 64, 1, 128]
    - [14, 1984.09]
  - - [256, 448, 1, 3328]
    - [35, 6076.09]
  - - [1408, 6784, 1, 1280]
    - [98, 9593.19]
  - - [3584, 3584, 1, 1280]
    - [104, 9678.44]
  - - [7680, 24000, 1, 2560]
    - [105, 8760.35]
  - - [64, 2368, 1, 1280]
    - [35, 4300.06]
  - - [448, 2368, 1, 1280]
    - [94, 7663.52]
  - - [4608, 48000, 1, 1536]
    - [105, 8834.21]
  - - [5888, 5888, 1, 128]
    - [86, 5453.86]
  - - [64, 6784, 1, 3328]
    - [67, 6558.84]
  - - [2944, 256, 1, 1280]
    - [101, 8722.61]
  - - [2048, 16, 1, 2048]
    - [82, 2242.42]
  - - [256, 2368, 1, 128]
    - [85, 2580.04]
  - - [5056, 2368, 1, 3328]
    - [92, 9152.29]
  - - [2944, 4288, 1, 256]
    - [103, 10054.6]
  - - [1408, 3584, 1, 1280]
    - [91, 10317.9]
  - - [2368, 64, 1, 256]
    - [39, 2605.68]
  - - [1024, 128, 1, 128]
    - [14, 1324.43]
  - - [704, 128, 1, 3328]
    - [73, 5493.09]
  - - [5888, 4, 1, 128]
    - [107, 235.244]
  - - [1856, 704, 1, 256]
    - [101, 8049.08]
  - - [1024, 1500, 1, 2816]
    - [98, 9783.95]
  - - [8448, 1, 1, 2816]
    - [27, 197.266]
  - - [1024, 4, 1, 3328]
    - [54, 530.315]
  - - [1024, 6000, 1, 2048]
    - [98, 9452.1]
  - - [512, 24000, 1, 2560]
    - [99, 9329.88]
  - - [6144, 3000, 1, 2560]
    - [99, 9231.08]
  - - [2368, 6784, 1, 3328]
    - [91, 9280.47]
  - - [1856, 1408, 1, 1280]
    - [96, 9981.31]
  - - [1856, 448, 1, 1280]
    - [98, 7494.84]
  - - [6784, 704, 1, 128]
    - [89, 4860.15]
  - - [4, 4, 1, 256]
    - [54, 0.813182]
  - - [128, 5888, 1, 128]
    - [14, 2855.89]
  - - [5056, 2944, 1, 128]
    - [89, 5729.6]
  - - [1408, 5888, 1, 256]
    - [103, 9961.88]
  - - [704, 2944, 1, 1280]
    - [94, 9721.2]
  - - [4288, 64, 1, 1280]
    - [45, 5475.76]
  - - [256, 64, 1, 256]
    - [47, 820.643]
  - - [1024, 1024, 1, 256]
    - [101, 7395.43]
  - - [704, 1856, 1, 256]
    - [101, 7894.26]
  - - [2560, 64, 1, 2560]
    - [73, 5142.69]
  - - [3584, 704, 1, 1280]
    - [98, 9877.31]
  - - [256, 128, 1, 1280]
    - [64, 3370.27]
  - - [5888, 2368, 1, 256]
    - [104, 9924.78]
  - - [256, 2368, 1, 1280]
    - [94, 6955.48]
  - - [2944, 6784, 1, 128]
    - [86, 5701.41]
  - - [3584, 448, 1, 3328]
    - [94, 8320.14]
  - - [1408, 4, 1, 256]
    - [37, 286.212]
  - - [704, 2368, 1, 3328]
    - [101, 8456.1]
  - - [2944, 448, 1, 256]
    - [94, 7066.66]
  - - [1856, 448, 1, 128]
    - [86, 3123.42]
  - - [4608, 6000, 1, 1536]
    - [105, 9249.77]
  - - [2368, 128, 1, 1280]
    - [73, 5736.53]
  - - [256, 5888, 1, 128]
    - [85, 3529.23]
  - - [64, 6784, 1, 256]
    - [48, 2738.07]
  - - [64, 5056, 1, 1280]
    - [66, 5055.48]
  - - [4, 6784, 1, 128]
    - [107, 223.284]
  - - [3025, 64, 64, 64]
    - [122, 5191.55]
  - - [2944, 2944, 1, 1280]
    - [97, 9848.97]
  - - [5056, 448, 1, 3328]
    - [101, 9295.1]
  - - [4, 3584, 1, 1280]
    - [61, 519.325]
  - - [1408, 128, 1, 128]
    - [21, 1605.22]
  - - [6784, 704, 1, 3328]
    - [91, 9318.86]
  - - [128, 64, 1, 1280]
    - [75, 1726.19]
  - - [2368, 256, 1, 1280]
    - [94, 7058.58]
  - - [4, 448, 1, 3328]
    - [61, 417.149]
  - - [5888, 4288, 1, 128]
    - [85, 5167.81]
  - - [4, 5888, 1, 256]
    - [54, 325.566]
  - - [1408, 2944, 1, 3328]
    - [92, 10163.6]
  - - [3584, 704, 1, 128]
    - [85, 4124.72]
  - - [64, 1024, 1, 256]
    - [38, 2004.33]
  - - [2368, 448, 1, 1280]
    - [101, 7679.57]
  - - [128, 3584, 1, 256]
    - [101, 4075.53]
  - - [704, 448, 1, 1280]
    - [94, 5155.93]
  - - [448, 5056, 1, 128]
    - [85, 4524.77]
  - - [6144, 4, 1, 2560]
    - [44, 783.504]
  - - [5056, 3584, 1, 256]
    - [103, 10397.3]
  - - [4288, 4288, 1, 256]
    - [97, 10081.4]
  - - [1408, 5056, 1, 128]
    - [88, 5144.69]
  - - [2944, 3584, 1, 128]
    - [85, 5468.51]
  - - [3584, 2368, 1, 256]
    - [94, 9541.26]
  - - [5888, 5056, 1, 1280]
    - [99, 9474.96]
  - - [128, 1024, 1, 1280]
    - [73, 4955.9]
  - - [8448, 24000, 1, 2816]
    - [92, 8839.13]
  - - [64, 704, 1, 256]
    - [38, 1621.93]
  - - [4288, 256, 1, 1280]
    - [101, 7929.84]
  - - [3584, 3584, 1, 3328]
    - [91, 9072.95]
  - - [704, 64, 1, 128]
    - [20, 508.838]
  - - [3072, 1500, 1, 128]
    - [103, 8208.64]
  - - [2048, 3136, 1, 512]
    - [117, 9928.68]
  - - [3025, 256, 64, 64]
    - [126, 8027.73]
  - - [5888, 6784, 1, 256]
    - [99, 9993.69]
  - - [4288, 2944, 1, 3328]
    - [92, 9012.65]
  - - [2944, 64, 1, 128]
    - [21, 1686.87]
  - - [1024, 128, 1, 3328]
    - [71, 6014.91]
  - - [1024, 16, 1, 500000]
    - [0, 3266.42]
  - - [4288, 128, 1, 3328]
    - [45, 7470.01]
  - - [7680, 128, 1, 2560]
    - [98, 9107.99]
  - - [256, 5056, 1, 1280]
    - [94, 9200.08]
  - - [1408, 256, 1, 128]
    - [85, 2090.07]
  - - [2944, 5888, 1, 3328]
    - [99, 9249.27]
  - - [6784, 5888, 1, 1280]
    - [105, 9274.09]
  - - [3072, 1, 1, 1024]
    - [56, 169.865]
  - - [704, 128, 1, 256]
    - [38, 2193.15]
  - - [5888, 4288, 1, 1280]
    - [99, 9295.15]
  - - [1024, 24000, 1, 2048]
    - [99, 8939.84]
  - - [448, 256, 1, 1280]
    - [35, 4763.78]
  - - [5888, 3584, 1, 128]
    - [86, 5317.01]
  - - [64, 4288, 1, 3328]
    - [78, 6058.6]
  - - [448, 4, 1, 1280]
    - [61, 360.06]
  - - [6784, 6784, 1, 3328]
    - [92, 9149.23]
  - - [5056, 4, 1, 1280]
    - [24, 643.572]
  - - [4, 5888, 1, 3328]
    - [61, 602.225]
  - - [256, 1408, 1, 1280]
    - [94, 5793.78]
  - - [3072, 16, 1, 1024]
    - [65, 2375.76]
  - - [704, 3584, 1, 128]
    - [85, 4667.92]
  - - [1024, 2, 1, 512]
    - [54, 183.832]
  - - [5888, 448, 1, 3328]
    - [94, 8878.37]
  - - [2368, 4288, 1, 1280]
    - [104, 9596.63]
  - - [4288, 2944, 1, 128]
    - [85, 5639.43]
  - - [256, 64, 1, 3328]
    - [80, 2932.53]
  - - [2944, 64, 1, 3328]
    - [74, 6602.87]
  - - [6784, 64, 1, 3328]
    - [94, 7450.74]
  - - [5056, 2944, 1, 3328]
    - [92, 9068.71]
  - - [448, 128, 1, 256]
    - [37, 1835.01]
  - - [2944, 3584, 1, 256]
    - [103, 9906.03]
  - - [1408, 1408, 1, 3328]
    - [105, 9578.96]
  - - [1856, 128, 1, 1280]
    - [94, 5839.35]
  - - [3584, 3584, 1, 128]
    - [85, 5317.57]
  - - [64, 3584, 1, 256]
    - [38, 2810.93]
  - - [1408, 4, 1, 3328]
    - [30, 623.218]
  - - [128, 2944, 1, 3328]
    - [67, 6958.39]
  - - [3584, 704, 1, 256]
    - [98, 8506.99]
  - - [2944, 448, 1, 3328]
    - [96, 8321.05]
  - - [1024, 2, 1, 500000]
    - [2, 425.718]
  - - [3584, 1408, 1, 3328]
    - [92, 9759.44]
  - - [704, 3584, 1, 1280]
    - [96, 9611.63]
  - - [1024, 1408, 1, 128]
    - [87, 3809.38]
  - - [1856, 6784, 1, 256]
    - [97, 10023.8]
  - - [4288, 448, 1, 3328]
    - [104, 9310.15]
  - - [6784, 4288, 1, 128]
    - [85, 5499.5]
  - - [6784, 704, 1, 1280]
    - [101, 9323.88]
  - - [6144, 1, 1, 2560]
    - [38, 198.624]
  - - [3584, 6784, 1, 256]
    - [105, 10083.5]
  - - [6144, 16, 1, 2560]
    - [44, 3052.36]
  - - [3584, 64, 1, 128]
    - [23, 1809.84]
  - - [5888, 1024, 1, 3328]
    - [92, 9678.32]
  - - [448, 64, 1, 128]
    - [22, 321.72]
  - - [704, 6784, 1, 1280]
    - [105, 9493.32]
  - - [4, 448, 1, 256]
    - [54, 123.853]
  - - [196, 1024, 64, 256]
    - [121, 7759.33]
  - - [5888, 128, 1, 256]
    - [94, 7135.81]
  - - [4096, 16, 1, 4096]
    - [68, 3029.9]
  - - [1856, 5056, 1, 3328]
    - [91, 8854.09]
  - - [4, 6784, 1, 256]
    - [54, 336.123]
  - - [1024, 3584, 1, 128]
    - [87, 4067.71]
  - - [64, 704, 1, 3328]
    - [81, 4419.68]
  - - [2368, 2944, 1, 128]
    - [89, 5288.06]
  - - [5056, 64, 1, 256]
    - [94, 4008.2]
  - - [512, 1500, 1, 1536]
    - [94, 8002.36]
  - - [512, 1, 1, 500000]
    - [3, 213.049]
  - - [5888, 2944, 1, 3328]
    - [92, 9332.52]
  - - [128, 3584, 1, 1280]
    - [94, 6377.26]
  - - [1024, 704, 1, 128]
    - [89, 2743.74]
  - - [1408, 2368, 1, 128]
    - [85, 4870.0]
  - - [5888, 2368, 1, 128]
    - [85, 5211.4]
  - - [128, 5056, 1, 3328]
    - [94, 7591.39]
  - - [3584, 6784, 1, 1280]
    - [91, 9387.34]
  - - [4288, 1856, 1, 256]
    - [103, 9461.24]
  - - [1856, 5888, 1, 256]
    - [101, 9847.83]
  - - [256, 256, 1, 256]
    - [48, 1903.26]
  - - [4288, 4288, 1, 3328]
    - [91, 8774.09]
  - - [1024, 1024, 1, 128]
    - [90, 3252.94]
  - - [4288, 1408, 1, 1280]
    - [92, 10071.9]
  - - [3584, 5056, 1, 128]
    - [86, 5459.72]
  - - [4, 1024, 1, 3328]
    - [54, 490.712]
  - - [4, 704, 1, 128]
    - [107, 35.2603]
  - - [4288, 2368, 1, 256]
    - [97, 9747.52]
  - - [2944, 5056, 1, 1280]
    - [98, 9630.88]
  - - [448, 6784, 1, 256]
    - [94, 8848.54]
  - - [64, 128, 1, 128]
    - [20, 129.863]
  - - [1856, 2368, 1, 128]
    - [85, 5117.47]
  - - [6784, 2368, 1, 3328]
    - [92, 9134.25]
  - - [1408, 6784, 1, 128]
    - [85, 5385.01]
  - - [256, 1024, 1, 1280]
    - [94, 6308.77]
  - - [704, 4, 1, 128]
    - [107, 32.4392]
  - - [1408, 4, 1, 128]
    - [107, 66.201]
  - - [4288, 128, 1, 256]
    - [94, 5283.59]
  - - [4288, 1856, 1, 3328]
    - [91, 9137.48]
  - - [3584, 448, 1, 128]
    - [89, 3631.46]
  - - [64, 4288, 1, 128]
    - [18, 2035.19]
  - - [64, 448, 1, 3328]
    - [81, 3649.1]
  - - [448, 4, 1, 3328]
    - [113, 460.044]
  - - [256, 4, 1, 3328]
    - [113, 374.019]
  - - [4, 1408, 1, 1280]
    - [54, 419.479]
  - - [3584, 64, 1, 1280]
    - [36, 5590.28]
  - - [1408, 448, 1, 128]
    - [85, 2961.86]
  - - [3584, 1024, 1, 1280]
    - [98, 10442.3]
  - - [1856, 5056, 1, 256]
    - [94, 9818.3]
  - - [4, 3584, 1, 256]
    - [37, 434.604]
  - - [6784, 4288, 1, 3328]
    - [92, 8956.38]
  - - [4, 2944, 1, 1280]
    - [61, 489.146]
  - - [1024, 4288, 1, 256]
    - [97, 8884.34]
  - - [5888, 3584, 1, 3328]
    - [92, 9227.93]
  - - [1856, 4, 1, 256]
    - [111, 382.943]
  - - [4, 256, 1, 256]
    - [54, 78.6393]
  - - [5056, 3584, 1, 3328]
    - [92, 9145.47]
  - - [1408, 128, 1, 3328]
    - [74, 6390.55]
  - - [4, 64, 1, 1280]
    - [61, 68.054]
  - - [2368, 1408, 1, 1280]
    - [94, 9710.45]
  - - [5056, 2944, 1, 1280]
    - [99, 9552.2]
  - - [8448, 6000, 1, 2816]
    - [92, 9077.7]
  - - [4, 4, 1, 128]
    - [108, 0.100535]
  - - [3584, 256, 1, 256]
    - [101, 6984.17]
  - - [3584, 2944, 1, 1280]
    - [97, 9660.91]
  - - [1024, 6784, 1, 256]
    - [98, 9262.13]
  - - [4, 128, 1, 256]
    - [54, 42.125]
  - - [6784, 448, 1, 256]
    - [100, 8630.49]
  - - [5124, 9124, 1, 2048]
    - [105, 8513.09]
  - - [2944, 5056, 1, 3328]
    - [92, 9060.84]
  - - [6784, 4, 1, 128]
    - [107, 259.065]
  - - [2944, 1408, 1, 128]
    - [85, 5054.75]
  - - [448, 128, 1, 3328]
    - [52, 4983.11]
  - - [64, 2944, 1, 3328]
    - [67, 6024.79]
  - - [5056, 6784, 1, 3328]
    - [105, 8890.33]
  - - [704, 2368, 1, 128]
    - [85, 4068.67]
  - - [3072, 1500, 1, 1024]
    - [98, 9596.11]
  - - [128, 2944, 1, 256]
    - [94, 4269.77]
  - - [128, 6784, 1, 128]
    - [16, 3025.12]
  - - [3584, 4288, 1, 256]
    - [103, 10170.6]
  - - [448, 1856, 1, 256]
    - [94, 6315.41]
  - - [1856, 6784, 1, 3328]
    - [92, 8910.79]
  - - [3584, 128, 1, 3328]
    - [94, 7851.49]
  - - [64, 1856, 1, 256]
    - [40, 2429.0]
  - - [64, 448, 1, 256]
    - [63, 1303.85]
  - - [5888, 4288, 1, 256]
    - [103, 10428.3]
  - - [128, 1500, 1, 1280]
    - [66, 5241.15]
  - - [5056, 1408, 1, 256]
    - [103, 9444.13]
  - - [35, 8457, 1, 4096]
    - [8, 4081.49]
  - - [64, 256, 1, 1280]
    - [63, 2379.07]
  - - [2944, 4, 1, 128]
    - [107, 137.486]
  - - [3584, 1024, 1, 256]
    - [98, 9210.75]
  - - [512, 6000, 1, 1536]
    - [97, 9570.14]
  - - [256, 704, 1, 256]
    - [94, 3098.65]
  - - [5888, 5888, 1, 256]
    - [105, 10241.1]
  - - [4288, 1024, 1, 1280]
    - [98, 9830.6]
  - - [5888, 128, 1, 3328]
    - [101, 9043.69]
  - - [448, 6784, 1, 3328]
    - [102, 9441.44]
  - - [2944, 1408, 1, 1280]
    - [91, 10465.5]
  - - [3072, 6000, 1, 1024]
    - [98, 9401.37]
  - - [1024, 32, 1, 512]
    - [47, 1797.53]
  - - [2944, 1856, 1, 3328]
    - [98, 9360.6]
  - - [2368, 64, 1, 128]
    - [14, 1431.0]
  - - [256, 1024, 1, 128]
    - [84, 1572.78]
  - - [3584, 5888, 1, 1280]
    - [99, 9435.43]
  - - [64, 4, 1, 128]
    - [107, 2.60208]
  - - [6784, 1856, 1, 1280]
    - [103, 9518.23]
  - - [2944, 5056, 1, 256]
    - [97, 9986.49]
  - - [5888, 256, 1, 3328]
    - [98, 9732.56]
  - - [2944, 4288, 1, 128]
    - [85, 5636.51]
  - - [3584, 1408, 1, 256]
    - [103, 9266.39]
  - - [704, 3584, 1, 3328]
    - [96, 9453.4]
  - - [5056, 448, 1, 1280]
    - [101, 9488.37]
  - - [3584, 1856, 1, 3328]
    - [98, 9247.95]
  - - [64, 1408, 1, 128]
    - [20, 985.462]
  - - [4288, 6784, 1, 1280]
    - [91, 9281.29]
  - - [1024, 3000, 1, 2048]
    - [104, 8794.85]
  - - [1408, 704, 1, 1280]
    - [98, 9005.22]
  - - [2944, 1024, 1, 256]
    - [101, 8859.1]
  - - [256, 64, 1, 128]
    - [22, 185.032]
  - - [2368, 4288, 1, 3328]
    - [98, 9084.61]
  - - [4, 1408, 1, 256]
    - [37, 278.043]
  - - [1024, 1408, 1, 1280]
    - [104, 8766.13]
  - - [64, 64, 1, 256]
    - [63, 321.698]
  - - [704, 256, 1, 3328]
    - [94, 4907.16]
  - - [6784, 5056, 1, 256]
    - [105, 9945.2]
  - - [1856, 1856, 1, 128]
    - [85, 4851.1]
  - - [4288, 5888, 1, 256]
    - [103, 10491.0]
  - - [4, 704, 1, 3328]
    - [61, 492.273]
  - - [35, 8457, 1, 2048]
    - [8, 3556.45]
  - - [448, 2944, 1, 256]
    - [94, 7044.84]
  - - [4, 4288, 1, 3328]
    - [61, 582.011]
  - - [2944, 6784, 1, 256]
    - [103, 10346.5]
  - - [2944, 2944, 1, 128]
    - [85, 5335.34]
  - - [4, 4, 1, 1280]
    - [61, 3.41333]
  - - [1856, 3584, 1, 1280]
    - [102, 9398.29]
  - - [64, 2944, 1, 256]
    - [94, 2831.08]
  - - [3584, 1408, 1, 1280]
    - [91, 10475.4]
  - - [448, 256, 1, 128]
    - [20, 1238.56]
  - - [4288, 448, 1, 128]
    - [85, 4250.2]
  - - [5056, 256, 1, 1280]
    - [101, 8801.83]
  - - [1856, 1408, 1, 3328]
    - [102, 9807.38]
  - - [128, 128, 1, 128]
    - [20, 235.913]
  - - [1024, 4288, 1, 3328]
    - [98, 9109.6]
  - - [448, 2368, 1, 256]
    - [94, 6558.51]
  - - [1024, 4, 1, 128]
    - [107, 49.1505]
  - - [64, 1408, 1, 1280]
    - [73, 4076.1]
  - - [64, 6784, 1, 1280]
    - [66, 5257.39]
  - - [5056, 448, 1, 256]
    - [101, 8490.18]
  - - [2944, 2368, 1, 3328]
    - [91, 9523.25]
  - - [704, 4288, 1, 3328]
    - [96, 9212.82]
  - - [1408, 128, 1, 256]
    - [101, 3008.83]
  - - [1024, 1856, 1, 1280]
    - [92, 9242.98]
  - - [6784, 1856, 1, 256]
    - [103, 10074.9]
  - - [512, 48000, 1, 2816]
    - [92, 9413.48]
  - - [512, 3000, 1, 2816]
    - [104, 9743.14]
  - - [128, 2368, 1, 3328]
    - [67, 6655.63]
  - - [1024, 5888, 1, 256]
    - [101, 9428.34]
  - - [64, 2944, 1, 1280]
    - [66, 4405.58]
  - - [6784, 1408, 1, 256]
    - [103, 9901.1]
  - - [5056, 64, 1, 3328]
    - [74, 7119.24]
  - - [128, 704, 1, 128]
    - [12, 1031.19]
  - - [1408, 2368, 1, 256]
    - [94, 9087.09]
  - - [1408, 1408, 1, 256]
    - [101, 8344.95]
  - - [4, 64, 1, 128]
    - [107, 2.81754]
  - - [64, 128, 1, 1280]
    - [75, 1705.56]
  - - [1024, 8, 1, 500000]
    - [2, 1673.29]
  - - [4, 2368, 1, 128]
    - [107, 117.75]
  - - [2368, 2368, 1, 128]
    - [85, 5315.03]
  - - [64, 5888, 1, 128]
    - [15, 2284.75]
  - - [5888, 4, 1, 3328]
    - [110, 677.407]
  - - [6784, 1408, 1, 128]
    - [85, 5233.06]
  - - [1408, 5056, 1, 256]
    - [97, 9832.9]
  - - [512, 50176, 1, 128]
    - [116, 10079.7]
  - - [5056, 128, 1, 3328]
    - [101, 7653.35]
  - - [128, 128, 1, 1280]
    - [63, 2359.13]
  - - [512, 2, 1, 512]
    - [75, 124.18]
  - - [448, 704, 1, 256]
    - [94, 4082.33]
  - - [4288, 3584, 1, 128]
    - [85, 5658.5]
  - - [2944, 128, 1, 3328]
    - [45, 7405.84]
  - - [128, 5056, 1, 1280]
    - [94, 7082.16]
  - - [3584, 5056, 1, 1280]
    - [92, 9453.7]
  - - [256, 448, 1, 1280]
    - [32, 4473.45]
  - - [704, 704, 1, 128]
    - [84, 2902.98]
  - - [5056, 4, 1, 128]
    - [107, 209.262]
  - - [704, 256, 1, 1280]
    - [94, 4506.74]
  - - [64, 2368, 1, 3328]
    - [35, 5900.08]
  - - [1856, 1024, 1, 128]
    - [85, 4204.89]
  - - [1856, 64, 1, 128]
    - [14, 1359.29]
  - - [4096, 64, 1, 4096]
    - [50, 7182.84]
  - - [1024, 24000, 1, 1536]
    - [99, 9375.93]
  - - [704, 4288, 1, 256]
    - [100, 8586.39]
  - - [5888, 2368, 1, 1280]
    - [91, 9809.61]
  - - [6784, 1856, 1, 3328]
    - [92, 9010.3]
  - - [64, 128, 1, 256]
    - [54, 544.432]
  - - [2368, 5888, 1, 1280]
    - [91, 9720.15]
  - - [5888, 256, 1, 1280]
    - [96, 9203.48]
  - - [4, 5888, 1, 1280]
    - [61, 543.348]
  - - [704, 128, 1, 128]
    - [20, 998.125]
  - - [1024, 4, 1, 1280]
    - [113, 436.888]
  - - [2368, 1856, 1, 3328]
    - [94, 9136.25]
  - - [2368, 128, 1, 128]
    - [15, 2137.77]
  - - [2944, 704, 1, 256]
    - [101, 8692.54]
  - - [5056, 128, 1, 128]
    - [17, 3097.71]
  - - [2368, 1024, 1, 3328]
    - [98, 9284.08]
  - - [35, 700, 1, 2048]
    - [11, 2046.37]
  - - [256, 704, 1, 3328]
    - [94, 4898.25]
  - - [704, 3584, 1, 256]
    - [101, 8693.62]
  - - [1024, 1024, 1, 1024]
    - [98, 7197.12]
  - - [704, 2944, 1, 3328]
    - [101, 9779.81]
  - - [6784, 1024, 1, 128]
    - [89, 5237.21]
  - - [256, 448, 1, 128]
    - [20, 1208.34]
  - - [448, 1024, 1, 3328]
    - [94, 7809.82]
  - - [2944, 1024, 1, 3328]
    - [92, 9907.69]
  - - [2944, 5056, 1, 128]
    - [85, 5705.45]
  - - [2368, 256, 1, 256]
    - [94, 5901.41]
  - - [1408, 6784, 1, 256]
    - [97, 9877.38]
  - - [6784, 1408, 1, 3328]
    - [92, 8957.45]
  - - [4288, 6784, 1, 128]
    - [86, 5723.69]
  - - [1408, 2944, 1, 128]
    - [89, 4791.02]
  - - [704, 64, 1, 256]
    - [38, 1789.8]
  - - [3072, 4, 1, 1024]
    - [63, 655.838]
  - - [256, 2368, 1, 3328]
    - [101, 7276.2]
  - - [6784, 2944, 1, 1280]
    - [92, 9352.5]
  - - [4288, 1856, 1, 128]
    - [89, 5218.93]
  - - [1856, 2944, 1, 128]
    - [85, 5313.22]
  - - [6784, 448, 1, 128]
    - [85, 4655.71]
  - - [64, 3584, 1, 128]
    - [14, 1869.54]
  - - [448, 5056, 1, 1280]
    - [94, 9488.35]
  - - [4288, 5056, 1, 1280]
    - [103, 9507.18]
  - - [2368, 1856, 1, 128]
    - [84, 4821.79]
  - - [128, 448, 1, 1280]
    - [66, 3781.96]
  - - [4288, 704, 1, 256]
    - [101, 8916.69]
  - - [256, 3584, 1, 128]
    - [86, 2925.08]
  - - [5888, 704, 1, 256]
    - [103, 9430.68]
  - - [3584, 1024, 1, 128]
    - [85, 4542.67]
  - - [256, 5888, 1, 3328]
    - [98, 9577.0]
  - - [1408, 4288, 1, 3328]
    - [91, 9716.43]
  - - [6784, 4288, 1, 256]
    - [103, 10126.0]
  - - [4288, 256, 1, 128]
    - [85, 3486.8]
  - - [448, 1856, 1, 3328]
    - [101, 7689.55]
  - - [5888, 256, 1, 256]
    - [101, 7977.34]
  - - [1024, 4, 1, 500000]
    - [2, 845.604]
  - - [6784, 1024, 1, 1280]
    - [91, 9992.29]
  - - [5888, 1024, 1, 128]
    - [85, 4866.09]
  - - [1024, 128, 1, 256]
    - [101, 2264.9]
  - - [512, 16, 1, 500000]
    - [6, 3212.15]
  - - [128, 64, 1, 3328]
    - [75, 2314.74]
  - - [448, 64, 1, 256]
    - [63, 1270.34]
  - - [2368, 256, 1, 128]
    - [84, 2854.21]
  - - [6784, 3584, 1, 1280]
    - [99, 9431.81]
  - - [1024, 6784, 1, 1280]
    - [91, 9827.01]
  - - [2944, 64, 1, 1280]
    - [73, 5259.63]
  - - [1408, 2944, 1, 1280]
    - [92, 10527.0]
  - - [256, 1856, 1, 256]
    - [94, 5927.91]
  - - [1408, 2368, 1, 3328]
    - [101, 9202.08]
  - - [2944, 4, 1, 3328]
    - [37, 653.966]
  - - [128, 1408, 1, 3328]
    - [67, 6214.01]
  - - [2944, 1856, 1, 128]
    - [89, 5117.4]
  - - [256, 2944, 1, 128]
    - [84, 2818.83]
  - - [256, 6784, 1, 128]
    - [85, 3718.6]
  - - [2368, 4, 1, 128]
    - [107, 112.877]
  - - [1408, 256, 1, 3328]
    - [101, 6178.43]
  - - [1856, 4, 1, 128]
    - [107, 87.8661]
  - - [1024, 16, 1, 512]
    - [54, 1286.79]
  - - [5056, 6784, 1, 128]
    - [89, 5693.39]
  - - [4288, 5056, 1, 128]
    - [85, 5859.85]
  - - [1856, 5888, 1, 128]
    - [89, 5595.01]
  - - [7680, 2, 1, 2560]
    - [32, 405.21]
  - - [3584, 1856, 1, 256]
    - [103, 9562.51]
  - - [4288, 3584, 1, 1280]
    - [92, 9873.74]
  - - [2368, 448, 1, 256]
    - [101, 6665.88]
  - - [4288, 256, 1, 3328]
    - [94, 7883.18]
  - - [1856, 704, 1, 128]
    - [85, 4031.77]
  - - [1408, 64, 1, 256]
    - [38, 2341.4]
  - - [64, 1856, 1, 128]
    - [20, 1266.98]
  - - [4, 256, 1, 128]
    - [107, 12.7298]
  - - [512, 16, 1, 512]
    - [59, 884.688]
  - - [704, 5888, 1, 128]
    - [86, 4912.61]
  - - [6784, 3584, 1, 128]
    - [90, 5688.96]
  - - [1024, 64, 1, 256]
    - [37, 1841.32]
  - - [64, 2368, 1, 256]
    - [38, 2631.84]
  - - [5124, 1500, 1, 2048]
    - [104, 8831.92]
  - - [4288, 5056, 1, 3328]
    - [92, 8953.74]
  - - [4, 1856, 1, 1280]
    - [61, 439.331]
  - - [4288, 128, 1, 128]
    - [17, 2679.12]
  - - [512, 2, 1, 500000]
    - [4, 425.286]
  - - [1408, 1408, 1, 128]
    - [85, 4208.32]
  - - [7680, 16, 1, 2560]
    - [69, 2986.36]
  - - [1856, 128, 1, 128]
    - [21, 2022.19]
  - - [5056, 2368, 1, 256]
    - [103, 9912.81]
  - - [4288, 704, 1, 3328]
    - [104, 9454.33]
  - - [448, 3584, 1, 256]
    - [94, 7580.44]
  - - [2368, 64, 1, 1280]
    - [45, 5124.73]
  - - [2368, 1024, 1, 1280]
    - [98, 9460.32]
  - - [2944, 1408, 1, 3328]
    - [105, 10101.3]
  - - [6144, 1500, 1, 2560]
    - [105, 9609.15]
  - - [4224, 1, 1, 128]
    - [38, 94.7882]
  - - [1024, 1408, 1, 3328]
    - [98, 9322.78]
  - - [2944, 5888, 1, 1280]
    - [91, 9803.84]
  - - [8448, 2, 1, 2816]
    - [25, 391.883]
  - - [1408, 4, 1, 1280]
    - [54, 491.509]
  - - [5888, 3584, 1, 256]
    - [105, 10225.5]
  - - [2368, 5056, 1, 128]
    - [84, 5553.81]
  - - [1408, 1856, 1, 3328]
    - [104, 9833.66]
  - - [4, 4, 1, 3328]
    - [113, 8.35853]
  - - [5888, 5056, 1, 3328]
    - [105, 9159.95]
  - - [7680, 6000, 1, 2560]
    - [105, 9000.6]
  - - [6784, 1408, 1, 1280]
    - [103, 9592.1]
  - - [4, 1024, 1, 1280]
    - [54, 397.625]
  - - [512, 3000, 1, 2560]
    - [98, 9507.87]
  - - [704, 2944, 1, 256]
    - [94, 7870.99]
  - - [4288, 64, 1, 256]
    - [94, 3578.85]
  - - [6784, 5888, 1, 3328]
    - [105, 8964.41]
  - - [2368, 4288, 1, 128]
    - [84, 5491.55]
  - - [64, 4288, 1, 1280]
    - [73, 4809.36]
  - - [6784, 64, 1, 1280]
    - [94, 6972.44]
  - - [3584, 128, 1, 128]
    - [17, 2714.7]
  - - [1024, 6784, 1, 128]
    - [86, 4403.41]
  - - [1024, 1500, 1, 1536]
    - [104, 9420.11]
  - - [1408, 64, 1, 3328]
    - [32, 5485.66]
  - - [6784, 4, 1, 256]
    - [109, 490.993]
  - - [1408, 1408, 1, 1280]
    - [91, 9781.79]
  - - [256, 2368, 1, 256]
    - [101, 5616.59]
  - - [3072, 3000, 1, 1024]
    - [98, 9671.14]
  - - [448, 4288, 1, 3328]
    - [101, 8965.81]
  - - [2368, 1408, 1, 256]
    - [94, 9072.79]
  - - [704, 2368, 1, 256]
    - [94, 7849.01]
  - - [1024, 24000, 1, 2560]
    - [105, 9196.53]
  - - [2944, 448, 1, 1280]
    - [98, 8275.26]
  - - [5888, 2368, 1, 3328]
    - [92, 9182.63]
  - - [1024, 256, 1, 128]
    - [88, 1490.02]
  - - [5124, 9124, 1, 1760]
    - [92, 8991.18]
  - - [448, 1408, 1, 1280]
    - [94, 7310.26]
  - - [448, 1856, 1, 1280]
    - [94, 7409.81]
  - - [4288, 448, 1, 1280]
    - [98, 9233.46]
  - - [5888, 704, 1, 3328]
    - [104, 9749.12]
  - - [4, 1856, 1, 128]
    - [107, 97.1847]
  - - [5056, 256, 1, 128]
    - [85, 4029.8]
  - - [1856, 256, 1, 128]
    - [85, 2870.64]
  - - [128, 2368, 1, 256]
    - [94, 3894.04]
  - - [704, 4, 1, 256]
    - [54, 162.2]
  - - [1024, 6784, 1, 3328]
    - [92, 9423.48]
  - - [1408, 5888, 1, 128]
    - [86, 5260.8]
  - - [4288, 4, 1, 128]
    - [107, 187.582]
  - - [512, 3136, 1, 2048]
    - [105, 7618.18]
  - - [1408, 1024, 1, 256]
    - [94, 7653.84]
  - - [128, 64, 1, 256]
    - [63, 615.452]
  - - [8448, 1500, 1, 2816]
    - [103, 9047.14]
  - - [256, 704, 1, 128]
    - [84, 1250.67]
  - - [2560, 7000, 1, 2560]
    - [99, 9076.72]
  - - [5888, 64, 1, 1280]
    - [101, 6079.81]
  - - [128, 4, 1, 3328]
    - [113, 239.62]
  - - [5056, 6784, 1, 1280]
    - [105, 9153.14]
  - - [1024, 448, 1, 1280]
    - [101, 7252.5]
  - - [704, 5056, 1, 3328]
    - [102, 9398.87]
  - - [128, 5056, 1, 256]
    - [94, 4536.62]
  - - [3584, 5056, 1, 3328]
    - [92, 9262.73]
  - - [1856, 4, 1, 3328]
    - [28, 613.117]
  - - [4, 2944, 1, 128]
    - [107, 139.374]
  - - [2368, 2944, 1, 3328]
    - [105, 9424.1]
  - - [448, 448, 1, 1280]
    - [66, 5085.14]
  - - [128, 4, 1, 128]
    - [107, 5.97765]
  - - [2368, 3584, 1, 256]
    - [103, 9667.05]
  - - [4608, 3000, 1, 1536]
    - [104, 9461.19]
  - - [1024, 256, 1, 1280]
    - [101, 6326.37]
  - - [5056, 3584, 1, 1280]
    - [103, 9697.9]
  - - [5124, 9124, 1, 4096]
    - [99, 8268.33]
  - - [7680, 48000, 1, 2560]
    - [105, 8717.01]
  - - [1856, 704, 1, 1280]
    - [101, 8867.91]
  - - [1856, 2944, 1, 1280]
    - [103, 9723.58]
  - - [4608, 1500, 1, 1536]
    - [103, 9545.31]
  - - [1024, 48000, 1, 2816]
    - [99, 9210.6]
  - - [5124, 9124, 1, 2560]
    - [105, 8729.72]
  - - [128, 1024, 1, 256]
    - [40, 2618.27]
  - - [2944, 1408, 1, 256]
    - [103, 9387.38]
  - - [4288, 1408, 1, 3328]
    - [92, 9640.83]
  - - [3584, 64, 1, 3328]
    - [41, 6396.68]
  - - [5888, 2944, 1, 128]
    - [86, 5367.86]
  - - [2944, 1024, 1, 128]
    - [89, 4601.73]
  - - [128, 1, 1, 1024]
    - [61, 23.5932]
  - - [5124, 700, 1, 2048]
    - [105, 8493.05]
  - - [4, 4288, 1, 1280]
    - [61, 532.096]
  - - [6784, 5056, 1, 128]
    - [89, 5611.99]
  - - [256, 1024, 1, 3328]
    - [94, 6964.64]
  - - [3584, 4, 1, 256]
    - [28, 458.723]
  - - [1856, 64, 1, 3328]
    - [45, 6322.94]
  - - [4, 128, 1, 3328]
    - [113, 242.122]
  - - [256, 12544, 1, 1024]
    - [119, 7984.02]
  - - [5888, 1408, 1, 3328]
    - [105, 9674.42]
  - - [448, 2944, 1, 128]
    - [84, 3606.01]
  - - [2368, 1856, 1, 256]
    - [101, 9404.74]
  - - [256, 5056, 1, 256]
    - [100, 7134.09]
  - - [5056, 5056, 1, 128]
    - [89, 5798.32]
  - - [448, 3584, 1, 3328]
    - [101, 8709.9]
  - - [4, 5056, 1, 3328]
    - [113, 597.761]
  - - [256, 256, 1, 128]
    - [20, 744.992]
  - - [5888, 256, 1, 128]
    - [87, 3893.21]
  - - [4, 5056, 1, 128]
    - [107, 203.177]
  - - [448, 256, 1, 256]
    - [38, 2431.68]
  - - [704, 4, 1, 3328]
    - [61, 510.133]
  - - [1408, 256, 1, 256]
    - [94, 4648.01]
  - - [3584, 1856, 1, 128]
    - [85, 4815.3]
  - - [4288, 4288, 1, 128]
    - [85, 5727.71]
  - - [1856, 1024, 1, 3328]
    - [91, 9524.24]
  - - [1856, 4288, 1, 128]
    - [85, 5444.13]
  - - [1024, 6000, 1, 2560]
    - [105, 9961.04]
  - - [1024, 5056, 1, 256]
    - [103, 9441.85]
  - - [5056, 5888, 1, 128]
    - [85, 5818.39]
  - - [2368, 1408, 1, 3328]
    - [94, 8993.79]
  - - [1024, 48000, 1, 1536]
    - [105, 9292.41]
  - - [5888, 448, 1, 256]
    - [94, 8139.32]
  - - [5888, 6784, 1, 128]
    - [86, 5247.17]
  - - [2368, 4, 1, 3328]
    - [28, 658.736]
  - - [6784, 5056, 1, 1280]
    - [92, 9106.03]
  - - [5056, 704, 1, 1280]
    - [98, 10048.2]
  - - [1024, 48000, 1, 2560]
    - [99, 9241.87]
  - - [4608, 32, 1, 1536]
    - [46, 3817.15]
  - - [1024, 2368, 1, 128]
    - [90, 3731.05]
  - - [128, 704, 1, 256]
    - [48, 2240.33]
  - - [2368, 448, 1, 3328]
    - [101, 7894.81]
  - - [128, 5888, 1, 3328]
    - [101, 8507.4]
  - - [448, 128, 1, 1280]
    - [66, 3855.57]
  - - [6784, 4, 1, 3328]
    - [110, 649.508]
  - - [4288, 4, 1, 1280]
    - [24, 599.958]
  - - [1024, 64, 1, 3328]
    - [66, 4688.39]
  - - [3072, 48000, 1, 1024]
    - [105, 8842.75]
  - - [256, 4, 1, 128]
    - [107, 11.641]
  - - [1024, 5888, 1, 128]
    - [87, 4353.66]
  - - [3584, 5888, 1, 128]
    - [85, 5583.23]
  - - [5056, 5888, 1, 256]
    - [99, 9915.29]
  - - [2368, 1024, 1, 256]
    - [98, 8223.69]
  - - [2944, 1856, 1, 256]
    - [101, 9551.42]
  - - [1856, 6784, 1, 1280]
    - [97, 9593.76]
  - - [64, 5056, 1, 128]
    - [19, 2272.95]
  - - [64, 6784, 1, 128]
    - [19, 2517.59]
  - - [448, 704, 1, 128]
    - [84, 1932.56]
  - - [4, 1024, 1, 128]
    - [107, 52.0437]
  - - [1408, 448, 1, 256]
    - [94, 6123.42]
  - - [1408, 704, 1, 128]
    - [84, 3590.76]
  - - [64, 256, 1, 3328]
    - [77, 2956.06]
  - - [8448, 3000, 1, 2816]
    - [92, 9314.08]
  - - [6784, 448, 1, 3328]
    - [104, 9492.0]
  - - [5056, 1856, 1, 1280]
    - [103, 9220.37]
  - - [1408, 1024, 1, 3328]
    - [96, 9124.48]
  - - [2368, 256, 1, 3328]
    - [94, 7083.18]
  - - [7680, 1500, 1, 2560]
    - [99, 8877.27]
  - - [5888, 3584, 1, 1280]
    - [99, 9492.66]
  - - [1856, 3584, 1, 3328]
    - [95, 8931.2]
  - - [5888, 128, 1, 1280]
    - [94, 8664.63]
  - - [1024, 2944, 1, 256]
    - [98, 8456.44]
  - - [448, 6784, 1, 1280]
    - [96, 9716.21]
  - - [256, 3584, 1, 1280]
    - [94, 8117.74]
  - - [448, 128, 1, 128]
    - [20, 669.497]
  - - [704, 5056, 1, 256]
    - [94, 9038.19]
  - - [3584, 1024, 1, 3328]
    - [104, 9832.51]
  - - [2944, 1856, 1, 1280]
    - [98, 9894.78]
  - - [128, 256, 1, 128]
    - [20, 410.281]
  - - [5056, 256, 1, 256]
    - [101, 8016.31]
  - - [2944, 4288, 1, 3328]
    - [91, 9019.81]
  - - [2368, 3584, 1, 3328]
    - [97, 8951.68]
  - - [2944, 704, 1, 1280]
    - [98, 9986.89]
  - - [128, 4, 1, 256]
    - [54, 40.2123]
  - - [2944, 3584, 1, 1280]
    - [97, 9726.88]
  - - [1856, 5888, 1, 1280]
    - [99, 9810.98]
  - - [256, 256, 1, 1280]
    - [32, 4088.21]
  - - [4608, 24000, 1, 1536]
    - [105, 9003.11]
  - - [4288, 1408, 1, 256]
    - [103, 9492.7]
  - - [3584, 64, 1, 256]
    - [94, 3721.54]
  - - [64, 1856, 1, 3328]
    - [35, 5806.9]
  - - [256, 1408, 1, 128]
    - [84, 1859.18]
  - - [5888, 1408, 1, 128]
    - [85, 5042.3]
  - - [4288, 2368, 1, 1280]
    - [104, 9673.36]
  - - [4, 4288, 1, 256]
    - [37, 403.243]
  - - [256, 4288, 1, 128]
    - [85, 3333.59]
  - - [256, 128, 1, 3328]
    - [81, 4011.33]
  - - [512, 8, 1, 500000]
    - [3, 1675.17]
  - - [6784, 2368, 1, 256]
    - [103, 10263.9]
  - - [5888, 128, 1, 128]
    - [17, 3305.32]
  - - [1408, 448, 1, 3328]
    - [101, 7583.34]
  - - [1024, 24000, 1, 2816]
    - [92, 9356.63]
  - - [704, 1024, 1, 1280]
    - [101, 8382.7]
  - - [1856, 256, 1, 3328]
    - [94, 8119.52]
  - - [1856, 2944, 1, 256]
    - [101, 9556.25]
  - - [5056, 1024, 1, 128]
    - [85, 5228.61]
  - - [64, 5888, 1, 1280]
    - [66, 5259.66]
  - - [7680, 3000, 1, 2560]
    - [105, 9054.85]
  - - [4224, 1500, 1, 176]
    - [103, 9140.2]
  - - [5124, 700, 1, 2560]
    - [100, 8804.32]
  - - [6784, 256, 1, 128]
    - [85, 4038.96]
  - - [5888, 704, 1, 128]
    - [85, 4591.4]
  - - [6784, 64, 1, 128]
    - [19, 2688.98]
  - - [4, 448, 1, 1280]
    - [112, 329.421]
  - - [1024, 4288, 1, 1280]
    - [94, 9774.86]
  - - [2368, 5056, 1, 3328]
    - [91, 9223.36]
  - - [448, 4, 1, 128]
    - [107, 20.5056]
  - - [4, 256, 1, 3328]
    - [113, 343.328]
  - - [4288, 1024, 1, 3328]
    - [101, 9055.26]
  - - [6144, 48000, 1, 2560]
    - [105, 8635.29]
  - - [1024, 5056, 1, 3328]
    - [92, 9882.31]
  - - [1024, 1856, 1, 3328]
    - [92, 9524.23]
  - - [704, 704, 1, 1280]
    - [94, 8003.69]
  - - [128, 2368, 1, 1280]
    - [66, 5613.56]
  - - [3584, 4, 1, 128]
    - [107, 170.841]
  - - [3584, 256, 1, 1280]
    - [98, 8304.85]
  - - [4, 128, 1, 128]
    - [107, 6.41096]
  - - [128, 4288, 1, 3328]
    - [74, 7126.74]
  - - [5124, 1500, 1, 2560]
    - [105, 8987.32]
  - - [3584, 128, 1, 1280]
    - [101, 7394.57]
  - - [4, 256, 1, 1280]
    - [61, 249.21]
  - - [128, 704, 1, 3328]
    - [32, 5622.76]
  - - [4288, 6784, 1, 256]
    - [97, 9971.36]
  - - [3584, 2944, 1, 3328]
    - [92, 9046.28]
  - - [128, 1856, 1, 256]
    - [94, 3800.97]
  - - [64, 4288, 1, 256]
    - [38, 2694.33]
  - - [4, 3584, 1, 3328]
    - [113, 576.092]
  - - [64, 4, 1, 3328]
    - [113, 126.386]
  - - [4, 64, 1, 3328]
    - [113, 127.789]
  - - [35, 700, 1, 2560]
    - [10, 2338.9]
  - - [5888, 2944, 1, 256]
    - [99, 10289.5]
  - - [4, 2368, 1, 256]
    - [37, 359.741]
  - - [1856, 64, 1, 256]
    - [40, 2443.45]
  - - [5056, 128, 1, 1280]
    - [94, 7525.38]
  - - [448, 4288, 1, 1280]
    - [101, 9005.48]
  - - [256, 4288, 1, 256]
    - [93, 6138.59]
  - - [1024, 4288, 1, 128]
    - [87, 4421.46]
  - - [4, 1024, 1, 256]
    - [54, 221.195]
  - - [5056, 4288, 1, 256]
    - [103, 10313.0]
  - - [1024, 448, 1, 256]
    - [94, 5302.29]
  - - [1024, 3584, 1, 256]
    - [98, 9052.91]
  - - [2944, 128, 1, 1280]
    - [94, 6148.67]
  - - [49, 2048, 64, 512]
    - [123, 4958.8]
  - - [2560, 32, 1, 2560]
    - [53, 4335.47]
  - - [64, 256, 1, 256]
    - [37, 857.819]
  - - [1024, 4, 1, 512]
    - [75, 416.349]
  - - [128, 2368, 1, 128]
    - [15, 2103.41]
  - - [256, 704, 1, 1280]
    - [94, 4500.24]
  - - [64, 2368, 1, 128]
    - [18, 1558.75]
  - - [176, 1500, 1, 1408]
    - [35, 5508.15]
  - - [448, 5888, 1, 1280]
    - [94, 9141.62]
  - - [512, 3000, 1, 2048]
    - [105, 7276.54]
  - - [5056, 448, 1, 128]
    - [85, 4519.55]
  - - [4288, 704, 1, 1280]
    - [98, 9937.6]
  - - [3584, 2944, 1, 128]
    - [86, 5124.23]
  - - [6784, 256, 1, 1280]
    - [101, 9157.57]
  - - [256, 2944, 1, 1280]
    - [94, 8573.35]
  - - [2560, 128, 1, 2560]
    - [74, 6496.98]
  - - [2368, 5888, 1, 3328]
    - [91, 9102.82]
  - - [4, 64, 1, 256]
    - [54, 20.1062]
  - - [704, 1024, 1, 3328]
    - [101, 8694.59]
  - - [2368, 1856, 1, 1280]
    - [98, 9887.16]
  - - [448, 5056, 1, 3328]
    - [101, 9003.14]
  - - [128, 448, 1, 128]
    - [20, 678.659]
  - - [128, 6784, 1, 256]
    - [94, 4574.55]
  - - [512, 4, 1, 500000]
    - [3, 845.836]
  - - [3584, 4288, 1, 128]
    - [85, 5439.44]
  - - [64, 448, 1, 128]
    - [20, 339.329]
  - - [1024, 6000, 1, 2816]
    - [91, 9876.63]
  - - [5888, 4288, 1, 3328]
    - [92, 9070.81]
  - - [2368, 704, 1, 256]
    - [101, 7913.71]
  - - [256, 1856, 1, 3328]
    - [101, 8046.06]
  - - [1856, 128, 1, 256]
    - [94, 3854.45]
  - - [6784, 128, 1, 128]
    - [13, 3283.24]
  - - [3584, 1408, 1, 128]
    - [85, 4804.22]
  - - [1856, 5056, 1, 1280]
    - [103, 9473.54]
  - - [2944, 1024, 1, 1280]
    - [91, 10204.0]
  - - [5056, 4, 1, 256]
    - [24, 478.719]
  - - [3584, 5888, 1, 3328]
    - [92, 9232.78]
  - - [2368, 4288, 1, 256]
    - [97, 9980.4]
  - - [1024, 2368, 1, 3328]
    - [98, 9176.92]
  - - [128, 3584, 1, 128]
    - [15, 2762.01]
  - - [704, 1408, 1, 256]
    - [101, 7528.72]
  - - [4096, 128, 1, 4096]
    - [104, 7683.58]
  - - [1024, 2944, 1, 128]
    - [87, 4211.13]
  - - [1024, 3584, 1, 1280]
    - [98, 10390.9]
  - - [4288, 5888, 1, 3328]
    - [92, 9018.09]
  - - [4288, 4, 1, 3328]
    - [24, 662.01]
  - - [4608, 16, 1, 1536]
    - [38, 2729.98]
  - - [5888, 64, 1, 128]
    - [14, 2317.24]
  - - [4, 5888, 1, 128]
    - [107, 216.477]
  - - [1024, 2944, 1, 3328]
    - [99, 9783.15]
  - - [2048, 64, 1, 2048]
    - [33, 4910.24]
  - - [6144, 2, 1, 2560]
    - [29, 393.932]
  - - [256, 6784, 1, 1280]
    - [101, 9165.93]
  - - [1856, 3584, 1, 256]
    - [94, 9530.77]
  - - [128, 448, 1, 3328]
    - [66, 4797.47]
  - - [6784, 1856, 1, 128]
    - [85, 5561.53]
  - - [1024, 1500, 1, 2048]
    - [98, 8425.78]
  - - [5056, 128, 1, 256]
    - [101, 6212.62]
  - - [512, 24000, 1, 2816]
    - [92, 9458.85]
  - - [256, 5888, 1, 1280]
    - [98, 8978.2]
  - - [4, 128, 1, 1280]
    - [61, 132.036]
  - - [4288, 6784, 1, 3328]
    - [92, 8959.76]
  - - [6784, 128, 1, 1280]
    - [98, 7843.53]
  - - [64, 1408, 1, 256]
    - [38, 2273.11]
  - - [2368, 1408, 1, 128]
    - [85, 4975.14]
  - - [1856, 448, 1, 256]
    - [101, 6414.18]
  - - [1408, 1024, 1, 128]
    - [85, 3874.52]
  - - [128, 64, 1, 128]
    - [14, 104.082]
  - - [6784, 3584, 1, 3328]
    - [92, 9129.69]
  - - [1760, 7000, 1, 1760]
    - [91, 9442.98]
  - - [1024, 704, 1, 3328]
    - [101, 8641.23]
  - - [64, 64, 1, 128]
    - [14, 49.842]
  - - [2368, 5056, 1, 1280]
    - [91, 9481.65]
  - - [64, 4, 1, 1280]
    - [61, 66.0246]
  - - [1408, 2368, 1, 1280]
    - [98, 9544.75]
  - - [128, 1408, 1, 1280]
    - [73, 5088.49]
  - - [1024, 1, 1, 512]
    - [54, 90.7387]
  - - [4, 1408, 1, 128]
    - [107, 73.7226]
  - - [704, 4288, 1, 128]
    - [85, 4798.72]
  - - [128, 1856, 1, 3328]
    - [62, 6616.92]
  - - [2944, 2944, 1, 256]
    - [97, 9671.52]
  - - [2944, 4, 1, 1280]
    - [28, 596.713]
  - - [5888, 4, 1, 256]
    - [24, 502.422]
  - - [6784, 256, 1, 256]
    - [94, 7845.56]
  - - [256, 5056, 1, 3328]
    - [94, 9564.14]
  - - [128, 4288, 1, 1280]
    - [73, 6052.36]
  - - [5056, 1856, 1, 128]
    - [85, 5547.36]
  - - [1024, 3000, 1, 1536]
    - [105, 10180.4]
  - - [5056, 1024, 1, 3328]
    - [92, 9880.24]
  - - [128, 128, 1, 256]
    - [63, 884.688]
  - - [1760, 64, 1, 1760]
    - [45, 5373.99]
  - - [4288, 3584, 1, 3328]
    - [92, 9286.73]
  - - [448, 704, 1, 3328]
    - [101, 5381.49]
  - - [448, 448, 1, 128]
    - [21, 1716.85]
  - - [1024, 2368, 1, 1280]
    - [98, 9471.0]
  - - [1856, 704, 1, 3328]
    - [101, 9390.83]
  - - [512, 1500, 1, 2560]
    - [101, 8545.13]
  - - [5888, 6784, 1, 3328]
    - [92, 9050.08]
  - - [704, 4288, 1, 1280]
    - [96, 9679.4]
  - - [128, 50176, 1, 512]
    - [118, 7790.65]
  - - [704, 256, 1, 256]
    - [101, 3098.65]
  - - [1024, 48000, 1, 2048]
    - [99, 8933.67]
  - - [4288, 1024, 1, 128]
    - [85, 5147.4]
  - - [3136, 64, 128, 64]
    - [133, 5028.36]
  - - [784, 512, 64, 128]
    - [131, 8705.86]
  - - [3136, 256, 64, 64]
    - [129, 7446.77]
  - - [784, 128, 128, 512]
    - [134, 8613.09]
  - - [784, 128, 64, 512]
    - [132, 8262.22]
  - - [3136, 512, 1, 2048]
    - [130, 8098.91]
  - - [12544, 256, 1, 1024]
    - [138, 9026.05]
  - - [3136, 64, 128, 256]
    - [128, 7293.84]
  - - [3136, 64, 64, 256]
    - [127, 7164.37]
  - - [3136, 2048, 1, 512]
    - [136, 9066.6]
  - - [784, 512, 128, 128]
    - [131, 8905.73]
  - - [3136, 64, 64, 64]
    - [139, 4930.1]
  - - [12544, 1024, 1, 256]
    - [137, 9616.57]
  - - [3136, 256, 128, 64]
    - [135, 7497.7]
  - - [704, 1024, 1, 128]
    - [211, 3348.66]
  - - [1024, 1024, 1, 3328]
    - [225, 9865.83]
  - - [4, 704, 1, 1280]
    - [188, 386.287]
  - - [4, 1856, 1, 3328]
    - [240, 527.848]
  - - [1856, 448, 1, 3328]
    - [225, 7859.53]
  - - [2944, 4288, 1, 1280]
    - [224, 9683.74]
  - - [2368, 64, 1, 3328]
    - [172, 6304.47]
  - - [1760, 32, 1, 1760]
    - [200, 3947.34]
  - - [2368, 5888, 1, 256]
    - [222, 9990.7]
  - - [5888, 1856, 1, 256]
    - [230, 10190.7]
  - - [64, 3584, 1, 1280]
    - [200, 4540.16]
  - - [512, 24000, 1, 1536]
    - [230, 9643.04]
  - - [128, 6784, 1, 3328]
    - [221, 7808.76]
  - - [5888, 1408, 1, 256]
    - [230, 9993.29]
  - - [5888, 1856, 1, 3328]
    - [232, 9143.67]
  - - [512, 4, 1, 512]
    - [181, 244.154]
  - - [35, 1500, 1, 2560]
    - [136, 3013.92]
  - - [1856, 4288, 1, 256]
    - [230, 9596.66]
  - - [1024, 5056, 1, 128]
    - [212, 4477.65]
  - - [5056, 5056, 1, 3328]
    - [219, 9201.52]
  - - [1408, 5888, 1, 1280]
    - [219, 10371.6]
  - - [2368, 448, 1, 128]
    - [212, 3357.47]
  - - [6144, 6000, 1, 2560]
    - [232, 9089.97]
  - - [2368, 6784, 1, 128]
    - [212, 5732.97]
  - - [1024, 3584, 1, 3328]
    - [225, 9916.56]
  - - [512, 48000, 1, 2048]
    - [230, 8625.03]
  - - [1408, 64, 1, 128]
    - [147, 991.874]
  - - [256, 4288, 1, 3328]
    - [221, 8185.51]
  - - [5888, 1408, 1, 1280]
    - [219, 10292.7]
  - - [704, 1856, 1, 3328]
    - [221, 9712.54]
  - - [1408, 4288, 1, 256]
    - [224, 9597.57]
  - - [1024, 2368, 1, 256]
    - [225, 8120.2]
  - - [64, 4, 1, 256]
    - [239, 17.7933]
  - - [1408, 1856, 1, 1280]
    - [231, 10151.9]
  - - [1408, 64, 1, 1280]
    - [193, 4526.48]
  - - [448, 1024, 1, 1280]
    - [221, 7401.56]
  - - [4096, 32, 1, 4096]
    - [199, 4964.14]
  - - [256, 1408, 1, 3328]
    - [221, 6152.71]
  - - [5056, 5056, 1, 1280]
    - [226, 9480.03]
  - - [448, 5056, 1, 256]
    - [228, 8372.18]
  - - [704, 1856, 1, 1280]
    - [228, 8836.78]
  - - [128, 5056, 1, 128]
    - [141, 2761.26]
  - - [2368, 128, 1, 256]
    - [221, 3982.89]
  - - [1856, 1408, 1, 128]
    - [211, 4689.15]
  - - [64, 5056, 1, 256]
    - [176, 2625.15]
  - - [6784, 256, 1, 3328]
    - [221, 8902.92]
  - - [1408, 3584, 1, 256]
    - [224, 9462.58]
  - - [4288, 448, 1, 256]
    - [221, 8086.43]
  - - [64, 704, 1, 128]
    - [147, 522.607]
  - - [1024, 1856, 1, 128]
    - [212, 3410.29]
  - - [4288, 2944, 1, 1280]
    - [225, 9602.33]
  - - [704, 5056, 1, 1280]
    - [229, 9716.5]
  - - [2368, 704, 1, 3328]
    - [221, 8380.52]
  - - [256, 5888, 1, 256]
    - [220, 7306.07]
  - - [1856, 4288, 1, 3328]
    - [232, 9292.64]
  - - [256, 2944, 1, 256]
    - [221, 6627.54]
  - - [5888, 1024, 1, 256]
    - [228, 9637.78]
  - - [448, 64, 1, 1280]
    - [185, 2783.47]
  - - [3072, 64, 1, 1024]
    - [175, 3672.8]
  - - [3584, 4, 1, 1280]
    - [155, 651.991]
  - - [2560, 16, 1, 2560]
    - [192, 2701.5]
  - - [2944, 64, 1, 256]
    - [221, 3160.95]
  - - [128, 4, 1, 1280]
    - [188, 134.148]
  - - [1408, 2944, 1, 256]
    - [224, 9424.54]
  - - [256, 1856, 1, 1280]
    - [221, 7477.41]
  - - [6784, 5056, 1, 3328]
    - [219, 8925.6]
  - - [5056, 5056, 1, 256]
    - [230, 9690.07]
  - - [128, 256, 1, 256]
    - [164, 1433.56]
  - - [64, 1024, 1, 1280]
    - [193, 3700.9]
  - - [2944, 4, 1, 256]
    - [155, 424.043]
  - - [704, 5056, 1, 128]
    - [212, 4944.2]
  - - [4, 2368, 1, 1280]
    - [188, 480.065]
  - - [2368, 2944, 1, 1280]
    - [226, 9780.22]
  - - [448, 448, 1, 3328]
    - [172, 6332.21]
  - - [6784, 6784, 1, 1280]
    - [232, 9460.91]
  - - [1024, 256, 1, 3328]
    - [228, 6915.66]
  - - [1408, 4288, 1, 1280]
    - [231, 9958.54]
  - - [3584, 4288, 1, 1280]
    - [218, 9900.34]
  - - [512, 6000, 1, 2560]
    - [225, 9616.48]
  - - [2368, 704, 1, 1280]
    - [228, 8739.81]
  - - [5056, 4288, 1, 3328]
    - [219, 8983.08]
  - - [3584, 2368, 1, 3328]
    - [224, 8884.21]
  - - [5888, 6784, 1, 1280]
    - [219, 9385.29]
  - - [64, 704, 1, 1280]
    - [165, 3139.38]
  - - [4288, 256, 1, 256]
    - [228, 6922.84]
  - - [2944, 128, 1, 128]
    - [142, 2376.53]
  - - [6144, 32, 1, 2560]
    - [153, 4718.54]
  - - [6784, 448, 1, 1280]
    - [231, 9840.16]
  - - [2944, 5888, 1, 256]
    - [232, 10242.1]
  - - [64, 64, 1, 1280]
    - [202, 1040.87]
  - - [4288, 2944, 1, 256]
    - [230, 10017.7]
  - - [5888, 704, 1, 1280]
    - [230, 9978.66]
  - - [5056, 4, 1, 3328]
    - [151, 692.102]
  - - [1856, 64, 1, 1280]
    - [172, 4934.01]
  - - [1760, 16, 1, 1760]
    - [192, 2355.91]
  - - [448, 5888, 1, 128]
    - [212, 4526.43]
  - - [5888, 64, 1, 3328]
    - [201, 6981.44]
  - - [2944, 256, 1, 3328]
    - [221, 9036.54]
  - - [1024, 64, 1, 128]
    - [141, 781.089]
  - - [5056, 2368, 1, 1280]
    - [218, 9697.31]
  - - [448, 3584, 1, 1280]
    - [221, 8526.35]
  - - [6784, 5888, 1, 256]
    - [226, 10150.3]
  - - [64, 1024, 1, 3328]
    - [193, 5033.07]
  - - [704, 128, 1, 1280]
    - [200, 4423.62]
  - - [4, 3584, 1, 128]
    - [234, 167.482]
  - - [1408, 448, 1, 1280]
    - [228, 7310.33]
  - - [1024, 1408, 1, 256]
    - [228, 7504.09]
  - - [2368, 2368, 1, 3328]
    - [224, 9273.2]
  - - [1856, 6784, 1, 128]
    - [212, 5627.8]
  - - [5056, 704, 1, 3328]
    - [231, 9628.77]
  - - [1408, 1856, 1, 256]
    - [228, 8293.09]
  - - [1408, 704, 1, 3328]
    - [225, 9379.33]
  - - [2368, 5056, 1, 256]
    - [224, 9898.67]
  - - [1408, 256, 1, 1280]
    - [228, 5870.36]
  - - [3072, 128, 1, 1024]
    - [228, 5376.59]
  - - [3584, 2368, 1, 1280]
    - [224, 9632.24]
  - - [4288, 64, 1, 3328]
    - [172, 6313.09]
  - - [2368, 4, 1, 1280]
    - [164, 551.173]
  - - [704, 5888, 1, 256]
    - [228, 9308.23]
  - - [6784, 2944, 1, 128]
    - [215, 5499.8]
  - - [6784, 64, 1, 256]
    - [228, 5103.71]
  - - [2944, 256, 1, 256]
    - [228, 7135.91]
  - - [2944, 6784, 1, 3328]
    - [226, 8974.14]
  - - [128, 1, 1, 1408]
    - [210, 41.3365]
  - - [704, 1408, 1, 3328]
    - [228, 9150.01]
  - - [3584, 704, 1, 3328]
    - [225, 9577.32]
  - - [2944, 256, 1, 128]
    - [212, 3280.47]
  - - [6784, 4, 1, 1280]
    - [237, 651.344]
  - - [1024, 64, 1, 1280]
    - [161, 3442.07]
  - - [8448, 4, 1, 2816]
    - [152, 777.699]
  - - [448, 4288, 1, 256]
    - [221, 7960.32]
  - - [64, 3584, 1, 3328]
    - [163, 6207.95]
  - - [704, 2368, 1, 1280]
    - [228, 8885.38]
  - - [1856, 2368, 1, 1280]
    - [221, 9962.49]
  - - [2368, 128, 1, 3328]
    - [208, 6429.45]
  - - [64, 193600, 1, 64]
    - [241, 5384.89]
  - - [1760, 128, 1, 1760]
    - [173, 6311.97]
  - - [448, 1408, 1, 256]
    - [221, 6106.27]
  - - [1856, 4288, 1, 1280]
    - [218, 9943.62]
  - - [64, 5056, 1, 3328]
    - [201, 6614.06]
  - - [512, 1500, 1, 2816]
    - [221, 9152.22]
  - - [1024, 448, 1, 128]
    - [212, 2165.94]
  - - [704, 4, 1, 1280]
    - [188, 415.986]
  - - [704, 256, 1, 128]
    - [212, 1360.0]
  - - [256, 193600, 1, 64]
    - [242, 8470.9]
  - - [704, 2944, 1, 128]
    - [212, 4544.91]
  - - [1408, 1024, 1, 1280]
    - [225, 9066.08]
  - - [704, 6784, 1, 256]
    - [228, 9190.05]
  - - [6784, 704, 1, 256]
    - [228, 9174.7]
  - - [5056, 1408, 1, 128]
    - [212, 5392.9]
  - - [2048, 7000, 1, 2048]
    - [224, 9153.23]
  - - [256, 3584, 1, 3328]
    - [228, 8434.77]
  - - [5056, 704, 1, 256]
    - [230, 9085.02]
  - - [128, 1408, 1, 128]
    - [142, 1656.56]
  - - [3584, 4288, 1, 3328]
    - [219, 9316.28]
  - - [5888, 1856, 1, 1280]
    - [224, 9797.36]
  - - [256, 1408, 1, 256]
    - [221, 4630.85]
  - - [5056, 64, 1, 1280]
    - [172, 5558.06]
  - - [1024, 704, 1, 256]
    - [228, 6323.32]
  - - [64, 256, 1, 128]
    - [147, 226.587]
  - - [2368, 3584, 1, 1280]
    - [230, 9758.49]
  - - [1024, 256, 1, 256]
    - [228, 4044.51]
  - - [1856, 4, 1, 1280]
    - [155, 489.729]
  - - [448, 448, 1, 256]
    - [221, 3416.79]
  - - [2944, 3584, 1, 3328]
    - [219, 8957.99]
  - - [7680, 32, 1, 2560]
    - [173, 5504.41]
  - - [128, 4288, 1, 128]
    - [141, 2649.32]
  - - [256, 256, 1, 3328]
    - [193, 5257.83]
  - - [128, 1024, 1, 3328]
    - [194, 6521.27]
  - - [4, 1408, 1, 3328]
    - [181, 508.186]
  - - [196, 256, 64, 1024]
    - [247, 6101.14]
  - - [6784, 2944, 1, 256]
    - [226, 10204.3]
  - - [64, 1856, 1, 1280]
    - [193, 4404.61]
  - - [64, 1024, 1, 128]
    - [147, 760.11]
  - - [1024, 1500, 1, 2560]
    - [225, 9672.55]
  - - [1856, 2368, 1, 256]
    - [228, 9410.66]
  - - [3584, 256, 1, 128]
    - [215, 3164.55]
  - - [3584, 6784, 1, 3328]
    - [219, 9098.83]
  - - [256, 1024, 1, 256]
    - [221, 4155.83]
  - - [4, 6784, 1, 3328]
    - [240, 618.947]
  - - [1024, 5888, 1, 3328]
    - [219, 9651.49]
  - - [1024, 128, 1, 1280]
    - [169, 4148.15]
  - - [3072, 32, 1, 1024]
    - [171, 3088.5]
  - - [6144, 24000, 1, 2560]
    - [232, 8729.8]
  - - [448, 1024, 1, 256]
    - [221, 5807.52]
  - - [5056, 4288, 1, 1280]
    - [230, 9410.09]
  - - [5888, 64, 1, 256]
    - [221, 4569.49]
  - - [1856, 256, 1, 1280]
    - [221, 7665.9]
  - - [64, 5888, 1, 3328]
    - [201, 6647.03]
  - - [2368, 2368, 1, 1280]
    - [225, 10055.4]
  - - [2944, 5888, 1, 128]
    - [213, 5683.71]
  - - [704, 5888, 1, 1280]
    - [228, 9967.51]
  - - [2368, 3584, 1, 128]
    - [211, 5451.73]
  - - [1856, 5056, 1, 128]
    - [212, 5579.9]
  - - [4608, 1, 1, 1536]
    - [178, 186.719]
  - - [448, 256, 1, 3328]
    - [172, 6112.24]
  - - [2944, 6784, 1, 1280]
    - [218, 9461.83]
  - - [448, 1856, 1, 128]
    - [211, 3221.56]
  - - [128, 1024, 1, 128]
    - [147, 1340.24]
  - - [7680, 4, 1, 2560]
    - [158, 800.739]
  - - [1024, 704, 1, 1280]
    - [228, 8179.14]
  - - [128, 5888, 1, 256]
    - [228, 4744.32]
  - - [1024, 5056, 1, 1280]
    - [230, 10240.7]
  - - [4288, 1024, 1, 256]
    - [228, 9338.27]
  - - [2944, 2368, 1, 128]
    - [215, 5150.22]
  - - [704, 704, 1, 3328]
    - [221, 8498.67]
  - - [704, 1408, 1, 1280]
    - [228, 8815.27]
  - - [5888, 448, 1, 1280]
    - [228, 9125.26]
  - - [3584, 256, 1, 3328]
    - [223, 8465.97]
  - - [704, 5888, 1, 3328]
    - [221, 9379.93]
  - - [704, 1856, 1, 128]
    - [212, 4046.26]
  - - [128, 3584, 1, 3328]
    - [221, 7500.16]
  - - [4, 4288, 1, 128]
    - [234, 187.682]
  - - [128, 704, 1, 1280]
    - [159, 4411.1]
  - - [3584, 2944, 1, 256]
    - [228, 9716.1]
  - - [1856, 128, 1, 3328]
    - [189, 6903.78]
  - - [1856, 2368, 1, 3328]
    - [221, 9282.81]
  - - [512, 6000, 1, 2816]
    - [219, 10011.4]
  - - [2944, 448, 1, 128]
    - [212, 3664.06]
  - - [64, 193600, 1, 256]
    - [233, 6410.27]
  - - [128, 2944, 1, 1280]
    - [193, 5803.51]
  - - [448, 2944, 1, 1280]
    - [223, 8070.21]
  - - [512, 24000, 1, 2048]
    - [231, 8810.23]
  - - [128, 256, 1, 3328]
    - [205, 4089.34]
  - - [1408, 5056, 1, 3328]
    - [226, 9595.52]
  - - [1856, 1856, 1, 3328]
    - [231, 9290.53]
  - - [3584, 128, 1, 256]
    - [221, 5642.07]
  - - [448, 1408, 1, 3328]
    - [221, 7587.51]
  - - [2368, 2368, 1, 256]
    - [230, 9508.74]
  - - [4288, 4288, 1, 1280]
    - [230, 9368.13]
  - - [64, 448, 1, 1280]
    - [191, 2831.25]
  - - [5888, 1024, 1, 1280]
    - [219, 10225.2]
  - - [704, 1024, 1, 256]
    - [228, 6920.49]
  - - [1024, 12544, 1, 256]
    - [244, 9919.91]
  - - [448, 4, 1, 256]
    - [181, 126.495]
  - - [5888, 448, 1, 128]
    - [216, 4110.11]
  - - [512, 48000, 1, 2560]
    - [226, 9188.97]
  - - [8448, 16, 1, 2816]
    - [152, 2861.11]
  - - [704, 6784, 1, 3328]
    - [232, 9197.5]
  - - [5888, 5888, 1, 1280]
    - [226, 9345.87]
  - - [5056, 1024, 1, 1280]
    - [230, 10271.3]
  - - [448, 5888, 1, 3328]
    - [221, 8883.1]
  - - [3072, 2, 1, 1024]
    - [182, 320.594]
  - - [1024, 2944, 1, 1280]
    - [232, 9939.32]
  - - [5056, 5888, 1, 1280]
    - [226, 9479.25]
  - - [4288, 5888, 1, 128]
    - [212, 5829.42]
  - - [256, 3584, 1, 256]
    - [221, 6592.23]
  - - [256, 4, 1, 1280]
    - [188, 252.891]
  - - [1408, 3584, 1, 128]
    - [216, 4979.92]
  - - [256, 2944, 1, 3328]
    - [228, 8952.9]
  - - [448, 3584, 1, 128]
    - [212, 3902.26]
  - - [5888, 2944, 1, 1280]
    - [218, 9834.85]
  - - [4, 6784, 1, 1280]
    - [188, 551.741]
  - - [2368, 5888, 1, 128]
    - [211, 5580.89]
  - - [35, 8457, 1, 1760]
    - [134, 4398.21]
  - - [64, 2944, 1, 128]
    - [148, 1661.18]
  - - [2368, 4, 1, 256]
    - [238, 419.766]
  - - [3584, 5888, 1, 256]
    - [226, 9991.65]
  - - [2368, 1024, 1, 128]
    - [212, 4520.02]
  - - [2368, 704, 1, 128]
    - [211, 4115.22]
  - - [512, 32, 1, 512]
    - [190, 1451.92]
  - - [3584, 2368, 1, 128]
    - [212, 5158.35]
  - - [5056, 704, 1, 128]
    - [212, 4972.18]
  - - [448, 2368, 1, 128]
    - [212, 3297.07]
  - - [4, 5056, 1, 256]
    - [164, 356.691]
  - - [5056, 1408, 1, 3328]
    - [218, 9670.98]
  - - [1408, 704, 1, 256]
    - [228, 7512.32]
  - - [6784, 1024, 1, 3328]
    - [219, 9389.02]
  - - [6784, 2944, 1, 3328]
    - [219, 9065.45]
  - - [7680, 1, 1, 2560]
    - [170, 203.793]
  - - [1856, 1856, 1, 256]
    - [221, 8805.28]
  - - [64, 64, 1, 3328]
    - [210, 1786.66]
  - - [512, 1, 1, 512]
    - [132, 61.1134]
  - - [6784, 2368, 1, 1280]
    - [230, 9801.88]
  - - [4608, 2, 1, 1536]
    - [159, 368.304]
  - - [4288, 3584, 1, 256]
    - [230, 10247.2]
  - - [4288, 5888, 1, 1280]
    - [230, 9403.43]
  - - [4608, 4, 1, 1536]
    - [161, 718.512]
  - - [1024, 6000, 1, 1536]
    - [232, 10038.5]
  - - [8448, 32, 1, 2816]
    - [201, 4863.67]
  - - [448, 2944, 1, 3328]
    - [225, 8492.88]
  - - [4288, 1856, 1, 1280]
    - [219, 9810.29]
  - - [1856, 2944, 1, 3328]
    - [231, 9202.43]
  - - [256, 6784, 1, 3328]
    - [221, 9143.9]
  - - [512, 3000, 1, 1536]
    - [225, 9231.82]
  - - [64, 5888, 1, 256]
    - [176, 2647.0]
  - - [256, 5056, 1, 128]
    - [211, 3284.31]
  - - [5056, 1024, 1, 256]
    - [230, 9563.08]
  - - [704, 64, 1, 3328]
    - [205, 4664.21]
  - - [5056, 1856, 1, 3328]
    - [218, 8731.72]
  - - [4, 2944, 1, 3328]
    - [240, 564.728]
  - - [512, 1500, 1, 2048]
    - [231, 6829.61]
  - - [1024, 1, 1, 500000]
    - [128, 213.492]
  - - [256, 4, 1, 256]
    - [181, 78.7511]
  - - [6784, 128, 1, 3328]
    - [229, 8052.14]
  - - [4288, 1408, 1, 128]
    - [212, 5261.04]
  - - [1856, 5888, 1, 3328]
    - [232, 9138.71]
  - - [4288, 5056, 1, 256]
    - [230, 10439.6]
  - - [1408, 128, 1, 1280]
    - [162, 5122.09]
  - - [4096, 7000, 1, 4096]
    - [226, 8662.72]
  - - [5056, 256, 1, 3328]
    - [221, 9233.22]
  - - [704, 704, 1, 256]
    - [228, 6274.19]
  - - [1024, 3000, 1, 2560]
    - [232, 9872.22]
  - - [1024, 5888, 1, 1280]
    - [218, 9875.27]
  - - [6784, 2368, 1, 128]
    - [216, 5512.12]
  - - [4, 5056, 1, 1280]
    - [188, 531.191]
  - - [256, 64, 1, 1280]
    - [203, 2246.89]
  - - [128, 1856, 1, 1280]
    - [193, 5387.27]
  - - [1856, 1024, 1, 1280]
    - [226, 9214.56]
  - - [6784, 4288, 1, 1280]
    - [226, 9222.81]
  - - [1856, 1856, 1, 1280]
    - [231, 9537.53]
  - - [35, 1500, 1, 2048]
    - [138, 2333.66]
  - - [3072, 24000, 1, 1024]
    - [232, 8996.18]
  - - [1408, 5056, 1, 1280]
    - [219, 10027.0]
  - - [4, 2368, 1, 3328]
    - [188, 563.737]
  - - [5888, 1856, 1, 128]
    - [212, 4990.36]
  - - [448, 704, 1, 1280]
    - [221, 5093.36]
  - - [448, 6784, 1, 128]
    - [212, 4840.27]
  - - [1024, 448, 1, 3328]
    - [228, 7783.37]
  - - [2944, 128, 1, 256]
    - [221, 4859.39]
  - - [5056, 3584, 1, 128]
    - [213, 5646.9]
  - - [5888, 5888, 1, 3328]
    - [232, 9047.05]
  - - [6784, 1024, 1, 256]
    - [227, 9451.85]
  - - [2944, 2368, 1, 256]
    - [230, 9633.17]
  - - [256, 448, 1, 256]
    - [175, 2416.87]
  - - [5056, 5888, 1, 3328]
    - [232, 9111.32]
  - - [1856, 1024, 1, 256]
    - [221, 7961.41]
  - - [512, 48000, 1, 1536]
    - [230, 9370.68]
  - - [3584, 448, 1, 1280]
    - [228, 8502.85]
  - - [1024, 1024, 1, 1280]
    - [225, 9407.57]
  - - [448, 5888, 1, 256]
    - [227, 8053.13]
  - - [2048, 128, 1, 2048]
    - [168, 5420.82]
  - - [1408, 6784, 1, 3328]
    - [225, 9028.76]
  - - [448, 1024, 1, 128]
    - [211, 2696.35]
  - - [4288, 704, 1, 128]
    - [212, 4816.56]
  - - [128, 1856, 1, 128]
    - [148, 2012.32]
  - - [448, 2368, 1, 3328]
    - [221, 7898.83]
  - - [5056, 64, 1, 128]
    - [142, 2263.79]
  - - [5056, 2944, 1, 256]
    - [230, 10251.3]
  - - [6784, 5888, 1, 128]
    - [213, 5406.75]
  - - [1024, 700, 1, 512]
    - [228, 6722.42]
  - - [3072, 1, 1, 128]
    - [197, 83.0395]
  - - [1024, 4, 1, 256]
    - [238, 221.272]
  - - [2944, 704, 1, 128]
    - [212, 4405.11]
  - - [128, 6784, 1, 1280]
    - [221, 7179.34]
  - - [1408, 3584, 1, 3328]
    - [218, 9667.96]
  - - [2368, 6784, 1, 256]
    - [224, 10070.3]
  - - [5056, 1408, 1, 1280]
    - [225, 9901.89]
  - - [5056, 4288, 1, 128]
    - [212, 5781.27]
  - - [4, 704, 1, 256]
    - [164, 157.055]
  - - [4288, 2368, 1, 3328]
    - [230, 9034.16]
  - - [1408, 1856, 1, 128]
    - [211, 4506.64]
  - - [1408, 5888, 1, 3328]
    - [232, 9683.04]
  - - [1856, 256, 1, 256]
    - [221, 6014.93]
  - - [6784, 6784, 1, 256]
    - [232, 10039.8]
  - - [5888, 5056, 1, 128]
    - [217, 5395.0]
  - - [4288, 2368, 1, 128]
    - [212, 5620.05]
  - - [128, 5888, 1, 1280]
    - [228, 7678.67]
  - - [256, 4288, 1, 1280]
    - [221, 7887.05]
  - - [2368, 2944, 1, 256]
    - [228, 9617.81]
  - - [4, 1856, 1, 256]
    - [164, 324.868]
  - - [3584, 1856, 1, 1280]
    - [225, 9991.52]
  - - [6784, 6784, 1, 128]
    - [217, 5552.32]
  - - [256, 1856, 1, 128]
    - [211, 2325.9]
  - - [49, 512, 64, 2048]
    - [250, 3299.33]
  - - [704, 64, 1, 1280]
    - [184, 3177.87]
  - - [5888, 5056, 1, 256]
    - [230, 10042.2]
  - - [8448, 48000, 1, 2816]
    - [219, 8822.68]
  - - [512, 6000, 1, 2048]
    - [231, 7747.23]
  - - [3584, 448, 1, 256]
    - [221, 7253.54]
  - - [448, 4288, 1, 128]
    - [212, 4201.89]
  - - [7680, 64, 1, 2560]
    - [168, 6682.39]
  - - [256, 6784, 1, 256]
    - [228, 7493.08]
  - - [1408, 4288, 1, 128]
    - [215, 5071.78]
  - - [2944, 704, 1, 3328]
    - [225, 9514.12]
  - - [128, 448, 1, 256]
    - [164, 1852.24]
  - - [2048, 32, 1, 2048]
    - [187, 3682.8]
  - - [3584, 3584, 1, 256]
    - [230, 10105.1]
  - - [448, 1408, 1, 128]
    - [211, 2906.68]
  - - [128, 256, 1, 1280]
    - [165, 3180.98]
  - - [3584, 5056, 1, 256]
    - [226, 10026.2]
  - - [6784, 128, 1, 256]
    - [221, 6743.76]
  - - [4288, 4, 1, 256]
    - [151, 445.787]
  - - [64, 1408, 1, 3328]
    - [200, 5348.07]
  - - [704, 448, 1, 256]
    - [221, 4067.11]
  - - [2944, 2368, 1, 1280]
    - [218, 9897.55]
  - - [448, 64, 1, 3328]
    - [208, 3845.29]
  - - [704, 6784, 1, 128]
    - [213, 4759.34]
  - - [3584, 4, 1, 3328]
    - [164, 700.937]
  - - [6784, 3584, 1, 256]
    - [226, 10425.2]
  - - [704, 448, 1, 128]
    - [216, 1974.67]
  - - [256, 128, 1, 128]
    - [147, 401.661]
  - - [704, 1408, 1, 128]
    - [211, 3644.34]
  - - [4, 448, 1, 128]
    - [234, 22.5383]
  - - [4288, 128, 1, 1280]
    - [221, 6373.82]
  - - [128, 1408, 1, 256]
    - [221, 3023.52]
  - - [4, 2944, 1, 256]
    - [164, 399.102]
  - - [64, 128, 1, 3328]
    - [206, 2244.24]
  - - [1856, 1408, 1, 256]
    - [228, 9013.18]
  - - [5056, 2368, 1, 128]
    - [212, 5638.68]
  - - [2944, 2944, 1, 3328]
    - [225, 9214.34]
  - - [5056, 6784, 1, 256]
    - [230, 9753.01]
  - - [1856, 3584, 1, 128]
    - [212, 5224.71]
  - - [5888, 4, 1, 1280]
    - [236, 646.079]
  - - [128, 2944, 1, 128]
    - [142, 2350.77]
  - - [35, 8457, 1, 2560]
    - [136, 4036.9]
  - - [3584, 6784, 1, 128]
    - [212, 5558.84]
  - - [128, 4288, 1, 256]
    - [228, 3839.83]
  - - [704, 448, 1, 3328]
    - [221, 5395.93]
  - - [2368, 6784, 1, 1280]
    - [218, 9705.22]
  - - [128, 128, 1, 3328]
    - [203, 3228.49]
  - - [5056, 1856, 1, 256]
    - [228, 9762.26]
  - - [256, 128, 1, 256]
    - [190, 1470.75]
  - - [1024, 3000, 1, 2816]
    - [232, 10076.1]
  - - [1024, 1856, 1, 256]
    - [228, 7894.36]
  - - [64, 1, 1, 1216]
    - [188, 13.7438]
  - - [4288, 64, 1, 128]
    - [141, 1984.19]
  - - [256, 448, 1, 3328]
    - [162, 6076.19]
  - - [1408, 6784, 1, 1280]
    - [225, 9593.29]
  - - [3584, 3584, 1, 1280]
    - [231, 9678.54]
  - - [7680, 24000, 1, 2560]
    - [232, 8760.45]
  - - [64, 2368, 1, 1280]
    - [162, 4300.16]
  - - [448, 2368, 1, 1280]
    - [221, 7663.62]
  - - [4608, 48000, 1, 1536]
    - [232, 8834.31]
  - - [5888, 5888, 1, 128]
    - [213, 5453.96]
  - - [64, 6784, 1, 3328]
    - [194, 6558.94]
  - - [2944, 256, 1, 1280]
    - [228, 8722.71]
  - - [2048, 16, 1, 2048]
    - [209, 2242.52]
  - - [256, 2368, 1, 128]
    - [212, 2580.14]
  - - [5056, 2368, 1, 3328]
    - [219, 9152.39]
  - - [2944, 4288, 1, 256]
    - [230, 10054.7]
  - - [1408, 3584, 1, 1280]
    - [218, 10318.0]
  - - [2368, 64, 1, 256]
    - [166, 2605.78]
  - - [1024, 128, 1, 128]
    - [141, 1324.53]
  - - [704, 128, 1, 3328]
    - [200, 5493.19]
  - - [5888, 4, 1, 128]
    - [234, 235.344]
  - - [1856, 704, 1, 256]
    - [228, 8049.18]
  - - [1024, 1500, 1, 2816]
    - [225, 9784.05]
  - - [8448, 1, 1, 2816]
    - [154, 197.366]
  - - [1024, 4, 1, 3328]
    - [181, 530.415]
  - - [1024, 6000, 1, 2048]
    - [225, 9452.2]
  - - [512, 24000, 1, 2560]
    - [226, 9329.98]
  - - [6144, 3000, 1, 2560]
    - [226, 9231.18]
  - - [2368, 6784, 1, 3328]
    - [218, 9280.57]
  - - [1856, 1408, 1, 1280]
    - [223, 9981.41]
  - - [1856, 448, 1, 1280]
    - [225, 7494.94]
  - - [6784, 704, 1, 128]
    - [216, 4860.25]
  - - [4, 4, 1, 256]
    - [181, 0.913182]
  - - [128, 5888, 1, 128]
    - [141, 2855.99]
  - - [5056, 2944, 1, 128]
    - [216, 5729.7]
  - - [1408, 5888, 1, 256]
    - [230, 9961.98]
  - - [704, 2944, 1, 1280]
    - [221, 9721.3]
  - - [4288, 64, 1, 1280]
    - [172, 5475.86]
  - - [256, 64, 1, 256]
    - [174, 820.743]
  - - [1024, 1024, 1, 256]
    - [228, 7395.53]
  - - [704, 1856, 1, 256]
    - [228, 7894.36]
  - - [2560, 64, 1, 2560]
    - [200, 5142.79]
  - - [3584, 704, 1, 1280]
    - [225, 9877.41]
  - - [256, 128, 1, 1280]
    - [191, 3370.37]
  - - [5888, 2368, 1, 256]
    - [231, 9924.88]
  - - [256, 2368, 1, 1280]
    - [221, 6955.58]
  - - [2944, 6784, 1, 128]
    - [213, 5701.51]
  - - [3584, 448, 1, 3328]
    - [221, 8320.24]
  - - [1408, 4, 1, 256]
    - [164, 286.312]
  - - [704, 2368, 1, 3328]
    - [228, 8456.2]
  - - [2944, 448, 1, 256]
    - [221, 7066.76]
  - - [1856, 448, 1, 128]
    - [213, 3123.52]
  - - [4608, 6000, 1, 1536]
    - [232, 9249.87]
  - - [2368, 128, 1, 1280]
    - [200, 5736.63]
  - - [256, 5888, 1, 128]
    - [212, 3529.33]
  - - [64, 6784, 1, 256]
    - [175, 2738.17]
  - - [64, 5056, 1, 1280]
    - [193, 5055.58]
  - - [4, 6784, 1, 128]
    - [234, 223.384]
  - - [3025, 64, 64, 64]
    - [249, 5191.65]
  - - [2944, 2944, 1, 1280]
    - [224, 9849.07]
  - - [5056, 448, 1, 3328]
    - [228, 9295.2]
  - - [4, 3584, 1, 1280]
    - [188, 519.425]
  - - [1408, 128, 1, 128]
    - [148, 1605.32]
  - - [6784, 704, 1, 3328]
    - [218, 9318.96]
  - - [128, 64, 1, 1280]
    - [202, 1726.29]
  - - [2368, 256, 1, 1280]
    - [221, 7058.68]
  - - [4, 448, 1, 3328]
    - [188, 417.249]
  - - [5888, 4288, 1, 128]
    - [212, 5167.91]
  - - [4, 5888, 1, 256]
    - [181, 325.666]
  - - [1408, 2944, 1, 3328]
    - [219, 10163.7]
  - - [3584, 704, 1, 128]
    - [212, 4124.82]
  - - [64, 1024, 1, 256]
    - [165, 2004.43]
  - - [2368, 448, 1, 1280]
    - [228, 7679.67]
  - - [128, 3584, 1, 256]
    - [228, 4075.63]
  - - [704, 448, 1, 1280]
    - [221, 5156.03]
  - - [448, 5056, 1, 128]
    - [212, 4524.87]
  - - [6144, 4, 1, 2560]
    - [171, 783.604]
  - - [5056, 3584, 1, 256]
    - [230, 10397.4]
  - - [4288, 4288, 1, 256]
    - [224, 10081.5]
  - - [1408, 5056, 1, 128]
    - [215, 5144.79]
  - - [2944, 3584, 1, 128]
    - [212, 5468.61]
  - - [3584, 2368, 1, 256]
    - [221, 9541.36]
  - - [5888, 5056, 1, 1280]
    - [226, 9475.06]
  - - [128, 1024, 1, 1280]
    - [200, 4956.0]
  - - [8448, 24000, 1, 2816]
    - [219, 8839.23]
  - - [64, 704, 1, 256]
    - [165, 1622.03]
  - - [4288, 256, 1, 1280]
    - [228, 7929.94]
  - - [3584, 3584, 1, 3328]
    - [218, 9073.05]
  - - [704, 64, 1, 128]
    - [147, 508.938]
  - - [3072, 1500, 1, 128]
    - [230, 8208.74]
  - - [2048, 3136, 1, 512]
    - [244, 9928.78]
  - - [3025, 256, 64, 64]
    - [253, 8027.83]
  - - [5888, 6784, 1, 256]
    - [226, 9993.79]
  - - [4288, 2944, 1, 3328]
    - [219, 9012.75]
  - - [2944, 64, 1, 128]
    - [148, 1686.97]
  - - [1024, 128, 1, 3328]
    - [198, 6015.01]
  - - [1024, 16, 1, 500000]
    - [127, 3266.52]
  - - [4288, 128, 1, 3328]
    - [172, 7470.11]
  - - [7680, 128, 1, 2560]
    - [225, 9108.09]
  - - [256, 5056, 1, 1280]
    - [221, 9200.18]
  - - [1408, 256, 1, 128]
    - [212, 2090.17]
  - - [2944, 5888, 1, 3328]
    - [226, 9249.37]
  - - [6784, 5888, 1, 1280]
    - [232, 9274.19]
  - - [3072, 1, 1, 1024]
    - [183, 169.965]
  - - [704, 128, 1, 256]
    - [165, 2193.25]
  - - [5888, 4288, 1, 1280]
    - [226, 9295.25]
  - - [1024, 24000, 1, 2048]
    - [226, 8939.94]
  - - [448, 256, 1, 1280]
    - [162, 4763.88]
  - - [5888, 3584, 1, 128]
    - [213, 5317.11]
  - - [64, 4288, 1, 3328]
    - [205, 6058.7]
  - - [448, 4, 1, 1280]
    - [188, 360.16]
  - - [6784, 6784, 1, 3328]
    - [219, 9149.33]
  - - [5056, 4, 1, 1280]
    - [151, 643.672]
  - - [4, 5888, 1, 3328]
    - [188, 602.325]
  - - [256, 1408, 1, 1280]
    - [221, 5793.88]
  - - [3072, 16, 1, 1024]
    - [192, 2375.86]
  - - [704, 3584, 1, 128]
    - [212, 4668.02]
  - - [1024, 2, 1, 512]
    - [181, 183.932]
  - - [5888, 448, 1, 3328]
    - [221, 8878.47]
  - - [2368, 4288, 1, 1280]
    - [231, 9596.73]
  - - [4288, 2944, 1, 128]
    - [212, 5639.53]
  - - [256, 64, 1, 3328]
    - [207, 2932.63]
  - - [2944, 64, 1, 3328]
    - [201, 6602.97]
  - - [6784, 64, 1, 3328]
    - [221, 7450.84]
  - - [5056, 2944, 1, 3328]
    - [219, 9068.81]
  - - [448, 128, 1, 256]
    - [164, 1835.11]
  - - [2944, 3584, 1, 256]
    - [230, 9906.13]
  - - [1408, 1408, 1, 3328]
    - [232, 9579.06]
  - - [1856, 128, 1, 1280]
    - [221, 5839.45]
  - - [3584, 3584, 1, 128]
    - [212, 5317.67]
  - - [64, 3584, 1, 256]
    - [165, 2811.03]
  - - [1408, 4, 1, 3328]
    - [157, 623.318]
  - - [128, 2944, 1, 3328]
    - [194, 6958.49]
  - - [3584, 704, 1, 256]
    - [225, 8507.09]
  - - [2944, 448, 1, 3328]
    - [223, 8321.15]
  - - [1024, 2, 1, 500000]
    - [129, 425.818]
  - - [3584, 1408, 1, 3328]
    - [219, 9759.54]
  - - [704, 3584, 1, 1280]
    - [223, 9611.73]
  - - [1024, 1408, 1, 128]
    - [214, 3809.48]
  - - [1856, 6784, 1, 256]
    - [224, 10023.9]
  - - [4288, 448, 1, 3328]
    - [231, 9310.25]
  - - [6784, 4288, 1, 128]
    - [212, 5499.6]
  - - [6784, 704, 1, 1280]
    - [228, 9323.98]
  - - [6144, 1, 1, 2560]
    - [165, 198.724]
  - - [3584, 6784, 1, 256]
    - [232, 10083.6]
  - - [6144, 16, 1, 2560]
    - [171, 3052.46]
  - - [3584, 64, 1, 128]
    - [150, 1809.94]
  - - [5888, 1024, 1, 3328]
    - [219, 9678.42]
  - - [448, 64, 1, 128]
    - [149, 321.82]
  - - [704, 6784, 1, 1280]
    - [232, 9493.42]
  - - [4, 448, 1, 256]
    - [181, 123.953]
  - - [196, 1024, 64, 256]
    - [248, 7759.43]
  - - [5888, 128, 1, 256]
    - [221, 7135.91]
  - - [4096, 16, 1, 4096]
    - [195, 3030.0]
  - - [1856, 5056, 1, 3328]
    - [218, 8854.19]
  - - [4, 6784, 1, 256]
    - [181, 336.223]
  - - [1024, 3584, 1, 128]
    - [214, 4067.81]
  - - [64, 704, 1, 3328]
    - [208, 4419.78]
  - - [2368, 2944, 1, 128]
    - [216, 5288.16]
  - - [5056, 64, 1, 256]
    - [221, 4008.3]
  - - [512, 1500, 1, 1536]
    - [221, 8002.46]
  - - [512, 1, 1, 500000]
    - [130, 213.149]
  - - [5888, 2944, 1, 3328]
    - [219, 9332.62]
  - - [128, 3584, 1, 1280]
    - [221, 6377.36]
  - - [1024, 704, 1, 128]
    - [216, 2743.84]
  - - [1408, 2368, 1, 128]
    - [212, 4870.1]
  - - [5888, 2368, 1, 128]
    - [212, 5211.5]
  - - [128, 5056, 1, 3328]
    - [221, 7591.49]
  - - [3584, 6784, 1, 1280]
    - [218, 9387.44]
  - - [4288, 1856, 1, 256]
    - [230, 9461.34]
  - - [1856, 5888, 1, 256]
    - [228, 9847.93]
  - - [256, 256, 1, 256]
    - [175, 1903.36]
  - - [4288, 4288, 1, 3328]
    - [218, 8774.19]
  - - [1024, 1024, 1, 128]
    - [217, 3253.04]
  - - [4288, 1408, 1, 1280]
    - [219, 10072.0]
  - - [3584, 5056, 1, 128]
    - [213, 5459.82]
  - - [4, 1024, 1, 3328]
    - [181, 490.812]
  - - [4, 704, 1, 128]
    - [234, 35.3603]
  - - [4288, 2368, 1, 256]
    - [224, 9747.62]
  - - [2944, 5056, 1, 1280]
    - [225, 9630.98]
  - - [448, 6784, 1, 256]
    - [221, 8848.64]
  - - [64, 128, 1, 128]
    - [147, 129.963]
  - - [1856, 2368, 1, 128]
    - [212, 5117.57]
  - - [6784, 2368, 1, 3328]
    - [219, 9134.35]
  - - [1408, 6784, 1, 128]
    - [212, 5385.11]
  - - [256, 1024, 1, 1280]
    - [221, 6308.87]
  - - [704, 4, 1, 128]
    - [234, 32.5392]
  - - [1408, 4, 1, 128]
    - [234, 66.301]
  - - [4288, 128, 1, 256]
    - [221, 5283.69]
  - - [4288, 1856, 1, 3328]
    - [218, 9137.58]
  - - [3584, 448, 1, 128]
    - [216, 3631.56]
  - - [64, 4288, 1, 128]
    - [145, 2035.29]
  - - [64, 448, 1, 3328]
    - [208, 3649.2]
  - - [448, 4, 1, 3328]
    - [240, 460.144]
  - - [256, 4, 1, 3328]
    - [240, 374.119]
  - - [4, 1408, 1, 1280]
    - [181, 419.579]
  - - [3584, 64, 1, 1280]
    - [163, 5590.38]
  - - [1408, 448, 1, 128]
    - [212, 2961.96]
  - - [3584, 1024, 1, 1280]
    - [225, 10442.4]
  - - [1856, 5056, 1, 256]
    - [221, 9818.4]
  - - [4, 3584, 1, 256]
    - [164, 434.704]
  - - [6784, 4288, 1, 3328]
    - [219, 8956.48]
  - - [4, 2944, 1, 1280]
    - [188, 489.246]
  - - [1024, 4288, 1, 256]
    - [224, 8884.44]
  - - [5888, 3584, 1, 3328]
    - [219, 9228.03]
  - - [1856, 4, 1, 256]
    - [238, 383.043]
  - - [4, 256, 1, 256]
    - [181, 78.7393]
  - - [5056, 3584, 1, 3328]
    - [219, 9145.57]
  - - [1408, 128, 1, 3328]
    - [201, 6390.65]
  - - [4, 64, 1, 1280]
    - [188, 68.154]
  - - [2368, 1408, 1, 1280]
    - [221, 9710.55]
  - - [5056, 2944, 1, 1280]
    - [226, 9552.3]
  - - [8448, 6000, 1, 2816]
    - [219, 9077.8]
  - - [4, 4, 1, 128]
    - [235, 0.200535]
  - - [3584, 256, 1, 256]
    - [228, 6984.27]
  - - [3584, 2944, 1, 1280]
    - [224, 9661.01]
  - - [1024, 6784, 1, 256]
    - [225, 9262.23]
  - - [4, 128, 1, 256]
    - [181, 42.225]
  - - [6784, 448, 1, 256]
    - [227, 8630.59]
  - - [5124, 9124, 1, 2048]
    - [232, 8513.19]
  - - [2944, 5056, 1, 3328]
    - [219, 9060.94]
  - - [6784, 4, 1, 128]
    - [234, 259.165]
  - - [2944, 1408, 1, 128]
    - [212, 5054.85]
  - - [448, 128, 1, 3328]
    - [179, 4983.21]
  - - [64, 2944, 1, 3328]
    - [194, 6024.89]
  - - [5056, 6784, 1, 3328]
    - [232, 8890.43]
  - - [704, 2368, 1, 128]
    - [212, 4068.77]
  - - [3072, 1500, 1, 1024]
    - [225, 9596.21]
  - - [128, 2944, 1, 256]
    - [221, 4269.87]
  - - [128, 6784, 1, 128]
    - [143, 3025.22]
  - - [3584, 4288, 1, 256]
    - [230, 10170.7]
  - - [448, 1856, 1, 256]
    - [221, 6315.51]
  - - [1856, 6784, 1, 3328]
    - [219, 8910.89]
  - - [3584, 128, 1, 3328]
    - [221, 7851.59]
  - - [64, 1856, 1, 256]
    - [167, 2429.1]
  - - [64, 448, 1, 256]
    - [190, 1303.95]
  - - [5888, 4288, 1, 256]
    - [230, 10428.4]
  - - [128, 1500, 1, 1280]
    - [193, 5241.25]
  - - [5056, 1408, 1, 256]
    - [230, 9444.23]
  - - [35, 8457, 1, 4096]
    - [135, 4081.59]
  - - [64, 256, 1, 1280]
    - [190, 2379.17]
  - - [2944, 4, 1, 128]
    - [234, 137.586]
  - - [3584, 1024, 1, 256]
    - [225, 9210.85]
  - - [512, 6000, 1, 1536]
    - [224, 9570.24]
  - - [256, 704, 1, 256]
    - [221, 3098.75]
  - - [5888, 5888, 1, 256]
    - [232, 10241.2]
  - - [4288, 1024, 1, 1280]
    - [225, 9830.7]
  - - [5888, 128, 1, 3328]
    - [228, 9043.79]
  - - [448, 6784, 1, 3328]
    - [229, 9441.54]
  - - [2944, 1408, 1, 1280]
    - [218, 10465.6]
  - - [3072, 6000, 1, 1024]
    - [225, 9401.47]
  - - [1024, 32, 1, 512]
    - [174, 1797.63]
  - - [2944, 1856, 1, 3328]
    - [225, 9360.7]
  - - [2368, 64, 1, 128]
    - [141, 1431.1]
  - - [256, 1024, 1, 128]
    - [211, 1572.88]
  - - [3584, 5888, 1, 1280]
    - [226, 9435.53]
  - - [64, 4, 1, 128]
    - [234, 2.70208]
  - - [6784, 1856, 1, 1280]
    - [230, 9518.33]
  - - [2944, 5056, 1, 256]
    - [224, 9986.59]
  - - [5888, 256, 1, 3328]
    - [225, 9732.66]
  - - [2944, 4288, 1, 128]
    - [212, 5636.61]
  - - [3584, 1408, 1, 256]
    - [230, 9266.49]
  - - [704, 3584, 1, 3328]
    - [223, 9453.5]
  - - [5056, 448, 1, 1280]
    - [228, 9488.47]
  - - [3584, 1856, 1, 3328]
    - [225, 9248.05]
  - - [64, 1408, 1, 128]
    - [147, 985.562]
  - - [4288, 6784, 1, 1280]
    - [218, 9281.39]
  - - [1024, 3000, 1, 2048]
    - [231, 8794.95]
  - - [1408, 704, 1, 1280]
    - [225, 9005.32]
  - - [2944, 1024, 1, 256]
    - [228, 8859.2]
  - - [256, 64, 1, 128]
    - [149, 185.132]
  - - [2368, 4288, 1, 3328]
    - [225, 9084.71]
  - - [4, 1408, 1, 256]
    - [164, 278.143]
  - - [1024, 1408, 1, 1280]
    - [231, 8766.23]
  - - [64, 64, 1, 256]
    - [190, 321.798]
  - - [704, 256, 1, 3328]
    - [221, 4907.26]
  - - [6784, 5056, 1, 256]
    - [232, 9945.3]
  - - [1856, 1856, 1, 128]
    - [212, 4851.2]
  - - [4288, 5888, 1, 256]
    - [230, 10491.1]
  - - [4, 704, 1, 3328]
    - [188, 492.373]
  - - [35, 8457, 1, 2048]
    - [135, 3556.55]
  - - [448, 2944, 1, 256]
    - [221, 7044.94]
  - - [4, 4288, 1, 3328]
    - [188, 582.111]
  - - [2944, 6784, 1, 256]
    - [230, 10346.6]
  - - [2944, 2944, 1, 128]
    - [212, 5335.44]
  - - [4, 4, 1, 1280]
    - [188, 3.51333]
  - - [1856, 3584, 1, 1280]
    - [229, 9398.39]
  - - [64, 2944, 1, 256]
    - [221, 2831.18]
  - - [3584, 1408, 1, 1280]
    - [218, 10475.5]
  - - [448, 256, 1, 128]
    - [147, 1238.66]
  - - [4288, 448, 1, 128]
    - [212, 4250.3]
  - - [5056, 256, 1, 1280]
    - [228, 8801.93]
  - - [1856, 1408, 1, 3328]
    - [229, 9807.48]
  - - [128, 128, 1, 128]
    - [147, 236.013]
  - - [1024, 4288, 1, 3328]
    - [225, 9109.7]
  - - [448, 2368, 1, 256]
    - [221, 6558.61]
  - - [1024, 4, 1, 128]
    - [234, 49.2505]
  - - [64, 1408, 1, 1280]
    - [200, 4076.2]
  - - [64, 6784, 1, 1280]
    - [193, 5257.49]
  - - [5056, 448, 1, 256]
    - [228, 8490.28]
  - - [2944, 2368, 1, 3328]
    - [218, 9523.35]
  - - [704, 4288, 1, 3328]
    - [223, 9212.92]
  - - [1408, 128, 1, 256]
    - [228, 3008.93]
  - - [1024, 1856, 1, 1280]
    - [219, 9243.08]
  - - [6784, 1856, 1, 256]
    - [230, 10075.0]
  - - [512, 48000, 1, 2816]
    - [219, 9413.58]
  - - [512, 3000, 1, 2816]
    - [231, 9743.24]
  - - [128, 2368, 1, 3328]
    - [194, 6655.73]
  - - [1024, 5888, 1, 256]
    - [228, 9428.44]
  - - [64, 2944, 1, 1280]
    - [193, 4405.68]
  - - [6784, 1408, 1, 256]
    - [230, 9901.2]
  - - [5056, 64, 1, 3328]
    - [201, 7119.34]
  - - [128, 704, 1, 128]
    - [139, 1031.29]
  - - [1408, 2368, 1, 256]
    - [221, 9087.19]
  - - [1408, 1408, 1, 256]
    - [228, 8345.05]
  - - [4, 64, 1, 128]
    - [234, 2.91754]
  - - [64, 128, 1, 1280]
    - [202, 1705.66]
  - - [1024, 8, 1, 500000]
    - [129, 1673.39]
  - - [4, 2368, 1, 128]
    - [234, 117.85]
  - - [2368, 2368, 1, 128]
    - [212, 5315.13]
  - - [64, 5888, 1, 128]
    - [142, 2284.85]
  - - [5888, 4, 1, 3328]
    - [237, 677.507]
  - - [6784, 1408, 1, 128]
    - [212, 5233.16]
  - - [1408, 5056, 1, 256]
    - [224, 9833.0]
  - - [512, 50176, 1, 128]
    - [243, 10079.8]
  - - [5056, 128, 1, 3328]
    - [228, 7653.45]
  - - [128, 128, 1, 1280]
    - [190, 2359.23]
  - - [512, 2, 1, 512]
    - [202, 124.28]
  - - [448, 704, 1, 256]
    - [221, 4082.43]
  - - [4288, 3584, 1, 128]
    - [212, 5658.6]
  - - [2944, 128, 1, 3328]
    - [172, 7405.94]
  - - [128, 5056, 1, 1280]
    - [221, 7082.26]
  - - [3584, 5056, 1, 1280]
    - [219, 9453.8]
  - - [256, 448, 1, 1280]
    - [159, 4473.55]
  - - [704, 704, 1, 128]
    - [211, 2903.08]
  - - [5056, 4, 1, 128]
    - [234, 209.362]
  - - [704, 256, 1, 1280]
    - [221, 4506.84]
  - - [64, 2368, 1, 3328]
    - [162, 5900.18]
  - - [1856, 1024, 1, 128]
    - [212, 4204.99]
  - - [1856, 64, 1, 128]
    - [141, 1359.39]
  - - [4096, 64, 1, 4096]
    - [177, 7182.94]
  - - [1024, 24000, 1, 1536]
    - [226, 9376.03]
  - - [704, 4288, 1, 256]
    - [227, 8586.49]
  - - [5888, 2368, 1, 1280]
    - [218, 9809.71]
  - - [6784, 1856, 1, 3328]
    - [219, 9010.4]
  - - [64, 128, 1, 256]
    - [181, 544.532]
  - - [2368, 5888, 1, 1280]
    - [218, 9720.25]
  - - [5888, 256, 1, 1280]
    - [223, 9203.58]
  - - [4, 5888, 1, 1280]
    - [188, 543.448]
  - - [704, 128, 1, 128]
    - [147, 998.225]
  - - [1024, 4, 1, 1280]
    - [240, 436.988]
  - - [2368, 1856, 1, 3328]
    - [221, 9136.35]
  - - [2368, 128, 1, 128]
    - [142, 2137.87]
  - - [2944, 704, 1, 256]
    - [228, 8692.64]
  - - [5056, 128, 1, 128]
    - [144, 3097.81]
  - - [2368, 1024, 1, 3328]
    - [225, 9284.18]
  - - [35, 700, 1, 2048]
    - [138, 2046.47]
  - - [256, 704, 1, 3328]
    - [221, 4898.35]
  - - [704, 3584, 1, 256]
    - [228, 8693.72]
  - - [1024, 1024, 1, 1024]
    - [225, 7197.22]
  - - [704, 2944, 1, 3328]
    - [228, 9779.91]
  - - [6784, 1024, 1, 128]
    - [216, 5237.31]
  - - [256, 448, 1, 128]
    - [147, 1208.44]
  - - [448, 1024, 1, 3328]
    - [221, 7809.92]
  - - [2944, 1024, 1, 3328]
    - [219, 9907.79]
  - - [2944, 5056, 1, 128]
    - [212, 5705.55]
  - - [2368, 256, 1, 256]
    - [221, 5901.51]
  - - [1408, 6784, 1, 256]
    - [224, 9877.48]
  - - [6784, 1408, 1, 3328]
    - [219, 8957.55]
  - - [4288, 6784, 1, 128]
    - [213, 5723.79]
  - - [1408, 2944, 1, 128]
    - [216, 4791.12]
  - - [704, 64, 1, 256]
    - [165, 1789.9]
  - - [3072, 4, 1, 1024]
    - [190, 655.938]
  - - [256, 2368, 1, 3328]
    - [228, 7276.3]
  - - [6784, 2944, 1, 1280]
    - [219, 9352.6]
  - - [4288, 1856, 1, 128]
    - [216, 5219.03]
  - - [1856, 2944, 1, 128]
    - [212, 5313.32]
  - - [6784, 448, 1, 128]
    - [212, 4655.81]
  - - [64, 3584, 1, 128]
    - [141, 1869.64]
  - - [448, 5056, 1, 1280]
    - [221, 9488.45]
  - - [4288, 5056, 1, 1280]
    - [230, 9507.28]
  - - [2368, 1856, 1, 128]
    - [211, 4821.89]
  - - [128, 448, 1, 1280]
    - [193, 3782.06]
  - - [4288, 704, 1, 256]
    - [228, 8916.79]
  - - [256, 3584, 1, 128]
    - [213, 2925.18]
  - - [5888, 704, 1, 256]
    - [230, 9430.78]
  - - [3584, 1024, 1, 128]
    - [212, 4542.77]
  - - [256, 5888, 1, 3328]
    - [225, 9577.1]
  - - [1408, 4288, 1, 3328]
    - [218, 9716.53]
  - - [6784, 4288, 1, 256]
    - [230, 10126.1]
  - - [4288, 256, 1, 128]
    - [212, 3486.9]
  - - [448, 1856, 1, 3328]
    - [228, 7689.65]
  - - [5888, 256, 1, 256]
    - [228, 7977.44]
  - - [1024, 4, 1, 500000]
    - [129, 845.704]
  - - [6784, 1024, 1, 1280]
    - [218, 9992.39]
  - - [5888, 1024, 1, 128]
    - [212, 4866.19]
  - - [1024, 128, 1, 256]
    - [228, 2265.0]
  - - [512, 16, 1, 500000]
    - [133, 3212.25]
  - - [128, 64, 1, 3328]
    - [202, 2314.84]
  - - [448, 64, 1, 256]
    - [190, 1270.44]
  - - [2368, 256, 1, 128]
    - [211, 2854.31]
  - - [6784, 3584, 1, 1280]
    - [226, 9431.91]
  - - [1024, 6784, 1, 1280]
    - [218, 9827.11]
  - - [2944, 64, 1, 1280]
    - [200, 5259.73]
  - - [1408, 2944, 1, 1280]
    - [219, 10527.1]
  - - [256, 1856, 1, 256]
    - [221, 5928.01]
  - - [1408, 2368, 1, 3328]
    - [228, 9202.18]
  - - [2944, 4, 1, 3328]
    - [164, 654.066]
  - - [128, 1408, 1, 3328]
    - [194, 6214.11]
  - - [2944, 1856, 1, 128]
    - [216, 5117.5]
  - - [256, 2944, 1, 128]
    - [211, 2818.93]
  - - [256, 6784, 1, 128]
    - [212, 3718.7]
  - - [2368, 4, 1, 128]
    - [234, 112.977]
  - - [1408, 256, 1, 3328]
    - [228, 6178.53]
  - - [1856, 4, 1, 128]
    - [234, 87.9661]
  - - [1024, 16, 1, 512]
    - [181, 1286.89]
  - - [5056, 6784, 1, 128]
    - [216, 5693.49]
  - - [4288, 5056, 1, 128]
    - [212, 5859.95]
  - - [1856, 5888, 1, 128]
    - [216, 5595.11]
  - - [7680, 2, 1, 2560]
    - [159, 405.31]
  - - [3584, 1856, 1, 256]
    - [230, 9562.61]
  - - [4288, 3584, 1, 1280]
    - [219, 9873.84]
  - - [2368, 448, 1, 256]
    - [228, 6665.98]
  - - [4288, 256, 1, 3328]
    - [221, 7883.28]
  - - [1856, 704, 1, 128]
    - [212, 4031.87]
  - - [1408, 64, 1, 256]
    - [165, 2341.5]
  - - [64, 1856, 1, 128]
    - [147, 1267.08]
  - - [4, 256, 1, 128]
    - [234, 12.8298]
  - - [512, 16, 1, 512]
    - [186, 884.788]
  - - [704, 5888, 1, 128]
    - [213, 4912.71]
  - - [6784, 3584, 1, 128]
    - [217, 5689.06]
  - - [1024, 64, 1, 256]
    - [164, 1841.42]
  - - [64, 2368, 1, 256]
    - [165, 2631.94]
  - - [5124, 1500, 1, 2048]
    - [231, 8832.02]
  - - [4288, 5056, 1, 3328]
    - [219, 8953.84]
  - - [4, 1856, 1, 1280]
    - [188, 439.431]
  - - [4288, 128, 1, 128]
    - [144, 2679.22]
  - - [512, 2, 1, 500000]
    - [131, 425.386]
  - - [1408, 1408, 1, 128]
    - [212, 4208.42]
  - - [7680, 16, 1, 2560]
    - [196, 2986.46]
  - - [1856, 128, 1, 128]
    - [148, 2022.29]
  - - [5056, 2368, 1, 256]
    - [230, 9912.91]
  - - [4288, 704, 1, 3328]
    - [231, 9454.43]
  - - [448, 3584, 1, 256]
    - [221, 7580.54]
  - - [2368, 64, 1, 1280]
    - [172, 5124.83]
  - - [2368, 1024, 1, 1280]
    - [225, 9460.42]
  - - [2944, 1408, 1, 3328]
    - [232, 10101.4]
  - - [6144, 1500, 1, 2560]
    - [232, 9609.25]
  - - [4224, 1, 1, 128]
    - [165, 94.8882]
  - - [1024, 1408, 1, 3328]
    - [225, 9322.88]
  - - [2944, 5888, 1, 1280]
    - [218, 9803.94]
  - - [8448, 2, 1, 2816]
    - [152, 391.983]
  - - [1408, 4, 1, 1280]
    - [181, 491.609]
  - - [5888, 3584, 1, 256]
    - [232, 10225.6]
  - - [2368, 5056, 1, 128]
    - [211, 5553.91]
  - - [1408, 1856, 1, 3328]
    - [231, 9833.76]
  - - [4, 4, 1, 3328]
    - [240, 8.45853]
  - - [5888, 5056, 1, 3328]
    - [232, 9160.05]
  - - [7680, 6000, 1, 2560]
    - [232, 9000.7]
  - - [6784, 1408, 1, 1280]
    - [230, 9592.2]
  - - [4, 1024, 1, 1280]
    - [181, 397.725]
  - - [512, 3000, 1, 2560]
    - [225, 9507.97]
  - - [704, 2944, 1, 256]
    - [221, 7871.09]
  - - [4288, 64, 1, 256]
    - [221, 3578.95]
  - - [6784, 5888, 1, 3328]
    - [232, 8964.51]
  - - [2368, 4288, 1, 128]
    - [211, 5491.65]
  - - [64, 4288, 1, 1280]
    - [200, 4809.46]
  - - [6784, 64, 1, 1280]
    - [221, 6972.54]
  - - [3584, 128, 1, 128]
    - [144, 2714.8]
  - - [1024, 6784, 1, 128]
    - [213, 4403.51]
  - - [1024, 1500, 1, 1536]
    - [231, 9420.21]
  - - [1408, 64, 1, 3328]
    - [159, 5485.76]
  - - [6784, 4, 1, 256]
    - [236, 491.093]
  - - [1408, 1408, 1, 1280]
    - [218, 9781.89]
  - - [256, 2368, 1, 256]
    - [228, 5616.69]
  - - [3072, 3000, 1, 1024]
    - [225, 9671.24]
  - - [448, 4288, 1, 3328]
    - [228, 8965.91]
  - - [2368, 1408, 1, 256]
    - [221, 9072.89]
  - - [704, 2368, 1, 256]
    - [221, 7849.11]
  - - [1024, 24000, 1, 2560]
    - [232, 9196.63]
  - - [2944, 448, 1, 1280]
    - [225, 8275.36]
  - - [5888, 2368, 1, 3328]
    - [219, 9182.73]
  - - [1024, 256, 1, 128]
    - [215, 1490.12]
  - - [5124, 9124, 1, 1760]
    - [219, 8991.28]
  - - [448, 1408, 1, 1280]
    - [221, 7310.36]
  - - [448, 1856, 1, 1280]
    - [221, 7409.91]
  - - [4288, 448, 1, 1280]
    - [225, 9233.56]
  - - [5888, 704, 1, 3328]
    - [231, 9749.22]
  - - [4, 1856, 1, 128]
    - [234, 97.2847]
  - - [5056, 256, 1, 128]
    - [212, 4029.9]
  - - [1856, 256, 1, 128]
    - [212, 2870.74]
  - - [128, 2368, 1, 256]
    - [221, 3894.14]
  - - [704, 4, 1, 256]
    - [181, 162.3]
  - - [1024, 6784, 1, 3328]
    - [219, 9423.58]
  - - [1408, 5888, 1, 128]
    - [213, 5260.9]
  - - [4288, 4, 1, 128]
    - [234, 187.682]
  - - [512, 3136, 1, 2048]
    - [232, 7618.28]
  - - [1408, 1024, 1, 256]
    - [221, 7653.94]
  - - [128, 64, 1, 256]
    - [190, 615.552]
  - - [8448, 1500, 1, 2816]
    - [230, 9047.24]
  - - [256, 704, 1, 128]
    - [211, 1250.77]
  - - [2560, 7000, 1, 2560]
    - [226, 9076.82]
  - - [5888, 64, 1, 1280]
    - [228, 6079.91]
  - - [128, 4, 1, 3328]
    - [240, 239.72]
  - - [5056, 6784, 1, 1280]
    - [232, 9153.24]
  - - [1024, 448, 1, 1280]
    - [228, 7252.6]
  - - [704, 5056, 1, 3328]
    - [229, 9398.97]
  - - [128, 5056, 1, 256]
    - [221, 4536.72]
  - - [3584, 5056, 1, 3328]
    - [219, 9262.83]
  - - [1856, 4, 1, 3328]
    - [155, 613.217]
  - - [4, 2944, 1, 128]
    - [234, 139.474]
  - - [2368, 2944, 1, 3328]
    - [232, 9424.2]
  - - [448, 448, 1, 1280]
    - [193, 5085.24]
  - - [128, 4, 1, 128]
    - [234, 6.07765]
  - - [2368, 3584, 1, 256]
    - [230, 9667.15]
  - - [4608, 3000, 1, 1536]
    - [231, 9461.29]
  - - [1024, 256, 1, 1280]
    - [228, 6326.47]
  - - [5056, 3584, 1, 1280]
    - [230, 9698.0]
  - - [5124, 9124, 1, 4096]
    - [226, 8268.43]
  - - [7680, 48000, 1, 2560]
    - [232, 8717.11]
  - - [1856, 704, 1, 1280]
    - [228, 8868.01]
  - - [1856, 2944, 1, 1280]
    - [230, 9723.68]
  - - [4608, 1500, 1, 1536]
    - [230, 9545.41]
  - - [1024, 48000, 1, 2816]
    - [226, 9210.7]
  - - [5124, 9124, 1, 2560]
    - [232, 8729.82]
  - - [128, 1024, 1, 256]
    - [167, 2618.37]
  - - [2944, 1408, 1, 256]
    - [230, 9387.48]
  - - [4288, 1408, 1, 3328]
    - [219, 9640.93]
  - - [3584, 64, 1, 3328]
    - [168, 6396.78]
  - - [5888, 2944, 1, 128]
    - [213, 5367.96]
  - - [2944, 1024, 1, 128]
    - [216, 4601.83]
  - - [128, 1, 1, 1024]
    - [188, 23.6932]
  - - [5124, 700, 1, 2048]
    - [232, 8493.15]
  - - [4, 4288, 1, 1280]
    - [188, 532.196]
  - - [6784, 5056, 1, 128]
    - [216, 5612.09]
  - - [256, 1024, 1, 3328]
    - [221, 6964.74]
  - - [3584, 4, 1, 256]
    - [155, 458.823]
  - - [1856, 64, 1, 3328]
    - [172, 6323.04]
  - - [4, 128, 1, 3328]
    - [240, 242.222]
  - - [256, 12544, 1, 1024]
    - [246, 7984.12]
  - - [5888, 1408, 1, 3328]
    - [232, 9674.52]
  - - [448, 2944, 1, 128]
    - [211, 3606.11]
  - - [2368, 1856, 1, 256]
    - [228, 9404.84]
  - - [256, 5056, 1, 256]
    - [227, 7134.19]
  - - [5056, 5056, 1, 128]
    - [216, 5798.42]
  - - [448, 3584, 1, 3328]
    - [228, 8710.0]
  - - [4, 5056, 1, 3328]
    - [240, 597.861]
  - - [256, 256, 1, 128]
    - [147, 745.092]
  - - [5888, 256, 1, 128]
    - [214, 3893.31]
  - - [4, 5056, 1, 128]
    - [234, 203.277]
  - - [448, 256, 1, 256]
    - [165, 2431.78]
  - - [704, 4, 1, 3328]
    - [188, 510.233]
  - - [1408, 256, 1, 256]
    - [221, 4648.11]
  - - [3584, 1856, 1, 128]
    - [212, 4815.4]
  - - [4288, 4288, 1, 128]
    - [212, 5727.81]
  - - [1856, 1024, 1, 3328]
    - [218, 9524.34]
  - - [1856, 4288, 1, 128]
    - [212, 5444.23]
  - - [1024, 6000, 1, 2560]
    - [232, 9961.14]
  - - [1024, 5056, 1, 256]
    - [230, 9441.95]
  - - [5056, 5888, 1, 128]
    - [212, 5818.49]
  - - [2368, 1408, 1, 3328]
    - [221, 8993.89]
  - - [1024, 48000, 1, 1536]
    - [232, 9292.51]
  - - [5888, 448, 1, 256]
    - [221, 8139.42]
  - - [5888, 6784, 1, 128]
    - [213, 5247.27]
  - - [2368, 4, 1, 3328]
    - [155, 658.836]
  - - [6784, 5056, 1, 1280]
    - [219, 9106.13]
  - - [5056, 704, 1, 1280]
    - [225, 10048.3]
  - - [1024, 48000, 1, 2560]
    - [226, 9241.97]
  - - [4608, 32, 1, 1536]
    - [173, 3817.25]
  - - [1024, 2368, 1, 128]
    - [217, 3731.15]
  - - [128, 704, 1, 256]
    - [175, 2240.43]
  - - [2368, 448, 1, 3328]
    - [228, 7894.91]
  - - [128, 5888, 1, 3328]
    - [228, 8507.5]
  - - [448, 128, 1, 1280]
    - [193, 3855.67]
  - - [6784, 4, 1, 3328]
    - [237, 649.608]
  - - [4288, 4, 1, 1280]
    - [151, 600.058]
  - - [1024, 64, 1, 3328]
    - [193, 4688.49]
  - - [3072, 48000, 1, 1024]
    - [232, 8842.85]
  - - [256, 4, 1, 128]
    - [234, 11.741]
  - - [1024, 5888, 1, 128]
    - [214, 4353.76]
  - - [3584, 5888, 1, 128]
    - [212, 5583.33]
  - - [5056, 5888, 1, 256]
    - [226, 9915.39]
  - - [2368, 1024, 1, 256]
    - [225, 8223.79]
  - - [2944, 1856, 1, 256]
    - [228, 9551.52]
  - - [1856, 6784, 1, 1280]
    - [224, 9593.86]
  - - [64, 5056, 1, 128]
    - [146, 2273.05]
  - - [64, 6784, 1, 128]
    - [146, 2517.69]
  - - [448, 704, 1, 128]
    - [211, 1932.66]
  - - [4, 1024, 1, 128]
    - [234, 52.1437]
  - - [1408, 448, 1, 256]
    - [221, 6123.52]
  - - [1408, 704, 1, 128]
    - [211, 3590.86]
  - - [64, 256, 1, 3328]
    - [204, 2956.16]
  - - [8448, 3000, 1, 2816]
    - [219, 9314.18]
  - - [6784, 448, 1, 3328]
    - [231, 9492.1]
  - - [5056, 1856, 1, 1280]
    - [230, 9220.47]
  - - [1408, 1024, 1, 3328]
    - [223, 9124.58]
  - - [2368, 256, 1, 3328]
    - [221, 7083.28]
  - - [7680, 1500, 1, 2560]
    - [226, 8877.37]
  - - [5888, 3584, 1, 1280]
    - [226, 9492.76]
  - - [1856, 3584, 1, 3328]
    - [222, 8931.3]
  - - [5888, 128, 1, 1280]
    - [221, 8664.73]
  - - [1024, 2944, 1, 256]
    - [225, 8456.54]
  - - [448, 6784, 1, 1280]
    - [223, 9716.31]
  - - [256, 3584, 1, 1280]
    - [221, 8117.84]
  - - [448, 128, 1, 128]
    - [147, 669.597]
  - - [704, 5056, 1, 256]
    - [221, 9038.29]
  - - [3584, 1024, 1, 3328]
    - [231, 9832.61]
  - - [2944, 1856, 1, 1280]
    - [225, 9894.88]
  - - [128, 256, 1, 128]
    - [147, 410.381]
  - - [5056, 256, 1, 256]
    - [228, 8016.41]
  - - [2944, 4288, 1, 3328]
    - [218, 9019.91]
  - - [2368, 3584, 1, 3328]
    - [224, 8951.78]
  - - [2944, 704, 1, 1280]
    - [225, 9986.99]
  - - [128, 4, 1, 256]
    - [181, 40.3123]
  - - [2944, 3584, 1, 1280]
    - [224, 9726.98]
  - - [1856, 5888, 1, 1280]
    - [226, 9811.08]
  - - [256, 256, 1, 1280]
    - [159, 4088.31]
  - - [4608, 24000, 1, 1536]
    - [232, 9003.21]
  - - [4288, 1408, 1, 256]
    - [230, 9492.8]
  - - [3584, 64, 1, 256]
    - [221, 3721.64]
  - - [64, 1856, 1, 3328]
    - [162, 5807.0]
  - - [256, 1408, 1, 128]
    - [211, 1859.28]
  - - [5888, 1408, 1, 128]
    - [212, 5042.4]
  - - [4288, 2368, 1, 1280]
    - [231, 9673.46]
  - - [4, 4288, 1, 256]
    - [164, 403.343]
  - - [256, 4288, 1, 128]
    - [212, 3333.69]
  - - [256, 128, 1, 3328]
    - [208, 4011.43]
  - - [512, 8, 1, 500000]
    - [130, 1675.27]
  - - [6784, 2368, 1, 256]
    - [230, 10264.0]
  - - [5888, 128, 1, 128]
    - [144, 3305.42]
  - - [1408, 448, 1, 3328]
    - [228, 7583.44]
  - - [1024, 24000, 1, 2816]
    - [219, 9356.73]
  - - [704, 1024, 1, 1280]
    - [228, 8382.8]
  - - [1856, 256, 1, 3328]
    - [221, 8119.62]
  - - [1856, 2944, 1, 256]
    - [228, 9556.35]
  - - [5056, 1024, 1, 128]
    - [212, 5228.71]
  - - [64, 5888, 1, 1280]
    - [193, 5259.76]
  - - [7680, 3000, 1, 2560]
    - [232, 9054.95]
  - - [4224, 1500, 1, 176]
    - [230, 9140.3]
  - - [5124, 700, 1, 2560]
    - [227, 8804.42]
  - - [6784, 256, 1, 128]
    - [212, 4039.06]
  - - [5888, 704, 1, 128]
    - [212, 4591.5]
  - - [6784, 64, 1, 128]
    - [146, 2689.08]
  - - [4, 448, 1, 1280]
    - [239, 329.521]
  - - [1024, 4288, 1, 1280]
    - [221, 9774.96]
  - - [2368, 5056, 1, 3328]
    - [218, 9223.46]
  - - [448, 4, 1, 128]
    - [234, 20.6056]
  - - [4, 256, 1, 3328]
    - [240, 343.428]
  - - [4288, 1024, 1, 3328]
    - [228, 9055.36]
  - - [6144, 48000, 1, 2560]
    - [232, 8635.39]
  - - [1024, 5056, 1, 3328]
    - [219, 9882.41]
  - - [1024, 1856, 1, 3328]
    - [219, 9524.33]
  - - [704, 704, 1, 1280]
    - [221, 8003.79]
  - - [128, 2368, 1, 1280]
    - [193, 5613.66]
  - - [3584, 4, 1, 128]
    - [234, 170.941]
  - - [3584, 256, 1, 1280]
    - [225, 8304.95]
  - - [4, 128, 1, 128]
    - [234, 6.51096]
  - - [128, 4288, 1, 3328]
    - [201, 7126.84]
  - - [5124, 1500, 1, 2560]
    - [232, 8987.42]
  - - [3584, 128, 1, 1280]
    - [228, 7394.67]
  - - [4, 256, 1, 1280]
    - [188, 249.31]
  - - [128, 704, 1, 3328]
    - [159, 5622.86]
  - - [4288, 6784, 1, 256]
    - [224, 9971.46]
  - - [3584, 2944, 1, 3328]
    - [219, 9046.38]
  - - [128, 1856, 1, 256]
    - [221, 3801.07]
  - - [64, 4288, 1, 256]
    - [165, 2694.43]
  - - [4, 3584, 1, 3328]
    - [240, 576.192]
  - - [64, 4, 1, 3328]
    - [240, 126.486]
  - - [4, 64, 1, 3328]
    - [240, 127.889]
  - - [35, 700, 1, 2560]
    - [137, 2339.0]
  - - [5888, 2944, 1, 256]
    - [226, 10289.6]
  - - [4, 2368, 1, 256]
    - [164, 359.841]
  - - [1856, 64, 1, 256]
    - [167, 2443.55]
  - - [5056, 128, 1, 1280]
    - [221, 7525.48]
  - - [448, 4288, 1, 1280]
    - [228, 9005.58]
  - - [256, 4288, 1, 256]
    - [220, 6138.69]
  - - [1024, 4288, 1, 128]
    - [214, 4421.56]
  - - [4, 1024, 1, 256]
    - [181, 221.295]
  - - [5056, 4288, 1, 256]
    - [230, 10313.1]
  - - [1024, 448, 1, 256]
    - [221, 5302.39]
  - - [1024, 3584, 1, 256]
    - [225, 9053.01]
  - - [2944, 128, 1, 1280]
    - [221, 6148.77]
  - - [49, 2048, 64, 512]
    - [250, 4958.9]
  - - [2560, 32, 1, 2560]
    - [180, 4335.57]
  - - [64, 256, 1, 256]
    - [164, 857.919]
  - - [1024, 4, 1, 512]
    - [202, 416.449]
  - - [128, 2368, 1, 128]
    - [142, 2103.51]
  - - [256, 704, 1, 1280]
    - [221, 4500.34]
  - - [64, 2368, 1, 128]
    - [145, 1558.85]
  - - [176, 1500, 1, 1408]
    - [162, 5508.25]
  - - [448, 5888, 1, 1280]
    - [221, 9141.72]
  - - [512, 3000, 1, 2048]
    - [232, 7276.64]
  - - [5056, 448, 1, 128]
    - [212, 4519.65]
  - - [4288, 704, 1, 1280]
    - [225, 9937.7]
  - - [3584, 2944, 1, 128]
    - [213, 5124.33]
  - - [6784, 256, 1, 1280]
    - [228, 9157.67]
  - - [256, 2944, 1, 1280]
    - [221, 8573.45]
  - - [2560, 128, 1, 2560]
    - [201, 6497.08]
  - - [2368, 5888, 1, 3328]
    - [218, 9102.92]
  - - [4, 64, 1, 256]
    - [181, 20.2062]
  - - [704, 1024, 1, 3328]
    - [228, 8694.69]
  - - [2368, 1856, 1, 1280]
    - [225, 9887.26]
  - - [448, 5056, 1, 3328]
    - [228, 9003.24]
  - - [128, 448, 1, 128]
    - [147, 678.759]
  - - [128, 6784, 1, 256]
    - [221, 4574.65]
  - - [512, 4, 1, 500000]
    - [130, 845.936]
  - - [3584, 4288, 1, 128]
    - [212, 5439.54]
  - - [64, 448, 1, 128]
    - [147, 339.429]
  - - [1024, 6000, 1, 2816]
    - [218, 9876.73]
  - - [5888, 4288, 1, 3328]
    - [219, 9070.91]
  - - [2368, 704, 1, 256]
    - [228, 7913.81]
  - - [256, 1856, 1, 3328]
    - [228, 8046.16]
  - - [1856, 128, 1, 256]
    - [221, 3854.55]
  - - [6784, 128, 1, 128]
    - [140, 3283.34]
  - - [3584, 1408, 1, 128]
    - [212, 4804.32]
  - - [1856, 5056, 1, 1280]
    - [230, 9473.64]
  - - [2944, 1024, 1, 1280]
    - [218, 10204.1]
  - - [5056, 4, 1, 256]
    - [151, 478.819]
  - - [3584, 5888, 1, 3328]
    - [219, 9232.88]
  - - [2368, 4288, 1, 256]
    - [224, 9980.5]
  - - [1024, 2368, 1, 3328]
    - [225, 9177.02]
  - - [128, 3584, 1, 128]
    - [142, 2762.11]
  - - [704, 1408, 1, 256]
    - [228, 7528.82]
  - - [4096, 128, 1, 4096]
    - [231, 7683.68]
  - - [1024, 2944, 1, 128]
    - [214, 4211.23]
  - - [1024, 3584, 1, 1280]
    - [225, 10391.0]
  - - [4288, 5888, 1, 3328]
    - [219, 9018.19]
  - - [4288, 4, 1, 3328]
    - [151, 662.11]
  - - [4608, 16, 1, 1536]
    - [165, 2730.08]
  - - [5888, 64, 1, 128]
    - [141, 2317.34]
  - - [4, 5888, 1, 128]
    - [234, 216.577]
  - - [1024, 2944, 1, 3328]
    - [226, 9783.25]
  - - [2048, 64, 1, 2048]
    - [160, 4910.34]
  - - [6144, 2, 1, 2560]
    - [156, 394.032]
  - - [256, 6784, 1, 1280]
    - [228, 9166.03]
  - - [1856, 3584, 1, 256]
    - [221, 9530.87]
  - - [128, 448, 1, 3328]
    - [193, 4797.57]
  - - [6784, 1856, 1, 128]
    - [212, 5561.63]
  - - [1024, 1500, 1, 2048]
    - [225, 8425.88]
  - - [5056, 128, 1, 256]
    - [228, 6212.72]
  - - [512, 24000, 1, 2816]
    - [219, 9458.95]
  - - [256, 5888, 1, 1280]
    - [225, 8978.3]
  - - [4, 128, 1, 1280]
    - [188, 132.136]
  - - [4288, 6784, 1, 3328]
    - [219, 8959.86]
  - - [6784, 128, 1, 1280]
    - [225, 7843.63]
  - - [64, 1408, 1, 256]
    - [165, 2273.21]
  - - [2368, 1408, 1, 128]
    - [212, 4975.24]
  - - [1856, 448, 1, 256]
    - [228, 6414.28]
  - - [1408, 1024, 1, 128]
    - [212, 3874.62]
  - - [128, 64, 1, 128]
    - [141, 104.182]
  - - [6784, 3584, 1, 3328]
    - [219, 9129.79]
  - - [1760, 7000, 1, 1760]
    - [218, 9443.08]
  - - [1024, 704, 1, 3328]
    - [228, 8641.33]
  - - [64, 64, 1, 128]
    - [141, 49.942]
  - - [2368, 5056, 1, 1280]
    - [218, 9481.75]
  - - [64, 4, 1, 1280]
    - [188, 66.1246]
  - - [1408, 2368, 1, 1280]
    - [225, 9544.85]
  - - [128, 1408, 1, 1280]
    - [200, 5088.59]
  - - [1024, 1, 1, 512]
    - [181, 90.8387]
  - - [4, 1408, 1, 128]
    - [234, 73.8226]
  - - [704, 4288, 1, 128]
    - [212, 4798.82]
  - - [128, 1856, 1, 3328]
    - [189, 6617.02]
  - - [2944, 2944, 1, 256]
    - [224, 9671.62]
  - - [2944, 4, 1, 1280]
    - [155, 596.813]
  - - [5888, 4, 1, 256]
    - [151, 502.522]
  - - [6784, 256, 1, 256]
    - [221, 7845.66]
  - - [256, 5056, 1, 3328]
    - [221, 9564.24]
  - - [128, 4288, 1, 1280]
    - [200, 6052.46]
  - - [5056, 1856, 1, 128]
    - [212, 5547.46]
  - - [1024, 3000, 1, 1536]
    - [232, 10180.5]
  - - [5056, 1024, 1, 3328]
    - [219, 9880.34]
  - - [128, 128, 1, 256]
    - [190, 884.788]
  - - [1760, 64, 1, 1760]
    - [172, 5374.09]
  - - [4288, 3584, 1, 3328]
    - [219, 9286.83]
  - - [448, 704, 1, 3328]
    - [228, 5381.59]
  - - [448, 448, 1, 128]
    - [148, 1716.95]
  - - [1024, 2368, 1, 1280]
    - [225, 9471.1]
  - - [1856, 704, 1, 3328]
    - [228, 9390.93]
  - - [512, 1500, 1, 2560]
    - [228, 8545.23]
  - - [5888, 6784, 1, 3328]
    - [219, 9050.18]
  - - [704, 4288, 1, 1280]
    - [223, 9679.5]
  - - [128, 50176, 1, 512]
    - [245, 7790.75]
  - - [704, 256, 1, 256]
    - [228, 3098.75]
  - - [1024, 48000, 1, 2048]
    - [226, 8933.77]
  - - [4288, 1024, 1, 128]
    - [212, 5147.5]
  - - [3136, 64, 128, 64]
    - [260, 5028.46]
  - - [784, 512, 64, 128]
    - [258, 8705.96]
  - - [3136, 256, 64, 64]
    - [256, 7446.87]
  - - [784, 128, 128, 512]
    - [261, 8613.19]
  - - [784, 128, 64, 512]
    - [259, 8262.32]
  - - [3136, 512, 1, 2048]
    - [257, 8099.01]
  - - [12544, 256, 1, 1024]
    - [265, 9026.15]
  - - [3136, 64, 128, 256]
    - [255, 7293.94]
  - - [3136, 64, 64, 256]
    - [254, 7164.47]
  - - [3136, 2048, 1, 512]
    - [263, 9066.7]
  - - [784, 512, 128, 128]
    - [258, 8905.83]
  - - [3136, 64, 64, 64]
    - [266, 4930.2]
  - - [12544, 1024, 1, 256]
    - [264, 9616.67]
  - - [3136, 256, 128, 64]
    - [262, 7497.8]
- null
