library/src/blas3/Tensile/Logic/asm_full/vega20_Cijk_Ailk_Bjlk_HBH.yaml
- {MinimumRequiredVersion: 4.5.0}
- vega20
- gfx906
- [Device 66a0, Device 66a1, Device 66a7]
    SolutionIndex: 0
    SolutionNameMin: Cijk_Ailk_Bjlk_HBH_MT032x032x08_PGR1_PLR1_TT04_04
    SolutionIndex: 1
    SolutionNameMin: Cijk_Ailk_Bjlk_HBH_MT032x016x16_PGR1_PLR1_TT02_02
    SolutionIndex: 2
    SolutionNameMin: Cijk_Ailk_Bjlk_HBH_MT064x016x32_PGR1_PLR1_TT02_02
    SolutionIndex: 3
    SolutionNameMin: Cijk_Ailk_Bjlk_HBH_MT016x016x64_PGR1_PLR1_TT02_02
    SolutionIndex: 4
    SolutionNameMin: Cijk_Ailk_Bjlk_HBH_MT032x016x64_PGR1_PLR1_TT02_02
    SolutionIndex: 5
    SolutionNameMin: Cijk_Ailk_Bjlk_HBH_MT032x064x08_PGR1_PLR1_TT04_08
    SolutionIndex: 6
    SolutionNameMin: Cijk_Ailk_Bjlk_HBH_MT064x064x16_PGR1_PLR1_TT04_04
    SolutionIndex: 7
    SolutionNameMin: Cijk_Ailk_Bjlk_HBH_MT064x128x16_PGR1_PLR1_TT04_08
    SolutionIndex: 8
    SolutionNameMin: Cijk_Ailk_Bjlk_HBH_MT096x128x16_PGR1_PLR1_TT06_08
    SolutionIndex: 9
    SolutionNameMin: Cijk_Ailk_Bjlk_HBH_MT128x064x16_PGR1_PLR1_TT08_04
    SolutionIndex: 10
    SolutionNameMin: Cijk_Ailk_Bjlk_HBH_MT064x064x32_PGR1_PLR1_TT04_04
    SolutionIndex: 11
    SolutionNameMin: Cijk_Ailk_Bjlk_HBH_MT032x032x32_PGR1_PLR1_TT02_02
    SolutionIndex: 12
    SolutionNameMin: Cijk_Ailk_Bjlk_HBH_MT064x128x04_PGR0_PLR0_TT04_08
    SolutionIndex: 13
    SolutionNameMin: Cijk_Ailk_Bjlk_HBH_MT064x064x04_PGR1_PLR1_TT04_04
    SolutionIndex: 14
    SolutionNameMin: Cijk_Ailk_Bjlk_HBH_MT064x064x08_PGR0_PLR0_TT04_04
    SolutionIndex: 15
    SolutionNameMin: Cijk_Ailk_Bjlk_HBH_MT064x064x16_PGR1_PLR1_TT04_04
    SolutionIndex: 16
    SolutionNameMin: Cijk_Ailk_Bjlk_HBH_MT064x128x04_PGR0_PLR0_TT04_08
    SolutionIndex: 17
    SolutionNameMin: Cijk_Ailk_Bjlk_HBH_MT064x064x04_PGR0_PLR0_TT04_04
    SolutionIndex: 18
    SolutionNameMin: Cijk_Ailk_Bjlk_HBH_MT064x064x04_PGR1_PLR1_TT04_04
    SolutionIndex: 19
    SolutionNameMin: Cijk_Ailk_Bjlk_HBH_MT064x064x16_PGR1_PLR1_TT04_04
    SolutionIndex: 0
    SolutionNameMin: Cijk_Ailk_Bjlk_HBH_MT128x064x08_GRVW04_PGR1_PLR1_TT08_04_VW04_WG16_16_01_WGM01
    SolutionIndex: 1
    SolutionNameMin: Cijk_Ailk_Bjlk_HBH_MT032x128x16_GRVW04_PGR0_PLR1_TT04_04_VW04_WG08_32_01_WGM01
    SolutionIndex: 2
    SolutionNameMin: Cijk_Ailk_Bjlk_HBH_MT032x128x16_GRVW04_PGR1_PLR1_TT04_04_VW04_WG08_32_01_WGM01
    SolutionIndex: 3
    SolutionNameMin: Cijk_Ailk_Bjlk_HBH_MT064x064x16_GRVW04_PGR0_PLR1_TT04_04_VW04_WG16_16_01_WGM01
    SolutionIndex: 4
    SolutionNameMin: Cijk_Ailk_Bjlk_HBH_MT128x064x16_GRVW04_PGR1_PLR1_TT08_04_VW04_WG16_16_01_WGM01
    SolutionIndex: 5
    SolutionNameMin: Cijk_Ailk_Bjlk_HBH_MT032x128x32_GRVW04_PGR0_PLR1_TT04_04_VW04_WG08_32_01_WGM01
    SolutionIndex: 6
    SolutionNameMin: Cijk_Ailk_Bjlk_HBH_MT064x064x32_GRVW04_PGR0_PLR1_TT04_04_VW04_WG16_16_01_WGM01
    SolutionIndex: 7
    SolutionNameMin: Cijk_Ailk_Bjlk_HBH_MT064x256x16_GRVW08_PGR1_PLR1_TT08_08_VW08_WG08_32_01_WGM01
- - - [4096, 7133, 1, 4096]
    - [9, 10420.8]
  - - [512, 16, 1, 512]
    - [1, 289.662]
  - - [2048, 7133, 1, 2048]
    - [9, 10332.5]
  - - [2560, 7133, 1, 2560]
    - [9, 10370.9]
  - - [1024, 1024, 1, 1024]
    - [10, 9007.9]
  - - [3072, 7435, 1, 1024]
    - [9, 10258.1]
  - - [1024, 32, 1, 512]
    - [4, 1248.3]
  - - [1760, 7133, 1, 1760]
    - [0, 10047.7]
  - - [7680, 5481, 1, 2560]
    - [8, 10166.8]
  - - [1024, 16, 1, 512]
    - [3, 631.672]
  - - [512, 32, 1, 512]
    - [3, 627.89]
  - - [3136, 256, 64, 64]
    - [27, 8547.22]
  - - [784, 512, 64, 128]
    - [21, 8599.08]
  - - [784, 128, 128, 512]
    - [25, 9132.1]
  - - [3136, 64, 128, 64]
    - [24, 8187.98]
  - - [196, 256, 128, 1024]
    - [22, 8153.86]
  - - [196, 256, 64, 1024]
    - [22, 7975.08]
  - - [196, 1024, 128, 256]
    - [21, 8065.86]
  - - [3136, 64, 64, 256]
    - [26, 9091.71]
  - - [3136, 64, 128, 256]
    - [23, 9225.36]
  - - [784, 128, 64, 512]
    - [22, 8955.04]
  - - [784, 512, 128, 128]
    - [21, 8676.22]
  - - [196, 1024, 64, 256]
    - [21, 7961.18]
  - - [3136, 64, 64, 64]
    - [20, 8003.03]
  - - [3136, 256, 128, 64]
    - [27, 8598.18]
- - - -1
    - - - 1
        - - - 32
            - - [32, 18]
              - [128, 17]
              - [256, 18]
              - [1856, 17]
              - [2368, 18]
              - [2944, 17]
              - [5056, 18]
              - [5888, 19]
              - [-1, 17]
          - - 64
            - - [128, 17]
              - [704, 18]
              - [1024, 17]
              - [1408, 18]
              - [3584, 17]
              - [4288, 18]
              - [5056, 17]
              - [5888, 19]
              - [-1, 18]
          - - 128
            - - [1408, 17]
              - [1856, 19]
              - [2368, 17]
              - [2944, 18]
              - [3584, 17]
              - [4288, 18]
              - [5056, 17]
              - [5888, 16]
              - [-1, 18]
          - - 256
            - - [64, 16]
              - [1024, 17]
              - [1408, 18]
              - [2368, 19]
              - [2944, 16]
              - [3584, 18]
              - [4288, 16]
              - [5888, 18]
              - [-1, 17]
          - - 448
            - - [1408, 17]
              - [1856, 16]
              - [2368, 17]
              - [2944, 18]
              - [3584, 17]
              - [4288, 18]
              - [5056, 16]
              - [-1, 17]
          - - 704
            - - [32, 17]
              - [64, 18]
              - [128, 19]
              - [1408, 17]
              - [1856, 18]
              - [2368, 16]
              - [2944, 17]
              - [3584, 18]
              - [-1, 17]
          - - 1024
            - - [704, 17]
              - [1408, 18]
              - [2944, 17]
              - [3584, 16]
              - [4288, 17]
              - [-1, 16]
          - - 1408
            - - [32, 18]
              - [128, 17]
              - [448, 18]
              - [2368, 17]
              - [5056, 16]
              - [5888, 17]
              - [-1, 16]
          - - 1856
            - - [64, 17]
              - [256, 18]
              - [448, 17]
              - [704, 18]
              - [-1, 17]
          - - 2368
            - - [64, 17]
              - [128, 18]
              - [256, 17]
              - [448, 18]
              - [1024, 17]
              - [1408, 18]
              - [2944, 17]
              - [3584, 18]
              - [-1, 17]
          - - 2944
            - - [64, 17]
              - [128, 18]
              - [1024, 17]
              - [1408, 16]
              - [2944, 17]
              - [5056, 16]
              - [5888, 17]
              - [-1, 16]
          - - 3584
            - - [64, 17]
              - [128, 18]
              - [256, 17]
              - [448, 18]
              - [1408, 17]
              - [-1, 16]
          - - 4288
            - - [64, 18]
              - [128, 17]
              - [256, 16]
              - [-1, 17]
          - - 5056
            - - [32, 17]
              - [64, 19]
              - [128, 17]
              - [256, 16]
              - [-1, 17]
          - - 5888
            - - [32, 17]
              - [64, 18]
              - [256, 16]
              - [704, 17]
              - [1856, 16]
              - [2368, 17]
              - [-1, 16]
          - - -1
            - - [32, 17]
              - [64, 18]
              - [256, 16]
              - [448, 17]
              - [704, 16]
              - [1024, 17]
              - [-1, 16]
      - - 32
        - - - 32
            - - [32, 14]
              - [1024, 13]
              - [1408, 14]
              - [2944, 13]
              - [3584, 14]
              - [4288, 15]
              - [5056, 13]
              - [5888, 15]
              - [-1, 13]
          - - 64
            - - [256, 13]
              - [448, 14]
              - [4288, 13]
              - [5056, 14]
              - [-1, 13]
          - - 128
            - - [128, 13]
              - [256, 14]
              - [704, 13]
              - [1024, 14]
              - [1856, 13]
              - [2944, 15]
              - [3584, 13]
              - [4288, 15]
              - [5056, 14]
              - [5888, 13]
              - [-1, 14]
          - - 256
            - - [1024, 13]
              - [1856, 15]
              - [2368, 14]
              - [3584, 13]
              - [4288, 14]
              - [5056, 15]
              - [-1, 14]
          - - 448
            - - [448, 13]
              - [704, 15]
              - [1024, 13]
              - [1408, 15]
              - [2368, 14]
              - [2944, 15]
              - [5888, 14]
              - [-1, 12]
          - - 704
            - - [448, 13]
              - [704, 14]
              - [1024, 15]
              - [1408, 14]
              - [1856, 15]
              - [5056, 14]
              - [5888, 12]
              - [-1, 13]
          - - 1024
            - - [32, 13]
              - [128, 14]
              - [256, 15]
              - [704, 13]
              - [-1, 14]
          - - 1408
            - - [32, 13]
              - [128, 14]
              - [256, 13]
              - [448, 14]
              - [704, 15]
              - [2368, 14]
              - [2944, 12]
              - [5056, 14]
              - [5888, 12]
              - [-1, 14]
          - - 1856
            - - [128, 13]
              - [448, 15]
              - [704, 14]
              - [1024, 13]
              - [2944, 14]
              - [3584, 12]
              - [5888, 14]
              - [-1, 12]
          - - 2368
            - - [64, 13]
              - [256, 15]
              - [3584, 14]
              - [4288, 12]
              - [5056, 14]
              - [-1, 12]
          - - 2944
            - - [64, 13]
              - [128, 14]
              - [256, 13]
              - [2368, 14]
              - [2944, 12]
              - [4288, 14]
              - [-1, 12]
          - - 3584
            - - [128, 13]
              - [448, 14]
              - [704, 13]
              - [2944, 14]
              - [3584, 12]
              - [4288, 14]
              - [-1, 12]
          - - 4288
            - - [32, 13]
              - [64, 14]
              - [128, 13]
              - [704, 14]
              - [1024, 12]
              - [1408, 14]
              - [1856, 12]
              - [2944, 14]
              - [-1, 12]
          - - 5056
            - - [32, 13]
              - [2368, 14]
              - [4288, 12]
              - [5056, 14]
              - [-1, 12]
          - - 5888
            - - [32, 13]
              - [64, 14]
              - [128, 13]
              - [256, 14]
              - [448, 13]
              - [1024, 14]
              - [1408, 12]
              - [2368, 14]
              - [-1, 12]
          - - -1
            - - [64, 14]
              - [128, 13]
              - [2368, 14]
              - [-1, 12]
      - - 256
        - - - 1
            - - [128, 18]
              - [256, 19]
              - [2944, 18]
              - [5056, 19]
              - [5888, 18]
              - [-1, 19]
          - - 32
            - - [3584, 13]
              - [-1, 15]
          - - 64
            - - [1, 18]
              - [32, 13]
              - [128, 11]
              - [704, 3]
              - [-1, 11]
          - - 128
            - - [1, 18]
              - [32, 13]
              - [64, 1]
              - [128, 3]
              - [256, 1]
              - [448, 4]
              - [704, 2]
              - [1024, 1]
              - [1408, 2]
              - [1856, 1]
              - [2368, 2]
              - [2944, 1]
              - [3584, 6]
              - [4288, 2]
              - [5056, 6]
              - [5888, 10]
              - [-1, 6]
          - - 256
            - - [1, 18]
              - [32, 13]
              - [64, 3]
              - [128, 4]
              - [448, 2]
              - [704, 0]
              - [1408, 10]
              - [1856, 6]
              - [2944, 10]
              - [3584, 7]
              - [4288, 6]
              - [5056, 10]
              - [5888, 9]
              - [-1, 10]
          - - 448
            - - [1, 18]
              - [32, 13]
              - [64, 3]
              - [128, 4]
              - [448, 1]
              - [704, 6]
              - [1024, 10]
              - [1856, 6]
              - [2368, 10]
              - [2944, 7]
              - [5056, 10]
              - [5888, 6]
              - [-1, 7]
          - - 704
            - - [1, 18]
              - [32, 13]
              - [64, 3]
              - [128, 2]
              - [256, 0]
              - [448, 6]
              - [1408, 10]
              - [1856, 6]
              - [2368, 10]
              - [3584, 7]
              - [4288, 5]
              - [5888, 7]
              - [-1, 6]
          - - 1024
            - - [1, 18]
              - [32, 13]
              - [64, 11]
              - [128, 1]
              - [256, 6]
              - [704, 10]
              - [2944, 9]
              - [3584, 7]
              - [4288, 6]
              - [5056, 9]
              - [-1, 6]
          - - 1408
            - - [1, 18]
              - [32, 13]
              - [64, 11]
              - [128, 2]
              - [256, 6]
              - [448, 10]
              - [704, 9]
              - [1408, 7]
              - [1856, 9]
              - [2368, 6]
              - [2944, 7]
              - [5056, 9]
              - [5888, 7]
              - [-1, 6]
          - - 1856
            - - [1, 18]
              - [32, 13]
              - [64, 11]
              - [128, 2]
              - [704, 6]
              - [1856, 7]
              - [2368, 6]
              - [2944, 10]
              - [3584, 7]
              - [4288, 6]
              - [5056, 5]
              - [-1, 7]
          - - 2368
            - - [1, 18]
              - [32, 13]
              - [64, 11]
              - [128, 2]
              - [448, 6]
              - [704, 10]
              - [1024, 7]
              - [1856, 6]
              - [2368, 7]
              - [3584, 8]
              - [4288, 6]
              - [5056, 5]
              - [-1, 7]
          - - 2944
            - - [1, 18]
              - [32, 13]
              - [64, 11]
              - [128, 2]
              - [256, 10]
              - [704, 9]
              - [1408, 7]
              - [2368, 6]
              - [2944, 9]
              - [3584, 6]
              - [5056, 9]
              - [-1, 7]
          - - 3584
            - - [1, 19]
              - [32, 15]
              - [64, 11]
              - [128, 6]
              - [448, 10]
              - [1024, 9]
              - [1408, 7]
              - [1856, 9]
              - [2368, 6]
              - [2944, 7]
              - [5056, 9]
              - [-1, 7]
          - - 4288
            - - [1, 19]
              - [32, 15]
              - [64, 11]
              - [128, 1]
              - [256, 10]
              - [448, 6]
              - [704, 9]
              - [1024, 6]
              - [1408, 7]
              - [2368, 6]
              - [-1, 7]
          - - 5056
            - - [1, 19]
              - [32, 15]
              - [64, 11]
              - [128, 6]
              - [448, 10]
              - [704, 9]
              - [1408, 7]
              - [2368, 5]
              - [4288, 7]
              - [5056, 5]
              - [-1, 7]
          - - 5888
            - - [1, 18]
              - [32, 15]
              - [64, 11]
              - [128, 10]
              - [256, 7]
              - [448, 10]
              - [704, 9]
              - [1024, 6]
              - [1408, 7]
              - [2944, 9]
              - [3584, 7]
              - [-1, 9]
          - - -1
            - - [1, 19]
              - [32, 15]
              - [64, 11]
              - [256, 10]
              - [448, 9]
              - [704, 10]
              - [1024, 8]
              - [1408, 7]
              - [2368, 9]
              - [2944, 7]
              - [5056, 9]
              - [-1, 7]
      - - 1280
        - - - 1
            - - [-1, 19]
          - - 32
            - - [-1, 15]
          - - 64
            - - [1, 19]
              - [32, 15]
              - [128, 1]
              - [1024, 3]
              - [1408, 4]
              - [2944, 11]
              - [3584, 1]
              - [-1, 11]
          - - 128
            - - [1, 19]
              - [32, 15]
              - [64, 1]
              - [128, 3]
              - [256, 4]
              - [448, 2]
              - [1024, 4]
              - [1408, 2]
              - [1856, 1]
              - [2368, 2]
              - [2944, 1]
              - [3584, 2]
              - [4288, 1]
              - [5056, 2]
              - [-1, 10]
          - - 256
            - - [1, 19]
              - [32, 15]
              - [64, 3]
              - [128, 4]
              - [256, 2]
              - [448, 4]
              - [704, 0]
              - [1024, 10]
              - [1856, 6]
              - [2368, 10]
              - [2944, 6]
              - [4288, 10]
              - [5056, 6]
              - [5888, 10]
              - [-1, 6]
          - - 448
            - - [1, 19]
              - [32, 15]
              - [64, 4]
              - [128, 2]
              - [256, 4]
              - [448, 1]
              - [704, 10]
              - [1024, 6]
              - [1856, 10]
              - [2368, 6]
              - [5888, 10]
              - [-1, 7]
          - - 704
            - - [1, 19]
              - [32, 15]
              - [64, 3]
              - [128, 4]
              - [256, 0]
              - [448, 10]
              - [704, 6]
              - [2368, 10]
              - [2944, 7]
              - [3584, 10]
              - [5888, 7]
              - [-1, 10]
          - - 1024
            - - [1, 19]
              - [32, 15]
              - [64, 3]
              - [128, 4]
              - [256, 10]
              - [704, 6]
              - [1408, 10]
              - [1856, 6]
              - [3584, 9]
              - [4288, 10]
              - [5056, 9]
              - [-1, 10]
          - - 1408
            - - [1, 19]
              - [32, 15]
              - [64, 4]
              - [128, 2]
              - [448, 6]
              - [1024, 10]
              - [1408, 7]
              - [1856, 9]
              - [2368, 10]
              - [2944, 7]
              - [5056, 9]
              - [5888, 7]
              - [-1, 10]
          - - 1856
            - - [1, 19]
              - [32, 15]
              - [64, 4]
              - [128, 1]
              - [256, 6]
              - [704, 10]
              - [1856, 7]
              - [2944, 10]
              - [3584, 7]
              - [4288, 10]
              - [5056, 5]
              - [5888, 7]
              - [-1, 6]
          - - 2368
            - - [1, 19]
              - [32, 15]
              - [64, 11]
              - [128, 2]
              - [704, 10]
              - [1024, 7]
              - [1408, 10]
              - [1856, 6]
              - [2368, 9]
              - [4288, 10]
              - [5056, 5]
              - [-1, 7]
          - - 2944
            - - [1, 19]
              - [32, 15]
              - [64, 11]
              - [128, 2]
              - [448, 10]
              - [704, 9]
              - [1024, 7]
              - [1408, 9]
              - [2368, 6]
              - [2944, 7]
              - [-1, 10]
          - - 3584
            - - [1, 19]
              - [32, 15]
              - [128, 2]
              - [448, 10]
              - [1024, 9]
              - [1408, 7]
              - [1856, 9]
              - [4288, 10]
              - [5056, 9]
              - [5888, 10]
              - [-1, 7]
          - - 4288
            - - [1, 19]
              - [32, 15]
              - [64, 11]
              - [128, 1]
              - [448, 10]
              - [704, 9]
              - [1024, 10]
              - [1408, 7]
              - [5056, 10]
              - [-1, 7]
          - - 5056
            - - [1, 19]
              - [32, 15]
              - [64, 11]
              - [128, 1]
              - [448, 10]
              - [704, 9]
              - [1408, 7]
              - [2368, 5]
              - [2944, 10]
              - [3584, 7]
              - [4288, 9]
              - [5056, 5]
              - [-1, 7]
          - - 5888
            - - [1, 19]
              - [32, 15]
              - [64, 11]
              - [448, 10]
              - [704, 9]
              - [1024, 6]
              - [2368, 9]
              - [2944, 10]
              - [3584, 7]
              - [5888, 9]
              - [-1, 7]
          - - -1
            - - [1, 19]
              - [32, 15]
              - [64, 11]
              - [256, 10]
              - [448, 9]
              - [1856, 10]
              - [2368, 9]
              - [2944, 10]
              - [-1, 9]
      - - -1
        - - - 1
            - - [-1, 19]
          - - 32
            - - [-1, 15]
          - - 64
            - - [1, 19]
              - [32, 15]
              - [64, 3]
              - [128, 1]
              - [256, 3]
              - [448, 4]
              - [1024, 3]
              - [1856, 4]
              - [2944, 11]
              - [3584, 1]
              - [-1, 11]
          - - 128
            - - [1, 19]
              - [32, 15]
              - [64, 1]
              - [128, 3]
              - [256, 4]
              - [448, 3]
              - [1024, 4]
              - [1408, 2]
              - [1856, 1]
              - [3584, 2]
              - [4288, 1]
              - [5056, 2]
              - [-1, 10]
          - - 256
            - - [1, 19]
              - [32, 15]
              - [64, 3]
              - [128, 4]
              - [256, 3]
              - [448, 4]
              - [704, 6]
              - [1024, 10]
              - [1856, 6]
              - [-1, 10]
          - - 448
            - - [1, 19]
              - [32, 15]
              - [128, 3]
              - [256, 4]
              - [448, 1]
              - [1024, 6]
              - [5888, 10]
              - [-1, 7]
          - - 704
            - - [1, 19]
              - [32, 15]
              - [64, 3]
              - [128, 4]
              - [704, 6]
              - [4288, 10]
              - [5888, 7]
              - [-1, 10]
          - - 1024
            - - [1, 19]
              - [32, 15]
              - [64, 3]
              - [128, 4]
              - [256, 10]
              - [448, 6]
              - [2368, 10]
              - [3584, 9]
              - [4288, 10]
              - [5056, 9]
              - [-1, 10]
          - - 1408
            - - [1, 19]
              - [32, 15]
              - [64, 4]
              - [128, 2]
              - [256, 6]
              - [1408, 10]
              - [1856, 9]
              - [2368, 10]
              - [5056, 9]
              - [5888, 7]
              - [-1, 10]
          - - 1856
            - - [1, 19]
              - [32, 15]
              - [64, 4]
              - [128, 2]
              - [256, 6]
              - [1408, 10]
              - [1856, 7]
              - [2944, 10]
              - [3584, 7]
              - [5056, 10]
              - [5888, 7]
              - [-1, 10]
          - - 2368
            - - [1, 19]
              - [32, 15]
              - [64, 11]
              - [128, 2]
              - [1856, 10]
              - [2368, 9]
              - [5056, 10]
              - [-1, 7]
          - - 2944
            - - [1, 19]
              - [32, 15]
              - [64, 11]
              - [128, 2]
              - [1024, 10]
              - [1408, 7]
              - [2368, 10]
              - [2944, 7]
              - [-1, 10]
          - - 3584
            - - [1, 19]
              - [32, 15]
              - [64, 1]
              - [128, 2]
              - [448, 10]
              - [704, 9]
              - [1408, 7]
              - [1856, 9]
              - [4288, 10]
              - [5056, 9]
              - [-1, 10]
          - - 4288
            - - [1, 19]
              - [32, 15]
              - [64, 11]
              - [128, 2]
              - [448, 10]
              - [704, 9]
              - [1024, 10]
              - [1408, 7]
              - [-1, 10]
          - - 5056
            - - [1, 19]
              - [32, 15]
              - [64, 11]
              - [128, 2]
              - [256, 10]
              - [448, 6]
              - [704, 9]
              - [1408, 7]
              - [2944, 10]
              - [3584, 7]
              - [5056, 10]
              - [-1, 7]
          - - 5888
            - - [1, 19]
              - [32, 15]
              - [64, 11]
              - [448, 10]
              - [704, 9]
              - [1024, 10]
              - [2368, 9]
              - [3584, 10]
              - [5056, 9]
              - [5888, 7]
              - [-1, 9]
          - - -1
            - - [1, 19]
              - [32, 15]
              - [64, 11]
              - [256, 10]
              - [448, 9]
              - [1408, 10]
              - [1856, 6]
              - [2368, 10]
              - [2944, 9]
              - [3584, 10]
              - [4288, 5]
              - [5056, 9]
              - [5888, 8]
              - [-1, 9]
