library/src/blas3/Tensile/Logic/asm_full/vega20_Cijk_Ailk_Bljk_DB.yaml
- {MinimumRequiredVersion: 4.6.0}
- vega20
- gfx906
- [Device 66a0, Device 66a1, Device 66a7]
    SolutionIndex: 0
    SolutionNameMin: Cijk_Ailk_Bljk_DB_MT064x064x08_NLCA01_TT04_04_WG16_16_01
    SolutionIndex: 1
    SolutionNameMin: Cijk_Ailk_Bljk_DB_MT064x064x04_NLCA01_TT04_04_WG16_16_01
    SolutionIndex: 2
    SolutionNameMin: Cijk_Ailk_Bljk_DB_MT064x032x08_NLCA01_TT04_04_WG16_08_01
    SolutionIndex: 3
    SolutionNameMin: Cijk_Ailk_Bljk_DB_MT096x032x08_NLCA03_TT06_04_WG16_08_01
    SolutionIndex: 4
    SolutionNameMin: Cijk_Ailk_Bljk_DB_MT032x096x08_NLCA01_TT04_06_WG08_16_01
    SolutionIndex: 5
    SolutionNameMin: Cijk_Ailk_Bljk_DB_MT064x064x08_NLCA01_TT04_04_WG16_16_01
- - - [4296, 4296, 1, 384]
    - [3, 4598.34]
  - - [35784, 35784, 1, 384]
    - [3, 3207.0]
  - - [20424, 20424, 1, 384]
    - [3, 4704.96]
  - - [22728, 22728, 1, 384]
    - [3, 4695.47]
  - - [1, 1, 1, 64]
    - [1, 0.00617776]
  - - [3912, 3912, 1, 384]
    - [3, 4566.87]
  - - [10056, 10056, 1, 384]
    - [3, 4694.67]
  - - [6600, 6600, 1, 384]
    - [3, 4666.0]
  - - [10824, 10824, 1, 384]
    - [3, 4694.46]
  - - [8904, 8904, 1, 384]
    - [3, 4686.58]
  - - [43848, 43848, 1, 384]
    - [3, 3123.05]
  - - [456, 456, 1, 384]
    - [5, 2331.99]
  - - [9672, 9672, 1, 384]
    - [3, 4694.62]
  - - [72, 72, 1, 384]
    - [2, 60.4695]
  - - [18504, 18504, 1, 384]
    - [3, 4705.92]
  - - [25800, 25800, 1, 384]
    - [3, 3798.98]
  - - [36552, 36552, 1, 384]
    - [3, 3091.64]
  - - [6216, 6216, 1, 384]
    - [3, 4648.03]
  - - [32328, 32328, 1, 384]
    - [3, 3125.75]
  - - [13896, 13896, 1, 384]
    - [3, 4709.9]
  - - [11592, 11592, 1, 384]
    - [3, 4700.83]
  - - [19272, 19272, 1, 384]
    - [3, 4703.09]
  - - [12360, 12360, 1, 384]
    - [3, 4704.51]
  - - [840, 840, 1, 384]
    - [3, 3958.95]
  - - [10440, 10440, 1, 384]
    - [3, 4695.37]
  - - [37704, 37704, 1, 384]
    - [4, 3030.33]
  - - [1992, 1992, 1, 384]
    - [3, 4214.34]
  - - [36936, 36936, 1, 384]
    - [3, 3051.74]
  - - [29256, 29256, 1, 384]
    - [3, 2961.57]
  - - [40008, 40008, 1, 384]
    - [3, 3089.08]
  - - [31176, 31176, 1, 384]
    - [3, 3060.78]
  - - [64, 64, 1, 64]
    - [0, 26.11]
  - - [3528, 3528, 1, 384]
    - [3, 4524.74]
  - - [37320, 37320, 1, 384]
    - [3, 3000.22]
  - - [2376, 2376, 1, 384]
    - [3, 4384.41]
  - - [22344, 22344, 1, 384]
    - [3, 4701.94]
  - - [1, 64, 1, 64]
    - [1, 0.390849]
  - - [28488, 28488, 1, 384]
    - [3, 2975.18]
  - - [29640, 29640, 1, 384]
    - [3, 2962.59]
  - - [39240, 39240, 1, 384]
    - [3, 3040.89]
  - - [12744, 12744, 1, 384]
    - [3, 4698.99]
  - - [15432, 15432, 1, 384]
    - [3, 4705.13]
  - - [18120, 18120, 1, 384]
    - [3, 4707.9]
  - - [38088, 38088, 1, 384]
    - [4, 2998.26]
  - - [35016, 35016, 1, 384]
    - [3, 3153.68]
  - - [44232, 44232, 1, 384]
    - [3, 3163.12]
  - - [9288, 9288, 1, 384]
    - [3, 4693.16]
  - - [16968, 16968, 1, 384]
    - [3, 4706.84]
  - - [20040, 20040, 1, 384]
    - [3, 4702.49]
  - - [16584, 16584, 1, 384]
    - [3, 4709.27]
  - - [40776, 40776, 1, 384]
    - [3, 3087.74]
  - - [1608, 1608, 1, 384]
    - [3, 4168.33]
  - - [20808, 20808, 1, 384]
    - [3, 4707.72]
  - - [13512, 13512, 1, 384]
    - [3, 4710.1]
  - - [33864, 33864, 1, 384]
    - [3, 3133.42]
  - - [8136, 8136, 1, 384]
    - [3, 4685.37]
  - - [33096, 33096, 1, 384]
    - [3, 3144.12]
  - - [23496, 23496, 1, 384]
    - [3, 4696.04]
  - - [42696, 42696, 1, 384]
    - [3, 3152.26]
  - - [6984, 6984, 1, 384]
    - [3, 4675.0]
  - - [32712, 32712, 1, 384]
    - [3, 3126.03]
  - - [13128, 13128, 1, 384]
    - [3, 4702.63]
  - - [21960, 21960, 1, 384]
    - [3, 4701.75]
  - - [3144, 3144, 1, 384]
    - [3, 4500.74]
  - - [44616, 44616, 1, 384]
    - [3, 3163.8]
  - - [25032, 25032, 1, 384]
    - [3, 4199.08]
  - - [28872, 28872, 1, 384]
    - [3, 2996.97]
  - - [2760, 2760, 1, 384]
    - [3, 4478.48]
  - - [25416, 25416, 1, 384]
    - [3, 4066.78]
  - - [34632, 34632, 1, 384]
    - [3, 3164.49]
  - - [39624, 39624, 1, 384]
    - [4, 3165.39]
  - - [5064, 5064, 1, 384]
    - [3, 4624.03]
  - - [18888, 18888, 1, 384]
    - [3, 4703.55]
  - - [64, 1, 1, 64]
    - [1, 0.392356]
  - - [24264, 24264, 1, 384]
    - [3, 4599.3]
  - - [34248, 34248, 1, 384]
    - [3, 3186.55]
  - - [30792, 30792, 1, 384]
    - [3, 3050.84]
  - - [5832, 5832, 1, 384]
    - [3, 4649.99]
  - - [33480, 33480, 1, 384]
    - [3, 3149.67]
  - - [5448, 5448, 1, 384]
    - [3, 4634.15]
  - - [26184, 26184, 1, 384]
    - [3, 3359.69]
  - - [7752, 7752, 1, 384]
    - [3, 4680.79]
  - - [31560, 31560, 1, 384]
    - [3, 3079.0]
  - - [23880, 23880, 1, 384]
    - [3, 4634.2]
  - - [1224, 1224, 1, 384]
    - [3, 4251.41]
  - - [35400, 35400, 1, 384]
    - [3, 3166.09]
  - - [42312, 42312, 1, 384]
    - [3, 3159.74]
  - - [41544, 41544, 1, 384]
    - [3, 3113.45]
  - - [43080, 43080, 1, 384]
    - [3, 3151.15]
  - - [21576, 21576, 1, 384]
    - [3, 4701.11]
  - - [43464, 43464, 1, 384]
    - [3, 3158.1]
  - - [41928, 41928, 1, 384]
    - [3, 3122.92]
  - - [7368, 7368, 1, 384]
    - [3, 4673.53]
  - - [31944, 31944, 1, 384]
    - [3, 3087.3]
  - - [26952, 26952, 1, 384]
    - [3, 3041.54]
  - - [15816, 15816, 1, 384]
    - [3, 4706.85]
  - - [8520, 8520, 1, 384]
    - [3, 4689.97]
  - - [41160, 41160, 1, 384]
    - [3, 3088.58]
  - - [19656, 19656, 1, 384]
    - [3, 4702.65]
  - - [14664, 14664, 1, 384]
    - [3, 4706.96]
  - - [30408, 30408, 1, 384]
    - [3, 3014.58]
  - - [24648, 24648, 1, 384]
    - [3, 4394.8]
  - - [38856, 38856, 1, 384]
    - [3, 3054.51]
  - - [17352, 17352, 1, 384]
    - [3, 4707.67]
  - - [38472, 38472, 1, 384]
    - [3, 3008.21]
  - - [36168, 36168, 1, 384]
    - [3, 3154.64]
  - - [45000, 45000, 1, 384]
    - [3, 3184.02]
  - - [21192, 21192, 1, 384]
    - [3, 4705.72]
  - - [27336, 27336, 1, 384]
    - [3, 3040.04]
  - - [16200, 16200, 1, 384]
    - [3, 4708.16]
  - - [40392, 40392, 1, 384]
    - [3, 3052.22]
  - - [11976, 11976, 1, 384]
    - [3, 4706.32]
  - - [11208, 11208, 1, 384]
    - [3, 4699.99]
  - - [17736, 17736, 1, 384]
    - [3, 4705.66]
  - - [26568, 26568, 1, 384]
    - [3, 3138.04]
  - - [15048, 15048, 1, 384]
    - [3, 4708.06]
  - - [23112, 23112, 1, 384]
    - [3, 4696.95]
  - - [30024, 30024, 1, 384]
    - [3, 3005.26]
  - - [14280, 14280, 1, 384]
    - [3, 4709.22]
  - - [28104, 28104, 1, 384]
    - [3, 2981.82]
  - - [4680, 4680, 1, 384]
    - [3, 4595.22]
  - - [27720, 27720, 1, 384]
    - [4, 3004.44]
- null
