library/src/blas3/Tensile/Logic/asm_full/vega20_Cijk_Ailk_Bljk_SB.yaml
- {MinimumRequiredVersion: 4.3.0}
- vega20
- gfx906
- [Device 66a0, Device 66a7]
    SolutionIndex: 0
    SolutionNameMin: Cijk_Ailk_Bljk_SB_MT128x008x32_DTL0_GRVW02_LPB00_PGR0_TT04_02_VW02_WG32_04_02
    SolutionIndex: 1
    SolutionNameMin: Cijk_Ailk_Bljk_SB_MT128x008x32_DTL0_GRVW02_LPB00_PGR0_TT04_02_VW02_WG32_04_02
    SolutionIndex: 2
    SolutionNameMin: Cijk_Ailk_Bljk_SB_MT128x016x16_DTL0_GRVW02_LPB00_PGR1_TT08_02_VW02_WG16_08_02
    SolutionIndex: 3
    SolutionNameMin: Cijk_Ailk_Bljk_SB_MT064x008x32_DTL0_GRVW02_LPB00_PGR0_TT04_02_VW02_WG16_04_04
    SolutionIndex: 4
    SolutionNameMin: Cijk_Ailk_Bljk_SB_MT128x008x32_DTL0_GRVW02_LPB00_PGR0_TT08_02_VW02_WG16_04_04
    SolutionIndex: 5
    SolutionNameMin: Cijk_Ailk_Bljk_SB_MT064x008x32_DTL0_GRVW02_LPB00_PGR0_TT02_02_VW02_WG32_04_02
    SolutionIndex: 6
    SolutionNameMin: Cijk_Ailk_Bljk_SB_MT064x004x64_DTL0_GRVW02_LPB00_PGR0_TT04_02_VW02_WG16_02_08
    SolutionIndex: 7
    SolutionNameMin: Cijk_Ailk_Bljk_SB_MT128x008x32_DTL0_GRVW04_LPB00_PGR0_TT04_04_VW04_WG32_02_04
    SolutionIndex: 8
    SolutionNameMin: Cijk_Ailk_Bljk_SB_MT128x016x16_DTL0_GRVW04_LPB00_PGR1_TT04_04_VW04_WG32_04_02
    SolutionIndex: 9
    SolutionNameMin: Cijk_Ailk_Bljk_SB_MT036x048x16_DTL0_GRVW01_LPB00_PGR1_TT03_03_VW01_WG12_16_01
    SolutionIndex: 10
    SolutionNameMin: Cijk_Ailk_Bljk_SB_MT048x036x16_DTL0_GRVW01_LPB00_PGR1_TT06_03_VW01_WG08_12_02
    SolutionIndex: 11
    SolutionNameMin: Cijk_Ailk_Bljk_SB_MT048x024x32_DTL0_GRVW02_LPB00_PGR1_TT06_04_VW02_WG08_06_04
    SolutionIndex: 12
    SolutionNameMin: Cijk_Ailk_Bljk_SB_MT048x048x16_DTL0_GRVW01_LPB00_PGR1_TT03_03_VW01_WG16_16_01
    SolutionIndex: 13
    SolutionNameMin: Cijk_Ailk_Bljk_SB_MT048x096x08_DTL0_GRVW02_LPB00_PGR1_TT04_06_VW02_WG12_16_01
    SolutionIndex: 14
    SolutionNameMin: Cijk_Ailk_Bljk_SB_MT032x016x08_DTL0_GRVW02_LPB00_PGR1_TT02_02_VW02_WG16_08_01
    SolutionIndex: 15
    SolutionNameMin: Cijk_Ailk_Bljk_SB_MT032x032x16_DTL0_GRVW04_LPB00_PGR1_TT04_04_VW04_WG08_08_02
    SolutionIndex: 16
    SolutionNameMin: Cijk_Ailk_Bljk_SB_MT032x032x16_DTL0_GRVW04_LPB00_PGR1_TT04_04_VW04_WG08_08_02
    SolutionIndex: 17
    SolutionNameMin: Cijk_Ailk_Bljk_SB_MT064x016x32_DTL0_GRVW04_LPB00_PGR1_TT04_04_VW04_WG16_04_04
    SolutionIndex: 18
    SolutionNameMin: Cijk_Ailk_Bljk_SB_MT016x016x16_DTL0_GRVW02_LPB00_PGR1_TT02_02_VW02_WG08_08_04
    SolutionIndex: 19
    SolutionNameMin: Cijk_Ailk_Bljk_SB_MT016x016x16_DTL0_GRVW02_LPB00_PGR1_TT02_02_VW02_WG08_08_02
    SolutionIndex: 20
    SolutionNameMin: Cijk_Ailk_Bljk_SB_MT128x016x16_DTL0_GRVW04_LPB00_PGR1_TT04_04_VW04_WG32_04_02
    SolutionIndex: 21
    SolutionNameMin: Cijk_Ailk_Bljk_SB_MT128x016x16_DTL0_GRVW04_LPB00_PGR1_TT04_04_VW04_WG32_04_02
    SolutionIndex: 22
    SolutionNameMin: Cijk_Ailk_Bljk_SB_MT128x032x32_DTL0_GRVW04_LPB00_PGR1_TT08_04_VW04_WG16_08_02
    SolutionIndex: 23
    SolutionNameMin: Cijk_Ailk_Bljk_SB_MT016x016x16_DTL0_GRVW02_LPB00_PGR1_TT02_02_VW02_WG08_08_04
    SolutionIndex: 24
    SolutionNameMin: Cijk_Ailk_Bljk_SB_MT064x008x32_DTL0_GRVW02_LPB00_PGR1_TT04_02_VW02_WG16_04_04
    SolutionIndex: 25
    SolutionNameMin: Cijk_Ailk_Bljk_SB_MT032x032x32_DTL0_GRVW04_LPB00_PGR1_TT04_04_VW04_WG08_08_04
    SolutionIndex: 26
    SolutionNameMin: Cijk_Ailk_Bljk_SB_MT032x016x16_DTL0_GRVW02_LPB00_PGR1_TT04_02_VW02_WG08_08_04
    SolutionIndex: 27
    SolutionNameMin: Cijk_Ailk_Bljk_SB_MT064x032x16_DTL0_GRVW04_LPB00_PGR1_TT04_04_VW04_WG16_08_02
    SolutionIndex: 28
    SolutionNameMin: Cijk_Ailk_Bljk_SB_MT064x032x16_DTL0_GRVW04_LPB00_PGR1_TT04_04_VW04_WG16_08_02
    SolutionIndex: 29
    SolutionNameMin: Cijk_Ailk_Bljk_SB_MT064x032x16_DTL0_GRVW04_LPB00_PGR1_TT04_04_VW04_WG16_08_02
    SolutionIndex: 30
    SolutionNameMin: Cijk_Ailk_Bljk_SB_MT256x032x16_DTL0_GRVW04_LPB00_PGR1_TT08_08_VW04_WG32_04_02
    SolutionIndex: 31
    SolutionNameMin: Cijk_Ailk_Bljk_SB_MT032x016x16_DTL0_GRVW02_LPB00_PGR1_TT04_02_VW02_WG08_08_04
    SolutionIndex: 32
    SolutionNameMin: Cijk_Ailk_Bljk_SB_MT128x032x16_DTL0_GRVW04_LPB00_PGR1_TT08_04_VW04_WG16_08_02
    SolutionIndex: 33
    SolutionNameMin: Cijk_Ailk_Bljk_SB_MT128x032x16_DTL0_GRVW04_LPB00_PGR1_TT08_04_VW04_WG16_08_02
    SolutionIndex: 34
    SolutionNameMin: Cijk_Ailk_Bljk_SB_MT128x016x32_DTL0_GRVW04_LPB00_PGR1_TT04_04_VW04_WG32_04_02
    SolutionIndex: 35
    SolutionNameMin: Cijk_Ailk_Bljk_SB_MT064x016x16_DTL0_GRVW02_LPB00_PGR1_TT04_02_VW02_WG16_08_02
    SolutionIndex: 36
    SolutionNameMin: Cijk_Ailk_Bljk_SB_MT128x016x16_DTL0_GRVW04_LPB00_PGR1_TT08_04_VW04_WG16_04_04
    SolutionIndex: 37
    SolutionNameMin: Cijk_Ailk_Bljk_SB_MT032x016x08_DTL0_GRVW02_LPB00_PGR1_TT04_02_VW02_WG08_08_02
    SolutionIndex: 38
    SolutionNameMin: Cijk_Ailk_Bljk_SB_MT064x016x16_DTL0_GRVW02_LPB00_PGR1_TT04_02_VW02_WG16_08_02
    SolutionIndex: 39
    SolutionNameMin: Cijk_Ailk_Bljk_SB_MT032x008x32_DTL0_GRVW02_LPB00_PGR1_TT02_02_VW02_WG16_04_04
    SolutionIndex: 40
    SolutionNameMin: Cijk_Ailk_Bljk_SB_MT032x008x32_DTL0_GRVW02_LPB00_PGR1_TT02_02_VW02_WG16_04_04
    SolutionIndex: 41
    SolutionNameMin: Cijk_Ailk_Bljk_SB_MT032x016x16_DTL0_GRVW02_LPB00_PGR1_TT04_02_VW02_WG08_08_02
    SolutionIndex: 42
    SolutionNameMin: Cijk_Ailk_Bljk_SB_MT064x016x32_DTL0_GRVW02_LPB00_PGR1_TT04_02_VW02_WG16_08_02
    SolutionIndex: 43
    SolutionNameMin: Cijk_Ailk_Bljk_SB_MT032x008x32_DTL0_GRVW02_LPB00_PGR1_TT02_02_VW02_WG16_04_04
    SolutionIndex: 44
    SolutionNameMin: Cijk_Ailk_Bljk_SB_MT032x016x32_DTL0_GRVW02_LPB00_PGR1_TT04_02_VW02_WG08_08_04
    SolutionIndex: 45
    SolutionNameMin: Cijk_Ailk_Bljk_SB_MT032x008x32_DTL0_GRVW02_LPB00_PGR1_TT02_02_VW02_WG16_04_04
    SolutionIndex: 46
    SolutionNameMin: Cijk_Ailk_Bljk_SB_MT128x032x16_DTL0_GRVW04_LPB00_PGR1_TT08_04_VW04_WG16_08_02
    SolutionIndex: 47
    SolutionNameMin: Cijk_Ailk_Bljk_SB_MT128x032x16_DTL0_GRVW04_LPB00_PGR1_TT08_04_VW04_WG16_08_02
    SolutionIndex: 48
    SolutionNameMin: Cijk_Ailk_Bljk_SB_MT032x008x32_DTL0_GRVW02_LPB00_PGR1_TT02_02_VW02_WG16_04_04
    SolutionIndex: 49
    SolutionNameMin: Cijk_Ailk_Bljk_SB_MT032x008x32_DTL0_GRVW02_LPB00_PGR1_TT02_02_VW02_WG16_04_04
    SolutionIndex: 50
    SolutionNameMin: Cijk_Ailk_Bljk_SB_MT064x064x08_DTL0_GRVW04_LPB00_PGR1_TT04_04_VW04_WG16_16_01
    SolutionIndex: 51
    SolutionNameMin: Cijk_Ailk_Bljk_SB_MT128x096x16_DTL0_GRVW02_LPB00_PGR0_TT08_06_VW02_WG16_16_01
    SolutionIndex: 52
    SolutionNameMin: Cijk_Ailk_Bljk_SB_MT128x064x16_DTL0_GRVW04_LPB00_PGR1_TT08_04_VW04_WG16_16_01
    SolutionIndex: 53
    SolutionNameMin: Cijk_Ailk_Bljk_SB_MT128x064x16_DTL0_GRVW04_LPB00_PGR1_TT08_04_VW04_WG16_16_01
    SolutionIndex: 54
    SolutionNameMin: Cijk_Ailk_Bljk_SB_MT128x064x08_DTL0_GRVW04_LPB00_PGR1_TT08_04_VW04_WG16_16_01
    SolutionIndex: 55
    SolutionNameMin: Cijk_Ailk_Bljk_SB_MT128x064x08_DTL0_GRVW04_LPB00_PGR1_TT08_04_VW04_WG16_16_01
    SolutionIndex: 56
    SolutionNameMin: Cijk_Ailk_Bljk_SB_MT128x064x16_DTL0_GRVW04_LPB00_PGR0_TT08_04_VW04_WG16_16_01
    SolutionIndex: 57
    SolutionNameMin: Cijk_Ailk_Bljk_SB_MT128x128x16_DTL0_GRVW04_LPB00_PGR1_TT08_08_VW04_WG16_16_01
    SolutionIndex: 58
    SolutionNameMin: Cijk_Ailk_Bljk_SB_MT064x128x16_DTL0_GRVW04_LPB00_PGR1_TT04_08_VW04_WG16_16_01
    SolutionIndex: 59
    SolutionNameMin: Cijk_Ailk_Bljk_SB_MT128x128x16_DTL0_GRVW04_LPB00_PGR1_TT08_08_VW04_WG16_16_01
    SolutionIndex: 60
    SolutionNameMin: Cijk_Ailk_Bljk_SB_MT064x064x16_DTL0_GRVW04_LPB00_PGR1_TT04_04_VW04_WG16_16_01
    SolutionIndex: 61
    SolutionNameMin: Cijk_Ailk_Bljk_SB_MT064x064x16_DTL0_GRVW04_LPB00_PGR1_TT04_04_VW04_WG16_16_01
    SolutionIndex: 62
    SolutionNameMin: Cijk_Ailk_Bljk_SB_MT016x016x04_DTL0_GRVW02_LPB00_PGR1_TT02_02_VW02_WG08_08_01
    SolutionIndex: 63
    SolutionNameMin: Cijk_Ailk_Bljk_SB_MT016x016x04_DTL0_GRVW02_LPB00_PGR1_TT02_02_VW02_WG08_08_01
    SolutionIndex: 64
    SolutionNameMin: Cijk_Ailk_Bljk_SB_MT128x032x16_DTL0_GRVW04_LPB04_PGR1_TT04_04_VW04_WG32_08_01
    SolutionIndex: 65
    SolutionNameMin: Cijk_Ailk_Bljk_SB_MT128x064x08_DTL0_GRVW04_LPB00_PGR1_TT04_08_VW04_WG32_08_01
    SolutionIndex: 66
    SolutionNameMin: Cijk_Ailk_Bljk_SB_MT128x064x08_DTL0_GRVW04_LPB04_PGR1_TT04_08_VW04_WG32_08_01
    SolutionIndex: 67
    SolutionNameMin: Cijk_Ailk_Bljk_SB_MT064x064x08_DTL0_GRVW04_LPB04_PGR1_TT04_04_VW04_WG16_16_01
    SolutionIndex: 68
    SolutionNameMin: Cijk_Ailk_Bljk_SB_MT128x064x16_DTL0_GRVW04_LPB04_PGR1_TT04_04_VW02_WG32_16_01
    SolutionIndex: 69
    SolutionNameMin: Cijk_Ailk_Bljk_SB_MT128x032x16_DTL0_GRVW04_LPB04_PGR1_TT04_04_VW04_WG32_08_01
    SolutionIndex: 70
    SolutionNameMin: Cijk_Ailk_Bljk_SB_MT128x064x16_DTL0_GRVW04_LPB04_PGR1_TT04_04_VW04_WG32_16_01
    SolutionIndex: 71
    SolutionNameMin: Cijk_Ailk_Bljk_SB_MT128x032x16_DTL0_GRVW04_LPB02_PGR0_TT04_04_VW02_WG32_08_01
    SolutionIndex: 72
    SolutionNameMin: Cijk_Ailk_Bljk_SB_MT128x032x16_DTL0_GRVW04_LPB04_PGR0_TT04_04_VW04_WG32_08_01
    SolutionIndex: 73
    SolutionNameMin: Cijk_Ailk_Bljk_SB_MT064x064x16_DTL0_GRVW04_LPB00_PGR0_TT04_04_VW04_WG16_16_01
    SolutionIndex: 74
    SolutionNameMin: Cijk_Ailk_Bljk_SB_MT064x064x16_DTL0_GRVW01_LPB04_PGR0_TT04_04_VW02_WG16_16_01
    SolutionIndex: 75
    SolutionNameMin: Cijk_Ailk_Bljk_SB_MT032x128x16_DTL0_GRVW04_LPB04_PGR0_TT04_04_VW04_WG08_32_01
    SolutionIndex: 76
    SolutionNameMin: Cijk_Ailk_Bljk_SB_MT128x032x16_DTL0_GRVW01_LPB04_PGR0_TT04_04_VW04_WG32_08_01
    SolutionIndex: 77
    SolutionNameMin: Cijk_Ailk_Bljk_SB_MT064x064x16_DTL0_GRVW04_LPB04_PGR0_TT04_04_VW04_WG16_16_01
    SolutionIndex: 78
    SolutionNameMin: Cijk_Ailk_Bljk_SB_MT064x064x16_DTL0_GRVW01_LPB02_PGR0_TT04_04_VW02_WG16_16_01
    SolutionIndex: 0
    SolutionNameMin: Cijk_Ailk_Bljk_SB_MT064x064x16_DTL0_GRVW02_GSU04_PGR1_PLR1_TT04_04_VW02_WG16_16_01_WGM01
    SolutionIndex: 1
    SolutionNameMin: Cijk_Ailk_Bljk_SB_MT064x064x08_DTL0_GRVW04_GSU01_PGR1_PLR1_TT04_08_VW04_WG16_08_01_WGM01
    SolutionIndex: 2
    SolutionNameMin: Cijk_Ailk_Bljk_SB_MT064x128x08_DTL0_GRVW04_GSU01_PGR1_PLR1_TT08_04_VW04_WG08_32_01_WGM01
    SolutionIndex: 3
    SolutionNameMin: Cijk_Ailk_Bljk_SB_MT128x064x08_DTL0_GRVW04_GSU01_PGR1_PLR1_TT08_04_VW04_WG16_16_01_WGM01
    SolutionIndex: 4
    SolutionNameMin: Cijk_Ailk_Bljk_SB_MT128x064x08_DTL0_GRVW04_GSU01_PGR1_PLR1_TT04_08_VW04_WG32_08_01_WGM08
    SolutionIndex: 5
    SolutionNameMin: Cijk_Ailk_Bljk_SB_MT064x064x16_DTL0_GRVW04_GSU01_PGR0_PLR0_TT04_04_VW04_WG16_16_01_WGM01
    SolutionIndex: 6
    SolutionNameMin: Cijk_Ailk_Bljk_SB_MT064x064x16_DTL0_GRVW04_GSU01_PGR1_PLR1_TT04_04_VW04_WG16_16_01_WGM01
    SolutionIndex: 7
    SolutionNameMin: Cijk_Ailk_Bljk_SB_MT128x064x16_DTL0_GRVW04_GSU01_PGR1_PLR1_TT04_08_VW04_WG32_08_01_WGM01
    SolutionIndex: 8
    SolutionNameMin: Cijk_Ailk_Bljk_SB_MT128x064x16_DTL0_GRVW04_GSU01_PGR1_PLR1_TT08_04_VW04_WG16_16_01_WGM08
    SolutionIndex: 9
    SolutionNameMin: Cijk_Ailk_Bljk_SB_MT128x064x16_DTL0_GRVW04_GSU01_PGR1_PLR1_TT08_04_VW04_WG16_16_01_WGM64
- - - [4096, 7000, 1, 4096]
    - [54, 9010.41]
  - - [5124, 9124, 1, 1760]
    - [54, 9058.54]
  - - [5124, 9124, 1, 2560]
    - [54, 8965.63]
  - - [1760, 32, 1, 1760]
    - [25, 3601.86]
  - - [1024, 1500, 1, 1536]
    - [52, 7887.34]
  - - [512, 24000, 1, 1536]
    - [57, 8834.2]
  - - [3072, 24000, 1, 1024]
    - [54, 9048.07]
  - - [1024, 3000, 1, 2560]
    - [57, 8491.93]
  - - [512, 3136, 1, 2048]
    - [69, 6624.26]
  - - [7680, 4, 1, 2560]
    - [21, 1222.68]
  - - [35, 1500, 1, 2048]
    - [12, 2192.45]
  - - [8448, 1500, 1, 2816]
    - [54, 8929.89]
  - - [2560, 7000, 1, 2560]
    - [54, 9048.23]
  - - [3072, 16, 1, 1024]
    - [41, 1953.87]
  - - [512, 48000, 1, 2048]
    - [52, 8644.36]
  - - [1760, 64, 1, 1760]
    - [16, 4649.25]
  - - [1024, 16, 1, 512]
    - [18, 944.663]
  - - [196, 256, 64, 1024]
    - [71, 5399.13]
  - - [512, 48000, 1, 1536]
    - [55, 9109.65]
  - - [2560, 32, 1, 2560]
    - [29, 4174.23]
  - - [4608, 1500, 1, 1536]
    - [57, 8416.85]
  - - [2048, 128, 1, 2048]
    - [33, 5300.78]
  - - [1024, 24000, 1, 2560]
    - [55, 9155.29]
  - - [4608, 3000, 1, 1536]
    - [54, 8893.18]
  - - [5124, 9124, 1, 2048]
    - [54, 8758.53]
  - - [1024, 700, 1, 512]
    - [60, 5734.31]
  - - [3072, 1, 1, 128]
    - [26, 61.44]
  - - [5124, 700, 1, 2560]
    - [61, 7760.37]
  - - [8448, 16, 1, 2816]
    - [38, 3880.78]
  - - [6144, 6000, 1, 2560]
    - [55, 9162.61]
  - - [4608, 32, 1, 1536]
    - [27, 3981.86]
  - - [35, 8457, 1, 2560]
    - [9, 3775.09]
  - - [3072, 64, 1, 1024]
    - [33, 3519.63]
  - - [512, 16, 1, 512]
    - [18, 631.672]
  - - [7680, 2, 1, 2560]
    - [20, 614.39]
  - - [4224, 1, 1, 128]
    - [41, 76.8]
  - - [7680, 1, 1, 2560]
    - [21, 312.27]
  - - [128, 1500, 1, 1280]
    - [16, 4388.49]
  - - [35, 8457, 1, 4096]
    - [10, 3753.96]
  - - [1024, 1500, 1, 2816]
    - [54, 8151.13]
  - - [6144, 2, 1, 2560]
    - [1, 540.127]
  - - [8448, 48000, 1, 2816]
    - [55, 9399.38]
  - - [512, 6000, 1, 1536]
    - [57, 8388.79]
  - - [4224, 1500, 1, 176]
    - [55, 7761.14]
  - - [1024, 6000, 1, 2816]
    - [55, 8804.17]
  - - [512, 6000, 1, 2560]
    - [57, 8484.6]
  - - [512, 32, 1, 512]
    - [40, 1092.27]
  - - [2560, 128, 1, 2560]
    - [28, 5515.85]
  - - [4608, 24000, 1, 1536]
    - [54, 9286.56]
  - - [512, 2, 1, 500000]
    - [0, 676.451]
  - - [7680, 48000, 1, 2560]
    - [55, 9379.18]
  - - [3072, 48000, 1, 1024]
    - [54, 9147.8]
  - - [1760, 16, 1, 1760]
    - [42, 2488.03]
  - - [512, 3000, 1, 2816]
    - [55, 8175.78]
  - - [1760, 7000, 1, 1760]
    - [55, 8722.28]
  - - [64, 193600, 1, 256]
    - [67, 6927.96]
  - - [1024, 3000, 1, 2048]
    - [52, 7815.75]
  - - [6144, 4, 1, 2560]
    - [4, 1028.0]
  - - [1024, 6000, 1, 2048]
    - [52, 8194.02]
  - - [512, 24000, 1, 2816]
    - [55, 9020.84]
  - - [6144, 48000, 1, 2560]
    - [55, 9359.91]
  - - [8448, 3000, 1, 2816]
    - [54, 9175.21]
  - - [35, 1500, 1, 2560]
    - [9, 2921.71]
  - - [3072, 4, 1, 1024]
    - [48, 759.838]
  - - [4608, 48000, 1, 1536]
    - [54, 9311.04]
  - - [2048, 32, 1, 2048]
    - [17, 3183.49]
  - - [7680, 1500, 1, 2560]
    - [54, 8715.39]
  - - [4096, 128, 1, 4096]
    - [32, 6279.1]
  - - [4608, 16, 1, 1536]
    - [20, 2803.09]
  - - [1024, 1500, 1, 2048]
    - [52, 7077.22]
  - - [3072, 3000, 1, 1024]
    - [52, 8221.0]
  - - [3072, 2, 1, 1024]
    - [49, 391.26]
  - - [8448, 1, 1, 2816]
    - [3, 312.359]
  - - [1024, 48000, 1, 2560]
    - [55, 9231.1]
  - - [1024, 3000, 1, 2816]
    - [54, 8594.93]
  - - [128, 1, 1, 1408]
    - [43, 29.2571]
  - - [35, 8457, 1, 1760]
    - [13, 3941.76]
  - - [1024, 2, 1, 512]
    - [39, 161.817]
  - - [1024, 4, 1, 500000]
    - [8, 1200.4]
  - - [6144, 1, 1, 2560]
    - [4, 273.442]
  - - [1024, 48000, 1, 2816]
    - [55, 9238.47]
  - - [512, 48000, 1, 2816]
    - [54, 9278.21]
  - - [2048, 16, 1, 2048]
    - [44, 2267.15]
  - - [1024, 24000, 1, 1536]
    - [55, 8978.26]
  - - [64, 193600, 1, 64]
    - [61, 6985.3]
  - - [7680, 6000, 1, 2560]
    - [54, 9209.19]
  - - [1760, 128, 1, 1760]
    - [16, 5300.64]
  - - [35, 8457, 1, 2048]
    - [12, 3319.03]
  - - [512, 1500, 1, 2816]
    - [60, 7396.23]
  - - [512, 1, 1, 512]
    - [6, 47.4856]
  - - [512, 16, 1, 500000]
    - [2, 4815.13]
  - - [512, 8, 1, 500000]
    - [0, 2618.09]
  - - [512, 24000, 1, 2560]
    - [57, 8897.77]
  - - [6144, 3000, 1, 2560]
    - [54, 8993.28]
  - - [1024, 24000, 1, 2816]
    - [54, 9167.01]
  - - [2048, 7000, 1, 2048]
    - [59, 8698.45]
  - - [7680, 3000, 1, 2560]
    - [54, 9056.03]
  - - [1024, 4, 1, 512]
    - [31, 273.067]
  - - [5124, 700, 1, 2048]
    - [52, 7249.39]
  - - [5124, 9124, 1, 4096]
    - [54, 8857.81]
  - - [4096, 64, 1, 4096]
    - [30, 6040.32]
  - - [256, 193600, 1, 64]
    - [66, 7959.99]
  - - [512, 6000, 1, 2048]
    - [52, 7343.55]
  - - [7680, 32, 1, 2560]
    - [32, 5740.3]
  - - [2560, 64, 1, 2560]
    - [27, 4774.88]
  - - [3072, 128, 1, 1024]
    - [53, 4489.84]
  - - [8448, 6000, 1, 2816]
    - [55, 9309.93]
  - - [7680, 64, 1, 2560]
    - [33, 5899.63]
  - - [5124, 1500, 1, 2560]
    - [57, 8283.05]
  - - [1024, 1500, 1, 2560]
    - [53, 7937.87]
  - - [3025, 64, 64, 64]
    - [73, 6789.17]
  - - [512, 4, 1, 512]
    - [39, 177.124]
  - - [1024, 6000, 1, 2560]
    - [57, 8729.86]
  - - [3072, 32, 1, 1024]
    - [20, 2905.94]
  - - [35, 700, 1, 2560]
    - [11, 2312.64]
  - - [196, 1024, 64, 256]
    - [75, 6485.27]
  - - [512, 50176, 1, 128]
    - [66, 8513.59]
  - - [4608, 1, 1, 1536]
    - [3, 249.921]
  - - [49, 512, 64, 2048]
    - [74, 3349.11]
  - - [4096, 32, 1, 4096]
    - [46, 5390.19]
  - - [7680, 24000, 1, 2560]
    - [55, 9357.87]
  - - [8448, 4, 1, 2816]
    - [3, 1190.65]
  - - [64, 1, 1, 1216]
    - [45, 11.8634]
  - - [512, 1, 1, 500000]
    - [7, 341.219]
  - - [176, 1500, 1, 1408]
    - [15, 4586.72]
  - - [512, 3000, 1, 1536]
    - [52, 7828.73]
  - - [8448, 24000, 1, 2816]
    - [55, 9382.14]
  - - [4608, 2, 1, 1536]
    - [5, 487.449]
  - - [1024, 48000, 1, 1536]
    - [57, 9174.03]
  - - [7680, 128, 1, 2560]
    - [52, 7541.79]
  - - [3072, 6000, 1, 1024]
    - [59, 8649.59]
  - - [3072, 1500, 1, 128]
    - [55, 6988.35]
  - - [2048, 3136, 1, 512]
    - [70, 8088.07]
  - - [3025, 256, 64, 64]
    - [73, 7566.55]
  - - [1024, 3000, 1, 1536]
    - [57, 8354.33]
  - - [512, 4, 1, 500000]
    - [0, 1332.48]
  - - [35, 700, 1, 2048]
    - [11, 1872.2]
  - - [1024, 16, 1, 500000]
    - [8, 4509.76]
  - - [512, 24000, 1, 2048]
    - [52, 8351.52]
  - - [128, 50176, 1, 512]
    - [68, 7547.48]
  - - [1024, 32, 1, 512]
    - [19, 1407.48]
  - - [256, 12544, 1, 1024]
    - [64, 7003.51]
  - - [1024, 12544, 1, 256]
    - [65, 8391.92]
  - - [512, 48000, 1, 2560]
    - [55, 9198.66]
  - - [2560, 16, 1, 2560]
    - [35, 3076.76]
  - - [2048, 64, 1, 2048]
    - [22, 3728.22]
  - - [512, 2, 1, 512]
    - [24, 92.3042]
  - - [1024, 1, 1, 512]
    - [31, 70.4688]
  - - [512, 1500, 1, 2560]
    - [61, 6932.48]
  - - [6144, 32, 1, 2560]
    - [47, 4769.8]
  - - [1024, 1, 1, 500000]
    - [4, 304.135]
  - - [6144, 16, 1, 2560]
    - [36, 3375.2]
  - - [1024, 24000, 1, 2048]
    - [57, 8811.68]
  - - [4096, 16, 1, 4096]
    - [34, 3573.37]
  - - [5124, 1500, 1, 2048]
    - [57, 7996.05]
  - - [3072, 1500, 1, 1024]
    - [53, 7728.19]
  - - [1024, 2, 1, 500000]
    - [2, 610.096]
  - - [1024, 8, 1, 500000]
    - [2, 2391.37]
  - - [7680, 16, 1, 2560]
    - [20, 4165.37]
  - - [6144, 1500, 1, 2560]
    - [57, 8825.61]
  - - [3072, 1, 1, 1024]
    - [37, 179.551]
  - - [512, 6000, 1, 2816]
    - [55, 8630.61]
  - - [8448, 2, 1, 2816]
    - [3, 617.578]
  - - [4608, 4, 1, 1536]
    - [6, 926.41]
  - - [1024, 6000, 1, 1536]
    - [57, 8623.04]
  - - [8448, 32, 1, 2816]
    - [29, 5357.92]
  - - [512, 3000, 1, 2048]
    - [56, 6423.96]
  - - [6144, 24000, 1, 2560]
    - [55, 9331.88]
  - - [512, 3000, 1, 2560]
    - [52, 7989.48]
  - - [4608, 6000, 1, 1536]
    - [54, 9151.84]
  - - [1024, 1024, 1, 1024]
    - [52, 6092.41]
  - - [512, 1500, 1, 2048]
    - [53, 5708.63]
  - - [512, 1500, 1, 1536]
    - [61, 6541.88]
  - - [128, 1, 1, 1024]
    - [40, 19.2753]
  - - [49, 2048, 64, 512]
    - [78, 5355.51]
  - - [1024, 48000, 1, 2048]
    - [57, 9081.01]
  - - [3136, 64, 128, 64]
    - [84, 7734.96]
  - - [784, 512, 64, 128]
    - [81, 7939.64]
  - - [3136, 256, 64, 64]
    - [84, 7970.44]
  - - [784, 128, 128, 512]
    - [88, 7502.7]
  - - [784, 128, 64, 512]
    - [87, 7371.52]
  - - [3136, 512, 1, 2048]
    - [79, 6769.36]
  - - [12544, 256, 1, 1024]
    - [87, 7289.15]
  - - [3136, 64, 128, 256]
    - [82, 8635.2]
  - - [3136, 64, 64, 256]
    - [82, 8461.01]
  - - [3136, 2048, 1, 512]
    - [86, 7924.34]
  - - [784, 512, 128, 128]
    - [80, 8065.06]
  - - [3136, 64, 64, 64]
    - [85, 7408.73]
  - - [12544, 1024, 1, 256]
    - [83, 8637.02]
  - - [3136, 256, 128, 64]
    - [84, 8065.85]
- - - -1
    - - - 128
        - - - 4
            - - [-1, 62]
          - - 64
            - - [4, 62]
              - [5888, 14]
              - [-1, 50]
          - - 128
            - - [4, 62]
              - [5056, 14]
              - [5888, 50]
              - [-1, 14]
          - - 256
            - - [4, 62]
              - [448, 14]
              - [4288, 50]
              - [5888, 51]
              - [-1, 50]
          - - 448
            - - [4, 62]
              - [448, 14]
              - [2368, 50]
              - [2944, 51]
              - [-1, 50]
          - - 704
            - - [4, 62]
              - [128, 14]
              - [-1, 50]
          - - 1024
            - - [4, 62]
              - [128, 14]
              - [704, 50]
              - [-1, 51]
          - - 1408
            - - [4, 62]
              - [128, 14]
              - [704, 50]
              - [1024, 51]
              - [3584, 50]
              - [4288, 51]
              - [5056, 50]
              - [5888, 51]
              - [-1, 50]
          - - 1856
            - - [4, 62]
              - [128, 14]
              - [2944, 50]
              - [3584, 51]
              - [5888, 50]
              - [-1, 51]
          - - 2368
            - - [4, 62]
              - [128, 14]
              - [4288, 50]
              - [-1, 51]
          - - 2944
            - - [4, 62]
              - [128, 14]
              - [256, 50]
              - [448, 51]
              - [704, 50]
              - [1024, 51]
              - [1856, 50]
              - [2368, 51]
              - [2944, 50]
              - [-1, 51]
          - - 3584
            - - [4, 62]
              - [64, 14]
              - [704, 50]
              - [-1, 51]
          - - 4288
            - - [4, 62]
              - [128, 14]
              - [1024, 50]
              - [1408, 51]
              - [2368, 50]
              - [2944, 51]
              - [3584, 50]
              - [-1, 51]
          - - 5056
            - - [4, 62]
              - [64, 14]
              - [1856, 50]
              - [-1, 51]
          - - 5888
            - - [4, 62]
              - [128, 14]
              - [448, 50]
              - [-1, 51]
          - - -1
            - - [4, 62]
              - [64, 50]
              - [128, 14]
              - [1024, 50]
              - [-1, 51]
      - - 256
        - - - 4
            - - [-1, 18]
          - - 64
            - - [4, 18]
              - [128, 48]
              - [256, 49]
              - [448, 48]
              - [1408, 26]
              - [1856, 41]
              - [2368, 26]
              - [2944, 61]
              - [5056, 60]
              - [-1, 61]
          - - 128
            - - [4, 18]
              - [128, 48]
              - [256, 49]
              - [448, 41]
              - [704, 26]
              - [1024, 41]
              - [1408, 60]
              - [5888, 61]
              - [-1, 60]
          - - 256
            - - [4, 18]
              - [128, 48]
              - [448, 26]
              - [704, 60]
              - [4288, 61]
              - [5056, 60]
              - [5888, 55]
              - [-1, 61]
          - - 448
            - - [4, 18]
              - [64, 49]
              - [128, 41]
              - [256, 26]
              - [704, 61]
              - [1024, 60]
              - [2368, 61]
              - [3584, 60]
              - [4288, 61]
              - [5056, 60]
              - [-1, 61]
          - - 704
            - - [4, 18]
              - [128, 26]
              - [256, 60]
              - [448, 61]
              - [1024, 60]
              - [1408, 61]
              - [1856, 55]
              - [5056, 60]
              - [5888, 61]
              - [-1, 60]
          - - 1024
            - - [64, 18]
              - [128, 61]
              - [704, 60]
              - [1408, 52]
              - [1856, 54]
              - [2368, 60]
              - [2944, 54]
              - [3584, 55]
              - [4288, 54]
              - [5056, 59]
              - [-1, 54]
          - - 1408
            - - [4, 18]
              - [64, 26]
              - [128, 61]
              - [256, 60]
              - [448, 61]
              - [704, 53]
              - [1024, 55]
              - [1408, 57]
              - [1856, 54]
              - [2368, 60]
              - [-1, 54]
          - - 1856
            - - [4, 18]
              - [64, 26]
              - [256, 61]
              - [1408, 60]
              - [1856, 54]
              - [2368, 60]
              - [2944, 54]
              - [3584, 60]
              - [-1, 54]
          - - 2368
            - - [4, 18]
              - [64, 61]
              - [128, 60]
              - [256, 61]
              - [704, 60]
              - [1024, 54]
              - [1856, 60]
              - [5888, 54]
              - [-1, 55]
          - - 2944
            - - [4, 18]
              - [256, 60]
              - [448, 55]
              - [-1, 54]
          - - 3584
            - - [4, 18]
              - [64, 60]
              - [128, 61]
              - [256, 53]
              - [448, 60]
              - [1856, 54]
              - [4288, 55]
              - [5056, 54]
              - [-1, 55]
          - - 4288
            - - [4, 63]
              - [64, 61]
              - [256, 60]
              - [448, 61]
              - [704, 54]
              - [1024, 60]
              - [-1, 54]
          - - 5056
            - - [4, 63]
              - [64, 61]
              - [256, 60]
              - [448, 61]
              - [-1, 54]
          - - 5888
            - - [4, 63]
              - [64, 61]
              - [448, 60]
              - [-1, 54]
          - - -1
            - - [4, 63]
              - [256, 60]
              - [448, 53]
              - [-1, 54]
      - - 1280
        - - - 4
            - - [448, 23]
              - [1024, 18]
              - [2368, 23]
              - [-1, 18]
          - - 64
            - - [4, 23]
              - [64, 45]
              - [128, 39]
              - [256, 31]
              - [448, 35]
              - [704, 26]
              - [1408, 25]
              - [1856, 16]
              - [2368, 15]
              - [2944, 27]
              - [3584, 61]
              - [5056, 25]
              - [5888, 60]
              - [-1, 61]
          - - 128
            - - [4, 23]
              - [64, 18]
              - [128, 24]
              - [256, 26]
              - [448, 17]
              - [704, 25]
              - [1024, 28]
              - [1408, 27]
              - [1856, 61]
              - [2368, 27]
              - [2944, 61]
              - [3584, 60]
              - [4288, 27]
              - [5056, 60]
              - [5888, 61]
              - [-1, 52]
          - - 256
            - - [4, 23]
              - [64, 48]
              - [128, 26]
              - [256, 25]
              - [448, 27]
              - [1408, 60]
              - [2944, 61]
              - [3584, 53]
              - [5056, 61]
              - [5888, 55]
              - [-1, 61]
          - - 448
            - - [4, 23]
              - [64, 35]
              - [128, 25]
              - [256, 16]
              - [448, 15]
              - [1408, 61]
              - [1856, 53]
              - [2368, 61]
              - [2944, 55]
              - [3584, 61]
              - [4288, 58]
              - [5888, 61]
              - [-1, 58]
          - - 704
            - - [4, 18]
              - [64, 25]
              - [128, 16]
              - [704, 61]
              - [1024, 60]
              - [1408, 61]
              - [2368, 60]
              - [5888, 58]
              - [-1, 54]
          - - 1024
            - - [4, 18]
              - [64, 41]
              - [128, 32]
              - [704, 60]
              - [1024, 52]
              - [1408, 54]
              - [1856, 57]
              - [-1, 54]
          - - 1408
            - - [4, 23]
              - [64, 25]
              - [128, 27]
              - [256, 60]
              - [448, 61]
              - [704, 52]
              - [1024, 55]
              - [1408, 57]
              - [1856, 55]
              - [5056, 54]
              - [5888, 55]
              - [-1, 54]
          - - 1856
            - - [4, 23]
              - [64, 16]
              - [256, 61]
              - [448, 52]
              - [704, 60]
              - [1024, 54]
              - [1408, 58]
              - [1856, 54]
              - [2944, 55]
              - [3584, 58]
              - [-1, 55]
          - - 2368
            - - [4, 23]
              - [64, 15]
              - [128, 25]
              - [256, 61]
              - [704, 60]
              - [4288, 54]
              - [-1, 55]
          - - 2944
            - - [4, 23]
              - [64, 28]
              - [128, 60]
              - [256, 61]
              - [2368, 54]
              - [-1, 55]
          - - 3584
            - - [4, 18]
              - [128, 61]
              - [256, 53]
              - [448, 60]
              - [4288, 55]
              - [5056, 54]
              - [-1, 55]
          - - 4288
            - - [4, 23]
              - [128, 15]
              - [256, 60]
              - [448, 55]
              - [1408, 54]
              - [-1, 55]
          - - 5056
            - - [4, 63]
              - [64, 28]
              - [448, 61]
              - [704, 55]
              - [1024, 54]
              - [-1, 55]
          - - 5888
            - - [4, 63]
              - [64, 60]
              - [128, 61]
              - [256, 54]
              - [448, 60]
              - [-1, 55]
          - - -1
            - - [4, 63]
              - [64, 61]
              - [128, 52]
              - [256, 61]
              - [704, 54]
              - [-1, 55]
      - - -1
        - - - 4
            - - [704, 23]
              - [1024, 18]
              - [-1, 23]
          - - 64
            - - [4, 23]
              - [64, 45]
              - [128, 40]
              - [256, 24]
              - [448, 42]
              - [704, 35]
              - [1408, 25]
              - [1856, 16]
              - [2368, 25]
              - [3584, 27]
              - [4288, 29]
              - [5888, 27]
              - [-1, 61]
          - - 128
            - - [4, 23]
              - [64, 40]
              - [128, 24]
              - [256, 31]
              - [704, 25]
              - [1024, 16]
              - [1408, 28]
              - [1856, 33]
              - [2944, 27]
              - [3584, 61]
              - [4288, 27]
              - [5056, 32]
              - [5888, 60]
              - [-1, 52]
          - - 256
            - - [4, 23]
              - [64, 24]
              - [128, 31]
              - [256, 25]
              - [448, 27]
              - [704, 60]
              - [1856, 61]
              - [2368, 60]
              - [2944, 61]
              - [3584, 52]
              - [5056, 61]
              - [5888, 55]
              - [-1, 61]
          - - 448
            - - [4, 23]
              - [64, 31]
              - [128, 25]
              - [448, 16]
              - [704, 60]
              - [1024, 61]
              - [1408, 60]
              - [1856, 52]
              - [2368, 61]
              - [2944, 55]
              - [3584, 61]
              - [4288, 58]
              - [5056, 60]
              - [5888, 61]
              - [-1, 58]
          - - 704
            - - [4, 23]
              - [64, 25]
              - [128, 29]
              - [448, 61]
              - [1024, 60]
              - [1408, 58]
              - [1856, 61]
              - [2368, 60]
              - [5888, 58]
              - [-1, 55]
          - - 1024
            - - [4, 23]
              - [64, 25]
              - [128, 22]
              - [704, 60]
              - [1024, 52]
              - [3584, 54]
              - [4288, 55]
              - [5056, 54]
              - [5888, 57]
              - [-1, 54]
          - - 1408
            - - [4, 23]
              - [64, 29]
              - [128, 27]
              - [448, 60]
              - [704, 52]
              - [1024, 55]
              - [1408, 57]
              - [1856, 55]
              - [5056, 54]
              - [5888, 55]
              - [-1, 54]
          - - 1856
            - - [4, 23]
              - [64, 16]
              - [128, 33]
              - [256, 61]
              - [448, 52]
              - [704, 60]
              - [1024, 57]
              - [1408, 58]
              - [-1, 55]
          - - 2368
            - - [4, 18]
              - [64, 16]
              - [128, 27]
              - [256, 61]
              - [704, 60]
              - [1408, 55]
              - [1856, 54]
              - [-1, 55]
          - - 2944
            - - [4, 18]
              - [64, 28]
              - [128, 15]
              - [256, 60]
              - [448, 55]
              - [1024, 54]
              - [1408, 55]
              - [1856, 54]
              - [-1, 55]
          - - 3584
            - - [4, 63]
              - [64, 33]
              - [128, 61]
              - [256, 52]
              - [448, 60]
              - [704, 54]
              - [-1, 55]
          - - 4288
            - - [4, 63]
              - [64, 29]
              - [128, 15]
              - [256, 60]
              - [448, 55]
              - [704, 54]
              - [-1, 55]
          - - 5056
            - - [4, 63]
              - [64, 27]
              - [128, 32]
              - [448, 61]
              - [-1, 55]
          - - 5888
            - - [4, 63]
              - [64, 32]
              - [128, 61]
              - [256, 55]
              - [448, 60]
              - [-1, 55]
          - - -1
            - - [4, 63]
              - [64, 61]
              - [128, 52]
              - [256, 61]
              - [-1, 55]
