library/src/blas3/Tensile/Logic/asm_full/vega20_Cijk_Ailk_Bjlk_HB.yaml
- {MinimumRequiredVersion: 4.3.0}
- vega20
- gfx906
- [Device 66a0, Device 66a7]
    SolutionIndex: 0
    SolutionNameMin: Cijk_Ailk_Bjlk_HB_MT064x016x64_PGR1_PLR1_TT02_02
    SolutionIndex: 1
    SolutionNameMin: Cijk_Ailk_Bjlk_HB_MT032x016x16_PGR1_PLR1_TT02_02
    SolutionIndex: 2
    SolutionNameMin: Cijk_Ailk_Bjlk_HB_MT064x016x64_PGR1_PLR1_TT02_02
    SolutionIndex: 3
    SolutionNameMin: Cijk_Ailk_Bjlk_HB_MT064x064x08_PGR1_PLR1_TT08_08
    SolutionIndex: 4
    SolutionNameMin: Cijk_Ailk_Bjlk_HB_MT064x128x16_PGR1_PLR1_TT04_08
    SolutionIndex: 5
    SolutionNameMin: Cijk_Ailk_Bjlk_HB_MT128x064x16_PGR1_PLR1_TT08_04
    SolutionIndex: 6
    SolutionNameMin: Cijk_Ailk_Bjlk_HB_MT064x064x16_PGR1_PLR1_TT04_04
    SolutionIndex: 7
    SolutionNameMin: Cijk_Ailk_Bjlk_HB_MT128x128x16_PGR1_PLR1_TT08_08
    SolutionIndex: 8
    SolutionNameMin: Cijk_Ailk_Bjlk_HB_MT064x064x32_PGR1_PLR1_TT04_04
    SolutionIndex: 9
    SolutionNameMin: Cijk_Ailk_Bjlk_HB_MT064x128x08_PGR0_PLR1_TT04_08
    SolutionIndex: 10
    SolutionNameMin: Cijk_Ailk_Bjlk_HB_MT064x064x08_PGR0_PLR1_TT04_04
    SolutionIndex: 11
    SolutionNameMin: Cijk_Ailk_Bjlk_HB_MT064x064x08_PGR1_PLR1_TT04_04
    SolutionIndex: 12
    SolutionNameMin: Cijk_Ailk_Bjlk_HB_MT064x064x08_PGR0_PLR0_TT04_04
    SolutionIndex: 13
    SolutionNameMin: Cijk_Ailk_Bjlk_HB_MT064x064x16_PGR1_PLR1_TT04_04
    SolutionIndex: 14
    SolutionNameMin: Cijk_Ailk_Bjlk_HB_MT064x064x04_PGR0_PLR0_TT04_04
- - - [4096, 7133, 1, 4096]
    - [7, 19077.9]
  - - [512, 16, 1, 512]
    - [1, 297.88]
  - - [2048, 7133, 1, 2048]
    - [7, 18702.2]
  - - [2560, 7133, 1, 2560]
    - [5, 18676.4]
  - - [1024, 1024, 1, 1024]
    - [5, 14263.1]
  - - [3072, 7435, 1, 1024]
    - [3, 18565.6]
  - - [1024, 32, 1, 512]
    - [0, 1226.4]
  - - [1760, 7133, 1, 1760]
    - [5, 17782.9]
  - - [7680, 5481, 1, 2560]
    - [7, 18833.0]
  - - [1024, 16, 1, 512]
    - [1, 592.416]
  - - [512, 32, 1, 512]
    - [2, 631.649]
- - - -1
    - - - 1
        - - - 32
            - - [64, 14]
              - [128, 12]
              - [448, 14]
              - [1024, 12]
              - [1408, 13]
              - [1856, 12]
              - [2944, 14]
              - [3584, 12]
              - [4288, 13]
              - [5056, 14]
              - [5888, 13]
              - [-1, 14]
          - - 64
            - - [32, 13]
              - [64, 12]
              - [448, 14]
              - [704, 12]
              - [1408, 13]
              - [2368, 14]
              - [5056, 12]
              - [-1, 14]
          - - 128
            - - [64, 12]
              - [128, 14]
              - [256, 12]
              - [704, 14]
              - [2368, 12]
              - [3584, 14]
              - [4288, 12]
              - [-1, 14]
          - - 256
            - - [32, 14]
              - [64, 12]
              - [256, 14]
              - [448, 12]
              - [1024, 13]
              - [1856, 12]
              - [2944, 14]
              - [3584, 12]
              - [4288, 14]
              - [5056, 12]
              - [-1, 14]
          - - 448
            - - [64, 14]
              - [256, 12]
              - [448, 14]
              - [1024, 12]
              - [1408, 13]
              - [1856, 14]
              - [4288, 12]
              - [5056, 14]
              - [-1, 12]
          - - 704
            - - [32, 12]
              - [64, 14]
              - [448, 12]
              - [704, 13]
              - [1024, 12]
              - [2944, 14]
              - [4288, 12]
              - [5056, 14]
              - [-1, 12]
          - - 1024
            - - [64, 14]
              - [128, 12]
              - [256, 13]
              - [448, 14]
              - [1856, 12]
              - [-1, 14]
          - - 1408
            - - [32, 13]
              - [128, 14]
              - [448, 12]
              - [704, 14]
              - [1024, 12]
              - [1856, 14]
              - [2944, 12]
              - [4288, 14]
              - [5056, 12]
              - [-1, 14]
          - - 1856
            - - [64, 14]
              - [704, 12]
              - [1024, 14]
              - [1408, 12]
              - [1856, 14]
              - [2944, 12]
              - [-1, 14]
          - - 2368
            - - [64, 14]
              - [256, 12]
              - [704, 14]
              - [1856, 12]
              - [2368, 14]
              - [2944, 12]
              - [3584, 14]
              - [5056, 12]
              - [5888, 14]
              - [-1, 12]
          - - 2944
            - - [32, 14]
              - [64, 13]
              - [1024, 14]
              - [1408, 12]
              - [1856, 14]
              - [4288, 12]
              - [5056, 14]
              - [-1, 12]
          - - 3584
            - - [32, 12]
              - [64, 13]
              - [128, 12]
              - [256, 13]
              - [1024, 12]
              - [1408, 14]
              - [2368, 12]
              - [2944, 14]
              - [4288, 12]
              - [5056, 14]
              - [-1, 12]
          - - 4288
            - - [32, 14]
              - [64, 12]
              - [128, 13]
              - [256, 12]
              - [704, 14]
              - [1856, 12]
              - [4288, 14]
              - [5888, 12]
              - [-1, 14]
          - - 5056
            - - [32, 12]
              - [448, 14]
              - [704, 12]
              - [1024, 14]
              - [1408, 12]
              - [-1, 14]
          - - 5888
            - - [64, 14]
              - [128, 12]
              - [448, 14]
              - [704, 12]
              - [1024, 14]
              - [1856, 12]
              - [2944, 14]
              - [3584, 12]
              - [5056, 14]
              - [5888, 12]
              - [-1, 14]
          - - -1
            - - [64, 14]
              - [256, 12]
              - [704, 14]
              - [2944, 12]
              - [3584, 14]
              - [5056, 12]
              - [-1, 14]
      - - 32
        - - - 32
            - - [32, 10]
              - [128, 11]
              - [256, 10]
              - [704, 11]
              - [1408, 10]
              - [2368, 11]
              - [2944, 8]
              - [3584, 10]
              - [5056, 11]
              - [5888, 10]
              - [-1, 11]
          - - 64
            - - [32, 11]
              - [128, 8]
              - [256, 11]
              - [704, 8]
              - [1408, 10]
              - [1856, 8]
              - [2368, 11]
              - [2944, 10]
              - [3584, 8]
              - [5056, 11]
              - [-1, 10]
          - - 128
            - - [1024, 11]
              - [1408, 8]
              - [2368, 11]
              - [2944, 10]
              - [-1, 11]
          - - 256
            - - [64, 11]
              - [128, 8]
              - [256, 11]
              - [448, 10]
              - [704, 11]
              - [1024, 10]
              - [2368, 11]
              - [2944, 10]
              - [4288, 11]
              - [-1, 10]
          - - 448
            - - [64, 11]
              - [128, 8]
              - [256, 10]
              - [448, 11]
              - [704, 10]
              - [1856, 11]
              - [2368, 10]
              - [2944, 9]
              - [3584, 10]
              - [4288, 9]
              - [-1, 10]
          - - 704
            - - [64, 10]
              - [128, 8]
              - [256, 11]
              - [448, 8]
              - [704, 11]
              - [2368, 10]
              - [2944, 9]
              - [3584, 10]
              - [4288, 9]
              - [5056, 10]
              - [-1, 9]
          - - 1024
            - - [64, 10]
              - [128, 8]
              - [448, 10]
              - [1024, 11]
              - [1856, 9]
              - [5888, 10]
              - [-1, 9]
          - - 1408
            - - [32, 10]
              - [64, 11]
              - [256, 8]
              - [448, 10]
              - [704, 11]
              - [1408, 9]
              - [2368, 10]
              - [2944, 9]
              - [4288, 10]
              - [5056, 9]
              - [-1, 10]
          - - 1856
            - - [64, 10]
              - [128, 11]
              - [256, 10]
              - [448, 11]
              - [1024, 9]
              - [2944, 10]
              - [4288, 9]
              - [5056, 10]
              - [-1, 9]
          - - 2368
            - - [128, 10]
              - [256, 11]
              - [448, 10]
              - [704, 9]
              - [1408, 10]
              - [1856, 9]
              - [2944, 10]
              - [3584, 9]
              - [4288, 10]
              - [-1, 9]
          - - 2944
            - - [32, 10]
              - [64, 11]
              - [128, 10]
              - [256, 11]
              - [448, 10]
              - [704, 11]
              - [1024, 10]
              - [1408, 9]
              - [2368, 10]
              - [2944, 9]
              - [3584, 10]
              - [-1, 9]
          - - 3584
            - - [32, 11]
              - [1408, 10]
              - [1856, 9]
              - [2368, 10]
              - [-1, 9]
          - - 4288
            - - [32, 8]
              - [64, 10]
              - [128, 11]
              - [704, 10]
              - [1408, 9]
              - [1856, 10]
              - [-1, 9]
          - - 5056
            - - [32, 8]
              - [128, 11]
              - [1024, 10]
              - [1856, 9]
              - [2368, 10]
              - [3584, 9]
              - [4288, 10]
              - [-1, 9]
          - - 5888
            - - [64, 10]
              - [128, 11]
              - [256, 9]
              - [1024, 10]
              - [-1, 9]
          - - -1
            - - [64, 10]
              - [128, 11]
              - [704, 10]
              - [-1, 9]
      - - 256
        - - - 1
            - - [-1, 13]
          - - 32
            - - [448, 11]
              - [704, 8]
              - [1024, 11]
              - [1408, 8]
              - [4288, 11]
              - [5888, 8]
              - [-1, 11]
          - - 64
            - - [1, 13]
              - [32, 11]
              - [128, 1]
              - [256, 0]
              - [2944, 1]
              - [3584, 6]
              - [4288, 1]
              - [-1, 6]
          - - 128
            - - [1, 13]
              - [32, 11]
              - [1408, 1]
              - [-1, 6]
          - - 256
            - - [1, 13]
              - [32, 11]
              - [448, 1]
              - [5888, 6]
              - [-1, 4]
          - - 448
            - - [1, 13]
              - [32, 11]
              - [448, 1]
              - [3584, 6]
              - [4288, 4]
              - [5888, 6]
              - [-1, 4]
          - - 704
            - - [1, 13]
              - [32, 11]
              - [64, 0]
              - [128, 1]
              - [2368, 6]
              - [5056, 4]
              - [-1, 3]
          - - 1024
            - - [1, 13]
              - [32, 8]
              - [64, 0]
              - [128, 1]
              - [1024, 6]
              - [2368, 5]
              - [2944, 7]
              - [3584, 5]
              - [4288, 6]
              - [-1, 3]
          - - 1408
            - - [1, 13]
              - [32, 11]
              - [128, 1]
              - [448, 6]
              - [1856, 5]
              - [2368, 6]
              - [3584, 7]
              - [5888, 3]
              - [-1, 4]
          - - 1856
            - - [1, 13]
              - [32, 11]
              - [128, 1]
              - [704, 6]
              - [1408, 4]
              - [1856, 5]
              - [2944, 6]
              - [3584, 4]
              - [5056, 3]
              - [5888, 4]
              - [-1, 5]
          - - 2368
            - - [1, 13]
              - [32, 11]
              - [64, 1]
              - [704, 6]
              - [1024, 4]
              - [1856, 6]
              - [2368, 4]
              - [2944, 3]
              - [3584, 4]
              - [-1, 3]
          - - 2944
            - - [1, 13]
              - [32, 10]
              - [64, 1]
              - [448, 6]
              - [704, 5]
              - [1408, 3]
              - [1856, 6]
              - [2368, 3]
              - [2944, 5]
              - [3584, 4]
              - [4288, 5]
              - [5056, 3]
              - [-1, 7]
          - - 3584
            - - [1, 13]
              - [32, 11]
              - [448, 6]
              - [704, 5]
              - [1024, 4]
              - [1408, 7]
              - [2368, 5]
              - [2944, 4]
              - [3584, 7]
              - [5056, 3]
              - [-1, 7]
          - - 4288
            - - [1, 13]
              - [32, 11]
              - [256, 6]
              - [448, 5]
              - [704, 6]
              - [1024, 4]
              - [5056, 3]
              - [5888, 7]
              - [-1, 3]
          - - 5056
            - - [1, 13]
              - [32, 8]
              - [448, 6]
              - [704, 5]
              - [2368, 3]
              - [2944, 4]
              - [3584, 7]
              - [5056, 3]
              - [5888, 7]
              - [-1, 3]
          - - 5888
            - - [1, 13]
              - [32, 8]
              - [448, 6]
              - [704, 3]
              - [1408, 7]
              - [2368, 5]
              - [3584, 7]
              - [5056, 3]
              - [-1, 7]
          - - -1
            - - [1, 13]
              - [32, 8]
              - [256, 6]
              - [448, 5]
              - [704, 3]
              - [1024, 7]
              - [1408, 4]
              - [1856, 5]
              - [2368, 3]
              - [3584, 7]
              - [5056, 3]
              - [-1, 7]
      - - 1280
        - - - 1
            - - [-1, 13]
          - - 32
            - - [704, 8]
              - [1856, 11]
              - [2368, 8]
              - [3584, 11]
              - [-1, 8]
          - - 64
            - - [1, 13]
              - [32, 8]
              - [64, 1]
              - [704, 2]
              - [1024, 1]
              - [1856, 2]
              - [2944, 1]
              - [-1, 6]
          - - 128
            - - [1, 13]
              - [32, 8]
              - [64, 0]
              - [256, 2]
              - [448, 0]
              - [704, 2]
              - [1024, 0]
              - [5888, 6]
              - [-1, 4]
          - - 256
            - - [1, 13]
              - [32, 8]
              - [64, 2]
              - [128, 0]
              - [256, 1]
              - [448, 2]
              - [2944, 6]
              - [3584, 4]
              - [5056, 6]
              - [5888, 4]
              - [-1, 6]
          - - 448
            - - [1, 13]
              - [32, 11]
              - [128, 2]
              - [256, 0]
              - [2368, 6]
              - [2944, 4]
              - [3584, 6]
              - [4288, 4]
              - [5888, 6]
              - [-1, 4]
          - - 704
            - - [1, 13]
              - [32, 11]
              - [64, 0]
              - [128, 1]
              - [2368, 6]
              - [5056, 4]
              - [5888, 3]
              - [-1, 6]
          - - 1024
            - - [1, 13]
              - [32, 11]
              - [64, 1]
              - [128, 0]
              - [1024, 6]
              - [3584, 5]
              - [4288, 6]
              - [-1, 7]
          - - 1408
            - - [1, 13]
              - [32, 11]
              - [64, 0]
              - [448, 6]
              - [704, 5]
              - [1408, 4]
              - [1856, 5]
              - [2368, 6]
              - [5888, 7]
              - [-1, 4]
          - - 1856
            - - [1, 13]
              - [32, 8]
              - [64, 0]
              - [704, 6]
              - [1856, 4]
              - [2944, 6]
              - [3584, 4]
              - [4288, 7]
              - [5056, 3]
              - [-1, 4]
          - - 2368
            - - [1, 13]
              - [32, 8]
              - [64, 1]
              - [704, 6]
              - [1024, 4]
              - [1856, 6]
              - [2368, 5]
              - [2944, 7]
              - [3584, 5]
              - [4288, 3]
              - [5056, 7]
              - [-1, 4]
          - - 2944
            - - [1, 13]
              - [32, 8]
              - [256, 6]
              - [704, 5]
              - [1408, 7]
              - [1856, 5]
              - [2368, 7]
              - [5056, 5]
              - [5888, 7]
              - [-1, 4]
          - - 3584
            - - [1, 13]
              - [32, 11]
              - [448, 6]
              - [1024, 5]
              - [1408, 7]
              - [1856, 5]
              - [2368, 4]
              - [3584, 5]
              - [4288, 7]
              - [5888, 5]
              - [-1, 4]
          - - 4288
            - - [1, 13]
              - [32, 8]
              - [256, 6]
              - [704, 5]
              - [1024, 4]
              - [1856, 7]
              - [2368, 3]
              - [2944, 4]
              - [3584, 7]
              - [5056, 3]
              - [5888, 4]
              - [-1, 3]
          - - 5056
            - - [1, 13]
              - [32, 8]
              - [448, 6]
              - [704, 5]
              - [1408, 7]
              - [1856, 3]
              - [2368, 7]
              - [3584, 4]
              - [4288, 3]
              - [5888, 7]
              - [-1, 3]
          - - 5888
            - - [1, 13]
              - [32, 8]
              - [128, 6]
              - [256, 5]
              - [448, 6]
              - [704, 3]
              - [1408, 7]
              - [2368, 5]
              - [2944, 7]
              - [3584, 4]
              - [4288, 5]
              - [-1, 7]
          - - -1
            - - [1, 13]
              - [32, 8]
              - [256, 6]
              - [448, 5]
              - [704, 3]
              - [1024, 7]
              - [2944, 5]
              - [3584, 4]
              - [5056, 3]
              - [-1, 7]
      - - -1
        - - - 1
            - - [-1, 13]
          - - 32
            - - [32, 8]
              - [64, 11]
              - [448, 8]
              - [704, 11]
              - [-1, 8]
          - - 64
            - - [1, 13]
              - [32, 8]
              - [64, 2]
              - [128, 0]
              - [256, 1]
              - [1856, 2]
              - [2368, 1]
              - [-1, 6]
          - - 128
            - - [1, 13]
              - [32, 8]
              - [1024, 2]
              - [5888, 6]
              - [-1, 5]
          - - 256
            - - [1, 13]
              - [32, 8]
              - [64, 1]
              - [256, 2]
              - [448, 0]
              - [2944, 6]
              - [3584, 4]
              - [5056, 6]
              - [5888, 5]
              - [-1, 6]
          - - 448
            - - [1, 13]
              - [32, 8]
              - [128, 0]
              - [256, 2]
              - [1408, 6]
              - [1856, 4]
              - [2368, 6]
              - [2944, 4]
              - [3584, 6]
              - [4288, 4]
              - [5888, 6]
              - [-1, 4]
          - - 704
            - - [1, 13]
              - [32, 8]
              - [64, 2]
              - [128, 0]
              - [1024, 6]
              - [1408, 4]
              - [2368, 6]
              - [5888, 4]
              - [-1, 7]
          - - 1024
            - - [1, 13]
              - [32, 8]
              - [128, 0]
              - [704, 6]
              - [1024, 4]
              - [2368, 5]
              - [2944, 7]
              - [3584, 5]
              - [4288, 6]
              - [-1, 7]
          - - 1408
            - - [1, 13]
              - [32, 8]
              - [64, 2]
              - [448, 6]
              - [1856, 5]
              - [2368, 6]
              - [5888, 7]
              - [-1, 4]
          - - 1856
            - - [1, 13]
              - [32, 8]
              - [64, 2]
              - [256, 6]
              - [448, 5]
              - [704, 6]
              - [1408, 4]
              - [1856, 5]
              - [2368, 6]
              - [3584, 4]
              - [4288, 7]
              - [5056, 3]
              - [-1, 4]
          - - 2368
            - - [1, 13]
              - [32, 8]
              - [64, 1]
              - [704, 6]
              - [1024, 5]
              - [1856, 6]
              - [2368, 4]
              - [2944, 7]
              - [3584, 4]
              - [4288, 3]
              - [5056, 7]
              - [-1, 4]
          - - 2944
            - - [1, 13]
              - [32, 8]
              - [256, 6]
              - [704, 5]
              - [1408, 7]
              - [1856, 5]
              - [2368, 7]
              - [2944, 5]
              - [3584, 4]
              - [5056, 5]
              - [5888, 7]
              - [-1, 4]
          - - 3584
            - - [1, 13]
              - [32, 8]
              - [128, 6]
              - [256, 4]
              - [448, 6]
              - [1024, 5]
              - [1408, 7]
              - [3584, 5]
              - [4288, 7]
              - [-1, 5]
          - - 4288
            - - [1, 13]
              - [32, 8]
              - [256, 6]
              - [704, 5]
              - [1024, 4]
              - [1856, 7]
              - [2368, 3]
              - [2944, 5]
              - [3584, 7]
              - [5056, 3]
              - [5888, 4]
              - [-1, 3]
          - - 5056
            - - [1, 13]
              - [32, 8]
              - [448, 6]
              - [704, 5]
              - [1408, 7]
              - [1856, 3]
              - [2368, 7]
              - [2944, 5]
              - [3584, 4]
              - [4288, 3]
              - [5056, 7]
              - [5888, 4]
              - [-1, 3]
          - - 5888
            - - [1, 13]
              - [32, 8]
              - [128, 6]
              - [256, 5]
              - [448, 6]
              - [704, 5]
              - [1408, 7]
              - [2368, 5]
              - [2944, 7]
              - [5056, 5]
              - [-1, 7]
          - - -1
            - - [1, 13]
              - [32, 8]
              - [64, 6]
              - [128, 5]
              - [256, 6]
              - [448, 5]
              - [1024, 7]
              - [1408, 4]
              - [3584, 5]
              - [5056, 3]
              - [-1, 7]
