library/src/blas3/Tensile/Logic/asm_full/vega20_Cijk_Alik_Bjlk_SB_GB.yaml
- {MinimumRequiredVersion: 4.26.0}
- vega20
- gfx906
- [Device 66a0, Device 66a1, Device 66a7, Device 66af, Vega 20]
    SolutionIndex: 0
    SolutionNameMin: Cijk_Alik_Bjlk_SB_GB_MT32x32x8_SN_AMAS3_GRVW4_LRVW4_TT4_4_VW4_WG8_8_1_WGM1
    SolutionIndex: 1
    SolutionNameMin: Cijk_Alik_Bjlk_SB_GB_MT64x128x8_SN_AMAS3_GRVW4_LRVW4_TT4_8_VW4_WG16_16_1_WGM1
    SolutionIndex: 2
    SolutionNameMin: Cijk_Alik_Bjlk_SB_GB_MT128x128x8_SN_AMAS3_GRVW4_LRVW4_TT8_8_VW4_WG16_16_1_WGM1
    SolutionIndex: 3
    SolutionNameMin: Cijk_Alik_Bjlk_SB_GB_MT32x32x16_SN_AMAS3_GRVW4_LRVW4_TT4_4_VW4_WG8_8_1_WGM1
    SolutionIndex: 4
    SolutionNameMin: Cijk_Alik_Bjlk_SB_GB_MT64x64x16_SN_AMAS3_GRVW4_LRVW4_TT4_4_VW4_WG16_16_1_WGM1
    SolutionIndex: 5
    SolutionNameMin: Cijk_Alik_Bjlk_SB_GB_MT128x64x16_SN_AMAS3_GRVW4_LRVW4_TT8_4_VW4_WG16_16_1_WGM1
    SolutionIndex: 6
    SolutionNameMin: Cijk_Alik_Bjlk_SB_GB_MT64x128x16_SN_AMAS3_GRVW4_LRVW4_TT4_8_VW4_WG16_16_1_WGM1
    SolutionIndex: 7
    SolutionNameMin: Cijk_Alik_Bjlk_SB_GB_MT32x32x32_SN_AMAS3_GRVW4_LRVW4_TT4_4_VW4_WG8_8_1_WGM1
    SolutionIndex: 8
    SolutionNameMin: Cijk_Alik_Bjlk_SB_GB_MT64x64x8_SN_AMAS0_GRVW1_LRVW1_TT4_4_VW1_WG16_16_1_WGM1
    SolutionIndex: 9
    SolutionNameMin: Cijk_Alik_Bjlk_SB_GB_MT32x32x8_SN_AMAS3_GRVW4_LRVW4_TT4_4_VW4_WG8_8_1_WGM8
    SolutionIndex: 10
    SolutionNameMin: Cijk_Alik_Bjlk_SB_GB_MT32x32x16_SN_AMAS3_GRVW4_LRVW4_TT4_4_VW4_WG8_8_1_WGM8
    SolutionIndex: 11
    SolutionNameMin: Cijk_Alik_Bjlk_SB_GB_MT64x64x16_SN_AMAS3_GRVW4_LRVW4_TT4_4_VW4_WG16_16_1_WGM8
    SolutionIndex: 12
    SolutionNameMin: Cijk_Alik_Bjlk_SB_GB_MT64x128x16_SN_AMAS3_GRVW4_LRVW4_TT4_8_VW4_WG16_16_1_WGM8
- - - [32, 32, 8, 32, 32, 32, 32, 32]
    - [9, 89.0]
  - - [32, 32, 8, 64, 32, 32, 64, 32]
    - [0, 135.0]
  - - [32, 32, 8, 128, 32, 32, 128, 32]
    - [0, 179.0]
  - - [32, 32, 8, 256, 32, 32, 256, 32]
    - [3, 220.0]
  - - [32, 32, 8, 512, 32, 32, 512, 32]
    - [10, 249.0]
  - - [32, 64, 8, 32, 32, 32, 32, 64]
    - [0, 186.0]
  - - [32, 64, 8, 64, 32, 32, 64, 64]
    - [0, 277.0]
  - - [32, 64, 8, 128, 32, 32, 128, 64]
    - [3, 368.0]
  - - [32, 64, 8, 256, 32, 32, 256, 64]
    - [10, 449.0]
  - - [32, 64, 8, 512, 32, 32, 512, 64]
    - [10, 503.0]
  - - [32, 128, 8, 32, 32, 32, 32, 128]
    - [0, 377.0]
  - - [32, 128, 8, 64, 32, 32, 64, 128]
    - [0, 561.0]
  - - [32, 128, 8, 128, 32, 32, 128, 128]
    - [10, 746.0]
  - - [32, 128, 8, 256, 32, 32, 256, 128]
    - [10, 902.0]
  - - [32, 128, 8, 512, 32, 32, 512, 128]
    - [10, 997.0]
  - - [32, 256, 8, 32, 32, 32, 32, 256]
    - [0, 751.0]
  - - [32, 256, 8, 64, 32, 32, 64, 256]
    - [0, 1101.0]
  - - [32, 256, 8, 128, 32, 32, 128, 256]
    - [10, 1460.0]
  - - [32, 256, 8, 256, 32, 32, 256, 256]
    - [10, 1765.0]
  - - [32, 256, 8, 512, 32, 32, 512, 256]
    - [3, 1940.0]
  - - [32, 512, 8, 32, 32, 32, 32, 512]
    - [9, 1380.0]
  - - [32, 512, 8, 64, 32, 32, 64, 512]
    - [0, 2101.0]
  - - [32, 512, 8, 128, 32, 32, 128, 512]
    - [10, 2696.0]
  - - [32, 512, 8, 256, 32, 32, 256, 512]
    - [10, 3187.0]
  - - [32, 512, 8, 512, 32, 32, 512, 512]
    - [11, 3498.0]
  - - [64, 32, 8, 32, 64, 64, 32, 32]
    - [0, 190.0]
  - - [64, 32, 8, 64, 64, 64, 64, 32]
    - [0, 277.0]
  - - [64, 32, 8, 128, 64, 64, 128, 32]
    - [10, 368.0]
  - - [64, 32, 8, 256, 64, 64, 256, 32]
    - [10, 448.0]
  - - [64, 32, 8, 512, 64, 64, 512, 32]
    - [7, 503.0]
  - - [64, 64, 8, 32, 64, 64, 32, 64]
    - [0, 373.0]
  - - [64, 64, 8, 64, 64, 64, 64, 64]
    - [0, 554.0]
  - - [64, 64, 8, 128, 64, 64, 128, 64]
    - [3, 745.0]
  - - [64, 64, 8, 256, 64, 64, 256, 64]
    - [10, 899.0]
  - - [64, 64, 8, 512, 64, 64, 512, 64]
    - [10, 1005.0]
  - - [64, 128, 8, 32, 64, 64, 32, 128]
    - [0, 736.0]
  - - [64, 128, 8, 64, 64, 64, 64, 128]
    - [0, 1104.0]
  - - [64, 128, 8, 128, 64, 64, 128, 128]
    - [3, 1450.0]
  - - [64, 128, 8, 256, 64, 64, 256, 128]
    - [3, 1776.0]
  - - [64, 128, 8, 512, 64, 64, 512, 128]
    - [3, 1986.0]
  - - [64, 256, 8, 32, 64, 64, 32, 256]
    - [0, 1394.0]
  - - [64, 256, 8, 64, 64, 64, 64, 256]
    - [0, 2101.0]
  - - [64, 256, 8, 128, 64, 64, 128, 256]
    - [10, 2819.0]
  - - [64, 256, 8, 256, 64, 64, 256, 256]
    - [3, 3396.0]
  - - [64, 256, 8, 512, 64, 64, 512, 256]
    - [11, 3679.0]
  - - [64, 512, 8, 32, 64, 64, 32, 512]
    - [9, 2583.0]
  - - [64, 512, 8, 64, 64, 64, 64, 512]
    - [10, 3705.0]
  - - [64, 512, 8, 128, 64, 64, 128, 512]
    - [11, 5035.0]
  - - [64, 512, 8, 256, 64, 64, 256, 512]
    - [4, 6105.0]
  - - [64, 512, 8, 512, 64, 64, 512, 512]
    - [11, 5966.0]
  - - [128, 32, 8, 32, 128, 128, 32, 32]
    - [0, 382.0]
  - - [128, 32, 8, 64, 128, 128, 64, 32]
    - [0, 560.0]
  - - [128, 32, 8, 128, 128, 128, 128, 32]
    - [3, 743.0]
  - - [128, 32, 8, 256, 128, 128, 256, 32]
    - [10, 903.0]
  - - [128, 32, 8, 512, 128, 128, 512, 32]
    - [7, 1000.0]
  - - [128, 64, 8, 32, 128, 128, 32, 64]
    - [0, 734.0]
  - - [128, 64, 8, 64, 128, 128, 64, 64]
    - [0, 1083.0]
  - - [128, 64, 8, 128, 128, 128, 128, 64]
    - [3, 1458.0]
  - - [128, 64, 8, 256, 128, 128, 256, 64]
    - [3, 1776.0]
  - - [128, 64, 8, 512, 128, 128, 512, 64]
    - [3, 1983.0]
  - - [128, 128, 8, 32, 128, 128, 32, 128]
    - [0, 1372.0]
  - - [128, 128, 8, 64, 128, 128, 64, 128]
    - [0, 2076.0]
  - - [128, 128, 8, 128, 128, 128, 128, 128]
    - [3, 2830.0]
  - - [128, 128, 8, 256, 128, 128, 256, 128]
    - [3, 3487.0]
  - - [128, 128, 8, 512, 128, 128, 512, 128]
    - [3, 3905.0]
  - - [128, 256, 8, 32, 128, 128, 32, 256]
    - [0, 2570.0]
  - - [128, 256, 8, 64, 128, 128, 64, 256]
    - [0, 3848.0]
  - - [128, 256, 8, 128, 128, 128, 128, 256]
    - [3, 5243.0]
  - - [128, 256, 8, 256, 128, 128, 256, 256]
    - [3, 6443.0]
  - - [128, 256, 8, 512, 128, 128, 512, 256]
    - [4, 6993.0]
  - - [128, 512, 8, 32, 128, 128, 32, 512]
    - [8, 3905.0]
  - - [128, 512, 8, 64, 128, 128, 64, 512]
    - [4, 5660.0]
  - - [128, 512, 8, 128, 128, 128, 128, 512]
    - [4, 7530.0]
  - - [128, 512, 8, 256, 128, 128, 256, 512]
    - [4, 9143.0]
  - - [128, 512, 8, 512, 128, 128, 512, 512]
    - [4, 8922.0]
  - - [256, 32, 8, 32, 256, 256, 32, 32]
    - [0, 708.0]
  - - [256, 32, 8, 64, 256, 256, 64, 32]
    - [10, 1055.0]
  - - [256, 32, 8, 128, 256, 256, 128, 32]
    - [10, 1438.0]
  - - [256, 32, 8, 256, 256, 256, 256, 32]
    - [10, 1748.0]
  - - [256, 32, 8, 512, 256, 256, 512, 32]
    - [10, 1980.0]
  - - [256, 64, 8, 32, 256, 256, 32, 64]
    - [0, 1337.0]
  - - [256, 64, 8, 64, 256, 256, 64, 64]
    - [0, 2020.0]
  - - [256, 64, 8, 128, 256, 256, 128, 64]
    - [3, 2759.0]
  - - [256, 64, 8, 256, 256, 256, 256, 64]
    - [3, 3413.0]
  - - [256, 64, 8, 512, 256, 256, 512, 64]
    - [3, 3873.0]
  - - [256, 128, 8, 32, 256, 256, 32, 128]
    - [9, 2509.0]
  - - [256, 128, 8, 64, 256, 256, 64, 128]
    - [10, 3772.0]
  - - [256, 128, 8, 128, 256, 256, 128, 128]
    - [10, 5128.0]
  - - [256, 128, 8, 256, 256, 256, 256, 128]
    - [3, 6389.0]
  - - [256, 128, 8, 512, 256, 256, 512, 128]
    - [3, 7294.0]
  - - [256, 256, 8, 32, 256, 256, 32, 256]
    - [8, 3813.0]
  - - [256, 256, 8, 64, 256, 256, 64, 256]
    - [4, 5683.0]
  - - [256, 256, 8, 128, 256, 256, 128, 256]
    - [4, 7682.0]
  - - [256, 256, 8, 256, 256, 256, 256, 256]
    - [11, 9074.0]
  - - [256, 256, 8, 512, 256, 256, 512, 256]
    - [4, 10153.0]
  - - [256, 512, 8, 32, 256, 256, 32, 512]
    - [4, 5526.0]
  - - [256, 512, 8, 64, 256, 256, 64, 512]
    - [4, 7598.0]
  - - [256, 512, 8, 128, 256, 256, 128, 512]
    - [1, 9511.0]
  - - [256, 512, 8, 256, 256, 256, 256, 512]
    - [6, 10980.0]
  - - [256, 512, 8, 512, 256, 256, 512, 512]
    - [6, 12135.0]
  - - [512, 32, 8, 32, 512, 512, 32, 32]
    - [0, 1248.0]
  - - [512, 32, 8, 64, 512, 512, 64, 32]
    - [0, 1913.0]
  - - [512, 32, 8, 128, 512, 512, 128, 32]
    - [3, 2658.0]
  - - [512, 32, 8, 256, 512, 512, 256, 32]
    - [10, 3329.0]
  - - [512, 32, 8, 512, 512, 512, 512, 32]
    - [10, 3836.0]
  - - [512, 64, 8, 32, 512, 512, 32, 64]
    - [10, 2433.0]
  - - [512, 64, 8, 64, 512, 512, 64, 64]
    - [10, 3705.0]
  - - [512, 64, 8, 128, 512, 512, 128, 64]
    - [10, 5084.0]
  - - [512, 64, 8, 256, 512, 512, 256, 64]
    - [10, 6374.0]
  - - [512, 64, 8, 512, 512, 512, 512, 64]
    - [11, 7154.0]
  - - [512, 128, 8, 32, 512, 512, 32, 128]
    - [4, 3579.0]
  - - [512, 128, 8, 64, 512, 512, 64, 128]
    - [10, 5592.0]
  - - [512, 128, 8, 128, 512, 512, 128, 128]
    - [4, 7517.0]
  - - [512, 128, 8, 256, 512, 512, 256, 128]
    - [4, 9203.0]
  - - [512, 128, 8, 512, 512, 512, 512, 128]
    - [4, 10122.0]
  - - [512, 256, 8, 32, 512, 512, 32, 256]
    - [4, 5191.0]
  - - [512, 256, 8, 64, 512, 512, 64, 256]
    - [11, 7410.0]
  - - [512, 256, 8, 128, 512, 512, 128, 256]
    - [5, 9415.0]
  - - [512, 256, 8, 256, 512, 512, 256, 256]
    - [5, 10852.0]
  - - [512, 256, 8, 512, 512, 512, 512, 256]
    - [12, 11809.0]
  - - [512, 512, 8, 32, 512, 512, 32, 512]
    - [11, 6473.0]
  - - [512, 512, 8, 64, 512, 512, 64, 512]
    - [11, 8770.0]
  - - [512, 512, 8, 128, 512, 512, 128, 512]
    - [4, 10334.0]
  - - [512, 512, 8, 256, 512, 512, 256, 512]
    - [2, 11747.0]
  - - [512, 512, 8, 512, 512, 512, 512, 512]
    - [2, 12525.0]
- null
