library/src/blas3/Tensile/Logic/asm_full/vega20_Cijk_Ailk_Bjlk_HB.yaml
- {MinimumRequiredVersion: 4.3.0}
- vega20
- gfx906
- [Device 66a0, Device 66a7]
    SolutionIndex: 0
    SolutionNameMin: Cijk_Ailk_Bjlk_HB_MT032x016x08_GRVW02_PBC0_TT02_02_USFGRO00_VW02_WG16_08_01
    SolutionIndex: 1
    SolutionNameMin: Cijk_Ailk_Bjlk_HB_MT016x016x08_GRVW02_PBC0_TT02_02_USFGRO00_VW02_WG08_08_01
    SolutionIndex: 2
    SolutionNameMin: Cijk_Ailk_Bjlk_HB_MT032x016x16_GRVW02_PBC1_TT02_02_USFGRO01_VW02_WG16_08_01
    SolutionIndex: 3
    SolutionNameMin: Cijk_Ailk_Bjlk_HB_MT064x016x64_GRVW02_PBC1_TT02_02_USFGRO01_VW02_WG32_08_01
    SolutionIndex: 4
    SolutionNameMin: Cijk_Ailk_Bjlk_HB_MT016x016x32_GRVW02_PBC1_TT02_02_USFGRO01_VW02_WG08_08_01
    SolutionIndex: 5
    SolutionNameMin: Cijk_Ailk_Bjlk_HB_MT064x064x08_GRVW08_PBC0_TT08_08_USFGRO00_VW08_WG08_08_01
    SolutionIndex: 6
    SolutionNameMin: Cijk_Ailk_Bjlk_HB_MT032x016x32_GRVW02_PBC1_TT02_02_USFGRO01_VW02_WG16_08_01
    SolutionIndex: 7
    SolutionNameMin: Cijk_Ailk_Bjlk_HB_MT016x016x16_GRVW02_PBC1_TT02_02_USFGRO01_VW02_WG08_08_01
    SolutionIndex: 8
    SolutionNameMin: Cijk_Ailk_Bjlk_HB_MT128x064x08_GRVW04_PBC0_TT08_04_USFGRO00_VW04_WG16_16_01
    SolutionIndex: 9
    SolutionNameMin: Cijk_Ailk_Bjlk_HB_MT064x064x16_GRVW04_PBC0_TT04_04_USFGRO00_VW04_WG16_16_01
    SolutionIndex: 10
    SolutionNameMin: Cijk_Ailk_Bjlk_HB_MT064x064x32_GRVW04_PBC0_TT04_04_USFGRO00_VW04_WG16_16_01
    SolutionIndex: 11
    SolutionNameMin: Cijk_Ailk_Bjlk_HB_MT064x128x16_GRVW04_PBC0_TT04_08_USFGRO00_VW04_WG16_16_01
    SolutionIndex: 12
    SolutionNameMin: Cijk_Ailk_Bjlk_HB_MT128x064x16_GRVW04_PBC0_TT08_04_USFGRO00_VW04_WG16_16_01
    SolutionIndex: 13
    SolutionNameMin: Cijk_Ailk_Bjlk_HB_MT064x064x16_GRVW04_PBC0_TT04_04_USFGRO00_VW04_WG16_16_01
    SolutionIndex: 14
    SolutionNameMin: Cijk_Ailk_Bjlk_HB_MT128x128x16_GRVW08_PBC0_TT08_08_USFGRO00_VW08_WG16_16_01
- - - [4096, 7133, 1, 4096]
    - [14, 19051.2]
  - - [512, 16, 1, 512]
    - [7, 299.593]
  - - [2048, 7133, 1, 2048]
    - [14, 18735.9]
  - - [2560, 7133, 1, 2560]
    - [12, 18675.2]
  - - [1024, 1024, 1, 1024]
    - [12, 14278.3]
  - - [3072, 7435, 1, 1024]
    - [5, 18546.7]
  - - [1024, 32, 1, 512]
    - [3, 1226.4]
  - - [1760, 7133, 1, 1760]
    - [11, 17778.3]
  - - [7680, 5481, 1, 2560]
    - [14, 18834.0]
  - - [1024, 16, 1, 512]
    - [2, 579.324]
  - - [512, 32, 1, 512]
    - [6, 639.376]
- - - -1
    - - - 128
        - - - 4
            - - [-1, 1]
          - - 64
            - - [4, 1]
              - [64, 0]
              - [128, 1]
              - [704, 0]
              - [1024, 1]
              - [2944, 0]
              - [3584, 1]
              - [4288, 9]
              - [5888, 0]
              - [-1, 9]
          - - 128
            - - [64, 1]
              - [256, 0]
              - [448, 1]
              - [704, 0]
              - [1408, 1]
              - [1856, 0]
              - [2368, 9]
              - [2944, 0]
              - [5888, 9]
              - [-1, 8]
          - - 256
            - - [4, 1]
              - [64, 0]
              - [448, 1]
              - [-1, 9]
          - - 448
            - - [4, 1]
              - [64, 0]
              - [128, 1]
              - [448, 0]
              - [2368, 9]
              - [2944, 8]
              - [-1, 9]
          - - 704
            - - [128, 1]
              - [704, 9]
              - [1024, 8]
              - [1408, 9]
              - [1856, 8]
              - [-1, 9]
          - - 1024
            - - [64, 1]
              - [128, 0]
              - [704, 9]
              - [1024, 8]
              - [2944, 9]
              - [3584, 8]
              - [4288, 9]
              - [-1, 8]
          - - 1408
            - - [128, 1]
              - [1408, 9]
              - [1856, 8]
              - [4288, 9]
              - [-1, 8]
          - - 1856
            - - [64, 1]
              - [128, 0]
              - [-1, 9]
          - - 2368
            - - [64, 1]
              - [-1, 9]
          - - 2944
            - - [4, 1]
              - [128, 0]
              - [256, 9]
              - [448, 8]
              - [1408, 9]
              - [2368, 8]
              - [3584, 9]
              - [5888, 8]
              - [-1, 9]
          - - 3584
            - - [4, 1]
              - [64, 0]
              - [2368, 9]
              - [-1, 8]
          - - 4288
            - - [4, 1]
              - [64, 0]
              - [1024, 9]
              - [1408, 8]
              - [2944, 9]
              - [-1, 8]
          - - 5056
            - - [4, 1]
              - [64, 0]
              - [128, 9]
              - [256, 8]
              - [448, 9]
              - [704, 8]
              - [1024, 9]
              - [1408, 8]
              - [2944, 9]
              - [-1, 8]
          - - 5888
            - - [4, 1]
              - [64, 0]
              - [128, 9]
              - [256, 8]
              - [448, 9]
              - [704, 8]
              - [1024, 9]
              - [-1, 8]
          - - -1
            - - [4, 1]
              - [1408, 9]
              - [-1, 8]
      - - 256
        - - - 4
            - - [4, 7]
              - [64, 4]
              - [128, 7]
              - [704, 4]
              - [-1, 7]
          - - 64
            - - [64, 7]
              - [1024, 2]
              - [1408, 4]
              - [1856, 2]
              - [2368, 6]
              - [3584, 7]
              - [-1, 13]
          - - 128
            - - [4, 4]
              - [1024, 2]
              - [1408, 7]
              - [1856, 2]
              - [5888, 13]
              - [-1, 10]
          - - 256
            - - [4, 4]
              - [448, 2]
              - [2944, 13]
              - [3584, 10]
              - [-1, 13]
          - - 448
            - - [4, 4]
              - [64, 7]
              - [256, 2]
              - [448, 6]
              - [2368, 13]
              - [2944, 11]
              - [3584, 13]
              - [4288, 11]
              - [5888, 13]
              - [-1, 11]
          - - 704
            - - [4, 4]
              - [64, 3]
              - [128, 2]
              - [1024, 13]
              - [1408, 10]
              - [2368, 13]
              - [5056, 11]
              - [-1, 5]
          - - 1024
            - - [4, 7]
              - [64, 6]
              - [128, 2]
              - [1408, 13]
              - [2944, 12]
              - [4288, 13]
              - [-1, 14]
          - - 1408
            - - [4, 7]
              - [64, 2]
              - [128, 7]
              - [704, 13]
              - [1856, 12]
              - [2368, 13]
              - [3584, 14]
              - [4288, 5]
              - [5056, 14]
              - [5888, 5]
              - [-1, 12]
          - - 1856
            - - [4, 7]
              - [64, 2]
              - [256, 13]
              - [448, 12]
              - [704, 13]
              - [1856, 11]
              - [2368, 13]
              - [3584, 11]
              - [5056, 5]
              - [-1, 11]
          - - 2368
            - - [4, 7]
              - [64, 6]
              - [704, 13]
              - [1024, 11]
              - [1856, 13]
              - [2368, 11]
              - [2944, 5]
              - [3584, 12]
              - [5056, 5]
              - [5888, 11]
              - [-1, 14]
          - - 2944
            - - [4, 7]
              - [64, 2]
              - [128, 13]
              - [256, 10]
              - [448, 13]
              - [704, 12]
              - [1024, 11]
              - [1408, 14]
              - [1856, 12]
              - [2368, 14]
              - [2944, 12]
              - [3584, 11]
              - [4288, 12]
              - [5056, 5]
              - [-1, 14]
          - - 3584
            - - [4, 7]
              - [64, 2]
              - [448, 13]
              - [704, 12]
              - [1024, 11]
              - [1408, 14]
              - [2944, 12]
              - [3584, 14]
              - [5056, 5]
              - [-1, 14]
          - - 4288
            - - [4, 4]
              - [256, 13]
              - [1024, 12]
              - [2368, 5]
              - [2944, 11]
              - [3584, 14]
              - [5056, 5]
              - [5888, 14]
              - [-1, 5]
          - - 5056
            - - [4, 7]
              - [448, 13]
              - [704, 12]
              - [5056, 5]
              - [5888, 14]
              - [-1, 5]
          - - 5888
            - - [4, 7]
              - [128, 13]
              - [256, 12]
              - [448, 13]
              - [1024, 5]
              - [1408, 14]
              - [2368, 12]
              - [3584, 14]
              - [5056, 5]
              - [-1, 14]
          - - -1
            - - [4, 4]
              - [256, 13]
              - [448, 12]
              - [704, 13]
              - [1024, 14]
              - [1856, 12]
              - [2368, 5]
              - [3584, 14]
              - [5056, 5]
              - [-1, 14]
      - - 1280
        - - - 4
            - - [-1, 4]
          - - 64
            - - [64, 4]
              - [256, 6]
              - [1408, 4]
              - [1856, 3]
              - [2368, 6]
              - [2944, 2]
              - [3584, 10]
              - [-1, 13]
          - - 128
            - - [4, 4]
              - [128, 6]
              - [704, 4]
              - [1024, 3]
              - [1408, 13]
              - [1856, 10]
              - [5056, 13]
              - [-1, 10]
          - - 256
            - - [4, 4]
              - [64, 6]
              - [128, 4]
              - [256, 6]
              - [448, 3]
              - [2368, 13]
              - [2944, 10]
              - [5056, 13]
              - [5888, 12]
              - [-1, 13]
          - - 448
            - - [128, 4]
              - [256, 3]
              - [448, 13]
              - [704, 10]
              - [1024, 13]
              - [1408, 10]
              - [2368, 13]
              - [2944, 11]
              - [3584, 13]
              - [4288, 11]
              - [5888, 13]
              - [-1, 11]
          - - 704
            - - [64, 4]
              - [128, 6]
              - [2368, 13]
              - [5056, 11]
              - [5888, 5]
              - [-1, 14]
          - - 1024
            - - [64, 4]
              - [128, 6]
              - [704, 13]
              - [1024, 10]
              - [3584, 12]
              - [4288, 13]
              - [-1, 14]
          - - 1408
            - - [4, 4]
              - [128, 6]
              - [448, 13]
              - [704, 12]
              - [1024, 11]
              - [1856, 12]
              - [2368, 13]
              - [5888, 14]
              - [-1, 11]
          - - 1856
            - - [4, 4]
              - [64, 3]
              - [704, 13]
              - [1024, 12]
              - [1408, 11]
              - [1856, 12]
              - [2368, 13]
              - [3584, 11]
              - [4288, 14]
              - [5056, 5]
              - [-1, 11]
          - - 2368
            - - [4, 4]
              - [64, 6]
              - [704, 13]
              - [1024, 11]
              - [1856, 13]
              - [2368, 11]
              - [2944, 14]
              - [3584, 11]
              - [4288, 5]
              - [5056, 14]
              - [-1, 11]
          - - 2944
            - - [4, 4]
              - [64, 13]
              - [128, 10]
              - [256, 13]
              - [704, 12]
              - [1408, 14]
              - [1856, 12]
              - [2368, 14]
              - [2944, 11]
              - [5056, 12]
              - [5888, 14]
              - [-1, 12]
          - - 3584
            - - [4, 4]
              - [128, 13]
              - [256, 10]
              - [448, 13]
              - [1024, 12]
              - [1408, 14]
              - [1856, 12]
              - [2368, 11]
              - [2944, 12]
              - [3584, 11]
              - [4288, 14]
              - [5056, 12]
              - [-1, 11]
          - - 4288
            - - [4, 4]
              - [256, 13]
              - [704, 12]
              - [1024, 13]
              - [1856, 14]
              - [2368, 5]
              - [2944, 11]
              - [3584, 14]
              - [5056, 5]
              - [5888, 11]
              - [-1, 5]
          - - 5056
            - - [4, 4]
              - [448, 13]
              - [704, 12]
              - [1408, 14]
              - [1856, 5]
              - [2368, 14]
              - [3584, 11]
              - [4288, 5]
              - [5888, 14]
              - [-1, 5]
          - - 5888
            - - [4, 4]
              - [448, 13]
              - [704, 12]
              - [1408, 14]
              - [2368, 12]
              - [2944, 14]
              - [5056, 12]
              - [-1, 14]
          - - -1
            - - [4, 4]
              - [64, 13]
              - [128, 12]
              - [256, 13]
              - [448, 12]
              - [1024, 14]
              - [3584, 12]
              - [5056, 5]
              - [-1, 14]
      - - -1
        - - - 4
            - - [-1, 4]
          - - 64
            - - [256, 4]
              - [448, 6]
              - [704, 4]
              - [1408, 6]
              - [1856, 3]
              - [2368, 6]
              - [4288, 10]
              - [5056, 13]
              - [-1, 10]
          - - 128
            - - [4, 4]
              - [64, 6]
              - [256, 4]
              - [704, 6]
              - [1024, 3]
              - [1856, 10]
              - [2368, 13]
              - [2944, 10]
              - [4288, 13]
              - [5888, 10]
              - [-1, 11]
          - - 256
            - - [4, 4]
              - [64, 6]
              - [256, 4]
              - [448, 3]
              - [1024, 10]
              - [1408, 13]
              - [1856, 10]
              - [2368, 13]
              - [2944, 10]
              - [3584, 12]
              - [5056, 13]
              - [5888, 11]
              - [-1, 13]
          - - 448
            - - [128, 4]
              - [256, 3]
              - [448, 10]
              - [1408, 13]
              - [1856, 12]
              - [2368, 13]
              - [2944, 11]
              - [3584, 13]
              - [4288, 11]
              - [5888, 13]
              - [-1, 11]
          - - 704
            - - [4, 4]
              - [128, 6]
              - [256, 10]
              - [1024, 13]
              - [1408, 11]
              - [2368, 13]
              - [5888, 11]
              - [-1, 14]
          - - 1024
            - - [64, 4]
              - [128, 3]
              - [448, 10]
              - [704, 13]
              - [1024, 11]
              - [2368, 12]
              - [2944, 14]
              - [3584, 12]
              - [4288, 13]
              - [-1, 14]
          - - 1408
            - - [4, 4]
              - [64, 6]
              - [128, 10]
              - [256, 13]
              - [448, 10]
              - [1856, 12]
              - [2368, 13]
              - [5888, 14]
              - [-1, 11]
          - - 1856
            - - [4, 4]
              - [64, 3]
              - [128, 10]
              - [256, 13]
              - [448, 11]
              - [704, 13]
              - [1856, 11]
              - [2368, 13]
              - [3584, 11]
              - [4288, 14]
              - [5056, 5]
              - [-1, 11]
          - - 2368
            - - [4, 4]
              - [64, 6]
              - [704, 13]
              - [1024, 11]
              - [1856, 13]
              - [2368, 11]
              - [2944, 14]
              - [3584, 11]
              - [4288, 5]
              - [5056, 14]
              - [-1, 11]
          - - 2944
            - - [4, 4]
              - [128, 10]
              - [256, 13]
              - [448, 11]
              - [704, 12]
              - [1408, 14]
              - [1856, 12]
              - [2368, 14]
              - [2944, 12]
              - [3584, 11]
              - [5056, 12]
              - [5888, 14]
              - [-1, 11]
          - - 3584
            - - [4, 4]
              - [128, 10]
              - [256, 12]
              - [448, 13]
              - [1024, 12]
              - [1408, 14]
              - [2368, 12]
              - [2944, 11]
              - [3584, 12]
              - [4288, 14]
              - [5056, 12]
              - [5888, 11]
              - [-1, 12]
          - - 4288
            - - [4, 4]
              - [128, 10]
              - [256, 13]
              - [704, 12]
              - [1024, 13]
              - [1856, 14]
              - [2368, 5]
              - [2944, 11]
              - [3584, 14]
              - [5056, 5]
              - [5888, 11]
              - [-1, 5]
          - - 5056
            - - [4, 4]
              - [128, 10]
              - [448, 13]
              - [704, 12]
              - [1408, 14]
              - [1856, 5]
              - [2368, 14]
              - [3584, 11]
              - [4288, 5]
              - [5056, 14]
              - [5888, 11]
              - [-1, 5]
          - - 5888
            - - [4, 4]
              - [64, 10]
              - [128, 13]
              - [256, 12]
              - [448, 13]
              - [704, 12]
              - [1408, 14]
              - [2368, 12]
              - [2944, 14]
              - [3584, 11]
              - [5056, 12]
              - [-1, 14]
          - - -1
            - - [4, 4]
              - [64, 10]
              - [128, 12]
              - [256, 13]
              - [448, 12]
              - [1024, 14]
              - [1408, 11]
              - [2368, 12]
              - [3584, 11]
              - [5056, 5]
              - [-1, 14]
