library/src/blas3/Tensile/Logic/asm_full/vega10_Cijk_Ailk_Bljk_SB.yaml
- {MinimumRequiredVersion: 4.5.0}
- vega10
- gfx900
- [Device 6863, Device 6862, Device 687f, Device 6860, Device 6861, 'Vega 10 XTX [Radeon
    SolutionIndex: 0
    SolutionNameMin: Cijk_Ailk_Bljk_SB_MT064x016x16_DTL0_GRVW02_LPB00_PBC0_PGR1_TT04_02_USFGRO00_VW02_WG16_08_02
    SolutionIndex: 1
    SolutionNameMin: Cijk_Ailk_Bljk_SB_MT128x016x16_DTL0_GRVW04_LPB00_PBC0_PGR0_TT04_04_USFGRO00_VW04_WG32_04_02
    SolutionIndex: 2
    SolutionNameMin: Cijk_Ailk_Bljk_SB_MT032x008x32_DTL0_GRVW02_LPB00_PBC0_PGR1_TT02_02_USFGRO00_VW02_WG16_04_04
    SolutionIndex: 3
    SolutionNameMin: Cijk_Ailk_Bljk_SB_MT128x008x32_DTL0_GRVW04_LPB00_PBC0_PGR0_TT04_04_USFGRO00_VW04_WG32_02_04
    SolutionIndex: 4
    SolutionNameMin: Cijk_Ailk_Bljk_SB_MT064x008x32_DTL0_GRVW02_LPB00_PBC0_PGR0_TT08_02_USFGRO00_VW02_WG08_04_08
    SolutionIndex: 5
    SolutionNameMin: Cijk_Ailk_Bljk_SB_MT064x032x32_DTL0_GRVW04_LPB00_PBC0_PGR0_TT04_04_USFGRO00_VW04_WG16_08_02
    SolutionIndex: 6
    SolutionNameMin: Cijk_Ailk_Bljk_SB_MT128x016x32_DTL0_GRVW04_LPB00_PBC0_PGR1_TT04_04_USFGRO00_VW04_WG32_04_02
    SolutionIndex: 7
    SolutionNameMin: Cijk_Ailk_Bljk_SB_MT128x008x32_DTL0_GRVW04_LPB00_PBC0_PGR0_TT04_04_USFGRO00_VW04_WG32_02_04
    SolutionIndex: 8
    SolutionNameMin: Cijk_Ailk_Bljk_SB_MT128x008x32_DTL0_GRVW04_LPB00_PBC0_PGR1_TT04_04_USFGRO00_VW04_WG32_02_04
    SolutionIndex: 9
    SolutionNameMin: Cijk_Ailk_Bljk_SB_MT064x004x64_DTL0_GRVW02_LPB00_PBC0_PGR0_TT02_02_USFGRO00_VW02_WG32_02_04
    SolutionIndex: 10
    SolutionNameMin: Cijk_Ailk_Bljk_SB_MT048x036x16_DTL0_GRVW01_LPB00_PBC1_PGR1_TT06_03_USFGRO01_VW01_WG08_12_02
    SolutionIndex: 11
    SolutionNameMin: Cijk_Ailk_Bljk_SB_MT036x048x16_DTL0_GRVW01_LPB00_PBC1_PGR1_TT03_03_USFGRO01_VW01_WG12_16_01
    SolutionIndex: 12
    SolutionNameMin: Cijk_Ailk_Bljk_SB_MT048x048x16_DTL0_GRVW01_LPB00_PBC1_PGR1_TT03_03_USFGRO01_VW01_WG16_16_01
    SolutionIndex: 13
    SolutionNameMin: Cijk_Ailk_Bljk_SB_MT024x024x24_DTL0_GRVW01_LPB00_PBC1_PGR1_TT03_04_USFGRO01_VW01_WG08_06_04
    SolutionIndex: 14
    SolutionNameMin: Cijk_Ailk_Bljk_SB_MT048x036x32_DTL0_GRVW01_LPB00_PBC1_PGR1_TT06_03_USFGRO01_VW01_WG08_12_02
    SolutionIndex: 15
    SolutionNameMin: Cijk_Ailk_Bljk_SB_MT048x024x32_DTL0_GRVW02_LPB00_PBC0_PGR1_TT06_04_USFGRO00_VW02_WG08_06_04
    SolutionIndex: 16
    SolutionNameMin: Cijk_Ailk_Bljk_SB_MT032x016x08_DTL0_GRVW02_LPB00_PBC0_PGR1_TT04_02_USFGRO00_VW02_WG08_08_02
    SolutionIndex: 17
    SolutionNameMin: Cijk_Ailk_Bljk_SB_MT032x016x08_DTL0_GRVW02_LPB00_PBC0_PGR1_TT04_02_USFGRO00_VW02_WG08_08_02
    SolutionIndex: 18
    SolutionNameMin: Cijk_Ailk_Bljk_SB_MT032x032x08_DTL0_GRVW04_LPB00_PBC1_PGR1_TT04_04_USFGRO01_VW04_WG08_08_04
    SolutionIndex: 19
    SolutionNameMin: Cijk_Ailk_Bljk_SB_MT128x016x16_DTL0_GRVW04_LPB00_PBC0_PGR1_TT04_04_USFGRO00_VW04_WG32_04_02
    SolutionIndex: 20
    SolutionNameMin: Cijk_Ailk_Bljk_SB_MT064x016x16_DTL0_GRVW04_LPB00_PBC0_PGR1_TT04_04_USFGRO00_VW04_WG16_04_04
    SolutionIndex: 21
    SolutionNameMin: Cijk_Ailk_Bljk_SB_MT032x016x16_DTL0_GRVW02_LPB00_PBC0_PGR1_TT04_02_USFGRO00_VW02_WG08_08_02
    SolutionIndex: 22
    SolutionNameMin: Cijk_Ailk_Bljk_SB_MT032x032x16_DTL0_GRVW04_LPB00_PBC0_PGR1_TT04_04_USFGRO00_VW04_WG08_08_02
    SolutionIndex: 23
    SolutionNameMin: Cijk_Ailk_Bljk_SB_MT064x032x16_DTL0_GRVW04_LPB00_PBC0_PGR1_TT08_04_USFGRO00_VW04_WG08_08_02
    SolutionIndex: 24
    SolutionNameMin: Cijk_Ailk_Bljk_SB_MT064x016x16_DTL0_GRVW02_LPB00_PBC0_PGR1_TT04_02_USFGRO00_VW02_WG16_08_02
    SolutionIndex: 25
    SolutionNameMin: Cijk_Ailk_Bljk_SB_MT064x032x16_DTL0_GRVW04_LPB00_PBC0_PGR1_TT04_04_USFGRO00_VW04_WG16_08_02
    SolutionIndex: 26
    SolutionNameMin: Cijk_Ailk_Bljk_SB_MT128x032x16_DTL0_GRVW04_LPB00_PBC0_PGR1_TT08_04_USFGRO00_VW04_WG16_08_02
    SolutionIndex: 27
    SolutionNameMin: Cijk_Ailk_Bljk_SB_MT032x016x16_DTL0_GRVW02_LPB00_PBC0_PGR1_TT04_02_USFGRO00_VW02_WG08_08_02
    SolutionIndex: 28
    SolutionNameMin: Cijk_Ailk_Bljk_SB_MT064x032x16_DTL0_GRVW04_LPB00_PBC0_PGR1_TT08_04_USFGRO00_VW04_WG08_08_02
    SolutionIndex: 29
    SolutionNameMin: Cijk_Ailk_Bljk_SB_MT032x016x16_DTL0_GRVW02_LPB00_PBC0_PGR1_TT02_02_USFGRO00_VW02_WG16_08_02
    SolutionIndex: 30
    SolutionNameMin: Cijk_Ailk_Bljk_SB_MT064x016x16_DTL0_GRVW02_LPB00_PBC0_PGR1_TT04_02_USFGRO00_VW02_WG16_08_02
    SolutionIndex: 31
    SolutionNameMin: Cijk_Ailk_Bljk_SB_MT064x032x16_DTL0_GRVW04_LPB00_PBC0_PGR1_TT04_04_USFGRO00_VW04_WG16_08_02
    SolutionIndex: 32
    SolutionNameMin: Cijk_Ailk_Bljk_SB_MT128x032x16_DTL0_GRVW04_LPB00_PBC0_PGR1_TT08_04_USFGRO00_VW04_WG16_08_02
    SolutionIndex: 33
    SolutionNameMin: Cijk_Ailk_Bljk_SB_MT016x016x16_DTL0_GRVW02_LPB00_PBC1_PGR1_TT02_02_USFGRO01_VW02_WG08_08_04
    SolutionIndex: 34
    SolutionNameMin: Cijk_Ailk_Bljk_SB_MT064x016x16_DTL0_GRVW02_LPB00_PBC0_PGR1_TT04_02_USFGRO00_VW02_WG16_08_02
    SolutionIndex: 35
    SolutionNameMin: Cijk_Ailk_Bljk_SB_MT064x032x16_DTL0_GRVW04_LPB00_PBC0_PGR1_TT08_04_USFGRO00_VW04_WG08_08_04
    SolutionIndex: 36
    SolutionNameMin: Cijk_Ailk_Bljk_SB_MT032x008x32_DTL0_GRVW02_LPB00_PBC0_PGR1_TT02_02_USFGRO00_VW02_WG16_04_04
    SolutionIndex: 37
    SolutionNameMin: Cijk_Ailk_Bljk_SB_MT032x016x32_DTL0_GRVW02_LPB00_PBC0_PGR1_TT04_02_USFGRO00_VW02_WG08_08_04
    SolutionIndex: 38
    SolutionNameMin: Cijk_Ailk_Bljk_SB_MT032x032x32_DTL0_GRVW04_LPB00_PBC0_PGR1_TT04_04_USFGRO00_VW04_WG08_08_04
    SolutionIndex: 39
    SolutionNameMin: Cijk_Ailk_Bljk_SB_MT032x016x32_DTL0_GRVW02_LPB00_PBC0_PGR1_TT02_02_USFGRO00_VW02_WG16_08_02
    SolutionIndex: 40
    SolutionNameMin: Cijk_Ailk_Bljk_SB_MT128x032x32_DTL0_GRVW04_LPB00_PBC0_PGR1_TT08_04_USFGRO00_VW04_WG16_08_02
    SolutionIndex: 41
    SolutionNameMin: Cijk_Ailk_Bljk_SB_MT032x016x32_DTL0_GRVW02_LPB00_PBC0_PGR1_TT04_02_USFGRO00_VW02_WG08_08_04
    SolutionIndex: 42
    SolutionNameMin: Cijk_Ailk_Bljk_SB_MT064x016x32_DTL0_GRVW02_LPB00_PBC0_PGR1_TT04_02_USFGRO00_VW02_WG16_08_02
    SolutionIndex: 43
    SolutionNameMin: Cijk_Ailk_Bljk_SB_MT128x032x32_DTL0_GRVW04_LPB00_PBC0_PGR1_TT08_04_USFGRO00_VW04_WG16_08_02
    SolutionIndex: 44
    SolutionNameMin: Cijk_Ailk_Bljk_SB_MT128x064x32_DTL0_GRVW04_LPB00_PBC0_PGR1_TT08_08_USFGRO00_VW04_WG16_08_02
    SolutionIndex: 45
    SolutionNameMin: Cijk_Ailk_Bljk_SB_MT032x008x32_DTL0_GRVW02_LPB00_PBC0_PGR1_TT02_02_USFGRO00_VW02_WG16_04_04
    SolutionIndex: 46
    SolutionNameMin: Cijk_Ailk_Bljk_SB_MT064x032x32_DTL0_GRVW04_LPB00_PBC0_PGR1_TT08_04_USFGRO00_VW04_WG08_08_04
    SolutionIndex: 47
    SolutionNameMin: Cijk_Ailk_Bljk_SB_MT032x008x32_DTL0_GRVW02_LPB00_PBC0_PGR1_TT02_02_USFGRO00_VW02_WG16_04_04
    SolutionIndex: 48
    SolutionNameMin: Cijk_Ailk_Bljk_SB_MT032x008x32_DTL0_GRVW02_LPB00_PBC0_PGR1_TT02_02_USFGRO00_VW02_WG16_04_04
    SolutionIndex: 49
    SolutionNameMin: Cijk_Ailk_Bljk_SB_MT064x064x08_DTL0_GRVW04_LPB00_PBC0_PGR1_TT04_04_USFGRO00_VW04_WG16_16_01
    SolutionIndex: 50
    SolutionNameMin: Cijk_Ailk_Bljk_SB_MT064x064x16_DTL0_GRVW04_LPB00_PBC0_PGR0_TT04_04_USFGRO00_VW04_WG16_16_01
    SolutionIndex: 51
    SolutionNameMin: Cijk_Ailk_Bljk_SB_MT064x064x16_DTL0_GRVW04_LPB00_PBC0_PGR1_TT04_04_USFGRO00_VW04_WG16_16_01
    SolutionIndex: 52
    SolutionNameMin: Cijk_Ailk_Bljk_SB_MT064x064x16_DTL0_GRVW04_LPB00_PBC0_PGR1_TT04_04_USFGRO00_VW04_WG16_16_01
    SolutionIndex: 53
    SolutionNameMin: Cijk_Ailk_Bljk_SB_MT064x128x16_DTL0_GRVW04_LPB00_PBC0_PGR1_TT04_08_USFGRO00_VW04_WG16_16_01
    SolutionIndex: 54
    SolutionNameMin: Cijk_Ailk_Bljk_SB_MT064x064x08_DTL0_GRVW04_LPB00_PBC0_PGR0_TT04_04_USFGRO00_VW04_WG16_16_01
    SolutionIndex: 55
    SolutionNameMin: Cijk_Ailk_Bljk_SB_MT064x064x08_DTL0_GRVW04_LPB00_PBC0_PGR1_TT04_04_USFGRO00_VW04_WG16_16_01
    SolutionIndex: 56
    SolutionNameMin: Cijk_Ailk_Bljk_SB_MT128x064x08_DTL0_GRVW04_LPB00_PBC0_PGR1_TT08_04_USFGRO00_VW04_WG16_16_01
    SolutionIndex: 57
    SolutionNameMin: Cijk_Ailk_Bljk_SB_MT128x128x08_DTL0_GRVW04_LPB00_PBC0_PGR1_TT08_08_USFGRO00_VW04_WG16_16_01
    SolutionIndex: 58
    SolutionNameMin: Cijk_Ailk_Bljk_SB_MT064x128x08_DTL0_GRVW04_LPB00_PBC0_PGR1_TT04_08_USFGRO00_VW04_WG16_16_01
    SolutionIndex: 59
    SolutionNameMin: Cijk_Ailk_Bljk_SB_MT128x064x08_DTL0_GRVW04_LPB00_PBC0_PGR1_TT08_04_USFGRO00_VW04_WG16_16_01
    SolutionIndex: 60
    SolutionNameMin: Cijk_Ailk_Bljk_SB_MT128x128x08_DTL0_GRVW04_LPB00_PBC0_PGR1_TT08_08_USFGRO00_VW04_WG16_16_01
    SolutionIndex: 61
    SolutionNameMin: Cijk_Ailk_Bljk_SB_MT064x064x16_DTL0_GRVW04_LPB00_PBC0_PGR1_TT04_04_USFGRO00_VW04_WG16_16_01
    SolutionIndex: 62
    SolutionNameMin: Cijk_Ailk_Bljk_SB_MT064x128x16_DTL0_GRVW04_LPB00_PBC0_PGR1_TT04_08_USFGRO00_VW04_WG16_16_01
    SolutionIndex: 63
    SolutionNameMin: Cijk_Ailk_Bljk_SB_MT128x064x16_DTL0_GRVW04_LPB00_PBC0_PGR0_TT08_04_USFGRO00_VW04_WG16_16_01
    SolutionIndex: 64
    SolutionNameMin: Cijk_Ailk_Bljk_SB_MT128x064x16_DTL0_GRVW04_LPB00_PBC0_PGR1_TT08_04_USFGRO00_VW04_WG16_16_01
    SolutionIndex: 65
    SolutionNameMin: Cijk_Ailk_Bljk_SB_MT128x128x16_DTL0_GRVW04_LPB00_PBC0_PGR0_TT08_08_USFGRO00_VW04_WG16_16_01
    SolutionIndex: 66
    SolutionNameMin: Cijk_Ailk_Bljk_SB_MT128x128x16_DTL0_GRVW04_LPB00_PBC0_PGR1_TT08_08_USFGRO00_VW04_WG16_16_01
    SolutionIndex: 67
    SolutionNameMin: Cijk_Ailk_Bljk_SB_MT064x064x16_DTL0_GRVW04_LPB00_PBC0_PGR0_TT04_04_USFGRO00_VW04_WG16_16_01
    SolutionIndex: 68
    SolutionNameMin: Cijk_Ailk_Bljk_SB_MT064x064x16_DTL0_GRVW04_LPB00_PBC0_PGR1_TT04_04_USFGRO00_VW04_WG16_16_01
    SolutionIndex: 69
    SolutionNameMin: Cijk_Ailk_Bljk_SB_MT128x064x16_DTL0_GRVW04_LPB00_PBC0_PGR1_TT08_04_USFGRO00_VW04_WG16_16_01
    SolutionIndex: 70
    SolutionNameMin: Cijk_Ailk_Bljk_SB_MT128x096x16_DTL0_GRVW02_LPB00_PBC0_PGR1_TT08_06_USFGRO00_VW02_WG16_16_01
    SolutionIndex: 71
    SolutionNameMin: Cijk_Ailk_Bljk_SB_MT128x128x16_DTL0_GRVW04_LPB00_PBC0_PGR1_TT08_08_USFGRO00_VW04_WG16_16_01
    SolutionIndex: 72
    SolutionNameMin: Cijk_Ailk_Bljk_SB_MT064x064x32_DTL0_GRVW04_LPB00_PBC0_PGR1_TT04_04_USFGRO00_VW04_WG16_16_01
    SolutionIndex: 73
    SolutionNameMin: Cijk_Ailk_Bljk_SB_MT128x064x32_DTL0_GRVW04_LPB00_PBC0_PGR1_TT08_04_USFGRO00_VW04_WG16_16_01
    SolutionIndex: 74
    SolutionNameMin: Cijk_Ailk_Bljk_SB_MT128x064x32_DTL0_GRVW04_LPB00_PBC0_PGR0_TT08_04_USFGRO00_VW04_WG16_16_01
    SolutionIndex: 75
    SolutionNameMin: Cijk_Ailk_Bljk_SB_MT032x032x02_DTL0_GRVW04_LPB00_PBC0_PGR1_TT04_04_USFGRO00_VW04_WG08_08_01
    SolutionIndex: 76
    SolutionNameMin: Cijk_Ailk_Bljk_SB_MT032x032x08_DTL0_GRVW04_LPB00_PBC1_PGR1_TT04_04_USFGRO01_VW04_WG08_08_04
    SolutionIndex: 77
    SolutionNameMin: Cijk_Ailk_Bljk_SB_MT128x064x08_DTL0_GRVW04_LPB00_PBC0_PGR1_TT04_08_USFGRO00_VW04_WG32_08_01
    SolutionIndex: 78
    SolutionNameMin: Cijk_Ailk_Bljk_SB_MT064x032x16_DTL0_GRVW04_LPB00_PBC0_PGR1_TT04_04_USFGRO00_VW04_WG16_08_01
    SolutionIndex: 79
    SolutionNameMin: Cijk_Ailk_Bljk_SB_MT128x064x32_DTL0_GRVW04_LPB00_PBC0_PGR1_TT04_04_USFGRO00_VW04_WG32_16_01
    SolutionIndex: 80
    SolutionNameMin: Cijk_Ailk_Bljk_SB_MT128x064x16_DTL0_GRVW04_LPB04_PBC0_PGR1_TT04_08_USFGRO00_VW04_WG32_08_01
    SolutionIndex: 81
    SolutionNameMin: Cijk_Ailk_Bljk_SB_MT128x064x16_DTL0_GRVW04_LPB04_PBC0_PGR1_TT04_04_USFGRO00_VW04_WG32_16_01
    SolutionIndex: 82
    SolutionNameMin: Cijk_Ailk_Bljk_SB_MT128x064x32_DTL0_GRVW04_LPB04_PBC0_PGR1_TT04_04_USFGRO00_VW04_WG32_16_01
    SolutionIndex: 83
    SolutionNameMin: Cijk_Ailk_Bljk_SB_MT128x064x32_DTL0_GRVW04_LPB04_PBC0_PGR1_TT04_04_USFGRO00_VW04_WG32_16_01
    SolutionIndex: 84
    SolutionNameMin: Cijk_Ailk_Bljk_SB_MT064x064x16_DTL0_GRVW04_LPB00_PBC0_PGR0_TT04_04_USFGRO00_VW04_WG16_16_01
    SolutionIndex: 85
    SolutionNameMin: Cijk_Ailk_Bljk_SB_MT064x032x16_DTL0_GRVW01_LPB01_PBC1_PGR0_TT04_04_USFGRO01_VW01_WG16_08_01
    SolutionIndex: 86
    SolutionNameMin: Cijk_Ailk_Bljk_SB_MT064x032x16_DTL0_GRVW01_LPB02_PBC1_PGR0_TT04_04_USFGRO01_VW01_WG16_08_01
    SolutionIndex: 87
    SolutionNameMin: Cijk_Ailk_Bljk_SB_MT064x064x16_DTL0_GRVW01_LPB02_PBC1_PGR0_TT04_04_USFGRO01_VW01_WG16_16_01
    SolutionIndex: 88
    SolutionNameMin: Cijk_Ailk_Bljk_SB_MT128x032x16_DTL0_GRVW01_LPB02_PBC1_PGR0_TT04_04_USFGRO01_VW01_WG32_08_01
    SolutionIndex: 89
    SolutionNameMin: Cijk_Ailk_Bljk_SB_MT064x032x16_DTL0_GRVW01_LPB04_PBC1_PGR0_TT04_04_USFGRO01_VW01_WG16_08_01
    SolutionIndex: 90
    SolutionNameMin: Cijk_Ailk_Bljk_SB_MT128x064x16_DTL0_GRVW01_LPB04_PBC1_PGR0_TT08_04_USFGRO01_VW01_WG16_16_01
    SolutionIndex: 91
    SolutionNameMin: Cijk_Ailk_Bljk_SB_MT064x064x16_DTL0_GRVW04_LPB04_PBC0_PGR0_TT04_08_USFGRO00_VW04_WG16_08_01
    SolutionIndex: 92
    SolutionNameMin: Cijk_Ailk_Bljk_SB_MT128x064x16_DTL0_GRVW04_LPB04_PBC0_PGR0_TT08_04_USFGRO00_VW04_WG16_16_01
    SolutionIndex: 0
    SolutionNameMin: Cijk_Ailk_Bljk_SB_MT128x064x16_DTL0_GRVW04_GSU01_LPB00_PGR1_PLR1_TT08_04_USFGRO0_VW04_WG16_16_01_WGM01
    SolutionIndex: 1
    SolutionNameMin: Cijk_Ailk_Bljk_SB_MT128x064x16_DTL0_GRVW04_GSU01_LPB00_PGR1_PLR1_TT04_08_USFGRO0_VW04_WG32_08_01_WGM01
    SolutionIndex: 2
    SolutionNameMin: Cijk_Ailk_Bljk_SB_MT064x064x32_DTL0_GRVW04_GSU01_LPB00_PGR0_PLR1_TT04_04_USFGRO0_VW04_WG16_16_01_WGM64
    SolutionIndex: 3
    SolutionNameMin: Cijk_Ailk_Bljk_SB_MT128x032x16_DTL0_GRVW01_GSU05_LPB02_PGR0_PLR1_TT04_04_USFGRO01_VW02_WG32_08_01_WGM08
    SolutionIndex: 4
    SolutionNameMin: Cijk_Ailk_Bljk_SB_MT064x128x16_DTL0_GRVW01_GSU01_LPB04_PGR0_PLR1_TT04_08_USFGRO01_VW04_WG16_16_01_WGM01
    SolutionIndex: 5
    SolutionNameMin: Cijk_Ailk_Bljk_SB_MT064x064x16_DTL0_GRVW01_GSU01_LPB04_PGR0_PLR1_TT04_04_USFGRO01_VW04_WG16_16_01_WGM64
    SolutionIndex: 6
    SolutionNameMin: Cijk_Ailk_Bljk_SB_MT256x032x16_DTL1_GRVW01_GSU01_LPB04_PGR0_PLR1_TT08_04_USFGRO01_VW04_WG32_08_01_WGM64
    SolutionIndex: 7
    SolutionNameMin: Cijk_Ailk_Bljk_SB_MT064x128x16_DTL0_GRVW04_GSU01_LPB04_PGR0_PLR1_TT04_08_USFGRO0_VW04_WG16_16_01_WGM01
    SolutionIndex: 8
    SolutionNameMin: Cijk_Ailk_Bljk_SB_MT128x032x16_DTL0_GRVW04_GSU01_LPB04_PGR0_PLR0_TT04_04_USFGRO0_VW04_WG32_08_01_WGM01
    SolutionIndex: 9
    SolutionNameMin: Cijk_Ailk_Bljk_SB_MT064x064x16_DTL0_GRVW04_GSU01_LPB04_PGR0_PLR1_TT04_04_USFGRO0_VW04_WG16_16_01_WGM08
    SolutionIndex: 10
    SolutionNameMin: Cijk_Ailk_Bljk_SB_MT128x064x16_DTL0_GRVW04_GSU01_LPB04_PGR0_PLR1_TT04_08_USFGRO0_VW04_WG32_08_01_WGM08
    SolutionIndex: 11
    SolutionNameMin: Cijk_Ailk_Bljk_SB_MT128x064x16_DTL0_GRVW04_GSU01_LPB04_PGR1_PLR1_TT04_08_USFGRO0_VW04_WG32_08_01_WGM08
    SolutionIndex: 12
    SolutionNameMin: Cijk_Ailk_Bljk_SB_MT064x064x32_DTL0_GRVW04_GSU01_LPB04_PGR0_PLR1_TT04_04_USFGRO0_VW04_WG16_16_01_WGM01
- - - [4096, 7000, 1, 4096]
    - [66, 9285.3]
  - - [5124, 9124, 1, 1760]
    - [60, 9383.46]
  - - [5124, 9124, 1, 2560]
    - [71, 9198.65]
  - - [1760, 32, 1, 1760]
    - [38, 4142.73]
  - - [1024, 1500, 1, 1536]
    - [63, 6723.49]
  - - [512, 24000, 1, 1536]
    - [66, 8932.92]
  - - [3072, 24000, 1, 1024]
    - [71, 9538.81]
  - - [1024, 3000, 1, 2560]
    - [64, 8732.03]
  - - [512, 3136, 1, 2048]
    - [82, 6125.39]
  - - [7680, 4, 1, 2560]
    - [19, 804.275]
  - - [35, 1500, 1, 2048]
    - [15, 2423.15]
  - - [8448, 1500, 1, 2816]
    - [59, 9547.31]
  - - [2560, 7000, 1, 2560]
    - [71, 9585.78]
  - - [3072, 16, 1, 1024]
    - [39, 2264.84]
  - - [512, 48000, 1, 2048]
    - [69, 9226.01]
  - - [1760, 64, 1, 1760]
    - [22, 5472.79]
  - - [1024, 16, 1, 512]
    - [33, 1258.32]
  - - [196, 256, 64, 1024]
    - [88, 4706.39]
  - - [512, 48000, 1, 1536]
    - [71, 9557.15]
  - - [2560, 32, 1, 2560]
    - [38, 4641.05]
  - - [4608, 1500, 1, 1536]
    - [66, 9489.59]
  - - [2048, 128, 1, 2048]
    - [26, 6505.83]
  - - [1024, 24000, 1, 2560]
    - [71, 9709.64]
  - - [4608, 3000, 1, 1536]
    - [69, 9284.57]
  - - [5124, 9124, 1, 2048]
    - [66, 9042.08]
  - - [1024, 700, 1, 512]
    - [68, 6968.14]
  - - [3072, 1, 1, 128]
    - [36, 85.612]
  - - [5124, 700, 1, 2560]
    - [68, 8789.86]
  - - [8448, 16, 1, 2816]
    - [34, 2834.17]
  - - [6144, 6000, 1, 2560]
    - [71, 9647.25]
  - - [4608, 32, 1, 1536]
    - [23, 4223.12]
  - - [35, 8457, 1, 2560]
    - [11, 2207.9]
  - - [3072, 64, 1, 1024]
    - [26, 4279.99]
  - - [512, 16, 1, 512]
    - [45, 857.906]
  - - [7680, 2, 1, 2560]
    - [20, 406.448]
  - - [4224, 1, 1, 128]
    - [17, 93.5742]
  - - [7680, 1, 1, 2560]
    - [19, 202.758]
  - - [128, 1500, 1, 1280]
    - [38, 5385.75]
  - - [35, 8457, 1, 4096]
    - [35, 2526.51]
  - - [1024, 1500, 1, 2816]
    - [64, 8361.76]
  - - [6144, 2, 1, 2560]
    - [19, 395.396]
  - - [8448, 48000, 1, 2816]
    - [71, 9566.25]
  - - [512, 6000, 1, 1536]
    - [66, 7447.5]
  - - [4224, 1500, 1, 176]
    - [56, 9473.71]
  - - [1024, 6000, 1, 2816]
    - [66, 9818.84]
  - - [512, 6000, 1, 2560]
    - [71, 8086.84]
  - - [512, 32, 1, 512]
    - [36, 1451.82]
  - - [2560, 128, 1, 2560]
    - [31, 6720.59]
  - - [4608, 24000, 1, 1536]
    - [71, 9687.14]
  - - [512, 2, 1, 500000]
    - [7, 378.021]
  - - [7680, 48000, 1, 2560]
    - [71, 9467.77]
  - - [3072, 48000, 1, 1024]
    - [66, 9538.54]
  - - [1760, 16, 1, 1760]
    - [36, 2381.0]
  - - [512, 3000, 1, 2816]
    - [59, 8242.55]
  - - [1760, 7000, 1, 1760]
    - [58, 9496.83]
  - - [64, 193600, 1, 256]
    - [72, 4830.72]
  - - [1024, 3000, 1, 2048]
    - [74, 7067.59]
  - - [6144, 4, 1, 2560]
    - [27, 784.946]
  - - [1024, 6000, 1, 2048]
    - [69, 8695.73]
  - - [512, 24000, 1, 2816]
    - [59, 9907.14]
  - - [6144, 48000, 1, 2560]
    - [71, 9414.1]
  - - [8448, 3000, 1, 2816]
    - [60, 9674.53]
  - - [35, 1500, 1, 2560]
    - [12, 3155.37]
  - - [3072, 4, 1, 1024]
    - [36, 660.937]
  - - [4608, 48000, 1, 1536]
    - [71, 9600.07]
  - - [2048, 32, 1, 2048]
    - [42, 3743.56]
  - - [7680, 1500, 1, 2560]
    - [59, 9361.68]
  - - [4096, 128, 1, 4096]
    - [68, 5778.32]
  - - [4608, 16, 1, 1536]
    - [21, 2759.51]
  - - [1024, 1500, 1, 2048]
    - [70, 5934.27]
  - - [3072, 3000, 1, 1024]
    - [66, 8718.64]
  - - [3072, 2, 1, 1024]
    - [36, 333.066]
  - - [8448, 1, 1, 2816]
    - [3, 198.361]
  - - [1024, 48000, 1, 2560]
    - [71, 9788.98]
  - - [1024, 3000, 1, 2816]
    - [66, 9210.54]
  - - [128, 1, 1, 1408]
    - [47, 39.2431]
  - - [35, 8457, 1, 1760]
    - [10, 4409.14]
  - - [1024, 2, 1, 512]
    - [45, 181.477]
  - - [1024, 4, 1, 500000]
    - [1, 797.639]
  - - [6144, 1, 1, 2560]
    - [19, 199.933]
  - - [1024, 48000, 1, 2816]
    - [71, 9879.43]
  - - [512, 48000, 1, 2816]
    - [59, 9876.04]
  - - [2048, 16, 1, 2048]
    - [37, 2403.01]
  - - [1024, 24000, 1, 1536]
    - [66, 9607.78]
  - - [64, 193600, 1, 64]
    - [78, 5339.11]
  - - [7680, 6000, 1, 2560]
    - [71, 9583.37]
  - - [1760, 128, 1, 1760]
    - [23, 6356.85]
  - - [35, 8457, 1, 2048]
    - [14, 1903.11]
  - - [512, 1500, 1, 2816]
    - [55, 6331.62]
  - - [512, 1, 1, 512]
    - [9, 59.9803]
  - - [512, 16, 1, 500000]
    - [6, 2880.94]
  - - [512, 8, 1, 500000]
    - [0, 1461.1]
  - - [512, 24000, 1, 2560]
    - [59, 9422.15]
  - - [6144, 3000, 1, 2560]
    - [71, 9592.55]
  - - [1024, 24000, 1, 2816]
    - [71, 9846.78]
  - - [2048, 7000, 1, 2048]
    - [69, 9211.34]
  - - [7680, 3000, 1, 2560]
    - [59, 9613.51]
  - - [1024, 4, 1, 512]
    - [45, 393.204]
  - - [5124, 700, 1, 2048]
    - [65, 7300.58]
  - - [5124, 9124, 1, 4096]
    - [66, 9053.98]
  - - [4096, 64, 1, 4096]
    - [28, 7154.46]
  - - [256, 193600, 1, 64]
    - [81, 6184.21]
  - - [512, 6000, 1, 2048]
    - [73, 6769.05]
  - - [7680, 32, 1, 2560]
    - [23, 5598.63]
  - - [2560, 64, 1, 2560]
    - [25, 5879.6]
  - - [3072, 128, 1, 1024]
    - [64, 5632.77]
  - - [8448, 6000, 1, 2816]
    - [71, 9667.39]
  - - [7680, 64, 1, 2560]
    - [44, 6973.02]
  - - [5124, 1500, 1, 2560]
    - [71, 8974.16]
  - - [1024, 1500, 1, 2560]
    - [56, 7433.41]
  - - [3025, 64, 64, 64]
    - [85, 4817.67]
  - - [512, 4, 1, 512]
    - [45, 232.063]
  - - [1024, 6000, 1, 2560]
    - [64, 9427.58]
  - - [3072, 32, 1, 1024]
    - [38, 3088.4]
  - - [35, 700, 1, 2560]
    - [13, 2461.3]
  - - [196, 1024, 64, 256]
    - [90, 5796.65]
  - - [512, 50176, 1, 128]
    - [81, 7233.29]
  - - [4608, 1, 1, 1536]
    - [24, 186.253]
  - - [49, 512, 64, 2048]
    - [89, 3378.54]
  - - [4096, 32, 1, 4096]
    - [43, 5240.4]
  - - [7680, 24000, 1, 2560]
    - [71, 9447.06]
  - - [8448, 4, 1, 2816]
    - [16, 778.063]
  - - [64, 1, 1, 1216]
    - [47, 14.5915]
  - - [512, 1, 1, 500000]
    - [5, 187.047]
  - - [176, 1500, 1, 1408]
    - [38, 5834.8]
  - - [512, 3000, 1, 1536]
    - [68, 5890.37]
  - - [8448, 24000, 1, 2816]
    - [71, 9589.57]
  - - [4608, 2, 1, 1536]
    - [21, 370.342]
  - - [1024, 48000, 1, 1536]
    - [71, 9752.12]
  - - [7680, 128, 1, 2560]
    - [59, 6070.85]
  - - [3072, 6000, 1, 1024]
    - [69, 8970.02]
  - - [3072, 1500, 1, 128]
    - [56, 8654.66]
  - - [2048, 3136, 1, 512]
    - [80, 7791.94]
  - - [3025, 256, 64, 64]
    - [91, 5748.35]
  - - [1024, 3000, 1, 1536]
    - [56, 8142.45]
  - - [512, 4, 1, 500000]
    - [4, 755.011]
  - - [35, 700, 1, 2048]
    - [15, 2040.21]
  - - [1024, 16, 1, 500000]
    - [1, 3050.03]
  - - [512, 24000, 1, 2048]
    - [69, 8789.09]
  - - [128, 50176, 1, 512]
    - [83, 6009.3]
  - - [1024, 32, 1, 512]
    - [37, 1871.73]
  - - [256, 12544, 1, 1024]
    - [79, 5616.94]
  - - [1024, 12544, 1, 256]
    - [77, 7858.15]
  - - [512, 48000, 1, 2560]
    - [56, 9721.31]
  - - [2560, 16, 1, 2560]
    - [41, 2680.89]
  - - [2048, 64, 1, 2048]
    - [40, 5132.81]
  - - [512, 2, 1, 512]
    - [45, 116.031]
  - - [1024, 1, 1, 512]
    - [48, 88.4725]
  - - [512, 1500, 1, 2560]
    - [64, 5528.23]
  - - [6144, 32, 1, 2560]
    - [32, 5501.63]
  - - [1024, 1, 1, 500000]
    - [6, 199.37]
  - - [6144, 16, 1, 2560]
    - [29, 2987.91]
  - - [1024, 24000, 1, 2048]
    - [66, 9361.39]
  - - [4096, 16, 1, 4096]
    - [41, 3060.58]
  - - [5124, 1500, 1, 2048]
    - [62, 8235.87]
  - - [3072, 1500, 1, 1024]
    - [63, 7809.04]
  - - [1024, 2, 1, 500000]
    - [8, 398.797]
  - - [1024, 8, 1, 500000]
    - [2, 1557.88]
  - - [7680, 16, 1, 2560]
    - [20, 3048.5]
  - - [6144, 1500, 1, 2560]
    - [71, 9678.54]
  - - [3072, 1, 1, 1024]
    - [36, 169.86]
  - - [512, 6000, 1, 2816]
    - [59, 9073.14]
  - - [8448, 2, 1, 2816]
    - [16, 392.6]
  - - [4608, 4, 1, 1536]
    - [30, 718.403]
  - - [1024, 6000, 1, 1536]
    - [59, 9294.29]
  - - [8448, 32, 1, 2816]
    - [46, 4768.76]
  - - [512, 3000, 1, 2048]
    - [72, 5236.2]
  - - [6144, 24000, 1, 2560]
    - [71, 9453.5]
  - - [512, 3000, 1, 2560]
    - [64, 7409.55]
  - - [4608, 6000, 1, 1536]
    - [59, 9746.1]
  - - [1024, 1024, 1, 1024]
    - [64, 7525.92]
  - - [512, 1500, 1, 2048]
    - [64, 4118.08]
  - - [512, 1500, 1, 1536]
    - [72, 7612.13]
  - - [128, 1, 1, 1024]
    - [47, 22.981]
  - - [49, 2048, 64, 512]
    - [86, 4027.1]
  - - [1024, 48000, 1, 2048]
    - [66, 9554.91]
  - - [3136, 64, 128, 64]
    - [99, 5028.36]
  - - [784, 512, 64, 128]
    - [97, 8705.86]
  - - [3136, 256, 64, 64]
    - [95, 7446.77]
  - - [784, 128, 128, 512]
    - [100, 8613.09]
  - - [784, 128, 64, 512]
    - [98, 8262.22]
  - - [3136, 512, 1, 2048]
    - [96, 8098.91]
  - - [12544, 256, 1, 1024]
    - [104, 9026.05]
  - - [3136, 64, 128, 256]
    - [94, 7293.84]
  - - [3136, 64, 64, 256]
    - [93, 7164.37]
  - - [3136, 2048, 1, 512]
    - [102, 9066.6]
  - - [784, 512, 128, 128]
    - [97, 8905.73]
  - - [3136, 64, 64, 64]
    - [105, 4930.1]
  - - [12544, 1024, 1, 256]
    - [103, 9616.57]
  - - [3136, 256, 128, 64]
    - [101, 7497.7]
- - - -1
    - - - 128
        - - - 4
            - - [-1, 75]
          - - 64
            - - [4, 75]
              - [64, 50]
              - [256, 49]
              - [448, 51]
              - [-1, 49]
          - - 128
            - - [4, 75]
              - [128, 49]
              - [256, 51]
              - [448, 49]
              - [704, 51]
              - [3584, 49]
              - [4288, 50]
              - [5056, 49]
              - [5888, 51]
              - [-1, 49]
          - - 256
            - - [4, 75]
              - [128, 49]
              - [256, 51]
              - [1856, 49]
              - [2368, 51]
              - [3584, 49]
              - [5056, 50]
              - [-1, 51]
          - - 448
            - - [4, 75]
              - [64, 49]
              - [256, 51]
              - [5056, 49]
              - [5888, 51]
              - [-1, 49]
          - - 704
            - - [4, 75]
              - [64, 50]
              - [256, 51]
              - [3584, 49]
              - [-1, 51]
          - - 1024
            - - [4, 75]
              - [448, 49]
              - [704, 52]
              - [1024, 53]
              - [1408, 52]
              - [1856, 51]
              - [2368, 52]
              - [4288, 51]
              - [5056, 50]
              - [5888, 49]
              - [-1, 51]
          - - 1408
            - - [4, 75]
              - [64, 50]
              - [1024, 49]
              - [5888, 51]
              - [-1, 50]
          - - 1856
            - - [4, 75]
              - [64, 50]
              - [448, 49]
              - [704, 51]
              - [2368, 49]
              - [3584, 51]
              - [4288, 49]
              - [5056, 50]
              - [5888, 51]
              - [-1, 49]
          - - 2368
            - - [4, 75]
              - [256, 49]
              - [448, 51]
              - [1024, 49]
              - [1408, 51]
              - [2944, 49]
              - [4288, 51]
              - [5888, 49]
              - [-1, 51]
          - - 2944
            - - [4, 75]
              - [64, 50]
              - [128, 49]
              - [256, 51]
              - [448, 50]
              - [704, 49]
              - [2944, 51]
              - [3584, 53]
              - [4288, 52]
              - [5888, 51]
              - [-1, 49]
          - - 3584
            - - [4, 75]
              - [64, 50]
              - [128, 49]
              - [256, 50]
              - [704, 52]
              - [2368, 51]
              - [4288, 50]
              - [5056, 49]
              - [5888, 51]
              - [-1, 50]
          - - 4288
            - - [4, 75]
              - [704, 49]
              - [1024, 51]
              - [1408, 49]
              - [1856, 51]
              - [2368, 53]
              - [2944, 52]
              - [3584, 53]
              - [4288, 49]
              - [5056, 52]
              - [5888, 49]
              - [-1, 53]
          - - 5056
            - - [4, 75]
              - [64, 51]
              - [448, 49]
              - [1408, 51]
              - [1856, 50]
              - [2368, 51]
              - [2944, 52]
              - [3584, 50]
              - [5056, 52]
              - [-1, 53]
          - - 5888
            - - [4, 75]
              - [704, 51]
              - [1024, 53]
              - [1408, 50]
              - [1856, 49]
              - [2368, 52]
              - [4288, 51]
              - [5056, 49]
              - [5888, 50]
              - [-1, 52]
          - - -1
            - - [4, 75]
              - [64, 49]
              - [128, 53]
              - [256, 49]
              - [1024, 51]
              - [1408, 50]
              - [1856, 52]
              - [2368, 49]
              - [2944, 51]
              - [3584, 49]
              - [4288, 50]
              - [5056, 51]
              - [5888, 52]
              - [-1, 53]
      - - 256
        - - - 4
            - - [-1, 33]
          - - 64
            - - [4, 33]
              - [448, 36]
              - [1024, 37]
              - [1408, 24]
              - [1856, 21]
              - [2368, 68]
              - [2944, 61]
              - [3584, 72]
              - [4288, 29]
              - [5056, 39]
              - [5888, 37]
              - [-1, 30]
          - - 128
            - - [4, 33]
              - [256, 36]
              - [448, 21]
              - [704, 30]
              - [1024, 24]
              - [1856, 61]
              - [2368, 68]
              - [2944, 61]
              - [4288, 68]
              - [5056, 61]
              - [5888, 68]
              - [-1, 62]
          - - 256
            - - [4, 33]
              - [128, 36]
              - [256, 37]
              - [448, 24]
              - [704, 55]
              - [1408, 68]
              - [1856, 61]
              - [2368, 68]
              - [2944, 61]
              - [3584, 69]
              - [5056, 67]
              - [5888, 56]
              - [-1, 68]
          - - 448
            - - [4, 33]
              - [64, 36]
              - [128, 37]
              - [256, 24]
              - [704, 61]
              - [1024, 68]
              - [1408, 61]
              - [1856, 68]
              - [2368, 61]
              - [2944, 67]
              - [5888, 61]
              - [-1, 68]
          - - 704
            - - [4, 33]
              - [64, 37]
              - [128, 24]
              - [448, 61]
              - [704, 68]
              - [1408, 61]
              - [1856, 67]
              - [2944, 68]
              - [4288, 67]
              - [-1, 61]
          - - 1024
            - - [4, 33]
              - [64, 30]
              - [128, 61]
              - [256, 68]
              - [448, 61]
              - [704, 68]
              - [1024, 69]
              - [2368, 59]
              - [2944, 68]
              - [3584, 56]
              - [5056, 59]
              - [5888, 68]
              - [-1, 72]
          - - 1408
            - - [4, 33]
              - [64, 24]
              - [128, 61]
              - [256, 68]
              - [448, 61]
              - [704, 68]
              - [1024, 56]
              - [1408, 64]
              - [1856, 68]
              - [2368, 61]
              - [3584, 59]
              - [4288, 64]
              - [5888, 61]
              - [-1, 63]
          - - 1856
            - - [4, 33]
              - [64, 24]
              - [128, 68]
              - [448, 61]
              - [1024, 68]
              - [1408, 61]
              - [1856, 56]
              - [3584, 61]
              - [5056, 71]
              - [5888, 55]
              - [-1, 65]
          - - 2368
            - - [4, 33]
              - [448, 61]
              - [1408, 68]
              - [1856, 61]
              - [2368, 59]
              - [2944, 60]
              - [3584, 56]
              - [4288, 64]
              - [5056, 56]
              - [5888, 71]
              - [-1, 66]
          - - 2944
            - - [4, 33]
              - [128, 61]
              - [256, 68]
              - [448, 56]
              - [704, 61]
              - [1408, 59]
              - [1856, 61]
              - [2368, 68]
              - [2944, 62]
              - [3584, 71]
              - [4288, 68]
              - [5056, 67]
              - [5888, 66]
              - [-1, 62]
          - - 3584
            - - [4, 33]
              - [128, 61]
              - [256, 64]
              - [448, 68]
              - [1408, 56]
              - [1856, 68]
              - [2368, 67]
              - [2944, 66]
              - [3584, 67]
              - [4288, 59]
              - [5056, 68]
              - [5888, 67]
              - [-1, 62]
          - - 4288
            - - [4, 33]
              - [64, 61]
              - [448, 68]
              - [704, 59]
              - [1024, 68]
              - [1408, 72]
              - [1856, 60]
              - [2368, 56]
              - [2944, 68]
              - [3584, 67]
              - [4288, 66]
              - [5056, 64]
              - [5888, 57]
              - [-1, 66]
          - - 5056
            - - [4, 33]
              - [64, 61]
              - [448, 68]
              - [1024, 59]
              - [1408, 62]
              - [1856, 56]
              - [2368, 62]
              - [2944, 70]
              - [3584, 66]
              - [4288, 67]
              - [-1, 59]
          - - 5888
            - - [4, 33]
              - [64, 68]
              - [128, 61]
              - [256, 59]
              - [448, 68]
              - [704, 59]
              - [1024, 60]
              - [1408, 57]
              - [1856, 69]
              - [2368, 70]
              - [4288, 59]
              - [5056, 69]
              - [-1, 59]
          - - -1
            - - [4, 33]
              - [256, 68]
              - [448, 69]
              - [704, 68]
              - [1024, 69]
              - [1408, 66]
              - [1856, 68]
              - [2368, 69]
              - [2944, 57]
              - [3584, 66]
              - [4288, 67]
              - [5056, 59]
              - [5888, 71]
              - [-1, 66]
      - - 1280
        - - - 4
            - - [-1, 33]
          - - 64
            - - [4, 33]
              - [128, 45]
              - [256, 36]
              - [448, 34]
              - [-1, 38]
          - - 128
            - - [4, 33]
              - [64, 45]
              - [128, 36]
              - [1024, 38]
              - [1408, 25]
              - [1856, 61]
              - [2368, 38]
              - [3584, 61]
              - [4288, 25]
              - [-1, 55]
          - - 256
            - - [4, 33]
              - [64, 36]
              - [128, 34]
              - [256, 20]
              - [448, 22]
              - [3584, 61]
              - [5888, 55]
              - [-1, 54]
          - - 448
            - - [4, 33]
              - [64, 34]
              - [128, 38]
              - [256, 22]
              - [448, 38]
              - [704, 68]
              - [1408, 61]
              - [1856, 56]
              - [2368, 61]
              - [3584, 55]
              - [-1, 54]
          - - 704
            - - [4, 33]
              - [128, 38]
              - [1024, 61]
              - [1856, 68]
              - [2368, 54]
              - [2944, 55]
              - [-1, 54]
          - - 1024
            - - [4, 33]
              - [64, 30]
              - [128, 32]
              - [704, 68]
              - [1024, 64]
              - [1408, 57]
              - [1856, 59]
              - [2368, 69]
              - [2944, 70]
              - [3584, 69]
              - [4288, 54]
              - [5056, 56]
              - [5888, 59]
              - [-1, 56]
          - - 1408
            - - [4, 33]
              - [64, 38]
              - [128, 31]
              - [256, 68]
              - [448, 61]
              - [704, 64]
              - [1024, 56]
              - [2368, 54]
              - [2944, 56]
              - [3584, 59]
              - [4288, 56]
              - [5056, 57]
              - [5888, 60]
              - [-1, 59]
          - - 1856
            - - [4, 33]
              - [64, 22]
              - [128, 61]
              - [256, 68]
              - [448, 56]
              - [704, 59]
              - [1408, 54]
              - [2368, 59]
              - [2944, 69]
              - [3584, 68]
              - [4288, 60]
              - [5888, 59]
              - [-1, 64]
          - - 2368
            - - [4, 33]
              - [64, 22]
              - [128, 28]
              - [256, 61]
              - [448, 59]
              - [1408, 54]
              - [1856, 59]
              - [2368, 66]
              - [2944, 59]
              - [3584, 68]
              - [5056, 59]
              - [5888, 56]
              - [-1, 60]
          - - 2944
            - - [4, 33]
              - [64, 25]
              - [128, 61]
              - [256, 68]
              - [448, 56]
              - [1408, 54]
              - [1856, 67]
              - [2368, 60]
              - [2944, 66]
              - [3584, 59]
              - [4288, 71]
              - [5056, 56]
              - [5888, 60]
              - [-1, 66]
          - - 3584
            - - [4, 33]
              - [64, 68]
              - [128, 61]
              - [256, 64]
              - [704, 56]
              - [1024, 54]
              - [1408, 69]
              - [1856, 56]
              - [2368, 59]
              - [2944, 66]
              - [3584, 59]
              - [4288, 56]
              - [5888, 59]
              - [-1, 57]
          - - 4288
            - - [4, 33]
              - [64, 31]
              - [256, 68]
              - [704, 54]
              - [1024, 70]
              - [1408, 71]
              - [1856, 57]
              - [2368, 69]
              - [2944, 71]
              - [-1, 59]
          - - 5056
            - - [4, 33]
              - [64, 28]
              - [128, 61]
              - [256, 68]
              - [448, 54]
              - [704, 56]
              - [1024, 59]
              - [1408, 66]
              - [2368, 59]
              - [2944, 66]
              - [4288, 59]
              - [-1, 71]
          - - 5888
            - - [4, 33]
              - [128, 68]
              - [448, 54]
              - [704, 68]
              - [1024, 59]
              - [1408, 60]
              - [2368, 59]
              - [2944, 57]
              - [4288, 59]
              - [5056, 71]
              - [5888, 57]
              - [-1, 71]
          - - -1
            - - [4, 33]
              - [64, 68]
              - [128, 64]
              - [448, 54]
              - [704, 59]
              - [1024, 67]
              - [1408, 59]
              - [1856, 69]
              - [2368, 60]
              - [2944, 59]
              - [3584, 71]
              - [4288, 57]
              - [-1, 71]
      - - -1
        - - - 4
            - - [4, 76]
              - [128, 33]
              - [256, 76]
              - [1408, 33]
              - [1856, 18]
              - [2944, 33]
              - [4288, 18]
              - [5056, 76]
              - [-1, 18]
          - - 64
            - - [4, 33]
              - [64, 47]
              - [256, 45]
              - [704, 34]
              - [1408, 38]
              - [1856, 22]
              - [2368, 38]
              - [2944, 25]
              - [3584, 34]
              - [4288, 27]
              - [5056, 23]
              - [5888, 31]
              - [-1, 34]
          - - 128
            - - [4, 76]
              - [128, 45]
              - [256, 34]
              - [448, 38]
              - [704, 20]
              - [1024, 22]
              - [1408, 25]
              - [1856, 23]
              - [2944, 25]
              - [3584, 55]
              - [4288, 25]
              - [5056, 20]
              - [5888, 55]
              - [-1, 28]
          - - 256
            - - [4, 76]
              - [64, 45]
              - [128, 34]
              - [256, 38]
              - [448, 22]
              - [704, 68]
              - [1024, 61]
              - [1408, 54]
              - [2368, 55]
              - [3584, 54]
              - [5056, 68]
              - [-1, 55]
          - - 448
            - - [4, 33]
              - [64, 34]
              - [128, 38]
              - [256, 22]
              - [448, 23]
              - [704, 68]
              - [1024, 55]
              - [1856, 54]
              - [2368, 68]
              - [2944, 70]
              - [3584, 61]
              - [4288, 67]
              - [5888, 61]
              - [-1, 62]
          - - 704
            - - [4, 33]
              - [64, 38]
              - [128, 20]
              - [448, 68]
              - [1024, 54]
              - [1408, 67]
              - [2368, 61]
              - [2944, 62]
              - [3584, 55]
              - [5888, 62]
              - [-1, 66]
          - - 1024
            - - [4, 33]
              - [64, 30]
              - [128, 22]
              - [256, 68]
              - [448, 62]
              - [704, 55]
              - [1024, 54]
              - [2368, 59]
              - [2944, 71]
              - [4288, 56]
              - [5056, 71]
              - [5888, 57]
              - [-1, 71]
          - - 1408
            - - [4, 33]
              - [64, 38]
              - [128, 31]
              - [256, 68]
              - [448, 55]
              - [1024, 64]
              - [1408, 56]
              - [1856, 63]
              - [2368, 68]
              - [3584, 56]
              - [4288, 66]
              - [5056, 56]
              - [5888, 66]
              - [-1, 56]
          - - 1856
            - - [4, 18]
              - [64, 22]
              - [128, 28]
              - [256, 62]
              - [448, 55]
              - [704, 61]
              - [1024, 59]
              - [1408, 62]
              - [1856, 59]
              - [2368, 56]
              - [2944, 64]
              - [5056, 59]
              - [5888, 66]
              - [-1, 59]
          - - 2368
            - - [4, 33]
              - [64, 22]
              - [128, 28]
              - [448, 54]
              - [704, 61]
              - [1024, 56]
              - [1408, 68]
              - [1856, 56]
              - [2368, 69]
              - [2944, 59]
              - [3584, 56]
              - [4288, 59]
              - [5056, 71]
              - [5888, 60]
              - [-1, 71]
          - - 2944
            - - [4, 33]
              - [64, 25]
              - [256, 54]
              - [448, 67]
              - [704, 59]
              - [1024, 57]
              - [1408, 66]
              - [3584, 59]
              - [4288, 56]
              - [5056, 59]
              - [5888, 71]
              - [-1, 66]
          - - 3584
            - - [4, 33]
              - [64, 28]
              - [256, 54]
              - [448, 61]
              - [704, 59]
              - [1024, 56]
              - [1408, 71]
              - [3584, 59]
              - [4288, 57]
              - [5056, 71]
              - [-1, 59]
          - - 4288
            - - [4, 33]
              - [64, 35]
              - [128, 54]
              - [256, 67]
              - [704, 59]
              - [1024, 56]
              - [1408, 60]
              - [1856, 71]
              - [2368, 56]
              - [2944, 59]
              - [3584, 71]
              - [5056, 59]
              - [5888, 60]
              - [-1, 59]
          - - 5056
            - - [4, 33]
              - [64, 43]
              - [128, 54]
              - [448, 68]
              - [1856, 59]
              - [2368, 71]
              - [2944, 59]
              - [3584, 71]
              - [4288, 59]
              - [5056, 60]
              - [-1, 71]
          - - 5888
            - - [4, 33]
              - [64, 43]
              - [128, 54]
              - [256, 56]
              - [448, 68]
              - [704, 59]
              - [1024, 60]
              - [2368, 59]
              - [2944, 60]
              - [3584, 59]
              - [4288, 60]
              - [5888, 71]
              - [-1, 60]
          - - -1
            - - [4, 33]
              - [64, 55]
              - [128, 31]
              - [448, 56]
              - [2944, 59]
              - [3584, 60]
              - [5888, 59]
              - [-1, 71]
