library/src/blas3/Tensile/Logic/asm_full/vega20_Cijk_Alik_Bljk_HB.yaml
- {MinimumRequiredVersion: 4.3.0}
- vega20
- gfx906
- [Device 66a0, Device 66a7]
    SolutionIndex: 0
    SolutionNameMin: Cijk_Alik_Bljk_HB_MT128x032x32_PGR1_PLR1_TT04_04
    SolutionIndex: 1
    SolutionNameMin: Cijk_Alik_Bljk_HB_MT064x032x32_PGR1_PLR1_TT04_04
    SolutionIndex: 2
    SolutionNameMin: Cijk_Alik_Bljk_HB_MT016x016x32_PGR1_PLR1_TT02_02
    SolutionIndex: 3
    SolutionNameMin: Cijk_Alik_Bljk_HB_MT128x064x32_PGR1_PLR1_TT08_08
    SolutionIndex: 4
    SolutionNameMin: Cijk_Alik_Bljk_HB_MT032x032x32_PGR1_PLR1_TT04_04
    SolutionIndex: 5
    SolutionNameMin: Cijk_Alik_Bljk_HB_MT032x032x16_PGR1_PLR1_TT04_04
    SolutionIndex: 6
    SolutionNameMin: Cijk_Alik_Bljk_HB_MT048x032x24_PGR1_PLR1_TT06_04
    SolutionIndex: 7
    SolutionNameMin: Cijk_Alik_Bljk_HB_MT032x032x24_PGR1_PLR1_TT04_04
    SolutionIndex: 8
    SolutionNameMin: Cijk_Alik_Bljk_HB_MT032x016x24_PGR1_PLR1_TT04_02
    SolutionIndex: 9
    SolutionNameMin: Cijk_Alik_Bljk_HB_MT032x032x24_PGR1_PLR1_TT04_04
    SolutionIndex: 10
    SolutionNameMin: Cijk_Alik_Bljk_HB_MT032x016x24_PGR1_PLR1_TT04_02
    SolutionIndex: 11
    SolutionNameMin: Cijk_Alik_Bljk_HB_MT064x032x32_PGR1_PLR1_TT08_04
    SolutionIndex: 12
    SolutionNameMin: Cijk_Alik_Bljk_HB_MT064x064x32_PGR1_PLR1_TT08_08
    SolutionIndex: 13
    SolutionNameMin: Cijk_Alik_Bljk_HB_MT016x016x24_PGR1_PLR1_TT02_02
    SolutionIndex: 14
    SolutionNameMin: Cijk_Alik_Bljk_HB_MT016x016x24_PGR1_PLR1_TT02_02
    SolutionIndex: 15
    SolutionNameMin: Cijk_Alik_Bljk_HB_MT032x032x32_PGR1_PLR1_TT04_04
    SolutionIndex: 16
    SolutionNameMin: Cijk_Alik_Bljk_HB_MT064x016x32_PGR1_PLR1_TT02_02
    SolutionIndex: 17
    SolutionNameMin: Cijk_Alik_Bljk_HB_MT032x032x16_PGR1_PLR1_TT04_04
    SolutionIndex: 18
    SolutionNameMin: Cijk_Alik_Bljk_HB_MT064x064x32_PGR1_PLR1_TT04_04
    SolutionIndex: 19
    SolutionNameMin: Cijk_Alik_Bljk_HB_MT128x128x32_PGR1_PLR1_TT08_08
    SolutionIndex: 20
    SolutionNameMin: Cijk_Alik_Bljk_HB_MT128x064x16_PGR1_PLR1_TT08_04
    SolutionIndex: 21
    SolutionNameMin: Cijk_Alik_Bljk_HB_MT128x064x08_PGR1_PLR1_TT08_04
    SolutionIndex: 22
    SolutionNameMin: Cijk_Alik_Bljk_HB_MT064x064x16_PGR1_PLR1_TT04_04
    SolutionIndex: 23
    SolutionNameMin: Cijk_Alik_Bljk_HB_MT128x128x08_PGR1_PLR1_TT08_08
    SolutionIndex: 24
    SolutionNameMin: Cijk_Alik_Bljk_HB_MT128x128x16_PGR1_PLR1_TT08_08
    SolutionIndex: 25
    SolutionNameMin: Cijk_Alik_Bljk_HB_MT064x128x08_PGR0_PLR0_TT04_08
    SolutionIndex: 26
    SolutionNameMin: Cijk_Alik_Bljk_HB_MT064x064x08_PGR1_PLR1_TT04_04
    SolutionIndex: 27
    SolutionNameMin: Cijk_Alik_Bljk_HB_MT064x064x04_PGR0_PLR1_TT04_04
    SolutionIndex: 28
    SolutionNameMin: Cijk_Alik_Bljk_HB_MT064x064x08_PGR1_PLR1_TT04_04
- - - [4096, 7000, 1, 4096]
    - [19, 14394.8]
  - - [7680, 12000, 1, 2560]
    - [24, 18518.1]
  - - [5124, 9124, 1, 1760]
    - [23, 17867.3]
  - - [1760, 32, 1, 1760]
    - [14, 2337.76]
  - - [512, 24000, 1, 1536]
    - [24, 16050.5]
  - - [3072, 24000, 1, 1024]
    - [24, 16684.7]
  - - [2048, 400, 1, 512]
    - [24, 7500.48]
  - - [2560, 7000, 1, 2560]
    - [24, 17011.2]
  - - [3072, 16, 1, 1024]
    - [14, 1483.81]
  - - [512, 48000, 1, 2816]
    - [24, 18175.5]
  - - [512, 48000, 1, 2048]
    - [19, 13370.2]
  - - [1760, 64, 1, 1760]
    - [14, 3794.88]
  - - [35, 8457, 1, 4096]
    - [6, 0.0]
  - - [2048, 1600, 1, 2048]
    - [18, 8041.88]
  - - [512, 48000, 1, 1536]
    - [24, 17215.9]
  - - [2560, 32, 1, 2560]
    - [14, 2713.67]
  - - [8448, 5984, 1, 2816]
    - [24, 18470.5]
  - - [4096, 3200, 1, 1024]
    - [19, 13813.9]
  - - [1024, 24000, 1, 2560]
    - [24, 17676.0]
  - - [1760, 6400, 1, 1760]
    - [23, 17826.4]
  - - [1024, 700, 1, 512]
    - [24, 7014.49]
  - - [4608, 32, 1, 1536]
    - [9, 3730.05]
  - - [3072, 64, 1, 1024]
    - [15, 3442.6]
  - - [16384, 3200, 1, 4096]
    - [19, 15111.8]
  - - [2560, 16, 1, 2560]
    - [14, 1726.89]
  - - [1024, 48000, 1, 2560]
    - [24, 18226.5]
  - - [35, 8457, 1, 2560]
    - [6, 0.0]
  - - [8448, 48000, 1, 2816]
    - [24, 18909.6]
  - - [2048, 32, 1, 2048]
    - [13, 1917.37]
  - - [2560, 3200, 1, 2560]
    - [24, 15901.7]
  - - [16384, 800, 1, 4096]
    - [19, 12750.9]
  - - [4608, 24000, 1, 1536]
    - [24, 18433.7]
  - - [7680, 48000, 1, 2560]
    - [24, 18850.7]
  - - [3072, 48000, 1, 1024]
    - [24, 17815.8]
  - - [1760, 16, 1, 1760]
    - [14, 1207.61]
  - - [8192, 3200, 1, 2048]
    - [19, 13772.2]
  - - [512, 24000, 1, 2816]
    - [24, 17851.1]
  - - [4096, 400, 1, 1024]
    - [19, 9341.3]
  - - [6144, 48000, 1, 2560]
    - [24, 18718.2]
  - - [4608, 48000, 1, 1536]
    - [24, 18699.9]
  - - [35, 8457, 1, 2048]
    - [6, 0.0]
  - - [4096, 128, 1, 4096]
    - [3, 4598.01]
  - - [2048, 800, 1, 512]
    - [19, 9808.77]
  - - [4608, 5984, 1, 1536]
    - [24, 17340.9]
  - - [2560, 128, 1, 2560]
    - [17, 5568.55]
  - - [6144, 5984, 1, 2048]
    - [19, 14116.3]
  - - [35, 8457, 1, 1760]
    - [6, 0.0]
  - - [7680, 24000, 1, 2560]
    - [24, 18692.6]
  - - [6144, 48000, 1, 2048]
    - [24, 16283.3]
  - - [5124, 9124, 1, 2560]
    - [24, 17589.9]
  - - [2048, 3200, 1, 2048]
    - [19, 9367.9]
  - - [2048, 16, 1, 2048]
    - [14, 957.59]
  - - [1024, 24000, 1, 1536]
    - [24, 17263.1]
  - - [7680, 16, 1, 2560]
    - [10, 3041.07]
  - - [2560, 6400, 1, 2560]
    - [24, 17257.4]
  - - [2048, 128, 1, 2048]
    - [0, 3159.5]
  - - [512, 16, 1, 500000]
    - [2, 376.142]
  - - [1024, 8, 1, 500000]
    - [2, 376.131]
  - - [512, 24000, 1, 2560]
    - [24, 16881.8]
  - - [1024, 24000, 1, 2816]
    - [24, 18162.1]
  - - [7680, 5984, 1, 2560]
    - [24, 18039.2]
  - - [2048, 1600, 1, 512]
    - [19, 10480.4]
  - - [2048, 7000, 1, 2048]
    - [19, 11912.0]
  - - [1760, 800, 1, 1760]
    - [21, 12020.0]
  - - [5124, 9124, 1, 4096]
    - [19, 14662.2]
  - - [4096, 64, 1, 4096]
    - [0, 3431.75]
  - - [7680, 32, 1, 2560]
    - [0, 5160.25]
  - - [2560, 64, 1, 2560]
    - [17, 4405.74]
  - - [3072, 128, 1, 1024]
    - [0, 4699.42]
  - - [7680, 64, 1, 2560]
    - [11, 6537.16]
  - - [1760, 128, 1, 1760]
    - [7, 6149.03]
  - - [2560, 1600, 1, 2560]
    - [24, 12667.4]
  - - [2048, 3200, 1, 512]
    - [19, 12846.1]
  - - [2560, 800, 1, 2560]
    - [24, 10485.6]
  - - [3072, 32, 1, 1024]
    - [2, 2254.98]
  - - [6144, 32, 1, 2560]
    - [5, 4516.42]
  - - [4608, 12000, 1, 1536]
    - [24, 18180.8]
  - - [4096, 32, 1, 4096]
    - [1, 2318.07]
  - - [6144, 24000, 1, 2048]
    - [24, 15721.9]
  - - [8192, 800, 1, 2048]
    - [19, 10347.2]
  - - [4096, 1600, 1, 1024]
    - [19, 11332.7]
  - - [5124, 9124, 1, 2048]
    - [19, 14165.0]
  - - [8448, 24000, 1, 2816]
    - [24, 18834.9]
  - - [1024, 48000, 1, 1536]
    - [24, 18029.6]
  - - [7680, 128, 1, 2560]
    - [12, 11418.1]
  - - [8192, 1600, 1, 2048]
    - [19, 11510.8]
  - - [4096, 800, 1, 1024]
    - [19, 10158.0]
  - - [1024, 16, 1, 500000]
    - [2, 752.245]
  - - [2048, 800, 1, 2048]
    - [19, 6668.11]
  - - [1760, 3200, 1, 1760]
    - [23, 15856.4]
  - - [512, 48000, 1, 2560]
    - [24, 17663.6]
  - - [8448, 16, 1, 2816]
    - [8, 3304.06]
  - - [2048, 64, 1, 2048]
    - [4, 2295.08]
  - - [512, 24000, 1, 2048]
    - [19, 11121.4]
  - - [16384, 1600, 1, 4096]
    - [19, 13838.4]
  - - [4608, 16, 1, 1536]
    - [13, 2470.44]
  - - [1024, 24000, 1, 2048]
    - [19, 13444.2]
  - - [8192, 400, 1, 2048]
    - [18, 7305.13]
  - - [2048, 6400, 1, 2048]
    - [19, 11971.2]
  - - [6144, 12000, 1, 2048]
    - [19, 15028.5]
  - - [512, 8, 1, 500000]
    - [2, 188.058]
  - - [1760, 7000, 1, 1760]
    - [23, 16640.2]
  - - [1024, 48000, 1, 2816]
    - [24, 18693.4]
  - - [6144, 16, 1, 2560]
    - [8, 2723.54]
  - - [8448, 32, 1, 2816]
    - [17, 5135.29]
  - - [4096, 16, 1, 4096]
    - [16, 1309.68]
  - - [6144, 24000, 1, 2560]
    - [24, 18517.6]
  - - [1024, 1024, 1, 1024]
    - [19, 8812.58]
  - - [8448, 12000, 1, 2816]
    - [24, 18785.4]
  - - [16384, 400, 1, 4096]
    - [19, 9716.49]
  - - [1760, 1600, 1, 1760]
    - [23, 14743.2]
  - - [1024, 48000, 1, 2048]
    - [19, 14700.7]
- - - -1
    - - - 1
        - - - 32
            - - [32, 27]
              - [64, 28]
              - [448, 27]
              - [704, 28]
              - [2368, 27]
              - [2944, 28]
              - [4288, 27]
              - [-1, 28]
          - - 64
            - - [448, 27]
              - [704, 28]
              - [1024, 27]
              - [1408, 28]
              - [2944, 27]
              - [3584, 28]
              - [4288, 27]
              - [5888, 28]
              - [-1, 27]
          - - 128
            - - [128, 27]
              - [256, 28]
              - [448, 27]
              - [704, 28]
              - [1408, 27]
              - [1856, 28]
              - [2368, 27]
              - [2944, 28]
              - [3584, 27]
              - [4288, 28]
              - [-1, 27]
          - - 256
            - - [64, 28]
              - [448, 27]
              - [1408, 28]
              - [1856, 27]
              - [2368, 28]
              - [4288, 27]
              - [5056, 28]
              - [-1, 27]
          - - 448
            - - [32, 28]
              - [448, 27]
              - [1024, 28]
              - [1408, 27]
              - [1856, 28]
              - [2368, 27]
              - [2944, 28]
              - [-1, 27]
          - - 704
            - - [448, 27]
              - [1024, 28]
              - [-1, 27]
          - - 1024
            - - [64, 27]
              - [128, 28]
              - [1408, 27]
              - [2368, 28]
              - [-1, 27]
          - - 1408
            - - [64, 28]
              - [256, 27]
              - [704, 28]
              - [-1, 27]
          - - 1856
            - - [32, 27]
              - [64, 28]
              - [128, 27]
              - [256, 28]
              - [-1, 27]
          - - 2368
            - - [32, 27]
              - [64, 28]
              - [1856, 27]
              - [2368, 28]
              - [-1, 27]
          - - 2944
            - - [128, 27]
              - [256, 28]
              - [-1, 27]
          - - 3584
            - - [64, 28]
              - [448, 27]
              - [704, 28]
              - [-1, 27]
          - - 4288
            - - [-1, 27]
          - - 5056
            - - [32, 27]
              - [64, 28]
              - [-1, 27]
          - - 5888
            - - [-1, 27]
          - - -1
            - - [32, 28]
              - [128, 27]
              - [256, 28]
              - [-1, 27]
      - - 32
        - - - 32
            - - [5056, 26]
              - [5888, 25]
              - [-1, 26]
          - - 128
            - - [-1, 26]
          - - 256
            - - [3584, 26]
              - [-1, 25]
          - - 448
            - - [1856, 26]
              - [4288, 25]
              - [5056, 26]
              - [-1, 25]
          - - 704
            - - [1408, 26]
              - [-1, 25]
          - - 1024
            - - [1024, 26]
              - [1856, 25]
              - [2368, 26]
              - [-1, 25]
          - - 1408
            - - [704, 26]
              - [-1, 25]
          - - 1856
            - - [256, 26]
              - [-1, 25]
          - - 2368
            - - [448, 26]
              - [704, 25]
              - [1024, 26]
              - [-1, 25]
          - - 2944
            - - [704, 26]
              - [-1, 25]
          - - 3584
            - - [32, 26]
              - [64, 25]
              - [256, 26]
              - [-1, 25]
          - - 4288
            - - [128, 26]
              - [256, 25]
              - [448, 26]
              - [-1, 25]
          - - -1
            - - [128, 26]
              - [-1, 25]
      - - 256
        - - - 1
            - - [-1, 28]
          - - 32
            - - [-1, 26]
          - - 64
            - - [1, 28]
              - [32, 26]
              - [64, 13]
              - [256, 2]
              - [1408, 13]
              - [1856, 14]
              - [2368, 13]
              - [3584, 5]
              - [4288, 17]
              - [5888, 5]
              - [-1, 22]
          - - 128
            - - [1, 28]
              - [32, 26]
              - [64, 13]
              - [128, 2]
              - [704, 13]
              - [1024, 14]
              - [1408, 5]
              - [2368, 17]
              - [2944, 5]
              - [5888, 22]
              - [-1, 20]
          - - 256
            - - [1, 28]
              - [32, 26]
              - [128, 2]
              - [448, 13]
              - [2944, 22]
              - [5888, 20]
              - [-1, 24]
          - - 448
            - - [1, 28]
              - [32, 26]
              - [64, 2]
              - [128, 13]
              - [256, 14]
              - [1408, 22]
              - [2944, 20]
              - [3584, 24]
              - [5056, 20]
              - [-1, 24]
          - - 704
            - - [1, 28]
              - [32, 26]
              - [64, 13]
              - [128, 14]
              - [256, 17]
              - [1408, 22]
              - [1856, 20]
              - [2368, 24]
              - [2944, 22]
              - [-1, 24]
          - - 1024
            - - [1, 28]
              - [32, 26]
              - [128, 13]
              - [256, 17]
              - [704, 22]
              - [1408, 20]
              - [1856, 24]
              - [2368, 20]
              - [-1, 24]
          - - 1408
            - - [1, 28]
              - [32, 26]
              - [64, 13]
              - [128, 5]
              - [448, 22]
              - [1024, 20]
              - [-1, 24]
          - - 1856
            - - [1, 28]
              - [32, 26]
              - [64, 14]
              - [128, 17]
              - [256, 22]
              - [448, 20]
              - [704, 22]
              - [-1, 24]
          - - 2368
            - - [1, 28]
              - [32, 26]
              - [64, 14]
              - [256, 22]
              - [448, 20]
              - [-1, 24]
          - - 2944
            - - [1, 28]
              - [32, 26]
              - [64, 5]
              - [128, 17]
              - [256, 22]
              - [704, 20]
              - [-1, 24]
          - - 3584
            - - [1, 28]
              - [32, 26]
              - [128, 22]
              - [256, 20]
              - [-1, 24]
          - - 4288
            - - [1, 28]
              - [32, 26]
              - [256, 22]
              - [704, 20]
              - [-1, 24]
          - - 5056
            - - [1, 28]
              - [32, 26]
              - [64, 17]
              - [256, 22]
              - [448, 20]
              - [-1, 24]
          - - 5888
            - - [1, 28]
              - [32, 26]
              - [128, 22]
              - [256, 20]
              - [448, 24]
              - [704, 20]
              - [-1, 24]
          - - -1
            - - [1, 28]
              - [32, 26]
              - [64, 22]
              - [128, 20]
              - [256, 24]
              - [448, 20]
              - [-1, 24]
      - - 1280
        - - - 1
            - - [-1, 28]
          - - 32
            - - [-1, 26]
          - - 64
            - - [1, 28]
              - [32, 26]
              - [1408, 13]
              - [1856, 14]
              - [2944, 5]
              - [3584, 17]
              - [4288, 5]
              - [5056, 17]
              - [-1, 22]
          - - 128
            - - [1, 28]
              - [32, 26]
              - [64, 13]
              - [128, 14]
              - [256, 13]
              - [704, 14]
              - [1024, 13]
              - [1408, 5]
              - [2944, 7]
              - [5888, 22]
              - [-1, 20]
          - - 256
            - - [1, 28]
              - [32, 26]
              - [64, 14]
              - [128, 13]
              - [256, 14]
              - [448, 13]
              - [704, 9]
              - [1024, 17]
              - [2944, 22]
              - [3584, 20]
              - [5056, 22]
              - [5888, 20]
              - [-1, 24]
          - - 448
            - - [1, 28]
              - [32, 26]
              - [256, 14]
              - [1408, 22]
              - [1856, 24]
              - [2368, 22]
              - [2944, 20]
              - [3584, 24]
              - [4288, 22]
              - [5056, 20]
              - [-1, 24]
          - - 704
            - - [1, 28]
              - [32, 26]
              - [64, 13]
              - [128, 14]
              - [448, 17]
              - [1856, 22]
              - [2368, 24]
              - [2944, 22]
              - [-1, 24]
          - - 1024
            - - [1, 28]
              - [32, 26]
              - [64, 13]
              - [128, 14]
              - [256, 9]
              - [704, 22]
              - [1408, 20]
              - [1856, 24]
              - [2368, 20]
              - [-1, 24]
          - - 1408
            - - [1, 28]
              - [32, 26]
              - [64, 14]
              - [128, 17]
              - [256, 9]
              - [448, 22]
              - [1024, 20]
              - [1408, 24]
              - [1856, 20]
              - [-1, 24]
          - - 1856
            - - [1, 28]
              - [32, 26]
              - [64, 14]
              - [128, 17]
              - [256, 22]
              - [448, 24]
              - [704, 22]
              - [-1, 24]
          - - 2368
            - - [1, 28]
              - [32, 26]
              - [64, 5]
              - [128, 9]
              - [448, 22]
              - [704, 24]
              - [1024, 20]
              - [-1, 24]
          - - 2944
            - - [1, 28]
              - [32, 26]
              - [64, 5]
              - [256, 22]
              - [704, 20]
              - [-1, 24]
          - - 3584
            - - [1, 28]
              - [32, 26]
              - [64, 17]
              - [128, 22]
              - [448, 24]
              - [704, 20]
              - [-1, 24]
          - - 4288
            - - [1, 28]
              - [32, 26]
              - [64, 5]
              - [256, 22]
              - [704, 20]
              - [-1, 24]
          - - 5056
            - - [1, 28]
              - [32, 26]
              - [64, 17]
              - [256, 22]
              - [448, 20]
              - [-1, 24]
          - - 5888
            - - [1, 28]
              - [32, 26]
              - [128, 22]
              - [256, 20]
              - [448, 24]
              - [704, 20]
              - [-1, 24]
          - - -1
            - - [1, 28]
              - [32, 26]
              - [64, 22]
              - [256, 24]
              - [448, 20]
              - [-1, 24]
      - - -1
        - - - 1
            - - [-1, 28]
          - - 32
            - - [-1, 26]
          - - 64
            - - [1, 28]
              - [32, 26]
              - [448, 13]
              - [704, 14]
              - [1408, 13]
              - [1856, 14]
              - [2944, 5]
              - [5056, 9]
              - [-1, 22]
          - - 128
            - - [1, 28]
              - [32, 26]
              - [1024, 13]
              - [1408, 17]
              - [1856, 9]
              - [2944, 7]
              - [5888, 22]
              - [-1, 24]
          - - 256
            - - [1, 28]
              - [32, 26]
              - [256, 13]
              - [448, 14]
              - [1408, 9]
              - [2944, 22]
              - [3584, 24]
              - [5056, 22]
              - [5888, 20]
              - [-1, 24]
          - - 448
            - - [1, 28]
              - [32, 26]
              - [128, 13]
              - [256, 14]
              - [448, 9]
              - [1408, 22]
              - [1856, 24]
              - [2368, 22]
              - [2944, 20]
              - [3584, 24]
              - [4288, 22]
              - [5056, 20]
              - [-1, 24]
          - - 704
            - - [1, 28]
              - [32, 26]
              - [64, 13]
              - [128, 14]
              - [256, 9]
              - [448, 17]
              - [1856, 22]
              - [2368, 24]
              - [2944, 22]
              - [-1, 24]
          - - 1024
            - - [1, 28]
              - [32, 26]
              - [64, 13]
              - [128, 14]
              - [256, 9]
              - [704, 22]
              - [1024, 24]
              - [1408, 20]
              - [1856, 24]
              - [2368, 20]
              - [-1, 24]
          - - 1408
            - - [1, 28]
              - [32, 26]
              - [64, 14]
              - [128, 7]
              - [256, 9]
              - [448, 22]
              - [1024, 20]
              - [1408, 24]
              - [1856, 20]
              - [-1, 24]
          - - 1856
            - - [1, 28]
              - [32, 26]
              - [64, 14]
              - [128, 17]
              - [256, 22]
              - [448, 24]
              - [704, 22]
              - [-1, 24]
          - - 2368
            - - [1, 28]
              - [32, 26]
              - [64, 7]
              - [128, 9]
              - [448, 22]
              - [704, 24]
              - [1024, 20]
              - [-1, 24]
          - - 2944
            - - [1, 28]
              - [32, 26]
              - [64, 17]
              - [256, 22]
              - [704, 20]
              - [-1, 24]
          - - 3584
            - - [1, 28]
              - [32, 26]
              - [64, 17]
              - [128, 22]
              - [448, 24]
              - [704, 20]
              - [-1, 24]
          - - 4288
            - - [1, 28]
              - [32, 26]
              - [64, 5]
              - [256, 22]
              - [704, 20]
              - [-1, 24]
          - - 5056
            - - [1, 28]
              - [32, 26]
              - [64, 5]
              - [256, 22]
              - [448, 20]
              - [-1, 24]
          - - 5888
            - - [1, 28]
              - [32, 26]
              - [128, 22]
              - [256, 20]
              - [448, 24]
              - [704, 20]
              - [-1, 24]
          - - -1
            - - [1, 28]
              - [32, 26]
              - [64, 22]
              - [256, 24]
              - [448, 20]
              - [-1, 24]
