library/src/blas3/Tensile/Logic/asm_full/vega10_Cijk_Alik_Bljk_SB.yaml
- {MinimumRequiredVersion: 4.0.2}
- vega10
- gfx900
- [Device 6863, Device 6862, Device 687f, Device 6860]
- - - [4096, 7000, 1, 4096]
    - [36, 9039.17]
  - - [7680, 12000, 1, 2560]
    - [36, 10286.1]
  - - [5124, 9124, 1, 1760]
    - [43, 10352.1]
  - - [1760, 32, 1, 1760]
    - [9, 2815.94]
  - - [512, 24000, 1, 1536]
    - [36, 9804.02]
  - - [3072, 24000, 1, 1024]
    - [39, 9215.53]
  - - [2048, 400, 1, 512]
    - [36, 4243.23]
  - - [2560, 7000, 1, 2560]
    - [39, 9976.25]
  - - [3072, 16, 1, 1024]
    - [16, 842.588]
  - - [512, 48000, 1, 2816]
    - [41, 10388.4]
  - - [512, 48000, 1, 2048]
    - [36, 8689.33]
  - - [1760, 64, 1, 1760]
    - [13, 4322.12]
  - - [35, 8457, 1, 4096]
    - [4, 3789.49]
  - - [2048, 1600, 1, 2048]
    - [31, 6081.29]
  - - [512, 48000, 1, 1536]
    - [36, 10157.5]
  - - [2560, 32, 1, 2560]
    - [8, 2612.09]
  - - [8448, 5984, 1, 2816]
    - [43, 10756.2]
  - - [4096, 3200, 1, 1024]
    - [38, 7852.67]
  - - [1024, 24000, 1, 2560]
    - [39, 10207.4]
  - - [1760, 6400, 1, 1760]
    - [41, 10304.1]
  - - [1024, 700, 1, 512]
    - [31, 4311.47]
  - - [4608, 32, 1, 1536]
    - [27, 2627.86]
  - - [3072, 64, 1, 1024]
    - [20, 2194.65]
  - - [16384, 3200, 1, 4096]
    - [36, 8928.62]
  - - [2560, 16, 1, 2560]
    - [12, 1599.27]
  - - [1024, 48000, 1, 2560]
    - [36, 10582.5]
  - - [35, 8457, 1, 2560]
    - [4, 3723.12]
  - - [8448, 48000, 1, 2816]
    - [41, 11081.3]
  - - [2048, 32, 1, 2048]
    - [12, 1933.8]
  - - [2560, 3200, 1, 2560]
    - [39, 9869.31]
  - - [16384, 800, 1, 4096]
    - [31, 7186.07]
  - - [4608, 24000, 1, 1536]
    - [39, 10524.9]
  - - [7680, 48000, 1, 2560]
    - [36, 10654.1]
  - - [3072, 48000, 1, 1024]
    - [39, 9438.08]
  - - [1760, 16, 1, 1760]
    - [26, 1628.37]
  - - [8192, 3200, 1, 2048]
    - [38, 8464.76]
  - - [512, 24000, 1, 2816]
    - [36, 10149.0]
  - - [4096, 400, 1, 1024]
    - [44, 4494.64]
  - - [6144, 48000, 1, 2560]
    - [36, 10172.7]
  - - [4608, 48000, 1, 1536]
    - [39, 10587.8]
  - - [35, 8457, 1, 2048]
    - [4, 3263.57]
  - - [4096, 128, 1, 4096]
    - [21, 4976.64]
  - - [2048, 800, 1, 512]
    - [36, 5706.91]
  - - [4608, 5984, 1, 1536]
    - [39, 10114.3]
  - - [2560, 128, 1, 2560]
    - [25, 4739.34]
  - - [6144, 5984, 1, 2048]
    - [38, 8817.88]
  - - [35, 8457, 1, 1760]
    - [3, 4033.98]
  - - [7680, 24000, 1, 2560]
    - [39, 10439.1]
  - - [6144, 48000, 1, 2048]
    - [36, 9414.9]
  - - [5124, 9124, 1, 2560]
    - [36, 9838.23]
  - - [2048, 3200, 1, 2048]
    - [31, 7315.47]
  - - [2048, 16, 1, 2048]
    - [7, 1146.65]
  - - [1024, 24000, 1, 1536]
    - [36, 9933.55]
  - - [7680, 16, 1, 2560]
    - [15, 1935.08]
  - - [2560, 6400, 1, 2560]
    - [31, 9499.42]
  - - [2048, 128, 1, 2048]
    - [17, 3444.15]
  - - [512, 16, 1, 500000]
    - [1, 2883.53]
  - - [1024, 8, 1, 500000]
    - [0, 1552.86]
  - - [512, 24000, 1, 2560]
    - [36, 9989.55]
  - - [1024, 24000, 1, 2816]
    - [36, 10157.1]
  - - [7680, 5984, 1, 2560]
    - [39, 10507.0]
  - - [2048, 1600, 1, 512]
    - [40, 5789.54]
  - - [2048, 7000, 1, 2048]
    - [31, 8064.59]
  - - [1760, 800, 1, 1760]
    - [35, 7928.82]
  - - [5124, 9124, 1, 4096]
    - [36, 9037.1]
  - - [4096, 64, 1, 4096]
    - [21, 4187.23]
  - - [7680, 32, 1, 2560]
    - [6, 3499.67]
  - - [2560, 64, 1, 2560]
    - [19, 3728.25]
  - - [3072, 128, 1, 1024]
    - [20, 2597.33]
  - - [7680, 64, 1, 2560]
    - [23, 4835.83]
  - - [1760, 128, 1, 1760]
    - [14, 5305.01]
  - - [2560, 1600, 1, 2560]
    - [35, 8218.28]
  - - [2048, 3200, 1, 512]
    - [39, 7028.86]
  - - [2560, 800, 1, 2560]
    - [42, 7164.84]
  - - [3072, 32, 1, 1024]
    - [12, 1623.32]
  - - [6144, 32, 1, 2560]
    - [27, 3085.32]
  - - [4608, 12000, 1, 1536]
    - [39, 10486.2]
  - - [4096, 32, 1, 4096]
    - [18, 2707.88]
  - - [6144, 24000, 1, 2048]
    - [38, 9091.53]
  - - [8192, 800, 1, 2048]
    - [38, 6652.05]
  - - [4096, 1600, 1, 1024]
    - [38, 6708.57]
  - - [5124, 9124, 1, 2048]
    - [38, 8711.83]
  - - [8448, 24000, 1, 2816]
    - [41, 10946.7]
  - - [1024, 48000, 1, 1536]
    - [36, 10312.5]
  - - [7680, 128, 1, 2560]
    - [22, 6183.58]
  - - [8192, 1600, 1, 2048]
    - [31, 7627.5]
  - - [4096, 800, 1, 1024]
    - [30, 5393.16]
  - - [1024, 16, 1, 500000]
    - [2, 2971.83]
  - - [2048, 800, 1, 2048]
    - [45, 5394.39]
  - - [1760, 3200, 1, 1760]
    - [29, 10040.2]
  - - [512, 48000, 1, 2560]
    - [36, 10339.3]
  - - [8448, 16, 1, 2816]
    - [28, 2060.25]
  - - [2048, 64, 1, 2048]
    - [10, 2564.39]
  - - [512, 24000, 1, 2048]
    - [37, 8173.64]
  - - [16384, 1600, 1, 4096]
    - [36, 8359.45]
  - - [4608, 16, 1, 1536]
    - [12, 1512.33]
  - - [1024, 24000, 1, 2048]
    - [36, 8550.24]
  - - [8192, 400, 1, 2048]
    - [30, 5520.61]
  - - [2048, 6400, 1, 2048]
    - [31, 8047.37]
  - - [6144, 12000, 1, 2048]
    - [38, 9145.03]
  - - [512, 8, 1, 500000]
    - [0, 1545.44]
  - - [1760, 7000, 1, 1760]
    - [29, 9914.24]
  - - [1024, 48000, 1, 2816]
    - [36, 10596.9]
  - - [6144, 16, 1, 2560]
    - [11, 1772.09]
  - - [8448, 32, 1, 2816]
    - [8, 3615.36]
  - - [4096, 16, 1, 4096]
    - [5, 1596.11]
  - - [6144, 24000, 1, 2560]
    - [39, 9821.05]
  - - [1024, 1024, 1, 1024]
    - [42, 4497.81]
  - - [8448, 12000, 1, 2816]
    - [36, 10887.9]
  - - [16384, 400, 1, 4096]
    - [31, 6224.79]
  - - [1760, 1600, 1, 1760]
    - [41, 9033.61]
  - - [1024, 48000, 1, 2048]
    - [36, 8894.29]
- - - -1
    - - - -1
        - - - 4
            - - [-1, 46]
          - - 64
            - - [4, 46]
              - [128, 26]
              - [448, 10]
              - [1408, 25]
              - [2368, 13]
              - [5888, 24]
              - [-1, 33]
          - - 128
            - - [4, 46]
              - [64, 26]
              - [256, 10]
              - [704, 25]
              - [1408, 24]
              - [1856, 14]
              - [2944, 24]
              - [3584, 33]
              - [5056, 24]
              - [5888, 33]
              - [-1, 35]
          - - 256
            - - [4, 46]
              - [128, 10]
              - [256, 5]
              - [448, 24]
              - [2944, 33]
              - [3584, 31]
              - [5056, 33]
              - [5888, 32]
              - [-1, 43]
          - - 448
            - - [4, 46]
              - [64, 10]
              - [448, 25]
              - [1408, 33]
              - [1856, 35]
              - [2368, 33]
              - [2944, 29]
              - [3584, 43]
              - [4288, 31]
              - [5056, 29]
              - [5888, 43]
              - [-1, 31]
          - - 704
            - - [4, 46]
              - [64, 25]
              - [128, 13]
              - [1024, 33]
              - [1408, 34]
              - [1856, 33]
              - [2368, 43]
              - [5888, 31]
              - [-1, 41]
          - - 1024
            - - [4, 46]
              - [64, 8]
              - [128, 21]
              - [704, 33]
              - [1024, 34]
              - [1408, 29]
              - [1856, 41]
              - [2368, 29]
              - [2944, 43]
              - [4288, 29]
              - [-1, 43]
          - - 1408
            - - [4, 46]
              - [64, 14]
              - [128, 24]
              - [448, 33]
              - [704, 29]
              - [1024, 34]
              - [1408, 43]
              - [1856, 35]
              - [2368, 34]
              - [5888, 41]
              - [-1, 34]
          - - 1856
            - - [4, 46]
              - [64, 25]
              - [128, 14]
              - [256, 33]
              - [448, 29]
              - [704, 33]
              - [1024, 41]
              - [1856, 34]
              - [2944, 29]
              - [4288, 41]
              - [5056, 29]
              - [5888, 41]
              - [-1, 43]
          - - 2368
            - - [4, 46]
              - [64, 25]
              - [128, 24]
              - [448, 33]
              - [704, 43]
              - [1856, 34]
              - [2944, 41]
              - [3584, 43]
              - [4288, 34]
              - [-1, 41]
          - - 2944
            - - [4, 46]
              - [128, 24]
              - [256, 33]
              - [448, 34]
              - [704, 35]
              - [1024, 43]
              - [1408, 41]
              - [1856, 29]
              - [2368, 43]
              - [4288, 29]
              - [5888, 41]
              - [-1, 29]
          - - 3584
            - - [4, 46]
              - [64, 23]
              - [128, 33]
              - [256, 34]
              - [448, 33]
              - [704, 29]
              - [1024, 34]
              - [5056, 41]
              - [-1, 36]
          - - 4288
            - - [4, 46]
              - [64, 25]
              - [128, 14]
              - [256, 33]
              - [448, 37]
              - [704, 29]
              - [1024, 34]
              - [1856, 41]
              - [2944, 34]
              - [3584, 41]
              - [5056, 34]
              - [5888, 41]
              - [-1, 43]
          - - 5056
            - - [4, 46]
              - [64, 24]
              - [448, 33]
              - [704, 29]
              - [1024, 41]
              - [1408, 43]
              - [1856, 32]
              - [3584, 41]
              - [4288, 32]
              - [5056, 41]
              - [5888, 43]
              - [-1, 32]
          - - 5888
            - - [4, 46]
              - [64, 24]
              - [128, 33]
              - [256, 34]
              - [448, 41]
              - [704, 29]
              - [1408, 41]
              - [2368, 43]
              - [2944, 36]
              - [5056, 32]
              - [5888, 36]
              - [-1, 32]
          - - -1
            - - [4, 46]
              - [64, 33]
              - [128, 29]
              - [256, 43]
              - [448, 35]
              - [1024, 43]
              - [1856, 32]
              - [2368, 43]
              - [5888, 32]
              - [-1, 36]
