library/src/blas3/Tensile/Logic/asm_full/vega10_Cijk_Ailk_Bljk_HB.yaml
- {MinimumRequiredVersion: 4.3.0}
- vega10
- gfx900
- [Device 6863, Device 6862, Device 687f, Device 6860, Device 6861, 'Vega 10 XTX [Radeon
    SolutionIndex: 0
    SolutionNameMin: Cijk_Ailk_Bljk_HB_MT064x016x32_GRVW02_LPB00_PBC1_PGR1_TT02_02_USFGRO01_VW02_WG32_08_01
    SolutionIndex: 1
    SolutionNameMin: Cijk_Ailk_Bljk_HB_MT064x008x32_GRVW02_LPB00_PBC1_PGR1_TT04_02_USFGRO01_VW02_WG16_04_01
    SolutionIndex: 2
    SolutionNameMin: Cijk_Ailk_Bljk_HB_MT016x016x08_GRVW02_LPB00_PBC1_PGR1_TT02_02_USFGRO01_VW02_WG08_08_01
    SolutionIndex: 3
    SolutionNameMin: Cijk_Ailk_Bljk_HB_MT016x016x16_GRVW02_LPB00_PBC1_PGR1_TT02_02_USFGRO01_VW02_WG08_08_01
    SolutionIndex: 4
    SolutionNameMin: Cijk_Ailk_Bljk_HB_MT064x016x32_GRVW02_LPB00_PBC1_PGR1_TT04_02_USFGRO01_VW02_WG16_08_01
    SolutionIndex: 5
    SolutionNameMin: Cijk_Ailk_Bljk_HB_MT032x008x32_GRVW02_LPB00_PBC1_PGR1_TT02_02_USFGRO01_VW02_WG16_04_01
    SolutionIndex: 6
    SolutionNameMin: Cijk_Ailk_Bljk_HB_MT128x016x16_GRVW04_LPB00_PBC0_PGR1_TT04_04_USFGRO00_VW04_WG32_04_01
    SolutionIndex: 7
    SolutionNameMin: Cijk_Ailk_Bljk_HB_MT032x016x16_GRVW02_LPB00_PBC1_PGR1_TT02_02_USFGRO01_VW02_WG16_08_01
    SolutionIndex: 8
    SolutionNameMin: Cijk_Ailk_Bljk_HB_MT064x016x16_GRVW02_LPB00_PBC1_PGR1_TT04_02_USFGRO01_VW02_WG16_08_01
    SolutionIndex: 9
    SolutionNameMin: Cijk_Ailk_Bljk_HB_MT064x008x32_GRVW02_LPB00_PBC1_PGR1_TT02_02_USFGRO01_VW02_WG32_04_01
    SolutionIndex: 10
    SolutionNameMin: Cijk_Ailk_Bljk_HB_MT064x016x16_GRVW04_LPB00_PBC0_PGR1_TT04_04_USFGRO00_VW04_WG16_04_01
    SolutionIndex: 11
    SolutionNameMin: Cijk_Ailk_Bljk_HB_MT128x032x32_GRVW04_LPB00_PBC0_PGR1_TT04_04_USFGRO00_VW04_WG32_08_01
    SolutionIndex: 12
    SolutionNameMin: Cijk_Ailk_Bljk_HB_MT048x032x24_GRVW02_LPB00_PBC1_PGR1_TT06_04_USFGRO01_VW02_WG08_08_01
    SolutionIndex: 13
    SolutionNameMin: Cijk_Ailk_Bljk_HB_MT032x032x24_GRVW04_LPB00_PBC0_PGR1_TT04_04_USFGRO00_VW04_WG08_08_01
    SolutionIndex: 14
    SolutionNameMin: Cijk_Ailk_Bljk_HB_MT016x016x16_GRVW02_LPB00_PBC0_PGR1_TT02_02_USFGRO00_VW02_WG08_08_01
    SolutionIndex: 15
    SolutionNameMin: Cijk_Ailk_Bljk_HB_MT032x016x08_GRVW02_LPB00_PBC0_PGR1_TT02_02_USFGRO00_VW02_WG16_08_01
    SolutionIndex: 16
    SolutionNameMin: Cijk_Ailk_Bljk_HB_MT032x016x16_GRVW02_LPB00_PBC1_PGR1_TT02_02_USFGRO01_VW02_WG16_08_01
    SolutionIndex: 17
    SolutionNameMin: Cijk_Ailk_Bljk_HB_MT032x008x32_GRVW02_LPB00_PBC1_PGR1_TT02_02_USFGRO01_VW02_WG16_04_01
    SolutionIndex: 18
    SolutionNameMin: Cijk_Ailk_Bljk_HB_MT032x016x24_GRVW02_LPB00_PBC1_PGR1_TT04_02_USFGRO01_VW02_WG08_08_01
    SolutionIndex: 19
    SolutionNameMin: Cijk_Ailk_Bljk_HB_MT064x016x32_GRVW02_LPB00_PBC1_PGR1_TT04_02_USFGRO01_VW02_WG16_08_01
    SolutionIndex: 20
    SolutionNameMin: Cijk_Ailk_Bljk_HB_MT064x008x32_GRVW02_LPB00_PBC1_PGR1_TT02_02_USFGRO01_VW02_WG32_04_01
    SolutionIndex: 21
    SolutionNameMin: Cijk_Ailk_Bljk_HB_MT128x032x32_GRVW04_LPB00_PBC0_PGR1_TT04_04_USFGRO00_VW04_WG32_08_01
    SolutionIndex: 22
    SolutionNameMin: Cijk_Ailk_Bljk_HB_MT064x016x16_GRVW02_LPB00_PBC1_PGR1_TT04_02_USFGRO01_VW02_WG16_08_01
    SolutionIndex: 23
    SolutionNameMin: Cijk_Ailk_Bljk_HB_MT016x016x24_GRVW02_LPB00_PBC1_PGR1_TT02_02_USFGRO01_VW02_WG08_08_01
    SolutionIndex: 24
    SolutionNameMin: Cijk_Ailk_Bljk_HB_MT064x032x16_GRVW04_LPB00_PBC0_PGR1_TT04_04_USFGRO00_VW04_WG16_08_01
    SolutionIndex: 25
    SolutionNameMin: Cijk_Ailk_Bljk_HB_MT016x016x16_GRVW02_LPB00_PBC1_PGR1_TT02_02_USFGRO01_VW02_WG08_08_01
    SolutionIndex: 26
    SolutionNameMin: Cijk_Ailk_Bljk_HB_MT064x016x32_GRVW02_LPB00_PBC1_PGR1_TT02_02_USFGRO01_VW02_WG32_08_01
    SolutionIndex: 27
    SolutionNameMin: Cijk_Ailk_Bljk_HB_MT128x032x16_GRVW04_LPB00_PBC0_PGR1_TT04_04_USFGRO00_VW04_WG32_08_01
    SolutionIndex: 28
    SolutionNameMin: Cijk_Ailk_Bljk_HB_MT128x064x08_GRVW04_LPB00_PBC0_PGR0_TT08_04_USFGRO00_VW04_WG16_16_01
    SolutionIndex: 29
    SolutionNameMin: Cijk_Ailk_Bljk_HB_MT064x064x08_GRVW04_LPB00_PBC0_PGR0_TT04_04_USFGRO00_VW04_WG16_16_01
    SolutionIndex: 30
    SolutionNameMin: Cijk_Ailk_Bljk_HB_MT128x064x32_GRVW04_LPB00_PBC0_PGR0_TT08_04_USFGRO00_VW04_WG16_16_01
    SolutionIndex: 31
    SolutionNameMin: Cijk_Ailk_Bljk_HB_MT064x128x16_GRVW04_LPB00_PBC0_PGR1_TT04_08_USFGRO00_VW04_WG16_16_01
    SolutionIndex: 32
    SolutionNameMin: Cijk_Ailk_Bljk_HB_MT064x064x16_GRVW04_LPB00_PBC0_PGR1_TT04_04_USFGRO00_VW04_WG16_16_01
    SolutionIndex: 33
    SolutionNameMin: Cijk_Ailk_Bljk_HB_MT064x064x32_GRVW04_LPB00_PBC0_PGR1_TT04_04_USFGRO00_VW04_WG16_16_01
    SolutionIndex: 34
    SolutionNameMin: Cijk_Ailk_Bljk_HB_MT128x064x16_GRVW04_LPB00_PBC0_PGR1_TT08_04_USFGRO00_VW04_WG16_16_01
    SolutionIndex: 35
    SolutionNameMin: Cijk_Ailk_Bljk_HB_MT128x128x32_GRVW08_LPB00_PBC0_PGR0_TT08_08_USFGRO00_VW08_WG16_16_01
    SolutionIndex: 36
    SolutionNameMin: Cijk_Ailk_Bljk_HB_MT128x128x32_GRVW08_LPB00_PBC0_PGR1_TT08_08_USFGRO00_VW08_WG16_16_01
    SolutionIndex: 37
    SolutionNameMin: Cijk_Ailk_Bljk_HB_MT128x064x32_GRVW04_LPB00_PBC0_PGR1_TT08_04_USFGRO00_VW04_WG16_16_01
    SolutionIndex: 38
    SolutionNameMin: Cijk_Ailk_Bljk_HB_MT064x064x16_GRVW08_LPB00_PBC0_PGR0_TT08_08_USFGRO00_VW08_WG08_08_01
    SolutionIndex: 39
    SolutionNameMin: Cijk_Ailk_Bljk_HB_MT128x064x08_GRVW04_LPB00_PBC0_PGR1_TT08_04_USFGRO00_VW04_WG16_16_01
    SolutionIndex: 40
    SolutionNameMin: Cijk_Ailk_Bljk_HB_MT128x128x16_GRVW08_LPB00_PBC0_PGR1_TT08_08_USFGRO00_VW08_WG16_16_01
    SolutionIndex: 41
    SolutionNameMin: Cijk_Ailk_Bljk_HB_MT064x064x16_GRVW02_LPB04_PBC1_PGR1_TT04_04_USFGRO01_VW02_WG16_16_01
    SolutionIndex: 42
    SolutionNameMin: Cijk_Ailk_Bljk_HB_MT128x064x16_GRVW04_LPB04_PBC0_PGR1_TT04_08_USFGRO00_VW04_WG32_08_01
    SolutionIndex: 43
    SolutionNameMin: Cijk_Ailk_Bljk_HB_MT064x032x16_GRVW02_LPB02_PBC1_PGR1_TT04_02_USFGRO01_VW02_WG16_16_01
    SolutionIndex: 44
    SolutionNameMin: Cijk_Ailk_Bljk_HB_MT064x032x16_GRVW02_LPB04_PBC1_PGR1_TT02_04_USFGRO01_VW02_WG32_08_01
    SolutionIndex: 45
    SolutionNameMin: Cijk_Ailk_Bljk_HB_MT128x064x08_GRVW04_LPB00_PBC0_PGR1_TT08_04_USFGRO00_VW04_WG16_16_01
    SolutionIndex: 46
    SolutionNameMin: Cijk_Ailk_Bljk_HB_MT128x064x16_GRVW04_LPB04_PBC0_PGR1_TT08_04_USFGRO00_VW04_WG16_16_01
    SolutionIndex: 47
    SolutionNameMin: Cijk_Ailk_Bljk_HB_MT256x064x16_GRVW04_LPB04_PBC0_PGR1_TT08_04_USFGRO00_VW04_WG32_16_01
    SolutionIndex: 48
    SolutionNameMin: Cijk_Ailk_Bljk_HB_MT128x064x16_GRVW04_LPB04_PBC0_PGR1_TT04_04_USFGRO00_VW04_WG32_16_01
    SolutionIndex: 49
    SolutionNameMin: Cijk_Ailk_Bljk_HB_MT064x064x16_GRVW02_LPB04_PBC1_PGR1_TT04_04_USFGRO01_VW02_WG16_16_01
    SolutionIndex: 50
    SolutionNameMin: Cijk_Ailk_Bljk_HB_MT256x032x16_GRVW04_LPB04_PBC0_PGR0_TT08_04_USFGRO00_VW04_WG32_08_01
    SolutionIndex: 51
    SolutionNameMin: Cijk_Ailk_Bljk_HB_MT064x064x16_GRVW04_LPB04_PBC0_PGR0_TT04_08_USFGRO00_VW04_WG16_08_01
    SolutionIndex: 52
    SolutionNameMin: Cijk_Ailk_Bljk_HB_MT128x064x16_GRVW04_LPB04_PBC0_PGR0_TT04_08_USFGRO00_VW04_WG32_08_01
    SolutionIndex: 53
    SolutionNameMin: Cijk_Ailk_Bljk_HB_MT128x032x16_GRVW02_LPB02_PBC1_PGR0_TT04_04_USFGRO01_VW02_WG32_08_01
- - - [4096, 7000, 1, 4096]
    - [34, 21881.7]
  - - [5124, 9124, 1, 1760]
    - [38, 23025.8]
  - - [5124, 9124, 1, 2560]
    - [40, 22953.4]
  - - [1760, 32, 1, 1760]
    - [5, 3119.14]
  - - [1024, 1500, 1, 1536]
    - [34, 17703.9]
  - - [512, 24000, 1, 1536]
    - [40, 23448.0]
  - - [3072, 24000, 1, 1024]
    - [40, 23445.1]
  - - [1024, 3000, 1, 2560]
    - [40, 21840.0]
  - - [512, 3136, 1, 2048]
    - [47, 15150.4]
  - - [7680, 4, 1, 2560]
    - [20, 1486.89]
  - - [35, 1500, 1, 2048]
    - [12, 0.0]
  - - [8448, 1500, 1, 2816]
    - [39, 22558.2]
  - - [784, 512, 64, 128]
    - [51, 18320.6]
  - - [2560, 7000, 1, 2560]
    - [40, 23036.3]
  - - [3072, 16, 1, 1024]
    - [5, 2444.06]
  - - [512, 48000, 1, 2048]
    - [35, 20225.1]
  - - [1760, 64, 1, 1760]
    - [0, 5495.32]
  - - [1024, 16, 1, 512]
    - [7, 820.602]
  - - [196, 256, 64, 1024]
    - [53, 11119.9]
  - - [512, 48000, 1, 1536]
    - [40, 23332.7]
  - - [2560, 32, 1, 2560]
    - [9, 4282.96]
  - - [4608, 1500, 1, 1536]
    - [40, 22380.0]
  - - [2048, 128, 1, 2048]
    - [21, 9082.04]
  - - [1024, 24000, 1, 2560]
    - [40, 23671.7]
  - - [4608, 3000, 1, 1536]
    - [40, 22789.8]
  - - [5124, 9124, 1, 2048]
    - [35, 21568.1]
  - - [1024, 700, 1, 512]
    - [32, 11995.9]
  - - [3072, 1, 1, 128]
    - [2, 73.7257]
  - - [5124, 700, 1, 2560]
    - [40, 19129.8]
  - - [8448, 16, 1, 2816]
    - [4, 5302.74]
  - - [6144, 6000, 1, 2560]
    - [40, 23543.3]
  - - [4608, 32, 1, 1536]
    - [18, 5747.23]
  - - [35, 8457, 1, 2560]
    - [12, 0.0]
  - - [3072, 64, 1, 1024]
    - [22, 6710.55]
  - - [512, 16, 1, 512]
    - [7, 419.409]
  - - [7680, 2, 1, 2560]
    - [9, 747.637]
  - - [4224, 1, 1, 128]
    - [2, 98.6268]
  - - [7680, 1, 1, 2560]
    - [9, 367.602]
  - - [128, 1500, 1, 1280]
    - [22, 6955.24]
  - - [35, 8457, 1, 4096]
    - [12, 0.0]
  - - [1024, 1500, 1, 2816]
    - [34, 19653.4]
  - - [6144, 2, 1, 2560]
    - [5, 661.465]
  - - [8448, 48000, 1, 2816]
    - [40, 24183.0]
  - - [512, 6000, 1, 1536]
    - [40, 21197.5]
  - - [4224, 1500, 1, 176]
    - [39, 18247.0]
  - - [1024, 6000, 1, 2816]
    - [40, 23011.9]
  - - [512, 6000, 1, 2560]
    - [40, 21666.2]
  - - [512, 32, 1, 512]
    - [7, 814.665]
  - - [2560, 128, 1, 2560]
    - [6, 9662.29]
  - - [4608, 24000, 1, 1536]
    - [40, 24027.4]
  - - [512, 2, 1, 500000]
    - [5, 68.4308]
  - - [7680, 48000, 1, 2560]
    - [40, 24154.0]
  - - [3072, 48000, 1, 1024]
    - [40, 23849.0]
  - - [1760, 16, 1, 1760]
    - [5, 1608.31]
  - - [512, 3000, 1, 2816]
    - [34, 19713.1]
  - - [1760, 7000, 1, 1760]
    - [39, 21942.4]
  - - [64, 193600, 1, 256]
    - [43, 13821.7]
  - - [1024, 3000, 1, 2048]
    - [30, 17051.5]
  - - [6144, 4, 1, 2560]
    - [5, 1318.81]
  - - [1024, 6000, 1, 2048]
    - [30, 17976.3]
  - - [512, 24000, 1, 2816]
    - [40, 23497.9]
  - - [6144, 48000, 1, 2560]
    - [40, 24108.2]
  - - [8448, 3000, 1, 2816]
    - [39, 23263.8]
  - - [35, 1500, 1, 2560]
    - [12, 0.0]
  - - [3072, 4, 1, 1024]
    - [5, 631.466]
  - - [4608, 48000, 1, 1536]
    - [40, 24065.4]
  - - [2048, 32, 1, 2048]
    - [17, 3616.51]
  - - [7680, 1500, 1, 2560]
    - [34, 21723.9]
  - - [4096, 128, 1, 4096]
    - [21, 14280.7]
  - - [4608, 16, 1, 1536]
    - [9, 3639.89]
  - - [1024, 1500, 1, 2048]
    - [30, 14463.8]
  - - [3072, 3000, 1, 1024]
    - [35, 21211.6]
  - - [3072, 2, 1, 1024]
    - [5, 311.104]
  - - [8448, 1, 1, 2816]
    - [9, 367.443]
  - - [1024, 48000, 1, 2560]
    - [40, 24045.2]
  - - [1024, 3000, 1, 2816]
    - [40, 21992.7]
  - - [128, 1, 1, 1408]
    - [5, 7.84811]
  - - [35, 8457, 1, 1760]
    - [12, 0.0]
  - - [1024, 2, 1, 512]
    - [5, 103.323]
  - - [1024, 4, 1, 500000]
    - [5, 273.707]
  - - [6144, 1, 1, 2560]
    - [5, 331.765]
  - - [1024, 48000, 1, 2816]
    - [40, 23995.4]
  - - [512, 48000, 1, 2816]
    - [39, 23713.2]
  - - [2048, 16, 1, 2048]
    - [5, 1899.22]
  - - [1024, 24000, 1, 1536]
    - [40, 23345.6]
  - - [64, 193600, 1, 64]
    - [44, 10956.9]
  - - [7680, 6000, 1, 2560]
    - [40, 23571.1]
  - - [1760, 128, 1, 1760]
    - [10, 8509.43]
  - - [35, 8457, 1, 2048]
    - [12, 0.0]
  - - [512, 1500, 1, 2816]
    - [32, 16014.9]
  - - [512, 1, 1, 512]
    - [5, 26.6082]
  - - [512, 16, 1, 500000]
    - [5, 547.425]
  - - [512, 8, 1, 500000]
    - [5, 273.715]
  - - [512, 24000, 1, 2560]
    - [40, 23406.4]
  - - [6144, 3000, 1, 2560]
    - [40, 23384.6]
  - - [1024, 24000, 1, 2816]
    - [40, 23422.7]
  - - [2048, 7000, 1, 2048]
    - [35, 20702.5]
  - - [7680, 3000, 1, 2560]
    - [40, 23197.2]
  - - [1024, 4, 1, 512]
    - [5, 208.164]
  - - [5124, 700, 1, 2048]
    - [36, 16219.1]
  - - [5124, 9124, 1, 4096]
    - [34, 21695.2]
  - - [4096, 64, 1, 4096]
    - [11, 9847.09]
  - - [256, 193600, 1, 64]
    - [48, 17541.8]
  - - [512, 6000, 1, 2048]
    - [30, 15672.9]
  - - [7680, 32, 1, 2560]
    - [13, 9225.48]
  - - [2560, 64, 1, 2560]
    - [16, 6896.6]
  - - [3136, 2048, 1, 512]
    - [52, 19861.6]
  - - [3072, 128, 1, 1024]
    - [24, 10334.0]
  - - [8448, 6000, 1, 2816]
    - [40, 23854.3]
  - - [7680, 64, 1, 2560]
    - [27, 13354.0]
  - - [5124, 1500, 1, 2560]
    - [40, 21310.2]
  - - [1024, 1500, 1, 2560]
    - [34, 19587.5]
  - - [3025, 64, 64, 64]
    - [49, 0.0]
  - - [512, 4, 1, 512]
    - [9, 106.433]
  - - [1024, 6000, 1, 2560]
    - [40, 22613.0]
  - - [3072, 32, 1, 1024]
    - [16, 4440.86]
  - - [35, 700, 1, 2560]
    - [12, 0.0]
  - - [3136, 512, 1, 2048]
    - [50, 12787.2]
  - - [196, 1024, 64, 256]
    - [52, 16254.4]
  - - [512, 50176, 1, 128]
    - [45, 21348.5]
  - - [4608, 1, 1, 1536]
    - [5, 245.624]
  - - [49, 512, 64, 2048]
    - [49, 0.0]
  - - [4096, 32, 1, 4096]
    - [26, 6710.63]
  - - [7680, 24000, 1, 2560]
    - [40, 23976.4]
  - - [8448, 4, 1, 2816]
    - [9, 1440.12]
  - - [64, 1, 1, 1216]
    - [25, 3.42211]
  - - [512, 1, 1, 500000]
    - [5, 34.2141]
  - - [176, 1500, 1, 1408]
    - [8, 7445.04]
  - - [512, 3000, 1, 1536]
    - [34, 18879.3]
  - - [8448, 24000, 1, 2816]
    - [40, 24102.7]
  - - [4608, 2, 1, 1536]
    - [5, 488.737]
  - - [1024, 48000, 1, 1536]
    - [40, 24312.0]
  - - [7680, 128, 1, 2560]
    - [34, 17675.6]
  - - [3072, 6000, 1, 1024]
    - [40, 21982.8]
  - - [3072, 1500, 1, 128]
    - [39, 16383.3]
  - - [2048, 3136, 1, 512]
    - [42, 20704.7]
  - - [3025, 256, 64, 64]
    - [49, 0.0]
  - - [1024, 3000, 1, 1536]
    - [40, 21296.7]
  - - [512, 4, 1, 500000]
    - [5, 136.855]
  - - [35, 700, 1, 2048]
    - [12, 0.0]
  - - [1024, 16, 1, 500000]
    - [5, 1094.51]
  - - [512, 24000, 1, 2048]
    - [35, 18216.0]
  - - [128, 50176, 1, 512]
    - [41, 16865.8]
  - - [1024, 32, 1, 512]
    - [5, 1583.8]
  - - [256, 12544, 1, 1024]
    - [33, 14431.3]
  - - [1024, 12544, 1, 256]
    - [46, 21983.8]
  - - [512, 48000, 1, 2560]
    - [40, 23659.7]
  - - [2560, 16, 1, 2560]
    - [5, 2371.08]
  - - [2048, 64, 1, 2048]
    - [26, 6173.34]
  - - [512, 2, 1, 512]
    - [9, 53.2164]
  - - [1024, 1, 1, 512]
    - [3, 45.6617]
  - - [512, 1500, 1, 2560]
    - [32, 14910.7]
  - - [6144, 32, 1, 2560]
    - [19, 7668.77]
  - - [1024, 1, 1, 500000]
    - [5, 68.4282]
  - - [6144, 16, 1, 2560]
    - [20, 4888.13]
  - - [1024, 24000, 1, 2048]
    - [35, 21340.0]
  - - [4096, 16, 1, 4096]
    - [5, 3810.43]
  - - [5124, 1500, 1, 2048]
    - [35, 18719.0]
  - - [3072, 1500, 1, 1024]
    - [34, 20113.2]
  - - [1024, 2, 1, 500000]
    - [5, 136.852]
  - - [1024, 8, 1, 500000]
    - [5, 547.425]
  - - [7680, 16, 1, 2560]
    - [26, 5707.78]
  - - [6144, 1500, 1, 2560]
    - [40, 23085.1]
  - - [3072, 1, 1, 1024]
    - [5, 159.044]
  - - [512, 6000, 1, 2816]
    - [40, 21815.9]
  - - [8448, 2, 1, 2816]
    - [1, 720.061]
  - - [4608, 4, 1, 1536]
    - [5, 974.983]
  - - [1024, 6000, 1, 1536]
    - [40, 22179.4]
  - - [8448, 32, 1, 2816]
    - [22, 7972.63]
  - - [512, 3000, 1, 2048]
    - [36, 13528.4]
  - - [6144, 24000, 1, 2560]
    - [40, 24032.9]
  - - [512, 3000, 1, 2560]
    - [34, 19415.6]
  - - [4608, 6000, 1, 1536]
    - [40, 23495.2]
  - - [1024, 1024, 1, 1024]
    - [37, 15284.9]
  - - [512, 1500, 1, 2048]
    - [37, 10621.7]
  - - [512, 1500, 1, 1536]
    - [32, 14142.6]
  - - [128, 1, 1, 1024]
    - [3, 6.88476]
  - - [49, 2048, 64, 512]
    - [49, 0.0]
  - - [1024, 48000, 1, 2048]
    - [35, 22052.5]
- - - -1
    - - - 128
        - - - 4
            - - [-1, 14]
          - - 64
            - - [4, 14]
              - [-1, 15]
          - - 128
            - - [4, 14]
              - [4288, 15]
              - [-1, 29]
          - - 256
            - - [4, 14]
              - [448, 15]
              - [5888, 29]
              - [-1, 28]
          - - 448
            - - [4, 14]
              - [448, 15]
              - [2944, 29]
              - [3584, 28]
              - [-1, 29]
          - - 704
            - - [4, 14]
              - [128, 15]
              - [1856, 29]
              - [2368, 28]
              - [-1, 29]
          - - 1024
            - - [4, 14]
              - [128, 15]
              - [1408, 29]
              - [1856, 28]
              - [2944, 29]
              - [3584, 28]
              - [4288, 29]
              - [-1, 28]
          - - 1408
            - - [4, 14]
              - [128, 15]
              - [1024, 29]
              - [1408, 28]
              - [2368, 29]
              - [-1, 28]
          - - 1856
            - - [4, 14]
              - [128, 15]
              - [704, 29]
              - [1024, 28]
              - [2368, 29]
              - [4288, 28]
              - [5056, 29]
              - [-1, 28]
          - - 2368
            - - [4, 14]
              - [128, 15]
              - [448, 29]
              - [704, 28]
              - [1856, 29]
              - [2944, 28]
              - [3584, 29]
              - [-1, 28]
          - - 2944
            - - [4, 14]
              - [128, 15]
              - [448, 29]
              - [704, 28]
              - [1024, 29]
              - [-1, 28]
          - - 3584
            - - [4, 14]
              - [128, 15]
              - [256, 29]
              - [448, 28]
              - [704, 29]
              - [-1, 28]
          - - 4288
            - - [4, 14]
              - [128, 15]
              - [256, 29]
              - [704, 28]
              - [1024, 29]
              - [-1, 28]
          - - 5888
            - - [4, 14]
              - [64, 15]
              - [448, 29]
              - [-1, 28]
          - - -1
            - - [4, 14]
              - [64, 15]
              - [128, 29]
              - [448, 28]
              - [704, 29]
              - [-1, 28]
      - - 256
        - - - 4
            - - [704, 3]
              - [3584, 2]
              - [-1, 3]
          - - 64
            - - [4, 3]
              - [64, 2]
              - [256, 16]
              - [448, 3]
              - [1024, 2]
              - [1408, 3]
              - [2368, 7]
              - [2944, 0]
              - [5056, 8]
              - [5888, 24]
              - [-1, 32]
          - - 128
            - - [4, 3]
              - [64, 7]
              - [128, 20]
              - [256, 0]
              - [448, 2]
              - [1024, 7]
              - [1408, 0]
              - [2368, 8]
              - [2944, 10]
              - [3584, 32]
              - [4288, 24]
              - [5056, 6]
              - [5888, 27]
              - [-1, 32]
          - - 256
            - - [4, 3]
              - [64, 2]
              - [128, 3]
              - [256, 2]
              - [448, 16]
              - [2944, 32]
              - [3584, 39]
              - [5056, 32]
              - [-1, 39]
          - - 448
            - - [4, 3]
              - [128, 2]
              - [256, 25]
              - [448, 8]
              - [1408, 32]
              - [1856, 39]
              - [2368, 32]
              - [3584, 39]
              - [4288, 31]
              - [5888, 39]
              - [-1, 31]
          - - 704
            - - [4, 3]
              - [64, 0]
              - [128, 7]
              - [1856, 32]
              - [2368, 39]
              - [5056, 31]
              - [5888, 38]
              - [-1, 34]
          - - 1024
            - - [4, 2]
              - [64, 0]
              - [128, 7]
              - [704, 32]
              - [1024, 34]
              - [1408, 39]
              - [1856, 34]
              - [2944, 39]
              - [3584, 34]
              - [4288, 39]
              - [5056, 34]
              - [-1, 40]
          - - 1408
            - - [4, 2]
              - [64, 7]
              - [128, 0]
              - [448, 32]
              - [704, 34]
              - [1024, 39]
              - [1408, 34]
              - [1856, 39]
              - [2368, 34]
              - [5888, 40]
              - [-1, 39]
          - - 1856
            - - [4, 2]
              - [64, 7]
              - [128, 8]
              - [704, 32]
              - [1024, 39]
              - [1408, 31]
              - [1856, 34]
              - [2368, 39]
              - [2944, 34]
              - [3584, 31]
              - [4288, 40]
              - [-1, 39]
          - - 2368
            - - [4, 2]
              - [64, 7]
              - [128, 8]
              - [704, 32]
              - [1024, 39]
              - [1408, 34]
              - [5056, 39]
              - [-1, 40]
          - - 2944
            - - [4, 2]
              - [64, 0]
              - [128, 10]
              - [256, 32]
              - [704, 34]
              - [1024, 39]
              - [1408, 40]
              - [2368, 39]
              - [2944, 34]
              - [5056, 39]
              - [-1, 40]
          - - 3584
            - - [4, 2]
              - [64, 8]
              - [128, 27]
              - [256, 32]
              - [448, 34]
              - [704, 39]
              - [1024, 34]
              - [1408, 40]
              - [1856, 39]
              - [2368, 34]
              - [2944, 39]
              - [-1, 40]
          - - 4288
            - - [4, 3]
              - [64, 8]
              - [128, 24]
              - [256, 32]
              - [704, 34]
              - [1024, 39]
              - [1856, 40]
              - [2944, 39]
              - [3584, 40]
              - [4288, 39]
              - [5888, 40]
              - [-1, 38]
          - - 5056
            - - [4, 3]
              - [64, 8]
              - [128, 6]
              - [256, 32]
              - [448, 39]
              - [704, 34]
              - [1024, 39]
              - [1408, 40]
              - [1856, 34]
              - [2368, 39]
              - [3584, 40]
              - [4288, 39]
              - [-1, 40]
          - - 5888
            - - [4, 3]
              - [64, 10]
              - [128, 32]
              - [448, 34]
              - [704, 39]
              - [1408, 40]
              - [2368, 39]
              - [4288, 40]
              - [5056, 38]
              - [-1, 40]
          - - -1
            - - [4, 3]
              - [64, 10]
              - [128, 24]
              - [256, 32]
              - [448, 34]
              - [1024, 40]
              - [2368, 39]
              - [3584, 40]
              - [4288, 38]
              - [5056, 40]
              - [5888, 38]
              - [-1, 40]
      - - 1280
        - - - 4
            - - [64, 3]
              - [5888, 23]
              - [-1, 3]
          - - 64
            - - [4, 23]
              - [1024, 5]
              - [1408, 9]
              - [1856, 0]
              - [2368, 7]
              - [2944, 8]
              - [3584, 13]
              - [5056, 8]
              - [5888, 13]
              - [-1, 10]
          - - 128
            - - [4, 23]
              - [448, 5]
              - [704, 9]
              - [1024, 0]
              - [1408, 10]
              - [1856, 32]
              - [2368, 8]
              - [2944, 10]
              - [3584, 32]
              - [5056, 24]
              - [5888, 32]
              - [-1, 34]
          - - 256
            - - [4, 3]
              - [256, 5]
              - [448, 26]
              - [2944, 32]
              - [3584, 34]
              - [5056, 32]
              - [-1, 34]
          - - 448
            - - [4, 23]
              - [128, 5]
              - [256, 0]
              - [448, 10]
              - [1408, 32]
              - [1856, 34]
              - [2368, 32]
              - [2944, 34]
              - [3584, 39]
              - [4288, 31]
              - [5056, 34]
              - [5888, 40]
              - [-1, 31]
          - - 704
            - - [4, 23]
              - [64, 5]
              - [128, 7]
              - [1024, 32]
              - [1408, 31]
              - [1856, 32]
              - [2368, 34]
              - [5056, 31]
              - [5888, 38]
              - [-1, 40]
          - - 1024
            - - [4, 23]
              - [64, 5]
              - [128, 0]
              - [704, 32]
              - [1024, 34]
              - [1408, 39]
              - [1856, 34]
              - [2368, 39]
              - [2944, 40]
              - [4288, 34]
              - [-1, 40]
          - - 1408
            - - [4, 23]
              - [64, 7]
              - [128, 10]
              - [448, 32]
              - [2368, 34]
              - [5888, 40]
              - [-1, 39]
          - - 1856
            - - [4, 23]
              - [64, 0]
              - [256, 32]
              - [448, 34]
              - [704, 32]
              - [1024, 34]
              - [1408, 31]
              - [2944, 39]
              - [3584, 31]
              - [4288, 40]
              - [5056, 38]
              - [-1, 40]
          - - 2368
            - - [4, 23]
              - [64, 7]
              - [128, 8]
              - [704, 32]
              - [1024, 34]
              - [1856, 39]
              - [2368, 34]
              - [2944, 40]
              - [4288, 39]
              - [-1, 40]
          - - 2944
            - - [4, 23]
              - [64, 8]
              - [128, 24]
              - [256, 32]
              - [448, 34]
              - [704, 39]
              - [1408, 40]
              - [1856, 39]
              - [2368, 34]
              - [2944, 39]
              - [3584, 34]
              - [5056, 39]
              - [5888, 40]
              - [-1, 39]
          - - 3584
            - - [4, 23]
              - [64, 27]
              - [128, 32]
              - [1024, 34]
              - [1408, 40]
              - [2368, 39]
              - [2944, 34]
              - [4288, 40]
              - [5056, 39]
              - [-1, 40]
          - - 4288
            - - [4, 23]
              - [64, 22]
              - [128, 24]
              - [256, 32]
              - [704, 39]
              - [1024, 34]
              - [1856, 40]
              - [2944, 39]
              - [3584, 40]
              - [5056, 39]
              - [-1, 40]
          - - 5056
            - - [4, 23]
              - [64, 22]
              - [128, 24]
              - [256, 32]
              - [704, 34]
              - [1408, 40]
              - [1856, 38]
              - [2944, 40]
              - [4288, 39]
              - [-1, 40]
          - - 5888
            - - [4, 23]
              - [64, 10]
              - [128, 32]
              - [256, 39]
              - [448, 40]
              - [704, 39]
              - [1024, 40]
              - [2368, 39]
              - [-1, 40]
          - - -1
            - - [4, 3]
              - [64, 32]
              - [448, 34]
              - [1024, 40]
              - [2944, 39]
              - [3584, 40]
              - [5056, 38]
              - [-1, 40]
      - - -1
        - - - 4
            - - [5056, 23]
              - [-1, 13]
          - - 64
            - - [4, 23]
              - [448, 5]
              - [1024, 17]
              - [1408, 20]
              - [1856, 0]
              - [2368, 7]
              - [2944, 8]
              - [3584, 13]
              - [5056, 8]
              - [-1, 32]
          - - 128
            - - [4, 23]
              - [128, 5]
              - [256, 23]
              - [448, 5]
              - [704, 7]
              - [1024, 0]
              - [1408, 10]
              - [1856, 13]
              - [2368, 22]
              - [2944, 10]
              - [3584, 32]
              - [5056, 24]
              - [5888, 32]
              - [-1, 34]
          - - 256
            - - [64, 23]
              - [256, 5]
              - [448, 0]
              - [2944, 32]
              - [3584, 34]
              - [5056, 32]
              - [5888, 34]
              - [-1, 40]
          - - 448
            - - [4, 23]
              - [128, 5]
              - [256, 0]
              - [448, 13]
              - [1408, 32]
              - [1856, 34]
              - [2368, 32]
              - [2944, 34]
              - [3584, 39]
              - [4288, 31]
              - [5056, 39]
              - [5888, 34]
              - [-1, 31]
          - - 704
            - - [4, 23]
              - [64, 17]
              - [128, 16]
              - [1024, 32]
              - [1408, 31]
              - [1856, 32]
              - [2368, 40]
              - [5888, 31]
              - [-1, 40]
          - - 1024
            - - [4, 23]
              - [64, 5]
              - [128, 0]
              - [704, 32]
              - [1024, 34]
              - [1408, 39]
              - [1856, 34]
              - [2368, 39]
              - [2944, 40]
              - [4288, 34]
              - [-1, 40]
          - - 1408
            - - [4, 23]
              - [64, 7]
              - [128, 10]
              - [448, 32]
              - [1024, 34]
              - [1408, 40]
              - [2368, 39]
              - [5888, 40]
              - [-1, 39]
          - - 1856
            - - [4, 23]
              - [64, 0]
              - [128, 13]
              - [256, 32]
              - [448, 34]
              - [704, 32]
              - [1024, 34]
              - [1408, 31]
              - [1856, 34]
              - [2944, 39]
              - [4288, 40]
              - [5056, 39]
              - [5888, 40]
              - [-1, 39]
          - - 2368
            - - [4, 23]
              - [64, 16]
              - [128, 6]
              - [448, 32]
              - [1408, 34]
              - [2368, 39]
              - [2944, 40]
              - [3584, 34]
              - [4288, 39]
              - [-1, 40]
          - - 2944
            - - [4, 23]
              - [64, 18]
              - [128, 10]
              - [256, 32]
              - [1024, 34]
              - [1408, 40]
              - [1856, 39]
              - [2368, 40]
              - [2944, 34]
              - [3584, 39]
              - [5888, 40]
              - [-1, 39]
          - - 3584
            - - [4, 23]
              - [64, 13]
              - [128, 32]
              - [448, 34]
              - [704, 39]
              - [1024, 34]
              - [1408, 40]
              - [3584, 39]
              - [-1, 40]
          - - 4288
            - - [4, 23]
              - [64, 8]
              - [128, 24]
              - [256, 32]
              - [1024, 34]
              - [1856, 40]
              - [2944, 39]
              - [3584, 40]
              - [5056, 39]
              - [-1, 40]
          - - 5056
            - - [4, 23]
              - [64, 22]
              - [128, 24]
              - [256, 32]
              - [448, 39]
              - [704, 34]
              - [1408, 40]
              - [1856, 38]
              - [2368, 40]
              - [2944, 39]
              - [3584, 40]
              - [4288, 39]
              - [-1, 40]
          - - 5888
            - - [4, 23]
              - [128, 32]
              - [256, 34]
              - [448, 39]
              - [704, 34]
              - [1408, 40]
              - [2368, 39]
              - [-1, 40]
          - - -1
            - - [4, 3]
              - [64, 32]
              - [448, 34]
              - [1024, 40]
              - [1856, 39]
              - [3584, 40]
              - [5056, 39]
              - [-1, 40]
