library/src/blas3/Tensile/Logic/asm_full/vega20_Cijk_Ailk_Bljk_DB.yaml
- {MinimumRequiredVersion: 4.7.2}
- vega20
- gfx906
- [Device 66a0, Device 66a1, Device 66a7, Device 66af, Vega 20]
    SolutionIndex: 1
    SolutionNameMin: Cijk_Ailk_Bljk_DB_MT064x064x04_PK00_PLR1_SU32_TT04_04_WG16_16_01_WGM08
    SolutionIndex: 2
    SolutionNameMin: Cijk_Ailk_Bljk_DB_MT096x096x04_PK02_PLR0_SU32_TT06_06_WG16_16_01_WGM01
    SolutionIndex: 3
    SolutionNameMin: Cijk_Ailk_Bljk_DB_MT128x064x04_PK00_PLR1_SU32_TT08_04_WG16_16_01_WGM01
    SolutionIndex: 4
    SolutionNameMin: Cijk_Ailk_Bljk_DB_MT128x064x04_PK02_PLR1_SU32_TT08_04_WG16_16_01_WGM01
    SolutionIndex: 5
    SolutionNameMin: Cijk_Ailk_Bljk_DB_MT128x064x04_PK04_PLR1_SU32_TT08_04_WG16_16_01_WGM01
    SolutionIndex: 6
    SolutionNameMin: Cijk_Ailk_Bljk_DB_MT128x064x04_PK00_PLR1_SU32_TT08_04_WG16_16_01_WGM08
    SolutionIndex: 7
    SolutionNameMin: Cijk_Ailk_Bljk_DB_MT128x064x04_PK04_PLR1_SU32_TT08_04_WG16_16_01_WGM08
    SolutionIndex: 8
    SolutionNameMin: Cijk_Ailk_Bljk_DB_MT064x064x08_PK00_PLR1_SU00_TT04_04_WG16_16_01_WGM01
    SolutionIndex: 9
    SolutionNameMin: Cijk_Ailk_Bljk_DB_MT064x064x08_PK04_PLR1_SU32_TT04_04_WG16_16_01_WGM01
    SolutionIndex: 10
    SolutionNameMin: Cijk_Ailk_Bljk_DB_MT096x064x08_PK00_PLR1_SU00_TT06_04_WG16_16_01_WGM01
    SolutionIndex: 11
    SolutionNameMin: Cijk_Ailk_Bljk_DB_MT096x064x08_PK02_PLR1_SU00_TT06_04_WG16_16_01_WGM01
    SolutionIndex: 12
    SolutionNameMin: Cijk_Ailk_Bljk_DB_MT096x064x08_PK04_PLR1_SU00_TT06_04_WG16_16_01_WGM01
    SolutionIndex: 13
    SolutionNameMin: Cijk_Ailk_Bljk_DB_MT096x064x08_PK00_PLR1_SU32_TT06_04_WG16_16_01_WGM01
    SolutionIndex: 14
    SolutionNameMin: Cijk_Ailk_Bljk_DB_MT096x064x08_PK02_PLR1_SU32_TT06_04_WG16_16_01_WGM01
    SolutionIndex: 15
    SolutionNameMin: Cijk_Ailk_Bljk_DB_MT096x064x08_PK04_PLR1_SU32_TT06_04_WG16_16_01_WGM01
    SolutionIndex: 16
    SolutionNameMin: Cijk_Ailk_Bljk_DB_MT064x096x08_PK00_PLR1_SU32_TT04_06_WG16_16_01_WGM01
    SolutionIndex: 17
    SolutionNameMin: Cijk_Ailk_Bljk_DB_MT064x096x08_PK02_PLR1_SU32_TT04_06_WG16_16_01_WGM01
    SolutionIndex: 18
    SolutionNameMin: Cijk_Ailk_Bljk_DB_MT128x064x08_PK00_PLR0_SU00_TT08_04_WG16_16_01_WGM01
    SolutionIndex: 19
    SolutionNameMin: Cijk_Ailk_Bljk_DB_MT128x064x08_PK00_PLR0_SU32_TT08_04_WG16_16_01_WGM01
    SolutionIndex: 20
    SolutionNameMin: Cijk_Ailk_Bljk_DB_MT128x128x08_PK02_PLR1_SU00_TT08_04_WG16_32_01_WGM01
    SolutionIndex: 21
    SolutionNameMin: Cijk_Ailk_Bljk_DB_MT128x128x08_PK04_PLR1_SU00_TT08_04_WG16_32_01_WGM01
    SolutionIndex: 22
    SolutionNameMin: Cijk_Ailk_Bljk_DB_MT128x128x08_PK02_PLR1_SU32_TT08_04_WG16_32_01_WGM01
    SolutionIndex: 23
    SolutionNameMin: Cijk_Ailk_Bljk_DB_MT128x128x08_PK04_PLR1_SU32_TT08_04_WG16_32_01_WGM01
    SolutionIndex: 24
    SolutionNameMin: Cijk_Ailk_Bljk_DB_MT064x064x08_PK00_PLR1_SU32_TT04_04_WG16_16_01_WGM08
    SolutionIndex: 25
    SolutionNameMin: Cijk_Ailk_Bljk_DB_MT096x064x08_PK02_PLR1_SU00_TT06_04_WG16_16_01_WGM08
    SolutionIndex: 26
    SolutionNameMin: Cijk_Ailk_Bljk_DB_MT096x064x08_PK04_PLR1_SU00_TT06_04_WG16_16_01_WGM08
    SolutionIndex: 27
    SolutionNameMin: Cijk_Ailk_Bljk_DB_MT096x064x08_PK00_PLR1_SU32_TT06_04_WG16_16_01_WGM08
    SolutionIndex: 28
    SolutionNameMin: Cijk_Ailk_Bljk_DB_MT096x064x08_PK02_PLR1_SU32_TT06_04_WG16_16_01_WGM08
    SolutionIndex: 29
    SolutionNameMin: Cijk_Ailk_Bljk_DB_MT096x064x08_PK04_PLR1_SU32_TT06_04_WG16_16_01_WGM08
    SolutionIndex: 30
    SolutionNameMin: Cijk_Ailk_Bljk_DB_MT128x128x08_PK02_PLR1_SU32_TT08_04_WG16_32_01_WGM08
    SolutionIndex: 31
    SolutionNameMin: Cijk_Ailk_Bljk_DB_MT128x064x04_NLCA01_NLCB01_TT08_04_WG16_16_01
    SolutionIndex: 32
    SolutionNameMin: Cijk_Ailk_Bljk_DB_MT064x032x08_NLCA01_NLCB01_TT04_04_WG16_08_01
    SolutionIndex: 33
    SolutionNameMin: Cijk_Ailk_Bljk_DB_MT032x064x08_NLCA01_NLCB01_TT04_04_WG08_16_01
    SolutionIndex: 34
    SolutionNameMin: Cijk_Ailk_Bljk_DB_MT032x096x08_NLCA01_NLCB01_TT04_06_WG08_16_01
    SolutionIndex: 35
    SolutionNameMin: Cijk_Ailk_Bljk_DB_MT064x064x08_NLCA01_NLCB01_TT04_04_WG16_16_01
    SolutionIndex: 36
    SolutionNameMin: Cijk_Ailk_Bljk_DB_MT128x128x08_NLCA01_NLCB01_TT08_04_WG16_32_01
    SolutionIndex: 37
    SolutionNameMin: Cijk_Ailk_Bljk_DB_MT064x032x04_PK00_PLR1_SU00_SNLL1_TT04_04_WG16_08_01_WGM01
    SolutionIndex: 38
    SolutionNameMin: Cijk_Ailk_Bljk_DB_MT064x032x04_PK00_PLR0_SU00_SNLL1_TT04_04_WG16_08_01_WGM01
    SolutionIndex: 39
    SolutionNameMin: Cijk_Ailk_Bljk_DB_MT064x032x04_PK04_PLR1_SU00_SNLL1_TT04_04_WG16_08_01_WGM01
    SolutionIndex: 40
    SolutionNameMin: Cijk_Ailk_Bljk_DB_MT064x032x04_PK00_PLR1_SU00_SNLL0_TT04_04_WG16_08_01_WGM01
    SolutionIndex: 41
    SolutionNameMin: Cijk_Ailk_Bljk_DB_MT064x032x04_PK00_PLR0_SU00_SNLL0_TT04_04_WG16_08_01_WGM01
    SolutionIndex: 42
    SolutionNameMin: Cijk_Ailk_Bljk_DB_MT064x032x04_PK04_PLR1_SU00_SNLL0_TT04_04_WG16_08_01_WGM01
    SolutionIndex: 43
    SolutionNameMin: Cijk_Ailk_Bljk_DB_MT064x032x04_PK00_PLR1_SU32_SNLL1_TT04_04_WG16_08_01_WGM01
    SolutionIndex: 44
    SolutionNameMin: Cijk_Ailk_Bljk_DB_MT064x032x04_PK00_PLR0_SU32_SNLL1_TT04_04_WG16_08_01_WGM01
    SolutionIndex: 45
    SolutionNameMin: Cijk_Ailk_Bljk_DB_MT064x032x04_PK00_PLR1_SU32_SNLL0_TT04_04_WG16_08_01_WGM01
    SolutionIndex: 46
    SolutionNameMin: Cijk_Ailk_Bljk_DB_MT064x032x04_PK00_PLR0_SU32_SNLL0_TT04_04_WG16_08_01_WGM01
    SolutionIndex: 47
    SolutionNameMin: Cijk_Ailk_Bljk_DB_MT096x032x04_PK00_PLR1_SU00_SNLL1_TT06_04_WG16_08_01_WGM01
    SolutionIndex: 48
    SolutionNameMin: Cijk_Ailk_Bljk_DB_MT096x032x04_PK00_PLR1_SU00_SNLL0_TT06_04_WG16_08_01_WGM01
    SolutionIndex: 49
    SolutionNameMin: Cijk_Ailk_Bljk_DB_MT096x032x04_PK00_PLR1_SU32_SNLL1_TT06_04_WG16_08_01_WGM01
    SolutionIndex: 50
    SolutionNameMin: Cijk_Ailk_Bljk_DB_MT096x032x04_PK00_PLR1_SU32_SNLL0_TT06_04_WG16_08_01_WGM01
    SolutionIndex: 51
    SolutionNameMin: Cijk_Ailk_Bljk_DB_MT064x048x04_PK00_PLR1_SU00_SNLL1_TT04_06_WG16_08_01_WGM01
    SolutionIndex: 52
    SolutionNameMin: Cijk_Ailk_Bljk_DB_MT064x048x04_PK00_PLR0_SU00_SNLL1_TT04_06_WG16_08_01_WGM01
    SolutionIndex: 53
    SolutionNameMin: Cijk_Ailk_Bljk_DB_MT064x048x04_PK00_PLR1_SU00_SNLL0_TT04_06_WG16_08_01_WGM01
    SolutionIndex: 54
    SolutionNameMin: Cijk_Ailk_Bljk_DB_MT064x048x04_PK00_PLR0_SU00_SNLL0_TT04_06_WG16_08_01_WGM01
    SolutionIndex: 55
    SolutionNameMin: Cijk_Ailk_Bljk_DB_MT064x048x04_PK04_PLR1_SU00_SNLL0_TT04_06_WG16_08_01_WGM01
    SolutionIndex: 56
    SolutionNameMin: Cijk_Ailk_Bljk_DB_MT064x048x04_PK00_PLR1_SU32_SNLL1_TT04_06_WG16_08_01_WGM01
    SolutionIndex: 57
    SolutionNameMin: Cijk_Ailk_Bljk_DB_MT064x048x04_PK00_PLR0_SU32_SNLL1_TT04_06_WG16_08_01_WGM01
    SolutionIndex: 58
    SolutionNameMin: Cijk_Ailk_Bljk_DB_MT064x048x04_PK04_PLR1_SU32_SNLL1_TT04_06_WG16_08_01_WGM01
    SolutionIndex: 59
    SolutionNameMin: Cijk_Ailk_Bljk_DB_MT064x048x04_PK00_PLR1_SU32_SNLL0_TT04_06_WG16_08_01_WGM01
    SolutionIndex: 60
    SolutionNameMin: Cijk_Ailk_Bljk_DB_MT064x048x04_PK00_PLR0_SU32_SNLL0_TT04_06_WG16_08_01_WGM01
    SolutionIndex: 61
    SolutionNameMin: Cijk_Ailk_Bljk_DB_MT064x048x04_PK04_PLR1_SU32_SNLL0_TT04_06_WG16_08_01_WGM01
    SolutionIndex: 62
    SolutionNameMin: Cijk_Ailk_Bljk_DB_MT128x032x04_PK00_PLR0_SU32_SNLL1_TT08_04_WG16_08_01_WGM01
    SolutionIndex: 63
    SolutionNameMin: Cijk_Ailk_Bljk_DB_MT128x032x04_PK04_PLR0_SU32_SNLL1_TT08_04_WG16_08_01_WGM01
    SolutionIndex: 64
    SolutionNameMin: Cijk_Ailk_Bljk_DB_MT128x032x04_PK00_PLR0_SU32_SNLL0_TT08_04_WG16_08_01_WGM01
    SolutionIndex: 65
    SolutionNameMin: Cijk_Ailk_Bljk_DB_MT064x064x04_PK00_PLR0_SU32_SNLL1_TT04_08_WG16_08_01_WGM01
    SolutionIndex: 66
    SolutionNameMin: Cijk_Ailk_Bljk_DB_MT064x064x04_PK00_PLR1_SU32_SNLL0_TT04_08_WG16_08_01_WGM01
    SolutionIndex: 67
    SolutionNameMin: Cijk_Ailk_Bljk_DB_MT032x064x04_PK00_PLR1_SU00_SNLL1_TT04_04_WG08_16_01_WGM01
    SolutionIndex: 68
    SolutionNameMin: Cijk_Ailk_Bljk_DB_MT096x064x04_PK00_PLR1_SU32_SNLL1_TT06_04_WG16_16_01_WGM01
    SolutionIndex: 69
    SolutionNameMin: Cijk_Ailk_Bljk_DB_MT096x064x04_PK00_PLR0_SU32_SNLL1_TT06_04_WG16_16_01_WGM01
    SolutionIndex: 70
    SolutionNameMin: Cijk_Ailk_Bljk_DB_MT096x064x04_PK00_PLR0_SU32_SNLL0_TT06_04_WG16_16_01_WGM01
    SolutionIndex: 71
    SolutionNameMin: Cijk_Ailk_Bljk_DB_MT096x064x04_PK04_PLR0_SU32_SNLL0_TT06_04_WG16_16_01_WGM01
    SolutionIndex: 72
    SolutionNameMin: Cijk_Ailk_Bljk_DB_MT128x064x04_PK00_PLR1_SU32_SNLL1_TT08_04_WG16_16_01_WGM01
    SolutionIndex: 73
    SolutionNameMin: Cijk_Ailk_Bljk_DB_MT128x064x04_PK00_PLR1_SU32_SNLL0_TT08_04_WG16_16_01_WGM01
    SolutionIndex: 74
    SolutionNameMin: Cijk_Ailk_Bljk_DB_MT064x032x04_PK00_PLR1_SU00_SNLL1_TT04_04_WG16_08_01_WGM08
    SolutionIndex: 75
    SolutionNameMin: Cijk_Ailk_Bljk_DB_MT064x032x04_PK00_PLR0_SU00_SNLL1_TT04_04_WG16_08_01_WGM08
    SolutionIndex: 76
    SolutionNameMin: Cijk_Ailk_Bljk_DB_MT064x032x04_PK00_PLR1_SU00_SNLL0_TT04_04_WG16_08_01_WGM08
    SolutionIndex: 77
    SolutionNameMin: Cijk_Ailk_Bljk_DB_MT064x032x04_PK00_PLR0_SU00_SNLL0_TT04_04_WG16_08_01_WGM08
    SolutionIndex: 78
    SolutionNameMin: Cijk_Ailk_Bljk_DB_MT064x032x04_PK00_PLR1_SU32_SNLL1_TT04_04_WG16_08_01_WGM08
    SolutionIndex: 79
    SolutionNameMin: Cijk_Ailk_Bljk_DB_MT064x032x04_PK00_PLR0_SU32_SNLL1_TT04_04_WG16_08_01_WGM08
    SolutionIndex: 80
    SolutionNameMin: Cijk_Ailk_Bljk_DB_MT064x032x04_PK00_PLR1_SU32_SNLL0_TT04_04_WG16_08_01_WGM08
    SolutionIndex: 81
    SolutionNameMin: Cijk_Ailk_Bljk_DB_MT064x032x04_PK00_PLR0_SU32_SNLL0_TT04_04_WG16_08_01_WGM08
    SolutionIndex: 82
    SolutionNameMin: Cijk_Ailk_Bljk_DB_MT064x032x04_PK04_PLR1_SU32_SNLL0_TT04_04_WG16_08_01_WGM08
    SolutionIndex: 83
    SolutionNameMin: Cijk_Ailk_Bljk_DB_MT096x032x04_PK00_PLR1_SU00_SNLL1_TT06_04_WG16_08_01_WGM08
    SolutionIndex: 84
    SolutionNameMin: Cijk_Ailk_Bljk_DB_MT096x032x04_PK00_PLR1_SU00_SNLL0_TT06_04_WG16_08_01_WGM08
    SolutionIndex: 85
    SolutionNameMin: Cijk_Ailk_Bljk_DB_MT096x032x04_PK00_PLR1_SU32_SNLL1_TT06_04_WG16_08_01_WGM08
    SolutionIndex: 86
    SolutionNameMin: Cijk_Ailk_Bljk_DB_MT096x032x04_PK04_PLR1_SU32_SNLL1_TT06_04_WG16_08_01_WGM08
    SolutionIndex: 87
    SolutionNameMin: Cijk_Ailk_Bljk_DB_MT096x032x04_PK00_PLR1_SU32_SNLL0_TT06_04_WG16_08_01_WGM08
    SolutionIndex: 88
    SolutionNameMin: Cijk_Ailk_Bljk_DB_MT096x032x04_PK04_PLR1_SU32_SNLL0_TT06_04_WG16_08_01_WGM08
    SolutionIndex: 89
    SolutionNameMin: Cijk_Ailk_Bljk_DB_MT064x048x04_PK00_PLR1_SU00_SNLL1_TT04_06_WG16_08_01_WGM08
    SolutionIndex: 90
    SolutionNameMin: Cijk_Ailk_Bljk_DB_MT064x048x04_PK00_PLR0_SU00_SNLL1_TT04_06_WG16_08_01_WGM08
    SolutionIndex: 91
    SolutionNameMin: Cijk_Ailk_Bljk_DB_MT064x048x04_PK00_PLR1_SU00_SNLL0_TT04_06_WG16_08_01_WGM08
    SolutionIndex: 92
    SolutionNameMin: Cijk_Ailk_Bljk_DB_MT064x048x04_PK00_PLR0_SU00_SNLL0_TT04_06_WG16_08_01_WGM08
    SolutionIndex: 93
    SolutionNameMin: Cijk_Ailk_Bljk_DB_MT064x048x04_PK00_PLR1_SU32_SNLL1_TT04_06_WG16_08_01_WGM08
    SolutionIndex: 94
    SolutionNameMin: Cijk_Ailk_Bljk_DB_MT064x048x04_PK00_PLR0_SU32_SNLL1_TT04_06_WG16_08_01_WGM08
    SolutionIndex: 95
    SolutionNameMin: Cijk_Ailk_Bljk_DB_MT064x048x04_PK00_PLR1_SU32_SNLL0_TT04_06_WG16_08_01_WGM08
    SolutionIndex: 96
    SolutionNameMin: Cijk_Ailk_Bljk_DB_MT064x048x04_PK00_PLR0_SU32_SNLL0_TT04_06_WG16_08_01_WGM08
    SolutionIndex: 97
    SolutionNameMin: Cijk_Ailk_Bljk_DB_MT128x032x04_PK00_PLR0_SU00_SNLL1_TT08_04_WG16_08_01_WGM08
    SolutionIndex: 98
    SolutionNameMin: Cijk_Ailk_Bljk_DB_MT128x032x04_PK00_PLR0_SU32_SNLL1_TT08_04_WG16_08_01_WGM08
    SolutionIndex: 99
    SolutionNameMin: Cijk_Ailk_Bljk_DB_MT128x032x04_PK04_PLR0_SU32_SNLL1_TT08_04_WG16_08_01_WGM08
    SolutionIndex: 100
    SolutionNameMin: Cijk_Ailk_Bljk_DB_MT128x032x04_PK00_PLR0_SU32_SNLL0_TT08_04_WG16_08_01_WGM08
    SolutionIndex: 101
    SolutionNameMin: Cijk_Ailk_Bljk_DB_MT128x032x04_PK04_PLR0_SU32_SNLL0_TT08_04_WG16_08_01_WGM08
    SolutionIndex: 102
    SolutionNameMin: Cijk_Ailk_Bljk_DB_MT032x064x04_PK00_PLR1_SU00_SNLL1_TT04_04_WG08_16_01_WGM08
    SolutionIndex: 103
    SolutionNameMin: Cijk_Ailk_Bljk_DB_MT096x064x04_PK00_PLR0_SU32_SNLL1_TT06_04_WG16_16_01_WGM08
    SolutionIndex: 104
    SolutionNameMin: Cijk_Ailk_Bljk_DB_MT096x064x04_PK00_PLR0_SU32_SNLL0_TT06_04_WG16_16_01_WGM08
    SolutionIndex: 105
    SolutionNameMin: Cijk_Ailk_Bljk_DB_MT096x064x04_PK04_PLR0_SU32_SNLL0_TT06_04_WG16_16_01_WGM08
    SolutionIndex: 106
    SolutionNameMin: Cijk_Ailk_Bljk_DB_MT128x064x04_PK00_PLR1_SU32_SNLL1_TT08_04_WG16_16_01_WGM08
    SolutionIndex: 107
    SolutionNameMin: Cijk_Ailk_Bljk_DB_MT128x064x04_PK00_PLR1_SU32_SNLL0_TT08_04_WG16_16_01_WGM08
    SolutionIndex: 108
    SolutionNameMin: Cijk_Ailk_Bljk_DB_MT128x064x08_PK00_PLR0_SU00_SNLL1_TT04_04_WG32_16_01_WGM01
    SolutionIndex: 109
    SolutionNameMin: Cijk_Ailk_Bljk_DB_MT128x064x08_PK04_PLR0_SU00_SNLL1_TT04_04_WG32_16_01_WGM01
    SolutionIndex: 110
    SolutionNameMin: Cijk_Ailk_Bljk_DB_MT128x064x08_PK00_PLR0_SU00_SNLL0_TT04_04_WG32_16_01_WGM01
    SolutionIndex: 111
    SolutionNameMin: Cijk_Ailk_Bljk_DB_MT128x064x08_PK02_PLR0_SU00_SNLL0_TT04_04_WG32_16_01_WGM01
    SolutionIndex: 112
    SolutionNameMin: Cijk_Ailk_Bljk_DB_MT128x064x08_PK04_PLR0_SU00_SNLL0_TT04_04_WG32_16_01_WGM01
    SolutionIndex: 113
    SolutionNameMin: Cijk_Ailk_Bljk_DB_MT128x064x08_PK00_PLR0_SU32_SNLL1_TT04_04_WG32_16_01_WGM01
    SolutionIndex: 114
    SolutionNameMin: Cijk_Ailk_Bljk_DB_MT128x064x08_PK02_PLR0_SU32_SNLL1_TT04_04_WG32_16_01_WGM01
    SolutionIndex: 115
    SolutionNameMin: Cijk_Ailk_Bljk_DB_MT128x064x08_PK04_PLR0_SU32_SNLL1_TT04_04_WG32_16_01_WGM01
    SolutionIndex: 116
    SolutionNameMin: Cijk_Ailk_Bljk_DB_MT128x064x08_PK00_PLR0_SU32_SNLL0_TT04_04_WG32_16_01_WGM01
    SolutionIndex: 117
    SolutionNameMin: Cijk_Ailk_Bljk_DB_MT128x064x08_PK02_PLR0_SU32_SNLL0_TT04_04_WG32_16_01_WGM01
    SolutionIndex: 118
    SolutionNameMin: Cijk_Ailk_Bljk_DB_MT128x064x08_PK04_PLR0_SU32_SNLL0_TT04_04_WG32_16_01_WGM01
    SolutionIndex: 119
    SolutionNameMin: Cijk_Ailk_Bljk_DB_MT064x032x08_PK00_PLR1_SU00_SNLL1_TT04_04_WG16_08_01_WGM01
    SolutionIndex: 120
    SolutionNameMin: Cijk_Ailk_Bljk_DB_MT064x032x08_PK00_PLR0_SU00_SNLL1_TT04_04_WG16_08_01_WGM01
    SolutionIndex: 121
    SolutionNameMin: Cijk_Ailk_Bljk_DB_MT064x032x08_PK04_PLR1_SU00_SNLL1_TT04_04_WG16_08_01_WGM01
    SolutionIndex: 122
    SolutionNameMin: Cijk_Ailk_Bljk_DB_MT064x032x08_PK00_PLR1_SU00_SNLL0_TT04_04_WG16_08_01_WGM01
    SolutionIndex: 123
    SolutionNameMin: Cijk_Ailk_Bljk_DB_MT064x032x08_PK04_PLR1_SU00_SNLL0_TT04_04_WG16_08_01_WGM01
    SolutionIndex: 124
    SolutionNameMin: Cijk_Ailk_Bljk_DB_MT064x032x08_PK00_PLR1_SU32_SNLL1_TT04_04_WG16_08_01_WGM01
    SolutionIndex: 125
    SolutionNameMin: Cijk_Ailk_Bljk_DB_MT064x032x08_PK00_PLR0_SU32_SNLL1_TT04_04_WG16_08_01_WGM01
    SolutionIndex: 126
    SolutionNameMin: Cijk_Ailk_Bljk_DB_MT064x032x08_PK04_PLR1_SU32_SNLL1_TT04_04_WG16_08_01_WGM01
    SolutionIndex: 127
    SolutionNameMin: Cijk_Ailk_Bljk_DB_MT064x032x08_PK00_PLR1_SU32_SNLL0_TT04_04_WG16_08_01_WGM01
    SolutionIndex: 128
    SolutionNameMin: Cijk_Ailk_Bljk_DB_MT064x032x08_PK02_PLR1_SU32_SNLL0_TT04_04_WG16_08_01_WGM01
    SolutionIndex: 129
    SolutionNameMin: Cijk_Ailk_Bljk_DB_MT096x032x08_PK00_PLR1_SU00_SNLL1_TT06_04_WG16_08_01_WGM01
    SolutionIndex: 130
    SolutionNameMin: Cijk_Ailk_Bljk_DB_MT096x032x08_PK04_PLR1_SU00_SNLL1_TT06_04_WG16_08_01_WGM01
    SolutionIndex: 131
    SolutionNameMin: Cijk_Ailk_Bljk_DB_MT096x032x08_PK00_PLR1_SU32_SNLL1_TT06_04_WG16_08_01_WGM01
    SolutionIndex: 132
    SolutionNameMin: Cijk_Ailk_Bljk_DB_MT096x032x08_PK00_PLR0_SU32_SNLL1_TT06_04_WG16_08_01_WGM01
    SolutionIndex: 133
    SolutionNameMin: Cijk_Ailk_Bljk_DB_MT064x048x08_PK00_PLR1_SU00_SNLL1_TT04_06_WG16_08_01_WGM01
    SolutionIndex: 134
    SolutionNameMin: Cijk_Ailk_Bljk_DB_MT064x048x08_PK00_PLR1_SU00_SNLL0_TT04_06_WG16_08_01_WGM01
    SolutionIndex: 135
    SolutionNameMin: Cijk_Ailk_Bljk_DB_MT064x048x08_PK04_PLR1_SU00_SNLL0_TT04_06_WG16_08_01_WGM01
    SolutionIndex: 136
    SolutionNameMin: Cijk_Ailk_Bljk_DB_MT064x048x08_PK00_PLR1_SU32_SNLL1_TT04_06_WG16_08_01_WGM01
    SolutionIndex: 137
    SolutionNameMin: Cijk_Ailk_Bljk_DB_MT064x048x08_PK00_PLR1_SU32_SNLL0_TT04_06_WG16_08_01_WGM01
    SolutionIndex: 138
    SolutionNameMin: Cijk_Ailk_Bljk_DB_MT032x064x08_PK00_PLR1_SU00_SNLL1_TT04_04_WG08_16_01_WGM01
    SolutionIndex: 139
    SolutionNameMin: Cijk_Ailk_Bljk_DB_MT064x064x08_PK00_PLR1_SU00_SNLL1_TT04_04_WG16_16_01_WGM01
    SolutionIndex: 140
    SolutionNameMin: Cijk_Ailk_Bljk_DB_MT064x064x08_PK00_PLR1_SU00_SNLL0_TT04_04_WG16_16_01_WGM01
    SolutionIndex: 141
    SolutionNameMin: Cijk_Ailk_Bljk_DB_MT064x064x08_PK00_PLR1_SU32_SNLL1_TT04_04_WG16_16_01_WGM01
    SolutionIndex: 142
    SolutionNameMin: Cijk_Ailk_Bljk_DB_MT064x064x08_PK00_PLR0_SU32_SNLL1_TT04_04_WG16_16_01_WGM01
    SolutionIndex: 143
    SolutionNameMin: Cijk_Ailk_Bljk_DB_MT064x064x08_PK04_PLR1_SU32_SNLL1_TT04_04_WG16_16_01_WGM01
    SolutionIndex: 144
    SolutionNameMin: Cijk_Ailk_Bljk_DB_MT064x064x08_PK04_PLR0_SU32_SNLL1_TT04_04_WG16_16_01_WGM01
    SolutionIndex: 145
    SolutionNameMin: Cijk_Ailk_Bljk_DB_MT064x064x08_PK00_PLR1_SU32_SNLL0_TT04_04_WG16_16_01_WGM01
    SolutionIndex: 146
    SolutionNameMin: Cijk_Ailk_Bljk_DB_MT064x064x08_PK00_PLR0_SU32_SNLL0_TT04_04_WG16_16_01_WGM01
    SolutionIndex: 147
    SolutionNameMin: Cijk_Ailk_Bljk_DB_MT064x064x08_PK04_PLR1_SU32_SNLL0_TT04_04_WG16_16_01_WGM01
    SolutionIndex: 148
    SolutionNameMin: Cijk_Ailk_Bljk_DB_MT064x064x08_PK04_PLR0_SU32_SNLL0_TT04_04_WG16_16_01_WGM01
    SolutionIndex: 149
    SolutionNameMin: Cijk_Ailk_Bljk_DB_MT096x064x08_PK00_PLR1_SU00_SNLL1_TT06_04_WG16_16_01_WGM01
    SolutionIndex: 150
    SolutionNameMin: Cijk_Ailk_Bljk_DB_MT096x064x08_PK00_PLR1_SU00_SNLL0_TT06_04_WG16_16_01_WGM01
    SolutionIndex: 151
    SolutionNameMin: Cijk_Ailk_Bljk_DB_MT096x064x08_PK00_PLR1_SU32_SNLL1_TT06_04_WG16_16_01_WGM01
    SolutionIndex: 152
    SolutionNameMin: Cijk_Ailk_Bljk_DB_MT096x064x08_PK00_PLR1_SU32_SNLL0_TT06_04_WG16_16_01_WGM01
    SolutionIndex: 153
    SolutionNameMin: Cijk_Ailk_Bljk_DB_MT064x096x08_PK00_PLR1_SU00_SNLL1_TT04_06_WG16_16_01_WGM01
    SolutionIndex: 154
    SolutionNameMin: Cijk_Ailk_Bljk_DB_MT064x096x08_PK02_PLR1_SU00_SNLL1_TT04_06_WG16_16_01_WGM01
    SolutionIndex: 155
    SolutionNameMin: Cijk_Ailk_Bljk_DB_MT064x096x08_PK04_PLR1_SU00_SNLL1_TT04_06_WG16_16_01_WGM01
    SolutionIndex: 156
    SolutionNameMin: Cijk_Ailk_Bljk_DB_MT064x096x08_PK00_PLR1_SU00_SNLL0_TT04_06_WG16_16_01_WGM01
    SolutionIndex: 157
    SolutionNameMin: Cijk_Ailk_Bljk_DB_MT064x096x08_PK02_PLR1_SU00_SNLL0_TT04_06_WG16_16_01_WGM01
    SolutionIndex: 158
    SolutionNameMin: Cijk_Ailk_Bljk_DB_MT064x096x08_PK04_PLR1_SU00_SNLL0_TT04_06_WG16_16_01_WGM01
    SolutionIndex: 159
    SolutionNameMin: Cijk_Ailk_Bljk_DB_MT064x096x08_PK00_PLR1_SU32_SNLL1_TT04_06_WG16_16_01_WGM01
    SolutionIndex: 160
    SolutionNameMin: Cijk_Ailk_Bljk_DB_MT064x096x08_PK02_PLR1_SU32_SNLL1_TT04_06_WG16_16_01_WGM01
    SolutionIndex: 161
    SolutionNameMin: Cijk_Ailk_Bljk_DB_MT064x096x08_PK04_PLR1_SU32_SNLL1_TT04_06_WG16_16_01_WGM01
    SolutionIndex: 162
    SolutionNameMin: Cijk_Ailk_Bljk_DB_MT064x096x08_PK00_PLR1_SU32_SNLL0_TT04_06_WG16_16_01_WGM01
    SolutionIndex: 163
    SolutionNameMin: Cijk_Ailk_Bljk_DB_MT064x096x08_PK02_PLR1_SU32_SNLL0_TT04_06_WG16_16_01_WGM01
    SolutionIndex: 164
    SolutionNameMin: Cijk_Ailk_Bljk_DB_MT064x096x08_PK04_PLR1_SU32_SNLL0_TT04_06_WG16_16_01_WGM01
    SolutionIndex: 165
    SolutionNameMin: Cijk_Ailk_Bljk_DB_MT128x064x08_PK04_PLR0_SU00_SNLL1_TT04_04_WG32_16_01_WGM08
    SolutionIndex: 166
    SolutionNameMin: Cijk_Ailk_Bljk_DB_MT128x064x08_PK02_PLR0_SU00_SNLL0_TT04_04_WG32_16_01_WGM08
    SolutionIndex: 167
    SolutionNameMin: Cijk_Ailk_Bljk_DB_MT128x064x08_PK00_PLR0_SU32_SNLL1_TT04_04_WG32_16_01_WGM08
    SolutionIndex: 168
    SolutionNameMin: Cijk_Ailk_Bljk_DB_MT128x064x08_PK02_PLR0_SU32_SNLL1_TT04_04_WG32_16_01_WGM08
    SolutionIndex: 169
    SolutionNameMin: Cijk_Ailk_Bljk_DB_MT128x064x08_PK04_PLR0_SU32_SNLL1_TT04_04_WG32_16_01_WGM08
    SolutionIndex: 170
    SolutionNameMin: Cijk_Ailk_Bljk_DB_MT128x064x08_PK00_PLR0_SU32_SNLL0_TT04_04_WG32_16_01_WGM08
    SolutionIndex: 171
    SolutionNameMin: Cijk_Ailk_Bljk_DB_MT128x064x08_PK02_PLR0_SU32_SNLL0_TT04_04_WG32_16_01_WGM08
    SolutionIndex: 172
    SolutionNameMin: Cijk_Ailk_Bljk_DB_MT128x064x08_PK04_PLR0_SU32_SNLL0_TT04_04_WG32_16_01_WGM08
    SolutionIndex: 173
    SolutionNameMin: Cijk_Ailk_Bljk_DB_MT064x032x08_PK00_PLR1_SU00_SNLL1_TT04_04_WG16_08_01_WGM08
    SolutionIndex: 174
    SolutionNameMin: Cijk_Ailk_Bljk_DB_MT064x032x08_PK00_PLR0_SU00_SNLL1_TT04_04_WG16_08_01_WGM08
    SolutionIndex: 175
    SolutionNameMin: Cijk_Ailk_Bljk_DB_MT064x032x08_PK00_PLR1_SU00_SNLL0_TT04_04_WG16_08_01_WGM08
    SolutionIndex: 176
    SolutionNameMin: Cijk_Ailk_Bljk_DB_MT064x032x08_PK00_PLR1_SU32_SNLL1_TT04_04_WG16_08_01_WGM08
    SolutionIndex: 177
    SolutionNameMin: Cijk_Ailk_Bljk_DB_MT064x032x08_PK04_PLR1_SU32_SNLL1_TT04_04_WG16_08_01_WGM08
    SolutionIndex: 178
    SolutionNameMin: Cijk_Ailk_Bljk_DB_MT064x032x08_PK00_PLR1_SU32_SNLL0_TT04_04_WG16_08_01_WGM08
    SolutionIndex: 179
    SolutionNameMin: Cijk_Ailk_Bljk_DB_MT064x032x08_PK04_PLR1_SU32_SNLL0_TT04_04_WG16_08_01_WGM08
    SolutionIndex: 180
    SolutionNameMin: Cijk_Ailk_Bljk_DB_MT096x032x08_PK00_PLR1_SU00_SNLL1_TT06_04_WG16_08_01_WGM08
    SolutionIndex: 181
    SolutionNameMin: Cijk_Ailk_Bljk_DB_MT096x032x08_PK00_PLR1_SU00_SNLL0_TT06_04_WG16_08_01_WGM08
    SolutionIndex: 182
    SolutionNameMin: Cijk_Ailk_Bljk_DB_MT096x032x08_PK00_PLR1_SU32_SNLL1_TT06_04_WG16_08_01_WGM08
    SolutionIndex: 183
    SolutionNameMin: Cijk_Ailk_Bljk_DB_MT096x032x08_PK04_PLR1_SU32_SNLL1_TT06_04_WG16_08_01_WGM08
    SolutionIndex: 184
    SolutionNameMin: Cijk_Ailk_Bljk_DB_MT096x032x08_PK00_PLR1_SU32_SNLL0_TT06_04_WG16_08_01_WGM08
    SolutionIndex: 185
    SolutionNameMin: Cijk_Ailk_Bljk_DB_MT064x048x08_PK00_PLR1_SU00_SNLL1_TT04_06_WG16_08_01_WGM08
    SolutionIndex: 186
    SolutionNameMin: Cijk_Ailk_Bljk_DB_MT064x048x08_PK04_PLR1_SU00_SNLL0_TT04_06_WG16_08_01_WGM08
    SolutionIndex: 187
    SolutionNameMin: Cijk_Ailk_Bljk_DB_MT064x048x08_PK00_PLR1_SU32_SNLL1_TT04_06_WG16_08_01_WGM08
    SolutionIndex: 188
    SolutionNameMin: Cijk_Ailk_Bljk_DB_MT064x048x08_PK04_PLR1_SU32_SNLL1_TT04_06_WG16_08_01_WGM08
    SolutionIndex: 189
    SolutionNameMin: Cijk_Ailk_Bljk_DB_MT064x048x08_PK00_PLR1_SU32_SNLL0_TT04_06_WG16_08_01_WGM08
    SolutionIndex: 190
    SolutionNameMin: Cijk_Ailk_Bljk_DB_MT064x064x08_PK00_PLR1_SU00_SNLL0_TT04_04_WG16_16_01_WGM08
    SolutionIndex: 191
    SolutionNameMin: Cijk_Ailk_Bljk_DB_MT064x064x08_PK00_PLR1_SU32_SNLL1_TT04_04_WG16_16_01_WGM08
    SolutionIndex: 192
    SolutionNameMin: Cijk_Ailk_Bljk_DB_MT064x064x08_PK00_PLR0_SU32_SNLL1_TT04_04_WG16_16_01_WGM08
    SolutionIndex: 193
    SolutionNameMin: Cijk_Ailk_Bljk_DB_MT064x064x08_PK04_PLR0_SU32_SNLL1_TT04_04_WG16_16_01_WGM08
    SolutionIndex: 194
    SolutionNameMin: Cijk_Ailk_Bljk_DB_MT064x064x08_PK00_PLR1_SU32_SNLL0_TT04_04_WG16_16_01_WGM08
    SolutionIndex: 195
    SolutionNameMin: Cijk_Ailk_Bljk_DB_MT064x064x08_PK00_PLR0_SU32_SNLL0_TT04_04_WG16_16_01_WGM08
    SolutionIndex: 196
    SolutionNameMin: Cijk_Ailk_Bljk_DB_MT064x064x08_PK04_PLR1_SU32_SNLL0_TT04_04_WG16_16_01_WGM08
    SolutionIndex: 197
    SolutionNameMin: Cijk_Ailk_Bljk_DB_MT064x064x08_PK04_PLR0_SU32_SNLL0_TT04_04_WG16_16_01_WGM08
    SolutionIndex: 198
    SolutionNameMin: Cijk_Ailk_Bljk_DB_MT096x064x08_PK00_PLR1_SU00_SNLL1_TT06_04_WG16_16_01_WGM08
    SolutionIndex: 199
    SolutionNameMin: Cijk_Ailk_Bljk_DB_MT096x064x08_PK02_PLR1_SU00_SNLL1_TT06_04_WG16_16_01_WGM08
    SolutionIndex: 200
    SolutionNameMin: Cijk_Ailk_Bljk_DB_MT096x064x08_PK04_PLR1_SU00_SNLL1_TT06_04_WG16_16_01_WGM08
    SolutionIndex: 201
    SolutionNameMin: Cijk_Ailk_Bljk_DB_MT096x064x08_PK00_PLR1_SU00_SNLL0_TT06_04_WG16_16_01_WGM08
    SolutionIndex: 202
    SolutionNameMin: Cijk_Ailk_Bljk_DB_MT096x064x08_PK02_PLR1_SU00_SNLL0_TT06_04_WG16_16_01_WGM08
    SolutionIndex: 203
    SolutionNameMin: Cijk_Ailk_Bljk_DB_MT096x064x08_PK04_PLR1_SU00_SNLL0_TT06_04_WG16_16_01_WGM08
    SolutionIndex: 204
    SolutionNameMin: Cijk_Ailk_Bljk_DB_MT096x064x08_PK00_PLR1_SU32_SNLL0_TT06_04_WG16_16_01_WGM08
    SolutionIndex: 205
    SolutionNameMin: Cijk_Ailk_Bljk_DB_MT064x096x08_PK04_PLR1_SU00_SNLL1_TT04_06_WG16_16_01_WGM08
    SolutionIndex: 206
    SolutionNameMin: Cijk_Ailk_Bljk_DB_MT064x096x08_PK02_PLR1_SU00_SNLL0_TT04_06_WG16_16_01_WGM08
    SolutionIndex: 207
    SolutionNameMin: Cijk_Ailk_Bljk_DB_MT064x096x08_PK04_PLR1_SU00_SNLL0_TT04_06_WG16_16_01_WGM08
    SolutionIndex: 208
    SolutionNameMin: Cijk_Ailk_Bljk_DB_MT064x096x08_PK02_PLR1_SU32_SNLL1_TT04_06_WG16_16_01_WGM08
    SolutionIndex: 209
    SolutionNameMin: Cijk_Ailk_Bljk_DB_MT064x096x08_PK00_PLR1_SU32_SNLL0_TT04_06_WG16_16_01_WGM08
    SolutionIndex: 210
    SolutionNameMin: Cijk_Ailk_Bljk_DB_MT064x096x08_PK02_PLR1_SU32_SNLL0_TT04_06_WG16_16_01_WGM08
    SolutionIndex: 211
    SolutionNameMin: Cijk_Ailk_Bljk_DB_MT64x32x8_SE_AMAS1_GRVW1_USFGRO1_VW1
    SolutionIndex: 212
    SolutionNameMin: Cijk_Ailk_Bljk_DB_MT64x32x4_SE_PK0_PLR1_SU0_SNLL1_TT4_4_WG16_8_1_WGM1
    SolutionIndex: 213
    SolutionNameMin: Cijk_Ailk_Bljk_DB_MT64x32x4_SE_PK0_PLR0_SU0_SNLL1_TT4_4_WG16_8_1_WGM1
    SolutionIndex: 214
    SolutionNameMin: Cijk_Ailk_Bljk_DB_MT64x32x4_SE_PK2_PLR1_SU0_SNLL1_TT4_4_WG16_8_1_WGM1
    SolutionIndex: 215
    SolutionNameMin: Cijk_Ailk_Bljk_DB_MT64x32x4_SE_PK4_PLR1_SU0_SNLL1_TT4_4_WG16_8_1_WGM1
    SolutionIndex: 216
    SolutionNameMin: Cijk_Ailk_Bljk_DB_MT64x32x4_SE_PK0_PLR1_SU0_SNLL0_TT4_4_WG16_8_1_WGM1
    SolutionIndex: 217
    SolutionNameMin: Cijk_Ailk_Bljk_DB_MT64x32x4_SE_PK0_PLR0_SU0_SNLL0_TT4_4_WG16_8_1_WGM1
    SolutionIndex: 218
    SolutionNameMin: Cijk_Ailk_Bljk_DB_MT64x32x4_SE_PK4_PLR1_SU0_SNLL0_TT4_4_WG16_8_1_WGM1
    SolutionIndex: 219
    SolutionNameMin: Cijk_Ailk_Bljk_DB_MT64x32x4_SE_PK0_PLR1_SU32_SNLL1_TT4_4_WG16_8_1_WGM1
    SolutionIndex: 220
    SolutionNameMin: Cijk_Ailk_Bljk_DB_MT64x32x4_SE_PK0_PLR0_SU32_SNLL1_TT4_4_WG16_8_1_WGM1
    SolutionIndex: 221
    SolutionNameMin: Cijk_Ailk_Bljk_DB_MT64x32x4_SE_PK0_PLR1_SU32_SNLL0_TT4_4_WG16_8_1_WGM1
    SolutionIndex: 222
    SolutionNameMin: Cijk_Ailk_Bljk_DB_MT64x32x4_SE_PK0_PLR0_SU32_SNLL0_TT4_4_WG16_8_1_WGM1
    SolutionIndex: 224
    SolutionNameMin: Cijk_Ailk_Bljk_DB_MT32x64x4_SE_PK0_PLR1_SU0_SNLL1_TT4_4_WG8_16_1_WGM1
    SolutionIndex: 225
    SolutionNameMin: Cijk_Ailk_Bljk_DB_MT32x64x4_SE_PK4_PLR1_SU0_SNLL1_TT4_4_WG8_16_1_WGM1
    SolutionIndex: 226
    SolutionNameMin: Cijk_Ailk_Bljk_DB_MT32x64x4_SE_PK2_PLR1_SU0_SNLL0_TT4_4_WG8_16_1_WGM1
    SolutionIndex: 227
    SolutionNameMin: Cijk_Ailk_Bljk_DB_MT96x64x4_SE_PK0_PLR0_SU32_SNLL1_TT6_4_WG16_16_1_WGM1
    SolutionIndex: 228
    SolutionNameMin: Cijk_Ailk_Bljk_DB_MT96x64x4_SE_PK4_PLR0_SU32_SNLL1_TT6_4_WG16_16_1_WGM1
    SolutionIndex: 229
    SolutionNameMin: Cijk_Ailk_Bljk_DB_MT96x64x4_SE_PK0_PLR0_SU32_SNLL0_TT6_4_WG16_16_1_WGM1
    SolutionIndex: 231
    SolutionNameMin: Cijk_Ailk_Bljk_DB_MT64x32x4_SE_PK0_PLR1_SU0_SNLL1_TT4_4_WG16_8_1_WGM8
    SolutionIndex: 232
    SolutionNameMin: Cijk_Ailk_Bljk_DB_MT64x32x4_SE_PK0_PLR0_SU0_SNLL1_TT4_4_WG16_8_1_WGM8
    SolutionIndex: 233
    SolutionNameMin: Cijk_Ailk_Bljk_DB_MT64x32x4_SE_PK2_PLR1_SU0_SNLL1_TT4_4_WG16_8_1_WGM8
    SolutionIndex: 234
    SolutionNameMin: Cijk_Ailk_Bljk_DB_MT64x32x4_SE_PK4_PLR1_SU0_SNLL1_TT4_4_WG16_8_1_WGM8
    SolutionIndex: 235
    SolutionNameMin: Cijk_Ailk_Bljk_DB_MT64x32x4_SE_PK0_PLR1_SU0_SNLL0_TT4_4_WG16_8_1_WGM8
    SolutionIndex: 236
    SolutionNameMin: Cijk_Ailk_Bljk_DB_MT64x32x4_SE_PK0_PLR0_SU0_SNLL0_TT4_4_WG16_8_1_WGM8
    SolutionIndex: 237
    SolutionNameMin: Cijk_Ailk_Bljk_DB_MT64x32x4_SE_PK2_PLR1_SU0_SNLL0_TT4_4_WG16_8_1_WGM8
    SolutionIndex: 239
    SolutionNameMin: Cijk_Ailk_Bljk_DB_MT64x32x4_SE_PK0_PLR1_SU32_SNLL1_TT4_4_WG16_8_1_WGM8
    SolutionIndex: 240
    SolutionNameMin: Cijk_Ailk_Bljk_DB_MT64x32x4_SE_PK0_PLR0_SU32_SNLL1_TT4_4_WG16_8_1_WGM8
    SolutionIndex: 242
    SolutionNameMin: Cijk_Ailk_Bljk_DB_MT64x32x4_SE_PK0_PLR0_SU32_SNLL0_TT4_4_WG16_8_1_WGM8
    SolutionIndex: 243
    SolutionNameMin: Cijk_Ailk_Bljk_DB_MT32x64x4_SE_PK0_PLR1_SU0_SNLL1_TT4_4_WG8_16_1_WGM8
    SolutionIndex: 245
    SolutionNameMin: Cijk_Ailk_Bljk_DB_MT96x64x4_SE_PK0_PLR0_SU32_SNLL0_TT6_4_WG16_16_1_WGM8
    SolutionIndex: 246
    SolutionNameMin: Cijk_Ailk_Bljk_DB_MT64x32x8_SE_PK0_PLR1_SU0_SNLL1_TT4_4_WG16_8_1_WGM1
    SolutionIndex: 247
    SolutionNameMin: Cijk_Ailk_Bljk_DB_MT64x32x8_SE_PK2_PLR1_SU0_SNLL1_TT4_4_WG16_8_1_WGM1
    SolutionIndex: 248
    SolutionNameMin: Cijk_Ailk_Bljk_DB_MT64x32x8_SE_PK4_PLR1_SU0_SNLL1_TT4_4_WG16_8_1_WGM1
    SolutionIndex: 249
    SolutionNameMin: Cijk_Ailk_Bljk_DB_MT64x32x8_SE_PK4_PLR1_SU0_SNLL0_TT4_4_WG16_8_1_WGM1
    SolutionIndex: 250
    SolutionNameMin: Cijk_Ailk_Bljk_DB_MT64x32x8_SE_PK0_PLR1_SU32_SNLL1_TT4_4_WG16_8_1_WGM1
    SolutionIndex: 251
    SolutionNameMin: Cijk_Ailk_Bljk_DB_MT64x32x8_SE_PK2_PLR1_SU32_SNLL1_TT4_4_WG16_8_1_WGM1
    SolutionIndex: 252
    SolutionNameMin: Cijk_Ailk_Bljk_DB_MT64x32x8_SE_PK4_PLR1_SU32_SNLL1_TT4_4_WG16_8_1_WGM1
    SolutionIndex: 254
    SolutionNameMin: Cijk_Ailk_Bljk_DB_MT64x64x8_SE_PK0_PLR1_SU0_SNLL1_TT4_4_WG16_16_1_WGM1
    SolutionIndex: 255
    SolutionNameMin: Cijk_Ailk_Bljk_DB_MT64x64x8_SE_PK0_PLR0_SU0_SNLL1_TT4_4_WG16_16_1_WGM1
    SolutionIndex: 256
    SolutionNameMin: Cijk_Ailk_Bljk_DB_MT64x64x8_SE_PK4_PLR1_SU0_SNLL1_TT4_4_WG16_16_1_WGM1
    SolutionIndex: 257
    SolutionNameMin: Cijk_Ailk_Bljk_DB_MT64x64x8_SE_PK4_PLR0_SU0_SNLL1_TT4_4_WG16_16_1_WGM1
    SolutionIndex: 258
    SolutionNameMin: Cijk_Ailk_Bljk_DB_MT64x64x8_SE_PK0_PLR1_SU0_SNLL0_TT4_4_WG16_16_1_WGM1
    SolutionIndex: 259
    SolutionNameMin: Cijk_Ailk_Bljk_DB_MT64x64x8_SE_PK0_PLR0_SU0_SNLL0_TT4_4_WG16_16_1_WGM1
    SolutionIndex: 260
    SolutionNameMin: Cijk_Ailk_Bljk_DB_MT64x64x8_SE_PK4_PLR0_SU0_SNLL0_TT4_4_WG16_16_1_WGM1
    SolutionIndex: 261
    SolutionNameMin: Cijk_Ailk_Bljk_DB_MT64x64x8_SE_PK0_PLR1_SU32_SNLL1_TT4_4_WG16_16_1_WGM1
    SolutionIndex: 262
    SolutionNameMin: Cijk_Ailk_Bljk_DB_MT64x64x8_SE_PK0_PLR0_SU32_SNLL1_TT4_4_WG16_16_1_WGM1
    SolutionIndex: 263
    SolutionNameMin: Cijk_Ailk_Bljk_DB_MT64x64x8_SE_PK4_PLR1_SU32_SNLL1_TT4_4_WG16_16_1_WGM1
    SolutionIndex: 264
    SolutionNameMin: Cijk_Ailk_Bljk_DB_MT64x64x8_SE_PK4_PLR0_SU32_SNLL1_TT4_4_WG16_16_1_WGM1
    SolutionIndex: 265
    SolutionNameMin: Cijk_Ailk_Bljk_DB_MT64x64x8_SE_PK0_PLR1_SU32_SNLL0_TT4_4_WG16_16_1_WGM1
    SolutionIndex: 266
    SolutionNameMin: Cijk_Ailk_Bljk_DB_MT64x64x8_SE_PK0_PLR0_SU32_SNLL0_TT4_4_WG16_16_1_WGM1
    SolutionIndex: 267
    SolutionNameMin: Cijk_Ailk_Bljk_DB_MT64x64x8_SE_PK4_PLR1_SU32_SNLL0_TT4_4_WG16_16_1_WGM1
    SolutionIndex: 268
    SolutionNameMin: Cijk_Ailk_Bljk_DB_MT64x64x8_SE_PK4_PLR0_SU32_SNLL0_TT4_4_WG16_16_1_WGM1
    SolutionIndex: 269
    SolutionNameMin: Cijk_Ailk_Bljk_DB_MT128x64x8_SE_PK4_PLR0_SU32_SNLL0_TT4_4_WG32_16_1_WGM8
    SolutionIndex: 270
    SolutionNameMin: Cijk_Ailk_Bljk_DB_MT64x32x8_SE_PK0_PLR1_SU0_SNLL1_TT4_4_WG16_8_1_WGM8
    SolutionIndex: 271
    SolutionNameMin: Cijk_Ailk_Bljk_DB_MT64x32x8_SE_PK4_PLR1_SU0_SNLL1_TT4_4_WG16_8_1_WGM8
    SolutionIndex: 274
    SolutionNameMin: Cijk_Ailk_Bljk_DB_MT64x32x8_SE_PK0_PLR1_SU32_SNLL1_TT4_4_WG16_8_1_WGM8
    SolutionIndex: 275
    SolutionNameMin: Cijk_Ailk_Bljk_DB_MT64x64x8_SE_PK0_PLR1_SU0_SNLL1_TT4_4_WG16_16_1_WGM8
    SolutionIndex: 276
    SolutionNameMin: Cijk_Ailk_Bljk_DB_MT64x64x8_SE_PK0_PLR0_SU0_SNLL1_TT4_4_WG16_16_1_WGM8
    SolutionIndex: 277
    SolutionNameMin: Cijk_Ailk_Bljk_DB_MT64x64x8_SE_PK0_PLR1_SU32_SNLL1_TT4_4_WG16_16_1_WGM8
    SolutionIndex: 278
    SolutionNameMin: Cijk_Ailk_Bljk_DB_MT64x64x8_SE_PK0_PLR0_SU32_SNLL1_TT4_4_WG16_16_1_WGM8
    SolutionIndex: 279
    SolutionNameMin: Cijk_Ailk_Bljk_DB_MT64x64x8_SE_PK4_PLR1_SU32_SNLL1_TT4_4_WG16_16_1_WGM8
    SolutionIndex: 280
    SolutionNameMin: Cijk_Ailk_Bljk_DB_MT64x64x8_SE_PK4_PLR0_SU32_SNLL1_TT4_4_WG16_16_1_WGM8
    SolutionIndex: 281
    SolutionNameMin: Cijk_Ailk_Bljk_DB_MT64x64x8_SE_PK0_PLR1_SU32_SNLL0_TT4_4_WG16_16_1_WGM8
    SolutionIndex: 282
    SolutionNameMin: Cijk_Ailk_Bljk_DB_MT64x64x8_SE_PK0_PLR0_SU32_SNLL0_TT4_4_WG16_16_1_WGM8
    SolutionIndex: 283
    SolutionNameMin: Cijk_Ailk_Bljk_DB_MT64x64x8_SE_PK4_PLR1_SU32_SNLL0_TT4_4_WG16_16_1_WGM8
    SolutionIndex: 284
    SolutionNameMin: Cijk_Ailk_Bljk_DB_MT64x64x8_SE_PK4_PLR0_SU32_SNLL0_TT4_4_WG16_16_1_WGM8
    SolutionIndex: 286
    SolutionNameMin: Cijk_Ailk_Bljk_DB_MT64x96x8_SE_PK4_PLR1_SU32_SNLL0_TT4_6_WG16_16_1_WGM8
- - - [41728, 41728, 1, 256]
    - [10, 4871.54]
  - - [12032, 12032, 1, 256]
    - [23, 4827.72]
  - - [15360, 15360, 1, 256]
    - [21, 4849.08]
  - - [7680, 7680, 1, 384]
    - [29, 4910.48]
  - - [35328, 35328, 1, 384]
    - [10, 4943.34]
  - - [41088, 41088, 1, 384]
    - [6, 5019.62]
  - - [21504, 21504, 1, 384]
    - [21, 4942.97]
  - - [44544, 44544, 1, 384]
    - [10, 4942.33]
  - - [33280, 33280, 1, 256]
    - [22, 4855.32]
  - - [1152, 1152, 1, 384]
    - [10, 3960.29]
  - - [13312, 13312, 1, 256]
    - [21, 4842.64]
  - - [29952, 29952, 1, 256]
    - [23, 4858.87]
  - - [13824, 13824, 1, 256]
    - [21, 4841.69]
  - - [24576, 24576, 1, 384]
    - [22, 4904.94]
  - - [44544, 44544, 1, 256]
    - [22, 4846.45]
  - - [20736, 20736, 1, 384]
    - [10, 4967.81]
  - - [31488, 31488, 1, 256]
    - [10, 4865.19]
  - - [17664, 17664, 1, 384]
    - [10, 4967.58]
  - - [26880, 26880, 1, 384]
    - [10, 4978.88]
  - - [31872, 31872, 1, 384]
    - [6, 5012.4]
  - - [4864, 4864, 1, 256]
    - [28, 4655.91]
  - - [10240, 10240, 1, 256]
    - [20, 4826.83]
  - - [16896, 16896, 1, 384]
    - [10, 4935.21]
  - - [1, 1, 1, 64]
    - [1, 0.00632411]
  - - [9984, 9984, 1, 384]
    - [25, 4953.65]
  - - [26496, 26496, 1, 384]
    - [6, 5011.39]
  - - [2816, 2816, 1, 256]
    - [14, 4427.78]
  - - [24832, 24832, 1, 256]
    - [10, 4859.61]
  - - [8832, 8832, 1, 384]
    - [15, 4976.68]
  - - [29184, 29184, 1, 384]
    - [20, 4941.04]
  - - [42624, 42624, 1, 384]
    - [6, 5018.36]
  - - [22272, 22272, 1, 384]
    - [13, 4970.52]
  - - [39552, 39552, 1, 384]
    - [6, 5017.3]
  - - [40448, 40448, 1, 256]
    - [20, 4848.79]
  - - [44800, 44800, 1, 256]
    - [10, 4869.29]
  - - [39680, 39680, 1, 256]
    - [10, 4862.53]
  - - [30464, 30464, 1, 256]
    - [10, 4860.06]
  - - [32768, 32768, 1, 256]
    - [19, 4714.5]
  - - [12672, 12672, 1, 384]
    - [6, 4984.3]
  - - [41984, 41984, 1, 256]
    - [22, 4849.96]
  - - [11008, 11008, 1, 256]
    - [28, 4825.51]
  - - [26112, 26112, 1, 384]
    - [21, 4942.39]
  - - [3072, 3072, 1, 384]
    - [3, 4754.26]
  - - [9984, 9984, 1, 256]
    - [28, 4833.35]
  - - [38016, 38016, 1, 384]
    - [6, 5020.8]
  - - [17408, 17408, 1, 256]
    - [22, 4852.21]
  - - [43008, 43008, 1, 384]
    - [10, 4945.17]
  - - [36096, 36096, 1, 384]
    - [10, 4980.13]
  - - [33024, 33024, 1, 256]
    - [10, 4871.03]
  - - [8448, 8448, 1, 256]
    - [29, 4817.84]
  - - [23552, 23552, 1, 256]
    - [20, 4860.0]
  - - [24064, 24064, 1, 256]
    - [22, 4853.73]
  - - [41472, 41472, 1, 384]
    - [10, 4946.18]
  - - [5120, 5120, 1, 256]
    - [23, 4635.37]
  - - [7680, 7680, 1, 256]
    - [28, 4772.77]
  - - [6400, 6400, 1, 256]
    - [14, 4692.88]
  - - [8704, 8704, 1, 256]
    - [28, 4769.21]
  - - [19968, 19968, 1, 256]
    - [21, 4847.17]
  - - [40320, 40320, 1, 384]
    - [6, 5006.8]
  - - [18432, 18432, 1, 256]
    - [21, 4851.92]
  - - [19712, 19712, 1, 256]
    - [23, 4850.79]
  - - [43776, 43776, 1, 384]
    - [10, 4976.56]
  - - [25344, 25344, 1, 256]
    - [10, 4868.49]
  - - [12800, 12800, 1, 256]
    - [21, 4816.13]
  - - [10368, 10368, 1, 384]
    - [15, 4967.78]
  - - [1280, 1280, 1, 256]
    - [9, 3713.09]
  - - [10496, 10496, 1, 256]
    - [22, 4813.83]
  - - [24960, 24960, 1, 384]
    - [6, 5018.7]
  - - [6144, 6144, 1, 256]
    - [23, 4665.75]
  - - [15616, 15616, 1, 256]
    - [28, 4853.36]
  - - [9600, 9600, 1, 384]
    - [7, 4985.73]
  - - [30720, 30720, 1, 256]
    - [20, 4863.64]
  - - [1792, 1792, 1, 256]
    - [2, 4103.86]
  - - [20480, 20480, 1, 256]
    - [20, 4856.93]
  - - [17920, 17920, 1, 256]
    - [21, 4853.02]
  - - [10752, 10752, 1, 384]
    - [28, 4912.33]
  - - [39424, 39424, 1, 256]
    - [20, 4847.98]
  - - [4224, 4224, 1, 384]
    - [11, 4789.86]
  - - [29568, 29568, 1, 384]
    - [6, 5014.68]
  - - [33792, 33792, 1, 256]
    - [22, 4858.72]
  - - [25344, 25344, 1, 384]
    - [13, 4974.1]
  - - [35072, 35072, 1, 256]
    - [13, 4859.9]
  - - [1536, 1536, 1, 384]
    - [16, 4558.12]
  - - [15744, 15744, 1, 384]
    - [10, 4992.06]
  - - [29184, 29184, 1, 256]
    - [20, 4861.19]
  - - [40192, 40192, 1, 256]
    - [10, 4869.63]
  - - [9728, 9728, 1, 256]
    - [21, 4807.19]
  - - [17152, 17152, 1, 256]
    - [10, 4850.49]
  - - [30720, 30720, 1, 384]
    - [20, 4947.81]
  - - [8192, 8192, 1, 256]
    - [21, 4780.05]
  - - [31744, 31744, 1, 256]
    - [20, 4865.42]
  - - [16128, 16128, 1, 384]
    - [13, 4970.16]
  - - [34816, 34816, 1, 256]
    - [20, 4856.37]
  - - [36352, 36352, 1, 256]
    - [20, 4853.85]
  - - [38656, 38656, 1, 256]
    - [13, 4864.41]
  - - [44032, 44032, 1, 256]
    - [22, 4852.42]
  - - [9472, 9472, 1, 256]
    - [28, 4836.27]
  - - [23296, 23296, 1, 256]
    - [20, 4857.72]
  - - [34304, 34304, 1, 256]
    - [20, 4854.44]
  - - [43520, 43520, 1, 256]
    - [22, 4846.29]
  - - [19456, 19456, 1, 256]
    - [20, 4859.67]
  - - [21120, 21120, 1, 384]
    - [6, 5014.79]
  - - [6528, 6528, 1, 384]
    - [11, 4968.46]
  - - [9216, 9216, 1, 256]
    - [20, 4812.55]
  - - [25856, 25856, 1, 256]
    - [20, 4859.03]
  - - [34176, 34176, 1, 384]
    - [6, 5013.41]
  - - [32256, 32256, 1, 384]
    - [20, 4943.11]
  - - [39936, 39936, 1, 384]
    - [10, 4946.34]
  - - [9216, 9216, 1, 384]
    - [20, 4914.38]
  - - [14848, 14848, 1, 256]
    - [21, 4842.72]
  - - [23040, 23040, 1, 256]
    - [21, 4862.82]
  - - [19200, 19200, 1, 256]
    - [26, 4856.59]
  - - [1, 64, 1, 64]
    - [1, 0.445217]
  - - [14592, 14592, 1, 384]
    - [25, 4955.37]
  - - [21888, 21888, 1, 384]
    - [6, 5017.05]
  - - [768, 768, 1, 256]
    - [17, 3257.01]
  - - [26112, 26112, 1, 256]
    - [23, 4857.53]
  - - [27648, 27648, 1, 384]
    - [20, 4947.16]
  - - [20992, 20992, 1, 256]
    - [21, 4850.93]
  - - [15104, 15104, 1, 256]
    - [20, 4844.65]
  - - [13056, 13056, 1, 384]
    - [29, 4954.69]
  - - [19968, 19968, 1, 384]
    - [20, 4930.84]
  - - [25728, 25728, 1, 384]
    - [6, 5015.82]
  - - [44160, 44160, 1, 384]
    - [6, 5019.35]
  - - [27136, 27136, 1, 256]
    - [20, 4858.18]
  - - [6912, 6912, 1, 384]
    - [25, 4928.57]
  - - [37632, 37632, 1, 256]
    - [10, 4872.16]
  - - [10752, 10752, 1, 256]
    - [21, 4817.75]
  - - [5376, 5376, 1, 384]
    - [26, 4803.4]
  - - [35584, 35584, 1, 256]
    - [10, 4870.72]
  - - [28800, 28800, 1, 384]
    - [6, 5020.31]
  - - [24320, 24320, 1, 256]
    - [22, 4856.02]
  - - [38400, 38400, 1, 384]
    - [10, 4948.86]
  - - [13440, 13440, 1, 384]
    - [6, 4988.1]
  - - [32640, 32640, 1, 384]
    - [6, 5016.47]
  - - [11904, 11904, 1, 384]
    - [11, 4987.01]
  - - [256, 256, 1, 256]
    - [8, 683.111]
  - - [36096, 36096, 1, 256]
    - [10, 4868.08]
  - - [31488, 31488, 1, 384]
    - [10, 4974.98]
  - - [32512, 32512, 1, 256]
    - [10, 4861.63]
  - - [34560, 34560, 1, 384]
    - [10, 4976.96]
  - - [18944, 18944, 1, 256]
    - [23, 4853.4]
  - - [35840, 35840, 1, 256]
    - [22, 4855.84]
  - - [35328, 35328, 1, 256]
    - [20, 4853.93]
  - - [21504, 21504, 1, 256]
    - [22, 4856.11]
  - - [21760, 21760, 1, 256]
    - [25, 4859.95]
  - - [7936, 7936, 1, 256]
    - [28, 4812.81]
  - - [30976, 30976, 1, 256]
    - [10, 4870.93]
  - - [13824, 13824, 1, 384]
    - [25, 4923.17]
  - - [43776, 43776, 1, 256]
    - [10, 4868.32]
  - - [42240, 42240, 1, 384]
    - [10, 4983.31]
  - - [24576, 24576, 1, 256]
    - [18, 4754.92]
  - - [15360, 15360, 1, 384]
    - [20, 4936.1]
  - - [22656, 22656, 1, 384]
    - [6, 5003.7]
  - - [20736, 20736, 1, 256]
    - [10, 4856.43]
  - - [17664, 17664, 1, 256]
    - [22, 4852.06]
  - - [5632, 5632, 1, 256]
    - [4, 4637.03]
  - - [26880, 26880, 1, 256]
    - [10, 4863.85]
  - - [27264, 27264, 1, 384]
    - [6, 5017.43]
  - - [41216, 41216, 1, 256]
    - [10, 4861.92]
  - - [22528, 22528, 1, 256]
    - [20, 4857.97]
  - - [7424, 7424, 1, 256]
    - [14, 4773.87]
  - - [15872, 15872, 1, 256]
    - [21, 4833.79]
  - - [37248, 37248, 1, 384]
    - [6, 5021.41]
  - - [28672, 28672, 1, 256]
    - [22, 4858.35]
  - - [42240, 42240, 1, 256]
    - [10, 4870.79]
  - - [37888, 37888, 1, 256]
    - [20, 4855.48]
  - - [31104, 31104, 1, 384]
    - [6, 5014.67]
  - - [1024, 1024, 1, 256]
    - [3, 4369.08]
  - - [36480, 36480, 1, 384]
    - [6, 5020.84]
  - - [14976, 14976, 1, 384]
    - [10, 4985.92]
  - - [2304, 2304, 1, 384]
    - [25, 4575.41]
  - - [2048, 2048, 1, 256]
    - [3, 4535.93]
  - - [11520, 11520, 1, 256]
    - [29, 4844.97]
  - - [22272, 22272, 1, 256]
    - [23, 4857.01]
  - - [11264, 11264, 1, 256]
    - [22, 4831.11]
  - - [2688, 2688, 1, 384]
    - [4, 4718.92]
  - - [12544, 12544, 1, 256]
    - [28, 4841.35]
  - - [33024, 33024, 1, 384]
    - [10, 4974.18]
  - - [29440, 29440, 1, 256]
    - [21, 4860.35]
  - - [18816, 18816, 1, 384]
    - [6, 5001.37]
  - - [25088, 25088, 1, 256]
    - [20, 4857.75]
  - - [23040, 23040, 1, 384]
    - [21, 4945.28]
  - - [38912, 38912, 1, 256]
    - [22, 4851.58]
  - - [1536, 1536, 1, 256]
    - [27, 4319.09]
  - - [18176, 18176, 1, 256]
    - [22, 4853.31]
  - - [384, 384, 1, 384]
    - [8, 1642.2]
  - - [17280, 17280, 1, 384]
    - [6, 4999.5]
  - - [38144, 38144, 1, 256]
    - [10, 4867.78]
  - - [8960, 8960, 1, 256]
    - [14, 4804.36]
  - - [12288, 12288, 1, 256]
    - [21, 4835.13]
  - - [12288, 12288, 1, 384]
    - [20, 4927.03]
  - - [16640, 16640, 1, 256]
    - [12, 4848.56]
  - - [43008, 43008, 1, 256]
    - [20, 4836.65]
  - - [28160, 28160, 1, 256]
    - [20, 4858.47]
  - - [14208, 14208, 1, 384]
    - [10, 4992.5]
  - - [29952, 29952, 1, 384]
    - [10, 4982.95]
  - - [37120, 37120, 1, 256]
    - [10, 4865.84]
  - - [29696, 29696, 1, 256]
    - [22, 4863.22]
  - - [43392, 43392, 1, 384]
    - [6, 5024.08]
  - - [23808, 23808, 1, 256]
    - [13, 4858.15]
  - - [64, 1, 1, 64]
    - [1, 0.445217]
  - - [41472, 41472, 1, 256]
    - [22, 4844.67]
  - - [42496, 42496, 1, 256]
    - [30, 4839.66]
  - - [34560, 34560, 1, 256]
    - [10, 4866.12]
  - - [2560, 2560, 1, 256]
    - [14, 4400.71]
  - - [8448, 8448, 1, 384]
    - [26, 4944.11]
  - - [21248, 21248, 1, 256]
    - [21, 4854.26]
  - - [3584, 3584, 1, 256]
    - [4, 4495.22]
  - - [39936, 39936, 1, 256]
    - [20, 4846.22]
  - - [36864, 36864, 1, 256]
    - [20, 4852.78]
  - - [5760, 5760, 1, 384]
    - [11, 4850.09]
  - - [6144, 6144, 1, 384]
    - [25, 4786.41]
  - - [13568, 13568, 1, 256]
    - [15, 4836.82]
  - - [20352, 20352, 1, 384]
    - [10, 5004.09]
  - - [23808, 23808, 1, 384]
    - [10, 4969.93]
  - - [35712, 35712, 1, 384]
    - [6, 5019.66]
  - - [6912, 6912, 1, 256]
    - [29, 4792.41]
  - - [30336, 30336, 1, 384]
    - [6, 5013.72]
  - - [3072, 3072, 1, 256]
    - [5, 4577.7]
  - - [11136, 11136, 1, 384]
    - [14, 4978.3]
  - - [41856, 41856, 1, 384]
    - [6, 5017.61]
  - - [27392, 27392, 1, 256]
    - [22, 4861.54]
  - - [2304, 2304, 1, 256]
    - [28, 4405.9]
  - - [28032, 28032, 1, 384]
    - [6, 5021.9]
  - - [4608, 4608, 1, 384]
    - [28, 4774.41]
  - - [25600, 25600, 1, 256]
    - [20, 4860.47]
  - - [26368, 26368, 1, 256]
    - [10, 4864.24]
  - - [28928, 28928, 1, 256]
    - [10, 4860.92]
  - - [33408, 33408, 1, 384]
    - [6, 5013.08]
  - - [6656, 6656, 1, 256]
    - [21, 4733.4]
  - - [16128, 16128, 1, 256]
    - [25, 4857.93]
  - - [33536, 33536, 1, 256]
    - [10, 4859.43]
  - - [3840, 3840, 1, 256]
    - [28, 4610.71]
  - - [3456, 3456, 1, 384]
    - [12, 4727.36]
  - - [38784, 38784, 1, 384]
    - [6, 5016.05]
  - - [33792, 33792, 1, 384]
    - [22, 4940.17]
  - - [14080, 14080, 1, 256]
    - [25, 4844.09]
  - - [7168, 7168, 1, 256]
    - [22, 4775.88]
  - - [22784, 22784, 1, 256]
    - [23, 4857.55]
  - - [3840, 3840, 1, 384]
    - [26, 4746.45]
  - - [20224, 20224, 1, 256]
    - [25, 4856.91]
  - - [27904, 27904, 1, 256]
    - [10, 4865.43]
  - - [31232, 31232, 1, 256]
    - [21, 4861.3]
  - - [36864, 36864, 1, 384]
    - [10, 4934.34]
  - - [18688, 18688, 1, 256]
    - [22, 4853.79]
  - - [44928, 44928, 1, 384]
    - [6, 5010.63]
  - - [37376, 37376, 1, 256]
    - [20, 4851.1]
  - - [32000, 32000, 1, 256]
    - [10, 4858.95]
  - - [32256, 32256, 1, 256]
    - [20, 4859.67]
  - - [43264, 43264, 1, 256]
    - [10, 4862.8]
  - - [38400, 38400, 1, 256]
    - [20, 4848.8]
  - - [1920, 1920, 1, 384]
    - [11, 4467.81]
  - - [28416, 28416, 1, 256]
    - [14, 4861.19]
  - - [16512, 16512, 1, 384]
    - [10, 4998.69]
  - - [5376, 5376, 1, 256]
    - [29, 4675.78]
  - - [14592, 14592, 1, 256]
    - [28, 4846.97]
  - - [18432, 18432, 1, 384]
    - [20, 4938.63]
  - - [36608, 36608, 1, 256]
    - [10, 4867.16]
  - - [26624, 26624, 1, 256]
    - [20, 4860.0]
  - - [3328, 3328, 1, 256]
    - [14, 4523.54]
  - - [30208, 30208, 1, 256]
    - [23, 4856.93]
  - - [42752, 42752, 1, 256]
    - [10, 4863.05]
  - - [27648, 27648, 1, 256]
    - [20, 4863.69]
  - - [39168, 39168, 1, 256]
    - [10, 4870.21]
  - - [4352, 4352, 1, 256]
    - [14, 4636.28]
  - - [7296, 7296, 1, 384]
    - [12, 4955.96]
  - - [13056, 13056, 1, 256]
    - [25, 4847.22]
  - - [19200, 19200, 1, 384]
    - [13, 4965.33]
  - - [34944, 34944, 1, 384]
    - [6, 5017.12]
  - - [512, 512, 1, 256]
    - [24, 2557.5]
  - - [18048, 18048, 1, 384]
    - [13, 4993.58]
  - - [14336, 14336, 1, 256]
    - [20, 4843.18]
  - - [768, 768, 1, 384]
    - [13, 3461.07]
  - - [11776, 11776, 1, 256]
    - [21, 4804.65]
  - - [4608, 4608, 1, 256]
    - [28, 4600.86]
  - - [28416, 28416, 1, 384]
    - [13, 4973.24]
  - - [4096, 4096, 1, 256]
    - [3, 4591.59]
  - - [11520, 11520, 1, 384]
    - [25, 4954.95]
  - - [23424, 23424, 1, 384]
    - [6, 5016.01]
  - - [19584, 19584, 1, 384]
    - [6, 5003.04]
  - - [44288, 44288, 1, 256]
    - [10, 4862.62]
  - - [37632, 37632, 1, 384]
    - [6, 4975.4]
  - - [5888, 5888, 1, 256]
    - [4, 4671.14]
  - - [40960, 40960, 1, 256]
    - [18, 4754.82]
  - - [24192, 24192, 1, 384]
    - [6, 5012.99]
  - - [4992, 4992, 1, 384]
    - [15, 4819.75]
  - - [34048, 34048, 1, 256]
    - [10, 4865.84]
  - - [39168, 39168, 1, 384]
    - [10, 4981.96]
  - - [22016, 22016, 1, 256]
    - [21, 4858.07]
  - - [40704, 40704, 1, 384]
    - [10, 4980.77]
  - - [40704, 40704, 1, 256]
    - [10, 4870.61]
  - - [16384, 16384, 1, 256]
    - [18, 4739.15]
  - - [8064, 8064, 1, 384]
    - [11, 4955.24]
  - - [16896, 16896, 1, 256]
    - [22, 4839.43]
  - - [128, 35968, 1, 256]
    - [35, 3780.48]
  - - [128, 20608, 1, 384]
    - [35, 3900.67]
  - - [128, 2688, 1, 128]
    - [32, 2383.13]
  - - [128, 11648, 1, 384]
    - [34, 3819.88]
  - - [128, 38528, 1, 256]
    - [35, 3862.71]
  - - [128, 3968, 1, 128]
    - [35, 3049.33]
  - - [128, 14208, 1, 384]
    - [35, 4067.76]
  - - [128, 30848, 1, 256]
    - [35, 3724.5]
  - - [128, 37248, 1, 128]
    - [35, 3959.71]
  - - [128, 6528, 1, 384]
    - [31, 3618.24]
  - - [128, 33408, 1, 256]
    - [35, 3746.97]
  - - [128, 24448, 1, 256]
    - [35, 3602.13]
  - - [128, 28288, 1, 128]
    - [35, 3938.41]
  - - [128, 25728, 1, 256]
    - [35, 3643.92]
  - - [128, 1408, 1, 384]
    - [35, 1990.97]
  - - [128, 19328, 1, 256]
    - [35, 3534.27]
  - - [128, 44928, 1, 384]
    - [35, 4276.02]
  - - [128, 20608, 1, 256]
    - [35, 3412.6]
  - - [128, 11648, 1, 128]
    - [35, 3444.78]
  - - [128, 11648, 1, 256]
    - [35, 2931.51]
  - - [128, 9088, 1, 128]
    - [35, 3189.76]
  - - [128, 15488, 1, 128]
    - [35, 3554.0]
  - - [128, 7808, 1, 384]
    - [36, 4158.85]
  - - [128, 14208, 1, 256]
    - [35, 3111.25]
  - - [128, 9088, 1, 384]
    - [35, 3665.03]
  - - [128, 18048, 1, 128]
    - [35, 3699.93]
  - - [128, 41088, 1, 384]
    - [35, 4145.24]
  - - [128, 19328, 1, 384]
    - [35, 3975.61]
  - - [128, 24448, 1, 128]
    - [35, 3884.38]
  - - [128, 9088, 1, 256]
    - [32, 2715.13]
  - - [128, 12928, 1, 128]
    - [35, 3431.84]
  - - [128, 1408, 1, 256]
    - [35, 1760.97]
  - - [128, 27008, 1, 384]
    - [35, 4040.36]
  - - [128, 35968, 1, 384]
    - [35, 4184.19]
  - - [128, 19328, 1, 128]
    - [35, 3723.78]
  - - [128, 44928, 1, 256]
    - [35, 3935.95]
  - - [128, 29568, 1, 384]
    - [35, 4112.42]
  - - [128, 21888, 1, 384]
    - [35, 4095.63]
  - - [128, 32128, 1, 384]
    - [31, 4297.73]
  - - [128, 7808, 1, 256]
    - [32, 2645.3]
  - - [128, 14208, 1, 128]
    - [35, 3544.21]
  - - [128, 39808, 1, 256]
    - [35, 3909.69]
  - - [128, 43648, 1, 128]
    - [35, 4020.29]
  - - [128, 41088, 1, 256]
    - [35, 3927.12]
  - - [128, 6528, 1, 128]
    - [31, 2938.32]
  - - [128, 6528, 1, 256]
    - [35, 2344.48]
  - - [128, 32128, 1, 256]
    - [35, 3769.05]
  - - [128, 35968, 1, 128]
    - [35, 3976.39]
  - - [128, 27008, 1, 128]
    - [35, 3822.56]
  - - [128, 2688, 1, 256]
    - [33, 2240.09]
  - - [128, 32128, 1, 128]
    - [35, 3949.48]
  - - [128, 28288, 1, 384]
    - [35, 4185.98]
  - - [128, 34688, 1, 256]
    - [35, 3767.76]
  - - [128, 38528, 1, 128]
    - [35, 4015.55]
  - - [128, 1408, 1, 128]
    - [35, 1571.44]
  - - [128, 27008, 1, 256]
    - [35, 3670.98]
  - - [128, 30848, 1, 128]
    - [35, 3867.57]
  - - [128, 23168, 1, 384]
    - [31, 4109.85]
  - - [128, 29568, 1, 256]
    - [35, 3695.22]
  - - [128, 33408, 1, 128]
    - [35, 3926.52]
  - - [128, 21888, 1, 128]
    - [35, 3802.09]
  - - [128, 42368, 1, 128]
    - [35, 4027.38]
  - - [128, 15488, 1, 384]
    - [36, 4117.63]
  - - [128, 21888, 1, 256]
    - [35, 3575.41]
  - - [128, 25728, 1, 128]
    - [35, 3848.86]
  - - [128, 18048, 1, 384]
    - [35, 4031.53]
  - - [128, 44928, 1, 128]
    - [35, 4038.29]
  - - [128, 10368, 1, 384]
    - [35, 3522.31]
  - - [128, 16768, 1, 256]
    - [35, 3313.96]
  - - [128, 20608, 1, 128]
    - [35, 3695.73]
  - - [128, 42368, 1, 384]
    - [35, 4227.86]
  - - [128, 28288, 1, 256]
    - [35, 3714.31]
  - - [128, 34688, 1, 128]
    - [35, 3962.14]
  - - [128, 3968, 1, 384]
    - [35, 3739.17]
  - - [128, 16768, 1, 384]
    - [35, 3846.28]
  - - [128, 5248, 1, 384]
    - [34, 3470.81]
  - - [128, 23168, 1, 128]
    - [35, 3774.72]
  - - [128, 39808, 1, 128]
    - [35, 3997.4]
  - - [128, 37248, 1, 384]
    - [35, 4133.89]
  - - [128, 23168, 1, 256]
    - [35, 3619.24]
  - - [128, 29568, 1, 128]
    - [35, 3889.23]
  - - [128, 39808, 1, 384]
    - [31, 4252.47]
  - - [128, 128, 1, 384]
    - [33, 199.097]
  - - [128, 3968, 1, 256]
    - [35, 2563.55]
  - - [128, 10368, 1, 128]
    - [35, 3097.56]
  - - [128, 18048, 1, 256]
    - [35, 3246.59]
  - - [128, 43648, 1, 384]
    - [35, 4189.24]
  - - [128, 10368, 1, 256]
    - [35, 2765.71]
  - - [128, 16768, 1, 128]
    - [35, 3599.67]
  - - [128, 42368, 1, 256]
    - [35, 3918.7]
  - - [128, 34688, 1, 384]
    - [35, 4241.69]
  - - [128, 12928, 1, 256]
    - [35, 3020.72]
  - - [128, 38528, 1, 384]
    - [35, 4238.06]
  - - [128, 43648, 1, 256]
    - [35, 3874.36]
  - - [128, 12928, 1, 384]
    - [35, 3761.77]
  - - [128, 5248, 1, 128]
    - [34, 2989.71]
  - - [128, 5248, 1, 256]
    - [35, 2868.02]
  - - [128, 30848, 1, 384]
    - [36, 4128.31]
  - - [128, 37248, 1, 256]
    - [35, 3764.79]
  - - [128, 41088, 1, 128]
    - [35, 3993.75]
  - - [128, 33408, 1, 384]
    - [35, 4121.25]
  - - [128, 7808, 1, 128]
    - [31, 3297.09]
  - - [128, 24448, 1, 384]
    - [36, 4295.37]
  - - [128, 128, 1, 256]
    - [33, 187.246]
  - - [128, 25728, 1, 384]
    - [35, 4096.22]
  - - [128, 15488, 1, 256]
    - [35, 3216.99]
  - - [128, 128, 1, 128]
    - [33, 158.875]
  - - [128, 2688, 1, 384]
    - [33, 2962.34]
  - - [256, 66, 1, 66]
    - [67, 114.726]
  - - [12544, 66, 1, 66]
    - [59, 1557.63]
  - - [3872, 32, 1, 32]
    - [76, 532.92]
  - - [24832, 66, 1, 66]
    - [178, 1755.98]
  - - [37200, 48, 1, 48]
    - [92, 2084.36]
  - - [21472, 32, 1, 32]
    - [40, 1347.26]
  - - [15068, 30, 1, 36]
    - [74, 1007.02]
  - - [19200, 30, 1, 36]
    - [37, 1167.57]
  - - [23040, 58, 1, 66]
    - [168, 1932.45]
  - - [38784, 96, 1, 96]
    - [187, 3215.49]
  - - [2160, 48, 1, 48]
    - [37, 555.429]
  - - [24064, 58, 1, 66]
    - [86, 1995.6]
  - - [13824, 58, 1, 66]
    - [62, 1868.58]
  - - [10656, 96, 1, 96]
    - [96, 2844.89]
  - - [26522, 30, 1, 36]
    - [44, 1217.85]
  - - [37120, 58, 1, 66]
    - [171, 2113.26]
  - - [23998, 66, 1, 66]
    - [57, 1943.04]
  - - [3672, 30, 1, 36]
    - [74, 454.789]
  - - [20448, 32, 1, 32]
    - [37, 1349.15]
  - - [15520, 32, 1, 32]
    - [80, 1172.01]
  - - [28768, 32, 1, 32]
    - [44, 1405.46]
  - - [9664, 64, 1, 64]
    - [146, 1999.18]
  - - [40672, 32, 1, 32]
    - [80, 1438.13]
  - - [18000, 48, 1, 48]
    - [52, 1891.97]
  - - [31232, 58, 1, 66]
    - [98, 2090.14]
  - - [2528, 32, 1, 32]
    - [37, 361.546]
  - - [18240, 64, 1, 64]
    - [145, 2192.23]
  - - [29184, 66, 1, 66]
    - [98, 1927.31]
  - - [31104, 96, 1, 96]
    - [96, 3163.96]
  - - [1248, 32, 1, 32]
    - [76, 178.485]
  - - [28416, 128, 1, 128]
    - [194, 3584.6]
  - - [5340, 30, 1, 36]
    - [37, 598.257]
  - - [43264, 66, 1, 66]
    - [100, 2000.62]
  - - [43008, 66, 1, 66]
    - [98, 2004.1]
  - - [32768, 66, 1, 66]
    - [101, 1945.71]
  - - [20544, 64, 1, 64]
    - [171, 2205.14]
  - - [9264, 48, 1, 48]
    - [76, 1396.88]
  - - [34944, 48, 1, 48]
    - [52, 2060.16]
  - - [16800, 96, 1, 96]
    - [96, 2784.69]
  - - [22880, 32, 1, 32]
    - [76, 1368.52]
  - - [25088, 124, 1, 132]
    - [146, 3207.13]
  - - [39168, 58, 1, 66]
    - [171, 2143.15]
  - - [22752, 32, 1, 32]
    - [43, 1383.49]
  - - [43488, 32, 1, 32]
    - [40, 1461.01]
  - - [17664, 192, 1, 192]
    - [194, 4039.5]
  - - [25600, 58, 1, 66]
    - [46, 1927.55]
  - - [39936, 192, 1, 192]
    - [203, 4210.62]
  - - [7680, 30, 1, 36]
    - [45, 715.034]
  - - [39008, 32, 1, 32]
    - [40, 1449.35]
  - - [42752, 58, 1, 66]
    - [98, 2081.06]
  - - [8208, 48, 1, 48]
    - [40, 1309.64]
  - - [40448, 30, 1, 36]
    - [40, 1272.84]
  - - [28320, 96, 1, 96]
    - [160, 3141.52]
  - - [19648, 64, 1, 64]
    - [141, 2228.08]
  - - [33470, 66, 1, 66]
    - [60, 1911.32]
  - - [26736, 48, 1, 48]
    - [51, 1871.2]
  - - [30464, 30, 1, 36]
    - [38, 1238.75]
  - - [256, 30, 1, 36]
    - [67, 36.9626]
  - - [14304, 96, 1, 96]
    - [58, 2753.25]
  - - [2106, 58, 1, 66]
    - [45, 697.385]
  - - [416, 32, 1, 32]
    - [40, 61.5584]
  - - [20956, 30, 1, 36]
    - [37, 1157.08]
  - - [39936, 48, 1, 48]
    - [52, 2137.84]
  - - [38656, 30, 1, 36]
    - [45, 1259.0]
  - - [36864, 66, 1, 66]
    - [181, 1918.97]
  - - [38202, 58, 1, 66]
    - [111, 2124.31]
  - - [5632, 58, 1, 66]
    - [124, 1399.95]
  - - [29696, 124, 1, 132]
    - [142, 3293.12]
  - - [13296, 48, 1, 48]
    - [56, 1661.28]
  - - [30464, 66, 1, 66]
    - [98, 1945.77]
  - - [28032, 48, 1, 48]
    - [51, 1952.41]
  - - [9056, 32, 1, 32]
    - [37, 916.338]
  - - [23360, 64, 1, 64]
    - [114, 2406.5]
  - - [41560, 30, 1, 36]
    - [80, 1263.65]
  - - [28928, 30, 1, 36]
    - [79, 1218.5]
  - - [43008, 96, 1, 96]
    - [207, 3293.14]
  - - [27224, 30, 1, 36]
    - [38, 1227.13]
  - - [6720, 64, 1, 64]
    - [194, 1792.0]
  - - [44288, 66, 1, 66]
    - [182, 1989.67]
  - - [40272, 48, 1, 48]
    - [52, 2149.83]
  - - [43840, 64, 1, 64]
    - [172, 2527.71]
  - - [43872, 32, 1, 32]
    - [40, 1458.6]
  - - [35840, 66, 1, 66]
    - [57, 1941.78]
  - - [38336, 64, 1, 64]
    - [118, 2552.41]
  - - [27600, 48, 1, 48]
    - [136, 1899.35]
  - - [1488, 48, 1, 48]
    - [37, 412.062]
  - - [27326, 66, 1, 66]
    - [184, 1820.06]
  - - [30480, 48, 1, 48]
    - [51, 2011.05]
  - - [1632, 32, 1, 32]
    - [40, 229.556]
  - - [14112, 32, 1, 32]
    - [74, 1121.95]
  - - [27200, 64, 1, 64]
    - [117, 2251.64]
  - - [8832, 48, 1, 48]
    - [76, 1378.65]
  - - [24320, 128, 1, 128]
    - [146, 3480.6]
  - - [14746, 30, 1, 36]
    - [37, 1000.36]
  - - [11864, 30, 1, 36]
    - [74, 920.483]
  - - [3006, 66, 1, 66]
    - [78, 1013.48]
  - - [11184, 48, 1, 48]
    - [51, 1552.29]
  - - [8638, 66, 1, 66]
    - [62, 1544.63]
  - - [12186, 30, 1, 36]
    - [74, 919.056]
  - - [22784, 30, 1, 36]
    - [74, 1215.75]
  - - [26784, 96, 1, 96]
    - [179, 3014.67]
  - - [42400, 32, 1, 32]
    - [40, 1455.01]
  - - [36384, 32, 1, 32]
    - [76, 1398.54]
  - - [40960, 30, 1, 36]
    - [40, 1278.52]
  - - [21504, 58, 1, 66]
    - [45, 1891.48]
  - - [38640, 48, 1, 48]
    - [52, 2109.63]
  - - [40560, 48, 1, 48]
    - [90, 2141.39]
  - - [18520, 30, 1, 36]
    - [74, 1131.31]
  - - [22416, 48, 1, 48]
    - [54, 2052.72]
  - - [29696, 58, 1, 66]
    - [99, 2040.13]
  - - [25008, 48, 1, 48]
    - [133, 1818.76]
  - - [34048, 58, 1, 66]
    - [117, 2006.4]
  - - [8192, 66, 1, 66]
    - [136, 1636.9]
  - - [29248, 64, 1, 64]
    - [117, 2394.08]
  - - [7712, 32, 1, 32]
    - [40, 843.706]
  - - [20000, 32, 1, 32]
    - [45, 1343.83]
  - - [17664, 58, 1, 66]
    - [45, 1837.44]
  - - [41712, 48, 1, 48]
    - [90, 2092.87]
  - - [15072, 96, 1, 96]
    - [187, 2851.06]
  - - [10042, 58, 1, 66]
    - [77, 1737.83]
  - - [11674, 30, 1, 36]
    - [37, 916.273]
  - - [15002, 30, 1, 36]
    - [74, 997.67]
  - - [34874, 58, 1, 66]
    - [117, 2048.77]
  - - [2304, 58, 1, 66]
    - [40, 752.535]
  - - [3232, 32, 1, 32]
    - [37, 449.67]
  - - [24960, 96, 1, 96]
    - [176, 2901.51]
  - - [14848, 124, 1, 132]
    - [62, 3016.78]
  - - [35712, 192, 1, 192]
    - [194, 4161.36]
  - - [40704, 58, 1, 66]
    - [170, 2084.2]
  - - [33850, 58, 1, 66]
    - [85, 2003.37]
  - - [5464, 30, 1, 36]
    - [74, 597.279]
  - - [20032, 64, 1, 64]
    - [191, 2220.0]
  - - [6848, 64, 1, 64]
    - [145, 1840.51]
  - - [18432, 30, 1, 36]
    - [37, 1123.4]
  - - [23808, 66, 1, 66]
    - [60, 1934.84]
  - - [25856, 58, 1, 66]
    - [64, 1927.12]
  - - [42048, 64, 1, 64]
    - [112, 2515.02]
  - - [3408, 48, 1, 48]
    - [37, 824.793]
  - - [16640, 128, 1, 128]
    - [142, 3152.52]
  - - [33024, 96, 1, 96]
    - [94, 3132.45]
  - - [23230, 66, 1, 66]
    - [60, 1925.23]
  - - [30288, 48, 1, 48]
    - [56, 1998.38]
  - - [41440, 32, 1, 32]
    - [40, 1473.42]
  - - [30304, 32, 1, 32]
    - [44, 1428.7]
  - - [36064, 32, 1, 32]
    - [40, 1400.97]
  - - [2400, 96, 1, 96]
    - [127, 1486.45]
  - - [33792, 30, 1, 36]
    - [45, 1202.09]
  - - [6108, 30, 1, 36]
    - [37, 641.696]
  - - [27744, 32, 1, 32]
    - [38, 1423.34]
  - - [27232, 32, 1, 32]
    - [77, 1419.84]
  - - [42304, 64, 1, 64]
    - [118, 2509.82]
  - - [31008, 96, 1, 96]
    - [96, 3155.58]
  - - [16176, 48, 1, 48]
    - [51, 1874.72]
  - - [20832, 32, 1, 32]
    - [74, 1336.59]
  - - [34362, 58, 1, 66]
    - [184, 2042.51]
  - - [9472, 128, 1, 128]
    - [145, 3057.31]
  - - [41180, 30, 1, 36]
    - [74, 1263.48]
  - - [29568, 192, 1, 192]
    - [200, 4126.27]
  - - [31034, 58, 1, 66]
    - [98, 2094.47]
  - - [38848, 64, 1, 64]
    - [118, 2569.79]
  - - [22080, 64, 1, 64]
    - [171, 2335.74]
  - - [12288, 192, 1, 192]
    - [199, 3958.27]
  - - [36030, 66, 1, 66]
    - [60, 1950.13]
  - - [1280, 30, 1, 36]
    - [37, 174.545]
  - - [38400, 128, 1, 128]
    - [146, 3651.04]
  - - [17760, 32, 1, 32]
    - [40, 1238.84]
  - - [31488, 124, 1, 132]
    - [142, 3300.44]
  - - [2832, 48, 1, 48]
    - [37, 712.328]
  - - [15872, 30, 1, 36]
    - [74, 1022.78]
  - - [29040, 48, 1, 48]
    - [51, 1958.67]
  - - [33338, 58, 1, 66]
    - [184, 1994.03]
  - - [41662, 66, 1, 66]
    - [100, 2006.63]
  - - [29424, 48, 1, 48]
    - [51, 1984.57]
  - - [24160, 32, 1, 32]
    - [40, 1386.76]
  - - [29696, 128, 1, 128]
    - [194, 3567.0]
  - - [2874, 58, 1, 66]
    - [128, 835.993]
  - - [19104, 96, 1, 96]
    - [94, 3008.59]
  - - [12448, 32, 1, 32]
    - [37, 1062.23]
  - - [33888, 96, 1, 96]
    - [94, 3163.61]
  - - [20538, 58, 1, 66]
    - [43, 1906.39]
  - - [17728, 64, 1, 64]
    - [141, 2148.34]
  - - [25056, 96, 1, 96]
    - [208, 2852.22]
  - - [26528, 32, 1, 32]
    - [44, 1391.63]
  - - [14080, 124, 1, 132]
    - [144, 3087.64]
  - - [1776, 48, 1, 48]
    - [37, 482.536]
  - - [16224, 96, 1, 96]
    - [49, 2947.96]
  - - [9440, 32, 1, 32]
    - [119, 933.066]
  - - [27904, 128, 1, 128]
    - [146, 3524.35]
  - - [17240, 30, 1, 36]
    - [37, 1097.83]
  - - [18652, 30, 1, 36]
    - [37, 1129.16]
  - - [22016, 66, 1, 66]
    - [57, 1881.9]
  - - [24512, 64, 1, 64]
    - [117, 2470.5]
  - - [10368, 96, 1, 96]
    - [94, 2826.97]
  - - [13532, 30, 1, 36]
    - [74, 966.571]
  - - [40640, 64, 1, 64]
    - [113, 2565.68]
  - - [39680, 30, 1, 36]
    - [76, 1269.38]
  - - [37208, 30, 1, 36]
    - [40, 1219.19]
  - - [33696, 96, 1, 96]
    - [96, 3150.79]
  - - [36608, 124, 1, 132]
    - [142, 3373.12]
  - - [40602, 30, 1, 36]
    - [37, 1265.88]
  - - [2256, 48, 1, 48]
    - [37, 577.536]
  - - [28928, 128, 1, 128]
    - [195, 3625.74]
  - - [36240, 48, 1, 48]
    - [52, 2087.42]
  - - [28736, 64, 1, 64]
    - [117, 2359.72]
  - - [34012, 30, 1, 36]
    - [80, 1180.37]
  - - [26200, 30, 1, 36]
    - [38, 1196.95]
  - - [12672, 48, 1, 48]
    - [52, 1647.65]
  - - [32512, 128, 1, 128]
    - [142, 3589.47]
  - - [22938, 30, 1, 36]
    - [74, 1197.92]
  - - [33536, 30, 1, 36]
    - [40, 1191.41]
  - - [6846, 66, 1, 66]
    - [59, 1450.45]
  - - [23008, 32, 1, 32]
    - [74, 1385.89]
  - - [41024, 64, 1, 64]
    - [112, 2541.35]
  - - [15024, 48, 1, 48]
    - [51, 1818.03]
  - - [24768, 64, 1, 64]
    - [146, 2171.44]
  - - [5786, 30, 1, 36]
    - [74, 617.478]
  - - [10560, 64, 1, 64]
    - [195, 2063.63]
  - - [29280, 32, 1, 32]
    - [46, 1406.32]
  - - [38042, 30, 1, 36]
    - [40, 1228.63]
  - - [40448, 128, 1, 128]
    - [146, 3662.95]
  - - [14976, 192, 1, 192]
    - [190, 3976.35]
  - - [43008, 58, 1, 66]
    - [98, 2094.59]
  - - [10336, 32, 1, 32]
    - [119, 998.497]
  - - [38400, 96, 1, 96]
    - [162, 3177.93]
  - - [31648, 32, 1, 32]
    - [46, 1459.8]
  - - [33536, 124, 1, 132]
    - [146, 3320.34]
  - - [4752, 48, 1, 48]
    - [122, 977.554]
  - - [29850, 30, 1, 36]
    - [38, 1238.02]
  - - [16896, 58, 1, 66]
    - [43, 1774.91]
  - - [40896, 64, 1, 64]
    - [115, 2610.82]
  - - [26778, 30, 1, 36]
    - [38, 1221.29]
  - - [28944, 48, 1, 48]
    - [133, 1970.66]
  - - [3680, 32, 1, 32]
    - [37, 493.236]
  - - [9472, 58, 1, 66]
    - [80, 1571.01]
  - - [1792, 66, 1, 66]
    - [139, 725.46]
  - - [11776, 66, 1, 66]
    - [96, 1829.4]
  - - [26558, 66, 1, 66]
    - [179, 1811.0]
  - - [33024, 124, 1, 132]
    - [146, 3319.44]
  - - [1312, 32, 1, 32]
    - [40, 183.537]
  - - [17952, 96, 1, 96]
    - [94, 2912.78]
  - - [39552, 192, 1, 192]
    - [195, 4222.31]
  - - [43456, 64, 1, 64]
    - [118, 2502.75]
  - - [13056, 48, 1, 48]
    - [51, 1671.17]
  - - [3696, 48, 1, 48]
    - [37, 861.901]
  - - [18048, 48, 1, 48]
    - [52, 1932.28]
  - - [5376, 96, 1, 96]
    - [178, 2532.99]
  - - [13312, 58, 1, 66]
    - [62, 1819.94]
  - - [1056, 32, 1, 32]
    - [37, 151.874]
  - - [11136, 192, 1, 192]
    - [145, 3670.58]
  - - [1112, 30, 1, 36]
    - [40, 153.184]
  - - [31320, 30, 1, 36]
    - [38, 1260.27]
  - - [32000, 66, 1, 66]
    - [99, 1942.47]
  - - [23552, 66, 1, 66]
    - [57, 1941.57]
  - - [35760, 48, 1, 48]
    - [94, 2041.4]
  - - [13392, 48, 1, 48]
    - [51, 1699.07]
  - - [30096, 48, 1, 48]
    - [51, 2004.08]
  - - [27194, 58, 1, 66]
    - [63, 1977.56]
  - - [31422, 66, 1, 66]
    - [98, 1968.85]
  - - [11264, 124, 1, 132]
    - [88, 2962.23]
  - - [34528, 32, 1, 32]
    - [80, 1357.78]
  - - [12800, 66, 1, 66]
    - [59, 1567.96]
  - - [44256, 32, 1, 32]
    - [40, 1465.66]
  - - [38488, 30, 1, 36]
    - [76, 1247.51]
  - - [736, 32, 1, 32]
    - [37, 105.852]
  - - [732, 30, 1, 36]
    - [67, 102.938]
  - - [38400, 192, 1, 192]
    - [199, 4260.2]
  - - [31104, 48, 1, 48]
    - [51, 2040.54]
  - - [42480, 48, 1, 48]
    - [52, 2131.4]
  - - [28416, 124, 1, 132]
    - [172, 3314.67]
  - - [16944, 48, 1, 48]
    - [57, 1784.23]
  - - [35328, 96, 1, 96]
    - [94, 3232.55]
  - - [29952, 192, 1, 192]
    - [195, 4159.7]
  - - [43578, 58, 1, 66]
    - [118, 2096.74]
  - - [15192, 30, 1, 36]
    - [37, 1028.03]
  - - [38912, 66, 1, 66]
    - [182, 1983.86]
  - - [29472, 32, 1, 32]
    - [41, 1402.39]
  - - [14272, 64, 1, 64]
    - [142, 2194.37]
  - - [29280, 96, 1, 96]
    - [94, 3077.61]
  - - [768, 192, 1, 192]
    - [139, 1424.12]
  - - [27264, 192, 1, 192]
    - [194, 4123.84]
  - - [17664, 66, 1, 66]
    - [60, 1745.56]
  - - [42972, 30, 1, 36]
    - [37, 1248.92]
  - - [11264, 30, 1, 36]
    - [74, 918.816]
  - - [22624, 32, 1, 32]
    - [45, 1392.25]
  - - [25344, 30, 1, 36]
    - [75, 1163.76]
  - - [22272, 48, 1, 48]
    - [54, 2072.48]
  - - [37852, 30, 1, 36]
    - [76, 1249.39]
  - - [42328, 30, 1, 36]
    - [40, 1269.84]
  - - [15888, 48, 1, 48]
    - [51, 1890.8]
  - - [18688, 128, 1, 128]
    - [195, 3386.99]
  - - [32992, 32, 1, 32]
    - [37, 1349.19]
  - - [35184, 48, 1, 48]
    - [52, 2059.55]
  - - [40448, 124, 1, 132]
    - [142, 3411.24]
  - - [21760, 128, 1, 128]
    - [146, 3410.98]
  - - [11776, 30, 1, 36]
    - [37, 916.288]
  - - [9786, 58, 1, 66]
    - [76, 1770.36]
  - - [576, 64, 1, 64]
    - [37, 262.144]
  - - [1952, 32, 1, 32]
    - [37, 283.927]
  - - [40480, 32, 1, 32]
    - [76, 1447.33]
  - - [28350, 66, 1, 66]
    - [98, 1865.45]
  - - [20926, 66, 1, 66]
    - [98, 1886.46]
  - - [5216, 32, 1, 32]
    - [76, 657.781]
  - - [20480, 66, 1, 66]
    - [100, 1872.6]
  - - [39360, 64, 1, 64]
    - [112, 2585.29]
  - - [43996, 30, 1, 36]
    - [45, 1271.83]
  - - [12032, 58, 1, 66]
    - [131, 1819.06]
  - - [19932, 30, 1, 36]
    - [74, 1164.86]
  - - [35328, 30, 1, 36]
    - [40, 1201.33]
  - - [32976, 48, 1, 48]
    - [54, 1993.09]
  - - [22720, 64, 1, 64]
    - [117, 2374.01]
  - - [12384, 32, 1, 32]
    - [119, 1063.86]
  - - [35328, 124, 1, 132]
    - [142, 3352.56]
  - - [42298, 58, 1, 66]
    - [115, 2097.37]
  - - [23328, 32, 1, 32]
    - [37, 1382.4]
  - - [32704, 64, 1, 64]
    - [114, 2550.56]
  - - [8064, 96, 1, 96]
    - [209, 2773.05]
  - - [16352, 32, 1, 32]
    - [43, 1202.91]
  - - [34112, 64, 1, 64]
    - [168, 2412.34]
  - - [37946, 58, 1, 66]
    - [115, 2102.74]
  - - [20282, 58, 1, 66]
    - [45, 1904.8]
  - - [42144, 32, 1, 32]
    - [76, 1454.02]
  - - [4864, 124, 1, 132]
    - [56, 2545.2]
  - - [30752, 32, 1, 32]
    - [38, 1433.97]
  - - [20736, 96, 1, 96]
    - [94, 2985.98]
  - - [32784, 48, 1, 48]
    - [52, 2000.38]
  - - [30528, 64, 1, 64]
    - [117, 2438.43]
  - - [3552, 96, 1, 96]
    - [122, 1934.71]
  - - [7936, 128, 1, 128]
    - [72, 3113.59]
  - - [11232, 32, 1, 32]
    - [122, 994.945]
  - - [11096, 30, 1, 36]
    - [120, 848.718]
  - - [2494, 66, 1, 66]
    - [45, 896.358]
  - - [44160, 192, 1, 192]
    - [203, 4241.57]
  - - [20352, 96, 1, 96]
    - [94, 3027.18]
  - - [6576, 48, 1, 48]
    - [119, 1214.03]
  - - [1434, 30, 1, 36]
    - [74, 192.627]
  - - [37104, 48, 1, 48]
    - [90, 2076.96]
  - - [28892, 30, 1, 36]
    - [38, 1218.88]
  - - [36864, 96, 1, 96]
    - [157, 3292.04]
  - - [18656, 32, 1, 32]
    - [76, 1266.83]
  - - [18074, 30, 1, 36]
    - [37, 1111.61]
  - - [34176, 96, 1, 96]
    - [96, 3195.68]
  - - [21024, 32, 1, 32]
    - [37, 1345.54]
  - - [43360, 32, 1, 32]
    - [45, 1466.34]
  - - [18432, 124, 1, 132]
    - [148, 3183.78]
  - - [32832, 64, 1, 64]
    - [111, 2406.58]
  - - [38714, 58, 1, 66]
    - [118, 2136.64]
  - - [38624, 32, 1, 32]
    - [76, 1441.36]
  - - [8032, 32, 1, 32]
    - [37, 853.192]
  - - [40992, 96, 1, 96]
    - [161, 3245.55]
  - - [31936, 64, 1, 64]
    - [117, 2507.86]
  - - [36704, 32, 1, 32]
    - [76, 1404.52]
  - - [30384, 48, 1, 48]
    - [51, 1995.57]
  - - [32576, 64, 1, 64]
    - [117, 2560.08]
  - - [23424, 48, 1, 48]
    - [52, 2118.09]
  - - [9728, 66, 1, 66]
    - [62, 1684.23]
  - - [28248, 30, 1, 36]
    - [38, 1242.18]
  - - [3104, 32, 1, 32]
    - [76, 431.861]
  - - [5760, 192, 1, 192]
    - [96, 3748.88]
  - - [3616, 32, 1, 32]
    - [74, 487.208]
  - - [13280, 32, 1, 32]
    - [74, 1122.01]
  - - [41984, 124, 1, 132]
    - [146, 3405.33]
  - - [10298, 58, 1, 66]
    - [76, 1716.93]
  - - [42554, 58, 1, 66]
    - [100, 2063.03]
  - - [8858, 30, 1, 36]
    - [74, 789.327]
  - - [4464, 48, 1, 48]
    - [173, 945.318]
  - - [14080, 58, 1, 66]
    - [62, 1884.55]
  - - [12704, 32, 1, 32]
    - [37, 1087.7]
  - - [36912, 48, 1, 48]
    - [57, 2068.22]
  - - [37720, 30, 1, 36]
    - [80, 1235.97]
  - - [33280, 66, 1, 66]
    - [184, 1894.51]
  - - [28928, 58, 1, 66]
    - [101, 2000.3]
  - - [27696, 48, 1, 48]
    - [53, 1912.82]
  - - [13144, 30, 1, 36]
    - [37, 969.639]
  - - [8832, 192, 1, 192]
    - [194, 3604.77]
  - - [15418, 58, 1, 66]
    - [62, 1988.55]
  - - [31552, 64, 1, 64]
    - [117, 2494.92]
  - - [32256, 96, 1, 96]
    - [163, 3210.27]
  - - [41856, 96, 1, 96]
    - [155, 3266.81]
  - - [17232, 48, 1, 48]
    - [94, 1814.56]
  - - [18944, 58, 1, 66]
    - [45, 1880.64]
  - - [35664, 48, 1, 48]
    - [94, 2050.15]
  - - [40320, 48, 1, 48]
    - [54, 2128.72]
  - - [44032, 58, 1, 66]
    - [98, 2113.27]
  - - [20992, 66, 1, 66]
    - [98, 1889.28]
  - - [35072, 124, 1, 132]
    - [146, 3346.11]
  - - [3936, 96, 1, 96]
    - [124, 2084.72]
  - - [1500, 30, 1, 36]
    - [74, 204.545]
  - - [34976, 32, 1, 32]
    - [45, 1371.19]
  - - [41882, 30, 1, 36]
    - [40, 1263.48]
  - - [32672, 32, 1, 32]
    - [41, 1449.57]
  - - [11568, 48, 1, 48]
    - [56, 1556.81]
  - - [19584, 192, 1, 192]
    - [194, 3975.47]
  - - [17978, 58, 1, 66]
    - [45, 1859.99]
  - - [12672, 192, 1, 192]
    - [194, 3768.48]
  - - [26272, 32, 1, 32]
    - [38, 1392.47]
  - - [23384, 30, 1, 36]
    - [40, 1216.51]
  - - [36096, 66, 1, 66]
    - [182, 1943.08]
  - - [22464, 64, 1, 64]
    - [117, 2361.72]
  - - [14112, 96, 1, 96]
    - [58, 2748.44]
  - - [19968, 192, 1, 192]
    - [197, 4032.99]
  - - [17408, 58, 1, 66]
    - [45, 1808.84]
  - - [19646, 66, 1, 66]
    - [57, 1823.91]
  - - [42496, 58, 1, 66]
    - [98, 2083.44]
  - - [6912, 30, 1, 36]
    - [74, 683.604]
  - - [1792, 58, 1, 66]
    - [119, 644.716]
  - - [35744, 32, 1, 32]
    - [40, 1397.02]
  - - [36828, 30, 1, 36]
    - [76, 1212.63]
  - - [10512, 48, 1, 48]
    - [51, 1480.42]
  - - [25278, 66, 1, 66]
    - [178, 1755.6]
  - - [5376, 48, 1, 48]
    - [122, 1078.95]
  - - [17568, 32, 1, 32]
    - [78, 1235.55]
  - - [15872, 124, 1, 132]
    - [62, 3154.36]
  - - [30010, 58, 1, 66]
    - [99, 2026.79]
  - - [20064, 96, 1, 96]
    - [94, 3104.6]
  - - [41136, 48, 1, 48]
    - [54, 2085.77]
  - - [6458, 58, 1, 66]
    - [124, 1489.23]
  - - [11936, 32, 1, 32]
    - [37, 1103.11]
  - - [39834, 30, 1, 36]
    - [80, 1262.35]
  - - [37888, 124, 1, 132]
    - [146, 3374.06]
  - - [512, 128, 1, 128]
    - [119, 609.637]
  - - [23616, 64, 1, 64]
    - [117, 2406.25]
  - - [15600, 48, 1, 48]
    - [51, 1845.09]
  - - [17664, 128, 1, 128]
    - [148, 3337.26]
  - - [27680, 32, 1, 32]
    - [41, 1428.65]
  - - [30912, 64, 1, 64]
    - [117, 2465.26]
  - - [10080, 96, 1, 96]
    - [96, 2798.11]
  - - [36512, 32, 1, 32]
    - [37, 1407.69]
  - - [41312, 32, 1, 32]
    - [76, 1466.83]
  - - [28128, 96, 1, 96]
    - [154, 3126.24]
  - - [41184, 32, 1, 32]
    - [40, 1464.32]
  - - [13120, 64, 1, 64]
    - [192, 2060.56]
  - - [3548, 30, 1, 36]
    - [74, 437.425]
  - - [31072, 32, 1, 32]
    - [46, 1451.54]
  - - [11232, 96, 1, 96]
    - [92, 2770.72]
  - - [20824, 30, 1, 36]
    - [78, 1164.07]
  - - [26112, 192, 1, 192]
    - [202, 4108.73]
  - - [43264, 30, 1, 36]
    - [40, 1265.58]
  - - [768, 124, 1, 132]
    - [119, 827.015]
  - - [5632, 124, 1, 132]
    - [84, 2708.13]
  - - [12544, 128, 1, 128]
    - [145, 3100.8]
  - - [38944, 32, 1, 32]
    - [76, 1436.55]
  - - [32400, 48, 1, 48]
    - [51, 2055.33]
  - - [40192, 58, 1, 66]
    - [118, 2162.1]
  - - [19008, 64, 1, 64]
    - [147, 2204.33]
  - - [4320, 96, 1, 96]
    - [121, 2104.29]
  - - [27992, 30, 1, 36]
    - [38, 1243.07]
  - - [35328, 128, 1, 128]
    - [195, 3644.01]
  - - [4286, 66, 1, 66]
    - [125, 1199.86]
  - - [41408, 64, 1, 64]
    - [115, 2510.48]
  - - [38364, 30, 1, 36]
    - [80, 1244.99]
  - - [4272, 48, 1, 48]
    - [45, 911.36]
  - - [13466, 30, 1, 36]
    - [37, 954.283]
  - - [6528, 96, 1, 96]
    - [43, 2461.62]
  - - [38144, 58, 1, 66]
    - [117, 2127.26]
  - - [16992, 96, 1, 96]
    - [94, 2828.73]
  - - [21760, 124, 1, 132]
    - [146, 3184.62]
  - - [2048, 128, 1, 128]
    - [141, 2021.35]
  - - [42394, 30, 1, 36]
    - [40, 1257.84]
  - - [29754, 58, 1, 66]
    - [99, 2038.27]
  - - [18912, 32, 1, 32]
    - [40, 1297.98]
  - - [14048, 32, 1, 32]
    - [74, 1134.48]
  - - [18576, 48, 1, 48]
    - [90, 1966.87]
  - - [15840, 32, 1, 32]
    - [74, 1196.18]
  - - [30000, 48, 1, 48]
    - [56, 1990.78]
  - - [43930, 30, 1, 36]
    - [80, 1279.51]
  - - [29632, 64, 1, 64]
    - [117, 2392.99]
  - - [7424, 66, 1, 66]
    - [56, 1525.42]
  - - [768, 66, 1, 66]
    - [37, 338.604]
  - - [16640, 124, 1, 132]
    - [88, 3023.57]
  - - [6944, 32, 1, 32]
    - [74, 786.577]
  - - [34560, 128, 1, 128]
    - [146, 3619.48]
  - - [33880, 30, 1, 36]
    - [37, 1177.3]
  - - [28826, 30, 1, 36]
    - [75, 1208.54]
  - - [24510, 66, 1, 66]
    - [57, 1953.98]
  - - [25688, 30, 1, 36]
    - [38, 1197.89]
  - - [17520, 48, 1, 48]
    - [52, 1802.06]
  - - [1152, 192, 1, 192]
    - [139, 2026.11]
  - - [10080, 32, 1, 32]
    - [127, 931.581]
  - - [512, 58, 1, 66]
    - [37, 192.151]
  - - [4384, 32, 1, 32]
    - [37, 561.152]
  - - [39424, 124, 1, 132]
    - [142, 3394.85]
  - - [6752, 32, 1, 32]
    - [45, 775.117]
  - - [1536, 66, 1, 66]
    - [139, 617.234]
  - - [4032, 64, 1, 64]
    - [141, 1413.96]
  - - [6744, 30, 1, 36]
    - [37, 669.441]
  - - [7424, 124, 1, 132]
    - [64, 2912.66]
  - - [15616, 66, 1, 66]
    - [56, 1769.6]
  - - [40704, 124, 1, 132]
    - [142, 3397.12]
  - - [37274, 30, 1, 36]
    - [80, 1222.84]
  - - [27582, 66, 1, 66]
    - [100, 1780.49]
  - - [34080, 96, 1, 96]
    - [94, 3168.71]
  - - [21072, 48, 1, 48]
    - [54, 1983.25]
  - - [8448, 128, 1, 128]
    - [69, 3145.73]
  - - [3328, 124, 1, 132]
    - [127, 2308.17]
  - - [16960, 64, 1, 64]
    - [147, 2094.94]
  - - [24416, 32, 1, 32]
    - [40, 1410.95]
  - - [23808, 30, 1, 36]
    - [37, 1236.18]
  - - [26208, 96, 1, 96]
    - [154, 3005.64]
  - - [37340, 30, 1, 36]
    - [74, 1232.49]
  - - [12512, 32, 1, 32]
    - [173, 1067.69]
  - - [220, 30, 1, 36]
    - [40, 31.9355]
  - - [37680, 48, 1, 48]
    - [57, 2082.89]
  - - [36384, 96, 1, 96]
    - [163, 3251.7]
  - - [23896, 30, 1, 36]
    - [78, 1226.6]
  - - [33408, 48, 1, 48]
    - [57, 2008.66]
  - - [19544, 30, 1, 36]
    - [78, 1147.15]
  - - [12336, 48, 1, 48]
    - [53, 1554.82]
  - - [20672, 64, 1, 64]
    - [117, 2225.88]
  - - [18912, 96, 1, 96]
    - [96, 3002.98]
  - - [34464, 32, 1, 32]
    - [81, 1271.29]
  - - [43776, 48, 1, 48]
    - [52, 2144.13]
  - - [21888, 96, 1, 96]
    - [94, 3073.12]
  - - [20736, 192, 1, 192]
    - [194, 3980.49]
  - - [30688, 32, 1, 32]
    - [41, 1433.6]
  - - [2560, 30, 1, 36]
    - [37, 333.913]
  - - [39900, 30, 1, 36]
    - [45, 1268.9]
  - - [39000, 30, 1, 36]
    - [74, 1238.82]
  - - [23568, 48, 1, 48]
    - [54, 2101.42]
  - - [22656, 192, 1, 192]
    - [194, 4040.21]
  - - [26112, 48, 1, 48]
    - [133, 1877.72]
  - - [31344, 48, 1, 48]
    - [133, 2028.56]
  - - [28474, 58, 1, 66]
    - [99, 2009.56]
  - - [24064, 124, 1, 132]
    - [142, 3213.77]
  - - [38112, 96, 1, 96]
    - [187, 3155.23]
  - - [8960, 30, 1, 36]
    - [44, 737.561]
  - - [16604, 30, 1, 36]
    - [37, 1030.59]
  - - [1082, 58, 1, 66]
    - [37, 396.733]
  - - [36416, 64, 1, 64]
    - [168, 2471.17]
  - - [7584, 32, 1, 32]
    - [37, 833.264]
  - - [24096, 32, 1, 32]
    - [37, 1408.35]
  - - [28800, 96, 1, 96]
    - [96, 3060.66]
  - - [15104, 30, 1, 36]
    - [45, 1009.43]
  - - [29440, 58, 1, 66]
    - [99, 2032.76]
  - - [4608, 96, 1, 96]
    - [178, 2318.09]
  - - [13024, 32, 1, 32]
    - [37, 1100.38]
  - - [12288, 58, 1, 66]
    - [45, 1860.7]
  - - [38656, 124, 1, 132]
    - [146, 3392.25]
  - - [4080, 48, 1, 48]
    - [45, 903.877]
  - - [18944, 30, 1, 36]
    - [78, 1119.23]
  - - [17664, 96, 1, 96]
    - [96, 2890.47]
  - - [7520, 32, 1, 32]
    - [124, 819.2]
  - - [41472, 48, 1, 48]
    - [57, 2106.51]
  - - [27872, 32, 1, 32]
    - [75, 1427.05]
  - - [13888, 64, 1, 64]
    - [142, 2128.94]
  - - [41406, 66, 1, 66]
    - [98, 2000.49]
  - - [20768, 32, 1, 32]
    - [37, 1339.2]
  - - [4560, 48, 1, 48]
    - [74, 969.21]
  - - [16512, 192, 1, 192]
    - [194, 3896.92]
  - - [16656, 48, 1, 48]
    - [52, 1753.9]
  - - [33690, 30, 1, 36]
    - [43, 1195.31]
  - - [15616, 58, 1, 66]
    - [62, 1971.57]
  - - [33792, 96, 1, 96]
    - [94, 3170.06]
  - - [40160, 32, 1, 32]
    - [45, 1460.36]
  - - [22784, 124, 1, 132]
    - [142, 3177.65]
  - - [10592, 32, 1, 32]
    - [119, 1000.57]
  - - [38912, 58, 1, 66]
    - [117, 2175.16]
  - - [12376, 30, 1, 36]
    - [37, 928.2]
  - - [10174, 66, 1, 66]
    - [62, 1725.78]
  - - [1968, 48, 1, 48]
    - [37, 532.192]
  - - [7296, 192, 1, 192]
    - [149, 3533.37]
  - - [7066, 30, 1, 36]
    - [45, 701.404]
  - - [37632, 128, 1, 128]
    - [146, 3629.41]
  - - [18908, 30, 1, 36]
    - [76, 1129.46]
  - - [34816, 128, 1, 128]
    - [194, 3611.21]
  - - [7360, 64, 1, 64]
    - [145, 1893.63]
  - - [29952, 124, 1, 132]
    - [142, 3308.06]
  - - [2816, 128, 1, 128]
    - [124, 2266.08]
  - - [34268, 30, 1, 36]
    - [40, 1190.78]
  - - [22872, 30, 1, 36]
    - [74, 1210.87]
  - - [22240, 32, 1, 32]
    - [37, 1371.91]
  - - [35584, 124, 1, 132]
    - [142, 3348.89]
  - - [912, 48, 1, 48]
    - [37, 251.345]
  - - [27392, 66, 1, 66]
    - [98, 1835.69]
  - - [15552, 64, 1, 64]
    - [192, 2255.7]
  - - [24032, 32, 1, 32]
    - [43, 1401.41]
  - - [23472, 48, 1, 48]
    - [54, 2051.57]
  - - [16416, 96, 1, 96]
    - [96, 2746.73]
  - - [16192, 64, 1, 64]
    - [113, 2286.98]
  - - [7168, 66, 1, 66]
    - [136, 1498.26]
  - - [43104, 32, 1, 32]
    - [40, 1446.22]
  - - [10784, 32, 1, 32]
    - [119, 1003.89]
  - - [42752, 128, 1, 128]
    - [142, 3683.48]
  - - [10430, 66, 1, 66]
    - [62, 1766.45]
  - - [32928, 32, 1, 32]
    - [37, 1333.79]
  - - [38208, 64, 1, 64]
    - [118, 2568.94]
  - - [17504, 32, 1, 32]
    - [37, 1234.44]
  - - [12602, 58, 1, 66]
    - [77, 1755.48]
  - - [25402, 58, 1, 66]
    - [62, 1909.64]
  - - [35264, 64, 1, 64]
    - [168, 2456.49]
  - - [3994, 30, 1, 36]
    - [80, 475.057]
  - - [14208, 96, 1, 96]
    - [58, 2755.49]
  - - [6000, 48, 1, 48]
    - [119, 1163.64]
  - - [32256, 58, 1, 66]
    - [98, 2148.16]
  - - [1280, 58, 1, 66]
    - [37, 467.542]
  - - [13344, 96, 1, 96]
    - [45, 2728.0]
  - - [21336, 30, 1, 36]
    - [43, 1173.26]
  - - [34714, 30, 1, 36]
    - [43, 1200.1]
  - - [8536, 30, 1, 36]
    - [74, 755.646]
  - - [13056, 96, 1, 96]
    - [45, 2742.12]
  - - [33248, 32, 1, 32]
    - [76, 1342.51]
  - - [20480, 124, 1, 132]
    - [172, 3230.69]
  - - [14688, 32, 1, 32]
    - [37, 1156.96]
  - - [33632, 32, 1, 32]
    - [37, 1334.85]
  - - [6480, 48, 1, 48]
    - [119, 1192.49]
  - - [28800, 192, 1, 192]
    - [194, 4101.7]
  - - [26656, 32, 1, 32]
    - [46, 1409.9]
  - - [1504, 32, 1, 32]
    - [37, 215.097]
  - - [28752, 48, 1, 48]
    - [51, 1973.92]
  - - [5472, 32, 1, 32]
    - [40, 683.333]
  - - [32000, 30, 1, 36]
    - [44, 1259.48]
  - - [27904, 58, 1, 66]
    - [99, 2003.31]
  - - [31680, 64, 1, 64]
    - [117, 2491.58]
  - - [18688, 124, 1, 132]
    - [145, 3076.08]
  - - [4064, 32, 1, 32]
    - [43, 550.468]
  - - [9180, 30, 1, 36]
    - [74, 786.857]
  - - [23872, 64, 1, 64]
    - [171, 2422.69]
  - - [36768, 96, 1, 96]
    - [160, 3277.12]
  - - [10752, 96, 1, 96]
    - [60, 2887.25]
  - - [18366, 66, 1, 66]
    - [57, 1792.17]
  - - [30672, 48, 1, 48]
    - [59, 2009.91]
  - - [19248, 48, 1, 48]
    - [94, 1934.88]
  - - [9888, 32, 1, 32]
    - [119, 981.135]
  - - [33280, 124, 1, 132]
    - [146, 3310.21]
  - - [30944, 32, 1, 32]
    - [38, 1442.93]
  - - [32864, 32, 1, 32]
    - [80, 1331.2]
  - - [29856, 96, 1, 96]
    - [96, 3088.83]
  - - [3072, 192, 1, 192]
    - [44, 3008.67]
  - - [1024, 58, 1, 66]
    - [37, 381.311]
  - - [12544, 30, 1, 36]
    - [74, 938.194]
  - - [37248, 192, 1, 192]
    - [203, 4223.4]
  - - [19360, 32, 1, 32]
    - [37, 1328.73]
  - - [18192, 48, 1, 48]
    - [90, 1905.2]
  - - [10496, 128, 1, 128]
    - [147, 2958.82]
  - - [20992, 58, 1, 66]
    - [45, 1911.45]
  - - [21744, 48, 1, 48]
    - [54, 2010.36]
  - - [13536, 96, 1, 96]
    - [45, 2728.52]
  - - [39424, 66, 1, 66]
    - [184, 1991.31]
  - - [17664, 48, 1, 48]
    - [52, 1887.66]
  - - [25248, 96, 1, 96]
    - [178, 2876.92]
  - - [1850, 58, 1, 66]
    - [37, 641.467]
  - - [8736, 96, 1, 96]
    - [96, 2557.53]
  - - [38656, 128, 1, 128]
    - [142, 3658.39]
  - - [23296, 30, 1, 36]
    - [78, 1218.98]
  - - [29504, 64, 1, 64]
    - [116, 2390.2]
  - - [4848, 48, 1, 48]
    - [119, 1000.88]
  - - [11296, 32, 1, 32]
    - [173, 1032.78]
  - - [12000, 32, 1, 32]
    - [37, 1093.24]
  - - [20128, 32, 1, 32]
    - [45, 1338.38]
  - - [27136, 124, 1, 132]
    - [145, 3223.24]
  - - [4352, 30, 1, 36]
    - [46, 460.8]
  - - [28094, 66, 1, 66]
    - [98, 1851.96]
  - - [42208, 32, 1, 32]
    - [45, 1454.27]
  - - [35416, 30, 1, 36]
    - [37, 1210.42]
  - - [1152, 96, 1, 96]
    - [119, 912.099]
  - - [3804, 30, 1, 36]
    - [37, 471.138]
  - - [27706, 58, 1, 66]
    - [99, 1987.6]
  - - [24064, 30, 1, 36]
    - [76, 1223.59]
  - - [28960, 32, 1, 32]
    - [41, 1409.46]
  - - [24664, 30, 1, 36]
    - [38, 1168.29]
  - - [3072, 124, 1, 132]
    - [124, 2248.77]
  - - [30176, 32, 1, 32]
    - [38, 1441.24]
  - - [34704, 48, 1, 48]
    - [52, 2043.92]
  - - [42496, 124, 1, 132]
    - [146, 3414.37]
  - - [7392, 96, 1, 96]
    - [153, 2620.18]
  - - [23808, 58, 1, 66]
    - [117, 1962.47]
  - - [43616, 32, 1, 32]
    - [40, 1469.17]
  - - [2624, 64, 1, 64]
    - [141, 1002.6]
  - - [4192, 32, 1, 32]
    - [119, 533.906]
  - - [39168, 66, 1, 66]
    - [182, 1999.72]
  - - [24766, 66, 1, 66]
    - [184, 1767.38]
  - - [26588, 30, 1, 36]
    - [75, 1214.68]
  - - [14014, 66, 1, 66]
    - [56, 1655.23]
  - - [3036, 30, 1, 36]
    - [74, 386.66]
  - - [5808, 48, 1, 48]
    - [122, 1130.21]
  - - [666, 30, 1, 36]
    - [67, 95.6489]
  - - [11072, 64, 1, 64]
    - [143, 2087.98]
  - - [17824, 32, 1, 32]
    - [45, 1233.23]
  - - [7296, 48, 1, 48]
    - [119, 1301.08]
  - - [37120, 30, 1, 36]
    - [40, 1219.27]
  - - [5280, 32, 1, 32]
    - [37, 665.852]
  - - [13440, 96, 1, 96]
    - [43, 2762.33]
  - - [40416, 96, 1, 96]
    - [163, 3271.91]
  - - [11008, 124, 1, 132]
    - [86, 2849.13]
  - - [20112, 48, 1, 48]
    - [60, 1997.33]
  - - [23744, 64, 1, 64]
    - [117, 2419.29]
  - - [13824, 48, 1, 48]
    - [51, 1742.37]
  - - [32304, 48, 1, 48]
    - [51, 2031.34]
  - - [39256, 30, 1, 36]
    - [45, 1258.8]
  - - [1880, 30, 1, 36]
    - [37, 255.075]
  - - [27546, 30, 1, 36]
    - [46, 1231.36]
  - - [13248, 64, 1, 64]
    - [142, 2067.98]
  - - [4864, 66, 1, 66]
    - [124, 1386.62]
  - - [4096, 66, 1, 66]
    - [176, 1183.17]
  - - [37280, 32, 1, 32]
    - [45, 1422.31]
  - - [4672, 64, 1, 64]
    - [124, 1432.37]
  - - [9120, 96, 1, 96]
    - [123, 2507.46]
  - - [18176, 128, 1, 128]
    - [144, 3396.39]
  - - [32768, 58, 1, 66]
    - [99, 2136.17]
  - - [41626, 30, 1, 36]
    - [40, 1268.51]
  - - [18622, 66, 1, 66]
    - [60, 1789.88]
  - - [26880, 66, 1, 66]
    - [57, 1811.41]
  - - [19296, 32, 1, 32]
    - [37, 1320.8]
  - - [13632, 64, 1, 64]
    - [142, 2099.12]
  - - [16794, 30, 1, 36]
    - [74, 1052.06]
  - - [26682, 58, 1, 66]
    - [63, 1944.76]
  - - [18720, 96, 1, 96]
    - [94, 2952.15]
  - - [6768, 48, 1, 48]
    - [119, 1225.9]
  - - [25248, 32, 1, 32]
    - [38, 1363.61]
  - - [8192, 58, 1, 66]
    - [124, 1726.82]
  - - [11808, 32, 1, 32]
    - [37, 1079.59]
  - - [5984, 32, 1, 32]
    - [37, 736.492]
  - - [23040, 124, 1, 132]
    - [141, 3178.68]
  - - [29664, 96, 1, 96]
    - [96, 3085.59]
  - - [11040, 32, 1, 32]
    - [173, 1031.47]
  - - [40382, 66, 1, 66]
    - [184, 1998.01]
  - - [36192, 32, 1, 32]
    - [40, 1395.35]
  - - [4184, 30, 1, 36]
    - [40, 489.039]
  - - [24928, 32, 1, 32]
    - [38, 1343.49]
  - - [11712, 64, 1, 64]
    - [145, 2168.73]
  - - [33408, 192, 1, 192]
    - [194, 4142.18]
  - - [32928, 96, 1, 96]
    - [94, 3116.93]
  - - [36832, 32, 1, 32]
    - [37, 1401.04]
  - - [28672, 124, 1, 132]
    - [172, 3321.8]
  - - [32154, 30, 1, 36]
    - [41, 1260.03]
  - - [9918, 66, 1, 66]
    - [62, 1706.27]
  - - [36952, 30, 1, 36]
    - [40, 1227.19]
  - - [16464, 48, 1, 48]
    - [52, 1714.88]
  - - [34848, 32, 1, 32]
    - [76, 1364.08]
  - - [42176, 64, 1, 64]
    - [172, 2513.87]
  - - [32256, 48, 1, 48]
    - [133, 2062.09]
  - - [3584, 124, 1, 132]
    - [124, 2428.1]
  - - [7104, 64, 1, 64]
    - [194, 1870.05]
  - - [18878, 66, 1, 66]
    - [94, 1793.9]
  - - [17184, 96, 1, 96]
    - [94, 2832.04]
  - - [26880, 124, 1, 132]
    - [142, 3256.16]
  - - [3840, 48, 1, 48]
    - [37, 891.871]
  - - [7900, 30, 1, 36]
    - [37, 735.517]
  - - [25440, 32, 1, 32]
    - [38, 1342.81]
  - - [35936, 32, 1, 32]
    - [76, 1389.67]
  - - [27840, 64, 1, 64]
    - [113, 2291.65]
  - - [37312, 64, 1, 64]
    - [112, 2508.7]
  - - [18586, 30, 1, 36]
    - [74, 1130.23]
  - - [37952, 64, 1, 64]
    - [118, 2540.06]
  - - [7728, 48, 1, 48]
    - [124, 1324.8]
  - - [3840, 192, 1, 192]
    - [68, 3472.96]
  - - [41472, 124, 1, 132]
    - [192, 3413.87]
  - - [7968, 96, 1, 96]
    - [136, 2727.83]
  - - [17664, 124, 1, 132]
    - [144, 3130.41]
  - - [16128, 192, 1, 192]
    - [199, 4002.04]
  - - [6144, 30, 1, 36]
    - [37, 642.977]
  - - [20688, 48, 1, 48]
    - [57, 1982.74]
  - - [20224, 30, 1, 36]
    - [37, 1174.3]
  - - [1536, 96, 1, 96]
    - [139, 1088.91]
  - - [36480, 96, 1, 96]
    - [163, 3274.25]
  - - [28416, 192, 1, 192]
    - [202, 4167.44]
  - - [18960, 48, 1, 48]
    - [52, 1971.29]
  - - [15216, 48, 1, 48]
    - [51, 1803.38]
  - - [41232, 48, 1, 48]
    - [54, 2094.32]
  - - [33056, 32, 1, 32]
    - [37, 1322.24]
  - - [2048, 30, 1, 36]
    - [37, 275.104]
  - - [14848, 66, 1, 66]
    - [182, 1714.68]
  - - [4666, 58, 1, 66]
    - [124, 1206.85]
  - - [12544, 124, 1, 132]
    - [142, 2869.2]
  - - [5024, 32, 1, 32]
    - [37, 643.072]
  - - [32256, 124, 1, 132]
    - [146, 3313.05]
  - - [29082, 30, 1, 36]
    - [77, 1211.75]
  - - [22170, 30, 1, 36]
    - [37, 1182.98]
  - - [20414, 66, 1, 66]
    - [98, 1855.66]
  - - [14592, 58, 1, 66]
    - [64, 1899.94]
  - - [28314, 30, 1, 36]
    - [38, 1235.02]
  - - [11760, 48, 1, 48]
    - [51, 1575.29]
  - - [42240, 128, 1, 128]
    - [146, 3692.17]
  - - [34656, 96, 1, 96]
    - [96, 3193.9]
  - - [14816, 32, 1, 32]
    - [74, 1156.37]
  - - [10464, 96, 1, 96]
    - [94, 2833.03]
  - - [39744, 64, 1, 64]
    - [172, 2588.92]
  - - [16640, 58, 1, 66]
    - [45, 1773.33]
  - - [11136, 96, 1, 96]
    - [57, 2945.73]
  - - [35840, 58, 1, 66]
    - [117, 2086.31]
  - - [11424, 32, 1, 32]
    - [173, 1044.48]
  - - [37440, 64, 1, 64]
    - [115, 2510.71]
  - - [41304, 30, 1, 36]
    - [76, 1277.44]
  - - [21408, 32, 1, 32]
    - [37, 1356.55]
  - - [12032, 124, 1, 132]
    - [87, 3069.51]
  - - [4352, 128, 1, 128]
    - [152, 2462.13]
  - - [23098, 58, 1, 66]
    - [47, 1956.18]
  - - [43710, 66, 1, 66]
    - [182, 1972.66]
  - - [31248, 48, 1, 48]
    - [133, 2015.55]
  - - [22560, 96, 1, 96]
    - [94, 3079.28]
  - - [17306, 30, 1, 36]
    - [74, 1074.17]
  - - [23552, 128, 1, 128]
    - [146, 3440.41]
  - - [6400, 124, 1, 132]
    - [94, 2626.76]
  - - [1888, 32, 1, 32]
    - [37, 268.516]
  - - [40704, 128, 1, 128]
    - [195, 3688.58]
  - - [22528, 58, 1, 66]
    - [114, 1931.84]
  - - [44000, 32, 1, 32]
    - [76, 1466.67]
  - - [6304, 32, 1, 32]
    - [74, 743.698]
  - - [21216, 96, 1, 96]
    - [96, 3002.56]
  - - [9560, 30, 1, 36]
    - [74, 827.308]
  - - [1470, 66, 1, 66]
    - [40, 588.54]
  - - [25344, 192, 1, 192]
    - [190, 4071.3]
  - - [21936, 48, 1, 48]
    - [54, 1996.07]
  - - [14526, 66, 1, 66]
    - [58, 1699.12]
  - - [38458, 58, 1, 66]
    - [117, 2153.56]
  - - [192, 64, 1, 64]
    - [37, 87.3813]
  - - [12698, 30, 1, 36]
    - [37, 926.611]
  - - [9984, 96, 1, 96]
    - [57, 2836.39]
  - - [30368, 32, 1, 32]
    - [41, 1442.34]
  - - [23194, 30, 1, 36]
    - [43, 1206.62]
  - - [17280, 192, 1, 192]
    - [194, 3970.4]
  - - [35130, 58, 1, 66]
    - [112, 2040.01]
  - - [21080, 30, 1, 36]
    - [74, 1149.82]
  - - [10368, 192, 1, 192]
    - [194, 3736.86]
  - - [21562, 58, 1, 66]
    - [45, 1893.1]
  - - [27612, 30, 1, 36]
    - [38, 1224.18]
  - - [14656, 64, 1, 64]
    - [146, 2213.53]
  - - [29696, 66, 1, 66]
    - [98, 1934.15]
  - - [34560, 48, 1, 48]
    - [54, 2027.14]
  - - [18396, 30, 1, 36]
    - [76, 1098.88]
  - - [39840, 32, 1, 32]
    - [40, 1459.09]
  - - [19200, 124, 1, 132]
    - [169, 3110.31]
  - - [20880, 48, 1, 48]
    - [52, 1946.1]
  - - [39424, 128, 1, 128]
    - [192, 3701.14]
  - - [34992, 48, 1, 48]
    - [92, 2025.67]
  - - [17056, 32, 1, 32]
    - [40, 1233.43]
  - - [4608, 66, 1, 66]
    - [127, 1345.34]
  - - [17248, 32, 1, 32]
    - [37, 1233.38]
  - - [14368, 32, 1, 32]
    - [74, 1118.0]
  - - [24634, 58, 1, 66]
    - [62, 1884.47]
  - - [29568, 96, 1, 96]
    - [96, 3102.22]
  - - [17376, 96, 1, 96]
    - [96, 2849.42]
  - - [16544, 32, 1, 32]
    - [37, 1227.61]
  - - [12858, 58, 1, 66]
    - [79, 1850.39]
  - - [16318, 66, 1, 66]
    - [58, 1796.8]
  - - [11418, 30, 1, 36]
    - [74, 920.257]
  - - [43072, 64, 1, 64]
    - [116, 2523.22]
  - - [19824, 48, 1, 48]
    - [52, 1978.96]
  - - [38144, 128, 1, 128]
    - [192, 3660.69]
  - - [31776, 32, 1, 32]
    - [41, 1452.62]
  - - [2240, 64, 1, 64]
    - [139, 878.835]
  - - [8960, 58, 1, 66]
    - [49, 1478.4]
  - - [9504, 96, 1, 96]
    - [60, 2757.84]
  - - [40608, 32, 1, 32]
    - [45, 1460.06]
  - - [18330, 30, 1, 36]
    - [37, 1122.24]
  - - [8448, 48, 1, 48]
    - [76, 1318.71]
  - - [12120, 30, 1, 36]
    - [74, 940.345]
  - - [39512, 30, 1, 36]
    - [76, 1262.51]
  - - [8352, 96, 1, 96]
    - [44, 2426.61]
  - - [11968, 64, 1, 64]
    - [141, 2165.24]
  - - [42336, 96, 1, 96]
    - [205, 3293.12]
  - - [35584, 128, 1, 128]
    - [195, 3652.94]
  - - [4096, 124, 1, 132]
    - [127, 2631.21]
  - - [43392, 192, 1, 192]
    - [195, 4219.7]
  - - [21408, 96, 1, 96]
    - [96, 3020.46]
  - - [8668, 30, 1, 36]
    - [37, 754.955]
  - - [8016, 48, 1, 48]
    - [119, 1386.55]
  - - [33024, 128, 1, 128]
    - [192, 3673.72]
  - - [10272, 32, 1, 32]
    - [37, 970.344]
  - - [39614, 66, 1, 66]
    - [184, 1992.59]
  - - [27984, 48, 1, 48]
    - [51, 1939.69]
  - - [15296, 64, 1, 64]
    - [142, 2296.64]
  - - [7680, 48, 1, 48]
    - [173, 1336.46]
  - - [4572, 30, 1, 36]
    - [43, 514.35]
  - - [7488, 64, 1, 64]
    - [194, 1907.39]
  - - [37344, 96, 1, 96]
    - [187, 3148.21]
  - - [32032, 32, 1, 32]
    - [38, 1451.36]
  - - [12736, 64, 1, 64]
    - [116, 2012.6]
  - - [12576, 96, 1, 96]
    - [45, 2695.36]
  - - [13152, 32, 1, 32]
    - [37, 1111.19]
  - - [33824, 32, 1, 32]
    - [74, 1348.75]
  - - [10752, 48, 1, 48]
    - [52, 1525.41]
  - - [12288, 128, 1, 128]
    - [144, 3274.67]
  - - [4896, 32, 1, 32]
    - [37, 626.688]
  - - [35168, 32, 1, 32]
    - [45, 1385.08]
  - - [38464, 64, 1, 64]
    - [118, 2557.61]
  - - [23040, 192, 1, 192]
    - [195, 4085.76]
  - - [544, 32, 1, 32]
    - [67, 77.8011]
  - - [33552, 48, 1, 48]
    - [54, 1996.48]
  - - [5888, 30, 1, 36]
    - [40, 621.0]
  - - [43322, 58, 1, 66]
    - [98, 2096.01]
  - - [28864, 64, 1, 64]
    - [117, 2345.77]
  - - [2336, 32, 1, 32]
    - [37, 335.964]
  - - [19098, 30, 1, 36]
    - [74, 1145.88]
  - - [1296, 48, 1, 48]
    - [37, 355.474]
  - - [13856, 32, 1, 32]
    - [37, 1105.03]
  - - [4608, 58, 1, 66]
    - [125, 1182.27]
  - - [29536, 32, 1, 32]
    - [38, 1418.61]
  - - [36336, 48, 1, 48]
    - [52, 2074.29]
  - - [40544, 32, 1, 32]
    - [40, 1358.54]
  - - [9472, 30, 1, 36]
    - [74, 817.073]
  - - [23040, 66, 1, 66]
    - [57, 1912.39]
  - - [39936, 96, 1, 96]
    - [163, 3258.23]
  - - [7008, 32, 1, 32]
    - [127, 773.297]
  - - [5434, 58, 1, 66]
    - [124, 1350.74]
  - - [20736, 124, 1, 132]
    - [145, 3152.0]
  - - [6816, 32, 1, 32]
    - [37, 793.135]
  - - [35840, 30, 1, 36]
    - [80, 1218.74]
  - - [20992, 128, 1, 128]
    - [195, 3446.22]
  - - [28672, 30, 1, 36]
    - [38, 1226.85]
  - - [25944, 30, 1, 36]
    - [44, 1195.37]
  - - [34304, 30, 1, 36]
    - [76, 1201.31]
  - - [33280, 128, 1, 128]
    - [146, 3575.95]
  - - [39322, 30, 1, 36]
    - [76, 1268.45]
  - - [6432, 96, 1, 96]
    - [46, 2417.51]
  - - [38976, 64, 1, 64]
    - [115, 2573.27]
  - - [18672, 48, 1, 48]
    - [54, 1906.93]
  - - [11680, 32, 1, 32]
    - [74, 1071.71]
  - - [5088, 32, 1, 32]
    - [43, 632.295]
  - - [26464, 32, 1, 32]
    - [77, 1396.86]
  - - [43248, 48, 1, 48]
    - [90, 2125.5]
  - - [40960, 128, 1, 128]
    - [192, 3683.26]
  - - [31520, 32, 1, 32]
    - [44, 1453.9]
  - - [36250, 30, 1, 36]
    - [74, 1203.87]
  - - [40352, 32, 1, 32]
    - [76, 1477.84]
  - - [19032, 30, 1, 36]
    - [37, 1141.92]
  - - [3904, 64, 1, 64]
    - [141, 1364.4]
  - - [2012, 30, 1, 36]
    - [37, 268.931]
  - - [43056, 48, 1, 48]
    - [52, 2103.5]
  - - [39680, 128, 1, 128]
    - [146, 3653.17]
  - - [16480, 32, 1, 32]
    - [78, 1181.76]
  - - [37920, 96, 1, 96]
    - [187, 3156.35]
  - - [18432, 58, 1, 66]
    - [45, 1876.53]
  - - [8280, 30, 1, 36]
    - [37, 735.395]
  - - [512, 124, 1, 132]
    - [119, 552.798]
  - - [39168, 30, 1, 36]
    - [76, 1257.47]
  - - [25344, 66, 1, 66]
    - [180, 1751.24]
  - - [13792, 32, 1, 32]
    - [74, 1120.87]
  - - [24720, 48, 1, 48]
    - [53, 1800.09]
  - - [26208, 32, 1, 32]
    - [38, 1386.21]
  - - [43968, 64, 1, 64]
    - [169, 2518.08]
  - - [43424, 32, 1, 32]
    - [40, 1470.44]
  - - [38256, 48, 1, 48]
    - [57, 2096.62]
  - - [5728, 32, 1, 32]
    - [76, 708.39]
  - - [11454, 66, 1, 66]
    - [60, 1737.24]
  - - [30654, 66, 1, 66]
    - [100, 1930.72]
  - - [40024, 30, 1, 36]
    - [76, 1262.44]
  - - [19632, 48, 1, 48]
    - [54, 1956.41]
  - - [13882, 58, 1, 66]
    - [62, 1868.51]
  - - [8346, 30, 1, 36]
    - [74, 736.412]
  - - [11328, 64, 1, 64]
    - [141, 2132.33]
  - - [28928, 66, 1, 66]
    - [98, 1910.41]
  - - [26624, 128, 1, 128]
    - [146, 3508.75]
  - - [33568, 32, 1, 32]
    - [40, 1332.31]
  - - [1984, 64, 1, 64]
    - [124, 839.511]
  - - [26848, 32, 1, 32]
    - [41, 1408.42]
  - - [36672, 64, 1, 64]
    - [117, 2498.48]
  - - [18432, 128, 1, 128]
    - [197, 3408.46]
  - - [19200, 128, 1, 128]
    - [197, 3404.47]
  - - [29216, 32, 1, 32]
    - [79, 1392.79]
  - - [768, 96, 1, 96]
    - [119, 618.697]
  - - [14680, 30, 1, 36]
    - [37, 1018.92]
  - - [30106, 30, 1, 36]
    - [44, 1233.48]
  - - [6144, 66, 1, 66]
    - [45, 1435.8]
  - - [30464, 58, 1, 66]
    - [98, 2076.5]
  - - [9360, 48, 1, 48]
    - [45, 1404.0]
  - - [39168, 128, 1, 128]
    - [192, 3728.38]
  - - [16954, 58, 1, 66]
    - [80, 1808.8]
  - - [21182, 66, 1, 66]
    - [98, 1892.3]
  - - [28464, 48, 1, 48]
    - [51, 1937.97]
  - - [40768, 64, 1, 64]
    - [118, 2614.05]
  - - [36060, 30, 1, 36]
    - [45, 1220.08]
  - - [18944, 66, 1, 66]
    - [57, 1825.67]
  - - [2304, 66, 1, 66]
    - [45, 856.333]
  - - [9472, 66, 1, 66]
    - [62, 1661.03]
  - - [20896, 32, 1, 32]
    - [76, 1330.69]
  - - [5920, 32, 1, 32]
    - [76, 725.129]
  - - [43834, 58, 1, 66]
    - [118, 2111.18]
  - - [43632, 48, 1, 48]
    - [54, 2126.23]
  - - [20352, 192, 1, 192]
    - [197, 4098.87]
  - - [15456, 96, 1, 96]
    - [95, 2883.45]
  - - [36816, 48, 1, 48]
    - [52, 2099.61]
  - - [20592, 48, 1, 48]
    - [54, 1931.76]
  - - [13568, 128, 1, 128]
    - [146, 3225.45]
  - - [7680, 58, 1, 66]
    - [124, 1689.6]
  - - [8992, 32, 1, 32]
    - [42, 855.744]
  - - [16032, 32, 1, 32]
    - [37, 1210.68]
  - - [39520, 32, 1, 32]
    - [76, 1455.7]
  - - [34304, 66, 1, 66]
    - [60, 1910.85]
  - - [20158, 66, 1, 66]
    - [98, 1855.63]
  - - [13912, 30, 1, 36]
    - [39, 953.36]
  - - [31264, 32, 1, 32]
    - [46, 1449.92]
  - - [1214, 66, 1, 66]
    - [119, 508.479]
  - - [41530, 58, 1, 66]
    - [115, 2098.43]
  - - [28160, 128, 1, 128]
    - [194, 3546.84]
  - - [8480, 32, 1, 32]
    - [119, 871.839]
  - - [43104, 96, 1, 96]
    - [207, 3286.29]
  - - [20568, 30, 1, 36]
    - [74, 1176.56]
  - - [11856, 48, 1, 48]
    - [51, 1610.63]
  - - [33024, 58, 1, 66]
    - [165, 1997.72]
  - - [21248, 66, 1, 66]
    - [98, 1895.09]
  - - [25792, 64, 1, 64]
    - [144, 2208.28]
  - - [6096, 48, 1, 48]
    - [119, 1178.29]
  - - [17280, 48, 1, 48]
    - [52, 1850.05]
  - - [1632, 96, 1, 96]
    - [139, 1135.99]
  - - [7388, 30, 1, 36]
    - [74, 702.38]
  - - [16896, 124, 1, 132]
    - [148, 3044.4]
  - - [19456, 124, 1, 132]
    - [144, 3133.17]
  - - [20928, 64, 1, 64]
    - [114, 2255.82]
  - - [29952, 48, 1, 48]
    - [51, 2010.76]
  - - [3120, 48, 1, 48]
    - [40, 768.0]
  - - [30398, 66, 1, 66]
    - [100, 1938.14]
  - - [25754, 30, 1, 36]
    - [38, 1200.96]
  - - [23962, 30, 1, 36]
    - [37, 1216.12]
  - - [38912, 128, 1, 128]
    - [195, 3687.73]
  - - [30112, 32, 1, 32]
    - [38, 1432.84]
  - - [25176, 30, 1, 36]
    - [38, 1154.08]
  - - [11520, 192, 1, 192]
    - [103, 3795.8]
  - - [1536, 30, 1, 36]
    - [74, 206.328]
  - - [38912, 30, 1, 36]
    - [76, 1253.73]
  - - [24192, 48, 1, 48]
    - [90, 2120.94]
  - - [35280, 48, 1, 48]
    - [52, 2063.07]
  - - [43936, 32, 1, 32]
    - [76, 1470.28]
  - - [35712, 96, 1, 96]
    - [96, 3231.75]
  - - [2064, 48, 1, 48]
    - [37, 530.743]
  - - [35072, 128, 1, 128]
    - [146, 3611.24]
  - - [26880, 96, 1, 96]
    - [208, 3021.05]
  - - [35952, 48, 1, 48]
    - [52, 2083.34]
  - - [4768, 32, 1, 32]
    - [37, 619.598]
  - - [13568, 30, 1, 36]
    - [37, 951.522]
  - - [21760, 58, 1, 66]
    - [88, 1910.49]
  - - [15360, 96, 1, 96]
    - [162, 2910.32]
  - - [4154, 58, 1, 66]
    - [127, 1083.21]
  - - [2464, 32, 1, 32]
    - [37, 352.393]
  - - [12346, 58, 1, 66]
    - [64, 1729.89]
  - - [21504, 30, 1, 36]
    - [37, 1187.34]
  - - [10752, 58, 1, 66]
    - [145, 1667.69]
  - - [18336, 32, 1, 32]
    - [43, 1258.45]
  - - [30048, 32, 1, 32]
    - [44, 1432.46]
  - - [7152, 48, 1, 48]
    - [119, 1307.79]
  - - [25856, 128, 1, 128]
    - [145, 3475.75]
  - - [20026, 58, 1, 66]
    - [45, 1910.76]
  - - [6624, 96, 1, 96]
    - [45, 2489.67]
  - - [25296, 48, 1, 48]
    - [55, 1805.51]
  - - [39712, 32, 1, 32]
    - [76, 1456.49]
  - - [37728, 32, 1, 32]
    - [37, 1422.44]
  - - [40416, 32, 1, 32]
    - [45, 1471.76]
  - - [15776, 32, 1, 32]
    - [74, 1201.98]
  - - [384, 96, 1, 96]
    - [119, 311.527]
  - - [33536, 128, 1, 128]
    - [142, 3595.91]
  - - [19456, 58, 1, 66]
    - [45, 1945.6]
  - - [18144, 96, 1, 96]
    - [94, 2929.49]
  - - [37376, 66, 1, 66]
    - [182, 1947.49]
  - - [16472, 30, 1, 36]
    - [37, 1039.12]
  - - [9472, 124, 1, 132]
    - [145, 2816.82]
  - - [35672, 30, 1, 36]
    - [74, 1197.94]
  - - [21696, 64, 1, 64]
    - [114, 2290.38]
  - - [21984, 32, 1, 32]
    - [37, 1372.66]
  - - [27408, 48, 1, 48]
    - [189, 1920.56]
  - - [18008, 30, 1, 36]
    - [76, 1085.3]
  - - [9568, 32, 1, 32]
    - [119, 927.806]
  - - [30976, 66, 1, 66]
    - [98, 1936.44]
  - - [35520, 64, 1, 64]
    - [117, 2446.03]
  - - [27616, 32, 1, 32]
    - [81, 1380.8]
  - - [43264, 124, 1, 132]
    - [142, 3420.33]
  - - [12888, 30, 1, 36]
    - [37, 950.754]
  - - [5054, 66, 1, 66]
    - [124, 1437.03]
  - - [36768, 32, 1, 32]
    - [40, 1413.3]
  - - [15448, 30, 1, 36]
    - [74, 1012.37]
  - - [5040, 48, 1, 48]
    - [122, 1029.45]
  - - [13758, 66, 1, 66]
    - [56, 1637.43]
  - - [22074, 58, 1, 66]
    - [48, 1901.42]
  - - [6042, 30, 1, 36]
    - [37, 644.798]
  - - [18746, 58, 1, 66]
    - [45, 1894.4]
  - - [35424, 32, 1, 32]
    - [40, 1390.88]
  - - [32208, 48, 1, 48]
    - [51, 2063.6]
  - - [9984, 128, 1, 128]
    - [145, 3177.5]
  - - [24864, 32, 1, 32]
    - [38, 1354.29]
  - - [34816, 124, 1, 132]
    - [146, 3339.6]
  - - [20378, 30, 1, 36]
    - [37, 1173.15]
  - - [33726, 66, 1, 66]
    - [57, 1902.99]
  - - [33264, 48, 1, 48]
    - [52, 1991.69]
  - - [16272, 48, 1, 48]
    - [51, 1893.47]
  - - [14592, 128, 1, 128]
    - [145, 3155.69]
  - - [38400, 48, 1, 48]
    - [94, 2114.57]
  - - [34224, 48, 1, 48]
    - [52, 2023.92]
  - - [41948, 30, 1, 36]
    - [45, 1258.44]
  - - [27648, 96, 1, 96]
    - [160, 3089.28]
  - - [2048, 66, 1, 66]
    - [140, 805.152]
  - - [29088, 32, 1, 32]
    - [38, 1399.72]
  - - [37120, 66, 1, 66]
    - [182, 1933.22]
  - - [1568, 32, 1, 32]
    - [37, 220.554]
  - - [33024, 66, 1, 66]
    - [57, 1893.79]
  - - [40704, 96, 1, 96]
    - [160, 3306.84]
  - - [43198, 66, 1, 66]
    - [100, 1987.44]
  - - [39200, 32, 1, 32]
    - [76, 1441.84]
  - - [13656, 30, 1, 36]
    - [37, 972.855]
  - - [11066, 58, 1, 66]
    - [49, 1719.18]
  - - [16384, 66, 1, 66]
    - [58, 1796.8]
  - - [25312, 32, 1, 32]
    - [75, 1298.57]
  - - [8602, 30, 1, 36]
    - [40, 754.071]
  - - [26688, 64, 1, 64]
    - [142, 2240.04]
  - - [9072, 48, 1, 48]
    - [45, 1350.25]
  - - [14848, 30, 1, 36]
    - [37, 999.741]
  - - [12544, 58, 1, 66]
    - [81, 1783.75]
  - - [8352, 32, 1, 32]
    - [37, 869.151]
  - - [24224, 32, 1, 32]
    - [43, 1406.2]
  - - [41216, 30, 1, 36]
    - [76, 1267.46]
  - - [28986, 58, 1, 66]
    - [63, 2013.03]
  - - [28896, 32, 1, 32]
    - [38, 1411.71]
  - - [7512, 30, 1, 36]
    - [45, 706.704]
  - - [31802, 58, 1, 66]
    - [98, 2113.51]
  - - [11040, 96, 1, 96]
    - [94, 2910.32]
  - - [38620, 30, 1, 36]
    - [76, 1247.3]
  - - [18176, 30, 1, 36]
    - [37, 1088.14]
  - - [24320, 58, 1, 66]
    - [168, 1994.37]
  - - [16096, 32, 1, 32]
    - [74, 1222.72]
  - - [17312, 32, 1, 32]
    - [37, 1210.89]
  - - [21840, 48, 1, 48]
    - [52, 2035.57]
  - - [43552, 32, 1, 32]
    - [45, 1451.73]
  - - [19002, 58, 1, 66]
    - [45, 1888.36]
  - - [38688, 96, 1, 96]
    - [164, 3182.33]
  - - [27216, 48, 1, 48]
    - [51, 1900.17]
  - - [34848, 96, 1, 96]
    - [96, 3211.59]
  - - [28368, 48, 1, 48]
    - [56, 1942.92]
  - - [19456, 128, 1, 128]
    - [148, 3385.38]
  - - [26400, 32, 1, 32]
    - [46, 1393.48]
  - - [23808, 48, 1, 48]
    - [54, 2113.01]
  - - [2688, 48, 1, 48]
    - [37, 685.083]
  - - [7136, 32, 1, 32]
    - [76, 811.918]
  - - [8156, 30, 1, 36]
    - [40, 738.966]
  - - [28862, 66, 1, 66]
    - [100, 1878.7]
  - - [32088, 30, 1, 36]
    - [38, 1255.62]
  - - [41692, 30, 1, 36]
    - [76, 1267.66]
  - - [23040, 128, 1, 128]
    - [145, 3426.72]
  - - [10032, 48, 1, 48]
    - [74, 1462.89]
  - - [28416, 58, 1, 66]
    - [63, 2001.04]
  - - [17440, 32, 1, 32]
    - [74, 1216.52]
  - - [27290, 30, 1, 36]
    - [77, 1223.97]
  - - [35872, 32, 1, 32]
    - [40, 1385.1]
  - - [600, 30, 1, 36]
    - [102, 85.2632]
  - - [6144, 192, 1, 192]
    - [69, 3813.0]
  - - [20480, 30, 1, 36]
    - [74, 1171.53]
  - - [33792, 58, 1, 66]
    - [115, 2008.63]
  - - [3328, 30, 1, 36]
    - [37, 421.859]
  - - [26944, 64, 1, 64]
    - [117, 2252.3]
  - - [21888, 48, 1, 48]
    - [60, 2053.34]
  - - [16830, 66, 1, 66]
    - [60, 1697.02]
  - - [21264, 48, 1, 48]
    - [60, 1991.56]
  - - [43264, 128, 1, 128]
    - [146, 3690.33]
  - - [26352, 48, 1, 48]
    - [58, 1862.42]
  - - [43328, 64, 1, 64]
    - [169, 2503.83]
  - - [17920, 128, 1, 128]
    - [193, 3401.31]
  - - [42096, 48, 1, 48]
    - [54, 2097.52]
  - - [4922, 58, 1, 66]
    - [127, 1236.31]
  - - [14496, 32, 1, 32]
    - [37, 1166.97]
  - - [19456, 30, 1, 36]
    - [37, 1183.14]
  - - [17088, 64, 1, 64]
    - [145, 2152.29]
  - - [15360, 48, 1, 48]
    - [51, 1866.53]
  - - [16736, 32, 1, 32]
    - [45, 1177.04]
  - - [11104, 32, 1, 32]
    - [37, 1041.25]
  - - [20208, 48, 1, 48]
    - [52, 1999.97]
  - - [2272, 32, 1, 32]
    - [37, 326.76]
  - - [33184, 32, 1, 32]
    - [76, 1337.81]
  - - [24576, 128, 1, 128]
    - [146, 3532.05]
  - - [15136, 32, 1, 32]
    - [74, 1170.64]
  - - [39232, 64, 1, 64]
    - [118, 2591.84]
  - - [37632, 124, 1, 132]
    - [146, 3390.36]
  - - [23968, 32, 1, 32]
    - [74, 1385.06]
  - - [32320, 64, 1, 64]
    - [117, 2516.78]
  - - [9536, 64, 1, 64]
    - [146, 1949.07]
  - - [6364, 30, 1, 36]
    - [43, 653.338]
  - - [8160, 32, 1, 32]
    - [173, 863.207]
  - - [19584, 48, 1, 48]
    - [57, 2010.76]
  - - [28384, 32, 1, 32]
    - [38, 1441.73]
  - - [17562, 30, 1, 36]
    - [74, 1075.22]
  - - [30560, 32, 1, 32]
    - [44, 1430.23]
  - - [6144, 124, 1, 132]
    - [49, 2943.94]
  - - [42496, 30, 1, 36]
    - [76, 1272.05]
  - - [14848, 58, 1, 66]
    - [62, 1935.9]
  - - [19296, 96, 1, 96]
    - [94, 3024.35]
  - - [33168, 48, 1, 48]
    - [52, 2008.91]
  - - [22304, 32, 1, 32]
    - [74, 1369.26]
  - - [27040, 32, 1, 32]
    - [41, 1418.49]
  - - [35392, 64, 1, 64]
    - [111, 2445.44]
  - - [3168, 32, 1, 32]
    - [76, 436.026]
  - - [11424, 96, 1, 96]
    - [57, 2964.06]
  - - [8544, 96, 1, 96]
    - [92, 2488.67]
  - - [37296, 48, 1, 48]
    - [52, 2071.6]
  - - [37596, 30, 1, 36]
    - [40, 1240.94]
  - - [702, 66, 1, 66]
    - [76, 302.165]
  - - [14270, 66, 1, 66]
    - [58, 1674.57]
  - - [23640, 30, 1, 36]
    - [74, 1225.11]
  - - [8880, 48, 1, 48]
    - [37, 1346.02]
  - - [7834, 30, 1, 36]
    - [78, 721.904]
  - - [11584, 64, 1, 64]
    - [141, 2148.92]
  - - [20700, 30, 1, 36]
    - [74, 1166.81]
  - - [41856, 192, 1, 192]
    - [202, 4235.24]
  - - [17184, 32, 1, 32]
    - [37, 1221.97]
  - - [38144, 124, 1, 132]
    - [142, 3374.09]
  - - [12800, 128, 1, 128]
    - [196, 3141.33]
  - - [23392, 32, 1, 32]
    - [37, 1409.02]
  - - [10240, 124, 1, 132]
    - [141, 2963.37]
  - - [38240, 32, 1, 32]
    - [40, 1433.3]
  - - [43776, 124, 1, 132]
    - [146, 3436.91]
  - - [23184, 48, 1, 48]
    - [60, 2076.82]
  - - [22784, 128, 1, 128]
    - [145, 3444.93]
  - - [570, 58, 1, 66]
    - [37, 213.082]
  - - [41216, 58, 1, 66]
    - [115, 2099.19]
  - - [30768, 48, 1, 48]
    - [51, 2016.2]
  - - [24384, 64, 1, 64]
    - [171, 2457.6]
  - - [19676, 30, 1, 36]
    - [37, 1172.74]
  - - [3840, 66, 1, 66]
    - [124, 1219.17]
  - - [8704, 66, 1, 66]
    - [96, 1558.99]
  - - [20056, 30, 1, 36]
    - [37, 1159.55]
  - - [3360, 32, 1, 32]
    - [74, 455.111]
  - - [8448, 66, 1, 66]
    - [98, 1525.68]
  - - [33792, 124, 1, 132]
    - [142, 3323.17]
  - - [25696, 32, 1, 32]
    - [38, 1376.19]
  - - [29984, 32, 1, 32]
    - [46, 1421.46]
  - - [40894, 66, 1, 66]
    - [100, 1985.45]
  - - [42072, 30, 1, 36]
    - [45, 1259.36]
  - - [22128, 48, 1, 48]
    - [54, 2013.54]
  - - [18176, 66, 1, 66]
    - [60, 1748.56]
  - - [7168, 58, 1, 66]
    - [125, 1569.74]
  - - [2080, 32, 1, 32]
    - [37, 306.023]
  - - [37530, 30, 1, 36]
    - [45, 1238.77]
  - - [17920, 66, 1, 66]
    - [60, 1750.21]
  - - [33024, 48, 1, 48]
    - [52, 1993.9]
  - - [3160, 30, 1, 36]
    - [74, 398.692]
  - - [17632, 32, 1, 32]
    - [74, 1233.28]
  - - [14044, 30, 1, 36]
    - [37, 974.776]
  - - [24288, 32, 1, 32]
    - [40, 1403.55]
  - - [7248, 48, 1, 48]
    - [119, 1292.52]
  - - [38400, 30, 1, 36]
    - [76, 1250.66]
  - - [12288, 124, 1, 132]
    - [86, 3101.94]
  - - [36696, 30, 1, 36]
    - [40, 1215.7]
  - - [40192, 30, 1, 36]
    - [40, 1278.19]
  - - [39872, 64, 1, 64]
    - [118, 2613.89]
  - - [41520, 48, 1, 48]
    - [57, 2079.61]
  - - [15712, 32, 1, 32]
    - [37, 1200.68]
  - - [22656, 48, 1, 48]
    - [52, 2084.64]
  - - [9312, 96, 1, 96]
    - [96, 2702.12]
  - - [2780, 30, 1, 36]
    - [37, 360.865]
  - - [33120, 32, 1, 32]
    - [45, 1331.04]
  - - [20832, 96, 1, 96]
    - [98, 2935.59]
  - - [8928, 96, 1, 96]
    - [57, 2630.45]
  - - [24480, 32, 1, 32]
    - [37, 1421.06]
  - - [4160, 64, 1, 64]
    - [145, 1298.73]
  - - [10800, 48, 1, 48]
    - [51, 1502.61]
  - - [33280, 30, 1, 36]
    - [76, 1179.21]
  - - [25632, 32, 1, 32]
    - [44, 1364.2]
  - - [36864, 48, 1, 48]
    - [52, 2091.99]
  - - [26880, 192, 1, 192]
    - [190, 4100.75]
  - - [22528, 128, 1, 128]
    - [192, 3486.01]
  - - [22784, 58, 1, 66]
    - [117, 1938.16]
  - - [37696, 64, 1, 64]
    - [118, 2549.58]
  - - [18688, 66, 1, 66]
    - [57, 1800.99]
  - - [19200, 192, 1, 192]
    - [194, 3948.84]
  - - [5120, 30, 1, 36]
    - [74, 580.84]
  - - [13824, 128, 1, 128]
    - [192, 3278.7]
  - - [26368, 58, 1, 66]
    - [62, 1957.66]
  - - [19904, 64, 1, 64]
    - [191, 2213.0]
  - - [39680, 124, 1, 132]
    - [142, 3403.29]
  - - [9744, 48, 1, 48]
    - [40, 1465.42]
  - - [31488, 66, 1, 66]
    - [98, 1967.32]
  - - [31488, 128, 1, 128]
    - [194, 3574.69]
  - - [17086, 66, 1, 66]
    - [57, 1713.32]
  - - [32112, 48, 1, 48]
    - [51, 2043.81]
  - - [512, 30, 1, 36]
    - [67, 73.5319]
  - - [3642, 58, 1, 66]
    - [127, 1052.99]
  - - [24028, 30, 1, 36]
    - [74, 1221.76]
  - - [12192, 32, 1, 32]
    - [74, 1095.14]
  - - [43740, 30, 1, 36]
    - [76, 1265.79]
  - - [768, 58, 1, 66]
    - [37, 287.1]
  - - [14832, 48, 1, 48]
    - [51, 1779.84]
  - - [19488, 32, 1, 32]
    - [45, 1306.0]
  - - [384, 48, 1, 48]
    - [37, 107.895]
  - - [38810, 30, 1, 36]
    - [40, 1245.98]
  - - [41088, 48, 1, 48]
    - [52, 2101.84]
  - - [29024, 32, 1, 32]
    - [38, 1417.97]
  - - [26400, 96, 1, 96]
    - [160, 2983.11]
  - - [38298, 30, 1, 36]
    - [40, 1235.42]
  - - [6208, 64, 1, 64]
    - [173, 1699.73]
  - - [35898, 58, 1, 66]
    - [117, 2072.04]
  - - [16348, 30, 1, 36]
    - [37, 1028.9]
  - - [33312, 96, 1, 96]
    - [94, 3130.13]
  - - [26332, 30, 1, 36]
    - [75, 1211.18]
  - - [9692, 30, 1, 36]
    - [76, 817.762]
  - - [19456, 66, 1, 66]
    - [57, 1821.8]
  - - [9168, 48, 1, 48]
    - [45, 1386.03]
  - - [37120, 128, 1, 128]
    - [192, 3707.48]
  - - [29712, 48, 1, 48]
    - [51, 1987.7]
  - - [17920, 124, 1, 132]
    - [144, 3155.28]
  - - [29568, 48, 1, 48]
    - [51, 1996.62]
  - - [19712, 30, 1, 36]
    - [74, 1149.51]
  - - [43520, 128, 1, 128]
    - [146, 3700.6]
  - - [39168, 124, 1, 132]
    - [142, 3391.36]
  - - [4960, 32, 1, 32]
    - [40, 647.837]
  - - [19136, 64, 1, 64]
    - [194, 2214.15]
  - - [27968, 64, 1, 64]
    - [114, 2292.97]
  - - [3928, 30, 1, 36]
    - [37, 479.891]
  - - [12734, 66, 1, 66]
    - [59, 1568.7]
  - - [16448, 64, 1, 64]
    - [143, 2079.35]
  - - [432, 48, 1, 48]
    - [37, 118.491]
  - - [10942, 66, 1, 66]
    - [60, 1697.41]
  - - [37920, 32, 1, 32]
    - [40, 1419.23]
  - - [32960, 64, 1, 64]
    - [117, 2388.61]
  - - [3482, 30, 1, 36]
    - [76, 429.288]
  - - [37376, 124, 1, 132]
    - [142, 3376.97]
  - - [37472, 32, 1, 32]
    - [40, 1410.71]
  - - [12764, 30, 1, 36]
    - [74, 952.011]
  - - [30142, 66, 1, 66]
    - [98, 1935.42]
  - - [26176, 64, 1, 64]
    - [144, 2204.29]
  - - [24576, 30, 1, 36]
    - [37, 1261.51]
  - - [42688, 64, 1, 64]
    - [115, 2496.43]
  - - [20188, 30, 1, 36]
    - [37, 1167.19]
  - - [42496, 128, 1, 128]
    - [192, 3711.38]
  - - [11664, 48, 1, 48]
    - [51, 1577.1]
  - - [31386, 30, 1, 36]
    - [44, 1255.44]
  - - [27312, 48, 1, 48]
    - [134, 1893.11]
  - - [42840, 30, 1, 36]
    - [45, 1255.9]
  - - [24320, 30, 1, 36]
    - [37, 1234.29]
  - - [21440, 64, 1, 64]
    - [171, 2275.08]
  - - [3584, 66, 1, 66]
    - [124, 1175.6]
  - - [25728, 96, 1, 96]
    - [188, 2940.34]
  - - [672, 96, 1, 96]
    - [138, 519.56]
  - - [16640, 66, 1, 66]
    - [57, 1664.0]
  - - [4800, 64, 1, 64]
    - [124, 1467.22]
  - - [26814, 66, 1, 66]
    - [98, 1813.69]
  - - [40346, 30, 1, 36]
    - [45, 1262.27]
  - - [39644, 30, 1, 36]
    - [40, 1272.76]
  - - [11322, 58, 1, 66]
    - [80, 1833.36]
  - - [9882, 30, 1, 36]
    - [37, 839.038]
  - - [30624, 32, 1, 32]
    - [46, 1454.5]
  - - [42686, 66, 1, 66]
    - [98, 2003.67]
  - - [22896, 48, 1, 48]
    - [52, 2054.22]
  - - [25728, 192, 1, 192]
    - [195, 4112.2]
  - - [26368, 66, 1, 66]
    - [182, 1819.69]
  - - [7936, 58, 1, 66]
    - [124, 1687.72]
  - - [5536, 32, 1, 32]
    - [76, 687.969]
  - - [17760, 96, 1, 96]
    - [94, 2904.12]
  - - [19232, 32, 1, 32]
    - [45, 1309.41]
  - - [36096, 96, 1, 96]
    - [96, 3243.57]
  - - [43066, 58, 1, 66]
    - [118, 2088.91]
  - - [7000, 30, 1, 36]
    - [76, 692.308]
  - - [3648, 64, 1, 64]
    - [141, 1279.3]
  - - [30240, 32, 1, 32]
    - [44, 1428.31]
  - - [30720, 48, 1, 48]
    - [51, 2022.25]
  - - [41274, 58, 1, 66]
    - [113, 2094.34]
  - - [29184, 96, 1, 96]
    - [96, 3050.81]
  - - [24896, 64, 1, 64]
    - [146, 2184.53]
  - - [22236, 30, 1, 36]
    - [37, 1193.58]
  - - [1792, 30, 1, 36]
    - [40, 240.716]
  - - [928, 32, 1, 32]
    - [37, 131.982]
  - - [11088, 48, 1, 48]
    - [51, 1546.41]
  - - [43040, 32, 1, 32]
    - [40, 1444.07]
  - - [41808, 48, 1, 48]
    - [52, 2105.02]
  - - [32592, 48, 1, 48]
    - [51, 2078.96]
  - - [36506, 30, 1, 36]
    - [74, 1227.47]
  - - [3072, 128, 1, 128]
    - [127, 2383.13]
  - - [41114, 30, 1, 36]
    - [40, 1281.85]
  - - [19680, 32, 1, 32]
    - [45, 1315.43]
  - - [4576, 32, 1, 32]
    - [37, 582.814]
  - - [11740, 30, 1, 36]
    - [37, 913.487]
  - - [39904, 32, 1, 32]
    - [76, 1467.73]
  - - [40256, 64, 1, 64]
    - [172, 2594.22]
  - - [6528, 48, 1, 48]
    - [122, 1201.32]
  - - [32000, 124, 1, 132]
    - [142, 3315.04]
  - - [32640, 96, 1, 96]
    - [160, 3230.35]
  - - [5424, 48, 1, 48]
    - [119, 1073.62]
  - - [20224, 66, 1, 66]
    - [98, 1860.13]
  - - [24796, 30, 1, 36]
    - [46, 1148.36]
  - - [23712, 96, 1, 96]
    - [96, 3121.85]
  - - [14650, 58, 1, 66]
    - [62, 1923.19]
  - - [21920, 32, 1, 32]
    - [37, 1355.44]
  - - [13824, 192, 1, 192]
    - [199, 3821.3]
  - - [2688, 192, 1, 192]
    - [140, 3213.05]
  - - [768, 30, 1, 36]
    - [102, 107.44]
  - - [22016, 128, 1, 128]
    - [194, 3430.11]
  - - [15104, 124, 1, 132]
    - [64, 3025.24]
  - - [4368, 48, 1, 48]
    - [40, 938.794]
  - - [34800, 48, 1, 48]
    - [57, 2053.77]
  - - [31642, 30, 1, 36]
    - [38, 1261.94]
  - - [16128, 30, 1, 36]
    - [37, 1044.26]
  - - [8506, 58, 1, 66]
    - [45, 1499.12]
  - - [13984, 32, 1, 32]
    - [37, 1132.88]
  - - [27360, 96, 1, 96]
    - [160, 3052.66]
  - - [28032, 192, 1, 192]
    - [199, 4128.21]
  - - [14784, 64, 1, 64]
    - [142, 2232.86]
  - - [4832, 32, 1, 32]
    - [76, 618.496]
  - - [9456, 48, 1, 48]
    - [43, 1407.4]
  - - [38016, 192, 1, 192]
    - [199, 4229.31]
  - - [7008, 96, 1, 96]
    - [162, 2542.75]
  - - [28800, 48, 1, 48]
    - [51, 1974.86]
  - - [15168, 64, 1, 64]
    - [142, 2241.27]
  - - [24832, 58, 1, 66]
    - [46, 1898.1]
  - - [6976, 64, 1, 64]
    - [124, 1831.65]
  - - [476, 30, 1, 36]
    - [67, 69.0968]
  - - [18976, 32, 1, 32]
    - [76, 1291.98]
  - - [38078, 66, 1, 66]
    - [182, 1969.93]
  - - [28256, 32, 1, 32]
    - [38, 1438.08]
  - - [32256, 128, 1, 128]
    - [192, 3662.9]
  - - [22016, 124, 1, 132]
    - [142, 3204.89]
  - - [29600, 32, 1, 32]
    - [77, 1419.03]
  - - [7680, 124, 1, 132]
    - [64, 2961.98]
  - - [19968, 48, 1, 48]
    - [52, 2021.37]
  - - [29328, 48, 1, 48]
    - [185, 1975.78]
  - - [31744, 128, 1, 128]
    - [146, 3571.1]
  - - [19420, 30, 1, 36]
    - [45, 1152.4]
  - - [608, 32, 1, 32]
    - [37, 86.4711]
  - - [16896, 128, 1, 128]
    - [191, 3281.47]
  - - [24096, 96, 1, 96]
    - [94, 3165.18]
  - - [29904, 48, 1, 48]
    - [51, 2016.94]
  - - [35036, 30, 1, 36]
    - [80, 1198.95]
  - - [17152, 30, 1, 36]
    - [37, 1067.06]
  - - [6334, 66, 1, 66]
    - [45, 1385.09]
  - - [31200, 96, 1, 96]
    - [96, 3150.08]
  - - [22704, 48, 1, 48]
    - [52, 2018.13]
  - - [13344, 32, 1, 32]
    - [74, 1091.39]
  - - [7322, 30, 1, 36]
    - [40, 701.043]
  - - [3456, 96, 1, 96]
    - [124, 1904.93]
  - - [19968, 30, 1, 36]
    - [74, 1166.96]
  - - [31968, 32, 1, 32]
    - [44, 1464.01]
  - - [4096, 128, 1, 128]
    - [127, 2829.21]
  - - [40848, 48, 1, 48]
    - [57, 2133.13]
  - - [39066, 30, 1, 36]
    - [45, 1254.2]
  - - [34176, 48, 1, 48]
    - [60, 2025.24]
  - - [384, 192, 1, 192]
    - [119, 779.503]
  - - [31008, 32, 1, 32]
    - [77, 1440.66]
  - - [36256, 32, 1, 32]
    - [45, 1406.29]
  - - [15264, 32, 1, 32]
    - [37, 1194.98]
  - - [12432, 48, 1, 48]
    - [56, 1573.81]
  - - [40448, 66, 1, 66]
    - [98, 2002.18]
  - - [23706, 30, 1, 36]
    - [43, 1235.64]
  - - [14640, 48, 1, 48]
    - [51, 1790.37]
  - - [1280, 66, 1, 66]
    - [37, 548.787]
  - - [14080, 66, 1, 66]
    - [58, 1672.1]
  - - [800, 32, 1, 32]
    - [37, 116.364]
  - - [43824, 48, 1, 48]
    - [90, 2135.59]
  - - [17408, 124, 1, 132]
    - [148, 3090.39]
  - - [39648, 96, 1, 96]
    - [158, 3222.19]
  - - [11376, 48, 1, 48]
    - [56, 1538.16]
  - - [39424, 30, 1, 36]
    - [40, 1264.19]
  - - [43200, 64, 1, 64]
    - [118, 2509.18]
  - - [2560, 58, 1, 66]
    - [43, 827.676]
  - - [6048, 96, 1, 96]
    - [43, 2349.85]
  - - [31776, 96, 1, 96]
    - [96, 3197.03]
  - - [42624, 96, 1, 96]
    - [205, 3269.16]
  - - [8792, 30, 1, 36]
    - [37, 783.446]
  - - [8128, 64, 1, 64]
    - [176, 2010.4]
  - - [39936, 58, 1, 66]
    - [117, 2167.82]
  - - [20160, 64, 1, 64]
    - [191, 2222.16]
  - - [21468, 30, 1, 36]
    - [37, 1185.35]
  - - [28416, 48, 1, 48]
    - [59, 1943.9]
  - - [33856, 64, 1, 64]
    - [168, 2404.2]
  - - [14928, 48, 1, 48]
    - [51, 1837.29]
  - - [256, 124, 1, 132]
    - [119, 277.865]
  - - [44032, 128, 1, 128]
    - [195, 3720.2]
  - - [37248, 96, 1, 96]
    - [189, 3145.87]
  - - [21504, 96, 1, 96]
    - [96, 3035.86]
  - - [6368, 32, 1, 32]
    - [76, 741.004]
  - - [2268, 30, 1, 36]
    - [37, 300.176]
  - - [21504, 48, 1, 48]
    - [94, 2030.54]
  - - [15680, 64, 1, 64]
    - [146, 2230.04]
  - - [14848, 128, 1, 128]
    - [141, 3162.63]
  - - [6192, 48, 1, 48]
    - [119, 1180.99]
  - - [16896, 30, 1, 36]
    - [74, 1053.56]
  - - [28416, 66, 1, 66]
    - [98, 1884.59]
  - - [35328, 192, 1, 192]
    - [195, 4189.18]
  - - [8064, 48, 1, 48]
    - [119, 1370.17]
  - - [24576, 96, 1, 96]
    - [94, 3184.65]
  - - [17854, 66, 1, 66]
    - [98, 1711.53]
  - - [34048, 124, 1, 132]
    - [146, 3328.35]
  - - [14592, 192, 1, 192]
    - [190, 3887.83]
  - - [15104, 128, 1, 128]
    - [107, 3203.83]
  - - [14016, 64, 1, 64]
    - [79, 2218.3]
  - - [24576, 48, 1, 48]
    - [52, 2109.65]
  - - [4608, 30, 1, 36]
    - [40, 529.43]
  - - [6240, 32, 1, 32]
    - [76, 742.995]
  - - [17408, 66, 1, 66]
    - [57, 1745.61]
  - - [23104, 64, 1, 64]
    - [168, 2375.35]
  - - [23296, 124, 1, 132]
    - [142, 3170.18]
  - - [17424, 48, 1, 48]
    - [57, 1834.78]
  - - [28272, 48, 1, 48]
    - [58, 1924.9]
  - - [37536, 32, 1, 32]
    - [40, 1421.48]
  - - [15968, 32, 1, 32]
    - [37, 1181.45]
  - - [14080, 30, 1, 36]
    - [37, 1003.06]
  - - [25242, 30, 1, 36]
    - [75, 1171.02]
  - - [3130, 58, 1, 66]
    - [124, 930.252]
  - - [28928, 124, 1, 132]
    - [142, 3303.76]
  - - [9632, 32, 1, 32]
    - [37, 941.142]
  - - [44032, 30, 1, 36]
    - [40, 1264.75]
  - - [17372, 30, 1, 36]
    - [37, 1083.24]
  - - [8896, 64, 1, 64]
    - [204, 1745.12]
  - - [44016, 48, 1, 48]
    - [54, 2128.73]
  - - [20640, 32, 1, 32]
    - [43, 1320.96]
  - - [40858, 30, 1, 36]
    - [76, 1270.93]
  - - [27356, 30, 1, 36]
    - [77, 1220.85]
  - - [41472, 128, 1, 128]
    - [146, 3685.6]
  - - [25888, 32, 1, 32]
    - [41, 1377.82]
  - - [22976, 64, 1, 64]
    - [117, 2378.91]
  - - [36798, 66, 1, 66]
    - [182, 1938.7]
  - - [5120, 58, 1, 66]
    - [124, 1327.87]
  - - [21592, 30, 1, 36]
    - [74, 1184.93]
  - - [22512, 48, 1, 48]
    - [60, 2058.24]
  - - [22944, 96, 1, 96]
    - [96, 3091.4]
  - - [31200, 32, 1, 32]
    - [38, 1457.52]
  - - [8544, 32, 1, 32]
    - [37, 889.132]
  - - [9048, 30, 1, 36]
    - [74, 795.752]
  - - [10460, 30, 1, 36]
    - [37, 874.365]
  - - [16320, 64, 1, 64]
    - [116, 2305.06]
  - - [16608, 32, 1, 32]
    - [43, 1187.61]
  - - [36096, 124, 1, 132]
    - [146, 3359.22]
  - - [7744, 64, 1, 64]
    - [145, 1938.84]
  - - [31104, 192, 1, 192]
    - [195, 4155.02]
  - - [20192, 32, 1, 32]
    - [74, 1367.5]
  - - [27936, 32, 1, 32]
    - [46, 1441.86]
  - - [4352, 124, 1, 132]
    - [50, 2334.0]
  - - [41040, 48, 1, 48]
    - [52, 2077.24]
  - - [25872, 48, 1, 48]
    - [186, 1865.12]
  - - [39936, 128, 1, 128]
    - [195, 3689.18]
  - - [4448, 32, 1, 32]
    - [40, 569.344]
  - - [37888, 30, 1, 36]
    - [76, 1246.01]
  - - [17952, 32, 1, 32]
    - [80, 1238.74]
  - - [43344, 48, 1, 48]
    - [52, 2141.18]
  - - [36184, 30, 1, 36]
    - [40, 1207.62]
  - - [31840, 32, 1, 32]
    - [38, 1452.95]
  - - [9304, 30, 1, 36]
    - [37, 800.025]
  - - [4030, 66, 1, 66]
    - [127, 1239.74]
  - - [38846, 66, 1, 66]
    - [182, 1957.58]
  - - [20400, 48, 1, 48]
    - [94, 1974.86]
  - - [12222, 66, 1, 66]
    - [94, 1833.3]
  - - [16576, 64, 1, 64]
    - [145, 2092.95]
  - - [9114, 30, 1, 36]
    - [174, 750.238]
  - - [448, 64, 1, 64]
    - [37, 203.89]
  - - [20992, 124, 1, 132]
    - [146, 3113.42]
  - - [21088, 32, 1, 32]
    - [37, 1353.01]
  - - [18688, 58, 1, 66]
    - [45, 1898.56]
  - - [25052, 30, 1, 36]
    - [41, 1152.31]
  - - [27392, 128, 1, 128]
    - [194, 3569.76]
  - - [27504, 48, 1, 48]
    - [53, 1917.95]
  - - [26304, 64, 1, 64]
    - [144, 2233.44]
  - - [39388, 30, 1, 36]
    - [45, 1255.58]
  - - [21856, 32, 1, 32]
    - [37, 1364.67]
  - - [9600, 48, 1, 48]
    - [74, 1440.0]
  - - [26112, 128, 1, 128]
    - [146, 3477.07]
  - - [38656, 58, 1, 66]
    - [117, 2149.55]
  - - [40000, 64, 1, 64]
    - [115, 2590.77]
  - - [19344, 48, 1, 48]
    - [54, 1982.59]
  - - [34944, 192, 1, 192]
    - [195, 4155.94]
  - - [32688, 48, 1, 48]
    - [51, 2044.33]
  - - [26456, 30, 1, 36]
    - [75, 1204.57]
  - - [44252, 30, 1, 36]
    - [40, 1247.19]
  - - [17408, 128, 1, 128]
    - [144, 3330.37]
  - - [35232, 96, 1, 96]
    - [96, 3202.15]
  - - [9216, 66, 1, 66]
    - [94, 1637.23]
  - - [14496, 96, 1, 96]
    - [187, 2780.91]
  - - [28064, 32, 1, 32]
    - [41, 1425.47]
  - - [25600, 124, 1, 132]
    - [146, 3220.26]
  - - [23260, 30, 1, 36]
    - [37, 1219.46]
  - - [13626, 58, 1, 66]
    - [62, 1834.05]
  - - [32702, 66, 1, 66]
    - [99, 1964.28]
  - - [5018, 30, 1, 36]
    - [45, 576.536]
  - - [18176, 124, 1, 132]
    - [148, 3159.57]
  - - [24432, 48, 1, 48]
    - [54, 2097.29]
  - - [24218, 30, 1, 36]
    - [74, 1231.42]
  - - [3328, 58, 1, 66]
    - [43, 986.036]
  - - [10272, 96, 1, 96]
    - [94, 2774.52]
  - - [18272, 32, 1, 32]
    - [74, 1278.04]
  - - [16864, 32, 1, 32]
    - [45, 1209.3]
  - - [39168, 192, 1, 192]
    - [203, 4202.73]
  - - [2392, 30, 1, 36]
    - [37, 315.044]
  - - [6912, 96, 1, 96]
    - [209, 2519.82]
  - - [15360, 58, 1, 66]
    - [62, 1978.4]
  - - [25344, 58, 1, 66]
    - [62, 1894.86]
  - - [39936, 124, 1, 132]
    - [142, 3400.3]
  - - [15360, 66, 1, 66]
    - [56, 1742.4]
  - - [35774, 66, 1, 66]
    - [60, 1944.98]
  - - [336, 48, 1, 48]
    - [37, 94.4078]
  - - [34464, 96, 1, 96]
    - [206, 3144.75]
  - - [25680, 48, 1, 48]
    - [134, 1844.35]
  - - [30208, 124, 1, 132]
    - [142, 3316.64]
  - - [38108, 30, 1, 36]
    - [76, 1239.66]
  - - [29088, 96, 1, 96]
    - [94, 3068.62]
  - - [6112, 32, 1, 32]
    - [37, 748.647]
  - - [11228, 30, 1, 36]
    - [45, 889.021]
  - - [39264, 32, 1, 32]
    - [45, 1452.54]
  - - [43520, 124, 1, 132]
    - [146, 3424.03]
  - - [33504, 96, 1, 96]
    - [94, 3149.46]
  - - [20224, 124, 1, 132]
    - [172, 3206.38]
  - - [13104, 48, 1, 48]
    - [51, 1630.22]
  - - [1594, 58, 1, 66]
    - [37, 567.085]
  - - [34896, 48, 1, 48]
    - [52, 2051.03]
  - - [5822, 66, 1, 66]
    - [46, 1357.64]
  - - [4864, 128, 1, 128]
    - [146, 2631.83]
  - - [21280, 32, 1, 32]
    - [43, 1335.22]
  - - [26046, 66, 1, 66]
    - [98, 1773.86]
  - - [38928, 48, 1, 48]
    - [54, 2107.38]
  - - [33368, 30, 1, 36]
    - [45, 1190.14]
  - - [21504, 192, 1, 192]
    - [194, 4042.04]
  - - [23296, 128, 1, 128]
    - [145, 3421.31]
  - - [22208, 64, 1, 64]
    - [114, 2330.02]
  - - [38880, 32, 1, 32]
    - [45, 1457.29]
  - - [6400, 30, 1, 36]
    - [76, 652.075]
  - - [5632, 128, 1, 128]
    - [182, 2883.58]
  - - [24576, 58, 1, 66]
    - [86, 1998.24]
  - - [18592, 32, 1, 32]
    - [43, 1293.36]
  - - [12048, 48, 1, 48]
    - [90, 1610.13]
  - - [30960, 48, 1, 48]
    - [133, 2035.73]
  - - [43008, 30, 1, 36]
    - [45, 1256.73]
  - - [14976, 96, 1, 96]
    - [162, 2856.35]
  - - [29952, 58, 1, 66]
    - [99, 2043.06]
  - - [12090, 58, 1, 66]
    - [132, 1805.01]
  - - [2592, 96, 1, 96]
    - [127, 1579.89]
  - - [28704, 32, 1, 32]
    - [46, 1389.08]
  - - [19744, 32, 1, 32]
    - [37, 1330.12]
  - - [24960, 48, 1, 48]
    - [51, 1831.46]
  - - [30624, 96, 1, 96]
    - [94, 3133.11]
  - - [3168, 96, 1, 96]
    - [124, 1784.61]
  - - [23280, 48, 1, 48]
    - [57, 2044.1]
  - - [1280, 128, 1, 128]
    - [141, 1340.89]
  - - [38656, 66, 1, 66]
    - [182, 1967.12]
  - - [41120, 32, 1, 32]
    - [45, 1470.21]
  - - [8928, 32, 1, 32]
    - [74, 882.459]
  - - [1920, 48, 1, 48]
    - [37, 526.629]
  - - [39168, 48, 1, 48]
    - [52, 2138.46]
  - - [31440, 48, 1, 48]
    - [51, 2037.06]
  - - [44090, 58, 1, 66]
    - [98, 2107.6]
  - - [4416, 64, 1, 64]
    - [126, 1314.53]
  - - [8924, 30, 1, 36]
    - [44, 745.969]
  - - [19712, 66, 1, 66]
    - [98, 1848.96]
  - - [40928, 32, 1, 32]
    - [80, 1469.5]
  - - [4440, 30, 1, 36]
    - [80, 495.372]
  - - [15744, 48, 1, 48]
    - [51, 1873.67]
  - - [21792, 96, 1, 96]
    - [96, 3052.2]
  - - [11472, 48, 1, 48]
    - [51, 1569.57]
  - - [22560, 32, 1, 32]
    - [74, 1378.37]
  - - [29888, 64, 1, 64]
    - [116, 2413.67]
  - - [31632, 48, 1, 48]
    - [134, 2024.45]
  - - [42592, 32, 1, 32]
    - [76, 1469.48]
  - - [15360, 128, 1, 128]
    - [195, 3290.51]
  - - [9216, 96, 1, 96]
    - [57, 2732.78]
  - - [15584, 32, 1, 32]
    - [37, 1201.66]
  - - [32352, 96, 1, 96]
    - [160, 3203.22]
  - - [14432, 32, 1, 32]
    - [37, 1143.84]
  - - [10944, 64, 1, 64]
    - [146, 2106.51]
  - - [35808, 32, 1, 32]
    - [80, 1395.26]
  - - [30880, 32, 1, 32]
    - [38, 1442.57]
  - - [7870, 66, 1, 66]
    - [131, 1604.95]
  - - [25498, 30, 1, 36]
    - [46, 1172.82]
  - - [41728, 128, 1, 128]
    - [142, 3669.35]
  - - [32220, 30, 1, 36]
    - [44, 1257.14]
  - - [32512, 124, 1, 132]
    - [142, 3342.7]
  - - [24240, 48, 1, 48]
    - [52, 2083.92]
  - - [37376, 30, 1, 36]
    - [76, 1217.31]
  - - [10906, 30, 1, 36]
    - [45, 858.49]
  - - [12096, 64, 1, 64]
    - [145, 2192.27]
  - - [19152, 48, 1, 48]
    - [60, 1991.25]
  - - [7584, 96, 1, 96]
    - [56, 2671.79]
  - - [43232, 32, 1, 32]
    - [76, 1456.24]
  - - [43418, 30, 1, 36]
    - [80, 1263.24]
  - - [11776, 128, 1, 128]
    - [197, 3259.09]
  - - [21760, 66, 1, 66]
    - [98, 1939.17]
  - - [7776, 96, 1, 96]
    - [56, 2698.18]
  - - [43008, 124, 1, 132]
    - [142, 3403.38]
  - - [30522, 58, 1, 66]
    - [98, 2080.45]
  - - [7616, 64, 1, 64]
    - [145, 1954.58]
  - - [36576, 96, 1, 96]
    - [160, 3266.32]
  - - [13968, 48, 1, 48]
    - [51, 1726.52]
  - - [32800, 32, 1, 32]
    - [40, 1332.83]
  - - [15806, 66, 1, 66]
    - [56, 1765.41]
  - - [29232, 48, 1, 48]
    - [51, 1971.62]
  - - [8064, 192, 1, 192]
    - [198, 3807.27]
  - - [6912, 66, 1, 66]
    - [136, 1455.93]
  - - [1024, 66, 1, 66]
    - [37, 447.846]
  - - [27802, 30, 1, 36]
    - [38, 1234.63]
  - - [2976, 96, 1, 96]
    - [173, 1709.9]
  - - [30336, 192, 1, 192]
    - [202, 4184.65]
  - - [16442, 58, 1, 66]
    - [45, 1760.07]
  - - [16128, 96, 1, 96]
    - [162, 2965.6]
  - - [37856, 32, 1, 32]
    - [45, 1431.48]
  - - [24480, 96, 1, 96]
    - [96, 3161.54]
  - - [22368, 32, 1, 32]
    - [43, 1366.64]
  - - [16512, 96, 1, 96]
    - [94, 2780.97]
  - - [22682, 30, 1, 36]
    - [37, 1205.54]
  - - [41904, 48, 1, 48]
    - [52, 2066.5]
  - - [29148, 30, 1, 36]
    - [38, 1205.2]
  - - [33504, 32, 1, 32]
    - [76, 1354.98]
  - - [37392, 48, 1, 48]
    - [52, 2107.42]
  - - [26368, 124, 1, 132]
    - [142, 3239.2]
  - - [624, 48, 1, 48]
    - [37, 173.635]
  - - [2048, 58, 1, 66]
    - [119, 725.902]
  - - [12832, 32, 1, 32]
    - [37, 1073.53]
  - - [36288, 64, 1, 64]
    - [117, 2477.26]
  - - [31488, 58, 1, 66]
    - [98, 2099.93]
  - - [4320, 32, 1, 32]
    - [37, 573.016]
  - - [6232, 30, 1, 36]
    - [43, 647.169]
  - - [5568, 64, 1, 64]
    - [145, 1606.09]
  - - [23552, 58, 1, 66]
    - [47, 1978.86]
  - - [3776, 64, 1, 64]
    - [141, 1315.18]
  - - [7296, 96, 1, 96]
    - [162, 2610.25]
  - - [32512, 58, 1, 66]
    - [98, 2118.04]
  - - [25504, 32, 1, 32]
    - [77, 1365.9]
  - - [13056, 124, 1, 132]
    - [142, 2933.84]
  - - [10320, 48, 1, 48]
    - [51, 1467.73]
  - - [18110, 66, 1, 66]
    - [98, 1745.29]
  - - [35006, 66, 1, 66]
    - [57, 1926.3]
  - - [42464, 32, 1, 32]
    - [40, 1467.04]
  - - [8704, 124, 1, 132]
    - [69, 2926.6]
  - - [19680, 96, 1, 96]
    - [94, 3041.09]
  - - [26496, 192, 1, 192]
    - [199, 4172.72]
  - - [36096, 58, 1, 66]
    - [171, 2082.21]
  - - [10720, 32, 1, 32]
    - [37, 1008.94]
  - - [1760, 32, 1, 32]
    - [40, 248.928]
  - - [9948, 30, 1, 36]
    - [37, 836.748]
  - - [31712, 32, 1, 32]
    - [44, 1460.12]
  - - [44288, 128, 1, 128]
    - [146, 3704.39]
  - - [31708, 30, 1, 36]
    - [75, 1255.3]
  - - [19258, 58, 1, 66]
    - [45, 1933.88]
  - - [42460, 30, 1, 36]
    - [40, 1276.64]
  - - [36928, 64, 1, 64]
    - [118, 2507.58]
  - - [1584, 48, 1, 48]
    - [40, 430.37]
  - - [13056, 192, 1, 192]
    - [193, 3881.42]
  - - [28570, 30, 1, 36]
    - [44, 1236.2]
  - - [23520, 96, 1, 96]
    - [94, 3156.09]
  - - [23040, 96, 1, 96]
    - [96, 3139.22]
  - - [21050, 58, 1, 66]
    - [43, 1909.46]
  - - [43808, 32, 1, 32]
    - [40, 1465.99]
  - - [9984, 192, 1, 192]
    - [105, 3679.03]
  - - [14304, 32, 1, 32]
    - [74, 1144.32]
  - - [8192, 30, 1, 36]
    - [37, 752.327]
  - - [35136, 64, 1, 64]
    - [117, 2449.24]
  - - [40668, 30, 1, 36]
    - [76, 1233.75]
  - - [26912, 32, 1, 32]
    - [41, 1408.89]
  - - [9952, 32, 1, 32]
    - [37, 972.409]
  - - [12816, 48, 1, 48]
    - [89, 1625.99]
  - - [42336, 32, 1, 32]
    - [40, 1462.62]
  - - [36720, 48, 1, 48]
    - [52, 2094.13]
  - - [3072, 30, 1, 36]
    - [45, 389.408]
  - - [6714, 58, 1, 66]
    - [124, 1515.4]
  - - [7072, 32, 1, 32]
    - [37, 815.51]
  - - [25088, 128, 1, 128]
    - [146, 3437.95]
  - - [13056, 58, 1, 66]
    - [62, 1810.81]
  - - [6592, 64, 1, 64]
    - [145, 1785.77]
  - - [11520, 58, 1, 66]
    - [147, 1719.91]
  - - [1920, 96, 1, 96]
    - [139, 1304.92]
  - - [5616, 48, 1, 48]
    - [119, 1119.31]
  - - [36410, 58, 1, 66]
    - [117, 2104.13]
  - - [13920, 32, 1, 32]
    - [37, 1117.09]
  - - [28192, 32, 1, 32]
    - [41, 1446.32]
  - - [30720, 66, 1, 66]
    - [100, 1945.0]
  - - [13376, 64, 1, 64]
    - [192, 2075.31]
  - - [19584, 96, 1, 96]
    - [94, 3046.69]
  - - [8288, 32, 1, 32]
    - [119, 855.535]
  - - [3808, 32, 1, 32]
    - [40, 513.078]
  - - [32856, 30, 1, 36]
    - [40, 1189.16]
  - - [5888, 124, 1, 132]
    - [84, 2858.09]
  - - [33280, 58, 1, 66]
    - [171, 1990.56]
  - - [28176, 48, 1, 48]
    - [133, 1950.65]
  - - [37728, 96, 1, 96]
    - [182, 3141.5]
  - - [8832, 96, 1, 96]
    - [90, 2622.28]
  - - [42204, 30, 1, 36]
    - [80, 1253.58]
  - - [38784, 192, 1, 192]
    - [199, 4289.89]
  - - [39132, 30, 1, 36]
    - [76, 1254.83]
  - - [37632, 48, 1, 48]
    - [52, 2112.67]
  - - [23776, 32, 1, 32]
    - [40, 1396.02]
  - - [34392, 30, 1, 36]
    - [40, 1178.41]
  - - [12128, 32, 1, 32]
    - [37, 1085.58]
  - - [30778, 58, 1, 66]
    - [101, 2068.44]
  - - [32958, 66, 1, 66]
    - [57, 1920.35]
  - - [42768, 48, 1, 48]
    - [90, 2123.65]
  - - [19800, 30, 1, 36]
    - [37, 1152.16]
  - - [15456, 32, 1, 32]
    - [74, 1188.21]
  - - [10584, 30, 1, 36]
    - [74, 860.747]
  - - [3518, 66, 1, 66]
    - [124, 1130.12]
  - - [25088, 58, 1, 66]
    - [62, 1890.49]
  - - [35904, 64, 1, 64]
    - [117, 2465.84]
  - - [288, 96, 1, 96]
    - [119, 224.173]
  - - [15792, 48, 1, 48]
    - [51, 1856.37]
  - - [3262, 66, 1, 66]
    - [43, 1057.24]
  - - [40704, 66, 1, 66]
    - [98, 1996.7]
  - - [40960, 66, 1, 66]
    - [100, 2002.04]
  - - [6554, 30, 1, 36]
    - [40, 655.4]
  - - [25584, 48, 1, 48]
    - [136, 1830.61]
  - - [13568, 124, 1, 132]
    - [148, 3012.49]
  - - [26592, 32, 1, 32]
    - [41, 1412.36]
  - - [21914, 30, 1, 36]
    - [37, 1180.99]
  - - [35226, 30, 1, 36]
    - [40, 1194.85]
  - - [15808, 64, 1, 64]
    - [116, 2254.51]
  - - [5856, 32, 1, 32]
    - [76, 724.22]
  - - [32640, 192, 1, 192]
    - [202, 4222.49]
  - - [14736, 48, 1, 48]
    - [52, 1790.7]
  - - [40992, 32, 1, 32]
    - [45, 1453.46]
  - - [25952, 32, 1, 32]
    - [44, 1375.51]
  - - [7648, 32, 1, 32]
    - [40, 836.704]
  - - [31920, 48, 1, 48]
    - [137, 2022.65]
  - - [38736, 48, 1, 48]
    - [57, 2116.88]
  - - [35738, 30, 1, 36]
    - [45, 1203.15]
  - - [17722, 58, 1, 66]
    - [43, 1833.51]
  - - [6656, 66, 1, 66]
    - [59, 1441.03]
  - - [32, 32, 1, 32]
    - [138, 4.13737]
  - - [3072, 48, 1, 48]
    - [37, 766.005]
  - - [41728, 124, 1, 132]
    - [146, 3415.71]
  - - [9216, 124, 1, 132]
    - [70, 2978.82]
  - - [1120, 32, 1, 32]
    - [74, 161.079]
  - - [9018, 58, 1, 66]
    - [130, 1516.74]
  - - [16896, 96, 1, 96]
    - [94, 2714.67]
  - - [41696, 32, 1, 32]
    - [45, 1454.25]
  - - [4250, 30, 1, 36]
    - [37, 503.289]
  - - [13680, 48, 1, 48]
    - [89, 1698.21]
  - - [11008, 58, 1, 66]
    - [141, 1701.88]
  - - [14240, 32, 1, 32]
    - [37, 1153.62]
  - - [37584, 48, 1, 48]
    - [52, 2093.65]
  - - [36320, 32, 1, 32]
    - [76, 1404.52]
  - - [6144, 96, 1, 96]
    - [44, 2449.1]
  - - [28218, 58, 1, 66]
    - [63, 2003.31]
  - - [5976, 30, 1, 36]
    - [40, 635.244]
  - - [26064, 48, 1, 48]
    - [133, 1855.73]
  - - [13056, 128, 1, 128]
    - [142, 3147.58]
  - - [23072, 32, 1, 32]
    - [43, 1383.24]
  - - [11616, 32, 1, 32]
    - [37, 1073.54]
  - - [34560, 30, 1, 36]
    - [76, 1193.25]
  - - [2400, 32, 1, 32]
    - [76, 343.24]
  - - [1472, 64, 1, 64]
    - [119, 633.331]
  - - [21248, 124, 1, 132]
    - [146, 3138.87]
  - - [1872, 48, 1, 48]
    - [37, 511.029]
  - - [35386, 58, 1, 66]
    - [115, 2035.12]
  - - [24912, 48, 1, 48]
    - [53, 1807.22]
  - - [42816, 64, 1, 64]
    - [169, 2479.84]
  - - [21724, 30, 1, 36]
    - [37, 1209.38]
  - - [1920, 192, 1, 192]
    - [124, 2644.95]
  - - [42784, 32, 1, 32]
    - [45, 1462.31]
  - - [2304, 124, 1, 132]
    - [45, 1792.39]
  - - [11744, 32, 1, 32]
    - [37, 1062.35]
  - - [6620, 30, 1, 36]
    - [43, 662.0]
  - - [36864, 128, 1, 128]
    - [146, 3654.29]
  - - [27450, 58, 1, 66]
    - [64, 1934.44]
  - - [14976, 48, 1, 48]
    - [51, 1819.87]
  - - [8496, 48, 1, 48]
    - [45, 1291.21]
  - - [29152, 32, 1, 32]
    - [38, 1416.11]
  - - [5120, 128, 1, 128]
    - [142, 2723.57]
  - - [1056, 96, 1, 96]
    - [119, 816.451]
  - - [40762, 58, 1, 66]
    - [118, 2185.39]
  - - [9662, 66, 1, 66]
    - [64, 1670.15]
  - - [16984, 30, 1, 36]
    - [37, 1039.84]
  - - [16896, 192, 1, 192]
    - [194, 3909.46]
  - - [36864, 30, 1, 36]
    - [45, 1212.34]
  - - [22496, 32, 1, 32]
    - [40, 1381.05]
  - - [7936, 30, 1, 36]
    - [43, 719.034]
  - - [16092, 30, 1, 36]
    - [37, 1041.93]
  - - [41984, 66, 1, 66]
    - [98, 2012.35]
  - - [18144, 32, 1, 32]
    - [76, 1258.77]
  - - [34048, 30, 1, 36]
    - [78, 1186.19]
  - - [30808, 30, 1, 36]
    - [44, 1237.82]
  - - [19728, 48, 1, 48]
    - [60, 1979.67]
  - - [20512, 32, 1, 32]
    - [37, 1303.0]
  - - [20976, 48, 1, 48]
    - [54, 1977.44]
  - - [27488, 32, 1, 32]
    - [77, 1284.11]
  - - [7482, 58, 1, 66]
    - [124, 1634.77]
  - - [8864, 32, 1, 32]
    - [119, 904.057]
  - - [25568, 32, 1, 32]
    - [44, 1360.79]
  - - [5664, 96, 1, 96]
    - [159, 2223.14]
  - - [22336, 64, 1, 64]
    - [117, 2348.26]
  - - [21248, 58, 1, 66]
    - [45, 1896.86]
  - - [12528, 48, 1, 48]
    - [51, 1572.14]
  - - [16062, 66, 1, 66]
    - [58, 1794.0]
  - - [11616, 96, 1, 96]
    - [96, 2993.65]
  - - [3744, 32, 1, 32]
    - [40, 509.821]
  - - [20736, 30, 1, 36]
    - [37, 1186.17]
  - - [8416, 32, 1, 32]
    - [37, 865.259]
  - - [5952, 64, 1, 64]
    - [124, 1712.04]
  - - [24544, 32, 1, 32]
    - [37, 1428.01]
  - - [36608, 58, 1, 66]
    - [171, 2087.83]
  - - [28672, 66, 1, 66]
    - [98, 1879.82]
  - - [720, 48, 1, 48]
    - [37, 200.348]
  - - [21648, 48, 1, 48]
    - [60, 2027.52]
  - - [26112, 124, 1, 132]
    - [146, 3211.62]
  - - [14208, 192, 1, 192]
    - [199, 3906.36]
  - - [35072, 58, 1, 66]
    - [117, 2054.09]
  - - [7776, 32, 1, 32]
    - [76, 836.41]
  - - [36864, 192, 1, 192]
    - [199, 4253.64]
  - - [10240, 58, 1, 66]
    - [60, 1596.04]
  - - [23648, 32, 1, 32]
    - [43, 1391.7]
  - - [13502, 66, 1, 66]
    - [56, 1628.31]
  - - [42960, 48, 1, 48]
    - [52, 2144.28]
  - - [13488, 48, 1, 48]
    - [51, 1656.52]
  - - [31872, 192, 1, 192]
    - [200, 4162.29]
  - - [38400, 58, 1, 66]
    - [117, 2135.32]
  - - [10394, 30, 1, 36]
    - [74, 845.295]
  - - [12352, 64, 1, 64]
    - [81, 2001.34]
  - - [41792, 64, 1, 64]
    - [116, 2509.98]
  - - [37084, 30, 1, 36]
    - [80, 1227.04]
  - - [22528, 66, 1, 66]
    - [57, 1890.06]
  - - [10496, 58, 1, 66]
    - [83, 1693.87]
  - - [38334, 66, 1, 66]
    - [182, 1963.58]
  - - [40736, 32, 1, 32]
    - [40, 1456.48]
  - - [11264, 128, 1, 128]
    - [197, 3181.89]
  - - [27424, 32, 1, 32]
    - [79, 1395.73]
  - - [31934, 66, 1, 66]
    - [100, 1968.09]
  - - [27168, 96, 1, 96]
    - [163, 3054.91]
  - - [28380, 30, 1, 36]
    - [75, 1233.91]
  - - [37888, 66, 1, 66]
    - [98, 1935.27]
  - - [23424, 96, 1, 96]
    - [96, 3159.77]
  - - [9370, 30, 1, 36]
    - [74, 793.072]
  - - [25392, 48, 1, 48]
    - [189, 1810.12]
  - - [21760, 30, 1, 36]
    - [37, 1196.58]
  - - [4352, 66, 1, 66]
    - [124, 1305.6]
  - - [14592, 66, 1, 66]
    - [58, 1694.1]
  - - [36440, 30, 1, 36]
    - [43, 1210.18]
  - - [7968, 32, 1, 32]
    - [40, 860.679]
  - - [35994, 30, 1, 36]
    - [45, 1211.77]
  - - [40752, 48, 1, 48]
    - [54, 2114.7]
  - - [17210, 58, 1, 66]
    - [45, 1823.92]
  - - [21504, 128, 1, 128]
    - [145, 3407.36]
  - - [17120, 32, 1, 32]
    - [74, 1224.22]
  - - [38816, 32, 1, 32]
    - [76, 1448.53]
  - - [14448, 48, 1, 48]
    - [51, 1763.15]
  - - [34560, 66, 1, 66]
    - [57, 1863.16]
  - - [1536, 58, 1, 66]
    - [37, 563.2]
  - - [4512, 96, 1, 96]
    - [124, 2235.62]
  - - [41760, 32, 1, 32]
    - [45, 1462.46]
  - - [28896, 96, 1, 96]
    - [96, 3063.8]
  - - [20794, 58, 1, 66]
    - [45, 1909.78]
  - - [34144, 32, 1, 32]
    - [45, 1357.28]
  - - [7768, 30, 1, 36]
    - [76, 706.182]
  - - [21248, 128, 1, 128]
    - [145, 3366.8]
  - - [40704, 192, 1, 192]
    - [200, 4257.02]
  - - [33088, 64, 1, 64]
    - [117, 2396.19]
  - - [15770, 30, 1, 36]
    - [37, 1013.79]
  - - [39936, 66, 1, 66]
    - [98, 1981.34]
  - - [15312, 48, 1, 48]
    - [51, 1856.78]
  - - [5712, 48, 1, 48]
    - [124, 1130.62]
  - - [18464, 32, 1, 32]
    - [37, 1295.01]
  - - [3024, 48, 1, 48]
    - [37, 754.036]
  - - [19104, 32, 1, 32]
    - [76, 1297.25]
  - - [37786, 30, 1, 36]
    - [45, 1235.14]
  - - [19712, 58, 1, 66]
    - [45, 1934.81]
  - - [31296, 64, 1, 64]
    - [117, 2484.27]
  - - [5344, 32, 1, 32]
    - [37, 667.348]
  - - [37776, 48, 1, 48]
    - [52, 2112.52]
  - - [1244, 30, 1, 36]
    - [74, 171.367]
  - - [33244, 30, 1, 36]
    - [74, 1179.48]
  - - [19552, 32, 1, 32]
    - [45, 1324.16]
  - - [40224, 32, 1, 32]
    - [45, 1462.69]
  - - [2784, 32, 1, 32]
    - [74, 395.947]
  - - [21552, 48, 1, 48]
    - [54, 1983.06]
  - - [42016, 32, 1, 32]
    - [40, 1455.49]
  - - [32732, 30, 1, 36]
    - [38, 1250.02]
  - - [37344, 32, 1, 32]
    - [80, 1399.72]
  - - [33792, 192, 1, 192]
    - [195, 4169.6]
  - - [31576, 30, 1, 36]
    - [44, 1257.45]
  - - [22752, 96, 1, 96]
    - [94, 3129.59]
  - - [22842, 58, 1, 66]
    - [45, 1932.78]
  - - [5376, 192, 1, 192]
    - [107, 3640.35]
  - - [41504, 32, 1, 32]
    - [40, 1433.88]
  - - [3584, 30, 1, 36]
    - [74, 439.855]
  - - [26010, 30, 1, 36]
    - [44, 1186.27]
  - - [42810, 58, 1, 66]
    - [98, 2073.34]
  - - [27712, 64, 1, 64]
    - [116, 2295.88]
  - - [20496, 48, 1, 48]
    - [52, 1954.59]
  - - [32880, 48, 1, 48]
    - [90, 1997.77]
  - - [23354, 58, 1, 66]
    - [168, 1958.79]
  - - [10496, 30, 1, 36]
    - [37, 866.642]
  - - [39504, 48, 1, 48]
    - [90, 2130.55]
  - - [38112, 32, 1, 32]
    - [76, 1416.06]
  - - [37008, 48, 1, 48]
    - [52, 2108.47]
  - - [14394, 58, 1, 66]
    - [64, 1889.58]
  - - [4512, 32, 1, 32]
    - [40, 577.536]
  - - [30464, 128, 1, 128]
    - [146, 3567.2]
  - - [41664, 64, 1, 64]
    - [115, 2511.12]
  - - [992, 32, 1, 32]
    - [37, 139.534]
  - - [42672, 48, 1, 48]
    - [94, 2104.37]
  - - [11776, 58, 1, 66]
    - [131, 1803.14]
  - - [8448, 96, 1, 96]
    - [94, 2498.61]
  - - [1008, 48, 1, 48]
    - [37, 276.48]
  - - [24254, 66, 1, 66]
    - [57, 1946.4]
  - - [2912, 32, 1, 32]
    - [76, 398.648]
  - - [41816, 30, 1, 36]
    - [40, 1264.31]
  - - [43228, 30, 1, 36]
    - [40, 1256.36]
  - - [24128, 64, 1, 64]
    - [168, 2429.41]
  - - [10816, 64, 1, 64]
    - [141, 2117.7]
  - - [27168, 32, 1, 32]
    - [38, 1422.29]
  - - [32736, 32, 1, 32]
    - [38, 1475.43]
  - - [40960, 124, 1, 132]
    - [142, 3397.01]
  - - [28058, 30, 1, 36]
    - [38, 1241.91]
  - - [29184, 30, 1, 36]
    - [44, 1208.54]
  - - [40704, 48, 1, 48]
    - [52, 2127.54]
  - - [33624, 30, 1, 36]
    - [78, 1179.02]
  - - [39408, 48, 1, 48]
    - [90, 2147.49]
  - - [35160, 30, 1, 36]
    - [40, 1201.67]
  - - [11520, 124, 1, 132]
    - [88, 2972.25]
  - - [27392, 30, 1, 36]
    - [44, 1230.59]
  - - [36624, 48, 1, 48]
    - [90, 2078.37]
  - - [31392, 32, 1, 32]
    - [41, 1455.86]
  - - [34304, 124, 1, 132]
    - [146, 3331.09]
  - - [922, 30, 1, 36]
    - [37, 129.656]
  - - [31166, 66, 1, 66]
    - [100, 1962.97]
  - - [18848, 32, 1, 32]
    - [40, 1286.69]
  - - [3424, 32, 1, 32]
    - [40, 466.247]
  - - [43776, 66, 1, 66]
    - [182, 1973.18]
  - - [9816, 30, 1, 36]
    - [74, 830.821]
  - - [7102, 66, 1, 66]
    - [57, 1456.51]
  - - [35584, 58, 1, 66]
    - [184, 2098.21]
  - - [864, 32, 1, 32]
    - [37, 124.963]
  - - [10686, 66, 1, 66]
    - [64, 1755.21]
  - - [8090, 30, 1, 36]
    - [40, 728.1]
  - - [960, 64, 1, 64]
    - [119, 431.158]
  - - [20352, 48, 1, 48]
    - [90, 2021.16]
  - - [42944, 64, 1, 64]
    - [118, 2507.11]
  - - [14880, 96, 1, 96]
    - [162, 2842.75]
  - - [3840, 128, 1, 128]
    - [127, 2754.58]
  - - [43162, 30, 1, 36]
    - [40, 1265.34]
  - - [36572, 30, 1, 36]
    - [40, 1214.57]
  - - [13312, 66, 1, 66]
    - [56, 1610.75]
  - - [96, 96, 1, 96]
    - [138, 74.7243]
  - - [23456, 32, 1, 32]
    - [40, 1389.99]
  - - [10128, 48, 1, 48]
    - [76, 1499.67]
  - - [24608, 32, 1, 32]
    - [38, 1354.76]
  - - [31152, 48, 1, 48]
    - [51, 2011.61]
  - - [2688, 96, 1, 96]
    - [127, 1638.4]
  - - [19354, 30, 1, 36]
    - [74, 1145.96]
  - - [12288, 66, 1, 66]
    - [60, 1866.34]
  - - [5280, 96, 1, 96]
    - [178, 2472.59]
  - - [38448, 48, 1, 48]
    - [54, 2095.18]
  - - [28032, 96, 1, 96]
    - [157, 3121.59]
  - - [28416, 30, 1, 36]
    - [44, 1233.49]
  - - [3898, 58, 1, 66]
    - [127, 1090.76]
  - - [18336, 96, 1, 96]
    - [94, 2931.72]
  - - [5530, 30, 1, 36]
    - [40, 611.926]
  - - [2928, 48, 1, 48]
    - [78, 694.044]
  - - [15392, 32, 1, 32]
    - [37, 1152.15]
  - - [37566, 66, 1, 66]
    - [182, 1945.29]
  - - [6400, 58, 1, 66]
    - [124, 1512.3]
  - - [1184, 32, 1, 32]
    - [37, 171.245]
  - - [42576, 48, 1, 48]
    - [54, 2117.77]
  - - [19264, 64, 1, 64]
    - [145, 2221.43]
  - - [14944, 32, 1, 32]
    - [37, 1180.76]
  - - [1368, 30, 1, 36]
    - [37, 184.68]
  - - [23128, 30, 1, 36]
    - [37, 1214.89]
  - - [42174, 66, 1, 66]
    - [100, 2012.6]
  - - [33344, 64, 1, 64]
    - [114, 2401.14]
  - - [28636, 30, 1, 36]
    - [38, 1233.13]
  - - [36352, 128, 1, 128]
    - [192, 3706.7]
  - - [16672, 32, 1, 32]
    - [37, 1188.87]
  - - [42496, 66, 1, 66]
    - [98, 2006.86]
  - - [15696, 48, 1, 48]
    - [51, 1841.32]
  - - [33984, 64, 1, 64]
    - [117, 2416.64]
  - - [36432, 48, 1, 48]
    - [52, 2090.12]
  - - [26432, 64, 1, 64]
    - [144, 2251.78]
  - - [38876, 30, 1, 36]
    - [40, 1252.57]
  - - [31968, 96, 1, 96]
    - [162, 3174.75]
  - - [25760, 32, 1, 32]
    - [41, 1368.17]
  - - [9184, 32, 1, 32]
    - [40, 897.368]
  - - [10204, 30, 1, 36]
    - [119, 837.41]
  - - [42000, 48, 1, 48]
    - [52, 2092.73]
  - - [27034, 30, 1, 36]
    - [77, 1218.56]
  - - [15648, 32, 1, 32]
    - [119, 1134.81]
  - - [37216, 32, 1, 32]
    - [76, 1417.75]
  - - [37632, 192, 1, 192]
    - [200, 4232.57]
  - - [3888, 48, 1, 48]
    - [37, 899.393]
  - - [36608, 66, 1, 66]
    - [60, 1955.18]
  - - [12768, 32, 1, 32]
    - [37, 1071.67]
  - - [11520, 128, 1, 128]
    - [193, 3173.23]
  - - [41952, 96, 1, 96]
    - [155, 3239.2]
  - - [38304, 32, 1, 32]
    - [45, 1439.92]
  - - [24576, 192, 1, 192]
    - [202, 4156.59]
  - - [15840, 96, 1, 96]
    - [58, 2921.97]
  - - [5376, 30, 1, 36]
    - [37, 597.333]
  - - [25600, 66, 1, 66]
    - [182, 1790.52]
  - - [26112, 96, 1, 96]
    - [179, 2976.85]
  - - [13246, 66, 1, 66]
    - [56, 1600.99]
  - - [15120, 48, 1, 48]
    - [51, 1814.4]
  - - [1536, 48, 1, 48]
    - [37, 419.306]
  - - [35568, 48, 1, 48]
    - [52, 2065.24]
  - - [22360, 30, 1, 36]
    - [43, 1224.58]
  - - [39424, 58, 1, 66]
    - [117, 2142.46]
  - - [32736, 96, 1, 96]
    - [163, 3221.86]
  - - [6970, 58, 1, 66]
    - [145, 1453.22]
  - - [25152, 64, 1, 64]
    - [146, 2199.46]
  - - [160, 32, 1, 32]
    - [74, 23.6763]
  - - [20480, 58, 1, 66]
    - [45, 1981.74]
  - - [34494, 66, 1, 66]
    - [184, 1884.8]
  - - [28832, 32, 1, 32]
    - [75, 1397.92]
  - - [22272, 124, 1, 132]
    - [142, 3235.25]
  - - [35548, 30, 1, 36]
    - [37, 1204.26]
  - - [37690, 58, 1, 66]
    - [117, 2135.54]
  - - [32192, 64, 1, 64]
    - [117, 2531.84]
  - - [29784, 30, 1, 36]
    - [44, 1231.5]
  - - [14064, 48, 1, 48]
    - [89, 1694.74]
  - - [34048, 128, 1, 128]
    - [146, 3598.06]
  - - [11520, 48, 1, 48]
    - [57, 1595.08]
  - - [19488, 96, 1, 96]
    - [96, 3042.03]
  - - [16608, 96, 1, 96]
    - [94, 2803.28]
  - - [40126, 66, 1, 66]
    - [184, 1991.67]
  - - [3392, 64, 1, 64]
    - [141, 1206.04]
  - - [3292, 30, 1, 36]
    - [37, 411.5]
  - - [35360, 32, 1, 32]
    - [76, 1384.12]
  - - [36000, 32, 1, 32]
    - [40, 1407.02]
  - - [44160, 96, 1, 96]
    - [160, 3333.71]
  - - [20224, 58, 1, 66]
    - [45, 1939.32]
  - - [28512, 32, 1, 32]
    - [75, 1439.66]
  - - [27104, 32, 1, 32]
    - [38, 1418.94]
  - - [17152, 124, 1, 132]
    - [144, 3067.57]
  - - [8192, 124, 1, 132]
    - [62, 3061.34]
  - - [14906, 58, 1, 66]
    - [62, 1943.47]
  - - [23040, 48, 1, 48]
    - [52, 2106.51]
  - - [17808, 48, 1, 48]
    - [52, 1854.87]
  - - [9728, 124, 1, 132]
    - [145, 2886.66]
  - - [27584, 64, 1, 64]
    - [114, 2268.76]
  - - [36096, 48, 1, 48]
    - [90, 2072.91]
  - - [16848, 48, 1, 48]
    - [90, 1797.12]
  - - [2784, 96, 1, 96]
    - [122, 1607.6]
  - - [43712, 64, 1, 64]
    - [118, 2534.6]
  - - [43674, 30, 1, 36]
    - [40, 1263.88]
  - - [19776, 64, 1, 64]
    - [141, 2210.77]
  - - [21888, 192, 1, 192]
    - [199, 4016.73]
  - - [2750, 66, 1, 66]
    - [45, 947.706]
  - - [23264, 32, 1, 32]
    - [45, 1385.02]
  - - [34458, 30, 1, 36]
    - [78, 1155.73]
  - - [2736, 48, 1, 48]
    - [40, 691.2]
  - - [36096, 128, 1, 128]
    - [194, 3633.56]
  - - [32512, 66, 1, 66]
    - [99, 1956.11]
  - - [1690, 30, 1, 36]
    - [76, 224.778]
  - - [12608, 64, 1, 64]
    - [79, 2055.83]
  - - [25408, 64, 1, 64]
    - [195, 2197.45]
  - - [32666, 30, 1, 36]
    - [38, 1254.6]
  - - [39024, 48, 1, 48]
    - [52, 2124.56]
  - - [21950, 66, 1, 66]
    - [57, 1860.2]
  - - [17984, 64, 1, 64]
    - [145, 2169.09]
  - - [26266, 30, 1, 36]
    - [44, 1208.15]
  - - [34304, 128, 1, 128]
    - [146, 3611.14]
  - - [17050, 30, 1, 36]
    - [37, 1053.43]
  - - [40384, 64, 1, 64]
    - [118, 2613.98]
  - - [17040, 48, 1, 48]
    - [52, 1810.89]
  - - [42042, 58, 1, 66]
    - [118, 2069.67]
  - - [26976, 96, 1, 96]
    - [208, 3040.74]
  - - [30240, 96, 1, 96]
    - [94, 3124.35]
  - - [25600, 128, 1, 128]
    - [146, 3464.08]
  - - [5888, 66, 1, 66]
    - [56, 1352.75]
  - - [5632, 66, 1, 66]
    - [59, 1313.33]
  - - [20444, 30, 1, 36]
    - [74, 1157.21]
  - - [13600, 32, 1, 32]
    - [37, 1119.49]
  - - [37248, 48, 1, 48]
    - [90, 2105.48]
  - - [24576, 66, 1, 66]
    - [57, 1960.68]
  - - [41472, 96, 1, 96]
    - [205, 3234.65]
  - - [43776, 192, 1, 192]
    - [202, 4220.53]
  - - [22432, 32, 1, 32]
    - [43, 1360.8]
  - - [15984, 48, 1, 48]
    - [51, 1863.72]
  - - [23584, 32, 1, 32]
    - [76, 1387.93]
  - - [9216, 58, 1, 66]
    - [131, 1569.34]
  - - [6816, 96, 1, 96]
    - [156, 2488.76]
  - - [21984, 96, 1, 96]
    - [96, 3062.34]
  - - [23136, 32, 1, 32]
    - [45, 1387.08]
  - - [20416, 64, 1, 64]
    - [145, 2240.73]
  - - [37088, 32, 1, 32]
    - [40, 1408.68]
  - - [13400, 30, 1, 36]
    - [74, 954.617]
  - - [14880, 32, 1, 32]
    - [37, 1164.92]
  - - [36544, 64, 1, 64]
    - [117, 2508.11]
  - - [16704, 64, 1, 64]
    - [141, 2098.76]
  - - [1104, 48, 1, 48]
    - [37, 305.723]
  - - [4224, 192, 1, 192]
    - [107, 3096.93]
  - - [15104, 58, 1, 66]
    - [62, 1955.96]
  - - [13312, 124, 1, 132]
    - [196, 3002.91]
  - - [2720, 32, 1, 32]
    - [40, 386.844]
  - - [1856, 64, 1, 64]
    - [124, 788.607]
  - - [34592, 32, 1, 32]
    - [76, 1383.68]
  - - [14912, 64, 1, 64]
    - [146, 2209.82]
  - - [768, 48, 1, 48]
    - [37, 213.704]
  - - [12032, 128, 1, 128]
    - [86, 3250.86]
  - - [4828, 30, 1, 36]
    - [37, 561.879]
  - - [40280, 30, 1, 36]
    - [76, 1267.55]
  - - [23840, 32, 1, 32]
    - [74, 1393.39]
  - - [4544, 64, 1, 64]
    - [145, 1384.84]
  - - [26302, 66, 1, 66]
    - [179, 1793.54]
  - - [39984, 48, 1, 48]
    - [52, 2116.8]
  - - [4656, 48, 1, 48]
    - [40, 978.78]
  - - [34304, 58, 1, 66]
    - [109, 2030.24]
  - - [36096, 192, 1, 192]
    - [200, 4196.56]
  - - [22784, 66, 1, 66]
    - [57, 1913.01]
  - - [19872, 96, 1, 96]
    - [94, 3058.46]
  - - [988, 30, 1, 36]
    - [67, 138.218]
  - - [25120, 32, 1, 32]
    - [77, 1328.66]
  - - [30400, 64, 1, 64]
    - [117, 2428.21]
  - - [7168, 30, 1, 36]
    - [40, 696.173]
  - - [42720, 32, 1, 32]
    - [40, 1446.6]
  - - [3600, 48, 1, 48]
    - [37, 856.86]
  - - [29184, 58, 1, 66]
    - [98, 2023.85]
  - - [3264, 64, 1, 64]
    - [127, 1160.53]
  - - [16752, 48, 1, 48]
    - [57, 1719.99]
  - - [40176, 48, 1, 48]
    - [52, 2134.81]
  - - [30552, 30, 1, 36]
    - [38, 1247.96]
  - - [30428, 30, 1, 36]
    - [44, 1246.67]
  - - [9728, 30, 1, 36]
    - [40, 803.229]
  - - [43484, 30, 1, 36]
    - [76, 1266.52]
  - - [21728, 32, 1, 32]
    - [37, 1350.09]
  - - [5690, 58, 1, 66]
    - [124, 1396.24]
  - - [6048, 32, 1, 32]
    - [37, 737.28]
  - - [28672, 58, 1, 66]
    - [63, 2028.02]
  - - [30910, 66, 1, 66]
    - [98, 1957.03]
  - - [40080, 48, 1, 48]
    - [57, 2135.62]
  - - [17752, 30, 1, 36]
    - [37, 1094.3]
  - - [25344, 48, 1, 48]
    - [137, 1873.96]
  - - [5888, 58, 1, 66]
    - [124, 1430.16]
  - - [37976, 30, 1, 36]
    - [76, 1235.36]
  - - [8688, 48, 1, 48]
    - [37, 1320.39]
  - - [36352, 58, 1, 66]
    - [117, 2098.24]
  - - [12000, 96, 1, 96]
    - [96, 2995.45]
  - - [33434, 30, 1, 36]
    - [76, 1178.48]
  - - [26076, 30, 1, 36]
    - [38, 1199.41]
  - - [30208, 66, 1, 66]
    - [98, 1960.46]
  - - [36286, 66, 1, 66]
    - [57, 1940.84]
  - - [35296, 32, 1, 32]
    - [40, 1381.62]
  - - [64, 64, 1, 64]
    - [37, 29.2571]
  - - [17152, 128, 1, 128]
    - [195, 3302.99]
  - - [27904, 66, 1, 66]
    - [98, 1864.26]
  - - [24576, 124, 1, 132]
    - [146, 3264.04]
  - - [41056, 32, 1, 32]
    - [76, 1467.92]
  - - [36576, 32, 1, 32]
    - [76, 1412.29]
  - - [24064, 128, 1, 128]
    - [194, 3529.04]
  - - [8960, 124, 1, 132]
    - [69, 2781.81]
  - - [5312, 64, 1, 64]
    - [124, 1576.66]
  - - [26640, 48, 1, 48]
    - [61, 1871.3]
  - - [41824, 32, 1, 32]
    - [76, 1441.04]
  - - [25088, 66, 1, 66]
    - [184, 1782.18]
  - - [26880, 30, 1, 36]
    - [38, 1221.82]
  - - [4224, 48, 1, 48]
    - [119, 925.104]
  - - [40192, 124, 1, 132]
    - [146, 3398.06]
  - - [21504, 124, 1, 132]
    - [146, 3166.4]
  - - [44112, 48, 1, 48]
    - [54, 2117.38]
  - - [4952, 30, 1, 36]
    - [76, 566.542]
  - - [6590, 66, 1, 66]
    - [59, 1415.49]
  - - [19200, 48, 1, 48]
    - [52, 2018.1]
  - - [20384, 32, 1, 32]
    - [74, 1327.81]
  - - [18864, 48, 1, 48]
    - [52, 1950.75]
  - - [11966, 66, 1, 66]
    - [96, 1785.07]
  - - [13722, 30, 1, 36]
    - [37, 964.828]
  - - [11520, 96, 1, 96]
    - [57, 2988.97]
  - - [27480, 30, 1, 36]
    - [38, 1232.49]
  - - [32608, 32, 1, 32]
    - [46, 1451.76]
  - - [15872, 66, 1, 66]
    - [58, 1785.6]
  - - [26560, 64, 1, 64]
    - [97, 2229.3]
  - - [20256, 96, 1, 96]
    - [60, 2961.28]
  - - [7424, 128, 1, 128]
    - [73, 3019.73]
  - - [35680, 32, 1, 32]
    - [37, 1377.69]
  - - [29952, 66, 1, 66]
    - [98, 1926.62]
  - - [25344, 96, 1, 96]
    - [163, 2899.33]
  - - [20448, 96, 1, 96]
    - [210, 2970.5]
  - - [22816, 32, 1, 32]
    - [40, 1377.57]
  - - [14336, 30, 1, 36]
    - [37, 1010.63]
  - - [5520, 48, 1, 48]
    - [40, 1088.88]
  - - [36528, 48, 1, 48]
    - [52, 2052.7]
  - - [13824, 66, 1, 66]
    - [58, 1645.28]
  - - [41216, 124, 1, 132]
    - [142, 3401.01]
  - - [7200, 32, 1, 32]
    - [37, 794.483]
  - - [33888, 32, 1, 32]
    - [76, 1351.3]
  - - [8250, 58, 1, 66]
    - [131, 1470.25]
  - - [38176, 32, 1, 32]
    - [45, 1426.72]
  - - [2714, 30, 1, 36]
    - [37, 350.612]
  - - [16512, 48, 1, 48]
    - [90, 1794.51]
  - - [5376, 128, 1, 128]
    - [83, 2815.87]
  - - [9984, 58, 1, 66]
    - [85, 1608.53]
  - - [10656, 32, 1, 32]
    - [37, 1014.1]
  - - [39968, 32, 1, 32]
    - [45, 1451.32]
  - - [24832, 30, 1, 36]
    - [38, 1155.97]
  - - [29472, 96, 1, 96]
    - [96, 3085.12]
  - - [41280, 64, 1, 64]
    - [112, 2528.15]
  - - [856, 30, 1, 36]
    - [67, 120.375]
  - - [8384, 64, 1, 64]
    - [83, 1759.27]
  - - [31744, 58, 1, 66]
    - [98, 2121.44]
  - - [19968, 128, 1, 128]
    - [193, 3462.7]
  - - [42584, 30, 1, 36]
    - [45, 1248.39]
  - - [34240, 64, 1, 64]
    - [171, 2409.74]
  - - [39888, 48, 1, 48]
    - [90, 2127.36]
  - - [4944, 48, 1, 48]
    - [173, 1020.7]
  - - [256, 128, 1, 128]
    - [119, 308.405]
  - - [17600, 64, 1, 64]
    - [147, 2158.37]
  - - [17888, 32, 1, 32]
    - [40, 1237.66]
  - - [29520, 48, 1, 48]
    - [51, 1988.72]
  - - [41856, 48, 1, 48]
    - [52, 2122.28]
  - - [38016, 48, 1, 48]
    - [90, 2123.88]
  - - [14752, 32, 1, 32]
    - [74, 1147.88]
  - - [6624, 32, 1, 32]
    - [40, 770.793]
  - - [5596, 30, 1, 36]
    - [74, 614.195]
  - - [31424, 64, 1, 64]
    - [117, 2494.43]
  - - [15704, 30, 1, 36]
    - [74, 1011.95]
  - - [32922, 30, 1, 36]
    - [43, 1175.79]
  - - [6656, 128, 1, 128]
    - [72, 2810.62]
  - - [27360, 32, 1, 32]
    - [38, 1429.42]
  - - [23856, 48, 1, 48]
    - [54, 2069.44]
  - - [30362, 30, 1, 36]
    - [41, 1223.54]
  - - [9728, 58, 1, 66]
    - [74, 1610.67]
  - - [22206, 66, 1, 66]
    - [60, 1863.05]
  - - [32640, 48, 1, 48]
    - [51, 2077.42]
  - - [28160, 66, 1, 66]
    - [98, 1868.75]
  - - [4704, 96, 1, 96]
    - [124, 2335.78]
  - - [37872, 48, 1, 48]
    - [90, 2083.5]
  - - [7680, 192, 1, 192]
    - [151, 3665.4]
  - - [17466, 58, 1, 66]
    - [45, 1846.96]
  - - [2816, 30, 1, 36]
    - [76, 360.341]
  - - [42976, 32, 1, 32]
    - [45, 1457.2]
  - - [34618, 58, 1, 66]
    - [117, 2037.48]
  - - [20320, 32, 1, 32]
    - [37, 1344.17]
  - - [39680, 66, 1, 66]
    - [184, 1995.91]
  - - [31064, 30, 1, 36]
    - [38, 1246.25]
  - - [31728, 48, 1, 48]
    - [59, 2048.8]
  - - [38554, 30, 1, 36]
    - [76, 1251.15]
  - - [10554, 58, 1, 66]
    - [131, 1714.8]
  - - [7200, 96, 1, 96]
    - [129, 2563.96]
  - - [18048, 192, 1, 192]
    - [103, 3982.06]
  - - [26976, 32, 1, 32]
    - [77, 1418.04]
  - - [704, 64, 1, 64]
    - [119, 321.829]
  - - [33536, 66, 1, 66]
    - [57, 1914.08]
  - - [22848, 64, 1, 64]
    - [114, 2365.66]
  - - [3312, 48, 1, 48]
    - [37, 801.56]
  - - [42240, 96, 1, 96]
    - [158, 3255.97]
  - - [4608, 48, 1, 48]
    - [74, 972.237]
  - - [41376, 32, 1, 32]
    - [45, 1471.15]
  - - [8192, 128, 1, 128]
    - [62, 3144.75]
  - - [38304, 96, 1, 96]
    - [207, 3145.13]
  - - [15936, 64, 1, 64]
    - [116, 2263.31]
  - - [832, 64, 1, 64]
    - [119, 373.67]
  - - [13788, 30, 1, 36]
    - [37, 987.47]
  - - [20640, 96, 1, 96]
    - [98, 2942.73]
  - - [40320, 192, 1, 192]
    - [203, 4229.82]
  - - [26624, 66, 1, 66]
    - [57, 1806.45]
  - - [29660, 30, 1, 36]
    - [44, 1233.93]
  - - [34524, 30, 1, 36]
    - [37, 1188.96]
  - - [24540, 30, 1, 36]
    - [37, 1231.56]
  - - [26832, 48, 1, 48]
    - [51, 1887.09]
  - - [36480, 48, 1, 48]
    - [54, 2092.88]
  - - [1536, 124, 1, 132]
    - [139, 1396.74]
  - - [17884, 30, 1, 36]
    - [37, 1104.96]
  - - [26256, 48, 1, 48]
    - [58, 1869.4]
  - - [40656, 48, 1, 48]
    - [54, 2052.4]
  - - [26368, 128, 1, 128]
    - [194, 3520.32]
  - - [27904, 30, 1, 36]
    - [38, 1231.06]
  - - [15674, 58, 1, 66]
    - [46, 1953.13]
  - - [11200, 64, 1, 64]
    - [141, 2168.02]
  - - [13920, 96, 1, 96]
    - [93, 2697.37]
  - - [10848, 32, 1, 32]
    - [74, 1017.25]
  - - [38970, 58, 1, 66]
    - [117, 2155.74]
  - - [23552, 124, 1, 132]
    - [145, 3185.94]
  - - [190, 66, 1, 66]
    - [37, 82.4343]
  - - [16560, 48, 1, 48]
    - [94, 1712.49]
  - - [19712, 128, 1, 128]
    - [195, 3444.55]
  - - [37968, 48, 1, 48]
    - [52, 2119.14]
  - - [1178, 30, 1, 36]
    - [37, 161.452]
  - - [8768, 64, 1, 64]
    - [146, 1821.18]
  - - [38560, 32, 1, 32]
    - [40, 1453.81]
  - - [43264, 58, 1, 66]
    - [98, 2096.39]
  - - [41728, 58, 1, 66]
    - [118, 2087.49]
  - - [9600, 96, 1, 96]
    - [94, 2785.69]
  - - [14336, 128, 1, 128]
    - [193, 3349.7]
  - - [38144, 66, 1, 66]
    - [182, 1984.65]
  - - [2016, 32, 1, 32]
    - [74, 288.322]
  - - [30976, 30, 1, 36]
    - [75, 1253.9]
  - - [6288, 48, 1, 48]
    - [124, 1183.62]
  - - [6400, 128, 1, 128]
    - [73, 2794.71]
  - - [36144, 48, 1, 48]
    - [52, 2079.81]
  - - [19920, 48, 1, 48]
    - [54, 1998.94]
  - - [18264, 30, 1, 36]
    - [37, 1123.3]
  - - [11520, 66, 1, 66]
    - [60, 1761.98]
  - - [11008, 66, 1, 66]
    - [60, 1676.6]
  - - [42384, 48, 1, 48]
    - [57, 2091.96]
  - - [31130, 30, 1, 36]
    - [38, 1256.37]
  - - [1440, 96, 1, 96]
    - [139, 1020.85]
  - - [31744, 30, 1, 36]
    - [38, 1258.57]
  - - [29760, 64, 1, 64]
    - [116, 2403.33]
  - - [9312, 32, 1, 32]
    - [119, 942.242]
  - - [29184, 128, 1, 128]
    - [192, 3557.68]
  - - [42912, 96, 1, 96]
    - [158, 3277.07]
  - - [15514, 30, 1, 36]
    - [74, 1014.23]
  - - [42752, 124, 1, 132]
    - [142, 3411.49]
  - - [5232, 48, 1, 48]
    - [119, 1061.14]
  - - [12800, 58, 1, 66]
    - [81, 1801.41]
  - - [6432, 32, 1, 32]
    - [40, 745.064]
  - - [40096, 32, 1, 32]
    - [40, 1470.57]
  - - [20704, 32, 1, 32]
    - [37, 1318.46]
  - - [10840, 30, 1, 36]
    - [74, 871.071]
  - - [12288, 96, 1, 96]
    - [57, 3057.4]
  - - [21438, 66, 1, 66]
    - [98, 1890.36]
  - - [21024, 96, 1, 96]
    - [98, 2982.72]
  - - [42752, 30, 1, 36]
    - [40, 1271.26]
  - - [42432, 64, 1, 64]
    - [118, 2501.46]
  - - [22528, 124, 1, 132]
    - [146, 3233.41]
  - - [22272, 30, 1, 36]
    - [37, 1197.9]
  - - [8784, 48, 1, 48]
    - [37, 1352.83]
  - - [22016, 30, 1, 36]
    - [74, 1210.66]
  - - [31584, 96, 1, 96]
    - [210, 3152.93]
  - - [1280, 124, 1, 132]
    - [139, 1195.84]
  - - [20312, 30, 1, 36]
    - [37, 1179.41]
  - - [27962, 58, 1, 66]
    - [63, 2013.52]
  - - [22944, 32, 1, 32]
    - [37, 1391.86]
  - - [22104, 30, 1, 36]
    - [37, 1200.82]
  - - [224, 32, 1, 32]
    - [74, 33.1468]
  - - [4316, 30, 1, 36]
    - [37, 502.293]
  - - [35642, 58, 1, 66]
    - [117, 2068.49]
  - - [35552, 32, 1, 32]
    - [74, 1391.64]
  - - [48, 48, 1, 48]
    - [67, 13.1657]
  - - [32000, 128, 1, 128]
    - [146, 3575.35]
  - - [17920, 58, 1, 66]
    - [43, 1826.35]
  - - [32256, 192, 1, 192]
    - [199, 4172.82]
  - - [28730, 58, 1, 66]
    - [99, 2030.62]
  - - [6144, 128, 1, 128]
    - [85, 3114.58]
  - - [20736, 58, 1, 66]
    - [45, 1921.04]
  - - [8448, 192, 1, 192]
    - [194, 3492.9]
  - - [25658, 58, 1, 66]
    - [64, 1906.42]
  - - [6656, 30, 1, 36]
    - [37, 663.144]
  - - [36608, 30, 1, 36]
    - [45, 1214.27]
  - - [43296, 32, 1, 32]
    - [40, 1454.56]
  - - [3520, 64, 1, 64]
    - [141, 1260.31]
  - - [26336, 32, 1, 32]
    - [75, 1398.76]
  - - [24992, 32, 1, 32]
    - [38, 1352.63]
  - - [11280, 48, 1, 48]
    - [53, 1550.66]
  - - [2304, 128, 1, 128]
    - [124, 1922.03]
  - - [15104, 66, 1, 66]
    - [58, 1727.76]
  - - [25200, 48, 1, 48]
    - [91, 1798.66]
  - - [27552, 96, 1, 96]
    - [158, 2978.87]
  - - [22224, 48, 1, 48]
    - [54, 2031.91]
  - - [31964, 30, 1, 36]
    - [38, 1248.96]
  - - [11008, 30, 1, 36]
    - [119, 869.053]
  - - [20256, 32, 1, 32]
    - [37, 1375.47]
  - - [24730, 30, 1, 36]
    - [38, 1165.29]
  - - [13370, 58, 1, 66]
    - [62, 1807.22]
  - - [22992, 48, 1, 48]
    - [54, 2098.79]
  - - [3488, 32, 1, 32]
    - [37, 482.664]
  - - [27792, 48, 1, 48]
    - [133, 1926.38]
  - - [17568, 96, 1, 96]
    - [96, 2891.19]
  - - [33760, 32, 1, 32]
    - [45, 1346.19]
  - - [31392, 96, 1, 96]
    - [96, 3137.84]
  - - [37632, 58, 1, 66]
    - [117, 2122.21]
  - - [14336, 58, 1, 66]
    - [62, 1902.85]
  - - [16368, 48, 1, 48]
    - [51, 1896.98]
  - - [13440, 192, 1, 192]
    - [193, 3964.89]
  - - [19968, 58, 1, 66]
    - [45, 1928.29]
  - - [2016, 96, 1, 96]
    - [139, 1354.19]
  - - [44064, 96, 1, 96]
    - [206, 3324.29]
  - - [19040, 32, 1, 32]
    - [74, 1320.93]
  - - [18784, 32, 1, 32]
    - [37, 1285.75]
  - - [19902, 66, 1, 66]
    - [60, 1836.72]
  - - [21980, 30, 1, 36]
    - [37, 1194.08]
  - - [1600, 64, 1, 64]
    - [119, 688.403]
  - - [768, 128, 1, 128]
    - [119, 898.779]
  - - [19514, 58, 1, 66]
    - [43, 1929.22]
  - - [30048, 96, 1, 96]
    - [94, 3103.12]
  - - [33952, 32, 1, 32]
    - [37, 1351.74]
  - - [41436, 30, 1, 36]
    - [76, 1262.72]
  - - [23486, 66, 1, 66]
    - [57, 1918.7]
  - - [14592, 124, 1, 132]
    - [64, 2963.3]
  - - [22176, 96, 1, 96]
    - [96, 3085.36]
  - - [22800, 48, 1, 48]
    - [54, 2058.43]
  - - [34400, 32, 1, 32]
    - [74, 1322.28]
  - - [19392, 64, 1, 64]
    - [141, 2221.19]
  - - [42240, 192, 1, 192]
    - [202, 4266.13]
  - - [34048, 66, 1, 66]
    - [57, 1915.2]
  - - [6496, 32, 1, 32]
    - [37, 752.478]
  - - [2752, 64, 1, 64]
    - [141, 1047.6]
  - - [33120, 96, 1, 96]
    - [94, 3121.0]
  - - [30172, 30, 1, 36]
    - [38, 1236.18]
  - - [31744, 124, 1, 132]
    - [146, 3287.69]
  - - [10752, 128, 1, 128]
    - [204, 3010.27]
  - - [10328, 30, 1, 36]
    - [74, 855.386]
  - - [6078, 66, 1, 66]
    - [44, 1384.72]
  - - [16832, 64, 1, 64]
    - [69, 2104.51]
  - - [36542, 66, 1, 66]
    - [60, 1939.29]
  - - [24320, 124, 1, 132]
    - [172, 3252.2]
  - - [14256, 48, 1, 48]
    - [51, 1736.04]
  - - [9150, 66, 1, 66]
    - [60, 1604.57]
  - - [21536, 32, 1, 32]
    - [76, 1338.16]
  - - [2970, 30, 1, 36]
    - [76, 380.047]
  - - [25856, 66, 1, 66]
    - [179, 1775.36]
  - - [32160, 96, 1, 96]
    - [163, 3196.58]
  - - [9792, 64, 1, 64]
    - [146, 1997.41]
  - - [41952, 32, 1, 32]
    - [45, 1453.28]
  - - [13568, 66, 1, 66]
    - [58, 1630.86]
  - - [26496, 48, 1, 48]
    - [58, 1881.84]
  - - [29856, 32, 1, 32]
    - [41, 1423.3]
  - - [22330, 58, 1, 66]
    - [45, 1933.92]
  - - [26144, 32, 1, 32]
    - [46, 1391.45]
  - - [19808, 32, 1, 32]
    - [40, 1320.53]
  - - [13200, 48, 1, 48]
    - [51, 1671.03]
  - - [36352, 30, 1, 36]
    - [40, 1217.75]
  - - [40608, 96, 1, 96]
    - [210, 3279.38]
  - - [29616, 48, 1, 48]
    - [51, 2004.56]
  - - [19968, 124, 1, 132]
    - [148, 3168.25]
  - - [29952, 30, 1, 36]
    - [44, 1223.46]
  - - [32544, 32, 1, 32]
    - [38, 1461.63]
  - - [5056, 64, 1, 64]
    - [141, 1545.48]
  - - [11264, 66, 1, 66]
    - [96, 1785.52]
  - - [6688, 32, 1, 32]
    - [119, 774.719]
  - - [34648, 30, 1, 36]
    - [43, 1187.18]
  - - [42528, 96, 1, 96]
    - [207, 3253.14]
  - - [2362, 58, 1, 66]
    - [45, 776.781]
  - - [10138, 30, 1, 36]
    - [78, 822.0]
  - - [15162, 58, 1, 66]
    - [62, 1966.13]
  - - [15836, 30, 1, 36]
    - [37, 1013.2]
  - - [39312, 48, 1, 48]
    - [52, 2128.17]
  - - [9984, 66, 1, 66]
    - [64, 1706.84]
  - - [34560, 96, 1, 96]
    - [210, 3121.37]
  - - [13568, 58, 1, 66]
    - [62, 1839.18]
  - - [7840, 32, 1, 32]
    - [119, 846.852]
  - - [2848, 32, 1, 32]
    - [176, 379.733]
  - - [32190, 66, 1, 66]
    - [184, 1963.86]
  - - [12632, 30, 1, 36]
    - [37, 929.33]
  - - [1728, 64, 1, 64]
    - [124, 734.221]
  - - [39456, 32, 1, 32]
    - [76, 1449.17]
  - - [35040, 96, 1, 96]
    - [94, 3204.93]
  - - [3456, 48, 1, 48]
    - [45, 825.998]
  - - [21658, 30, 1, 36]
    - [76, 1178.96]
  - - [16026, 30, 1, 36]
    - [74, 1035.17]
  - - [18768, 48, 1, 48]
    - [52, 1998.22]
  - - [22608, 48, 1, 48]
    - [54, 2076.91]
  - - [26624, 58, 1, 66]
    - [64, 1950.93]
  - - [30432, 96, 1, 96]
    - [96, 3120.4]
  - - [34970, 30, 1, 36]
    - [40, 1207.4]
  - - [39488, 64, 1, 64]
    - [118, 2575.52]
  - - [5472, 96, 1, 96]
    - [159, 2188.8]
  - - [36608, 128, 1, 128]
    - [146, 3639.48]
  - - [5084, 30, 1, 36]
    - [40, 574.343]
  - - [23520, 32, 1, 32]
    - [37, 1410.1]
  - - [27648, 124, 1, 132]
    - [142, 3272.66]
  - - [10976, 32, 1, 32]
    - [37, 1029.25]
  - - [16288, 32, 1, 32]
    - [37, 1212.13]
  - - [6960, 48, 1, 48]
    - [74, 1196.7]
  - - [25088, 30, 1, 36]
    - [46, 1103.22]
  - - [23808, 96, 1, 96]
    - [94, 3178.08]
  - - [1792, 128, 1, 128]
    - [141, 1794.63]
  - - [33376, 32, 1, 32]
    - [37, 1328.81]
  - - [36666, 58, 1, 66]
    - [117, 2089.9]
  - - [26880, 48, 1, 48]
    - [58, 1899.74]
  - - [32544, 96, 1, 96]
    - [210, 3200.23]
  - - [15360, 192, 1, 192]
    - [145, 3854.01]
  - - [8448, 30, 1, 36]
    - [76, 752.792]
  - - [15264, 96, 1, 96]
    - [187, 2870.88]
  - - [3136, 64, 1, 64]
    - [191, 1142.8]
  - - [5904, 48, 1, 48]
    - [124, 1148.89]
  - - [23296, 66, 1, 66]
    - [60, 1911.78]
  - - [21120, 96, 1, 96]
    - [94, 3007.45]
  - - [27888, 48, 1, 48]
    - [51, 1940.03]
  - - [12960, 32, 1, 32]
    - [37, 1091.37]
  - - [15258, 30, 1, 36]
    - [40, 1007.25]
  - - [13978, 30, 1, 36]
    - [74, 982.828]
  - - [33728, 64, 1, 64]
    - [111, 2427.09]
  - - [13536, 32, 1, 32]
    - [37, 1128.73]
  - - [5946, 58, 1, 66]
    - [124, 1433.33]
  - - [37120, 124, 1, 132]
    - [146, 3384.48]
  - - [7328, 32, 1, 32]
    - [124, 815.638]
  - - [39104, 64, 1, 64]
    - [118, 2586.72]
  - - [28512, 96, 1, 96]
    - [160, 3144.65]
  - - [37568, 64, 1, 64]
    - [118, 2514.36]
  - - [20890, 30, 1, 36]
    - [76, 1160.56]
  - - [34080, 32, 1, 32]
    - [40, 1340.17]
  - - [26496, 96, 1, 96]
    - [188, 3002.79]
  - - [24528, 48, 1, 48]
    - [52, 2121.34]
  - - [17136, 48, 1, 48]
    - [90, 1788.1]
  - - [27136, 30, 1, 36]
    - [38, 1229.32]
  - - [28160, 58, 1, 66]
    - [62, 2002.16]
  - - [14528, 64, 1, 64]
    - [142, 2240.46]
  - - [39392, 32, 1, 32]
    - [76, 1457.28]
  - - [12384, 96, 1, 96]
    - [45, 2661.64]
  - - [35584, 66, 1, 66]
    - [60, 1954.16]
  - - [15744, 96, 1, 96]
    - [162, 2932.43]
  - - [6464, 64, 1, 64]
    - [194, 1728.23]
  - - [1756, 30, 1, 36]
    - [74, 237.06]
  - - [21694, 66, 1, 66]
    - [101, 1867.57]
  - - [37184, 64, 1, 64]
    - [117, 2508.33]
  - - [18140, 30, 1, 36]
    - [74, 1090.82]
  - - [15872, 128, 1, 128]
    - [145, 3301.76]
  - - [27136, 66, 1, 66]
    - [98, 1827.53]
  - - [13760, 64, 1, 64]
    - [192, 2147.9]
  - - [16128, 48, 1, 48]
    - [51, 1892.0]
  - - [43440, 48, 1, 48]
    - [54, 2118.67]
  - - [39680, 58, 1, 66]
    - [118, 2164.98]
  - - [5328, 48, 1, 48]
    - [122, 1065.6]
  - - [25022, 66, 1, 66]
    - [184, 1732.29]
  - - [35518, 66, 1, 66]
    - [60, 1955.47]
  - - [28560, 48, 1, 48]
    - [89, 1967.77]
  - - [40792, 30, 1, 36]
    - [40, 1280.68]
  - - [23516, 30, 1, 36]
    - [37, 1247.41]
  - - [4896, 96, 1, 96]
    - [124, 2400.08]
  - - [96, 32, 1, 32]
    - [67, 13.8067]
  - - [22586, 58, 1, 66]
    - [114, 1923.03]
  - - [18816, 48, 1, 48]
    - [57, 1995.95]
  - - [1726, 66, 1, 66]
    - [40, 678.561]
  - - [25024, 64, 1, 64]
    - [146, 2160.59]
  - - [18096, 48, 1, 48]
    - [52, 1874.69]
  - - [12954, 30, 1, 36]
    - [74, 947.854]
  - - [11904, 96, 1, 96]
    - [96, 3020.57]
  - - [19288, 30, 1, 36]
    - [37, 1132.12]
  - - [40288, 32, 1, 32]
    - [40, 1467.1]
  - - [26880, 58, 1, 66]
    - [63, 1966.68]
  - - [36922, 58, 1, 66]
    - [111, 2104.49]
  - - [5376, 124, 1, 132]
    - [84, 2676.23]
  - - [16384, 30, 1, 36]
    - [37, 1038.42]
  - - [34496, 64, 1, 64]
    - [204, 2429.43]
  - - [43454, 66, 1, 66]
    - [99, 2004.3]
  - - [25914, 58, 1, 66]
    - [63, 1934.45]
  - - [14812, 30, 1, 36]
    - [37, 1007.37]
  - - [31808, 64, 1, 64]
    - [117, 2495.89]
  - - [7824, 48, 1, 48]
    - [119, 1357.42]
  - - [26160, 48, 1, 48]
    - [51, 1857.97]
  - - [41632, 32, 1, 32]
    - [45, 1448.07]
  - - [28160, 124, 1, 132]
    - [142, 3272.67]
  - - [25824, 96, 1, 96]
    - [157, 2933.85]
  - - [42240, 58, 1, 66]
    - [172, 2078.34]
  - - [10368, 48, 1, 48]
    - [52, 1492.99]
  - - [8960, 66, 1, 66]
    - [94, 1602.21]
  - - [10240, 66, 1, 66]
    - [100, 1712.96]
  - - [44160, 48, 1, 48]
    - [54, 2146.51]
  - - [288, 32, 1, 32]
    - [67, 41.4202]
  - - [19056, 48, 1, 48]
    - [57, 1939.27]
  - - [23040, 30, 1, 36]
    - [37, 1226.98]
  - - [24122, 58, 1, 66]
    - [114, 1983.23]
  - - [26816, 64, 1, 64]
    - [117, 2236.12]
  - - [4096, 58, 1, 66]
    - [125, 1094.94]
  - - [9760, 32, 1, 32]
    - [173, 957.303]
  - - [42430, 66, 1, 66]
    - [98, 2017.74]
  - - [27456, 64, 1, 64]
    - [117, 2271.0]
  - - [16640, 30, 1, 36]
    - [74, 1049.72]
  - - [37178, 58, 1, 66]
    - [171, 2109.03]
  - - [30720, 96, 1, 96]
    - [163, 3148.53]
  - - [88, 30, 1, 36]
    - [67, 12.913]
  - - [30720, 30, 1, 36]
    - [38, 1260.55]
  - - [36128, 32, 1, 32]
    - [40, 1392.89]
  - - [17598, 66, 1, 66]
    - [57, 1748.56]
  - - [41616, 48, 1, 48]
    - [90, 2086.23]
  - - [24378, 58, 1, 66]
    - [47, 1995.7]
  - - [26048, 64, 1, 64]
    - [142, 2200.76]
  - - [11198, 66, 1, 66]
    - [60, 1686.67]
  - - [17472, 64, 1, 64]
    - [145, 2158.18]
  - - [4176, 48, 1, 48]
    - [37, 900.89]
  - - [5632, 30, 1, 36]
    - [37, 625.778]
  - - [8672, 32, 1, 32]
    - [124, 880.965]
  - - [3792, 48, 1, 48]
    - [37, 877.186]
  - - [35488, 32, 1, 32]
    - [76, 1391.26]
  - - [34624, 64, 1, 64]
    - [118, 2402.1]
  - - [27648, 128, 1, 128]
    - [146, 3524.62]
  - - [26624, 124, 1, 132]
    - [146, 3257.94]
  - - [20634, 30, 1, 36]
    - [45, 1148.7]
  - - [6240, 96, 1, 96]
    - [46, 2396.16]
  - - [11996, 30, 1, 36]
    - [74, 941.546]
  - - [37054, 66, 1, 66]
    - [184, 1944.67]
  - - [32256, 66, 1, 66]
    - [100, 1973.41]
  - - [37152, 96, 1, 96]
    - [182, 3137.76]
  - - [20016, 48, 1, 48]
    - [60, 1977.57]
  - - [15616, 128, 1, 128]
    - [145, 3261.76]
  - - [28000, 32, 1, 32]
    - [77, 1442.25]
  - - [4288, 64, 1, 64]
    - [175, 1314.64]
  - - [34560, 192, 1, 192]
    - [199, 4248.43]
  - - [25632, 96, 1, 96]
    - [177, 2917.79]
  - - [8800, 32, 1, 32]
    - [37, 880.0]
  - - [4992, 192, 1, 192]
    - [107, 3472.17]
  - - [39226, 58, 1, 66]
    - [117, 2138.99]
  - - [39136, 32, 1, 32]
    - [40, 1458.34]
  - - [26968, 30, 1, 36]
    - [41, 1215.59]
  - - [12640, 32, 1, 32]
    - [37, 1082.22]
  - - [41984, 58, 1, 66]
    - [115, 2101.4]
  - - [44222, 66, 1, 66]
    - [182, 1969.64]
  - - [10240, 30, 1, 36]
    - [45, 835.287]
  - - [6912, 124, 1, 132]
    - [66, 2711.78]
  - - [6672, 48, 1, 48]
    - [122, 1212.33]
  - - [29242, 58, 1, 66]
    - [98, 2020.55]
  - - [36032, 64, 1, 64]
    - [117, 2499.78]
  - - [28128, 32, 1, 32]
    - [38, 1428.72]
  - - [33648, 48, 1, 48]
    - [52, 1996.01]
  - - [21152, 32, 1, 32]
    - [76, 1333.72]
  - - [20288, 64, 1, 64]
    - [196, 2224.29]
  - - [23450, 30, 1, 36]
    - [43, 1219.94]
  - - [12288, 30, 1, 36]
    - [37, 934.58]
  - - [9152, 64, 1, 64]
    - [146, 1754.99]
  - - [8762, 58, 1, 66]
    - [49, 1567.33]
  - - [32344, 30, 1, 36]
    - [38, 1252.92]
  - - [9120, 32, 1, 32]
    - [119, 930.167]
  - - [20736, 66, 1, 66]
    - [98, 1881.79]
  - - [39264, 96, 1, 96]
    - [187, 3214.79]
  - - [4256, 32, 1, 32]
    - [122, 523.815]
  - - [25920, 64, 1, 64]
    - [144, 2211.84]
  - - [37984, 32, 1, 32]
    - [40, 1419.55]
  - - [8448, 58, 1, 66]
    - [45, 1454.09]
  - - [24048, 48, 1, 48]
    - [57, 2082.95]
  - - [37632, 30, 1, 36]
    - [40, 1236.09]
  - - [14208, 48, 1, 48]
    - [52, 1775.23]
  - - [28320, 32, 1, 32]
    - [38, 1444.21]
  - - [2656, 32, 1, 32]
    - [37, 377.742]
  - - [35482, 30, 1, 36]
    - [40, 1196.02]
  - - [35808, 96, 1, 96]
    - [94, 3221.46]
  - - [19712, 124, 1, 132]
    - [171, 3138.58]
  - - [7232, 64, 1, 64]
    - [191, 1874.83]
  - - [30720, 58, 1, 66]
    - [98, 2079.14]
  - - [42240, 124, 1, 132]
    - [142, 3415.26]
  - - [19164, 30, 1, 36]
    - [37, 1168.01]
  - - [22492, 30, 1, 36]
    - [45, 1195.44]
  - - [7936, 124, 1, 132]
    - [64, 3040.65]
  - - [42848, 32, 1, 32]
    - [45, 1460.6]
  - - [38080, 64, 1, 64]
    - [118, 2537.03]
  - - [25104, 48, 1, 48]
    - [133, 1823.44]
  - - [16216, 30, 1, 36]
    - [37, 1035.06]
  - - [18016, 32, 1, 32]
    - [37, 1260.14]
  - - [3008, 64, 1, 64]
    - [191, 1107.98]
  - - [35232, 32, 1, 32]
    - [76, 1389.74]
  - - [43584, 64, 1, 64]
    - [115, 2514.37]
  - - [14176, 32, 1, 32]
    - [37, 1144.81]
  - - [36480, 192, 1, 192]
    - [199, 4226.8]
  - - [33792, 48, 1, 48]
    - [54, 2019.11]
  - - [32480, 32, 1, 32]
    - [41, 1458.75]
  - - [15360, 124, 1, 132]
    - [63, 3085.57]
  - - [3416, 30, 1, 36]
    - [37, 419.236]
  - - [5566, 66, 1, 66]
    - [45, 1311.99]
  - - [43536, 48, 1, 48]
    - [57, 2141.48]
  - - [38832, 48, 1, 48]
    - [52, 2116.11]
  - - [9648, 48, 1, 48]
    - [45, 1443.44]
  - - [12478, 66, 1, 66]
    - [59, 1535.43]
  - - [5152, 32, 1, 32]
    - [40, 640.249]
  - - [38496, 96, 1, 96]
    - [182, 3176.75]
  - - [410, 30, 1, 36]
    - [67, 59.5161]
  - - [4704, 32, 1, 32]
    - [37, 608.194]
  - - [30816, 96, 1, 96]
    - [94, 3152.76]
  - - [11008, 128, 1, 128]
    - [142, 3015.97]
  - - [37888, 58, 1, 66]
    - [117, 2132.87]
  - - [9920, 64, 1, 64]
    - [80, 2090.14]
  - - [23742, 66, 1, 66]
    - [57, 1941.07]
  - - [15744, 192, 1, 192]
    - [202, 3920.47]
  - - [13472, 32, 1, 32]
    - [37, 1105.39]
  - - [9728, 128, 1, 128]
    - [145, 3093.62]
  - - [13824, 96, 1, 96]
    - [93, 2712.99]
  - - [25824, 32, 1, 32]
    - [38, 1374.42]
  - - [34904, 30, 1, 36]
    - [76, 1195.95]
  - - [8592, 48, 1, 48]
    - [40, 1323.26]
  - - [39168, 96, 1, 96]
    - [162, 3205.79]
  - - [28848, 48, 1, 48]
    - [51, 1964.12]
  - - [12768, 96, 1, 96]
    - [45, 2718.81]
  - - [1024, 128, 1, 128]
    - [124, 1168.33]
  - - [43520, 66, 1, 66]
    - [99, 1990.48]
  - - [512, 66, 1, 66]
    - [74, 226.654]
  - - [9888, 96, 1, 96]
    - [94, 2805.66]
  - - [21504, 66, 1, 66]
    - [98, 1902.34]
  - - [38232, 30, 1, 36]
    - [45, 1246.7]
  - - [43168, 32, 1, 32]
    - [45, 1473.47]
  - - [21824, 64, 1, 64]
    - [114, 2299.15]
  - - [33214, 66, 1, 66]
    - [184, 1913.76]
  - - [2618, 58, 1, 66]
    - [45, 832.367]
  - - [5274, 30, 1, 36]
    - [76, 593.325]
  - - [1792, 124, 1, 132]
    - [141, 1580.36]
  - - [7536, 48, 1, 48]
    - [119, 1303.52]
  - - [15872, 58, 1, 66]
    - [62, 1977.8]
  - - [4864, 58, 1, 66]
    - [124, 1261.48]
  - - [3360, 96, 1, 96]
    - [124, 1869.91]
  - - [35648, 64, 1, 64]
    - [111, 2468.12]
  - - [38784, 48, 1, 48]
    - [90, 2139.81]
  - - [28608, 64, 1, 64]
    - [117, 2339.82]
  - - [8024, 30, 1, 36]
    - [74, 739.413]
  - - [20576, 32, 1, 32]
    - [40, 1313.58]
  - - [32570, 58, 1, 66]
    - [99, 2116.05]
  - - [19390, 66, 1, 66]
    - [57, 1814.06]
  - - [20304, 48, 1, 48]
    - [52, 2023.37]
  - - [23296, 58, 1, 66]
    - [114, 1955.64]
  - - [34128, 48, 1, 48]
    - [52, 2049.82]
  - - [43680, 32, 1, 32]
    - [76, 1457.9]
  - - [16896, 48, 1, 48]
    - [90, 1805.58]
  - - [2560, 124, 1, 132]
    - [45, 1936.33]
  - - [5600, 32, 1, 32]
    - [76, 699.317]
  - - [20224, 128, 1, 128]
    - [148, 3438.67]
  - - [10496, 66, 1, 66]
    - [62, 1766.64]
  - - [42138, 30, 1, 36]
    - [76, 1253.0]
  - - [39994, 58, 1, 66]
    - [117, 2166.06]
  - - [3840, 124, 1, 132]
    - [127, 2522.2]
  - - [2352, 48, 1, 48]
    - [37, 599.448]
  - - [29440, 124, 1, 132]
    - [146, 3281.63]
  - - [10240, 128, 1, 128]
    - [145, 3201.76]
  - - [31136, 32, 1, 32]
    - [38, 1443.99]
  - - [6864, 48, 1, 48]
    - [119, 1243.29]
  - - [16992, 32, 1, 32]
    - [37, 1198.33]
  - - [14560, 32, 1, 32]
    - [37, 1164.8]
  - - [10752, 192, 1, 192]
    - [194, 3834.77]
  - - [6912, 128, 1, 128]
    - [73, 2912.71]
  - - [5824, 64, 1, 64]
    - [124, 1652.02]
  - - [36192, 96, 1, 96]
    - [210, 3238.31]
  - - [9984, 30, 1, 36]
    - [74, 834.576]
  - - [30720, 124, 1, 132]
    - [146, 3318.54]
  - - [30816, 32, 1, 32]
    - [77, 1434.34]
  - - [34560, 58, 1, 66]
    - [114, 2037.83]
  - - [40412, 30, 1, 36]
    - [45, 1274.68]
  - - [13584, 48, 1, 48]
    - [89, 1693.59]
  - - [32256, 30, 1, 36]
    - [75, 1249.52]
  - - [11456, 64, 1, 64]
    - [145, 2140.68]
  - - [864, 96, 1, 96]
    - [138, 663.552]
  - - [30192, 48, 1, 48]
    - [135, 2010.47]
  - - [38744, 30, 1, 36]
    - [40, 1248.32]
  - - [12064, 32, 1, 32]
    - [37, 1106.95]
  - - [17344, 64, 1, 64]
    - [145, 2144.96]
  - - [4542, 66, 1, 66]
    - [176, 1291.45]
  - - [40128, 64, 1, 64]
    - [118, 2612.27]
  - - [9530, 58, 1, 66]
    - [50, 1608.5]
  - - [10912, 32, 1, 32]
    - [119, 1023.25]
  - - [36864, 58, 1, 66]
    - [117, 2094.94]
  - - [33472, 64, 1, 64]
    - [118, 2381.89]
  - - [39102, 66, 1, 66]
    - [184, 1973.22]
  - - [4506, 30, 1, 36]
    - [40, 515.517]
  - - [28606, 66, 1, 66]
    - [98, 1875.49]
  - - [30464, 124, 1, 132]
    - [146, 3318.93]
  - - [6384, 48, 1, 48]
    - [122, 1190.03]
  - - [22272, 66, 1, 66]
    - [57, 1870.02]
  - - [9216, 48, 1, 48]
    - [76, 1411.81]
  - - [36762, 30, 1, 36]
    - [76, 1220.88]
  - - [24800, 32, 1, 32]
    - [38, 1350.81]
  - - [20736, 48, 1, 48]
    - [52, 1993.98]
  - - [34016, 32, 1, 32]
    - [37, 1352.19]
  - - [27904, 124, 1, 132]
    - [142, 3286.79]
  - - [8000, 64, 1, 64]
    - [145, 1978.74]
  - - [4060, 30, 1, 36]
    - [37, 491.57]
  - - [5310, 66, 1, 66]
    - [124, 1478.92]
  - - [29728, 32, 1, 32]
    - [75, 1398.96]
  - - [20800, 64, 1, 64]
    - [171, 2239.66]
  - - [19866, 30, 1, 36]
    - [74, 1168.59]
  - - [27648, 66, 1, 66]
    - [57, 1841.51]
  - - [4608, 124, 1, 132]
    - [44, 2433.02]
  - - [31290, 58, 1, 66]
    - [98, 2092.56]
  - - [13504, 64, 1, 64]
    - [192, 2101.53]
  - - [19134, 66, 1, 66]
    - [57, 1804.06]
  - - [30864, 48, 1, 48]
    - [53, 2006.51]
  - - [24408, 30, 1, 36]
    - [37, 1245.78]
  - - [9824, 32, 1, 32]
    - [173, 952.63]
  - - [11904, 192, 1, 192]
    - [202, 3865.66]
  - - [8382, 66, 1, 66]
    - [98, 1498.85]
  - - [37376, 128, 1, 128]
    - [195, 3651.14]
  - - [7358, 66, 1, 66]
    - [59, 1506.18]
  - - [39648, 32, 1, 32]
    - [76, 1468.87]
  - - [7344, 48, 1, 48]
    - [119, 1305.6]
  - - [40090, 30, 1, 36]
    - [45, 1268.97]
  - - [34880, 64, 1, 64]
    - [166, 2421.5]
  - - [12442, 30, 1, 36]
    - [74, 925.438]
  - - [5184, 64, 1, 64]
    - [124, 1516.69]
  - - [41370, 30, 1, 36]
    - [45, 1273.65]
  - - [25564, 30, 1, 36]
    - [38, 1173.86]
  - - [1440, 32, 1, 32]
    - [37, 204.8]
  - - [34368, 64, 1, 64]
    - [117, 2400.6]
  - - [13312, 128, 1, 128]
    - [146, 3194.26]
  - - [18112, 64, 1, 64]
    - [145, 2189.69]
  - - [34784, 32, 1, 32]
    - [76, 1369.95]
  - - [26112, 30, 1, 36]
    - [38, 1203.11]
  - - [8400, 48, 1, 48]
    - [37, 1321.97]
  - - [24672, 96, 1, 96]
    - [178, 2884.03]
  - - [43096, 30, 1, 36]
    - [76, 1252.52]
  - - [16224, 32, 1, 32]
    - [74, 1225.18]
  - - [16416, 32, 1, 32]
    - [40, 1173.88]
  - - [14592, 96, 1, 96]
    - [187, 2797.0]
  - - [34608, 48, 1, 48]
    - [52, 2021.73]
  - - [4762, 30, 1, 36]
    - [37, 544.805]
  - - [20064, 32, 1, 32]
    - [37, 1337.6]
  - - [6400, 66, 1, 66]
    - [56, 1393.92]
  - - [3328, 66, 1, 66]
    - [124, 1108.32]
  - - [1824, 32, 1, 32]
    - [74, 263.81]
  - - [16384, 58, 1, 66]
    - [62, 2033.66]
  - - [40512, 64, 1, 64]
    - [112, 2579.87]
  - - [39578, 30, 1, 36]
    - [45, 1260.15]
  - - [41424, 48, 1, 48]
    - [57, 2091.17]
  - - [33536, 58, 1, 66]
    - [182, 2040.3]
  - - [18496, 64, 1, 64]
    - [147, 2182.02]
  - - [8304, 48, 1, 48]
    - [76, 1285.78]
  - - [3584, 58, 1, 66]
    - [124, 1045.7]
  - - [13728, 96, 1, 96]
    - [95, 2691.86]
  - - [36448, 32, 1, 32]
    - [40, 1405.22]
  - - [15324, 30, 1, 36]
    - [40, 1016.58]
  - - [1624, 30, 1, 36]
    - [74, 219.24]
  - - [16800, 32, 1, 32]
    - [43, 1197.99]
  - - [3072, 96, 1, 96]
    - [175, 1743.32]
  - - [22112, 32, 1, 32]
    - [37, 1370.62]
  - - [42272, 32, 1, 32]
    - [76, 1450.62]
  - - [39696, 48, 1, 48]
    - [52, 2144.92]
  - - [18816, 192, 1, 192]
    - [194, 4016.88]
  - - [1088, 64, 1, 64]
    - [119, 484.397]
  - - [24144, 48, 1, 48]
    - [54, 2126.44]
  - - [41216, 128, 1, 128]
    - [192, 3680.42]
  - - [26080, 32, 1, 32]
    - [38, 1390.93]
  - - [12240, 48, 1, 48]
    - [51, 1628.23]
  - - [40638, 66, 1, 66]
    - [184, 1996.16]
  - - [38368, 32, 1, 32]
    - [37, 1440.21]
  - - [7392, 32, 1, 32]
    - [37, 826.355]
  - - [25600, 30, 1, 36]
    - [38, 1187.63]
  - - [11484, 30, 1, 36]
    - [37, 909.29]
  - - [15328, 32, 1, 32]
    - [37, 1189.08]
  - - [34176, 192, 1, 192]
    - [202, 4210.22]
  - - [19200, 58, 1, 66]
    - [45, 1922.01]
  - - [40864, 32, 1, 32]
    - [76, 1459.02]
  - - [15408, 48, 1, 48]
    - [89, 1837.48]
  - - [26170, 58, 1, 66]
    - [63, 1944.46]
  - - [30720, 192, 1, 192]
    - [199, 4235.09]
  - - [36352, 66, 1, 66]
    - [57, 1947.24]
  - - [30656, 64, 1, 64]
    - [171, 2462.1]
  - - [34780, 30, 1, 36]
    - [40, 1181.21]
  - - [23808, 192, 1, 192]
    - [194, 4053.48]
  - - [35088, 48, 1, 48]
    - [54, 2051.85]
  - - [27838, 66, 1, 66]
    - [98, 1839.54]
  - - [13824, 30, 1, 36]
    - [37, 987.429]
  - - [18752, 64, 1, 64]
    - [145, 2197.03]
  - - [24284, 30, 1, 36]
    - [74, 1227.84]
  - - [30208, 128, 1, 128]
    - [146, 3574.0]
  - - [35804, 30, 1, 36]
    - [40, 1212.93]
  - - [27936, 96, 1, 96]
    - [160, 3118.44]
  - - [14352, 48, 1, 48]
    - [51, 1773.98]
  - - [29808, 48, 1, 48]
    - [59, 1980.32]
  - - [32058, 58, 1, 66]
    - [113, 2065.96]
  - - [39552, 96, 1, 96]
    - [187, 3230.34]
  - - [11520, 30, 1, 36]
    - [37, 928.478]
  - - [44288, 124, 1, 132]
    - [146, 3412.29]
  - - [58, 58, 1, 66]
    - [37, 21.7671]
  - - [15960, 30, 1, 36]
    - [37, 1013.93]
  - - [6560, 32, 1, 32]
    - [43, 756.468]
  - - [34136, 30, 1, 36]
    - [74, 1180.12]
  - - [21600, 32, 1, 32]
    - [43, 1355.29]
  - - [3456, 192, 1, 192]
    - [150, 3230.27]
  - - [27744, 96, 1, 96]
    - [160, 3097.0]
  - - [8704, 58, 1, 66]
    - [43, 1511.75]
  - - [19440, 48, 1, 48]
    - [54, 1967.92]
  - - [3936, 32, 1, 32]
    - [76, 527.548]
  - - [41184, 96, 1, 96]
    - [205, 3241.82]
  - - [16384, 128, 1, 128]
    - [193, 3374.0]
  - - [314, 58, 1, 66]
    - [37, 117.382]
  - - [28504, 30, 1, 36]
    - [38, 1227.45]
  - - [40320, 96, 1, 96]
    - [210, 3276.8]
  - - [12672, 96, 1, 96]
    - [45, 2708.38]
  - - [22528, 30, 1, 36]
    - [78, 1202.09]
  - - [43008, 48, 1, 48]
    - [52, 2133.73]
  - - [32448, 64, 1, 64]
    - [117, 2538.33]
  - - [28992, 64, 1, 64]
    - [111, 2369.34]
  - - [42716, 30, 1, 36]
    - [76, 1253.62]
  - - [43872, 96, 1, 96]
    - [160, 3332.72]
  - - [19968, 96, 1, 96]
    - [96, 3071.18]
  - - [37152, 32, 1, 32]
    - [37, 1409.02]
  - - [41048, 30, 1, 36]
    - [40, 1266.62]
  - - [7632, 48, 1, 48]
    - [124, 1316.18]
  - - [37536, 96, 1, 96]
    - [182, 3128.91]
  - - [38880, 96, 1, 96]
    - [158, 3192.43]
  - - [20736, 128, 1, 128]
    - [145, 3409.66]
  - - [16080, 48, 1, 48]
    - [51, 1897.97]
  - - [25820, 30, 1, 36]
    - [38, 1206.12]
  - - [36096, 30, 1, 36]
    - [45, 1210.67]
  - - [41472, 66, 1, 66]
    - [100, 2003.68]
  - - [29952, 96, 1, 96]
    - [94, 3114.14]
  - - [13664, 32, 1, 32]
    - [74, 1117.57]
  - - [32512, 30, 1, 36]
    - [38, 1254.03]
  - - [16574, 66, 1, 66]
    - [60, 1688.41]
  - - [44096, 64, 1, 64]
    - [115, 2535.33]
  - - [43392, 48, 1, 48]
    - [52, 2152.78]
  - - [2648, 30, 1, 36]
    - [74, 340.457]
  - - [958, 66, 1, 66]
    - [37, 407.524]
  - - [40944, 48, 1, 48]
    - [92, 2109.46]
  - - [29338, 30, 1, 36]
    - [44, 1218.66]
  - - [17328, 48, 1, 48]
    - [94, 1775.97]
  - - [11710, 66, 1, 66]
    - [94, 1819.14]
  - - [24320, 66, 1, 66]
    - [57, 1950.26]
  - - [1946, 30, 1, 36]
    - [74, 257.559]
  - - [44120, 30, 1, 36]
    - [40, 1244.76]
  - - [43864, 30, 1, 36]
    - [80, 1254.58]
  - - [35040, 32, 1, 32]
    - [76, 1382.16]
  - - [30874, 30, 1, 36]
    - [38, 1247.9]
  - - [5888, 128, 1, 128]
    - [83, 3048.96]
  - - [18720, 32, 1, 32]
    - [76, 1274.55]
  - - [40224, 96, 1, 96]
    - [164, 3272.46]
  - - [3984, 48, 1, 48]
    - [37, 903.458]
  - - [41472, 58, 1, 66]
    - [113, 2114.48]
  - - [27100, 30, 1, 36]
    - [38, 1221.54]
  - - [29374, 66, 1, 66]
    - [98, 1902.93]
  - - [28080, 48, 1, 48]
    - [56, 1932.39]
  - - [1338, 58, 1, 66]
    - [40, 486.869]
  - - [14336, 66, 1, 66]
    - [61, 1684.13]
  - - [5664, 32, 1, 32]
    - [40, 687.196]
  - - [21184, 64, 1, 64]
    - [114, 2266.71]
  - - [41984, 30, 1, 36]
    - [74, 1256.73]
  - - [13114, 58, 1, 66]
    - [75, 1842.89]
  - - [38400, 124, 1, 132]
    - [142, 3370.51]
  - - [2458, 30, 1, 36]
    - [37, 323.737]
  - - [21360, 48, 1, 48]
    - [54, 1990.83]
  - - [42752, 66, 1, 66]
    - [98, 2000.73]
  - - [256, 58, 1, 66]
    - [74, 98.3904]
  - - [10400, 32, 1, 32]
    - [173, 986.074]
  - - [22748, 30, 1, 36]
    - [37, 1213.83]
  - - [43920, 48, 1, 48]
    - [90, 2122.31]
  - - [29696, 30, 1, 36]
    - [38, 1218.53]
  - - [11608, 30, 1, 36]
    - [74, 932.786]
  - - [15616, 124, 1, 132]
    - [107, 3109.52]
  - - [12992, 64, 1, 64]
    - [142, 2037.34]
  - - [25056, 32, 1, 32]
    - [38, 1358.97]
  - - [31872, 96, 1, 96]
    - [94, 3191.36]
  - - [26016, 96, 1, 96]
    - [188, 2961.5]
  - - [16186, 58, 1, 66]
    - [62, 1993.57]
  - - [35928, 30, 1, 36]
    - [76, 1211.06]
  - - [28760, 30, 1, 36]
    - [44, 1219.03]
  - - [9552, 48, 1, 48]
    - [40, 1444.08]
  - - [30208, 30, 1, 36]
    - [38, 1233.91]
  - - [35328, 58, 1, 66]
    - [117, 2059.01]
  - - [34272, 32, 1, 32]
    - [76, 1358.15]
  - - [33360, 48, 1, 48]
    - [54, 1999.52]
  - - [27296, 32, 1, 32]
    - [44, 1426.08]
  - - [25146, 58, 1, 66]
    - [64, 1891.88]
  - - [41760, 96, 1, 96]
    - [155, 3234.12]
  - - [30296, 30, 1, 36]
    - [38, 1241.26]
  - - [3040, 32, 1, 32]
    - [37, 434.771]
  - - [12252, 30, 1, 36]
    - [74, 929.225]
  - - [18490, 58, 1, 66]
    - [43, 1876.45]
  - - [34944, 96, 1, 96]
    - [96, 3214.01]
  - - [9600, 192, 1, 192]
    - [104, 3684.87]
  - - [27392, 58, 1, 66]
    - [63, 1987.43]
  - - [43744, 32, 1, 32]
    - [40, 1479.32]
  - - [39216, 48, 1, 48]
    - [52, 2120.98]
  - - [27736, 30, 1, 36]
    - [38, 1235.76]
  - - [22320, 48, 1, 48]
    - [96, 2011.94]
  - - [22368, 96, 1, 96]
    - [94, 3091.53]
  - - [42656, 32, 1, 32]
    - [40, 1461.84]
  - - [39768, 30, 1, 36]
    - [40, 1261.73]
  - - [35072, 30, 1, 36]
    - [45, 1198.66]
  - - [18432, 192, 1, 192]
    - [199, 4048.37]
  - - [42240, 66, 1, 66]
    - [98, 2027.3]
  - - [7424, 30, 1, 36]
    - [43, 698.425]
  - - [34202, 30, 1, 36]
    - [74, 1188.49]
  - - [18176, 58, 1, 66]
    - [45, 1840.68]
  - - [14424, 30, 1, 36]
    - [74, 985.944]
  - - [8976, 48, 1, 48]
    - [37, 1353.45]
  - - [39738, 58, 1, 66]
    - [172, 2163.21]
  - - [32496, 48, 1, 48]
    - [51, 2047.89]
  - - [44192, 32, 1, 32]
    - [45, 1473.07]
  - - [826, 58, 1, 66]
    - [37, 304.032]
  - - [24152, 30, 1, 36]
    - [74, 1242.1]
  - - [2208, 32, 1, 32]
    - [74, 317.555]
  - - [22718, 66, 1, 66]
    - [57, 1903.07]
  - - [29792, 32, 1, 32]
    - [38, 1414.98]
  - - [31168, 64, 1, 64]
    - [168, 2458.86]
  - - [21216, 32, 1, 32]
    - [76, 1337.76]
  - - [35072, 66, 1, 66]
    - [57, 1941.71]
  - - [22592, 64, 1, 64]
    - [117, 2358.23]
  - - [7920, 48, 1, 48]
    - [119, 1361.77]
  - - [44064, 32, 1, 32]
    - [40, 1442.5]
  - - [29184, 48, 1, 48]
    - [51, 1998.81]
  - - [10848, 96, 1, 96]
    - [96, 2859.7]
  - - [30336, 96, 1, 96]
    - [96, 3130.06]
  - - [37018, 30, 1, 36]
    - [45, 1229.38]
  - - [18816, 96, 1, 96]
    - [92, 2943.11]
  - - [43520, 30, 1, 36]
    - [76, 1255.38]
  - - [5440, 64, 1, 64]
    - [124, 1582.55]
  - - [12508, 30, 1, 36]
    - [37, 940.713]
  - - [31678, 66, 1, 66]
    - [98, 1960.08]
  - - [21120, 192, 1, 192]
    - [194, 4011.59]
  - - [2048, 124, 1, 132]
    - [141, 1764.3]
  - - [154, 30, 1, 36]
    - [67, 22.3548]
  - - [40368, 48, 1, 48]
    - [57, 2127.35]
  - - [27024, 48, 1, 48]
    - [133, 1898.27]
  - - [39584, 32, 1, 32]
    - [76, 1466.5]
  - - [33408, 96, 1, 96]
    - [94, 3149.43]
  - - [35616, 96, 1, 96]
    - [96, 3235.78]
  - - [44288, 30, 1, 36]
    - [45, 1257.39]
  - - [31898, 30, 1, 36]
    - [38, 1257.29]
  - - [39358, 66, 1, 66]
    - [184, 1989.83]
  - - [30976, 124, 1, 132]
    - [146, 3303.47]
  - - [7264, 32, 1, 32]
    - [76, 808.515]
  - - [39600, 48, 1, 48]
    - [52, 2133.73]
  - - [4798, 66, 1, 66]
    - [124, 1367.81]
  - - [21168, 48, 1, 48]
    - [52, 1953.97]
  - - [22016, 58, 1, 66]
    - [183, 1891.32]
  - - [11930, 30, 1, 36]
    - [74, 909.915]
  - - [1344, 64, 1, 64]
    - [119, 580.699]
  - - [23610, 58, 1, 66]
    - [49, 1964.76]
  - - [10464, 32, 1, 32]
    - [37, 1014.69]
  - - [8704, 128, 1, 128]
    - [103, 3146.65]
  - - [27264, 48, 1, 48]
    - [51, 1917.47]
  - - [15550, 66, 1, 66]
    - [184, 1762.12]
  - - [38048, 32, 1, 32]
    - [76, 1445.15]
  - - [21344, 32, 1, 32]
    - [37, 1345.83]
  - - [30432, 32, 1, 32]
    - [41, 1419.05]
  - - [36048, 48, 1, 48]
    - [54, 2066.03]
  - - [15648, 96, 1, 96]
    - [209, 2914.55]
  - - [26712, 30, 1, 36]
    - [38, 1208.08]
  - - [10896, 48, 1, 48]
    - [54, 1515.97]
  - - [41328, 48, 1, 48]
    - [52, 2086.32]
  - - [32224, 32, 1, 32]
    - [38, 1457.48]
  - - [24624, 48, 1, 48]
    - [51, 1804.51]
  - - [39456, 96, 1, 96]
    - [164, 3223.65]
  - - [36800, 64, 1, 64]
    - [118, 2503.87]
  - - [30940, 30, 1, 36]
    - [38, 1246.84]
  - - [7936, 66, 1, 66]
    - [91, 1600.43]
  - - [2560, 66, 1, 66]
    - [78, 929.28]
  - - [7456, 32, 1, 32]
    - [37, 829.885]
  - - [28224, 64, 1, 64]
    - [117, 2317.67]
  - - [27648, 48, 1, 48]
    - [51, 1944.47]
  - - [34512, 48, 1, 48]
    - [135, 1904.11]
  - - [17152, 58, 1, 66]
    - [45, 1795.89]
  - - [9840, 48, 1, 48]
    - [43, 1460.78]
  - - [11264, 58, 1, 66]
    - [131, 1781.76]
  - - [3744, 96, 1, 96]
    - [124, 2024.92]
  - - [29528, 30, 1, 36]
    - [44, 1222.79]
  - - [35616, 32, 1, 32]
    - [45, 1379.38]
  - - [39776, 32, 1, 32]
    - [40, 1458.83]
  - - [7256, 30, 1, 36]
    - [74, 702.194]
  - - [23808, 124, 1, 132]
    - [146, 3195.23]
  - - [26624, 30, 1, 36]
    - [44, 1220.46]
  - - [19200, 96, 1, 96]
    - [94, 3013.41]
  - - [29916, 30, 1, 36]
    - [38, 1238.85]
  - - [43966, 66, 1, 66]
    - [184, 1982.57]
  - - [19536, 48, 1, 48]
    - [52, 1991.63]
  - - [24832, 128, 1, 128]
    - [194, 3498.86]
  - - [43520, 58, 1, 66]
    - [98, 2112.01]
  - - [38544, 48, 1, 48]
    - [52, 2120.47]
  - - [9696, 32, 1, 32]
    - [173, 958.369]
  - - [14336, 124, 1, 132]
    - [148, 3097.3]
  - - [21402, 30, 1, 36]
    - [43, 1186.56]
  - - [29498, 58, 1, 66]
    - [98, 2027.99]
  - - [39328, 32, 1, 32]
    - [40, 1459.13]
  - - [6880, 32, 1, 32]
    - [40, 786.286]
  - - [14300, 30, 1, 36]
    - [37, 997.674]
  - - [6876, 30, 1, 36]
    - [37, 690.156]
  - - [26784, 32, 1, 32]
    - [38, 1399.33]
  - - [32064, 64, 1, 64]
    - [117, 2521.78]
  - - [17116, 30, 1, 36]
    - [37, 1050.3]
  - - [31232, 128, 1, 128]
    - [195, 3644.63]
  - - [26426, 58, 1, 66]
    - [63, 1949.86]
  - - [23088, 48, 1, 48]
    - [54, 2036.55]
  - - [37056, 64, 1, 64]
    - [118, 2496.4]
  - - [20960, 32, 1, 32]
    - [43, 1334.77]
  - - [33024, 192, 1, 192]
    - [194, 4123.98]
  - - [41568, 32, 1, 32]
    - [80, 1459.73]
  - - [29920, 32, 1, 32]
    - [38, 1426.35]
  - - [19968, 66, 1, 66]
    - [98, 1861.74]
  - - [34238, 66, 1, 66]
    - [57, 1928.88]
  - - [6912, 192, 1, 192]
    - [201, 3399.2]
  - - [9216, 30, 1, 36]
    - [44, 756.328]
  - - [2368, 64, 1, 64]
    - [141, 921.989]
  - - [9626, 30, 1, 36]
    - [37, 812.194]
  - - [33792, 66, 1, 66]
    - [57, 1905.72]
  - - [27552, 32, 1, 32]
    - [77, 1419.18]
  - - [26592, 96, 1, 96]
    - [188, 3018.13]
  - - [22032, 48, 1, 48]
    - [57, 2043.55]
  - - [25440, 96, 1, 96]
    - [179, 2904.55]
  - - [25968, 48, 1, 48]
    - [58, 1848.9]
  - - [40032, 32, 1, 32]
    - [40, 1470.33]
  - - [10752, 30, 1, 36]
    - [37, 871.784]
  - - [36640, 32, 1, 32]
    - [40, 1404.17]
  - - [41920, 64, 1, 64]
    - [108, 2495.7]
  - - [7738, 58, 1, 66]
    - [127, 1649.28]
  - - [8096, 32, 1, 32]
    - [40, 859.99]
  - - [14080, 128, 1, 128]
    - [142, 3304.97]
  - - [25280, 64, 1, 64]
    - [142, 2203.13]
  - - [37024, 32, 1, 32]
    - [40, 1406.25]
  - - [31872, 48, 1, 48]
    - [51, 2058.1]
  - - [31488, 30, 1, 36]
    - [44, 1250.26]
  - - [29408, 32, 1, 32]
    - [38, 1439.47]
  - - [2816, 58, 1, 66]
    - [43, 886.484]
  - - [352, 32, 1, 32]
    - [40, 51.4926]
  - - [30784, 64, 1, 64]
    - [117, 2453.14]
  - - [2544, 48, 1, 48]
    - [37, 645.526]
  - - [26928, 48, 1, 48]
    - [51, 1882.35]
  - - [11360, 32, 1, 32]
    - [74, 1046.1]
  - - [25432, 30, 1, 36]
    - [41, 1150.19]
  - - [26844, 30, 1, 36]
    - [38, 1220.18]
  - - [23424, 192, 1, 192]
    - [194, 4025.28]
  - - [40192, 128, 1, 128]
    - [146, 3668.15]
  - - [33946, 30, 1, 36]
    - [43, 1173.55]
  - - [2112, 64, 1, 64]
    - [141, 831.803]
  - - [16064, 64, 1, 64]
    - [110, 2284.66]
  - - [39120, 48, 1, 48]
    - [90, 2137.87]
  - - [21952, 64, 1, 64]
    - [117, 2317.41]
  - - [39870, 66, 1, 66]
    - [184, 1989.85]
  - - [2816, 124, 1, 132]
    - [127, 2068.77]
  - - [17152, 66, 1, 66]
    - [57, 1704.25]
  - - [35856, 48, 1, 48]
    - [52, 2075.68]
  - - [15008, 32, 1, 32]
    - [37, 1178.54]
  - - [9436, 30, 1, 36]
    - [37, 811.376]
  - - [32000, 58, 1, 66]
    - [98, 2106.19]
  - - [35776, 64, 1, 64]
    - [115, 2465.32]
  - - [14782, 66, 1, 66]
    - [56, 1690.92]
  - - [9696, 96, 1, 96]
    - [94, 2757.97]
  - - [34336, 32, 1, 32]
    - [37, 1346.1]
  - - [37408, 32, 1, 32]
    - [45, 1418.73]
  - - [39072, 32, 1, 32]
    - [45, 1445.44]
  - - [14168, 30, 1, 36]
    - [37, 998.788]
  - - [446, 66, 1, 66]
    - [37, 194.278]
  - - [33216, 64, 1, 64]
    - [111, 2400.37]
  - - [12720, 48, 1, 48]
    - [51, 1613.81]
  - - [12990, 66, 1, 66]
    - [56, 1575.29]
  - - [7578, 30, 1, 36]
    - [76, 710.437]
  - - [9408, 64, 1, 64]
    - [142, 1938.39]
  - - [33600, 64, 1, 64]
    - [117, 2382.71]
  - - [17920, 30, 1, 36]
    - [74, 1107.19]
  - - [25376, 32, 1, 32]
    - [41, 1353.39]
  - - [41568, 96, 1, 96]
    - [155, 3262.01]
  - - [26016, 32, 1, 32]
    - [41, 1381.76]
  - - [43776, 128, 1, 128]
    - [195, 3729.34]
  - - [28160, 30, 1, 36]
    - [38, 1244.39]
  - - [24960, 192, 1, 192]
    - [194, 4049.14]
  - - [17342, 66, 1, 66]
    - [60, 1724.7]
  - - [23952, 48, 1, 48]
    - [54, 2096.71]
  - - [8224, 32, 1, 32]
    - [173, 845.52]
  - - [42624, 192, 1, 192]
    - [202, 4286.12]
  - - [33456, 48, 1, 48]
    - [92, 1966.39]
  - - [36352, 124, 1, 132]
    - [142, 3367.73]
  - - [33792, 128, 1, 128]
    - [146, 3585.81]
  - - [15616, 30, 1, 36]
    - [37, 1015.98]
  - - [7680, 66, 1, 66]
    - [136, 1578.02]
  - - [12864, 64, 1, 64]
    - [81, 2064.69]
  - - [12960, 96, 1, 96]
    - [45, 2762.24]
  - - [24986, 30, 1, 36]
    - [38, 1171.22]
  - - [5178, 58, 1, 66]
    - [124, 1304.04]
  - - [3738, 30, 1, 36]
    - [74, 460.849]
  - - [34560, 124, 1, 132]
    - [146, 3273.6]
  - - [10608, 48, 1, 48]
    - [53, 1486.67]
  - - [32314, 58, 1, 66]
    - [99, 2115.22]
  - - [35008, 64, 1, 64]
    - [117, 2453.68]
  - - [3840, 58, 1, 66]
    - [127, 1090.47]
  - - [1824, 96, 1, 96]
    - [139, 1247.03]
  - - [32410, 30, 1, 36]
    - [75, 1259.09]
  - - [2904, 30, 1, 36]
    - [43, 361.327]
  - - [10432, 64, 1, 64]
    - [195, 2054.3]
  - - [25790, 66, 1, 66]
    - [184, 1780.93]
  - - [38432, 32, 1, 32]
    - [45, 1432.11]
  - - [23904, 32, 1, 32]
    - [37, 1387.62]
  - - [36864, 124, 1, 132]
    - [146, 3382.99]
  - - [31744, 66, 1, 66]
    - [98, 1970.88]
  - - [25664, 64, 1, 64]
    - [146, 2248.07]
  - - [23376, 48, 1, 48]
    - [60, 2094.02]
  - - [33756, 30, 1, 36]
    - [76, 1174.5]
  - - [43680, 96, 1, 96]
    - [163, 3291.0]
  - - [26448, 48, 1, 48]
    - [58, 1869.21]
  - - [10016, 32, 1, 32]
    - [74, 953.196]
  - - [27070, 66, 1, 66]
    - [179, 1821.95]
  - - [34032, 48, 1, 48]
    - [52, 2008.45]
  - - [480, 32, 1, 32]
    - [37, 71.0289]
  - - [17408, 30, 1, 36]
    - [37, 1100.74]
  - - [7644, 30, 1, 36]
    - [37, 714.145]
  - - [44032, 124, 1, 132]
    - [142, 3411.84]
  - - [21248, 30, 1, 36]
    - [74, 1173.2]
  - - [34816, 66, 1, 66]
    - [57, 1939.37]
  - - [42560, 64, 1, 64]
    - [172, 2497.5]
  - - [17712, 48, 1, 48]
    - [52, 1825.06]
  - - [41472, 30, 1, 36]
    - [78, 1260.97]
  - - [4608, 128, 1, 128]
    - [83, 2560.97]
  - - [41728, 66, 1, 66]
    - [98, 2001.84]
  - - [18688, 30, 1, 36]
    - [37, 1123.78]
  - - [30976, 58, 1, 66]
    - [98, 2114.41]
  - - [1536, 192, 1, 192]
    - [122, 2184.53]
  - - [33312, 32, 1, 32]
    - [37, 1332.48]
  - - [37632, 96, 1, 96]
    - [187, 3157.47]
  - - [4864, 30, 1, 36]
    - [37, 563.639]
  - - [17818, 30, 1, 36]
    - [74, 1093.38]
  - - [35104, 32, 1, 32]
    - [80, 1359.55]
  - - [28096, 64, 1, 64]
    - [117, 2327.69]
  - - [21312, 64, 1, 64]
    - [117, 2273.28]
  - - [41472, 192, 1, 192]
    - [202, 4195.92]
  - - [19520, 64, 1, 64]
    - [145, 2225.89]
  - - [1152, 48, 1, 48]
    - [37, 315.977]
  - - [26880, 128, 1, 128]
    - [195, 3567.74]
  - - [37376, 58, 1, 66]
    - [117, 2119.01]
  - - [44224, 64, 1, 64]
    - [172, 2527.09]
  - - [28656, 48, 1, 48]
    - [58, 1941.87]
  - - [28480, 64, 1, 64]
    - [114, 2325.64]
  - - [43392, 96, 1, 96]
    - [210, 3289.74]
  - - [42240, 30, 1, 36]
    - [37, 1261.59]
  - - [37310, 66, 1, 66]
    - [182, 1951.52]
  - - [4410, 58, 1, 66]
    - [122, 1084.95]
  - - [1696, 32, 1, 32]
    - [37, 239.876]
  - - [13408, 32, 1, 32]
    - [74, 1107.24]
  - - [21306, 58, 1, 66]
    - [45, 1900.26]
  - - [10144, 32, 1, 32]
    - [122, 961.801]
  - - [15200, 32, 1, 32]
    - [37, 1179.15]
  - - [35712, 48, 1, 48]
    - [52, 2092.59]
  - - [3552, 32, 1, 32]
    - [37, 483.677]
  - - [41152, 64, 1, 64]
    - [172, 2527.87]
  - - [25728, 48, 1, 48]
    - [133, 1843.2]
  - - [38352, 48, 1, 48]
    - [52, 2120.03]
  - - [2880, 64, 1, 64]
    - [119, 1027.57]
  - - [2524, 30, 1, 36]
    - [43, 324.514]
  - - [32988, 30, 1, 36]
    - [74, 1176.59]
  - - [24256, 64, 1, 64]
    - [117, 2444.7]
  - - [19616, 32, 1, 32]
    - [74, 1335.56]
  - - [32768, 124, 1, 132]
    - [142, 3341.31]
  - - [30144, 64, 1, 64]
    - [114, 2424.78]
  - - [15294, 66, 1, 66]
    - [56, 1725.92]
  - - [35328, 48, 1, 48]
    - [52, 2072.19]
  - - [21568, 64, 1, 64]
    - [114, 2291.04]
  - - [9936, 48, 1, 48]
    - [45, 1494.29]
  - - [41088, 192, 1, 192]
    - [199, 4188.8]
  - - [41150, 66, 1, 66]
    - [98, 2000.56]
  - - [35472, 48, 1, 48]
    - [90, 2045.23]
  - - [23200, 32, 1, 32]
    - [37, 1414.1]
  - - [17628, 30, 1, 36]
    - [37, 1084.18]
  - - [31232, 30, 1, 36]
    - [44, 1247.43]
  - - [22974, 66, 1, 66]
    - [57, 1909.82]
  - - [35262, 66, 1, 66]
    - [57, 1945.3]
  - - [12896, 32, 1, 32]
    - [37, 1104.14]
  - - [16128, 128, 1, 128]
    - [145, 3336.38]
  - - [42528, 32, 1, 32]
    - [76, 1455.5]
  - - [27328, 64, 1, 64]
    - [113, 2286.26]
  - - [21212, 30, 1, 36]
    - [74, 1161.71]
  - - [2238, 66, 1, 66]
    - [43, 815.111]
  - - [21600, 96, 1, 96]
    - [94, 3041.96]
  - - [41376, 96, 1, 96]
    - [158, 3240.32]
  - - [24640, 64, 1, 64]
    - [146, 2176.99]
  - - [10416, 48, 1, 48]
    - [53, 1459.76]
  - - [16128, 66, 1, 66]
    - [56, 1794.01]
  - - [3226, 30, 1, 36]
    - [76, 397.726]
  - - [5696, 64, 1, 64]
    - [145, 1620.2]
  - - [9024, 64, 1, 64]
    - [192, 1870.56]
  - - [16282, 30, 1, 36]
    - [37, 1024.74]
  - - [33936, 48, 1, 48]
    - [52, 2025.61]
  - - [34752, 64, 1, 64]
    - [112, 2440.74]
  - - [34208, 32, 1, 32]
    - [43, 1368.32]
  - - [29272, 30, 1, 36]
    - [75, 1219.67]
  - - [32768, 30, 1, 36]
    - [75, 1253.17]
  - - [21664, 32, 1, 32]
    - [37, 1359.31]
  - - [24000, 64, 1, 64]
    - [171, 2435.68]
  - - [27392, 124, 1, 132]
    - [170, 3187.04]
  - - [144, 48, 1, 48]
    - [45, 40.6588]
  - - [33072, 48, 1, 48]
    - [57, 1951.79]
  - - [27264, 96, 1, 96]
    - [179, 3043.42]
  - - [9216, 128, 1, 128]
    - [71, 3101.79]
  - - [5376, 66, 1, 66]
    - [124, 1493.49]
  - - [12032, 66, 1, 66]
    - [92, 1819.84]
  - - [23328, 96, 1, 96]
    - [96, 3143.14]
  - - [21056, 64, 1, 64]
    - [168, 2245.97]
  - - [13088, 32, 1, 32]
    - [74, 1091.38]
  - - [43608, 30, 1, 36]
    - [40, 1271.51]
  - - [32826, 58, 1, 66]
    - [169, 2029.36]
  - - [24736, 32, 1, 32]
    - [44, 1338.78]
  - - [30016, 64, 1, 64]
    - [114, 2420.19]
  - - [33178, 30, 1, 36]
    - [76, 1180.25]
  - - [38592, 64, 1, 64]
    - [118, 2577.83]
  - - [27072, 64, 1, 64]
    - [98, 2255.63]
  - - [27136, 128, 1, 128]
    - [146, 3501.87]
  - - [23664, 48, 1, 48]
    - [94, 2055.88]
  - - [40506, 58, 1, 66]
    - [172, 2172.88]
  - - [6656, 58, 1, 66]
    - [124, 1553.61]
  - - [11552, 32, 1, 32]
    - [37, 1067.62]
  - - [33024, 30, 1, 36]
    - [37, 1190.45]
  - - [4352, 58, 1, 66]
    - [124, 1169.91]
  - - [4696, 30, 1, 36]
    - [76, 546.517]
  - - [14936, 30, 1, 36]
    - [37, 1018.36]
  - - [12224, 64, 1, 64]
    - [145, 2188.35]
  - - [33982, 66, 1, 66]
    - [60, 1934.47]
  - - [33112, 30, 1, 36]
    - [76, 1168.66]
  - - [40704, 30, 1, 36]
    - [76, 1248.87]
  - - [41248, 32, 1, 32]
    - [45, 1462.53]
  - - [7904, 32, 1, 32]
    - [37, 850.178]
  - - [17280, 96, 1, 96]
    - [94, 2837.71]
  - - [2640, 48, 1, 48]
    - [37, 669.885]
  - - [27136, 58, 1, 66]
    - [63, 1974.84]
  - - [15038, 66, 1, 66]
    - [56, 1716.6]
  - - [10496, 124, 1, 132]
    - [61, 2836.83]
  - - [18208, 32, 1, 32]
    - [76, 1239.69]
  - - [23488, 64, 1, 64]
    - [114, 2414.83]
  - - [29136, 48, 1, 48]
    - [51, 1986.08]
  - - [14592, 48, 1, 48]
    - [52, 1815.33]
  - - [14556, 30, 1, 36]
    - [37, 1010.31]
  - - [39616, 64, 1, 64]
    - [115, 2593.78]
  - - [18842, 30, 1, 36]
    - [37, 1133.04]
  - - [29440, 30, 1, 36]
    - [38, 1232.37]
  - - [37488, 48, 1, 48]
    - [54, 2078.26]
  - - [42942, 66, 1, 66]
    - [100, 2001.88]
  - - [37822, 66, 1, 66]
    - [182, 1952.97]
  - - [18480, 48, 1, 48]
    - [52, 1931.85]
  - - [9248, 32, 1, 32]
    - [119, 903.621]
  - - [21848, 30, 1, 36]
    - [74, 1206.33]
  - - [29184, 192, 1, 192]
    - [200, 4120.1]
  - - [4928, 64, 1, 64]
    - [141, 1484.2]
  - - [25184, 32, 1, 32]
    - [75, 1363.02]
  - - [2304, 192, 1, 192]
    - [124, 2892.87]
  - - [34816, 58, 1, 66]
    - [114, 2049.13]
  - - [8704, 30, 1, 36]
    - [76, 755.653]
  - - [38912, 124, 1, 132]
    - [146, 3390.72]
  - - [39840, 96, 1, 96]
    - [164, 3241.22]
  - - [42906, 30, 1, 36]
    - [45, 1257.83]
  - - [5136, 48, 1, 48]
    - [119, 1060.34]
  - - [34416, 48, 1, 48]
    - [54, 2024.88]
  - - [11136, 48, 1, 48]
    - [51, 1534.53]
  - - [3840, 30, 1, 36]
    - [37, 467.027]
  - - [31232, 66, 1, 66]
    - [98, 1963.72]
  - - [25536, 64, 1, 64]
    - [195, 2208.52]
  - - [42240, 48, 1, 48]
    - [52, 2132.36]
  - - [7226, 58, 1, 66]
    - [127, 1582.44]
  - - [13728, 32, 1, 32]
    - [37, 1126.4]
  - - [30576, 48, 1, 48]
    - [51, 2015.08]
  - - [43008, 192, 1, 192]
    - [202, 4333.72]
  - - [20122, 30, 1, 36]
    - [74, 1173.42]
  - - [3072, 58, 1, 66]
    - [119, 948.356]
  - - [14400, 64, 1, 64]
    - [192, 2181.3]
  - - [10224, 48, 1, 48]
    - [45, 1479.65]
  - - [6336, 64, 1, 64]
    - [145, 1748.8]
  - - [40800, 96, 1, 96]
    - [160, 3291.43]
  - - [11904, 48, 1, 48]
    - [57, 1605.79]
  - - [18944, 124, 1, 132]
    - [141, 3083.49]
  - - [22426, 30, 1, 36]
    - [37, 1213.43]
  - - [33082, 58, 1, 66]
    - [115, 2010.13]
  - - [40960, 58, 1, 66]
    - [118, 2177.71]
  - - [35424, 96, 1, 96]
    - [94, 3212.0]
  - - [13776, 48, 1, 48]
    - [51, 1724.99]
  - - [11840, 64, 1, 64]
    - [145, 2176.69]
  - - [31488, 96, 1, 96]
    - [162, 3150.17]
  - - [27808, 32, 1, 32]
    - [46, 1432.36]
  - - [29016, 30, 1, 36]
    - [38, 1203.43]
  - - [24672, 32, 1, 32]
    - [38, 1352.47]
  - - [7680, 128, 1, 128]
    - [62, 3066.01]
  - - [37792, 32, 1, 32]
    - [45, 1433.3]
  - - [10704, 48, 1, 48]
    - [53, 1489.25]
  - - [25308, 30, 1, 36]
    - [44, 1158.16]
  - - [39482, 58, 1, 66]
    - [117, 2150.5]
  - - [32352, 32, 1, 32]
    - [46, 1458.12]
  - - [32016, 48, 1, 48]
    - [91, 2035.45]
  - - [32600, 30, 1, 36]
    - [44, 1241.47]
  - - [41888, 32, 1, 32]
    - [40, 1458.96]
  - - [31546, 58, 1, 66]
    - [99, 2092.14]
  - - [5760, 48, 1, 48]
    - [119, 1124.66]
  - - [31196, 30, 1, 36]
    - [44, 1244.15]
  - - [22688, 32, 1, 32]
    - [40, 1382.89]
  - - [22656, 96, 1, 96]
    - [96, 3125.71]
  - - [29404, 30, 1, 36]
    - [44, 1221.4]
  - - [11352, 30, 1, 36]
    - [45, 868.283]
  - - [8126, 66, 1, 66]
    - [184, 1591.59]
  - - [15072, 32, 1, 32]
    - [74, 1158.69]
  - - [18384, 48, 1, 48]
    - [94, 1921.81]
  - - [8112, 48, 1, 48]
    - [122, 1346.55]
  - - [1982, 66, 1, 66]
    - [40, 765.389]
  - - [13210, 30, 1, 36]
    - [40, 951.12]
  - - [2496, 64, 1, 64]
    - [141, 975.536]
  - - [17216, 64, 1, 64]
    - [141, 2134.28]
  - - [24474, 30, 1, 36]
    - [37, 1235.14]
  - - [33500, 30, 1, 36]
    - [37, 1183.9]
  - - [10176, 64, 1, 64]
    - [192, 2011.63]
  - - [37464, 30, 1, 36]
    - [40, 1229.07]
  - - [8960, 128, 1, 128]
    - [69, 3236.35]
  - - [4640, 32, 1, 32]
    - [74, 585.143]
  - - [23904, 96, 1, 96]
    - [96, 3147.13]
  - - [38016, 96, 1, 96]
    - [158, 3170.06]
  - - [34912, 32, 1, 32]
    - [37, 1368.68]
  - - [37664, 32, 1, 32]
    - [78, 1415.86]
  - - [41918, 66, 1, 66]
    - [98, 2007.42]
  - - [29118, 66, 1, 66]
    - [98, 1895.37]
  - - [7056, 48, 1, 48]
    - [175, 1220.5]
  - - [41786, 58, 1, 66]
    - [115, 2086.03]
  - - [26544, 48, 1, 48]
    - [133, 1871.4]
  - - [33440, 32, 1, 32]
    - [40, 1341.79]
  - - [8608, 32, 1, 32]
    - [119, 877.947]
  - - [34106, 58, 1, 66]
    - [114, 1998.74]
  - - [37888, 128, 1, 128]
    - [195, 3725.14]
  - - [5120, 66, 1, 66]
    - [124, 1463.43]
  - - [24832, 124, 1, 132]
    - [146, 3201.41]
  - - [8736, 32, 1, 32]
    - [119, 877.026]
  - - [39936, 30, 1, 36]
    - [45, 1261.14]
  - - [41018, 58, 1, 66]
    - [167, 2108.18]
  - - [21120, 48, 1, 48]
    - [52, 2030.9]
  - - [41088, 96, 1, 96]
    - [158, 3266.62]
  - - [11578, 58, 1, 66]
    - [80, 1852.87]
  - - [21792, 32, 1, 32]
    - [45, 1354.07]
  - - [37434, 58, 1, 66]
    - [114, 2106.08]
  - - [11162, 30, 1, 36]
    - [45, 876.087]
  - - [43296, 96, 1, 96]
    - [163, 3277.07]
  - - [12144, 48, 1, 48]
    - [51, 1608.03]
  - - [15930, 58, 1, 66]
    - [64, 1985.03]
  - - [18624, 64, 1, 64]
    - [145, 2197.12]
  - - [7424, 58, 1, 66]
    - [124, 1640.82]
  - - [672, 32, 1, 32]
    - [37, 97.1932]
  - - [18048, 96, 1, 96]
    - [94, 2909.91]
  - - [22048, 32, 1, 32]
    - [37, 1350.31]
  - - [6488, 30, 1, 36]
    - [37, 656.09]
  - - [29440, 128, 1, 128]
    - [195, 3523.86]
  - - [16538, 30, 1, 36]
    - [43, 1021.8]
  - - [28640, 32, 1, 32]
    - [44, 1440.44]
  - - [23712, 32, 1, 32]
    - [37, 1411.69]
  - - [8512, 64, 1, 64]
    - [146, 1782.47]
  - - [36960, 32, 1, 32]
    - [40, 1422.82]
  - - [3584, 128, 1, 128]
    - [127, 2649.83]
  - - [17856, 64, 1, 64]
    - [194, 2158.74]
  - - [18528, 96, 1, 96]
    - [60, 2896.1]
  - - [12624, 48, 1, 48]
    - [52, 1612.29]
  - - [29440, 66, 1, 66]
    - [98, 1911.76]
  - - [1216, 64, 1, 64]
    - [119, 534.414]
  - - [31824, 48, 1, 48]
    - [51, 2041.27]
  - - [38752, 32, 1, 32]
    - [37, 1439.84]
  - - [36154, 58, 1, 66]
    - [118, 2078.04]
  - - [3296, 32, 1, 32]
    - [37, 453.643]
  - - [10208, 32, 1, 32]
    - [122, 940.017]
  - - [1024, 30, 1, 36]
    - [37, 145.516]
  - - [7132, 30, 1, 36]
    - [37, 690.194]
  - - [15040, 64, 1, 64]
    - [142, 2241.77]
  - - [11808, 96, 1, 96]
    - [96, 3016.15]
  - - [18432, 66, 1, 66]
    - [60, 1782.63]
  - - [29120, 64, 1, 64]
    - [117, 2360.96]
  - - [31488, 48, 1, 48]
    - [133, 2054.03]
  - - [23866, 58, 1, 66]
    - [117, 1972.35]
  - - [816, 48, 1, 48]
    - [37, 225.969]
  - - [8412, 30, 1, 36]
    - [37, 749.584]
  - - [6080, 64, 1, 64]
    - [124, 1734.24]
  - - [42080, 32, 1, 32]
    - [40, 1465.64]
  - - [9216, 192, 1, 192]
    - [145, 3705.7]
  - - [16928, 32, 1, 32]
    - [37, 1217.29]
  - - [2304, 30, 1, 36]
    - [37, 304.941]
  - - [29630, 66, 1, 66]
    - [98, 1933.32]
  - - [32476, 30, 1, 36]
    - [38, 1259.84]
  - - [18234, 58, 1, 66]
    - [45, 1882.41]
  - - [33744, 48, 1, 48]
    - [54, 2020.43]
  - - [24336, 48, 1, 48]
    - [90, 2120.66]
  - - [36896, 32, 1, 32]
    - [40, 1416.1]
  - - [2304, 96, 1, 96]
    - [122, 1466.41]
  - - [8894, 66, 1, 66]
    - [98, 1572.33]
  - - [24816, 48, 1, 48]
    - [136, 1825.54]
  - - [40156, 30, 1, 36]
    - [40, 1254.87]
  - - [25856, 30, 1, 36]
    - [75, 1181.24]
  - - [28448, 32, 1, 32]
    - [38, 1439.27]
  - - [32096, 32, 1, 32]
    - [44, 1462.02]
  - - [7994, 58, 1, 66]
    - [124, 1700.06]
  - - [9376, 32, 1, 32]
    - [37, 930.332]
  - - [32288, 32, 1, 32]
    - [41, 1468.16]
  - - [40448, 58, 1, 66]
    - [118, 2186.93]
  - - [4224, 96, 1, 96]
    - [178, 2129.56]
  - - [10992, 48, 1, 48]
    - [76, 1486.24]
  - - [32446, 66, 1, 66]
    - [99, 1955.38]
  - - [6912, 48, 1, 48]
    - [173, 1225.02]
  - - [43776, 58, 1, 66]
    - [118, 2123.35]
  - - [30618, 30, 1, 36]
    - [75, 1235.7]
  - - [18432, 96, 1, 96]
    - [96, 2949.12]
  - - [23136, 96, 1, 96]
    - [94, 3100.95]
  - - [320, 64, 1, 64]
    - [37, 145.636]
  - - [10972, 30, 1, 36]
    - [78, 861.174]
  - - [27648, 58, 1, 66]
    - [44, 1929.92]
  - - [7872, 64, 1, 64]
    - [124, 1947.08]
  - - [19936, 32, 1, 32]
    - [76, 1329.07]
  - - [21146, 30, 1, 36]
    - [37, 1174.78]
  - - [16384, 124, 1, 132]
    - [63, 3195.58]
  - - [36960, 96, 1, 96]
    - [155, 3130.73]
  - - [44032, 66, 1, 66]
    - [182, 1974.1]
  - - [28124, 30, 1, 36]
    - [38, 1232.71]
  - - [40464, 48, 1, 48]
    - [133, 2035.57]
  - - [13216, 32, 1, 32]
    - [119, 1091.39]
  - - [4992, 96, 1, 96]
    - [124, 2426.49]
  - - [1024, 124, 1, 132]
    - [119, 1068.93]
  - - [42288, 48, 1, 48]
    - [52, 2119.92]
  - - [25488, 48, 1, 48]
    - [133, 1844.36]
  - - [16896, 66, 1, 66]
    - [60, 1710.01]
  - - [2144, 32, 1, 32]
    - [37, 310.093]
  - - [22272, 96, 1, 96]
    - [94, 3106.22]
  - - [7168, 124, 1, 132]
    - [65, 2798.8]
  - - [18944, 128, 1, 128]
    - [193, 3353.27]
  - - [3774, 66, 1, 66]
    - [124, 1181.0]
  - - [24864, 96, 1, 96]
    - [178, 2880.17]
  - - [8256, 64, 1, 64]
    - [78, 1849.92]
  - - [11952, 48, 1, 48]
    - [52, 1589.92]
  - - [3328, 128, 1, 128]
    - [127, 2496.61]
  - - [30266, 58, 1, 66]
    - [98, 2054.22]
  - - [36316, 30, 1, 36]
    - [40, 1213.53]
  - - [6810, 30, 1, 36]
    - [40, 681.0]
  - - [14144, 64, 1, 64]
    - [142, 2164.94]
  - - [22176, 32, 1, 32]
    - [40, 1364.68]
  - - [29184, 124, 1, 132]
    - [142, 3285.31]
  - - [42144, 96, 1, 96]
    - [154, 3260.57]
  - - [43008, 128, 1, 128]
    - [146, 3679.99]
  - - [26938, 58, 1, 66]
    - [63, 1969.42]
  - - [18368, 64, 1, 64]
    - [141, 2207.61]
  - - [6528, 192, 1, 192]
    - [145, 3600.36]
  - - [38160, 48, 1, 48]
    - [90, 2101.35]
  - - [39792, 48, 1, 48]
    - [57, 2132.11]
  - - [12288, 48, 1, 48]
    - [52, 1630.85]
  - - [27648, 192, 1, 192]
    - [202, 4084.71]
  - - [1536, 128, 1, 128]
    - [141, 1592.77]
  - - [14624, 32, 1, 32]
    - [37, 1184.73]
  - - [1680, 48, 1, 48]
    - [37, 460.8]
  - - [16032, 96, 1, 96]
    - [95, 2950.3]
  - - [23004, 30, 1, 36]
    - [37, 1215.48]
  - - [35376, 48, 1, 48]
    - [52, 2045.84]
  - - [38144, 30, 1, 36]
    - [80, 1234.88]
  - - [35328, 66, 1, 66]
    - [60, 1929.4]
  - - [1376, 32, 1, 32]
    - [37, 196.791]
  - - [2816, 66, 1, 66]
    - [43, 982.892]
  - - [3072, 66, 1, 66]
    - [43, 1038.95]
  - - [38400, 66, 1, 66]
    - [182, 1948.63]
  - - [10528, 32, 1, 32]
    - [37, 987.241]
  - - [15360, 30, 1, 36]
    - [74, 1029.08]
  - - [41216, 66, 1, 66]
    - [98, 2011.84]
  - - [29376, 64, 1, 64]
    - [117, 2400.72]
  - - [23760, 48, 1, 48]
    - [60, 2095.83]
  - - [31452, 30, 1, 36]
    - [44, 1248.83]
  - - [35584, 30, 1, 36]
    - [37, 1220.8]
  - - [10688, 64, 1, 64]
    - [142, 2080.71]
  - - [42192, 48, 1, 48]
    - [52, 2124.35]
  - - [12912, 48, 1, 48]
    - [89, 1613.3]
  - - [29952, 128, 1, 128]
    - [194, 3646.95]
  - - [6144, 58, 1, 66]
    - [124, 1503.79]
  - - [2592, 32, 1, 32]
    - [37, 368.64]
  - - [32416, 32, 1, 32]
    - [44, 1458.44]
  - - [20480, 128, 1, 128]
    - [193, 3457.79]
  - - [35292, 30, 1, 36]
    - [45, 1209.24]
  - - [2136, 30, 1, 36]
    - [76, 282.706]
  - - [7680, 96, 1, 96]
    - [49, 2681.02]
  - - [29886, 66, 1, 66]
    - [98, 1911.09]
  - - [31904, 32, 1, 32]
    - [41, 1448.12]
  - - [16728, 30, 1, 36]
    - [43, 1033.54]
  - - [5856, 96, 1, 96]
    - [46, 2302.43]
  - - [26368, 30, 1, 36]
    - [44, 1214.91]
  - - [43488, 96, 1, 96]
    - [206, 3294.85]
  - - [19610, 30, 1, 36]
    - [37, 1158.58]
  - - [37632, 66, 1, 66]
    - [184, 1964.59]
  - - [480, 96, 1, 96]
    - [138, 372.364]
  - - [13008, 48, 1, 48]
    - [52, 1657.66]
  - - [40250, 58, 1, 66]
    - [115, 2177.46]
  - - [38496, 32, 1, 32]
    - [45, 1447.13]
  - - [42624, 48, 1, 48]
    - [54, 2146.1]
  - - [31040, 64, 1, 64]
    - [117, 2475.46]
  - - [11488, 32, 1, 32]
    - [37, 1061.71]
  - - [17664, 30, 1, 36]
    - [37, 1096.39]
  - - [5720, 30, 1, 36]
    - [45, 625.263]
  - - [9984, 48, 1, 48]
    - [74, 1478.35]
  - - [24192, 192, 1, 192]
    - [200, 4098.41]
  - - [5852, 30, 1, 36]
    - [74, 629.498]
  - - [23232, 64, 1, 64]
    - [171, 2388.51]
  - - [35840, 124, 1, 132]
    - [146, 3371.44]
  - - [13056, 30, 1, 36]
    - [37, 947.613]
  - - [12192, 96, 1, 96]
    - [96, 3049.99]
  - - [19168, 32, 1, 32]
    - [37, 1312.03]
  - - [34656, 32, 1, 32]
    - [40, 1379.77]
  - - [13872, 48, 1, 48]
    - [51, 1692.85]
  - - [31488, 192, 1, 192]
    - [200, 4159.29]
  - - [18080, 32, 1, 32]
    - [45, 1250.94]
  - - [38064, 48, 1, 48]
    - [90, 2100.08]
  - - [43728, 48, 1, 48]
    - [54, 2141.78]
  - - [2304, 48, 1, 48]
    - [40, 587.214]
  - - [39072, 96, 1, 96]
    - [163, 3202.49]
  - - [30272, 64, 1, 64]
    - [117, 2427.45]
  - - [22272, 192, 1, 192]
    - [202, 4074.22]
  - - [9274, 58, 1, 66]
    - [80, 1696.98]
  - - [4096, 30, 1, 36]
    - [43, 489.345]
  - - [43352, 30, 1, 36]
    - [45, 1242.57]
  - - [30336, 48, 1, 48]
    - [133, 2013.08]
  - - [22616, 30, 1, 36]
    - [40, 1192.64]
  - - [528, 48, 1, 48]
    - [37, 149.817]
  - - [5088, 96, 1, 96]
    - [119, 2382.67]
  - - [12320, 32, 1, 32]
    - [37, 1072.76]
  - - [18288, 48, 1, 48]
    - [52, 1884.42]
  - - [38720, 64, 1, 64]
    - [118, 2556.37]
  - - [15580, 30, 1, 36]
    - [37, 1038.67]
  - - [13312, 30, 1, 36]
    - [37, 966.194]
  - - [21818, 58, 1, 66]
    - [183, 1903.36]
  - - [10810, 58, 1, 66]
    - [131, 1684.88]
  - - [11168, 32, 1, 32]
    - [119, 1024.73]
  - - [27648, 30, 1, 36]
    - [75, 1244.16]
  - - [28416, 96, 1, 96]
    - [154, 3144.59]
  - - [17376, 32, 1, 32]
    - [45, 1218.7]
  - - [9504, 32, 1, 32]
    - [37, 935.778]
  - - [43776, 96, 1, 96]
    - [158, 3303.63]
  - - [5376, 58, 1, 66]
    - [124, 1361.07]
  - - [34720, 32, 1, 32]
    - [45, 1367.43]
  - - [5208, 30, 1, 36]
    - [37, 585.9]
  - - [17904, 48, 1, 48]
    - [92, 1838.27]
  - - [11872, 32, 1, 32]
    - [37, 1073.93]
  - - [5760, 96, 1, 96]
    - [162, 2288.11]
  - - [29664, 32, 1, 32]
    - [77, 1422.09]
  - - [32768, 128, 1, 128]
    - [146, 3601.23]
  - - [16698, 58, 1, 66]
    - [43, 1752.19]
  - - [2202, 30, 1, 36]
    - [37, 291.441]
  - - [32160, 32, 1, 32]
    - [79, 1459.74]
  - - [9280, 64, 1, 64]
    - [142, 1927.53]
  - - [18432, 48, 1, 48]
    - [90, 1951.62]
  - - [40924, 30, 1, 36]
    - [76, 1270.06]
  - - [36000, 96, 1, 96]
    - [160, 3227.39]
  - - [25344, 124, 1, 132]
    - [142, 3182.19]
  - - [9984, 124, 1, 132]
    - [145, 2916.1]
  - - [34320, 48, 1, 48]
    - [52, 2013.07]
  - - [24192, 96, 1, 96]
    - [94, 3185.05]
  - - [43152, 48, 1, 48]
    - [57, 2124.41]
  - - [30496, 32, 1, 32]
    - [38, 1437.75]
  - - [16128, 58, 1, 66]
    - [62, 1973.72]
  - - [13440, 48, 1, 48]
    - [51, 1708.93]
  - - [13020, 30, 1, 36]
    - [37, 963.123]
  - - [344, 30, 1, 36]
    - [67, 50.4783]
  - - [7614, 66, 1, 66]
    - [56, 1521.4]
  - - [22462, 66, 1, 66]
    - [57, 1897.68]
  - - [38590, 66, 1, 66]
    - [182, 1969.28]
  - - [31832, 30, 1, 36]
    - [75, 1254.69]
  - - [3504, 48, 1, 48]
    - [37, 834.01]
  - - [12800, 30, 1, 36]
    - [74, 957.341]
  - - [30208, 58, 1, 66]
    - [98, 2060.52]
  - - [10650, 30, 1, 36]
    - [74, 860.928]
  - - [28352, 64, 1, 64]
    - [111, 2324.46]
  - - [33840, 48, 1, 48]
    - [52, 1986.94]
  - - [26112, 58, 1, 66]
    - [62, 1931.16]
  - - [33594, 58, 1, 66]
    - [88, 1998.1]
  - - [18528, 32, 1, 32]
    - [40, 1285.41]
  - - [22272, 58, 1, 66]
    - [45, 1913.31]
  - - [29344, 32, 1, 32]
    - [46, 1409.39]
  - - [21456, 48, 1, 48]
    - [60, 2006.28]
  - - [2448, 48, 1, 48]
    - [40, 621.167]
  - - [30976, 128, 1, 128]
    - [146, 3554.0]
  - - [25776, 48, 1, 48]
    - [133, 1844.34]
  - - [44288, 58, 1, 66]
    - [98, 2128.76]
  - - [27868, 30, 1, 36]
    - [41, 1223.47]
  - - [16160, 32, 1, 32]
    - [74, 1231.24]
  - - [10752, 66, 1, 66]
    - [98, 1774.08]
  - - [8448, 124, 1, 132]
    - [70, 2967.31]
  - - [4128, 32, 1, 32]
    - [37, 547.548]
  - - [23552, 30, 1, 36]
    - [37, 1225.25]
  - - [42864, 48, 1, 48]
    - [54, 2121.11]
  - - [31456, 32, 1, 32]
    - [38, 1464.13]
  - - [30040, 30, 1, 36]
    - [38, 1230.77]
  - - [11834, 58, 1, 66]
    - [83, 1829.59]
  - - [5408, 32, 1, 32]
    - [37, 675.34]
  - - [18880, 64, 1, 64]
    - [141, 2206.98]
  - - [40032, 96, 1, 96]
    - [164, 3249.96]
  - - [6298, 30, 1, 36]
    - [45, 654.023]
  - - [17496, 30, 1, 36]
    - [78, 1076.06]
  - - [1392, 48, 1, 48]
    - [37, 389.219]
  - - [6912, 58, 1, 66]
    - [141, 1447.44]
  - - [4000, 32, 1, 32]
    - [78, 527.835]
  - - [16860, 30, 1, 36]
    - [37, 1078.72]
  - - [31232, 124, 1, 132]
    - [142, 3305.78]
  - - [31328, 32, 1, 32]
    - [44, 1458.18]
  - - [28672, 128, 1, 128]
    - [146, 3572.89]
  - - [26112, 66, 1, 66]
    - [184, 1787.3]
  - - [25344, 128, 1, 128]
    - [146, 3452.25]
  - - [10072, 30, 1, 36]
    - [82, 797.49]
  - - [34272, 96, 1, 96]
    - [94, 3173.74]
  - - [34816, 30, 1, 36]
    - [40, 1191.42]
  - - [40192, 66, 1, 66]
    - [98, 1989.5]
  - - [12256, 32, 1, 32]
    - [74, 1104.77]
  - - [24920, 30, 1, 36]
    - [44, 1164.08]
  - - [33696, 32, 1, 32]
    - [76, 1354.19]
  - - [44186, 30, 1, 36]
    - [45, 1255.81]
  - - [14160, 48, 1, 48]
    - [93, 1728.0]
  - - [13056, 66, 1, 66]
    - [59, 1602.93]
  - - [31056, 48, 1, 48]
    - [56, 2018.99]
  - - [13824, 124, 1, 132]
    - [144, 3064.34]
  - - [29594, 30, 1, 36]
    - [38, 1229.29]
  - - [35840, 128, 1, 128]
    - [146, 3626.5]
  - - [19770, 58, 1, 66]
    - [45, 1948.5]
  - - [20670, 66, 1, 66]
    - [101, 1855.7]
  - - [13152, 96, 1, 96]
    - [43, 2744.77]
  - - [10716, 30, 1, 36]
    - [74, 882.11]
  - - [42650, 30, 1, 36]
    - [80, 1246.27]
  - - [8160, 96, 1, 96]
    - [136, 2744.62]
  - - [17616, 48, 1, 48]
    - [52, 1872.11]
  - - [44128, 32, 1, 32]
    - [40, 1463.31]
  - - [20784, 48, 1, 48]
    - [96, 1934.02]
  - - [23808, 128, 1, 128]
    - [146, 3447.07]
  - - [12480, 64, 1, 64]
    - [116, 1999.92]
  - - [7168, 128, 1, 128]
    - [73, 2956.71]
  - - [30720, 128, 1, 128]
    - [146, 3602.33]
  - - [25856, 124, 1, 132]
    - [142, 3228.65]
  - - [4608, 192, 1, 192]
    - [106, 3294.59]
  - - [2208, 96, 1, 96]
    - [122, 1393.76]
  - - [12032, 30, 1, 36]
    - [37, 907.441]
  - - [18776, 30, 1, 36]
    - [74, 1114.18]
  - - [24288, 96, 1, 96]
    - [96, 3194.04]
  - - [2976, 32, 1, 32]
    - [37, 416.315]
  - - [7440, 48, 1, 48]
    - [119, 1322.67]
  - - [27120, 48, 1, 48]
    - [51, 1905.01]
  - - [28704, 96, 1, 96]
    - [96, 3037.85]
  - - [23772, 30, 1, 36]
    - [37, 1236.69]
  - - [19872, 32, 1, 32]
    - [37, 1349.4]
  - - [3386, 58, 1, 66]
    - [127, 993.988]
  - - [40536, 30, 1, 36]
    - [76, 1220.15]
  - - [4128, 96, 1, 96]
    - [122, 2063.1]
  - - [22272, 128, 1, 128]
    - [142, 3441.2]
  - - [15904, 32, 1, 32]
    - [37, 1193.97]
  - - [3840, 96, 1, 96]
    - [173, 2052.75]
  - - [14688, 96, 1, 96]
    - [162, 2817.75]
  - - [5120, 124, 1, 132]
    - [95, 2602.61]
  - - [17696, 32, 1, 32]
    - [40, 1237.75]
  - - [37600, 32, 1, 32]
    - [45, 1432.38]
  - - [42912, 32, 1, 32]
    - [40, 1464.73]
  - - [240, 48, 1, 48]
    - [67, 66.1435]
  - - [6144, 48, 1, 48]
    - [124, 1175.73]
  - - [10752, 124, 1, 132]
    - [88, 2909.87]
  - - [14234, 30, 1, 36]
    - [37, 993.07]
  - - [24890, 58, 1, 66]
    - [46, 1911.7]
  - - [37824, 64, 1, 64]
    - [112, 2521.6]
  - - [10048, 64, 1, 64]
    - [142, 2013.53]
  - - [13276, 30, 1, 36]
    - [37, 958.428]
  - - [43776, 30, 1, 36]
    - [40, 1272.28]
  - - [14544, 48, 1, 48]
    - [51, 1778.63]
  - - [42720, 96, 1, 96]
    - [206, 3274.35]
  - - [12576, 32, 1, 32]
    - [37, 1080.35]
  - - [41728, 30, 1, 36]
    - [40, 1263.07]
  - - [41536, 64, 1, 64]
    - [116, 2501.93]
  - - [6656, 124, 1, 132]
    - [79, 2731.83]
  - - [30684, 30, 1, 36]
    - [38, 1257.16]
  - - [6176, 32, 1, 32]
    - [40, 731.97]
  - - [34750, 66, 1, 66]
    - [57, 1939.66]
  - - [3216, 48, 1, 48]
    - [40, 791.631]
  - - [4992, 48, 1, 48]
    - [119, 1030.61]
  - - [38688, 32, 1, 32]
    - [76, 1437.46]
  - - [31584, 32, 1, 32]
    - [38, 1456.85]
  - - [1248, 96, 1, 96]
    - [119, 942.751]
  - - [6202, 58, 1, 66]
    - [127, 1437.12]
  - - [40800, 32, 1, 32]
    - [76, 1471.1]
  - - [36160, 64, 1, 64]
    - [168, 2458.69]
  - - [39552, 48, 1, 48]
    - [52, 2155.34]
  - - [2560, 128, 1, 128]
    - [127, 2076.39]
  - - [9406, 66, 1, 66]
    - [60, 1649.46]
  - - [8640, 64, 1, 64]
    - [78, 1923.34]
  - - [28576, 32, 1, 32]
    - [44, 1437.22]
  - - [16128, 124, 1, 132]
    - [62, 3160.72]
  - - [1200, 48, 1, 48]
    - [37, 326.038]
  - - [20992, 30, 1, 36]
    - [74, 1173.47]
  - - [14490, 30, 1, 36]
    - [45, 992.969]
  - - [10304, 64, 1, 64]
    - [146, 2068.88]
  - - [5792, 32, 1, 32]
    - [37, 719.783]
  - - [12800, 124, 1, 132]
    - [144, 2896.99]
  - - [14592, 30, 1, 36]
    - [74, 989.91]
  - - [24064, 66, 1, 66]
    - [57, 1939.73]
  - - [18400, 32, 1, 32]
    - [37, 1290.52]
  - - [26720, 32, 1, 32]
    - [38, 1407.47]
  - - [14138, 58, 1, 66]
    - [79, 1927.36]
  - - [25534, 66, 1, 66]
    - [179, 1777.91]
  - - [15424, 64, 1, 64]
    - [142, 2249.88]
  - - [15504, 48, 1, 48]
    - [89, 1868.26]
  - - [19200, 66, 1, 66]
    - [60, 1813.43]
  - - [19424, 32, 1, 32]
    - [40, 1301.71]
  - - [31536, 48, 1, 48]
    - [136, 2031.85]
  - - [11776, 124, 1, 132]
    - [88, 2993.01]
  - - [41984, 128, 1, 128]
    - [142, 3686.32]
  - - [24352, 32, 1, 32]
    - [37, 1394.66]
  - - [128, 1, 1, 128]
    - [211, 1.09814]
  - - [1408, 64, 1, 64]
    - [212, 558.834]
  - - [26240, 16, 1, 16]
    - [217, 436.197]
  - - [29952, 16, 1, 16]
    - [213, 459.695]
  - - [14208, 32, 1, 32]
    - [212, 1085.75]
  - - [1152, 64, 1, 64]
    - [216, 455.463]
  - - [14720, 16, 1, 16]
    - [235, 355.502]
  - - [44544, 32, 1, 32]
    - [236, 1333.72]
  - - [35072, 64, 1, 64]
    - [255, 2534.49]
  - - [41472, 32, 1, 32]
    - [235, 1450.39]
  - - [36992, 32, 1, 32]
    - [235, 1424.05]
  - - [33792, 32, 1, 32]
    - [221, 1370.96]
  - - [39296, 64, 1, 64]
    - [259, 2592.73]
  - - [39552, 16, 1, 16]
    - [212, 494.4]
  - - [27136, 64, 1, 64]
    - [281, 2439.62]
  - - [2944, 32, 1, 32]
    - [212, 380.638]
  - - [42752, 32, 1, 32]
    - [231, 1463.17]
  - - [30848, 64, 1, 64]
    - [264, 2515.0]
  - - [23936, 16, 1, 16]
    - [213, 405.266]
  - - [38272, 32, 1, 32]
    - [216, 1436.6]
  - - [34816, 16, 1, 16]
    - [212, 464.213]
  - - [17920, 32, 1, 32]
    - [212, 1210.43]
  - - [23424, 64, 1, 64]
    - [267, 2328.75]
  - - [15488, 16, 1, 16]
    - [231, 363.089]
  - - [19456, 64, 1, 64]
    - [255, 2221.06]
  - - [27392, 16, 1, 16]
    - [213, 427.582]
  - - [30976, 32, 1, 32]
    - [235, 1315.07]
  - - [23168, 64, 1, 64]
    - [264, 2389.13]
  - - [30592, 32, 1, 32]
    - [213, 1398.49]
  - - [36608, 64, 1, 64]
    - [266, 2592.43]
  - - [18944, 16, 1, 16]
    - [231, 410.988]
  - - [30720, 32, 1, 32]
    - [217, 1399.35]
  - - [32384, 16, 1, 16]
    - [231, 446.676]
  - - [13952, 32, 1, 32]
    - [212, 1079.07]
  - - [44544, 64, 1, 64]
    - [278, 2636.59]
  - - [44288, 16, 1, 16]
    - [235, 519.127]
  - - [3840, 64, 1, 64]
    - [246, 1280.83]
  - - [40064, 64, 1, 64]
    - [262, 2593.27]
  - - [10624, 32, 1, 32]
    - [212, 931.419]
  - - [39424, 32, 1, 32]
    - [216, 1429.54]
  - - [16256, 64, 1, 64]
    - [229, 2187.4]
  - - [26752, 32, 1, 32]
    - [213, 1356.14]
  - - [36608, 16, 1, 16]
    - [231, 482.081]
  - - [21376, 16, 1, 16]
    - [212, 420.943]
  - - [23552, 32, 1, 32]
    - [213, 1253.5]
  - - [29056, 64, 1, 64]
    - [278, 2446.82]
  - - [29312, 16, 1, 16]
    - [236, 447.725]
  - - [43648, 32, 1, 32]
    - [212, 1466.39]
  - - [33280, 64, 1, 64]
    - [284, 2558.46]
  - - [11520, 16, 1, 16]
    - [212, 319.169]
  - - [2560, 16, 1, 16]
    - [212, 90.022]
  - - [19840, 32, 1, 32]
    - [212, 1235.78]
  - - [17664, 64, 1, 64]
    - [283, 2263.82]
  - - [8192, 16, 1, 16]
    - [212, 244.994]
  - - [40448, 32, 1, 32]
    - [216, 1448.21]
  - - [44800, 32, 1, 32]
    - [216, 1491.39]
  - - [35968, 32, 1, 32]
    - [231, 1412.24]
  - - [9216, 64, 1, 64]
    - [231, 1929.89]
  - - [768, 16, 1, 16]
    - [224, 28.4116]
  - - [1792, 64, 1, 64]
    - [215, 679.633]
  - - [33280, 16, 1, 16]
    - [212, 459.034]
  - - [26112, 64, 1, 64]
    - [284, 2468.95]
  - - [42240, 16, 1, 16]
    - [212, 509.107]
  - - [14336, 32, 1, 32]
    - [212, 1095.53]
  - - [29824, 64, 1, 64]
    - [266, 2499.16]
  - - [10624, 16, 1, 16]
    - [221, 295.624]
  - - [41344, 32, 1, 32]
    - [219, 1438.05]
  - - [14592, 64, 1, 64]
    - [268, 2190.94]
  - - [17408, 16, 1, 16]
    - [219, 382.856]
  - - [4608, 32, 1, 32]
    - [212, 546.133]
  - - [4864, 32, 1, 32]
    - [218, 571.185]
  - - [128, 32, 1, 32]
    - [212, 16.384]
  - - [26368, 16, 1, 16]
    - [236, 430.498]
  - - [38144, 32, 1, 32]
    - [235, 1429.7]
  - - [22144, 64, 1, 64]
    - [268, 2386.89]
  - - [896, 32, 1, 32]
    - [233, 120.724]
  - - [31488, 64, 1, 64]
    - [259, 2499.51]
  - - [1536, 16, 1, 16]
    - [233, 54.9184]
  - - [2432, 64, 1, 64]
    - [248, 892.605]
  - - [35456, 16, 1, 16]
    - [212, 471.764]
  - - [8832, 32, 1, 32]
    - [212, 813.306]
  - - [6656, 64, 1, 64]
    - [275, 1721.15]
  - - [4992, 64, 1, 64]
    - [271, 1507.91]
  - - [22272, 32, 1, 32]
    - [231, 1301.74]
  - - [26752, 64, 1, 64]
    - [284, 2492.63]
  - - [3456, 16, 1, 16]
    - [216, 118.28]
  - - [14336, 16, 1, 16]
    - [235, 352.886]
  - - [30208, 32, 1, 32]
    - [213, 1400.95]
  - - [19328, 64, 1, 64]
    - [267, 2251.64]
  - - [27776, 16, 1, 16]
    - [213, 438.929]
  - - [15360, 64, 1, 64]
    - [264, 2240.55]
  - - [6912, 16, 1, 16]
    - [212, 216.847]
  - - [26880, 32, 1, 32]
    - [236, 1346.63]
  - - [2688, 64, 1, 64]
    - [271, 965.794]
  - - [20352, 16, 1, 16]
    - [212, 422.899]
  - - [26496, 32, 1, 32]
    - [213, 1359.31]
  - - [31232, 16, 1, 16]
    - [212, 447.17]
  - - [43008, 32, 1, 32]
    - [212, 1458.28]
  - - [11648, 64, 1, 64]
    - [232, 1923.8]
  - - [11904, 16, 1, 16]
    - [212, 314.817]
  - - [38528, 16, 1, 16]
    - [212, 485.392]
  - - [13696, 64, 1, 64]
    - [255, 2099.51]
  - - [19584, 64, 1, 64]
    - [283, 2228.22]
  - - [33152, 16, 1, 16]
    - [212, 453.361]
  - - [39296, 32, 1, 32]
    - [216, 1447.45]
  - - [2560, 32, 1, 32]
    - [233, 330.99]
  - - [28544, 64, 1, 64]
    - [265, 2439.82]
  - - [24704, 16, 1, 16]
    - [213, 421.615]
  - - [6272, 32, 1, 32]
    - [212, 680.353]
  - - [4096, 64, 1, 64]
    - [270, 1286.6]
  - - [32512, 16, 1, 16]
    - [231, 456.309]
  - - [36480, 64, 1, 64]
    - [268, 2594.13]
  - - [896, 16, 1, 16]
    - [212, 32.768]
  - - [2304, 16, 1, 16]
    - [212, 81.4674]
  - - [13056, 64, 1, 64]
    - [232, 2072.77]
  - - [7680, 16, 1, 16]
    - [212, 236.308]
  - - [19456, 32, 1, 32]
    - [216, 1232.86]
  - - [41344, 64, 1, 64]
    - [262, 2637.77]
  - - [28416, 32, 1, 32]
    - [217, 1362.27]
  - - [23168, 32, 1, 32]
    - [217, 1267.31]
  - - [20736, 16, 1, 16]
    - [212, 417.328]
  - - [9856, 16, 1, 16]
    - [212, 292.03]
  - - [20224, 32, 1, 32]
    - [212, 1247.55]
  - - [29952, 64, 1, 64]
    - [264, 2493.56]
  - - [4096, 16, 1, 16]
    - [231, 137.248]
  - - [36352, 32, 1, 32]
    - [231, 1414.3]
  - - [17280, 64, 1, 64]
    - [227, 2242.68]
  - - [21504, 64, 1, 64]
    - [284, 2367.75]
  - - [8832, 64, 1, 64]
    - [236, 1864.74]
  - - [34688, 16, 1, 16]
    - [216, 466.393]
  - - [16384, 32, 1, 32]
    - [231, 1158.65]
  - - [18048, 16, 1, 16]
    - [212, 396.932]
  - - [5632, 64, 1, 64]
    - [271, 1629.14]
  - - [21760, 16, 1, 16]
    - [212, 423.295]
  - - [7808, 32, 1, 32]
    - [234, 774.747]
  - - [25728, 64, 1, 64]
    - [264, 2448.46]
  - - [6528, 16, 1, 16]
    - [233, 204.8]
  - - [4480, 32, 1, 32]
    - [214, 535.925]
  - - [29696, 16, 1, 16]
    - [242, 460.18]
  - - [512, 32, 1, 32]
    - [212, 67.5629]
  - - [42880, 64, 1, 64]
    - [262, 2649.92]
  - - [14464, 16, 1, 16]
    - [212, 353.319]
  - - [28800, 32, 1, 32]
    - [232, 1370.41]
  - - [43264, 16, 1, 16]
    - [216, 516.585]
  - - [2048, 64, 1, 64]
    - [247, 759.838]
  - - [5888, 16, 1, 16]
    - [224, 187.479]
  - - [43776, 32, 1, 32]
    - [216, 1468.76]
  - - [1664, 64, 1, 64]
    - [212, 638.178]
  - - [13184, 32, 1, 32]
    - [212, 1044.92]
  - - [11008, 64, 1, 64]
    - [263, 2038.37]
  - - [13824, 16, 1, 16]
    - [231, 348.321]
  - - [31104, 64, 1, 64]
    - [258, 2488.32]
  - - [18944, 64, 1, 64]
    - [265, 2323.19]
  - - [7936, 32, 1, 32]
    - [234, 775.426]
  - - [34560, 32, 1, 32]
    - [212, 1378.09]
  - - [22656, 64, 1, 64]
    - [280, 2406.61]
  - - [15744, 16, 1, 16]
    - [212, 380.232]
  - - [27904, 64, 1, 64]
    - [281, 2413.32]
  - - [26624, 16, 1, 16]
    - [213, 434.678]
  - - [42496, 32, 1, 32]
    - [231, 1464.2]
  - - [15232, 64, 1, 64]
    - [278, 2228.22]
  - - [7296, 16, 1, 16]
    - [212, 226.672]
  - - [38016, 32, 1, 32]
    - [216, 1426.99]
  - - [44032, 64, 1, 64]
    - [278, 2635.23]
  - - [19200, 16, 1, 16]
    - [212, 416.542]
  - - [22784, 32, 1, 32]
    - [212, 1322.61]
  - - [14976, 64, 1, 64]
    - [255, 2216.1]
  - - [22400, 32, 1, 32]
    - [212, 1303.27]
  - - [28416, 64, 1, 64]
    - [265, 2437.02]
  - - [10752, 16, 1, 16]
    - [212, 303.14]
  - - [22528, 32, 1, 32]
    - [212, 1307.75]
  - - [23936, 64, 1, 64]
    - [283, 2359.04]
  - - [24192, 16, 1, 16]
    - [213, 412.877]
  - - [38528, 32, 1, 32]
    - [216, 1446.21]
  - - [3584, 64, 1, 64]
    - [248, 1211.23]
  - - [36096, 16, 1, 16]
    - [231, 471.458]
  - - [13824, 64, 1, 64]
    - [278, 2125.49]
  - - [31872, 64, 1, 64]
    - [280, 2512.47]
  - - [35200, 32, 1, 32]
    - [231, 1397.09]
  - - [41216, 64, 1, 64]
    - [268, 2614.94]
  - - [40832, 64, 1, 64]
    - [278, 2613.25]
  - - [4224, 16, 1, 16]
    - [212, 140.8]
  - - [18560, 32, 1, 32]
    - [212, 1247.08]
  - - [16384, 64, 1, 64]
    - [229, 2184.53]
  - - [28416, 16, 1, 16]
    - [213, 447.937]
  - - [23808, 32, 1, 32]
    - [217, 1272.41]
  - - [13184, 16, 1, 16]
    - [231, 330.893]
  - - [27520, 32, 1, 32]
    - [220, 1339.38]
  - - [36352, 16, 1, 16]
    - [231, 482.682]
  - - [35456, 32, 1, 32]
    - [231, 1387.88]
  - - [25088, 64, 1, 64]
    - [280, 2405.44]
  - - [12416, 16, 1, 16]
    - [212, 328.357]
  - - [13568, 16, 1, 16]
    - [212, 344.584]
  - - [20608, 64, 1, 64]
    - [264, 2288.78]
  - - [44416, 32, 1, 32]
    - [231, 1478.61]
  - - [42240, 64, 1, 64]
    - [262, 2658.5]
  - - [13184, 64, 1, 64]
    - [242, 2089.85]
  - - [38016, 16, 1, 16]
    - [216, 481.787]
  - - [27776, 32, 1, 32]
    - [217, 1346.72]
  - - [33792, 64, 1, 64]
    - [264, 2590.05]
  - - [20736, 32, 1, 32]
    - [231, 1266.93]
  - - [4736, 64, 1, 64]
    - [250, 1443.35]
  - - [41728, 32, 1, 32]
    - [212, 1439.67]
  - - [26368, 64, 1, 64]
    - [280, 2479.42]
  - - [25088, 16, 1, 16]
    - [213, 419.225]
  - - [12288, 32, 1, 32]
    - [212, 1011.49]
  - - [5504, 64, 1, 64]
    - [248, 1583.17]
  - - [44672, 32, 1, 32]
    - [235, 1481.35]
  - - [1280, 16, 1, 16]
    - [234, 45.5111]
  - - [6912, 32, 1, 32]
    - [212, 713.497]
  - - [2432, 16, 1, 16]
    - [212, 86.4711]
  - - [33152, 32, 1, 32]
    - [231, 1360.08]
  - - [6400, 64, 1, 64]
    - [248, 1684.73]
  - - [9216, 16, 1, 16]
    - [212, 274.337]
  - - [29184, 32, 1, 32]
    - [220, 1373.36]
  - - [22400, 64, 1, 64]
    - [280, 2396.82]
  - - [10368, 16, 1, 16]
    - [212, 301.615]
  - - [14336, 64, 1, 64]
    - [264, 2174.82]
  - - [23296, 64, 1, 64]
    - [258, 2341.03]
  - - [37888, 32, 1, 32]
    - [216, 1436.94]
  - - [33408, 32, 1, 32]
    - [231, 1359.69]
  - - [31232, 64, 1, 64]
    - [265, 2467.71]
  - - [768, 64, 1, 64]
    - [212, 306.005]
  - - [18560, 64, 1, 64]
    - [283, 2295.34]
  - - [28032, 16, 1, 16]
    - [232, 442.975]
  - - [42368, 32, 1, 32]
    - [216, 1453.92]
  - - [40192, 64, 1, 64]
    - [262, 2604.85]
  - - [38912, 16, 1, 16]
    - [231, 490.23]
  - - [22016, 32, 1, 32]
    - [231, 1298.64]
  - - [11136, 64, 1, 64]
    - [256, 2054.64]
  - - [17536, 32, 1, 32]
    - [212, 1190.77]
  - - [39936, 64, 1, 64]
    - [262, 2596.47]
  - - [31488, 16, 1, 16]
    - [217, 445.848]
  - - [18688, 32, 1, 32]
    - [231, 1262.3]
  - - [27264, 64, 1, 64]
    - [262, 2421.36]
  - - [18304, 32, 1, 32]
    - [212, 1252.89]
  - - [7936, 64, 1, 64]
    - [236, 1740.14]
  - - [2048, 32, 1, 32]
    - [212, 268.866]
  - - [3456, 64, 1, 64]
    - [248, 1175.73]
  - - [36480, 16, 1, 16]
    - [212, 478.426]
  - - [15616, 16, 1, 16]
    - [231, 362.11]
  - - [7296, 64, 1, 64]
    - [254, 1813.37]
  - - [44160, 64, 1, 64]
    - [282, 2621.44]
  - - [20736, 64, 1, 64]
    - [268, 2310.52]
  - - [7168, 16, 1, 16]
    - [233, 216.392]
  - - [27136, 32, 1, 32]
    - [236, 1328.26]
  - - [20352, 64, 1, 64]
    - [264, 2272.68]
  - - [16512, 16, 1, 16]
    - [212, 385.682]
  - - [30848, 32, 1, 32]
    - [212, 1309.63]
  - - [24320, 16, 1, 16]
    - [213, 409.6]
  - - [19712, 32, 1, 32]
    - [212, 1252.18]
  - - [6400, 16, 1, 16]
    - [212, 197.874]
  - - [25472, 16, 1, 16]
    - [213, 425.642]
  - - [39808, 32, 1, 32]
    - [212, 1435.33]
  - - [37632, 64, 1, 64]
    - [284, 2617.88]
  - - [32256, 16, 1, 16]
    - [212, 461.831]
  - - [44032, 32, 1, 32]
    - [216, 1473.49]
  - - [33152, 64, 1, 64]
    - [264, 2552.45]
  - - [640, 16, 1, 16]
    - [212, 23.1412]
  - - [4480, 16, 1, 16]
    - [243, 149.333]
  - - [16512, 64, 1, 64]
    - [229, 2204.47]
  - - [9600, 16, 1, 16]
    - [218, 278.009]
  - - [21760, 64, 1, 64]
    - [264, 2370.45]
  - - [44800, 128, 1, 128]
    - [282, 3341.24]
  - - [41856, 64, 1, 64]
    - [264, 2644.08]
  - - [13312, 64, 1, 64]
    - [232, 2090.72]
  - - [16640, 32, 1, 32]
    - [212, 1132.94]
  - - [33408, 64, 1, 64]
    - [264, 2583.82]
  - - [38656, 64, 1, 64]
    - [264, 2611.06]
  - - [4608, 16, 1, 16]
    - [231, 153.6]
  - - [40960, 32, 1, 32]
    - [212, 1454.34]
  - - [44544, 128, 1, 128]
    - [282, 3320.94]
  - - [40576, 32, 1, 32]
    - [212, 1444.71]
  - - [384, 32, 1, 32]
    - [212, 51.4681]
  - - [18688, 64, 1, 64]
    - [281, 2302.83]
  - - [25088, 32, 1, 32]
    - [232, 1326.97]
  - - [34688, 64, 1, 64]
    - [280, 2572.09]
  - - [39040, 16, 1, 16]
    - [235, 493.787]
  - - [20608, 32, 1, 32]
    - [212, 1277.4]
  - - [42240, 32, 1, 32]
    - [216, 1451.47]
  - - [37760, 32, 1, 32]
    - [235, 1436.34]
  - - [35584, 64, 1, 64]
    - [284, 2557.05]
  - - [38400, 16, 1, 16]
    - [235, 488.589]
  - - [17408, 32, 1, 32]
    - [231, 1197.97]
  - - [22912, 64, 1, 64]
    - [264, 2406.35]
  - - [23168, 16, 1, 16]
    - [231, 413.023]
  - - [10368, 32, 1, 32]
    - [212, 931.301]
  - - [26368, 32, 1, 32]
    - [232, 1355.46]
  - - [25344, 32, 1, 32]
    - [232, 1337.75]
  - - [21888, 32, 1, 32]
    - [231, 1294.07]
  - - [18432, 16, 1, 16]
    - [212, 401.241]
  - - [44544, 96, 1, 96]
    - [286, 3110.92]
  - - [29824, 32, 1, 32]
    - [213, 1383.14]
  - - [20224, 64, 1, 64]
    - [268, 2280.77]
  - - [16000, 16, 1, 16]
    - [231, 376.471]
  - - [28160, 64, 1, 64]
    - [265, 2441.65]
  - - [27904, 16, 1, 16]
    - [242, 442.044]
  - - [2304, 64, 1, 64]
    - [250, 842.606]
  - - [23680, 64, 1, 64]
    - [264, 2340.57]
  - - [37248, 16, 1, 16]
    - [212, 491.52]
  - - [33024, 64, 1, 64]
    - [264, 2556.05]
  - - [23040, 32, 1, 32]
    - [212, 1299.17]
  - - [28800, 16, 1, 16]
    - [242, 449.561]
  - - [40960, 64, 1, 64]
    - [268, 2618.17]
  - - [20224, 16, 1, 16]
    - [231, 405.748]
  - - [40576, 64, 1, 64]
    - [262, 2608.28]
  - - [12928, 16, 1, 16]
    - [216, 333.626]
  - - [27264, 32, 1, 32]
    - [217, 1334.53]
  - - [16896, 64, 1, 64]
    - [229, 2223.84]
  - - [11776, 16, 1, 16]
    - [231, 311.431]
  - - [5120, 16, 1, 16]
    - [233, 166.335]
  - - [3456, 32, 1, 32]
    - [233, 431.579]
  - - [1280, 64, 1, 64]
    - [212, 508.031]
  - - [24064, 32, 1, 32]
    - [213, 1288.78]
  - - [37760, 64, 1, 64]
    - [280, 2621.44]
  - - [19584, 32, 1, 32]
    - [212, 1240.97]
  - - [29312, 64, 1, 64]
    - [265, 2474.48]
  - - [38784, 16, 1, 16]
    - [231, 494.457]
  - - [16896, 16, 1, 16]
    - [212, 379.419]
  - - [36864, 32, 1, 32]
    - [216, 1425.56]
  - - [30080, 64, 1, 64]
    - [278, 2488.04]
  - - [17152, 32, 1, 32]
    - [212, 1202.99]
  - - [36480, 32, 1, 32]
    - [235, 1425.78]
  - - [9728, 64, 1, 64]
    - [259, 1911.99]
  - - [25856, 16, 1, 16]
    - [213, 428.701]
  - - [8704, 32, 1, 32]
    - [212, 825.268]
  - - [13440, 64, 1, 64]
    - [240, 2104.37]
  - - [24960, 32, 1, 32]
    - [213, 1314.77]
  - - [1024, 16, 1, 16]
    - [212, 37.6644]
  - - [34944, 16, 1, 16]
    - [212, 476.848]
  - - [38912, 64, 1, 64]
    - [282, 2597.52]
  - - [9984, 16, 1, 16]
    - [212, 286.536]
  - - [21760, 32, 1, 32]
    - [216, 1286.5]
  - - [5760, 64, 1, 64]
    - [248, 1620.4]
  - - [43904, 16, 1, 16]
    - [231, 524.227]
  - - [15104, 64, 1, 64]
    - [278, 2219.01]
  - - [29696, 32, 1, 32]
    - [236, 1392.34]
  - - [19072, 16, 1, 16]
    - [212, 415.173]
  - - [12416, 64, 1, 64]
    - [240, 1995.92]
  - - [5888, 32, 1, 32]
    - [212, 664.021]
  - - [10368, 64, 1, 64]
    - [259, 1980.75]
  - - [34176, 32, 1, 32]
    - [235, 1393.16]
  - - [32000, 64, 1, 64]
    - [264, 2505.2]
  - - [13824, 32, 1, 32]
    - [212, 1082.25]
  - - [2944, 64, 1, 64]
    - [271, 1043.13]
  - - [11392, 16, 1, 16]
    - [212, 315.623]
  - - [42112, 32, 1, 32]
    - [212, 1452.92]
  - - [10496, 32, 1, 32]
    - [212, 926.543]
  - - [3968, 16, 1, 16]
    - [216, 132.267]
  - - [10112, 32, 1, 32]
    - [246, 895.734]
  - - [32512, 64, 1, 64]
    - [268, 2535.59]
  - - [14848, 16, 1, 16]
    - [215, 358.593]
  - - [26624, 32, 1, 32]
    - [236, 1355.02]
  - - [42624, 32, 1, 32]
    - [231, 1451.03]
  - - [40448, 64, 1, 64]
    - [262, 2613.17]
  - - [40192, 16, 1, 16]
    - [212, 494.671]
  - - [14208, 64, 1, 64]
    - [264, 2152.22]
  - - [3200, 64, 1, 64]
    - [246, 1114.56]
  - - [16768, 16, 1, 16]
    - [231, 384.642]
  - - [22912, 32, 1, 32]
    - [231, 1312.19]
  - - [256, 16, 1, 16]
    - [225, 9.41609]
  - - [12160, 64, 1, 64]
    - [232, 1960.92]
  - - [8320, 16, 1, 16]
    - [231, 248.822]
  - - [16128, 16, 1, 16]
    - [212, 360.906]
  - - [44288, 32, 1, 32]
    - [219, 1485.94]
  - - [20096, 64, 1, 64]
    - [282, 2256.39]
  - - [31616, 32, 1, 32]
    - [221, 1331.2]
  - - [3072, 32, 1, 32]
    - [212, 387.405]
  - - [24960, 64, 1, 64]
    - [264, 2404.43]
  - - [768, 32, 1, 32]
    - [234, 104.025]
  - - [6784, 32, 1, 32]
    - [248, 717.646]
  - - [4352, 16, 1, 16]
    - [225, 142.835]
  - - [6272, 16, 1, 16]
    - [231, 197.738]
  - - [41088, 64, 1, 64]
    - [264, 2618.18]
  - - [34176, 16, 1, 16]
    - [212, 461.448]
  - - [23296, 32, 1, 32]
    - [232, 1260.84]
  - - [13568, 64, 1, 64]
    - [257, 2092.41]
  - - [8448, 16, 1, 16]
    - [218, 251.475]
  - - [19968, 32, 1, 32]
    - [212, 1249.83]
  - - [896, 64, 1, 64]
    - [233, 355.622]
  - - [42112, 16, 1, 16]
    - [221, 508.522]
  - - [5120, 64, 1, 64]
    - [271, 1524.09]
  - - [41216, 32, 1, 32]
    - [212, 1447.37]
  - - [18304, 16, 1, 16]
    - [231, 401.184]
  - - [40832, 32, 1, 32]
    - [219, 1443.78]
  - - [30464, 64, 1, 64]
    - [280, 2517.77]
  - - [29184, 16, 1, 16]
    - [236, 454.447]
  - - [42368, 64, 1, 64]
    - [262, 2658.38]
  - - [1664, 16, 1, 16]
    - [234, 59.495]
  - - [32384, 32, 1, 32]
    - [212, 1348.02]
  - - [44544, 64, 1, 64]
    - [269, 2468.24]
  - - [5376, 16, 1, 16]
    - [231, 175.543]
  - - [4224, 32, 1, 32]
    - [212, 507.673]
  - - [9344, 64, 1, 64]
    - [235, 1932.98]
  - - [43264, 64, 1, 64]
    - [262, 2637.04]
  - - [13312, 16, 1, 16]
    - [212, 338.083]
  - - [26496, 64, 1, 64]
    - [280, 2484.61]
  - - [12416, 32, 1, 32]
    - [212, 1018.75]
  - - [34048, 32, 1, 32]
    - [216, 1379.16]
  - - [39808, 16, 1, 16]
    - [216, 500.533]
  - - [41984, 32, 1, 32]
    - [212, 1442.67]
  - - [14720, 64, 1, 64]
    - [262, 2194.07]
  - - [37504, 32, 1, 32]
    - [216, 1435.13]
  - - [33536, 32, 1, 32]
    - [212, 1375.84]
  - - [2560, 64, 1, 64]
    - [251, 919.804]
  - - [4096, 32, 1, 32]
    - [212, 499.322]
  - - [18176, 32, 1, 32]
    - [212, 1227.72]
  - - [6272, 64, 1, 64]
    - [275, 1685.7]
  - - [11520, 64, 1, 64]
    - [259, 2055.14]
  - - [10240, 16, 1, 16]
    - [212, 296.543]
  - - [26112, 32, 1, 32]
    - [240, 1347.72]
  - - [21632, 32, 1, 32]
    - [212, 1284.87]
  - - [27648, 64, 1, 64]
    - [276, 2419.79]
  - - [2816, 16, 1, 16]
    - [234, 97.9478]
  - - [6400, 32, 1, 32]
    - [212, 688.403]
  - - [11008, 32, 1, 32]
    - [212, 961.791]
  - - [6016, 32, 1, 32]
    - [212, 675.481]
  - - [12032, 64, 1, 64]
    - [220, 1949.49]
  - - [6144, 32, 1, 32]
    - [234, 677.959]
  - - [7552, 64, 1, 64]
    - [249, 1854.5]
  - - [7808, 16, 1, 16]
    - [212, 240.246]
  - - [22144, 32, 1, 32]
    - [221, 1303.19]
  - - [19712, 16, 1, 16]
    - [216, 404.349]
  - - [10240, 64, 1, 64]
    - [254, 1967.31]
  - - [15488, 64, 1, 64]
    - [229, 2151.93]
  - - [29056, 16, 1, 16]
    - [236, 452.454]
  - - [18816, 32, 1, 32]
    - [212, 1235.1]
  - - [24832, 64, 1, 64]
    - [264, 2437.96]
  - - [44032, 16, 1, 16]
    - [212, 516.126]
  - - [24448, 64, 1, 64]
    - [283, 2379.73]
  - - [2176, 32, 1, 32]
    - [212, 284.212]
  - - [15104, 32, 1, 32]
    - [231, 1120.76]
  - - [12032, 16, 1, 16]
    - [212, 320.853]
  - - [7424, 32, 1, 32]
    - [212, 754.184]
  - - [32384, 64, 1, 64]
    - [284, 2517.94]
  - - [11136, 32, 1, 32]
    - [231, 956.65]
  - - [41728, 64, 1, 64]
    - [284, 2642.52]
  - - [19968, 16, 1, 16]
    - [212, 406.991]
  - - [31744, 32, 1, 32]
    - [221, 1332.21]
  - - [37248, 64, 1, 64]
    - [268, 2610.67]
  - - [37504, 16, 1, 16]
    - [231, 485.882]
  - - [19072, 32, 1, 32]
    - [212, 1258.36]
  - - [8704, 64, 1, 64]
    - [232, 1849.15]
  - - [5504, 16, 1, 16]
    - [212, 177.013]
  - - [14080, 16, 1, 16]
    - [231, 352.0]
  - - [4224, 64, 1, 64]
    - [274, 1322.74]
  - - [28032, 32, 1, 32]
    - [213, 1343.86]
  - - [25856, 64, 1, 64]
    - [264, 2444.74]
  - - [21632, 16, 1, 16]
    - [231, 419.53]
  - - [11392, 32, 1, 32]
    - [231, 985.254]
  - - [17408, 64, 1, 64]
    - [265, 2236.61]
  - - [41728, 16, 1, 16]
    - [212, 499.176]
  - - [4352, 32, 1, 32]
    - [212, 530.529]
  - - [30592, 16, 1, 16]
    - [232, 462.858]
  - - [36736, 32, 1, 32]
    - [212, 1422.76]
  - - [9984, 64, 1, 64]
    - [279, 1951.07]
  - - [8704, 16, 1, 16]
    - [218, 261.529]
  - - [30336, 16, 1, 16]
    - [232, 465.588]
  - - [28288, 32, 1, 32]
    - [217, 1358.67]
  - - [31488, 32, 1, 32]
    - [221, 1321.46]
  - - [34304, 64, 1, 64]
    - [264, 2607.82]
  - - [9472, 32, 1, 32]
    - [246, 866.011]
  - - [38016, 64, 1, 64]
    - [268, 2632.07]
  - - [16768, 32, 1, 32]
    - [231, 1172.84]
  - - [12800, 32, 1, 32]
    - [212, 1040.25]
  - - [6016, 64, 1, 64]
    - [275, 1629.73]
  - - [41088, 32, 1, 32]
    - [216, 1436.96]
  - - [34560, 16, 1, 16]
    - [231, 470.604]
  - - [30336, 64, 1, 64]
    - [264, 2499.12]
  - - [35712, 16, 1, 16]
    - [216, 474.184]
  - - [41856, 32, 1, 32]
    - [221, 1459.83]
  - - [6912, 64, 1, 64]
    - [248, 1778.36]
  - - [42496, 16, 1, 16]
    - [216, 515.103]
  - - [21504, 32, 1, 32]
    - [216, 1283.22]
  - - [43392, 64, 1, 64]
    - [278, 2633.87]
  - - [43648, 16, 1, 16]
    - [221, 520.2]
  - - [17024, 32, 1, 32]
    - [231, 1174.7]
  - - [14848, 64, 1, 64]
    - [262, 2203.53]
  - - [8192, 64, 1, 64]
    - [232, 1762.31]
  - - [30464, 32, 1, 32]
    - [213, 1397.63]
  - - [2176, 64, 1, 64]
    - [247, 795.794]
  - - [11648, 16, 1, 16]
    - [221, 314.545]
  - - [25984, 32, 1, 32]
    - [213, 1335.72]
  - - [23808, 64, 1, 64]
    - [261, 2328.5]
  - - [22528, 16, 1, 16]
    - [212, 429.105]
  - - [5632, 32, 1, 32]
    - [212, 643.657]
  - - [35968, 16, 1, 16]
    - [212, 477.583]
  - - [1152, 32, 1, 32]
    - [214, 151.237]
  - - [10496, 16, 1, 16]
    - [212, 298.553]
  - - [23552, 64, 1, 64]
    - [264, 2318.97]
  - - [15104, 16, 1, 16]
    - [231, 360.693]
  - - [2304, 32, 1, 32]
    - [212, 299.403]
  - - [10880, 64, 1, 64]
    - [263, 2029.35]
  - - [8960, 32, 1, 32]
    - [270, 840.205]
  - - [1920, 32, 1, 32]
    - [234, 254.674]
  - - [39424, 16, 1, 16]
    - [212, 493.764]
  - - [35584, 32, 1, 32]
    - [216, 1401.46]
  - - [20096, 16, 1, 16]
    - [212, 410.909]
  - - [34432, 32, 1, 32]
    - [239, 1383.77]
  - - [32256, 64, 1, 64]
    - [284, 2527.17]
  - - [9856, 64, 1, 64]
    - [254, 1948.37]
  - - [27776, 64, 1, 64]
    - [275, 2408.35]
  - - [41344, 16, 1, 16]
    - [212, 500.192]
  - - [4352, 64, 1, 64]
    - [271, 1354.54]
  - - [10752, 32, 1, 32]
    - [212, 945.88]
  - - [3968, 64, 1, 64]
    - [250, 1273.74]
  - - [128, 16, 1, 16]
    - [226, 4.31158]
  - - [14464, 32, 1, 32]
    - [212, 1102.02]
  - - [7936, 16, 1, 16]
    - [212, 244.185]
  - - [3328, 32, 1, 32]
    - [212, 421.766]
  - - [44672, 64, 1, 64]
    - [262, 2650.3]
  - - [9088, 16, 1, 16]
    - [212, 268.033]
  - - [23424, 32, 1, 32]
    - [232, 1265.09]
  - - [21248, 64, 1, 64]
    - [260, 2334.54]
  - - [15872, 16, 1, 16]
    - [212, 373.459]
  - - [27648, 32, 1, 32]
    - [232, 1332.94]
  - - [16768, 64, 1, 64]
    - [229, 2229.93]
  - - [40704, 32, 1, 32]
    - [235, 1445.25]
  - - [31360, 32, 1, 32]
    - [235, 1318.25]
  - - [37376, 64, 1, 64]
    - [280, 2607.15]
  - - [28928, 16, 1, 16]
    - [217, 450.46]
  - - [4992, 16, 1, 16]
    - [212, 164.685]
  - - [128, 64, 1, 64]
    - [237, 51.2]
  - - [40320, 32, 1, 32]
    - [216, 1441.61]
  - - [5376, 64, 1, 64]
    - [252, 1572.86]
  - - [44544, 32, 1, 32]
    - [216, 1471.39]
  - - [25472, 64, 1, 64]
    - [268, 2424.1]
  - - [33920, 16, 1, 16]
    - [212, 456.067]
  - - [40064, 32, 1, 32]
    - [216, 1436.47]
  - - [37632, 16, 1, 16]
    - [231, 484.597]
  - - [256, 32, 1, 32]
    - [233, 34.8596]
  - - [17024, 64, 1, 64]
    - [229, 2226.38]
  - - [42880, 16, 1, 16]
    - [216, 506.332]
  - - [32640, 32, 1, 32]
    - [216, 1347.72]
  - - [22272, 64, 1, 64]
    - [268, 2390.62]
  - - [24576, 32, 1, 32]
    - [222, 1294.54]
  - - [34176, 64, 1, 64]
    - [284, 2590.39]
  - - [24192, 32, 1, 32]
    - [236, 1284.89]
  - - [4992, 32, 1, 32]
    - [215, 580.887]
  - - [33920, 64, 1, 64]
    - [264, 2592.1]
  - - [37888, 16, 1, 16]
    - [231, 488.877]
  - - [18304, 64, 1, 64]
    - [258, 2285.77]
  - - [22656, 16, 1, 16]
    - [212, 434.127]
  - - [28544, 16, 1, 16]
    - [213, 440.197]
  - - [43008, 64, 1, 64]
    - [262, 2640.3]
  - - [25856, 32, 1, 32]
    - [213, 1348.09]
  - - [42624, 64, 1, 64]
    - [255, 2629.34]
  - - [31616, 16, 1, 16]
    - [231, 443.733]
  - - [21376, 32, 1, 32]
    - [212, 1287.59]
  - - [19200, 64, 1, 64]
    - [265, 2318.49]
  - - [22016, 16, 1, 16]
    - [231, 410.794]
  - - [1024, 32, 1, 32]
    - [216, 135.826]
  - - [29312, 32, 1, 32]
    - [236, 1371.82]
  - - [12672, 32, 1, 32]
    - [212, 1020.14]
  - - [36096, 64, 1, 64]
    - [262, 2581.17]
  - - [40832, 16, 1, 16]
    - [216, 503.516]
  - - [16128, 32, 1, 32]
    - [212, 1118.91]
  - - [32128, 64, 1, 64]
    - [280, 2524.87]
  - - [2816, 64, 1, 64]
    - [248, 1004.73]
  - - [20864, 16, 1, 16]
    - [231, 413.404]
  - - [43392, 32, 1, 32]
    - [221, 1465.48]
  - - [16640, 64, 1, 64]
    - [245, 2210.03]
  - - [35840, 16, 1, 16]
    - [212, 470.998]
  - - [24576, 64, 1, 64]
    - [264, 2389.92]
  - - [33024, 16, 1, 16]
    - [213, 454.524]
  - - [32000, 32, 1, 32]
    - [216, 1340.75]
  - - [24192, 64, 1, 64]
    - [264, 2370.58]
  - - [35712, 32, 1, 32]
    - [221, 1406.5]
  - - [33536, 64, 1, 64]
    - [264, 2580.08]
  - - [44544, 16, 1, 16]
    - [216, 515.518]
  - - [30976, 16, 1, 16]
    - [213, 449.538]
  - - [10880, 32, 1, 32]
    - [231, 947.374]
  - - [512, 64, 1, 64]
    - [212, 205.603]
  - - [3840, 16, 1, 16]
    - [224, 130.723]
  - - [5632, 16, 1, 16]
    - [212, 180.224]
  - - [28800, 64, 1, 64]
    - [262, 2433.27]
  - - [38272, 16, 1, 16]
    - [231, 490.863]
  - - [40960, 16, 1, 16]
    - [212, 510.008]
  - - [7680, 32, 1, 32]
    - [219, 765.012]
  - - [21376, 64, 1, 64]
    - [268, 2361.28]
  - - [3200, 32, 1, 32]
    - [212, 405.545]
  - - [41984, 64, 1, 64]
    - [262, 2655.44]
  - - [33536, 16, 1, 16]
    - [235, 453.764]
  - - [28928, 32, 1, 32]
    - [213, 1381.64]
  - - [12928, 64, 1, 64]
    - [236, 2058.83]
  - - [22400, 16, 1, 16]
    - [212, 419.181]
  - - [28544, 32, 1, 32]
    - [217, 1368.4]
  - - [34560, 64, 1, 64]
    - [268, 2613.7]
  - - [512, 16, 1, 16]
    - [212, 18.8322]
  - - [20480, 32, 1, 32]
    - [216, 1260.31]
  - - [22144, 16, 1, 16]
    - [212, 424.316]
  - - [20096, 32, 1, 32]
    - [212, 1239.66]
  - - [9472, 16, 1, 16]
    - [212, 278.077]
  - - [7168, 32, 1, 32]
    - [231, 734.003]
  - - [43392, 16, 1, 16]
    - [216, 510.494]
  - - [8576, 32, 1, 32]
    - [231, 813.132]
  - - [37376, 32, 1, 32]
    - [231, 1438.84]
  - - [30592, 64, 1, 64]
    - [268, 2522.24]
  - - [18560, 16, 1, 16]
    - [212, 401.297]
  - - [32896, 32, 1, 32]
    - [235, 1351.75]
  - - [22528, 64, 1, 64]
    - [280, 2400.49]
  - - [5376, 32, 1, 32]
    - [212, 617.155]
  - - [27520, 16, 1, 16]
    - [213, 441.424]
  - - [33664, 32, 1, 32]
    - [235, 1376.67]
  - - [34304, 16, 1, 16]
    - [212, 469.115]
  - - [13312, 32, 1, 32]
    - [212, 1064.96]
  - - [35200, 64, 1, 64]
    - [282, 2570.96]
  - - [2688, 16, 1, 16]
    - [233, 93.4957]
  - - [41600, 32, 1, 32]
    - [216, 1452.88]
  - - [26880, 16, 1, 16]
    - [213, 438.857]
  - - [39424, 64, 1, 64]
    - [262, 2596.15]
  - - [12672, 64, 1, 64]
    - [240, 2030.69]
  - - [36224, 16, 1, 16]
    - [231, 477.024]
  - - [17792, 32, 1, 32]
    - [216, 1208.16]
  - - [44800, 64, 1, 64]
    - [269, 2461.12]
  - - [15616, 64, 1, 64]
    - [228, 2152.19]
  - - [25728, 32, 1, 32]
    - [213, 1344.16]
  - - [39680, 16, 1, 16]
    - [216, 489.31]
  - - [35456, 64, 1, 64]
    - [262, 2544.28]
  - - [16128, 64, 1, 64]
    - [229, 2187.43]
  - - [10240, 32, 1, 32]
    - [246, 900.839]
  - - [44416, 64, 1, 64]
    - [278, 2639.7]
  - - [44672, 16, 1, 16]
    - [221, 517.0]
  - - [26240, 32, 1, 32]
    - [217, 1357.06]
  - - [24064, 64, 1, 64]
    - [264, 2373.94]
  - - [23808, 16, 1, 16]
    - [232, 409.6]
  - - [6528, 64, 1, 64]
    - [271, 1709.63]
  - - [384, 16, 1, 16]
    - [224, 13.9636]
  - - [6528, 32, 1, 32]
    - [216, 696.32]
  - - [28928, 64, 1, 64]
    - [262, 2448.12]
  - - [15360, 16, 1, 16]
    - [218, 364.089]
  - - [35328, 32, 1, 32]
    - [212, 1397.83]
  - - [39040, 32, 1, 32]
    - [216, 1440.09]
  - - [36864, 64, 1, 64]
    - [280, 2589.08]
  - - [27904, 32, 1, 32]
    - [232, 1350.36]
  - - [3712, 64, 1, 64]
    - [274, 1250.36]
  - - [33664, 16, 1, 16]
    - [216, 456.461]
  - - [15232, 32, 1, 32]
    - [212, 1110.94]
  - - [40448, 16, 1, 16]
    - [212, 494.966]
  - - [8576, 64, 1, 64]
    - [236, 1844.92]
  - - [41600, 16, 1, 16]
    - [216, 508.092]
  - - [29184, 64, 1, 64]
    - [264, 2451.55]
  - - [8832, 16, 1, 16]
    - [212, 266.626]
  - - [27392, 32, 1, 32]
    - [213, 1340.79]
  - - [24704, 64, 1, 64]
    - [264, 2395.54]
  - - [17792, 16, 1, 16]
    - [212, 396.755]
  - - [32128, 32, 1, 32]
    - [216, 1330.87]
  - - [24832, 16, 1, 16]
    - [242, 407.499]
  - - [3584, 32, 1, 32]
    - [231, 451.972]
  - - [25728, 16, 1, 16]
    - [213, 423.288]
  - - [31872, 32, 1, 32]
    - [212, 1335.39]
  - - [29440, 16, 1, 16]
    - [213, 455.111]
  - - [24832, 32, 1, 32]
    - [222, 1305.34]
  - - [41600, 64, 1, 64]
    - [262, 2649.15]
  - - [1920, 16, 1, 16]
    - [233, 67.8895]
  - - [24448, 32, 1, 32]
    - [217, 1285.15]
  - - [14080, 64, 1, 64]
    - [262, 2139.16]
  - - [12800, 16, 1, 16]
    - [231, 328.996]
  - - [25984, 64, 1, 64]
    - [280, 2463.67]
  - - [16000, 32, 1, 32]
    - [212, 1128.37]
  - - [38400, 64, 1, 64]
    - [264, 2639.03]
  - - [12928, 32, 1, 32]
    - [212, 1037.48]
  - - [39296, 16, 1, 16]
    - [231, 494.095]
  - - [37248, 32, 1, 32]
    - [231, 1421.09]
  - - [26880, 64, 1, 64]
    - [264, 2509.13]
  - - [33280, 32, 1, 32]
    - [221, 1350.19]
  - - [10112, 64, 1, 64]
    - [260, 1961.12]
  - - [34816, 64, 1, 64]
    - [281, 2539.29]
  - - [38656, 16, 1, 16]
    - [212, 492.825]
  - - [17664, 32, 1, 32]
    - [212, 1199.47]
  - - [34432, 64, 1, 64]
    - [280, 2602.09]
  - - [23424, 16, 1, 16]
    - [213, 404.08]
  - - [43008, 16, 1, 16]
    - [235, 508.782]
  - - [43776, 64, 1, 64]
    - [278, 2606.2]
  - - [25600, 32, 1, 32]
    - [222, 1334.75]
  - - [31360, 16, 1, 16]
    - [217, 440.14]
  - - [21120, 32, 1, 32]
    - [212, 1272.17]
  - - [12544, 32, 1, 32]
    - [212, 1019.45]
  - - [1792, 32, 1, 32]
    - [234, 234.057]
  - - [30080, 32, 1, 32]
    - [217, 1389.98]
  - - [9728, 32, 1, 32]
    - [212, 883.109]
  - - [40064, 16, 1, 16]
    - [216, 494.999]
  - - [5248, 32, 1, 32]
    - [212, 605.175]
  - - [11264, 64, 1, 64]
    - [277, 2074.52]
  - - [3840, 32, 1, 32]
    - [231, 474.899]
  - - [32640, 16, 1, 16]
    - [212, 455.111]
  - - [43520, 16, 1, 16]
    - [212, 516.75]
  - - [5760, 32, 1, 32]
    - [212, 649.586]
  - - [36352, 64, 1, 64]
    - [278, 2576.09]
  - - [3328, 16, 1, 16]
    - [214, 113.294]
  - - [10752, 64, 1, 64]
    - [263, 2035.13]
  - - [12672, 16, 1, 16]
    - [212, 327.019]
  - - [2432, 32, 1, 32]
    - [212, 311.296]
  - - [8448, 64, 1, 64]
    - [231, 1821.21]
  - - [27648, 16, 1, 16]
    - [232, 440.167]
  - - [31232, 32, 1, 32]
    - [221, 1319.37]
  - - [8064, 64, 1, 64]
    - [231, 1731.14]
  - - [36992, 16, 1, 16]
    - [212, 477.316]
  - - [16000, 64, 1, 64]
    - [227, 2175.83]
