library/src/blas3/Tensile/Logic/asm_full/vega20_Cijk_Ailk_Bjlk_DB.yaml
- {MinimumRequiredVersion: 4.2.0}
- vega20
- gfx906
- [Device 66a0, Device 66a7]
    SolutionIndex: 0
    SolutionNameMin: Cijk_Ailk_Bjlk_DB_MT064x064x08_NLCA01_NLCB01_PBC0_TT04_04_USFGRO00_WG16_16_01
    SolutionIndex: 1
    SolutionNameMin: Cijk_Ailk_Bjlk_DB_MT064x064x08_NLCA01_NLCB01_PBC0_TT04_04_USFGRO00_WG16_16_01
    SolutionIndex: 2
    SolutionNameMin: Cijk_Ailk_Bjlk_DB_MT064x064x04_NLCA01_NLCB01_PBC0_TT04_04_USFGRO00_WG16_16_01
    SolutionIndex: 3
    SolutionNameMin: Cijk_Ailk_Bjlk_DB_MT064x032x08_NLCA01_NLCB01_PBC0_TT04_04_USFGRO00_WG16_08_01
- - - [2084, 2084, 1, 400]
    - [1, 3937.8]
  - - [1536, 1536, 1, 384]
    - [1, 3759.79]
  - - [2688, 2688, 1, 384]
    - [1, 4235.35]
  - - [1060, 1060, 1, 400]
    - [1, 3459.32]
  - - [5760, 5760, 1, 5760]
    - [1, 4413.77]
  - - [4132, 4132, 1, 400]
    - [1, 4229.07]
  - - [3840, 3840, 1, 384]
    - [1, 4268.61]
  - - [4224, 4224, 1, 384]
    - [1, 4289.46]
  - - [1152, 1152, 1, 384]
    - [1, 3461.02]
  - - [768, 768, 1, 384]
    - [1, 2890.37]
  - - [7744, 7744, 1, 7744]
    - [1, 4426.15]
  - - [3456, 3456, 1, 384]
    - [1, 4288.29]
  - - [384, 384, 1, 384]
    - [1, 1597.69]
  - - [36, 36, 1, 400]
    - [3, 14.8451]
  - - [2304, 2304, 1, 384]
    - [1, 4121.65]
  - - [3108, 3108, 1, 400]
    - [1, 4193.23]
  - - [1920, 1920, 1, 384]
    - [1, 3994.24]
  - - [3072, 3072, 1, 384]
    - [1, 4156.15]
- - - -1
    - - - -1
        - - - 1
            - - [-1, 2]
          - - -1
            - - [1, 2]
              - [-1, 0]
