library/src/blas3/Tensile/Logic/asm_full/vega10_Cijk_Alik_Bjlk_SB.yaml
- {MinimumRequiredVersion: 4.6.0}
- vega10
- gfx900
- [Device 6863, Device 6862, Device 687f, Device 6860, Device 6861, 'Vega 10 XTX [Radeon
    SolutionIndex: 0
    SolutionNameMin: Cijk_Alik_Bjlk_SB_MT016x016x08_GRVW02_GSU01_SNLL0_TT02_02_VW02_WG08_08_01
    SolutionIndex: 1
    SolutionNameMin: Cijk_Alik_Bjlk_SB_MT032x032x08_GRVW02_GSU01_SNLL0_TT02_02_VW02_WG16_16_01
    SolutionIndex: 2
    SolutionNameMin: Cijk_Alik_Bjlk_SB_MT032x064x08_GRVW02_GSU01_SNLL0_TT02_04_VW02_WG16_16_01
    SolutionIndex: 3
    SolutionNameMin: Cijk_Alik_Bjlk_SB_MT128x128x08_GRVW04_GSU01_SNLL0_TT08_08_VW04_WG16_16_01
    SolutionIndex: 4
    SolutionNameMin: Cijk_Alik_Bjlk_SB_MT032x032x08_GRVW02_GSU01_SNLL0_TT02_04_VW02_WG16_08_01
    SolutionIndex: 5
    SolutionNameMin: Cijk_Alik_Bjlk_SB_MT016x032x08_GRVW02_GSU01_SNLL0_TT02_02_VW02_WG08_16_01
    SolutionIndex: 6
    SolutionNameMin: Cijk_Alik_Bjlk_SB_MT032x064x08_GRVW02_GSU01_SNLL0_TT02_04_VW02_WG16_16_01
    SolutionIndex: 7
    SolutionNameMin: Cijk_Alik_Bjlk_SB_MT128x128x08_GRVW04_GSU01_SNLL0_TT08_08_VW04_WG16_16_01
    SolutionIndex: 8
    SolutionNameMin: Cijk_Alik_Bjlk_SB_MT016x064x08_GRVW02_GSU01_SNLL0_TT02_04_VW02_WG08_16_01
    SolutionIndex: 9
    SolutionNameMin: Cijk_Alik_Bjlk_SB_MT016x016x08_GRVW02_GSU02_SNLL0_TT02_02_VW02_WG08_08_02
    SolutionIndex: 10
    SolutionNameMin: Cijk_Alik_Bjlk_SB_MT016x016x08_GRVW02_GSU04_SNLL0_TT02_02_VW02_WG08_08_02
    SolutionIndex: 11
    SolutionNameMin: Cijk_Alik_Bjlk_SB_MT016x016x08_GRVW02_GSU08_SNLL0_TT02_02_VW02_WG08_08_02
    SolutionIndex: 12
    SolutionNameMin: Cijk_Alik_Bjlk_SB_MT008x016x16_GRVW02_GSU02_SNLL0_TT02_02_VW02_WG04_08_04
    SolutionIndex: 13
    SolutionNameMin: Cijk_Alik_Bjlk_SB_MT008x032x16_GRVW02_GSU02_SNLL0_TT02_04_VW02_WG04_08_04
    SolutionIndex: 14
    SolutionNameMin: Cijk_Alik_Bjlk_SB_MT016x032x16_GRVW02_GSU02_SNLL0_TT02_04_VW02_WG08_08_02
    SolutionIndex: 15
    SolutionNameMin: Cijk_Alik_Bjlk_SB_MT032x032x16_GRVW04_GSU02_SNLL0_TT04_04_VW04_WG08_08_02
    SolutionIndex: 16
    SolutionNameMin: Cijk_Alik_Bjlk_SB_MT032x064x16_GRVW04_GSU02_SNLL0_TT04_08_VW04_WG08_08_02
    SolutionIndex: 17
    SolutionNameMin: Cijk_Alik_Bjlk_SB_MT032x032x16_GRVW02_GSU02_SNLL0_TT02_04_VW02_WG16_08_04
    SolutionIndex: 18
    SolutionNameMin: Cijk_Alik_Bjlk_SB_MT016x032x16_GRVW02_GSU02_SNLL0_TT02_02_VW02_WG08_16_02
    SolutionIndex: 19
    SolutionNameMin: Cijk_Alik_Bjlk_SB_MT016x064x16_GRVW02_GSU02_SNLL0_TT02_04_VW02_WG08_16_02
    SolutionIndex: 20
    SolutionNameMin: Cijk_Alik_Bjlk_SB_MT008x016x16_GRVW02_GSU02_SNLL0_TT02_02_VW02_WG04_08_04
    SolutionIndex: 21
    SolutionNameMin: Cijk_Alik_Bjlk_SB_MT008x032x16_GRVW02_GSU02_SNLL0_TT02_04_VW02_WG04_08_04
    SolutionIndex: 22
    SolutionNameMin: Cijk_Alik_Bjlk_SB_MT016x032x16_GRVW02_GSU02_SNLL0_TT02_04_VW02_WG08_08_02
    SolutionIndex: 23
    SolutionNameMin: Cijk_Alik_Bjlk_SB_MT032x032x16_GRVW04_GSU02_SNLL0_TT04_04_VW04_WG08_08_02
    SolutionIndex: 24
    SolutionNameMin: Cijk_Alik_Bjlk_SB_MT032x064x16_GRVW04_GSU02_SNLL0_TT04_08_VW04_WG08_08_02
    SolutionIndex: 25
    SolutionNameMin: Cijk_Alik_Bjlk_SB_MT032x032x16_GRVW02_GSU02_SNLL0_TT02_04_VW02_WG16_08_04
    SolutionIndex: 26
    SolutionNameMin: Cijk_Alik_Bjlk_SB_MT016x032x16_GRVW02_GSU02_SNLL0_TT02_02_VW02_WG08_16_02
    SolutionIndex: 27
    SolutionNameMin: Cijk_Alik_Bjlk_SB_MT016x064x16_GRVW02_GSU02_SNLL0_TT02_04_VW02_WG08_16_02
    SolutionIndex: 28
    SolutionNameMin: Cijk_Alik_Bjlk_SB_MT008x016x16_GRVW02_GSU04_SNLL0_TT02_02_VW02_WG04_08_04
    SolutionIndex: 29
    SolutionNameMin: Cijk_Alik_Bjlk_SB_MT008x032x16_GRVW02_GSU04_SNLL0_TT02_04_VW02_WG04_08_04
    SolutionIndex: 30
    SolutionNameMin: Cijk_Alik_Bjlk_SB_MT032x032x16_GRVW04_GSU04_SNLL0_TT04_04_VW04_WG08_08_02
    SolutionIndex: 31
    SolutionNameMin: Cijk_Alik_Bjlk_SB_MT032x064x16_GRVW04_GSU04_SNLL0_TT04_08_VW04_WG08_08_02
    SolutionIndex: 32
    SolutionNameMin: Cijk_Alik_Bjlk_SB_MT016x064x16_GRVW02_GSU04_SNLL0_TT02_04_VW02_WG08_16_02
    SolutionIndex: 33
    SolutionNameMin: Cijk_Alik_Bjlk_SB_MT008x032x16_GRVW02_GSU04_SNLL0_TT02_04_VW02_WG04_08_04
    SolutionIndex: 34
    SolutionNameMin: Cijk_Alik_Bjlk_SB_MT032x032x16_GRVW04_GSU04_SNLL0_TT04_04_VW04_WG08_08_02
    SolutionIndex: 35
    SolutionNameMin: Cijk_Alik_Bjlk_SB_MT016x064x16_GRVW02_GSU04_SNLL0_TT02_04_VW02_WG08_16_02
    SolutionIndex: 36
    SolutionNameMin: Cijk_Alik_Bjlk_SB_MT008x016x16_GRVW02_GSU08_SNLL0_TT02_02_VW02_WG04_08_04
    SolutionIndex: 37
    SolutionNameMin: Cijk_Alik_Bjlk_SB_MT064x064x24_GRVW04_GSU02_SNLL0_TT08_08_VW04_WG08_08_02
    SolutionIndex: 38
    SolutionNameMin: Cijk_Alik_Bjlk_SB_MT008x016x32_GRVW02_GSU02_SNLL0_TT02_02_VW02_WG04_08_04
    SolutionIndex: 39
    SolutionNameMin: Cijk_Alik_Bjlk_SB_MT016x032x32_GRVW04_GSU02_SNLL0_TT04_04_VW04_WG04_08_04
    SolutionIndex: 40
    SolutionNameMin: Cijk_Alik_Bjlk_SB_MT032x032x32_GRVW02_GSU02_SNLL0_TT02_04_VW02_WG16_08_04
    SolutionIndex: 41
    SolutionNameMin: Cijk_Alik_Bjlk_SB_MT064x064x32_GRVW04_GSU02_SNLL0_TT04_08_VW04_WG16_08_04
    SolutionIndex: 42
    SolutionNameMin: Cijk_Alik_Bjlk_SB_MT032x064x32_GRVW04_GSU02_SNLL0_TT04_04_VW04_WG08_16_02
    SolutionIndex: 43
    SolutionNameMin: Cijk_Alik_Bjlk_SB_MT016x032x32_GRVW04_GSU02_SNLL0_TT04_04_VW04_WG04_08_04
    SolutionIndex: 44
    SolutionNameMin: Cijk_Alik_Bjlk_SB_MT064x064x32_GRVW04_GSU02_SNLL0_TT04_08_VW04_WG16_08_04
    SolutionIndex: 45
    SolutionNameMin: Cijk_Alik_Bjlk_SB_MT032x064x32_GRVW04_GSU02_SNLL0_TT04_04_VW04_WG08_16_02
    SolutionIndex: 46
    SolutionNameMin: Cijk_Alik_Bjlk_SB_MT008x016x32_GRVW02_GSU04_SNLL0_TT02_02_VW02_WG04_08_04
    SolutionIndex: 47
    SolutionNameMin: Cijk_Alik_Bjlk_SB_MT008x032x32_GRVW02_GSU04_SNLL0_TT02_04_VW02_WG04_08_04
    SolutionIndex: 48
    SolutionNameMin: Cijk_Alik_Bjlk_SB_MT016x032x32_GRVW04_GSU04_SNLL0_TT04_04_VW04_WG04_08_04
    SolutionIndex: 49
    SolutionNameMin: Cijk_Alik_Bjlk_SB_MT016x032x32_GRVW04_GSU04_SNLL0_TT04_04_VW04_WG04_08_04
    SolutionIndex: 50
    SolutionNameMin: Cijk_Alik_Bjlk_SB_MT032x064x32_GRVW04_GSU04_SNLL0_TT04_04_VW04_WG08_16_02
    SolutionIndex: 51
    SolutionNameMin: Cijk_Alik_Bjlk_SB_MT008x016x32_GRVW02_GSU08_SNLL0_TT02_02_VW02_WG04_08_04
    SolutionIndex: 52
    SolutionNameMin: Cijk_Alik_Bjlk_SB_MT128x128x08_GRVW04_GSU01_SNLL0_TT08_08_VW04_WG16_16_01
    SolutionIndex: 53
    SolutionNameMin: Cijk_Alik_Bjlk_SB_MT128x128x08_GRVW04_GSU01_SNLL0_TT08_08_VW04_WG16_16_01
    SolutionIndex: 54
    SolutionNameMin: Cijk_Alik_Bjlk_SB_MT128x128x08_GRVW04_GSU01_SNLL1_TT08_08_VW04_WG16_16_01
    SolutionIndex: 55
    SolutionNameMin: Cijk_Alik_Bjlk_SB_MT128x128x08_GRVW04_GSU01_SNLL1_TT08_08_VW04_WG16_16_01
    SolutionIndex: 56
    SolutionNameMin: Cijk_Alik_Bjlk_SB_MT064x064x16_GRVW04_GSU01_SNLL0_TT04_04_VW04_WG16_16_01
    SolutionIndex: 57
    SolutionNameMin: Cijk_Alik_Bjlk_SB_MT064x064x16_GRVW04_GSU01_SNLL1_TT04_04_VW04_WG16_16_01
    SolutionIndex: 58
    SolutionNameMin: Cijk_Alik_Bjlk_SB_MT064x128x16_GRVW04_GSU01_SNLL0_TT04_08_VW04_WG16_16_01
    SolutionIndex: 59
    SolutionNameMin: Cijk_Alik_Bjlk_SB_MT064x128x16_GRVW04_GSU01_SNLL1_TT04_08_VW04_WG16_16_01
    SolutionIndex: 60
    SolutionNameMin: Cijk_Alik_Bjlk_SB_MT128x064x16_GRVW04_GSU01_SNLL0_TT08_04_VW04_WG16_16_01
    SolutionIndex: 61
    SolutionNameMin: Cijk_Alik_Bjlk_SB_MT128x064x16_GRVW04_GSU01_SNLL1_TT08_04_VW04_WG16_16_01
    SolutionIndex: 62
    SolutionNameMin: Cijk_Alik_Bjlk_SB_MT128x128x16_GRVW04_GSU01_SNLL1_TT08_08_VW04_WG16_16_01
    SolutionIndex: 63
    SolutionNameMin: Cijk_Alik_Bjlk_SB_MT064x064x16_GRVW04_GSU01_SNLL0_TT04_04_VW04_WG16_16_01
    SolutionIndex: 64
    SolutionNameMin: Cijk_Alik_Bjlk_SB_MT064x064x16_GRVW04_GSU01_SNLL1_TT04_04_VW04_WG16_16_01
    SolutionIndex: 65
    SolutionNameMin: Cijk_Alik_Bjlk_SB_MT064x128x16_GRVW04_GSU01_SNLL0_TT04_08_VW04_WG16_16_01
    SolutionIndex: 66
    SolutionNameMin: Cijk_Alik_Bjlk_SB_MT064x128x16_GRVW04_GSU01_SNLL1_TT04_08_VW04_WG16_16_01
    SolutionIndex: 67
    SolutionNameMin: Cijk_Alik_Bjlk_SB_MT128x064x16_GRVW04_GSU01_SNLL0_TT08_04_VW04_WG16_16_01
    SolutionIndex: 68
    SolutionNameMin: Cijk_Alik_Bjlk_SB_MT128x064x16_GRVW04_GSU01_SNLL1_TT08_04_VW04_WG16_16_01
    SolutionIndex: 69
    SolutionNameMin: Cijk_Alik_Bjlk_SB_MT128x128x16_GRVW04_GSU01_SNLL1_TT08_08_VW04_WG16_16_01
    SolutionIndex: 70
    SolutionNameMin: Cijk_Alik_Bjlk_SB_MT016x016x04_GRVW02_GSU01_SNLL0_TT02_02_VW02_WG08_08_01
    SolutionIndex: 71
    SolutionNameMin: Cijk_Alik_Bjlk_SB_MT032x032x02_GRVW04_GSU01_SNLL0_TT04_04_VW04_WG08_08_01
    SolutionIndex: 72
    SolutionNameMin: Cijk_Alik_Bjlk_SB_MT016x016x16_GRVW02_GSU01_SNLL1_TT02_02_VW02_WG08_08_04
    SolutionIndex: 73
    SolutionNameMin: Cijk_Alik_Bjlk_SB_MT008x008x08_GRVW02_GSU02_SNLL0_TT02_02_VW02_WG04_04_04
    SolutionIndex: 74
    SolutionNameMin: Cijk_Alik_Bjlk_SB_MT016x016x16_GRVW02_GSU02_SNLL0_TT02_02_VW02_WG08_08_04
    SolutionIndex: 75
    SolutionNameMin: Cijk_Alik_Bjlk_SB_MT016x016x04_GRVW02_GSU04_SNLL0_TT02_02_VW02_WG08_08_01
    SolutionIndex: 76
    SolutionNameMin: Cijk_Alik_Bjlk_SB_MT008x008x08_GRVW02_GSU04_SNLL0_TT02_02_VW02_WG04_04_04
    SolutionIndex: 77
    SolutionNameMin: Cijk_Alik_Bjlk_SB_MT016x016x16_GRVW02_GSU04_SNLL0_TT02_02_VW02_WG08_08_04
    SolutionIndex: 78
    SolutionNameMin: Cijk_Alik_Bjlk_SB_MT008x008x08_GRVW02_GSU08_SNLL0_TT02_02_VW02_WG04_04_04
    SolutionIndex: 79
    SolutionNameMin: Cijk_Alik_Bjlk_SB_MT016x016x16_GRVW02_GSU08_SNLL0_TT02_02_VW02_WG08_08_04
    SolutionIndex: 80
    SolutionNameMin: Cijk_Alik_Bjlk_SB_MT008x008x08_GRVW02_GSU16_SNLL0_TT02_02_VW02_WG04_04_04
    SolutionIndex: 81
    SolutionNameMin: Cijk_Alik_Bjlk_SB_MT016x016x16_GRVW02_GSU16_SNLL0_TT02_02_VW02_WG08_08_04
    SolutionIndex: 82
    SolutionNameMin: Cijk_Alik_Bjlk_SB_MT016x016x08_GRVW02_GSU01_SNLL0_TT02_02_VW02_WG08_08_01
    SolutionIndex: 83
    SolutionNameMin: Cijk_Alik_Bjlk_SB_MT032x032x08_GRVW02_GSU01_SNLL0_TT02_02_VW02_WG16_16_01
    SolutionIndex: 84
    SolutionNameMin: Cijk_Alik_Bjlk_SB_MT032x064x08_GRVW02_GSU01_SNLL0_TT02_04_VW02_WG16_16_01
    SolutionIndex: 85
    SolutionNameMin: Cijk_Alik_Bjlk_SB_MT128x128x08_GRVW04_GSU01_SNLL0_TT08_08_VW04_WG16_16_01
    SolutionIndex: 86
    SolutionNameMin: Cijk_Alik_Bjlk_SB_MT032x032x08_GRVW02_GSU01_SNLL0_TT02_04_VW02_WG16_08_01
    SolutionIndex: 87
    SolutionNameMin: Cijk_Alik_Bjlk_SB_MT016x032x08_GRVW02_GSU01_SNLL0_TT02_02_VW02_WG08_16_01
    SolutionIndex: 88
    SolutionNameMin: Cijk_Alik_Bjlk_SB_MT032x064x08_GRVW02_GSU01_SNLL0_TT02_04_VW02_WG16_16_01
    SolutionIndex: 89
    SolutionNameMin: Cijk_Alik_Bjlk_SB_MT128x128x08_GRVW04_GSU01_SNLL0_TT08_08_VW04_WG16_16_01
    SolutionIndex: 90
    SolutionNameMin: Cijk_Alik_Bjlk_SB_MT016x064x08_GRVW02_GSU01_SNLL0_TT02_04_VW02_WG08_16_01
    SolutionIndex: 91
    SolutionNameMin: Cijk_Alik_Bjlk_SB_MT016x016x08_GRVW02_GSU02_SNLL0_TT02_02_VW02_WG08_08_02
    SolutionIndex: 92
    SolutionNameMin: Cijk_Alik_Bjlk_SB_MT016x016x08_GRVW02_GSU04_SNLL0_TT02_02_VW02_WG08_08_02
    SolutionIndex: 93
    SolutionNameMin: Cijk_Alik_Bjlk_SB_MT016x016x08_GRVW02_GSU08_SNLL0_TT02_02_VW02_WG08_08_02
    SolutionIndex: 94
    SolutionNameMin: Cijk_Alik_Bjlk_SB_MT008x016x16_GRVW02_GSU02_SNLL0_TT02_02_VW02_WG04_08_04
    SolutionIndex: 95
    SolutionNameMin: Cijk_Alik_Bjlk_SB_MT008x032x16_GRVW02_GSU02_SNLL0_TT02_04_VW02_WG04_08_04
    SolutionIndex: 96
    SolutionNameMin: Cijk_Alik_Bjlk_SB_MT016x032x16_GRVW02_GSU02_SNLL0_TT02_04_VW02_WG08_08_02
    SolutionIndex: 97
    SolutionNameMin: Cijk_Alik_Bjlk_SB_MT032x032x16_GRVW04_GSU02_SNLL0_TT04_04_VW04_WG08_08_02
    SolutionIndex: 98
    SolutionNameMin: Cijk_Alik_Bjlk_SB_MT032x064x16_GRVW04_GSU02_SNLL0_TT04_08_VW04_WG08_08_02
    SolutionIndex: 99
    SolutionNameMin: Cijk_Alik_Bjlk_SB_MT032x032x16_GRVW02_GSU02_SNLL0_TT02_04_VW02_WG16_08_04
    SolutionIndex: 100
    SolutionNameMin: Cijk_Alik_Bjlk_SB_MT016x032x16_GRVW02_GSU02_SNLL0_TT02_02_VW02_WG08_16_02
    SolutionIndex: 101
    SolutionNameMin: Cijk_Alik_Bjlk_SB_MT016x064x16_GRVW02_GSU02_SNLL0_TT02_04_VW02_WG08_16_02
    SolutionIndex: 102
    SolutionNameMin: Cijk_Alik_Bjlk_SB_MT008x016x16_GRVW02_GSU02_SNLL0_TT02_02_VW02_WG04_08_04
    SolutionIndex: 103
    SolutionNameMin: Cijk_Alik_Bjlk_SB_MT008x032x16_GRVW02_GSU02_SNLL0_TT02_04_VW02_WG04_08_04
    SolutionIndex: 104
    SolutionNameMin: Cijk_Alik_Bjlk_SB_MT016x032x16_GRVW02_GSU02_SNLL0_TT02_04_VW02_WG08_08_02
    SolutionIndex: 105
    SolutionNameMin: Cijk_Alik_Bjlk_SB_MT032x032x16_GRVW04_GSU02_SNLL0_TT04_04_VW04_WG08_08_02
    SolutionIndex: 106
    SolutionNameMin: Cijk_Alik_Bjlk_SB_MT032x064x16_GRVW04_GSU02_SNLL0_TT04_08_VW04_WG08_08_02
    SolutionIndex: 107
    SolutionNameMin: Cijk_Alik_Bjlk_SB_MT032x032x16_GRVW02_GSU02_SNLL0_TT02_04_VW02_WG16_08_04
    SolutionIndex: 108
    SolutionNameMin: Cijk_Alik_Bjlk_SB_MT016x032x16_GRVW02_GSU02_SNLL0_TT02_02_VW02_WG08_16_02
    SolutionIndex: 109
    SolutionNameMin: Cijk_Alik_Bjlk_SB_MT016x064x16_GRVW02_GSU02_SNLL0_TT02_04_VW02_WG08_16_02
    SolutionIndex: 110
    SolutionNameMin: Cijk_Alik_Bjlk_SB_MT008x016x16_GRVW02_GSU04_SNLL0_TT02_02_VW02_WG04_08_04
    SolutionIndex: 111
    SolutionNameMin: Cijk_Alik_Bjlk_SB_MT008x032x16_GRVW02_GSU04_SNLL0_TT02_04_VW02_WG04_08_04
    SolutionIndex: 112
    SolutionNameMin: Cijk_Alik_Bjlk_SB_MT032x032x16_GRVW04_GSU04_SNLL0_TT04_04_VW04_WG08_08_02
    SolutionIndex: 113
    SolutionNameMin: Cijk_Alik_Bjlk_SB_MT032x064x16_GRVW04_GSU04_SNLL0_TT04_08_VW04_WG08_08_02
    SolutionIndex: 114
    SolutionNameMin: Cijk_Alik_Bjlk_SB_MT016x064x16_GRVW02_GSU04_SNLL0_TT02_04_VW02_WG08_16_02
    SolutionIndex: 115
    SolutionNameMin: Cijk_Alik_Bjlk_SB_MT008x032x16_GRVW02_GSU04_SNLL0_TT02_04_VW02_WG04_08_04
    SolutionIndex: 116
    SolutionNameMin: Cijk_Alik_Bjlk_SB_MT032x032x16_GRVW04_GSU04_SNLL0_TT04_04_VW04_WG08_08_02
    SolutionIndex: 117
    SolutionNameMin: Cijk_Alik_Bjlk_SB_MT016x064x16_GRVW02_GSU04_SNLL0_TT02_04_VW02_WG08_16_02
    SolutionIndex: 118
    SolutionNameMin: Cijk_Alik_Bjlk_SB_MT008x016x16_GRVW02_GSU08_SNLL0_TT02_02_VW02_WG04_08_04
    SolutionIndex: 119
    SolutionNameMin: Cijk_Alik_Bjlk_SB_MT064x064x24_GRVW04_GSU02_SNLL0_TT08_08_VW04_WG08_08_02
    SolutionIndex: 120
    SolutionNameMin: Cijk_Alik_Bjlk_SB_MT008x016x32_GRVW02_GSU02_SNLL0_TT02_02_VW02_WG04_08_04
    SolutionIndex: 121
    SolutionNameMin: Cijk_Alik_Bjlk_SB_MT016x032x32_GRVW04_GSU02_SNLL0_TT04_04_VW04_WG04_08_04
    SolutionIndex: 122
    SolutionNameMin: Cijk_Alik_Bjlk_SB_MT032x032x32_GRVW02_GSU02_SNLL0_TT02_04_VW02_WG16_08_04
    SolutionIndex: 123
    SolutionNameMin: Cijk_Alik_Bjlk_SB_MT064x064x32_GRVW04_GSU02_SNLL0_TT04_08_VW04_WG16_08_04
    SolutionIndex: 124
    SolutionNameMin: Cijk_Alik_Bjlk_SB_MT032x064x32_GRVW04_GSU02_SNLL0_TT04_04_VW04_WG08_16_02
    SolutionIndex: 125
    SolutionNameMin: Cijk_Alik_Bjlk_SB_MT016x032x32_GRVW04_GSU02_SNLL0_TT04_04_VW04_WG04_08_04
    SolutionIndex: 126
    SolutionNameMin: Cijk_Alik_Bjlk_SB_MT064x064x32_GRVW04_GSU02_SNLL0_TT04_08_VW04_WG16_08_04
    SolutionIndex: 127
    SolutionNameMin: Cijk_Alik_Bjlk_SB_MT032x064x32_GRVW04_GSU02_SNLL0_TT04_04_VW04_WG08_16_02
    SolutionIndex: 128
    SolutionNameMin: Cijk_Alik_Bjlk_SB_MT008x016x32_GRVW02_GSU04_SNLL0_TT02_02_VW02_WG04_08_04
    SolutionIndex: 129
    SolutionNameMin: Cijk_Alik_Bjlk_SB_MT008x032x32_GRVW02_GSU04_SNLL0_TT02_04_VW02_WG04_08_04
    SolutionIndex: 130
    SolutionNameMin: Cijk_Alik_Bjlk_SB_MT016x032x32_GRVW04_GSU04_SNLL0_TT04_04_VW04_WG04_08_04
    SolutionIndex: 131
    SolutionNameMin: Cijk_Alik_Bjlk_SB_MT016x032x32_GRVW04_GSU04_SNLL0_TT04_04_VW04_WG04_08_04
    SolutionIndex: 132
    SolutionNameMin: Cijk_Alik_Bjlk_SB_MT032x064x32_GRVW04_GSU04_SNLL0_TT04_04_VW04_WG08_16_02
    SolutionIndex: 133
    SolutionNameMin: Cijk_Alik_Bjlk_SB_MT008x016x32_GRVW02_GSU08_SNLL0_TT02_02_VW02_WG04_08_04
    SolutionIndex: 134
    SolutionNameMin: Cijk_Alik_Bjlk_SB_MT128x128x08_GRVW04_GSU01_SNLL0_TT08_08_VW04_WG16_16_01
    SolutionIndex: 135
    SolutionNameMin: Cijk_Alik_Bjlk_SB_MT128x128x08_GRVW04_GSU01_SNLL0_TT08_08_VW04_WG16_16_01
    SolutionIndex: 136
    SolutionNameMin: Cijk_Alik_Bjlk_SB_MT128x128x08_GRVW04_GSU01_SNLL1_TT08_08_VW04_WG16_16_01
    SolutionIndex: 137
    SolutionNameMin: Cijk_Alik_Bjlk_SB_MT128x128x08_GRVW04_GSU01_SNLL1_TT08_08_VW04_WG16_16_01
    SolutionIndex: 138
    SolutionNameMin: Cijk_Alik_Bjlk_SB_MT064x064x16_GRVW04_GSU01_SNLL0_TT04_04_VW04_WG16_16_01
    SolutionIndex: 139
    SolutionNameMin: Cijk_Alik_Bjlk_SB_MT064x064x16_GRVW04_GSU01_SNLL1_TT04_04_VW04_WG16_16_01
    SolutionIndex: 140
    SolutionNameMin: Cijk_Alik_Bjlk_SB_MT064x128x16_GRVW04_GSU01_SNLL0_TT04_08_VW04_WG16_16_01
    SolutionIndex: 141
    SolutionNameMin: Cijk_Alik_Bjlk_SB_MT064x128x16_GRVW04_GSU01_SNLL1_TT04_08_VW04_WG16_16_01
    SolutionIndex: 142
    SolutionNameMin: Cijk_Alik_Bjlk_SB_MT128x064x16_GRVW04_GSU01_SNLL0_TT08_04_VW04_WG16_16_01
    SolutionIndex: 143
    SolutionNameMin: Cijk_Alik_Bjlk_SB_MT128x064x16_GRVW04_GSU01_SNLL1_TT08_04_VW04_WG16_16_01
    SolutionIndex: 144
    SolutionNameMin: Cijk_Alik_Bjlk_SB_MT128x128x16_GRVW04_GSU01_SNLL1_TT08_08_VW04_WG16_16_01
    SolutionIndex: 145
    SolutionNameMin: Cijk_Alik_Bjlk_SB_MT064x064x16_GRVW04_GSU01_SNLL0_TT04_04_VW04_WG16_16_01
    SolutionIndex: 146
    SolutionNameMin: Cijk_Alik_Bjlk_SB_MT064x064x16_GRVW04_GSU01_SNLL1_TT04_04_VW04_WG16_16_01
    SolutionIndex: 147
    SolutionNameMin: Cijk_Alik_Bjlk_SB_MT064x128x16_GRVW04_GSU01_SNLL0_TT04_08_VW04_WG16_16_01
    SolutionIndex: 148
    SolutionNameMin: Cijk_Alik_Bjlk_SB_MT064x128x16_GRVW04_GSU01_SNLL1_TT04_08_VW04_WG16_16_01
    SolutionIndex: 149
    SolutionNameMin: Cijk_Alik_Bjlk_SB_MT128x064x16_GRVW04_GSU01_SNLL0_TT08_04_VW04_WG16_16_01
    SolutionIndex: 150
    SolutionNameMin: Cijk_Alik_Bjlk_SB_MT128x064x16_GRVW04_GSU01_SNLL1_TT08_04_VW04_WG16_16_01
    SolutionIndex: 151
    SolutionNameMin: Cijk_Alik_Bjlk_SB_MT128x128x16_GRVW04_GSU01_SNLL1_TT08_08_VW04_WG16_16_01
    SolutionIndex: 152
    SolutionNameMin: Cijk_Alik_Bjlk_SB_MT016x016x04_GRVW02_GSU01_SNLL0_TT02_02_VW02_WG08_08_01
    SolutionIndex: 153
    SolutionNameMin: Cijk_Alik_Bjlk_SB_MT032x032x02_GRVW04_GSU01_SNLL0_TT04_04_VW04_WG08_08_01
    SolutionIndex: 154
    SolutionNameMin: Cijk_Alik_Bjlk_SB_MT016x016x16_GRVW02_GSU01_SNLL1_TT02_02_VW02_WG08_08_04
    SolutionIndex: 155
    SolutionNameMin: Cijk_Alik_Bjlk_SB_MT008x008x08_GRVW02_GSU02_SNLL0_TT02_02_VW02_WG04_04_04
    SolutionIndex: 156
    SolutionNameMin: Cijk_Alik_Bjlk_SB_MT016x016x16_GRVW02_GSU02_SNLL0_TT02_02_VW02_WG08_08_04
    SolutionIndex: 157
    SolutionNameMin: Cijk_Alik_Bjlk_SB_MT016x016x04_GRVW02_GSU04_SNLL0_TT02_02_VW02_WG08_08_01
    SolutionIndex: 158
    SolutionNameMin: Cijk_Alik_Bjlk_SB_MT008x008x08_GRVW02_GSU04_SNLL0_TT02_02_VW02_WG04_04_04
    SolutionIndex: 159
    SolutionNameMin: Cijk_Alik_Bjlk_SB_MT016x016x16_GRVW02_GSU04_SNLL0_TT02_02_VW02_WG08_08_04
    SolutionIndex: 160
    SolutionNameMin: Cijk_Alik_Bjlk_SB_MT008x008x08_GRVW02_GSU08_SNLL0_TT02_02_VW02_WG04_04_04
    SolutionIndex: 161
    SolutionNameMin: Cijk_Alik_Bjlk_SB_MT016x016x16_GRVW02_GSU08_SNLL0_TT02_02_VW02_WG08_08_04
    SolutionIndex: 162
    SolutionNameMin: Cijk_Alik_Bjlk_SB_MT008x008x08_GRVW02_GSU16_SNLL0_TT02_02_VW02_WG04_04_04
    SolutionIndex: 163
    SolutionNameMin: Cijk_Alik_Bjlk_SB_MT016x016x16_GRVW02_GSU16_SNLL0_TT02_02_VW02_WG08_08_04
- - - [1024, 128, 1, 128]
    - [5, 1665.4]
  - - [4, 704, 1, 1280]
    - [77, 402.129]
  - - [4, 1856, 1, 3328]
    - [10, 615.377]
  - - [1856, 448, 1, 3328]
    - [57, 7695.9]
  - - [2944, 4288, 1, 1280]
    - [54, 9438.92]
  - - [2368, 64, 1, 3328]
    - [15, 5910.34]
  - - [2368, 5888, 1, 256]
    - [62, 9702.93]
  - - [128, 64, 1, 256]
    - [28, 435.591]
  - - [5888, 1024, 1, 1280]
    - [62, 10054.3]
  - - [128, 6784, 1, 3328]
    - [66, 8055.36]
  - - [64, 4, 1, 256]
    - [78, 16.6928]
  - - [5888, 1856, 1, 3328]
    - [54, 9217.71]
  - - [5056, 704, 1, 256]
    - [57, 9005.1]
  - - [5888, 2944, 1, 3328]
    - [54, 9182.94]
  - - [1856, 4288, 1, 256]
    - [57, 9092.17]
  - - [1024, 5056, 1, 128]
    - [7, 2769.71]
  - - [5056, 5056, 1, 3328]
    - [55, 9180.65]
  - - [1408, 5888, 1, 1280]
    - [54, 10109.5]
  - - [2368, 448, 1, 128]
    - [7, 1807.81]
  - - [1024, 3584, 1, 3328]
    - [68, 9512.55]
  - - [4, 2944, 1, 1280]
    - [10, 591.515]
  - - [1408, 64, 1, 128]
    - [5, 1188.62]
  - - [256, 4288, 1, 3328]
    - [64, 8203.12]
  - - [5888, 1408, 1, 1280]
    - [54, 10356.5]
  - - [704, 1856, 1, 3328]
    - [57, 9305.98]
  - - [4, 1408, 1, 128]
    - [70, 68.054]
  - - [1024, 2368, 1, 256]
    - [64, 6954.29]
  - - [1408, 1856, 1, 1280]
    - [57, 9900.35]
  - - [1408, 64, 1, 1280]
    - [19, 3742.97]
  - - [448, 1024, 1, 1280]
    - [64, 7436.19]
  - - [256, 1408, 1, 3328]
    - [64, 6245.15]
  - - [5056, 5056, 1, 1280]
    - [54, 9498.87]
  - - [448, 5056, 1, 256]
    - [57, 7914.92]
  - - [704, 1856, 1, 1280]
    - [57, 8867.91]
  - - [128, 5056, 1, 128]
    - [2, 3250.82]
  - - [2368, 128, 1, 256]
    - [64, 3837.04]
  - - [1856, 1408, 1, 128]
    - [3, 2972.71]
  - - [64, 5056, 1, 256]
    - [57, 4022.6]
  - - [6784, 256, 1, 3328]
    - [64, 9368.88]
  - - [6784, 4288, 1, 3328]
    - [54, 8774.76]
  - - [4288, 448, 1, 256]
    - [57, 7960.28]
  - - [64, 704, 1, 128]
    - [0, 638.173]
  - - [1856, 2368, 1, 3328]
    - [57, 9307.21]
  - - [4288, 2944, 1, 1280]
    - [58, 9672.46]
  - - [704, 5056, 1, 1280]
    - [59, 9886.65]
  - - [2368, 704, 1, 3328]
    - [64, 9054.13]
  - - [256, 5888, 1, 256]
    - [64, 7928.66]
  - - [1856, 4288, 1, 3328]
    - [62, 9207.83]
  - - [256, 2944, 1, 256]
    - [64, 7096.96]
  - - [5888, 1024, 1, 256]
    - [64, 9566.84]
  - - [448, 64, 1, 1280]
    - [29, 2737.18]
  - - [448, 5056, 1, 3328]
    - [57, 8836.62]
  - - [3584, 4, 1, 1280]
    - [79, 518.239]
  - - [2944, 64, 1, 256]
    - [57, 2843.43]
  - - [128, 4, 1, 1280]
    - [79, 130.109]
  - - [1408, 2944, 1, 256]
    - [58, 9338.43]
  - - [256, 1856, 1, 1280]
    - [64, 7723.48]
  - - [6784, 5056, 1, 3328]
    - [55, 8729.31]
  - - [5056, 5056, 1, 256]
    - [55, 9738.02]
  - - [1408, 6784, 1, 128]
    - [7, 3347.21]
  - - [64, 1024, 1, 1280]
    - [14, 3653.02]
  - - [2944, 4, 1, 256]
    - [74, 398.975]
  - - [704, 5056, 1, 128]
    - [3, 3165.46]
  - - [4, 2368, 1, 1280]
    - [10, 554.818]
  - - [2368, 2944, 1, 1280]
    - [62, 9679.53]
  - - [128, 3584, 1, 1280]
    - [64, 7450.15]
  - - [6784, 6784, 1, 1280]
    - [54, 9205.51]
  - - [1024, 256, 1, 3328]
    - [57, 6851.2]
  - - [1408, 4288, 1, 1280]
    - [55, 9882.97]
  - - [3584, 4288, 1, 1280]
    - [54, 9681.49]
  - - [2368, 704, 1, 1280]
    - [64, 8838.94]
  - - [5056, 4288, 1, 3328]
    - [55, 8880.25]
  - - [3584, 2368, 1, 3328]
    - [65, 8932.8]
  - - [64, 704, 1, 1280]
    - [32, 3139.28]
  - - [4288, 256, 1, 256]
    - [57, 6198.71]
  - - [2944, 128, 1, 128]
    - [2, 2843.43]
  - - [6784, 448, 1, 1280]
    - [61, 9578.01]
  - - [1408, 2944, 1, 128]
    - [7, 3354.85]
  - - [4288, 2944, 1, 256]
    - [58, 10026.8]
  - - [5888, 704, 1, 1280]
    - [57, 9988.27]
  - - [1856, 64, 1, 1280]
    - [15, 4171.81]
  - - [448, 5888, 1, 128]
    - [7, 3000.67]
  - - [5888, 64, 1, 3328]
    - [42, 6529.03]
  - - [2944, 256, 1, 3328]
    - [64, 8870.71]
  - - [1024, 64, 1, 128]
    - [1, 913.245]
  - - [5056, 2368, 1, 1280]
    - [62, 9776.47]
  - - [448, 3584, 1, 1280]
    - [57, 8379.48]
  - - [6784, 5888, 1, 256]
    - [69, 9887.02]
  - - [64, 1024, 1, 3328]
    - [50, 4673.47]
  - - [704, 128, 1, 1280]
    - [23, 4044.44]
  - - [5888, 2944, 1, 128]
    - [7, 3569.19]
  - - [4, 3584, 1, 128]
    - [70, 152.911]
  - - [1408, 448, 1, 1280]
    - [57, 7320.07]
  - - [1024, 1408, 1, 256]
    - [68, 6939.64]
  - - [2368, 2368, 1, 3328]
    - [65, 9333.22]
  - - [1856, 6784, 1, 128]
    - [3, 3782.47]
  - - [5056, 704, 1, 3328]
    - [64, 9157.22]
  - - [1408, 1856, 1, 256]
    - [57, 8986.14]
  - - [1408, 704, 1, 3328]
    - [64, 9105.02]
  - - [2368, 5056, 1, 256]
    - [62, 9511.71]
  - - [5888, 1856, 1, 256]
    - [60, 9912.43]
  - - [4288, 64, 1, 3328]
    - [31, 5777.55]
  - - [2368, 4, 1, 1280]
    - [79, 488.572]
  - - [704, 5888, 1, 256]
    - [58, 8729.54]
  - - [4288, 64, 1, 256]
    - [17, 2781.26]
  - - [6784, 64, 1, 256]
    - [17, 2783.77]
  - - [2944, 256, 1, 256]
    - [64, 6431.05]
  - - [2944, 6784, 1, 3328]
    - [54, 8853.25]
  - - [704, 1408, 1, 3328]
    - [57, 9166.85]
  - - [3584, 704, 1, 3328]
    - [61, 9256.55]
  - - [2944, 256, 1, 128]
    - [52, 2280.7]
  - - [6784, 4, 1, 1280]
    - [79, 562.901]
  - - [1024, 64, 1, 1280]
    - [21, 3254.11]
  - - [448, 4288, 1, 256]
    - [57, 7476.17]
  - - [64, 3584, 1, 3328]
    - [37, 6501.61]
  - - [704, 2368, 1, 1280]
    - [57, 8868.86]
  - - [448, 2944, 1, 128]
    - [7, 2176.7]
  - - [1856, 2368, 1, 1280]
    - [57, 9963.69]
  - - [2368, 128, 1, 3328]
    - [31, 6466.01]
  - - [2944, 128, 1, 256]
    - [64, 4269.86]
  - - [448, 1408, 1, 256]
    - [57, 6157.98]
  - - [1856, 4288, 1, 1280]
    - [55, 9944.96]
  - - [64, 5056, 1, 3328]
    - [45, 6702.4]
  - - [4, 704, 1, 256]
    - [74, 156.972]
  - - [1024, 448, 1, 128]
    - [7, 1627.73]
  - - [704, 4, 1, 1280]
    - [77, 383.15]
  - - [704, 256, 1, 128]
    - [3, 666.85]
  - - [704, 2944, 1, 128]
    - [3, 2473.28]
  - - [1408, 1024, 1, 1280]
    - [66, 8916.72]
  - - [704, 6784, 1, 256]
    - [55, 8361.24]
  - - [6784, 704, 1, 256]
    - [57, 9179.7]
  - - [5056, 1408, 1, 128]
    - [7, 3720.8]
  - - [256, 3584, 1, 3328]
    - [66, 8530.69]
  - - [4, 5888, 1, 3328]
    - [75, 680.019]
  - - [128, 1408, 1, 128]
    - [1, 1898.89]
  - - [3584, 4288, 1, 3328]
    - [55, 9284.09]
  - - [5888, 1856, 1, 1280]
    - [60, 9704.59]
  - - [5056, 1024, 1, 3328]
    - [55, 9983.26]
  - - [5056, 64, 1, 1280]
    - [42, 4678.95]
  - - [1024, 704, 1, 256]
    - [64, 6538.86]
  - - [1024, 4288, 1, 128]
    - [7, 2618.1]
  - - [4288, 64, 1, 1280]
    - [42, 4456.79]
  - - [2368, 3584, 1, 1280]
    - [59, 9644.79]
  - - [2368, 6784, 1, 1280]
    - [54, 9789.66]
  - - [1024, 256, 1, 256]
    - [64, 4194.17]
  - - [1856, 4, 1, 1280]
    - [79, 453.298]
  - - [448, 448, 1, 256]
    - [64, 3334.75]
  - - [2944, 3584, 1, 3328]
    - [54, 8783.27]
  - - [128, 4288, 1, 128]
    - [4, 3001.24]
  - - [64, 448, 1, 256]
    - [20, 1254.28]
  - - [128, 1024, 1, 3328]
    - [23, 6572.11]
  - - [4, 1408, 1, 3328]
    - [77, 581.665]
  - - [6784, 2944, 1, 256]
    - [58, 10310.9]
  - - [64, 1856, 1, 1280]
    - [15, 4729.27]
  - - [64, 1024, 1, 128]
    - [1, 928.2]
  - - [4288, 2368, 1, 3328]
    - [58, 8891.25]
  - - [1856, 2368, 1, 256]
    - [64, 9312.46]
  - - [3584, 256, 1, 128]
    - [52, 2331.46]
  - - [3584, 6784, 1, 3328]
    - [55, 9022.66]
  - - [256, 1024, 1, 256]
    - [64, 4397.7]
  - - [4, 6784, 1, 3328]
    - [75, 647.782]
  - - [1024, 5888, 1, 3328]
    - [55, 9619.18]
  - - [1024, 128, 1, 1280]
    - [44, 4458.35]
  - - [4288, 128, 1, 1280]
    - [42, 5692.71]
  - - [5056, 4288, 1, 1280]
    - [58, 9401.0]
  - - [5888, 64, 1, 256]
    - [25, 2713.08]
  - - [1408, 5056, 1, 1280]
    - [54, 10222.7]
  - - [1856, 256, 1, 1280]
    - [57, 7490.94]
  - - [64, 5888, 1, 3328]
    - [41, 6763.78]
  - - [2944, 5888, 1, 128]
    - [3, 3553.1]
  - - [704, 5888, 1, 1280]
    - [58, 9995.24]
  - - [2368, 3584, 1, 128]
    - [7, 3539.69]
  - - [6784, 5888, 1, 3328]
    - [54, 8748.71]
  - - [704, 1024, 1, 1280]
    - [64, 8348.99]
  - - [448, 256, 1, 3328]
    - [30, 6019.31]
  - - [448, 1856, 1, 128]
    - [52, 2690.59]
  - - [128, 1024, 1, 128]
    - [5, 1641.2]
  - - [2944, 4, 1, 128]
    - [70, 143.296]
  - - [1024, 704, 1, 1280]
    - [57, 8179.04]
  - - [128, 5888, 1, 256]
    - [57, 6927.01]
  - - [1024, 5056, 1, 1280]
    - [69, 10154.6]
  - - [4288, 1024, 1, 256]
    - [64, 9361.19]
  - - [2944, 2368, 1, 128]
    - [3, 3406.72]
  - - [704, 704, 1, 3328]
    - [64, 8540.97]
  - - [704, 1408, 1, 1280]
    - [57, 8888.39]
  - - [5888, 448, 1, 1280]
    - [57, 9136.12]
  - - [3584, 256, 1, 3328]
    - [64, 8462.39]
  - - [704, 5888, 1, 3328]
    - [59, 9570.24]
  - - [704, 1856, 1, 128]
    - [3, 2189.9]
  - - [128, 3584, 1, 3328]
    - [64, 7920.88]
  - - [4, 4288, 1, 128]
    - [70, 172.308]
  - - [128, 704, 1, 1280]
    - [19, 4023.49]
  - - [3584, 2944, 1, 256]
    - [64, 9679.88]
  - - [1856, 128, 1, 3328]
    - [15, 6683.23]
  - - [4, 64, 1, 1280]
    - [79, 68.054]
  - - [4, 5056, 1, 3328]
    - [9, 698.382]
  - - [128, 2944, 1, 1280]
    - [57, 6213.22]
  - - [2368, 1024, 1, 3328]
    - [59, 9087.36]
  - - [128, 256, 1, 3328]
    - [48, 4066.75]
  - - [1408, 5056, 1, 3328]
    - [54, 9638.8]
  - - [1856, 1856, 1, 3328]
    - [66, 9221.79]
  - - [3584, 128, 1, 256]
    - [64, 4044.37]
  - - [448, 1408, 1, 3328]
    - [57, 7374.17]
  - - [2368, 2368, 1, 256]
    - [58, 9598.13]
  - - [4288, 4288, 1, 1280]
    - [60, 9246.95]
  - - [64, 448, 1, 1280]
    - [32, 2707.3]
  - - [1408, 4288, 1, 256]
    - [65, 9175.43]
  - - [448, 4, 1, 256]
    - [77, 126.395]
  - - [5888, 448, 1, 128]
    - [7, 2787.78]
  - - [448, 4, 1, 1280]
    - [77, 319.221]
  - - [704, 6784, 1, 3328]
    - [54, 9312.37]
  - - [5888, 5888, 1, 1280]
    - [55, 9274.41]
  - - [5056, 1024, 1, 1280]
    - [54, 10296.0]
  - - [448, 5888, 1, 3328]
    - [54, 8687.65]
  - - [128, 4, 1, 128]
    - [70, 6.70239]
  - - [1024, 2944, 1, 1280]
    - [55, 9780.62]
  - - [5056, 5888, 1, 1280]
    - [54, 9469.01]
  - - [4288, 5888, 1, 128]
    - [7, 3923.97]
  - - [256, 3584, 1, 256]
    - [64, 6848.34]
  - - [1408, 3584, 1, 128]
    - [3, 3399.48]
  - - [256, 2944, 1, 3328]
    - [64, 9046.1]
  - - [448, 3584, 1, 128]
    - [7, 2552.39]
  - - [5888, 2944, 1, 1280]
    - [54, 9702.2]
  - - [4, 6784, 1, 1280]
    - [10, 642.32]
  - - [2368, 5888, 1, 128]
    - [3, 3594.8]
  - - [64, 2944, 1, 128]
    - [1, 1949.5]
  - - [3584, 5888, 1, 256]
    - [65, 10194.0]
  - - [2368, 704, 1, 128]
    - [3, 2704.79]
  - - [3584, 2944, 1, 1280]
    - [62, 9427.12]
  - - [3584, 2368, 1, 128]
    - [7, 3304.39]
  - - [5056, 704, 1, 128]
    - [52, 2975.56]
  - - [448, 2368, 1, 128]
    - [3, 1882.05]
  - - [5056, 1408, 1, 3328]
    - [62, 9424.92]
  - - [1408, 704, 1, 256]
    - [57, 7495.91]
  - - [6784, 1024, 1, 3328]
    - [55, 9484.48]
  - - [6784, 2944, 1, 3328]
    - [54, 8908.1]
  - - [2944, 5056, 1, 3328]
    - [69, 8925.02]
  - - [1856, 1856, 1, 256]
    - [57, 8811.74]
  - - [1024, 5888, 1, 128]
    - [7, 3011.07]
  - - [6784, 2368, 1, 1280]
    - [69, 9407.77]
  - - [256, 4, 1, 128]
    - [70, 13.0109]
  - - [4288, 5888, 1, 1280]
    - [54, 9392.58]
  - - [4288, 4288, 1, 256]
    - [60, 9804.54]
  - - [448, 2944, 1, 3328]
    - [59, 8419.17]
  - - [4288, 1856, 1, 1280]
    - [54, 9982.49]
  - - [1856, 2944, 1, 3328]
    - [64, 9169.33]
  - - [256, 6784, 1, 3328]
    - [64, 8703.19]
  - - [64, 5888, 1, 256]
    - [64, 4601.65]
  - - [256, 5056, 1, 128]
    - [53, 1876.28]
  - - [5056, 1024, 1, 256]
    - [58, 9687.22]
  - - [704, 64, 1, 3328]
    - [39, 4131.04]
  - - [5056, 1856, 1, 3328]
    - [55, 8842.02]
  - - [4, 2944, 1, 3328]
    - [74, 645.186]
  - - [4, 5056, 1, 256]
    - [9, 465.966]
  - - [1856, 1408, 1, 256]
    - [64, 8906.35]
  - - [3584, 4, 1, 128]
    - [70, 170.841]
  - - [448, 448, 1, 3328]
    - [15, 6296.74]
  - - [6784, 128, 1, 3328]
    - [57, 7833.74]
  - - [4288, 1408, 1, 128]
    - [3, 3642.61]
  - - [4288, 5056, 1, 256]
    - [67, 9861.03]
  - - [1408, 128, 1, 1280]
    - [15, 4958.87]
  - - [5056, 256, 1, 3328]
    - [64, 9523.42]
  - - [704, 704, 1, 256]
    - [57, 6228.35]
  - - [1024, 5888, 1, 1280]
    - [55, 9634.99]
  - - [6784, 2368, 1, 128]
    - [3, 3750.65]
  - - [4, 5056, 1, 1280]
    - [9, 664.375]
  - - [64, 128, 1, 256]
    - [13, 496.661]
  - - [128, 1856, 1, 1280]
    - [57, 5749.37]
  - - [5056, 3584, 1, 256]
    - [69, 10118.5]
  - - [1856, 1024, 1, 1280]
    - [54, 9308.5]
  - - [6784, 4288, 1, 1280]
    - [54, 9243.72]
  - - [1856, 1856, 1, 1280]
    - [66, 9617.57]
  - - [6784, 2944, 1, 128]
    - [3, 3874.55]
  - - [128, 4288, 1, 3328]
    - [23, 7494.99]
  - - [4, 2368, 1, 3328]
    - [74, 634.192]
  - - [5888, 1856, 1, 128]
    - [7, 3683.81]
  - - [448, 704, 1, 1280]
    - [57, 5200.2]
  - - [2368, 1024, 1, 128]
    - [3, 2724.29]
  - - [1024, 448, 1, 3328]
    - [64, 7670.32]
  - - [1856, 704, 1, 1280]
    - [57, 8850.52]
  - - [5056, 3584, 1, 128]
    - [3, 3808.26]
  - - [5888, 5888, 1, 3328]
    - [55, 8870.71]
  - - [6784, 1024, 1, 256]
    - [58, 9519.19]
  - - [2944, 2368, 1, 256]
    - [58, 9511.4]
  - - [256, 448, 1, 256]
    - [22, 2345.25]
  - - [5056, 5888, 1, 3328]
    - [55, 9021.28]
  - - [1856, 1024, 1, 256]
    - [58, 7922.87]
  - - [448, 1408, 1, 1280]
    - [57, 7310.26]
  - - [3584, 448, 1, 1280]
    - [57, 8534.12]
  - - [1024, 1024, 1, 1280]
    - [66, 9127.85]
  - - [448, 5888, 1, 256]
    - [57, 7906.37]
  - - [704, 64, 1, 128]
    - [0, 648.798]
  - - [1408, 6784, 1, 3328]
    - [54, 8944.73]
  - - [448, 1024, 1, 128]
    - [7, 1708.4]
  - - [4288, 704, 1, 128]
    - [7, 2735.32]
  - - [128, 1856, 1, 128]
    - [2, 2293.35]
  - - [448, 2368, 1, 3328]
    - [57, 7932.91]
  - - [5056, 64, 1, 128]
    - [8, 2329.71]
  - - [5056, 2944, 1, 256]
    - [65, 10094.3]
  - - [6784, 5888, 1, 128]
    - [3, 3786.35]
  - - [704, 1024, 1, 256]
    - [64, 6679.19]
  - - [1024, 4, 1, 256]
    - [74, 217.773]
  - - [2368, 1856, 1, 256]
    - [57, 9352.6]
  - - [128, 6784, 1, 1280]
    - [64, 7754.33]
  - - [1408, 3584, 1, 3328]
    - [54, 9786.39]
  - - [2368, 6784, 1, 256]
    - [62, 9653.49]
  - - [5056, 1408, 1, 1280]
    - [54, 10146.8]
  - - [256, 256, 1, 128]
    - [1, 928.251]
  - - [5056, 4288, 1, 128]
    - [3, 3932.61]
  - - [1408, 1856, 1, 128]
    - [7, 2868.83]
  - - [1408, 5888, 1, 3328]
    - [54, 9870.01]
  - - [1856, 256, 1, 256]
    - [57, 5864.32]
  - - [6784, 6784, 1, 256]
    - [65, 9884.96]
  - - [64, 256, 1, 128]
    - [5, 246.188]
  - - [4288, 2368, 1, 128]
    - [3, 3510.51]
  - - [1856, 4288, 1, 128]
    - [7, 3713.72]
  - - [256, 4288, 1, 1280]
    - [64, 7479.54]
  - - [2368, 2944, 1, 256]
    - [57, 9284.14]
  - - [4, 1856, 1, 256]
    - [76, 366.511]
  - - [3584, 1856, 1, 1280]
    - [55, 9548.99]
  - - [6784, 6784, 1, 128]
    - [3, 3859.67]
  - - [256, 1856, 1, 128]
    - [52, 1531.73]
  - - [704, 64, 1, 1280]
    - [32, 3101.8]
  - - [5888, 5056, 1, 256]
    - [69, 10094.3]
  - - [3584, 448, 1, 256]
    - [57, 7428.18]
  - - [448, 4288, 1, 128]
    - [3, 2384.65]
  - - [2944, 4288, 1, 3328]
    - [55, 8826.91]
  - - [256, 6784, 1, 256]
    - [64, 8154.74]
  - - [1408, 4288, 1, 128]
    - [7, 3412.65]
  - - [2944, 704, 1, 3328]
    - [64, 9746.04]
  - - [128, 448, 1, 256]
    - [20, 1753.79]
  - - [3584, 3584, 1, 256]
    - [64, 9821.04]
  - - [448, 1408, 1, 128]
    - [52, 2275.5]
  - - [128, 256, 1, 1280]
    - [21, 3272.84]
  - - [3584, 5056, 1, 256]
    - [55, 9724.09]
  - - [6784, 128, 1, 256]
    - [57, 4553.75]
  - - [4288, 4, 1, 256]
    - [74, 411.635]
  - - [64, 1408, 1, 3328]
    - [30, 5131.11]
  - - [704, 448, 1, 256]
    - [57, 4036.82]
  - - [2944, 2368, 1, 1280]
    - [69, 9782.5]
  - - [448, 64, 1, 3328]
    - [48, 3659.46]
  - - [1408, 3584, 1, 256]
    - [64, 9222.26]
  - - [3584, 4, 1, 3328]
    - [81, 614.569]
  - - [6784, 3584, 1, 256]
    - [58, 10088.4]
  - - [256, 128, 1, 128]
    - [0, 488.107]
  - - [704, 1408, 1, 128]
    - [52, 1797.26]
  - - [4, 2368, 1, 256]
    - [76, 419.666]
  - - [2944, 448, 1, 128]
    - [3, 2106.3]
  - - [128, 1408, 1, 256]
    - [57, 3068.15]
  - - [4, 2944, 1, 256]
    - [73, 423.943]
  - - [64, 128, 1, 3328]
    - [36, 2177.73]
  - - [5056, 2368, 1, 128]
    - [3, 3901.92]
  - - [2944, 2944, 1, 3328]
    - [65, 9177.75]
  - - [5056, 6784, 1, 256]
    - [62, 9589.56]
  - - [1856, 3584, 1, 128]
    - [3, 3422.9]
  - - [128, 2944, 1, 128]
    - [2, 2794.66]
  - - [1024, 704, 1, 3328]
    - [64, 8505.09]
  - - [6784, 448, 1, 256]
    - [57, 8781.97]
  - - [3584, 6784, 1, 128]
    - [7, 4006.96]
  - - [128, 4288, 1, 256]
    - [64, 5298.33]
  - - [704, 448, 1, 3328]
    - [57, 5483.54]
  - - [1024, 1024, 1, 3328]
    - [66, 9643.58]
  - - [128, 128, 1, 3328]
    - [47, 3132.24]
  - - [5056, 1856, 1, 256]
    - [57, 9800.48]
  - - [256, 128, 1, 256]
    - [12, 1433.46]
  - - [1024, 1856, 1, 256]
    - [68, 6935.7]
  - - [4288, 64, 1, 128]
    - [5, 2155.45]
  - - [256, 448, 1, 3328]
    - [41, 5902.13]
  - - [1408, 6784, 1, 1280]
    - [65, 9666.24]
  - - [3584, 3584, 1, 1280]
    - [55, 9746.85]
  - - [64, 2368, 1, 1280]
    - [23, 4941.01]
  - - [448, 2368, 1, 1280]
    - [57, 7300.33]
  - - [5888, 5888, 1, 128]
    - [7, 3729.86]
  - - [64, 6784, 1, 3328]
    - [57, 7505.22]
  - - [2944, 256, 1, 1280]
    - [57, 8506.14]
  - - [5056, 5888, 1, 128]
    - [3, 3873.53]
  - - [256, 2368, 1, 128]
    - [52, 1673.31]
  - - [5056, 2368, 1, 3328]
    - [54, 9287.22]
  - - [2944, 4288, 1, 256]
    - [58, 9729.41]
  - - [1408, 3584, 1, 1280]
    - [54, 10529.7]
  - - [2368, 64, 1, 256]
    - [57, 2530.23]
  - - [64, 448, 1, 3328]
    - [48, 3568.25]
  - - [256, 256, 1, 3328]
    - [43, 5007.32]
  - - [5888, 4, 1, 128]
    - [70, 217.633]
  - - [1856, 704, 1, 256]
    - [56, 7563.76]
  - - [4, 4288, 1, 1280]
    - [9, 596.332]
  - - [1408, 448, 1, 3328]
    - [57, 7595.53]
  - - [1024, 4, 1, 3328]
    - [81, 496.006]
  - - [2368, 256, 1, 256]
    - [57, 5527.67]
  - - [2368, 6784, 1, 3328]
    - [55, 8953.93]
  - - [1856, 1408, 1, 1280]
    - [59, 10110.9]
  - - [1856, 448, 1, 1280]
    - [57, 7425.14]
  - - [6784, 704, 1, 128]
    - [3, 3337.06]
  - - [4, 4, 1, 256]
    - [77, 0.825224]
  - - [128, 5888, 1, 128]
    - [2, 3356.44]
  - - [1408, 5888, 1, 256]
    - [60, 9562.88]
  - - [704, 2944, 1, 1280]
    - [66, 9814.44]
  - - [1856, 2368, 1, 128]
    - [3, 3249.61]
  - - [256, 64, 1, 256]
    - [12, 820.562]
  - - [1024, 1024, 1, 256]
    - [64, 7247.57]
  - - [704, 1856, 1, 256]
    - [56, 7732.13]
  - - [64, 6784, 1, 256]
    - [57, 5121.13]
  - - [3584, 704, 1, 1280]
    - [57, 9563.13]
  - - [256, 128, 1, 1280]
    - [13, 3198.95]
  - - [2368, 4, 1, 256]
    - [74, 351.986]
  - - [256, 2368, 1, 1280]
    - [64, 7006.63]
  - - [2944, 6784, 1, 128]
    - [3, 3614.82]
  - - [3584, 448, 1, 3328]
    - [57, 8685.79]
  - - [1408, 4, 1, 256]
    - [74, 270.328]
  - - [704, 2368, 1, 3328]
    - [64, 8648.47]
  - - [2944, 448, 1, 256]
    - [56, 6937.58]
  - - [1856, 448, 1, 128]
    - [52, 2731.47]
  - - [2368, 128, 1, 1280]
    - [15, 5007.14]
  - - [256, 5888, 1, 128]
    - [53, 2143.68]
  - - [2368, 256, 1, 128]
    - [52, 2026.1]
  - - [64, 5056, 1, 1280]
    - [57, 5320.05]
  - - [4, 6784, 1, 128]
    - [70, 253.45]
  - - [2944, 2944, 1, 1280]
    - [58, 9561.59]
  - - [5888, 2368, 1, 256]
    - [60, 9949.35]
  - - [4, 3584, 1, 1280]
    - [74, 636.802]
  - - [1408, 128, 1, 128]
    - [4, 1853.65]
  - - [6784, 704, 1, 3328]
    - [54, 9045.03]
  - - [128, 64, 1, 1280]
    - [46, 1645.99]
  - - [2368, 256, 1, 1280]
    - [64, 6969.35]
  - - [4, 448, 1, 3328]
    - [80, 425.984]
  - - [5888, 4288, 1, 128]
    - [7, 3700.31]
  - - [4, 5888, 1, 256]
    - [72, 467.769]
  - - [1408, 2944, 1, 3328]
    - [55, 10123.3]
  - - [3584, 704, 1, 128]
    - [7, 2718.1]
  - - [64, 1024, 1, 256]
    - [40, 1871.73]
  - - [5056, 5056, 1, 128]
    - [7, 3780.85]
  - - [2368, 448, 1, 1280]
    - [57, 7228.36]
  - - [128, 3584, 1, 256]
    - [57, 5682.38]
  - - [704, 448, 1, 1280]
    - [57, 5205.16]
  - - [448, 5056, 1, 128]
    - [3, 2727.48]
  - - [256, 4, 1, 1280]
    - [79, 249.21]
  - - [128, 5056, 1, 256]
    - [57, 6195.31]
  - - [1408, 5056, 1, 128]
    - [7, 3416.93]
  - - [2944, 3584, 1, 128]
    - [3, 3678.78]
  - - [3584, 2368, 1, 256]
    - [64, 9382.54]
  - - [5888, 5056, 1, 1280]
    - [55, 9547.75]
  - - [2368, 5056, 1, 128]
    - [3, 3657.71]
  - - [64, 704, 1, 256]
    - [18, 1557.01]
  - - [4288, 256, 1, 1280]
    - [57, 7488.41]
  - - [3584, 3584, 1, 3328]
    - [54, 9093.38]
  - - [1024, 256, 1, 128]
    - [52, 951.615]
  - - [4, 704, 1, 128]
    - [70, 32.8771]
  - - [5888, 6784, 1, 256]
    - [62, 10133.8]
  - - [4288, 2944, 1, 3328]
    - [54, 8873.73]
  - - [2944, 64, 1, 128]
    - [4, 1903.94]
  - - [1856, 64, 1, 256]
    - [19, 2443.45]
  - - [4288, 128, 1, 3328]
    - [45, 6948.03]
  - - [4288, 704, 1, 1280]
    - [57, 9616.95]
  - - [256, 5056, 1, 1280]
    - [64, 9393.29]
  - - [1408, 256, 1, 128]
    - [3, 1297.58]
  - - [2944, 5888, 1, 3328]
    - [54, 9051.66]
  - - [6784, 5888, 1, 1280]
    - [54, 9233.25]
  - - [704, 128, 1, 256]
    - [18, 2208.69]
  - - [5888, 4288, 1, 1280]
    - [55, 9501.0]
  - - [448, 256, 1, 1280]
    - [15, 4707.19]
  - - [5888, 3584, 1, 128]
    - [7, 3870.1]
  - - [1856, 1856, 1, 128]
    - [3, 3154.38]
  - - [5056, 4, 1, 1280]
    - [79, 546.889]
  - - [256, 1408, 1, 1280]
    - [57, 5898.03]
  - - [3584, 1024, 1, 3328]
    - [66, 9592.8]
  - - [704, 3584, 1, 128]
    - [7, 2872.08]
  - - [5888, 448, 1, 3328]
    - [57, 8887.68]
  - - [2368, 4288, 1, 1280]
    - [58, 9606.08]
  - - [4288, 2944, 1, 128]
    - [3, 3794.29]
  - - [1024, 6784, 1, 3328]
    - [69, 9241.55]
  - - [128, 2368, 1, 256]
    - [57, 3908.56]
  - - [6784, 64, 1, 3328]
    - [45, 6569.9]
  - - [5056, 2944, 1, 3328]
    - [54, 9144.59]
  - - [448, 128, 1, 256]
    - [13, 1834.89]
  - - [2944, 3584, 1, 256]
    - [58, 9804.81]
  - - [1408, 1408, 1, 3328]
    - [55, 9702.1]
  - - [1856, 128, 1, 1280]
    - [23, 5317.42]
  - - [3584, 3584, 1, 128]
    - [7, 3518.63]
  - - [64, 3584, 1, 256]
    - [57, 3829.42]
  - - [1408, 4, 1, 3328]
    - [81, 539.507]
  - - [128, 2944, 1, 3328]
    - [45, 6927.09]
  - - [3584, 704, 1, 256]
    - [57, 8599.29]
  - - [2944, 448, 1, 3328]
    - [59, 8345.66]
  - - [3584, 1408, 1, 3328]
    - [54, 9932.6]
  - - [704, 3584, 1, 1280]
    - [59, 9718.75]
  - - [2944, 6784, 1, 1280]
    - [54, 9563.98]
  - - [1856, 6784, 1, 256]
    - [60, 9486.25]
  - - [4288, 448, 1, 3328]
    - [64, 8786.01]
  - - [6784, 4288, 1, 128]
    - [3, 3655.94]
  - - [6784, 704, 1, 1280]
    - [55, 9639.7]
  - - [256, 4288, 1, 256]
    - [64, 6726.31]
  - - [3584, 64, 1, 128]
    - [5, 2119.56]
  - - [5888, 1024, 1, 3328]
    - [55, 9823.25]
  - - [448, 64, 1, 128]
    - [1, 419.862]
  - - [704, 6784, 1, 1280]
    - [54, 9897.52]
  - - [5888, 128, 1, 256]
    - [64, 4498.39]
  - - [2368, 448, 1, 3328]
    - [57, 7577.26]
  - - [1856, 5056, 1, 3328]
    - [54, 8776.68]
  - - [4, 6784, 1, 256]
    - [72, 488.438]
  - - [1024, 3584, 1, 128]
    - [7, 2561.22]
  - - [1024, 1408, 1, 128]
    - [53, 1960.13]
  - - [2368, 2944, 1, 128]
    - [3, 3484.57]
  - - [5056, 64, 1, 256]
    - [25, 2774.85]
  - - [4, 448, 1, 1280]
    - [78, 340.27]
  - - [5056, 2944, 1, 128]
    - [3, 3761.91]
  - - [5888, 5056, 1, 3328]
    - [55, 8934.98]
  - - [1024, 704, 1, 128]
    - [52, 1943.32]
  - - [1408, 2368, 1, 128]
    - [3, 2927.45]
  - - [5888, 2368, 1, 128]
    - [7, 3607.18]
  - - [128, 5056, 1, 3328]
    - [57, 7780.3]
  - - [3584, 6784, 1, 1280]
    - [55, 9315.93]
  - - [1856, 5888, 1, 256]
    - [62, 9453.41]
  - - [256, 256, 1, 256]
    - [17, 1919.37]
  - - [256, 64, 1, 128]
    - [5, 209.705]
  - - [4288, 4288, 1, 3328]
    - [62, 8668.56]
  - - [4288, 1408, 1, 1280]
    - [54, 9878.29]
  - - [3584, 5056, 1, 128]
    - [7, 3877.59]
  - - [4, 1024, 1, 3328]
    - [11, 533.386]
  - - [4288, 2368, 1, 256]
    - [58, 10023.1]
  - - [2944, 5056, 1, 1280]
    - [55, 9559.28]
  - - [448, 6784, 1, 256]
    - [58, 8073.21]
  - - [704, 1024, 1, 128]
    - [52, 2442.49]
  - - [6784, 2368, 1, 3328]
    - [54, 9217.87]
  - - [256, 1024, 1, 1280]
    - [64, 6291.26]
  - - [704, 4, 1, 128]
    - [70, 35.2603]
  - - [256, 4, 1, 256]
    - [77, 78.6393]
  - - [4288, 128, 1, 256]
    - [57, 3719.24]
  - - [4288, 1856, 1, 3328]
    - [55, 9301.48]
  - - [3584, 448, 1, 128]
    - [7, 2253.82]
  - - [256, 4, 1, 3328]
    - [81, 353.881]
  - - [4, 1408, 1, 1280]
    - [11, 477.035]
  - - [3584, 64, 1, 1280]
    - [16, 4394.11]
  - - [1408, 448, 1, 128]
    - [7, 1985.35]
  - - [3584, 1024, 1, 1280]
    - [65, 10125.5]
  - - [1856, 5056, 1, 256]
    - [58, 9168.74]
  - - [4, 3584, 1, 256]
    - [10, 450.419]
  - - [1024, 4288, 1, 256]
    - [68, 7842.12]
  - - [5888, 3584, 1, 3328]
    - [69, 8968.81]
  - - [4, 256, 1, 256]
    - [77, 80.4246]
  - - [5056, 3584, 1, 3328]
    - [54, 9078.54]
  - - [128, 5888, 1, 1280]
    - [64, 8613.0]
  - - [704, 448, 1, 128]
    - [52, 1169.49]
  - - [2368, 1408, 1, 1280]
    - [57, 9824.72]
  - - [5056, 2944, 1, 1280]
    - [54, 9585.65]
  - - [4, 4, 1, 128]
    - [71, 0.0510094]
  - - [3584, 256, 1, 256]
    - [64, 6444.72]
  - - [128, 1856, 1, 3328]
    - [23, 6980.45]
  - - [1024, 6784, 1, 256]
    - [67, 8564.92]
  - - [4, 128, 1, 256]
    - [77, 40.2123]
  - - [64, 64, 1, 1280]
    - [36, 795.279]
  - - [6784, 4, 1, 128]
    - [70, 222.227]
  - - [2944, 1408, 1, 128]
    - [3, 3391.38]
  - - [448, 128, 1, 3328]
    - [30, 4684.13]
  - - [64, 2944, 1, 3328]
    - [23, 6359.81]
  - - [64, 4288, 1, 3328]
    - [34, 5887.9]
  - - [5056, 6784, 1, 3328]
    - [69, 8846.78]
  - - [128, 2944, 1, 256]
    - [57, 4859.29]
  - - [128, 6784, 1, 128]
    - [6, 3410.16]
  - - [3584, 4288, 1, 256]
    - [69, 9986.97]
  - - [448, 1856, 1, 256]
    - [57, 6371.46]
  - - [1856, 6784, 1, 3328]
    - [55, 8689.05]
  - - [3584, 128, 1, 3328]
    - [57, 7413.72]
  - - [64, 1856, 1, 256]
    - [14, 2429.0]
  - - [1024, 448, 1, 1280]
    - [57, 7259.14]
  - - [5888, 4288, 1, 256]
    - [65, 9890.43]
  - - [4, 448, 1, 128]
    - [70, 20.7825]
  - - [5056, 1408, 1, 256]
    - [59, 9520.86]
  - - [64, 256, 1, 1280]
    - [29, 2264.87]
  - - [3584, 1024, 1, 256]
    - [58, 9230.84]
  - - [256, 704, 1, 256]
    - [57, 3038.15]
  - - [5888, 5888, 1, 256]
    - [65, 9933.72]
  - - [4288, 1024, 1, 1280]
    - [64, 9953.1]
  - - [5888, 128, 1, 3328]
    - [64, 8456.42]
  - - [448, 6784, 1, 3328]
    - [59, 9559.77]
  - - [2944, 1408, 1, 1280]
    - [54, 10534.8]
  - - [2944, 1856, 1, 3328]
    - [57, 9243.57]
  - - [2368, 64, 1, 128]
    - [5, 1711.62]
  - - [2944, 2944, 1, 128]
    - [3, 3524.67]
  - - [4, 128, 1, 3328]
    - [81, 244.713]
  - - [3584, 5888, 1, 1280]
    - [55, 9375.73]
  - - [64, 4, 1, 128]
    - [70, 2.66482]
  - - [6784, 1856, 1, 1280]
    - [60, 9272.78]
  - - [2944, 5056, 1, 256]
    - [64, 9833.77]
  - - [5888, 256, 1, 3328]
    - [57, 9430.31]
  - - [1856, 5888, 1, 3328]
    - [55, 9146.62]
  - - [3584, 1408, 1, 256]
    - [64, 9183.42]
  - - [704, 3584, 1, 3328]
    - [66, 9429.82]
  - - [5056, 448, 1, 1280]
    - [57, 9483.74]
  - - [3584, 1856, 1, 3328]
    - [55, 9094.27]
  - - [64, 1408, 1, 128]
    - [5, 1188.62]
  - - [1408, 704, 1, 1280]
    - [64, 8828.82]
  - - [2944, 1024, 1, 256]
    - [63, 8553.59]
  - - [1024, 2368, 1, 128]
    - [7, 2444.56]
  - - [2368, 4288, 1, 3328]
    - [58, 8728.44]
  - - [4, 1408, 1, 256]
    - [76, 294.905]
  - - [1024, 1408, 1, 1280]
    - [66, 8653.46]
  - - [64, 64, 1, 256]
    - [38, 202.233]
  - - [704, 256, 1, 3328]
    - [57, 4860.05]
  - - [6784, 5056, 1, 256]
    - [65, 9877.23]
  - - [4, 4288, 1, 3328]
    - [75, 673.584]
  - - [448, 6784, 1, 128]
    - [7, 2764.01]
  - - [4, 704, 1, 3328]
    - [80, 527.134]
  - - [448, 2944, 1, 256]
    - [57, 7144.19]
  - - [2944, 6784, 1, 256]
    - [64, 9454.98]
  - - [2368, 2368, 1, 1280]
    - [58, 10075.2]
  - - [4, 4, 1, 1280]
    - [79, 3.45596]
  - - [1856, 3584, 1, 1280]
    - [59, 9812.29]
  - - [64, 2944, 1, 256]
    - [57, 3207.61]
  - - [3584, 1408, 1, 1280]
    - [61, 9685.3]
  - - [448, 256, 1, 128]
    - [5, 1468.01]
  - - [4288, 448, 1, 128]
    - [7, 2273.58]
  - - [5056, 256, 1, 1280]
    - [57, 9125.01]
  - - [1856, 1408, 1, 3328]
    - [59, 9921.76]
  - - [128, 128, 1, 128]
    - [5, 248.331]
  - - [1024, 4288, 1, 3328]
    - [64, 8979.4]
  - - [448, 2368, 1, 256]
    - [57, 6629.75]
  - - [1024, 4, 1, 128]
    - [70, 51.6616]
  - - [5056, 448, 1, 256]
    - [56, 7599.87]
  - - [2944, 2368, 1, 3328]
    - [54, 9215.85]
  - - [704, 128, 1, 3328]
    - [23, 5163.8]
  - - [64, 64, 1, 3328]
    - [51, 1688.32]
  - - [1024, 1856, 1, 1280]
    - [55, 9175.83]
  - - [6784, 1856, 1, 256]
    - [65, 9878.19]
  - - [128, 2368, 1, 3328]
    - [45, 6426.34]
  - - [1024, 5888, 1, 256]
    - [67, 8539.61]
  - - [5056, 128, 1, 1280]
    - [64, 6941.45]
  - - [5056, 64, 1, 3328]
    - [42, 6452.52]
  - - [128, 704, 1, 128]
    - [5, 1188.62]
  - - [1408, 2368, 1, 256]
    - [64, 9058.49]
  - - [1408, 1408, 1, 256]
    - [54, 8107.91]
  - - [4, 64, 1, 128]
    - [70, 2.40411]
  - - [64, 128, 1, 1280]
    - [46, 1645.99]
  - - [2368, 2368, 1, 128]
    - [7, 3304.67]
  - - [64, 5888, 1, 128]
    - [2, 2855.89]
  - - [5888, 4, 1, 3328]
    - [81, 649.145]
  - - [6784, 1408, 1, 128]
    - [3, 3540.35]
  - - [4288, 5888, 1, 256]
    - [67, 9844.67]
  - - [1408, 5056, 1, 256]
    - [65, 9231.51]
  - - [5056, 128, 1, 3328]
    - [57, 7551.95]
  - - [128, 128, 1, 1280]
    - [47, 2339.79]
  - - [448, 704, 1, 256]
    - [57, 4128.67]
  - - [4288, 3584, 1, 128]
    - [3, 3965.26]
  - - [2944, 128, 1, 3328]
    - [23, 7045.25]
  - - [128, 5056, 1, 1280]
    - [64, 7500.14]
  - - [3584, 5056, 1, 1280]
    - [55, 9474.57]
  - - [256, 448, 1, 1280]
    - [23, 4608.69]
  - - [704, 704, 1, 128]
    - [3, 1744.19]
  - - [5056, 4, 1, 128]
    - [70, 206.779]
  - - [704, 256, 1, 1280]
    - [57, 4506.74]
  - - [64, 2368, 1, 3328]
    - [23, 6223.69]
  - - [1856, 1024, 1, 128]
    - [3, 2919.14]
  - - [1856, 64, 1, 128]
    - [5, 1498.19]
  - - [64, 6784, 1, 1280]
    - [64, 7091.03]
  - - [704, 4288, 1, 256]
    - [57, 8169.53]
  - - [5888, 2368, 1, 1280]
    - [55, 9546.43]
  - - [128, 256, 1, 256]
    - [12, 1415.44]
  - - [256, 64, 1, 1280]
    - [33, 2229.12]
  - - [2368, 5888, 1, 1280]
    - [58, 9521.54]
  - - [5888, 256, 1, 1280]
    - [57, 8823.09]
  - - [4, 5888, 1, 1280]
    - [9, 645.979]
  - - [704, 128, 1, 128]
    - [5, 1188.62]
  - - [1024, 4, 1, 1280]
    - [77, 402.138]
  - - [2368, 1856, 1, 3328]
    - [64, 9140.47]
  - - [2368, 128, 1, 128]
    - [4, 2436.02]
  - - [2944, 704, 1, 256]
    - [57, 8526.86]
  - - [5056, 128, 1, 128]
    - [2, 3298.72]
  - - [256, 704, 1, 3328]
    - [57, 4877.61]
  - - [704, 3584, 1, 256]
    - [64, 8506.99]
  - - [1024, 1024, 1, 1024]
    - [66, 7147.44]
  - - [704, 2944, 1, 3328]
    - [64, 9652.09]
  - - [6784, 1024, 1, 128]
    - [3, 3316.86]
  - - [256, 448, 1, 128]
    - [5, 1457.15]
  - - [448, 1024, 1, 3328]
    - [64, 7914.81]
  - - [2944, 1024, 1, 3328]
    - [62, 9816.48]
  - - [2944, 5056, 1, 128]
    - [3, 3688.54]
  - - [1408, 6784, 1, 256]
    - [60, 9463.94]
  - - [6784, 1408, 1, 3328]
    - [58, 8972.6]
  - - [4288, 6784, 1, 128]
    - [7, 3847.93]
  - - [704, 64, 1, 256]
    - [12, 1588.86]
  - - [5888, 4, 1, 1280]
    - [79, 551.443]
  - - [256, 2368, 1, 3328]
    - [57, 7311.37]
  - - [6784, 2944, 1, 1280]
    - [54, 9426.05]
  - - [4288, 1856, 1, 128]
    - [3, 3827.42]
  - - [1856, 2944, 1, 128]
    - [3, 3365.99]
  - - [6784, 448, 1, 128]
    - [7, 2716.83]
  - - [64, 3584, 1, 128]
    - [4, 2177.73]
  - - [448, 5056, 1, 1280]
    - [56, 8823.13]
  - - [2368, 1856, 1, 128]
    - [3, 3248.22]
  - - [128, 448, 1, 1280]
    - [39, 3629.64]
  - - [4288, 704, 1, 256]
    - [57, 8759.38]
  - - [256, 3584, 1, 128]
    - [53, 2083.31]
  - - [5888, 704, 1, 256]
    - [57, 9308.13]
  - - [3584, 1024, 1, 128]
    - [7, 2996.96]
  - - [256, 5888, 1, 3328]
    - [64, 9472.51]
  - - [1408, 4288, 1, 3328]
    - [62, 9488.04]
  - - [6784, 4288, 1, 256]
    - [60, 9962.44]
  - - [4288, 256, 1, 128]
    - [52, 1769.41]
  - - [5888, 256, 1, 256]
    - [63, 7087.32]
  - - [6784, 1024, 1, 1280]
    - [55, 10003.9]
  - - [5888, 1024, 1, 128]
    - [7, 3225.48]
  - - [1024, 128, 1, 256]
    - [64, 2198.92]
  - - [128, 64, 1, 3328]
    - [36, 2190.68]
  - - [448, 64, 1, 256]
    - [12, 1303.74]
  - - [2944, 704, 1, 1280]
    - [61, 9606.48]
  - - [6784, 3584, 1, 1280]
    - [55, 9415.94]
  - - [1024, 6784, 1, 1280]
    - [69, 9733.79]
  - - [2944, 64, 1, 1280]
    - [43, 4329.42]
  - - [1408, 2944, 1, 1280]
    - [55, 10567.4]
  - - [256, 1856, 1, 256]
    - [64, 5761.41]
  - - [1408, 2368, 1, 3328]
    - [57, 9431.53]
  - - [2944, 4, 1, 3328]
    - [81, 601.202]
  - - [128, 1408, 1, 3328]
    - [24, 6124.7]
  - - [2944, 1856, 1, 128]
    - [3, 3290.91]
  - - [256, 2944, 1, 128]
    - [52, 2034.82]
  - - [256, 6784, 1, 128]
    - [7, 2184.08]
  - - [2368, 4, 1, 128]
    - [70, 113.66]
  - - [1408, 256, 1, 3328]
    - [57, 6242.76]
  - - [1856, 4, 1, 128]
    - [70, 94.3245]
  - - [5056, 6784, 1, 128]
    - [7, 3807.79]
  - - [4288, 5056, 1, 128]
    - [3, 3789.02]
  - - [1856, 5888, 1, 128]
    - [3, 3727.44]
  - - [2944, 5888, 1, 256]
    - [62, 10119.1]
  - - [3584, 1856, 1, 256]
    - [64, 9448.49]
  - - [4288, 3584, 1, 1280]
    - [55, 9950.68]
  - - [2368, 448, 1, 256]
    - [57, 6466.06]
  - - [4288, 256, 1, 3328]
    - [57, 8184.05]
  - - [1856, 704, 1, 128]
    - [3, 2187.76]
  - - [1408, 64, 1, 256]
    - [19, 2177.73]
  - - [64, 1856, 1, 128]
    - [5, 1487.34]
  - - [4, 256, 1, 128]
    - [70, 11.718]
  - - [704, 4288, 1, 3328]
    - [66, 9432.61]
  - - [704, 5888, 1, 128]
    - [7, 2899.84]
  - - [6784, 3584, 1, 128]
    - [3, 3826.67]
  - - [1024, 64, 1, 256]
    - [19, 1629.41]
  - - [64, 2368, 1, 256]
    - [18, 2605.77]
  - - [4288, 5056, 1, 3328]
    - [69, 8815.31]
  - - [4, 1856, 1, 1280]
    - [10, 503.069]
  - - [4288, 128, 1, 128]
    - [4, 2865.31]
  - - [1408, 1408, 1, 128]
    - [3, 2749.28]
  - - [1024, 128, 1, 3328]
    - [44, 6318.23]
  - - [1856, 128, 1, 128]
    - [2, 2306.22]
  - - [5056, 2368, 1, 256]
    - [58, 9886.74]
  - - [4288, 704, 1, 3328]
    - [64, 9293.0]
  - - [448, 3584, 1, 256]
    - [64, 7488.33]
  - - [64, 128, 1, 128]
    - [5, 124.165]
  - - [2368, 64, 1, 1280]
    - [15, 4314.26]
  - - [2368, 1024, 1, 1280]
    - [59, 9396.67]
  - - [2944, 1408, 1, 3328]
    - [54, 10138.1]
  - - [1408, 448, 1, 256]
    - [57, 6021.8]
  - - [1024, 1408, 1, 3328]
    - [68, 8961.64]
  - - [2944, 5888, 1, 1280]
    - [62, 9676.19]
  - - [1408, 4, 1, 1280]
    - [79, 440.349]
  - - [5888, 3584, 1, 256]
    - [65, 10381.2]
  - - [128, 1024, 1, 1280]
    - [23, 5124.14]
  - - [1408, 1856, 1, 3328]
    - [57, 9702.83]
  - - [4, 4, 1, 3328]
    - [81, 8.35787]
  - - [6784, 1408, 1, 1280]
    - [65, 9703.74]
  - - [4, 1024, 1, 1280]
    - [77, 439.599]
  - - [704, 2944, 1, 256]
    - [64, 8557.46]
  - - [704, 4288, 1, 128]
    - [3, 2825.7]
  - - [2368, 4288, 1, 128]
    - [3, 3596.87]
  - - [64, 4288, 1, 1280]
    - [23, 5328.09]
  - - [6784, 64, 1, 1280]
    - [42, 5142.1]
  - - [3584, 128, 1, 128]
    - [2, 2914.3]
  - - [1024, 6784, 1, 128]
    - [7, 2958.03]
  - - [4, 1856, 1, 128]
    - [70, 88.4715]
  - - [1408, 64, 1, 3328]
    - [30, 4967.41]
  - - [6784, 4, 1, 256]
    - [77, 322.268]
  - - [1408, 1408, 1, 1280]
    - [69, 9515.51]
  - - [256, 2368, 1, 256]
    - [57, 5868.27]
  - - [448, 4288, 1, 3328]
    - [59, 8838.2]
  - - [2368, 1408, 1, 256]
    - [64, 9079.93]
  - - [5888, 5056, 1, 128]
    - [7, 3811.53]
  - - [704, 2368, 1, 256]
    - [57, 7817.1]
  - - [2944, 448, 1, 1280]
    - [57, 8136.41]
  - - [5888, 2368, 1, 3328]
    - [54, 9154.56]
  - - [64, 2944, 1, 1280]
    - [15, 5071.18]
  - - [448, 1856, 1, 1280]
    - [57, 7463.72]
  - - [4288, 448, 1, 1280]
    - [61, 8788.51]
  - - [5888, 704, 1, 3328]
    - [61, 9331.43]
  - - [5056, 256, 1, 128]
    - [7, 2029.52]
  - - [1856, 256, 1, 128]
    - [3, 1765.61]
  - - [5056, 128, 1, 256]
    - [57, 4411.3]
  - - [704, 4, 1, 256]
    - [77, 164.946]
  - - [1408, 5888, 1, 128]
    - [3, 3418.08]
  - - [4288, 4, 1, 128]
    - [70, 182.947]
  - - [1408, 1024, 1, 256]
    - [64, 7773.28]
  - - [1024, 1856, 1, 128]
    - [7, 2391.87]
  - - [256, 704, 1, 128]
    - [3, 661.183]
  - - [256, 1024, 1, 128]
    - [7, 939.768]
  - - [448, 1024, 1, 256]
    - [64, 5807.27]
  - - [128, 4, 1, 3328]
    - [81, 237.135]
  - - [5056, 6784, 1, 1280]
    - [55, 9249.69]
  - - [704, 5056, 1, 3328]
    - [59, 9342.87]
  - - [64, 1408, 1, 1280]
    - [15, 3982.3]
  - - [3584, 5056, 1, 3328]
    - [55, 9171.2]
  - - [1856, 4, 1, 3328]
    - [81, 548.577]
  - - [4, 2944, 1, 128]
    - [70, 141.308]
  - - [2368, 2944, 1, 3328]
    - [55, 9482.88]
  - - [448, 448, 1, 1280]
    - [57, 4968.55]
  - - [2368, 3584, 1, 256]
    - [57, 9299.23]
  - - [1024, 256, 1, 1280]
    - [57, 6137.86]
  - - [5056, 3584, 1, 1280]
    - [55, 9565.16]
  - - [448, 4, 1, 3328]
    - [81, 419.305]
  - - [1856, 2944, 1, 1280]
    - [57, 9811.49]
  - - [3584, 2368, 1, 1280]
    - [62, 9413.86]
  - - [128, 1024, 1, 256]
    - [14, 2475.25]
  - - [2944, 1408, 1, 256]
    - [58, 9449.32]
  - - [4288, 1408, 1, 3328]
    - [54, 9784.44]
  - - [3584, 64, 1, 3328]
    - [16, 6108.52]
  - - [1408, 128, 1, 256]
    - [57, 3098.65]
  - - [2944, 1024, 1, 128]
    - [7, 3138.04]
  - - [4288, 5056, 1, 1280]
    - [55, 9300.41]
  - - [5888, 6784, 1, 1280]
    - [69, 9105.95]
  - - [6784, 5056, 1, 128]
    - [3, 3751.16]
  - - [256, 1024, 1, 3328]
    - [64, 6952.32]
  - - [3584, 4, 1, 256]
    - [74, 434.604]
  - - [1856, 64, 1, 3328]
    - [15, 5725.9]
  - - [64, 6784, 1, 128]
    - [8, 2641.69]
  - - [5888, 1408, 1, 3328]
    - [62, 9562.13]
  - - [5888, 64, 1, 1280]
    - [42, 4947.89]
  - - [256, 5056, 1, 256]
    - [63, 7594.37]
  - - [128, 3584, 1, 128]
    - [2, 2935.94]
  - - [448, 3584, 1, 3328]
    - [57, 8304.8]
  - - [704, 2368, 1, 128]
    - [7, 2772.48]
  - - [5888, 256, 1, 128]
    - [3, 2274.74]
  - - [4, 5056, 1, 128]
    - [70, 211.796]
  - - [448, 256, 1, 256]
    - [26, 2387.68]
  - - [704, 4, 1, 3328]
    - [79, 498.081]
  - - [1408, 256, 1, 256]
    - [64, 4648.01]
  - - [3584, 1856, 1, 128]
    - [7, 3261.67]
  - - [4288, 4288, 1, 128]
    - [3, 3647.72]
  - - [1856, 1024, 1, 3328]
    - [59, 9184.13]
  - - [128, 5888, 1, 3328]
    - [64, 9012.38]
  - - [1024, 5056, 1, 256]
    - [67, 8333.62]
  - - [2368, 1408, 1, 3328]
    - [57, 9337.46]
  - - [5888, 448, 1, 256]
    - [57, 8242.34]
  - - [5888, 6784, 1, 128]
    - [7, 3770.01]
  - - [2368, 4, 1, 3328]
    - [81, 584.541]
  - - [6784, 5056, 1, 1280]
    - [55, 9136.47]
  - - [5056, 704, 1, 1280]
    - [57, 9761.12]
  - - [1408, 256, 1, 1280]
    - [57, 5848.2]
  - - [4288, 6784, 1, 1280]
    - [55, 9245.59]
  - - [128, 704, 1, 256]
    - [17, 2133.03]
  - - [1024, 1024, 1, 128]
    - [7, 2645.08]
  - - [448, 128, 1, 1280]
    - [39, 3603.18]
  - - [6784, 4, 1, 3328]
    - [81, 650.894]
  - - [4288, 4, 1, 1280]
    - [79, 534.012]
  - - [1024, 64, 1, 3328]
    - [45, 4291.99]
  - - [1856, 4, 1, 256]
    - [74, 320.713]
  - - [64, 3584, 1, 1280]
    - [57, 5497.17]
  - - [6784, 1408, 1, 256]
    - [65, 9743.27]
  - - [3584, 5888, 1, 128]
    - [7, 3851.71]
  - - [5056, 5888, 1, 256]
    - [69, 10118.1]
  - - [2368, 1024, 1, 256]
    - [64, 8405.19]
  - - [2944, 1856, 1, 256]
    - [64, 9522.52]
  - - [1856, 6784, 1, 1280]
    - [62, 9289.01]
  - - [64, 5056, 1, 128]
    - [4, 2600.62]
  - - [5888, 64, 1, 128]
    - [6, 2420.62]
  - - [448, 704, 1, 128]
    - [52, 1211.06]
  - - [4, 1024, 1, 128]
    - [70, 49.4938]
  - - [4288, 3584, 1, 256]
    - [58, 10201.8]
  - - [1408, 704, 1, 128]
    - [3, 1667.76]
  - - [64, 256, 1, 3328]
    - [47, 3041.64]
  - - [5056, 1856, 1, 1280]
    - [57, 9372.24]
  - - [1408, 1024, 1, 3328]
    - [66, 9198.34]
  - - [2368, 256, 1, 3328]
    - [57, 7287.88]
  - - [5888, 3584, 1, 1280]
    - [55, 9583.7]
  - - [1856, 3584, 1, 3328]
    - [65, 9067.51]
  - - [5888, 128, 1, 1280]
    - [57, 7378.41]
  - - [1024, 2944, 1, 256]
    - [55, 7833.3]
  - - [448, 6784, 1, 1280]
    - [66, 9536.27]
  - - [256, 3584, 1, 1280]
    - [64, 8193.26]
  - - [448, 128, 1, 128]
    - [1, 818.926]
  - - [704, 5056, 1, 256]
    - [57, 8524.57]
  - - [2944, 1856, 1, 1280]
    - [56, 9608.79]
  - - [128, 256, 1, 128]
    - [0, 479.843]
  - - [5056, 256, 1, 256]
    - [56, 7077.63]
  - - [2368, 3584, 1, 3328]
    - [59, 8863.03]
  - - [3584, 5888, 1, 3328]
    - [55, 9032.39]
  - - [128, 4, 1, 256]
    - [77, 41.1464]
  - - [2944, 3584, 1, 1280]
    - [59, 9459.4]
  - - [1856, 5888, 1, 1280]
    - [54, 9876.14]
  - - [256, 256, 1, 1280]
    - [19, 4001.53]
  - - [5056, 448, 1, 3328]
    - [57, 9311.24]
  - - [4288, 1408, 1, 256]
    - [65, 9394.38]
  - - [3584, 64, 1, 256]
    - [27, 2633.55]
  - - [64, 1856, 1, 3328]
    - [15, 6241.57]
  - - [256, 1408, 1, 128]
    - [52, 1248.15]
  - - [5888, 1408, 1, 128]
    - [7, 3456.01]
  - - [4288, 2368, 1, 1280]
    - [65, 9767.58]
  - - [4, 4288, 1, 256]
    - [73, 439.091]
  - - [256, 4288, 1, 128]
    - [53, 1677.11]
  - - [256, 128, 1, 3328]
    - [49, 4011.33]
  - - [6784, 2368, 1, 256]
    - [60, 10064.7]
  - - [5888, 128, 1, 128]
    - [2, 3427.08]
  - - [4288, 1856, 1, 256]
    - [58, 9650.45]
  - - [1856, 256, 1, 3328]
    - [57, 8009.83]
  - - [1856, 2944, 1, 256]
    - [64, 9460.5]
  - - [5056, 1024, 1, 128]
    - [3, 3369.54]
  - - [64, 5888, 1, 1280]
    - [57, 6183.71]
  - - [6784, 256, 1, 128]
    - [3, 2526.04]
  - - [5888, 704, 1, 128]
    - [3, 2793.52]
  - - [6784, 64, 1, 128]
    - [8, 2543.17]
  - - [1024, 4288, 1, 1280]
    - [64, 9002.43]
  - - [2368, 5056, 1, 3328]
    - [69, 9053.06]
  - - [448, 4, 1, 128]
    - [70, 22.2771]
  - - [4, 256, 1, 3328]
    - [81, 348.524]
  - - [4288, 1024, 1, 3328]
    - [64, 9010.16]
  - - [1024, 5056, 1, 3328]
    - [55, 10033.7]
  - - [1024, 1856, 1, 3328]
    - [55, 9461.98]
  - - [704, 704, 1, 1280]
    - [57, 8079.22]
  - - [128, 2368, 1, 1280]
    - [23, 5382.83]
  - - [1408, 128, 1, 3328]
    - [30, 6129.33]
  - - [3584, 256, 1, 1280]
    - [57, 8113.59]
  - - [4, 128, 1, 128]
    - [70, 6.05973]
  - - [704, 6784, 1, 128]
    - [7, 3074.72]
  - - [3584, 128, 1, 1280]
    - [57, 6382.43]
  - - [4, 256, 1, 1280]
    - [79, 252.766]
  - - [128, 704, 1, 3328]
    - [30, 5326.88]
  - - [4288, 6784, 1, 256]
    - [62, 9981.24]
  - - [3584, 2944, 1, 3328]
    - [62, 8795.33]
  - - [128, 1856, 1, 256]
    - [57, 3928.27]
  - - [64, 4288, 1, 256]
    - [57, 3525.69]
  - - [4, 3584, 1, 3328]
    - [74, 675.835]
  - - [64, 4, 1, 3328]
    - [81, 127.789]
  - - [4, 64, 1, 3328]
    - [81, 126.386]
  - - [5888, 2944, 1, 256]
    - [65, 9956.0]
  - - [2368, 6784, 1, 128]
    - [3, 3821.92]
  - - [448, 4288, 1, 1280]
    - [59, 9094.29]
  - - [448, 1856, 1, 3328]
    - [57, 7703.83]
  - - [4, 1024, 1, 256]
    - [77, 221.195]
  - - [5056, 4288, 1, 256]
    - [58, 10107.1]
  - - [1024, 448, 1, 256]
    - [64, 5448.16]
  - - [1024, 3584, 1, 256]
    - [68, 8037.47]
  - - [2944, 128, 1, 1280]
    - [15, 5757.25]
  - - [1856, 5056, 1, 128]
    - [3, 3640.53]
  - - [64, 256, 1, 256]
    - [12, 884.688]
  - - [1408, 4, 1, 128]
    - [70, 72.627]
  - - [128, 2368, 1, 128]
    - [4, 2424.76]
  - - [256, 704, 1, 1280]
    - [57, 4480.79]
  - - [64, 2368, 1, 128]
    - [5, 1711.55]
  - - [6784, 6784, 1, 3328]
    - [54, 8825.99]
  - - [448, 5888, 1, 1280]
    - [55, 8897.16]
  - - [5056, 448, 1, 128]
    - [7, 2440.12]
  - - [3584, 2944, 1, 128]
    - [7, 3634.78]
  - - [6784, 256, 1, 1280]
    - [57, 9174.33]
  - - [256, 2944, 1, 1280]
    - [64, 8705.17]
  - - [64, 4288, 1, 128]
    - [5, 2226.35]
  - - [2368, 5888, 1, 3328]
    - [54, 8961.13]
  - - [4, 64, 1, 256]
    - [77, 20.5732]
  - - [704, 1024, 1, 3328]
    - [57, 8549.98]
  - - [2368, 1856, 1, 1280]
    - [64, 9935.02]
  - - [128, 448, 1, 128]
    - [1, 825.743]
  - - [128, 6784, 1, 256]
    - [64, 6523.79]
  - - [3584, 4288, 1, 128]
    - [7, 3696.46]
  - - [64, 448, 1, 128]
    - [1, 427.094]
  - - [5888, 4288, 1, 3328]
    - [62, 8862.78]
  - - [2368, 704, 1, 256]
    - [64, 7827.71]
  - - [256, 1856, 1, 3328]
    - [57, 8178.63]
  - - [1856, 128, 1, 256]
    - [57, 3891.07]
  - - [6784, 128, 1, 128]
    - [2, 3589.68]
  - - [3584, 1408, 1, 128]
    - [7, 3064.91]
  - - [1856, 5056, 1, 1280]
    - [55, 9339.85]
  - - [2944, 1024, 1, 1280]
    - [54, 10120.8]
  - - [5056, 4, 1, 256]
    - [77, 369.797]
  - - [2368, 4288, 1, 256]
    - [58, 9677.61]
  - - [1024, 2368, 1, 3328]
    - [68, 8578.57]
  - - [64, 704, 1, 3328]
    - [35, 4040.32]
  - - [704, 1408, 1, 256]
    - [64, 7495.8]
  - - [6784, 1856, 1, 3328]
    - [55, 8970.13]
  - - [1024, 2944, 1, 128]
    - [7, 2734.47]
  - - [1024, 3584, 1, 1280]
    - [68, 9796.98]
  - - [4288, 5888, 1, 3328]
    - [55, 8828.9]
  - - [4288, 4, 1, 3328]
    - [81, 628.534]
  - - [256, 1408, 1, 256]
    - [64, 4665.4]
  - - [448, 2944, 1, 1280]
    - [59, 8162.63]
  - - [4, 5888, 1, 128]
    - [70, 231.23]
  - - [1024, 2944, 1, 3328]
    - [55, 9661.03]
  - - [3584, 6784, 1, 256]
    - [69, 9812.68]
  - - [256, 6784, 1, 1280]
    - [64, 8854.91]
  - - [1856, 3584, 1, 256]
    - [65, 9425.27]
  - - [128, 448, 1, 3328]
    - [30, 4709.79]
  - - [6784, 1856, 1, 128]
    - [3, 3656.59]
  - - [4, 448, 1, 256]
    - [74, 121.427]
  - - [2944, 704, 1, 128]
    - [3, 2357.66]
  - - [256, 5888, 1, 1280]
    - [66, 9338.74]
  - - [4, 128, 1, 1280]
    - [79, 132.049]
  - - [4288, 6784, 1, 3328]
    - [55, 8739.96]
  - - [6784, 128, 1, 1280]
    - [57, 7131.48]
  - - [64, 1408, 1, 256]
    - [18, 2240.33]
  - - [2368, 1408, 1, 128]
    - [3, 2968.17]
  - - [1856, 448, 1, 256]
    - [57, 6385.7]
  - - [1408, 1024, 1, 128]
    - [3, 2244.44]
  - - [128, 64, 1, 128]
    - [5, 106.427]
  - - [6784, 3584, 1, 3328]
    - [54, 8947.64]
  - - [2944, 64, 1, 3328]
    - [45, 6007.71]
  - - [64, 64, 1, 128]
    - [0, 53.6191]
  - - [2368, 5056, 1, 1280]
    - [54, 9713.59]
  - - [64, 4, 1, 1280]
    - [79, 68.054]
  - - [1408, 2368, 1, 1280]
    - [64, 9527.39]
  - - [128, 1408, 1, 1280]
    - [24, 4958.82]
  - - [256, 64, 1, 3328]
    - [47, 3016.65]
  - - [2944, 4288, 1, 128]
    - [7, 3495.17]
  - - [2944, 2944, 1, 256]
    - [65, 9718.58]
  - - [2944, 4, 1, 1280]
    - [79, 507.441]
  - - [5888, 4, 1, 256]
    - [77, 344.887]
  - - [6784, 256, 1, 256]
    - [57, 7136.55]
  - - [256, 5056, 1, 3328]
    - [64, 9205.33]
  - - [128, 4288, 1, 1280]
    - [57, 6335.38]
  - - [5056, 1856, 1, 128]
    - [3, 3711.35]
  - - [5888, 1408, 1, 256]
    - [65, 9845.49]
  - - [128, 128, 1, 256]
    - [20, 845.115]
  - - [5056, 4, 1, 3328]
    - [81, 640.306]
  - - [4288, 3584, 1, 3328]
    - [62, 9234.67]
  - - [448, 704, 1, 3328]
    - [57, 5485.67]
  - - [448, 448, 1, 128]
    - [2, 1993.1]
  - - [1024, 2368, 1, 1280]
    - [64, 9086.9]
  - - [1856, 704, 1, 3328]
    - [57, 9307.45]
  - - [4, 2368, 1, 128]
    - [70, 113.66]
  - - [5888, 6784, 1, 3328]
    - [55, 8815.15]
  - - [704, 4288, 1, 1280]
    - [59, 9753.62]
  - - [704, 256, 1, 256]
    - [57, 3068.15]
  - - [6784, 448, 1, 3328]
    - [57, 9063.53]
  - - [4288, 1024, 1, 128]
    - [3, 3231.37]
  - - [1024, 128, 1, 128]
    - [87, 1665.5]
  - - [4, 704, 1, 1280]
    - [159, 402.229]
  - - [4, 1856, 1, 3328]
    - [92, 615.477]
  - - [1856, 448, 1, 3328]
    - [139, 7696.0]
  - - [2944, 4288, 1, 1280]
    - [136, 9439.02]
  - - [2368, 64, 1, 3328]
    - [97, 5910.44]
  - - [2368, 5888, 1, 256]
    - [144, 9703.03]
  - - [128, 64, 1, 256]
    - [110, 435.691]
  - - [5888, 1024, 1, 1280]
    - [144, 10054.4]
  - - [128, 6784, 1, 3328]
    - [148, 8055.46]
  - - [64, 4, 1, 256]
    - [160, 16.7928]
  - - [5888, 1856, 1, 3328]
    - [136, 9217.81]
  - - [5056, 704, 1, 256]
    - [139, 9005.2]
  - - [5888, 2944, 1, 3328]
    - [136, 9183.04]
  - - [1856, 4288, 1, 256]
    - [139, 9092.27]
  - - [1024, 5056, 1, 128]
    - [89, 2769.81]
  - - [5056, 5056, 1, 3328]
    - [137, 9180.75]
  - - [1408, 5888, 1, 1280]
    - [136, 10109.6]
  - - [2368, 448, 1, 128]
    - [89, 1807.91]
  - - [1024, 3584, 1, 3328]
    - [150, 9512.65]
  - - [4, 2944, 1, 1280]
    - [92, 591.615]
  - - [1408, 64, 1, 128]
    - [87, 1188.72]
  - - [256, 4288, 1, 3328]
    - [146, 8203.22]
  - - [5888, 1408, 1, 1280]
    - [136, 10356.6]
  - - [704, 1856, 1, 3328]
    - [139, 9306.08]
  - - [4, 1408, 1, 128]
    - [152, 68.154]
  - - [1024, 2368, 1, 256]
    - [146, 6954.39]
  - - [1408, 1856, 1, 1280]
    - [139, 9900.45]
  - - [1408, 64, 1, 1280]
    - [101, 3743.07]
  - - [448, 1024, 1, 1280]
    - [146, 7436.29]
  - - [256, 1408, 1, 3328]
    - [146, 6245.25]
  - - [5056, 5056, 1, 1280]
    - [136, 9498.97]
  - - [448, 5056, 1, 256]
    - [139, 7915.02]
  - - [704, 1856, 1, 1280]
    - [139, 8868.01]
  - - [128, 5056, 1, 128]
    - [84, 3250.92]
  - - [2368, 128, 1, 256]
    - [146, 3837.14]
  - - [1856, 1408, 1, 128]
    - [85, 2972.81]
  - - [64, 5056, 1, 256]
    - [139, 4022.7]
  - - [6784, 256, 1, 3328]
    - [146, 9368.98]
  - - [6784, 4288, 1, 3328]
    - [136, 8774.86]
  - - [4288, 448, 1, 256]
    - [139, 7960.38]
  - - [64, 704, 1, 128]
    - [82, 638.273]
  - - [1856, 2368, 1, 3328]
    - [139, 9307.31]
  - - [4288, 2944, 1, 1280]
    - [140, 9672.56]
  - - [704, 5056, 1, 1280]
    - [141, 9886.75]
  - - [2368, 704, 1, 3328]
    - [146, 9054.23]
  - - [256, 5888, 1, 256]
    - [146, 7928.76]
  - - [1856, 4288, 1, 3328]
    - [144, 9207.93]
  - - [256, 2944, 1, 256]
    - [146, 7097.06]
  - - [5888, 1024, 1, 256]
    - [146, 9566.94]
  - - [448, 64, 1, 1280]
    - [111, 2737.28]
  - - [448, 5056, 1, 3328]
    - [139, 8836.72]
  - - [3584, 4, 1, 1280]
    - [161, 518.339]
  - - [2944, 64, 1, 256]
    - [139, 2843.53]
  - - [128, 4, 1, 1280]
    - [161, 130.209]
  - - [1408, 2944, 1, 256]
    - [140, 9338.53]
  - - [256, 1856, 1, 1280]
    - [146, 7723.58]
  - - [6784, 5056, 1, 3328]
    - [137, 8729.41]
  - - [5056, 5056, 1, 256]
    - [137, 9738.12]
  - - [1408, 6784, 1, 128]
    - [89, 3347.31]
  - - [64, 1024, 1, 1280]
    - [96, 3653.12]
  - - [2944, 4, 1, 256]
    - [156, 399.075]
  - - [704, 5056, 1, 128]
    - [85, 3165.56]
  - - [4, 2368, 1, 1280]
    - [92, 554.918]
  - - [2368, 2944, 1, 1280]
    - [144, 9679.63]
  - - [128, 3584, 1, 1280]
    - [146, 7450.25]
  - - [6784, 6784, 1, 1280]
    - [136, 9205.61]
  - - [1024, 256, 1, 3328]
    - [139, 6851.3]
  - - [1408, 4288, 1, 1280]
    - [137, 9883.07]
  - - [3584, 4288, 1, 1280]
    - [136, 9681.59]
  - - [2368, 704, 1, 1280]
    - [146, 8839.04]
  - - [5056, 4288, 1, 3328]
    - [137, 8880.35]
  - - [3584, 2368, 1, 3328]
    - [147, 8932.9]
  - - [64, 704, 1, 1280]
    - [114, 3139.38]
  - - [4288, 256, 1, 256]
    - [139, 6198.81]
  - - [2944, 128, 1, 128]
    - [84, 2843.53]
  - - [6784, 448, 1, 1280]
    - [143, 9578.11]
  - - [1408, 2944, 1, 128]
    - [89, 3354.95]
  - - [4288, 2944, 1, 256]
    - [140, 10026.9]
  - - [5888, 704, 1, 1280]
    - [139, 9988.37]
  - - [1856, 64, 1, 1280]
    - [97, 4171.91]
  - - [448, 5888, 1, 128]
    - [89, 3000.77]
  - - [5888, 64, 1, 3328]
    - [124, 6529.13]
  - - [2944, 256, 1, 3328]
    - [146, 8870.81]
  - - [1024, 64, 1, 128]
    - [83, 913.345]
  - - [5056, 2368, 1, 1280]
    - [144, 9776.57]
  - - [448, 3584, 1, 1280]
    - [139, 8379.58]
  - - [6784, 5888, 1, 256]
    - [151, 9887.12]
  - - [64, 1024, 1, 3328]
    - [132, 4673.57]
  - - [704, 128, 1, 1280]
    - [105, 4044.54]
  - - [5888, 2944, 1, 128]
    - [89, 3569.29]
  - - [4, 3584, 1, 128]
    - [152, 153.011]
  - - [1408, 448, 1, 1280]
    - [139, 7320.17]
  - - [1024, 1408, 1, 256]
    - [150, 6939.74]
  - - [2368, 2368, 1, 3328]
    - [147, 9333.32]
  - - [1856, 6784, 1, 128]
    - [85, 3782.57]
  - - [5056, 704, 1, 3328]
    - [146, 9157.32]
  - - [1408, 1856, 1, 256]
    - [139, 8986.24]
  - - [1408, 704, 1, 3328]
    - [146, 9105.12]
  - - [2368, 5056, 1, 256]
    - [144, 9511.81]
  - - [5888, 1856, 1, 256]
    - [142, 9912.53]
  - - [4288, 64, 1, 3328]
    - [113, 5777.65]
  - - [2368, 4, 1, 1280]
    - [161, 488.672]
  - - [704, 5888, 1, 256]
    - [140, 8729.64]
  - - [4288, 64, 1, 256]
    - [99, 2781.36]
  - - [6784, 64, 1, 256]
    - [99, 2783.87]
  - - [2944, 256, 1, 256]
    - [146, 6431.15]
  - - [2944, 6784, 1, 3328]
    - [136, 8853.35]
  - - [704, 1408, 1, 3328]
    - [139, 9166.95]
  - - [3584, 704, 1, 3328]
    - [143, 9256.65]
  - - [2944, 256, 1, 128]
    - [134, 2280.8]
  - - [6784, 4, 1, 1280]
    - [161, 563.001]
  - - [1024, 64, 1, 1280]
    - [103, 3254.21]
  - - [448, 4288, 1, 256]
    - [139, 7476.27]
  - - [64, 3584, 1, 3328]
    - [119, 6501.71]
  - - [704, 2368, 1, 1280]
    - [139, 8868.96]
  - - [448, 2944, 1, 128]
    - [89, 2176.8]
  - - [1856, 2368, 1, 1280]
    - [139, 9963.79]
  - - [2368, 128, 1, 3328]
    - [113, 6466.11]
  - - [2944, 128, 1, 256]
    - [146, 4269.96]
  - - [448, 1408, 1, 256]
    - [139, 6158.08]
  - - [1856, 4288, 1, 1280]
    - [137, 9945.06]
  - - [64, 5056, 1, 3328]
    - [127, 6702.5]
  - - [4, 704, 1, 256]
    - [156, 157.072]
  - - [1024, 448, 1, 128]
    - [89, 1627.83]
  - - [704, 4, 1, 1280]
    - [159, 383.25]
  - - [704, 256, 1, 128]
    - [85, 666.95]
  - - [704, 2944, 1, 128]
    - [85, 2473.38]
  - - [1408, 1024, 1, 1280]
    - [148, 8916.82]
  - - [704, 6784, 1, 256]
    - [137, 8361.34]
  - - [6784, 704, 1, 256]
    - [139, 9179.8]
  - - [5056, 1408, 1, 128]
    - [89, 3720.9]
  - - [256, 3584, 1, 3328]
    - [148, 8530.79]
  - - [4, 5888, 1, 3328]
    - [157, 680.119]
  - - [128, 1408, 1, 128]
    - [83, 1898.99]
  - - [3584, 4288, 1, 3328]
    - [137, 9284.19]
  - - [5888, 1856, 1, 1280]
    - [142, 9704.69]
  - - [5056, 1024, 1, 3328]
    - [137, 9983.36]
  - - [5056, 64, 1, 1280]
    - [124, 4679.05]
  - - [1024, 704, 1, 256]
    - [146, 6538.96]
  - - [1024, 4288, 1, 128]
    - [89, 2618.2]
  - - [4288, 64, 1, 1280]
    - [124, 4456.89]
  - - [2368, 3584, 1, 1280]
    - [141, 9644.89]
  - - [2368, 6784, 1, 1280]
    - [136, 9789.76]
  - - [1024, 256, 1, 256]
    - [146, 4194.27]
  - - [1856, 4, 1, 1280]
    - [161, 453.398]
  - - [448, 448, 1, 256]
    - [146, 3334.85]
  - - [2944, 3584, 1, 3328]
    - [136, 8783.37]
  - - [128, 4288, 1, 128]
    - [86, 3001.34]
  - - [64, 448, 1, 256]
    - [102, 1254.38]
  - - [128, 1024, 1, 3328]
    - [105, 6572.21]
  - - [4, 1408, 1, 3328]
    - [159, 581.765]
  - - [6784, 2944, 1, 256]
    - [140, 10311.0]
  - - [64, 1856, 1, 1280]
    - [97, 4729.37]
  - - [64, 1024, 1, 128]
    - [83, 928.3]
  - - [4288, 2368, 1, 3328]
    - [140, 8891.35]
  - - [1856, 2368, 1, 256]
    - [146, 9312.56]
  - - [3584, 256, 1, 128]
    - [134, 2331.56]
  - - [3584, 6784, 1, 3328]
    - [137, 9022.76]
  - - [256, 1024, 1, 256]
    - [146, 4397.8]
  - - [4, 6784, 1, 3328]
    - [157, 647.882]
  - - [1024, 5888, 1, 3328]
    - [137, 9619.28]
  - - [1024, 128, 1, 1280]
    - [126, 4458.45]
  - - [4288, 128, 1, 1280]
    - [124, 5692.81]
  - - [5056, 4288, 1, 1280]
    - [140, 9401.1]
  - - [5888, 64, 1, 256]
    - [107, 2713.18]
  - - [1408, 5056, 1, 1280]
    - [136, 10222.8]
  - - [1856, 256, 1, 1280]
    - [139, 7491.04]
  - - [64, 5888, 1, 3328]
    - [123, 6763.88]
  - - [2944, 5888, 1, 128]
    - [85, 3553.2]
  - - [704, 5888, 1, 1280]
    - [140, 9995.34]
  - - [2368, 3584, 1, 128]
    - [89, 3539.79]
  - - [6784, 5888, 1, 3328]
    - [136, 8748.81]
  - - [704, 1024, 1, 1280]
    - [146, 8349.09]
  - - [448, 256, 1, 3328]
    - [112, 6019.41]
  - - [448, 1856, 1, 128]
    - [134, 2690.69]
  - - [128, 1024, 1, 128]
    - [87, 1641.3]
  - - [2944, 4, 1, 128]
    - [152, 143.396]
  - - [1024, 704, 1, 1280]
    - [139, 8179.14]
  - - [128, 5888, 1, 256]
    - [139, 6927.11]
  - - [1024, 5056, 1, 1280]
    - [151, 10154.7]
  - - [4288, 1024, 1, 256]
    - [146, 9361.29]
  - - [2944, 2368, 1, 128]
    - [85, 3406.82]
  - - [704, 704, 1, 3328]
    - [146, 8541.07]
  - - [704, 1408, 1, 1280]
    - [139, 8888.49]
  - - [5888, 448, 1, 1280]
    - [139, 9136.22]
  - - [3584, 256, 1, 3328]
    - [146, 8462.49]
  - - [704, 5888, 1, 3328]
    - [141, 9570.34]
  - - [704, 1856, 1, 128]
    - [85, 2190.0]
  - - [128, 3584, 1, 3328]
    - [146, 7920.98]
  - - [4, 4288, 1, 128]
    - [152, 172.408]
  - - [128, 704, 1, 1280]
    - [101, 4023.59]
  - - [3584, 2944, 1, 256]
    - [146, 9679.98]
  - - [1856, 128, 1, 3328]
    - [97, 6683.33]
  - - [4, 64, 1, 1280]
    - [161, 68.154]
  - - [4, 5056, 1, 3328]
    - [91, 698.482]
  - - [128, 2944, 1, 1280]
    - [139, 6213.32]
  - - [2368, 1024, 1, 3328]
    - [141, 9087.46]
  - - [128, 256, 1, 3328]
    - [130, 4066.85]
  - - [1408, 5056, 1, 3328]
    - [136, 9638.9]
  - - [1856, 1856, 1, 3328]
    - [148, 9221.89]
  - - [3584, 128, 1, 256]
    - [146, 4044.47]
  - - [448, 1408, 1, 3328]
    - [139, 7374.27]
  - - [2368, 2368, 1, 256]
    - [140, 9598.23]
  - - [4288, 4288, 1, 1280]
    - [142, 9247.05]
  - - [64, 448, 1, 1280]
    - [114, 2707.4]
  - - [1408, 4288, 1, 256]
    - [147, 9175.53]
  - - [448, 4, 1, 256]
    - [159, 126.495]
  - - [5888, 448, 1, 128]
    - [89, 2787.88]
  - - [448, 4, 1, 1280]
    - [159, 319.321]
  - - [704, 6784, 1, 3328]
    - [136, 9312.47]
  - - [5888, 5888, 1, 1280]
    - [137, 9274.51]
  - - [5056, 1024, 1, 1280]
    - [136, 10296.1]
  - - [448, 5888, 1, 3328]
    - [136, 8687.75]
  - - [128, 4, 1, 128]
    - [152, 6.80239]
  - - [1024, 2944, 1, 1280]
    - [137, 9780.72]
  - - [5056, 5888, 1, 1280]
    - [136, 9469.11]
  - - [4288, 5888, 1, 128]
    - [89, 3924.07]
  - - [256, 3584, 1, 256]
    - [146, 6848.44]
  - - [1408, 3584, 1, 128]
    - [85, 3399.58]
  - - [256, 2944, 1, 3328]
    - [146, 9046.2]
  - - [448, 3584, 1, 128]
    - [89, 2552.49]
  - - [5888, 2944, 1, 1280]
    - [136, 9702.3]
  - - [4, 6784, 1, 1280]
    - [92, 642.42]
  - - [2368, 5888, 1, 128]
    - [85, 3594.9]
  - - [64, 2944, 1, 128]
    - [83, 1949.6]
  - - [3584, 5888, 1, 256]
    - [147, 10194.1]
  - - [2368, 704, 1, 128]
    - [85, 2704.89]
  - - [3584, 2944, 1, 1280]
    - [144, 9427.22]
  - - [3584, 2368, 1, 128]
    - [89, 3304.49]
  - - [5056, 704, 1, 128]
    - [134, 2975.66]
  - - [448, 2368, 1, 128]
    - [85, 1882.15]
  - - [5056, 1408, 1, 3328]
    - [144, 9425.02]
  - - [1408, 704, 1, 256]
    - [139, 7496.01]
  - - [6784, 1024, 1, 3328]
    - [137, 9484.58]
  - - [6784, 2944, 1, 3328]
    - [136, 8908.2]
  - - [2944, 5056, 1, 3328]
    - [151, 8925.12]
  - - [1856, 1856, 1, 256]
    - [139, 8811.84]
  - - [1024, 5888, 1, 128]
    - [89, 3011.17]
  - - [6784, 2368, 1, 1280]
    - [151, 9407.87]
  - - [256, 4, 1, 128]
    - [152, 13.1109]
  - - [4288, 5888, 1, 1280]
    - [136, 9392.68]
  - - [4288, 4288, 1, 256]
    - [142, 9804.64]
  - - [448, 2944, 1, 3328]
    - [141, 8419.27]
  - - [4288, 1856, 1, 1280]
    - [136, 9982.59]
  - - [1856, 2944, 1, 3328]
    - [146, 9169.43]
  - - [256, 6784, 1, 3328]
    - [146, 8703.29]
  - - [64, 5888, 1, 256]
    - [146, 4601.75]
  - - [256, 5056, 1, 128]
    - [135, 1876.38]
  - - [5056, 1024, 1, 256]
    - [140, 9687.32]
  - - [704, 64, 1, 3328]
    - [121, 4131.14]
  - - [5056, 1856, 1, 3328]
    - [137, 8842.12]
  - - [4, 2944, 1, 3328]
    - [156, 645.286]
  - - [4, 5056, 1, 256]
    - [91, 466.066]
  - - [1856, 1408, 1, 256]
    - [146, 8906.45]
  - - [3584, 4, 1, 128]
    - [152, 170.941]
  - - [448, 448, 1, 3328]
    - [97, 6296.84]
  - - [6784, 128, 1, 3328]
    - [139, 7833.84]
  - - [4288, 1408, 1, 128]
    - [85, 3642.71]
  - - [4288, 5056, 1, 256]
    - [149, 9861.13]
  - - [1408, 128, 1, 1280]
    - [97, 4958.97]
  - - [5056, 256, 1, 3328]
    - [146, 9523.52]
  - - [704, 704, 1, 256]
    - [139, 6228.45]
  - - [1024, 5888, 1, 1280]
    - [137, 9635.09]
  - - [6784, 2368, 1, 128]
    - [85, 3750.75]
  - - [4, 5056, 1, 1280]
    - [91, 664.475]
  - - [64, 128, 1, 256]
    - [95, 496.761]
  - - [128, 1856, 1, 1280]
    - [139, 5749.47]
  - - [5056, 3584, 1, 256]
    - [151, 10118.6]
  - - [1856, 1024, 1, 1280]
    - [136, 9308.6]
  - - [6784, 4288, 1, 1280]
    - [136, 9243.82]
  - - [1856, 1856, 1, 1280]
    - [148, 9617.67]
  - - [6784, 2944, 1, 128]
    - [85, 3874.65]
  - - [128, 4288, 1, 3328]
    - [105, 7495.09]
  - - [4, 2368, 1, 3328]
    - [156, 634.292]
  - - [5888, 1856, 1, 128]
    - [89, 3683.91]
  - - [448, 704, 1, 1280]
    - [139, 5200.3]
  - - [2368, 1024, 1, 128]
    - [85, 2724.39]
  - - [1024, 448, 1, 3328]
    - [146, 7670.42]
  - - [1856, 704, 1, 1280]
    - [139, 8850.62]
  - - [5056, 3584, 1, 128]
    - [85, 3808.36]
  - - [5888, 5888, 1, 3328]
    - [137, 8870.81]
  - - [6784, 1024, 1, 256]
    - [140, 9519.29]
  - - [2944, 2368, 1, 256]
    - [140, 9511.5]
  - - [256, 448, 1, 256]
    - [104, 2345.35]
  - - [5056, 5888, 1, 3328]
    - [137, 9021.38]
  - - [1856, 1024, 1, 256]
    - [140, 7922.97]
  - - [448, 1408, 1, 1280]
    - [139, 7310.36]
  - - [3584, 448, 1, 1280]
    - [139, 8534.22]
  - - [1024, 1024, 1, 1280]
    - [148, 9127.95]
  - - [448, 5888, 1, 256]
    - [139, 7906.47]
  - - [704, 64, 1, 128]
    - [82, 648.898]
  - - [1408, 6784, 1, 3328]
    - [136, 8944.83]
  - - [448, 1024, 1, 128]
    - [89, 1708.5]
  - - [4288, 704, 1, 128]
    - [89, 2735.42]
  - - [128, 1856, 1, 128]
    - [84, 2293.45]
  - - [448, 2368, 1, 3328]
    - [139, 7933.01]
  - - [5056, 64, 1, 128]
    - [90, 2329.81]
  - - [5056, 2944, 1, 256]
    - [147, 10094.4]
  - - [6784, 5888, 1, 128]
    - [85, 3786.45]
  - - [704, 1024, 1, 256]
    - [146, 6679.29]
  - - [1024, 4, 1, 256]
    - [156, 217.873]
  - - [2368, 1856, 1, 256]
    - [139, 9352.7]
  - - [128, 6784, 1, 1280]
    - [146, 7754.43]
  - - [1408, 3584, 1, 3328]
    - [136, 9786.49]
  - - [2368, 6784, 1, 256]
    - [144, 9653.59]
  - - [5056, 1408, 1, 1280]
    - [136, 10146.9]
  - - [256, 256, 1, 128]
    - [83, 928.351]
  - - [5056, 4288, 1, 128]
    - [85, 3932.71]
  - - [1408, 1856, 1, 128]
    - [89, 2868.93]
  - - [1408, 5888, 1, 3328]
    - [136, 9870.11]
  - - [1856, 256, 1, 256]
    - [139, 5864.42]
  - - [6784, 6784, 1, 256]
    - [147, 9885.06]
  - - [64, 256, 1, 128]
    - [87, 246.288]
  - - [4288, 2368, 1, 128]
    - [85, 3510.61]
  - - [1856, 4288, 1, 128]
    - [89, 3713.82]
  - - [256, 4288, 1, 1280]
    - [146, 7479.64]
  - - [2368, 2944, 1, 256]
    - [139, 9284.24]
  - - [4, 1856, 1, 256]
    - [158, 366.611]
  - - [3584, 1856, 1, 1280]
    - [137, 9549.09]
  - - [6784, 6784, 1, 128]
    - [85, 3859.77]
  - - [256, 1856, 1, 128]
    - [134, 1531.83]
  - - [704, 64, 1, 1280]
    - [114, 3101.9]
  - - [5888, 5056, 1, 256]
    - [151, 10094.4]
  - - [3584, 448, 1, 256]
    - [139, 7428.28]
  - - [448, 4288, 1, 128]
    - [85, 2384.75]
  - - [2944, 4288, 1, 3328]
    - [137, 8827.01]
  - - [256, 6784, 1, 256]
    - [146, 8154.84]
  - - [1408, 4288, 1, 128]
    - [89, 3412.75]
  - - [2944, 704, 1, 3328]
    - [146, 9746.14]
  - - [128, 448, 1, 256]
    - [102, 1753.89]
  - - [3584, 3584, 1, 256]
    - [146, 9821.14]
  - - [448, 1408, 1, 128]
    - [134, 2275.6]
  - - [128, 256, 1, 1280]
    - [103, 3272.94]
  - - [3584, 5056, 1, 256]
    - [137, 9724.19]
  - - [6784, 128, 1, 256]
    - [139, 4553.85]
  - - [4288, 4, 1, 256]
    - [156, 411.735]
  - - [64, 1408, 1, 3328]
    - [112, 5131.21]
  - - [704, 448, 1, 256]
    - [139, 4036.92]
  - - [2944, 2368, 1, 1280]
    - [151, 9782.6]
  - - [448, 64, 1, 3328]
    - [130, 3659.56]
  - - [1408, 3584, 1, 256]
    - [146, 9222.36]
  - - [3584, 4, 1, 3328]
    - [163, 614.669]
  - - [6784, 3584, 1, 256]
    - [140, 10088.5]
  - - [256, 128, 1, 128]
    - [82, 488.207]
  - - [704, 1408, 1, 128]
    - [134, 1797.36]
  - - [4, 2368, 1, 256]
    - [158, 419.766]
  - - [2944, 448, 1, 128]
    - [85, 2106.4]
  - - [128, 1408, 1, 256]
    - [139, 3068.25]
  - - [4, 2944, 1, 256]
    - [155, 424.043]
  - - [64, 128, 1, 3328]
    - [118, 2177.83]
  - - [5056, 2368, 1, 128]
    - [85, 3902.02]
  - - [2944, 2944, 1, 3328]
    - [147, 9177.85]
  - - [5056, 6784, 1, 256]
    - [144, 9589.66]
  - - [1856, 3584, 1, 128]
    - [85, 3423.0]
  - - [128, 2944, 1, 128]
    - [84, 2794.76]
  - - [1024, 704, 1, 3328]
    - [146, 8505.19]
  - - [6784, 448, 1, 256]
    - [139, 8782.07]
  - - [3584, 6784, 1, 128]
    - [89, 4007.06]
  - - [128, 4288, 1, 256]
    - [146, 5298.43]
  - - [704, 448, 1, 3328]
    - [139, 5483.64]
  - - [1024, 1024, 1, 3328]
    - [148, 9643.68]
  - - [128, 128, 1, 3328]
    - [129, 3132.34]
  - - [5056, 1856, 1, 256]
    - [139, 9800.58]
  - - [256, 128, 1, 256]
    - [94, 1433.56]
  - - [1024, 1856, 1, 256]
    - [150, 6935.8]
  - - [4288, 64, 1, 128]
    - [87, 2155.55]
  - - [256, 448, 1, 3328]
    - [123, 5902.23]
  - - [1408, 6784, 1, 1280]
    - [147, 9666.34]
  - - [3584, 3584, 1, 1280]
    - [137, 9746.95]
  - - [64, 2368, 1, 1280]
    - [105, 4941.11]
  - - [448, 2368, 1, 1280]
    - [139, 7300.43]
  - - [5888, 5888, 1, 128]
    - [89, 3729.96]
  - - [64, 6784, 1, 3328]
    - [139, 7505.32]
  - - [2944, 256, 1, 1280]
    - [139, 8506.24]
  - - [5056, 5888, 1, 128]
    - [85, 3873.63]
  - - [256, 2368, 1, 128]
    - [134, 1673.41]
  - - [5056, 2368, 1, 3328]
    - [136, 9287.32]
  - - [2944, 4288, 1, 256]
    - [140, 9729.51]
  - - [1408, 3584, 1, 1280]
    - [136, 10529.8]
  - - [2368, 64, 1, 256]
    - [139, 2530.33]
  - - [64, 448, 1, 3328]
    - [130, 3568.35]
  - - [256, 256, 1, 3328]
    - [125, 5007.42]
  - - [5888, 4, 1, 128]
    - [152, 217.733]
  - - [1856, 704, 1, 256]
    - [138, 7563.86]
  - - [4, 4288, 1, 1280]
    - [91, 596.432]
  - - [1408, 448, 1, 3328]
    - [139, 7595.63]
  - - [1024, 4, 1, 3328]
    - [163, 496.106]
  - - [2368, 256, 1, 256]
    - [139, 5527.77]
  - - [2368, 6784, 1, 3328]
    - [137, 8954.03]
  - - [1856, 1408, 1, 1280]
    - [141, 10111.0]
  - - [1856, 448, 1, 1280]
    - [139, 7425.24]
  - - [6784, 704, 1, 128]
    - [85, 3337.16]
  - - [4, 4, 1, 256]
    - [159, 0.925224]
  - - [128, 5888, 1, 128]
    - [84, 3356.54]
  - - [1408, 5888, 1, 256]
    - [142, 9562.98]
  - - [704, 2944, 1, 1280]
    - [148, 9814.54]
  - - [1856, 2368, 1, 128]
    - [85, 3249.71]
  - - [256, 64, 1, 256]
    - [94, 820.662]
  - - [1024, 1024, 1, 256]
    - [146, 7247.67]
  - - [704, 1856, 1, 256]
    - [138, 7732.23]
  - - [64, 6784, 1, 256]
    - [139, 5121.23]
  - - [3584, 704, 1, 1280]
    - [139, 9563.23]
  - - [256, 128, 1, 1280]
    - [95, 3199.05]
  - - [2368, 4, 1, 256]
    - [156, 352.086]
  - - [256, 2368, 1, 1280]
    - [146, 7006.73]
  - - [2944, 6784, 1, 128]
    - [85, 3614.92]
  - - [3584, 448, 1, 3328]
    - [139, 8685.89]
  - - [1408, 4, 1, 256]
    - [156, 270.428]
  - - [704, 2368, 1, 3328]
    - [146, 8648.57]
  - - [2944, 448, 1, 256]
    - [138, 6937.68]
  - - [1856, 448, 1, 128]
    - [134, 2731.57]
  - - [2368, 128, 1, 1280]
    - [97, 5007.24]
  - - [256, 5888, 1, 128]
    - [135, 2143.78]
  - - [2368, 256, 1, 128]
    - [134, 2026.2]
  - - [64, 5056, 1, 1280]
    - [139, 5320.15]
  - - [4, 6784, 1, 128]
    - [152, 253.55]
  - - [2944, 2944, 1, 1280]
    - [140, 9561.69]
  - - [5888, 2368, 1, 256]
    - [142, 9949.45]
  - - [4, 3584, 1, 1280]
    - [156, 636.902]
  - - [1408, 128, 1, 128]
    - [86, 1853.75]
  - - [6784, 704, 1, 3328]
    - [136, 9045.13]
  - - [128, 64, 1, 1280]
    - [128, 1646.09]
  - - [2368, 256, 1, 1280]
    - [146, 6969.45]
  - - [4, 448, 1, 3328]
    - [162, 426.084]
  - - [5888, 4288, 1, 128]
    - [89, 3700.41]
  - - [4, 5888, 1, 256]
    - [154, 467.869]
  - - [1408, 2944, 1, 3328]
    - [137, 10123.4]
  - - [3584, 704, 1, 128]
    - [89, 2718.2]
  - - [64, 1024, 1, 256]
    - [122, 1871.83]
  - - [5056, 5056, 1, 128]
    - [89, 3780.95]
  - - [2368, 448, 1, 1280]
    - [139, 7228.46]
  - - [128, 3584, 1, 256]
    - [139, 5682.48]
  - - [704, 448, 1, 1280]
    - [139, 5205.26]
  - - [448, 5056, 1, 128]
    - [85, 2727.58]
  - - [256, 4, 1, 1280]
    - [161, 249.31]
  - - [128, 5056, 1, 256]
    - [139, 6195.41]
  - - [1408, 5056, 1, 128]
    - [89, 3417.03]
  - - [2944, 3584, 1, 128]
    - [85, 3678.88]
  - - [3584, 2368, 1, 256]
    - [146, 9382.64]
  - - [5888, 5056, 1, 1280]
    - [137, 9547.85]
  - - [2368, 5056, 1, 128]
    - [85, 3657.81]
  - - [64, 704, 1, 256]
    - [100, 1557.11]
  - - [4288, 256, 1, 1280]
    - [139, 7488.51]
  - - [3584, 3584, 1, 3328]
    - [136, 9093.48]
  - - [1024, 256, 1, 128]
    - [134, 951.715]
  - - [4, 704, 1, 128]
    - [152, 32.9771]
  - - [5888, 6784, 1, 256]
    - [144, 10133.9]
  - - [4288, 2944, 1, 3328]
    - [136, 8873.83]
  - - [2944, 64, 1, 128]
    - [86, 1904.04]
  - - [1856, 64, 1, 256]
    - [101, 2443.55]
  - - [4288, 128, 1, 3328]
    - [127, 6948.13]
  - - [4288, 704, 1, 1280]
    - [139, 9617.05]
  - - [256, 5056, 1, 1280]
    - [146, 9393.39]
  - - [1408, 256, 1, 128]
    - [85, 1297.68]
  - - [2944, 5888, 1, 3328]
    - [136, 9051.76]
  - - [6784, 5888, 1, 1280]
    - [136, 9233.35]
  - - [704, 128, 1, 256]
    - [100, 2208.79]
  - - [5888, 4288, 1, 1280]
    - [137, 9501.1]
  - - [448, 256, 1, 1280]
    - [97, 4707.29]
  - - [5888, 3584, 1, 128]
    - [89, 3870.2]
  - - [1856, 1856, 1, 128]
    - [85, 3154.48]
  - - [5056, 4, 1, 1280]
    - [161, 546.989]
  - - [256, 1408, 1, 1280]
    - [139, 5898.13]
  - - [3584, 1024, 1, 3328]
    - [148, 9592.9]
  - - [704, 3584, 1, 128]
    - [89, 2872.18]
  - - [5888, 448, 1, 3328]
    - [139, 8887.78]
  - - [2368, 4288, 1, 1280]
    - [140, 9606.18]
  - - [4288, 2944, 1, 128]
    - [85, 3794.39]
  - - [1024, 6784, 1, 3328]
    - [151, 9241.65]
  - - [128, 2368, 1, 256]
    - [139, 3908.66]
  - - [6784, 64, 1, 3328]
    - [127, 6570.0]
  - - [5056, 2944, 1, 3328]
    - [136, 9144.69]
  - - [448, 128, 1, 256]
    - [95, 1834.99]
  - - [2944, 3584, 1, 256]
    - [140, 9804.91]
  - - [1408, 1408, 1, 3328]
    - [137, 9702.2]
  - - [1856, 128, 1, 1280]
    - [105, 5317.52]
  - - [3584, 3584, 1, 128]
    - [89, 3518.73]
  - - [64, 3584, 1, 256]
    - [139, 3829.52]
  - - [1408, 4, 1, 3328]
    - [163, 539.607]
  - - [128, 2944, 1, 3328]
    - [127, 6927.19]
  - - [3584, 704, 1, 256]
    - [139, 8599.39]
  - - [2944, 448, 1, 3328]
    - [141, 8345.76]
  - - [3584, 1408, 1, 3328]
    - [136, 9932.7]
  - - [704, 3584, 1, 1280]
    - [141, 9718.85]
  - - [2944, 6784, 1, 1280]
    - [136, 9564.08]
  - - [1856, 6784, 1, 256]
    - [142, 9486.35]
  - - [4288, 448, 1, 3328]
    - [146, 8786.11]
  - - [6784, 4288, 1, 128]
    - [85, 3656.04]
  - - [6784, 704, 1, 1280]
    - [137, 9639.8]
  - - [256, 4288, 1, 256]
    - [146, 6726.41]
  - - [3584, 64, 1, 128]
    - [87, 2119.66]
  - - [5888, 1024, 1, 3328]
    - [137, 9823.35]
  - - [448, 64, 1, 128]
    - [83, 419.962]
  - - [704, 6784, 1, 1280]
    - [136, 9897.62]
  - - [5888, 128, 1, 256]
    - [146, 4498.49]
  - - [2368, 448, 1, 3328]
    - [139, 7577.36]
  - - [1856, 5056, 1, 3328]
    - [136, 8776.78]
  - - [4, 6784, 1, 256]
    - [154, 488.538]
  - - [1024, 3584, 1, 128]
    - [89, 2561.32]
  - - [1024, 1408, 1, 128]
    - [135, 1960.23]
  - - [2368, 2944, 1, 128]
    - [85, 3484.67]
  - - [5056, 64, 1, 256]
    - [107, 2774.95]
  - - [4, 448, 1, 1280]
    - [160, 340.37]
  - - [5056, 2944, 1, 128]
    - [85, 3762.01]
  - - [5888, 5056, 1, 3328]
    - [137, 8935.08]
  - - [1024, 704, 1, 128]
    - [134, 1943.42]
  - - [1408, 2368, 1, 128]
    - [85, 2927.55]
  - - [5888, 2368, 1, 128]
    - [89, 3607.28]
  - - [128, 5056, 1, 3328]
    - [139, 7780.4]
  - - [3584, 6784, 1, 1280]
    - [137, 9316.03]
  - - [1856, 5888, 1, 256]
    - [144, 9453.51]
  - - [256, 256, 1, 256]
    - [99, 1919.47]
  - - [256, 64, 1, 128]
    - [87, 209.805]
  - - [4288, 4288, 1, 3328]
    - [144, 8668.66]
  - - [4288, 1408, 1, 1280]
    - [136, 9878.39]
  - - [3584, 5056, 1, 128]
    - [89, 3877.69]
  - - [4, 1024, 1, 3328]
    - [93, 533.486]
  - - [4288, 2368, 1, 256]
    - [140, 10023.2]
  - - [2944, 5056, 1, 1280]
    - [137, 9559.38]
  - - [448, 6784, 1, 256]
    - [140, 8073.31]
  - - [704, 1024, 1, 128]
    - [134, 2442.59]
  - - [6784, 2368, 1, 3328]
    - [136, 9217.97]
  - - [256, 1024, 1, 1280]
    - [146, 6291.36]
  - - [704, 4, 1, 128]
    - [152, 35.3603]
  - - [256, 4, 1, 256]
    - [159, 78.7393]
  - - [4288, 128, 1, 256]
    - [139, 3719.34]
  - - [4288, 1856, 1, 3328]
    - [137, 9301.58]
  - - [3584, 448, 1, 128]
    - [89, 2253.92]
  - - [256, 4, 1, 3328]
    - [163, 353.981]
  - - [4, 1408, 1, 1280]
    - [93, 477.135]
  - - [3584, 64, 1, 1280]
    - [98, 4394.21]
  - - [1408, 448, 1, 128]
    - [89, 1985.45]
  - - [3584, 1024, 1, 1280]
    - [147, 10125.6]
  - - [1856, 5056, 1, 256]
    - [140, 9168.84]
  - - [4, 3584, 1, 256]
    - [92, 450.519]
  - - [1024, 4288, 1, 256]
    - [150, 7842.22]
  - - [5888, 3584, 1, 3328]
    - [151, 8968.91]
  - - [4, 256, 1, 256]
    - [159, 80.5246]
  - - [5056, 3584, 1, 3328]
    - [136, 9078.64]
  - - [128, 5888, 1, 1280]
    - [146, 8613.1]
  - - [704, 448, 1, 128]
    - [134, 1169.59]
  - - [2368, 1408, 1, 1280]
    - [139, 9824.82]
  - - [5056, 2944, 1, 1280]
    - [136, 9585.75]
  - - [4, 4, 1, 128]
    - [153, 0.1510094]
  - - [3584, 256, 1, 256]
    - [146, 6444.82]
  - - [128, 1856, 1, 3328]
    - [105, 6980.55]
  - - [1024, 6784, 1, 256]
    - [149, 8565.02]
  - - [4, 128, 1, 256]
    - [159, 40.3123]
  - - [64, 64, 1, 1280]
    - [118, 795.379]
  - - [6784, 4, 1, 128]
    - [152, 222.327]
  - - [2944, 1408, 1, 128]
    - [85, 3391.48]
  - - [448, 128, 1, 3328]
    - [112, 4684.23]
  - - [64, 2944, 1, 3328]
    - [105, 6359.91]
  - - [64, 4288, 1, 3328]
    - [116, 5888.0]
  - - [5056, 6784, 1, 3328]
    - [151, 8846.88]
  - - [128, 2944, 1, 256]
    - [139, 4859.39]
  - - [128, 6784, 1, 128]
    - [88, 3410.26]
  - - [3584, 4288, 1, 256]
    - [151, 9987.07]
  - - [448, 1856, 1, 256]
    - [139, 6371.56]
  - - [1856, 6784, 1, 3328]
    - [137, 8689.15]
  - - [3584, 128, 1, 3328]
    - [139, 7413.82]
  - - [64, 1856, 1, 256]
    - [96, 2429.1]
  - - [1024, 448, 1, 1280]
    - [139, 7259.24]
  - - [5888, 4288, 1, 256]
    - [147, 9890.53]
  - - [4, 448, 1, 128]
    - [152, 20.8825]
  - - [5056, 1408, 1, 256]
    - [141, 9520.96]
  - - [64, 256, 1, 1280]
    - [111, 2264.97]
  - - [3584, 1024, 1, 256]
    - [140, 9230.94]
  - - [256, 704, 1, 256]
    - [139, 3038.25]
  - - [5888, 5888, 1, 256]
    - [147, 9933.82]
  - - [4288, 1024, 1, 1280]
    - [146, 9953.2]
  - - [5888, 128, 1, 3328]
    - [146, 8456.52]
  - - [448, 6784, 1, 3328]
    - [141, 9559.87]
  - - [2944, 1408, 1, 1280]
    - [136, 10534.9]
  - - [2944, 1856, 1, 3328]
    - [139, 9243.67]
  - - [2368, 64, 1, 128]
    - [87, 1711.72]
  - - [2944, 2944, 1, 128]
    - [85, 3524.77]
  - - [4, 128, 1, 3328]
    - [163, 244.813]
  - - [3584, 5888, 1, 1280]
    - [137, 9375.83]
  - - [64, 4, 1, 128]
    - [152, 2.76482]
  - - [6784, 1856, 1, 1280]
    - [142, 9272.88]
  - - [2944, 5056, 1, 256]
    - [146, 9833.87]
  - - [5888, 256, 1, 3328]
    - [139, 9430.41]
  - - [1856, 5888, 1, 3328]
    - [137, 9146.72]
  - - [3584, 1408, 1, 256]
    - [146, 9183.52]
  - - [704, 3584, 1, 3328]
    - [148, 9429.92]
  - - [5056, 448, 1, 1280]
    - [139, 9483.84]
  - - [3584, 1856, 1, 3328]
    - [137, 9094.37]
  - - [64, 1408, 1, 128]
    - [87, 1188.72]
  - - [1408, 704, 1, 1280]
    - [146, 8828.92]
  - - [2944, 1024, 1, 256]
    - [145, 8553.69]
  - - [1024, 2368, 1, 128]
    - [89, 2444.66]
  - - [2368, 4288, 1, 3328]
    - [140, 8728.54]
  - - [4, 1408, 1, 256]
    - [158, 295.005]
  - - [1024, 1408, 1, 1280]
    - [148, 8653.56]
  - - [64, 64, 1, 256]
    - [120, 202.333]
  - - [704, 256, 1, 3328]
    - [139, 4860.15]
  - - [6784, 5056, 1, 256]
    - [147, 9877.33]
  - - [4, 4288, 1, 3328]
    - [157, 673.684]
  - - [448, 6784, 1, 128]
    - [89, 2764.11]
  - - [4, 704, 1, 3328]
    - [162, 527.234]
  - - [448, 2944, 1, 256]
    - [139, 7144.29]
  - - [2944, 6784, 1, 256]
    - [146, 9455.08]
  - - [2368, 2368, 1, 1280]
    - [140, 10075.3]
  - - [4, 4, 1, 1280]
    - [161, 3.55596]
  - - [1856, 3584, 1, 1280]
    - [141, 9812.39]
  - - [64, 2944, 1, 256]
    - [139, 3207.71]
  - - [3584, 1408, 1, 1280]
    - [143, 9685.4]
  - - [448, 256, 1, 128]
    - [87, 1468.11]
  - - [4288, 448, 1, 128]
    - [89, 2273.68]
  - - [5056, 256, 1, 1280]
    - [139, 9125.11]
  - - [1856, 1408, 1, 3328]
    - [141, 9921.86]
  - - [128, 128, 1, 128]
    - [87, 248.431]
  - - [1024, 4288, 1, 3328]
    - [146, 8979.5]
  - - [448, 2368, 1, 256]
    - [139, 6629.85]
  - - [1024, 4, 1, 128]
    - [152, 51.7616]
  - - [5056, 448, 1, 256]
    - [138, 7599.97]
  - - [2944, 2368, 1, 3328]
    - [136, 9215.95]
  - - [704, 128, 1, 3328]
    - [105, 5163.9]
  - - [64, 64, 1, 3328]
    - [133, 1688.42]
  - - [1024, 1856, 1, 1280]
    - [137, 9175.93]
  - - [6784, 1856, 1, 256]
    - [147, 9878.29]
  - - [128, 2368, 1, 3328]
    - [127, 6426.44]
  - - [1024, 5888, 1, 256]
    - [149, 8539.71]
  - - [5056, 128, 1, 1280]
    - [146, 6941.55]
  - - [5056, 64, 1, 3328]
    - [124, 6452.62]
  - - [128, 704, 1, 128]
    - [87, 1188.72]
  - - [1408, 2368, 1, 256]
    - [146, 9058.59]
  - - [1408, 1408, 1, 256]
    - [136, 8108.01]
  - - [4, 64, 1, 128]
    - [152, 2.50411]
  - - [64, 128, 1, 1280]
    - [128, 1646.09]
  - - [2368, 2368, 1, 128]
    - [89, 3304.77]
  - - [64, 5888, 1, 128]
    - [84, 2855.99]
  - - [5888, 4, 1, 3328]
    - [163, 649.245]
  - - [6784, 1408, 1, 128]
    - [85, 3540.45]
  - - [4288, 5888, 1, 256]
    - [149, 9844.77]
  - - [1408, 5056, 1, 256]
    - [147, 9231.61]
  - - [5056, 128, 1, 3328]
    - [139, 7552.05]
  - - [128, 128, 1, 1280]
    - [129, 2339.89]
  - - [448, 704, 1, 256]
    - [139, 4128.77]
  - - [4288, 3584, 1, 128]
    - [85, 3965.36]
  - - [2944, 128, 1, 3328]
    - [105, 7045.35]
  - - [128, 5056, 1, 1280]
    - [146, 7500.24]
  - - [3584, 5056, 1, 1280]
    - [137, 9474.67]
  - - [256, 448, 1, 1280]
    - [105, 4608.79]
  - - [704, 704, 1, 128]
    - [85, 1744.29]
  - - [5056, 4, 1, 128]
    - [152, 206.879]
  - - [704, 256, 1, 1280]
    - [139, 4506.84]
  - - [64, 2368, 1, 3328]
    - [105, 6223.79]
  - - [1856, 1024, 1, 128]
    - [85, 2919.24]
  - - [1856, 64, 1, 128]
    - [87, 1498.29]
  - - [64, 6784, 1, 1280]
    - [146, 7091.13]
  - - [704, 4288, 1, 256]
    - [139, 8169.63]
  - - [5888, 2368, 1, 1280]
    - [137, 9546.53]
  - - [128, 256, 1, 256]
    - [94, 1415.54]
  - - [256, 64, 1, 1280]
    - [115, 2229.22]
  - - [2368, 5888, 1, 1280]
    - [140, 9521.64]
  - - [5888, 256, 1, 1280]
    - [139, 8823.19]
  - - [4, 5888, 1, 1280]
    - [91, 646.079]
  - - [704, 128, 1, 128]
    - [87, 1188.72]
  - - [1024, 4, 1, 1280]
    - [159, 402.238]
  - - [2368, 1856, 1, 3328]
    - [146, 9140.57]
  - - [2368, 128, 1, 128]
    - [86, 2436.12]
  - - [2944, 704, 1, 256]
    - [139, 8526.96]
  - - [5056, 128, 1, 128]
    - [84, 3298.82]
  - - [256, 704, 1, 3328]
    - [139, 4877.71]
  - - [704, 3584, 1, 256]
    - [146, 8507.09]
  - - [1024, 1024, 1, 1024]
    - [148, 7147.54]
  - - [704, 2944, 1, 3328]
    - [146, 9652.19]
  - - [6784, 1024, 1, 128]
    - [85, 3316.96]
  - - [256, 448, 1, 128]
    - [87, 1457.25]
  - - [448, 1024, 1, 3328]
    - [146, 7914.91]
  - - [2944, 1024, 1, 3328]
    - [144, 9816.58]
  - - [2944, 5056, 1, 128]
    - [85, 3688.64]
  - - [1408, 6784, 1, 256]
    - [142, 9464.04]
  - - [6784, 1408, 1, 3328]
    - [140, 8972.7]
  - - [4288, 6784, 1, 128]
    - [89, 3848.03]
  - - [704, 64, 1, 256]
    - [94, 1588.96]
  - - [5888, 4, 1, 1280]
    - [161, 551.543]
  - - [256, 2368, 1, 3328]
    - [139, 7311.47]
  - - [6784, 2944, 1, 1280]
    - [136, 9426.15]
  - - [4288, 1856, 1, 128]
    - [85, 3827.52]
  - - [1856, 2944, 1, 128]
    - [85, 3366.09]
  - - [6784, 448, 1, 128]
    - [89, 2716.93]
  - - [64, 3584, 1, 128]
    - [86, 2177.83]
  - - [448, 5056, 1, 1280]
    - [138, 8823.23]
  - - [2368, 1856, 1, 128]
    - [85, 3248.32]
  - - [128, 448, 1, 1280]
    - [121, 3629.74]
  - - [4288, 704, 1, 256]
    - [139, 8759.48]
  - - [256, 3584, 1, 128]
    - [135, 2083.41]
  - - [5888, 704, 1, 256]
    - [139, 9308.23]
  - - [3584, 1024, 1, 128]
    - [89, 2997.06]
  - - [256, 5888, 1, 3328]
    - [146, 9472.61]
  - - [1408, 4288, 1, 3328]
    - [144, 9488.14]
  - - [6784, 4288, 1, 256]
    - [142, 9962.54]
  - - [4288, 256, 1, 128]
    - [134, 1769.51]
  - - [5888, 256, 1, 256]
    - [145, 7087.42]
  - - [6784, 1024, 1, 1280]
    - [137, 10004.0]
  - - [5888, 1024, 1, 128]
    - [89, 3225.58]
  - - [1024, 128, 1, 256]
    - [146, 2199.02]
  - - [128, 64, 1, 3328]
    - [118, 2190.78]
  - - [448, 64, 1, 256]
    - [94, 1303.84]
  - - [2944, 704, 1, 1280]
    - [143, 9606.58]
  - - [6784, 3584, 1, 1280]
    - [137, 9416.04]
  - - [1024, 6784, 1, 1280]
    - [151, 9733.89]
  - - [2944, 64, 1, 1280]
    - [125, 4329.52]
  - - [1408, 2944, 1, 1280]
    - [137, 10567.5]
  - - [256, 1856, 1, 256]
    - [146, 5761.51]
  - - [1408, 2368, 1, 3328]
    - [139, 9431.63]
  - - [2944, 4, 1, 3328]
    - [163, 601.302]
  - - [128, 1408, 1, 3328]
    - [106, 6124.8]
  - - [2944, 1856, 1, 128]
    - [85, 3291.01]
  - - [256, 2944, 1, 128]
    - [134, 2034.92]
  - - [256, 6784, 1, 128]
    - [89, 2184.18]
  - - [2368, 4, 1, 128]
    - [152, 113.76]
  - - [1408, 256, 1, 3328]
    - [139, 6242.86]
  - - [1856, 4, 1, 128]
    - [152, 94.4245]
  - - [5056, 6784, 1, 128]
    - [89, 3807.89]
  - - [4288, 5056, 1, 128]
    - [85, 3789.12]
  - - [1856, 5888, 1, 128]
    - [85, 3727.54]
  - - [2944, 5888, 1, 256]
    - [144, 10119.2]
  - - [3584, 1856, 1, 256]
    - [146, 9448.59]
  - - [4288, 3584, 1, 1280]
    - [137, 9950.78]
  - - [2368, 448, 1, 256]
    - [139, 6466.16]
  - - [4288, 256, 1, 3328]
    - [139, 8184.15]
  - - [1856, 704, 1, 128]
    - [85, 2187.86]
  - - [1408, 64, 1, 256]
    - [101, 2177.83]
  - - [64, 1856, 1, 128]
    - [87, 1487.44]
  - - [4, 256, 1, 128]
    - [152, 11.818]
  - - [704, 4288, 1, 3328]
    - [148, 9432.71]
  - - [704, 5888, 1, 128]
    - [89, 2899.94]
  - - [6784, 3584, 1, 128]
    - [85, 3826.77]
  - - [1024, 64, 1, 256]
    - [101, 1629.51]
  - - [64, 2368, 1, 256]
    - [100, 2605.87]
  - - [4288, 5056, 1, 3328]
    - [151, 8815.41]
  - - [4, 1856, 1, 1280]
    - [92, 503.169]
  - - [4288, 128, 1, 128]
    - [86, 2865.41]
  - - [1408, 1408, 1, 128]
    - [85, 2749.38]
  - - [1024, 128, 1, 3328]
    - [126, 6318.33]
  - - [1856, 128, 1, 128]
    - [84, 2306.32]
  - - [5056, 2368, 1, 256]
    - [140, 9886.84]
  - - [4288, 704, 1, 3328]
    - [146, 9293.1]
  - - [448, 3584, 1, 256]
    - [146, 7488.43]
  - - [64, 128, 1, 128]
    - [87, 124.265]
  - - [2368, 64, 1, 1280]
    - [97, 4314.36]
  - - [2368, 1024, 1, 1280]
    - [141, 9396.77]
  - - [2944, 1408, 1, 3328]
    - [136, 10138.2]
  - - [1408, 448, 1, 256]
    - [139, 6021.9]
  - - [1024, 1408, 1, 3328]
    - [150, 8961.74]
  - - [2944, 5888, 1, 1280]
    - [144, 9676.29]
  - - [1408, 4, 1, 1280]
    - [161, 440.449]
  - - [5888, 3584, 1, 256]
    - [147, 10381.3]
  - - [128, 1024, 1, 1280]
    - [105, 5124.24]
  - - [1408, 1856, 1, 3328]
    - [139, 9702.93]
  - - [4, 4, 1, 3328]
    - [163, 8.45787]
  - - [6784, 1408, 1, 1280]
    - [147, 9703.84]
  - - [4, 1024, 1, 1280]
    - [159, 439.699]
  - - [704, 2944, 1, 256]
    - [146, 8557.56]
  - - [704, 4288, 1, 128]
    - [85, 2825.8]
  - - [2368, 4288, 1, 128]
    - [85, 3596.97]
  - - [64, 4288, 1, 1280]
    - [105, 5328.19]
  - - [6784, 64, 1, 1280]
    - [124, 5142.2]
  - - [3584, 128, 1, 128]
    - [84, 2914.4]
  - - [1024, 6784, 1, 128]
    - [89, 2958.13]
  - - [4, 1856, 1, 128]
    - [152, 88.5715]
  - - [1408, 64, 1, 3328]
    - [112, 4967.51]
  - - [6784, 4, 1, 256]
    - [159, 322.368]
  - - [1408, 1408, 1, 1280]
    - [151, 9515.61]
  - - [256, 2368, 1, 256]
    - [139, 5868.37]
  - - [448, 4288, 1, 3328]
    - [141, 8838.3]
  - - [2368, 1408, 1, 256]
    - [146, 9080.03]
  - - [5888, 5056, 1, 128]
    - [89, 3811.63]
  - - [704, 2368, 1, 256]
    - [139, 7817.2]
  - - [2944, 448, 1, 1280]
    - [139, 8136.51]
  - - [5888, 2368, 1, 3328]
    - [136, 9154.66]
  - - [64, 2944, 1, 1280]
    - [97, 5071.28]
  - - [448, 1856, 1, 1280]
    - [139, 7463.82]
  - - [4288, 448, 1, 1280]
    - [143, 8788.61]
  - - [5888, 704, 1, 3328]
    - [143, 9331.53]
  - - [5056, 256, 1, 128]
    - [89, 2029.62]
  - - [1856, 256, 1, 128]
    - [85, 1765.71]
  - - [5056, 128, 1, 256]
    - [139, 4411.4]
  - - [704, 4, 1, 256]
    - [159, 165.046]
  - - [1408, 5888, 1, 128]
    - [85, 3418.18]
  - - [4288, 4, 1, 128]
    - [152, 183.047]
  - - [1408, 1024, 1, 256]
    - [146, 7773.38]
  - - [1024, 1856, 1, 128]
    - [89, 2391.97]
  - - [256, 704, 1, 128]
    - [85, 661.283]
  - - [256, 1024, 1, 128]
    - [89, 939.868]
  - - [448, 1024, 1, 256]
    - [146, 5807.37]
  - - [128, 4, 1, 3328]
    - [163, 237.235]
  - - [5056, 6784, 1, 1280]
    - [137, 9249.79]
  - - [704, 5056, 1, 3328]
    - [141, 9342.97]
  - - [64, 1408, 1, 1280]
    - [97, 3982.4]
  - - [3584, 5056, 1, 3328]
    - [137, 9171.3]
  - - [1856, 4, 1, 3328]
    - [163, 548.677]
  - - [4, 2944, 1, 128]
    - [152, 141.408]
  - - [2368, 2944, 1, 3328]
    - [137, 9482.98]
  - - [448, 448, 1, 1280]
    - [139, 4968.65]
  - - [2368, 3584, 1, 256]
    - [139, 9299.33]
  - - [1024, 256, 1, 1280]
    - [139, 6137.96]
  - - [5056, 3584, 1, 1280]
    - [137, 9565.26]
  - - [448, 4, 1, 3328]
    - [163, 419.405]
  - - [1856, 2944, 1, 1280]
    - [139, 9811.59]
  - - [3584, 2368, 1, 1280]
    - [144, 9413.96]
  - - [128, 1024, 1, 256]
    - [96, 2475.35]
  - - [2944, 1408, 1, 256]
    - [140, 9449.42]
  - - [4288, 1408, 1, 3328]
    - [136, 9784.54]
  - - [3584, 64, 1, 3328]
    - [98, 6108.62]
  - - [1408, 128, 1, 256]
    - [139, 3098.75]
  - - [2944, 1024, 1, 128]
    - [89, 3138.14]
  - - [4288, 5056, 1, 1280]
    - [137, 9300.51]
  - - [5888, 6784, 1, 1280]
    - [151, 9106.05]
  - - [6784, 5056, 1, 128]
    - [85, 3751.26]
  - - [256, 1024, 1, 3328]
    - [146, 6952.42]
  - - [3584, 4, 1, 256]
    - [156, 434.704]
  - - [1856, 64, 1, 3328]
    - [97, 5726.0]
  - - [64, 6784, 1, 128]
    - [90, 2641.79]
  - - [5888, 1408, 1, 3328]
    - [144, 9562.23]
  - - [5888, 64, 1, 1280]
    - [124, 4947.99]
  - - [256, 5056, 1, 256]
    - [145, 7594.47]
  - - [128, 3584, 1, 128]
    - [84, 2936.04]
  - - [448, 3584, 1, 3328]
    - [139, 8304.9]
  - - [704, 2368, 1, 128]
    - [89, 2772.58]
  - - [5888, 256, 1, 128]
    - [85, 2274.84]
  - - [4, 5056, 1, 128]
    - [152, 211.896]
  - - [448, 256, 1, 256]
    - [108, 2387.78]
  - - [704, 4, 1, 3328]
    - [161, 498.181]
  - - [1408, 256, 1, 256]
    - [146, 4648.11]
  - - [3584, 1856, 1, 128]
    - [89, 3261.77]
  - - [4288, 4288, 1, 128]
    - [85, 3647.82]
  - - [1856, 1024, 1, 3328]
    - [141, 9184.23]
  - - [128, 5888, 1, 3328]
    - [146, 9012.48]
  - - [1024, 5056, 1, 256]
    - [149, 8333.72]
  - - [2368, 1408, 1, 3328]
    - [139, 9337.56]
  - - [5888, 448, 1, 256]
    - [139, 8242.44]
  - - [5888, 6784, 1, 128]
    - [89, 3770.11]
  - - [2368, 4, 1, 3328]
    - [163, 584.641]
  - - [6784, 5056, 1, 1280]
    - [137, 9136.57]
  - - [5056, 704, 1, 1280]
    - [139, 9761.22]
  - - [1408, 256, 1, 1280]
    - [139, 5848.3]
  - - [4288, 6784, 1, 1280]
    - [137, 9245.69]
  - - [128, 704, 1, 256]
    - [99, 2133.13]
  - - [1024, 1024, 1, 128]
    - [89, 2645.18]
  - - [448, 128, 1, 1280]
    - [121, 3603.28]
  - - [6784, 4, 1, 3328]
    - [163, 650.994]
  - - [4288, 4, 1, 1280]
    - [161, 534.112]
  - - [1024, 64, 1, 3328]
    - [127, 4292.09]
  - - [1856, 4, 1, 256]
    - [156, 320.813]
  - - [64, 3584, 1, 1280]
    - [139, 5497.27]
  - - [6784, 1408, 1, 256]
    - [147, 9743.37]
  - - [3584, 5888, 1, 128]
    - [89, 3851.81]
  - - [5056, 5888, 1, 256]
    - [151, 10118.2]
  - - [2368, 1024, 1, 256]
    - [146, 8405.29]
  - - [2944, 1856, 1, 256]
    - [146, 9522.62]
  - - [1856, 6784, 1, 1280]
    - [144, 9289.11]
  - - [64, 5056, 1, 128]
    - [86, 2600.72]
  - - [5888, 64, 1, 128]
    - [88, 2420.72]
  - - [448, 704, 1, 128]
    - [134, 1211.16]
  - - [4, 1024, 1, 128]
    - [152, 49.5938]
  - - [4288, 3584, 1, 256]
    - [140, 10201.9]
  - - [1408, 704, 1, 128]
    - [85, 1667.86]
  - - [64, 256, 1, 3328]
    - [129, 3041.74]
  - - [5056, 1856, 1, 1280]
    - [139, 9372.34]
  - - [1408, 1024, 1, 3328]
    - [148, 9198.44]
  - - [2368, 256, 1, 3328]
    - [139, 7287.98]
  - - [5888, 3584, 1, 1280]
    - [137, 9583.8]
  - - [1856, 3584, 1, 3328]
    - [147, 9067.61]
  - - [5888, 128, 1, 1280]
    - [139, 7378.51]
  - - [1024, 2944, 1, 256]
    - [137, 7833.4]
  - - [448, 6784, 1, 1280]
    - [148, 9536.37]
  - - [256, 3584, 1, 1280]
    - [146, 8193.36]
  - - [448, 128, 1, 128]
    - [83, 819.026]
  - - [704, 5056, 1, 256]
    - [139, 8524.67]
  - - [2944, 1856, 1, 1280]
    - [138, 9608.89]
  - - [128, 256, 1, 128]
    - [82, 479.943]
  - - [5056, 256, 1, 256]
    - [138, 7077.73]
  - - [2368, 3584, 1, 3328]
    - [141, 8863.13]
  - - [3584, 5888, 1, 3328]
    - [137, 9032.49]
  - - [128, 4, 1, 256]
    - [159, 41.2464]
  - - [2944, 3584, 1, 1280]
    - [141, 9459.5]
  - - [1856, 5888, 1, 1280]
    - [136, 9876.24]
  - - [256, 256, 1, 1280]
    - [101, 4001.63]
  - - [5056, 448, 1, 3328]
    - [139, 9311.34]
  - - [4288, 1408, 1, 256]
    - [147, 9394.48]
  - - [3584, 64, 1, 256]
    - [109, 2633.65]
  - - [64, 1856, 1, 3328]
    - [97, 6241.67]
  - - [256, 1408, 1, 128]
    - [134, 1248.25]
  - - [5888, 1408, 1, 128]
    - [89, 3456.11]
  - - [4288, 2368, 1, 1280]
    - [147, 9767.68]
  - - [4, 4288, 1, 256]
    - [155, 439.191]
  - - [256, 4288, 1, 128]
    - [135, 1677.21]
  - - [256, 128, 1, 3328]
    - [131, 4011.43]
  - - [6784, 2368, 1, 256]
    - [142, 10064.8]
  - - [5888, 128, 1, 128]
    - [84, 3427.18]
  - - [4288, 1856, 1, 256]
    - [140, 9650.55]
  - - [1856, 256, 1, 3328]
    - [139, 8009.93]
  - - [1856, 2944, 1, 256]
    - [146, 9460.6]
  - - [5056, 1024, 1, 128]
    - [85, 3369.64]
  - - [64, 5888, 1, 1280]
    - [139, 6183.81]
  - - [6784, 256, 1, 128]
    - [85, 2526.14]
  - - [5888, 704, 1, 128]
    - [85, 2793.62]
  - - [6784, 64, 1, 128]
    - [90, 2543.27]
  - - [1024, 4288, 1, 1280]
    - [146, 9002.53]
  - - [2368, 5056, 1, 3328]
    - [151, 9053.16]
  - - [448, 4, 1, 128]
    - [152, 22.3771]
  - - [4, 256, 1, 3328]
    - [163, 348.624]
  - - [4288, 1024, 1, 3328]
    - [146, 9010.26]
  - - [1024, 5056, 1, 3328]
    - [137, 10033.8]
  - - [1024, 1856, 1, 3328]
    - [137, 9462.08]
  - - [704, 704, 1, 1280]
    - [139, 8079.32]
  - - [128, 2368, 1, 1280]
    - [105, 5382.93]
  - - [1408, 128, 1, 3328]
    - [112, 6129.43]
  - - [3584, 256, 1, 1280]
    - [139, 8113.69]
  - - [4, 128, 1, 128]
    - [152, 6.15973]
  - - [704, 6784, 1, 128]
    - [89, 3074.82]
  - - [3584, 128, 1, 1280]
    - [139, 6382.53]
  - - [4, 256, 1, 1280]
    - [161, 252.866]
  - - [128, 704, 1, 3328]
    - [112, 5326.98]
  - - [4288, 6784, 1, 256]
    - [144, 9981.34]
  - - [3584, 2944, 1, 3328]
    - [144, 8795.43]
  - - [128, 1856, 1, 256]
    - [139, 3928.37]
  - - [64, 4288, 1, 256]
    - [139, 3525.79]
  - - [4, 3584, 1, 3328]
    - [156, 675.935]
  - - [64, 4, 1, 3328]
    - [163, 127.889]
  - - [4, 64, 1, 3328]
    - [163, 126.486]
  - - [5888, 2944, 1, 256]
    - [147, 9956.1]
  - - [2368, 6784, 1, 128]
    - [85, 3822.02]
  - - [448, 4288, 1, 1280]
    - [141, 9094.39]
  - - [448, 1856, 1, 3328]
    - [139, 7703.93]
  - - [4, 1024, 1, 256]
    - [159, 221.295]
  - - [5056, 4288, 1, 256]
    - [140, 10107.2]
  - - [1024, 448, 1, 256]
    - [146, 5448.26]
  - - [1024, 3584, 1, 256]
    - [150, 8037.57]
  - - [2944, 128, 1, 1280]
    - [97, 5757.35]
  - - [1856, 5056, 1, 128]
    - [85, 3640.63]
  - - [64, 256, 1, 256]
    - [94, 884.788]
  - - [1408, 4, 1, 128]
    - [152, 72.727]
  - - [128, 2368, 1, 128]
    - [86, 2424.86]
  - - [256, 704, 1, 1280]
    - [139, 4480.89]
  - - [64, 2368, 1, 128]
    - [87, 1711.65]
  - - [6784, 6784, 1, 3328]
    - [136, 8826.09]
  - - [448, 5888, 1, 1280]
    - [137, 8897.26]
  - - [5056, 448, 1, 128]
    - [89, 2440.22]
  - - [3584, 2944, 1, 128]
    - [89, 3634.88]
  - - [6784, 256, 1, 1280]
    - [139, 9174.43]
  - - [256, 2944, 1, 1280]
    - [146, 8705.27]
  - - [64, 4288, 1, 128]
    - [87, 2226.45]
  - - [2368, 5888, 1, 3328]
    - [136, 8961.23]
  - - [4, 64, 1, 256]
    - [159, 20.6732]
  - - [704, 1024, 1, 3328]
    - [139, 8550.08]
  - - [2368, 1856, 1, 1280]
    - [146, 9935.12]
  - - [128, 448, 1, 128]
    - [83, 825.843]
  - - [128, 6784, 1, 256]
    - [146, 6523.89]
  - - [3584, 4288, 1, 128]
    - [89, 3696.56]
  - - [64, 448, 1, 128]
    - [83, 427.194]
  - - [5888, 4288, 1, 3328]
    - [144, 8862.88]
  - - [2368, 704, 1, 256]
    - [146, 7827.81]
  - - [256, 1856, 1, 3328]
    - [139, 8178.73]
  - - [1856, 128, 1, 256]
    - [139, 3891.17]
  - - [6784, 128, 1, 128]
    - [84, 3589.78]
  - - [3584, 1408, 1, 128]
    - [89, 3065.01]
  - - [1856, 5056, 1, 1280]
    - [137, 9339.95]
  - - [2944, 1024, 1, 1280]
    - [136, 10120.9]
  - - [5056, 4, 1, 256]
    - [159, 369.897]
  - - [2368, 4288, 1, 256]
    - [140, 9677.71]
  - - [1024, 2368, 1, 3328]
    - [150, 8578.67]
  - - [64, 704, 1, 3328]
    - [117, 4040.42]
  - - [704, 1408, 1, 256]
    - [146, 7495.9]
  - - [6784, 1856, 1, 3328]
    - [137, 8970.23]
  - - [1024, 2944, 1, 128]
    - [89, 2734.57]
  - - [1024, 3584, 1, 1280]
    - [150, 9797.08]
  - - [4288, 5888, 1, 3328]
    - [137, 8829.0]
  - - [4288, 4, 1, 3328]
    - [163, 628.634]
  - - [256, 1408, 1, 256]
    - [146, 4665.5]
  - - [448, 2944, 1, 1280]
    - [141, 8162.73]
  - - [4, 5888, 1, 128]
    - [152, 231.33]
  - - [1024, 2944, 1, 3328]
    - [137, 9661.13]
  - - [3584, 6784, 1, 256]
    - [151, 9812.78]
  - - [256, 6784, 1, 1280]
    - [146, 8855.01]
  - - [1856, 3584, 1, 256]
    - [147, 9425.37]
  - - [128, 448, 1, 3328]
    - [112, 4709.89]
  - - [6784, 1856, 1, 128]
    - [85, 3656.69]
  - - [4, 448, 1, 256]
    - [156, 121.527]
  - - [2944, 704, 1, 128]
    - [85, 2357.76]
  - - [256, 5888, 1, 1280]
    - [148, 9338.84]
  - - [4, 128, 1, 1280]
    - [161, 132.149]
  - - [4288, 6784, 1, 3328]
    - [137, 8740.06]
  - - [6784, 128, 1, 1280]
    - [139, 7131.58]
  - - [64, 1408, 1, 256]
    - [100, 2240.43]
  - - [2368, 1408, 1, 128]
    - [85, 2968.27]
  - - [1856, 448, 1, 256]
    - [139, 6385.8]
  - - [1408, 1024, 1, 128]
    - [85, 2244.54]
  - - [128, 64, 1, 128]
    - [87, 106.527]
  - - [6784, 3584, 1, 3328]
    - [136, 8947.74]
  - - [2944, 64, 1, 3328]
    - [127, 6007.81]
  - - [64, 64, 1, 128]
    - [82, 53.7191]
  - - [2368, 5056, 1, 1280]
    - [136, 9713.69]
  - - [64, 4, 1, 1280]
    - [161, 68.154]
  - - [1408, 2368, 1, 1280]
    - [146, 9527.49]
  - - [128, 1408, 1, 1280]
    - [106, 4958.92]
  - - [256, 64, 1, 3328]
    - [129, 3016.75]
  - - [2944, 4288, 1, 128]
    - [89, 3495.27]
  - - [2944, 2944, 1, 256]
    - [147, 9718.68]
  - - [2944, 4, 1, 1280]
    - [161, 507.541]
  - - [5888, 4, 1, 256]
    - [159, 344.987]
  - - [6784, 256, 1, 256]
    - [139, 7136.65]
  - - [256, 5056, 1, 3328]
    - [146, 9205.43]
  - - [128, 4288, 1, 1280]
    - [139, 6335.48]
  - - [5056, 1856, 1, 128]
    - [85, 3711.45]
  - - [5888, 1408, 1, 256]
    - [147, 9845.59]
  - - [128, 128, 1, 256]
    - [102, 845.215]
  - - [5056, 4, 1, 3328]
    - [163, 640.406]
  - - [4288, 3584, 1, 3328]
    - [144, 9234.77]
  - - [448, 704, 1, 3328]
    - [139, 5485.77]
  - - [448, 448, 1, 128]
    - [84, 1993.2]
  - - [1024, 2368, 1, 1280]
    - [146, 9087.0]
  - - [1856, 704, 1, 3328]
    - [139, 9307.55]
  - - [4, 2368, 1, 128]
    - [152, 113.76]
  - - [5888, 6784, 1, 3328]
    - [137, 8815.25]
  - - [704, 4288, 1, 1280]
    - [141, 9753.72]
  - - [704, 256, 1, 256]
    - [139, 3068.25]
  - - [6784, 448, 1, 3328]
    - [139, 9063.63]
  - - [4288, 1024, 1, 128]
    - [85, 3231.47]
- null
