library/src/blas3/Tensile/Logic/asm_full/vega10_Cijk_Ailk_Bjlk_SB.yaml
- {MinimumRequiredVersion: 4.1.0}
- vega10
- gfx900
- [Device 6863, Device 6862, Device 687f, Device 6860]
- - - [4096, 7133, 1, 4096]
    - [14, 11349.9]
  - - [512, 16, 1, 512]
    - [3, 595.768]
  - - [2048, 7133, 1, 2048]
    - [13, 11186.2]
  - - [2560, 7133, 1, 2560]
    - [12, 11212.2]
  - - [1024, 1024, 1, 1024]
    - [11, 9268.92]
  - - [3072, 7435, 1, 1024]
    - [12, 10986.5]
  - - [1024, 32, 1, 512]
    - [5, 1572.81]
  - - [1760, 7133, 1, 1760]
    - [9, 10748.5]
  - - [7680, 5481, 1, 2560]
    - [7, 11297.0]
  - - [1024, 16, 1, 512]
    - [0, 936.212]
  - - [512, 32, 1, 512]
    - [4, 1034.77]
- - - -1
    - - - -1
        - - - 4
            - - [704, 17]
              - [3584, 16]
              - [5056, 15]
              - [5888, 16]
              - [-1, 15]
          - - 64
            - - [4, 17]
              - [256, 3]
              - [1024, 1]
              - [1408, 2]
              - [1856, 1]
              - [2368, 2]
              - [3584, 6]
              - [5888, 1]
              - [-1, 10]
          - - 128
            - - [4, 17]
              - [128, 3]
              - [704, 1]
              - [1024, 6]
              - [1408, 2]
              - [1856, 6]
              - [2368, 2]
              - [2944, 6]
              - [3584, 10]
              - [4288, 1]
              - [5056, 6]
              - [5888, 10]
              - [-1, 6]
          - - 256
            - - [4, 17]
              - [64, 3]
              - [128, 2]
              - [448, 1]
              - [5056, 10]
              - [5888, 8]
              - [-1, 10]
          - - 448
            - - [4, 17]
              - [128, 1]
              - [256, 2]
              - [448, 1]
              - [1408, 10]
              - [2368, 8]
              - [2944, 10]
              - [3584, 8]
              - [5056, 10]
              - [5888, 8]
              - [-1, 9]
          - - 704
            - - [4, 17]
              - [64, 1]
              - [128, 2]
              - [448, 8]
              - [1856, 10]
              - [2368, 8]
              - [5888, 9]
              - [-1, 10]
          - - 1024
            - - [4, 17]
              - [64, 1]
              - [128, 6]
              - [704, 8]
              - [1024, 11]
              - [1408, 8]
              - [1856, 14]
              - [2368, 12]
              - [2944, 14]
              - [3584, 12]
              - [4288, 8]
              - [5888, 13]
              - [-1, 14]
          - - 1408
            - - [4, 17]
              - [128, 2]
              - [448, 8]
              - [704, 10]
              - [1024, 12]
              - [1408, 14]
              - [1856, 12]
              - [2368, 8]
              - [5888, 14]
              - [-1, 9]
          - - 1856
            - - [4, 17]
              - [64, 2]
              - [128, 6]
              - [704, 10]
              - [1024, 14]
              - [1856, 9]
              - [2944, 10]
              - [3584, 9]
              - [4288, 13]
              - [5056, 10]
              - [-1, 9]
          - - 2368
            - - [4, 16]
              - [128, 2]
              - [256, 8]
              - [448, 10]
              - [704, 8]
              - [1024, 9]
              - [1856, 8]
              - [2368, 12]
              - [2944, 14]
              - [4288, 9]
              - [5056, 14]
              - [-1, 9]
          - - 2944
            - - [4, 16]
              - [128, 6]
              - [448, 10]
              - [704, 12]
              - [1024, 13]
              - [1408, 14]
              - [1856, 10]
              - [2368, 14]
              - [3584, 9]
              - [4288, 7]
              - [5056, 14]
              - [5888, 13]
              - [-1, 14]
          - - 3584
            - - [4, 16]
              - [64, 6]
              - [256, 8]
              - [448, 10]
              - [704, 12]
              - [1024, 9]
              - [1408, 14]
              - [2368, 12]
              - [2944, 9]
              - [3584, 12]
              - [4288, 14]
              - [5056, 12]
              - [5888, 9]
              - [-1, 12]
          - - 4288
            - - [4, 15]
              - [128, 2]
              - [448, 8]
              - [704, 12]
              - [1024, 9]
              - [1856, 14]
              - [2944, 9]
              - [3584, 14]
              - [-1, 9]
          - - 5056
            - - [4, 15]
              - [128, 6]
              - [448, 8]
              - [704, 11]
              - [1408, 14]
              - [1856, 8]
              - [2368, 14]
              - [4288, 9]
              - [5056, 14]
              - [5888, 9]
              - [-1, 14]
          - - 5888
            - - [4, 16]
              - [64, 6]
              - [448, 8]
              - [704, 7]
              - [1024, 13]
              - [1408, 14]
              - [2368, 7]
              - [-1, 14]
          - - -1
            - - [4, 15]
              - [64, 10]
              - [128, 2]
              - [256, 8]
              - [448, 7]
              - [1024, 14]
              - [1408, 9]
              - [1856, 7]
              - [3584, 14]
              - [5056, 7]
              - [5888, 9]
              - [-1, 14]
