library/src/blas3/Tensile/Logic/asm_full/vega10_Cijk_Alik_Bljk_SB.yaml
- {MinimumRequiredVersion: 4.3.0}
- vega10
- gfx900
- [Device 6863, Device 6862, Device 687f, Device 6860, Device 6861]
    SolutionIndex: 0
    SolutionNameMin: Cijk_Alik_Bljk_SB_MT064x008x64_GRVW04_GSU16_TT04_04_VW04_WG16_02_08
    SolutionIndex: 1
    SolutionNameMin: Cijk_Alik_Bljk_SB_MT064x016x64_GRVW04_GSU32_TT04_04_VW04_WG16_04_04
    SolutionIndex: 2
    SolutionNameMin: Cijk_Alik_Bljk_SB_MT064x016x64_GRVW04_GSU16_TT04_04_VW04_WG16_04_04
    SolutionIndex: 3
    SolutionNameMin: Cijk_Alik_Bljk_SB_MT064x008x64_GRVW04_GSU32_TT04_04_VW04_WG16_02_08
    SolutionIndex: 4
    SolutionNameMin: Cijk_Alik_Bljk_SB_MT048x048x16_GRVW01_GSU08_TT03_03_VW01_WG16_16_01
    SolutionIndex: 5
    SolutionNameMin: Cijk_Alik_Bljk_SB_MT048x096x08_GRVW02_GSU02_TT04_06_VW02_WG12_16_01
    SolutionIndex: 6
    SolutionNameMin: Cijk_Alik_Bljk_SB_MT064x064x16_GRVW04_GSU08_TT04_04_VW04_WG16_16_01
    SolutionIndex: 7
    SolutionNameMin: Cijk_Alik_Bljk_SB_MT036x048x16_GRVW01_GSU08_TT03_03_VW01_WG12_16_01
    SolutionIndex: 8
    SolutionNameMin: Cijk_Alik_Bljk_SB_MT032x016x16_GRVW02_GSU01_TT02_02_VW02_WG16_08_01
    SolutionIndex: 9
    SolutionNameMin: Cijk_Alik_Bljk_SB_MT064x032x16_GRVW04_GSU04_TT08_04_VW04_WG08_08_04
    SolutionIndex: 10
    SolutionNameMin: Cijk_Alik_Bljk_SB_MT032x032x32_GRVW04_GSU02_TT04_04_VW04_WG08_08_04
    SolutionIndex: 11
    SolutionNameMin: Cijk_Alik_Bljk_SB_MT064x032x32_GRVW04_GSU04_TT08_04_VW04_WG08_08_04
    SolutionIndex: 12
    SolutionNameMin: Cijk_Alik_Bljk_SB_MT064x032x32_GRVW04_GSU02_TT08_04_VW04_WG08_08_04
    SolutionIndex: 13
    SolutionNameMin: Cijk_Alik_Bljk_SB_MT016x016x16_GRVW02_GSU04_TT02_02_VW02_WG08_08_02
    SolutionIndex: 14
    SolutionNameMin: Cijk_Alik_Bljk_SB_MT016x016x16_GRVW02_GSU04_TT02_02_VW02_WG08_08_04
    SolutionIndex: 15
    SolutionNameMin: Cijk_Alik_Bljk_SB_MT016x016x16_GRVW02_GSU04_TT02_02_VW02_WG08_08_04
    SolutionIndex: 16
    SolutionNameMin: Cijk_Alik_Bljk_SB_MT032x032x16_GRVW04_GSU02_TT04_04_VW04_WG08_08_02
    SolutionIndex: 17
    SolutionNameMin: Cijk_Alik_Bljk_SB_MT016x016x16_GRVW02_GSU08_TT02_02_VW02_WG08_08_04
    SolutionIndex: 18
    SolutionNameMin: Cijk_Alik_Bljk_SB_MT064x064x16_GRVW04_GSU02_TT08_08_VW04_WG08_08_04
    SolutionIndex: 19
    SolutionNameMin: Cijk_Alik_Bljk_SB_MT032x016x16_GRVW02_GSU04_TT02_02_VW02_WG16_08_02
    SolutionIndex: 20
    SolutionNameMin: Cijk_Alik_Bljk_SB_MT032x016x16_GRVW02_GSU04_TT02_02_VW02_WG16_08_02
    SolutionIndex: 21
    SolutionNameMin: Cijk_Alik_Bljk_SB_MT064x016x32_GRVW04_GSU02_TT04_04_VW04_WG16_04_04
    SolutionIndex: 22
    SolutionNameMin: Cijk_Alik_Bljk_SB_MT064x032x16_GRVW04_GSU02_TT08_04_VW04_WG08_08_02
    SolutionIndex: 23
    SolutionNameMin: Cijk_Alik_Bljk_SB_MT128x064x16_GRVW04_GSU04_TT08_08_VW04_WG16_08_02
    SolutionIndex: 24
    SolutionNameMin: Cijk_Alik_Bljk_SB_MT128x064x16_GRVW04_GSU02_TT08_08_VW04_WG16_08_02
    SolutionIndex: 25
    SolutionNameMin: Cijk_Alik_Bljk_SB_MT064x064x32_GRVW04_GSU02_TT08_08_VW04_WG08_08_04
    SolutionIndex: 26
    SolutionNameMin: Cijk_Alik_Bljk_SB_MT032x016x32_GRVW02_GSU02_TT04_02_VW02_WG08_08_04
    SolutionIndex: 27
    SolutionNameMin: Cijk_Alik_Bljk_SB_MT032x032x16_GRVW04_GSU04_TT04_04_VW04_WG08_08_02
    SolutionIndex: 28
    SolutionNameMin: Cijk_Alik_Bljk_SB_MT032x016x16_GRVW02_GSU04_TT04_02_VW02_WG08_08_04
    SolutionIndex: 29
    SolutionNameMin: Cijk_Alik_Bljk_SB_MT064x064x08_GRVW04_GSU01_TT04_04_VW04_WG16_16_01
    SolutionIndex: 30
    SolutionNameMin: Cijk_Alik_Bljk_SB_MT064x064x08_GRVW04_GSU01_TT04_04_VW04_WG16_16_01
    SolutionIndex: 31
    SolutionNameMin: Cijk_Alik_Bljk_SB_MT128x064x08_GRVW04_GSU01_TT08_04_VW04_WG16_16_01
    SolutionIndex: 32
    SolutionNameMin: Cijk_Alik_Bljk_SB_MT128x128x32_GRVW04_GSU01_TT08_08_VW04_WG16_16_01
    SolutionIndex: 33
    SolutionNameMin: Cijk_Alik_Bljk_SB_MT064x128x16_GRVW04_GSU01_TT04_08_VW04_WG16_16_01
    SolutionIndex: 34
    SolutionNameMin: Cijk_Alik_Bljk_SB_MT064x064x16_GRVW04_GSU01_TT04_04_VW04_WG16_16_01
    SolutionIndex: 35
    SolutionNameMin: Cijk_Alik_Bljk_SB_MT064x128x16_GRVW04_GSU01_TT04_08_VW04_WG16_16_01
    SolutionIndex: 36
    SolutionNameMin: Cijk_Alik_Bljk_SB_MT064x064x16_GRVW04_GSU01_TT04_04_VW04_WG16_16_01
    SolutionIndex: 37
    SolutionNameMin: Cijk_Alik_Bljk_SB_MT128x064x16_GRVW04_GSU01_TT08_04_VW04_WG16_16_01
    SolutionIndex: 38
    SolutionNameMin: Cijk_Alik_Bljk_SB_MT128x128x16_GRVW04_GSU01_TT08_08_VW04_WG16_16_01
    SolutionIndex: 39
    SolutionNameMin: Cijk_Alik_Bljk_SB_MT096x128x16_GRVW02_GSU01_TT06_08_VW02_WG16_16_01
    SolutionIndex: 40
    SolutionNameMin: Cijk_Alik_Bljk_SB_MT128x128x16_GRVW04_GSU01_TT08_08_VW04_WG16_16_01
    SolutionIndex: 41
    SolutionNameMin: Cijk_Alik_Bljk_SB_MT128x096x16_GRVW02_GSU01_TT08_06_VW02_WG16_16_01
    SolutionIndex: 42
    SolutionNameMin: Cijk_Alik_Bljk_SB_MT128x096x16_GRVW02_GSU01_TT08_06_VW02_WG16_16_01
    SolutionIndex: 43
    SolutionNameMin: Cijk_Alik_Bljk_SB_MT128x128x08_GRVW04_GSU01_TT08_08_VW04_WG16_16_01
    SolutionIndex: 44
    SolutionNameMin: Cijk_Alik_Bljk_SB_MT096x128x16_GRVW02_GSU01_TT06_08_VW02_WG16_16_01
    SolutionIndex: 45
    SolutionNameMin: Cijk_Alik_Bljk_SB_MT128x128x08_GRVW04_GSU01_TT08_08_VW04_WG16_16_01
    SolutionIndex: 46
    SolutionNameMin: Cijk_Alik_Bljk_SB_MT128x064x32_GRVW04_GSU01_TT08_04_VW04_WG16_16_01
    SolutionIndex: 47
    SolutionNameMin: Cijk_Alik_Bljk_SB_MT064x064x32_GRVW04_GSU01_TT04_04_VW04_WG16_16_01
    SolutionIndex: 48
    SolutionNameMin: Cijk_Alik_Bljk_SB_MT016x016x04_GRVW02_GSU01_TT02_02_VW02_WG08_08_01
- - - [4096, 7000, 1, 4096]
    - [40, 9224.16]
  - - [7680, 12000, 1, 2560]
    - [39, 10089.4]
  - - [5124, 9124, 1, 1760]
    - [31, 11671.2]
  - - [1760, 32, 1, 1760]
    - [10, 3758.72]
  - - [512, 24000, 1, 1536]
    - [38, 10680.1]
  - - [3072, 24000, 1, 1024]
    - [40, 10094.3]
  - - [2048, 400, 1, 512]
    - [32, 5073.58]
  - - [2560, 7000, 1, 2560]
    - [41, 9881.36]
  - - [3072, 16, 1, 1024]
    - [26, 868.866]
  - - [512, 48000, 1, 2816]
    - [43, 11626.4]
  - - [512, 48000, 1, 2048]
    - [37, 8965.2]
  - - [1760, 64, 1, 1760]
    - [16, 5484.07]
  - - [35, 8457, 1, 4096]
    - [6, 3767.68]
  - - [2048, 1600, 1, 2048]
    - [47, 6805.43]
  - - [512, 48000, 1, 1536]
    - [38, 11139.8]
  - - [2560, 32, 1, 2560]
    - [16, 2836.73]
  - - [8448, 5984, 1, 2816]
    - [45, 11672.2]
  - - [4096, 3200, 1, 1024]
    - [39, 7879.1]
  - - [1024, 24000, 1, 2560]
    - [38, 9695.97]
  - - [1760, 6400, 1, 1760]
    - [45, 11722.5]
  - - [1024, 700, 1, 512]
    - [35, 5468.37]
  - - [4608, 32, 1, 1536]
    - [28, 2870.94]
  - - [3072, 64, 1, 1024]
    - [19, 2507.21]
  - - [16384, 3200, 1, 4096]
    - [38, 8854.09]
  - - [2560, 16, 1, 2560]
    - [15, 1617.75]
  - - [1024, 48000, 1, 2560]
    - [42, 10050.7]
  - - [35, 8457, 1, 2560]
    - [7, 3794.23]
  - - [8448, 48000, 1, 2816]
    - [38, 11839.5]
  - - [2048, 32, 1, 2048]
    - [15, 2159.58]
  - - [2560, 3200, 1, 2560]
    - [40, 10421.7]
  - - [16384, 800, 1, 4096]
    - [40, 7305.08]
  - - [4608, 24000, 1, 1536]
    - [40, 11558.1]
  - - [7680, 48000, 1, 2560]
    - [38, 10950.2]
  - - [3072, 48000, 1, 1024]
    - [40, 10478.3]
  - - [1760, 16, 1, 1760]
    - [13, 2103.95]
  - - [8192, 3200, 1, 2048]
    - [33, 8681.01]
  - - [512, 24000, 1, 2816]
    - [38, 11276.7]
  - - [4096, 400, 1, 1024]
    - [46, 4913.97]
  - - [6144, 48000, 1, 2560]
    - [38, 10638.7]
  - - [4608, 48000, 1, 1536]
    - [40, 11584.5]
  - - [35, 8457, 1, 2048]
    - [4, 3489.72]
  - - [4096, 128, 1, 4096]
    - [23, 5304.68]
  - - [2048, 800, 1, 512]
    - [40, 6921.92]
  - - [4608, 5984, 1, 1536]
    - [40, 11109.9]
  - - [2560, 128, 1, 2560]
    - [27, 5032.99]
  - - [6144, 5984, 1, 2048]
    - [33, 9306.83]
  - - [35, 8457, 1, 1760]
    - [5, 4346.49]
  - - [7680, 24000, 1, 2560]
    - [40, 10325.0]
  - - [6144, 48000, 1, 2048]
    - [33, 9767.97]
  - - [5124, 9124, 1, 2560]
    - [39, 9856.29]
  - - [2048, 3200, 1, 2048]
    - [32, 7657.98]
  - - [2048, 16, 1, 2048]
    - [13, 1219.3]
  - - [1024, 24000, 1, 1536]
    - [38, 11007.0]
  - - [7680, 16, 1, 2560]
    - [21, 1878.19]
  - - [2560, 6400, 1, 2560]
    - [40, 9939.13]
  - - [2048, 128, 1, 2048]
    - [18, 3452.83]
  - - [512, 16, 1, 500000]
    - [2, 2936.34]
  - - [1024, 8, 1, 500000]
    - [0, 1499.71]
  - - [512, 24000, 1, 2560]
    - [42, 9645.21]
  - - [1024, 24000, 1, 2816]
    - [38, 11398.3]
  - - [7680, 5984, 1, 2560]
    - [39, 10009.5]
  - - [2048, 1600, 1, 512]
    - [34, 6639.84]
  - - [2048, 7000, 1, 2048]
    - [33, 8508.44]
  - - [1760, 800, 1, 1760]
    - [31, 9632.31]
  - - [5124, 9124, 1, 4096]
    - [40, 9293.63]
  - - [4096, 64, 1, 4096]
    - [23, 4261.99]
  - - [7680, 32, 1, 2560]
    - [12, 3427.43]
  - - [2560, 64, 1, 2560]
    - [11, 4024.26]
  - - [3072, 128, 1, 1024]
    - [28, 2853.35]
  - - [7680, 64, 1, 2560]
    - [25, 5212.14]
  - - [1760, 128, 1, 1760]
    - [22, 6519.44]
  - - [2560, 1600, 1, 2560]
    - [37, 8616.57]
  - - [2048, 3200, 1, 512]
    - [37, 8078.65]
  - - [2560, 800, 1, 2560]
    - [44, 7628.43]
  - - [3072, 32, 1, 1024]
    - [15, 1795.12]
  - - [6144, 32, 1, 2560]
    - [28, 3183.95]
  - - [4608, 12000, 1, 1536]
    - [40, 11204.4]
  - - [4096, 32, 1, 4096]
    - [9, 2839.94]
  - - [6144, 24000, 1, 2048]
    - [33, 9543.92]
  - - [8192, 800, 1, 2048]
    - [33, 7084.57]
  - - [4096, 1600, 1, 1024]
    - [39, 6947.92]
  - - [5124, 9124, 1, 2048]
    - [33, 9182.63]
  - - [8448, 24000, 1, 2816]
    - [45, 11924.8]
  - - [1024, 48000, 1, 1536]
    - [40, 11309.8]
  - - [7680, 128, 1, 2560]
    - [24, 6196.01]
  - - [8192, 1600, 1, 2048]
    - [33, 7759.98]
  - - [4096, 800, 1, 1024]
    - [32, 5901.12]
  - - [1024, 16, 1, 500000]
    - [1, 2949.65]
  - - [2048, 800, 1, 2048]
    - [47, 5925.04]
  - - [1760, 3200, 1, 1760]
    - [31, 11362.1]
  - - [512, 48000, 1, 2560]
    - [38, 11244.3]
  - - [8448, 16, 1, 2816]
    - [19, 2043.9]
  - - [2048, 64, 1, 2048]
    - [19, 2732.85]
  - - [512, 24000, 1, 2048]
    - [32, 8559.52]
  - - [16384, 1600, 1, 4096]
    - [33, 7897.78]
  - - [4608, 16, 1, 1536]
    - [14, 1544.21]
  - - [1024, 24000, 1, 2048]
    - [38, 8912.28]
  - - [8192, 400, 1, 2048]
    - [32, 5745.79]
  - - [2048, 6400, 1, 2048]
    - [32, 8395.52]
  - - [6144, 12000, 1, 2048]
    - [33, 9303.05]
  - - [512, 8, 1, 500000]
    - [3, 1512.17]
  - - [1760, 7000, 1, 1760]
    - [31, 11248.3]
  - - [1024, 48000, 1, 2816]
    - [38, 11690.8]
  - - [6144, 16, 1, 2560]
    - [20, 1773.11]
  - - [8448, 32, 1, 2816]
    - [21, 3668.96]
  - - [4096, 16, 1, 4096]
    - [9, 1620.64]
  - - [6144, 24000, 1, 2560]
    - [39, 10173.6]
  - - [1024, 1024, 1, 1024]
    - [39, 4546.75]
  - - [8448, 12000, 1, 2816]
    - [45, 11818.0]
  - - [16384, 400, 1, 4096]
    - [33, 6449.92]
  - - [1760, 1600, 1, 1760]
    - [43, 10186.6]
  - - [1024, 48000, 1, 2048]
    - [37, 9178.84]
- - - -1
    - - - 128
        - - - 4
            - - [-1, 48]
          - - 64
            - - [4, 48]
              - [-1, 8]
          - - 128
            - - [4, 48]
              - [2368, 8]
              - [3584, 29]
              - [4288, 8]
              - [-1, 29]
          - - 256
            - - [4, 48]
              - [448, 8]
              - [-1, 29]
          - - 448
            - - [4, 48]
              - [256, 8]
              - [-1, 29]
          - - 704
            - - [4, 48]
              - [128, 8]
              - [1408, 29]
              - [1856, 30]
              - [-1, 29]
          - - 1024
            - - [4, 48]
              - [128, 8]
              - [256, 29]
              - [1856, 30]
              - [-1, 29]
          - - 1856
            - - [4, 48]
              - [128, 8]
              - [-1, 29]
          - - 3584
            - - [4, 48]
              - [64, 8]
              - [-1, 29]
          - - 4288
            - - [4, 48]
              - [128, 8]
              - [256, 30]
              - [704, 29]
              - [1408, 30]
              - [1856, 29]
              - [-1, 30]
          - - 5056
            - - [4, 48]
              - [64, 8]
              - [128, 29]
              - [-1, 30]
          - - 5888
            - - [4, 48]
              - [64, 8]
              - [256, 29]
              - [448, 30]
              - [704, 29]
              - [-1, 30]
          - - -1
            - - [4, 48]
              - [64, 8]
              - [128, 29]
              - [-1, 30]
      - - 256
        - - - 4
            - - [4, 17]
              - [-1, 14]
          - - 64
            - - [128, 14]
              - [256, 26]
              - [704, 14]
              - [1024, 26]
              - [1408, 10]
              - [1856, 36]
              - [3584, 34]
              - [-1, 47]
          - - 128
            - - [128, 14]
              - [256, 26]
              - [448, 14]
              - [704, 16]
              - [2944, 36]
              - [3584, 47]
              - [5056, 36]
              - [5888, 37]
              - [-1, 35]
          - - 256
            - - [64, 14]
              - [128, 26]
              - [256, 14]
              - [448, 34]
              - [1024, 36]
              - [1408, 34]
              - [1856, 47]
              - [2368, 36]
              - [2944, 35]
              - [4288, 37]
              - [5056, 39]
              - [5888, 42]
              - [-1, 38]
          - - 448
            - - [128, 14]
              - [448, 36]
              - [704, 34]
              - [1024, 36]
              - [1408, 34]
              - [1856, 35]
              - [2368, 33]
              - [2944, 42]
              - [3584, 38]
              - [4288, 33]
              - [5056, 37]
              - [5888, 38]
              - [-1, 37]
          - - 704
            - - [128, 14]
              - [1024, 36]
              - [1408, 33]
              - [1856, 42]
              - [2368, 38]
              - [2944, 33]
              - [3584, 38]
              - [4288, 37]
              - [5056, 38]
              - [5888, 37]
              - [-1, 38]
          - - 1024
            - - [64, 14]
              - [256, 34]
              - [448, 36]
              - [704, 34]
              - [1024, 37]
              - [1408, 39]
              - [2944, 38]
              - [3584, 40]
              - [4288, 34]
              - [-1, 38]
          - - 1408
            - - [4, 17]
              - [64, 14]
              - [128, 34]
              - [256, 36]
              - [448, 34]
              - [704, 37]
              - [1024, 39]
              - [1856, 40]
              - [2368, 34]
              - [5056, 38]
              - [5888, 40]
              - [-1, 34]
          - - 1856
            - - [4, 17]
              - [256, 36]
              - [704, 35]
              - [1024, 38]
              - [1408, 40]
              - [1856, 34]
              - [2944, 37]
              - [3584, 34]
              - [4288, 37]
              - [5056, 34]
              - [5888, 40]
              - [-1, 34]
          - - 2368
            - - [4, 14]
              - [64, 34]
              - [128, 36]
              - [256, 34]
              - [448, 35]
              - [1408, 40]
              - [2368, 34]
              - [2944, 40]
              - [5056, 34]
              - [-1, 40]
          - - 2944
            - - [4, 14]
              - [64, 36]
              - [128, 34]
              - [448, 35]
              - [704, 37]
              - [1408, 40]
              - [1856, 34]
              - [2944, 40]
              - [3584, 38]
              - [5056, 34]
              - [5888, 40]
              - [-1, 38]
          - - 3584
            - - [4, 14]
              - [64, 34]
              - [128, 47]
              - [448, 35]
              - [1408, 40]
              - [2944, 34]
              - [3584, 40]
              - [4288, 34]
              - [5056, 40]
              - [-1, 34]
          - - 4288
            - - [4, 14]
              - [64, 19]
              - [256, 34]
              - [448, 37]
              - [704, 35]
              - [1024, 34]
              - [1856, 40]
              - [2944, 34]
              - [5056, 40]
              - [-1, 34]
          - - 5056
            - - [4, 14]
              - [64, 47]
              - [128, 37]
              - [256, 41]
              - [448, 35]
              - [704, 34]
              - [1408, 40]
              - [5056, 34]
              - [5888, 40]
              - [-1, 34]
          - - 5888
            - - [4, 14]
              - [128, 37]
              - [256, 44]
              - [448, 35]
              - [704, 34]
              - [1856, 40]
              - [2368, 34]
              - [-1, 40]
          - - -1
            - - [4, 14]
              - [128, 37]
              - [256, 40]
              - [448, 34]
              - [1024, 40]
              - [1856, 34]
              - [2944, 40]
              - [3584, 34]
              - [5056, 40]
              - [5888, 34]
              - [-1, 40]
      - - 1280
        - - - 4
            - - [256, 17]
              - [1408, 14]
              - [-1, 17]
          - - 64
            - - [64, 17]
              - [128, 14]
              - [256, 28]
              - [1408, 10]
              - [2368, 16]
              - [-1, 10]
          - - 128
            - - [4, 17]
              - [64, 14]
              - [128, 28]
              - [704, 10]
              - [1408, 16]
              - [1856, 22]
              - [2368, 10]
              - [5888, 36]
              - [-1, 35]
          - - 256
            - - [4, 17]
              - [64, 28]
              - [256, 10]
              - [448, 16]
              - [704, 36]
              - [1024, 47]
              - [2368, 36]
              - [2944, 34]
              - [3584, 37]
              - [5056, 34]
              - [5888, 37]
              - [-1, 36]
          - - 448
            - - [4, 14]
              - [128, 10]
              - [448, 16]
              - [704, 34]
              - [1024, 36]
              - [1408, 34]
              - [1856, 35]
              - [2368, 34]
              - [2944, 37]
              - [3584, 38]
              - [4288, 33]
              - [5056, 36]
              - [5888, 38]
              - [-1, 33]
          - - 704
            - - [4, 14]
              - [64, 10]
              - [128, 16]
              - [256, 47]
              - [704, 36]
              - [1024, 34]
              - [1408, 33]
              - [1856, 36]
              - [2368, 38]
              - [5888, 33]
              - [-1, 38]
          - - 1024
            - - [4, 14]
              - [64, 10]
              - [128, 16]
              - [256, 47]
              - [704, 36]
              - [1024, 40]
              - [1408, 33]
              - [1856, 40]
              - [2368, 33]
              - [2944, 40]
              - [3584, 33]
              - [4288, 36]
              - [5888, 38]
              - [-1, 40]
          - - 1408
            - - [4, 14]
              - [64, 10]
              - [128, 16]
              - [448, 34]
              - [704, 37]
              - [1024, 33]
              - [1408, 38]
              - [1856, 37]
              - [2368, 34]
              - [-1, 38]
          - - 1856
            - - [4, 14]
              - [64, 16]
              - [128, 22]
              - [256, 36]
              - [448, 35]
              - [704, 34]
              - [1024, 38]
              - [1408, 33]
              - [1856, 37]
              - [2368, 34]
              - [2944, 37]
              - [4288, 38]
              - [-1, 45]
          - - 2368
            - - [4, 14]
              - [64, 16]
              - [128, 12]
              - [704, 34]
              - [1024, 37]
              - [1856, 34]
              - [2368, 33]
              - [2944, 40]
              - [4288, 33]
              - [5056, 40]
              - [5888, 43]
              - [-1, 40]
          - - 2944
            - - [4, 14]
              - [64, 16]
              - [256, 34]
              - [448, 35]
              - [704, 34]
              - [1408, 40]
              - [1856, 34]
              - [5888, 40]
              - [-1, 43]
          - - 3584
            - - [4, 14]
              - [64, 22]
              - [128, 34]
              - [256, 35]
              - [704, 34]
              - [1024, 37]
              - [1408, 40]
              - [1856, 37]
              - [5888, 40]
              - [-1, 45]
          - - 4288
            - - [4, 14]
              - [128, 27]
              - [256, 34]
              - [704, 37]
              - [1024, 34]
              - [1856, 40]
              - [2368, 37]
              - [3584, 40]
              - [4288, 38]
              - [-1, 45]
          - - 5056
            - - [4, 14]
              - [64, 12]
              - [448, 34]
              - [704, 37]
              - [2944, 40]
              - [3584, 45]
              - [4288, 38]
              - [5056, 40]
              - [-1, 38]
          - - 5888
            - - [4, 14]
              - [64, 12]
              - [128, 34]
              - [256, 35]
              - [448, 40]
              - [704, 34]
              - [2368, 40]
              - [-1, 38]
          - - -1
            - - [4, 14]
              - [64, 12]
              - [128, 37]
              - [256, 40]
              - [448, 37]
              - [1024, 40]
              - [1408, 38]
              - [2368, 40]
              - [-1, 38]
      - - -1
        - - - 4
            - - [1024, 17]
              - [1408, 14]
              - [-1, 17]
          - - 64
            - - [128, 17]
              - [256, 20]
              - [448, 10]
              - [704, 27]
              - [1408, 10]
              - [1856, 25]
              - [2368, 16]
              - [2944, 12]
              - [3584, 16]
              - [4288, 10]
              - [5888, 12]
              - [-1, 34]
          - - 128
            - - [64, 17]
              - [128, 19]
              - [256, 10]
              - [448, 27]
              - [704, 16]
              - [1024, 12]
              - [1408, 16]
              - [1856, 22]
              - [2368, 27]
              - [2944, 12]
              - [3584, 36]
              - [4288, 22]
              - [5888, 36]
              - [-1, 35]
          - - 256
            - - [4, 17]
              - [64, 28]
              - [256, 11]
              - [448, 27]
              - [1024, 47]
              - [1408, 34]
              - [2368, 36]
              - [2944, 34]
              - [3584, 35]
              - [5056, 34]
              - [5888, 33]
              - [-1, 36]
          - - 448
            - - [4, 17]
              - [64, 10]
              - [448, 27]
              - [704, 34]
              - [1024, 36]
              - [1408, 34]
              - [1856, 35]
              - [2368, 34]
              - [2944, 37]
              - [3584, 36]
              - [4288, 33]
              - [5056, 36]
              - [5888, 38]
              - [-1, 33]
          - - 704
            - - [4, 17]
              - [64, 27]
              - [128, 16]
              - [256, 47]
              - [448, 34]
              - [1024, 36]
              - [1408, 33]
              - [2368, 36]
              - [4288, 33]
              - [5056, 35]
              - [5888, 33]
              - [-1, 38]
          - - 1024
            - - [4, 17]
              - [64, 10]
              - [128, 16]
              - [256, 47]
              - [448, 35]
              - [704, 34]
              - [1024, 38]
              - [1408, 33]
              - [1856, 38]
              - [2368, 37]
              - [2944, 38]
              - [3584, 37]
              - [4288, 36]
              - [-1, 38]
          - - 1408
            - - [4, 14]
              - [64, 16]
              - [128, 27]
              - [448, 34]
              - [704, 37]
              - [1024, 33]
              - [1408, 38]
              - [1856, 37]
              - [2368, 36]
              - [-1, 38]
          - - 1856
            - - [4, 14]
              - [64, 16]
              - [128, 22]
              - [256, 34]
              - [448, 37]
              - [704, 34]
              - [1024, 38]
              - [1408, 35]
              - [2944, 37]
              - [-1, 45]
          - - 2368
            - - [4, 14]
              - [128, 27]
              - [704, 34]
              - [1024, 35]
              - [1856, 34]
              - [2368, 35]
              - [3584, 38]
              - [4288, 37]
              - [-1, 43]
          - - 2944
            - - [4, 14]
              - [64, 12]
              - [128, 27]
              - [256, 34]
              - [448, 35]
              - [704, 34]
              - [1024, 40]
              - [1408, 38]
              - [1856, 35]
              - [2944, 40]
              - [3584, 38]
              - [5056, 45]
              - [5888, 43]
              - [-1, 45]
          - - 3584
            - - [4, 14]
              - [64, 22]
              - [128, 34]
              - [256, 38]
              - [448, 34]
              - [1024, 37]
              - [2368, 40]
              - [3584, 43]
              - [5056, 45]
              - [5888, 43]
              - [-1, 45]
          - - 4288
            - - [4, 14]
              - [128, 27]
              - [256, 34]
              - [704, 37]
              - [1024, 34]
              - [1856, 40]
              - [2368, 35]
              - [2944, 45]
              - [4288, 43]
              - [-1, 45]
          - - 5056
            - - [4, 14]
              - [64, 27]
              - [448, 34]
              - [704, 37]
              - [2368, 40]
              - [5056, 45]
              - [5888, 38]
              - [-1, 45]
          - - 5888
            - - [4, 14]
              - [64, 27]
              - [128, 34]
              - [256, 35]
              - [448, 40]
              - [704, 37]
              - [1856, 40]
              - [-1, 45]
          - - -1
            - - [4, 14]
              - [64, 12]
              - [128, 37]
              - [256, 34]
              - [448, 37]
              - [1024, 40]
              - [1408, 45]
              - [1856, 40]
              - [-1, 45]
