library/src/blas3/Tensile/Logic/asm_full/vega20_Cijk_Alik_Bljk_SB.yaml
- {MinimumRequiredVersion: 4.3.0}
- vega20
- gfx906
- [Device 66a0, Device 66a7]
    SolutionIndex: 0
    SolutionNameMin: Cijk_Alik_Bljk_SB_MT128x016x32_GRVW04_GSU16_TT04_04_VW04_WG32_04_02
    SolutionIndex: 1
    SolutionNameMin: Cijk_Alik_Bljk_SB_MT128x008x32_GRVW04_GSU16_TT04_04_VW04_WG32_02_04
    SolutionIndex: 2
    SolutionNameMin: Cijk_Alik_Bljk_SB_MT036x048x16_GRVW01_GSU08_TT03_03_VW01_WG12_16_01
    SolutionIndex: 3
    SolutionNameMin: Cijk_Alik_Bljk_SB_MT036x048x16_GRVW01_GSU04_TT03_03_VW01_WG12_16_01
    SolutionIndex: 4
    SolutionNameMin: Cijk_Alik_Bljk_SB_MT032x016x16_GRVW02_GSU01_TT02_02_VW02_WG16_08_01
    SolutionIndex: 5
    SolutionNameMin: Cijk_Alik_Bljk_SB_MT032x032x16_GRVW04_GSU02_TT04_04_VW04_WG08_08_02
    SolutionIndex: 6
    SolutionNameMin: Cijk_Alik_Bljk_SB_MT032x032x16_GRVW04_GSU02_TT04_04_VW04_WG08_08_02
    SolutionIndex: 7
    SolutionNameMin: Cijk_Alik_Bljk_SB_MT064x032x32_GRVW04_GSU02_TT08_04_VW04_WG08_08_04
    SolutionIndex: 8
    SolutionNameMin: Cijk_Alik_Bljk_SB_MT128x032x32_GRVW04_GSU02_TT08_08_VW04_WG16_04_04
    SolutionIndex: 9
    SolutionNameMin: Cijk_Alik_Bljk_SB_MT032x032x16_GRVW04_GSU04_TT04_04_VW04_WG08_08_02
    SolutionIndex: 10
    SolutionNameMin: Cijk_Alik_Bljk_SB_MT016x016x16_GRVW02_GSU04_TT02_02_VW02_WG08_08_04
    SolutionIndex: 11
    SolutionNameMin: Cijk_Alik_Bljk_SB_MT016x016x16_GRVW02_GSU04_TT02_02_VW02_WG08_08_04
    SolutionIndex: 12
    SolutionNameMin: Cijk_Alik_Bljk_SB_MT016x016x16_GRVW02_GSU08_TT02_02_VW02_WG08_08_04
    SolutionIndex: 13
    SolutionNameMin: Cijk_Alik_Bljk_SB_MT032x016x16_GRVW02_GSU04_TT04_02_VW02_WG08_08_02
    SolutionIndex: 14
    SolutionNameMin: Cijk_Alik_Bljk_SB_MT032x016x16_GRVW02_GSU04_TT04_02_VW02_WG08_08_02
    SolutionIndex: 15
    SolutionNameMin: Cijk_Alik_Bljk_SB_MT064x032x16_GRVW04_GSU04_TT08_04_VW04_WG08_08_04
    SolutionIndex: 16
    SolutionNameMin: Cijk_Alik_Bljk_SB_MT128x064x16_GRVW04_GSU04_TT08_08_VW04_WG16_08_02
    SolutionIndex: 17
    SolutionNameMin: Cijk_Alik_Bljk_SB_MT128x064x16_GRVW04_GSU02_TT08_08_VW04_WG16_08_02
    SolutionIndex: 18
    SolutionNameMin: Cijk_Alik_Bljk_SB_MT128x064x16_GRVW04_GSU02_TT08_08_VW04_WG16_08_02
    SolutionIndex: 19
    SolutionNameMin: Cijk_Alik_Bljk_SB_MT128x064x32_GRVW04_GSU04_TT08_08_VW04_WG16_08_02
    SolutionIndex: 20
    SolutionNameMin: Cijk_Alik_Bljk_SB_MT064x032x16_GRVW04_GSU04_TT04_04_VW04_WG16_08_02
    SolutionIndex: 21
    SolutionNameMin: Cijk_Alik_Bljk_SB_MT032x016x16_GRVW02_GSU04_TT04_02_VW02_WG08_08_04
    SolutionIndex: 22
    SolutionNameMin: Cijk_Alik_Bljk_SB_MT032x016x16_GRVW02_GSU04_TT04_02_VW02_WG08_08_04
    SolutionIndex: 23
    SolutionNameMin: Cijk_Alik_Bljk_SB_MT032x016x16_GRVW02_GSU08_TT04_02_VW02_WG08_08_04
    SolutionIndex: 24
    SolutionNameMin: Cijk_Alik_Bljk_SB_MT064x032x16_GRVW04_GSU02_TT08_04_VW04_WG08_08_02
    SolutionIndex: 25
    SolutionNameMin: Cijk_Alik_Bljk_SB_MT064x064x24_GRVW04_GSU04_TT08_08_VW04_WG08_08_02
    SolutionIndex: 26
    SolutionNameMin: Cijk_Alik_Bljk_SB_MT064x016x32_GRVW02_GSU04_TT04_02_VW02_WG16_08_02
    SolutionIndex: 27
    SolutionNameMin: Cijk_Alik_Bljk_SB_MT064x032x32_GRVW04_GSU04_TT04_04_VW04_WG16_08_02
    SolutionIndex: 28
    SolutionNameMin: Cijk_Alik_Bljk_SB_MT128x016x32_GRVW04_GSU02_TT04_04_VW04_WG32_04_02
    SolutionIndex: 29
    SolutionNameMin: Cijk_Alik_Bljk_SB_MT064x128x08_GRVW04_GSU01_TT04_08_VW04_WG16_16_01
    SolutionIndex: 30
    SolutionNameMin: Cijk_Alik_Bljk_SB_MT064x064x08_GRVW04_GSU01_TT04_04_VW04_WG16_16_01
    SolutionIndex: 31
    SolutionNameMin: Cijk_Alik_Bljk_SB_MT064x064x16_GRVW04_GSU01_TT04_04_VW04_WG16_16_01
    SolutionIndex: 32
    SolutionNameMin: Cijk_Alik_Bljk_SB_MT064x128x16_GRVW04_GSU01_TT04_08_VW04_WG16_16_01
    SolutionIndex: 33
    SolutionNameMin: Cijk_Alik_Bljk_SB_MT064x064x16_GRVW04_GSU01_TT04_04_VW04_WG16_16_01
    SolutionIndex: 34
    SolutionNameMin: Cijk_Alik_Bljk_SB_MT064x064x16_GRVW04_GSU01_TT04_04_VW04_WG16_16_01
    SolutionIndex: 35
    SolutionNameMin: Cijk_Alik_Bljk_SB_MT128x128x08_GRVW04_GSU01_TT08_08_VW04_WG16_16_01
    SolutionIndex: 36
    SolutionNameMin: Cijk_Alik_Bljk_SB_MT128x128x08_GRVW04_GSU01_TT08_08_VW04_WG16_16_01
    SolutionIndex: 37
    SolutionNameMin: Cijk_Alik_Bljk_SB_MT128x096x16_GRVW02_GSU01_TT08_06_VW02_WG16_16_01
    SolutionIndex: 38
    SolutionNameMin: Cijk_Alik_Bljk_SB_MT064x064x32_GRVW04_GSU01_TT04_04_VW04_WG16_16_01
    SolutionIndex: 39
    SolutionNameMin: Cijk_Alik_Bljk_SB_MT064x064x32_GRVW04_GSU01_TT04_04_VW04_WG16_16_01
    SolutionIndex: 40
    SolutionNameMin: Cijk_Alik_Bljk_SB_MT064x128x16_GRVW04_GSU01_TT04_08_VW04_WG16_16_01
    SolutionIndex: 41
    SolutionNameMin: Cijk_Alik_Bljk_SB_MT128x064x32_GRVW04_GSU01_TT08_04_VW04_WG16_16_01
    SolutionIndex: 42
    SolutionNameMin: Cijk_Alik_Bljk_SB_MT128x128x16_GRVW04_GSU01_TT08_08_VW04_WG16_16_01
    SolutionIndex: 43
    SolutionNameMin: Cijk_Alik_Bljk_SB_MT128x128x16_GRVW04_GSU01_TT08_08_VW04_WG16_16_01
    SolutionIndex: 44
    SolutionNameMin: Cijk_Alik_Bljk_SB_MT128x064x16_GRVW04_GSU01_TT08_04_VW04_WG16_16_01
    SolutionIndex: 45
    SolutionNameMin: Cijk_Alik_Bljk_SB_MT128x064x16_GRVW04_GSU01_TT08_04_VW04_WG16_16_01
    SolutionIndex: 46
    SolutionNameMin: Cijk_Alik_Bljk_SB_MT128x064x08_GRVW04_GSU01_TT08_04_VW04_WG16_16_01
    SolutionIndex: 47
    SolutionNameMin: Cijk_Alik_Bljk_SB_MT016x016x04_GRVW02_GSU01_TT02_02_VW02_WG08_08_01
- - - [4096, 7000, 1, 4096]
    - [43, 8268.62]
  - - [7680, 12000, 1, 2560]
    - [42, 8791.33]
  - - [5124, 9124, 1, 1760]
    - [46, 8809.71]
  - - [1760, 32, 1, 1760]
    - [9, 3128.84]
  - - [512, 24000, 1, 1536]
    - [43, 8387.89]
  - - [3072, 24000, 1, 1024]
    - [43, 8461.22]
  - - [2048, 400, 1, 512]
    - [43, 4347.26]
  - - [2560, 7000, 1, 2560]
    - [43, 8322.79]
  - - [3072, 16, 1, 1024]
    - [11, 1125.47]
  - - [512, 48000, 1, 2816]
    - [36, 8720.66]
  - - [512, 48000, 1, 2048]
    - [43, 8078.18]
  - - [1760, 64, 1, 1760]
    - [6, 4339.85]
  - - [35, 8457, 1, 4096]
    - [2, 3672.09]
  - - [2048, 1600, 1, 2048]
    - [39, 5343.33]
  - - [512, 48000, 1, 1536]
    - [43, 8521.81]
  - - [2560, 32, 1, 2560]
    - [20, 3189.05]
  - - [8448, 5984, 1, 2816]
    - [35, 8878.57]
  - - [4096, 3200, 1, 1024]
    - [43, 7202.89]
  - - [1024, 24000, 1, 2560]
    - [42, 8553.26]
  - - [1760, 6400, 1, 1760]
    - [35, 8876.15]
  - - [1024, 700, 1, 512]
    - [40, 4283.32]
  - - [4608, 32, 1, 1536]
    - [6, 2704.03]
  - - [3072, 64, 1, 1024]
    - [18, 2069.53]
  - - [16384, 3200, 1, 4096]
    - [42, 8336.2]
  - - [2560, 16, 1, 2560]
    - [14, 1930.35]
  - - [1024, 48000, 1, 2560]
    - [43, 8798.37]
  - - [35, 8457, 1, 2560]
    - [2, 3608.27]
  - - [8448, 48000, 1, 2816]
    - [36, 9031.61]
  - - [2048, 32, 1, 2048]
    - [27, 1811.77]
  - - [2560, 3200, 1, 2560]
    - [43, 8291.64]
  - - [16384, 800, 1, 4096]
    - [43, 7100.31]
  - - [4608, 24000, 1, 1536]
    - [43, 8808.07]
  - - [7680, 48000, 1, 2560]
    - [42, 8907.3]
  - - [3072, 48000, 1, 1024]
    - [43, 8679.9]
  - - [1760, 16, 1, 1760]
    - [23, 2173.75]
  - - [8192, 3200, 1, 2048]
    - [43, 8049.6]
  - - [512, 24000, 1, 2816]
    - [42, 8596.81]
  - - [4096, 400, 1, 1024]
    - [41, 3756.26]
  - - [6144, 48000, 1, 2560]
    - [42, 8890.9]
  - - [4608, 48000, 1, 1536]
    - [42, 8875.1]
  - - [35, 8457, 1, 2048]
    - [2, 3008.08]
  - - [4096, 128, 1, 4096]
    - [18, 4695.32]
  - - [2048, 800, 1, 512]
    - [42, 5661.78]
  - - [4608, 5984, 1, 1536]
    - [43, 8509.91]
  - - [2560, 128, 1, 2560]
    - [25, 3898.0]
  - - [6144, 5984, 1, 2048]
    - [43, 8237.11]
  - - [35, 8457, 1, 1760]
    - [3, 3805.84]
  - - [7680, 24000, 1, 2560]
    - [42, 8849.35]
  - - [6144, 48000, 1, 2048]
    - [43, 8798.37]
  - - [5124, 9124, 1, 2560]
    - [42, 8415.12]
  - - [2048, 3200, 1, 2048]
    - [40, 6597.06]
  - - [2048, 16, 1, 2048]
    - [26, 1069.97]
  - - [1024, 24000, 1, 1536]
    - [43, 8488.08]
  - - [7680, 16, 1, 2560]
    - [28, 2466.81]
  - - [2560, 6400, 1, 2560]
    - [42, 8497.25]
  - - [2048, 128, 1, 2048]
    - [19, 3009.32]
  - - [512, 16, 1, 500000]
    - [0, 3418.53]
  - - [1024, 8, 1, 500000]
    - [1, 1895.08]
  - - [512, 24000, 1, 2560]
    - [43, 8426.78]
  - - [1024, 24000, 1, 2816]
    - [42, 8648.9]
  - - [7680, 5984, 1, 2560]
    - [43, 8638.84]
  - - [2048, 1600, 1, 512]
    - [45, 5317.25]
  - - [2048, 7000, 1, 2048]
    - [43, 7435.85]
  - - [1760, 800, 1, 1760]
    - [46, 7315.91]
  - - [5124, 9124, 1, 4096]
    - [43, 8313.52]
  - - [4096, 64, 1, 4096]
    - [16, 3968.53]
  - - [7680, 32, 1, 2560]
    - [8, 3741.3]
  - - [2560, 64, 1, 2560]
    - [5, 3535.28]
  - - [3072, 128, 1, 1024]
    - [17, 2514.03]
  - - [7680, 64, 1, 2560]
    - [17, 4756.1]
  - - [1760, 128, 1, 1760]
    - [24, 5114.65]
  - - [2560, 1600, 1, 2560]
    - [44, 6990.03]
  - - [2048, 3200, 1, 512]
    - [43, 6760.55]
  - - [2560, 800, 1, 2560]
    - [33, 6089.49]
  - - [3072, 32, 1, 1024]
    - [10, 1651.27]
  - - [6144, 32, 1, 2560]
    - [6, 3362.56]
  - - [4608, 12000, 1, 1536]
    - [43, 8736.57]
  - - [4096, 32, 1, 4096]
    - [15, 2514.35]
  - - [6144, 24000, 1, 2048]
    - [43, 8712.37]
  - - [8192, 800, 1, 2048]
    - [33, 6147.89]
  - - [4096, 1600, 1, 1024]
    - [34, 5969.18]
  - - [5124, 9124, 1, 2048]
    - [43, 8192.11]
  - - [8448, 24000, 1, 2816]
    - [35, 8988.66]
  - - [1024, 48000, 1, 1536]
    - [42, 8725.81]
  - - [7680, 128, 1, 2560]
    - [18, 5226.25]
  - - [8192, 1600, 1, 2048]
    - [43, 7086.97]
  - - [4096, 800, 1, 1024]
    - [37, 4783.04]
  - - [1024, 16, 1, 500000]
    - [0, 3473.49]
  - - [2048, 800, 1, 2048]
    - [38, 4561.44]
  - - [1760, 3200, 1, 1760]
    - [46, 8591.2]
  - - [512, 48000, 1, 2560]
    - [42, 8577.05]
  - - [8448, 16, 1, 2816]
    - [13, 2633.01]
  - - [2048, 64, 1, 2048]
    - [19, 2339.89]
  - - [512, 24000, 1, 2048]
    - [43, 7276.28]
  - - [16384, 1600, 1, 4096]
    - [43, 7881.37]
  - - [4608, 16, 1, 1536]
    - [22, 1925.94]
  - - [1024, 24000, 1, 2048]
    - [42, 7979.92]
  - - [8192, 400, 1, 2048]
    - [33, 5014.64]
  - - [2048, 6400, 1, 2048]
    - [43, 7260.25]
  - - [6144, 12000, 1, 2048]
    - [43, 8528.85]
  - - [512, 8, 1, 500000]
    - [1, 1885.24]
  - - [1760, 7000, 1, 1760]
    - [46, 8485.79]
  - - [1024, 48000, 1, 2816]
    - [42, 8865.53]
  - - [6144, 16, 1, 2560]
    - [21, 2311.3]
  - - [8448, 32, 1, 2816]
    - [7, 4082.23]
  - - [4096, 16, 1, 4096]
    - [15, 1567.21]
  - - [6144, 24000, 1, 2560]
    - [42, 8861.96]
  - - [1024, 1024, 1, 1024]
    - [42, 3969.71]
  - - [8448, 12000, 1, 2816]
    - [35, 8942.47]
  - - [16384, 400, 1, 4096]
    - [44, 6276.46]
  - - [1760, 1600, 1, 1760]
    - [35, 7732.29]
  - - [1024, 48000, 1, 2048]
    - [42, 8407.38]
- - - -1
    - - - 128
        - - - 4
            - - [-1, 47]
          - - 64
            - - [4, 47]
              - [5888, 4]
              - [-1, 30]
          - - 128
            - - [4, 47]
              - [2368, 4]
              - [4288, 30]
              - [5056, 4]
              - [5888, 31]
              - [-1, 29]
          - - 256
            - - [4, 47]
              - [448, 4]
              - [704, 30]
              - [1024, 31]
              - [2944, 30]
              - [3584, 29]
              - [5056, 31]
              - [5888, 30]
              - [-1, 29]
          - - 448
            - - [4, 47]
              - [448, 4]
              - [1408, 30]
              - [1856, 29]
              - [3584, 30]
              - [4288, 29]
              - [5888, 30]
              - [-1, 29]
          - - 704
            - - [4, 47]
              - [128, 4]
              - [1024, 30]
              - [1408, 29]
              - [1856, 30]
              - [2368, 31]
              - [2944, 30]
              - [3584, 29]
              - [4288, 30]
              - [5888, 29]
              - [-1, 30]
          - - 1024
            - - [4, 47]
              - [128, 4]
              - [704, 30]
              - [1024, 29]
              - [4288, 31]
              - [5888, 32]
              - [-1, 31]
          - - 1408
            - - [4, 47]
              - [128, 4]
              - [704, 30]
              - [1024, 31]
              - [1408, 29]
              - [2368, 30]
              - [-1, 29]
          - - 1856
            - - [4, 47]
              - [128, 4]
              - [256, 30]
              - [448, 29]
              - [704, 30]
              - [1856, 29]
              - [2944, 30]
              - [4288, 29]
              - [5056, 30]
              - [-1, 29]
          - - 2368
            - - [4, 47]
              - [64, 4]
              - [448, 30]
              - [1024, 29]
              - [1856, 30]
              - [2944, 29]
              - [3584, 30]
              - [-1, 29]
          - - 2944
            - - [4, 47]
              - [64, 4]
              - [704, 30]
              - [1408, 29]
              - [1856, 31]
              - [-1, 32]
          - - 3584
            - - [4, 47]
              - [64, 4]
              - [128, 30]
              - [256, 29]
              - [2368, 31]
              - [-1, 32]
          - - 4288
            - - [4, 47]
              - [64, 4]
              - [128, 30]
              - [704, 31]
              - [1408, 29]
              - [1856, 32]
              - [2368, 29]
              - [-1, 32]
          - - 5056
            - - [4, 47]
              - [128, 30]
              - [448, 31]
              - [704, 30]
              - [1408, 29]
              - [-1, 32]
          - - 5888
            - - [4, 47]
              - [64, 30]
              - [128, 31]
              - [256, 29]
              - [704, 31]
              - [-1, 32]
          - - -1
            - - [4, 47]
              - [64, 30]
              - [128, 29]
              - [448, 31]
              - [-1, 32]
      - - 256
        - - - 4
            - - [-1, 11]
          - - 64
            - - [64, 11]
              - [128, 10]
              - [1408, 11]
              - [4288, 34]
              - [5888, 33]
              - [-1, 34]
          - - 128
            - - [128, 11]
              - [256, 10]
              - [704, 11]
              - [3584, 34]
              - [4288, 33]
              - [5056, 34]
              - [5888, 40]
              - [-1, 45]
          - - 256
            - - [256, 11]
              - [1024, 34]
              - [1408, 33]
              - [2368, 34]
              - [3584, 45]
              - [4288, 39]
              - [5888, 37]
              - [-1, 42]
          - - 448
            - - [4, 11]
              - [64, 10]
              - [128, 11]
              - [448, 34]
              - [704, 33]
              - [1408, 34]
              - [1856, 40]
              - [2944, 45]
              - [3584, 42]
              - [4288, 40]
              - [5056, 45]
              - [5888, 42]
              - [-1, 40]
          - - 704
            - - [64, 11]
              - [128, 10]
              - [704, 34]
              - [1024, 33]
              - [1408, 40]
              - [1856, 45]
              - [2368, 43]
              - [2944, 40]
              - [3584, 43]
              - [4288, 40]
              - [5056, 42]
              - [5888, 40]
              - [-1, 43]
          - - 1024
            - - [64, 11]
              - [704, 34]
              - [1024, 45]
              - [1408, 37]
              - [1856, 43]
              - [2368, 45]
              - [2944, 42]
              - [3584, 43]
              - [5888, 42]
              - [-1, 43]
          - - 1408
            - - [64, 11]
              - [448, 34]
              - [704, 45]
              - [1024, 37]
              - [1408, 43]
              - [1856, 42]
              - [2368, 33]
              - [2944, 42]
              - [4288, 43]
              - [5056, 42]
              - [5888, 43]
              - [-1, 42]
          - - 1856
            - - [4, 11]
              - [128, 34]
              - [256, 40]
              - [448, 45]
              - [704, 37]
              - [1024, 42]
              - [1408, 43]
              - [1856, 45]
              - [2368, 44]
              - [2944, 43]
              - [3584, 42]
              - [4288, 43]
              - [5056, 42]
              - [-1, 43]
          - - 2368
            - - [4, 11]
              - [128, 34]
              - [256, 33]
              - [448, 40]
              - [1024, 42]
              - [1856, 45]
              - [2944, 42]
              - [4288, 43]
              - [5056, 42]
              - [-1, 43]
          - - 2944
            - - [4, 11]
              - [64, 34]
              - [128, 33]
              - [256, 40]
              - [448, 37]
              - [704, 44]
              - [1408, 42]
              - [1856, 43]
              - [2368, 42]
              - [5888, 43]
              - [-1, 42]
          - - 3584
            - - [4, 11]
              - [64, 34]
              - [128, 33]
              - [256, 45]
              - [704, 42]
              - [1024, 43]
              - [5056, 42]
              - [-1, 43]
          - - 4288
            - - [4, 11]
              - [128, 33]
              - [256, 40]
              - [448, 44]
              - [704, 45]
              - [1024, 33]
              - [1408, 43]
              - [1856, 42]
              - [-1, 43]
          - - 5056
            - - [4, 11]
              - [64, 33]
              - [128, 34]
              - [256, 37]
              - [704, 42]
              - [1024, 43]
              - [2368, 42]
              - [-1, 43]
          - - 5888
            - - [4, 11]
              - [64, 34]
              - [128, 40]
              - [448, 42]
              - [704, 33]
              - [1408, 43]
              - [2368, 42]
              - [2944, 43]
              - [3584, 42]
              - [5888, 43]
              - [-1, 42]
          - - -1
            - - [4, 11]
              - [64, 39]
              - [128, 40]
              - [256, 42]
              - [448, 44]
              - [2368, 43]
              - [5888, 42]
              - [-1, 43]
      - - 1280
        - - - 4
            - - [256, 12]
              - [1024, 11]
              - [2368, 12]
              - [3584, 11]
              - [4288, 12]
              - [-1, 11]
          - - 64
            - - [64, 12]
              - [128, 11]
              - [256, 21]
              - [448, 14]
              - [704, 9]
              - [3584, 6]
              - [4288, 33]
              - [-1, 34]
          - - 128
            - - [4, 12]
              - [64, 11]
              - [256, 21]
              - [448, 22]
              - [1408, 6]
              - [1856, 24]
              - [3584, 34]
              - [4288, 33]
              - [5056, 34]
              - [5888, 33]
              - [-1, 40]
          - - 256
            - - [4, 12]
              - [64, 22]
              - [128, 21]
              - [256, 6]
              - [448, 7]
              - [1024, 39]
              - [1408, 33]
              - [2368, 34]
              - [2944, 33]
              - [3584, 45]
              - [5056, 34]
              - [5888, 45]
              - [-1, 42]
          - - 448
            - - [4, 12]
              - [64, 13]
              - [128, 9]
              - [256, 6]
              - [448, 5]
              - [704, 33]
              - [1024, 34]
              - [1408, 33]
              - [1856, 40]
              - [2368, 34]
              - [2944, 44]
              - [3584, 42]
              - [4288, 40]
              - [5056, 34]
              - [5888, 42]
              - [-1, 40]
          - - 704
            - - [4, 12]
              - [64, 9]
              - [128, 6]
              - [256, 39]
              - [704, 34]
              - [1024, 33]
              - [1408, 40]
              - [1856, 34]
              - [2368, 42]
              - [5888, 40]
              - [-1, 42]
          - - 1024
            - - [4, 11]
              - [128, 6]
              - [256, 38]
              - [448, 33]
              - [704, 34]
              - [1408, 45]
              - [1856, 43]
              - [2368, 44]
              - [2944, 43]
              - [4288, 45]
              - [5056, 43]
              - [-1, 42]
          - - 1408
            - - [4, 12]
              - [64, 6]
              - [128, 5]
              - [448, 33]
              - [1024, 44]
              - [1408, 42]
              - [1856, 45]
              - [2368, 33]
              - [-1, 42]
          - - 1856
            - - [4, 12]
              - [64, 6]
              - [128, 39]
              - [448, 44]
              - [704, 33]
              - [1024, 42]
              - [1408, 40]
              - [1856, 44]
              - [2368, 45]
              - [2944, 44]
              - [3584, 40]
              - [-1, 42]
          - - 2368
            - - [4, 12]
              - [64, 5]
              - [128, 34]
              - [256, 33]
              - [448, 34]
              - [704, 33]
              - [1024, 45]
              - [1408, 33]
              - [1856, 45]
              - [2368, 40]
              - [3584, 42]
              - [4288, 40]
              - [-1, 42]
          - - 2944
            - - [4, 11]
              - [64, 5]
              - [256, 34]
              - [448, 40]
              - [704, 44]
              - [1408, 42]
              - [1856, 40]
              - [2368, 42]
              - [2944, 43]
              - [3584, 42]
              - [4288, 43]
              - [5056, 42]
              - [5888, 43]
              - [-1, 42]
          - - 3584
            - - [4, 11]
              - [64, 24]
              - [128, 34]
              - [256, 44]
              - [448, 33]
              - [704, 45]
              - [1024, 40]
              - [1408, 42]
              - [1856, 44]
              - [2944, 42]
              - [3584, 43]
              - [-1, 42]
          - - 4288
            - - [4, 11]
              - [64, 5]
              - [256, 33]
              - [704, 45]
              - [1024, 40]
              - [1856, 43]
              - [2368, 44]
              - [3584, 43]
              - [5056, 42]
              - [5888, 43]
              - [-1, 42]
          - - 5056
            - - [4, 11]
              - [64, 34]
              - [448, 33]
              - [704, 45]
              - [1024, 42]
              - [4288, 43]
              - [5056, 42]
              - [-1, 43]
          - - 5888
            - - [4, 11]
              - [128, 34]
              - [256, 40]
              - [448, 42]
              - [704, 45]
              - [1408, 43]
              - [1856, 42]
              - [5056, 43]
              - [-1, 42]
          - - -1
            - - [4, 11]
              - [64, 33]
              - [128, 40]
              - [256, 42]
              - [448, 44]
              - [704, 42]
              - [5056, 43]
              - [5888, 42]
              - [-1, 43]
      - - -1
        - - - 4
            - - [448, 12]
              - [1024, 11]
              - [2944, 12]
              - [3584, 11]
              - [-1, 12]
          - - 64
            - - [64, 12]
              - [256, 23]
              - [1024, 9]
              - [1408, 20]
              - [1856, 25]
              - [2368, 5]
              - [2944, 6]
              - [3584, 24]
              - [4288, 20]
              - [5056, 7]
              - [5888, 25]
              - [-1, 34]
          - - 128
            - - [4, 12]
              - [128, 23]
              - [256, 22]
              - [448, 9]
              - [704, 20]
              - [1024, 6]
              - [1856, 24]
              - [2368, 20]
              - [2944, 25]
              - [3584, 34]
              - [4288, 20]
              - [5888, 33]
              - [-1, 44]
          - - 256
            - - [4, 12]
              - [64, 23]
              - [128, 9]
              - [256, 20]
              - [448, 25]
              - [1024, 39]
              - [1856, 33]
              - [2368, 34]
              - [2944, 33]
              - [3584, 40]
              - [5056, 33]
              - [5888, 45]
              - [-1, 34]
          - - 448
            - - [4, 12]
              - [64, 23]
              - [128, 9]
              - [256, 6]
              - [448, 5]
              - [1408, 33]
              - [1856, 40]
              - [2368, 34]
              - [2944, 44]
              - [3584, 34]
              - [4288, 40]
              - [5056, 34]
              - [5888, 42]
              - [-1, 40]
          - - 704
            - - [4, 12]
              - [128, 9]
              - [256, 39]
              - [704, 33]
              - [1024, 34]
              - [1408, 40]
              - [2368, 34]
              - [5888, 40]
              - [-1, 42]
          - - 1024
            - - [4, 11]
              - [64, 9]
              - [128, 6]
              - [256, 38]
              - [448, 33]
              - [704, 34]
              - [1024, 44]
              - [1408, 45]
              - [1856, 42]
              - [2368, 45]
              - [2944, 42]
              - [3584, 44]
              - [4288, 45]
              - [-1, 42]
          - - 1408
            - - [4, 12]
              - [64, 20]
              - [128, 5]
              - [256, 33]
              - [448, 34]
              - [704, 44]
              - [1024, 40]
              - [1408, 42]
              - [1856, 45]
              - [2368, 33]
              - [-1, 42]
          - - 1856
            - - [4, 12]
              - [64, 25]
              - [128, 24]
              - [256, 33]
              - [448, 44]
              - [704, 33]
              - [1024, 42]
              - [1408, 40]
              - [2944, 44]
              - [3584, 40]
              - [4288, 42]
              - [5056, 35]
              - [5888, 42]
              - [-1, 35]
          - - 2368
            - - [4, 12]
              - [64, 5]
              - [128, 20]
              - [256, 33]
              - [448, 34]
              - [704, 33]
              - [1024, 45]
              - [1408, 33]
              - [2368, 45]
              - [3584, 42]
              - [4288, 40]
              - [5888, 42]
              - [-1, 35]
          - - 2944
            - - [4, 12]
              - [64, 24]
              - [128, 25]
              - [256, 34]
              - [448, 40]
              - [704, 44]
              - [1408, 42]
              - [1856, 40]
              - [5888, 42]
              - [-1, 35]
          - - 3584
            - - [4, 11]
              - [64, 24]
              - [128, 34]
              - [256, 44]
              - [448, 33]
              - [704, 45]
              - [1024, 40]
              - [1408, 42]
              - [1856, 44]
              - [2944, 42]
              - [3584, 35]
              - [5888, 42]
              - [-1, 35]
          - - 4288
            - - [4, 11]
              - [128, 5]
              - [256, 33]
              - [704, 45]
              - [1024, 40]
              - [1856, 42]
              - [2368, 40]
              - [3584, 42]
              - [-1, 35]
          - - 5056
            - - [4, 11]
              - [64, 20]
              - [448, 33]
              - [704, 45]
              - [1408, 42]
              - [1856, 43]
              - [2368, 42]
              - [2944, 43]
              - [4288, 35]
              - [5056, 42]
              - [-1, 35]
          - - 5888
            - - [4, 11]
              - [64, 25]
              - [128, 34]
              - [256, 40]
              - [448, 42]
              - [704, 44]
              - [2368, 42]
              - [-1, 35]
          - - -1
            - - [4, 11]
              - [64, 34]
              - [128, 44]
              - [256, 33]
              - [448, 45]
              - [1408, 42]
              - [1856, 35]
              - [3584, 42]
              - [4288, 35]
              - [5056, 36]
              - [5888, 35]
              - [-1, 42]
