library/src/blas3/Tensile/Logic/asm_full/vega20_Cijk_Alik_Bjlk_HB.yaml
- {MinimumRequiredVersion: 4.6.0}
- vega20
- gfx906
- [Device 66a0, Device 66a1, Device 66a7]
    SolutionIndex: 0
    SolutionNameMin: Cijk_Alik_Bjlk_HB_MT016x016x08_PGR1_PLR1_TT02_02
    SolutionIndex: 1
    SolutionNameMin: Cijk_Alik_Bjlk_HB_MT016x032x08_PGR1_PLR1_TT02_04
    SolutionIndex: 2
    SolutionNameMin: Cijk_Alik_Bjlk_HB_MT032x032x08_PGR1_PLR1_TT04_04
    SolutionIndex: 3
    SolutionNameMin: Cijk_Alik_Bjlk_HB_MT016x064x08_PGR1_PLR1_TT02_04
    SolutionIndex: 4
    SolutionNameMin: Cijk_Alik_Bjlk_HB_MT032x064x08_PGR1_PLR1_TT04_04
    SolutionIndex: 5
    SolutionNameMin: Cijk_Alik_Bjlk_HB_MT032x128x08_PGR1_PLR1_TT04_04
    SolutionIndex: 6
    SolutionNameMin: Cijk_Alik_Bjlk_HB_MT032x064x08_PGR1_PLR1_TT02_04
    SolutionIndex: 7
    SolutionNameMin: Cijk_Alik_Bjlk_HB_MT064x128x08_PGR1_PLR1_TT04_08
    SolutionIndex: 8
    SolutionNameMin: Cijk_Alik_Bjlk_HB_MT016x128x08_PGR1_PLR1_TT04_04
    SolutionIndex: 9
    SolutionNameMin: Cijk_Alik_Bjlk_HB_MT032x032x08_PGR1_PLR1_TT04_04
    SolutionIndex: 10
    SolutionNameMin: Cijk_Alik_Bjlk_HB_MT032x064x08_PGR1_PLR1_TT04_08
    SolutionIndex: 11
    SolutionNameMin: Cijk_Alik_Bjlk_HB_MT016x064x08_PGR1_PLR1_TT02_04
    SolutionIndex: 12
    SolutionNameMin: Cijk_Alik_Bjlk_HB_MT032x064x08_PGR1_PLR1_TT04_04
    SolutionIndex: 13
    SolutionNameMin: Cijk_Alik_Bjlk_HB_MT032x128x08_PGR1_PLR1_TT04_04
    SolutionIndex: 14
    SolutionNameMin: Cijk_Alik_Bjlk_HB_MT064x128x08_PGR1_PLR1_TT04_08
    SolutionIndex: 15
    SolutionNameMin: Cijk_Alik_Bjlk_HB_MT008x064x16_PGR1_PLR1_TT02_02
    SolutionIndex: 16
    SolutionNameMin: Cijk_Alik_Bjlk_HB_MT016x128x16_PGR1_PLR1_TT04_04
    SolutionIndex: 17
    SolutionNameMin: Cijk_Alik_Bjlk_HB_MT016x016x16_PGR1_PLR1_TT02_02
    SolutionIndex: 18
    SolutionNameMin: Cijk_Alik_Bjlk_HB_MT032x032x16_PGR1_PLR1_TT04_04
    SolutionIndex: 19
    SolutionNameMin: Cijk_Alik_Bjlk_HB_MT032x064x16_PGR1_PLR1_TT04_08
    SolutionIndex: 20
    SolutionNameMin: Cijk_Alik_Bjlk_HB_MT064x064x16_PGR1_PLR1_TT08_08
    SolutionIndex: 21
    SolutionNameMin: Cijk_Alik_Bjlk_HB_MT016x032x16_PGR1_PLR1_TT02_02
    SolutionIndex: 22
    SolutionNameMin: Cijk_Alik_Bjlk_HB_MT016x064x16_PGR1_PLR1_TT02_04
    SolutionIndex: 23
    SolutionNameMin: Cijk_Alik_Bjlk_HB_MT032x064x16_PGR1_PLR1_TT04_04
    SolutionIndex: 24
    SolutionNameMin: Cijk_Alik_Bjlk_HB_MT016x064x16_PGR1_PLR1_TT02_02
    SolutionIndex: 25
    SolutionNameMin: Cijk_Alik_Bjlk_HB_MT016x128x16_PGR1_PLR1_TT02_04
    SolutionIndex: 26
    SolutionNameMin: Cijk_Alik_Bjlk_HB_MT064x064x16_PGR1_PLR1_TT04_04
    SolutionIndex: 27
    SolutionNameMin: Cijk_Alik_Bjlk_HB_MT064x128x16_PGR1_PLR1_TT04_08
    SolutionIndex: 28
    SolutionNameMin: Cijk_Alik_Bjlk_HB_MT128x128x16_PGR1_PLR1_TT08_08
    SolutionIndex: 29
    SolutionNameMin: Cijk_Alik_Bjlk_HB_MT016x128x16_PGR1_PLR1_TT04_04
    SolutionIndex: 30
    SolutionNameMin: Cijk_Alik_Bjlk_HB_MT016x016x16_PGR1_PLR1_TT02_02
    SolutionIndex: 31
    SolutionNameMin: Cijk_Alik_Bjlk_HB_MT032x032x16_PGR1_PLR1_TT04_04
    SolutionIndex: 32
    SolutionNameMin: Cijk_Alik_Bjlk_HB_MT032x064x16_PGR1_PLR1_TT04_08
    SolutionIndex: 33
    SolutionNameMin: Cijk_Alik_Bjlk_HB_MT064x064x16_PGR1_PLR1_TT08_08
    SolutionIndex: 34
    SolutionNameMin: Cijk_Alik_Bjlk_HB_MT016x032x16_PGR1_PLR1_TT02_02
    SolutionIndex: 35
    SolutionNameMin: Cijk_Alik_Bjlk_HB_MT016x064x16_PGR1_PLR1_TT02_04
    SolutionIndex: 36
    SolutionNameMin: Cijk_Alik_Bjlk_HB_MT032x064x16_PGR1_PLR1_TT04_04
    SolutionIndex: 37
    SolutionNameMin: Cijk_Alik_Bjlk_HB_MT016x064x16_PGR1_PLR1_TT02_02
    SolutionIndex: 38
    SolutionNameMin: Cijk_Alik_Bjlk_HB_MT016x128x16_PGR1_PLR1_TT02_04
    SolutionIndex: 39
    SolutionNameMin: Cijk_Alik_Bjlk_HB_MT064x064x16_PGR1_PLR1_TT04_04
    SolutionIndex: 40
    SolutionNameMin: Cijk_Alik_Bjlk_HB_MT064x128x16_PGR1_PLR1_TT04_08
    SolutionIndex: 41
    SolutionNameMin: Cijk_Alik_Bjlk_HB_MT128x128x16_PGR1_PLR1_TT08_08
    SolutionIndex: 42
    SolutionNameMin: Cijk_Alik_Bjlk_HB_MT016x016x24_PGR1_PLR1_TT02_02
    SolutionIndex: 43
    SolutionNameMin: Cijk_Alik_Bjlk_HB_MT032x032x24_PGR1_PLR1_TT04_04
    SolutionIndex: 44
    SolutionNameMin: Cijk_Alik_Bjlk_HB_MT032x064x24_PGR1_PLR1_TT04_08
    SolutionIndex: 45
    SolutionNameMin: Cijk_Alik_Bjlk_HB_MT016x016x24_PGR1_PLR1_TT02_02
    SolutionIndex: 46
    SolutionNameMin: Cijk_Alik_Bjlk_HB_MT032x032x24_PGR1_PLR1_TT04_04
    SolutionIndex: 47
    SolutionNameMin: Cijk_Alik_Bjlk_HB_MT064x064x24_PGR1_PLR1_TT08_08
    SolutionIndex: 48
    SolutionNameMin: Cijk_Alik_Bjlk_HB_MT008x064x32_PGR1_PLR1_TT02_02
    SolutionIndex: 49
    SolutionNameMin: Cijk_Alik_Bjlk_HB_MT016x016x32_PGR1_PLR1_TT02_02
    SolutionIndex: 50
    SolutionNameMin: Cijk_Alik_Bjlk_HB_MT016x064x32_PGR1_PLR1_TT02_02
    SolutionIndex: 51
    SolutionNameMin: Cijk_Alik_Bjlk_HB_MT128x128x32_PGR1_PLR1_TT08_08
    SolutionIndex: 52
    SolutionNameMin: Cijk_Alik_Bjlk_HB_MT008x064x32_PGR1_PLR1_TT02_02
    SolutionIndex: 53
    SolutionNameMin: Cijk_Alik_Bjlk_HB_MT016x064x32_PGR1_PLR1_TT02_02
    SolutionIndex: 54
    SolutionNameMin: Cijk_Alik_Bjlk_HB_MT128x128x32_PGR1_PLR1_TT08_08
    SolutionIndex: 55
    SolutionNameMin: Cijk_Alik_Bjlk_HB_MT064x128x08_PGR0_PLR1_TT04_08
    SolutionIndex: 56
    SolutionNameMin: Cijk_Alik_Bjlk_HB_MT064x128x08_PGR0_PLR1_TT04_08
    SolutionIndex: 57
    SolutionNameMin: Cijk_Alik_Bjlk_HB_MT048x064x16_PGR0_PLR1_TT06_08
    SolutionIndex: 58
    SolutionNameMin: Cijk_Alik_Bjlk_HB_MT064x064x16_PGR0_PLR1_TT08_08
    SolutionIndex: 59
    SolutionNameMin: Cijk_Alik_Bjlk_HB_MT064x064x16_PGR0_PLR1_TT04_04
    SolutionIndex: 60
    SolutionNameMin: Cijk_Alik_Bjlk_HB_MT064x128x16_PGR0_PLR1_TT04_08
    SolutionIndex: 61
    SolutionNameMin: Cijk_Alik_Bjlk_HB_MT096x128x16_PGR1_PLR1_TT06_08
    SolutionIndex: 62
    SolutionNameMin: Cijk_Alik_Bjlk_HB_MT128x064x16_PGR1_PLR1_TT08_04
    SolutionIndex: 63
    SolutionNameMin: Cijk_Alik_Bjlk_HB_MT128x128x16_PGR0_PLR1_TT08_08
    SolutionIndex: 64
    SolutionNameMin: Cijk_Alik_Bjlk_HB_MT032x032x16_PGR0_PLR1_TT04_04
    SolutionIndex: 65
    SolutionNameMin: Cijk_Alik_Bjlk_HB_MT032x064x16_PGR0_PLR1_TT04_08
    SolutionIndex: 66
    SolutionNameMin: Cijk_Alik_Bjlk_HB_MT064x064x16_PGR0_PLR1_TT08_08
    SolutionIndex: 67
    SolutionNameMin: Cijk_Alik_Bjlk_HB_MT064x064x16_PGR0_PLR1_TT04_04
    SolutionIndex: 68
    SolutionNameMin: Cijk_Alik_Bjlk_HB_MT064x128x16_PGR0_PLR1_TT04_08
    SolutionIndex: 69
    SolutionNameMin: Cijk_Alik_Bjlk_HB_MT096x128x16_PGR1_PLR1_TT06_08
    SolutionIndex: 70
    SolutionNameMin: Cijk_Alik_Bjlk_HB_MT128x064x16_PGR0_PLR1_TT08_04
    SolutionIndex: 71
    SolutionNameMin: Cijk_Alik_Bjlk_HB_MT128x064x16_PGR1_PLR1_TT08_04
    SolutionIndex: 72
    SolutionNameMin: Cijk_Alik_Bjlk_HB_MT128x128x16_PGR0_PLR1_TT08_08
    SolutionIndex: 73
    SolutionNameMin: Cijk_Alik_Bjlk_HB_MT048x064x24_PGR0_PLR1_TT06_08
    SolutionIndex: 74
    SolutionNameMin: Cijk_Alik_Bjlk_HB_MT064x064x24_PGR0_PLR1_TT08_08
    SolutionIndex: 75
    SolutionNameMin: Cijk_Alik_Bjlk_HB_MT064x064x24_PGR0_PLR1_TT08_08
    SolutionIndex: 76
    SolutionNameMin: Cijk_Alik_Bjlk_HB_MT064x064x32_PGR0_PLR1_TT04_04
    SolutionIndex: 77
    SolutionNameMin: Cijk_Alik_Bjlk_HB_MT064x128x32_PGR0_PLR1_TT04_08
    SolutionIndex: 78
    SolutionNameMin: Cijk_Alik_Bjlk_HB_MT128x128x32_PGR0_PLR1_TT08_08
    SolutionIndex: 79
    SolutionNameMin: Cijk_Alik_Bjlk_HB_MT064x064x32_PGR0_PLR1_TT04_04
    SolutionIndex: 80
    SolutionNameMin: Cijk_Alik_Bjlk_HB_MT064x128x32_PGR0_PLR1_TT04_08
    SolutionIndex: 81
    SolutionNameMin: Cijk_Alik_Bjlk_HB_MT128x128x32_PGR0_PLR1_TT08_08
    SolutionIndex: 82
    SolutionNameMin: Cijk_Alik_Bjlk_HB_MT064x128x04_PGR0_PLR0_TT04_08
    SolutionIndex: 83
    SolutionNameMin: Cijk_Alik_Bjlk_HB_MT064x064x04_PGR0_PLR0_TT04_04
    SolutionIndex: 84
    SolutionNameMin: Cijk_Alik_Bjlk_HB_MT064x128x04_PGR1_PLR0_TT04_08
    SolutionIndex: 85
    SolutionNameMin: Cijk_Alik_Bjlk_HB_MT064x064x04_PGR1_PLR0_TT04_04
    SolutionIndex: 86
    SolutionNameMin: Cijk_Alik_Bjlk_HB_MT064x128x04_PGR0_PLR1_TT04_08
    SolutionIndex: 87
    SolutionNameMin: Cijk_Alik_Bjlk_HB_MT064x064x04_PGR0_PLR1_TT04_04
    SolutionIndex: 88
    SolutionNameMin: Cijk_Alik_Bjlk_HB_MT128x128x04_PGR1_PLR1_TT08_08
    SolutionIndex: 89
    SolutionNameMin: Cijk_Alik_Bjlk_HB_MT064x128x04_PGR1_PLR1_TT04_08
    SolutionIndex: 90
    SolutionNameMin: Cijk_Alik_Bjlk_HB_MT064x064x04_PGR1_PLR1_TT04_04
    SolutionIndex: 91
    SolutionNameMin: Cijk_Alik_Bjlk_HB_MT064x128x08_PGR0_PLR0_TT04_08
    SolutionIndex: 92
    SolutionNameMin: Cijk_Alik_Bjlk_HB_MT064x064x08_PGR0_PLR0_TT04_04
    SolutionIndex: 93
    SolutionNameMin: Cijk_Alik_Bjlk_HB_MT128x128x08_PGR1_PLR0_TT08_08
    SolutionIndex: 94
    SolutionNameMin: Cijk_Alik_Bjlk_HB_MT064x128x08_PGR1_PLR0_TT04_08
    SolutionIndex: 95
    SolutionNameMin: Cijk_Alik_Bjlk_HB_MT064x064x08_PGR1_PLR0_TT04_04
    SolutionIndex: 96
    SolutionNameMin: Cijk_Alik_Bjlk_HB_MT128x128x08_PGR0_PLR1_TT08_08
    SolutionIndex: 97
    SolutionNameMin: Cijk_Alik_Bjlk_HB_MT064x128x08_PGR0_PLR1_TT04_08
    SolutionIndex: 98
    SolutionNameMin: Cijk_Alik_Bjlk_HB_MT064x064x08_PGR0_PLR1_TT04_04
    SolutionIndex: 99
    SolutionNameMin: Cijk_Alik_Bjlk_HB_MT064x064x08_PGR1_PLR1_TT04_04
    SolutionIndex: 100
    SolutionNameMin: Cijk_Alik_Bjlk_HB_MT064x128x16_PGR0_PLR0_TT04_08
    SolutionIndex: 101
    SolutionNameMin: Cijk_Alik_Bjlk_HB_MT064x064x16_PGR0_PLR0_TT04_04
    SolutionIndex: 102
    SolutionNameMin: Cijk_Alik_Bjlk_HB_MT064x128x16_PGR1_PLR0_TT04_08
    SolutionIndex: 103
    SolutionNameMin: Cijk_Alik_Bjlk_HB_MT064x064x16_PGR1_PLR0_TT04_04
    SolutionIndex: 104
    SolutionNameMin: Cijk_Alik_Bjlk_HB_MT064x128x16_PGR0_PLR1_TT04_08
    SolutionIndex: 105
    SolutionNameMin: Cijk_Alik_Bjlk_HB_MT064x064x16_PGR0_PLR1_TT04_04
    SolutionIndex: 106
    SolutionNameMin: Cijk_Alik_Bjlk_HB_MT064x064x16_PGR1_PLR1_TT04_04
    SolutionIndex: 107
    SolutionNameMin: Cijk_Alik_Bjlk_HB_MT064x064x32_PGR0_PLR0_TT04_04
    SolutionIndex: 108
    SolutionNameMin: Cijk_Alik_Bjlk_HB_MT064x128x32_PGR1_PLR0_TT04_08
    SolutionIndex: 109
    SolutionNameMin: Cijk_Alik_Bjlk_HB_MT064x064x32_PGR1_PLR0_TT04_04
    SolutionIndex: 110
    SolutionNameMin: Cijk_Alik_Bjlk_HB_MT064x064x32_PGR0_PLR1_TT04_04
    SolutionIndex: 111
    SolutionNameMin: Cijk_Alik_Bjlk_HB_MT064x064x32_PGR1_PLR1_TT04_04
    SolutionIndex: 112
    SolutionNameMin: Cijk_Alik_Bjlk_HB_MT128x128x04_PGR0_PLR0_TT08_08
    SolutionIndex: 113
    SolutionNameMin: Cijk_Alik_Bjlk_HB_MT064x128x04_PGR0_PLR0_TT04_08
    SolutionIndex: 114
    SolutionNameMin: Cijk_Alik_Bjlk_HB_MT064x064x04_PGR0_PLR0_TT04_04
    SolutionIndex: 115
    SolutionNameMin: Cijk_Alik_Bjlk_HB_MT064x128x04_PGR1_PLR0_TT04_08
    SolutionIndex: 116
    SolutionNameMin: Cijk_Alik_Bjlk_HB_MT064x064x04_PGR1_PLR0_TT04_04
    SolutionIndex: 117
    SolutionNameMin: Cijk_Alik_Bjlk_HB_MT064x128x04_PGR0_PLR1_TT04_08
    SolutionIndex: 118
    SolutionNameMin: Cijk_Alik_Bjlk_HB_MT064x064x04_PGR0_PLR1_TT04_04
    SolutionIndex: 119
    SolutionNameMin: Cijk_Alik_Bjlk_HB_MT064x064x04_PGR1_PLR1_TT04_04
    SolutionIndex: 120
    SolutionNameMin: Cijk_Alik_Bjlk_HB_MT064x128x08_PGR0_PLR0_TT04_08
    SolutionIndex: 121
    SolutionNameMin: Cijk_Alik_Bjlk_HB_MT064x064x08_PGR0_PLR0_TT04_04
    SolutionIndex: 122
    SolutionNameMin: Cijk_Alik_Bjlk_HB_MT128x128x08_PGR1_PLR0_TT08_08
    SolutionIndex: 123
    SolutionNameMin: Cijk_Alik_Bjlk_HB_MT064x128x08_PGR1_PLR0_TT04_08
    SolutionIndex: 124
    SolutionNameMin: Cijk_Alik_Bjlk_HB_MT064x064x08_PGR1_PLR0_TT04_04
    SolutionIndex: 125
    SolutionNameMin: Cijk_Alik_Bjlk_HB_MT128x128x08_PGR0_PLR1_TT08_08
    SolutionIndex: 126
    SolutionNameMin: Cijk_Alik_Bjlk_HB_MT064x128x08_PGR0_PLR1_TT04_08
    SolutionIndex: 127
    SolutionNameMin: Cijk_Alik_Bjlk_HB_MT064x064x08_PGR0_PLR1_TT04_04
    SolutionIndex: 128
    SolutionNameMin: Cijk_Alik_Bjlk_HB_MT064x128x08_PGR1_PLR1_TT04_08
    SolutionIndex: 129
    SolutionNameMin: Cijk_Alik_Bjlk_HB_MT064x064x08_PGR1_PLR1_TT04_04
    SolutionIndex: 130
    SolutionNameMin: Cijk_Alik_Bjlk_HB_MT064x064x16_PGR0_PLR0_TT04_04
    SolutionIndex: 131
    SolutionNameMin: Cijk_Alik_Bjlk_HB_MT064x064x16_PGR1_PLR0_TT04_04
    SolutionIndex: 132
    SolutionNameMin: Cijk_Alik_Bjlk_HB_MT064x128x16_PGR0_PLR1_TT04_08
    SolutionIndex: 133
    SolutionNameMin: Cijk_Alik_Bjlk_HB_MT064x064x16_PGR0_PLR1_TT04_04
    SolutionIndex: 134
    SolutionNameMin: Cijk_Alik_Bjlk_HB_MT064x064x16_PGR1_PLR1_TT04_04
    SolutionIndex: 135
    SolutionNameMin: Cijk_Alik_Bjlk_HB_MT064x064x32_PGR0_PLR0_TT04_04
    SolutionIndex: 136
    SolutionNameMin: Cijk_Alik_Bjlk_HB_MT064x128x32_PGR1_PLR0_TT04_08
    SolutionIndex: 137
    SolutionNameMin: Cijk_Alik_Bjlk_HB_MT064x064x32_PGR1_PLR0_TT04_04
    SolutionIndex: 138
    SolutionNameMin: Cijk_Alik_Bjlk_HB_MT064x064x32_PGR0_PLR1_TT04_04
    SolutionIndex: 139
    SolutionNameMin: Cijk_Alik_Bjlk_HB_MT064x064x32_PGR1_PLR1_TT04_04
- - - [2368, 1024, 1, 1]
    - [116, 119.804]
  - - [128, 256, 1, 1280]
    - [21, 1444.32]
  - - [32, 5056, 1, 1280]
    - [106, 1423.91]
  - - [448, 1, 1, 256]
    - [119, 3.42966]
  - - [5056, 1408, 1, 3328]
    - [41, 14612.1]
  - - [2368, 64, 1, 1]
    - [127, 12.3817]
  - - [5056, 1856, 1, 3328]
    - [41, 17605.7]
  - - [704, 64, 1, 1]
    - [119, 3.63355]
  - - [448, 3584, 1, 3328]
    - [27, 12466.3]
  - - [2368, 32, 1, 256]
    - [106, 536.467]
  - - [5888, 256, 1, 256]
    - [27, 12242.3]
  - - [448, 3584, 1, 32]
    - [84, 1934.5]
  - - [1856, 256, 1, 1]
    - [116, 38.0718]
  - - [6784, 6784, 1, 1280]
    - [40, 18951.5]
  - - [448, 1, 1, 1]
    - [121, 0.0347826]
  - - [1408, 3584, 1, 3328]
    - [41, 15510.9]
  - - [448, 448, 1, 3328]
    - [43, 6589.81]
  - - [1024, 2368, 1, 3328]
    - [26, 13839.1]
  - - [1, 4288, 1, 1280]
    - [128, 33.3534]
  - - [6784, 64, 1, 32]
    - [87, 909.269]
  - - [256, 128, 1, 256]
    - [17, 881.156]
  - - [448, 3584, 1, 1]
    - [113, 101.88]
  - - [448, 64, 1, 1]
    - [116, 2.37351]
  - - [32, 1408, 1, 32]
    - [98, 96.8946]
  - - [64, 1024, 1, 1280]
    - [42, 2788.77]
  - - [1, 1408, 1, 3328]
    - [129, 17.5947]
  - - [32, 3584, 1, 1280]
    - [103, 1193.89]
  - - [1024, 1, 1, 3328]
    - [129, 12.8038]
  - - [32, 1024, 1, 3328]
    - [106, 428.933]
  - - [1408, 5056, 1, 1]
    - [117, 196.436]
  - - [1024, 64, 1, 1280]
    - [42, 2904.64]
  - - [64, 5056, 1, 3328]
    - [23, 7974.58]
  - - [5888, 4288, 1, 3328]
    - [78, 18154.7]
  - - [1, 2368, 1, 1280]
    - [134, 24.9921]
  - - [704, 1024, 1, 1]
    - [119, 57.7641]
  - - [2368, 1408, 1, 32]
    - [98, 2646.15]
  - - [256, 1856, 1, 1280]
    - [46, 9514.61]
  - - [1024, 2944, 1, 1]
    - [115, 125.193]
  - - [2944, 3584, 1, 3328]
    - [56, 17238.8]
  - - [2368, 2944, 1, 1280]
    - [28, 18157.6]
  - - [256, 1408, 1, 1]
    - [121, 29.2571]
  - - [1, 1024, 1, 3328]
    - [139, 11.7805]
  - - [3584, 1408, 1, 32]
    - [97, 3163.81]
  - - [6784, 1856, 1, 32]
    - [82, 3750.14]
  - - [5056, 256, 1, 256]
    - [39, 10277.6]
  - - [1856, 2368, 1, 256]
    - [26, 14078.1]
  - - [2368, 1024, 1, 3328]
    - [28, 13919.3]
  - - [3584, 4288, 1, 32]
    - [104, 3815.81]
  - - [1024, 1024, 1, 1280]
    - [14, 13035.9]
  - - [32, 128, 1, 3328]
    - [108, 37.573]
  - - [32, 2944, 1, 3328]
    - [111, 1138.6]
  - - [704, 1408, 1, 3328]
    - [40, 14493.9]
  - - [1408, 704, 1, 256]
    - [39, 10608.5]
  - - [704, 64, 1, 32]
    - [87, 81.182]
  - - [5888, 1, 1, 3328]
    - [129, 53.4454]
  - - [5056, 4288, 1, 32]
    - [100, 3634.56]
  - - [6784, 128, 1, 3328]
    - [27, 12595.3]
  - - [2944, 1856, 1, 1]
    - [113, 175.13]
  - - [32, 448, 1, 3328]
    - [99, 183.388]
  - - [5056, 1, 1, 3328]
    - [119, 43.0121]
  - - [2368, 3584, 1, 1280]
    - [27, 17832.0]
  - - [4288, 5056, 1, 1]
    - [125, 201.338]
  - - [128, 4288, 1, 3328]
    - [23, 9918.65]
  - - [1408, 4288, 1, 1280]
    - [28, 18164.7]
  - - [1856, 704, 1, 1280]
    - [7, 13206.6]
  - - [448, 5888, 1, 256]
    - [27, 13230.5]
  - - [1, 5888, 1, 3328]
    - [136, 47.6167]
  - - [1024, 128, 1, 32]
    - [98, 234.057]
  - - [32, 4288, 1, 1280]
    - [99, 1231.33]
  - - [1024, 5056, 1, 1]
    - [117, 173.04]
  - - [704, 3584, 1, 1280]
    - [7, 16599.6]
  - - [1856, 5056, 1, 256]
    - [58, 16654.8]
  - - [1408, 1024, 1, 1280]
    - [7, 14337.2]
  - - [5056, 5888, 1, 3328]
    - [58, 16034.0]
  - - [3584, 3584, 1, 1280]
    - [40, 18505.4]
  - - [2368, 3584, 1, 32]
    - [84, 3573.44]
  - - [5056, 5056, 1, 1]
    - [112, 213.311]
  - - [2368, 256, 1, 32]
    - [105, 1171.42]
  - - [1024, 6784, 1, 1280]
    - [66, 16815.3]
  - - [1024, 3584, 1, 1]
    - [126, 138.596]
  - - [256, 5056, 1, 1]
    - [127, 78.5398]
  - - [32, 5056, 1, 32]
    - [98, 312.642]
  - - [5888, 32, 1, 32]
    - [83, 362.338]
  - - [64, 128, 1, 3328]
    - [42, 410.093]
  - - [256, 5056, 1, 32]
    - [95, 1791.47]
  - - [5056, 64, 1, 32]
    - [98, 583.034]
  - - [128, 6784, 1, 32]
    - [95, 1356.8]
  - - [64, 128, 1, 1]
    - [127, 0.562637]
  - - [64, 2368, 1, 1280]
    - [34, 4938.56]
  - - [128, 704, 1, 32]
    - [87, 182.969]
  - - [64, 6784, 1, 3328]
    - [23, 10051.0]
  - - [2944, 256, 1, 1280]
    - [27, 10587.0]
  - - [2944, 4288, 1, 256]
    - [7, 17563.6]
  - - [1024, 1024, 1, 3328]
    - [47, 14171.8]
  - - [5056, 704, 1, 32]
    - [91, 2819.35]
  - - [1856, 4288, 1, 3328]
    - [27, 17110.7]
  - - [1, 1856, 1, 256]
    - [130, 12.9677]
  - - [6784, 4288, 1, 32]
    - [91, 4538.18]
  - - [4288, 1024, 1, 3328]
    - [68, 16114.8]
  - - [256, 128, 1, 1]
    - [137, 2.39532]
  - - [3584, 448, 1, 3328]
    - [54, 12491.9]
  - - [2944, 448, 1, 256]
    - [14, 10849.7]
  - - [3584, 2368, 1, 3328]
    - [27, 17962.6]
  - - [4288, 1856, 1, 1]
    - [117, 181.205]
  - - [1856, 2944, 1, 1]
    - [117, 176.488]
  - - [32, 4288, 1, 3328]
    - [99, 1303.53]
  - - [1, 3584, 1, 3328]
    - [129, 44.4129]
  - - [256, 32, 1, 3328]
    - [106, 106.696]
  - - [1856, 2368, 1, 32]
    - [84, 2844.67]
  - - [4288, 1856, 1, 32]
    - [84, 3415.68]
  - - [5056, 64, 1, 3328]
    - [23, 7960.43]
  - - [6784, 1, 1, 1280]
    - [129, 58.7677]
  - - [32, 2368, 1, 256]
    - [99, 534.104]
  - - [1408, 64, 1, 1]
    - [116, 7.22051]
  - - [1, 1, 1, 3328]
    - [131, 0.0122569]
  - - [5056, 2368, 1, 256]
    - [68, 16818.4]
  - - [1408, 5888, 1, 256]
    - [7, 17271.5]
  - - [5056, 6784, 1, 1]
    - [112, 226.731]
  - - [32, 448, 1, 1280]
    - [99, 165.376]
  - - [32, 448, 1, 32]
    - [90, 29.8667]
  - - [256, 5056, 1, 1280]
    - [39, 13633.6]
  - - [704, 2368, 1, 1]
    - [124, 83.3536]
  - - [64, 1024, 1, 32]
    - [87, 114.975]
  - - [1024, 256, 1, 256]
    - [18, 4583.94]
  - - [128, 1, 1, 1]
    - [133, 0.0110345]
  - - [128, 3584, 1, 256]
    - [12, 7726.35]
  - - [3584, 4288, 1, 1280]
    - [63, 18208.7]
  - - [1856, 128, 1, 32]
    - [101, 463.547]
  - - [1856, 128, 1, 1280]
    - [38, 6936.29]
  - - [128, 2944, 1, 3328]
    - [23, 9226.73]
  - - [1, 6784, 1, 3328]
    - [136, 54.608]
  - - [2368, 4288, 1, 1]
    - [117, 189.723]
  - - [4288, 448, 1, 3328]
    - [20, 15596.1]
  - - [4288, 32, 1, 3328]
    - [103, 1246.87]
  - - [32, 2944, 1, 256]
    - [99, 744.359]
  - - [256, 1856, 1, 1]
    - [116, 38.3174]
  - - [704, 6784, 1, 1280]
    - [28, 16016.5]
  - - [3584, 6784, 1, 1]
    - [126, 231.472]
  - - [704, 5056, 1, 1280]
    - [14, 15603.0]
  - - [256, 3584, 1, 3328]
    - [27, 13084.7]
  - - [1024, 32, 1, 3328]
    - [106, 388.14]
  - - [3584, 6784, 1, 32]
    - [97, 4442.92]
  - - [3584, 6784, 1, 1280]
    - [80, 15935.0]
  - - [4288, 4288, 1, 3328]
    - [78, 17335.1]
  - - [3584, 64, 1, 1280]
    - [43, 6624.58]
  - - [64, 1856, 1, 256]
    - [24, 3040.87]
  - - [3584, 64, 1, 32]
    - [90, 415.16]
  - - [448, 1, 1, 1280]
    - [134, 5.00209]
  - - [256, 4288, 1, 1280]
    - [14, 11032.4]
  - - [1408, 3584, 1, 1]
    - [113, 162.993]
  - - [4288, 1856, 1, 3328]
    - [63, 17345.5]
  - - [1856, 2944, 1, 1280]
    - [7, 17675.9]
  - - [4288, 256, 1, 256]
    - [26, 10065.1]
  - - [128, 5888, 1, 32]
    - [87, 1402.17]
  - - [128, 5888, 1, 1280]
    - [5, 12483.0]
  - - [1408, 128, 1, 3328]
    - [22, 6237.37]
  - - [3584, 256, 1, 256]
    - [7, 9986.44]
  - - [32, 6784, 1, 3328]
    - [105, 1911.7]
  - - [64, 64, 1, 1280]
    - [30, 180.54]
  - - [32, 3584, 1, 256]
    - [105, 761.414]
  - - [704, 256, 1, 32]
    - [110, 305.464]
  - - [448, 128, 1, 3328]
    - [42, 2698.54]
  - - [64, 2944, 1, 3328]
    - [22, 6510.05]
  - - [64, 4288, 1, 3328]
    - [23, 6811.68]
  - - [5056, 1024, 1, 3328]
    - [81, 17231.6]
  - - [2368, 64, 1, 3328]
    - [48, 5297.95]
  - - [1856, 256, 1, 256]
    - [26, 7526.91]
  - - [3584, 704, 1, 1]
    - [114, 121.773]
  - - [256, 704, 1, 256]
    - [2, 3392.45]
  - - [448, 5056, 1, 1]
    - [118, 116.998]
  - - [5888, 5888, 1, 256]
    - [28, 18832.0]
  - - [3584, 704, 1, 32]
    - [95, 2380.32]
  - - [448, 6784, 1, 3328]
    - [27, 17255.6]
  - - [6784, 4288, 1, 1]
    - [117, 250.947]
  - - [5056, 704, 1, 1]
    - [121, 122.908]
  - - [1408, 2368, 1, 32]
    - [84, 2599.72]
  - - [448, 5056, 1, 32]
    - [91, 2116.9]
  - - [4288, 4288, 1, 1280]
    - [72, 17261.7]
  - - [6784, 1408, 1, 1]
    - [113, 213.976]
  - - [5888, 256, 1, 3328]
    - [69, 13537.3]
  - - [1856, 5888, 1, 3328]
    - [58, 17166.1]
  - - [1024, 704, 1, 1]
    - [121, 59.2842]
  - - [5056, 5888, 1, 1]
    - [125, 215.598]
  - - [2944, 1024, 1, 256]
    - [78, 13251.2]
  - - [448, 1408, 1, 3328]
    - [40, 9358.28]
  - - [5056, 32, 1, 3328]
    - [103, 1471.48]
  - - [2368, 4288, 1, 3328]
    - [7, 18935.1]
  - - [1024, 704, 1, 32]
    - [107, 1181.8]
  - - [448, 2944, 1, 256]
    - [62, 10219.2]
  - - [2944, 6784, 1, 256]
    - [40, 17767.8]
  - - [2368, 2368, 1, 1280]
    - [14, 16691.8]
  - - [5888, 128, 1, 3328]
    - [13, 12891.6]
  - - [256, 256, 1, 32]
    - [101, 119.7]
  - - [1024, 1, 1, 256]
    - [129, 7.43039]
  - - [3584, 3584, 1, 32]
    - [91, 3805.94]
  - - [2944, 448, 1, 1]
    - [117, 81.2138]
  - - [128, 32, 1, 32]
    - [92, 8.66878]
  - - [5056, 64, 1, 1280]
    - [35, 7406.79]
  - - [2944, 2944, 1, 1280]
    - [41, 17852.0]
  - - [1, 2368, 1, 256]
    - [129, 14.7712]
  - - [64, 6784, 1, 1]
    - [124, 35.2416]
  - - [2944, 32, 1, 1280]
    - [111, 987.764]
  - - [64, 1408, 1, 3328]
    - [48, 3929.41]
  - - [256, 448, 1, 1280]
    - [24, 4453.9]
  - - [2368, 2944, 1, 1]
    - [113, 171.54]
  - - [6784, 4288, 1, 1280]
    - [41, 19171.9]
  - - [2944, 704, 1, 256]
    - [67, 11494.4]
  - - [5888, 1856, 1, 256]
    - [7, 17142.2]
  - - [704, 2944, 1, 3328]
    - [7, 16912.3]
  - - [5888, 256, 1, 1]
    - [120, 83.7404]
  - - [704, 704, 1, 32]
    - [98, 1037.94]
  - - [256, 4288, 1, 256]
    - [14, 9317.58]
  - - [5056, 6784, 1, 32]
    - [93, 3818.52]
  - - [5056, 128, 1, 1]
    - [113, 40.448]
  - - [448, 5056, 1, 1280]
    - [14, 14914.2]
  - - [448, 448, 1, 256]
    - [11, 4117.01]
  - - [256, 5888, 1, 3328]
    - [27, 15613.7]
  - - [704, 448, 1, 1280]
    - [43, 6912.7]
  - - [448, 64, 1, 256]
    - [24, 784.191]
  - - [1024, 704, 1, 1280]
    - [39, 10799.9]
  - - [5888, 1024, 1, 1]
    - [117, 182.044]
  - - [5888, 448, 1, 32]
    - [99, 2249.74]
  - - [6784, 2944, 1, 256]
    - [41, 16787.7]
  - - [1024, 256, 1, 1]
    - [133, 21.0051]
  - - [5888, 256, 1, 32]
    - [106, 1717.75]
  - - [2368, 448, 1, 256]
    - [65, 8486.91]
  - - [4288, 256, 1, 3328]
    - [10, 11078.5]
  - - [4288, 2944, 1, 256]
    - [7, 17702.2]
  - - [704, 4288, 1, 3328]
    - [27, 16970.3]
  - - [448, 5888, 1, 3328]
    - [41, 13957.4]
  - - [128, 256, 1, 3328]
    - [48, 1609.38]
  - - [2368, 5056, 1, 32]
    - [91, 3753.17]
  - - [32, 128, 1, 1280]
    - [106, 47.2843]
  - - [1408, 4288, 1, 1]
    - [117, 185.884]
  - - [1408, 1856, 1, 3328]
    - [27, 14879.7]
  - - [4288, 64, 1, 256]
    - [3, 4933.61]
  - - [2944, 5888, 1, 3328]
    - [81, 18164.3]
  - - [128, 6784, 1, 3328]
    - [14, 12371.0]
  - - [448, 4288, 1, 3328]
    - [40, 15759.1]
  - - [704, 2368, 1, 256]
    - [14, 11854.7]
  - - [1, 64, 1, 3328]
    - [119, 0.740584]
  - - [4288, 128, 1, 1]
    - [116, 37.905]
  - - [256, 2368, 1, 32]
    - [85, 1092.27]
  - - [4288, 3584, 1, 3328]
    - [78, 18194.9]
  - - [2368, 1024, 1, 1280]
    - [55, 13976.0]
  - - [1408, 1024, 1, 1]
    - [117, 90.112]
  - - [1408, 1024, 1, 256]
    - [70, 10207.4]
  - - [5056, 3584, 1, 1]
    - [112, 199.041]
  - - [448, 1024, 1, 256]
    - [39, 7267.36]
  - - [6784, 6784, 1, 3328]
    - [7, 19397.4]
  - - [1408, 256, 1, 1280]
    - [26, 7793.47]
  - - [6784, 32, 1, 32]
    - [98, 477.116]
  - - [64, 1024, 1, 3328]
    - [42, 3105.12]
  - - [2368, 2944, 1, 3328]
    - [41, 16332.1]
  - - [448, 448, 1, 1280]
    - [43, 5870.68]
  - - [5056, 3584, 1, 32]
    - [97, 4384.93]
  - - [5056, 3584, 1, 1280]
    - [40, 18396.6]
  - - [1024, 256, 1, 1280]
    - [43, 7516.67]
  - - [1856, 1856, 1, 256]
    - [27, 14916.3]
  - - [32, 5888, 1, 256]
    - [106, 1116.54]
  - - [256, 1408, 1, 32]
    - [92, 762.853]
  - - [2944, 1, 1, 3328]
    - [129, 36.4604]
  - - [32, 704, 1, 3328]
    - [99, 286.42]
  - - [5888, 4288, 1, 1]
    - [115, 242.58]
  - - [1024, 128, 1, 256]
    - [24, 3382.5]
  - - [32, 1856, 1, 3328]
    - [106, 775.001]
  - - [5056, 704, 1, 256]
    - [62, 14273.4]
  - - [448, 256, 1, 256]
    - [24, 3008.21]
  - - [2368, 5056, 1, 256]
    - [60, 16944.9]
  - - [1024, 5056, 1, 256]
    - [81, 14885.4]
  - - [1024, 64, 1, 1]
    - [116, 5.38947]
  - - [5888, 448, 1, 256]
    - [80, 11224.8]
  - - [6784, 5056, 1, 1280]
    - [60, 18290.8]
  - - [704, 6784, 1, 32]
    - [91, 3216.12]
  - - [4288, 6784, 1, 1280]
    - [58, 19278.3]
  - - [64, 1, 1, 256]
    - [129, 0.460225]
  - - [1856, 64, 1, 1280]
    - [24, 4450.92]
  - - [128, 1408, 1, 1]
    - [119, 14.8211]
  - - [1024, 64, 1, 32]
    - [90, 135.126]
  - - [1024, 64, 1, 3328]
    - [50, 3098.07]
  - - [704, 6784, 1, 3328]
    - [26, 13639.9]
  - - [5888, 4288, 1, 1280]
    - [60, 18556.8]
  - - [5888, 3584, 1, 1280]
    - [58, 18061.5]
  - - [32, 2368, 1, 1280]
    - [99, 890.173]
  - - [5888, 128, 1, 1280]
    - [5, 12496.0]
  - - [1024, 2944, 1, 256]
    - [40, 14616.5]
  - - [1, 2944, 1, 1280]
    - [129, 33.4071]
  - - [4288, 2368, 1, 32]
    - [82, 3471.45]
  - - [2944, 1856, 1, 1280]
    - [14, 17661.6]
  - - [3584, 1, 1, 1280]
    - [129, 41.048]
  - - [256, 3584, 1, 32]
    - [101, 1416.99]
  - - [1024, 2368, 1, 1]
    - [133, 105.611]
  - - [2944, 3584, 1, 1280]
    - [28, 17942.4]
  - - [64, 1, 1, 1]
    - [114, 0.00368664]
  - - [1856, 4288, 1, 256]
    - [41, 16799.0]
  - - [256, 128, 1, 3328]
    - [52, 1605.59]
  - - [1024, 1024, 1, 1024]
    - [51, 10746.0]
  - - [1, 1856, 1, 3328]
    - [129, 22.7556]
  - - [1408, 704, 1, 1]
    - [114, 56.5772]
  - - [2368, 2944, 1, 32]
    - [91, 3158.05]
  - - [128, 4288, 1, 32]
    - [87, 980.114]
  - - [128, 704, 1, 1280]
    - [21, 3604.48]
  - - [64, 64, 1, 1]
    - [133, 0.339073]
  - - [1, 1408, 1, 1]
    - [118, 0.125714]
  - - [128, 2368, 1, 1280]
    - [23, 7028.5]
  - - [2944, 32, 1, 32]
    - [83, 168.229]
  - - [448, 1856, 1, 1]
    - [121, 65.3686]
  - - [4288, 704, 1, 256]
    - [55, 12227.9]
  - - [1856, 1024, 1, 256]
    - [77, 11389.0]
  - - [448, 1856, 1, 32]
    - [83, 1319.82]
  - - [448, 1856, 1, 3328]
    - [14, 11817.5]
  - - [448, 448, 1, 32]
    - [98, 366.583]
  - - [1024, 448, 1, 256]
    - [59, 6612.64]
  - - [6784, 1, 1, 256]
    - [131, 41.5877]
  - - [1024, 5056, 1, 32]
    - [91, 3251.08]
  - - [1024, 4288, 1, 1]
    - [117, 153.743]
  - - [704, 256, 1, 3328]
    - [43, 5936.12]
  - - [704, 1856, 1, 32]
    - [86, 1685.97]
  - - [1408, 5888, 1, 1280]
    - [27, 18430.5]
  - - [32, 704, 1, 1280]
    - [106, 271.217]
  - - [5056, 1856, 1, 256]
    - [7, 16813.3]
  - - [6784, 704, 1, 1280]
    - [40, 16515.0]
  - - [704, 1408, 1, 32]
    - [99, 1754.39]
  - - [5888, 1024, 1, 256]
    - [14, 16462.3]
  - - [64, 2944, 1, 1]
    - [138, 13.8541]
  - - [64, 2944, 1, 32]
    - [92, 388.487]
  - - [64, 2944, 1, 1280]
    - [22, 5993.35]
  - - [6784, 1856, 1, 3328]
    - [41, 18331.6]
  - - [64, 704, 1, 3328]
    - [53, 2122.68]
  - - [2368, 5888, 1, 1280]
    - [56, 17681.2]
  - - [1, 6784, 1, 256]
    - [119, 41.8281]
  - - [6784, 6784, 1, 32]
    - [91, 4721.48]
  - - [256, 1, 1, 1280]
    - [129, 2.92571]
  - - [5888, 128, 1, 32]
    - [103, 645.537]
  - - [6784, 256, 1, 256]
    - [79, 10197.2]
  - - [2368, 3584, 1, 3328]
    - [71, 16566.8]
  - - [128, 4288, 1, 1280]
    - [16, 9504.14]
  - - [128, 128, 1, 256]
    - [21, 472.332]
  - - [5888, 1024, 1, 1280]
    - [58, 16853.4]
  - - [1856, 704, 1, 3328]
    - [14, 13315.9]
  - - [5888, 6784, 1, 3328]
    - [28, 19056.3]
  - - [6784, 1856, 1, 1]
    - [120, 213.264]
  - - [128, 32, 1, 1280]
    - [106, 44.1023]
  - - [2944, 2368, 1, 1280]
    - [7, 18037.2]
  - - [4288, 448, 1, 1]
    - [117, 93.0729]
  - - [6784, 448, 1, 32]
    - [101, 2603.2]
  - - [6784, 448, 1, 3328]
    - [40, 14932.3]
  - - [1, 6784, 1, 1]
    - [121, 0.561589]
  - - [448, 3584, 1, 1280]
    - [14, 12813.0]
  - - [1408, 6784, 1, 1280]
    - [68, 15780.0]
  - - [5056, 5888, 1, 1280]
    - [7, 19706.0]
  - - [32, 2944, 1, 32]
    - [92, 200.443]
  - - [5888, 704, 1, 1]
    - [113, 141.957]
  - - [1, 256, 1, 256]
    - [119, 1.8963]
  - - [5056, 2944, 1, 32]
    - [84, 3836.31]
  - - [32, 6784, 1, 256]
    - [99, 1459.42]
  - - [64, 5056, 1, 256]
    - [11, 5658.3]
  - - [4288, 6784, 1, 1]
    - [112, 212.396]
  - - [448, 704, 1, 1280]
    - [43, 6922.18]
  - - [64, 2368, 1, 1]
    - [129, 12.3013]
  - - [1, 4288, 1, 3328]
    - [128, 35.5623]
  - - [5056, 4288, 1, 1]
    - [120, 204.53]
  - - [2368, 5888, 1, 32]
    - [102, 3693.45]
  - - [128, 3584, 1, 1280]
    - [23, 9986.44]
  - - [2944, 6784, 1, 1]
    - [126, 224.709]
  - - [1, 256, 1, 1]
    - [119, 0.022695]
  - - [5888, 1024, 1, 3328]
    - [41, 16695.7]
  - - [6784, 5888, 1, 256]
    - [68, 18307.2]
  - - [704, 128, 1, 1280]
    - [21, 3622.59]
  - - [4288, 128, 1, 256]
    - [16, 7603.31]
  - - [32, 3584, 1, 3328]
    - [111, 1390.56]
  - - [6784, 64, 1, 256]
    - [23, 6981.72]
  - - [1024, 1, 1, 1280]
    - [129, 11.7112]
  - - [2368, 4288, 1, 32]
    - [82, 3659.09]
  - - [704, 3584, 1, 1]
    - [116, 114.688]
  - - [704, 1856, 1, 3328]
    - [7, 13565.1]
  - - [2944, 128, 1, 1280]
    - [36, 8637.98]
  - - [1, 2368, 1, 3328]
    - [134, 28.3968]
  - - [6784, 704, 1, 32]
    - [95, 3091.22]
  - - [4288, 1, 1, 1280]
    - [134, 34.2526]
  - - [704, 5888, 1, 256]
    - [7, 15605.3]
  - - [2944, 256, 1, 1]
    - [119, 57.4439]
  - - [64, 448, 1, 256]
    - [21, 804.828]
  - - [1408, 448, 1, 1280]
    - [18, 9108.79]
  - - [1408, 128, 1, 32]
    - [83, 369.69]
  - - [256, 1024, 1, 256]
    - [9, 5146.39]
  - - [3584, 5056, 1, 32]
    - [89, 3765.34]
  - - [1024, 32, 1, 1280]
    - [111, 349.759]
  - - [128, 2368, 1, 1]
    - [124, 24.4439]
  - - [6784, 1856, 1, 1280]
    - [75, 15307.1]
  - - [5056, 5056, 1, 3328]
    - [56, 17382.5]
  - - [128, 2944, 1, 1280]
    - [23, 8675.27]
  - - [128, 6784, 1, 1]
    - [121, 62.0251]
  - - [5888, 1408, 1, 256]
    - [81, 16549.6]
  - - [2368, 1024, 1, 32]
    - [101, 2331.57]
  - - [256, 256, 1, 3328]
    - [45, 3101.59]
  - - [64, 4288, 1, 1]
    - [114, 22.5684]
  - - [4288, 1024, 1, 256]
    - [80, 13484.6]
  - - [3584, 32, 1, 32]
    - [92, 246.641]
  - - [3584, 64, 1, 1]
    - [121, 19.373]
  - - [704, 32, 1, 1280]
    - [99, 262.144]
  - - [32, 4288, 1, 32]
    - [92, 299.926]
  - - [64, 64, 1, 3328]
    - [48, 202.85]
  - - [64, 1408, 1, 1]
    - [139, 5.99149]
  - - [4288, 5888, 1, 1280]
    - [7, 19587.0]
  - - [704, 64, 1, 3328]
    - [50, 2129.92]
  - - [5056, 5888, 1, 256]
    - [41, 18782.1]
  - - [1408, 128, 1, 1280]
    - [22, 5755.66]
  - - [1024, 5888, 1, 1280]
    - [68, 16826.9]
  - - [64, 1024, 1, 1]
    - [118, 5.42517]
  - - [32, 32, 1, 32]
    - [106, 1.59377]
  - - [64, 128, 1, 256]
    - [17, 267.494]
  - - [5888, 5056, 1, 1280]
    - [68, 17969.4]
  - - [5888, 2944, 1, 1]
    - [113, 217.986]
  - - [64, 4288, 1, 1280]
    - [23, 6410.09]
  - - [704, 2944, 1, 1]
    - [117, 111.669]
  - - [1408, 4288, 1, 3328]
    - [14, 15822.1]
  - - [704, 2944, 1, 32]
    - [91, 2745.13]
  - - [1, 5888, 1, 1280]
    - [134, 47.8456]
  - - [2944, 4288, 1, 3328]
    - [55, 17589.5]
  - - [256, 2944, 1, 256]
    - [59, 8834.16]
  - - [704, 448, 1, 32]
    - [87, 609.453]
  - - [5056, 2944, 1, 256]
    - [40, 17576.2]
  - - [704, 1024, 1, 256]
    - [26, 9532.51]
  - - [2368, 1856, 1, 256]
    - [27, 15337.0]
  - - [64, 3584, 1, 1]
    - [119, 19.1147]
  - - [1024, 128, 1, 1280]
    - [24, 5029.14]
  - - [2368, 4288, 1, 1280]
    - [7, 16882.8]
  - - [3584, 448, 1, 256]
    - [79, 9514.86]
  - - [256, 6784, 1, 256]
    - [7, 12160.7]
  - - [1024, 32, 1, 32]
    - [92, 61.2486]
  - - [2944, 5888, 1, 1]
    - [126, 221.1]
  - - [128, 64, 1, 32]
    - [105, 16.0627]
  - - [64, 1, 1, 1280]
    - [129, 0.713589]
  - - [6784, 5888, 1, 3328]
    - [66, 18210.1]
  - - [256, 5888, 1, 1]
    - [113, 95.6426]
  - - [6784, 3584, 1, 256]
    - [66, 18233.9]
  - - [1408, 1856, 1, 256]
    - [71, 12825.8]
  - - [128, 1408, 1, 256]
    - [3, 4004.98]
  - - [2944, 2944, 1, 32]
    - [92, 3408.9]
  - - [2944, 2944, 1, 3328]
    - [14, 18839.6]
  - - [1, 2944, 1, 256]
    - [129, 21.5579]
  - - [448, 32, 1, 1280]
    - [109, 154.775]
  - - [3584, 1, 1, 256]
    - [124, 24.0941]
  - - [704, 32, 1, 3328]
    - [99, 289.159]
  - - [256, 448, 1, 3328]
    - [50, 4795.0]
  - - [2368, 64, 1, 256]
    - [34, 3488.97]
  - - [64, 448, 1, 1280]
    - [42, 1270.78]
  - - [1408, 448, 1, 3328]
    - [18, 9744.01]
  - - [2368, 6784, 1, 3328]
    - [40, 18896.2]
  - - [256, 2368, 1, 1]
    - [124, 48.8877]
  - - [4288, 3584, 1, 32]
    - [100, 3801.66]
  - - [5888, 64, 1, 3328]
    - [23, 9226.73]
  - - [3584, 704, 1, 1280]
    - [62, 15222.5]
  - - [448, 5056, 1, 3328]
    - [7, 15286.8]
  - - [4288, 448, 1, 256]
    - [71, 12197.0]
  - - [5056, 256, 1, 1280]
    - [39, 12581.6]
  - - [704, 448, 1, 3328]
    - [26, 7208.96]
  - - [2944, 5888, 1, 32]
    - [91, 4328.16]
  - - [3584, 5056, 1, 256]
    - [14, 18537.8]
  - - [6784, 1, 1, 3328]
    - [129, 61.9842]
  - - [32, 2368, 1, 3328]
    - [106, 966.067]
  - - [64, 256, 1, 1]
    - [131, 1.2962]
  - - [1856, 448, 1, 3328]
    - [40, 12179.5]
  - - [3584, 2368, 1, 256]
    - [14, 16559.8]
  - - [128, 1024, 1, 1280]
    - [37, 4993.22]
  - - [4288, 256, 1, 32]
    - [98, 1493.51]
  - - [4288, 256, 1, 1280]
    - [14, 10997.9]
  - - [448, 5056, 1, 256]
    - [40, 12761.1]
  - - [128, 1856, 1, 1]
    - [127, 19.2831]
  - - [128, 1856, 1, 32]
    - [83, 484.833]
  - - [1408, 1856, 1, 1]
    - [118, 126.611]
  - - [128, 2944, 1, 1]
    - [118, 26.1689]
  - - [3584, 32, 1, 256]
    - [99, 906.177]
  - - [1408, 1408, 1, 1280]
    - [51, 14644.2]
  - - [3584, 256, 1, 1]
    - [124, 59.4238]
  - - [1408, 1856, 1, 1280]
    - [71, 15784.1]
  - - [448, 4288, 1, 1]
    - [117, 110.658]
  - - [3584, 4288, 1, 3328]
    - [27, 17652.4]
  - - [448, 128, 1, 256]
    - [15, 1504.1]
  - - [448, 4288, 1, 32]
    - [82, 2022.13]
  - - [448, 4288, 1, 1280]
    - [27, 15422.2]
  - - [64, 3584, 1, 256]
    - [25, 4860.95]
  - - [6784, 1408, 1, 1280]
    - [72, 16646.3]
  - - [1, 6784, 1, 1280]
    - [129, 58.3256]
  - - [5056, 1024, 1, 256]
    - [78, 14307.0]
  - - [2368, 448, 1, 32]
    - [92, 1595.28]
  - - [256, 1, 1, 256]
    - [119, 1.97398]
  - - [32, 2944, 1, 1280]
    - [99, 1100.24]
  - - [5056, 1024, 1, 1]
    - [126, 143.179]
  - - [2368, 256, 1, 256]
    - [39, 7853.71]
  - - [1, 5056, 1, 1]
    - [116, 0.435862]
  - - [4288, 32, 1, 32]
    - [92, 298.296]
  - - [1856, 3584, 1, 32]
    - [98, 3363.79]
  - - [5056, 3584, 1, 3328]
    - [14, 19647.6]
  - - [4288, 5056, 1, 256]
    - [7, 18475.7]
  - - [1856, 5888, 1, 256]
    - [7, 17778.3]
  - - [256, 256, 1, 256]
    - [17, 1762.31]
  - - [2368, 3584, 1, 1]
    - [113, 184.82]
  - - [4288, 2368, 1, 256]
    - [58, 16766.1]
  - - [448, 1, 1, 3328]
    - [129, 5.56821]
  - - [1856, 256, 1, 1280]
    - [26, 10176.9]
  - - [1024, 6784, 1, 1]
    - [117, 165.716]
  - - [1408, 2944, 1, 3328]
    - [14, 18241.6]
  - - [32, 1856, 1, 32]
    - [92, 109.985]
  - - [256, 1, 1, 1]
    - [127, 0.0225352]
  - - [6784, 5056, 1, 3328]
    - [68, 16553.1]
  - - [6784, 5056, 1, 1]
    - [113, 255.36]
  - - [5888, 3584, 1, 32]
    - [97, 4375.86]
  - - [5888, 3584, 1, 3328]
    - [78, 16979.3]
  - - [1, 256, 1, 3328]
    - [129, 3.14798]
  - - [1024, 6784, 1, 256]
    - [41, 16491.0]
  - - [6784, 5888, 1, 32]
    - [98, 4124.33]
  - - [1408, 1, 1, 1280]
    - [134, 15.0992]
  - - [2368, 6784, 1, 32]
    - [97, 4278.17]
  - - [6784, 64, 1, 1]
    - [121, 35.7053]
  - - [2368, 32, 1, 32]
    - [90, 157.049]
  - - [3584, 1408, 1, 3328]
    - [68, 15960.2]
  - - [2944, 1408, 1, 1280]
    - [55, 15772.3]
  - - [1856, 64, 1, 1]
    - [114, 10.1007]
  - - [3584, 1024, 1, 1]
    - [113, 131.825]
  - - [256, 32, 1, 256]
    - [99, 61.2486]
  - - [2944, 1856, 1, 3328]
    - [27, 16058.3]
  - - [128, 1024, 1, 3328]
    - [53, 5458.05]
  - - [1408, 128, 1, 1]
    - [121, 15.1195]
  - - [2944, 3584, 1, 32]
    - [104, 3638.38]
  - - [3584, 1024, 1, 32]
    - [91, 2780.32]
  - - [4288, 6784, 1, 3328]
    - [28, 17003.4]
  - - [256, 128, 1, 1280]
    - [21, 1432.48]
  - - [6784, 5056, 1, 256]
    - [41, 18376.0]
  - - [1408, 32, 1, 3328]
    - [99, 571.268]
  - - [1856, 3584, 1, 1280]
    - [58, 16467.6]
  - - [256, 5888, 1, 256]
    - [14, 12626.8]
  - - [5056, 32, 1, 256]
    - [106, 1063.11]
  - - [1024, 4288, 1, 3328]
    - [14, 17454.5]
  - - [448, 2368, 1, 256]
    - [26, 9783.18]
  - - [64, 1408, 1, 1280]
    - [21, 3568.79]
  - - [3584, 32, 1, 1280]
    - [111, 1247.46]
  - - [128, 2368, 1, 3328]
    - [36, 7496.51]
  - - [3584, 1024, 1, 256]
    - [27, 15913.3]
  - - [256, 64, 1, 256]
    - [17, 476.625]
  - - [2368, 448, 1, 3328]
    - [7, 11060.6]
  - - [3584, 2368, 1, 1]
    - [117, 195.731]
  - - [1, 1, 1, 1]
    - [116, 8.74126e-05]
  - - [1024, 1856, 1, 32]
    - [84, 2339.13]
  - - [32, 1024, 1, 32]
    - [85, 59.3086]
  - - [4288, 1, 1, 256]
    - [124, 26.4385]
  - - [1856, 128, 1, 3328]
    - [43, 7708.91]
  - - [5888, 2368, 1, 1]
    - [115, 213.584]
  - - [5888, 128, 1, 1]
    - [118, 52.3378]
  - - [704, 256, 1, 1280]
    - [43, 5339.97]
  - - [704, 4288, 1, 256]
    - [40, 14793.3]
  - - [5888, 2368, 1, 32]
    - [94, 3713.12]
  - - [5888, 2368, 1, 1280]
    - [81, 17397.2]
  - - [128, 256, 1, 256]
    - [21, 903.945]
  - - [2944, 5056, 1, 3328]
    - [14, 19327.9]
  - - [6784, 704, 1, 3328]
    - [7, 17237.4]
  - - [1856, 1856, 1, 32]
    - [97, 2670.34]
  - - [4288, 2944, 1, 32]
    - [96, 3193.9]
  - - [128, 448, 1, 1]
    - [134, 4.62452]
  - - [2944, 64, 1, 1]
    - [121, 15.3935]
  - - [704, 64, 1, 256]
    - [17, 1287.31]
  - - [256, 2368, 1, 3328]
    - [39, 9736.78]
  - - [704, 1, 1, 1]
    - [129, 0.0637681]
  - - [128, 448, 1, 1280]
    - [21, 2427.26]
  - - [5056, 5056, 1, 256]
    - [27, 17067.0]
  - - [6784, 6784, 1, 256]
    - [41, 19418.8]
  - - [256, 3584, 1, 1]
    - [124, 69.5079]
  - - [2368, 2944, 1, 256]
    - [28, 16735.5]
  - - [448, 32, 1, 32]
    - [85, 29.2571]
  - - [5888, 3584, 1, 1]
    - [115, 237.428]
  - - [5888, 128, 1, 256]
    - [39, 9494.98]
  - - [3584, 704, 1, 3328]
    - [67, 13422.3]
  - - [4288, 704, 1, 3328]
    - [27, 14879.1]
  - - [4288, 2944, 1, 1280]
    - [14, 18735.0]
  - - [448, 3584, 1, 256]
    - [7, 11443.3]
  - - [704, 32, 1, 256]
    - [99, 169.224]
  - - [6784, 256, 1, 32]
    - [84, 1837.78]
  - - [1856, 128, 1, 1]
    - [116, 19.4092]
  - - [1856, 32, 1, 32]
    - [83, 127.725]
  - - [2368, 5056, 1, 1280]
    - [40, 17946.5]
  - - [704, 1856, 1, 1280]
    - [62, 12197.2]
  - - [448, 1024, 1, 3328]
    - [26, 10462.8]
  - - [32, 704, 1, 32]
    - [83, 43.1158]
  - - [3584, 448, 1, 1]
    - [121, 88.0281]
  - - [6784, 1024, 1, 3328]
    - [7, 16411.3]
  - - [5888, 1856, 1, 32]
    - [91, 3807.71]
  - - [5888, 704, 1, 3328]
    - [33, 13989.8]
  - - [5056, 1, 1, 256]
    - [129, 32.3584]
  - - [448, 6784, 1, 256]
    - [27, 15219.9]
  - - [1024, 128, 1, 1]
    - [118, 10.996]
  - - [128, 64, 1, 256]
    - [17, 227.951]
  - - [128, 5056, 1, 1]
    - [129, 45.4472]
  - - [1856, 128, 1, 256]
    - [22, 5001.43]
  - - [64, 704, 1, 1]
    - [127, 3.68105]
  - - [2944, 5888, 1, 256]
    - [7, 18115.5]
  - - [1408, 64, 1, 256]
    - [21, 2344.38]
  - - [128, 5056, 1, 32]
    - [87, 1092.27]
  - - [128, 5056, 1, 1280]
    - [8, 11182.2]
  - - [448, 32, 1, 3328]
    - [111, 174.993]
  - - [1856, 1408, 1, 32]
    - [105, 2419.67]
  - - [64, 704, 1, 32]
    - [92, 94.3581]
  - - [1, 5888, 1, 256]
    - [129, 40.0885]
  - - [64, 2368, 1, 32]
    - [83, 317.386]
  - - [5888, 64, 1, 32]
    - [88, 361.47]
  - - [2368, 256, 1, 1]
    - [131, 39.2622]
  - - [5888, 64, 1, 1280]
    - [23, 8576.55]
  - - [5056, 1, 1, 1]
    - [119, 0.454676]
  - - [5888, 2944, 1, 1280]
    - [28, 19307.2]
  - - [256, 1408, 1, 256]
    - [64, 5518.82]
  - - [448, 5888, 1, 1]
    - [127, 121.224]
  - - [2944, 128, 1, 32]
    - [106, 649.71]
  - - [3584, 1408, 1, 1]
    - [113, 165.56]
  - - [32, 6784, 1, 1280]
    - [106, 1914.77]
  - - [32, 6784, 1, 32]
    - [92, 466.856]
  - - [32, 1856, 1, 1280]
    - [106, 698.216]
  - - [448, 5888, 1, 32]
    - [95, 2554.79]
  - - [5056, 704, 1, 1280]
    - [56, 13572.6]
  - - [1856, 6784, 1, 1]
    - [117, 206.818]
  - - [5056, 64, 1, 1]
    - [114, 23.7929]
  - - [1, 5888, 1, 1]
    - [134, 0.511111]
  - - [2368, 1024, 1, 256]
    - [80, 12238.9]
  - - [1856, 6784, 1, 32]
    - [100, 3781.11]
  - - [1856, 6784, 1, 1280]
    - [40, 18123.2]
  - - [64, 3584, 1, 3328]
    - [43, 7495.71]
  - - [5888, 5056, 1, 3328]
    - [14, 19636.2]
  - - [1, 2944, 1, 3328]
    - [129, 36.7448]
  - - [1408, 6784, 1, 32]
    - [98, 3473.41]
  - - [32, 5888, 1, 1280]
    - [99, 1665.56]
  - - [448, 256, 1, 1]
    - [121, 9.55733]
  - - [3584, 5888, 1, 3328]
    - [7, 19586.5]
  - - [4288, 1408, 1, 256]
    - [41, 16456.6]
  - - [448, 64, 1, 1280]
    - [42, 1253.42]
  - - [128, 448, 1, 32]
    - [83, 118.235]
  - - [6784, 2368, 1, 256]
    - [14, 17665.4]
  - - [1408, 448, 1, 32]
    - [92, 1236.83]
  - - [1856, 1408, 1, 1280]
    - [28, 13509.5]
  - - [448, 256, 1, 3328]
    - [37, 4756.75]
  - - [1856, 2368, 1, 1]
    - [121, 135.984]
  - - [1408, 5056, 1, 3328]
    - [77, 15294.3]
  - - [128, 704, 1, 3328]
    - [52, 3929.41]
  - - [5056, 128, 1, 1280]
    - [16, 11182.2]
  - - [5056, 4288, 1, 256]
    - [14, 18480.6]
  - - [5056, 5056, 1, 32]
    - [97, 4528.46]
  - - [1856, 704, 1, 256]
    - [76, 10051.0]
  - - [5888, 32, 1, 1280]
    - [99, 1603.54]
  - - [64, 256, 1, 256]
    - [21, 468.114]
  - - [448, 5888, 1, 1280]
    - [41, 14644.4]
  - - [704, 704, 1, 3328]
    - [39, 11248.0]
  - - [128, 6784, 1, 256]
    - [12, 9853.64]
  - - [5056, 448, 1, 256]
    - [7, 13178.7]
  - - [4288, 5888, 1, 1]
    - [112, 206.138]
  - - [1856, 5056, 1, 1280]
    - [14, 17432.1]
  - - [704, 1856, 1, 1]
    - [127, 77.4066]
  - - [2368, 32, 1, 3328]
    - [105, 770.351]
  - - [3584, 1856, 1, 256]
    - [28, 15897.0]
  - - [256, 3584, 1, 256]
    - [7, 9952.59]
  - - [2944, 1408, 1, 1]
    - [126, 122.493]
  - - [4288, 5888, 1, 32]
    - [100, 4118.71]
  - - [4288, 5888, 1, 3328]
    - [66, 18578.6]
  - - [1, 1024, 1, 1]
    - [118, 0.0870748]
  - - [32, 64, 1, 32]
    - [87, 4.20103]
  - - [1408, 2368, 1, 1]
    - [113, 131.473]
  - - [2944, 2368, 1, 256]
    - [28, 16685.5]
  - - [1024, 1856, 1, 256]
    - [7, 12539.7]
  - - [2944, 64, 1, 3328]
    - [35, 6445.81]
  - - [1024, 5888, 1, 32]
    - [84, 3299.21]
  - - [1024, 5888, 1, 3328]
    - [41, 18389.8]
  - - [5056, 2368, 1, 32]
    - [97, 3997.53]
  - - [1408, 2368, 1, 1280]
    - [27, 16097.3]
  - - [256, 1, 1, 3328]
    - [129, 3.19903]
  - - [128, 1024, 1, 32]
    - [92, 271.652]
  - - [5056, 6784, 1, 3328]
    - [41, 18389.0]
  - - [448, 704, 1, 1]
    - [130, 25.2718]
  - - [448, 704, 1, 32]
    - [90, 643.657]
  - - [448, 704, 1, 3328]
    - [31, 7350.31]
  - - [1408, 2944, 1, 256]
    - [78, 14937.5]
  - - [3584, 4288, 1, 1]
    - [126, 213.922]
  - - [2368, 128, 1, 32]
    - [98, 624.957]
  - - [5056, 1408, 1, 1280]
    - [27, 17996.8]
  - - [2368, 128, 1, 3328]
    - [23, 7487.6]
  - - [704, 5056, 1, 32]
    - [84, 2727.53]
  - - [32, 2368, 1, 32]
    - [98, 162.088]
  - - [1408, 1, 1, 256]
    - [129, 10.9094]
  - - [256, 1856, 1, 32]
    - [83, 984.738]
  - - [448, 1408, 1, 1]
    - [133, 42.8522]
  - - [5056, 4288, 1, 1280]
    - [41, 17009.0]
  - - [1408, 256, 1, 256]
    - [31, 5681.94]
  - - [128, 256, 1, 1]
    - [124, 2.64258]
  - - [256, 4288, 1, 32]
    - [95, 1682.34]
  - - [1856, 2368, 1, 1280]
    - [7, 17105.3]
  - - [256, 256, 1, 1]
    - [134, 5.25128]
  - - [1408, 1, 1, 1]
    - [127, 0.126619]
  - - [448, 1408, 1, 256]
    - [26, 8272.58]
  - - [5888, 5888, 1, 1]
    - [117, 272.723]
  - - [128, 2944, 1, 32]
    - [101, 711.004]
  - - [32, 1024, 1, 1280]
    - [111, 348.828]
  - - [32, 256, 1, 32]
    - [87, 15.384]
  - - [2944, 704, 1, 1280]
    - [71, 15373.8]
  - - [1024, 3584, 1, 1280]
    - [60, 16176.4]
  - - [704, 6784, 1, 256]
    - [81, 14111.7]
  - - [1856, 448, 1, 1]
    - [118, 54.9926]
  - - [128, 704, 1, 1]
    - [135, 6.62588]
  - - [5056, 256, 1, 32]
    - [82, 1767.01]
  - - [4288, 1, 1, 3328]
    - [129, 38.4358]
  - - [5056, 1024, 1, 1280]
    - [51, 16063.1]
  - - [704, 704, 1, 1]
    - [137, 36.0186]
  - - [1856, 448, 1, 1280]
    - [40, 11478.7]
  - - [3584, 6784, 1, 256]
    - [28, 18577.9]
  - - [64, 1856, 1, 1280]
    - [24, 4546.76]
  - - [1856, 1408, 1, 256]
    - [27, 14959.6]
  - - [4288, 4288, 1, 32]
    - [91, 4131.9]
  - - [128, 1, 1, 256]
    - [129, 0.989372]
  - - [32, 64, 1, 3328]
    - [99, 26.158]
  - - [5888, 448, 1, 1]
    - [116, 122.121]
  - - [128, 5888, 1, 256]
    - [13, 10219.2]
  - - [3584, 256, 1, 3328]
    - [41, 12651.0]
  - - [5056, 5056, 1, 1280]
    - [41, 17217.8]
  - - [2368, 1, 1, 256]
    - [129, 17.7047]
  - - [6784, 1408, 1, 3328]
    - [14, 17816.3]
  - - [1408, 1408, 1, 1]
    - [124, 91.4421]
  - - [32, 64, 1, 256]
    - [99, 16.1419]
  - - [2368, 1, 1, 1280]
    - [129, 26.5136]
  - - [32, 3584, 1, 32]
    - [92, 246.641]
  - - [2368, 5056, 1, 1]
    - [113, 186.141]
  - - [1, 3584, 1, 1]
    - [127, 0.300671]
  - - [256, 2944, 1, 3328]
    - [9, 11564.9]
  - - [1408, 64, 1, 3328]
    - [48, 3913.01]
  - - [1, 128, 1, 3328]
    - [139, 1.47542]
  - - [32, 256, 1, 256]
    - [105, 55.539]
  - - [5888, 1408, 1, 32]
    - [91, 3705.16]
  - - [704, 256, 1, 1]
    - [124, 14.5342]
  - - [1, 448, 1, 1]
    - [114, 0.0333333]
  - - [256, 6784, 1, 3328]
    - [14, 14230.2]
  - - [64, 5888, 1, 256]
    - [4, 6380.22]
  - - [1856, 1, 1, 1]
    - [138, 0.127473]
  - - [1024, 256, 1, 3328]
    - [43, 8473.34]
  - - [704, 704, 1, 256]
    - [26, 7969.7]
  - - [448, 1024, 1, 32]
    - [99, 784.191]
  - - [6784, 2368, 1, 1280]
    - [77, 15474.5]
  - - [128, 1856, 1, 1280]
    - [25, 6987.29]
  - - [256, 2368, 1, 256]
    - [39, 7822.04]
  - - [1024, 448, 1, 32]
    - [87, 955.733]
  - - [6784, 1024, 1, 256]
    - [28, 16840.8]
  - - [1408, 6784, 1, 3328]
    - [28, 17954.8]
  - - [2944, 1408, 1, 3328]
    - [40, 17101.9]
  - - [1856, 32, 1, 256]
    - [106, 451.436]
  - - [704, 2368, 1, 32]
    - [98, 2070.9]
  - - [448, 256, 1, 32]
    - [90, 240.184]
  - - [704, 6784, 1, 1]
    - [133, 140.469]
  - - [2368, 6784, 1, 256]
    - [41, 18012.0]
  - - [1856, 64, 1, 256]
    - [24, 3090.32]
  - - [1856, 3584, 1, 3328]
    - [58, 14018.2]
  - - [1, 704, 1, 3328]
    - [139, 8.02147]
  - - [5056, 1408, 1, 32]
    - [91, 3524.18]
  - - [64, 1, 1, 3328]
    - [130, 0.689383]
  - - [5056, 4288, 1, 3328]
    - [40, 18902.4]
  - - [4288, 2368, 1, 1]
    - [113, 185.292]
  - - [704, 448, 1, 256]
    - [26, 5046.27]
  - - [448, 64, 1, 3328]
    - [42, 1401.58]
  - - [2368, 256, 1, 1280]
    - [26, 9867.07]
  - - [2368, 448, 1, 1280]
    - [76, 9115.91]
  - - [6784, 2944, 1, 32]
    - [91, 4389.47]
  - - [64, 4288, 1, 32]
    - [87, 562.937]
  - - [3584, 1856, 1, 1]
    - [121, 165.966]
  - - [128, 448, 1, 3328]
    - [42, 2701.6]
  - - [5888, 2368, 1, 3328]
    - [14, 18729.6]
  - - [2368, 704, 1, 1280]
    - [14, 13363.3]
  - - [1024, 1408, 1, 1280]
    - [14, 14319.5]
  - - [4288, 64, 1, 1280]
    - [23, 6326.96]
  - - [2368, 6784, 1, 1]
    - [126, 205.534]
  - - [2944, 5056, 1, 32]
    - [91, 4166.51]
  - - [5056, 256, 1, 3328]
    - [40, 13420.8]
  - - [448, 448, 1, 1]
    - [127, 16.3974]
  - - [256, 2368, 1, 1280]
    - [26, 9857.04]
  - - [704, 2368, 1, 3328]
    - [40, 13746.3]
  - - [3584, 2944, 1, 256]
    - [60, 16690.1]
  - - [64, 6784, 1, 256]
    - [4, 6981.72]
  - - [3584, 1024, 1, 1280]
    - [7, 17692.2]
  - - [1408, 256, 1, 32]
    - [85, 724.519]
  - - [64, 1024, 1, 256]
    - [0, 1718.98]
  - - [1408, 32, 1, 32]
    - [99, 90.112]
  - - [256, 32, 1, 1280]
    - [99, 94.5004]
  - - [4288, 2944, 1, 1]
    - [124, 184.56]
  - - [5056, 3584, 1, 256]
    - [78, 17170.9]
  - - [2368, 704, 1, 256]
    - [27, 11546.8]
  - - [1856, 1856, 1, 1280]
    - [7, 16641.2]
  - - [64, 32, 1, 32]
    - [98, 4.45217]
  - - [4288, 704, 1, 1]
    - [113, 101.437]
  - - [1856, 1024, 1, 1]
    - [117, 111.534]
  - - [4288, 2944, 1, 3328]
    - [28, 17679.5]
  - - [1024, 128, 1, 3328]
    - [50, 5447.15]
  - - [4288, 128, 1, 3328]
    - [23, 9914.35]
  - - [4288, 704, 1, 32]
    - [101, 2500.0]
  - - [1856, 1024, 1, 32]
    - [91, 2282.94]
  - - [1, 448, 1, 3328]
    - [139, 5.16397]
  - - [6784, 2368, 1, 32]
    - [82, 3818.07]
  - - [5888, 5056, 1, 1]
    - [113, 258.957]
  - - [128, 6784, 1, 1280]
    - [27, 12144.8]
  - - [704, 5888, 1, 1]
    - [113, 155.599]
  - - [6784, 6784, 1, 1]
    - [117, 293.812]
  - - [5888, 448, 1, 3328]
    - [28, 15005.2]
  - - [704, 5888, 1, 32]
    - [105, 2824.64]
  - - [704, 5888, 1, 1280]
    - [68, 16457.2]
  - - [1024, 6784, 1, 3328]
    - [40, 17732.5]
  - - [704, 2944, 1, 1280]
    - [27, 16638.8]
  - - [4288, 6784, 1, 256]
    - [27, 18263.1]
  - - [3584, 256, 1, 32]
    - [83, 1433.6]
  - - [1408, 1408, 1, 32]
    - [91, 2298.51]
  - - [1408, 1408, 1, 3328]
    - [14, 16091.8]
  - - [1024, 64, 1, 256]
    - [21, 1762.31]
  - - [4288, 64, 1, 32]
    - [105, 532.878]
  - - [5888, 6784, 1, 32]
    - [84, 4290.45]
  - - [1024, 2944, 1, 3328]
    - [27, 16997.8]
  - - [64, 704, 1, 1280]
    - [50, 1912.19]
  - - [2944, 1856, 1, 256]
    - [78, 14010.4]
  - - [128, 5056, 1, 3328]
    - [23, 11735.9]
  - - [704, 1408, 1, 1]
    - [127, 74.641]
  - - [6784, 5056, 1, 32]
    - [101, 3997.66]
  - - [1024, 448, 1, 3328]
    - [26, 9633.56]
  - - [5888, 1408, 1, 1]
    - [113, 181.169]
  - - [2944, 4288, 1, 1280]
    - [41, 15969.5]
  - - [64, 32, 1, 3328]
    - [106, 26.9184]
  - - [1024, 4288, 1, 256]
    - [14, 13953.2]
  - - [128, 2368, 1, 256]
    - [22, 5358.74]
  - - [2368, 64, 1, 32]
    - [92, 309.29]
  - - [1408, 1, 1, 3328]
    - [129, 17.542]
  - - [64, 1408, 1, 32]
    - [92, 163.099]
  - - [2368, 5888, 1, 1]
    - [115, 186.8]
  - - [448, 1856, 1, 256]
    - [39, 8928.73]
  - - [1856, 6784, 1, 3328]
    - [7, 18709.4]
  - - [3584, 128, 1, 256]
    - [13, 7414.17]
  - - [1024, 448, 1, 1280]
    - [26, 9106.74]
  - - [1024, 2368, 1, 32]
    - [92, 2260.92]
  - - [128, 5888, 1, 1]
    - [114, 60.7794]
  - - [64, 5056, 1, 1]
    - [118, 26.2649]
  - - [1856, 256, 1, 32]
    - [99, 964.743]
  - - [2368, 2368, 1, 3328]
    - [7, 18476.7]
  - - [64, 448, 1, 1]
    - [119, 1.99111]
  - - [3584, 5888, 1, 32]
    - [84, 4103.57]
  - - [3584, 5888, 1, 1280]
    - [27, 18686.2]
  - - [64, 5056, 1, 32]
    - [87, 670.64]
  - - [6784, 704, 1, 256]
    - [41, 14924.8]
  - - [1408, 704, 1, 32]
    - [90, 1680.05]
  - - [1408, 704, 1, 1280]
    - [19, 12936.1]
  - - [2368, 5888, 1, 256]
    - [7, 18100.2]
  - - [2944, 64, 1, 32]
    - [83, 396.665]
  - - [1, 1408, 1, 256]
    - [119, 10.7532]
  - - [64, 2944, 1, 256]
    - [22, 4129.67]
  - - [5888, 5888, 1, 32]
    - [104, 4303.98]
  - - [1856, 1408, 1, 3328]
    - [55, 14969.8]
  - - [1024, 1024, 1, 32]
    - [90, 1815.72]
  - - [6784, 704, 1, 1]
    - [120, 144.55]
  - - [2944, 5056, 1, 1280]
    - [74, 15269.4]
  - - [6784, 2944, 1, 1280]
    - [68, 18265.4]
  - - [6784, 256, 1, 3328]
    - [7, 14233.0]
  - - [5056, 128, 1, 3328]
    - [29, 11679.9]
  - - [128, 128, 1, 1280]
    - [34, 724.155]
  - - [5888, 64, 1, 1]
    - [121, 26.9166]
  - - [1408, 5056, 1, 32]
    - [91, 3519.83]
  - - [2944, 128, 1, 3328]
    - [43, 8801.92]
  - - [5888, 1856, 1, 1280]
    - [71, 16875.8]
  - - [256, 64, 1, 1280]
    - [42, 730.206]
  - - [5888, 256, 1, 1280]
    - [73, 12476.5]
  - - [1856, 5056, 1, 1]
    - [117, 193.883]
  - - [3584, 1856, 1, 1280]
    - [63, 16376.4]
  - - [704, 3584, 1, 256]
    - [40, 14417.9]
  - - [1856, 5056, 1, 32]
    - [91, 3709.07]
  - - [1856, 5056, 1, 3328]
    - [41, 17605.7]
  - - [1024, 2944, 1, 32]
    - [98, 2709.8]
  - - [1408, 6784, 1, 256]
    - [60, 16785.3]
  - - [1024, 2368, 1, 1280]
    - [7, 15420.2]
  - - [1856, 3584, 1, 1]
    - [124, 172.151]
  - - [2944, 5888, 1, 1280]
    - [28, 17814.1]
  - - [1, 1856, 1, 1]
    - [121, 0.16338]
  - - [3584, 3584, 1, 256]
    - [7, 17717.3]
  - - [1856, 2368, 1, 3328]
    - [14, 17369.6]
  - - [5888, 704, 1, 256]
    - [7, 14141.2]
  - - [64, 448, 1, 32]
    - [98, 59.7333]
  - - [6784, 4288, 1, 256]
    - [78, 17267.2]
  - - [128, 64, 1, 3328]
    - [52, 403.298]
  - - [1, 5056, 1, 1280]
    - [134, 40.0872]
  - - [32, 64, 1, 1280]
    - [99, 23.5572]
  - - [1408, 2368, 1, 3328]
    - [40, 16377.4]
  - - [1024, 3584, 1, 256]
    - [40, 15493.5]
  - - [2944, 128, 1, 256]
    - [4, 6518.18]
  - - [6784, 128, 1, 1]
    - [116, 53.7347]
  - - [1408, 256, 1, 3328]
    - [26, 8234.29]
  - - [2368, 1408, 1, 1]
    - [117, 134.009]
  - - [448, 32, 1, 256]
    - [99, 103.323]
  - - [5056, 6784, 1, 1280]
    - [26, 15672.3]
  - - [64, 2368, 1, 256]
    - [21, 3619.15]
  - - [2944, 256, 1, 256]
    - [59, 8644.17]
  - - [1, 128, 1, 256]
    - [134, 0.945958]
  - - [32, 256, 1, 1280]
    - [106, 94.3643]
  - - [5888, 1, 1, 256]
    - [124, 37.2364]
  - - [1856, 32, 1, 1280]
    - [109, 633.093]
  - - [6784, 128, 1, 256]
    - [5, 9516.19]
  - - [6784, 64, 1, 1280]
    - [36, 9324.59]
  - - [4288, 1024, 1, 32]
    - [91, 3130.78]
  - - [2944, 448, 1, 1280]
    - [14, 13197.4]
  - - [6784, 32, 1, 1280]
    - [99, 1914.78]
  - - [2944, 64, 1, 1280]
    - [35, 5957.82]
  - - [704, 448, 1, 1]
    - [133, 24.795]
  - - [32, 128, 1, 32]
    - [92, 8.71489]
  - - [1, 128, 1, 1]
    - [129, 0.0109589]
  - - [32, 4288, 1, 256]
    - [99, 969.296]
  - - [5888, 1, 1, 1]
    - [121, 0.507586]
  - - [5888, 1856, 1, 3328]
    - [62, 17325.1]
  - - [2368, 3584, 1, 256]
    - [7, 16995.1]
  - - [4288, 1408, 1, 3328]
    - [28, 18414.8]
  - - [1856, 32, 1, 3328]
    - [107, 648.138]
  - - [2944, 32, 1, 256]
    - [99, 749.914]
  - - [128, 64, 1, 1]
    - [134, 0.636025]
  - - [256, 1024, 1, 3328]
    - [31, 8054.06]
  - - [32, 448, 1, 256]
    - [106, 101.494]
  - - [1856, 64, 1, 32]
    - [98, 215.971]
  - - [1856, 64, 1, 3328]
    - [53, 4946.36]
  - - [256, 5056, 1, 256]
    - [7, 10871.1]
  - - [5888, 2944, 1, 3328]
    - [14, 19284.0]
  - - [2368, 1408, 1, 3328]
    - [27, 15642.3]
  - - [5888, 704, 1, 32]
    - [84, 2810.27]
  - - [2944, 704, 1, 1]
    - [121, 105.744]
  - - [6784, 1856, 1, 256]
    - [55, 16546.8]
  - - [1, 704, 1, 256]
    - [129, 4.99512]
  - - [1856, 1856, 1, 1]
    - [114, 140.716]
  - - [5888, 32, 1, 256]
    - [99, 1288.31]
  - - [2368, 1856, 1, 1]
    - [117, 153.457]
  - - [128, 704, 1, 256]
    - [24, 2344.38]
  - - [256, 1408, 1, 3328]
    - [43, 8367.54]
  - - [2944, 128, 1, 1]
    - [114, 30.587]
  - - [32, 256, 1, 3328]
    - [99, 104.922]
  - - [2944, 704, 1, 3328]
    - [26, 14578.8]
  - - [2368, 1856, 1, 32]
    - [97, 2994.89]
  - - [3584, 128, 1, 1280]
    - [23, 9878.91]
  - - [1024, 5056, 1, 3328]
    - [56, 16706.3]
  - - [256, 32, 1, 32]
    - [92, 15.384]
  - - [64, 256, 1, 3328]
    - [48, 807.553]
  - - [256, 6784, 1, 1]
    - [113, 105.897]
  - - [1024, 3584, 1, 32]
    - [97, 2850.5]
  - - [256, 6784, 1, 32]
    - [92, 1903.24]
  - - [2944, 1408, 1, 32]
    - [97, 3087.64]
  - - [1024, 32, 1, 256]
    - [99, 249.661]
  - - [4288, 3584, 1, 1]
    - [123, 201.365]
  - - [1, 704, 1, 1]
    - [124, 0.0615385]
  - - [5056, 448, 1, 3328]
    - [27, 15083.6]
  - - [3584, 64, 1, 256]
    - [3, 4705.15]
  - - [64, 1856, 1, 32]
    - [98, 182.044]
  - - [64, 1856, 1, 3328]
    - [24, 4951.32]
  - - [5888, 5888, 1, 3328]
    - [27, 18188.8]
  - - [6784, 3584, 1, 32]
    - [84, 4170.47]
  - - [4288, 1856, 1, 256]
    - [41, 16732.8]
  - - [1856, 2944, 1, 256]
    - [68, 15625.6]
  - - [4288, 256, 1, 1]
    - [132, 51.585]
  - - [64, 128, 1, 32]
    - [83, 16.8041]
  - - [704, 1, 1, 1280]
    - [134, 8.01138]
  - - [1024, 2368, 1, 256]
    - [40, 13471.3]
  - - [6784, 1024, 1, 1]
    - [113, 192.113]
  - - [1024, 1856, 1, 3328]
    - [27, 15542.1]
  - - [5888, 1024, 1, 32]
    - [98, 3224.23]
  - - [3584, 256, 1, 1280]
    - [27, 12754.2]
  - - [1024, 1, 1, 1]
    - [137, 0.0790123]
  - - [1408, 5056, 1, 1280]
    - [63, 17117.7]
  - - [5056, 6784, 1, 256]
    - [41, 16731.6]
  - - [256, 1856, 1, 256]
    - [26, 7489.83]
  - - [256, 704, 1, 1]
    - [127, 14.5342]
  - - [256, 128, 1, 32]
    - [87, 68.2667]
  - - [1408, 1856, 1, 32]
    - [90, 2453.75]
  - - [2944, 5056, 1, 1]
    - [113, 235.222]
  - - [448, 128, 1, 1]
    - [114, 4.84324]
  - - [256, 704, 1, 32]
    - [90, 377.432]
  - - [256, 704, 1, 1280]
    - [18, 5359.82]
  - - [1, 2368, 1, 1]
    - [121, 0.169143]
  - - [5888, 5888, 1, 1280]
    - [66, 19132.7]
  - - [256, 2944, 1, 1280]
    - [26, 12217.5]
  - - [2944, 256, 1, 3328]
    - [26, 12734.5]
  - - [5056, 2944, 1, 1280]
    - [28, 18439.0]
  - - [704, 1024, 1, 3328]
    - [26, 12185.8]
  - - [2368, 1856, 1, 1280]
    - [68, 15887.9]
  - - [448, 2944, 1, 1]
    - [113, 73.2729]
  - - [6784, 2944, 1, 1]
    - [120, 235.076]
  - - [2944, 1024, 1, 32]
    - [92, 2455.93]
  - - [2944, 1024, 1, 1280]
    - [41, 16806.4]
  - - [1408, 64, 1, 32]
    - [83, 163.099]
  - - [2368, 4288, 1, 256]
    - [14, 17525.7]
  - - [448, 1856, 1, 1280]
    - [40, 11598.8]
  - - [2368, 448, 1, 1]
    - [116, 70.9134]
  - - [448, 2944, 1, 32]
    - [92, 1838.2]
  - - [448, 2944, 1, 1280]
    - [7, 13297.2]
  - - [2944, 6784, 1, 1280]
    - [7, 18343.0]
  - - [256, 6784, 1, 1280]
    - [27, 13991.6]
  - - [5056, 128, 1, 256]
    - [5, 8888.14]
  - - [3584, 2368, 1, 32]
    - [97, 3584.76]
  - - [704, 32, 1, 32]
    - [95, 42.9105]
  - - [6784, 3584, 1, 3328]
    - [66, 17341.7]
  - - [128, 32, 1, 256]
    - [101, 30.4819]
  - - [128, 1408, 1, 1280]
    - [22, 5744.19]
  - - [64, 32, 1, 1280]
    - [99, 23.3058]
  - - [128, 1856, 1, 3328]
    - [46, 7745.16]
  - - [2944, 2944, 1, 256]
    - [14, 17004.8]
  - - [5056, 2368, 1, 1280]
    - [40, 17896.2]
  - - [448, 128, 1, 32]
    - [90, 116.435]
  - - [32, 5056, 1, 3328]
    - [99, 1524.13]
  - - [448, 2944, 1, 3328]
    - [7, 13634.9]
  - - [2944, 1024, 1, 1]
    - [113, 123.551]
  - - [256, 4288, 1, 1]
    - [126, 69.301]
  - - [2368, 128, 1, 1280]
    - [23, 7008.18]
  - - [3584, 704, 1, 256]
    - [62, 13367.6]
  - - [2368, 5888, 1, 3328]
    - [27, 18806.1]
  - - [1408, 3584, 1, 32]
    - [91, 3072.31]
  - - [2944, 4288, 1, 32]
    - [91, 4149.18]
  - - [5888, 1408, 1, 1280]
    - [28, 19044.5]
  - - [3584, 5056, 1, 1280]
    - [27, 18226.6]
  - - [5888, 6784, 1, 1280]
    - [14, 18914.6]
  - - [64, 1856, 1, 1]
    - [114, 10.0324]
  - - [704, 128, 1, 32]
    - [98, 188.716]
  - - [128, 3584, 1, 3328]
    - [39, 10417.1]
  - - [256, 4288, 1, 3328]
    - [40, 11402.1]
  - - [1, 1408, 1, 1280]
    - [134, 15.1908]
  - - [6784, 1408, 1, 32]
    - [97, 3836.09]
  - - [1856, 704, 1, 32]
    - [95, 2115.99]
  - - [128, 4288, 1, 1]
    - [119, 45.4358]
  - - [704, 5056, 1, 3328]
    - [40, 17469.5]
  - - [1024, 3584, 1, 3328]
    - [69, 15153.6]
  - - [3584, 1024, 1, 3328]
    - [60, 16689.2]
  - - [1856, 1408, 1, 1]
    - [116, 111.868]
  - - [2944, 448, 1, 32]
    - [100, 1819.19]
  - - [128, 448, 1, 256]
    - [21, 1529.17]
  - - [128, 1024, 1, 1]
    - [116, 9.05193]
  - - [32, 32, 1, 256]
    - [99, 7.58519]
  - - [4288, 5056, 1, 1280]
    - [28, 15454.7]
  - - [1856, 1856, 1, 3328]
    - [14, 17047.4]
  - - [3584, 1856, 1, 3328]
    - [80, 14144.3]
  - - [4288, 2368, 1, 3328]
    - [40, 18333.6]
  - - [256, 64, 1, 32]
    - [85, 32.4436]
  - - [1, 1024, 1, 1280]
    - [134, 11.4734]
  - - [32, 1408, 1, 256]
    - [106, 308.075]
  - - [448, 6784, 1, 32]
    - [83, 2570.17]
  - - [5888, 3584, 1, 256]
    - [7, 18567.0]
  - - [32, 1024, 1, 256]
    - [99, 243.855]
  - - [5888, 448, 1, 1280]
    - [41, 14523.5]
  - - [704, 5888, 1, 3328]
    - [40, 17830.4]
  - - [1024, 1408, 1, 256]
    - [14, 11037.6]
  - - [3584, 2944, 1, 1280]
    - [41, 17432.9]
  - - [1, 5056, 1, 256]
    - [134, 32.4232]
  - - [256, 1024, 1, 1]
    - [114, 21.8453]
  - - [32, 32, 1, 3328]
    - [103, 11.8692]
  - - [5056, 128, 1, 32]
    - [99, 1232.7]
  - - [2368, 1, 1, 3328]
    - [139, 27.4016]
  - - [4288, 1856, 1, 1280]
    - [51, 16434.7]
  - - [3584, 5888, 1, 1]
    - [117, 263.256]
  - - [5888, 4288, 1, 256]
    - [81, 17517.9]
  - - [1024, 2944, 1, 1280]
    - [7, 16400.7]
  - - [6784, 1, 1, 1]
    - [129, 0.593007]
  - - [1408, 64, 1, 1280]
    - [21, 3559.98]
  - - [1, 256, 1, 1280]
    - [129, 2.87237]
  - - [2944, 3584, 1, 256]
    - [7, 17449.2]
  - - [1, 128, 1, 1280]
    - [134, 1.4242]
  - - [1024, 256, 1, 32]
    - [99, 504.123]
  - - [5888, 1, 1, 1280]
    - [134, 44.7757]
  - - [2368, 32, 1, 1280]
    - [106, 890.827]
  - - [6784, 448, 1, 1]
    - [114, 131.455]
  - - [6784, 128, 1, 1280]
    - [27, 12081.4]
  - - [448, 2368, 1, 1280]
    - [7, 10682.1]
  - - [6784, 2368, 1, 3328]
    - [7, 18770.9]
  - - [1, 64, 1, 256]
    - [114, 0.46865]
  - - [704, 128, 1, 1]
    - [118, 7.31429]
  - - [1408, 4288, 1, 32]
    - [91, 3440.17]
  - - [32, 1408, 1, 3328]
    - [106, 585.362]
  - - [256, 448, 1, 256]
    - [24, 2959.69]
  - - [1856, 1024, 1, 1280]
    - [7, 15265.4]
  - - [1024, 448, 1, 1]
    - [121, 37.7263]
  - - [4288, 3584, 1, 1280]
    - [66, 18681.9]
  - - [448, 1024, 1, 1280]
    - [39, 9892.23]
  - - [5056, 1856, 1, 1]
    - [115, 185.894]
  - - [5888, 2368, 1, 256]
    - [58, 17435.3]
  - - [1408, 1024, 1, 32]
    - [82, 1948.37]
  - - [32, 704, 1, 256]
    - [107, 157.401]
  - - [2944, 1, 1, 256]
    - [129, 21.5087]
  - - [704, 1024, 1, 32]
    - [90, 1328.84]
  - - [5056, 1856, 1, 32]
    - [91, 3826.27]
  - - [5056, 1856, 1, 1280]
    - [40, 17643.1]
  - - [1, 64, 1, 1]
    - [120, 0.00610687]
  - - [1408, 5888, 1, 3328]
    - [7, 17732.3]
  - - [1408, 704, 1, 3328]
    - [32, 13763.4]
  - - [5056, 704, 1, 3328]
    - [7, 15799.4]
  - - [704, 64, 1, 1280]
    - [53, 1912.19]
  - - [1, 704, 1, 1280]
    - [119, 7.03121]
  - - [1408, 256, 1, 1]
    - [114, 29.6421]
  - - [5888, 4288, 1, 32]
    - [91, 4540.96]
  - - [1408, 3584, 1, 256]
    - [7, 15956.6]
  - - [1408, 6784, 1, 1]
    - [116, 186.852]
  - - [2944, 1, 1, 1]
    - [118, 0.259155]
  - - [256, 1856, 1, 3328]
    - [26, 10812.7]
  - - [4288, 128, 1, 1280]
    - [8, 9283.11]
  - - [128, 128, 1, 1]
    - [119, 1.45248]
  - - [6784, 256, 1, 1280]
    - [20, 13607.9]
  - - [128, 4288, 1, 256]
    - [5, 7669.72]
  - - [2368, 6784, 1, 1280]
    - [56, 15832.0]
  - - [128, 128, 1, 32]
    - [83, 34.6751]
  - - [128, 128, 1, 3328]
    - [52, 807.553]
  - - [128, 1408, 1, 32]
    - [92, 373.521]
  - - [6784, 128, 1, 32]
    - [105, 1453.31]
  - - [1408, 448, 1, 1]
    - [118, 43.3231]
  - - [2368, 704, 1, 3328]
    - [41, 13479.1]
  - - [704, 128, 1, 3328]
    - [52, 3945.96]
  - - [2944, 1856, 1, 32]
    - [95, 2961.55]
  - - [5888, 1856, 1, 1]
    - [120, 202.373]
  - - [1408, 32, 1, 1280]
    - [103, 437.437]
  - - [704, 1, 1, 256]
    - [129, 5.53514]
  - - [1856, 2944, 1, 3328]
    - [40, 17574.2]
  - - [3584, 2944, 1, 1]
    - [113, 195.975]
  - - [5888, 64, 1, 256]
    - [23, 6152.36]
  - - [64, 5056, 1, 1280]
    - [23, 7470.91]
  - - [1408, 2944, 1, 1]
    - [117, 145.956]
  - - [4288, 1408, 1, 32]
    - [91, 3510.18]
  - - [5888, 2944, 1, 256]
    - [7, 18192.7]
  - - [128, 64, 1, 1280]
    - [42, 376.644]
  - - [1408, 2944, 1, 32]
    - [105, 2913.99]
  - - [1, 3584, 1, 1280]
    - [129, 31.7168]
  - - [64, 64, 1, 32]
    - [98, 8.44536]
  - - [448, 1408, 1, 32]
    - [101, 1092.27]
  - - [128, 5056, 1, 256]
    - [23, 8812.5]
  - - [1, 1, 1, 1280]
    - [119, 0.0108992]
  - - [64, 704, 1, 256]
    - [17, 1242.92]
  - - [3584, 1408, 1, 1280]
    - [28, 14896.7]
  - - [5888, 6784, 1, 256]
    - [28, 16589.4]
  - - [6784, 5888, 1, 1]
    - [122, 229.353]
  - - [64, 4288, 1, 256]
    - [1, 4851.84]
  - - [1, 448, 1, 1280]
    - [134, 4.97087]
  - - [1024, 1024, 1, 1]
    - [114, 79.4376]
  - - [6784, 5888, 1, 1280]
    - [14, 18937.0]
  - - [1024, 4288, 1, 32]
    - [97, 2981.94]
  - - [1856, 1, 1, 1280]
    - [129, 18.2632]
  - - [3584, 5888, 1, 256]
    - [7, 17761.2]
  - - [5056, 2368, 1, 1]
    - [113, 195.375]
  - - [256, 1408, 1, 1280]
    - [26, 7782.95]
  - - [64, 256, 1, 32]
    - [98, 33.6082]
  - - [64, 5888, 1, 3328]
    - [16, 9103.49]
  - - [6784, 64, 1, 3328]
    - [23, 9929.48]
  - - [5056, 448, 1, 1]
    - [114, 114.63]
  - - [2944, 448, 1, 3328]
    - [40, 13611.2]
  - - [1856, 6784, 1, 256]
    - [7, 17487.6]
  - - [4288, 32, 1, 1280]
    - [106, 1211.62]
  - - [448, 1408, 1, 1280]
    - [39, 10235.8]
  - - [5056, 448, 1, 32]
    - [92, 2172.75]
  - - [3584, 2944, 1, 32]
    - [97, 3955.5]
  - - [2368, 128, 1, 1]
    - [118, 24.7634]
  - - [128, 3584, 1, 32]
    - [92, 960.737]
  - - [3584, 1856, 1, 32]
    - [97, 3455.53]
  - - [4288, 64, 1, 3328]
    - [23, 6795.46]
  - - [5056, 64, 1, 256]
    - [11, 5627.55]
  - - [1024, 1856, 1, 1]
    - [118, 97.3639]
  - - [64, 448, 1, 3328]
    - [42, 1428.45]
  - - [4288, 1408, 1, 1280]
    - [40, 17640.6]
  - - [32, 5056, 1, 256]
    - [106, 1056.6]
  - - [704, 128, 1, 256]
    - [21, 2383.13]
  - - [704, 5056, 1, 1]
    - [119, 132.419]
  - - [256, 1024, 1, 32]
    - [109, 429.744]
  - - [256, 1024, 1, 1280]
    - [43, 7410.43]
  - - [2368, 128, 1, 256]
    - [11, 5388.52]
  - - [2368, 1408, 1, 1280]
    - [14, 16185.2]
  - - [128, 256, 1, 32]
    - [101, 63.0154]
  - - [64, 6784, 1, 32]
    - [87, 918.891]
  - - [6784, 32, 1, 256]
    - [101, 1338.5]
  - - [5056, 2944, 1, 1]
    - [126, 191.421]
  - - [3584, 128, 1, 1]
    - [114, 33.7318]
  - - [1024, 4288, 1, 1280]
    - [41, 15615.6]
  - - [1856, 4288, 1, 1]
    - [117, 169.186]
  - - [128, 2944, 1, 256]
    - [9, 6280.53]
  - - [3584, 4288, 1, 256]
    - [14, 18140.2]
  - - [3584, 128, 1, 32]
    - [86, 667.276]
  - - [3584, 128, 1, 3328]
    - [26, 10405.7]
  - - [704, 5056, 1, 256]
    - [60, 14908.6]
  - - [1856, 4288, 1, 32]
    - [97, 3505.96]
  - - [5056, 1, 1, 1280]
    - [134, 40.1469]
  - - [64, 256, 1, 1280]
    - [21, 728.178]
  - - [4288, 1024, 1, 1280]
    - [27, 16811.3]
  - - [1, 4288, 1, 256]
    - [119, 28.8876]
  - - [2944, 3584, 1, 1]
    - [113, 218.363]
  - - [4288, 6784, 1, 32]
    - [91, 4611.94]
  - - [4288, 4288, 1, 256]
    - [27, 17743.7]
  - - [3584, 3584, 1, 1]
    - [113, 209.067]
  - - [3584, 1408, 1, 256]
    - [27, 16083.7]
  - - [704, 3584, 1, 3328]
    - [28, 14111.6]
  - - [5056, 448, 1, 1280]
    - [14, 14944.9]
  - - [1408, 2944, 1, 1280]
    - [7, 17814.2]
  - - [5888, 704, 1, 1280]
    - [71, 16396.1]
  - - [64, 64, 1, 256]
    - [17, 105.703]
  - - [704, 1408, 1, 1280]
    - [40, 13791.1]
  - - [4288, 5888, 1, 256]
    - [68, 17702.2]
  - - [3584, 3584, 1, 3328]
    - [7, 19354.3]
  - - [2944, 6784, 1, 32]
    - [97, 4265.26]
  - - [448, 64, 1, 32]
    - [90, 59.7333]
  - - [5056, 256, 1, 1]
    - [118, 80.896]
  - - [64, 6784, 1, 1280]
    - [23, 9400.29]
  - - [2944, 2368, 1, 3328]
    - [14, 16868.9]
  - - [1, 4288, 1, 1]
    - [121, 0.362162]
  - - [1408, 128, 1, 256]
    - [24, 4032.98]
  - - [1024, 1856, 1, 1280]
    - [40, 15166.4]
  - - [1024, 5888, 1, 256]
    - [81, 15227.9]
  - - [704, 1408, 1, 256]
    - [14, 10716.0]
  - - [6784, 2944, 1, 3328]
    - [14, 19435.3]
  - - [1408, 2368, 1, 256]
    - [27, 14496.3]
  - - [1024, 1408, 1, 1]
    - [117, 79.3938]
  - - [64, 128, 1, 1280]
    - [49, 386.643]
  - - [5888, 32, 1, 3328]
    - [101, 1546.28]
  - - [1408, 5056, 1, 256]
    - [14, 16974.9]
  - - [1024, 1408, 1, 32]
    - [89, 1836.68]
  - - [4288, 1024, 1, 1]
    - [113, 142.933]
  - - [448, 704, 1, 256]
    - [18, 5149.26]
  - - [704, 3584, 1, 32]
    - [101, 2431.94]
  - - [1856, 256, 1, 3328]
    - [46, 10458.0]
  - - [6784, 448, 1, 256]
    - [66, 11550.5]
  - - [4288, 4288, 1, 1]
    - [123, 201.258]
  - - [256, 2944, 1, 1]
    - [118, 61.174]
  - - [64, 2368, 1, 3328]
    - [48, 5324.8]
  - - [256, 704, 1, 3328]
    - [46, 5940.82]
  - - [1, 2944, 1, 1]
    - [129, 0.15794]
  - - [1024, 1024, 1, 256]
    - [26, 10859.0]
  - - [4288, 704, 1, 1280]
    - [57, 14379.3]
  - - [3584, 1, 1, 1]
    - [119, 0.315493]
  - - [256, 2944, 1, 32]
    - [92, 1449.35]
  - - [6784, 4288, 1, 3328]
    - [78, 18167.2]
  - - [5056, 2944, 1, 3328]
    - [40, 18701.6]
  - - [704, 1024, 1, 1280]
    - [39, 10810.1]
  - - [256, 3584, 1, 1280]
    - [32, 12336.2]
  - - [2368, 1856, 1, 3328]
    - [62, 15751.9]
  - - [1856, 4288, 1, 1280]
    - [58, 17221.6]
  - - [1, 1024, 1, 256]
    - [119, 7.33065]
  - - [2944, 1024, 1, 3328]
    - [68, 15652.7]
  - - [2944, 256, 1, 32]
    - [98, 1470.56]
  - - [128, 1, 1, 3328]
    - [129, 1.5976]
  - - [5888, 5056, 1, 32]
    - [97, 4675.26]
  - - [4288, 1408, 1, 1]
    - [113, 167.708]
  - - [3584, 448, 1, 32]
    - [97, 1922.91]
  - - [3584, 448, 1, 1280]
    - [7, 12929.1]
  - - [2944, 6784, 1, 3328]
    - [55, 18134.6]
  - - [1024, 1408, 1, 3328]
    - [27, 13781.8]
  - - [6784, 1024, 1, 1280]
    - [63, 16935.7]
  - - [6784, 3584, 1, 1280]
    - [40, 18834.2]
  - - [1, 5056, 1, 3328]
    - [134, 42.6978]
  - - [4288, 64, 1, 1]
    - [119, 20.0608]
  - - [128, 2368, 1, 32]
    - [83, 520.35]
  - - [128, 1408, 1, 3328]
    - [22, 6227.01]
  - - [2944, 32, 1, 3328]
    - [99, 1191.56]
  - - [704, 1856, 1, 256]
    - [7, 11392.9]
  - - [2944, 2944, 1, 1]
    - [113, 188.416]
  - - [1408, 4288, 1, 256]
    - [27, 16317.6]
  - - [5888, 5056, 1, 256]
    - [81, 17849.5]
  - - [256, 5056, 1, 3328]
    - [62, 12521.9]
  - - [2368, 64, 1, 1280]
    - [21, 4948.64]
  - - [1856, 448, 1, 32]
    - [97, 1146.88]
  - - [1408, 448, 1, 256]
    - [59, 6936.46]
  - - [32, 128, 1, 256]
    - [99, 32.2044]
  - - [448, 1024, 1, 1]
    - [114, 38.4859]
  - - [448, 6784, 1, 1]
    - [114, 136.656]
  - - [704, 2944, 1, 256]
    - [60, 13185.4]
  - - [1408, 1408, 1, 256]
    - [14, 13731.4]
  - - [1, 64, 1, 1280]
    - [129, 0.719606]
  - - [2944, 2368, 1, 1]
    - [127, 173.59]
  - - [4288, 448, 1, 32]
    - [83, 2065.62]
  - - [4288, 448, 1, 1280]
    - [71, 14131.7]
  - - [2944, 704, 1, 32]
    - [99, 2302.86]
  - - [1024, 704, 1, 256]
    - [67, 8209.49]
  - - [6784, 256, 1, 1]
    - [127, 85.1325]
  - - [3584, 5056, 1, 1]
    - [123, 223.381]
  - - [2368, 2368, 1, 1]
    - [117, 176.556]
  - - [64, 5888, 1, 1]
    - [118, 30.7869]
  - - [1408, 3584, 1, 1280]
    - [40, 17491.4]
  - - [6784, 448, 1, 1280]
    - [71, 14429.6]
  - - [3584, 5056, 1, 3328]
    - [40, 18138.1]
  - - [2368, 2368, 1, 32]
    - [101, 3195.11]
  - - [64, 5888, 1, 32]
    - [87, 753.664]
  - - [1856, 448, 1, 256]
    - [7, 9050.21]
  - - [3584, 2368, 1, 1280]
    - [40, 17626.0]
  - - [128, 1024, 1, 256]
    - [24, 3382.5]
  - - [3584, 64, 1, 3328]
    - [43, 7454.72]
  - - [5888, 2944, 1, 32]
    - [84, 3978.03]
  - - [2944, 1, 1, 1280]
    - [134, 31.9133]
  - - [1856, 2944, 1, 32]
    - [100, 2981.75]
  - - [5056, 1408, 1, 1]
    - [117, 171.787]
  - - [5888, 1408, 1, 3328]
    - [61, 14030.2]
  - - [448, 4288, 1, 256]
    - [7, 13480.9]
  - - [256, 448, 1, 1]
    - [116, 9.55733]
  - - [128, 5888, 1, 3328]
    - [5, 12955.5]
  - - [6784, 1024, 1, 32]
    - [97, 3585.45]
  - - [256, 448, 1, 32]
    - [83, 235.257]
  - - [6784, 3584, 1, 1]
    - [126, 239.121]
  - - [2944, 2368, 1, 32]
    - [97, 3538.78]
  - - [3584, 6784, 1, 3328]
    - [58, 18640.9]
  - - [448, 128, 1, 1280]
    - [21, 2427.26]
  - - [64, 3584, 1, 32]
    - [92, 458.752]
  - - [64, 3584, 1, 1280]
    - [38, 6758.78]
  - - [6784, 1408, 1, 256]
    - [14, 17000.0]
  - - [5056, 1024, 1, 32]
    - [91, 3240.9]
  - - [1024, 5056, 1, 1280]
    - [14, 17377.3]
  - - [4288, 3584, 1, 256]
    - [66, 17870.0]
  - - [1408, 1024, 1, 3328]
    - [14, 14765.7]
  - - [2368, 256, 1, 3328]
    - [39, 9326.26]
  - - [448, 6784, 1, 1280]
    - [14, 17008.6]
  - - [1856, 5888, 1, 1]
    - [113, 197.401]
  - - [256, 5888, 1, 32]
    - [89, 1957.57]
  - - [3584, 1, 1, 3328]
    - [134, 44.1892]
  - - [4288, 32, 1, 256]
    - [99, 914.773]
  - - [256, 64, 1, 1]
    - [114, 1.3745]
  - - [4288, 5056, 1, 32]
    - [103, 3620.9]
  - - [4288, 5056, 1, 3328]
    - [78, 15429.6]
  - - [1856, 5888, 1, 32]
    - [91, 3948.74]
  - - [1856, 5888, 1, 1280]
    - [41, 18508.5]
  - - [256, 256, 1, 1280]
    - [24, 2709.5]
  - - [704, 2368, 1, 1280]
    - [27, 13444.1]
  - - [5056, 32, 1, 1280]
    - [106, 1425.48]
  - - [4288, 2368, 1, 1280]
    - [81, 15612.5]
  - - [2944, 5056, 1, 256]
    - [28, 17759.7]
  - - [4288, 128, 1, 32]
    - [87, 1137.54]
  - - [64, 5888, 1, 1280]
    - [23, 8712.88]
  - - [1, 1856, 1, 1280]
    - [134, 19.5626]
  - - [2944, 4288, 1, 1]
    - [113, 217.653]
  - - [5056, 5888, 1, 32]
    - [97, 4608.32]
  - - [704, 4288, 1, 1]
    - [116, 131.938]
  - - [704, 1, 1, 3328]
    - [129, 8.78153]
  - - [448, 256, 1, 1280]
    - [24, 4389.97]
  - - [5888, 6784, 1, 1]
    - [113, 290.123]
  - - [2368, 5056, 1, 3328]
    - [55, 17101.3]
  - - [704, 704, 1, 1280]
    - [44, 9485.47]
  - - [128, 32, 1, 3328]
    - [110, 48.3661]
  - - [1024, 6784, 1, 32]
    - [95, 3477.76]
  - - [2368, 1408, 1, 256]
    - [27, 14595.4]
  - - [3584, 2944, 1, 3328]
    - [7, 18736.2]
  - - [128, 1856, 1, 256]
    - [6, 4873.19]
  - - [32, 32, 1, 1280]
    - [111, 10.9886]
  - - [1408, 5888, 1, 1]
    - [123, 171.855]
  - - [1, 3584, 1, 256]
    - [119, 26.3046]
  - - [704, 4288, 1, 32]
    - [92, 2552.86]
  - - [1408, 5888, 1, 32]
    - [97, 3520.3]
  - - [32, 1856, 1, 256]
    - [99, 475.136]
  - - [6784, 2368, 1, 1]
    - [117, 239.34]
  - - [1856, 1, 1, 3328]
    - [139, 21.5248]
  - - [5056, 1408, 1, 256]
    - [28, 17051.1]
  - - [1, 1, 1, 256]
    - [129, 0.00711111]
  - - [2944, 1408, 1, 256]
    - [28, 16498.1]
  - - [4288, 1, 1, 1]
    - [119, 0.34359]
  - - [2368, 2368, 1, 256]
    - [27, 16402.0]
  - - [1, 448, 1, 256]
    - [119, 3.40523]
  - - [1856, 704, 1, 1]
    - [126, 73.9041]
  - - [3584, 32, 1, 3328]
    - [106, 1505.05]
  - - [128, 3584, 1, 1]
    - [114, 38.2293]
  - - [1856, 1, 1, 256]
    - [129, 13.5908]
  - - [32, 5888, 1, 32]
    - [98, 414.101]
  - - [1024, 5888, 1, 1]
    - [126, 147.488]
  - - [6784, 32, 1, 3328]
    - [103, 1954.73]
  - - [2368, 704, 1, 1]
    - [121, 92.2053]
  - - [1408, 32, 1, 256]
    - [99, 340.045]
  - - [448, 2368, 1, 1]
    - [121, 69.7937]
  - - [1856, 3584, 1, 256]
    - [7, 16827.0]
  - - [2944, 64, 1, 256]
    - [37, 4158.15]
  - - [2368, 704, 1, 32]
    - [98, 1921.7]
  - - [256, 5888, 1, 1280]
    - [14, 15063.9]
  - - [448, 2368, 1, 32]
    - [100, 1483.73]
  - - [448, 2368, 1, 3328]
    - [26, 11510.7]
  - - [64, 1408, 1, 256]
    - [21, 2423.18]
  - - [5056, 32, 1, 32]
    - [92, 303.835]
  - - [1024, 704, 1, 3328]
    - [40, 10596.9]
  - - [32, 5888, 1, 3328]
    - [99, 1769.32]
  - - [256, 64, 1, 3328]
    - [42, 824.153]
  - - [32, 1408, 1, 1280]
    - [106, 521.632]
  - - [64, 32, 1, 256]
    - [103, 14.4671]
  - - [1856, 1024, 1, 3328]
    - [40, 15628.1]
  - - [2368, 1, 1, 1]
    - [127, 0.208451]
  - - [5056, 2368, 1, 3328]
    - [62, 15381.2]
  - - [128, 1, 1, 1280]
    - [131, 1.36352]
  - - [704, 4288, 1, 1280]
    - [14, 17007.1]
  - - [704, 256, 1, 256]
    - [2, 3604.48]
- null
