library/src/blas3/Tensile/Logic/asm_full/vega20_Cijk_Alik_Bljk_SB.yaml
- {MinimumRequiredVersion: 4.5.0}
- vega20
- gfx906
- [Device 66a0, Device 66a1, Device 66a7]
    SolutionIndex: 0
    SolutionNameMin: Cijk_Alik_Bljk_SB_MT128x016x32_GRVW04_GSU16_TT04_04_VW04_WG32_04_02
    SolutionIndex: 1
    SolutionNameMin: Cijk_Alik_Bljk_SB_MT128x008x32_GRVW04_GSU16_TT04_04_VW04_WG32_02_04
    SolutionIndex: 2
    SolutionNameMin: Cijk_Alik_Bljk_SB_MT128x016x32_GRVW04_GSU32_TT04_04_VW04_WG32_04_02
    SolutionIndex: 3
    SolutionNameMin: Cijk_Alik_Bljk_SB_MT128x008x32_GRVW04_GSU32_TT04_04_VW04_WG32_02_04
    SolutionIndex: 4
    SolutionNameMin: Cijk_Alik_Bljk_SB_MT036x048x16_GRVW01_GSU04_TT03_03_VW01_WG12_16_01
    SolutionIndex: 5
    SolutionNameMin: Cijk_Alik_Bljk_SB_MT036x048x16_GRVW01_GSU08_TT03_03_VW01_WG12_16_01
    SolutionIndex: 6
    SolutionNameMin: Cijk_Alik_Bljk_SB_MT048x048x16_GRVW01_GSU08_TT03_03_VW01_WG16_16_01
    SolutionIndex: 7
    SolutionNameMin: Cijk_Alik_Bljk_SB_MT032x032x16_GRVW04_GSU02_TT04_04_VW04_WG08_08_02
    SolutionIndex: 8
    SolutionNameMin: Cijk_Alik_Bljk_SB_MT128x064x16_GRVW04_GSU02_TT08_08_VW04_WG16_08_02
    SolutionIndex: 9
    SolutionNameMin: Cijk_Alik_Bljk_SB_MT032x032x16_GRVW04_GSU02_TT04_04_VW04_WG08_08_02
    SolutionIndex: 10
    SolutionNameMin: Cijk_Alik_Bljk_SB_MT064x064x16_GRVW04_GSU02_TT08_08_VW04_WG08_08_04
    SolutionIndex: 11
    SolutionNameMin: Cijk_Alik_Bljk_SB_MT128x064x16_GRVW04_GSU02_TT08_08_VW04_WG16_08_02
    SolutionIndex: 12
    SolutionNameMin: Cijk_Alik_Bljk_SB_MT032x032x16_GRVW04_GSU04_TT04_04_VW04_WG08_08_02
    SolutionIndex: 13
    SolutionNameMin: Cijk_Alik_Bljk_SB_MT016x016x16_GRVW02_GSU04_TT02_02_VW02_WG08_08_04
    SolutionIndex: 14
    SolutionNameMin: Cijk_Alik_Bljk_SB_MT032x016x16_GRVW02_GSU04_TT04_02_VW02_WG08_08_04
    SolutionIndex: 15
    SolutionNameMin: Cijk_Alik_Bljk_SB_MT064x032x16_GRVW04_GSU04_TT08_04_VW04_WG08_08_04
    SolutionIndex: 16
    SolutionNameMin: Cijk_Alik_Bljk_SB_MT128x064x16_GRVW04_GSU04_TT08_08_VW04_WG16_08_02
    SolutionIndex: 17
    SolutionNameMin: Cijk_Alik_Bljk_SB_MT016x016x16_GRVW02_GSU04_TT02_02_VW02_WG08_08_04
    SolutionIndex: 18
    SolutionNameMin: Cijk_Alik_Bljk_SB_MT128x064x16_GRVW04_GSU04_TT08_08_VW04_WG16_08_02
    SolutionIndex: 19
    SolutionNameMin: Cijk_Alik_Bljk_SB_MT032x016x16_GRVW02_GSU08_TT04_02_VW02_WG08_08_04
    SolutionIndex: 20
    SolutionNameMin: Cijk_Alik_Bljk_SB_MT064x016x32_GRVW04_GSU02_TT04_04_VW04_WG16_04_04
    SolutionIndex: 21
    SolutionNameMin: Cijk_Alik_Bljk_SB_MT128x016x32_GRVW04_GSU02_TT08_04_VW04_WG16_04_04
    SolutionIndex: 22
    SolutionNameMin: Cijk_Alik_Bljk_SB_MT032x032x32_GRVW04_GSU02_TT04_04_VW04_WG08_08_04
    SolutionIndex: 23
    SolutionNameMin: Cijk_Alik_Bljk_SB_MT064x032x32_GRVW04_GSU02_TT08_04_VW04_WG08_08_04
    SolutionIndex: 24
    SolutionNameMin: Cijk_Alik_Bljk_SB_MT064x064x32_GRVW04_GSU02_TT08_08_VW04_WG08_08_04
    SolutionIndex: 25
    SolutionNameMin: Cijk_Alik_Bljk_SB_MT128x032x32_GRVW04_GSU02_TT08_04_VW04_WG16_08_02
    SolutionIndex: 26
    SolutionNameMin: Cijk_Alik_Bljk_SB_MT032x032x32_GRVW04_GSU04_TT04_04_VW04_WG08_08_02
    SolutionIndex: 27
    SolutionNameMin: Cijk_Alik_Bljk_SB_MT128x064x32_GRVW04_GSU04_TT08_08_VW04_WG16_08_02
    SolutionIndex: 28
    SolutionNameMin: Cijk_Alik_Bljk_SB_MT064x064x16_GRVW04_GSU01_TT04_04_VW04_WG16_16_01
    SolutionIndex: 29
    SolutionNameMin: Cijk_Alik_Bljk_SB_MT064x128x16_GRVW04_GSU01_TT04_08_VW04_WG16_16_01
    SolutionIndex: 30
    SolutionNameMin: Cijk_Alik_Bljk_SB_MT064x128x08_GRVW04_GSU01_TT04_08_VW04_WG16_16_01
    SolutionIndex: 31
    SolutionNameMin: Cijk_Alik_Bljk_SB_MT128x128x08_GRVW04_GSU01_TT08_08_VW04_WG16_16_01
    SolutionIndex: 32
    SolutionNameMin: Cijk_Alik_Bljk_SB_MT128x064x08_GRVW04_GSU01_TT08_04_VW04_WG16_16_01
    SolutionIndex: 33
    SolutionNameMin: Cijk_Alik_Bljk_SB_MT128x128x08_GRVW04_GSU01_TT08_08_VW04_WG16_16_01
    SolutionIndex: 34
    SolutionNameMin: Cijk_Alik_Bljk_SB_MT064x128x16_GRVW04_GSU01_TT04_08_VW04_WG16_16_01
    SolutionIndex: 35
    SolutionNameMin: Cijk_Alik_Bljk_SB_MT096x128x16_GRVW02_GSU01_TT06_08_VW02_WG16_16_01
    SolutionIndex: 36
    SolutionNameMin: Cijk_Alik_Bljk_SB_MT128x064x16_GRVW04_GSU01_TT08_04_VW04_WG16_16_01
    SolutionIndex: 37
    SolutionNameMin: Cijk_Alik_Bljk_SB_MT128x128x16_GRVW04_GSU01_TT08_08_VW04_WG16_16_01
    SolutionIndex: 38
    SolutionNameMin: Cijk_Alik_Bljk_SB_MT064x064x16_GRVW04_GSU01_TT04_04_VW04_WG16_16_01
    SolutionIndex: 39
    SolutionNameMin: Cijk_Alik_Bljk_SB_MT064x128x16_GRVW04_GSU01_TT04_08_VW04_WG16_16_01
    SolutionIndex: 40
    SolutionNameMin: Cijk_Alik_Bljk_SB_MT096x128x16_GRVW02_GSU01_TT06_08_VW02_WG16_16_01
    SolutionIndex: 41
    SolutionNameMin: Cijk_Alik_Bljk_SB_MT128x064x16_GRVW04_GSU01_TT08_04_VW04_WG16_16_01
    SolutionIndex: 42
    SolutionNameMin: Cijk_Alik_Bljk_SB_MT128x128x16_GRVW04_GSU01_TT08_08_VW04_WG16_16_01
    SolutionIndex: 43
    SolutionNameMin: Cijk_Alik_Bljk_SB_MT064x064x32_GRVW04_GSU01_TT04_04_VW04_WG16_16_01
    SolutionIndex: 44
    SolutionNameMin: Cijk_Alik_Bljk_SB_MT128x128x32_GRVW04_GSU01_TT08_08_VW04_WG16_16_01
    SolutionIndex: 45
    SolutionNameMin: Cijk_Alik_Bljk_SB_MT016x016x04_GRVW02_GSU01_TT02_02_VW02_WG08_08_01
    SolutionIndex: 46
    SolutionNameMin: Cijk_Alik_Bljk_SB_MT032x032x02_GRVW04_GSU01_TT04_04_VW04_WG08_08_01
    SolutionIndex: 0
    SolutionNameMin: Cijk_Alik_Bljk_SB_MT064x032x32_GRVW01_GSU04_LPA01_LPB01_PGR1_PLR1_TT04_08_USFGRO01_VW01_WG16_04_04_WGM01
    SolutionIndex: 1
    SolutionNameMin: Cijk_Alik_Bljk_SB_MT064x016x32_GRVW01_GSU08_LPA01_LPB01_PGR1_PLR1_TT04_04_USFGRO01_VW01_WG16_04_04_WGM01
    SolutionIndex: 2
    SolutionNameMin: Cijk_Alik_Bljk_SB_MT128x064x08_GRVW01_GSU01_LPA02_LPB02_PGR1_PLR1_TT04_08_USFGRO01_VW02_WG32_08_01_WGM01
    SolutionIndex: 3
    SolutionNameMin: Cijk_Alik_Bljk_SB_MT064x032x32_GRVW01_GSU01_LPA02_LPB02_PGR1_PLR1_TT04_04_USFGRO01_VW02_WG16_08_02_WGM01
    SolutionIndex: 4
    SolutionNameMin: Cijk_Alik_Bljk_SB_MT032x008x32_GRVW01_GSU08_LPA02_LPB02_PGR1_PLR1_TT02_02_USFGRO01_VW02_WG16_04_04_WGM01
    SolutionIndex: 5
    SolutionNameMin: Cijk_Alik_Bljk_SB_MT064x032x16_GRVW01_GSU01_LPA04_LPB04_PGR1_PLR1_TT04_04_USFGRO01_VW04_WG16_08_02_WGM01
    SolutionIndex: 6
    SolutionNameMin: Cijk_Alik_Bljk_SB_MT128x064x16_GRVW01_GSU01_LPA04_LPB04_PGR1_PLR1_TT04_08_USFGRO01_VW04_WG32_08_01_WGM01
    SolutionIndex: 0
    SolutionNameMin: Cijk_Alik_Bljk_SB_MT064x032x16_GRVW01_GSU04_LPA01_LPB01_PGR1_PLR1_TT04_04_USFGRO01_VW01_WG16_08_02_WGM01
    SolutionIndex: 1
    SolutionNameMin: Cijk_Alik_Bljk_SB_MT064x016x16_GRVW01_GSU04_LPA01_LPB01_PGR1_PLR1_TT04_04_USFGRO01_VW01_WG16_04_04_WGM01
    SolutionIndex: 2
    SolutionNameMin: Cijk_Alik_Bljk_SB_MT064x016x32_GRVW01_GSU08_LPA01_LPB01_PGR1_PLR1_TT04_04_USFGRO01_VW01_WG16_04_04_WGM01
    SolutionIndex: 3
    SolutionNameMin: Cijk_Alik_Bljk_SB_MT064x016x32_GRVW01_GSU08_LPA01_LPB01_PGR1_PLR1_TT04_04_USFGRO01_VW01_WG16_04_04_WGM08
    SolutionIndex: 4
    SolutionNameMin: Cijk_Alik_Bljk_SB_MT064x032x32_GRVW01_GSU01_LPA02_LPB02_PGR1_PLR1_TT04_08_USFGRO01_VW02_WG16_04_04_WGM01
    SolutionIndex: 5
    SolutionNameMin: Cijk_Alik_Bljk_SB_MT032x008x32_GRVW01_GSU08_LPA02_LPB02_PGR1_PLR1_TT02_02_USFGRO01_VW02_WG16_04_04_WGM01
    SolutionIndex: 6
    SolutionNameMin: Cijk_Alik_Bljk_SB_MT064x032x16_GRVW01_GSU01_LPA04_LPB04_PGR1_PLR1_TT04_04_USFGRO01_VW04_WG16_08_02_WGM01
    SolutionIndex: 7
    SolutionNameMin: Cijk_Alik_Bljk_SB_MT128x064x16_GRVW01_GSU01_LPA04_LPB04_PGR1_PLR1_TT04_08_USFGRO01_VW04_WG32_08_01_WGM01
    SolutionIndex: 8
    SolutionNameMin: Cijk_Alik_Bljk_SB_MT128x064x16_GRVW04_GSU01_LPA04_LPB04_PGR1_PLR1_TT04_08_USFGRO0_VW04_WG32_08_01_WGM01
- - - [4096, 7000, 1, 4096]
    - [37, 8929.59]
  - - [7680, 12000, 1, 2560]
    - [42, 9326.66]
  - - [5124, 9124, 1, 1760]
    - [30, 9495.38]
  - - [1760, 32, 1, 1760]
    - [12, 3530.03]
  - - [512, 24000, 1, 1536]
    - [37, 8979.93]
  - - [3072, 24000, 1, 1024]
    - [37, 8920.6]
  - - [2048, 400, 1, 512]
    - [42, 4685.33]
  - - [2560, 7000, 1, 2560]
    - [42, 8969.95]
  - - [3072, 16, 1, 1024]
    - [17, 1221.64]
  - - [512, 48000, 1, 2816]
    - [31, 9564.98]
  - - [512, 48000, 1, 2048]
    - [37, 8582.11]
  - - [1760, 64, 1, 1760]
    - [7, 4666.82]
  - - [35, 8457, 1, 4096]
    - [5, 3777.4]
  - - [2048, 1600, 1, 2048]
    - [39, 6010.76]
  - - [512, 48000, 1, 1536]
    - [37, 9246.35]
  - - [2560, 32, 1, 2560]
    - [7, 3192.98]
  - - [8448, 5984, 1, 2816]
    - [33, 9494.55]
  - - [4096, 3200, 1, 1024]
    - [37, 7716.15]
  - - [1024, 24000, 1, 2560]
    - [37, 9262.72]
  - - [1760, 6400, 1, 1760]
    - [31, 9601.62]
  - - [1024, 700, 1, 512]
    - [34, 4633.86]
  - - [4608, 32, 1, 1536]
    - [9, 3074.0]
  - - [3072, 64, 1, 1024]
    - [10, 2156.45]
  - - [16384, 3200, 1, 4096]
    - [37, 8591.0]
  - - [2560, 16, 1, 2560]
    - [14, 2117.48]
  - - [1024, 48000, 1, 2560]
    - [37, 9531.94]
  - - [35, 8457, 1, 2560]
    - [5, 4073.91]
  - - [8448, 48000, 1, 2816]
    - [44, 6183.2]
  - - [2048, 32, 1, 2048]
    - [17, 1802.06]
  - - [2560, 3200, 1, 2560]
    - [42, 8855.62]
  - - [16384, 800, 1, 4096]
    - [37, 7095.01]
  - - [4608, 24000, 1, 1536]
    - [37, 9524.47]
  - - [7680, 48000, 1, 2560]
    - [42, 7317.29]
  - - [3072, 48000, 1, 1024]
    - [42, 9278.11]
  - - [1760, 16, 1, 1760]
    - [19, 2364.58]
  - - [8192, 3200, 1, 2048]
    - [37, 8273.7]
  - - [512, 24000, 1, 2816]
    - [33, 9329.98]
  - - [4096, 400, 1, 1024]
    - [44, 4212.84]
  - - [6144, 48000, 1, 2560]
    - [42, 9446.96]
  - - [4608, 48000, 1, 1536]
    - [42, 9607.76]
  - - [35, 8457, 1, 2048]
    - [6, 3159.91]
  - - [4096, 128, 1, 4096]
    - [18, 4937.2]
  - - [2048, 800, 1, 512]
    - [37, 6092.83]
  - - [4608, 5984, 1, 1536]
    - [42, 9176.61]
  - - [2560, 128, 1, 2560]
    - [24, 4229.83]
  - - [6144, 5984, 1, 2048]
    - [42, 8789.21]
  - - [35, 8457, 1, 1760]
    - [4, 4085.25]
  - - [7680, 24000, 1, 2560]
    - [42, 9395.31]
  - - [6144, 48000, 1, 2048]
    - [42, 9531.44]
  - - [5124, 9124, 1, 2560]
    - [37, 9101.69]
  - - [2048, 3200, 1, 2048]
    - [34, 6894.28]
  - - [2048, 16, 1, 2048]
    - [17, 1183.16]
  - - [1024, 24000, 1, 1536]
    - [37, 9205.94]
  - - [7680, 16, 1, 2560]
    - [21, 2709.97]
  - - [2560, 6400, 1, 2560]
    - [42, 9160.43]
  - - [2048, 128, 1, 2048]
    - [27, 3229.49]
  - - [512, 16, 1, 500000]
    - [0, 3644.13]
  - - [1024, 8, 1, 500000]
    - [1, 2037.49]
  - - [512, 24000, 1, 2560]
    - [37, 9097.81]
  - - [1024, 24000, 1, 2816]
    - [31, 9496.83]
  - - [7680, 5984, 1, 2560]
    - [42, 9183.61]
  - - [2048, 1600, 1, 512]
    - [36, 5704.98]
  - - [2048, 7000, 1, 2048]
    - [37, 8062.25]
  - - [1760, 800, 1, 1760]
    - [32, 7891.97]
  - - [5124, 9124, 1, 4096]
    - [37, 8929.01]
  - - [4096, 64, 1, 4096]
    - [16, 4023.31]
  - - [7680, 32, 1, 2560]
    - [25, 3990.02]
  - - [2560, 64, 1, 2560]
    - [9, 3782.74]
  - - [3072, 128, 1, 1024]
    - [8, 2765.48]
  - - [7680, 64, 1, 2560]
    - [11, 5100.08]
  - - [1760, 128, 1, 1760]
    - [7, 5295.04]
  - - [2560, 1600, 1, 2560]
    - [41, 7647.59]
  - - [2048, 3200, 1, 512]
    - [37, 6953.42]
  - - [2560, 800, 1, 2560]
    - [38, 6585.21]
  - - [3072, 32, 1, 1024]
    - [17, 1769.75]
  - - [6144, 32, 1, 2560]
    - [22, 3430.46]
  - - [4608, 12000, 1, 1536]
    - [42, 9469.0]
  - - [4096, 32, 1, 4096]
    - [15, 2671.53]
  - - [6144, 24000, 1, 2048]
    - [42, 9324.77]
  - - [8192, 800, 1, 2048]
    - [34, 6391.8]
  - - [4096, 1600, 1, 1024]
    - [36, 6492.23]
  - - [5124, 9124, 1, 2048]
    - [42, 8764.17]
  - - [8448, 24000, 1, 2816]
    - [31, 9598.74]
  - - [1024, 48000, 1, 1536]
    - [37, 9487.38]
  - - [7680, 128, 1, 2560]
    - [8, 5739.33]
  - - [8192, 1600, 1, 2048]
    - [34, 7404.21]
  - - [4096, 800, 1, 1024]
    - [40, 5187.12]
  - - [1024, 16, 1, 500000]
    - [2, 3672.23]
  - - [2048, 800, 1, 2048]
    - [43, 4903.9]
  - - [1760, 3200, 1, 1760]
    - [32, 9327.32]
  - - [512, 48000, 1, 2560]
    - [37, 9260.65]
  - - [8448, 16, 1, 2816]
    - [20, 2835.47]
  - - [2048, 64, 1, 2048]
    - [26, 2435.01]
  - - [512, 24000, 1, 2048]
    - [37, 7757.85]
  - - [16384, 1600, 1, 4096]
    - [37, 8185.2]
  - - [4608, 16, 1, 1536]
    - [14, 2100.26]
  - - [1024, 24000, 1, 2048]
    - [37, 8644.25]
  - - [8192, 400, 1, 2048]
    - [39, 5331.85]
  - - [2048, 6400, 1, 2048]
    - [37, 8016.26]
  - - [6144, 12000, 1, 2048]
    - [42, 9096.3]
  - - [512, 8, 1, 500000]
    - [3, 1996.57]
  - - [1760, 7000, 1, 1760]
    - [32, 9191.23]
  - - [1024, 48000, 1, 2816]
    - [31, 9729.46]
  - - [6144, 16, 1, 2560]
    - [14, 2365.21]
  - - [8448, 32, 1, 2816]
    - [23, 4419.8]
  - - [4096, 16, 1, 4096]
    - [17, 1649.68]
  - - [6144, 24000, 1, 2560]
    - [37, 9576.77]
  - - [1024, 1024, 1, 1024]
    - [35, 4146.36]
  - - [8448, 12000, 1, 2816]
    - [33, 9576.81]
  - - [16384, 400, 1, 4096]
    - [41, 6121.61]
  - - [1760, 1600, 1, 1760]
    - [31, 8345.95]
  - - [1024, 48000, 1, 2048]
    - [37, 9092.56]
  - - [512, 2048, 1, 49]
    - [61, 4554.98]
  - - [512, 128, 1, 784]
    - [54, 3195.29]
  - - [2048, 512, 1, 49]
    - [62, 4253.33]
  - - [1024, 256, 1, 196]
    - [58, 4039.33]
  - - [256, 64, 1, 3136]
    - [56, 3015.27]
  - - [256, 1024, 1, 196]
    - [60, 4225.35]
  - - [64, 256, 1, 3136]
    - [57, 3058.35]
  - - [128, 512, 1, 784]
    - [55, 3380.28]
  - - [64, 64, 1, 3136]
    - [59, 1372.34]
- - - -1
    - - - 128
        - - - 4
            - - [4, 46]
              - [-1, 45]
          - - 128
            - - [4, 45]
              - [-1, 28]
          - - 256
            - - [4, 45]
              - [128, 28]
              - [256, 29]
              - [1856, 28]
              - [2368, 29]
              - [2944, 28]
              - [3584, 29]
              - [-1, 28]
          - - 448
            - - [4, 45]
              - [1408, 28]
              - [1856, 29]
              - [5888, 28]
              - [-1, 29]
          - - 704
            - - [4, 45]
              - [1024, 28]
              - [1408, 29]
              - [2368, 28]
              - [2944, 29]
              - [3584, 28]
              - [4288, 29]
              - [-1, 28]
          - - 1024
            - - [4, 45]
              - [704, 28]
              - [1024, 29]
              - [5056, 28]
              - [5888, 29]
              - [-1, 28]
          - - 1408
            - - [4, 45]
              - [704, 28]
              - [1024, 29]
              - [-1, 28]
          - - 1856
            - - [4, 45]
              - [256, 28]
              - [448, 29]
              - [1024, 28]
              - [1408, 29]
              - [5056, 28]
              - [5888, 29]
              - [-1, 28]
          - - 2368
            - - [4, 45]
              - [448, 28]
              - [1024, 29]
              - [-1, 28]
          - - 2944
            - - [4, 45]
              - [-1, 28]
          - - 3584
            - - [4, 45]
              - [128, 28]
              - [256, 29]
              - [2368, 28]
              - [-1, 29]
          - - 4288
            - - [4, 45]
              - [-1, 28]
          - - 5056
            - - [4, 45]
              - [704, 28]
              - [1024, 29]
              - [5888, 28]
              - [-1, 29]
          - - 5888
            - - [4, 45]
              - [1024, 28]
              - [1408, 29]
              - [1856, 28]
              - [-1, 29]
          - - -1
            - - [4, 45]
              - [64, 28]
              - [128, 29]
              - [2944, 28]
              - [-1, 29]
      - - 256
        - - - 4
            - - [-1, 13]
          - - 64
            - - [704, 13]
              - [1408, 22]
              - [-1, 38]
          - - 128
            - - [64, 13]
              - [128, 17]
              - [448, 13]
              - [704, 22]
              - [5056, 38]
              - [5888, 39]
              - [-1, 36]
          - - 256
            - - [128, 13]
              - [256, 22]
              - [2944, 38]
              - [3584, 34]
              - [4288, 36]
              - [5056, 35]
              - [-1, 42]
          - - 448
            - - [128, 13]
              - [1408, 38]
              - [1856, 34]
              - [2944, 36]
              - [3584, 37]
              - [4288, 39]
              - [5056, 36]
              - [5888, 42]
              - [-1, 34]
          - - 704
            - - [4, 13]
              - [64, 17]
              - [128, 22]
              - [1024, 38]
              - [1408, 39]
              - [1856, 36]
              - [2368, 37]
              - [2944, 39]
              - [3584, 42]
              - [5888, 34]
              - [-1, 42]
          - - 1024
            - - [64, 13]
              - [704, 38]
              - [1024, 41]
              - [1408, 35]
              - [1856, 42]
              - [2368, 36]
              - [3584, 42]
              - [4288, 37]
              - [5888, 42]
              - [-1, 37]
          - - 1408
            - - [64, 13]
              - [448, 38]
              - [704, 36]
              - [1024, 35]
              - [1856, 37]
              - [2368, 38]
              - [3584, 37]
              - [4288, 42]
              - [-1, 37]
          - - 1856
            - - [4, 13]
              - [256, 38]
              - [448, 36]
              - [704, 39]
              - [1408, 37]
              - [2944, 36]
              - [3584, 37]
              - [5056, 42]
              - [-1, 37]
          - - 2368
            - - [4, 13]
              - [256, 38]
              - [448, 36]
              - [704, 37]
              - [1024, 36]
              - [1856, 38]
              - [2368, 36]
              - [2944, 42]
              - [3584, 37]
              - [4288, 36]
              - [5888, 42]
              - [-1, 37]
          - - 2944
            - - [4, 13]
              - [256, 38]
              - [448, 39]
              - [704, 36]
              - [1024, 42]
              - [2944, 37]
              - [3584, 42]
              - [-1, 37]
          - - 3584
            - - [4, 13]
              - [128, 38]
              - [256, 41]
              - [1024, 37]
              - [2368, 42]
              - [3584, 37]
              - [4288, 42]
              - [5056, 37]
              - [5888, 42]
              - [-1, 37]
          - - 4288
            - - [4, 13]
              - [128, 38]
              - [256, 34]
              - [704, 36]
              - [1024, 38]
              - [2368, 37]
              - [3584, 42]
              - [4288, 37]
              - [-1, 42]
          - - 5056
            - - [4, 13]
              - [128, 38]
              - [256, 35]
              - [448, 39]
              - [704, 37]
              - [1024, 42]
              - [1408, 37]
              - [-1, 42]
          - - 5888
            - - [4, 13]
              - [64, 38]
              - [128, 34]
              - [256, 35]
              - [448, 37]
              - [704, 38]
              - [1408, 42]
              - [-1, 37]
          - - -1
            - - [4, 13]
              - [64, 38]
              - [128, 39]
              - [256, 42]
              - [448, 41]
              - [1024, 42]
              - [1408, 37]
              - [2368, 42]
              - [-1, 37]
      - - 1280
        - - - 4
            - - [-1, 13]
          - - 64
            - - [128, 13]
              - [256, 14]
              - [1408, 22]
              - [4288, 7]
              - [-1, 38]
          - - 128
            - - [4, 13]
              - [64, 17]
              - [128, 14]
              - [448, 22]
              - [1408, 7]
              - [1856, 38]
              - [2368, 22]
              - [5888, 38]
              - [-1, 34]
          - - 256
            - - [4, 13]
              - [64, 14]
              - [256, 22]
              - [448, 7]
              - [2944, 38]
              - [3584, 36]
              - [5056, 38]
              - [5888, 41]
              - [-1, 37]
          - - 448
            - - [4, 13]
              - [128, 22]
              - [256, 7]
              - [1408, 38]
              - [1856, 34]
              - [2368, 38]
              - [2944, 36]
              - [3584, 38]
              - [4288, 34]
              - [5056, 38]
              - [5888, 37]
              - [-1, 34]
          - - 704
            - - [4, 13]
              - [64, 22]
              - [128, 7]
              - [1024, 38]
              - [1408, 34]
              - [1856, 38]
              - [2368, 37]
              - [2944, 39]
              - [3584, 34]
              - [4288, 39]
              - [5888, 34]
              - [-1, 42]
          - - 1024
            - - [4, 13]
              - [64, 22]
              - [128, 7]
              - [704, 38]
              - [1024, 36]
              - [1408, 39]
              - [1856, 42]
              - [2368, 36]
              - [2944, 42]
              - [4288, 36]
              - [5888, 42]
              - [-1, 37]
          - - 1408
            - - [4, 13]
              - [64, 22]
              - [128, 9]
              - [448, 38]
              - [704, 36]
              - [1024, 39]
              - [1408, 42]
              - [1856, 36]
              - [2368, 38]
              - [3584, 37]
              - [4288, 42]
              - [5888, 37]
              - [-1, 42]
          - - 1856
            - - [4, 13]
              - [64, 9]
              - [256, 38]
              - [448, 36]
              - [704, 38]
              - [1024, 37]
              - [1408, 34]
              - [2944, 36]
              - [3584, 34]
              - [5056, 37]
              - [5888, 42]
              - [-1, 37]
          - - 2368
            - - [4, 13]
              - [64, 9]
              - [704, 38]
              - [1024, 36]
              - [1408, 38]
              - [1856, 36]
              - [2368, 34]
              - [3584, 37]
              - [4288, 34]
              - [5888, 37]
              - [-1, 42]
          - - 2944
            - - [4, 13]
              - [64, 9]
              - [256, 38]
              - [448, 39]
              - [704, 36]
              - [1408, 42]
              - [1856, 36]
              - [2368, 37]
              - [4288, 42]
              - [5056, 37]
              - [-1, 42]
          - - 3584
            - - [4, 13]
              - [64, 43]
              - [128, 38]
              - [256, 41]
              - [448, 38]
              - [704, 36]
              - [1024, 34]
              - [1408, 37]
              - [1856, 36]
              - [4288, 42]
              - [5056, 37]
              - [-1, 42]
          - - 4288
            - - [4, 13]
              - [64, 9]
              - [256, 38]
              - [704, 36]
              - [1024, 34]
              - [1856, 42]
              - [2368, 34]
              - [5056, 42]
              - [5888, 33]
              - [-1, 31]
          - - 5056
            - - [4, 13]
              - [64, 9]
              - [448, 38]
              - [704, 36]
              - [1024, 37]
              - [3584, 42]
              - [4288, 33]
              - [5056, 42]
              - [5888, 33]
              - [-1, 31]
          - - 5888
            - - [4, 13]
              - [128, 38]
              - [256, 34]
              - [448, 37]
              - [704, 36]
              - [3584, 42]
              - [4288, 33]
              - [5056, 42]
              - [-1, 33]
          - - -1
            - - [4, 13]
              - [64, 38]
              - [128, 34]
              - [256, 37]
              - [448, 36]
              - [4288, 42]
              - [5888, 33]
              - [-1, 42]
      - - -1
        - - - 4
            - - [-1, 13]
          - - 64
            - - [4, 13]
              - [128, 19]
              - [256, 14]
              - [448, 22]
              - [704, 12]
              - [1024, 22]
              - [1408, 9]
              - [1856, 7]
              - [2368, 9]
              - [2944, 7]
              - [3584, 38]
              - [4288, 12]
              - [5056, 23]
              - [-1, 38]
          - - 128
            - - [4, 13]
              - [128, 19]
              - [256, 22]
              - [448, 12]
              - [1024, 7]
              - [1408, 9]
              - [1856, 7]
              - [2368, 12]
              - [3584, 38]
              - [4288, 12]
              - [5888, 38]
              - [-1, 34]
          - - 256
            - - [4, 13]
              - [64, 19]
              - [128, 20]
              - [256, 23]
              - [448, 7]
              - [2944, 38]
              - [3584, 36]
              - [5056, 38]
              - [5888, 36]
              - [-1, 38]
          - - 448
            - - [4, 13]
              - [64, 22]
              - [128, 12]
              - [256, 7]
              - [448, 11]
              - [1408, 38]
              - [1856, 34]
              - [2368, 38]
              - [2944, 36]
              - [3584, 38]
              - [4288, 34]
              - [5056, 38]
              - [5888, 42]
              - [-1, 34]
          - - 704
            - - [4, 13]
              - [64, 12]
              - [128, 7]
              - [1024, 38]
              - [1408, 34]
              - [2368, 38]
              - [5888, 34]
              - [-1, 37]
          - - 1024
            - - [4, 13]
              - [64, 22]
              - [128, 7]
              - [704, 38]
              - [1408, 36]
              - [1856, 42]
              - [2368, 36]
              - [2944, 42]
              - [4288, 36]
              - [5056, 37]
              - [-1, 42]
          - - 1408
            - - [4, 13]
              - [64, 12]
              - [128, 9]
              - [448, 38]
              - [704, 36]
              - [1024, 34]
              - [1408, 42]
              - [1856, 36]
              - [2368, 38]
              - [4288, 42]
              - [5056, 37]
              - [5888, 42]
              - [-1, 31]
          - - 1856
            - - [4, 13]
              - [64, 9]
              - [128, 11]
              - [256, 38]
              - [448, 36]
              - [704, 38]
              - [1024, 42]
              - [1408, 34]
              - [2944, 36]
              - [3584, 34]
              - [4288, 42]
              - [5056, 33]
              - [-1, 31]
          - - 2368
            - - [4, 13]
              - [64, 9]
              - [128, 12]
              - [704, 38]
              - [1024, 36]
              - [1408, 38]
              - [2368, 36]
              - [2944, 42]
              - [3584, 33]
              - [4288, 34]
              - [5056, 31]
              - [5888, 33]
              - [-1, 31]
          - - 2944
            - - [4, 13]
              - [64, 9]
              - [256, 38]
              - [704, 36]
              - [1408, 42]
              - [1856, 36]
              - [2368, 42]
              - [-1, 33]
          - - 3584
            - - [4, 13]
              - [64, 11]
              - [128, 38]
              - [256, 34]
              - [448, 38]
              - [704, 36]
              - [1024, 34]
              - [1408, 42]
              - [1856, 36]
              - [2368, 42]
              - [-1, 33]
          - - 4288
            - - [4, 13]
              - [128, 9]
              - [256, 38]
              - [704, 36]
              - [1024, 34]
              - [1856, 42]
              - [2368, 34]
              - [-1, 33]
          - - 5056
            - - [4, 13]
              - [64, 23]
              - [448, 38]
              - [704, 36]
              - [1024, 37]
              - [1408, 42]
              - [-1, 33]
          - - 5888
            - - [4, 13]
              - [64, 16]
              - [128, 38]
              - [256, 34]
              - [448, 37]
              - [704, 36]
              - [1408, 42]
              - [-1, 33]
          - - -1
            - - [4, 13]
              - [64, 38]
              - [128, 34]
              - [256, 38]
              - [448, 36]
              - [1024, 42]
              - [1408, 37]
              - [1856, 33]
              - [2368, 42]
              - [-1, 33]
