library/src/blas3/Tensile/Logic/asm_full/vega20_Cijk_Ailk_Bjlk_DB.yaml
- {MinimumRequiredVersion: 4.6.0}
- vega20
- gfx906
- [Device 66a0, Device 66a1, Device 66a7]
    SolutionIndex: 0
    SolutionNameMin: Cijk_Ailk_Bjlk_DB_MT064x064x08_NLCA01_NLCB01_TT04_04_WG16_16_01
    SolutionIndex: 1
    SolutionNameMin: Cijk_Ailk_Bjlk_DB_MT064x064x04_NLCA01_NLCB01_TT04_04_WG16_16_01
    SolutionIndex: 2
    SolutionNameMin: Cijk_Ailk_Bjlk_DB_MT064x032x08_NLCA01_NLCB01_TT04_04_WG16_08_01
    SolutionIndex: 3
    SolutionNameMin: Cijk_Ailk_Bjlk_DB_MT096x032x08_NLCA03_NLCB01_TT06_04_WG16_08_01
    SolutionIndex: 4
    SolutionNameMin: Cijk_Ailk_Bjlk_DB_MT032x096x08_NLCA01_NLCB03_TT04_06_WG08_16_01
    SolutionIndex: 5
    SolutionNameMin: Cijk_Ailk_Bjlk_DB_MT064x064x08_NLCA01_NLCB01_TT04_04_WG16_16_01
- - - [4296, 4296, 1, 384]
    - [4, 4734.48]
  - - [35784, 35784, 1, 384]
    - [4, 3592.24]
  - - [20424, 20424, 1, 384]
    - [3, 4838.9]
  - - [7744, 7744, 1, 7744]
    - [0, 4330.16]
  - - [22728, 22728, 1, 384]
    - [3, 4536.41]
  - - [1, 1, 1, 64]
    - [1, 0.00627466]
  - - [3912, 3912, 1, 384]
    - [4, 4717.76]
  - - [10056, 10056, 1, 384]
    - [3, 4826.75]
  - - [6600, 6600, 1, 384]
    - [4, 4799.99]
  - - [10824, 10824, 1, 384]
    - [3, 4829.3]
  - - [8904, 8904, 1, 384]
    - [4, 4823.31]
  - - [43848, 43848, 1, 384]
    - [3, 2869.16]
  - - [456, 456, 1, 384]
    - [5, 2399.26]
  - - [9672, 9672, 1, 384]
    - [3, 4825.38]
  - - [72, 72, 1, 384]
    - [2, 61.9756]
  - - [18504, 18504, 1, 384]
    - [4, 4827.54]
  - - [25800, 25800, 1, 384]
    - [4, 3203.65]
  - - [36552, 36552, 1, 384]
    - [3, 3534.51]
  - - [6216, 6216, 1, 384]
    - [3, 4782.13]
  - - [32328, 32328, 1, 384]
    - [4, 3423.04]
  - - [13896, 13896, 1, 384]
    - [3, 4834.87]
  - - [11592, 11592, 1, 384]
    - [3, 4831.25]
  - - [19272, 19272, 1, 384]
    - [4, 4831.71]
  - - [12360, 12360, 1, 384]
    - [3, 4832.99]
  - - [840, 840, 1, 384]
    - [3, 4130.34]
  - - [10440, 10440, 1, 384]
    - [3, 4825.88]
  - - [37704, 37704, 1, 384]
    - [4, 3411.99]
  - - [1992, 1992, 1, 384]
    - [5, 4432.56]
  - - [36936, 36936, 1, 384]
    - [3, 3529.27]
  - - [29256, 29256, 1, 384]
    - [5, 3167.06]
  - - [40008, 40008, 1, 384]
    - [3, 3030.43]
  - - [31176, 31176, 1, 384]
    - [5, 3308.95]
  - - [64, 64, 1, 64]
    - [0, 26.3197]
  - - [3528, 3528, 1, 384]
    - [4, 4641.25]
  - - [37320, 37320, 1, 384]
    - [3, 3487.7]
  - - [2376, 2376, 1, 384]
    - [5, 4422.68]
  - - [22344, 22344, 1, 384]
    - [3, 4696.17]
  - - [1, 64, 1, 64]
    - [1, 0.389363]
  - - [28488, 28488, 1, 384]
    - [4, 3168.47]
  - - [29640, 29640, 1, 384]
    - [4, 3231.01]
  - - [39240, 39240, 1, 384]
    - [4, 3123.94]
  - - [12744, 12744, 1, 384]
    - [3, 4828.7]
  - - [15432, 15432, 1, 384]
    - [3, 4843.5]
  - - [18120, 18120, 1, 384]
    - [3, 4833.1]
  - - [38088, 38088, 1, 384]
    - [3, 3412.71]
  - - [35016, 35016, 1, 384]
    - [5, 3558.76]
  - - [44232, 44232, 1, 384]
    - [3, 2800.08]
  - - [9288, 9288, 1, 384]
    - [3, 4822.69]
  - - [16968, 16968, 1, 384]
    - [3, 4831.41]
  - - [20040, 20040, 1, 384]
    - [3, 4834.8]
  - - [16584, 16584, 1, 384]
    - [3, 4840.6]
  - - [40776, 40776, 1, 384]
    - [5, 2981.46]
  - - [1608, 1608, 1, 384]
    - [5, 4163.43]
  - - [20808, 20808, 1, 384]
    - [3, 4827.89]
  - - [13512, 13512, 1, 384]
    - [4, 4834.66]
  - - [33864, 33864, 1, 384]
    - [3, 3496.85]
  - - [8136, 8136, 1, 384]
    - [4, 4814.72]
  - - [33096, 33096, 1, 384]
    - [3, 3444.26]
  - - [23496, 23496, 1, 384]
    - [3, 4269.61]
  - - [42696, 42696, 1, 384]
    - [3, 2894.95]
  - - [6984, 6984, 1, 384]
    - [4, 4801.64]
  - - [32712, 32712, 1, 384]
    - [4, 3437.06]
  - - [13128, 13128, 1, 384]
    - [3, 4833.56]
  - - [21960, 21960, 1, 384]
    - [3, 4763.26]
  - - [3144, 3144, 1, 384]
    - [4, 4663.75]
  - - [44616, 44616, 1, 384]
    - [3, 2789.52]
  - - [25032, 25032, 1, 384]
    - [4, 3359.36]
  - - [28872, 28872, 1, 384]
    - [4, 3158.47]
  - - [2760, 2760, 1, 384]
    - [3, 4656.41]
  - - [25416, 25416, 1, 384]
    - [3, 3270.92]
  - - [34632, 34632, 1, 384]
    - [3, 3533.15]
  - - [39624, 39624, 1, 384]
    - [3, 3083.12]
  - - [5064, 5064, 1, 384]
    - [3, 4765.72]
  - - [18888, 18888, 1, 384]
    - [3, 4834.56]
  - - [64, 1, 1, 64]
    - [1, 0.383521]
  - - [24264, 24264, 1, 384]
    - [4, 4009.34]
  - - [34248, 34248, 1, 384]
    - [4, 3519.41]
  - - [30792, 30792, 1, 384]
    - [5, 3328.71]
  - - [5832, 5832, 1, 384]
    - [4, 4779.58]
  - - [33480, 33480, 1, 384]
    - [3, 3471.3]
  - - [5448, 5448, 1, 384]
    - [4, 4760.33]
  - - [5760, 5760, 1, 5760]
    - [0, 4739.22]
  - - [26184, 26184, 1, 384]
    - [5, 3037.31]
  - - [7752, 7752, 1, 384]
    - [4, 4811.28]
  - - [31560, 31560, 1, 384]
    - [4, 3368.8]
  - - [23880, 23880, 1, 384]
    - [4, 4147.43]
  - - [1224, 1224, 1, 384]
    - [3, 3907.22]
  - - [35400, 35400, 1, 384]
    - [3, 3586.3]
  - - [42312, 42312, 1, 384]
    - [3, 2920.75]
  - - [41544, 41544, 1, 384]
    - [3, 2949.34]
  - - [43080, 43080, 1, 384]
    - [3, 2886.32]
  - - [21576, 21576, 1, 384]
    - [3, 4764.76]
  - - [43464, 43464, 1, 384]
    - [3, 2886.22]
  - - [41928, 41928, 1, 384]
    - [3, 2922.31]
  - - [7368, 7368, 1, 384]
    - [4, 4803.35]
  - - [31944, 31944, 1, 384]
    - [5, 3386.99]
  - - [26952, 26952, 1, 384]
    - [4, 3047.25]
  - - [15816, 15816, 1, 384]
    - [3, 4844.94]
  - - [8520, 8520, 1, 384]
    - [3, 4817.11]
  - - [41160, 41160, 1, 384]
    - [5, 2978.91]
  - - [19656, 19656, 1, 384]
    - [4, 4832.67]
  - - [14664, 14664, 1, 384]
    - [4, 4837.5]
  - - [30408, 30408, 1, 384]
    - [3, 3253.61]
  - - [24648, 24648, 1, 384]
    - [4, 3659.04]
  - - [38856, 38856, 1, 384]
    - [3, 3120.69]
  - - [17352, 17352, 1, 384]
    - [3, 4834.25]
  - - [38472, 38472, 1, 384]
    - [4, 3208.75]
  - - [36168, 36168, 1, 384]
    - [4, 3572.82]
  - - [45000, 45000, 1, 384]
    - [5, 2707.14]
  - - [21192, 21192, 1, 384]
    - [3, 4765.35]
  - - [27336, 27336, 1, 384]
    - [5, 3070.09]
  - - [16200, 16200, 1, 384]
    - [3, 4840.34]
  - - [40392, 40392, 1, 384]
    - [3, 2993.1]
  - - [11976, 11976, 1, 384]
    - [3, 4832.26]
  - - [11208, 11208, 1, 384]
    - [3, 4830.59]
  - - [17736, 17736, 1, 384]
    - [4, 4836.72]
  - - [26568, 26568, 1, 384]
    - [4, 3082.52]
  - - [15048, 15048, 1, 384]
    - [4, 4840.14]
  - - [23112, 23112, 1, 384]
    - [3, 4357.91]
  - - [30024, 30024, 1, 384]
    - [4, 3211.51]
  - - [14280, 14280, 1, 384]
    - [3, 4835.75]
  - - [28104, 28104, 1, 384]
    - [3, 3145.3]
  - - [4680, 4680, 1, 384]
    - [3, 4732.02]
  - - [27720, 27720, 1, 384]
    - [5, 3132.17]
- null
