library/src/blas3/Tensile/Logic/asm_full/vega20_Cijk_Ailk_Bljk_HB.yaml
- {MinimumRequiredVersion: 4.3.0}
- vega20
- gfx906
- [Device 66a0, Device 66a7]
    SolutionIndex: 0
    SolutionNameMin: Cijk_Ailk_Bljk_HB_MT064x032x16_GRVW04_LPB00_PBC0_PGR1_TT04_04_USFGRO00_VW04_WG16_08_01
    SolutionIndex: 1
    SolutionNameMin: Cijk_Ailk_Bljk_HB_MT064x016x32_GRVW02_LPB00_PBC1_PGR1_TT02_02_USFGRO01_VW02_WG32_08_01
    SolutionIndex: 2
    SolutionNameMin: Cijk_Ailk_Bljk_HB_MT064x064x16_GRVW04_LPB00_PBC0_PGR1_TT04_04_USFGRO00_VW04_WG16_16_01
    SolutionIndex: 3
    SolutionNameMin: Cijk_Ailk_Bljk_HB_MT128x128x16_GRVW08_LPB00_PBC0_PGR1_TT08_08_USFGRO00_VW08_WG16_16_01
    SolutionIndex: 4
    SolutionNameMin: Cijk_Ailk_Bljk_HB_MT016x016x08_GRVW02_LPB00_PBC1_PGR1_TT02_02_USFGRO01_VW02_WG08_08_01
    SolutionIndex: 5
    SolutionNameMin: Cijk_Ailk_Bljk_HB_MT016x016x16_GRVW02_LPB00_PBC1_PGR1_TT02_02_USFGRO01_VW02_WG08_08_01
    SolutionIndex: 6
    SolutionNameMin: Cijk_Ailk_Bljk_HB_MT032x008x32_GRVW02_LPB00_PBC1_PGR1_TT02_02_USFGRO01_VW02_WG16_04_01
    SolutionIndex: 7
    SolutionNameMin: Cijk_Ailk_Bljk_HB_MT256x064x08_GRVW08_LPB00_PBC0_PGR1_TT08_08_USFGRO00_VW08_WG32_08_01
    SolutionIndex: 8
    SolutionNameMin: Cijk_Ailk_Bljk_HB_MT032x016x16_GRVW02_LPB00_PBC1_PGR1_TT02_02_USFGRO01_VW02_WG16_08_01
    SolutionIndex: 9
    SolutionNameMin: Cijk_Ailk_Bljk_HB_MT064x016x16_GRVW02_LPB00_PBC1_PGR1_TT04_02_USFGRO01_VW02_WG16_08_01
    SolutionIndex: 10
    SolutionNameMin: Cijk_Ailk_Bljk_HB_MT064x008x32_GRVW02_LPB00_PBC1_PGR1_TT02_02_USFGRO01_VW02_WG32_04_01
    SolutionIndex: 11
    SolutionNameMin: Cijk_Ailk_Bljk_HB_MT048x032x24_GRVW02_LPB00_PBC1_PGR1_TT06_04_USFGRO01_VW02_WG08_08_01
    SolutionIndex: 12
    SolutionNameMin: Cijk_Ailk_Bljk_HB_MT032x032x24_GRVW04_LPB00_PBC0_PGR1_TT04_04_USFGRO00_VW04_WG08_08_01
    SolutionIndex: 13
    SolutionNameMin: Cijk_Ailk_Bljk_HB_MT016x016x08_GRVW02_LPB00_PBC0_PGR1_TT02_02_USFGRO00_VW02_WG08_08_01
    SolutionIndex: 14
    SolutionNameMin: Cijk_Ailk_Bljk_HB_MT032x016x08_GRVW02_LPB00_PBC0_PGR1_TT02_02_USFGRO00_VW02_WG16_08_01
    SolutionIndex: 15
    SolutionNameMin: Cijk_Ailk_Bljk_HB_MT032x016x16_GRVW02_LPB00_PBC1_PGR1_TT02_02_USFGRO01_VW02_WG16_08_01
    SolutionIndex: 16
    SolutionNameMin: Cijk_Ailk_Bljk_HB_MT064x032x16_GRVW04_LPB00_PBC0_PGR1_TT08_04_USFGRO00_VW04_WG08_08_01
    SolutionIndex: 17
    SolutionNameMin: Cijk_Ailk_Bljk_HB_MT032x008x32_GRVW02_LPB00_PBC1_PGR1_TT02_02_USFGRO01_VW02_WG16_04_01
    SolutionIndex: 18
    SolutionNameMin: Cijk_Ailk_Bljk_HB_MT064x008x32_GRVW02_LPB00_PBC1_PGR1_TT02_02_USFGRO01_VW02_WG32_04_01
    SolutionIndex: 19
    SolutionNameMin: Cijk_Ailk_Bljk_HB_MT064x016x16_GRVW02_LPB00_PBC1_PGR1_TT04_02_USFGRO01_VW02_WG16_08_01
    SolutionIndex: 20
    SolutionNameMin: Cijk_Ailk_Bljk_HB_MT016x016x24_GRVW02_LPB00_PBC1_PGR1_TT02_02_USFGRO01_VW02_WG08_08_01
    SolutionIndex: 21
    SolutionNameMin: Cijk_Ailk_Bljk_HB_MT064x032x16_GRVW04_LPB00_PBC0_PGR1_TT04_04_USFGRO00_VW04_WG16_08_01
    SolutionIndex: 22
    SolutionNameMin: Cijk_Ailk_Bljk_HB_MT064x016x16_GRVW04_LPB00_PBC0_PGR1_TT04_04_USFGRO00_VW04_WG16_04_01
    SolutionIndex: 23
    SolutionNameMin: Cijk_Ailk_Bljk_HB_MT064x016x32_GRVW02_LPB00_PBC1_PGR1_TT02_02_USFGRO01_VW02_WG32_08_01
    SolutionIndex: 24
    SolutionNameMin: Cijk_Ailk_Bljk_HB_MT128x032x16_GRVW04_LPB00_PBC0_PGR1_TT04_04_USFGRO00_VW04_WG32_08_01
    SolutionIndex: 25
    SolutionNameMin: Cijk_Ailk_Bljk_HB_MT128x064x08_GRVW04_LPB00_PBC0_PGR0_TT08_04_USFGRO00_VW04_WG16_16_01
    SolutionIndex: 26
    SolutionNameMin: Cijk_Ailk_Bljk_HB_MT064x064x08_GRVW04_LPB00_PBC0_PGR1_TT04_04_USFGRO00_VW04_WG16_16_01
    SolutionIndex: 27
    SolutionNameMin: Cijk_Ailk_Bljk_HB_MT128x064x32_GRVW04_LPB00_PBC0_PGR0_TT08_04_USFGRO00_VW04_WG16_16_01
    SolutionIndex: 28
    SolutionNameMin: Cijk_Ailk_Bljk_HB_MT064x128x16_GRVW04_LPB00_PBC0_PGR1_TT04_08_USFGRO00_VW04_WG16_16_01
    SolutionIndex: 29
    SolutionNameMin: Cijk_Ailk_Bljk_HB_MT064x064x16_GRVW04_LPB00_PBC0_PGR1_TT04_04_USFGRO00_VW04_WG16_16_01
    SolutionIndex: 30
    SolutionNameMin: Cijk_Ailk_Bljk_HB_MT128x064x16_GRVW04_LPB00_PBC0_PGR1_TT08_04_USFGRO00_VW04_WG16_16_01
    SolutionIndex: 31
    SolutionNameMin: Cijk_Ailk_Bljk_HB_MT128x128x32_GRVW08_LPB00_PBC0_PGR0_TT08_08_USFGRO00_VW08_WG16_16_01
    SolutionIndex: 32
    SolutionNameMin: Cijk_Ailk_Bljk_HB_MT128x128x32_GRVW08_LPB00_PBC0_PGR1_TT08_08_USFGRO00_VW08_WG16_16_01
    SolutionIndex: 33
    SolutionNameMin: Cijk_Ailk_Bljk_HB_MT128x064x32_GRVW04_LPB00_PBC0_PGR1_TT08_04_USFGRO00_VW04_WG16_16_01
    SolutionIndex: 34
    SolutionNameMin: Cijk_Ailk_Bljk_HB_MT064x064x16_GRVW08_LPB00_PBC0_PGR0_TT08_08_USFGRO00_VW08_WG08_08_01
    SolutionIndex: 35
    SolutionNameMin: Cijk_Ailk_Bljk_HB_MT128x064x08_GRVW04_LPB00_PBC0_PGR1_TT08_04_USFGRO00_VW04_WG16_16_01
    SolutionIndex: 36
    SolutionNameMin: Cijk_Ailk_Bljk_HB_MT128x128x16_GRVW08_LPB00_PBC0_PGR1_TT08_08_USFGRO00_VW08_WG16_16_01
    SolutionIndex: 37
    SolutionNameMin: Cijk_Ailk_Bljk_HB_MT128x064x16_GRVW04_LPB04_PBC0_PGR1_TT04_08_USFGRO00_VW04_WG32_08_01
    SolutionIndex: 38
    SolutionNameMin: Cijk_Ailk_Bljk_HB_MT064x128x16_GRVW04_LPB04_PBC0_PGR1_TT04_08_USFGRO00_VW04_WG16_16_01
    SolutionIndex: 39
    SolutionNameMin: Cijk_Ailk_Bljk_HB_MT128x064x32_GRVW04_LPB04_PBC0_PGR1_TT04_04_USFGRO00_VW04_WG32_16_01
    SolutionIndex: 40
    SolutionNameMin: Cijk_Ailk_Bljk_HB_MT128x064x16_GRVW04_LPB04_PBC0_PGR1_TT04_08_USFGRO00_VW04_WG32_08_01
    SolutionIndex: 41
    SolutionNameMin: Cijk_Ailk_Bljk_HB_MT128x064x16_GRVW04_LPB04_PBC0_PGR1_TT08_04_USFGRO00_VW04_WG16_16_01
    SolutionIndex: 42
    SolutionNameMin: Cijk_Ailk_Bljk_HB_MT256x128x32_GRVW08_LPB00_PBC0_PGR1_TT08_08_USFGRO00_VW08_WG32_16_01
    SolutionIndex: 43
    SolutionNameMin: Cijk_Ailk_Bljk_HB_MT064x064x16_GRVW02_LPB04_PBC1_PGR1_TT04_04_USFGRO01_VW02_WG16_16_01
    SolutionIndex: 44
    SolutionNameMin: Cijk_Ailk_Bljk_HB_MT256x032x16_GRVW04_LPB04_PBC0_PGR0_TT08_04_USFGRO00_VW04_WG32_08_01
    SolutionIndex: 45
    SolutionNameMin: Cijk_Ailk_Bljk_HB_MT064x128x16_GRVW04_LPB04_PBC0_PGR0_TT04_08_USFGRO00_VW04_WG16_16_01
    SolutionIndex: 46
    SolutionNameMin: Cijk_Ailk_Bljk_HB_MT128x064x16_GRVW04_LPB04_PBC0_PGR0_TT04_08_USFGRO00_VW04_WG32_08_01
- - - [4096, 7000, 1, 4096]
    - [36, 17704.7]
  - - [5124, 9124, 1, 1760]
    - [34, 18113.1]
  - - [5124, 9124, 1, 2560]
    - [36, 18110.8]
  - - [1760, 32, 1, 1760]
    - [6, 2424.71]
  - - [1024, 1500, 1, 1536]
    - [30, 14708.6]
  - - [512, 24000, 1, 1536]
    - [36, 18034.4]
  - - [3072, 24000, 1, 1024]
    - [36, 18519.3]
  - - [1024, 3000, 1, 2560]
    - [36, 16527.0]
  - - [512, 3136, 1, 2048]
    - [42, 12001.1]
  - - [7680, 4, 1, 2560]
    - [6, 1348.47]
  - - [35, 1500, 1, 2048]
    - [11, 0.0]
  - - [8448, 1500, 1, 2816]
    - [35, 17575.5]
  - - [784, 512, 64, 128]
    - [45, 15012.3]
  - - [2560, 7000, 1, 2560]
    - [36, 17865.6]
  - - [3072, 16, 1, 1024]
    - [6, 1941.81]
  - - [512, 48000, 1, 2048]
    - [31, 16900.0]
  - - [1760, 64, 1, 1760]
    - [1, 4243.24]
  - - [1024, 16, 1, 512]
    - [10, 620.459]
  - - [196, 256, 64, 1024]
    - [44, 10734.8]
  - - [512, 48000, 1, 1536]
    - [36, 18433.2]
  - - [2560, 32, 1, 2560]
    - [18, 3301.51]
  - - [4608, 1500, 1, 1536]
    - [36, 16864.7]
  - - [2048, 128, 1, 2048]
    - [22, 7506.48]
  - - [1024, 24000, 1, 2560]
    - [36, 18485.3]
  - - [4608, 3000, 1, 1536]
    - [36, 17499.6]
  - - [5124, 9124, 1, 2048]
    - [30, 16983.4]
  - - [1024, 700, 1, 512]
    - [29, 9781.36]
  - - [3072, 1, 1, 128]
    - [4, 57.1535]
  - - [5124, 700, 1, 2560]
    - [36, 14956.5]
  - - [8448, 16, 1, 2816]
    - [10, 4349.05]
  - - [6144, 6000, 1, 2560]
    - [36, 18538.3]
  - - [4608, 32, 1, 1536]
    - [15, 4610.95]
  - - [35, 8457, 1, 2560]
    - [11, 0.0]
  - - [3072, 64, 1, 1024]
    - [19, 5579.93]
  - - [512, 16, 1, 512]
    - [10, 317.75]
  - - [7680, 2, 1, 2560]
    - [6, 673.304]
  - - [4224, 1, 1, 128]
    - [4, 77.6828]
  - - [7680, 1, 1, 2560]
    - [6, 336.194]
  - - [128, 1500, 1, 1280]
    - [9, 5774.37]
  - - [35, 8457, 1, 4096]
    - [11, 0.0]
  - - [1024, 1500, 1, 2816]
    - [30, 15060.3]
  - - [6144, 2, 1, 2560]
    - [6, 542.362]
  - - [8448, 48000, 1, 2816]
    - [36, 19228.9]
  - - [512, 6000, 1, 1536]
    - [36, 16226.0]
  - - [4224, 1500, 1, 176]
    - [35, 14504.7]
  - - [1024, 6000, 1, 2816]
    - [36, 17645.7]
  - - [512, 6000, 1, 2560]
    - [36, 16413.9]
  - - [512, 32, 1, 512]
    - [8, 613.202]
  - - [2560, 128, 1, 2560]
    - [19, 7415.57]
  - - [4608, 24000, 1, 1536]
    - [36, 19024.9]
  - - [512, 2, 1, 500000]
    - [6, 51.4458]
  - - [7680, 48000, 1, 2560]
    - [36, 19209.5]
  - - [3072, 48000, 1, 1024]
    - [36, 18877.9]
  - - [1760, 16, 1, 1760]
    - [6, 1254.07]
  - - [512, 3000, 1, 2816]
    - [30, 15001.8]
  - - [1760, 7000, 1, 1760]
    - [35, 17158.5]
  - - [64, 193600, 1, 256]
    - [38, 15493.8]
  - - [1024, 3000, 1, 2048]
    - [27, 12820.7]
  - - [6144, 4, 1, 2560]
    - [10, 1071.42]
  - - [1024, 6000, 1, 2048]
    - [31, 14774.0]
  - - [512, 24000, 1, 2816]
    - [36, 18218.0]
  - - [6144, 48000, 1, 2560]
    - [36, 19156.6]
  - - [8448, 3000, 1, 2816]
    - [36, 18324.2]
  - - [35, 1500, 1, 2560]
    - [11, 0.0]
  - - [3072, 4, 1, 1024]
    - [6, 502.512]
  - - [4608, 48000, 1, 1536]
    - [36, 19154.3]
  - - [2048, 32, 1, 2048]
    - [17, 2819.64]
  - - [7680, 1500, 1, 2560]
    - [30, 17091.7]
  - - [4096, 128, 1, 4096]
    - [16, 10724.4]
  - - [4608, 16, 1, 1536]
    - [10, 2842.49]
  - - [1024, 1500, 1, 2048]
    - [27, 11051.4]
  - - [3072, 3000, 1, 1024]
    - [30, 16498.3]
  - - [3072, 2, 1, 1024]
    - [6, 248.086]
  - - [8448, 1, 1, 2816]
    - [18, 343.378]
  - - [1024, 48000, 1, 2560]
    - [36, 19020.0]
  - - [1024, 3000, 1, 2816]
    - [36, 16544.2]
  - - [128, 1, 1, 1408]
    - [6, 6.07213]
  - - [35, 8457, 1, 1760]
    - [11, 0.0]
  - - [1024, 2, 1, 512]
    - [10, 78.4862]
  - - [1024, 4, 1, 500000]
    - [6, 205.777]
  - - [6144, 1, 1, 2560]
    - [6, 270.433]
  - - [1024, 48000, 1, 2816]
    - [36, 19050.1]
  - - [512, 48000, 1, 2816]
    - [36, 18515.9]
  - - [2048, 16, 1, 2048]
    - [17, 1461.41]
  - - [1024, 24000, 1, 1536]
    - [36, 18409.4]
  - - [64, 193600, 1, 64]
    - [2, 12740.6]
  - - [7680, 6000, 1, 2560]
    - [36, 18634.6]
  - - [1760, 128, 1, 1760]
    - [12, 6428.17]
  - - [35, 8457, 1, 2048]
    - [11, 0.0]
  - - [512, 1500, 1, 2816]
    - [29, 12315.8]
  - - [512, 1, 1, 512]
    - [6, 20.1031]
  - - [512, 16, 1, 500000]
    - [6, 411.566]
  - - [512, 8, 1, 500000]
    - [6, 205.782]
  - - [512, 24000, 1, 2560]
    - [36, 18163.0]
  - - [6144, 3000, 1, 2560]
    - [36, 18217.7]
  - - [1024, 24000, 1, 2816]
    - [36, 18513.5]
  - - [2048, 7000, 1, 2048]
    - [31, 16428.5]
  - - [7680, 3000, 1, 2560]
    - [36, 18064.1]
  - - [1024, 4, 1, 512]
    - [6, 158.875]
  - - [5124, 700, 1, 2048]
    - [32, 12887.1]
  - - [5124, 9124, 1, 4096]
    - [36, 17569.0]
  - - [4096, 64, 1, 4096]
    - [22, 8090.16]
  - - [256, 193600, 1, 64]
    - [7, 16229.5]
  - - [512, 6000, 1, 2048]
    - [27, 12708.8]
  - - [7680, 32, 1, 2560]
    - [12, 7315.56]
  - - [2560, 64, 1, 2560]
    - [15, 5344.36]
  - - [3136, 2048, 1, 512]
    - [46, 15291.5]
  - - [3072, 128, 1, 1024]
    - [21, 8131.04]
  - - [8448, 6000, 1, 2816]
    - [36, 18850.2]
  - - [7680, 64, 1, 2560]
    - [24, 10354.5]
  - - [5124, 1500, 1, 2560]
    - [36, 16711.9]
  - - [1024, 1500, 1, 2560]
    - [30, 14971.5]
  - - [3025, 64, 64, 64]
    - [43, 0.0]
  - - [512, 4, 1, 512]
    - [6, 79.4376]
  - - [1024, 6000, 1, 2560]
    - [36, 17539.9]
  - - [3072, 32, 1, 1024]
    - [15, 3466.31]
  - - [35, 700, 1, 2560]
    - [11, 0.0]
  - - [3136, 512, 1, 2048]
    - [44, 9610.38]
  - - [196, 1024, 64, 256]
    - [46, 12733.4]
  - - [512, 50176, 1, 128]
    - [3, 17069.6]
  - - [4608, 1, 1, 1536]
    - [6, 194.873]
  - - [49, 512, 64, 2048]
    - [43, 0.0]
  - - [4096, 32, 1, 4096]
    - [23, 5107.15]
  - - [7680, 24000, 1, 2560]
    - [36, 19082.7]
  - - [8448, 4, 1, 2816]
    - [10, 1396.08]
  - - [64, 1, 1, 1216]
    - [6, 2.65064]
  - - [512, 1, 1, 500000]
    - [6, 25.7227]
  - - [176, 1500, 1, 1408]
    - [9, 5837.14]
  - - [512, 3000, 1, 1536]
    - [30, 14664.8]
  - - [8448, 24000, 1, 2816]
    - [36, 19156.1]
  - - [4608, 2, 1, 1536]
    - [6, 390.607]
  - - [1024, 48000, 1, 1536]
    - [36, 18950.7]
  - - [7680, 128, 1, 2560]
    - [30, 13541.5]
  - - [3072, 6000, 1, 1024]
    - [30, 17130.9]
  - - [3072, 1500, 1, 128]
    - [30, 13236.5]
  - - [2048, 3136, 1, 512]
    - [37, 15999.8]
  - - [3025, 256, 64, 64]
    - [43, 0.0]
  - - [1024, 3000, 1, 1536]
    - [36, 16324.8]
  - - [512, 4, 1, 500000]
    - [6, 102.89]
  - - [35, 700, 1, 2048]
    - [11, 0.0]
  - - [1024, 16, 1, 500000]
    - [6, 823.08]
  - - [512, 24000, 1, 2048]
    - [31, 16010.2]
  - - [128, 50176, 1, 512]
    - [40, 15944.0]
  - - [1024, 32, 1, 512]
    - [6, 1198.37]
  - - [256, 12544, 1, 1024]
    - [39, 13733.2]
  - - [1024, 12544, 1, 256]
    - [41, 16790.7]
  - - [512, 48000, 1, 2560]
    - [36, 18500.5]
  - - [2560, 16, 1, 2560]
    - [6, 1815.39]
  - - [2048, 64, 1, 2048]
    - [23, 4848.86]
  - - [512, 2, 1, 512]
    - [6, 40.2061]
  - - [1024, 1, 1, 512]
    - [8, 36.4076]
  - - [512, 1500, 1, 2560]
    - [29, 11283.6]
  - - [6144, 32, 1, 2560]
    - [12, 6014.7]
  - - [1024, 1, 1, 500000]
    - [6, 51.445]
  - - [6144, 16, 1, 2560]
    - [18, 3941.98]
  - - [1024, 24000, 1, 2048]
    - [31, 17005.1]
  - - [4096, 16, 1, 4096]
    - [17, 2969.39]
  - - [5124, 1500, 1, 2048]
    - [31, 14669.3]
  - - [3072, 1500, 1, 1024]
    - [30, 15127.4]
  - - [1024, 2, 1, 500000]
    - [6, 102.89]
  - - [1024, 8, 1, 500000]
    - [6, 411.553]
  - - [7680, 16, 1, 2560]
    - [1, 4760.41]
  - - [6144, 1500, 1, 2560]
    - [36, 17746.3]
  - - [3072, 1, 1, 1024]
    - [6, 124.04]
  - - [512, 6000, 1, 2816]
    - [36, 16546.7]
  - - [8448, 2, 1, 2816]
    - [10, 687.55]
  - - [4608, 4, 1, 1536]
    - [6, 779.492]
  - - [1024, 6000, 1, 1536]
    - [36, 17258.7]
  - - [8448, 32, 1, 2816]
    - [0, 6219.42]
  - - [512, 3000, 1, 2048]
    - [27, 11045.2]
  - - [6144, 24000, 1, 2560]
    - [36, 19040.4]
  - - [512, 3000, 1, 2560]
    - [30, 14976.0]
  - - [4608, 6000, 1, 1536]
    - [36, 18435.6]
  - - [1024, 1024, 1, 1024]
    - [33, 12246.0]
  - - [512, 1500, 1, 2048]
    - [33, 9300.17]
  - - [512, 1500, 1, 1536]
    - [29, 10700.6]
  - - [128, 1, 1, 1024]
    - [5, 5.35425]
  - - [49, 2048, 64, 512]
    - [43, 0.0]
  - - [1024, 48000, 1, 2048]
    - [31, 17690.3]
- - - -1
    - - - 128
        - - - 4
            - - [-1, 13]
          - - 64
            - - [64, 13]
              - [448, 14]
              - [704, 13]
              - [5888, 14]
              - [-1, 26]
          - - 128
            - - [64, 13]
              - [2368, 14]
              - [-1, 26]
          - - 256
            - - [4, 13]
              - [448, 14]
              - [5888, 26]
              - [-1, 25]
          - - 448
            - - [4, 13]
              - [64, 14]
              - [128, 13]
              - [448, 14]
              - [2368, 26]
              - [2944, 25]
              - [-1, 26]
          - - 704
            - - [64, 13]
              - [128, 14]
              - [448, 26]
              - [704, 25]
              - [5888, 26]
              - [-1, 25]
          - - 1024
            - - [64, 13]
              - [128, 14]
              - [704, 26]
              - [-1, 25]
          - - 1408
            - - [4, 13]
              - [128, 14]
              - [704, 26]
              - [-1, 25]
          - - 1856
            - - [4, 13]
              - [128, 14]
              - [704, 26]
              - [1024, 25]
              - [1408, 26]
              - [-1, 25]
          - - 2368
            - - [4, 13]
              - [128, 14]
              - [448, 26]
              - [704, 25]
              - [1024, 26]
              - [1408, 25]
              - [1856, 26]
              - [-1, 25]
          - - 3584
            - - [4, 13]
              - [64, 14]
              - [448, 26]
              - [-1, 25]
          - - 4288
            - - [4, 13]
              - [128, 14]
              - [256, 26]
              - [-1, 25]
          - - 5056
            - - [4, 13]
              - [64, 14]
              - [128, 26]
              - [256, 25]
              - [448, 26]
              - [-1, 25]
          - - 5888
            - - [4, 13]
              - [64, 14]
              - [128, 26]
              - [-1, 25]
          - - -1
            - - [4, 13]
              - [256, 26]
              - [-1, 25]
      - - 256
        - - - 4
            - - [704, 5]
              - [2368, 4]
              - [2944, 5]
              - [3584, 4]
              - [-1, 5]
          - - 64
            - - [64, 5]
              - [128, 10]
              - [256, 8]
              - [704, 5]
              - [1024, 8]
              - [1408, 15]
              - [1856, 6]
              - [2368, 8]
              - [2944, 1]
              - [3584, 9]
              - [4288, 0]
              - [5056, 9]
              - [5888, 21]
              - [-1, 29]
          - - 128
            - - [4, 5]
              - [64, 6]
              - [128, 8]
              - [256, 23]
              - [1024, 8]
              - [1856, 9]
              - [2944, 0]
              - [3584, 29]
              - [5056, 0]
              - [5888, 29]
              - [-1, 35]
          - - 256
            - - [128, 5]
              - [256, 6]
              - [448, 8]
              - [2944, 29]
              - [3584, 30]
              - [5056, 29]
              - [-1, 30]
          - - 448
            - - [128, 5]
              - [256, 8]
              - [448, 19]
              - [1408, 29]
              - [1856, 30]
              - [2368, 29]
              - [2944, 35]
              - [3584, 29]
              - [4288, 28]
              - [5056, 35]
              - [5888, 30]
              - [-1, 28]
          - - 704
            - - [4, 5]
              - [64, 23]
              - [128, 10]
              - [1856, 29]
              - [2368, 30]
              - [5888, 28]
              - [-1, 36]
          - - 1024
            - - [4, 5]
              - [64, 6]
              - [128, 15]
              - [704, 29]
              - [1024, 35]
              - [3584, 30]
              - [4288, 35]
              - [-1, 36]
          - - 1408
            - - [64, 5]
              - [128, 1]
              - [448, 29]
              - [1408, 30]
              - [1856, 35]
              - [2368, 30]
              - [5888, 36]
              - [-1, 35]
          - - 1856
            - - [4, 4]
              - [64, 15]
              - [128, 9]
              - [256, 29]
              - [448, 30]
              - [704, 29]
              - [1024, 30]
              - [1408, 28]
              - [2368, 30]
              - [2944, 35]
              - [4288, 36]
              - [5056, 35]
              - [5888, 36]
              - [-1, 35]
          - - 2368
            - - [4, 5]
              - [64, 15]
              - [128, 19]
              - [448, 29]
              - [1024, 35]
              - [1408, 30]
              - [2368, 35]
              - [2944, 36]
              - [4288, 35]
              - [-1, 36]
          - - 2944
            - - [4, 4]
              - [64, 1]
              - [128, 22]
              - [256, 29]
              - [704, 30]
              - [1408, 36]
              - [1856, 35]
              - [2368, 36]
              - [5056, 35]
              - [-1, 36]
          - - 3584
            - - [4, 5]
              - [64, 9]
              - [128, 22]
              - [1024, 30]
              - [1408, 36]
              - [2944, 35]
              - [4288, 36]
              - [5056, 35]
              - [-1, 36]
          - - 4288
            - - [4, 5]
              - [64, 9]
              - [128, 0]
              - [256, 29]
              - [448, 30]
              - [1024, 35]
              - [1856, 36]
              - [2944, 35]
              - [3584, 36]
              - [5056, 35]
              - [5888, 36]
              - [-1, 34]
          - - 5056
            - - [4, 5]
              - [128, 0]
              - [256, 29]
              - [704, 30]
              - [1408, 36]
              - [1856, 35]
              - [3584, 36]
              - [4288, 34]
              - [5888, 36]
              - [-1, 34]
          - - 5888
            - - [4, 5]
              - [64, 22]
              - [128, 29]
              - [256, 35]
              - [704, 30]
              - [1408, 36]
              - [2368, 35]
              - [-1, 36]
          - - -1
            - - [4, 5]
              - [64, 24]
              - [448, 30]
              - [704, 35]
              - [1024, 36]
              - [2368, 35]
              - [3584, 36]
              - [5056, 34]
              - [-1, 36]
      - - 1280
        - - - 4
            - - [4, 5]
              - [-1, 20]
          - - 64
            - - [4, 20]
              - [128, 6]
              - [256, 18]
              - [704, 6]
              - [1024, 17]
              - [1408, 10]
              - [1856, 1]
              - [2368, 10]
              - [2944, 19]
              - [3584, 22]
              - [5056, 9]
              - [-1, 22]
          - - 128
            - - [4, 20]
              - [64, 6]
              - [128, 8]
              - [448, 6]
              - [704, 15]
              - [1024, 1]
              - [1408, 9]
              - [1856, 22]
              - [2368, 9]
              - [2944, 22]
              - [3584, 29]
              - [5056, 0]
              - [5888, 29]
              - [-1, 30]
          - - 256
            - - [4, 20]
              - [64, 15]
              - [256, 6]
              - [448, 1]
              - [2944, 29]
              - [3584, 30]
              - [5056, 29]
              - [-1, 30]
          - - 448
            - - [4, 20]
              - [128, 6]
              - [256, 1]
              - [448, 22]
              - [1408, 29]
              - [1856, 30]
              - [2368, 29]
              - [3584, 30]
              - [4288, 28]
              - [5056, 30]
              - [5888, 36]
              - [-1, 28]
          - - 704
            - - [4, 20]
              - [64, 6]
              - [128, 8]
              - [1024, 29]
              - [1408, 16]
              - [1856, 29]
              - [2368, 30]
              - [5056, 28]
              - [5888, 34]
              - [-1, 36]
          - - 1024
            - - [4, 20]
              - [64, 6]
              - [128, 10]
              - [704, 29]
              - [2368, 30]
              - [2944, 36]
              - [3584, 30]
              - [4288, 35]
              - [-1, 36]
          - - 1408
            - - [4, 20]
              - [64, 8]
              - [128, 9]
              - [448, 29]
              - [2368, 30]
              - [5888, 36]
              - [-1, 35]
          - - 1856
            - - [4, 20]
              - [64, 1]
              - [128, 22]
              - [256, 29]
              - [448, 30]
              - [704, 29]
              - [1024, 30]
              - [1408, 28]
              - [2944, 30]
              - [4288, 36]
              - [5056, 34]
              - [5888, 36]
              - [-1, 35]
          - - 2368
            - - [4, 20]
              - [64, 15]
              - [128, 9]
              - [448, 29]
              - [2368, 30]
              - [2944, 36]
              - [4288, 35]
              - [-1, 36]
          - - 2944
            - - [4, 20]
              - [64, 19]
              - [128, 0]
              - [256, 29]
              - [704, 30]
              - [1408, 36]
              - [1856, 30]
              - [2368, 36]
              - [5056, 35]
              - [-1, 36]
          - - 3584
            - - [4, 20]
              - [64, 22]
              - [128, 0]
              - [1024, 30]
              - [1408, 36]
              - [1856, 30]
              - [3584, 35]
              - [-1, 36]
          - - 4288
            - - [4, 20]
              - [64, 19]
              - [128, 0]
              - [256, 29]
              - [1024, 30]
              - [1856, 36]
              - [2944, 35]
              - [3584, 36]
              - [5056, 35]
              - [-1, 36]
          - - 5056
            - - [4, 20]
              - [64, 19]
              - [128, 21]
              - [256, 29]
              - [704, 30]
              - [1408, 36]
              - [1856, 35]
              - [2368, 36]
              - [2944, 35]
              - [3584, 36]
              - [4288, 35]
              - [-1, 36]
          - - 5888
            - - [4, 20]
              - [64, 22]
              - [128, 29]
              - [704, 30]
              - [1408, 36]
              - [2368, 35]
              - [-1, 36]
          - - -1
            - - [4, 20]
              - [64, 22]
              - [448, 30]
              - [1024, 36]
              - [2368, 35]
              - [3584, 36]
              - [5056, 34]
              - [-1, 36]
      - - -1
        - - - 4
            - - [5056, 20]
              - [-1, 12]
          - - 64
            - - [4, 20]
              - [448, 6]
              - [1024, 17]
              - [1408, 10]
              - [1856, 1]
              - [2368, 8]
              - [2944, 19]
              - [3584, 12]
              - [5056, 21]
              - [-1, 29]
          - - 128
            - - [4, 20]
              - [448, 6]
              - [704, 10]
              - [1024, 1]
              - [1408, 22]
              - [1856, 12]
              - [2368, 21]
              - [3584, 22]
              - [4288, 21]
              - [5056, 0]
              - [5888, 29]
              - [-1, 30]
          - - 256
            - - [4, 20]
              - [256, 6]
              - [448, 23]
              - [2944, 29]
              - [3584, 30]
              - [5056, 29]
              - [-1, 30]
          - - 448
            - - [4, 20]
              - [128, 6]
              - [256, 1]
              - [448, 12]
              - [1408, 29]
              - [1856, 30]
              - [2368, 29]
              - [3584, 30]
              - [4288, 28]
              - [5056, 30]
              - [5888, 36]
              - [-1, 28]
          - - 704
            - - [4, 20]
              - [64, 17]
              - [128, 10]
              - [1024, 29]
              - [1408, 16]
              - [1856, 29]
              - [2368, 30]
              - [5888, 28]
              - [-1, 36]
          - - 1024
            - - [4, 20]
              - [64, 6]
              - [128, 1]
              - [704, 29]
              - [2368, 30]
              - [2944, 36]
              - [4288, 30]
              - [-1, 36]
          - - 1408
            - - [4, 20]
              - [64, 10]
              - [128, 19]
              - [448, 29]
              - [2368, 30]
              - [5888, 36]
              - [-1, 35]
          - - 1856
            - - [4, 20]
              - [64, 1]
              - [128, 12]
              - [256, 29]
              - [448, 30]
              - [704, 29]
              - [1024, 30]
              - [1408, 28]
              - [2944, 30]
              - [4288, 36]
              - [5056, 35]
              - [5888, 36]
              - [-1, 35]
          - - 2368
            - - [4, 20]
              - [64, 8]
              - [128, 19]
              - [448, 29]
              - [2368, 30]
              - [2944, 36]
              - [4288, 35]
              - [-1, 36]
          - - 2944
            - - [4, 20]
              - [128, 22]
              - [256, 29]
              - [704, 30]
              - [1408, 36]
              - [1856, 35]
              - [2368, 36]
              - [5056, 35]
              - [-1, 36]
          - - 3584
            - - [4, 20]
              - [64, 12]
              - [128, 29]
              - [1024, 30]
              - [1408, 36]
              - [3584, 35]
              - [-1, 36]
          - - 4288
            - - [4, 20]
              - [64, 19]
              - [128, 0]
              - [256, 29]
              - [1024, 30]
              - [1856, 36]
              - [2944, 35]
              - [3584, 36]
              - [5056, 35]
              - [-1, 36]
          - - 5056
            - - [4, 20]
              - [64, 19]
              - [128, 0]
              - [256, 29]
              - [704, 30]
              - [1408, 36]
              - [1856, 35]
              - [2368, 36]
              - [4288, 35]
              - [-1, 36]
          - - 5888
            - - [4, 20]
              - [64, 21]
              - [128, 29]
              - [256, 30]
              - [448, 36]
              - [704, 30]
              - [1408, 36]
              - [2368, 35]
              - [-1, 36]
          - - -1
            - - [4, 20]
              - [64, 22]
              - [448, 30]
              - [1024, 36]
              - [2368, 35]
              - [3584, 36]
              - [5056, 35]
              - [-1, 36]
