library/src/blas3/Tensile/Logic/asm_full/vega10_Cijk_Alik_Bljk_SB.yaml
- {MinimumRequiredVersion: 4.6.0}
- vega10
- gfx900
- [Device 6863, Device 6862, Device 687f, Device 6860, Device 6861, 'Vega 10 XTX [Radeon
    SolutionIndex: 0
    SolutionNameMin: Cijk_Alik_Bljk_SB_MT064x016x64_GRVW04_GSU16_SNLL0_TT04_04_VW04_WG16_04_04
    SolutionIndex: 1
    SolutionNameMin: Cijk_Alik_Bljk_SB_MT064x016x64_GRVW04_GSU16_SNLL0_TT04_04_VW04_WG16_04_04
    SolutionIndex: 2
    SolutionNameMin: Cijk_Alik_Bljk_SB_MT064x016x64_GRVW04_GSU32_SNLL0_TT04_04_VW04_WG16_04_04
    SolutionIndex: 3
    SolutionNameMin: Cijk_Alik_Bljk_SB_MT048x096x08_GRVW02_GSU02_SNLL0_TT04_06_VW02_WG12_16_01
    SolutionIndex: 4
    SolutionNameMin: Cijk_Alik_Bljk_SB_MT036x048x16_GRVW01_GSU08_SNLL0_TT03_03_VW01_WG12_16_01
    SolutionIndex: 5
    SolutionNameMin: Cijk_Alik_Bljk_SB_MT032x008x08_GRVW02_GSU01_SNLL0_TT02_02_VW02_WG16_04_01
    SolutionIndex: 6
    SolutionNameMin: Cijk_Alik_Bljk_SB_MT016x016x08_GRVW02_GSU01_SNLL0_TT02_02_VW02_WG08_08_01
    SolutionIndex: 7
    SolutionNameMin: Cijk_Alik_Bljk_SB_MT032x016x08_GRVW02_GSU01_SNLL0_TT04_02_VW02_WG08_08_01
    SolutionIndex: 8
    SolutionNameMin: Cijk_Alik_Bljk_SB_MT032x032x08_GRVW04_GSU01_SNLL0_TT04_04_VW04_WG08_08_01
    SolutionIndex: 9
    SolutionNameMin: Cijk_Alik_Bljk_SB_MT032x016x08_GRVW02_GSU01_SNLL0_TT02_02_VW02_WG16_08_01
    SolutionIndex: 10
    SolutionNameMin: Cijk_Alik_Bljk_SB_MT064x016x08_GRVW02_GSU01_SNLL0_TT04_02_VW02_WG16_08_01
    SolutionIndex: 11
    SolutionNameMin: Cijk_Alik_Bljk_SB_MT032x016x08_GRVW02_GSU01_SNLL0_TT04_02_VW02_WG08_08_01
    SolutionIndex: 12
    SolutionNameMin: Cijk_Alik_Bljk_SB_MT032x032x08_GRVW04_GSU01_SNLL0_TT04_04_VW04_WG08_08_01
    SolutionIndex: 13
    SolutionNameMin: Cijk_Alik_Bljk_SB_MT032x016x08_GRVW02_GSU01_SNLL0_TT02_02_VW02_WG16_08_01
    SolutionIndex: 14
    SolutionNameMin: Cijk_Alik_Bljk_SB_MT016x016x16_GRVW02_GSU01_SNLL0_TT02_02_VW02_WG08_08_01
    SolutionIndex: 15
    SolutionNameMin: Cijk_Alik_Bljk_SB_MT032x032x16_GRVW04_GSU01_SNLL0_TT04_04_VW04_WG08_08_01
    SolutionIndex: 16
    SolutionNameMin: Cijk_Alik_Bljk_SB_MT032x016x16_GRVW02_GSU01_SNLL0_TT02_02_VW02_WG16_08_01
    SolutionIndex: 17
    SolutionNameMin: Cijk_Alik_Bljk_SB_MT064x016x16_GRVW02_GSU01_SNLL0_TT04_02_VW02_WG16_08_01
    SolutionIndex: 18
    SolutionNameMin: Cijk_Alik_Bljk_SB_MT064x032x16_GRVW04_GSU01_SNLL0_TT04_04_VW04_WG16_08_01
    SolutionIndex: 19
    SolutionNameMin: Cijk_Alik_Bljk_SB_MT016x016x16_GRVW02_GSU01_SNLL0_TT02_02_VW02_WG08_08_01
    SolutionIndex: 20
    SolutionNameMin: Cijk_Alik_Bljk_SB_MT032x032x16_GRVW04_GSU01_SNLL0_TT04_04_VW04_WG08_08_01
    SolutionIndex: 21
    SolutionNameMin: Cijk_Alik_Bljk_SB_MT032x016x16_GRVW02_GSU01_SNLL0_TT02_02_VW02_WG16_08_01
    SolutionIndex: 22
    SolutionNameMin: Cijk_Alik_Bljk_SB_MT064x032x16_GRVW04_GSU01_SNLL0_TT04_04_VW04_WG16_08_01
    SolutionIndex: 23
    SolutionNameMin: Cijk_Alik_Bljk_SB_MT016x016x08_GRVW02_GSU08_SNLL0_TT02_02_VW02_WG08_08_02
    SolutionIndex: 24
    SolutionNameMin: Cijk_Alik_Bljk_SB_MT032x016x16_GRVW02_GSU02_SNLL0_TT04_02_VW02_WG08_08_02
    SolutionIndex: 25
    SolutionNameMin: Cijk_Alik_Bljk_SB_MT032x032x16_GRVW04_GSU02_SNLL0_TT04_04_VW04_WG08_08_02
    SolutionIndex: 26
    SolutionNameMin: Cijk_Alik_Bljk_SB_MT064x032x16_GRVW04_GSU02_SNLL0_TT08_04_VW04_WG08_08_02
    SolutionIndex: 27
    SolutionNameMin: Cijk_Alik_Bljk_SB_MT016x016x16_GRVW02_GSU02_SNLL0_TT02_02_VW02_WG08_08_04
    SolutionIndex: 28
    SolutionNameMin: Cijk_Alik_Bljk_SB_MT032x016x16_GRVW02_GSU02_SNLL0_TT04_02_VW02_WG08_08_04
    SolutionIndex: 29
    SolutionNameMin: Cijk_Alik_Bljk_SB_MT032x016x16_GRVW02_GSU02_SNLL0_TT02_02_VW02_WG16_08_02
    SolutionIndex: 30
    SolutionNameMin: Cijk_Alik_Bljk_SB_MT032x016x16_GRVW02_GSU02_SNLL0_TT04_02_VW02_WG08_08_02
    SolutionIndex: 31
    SolutionNameMin: Cijk_Alik_Bljk_SB_MT032x032x16_GRVW04_GSU02_SNLL0_TT04_04_VW04_WG08_08_02
    SolutionIndex: 32
    SolutionNameMin: Cijk_Alik_Bljk_SB_MT064x032x16_GRVW04_GSU02_SNLL0_TT08_04_VW04_WG08_08_02
    SolutionIndex: 33
    SolutionNameMin: Cijk_Alik_Bljk_SB_MT016x016x16_GRVW02_GSU02_SNLL0_TT02_02_VW02_WG08_08_04
    SolutionIndex: 34
    SolutionNameMin: Cijk_Alik_Bljk_SB_MT032x016x16_GRVW02_GSU02_SNLL0_TT04_02_VW02_WG08_08_04
    SolutionIndex: 35
    SolutionNameMin: Cijk_Alik_Bljk_SB_MT032x016x16_GRVW02_GSU02_SNLL0_TT02_02_VW02_WG16_08_02
    SolutionIndex: 36
    SolutionNameMin: Cijk_Alik_Bljk_SB_MT128x064x16_GRVW04_GSU02_SNLL0_TT08_08_VW04_WG16_08_02
    SolutionIndex: 37
    SolutionNameMin: Cijk_Alik_Bljk_SB_MT032x032x16_GRVW04_GSU04_SNLL0_TT04_04_VW04_WG08_08_02
    SolutionIndex: 38
    SolutionNameMin: Cijk_Alik_Bljk_SB_MT064x032x16_GRVW04_GSU04_SNLL0_TT08_04_VW04_WG08_08_02
    SolutionIndex: 39
    SolutionNameMin: Cijk_Alik_Bljk_SB_MT016x016x16_GRVW02_GSU04_SNLL0_TT02_02_VW02_WG08_08_04
    SolutionIndex: 40
    SolutionNameMin: Cijk_Alik_Bljk_SB_MT032x016x16_GRVW02_GSU04_SNLL0_TT04_02_VW02_WG08_08_04
    SolutionIndex: 41
    SolutionNameMin: Cijk_Alik_Bljk_SB_MT032x016x16_GRVW02_GSU04_SNLL0_TT02_02_VW02_WG16_08_02
    SolutionIndex: 42
    SolutionNameMin: Cijk_Alik_Bljk_SB_MT032x032x16_GRVW04_GSU04_SNLL0_TT04_04_VW04_WG08_08_02
    SolutionIndex: 43
    SolutionNameMin: Cijk_Alik_Bljk_SB_MT064x032x16_GRVW04_GSU04_SNLL0_TT08_04_VW04_WG08_08_02
    SolutionIndex: 44
    SolutionNameMin: Cijk_Alik_Bljk_SB_MT016x016x16_GRVW02_GSU04_SNLL0_TT02_02_VW02_WG08_08_04
    SolutionIndex: 45
    SolutionNameMin: Cijk_Alik_Bljk_SB_MT032x016x16_GRVW02_GSU04_SNLL0_TT04_02_VW02_WG08_08_04
    SolutionIndex: 46
    SolutionNameMin: Cijk_Alik_Bljk_SB_MT032x016x16_GRVW02_GSU04_SNLL0_TT02_02_VW02_WG16_08_02
    SolutionIndex: 47
    SolutionNameMin: Cijk_Alik_Bljk_SB_MT128x064x16_GRVW04_GSU04_SNLL0_TT08_08_VW04_WG16_08_02
    SolutionIndex: 48
    SolutionNameMin: Cijk_Alik_Bljk_SB_MT016x016x16_GRVW02_GSU08_SNLL0_TT02_02_VW02_WG08_08_04
    SolutionIndex: 49
    SolutionNameMin: Cijk_Alik_Bljk_SB_MT032x016x16_GRVW02_GSU08_SNLL0_TT04_02_VW02_WG08_08_04
    SolutionIndex: 50
    SolutionNameMin: Cijk_Alik_Bljk_SB_MT064x064x24_GRVW04_GSU02_SNLL0_TT08_08_VW04_WG08_08_02
    SolutionIndex: 51
    SolutionNameMin: Cijk_Alik_Bljk_SB_MT064x064x24_GRVW04_GSU02_SNLL0_TT08_08_VW04_WG08_08_02
    SolutionIndex: 52
    SolutionNameMin: Cijk_Alik_Bljk_SB_MT064x064x24_GRVW04_GSU04_SNLL0_TT08_08_VW04_WG08_08_02
    SolutionIndex: 53
    SolutionNameMin: Cijk_Alik_Bljk_SB_MT032x032x32_GRVW04_GSU02_SNLL0_TT04_04_VW04_WG08_08_04
    SolutionIndex: 54
    SolutionNameMin: Cijk_Alik_Bljk_SB_MT064x032x32_GRVW04_GSU02_SNLL0_TT08_04_VW04_WG08_08_04
    SolutionIndex: 55
    SolutionNameMin: Cijk_Alik_Bljk_SB_MT064x064x32_GRVW04_GSU02_SNLL0_TT08_08_VW04_WG08_08_04
    SolutionIndex: 56
    SolutionNameMin: Cijk_Alik_Bljk_SB_MT064x032x32_GRVW04_GSU02_SNLL0_TT04_04_VW04_WG16_08_02
    SolutionIndex: 57
    SolutionNameMin: Cijk_Alik_Bljk_SB_MT032x032x32_GRVW04_GSU02_SNLL0_TT04_04_VW04_WG08_08_04
    SolutionIndex: 58
    SolutionNameMin: Cijk_Alik_Bljk_SB_MT064x032x32_GRVW04_GSU02_SNLL0_TT08_04_VW04_WG08_08_04
    SolutionIndex: 59
    SolutionNameMin: Cijk_Alik_Bljk_SB_MT064x032x32_GRVW04_GSU02_SNLL0_TT04_04_VW04_WG16_08_02
    SolutionIndex: 60
    SolutionNameMin: Cijk_Alik_Bljk_SB_MT128x032x32_GRVW04_GSU02_SNLL0_TT08_04_VW04_WG16_08_02
    SolutionIndex: 61
    SolutionNameMin: Cijk_Alik_Bljk_SB_MT032x032x32_GRVW04_GSU04_SNLL0_TT04_04_VW04_WG08_08_04
    SolutionIndex: 62
    SolutionNameMin: Cijk_Alik_Bljk_SB_MT032x008x32_GRVW02_GSU04_SNLL0_TT02_02_VW02_WG16_04_04
    SolutionIndex: 63
    SolutionNameMin: Cijk_Alik_Bljk_SB_MT032x032x32_GRVW04_GSU04_SNLL0_TT04_04_VW04_WG08_08_02
    SolutionIndex: 64
    SolutionNameMin: Cijk_Alik_Bljk_SB_MT032x032x32_GRVW04_GSU04_SNLL0_TT04_04_VW04_WG08_08_04
    SolutionIndex: 65
    SolutionNameMin: Cijk_Alik_Bljk_SB_MT064x032x32_GRVW04_GSU04_SNLL0_TT04_04_VW04_WG16_08_02
    SolutionIndex: 66
    SolutionNameMin: Cijk_Alik_Bljk_SB_MT064x064x16_GRVW04_GSU01_SNLL0_TT04_04_VW04_WG16_16_01
    SolutionIndex: 67
    SolutionNameMin: Cijk_Alik_Bljk_SB_MT064x128x16_GRVW04_GSU01_SNLL0_TT04_08_VW04_WG16_16_01
    SolutionIndex: 68
    SolutionNameMin: Cijk_Alik_Bljk_SB_MT128x064x16_GRVW04_GSU01_SNLL0_TT08_04_VW04_WG16_16_01
    SolutionIndex: 69
    SolutionNameMin: Cijk_Alik_Bljk_SB_MT064x064x16_GRVW04_GSU01_SNLL0_TT04_04_VW04_WG16_16_01
    SolutionIndex: 70
    SolutionNameMin: Cijk_Alik_Bljk_SB_MT064x128x16_GRVW04_GSU01_SNLL0_TT04_08_VW04_WG16_16_01
    SolutionIndex: 71
    SolutionNameMin: Cijk_Alik_Bljk_SB_MT128x064x16_GRVW04_GSU01_SNLL0_TT08_04_VW04_WG16_16_01
    SolutionIndex: 72
    SolutionNameMin: Cijk_Alik_Bljk_SB_MT128x128x08_GRVW04_GSU01_SNLL1_TT08_08_VW04_WG16_16_01
    SolutionIndex: 73
    SolutionNameMin: Cijk_Alik_Bljk_SB_MT128x128x08_GRVW04_GSU01_SNLL1_TT08_08_VW04_WG16_16_01
    SolutionIndex: 74
    SolutionNameMin: Cijk_Alik_Bljk_SB_MT064x064x16_GRVW04_GSU01_SNLL1_TT04_04_VW04_WG16_16_01
    SolutionIndex: 75
    SolutionNameMin: Cijk_Alik_Bljk_SB_MT064x128x16_GRVW04_GSU01_SNLL1_TT04_08_VW04_WG16_16_01
    SolutionIndex: 76
    SolutionNameMin: Cijk_Alik_Bljk_SB_MT096x128x16_GRVW02_GSU01_SNLL1_TT06_08_VW02_WG16_16_01
    SolutionIndex: 77
    SolutionNameMin: Cijk_Alik_Bljk_SB_MT128x064x16_GRVW04_GSU01_SNLL1_TT08_04_VW04_WG16_16_01
    SolutionIndex: 78
    SolutionNameMin: Cijk_Alik_Bljk_SB_MT128x096x16_GRVW02_GSU01_SNLL1_TT08_06_VW02_WG16_16_01
    SolutionIndex: 79
    SolutionNameMin: Cijk_Alik_Bljk_SB_MT128x128x16_GRVW04_GSU01_SNLL1_TT08_08_VW04_WG16_16_01
    SolutionIndex: 80
    SolutionNameMin: Cijk_Alik_Bljk_SB_MT064x064x16_GRVW04_GSU01_SNLL1_TT04_04_VW04_WG16_16_01
    SolutionIndex: 81
    SolutionNameMin: Cijk_Alik_Bljk_SB_MT064x128x16_GRVW04_GSU01_SNLL1_TT04_08_VW04_WG16_16_01
    SolutionIndex: 82
    SolutionNameMin: Cijk_Alik_Bljk_SB_MT096x128x16_GRVW02_GSU01_SNLL1_TT06_08_VW02_WG16_16_01
    SolutionIndex: 83
    SolutionNameMin: Cijk_Alik_Bljk_SB_MT128x064x16_GRVW04_GSU01_SNLL1_TT08_04_VW04_WG16_16_01
    SolutionIndex: 84
    SolutionNameMin: Cijk_Alik_Bljk_SB_MT128x096x16_GRVW02_GSU01_SNLL1_TT08_06_VW02_WG16_16_01
    SolutionIndex: 85
    SolutionNameMin: Cijk_Alik_Bljk_SB_MT128x128x16_GRVW04_GSU01_SNLL1_TT08_08_VW04_WG16_16_01
    SolutionIndex: 86
    SolutionNameMin: Cijk_Alik_Bljk_SB_MT064x064x32_GRVW04_GSU01_SNLL1_TT04_04_VW04_WG16_16_01
    SolutionIndex: 87
    SolutionNameMin: Cijk_Alik_Bljk_SB_MT064x064x32_GRVW04_GSU01_SNLL1_TT04_04_VW04_WG16_16_01
    SolutionIndex: 88
    SolutionNameMin: Cijk_Alik_Bljk_SB_MT128x064x32_GRVW04_GSU01_SNLL1_TT08_04_VW04_WG16_16_01
    SolutionIndex: 89
    SolutionNameMin: Cijk_Alik_Bljk_SB_MT128x128x32_GRVW04_GSU01_SNLL1_TT08_08_VW04_WG16_16_01
    SolutionIndex: 90
    SolutionNameMin: Cijk_Alik_Bljk_SB_MT016x016x04_GRVW02_GSU01_SNLL0_TT02_02_VW02_WG08_08_01
    SolutionIndex: 91
    SolutionNameMin: Cijk_Alik_Bljk_SB_MT032x032x02_GRVW04_GSU01_SNLL0_TT04_04_VW04_WG08_08_01
    SolutionIndex: 92
    SolutionNameMin: Cijk_Alik_Bljk_SB_MT016x016x16_GRVW02_GSU01_SNLL1_TT02_02_VW02_WG08_08_04
    SolutionIndex: 93
    SolutionNameMin: Cijk_Alik_Bljk_SB_MT008x008x08_GRVW02_GSU04_SNLL0_TT02_02_VW02_WG04_04_04
    SolutionIndex: 94
    SolutionNameMin: Cijk_Alik_Bljk_SB_MT008x008x08_GRVW02_GSU08_SNLL0_TT02_02_VW02_WG04_04_04
    SolutionIndex: 95
    SolutionNameMin: Cijk_Alik_Bljk_SB_MT008x008x08_GRVW02_GSU16_SNLL0_TT02_02_VW02_WG04_04_04
    SolutionIndex: 96
    SolutionNameMin: Cijk_Alik_Bljk_SB_MT016x016x16_GRVW02_GSU16_SNLL0_TT02_02_VW02_WG08_08_04
    SolutionIndex: 97
    SolutionNameMin: Cijk_Alik_Bljk_SB_MT064x032x16_GRVW01_GSU05_LPA01_LPB01_PGR0_PLR1_TT04_04_USFGRO01_VW01_WG16_08_01_WGM01
    SolutionIndex: 98
    SolutionNameMin: Cijk_Alik_Bljk_SB_MT032x016x32_GRVW01_GSU05_LPA01_LPB01_PGR1_PLR1_TT02_02_USFGRO01_VW01_WG16_08_01_WGM01
    SolutionIndex: 99
    SolutionNameMin: Cijk_Alik_Bljk_SB_MT032x032x32_GRVW01_GSU05_LPA01_LPB01_PGR0_PLR1_TT02_02_USFGRO01_VW01_WG16_16_01_WGM01
    SolutionIndex: 100
    SolutionNameMin: Cijk_Alik_Bljk_SB_MT032x016x32_GRVW01_GSU05_LPA02_LPB02_PGR1_PLR1_TT02_02_USFGRO01_VW02_WG16_08_01_WGM01
    SolutionIndex: 101
    SolutionNameMin: Cijk_Alik_Bljk_SB_MT032x032x32_GRVW01_GSU05_LPA02_LPB02_PGR1_PLR1_TT02_02_USFGRO01_VW02_WG16_16_01_WGM01
    SolutionIndex: 102
    SolutionNameMin: Cijk_Alik_Bljk_SB_MT128x032x16_GRVW01_GSU01_LPA04_LPB04_PGR0_PLR1_TT04_04_USFGRO01_VW04_WG32_08_01_WGM01
    SolutionIndex: 103
    SolutionNameMin: Cijk_Alik_Bljk_SB_MT128x064x16_GRVW01_GSU01_LPA04_LPB04_PGR0_PLR1_TT04_08_USFGRO01_VW04_WG32_08_01_WGM01
    SolutionIndex: 104
    SolutionNameMin: Cijk_Alik_Bljk_SB_MT064x032x16_GRVW01_GSU01_LPA04_LPB04_PGR1_PLR1_TT04_04_USFGRO01_VW04_WG16_08_01_WGM08
    SolutionIndex: 105
    SolutionNameMin: Cijk_Alik_Bljk_SB_MT064x032x16_GRVW04_GSU01_LPA04_LPB04_PGR1_PLR1_TT04_04_USFGRO0_VW04_WG16_08_01_WGM01
    SolutionIndex: 106
    SolutionNameMin: Cijk_Alik_Bljk_SB_MT64x64x8_SE_EPS0_FL0_GRVW2_LPA0_LPB0_PGR0_PLR0_TT4_4_USFGRO1_VW2_WG16_16_1_WGM8
    SolutionIndex: 107
    SolutionNameMin: Cijk_Alik_Bljk_SB_MT64x64x16_SE_EPS0_FL0_GRVW4_LPA0_LPB0_PGR0_PLR0_TT4_4_USFGRO1_VW2_WG16_16_1_WGM8
    SolutionIndex: 108
    SolutionNameMin: Cijk_Alik_Bljk_SB_MT64x64x16_SE_EPS1_FL0_GRVW4_LPA0_LPB0_PGR1_PLR1_TT4_4_USFGRO1_VW2_WG16_16_1_WGM1
    SolutionIndex: 109
    SolutionNameMin: Cijk_Alik_Bljk_SB_MT64x64x16_SE_EPS1_FL0_GRVW4_LPA0_LPB0_PGR1_PLR1_TT4_4_USFGRO1_VW2_WG16_16_1_WGM8
    SolutionIndex: 110
    SolutionNameMin: Cijk_Alik_Bljk_SB_MT64x64x32_SE_EPS1_FL0_GRVW4_LPA0_LPB0_PGR1_PLR1_TT4_4_USFGRO1_VW2_WG16_16_1_WGM1
    SolutionIndex: 111
    SolutionNameMin: Cijk_Alik_Bljk_SB_MT64x64x32_SE_EPS0_FL0_GRVW4_LPA0_LPB0_PGR0_PLR1_TT4_4_USFGRO1_VW2_WG16_16_1_WGM8
    SolutionIndex: 112
    SolutionNameMin: Cijk_Alik_Bljk_SB_MT64x64x16_SE_EPS1_FL0_GRVW4_LPA0_LPB0_PGR1_PLR0_TT4_4_USFGRO1_VW4_WG16_16_1_WGM1
    SolutionIndex: 113
    SolutionNameMin: Cijk_Alik_Bljk_SB_MT64x64x16_SE_EPS1_FL0_GRVW4_LPA0_LPB0_PGR1_PLR1_TT4_4_USFGRO1_VW4_WG16_16_1_WGM1
    SolutionIndex: 114
    SolutionNameMin: Cijk_Alik_Bljk_SB_MT64x64x16_SE_EPS1_FL0_GRVW4_LPA0_LPB0_PGR1_PLR1_TT4_4_USFGRO1_VW4_WG16_16_1_WGM8
    SolutionIndex: 115
    SolutionNameMin: Cijk_Alik_Bljk_SB_MT64x64x32_SE_EPS1_FL0_GRVW4_LPA0_LPB0_PGR1_PLR1_TT4_4_USFGRO1_VW4_WG16_16_1_WGM1
    SolutionIndex: 116
    SolutionNameMin: Cijk_Alik_Bljk_SB_MT64x64x32_SE_EPS0_FL0_GRVW4_LPA0_LPB0_PGR0_PLR1_TT4_4_USFGRO1_VW4_WG16_16_1_WGM8
    SolutionIndex: 117
    SolutionNameMin: Cijk_Alik_Bljk_SB_MT64x64x32_SE_EPS1_FL0_GRVW4_LPA0_LPB0_PGR1_PLR1_TT4_4_USFGRO1_VW4_WG16_16_1_WGM8
    SolutionIndex: 118
    SolutionNameMin: Cijk_Alik_Bljk_SB_MT64x64x16_SE_EPS1_FL1_GRVW2_LPA0_LPB0_PGR1_PLR1_TT4_4_USFGRO1_VW2_WG16_16_1_WGM8
    SolutionIndex: 119
    SolutionNameMin: Cijk_Alik_Bljk_SB_MT64x64x16_SE_EPS1_FL1_GRVW2_LPA0_LPB0_PGR1_PLR1_TT4_4_USFGRO1_VW4_WG16_16_1_WGM1
    SolutionIndex: 120
    SolutionNameMin: Cijk_Alik_Bljk_SB_MT64x64x16_SE_EPS1_FL1_GRVW4_LPA0_LPB0_PGR1_PLR1_TT4_4_USFGRO1_VW2_WG16_16_1_WGM1
    SolutionIndex: 121
    SolutionNameMin: Cijk_Alik_Bljk_SB_MT64x64x16_SE_EPS1_FL1_GRVW4_LPA0_LPB0_PGR1_PLR1_TT4_4_USFGRO1_VW2_WG16_16_1_WGM8
    SolutionIndex: 122
    SolutionNameMin: Cijk_Alik_Bljk_SB_MT64x64x32_SE_EPS1_FL1_GRVW4_LPA0_LPB0_PGR1_PLR1_TT4_4_USFGRO1_VW2_WG16_16_1_WGM1
    SolutionIndex: 123
    SolutionNameMin: Cijk_Alik_Bljk_SB_MT64x64x16_SE_EPS1_FL1_GRVW4_LPA0_LPB0_PGR1_PLR0_TT4_4_USFGRO1_VW4_WG16_16_1_WGM1
    SolutionIndex: 124
    SolutionNameMin: Cijk_Alik_Bljk_SB_MT64x64x16_SE_EPS1_FL1_GRVW4_LPA0_LPB0_PGR1_PLR1_TT4_4_USFGRO1_VW4_WG16_16_1_WGM1
    SolutionIndex: 125
    SolutionNameMin: Cijk_Alik_Bljk_SB_MT64x64x16_SE_EPS1_FL1_GRVW4_LPA0_LPB0_PGR1_PLR1_TT4_4_USFGRO1_VW4_WG16_16_1_WGM8
    SolutionIndex: 126
    SolutionNameMin: Cijk_Alik_Bljk_SB_MT64x64x32_SE_EPS1_FL1_GRVW4_LPA0_LPB0_PGR1_PLR1_TT4_4_USFGRO1_VW4_WG16_16_1_WGM1
    SolutionIndex: 127
    SolutionNameMin: Cijk_Alik_Bljk_SB_MT64x64x32_SE_EPS1_FL1_GRVW4_LPA0_LPB0_PGR1_PLR1_TT4_4_USFGRO1_VW4_WG16_16_1_WGM8
    SolutionIndex: 128
    SolutionNameMin: Cijk_Alik_Bljk_SB_MT96x64x32_SE_EPS0_FL0_GRVW2_LPA0_LPB0_PGR0_PLR1_TT6_4_USFGRO1_VW2_WG16_16_1_WGM8
    SolutionIndex: 129
    SolutionNameMin: Cijk_Alik_Bljk_SB_MT96x64x8_SE_EPS1_FL1_GRVW1_LPA0_LPB0_PGR1_PLR0_TT6_4_USFGRO1_VW2_WG16_16_1_WGM1
    SolutionIndex: 130
    SolutionNameMin: Cijk_Alik_Bljk_SB_MT64x96x8_SE_EPS1_FL0_GRVW1_LPA0_LPB0_PGR1_PLR0_TT4_6_USFGRO1_VW2_WG16_16_1_WGM1
    SolutionIndex: 131
    SolutionNameMin: Cijk_Alik_Bljk_SB_MT64x96x16_SE_EPS0_FL0_GRVW2_LPA0_LPB0_PGR0_PLR0_TT4_6_USFGRO1_VW2_WG16_16_1_WGM8
    SolutionIndex: 132
    SolutionNameMin: Cijk_Alik_Bljk_SB_MT64x96x16_SE_EPS1_FL0_GRVW2_LPA0_LPB0_PGR1_PLR1_TT4_6_USFGRO1_VW2_WG16_16_1_WGM1
    SolutionIndex: 133
    SolutionNameMin: Cijk_Alik_Bljk_SB_MT64x96x32_SE_EPS0_FL0_GRVW4_LPA0_LPB0_PGR0_PLR1_TT4_6_USFGRO1_VW2_WG16_16_1_WGM8
    SolutionIndex: 134
    SolutionNameMin: Cijk_Alik_Bljk_SB_MT64x96x8_SE_EPS1_FL1_GRVW1_LPA0_LPB0_PGR1_PLR1_TT4_6_USFGRO1_VW2_WG16_16_1_WGM1
    SolutionIndex: 135
    SolutionNameMin: Cijk_Alik_Bljk_SB_MT64x96x8_SE_EPS1_FL1_GRVW4_LPA0_LPB0_PGR1_PLR1_TT4_6_USFGRO1_VW2_WG16_16_1_WGM1
    SolutionIndex: 136
    SolutionNameMin: Cijk_Alik_Bljk_SB_MT64x128x8_SE_EPS1_FL0_GRVW1_LPA0_LPB0_PGR1_PLR0_TT4_8_USFGRO1_VW4_WG16_16_1_WGM1
    SolutionIndex: 137
    SolutionNameMin: Cijk_Alik_Bljk_SB_MT64x128x8_SE_EPS0_FL0_GRVW2_LPA0_LPB0_PGR0_PLR0_TT4_8_USFGRO1_VW4_WG16_16_1_WGM1
    SolutionIndex: 138
    SolutionNameMin: Cijk_Alik_Bljk_SB_MT64x128x8_SE_EPS1_FL0_GRVW4_LPA0_LPB0_PGR1_PLR0_TT4_8_USFGRO1_VW2_WG16_16_1_WGM8
    SolutionIndex: 139
    SolutionNameMin: Cijk_Alik_Bljk_SB_MT64x128x16_SE_EPS1_FL0_GRVW4_LPA0_LPB0_PGR1_PLR1_TT4_8_USFGRO1_VW2_WG16_16_1_WGM1
    SolutionIndex: 140
    SolutionNameMin: Cijk_Alik_Bljk_SB_MT64x128x16_SE_EPS1_FL0_GRVW4_LPA0_LPB0_PGR1_PLR0_TT4_8_USFGRO1_VW4_WG16_16_1_WGM1
    SolutionIndex: 141
    SolutionNameMin: Cijk_Alik_Bljk_SB_MT64x128x16_SE_EPS1_FL0_GRVW4_LPA0_LPB0_PGR1_PLR1_TT4_8_USFGRO1_VW4_WG16_16_1_WGM1
    SolutionIndex: 142
    SolutionNameMin: Cijk_Alik_Bljk_SB_MT64x128x8_SE_EPS1_FL1_GRVW1_LPA0_LPB0_PGR1_PLR0_TT4_8_USFGRO1_VW4_WG16_16_1_WGM1
    SolutionIndex: 143
    SolutionNameMin: Cijk_Alik_Bljk_SB_MT64x128x8_SE_EPS1_FL1_GRVW4_LPA0_LPB0_PGR1_PLR0_TT4_8_USFGRO1_VW2_WG16_16_1_WGM8
    SolutionIndex: 144
    SolutionNameMin: Cijk_Alik_Bljk_SB_MT64x128x8_SE_EPS1_FL1_GRVW4_LPA0_LPB0_PGR1_PLR1_TT4_8_USFGRO1_VW2_WG16_16_1_WGM8
    SolutionIndex: 145
    SolutionNameMin: Cijk_Alik_Bljk_SB_MT64x128x16_SE_EPS1_FL1_GRVW4_LPA0_LPB0_PGR1_PLR1_TT4_8_USFGRO1_VW2_WG16_16_1_WGM1
    SolutionIndex: 146
    SolutionNameMin: Cijk_Alik_Bljk_SB_MT64x128x8_SE_EPS1_FL1_GRVW4_LPA0_LPB0_PGR1_PLR0_TT4_8_USFGRO1_VW4_WG16_16_1_WGM8
    SolutionIndex: 147
    SolutionNameMin: Cijk_Alik_Bljk_SB_MT64x128x16_SE_EPS1_FL1_GRVW4_LPA0_LPB0_PGR1_PLR1_TT4_8_USFGRO1_VW4_WG16_16_1_WGM1
    SolutionIndex: 148
    SolutionNameMin: Cijk_Alik_Bljk_SB_MT128x64x16_SE_EPS0_FL0_GRVW1_LPA0_LPB0_PGR0_PLR0_TT8_4_USFGRO1_VW2_WG16_16_1_WGM8
    SolutionIndex: 149
    SolutionNameMin: Cijk_Alik_Bljk_SB_MT128x64x8_SE_EPS1_FL0_GRVW2_LPA0_LPB0_PGR1_PLR0_TT8_4_USFGRO1_VW2_WG16_16_1_WGM8
    SolutionIndex: 150
    SolutionNameMin: Cijk_Alik_Bljk_SB_MT128x64x8_SE_EPS1_FL0_GRVW2_LPA0_LPB0_PGR1_PLR1_TT8_4_USFGRO1_VW2_WG16_16_1_WGM8
    SolutionIndex: 151
    SolutionNameMin: Cijk_Alik_Bljk_SB_MT128x64x16_SE_EPS1_FL0_GRVW2_LPA0_LPB0_PGR1_PLR1_TT8_4_USFGRO1_VW4_WG16_16_1_WGM8
    SolutionIndex: 152
    SolutionNameMin: Cijk_Alik_Bljk_SB_MT128x64x16_SE_EPS1_FL0_GRVW4_LPA0_LPB0_PGR1_PLR1_TT8_4_USFGRO1_VW2_WG16_16_1_WGM1
    SolutionIndex: 153
    SolutionNameMin: Cijk_Alik_Bljk_SB_MT128x64x16_SE_EPS1_FL0_GRVW4_LPA0_LPB0_PGR1_PLR1_TT8_4_USFGRO1_VW2_WG16_16_1_WGM8
    SolutionIndex: 154
    SolutionNameMin: Cijk_Alik_Bljk_SB_MT128x64x16_SE_EPS0_FL0_GRVW4_LPA0_LPB0_PGR0_PLR1_TT8_4_USFGRO1_VW4_WG16_16_1_WGM1
    SolutionIndex: 155
    SolutionNameMin: Cijk_Alik_Bljk_SB_MT128x64x16_SE_EPS1_FL0_GRVW4_LPA0_LPB0_PGR1_PLR1_TT8_4_USFGRO1_VW4_WG16_16_1_WGM1
    SolutionIndex: 156
    SolutionNameMin: Cijk_Alik_Bljk_SB_MT128x64x16_SE_EPS1_FL0_GRVW4_LPA0_LPB0_PGR1_PLR1_TT8_4_USFGRO1_VW4_WG16_16_1_WGM8
    SolutionIndex: 157
    SolutionNameMin: Cijk_Alik_Bljk_SB_MT128x64x8_SE_EPS1_FL1_GRVW2_LPA0_LPB0_PGR1_PLR0_TT8_4_USFGRO1_VW2_WG16_16_1_WGM8
    SolutionIndex: 158
    SolutionNameMin: Cijk_Alik_Bljk_SB_MT128x64x16_SE_EPS1_FL1_GRVW2_LPA0_LPB0_PGR1_PLR1_TT8_4_USFGRO1_VW4_WG16_16_1_WGM8
    SolutionIndex: 159
    SolutionNameMin: Cijk_Alik_Bljk_SB_MT128x64x8_SE_EPS1_FL1_GRVW4_LPA0_LPB0_PGR1_PLR0_TT8_4_USFGRO1_VW2_WG16_16_1_WGM8
    SolutionIndex: 160
    SolutionNameMin: Cijk_Alik_Bljk_SB_MT128x64x16_SE_EPS1_FL1_GRVW4_LPA0_LPB0_PGR1_PLR1_TT8_4_USFGRO1_VW2_WG16_16_1_WGM8
    SolutionIndex: 161
    SolutionNameMin: Cijk_Alik_Bljk_SB_MT128x64x8_SE_EPS1_FL1_GRVW4_LPA0_LPB0_PGR1_PLR0_TT8_4_USFGRO1_VW4_WG16_16_1_WGM8
    SolutionIndex: 162
    SolutionNameMin: Cijk_Alik_Bljk_SB_MT128x64x16_SE_EPS0_FL1_GRVW4_LPA0_LPB0_PGR0_PLR1_TT8_4_USFGRO1_VW4_WG16_16_1_WGM1
    SolutionIndex: 163
    SolutionNameMin: Cijk_Alik_Bljk_SB_MT128x64x16_SE_EPS1_FL1_GRVW4_LPA0_LPB0_PGR1_PLR1_TT8_4_USFGRO1_VW4_WG16_16_1_WGM1
    SolutionIndex: 164
    SolutionNameMin: Cijk_Alik_Bljk_SB_MT128x64x16_SE_EPS0_FL1_GRVW4_LPA0_LPB0_PGR0_PLR1_TT8_4_USFGRO1_VW4_WG16_16_1_WGM8
    SolutionIndex: 165
    SolutionNameMin: Cijk_Alik_Bljk_SB_MT128x64x16_SE_EPS1_FL1_GRVW4_LPA0_LPB0_PGR1_PLR1_TT8_4_USFGRO1_VW4_WG16_16_1_WGM8
    SolutionIndex: 166
    SolutionNameMin: Cijk_Alik_Bljk_SB_MT128x128x16_SE_EPS1_FL0_GRVW2_LPA0_LPB0_PGR1_PLR0_TT8_8_USFGRO1_VW2_WG16_16_1_WGM1
    SolutionIndex: 167
    SolutionNameMin: Cijk_Alik_Bljk_SB_MT128x128x8_SE_EPS1_FL0_GRVW2_LPA0_LPB0_PGR1_PLR1_TT8_8_USFGRO1_VW2_WG16_16_1_WGM1
    SolutionIndex: 168
    SolutionNameMin: Cijk_Alik_Bljk_SB_MT128x128x8_SE_EPS1_FL0_GRVW2_LPA0_LPB0_PGR1_PLR1_TT8_8_USFGRO1_VW2_WG16_16_1_WGM8
    SolutionIndex: 169
    SolutionNameMin: Cijk_Alik_Bljk_SB_MT128x128x16_SE_EPS1_FL0_GRVW2_LPA0_LPB0_PGR1_PLR1_TT8_8_USFGRO1_VW2_WG16_16_1_WGM1
    SolutionIndex: 170
    SolutionNameMin: Cijk_Alik_Bljk_SB_MT128x128x16_SE_EPS1_FL0_GRVW2_LPA0_LPB0_PGR1_PLR1_TT8_8_USFGRO1_VW2_WG16_16_1_WGM8
    SolutionIndex: 171
    SolutionNameMin: Cijk_Alik_Bljk_SB_MT128x128x8_SE_EPS1_FL0_GRVW2_LPA0_LPB0_PGR1_PLR0_TT8_8_USFGRO1_VW4_WG16_16_1_WGM1
    SolutionIndex: 172
    SolutionNameMin: Cijk_Alik_Bljk_SB_MT128x128x16_SE_EPS1_FL0_GRVW2_LPA0_LPB0_PGR1_PLR0_TT8_8_USFGRO1_VW4_WG16_16_1_WGM1
    SolutionIndex: 173
    SolutionNameMin: Cijk_Alik_Bljk_SB_MT128x128x16_SE_EPS1_FL0_GRVW2_LPA0_LPB0_PGR1_PLR0_TT8_8_USFGRO1_VW4_WG16_16_1_WGM8
    SolutionIndex: 174
    SolutionNameMin: Cijk_Alik_Bljk_SB_MT128x128x8_SE_EPS1_FL0_GRVW2_LPA0_LPB0_PGR1_PLR1_TT8_8_USFGRO1_VW4_WG16_16_1_WGM1
    SolutionIndex: 175
    SolutionNameMin: Cijk_Alik_Bljk_SB_MT128x128x8_SE_EPS1_FL0_GRVW4_LPA0_LPB0_PGR1_PLR0_TT8_8_USFGRO1_VW2_WG16_16_1_WGM1
    SolutionIndex: 176
    SolutionNameMin: Cijk_Alik_Bljk_SB_MT128x128x16_SE_EPS1_FL0_GRVW4_LPA0_LPB0_PGR1_PLR0_TT8_8_USFGRO1_VW2_WG16_16_1_WGM1
    SolutionIndex: 177
    SolutionNameMin: Cijk_Alik_Bljk_SB_MT128x128x8_SE_EPS1_FL0_GRVW4_LPA0_LPB0_PGR1_PLR1_TT8_8_USFGRO1_VW2_WG16_16_1_WGM1
    SolutionIndex: 178
    SolutionNameMin: Cijk_Alik_Bljk_SB_MT128x128x16_SE_EPS1_FL0_GRVW4_LPA0_LPB0_PGR1_PLR1_TT8_8_USFGRO1_VW2_WG16_16_1_WGM1
    SolutionIndex: 179
    SolutionNameMin: Cijk_Alik_Bljk_SB_MT128x128x16_SE_EPS1_FL0_GRVW4_LPA0_LPB0_PGR1_PLR1_TT8_8_USFGRO1_VW2_WG16_16_1_WGM8
    SolutionIndex: 180
    SolutionNameMin: Cijk_Alik_Bljk_SB_MT128x128x8_SE_EPS1_FL0_GRVW4_LPA0_LPB0_PGR1_PLR0_TT8_8_USFGRO1_VW4_WG16_16_1_WGM1
    SolutionIndex: 181
    SolutionNameMin: Cijk_Alik_Bljk_SB_MT128x128x16_SE_EPS1_FL0_GRVW4_LPA0_LPB0_PGR1_PLR0_TT8_8_USFGRO1_VW4_WG16_16_1_WGM1
    SolutionIndex: 182
    SolutionNameMin: Cijk_Alik_Bljk_SB_MT128x128x8_SE_EPS1_FL0_GRVW4_LPA0_LPB0_PGR1_PLR1_TT8_8_USFGRO1_VW4_WG16_16_1_WGM1
    SolutionIndex: 183
    SolutionNameMin: Cijk_Alik_Bljk_SB_MT128x128x16_SE_EPS1_FL0_GRVW4_LPA0_LPB0_PGR1_PLR1_TT8_8_USFGRO1_VW4_WG16_16_1_WGM1
    SolutionIndex: 184
    SolutionNameMin: Cijk_Alik_Bljk_SB_MT128x128x8_SE_EPS1_FL1_GRVW1_LPA0_LPB0_PGR1_PLR1_TT8_8_USFGRO1_VW4_WG16_16_1_WGM1
    SolutionIndex: 185
    SolutionNameMin: Cijk_Alik_Bljk_SB_MT128x128x8_SE_EPS1_FL1_GRVW2_LPA0_LPB0_PGR1_PLR0_TT8_8_USFGRO1_VW2_WG16_16_1_WGM1
    SolutionIndex: 186
    SolutionNameMin: Cijk_Alik_Bljk_SB_MT128x128x16_SE_EPS1_FL1_GRVW2_LPA0_LPB0_PGR1_PLR0_TT8_8_USFGRO1_VW2_WG16_16_1_WGM1
    SolutionIndex: 187
    SolutionNameMin: Cijk_Alik_Bljk_SB_MT128x128x8_SE_EPS1_FL1_GRVW2_LPA0_LPB0_PGR1_PLR1_TT8_8_USFGRO1_VW2_WG16_16_1_WGM1
    SolutionIndex: 188
    SolutionNameMin: Cijk_Alik_Bljk_SB_MT128x128x8_SE_EPS1_FL1_GRVW2_LPA0_LPB0_PGR1_PLR1_TT8_8_USFGRO1_VW2_WG16_16_1_WGM8
    SolutionIndex: 189
    SolutionNameMin: Cijk_Alik_Bljk_SB_MT128x128x16_SE_EPS1_FL1_GRVW2_LPA0_LPB0_PGR1_PLR1_TT8_8_USFGRO1_VW2_WG16_16_1_WGM1
    SolutionIndex: 190
    SolutionNameMin: Cijk_Alik_Bljk_SB_MT128x128x8_SE_EPS1_FL1_GRVW2_LPA0_LPB0_PGR1_PLR0_TT8_8_USFGRO1_VW4_WG16_16_1_WGM1
    SolutionIndex: 191
    SolutionNameMin: Cijk_Alik_Bljk_SB_MT128x128x16_SE_EPS1_FL1_GRVW2_LPA0_LPB0_PGR1_PLR0_TT8_8_USFGRO1_VW4_WG16_16_1_WGM1
    SolutionIndex: 192
    SolutionNameMin: Cijk_Alik_Bljk_SB_MT128x128x16_SE_EPS1_FL1_GRVW2_LPA0_LPB0_PGR1_PLR0_TT8_8_USFGRO1_VW4_WG16_16_1_WGM8
    SolutionIndex: 193
    SolutionNameMin: Cijk_Alik_Bljk_SB_MT128x128x8_SE_EPS1_FL1_GRVW2_LPA0_LPB0_PGR1_PLR1_TT8_8_USFGRO1_VW4_WG16_16_1_WGM1
    SolutionIndex: 194
    SolutionNameMin: Cijk_Alik_Bljk_SB_MT128x128x16_SE_EPS1_FL1_GRVW2_LPA0_LPB0_PGR1_PLR1_TT8_8_USFGRO1_VW4_WG16_16_1_WGM1
    SolutionIndex: 195
    SolutionNameMin: Cijk_Alik_Bljk_SB_MT128x128x8_SE_EPS1_FL1_GRVW4_LPA0_LPB0_PGR1_PLR0_TT8_8_USFGRO1_VW2_WG16_16_1_WGM1
    SolutionIndex: 196
    SolutionNameMin: Cijk_Alik_Bljk_SB_MT128x128x8_SE_EPS1_FL1_GRVW4_LPA0_LPB0_PGR1_PLR0_TT8_8_USFGRO1_VW2_WG16_16_1_WGM8
    SolutionIndex: 197
    SolutionNameMin: Cijk_Alik_Bljk_SB_MT128x128x16_SE_EPS1_FL1_GRVW4_LPA0_LPB0_PGR1_PLR0_TT8_8_USFGRO1_VW2_WG16_16_1_WGM1
    SolutionIndex: 198
    SolutionNameMin: Cijk_Alik_Bljk_SB_MT128x128x8_SE_EPS1_FL1_GRVW4_LPA0_LPB0_PGR1_PLR1_TT8_8_USFGRO1_VW2_WG16_16_1_WGM1
    SolutionIndex: 199
    SolutionNameMin: Cijk_Alik_Bljk_SB_MT128x128x16_SE_EPS1_FL1_GRVW4_LPA0_LPB0_PGR1_PLR1_TT8_8_USFGRO1_VW2_WG16_16_1_WGM1
    SolutionIndex: 200
    SolutionNameMin: Cijk_Alik_Bljk_SB_MT128x128x16_SE_EPS1_FL1_GRVW4_LPA0_LPB0_PGR1_PLR1_TT8_8_USFGRO1_VW2_WG16_16_1_WGM8
    SolutionIndex: 201
    SolutionNameMin: Cijk_Alik_Bljk_SB_MT128x128x8_SE_EPS1_FL1_GRVW4_LPA0_LPB0_PGR1_PLR0_TT8_8_USFGRO1_VW4_WG16_16_1_WGM1
    SolutionIndex: 202
    SolutionNameMin: Cijk_Alik_Bljk_SB_MT128x128x16_SE_EPS1_FL1_GRVW4_LPA0_LPB0_PGR1_PLR0_TT8_8_USFGRO1_VW4_WG16_16_1_WGM1
    SolutionIndex: 203
    SolutionNameMin: Cijk_Alik_Bljk_SB_MT128x128x16_SE_EPS1_FL1_GRVW4_LPA0_LPB0_PGR1_PLR0_TT8_8_USFGRO1_VW4_WG16_16_1_WGM8
    SolutionIndex: 204
    SolutionNameMin: Cijk_Alik_Bljk_SB_MT128x128x8_SE_EPS1_FL1_GRVW4_LPA0_LPB0_PGR1_PLR1_TT8_8_USFGRO1_VW4_WG16_16_1_WGM1
    SolutionIndex: 205
    SolutionNameMin: Cijk_Alik_Bljk_SB_MT128x128x16_SE_EPS1_FL1_GRVW4_LPA0_LPB0_PGR1_PLR1_TT8_8_USFGRO1_VW4_WG16_16_1_WGM1
    SolutionIndex: 206
    SolutionNameMin: Cijk_Alik_Bljk_SB_MT64x64x16_SE_EPS0_FL0_GRVW4_LPA2_LPB0_PGR0_PLR0_TT4_4_USFGRO1_VW2_WG16_16_1_WGM8
    SolutionIndex: 207
    SolutionNameMin: Cijk_Alik_Bljk_SB_MT64x64x16_SE_EPS0_FL0_GRVW4_LPA2_LPB2_PGR0_PLR0_TT4_4_USFGRO1_VW2_WG16_16_1_WGM8
    SolutionIndex: 208
    SolutionNameMin: Cijk_Alik_Bljk_SB_MT64x64x16_SE_EPS0_FL0_GRVW4_LPA0_LPB2_PGR0_PLR1_TT4_4_USFGRO1_VW2_WG16_16_1_WGM8
    SolutionIndex: 209
    SolutionNameMin: Cijk_Alik_Bljk_SB_MT64x64x16_SE_EPS0_FL1_GRVW4_LPA2_LPB0_PGR0_PLR1_TT4_4_USFGRO1_VW2_WG16_16_1_WGM8
    SolutionIndex: 210
    SolutionNameMin: Cijk_Alik_Bljk_SB_MT64x64x16_SE_EPS0_FL1_GRVW4_LPA2_LPB2_PGR0_PLR0_TT4_4_USFGRO1_VW2_WG16_16_1_WGM8
    SolutionIndex: 211
    SolutionNameMin: Cijk_Alik_Bljk_SB_MT64x32x32_SE_EPS0_FL0_GRVW2_LPA2_LPB2_PGR0_PLR1_TT4_2_USFGRO1_VW2_WG16_16_1_WGM8
    SolutionIndex: 212
    SolutionNameMin: Cijk_Alik_Bljk_SB_MT64x32x32_SE_EPS0_FL0_GRVW4_LPA2_LPB2_PGR0_PLR1_TT4_2_USFGRO1_VW2_WG16_16_1_WGM1
    SolutionIndex: 213
    SolutionNameMin: Cijk_Alik_Bljk_SB_MT64x32x32_SE_EPS0_FL0_GRVW4_LPA2_LPB2_PGR0_PLR1_TT4_2_USFGRO1_VW2_WG16_16_1_WGM8
    SolutionIndex: 214
    SolutionNameMin: Cijk_Alik_Bljk_SB_MT64x32x32_SE_EPS0_FL1_GRVW4_LPA2_LPB2_PGR0_PLR1_TT4_2_USFGRO1_VW2_WG16_16_1_WGM1
    SolutionIndex: 215
    SolutionNameMin: Cijk_Alik_Bljk_SB_MT32x64x32_SE_EPS0_FL0_GRVW2_LPA2_LPB2_PGR0_PLR1_TT2_4_USFGRO1_VW2_WG16_16_1_WGM8
    SolutionIndex: 216
    SolutionNameMin: Cijk_Alik_Bljk_SB_MT32x64x32_SE_EPS0_FL1_GRVW4_LPA2_LPB2_PGR0_PLR1_TT2_4_USFGRO1_VW2_WG16_16_1_WGM1
    SolutionIndex: 217
    SolutionNameMin: Cijk_Alik_Bljk_SB_MT64x32x16_SE_EPS0_FL0_GRVW4_LPA2_LPB2_PGR0_PLR1_TT4_4_USFGRO1_VW2_WG16_8_1_WGM8
    SolutionIndex: 218
    SolutionNameMin: Cijk_Alik_Bljk_SB_MT64x16x8_SE_EPS1_FL0_GRVW1_LPA2_LPB0_PGR1_PLR1_TT4_2_USFGRO1_VW2_WG16_8_1_WGM1
    SolutionIndex: 219
    SolutionNameMin: Cijk_Alik_Bljk_SB_MT64x16x16_SE_EPS0_FL0_GRVW1_LPA2_LPB2_PGR0_PLR1_TT4_2_USFGRO1_VW2_WG16_8_1_WGM1
    SolutionIndex: 220
    SolutionNameMin: Cijk_Alik_Bljk_SB_MT64x16x16_SE_EPS0_FL0_GRVW1_LPA2_LPB2_PGR0_PLR1_TT4_2_USFGRO1_VW2_WG16_8_1_WGM8
    SolutionIndex: 221
    SolutionNameMin: Cijk_Alik_Bljk_SB_MT64x16x8_SE_EPS1_FL0_GRVW4_LPA0_LPB2_PGR1_PLR1_TT4_2_USFGRO1_VW2_WG16_8_1_WGM1
    SolutionIndex: 222
    SolutionNameMin: Cijk_Alik_Bljk_SB_MT64x16x16_SE_EPS0_FL1_GRVW1_LPA2_LPB2_PGR0_PLR1_TT4_2_USFGRO1_VW2_WG16_8_1_WGM1
    SolutionIndex: 223
    SolutionNameMin: Cijk_Alik_Bljk_SB_MT64x16x16_SE_EPS0_FL1_GRVW1_LPA2_LPB2_PGR0_PLR1_TT4_2_USFGRO1_VW2_WG16_8_1_WGM8
    SolutionIndex: 224
    SolutionNameMin: Cijk_Alik_Bljk_SB_MT64x16x32_SE_EPS0_FL1_GRVW1_LPA2_LPB2_PGR0_PLR1_TT4_2_USFGRO1_VW2_WG16_8_1_WGM1
    SolutionIndex: 225
    SolutionNameMin: Cijk_Alik_Bljk_SB_MT64x16x16_SE_EPS0_FL1_GRVW2_LPA2_LPB2_PGR0_PLR1_TT4_2_USFGRO1_VW2_WG16_8_1_WGM8
    SolutionIndex: 226
    SolutionNameMin: Cijk_Alik_Bljk_SB_MT64x16x32_SE_EPS0_FL1_GRVW2_LPA2_LPB2_PGR0_PLR1_TT4_2_USFGRO1_VW2_WG16_8_1_WGM1
    SolutionIndex: 227
    SolutionNameMin: Cijk_Alik_Bljk_SB_MT64x16x16_SE_EPS0_FL1_GRVW4_LPA2_LPB0_PGR0_PLR1_TT4_2_USFGRO1_VW2_WG16_8_1_WGM8
    SolutionIndex: 228
    SolutionNameMin: Cijk_Alik_Bljk_SB_MT64x16x16_SE_EPS0_FL1_GRVW4_LPA0_LPB2_PGR0_PLR1_TT4_2_USFGRO1_VW2_WG16_8_1_WGM8
    SolutionIndex: 229
    SolutionNameMin: Cijk_Alik_Bljk_SB_MT32x32x8_SE_EPS0_FL0_GRVW1_LPA2_LPB2_PGR0_PLR0_TT2_4_USFGRO1_VW2_WG16_8_1_WGM1
    SolutionIndex: 230
    SolutionNameMin: Cijk_Alik_Bljk_SB_MT32x32x16_SE_EPS0_FL0_GRVW1_LPA2_LPB2_PGR0_PLR0_TT2_4_USFGRO1_VW2_WG16_8_1_WGM1
    SolutionIndex: 231
    SolutionNameMin: Cijk_Alik_Bljk_SB_MT32x32x16_SE_EPS0_FL0_GRVW2_LPA2_LPB2_PGR0_PLR0_TT2_4_USFGRO1_VW2_WG16_8_1_WGM8
    SolutionIndex: 232
    SolutionNameMin: Cijk_Alik_Bljk_SB_MT32x32x16_SE_EPS0_FL0_GRVW2_LPA2_LPB2_PGR0_PLR1_TT2_4_USFGRO1_VW2_WG16_8_1_WGM8
    SolutionIndex: 233
    SolutionNameMin: Cijk_Alik_Bljk_SB_MT32x32x32_SE_EPS0_FL0_GRVW2_LPA2_LPB2_PGR0_PLR1_TT2_4_USFGRO1_VW2_WG16_8_1_WGM8
    SolutionIndex: 234
    SolutionNameMin: Cijk_Alik_Bljk_SB_MT32x32x16_SE_EPS0_FL0_GRVW4_LPA0_LPB0_PGR0_PLR1_TT2_4_USFGRO1_VW2_WG16_8_1_WGM8
    SolutionIndex: 235
    SolutionNameMin: Cijk_Alik_Bljk_SB_MT32x32x16_SE_EPS0_FL0_GRVW4_LPA2_LPB0_PGR0_PLR1_TT2_4_USFGRO1_VW2_WG16_8_1_WGM8
    SolutionIndex: 236
    SolutionNameMin: Cijk_Alik_Bljk_SB_MT32x32x32_SE_EPS0_FL0_GRVW4_LPA2_LPB0_PGR0_PLR1_TT2_4_USFGRO1_VW2_WG16_8_1_WGM1
    SolutionIndex: 237
    SolutionNameMin: Cijk_Alik_Bljk_SB_MT32x32x32_SE_EPS0_FL0_GRVW4_LPA2_LPB2_PGR0_PLR0_TT2_4_USFGRO1_VW2_WG16_8_1_WGM1
    SolutionIndex: 238
    SolutionNameMin: Cijk_Alik_Bljk_SB_MT32x32x16_SE_EPS0_FL0_GRVW4_LPA0_LPB2_PGR0_PLR1_TT2_4_USFGRO1_VW2_WG16_8_1_WGM1
    SolutionIndex: 239
    SolutionNameMin: Cijk_Alik_Bljk_SB_MT32x32x8_SE_EPS1_FL0_GRVW4_LPA2_LPB2_PGR1_PLR1_TT2_4_USFGRO1_VW2_WG16_8_1_WGM1
    SolutionIndex: 240
    SolutionNameMin: Cijk_Alik_Bljk_SB_MT32x32x16_SE_EPS0_FL0_GRVW4_LPA2_LPB2_PGR0_PLR1_TT2_4_USFGRO1_VW2_WG16_8_1_WGM1
    SolutionIndex: 241
    SolutionNameMin: Cijk_Alik_Bljk_SB_MT32x32x16_SE_EPS0_FL0_GRVW4_LPA2_LPB2_PGR0_PLR1_TT2_4_USFGRO1_VW2_WG16_8_1_WGM8
    SolutionIndex: 242
    SolutionNameMin: Cijk_Alik_Bljk_SB_MT32x32x32_SE_EPS0_FL0_GRVW4_LPA2_LPB2_PGR0_PLR1_TT2_4_USFGRO1_VW2_WG16_8_1_WGM1
    SolutionIndex: 243
    SolutionNameMin: Cijk_Alik_Bljk_SB_MT32x32x32_SE_EPS0_FL0_GRVW4_LPA2_LPB2_PGR0_PLR1_TT2_4_USFGRO1_VW2_WG16_8_1_WGM8
    SolutionIndex: 244
    SolutionNameMin: Cijk_Alik_Bljk_SB_MT32x32x8_SE_EPS0_FL1_GRVW1_LPA2_LPB2_PGR0_PLR1_TT2_4_USFGRO1_VW2_WG16_8_1_WGM1
    SolutionIndex: 245
    SolutionNameMin: Cijk_Alik_Bljk_SB_MT32x32x16_SE_EPS0_FL1_GRVW1_LPA2_LPB2_PGR0_PLR1_TT2_4_USFGRO1_VW2_WG16_8_1_WGM8
    SolutionIndex: 246
    SolutionNameMin: Cijk_Alik_Bljk_SB_MT32x32x16_SE_EPS0_FL1_GRVW2_LPA2_LPB2_PGR0_PLR1_TT2_4_USFGRO1_VW2_WG16_8_1_WGM8
    SolutionIndex: 247
    SolutionNameMin: Cijk_Alik_Bljk_SB_MT32x32x32_SE_EPS0_FL1_GRVW2_LPA2_LPB2_PGR0_PLR1_TT2_4_USFGRO1_VW2_WG16_8_1_WGM1
    SolutionIndex: 248
    SolutionNameMin: Cijk_Alik_Bljk_SB_MT32x32x32_SE_EPS0_FL1_GRVW4_LPA2_LPB0_PGR0_PLR1_TT2_4_USFGRO1_VW2_WG16_8_1_WGM8
    SolutionIndex: 249
    SolutionNameMin: Cijk_Alik_Bljk_SB_MT32x32x16_SE_EPS0_FL1_GRVW4_LPA0_LPB2_PGR0_PLR0_TT2_4_USFGRO1_VW2_WG16_8_1_WGM1
    SolutionIndex: 250
    SolutionNameMin: Cijk_Alik_Bljk_SB_MT32x32x16_SE_EPS0_FL1_GRVW4_LPA2_LPB2_PGR0_PLR0_TT2_4_USFGRO1_VW2_WG16_8_1_WGM8
    SolutionIndex: 251
    SolutionNameMin: Cijk_Alik_Bljk_SB_MT32x32x32_SE_EPS0_FL1_GRVW4_LPA0_LPB2_PGR0_PLR1_TT2_4_USFGRO1_VW2_WG16_8_1_WGM1
    SolutionIndex: 252
    SolutionNameMin: Cijk_Alik_Bljk_SB_MT32x32x16_SE_EPS0_FL1_GRVW4_LPA2_LPB2_PGR0_PLR1_TT2_4_USFGRO1_VW2_WG16_8_1_WGM1
    SolutionIndex: 253
    SolutionNameMin: Cijk_Alik_Bljk_SB_MT32x32x16_SE_EPS0_FL1_GRVW4_LPA2_LPB2_PGR0_PLR1_TT2_4_USFGRO1_VW2_WG16_8_1_WGM8
    SolutionIndex: 254
    SolutionNameMin: Cijk_Alik_Bljk_SB_MT32x32x32_SE_EPS0_FL1_GRVW4_LPA2_LPB2_PGR0_PLR1_TT2_4_USFGRO1_VW2_WG16_8_1_WGM1
    SolutionIndex: 255
    SolutionNameMin: Cijk_Alik_Bljk_SB_MT32x32x32_SE_EPS0_FL1_GRVW4_LPA2_LPB2_PGR0_PLR1_TT2_4_USFGRO1_VW2_WG16_8_1_WGM8
    SolutionIndex: 256
    SolutionNameMin: Cijk_Alik_Bljk_SB_MT64x64x16_SE_EPS0_FL1_GRVW4_LPA2_LPB2_PGR0_PLR1_TT4_8_USFGRO1_VW2_WG16_8_1_WGM8
    SolutionIndex: 257
    SolutionNameMin: Cijk_Alik_Bljk_SB_MT32x32x16_SE_EPS0_FL0_GRVW1_LPA2_LPB2_PGR0_PLR1_TT4_2_USFGRO1_VW2_WG8_16_1_WGM1
    SolutionIndex: 258
    SolutionNameMin: Cijk_Alik_Bljk_SB_MT32x32x32_SE_EPS0_FL0_GRVW2_LPA2_LPB2_PGR0_PLR1_TT4_2_USFGRO1_VW2_WG8_16_1_WGM1
    SolutionIndex: 259
    SolutionNameMin: Cijk_Alik_Bljk_SB_MT32x32x32_SE_EPS0_FL0_GRVW2_LPA2_LPB2_PGR0_PLR1_TT4_2_USFGRO1_VW2_WG8_16_1_WGM8
    SolutionIndex: 260
    SolutionNameMin: Cijk_Alik_Bljk_SB_MT32x32x16_SE_EPS0_FL0_GRVW4_LPA2_LPB0_PGR0_PLR1_TT4_2_USFGRO1_VW2_WG8_16_1_WGM1
    SolutionIndex: 261
    SolutionNameMin: Cijk_Alik_Bljk_SB_MT32x32x32_SE_EPS0_FL0_GRVW4_LPA2_LPB2_PGR0_PLR1_TT4_2_USFGRO1_VW2_WG8_16_1_WGM1
    SolutionIndex: 262
    SolutionNameMin: Cijk_Alik_Bljk_SB_MT32x32x32_SE_EPS0_FL0_GRVW4_LPA2_LPB2_PGR0_PLR1_TT4_2_USFGRO1_VW2_WG8_16_1_WGM8
    SolutionIndex: 263
    SolutionNameMin: Cijk_Alik_Bljk_SB_MT32x32x16_SE_EPS0_FL1_GRVW2_LPA2_LPB2_PGR0_PLR0_TT4_2_USFGRO1_VW2_WG8_16_1_WGM8
    SolutionIndex: 264
    SolutionNameMin: Cijk_Alik_Bljk_SB_MT32x32x8_SE_EPS1_FL1_GRVW2_LPA2_LPB2_PGR1_PLR1_TT4_2_USFGRO1_VW2_WG8_16_1_WGM8
    SolutionIndex: 265
    SolutionNameMin: Cijk_Alik_Bljk_SB_MT32x32x16_SE_EPS0_FL1_GRVW4_LPA2_LPB0_PGR0_PLR1_TT4_2_USFGRO1_VW2_WG8_16_1_WGM1
    SolutionIndex: 266
    SolutionNameMin: Cijk_Alik_Bljk_SB_MT32x32x16_SE_EPS0_FL1_GRVW4_LPA2_LPB0_PGR0_PLR1_TT4_2_USFGRO1_VW2_WG8_16_1_WGM8
    SolutionIndex: 267
    SolutionNameMin: Cijk_Alik_Bljk_SB_MT32x32x32_SE_EPS0_FL1_GRVW4_LPA0_LPB2_PGR0_PLR1_TT4_2_USFGRO1_VW2_WG8_16_1_WGM1
    SolutionIndex: 268
    SolutionNameMin: Cijk_Alik_Bljk_SB_MT32x32x16_SE_EPS0_FL1_GRVW4_LPA2_LPB2_PGR0_PLR1_TT4_2_USFGRO1_VW2_WG8_16_1_WGM1
    SolutionIndex: 269
    SolutionNameMin: Cijk_Alik_Bljk_SB_MT32x32x16_SE_EPS0_FL1_GRVW4_LPA2_LPB2_PGR0_PLR1_TT4_2_USFGRO1_VW2_WG8_16_1_WGM8
    SolutionIndex: 270
    SolutionNameMin: Cijk_Alik_Bljk_SB_MT32x32x32_SE_EPS0_FL1_GRVW4_LPA2_LPB2_PGR0_PLR1_TT4_2_USFGRO1_VW2_WG8_16_1_WGM1
    SolutionIndex: 271
    SolutionNameMin: Cijk_Alik_Bljk_SB_MT16x64x16_SE_EPS0_FL0_GRVW1_LPA2_LPB2_PGR0_PLR1_TT2_4_USFGRO1_VW2_WG8_16_1_WGM8
    SolutionIndex: 272
    SolutionNameMin: Cijk_Alik_Bljk_SB_MT16x64x16_SE_EPS0_FL1_GRVW1_LPA2_LPB2_PGR0_PLR1_TT2_4_USFGRO1_VW2_WG8_16_1_WGM8
    SolutionIndex: 273
    SolutionNameMin: Cijk_Alik_Bljk_SB_MT64x32x16_SE_EPS1_FL0_GRVW4_PGR1_PLR0_TT4_4_VW2_WGM8
    SolutionIndex: 274
    SolutionNameMin: Cijk_Alik_Bljk_SB_MT128x64x16_SE_EPS0_FL1_GRVW4_PGR0_PLR1_TT8_4_VW4_WGM8
    SolutionIndex: 275
    SolutionNameMin: Cijk_Alik_Bljk_SB_MT064x016x64_GRVW04_GSU16_SNLL0_TT04_04_VW04_WG16_04_04
    SolutionIndex: 276
    SolutionNameMin: Cijk_Alik_Bljk_SB_MT064x016x64_GRVW04_GSU16_SNLL0_TT04_04_VW04_WG16_04_04
    SolutionIndex: 277
    SolutionNameMin: Cijk_Alik_Bljk_SB_MT064x016x64_GRVW04_GSU32_SNLL0_TT04_04_VW04_WG16_04_04
    SolutionIndex: 278
    SolutionNameMin: Cijk_Alik_Bljk_SB_MT048x096x08_GRVW02_GSU02_SNLL0_TT04_06_VW02_WG12_16_01
    SolutionIndex: 279
    SolutionNameMin: Cijk_Alik_Bljk_SB_MT036x048x16_GRVW01_GSU08_SNLL0_TT03_03_VW01_WG12_16_01
    SolutionIndex: 280
    SolutionNameMin: Cijk_Alik_Bljk_SB_MT032x008x08_GRVW02_GSU01_SNLL0_TT02_02_VW02_WG16_04_01
    SolutionIndex: 281
    SolutionNameMin: Cijk_Alik_Bljk_SB_MT016x016x08_GRVW02_GSU01_SNLL0_TT02_02_VW02_WG08_08_01
    SolutionIndex: 282
    SolutionNameMin: Cijk_Alik_Bljk_SB_MT032x016x08_GRVW02_GSU01_SNLL0_TT04_02_VW02_WG08_08_01
    SolutionIndex: 283
    SolutionNameMin: Cijk_Alik_Bljk_SB_MT032x032x08_GRVW04_GSU01_SNLL0_TT04_04_VW04_WG08_08_01
    SolutionIndex: 284
    SolutionNameMin: Cijk_Alik_Bljk_SB_MT032x016x08_GRVW02_GSU01_SNLL0_TT02_02_VW02_WG16_08_01
    SolutionIndex: 285
    SolutionNameMin: Cijk_Alik_Bljk_SB_MT064x016x08_GRVW02_GSU01_SNLL0_TT04_02_VW02_WG16_08_01
    SolutionIndex: 286
    SolutionNameMin: Cijk_Alik_Bljk_SB_MT032x016x08_GRVW02_GSU01_SNLL0_TT04_02_VW02_WG08_08_01
    SolutionIndex: 287
    SolutionNameMin: Cijk_Alik_Bljk_SB_MT032x032x08_GRVW04_GSU01_SNLL0_TT04_04_VW04_WG08_08_01
    SolutionIndex: 288
    SolutionNameMin: Cijk_Alik_Bljk_SB_MT032x016x08_GRVW02_GSU01_SNLL0_TT02_02_VW02_WG16_08_01
    SolutionIndex: 289
    SolutionNameMin: Cijk_Alik_Bljk_SB_MT016x016x16_GRVW02_GSU01_SNLL0_TT02_02_VW02_WG08_08_01
    SolutionIndex: 290
    SolutionNameMin: Cijk_Alik_Bljk_SB_MT032x032x16_GRVW04_GSU01_SNLL0_TT04_04_VW04_WG08_08_01
    SolutionIndex: 291
    SolutionNameMin: Cijk_Alik_Bljk_SB_MT032x016x16_GRVW02_GSU01_SNLL0_TT02_02_VW02_WG16_08_01
    SolutionIndex: 292
    SolutionNameMin: Cijk_Alik_Bljk_SB_MT064x016x16_GRVW02_GSU01_SNLL0_TT04_02_VW02_WG16_08_01
    SolutionIndex: 293
    SolutionNameMin: Cijk_Alik_Bljk_SB_MT064x032x16_GRVW04_GSU01_SNLL0_TT04_04_VW04_WG16_08_01
    SolutionIndex: 294
    SolutionNameMin: Cijk_Alik_Bljk_SB_MT016x016x16_GRVW02_GSU01_SNLL0_TT02_02_VW02_WG08_08_01
    SolutionIndex: 295
    SolutionNameMin: Cijk_Alik_Bljk_SB_MT032x032x16_GRVW04_GSU01_SNLL0_TT04_04_VW04_WG08_08_01
    SolutionIndex: 296
    SolutionNameMin: Cijk_Alik_Bljk_SB_MT032x016x16_GRVW02_GSU01_SNLL0_TT02_02_VW02_WG16_08_01
    SolutionIndex: 297
    SolutionNameMin: Cijk_Alik_Bljk_SB_MT064x032x16_GRVW04_GSU01_SNLL0_TT04_04_VW04_WG16_08_01
    SolutionIndex: 298
    SolutionNameMin: Cijk_Alik_Bljk_SB_MT016x016x08_GRVW02_GSU08_SNLL0_TT02_02_VW02_WG08_08_02
    SolutionIndex: 299
    SolutionNameMin: Cijk_Alik_Bljk_SB_MT032x016x16_GRVW02_GSU02_SNLL0_TT04_02_VW02_WG08_08_02
    SolutionIndex: 300
    SolutionNameMin: Cijk_Alik_Bljk_SB_MT032x032x16_GRVW04_GSU02_SNLL0_TT04_04_VW04_WG08_08_02
    SolutionIndex: 301
    SolutionNameMin: Cijk_Alik_Bljk_SB_MT064x032x16_GRVW04_GSU02_SNLL0_TT08_04_VW04_WG08_08_02
    SolutionIndex: 302
    SolutionNameMin: Cijk_Alik_Bljk_SB_MT016x016x16_GRVW02_GSU02_SNLL0_TT02_02_VW02_WG08_08_04
    SolutionIndex: 303
    SolutionNameMin: Cijk_Alik_Bljk_SB_MT032x016x16_GRVW02_GSU02_SNLL0_TT04_02_VW02_WG08_08_04
    SolutionIndex: 304
    SolutionNameMin: Cijk_Alik_Bljk_SB_MT032x016x16_GRVW02_GSU02_SNLL0_TT02_02_VW02_WG16_08_02
    SolutionIndex: 305
    SolutionNameMin: Cijk_Alik_Bljk_SB_MT032x016x16_GRVW02_GSU02_SNLL0_TT04_02_VW02_WG08_08_02
    SolutionIndex: 306
    SolutionNameMin: Cijk_Alik_Bljk_SB_MT032x032x16_GRVW04_GSU02_SNLL0_TT04_04_VW04_WG08_08_02
    SolutionIndex: 307
    SolutionNameMin: Cijk_Alik_Bljk_SB_MT064x032x16_GRVW04_GSU02_SNLL0_TT08_04_VW04_WG08_08_02
    SolutionIndex: 308
    SolutionNameMin: Cijk_Alik_Bljk_SB_MT016x016x16_GRVW02_GSU02_SNLL0_TT02_02_VW02_WG08_08_04
    SolutionIndex: 309
    SolutionNameMin: Cijk_Alik_Bljk_SB_MT032x016x16_GRVW02_GSU02_SNLL0_TT04_02_VW02_WG08_08_04
    SolutionIndex: 310
    SolutionNameMin: Cijk_Alik_Bljk_SB_MT032x016x16_GRVW02_GSU02_SNLL0_TT02_02_VW02_WG16_08_02
    SolutionIndex: 311
    SolutionNameMin: Cijk_Alik_Bljk_SB_MT128x064x16_GRVW04_GSU02_SNLL0_TT08_08_VW04_WG16_08_02
    SolutionIndex: 312
    SolutionNameMin: Cijk_Alik_Bljk_SB_MT032x032x16_GRVW04_GSU04_SNLL0_TT04_04_VW04_WG08_08_02
    SolutionIndex: 313
    SolutionNameMin: Cijk_Alik_Bljk_SB_MT064x032x16_GRVW04_GSU04_SNLL0_TT08_04_VW04_WG08_08_02
    SolutionIndex: 314
    SolutionNameMin: Cijk_Alik_Bljk_SB_MT016x016x16_GRVW02_GSU04_SNLL0_TT02_02_VW02_WG08_08_04
    SolutionIndex: 315
    SolutionNameMin: Cijk_Alik_Bljk_SB_MT032x016x16_GRVW02_GSU04_SNLL0_TT04_02_VW02_WG08_08_04
    SolutionIndex: 316
    SolutionNameMin: Cijk_Alik_Bljk_SB_MT032x016x16_GRVW02_GSU04_SNLL0_TT02_02_VW02_WG16_08_02
    SolutionIndex: 317
    SolutionNameMin: Cijk_Alik_Bljk_SB_MT032x032x16_GRVW04_GSU04_SNLL0_TT04_04_VW04_WG08_08_02
    SolutionIndex: 318
    SolutionNameMin: Cijk_Alik_Bljk_SB_MT064x032x16_GRVW04_GSU04_SNLL0_TT08_04_VW04_WG08_08_02
    SolutionIndex: 319
    SolutionNameMin: Cijk_Alik_Bljk_SB_MT016x016x16_GRVW02_GSU04_SNLL0_TT02_02_VW02_WG08_08_04
    SolutionIndex: 320
    SolutionNameMin: Cijk_Alik_Bljk_SB_MT032x016x16_GRVW02_GSU04_SNLL0_TT04_02_VW02_WG08_08_04
    SolutionIndex: 321
    SolutionNameMin: Cijk_Alik_Bljk_SB_MT032x016x16_GRVW02_GSU04_SNLL0_TT02_02_VW02_WG16_08_02
    SolutionIndex: 322
    SolutionNameMin: Cijk_Alik_Bljk_SB_MT128x064x16_GRVW04_GSU04_SNLL0_TT08_08_VW04_WG16_08_02
    SolutionIndex: 323
    SolutionNameMin: Cijk_Alik_Bljk_SB_MT016x016x16_GRVW02_GSU08_SNLL0_TT02_02_VW02_WG08_08_04
    SolutionIndex: 324
    SolutionNameMin: Cijk_Alik_Bljk_SB_MT032x016x16_GRVW02_GSU08_SNLL0_TT04_02_VW02_WG08_08_04
    SolutionIndex: 325
    SolutionNameMin: Cijk_Alik_Bljk_SB_MT064x064x24_GRVW04_GSU02_SNLL0_TT08_08_VW04_WG08_08_02
    SolutionIndex: 326
    SolutionNameMin: Cijk_Alik_Bljk_SB_MT064x064x24_GRVW04_GSU02_SNLL0_TT08_08_VW04_WG08_08_02
    SolutionIndex: 327
    SolutionNameMin: Cijk_Alik_Bljk_SB_MT064x064x24_GRVW04_GSU04_SNLL0_TT08_08_VW04_WG08_08_02
    SolutionIndex: 328
    SolutionNameMin: Cijk_Alik_Bljk_SB_MT032x032x32_GRVW04_GSU02_SNLL0_TT04_04_VW04_WG08_08_04
    SolutionIndex: 329
    SolutionNameMin: Cijk_Alik_Bljk_SB_MT064x032x32_GRVW04_GSU02_SNLL0_TT08_04_VW04_WG08_08_04
    SolutionIndex: 330
    SolutionNameMin: Cijk_Alik_Bljk_SB_MT064x064x32_GRVW04_GSU02_SNLL0_TT08_08_VW04_WG08_08_04
    SolutionIndex: 331
    SolutionNameMin: Cijk_Alik_Bljk_SB_MT064x032x32_GRVW04_GSU02_SNLL0_TT04_04_VW04_WG16_08_02
    SolutionIndex: 332
    SolutionNameMin: Cijk_Alik_Bljk_SB_MT032x032x32_GRVW04_GSU02_SNLL0_TT04_04_VW04_WG08_08_04
    SolutionIndex: 333
    SolutionNameMin: Cijk_Alik_Bljk_SB_MT064x032x32_GRVW04_GSU02_SNLL0_TT08_04_VW04_WG08_08_04
    SolutionIndex: 334
    SolutionNameMin: Cijk_Alik_Bljk_SB_MT064x032x32_GRVW04_GSU02_SNLL0_TT04_04_VW04_WG16_08_02
    SolutionIndex: 335
    SolutionNameMin: Cijk_Alik_Bljk_SB_MT128x032x32_GRVW04_GSU02_SNLL0_TT08_04_VW04_WG16_08_02
    SolutionIndex: 336
    SolutionNameMin: Cijk_Alik_Bljk_SB_MT032x032x32_GRVW04_GSU04_SNLL0_TT04_04_VW04_WG08_08_04
    SolutionIndex: 337
    SolutionNameMin: Cijk_Alik_Bljk_SB_MT032x008x32_GRVW02_GSU04_SNLL0_TT02_02_VW02_WG16_04_04
    SolutionIndex: 338
    SolutionNameMin: Cijk_Alik_Bljk_SB_MT032x032x32_GRVW04_GSU04_SNLL0_TT04_04_VW04_WG08_08_02
    SolutionIndex: 339
    SolutionNameMin: Cijk_Alik_Bljk_SB_MT032x032x32_GRVW04_GSU04_SNLL0_TT04_04_VW04_WG08_08_04
    SolutionIndex: 340
    SolutionNameMin: Cijk_Alik_Bljk_SB_MT064x032x32_GRVW04_GSU04_SNLL0_TT04_04_VW04_WG16_08_02
    SolutionIndex: 341
    SolutionNameMin: Cijk_Alik_Bljk_SB_MT064x064x16_GRVW04_GSU01_SNLL0_TT04_04_VW04_WG16_16_01
    SolutionIndex: 342
    SolutionNameMin: Cijk_Alik_Bljk_SB_MT064x128x16_GRVW04_GSU01_SNLL0_TT04_08_VW04_WG16_16_01
    SolutionIndex: 343
    SolutionNameMin: Cijk_Alik_Bljk_SB_MT128x064x16_GRVW04_GSU01_SNLL0_TT08_04_VW04_WG16_16_01
    SolutionIndex: 344
    SolutionNameMin: Cijk_Alik_Bljk_SB_MT064x064x16_GRVW04_GSU01_SNLL0_TT04_04_VW04_WG16_16_01
    SolutionIndex: 345
    SolutionNameMin: Cijk_Alik_Bljk_SB_MT064x128x16_GRVW04_GSU01_SNLL0_TT04_08_VW04_WG16_16_01
    SolutionIndex: 346
    SolutionNameMin: Cijk_Alik_Bljk_SB_MT128x064x16_GRVW04_GSU01_SNLL0_TT08_04_VW04_WG16_16_01
    SolutionIndex: 347
    SolutionNameMin: Cijk_Alik_Bljk_SB_MT128x128x08_GRVW04_GSU01_SNLL1_TT08_08_VW04_WG16_16_01
    SolutionIndex: 348
    SolutionNameMin: Cijk_Alik_Bljk_SB_MT128x128x08_GRVW04_GSU01_SNLL1_TT08_08_VW04_WG16_16_01
    SolutionIndex: 349
    SolutionNameMin: Cijk_Alik_Bljk_SB_MT064x064x16_GRVW04_GSU01_SNLL1_TT04_04_VW04_WG16_16_01
    SolutionIndex: 350
    SolutionNameMin: Cijk_Alik_Bljk_SB_MT064x128x16_GRVW04_GSU01_SNLL1_TT04_08_VW04_WG16_16_01
    SolutionIndex: 351
    SolutionNameMin: Cijk_Alik_Bljk_SB_MT096x128x16_GRVW02_GSU01_SNLL1_TT06_08_VW02_WG16_16_01
    SolutionIndex: 352
    SolutionNameMin: Cijk_Alik_Bljk_SB_MT128x064x16_GRVW04_GSU01_SNLL1_TT08_04_VW04_WG16_16_01
    SolutionIndex: 353
    SolutionNameMin: Cijk_Alik_Bljk_SB_MT128x096x16_GRVW02_GSU01_SNLL1_TT08_06_VW02_WG16_16_01
    SolutionIndex: 354
    SolutionNameMin: Cijk_Alik_Bljk_SB_MT128x128x16_GRVW04_GSU01_SNLL1_TT08_08_VW04_WG16_16_01
    SolutionIndex: 355
    SolutionNameMin: Cijk_Alik_Bljk_SB_MT064x064x16_GRVW04_GSU01_SNLL1_TT04_04_VW04_WG16_16_01
    SolutionIndex: 356
    SolutionNameMin: Cijk_Alik_Bljk_SB_MT064x128x16_GRVW04_GSU01_SNLL1_TT04_08_VW04_WG16_16_01
    SolutionIndex: 357
    SolutionNameMin: Cijk_Alik_Bljk_SB_MT096x128x16_GRVW02_GSU01_SNLL1_TT06_08_VW02_WG16_16_01
    SolutionIndex: 358
    SolutionNameMin: Cijk_Alik_Bljk_SB_MT128x064x16_GRVW04_GSU01_SNLL1_TT08_04_VW04_WG16_16_01
    SolutionIndex: 359
    SolutionNameMin: Cijk_Alik_Bljk_SB_MT128x096x16_GRVW02_GSU01_SNLL1_TT08_06_VW02_WG16_16_01
    SolutionIndex: 360
    SolutionNameMin: Cijk_Alik_Bljk_SB_MT128x128x16_GRVW04_GSU01_SNLL1_TT08_08_VW04_WG16_16_01
    SolutionIndex: 361
    SolutionNameMin: Cijk_Alik_Bljk_SB_MT064x064x32_GRVW04_GSU01_SNLL1_TT04_04_VW04_WG16_16_01
    SolutionIndex: 362
    SolutionNameMin: Cijk_Alik_Bljk_SB_MT064x064x32_GRVW04_GSU01_SNLL1_TT04_04_VW04_WG16_16_01
    SolutionIndex: 363
    SolutionNameMin: Cijk_Alik_Bljk_SB_MT128x064x32_GRVW04_GSU01_SNLL1_TT08_04_VW04_WG16_16_01
    SolutionIndex: 364
    SolutionNameMin: Cijk_Alik_Bljk_SB_MT128x128x32_GRVW04_GSU01_SNLL1_TT08_08_VW04_WG16_16_01
    SolutionIndex: 365
    SolutionNameMin: Cijk_Alik_Bljk_SB_MT016x016x04_GRVW02_GSU01_SNLL0_TT02_02_VW02_WG08_08_01
    SolutionIndex: 366
    SolutionNameMin: Cijk_Alik_Bljk_SB_MT032x032x02_GRVW04_GSU01_SNLL0_TT04_04_VW04_WG08_08_01
    SolutionIndex: 367
    SolutionNameMin: Cijk_Alik_Bljk_SB_MT016x016x16_GRVW02_GSU01_SNLL1_TT02_02_VW02_WG08_08_04
    SolutionIndex: 368
    SolutionNameMin: Cijk_Alik_Bljk_SB_MT008x008x08_GRVW02_GSU04_SNLL0_TT02_02_VW02_WG04_04_04
    SolutionIndex: 369
    SolutionNameMin: Cijk_Alik_Bljk_SB_MT008x008x08_GRVW02_GSU08_SNLL0_TT02_02_VW02_WG04_04_04
    SolutionIndex: 370
    SolutionNameMin: Cijk_Alik_Bljk_SB_MT008x008x08_GRVW02_GSU16_SNLL0_TT02_02_VW02_WG04_04_04
    SolutionIndex: 371
    SolutionNameMin: Cijk_Alik_Bljk_SB_MT016x016x16_GRVW02_GSU16_SNLL0_TT02_02_VW02_WG08_08_04
    SolutionIndex: 372
    SolutionNameMin: Cijk_Alik_Bljk_SB_MT064x032x16_GRVW01_GSU05_LPA01_LPB01_PGR0_PLR1_TT04_04_USFGRO01_VW01_WG16_08_01_WGM01
    SolutionIndex: 373
    SolutionNameMin: Cijk_Alik_Bljk_SB_MT032x016x32_GRVW01_GSU05_LPA01_LPB01_PGR1_PLR1_TT02_02_USFGRO01_VW01_WG16_08_01_WGM01
    SolutionIndex: 374
    SolutionNameMin: Cijk_Alik_Bljk_SB_MT032x032x32_GRVW01_GSU05_LPA01_LPB01_PGR0_PLR1_TT02_02_USFGRO01_VW01_WG16_16_01_WGM01
    SolutionIndex: 375
    SolutionNameMin: Cijk_Alik_Bljk_SB_MT032x016x32_GRVW01_GSU05_LPA02_LPB02_PGR1_PLR1_TT02_02_USFGRO01_VW02_WG16_08_01_WGM01
    SolutionIndex: 376
    SolutionNameMin: Cijk_Alik_Bljk_SB_MT032x032x32_GRVW01_GSU05_LPA02_LPB02_PGR1_PLR1_TT02_02_USFGRO01_VW02_WG16_16_01_WGM01
    SolutionIndex: 377
    SolutionNameMin: Cijk_Alik_Bljk_SB_MT128x032x16_GRVW01_GSU01_LPA04_LPB04_PGR0_PLR1_TT04_04_USFGRO01_VW04_WG32_08_01_WGM01
    SolutionIndex: 378
    SolutionNameMin: Cijk_Alik_Bljk_SB_MT128x064x16_GRVW01_GSU01_LPA04_LPB04_PGR0_PLR1_TT04_08_USFGRO01_VW04_WG32_08_01_WGM01
    SolutionIndex: 379
    SolutionNameMin: Cijk_Alik_Bljk_SB_MT064x032x16_GRVW01_GSU01_LPA04_LPB04_PGR1_PLR1_TT04_04_USFGRO01_VW04_WG16_08_01_WGM08
    SolutionIndex: 380
    SolutionNameMin: Cijk_Alik_Bljk_SB_MT064x032x16_GRVW04_GSU01_LPA04_LPB04_PGR1_PLR1_TT04_04_USFGRO0_VW04_WG16_08_01_WGM01
    SolutionIndex: 381
    SolutionNameMin: Cijk_Alik_Bljk_SB_MT64x64x8_SE_EPS0_FL0_GRVW2_LPA0_LPB0_PGR0_PLR0_TT4_4_USFGRO1_VW2_WG16_16_1_WGM8
    SolutionIndex: 382
    SolutionNameMin: Cijk_Alik_Bljk_SB_MT64x64x16_SE_EPS0_FL0_GRVW4_LPA0_LPB0_PGR0_PLR0_TT4_4_USFGRO1_VW2_WG16_16_1_WGM8
    SolutionIndex: 383
    SolutionNameMin: Cijk_Alik_Bljk_SB_MT64x64x16_SE_EPS1_FL0_GRVW4_LPA0_LPB0_PGR1_PLR1_TT4_4_USFGRO1_VW2_WG16_16_1_WGM1
    SolutionIndex: 384
    SolutionNameMin: Cijk_Alik_Bljk_SB_MT64x64x16_SE_EPS1_FL0_GRVW4_LPA0_LPB0_PGR1_PLR1_TT4_4_USFGRO1_VW2_WG16_16_1_WGM8
    SolutionIndex: 385
    SolutionNameMin: Cijk_Alik_Bljk_SB_MT64x64x32_SE_EPS1_FL0_GRVW4_LPA0_LPB0_PGR1_PLR1_TT4_4_USFGRO1_VW2_WG16_16_1_WGM1
    SolutionIndex: 386
    SolutionNameMin: Cijk_Alik_Bljk_SB_MT64x64x32_SE_EPS0_FL0_GRVW4_LPA0_LPB0_PGR0_PLR1_TT4_4_USFGRO1_VW2_WG16_16_1_WGM8
    SolutionIndex: 387
    SolutionNameMin: Cijk_Alik_Bljk_SB_MT64x64x16_SE_EPS1_FL0_GRVW4_LPA0_LPB0_PGR1_PLR0_TT4_4_USFGRO1_VW4_WG16_16_1_WGM1
    SolutionIndex: 388
    SolutionNameMin: Cijk_Alik_Bljk_SB_MT64x64x16_SE_EPS1_FL0_GRVW4_LPA0_LPB0_PGR1_PLR1_TT4_4_USFGRO1_VW4_WG16_16_1_WGM1
    SolutionIndex: 389
    SolutionNameMin: Cijk_Alik_Bljk_SB_MT64x64x16_SE_EPS1_FL0_GRVW4_LPA0_LPB0_PGR1_PLR1_TT4_4_USFGRO1_VW4_WG16_16_1_WGM8
    SolutionIndex: 390
    SolutionNameMin: Cijk_Alik_Bljk_SB_MT64x64x32_SE_EPS1_FL0_GRVW4_LPA0_LPB0_PGR1_PLR1_TT4_4_USFGRO1_VW4_WG16_16_1_WGM1
    SolutionIndex: 391
    SolutionNameMin: Cijk_Alik_Bljk_SB_MT64x64x32_SE_EPS0_FL0_GRVW4_LPA0_LPB0_PGR0_PLR1_TT4_4_USFGRO1_VW4_WG16_16_1_WGM8
    SolutionIndex: 392
    SolutionNameMin: Cijk_Alik_Bljk_SB_MT64x64x32_SE_EPS1_FL0_GRVW4_LPA0_LPB0_PGR1_PLR1_TT4_4_USFGRO1_VW4_WG16_16_1_WGM8
    SolutionIndex: 393
    SolutionNameMin: Cijk_Alik_Bljk_SB_MT64x64x16_SE_EPS1_FL1_GRVW2_LPA0_LPB0_PGR1_PLR1_TT4_4_USFGRO1_VW2_WG16_16_1_WGM8
    SolutionIndex: 394
    SolutionNameMin: Cijk_Alik_Bljk_SB_MT64x64x16_SE_EPS1_FL1_GRVW2_LPA0_LPB0_PGR1_PLR1_TT4_4_USFGRO1_VW4_WG16_16_1_WGM1
    SolutionIndex: 395
    SolutionNameMin: Cijk_Alik_Bljk_SB_MT64x64x16_SE_EPS1_FL1_GRVW4_LPA0_LPB0_PGR1_PLR1_TT4_4_USFGRO1_VW2_WG16_16_1_WGM1
    SolutionIndex: 396
    SolutionNameMin: Cijk_Alik_Bljk_SB_MT64x64x16_SE_EPS1_FL1_GRVW4_LPA0_LPB0_PGR1_PLR1_TT4_4_USFGRO1_VW2_WG16_16_1_WGM8
    SolutionIndex: 397
    SolutionNameMin: Cijk_Alik_Bljk_SB_MT64x64x32_SE_EPS1_FL1_GRVW4_LPA0_LPB0_PGR1_PLR1_TT4_4_USFGRO1_VW2_WG16_16_1_WGM1
    SolutionIndex: 398
    SolutionNameMin: Cijk_Alik_Bljk_SB_MT64x64x16_SE_EPS1_FL1_GRVW4_LPA0_LPB0_PGR1_PLR0_TT4_4_USFGRO1_VW4_WG16_16_1_WGM1
    SolutionIndex: 399
    SolutionNameMin: Cijk_Alik_Bljk_SB_MT64x64x16_SE_EPS1_FL1_GRVW4_LPA0_LPB0_PGR1_PLR1_TT4_4_USFGRO1_VW4_WG16_16_1_WGM1
    SolutionIndex: 400
    SolutionNameMin: Cijk_Alik_Bljk_SB_MT64x64x16_SE_EPS1_FL1_GRVW4_LPA0_LPB0_PGR1_PLR1_TT4_4_USFGRO1_VW4_WG16_16_1_WGM8
    SolutionIndex: 401
    SolutionNameMin: Cijk_Alik_Bljk_SB_MT64x64x32_SE_EPS1_FL1_GRVW4_LPA0_LPB0_PGR1_PLR1_TT4_4_USFGRO1_VW4_WG16_16_1_WGM1
    SolutionIndex: 402
    SolutionNameMin: Cijk_Alik_Bljk_SB_MT64x64x32_SE_EPS1_FL1_GRVW4_LPA0_LPB0_PGR1_PLR1_TT4_4_USFGRO1_VW4_WG16_16_1_WGM8
    SolutionIndex: 403
    SolutionNameMin: Cijk_Alik_Bljk_SB_MT96x64x32_SE_EPS0_FL0_GRVW2_LPA0_LPB0_PGR0_PLR1_TT6_4_USFGRO1_VW2_WG16_16_1_WGM8
    SolutionIndex: 404
    SolutionNameMin: Cijk_Alik_Bljk_SB_MT96x64x8_SE_EPS1_FL1_GRVW1_LPA0_LPB0_PGR1_PLR0_TT6_4_USFGRO1_VW2_WG16_16_1_WGM1
    SolutionIndex: 405
    SolutionNameMin: Cijk_Alik_Bljk_SB_MT64x96x8_SE_EPS1_FL0_GRVW1_LPA0_LPB0_PGR1_PLR0_TT4_6_USFGRO1_VW2_WG16_16_1_WGM1
    SolutionIndex: 406
    SolutionNameMin: Cijk_Alik_Bljk_SB_MT64x96x16_SE_EPS0_FL0_GRVW2_LPA0_LPB0_PGR0_PLR0_TT4_6_USFGRO1_VW2_WG16_16_1_WGM8
    SolutionIndex: 407
    SolutionNameMin: Cijk_Alik_Bljk_SB_MT64x96x16_SE_EPS1_FL0_GRVW2_LPA0_LPB0_PGR1_PLR1_TT4_6_USFGRO1_VW2_WG16_16_1_WGM1
    SolutionIndex: 408
    SolutionNameMin: Cijk_Alik_Bljk_SB_MT64x96x32_SE_EPS0_FL0_GRVW4_LPA0_LPB0_PGR0_PLR1_TT4_6_USFGRO1_VW2_WG16_16_1_WGM8
    SolutionIndex: 409
    SolutionNameMin: Cijk_Alik_Bljk_SB_MT64x96x8_SE_EPS1_FL1_GRVW1_LPA0_LPB0_PGR1_PLR1_TT4_6_USFGRO1_VW2_WG16_16_1_WGM1
    SolutionIndex: 410
    SolutionNameMin: Cijk_Alik_Bljk_SB_MT64x96x8_SE_EPS1_FL1_GRVW4_LPA0_LPB0_PGR1_PLR1_TT4_6_USFGRO1_VW2_WG16_16_1_WGM1
    SolutionIndex: 411
    SolutionNameMin: Cijk_Alik_Bljk_SB_MT64x128x8_SE_EPS1_FL0_GRVW1_LPA0_LPB0_PGR1_PLR0_TT4_8_USFGRO1_VW4_WG16_16_1_WGM1
    SolutionIndex: 412
    SolutionNameMin: Cijk_Alik_Bljk_SB_MT64x128x8_SE_EPS0_FL0_GRVW2_LPA0_LPB0_PGR0_PLR0_TT4_8_USFGRO1_VW4_WG16_16_1_WGM1
    SolutionIndex: 413
    SolutionNameMin: Cijk_Alik_Bljk_SB_MT64x128x8_SE_EPS1_FL0_GRVW4_LPA0_LPB0_PGR1_PLR0_TT4_8_USFGRO1_VW2_WG16_16_1_WGM8
    SolutionIndex: 414
    SolutionNameMin: Cijk_Alik_Bljk_SB_MT64x128x16_SE_EPS1_FL0_GRVW4_LPA0_LPB0_PGR1_PLR1_TT4_8_USFGRO1_VW2_WG16_16_1_WGM1
    SolutionIndex: 415
    SolutionNameMin: Cijk_Alik_Bljk_SB_MT64x128x16_SE_EPS1_FL0_GRVW4_LPA0_LPB0_PGR1_PLR0_TT4_8_USFGRO1_VW4_WG16_16_1_WGM1
    SolutionIndex: 416
    SolutionNameMin: Cijk_Alik_Bljk_SB_MT64x128x16_SE_EPS1_FL0_GRVW4_LPA0_LPB0_PGR1_PLR1_TT4_8_USFGRO1_VW4_WG16_16_1_WGM1
    SolutionIndex: 417
    SolutionNameMin: Cijk_Alik_Bljk_SB_MT64x128x8_SE_EPS1_FL1_GRVW1_LPA0_LPB0_PGR1_PLR0_TT4_8_USFGRO1_VW4_WG16_16_1_WGM1
    SolutionIndex: 418
    SolutionNameMin: Cijk_Alik_Bljk_SB_MT64x128x8_SE_EPS1_FL1_GRVW4_LPA0_LPB0_PGR1_PLR0_TT4_8_USFGRO1_VW2_WG16_16_1_WGM8
    SolutionIndex: 419
    SolutionNameMin: Cijk_Alik_Bljk_SB_MT64x128x8_SE_EPS1_FL1_GRVW4_LPA0_LPB0_PGR1_PLR1_TT4_8_USFGRO1_VW2_WG16_16_1_WGM8
    SolutionIndex: 420
    SolutionNameMin: Cijk_Alik_Bljk_SB_MT64x128x16_SE_EPS1_FL1_GRVW4_LPA0_LPB0_PGR1_PLR1_TT4_8_USFGRO1_VW2_WG16_16_1_WGM1
    SolutionIndex: 421
    SolutionNameMin: Cijk_Alik_Bljk_SB_MT64x128x8_SE_EPS1_FL1_GRVW4_LPA0_LPB0_PGR1_PLR0_TT4_8_USFGRO1_VW4_WG16_16_1_WGM8
    SolutionIndex: 422
    SolutionNameMin: Cijk_Alik_Bljk_SB_MT64x128x16_SE_EPS1_FL1_GRVW4_LPA0_LPB0_PGR1_PLR1_TT4_8_USFGRO1_VW4_WG16_16_1_WGM1
    SolutionIndex: 423
    SolutionNameMin: Cijk_Alik_Bljk_SB_MT128x64x16_SE_EPS0_FL0_GRVW1_LPA0_LPB0_PGR0_PLR0_TT8_4_USFGRO1_VW2_WG16_16_1_WGM8
    SolutionIndex: 424
    SolutionNameMin: Cijk_Alik_Bljk_SB_MT128x64x8_SE_EPS1_FL0_GRVW2_LPA0_LPB0_PGR1_PLR0_TT8_4_USFGRO1_VW2_WG16_16_1_WGM8
    SolutionIndex: 425
    SolutionNameMin: Cijk_Alik_Bljk_SB_MT128x64x8_SE_EPS1_FL0_GRVW2_LPA0_LPB0_PGR1_PLR1_TT8_4_USFGRO1_VW2_WG16_16_1_WGM8
    SolutionIndex: 426
    SolutionNameMin: Cijk_Alik_Bljk_SB_MT128x64x16_SE_EPS1_FL0_GRVW2_LPA0_LPB0_PGR1_PLR1_TT8_4_USFGRO1_VW4_WG16_16_1_WGM8
    SolutionIndex: 427
    SolutionNameMin: Cijk_Alik_Bljk_SB_MT128x64x16_SE_EPS1_FL0_GRVW4_LPA0_LPB0_PGR1_PLR1_TT8_4_USFGRO1_VW2_WG16_16_1_WGM1
    SolutionIndex: 428
    SolutionNameMin: Cijk_Alik_Bljk_SB_MT128x64x16_SE_EPS1_FL0_GRVW4_LPA0_LPB0_PGR1_PLR1_TT8_4_USFGRO1_VW2_WG16_16_1_WGM8
    SolutionIndex: 429
    SolutionNameMin: Cijk_Alik_Bljk_SB_MT128x64x16_SE_EPS0_FL0_GRVW4_LPA0_LPB0_PGR0_PLR1_TT8_4_USFGRO1_VW4_WG16_16_1_WGM1
    SolutionIndex: 430
    SolutionNameMin: Cijk_Alik_Bljk_SB_MT128x64x16_SE_EPS1_FL0_GRVW4_LPA0_LPB0_PGR1_PLR1_TT8_4_USFGRO1_VW4_WG16_16_1_WGM1
    SolutionIndex: 431
    SolutionNameMin: Cijk_Alik_Bljk_SB_MT128x64x16_SE_EPS1_FL0_GRVW4_LPA0_LPB0_PGR1_PLR1_TT8_4_USFGRO1_VW4_WG16_16_1_WGM8
    SolutionIndex: 432
    SolutionNameMin: Cijk_Alik_Bljk_SB_MT128x64x8_SE_EPS1_FL1_GRVW2_LPA0_LPB0_PGR1_PLR0_TT8_4_USFGRO1_VW2_WG16_16_1_WGM8
    SolutionIndex: 433
    SolutionNameMin: Cijk_Alik_Bljk_SB_MT128x64x16_SE_EPS1_FL1_GRVW2_LPA0_LPB0_PGR1_PLR1_TT8_4_USFGRO1_VW4_WG16_16_1_WGM8
    SolutionIndex: 434
    SolutionNameMin: Cijk_Alik_Bljk_SB_MT128x64x8_SE_EPS1_FL1_GRVW4_LPA0_LPB0_PGR1_PLR0_TT8_4_USFGRO1_VW2_WG16_16_1_WGM8
    SolutionIndex: 435
    SolutionNameMin: Cijk_Alik_Bljk_SB_MT128x64x16_SE_EPS1_FL1_GRVW4_LPA0_LPB0_PGR1_PLR1_TT8_4_USFGRO1_VW2_WG16_16_1_WGM8
    SolutionIndex: 436
    SolutionNameMin: Cijk_Alik_Bljk_SB_MT128x64x8_SE_EPS1_FL1_GRVW4_LPA0_LPB0_PGR1_PLR0_TT8_4_USFGRO1_VW4_WG16_16_1_WGM8
    SolutionIndex: 437
    SolutionNameMin: Cijk_Alik_Bljk_SB_MT128x64x16_SE_EPS0_FL1_GRVW4_LPA0_LPB0_PGR0_PLR1_TT8_4_USFGRO1_VW4_WG16_16_1_WGM1
    SolutionIndex: 438
    SolutionNameMin: Cijk_Alik_Bljk_SB_MT128x64x16_SE_EPS1_FL1_GRVW4_LPA0_LPB0_PGR1_PLR1_TT8_4_USFGRO1_VW4_WG16_16_1_WGM1
    SolutionIndex: 439
    SolutionNameMin: Cijk_Alik_Bljk_SB_MT128x64x16_SE_EPS0_FL1_GRVW4_LPA0_LPB0_PGR0_PLR1_TT8_4_USFGRO1_VW4_WG16_16_1_WGM8
    SolutionIndex: 440
    SolutionNameMin: Cijk_Alik_Bljk_SB_MT128x64x16_SE_EPS1_FL1_GRVW4_LPA0_LPB0_PGR1_PLR1_TT8_4_USFGRO1_VW4_WG16_16_1_WGM8
    SolutionIndex: 441
    SolutionNameMin: Cijk_Alik_Bljk_SB_MT128x128x16_SE_EPS1_FL0_GRVW2_LPA0_LPB0_PGR1_PLR0_TT8_8_USFGRO1_VW2_WG16_16_1_WGM1
    SolutionIndex: 442
    SolutionNameMin: Cijk_Alik_Bljk_SB_MT128x128x8_SE_EPS1_FL0_GRVW2_LPA0_LPB0_PGR1_PLR1_TT8_8_USFGRO1_VW2_WG16_16_1_WGM1
    SolutionIndex: 443
    SolutionNameMin: Cijk_Alik_Bljk_SB_MT128x128x8_SE_EPS1_FL0_GRVW2_LPA0_LPB0_PGR1_PLR1_TT8_8_USFGRO1_VW2_WG16_16_1_WGM8
    SolutionIndex: 444
    SolutionNameMin: Cijk_Alik_Bljk_SB_MT128x128x16_SE_EPS1_FL0_GRVW2_LPA0_LPB0_PGR1_PLR1_TT8_8_USFGRO1_VW2_WG16_16_1_WGM1
    SolutionIndex: 445
    SolutionNameMin: Cijk_Alik_Bljk_SB_MT128x128x16_SE_EPS1_FL0_GRVW2_LPA0_LPB0_PGR1_PLR1_TT8_8_USFGRO1_VW2_WG16_16_1_WGM8
    SolutionIndex: 446
    SolutionNameMin: Cijk_Alik_Bljk_SB_MT128x128x8_SE_EPS1_FL0_GRVW2_LPA0_LPB0_PGR1_PLR0_TT8_8_USFGRO1_VW4_WG16_16_1_WGM1
    SolutionIndex: 447
    SolutionNameMin: Cijk_Alik_Bljk_SB_MT128x128x16_SE_EPS1_FL0_GRVW2_LPA0_LPB0_PGR1_PLR0_TT8_8_USFGRO1_VW4_WG16_16_1_WGM1
    SolutionIndex: 448
    SolutionNameMin: Cijk_Alik_Bljk_SB_MT128x128x16_SE_EPS1_FL0_GRVW2_LPA0_LPB0_PGR1_PLR0_TT8_8_USFGRO1_VW4_WG16_16_1_WGM8
    SolutionIndex: 449
    SolutionNameMin: Cijk_Alik_Bljk_SB_MT128x128x8_SE_EPS1_FL0_GRVW2_LPA0_LPB0_PGR1_PLR1_TT8_8_USFGRO1_VW4_WG16_16_1_WGM1
    SolutionIndex: 450
    SolutionNameMin: Cijk_Alik_Bljk_SB_MT128x128x8_SE_EPS1_FL0_GRVW4_LPA0_LPB0_PGR1_PLR0_TT8_8_USFGRO1_VW2_WG16_16_1_WGM1
    SolutionIndex: 451
    SolutionNameMin: Cijk_Alik_Bljk_SB_MT128x128x16_SE_EPS1_FL0_GRVW4_LPA0_LPB0_PGR1_PLR0_TT8_8_USFGRO1_VW2_WG16_16_1_WGM1
    SolutionIndex: 452
    SolutionNameMin: Cijk_Alik_Bljk_SB_MT128x128x8_SE_EPS1_FL0_GRVW4_LPA0_LPB0_PGR1_PLR1_TT8_8_USFGRO1_VW2_WG16_16_1_WGM1
    SolutionIndex: 453
    SolutionNameMin: Cijk_Alik_Bljk_SB_MT128x128x16_SE_EPS1_FL0_GRVW4_LPA0_LPB0_PGR1_PLR1_TT8_8_USFGRO1_VW2_WG16_16_1_WGM1
    SolutionIndex: 454
    SolutionNameMin: Cijk_Alik_Bljk_SB_MT128x128x16_SE_EPS1_FL0_GRVW4_LPA0_LPB0_PGR1_PLR1_TT8_8_USFGRO1_VW2_WG16_16_1_WGM8
    SolutionIndex: 455
    SolutionNameMin: Cijk_Alik_Bljk_SB_MT128x128x8_SE_EPS1_FL0_GRVW4_LPA0_LPB0_PGR1_PLR0_TT8_8_USFGRO1_VW4_WG16_16_1_WGM1
    SolutionIndex: 456
    SolutionNameMin: Cijk_Alik_Bljk_SB_MT128x128x16_SE_EPS1_FL0_GRVW4_LPA0_LPB0_PGR1_PLR0_TT8_8_USFGRO1_VW4_WG16_16_1_WGM1
    SolutionIndex: 457
    SolutionNameMin: Cijk_Alik_Bljk_SB_MT128x128x8_SE_EPS1_FL0_GRVW4_LPA0_LPB0_PGR1_PLR1_TT8_8_USFGRO1_VW4_WG16_16_1_WGM1
    SolutionIndex: 458
    SolutionNameMin: Cijk_Alik_Bljk_SB_MT128x128x16_SE_EPS1_FL0_GRVW4_LPA0_LPB0_PGR1_PLR1_TT8_8_USFGRO1_VW4_WG16_16_1_WGM1
    SolutionIndex: 459
    SolutionNameMin: Cijk_Alik_Bljk_SB_MT128x128x8_SE_EPS1_FL1_GRVW1_LPA0_LPB0_PGR1_PLR1_TT8_8_USFGRO1_VW4_WG16_16_1_WGM1
    SolutionIndex: 460
    SolutionNameMin: Cijk_Alik_Bljk_SB_MT128x128x8_SE_EPS1_FL1_GRVW2_LPA0_LPB0_PGR1_PLR0_TT8_8_USFGRO1_VW2_WG16_16_1_WGM1
    SolutionIndex: 461
    SolutionNameMin: Cijk_Alik_Bljk_SB_MT128x128x16_SE_EPS1_FL1_GRVW2_LPA0_LPB0_PGR1_PLR0_TT8_8_USFGRO1_VW2_WG16_16_1_WGM1
    SolutionIndex: 462
    SolutionNameMin: Cijk_Alik_Bljk_SB_MT128x128x8_SE_EPS1_FL1_GRVW2_LPA0_LPB0_PGR1_PLR1_TT8_8_USFGRO1_VW2_WG16_16_1_WGM1
    SolutionIndex: 463
    SolutionNameMin: Cijk_Alik_Bljk_SB_MT128x128x8_SE_EPS1_FL1_GRVW2_LPA0_LPB0_PGR1_PLR1_TT8_8_USFGRO1_VW2_WG16_16_1_WGM8
    SolutionIndex: 464
    SolutionNameMin: Cijk_Alik_Bljk_SB_MT128x128x16_SE_EPS1_FL1_GRVW2_LPA0_LPB0_PGR1_PLR1_TT8_8_USFGRO1_VW2_WG16_16_1_WGM1
    SolutionIndex: 465
    SolutionNameMin: Cijk_Alik_Bljk_SB_MT128x128x8_SE_EPS1_FL1_GRVW2_LPA0_LPB0_PGR1_PLR0_TT8_8_USFGRO1_VW4_WG16_16_1_WGM1
    SolutionIndex: 466
    SolutionNameMin: Cijk_Alik_Bljk_SB_MT128x128x16_SE_EPS1_FL1_GRVW2_LPA0_LPB0_PGR1_PLR0_TT8_8_USFGRO1_VW4_WG16_16_1_WGM1
    SolutionIndex: 467
    SolutionNameMin: Cijk_Alik_Bljk_SB_MT128x128x16_SE_EPS1_FL1_GRVW2_LPA0_LPB0_PGR1_PLR0_TT8_8_USFGRO1_VW4_WG16_16_1_WGM8
    SolutionIndex: 468
    SolutionNameMin: Cijk_Alik_Bljk_SB_MT128x128x8_SE_EPS1_FL1_GRVW2_LPA0_LPB0_PGR1_PLR1_TT8_8_USFGRO1_VW4_WG16_16_1_WGM1
    SolutionIndex: 469
    SolutionNameMin: Cijk_Alik_Bljk_SB_MT128x128x16_SE_EPS1_FL1_GRVW2_LPA0_LPB0_PGR1_PLR1_TT8_8_USFGRO1_VW4_WG16_16_1_WGM1
    SolutionIndex: 470
    SolutionNameMin: Cijk_Alik_Bljk_SB_MT128x128x8_SE_EPS1_FL1_GRVW4_LPA0_LPB0_PGR1_PLR0_TT8_8_USFGRO1_VW2_WG16_16_1_WGM1
    SolutionIndex: 471
    SolutionNameMin: Cijk_Alik_Bljk_SB_MT128x128x8_SE_EPS1_FL1_GRVW4_LPA0_LPB0_PGR1_PLR0_TT8_8_USFGRO1_VW2_WG16_16_1_WGM8
    SolutionIndex: 472
    SolutionNameMin: Cijk_Alik_Bljk_SB_MT128x128x16_SE_EPS1_FL1_GRVW4_LPA0_LPB0_PGR1_PLR0_TT8_8_USFGRO1_VW2_WG16_16_1_WGM1
    SolutionIndex: 473
    SolutionNameMin: Cijk_Alik_Bljk_SB_MT128x128x8_SE_EPS1_FL1_GRVW4_LPA0_LPB0_PGR1_PLR1_TT8_8_USFGRO1_VW2_WG16_16_1_WGM1
    SolutionIndex: 474
    SolutionNameMin: Cijk_Alik_Bljk_SB_MT128x128x16_SE_EPS1_FL1_GRVW4_LPA0_LPB0_PGR1_PLR1_TT8_8_USFGRO1_VW2_WG16_16_1_WGM1
    SolutionIndex: 475
    SolutionNameMin: Cijk_Alik_Bljk_SB_MT128x128x16_SE_EPS1_FL1_GRVW4_LPA0_LPB0_PGR1_PLR1_TT8_8_USFGRO1_VW2_WG16_16_1_WGM8
    SolutionIndex: 476
    SolutionNameMin: Cijk_Alik_Bljk_SB_MT128x128x8_SE_EPS1_FL1_GRVW4_LPA0_LPB0_PGR1_PLR0_TT8_8_USFGRO1_VW4_WG16_16_1_WGM1
    SolutionIndex: 477
    SolutionNameMin: Cijk_Alik_Bljk_SB_MT128x128x16_SE_EPS1_FL1_GRVW4_LPA0_LPB0_PGR1_PLR0_TT8_8_USFGRO1_VW4_WG16_16_1_WGM1
    SolutionIndex: 478
    SolutionNameMin: Cijk_Alik_Bljk_SB_MT128x128x16_SE_EPS1_FL1_GRVW4_LPA0_LPB0_PGR1_PLR0_TT8_8_USFGRO1_VW4_WG16_16_1_WGM8
    SolutionIndex: 479
    SolutionNameMin: Cijk_Alik_Bljk_SB_MT128x128x8_SE_EPS1_FL1_GRVW4_LPA0_LPB0_PGR1_PLR1_TT8_8_USFGRO1_VW4_WG16_16_1_WGM1
    SolutionIndex: 480
    SolutionNameMin: Cijk_Alik_Bljk_SB_MT128x128x16_SE_EPS1_FL1_GRVW4_LPA0_LPB0_PGR1_PLR1_TT8_8_USFGRO1_VW4_WG16_16_1_WGM1
    SolutionIndex: 481
    SolutionNameMin: Cijk_Alik_Bljk_SB_MT64x64x16_SE_EPS0_FL0_GRVW4_LPA2_LPB0_PGR0_PLR0_TT4_4_USFGRO1_VW2_WG16_16_1_WGM8
    SolutionIndex: 482
    SolutionNameMin: Cijk_Alik_Bljk_SB_MT64x64x16_SE_EPS0_FL0_GRVW4_LPA2_LPB2_PGR0_PLR0_TT4_4_USFGRO1_VW2_WG16_16_1_WGM8
    SolutionIndex: 483
    SolutionNameMin: Cijk_Alik_Bljk_SB_MT64x64x16_SE_EPS0_FL0_GRVW4_LPA0_LPB2_PGR0_PLR1_TT4_4_USFGRO1_VW2_WG16_16_1_WGM8
    SolutionIndex: 484
    SolutionNameMin: Cijk_Alik_Bljk_SB_MT64x64x16_SE_EPS0_FL1_GRVW4_LPA2_LPB0_PGR0_PLR1_TT4_4_USFGRO1_VW2_WG16_16_1_WGM8
    SolutionIndex: 485
    SolutionNameMin: Cijk_Alik_Bljk_SB_MT64x64x16_SE_EPS0_FL1_GRVW4_LPA2_LPB2_PGR0_PLR0_TT4_4_USFGRO1_VW2_WG16_16_1_WGM8
    SolutionIndex: 486
    SolutionNameMin: Cijk_Alik_Bljk_SB_MT64x32x32_SE_EPS0_FL0_GRVW2_LPA2_LPB2_PGR0_PLR1_TT4_2_USFGRO1_VW2_WG16_16_1_WGM8
    SolutionIndex: 487
    SolutionNameMin: Cijk_Alik_Bljk_SB_MT64x32x32_SE_EPS0_FL0_GRVW4_LPA2_LPB2_PGR0_PLR1_TT4_2_USFGRO1_VW2_WG16_16_1_WGM1
    SolutionIndex: 488
    SolutionNameMin: Cijk_Alik_Bljk_SB_MT64x32x32_SE_EPS0_FL0_GRVW4_LPA2_LPB2_PGR0_PLR1_TT4_2_USFGRO1_VW2_WG16_16_1_WGM8
    SolutionIndex: 489
    SolutionNameMin: Cijk_Alik_Bljk_SB_MT64x32x32_SE_EPS0_FL1_GRVW4_LPA2_LPB2_PGR0_PLR1_TT4_2_USFGRO1_VW2_WG16_16_1_WGM1
    SolutionIndex: 490
    SolutionNameMin: Cijk_Alik_Bljk_SB_MT32x64x32_SE_EPS0_FL0_GRVW2_LPA2_LPB2_PGR0_PLR1_TT2_4_USFGRO1_VW2_WG16_16_1_WGM8
    SolutionIndex: 491
    SolutionNameMin: Cijk_Alik_Bljk_SB_MT32x64x32_SE_EPS0_FL1_GRVW4_LPA2_LPB2_PGR0_PLR1_TT2_4_USFGRO1_VW2_WG16_16_1_WGM1
    SolutionIndex: 492
    SolutionNameMin: Cijk_Alik_Bljk_SB_MT64x32x16_SE_EPS0_FL0_GRVW4_LPA2_LPB2_PGR0_PLR1_TT4_4_USFGRO1_VW2_WG16_8_1_WGM8
    SolutionIndex: 493
    SolutionNameMin: Cijk_Alik_Bljk_SB_MT64x16x8_SE_EPS1_FL0_GRVW1_LPA2_LPB0_PGR1_PLR1_TT4_2_USFGRO1_VW2_WG16_8_1_WGM1
    SolutionIndex: 494
    SolutionNameMin: Cijk_Alik_Bljk_SB_MT64x16x16_SE_EPS0_FL0_GRVW1_LPA2_LPB2_PGR0_PLR1_TT4_2_USFGRO1_VW2_WG16_8_1_WGM1
    SolutionIndex: 495
    SolutionNameMin: Cijk_Alik_Bljk_SB_MT64x16x16_SE_EPS0_FL0_GRVW1_LPA2_LPB2_PGR0_PLR1_TT4_2_USFGRO1_VW2_WG16_8_1_WGM8
    SolutionIndex: 496
    SolutionNameMin: Cijk_Alik_Bljk_SB_MT64x16x8_SE_EPS1_FL0_GRVW4_LPA0_LPB2_PGR1_PLR1_TT4_2_USFGRO1_VW2_WG16_8_1_WGM1
    SolutionIndex: 497
    SolutionNameMin: Cijk_Alik_Bljk_SB_MT64x16x16_SE_EPS0_FL1_GRVW1_LPA2_LPB2_PGR0_PLR1_TT4_2_USFGRO1_VW2_WG16_8_1_WGM1
    SolutionIndex: 498
    SolutionNameMin: Cijk_Alik_Bljk_SB_MT64x16x16_SE_EPS0_FL1_GRVW1_LPA2_LPB2_PGR0_PLR1_TT4_2_USFGRO1_VW2_WG16_8_1_WGM8
    SolutionIndex: 499
    SolutionNameMin: Cijk_Alik_Bljk_SB_MT64x16x32_SE_EPS0_FL1_GRVW1_LPA2_LPB2_PGR0_PLR1_TT4_2_USFGRO1_VW2_WG16_8_1_WGM1
    SolutionIndex: 500
    SolutionNameMin: Cijk_Alik_Bljk_SB_MT64x16x16_SE_EPS0_FL1_GRVW2_LPA2_LPB2_PGR0_PLR1_TT4_2_USFGRO1_VW2_WG16_8_1_WGM8
    SolutionIndex: 501
    SolutionNameMin: Cijk_Alik_Bljk_SB_MT64x16x32_SE_EPS0_FL1_GRVW2_LPA2_LPB2_PGR0_PLR1_TT4_2_USFGRO1_VW2_WG16_8_1_WGM1
    SolutionIndex: 502
    SolutionNameMin: Cijk_Alik_Bljk_SB_MT64x16x16_SE_EPS0_FL1_GRVW4_LPA2_LPB0_PGR0_PLR1_TT4_2_USFGRO1_VW2_WG16_8_1_WGM8
    SolutionIndex: 503
    SolutionNameMin: Cijk_Alik_Bljk_SB_MT64x16x16_SE_EPS0_FL1_GRVW4_LPA0_LPB2_PGR0_PLR1_TT4_2_USFGRO1_VW2_WG16_8_1_WGM8
    SolutionIndex: 504
    SolutionNameMin: Cijk_Alik_Bljk_SB_MT32x32x8_SE_EPS0_FL0_GRVW1_LPA2_LPB2_PGR0_PLR0_TT2_4_USFGRO1_VW2_WG16_8_1_WGM1
    SolutionIndex: 505
    SolutionNameMin: Cijk_Alik_Bljk_SB_MT32x32x16_SE_EPS0_FL0_GRVW1_LPA2_LPB2_PGR0_PLR0_TT2_4_USFGRO1_VW2_WG16_8_1_WGM1
    SolutionIndex: 506
    SolutionNameMin: Cijk_Alik_Bljk_SB_MT32x32x16_SE_EPS0_FL0_GRVW2_LPA2_LPB2_PGR0_PLR0_TT2_4_USFGRO1_VW2_WG16_8_1_WGM8
    SolutionIndex: 507
    SolutionNameMin: Cijk_Alik_Bljk_SB_MT32x32x16_SE_EPS0_FL0_GRVW2_LPA2_LPB2_PGR0_PLR1_TT2_4_USFGRO1_VW2_WG16_8_1_WGM8
    SolutionIndex: 508
    SolutionNameMin: Cijk_Alik_Bljk_SB_MT32x32x32_SE_EPS0_FL0_GRVW2_LPA2_LPB2_PGR0_PLR1_TT2_4_USFGRO1_VW2_WG16_8_1_WGM8
    SolutionIndex: 509
    SolutionNameMin: Cijk_Alik_Bljk_SB_MT32x32x16_SE_EPS0_FL0_GRVW4_LPA0_LPB0_PGR0_PLR1_TT2_4_USFGRO1_VW2_WG16_8_1_WGM8
    SolutionIndex: 510
    SolutionNameMin: Cijk_Alik_Bljk_SB_MT32x32x16_SE_EPS0_FL0_GRVW4_LPA2_LPB0_PGR0_PLR1_TT2_4_USFGRO1_VW2_WG16_8_1_WGM8
    SolutionIndex: 511
    SolutionNameMin: Cijk_Alik_Bljk_SB_MT32x32x32_SE_EPS0_FL0_GRVW4_LPA2_LPB0_PGR0_PLR1_TT2_4_USFGRO1_VW2_WG16_8_1_WGM1
    SolutionIndex: 512
    SolutionNameMin: Cijk_Alik_Bljk_SB_MT32x32x32_SE_EPS0_FL0_GRVW4_LPA2_LPB2_PGR0_PLR0_TT2_4_USFGRO1_VW2_WG16_8_1_WGM1
    SolutionIndex: 513
    SolutionNameMin: Cijk_Alik_Bljk_SB_MT32x32x16_SE_EPS0_FL0_GRVW4_LPA0_LPB2_PGR0_PLR1_TT2_4_USFGRO1_VW2_WG16_8_1_WGM1
    SolutionIndex: 514
    SolutionNameMin: Cijk_Alik_Bljk_SB_MT32x32x8_SE_EPS1_FL0_GRVW4_LPA2_LPB2_PGR1_PLR1_TT2_4_USFGRO1_VW2_WG16_8_1_WGM1
    SolutionIndex: 515
    SolutionNameMin: Cijk_Alik_Bljk_SB_MT32x32x16_SE_EPS0_FL0_GRVW4_LPA2_LPB2_PGR0_PLR1_TT2_4_USFGRO1_VW2_WG16_8_1_WGM1
    SolutionIndex: 516
    SolutionNameMin: Cijk_Alik_Bljk_SB_MT32x32x16_SE_EPS0_FL0_GRVW4_LPA2_LPB2_PGR0_PLR1_TT2_4_USFGRO1_VW2_WG16_8_1_WGM8
    SolutionIndex: 517
    SolutionNameMin: Cijk_Alik_Bljk_SB_MT32x32x32_SE_EPS0_FL0_GRVW4_LPA2_LPB2_PGR0_PLR1_TT2_4_USFGRO1_VW2_WG16_8_1_WGM1
    SolutionIndex: 518
    SolutionNameMin: Cijk_Alik_Bljk_SB_MT32x32x32_SE_EPS0_FL0_GRVW4_LPA2_LPB2_PGR0_PLR1_TT2_4_USFGRO1_VW2_WG16_8_1_WGM8
    SolutionIndex: 519
    SolutionNameMin: Cijk_Alik_Bljk_SB_MT32x32x8_SE_EPS0_FL1_GRVW1_LPA2_LPB2_PGR0_PLR1_TT2_4_USFGRO1_VW2_WG16_8_1_WGM1
    SolutionIndex: 520
    SolutionNameMin: Cijk_Alik_Bljk_SB_MT32x32x16_SE_EPS0_FL1_GRVW1_LPA2_LPB2_PGR0_PLR1_TT2_4_USFGRO1_VW2_WG16_8_1_WGM8
    SolutionIndex: 521
    SolutionNameMin: Cijk_Alik_Bljk_SB_MT32x32x16_SE_EPS0_FL1_GRVW2_LPA2_LPB2_PGR0_PLR1_TT2_4_USFGRO1_VW2_WG16_8_1_WGM8
    SolutionIndex: 522
    SolutionNameMin: Cijk_Alik_Bljk_SB_MT32x32x32_SE_EPS0_FL1_GRVW2_LPA2_LPB2_PGR0_PLR1_TT2_4_USFGRO1_VW2_WG16_8_1_WGM1
    SolutionIndex: 523
    SolutionNameMin: Cijk_Alik_Bljk_SB_MT32x32x32_SE_EPS0_FL1_GRVW4_LPA2_LPB0_PGR0_PLR1_TT2_4_USFGRO1_VW2_WG16_8_1_WGM8
    SolutionIndex: 524
    SolutionNameMin: Cijk_Alik_Bljk_SB_MT32x32x16_SE_EPS0_FL1_GRVW4_LPA0_LPB2_PGR0_PLR0_TT2_4_USFGRO1_VW2_WG16_8_1_WGM1
    SolutionIndex: 525
    SolutionNameMin: Cijk_Alik_Bljk_SB_MT32x32x16_SE_EPS0_FL1_GRVW4_LPA2_LPB2_PGR0_PLR0_TT2_4_USFGRO1_VW2_WG16_8_1_WGM8
    SolutionIndex: 526
    SolutionNameMin: Cijk_Alik_Bljk_SB_MT32x32x32_SE_EPS0_FL1_GRVW4_LPA0_LPB2_PGR0_PLR1_TT2_4_USFGRO1_VW2_WG16_8_1_WGM1
    SolutionIndex: 527
    SolutionNameMin: Cijk_Alik_Bljk_SB_MT32x32x16_SE_EPS0_FL1_GRVW4_LPA2_LPB2_PGR0_PLR1_TT2_4_USFGRO1_VW2_WG16_8_1_WGM1
    SolutionIndex: 528
    SolutionNameMin: Cijk_Alik_Bljk_SB_MT32x32x16_SE_EPS0_FL1_GRVW4_LPA2_LPB2_PGR0_PLR1_TT2_4_USFGRO1_VW2_WG16_8_1_WGM8
    SolutionIndex: 529
    SolutionNameMin: Cijk_Alik_Bljk_SB_MT32x32x32_SE_EPS0_FL1_GRVW4_LPA2_LPB2_PGR0_PLR1_TT2_4_USFGRO1_VW2_WG16_8_1_WGM1
    SolutionIndex: 530
    SolutionNameMin: Cijk_Alik_Bljk_SB_MT32x32x32_SE_EPS0_FL1_GRVW4_LPA2_LPB2_PGR0_PLR1_TT2_4_USFGRO1_VW2_WG16_8_1_WGM8
    SolutionIndex: 531
    SolutionNameMin: Cijk_Alik_Bljk_SB_MT64x64x16_SE_EPS0_FL1_GRVW4_LPA2_LPB2_PGR0_PLR1_TT4_8_USFGRO1_VW2_WG16_8_1_WGM8
    SolutionIndex: 532
    SolutionNameMin: Cijk_Alik_Bljk_SB_MT32x32x16_SE_EPS0_FL0_GRVW1_LPA2_LPB2_PGR0_PLR1_TT4_2_USFGRO1_VW2_WG8_16_1_WGM1
    SolutionIndex: 533
    SolutionNameMin: Cijk_Alik_Bljk_SB_MT32x32x32_SE_EPS0_FL0_GRVW2_LPA2_LPB2_PGR0_PLR1_TT4_2_USFGRO1_VW2_WG8_16_1_WGM1
    SolutionIndex: 534
    SolutionNameMin: Cijk_Alik_Bljk_SB_MT32x32x32_SE_EPS0_FL0_GRVW2_LPA2_LPB2_PGR0_PLR1_TT4_2_USFGRO1_VW2_WG8_16_1_WGM8
    SolutionIndex: 535
    SolutionNameMin: Cijk_Alik_Bljk_SB_MT32x32x16_SE_EPS0_FL0_GRVW4_LPA2_LPB0_PGR0_PLR1_TT4_2_USFGRO1_VW2_WG8_16_1_WGM1
    SolutionIndex: 536
    SolutionNameMin: Cijk_Alik_Bljk_SB_MT32x32x32_SE_EPS0_FL0_GRVW4_LPA2_LPB2_PGR0_PLR1_TT4_2_USFGRO1_VW2_WG8_16_1_WGM1
    SolutionIndex: 537
    SolutionNameMin: Cijk_Alik_Bljk_SB_MT32x32x32_SE_EPS0_FL0_GRVW4_LPA2_LPB2_PGR0_PLR1_TT4_2_USFGRO1_VW2_WG8_16_1_WGM8
    SolutionIndex: 538
    SolutionNameMin: Cijk_Alik_Bljk_SB_MT32x32x16_SE_EPS0_FL1_GRVW2_LPA2_LPB2_PGR0_PLR0_TT4_2_USFGRO1_VW2_WG8_16_1_WGM8
    SolutionIndex: 539
    SolutionNameMin: Cijk_Alik_Bljk_SB_MT32x32x8_SE_EPS1_FL1_GRVW2_LPA2_LPB2_PGR1_PLR1_TT4_2_USFGRO1_VW2_WG8_16_1_WGM8
    SolutionIndex: 540
    SolutionNameMin: Cijk_Alik_Bljk_SB_MT32x32x16_SE_EPS0_FL1_GRVW4_LPA2_LPB0_PGR0_PLR1_TT4_2_USFGRO1_VW2_WG8_16_1_WGM1
    SolutionIndex: 541
    SolutionNameMin: Cijk_Alik_Bljk_SB_MT32x32x16_SE_EPS0_FL1_GRVW4_LPA2_LPB0_PGR0_PLR1_TT4_2_USFGRO1_VW2_WG8_16_1_WGM8
    SolutionIndex: 542
    SolutionNameMin: Cijk_Alik_Bljk_SB_MT32x32x32_SE_EPS0_FL1_GRVW4_LPA0_LPB2_PGR0_PLR1_TT4_2_USFGRO1_VW2_WG8_16_1_WGM1
    SolutionIndex: 543
    SolutionNameMin: Cijk_Alik_Bljk_SB_MT32x32x16_SE_EPS0_FL1_GRVW4_LPA2_LPB2_PGR0_PLR1_TT4_2_USFGRO1_VW2_WG8_16_1_WGM1
    SolutionIndex: 544
    SolutionNameMin: Cijk_Alik_Bljk_SB_MT32x32x16_SE_EPS0_FL1_GRVW4_LPA2_LPB2_PGR0_PLR1_TT4_2_USFGRO1_VW2_WG8_16_1_WGM8
    SolutionIndex: 545
    SolutionNameMin: Cijk_Alik_Bljk_SB_MT32x32x32_SE_EPS0_FL1_GRVW4_LPA2_LPB2_PGR0_PLR1_TT4_2_USFGRO1_VW2_WG8_16_1_WGM1
    SolutionIndex: 546
    SolutionNameMin: Cijk_Alik_Bljk_SB_MT16x64x16_SE_EPS0_FL0_GRVW1_LPA2_LPB2_PGR0_PLR1_TT2_4_USFGRO1_VW2_WG8_16_1_WGM8
    SolutionIndex: 547
    SolutionNameMin: Cijk_Alik_Bljk_SB_MT16x64x16_SE_EPS0_FL1_GRVW1_LPA2_LPB2_PGR0_PLR1_TT2_4_USFGRO1_VW2_WG8_16_1_WGM8
    SolutionIndex: 548
    SolutionNameMin: Cijk_Alik_Bljk_SB_MT64x32x16_SE_EPS1_FL0_GRVW4_PGR1_PLR0_TT4_4_VW2_WGM8
    SolutionIndex: 549
    SolutionNameMin: Cijk_Alik_Bljk_SB_MT128x64x16_SE_EPS0_FL1_GRVW4_PGR0_PLR1_TT8_4_VW4_WGM8
- - - [1024, 128, 1, 128]
    - [16, 1356.23]
  - - [4, 704, 1, 1280]
    - [94, 374.297]
  - - [4, 1856, 1, 3328]
    - [96, 517.106]
  - - [1856, 448, 1, 3328]
    - [83, 7357.87]
  - - [2944, 4288, 1, 1280]
    - [85, 8917.24]
  - - [2368, 64, 1, 3328]
    - [31, 5348.57]
  - - [1760, 32, 1, 1760]
    - [53, 3558.86]
  - - [2368, 5888, 1, 256]
    - [85, 8635.26]
  - - [5888, 1856, 1, 256]
    - [85, 8778.8]
  - - [128, 64, 1, 256]
    - [44, 435.591]
  - - [512, 24000, 1, 1536]
    - [79, 8792.13]
  - - [128, 6784, 1, 3328]
    - [81, 7498.0]
  - - [5888, 1408, 1, 256]
    - [85, 8703.02]
  - - [5888, 1856, 1, 3328]
    - [85, 8733.67]
  - - [5056, 704, 1, 256]
    - [85, 7081.72]
  - - [2048, 400, 1, 512]
    - [77, 4338.81]
  - - [5888, 2944, 1, 3328]
    - [73, 8878.71]
  - - [1856, 4288, 1, 256]
    - [80, 8276.8]
  - - [1024, 5056, 1, 128]
    - [69, 3951.49]
  - - [5056, 5056, 1, 3328]
    - [85, 8830.54]
  - - [1408, 5888, 1, 1280]
    - [85, 9816.48]
  - - [2368, 448, 1, 128]
    - [66, 3279.29]
  - - [2368, 6784, 1, 128]
    - [66, 5473.99]
  - - [1024, 3584, 1, 3328]
    - [83, 8993.69]
  - - [512, 48000, 1, 2048]
    - [79, 7539.54]
  - - [128, 448, 1, 1280]
    - [53, 3206.72]
  - - [256, 4288, 1, 3328]
    - [74, 7345.42]
  - - [5888, 1408, 1, 1280]
    - [79, 9478.72]
  - - [704, 1856, 1, 3328]
    - [80, 8393.22]
  - - [4, 1408, 1, 128]
    - [90, 72.6234]
  - - [1024, 2368, 1, 256]
    - [85, 6148.15]
  - - [64, 4, 1, 256]
    - [94, 17.0135]
  - - [1408, 1856, 1, 1280]
    - [77, 8984.38]
  - - [1408, 64, 1, 1280]
    - [57, 3716.2]
  - - [448, 1024, 1, 1280]
    - [74, 6734.94]
  - - [6144, 24000, 1, 2048]
    - [85, 7639.24]
  - - [4096, 32, 1, 4096]
    - [45, 2420.69]
  - - [256, 1408, 1, 3328]
    - [74, 5802.12]
  - - [5056, 5056, 1, 1280]
    - [73, 9023.66]
  - - [448, 5056, 1, 256]
    - [77, 6622.57]
  - - [704, 1856, 1, 1280]
    - [80, 7894.32]
  - - [128, 5056, 1, 128]
    - [7, 2570.76]
  - - [2368, 128, 1, 256]
    - [74, 3688.4]
  - - [1760, 6400, 1, 1760]
    - [73, 9987.47]
  - - [1856, 1408, 1, 128]
    - [66, 4650.39]
  - - [64, 5056, 1, 256]
    - [29, 2547.32]
  - - [6784, 256, 1, 3328]
    - [80, 8121.59]
  - - [6784, 4288, 1, 3328]
    - [85, 8574.31]
  - - [4288, 448, 1, 256]
    - [83, 6204.55]
  - - [64, 704, 1, 128]
    - [16, 536.93]
  - - [1856, 2368, 1, 3328]
    - [80, 8532.59]
  - - [4288, 2944, 1, 1280]
    - [75, 8827.39]
  - - [704, 5056, 1, 1280]
    - [75, 9197.68]
  - - [2368, 704, 1, 3328]
    - [79, 7954.1]
  - - [256, 5888, 1, 256]
    - [84, 5912.81]
  - - [1856, 4288, 1, 3328]
    - [85, 8898.92]
  - - [256, 2944, 1, 256]
    - [80, 5157.6]
  - - [5888, 1024, 1, 256]
    - [85, 8374.84]
  - - [448, 64, 1, 1280]
    - [53, 2315.1]
  - - [3072, 64, 1, 1024]
    - [45, 2367.43]
  - - [3584, 4, 1, 1280]
    - [39, 462.16]
  - - [16384, 3200, 1, 4096]
    - [79, 7796.56]
  - - [2944, 64, 1, 256]
    - [74, 2679.62]
  - - [128, 4, 1, 1280]
    - [48, 128.213]
  - - [1408, 2944, 1, 256]
    - [85, 7543.55]
  - - [256, 1856, 1, 1280]
    - [80, 6757.26]
  - - [6784, 5056, 1, 3328]
    - [73, 8694.1]
  - - [5056, 5056, 1, 256]
    - [85, 9180.44]
  - - [1408, 6784, 1, 128]
    - [66, 5397.35]
  - - [64, 1024, 1, 1280]
    - [53, 3421.2]
  - - [2944, 4, 1, 256]
    - [27, 376.832]
  - - [704, 5056, 1, 128]
    - [67, 4663.01]
  - - [4, 2368, 1, 1280]
    - [48, 471.665]
  - - [2368, 2944, 1, 1280]
    - [79, 9313.58]
  - - [128, 3584, 1, 1280]
    - [80, 6018.98]
  - - [6784, 6784, 1, 1280]
    - [85, 8934.65]
  - - [1024, 256, 1, 3328]
    - [80, 5984.36]
  - - [1408, 4288, 1, 1280]
    - [79, 9466.0]
  - - [3584, 4288, 1, 1280]
    - [85, 9157.35]
  - - [2368, 704, 1, 1280]
    - [80, 7791.75]
  - - [5056, 4288, 1, 3328]
    - [85, 8547.21]
  - - [3584, 2368, 1, 3328]
    - [79, 8377.19]
  - - [64, 704, 1, 1280]
    - [53, 2648.1]
  - - [4288, 256, 1, 256]
    - [82, 4609.5]
  - - [2944, 128, 1, 128]
    - [66, 2268.79]
  - - [6144, 32, 1, 2560]
    - [45, 3015.79]
  - - [6784, 448, 1, 1280]
    - [83, 9038.94]
  - - [1408, 2944, 1, 128]
    - [67, 4396.93]
  - - [4288, 2944, 1, 256]
    - [80, 8623.59]
  - - [5888, 704, 1, 1280]
    - [80, 9037.98]
  - - [5056, 4, 1, 3328]
    - [39, 529.175]
  - - [1856, 64, 1, 1280]
    - [31, 4064.41]
  - - [1760, 16, 1, 1760]
    - [40, 2021.35]
  - - [448, 5888, 1, 128]
    - [66, 4391.14]
  - - [5888, 64, 1, 3328]
    - [58, 5795.89]
  - - [2944, 256, 1, 3328]
    - [80, 8137.36]
  - - [1024, 64, 1, 128]
    - [16, 740.128]
  - - [5056, 2368, 1, 1280]
    - [85, 9128.14]
  - - [448, 3584, 1, 1280]
    - [79, 7450.18]
  - - [6784, 5888, 1, 256]
    - [79, 9532.02]
  - - [704, 1024, 1, 128]
    - [66, 3235.49]
  - - [704, 128, 1, 1280]
    - [53, 3672.42]
  - - [4, 3584, 1, 128]
    - [90, 162.967]
  - - [1408, 448, 1, 1280]
    - [74, 6577.92]
  - - [1024, 1408, 1, 256]
    - [76, 6069.06]
  - - [2368, 2368, 1, 3328]
    - [81, 8719.45]
  - - [1856, 6784, 1, 128]
    - [69, 5484.43]
  - - [5056, 704, 1, 3328]
    - [83, 8362.76]
  - - [1408, 1856, 1, 256]
    - [85, 6293.46]
  - - [1408, 704, 1, 3328]
    - [77, 8645.44]
  - - [2368, 5056, 1, 256]
    - [85, 8657.89]
  - - [1408, 256, 1, 1280]
    - [80, 5346.22]
  - - [3072, 128, 1, 1024]
    - [46, 2602.03]
  - - [3584, 2368, 1, 1280]
    - [85, 8799.83]
  - - [4288, 64, 1, 3328]
    - [42, 5823.94]
  - - [2368, 4, 1, 1280]
    - [39, 429.584]
  - - [704, 5888, 1, 256]
    - [74, 7130.51]
  - - [6784, 2944, 1, 128]
    - [71, 5235.24]
  - - [2560, 1600, 1, 2560]
    - [75, 7534.64]
  - - [4288, 6784, 1, 3328]
    - [73, 8591.78]
  - - [2944, 256, 1, 256]
    - [80, 5209.12]
  - - [2944, 6784, 1, 3328]
    - [85, 8685.3]
  - - [704, 1408, 1, 3328]
    - [75, 8697.78]
  - - [6144, 5984, 1, 2048]
    - [75, 7559.11]
  - - [3584, 704, 1, 3328]
    - [80, 8485.99]
  - - [2944, 256, 1, 128]
    - [66, 3093.29]
  - - [6784, 4, 1, 1280]
    - [39, 480.918]
  - - [1024, 64, 1, 1280]
    - [30, 2639.67]
  - - [2048, 1600, 1, 512]
    - [85, 5977.44]
  - - [448, 4288, 1, 256]
    - [75, 6204.55]
  - - [64, 3584, 1, 3328]
    - [50, 5908.89]
  - - [1856, 4288, 1, 128]
    - [66, 5348.85]
  - - [704, 2368, 1, 1280]
    - [79, 7749.82]
  - - [1856, 2368, 1, 1280]
    - [83, 8785.67]
  - - [2368, 128, 1, 3328]
    - [42, 5949.07]
  - - [2944, 128, 1, 256]
    - [80, 4056.9]
  - - [448, 1408, 1, 256]
    - [74, 5329.92]
  - - [1856, 4288, 1, 1280]
    - [73, 9127.17]
  - - [64, 5056, 1, 3328]
    - [58, 5741.53]
  - - [4, 704, 1, 256]
    - [27, 156.955]
  - - [1024, 448, 1, 128]
    - [66, 2142.41]
  - - [704, 4, 1, 1280]
    - [48, 371.443]
  - - [704, 256, 1, 128]
    - [66, 1605.22]
  - - [704, 2944, 1, 128]
    - [67, 4213.29]
  - - [1408, 1024, 1, 1280]
    - [75, 7800.06]
  - - [704, 6784, 1, 256]
    - [79, 7904.75]
  - - [6784, 704, 1, 256]
    - [81, 7394.77]
  - - [5056, 1408, 1, 128]
    - [69, 5199.06]
  - - [2048, 7000, 1, 2048]
    - [75, 7360.93]
  - - [256, 3584, 1, 3328]
    - [75, 8131.84]
  - - [4, 5888, 1, 3328]
    - [48, 596.119]
  - - [128, 1408, 1, 128]
    - [13, 1557.06]
  - - [3584, 4288, 1, 3328]
    - [85, 8923.88]
  - - [5888, 1856, 1, 1280]
    - [85, 9205.03]
  - - [256, 1408, 1, 256]
    - [80, 4194.21]
  - - [5056, 64, 1, 1280]
    - [57, 4501.89]
  - - [1024, 704, 1, 256]
    - [74, 5404.24]
  - - [448, 128, 1, 128]
    - [14, 656.21]
  - - [2368, 3584, 1, 1280]
    - [72, 8873.85]
  - - [2368, 6784, 1, 1280]
    - [85, 9000.84]
  - - [1024, 256, 1, 256]
    - [74, 3667.75]
  - - [1856, 4, 1, 1280]
    - [39, 381.796]
  - - [448, 448, 1, 256]
    - [74, 3241.14]
  - - [2944, 3584, 1, 3328]
    - [72, 8406.64]
  - - [7680, 32, 1, 2560]
    - [60, 3420.54]
  - - [128, 4288, 1, 128]
    - [9, 2394.99]
  - - [256, 256, 1, 3328]
    - [61, 4394.51]
  - - [128, 1024, 1, 3328]
    - [25, 6033.43]
  - - [4, 1408, 1, 3328]
    - [39, 494.194]
  - - [6784, 2944, 1, 256]
    - [85, 9175.93]
  - - [64, 1856, 1, 1280]
    - [25, 4072.47]
  - - [6784, 64, 1, 128]
    - [20, 2351.81]
  - - [4288, 2368, 1, 3328]
    - [83, 8209.03]
  - - [1856, 2368, 1, 256]
    - [80, 7330.45]
  - - [3584, 256, 1, 128]
    - [68, 3037.15]
  - - [3584, 6784, 1, 3328]
    - [85, 8679.2]
  - - [256, 1024, 1, 256]
    - [80, 3956.07]
  - - [4, 6784, 1, 3328]
    - [48, 596.733]
  - - [1024, 5888, 1, 3328]
    - [79, 9126.56]
  - - [1024, 128, 1, 1280]
    - [25, 3653.02]
  - - [3072, 32, 1, 1024]
    - [44, 1608.18]
  - - [6144, 24000, 1, 2560]
    - [85, 8305.1]
  - - [5056, 4288, 1, 1280]
    - [73, 8786.69]
  - - [5888, 64, 1, 256]
    - [34, 2609.77]
  - - [6784, 1856, 1, 3328]
    - [85, 8464.77]
  - - [1408, 5056, 1, 1280]
    - [79, 9531.95]
  - - [1856, 256, 1, 1280]
    - [80, 6696.66]
  - - [64, 5888, 1, 3328]
    - [54, 5721.45]
  - - [2368, 2368, 1, 1280]
    - [85, 8837.4]
  - - [2944, 5888, 1, 128]
    - [69, 5308.88]
  - - [704, 5888, 1, 1280]
    - [75, 9423.23]
  - - [2368, 3584, 1, 128]
    - [66, 5072.61]
  - - [1856, 5056, 1, 128]
    - [69, 5404.98]
  - - [704, 1024, 1, 1280]
    - [74, 7414.69]
  - - [448, 256, 1, 3328]
    - [43, 5582.39]
  - - [448, 1856, 1, 128]
    - [67, 3143.9]
  - - [8192, 3200, 1, 2048]
    - [75, 7504.25]
  - - [128, 1024, 1, 128]
    - [6, 1316.79]
  - - [2944, 4, 1, 128]
    - [90, 144.311]
  - - [1024, 704, 1, 1280]
    - [74, 7280.37]
  - - [128, 5888, 1, 256]
    - [80, 4384.85]
  - - [1024, 5056, 1, 1280]
    - [85, 9737.86]
  - - [4288, 1024, 1, 256]
    - [80, 7409.43]
  - - [2944, 2368, 1, 128]
    - [69, 5093.52]
  - - [704, 704, 1, 3328]
    - [74, 7628.07]
  - - [704, 1408, 1, 1280]
    - [81, 8160.05]
  - - [5888, 448, 1, 1280]
    - [85, 8189.03]
  - - [3584, 256, 1, 3328]
    - [81, 8041.42]
  - - [704, 5888, 1, 3328]
    - [81, 9045.88]
  - - [704, 1856, 1, 128]
    - [66, 4135.14]
  - - [448, 448, 1, 3328]
    - [51, 5699.73]
  - - [4, 4288, 1, 128]
    - [90, 179.624]
  - - [128, 704, 1, 1280]
    - [25, 3854.16]
  - - [3584, 2944, 1, 256]
    - [79, 8533.61]
  - - [3584, 4, 1, 128]
    - [90, 166.252]
  - - [1856, 128, 1, 3328]
    - [51, 6322.94]
  - - [4, 64, 1, 1280]
    - [48, 66.0246]
  - - [2944, 448, 1, 128]
    - [66, 3522.42]
  - - [128, 2944, 1, 1280]
    - [80, 5324.16]
  - - [64, 64, 1, 3328]
    - [48, 1520.78]
  - - [448, 2944, 1, 1280]
    - [77, 7558.89]
  - - [512, 24000, 1, 2048]
    - [77, 7171.04]
  - - [128, 256, 1, 3328]
    - [61, 3617.1]
  - - [1408, 5056, 1, 3328]
    - [79, 8912.02]
  - - [1856, 1856, 1, 3328]
    - [75, 8503.78]
  - - [3584, 128, 1, 256]
    - [80, 3695.54]
  - - [2560, 800, 1, 2560]
    - [82, 7141.94]
  - - [448, 1408, 1, 3328]
    - [80, 6993.83]
  - - [2368, 2368, 1, 256]
    - [77, 7674.71]
  - - [4288, 4288, 1, 1280]
    - [72, 8782.03]
  - - [64, 448, 1, 1280]
    - [57, 2272.67]
  - - [5888, 1024, 1, 1280]
    - [85, 9558.09]
  - - [1408, 4288, 1, 256]
    - [79, 8201.63]
  - - [448, 4, 1, 256]
    - [39, 123.853]
  - - [5888, 448, 1, 128]
    - [71, 3729.96]
  - - [512, 48000, 1, 2560]
    - [79, 8801.88]
  - - [35, 8457, 1, 1760]
    - [3, 4239.08]
  - - [704, 6784, 1, 3328]
    - [85, 8674.96]
  - - [2560, 6400, 1, 2560]
    - [85, 8681.32]
  - - [5056, 1024, 1, 1280]
    - [85, 9725.15]
  - - [448, 5888, 1, 3328]
    - [74, 8087.11]
  - - [128, 4, 1, 128]
    - [90, 6.91162]
  - - [1024, 2944, 1, 1280]
    - [85, 9568.63]
  - - [5056, 5888, 1, 1280]
    - [73, 8984.6]
  - - [4288, 5888, 1, 128]
    - [67, 5453.34]
  - - [256, 3584, 1, 256]
    - [77, 5723.43]
  - - [1408, 3584, 1, 128]
    - [69, 4865.89]
  - - [256, 2944, 1, 3328]
    - [74, 8151.08]
  - - [448, 3584, 1, 128]
    - [66, 3848.06]
  - - [5888, 2944, 1, 1280]
    - [73, 9048.32]
  - - [4, 6784, 1, 1280]
    - [48, 534.05]
  - - [2368, 5888, 1, 128]
    - [66, 5598.98]
  - - [8448, 16, 1, 2816]
    - [41, 2028.58]
  - - [64, 2944, 1, 128]
    - [7, 1588.18]
  - - [2368, 4, 1, 256]
    - [27, 334.022]
  - - [3584, 5888, 1, 256]
    - [79, 8723.47]
  - - [2368, 1024, 1, 128]
    - [66, 4355.49]
  - - [2368, 704, 1, 128]
    - [66, 3956.85]
  - - [3584, 2944, 1, 1280]
    - [85, 8820.97]
  - - [3584, 2368, 1, 128]
    - [69, 4677.81]
  - - [5056, 704, 1, 128]
    - [70, 4253.45]
  - - [448, 2368, 1, 128]
    - [66, 3407.24]
  - - [5056, 1408, 1, 3328]
    - [85, 8983.36]
  - - [1408, 704, 1, 256]
    - [77, 6285.51]
  - - [6784, 1024, 1, 3328]
    - [85, 8738.53]
  - - [6784, 2944, 1, 3328]
    - [85, 8649.29]
  - - [2944, 5056, 1, 3328]
    - [85, 8637.19]
  - - [1856, 1856, 1, 256]
    - [83, 6986.27]
  - - [1024, 5888, 1, 128]
    - [67, 4147.42]
  - - [6784, 2368, 1, 1280]
    - [73, 9010.48]
  - - [256, 4, 1, 128]
    - [90, 13.8232]
  - - [4288, 5888, 1, 1280]
    - [73, 8946.87]
  - - [4288, 4288, 1, 256]
    - [80, 8945.97]
  - - [8448, 32, 1, 2816]
    - [57, 3557.21]
  - - [448, 2944, 1, 3328]
    - [83, 7945.05]
  - - [5888, 4, 1, 128]
    - [90, 218.794]
  - - [4288, 1856, 1, 1280]
    - [85, 9166.71]
  - - [1856, 2944, 1, 3328]
    - [77, 8612.18]
  - - [256, 6784, 1, 3328]
    - [74, 8206.16]
  - - [64, 5888, 1, 256]
    - [80, 2533.62]
  - - [256, 5056, 1, 128]
    - [66, 3055.38]
  - - [5056, 1024, 1, 256]
    - [85, 8249.13]
  - - [704, 64, 1, 3328]
    - [37, 4008.35]
  - - [5056, 1856, 1, 3328]
    - [85, 8195.41]
  - - [4, 2944, 1, 3328]
    - [96, 552.248]
  - - [4, 5056, 1, 256]
    - [27, 351.209]
  - - [1856, 1408, 1, 256]
    - [77, 6377.91]
  - - [8448, 12000, 1, 2816]
    - [85, 8697.62]
  - - [6784, 128, 1, 3328]
    - [75, 7459.28]
  - - [4288, 1408, 1, 128]
    - [69, 5064.31]
  - - [1856, 5888, 1, 3328]
    - [73, 8967.04]
  - - [4288, 5056, 1, 256]
    - [85, 8650.75]
  - - [1408, 128, 1, 1280]
    - [31, 4711.31]
  - - [4096, 800, 1, 1024]
    - [88, 5325.31]
  - - [5056, 256, 1, 3328]
    - [80, 8476.69]
  - - [704, 704, 1, 256]
    - [80, 4993.61]
  - - [1024, 5888, 1, 1280]
    - [79, 9439.46]
  - - [6784, 2368, 1, 128]
    - [69, 5432.21]
  - - [4, 5056, 1, 1280]
    - [48, 520.807]
  - - [256, 64, 1, 1280]
    - [40, 1993.68]
  - - [128, 1856, 1, 1280]
    - [74, 4969.8]
  - - [1856, 1024, 1, 1280]
    - [85, 8780.84]
  - - [6784, 4288, 1, 1280]
    - [73, 8931.81]
  - - [2560, 64, 1, 2560]
    - [63, 3693.5]
  - - [1856, 1856, 1, 1280]
    - [81, 8902.65]
  - - [4096, 400, 1, 1024]
    - [88, 4111.19]
  - - [3072, 24000, 1, 1024]
    - [85, 8343.77]
  - - [128, 4288, 1, 3328]
    - [38, 6396.52]
  - - [4, 2368, 1, 3328]
    - [48, 537.983]
  - - [5888, 1856, 1, 128]
    - [70, 4846.82]
  - - [448, 704, 1, 1280]
    - [80, 4892.11]
  - - [128, 5056, 1, 1280]
    - [74, 6181.72]
  - - [1024, 448, 1, 3328]
    - [80, 7089.84]
  - - [1856, 704, 1, 1280]
    - [80, 8086.58]
  - - [5056, 3584, 1, 128]
    - [71, 5328.73]
  - - [5888, 5888, 1, 3328]
    - [73, 8777.29]
  - - [6784, 1024, 1, 256]
    - [85, 8216.09]
  - - [2944, 2368, 1, 256]
    - [85, 8025.44]
  - - [256, 448, 1, 256]
    - [28, 2177.73]
  - - [5056, 5888, 1, 3328]
    - [85, 8761.5]
  - - [1856, 1024, 1, 256]
    - [79, 6899.26]
  - - [512, 48000, 1, 1536]
    - [79, 8859.39]
  - - [3584, 448, 1, 1280]
    - [85, 7355.37]
  - - [8448, 5984, 1, 2816]
    - [85, 8766.09]
  - - [1024, 1024, 1, 1280]
    - [79, 8384.47]
  - - [448, 5888, 1, 256]
    - [83, 6698.04]
  - - [704, 64, 1, 128]
    - [16, 526.057]
  - - [1408, 6784, 1, 3328]
    - [85, 8535.71]
  - - [448, 1024, 1, 128]
    - [66, 2678.05]
  - - [4288, 704, 1, 128]
    - [69, 4559.64]
  - - [128, 1856, 1, 128]
    - [10, 1840.83]
  - - [448, 2368, 1, 3328]
    - [74, 6895.4]
  - - [5056, 64, 1, 128]
    - [18, 1955.01]
  - - [5056, 2944, 1, 256]
    - [80, 8843.12]
  - - [6784, 5888, 1, 128]
    - [70, 5469.21]
  - - [1024, 700, 1, 512]
    - [81, 4786.83]
  - - [704, 1024, 1, 256]
    - [74, 5662.15]
  - - [1024, 4, 1, 256]
    - [93, 217.773]
  - - [2944, 704, 1, 128]
    - [68, 3830.26]
  - - [128, 6784, 1, 1280]
    - [75, 6870.26]
  - - [1408, 3584, 1, 3328]
    - [85, 9245.62]
  - - [2368, 6784, 1, 256]
    - [80, 8640.81]
  - - [5056, 1408, 1, 1280]
    - [85, 9583.93]
  - - [256, 256, 1, 128]
    - [6, 775.61]
  - - [5056, 4288, 1, 128]
    - [69, 5688.14]
  - - [1408, 1856, 1, 128]
    - [69, 4321.09]
  - - [1408, 5888, 1, 3328]
    - [85, 9213.48]
  - - [1856, 256, 1, 256]
    - [80, 5052.33]
  - - [6784, 6784, 1, 256]
    - [79, 9445.29]
  - - [64, 256, 1, 128]
    - [16, 211.268]
  - - [4288, 2368, 1, 128]
    - [69, 5403.62]
  - - [1024, 1024, 1, 128]
    - [71, 3140.18]
  - - [256, 4288, 1, 1280]
    - [74, 6945.5]
  - - [2368, 2944, 1, 256]
    - [85, 8191.91]
  - - [4, 1856, 1, 256]
    - [92, 291.562]
  - - [3584, 1856, 1, 1280]
    - [83, 8693.84]
  - - [6784, 6784, 1, 128]
    - [70, 5398.82]
  - - [256, 1856, 1, 128]
    - [66, 2062.83]
  - - [704, 64, 1, 1280]
    - [61, 2915.88]
  - - [5888, 5056, 1, 256]
    - [85, 9294.51]
  - - [8448, 48000, 1, 2816]
    - [85, 8524.48]
  - - [3584, 448, 1, 256]
    - [81, 5610.61]
  - - [448, 4288, 1, 128]
    - [66, 4098.05]
  - - [7680, 64, 1, 2560]
    - [55, 5000.41]
  - - [256, 6784, 1, 256]
    - [79, 6251.92]
  - - [1408, 4288, 1, 128]
    - [69, 5010.8]
  - - [2944, 704, 1, 3328]
    - [77, 8748.0]
  - - [128, 448, 1, 256]
    - [27, 1679.45]
  - - [5056, 256, 1, 1280]
    - [80, 8249.86]
  - - [2560, 32, 1, 2560]
    - [45, 2670.82]
  - - [3584, 3584, 1, 256]
    - [80, 8702.43]
  - - [448, 1408, 1, 128]
    - [66, 2831.06]
  - - [128, 256, 1, 1280]
    - [28, 2670.85]
  - - [3584, 5056, 1, 256]
    - [85, 8866.37]
  - - [6784, 128, 1, 256]
    - [80, 4238.61]
  - - [4288, 4, 1, 256]
    - [39, 387.428]
  - - [704, 448, 1, 256]
    - [80, 3837.83]
  - - [2944, 2368, 1, 1280]
    - [85, 9464.32]
  - - [448, 64, 1, 3328]
    - [64, 3286.05]
  - - [1408, 3584, 1, 256]
    - [85, 7999.71]
  - - [3584, 4, 1, 3328]
    - [39, 524.484]
  - - [6784, 3584, 1, 256]
    - [79, 9434.76]
  - - [256, 128, 1, 128]
    - [14, 382.587]
  - - [704, 1408, 1, 128]
    - [70, 3644.29]
  - - [4, 2368, 1, 256]
    - [27, 330.651]
  - - [4288, 128, 1, 1280]
    - [31, 5517.2]
  - - [128, 1408, 1, 256]
    - [74, 2910.41]
  - - [4, 2944, 1, 256]
    - [27, 369.965]
  - - [64, 128, 1, 3328]
    - [49, 1906.97]
  - - [5056, 2368, 1, 128]
    - [69, 5493.37]
  - - [2944, 2944, 1, 3328]
    - [85, 8583.56]
  - - [5056, 6784, 1, 256]
    - [85, 9193.17]
  - - [1856, 3584, 1, 128]
    - [66, 5279.81]
  - - [128, 2944, 1, 128]
    - [7, 2237.64]
  - - [35, 8457, 1, 2560]
    - [4, 3787.21]
  - - [1024, 704, 1, 3328]
    - [80, 7809.83]
  - - [6784, 448, 1, 256]
    - [81, 6527.81]
  - - [3584, 6784, 1, 128]
    - [67, 5298.65]
  - - [128, 4288, 1, 256]
    - [80, 3512.64]
  - - [704, 448, 1, 3328]
    - [80, 5091.45]
  - - [1024, 1024, 1, 3328]
    - [79, 8990.25]
  - - [128, 128, 1, 3328]
    - [61, 2520.79]
  - - [5056, 1856, 1, 256]
    - [85, 8220.5]
  - - [4608, 5984, 1, 1536]
    - [85, 8717.74]
  - - [256, 128, 1, 256]
    - [27, 1244.42]
  - - [1760, 3200, 1, 1760]
    - [73, 9273.83]
  - - [1024, 1856, 1, 256]
    - [85, 6799.23]
  - - [4096, 1600, 1, 1024]
    - [76, 6089.95]
  - - [4288, 64, 1, 128]
    - [12, 1737.0]
  - - [256, 448, 1, 3328]
    - [38, 5534.43]
  - - [1408, 6784, 1, 1280]
    - [79, 8923.62]
  - - [3584, 3584, 1, 1280]
    - [75, 8803.92]
  - - [7680, 24000, 1, 2560]
    - [85, 8287.43]
  - - [64, 2368, 1, 1280]
    - [25, 4041.3]
  - - [448, 2368, 1, 1280]
    - [74, 6819.62]
  - - [4608, 48000, 1, 1536]
    - [85, 8428.11]
  - - [5888, 5888, 1, 128]
    - [67, 5002.53]
  - - [64, 6784, 1, 3328]
    - [51, 5634.34]
  - - [2944, 256, 1, 1280]
    - [80, 7589.11]
  - - [2048, 16, 1, 2048]
    - [62, 1063.31]
  - - [256, 2368, 1, 128]
    - [66, 2292.1]
  - - [5056, 2368, 1, 3328]
    - [73, 8729.83]
  - - [2944, 4288, 1, 256]
    - [80, 8728.83]
  - - [1408, 3584, 1, 1280]
    - [79, 9747.02]
  - - [2368, 64, 1, 256]
    - [74, 2369.88]
  - - [64, 448, 1, 3328]
    - [61, 3345.8]
  - - [704, 128, 1, 3328]
    - [42, 4907.18]
  - - [8192, 1600, 1, 2048]
    - [75, 7009.08]
  - - [1856, 704, 1, 256]
    - [84, 5759.62]
  - - [4, 4288, 1, 1280]
    - [48, 497.278]
  - - [1408, 448, 1, 3328]
    - [80, 6990.38]
  - - [1024, 4, 1, 3328]
    - [23, 460.049]
  - - [512, 24000, 1, 2560]
    - [79, 8687.09]
  - - [2368, 6784, 1, 3328]
    - [73, 8728.59]
  - - [1856, 1408, 1, 1280]
    - [75, 8766.36]
  - - [1856, 448, 1, 1280]
    - [83, 7070.69]
  - - [6784, 704, 1, 128]
    - [69, 4789.63]
  - - [4, 4, 1, 256]
    - [39, 0.850675]
  - - [128, 5888, 1, 128]
    - [8, 2862.2]
  - - [1408, 5888, 1, 256]
    - [79, 8807.38]
  - - [704, 2944, 1, 1280]
    - [75, 8937.61]
  - - [4288, 64, 1, 1280]
    - [57, 4374.59]
  - - [256, 64, 1, 256]
    - [33, 765.174]
  - - [1024, 1024, 1, 256]
    - [77, 6357.49]
  - - [704, 1856, 1, 256]
    - [78, 5737.64]
  - - [704, 6784, 1, 128]
    - [69, 4974.43]
  - - [3584, 704, 1, 1280]
    - [80, 8585.75]
  - - [256, 128, 1, 1280]
    - [28, 2683.5]
  - - [5888, 2368, 1, 256]
    - [85, 8914.85]
  - - [256, 2368, 1, 1280]
    - [80, 6227.67]
  - - [2944, 6784, 1, 128]
    - [66, 5701.42]
  - - [3584, 448, 1, 3328]
    - [85, 7645.53]
  - - [1408, 4, 1, 256]
    - [27, 274.157]
  - - [704, 2368, 1, 3328]
    - [74, 8138.2]
  - - [2944, 448, 1, 256]
    - [81, 5828.69]
  - - [1856, 448, 1, 128]
    - [67, 3137.04]
  - - [4288, 4, 1, 3328]
    - [39, 531.436]
  - - [2368, 128, 1, 1280]
    - [57, 4651.4]
  - - [256, 5888, 1, 128]
    - [66, 3413.62]
  - - [64, 6784, 1, 256]
    - [86, 2614.07]
  - - [64, 5056, 1, 1280]
    - [53, 4534.74]
  - - [4, 6784, 1, 128]
    - [90, 224.351]
  - - [2048, 3200, 1, 512]
    - [75, 7636.05]
  - - [2944, 2944, 1, 1280]
    - [85, 9040.96]
  - - [5056, 448, 1, 3328]
    - [80, 8444.33]
  - - [4, 3584, 1, 1280]
    - [48, 490.532]
  - - [1408, 128, 1, 128]
    - [16, 1455.21]
  - - [6784, 704, 1, 3328]
    - [73, 8787.58]
  - - [128, 64, 1, 1280]
    - [39, 1429.84]
  - - [2368, 256, 1, 1280]
    - [80, 6249.97]
  - - [4, 448, 1, 3328]
    - [96, 383.375]
  - - [5888, 4288, 1, 128]
    - [67, 4999.05]
  - - [4, 5888, 1, 256]
    - [39, 334.952]
  - - [1408, 2944, 1, 3328]
    - [79, 9516.94]
  - - [3584, 704, 1, 128]
    - [71, 3697.9]
  - - [4608, 12000, 1, 1536]
    - [85, 8745.12]
  - - [64, 1024, 1, 256]
    - [28, 1715.81]
  - - [5056, 5056, 1, 128]
    - [69, 5577.23]
  - - [2368, 448, 1, 1280]
    - [80, 6699.98]
  - - [128, 3584, 1, 256]
    - [74, 3895.34]
  - - [704, 448, 1, 1280]
    - [74, 4878.95]
  - - [8192, 800, 1, 2048]
    - [75, 6400.15]
  - - [448, 5056, 1, 128]
    - [66, 4432.56]
  - - [256, 4, 1, 1280]
    - [48, 245.752]
  - - [5056, 3584, 1, 256]
    - [80, 8847.58]
  - - [2368, 4, 1, 3328]
    - [27, 473.878]
  - - [1408, 5056, 1, 128]
    - [69, 5070.48]
  - - [2944, 3584, 1, 128]
    - [66, 5445.65]
  - - [3584, 2368, 1, 256]
    - [80, 8133.62]
  - - [128, 3584, 1, 3328]
    - [80, 6934.76]
  - - [128, 1024, 1, 1280]
    - [25, 4314.02]
  - - [8448, 24000, 1, 2816]
    - [85, 8593.94]
  - - [64, 704, 1, 256]
    - [28, 1526.51]
  - - [4288, 256, 1, 1280]
    - [80, 7033.06]
  - - [3584, 3584, 1, 3328]
    - [73, 8694.04]
  - - [1024, 256, 1, 128]
    - [69, 1887.36]
  - - [4, 704, 1, 128]
    - [90, 36.5844]
  - - [5888, 6784, 1, 256]
    - [79, 9038.94]
  - - [4288, 2944, 1, 3328]
    - [73, 8429.78]
  - - [2944, 64, 1, 128]
    - [21, 1493.42]
  - - [1024, 128, 1, 3328]
    - [25, 5015.87]
  - - [1024, 16, 1, 500000]
    - [2, 2770.19]
  - - [4288, 128, 1, 3328]
    - [42, 6630.44]
  - - [7680, 128, 1, 2560]
    - [36, 5752.25]
  - - [256, 5056, 1, 1280]
    - [74, 8129.93]
  - - [1408, 256, 1, 128]
    - [66, 2118.48]
  - - [2944, 5888, 1, 3328]
    - [79, 8827.99]
  - - [6784, 5888, 1, 1280]
    - [73, 8950.68]
  - - [2048, 800, 1, 512]
    - [85, 6622.36]
  - - [704, 128, 1, 256]
    - [39, 1720.52]
  - - [5888, 4288, 1, 1280]
    - [72, 8852.46]
  - - [1024, 24000, 1, 2048]
    - [79, 7661.8]
  - - [448, 256, 1, 1280]
    - [25, 4145.92]
  - - [5888, 3584, 1, 128]
    - [67, 5125.69]
  - - [1024, 2944, 1, 128]
    - [71, 3663.25]
  - - [5056, 4, 1, 1280]
    - [39, 474.807]
  - - [256, 1408, 1, 1280]
    - [80, 5430.13]
  - - [3072, 16, 1, 1024]
    - [44, 815.669]
  - - [704, 3584, 1, 128]
    - [69, 4439.76]
  - - [5888, 448, 1, 3328]
    - [85, 8207.52]
  - - [2368, 4288, 1, 1280]
    - [77, 8821.28]
  - - [4288, 2944, 1, 128]
    - [66, 5473.87]
  - - [1024, 6784, 1, 3328]
    - [85, 9000.63]
  - - [128, 2368, 1, 256]
    - [74, 3649.79]
  - - [6784, 64, 1, 3328]
    - [58, 5737.07]
  - - [5056, 2944, 1, 3328]
    - [85, 8678.67]
  - - [448, 128, 1, 256]
    - [24, 1489.98]
  - - [2944, 3584, 1, 256]
    - [85, 8797.13]
  - - [1408, 1408, 1, 3328]
    - [79, 9353.64]
  - - [1856, 128, 1, 1280]
    - [80, 4945.83]
  - - [3584, 3584, 1, 128]
    - [67, 5130.74]
  - - [64, 3584, 1, 256]
    - [74, 2516.51]
  - - [1408, 4, 1, 3328]
    - [39, 473.83]
  - - [128, 2944, 1, 3328]
    - [52, 6026.98]
  - - [3584, 704, 1, 256]
    - [85, 6454.23]
  - - [2944, 448, 1, 3328]
    - [75, 7825.44]
  - - [3584, 1408, 1, 3328]
    - [85, 9049.29]
  - - [704, 3584, 1, 1280]
    - [81, 8707.49]
  - - [2944, 6784, 1, 1280]
    - [73, 8822.88]
  - - [1856, 6784, 1, 256]
    - [85, 8662.85]
  - - [4288, 448, 1, 3328]
    - [83, 8321.77]
  - - [6784, 4288, 1, 128]
    - [71, 5203.47]
  - - [6784, 704, 1, 1280]
    - [85, 9314.39]
  - - [256, 4288, 1, 256]
    - [86, 4649.04]
  - - [3584, 6784, 1, 256]
    - [79, 8843.91]
  - - [6144, 12000, 1, 2048]
    - [85, 7678.01]
  - - [6144, 16, 1, 2560]
    - [44, 1728.9]
  - - [3584, 64, 1, 128]
    - [17, 1708.42]
  - - [5888, 1024, 1, 3328]
    - [85, 9271.82]
  - - [448, 64, 1, 128]
    - [6, 356.433]
  - - [704, 6784, 1, 1280]
    - [77, 8800.86]
  - - [4, 1024, 1, 1280]
    - [39, 388.88]
  - - [5888, 128, 1, 256]
    - [74, 4050.68]
  - - [4096, 16, 1, 4096]
    - [44, 1442.58]
  - - [1856, 5056, 1, 3328]
    - [72, 8514.87]
  - - [4, 6784, 1, 256]
    - [94, 323.371]
  - - [1024, 3584, 1, 128]
    - [68, 3750.19]
  - - [1024, 1408, 1, 128]
    - [66, 3060.62]
  - - [2368, 2944, 1, 128]
    - [66, 5297.36]
  - - [5056, 64, 1, 256]
    - [35, 2570.76]
  - - [4, 448, 1, 1280]
    - [94, 322.542]
  - - [5056, 2944, 1, 128]
    - [69, 5582.86]
  - - [5888, 5056, 1, 3328]
    - [85, 8813.17]
  - - [1024, 704, 1, 128]
    - [69, 2552.59]
  - - [5888, 2368, 1, 128]
    - [71, 4840.75]
  - - [128, 5056, 1, 3328]
    - [80, 6842.8]
  - - [3584, 6784, 1, 1280]
    - [73, 9026.9]
  - - [448, 4, 1, 1280]
    - [96, 332.936]
  - - [1856, 5888, 1, 256]
    - [85, 8610.68]
  - - [256, 256, 1, 256]
    - [27, 1653.25]
  - - [256, 64, 1, 128]
    - [14, 192.594]
  - - [4288, 4288, 1, 3328]
    - [73, 8447.05]
  - - [4288, 1408, 1, 1280]
    - [85, 9353.12]
  - - [3584, 5056, 1, 128]
    - [66, 5098.78]
  - - [4, 1024, 1, 3328]
    - [39, 484.262]
  - - [4288, 2368, 1, 256]
    - [80, 8415.13]
  - - [2944, 5056, 1, 1280]
    - [73, 8986.18]
  - - [448, 6784, 1, 256]
    - [83, 6833.6]
  - - [64, 128, 1, 128]
    - [16, 118.954]
  - - [1856, 2368, 1, 128]
    - [68, 4602.63]
  - - [6784, 2368, 1, 3328]
    - [73, 8812.25]
  - - [256, 1024, 1, 1280]
    - [74, 5261.01]
  - - [704, 4, 1, 128]
    - [90, 37.7195]
  - - [256, 4, 1, 256]
    - [39, 76.9315]
  - - [4288, 128, 1, 256]
    - [80, 3399.32]
  - - [4288, 1856, 1, 3328]
    - [85, 8682.18]
  - - [3584, 448, 1, 128]
    - [66, 3437.95]
  - - [2048, 1600, 1, 2048]
    - [86, 6080.14]
  - - [256, 4, 1, 3328]
    - [96, 353.881]
  - - [4, 1408, 1, 1280]
    - [48, 423.123]
  - - [3584, 64, 1, 1280]
    - [57, 3939.85]
  - - [1408, 448, 1, 128]
    - [66, 2759.41]
  - - [3584, 1024, 1, 1280]
    - [83, 9118.03]
  - - [1856, 5056, 1, 256]
    - [80, 8364.67]
  - - [4, 3584, 1, 256]
    - [27, 387.051]
  - - [4, 2944, 1, 1280]
    - [48, 479.911]
  - - [1024, 4288, 1, 256]
    - [80, 7515.87]
  - - [5888, 3584, 1, 3328]
    - [85, 8687.58]
  - - [1856, 4, 1, 256]
    - [27, 301.841]
  - - [4, 256, 1, 256]
    - [39, 78.6393]
  - - [5056, 3584, 1, 3328]
    - [85, 8708.08]
  - - [704, 448, 1, 128]
    - [66, 2003.58]
  - - [2368, 1408, 1, 1280]
    - [80, 8498.63]
  - - [5056, 2944, 1, 1280]
    - [85, 9020.21]
  - - [4, 4, 1, 128]
    - [91, 0.0554053]
  - - [3584, 256, 1, 256]
    - [83, 5365.09]
  - - [1024, 6784, 1, 256]
    - [79, 8414.81]
  - - [4, 128, 1, 256]
    - [39, 40.2123]
  - - [64, 64, 1, 1280]
    - [48, 943.643]
  - - [5124, 9124, 1, 2048]
    - [75, 7490.6]
  - - [6784, 4, 1, 128]
    - [90, 225.429]
  - - [2944, 1408, 1, 128]
    - [69, 4663.16]
  - - [448, 128, 1, 3328]
    - [37, 4616.99]
  - - [3584, 1408, 1, 1280]
    - [85, 9505.81]
  - - [64, 4288, 1, 3328]
    - [61, 5215.44]
  - - [5056, 6784, 1, 3328]
    - [85, 8624.66]
  - - [128, 2944, 1, 256]
    - [74, 4147.42]
  - - [128, 6784, 1, 128]
    - [7, 2858.04]
  - - [3584, 4288, 1, 256]
    - [80, 8726.72]
  - - [448, 1856, 1, 256]
    - [75, 5463.02]
  - - [1856, 6784, 1, 3328]
    - [79, 8490.95]
  - - [3584, 128, 1, 3328]
    - [80, 6937.11]
  - - [64, 1856, 1, 256]
    - [28, 2138.07]
  - - [64, 448, 1, 256]
    - [27, 1165.73]
  - - [5888, 4288, 1, 256]
    - [85, 8799.25]
  - - [4, 448, 1, 128]
    - [90, 24.0033]
  - - [5056, 1408, 1, 256]
    - [85, 8317.08]
  - - [35, 8457, 1, 2048]
    - [4, 3278.61]
  - - [64, 256, 1, 1280]
    - [45, 2066.46]
  - - [3584, 1024, 1, 256]
    - [85, 7335.56]
  - - [256, 704, 1, 256]
    - [74, 2951.85]
  - - [5888, 5888, 1, 256]
    - [79, 9340.51]
  - - [4288, 1024, 1, 1280]
    - [80, 8612.09]
  - - [5888, 128, 1, 3328]
    - [80, 7780.22]
  - - [448, 6784, 1, 3328]
    - [81, 8916.18]
  - - [2944, 1408, 1, 1280]
    - [85, 9959.11]
  - - [64, 128, 1, 1280]
    - [39, 1415.56]
  - - [2944, 1856, 1, 3328]
    - [81, 8464.89]
  - - [2368, 64, 1, 128]
    - [21, 1277.45]
  - - [256, 1024, 1, 128]
    - [66, 1665.32]
  - - [3584, 5888, 1, 1280]
    - [73, 8863.21]
  - - [64, 4, 1, 128]
    - [90, 3.4027]
  - - [6784, 1856, 1, 1280]
    - [79, 8897.73]
  - - [2944, 5056, 1, 256]
    - [85, 8590.59]
  - - [4288, 4, 1, 128]
    - [90, 181.833]
  - - [5888, 256, 1, 3328]
    - [75, 8694.19]
  - - [2944, 4288, 1, 128]
    - [66, 5508.43]
  - - [3584, 1408, 1, 256]
    - [79, 7662.28]
  - - [704, 3584, 1, 3328]
    - [81, 8825.59]
  - - [4096, 3200, 1, 1024]
    - [76, 7062.77]
  - - [5056, 448, 1, 1280]
    - [80, 8343.53]
  - - [3584, 1856, 1, 3328]
    - [85, 8665.0]
  - - [4288, 6784, 1, 1280]
    - [73, 8886.34]
  - - [2560, 7000, 1, 2560]
    - [85, 8393.7]
  - - [1408, 704, 1, 1280]
    - [83, 8105.98]
  - - [2944, 1024, 1, 256]
    - [85, 7626.87]
  - - [6784, 64, 1, 256]
    - [34, 2688.98]
  - - [2368, 4288, 1, 3328]
    - [75, 8257.62]
  - - [4, 1408, 1, 256]
    - [27, 270.328]
  - - [1024, 1408, 1, 1280]
    - [80, 7672.74]
  - - [64, 64, 1, 256]
    - [27, 232.063]
  - - [704, 256, 1, 3328]
    - [74, 4318.33]
  - - [6784, 5056, 1, 256]
    - [79, 9104.2]
  - - [1856, 1856, 1, 128]
    - [69, 4621.36]
  - - [3584, 5056, 1, 3328]
    - [85, 8766.88]
  - - [448, 6784, 1, 128]
    - [69, 4586.57]
  - - [4, 704, 1, 3328]
    - [48, 434.758]
  - - [35, 8457, 1, 4096]
    - [4, 3536.48]
  - - [448, 2944, 1, 256]
    - [82, 5641.13]
  - - [4, 4288, 1, 3328]
    - [48, 580.256]
  - - [2944, 6784, 1, 256]
    - [79, 9076.98]
  - - [2944, 2944, 1, 128]
    - [69, 5180.33]
  - - [4, 4, 1, 1280]
    - [48, 3.54448]
  - - [1856, 3584, 1, 1280]
    - [79, 9085.55]
  - - [64, 2944, 1, 256]
    - [74, 2646.9]
  - - [448, 256, 1, 128]
    - [16, 1201.02]
  - - [4288, 448, 1, 128]
    - [66, 3859.81]
  - - [4608, 24000, 1, 1536]
    - [85, 8553.1]
  - - [1856, 1408, 1, 3328]
    - [81, 8745.2]
  - - [128, 128, 1, 128]
    - [19, 230.178]
  - - [1024, 4288, 1, 3328]
    - [75, 8353.18]
  - - [448, 2368, 1, 256]
    - [77, 4749.0]
  - - [1024, 4, 1, 128]
    - [90, 53.6191]
  - - [64, 1408, 1, 1280]
    - [25, 3629.55]
  - - [64, 6784, 1, 1280]
    - [54, 4519.47]
  - - [5056, 448, 1, 256]
    - [81, 6572.54]
  - - [2944, 2368, 1, 3328]
    - [79, 8696.16]
  - - [704, 4288, 1, 3328]
    - [75, 8639.46]
  - - [1408, 128, 1, 256]
    - [80, 2980.06]
  - - [1024, 1856, 1, 1280]
    - [79, 8783.2]
  - - [2048, 6400, 1, 2048]
    - [75, 7293.48]
  - - [512, 48000, 1, 2816]
    - [85, 8825.35]
  - - [5124, 9124, 1, 2560]
    - [85, 8195.74]
  - - [128, 2368, 1, 3328]
    - [37, 5844.41]
  - - [1024, 5888, 1, 256]
    - [79, 8321.34]
  - - [64, 2944, 1, 1280]
    - [31, 4090.13]
  - - [5056, 64, 1, 3328]
    - [42, 5721.19]
  - - [128, 704, 1, 128]
    - [16, 998.125]
  - - [1408, 2368, 1, 256]
    - [79, 6695.2]
  - - [1408, 1408, 1, 256]
    - [79, 7151.56]
  - - [4, 64, 1, 128]
    - [90, 3.3512]
  - - [64, 1024, 1, 128]
    - [16, 735.327]
  - - [1024, 8, 1, 500000]
    - [2, 1411.61]
  - - [2368, 2368, 1, 128]
    - [66, 5184.24]
  - - [64, 5888, 1, 128]
    - [11, 2080.33]
  - - [5888, 4, 1, 3328]
    - [39, 530.381]
  - - [6784, 1408, 1, 128]
    - [69, 5175.64]
  - - [4288, 5888, 1, 256]
    - [85, 9063.41]
  - - [1408, 5056, 1, 256]
    - [79, 8489.29]
  - - [5056, 128, 1, 3328]
    - [80, 6836.36]
  - - [128, 128, 1, 1280]
    - [40, 2036.76]
  - - [448, 704, 1, 256]
    - [74, 3878.86]
  - - [4288, 3584, 1, 128]
    - [66, 5555.52]
  - - [2944, 128, 1, 3328]
    - [42, 6454.35]
  - - [64, 1408, 1, 3328]
    - [31, 4785.38]
  - - [3584, 5056, 1, 1280]
    - [73, 8879.19]
  - - [256, 448, 1, 1280]
    - [54, 3955.56]
  - - [704, 704, 1, 128]
    - [66, 2912.91]
  - - [5056, 4, 1, 128]
    - [90, 205.564]
  - - [704, 256, 1, 1280]
    - [74, 3987.39]
  - - [64, 2368, 1, 3328]
    - [25, 5084.94]
  - - [1856, 1024, 1, 128]
    - [66, 4064.42]
  - - [1856, 64, 1, 128]
    - [16, 1251.54]
  - - [4096, 64, 1, 4096]
    - [47, 3833.66]
  - - [1024, 24000, 1, 1536]
    - [79, 8866.63]
  - - [704, 4288, 1, 256]
    - [75, 6836.46]
  - - [5888, 2368, 1, 1280]
    - [79, 9067.85]
  - - [128, 256, 1, 256]
    - [27, 1286.79]
  - - [64, 128, 1, 256]
    - [39, 505.581]
  - - [2368, 5888, 1, 1280]
    - [73, 8939.99]
  - - [5888, 256, 1, 1280]
    - [81, 8481.22]
  - - [1760, 128, 1, 1760]
    - [32, 6096.23]
  - - [4, 5888, 1, 1280]
    - [48, 529.905]
  - - [704, 128, 1, 128]
    - [16, 1004.56]
  - - [1024, 4, 1, 1280]
    - [48, 380.525]
  - - [2368, 1856, 1, 3328]
    - [80, 8501.0]
  - - [2368, 128, 1, 128]
    - [12, 1870.52]
  - - [2944, 704, 1, 256]
    - [77, 6266.48]
  - - [5056, 128, 1, 128]
    - [66, 2867.34]
  - - [2368, 1024, 1, 3328]
    - [77, 8600.93]
  - - [256, 704, 1, 3328]
    - [74, 4461.08]
  - - [704, 3584, 1, 256]
    - [75, 6411.53]
  - - [1024, 1024, 1, 1024]
    - [76, 4280.87]
  - - [704, 2944, 1, 3328]
    - [81, 8970.5]
  - - [6784, 1024, 1, 128]
    - [69, 5052.07]
  - - [256, 448, 1, 128]
    - [16, 1223.29]
  - - [448, 1024, 1, 3328]
    - [74, 7176.24]
  - - [2944, 1024, 1, 3328]
    - [85, 9486.46]
  - - [2944, 5056, 1, 128]
    - [69, 5464.25]
  - - [2368, 256, 1, 256]
    - [80, 4988.08]
  - - [1408, 6784, 1, 256]
    - [79, 8485.93]
  - - [6784, 1408, 1, 3328]
    - [79, 8515.55]
  - - [4288, 6784, 1, 128]
    - [69, 5333.22]
  - - [704, 64, 1, 256]
    - [33, 1354.03]
  - - [5888, 4, 1, 1280]
    - [39, 468.318]
  - - [256, 2368, 1, 3328]
    - [74, 6703.14]
  - - [6784, 2944, 1, 1280]
    - [79, 8963.81]
  - - [4288, 1856, 1, 128]
    - [69, 5281.08]
  - - [1856, 2944, 1, 128]
    - [67, 4879.39]
  - - [6784, 448, 1, 128]
    - [71, 4058.44]
  - - [64, 3584, 1, 128]
    - [13, 1777.35]
  - - [448, 5056, 1, 1280]
    - [74, 8338.2]
  - - [2368, 1856, 1, 128]
    - [69, 4934.59]
  - - [64, 2944, 1, 3328]
    - [26, 5155.25]
  - - [4288, 704, 1, 256]
    - [80, 6548.96]
  - - [256, 3584, 1, 128]
    - [67, 2851.43]
  - - [5888, 704, 1, 256]
    - [80, 7095.18]
  - - [3584, 1024, 1, 128]
    - [67, 3973.42]
  - - [256, 5888, 1, 3328]
    - [77, 8993.24]
  - - [1408, 4288, 1, 3328]
    - [73, 8959.95]
  - - [6784, 4288, 1, 256]
    - [79, 9185.11]
  - - [4288, 256, 1, 128]
    - [66, 3140.4]
  - - [5888, 256, 1, 256]
    - [82, 5892.72]
  - - [6784, 1024, 1, 1280]
    - [85, 9489.85]
  - - [5888, 1024, 1, 128]
    - [69, 4565.43]
  - - [1024, 128, 1, 256]
    - [80, 2157.01]
  - - [512, 16, 1, 500000]
    - [1, 2735.45]
  - - [128, 64, 1, 3328]
    - [48, 1831.02]
  - - [448, 64, 1, 256]
    - [33, 1100.95]
  - - [2368, 256, 1, 128]
    - [66, 2800.79]
  - - [6784, 3584, 1, 1280]
    - [79, 9064.1]
  - - [1024, 6784, 1, 1280]
    - [79, 9331.98]
  - - [2944, 64, 1, 1280]
    - [31, 4261.41]
  - - [1408, 2944, 1, 1280]
    - [85, 9387.41]
  - - [256, 1856, 1, 256]
    - [80, 4886.99]
  - - [2048, 800, 1, 2048]
    - [89, 5108.5]
  - - [1408, 2368, 1, 3328]
    - [80, 8461.37]
  - - [2944, 4, 1, 3328]
    - [39, 514.646]
  - - [128, 1408, 1, 3328]
    - [32, 5666.1]
  - - [2944, 1856, 1, 128]
    - [69, 5011.47]
  - - [256, 2944, 1, 128]
    - [66, 2707.45]
  - - [256, 6784, 1, 128]
    - [66, 3421.81]
  - - [2368, 4, 1, 128]
    - [90, 116.91]
  - - [1408, 256, 1, 3328]
    - [80, 5746.52]
  - - [1856, 4, 1, 128]
    - [90, 92.9589]
  - - [5056, 6784, 1, 128]
    - [66, 5514.36]
  - - [4288, 5056, 1, 128]
    - [66, 5646.14]
  - - [1856, 5888, 1, 128]
    - [69, 5454.42]
  - - [2944, 5888, 1, 256]
    - [85, 9462.23]
  - - [3584, 1856, 1, 256]
    - [80, 7962.68]
  - - [4288, 3584, 1, 1280]
    - [85, 9217.1]
  - - [2368, 448, 1, 256]
    - [80, 4901.39]
  - - [4288, 256, 1, 3328]
    - [80, 6955.88]
  - - [1856, 704, 1, 128]
    - [66, 3886.01]
  - - [1408, 64, 1, 256]
    - [33, 1853.65]
  - - [64, 1856, 1, 128]
    - [16, 1186.45]
  - - [4, 256, 1, 128]
    - [90, 13.6108]
  - - [2560, 16, 1, 2560]
    - [44, 1572.82]
  - - [704, 5888, 1, 128]
    - [69, 4932.92]
  - - [6784, 3584, 1, 128]
    - [67, 5214.47]
  - - [1024, 64, 1, 256]
    - [39, 1530.35]
  - - [64, 2368, 1, 256]
    - [74, 2369.88]
  - - [4288, 5056, 1, 3328]
    - [85, 8526.78]
  - - [4, 1856, 1, 1280]
    - [48, 440.829]
  - - [4288, 128, 1, 128]
    - [66, 2502.39]
  - - [1408, 1408, 1, 128]
    - [66, 4102.49]
  - - [7680, 16, 1, 2560]
    - [59, 1908.58]
  - - [1856, 128, 1, 128]
    - [17, 1655.26]
  - - [5056, 2368, 1, 256]
    - [80, 8522.35]
  - - [4288, 704, 1, 3328]
    - [83, 8429.5]
  - - [448, 3584, 1, 256]
    - [79, 5828.69]
  - - [2368, 64, 1, 1280]
    - [25, 4210.19]
  - - [2368, 1024, 1, 1280]
    - [75, 8405.18]
  - - [2944, 1408, 1, 3328]
    - [79, 9533.51]
  - - [1408, 448, 1, 256]
    - [74, 5202.68]
  - - [1024, 1408, 1, 3328]
    - [83, 8283.23]
  - - [2944, 5888, 1, 1280]
    - [85, 9236.67]
  - - [1408, 4, 1, 1280]
    - [94, 400.487]
  - - [5888, 3584, 1, 256]
    - [79, 8890.43]
  - - [2368, 5056, 1, 128]
    - [69, 5245.44]
  - - [1408, 1856, 1, 3328]
    - [77, 9166.48]
  - - [4, 4, 1, 3328]
    - [96, 8.26255]
  - - [6784, 1408, 1, 1280]
    - [75, 8821.54]
  - - [4096, 7000, 1, 4096]
    - [79, 7861.54]
  - - [704, 2944, 1, 256]
    - [75, 6782.78]
  - - [4288, 64, 1, 256]
    - [35, 2382.97]
  - - [6784, 5888, 1, 3328]
    - [73, 8766.11]
  - - [2368, 4288, 1, 128]
    - [69, 5425.34]
  - - [64, 4288, 1, 1280]
    - [53, 4456.79]
  - - [6784, 64, 1, 1280]
    - [57, 4611.13]
  - - [3584, 128, 1, 128]
    - [15, 2469.47]
  - - [1024, 6784, 1, 128]
    - [66, 4166.5]
  - - [4, 1856, 1, 128]
    - [90, 95.0224]
  - - [1408, 64, 1, 3328]
    - [42, 4961.33]
  - - [6784, 4, 1, 256]
    - [39, 366.326]
  - - [1408, 1408, 1, 1280]
    - [79, 9253.34]
  - - [16384, 400, 1, 4096]
    - [83, 5665.58]
  - - [256, 2368, 1, 256]
    - [74, 5011.93]
  - - [448, 4288, 1, 3328]
    - [81, 8483.74]
  - - [2368, 1408, 1, 256]
    - [79, 6675.82]
  - - [5888, 5056, 1, 128]
    - [71, 5220.8]
  - - [704, 2368, 1, 256]
    - [79, 6077.23]
  - - [1024, 24000, 1, 2560]
    - [79, 8711.24]
  - - [2944, 448, 1, 1280]
    - [81, 7399.37]
  - - [5888, 2368, 1, 3328]
    - [85, 8690.61]
  - - [5124, 9124, 1, 1760]
    - [73, 8860.35]
  - - [448, 1408, 1, 1280]
    - [74, 6666.42]
  - - [448, 1856, 1, 1280]
    - [75, 7025.76]
  - - [4288, 448, 1, 1280]
    - [83, 8192.05]
  - - [5888, 704, 1, 3328]
    - [83, 8609.28]
  - - [5056, 256, 1, 128]
    - [66, 3702.86]
  - - [1856, 256, 1, 128]
    - [66, 2831.09]
  - - [64, 1408, 1, 128]
    - [6, 1052.11]
  - - [704, 4, 1, 256]
    - [39, 154.467]
  - - [1408, 5888, 1, 128]
    - [69, 5180.9]
  - - [7680, 12000, 1, 2560]
    - [85, 8485.59]
  - - [1408, 1024, 1, 256]
    - [76, 6205.11]
  - - [8192, 400, 1, 2048]
    - [88, 5273.84]
  - - [1024, 1856, 1, 128]
    - [66, 3438.78]
  - - [256, 704, 1, 128]
    - [66, 1245.68]
  - - [2560, 128, 1, 2560]
    - [65, 4681.39]
  - - [448, 1024, 1, 256]
    - [74, 4923.61]
  - - [128, 4, 1, 3328]
    - [96, 237.135]
  - - [5056, 6784, 1, 1280]
    - [85, 8783.88]
  - - [1408, 64, 1, 128]
    - [21, 967.118]
  - - [1024, 448, 1, 1280]
    - [80, 6540.42]
  - - [704, 5056, 1, 3328]
    - [75, 8566.14]
  - - [128, 5056, 1, 256]
    - [80, 3993.85]
  - - [64, 1024, 1, 3328]
    - [53, 4434.18]
  - - [1856, 4, 1, 3328]
    - [27, 448.901]
  - - [4, 2944, 1, 128]
    - [90, 143.303]
  - - [2368, 2944, 1, 3328]
    - [85, 8856.99]
  - - [448, 448, 1, 1280]
    - [31, 4440.55]
  - - [2368, 3584, 1, 256]
    - [80, 8099.93]
  - - [1024, 256, 1, 1280]
    - [80, 5027.41]
  - - [5056, 3584, 1, 1280]
    - [73, 9038.36]
  - - [5124, 9124, 1, 4096]
    - [79, 7774.1]
  - - [7680, 48000, 1, 2560]
    - [85, 8274.39]
  - - [448, 4, 1, 3328]
    - [96, 408.674]
  - - [1856, 2944, 1, 1280]
    - [77, 9011.75]
  - - [1024, 48000, 1, 2816]
    - [85, 8924.28]
  - - [128, 1024, 1, 256]
    - [34, 2220.46]
  - - [2944, 1408, 1, 256]
    - [85, 8025.34]
  - - [4288, 1408, 1, 3328]
    - [85, 8922.51]
  - - [3584, 64, 1, 3328]
    - [50, 5715.53]
  - - [5888, 2944, 1, 128]
    - [71, 5057.01]
  - - [2944, 1024, 1, 128]
    - [67, 4290.92]
  - - [4288, 5056, 1, 1280]
    - [73, 8884.22]
  - - [5888, 6784, 1, 1280]
    - [73, 8772.3]
  - - [6784, 5056, 1, 128]
    - [70, 5257.55]
  - - [256, 1024, 1, 3328]
    - [86, 5856.39]
  - - [3584, 4, 1, 256]
    - [93, 438.446]
  - - [1760, 1600, 1, 1760]
    - [73, 9548.46]
  - - [1856, 64, 1, 3328]
    - [31, 5484.67]
  - - [4, 128, 1, 3328]
    - [96, 230.028]
  - - [5888, 1408, 1, 3328]
    - [85, 9276.59]
  - - [448, 2944, 1, 128]
    - [66, 3544.35]
  - - [2368, 1856, 1, 256]
    - [85, 7178.02]
  - - [256, 5056, 1, 256]
    - [86, 5408.78]
  - - [128, 3584, 1, 128]
    - [18, 2359.19]
  - - [448, 3584, 1, 3328]
    - [73, 7666.65]
  - - [4, 5056, 1, 3328]
    - [48, 589.615]
  - - [704, 2368, 1, 128]
    - [66, 3973.28]
  - - [5888, 256, 1, 128]
    - [66, 3317.94]
  - - [4, 5056, 1, 128]
    - [90, 201.995]
  - - [448, 256, 1, 256]
    - [74, 1933.43]
  - - [704, 4, 1, 3328]
    - [95, 453.46]
  - - [1408, 256, 1, 256]
    - [74, 4222.61]
  - - [3584, 1856, 1, 128]
    - [68, 4621.68]
  - - [4288, 4288, 1, 128]
    - [66, 5432.9]
  - - [1856, 1024, 1, 3328]
    - [73, 8884.08]
  - - [128, 5888, 1, 3328]
    - [74, 7856.04]
  - - [1024, 5056, 1, 256]
    - [79, 8170.01]
  - - [5888, 5888, 1, 1280]
    - [79, 8855.71]
  - - [5056, 5888, 1, 128]
    - [69, 5734.73]
  - - [2368, 1408, 1, 3328]
    - [77, 8159.48]
  - - [1024, 48000, 1, 1536]
    - [79, 8900.16]
  - - [5888, 448, 1, 256]
    - [81, 6469.84]
  - - [2560, 3200, 1, 2560]
    - [85, 8914.5]
  - - [5888, 6784, 1, 128]
    - [67, 5219.8]
  - - [6144, 48000, 1, 2048]
    - [85, 7691.74]
  - - [6784, 5056, 1, 1280]
    - [73, 8886.47]
  - - [5056, 704, 1, 1280]
    - [85, 8612.92]
  - - [1024, 48000, 1, 2560]
    - [85, 8562.08]
  - - [4608, 32, 1, 1536]
    - [45, 2677.36]
  - - [1024, 2368, 1, 128]
    - [67, 3392.69]
  - - [128, 704, 1, 256]
    - [28, 1983.55]
  - - [2368, 448, 1, 3328]
    - [74, 7107.22]
  - - [128, 5888, 1, 1280]
    - [80, 6825.41]
  - - [16384, 800, 1, 4096]
    - [79, 6696.72]
  - - [448, 128, 1, 1280]
    - [53, 3270.16]
  - - [6784, 4, 1, 3328]
    - [39, 541.834]
  - - [5888, 5056, 1, 1280]
    - [73, 9014.2]
  - - [1024, 64, 1, 3328]
    - [42, 3848.77]
  - - [3072, 48000, 1, 1024]
    - [85, 8291.3]
  - - [64, 3584, 1, 1280]
    - [53, 4243.56]
  - - [6784, 1408, 1, 256]
    - [85, 8440.35]
  - - [3584, 5888, 1, 128]
    - [67, 5224.09]
  - - [5056, 5888, 1, 256]
    - [85, 9333.29]
  - - [2368, 1024, 1, 256]
    - [85, 6230.44]
  - - [2944, 1856, 1, 256]
    - [85, 7454.86]
  - - [1856, 6784, 1, 1280]
    - [72, 8784.57]
  - - [64, 5056, 1, 128]
    - [13, 2094.13]
  - - [64, 6784, 1, 128]
    - [22, 2119.26]
  - - [448, 704, 1, 128]
    - [66, 2018.46]
  - - [4, 1024, 1, 128]
    - [90, 53.6191]
  - - [4288, 3584, 1, 256]
    - [85, 9196.67]
  - - [1408, 704, 1, 128]
    - [68, 3474.2]
  - - [64, 256, 1, 3328]
    - [61, 2520.79]
  - - [6784, 448, 1, 3328]
    - [83, 8425.94]
  - - [5056, 1856, 1, 1280]
    - [80, 8722.86]
  - - [1408, 1024, 1, 3328]
    - [81, 8264.2]
  - - [2368, 256, 1, 3328]
    - [80, 6583.24]
  - - [5888, 3584, 1, 1280]
    - [79, 8997.49]
  - - [1856, 3584, 1, 3328]
    - [85, 8663.5]
  - - [5888, 128, 1, 1280]
    - [80, 6726.7]
  - - [1024, 2944, 1, 256]
    - [85, 7479.09]
  - - [448, 6784, 1, 1280]
    - [75, 8992.52]
  - - [256, 3584, 1, 1280]
    - [77, 7607.46]
  - - [704, 5056, 1, 256]
    - [79, 7106.27]
  - - [3584, 1024, 1, 3328]
    - [75, 8979.0]
  - - [2944, 1856, 1, 1280]
    - [80, 8888.73]
  - - [128, 256, 1, 128]
    - [14, 382.57]
  - - [5056, 256, 1, 256]
    - [87, 5287.35]
  - - [2944, 4288, 1, 3328]
    - [79, 8540.09]
  - - [2368, 3584, 1, 3328]
    - [72, 8430.35]
  - - [2944, 704, 1, 1280]
    - [80, 8484.48]
  - - [128, 4, 1, 256]
    - [39, 39.3196]
  - - [2944, 3584, 1, 1280]
    - [81, 8740.62]
  - - [1856, 5888, 1, 1280]
    - [85, 9241.98]
  - - [256, 256, 1, 1280]
    - [57, 3421.2]
  - - [2048, 3200, 1, 2048]
    - [75, 6963.42]
  - - [4288, 1408, 1, 256]
    - [85, 8059.07]
  - - [3584, 64, 1, 256]
    - [74, 2516.51]
  - - [64, 1856, 1, 3328]
    - [25, 5283.73]
  - - [256, 1408, 1, 128]
    - [66, 1754.44]
  - - [5888, 1408, 1, 128]
    - [66, 4562.16]
  - - [4288, 2368, 1, 1280]
    - [75, 8823.94]
  - - [4, 4288, 1, 256]
    - [27, 384.898]
  - - [256, 4288, 1, 128]
    - [66, 3114.64]
  - - [2048, 128, 1, 2048]
    - [47, 3307.86]
  - - [256, 128, 1, 3328]
    - [64, 3547.38]
  - - [512, 8, 1, 500000]
    - [0, 1390.0]
  - - [6784, 2368, 1, 256]
    - [80, 8833.29]
  - - [5888, 128, 1, 128]
    - [66, 2741.65]
  - - [1024, 24000, 1, 2816]
    - [85, 8885.96]
  - - [7680, 5984, 1, 2560]
    - [85, 8573.52]
  - - [4288, 1856, 1, 256]
    - [80, 8183.23]
  - - [1856, 256, 1, 3328]
    - [80, 7414.46]
  - - [1856, 2944, 1, 256]
    - [83, 8008.15]
  - - [5056, 1024, 1, 128]
    - [69, 5065.78]
  - - [64, 5888, 1, 1280]
    - [56, 4420.54]
  - - [1760, 800, 1, 1760]
    - [77, 8386.33]
  - - [6784, 256, 1, 128]
    - [66, 3394.72]
  - - [5888, 704, 1, 128]
    - [69, 4351.53]
  - - [1408, 2368, 1, 128]
    - [67, 4296.23]
  - - [1024, 4288, 1, 1280]
    - [74, 8630.71]
  - - [2368, 5056, 1, 3328]
    - [72, 8711.02]
  - - [448, 4, 1, 128]
    - [90, 23.1086]
  - - [4, 256, 1, 3328]
    - [96, 321.71]
  - - [4288, 1024, 1, 3328]
    - [80, 8448.34]
  - - [6144, 48000, 1, 2560]
    - [85, 8267.06]
  - - [1024, 5056, 1, 3328]
    - [85, 9571.24]
  - - [1024, 1856, 1, 3328]
    - [79, 8747.57]
  - - [704, 704, 1, 1280]
    - [80, 6867.68]
  - - [128, 2368, 1, 1280]
    - [25, 4917.84]
  - - [1408, 128, 1, 3328]
    - [42, 5678.01]
  - - [3584, 256, 1, 1280]
    - [83, 7380.81]
  - - [4, 128, 1, 128]
    - [90, 6.55327]
  - - [5888, 64, 1, 1280]
    - [58, 4531.27]
  - - [3584, 128, 1, 1280]
    - [80, 6009.86]
  - - [4, 256, 1, 1280]
    - [48, 232.81]
  - - [128, 704, 1, 3328]
    - [25, 4895.29]
  - - [4288, 6784, 1, 256]
    - [79, 9026.77]
  - - [3584, 2944, 1, 3328]
    - [73, 8545.61]
  - - [128, 1856, 1, 256]
    - [80, 3449.65]
  - - [64, 4288, 1, 256]
    - [28, 2529.1]
  - - [4, 3584, 1, 3328]
    - [96, 560.545]
  - - [64, 4, 1, 3328]
    - [96, 125.014]
  - - [4, 64, 1, 3328]
    - [96, 121.061]
  - - [5888, 2944, 1, 256]
    - [85, 9468.21]
  - - [1856, 64, 1, 256]
    - [74, 2022.19]
  - - [5056, 128, 1, 1280]
    - [80, 6202.27]
  - - [448, 4288, 1, 1280]
    - [75, 8384.5]
  - - [448, 1856, 1, 3328]
    - [75, 7376.76]
  - - [1024, 4288, 1, 128]
    - [66, 3715.6]
  - - [4, 1024, 1, 256]
    - [39, 214.477]
  - - [5056, 4288, 1, 256]
    - [85, 9063.04]
  - - [1024, 448, 1, 256]
    - [74, 4635.69]
  - - [1024, 3584, 1, 256]
    - [85, 7504.85]
  - - [2944, 128, 1, 1280]
    - [31, 5319.82]
  - - [2048, 32, 1, 2048]
    - [44, 1956.68]
  - - [64, 256, 1, 256]
    - [27, 808.852]
  - - [1408, 4, 1, 128]
    - [90, 71.5601]
  - - [128, 2368, 1, 128]
    - [7, 1947.02]
  - - [256, 704, 1, 1280]
    - [80, 3977.22]
  - - [64, 2368, 1, 128]
    - [9, 1392.93]
  - - [6784, 6784, 1, 3328]
    - [85, 8893.69]
  - - [448, 5888, 1, 1280]
    - [74, 8191.98]
  - - [5056, 448, 1, 128]
    - [69, 4286.93]
  - - [4288, 704, 1, 1280]
    - [80, 8304.79]
  - - [3584, 2944, 1, 128]
    - [66, 5061.65]
  - - [6784, 256, 1, 1280]
    - [80, 7991.82]
  - - [256, 2944, 1, 1280]
    - [74, 7602.39]
  - - [64, 4288, 1, 128]
    - [9, 1959.52]
  - - [2368, 5888, 1, 3328]
    - [79, 8699.78]
  - - [4, 64, 1, 256]
    - [39, 20.1062]
  - - [704, 1024, 1, 3328]
    - [74, 7924.5]
  - - [2368, 1856, 1, 1280]
    - [80, 8673.29]
  - - [448, 5056, 1, 3328]
    - [74, 8481.64]
  - - [128, 448, 1, 128]
    - [14, 651.897]
  - - [128, 6784, 1, 256]
    - [75, 4342.86]
  - - [3584, 4288, 1, 128]
    - [66, 5114.68]
  - - [64, 448, 1, 128]
    - [5, 341.683]
  - - [5888, 4288, 1, 3328]
    - [85, 8690.11]
  - - [2368, 704, 1, 256]
    - [85, 6051.72]
  - - [256, 1856, 1, 3328]
    - [80, 7365.85]
  - - [1856, 128, 1, 256]
    - [80, 3449.65]
  - - [6784, 128, 1, 128]
    - [68, 2942.09]
  - - [3584, 1408, 1, 128]
    - [69, 4478.53]
  - - [1856, 5056, 1, 1280]
    - [80, 8645.66]
  - - [2944, 1024, 1, 1280]
    - [85, 9565.12]
  - - [5056, 4, 1, 256]
    - [39, 367.853]
  - - [3584, 5888, 1, 3328]
    - [73, 8767.52]
  - - [2368, 4288, 1, 256]
    - [77, 8376.96]
  - - [1024, 2368, 1, 3328]
    - [75, 8604.33]
  - - [64, 704, 1, 3328]
    - [61, 3938.13]
  - - [704, 1408, 1, 256]
    - [81, 6391.02]
  - - [4096, 128, 1, 4096]
    - [47, 5040.01]
  - - [1024, 3584, 1, 1280]
    - [85, 8950.72]
  - - [4288, 5888, 1, 3328]
    - [85, 8741.01]
  - - [4288, 4, 1, 1280]
    - [39, 470.441]
  - - [4608, 16, 1, 1536]
    - [44, 1497.33]
  - - [5888, 64, 1, 128]
    - [22, 2114.11]
  - - [4, 5888, 1, 128]
    - [90, 222.385]
  - - [1024, 2944, 1, 3328]
    - [85, 9517.79]
  - - [6784, 1856, 1, 256]
    - [80, 8671.48]
  - - [2048, 64, 1, 2048]
    - [63, 2639.3]
  - - [256, 6784, 1, 1280]
    - [85, 7981.21]
  - - [1856, 3584, 1, 256]
    - [79, 8068.89]
  - - [128, 448, 1, 3328]
    - [37, 4329.86]
  - - [6784, 1856, 1, 128]
    - [69, 5337.78]
  - - [4, 448, 1, 256]
    - [39, 119.094]
  - - [5056, 128, 1, 256]
    - [80, 4157.1]
  - - [512, 24000, 1, 2816]
    - [72, 9061.96]
  - - [256, 5888, 1, 1280]
    - [77, 8420.88]
  - - [4, 128, 1, 1280]
    - [48, 130.109]
  - - [16384, 1600, 1, 4096]
    - [79, 7160.24]
  - - [6784, 128, 1, 1280]
    - [75, 6798.65]
  - - [64, 1408, 1, 256]
    - [28, 2022.24]
  - - [2368, 1408, 1, 128]
    - [67, 4371.17]
  - - [1856, 448, 1, 256]
    - [77, 5452.59]
  - - [1408, 1024, 1, 128]
    - [66, 3774.75]
  - - [128, 64, 1, 128]
    - [9, 100.395]
  - - [6784, 3584, 1, 3328]
    - [85, 8715.97]
  - - [1760, 7000, 1, 1760]
    - [73, 9155.32]
  - - [2944, 64, 1, 3328]
    - [32, 5310.46]
  - - [64, 64, 1, 128]
    - [6, 52.4262]
  - - [2368, 5056, 1, 1280]
    - [79, 8979.95]
  - - [64, 4, 1, 1280]
    - [48, 64.1127]
  - - [1408, 2368, 1, 1280]
    - [74, 8683.07]
  - - [128, 1408, 1, 1280]
    - [25, 4654.98]
  - - [256, 64, 1, 3328]
    - [64, 2512.2]
  - - [704, 4288, 1, 128]
    - [69, 4571.65]
  - - [128, 1856, 1, 3328]
    - [50, 6504.03]
  - - [2944, 2944, 1, 256]
    - [85, 8242.33]
  - - [2944, 4, 1, 1280]
    - [39, 459.327]
  - - [5888, 4, 1, 256]
    - [39, 349.323]
  - - [6784, 256, 1, 256]
    - [85, 6130.59]
  - - [256, 5056, 1, 3328]
    - [74, 8689.49]
  - - [128, 4288, 1, 1280]
    - [80, 5298.35]
  - - [5056, 1856, 1, 128]
    - [69, 5419.42]
  - - [5056, 1024, 1, 3328]
    - [85, 9353.4]
  - - [128, 128, 1, 256]
    - [27, 884.781]
  - - [1760, 64, 1, 1760]
    - [25, 5030.49]
  - - [4288, 3584, 1, 3328]
    - [85, 8837.07]
  - - [448, 704, 1, 3328]
    - [80, 5096.94]
  - - [448, 448, 1, 128]
    - [69, 1659.35]
  - - [1024, 2368, 1, 1280]
    - [83, 8301.91]
  - - [1856, 704, 1, 3328]
    - [80, 8540.98]
  - - [4, 2368, 1, 128]
    - [90, 119.468]
  - - [5888, 6784, 1, 3328]
    - [85, 8719.01]
  - - [704, 4288, 1, 1280]
    - [75, 9019.96]
  - - [704, 256, 1, 256]
    - [74, 3038.25]
  - - [1024, 48000, 1, 2048]
    - [79, 7889.92]
  - - [4288, 1024, 1, 128]
    - [69, 4962.23]
  - - [512, 2048, 1, 49]
    - [102, 3811.02]
  - - [512, 128, 1, 784]
    - [99, 3002.58]
  - - [2048, 512, 1, 49]
    - [103, 3669.75]
  - - [1024, 256, 1, 196]
    - [104, 3399.96]
  - - [256, 64, 1, 3136]
    - [98, 2719.97]
  - - [256, 1024, 1, 196]
    - [105, 3468.0]
  - - [64, 256, 1, 3136]
    - [100, 2763.34]
  - - [128, 512, 1, 784]
    - [97, 3002.58]
  - - [64, 64, 1, 3136]
    - [101, 750.646]
  - - [512, 3955, 1, 2048]
    - [133, 3897.55]
  - - [59, 59, 512, 64]
    - [255, 1677.38]
  - - [2048, 3462, 1, 512]
    - [193, 5947.31]
  - - [512, 3323, 1, 2048]
    - [141, 4633.86]
  - - [33708, 1599, 1, 512]
    - [137, 5066.49]
  - - [512, 3990, 1, 512]
    - [124, 4980.59]
  - - [33708, 1424, 1, 512]
    - [202, 3054.05]
  - - [33708, 3955, 1, 512]
    - [168, 6043.02]
  - - [512, 3478, 1, 2048]
    - [181, 5006.33]
  - - [512, 4012, 1, 2048]
    - [111, 3847.65]
  - - [33708, 1917, 1, 512]
    - [148, 4038.92]
  - - [2048, 3484, 1, 512]
    - [204, 5976.4]
  - - [10, 10, 448, 64]
    - [264, 153.593]
  - - [33708, 3776, 1, 512]
    - [199, 4768.72]
  - - [2048, 3428, 1, 512]
    - [198, 5891.05]
  - - [103, 104, 16, 64]
    - [219, 740.379]
  - - [512, 3977, 1, 2048]
    - [133, 3913.24]
  - - [512, 3458, 1, 2048]
    - [199, 5089.86]
  - - [512, 3479, 1, 2048]
    - [176, 5022.08]
  - - [33708, 1680, 1, 512]
    - [157, 3341.99]
  - - [512, 3968, 1, 2048]
    - [116, 3928.41]
  - - [512, 3450, 1, 2048]
    - [181, 5057.58]
  - - [91, 91, 40, 64]
    - [262, 1182.57]
  - - [85, 85, 376, 64]
    - [243, 2112.57]
  - - [2048, 3418, 1, 512]
    - [187, 5876.71]
  - - [2048, 3508, 1, 512]
    - [198, 6015.38]
  - - [33708, 4020, 1, 512]
    - [106, 4999.09]
  - - [512, 3445, 1, 2048]
    - [202, 5101.49]
  - - [80, 80, 152, 64]
    - [260, 1622.54]
  - - [33708, 3995, 1, 512]
    - [130, 5306.62]
  - - [33708, 3977, 1, 512]
    - [173, 6171.18]
  - - [33708, 4005, 1, 512]
    - [184, 6028.68]
  - - [512, 3443, 1, 2048]
    - [199, 5005.33]
  - - [33708, 1520, 1, 512]
    - [128, 3675.91]
  - - [512, 3483, 1, 2048]
    - [183, 5084.89]
  - - [33708, 644, 1, 512]
    - [162, 4457.54]
  - - [512, 3360, 1, 2048]
    - [183, 4772.9]
  - - [512, 3381, 1, 2048]
    - [197, 4996.27]
  - - [512, 3430, 1, 2048]
    - [169, 4687.47]
  - - [33708, 3968, 1, 512]
    - [134, 5271.99]
  - - [33708, 3822, 1, 512]
    - [129, 4870.24]
  - - [33708, 3944, 1, 512]
    - [131, 5089.75]
  - - [512, 3990, 1, 2048]
    - [133, 3948.53]
  - - [103, 103, 16, 64]
    - [225, 715.394]
  - - [512, 3575, 1, 2048]
    - [199, 5105.98]
  - - [2048, 3287, 1, 512]
    - [163, 5755.64]
  - - [2048, 3456, 1, 512]
    - [171, 5973.25]
  - - [512, 3969, 1, 2048]
    - [127, 3794.58]
  - - [33708, 1615, 1, 512]
    - [137, 5128.49]
  - - [84, 84, 152, 64]
    - [270, 1725.55]
  - - [512, 3456, 1, 2048]
    - [186, 4812.21]
  - - [512, 3477, 1, 2048]
    - [205, 5080.32]
  - - [33708, 4012, 1, 512]
    - [176, 4858.09]
  - - [33708, 3969, 1, 512]
    - [142, 5626.04]
  - - [33708, 3976, 1, 512]
    - [136, 5639.16]
  - - [33708, 4032, 1, 512]
    - [131, 5181.62]
  - - [512, 3448, 1, 2048]
    - [176, 5037.43]
  - - [512, 3262, 1, 2048]
    - [197, 4917.97]
  - - [2048, 3262, 1, 512]
    - [163, 5708.34]
  - - [2048, 4030, 1, 512]
    - [205, 5602.64]
  - - [512, 3462, 1, 2048]
    - [181, 5191.29]
  - - [2048, 3430, 1, 512]
    - [175, 5900.93]
  - - [512, 3489, 1, 2048]
    - [178, 5226.8]
  - - [512, 3438, 1, 2048]
    - [183, 5002.68]
  - - [17, 17, 1816, 64]
    - [259, 613.577]
  - - [2048, 3483, 1, 512]
    - [187, 5978.3]
  - - [512, 3468, 1, 2048]
    - [197, 5159.84]
  - - [2048, 3532, 1, 512]
    - [177, 6051.4]
  - - [2048, 4005, 1, 512]
    - [190, 5571.71]
  - - [2048, 3242, 1, 512]
    - [163, 5680.37]
  - - [33708, 980, 1, 512]
    - [176, 2517.01]
  - - [512, 3219, 1, 2048]
    - [199, 4793.91]
  - - [512, 3137, 1, 2048]
    - [166, 4661.5]
  - - [112, 123, 16, 64]
    - [272, 938.096]
  - - [512, 3268, 1, 2048]
    - [176, 4922.82]
  - - [512, 3342, 1, 2048]
    - [183, 4860.5]
  - - [512, 3369, 1, 2048]
    - [181, 4789.53]
  - - [27, 27, 1168, 64]
    - [237, 925.34]
  - - [77, 78, 408, 64]
    - [254, 1926.41]
  - - [2048, 3548, 1, 512]
    - [198, 6063.4]
  - - [512, 3523, 1, 2048]
    - [178, 5083.52]
  - - [2048, 3489, 1, 512]
    - [198, 5982.08]
  - - [123, 122, 264, 64]
    - [216, 2661.5]
  - - [512, 3427, 1, 2048]
    - [199, 5111.74]
  - - [2048, 3547, 1, 512]
    - [198, 6075.63]
  - - [33708, 264, 1, 512]
    - [135, 4754.01]
  - - [512, 3297, 1, 2048]
    - [178, 4767.62]
  - - [2048, 3796, 1, 512]
    - [163, 5622.44]
  - - [2048, 3995, 1, 512]
    - [201, 5564.91]
  - - [21, 21, 1488, 64]
    - [231, 729.658]
  - - [512, 3529, 1, 2048]
    - [176, 5100.49]
  - - [512, 3386, 1, 2048]
    - [194, 4613.09]
  - - [2048, 3870, 1, 512]
    - [165, 5609.96]
  - - [78, 78, 248, 64]
    - [238, 1742.76]
  - - [33708, 3864, 1, 512]
    - [202, 4796.11]
  - - [38, 38, 840, 64]
    - [228, 1144.07]
  - - [2048, 4012, 1, 512]
    - [167, 5588.04]
  - - [64, 64, 496, 64]
    - [212, 1836.05]
  - - [512, 3327, 1, 2048]
    - [199, 4824.31]
  - - [33708, 714, 1, 512]
    - [183, 2017.29]
  - - [2048, 3438, 1, 512]
    - [185, 5903.21]
  - - [16, 16, 712, 64]
    - [229, 449.941]
  - - [29, 29, 1088, 64]
    - [251, 990.654]
  - - [2048, 3360, 1, 512]
    - [182, 5805.91]
  - - [2048, 3443, 1, 512]
    - [177, 5916.82]
  - - [512, 3942, 1, 2048]
    - [156, 3954.95]
  - - [512, 3383, 1, 2048]
    - [197, 5090.09]
  - - [512, 3314, 1, 2048]
    - [199, 4736.56]
  - - [2048, 3876, 1, 512]
    - [189, 5693.87]
  - - [2048, 3575, 1, 512]
    - [175, 6094.83]
  - - [2048, 2864, 1, 512]
    - [156, 5585.69]
  - - [21, 21, 1472, 64]
    - [250, 730.269]
  - - [512, 3978, 1, 512]
    - [114, 4963.85]
  - - [2048, 3384, 1, 512]
    - [198, 5825.33]
  - - [33708, 3780, 1, 512]
    - [202, 4785.36]
  - - [512, 3414, 1, 2048]
    - [176, 5083.24]
  - - [2048, 3322, 1, 512]
    - [163, 5795.43]
  - - [2048, 3955, 1, 512]
    - [160, 5560.63]
  - - [512, 3969, 1, 512]
    - [113, 4936.95]
  - - [512, 3978, 1, 2048]
    - [160, 3942.17]
  - - [512, 3487, 1, 2048]
    - [183, 4984.82]
  - - [512, 4032, 1, 512]
    - [121, 4982.05]
  - - [512, 3420, 1, 2048]
    - [186, 4960.68]
  - - [512, 3378, 1, 2048]
    - [186, 4587.18]
  - - [512, 3431, 1, 2048]
    - [181, 5069.1]
  - - [512, 3822, 1, 512]
    - [113, 4796.26]
  - - [14, 14, 704, 64]
    - [269, 369.088]
  - - [512, 3194, 1, 2048]
    - [139, 4346.5]
  - - [512, 3336, 1, 2048]
    - [205, 4865.77]
  - - [512, 3461, 1, 2048]
    - [166, 5024.79]
  - - [122, 122, 264, 64]
    - [213, 2637.82]
  - - [512, 3906, 1, 512]
    - [113, 4879.18]
  - - [2048, 3468, 1, 512]
    - [193, 5967.76]
  - - [512, 3520, 1, 2048]
    - [169, 4896.5]
  - - [512, 3092, 1, 2048]
    - [202, 4546.9]
  - - [54, 54, 592, 64]
    - [267, 1560.1]
  - - [2048, 3859, 1, 512]
    - [169, 5690.16]
  - - [2048, 3996, 1, 512]
    - [171, 5570.14]
  - - [512, 3467, 1, 2048]
    - [178, 5144.3]
  - - [7, 7, 736, 64]
    - [237, 82.2118]
  - - [65, 65, 496, 64]
    - [269, 1588.2]
  - - [512, 3780, 1, 2048]
    - [117, 3878.74]
  - - [19, 19, 680, 64]
    - [249, 565.571]
  - - [16, 16, 1920, 64]
    - [225, 570.018]
  - - [2048, 3422, 1, 512]
    - [198, 5887.17]
  - - [70, 71, 216, 64]
    - [268, 1518.0]
  - - [41, 41, 312, 64]
    - [107, 998.088]
  - - [512, 3538, 1, 2048]
    - [181, 5129.74]
  - - [512, 3996, 1, 512]
    - [124, 4974.04]
  - - [35, 35, 904, 64]
    - [227, 1065.44]
  - - [33708, 3910, 1, 512]
    - [183, 4867.52]
  - - [512, 3495, 1, 2048]
    - [202, 5155.04]
  - - [2048, 3495, 1, 512]
    - [174, 5993.09]
  - - [512, 3428, 1, 2048]
    - [166, 4898.5]
  - - [33708, 1232, 1, 512]
    - [183, 2868.48]
  - - [512, 3242, 1, 2048]
    - [197, 4962.88]
  - - [2048, 3458, 1, 512]
    - [204, 5954.17]
  - - [2048, 3501, 1, 512]
    - [204, 6002.65]
  - - [512, 3870, 1, 512]
    - [113, 4865.12]
  - - [2048, 3374, 1, 512]
    - [177, 5815.9]
  - - [512, 3385, 1, 2048]
    - [197, 5058.15]
  - - [2048, 3780, 1, 512]
    - [170, 5420.1]
  - - [2048, 2790, 1, 512]
    - [147, 5502.78]
  - - [512, 3490, 1, 2048]
    - [178, 5117.28]
  - - [2048, 3538, 1, 512]
    - [193, 6034.66]
  - - [18, 18, 648, 64]
    - [260, 525.784]
  - - [512, 3976, 1, 512]
    - [124, 4963.11]
  - - [512, 3511, 1, 2048]
    - [202, 5162.51]
  - - [512, 3539, 1, 2048]
    - [172, 5059.16]
  - - [512, 3332, 1, 2048]
    - [166, 4612.33]
  - - [13, 13, 2336, 64]
    - [268, 477.707]
  - - [512, 3484, 1, 2048]
    - [186, 4937.65]
  - - [26, 27, 56, 64]
    - [265, 186.624]
  - - [2048, 3533, 1, 512]
    - [187, 6053.85]
  - - [512, 4030, 1, 512]
    - [113, 4981.33]
  - - [512, 3390, 1, 2048]
    - [176, 4880.16]
  - - [2048, 3137, 1, 512]
    - [163, 5512.08]
  - - [33708, 3796, 1, 512]
    - [181, 4790.0]
  - - [512, 3925, 1, 512]
    - [125, 4885.66]
  - - [77, 77, 408, 64]
    - [242, 1886.27]
  - - [2048, 3528, 1, 512]
    - [171, 6033.6]
  - - [2048, 3376, 1, 512]
    - [177, 5827.15]
  - - [2048, 3268, 1, 512]
    - [175, 5649.01]
  - - [11, 11, 568, 64]
    - [222, 208.346]
  - - [33708, 3990, 1, 512]
    - [181, 4849.07]
  - - [512, 3608, 1, 2048]
    - [132, 4177.37]
  - - [2048, 3166, 1, 512]
    - [163, 5552.02]
  - - [2048, 3342, 1, 512]
    - [182, 5793.18]
  - - [33708, 3840, 1, 512]
    - [203, 4860.34]
  - - [77, 77, 248, 64]
    - [261, 1735.49]
  - - [2048, 3498, 1, 512]
    - [198, 5990.97]
  - - [512, 3859, 1, 2048]
    - [152, 4148.67]
  - - [33708, 2418, 1, 512]
    - [197, 6421.43]
  - - [2048, 3969, 1, 512]
    - [190, 5549.44]
  - - [2048, 3396, 1, 512]
    - [167, 5843.86]
  - - [2048, 3518, 1, 512]
    - [175, 6022.31]
  - - [512, 3598, 1, 2048]
    - [123, 4105.35]
  - - [2048, 3369, 1, 512]
    - [180, 5808.69]
  - - [33708, 3835, 1, 512]
    - [202, 4852.49]
  - - [512, 4005, 1, 2048]
    - [122, 3980.63]
  - - [512, 3501, 1, 2048]
    - [183, 5234.25]
  - - [512, 3447, 1, 2048]
    - [199, 4978.93]
  - - [2048, 3439, 1, 512]
    - [177, 5907.08]
  - - [2048, 3358, 1, 512]
    - [198, 5807.41]
  - - [33708, 781, 1, 512]
    - [144, 5383.57]
  - - [33708, 3870, 1, 512]
    - [202, 4802.97]
  - - [2048, 3968, 1, 512]
    - [177, 5559.58]
  - - [2048, 3477, 1, 512]
    - [201, 5971.63]
  - - [2048, 3237, 1, 512]
    - [187, 5600.89]
  - - [2048, 3410, 1, 512]
    - [204, 5857.98]
  - - [512, 3412, 1, 2048]
    - [205, 5053.15]
  - - [512, 3944, 1, 2048]
    - [156, 3984.07]
  - - [512, 3453, 1, 2048]
    - [205, 5033.3]
  - - [512, 3307, 1, 2048]
    - [176, 4769.9]
  - - [2048, 3251, 1, 512]
    - [177, 5629.24]
  - - [2048, 3385, 1, 512]
    - [177, 5830.6]
  - - [512, 3457, 1, 2048]
    - [178, 4958.96]
  - - [2048, 3323, 1, 512]
    - [167, 5738.47]
  - - [512, 3995, 1, 512]
    - [125, 4964.07]
  - - [512, 3532, 1, 2048]
    - [202, 5218.32]
  - - [512, 3517, 1, 2048]
    - [176, 5163.82]
  - - [2048, 3455, 1, 512]
    - [167, 5948.28]
  - - [33708, 720, 1, 512]
    - [146, 5660.07]
  - - [2048, 3427, 1, 512]
    - [167, 5907.25]
  - - [512, 3796, 1, 2048]
    - [118, 4029.22]
  - - [2048, 3257, 1, 512]
    - [167, 5632.05]
  - - [33708, 4030, 1, 512]
    - [183, 4908.72]
  - - [29, 29, 136, 64]
    - [258, 494.081]
  - - [2048, 3457, 1, 512]
    - [193, 5961.14]
  - - [512, 3514, 1, 2048]
    - [197, 5216.77]
  - - [512, 3364, 1, 2048]
    - [205, 4997.75]
  - - [512, 2790, 1, 2048]
    - [179, 4644.66]
  - - [15, 15, 688, 64]
    - [263, 399.234]
  - - [33708, 3925, 1, 512]
    - [202, 4867.96]
  - - [104, 104, 16, 64]
    - [271, 747.593]
  - - [33708, 3996, 1, 512]
    - [188, 6016.88]
  - - [2048, 4026, 1, 512]
    - [187, 5613.06]
  - - [2048, 3511, 1, 512]
    - [198, 6021.26]
  - - [2048, 3523, 1, 512]
    - [198, 6038.91]
  - - [54, 54, 200, 64]
    - [209, 1262.83]
  - - [112, 112, 16, 64]
    - [218, 862.721]
  - - [512, 3876, 1, 512]
    - [125, 4831.47]
  - - [2048, 3517, 1, 512]
    - [204, 6028.62]
  - - [512, 3876, 1, 2048]
    - [109, 4015.97]
  - - [12, 12, 480, 64]
    - [221, 226.2]
  - - [2048, 3450, 1, 512]
    - [177, 5925.97]
  - - [2048, 3976, 1, 512]
    - [165, 5654.74]
  - - [112, 112, 288, 64]
    - [214, 2529.38]
  - - [2048, 3402, 1, 512]
    - [185, 5850.63]
  - - [59, 59, 544, 64]
    - [254, 1700.7]
  - - [78, 78, 408, 64]
    - [258, 1921.7]
  - - [512, 3480, 1, 2048]
    - [178, 5118.52]
  - - [512, 3491, 1, 2048]
    - [202, 5123.52]
  - - [102, 102, 312, 64]
    - [212, 2208.28]
  - - [512, 3944, 1, 512]
    - [124, 4924.91]
  - - [512, 3391, 1, 2048]
    - [172, 4877.14]
  - - [2048, 3539, 1, 512]
    - [177, 6057.53]
  - - [65, 65, 472, 64]
    - [245, 1583.58]
  - - [2048, 3332, 1, 512]
    - [193, 5746.3]
  - - [33708, 540, 1, 512]
    - [164, 5065.66]
  - - [512, 3165, 1, 2048]
    - [183, 4815.32]
  - - [2048, 3470, 1, 512]
    - [204, 5958.16]
  - - [2048, 3497, 1, 512]
    - [177, 5998.7]
  - - [2048, 3480, 1, 512]
    - [198, 5970.98]
  - - [2048, 3365, 1, 512]
    - [174, 5803.21]
  - - [25, 25, 1256, 64]
    - [248, 858.51]
  - - [2048, 3530, 1, 512]
    - [177, 6034.1]
  - - [2048, 3319, 1, 512]
    - [155, 5801.63]
  - - [2048, 3297, 1, 512]
    - [155, 5760.33]
  - - [512, 3840, 1, 512]
    - [113, 4829.12]
  - - [2048, 3491, 1, 512]
    - [174, 5992.03]
  - - [512, 3910, 1, 2048]
    - [158, 4323.34]
  - - [2048, 3371, 1, 512]
    - [177, 5816.39]
  - - [45, 45, 712, 64]
    - [226, 1348.14]
  - - [2048, 3282, 1, 512]
    - [198, 5682.92]
  - - [512, 3325, 1, 2048]
    - [181, 4833.79]
  - - [512, 3286, 1, 2048]
    - [178, 4944.14]
  - - [2048, 3514, 1, 512]
    - [177, 6022.75]
  - - [33708, 1596, 1, 512]
    - [174, 3275.0]
  - - [71, 71, 448, 64]
    - [253, 1777.03]
  - - [2048, 3382, 1, 512]
    - [174, 5840.36]
  - - [33708, 1350, 1, 512]
    - [205, 3034.1]
  - - [2048, 3391, 1, 512]
    - [180, 5835.96]
  - - [91, 93, 40, 64]
    - [250, 1208.56]
  - - [33708, 2496, 1, 512]
    - [143, 6034.42]
  - - [33708, 189, 1, 512]
    - [149, 5700.9]
  - - [135, 134, 240, 64]
    - [241, 2490.73]
  - - [2048, 3507, 1, 512]
    - [174, 6020.23]
  - - [2048, 3509, 1, 512]
    - [193, 6008.36]
  - - [2048, 3388, 1, 512]
    - [198, 5837.19]
  - - [33708, 3942, 1, 512]
    - [202, 4892.62]
  - - [2048, 3399, 1, 512]
    - [182, 5861.13]
  - - [2048, 3529, 1, 512]
    - [175, 6043.34]
  - - [2048, 3386, 1, 512]
    - [167, 5831.61]
  - - [27, 27, 56, 64]
    - [234, 189.631]
  - - [512, 3324, 1, 2048]
    - [199, 4798.82]
  - - [512, 3518, 1, 2048]
    - [197, 5121.72]
  - - [512, 3440, 1, 2048]
    - [178, 5114.96]
  - - [33708, 468, 1, 512]
    - [179, 5330.79]
  - - [512, 3459, 1, 2048]
    - [176, 5157.29]
  - - [512, 3548, 1, 2048]
    - [140, 4461.11]
  - - [45, 45, 392, 64]
    - [256, 1237.96]
  - - [33708, 3876, 1, 512]
    - [205, 4829.71]
  - - [19, 19, 1632, 64]
    - [261, 681.408]
  - - [512, 3322, 1, 2048]
    - [183, 4706.18]
  - - [2048, 3165, 1, 512]
    - [155, 5559.9]
  - - [77, 78, 248, 64]
    - [240, 1753.24]
  - - [512, 3422, 1, 2048]
    - [202, 5108.05]
  - - [512, 3470, 1, 2048]
    - [183, 4994.82]
  - - [135, 135, 240, 64]
    - [252, 2492.76]
  - - [512, 3475, 1, 2048]
    - [183, 4926.38]
  - - [2048, 3925, 1, 512]
    - [154, 5510.24]
  - - [512, 3358, 1, 2048]
    - [197, 4784.95]
  - - [512, 3528, 1, 2048]
    - [191, 5060.3]
  - - [512, 3859, 1, 512]
    - [125, 4803.52]
  - - [512, 3396, 1, 2048]
    - [183, 4989.79]
  - - [512, 3497, 1, 2048]
    - [199, 5166.61]
  - - [512, 3439, 1, 2048]
    - [181, 5102.75]
  - - [512, 3237, 1, 2048]
    - [183, 5009.94]
  - - [102, 102, 56, 64]
    - [207, 1511.62]
  - - [23, 23, 1360, 64]
    - [233, 804.11]
  - - [512, 3402, 1, 2048]
    - [183, 5126.85]
  - - [12, 12, 2520, 64]
    - [232, 427.724]
  - - [512, 3365, 1, 2048]
    - [183, 5078.66]
  - - [512, 3507, 1, 2048]
    - [197, 5118.87]
  - - [33708, 560, 1, 512]
    - [153, 5382.44]
  - - [71, 71, 216, 64]
    - [230, 1524.69]
  - - [512, 3508, 1, 2048]
    - [183, 5215.52]
  - - [2048, 3440, 1, 512]
    - [198, 5918.86]
  - - [512, 3451, 1, 2048]
    - [205, 4949.35]
  - - [33708, 2205, 1, 512]
    - [201, 6064.82]
  - - [2048, 3520, 1, 512]
    - [195, 6026.47]
  - - [512, 3415, 1, 2048]
    - [199, 4970.24]
  - - [512, 3249, 1, 2048]
    - [205, 4890.55]
  - - [33708, 1462, 1, 512]
    - [161, 3131.51]
  - - [2048, 3381, 1, 512]
    - [187, 5829.38]
  - - [512, 3319, 1, 2048]
    - [199, 4886.79]
  - - [2048, 3999, 1, 512]
    - [165, 5649.43]
  - - [512, 3942, 1, 512]
    - [109, 4898.22]
  - - [512, 3460, 1, 2048]
    - [205, 5162.05]
  - - [2048, 3977, 1, 512]
    - [190, 5539.84]
  - - [512, 3503, 1, 2048]
    - [199, 5091.51]
  - - [512, 3344, 1, 2048]
    - [197, 4951.93]
  - - [18, 18, 1720, 64]
    - [236, 640.259]
  - - [512, 3234, 1, 2048]
    - [197, 4894.0]
  - - [33708, 493, 1, 512]
    - [138, 5592.58]
  - - [512, 3432, 1, 2048]
    - [178, 5087.03]
  - - [9, 9, 416, 64]
    - [257, 118.342]
  - - [2048, 3466, 1, 512]
    - [193, 5957.79]
  - - [512, 3999, 1, 2048]
    - [115, 4076.27]
  - - [512, 4032, 1, 2048]
    - [110, 3950.6]
  - - [512, 3541, 1, 2048]
    - [205, 5044.19]
  - - [32, 32, 624, 64]
    - [252, 1000.11]
  - - [2048, 3314, 1, 512]
    - [163, 5795.75]
  - - [26, 26, 56, 64]
    - [257, 179.705]
  - - [512, 4020, 1, 512]
    - [120, 4993.38]
  - - [512, 3822, 1, 2048]
    - [112, 4048.02]
  - - [512, 3315, 1, 2048]
    - [186, 4526.38]
  - - [512, 3481, 1, 2048]
    - [205, 5220.89]
  - - [512, 3547, 1, 2048]
    - [183, 5212.19]
  - - [512, 3906, 1, 2048]
    - [119, 4042.91]
  - - [2048, 3415, 1, 512]
    - [177, 5873.7]
  - - [123, 123, 264, 64]
    - [214, 2666.75]
  - - [2048, 3487, 1, 512]
    - [195, 5977.92]
  - - [512, 3376, 1, 2048]
    - [199, 5116.54]
  - - [33708, 550, 1, 512]
    - [160, 5220.85]
  - - [2048, 3840, 1, 512]
    - [139, 5467.37]
  - - [512, 3494, 1, 2048]
    - [178, 5186.54]
  - - [33708, 3999, 1, 512]
    - [200, 4855.63]
  - - [93, 93, 40, 64]
    - [233, 1215.03]
  - - [2048, 3378, 1, 512]
    - [193, 5827.76]
  - - [2048, 3460, 1, 512]
    - [193, 5949.65]
  - - [512, 3287, 1, 2048]
    - [186, 4741.54]
  - - [2048, 3219, 1, 512]
    - [163, 5642.86]
  - - [512, 3780, 1, 512]
    - [113, 4758.74]
  - - [2048, 3552, 1, 512]
    - [167, 6073.18]
  - - [2048, 3608, 1, 512]
    - [141, 5545.93]
  - - [512, 3371, 1, 2048]
    - [199, 4870.64]
  - - [512, 4012, 1, 512]
    - [124, 4995.71]
  - - [512, 3384, 1, 2048]
    - [183, 5167.95]
  - - [2048, 3503, 1, 512]
    - [175, 6009.71]
  - - [512, 3166, 1, 2048]
    - [178, 4766.13]
  - - [512, 3425, 1, 2048]
    - [205, 5107.14]
  - - [2048, 3344, 1, 512]
    - [182, 5774.03]
  - - [512, 3509, 1, 2048]
    - [197, 5098.14]
  - - [512, 3282, 1, 2048]
    - [178, 4905.8]
  - - [512, 3996, 1, 2048]
    - [126, 4016.24]
  - - [512, 4050, 1, 512]
    - [125, 4656.36]
  - - [2048, 3476, 1, 512]
    - [182, 5987.35]
  - - [512, 3329, 1, 2048]
    - [186, 4740.29]
  - - [512, 3374, 1, 2048]
    - [199, 5032.16]
  - - [2048, 3414, 1, 512]
    - [198, 5888.43]
  - - [32, 32, 992, 64]
    - [251, 1068.98]
  - - [512, 3498, 1, 2048]
    - [202, 5151.42]
  - - [2048, 3325, 1, 512]
    - [175, 5734.23]
  - - [2048, 3479, 1, 512]
    - [204, 5969.99]
  - - [33708, 4026, 1, 512]
    - [199, 4856.19]
  - - [512, 3519, 1, 2048]
    - [183, 5196.94]
  - - [512, 3870, 1, 2048]
    - [127, 3954.47]
  - - [2048, 3412, 1, 512]
    - [175, 5852.89]
  - - [2048, 4020, 1, 512]
    - [204, 5604.15]
  - - [512, 3455, 1, 2048]
    - [176, 5110.96]
  - - [2048, 3234, 1, 512]
    - [163, 5686.76]
  - - [33708, 936, 1, 512]
    - [157, 2432.18]
  - - [119, 119, 32, 64]
    - [215, 1444.67]
  - - [512, 3976, 1, 2048]
    - [122, 3928.64]
  - - [512, 3534, 1, 2048]
    - [202, 5194.7]
  - - [35, 35, 384, 64]
    - [210, 883.51]
  - - [512, 3418, 1, 2048]
    - [169, 4822.87]
  - - [41, 41, 776, 64]
    - [224, 1229.02]
  - - [512, 3339, 1, 2048]
    - [205, 4972.1]
  - - [33708, 3906, 1, 512]
    - [179, 4832.33]
  - - [512, 4026, 1, 512]
    - [108, 4990.32]
  - - [512, 3452, 1, 2048]
    - [202, 4966.38]
  - - [512, 3471, 1, 2048]
    - [205, 5186.11]
  - - [512, 4030, 1, 2048]
    - [110, 4012.53]
  - - [2048, 3459, 1, 512]
    - [174, 5945.04]
  - - [2048, 3534, 1, 512]
    - [198, 6045.32]
  - - [512, 3925, 1, 2048]
    - [125, 4054.27]
  - - [17, 17, 688, 64]
    - [244, 489.423]
  - - [33708, 3859, 1, 512]
    - [166, 6135.51]
  - - [512, 3382, 1, 2048]
    - [183, 5149.34]
  - - [23, 23, 64, 64]
    - [266, 157.258]
  - - [512, 3977, 1, 512]
    - [125, 4957.37]
  - - [93, 93, 344, 64]
    - [247, 2250.92]
  - - [512, 2864, 1, 2048]
    - [192, 4164.89]
  - - [512, 3466, 1, 2048]
    - [199, 5143.89]
  - - [512, 3293, 1, 2048]
    - [205, 4604.27]
  - - [512, 3999, 1, 512]
    - [124, 4988.3]
  - - [33708, 3978, 1, 512]
    - [196, 5941.4]
  - - [2048, 3598, 1, 512]
    - [159, 5295.93]
  - - [512, 3476, 1, 2048]
    - [166, 4742.1]
  - - [15, 15, 2048, 64]
    - [220, 537.999]
  - - [2048, 3519, 1, 512]
    - [195, 6023.3]
  - - [512, 3552, 1, 2048]
    - [199, 5084.93]
  - - [2048, 3978, 1, 512]
    - [180, 5549.97]
  - - [2048, 3339, 1, 512]
    - [193, 5780.2]
  - - [2048, 3452, 1, 512]
    - [167, 5922.94]
  - - [2048, 3541, 1, 512]
    - [185, 6049.98]
  - - [2048, 3293, 1, 512]
    - [163, 5753.34]
  - - [2048, 3113, 1, 512]
    - [155, 5860.57]
  - - [2048, 4032, 1, 512]
    - [163, 5968.87]
  - - [512, 3493, 1, 2048]
    - [199, 5126.99]
  - - [512, 3377, 1, 2048]
    - [145, 4608.37]
  - - [512, 3426, 1, 2048]
    - [202, 5116.72]
  - - [2048, 3420, 1, 512]
    - [167, 5896.63]
  - - [512, 3968, 1, 512]
    - [113, 4951.38]
  - - [2048, 3499, 1, 512]
    - [204, 6007.95]
  - - [512, 4005, 1, 512]
    - [114, 4983.49]
  - - [2048, 3432, 1, 512]
    - [204, 5897.2]
  - - [2048, 3431, 1, 512]
    - [187, 5899.07]
  - - [512, 3246, 1, 2048]
    - [178, 4824.99]
  - - [2048, 3493, 1, 512]
    - [174, 5996.19]
  - - [512, 3599, 1, 2048]
    - [151, 4131.47]
  - - [33708, 1458, 1, 512]
    - [178, 3116.52]
  - - [512, 3995, 1, 2048]
    - [122, 4054.97]
  - - [2048, 3478, 1, 512]
    - [177, 5958.88]
  - - [2048, 3822, 1, 512]
    - [169, 5655.63]
  - - [512, 3796, 1, 512]
    - [114, 4767.01]
  - - [2048, 3377, 1, 512]
    - [193, 5820.36]
  - - [2048, 3910, 1, 512]
    - [165, 5609.35]
  - - [2048, 3327, 1, 512]
    - [163, 5787.03]
  - - [2048, 3315, 1, 512]
    - [187, 5728.15]
  - - [2048, 3426, 1, 512]
    - [204, 5881.9]
  - - [2048, 3336, 1, 512]
    - [193, 5755.3]
  - - [2048, 3447, 1, 512]
    - [167, 5924.42]
  - - [38, 38, 320, 64]
    - [206, 924.131]
  - - [512, 3955, 1, 512]
    - [125, 4933.42]
  - - [2048, 3194, 1, 512]
    - [195, 5519.74]
  - - [33708, 184, 1, 512]
    - [150, 5286.57]
  - - [2048, 3490, 1, 512]
    - [204, 6000.5]
  - - [512, 3388, 1, 2048]
    - [186, 4871.34]
  - - [512, 3533, 1, 2048]
    - [181, 5186.77]
  - - [2048, 3390, 1, 512]
    - [204, 5844.19]
  - - [2048, 3329, 1, 512]
    - [182, 5750.24]
  - - [2048, 3307, 1, 512]
    - [167, 5716.42]
  - - [2048, 3461, 1, 512]
    - [174, 5942.71]
  - - [512, 3399, 1, 2048]
    - [176, 5093.05]
  - - [2048, 3364, 1, 512]
    - [198, 5810.69]
  - - [49, 49, 648, 64]
    - [259, 1442.29]
  - - [512, 4059, 1, 512]
    - [125, 4663.68]
  - - [512, 3113, 1, 2048]
    - [139, 4399.97]
  - - [25, 25, 176, 64]
    - [270, 482.423]
  - - [2048, 3942, 1, 512]
    - [153, 5544.0]
  - - [33708, 1290, 1, 512]
    - [205, 2899.25]
  - - [33708, 465, 1, 512]
    - [179, 5294.03]
  - - [2048, 3445, 1, 512]
    - [187, 5923.86]
  - - [2048, 3906, 1, 512]
    - [160, 5527.98]
  - - [2048, 3324, 1, 512]
    - [163, 5799.63]
  - - [512, 3927, 1, 512]
    - [124, 4907.14]
  - - [2048, 3475, 1, 512]
    - [187, 5965.3]
  - - [14, 14, 2184, 64]
    - [246, 507.321]
  - - [13, 13, 576, 64]
    - [240, 291.013]
  - - [2048, 3944, 1, 512]
    - [147, 5763.26]
  - - [512, 3499, 1, 2048]
    - [202, 5081.52]
  - - [2048, 3222, 1, 512]
    - [155, 5648.12]
  - - [2048, 3451, 1, 512]
    - [198, 5933.45]
  - - [2048, 3249, 1, 512]
    - [163, 5639.57]
  - - [80, 84, 152, 64]
    - [235, 1674.56]
  - - [70, 70, 216, 64]
    - [253, 1513.96]
  - - [512, 4020, 1, 2048]
    - [122, 4000.32]
  - - [2048, 3481, 1, 512]
    - [204, 5977.05]
  - - [512, 3530, 1, 2048]
    - [202, 5182.37]
  - - [512, 3472, 1, 2048]
    - [202, 5115.26]
  - - [512, 3840, 1, 2048]
    - [114, 4061.61]
  - - [512, 3910, 1, 512]
    - [124, 4887.62]
  - - [512, 3410, 1, 2048]
    - [183, 5104.67]
  - - [2048, 3425, 1, 512]
    - [167, 5899.49]
  - - [2048, 3990, 1, 512]
    - [201, 5567.81]
  - - [2048, 3092, 1, 512]
    - [163, 5831.11]
  - - [123, 123, 16, 64]
    - [254, 972.724]
  - - [512, 4026, 1, 2048]
    - [165, 4155.26]
  - - [2048, 3471, 1, 512]
    - [167, 5950.49]
  - - [512, 3515, 1, 2048]
    - [205, 5255.74]
  - - [135, 135, 32, 64]
    - [217, 1517.7]
  - - [2048, 3453, 1, 512]
    - [167, 5938.33]
  - - [2048, 3564, 1, 512]
    - [187, 6098.85]
  - - [2048, 3246, 1, 512]
    - [182, 5633.67]
  - - [49, 49, 160, 64]
    - [208, 1063.81]
  - - [512, 3222, 1, 2048]
    - [178, 4789.81]
  - - [33708, 208, 1, 512]
    - [144, 5004.17]
  - - [119, 135, 32, 64]
    - [223, 1475.59]
  - - [512, 3251, 1, 2048]
    - [197, 4969.13]
  - - [134, 134, 240, 64]
    - [252, 2459.21]
  - - [512, 3257, 1, 2048]
    - [145, 4530.66]
  - - [64, 65, 496, 64]
    - [211, 1791.66]
  - - [2048, 3383, 1, 512]
    - [204, 5841.37]
  - - [2048, 3494, 1, 512]
    - [174, 5997.92]
  - - [2048, 3472, 1, 512]
    - [182, 5970.29]
  - - [2048, 3467, 1, 512]
    - [174, 5959.51]
  - - [2048, 3515, 1, 512]
    - [167, 6033.96]
  - - [512, 3564, 1, 2048]
    - [181, 4960.15]
  - - [8, 8, 264, 64]
    - [239, 68.2128]
  - - [33708, 246, 1, 512]
    - [195, 5470.43]
  - - [2048, 3286, 1, 512]
    - [182, 5691.23]
  - - [2048, 3448, 1, 512]
    - [195, 5932.62]
  - - [2048, 3599, 1, 512]
    - [141, 5553.81]
  - - [4096, 64, 1, 1024]
    - [273, 2702.28]
  - - [4096, 6400, 1, 256]
    - [274, 5439.79]
  - - [1024, 128, 1, 128]
    - [291, 1356.23]
  - - [4, 704, 1, 1280]
    - [369, 374.297]
  - - [4, 1856, 1, 3328]
    - [371, 517.106]
  - - [1856, 448, 1, 3328]
    - [358, 7357.87]
  - - [2944, 4288, 1, 1280]
    - [360, 8917.24]
  - - [2368, 64, 1, 3328]
    - [306, 5348.57]
  - - [1760, 32, 1, 1760]
    - [328, 3558.86]
  - - [2368, 5888, 1, 256]
    - [360, 8635.26]
  - - [5888, 1856, 1, 256]
    - [360, 8778.8]
  - - [128, 64, 1, 256]
    - [319, 435.591]
  - - [512, 24000, 1, 1536]
    - [354, 8792.13]
  - - [128, 6784, 1, 3328]
    - [356, 7498.0]
  - - [5888, 1408, 1, 256]
    - [360, 8703.02]
  - - [5888, 1856, 1, 3328]
    - [360, 8733.67]
  - - [5056, 704, 1, 256]
    - [360, 7081.72]
  - - [2048, 400, 1, 512]
    - [352, 4338.81]
  - - [5888, 2944, 1, 3328]
    - [348, 8878.71]
  - - [1856, 4288, 1, 256]
    - [355, 8276.8]
  - - [1024, 5056, 1, 128]
    - [344, 3951.49]
  - - [5056, 5056, 1, 3328]
    - [360, 8830.54]
  - - [1408, 5888, 1, 1280]
    - [360, 9816.48]
  - - [2368, 448, 1, 128]
    - [341, 3279.29]
  - - [2368, 6784, 1, 128]
    - [341, 5473.99]
  - - [1024, 3584, 1, 3328]
    - [358, 8993.69]
  - - [512, 48000, 1, 2048]
    - [354, 7539.54]
  - - [128, 448, 1, 1280]
    - [328, 3206.72]
  - - [256, 4288, 1, 3328]
    - [349, 7345.42]
  - - [5888, 1408, 1, 1280]
    - [354, 9478.72]
  - - [704, 1856, 1, 3328]
    - [355, 8393.22]
  - - [4, 1408, 1, 128]
    - [365, 72.6234]
  - - [1024, 2368, 1, 256]
    - [360, 6148.15]
  - - [64, 4, 1, 256]
    - [369, 17.0135]
  - - [1408, 1856, 1, 1280]
    - [352, 8984.38]
  - - [1408, 64, 1, 1280]
    - [332, 3716.2]
  - - [448, 1024, 1, 1280]
    - [349, 6734.94]
  - - [6144, 24000, 1, 2048]
    - [360, 7639.24]
  - - [4096, 32, 1, 4096]
    - [320, 2420.69]
  - - [256, 1408, 1, 3328]
    - [349, 5802.12]
  - - [5056, 5056, 1, 1280]
    - [348, 9023.66]
  - - [448, 5056, 1, 256]
    - [352, 6622.57]
  - - [704, 1856, 1, 1280]
    - [355, 7894.32]
  - - [128, 5056, 1, 128]
    - [282, 2570.76]
  - - [2368, 128, 1, 256]
    - [349, 3688.4]
  - - [1760, 6400, 1, 1760]
    - [348, 9987.47]
  - - [1856, 1408, 1, 128]
    - [341, 4650.39]
  - - [64, 5056, 1, 256]
    - [304, 2547.32]
  - - [6784, 256, 1, 3328]
    - [355, 8121.59]
  - - [6784, 4288, 1, 3328]
    - [360, 8574.31]
  - - [4288, 448, 1, 256]
    - [358, 6204.55]
  - - [64, 704, 1, 128]
    - [291, 536.93]
  - - [1856, 2368, 1, 3328]
    - [355, 8532.59]
  - - [4288, 2944, 1, 1280]
    - [350, 8827.39]
  - - [704, 5056, 1, 1280]
    - [350, 9197.68]
  - - [2368, 704, 1, 3328]
    - [354, 7954.1]
  - - [256, 5888, 1, 256]
    - [359, 5912.81]
  - - [1856, 4288, 1, 3328]
    - [360, 8898.92]
  - - [256, 2944, 1, 256]
    - [355, 5157.6]
  - - [5888, 1024, 1, 256]
    - [360, 8374.84]
  - - [448, 64, 1, 1280]
    - [328, 2315.1]
  - - [3072, 64, 1, 1024]
    - [320, 2367.43]
  - - [3584, 4, 1, 1280]
    - [314, 462.16]
  - - [16384, 3200, 1, 4096]
    - [354, 7796.56]
  - - [2944, 64, 1, 256]
    - [349, 2679.62]
  - - [128, 4, 1, 1280]
    - [323, 128.213]
  - - [1408, 2944, 1, 256]
    - [360, 7543.55]
  - - [256, 1856, 1, 1280]
    - [355, 6757.26]
  - - [6784, 5056, 1, 3328]
    - [348, 8694.1]
  - - [5056, 5056, 1, 256]
    - [360, 9180.44]
  - - [1408, 6784, 1, 128]
    - [341, 5397.35]
  - - [64, 1024, 1, 1280]
    - [328, 3421.2]
  - - [2944, 4, 1, 256]
    - [302, 376.832]
  - - [704, 5056, 1, 128]
    - [342, 4663.01]
  - - [4, 2368, 1, 1280]
    - [323, 471.665]
  - - [2368, 2944, 1, 1280]
    - [354, 9313.58]
  - - [128, 3584, 1, 1280]
    - [355, 6018.98]
  - - [6784, 6784, 1, 1280]
    - [360, 8934.65]
  - - [1024, 256, 1, 3328]
    - [355, 5984.36]
  - - [1408, 4288, 1, 1280]
    - [354, 9466.0]
  - - [3584, 4288, 1, 1280]
    - [360, 9157.35]
  - - [2368, 704, 1, 1280]
    - [355, 7791.75]
  - - [5056, 4288, 1, 3328]
    - [360, 8547.21]
  - - [3584, 2368, 1, 3328]
    - [354, 8377.19]
  - - [64, 704, 1, 1280]
    - [328, 2648.1]
  - - [4288, 256, 1, 256]
    - [357, 4609.5]
  - - [2944, 128, 1, 128]
    - [341, 2268.79]
  - - [6144, 32, 1, 2560]
    - [320, 3015.79]
  - - [6784, 448, 1, 1280]
    - [358, 9038.94]
  - - [1408, 2944, 1, 128]
    - [342, 4396.93]
  - - [4288, 2944, 1, 256]
    - [355, 8623.59]
  - - [5888, 704, 1, 1280]
    - [355, 9037.98]
  - - [5056, 4, 1, 3328]
    - [314, 529.175]
  - - [1856, 64, 1, 1280]
    - [306, 4064.41]
  - - [1760, 16, 1, 1760]
    - [315, 2021.35]
  - - [448, 5888, 1, 128]
    - [341, 4391.14]
  - - [5888, 64, 1, 3328]
    - [333, 5795.89]
  - - [2944, 256, 1, 3328]
    - [355, 8137.36]
  - - [1024, 64, 1, 128]
    - [291, 740.128]
  - - [5056, 2368, 1, 1280]
    - [360, 9128.14]
  - - [448, 3584, 1, 1280]
    - [354, 7450.18]
  - - [6784, 5888, 1, 256]
    - [354, 9532.02]
  - - [704, 1024, 1, 128]
    - [341, 3235.49]
  - - [704, 128, 1, 1280]
    - [328, 3672.42]
  - - [4, 3584, 1, 128]
    - [365, 162.967]
  - - [1408, 448, 1, 1280]
    - [349, 6577.92]
  - - [1024, 1408, 1, 256]
    - [351, 6069.06]
  - - [2368, 2368, 1, 3328]
    - [356, 8719.45]
  - - [1856, 6784, 1, 128]
    - [344, 5484.43]
  - - [5056, 704, 1, 3328]
    - [358, 8362.76]
  - - [1408, 1856, 1, 256]
    - [360, 6293.46]
  - - [1408, 704, 1, 3328]
    - [352, 8645.44]
  - - [2368, 5056, 1, 256]
    - [360, 8657.89]
  - - [1408, 256, 1, 1280]
    - [355, 5346.22]
  - - [3072, 128, 1, 1024]
    - [321, 2602.03]
  - - [3584, 2368, 1, 1280]
    - [360, 8799.83]
  - - [4288, 64, 1, 3328]
    - [317, 5823.94]
  - - [2368, 4, 1, 1280]
    - [314, 429.584]
  - - [704, 5888, 1, 256]
    - [349, 7130.51]
  - - [6784, 2944, 1, 128]
    - [346, 5235.24]
  - - [2560, 1600, 1, 2560]
    - [350, 7534.64]
  - - [4288, 6784, 1, 3328]
    - [348, 8591.78]
  - - [2944, 256, 1, 256]
    - [355, 5209.12]
  - - [2944, 6784, 1, 3328]
    - [360, 8685.3]
  - - [704, 1408, 1, 3328]
    - [350, 8697.78]
  - - [6144, 5984, 1, 2048]
    - [350, 7559.11]
  - - [3584, 704, 1, 3328]
    - [355, 8485.99]
  - - [2944, 256, 1, 128]
    - [341, 3093.29]
  - - [6784, 4, 1, 1280]
    - [314, 480.918]
  - - [1024, 64, 1, 1280]
    - [305, 2639.67]
  - - [2048, 1600, 1, 512]
    - [360, 5977.44]
  - - [448, 4288, 1, 256]
    - [350, 6204.55]
  - - [64, 3584, 1, 3328]
    - [325, 5908.89]
  - - [1856, 4288, 1, 128]
    - [341, 5348.85]
  - - [704, 2368, 1, 1280]
    - [354, 7749.82]
  - - [1856, 2368, 1, 1280]
    - [358, 8785.67]
  - - [2368, 128, 1, 3328]
    - [317, 5949.07]
  - - [2944, 128, 1, 256]
    - [355, 4056.9]
  - - [448, 1408, 1, 256]
    - [349, 5329.92]
  - - [1856, 4288, 1, 1280]
    - [348, 9127.17]
  - - [64, 5056, 1, 3328]
    - [333, 5741.53]
  - - [4, 704, 1, 256]
    - [302, 156.955]
  - - [1024, 448, 1, 128]
    - [341, 2142.41]
  - - [704, 4, 1, 1280]
    - [323, 371.443]
  - - [704, 256, 1, 128]
    - [341, 1605.22]
  - - [704, 2944, 1, 128]
    - [342, 4213.29]
  - - [1408, 1024, 1, 1280]
    - [350, 7800.06]
  - - [704, 6784, 1, 256]
    - [354, 7904.75]
  - - [6784, 704, 1, 256]
    - [356, 7394.77]
  - - [5056, 1408, 1, 128]
    - [344, 5199.06]
  - - [2048, 7000, 1, 2048]
    - [350, 7360.93]
  - - [256, 3584, 1, 3328]
    - [350, 8131.84]
  - - [4, 5888, 1, 3328]
    - [323, 596.119]
  - - [128, 1408, 1, 128]
    - [288, 1557.06]
  - - [3584, 4288, 1, 3328]
    - [360, 8923.88]
  - - [5888, 1856, 1, 1280]
    - [360, 9205.03]
  - - [256, 1408, 1, 256]
    - [355, 4194.21]
  - - [5056, 64, 1, 1280]
    - [332, 4501.89]
  - - [1024, 704, 1, 256]
    - [349, 5404.24]
  - - [448, 128, 1, 128]
    - [289, 656.21]
  - - [2368, 3584, 1, 1280]
    - [347, 8873.85]
  - - [2368, 6784, 1, 1280]
    - [360, 9000.84]
  - - [1024, 256, 1, 256]
    - [349, 3667.75]
  - - [1856, 4, 1, 1280]
    - [314, 381.796]
  - - [448, 448, 1, 256]
    - [349, 3241.14]
  - - [2944, 3584, 1, 3328]
    - [347, 8406.64]
  - - [7680, 32, 1, 2560]
    - [335, 3420.54]
  - - [128, 4288, 1, 128]
    - [284, 2394.99]
  - - [256, 256, 1, 3328]
    - [336, 4394.51]
  - - [128, 1024, 1, 3328]
    - [300, 6033.43]
  - - [4, 1408, 1, 3328]
    - [314, 494.194]
  - - [6784, 2944, 1, 256]
    - [360, 9175.93]
  - - [64, 1856, 1, 1280]
    - [300, 4072.47]
  - - [6784, 64, 1, 128]
    - [295, 2351.81]
  - - [4288, 2368, 1, 3328]
    - [358, 8209.03]
  - - [1856, 2368, 1, 256]
    - [355, 7330.45]
  - - [3584, 256, 1, 128]
    - [343, 3037.15]
  - - [3584, 6784, 1, 3328]
    - [360, 8679.2]
  - - [256, 1024, 1, 256]
    - [355, 3956.07]
  - - [4, 6784, 1, 3328]
    - [323, 596.733]
  - - [1024, 5888, 1, 3328]
    - [354, 9126.56]
  - - [1024, 128, 1, 1280]
    - [300, 3653.02]
  - - [3072, 32, 1, 1024]
    - [319, 1608.18]
  - - [6144, 24000, 1, 2560]
    - [360, 8305.1]
  - - [5056, 4288, 1, 1280]
    - [348, 8786.69]
  - - [5888, 64, 1, 256]
    - [309, 2609.77]
  - - [6784, 1856, 1, 3328]
    - [360, 8464.77]
  - - [1408, 5056, 1, 1280]
    - [354, 9531.95]
  - - [1856, 256, 1, 1280]
    - [355, 6696.66]
  - - [64, 5888, 1, 3328]
    - [329, 5721.45]
  - - [2368, 2368, 1, 1280]
    - [360, 8837.4]
  - - [2944, 5888, 1, 128]
    - [344, 5308.88]
  - - [704, 5888, 1, 1280]
    - [350, 9423.23]
  - - [2368, 3584, 1, 128]
    - [341, 5072.61]
  - - [1856, 5056, 1, 128]
    - [344, 5404.98]
  - - [704, 1024, 1, 1280]
    - [349, 7414.69]
  - - [448, 256, 1, 3328]
    - [318, 5582.39]
  - - [448, 1856, 1, 128]
    - [342, 3143.9]
  - - [8192, 3200, 1, 2048]
    - [350, 7504.25]
  - - [128, 1024, 1, 128]
    - [281, 1316.79]
  - - [2944, 4, 1, 128]
    - [365, 144.311]
  - - [1024, 704, 1, 1280]
    - [349, 7280.37]
  - - [128, 5888, 1, 256]
    - [355, 4384.85]
  - - [1024, 5056, 1, 1280]
    - [360, 9737.86]
  - - [4288, 1024, 1, 256]
    - [355, 7409.43]
  - - [2944, 2368, 1, 128]
    - [344, 5093.52]
  - - [704, 704, 1, 3328]
    - [349, 7628.07]
  - - [704, 1408, 1, 1280]
    - [356, 8160.05]
  - - [5888, 448, 1, 1280]
    - [360, 8189.03]
  - - [3584, 256, 1, 3328]
    - [356, 8041.42]
  - - [704, 5888, 1, 3328]
    - [356, 9045.88]
  - - [704, 1856, 1, 128]
    - [341, 4135.14]
  - - [448, 448, 1, 3328]
    - [326, 5699.73]
  - - [4, 4288, 1, 128]
    - [365, 179.624]
  - - [128, 704, 1, 1280]
    - [300, 3854.16]
  - - [3584, 2944, 1, 256]
    - [354, 8533.61]
  - - [3584, 4, 1, 128]
    - [365, 166.252]
  - - [1856, 128, 1, 3328]
    - [326, 6322.94]
  - - [4, 64, 1, 1280]
    - [323, 66.0246]
  - - [2944, 448, 1, 128]
    - [341, 3522.42]
  - - [128, 2944, 1, 1280]
    - [355, 5324.16]
  - - [64, 64, 1, 3328]
    - [323, 1520.78]
  - - [448, 2944, 1, 1280]
    - [352, 7558.89]
  - - [512, 24000, 1, 2048]
    - [352, 7171.04]
  - - [128, 256, 1, 3328]
    - [336, 3617.1]
  - - [1408, 5056, 1, 3328]
    - [354, 8912.02]
  - - [1856, 1856, 1, 3328]
    - [350, 8503.78]
  - - [3584, 128, 1, 256]
    - [355, 3695.54]
  - - [2560, 800, 1, 2560]
    - [357, 7141.94]
  - - [448, 1408, 1, 3328]
    - [355, 6993.83]
  - - [2368, 2368, 1, 256]
    - [352, 7674.71]
  - - [4288, 4288, 1, 1280]
    - [347, 8782.03]
  - - [64, 448, 1, 1280]
    - [332, 2272.67]
  - - [5888, 1024, 1, 1280]
    - [360, 9558.09]
  - - [1408, 4288, 1, 256]
    - [354, 8201.63]
  - - [448, 4, 1, 256]
    - [314, 123.853]
  - - [5888, 448, 1, 128]
    - [346, 3729.96]
  - - [512, 48000, 1, 2560]
    - [354, 8801.88]
  - - [35, 8457, 1, 1760]
    - [278, 4239.08]
  - - [704, 6784, 1, 3328]
    - [360, 8674.96]
  - - [2560, 6400, 1, 2560]
    - [360, 8681.32]
  - - [5056, 1024, 1, 1280]
    - [360, 9725.15]
  - - [448, 5888, 1, 3328]
    - [349, 8087.11]
  - - [128, 4, 1, 128]
    - [365, 6.91162]
  - - [1024, 2944, 1, 1280]
    - [360, 9568.63]
  - - [5056, 5888, 1, 1280]
    - [348, 8984.6]
  - - [4288, 5888, 1, 128]
    - [342, 5453.34]
  - - [256, 3584, 1, 256]
    - [352, 5723.43]
  - - [1408, 3584, 1, 128]
    - [344, 4865.89]
  - - [256, 2944, 1, 3328]
    - [349, 8151.08]
  - - [448, 3584, 1, 128]
    - [341, 3848.06]
  - - [5888, 2944, 1, 1280]
    - [348, 9048.32]
  - - [4, 6784, 1, 1280]
    - [323, 534.05]
  - - [2368, 5888, 1, 128]
    - [341, 5598.98]
  - - [8448, 16, 1, 2816]
    - [316, 2028.58]
  - - [64, 2944, 1, 128]
    - [282, 1588.18]
  - - [2368, 4, 1, 256]
    - [302, 334.022]
  - - [3584, 5888, 1, 256]
    - [354, 8723.47]
  - - [2368, 1024, 1, 128]
    - [341, 4355.49]
  - - [2368, 704, 1, 128]
    - [341, 3956.85]
  - - [3584, 2944, 1, 1280]
    - [360, 8820.97]
  - - [3584, 2368, 1, 128]
    - [344, 4677.81]
  - - [5056, 704, 1, 128]
    - [345, 4253.45]
  - - [448, 2368, 1, 128]
    - [341, 3407.24]
  - - [5056, 1408, 1, 3328]
    - [360, 8983.36]
  - - [1408, 704, 1, 256]
    - [352, 6285.51]
  - - [6784, 1024, 1, 3328]
    - [360, 8738.53]
  - - [6784, 2944, 1, 3328]
    - [360, 8649.29]
  - - [2944, 5056, 1, 3328]
    - [360, 8637.19]
  - - [1856, 1856, 1, 256]
    - [358, 6986.27]
  - - [1024, 5888, 1, 128]
    - [342, 4147.42]
  - - [6784, 2368, 1, 1280]
    - [348, 9010.48]
  - - [256, 4, 1, 128]
    - [365, 13.8232]
  - - [4288, 5888, 1, 1280]
    - [348, 8946.87]
  - - [4288, 4288, 1, 256]
    - [355, 8945.97]
  - - [8448, 32, 1, 2816]
    - [332, 3557.21]
  - - [448, 2944, 1, 3328]
    - [358, 7945.05]
  - - [5888, 4, 1, 128]
    - [365, 218.794]
  - - [4288, 1856, 1, 1280]
    - [360, 9166.71]
  - - [1856, 2944, 1, 3328]
    - [352, 8612.18]
  - - [256, 6784, 1, 3328]
    - [349, 8206.16]
  - - [64, 5888, 1, 256]
    - [355, 2533.62]
  - - [256, 5056, 1, 128]
    - [341, 3055.38]
  - - [5056, 1024, 1, 256]
    - [360, 8249.13]
  - - [704, 64, 1, 3328]
    - [312, 4008.35]
  - - [5056, 1856, 1, 3328]
    - [360, 8195.41]
  - - [4, 2944, 1, 3328]
    - [371, 552.248]
  - - [4, 5056, 1, 256]
    - [302, 351.209]
  - - [1856, 1408, 1, 256]
    - [352, 6377.91]
  - - [8448, 12000, 1, 2816]
    - [360, 8697.62]
  - - [6784, 128, 1, 3328]
    - [350, 7459.28]
  - - [4288, 1408, 1, 128]
    - [344, 5064.31]
  - - [1856, 5888, 1, 3328]
    - [348, 8967.04]
  - - [4288, 5056, 1, 256]
    - [360, 8650.75]
  - - [1408, 128, 1, 1280]
    - [306, 4711.31]
  - - [4096, 800, 1, 1024]
    - [363, 5325.31]
  - - [5056, 256, 1, 3328]
    - [355, 8476.69]
  - - [704, 704, 1, 256]
    - [355, 4993.61]
  - - [1024, 5888, 1, 1280]
    - [354, 9439.46]
  - - [6784, 2368, 1, 128]
    - [344, 5432.21]
  - - [4, 5056, 1, 1280]
    - [323, 520.807]
  - - [256, 64, 1, 1280]
    - [315, 1993.68]
  - - [128, 1856, 1, 1280]
    - [349, 4969.8]
  - - [1856, 1024, 1, 1280]
    - [360, 8780.84]
  - - [6784, 4288, 1, 1280]
    - [348, 8931.81]
  - - [2560, 64, 1, 2560]
    - [338, 3693.5]
  - - [1856, 1856, 1, 1280]
    - [356, 8902.65]
  - - [4096, 400, 1, 1024]
    - [363, 4111.19]
  - - [3072, 24000, 1, 1024]
    - [360, 8343.77]
  - - [128, 4288, 1, 3328]
    - [313, 6396.52]
  - - [4, 2368, 1, 3328]
    - [323, 537.983]
  - - [5888, 1856, 1, 128]
    - [345, 4846.82]
  - - [448, 704, 1, 1280]
    - [355, 4892.11]
  - - [128, 5056, 1, 1280]
    - [349, 6181.72]
  - - [1024, 448, 1, 3328]
    - [355, 7089.84]
  - - [1856, 704, 1, 1280]
    - [355, 8086.58]
  - - [5056, 3584, 1, 128]
    - [346, 5328.73]
  - - [5888, 5888, 1, 3328]
    - [348, 8777.29]
  - - [6784, 1024, 1, 256]
    - [360, 8216.09]
  - - [2944, 2368, 1, 256]
    - [360, 8025.44]
  - - [256, 448, 1, 256]
    - [303, 2177.73]
  - - [5056, 5888, 1, 3328]
    - [360, 8761.5]
  - - [1856, 1024, 1, 256]
    - [354, 6899.26]
  - - [512, 48000, 1, 1536]
    - [354, 8859.39]
  - - [3584, 448, 1, 1280]
    - [360, 7355.37]
  - - [8448, 5984, 1, 2816]
    - [360, 8766.09]
  - - [1024, 1024, 1, 1280]
    - [354, 8384.47]
  - - [448, 5888, 1, 256]
    - [358, 6698.04]
  - - [704, 64, 1, 128]
    - [291, 526.057]
  - - [1408, 6784, 1, 3328]
    - [360, 8535.71]
  - - [448, 1024, 1, 128]
    - [341, 2678.05]
  - - [4288, 704, 1, 128]
    - [344, 4559.64]
  - - [128, 1856, 1, 128]
    - [285, 1840.83]
  - - [448, 2368, 1, 3328]
    - [349, 6895.4]
  - - [5056, 64, 1, 128]
    - [293, 1955.01]
  - - [5056, 2944, 1, 256]
    - [355, 8843.12]
  - - [6784, 5888, 1, 128]
    - [345, 5469.21]
  - - [1024, 700, 1, 512]
    - [356, 4786.83]
  - - [704, 1024, 1, 256]
    - [349, 5662.15]
  - - [1024, 4, 1, 256]
    - [368, 217.773]
  - - [2944, 704, 1, 128]
    - [343, 3830.26]
  - - [128, 6784, 1, 1280]
    - [350, 6870.26]
  - - [1408, 3584, 1, 3328]
    - [360, 9245.62]
  - - [2368, 6784, 1, 256]
    - [355, 8640.81]
  - - [5056, 1408, 1, 1280]
    - [360, 9583.93]
  - - [256, 256, 1, 128]
    - [281, 775.61]
  - - [5056, 4288, 1, 128]
    - [344, 5688.14]
  - - [1408, 1856, 1, 128]
    - [344, 4321.09]
  - - [1408, 5888, 1, 3328]
    - [360, 9213.48]
  - - [1856, 256, 1, 256]
    - [355, 5052.33]
  - - [6784, 6784, 1, 256]
    - [354, 9445.29]
  - - [64, 256, 1, 128]
    - [291, 211.268]
  - - [4288, 2368, 1, 128]
    - [344, 5403.62]
  - - [1024, 1024, 1, 128]
    - [346, 3140.18]
  - - [256, 4288, 1, 1280]
    - [349, 6945.5]
  - - [2368, 2944, 1, 256]
    - [360, 8191.91]
  - - [4, 1856, 1, 256]
    - [367, 291.562]
  - - [3584, 1856, 1, 1280]
    - [358, 8693.84]
  - - [6784, 6784, 1, 128]
    - [345, 5398.82]
  - - [256, 1856, 1, 128]
    - [341, 2062.83]
  - - [704, 64, 1, 1280]
    - [336, 2915.88]
  - - [5888, 5056, 1, 256]
    - [360, 9294.51]
  - - [8448, 48000, 1, 2816]
    - [360, 8524.48]
  - - [3584, 448, 1, 256]
    - [356, 5610.61]
  - - [448, 4288, 1, 128]
    - [341, 4098.05]
  - - [7680, 64, 1, 2560]
    - [330, 5000.41]
  - - [256, 6784, 1, 256]
    - [354, 6251.92]
  - - [1408, 4288, 1, 128]
    - [344, 5010.8]
  - - [2944, 704, 1, 3328]
    - [352, 8748.0]
  - - [128, 448, 1, 256]
    - [302, 1679.45]
  - - [5056, 256, 1, 1280]
    - [355, 8249.86]
  - - [2560, 32, 1, 2560]
    - [320, 2670.82]
  - - [3584, 3584, 1, 256]
    - [355, 8702.43]
  - - [448, 1408, 1, 128]
    - [341, 2831.06]
  - - [128, 256, 1, 1280]
    - [303, 2670.85]
  - - [3584, 5056, 1, 256]
    - [360, 8866.37]
  - - [6784, 128, 1, 256]
    - [355, 4238.61]
  - - [4288, 4, 1, 256]
    - [314, 387.428]
  - - [704, 448, 1, 256]
    - [355, 3837.83]
  - - [2944, 2368, 1, 1280]
    - [360, 9464.32]
  - - [448, 64, 1, 3328]
    - [339, 3286.05]
  - - [1408, 3584, 1, 256]
    - [360, 7999.71]
  - - [3584, 4, 1, 3328]
    - [314, 524.484]
  - - [6784, 3584, 1, 256]
    - [354, 9434.76]
  - - [256, 128, 1, 128]
    - [289, 382.587]
  - - [704, 1408, 1, 128]
    - [345, 3644.29]
  - - [4, 2368, 1, 256]
    - [302, 330.651]
  - - [4288, 128, 1, 1280]
    - [306, 5517.2]
  - - [128, 1408, 1, 256]
    - [349, 2910.41]
  - - [4, 2944, 1, 256]
    - [302, 369.965]
  - - [64, 128, 1, 3328]
    - [324, 1906.97]
  - - [5056, 2368, 1, 128]
    - [344, 5493.37]
  - - [2944, 2944, 1, 3328]
    - [360, 8583.56]
  - - [5056, 6784, 1, 256]
    - [360, 9193.17]
  - - [1856, 3584, 1, 128]
    - [341, 5279.81]
  - - [128, 2944, 1, 128]
    - [282, 2237.64]
  - - [35, 8457, 1, 2560]
    - [279, 3787.21]
  - - [1024, 704, 1, 3328]
    - [355, 7809.83]
  - - [6784, 448, 1, 256]
    - [356, 6527.81]
  - - [3584, 6784, 1, 128]
    - [342, 5298.65]
  - - [128, 4288, 1, 256]
    - [355, 3512.64]
  - - [704, 448, 1, 3328]
    - [355, 5091.45]
  - - [1024, 1024, 1, 3328]
    - [354, 8990.25]
  - - [128, 128, 1, 3328]
    - [336, 2520.79]
  - - [5056, 1856, 1, 256]
    - [360, 8220.5]
  - - [4608, 5984, 1, 1536]
    - [360, 8717.74]
  - - [256, 128, 1, 256]
    - [302, 1244.42]
  - - [1760, 3200, 1, 1760]
    - [348, 9273.83]
  - - [1024, 1856, 1, 256]
    - [360, 6799.23]
  - - [4096, 1600, 1, 1024]
    - [351, 6089.95]
  - - [4288, 64, 1, 128]
    - [287, 1737.0]
  - - [256, 448, 1, 3328]
    - [313, 5534.43]
  - - [1408, 6784, 1, 1280]
    - [354, 8923.62]
  - - [3584, 3584, 1, 1280]
    - [350, 8803.92]
  - - [7680, 24000, 1, 2560]
    - [360, 8287.43]
  - - [64, 2368, 1, 1280]
    - [300, 4041.3]
  - - [448, 2368, 1, 1280]
    - [349, 6819.62]
  - - [4608, 48000, 1, 1536]
    - [360, 8428.11]
  - - [5888, 5888, 1, 128]
    - [342, 5002.53]
  - - [64, 6784, 1, 3328]
    - [326, 5634.34]
  - - [2944, 256, 1, 1280]
    - [355, 7589.11]
  - - [2048, 16, 1, 2048]
    - [337, 1063.31]
  - - [256, 2368, 1, 128]
    - [341, 2292.1]
  - - [5056, 2368, 1, 3328]
    - [348, 8729.83]
  - - [2944, 4288, 1, 256]
    - [355, 8728.83]
  - - [1408, 3584, 1, 1280]
    - [354, 9747.02]
  - - [2368, 64, 1, 256]
    - [349, 2369.88]
  - - [64, 448, 1, 3328]
    - [336, 3345.8]
  - - [704, 128, 1, 3328]
    - [317, 4907.18]
  - - [8192, 1600, 1, 2048]
    - [350, 7009.08]
  - - [1856, 704, 1, 256]
    - [359, 5759.62]
  - - [4, 4288, 1, 1280]
    - [323, 497.278]
  - - [1408, 448, 1, 3328]
    - [355, 6990.38]
  - - [1024, 4, 1, 3328]
    - [298, 460.049]
  - - [512, 24000, 1, 2560]
    - [354, 8687.09]
  - - [2368, 6784, 1, 3328]
    - [348, 8728.59]
  - - [1856, 1408, 1, 1280]
    - [350, 8766.36]
  - - [1856, 448, 1, 1280]
    - [358, 7070.69]
  - - [6784, 704, 1, 128]
    - [344, 4789.63]
  - - [4, 4, 1, 256]
    - [314, 0.850675]
  - - [128, 5888, 1, 128]
    - [283, 2862.2]
  - - [1408, 5888, 1, 256]
    - [354, 8807.38]
  - - [704, 2944, 1, 1280]
    - [350, 8937.61]
  - - [4288, 64, 1, 1280]
    - [332, 4374.59]
  - - [256, 64, 1, 256]
    - [308, 765.174]
  - - [1024, 1024, 1, 256]
    - [352, 6357.49]
  - - [704, 1856, 1, 256]
    - [353, 5737.64]
  - - [704, 6784, 1, 128]
    - [344, 4974.43]
  - - [3584, 704, 1, 1280]
    - [355, 8585.75]
  - - [256, 128, 1, 1280]
    - [303, 2683.5]
  - - [5888, 2368, 1, 256]
    - [360, 8914.85]
  - - [256, 2368, 1, 1280]
    - [355, 6227.67]
  - - [2944, 6784, 1, 128]
    - [341, 5701.42]
  - - [3584, 448, 1, 3328]
    - [360, 7645.53]
  - - [1408, 4, 1, 256]
    - [302, 274.157]
  - - [704, 2368, 1, 3328]
    - [349, 8138.2]
  - - [2944, 448, 1, 256]
    - [356, 5828.69]
  - - [1856, 448, 1, 128]
    - [342, 3137.04]
  - - [4288, 4, 1, 3328]
    - [314, 531.436]
  - - [2368, 128, 1, 1280]
    - [332, 4651.4]
  - - [256, 5888, 1, 128]
    - [341, 3413.62]
  - - [64, 6784, 1, 256]
    - [361, 2614.07]
  - - [64, 5056, 1, 1280]
    - [328, 4534.74]
  - - [4, 6784, 1, 128]
    - [365, 224.351]
  - - [2048, 3200, 1, 512]
    - [350, 7636.05]
  - - [2944, 2944, 1, 1280]
    - [360, 9040.96]
  - - [5056, 448, 1, 3328]
    - [355, 8444.33]
  - - [4, 3584, 1, 1280]
    - [323, 490.532]
  - - [1408, 128, 1, 128]
    - [291, 1455.21]
  - - [6784, 704, 1, 3328]
    - [348, 8787.58]
  - - [128, 64, 1, 1280]
    - [314, 1429.84]
  - - [2368, 256, 1, 1280]
    - [355, 6249.97]
  - - [4, 448, 1, 3328]
    - [371, 383.375]
  - - [5888, 4288, 1, 128]
    - [342, 4999.05]
  - - [4, 5888, 1, 256]
    - [314, 334.952]
  - - [1408, 2944, 1, 3328]
    - [354, 9516.94]
  - - [3584, 704, 1, 128]
    - [346, 3697.9]
  - - [4608, 12000, 1, 1536]
    - [360, 8745.12]
  - - [64, 1024, 1, 256]
    - [303, 1715.81]
  - - [5056, 5056, 1, 128]
    - [344, 5577.23]
  - - [2368, 448, 1, 1280]
    - [355, 6699.98]
  - - [128, 3584, 1, 256]
    - [349, 3895.34]
  - - [704, 448, 1, 1280]
    - [349, 4878.95]
  - - [8192, 800, 1, 2048]
    - [350, 6400.15]
  - - [448, 5056, 1, 128]
    - [341, 4432.56]
  - - [256, 4, 1, 1280]
    - [323, 245.752]
  - - [5056, 3584, 1, 256]
    - [355, 8847.58]
  - - [2368, 4, 1, 3328]
    - [302, 473.878]
  - - [1408, 5056, 1, 128]
    - [344, 5070.48]
  - - [2944, 3584, 1, 128]
    - [341, 5445.65]
  - - [3584, 2368, 1, 256]
    - [355, 8133.62]
  - - [128, 3584, 1, 3328]
    - [355, 6934.76]
  - - [128, 1024, 1, 1280]
    - [300, 4314.02]
  - - [8448, 24000, 1, 2816]
    - [360, 8593.94]
  - - [64, 704, 1, 256]
    - [303, 1526.51]
  - - [4288, 256, 1, 1280]
    - [355, 7033.06]
  - - [3584, 3584, 1, 3328]
    - [348, 8694.04]
  - - [1024, 256, 1, 128]
    - [344, 1887.36]
  - - [4, 704, 1, 128]
    - [365, 36.5844]
  - - [5888, 6784, 1, 256]
    - [354, 9038.94]
  - - [4288, 2944, 1, 3328]
    - [348, 8429.78]
  - - [2944, 64, 1, 128]
    - [296, 1493.42]
  - - [1024, 128, 1, 3328]
    - [300, 5015.87]
  - - [1024, 16, 1, 500000]
    - [277, 2770.19]
  - - [4288, 128, 1, 3328]
    - [317, 6630.44]
  - - [7680, 128, 1, 2560]
    - [311, 5752.25]
  - - [256, 5056, 1, 1280]
    - [349, 8129.93]
  - - [1408, 256, 1, 128]
    - [341, 2118.48]
  - - [2944, 5888, 1, 3328]
    - [354, 8827.99]
  - - [6784, 5888, 1, 1280]
    - [348, 8950.68]
  - - [2048, 800, 1, 512]
    - [360, 6622.36]
  - - [704, 128, 1, 256]
    - [314, 1720.52]
  - - [5888, 4288, 1, 1280]
    - [347, 8852.46]
  - - [1024, 24000, 1, 2048]
    - [354, 7661.8]
  - - [448, 256, 1, 1280]
    - [300, 4145.92]
  - - [5888, 3584, 1, 128]
    - [342, 5125.69]
  - - [1024, 2944, 1, 128]
    - [346, 3663.25]
  - - [5056, 4, 1, 1280]
    - [314, 474.807]
  - - [256, 1408, 1, 1280]
    - [355, 5430.13]
  - - [3072, 16, 1, 1024]
    - [319, 815.669]
  - - [704, 3584, 1, 128]
    - [344, 4439.76]
  - - [5888, 448, 1, 3328]
    - [360, 8207.52]
  - - [2368, 4288, 1, 1280]
    - [352, 8821.28]
  - - [4288, 2944, 1, 128]
    - [341, 5473.87]
  - - [1024, 6784, 1, 3328]
    - [360, 9000.63]
  - - [128, 2368, 1, 256]
    - [349, 3649.79]
  - - [6784, 64, 1, 3328]
    - [333, 5737.07]
  - - [5056, 2944, 1, 3328]
    - [360, 8678.67]
  - - [448, 128, 1, 256]
    - [299, 1489.98]
  - - [2944, 3584, 1, 256]
    - [360, 8797.13]
  - - [1408, 1408, 1, 3328]
    - [354, 9353.64]
  - - [1856, 128, 1, 1280]
    - [355, 4945.83]
  - - [3584, 3584, 1, 128]
    - [342, 5130.74]
  - - [64, 3584, 1, 256]
    - [349, 2516.51]
  - - [1408, 4, 1, 3328]
    - [314, 473.83]
  - - [128, 2944, 1, 3328]
    - [327, 6026.98]
  - - [3584, 704, 1, 256]
    - [360, 6454.23]
  - - [2944, 448, 1, 3328]
    - [350, 7825.44]
  - - [3584, 1408, 1, 3328]
    - [360, 9049.29]
  - - [704, 3584, 1, 1280]
    - [356, 8707.49]
  - - [2944, 6784, 1, 1280]
    - [348, 8822.88]
  - - [1856, 6784, 1, 256]
    - [360, 8662.85]
  - - [4288, 448, 1, 3328]
    - [358, 8321.77]
  - - [6784, 4288, 1, 128]
    - [346, 5203.47]
  - - [6784, 704, 1, 1280]
    - [360, 9314.39]
  - - [256, 4288, 1, 256]
    - [361, 4649.04]
  - - [3584, 6784, 1, 256]
    - [354, 8843.91]
  - - [6144, 12000, 1, 2048]
    - [360, 7678.01]
  - - [6144, 16, 1, 2560]
    - [319, 1728.9]
  - - [3584, 64, 1, 128]
    - [292, 1708.42]
  - - [5888, 1024, 1, 3328]
    - [360, 9271.82]
  - - [448, 64, 1, 128]
    - [281, 356.433]
  - - [704, 6784, 1, 1280]
    - [352, 8800.86]
  - - [4, 1024, 1, 1280]
    - [314, 388.88]
  - - [5888, 128, 1, 256]
    - [349, 4050.68]
  - - [4096, 16, 1, 4096]
    - [319, 1442.58]
  - - [1856, 5056, 1, 3328]
    - [347, 8514.87]
  - - [4, 6784, 1, 256]
    - [369, 323.371]
  - - [1024, 3584, 1, 128]
    - [343, 3750.19]
  - - [1024, 1408, 1, 128]
    - [341, 3060.62]
  - - [2368, 2944, 1, 128]
    - [341, 5297.36]
  - - [5056, 64, 1, 256]
    - [310, 2570.76]
  - - [4, 448, 1, 1280]
    - [369, 322.542]
  - - [5056, 2944, 1, 128]
    - [344, 5582.86]
  - - [5888, 5056, 1, 3328]
    - [360, 8813.17]
  - - [1024, 704, 1, 128]
    - [344, 2552.59]
  - - [5888, 2368, 1, 128]
    - [346, 4840.75]
  - - [128, 5056, 1, 3328]
    - [355, 6842.8]
  - - [3584, 6784, 1, 1280]
    - [348, 9026.9]
  - - [448, 4, 1, 1280]
    - [371, 332.936]
  - - [1856, 5888, 1, 256]
    - [360, 8610.68]
  - - [256, 256, 1, 256]
    - [302, 1653.25]
  - - [256, 64, 1, 128]
    - [289, 192.594]
  - - [4288, 4288, 1, 3328]
    - [348, 8447.05]
  - - [4288, 1408, 1, 1280]
    - [360, 9353.12]
  - - [3584, 5056, 1, 128]
    - [341, 5098.78]
  - - [4, 1024, 1, 3328]
    - [314, 484.262]
  - - [4288, 2368, 1, 256]
    - [355, 8415.13]
  - - [2944, 5056, 1, 1280]
    - [348, 8986.18]
  - - [448, 6784, 1, 256]
    - [358, 6833.6]
  - - [64, 128, 1, 128]
    - [291, 118.954]
  - - [1856, 2368, 1, 128]
    - [343, 4602.63]
  - - [6784, 2368, 1, 3328]
    - [348, 8812.25]
  - - [256, 1024, 1, 1280]
    - [349, 5261.01]
  - - [704, 4, 1, 128]
    - [365, 37.7195]
  - - [256, 4, 1, 256]
    - [314, 76.9315]
  - - [4288, 128, 1, 256]
    - [355, 3399.32]
  - - [4288, 1856, 1, 3328]
    - [360, 8682.18]
  - - [3584, 448, 1, 128]
    - [341, 3437.95]
  - - [2048, 1600, 1, 2048]
    - [361, 6080.14]
  - - [256, 4, 1, 3328]
    - [371, 353.881]
  - - [4, 1408, 1, 1280]
    - [323, 423.123]
  - - [3584, 64, 1, 1280]
    - [332, 3939.85]
  - - [1408, 448, 1, 128]
    - [341, 2759.41]
  - - [3584, 1024, 1, 1280]
    - [358, 9118.03]
  - - [1856, 5056, 1, 256]
    - [355, 8364.67]
  - - [4, 3584, 1, 256]
    - [302, 387.051]
  - - [4, 2944, 1, 1280]
    - [323, 479.911]
  - - [1024, 4288, 1, 256]
    - [355, 7515.87]
  - - [5888, 3584, 1, 3328]
    - [360, 8687.58]
  - - [1856, 4, 1, 256]
    - [302, 301.841]
  - - [4, 256, 1, 256]
    - [314, 78.6393]
  - - [5056, 3584, 1, 3328]
    - [360, 8708.08]
  - - [704, 448, 1, 128]
    - [341, 2003.58]
  - - [2368, 1408, 1, 1280]
    - [355, 8498.63]
  - - [5056, 2944, 1, 1280]
    - [360, 9020.21]
  - - [4, 4, 1, 128]
    - [366, 0.0554053]
  - - [3584, 256, 1, 256]
    - [358, 5365.09]
  - - [1024, 6784, 1, 256]
    - [354, 8414.81]
  - - [4, 128, 1, 256]
    - [314, 40.2123]
  - - [64, 64, 1, 1280]
    - [323, 943.643]
  - - [5124, 9124, 1, 2048]
    - [350, 7490.6]
  - - [6784, 4, 1, 128]
    - [365, 225.429]
  - - [2944, 1408, 1, 128]
    - [344, 4663.16]
  - - [448, 128, 1, 3328]
    - [312, 4616.99]
  - - [3584, 1408, 1, 1280]
    - [360, 9505.81]
  - - [64, 4288, 1, 3328]
    - [336, 5215.44]
  - - [5056, 6784, 1, 3328]
    - [360, 8624.66]
  - - [128, 2944, 1, 256]
    - [349, 4147.42]
  - - [128, 6784, 1, 128]
    - [282, 2858.04]
  - - [3584, 4288, 1, 256]
    - [355, 8726.72]
  - - [448, 1856, 1, 256]
    - [350, 5463.02]
  - - [1856, 6784, 1, 3328]
    - [354, 8490.95]
  - - [3584, 128, 1, 3328]
    - [355, 6937.11]
  - - [64, 1856, 1, 256]
    - [303, 2138.07]
  - - [64, 448, 1, 256]
    - [302, 1165.73]
  - - [5888, 4288, 1, 256]
    - [360, 8799.25]
  - - [4, 448, 1, 128]
    - [365, 24.0033]
  - - [5056, 1408, 1, 256]
    - [360, 8317.08]
  - - [35, 8457, 1, 2048]
    - [279, 3278.61]
  - - [64, 256, 1, 1280]
    - [320, 2066.46]
  - - [3584, 1024, 1, 256]
    - [360, 7335.56]
  - - [256, 704, 1, 256]
    - [349, 2951.85]
  - - [5888, 5888, 1, 256]
    - [354, 9340.51]
  - - [4288, 1024, 1, 1280]
    - [355, 8612.09]
  - - [5888, 128, 1, 3328]
    - [355, 7780.22]
  - - [448, 6784, 1, 3328]
    - [356, 8916.18]
  - - [2944, 1408, 1, 1280]
    - [360, 9959.11]
  - - [64, 128, 1, 1280]
    - [314, 1415.56]
  - - [2944, 1856, 1, 3328]
    - [356, 8464.89]
  - - [2368, 64, 1, 128]
    - [296, 1277.45]
  - - [256, 1024, 1, 128]
    - [341, 1665.32]
  - - [3584, 5888, 1, 1280]
    - [348, 8863.21]
  - - [64, 4, 1, 128]
    - [365, 3.4027]
  - - [6784, 1856, 1, 1280]
    - [354, 8897.73]
  - - [2944, 5056, 1, 256]
    - [360, 8590.59]
  - - [4288, 4, 1, 128]
    - [365, 181.833]
  - - [5888, 256, 1, 3328]
    - [350, 8694.19]
  - - [2944, 4288, 1, 128]
    - [341, 5508.43]
  - - [3584, 1408, 1, 256]
    - [354, 7662.28]
  - - [704, 3584, 1, 3328]
    - [356, 8825.59]
  - - [4096, 3200, 1, 1024]
    - [351, 7062.77]
  - - [5056, 448, 1, 1280]
    - [355, 8343.53]
  - - [3584, 1856, 1, 3328]
    - [360, 8665.0]
  - - [4288, 6784, 1, 1280]
    - [348, 8886.34]
  - - [2560, 7000, 1, 2560]
    - [360, 8393.7]
  - - [1408, 704, 1, 1280]
    - [358, 8105.98]
  - - [2944, 1024, 1, 256]
    - [360, 7626.87]
  - - [6784, 64, 1, 256]
    - [309, 2688.98]
  - - [2368, 4288, 1, 3328]
    - [350, 8257.62]
  - - [4, 1408, 1, 256]
    - [302, 270.328]
  - - [1024, 1408, 1, 1280]
    - [355, 7672.74]
  - - [64, 64, 1, 256]
    - [302, 232.063]
  - - [704, 256, 1, 3328]
    - [349, 4318.33]
  - - [6784, 5056, 1, 256]
    - [354, 9104.2]
  - - [1856, 1856, 1, 128]
    - [344, 4621.36]
  - - [3584, 5056, 1, 3328]
    - [360, 8766.88]
  - - [448, 6784, 1, 128]
    - [344, 4586.57]
  - - [4, 704, 1, 3328]
    - [323, 434.758]
  - - [35, 8457, 1, 4096]
    - [279, 3536.48]
  - - [448, 2944, 1, 256]
    - [357, 5641.13]
  - - [4, 4288, 1, 3328]
    - [323, 580.256]
  - - [2944, 6784, 1, 256]
    - [354, 9076.98]
  - - [2944, 2944, 1, 128]
    - [344, 5180.33]
  - - [4, 4, 1, 1280]
    - [323, 3.54448]
  - - [1856, 3584, 1, 1280]
    - [354, 9085.55]
  - - [64, 2944, 1, 256]
    - [349, 2646.9]
  - - [448, 256, 1, 128]
    - [291, 1201.02]
  - - [4288, 448, 1, 128]
    - [341, 3859.81]
  - - [4608, 24000, 1, 1536]
    - [360, 8553.1]
  - - [1856, 1408, 1, 3328]
    - [356, 8745.2]
  - - [128, 128, 1, 128]
    - [294, 230.178]
  - - [1024, 4288, 1, 3328]
    - [350, 8353.18]
  - - [448, 2368, 1, 256]
    - [352, 4749.0]
  - - [1024, 4, 1, 128]
    - [365, 53.6191]
  - - [64, 1408, 1, 1280]
    - [300, 3629.55]
  - - [64, 6784, 1, 1280]
    - [329, 4519.47]
  - - [5056, 448, 1, 256]
    - [356, 6572.54]
  - - [2944, 2368, 1, 3328]
    - [354, 8696.16]
  - - [704, 4288, 1, 3328]
    - [350, 8639.46]
  - - [1408, 128, 1, 256]
    - [355, 2980.06]
  - - [1024, 1856, 1, 1280]
    - [354, 8783.2]
  - - [2048, 6400, 1, 2048]
    - [350, 7293.48]
  - - [512, 48000, 1, 2816]
    - [360, 8825.35]
  - - [5124, 9124, 1, 2560]
    - [360, 8195.74]
  - - [128, 2368, 1, 3328]
    - [312, 5844.41]
  - - [1024, 5888, 1, 256]
    - [354, 8321.34]
  - - [64, 2944, 1, 1280]
    - [306, 4090.13]
  - - [5056, 64, 1, 3328]
    - [317, 5721.19]
  - - [128, 704, 1, 128]
    - [291, 998.125]
  - - [1408, 2368, 1, 256]
    - [354, 6695.2]
  - - [1408, 1408, 1, 256]
    - [354, 7151.56]
  - - [4, 64, 1, 128]
    - [365, 3.3512]
  - - [64, 1024, 1, 128]
    - [291, 735.327]
  - - [1024, 8, 1, 500000]
    - [277, 1411.61]
  - - [2368, 2368, 1, 128]
    - [341, 5184.24]
  - - [64, 5888, 1, 128]
    - [286, 2080.33]
  - - [5888, 4, 1, 3328]
    - [314, 530.381]
  - - [6784, 1408, 1, 128]
    - [344, 5175.64]
  - - [4288, 5888, 1, 256]
    - [360, 9063.41]
  - - [1408, 5056, 1, 256]
    - [354, 8489.29]
  - - [5056, 128, 1, 3328]
    - [355, 6836.36]
  - - [128, 128, 1, 1280]
    - [315, 2036.76]
  - - [448, 704, 1, 256]
    - [349, 3878.86]
  - - [4288, 3584, 1, 128]
    - [341, 5555.52]
  - - [2944, 128, 1, 3328]
    - [317, 6454.35]
  - - [64, 1408, 1, 3328]
    - [306, 4785.38]
  - - [3584, 5056, 1, 1280]
    - [348, 8879.19]
  - - [256, 448, 1, 1280]
    - [329, 3955.56]
  - - [704, 704, 1, 128]
    - [341, 2912.91]
  - - [5056, 4, 1, 128]
    - [365, 205.564]
  - - [704, 256, 1, 1280]
    - [349, 3987.39]
  - - [64, 2368, 1, 3328]
    - [300, 5084.94]
  - - [1856, 1024, 1, 128]
    - [341, 4064.42]
  - - [1856, 64, 1, 128]
    - [291, 1251.54]
  - - [4096, 64, 1, 4096]
    - [322, 3833.66]
  - - [1024, 24000, 1, 1536]
    - [354, 8866.63]
  - - [704, 4288, 1, 256]
    - [350, 6836.46]
  - - [5888, 2368, 1, 1280]
    - [354, 9067.85]
  - - [128, 256, 1, 256]
    - [302, 1286.79]
  - - [64, 128, 1, 256]
    - [314, 505.581]
  - - [2368, 5888, 1, 1280]
    - [348, 8939.99]
  - - [5888, 256, 1, 1280]
    - [356, 8481.22]
  - - [1760, 128, 1, 1760]
    - [307, 6096.23]
  - - [4, 5888, 1, 1280]
    - [323, 529.905]
  - - [704, 128, 1, 128]
    - [291, 1004.56]
  - - [1024, 4, 1, 1280]
    - [323, 380.525]
  - - [2368, 1856, 1, 3328]
    - [355, 8501.0]
  - - [2368, 128, 1, 128]
    - [287, 1870.52]
  - - [2944, 704, 1, 256]
    - [352, 6266.48]
  - - [5056, 128, 1, 128]
    - [341, 2867.34]
  - - [2368, 1024, 1, 3328]
    - [352, 8600.93]
  - - [256, 704, 1, 3328]
    - [349, 4461.08]
  - - [704, 3584, 1, 256]
    - [350, 6411.53]
  - - [1024, 1024, 1, 1024]
    - [351, 4280.87]
  - - [704, 2944, 1, 3328]
    - [356, 8970.5]
  - - [6784, 1024, 1, 128]
    - [344, 5052.07]
  - - [256, 448, 1, 128]
    - [291, 1223.29]
  - - [448, 1024, 1, 3328]
    - [349, 7176.24]
  - - [2944, 1024, 1, 3328]
    - [360, 9486.46]
  - - [2944, 5056, 1, 128]
    - [344, 5464.25]
  - - [2368, 256, 1, 256]
    - [355, 4988.08]
  - - [1408, 6784, 1, 256]
    - [354, 8485.93]
  - - [6784, 1408, 1, 3328]
    - [354, 8515.55]
  - - [4288, 6784, 1, 128]
    - [344, 5333.22]
  - - [704, 64, 1, 256]
    - [308, 1354.03]
  - - [5888, 4, 1, 1280]
    - [314, 468.318]
  - - [256, 2368, 1, 3328]
    - [349, 6703.14]
  - - [6784, 2944, 1, 1280]
    - [354, 8963.81]
  - - [4288, 1856, 1, 128]
    - [344, 5281.08]
  - - [1856, 2944, 1, 128]
    - [342, 4879.39]
  - - [6784, 448, 1, 128]
    - [346, 4058.44]
  - - [64, 3584, 1, 128]
    - [288, 1777.35]
  - - [448, 5056, 1, 1280]
    - [349, 8338.2]
  - - [2368, 1856, 1, 128]
    - [344, 4934.59]
  - - [64, 2944, 1, 3328]
    - [301, 5155.25]
  - - [4288, 704, 1, 256]
    - [355, 6548.96]
  - - [256, 3584, 1, 128]
    - [342, 2851.43]
  - - [5888, 704, 1, 256]
    - [355, 7095.18]
  - - [3584, 1024, 1, 128]
    - [342, 3973.42]
  - - [256, 5888, 1, 3328]
    - [352, 8993.24]
  - - [1408, 4288, 1, 3328]
    - [348, 8959.95]
  - - [6784, 4288, 1, 256]
    - [354, 9185.11]
  - - [4288, 256, 1, 128]
    - [341, 3140.4]
  - - [5888, 256, 1, 256]
    - [357, 5892.72]
  - - [6784, 1024, 1, 1280]
    - [360, 9489.85]
  - - [5888, 1024, 1, 128]
    - [344, 4565.43]
  - - [1024, 128, 1, 256]
    - [355, 2157.01]
  - - [512, 16, 1, 500000]
    - [276, 2735.45]
  - - [128, 64, 1, 3328]
    - [323, 1831.02]
  - - [448, 64, 1, 256]
    - [308, 1100.95]
  - - [2368, 256, 1, 128]
    - [341, 2800.79]
  - - [6784, 3584, 1, 1280]
    - [354, 9064.1]
  - - [1024, 6784, 1, 1280]
    - [354, 9331.98]
  - - [2944, 64, 1, 1280]
    - [306, 4261.41]
  - - [1408, 2944, 1, 1280]
    - [360, 9387.41]
  - - [256, 1856, 1, 256]
    - [355, 4886.99]
  - - [2048, 800, 1, 2048]
    - [364, 5108.5]
  - - [1408, 2368, 1, 3328]
    - [355, 8461.37]
  - - [2944, 4, 1, 3328]
    - [314, 514.646]
  - - [128, 1408, 1, 3328]
    - [307, 5666.1]
  - - [2944, 1856, 1, 128]
    - [344, 5011.47]
  - - [256, 2944, 1, 128]
    - [341, 2707.45]
  - - [256, 6784, 1, 128]
    - [341, 3421.81]
  - - [2368, 4, 1, 128]
    - [365, 116.91]
  - - [1408, 256, 1, 3328]
    - [355, 5746.52]
  - - [1856, 4, 1, 128]
    - [365, 92.9589]
  - - [5056, 6784, 1, 128]
    - [341, 5514.36]
  - - [4288, 5056, 1, 128]
    - [341, 5646.14]
  - - [1856, 5888, 1, 128]
    - [344, 5454.42]
  - - [2944, 5888, 1, 256]
    - [360, 9462.23]
  - - [3584, 1856, 1, 256]
    - [355, 7962.68]
  - - [4288, 3584, 1, 1280]
    - [360, 9217.1]
  - - [2368, 448, 1, 256]
    - [355, 4901.39]
  - - [4288, 256, 1, 3328]
    - [355, 6955.88]
  - - [1856, 704, 1, 128]
    - [341, 3886.01]
  - - [1408, 64, 1, 256]
    - [308, 1853.65]
  - - [64, 1856, 1, 128]
    - [291, 1186.45]
  - - [4, 256, 1, 128]
    - [365, 13.6108]
  - - [2560, 16, 1, 2560]
    - [319, 1572.82]
  - - [704, 5888, 1, 128]
    - [344, 4932.92]
  - - [6784, 3584, 1, 128]
    - [342, 5214.47]
  - - [1024, 64, 1, 256]
    - [314, 1530.35]
  - - [64, 2368, 1, 256]
    - [349, 2369.88]
  - - [4288, 5056, 1, 3328]
    - [360, 8526.78]
  - - [4, 1856, 1, 1280]
    - [323, 440.829]
  - - [4288, 128, 1, 128]
    - [341, 2502.39]
  - - [1408, 1408, 1, 128]
    - [341, 4102.49]
  - - [7680, 16, 1, 2560]
    - [334, 1908.58]
  - - [1856, 128, 1, 128]
    - [292, 1655.26]
  - - [5056, 2368, 1, 256]
    - [355, 8522.35]
  - - [4288, 704, 1, 3328]
    - [358, 8429.5]
  - - [448, 3584, 1, 256]
    - [354, 5828.69]
  - - [2368, 64, 1, 1280]
    - [300, 4210.19]
  - - [2368, 1024, 1, 1280]
    - [350, 8405.18]
  - - [2944, 1408, 1, 3328]
    - [354, 9533.51]
  - - [1408, 448, 1, 256]
    - [349, 5202.68]
  - - [1024, 1408, 1, 3328]
    - [358, 8283.23]
  - - [2944, 5888, 1, 1280]
    - [360, 9236.67]
  - - [1408, 4, 1, 1280]
    - [369, 400.487]
  - - [5888, 3584, 1, 256]
    - [354, 8890.43]
  - - [2368, 5056, 1, 128]
    - [344, 5245.44]
  - - [1408, 1856, 1, 3328]
    - [352, 9166.48]
  - - [4, 4, 1, 3328]
    - [371, 8.26255]
  - - [6784, 1408, 1, 1280]
    - [350, 8821.54]
  - - [4096, 7000, 1, 4096]
    - [354, 7861.54]
  - - [704, 2944, 1, 256]
    - [350, 6782.78]
  - - [4288, 64, 1, 256]
    - [310, 2382.97]
  - - [6784, 5888, 1, 3328]
    - [348, 8766.11]
  - - [2368, 4288, 1, 128]
    - [344, 5425.34]
  - - [64, 4288, 1, 1280]
    - [328, 4456.79]
  - - [6784, 64, 1, 1280]
    - [332, 4611.13]
  - - [3584, 128, 1, 128]
    - [290, 2469.47]
  - - [1024, 6784, 1, 128]
    - [341, 4166.5]
  - - [4, 1856, 1, 128]
    - [365, 95.0224]
  - - [1408, 64, 1, 3328]
    - [317, 4961.33]
  - - [6784, 4, 1, 256]
    - [314, 366.326]
  - - [1408, 1408, 1, 1280]
    - [354, 9253.34]
  - - [16384, 400, 1, 4096]
    - [358, 5665.58]
  - - [256, 2368, 1, 256]
    - [349, 5011.93]
  - - [448, 4288, 1, 3328]
    - [356, 8483.74]
  - - [2368, 1408, 1, 256]
    - [354, 6675.82]
  - - [5888, 5056, 1, 128]
    - [346, 5220.8]
  - - [704, 2368, 1, 256]
    - [354, 6077.23]
  - - [1024, 24000, 1, 2560]
    - [354, 8711.24]
  - - [2944, 448, 1, 1280]
    - [356, 7399.37]
  - - [5888, 2368, 1, 3328]
    - [360, 8690.61]
  - - [5124, 9124, 1, 1760]
    - [348, 8860.35]
  - - [448, 1408, 1, 1280]
    - [349, 6666.42]
  - - [448, 1856, 1, 1280]
    - [350, 7025.76]
  - - [4288, 448, 1, 1280]
    - [358, 8192.05]
  - - [5888, 704, 1, 3328]
    - [358, 8609.28]
  - - [5056, 256, 1, 128]
    - [341, 3702.86]
  - - [1856, 256, 1, 128]
    - [341, 2831.09]
  - - [64, 1408, 1, 128]
    - [281, 1052.11]
  - - [704, 4, 1, 256]
    - [314, 154.467]
  - - [1408, 5888, 1, 128]
    - [344, 5180.9]
  - - [7680, 12000, 1, 2560]
    - [360, 8485.59]
  - - [1408, 1024, 1, 256]
    - [351, 6205.11]
  - - [8192, 400, 1, 2048]
    - [363, 5273.84]
  - - [1024, 1856, 1, 128]
    - [341, 3438.78]
  - - [256, 704, 1, 128]
    - [341, 1245.68]
  - - [2560, 128, 1, 2560]
    - [340, 4681.39]
  - - [448, 1024, 1, 256]
    - [349, 4923.61]
  - - [128, 4, 1, 3328]
    - [371, 237.135]
  - - [5056, 6784, 1, 1280]
    - [360, 8783.88]
  - - [1408, 64, 1, 128]
    - [296, 967.118]
  - - [1024, 448, 1, 1280]
    - [355, 6540.42]
  - - [704, 5056, 1, 3328]
    - [350, 8566.14]
  - - [128, 5056, 1, 256]
    - [355, 3993.85]
  - - [64, 1024, 1, 3328]
    - [328, 4434.18]
  - - [1856, 4, 1, 3328]
    - [302, 448.901]
  - - [4, 2944, 1, 128]
    - [365, 143.303]
  - - [2368, 2944, 1, 3328]
    - [360, 8856.99]
  - - [448, 448, 1, 1280]
    - [306, 4440.55]
  - - [2368, 3584, 1, 256]
    - [355, 8099.93]
  - - [1024, 256, 1, 1280]
    - [355, 5027.41]
  - - [5056, 3584, 1, 1280]
    - [348, 9038.36]
  - - [5124, 9124, 1, 4096]
    - [354, 7774.1]
  - - [7680, 48000, 1, 2560]
    - [360, 8274.39]
  - - [448, 4, 1, 3328]
    - [371, 408.674]
  - - [1856, 2944, 1, 1280]
    - [352, 9011.75]
  - - [1024, 48000, 1, 2816]
    - [360, 8924.28]
  - - [128, 1024, 1, 256]
    - [309, 2220.46]
  - - [2944, 1408, 1, 256]
    - [360, 8025.34]
  - - [4288, 1408, 1, 3328]
    - [360, 8922.51]
  - - [3584, 64, 1, 3328]
    - [325, 5715.53]
  - - [5888, 2944, 1, 128]
    - [346, 5057.01]
  - - [2944, 1024, 1, 128]
    - [342, 4290.92]
  - - [4288, 5056, 1, 1280]
    - [348, 8884.22]
  - - [5888, 6784, 1, 1280]
    - [348, 8772.3]
  - - [6784, 5056, 1, 128]
    - [345, 5257.55]
  - - [256, 1024, 1, 3328]
    - [361, 5856.39]
  - - [3584, 4, 1, 256]
    - [368, 438.446]
  - - [1760, 1600, 1, 1760]
    - [348, 9548.46]
  - - [1856, 64, 1, 3328]
    - [306, 5484.67]
  - - [4, 128, 1, 3328]
    - [371, 230.028]
  - - [5888, 1408, 1, 3328]
    - [360, 9276.59]
  - - [448, 2944, 1, 128]
    - [341, 3544.35]
  - - [2368, 1856, 1, 256]
    - [360, 7178.02]
  - - [256, 5056, 1, 256]
    - [361, 5408.78]
  - - [128, 3584, 1, 128]
    - [293, 2359.19]
  - - [448, 3584, 1, 3328]
    - [348, 7666.65]
  - - [4, 5056, 1, 3328]
    - [323, 589.615]
  - - [704, 2368, 1, 128]
    - [341, 3973.28]
  - - [5888, 256, 1, 128]
    - [341, 3317.94]
  - - [4, 5056, 1, 128]
    - [365, 201.995]
  - - [448, 256, 1, 256]
    - [349, 1933.43]
  - - [704, 4, 1, 3328]
    - [370, 453.46]
  - - [1408, 256, 1, 256]
    - [349, 4222.61]
  - - [3584, 1856, 1, 128]
    - [343, 4621.68]
  - - [4288, 4288, 1, 128]
    - [341, 5432.9]
  - - [1856, 1024, 1, 3328]
    - [348, 8884.08]
  - - [128, 5888, 1, 3328]
    - [349, 7856.04]
  - - [1024, 5056, 1, 256]
    - [354, 8170.01]
  - - [5888, 5888, 1, 1280]
    - [354, 8855.71]
  - - [5056, 5888, 1, 128]
    - [344, 5734.73]
  - - [2368, 1408, 1, 3328]
    - [352, 8159.48]
  - - [1024, 48000, 1, 1536]
    - [354, 8900.16]
  - - [5888, 448, 1, 256]
    - [356, 6469.84]
  - - [2560, 3200, 1, 2560]
    - [360, 8914.5]
  - - [5888, 6784, 1, 128]
    - [342, 5219.8]
  - - [6144, 48000, 1, 2048]
    - [360, 7691.74]
  - - [6784, 5056, 1, 1280]
    - [348, 8886.47]
  - - [5056, 704, 1, 1280]
    - [360, 8612.92]
  - - [1024, 48000, 1, 2560]
    - [360, 8562.08]
  - - [4608, 32, 1, 1536]
    - [320, 2677.36]
  - - [1024, 2368, 1, 128]
    - [342, 3392.69]
  - - [128, 704, 1, 256]
    - [303, 1983.55]
  - - [2368, 448, 1, 3328]
    - [349, 7107.22]
  - - [128, 5888, 1, 1280]
    - [355, 6825.41]
  - - [16384, 800, 1, 4096]
    - [354, 6696.72]
  - - [448, 128, 1, 1280]
    - [328, 3270.16]
  - - [6784, 4, 1, 3328]
    - [314, 541.834]
  - - [5888, 5056, 1, 1280]
    - [348, 9014.2]
  - - [1024, 64, 1, 3328]
    - [317, 3848.77]
  - - [3072, 48000, 1, 1024]
    - [360, 8291.3]
  - - [64, 3584, 1, 1280]
    - [328, 4243.56]
  - - [6784, 1408, 1, 256]
    - [360, 8440.35]
  - - [3584, 5888, 1, 128]
    - [342, 5224.09]
  - - [5056, 5888, 1, 256]
    - [360, 9333.29]
  - - [2368, 1024, 1, 256]
    - [360, 6230.44]
  - - [2944, 1856, 1, 256]
    - [360, 7454.86]
  - - [1856, 6784, 1, 1280]
    - [347, 8784.57]
  - - [64, 5056, 1, 128]
    - [288, 2094.13]
  - - [64, 6784, 1, 128]
    - [297, 2119.26]
  - - [448, 704, 1, 128]
    - [341, 2018.46]
  - - [4, 1024, 1, 128]
    - [365, 53.6191]
  - - [4288, 3584, 1, 256]
    - [360, 9196.67]
  - - [1408, 704, 1, 128]
    - [343, 3474.2]
  - - [64, 256, 1, 3328]
    - [336, 2520.79]
  - - [6784, 448, 1, 3328]
    - [358, 8425.94]
  - - [5056, 1856, 1, 1280]
    - [355, 8722.86]
  - - [1408, 1024, 1, 3328]
    - [356, 8264.2]
  - - [2368, 256, 1, 3328]
    - [355, 6583.24]
  - - [5888, 3584, 1, 1280]
    - [354, 8997.49]
  - - [1856, 3584, 1, 3328]
    - [360, 8663.5]
  - - [5888, 128, 1, 1280]
    - [355, 6726.7]
  - - [1024, 2944, 1, 256]
    - [360, 7479.09]
  - - [448, 6784, 1, 1280]
    - [350, 8992.52]
  - - [256, 3584, 1, 1280]
    - [352, 7607.46]
  - - [704, 5056, 1, 256]
    - [354, 7106.27]
  - - [3584, 1024, 1, 3328]
    - [350, 8979.0]
  - - [2944, 1856, 1, 1280]
    - [355, 8888.73]
  - - [128, 256, 1, 128]
    - [289, 382.57]
  - - [5056, 256, 1, 256]
    - [362, 5287.35]
  - - [2944, 4288, 1, 3328]
    - [354, 8540.09]
  - - [2368, 3584, 1, 3328]
    - [347, 8430.35]
  - - [2944, 704, 1, 1280]
    - [355, 8484.48]
  - - [128, 4, 1, 256]
    - [314, 39.3196]
  - - [2944, 3584, 1, 1280]
    - [356, 8740.62]
  - - [1856, 5888, 1, 1280]
    - [360, 9241.98]
  - - [256, 256, 1, 1280]
    - [332, 3421.2]
  - - [2048, 3200, 1, 2048]
    - [350, 6963.42]
  - - [4288, 1408, 1, 256]
    - [360, 8059.07]
  - - [3584, 64, 1, 256]
    - [349, 2516.51]
  - - [64, 1856, 1, 3328]
    - [300, 5283.73]
  - - [256, 1408, 1, 128]
    - [341, 1754.44]
  - - [5888, 1408, 1, 128]
    - [341, 4562.16]
  - - [4288, 2368, 1, 1280]
    - [350, 8823.94]
  - - [4, 4288, 1, 256]
    - [302, 384.898]
  - - [256, 4288, 1, 128]
    - [341, 3114.64]
  - - [2048, 128, 1, 2048]
    - [322, 3307.86]
  - - [256, 128, 1, 3328]
    - [339, 3547.38]
  - - [512, 8, 1, 500000]
    - [275, 1390.0]
  - - [6784, 2368, 1, 256]
    - [355, 8833.29]
  - - [5888, 128, 1, 128]
    - [341, 2741.65]
  - - [1024, 24000, 1, 2816]
    - [360, 8885.96]
  - - [7680, 5984, 1, 2560]
    - [360, 8573.52]
  - - [4288, 1856, 1, 256]
    - [355, 8183.23]
  - - [1856, 256, 1, 3328]
    - [355, 7414.46]
  - - [1856, 2944, 1, 256]
    - [358, 8008.15]
  - - [5056, 1024, 1, 128]
    - [344, 5065.78]
  - - [64, 5888, 1, 1280]
    - [331, 4420.54]
  - - [1760, 800, 1, 1760]
    - [352, 8386.33]
  - - [6784, 256, 1, 128]
    - [341, 3394.72]
  - - [5888, 704, 1, 128]
    - [344, 4351.53]
  - - [1408, 2368, 1, 128]
    - [342, 4296.23]
  - - [1024, 4288, 1, 1280]
    - [349, 8630.71]
  - - [2368, 5056, 1, 3328]
    - [347, 8711.02]
  - - [448, 4, 1, 128]
    - [365, 23.1086]
  - - [4, 256, 1, 3328]
    - [371, 321.71]
  - - [4288, 1024, 1, 3328]
    - [355, 8448.34]
  - - [6144, 48000, 1, 2560]
    - [360, 8267.06]
  - - [1024, 5056, 1, 3328]
    - [360, 9571.24]
  - - [1024, 1856, 1, 3328]
    - [354, 8747.57]
  - - [704, 704, 1, 1280]
    - [355, 6867.68]
  - - [128, 2368, 1, 1280]
    - [300, 4917.84]
  - - [1408, 128, 1, 3328]
    - [317, 5678.01]
  - - [3584, 256, 1, 1280]
    - [358, 7380.81]
  - - [4, 128, 1, 128]
    - [365, 6.55327]
  - - [5888, 64, 1, 1280]
    - [333, 4531.27]
  - - [3584, 128, 1, 1280]
    - [355, 6009.86]
  - - [4, 256, 1, 1280]
    - [323, 232.81]
  - - [128, 704, 1, 3328]
    - [300, 4895.29]
  - - [4288, 6784, 1, 256]
    - [354, 9026.77]
  - - [3584, 2944, 1, 3328]
    - [348, 8545.61]
  - - [128, 1856, 1, 256]
    - [355, 3449.65]
  - - [64, 4288, 1, 256]
    - [303, 2529.1]
  - - [4, 3584, 1, 3328]
    - [371, 560.545]
  - - [64, 4, 1, 3328]
    - [371, 125.014]
  - - [4, 64, 1, 3328]
    - [371, 121.061]
  - - [5888, 2944, 1, 256]
    - [360, 9468.21]
  - - [1856, 64, 1, 256]
    - [349, 2022.19]
  - - [5056, 128, 1, 1280]
    - [355, 6202.27]
  - - [448, 4288, 1, 1280]
    - [350, 8384.5]
  - - [448, 1856, 1, 3328]
    - [350, 7376.76]
  - - [1024, 4288, 1, 128]
    - [341, 3715.6]
  - - [4, 1024, 1, 256]
    - [314, 214.477]
  - - [5056, 4288, 1, 256]
    - [360, 9063.04]
  - - [1024, 448, 1, 256]
    - [349, 4635.69]
  - - [1024, 3584, 1, 256]
    - [360, 7504.85]
  - - [2944, 128, 1, 1280]
    - [306, 5319.82]
  - - [2048, 32, 1, 2048]
    - [319, 1956.68]
  - - [64, 256, 1, 256]
    - [302, 808.852]
  - - [1408, 4, 1, 128]
    - [365, 71.5601]
  - - [128, 2368, 1, 128]
    - [282, 1947.02]
  - - [256, 704, 1, 1280]
    - [355, 3977.22]
  - - [64, 2368, 1, 128]
    - [284, 1392.93]
  - - [6784, 6784, 1, 3328]
    - [360, 8893.69]
  - - [448, 5888, 1, 1280]
    - [349, 8191.98]
  - - [5056, 448, 1, 128]
    - [344, 4286.93]
  - - [4288, 704, 1, 1280]
    - [355, 8304.79]
  - - [3584, 2944, 1, 128]
    - [341, 5061.65]
  - - [6784, 256, 1, 1280]
    - [355, 7991.82]
  - - [256, 2944, 1, 1280]
    - [349, 7602.39]
  - - [64, 4288, 1, 128]
    - [284, 1959.52]
  - - [2368, 5888, 1, 3328]
    - [354, 8699.78]
  - - [4, 64, 1, 256]
    - [314, 20.1062]
  - - [704, 1024, 1, 3328]
    - [349, 7924.5]
  - - [2368, 1856, 1, 1280]
    - [355, 8673.29]
  - - [448, 5056, 1, 3328]
    - [349, 8481.64]
  - - [128, 448, 1, 128]
    - [289, 651.897]
  - - [128, 6784, 1, 256]
    - [350, 4342.86]
  - - [3584, 4288, 1, 128]
    - [341, 5114.68]
  - - [64, 448, 1, 128]
    - [280, 341.683]
  - - [5888, 4288, 1, 3328]
    - [360, 8690.11]
  - - [2368, 704, 1, 256]
    - [360, 6051.72]
  - - [256, 1856, 1, 3328]
    - [355, 7365.85]
  - - [1856, 128, 1, 256]
    - [355, 3449.65]
  - - [6784, 128, 1, 128]
    - [343, 2942.09]
  - - [3584, 1408, 1, 128]
    - [344, 4478.53]
  - - [1856, 5056, 1, 1280]
    - [355, 8645.66]
  - - [2944, 1024, 1, 1280]
    - [360, 9565.12]
  - - [5056, 4, 1, 256]
    - [314, 367.853]
  - - [3584, 5888, 1, 3328]
    - [348, 8767.52]
  - - [2368, 4288, 1, 256]
    - [352, 8376.96]
  - - [1024, 2368, 1, 3328]
    - [350, 8604.33]
  - - [64, 704, 1, 3328]
    - [336, 3938.13]
  - - [704, 1408, 1, 256]
    - [356, 6391.02]
  - - [4096, 128, 1, 4096]
    - [322, 5040.01]
  - - [1024, 3584, 1, 1280]
    - [360, 8950.72]
  - - [4288, 5888, 1, 3328]
    - [360, 8741.01]
  - - [4288, 4, 1, 1280]
    - [314, 470.441]
  - - [4608, 16, 1, 1536]
    - [319, 1497.33]
  - - [5888, 64, 1, 128]
    - [297, 2114.11]
  - - [4, 5888, 1, 128]
    - [365, 222.385]
  - - [1024, 2944, 1, 3328]
    - [360, 9517.79]
  - - [6784, 1856, 1, 256]
    - [355, 8671.48]
  - - [2048, 64, 1, 2048]
    - [338, 2639.3]
  - - [256, 6784, 1, 1280]
    - [360, 7981.21]
  - - [1856, 3584, 1, 256]
    - [354, 8068.89]
  - - [128, 448, 1, 3328]
    - [312, 4329.86]
  - - [6784, 1856, 1, 128]
    - [344, 5337.78]
  - - [4, 448, 1, 256]
    - [314, 119.094]
  - - [5056, 128, 1, 256]
    - [355, 4157.1]
  - - [512, 24000, 1, 2816]
    - [347, 9061.96]
  - - [256, 5888, 1, 1280]
    - [352, 8420.88]
  - - [4, 128, 1, 1280]
    - [323, 130.109]
  - - [16384, 1600, 1, 4096]
    - [354, 7160.24]
  - - [6784, 128, 1, 1280]
    - [350, 6798.65]
  - - [64, 1408, 1, 256]
    - [303, 2022.24]
  - - [2368, 1408, 1, 128]
    - [342, 4371.17]
  - - [1856, 448, 1, 256]
    - [352, 5452.59]
  - - [1408, 1024, 1, 128]
    - [341, 3774.75]
  - - [128, 64, 1, 128]
    - [284, 100.395]
  - - [6784, 3584, 1, 3328]
    - [360, 8715.97]
  - - [1760, 7000, 1, 1760]
    - [348, 9155.32]
  - - [2944, 64, 1, 3328]
    - [307, 5310.46]
  - - [64, 64, 1, 128]
    - [281, 52.4262]
  - - [2368, 5056, 1, 1280]
    - [354, 8979.95]
  - - [64, 4, 1, 1280]
    - [323, 64.1127]
  - - [1408, 2368, 1, 1280]
    - [349, 8683.07]
  - - [128, 1408, 1, 1280]
    - [300, 4654.98]
  - - [256, 64, 1, 3328]
    - [339, 2512.2]
  - - [704, 4288, 1, 128]
    - [344, 4571.65]
  - - [128, 1856, 1, 3328]
    - [325, 6504.03]
  - - [2944, 2944, 1, 256]
    - [360, 8242.33]
  - - [2944, 4, 1, 1280]
    - [314, 459.327]
  - - [5888, 4, 1, 256]
    - [314, 349.323]
  - - [6784, 256, 1, 256]
    - [360, 6130.59]
  - - [256, 5056, 1, 3328]
    - [349, 8689.49]
  - - [128, 4288, 1, 1280]
    - [355, 5298.35]
  - - [5056, 1856, 1, 128]
    - [344, 5419.42]
  - - [5056, 1024, 1, 3328]
    - [360, 9353.4]
  - - [128, 128, 1, 256]
    - [302, 884.781]
  - - [1760, 64, 1, 1760]
    - [300, 5030.49]
  - - [4288, 3584, 1, 3328]
    - [360, 8837.07]
  - - [448, 704, 1, 3328]
    - [355, 5096.94]
  - - [448, 448, 1, 128]
    - [344, 1659.35]
  - - [1024, 2368, 1, 1280]
    - [358, 8301.91]
  - - [1856, 704, 1, 3328]
    - [355, 8540.98]
  - - [4, 2368, 1, 128]
    - [365, 119.468]
  - - [5888, 6784, 1, 3328]
    - [360, 8719.01]
  - - [704, 4288, 1, 1280]
    - [350, 9019.96]
  - - [704, 256, 1, 256]
    - [349, 3038.25]
  - - [1024, 48000, 1, 2048]
    - [354, 7889.92]
  - - [4288, 1024, 1, 128]
    - [344, 4962.23]
  - - [512, 2048, 1, 49]
    - [377, 3811.02]
  - - [512, 128, 1, 784]
    - [374, 3002.58]
  - - [2048, 512, 1, 49]
    - [378, 3669.75]
  - - [1024, 256, 1, 196]
    - [379, 3399.96]
  - - [256, 64, 1, 3136]
    - [373, 2719.97]
  - - [256, 1024, 1, 196]
    - [380, 3468.0]
  - - [64, 256, 1, 3136]
    - [375, 2763.34]
  - - [128, 512, 1, 784]
    - [372, 3002.58]
  - - [64, 64, 1, 3136]
    - [376, 750.646]
  - - [512, 3955, 1, 2048]
    - [408, 3897.55]
  - - [59, 59, 512, 64]
    - [530, 1677.38]
  - - [2048, 3462, 1, 512]
    - [468, 5947.31]
  - - [512, 3323, 1, 2048]
    - [416, 4633.86]
  - - [33708, 1599, 1, 512]
    - [412, 5066.49]
  - - [512, 3990, 1, 512]
    - [399, 4980.59]
  - - [33708, 1424, 1, 512]
    - [477, 3054.05]
  - - [33708, 3955, 1, 512]
    - [443, 6043.02]
  - - [512, 3478, 1, 2048]
    - [456, 5006.33]
  - - [512, 4012, 1, 2048]
    - [386, 3847.65]
  - - [33708, 1917, 1, 512]
    - [423, 4038.92]
  - - [2048, 3484, 1, 512]
    - [479, 5976.4]
  - - [10, 10, 448, 64]
    - [539, 153.593]
  - - [33708, 3776, 1, 512]
    - [474, 4768.72]
  - - [2048, 3428, 1, 512]
    - [473, 5891.05]
  - - [103, 104, 16, 64]
    - [494, 740.379]
  - - [512, 3977, 1, 2048]
    - [408, 3913.24]
  - - [512, 3458, 1, 2048]
    - [474, 5089.86]
  - - [512, 3479, 1, 2048]
    - [451, 5022.08]
  - - [33708, 1680, 1, 512]
    - [432, 3341.99]
  - - [512, 3968, 1, 2048]
    - [391, 3928.41]
  - - [512, 3450, 1, 2048]
    - [456, 5057.58]
  - - [91, 91, 40, 64]
    - [537, 1182.57]
  - - [85, 85, 376, 64]
    - [518, 2112.57]
  - - [2048, 3418, 1, 512]
    - [462, 5876.71]
  - - [2048, 3508, 1, 512]
    - [473, 6015.38]
  - - [33708, 4020, 1, 512]
    - [381, 4999.09]
  - - [512, 3445, 1, 2048]
    - [477, 5101.49]
  - - [80, 80, 152, 64]
    - [535, 1622.54]
  - - [33708, 3995, 1, 512]
    - [405, 5306.62]
  - - [33708, 3977, 1, 512]
    - [448, 6171.18]
  - - [33708, 4005, 1, 512]
    - [459, 6028.68]
  - - [512, 3443, 1, 2048]
    - [474, 5005.33]
  - - [33708, 1520, 1, 512]
    - [403, 3675.91]
  - - [512, 3483, 1, 2048]
    - [458, 5084.89]
  - - [33708, 644, 1, 512]
    - [437, 4457.54]
  - - [512, 3360, 1, 2048]
    - [458, 4772.9]
  - - [512, 3381, 1, 2048]
    - [472, 4996.27]
  - - [512, 3430, 1, 2048]
    - [444, 4687.47]
  - - [33708, 3968, 1, 512]
    - [409, 5271.99]
  - - [33708, 3822, 1, 512]
    - [404, 4870.24]
  - - [33708, 3944, 1, 512]
    - [406, 5089.75]
  - - [512, 3990, 1, 2048]
    - [408, 3948.53]
  - - [103, 103, 16, 64]
    - [500, 715.394]
  - - [512, 3575, 1, 2048]
    - [474, 5105.98]
  - - [2048, 3287, 1, 512]
    - [438, 5755.64]
  - - [2048, 3456, 1, 512]
    - [446, 5973.25]
  - - [512, 3969, 1, 2048]
    - [402, 3794.58]
  - - [33708, 1615, 1, 512]
    - [412, 5128.49]
  - - [84, 84, 152, 64]
    - [545, 1725.55]
  - - [512, 3456, 1, 2048]
    - [461, 4812.21]
  - - [512, 3477, 1, 2048]
    - [480, 5080.32]
  - - [33708, 4012, 1, 512]
    - [451, 4858.09]
  - - [33708, 3969, 1, 512]
    - [417, 5626.04]
  - - [33708, 3976, 1, 512]
    - [411, 5639.16]
  - - [33708, 4032, 1, 512]
    - [406, 5181.62]
  - - [512, 3448, 1, 2048]
    - [451, 5037.43]
  - - [512, 3262, 1, 2048]
    - [472, 4917.97]
  - - [2048, 3262, 1, 512]
    - [438, 5708.34]
  - - [2048, 4030, 1, 512]
    - [480, 5602.64]
  - - [512, 3462, 1, 2048]
    - [456, 5191.29]
  - - [2048, 3430, 1, 512]
    - [450, 5900.93]
  - - [512, 3489, 1, 2048]
    - [453, 5226.8]
  - - [512, 3438, 1, 2048]
    - [458, 5002.68]
  - - [17, 17, 1816, 64]
    - [534, 613.577]
  - - [2048, 3483, 1, 512]
    - [462, 5978.3]
  - - [512, 3468, 1, 2048]
    - [472, 5159.84]
  - - [2048, 3532, 1, 512]
    - [452, 6051.4]
  - - [2048, 4005, 1, 512]
    - [465, 5571.71]
  - - [2048, 3242, 1, 512]
    - [438, 5680.37]
  - - [33708, 980, 1, 512]
    - [451, 2517.01]
  - - [512, 3219, 1, 2048]
    - [474, 4793.91]
  - - [512, 3137, 1, 2048]
    - [441, 4661.5]
  - - [112, 123, 16, 64]
    - [547, 938.096]
  - - [512, 3268, 1, 2048]
    - [451, 4922.82]
  - - [512, 3342, 1, 2048]
    - [458, 4860.5]
  - - [512, 3369, 1, 2048]
    - [456, 4789.53]
  - - [27, 27, 1168, 64]
    - [512, 925.34]
  - - [77, 78, 408, 64]
    - [529, 1926.41]
  - - [2048, 3548, 1, 512]
    - [473, 6063.4]
  - - [512, 3523, 1, 2048]
    - [453, 5083.52]
  - - [2048, 3489, 1, 512]
    - [473, 5982.08]
  - - [123, 122, 264, 64]
    - [491, 2661.5]
  - - [512, 3427, 1, 2048]
    - [474, 5111.74]
  - - [2048, 3547, 1, 512]
    - [473, 6075.63]
  - - [33708, 264, 1, 512]
    - [410, 4754.01]
  - - [512, 3297, 1, 2048]
    - [453, 4767.62]
  - - [2048, 3796, 1, 512]
    - [438, 5622.44]
  - - [2048, 3995, 1, 512]
    - [476, 5564.91]
  - - [21, 21, 1488, 64]
    - [506, 729.658]
  - - [512, 3529, 1, 2048]
    - [451, 5100.49]
  - - [512, 3386, 1, 2048]
    - [469, 4613.09]
  - - [2048, 3870, 1, 512]
    - [440, 5609.96]
  - - [78, 78, 248, 64]
    - [513, 1742.76]
  - - [33708, 3864, 1, 512]
    - [477, 4796.11]
  - - [38, 38, 840, 64]
    - [503, 1144.07]
  - - [2048, 4012, 1, 512]
    - [442, 5588.04]
  - - [64, 64, 496, 64]
    - [487, 1836.05]
  - - [512, 3327, 1, 2048]
    - [474, 4824.31]
  - - [33708, 714, 1, 512]
    - [458, 2017.29]
  - - [2048, 3438, 1, 512]
    - [460, 5903.21]
  - - [16, 16, 712, 64]
    - [504, 449.941]
  - - [29, 29, 1088, 64]
    - [526, 990.654]
  - - [2048, 3360, 1, 512]
    - [457, 5805.91]
  - - [2048, 3443, 1, 512]
    - [452, 5916.82]
  - - [512, 3942, 1, 2048]
    - [431, 3954.95]
  - - [512, 3383, 1, 2048]
    - [472, 5090.09]
  - - [512, 3314, 1, 2048]
    - [474, 4736.56]
  - - [2048, 3876, 1, 512]
    - [464, 5693.87]
  - - [2048, 3575, 1, 512]
    - [450, 6094.83]
  - - [2048, 2864, 1, 512]
    - [431, 5585.69]
  - - [21, 21, 1472, 64]
    - [525, 730.269]
  - - [512, 3978, 1, 512]
    - [389, 4963.85]
  - - [2048, 3384, 1, 512]
    - [473, 5825.33]
  - - [33708, 3780, 1, 512]
    - [477, 4785.36]
  - - [512, 3414, 1, 2048]
    - [451, 5083.24]
  - - [2048, 3322, 1, 512]
    - [438, 5795.43]
  - - [2048, 3955, 1, 512]
    - [435, 5560.63]
  - - [512, 3969, 1, 512]
    - [388, 4936.95]
  - - [512, 3978, 1, 2048]
    - [435, 3942.17]
  - - [512, 3487, 1, 2048]
    - [458, 4984.82]
  - - [512, 4032, 1, 512]
    - [396, 4982.05]
  - - [512, 3420, 1, 2048]
    - [461, 4960.68]
  - - [512, 3378, 1, 2048]
    - [461, 4587.18]
  - - [512, 3431, 1, 2048]
    - [456, 5069.1]
  - - [512, 3822, 1, 512]
    - [388, 4796.26]
  - - [14, 14, 704, 64]
    - [544, 369.088]
  - - [512, 3194, 1, 2048]
    - [414, 4346.5]
  - - [512, 3336, 1, 2048]
    - [480, 4865.77]
  - - [512, 3461, 1, 2048]
    - [441, 5024.79]
  - - [122, 122, 264, 64]
    - [488, 2637.82]
  - - [512, 3906, 1, 512]
    - [388, 4879.18]
  - - [2048, 3468, 1, 512]
    - [468, 5967.76]
  - - [512, 3520, 1, 2048]
    - [444, 4896.5]
  - - [512, 3092, 1, 2048]
    - [477, 4546.9]
  - - [54, 54, 592, 64]
    - [542, 1560.1]
  - - [2048, 3859, 1, 512]
    - [444, 5690.16]
  - - [2048, 3996, 1, 512]
    - [446, 5570.14]
  - - [512, 3467, 1, 2048]
    - [453, 5144.3]
  - - [7, 7, 736, 64]
    - [512, 82.2118]
  - - [65, 65, 496, 64]
    - [544, 1588.2]
  - - [512, 3780, 1, 2048]
    - [392, 3878.74]
  - - [19, 19, 680, 64]
    - [524, 565.571]
  - - [16, 16, 1920, 64]
    - [500, 570.018]
  - - [2048, 3422, 1, 512]
    - [473, 5887.17]
  - - [70, 71, 216, 64]
    - [543, 1518.0]
  - - [41, 41, 312, 64]
    - [382, 998.088]
  - - [512, 3538, 1, 2048]
    - [456, 5129.74]
  - - [512, 3996, 1, 512]
    - [399, 4974.04]
  - - [35, 35, 904, 64]
    - [502, 1065.44]
  - - [33708, 3910, 1, 512]
    - [458, 4867.52]
  - - [512, 3495, 1, 2048]
    - [477, 5155.04]
  - - [2048, 3495, 1, 512]
    - [449, 5993.09]
  - - [512, 3428, 1, 2048]
    - [441, 4898.5]
  - - [33708, 1232, 1, 512]
    - [458, 2868.48]
  - - [512, 3242, 1, 2048]
    - [472, 4962.88]
  - - [2048, 3458, 1, 512]
    - [479, 5954.17]
  - - [2048, 3501, 1, 512]
    - [479, 6002.65]
  - - [512, 3870, 1, 512]
    - [388, 4865.12]
  - - [2048, 3374, 1, 512]
    - [452, 5815.9]
  - - [512, 3385, 1, 2048]
    - [472, 5058.15]
  - - [2048, 3780, 1, 512]
    - [445, 5420.1]
  - - [2048, 2790, 1, 512]
    - [422, 5502.78]
  - - [512, 3490, 1, 2048]
    - [453, 5117.28]
  - - [2048, 3538, 1, 512]
    - [468, 6034.66]
  - - [18, 18, 648, 64]
    - [535, 525.784]
  - - [512, 3976, 1, 512]
    - [399, 4963.11]
  - - [512, 3511, 1, 2048]
    - [477, 5162.51]
  - - [512, 3539, 1, 2048]
    - [447, 5059.16]
  - - [512, 3332, 1, 2048]
    - [441, 4612.33]
  - - [13, 13, 2336, 64]
    - [543, 477.707]
  - - [512, 3484, 1, 2048]
    - [461, 4937.65]
  - - [26, 27, 56, 64]
    - [540, 186.624]
  - - [2048, 3533, 1, 512]
    - [462, 6053.85]
  - - [512, 4030, 1, 512]
    - [388, 4981.33]
  - - [512, 3390, 1, 2048]
    - [451, 4880.16]
  - - [2048, 3137, 1, 512]
    - [438, 5512.08]
  - - [33708, 3796, 1, 512]
    - [456, 4790.0]
  - - [512, 3925, 1, 512]
    - [400, 4885.66]
  - - [77, 77, 408, 64]
    - [517, 1886.27]
  - - [2048, 3528, 1, 512]
    - [446, 6033.6]
  - - [2048, 3376, 1, 512]
    - [452, 5827.15]
  - - [2048, 3268, 1, 512]
    - [450, 5649.01]
  - - [11, 11, 568, 64]
    - [497, 208.346]
  - - [33708, 3990, 1, 512]
    - [456, 4849.07]
  - - [512, 3608, 1, 2048]
    - [407, 4177.37]
  - - [2048, 3166, 1, 512]
    - [438, 5552.02]
  - - [2048, 3342, 1, 512]
    - [457, 5793.18]
  - - [33708, 3840, 1, 512]
    - [478, 4860.34]
  - - [77, 77, 248, 64]
    - [536, 1735.49]
  - - [2048, 3498, 1, 512]
    - [473, 5990.97]
  - - [512, 3859, 1, 2048]
    - [427, 4148.67]
  - - [33708, 2418, 1, 512]
    - [472, 6421.43]
  - - [2048, 3969, 1, 512]
    - [465, 5549.44]
  - - [2048, 3396, 1, 512]
    - [442, 5843.86]
  - - [2048, 3518, 1, 512]
    - [450, 6022.31]
  - - [512, 3598, 1, 2048]
    - [398, 4105.35]
  - - [2048, 3369, 1, 512]
    - [455, 5808.69]
  - - [33708, 3835, 1, 512]
    - [477, 4852.49]
  - - [512, 4005, 1, 2048]
    - [397, 3980.63]
  - - [512, 3501, 1, 2048]
    - [458, 5234.25]
  - - [512, 3447, 1, 2048]
    - [474, 4978.93]
  - - [2048, 3439, 1, 512]
    - [452, 5907.08]
  - - [2048, 3358, 1, 512]
    - [473, 5807.41]
  - - [33708, 781, 1, 512]
    - [419, 5383.57]
  - - [33708, 3870, 1, 512]
    - [477, 4802.97]
  - - [2048, 3968, 1, 512]
    - [452, 5559.58]
  - - [2048, 3477, 1, 512]
    - [476, 5971.63]
  - - [2048, 3237, 1, 512]
    - [462, 5600.89]
  - - [2048, 3410, 1, 512]
    - [479, 5857.98]
  - - [512, 3412, 1, 2048]
    - [480, 5053.15]
  - - [512, 3944, 1, 2048]
    - [431, 3984.07]
  - - [512, 3453, 1, 2048]
    - [480, 5033.3]
  - - [512, 3307, 1, 2048]
    - [451, 4769.9]
  - - [2048, 3251, 1, 512]
    - [452, 5629.24]
  - - [2048, 3385, 1, 512]
    - [452, 5830.6]
  - - [512, 3457, 1, 2048]
    - [453, 4958.96]
  - - [2048, 3323, 1, 512]
    - [442, 5738.47]
  - - [512, 3995, 1, 512]
    - [400, 4964.07]
  - - [512, 3532, 1, 2048]
    - [477, 5218.32]
  - - [512, 3517, 1, 2048]
    - [451, 5163.82]
  - - [2048, 3455, 1, 512]
    - [442, 5948.28]
  - - [33708, 720, 1, 512]
    - [421, 5660.07]
  - - [2048, 3427, 1, 512]
    - [442, 5907.25]
  - - [512, 3796, 1, 2048]
    - [393, 4029.22]
  - - [2048, 3257, 1, 512]
    - [442, 5632.05]
  - - [33708, 4030, 1, 512]
    - [458, 4908.72]
  - - [29, 29, 136, 64]
    - [533, 494.081]
  - - [2048, 3457, 1, 512]
    - [468, 5961.14]
  - - [512, 3514, 1, 2048]
    - [472, 5216.77]
  - - [512, 3364, 1, 2048]
    - [480, 4997.75]
  - - [512, 2790, 1, 2048]
    - [454, 4644.66]
  - - [15, 15, 688, 64]
    - [538, 399.234]
  - - [33708, 3925, 1, 512]
    - [477, 4867.96]
  - - [104, 104, 16, 64]
    - [546, 747.593]
  - - [33708, 3996, 1, 512]
    - [463, 6016.88]
  - - [2048, 4026, 1, 512]
    - [462, 5613.06]
  - - [2048, 3511, 1, 512]
    - [473, 6021.26]
  - - [2048, 3523, 1, 512]
    - [473, 6038.91]
  - - [54, 54, 200, 64]
    - [484, 1262.83]
  - - [112, 112, 16, 64]
    - [493, 862.721]
  - - [512, 3876, 1, 512]
    - [400, 4831.47]
  - - [2048, 3517, 1, 512]
    - [479, 6028.62]
  - - [512, 3876, 1, 2048]
    - [384, 4015.97]
  - - [12, 12, 480, 64]
    - [496, 226.2]
  - - [2048, 3450, 1, 512]
    - [452, 5925.97]
  - - [2048, 3976, 1, 512]
    - [440, 5654.74]
  - - [112, 112, 288, 64]
    - [489, 2529.38]
  - - [2048, 3402, 1, 512]
    - [460, 5850.63]
  - - [59, 59, 544, 64]
    - [529, 1700.7]
  - - [78, 78, 408, 64]
    - [533, 1921.7]
  - - [512, 3480, 1, 2048]
    - [453, 5118.52]
  - - [512, 3491, 1, 2048]
    - [477, 5123.52]
  - - [102, 102, 312, 64]
    - [487, 2208.28]
  - - [512, 3944, 1, 512]
    - [399, 4924.91]
  - - [512, 3391, 1, 2048]
    - [447, 4877.14]
  - - [2048, 3539, 1, 512]
    - [452, 6057.53]
  - - [65, 65, 472, 64]
    - [520, 1583.58]
  - - [2048, 3332, 1, 512]
    - [468, 5746.3]
  - - [33708, 540, 1, 512]
    - [439, 5065.66]
  - - [512, 3165, 1, 2048]
    - [458, 4815.32]
  - - [2048, 3470, 1, 512]
    - [479, 5958.16]
  - - [2048, 3497, 1, 512]
    - [452, 5998.7]
  - - [2048, 3480, 1, 512]
    - [473, 5970.98]
  - - [2048, 3365, 1, 512]
    - [449, 5803.21]
  - - [25, 25, 1256, 64]
    - [523, 858.51]
  - - [2048, 3530, 1, 512]
    - [452, 6034.1]
  - - [2048, 3319, 1, 512]
    - [430, 5801.63]
  - - [2048, 3297, 1, 512]
    - [430, 5760.33]
  - - [512, 3840, 1, 512]
    - [388, 4829.12]
  - - [2048, 3491, 1, 512]
    - [449, 5992.03]
  - - [512, 3910, 1, 2048]
    - [433, 4323.34]
  - - [2048, 3371, 1, 512]
    - [452, 5816.39]
  - - [45, 45, 712, 64]
    - [501, 1348.14]
  - - [2048, 3282, 1, 512]
    - [473, 5682.92]
  - - [512, 3325, 1, 2048]
    - [456, 4833.79]
  - - [512, 3286, 1, 2048]
    - [453, 4944.14]
  - - [2048, 3514, 1, 512]
    - [452, 6022.75]
  - - [33708, 1596, 1, 512]
    - [449, 3275.0]
  - - [71, 71, 448, 64]
    - [528, 1777.03]
  - - [2048, 3382, 1, 512]
    - [449, 5840.36]
  - - [33708, 1350, 1, 512]
    - [480, 3034.1]
  - - [2048, 3391, 1, 512]
    - [455, 5835.96]
  - - [91, 93, 40, 64]
    - [525, 1208.56]
  - - [33708, 2496, 1, 512]
    - [418, 6034.42]
  - - [33708, 189, 1, 512]
    - [424, 5700.9]
  - - [135, 134, 240, 64]
    - [516, 2490.73]
  - - [2048, 3507, 1, 512]
    - [449, 6020.23]
  - - [2048, 3509, 1, 512]
    - [468, 6008.36]
  - - [2048, 3388, 1, 512]
    - [473, 5837.19]
  - - [33708, 3942, 1, 512]
    - [477, 4892.62]
  - - [2048, 3399, 1, 512]
    - [457, 5861.13]
  - - [2048, 3529, 1, 512]
    - [450, 6043.34]
  - - [2048, 3386, 1, 512]
    - [442, 5831.61]
  - - [27, 27, 56, 64]
    - [509, 189.631]
  - - [512, 3324, 1, 2048]
    - [474, 4798.82]
  - - [512, 3518, 1, 2048]
    - [472, 5121.72]
  - - [512, 3440, 1, 2048]
    - [453, 5114.96]
  - - [33708, 468, 1, 512]
    - [454, 5330.79]
  - - [512, 3459, 1, 2048]
    - [451, 5157.29]
  - - [512, 3548, 1, 2048]
    - [415, 4461.11]
  - - [45, 45, 392, 64]
    - [531, 1237.96]
  - - [33708, 3876, 1, 512]
    - [480, 4829.71]
  - - [19, 19, 1632, 64]
    - [536, 681.408]
  - - [512, 3322, 1, 2048]
    - [458, 4706.18]
  - - [2048, 3165, 1, 512]
    - [430, 5559.9]
  - - [77, 78, 248, 64]
    - [515, 1753.24]
  - - [512, 3422, 1, 2048]
    - [477, 5108.05]
  - - [512, 3470, 1, 2048]
    - [458, 4994.82]
  - - [135, 135, 240, 64]
    - [527, 2492.76]
  - - [512, 3475, 1, 2048]
    - [458, 4926.38]
  - - [2048, 3925, 1, 512]
    - [429, 5510.24]
  - - [512, 3358, 1, 2048]
    - [472, 4784.95]
  - - [512, 3528, 1, 2048]
    - [466, 5060.3]
  - - [512, 3859, 1, 512]
    - [400, 4803.52]
  - - [512, 3396, 1, 2048]
    - [458, 4989.79]
  - - [512, 3497, 1, 2048]
    - [474, 5166.61]
  - - [512, 3439, 1, 2048]
    - [456, 5102.75]
  - - [512, 3237, 1, 2048]
    - [458, 5009.94]
  - - [102, 102, 56, 64]
    - [482, 1511.62]
  - - [23, 23, 1360, 64]
    - [508, 804.11]
  - - [512, 3402, 1, 2048]
    - [458, 5126.85]
  - - [12, 12, 2520, 64]
    - [507, 427.724]
  - - [512, 3365, 1, 2048]
    - [458, 5078.66]
  - - [512, 3507, 1, 2048]
    - [472, 5118.87]
  - - [33708, 560, 1, 512]
    - [428, 5382.44]
  - - [71, 71, 216, 64]
    - [505, 1524.69]
  - - [512, 3508, 1, 2048]
    - [458, 5215.52]
  - - [2048, 3440, 1, 512]
    - [473, 5918.86]
  - - [512, 3451, 1, 2048]
    - [480, 4949.35]
  - - [33708, 2205, 1, 512]
    - [476, 6064.82]
  - - [2048, 3520, 1, 512]
    - [470, 6026.47]
  - - [512, 3415, 1, 2048]
    - [474, 4970.24]
  - - [512, 3249, 1, 2048]
    - [480, 4890.55]
  - - [33708, 1462, 1, 512]
    - [436, 3131.51]
  - - [2048, 3381, 1, 512]
    - [462, 5829.38]
  - - [512, 3319, 1, 2048]
    - [474, 4886.79]
  - - [2048, 3999, 1, 512]
    - [440, 5649.43]
  - - [512, 3942, 1, 512]
    - [384, 4898.22]
  - - [512, 3460, 1, 2048]
    - [480, 5162.05]
  - - [2048, 3977, 1, 512]
    - [465, 5539.84]
  - - [512, 3503, 1, 2048]
    - [474, 5091.51]
  - - [512, 3344, 1, 2048]
    - [472, 4951.93]
  - - [18, 18, 1720, 64]
    - [511, 640.259]
  - - [512, 3234, 1, 2048]
    - [472, 4894.0]
  - - [33708, 493, 1, 512]
    - [413, 5592.58]
  - - [512, 3432, 1, 2048]
    - [453, 5087.03]
  - - [9, 9, 416, 64]
    - [532, 118.342]
  - - [2048, 3466, 1, 512]
    - [468, 5957.79]
  - - [512, 3999, 1, 2048]
    - [390, 4076.27]
  - - [512, 4032, 1, 2048]
    - [385, 3950.6]
  - - [512, 3541, 1, 2048]
    - [480, 5044.19]
  - - [32, 32, 624, 64]
    - [527, 1000.11]
  - - [2048, 3314, 1, 512]
    - [438, 5795.75]
  - - [26, 26, 56, 64]
    - [532, 179.705]
  - - [512, 4020, 1, 512]
    - [395, 4993.38]
  - - [512, 3822, 1, 2048]
    - [387, 4048.02]
  - - [512, 3315, 1, 2048]
    - [461, 4526.38]
  - - [512, 3481, 1, 2048]
    - [480, 5220.89]
  - - [512, 3547, 1, 2048]
    - [458, 5212.19]
  - - [512, 3906, 1, 2048]
    - [394, 4042.91]
  - - [2048, 3415, 1, 512]
    - [452, 5873.7]
  - - [123, 123, 264, 64]
    - [489, 2666.75]
  - - [2048, 3487, 1, 512]
    - [470, 5977.92]
  - - [512, 3376, 1, 2048]
    - [474, 5116.54]
  - - [33708, 550, 1, 512]
    - [435, 5220.85]
  - - [2048, 3840, 1, 512]
    - [414, 5467.37]
  - - [512, 3494, 1, 2048]
    - [453, 5186.54]
  - - [33708, 3999, 1, 512]
    - [475, 4855.63]
  - - [93, 93, 40, 64]
    - [508, 1215.03]
  - - [2048, 3378, 1, 512]
    - [468, 5827.76]
  - - [2048, 3460, 1, 512]
    - [468, 5949.65]
  - - [512, 3287, 1, 2048]
    - [461, 4741.54]
  - - [2048, 3219, 1, 512]
    - [438, 5642.86]
  - - [512, 3780, 1, 512]
    - [388, 4758.74]
  - - [2048, 3552, 1, 512]
    - [442, 6073.18]
  - - [2048, 3608, 1, 512]
    - [416, 5545.93]
  - - [512, 3371, 1, 2048]
    - [474, 4870.64]
  - - [512, 4012, 1, 512]
    - [399, 4995.71]
  - - [512, 3384, 1, 2048]
    - [458, 5167.95]
  - - [2048, 3503, 1, 512]
    - [450, 6009.71]
  - - [512, 3166, 1, 2048]
    - [453, 4766.13]
  - - [512, 3425, 1, 2048]
    - [480, 5107.14]
  - - [2048, 3344, 1, 512]
    - [457, 5774.03]
  - - [512, 3509, 1, 2048]
    - [472, 5098.14]
  - - [512, 3282, 1, 2048]
    - [453, 4905.8]
  - - [512, 3996, 1, 2048]
    - [401, 4016.24]
  - - [512, 4050, 1, 512]
    - [400, 4656.36]
  - - [2048, 3476, 1, 512]
    - [457, 5987.35]
  - - [512, 3329, 1, 2048]
    - [461, 4740.29]
  - - [512, 3374, 1, 2048]
    - [474, 5032.16]
  - - [2048, 3414, 1, 512]
    - [473, 5888.43]
  - - [32, 32, 992, 64]
    - [526, 1068.98]
  - - [512, 3498, 1, 2048]
    - [477, 5151.42]
  - - [2048, 3325, 1, 512]
    - [450, 5734.23]
  - - [2048, 3479, 1, 512]
    - [479, 5969.99]
  - - [33708, 4026, 1, 512]
    - [474, 4856.19]
  - - [512, 3519, 1, 2048]
    - [458, 5196.94]
  - - [512, 3870, 1, 2048]
    - [402, 3954.47]
  - - [2048, 3412, 1, 512]
    - [450, 5852.89]
  - - [2048, 4020, 1, 512]
    - [479, 5604.15]
  - - [512, 3455, 1, 2048]
    - [451, 5110.96]
  - - [2048, 3234, 1, 512]
    - [438, 5686.76]
  - - [33708, 936, 1, 512]
    - [432, 2432.18]
  - - [119, 119, 32, 64]
    - [490, 1444.67]
  - - [512, 3976, 1, 2048]
    - [397, 3928.64]
  - - [512, 3534, 1, 2048]
    - [477, 5194.7]
  - - [35, 35, 384, 64]
    - [485, 883.51]
  - - [512, 3418, 1, 2048]
    - [444, 4822.87]
  - - [41, 41, 776, 64]
    - [499, 1229.02]
  - - [512, 3339, 1, 2048]
    - [480, 4972.1]
  - - [33708, 3906, 1, 512]
    - [454, 4832.33]
  - - [512, 4026, 1, 512]
    - [383, 4990.32]
  - - [512, 3452, 1, 2048]
    - [477, 4966.38]
  - - [512, 3471, 1, 2048]
    - [480, 5186.11]
  - - [512, 4030, 1, 2048]
    - [385, 4012.53]
  - - [2048, 3459, 1, 512]
    - [449, 5945.04]
  - - [2048, 3534, 1, 512]
    - [473, 6045.32]
  - - [512, 3925, 1, 2048]
    - [400, 4054.27]
  - - [17, 17, 688, 64]
    - [519, 489.423]
  - - [33708, 3859, 1, 512]
    - [441, 6135.51]
  - - [512, 3382, 1, 2048]
    - [458, 5149.34]
  - - [23, 23, 64, 64]
    - [541, 157.258]
  - - [512, 3977, 1, 512]
    - [400, 4957.37]
  - - [93, 93, 344, 64]
    - [522, 2250.92]
  - - [512, 2864, 1, 2048]
    - [467, 4164.89]
  - - [512, 3466, 1, 2048]
    - [474, 5143.89]
  - - [512, 3293, 1, 2048]
    - [480, 4604.27]
  - - [512, 3999, 1, 512]
    - [399, 4988.3]
  - - [33708, 3978, 1, 512]
    - [471, 5941.4]
  - - [2048, 3598, 1, 512]
    - [434, 5295.93]
  - - [512, 3476, 1, 2048]
    - [441, 4742.1]
  - - [15, 15, 2048, 64]
    - [495, 537.999]
  - - [2048, 3519, 1, 512]
    - [470, 6023.3]
  - - [512, 3552, 1, 2048]
    - [474, 5084.93]
  - - [2048, 3978, 1, 512]
    - [455, 5549.97]
  - - [2048, 3339, 1, 512]
    - [468, 5780.2]
  - - [2048, 3452, 1, 512]
    - [442, 5922.94]
  - - [2048, 3541, 1, 512]
    - [460, 6049.98]
  - - [2048, 3293, 1, 512]
    - [438, 5753.34]
  - - [2048, 3113, 1, 512]
    - [430, 5860.57]
  - - [2048, 4032, 1, 512]
    - [438, 5968.87]
  - - [512, 3493, 1, 2048]
    - [474, 5126.99]
  - - [512, 3377, 1, 2048]
    - [420, 4608.37]
  - - [512, 3426, 1, 2048]
    - [477, 5116.72]
  - - [2048, 3420, 1, 512]
    - [442, 5896.63]
  - - [512, 3968, 1, 512]
    - [388, 4951.38]
  - - [2048, 3499, 1, 512]
    - [479, 6007.95]
  - - [512, 4005, 1, 512]
    - [389, 4983.49]
  - - [2048, 3432, 1, 512]
    - [479, 5897.2]
  - - [2048, 3431, 1, 512]
    - [462, 5899.07]
  - - [512, 3246, 1, 2048]
    - [453, 4824.99]
  - - [2048, 3493, 1, 512]
    - [449, 5996.19]
  - - [512, 3599, 1, 2048]
    - [426, 4131.47]
  - - [33708, 1458, 1, 512]
    - [453, 3116.52]
  - - [512, 3995, 1, 2048]
    - [397, 4054.97]
  - - [2048, 3478, 1, 512]
    - [452, 5958.88]
  - - [2048, 3822, 1, 512]
    - [444, 5655.63]
  - - [512, 3796, 1, 512]
    - [389, 4767.01]
  - - [2048, 3377, 1, 512]
    - [468, 5820.36]
  - - [2048, 3910, 1, 512]
    - [440, 5609.35]
  - - [2048, 3327, 1, 512]
    - [438, 5787.03]
  - - [2048, 3315, 1, 512]
    - [462, 5728.15]
  - - [2048, 3426, 1, 512]
    - [479, 5881.9]
  - - [2048, 3336, 1, 512]
    - [468, 5755.3]
  - - [2048, 3447, 1, 512]
    - [442, 5924.42]
  - - [38, 38, 320, 64]
    - [481, 924.131]
  - - [512, 3955, 1, 512]
    - [400, 4933.42]
  - - [2048, 3194, 1, 512]
    - [470, 5519.74]
  - - [33708, 184, 1, 512]
    - [425, 5286.57]
  - - [2048, 3490, 1, 512]
    - [479, 6000.5]
  - - [512, 3388, 1, 2048]
    - [461, 4871.34]
  - - [512, 3533, 1, 2048]
    - [456, 5186.77]
  - - [2048, 3390, 1, 512]
    - [479, 5844.19]
  - - [2048, 3329, 1, 512]
    - [457, 5750.24]
  - - [2048, 3307, 1, 512]
    - [442, 5716.42]
  - - [2048, 3461, 1, 512]
    - [449, 5942.71]
  - - [512, 3399, 1, 2048]
    - [451, 5093.05]
  - - [2048, 3364, 1, 512]
    - [473, 5810.69]
  - - [49, 49, 648, 64]
    - [534, 1442.29]
  - - [512, 4059, 1, 512]
    - [400, 4663.68]
  - - [512, 3113, 1, 2048]
    - [414, 4399.97]
  - - [25, 25, 176, 64]
    - [545, 482.423]
  - - [2048, 3942, 1, 512]
    - [428, 5544.0]
  - - [33708, 1290, 1, 512]
    - [480, 2899.25]
  - - [33708, 465, 1, 512]
    - [454, 5294.03]
  - - [2048, 3445, 1, 512]
    - [462, 5923.86]
  - - [2048, 3906, 1, 512]
    - [435, 5527.98]
  - - [2048, 3324, 1, 512]
    - [438, 5799.63]
  - - [512, 3927, 1, 512]
    - [399, 4907.14]
  - - [2048, 3475, 1, 512]
    - [462, 5965.3]
  - - [14, 14, 2184, 64]
    - [521, 507.321]
  - - [13, 13, 576, 64]
    - [515, 291.013]
  - - [2048, 3944, 1, 512]
    - [422, 5763.26]
  - - [512, 3499, 1, 2048]
    - [477, 5081.52]
  - - [2048, 3222, 1, 512]
    - [430, 5648.12]
  - - [2048, 3451, 1, 512]
    - [473, 5933.45]
  - - [2048, 3249, 1, 512]
    - [438, 5639.57]
  - - [80, 84, 152, 64]
    - [510, 1674.56]
  - - [70, 70, 216, 64]
    - [528, 1513.96]
  - - [512, 4020, 1, 2048]
    - [397, 4000.32]
  - - [2048, 3481, 1, 512]
    - [479, 5977.05]
  - - [512, 3530, 1, 2048]
    - [477, 5182.37]
  - - [512, 3472, 1, 2048]
    - [477, 5115.26]
  - - [512, 3840, 1, 2048]
    - [389, 4061.61]
  - - [512, 3910, 1, 512]
    - [399, 4887.62]
  - - [512, 3410, 1, 2048]
    - [458, 5104.67]
  - - [2048, 3425, 1, 512]
    - [442, 5899.49]
  - - [2048, 3990, 1, 512]
    - [476, 5567.81]
  - - [2048, 3092, 1, 512]
    - [438, 5831.11]
  - - [123, 123, 16, 64]
    - [529, 972.724]
  - - [512, 4026, 1, 2048]
    - [440, 4155.26]
  - - [2048, 3471, 1, 512]
    - [442, 5950.49]
  - - [512, 3515, 1, 2048]
    - [480, 5255.74]
  - - [135, 135, 32, 64]
    - [492, 1517.7]
  - - [2048, 3453, 1, 512]
    - [442, 5938.33]
  - - [2048, 3564, 1, 512]
    - [462, 6098.85]
  - - [2048, 3246, 1, 512]
    - [457, 5633.67]
  - - [49, 49, 160, 64]
    - [483, 1063.81]
  - - [512, 3222, 1, 2048]
    - [453, 4789.81]
  - - [33708, 208, 1, 512]
    - [419, 5004.17]
  - - [119, 135, 32, 64]
    - [498, 1475.59]
  - - [512, 3251, 1, 2048]
    - [472, 4969.13]
  - - [134, 134, 240, 64]
    - [527, 2459.21]
  - - [512, 3257, 1, 2048]
    - [420, 4530.66]
  - - [64, 65, 496, 64]
    - [486, 1791.66]
  - - [2048, 3383, 1, 512]
    - [479, 5841.37]
  - - [2048, 3494, 1, 512]
    - [449, 5997.92]
  - - [2048, 3472, 1, 512]
    - [457, 5970.29]
  - - [2048, 3467, 1, 512]
    - [449, 5959.51]
  - - [2048, 3515, 1, 512]
    - [442, 6033.96]
  - - [512, 3564, 1, 2048]
    - [456, 4960.15]
  - - [8, 8, 264, 64]
    - [514, 68.2128]
  - - [33708, 246, 1, 512]
    - [470, 5470.43]
  - - [2048, 3286, 1, 512]
    - [457, 5691.23]
  - - [2048, 3448, 1, 512]
    - [470, 5932.62]
  - - [2048, 3599, 1, 512]
    - [416, 5553.81]
  - - [4096, 64, 1, 1024]
    - [548, 2702.28]
  - - [4096, 6400, 1, 256]
    - [549, 5439.79]
- null
