library/src/blas3/Tensile/Logic/asm_full/vega10_Cijk_Ailk_Bljk_HBH.yaml
- {MinimumRequiredVersion: 4.5.0}
- vega10
- gfx900
- [Device 6863, Device 6862, Device 687f, Device 6860, Device 6861, 'Vega 10 XTX [Radeon
    SolutionIndex: 0
    SolutionNameMin: Cijk_Ailk_Bljk_HBH_MT016x016x16_PGR1_PLR1_TT02_02
    SolutionIndex: 1
    SolutionNameMin: Cijk_Ailk_Bljk_HBH_MT032x016x16_PGR1_PLR1_TT02_02
    SolutionIndex: 2
    SolutionNameMin: Cijk_Ailk_Bljk_HBH_MT128x032x16_PGR1_PLR1_TT04_04
    SolutionIndex: 3
    SolutionNameMin: Cijk_Ailk_Bljk_HBH_MT016x016x32_PGR1_PLR1_TT02_02
    SolutionIndex: 4
    SolutionNameMin: Cijk_Ailk_Bljk_HBH_MT032x008x32_PGR1_PLR1_TT02_02
    SolutionIndex: 5
    SolutionNameMin: Cijk_Ailk_Bljk_HBH_MT064x008x32_PGR1_PLR1_TT02_02
    SolutionIndex: 6
    SolutionNameMin: Cijk_Ailk_Bljk_HBH_MT064x016x32_PGR1_PLR1_TT02_02
    SolutionIndex: 7
    SolutionNameMin: Cijk_Ailk_Bljk_HBH_MT032x008x64_PGR1_PLR1_TT02_02
    SolutionIndex: 8
    SolutionNameMin: Cijk_Ailk_Bljk_HBH_MT064x008x64_PGR1_PLR1_TT02_02
    SolutionIndex: 9
    SolutionNameMin: Cijk_Ailk_Bljk_HBH_MT064x032x08_PGR1_PLR1_TT08_04
    SolutionIndex: 10
    SolutionNameMin: Cijk_Ailk_Bljk_HBH_MT032x016x16_PGR1_PLR1_TT04_02
    SolutionIndex: 11
    SolutionNameMin: Cijk_Ailk_Bljk_HBH_MT032x032x16_PGR1_PLR1_TT04_04
    SolutionIndex: 12
    SolutionNameMin: Cijk_Ailk_Bljk_HBH_MT032x016x16_PGR1_PLR1_TT02_02
    SolutionIndex: 13
    SolutionNameMin: Cijk_Ailk_Bljk_HBH_MT064x016x16_PGR1_PLR1_TT04_04
    SolutionIndex: 14
    SolutionNameMin: Cijk_Ailk_Bljk_HBH_MT016x016x24_PGR1_PLR1_TT02_02
    SolutionIndex: 15
    SolutionNameMin: Cijk_Ailk_Bljk_HBH_MT032x016x24_PGR1_PLR1_TT04_02
    SolutionIndex: 16
    SolutionNameMin: Cijk_Ailk_Bljk_HBH_MT064x016x32_PGR1_PLR1_TT02_02
    SolutionIndex: 17
    SolutionNameMin: Cijk_Ailk_Bljk_HBH_MT128x016x32_PGR1_PLR1_TT04_02
    SolutionIndex: 18
    SolutionNameMin: Cijk_Ailk_Bljk_HBH_MT032x008x32_PGR1_PLR1_TT02_02
    SolutionIndex: 19
    SolutionNameMin: Cijk_Ailk_Bljk_HBH_MT064x008x32_PGR1_PLR1_TT02_02
    SolutionIndex: 20
    SolutionNameMin: Cijk_Ailk_Bljk_HBH_MT048x064x08_PGR1_PLR1_TT06_08
    SolutionIndex: 21
    SolutionNameMin: Cijk_Ailk_Bljk_HBH_MT064x064x08_PGR1_PLR1_TT04_04
    SolutionIndex: 22
    SolutionNameMin: Cijk_Ailk_Bljk_HBH_MT064x128x08_PGR1_PLR1_TT04_08
    SolutionIndex: 23
    SolutionNameMin: Cijk_Ailk_Bljk_HBH_MT128x064x08_PGR1_PLR1_TT08_04
    SolutionIndex: 24
    SolutionNameMin: Cijk_Ailk_Bljk_HBH_MT032x032x16_PGR0_PLR1_TT04_04
    SolutionIndex: 25
    SolutionNameMin: Cijk_Ailk_Bljk_HBH_MT064x064x16_PGR0_PLR1_TT04_04
    SolutionIndex: 26
    SolutionNameMin: Cijk_Ailk_Bljk_HBH_MT064x064x16_PGR1_PLR1_TT04_04
    SolutionIndex: 27
    SolutionNameMin: Cijk_Ailk_Bljk_HBH_MT064x128x16_PGR1_PLR1_TT04_08
    SolutionIndex: 28
    SolutionNameMin: Cijk_Ailk_Bljk_HBH_MT128x064x16_PGR1_PLR1_TT08_04
    SolutionIndex: 29
    SolutionNameMin: Cijk_Ailk_Bljk_HBH_MT128x128x16_PGR1_PLR1_TT08_08
    SolutionIndex: 30
    SolutionNameMin: Cijk_Ailk_Bljk_HBH_MT032x032x24_PGR0_PLR1_TT04_04
    SolutionIndex: 31
    SolutionNameMin: Cijk_Ailk_Bljk_HBH_MT064x064x32_PGR1_PLR1_TT04_04
    SolutionIndex: 32
    SolutionNameMin: Cijk_Ailk_Bljk_HBH_MT128x064x32_PGR1_PLR1_TT08_04
    SolutionIndex: 33
    SolutionNameMin: Cijk_Ailk_Bljk_HBH_MT064x064x16_PGR1_PLR1_TT04_04
    SolutionIndex: 34
    SolutionNameMin: Cijk_Ailk_Bljk_HBH_MT128x064x16_PGR1_PLR1_TT04_08
    SolutionIndex: 35
    SolutionNameMin: Cijk_Ailk_Bljk_HBH_MT064x032x32_PGR1_PLR1_TT02_04
    SolutionIndex: 36
    SolutionNameMin: Cijk_Ailk_Bljk_HBH_MT064x064x16_PGR1_PLR1_TT04_04
    SolutionIndex: 37
    SolutionNameMin: Cijk_Ailk_Bljk_HBH_MT064x064x16_PGR1_PLR1_TT04_04
    SolutionIndex: 38
    SolutionNameMin: Cijk_Ailk_Bljk_HBH_MT032x128x16_PGR0_PLR0_TT04_04
    SolutionIndex: 39
    SolutionNameMin: Cijk_Ailk_Bljk_HBH_MT032x128x16_PGR0_PLR0_TT04_04
    SolutionIndex: 40
    SolutionNameMin: Cijk_Ailk_Bljk_HBH_MT064x064x16_PGR0_PLR0_TT04_04
    SolutionIndex: 41
    SolutionNameMin: Cijk_Ailk_Bljk_HBH_MT128x032x16_PGR0_PLR0_TT04_04
    SolutionIndex: 42
    SolutionNameMin: Cijk_Ailk_Bljk_HBH_MT128x032x16_PGR1_PLR0_TT04_04
    SolutionIndex: 43
    SolutionNameMin: Cijk_Ailk_Bljk_HBH_MT064x128x08_PGR1_PLR1_TT04_08
    SolutionIndex: 44
    SolutionNameMin: Cijk_Ailk_Bljk_HBH_MT064x064x08_PGR1_PLR1_TT04_04
    SolutionIndex: 45
    SolutionNameMin: Cijk_Ailk_Bljk_HBH_MT064x128x04_PGR1_PLR1_TT04_08
    SolutionIndex: 46
    SolutionNameMin: Cijk_Ailk_Bljk_HBH_MT064x064x04_PGR1_PLR1_TT04_04
    SolutionIndex: 47
    SolutionNameMin: Cijk_Ailk_Bljk_HBH_MT064x064x16_PGR1_PLR0_TT04_04
- - - [4096, 7000, 1, 4096]
    - [28, 10495.9]
  - - [5124, 9124, 1, 1760]
    - [20, 10280.0]
  - - [1760, 32, 1, 1760]
    - [4, 3013.78]
  - - [1024, 1500, 1, 1536]
    - [28, 11222.4]
  - - [512, 24000, 1, 2048]
    - [25, 10085.4]
  - - [3072, 24000, 1, 1024]
    - [28, 10565.6]
  - - [1024, 3000, 1, 2560]
    - [28, 11781.6]
  - - [512, 3136, 1, 2048]
    - [35, 9966.49]
  - - [7680, 4, 1, 2560]
    - [8, 1545.33]
  - - [64, 193600, 1, 64]
    - [33, 9976.61]
  - - [8448, 1500, 1, 2816]
    - [23, 10512.1]
  - - [784, 512, 64, 128]
    - [38, 10803.3]
  - - [2560, 7000, 1, 2560]
    - [27, 10528.0]
  - - [3072, 16, 1, 1024]
    - [6, 2444.06]
  - - [512, 48000, 1, 2048]
    - [28, 10230.5]
  - - [1760, 64, 1, 1760]
    - [6, 5216.8]
  - - [1024, 16, 1, 512]
    - [4, 760.01]
  - - [196, 256, 64, 1024]
    - [41, 8559.73]
  - - [512, 48000, 1, 1536]
    - [23, 10875.6]
  - - [2560, 32, 1, 2560]
    - [5, 4102.97]
  - - [4608, 1500, 1, 1536]
    - [25, 11526.6]
  - - [2048, 128, 1, 2048]
    - [17, 8340.0]
  - - [1024, 24000, 1, 2560]
    - [28, 10692.5]
  - - [4608, 3000, 1, 1536]
    - [26, 11025.6]
  - - [5124, 9124, 1, 2048]
    - [28, 10532.9]
  - - [2048, 16, 1, 2048]
    - [4, 1826.49]
  - - [1024, 700, 1, 512]
    - [26, 8737.72]
  - - [3072, 1, 1, 128]
    - [18, 79.2295]
  - - [5124, 700, 1, 2560]
    - [25, 11135.0]
  - - [8448, 16, 1, 2816]
    - [6, 4959.81]
  - - [6144, 6000, 1, 2560]
    - [27, 10684.2]
  - - [4608, 32, 1, 1536]
    - [12, 5289.84]
  - - [3072, 64, 1, 1024]
    - [16, 6501.96]
  - - [512, 16, 1, 512]
    - [1, 329.184]
  - - [7680, 2, 1, 2560]
    - [8, 778.33]
  - - [4224, 1, 1, 128]
    - [19, 107.34]
  - - [7680, 1, 1, 2560]
    - [8, 389.74]
  - - [128, 1500, 1, 1280]
    - [16, 6569.63]
  - - [1024, 1500, 1, 2816]
    - [22, 10946.8]
  - - [6144, 2, 1, 2560]
    - [7, 647.342]
  - - [8448, 48000, 1, 2816]
    - [28, 10486.1]
  - - [512, 6000, 1, 2048]
    - [32, 10954.6]
  - - [4224, 1500, 1, 176]
    - [26, 10760.3]
  - - [1024, 6000, 1, 2816]
    - [28, 11157.0]
  - - [1024, 48000, 1, 1536]
    - [28, 10650.8]
  - - [1024, 48000, 1, 2560]
    - [27, 10578.9]
  - - [4096, 32, 1, 4096]
    - [16, 6280.29]
  - - [512, 16, 1, 500000]
    - [7, 500.139]
  - - [2560, 128, 1, 2560]
    - [16, 7391.76]
  - - [4608, 24000, 1, 1536]
    - [28, 10532.1]
  - - [512, 2, 1, 500000]
    - [7, 62.5179]
  - - [7680, 48000, 1, 2560]
    - [28, 10519.5]
  - - [3072, 48000, 1, 1024]
    - [28, 10432.0]
  - - [1760, 16, 1, 1760]
    - [4, 1563.21]
  - - [1024, 1500, 1, 2048]
    - [32, 10431.3]
  - - [1024, 16, 1, 500000]
    - [7, 1000.68]
  - - [64, 193600, 1, 256]
    - [36, 11776.5]
  - - [1024, 3000, 1, 2048]
    - [32, 10998.6]
  - - [6144, 4, 1, 2560]
    - [4, 1300.64]
  - - [1024, 6000, 1, 2048]
    - [26, 10845.5]
  - - [512, 24000, 1, 2816]
    - [28, 10674.9]
  - - [6144, 48000, 1, 2560]
    - [28, 10619.5]
  - - [1760, 7000, 1, 1760]
    - [24, 10903.4]
  - - [8448, 3000, 1, 2816]
    - [28, 10565.3]
  - - [3072, 4, 1, 1024]
    - [4, 633.82]
  - - [4608, 48000, 1, 1536]
    - [28, 10468.6]
  - - [2048, 32, 1, 2048]
    - [6, 3497.85]
  - - [7680, 1500, 1, 2560]
    - [26, 10550.6]
  - - [4096, 128, 1, 4096]
    - [13, 9724.89]
  - - [4608, 16, 1, 1536]
    - [5, 3563.55]
  - - [512, 3000, 1, 1536]
    - [26, 11020.5]
  - - [3072, 2, 1, 1024]
    - [18, 318.096]
  - - [8448, 1, 1, 2816]
    - [19, 381.408]
  - - [1024, 3000, 1, 2816]
    - [22, 11437.9]
  - - [128, 1, 1, 1408]
    - [7, 7.19802]
  - - [64, 1, 1, 1216]
    - [14, 3.43329]
  - - [1024, 2, 1, 512]
    - [3, 91.9199]
  - - [1024, 4, 1, 500000]
    - [7, 250.063]
  - - [6144, 1, 1, 2560]
    - [4, 324.66]
  - - [5124, 9124, 1, 2560]
    - [28, 10256.4]
  - - [512, 48000, 1, 2816]
    - [28, 10633.3]
  - - [512, 3000, 1, 2816]
    - [27, 11077.6]
  - - [1024, 24000, 1, 1536]
    - [28, 10908.0]
  - - [7680, 6000, 1, 2560]
    - [27, 10494.2]
  - - [1760, 128, 1, 1760]
    - [17, 7174.91]
  - - [512, 1500, 1, 2816]
    - [11, 10165.4]
  - - [512, 1, 1, 512]
    - [1, 20.8166]
  - - [512, 6000, 1, 2560]
    - [28, 11267.7]
  - - [512, 8, 1, 500000]
    - [7, 250.065]
  - - [512, 24000, 1, 2560]
    - [27, 10696.1]
  - - [6144, 3000, 1, 2560]
    - [26, 10598.2]
  - - [1024, 24000, 1, 2816]
    - [28, 10545.6]
  - - [2048, 7000, 1, 2048]
    - [26, 10656.5]
  - - [7680, 3000, 1, 2560]
    - [25, 10411.2]
  - - [1024, 4, 1, 512]
    - [3, 180.323]
  - - [5124, 700, 1, 2048]
    - [31, 9831.82]
  - - [5124, 9124, 1, 4096]
    - [28, 10307.5]
  - - [4096, 64, 1, 4096]
    - [17, 8653.7]
  - - [256, 193600, 1, 64]
    - [34, 11235.8]
  - - [7680, 32, 1, 2560]
    - [15, 7252.9]
  - - [2560, 64, 1, 2560]
    - [1, 6114.55]
  - - [3136, 2048, 1, 512]
    - [40, 11590.3]
  - - [3072, 128, 1, 1024]
    - [10, 7798.6]
  - - [8448, 6000, 1, 2816]
    - [27, 10546.7]
  - - [7680, 64, 1, 2560]
    - [2, 9103.01]
  - - [5124, 1500, 1, 2560]
    - [26, 10481.7]
  - - [1024, 1500, 1, 2560]
    - [28, 11320.5]
  - - [512, 4, 1, 512]
    - [0, 82.2993]
  - - [1024, 6000, 1, 2560]
    - [23, 11242.6]
  - - [3072, 32, 1, 1024]
    - [19, 4369.45]
  - - [6144, 32, 1, 2560]
    - [16, 7077.65]
  - - [3136, 512, 1, 2048]
    - [42, 8878.15]
  - - [196, 1024, 64, 256]
    - [39, 10022.7]
  - - [512, 50176, 1, 128]
    - [34, 11955.5]
  - - [4608, 1, 1, 1536]
    - [4, 244.994]
  - - [1024, 32, 1, 512]
    - [4, 1499.84]
  - - [7680, 24000, 1, 2560]
    - [28, 10456.5]
  - - [8448, 4, 1, 2816]
    - [5, 1513.05]
  - - [512, 1, 1, 500000]
    - [7, 31.259]
  - - [176, 1500, 1, 1408]
    - [1, 6164.53]
  - - [512, 3000, 1, 2560]
    - [28, 11296.5]
  - - [8448, 24000, 1, 2816]
    - [28, 10457.5]
  - - [4608, 2, 1, 1536]
    - [4, 491.247]
  - - [512, 6000, 1, 1536]
    - [28, 11276.1]
  - - [7680, 128, 1, 2560]
    - [28, 10392.3]
  - - [3072, 6000, 1, 1024]
    - [25, 11166.3]
  - - [3072, 1500, 1, 128]
    - [28, 10476.7]
  - - [2048, 3136, 1, 512]
    - [36, 11850.2]
  - - [1024, 3000, 1, 1536]
    - [28, 11479.3]
  - - [512, 4, 1, 500000]
    - [7, 125.034]
  - - [512, 6000, 1, 2816]
    - [23, 11152.8]
  - - [128, 50176, 1, 512]
    - [37, 11700.3]
  - - [256, 12544, 1, 1024]
    - [2, 11053.5]
  - - [1024, 12544, 1, 256]
    - [36, 12023.5]
  - - [512, 48000, 1, 2560]
    - [28, 10615.3]
  - - [2560, 16, 1, 2560]
    - [4, 2264.84]
  - - [2048, 64, 1, 2048]
    - [16, 6039.59]
  - - [512, 2, 1, 512]
    - [1, 41.3901]
  - - [1024, 1, 1, 512]
    - [3, 45.9599]
  - - [512, 1500, 1, 2560]
    - [30, 8924.36]
  - - [512, 24000, 1, 1536]
    - [25, 11533.3]
  - - [1024, 1, 1, 500000]
    - [7, 62.5151]
  - - [6144, 16, 1, 2560]
    - [19, 4778.11]
  - - [1024, 24000, 1, 2048]
    - [28, 10489.4]
  - - [4096, 16, 1, 4096]
    - [4, 3634.65]
  - - [512, 32, 1, 512]
    - [4, 754.948]
  - - [5124, 1500, 1, 2048]
    - [28, 10143.9]
  - - [3072, 1500, 1, 1024]
    - [28, 11901.8]
  - - [1024, 2, 1, 500000]
    - [7, 125.028]
  - - [1024, 8, 1, 500000]
    - [7, 500.134]
  - - [7680, 16, 1, 2560]
    - [16, 5617.17]
  - - [6144, 1500, 1, 2560]
    - [26, 10653.3]
  - - [3072, 1, 1, 1024]
    - [4, 159.645]
  - - [1024, 48000, 1, 2816]
    - [27, 10539.8]
  - - [8448, 2, 1, 2816]
    - [5, 751.218]
  - - [4608, 4, 1, 1536]
    - [4, 982.494]
  - - [1024, 6000, 1, 1536]
    - [29, 11426.8]
  - - [8448, 32, 1, 2816]
    - [12, 6524.9]
  - - [512, 3000, 1, 2048]
    - [32, 10441.5]
  - - [6144, 24000, 1, 2560]
    - [28, 10596.4]
  - - [4608, 6000, 1, 1536]
    - [26, 10763.9]
  - - [1024, 1024, 1, 1024]
    - [28, 10634.6]
  - - [512, 1500, 1, 2048]
    - [31, 8680.62]
  - - [512, 1500, 1, 1536]
    - [26, 10059.8]
  - - [128, 1, 1, 1024]
    - [7, 6.96617]
  - - [3072, 3000, 1, 1024]
    - [28, 11789.5]
  - - [1024, 48000, 1, 2048]
    - [28, 10497.1]
- - - -1
    - - - 1
        - - - 32
            - - [448, 46]
              - [704, 47]
              - [-1, 46]
          - - 64
            - - [-1, 46]
          - - 128
            - - [32, 46]
              - [64, 47]
              - [2944, 46]
              - [3584, 47]
              - [5056, 46]
              - [-1, 45]
          - - 256
            - - [2368, 46]
              - [2944, 45]
              - [3584, 46]
              - [5056, 45]
              - [5888, 46]
              - [-1, 45]
          - - 448
            - - [1408, 46]
              - [2944, 45]
              - [4288, 46]
              - [5056, 45]
              - [-1, 46]
          - - 704
            - - [128, 46]
              - [256, 47]
              - [704, 46]
              - [1024, 45]
              - [1856, 46]
              - [2368, 45]
              - [2944, 46]
              - [4288, 45]
              - [-1, 46]
          - - 1024
            - - [704, 46]
              - [1024, 45]
              - [1408, 46]
              - [-1, 45]
          - - 1408
            - - [1408, 46]
              - [-1, 45]
          - - 1856
            - - [64, 46]
              - [128, 47]
              - [256, 46]
              - [448, 45]
              - [-1, 46]
          - - 2368
            - - [-1, 46]
          - - 2944
            - - [128, 46]
              - [256, 45]
              - [704, 46]
              - [-1, 45]
          - - 3584
            - - [32, 46]
              - [64, 45]
              - [448, 46]
              - [-1, 45]
          - - 4288
            - - [1024, 46]
              - [1408, 45]
              - [-1, 46]
          - - 5056
            - - [-1, 46]
          - - 5888
            - - [64, 46]
              - [128, 45]
              - [704, 46]
              - [-1, 45]
          - - -1
            - - [128, 46]
              - [256, 45]
              - [448, 46]
              - [-1, 45]
      - - 32
        - - - 256
            - - [-1, 44]
          - - 448
            - - [3584, 44]
              - [-1, 43]
          - - 704
            - - [2368, 44]
              - [-1, 43]
          - - 1024
            - - [2944, 44]
              - [-1, 43]
          - - 1408
            - - [2368, 44]
              - [3584, 43]
              - [4288, 44]
              - [5888, 43]
              - [-1, 44]
          - - 2368
            - - [704, 44]
              - [-1, 43]
          - - 2944
            - - [1024, 44]
              - [1408, 43]
              - [2368, 44]
              - [-1, 43]
          - - 3584
            - - [704, 44]
              - [1408, 43]
              - [2368, 44]
              - [-1, 43]
          - - 4288
            - - [448, 44]
              - [-1, 43]
          - - 5056
            - - [704, 44]
              - [-1, 43]
          - - 5888
            - - [704, 44]
              - [1408, 43]
              - [1856, 44]
              - [-1, 43]
          - - -1
            - - [1024, 44]
              - [-1, 43]
      - - 256
        - - - 1
            - - [-1, 46]
          - - 32
            - - [-1, 44]
          - - 64
            - - [1, 46]
              - [32, 44]
              - [64, 16]
              - [256, 0]
              - [448, 7]
              - [1024, 4]
              - [1856, 6]
              - [2368, 1]
              - [2944, 6]
              - [3584, 10]
              - [4288, 1]
              - [5056, 12]
              - [5888, 1]
              - [-1, 13]
          - - 128
            - - [1, 46]
              - [32, 44]
              - [64, 16]
              - [448, 4]
              - [704, 6]
              - [1024, 1]
              - [1408, 6]
              - [1856, 17]
              - [2368, 1]
              - [2944, 10]
              - [4288, 2]
              - [5056, 26]
              - [5888, 2]
              - [-1, 26]
          - - 256
            - - [1, 46]
              - [32, 44]
              - [128, 4]
              - [256, 0]
              - [448, 1]
              - [1024, 11]
              - [2944, 26]
              - [3584, 28]
              - [5056, 26]
              - [5888, 28]
              - [-1, 26]
          - - 448
            - - [1, 46]
              - [32, 44]
              - [64, 7]
              - [128, 4]
              - [256, 1]
              - [448, 17]
              - [5888, 26]
              - [-1, 27]
          - - 704
            - - [1, 46]
              - [32, 44]
              - [64, 4]
              - [128, 1]
              - [256, 11]
              - [2368, 26]
              - [3584, 27]
              - [4288, 26]
              - [5888, 27]
              - [-1, 26]
          - - 1024
            - - [1, 46]
              - [32, 44]
              - [128, 6]
              - [704, 26]
              - [1024, 9]
              - [3584, 28]
              - [4288, 25]
              - [5056, 28]
              - [-1, 26]
          - - 1408
            - - [1, 46]
              - [32, 44]
              - [64, 16]
              - [128, 6]
              - [448, 26]
              - [1856, 28]
              - [2368, 25]
              - [5888, 28]
              - [-1, 26]
          - - 1856
            - - [1, 46]
              - [32, 44]
              - [64, 5]
              - [128, 17]
              - [704, 26]
              - [1024, 28]
              - [1408, 27]
              - [1856, 23]
              - [2944, 26]
              - [3584, 27]
              - [4288, 26]
              - [5888, 9]
              - [-1, 25]
          - - 2368
            - - [1, 46]
              - [32, 44]
              - [64, 1]
              - [128, 6]
              - [704, 26]
              - [1024, 28]
              - [1408, 9]
              - [1856, 26]
              - [2368, 28]
              - [3584, 26]
              - [4288, 28]
              - [5056, 26]
              - [5888, 27]
              - [-1, 9]
          - - 2944
            - - [1, 46]
              - [32, 44]
              - [64, 6]
              - [128, 10]
              - [256, 26]
              - [448, 28]
              - [704, 9]
              - [1408, 28]
              - [2368, 26]
              - [2944, 28]
              - [3584, 26]
              - [4288, 28]
              - [5056, 26]
              - [5888, 28]
              - [-1, 23]
          - - 3584
            - - [1, 47]
              - [32, 44]
              - [64, 17]
              - [128, 26]
              - [256, 28]
              - [448, 26]
              - [704, 23]
              - [1856, 28]
              - [2368, 26]
              - [4288, 28]
              - [5056, 23]
              - [5888, 28]
              - [-1, 27]
          - - 4288
            - - [1, 46]
              - [32, 44]
              - [64, 1]
              - [128, 10]
              - [256, 26]
              - [448, 9]
              - [704, 28]
              - [1024, 26]
              - [1408, 28]
              - [2368, 26]
              - [5056, 28]
              - [-1, 27]
          - - 5056
            - - [1, 46]
              - [32, 44]
              - [64, 1]
              - [128, 2]
              - [448, 26]
              - [1408, 28]
              - [1856, 9]
              - [2368, 25]
              - [2944, 26]
              - [4288, 28]
              - [5056, 9]
              - [5888, 25]
              - [-1, 27]
          - - 5888
            - - [1, 46]
              - [32, 44]
              - [64, 10]
              - [128, 2]
              - [256, 28]
              - [448, 26]
              - [704, 28]
              - [1024, 26]
              - [2944, 28]
              - [3584, 9]
              - [4288, 28]
              - [5056, 27]
              - [5888, 22]
              - [-1, 23]
          - - -1
            - - [1, 46]
              - [32, 44]
              - [64, 26]
              - [128, 2]
              - [256, 26]
              - [448, 28]
              - [1408, 26]
              - [1856, 28]
              - [2368, 26]
              - [2944, 28]
              - [3584, 27]
              - [5056, 23]
              - [5888, 28]
              - [-1, 27]
      - - 1280
        - - - 1
            - - [2944, 47]
              - [5888, 46]
              - [-1, 47]
          - - 32
            - - [-1, 44]
          - - 64
            - - [1, 47]
              - [32, 44]
              - [64, 1]
              - [128, 14]
              - [448, 7]
              - [1024, 4]
              - [1408, 5]
              - [1856, 6]
              - [2368, 12]
              - [2944, 6]
              - [3584, 10]
              - [4288, 12]
              - [5056, 6]
              - [5888, 10]
              - [-1, 13]
          - - 128
            - - [1, 47]
              - [32, 44]
              - [64, 1]
              - [128, 7]
              - [256, 4]
              - [448, 18]
              - [704, 5]
              - [1024, 16]
              - [1408, 6]
              - [1856, 17]
              - [2368, 6]
              - [2944, 12]
              - [3584, 2]
              - [4288, 10]
              - [5888, 2]
              - [-1, 28]
          - - 256
            - - [1, 47]
              - [32, 44]
              - [64, 7]
              - [128, 4]
              - [256, 6]
              - [448, 16]
              - [704, 11]
              - [2368, 26]
              - [2944, 11]
              - [3584, 28]
              - [4288, 26]
              - [5888, 21]
              - [-1, 26]
          - - 448
            - - [1, 47]
              - [32, 44]
              - [128, 4]
              - [256, 6]
              - [448, 17]
              - [2368, 26]
              - [2944, 28]
              - [3584, 21]
              - [4288, 26]
              - [5056, 21]
              - [5888, 24]
              - [-1, 26]
          - - 704
            - - [1, 47]
              - [32, 44]
              - [128, 4]
              - [256, 11]
              - [1024, 26]
              - [1408, 9]
              - [2368, 26]
              - [2944, 27]
              - [4288, 26]
              - [5056, 27]
              - [5888, 24]
              - [-1, 26]
          - - 1024
            - - [1, 47]
              - [32, 44]
              - [64, 4]
              - [128, 6]
              - [256, 11]
              - [704, 26]
              - [1024, 23]
              - [1856, 26]
              - [2368, 23]
              - [3584, 28]
              - [4288, 26]
              - [5056, 28]
              - [5888, 9]
              - [-1, 21]
          - - 1408
            - - [1, 47]
              - [32, 44]
              - [64, 1]
              - [128, 16]
              - [448, 26]
              - [704, 28]
              - [1408, 26]
              - [1856, 28]
              - [2368, 21]
              - [2944, 9]
              - [3584, 23]
              - [4288, 27]
              - [5056, 28]
              - [5888, 23]
              - [-1, 21]
          - - 1856
            - - [1, 47]
              - [32, 44]
              - [64, 6]
              - [128, 17]
              - [448, 26]
              - [704, 21]
              - [1024, 26]
              - [1408, 22]
              - [1856, 28]
              - [2368, 26]
              - [2944, 22]
              - [3584, 9]
              - [4288, 26]
              - [5888, 9]
              - [-1, 26]
          - - 2368
            - - [1, 47]
              - [32, 44]
              - [64, 1]
              - [128, 6]
              - [448, 26]
              - [704, 21]
              - [1024, 23]
              - [1408, 28]
              - [1856, 25]
              - [2368, 9]
              - [4288, 26]
              - [5056, 25]
              - [5888, 9]
              - [-1, 22]
          - - 2944
            - - [1, 47]
              - [32, 44]
              - [64, 6]
              - [128, 12]
              - [704, 26]
              - [1408, 9]
              - [2944, 26]
              - [3584, 25]
              - [4288, 26]
              - [5056, 9]
              - [5888, 22]
              - [-1, 26]
          - - 3584
            - - [1, 47]
              - [32, 44]
              - [64, 17]
              - [128, 2]
              - [256, 28]
              - [448, 26]
              - [1856, 28]
              - [2368, 21]
              - [3584, 25]
              - [5056, 28]
              - [5888, 23]
              - [-1, 25]
          - - 4288
            - - [1, 46]
              - [32, 44]
              - [64, 12]
              - [128, 10]
              - [256, 21]
              - [448, 26]
              - [1024, 9]
              - [1408, 22]
              - [2944, 26]
              - [3584, 25]
              - [4288, 27]
              - [5056, 23]
              - [5888, 26]
              - [-1, 25]
          - - 5056
            - - [1, 46]
              - [32, 44]
              - [64, 16]
              - [128, 2]
              - [256, 21]
              - [704, 26]
              - [1408, 28]
              - [1856, 25]
              - [2944, 26]
              - [3584, 22]
              - [4288, 23]
              - [5056, 26]
              - [-1, 25]
          - - 5888
            - - [1, 46]
              - [32, 44]
              - [64, 10]
              - [128, 2]
              - [256, 26]
              - [448, 24]
              - [704, 28]
              - [1408, 26]
              - [1856, 25]
              - [2944, 28]
              - [3584, 25]
              - [4288, 23]
              - [5888, 26]
              - [-1, 23]
          - - -1
            - - [1, 46]
              - [32, 44]
              - [128, 2]
              - [448, 26]
              - [1024, 21]
              - [1856, 26]
              - [2368, 28]
              - [2944, 21]
              - [3584, 25]
              - [4288, 28]
              - [5056, 25]
              - [-1, 23]
      - - -1
        - - - 1
            - - [2368, 47]
              - [5888, 46]
              - [-1, 47]
          - - 32
            - - [-1, 44]
          - - 64
            - - [1, 47]
              - [32, 44]
              - [128, 14]
              - [448, 7]
              - [1024, 18]
              - [1408, 5]
              - [1856, 16]
              - [2368, 12]
              - [2944, 6]
              - [3584, 10]
              - [4288, 12]
              - [5888, 6]
              - [-1, 13]
          - - 128
            - - [1, 47]
              - [32, 44]
              - [64, 14]
              - [128, 7]
              - [256, 18]
              - [448, 4]
              - [704, 19]
              - [1024, 16]
              - [1408, 6]
              - [1856, 10]
              - [2368, 6]
              - [2944, 10]
              - [3584, 2]
              - [4288, 6]
              - [5056, 21]
              - [5888, 2]
              - [-1, 26]
          - - 256
            - - [1, 47]
              - [32, 44]
              - [64, 7]
              - [256, 4]
              - [448, 6]
              - [704, 11]
              - [1024, 31]
              - [1856, 26]
              - [2944, 21]
              - [3584, 26]
              - [4288, 21]
              - [5056, 25]
              - [-1, 26]
          - - 448
            - - [1, 47]
              - [32, 44]
              - [64, 18]
              - [128, 14]
              - [256, 16]
              - [448, 17]
              - [1408, 26]
              - [1856, 11]
              - [3584, 26]
              - [4288, 27]
              - [5888, 26]
              - [-1, 22]
          - - 704
            - - [1, 47]
              - [32, 44]
              - [64, 18]
              - [128, 5]
              - [256, 11]
              - [1408, 26]
              - [1856, 30]
              - [2944, 26]
              - [3584, 27]
              - [4288, 26]
              - [5056, 25]
              - [5888, 27]
              - [-1, 25]
          - - 1024
            - - [1, 47]
              - [32, 44]
              - [64, 4]
              - [128, 16]
              - [256, 11]
              - [448, 26]
              - [1024, 11]
              - [1408, 26]
              - [1856, 27]
              - [2368, 26]
              - [2944, 21]
              - [3584, 23]
              - [4288, 26]
              - [5056, 28]
              - [5888, 26]
              - [-1, 25]
          - - 1408
            - - [1, 47]
              - [32, 44]
              - [64, 5]
              - [128, 16]
              - [448, 26]
              - [704, 28]
              - [1024, 26]
              - [1408, 28]
              - [2368, 26]
              - [2944, 25]
              - [4288, 23]
              - [5056, 22]
              - [5888, 9]
              - [-1, 28]
          - - 1856
            - - [1, 47]
              - [32, 44]
              - [64, 6]
              - [128, 17]
              - [256, 26]
              - [448, 11]
              - [704, 21]
              - [1024, 28]
              - [1408, 27]
              - [1856, 23]
              - [2368, 21]
              - [2944, 26]
              - [3584, 27]
              - [4288, 26]
              - [-1, 25]
          - - 2368
            - - [1, 47]
              - [32, 44]
              - [64, 12]
              - [128, 16]
              - [256, 11]
              - [448, 21]
              - [704, 26]
              - [1024, 27]
              - [1408, 25]
              - [1856, 26]
              - [2368, 23]
              - [2944, 26]
              - [3584, 28]
              - [5056, 26]
              - [-1, 27]
          - - 2944
            - - [1, 47]
              - [32, 44]
              - [64, 6]
              - [128, 10]
              - [448, 26]
              - [704, 28]
              - [1024, 26]
              - [1408, 28]
              - [1856, 23]
              - [2368, 25]
              - [2944, 22]
              - [4288, 26]
              - [5056, 28]
              - [5888, 26]
              - [-1, 27]
          - - 3584
            - - [1, 47]
              - [32, 44]
              - [64, 17]
              - [128, 11]
              - [448, 26]
              - [1024, 9]
              - [1856, 28]
              - [3584, 26]
              - [5056, 28]
              - [-1, 27]
          - - 4288
            - - [1, 46]
              - [32, 44]
              - [128, 12]
              - [256, 26]
              - [448, 23]
              - [1024, 26]
              - [1408, 28]
              - [1856, 26]
              - [2368, 25]
              - [2944, 28]
              - [3584, 25]
              - [4288, 23]
              - [5056, 28]
              - [-1, 27]
          - - 5056
            - - [1, 46]
              - [32, 44]
              - [64, 16]
              - [128, 26]
              - [448, 21]
              - [704, 25]
              - [1856, 26]
              - [2368, 25]
              - [2944, 26]
              - [3584, 23]
              - [5056, 28]
              - [-1, 27]
          - - 5888
            - - [1, 47]
              - [32, 44]
              - [64, 10]
              - [128, 2]
              - [256, 26]
              - [448, 21]
              - [704, 28]
              - [1024, 25]
              - [2944, 28]
              - [4288, 23]
              - [5056, 28]
              - [5888, 23]
              - [-1, 28]
          - - -1
            - - [1, 47]
              - [32, 44]
              - [128, 2]
              - [256, 26]
              - [448, 9]
              - [704, 23]
              - [1024, 26]
              - [2944, 28]
              - [3584, 23]
              - [-1, 28]
