library/src/blas3/Tensile/Logic/asm_full/vega20_Cijk_Alik_Bjlk_HBH.yaml
- {MinimumRequiredVersion: 4.6.0}
- vega20
- gfx906
- [Device 66a0, Device 66a1, Device 66a7]
    SolutionIndex: 0
    SolutionNameMin: Cijk_Alik_Bjlk_HBH_MT032x064x08_PGR1_PLR1_TT04_08
    SolutionIndex: 1
    SolutionNameMin: Cijk_Alik_Bjlk_HBH_MT016x032x08_PGR1_PLR1_TT02_02
    SolutionIndex: 2
    SolutionNameMin: Cijk_Alik_Bjlk_HBH_MT032x064x08_PGR1_PLR1_TT02_04
    SolutionIndex: 3
    SolutionNameMin: Cijk_Alik_Bjlk_HBH_MT064x128x08_PGR1_PLR1_TT04_08
    SolutionIndex: 4
    SolutionNameMin: Cijk_Alik_Bjlk_HBH_MT032x064x08_PGR1_PLR1_TT04_08
    SolutionIndex: 5
    SolutionNameMin: Cijk_Alik_Bjlk_HBH_MT064x064x08_PGR1_PLR1_TT08_08
    SolutionIndex: 6
    SolutionNameMin: Cijk_Alik_Bjlk_HBH_MT032x064x08_PGR1_PLR1_TT02_04
    SolutionIndex: 7
    SolutionNameMin: Cijk_Alik_Bjlk_HBH_MT064x128x08_PGR1_PLR1_TT04_08
    SolutionIndex: 8
    SolutionNameMin: Cijk_Alik_Bjlk_HBH_MT016x016x16_PGR1_PLR1_TT02_02
    SolutionIndex: 9
    SolutionNameMin: Cijk_Alik_Bjlk_HBH_MT016x032x16_PGR1_PLR1_TT02_04
    SolutionIndex: 10
    SolutionNameMin: Cijk_Alik_Bjlk_HBH_MT032x032x16_PGR1_PLR1_TT04_04
    SolutionIndex: 11
    SolutionNameMin: Cijk_Alik_Bjlk_HBH_MT016x032x16_PGR1_PLR1_TT02_02
    SolutionIndex: 12
    SolutionNameMin: Cijk_Alik_Bjlk_HBH_MT016x064x16_PGR1_PLR1_TT02_04
    SolutionIndex: 13
    SolutionNameMin: Cijk_Alik_Bjlk_HBH_MT016x064x16_PGR1_PLR1_TT02_02
    SolutionIndex: 14
    SolutionNameMin: Cijk_Alik_Bjlk_HBH_MT016x128x16_PGR1_PLR1_TT02_04
    SolutionIndex: 15
    SolutionNameMin: Cijk_Alik_Bjlk_HBH_MT064x064x16_PGR1_PLR1_TT04_04
    SolutionIndex: 16
    SolutionNameMin: Cijk_Alik_Bjlk_HBH_MT064x128x16_PGR1_PLR1_TT04_08
    SolutionIndex: 17
    SolutionNameMin: Cijk_Alik_Bjlk_HBH_MT016x064x16_PGR1_PLR1_TT02_04
    SolutionIndex: 18
    SolutionNameMin: Cijk_Alik_Bjlk_HBH_MT016x064x16_PGR1_PLR1_TT02_02
    SolutionIndex: 19
    SolutionNameMin: Cijk_Alik_Bjlk_HBH_MT064x064x16_PGR1_PLR1_TT04_04
    SolutionIndex: 20
    SolutionNameMin: Cijk_Alik_Bjlk_HBH_MT064x128x16_PGR1_PLR1_TT04_08
    SolutionIndex: 21
    SolutionNameMin: Cijk_Alik_Bjlk_HBH_MT016x016x24_PGR1_PLR1_TT02_02
    SolutionIndex: 22
    SolutionNameMin: Cijk_Alik_Bjlk_HBH_MT016x032x24_PGR1_PLR1_TT02_04
    SolutionIndex: 23
    SolutionNameMin: Cijk_Alik_Bjlk_HBH_MT032x032x24_PGR1_PLR1_TT04_04
    SolutionIndex: 24
    SolutionNameMin: Cijk_Alik_Bjlk_HBH_MT016x016x24_PGR1_PLR1_TT02_02
    SolutionIndex: 25
    SolutionNameMin: Cijk_Alik_Bjlk_HBH_MT032x032x24_PGR1_PLR1_TT04_04
    SolutionIndex: 26
    SolutionNameMin: Cijk_Alik_Bjlk_HBH_MT008x064x32_PGR1_PLR1_TT02_02
    SolutionIndex: 27
    SolutionNameMin: Cijk_Alik_Bjlk_HBH_MT016x016x32_PGR1_PLR1_TT02_02
    SolutionIndex: 28
    SolutionNameMin: Cijk_Alik_Bjlk_HBH_MT016x032x32_PGR1_PLR1_TT02_02
    SolutionIndex: 29
    SolutionNameMin: Cijk_Alik_Bjlk_HBH_MT016x064x32_PGR1_PLR1_TT02_02
    SolutionIndex: 30
    SolutionNameMin: Cijk_Alik_Bjlk_HBH_MT008x064x32_PGR1_PLR1_TT02_02
    SolutionIndex: 31
    SolutionNameMin: Cijk_Alik_Bjlk_HBH_MT016x064x32_PGR1_PLR1_TT02_02
    SolutionIndex: 32
    SolutionNameMin: Cijk_Alik_Bjlk_HBH_MT008x064x64_PGR1_PLR1_TT02_02
    SolutionIndex: 33
    SolutionNameMin: Cijk_Alik_Bjlk_HBH_MT016x064x64_PGR1_PLR1_TT02_02
    SolutionIndex: 34
    SolutionNameMin: Cijk_Alik_Bjlk_HBH_MT008x064x64_PGR1_PLR1_TT02_02
    SolutionIndex: 35
    SolutionNameMin: Cijk_Alik_Bjlk_HBH_MT048x064x08_PGR1_PLR1_TT06_08
    SolutionIndex: 36
    SolutionNameMin: Cijk_Alik_Bjlk_HBH_MT048x064x08_PGR1_PLR1_TT06_08
    SolutionIndex: 37
    SolutionNameMin: Cijk_Alik_Bjlk_HBH_MT064x064x16_PGR0_PLR1_TT04_04
    SolutionIndex: 38
    SolutionNameMin: Cijk_Alik_Bjlk_HBH_MT128x064x16_PGR1_PLR1_TT08_04
    SolutionIndex: 39
    SolutionNameMin: Cijk_Alik_Bjlk_HBH_MT064x064x16_PGR0_PLR1_TT04_04
    SolutionIndex: 40
    SolutionNameMin: Cijk_Alik_Bjlk_HBH_MT128x064x16_PGR1_PLR1_TT08_04
    SolutionIndex: 41
    SolutionNameMin: Cijk_Alik_Bjlk_HBH_MT032x032x24_PGR0_PLR1_TT04_04
    SolutionIndex: 42
    SolutionNameMin: Cijk_Alik_Bjlk_HBH_MT064x128x04_PGR0_PLR0_TT04_08
    SolutionIndex: 43
    SolutionNameMin: Cijk_Alik_Bjlk_HBH_MT064x064x04_PGR0_PLR0_TT04_04
    SolutionIndex: 44
    SolutionNameMin: Cijk_Alik_Bjlk_HBH_MT064x064x04_PGR0_PLR1_TT04_04
    SolutionIndex: 45
    SolutionNameMin: Cijk_Alik_Bjlk_HBH_MT128x128x04_PGR1_PLR1_TT08_08
    SolutionIndex: 46
    SolutionNameMin: Cijk_Alik_Bjlk_HBH_MT064x128x04_PGR1_PLR1_TT04_08
    SolutionIndex: 47
    SolutionNameMin: Cijk_Alik_Bjlk_HBH_MT064x128x08_PGR0_PLR0_TT04_08
    SolutionIndex: 48
    SolutionNameMin: Cijk_Alik_Bjlk_HBH_MT064x064x08_PGR0_PLR0_TT04_04
    SolutionIndex: 49
    SolutionNameMin: Cijk_Alik_Bjlk_HBH_MT064x128x08_PGR1_PLR0_TT04_08
    SolutionIndex: 50
    SolutionNameMin: Cijk_Alik_Bjlk_HBH_MT064x064x08_PGR1_PLR0_TT04_04
    SolutionIndex: 51
    SolutionNameMin: Cijk_Alik_Bjlk_HBH_MT064x064x08_PGR0_PLR1_TT04_04
    SolutionIndex: 52
    SolutionNameMin: Cijk_Alik_Bjlk_HBH_MT064x064x08_PGR1_PLR1_TT04_04
    SolutionIndex: 53
    SolutionNameMin: Cijk_Alik_Bjlk_HBH_MT064x128x16_PGR1_PLR0_TT04_08
    SolutionIndex: 54
    SolutionNameMin: Cijk_Alik_Bjlk_HBH_MT064x064x16_PGR1_PLR0_TT04_04
    SolutionIndex: 55
    SolutionNameMin: Cijk_Alik_Bjlk_HBH_MT064x128x16_PGR1_PLR1_TT04_08
    SolutionIndex: 56
    SolutionNameMin: Cijk_Alik_Bjlk_HBH_MT064x064x16_PGR1_PLR1_TT04_04
    SolutionIndex: 57
    SolutionNameMin: Cijk_Alik_Bjlk_HBH_MT128x128x04_PGR0_PLR0_TT08_08
    SolutionIndex: 58
    SolutionNameMin: Cijk_Alik_Bjlk_HBH_MT064x128x04_PGR0_PLR0_TT04_08
    SolutionIndex: 59
    SolutionNameMin: Cijk_Alik_Bjlk_HBH_MT064x064x04_PGR0_PLR0_TT04_04
    SolutionIndex: 60
    SolutionNameMin: Cijk_Alik_Bjlk_HBH_MT064x128x04_PGR1_PLR0_TT04_08
    SolutionIndex: 61
    SolutionNameMin: Cijk_Alik_Bjlk_HBH_MT064x064x04_PGR1_PLR0_TT04_04
    SolutionIndex: 62
    SolutionNameMin: Cijk_Alik_Bjlk_HBH_MT064x128x04_PGR0_PLR1_TT04_08
    SolutionIndex: 63
    SolutionNameMin: Cijk_Alik_Bjlk_HBH_MT064x064x04_PGR0_PLR1_TT04_04
    SolutionIndex: 64
    SolutionNameMin: Cijk_Alik_Bjlk_HBH_MT128x128x04_PGR1_PLR1_TT08_08
    SolutionIndex: 65
    SolutionNameMin: Cijk_Alik_Bjlk_HBH_MT064x128x04_PGR1_PLR1_TT04_08
    SolutionIndex: 66
    SolutionNameMin: Cijk_Alik_Bjlk_HBH_MT064x064x04_PGR1_PLR1_TT04_04
    SolutionIndex: 67
    SolutionNameMin: Cijk_Alik_Bjlk_HBH_MT064x128x08_PGR0_PLR0_TT04_08
    SolutionIndex: 68
    SolutionNameMin: Cijk_Alik_Bjlk_HBH_MT064x064x08_PGR0_PLR0_TT04_04
    SolutionIndex: 69
    SolutionNameMin: Cijk_Alik_Bjlk_HBH_MT064x064x08_PGR1_PLR0_TT04_04
    SolutionIndex: 70
    SolutionNameMin: Cijk_Alik_Bjlk_HBH_MT064x128x08_PGR0_PLR1_TT04_08
    SolutionIndex: 71
    SolutionNameMin: Cijk_Alik_Bjlk_HBH_MT064x064x08_PGR0_PLR1_TT04_04
    SolutionIndex: 72
    SolutionNameMin: Cijk_Alik_Bjlk_HBH_MT128x128x08_PGR1_PLR1_TT08_08
    SolutionIndex: 73
    SolutionNameMin: Cijk_Alik_Bjlk_HBH_MT064x128x08_PGR1_PLR1_TT04_08
    SolutionIndex: 74
    SolutionNameMin: Cijk_Alik_Bjlk_HBH_MT064x064x08_PGR1_PLR1_TT04_04
    SolutionIndex: 75
    SolutionNameMin: Cijk_Alik_Bjlk_HBH_MT064x064x16_PGR0_PLR0_TT04_04
    SolutionIndex: 76
    SolutionNameMin: Cijk_Alik_Bjlk_HBH_MT064x128x16_PGR0_PLR1_TT04_08
    SolutionIndex: 77
    SolutionNameMin: Cijk_Alik_Bjlk_HBH_MT064x064x16_PGR0_PLR1_TT04_04
    SolutionIndex: 78
    SolutionNameMin: Cijk_Alik_Bjlk_HBH_MT064x064x16_PGR1_PLR1_TT04_04
- - - [2368, 1024, 1, 1]
    - [63, 134.117]
  - - [128, 256, 1, 1280]
    - [32, 1436.41]
  - - [32, 5056, 1, 1280]
    - [56, 1263.38]
  - - [448, 1, 1, 256]
    - [78, 3.05672]
  - - [5056, 1408, 1, 3328]
    - [3, 9839.64]
  - - [2368, 64, 1, 1]
    - [63, 12.3013]
  - - [5056, 1856, 1, 3328]
    - [15, 10122.4]
  - - [704, 64, 1, 1]
    - [72, 4.26667]
  - - [448, 3584, 1, 3328]
    - [15, 8495.84]
  - - [2368, 32, 1, 256]
    - [52, 554.881]
  - - [5888, 256, 1, 256]
    - [15, 8189.22]
  - - [448, 3584, 1, 32]
    - [51, 2032.45]
  - - [1856, 256, 1, 1]
    - [59, 42.4229]
  - - [6784, 6784, 1, 1280]
    - [16, 10275.6]
  - - [448, 1, 1, 1]
    - [59, 0.0411765]
  - - [1408, 3584, 1, 3328]
    - [15, 9863.04]
  - - [448, 448, 1, 3328]
    - [14, 5390.11]
  - - [1024, 2368, 1, 3328]
    - [15, 9199.54]
  - - [1, 4288, 1, 1280]
    - [78, 30.0516]
  - - [6784, 64, 1, 32]
    - [52, 959.505]
  - - [256, 128, 1, 256]
    - [11, 927.943]
  - - [448, 3584, 1, 1]
    - [62, 107.905]
  - - [448, 64, 1, 1]
    - [77, 2.32727]
  - - [32, 1408, 1, 32]
    - [51, 93.3803]
  - - [64, 1024, 1, 1280]
    - [29, 2774.01]
  - - [1, 1408, 1, 3328]
    - [78, 15.3252]
  - - [32, 3584, 1, 1280]
    - [56, 1300.5]
  - - [1024, 1, 1, 3328]
    - [78, 11.1807]
  - - [32, 1024, 1, 3328]
    - [56, 386.599]
  - - [1408, 5056, 1, 1]
    - [59, 204.095]
  - - [1024, 64, 1, 1280]
    - [29, 2766.69]
  - - [64, 5056, 1, 3328]
    - [18, 6644.17]
  - - [5888, 4288, 1, 3328]
    - [3, 10140.7]
  - - [1, 2368, 1, 1280]
    - [78, 24.0101]
  - - [704, 1024, 1, 1]
    - [58, 60.8865]
  - - [2368, 1408, 1, 32]
    - [42, 2683.42]
  - - [256, 1856, 1, 1280]
    - [15, 7084.97]
  - - [1024, 2944, 1, 1]
    - [58, 148.359]
  - - [2944, 3584, 1, 3328]
    - [19, 10009.7]
  - - [2368, 2944, 1, 1280]
    - [19, 9887.62]
  - - [256, 1408, 1, 1]
    - [74, 33.3748]
  - - [1, 1024, 1, 3328]
    - [78, 11.219]
  - - [3584, 1408, 1, 32]
    - [42, 3081.69]
  - - [6784, 1856, 1, 32]
    - [42, 3497.53]
  - - [5056, 256, 1, 256]
    - [15, 8121.32]
  - - [1856, 2368, 1, 256]
    - [15, 9407.38]
  - - [2368, 1024, 1, 3328]
    - [15, 9049.34]
  - - [3584, 4288, 1, 32]
    - [42, 3678.8]
  - - [1024, 1024, 1, 1280]
    - [15, 8938.31]
  - - [32, 128, 1, 3328]
    - [56, 48.6005]
  - - [32, 2944, 1, 3328]
    - [56, 1117.81]
  - - [704, 1408, 1, 3328]
    - [15, 8621.21]
  - - [1408, 704, 1, 256]
    - [15, 7606.58]
  - - [704, 64, 1, 32]
    - [51, 91.0222]
  - - [5888, 1, 1, 3328]
    - [78, 42.4581]
  - - [5056, 4288, 1, 32]
    - [42, 3519.5]
  - - [6784, 128, 1, 3328]
    - [2, 8208.01]
  - - [2944, 1856, 1, 1]
    - [63, 189.199]
  - - [32, 448, 1, 3328]
    - [56, 170.833]
  - - [5056, 1, 1, 3328]
    - [78, 36.4902]
  - - [2368, 3584, 1, 1280]
    - [36, 9749.46]
  - - [4288, 5056, 1, 1]
    - [59, 238.558]
  - - [128, 4288, 1, 3328]
    - [17, 7006.06]
  - - [1408, 4288, 1, 1280]
    - [15, 9803.13]
  - - [1856, 704, 1, 1280]
    - [15, 9185.41]
  - - [448, 5888, 1, 256]
    - [15, 8526.3]
  - - [1, 5888, 1, 3328]
    - [78, 42.436]
  - - [1024, 128, 1, 32]
    - [48, 267.494]
  - - [32, 4288, 1, 1280]
    - [56, 1058.05]
  - - [1024, 5056, 1, 1]
    - [62, 183.334]
  - - [704, 3584, 1, 1280]
    - [15, 9467.68]
  - - [1856, 5056, 1, 256]
    - [15, 9781.3]
  - - [1408, 1024, 1, 1280]
    - [15, 8656.16]
  - - [5056, 5888, 1, 3328]
    - [20, 10273.7]
  - - [3584, 3584, 1, 1280]
    - [15, 10162.2]
  - - [2368, 3584, 1, 32]
    - [42, 3411.82]
  - - [5056, 5056, 1, 1]
    - [59, 247.705]
  - - [2368, 256, 1, 32]
    - [51, 1218.51]
  - - [1024, 6784, 1, 1280]
    - [15, 10053.3]
  - - [1024, 3584, 1, 1]
    - [62, 159.844]
  - - [256, 5056, 1, 1]
    - [62, 92.9839]
  - - [32, 5056, 1, 32]
    - [52, 409.6]
  - - [5888, 32, 1, 32]
    - [50, 448.61]
  - - [64, 128, 1, 3328]
    - [26, 374.491]
  - - [256, 5056, 1, 32]
    - [43, 1835.94]
  - - [5056, 64, 1, 32]
    - [50, 765.879]
  - - [128, 6784, 1, 32]
    - [51, 1536.91]
  - - [64, 128, 1, 1]
    - [63, 0.691892]
  - - [64, 2368, 1, 1280]
    - [13, 4557.95]
  - - [128, 704, 1, 32]
    - [43, 182.969]
  - - [64, 6784, 1, 3328]
    - [17, 6769.76]
  - - [2944, 256, 1, 1280]
    - [15, 8103.91]
  - - [2944, 4288, 1, 256]
    - [15, 9615.9]
  - - [1024, 1024, 1, 3328]
    - [19, 9118.05]
  - - [5056, 704, 1, 32]
    - [42, 2593.39]
  - - [1856, 4288, 1, 3328]
    - [15, 10131.1]
  - - [1, 1856, 1, 256]
    - [78, 12.6098]
  - - [6784, 4288, 1, 32]
    - [42, 3751.1]
  - - [4288, 1024, 1, 3328]
    - [0, 9231.87]
  - - [256, 128, 1, 1]
    - [63, 2.78639]
  - - [3584, 448, 1, 3328]
    - [19, 8356.59]
  - - [2944, 448, 1, 256]
    - [15, 7239.31]
  - - [3584, 2368, 1, 3328]
    - [19, 9969.65]
  - - [4288, 1856, 1, 1]
    - [59, 208.995]
  - - [1856, 2944, 1, 1]
    - [59, 189.724]
  - - [32, 4288, 1, 3328]
    - [56, 1103.24]
  - - [1, 3584, 1, 3328]
    - [78, 39.4847]
  - - [256, 32, 1, 3328]
    - [56, 96.9523]
  - - [1856, 2368, 1, 32]
    - [42, 2925.13]
  - - [4288, 1856, 1, 32]
    - [42, 3336.91]
  - - [5056, 64, 1, 3328]
    - [13, 6683.76]
  - - [6784, 1, 1, 1280]
    - [74, 46.4459]
  - - [32, 2368, 1, 256]
    - [52, 549.849]
  - - [1408, 64, 1, 1]
    - [59, 7.66258]
  - - [1, 1, 1, 3328]
    - [78, 0.0109301]
  - - [5056, 2368, 1, 256]
    - [15, 9691.95]
  - - [1408, 5888, 1, 256]
    - [3, 9785.68]
  - - [5056, 6784, 1, 1]
    - [63, 255.055]
  - - [32, 448, 1, 1280]
    - [56, 154.151]
  - - [32, 448, 1, 32]
    - [46, 34.3377]
  - - [256, 5056, 1, 1280]
    - [19, 9095.03]
  - - [704, 2368, 1, 1]
    - [58, 109.102]
  - - [64, 1024, 1, 32]
    - [48, 131.072]
  - - [1024, 256, 1, 256]
    - [15, 4686.37]
  - - [128, 1, 1, 1]
    - [77, 0.0118519]
  - - [128, 3584, 1, 256]
    - [19, 5825.42]
  - - [3584, 4288, 1, 1280]
    - [16, 9982.57]
  - - [1856, 128, 1, 32]
    - [52, 562.291]
  - - [1856, 128, 1, 1280]
    - [14, 6033.47]
  - - [128, 2944, 1, 3328]
    - [14, 6951.76]
  - - [1, 6784, 1, 3328]
    - [78, 48.8429]
  - - [2368, 4288, 1, 1]
    - [63, 209.102]
  - - [4288, 448, 1, 3328]
    - [15, 8832.28]
  - - [4288, 32, 1, 3328]
    - [56, 1093.1]
  - - [32, 2944, 1, 256]
    - [52, 655.36]
  - - [256, 1856, 1, 1]
    - [68, 41.2444]
  - - [704, 6784, 1, 1280]
    - [15, 9739.35]
  - - [3584, 6784, 1, 1]
    - [70, 240.446]
  - - [704, 5056, 1, 1280]
    - [15, 9723.53]
  - - [256, 3584, 1, 3328]
    - [15, 7995.01]
  - - [1024, 32, 1, 3328]
    - [56, 386.928]
  - - [3584, 6784, 1, 32]
    - [42, 3802.01]
  - - [3584, 6784, 1, 1280]
    - [19, 10178.5]
  - - [4288, 4288, 1, 3328]
    - [3, 10027.1]
  - - [3584, 64, 1, 1280]
    - [22, 5779.55]
  - - [64, 1856, 1, 256]
    - [29, 3115.65]
  - - [3584, 64, 1, 32]
    - [48, 556.063]
  - - [448, 1, 1, 1280]
    - [78, 4.48842]
  - - [256, 4288, 1, 1280]
    - [15, 7750.95]
  - - [1408, 3584, 1, 1]
    - [58, 183.367]
  - - [4288, 1856, 1, 3328]
    - [19, 9940.68]
  - - [1856, 2944, 1, 1280]
    - [15, 10070.8]
  - - [4288, 256, 1, 256]
    - [15, 7025.46]
  - - [128, 5888, 1, 32]
    - [51, 1382.87]
  - - [128, 5888, 1, 1280]
    - [15, 8186.44]
  - - [1408, 128, 1, 3328]
    - [13, 5645.57]
  - - [3584, 256, 1, 256]
    - [15, 6957.38]
  - - [32, 6784, 1, 3328]
    - [56, 1726.41]
  - - [64, 64, 1, 1280]
    - [21, 167.609]
  - - [32, 3584, 1, 256]
    - [56, 926.772]
  - - [704, 256, 1, 32]
    - [51, 353.38]
  - - [448, 128, 1, 3328]
    - [29, 2595.77]
  - - [64, 2944, 1, 3328]
    - [13, 5924.49]
  - - [64, 4288, 1, 3328]
    - [13, 5685.44]
  - - [5056, 1024, 1, 3328]
    - [15, 9928.42]
  - - [2368, 64, 1, 3328]
    - [11, 4783.43]
  - - [1856, 256, 1, 256]
    - [15, 6033.47]
  - - [3584, 704, 1, 1]
    - [59, 136.533]
  - - [256, 704, 1, 256]
    - [10, 3314.46]
  - - [448, 5056, 1, 1]
    - [61, 129.879]
  - - [5888, 5888, 1, 256]
    - [3, 9911.48]
  - - [3584, 704, 1, 32]
    - [54, 2151.93]
  - - [448, 6784, 1, 3328]
    - [15, 9709.11]
  - - [6784, 4288, 1, 1]
    - [58, 252.867]
  - - [5056, 704, 1, 1]
    - [59, 160.046]
  - - [1408, 2368, 1, 32]
    - [46, 2599.72]
  - - [448, 5056, 1, 32]
    - [42, 2323.17]
  - - [4288, 4288, 1, 1280]
    - [19, 10062.3]
  - - [6784, 1408, 1, 1]
    - [62, 222.758]
  - - [5888, 256, 1, 3328]
    - [19, 9013.19]
  - - [1856, 5888, 1, 3328]
    - [3, 10337.4]
  - - [1024, 704, 1, 1]
    - [73, 54.9463]
  - - [5056, 5888, 1, 1]
    - [59, 252.115]
  - - [2944, 1024, 1, 256]
    - [3, 8874.79]
  - - [448, 1408, 1, 3328]
    - [15, 7016.21]
  - - [5056, 32, 1, 3328]
    - [56, 1293.84]
  - - [2368, 4288, 1, 3328]
    - [39, 9851.79]
  - - [1024, 704, 1, 32]
    - [48, 1310.72]
  - - [448, 2944, 1, 256]
    - [15, 7365.65]
  - - [2944, 6784, 1, 256]
    - [3, 9760.33]
  - - [2368, 2368, 1, 1280]
    - [15, 9737.22]
  - - [5888, 128, 1, 3328]
    - [19, 8367.34]
  - - [256, 256, 1, 32]
    - [48, 131.731]
  - - [1024, 1, 1, 256]
    - [74, 6.97191]
  - - [3584, 3584, 1, 32]
    - [42, 3578.01]
  - - [2944, 448, 1, 1]
    - [61, 93.6727]
  - - [128, 32, 1, 32]
    - [56, 9.47052]
  - - [5056, 64, 1, 1280]
    - [13, 6399.68]
  - - [2944, 2944, 1, 1280]
    - [3, 9858.81]
  - - [1, 2368, 1, 256]
    - [78, 16.0203]
  - - [64, 6784, 1, 1]
    - [66, 40.806]
  - - [2944, 32, 1, 1280]
    - [56, 998.23]
  - - [64, 1408, 1, 3328]
    - [26, 3775.08]
  - - [256, 448, 1, 1280]
    - [26, 4247.7]
  - - [2368, 2944, 1, 1]
    - [59, 202.657]
  - - [6784, 4288, 1, 1280]
    - [39, 10024.5]
  - - [2944, 704, 1, 256]
    - [15, 8738.13]
  - - [5888, 1856, 1, 256]
    - [15, 9670.89]
  - - [704, 2944, 1, 3328]
    - [15, 9682.11]
  - - [5888, 256, 1, 1]
    - [63, 104.097]
  - - [704, 704, 1, 32]
    - [52, 1037.94]
  - - [256, 4288, 1, 256]
    - [15, 7125.21]
  - - [5056, 6784, 1, 32]
    - [42, 3697.11]
  - - [5056, 128, 1, 1]
    - [75, 52.191]
  - - [448, 5056, 1, 1280]
    - [19, 9367.13]
  - - [448, 448, 1, 256]
    - [9, 3989.15]
  - - [256, 5888, 1, 3328]
    - [15, 9168.72]
  - - [704, 448, 1, 1280]
    - [15, 4711.74]
  - - [448, 64, 1, 256]
    - [28, 865.57]
  - - [1024, 704, 1, 1280]
    - [15, 7830.51]
  - - [5888, 1024, 1, 1]
    - [59, 195.757]
  - - [5888, 448, 1, 32]
    - [52, 2436.79]
  - - [6784, 2944, 1, 256]
    - [3, 9763.3]
  - - [1024, 256, 1, 1]
    - [63, 23.2397]
  - - [5888, 256, 1, 32]
    - [46, 1970.36]
  - - [2368, 448, 1, 256]
    - [15, 6816.8]
  - - [4288, 256, 1, 3328]
    - [15, 7772.84]
  - - [4288, 2944, 1, 256]
    - [15, 9627.34]
  - - [704, 4288, 1, 3328]
    - [15, 9639.24]
  - - [448, 5888, 1, 3328]
    - [15, 9160.49]
  - - [128, 256, 1, 3328]
    - [32, 1557.88]
  - - [2368, 5056, 1, 32]
    - [42, 3552.7]
  - - [32, 128, 1, 1280]
    - [56, 44.1318]
  - - [1408, 4288, 1, 1]
    - [60, 192.522]
  - - [1408, 1856, 1, 3328]
    - [15, 9907.15]
  - - [4288, 64, 1, 256]
    - [13, 4457.78]
  - - [2944, 5888, 1, 3328]
    - [19, 10119.8]
  - - [128, 6784, 1, 3328]
    - [6, 8163.49]
  - - [448, 4288, 1, 3328]
    - [15, 8987.25]
  - - [704, 2368, 1, 256]
    - [15, 8058.35]
  - - [1, 64, 1, 3328]
    - [78, 0.699711]
  - - [4288, 128, 1, 1]
    - [59, 49.3583]
  - - [256, 2368, 1, 32]
    - [48, 1182.84]
  - - [4288, 3584, 1, 3328]
    - [16, 10036.5]
  - - [2368, 1024, 1, 1280]
    - [15, 8960.12]
  - - [1408, 1024, 1, 1]
    - [70, 98.4831]
  - - [1408, 1024, 1, 256]
    - [15, 7941.02]
  - - [5056, 3584, 1, 1]
    - [63, 243.82]
  - - [448, 1024, 1, 256]
    - [19, 5734.4]
  - - [6784, 6784, 1, 3328]
    - [20, 10293.3]
  - - [1408, 256, 1, 1280]
    - [15, 5399.97]
  - - [6784, 32, 1, 32]
    - [50, 496.201]
  - - [64, 1024, 1, 3328]
    - [29, 2956.94]
  - - [2368, 2944, 1, 3328]
    - [19, 9967.34]
  - - [448, 448, 1, 1280]
    - [14, 5138.02]
  - - [5056, 3584, 1, 32]
    - [42, 3686.82]
  - - [5056, 3584, 1, 1280]
    - [3, 10119.7]
  - - [1024, 256, 1, 1280]
    - [23, 6000.38]
  - - [1856, 1856, 1, 256]
    - [15, 8904.0]
  - - [32, 5888, 1, 256]
    - [52, 1137.61]
  - - [256, 1408, 1, 32]
    - [51, 805.47]
  - - [2944, 1, 1, 3328]
    - [78, 32.3312]
  - - [32, 704, 1, 3328]
    - [56, 264.96]
  - - [5888, 4288, 1, 1]
    - [62, 250.275]
  - - [1024, 128, 1, 256]
    - [11, 3226.39]
  - - [32, 1856, 1, 3328]
    - [56, 701.109]
  - - [5056, 704, 1, 256]
    - [15, 9032.64]
  - - [448, 256, 1, 256]
    - [11, 3033.07]
  - - [2368, 5056, 1, 256]
    - [15, 9696.87]
  - - [1024, 5056, 1, 256]
    - [7, 9483.4]
  - - [1024, 64, 1, 1]
    - [59, 5.53514]
  - - [5888, 448, 1, 256]
    - [15, 8415.79]
  - - [6784, 5056, 1, 1280]
    - [37, 10064.1]
  - - [704, 6784, 1, 32]
    - [42, 3008.46]
  - - [4288, 6784, 1, 1280]
    - [15, 10237.9]
  - - [64, 1, 1, 256]
    - [74, 0.413737]
  - - [1856, 64, 1, 1280]
    - [26, 4369.07]
  - - [128, 1408, 1, 1]
    - [59, 14.349]
  - - [1024, 64, 1, 32]
    - [48, 134.433]
  - - [1024, 64, 1, 3328]
    - [29, 2979.56]
  - - [704, 6784, 1, 3328]
    - [15, 9819.55]
  - - [5888, 4288, 1, 1280]
    - [15, 10160.8]
  - - [5888, 3584, 1, 1280]
    - [16, 10071.0]
  - - [32, 2368, 1, 1280]
    - [56, 814.796]
  - - [5888, 128, 1, 1280]
    - [15, 8164.27]
  - - [1024, 2944, 1, 256]
    - [20, 8899.35]
  - - [1, 2944, 1, 1280]
    - [78, 29.2208]
  - - [4288, 2368, 1, 32]
    - [42, 3381.84]
  - - [2944, 1856, 1, 1280]
    - [15, 9905.39]
  - - [3584, 1, 1, 1280]
    - [78, 37.0918]
  - - [256, 3584, 1, 32]
    - [51, 1555.09]
  - - [1024, 2368, 1, 1]
    - [58, 132.36]
  - - [2944, 3584, 1, 1280]
    - [19, 9932.37]
  - - [64, 1, 1, 1]
    - [78, 0.00714286]
  - - [1856, 4288, 1, 256]
    - [15, 9621.19]
  - - [256, 128, 1, 3328]
    - [26, 1552.56]
  - - [1024, 1024, 1, 1024]
    - [16, 8570.74]
  - - [1, 1856, 1, 3328]
    - [78, 20.3344]
  - - [1408, 704, 1, 1]
    - [61, 75.5512]
  - - [2368, 2944, 1, 32]
    - [42, 3280.65]
  - - [128, 4288, 1, 32]
    - [52, 1108.82]
  - - [128, 704, 1, 1280]
    - [26, 3533.8]
  - - [64, 64, 1, 1]
    - [59, 0.348299]
  - - [1, 1408, 1, 1]
    - [59, 0.128467]
  - - [128, 2368, 1, 1280]
    - [13, 6009.5]
  - - [2944, 32, 1, 32]
    - [44, 191.285]
  - - [448, 1856, 1, 1]
    - [60, 66.6256]
  - - [4288, 704, 1, 256]
    - [15, 8829.99]
  - - [1856, 1024, 1, 256]
    - [3, 8163.41]
  - - [448, 1856, 1, 32]
    - [51, 1478.2]
  - - [448, 1856, 1, 3328]
    - [15, 7256.12]
  - - [448, 448, 1, 32]
    - [51, 371.674]
  - - [1024, 448, 1, 256]
    - [19, 5779.55]
  - - [6784, 1, 1, 256]
    - [74, 38.8351]
  - - [1024, 5056, 1, 32]
    - [42, 3142.55]
  - - [1024, 4288, 1, 1]
    - [62, 166.828]
  - - [704, 256, 1, 3328]
    - [23, 4369.07]
  - - [704, 1856, 1, 32]
    - [43, 1859.96]
  - - [1408, 5888, 1, 1280]
    - [3, 10172.9]
  - - [32, 704, 1, 1280]
    - [56, 247.901]
  - - [5056, 1856, 1, 256]
    - [15, 9652.39]
  - - [6784, 704, 1, 1280]
    - [15, 9555.44]
  - - [704, 1408, 1, 32]
    - [50, 1605.23]
  - - [5888, 1024, 1, 256]
    - [15, 9532.51]
  - - [64, 2944, 1, 1]
    - [63, 14.4491]
  - - [64, 2944, 1, 32]
    - [51, 352.179]
  - - [64, 2944, 1, 1280]
    - [13, 5562.1]
  - - [6784, 1856, 1, 3328]
    - [15, 10026.8]
  - - [64, 704, 1, 3328]
    - [26, 2055.19]
  - - [2368, 5888, 1, 1280]
    - [7, 10052.0]
  - - [1, 6784, 1, 256]
    - [74, 38.8351]
  - - [6784, 6784, 1, 32]
    - [42, 3902.71]
  - - [256, 1, 1, 1280]
    - [78, 2.56803]
  - - [5888, 128, 1, 32]
    - [51, 1322.22]
  - - [6784, 256, 1, 256]
    - [15, 8270.02]
  - - [2368, 3584, 1, 3328]
    - [35, 9722.02]
  - - [128, 4288, 1, 1280]
    - [12, 6839.43]
  - - [128, 128, 1, 256]
    - [8, 480.998]
  - - [5888, 1024, 1, 1280]
    - [15, 10008.2]
  - - [1856, 704, 1, 3328]
    - [15, 9345.87]
  - - [5888, 6784, 1, 3328]
    - [37, 10100.5]
  - - [6784, 1856, 1, 1]
    - [70, 223.564]
  - - [128, 32, 1, 1280]
    - [56, 44.0726]
  - - [2944, 2368, 1, 1280]
    - [35, 9579.37]
  - - [4288, 448, 1, 1]
    - [61, 117.71]
  - - [6784, 448, 1, 32]
    - [44, 2532.69]
  - - [6784, 448, 1, 3328]
    - [40, 9283.49]
  - - [1, 6784, 1, 1]
    - [63, 0.737391]
  - - [448, 3584, 1, 1280]
    - [15, 8395.46]
  - - [1408, 6784, 1, 1280]
    - [15, 10142.7]
  - - [5056, 5888, 1, 1280]
    - [3, 10244.4]
  - - [32, 2944, 1, 32]
    - [51, 174.459]
  - - [5888, 704, 1, 1]
    - [63, 173.292]
  - - [1, 256, 1, 256]
    - [78, 1.73928]
  - - [5056, 2944, 1, 32]
    - [42, 3621.62]
  - - [32, 6784, 1, 256]
    - [56, 1330.81]
  - - [64, 5056, 1, 256]
    - [13, 5026.55]
  - - [4288, 6784, 1, 1]
    - [63, 251.294]
  - - [448, 704, 1, 1280]
    - [15, 4747.2]
  - - [64, 2368, 1, 1]
    - [63, 12.2219]
  - - [1, 4288, 1, 3328]
    - [78, 30.8137]
  - - [5056, 4288, 1, 1]
    - [63, 241.75]
  - - [2368, 5888, 1, 32]
    - [42, 3688.57]
  - - [128, 3584, 1, 1280]
    - [12, 6950.79]
  - - [2944, 6784, 1, 1]
    - [65, 243.325]
  - - [1, 256, 1, 1]
    - [63, 0.0233577]
  - - [5888, 1024, 1, 3328]
    - [15, 10085.2]
  - - [6784, 5888, 1, 256]
    - [3, 9954.15]
  - - [704, 128, 1, 1280]
    - [30, 3491.02]
  - - [4288, 128, 1, 256]
    - [12, 5835.1]
  - - [32, 3584, 1, 3328]
    - [56, 1356.17]
  - - [6784, 64, 1, 256]
    - [12, 5579.77]
  - - [1024, 1, 1, 1280]
    - [78, 10.4357]
  - - [2368, 4288, 1, 32]
    - [42, 3421.73]
  - - [704, 3584, 1, 1]
    - [63, 134.783]
  - - [704, 1856, 1, 3328]
    - [15, 9349.08]
  - - [2944, 128, 1, 1280]
    - [2, 6669.59]
  - - [1, 2368, 1, 3328]
    - [78, 25.7674]
  - - [6784, 704, 1, 32]
    - [42, 2939.04]
  - - [4288, 1, 1, 1280]
    - [78, 30.0122]
  - - [704, 5888, 1, 256]
    - [3, 9467.87]
  - - [2944, 256, 1, 1]
    - [62, 62.8053]
  - - [64, 448, 1, 256]
    - [26, 890.781]
  - - [1408, 448, 1, 1280]
    - [19, 6865.68]
  - - [1408, 128, 1, 32]
    - [51, 349.949]
  - - [256, 1024, 1, 256]
    - [15, 4609.13]
  - - [3584, 5056, 1, 32]
    - [42, 3651.53]
  - - [1024, 32, 1, 1280]
    - [56, 361.578]
  - - [128, 2368, 1, 1]
    - [74, 29.1446]
  - - [6784, 1856, 1, 1280]
    - [15, 9968.2]
  - - [5056, 5056, 1, 3328]
    - [3, 10064.3]
  - - [128, 2944, 1, 1280]
    - [14, 6699.24]
  - - [128, 6784, 1, 1]
    - [63, 71.4105]
  - - [5888, 1408, 1, 256]
    - [3, 9650.41]
  - - [2368, 1024, 1, 32]
    - [42, 2383.13]
  - - [256, 256, 1, 3328]
    - [29, 2979.56]
  - - [64, 4288, 1, 1]
    - [63, 25.7925]
  - - [4288, 1024, 1, 256]
    - [15, 9274.53]
  - - [3584, 32, 1, 32]
    - [50, 288.523]
  - - [3584, 64, 1, 1]
    - [61, 21.2385]
  - - [704, 32, 1, 1280]
    - [56, 243.217]
  - - [32, 4288, 1, 32]
    - [43, 280.033]
  - - [64, 64, 1, 3328]
    - [27, 188.697]
  - - [64, 1408, 1, 1]
    - [59, 7.76828]
  - - [4288, 5888, 1, 1280]
    - [19, 10134.8]
  - - [704, 64, 1, 3328]
    - [21, 2043.98]
  - - [5056, 5888, 1, 256]
    - [3, 9977.27]
  - - [1408, 128, 1, 1280]
    - [13, 5359.82]
  - - [1024, 5888, 1, 1280]
    - [15, 10183.6]
  - - [64, 1024, 1, 1]
    - [63, 5.53514]
  - - [32, 32, 1, 32]
    - [48, 2.0898]
  - - [64, 128, 1, 256]
    - [8, 234.057]
  - - [5888, 5056, 1, 1280]
    - [15, 10200.1]
  - - [5888, 2944, 1, 1]
    - [62, 235.264]
  - - [64, 4288, 1, 1280]
    - [13, 5481.79]
  - - [704, 2944, 1, 1]
    - [63, 124.554]
  - - [1408, 4288, 1, 3328]
    - [15, 9882.75]
  - - [704, 2944, 1, 32]
    - [42, 2341.89]
  - - [1, 5888, 1, 1280]
    - [78, 41.2107]
  - - [2944, 4288, 1, 3328]
    - [15, 10020.1]
  - - [256, 2944, 1, 256]
    - [15, 7156.45]
  - - [704, 448, 1, 32]
    - [52, 737.759]
  - - [5056, 2944, 1, 256]
    - [15, 9778.59]
  - - [704, 1024, 1, 256]
    - [15, 6886.17]
  - - [2368, 1856, 1, 256]
    - [15, 9270.95]
  - - [64, 3584, 1, 1]
    - [59, 16.6698]
  - - [1024, 128, 1, 1280]
    - [29, 4798.97]
  - - [2368, 4288, 1, 1280]
    - [15, 10065.3]
  - - [3584, 448, 1, 256]
    - [15, 7714.75]
  - - [256, 6784, 1, 256]
    - [15, 8319.54]
  - - [1024, 32, 1, 32]
    - [48, 72.0176]
  - - [2944, 5888, 1, 1]
    - [62, 239.158]
  - - [128, 64, 1, 32]
    - [51, 16.0627]
  - - [64, 1, 1, 1280]
    - [78, 0.6404]
  - - [6784, 5888, 1, 3328]
    - [15, 10263.3]
  - - [256, 5888, 1, 1]
    - [63, 103.525]
  - - [6784, 3584, 1, 256]
    - [3, 9872.38]
  - - [1408, 1856, 1, 256]
    - [15, 9109.3]
  - - [128, 1408, 1, 256]
    - [13, 3923.24]
  - - [2944, 2944, 1, 32]
    - [42, 3369.15]
  - - [2944, 2944, 1, 3328]
    - [15, 9894.96]
  - - [1, 2944, 1, 256]
    - [74, 18.9935]
  - - [448, 32, 1, 1280]
    - [56, 154.462]
  - - [3584, 1, 1, 256]
    - [78, 27.8369]
  - - [704, 32, 1, 3328]
    - [56, 266.846]
  - - [256, 448, 1, 3328]
    - [26, 4526.59]
  - - [2368, 64, 1, 256]
    - [13, 3321.69]
  - - [64, 448, 1, 1280]
    - [32, 1270.78]
  - - [1408, 448, 1, 3328]
    - [15, 7014.33]
  - - [2368, 6784, 1, 3328]
    - [16, 10140.7]
  - - [256, 2368, 1, 1]
    - [59, 52.2593]
  - - [4288, 3584, 1, 32]
    - [42, 3534.95]
  - - [5888, 64, 1, 3328]
    - [13, 6719.34]
  - - [3584, 704, 1, 1280]
    - [15, 9295.44]
  - - [448, 5056, 1, 3328]
    - [19, 9485.37]
  - - [4288, 448, 1, 256]
    - [15, 8152.89]
  - - [5056, 256, 1, 1280]
    - [15, 8965.1]
  - - [704, 448, 1, 3328]
    - [15, 4852.18]
  - - [2944, 5888, 1, 32]
    - [42, 3694.04]
  - - [3584, 5056, 1, 256]
    - [16, 9758.7]
  - - [6784, 1, 1, 3328]
    - [78, 48.6493]
  - - [32, 2368, 1, 3328]
    - [56, 889.721]
  - - [64, 256, 1, 1]
    - [66, 1.46286]
  - - [1856, 448, 1, 3328]
    - [19, 7251.55]
  - - [3584, 2368, 1, 256]
    - [15, 9512.48]
  - - [128, 1024, 1, 1280]
    - [26, 4832.15]
  - - [4288, 256, 1, 32]
    - [52, 1656.95]
  - - [4288, 256, 1, 1280]
    - [15, 7653.01]
  - - [448, 5056, 1, 256]
    - [15, 8722.36]
  - - [128, 1856, 1, 1]
    - [66, 22.8431]
  - - [128, 1856, 1, 32]
    - [52, 565.638]
  - - [1408, 1856, 1, 1]
    - [59, 140.8]
  - - [128, 2944, 1, 1]
    - [74, 35.9573]
  - - [3584, 32, 1, 256]
    - [54, 780.854]
  - - [1408, 1408, 1, 1280]
    - [15, 9148.95]
  - - [3584, 256, 1, 1]
    - [63, 73.9923]
  - - [1408, 1856, 1, 1280]
    - [15, 9778.28]
  - - [448, 4288, 1, 1]
    - [63, 120.667]
  - - [3584, 4288, 1, 3328]
    - [16, 10038.7]
  - - [448, 128, 1, 256]
    - [31, 1668.19]
  - - [448, 4288, 1, 32]
    - [42, 2208.07]
  - - [448, 4288, 1, 1280]
    - [15, 8878.22]
  - - [64, 3584, 1, 256]
    - [14, 4503.09]
  - - [6784, 1408, 1, 1280]
    - [15, 9971.27]
  - - [1, 6784, 1, 1280]
    - [78, 47.3576]
  - - [5056, 1024, 1, 256]
    - [3, 9461.74]
  - - [2368, 448, 1, 32]
    - [52, 1664.1]
  - - [256, 1, 1, 256]
    - [74, 1.74298]
  - - [32, 2944, 1, 1280]
    - [56, 994.936]
  - - [5056, 1024, 1, 1]
    - [59, 187.585]
  - - [2368, 256, 1, 256]
    - [15, 5896.25]
  - - [1, 5056, 1, 1]
    - [59, 0.540171]
  - - [4288, 32, 1, 32]
    - [52, 340.909]
  - - [1856, 3584, 1, 32]
    - [42, 3072.47]
  - - [5056, 3584, 1, 3328]
    - [3, 10167.0]
  - - [4288, 5056, 1, 256]
    - [15, 9828.07]
  - - [1856, 5888, 1, 256]
    - [3, 9917.76]
  - - [256, 256, 1, 256]
    - [31, 1855.89]
  - - [2368, 3584, 1, 1]
    - [63, 214.316]
  - - [4288, 2368, 1, 256]
    - [15, 9664.71]
  - - [448, 1, 1, 3328]
    - [78, 4.88514]
  - - [1856, 256, 1, 1280]
    - [15, 7084.97]
  - - [1024, 6784, 1, 1]
    - [62, 196.016]
  - - [1408, 2944, 1, 3328]
    - [15, 10047.7]
  - - [32, 1856, 1, 32]
    - [52, 119.984]
  - - [256, 1, 1, 1]
    - [61, 0.0235294]
  - - [6784, 5056, 1, 3328]
    - [35, 10135.0]
  - - [6784, 5056, 1, 1]
    - [58, 257.198]
  - - [5888, 3584, 1, 32]
    - [42, 3759.93]
  - - [5888, 3584, 1, 3328]
    - [7, 10110.4]
  - - [1, 256, 1, 3328]
    - [78, 2.78639]
  - - [1024, 6784, 1, 256]
    - [19, 9483.71]
  - - [6784, 5888, 1, 32]
    - [42, 3858.41]
  - - [1408, 1, 1, 1280]
    - [78, 14.349]
  - - [2368, 6784, 1, 32]
    - [42, 3697.24]
  - - [6784, 64, 1, 1]
    - [66, 42.4]
  - - [2368, 32, 1, 32]
    - [44, 159.528]
  - - [3584, 1408, 1, 3328]
    - [15, 9684.21]
  - - [2944, 1408, 1, 1280]
    - [3, 9760.47]
  - - [1856, 64, 1, 1]
    - [63, 9.9651]
  - - [3584, 1024, 1, 1]
    - [63, 164.427]
  - - [256, 32, 1, 256]
    - [52, 59.7139]
  - - [2944, 1856, 1, 3328]
    - [19, 9979.14]
  - - [128, 1024, 1, 3328]
    - [29, 5115.0]
  - - [1408, 128, 1, 1]
    - [59, 14.349]
  - - [2944, 3584, 1, 32]
    - [42, 3561.62]
  - - [3584, 1024, 1, 32]
    - [47, 2713.51]
  - - [4288, 6784, 1, 3328]
    - [3, 10232.6]
  - - [256, 128, 1, 1280]
    - [26, 1440.35]
  - - [6784, 5056, 1, 256]
    - [15, 9893.59]
  - - [1408, 32, 1, 3328]
    - [56, 535.676]
  - - [1856, 3584, 1, 1280]
    - [3, 9985.03]
  - - [256, 5888, 1, 256]
    - [15, 8259.33]
  - - [5056, 32, 1, 256]
    - [56, 1029.29]
  - - [1024, 4288, 1, 3328]
    - [19, 10034.7]
  - - [448, 2368, 1, 256]
    - [15, 6928.09]
  - - [64, 1408, 1, 1280]
    - [26, 3551.21]
  - - [3584, 32, 1, 1280]
    - [56, 1213.63]
  - - [128, 2368, 1, 3328]
    - [13, 6276.32]
  - - [3584, 1024, 1, 256]
    - [3, 9320.68]
  - - [256, 64, 1, 256]
    - [27, 485.452]
  - - [2368, 448, 1, 3328]
    - [15, 7514.38]
  - - [3584, 2368, 1, 1]
    - [58, 214.316]
  - - [1, 1, 1, 1]
    - [75, 8.56164e-05]
  - - [1024, 1856, 1, 32]
    - [42, 2209.93]
  - - [32, 1024, 1, 32]
    - [51, 65.21]
  - - [4288, 1, 1, 256]
    - [74, 25.2235]
  - - [1856, 128, 1, 3328]
    - [14, 6363.7]
  - - [5888, 2368, 1, 1]
    - [63, 233.001]
  - - [5888, 128, 1, 1]
    - [67, 64.526]
  - - [704, 256, 1, 1280]
    - [23, 4143.08]
  - - [704, 4288, 1, 256]
    - [3, 8977.7]
  - - [5888, 2368, 1, 32]
    - [42, 3563.65]
  - - [5888, 2368, 1, 1280]
    - [19, 10006.9]
  - - [128, 256, 1, 256]
    - [11, 944.663]
  - - [2944, 5056, 1, 3328]
    - [15, 10203.8]
  - - [6784, 704, 1, 3328]
    - [41, 9166.68]
  - - [1856, 1856, 1, 32]
    - [42, 2680.73]
  - - [4288, 2944, 1, 32]
    - [42, 3531.15]
  - - [128, 448, 1, 1]
    - [59, 4.90959]
  - - [2944, 64, 1, 1]
    - [59, 14.6286]
  - - [704, 64, 1, 256]
    - [11, 1322.74]
  - - [256, 2368, 1, 3328]
    - [15, 6742.85]
  - - [704, 1, 1, 1]
    - [64, 0.0765217]
  - - [128, 448, 1, 1280]
    - [31, 2427.26]
  - - [5056, 5056, 1, 256]
    - [15, 9833.14]
  - - [6784, 6784, 1, 256]
    - [16, 10018.5]
  - - [256, 3584, 1, 1]
    - [61, 73.5179]
  - - [2368, 2944, 1, 256]
    - [15, 9488.92]
  - - [448, 32, 1, 32]
    - [51, 40.6695]
  - - [5888, 3584, 1, 1]
    - [65, 245.836]
  - - [5888, 128, 1, 256]
    - [15, 7156.45]
  - - [3584, 704, 1, 3328]
    - [15, 9406.07]
  - - [4288, 704, 1, 3328]
    - [5, 9317.4]
  - - [4288, 2944, 1, 1280]
    - [19, 9972.93]
  - - [448, 3584, 1, 256]
    - [15, 7796.7]
  - - [704, 32, 1, 256]
    - [52, 166.489]
  - - [6784, 256, 1, 32]
    - [42, 2117.93]
  - - [1856, 128, 1, 1]
    - [66, 23.2]
  - - [1856, 32, 1, 32]
    - [51, 127.042]
  - - [2368, 5056, 1, 1280]
    - [15, 10084.3]
  - - [704, 1856, 1, 1280]
    - [15, 9201.58]
  - - [448, 1024, 1, 3328]
    - [15, 7031.72]
  - - [32, 704, 1, 32]
    - [46, 53.9593]
  - - [3584, 448, 1, 1]
    - [63, 103.992]
  - - [6784, 1024, 1, 3328]
    - [19, 9930.49]
  - - [5888, 1856, 1, 32]
    - [42, 3401.75]
  - - [5888, 704, 1, 3328]
    - [15, 9858.11]
  - - [5056, 1, 1, 256]
    - [74, 29.7408]
  - - [448, 6784, 1, 256]
    - [3, 9080.81]
  - - [1024, 128, 1, 1]
    - [59, 11.1456]
  - - [128, 64, 1, 256]
    - [11, 211.406]
  - - [128, 5056, 1, 1]
    - [59, 56.1778]
  - - [1856, 128, 1, 256]
    - [14, 4663.91]
  - - [64, 704, 1, 1]
    - [62, 3.91111]
  - - [2944, 5888, 1, 256]
    - [15, 9717.87]
  - - [1408, 64, 1, 256]
    - [29, 2423.18]
  - - [128, 5056, 1, 32]
    - [48, 1250.57]
  - - [128, 5056, 1, 1280]
    - [14, 7952.91]
  - - [448, 32, 1, 3328]
    - [56, 168.136]
  - - [1856, 1408, 1, 32]
    - [42, 2512.74]
  - - [64, 704, 1, 32]
    - [55, 96.3765]
  - - [1, 5888, 1, 256]
    - [74, 33.6457]
  - - [64, 2368, 1, 32]
    - [48, 292.854]
  - - [5888, 64, 1, 32]
    - [48, 837.404]
  - - [2368, 256, 1, 1]
    - [59, 52.6222]
  - - [5888, 64, 1, 1280]
    - [2, 6589.41]
  - - [5056, 1, 1, 1]
    - [68, 0.522314]
  - - [5888, 2944, 1, 1280]
    - [15, 10071.8]
  - - [256, 1408, 1, 256]
    - [15, 4650.94]
  - - [448, 5888, 1, 1]
    - [59, 140.31]
  - - [2944, 128, 1, 32]
    - [48, 871.288]
  - - [3584, 1408, 1, 1]
    - [59, 183.367]
  - - [32, 6784, 1, 1280]
    - [56, 1660.33]
  - - [32, 6784, 1, 32]
    - [52, 501.938]
  - - [32, 1856, 1, 1280]
    - [56, 635.633]
  - - [448, 5888, 1, 32]
    - [42, 2476.83]
  - - [5056, 704, 1, 1280]
    - [19, 9531.5]
  - - [1856, 6784, 1, 1]
    - [59, 231.114]
  - - [5056, 64, 1, 1]
    - [65, 27.8952]
  - - [1, 5888, 1, 1]
    - [59, 0.545185]
  - - [2368, 1024, 1, 256]
    - [16, 8425.04]
  - - [1856, 6784, 1, 32]
    - [42, 3559.32]
  - - [1856, 6784, 1, 1280]
    - [15, 9979.57]
  - - [64, 3584, 1, 3328]
    - [14, 6160.13]
  - - [5888, 5056, 1, 3328]
    - [0, 10240.3]
  - - [1, 2944, 1, 3328]
    - [78, 32.1445]
  - - [1408, 6784, 1, 32]
    - [42, 3492.46]
  - - [32, 5888, 1, 1280]
    - [56, 1430.1]
  - - [448, 256, 1, 1]
    - [59, 9.62148]
  - - [3584, 5888, 1, 3328]
    - [15, 10209.1]
  - - [4288, 1408, 1, 256]
    - [3, 9301.88]
  - - [448, 64, 1, 1280]
    - [32, 1263.78]
  - - [128, 448, 1, 32]
    - [43, 117.029]
  - - [6784, 2368, 1, 256]
    - [15, 9717.65]
  - - [1408, 448, 1, 32]
    - [50, 1242.92]
  - - [1856, 1408, 1, 1280]
    - [15, 9757.75]
  - - [448, 256, 1, 3328]
    - [26, 4522.29]
  - - [1856, 2368, 1, 1]
    - [59, 174.961]
  - - [1408, 5056, 1, 3328]
    - [15, 10024.8]
  - - [128, 704, 1, 3328]
    - [26, 3801.89]
  - - [5056, 128, 1, 1280]
    - [14, 7971.28]
  - - [5056, 4288, 1, 256]
    - [15, 9825.29]
  - - [5056, 5056, 1, 32]
    - [42, 3787.13]
  - - [1856, 704, 1, 256]
    - [15, 8345.7]
  - - [5888, 32, 1, 1280]
    - [56, 1450.75]
  - - [64, 256, 1, 256]
    - [27, 494.611]
  - - [448, 5888, 1, 1280]
    - [15, 9070.53]
  - - [704, 704, 1, 3328]
    - [15, 7591.17]
  - - [128, 6784, 1, 256]
    - [2, 7106.72]
  - - [5056, 448, 1, 256]
    - [15, 8608.41]
  - - [4288, 5888, 1, 1]
    - [63, 247.527]
  - - [1856, 5056, 1, 1280]
    - [15, 10220.8]
  - - [704, 1856, 1, 1]
    - [68, 93.8667]
  - - [2368, 32, 1, 3328]
    - [56, 893.504]
  - - [3584, 1856, 1, 256]
    - [15, 9385.4]
  - - [256, 3584, 1, 256]
    - [15, 7091.82]
  - - [2944, 1408, 1, 1]
    - [60, 138.913]
  - - [4288, 5888, 1, 32]
    - [42, 3708.81]
  - - [4288, 5888, 1, 3328]
    - [16, 10121.3]
  - - [1, 1024, 1, 1]
    - [59, 0.0920863]
  - - [32, 64, 1, 32]
    - [48, 4.07562]
  - - [1408, 2368, 1, 1]
    - [63, 157.271]
  - - [2944, 2368, 1, 256]
    - [15, 9476.83]
  - - [1024, 1856, 1, 256]
    - [19, 8119.81]
  - - [2944, 64, 1, 3328]
    - [13, 5915.55]
  - - [1024, 5888, 1, 32]
    - [45, 2999.66]
  - - [1024, 5888, 1, 3328]
    - [15, 10280.7]
  - - [5056, 2368, 1, 32]
    - [42, 3531.74]
  - - [1408, 2368, 1, 1280]
    - [15, 9759.65]
  - - [256, 1, 1, 3328]
    - [78, 2.78931]
  - - [128, 1024, 1, 32]
    - [48, 263.461]
  - - [5056, 6784, 1, 3328]
    - [7, 10237.5]
  - - [448, 704, 1, 1]
    - [61, 29.4209]
  - - [448, 704, 1, 32]
    - [52, 733.47]
  - - [448, 704, 1, 3328]
    - [15, 4845.02]
  - - [1408, 2944, 1, 256]
    - [3, 9467.87]
  - - [3584, 4288, 1, 1]
    - [58, 238.635]
  - - [2368, 128, 1, 32]
    - [52, 717.406]
  - - [5056, 1408, 1, 1280]
    - [3, 9787.87]
  - - [2368, 128, 1, 3328]
    - [13, 6276.32]
  - - [704, 5056, 1, 32]
    - [42, 2813.77]
  - - [32, 2368, 1, 32]
    - [48, 150.798]
  - - [1408, 1, 1, 256]
    - [78, 9.60682]
  - - [256, 1856, 1, 32]
    - [48, 974.638]
  - - [448, 1408, 1, 1]
    - [74, 55.5268]
  - - [5056, 4288, 1, 1280]
    - [15, 10188.0]
  - - [1408, 256, 1, 256]
    - [15, 4650.94]
  - - [128, 256, 1, 1]
    - [58, 3.35738]
  - - [256, 4288, 1, 32]
    - [54, 1688.81]
  - - [1856, 2368, 1, 1280]
    - [15, 9944.86]
  - - [256, 256, 1, 1]
    - [59, 5.57279]
  - - [1408, 1, 1, 1]
    - [59, 0.129412]
  - - [448, 1408, 1, 256]
    - [15, 6098.21]
  - - [5888, 5888, 1, 1]
    - [65, 254.466]
  - - [128, 2944, 1, 32]
    - [52, 842.083]
  - - [32, 1024, 1, 1280]
    - [56, 351.871]
  - - [32, 256, 1, 32]
    - [52, 24.0941]
  - - [2944, 704, 1, 1280]
    - [15, 9394.11]
  - - [1024, 3584, 1, 1280]
    - [15, 9994.94]
  - - [704, 6784, 1, 256]
    - [15, 9256.78]
  - - [1856, 448, 1, 1]
    - [63, 67.4909]
  - - [128, 704, 1, 1]
    - [63, 7.87692]
  - - [5056, 256, 1, 32]
    - [43, 1842.47]
  - - [4288, 1, 1, 3328]
    - [78, 30.9904]
  - - [5056, 1024, 1, 1280]
    - [3, 9854.55]
  - - [704, 704, 1, 1]
    - [66, 44.5698]
  - - [1856, 448, 1, 1280]
    - [19, 7133.41]
  - - [3584, 6784, 1, 256]
    - [16, 9843.66]
  - - [64, 1856, 1, 1280]
    - [26, 4379.13]
  - - [1856, 1408, 1, 256]
    - [16, 9149.23]
  - - [4288, 4288, 1, 32]
    - [42, 3646.39]
  - - [128, 1, 1, 256]
    - [78, 0.873348]
  - - [32, 64, 1, 3328]
    - [56, 24.2864]
  - - [5888, 448, 1, 1]
    - [59, 141.514]
  - - [128, 5888, 1, 256]
    - [15, 7199.18]
  - - [3584, 256, 1, 3328]
    - [15, 7895.76]
  - - [5056, 5056, 1, 1280]
    - [0, 10161.5]
  - - [2368, 1, 1, 256]
    - [74, 15.8196]
  - - [6784, 1408, 1, 3328]
    - [16, 9780.38]
  - - [1408, 1408, 1, 1]
    - [57, 115.798]
  - - [32, 64, 1, 256]
    - [52, 14.7272]
  - - [2368, 1, 1, 1280]
    - [78, 23.5475]
  - - [32, 3584, 1, 32]
    - [52, 290.349]
  - - [2368, 5056, 1, 1]
    - [63, 228.485]
  - - [1, 3584, 1, 1]
    - [71, 0.373333]
  - - [256, 2944, 1, 3328]
    - [15, 8367.34]
  - - [1408, 64, 1, 3328]
    - [26, 3778.89]
  - - [1, 128, 1, 3328]
    - [78, 1.402]
  - - [32, 256, 1, 256]
    - [56, 72.4155]
  - - [5888, 1408, 1, 32]
    - [42, 3457.9]
  - - [704, 256, 1, 1]
    - [63, 14.1686]
  - - [1, 448, 1, 1]
    - [73, 0.0523364]
  - - [256, 6784, 1, 3328]
    - [15, 9183.54]
  - - [64, 5888, 1, 256]
    - [14, 5359.39]
  - - [1856, 1, 1, 1]
    - [59, 0.170588]
  - - [1024, 256, 1, 3328]
    - [25, 6314.53]
  - - [704, 704, 1, 256]
    - [15, 6195.2]
  - - [448, 1024, 1, 32]
    - [56, 976.068]
  - - [6784, 2368, 1, 1280]
    - [15, 10075.7]
  - - [128, 1856, 1, 1280]
    - [14, 6091.49]
  - - [256, 2368, 1, 256]
    - [19, 5860.62]
  - - [1024, 448, 1, 32]
    - [50, 945.88]
  - - [6784, 1024, 1, 256]
    - [15, 9451.45]
  - - [1408, 6784, 1, 3328]
    - [15, 10225.9]
  - - [2944, 1408, 1, 3328]
    - [15, 9858.11]
  - - [1856, 32, 1, 256]
    - [56, 425.178]
  - - [704, 2368, 1, 32]
    - [42, 2039.23]
  - - [448, 256, 1, 32]
    - [48, 235.257]
  - - [704, 6784, 1, 1]
    - [59, 180.36]
  - - [2368, 6784, 1, 256]
    - [3, 9817.88]
  - - [1856, 64, 1, 256]
    - [11, 3065.39]
  - - [1856, 3584, 1, 3328]
    - [15, 10072.8]
  - - [1, 704, 1, 3328]
    - [78, 7.71101]
  - - [5056, 1408, 1, 32]
    - [42, 3303.41]
  - - [64, 1, 1, 3328]
    - [78, 0.700078]
  - - [5056, 4288, 1, 3328]
    - [40, 9975.14]
  - - [4288, 2368, 1, 1]
    - [59, 197.088]
  - - [704, 448, 1, 256]
    - [15, 4086.05]
  - - [448, 64, 1, 3328]
    - [26, 1344.71]
  - - [2368, 256, 1, 1280]
    - [15, 6566.91]
  - - [2368, 448, 1, 1280]
    - [15, 7399.23]
  - - [6784, 2944, 1, 32]
    - [42, 3757.68]
  - - [64, 4288, 1, 32]
    - [56, 630.878]
  - - [3584, 1856, 1, 1]
    - [63, 197.973]
  - - [128, 448, 1, 3328]
    - [29, 2612.83]
  - - [5888, 2368, 1, 3328]
    - [19, 10078.0]
  - - [2368, 704, 1, 1280]
    - [15, 8568.31]
  - - [1024, 1408, 1, 1280]
    - [15, 8630.26]
  - - [4288, 64, 1, 1280]
    - [13, 5474.95]
  - - [2368, 6784, 1, 1]
    - [63, 231.611]
  - - [2944, 5056, 1, 32]
    - [42, 3695.81]
  - - [5056, 256, 1, 3328]
    - [19, 9099.94]
  - - [448, 448, 1, 1]
    - [68, 14.7576]
  - - [256, 2368, 1, 1280]
    - [19, 6602.67]
  - - [704, 2368, 1, 3328]
    - [15, 8815.33]
  - - [3584, 2944, 1, 256]
    - [15, 9573.05]
  - - [64, 6784, 1, 256]
    - [15, 5579.77]
  - - [3584, 1024, 1, 1280]
    - [3, 9811.23]
  - - [1408, 256, 1, 32]
    - [48, 833.406]
  - - [64, 1024, 1, 256]
    - [29, 1906.5]
  - - [1408, 32, 1, 32]
    - [51, 96.3765]
  - - [256, 32, 1, 1280]
    - [56, 88.1453]
  - - [4288, 2944, 1, 1]
    - [59, 231.037]
  - - [5056, 3584, 1, 256]
    - [3, 9834.84]
  - - [2368, 704, 1, 256]
    - [15, 7950.27]
  - - [1856, 1856, 1, 1280]
    - [15, 9399.01]
  - - [64, 32, 1, 32]
    - [44, 4.13737]
  - - [4288, 704, 1, 1]
    - [59, 150.938]
  - - [1856, 1024, 1, 1]
    - [59, 118.784]
  - - [4288, 2944, 1, 3328]
    - [15, 10054.8]
  - - [1024, 128, 1, 3328]
    - [26, 5163.44]
  - - [4288, 128, 1, 3328]
    - [12, 7010.36]
  - - [4288, 704, 1, 32]
    - [52, 2526.15]
  - - [1856, 1024, 1, 32]
    - [52, 2165.86]
  - - [1, 448, 1, 3328]
    - [78, 4.9083]
  - - [6784, 2368, 1, 32]
    - [42, 3636.56]
  - - [5888, 5056, 1, 1]
    - [62, 256.282]
  - - [128, 6784, 1, 1280]
    - [14, 8007.86]
  - - [704, 5888, 1, 1]
    - [63, 172.141]
  - - [6784, 6784, 1, 1]
    - [65, 264.255]
  - - [5888, 448, 1, 3328]
    - [41, 8534.91]
  - - [704, 5888, 1, 32]
    - [42, 2950.29]
  - - [704, 5888, 1, 1280]
    - [4, 9935.95]
  - - [1024, 6784, 1, 3328]
    - [15, 10137.1]
  - - [704, 2944, 1, 1280]
    - [15, 9545.54]
  - - [4288, 6784, 1, 256]
    - [16, 9921.89]
  - - [3584, 256, 1, 32]
    - [51, 1575.11]
  - - [1408, 1408, 1, 32]
    - [42, 2265.67]
  - - [1408, 1408, 1, 3328]
    - [15, 9260.11]
  - - [1024, 64, 1, 256]
    - [8, 1839.61]
  - - [4288, 64, 1, 32]
    - [56, 596.591]
  - - [5888, 6784, 1, 32]
    - [42, 3905.57]
  - - [1024, 2944, 1, 3328]
    - [15, 9627.64]
  - - [64, 704, 1, 1280]
    - [21, 1897.09]
  - - [2944, 1856, 1, 256]
    - [15, 9436.05]
  - - [128, 5056, 1, 3328]
    - [14, 8165.66]
  - - [704, 1408, 1, 1]
    - [65, 76.484]
  - - [6784, 5056, 1, 32]
    - [42, 3817.46]
  - - [1024, 448, 1, 3328]
    - [19, 7036.9]
  - - [5888, 1408, 1, 1]
    - [58, 191.905]
  - - [2944, 4288, 1, 1280]
    - [15, 9992.67]
  - - [64, 32, 1, 3328]
    - [56, 24.328]
  - - [1024, 4288, 1, 256]
    - [19, 9323.77]
  - - [128, 2368, 1, 256]
    - [13, 4777.99]
  - - [2368, 64, 1, 32]
    - [48, 300.103]
  - - [1408, 1, 1, 3328]
    - [78, 15.5242]
  - - [64, 1408, 1, 32]
    - [48, 180.224]
  - - [2368, 5888, 1, 1]
    - [60, 228.419]
  - - [448, 1856, 1, 256]
    - [19, 6411.47]
  - - [1856, 6784, 1, 3328]
    - [19, 10025.3]
  - - [3584, 128, 1, 256]
    - [15, 5825.42]
  - - [1024, 448, 1, 1280]
    - [15, 6808.93]
  - - [1024, 2368, 1, 32]
    - [42, 2455.53]
  - - [128, 5888, 1, 1]
    - [62, 63.6541]
  - - [64, 5056, 1, 1]
    - [59, 30.1851]
  - - [1856, 256, 1, 32]
    - [48, 984.738]
  - - [2368, 2368, 1, 3328]
    - [3, 9784.35]
  - - [64, 448, 1, 1]
    - [76, 2.82205]
  - - [3584, 5888, 1, 32]
    - [42, 3753.24]
  - - [3584, 5888, 1, 1280]
    - [15, 10154.6]
  - - [64, 5056, 1, 32]
    - [52, 743.871]
  - - [6784, 704, 1, 256]
    - [15, 9113.29]
  - - [1408, 704, 1, 32]
    - [48, 1645.2]
  - - [1408, 704, 1, 1280]
    - [15, 8463.03]
  - - [2368, 5888, 1, 256]
    - [3, 9765.14]
  - - [2944, 64, 1, 32]
    - [43, 364.089]
  - - [1, 1408, 1, 256]
    - [74, 9.60682]
  - - [64, 2944, 1, 256]
    - [13, 4129.67]
  - - [5888, 5888, 1, 32]
    - [42, 3734.83]
  - - [1856, 1408, 1, 3328]
    - [15, 9900.83]
  - - [1024, 1024, 1, 32]
    - [46, 1671.04]
  - - [6784, 704, 1, 1]
    - [63, 180.36]
  - - [2944, 5056, 1, 1280]
    - [19, 10124.0]
  - - [6784, 2944, 1, 1280]
    - [20, 9987.28]
  - - [6784, 256, 1, 3328]
    - [19, 9018.45]
  - - [5056, 128, 1, 3328]
    - [14, 8175.58]
  - - [128, 128, 1, 1280]
    - [27, 697.191]
  - - [5888, 64, 1, 1]
    - [61, 37.6832]
  - - [1408, 5056, 1, 32]
    - [42, 3377.86]
  - - [2944, 128, 1, 3328]
    - [14, 6942.52]
  - - [5888, 1856, 1, 1280]
    - [15, 10065.0]
  - - [256, 64, 1, 1280]
    - [21, 708.497]
  - - [5888, 256, 1, 1280]
    - [15, 8876.41]
  - - [1856, 5056, 1, 1]
    - [63, 216.021]
  - - [3584, 1856, 1, 1280]
    - [40, 9648.3]
  - - [704, 3584, 1, 256]
    - [3, 8882.33]
  - - [1856, 5056, 1, 32]
    - [42, 3427.92]
  - - [1856, 5056, 1, 3328]
    - [15, 10308.7]
  - - [1024, 2944, 1, 32]
    - [49, 2544.01]
  - - [1408, 6784, 1, 256]
    - [15, 9709.65]
  - - [1024, 2368, 1, 1280]
    - [15, 9092.4]
  - - [1856, 3584, 1, 1]
    - [59, 200.359]
  - - [2944, 5888, 1, 1280]
    - [19, 10050.7]
  - - [1, 1856, 1, 1]
    - [61, 0.164539]
  - - [3584, 3584, 1, 256]
    - [15, 9761.14]
  - - [1856, 2368, 1, 3328]
    - [15, 10044.1]
  - - [5888, 704, 1, 256]
    - [15, 9275.86]
  - - [64, 448, 1, 32]
    - [44, 69.0892]
  - - [6784, 4288, 1, 256]
    - [15, 9889.22]
  - - [128, 64, 1, 3328]
    - [26, 374.903]
  - - [1, 5056, 1, 1280]
    - [78, 35.0958]
  - - [32, 64, 1, 1280]
    - [56, 22.0511]
  - - [1408, 2368, 1, 3328]
    - [15, 9859.98]
  - - [1024, 3584, 1, 256]
    - [20, 9395.24]
  - - [2944, 128, 1, 256]
    - [2, 5481.19]
  - - [6784, 128, 1, 1]
    - [59, 72.8483]
  - - [1408, 256, 1, 3328]
    - [19, 5533.08]
  - - [2368, 1408, 1, 1]
    - [63, 156.68]
  - - [448, 32, 1, 256]
    - [52, 105.46]
  - - [5056, 6784, 1, 1280]
    - [7, 10195.4]
  - - [64, 2368, 1, 256]
    - [13, 3439.48]
  - - [2944, 256, 1, 256]
    - [15, 7072.51]
  - - [1, 128, 1, 256]
    - [78, 0.871489]
  - - [32, 256, 1, 1280]
    - [56, 94.0258]
  - - [5888, 1, 1, 256]
    - [74, 34.1329]
  - - [1856, 32, 1, 1280]
    - [56, 642.51]
  - - [6784, 128, 1, 256]
    - [2, 7161.67]
  - - [6784, 64, 1, 1280]
    - [12, 6590.91]
  - - [4288, 1024, 1, 32]
    - [42, 2956.84]
  - - [2944, 448, 1, 1280]
    - [15, 7839.0]
  - - [6784, 32, 1, 1280]
    - [56, 1643.83]
  - - [2944, 64, 1, 1280]
    - [13, 5562.1]
  - - [704, 448, 1, 1]
    - [61, 30.5612]
  - - [32, 128, 1, 32]
    - [48, 8.192]
  - - [1, 128, 1, 1]
    - [63, 0.0114286]
  - - [32, 4288, 1, 256]
    - [56, 820.731]
  - - [5888, 1, 1, 1]
    - [59, 0.618487]
  - - [5888, 1856, 1, 3328]
    - [0, 10030.4]
  - - [2368, 3584, 1, 256]
    - [15, 9502.49]
  - - [4288, 1408, 1, 3328]
    - [19, 9692.05]
  - - [1856, 32, 1, 3328]
    - [56, 701.308]
  - - [2944, 32, 1, 256]
    - [52, 628.053]
  - - [128, 64, 1, 1]
    - [74, 0.716084]
  - - [256, 1024, 1, 3328]
    - [25, 6310.87]
  - - [32, 448, 1, 256]
    - [52, 103.556]
  - - [1856, 64, 1, 32]
    - [48, 241.186]
  - - [1856, 64, 1, 3328]
    - [26, 4701.63]
  - - [256, 5056, 1, 256]
    - [15, 8234.34]
  - - [5888, 2944, 1, 3328]
    - [3, 10009.1]
  - - [2368, 1408, 1, 3328]
    - [15, 9686.45]
  - - [5888, 704, 1, 32]
    - [42, 2824.64]
  - - [2944, 704, 1, 1]
    - [59, 125.763]
  - - [6784, 1856, 1, 256]
    - [15, 9602.35]
  - - [1, 704, 1, 256]
    - [78, 4.83433]
  - - [1856, 1856, 1, 1]
    - [59, 160.669]
  - - [5888, 32, 1, 256]
    - [56, 1179.9]
  - - [2368, 1856, 1, 1]
    - [59, 175.519]
  - - [128, 704, 1, 256]
    - [13, 2383.13]
  - - [256, 1408, 1, 3328]
    - [15, 5541.26]
  - - [2944, 128, 1, 1]
    - [63, 35.6848]
  - - [32, 256, 1, 3328]
    - [56, 97.3678]
  - - [2944, 704, 1, 3328]
    - [15, 9503.87]
  - - [2368, 1856, 1, 32]
    - [42, 2939.8]
  - - [3584, 128, 1, 1280]
    - [12, 6931.1]
  - - [1024, 5056, 1, 3328]
    - [19, 10114.9]
  - - [256, 32, 1, 32]
    - [54, 23.7449]
  - - [64, 256, 1, 3328]
    - [21, 765.814]
  - - [256, 6784, 1, 1]
    - [62, 112.481]
  - - [1024, 3584, 1, 32]
    - [42, 2906.94]
  - - [256, 6784, 1, 32]
    - [42, 2086.13]
  - - [2944, 1408, 1, 32]
    - [42, 2939.82]
  - - [1024, 32, 1, 256]
    - [52, 244.994]
  - - [4288, 3584, 1, 1]
    - [59, 236.871]
  - - [1, 704, 1, 1]
    - [76, 0.0752137]
  - - [5056, 448, 1, 3328]
    - [15, 9322.08]
  - - [3584, 64, 1, 256]
    - [12, 4369.07]
  - - [64, 1856, 1, 32]
    - [48, 237.568]
  - - [64, 1856, 1, 3328]
    - [26, 4692.7]
  - - [5888, 5888, 1, 3328]
    - [7, 10200.8]
  - - [6784, 3584, 1, 32]
    - [42, 3756.49]
  - - [4288, 1856, 1, 256]
    - [15, 9488.56]
  - - [1856, 2944, 1, 256]
    - [15, 9559.87]
  - - [4288, 256, 1, 1]
    - [63, 80.7153]
  - - [64, 128, 1, 32]
    - [48, 16.0627]
  - - [704, 1, 1, 1280]
    - [78, 7.04878]
  - - [1024, 2368, 1, 256]
    - [19, 8434.14]
  - - [6784, 1024, 1, 1]
    - [60, 201.942]
  - - [1024, 1856, 1, 3328]
    - [15, 8878.45]
  - - [5888, 1024, 1, 32]
    - [42, 3207.08]
  - - [3584, 256, 1, 1280]
    - [15, 7767.23]
  - - [1024, 1, 1, 1]
    - [59, 0.0941176]
  - - [1408, 5056, 1, 1280]
    - [3, 9949.47]
  - - [5056, 6784, 1, 256]
    - [3, 9945.59]
  - - [256, 1856, 1, 256]
    - [15, 5939.2]
  - - [256, 704, 1, 1]
    - [59, 13.9925]
  - - [256, 128, 1, 32]
    - [42, 66.534]
  - - [1408, 1856, 1, 32]
    - [52, 2436.59]
  - - [2944, 5056, 1, 1]
    - [60, 237.626]
  - - [448, 128, 1, 1]
    - [59, 4.87619]
  - - [256, 704, 1, 32]
    - [48, 346.585]
  - - [256, 704, 1, 1280]
    - [23, 4119.41]
  - - [1, 2368, 1, 1]
    - [59, 0.209929]
  - - [5888, 5888, 1, 1280]
    - [7, 10164.3]
  - - [256, 2944, 1, 1280]
    - [19, 8192.0]
  - - [2944, 256, 1, 3328]
    - [15, 8257.16]
  - - [5056, 2944, 1, 1280]
    - [3, 10006.2]
  - - [704, 1024, 1, 3328]
    - [15, 8012.1]
  - - [2368, 1856, 1, 1280]
    - [15, 9776.19]
  - - [448, 2944, 1, 1]
    - [60, 95.2971]
  - - [6784, 2944, 1, 1]
    - [60, 235.965]
  - - [2944, 1024, 1, 32]
    - [42, 2638.65]
  - - [2944, 1024, 1, 1280]
    - [15, 9371.37]
  - - [1408, 64, 1, 32]
    - [48, 185.798]
  - - [2368, 4288, 1, 256]
    - [15, 9656.09]
  - - [448, 1856, 1, 1280]
    - [15, 7133.41]
  - - [2368, 448, 1, 1]
    - [58, 73.6711]
  - - [448, 2944, 1, 32]
    - [50, 1838.2]
  - - [448, 2944, 1, 1280]
    - [15, 7942.26]
  - - [2944, 6784, 1, 1280]
    - [7, 10005.1]
  - - [256, 6784, 1, 1280]
    - [15, 9057.13]
  - - [5056, 128, 1, 256]
    - [14, 6767.77]
  - - [3584, 2368, 1, 32]
    - [42, 3279.97]
  - - [704, 32, 1, 32]
    - [51, 47.4274]
  - - [6784, 3584, 1, 3328]
    - [16, 10169.8]
  - - [128, 32, 1, 256]
    - [52, 30.0624]
  - - [128, 1408, 1, 1280]
    - [13, 5379.82]
  - - [64, 32, 1, 1280]
    - [56, 22.0809]
  - - [128, 1856, 1, 3328]
    - [14, 6359.61]
  - - [2944, 2944, 1, 256]
    - [3, 9537.43]
  - - [5056, 2368, 1, 1280]
    - [19, 10062.1]
  - - [448, 128, 1, 32]
    - [46, 127.431]
  - - [32, 5056, 1, 3328]
    - [56, 1294.09]
  - - [448, 2944, 1, 3328]
    - [15, 8035.55]
  - - [2944, 1024, 1, 1]
    - [59, 115.948]
  - - [256, 4288, 1, 1]
    - [65, 83.6683]
  - - [2368, 128, 1, 1280]
    - [13, 6024.43]
  - - [3584, 704, 1, 256]
    - [15, 8719.26]
  - - [2368, 5888, 1, 3328]
    - [3, 10114.4]
  - - [1408, 3584, 1, 32]
    - [42, 3067.64]
  - - [2944, 4288, 1, 32]
    - [42, 3548.52]
  - - [5888, 1408, 1, 1280]
    - [16, 9995.83]
  - - [3584, 5056, 1, 1280]
    - [7, 10101.4]
  - - [5888, 6784, 1, 1280]
    - [15, 10215.2]
  - - [64, 1856, 1, 1]
    - [59, 9.89867]
  - - [704, 128, 1, 32]
    - [48, 183.902]
  - - [128, 3584, 1, 3328]
    - [13, 7152.95]
  - - [256, 4288, 1, 3328]
    - [15, 7866.58]
  - - [1, 1408, 1, 1280]
    - [78, 14.1153]
  - - [6784, 1408, 1, 32]
    - [42, 3402.27]
  - - [1856, 704, 1, 32]
    - [43, 1821.08]
  - - [128, 4288, 1, 1]
    - [59, 48.6582]
  - - [704, 5056, 1, 3328]
    - [15, 9816.49]
  - - [1024, 3584, 1, 3328]
    - [19, 10104.7]
  - - [3584, 1024, 1, 3328]
    - [16, 9899.01]
  - - [1856, 1408, 1, 1]
    - [63, 142.024]
  - - [2944, 448, 1, 32]
    - [52, 1864.19]
  - - [128, 448, 1, 256]
    - [13, 1638.4]
  - - [128, 1024, 1, 1]
    - [59, 11.2219]
  - - [32, 32, 1, 256]
    - [52, 7.4984]
  - - [4288, 5056, 1, 1280]
    - [16, 10093.7]
  - - [1856, 1856, 1, 3328]
    - [15, 9496.42]
  - - [3584, 1856, 1, 3328]
    - [19, 9872.24]
  - - [4288, 2368, 1, 3328]
    - [16, 9892.16]
  - - [256, 64, 1, 32]
    - [54, 44.5823]
  - - [1, 1024, 1, 1280]
    - [78, 10.4224]
  - - [32, 1408, 1, 256]
    - [52, 332.21]
  - - [448, 6784, 1, 32]
    - [46, 2592.1]
  - - [5888, 3584, 1, 256]
    - [3, 9809.45]
  - - [32, 1024, 1, 256]
    - [52, 222.628]
  - - [5888, 448, 1, 1280]
    - [15, 8920.97]
  - - [704, 5888, 1, 3328]
    - [15, 10049.4]
  - - [1024, 1408, 1, 256]
    - [15, 7846.4]
  - - [3584, 2944, 1, 1280]
    - [19, 9940.56]
  - - [1, 5056, 1, 256]
    - [74, 29.6866]
  - - [256, 1024, 1, 1]
    - [59, 23.5741]
  - - [32, 32, 1, 3328]
    - [56, 12.1744]
  - - [5056, 128, 1, 32]
    - [56, 1238.6]
  - - [2368, 1, 1, 3328]
    - [78, 25.8893]
  - - [4288, 1856, 1, 1280]
    - [19, 9864.91]
  - - [3584, 5888, 1, 1]
    - [60, 244.923]
  - - [5888, 4288, 1, 256]
    - [15, 9815.66]
  - - [1024, 2944, 1, 1280]
    - [15, 9504.33]
  - - [6784, 1, 1, 1]
    - [74, 0.712605]
  - - [1408, 64, 1, 1280]
    - [26, 3551.21]
  - - [1, 256, 1, 1280]
    - [78, 2.5632]
  - - [2944, 3584, 1, 256]
    - [15, 9578.48]
  - - [1, 128, 1, 1280]
    - [78, 1.30197]
  - - [1024, 256, 1, 32]
    - [48, 602.63]
  - - [5888, 1, 1, 1280]
    - [78, 41.1389]
  - - [2368, 32, 1, 1280]
    - [56, 829.286]
  - - [6784, 448, 1, 1]
    - [63, 148.982]
  - - [6784, 128, 1, 1280]
    - [2, 8101.24]
  - - [448, 2368, 1, 1280]
    - [15, 7500.58]
  - - [6784, 2368, 1, 3328]
    - [39, 9882.33]
  - - [1, 64, 1, 256]
    - [74, 0.435745]
  - - [704, 128, 1, 1]
    - [59, 7.93239]
  - - [1408, 4288, 1, 32]
    - [42, 3202.92]
  - - [32, 1408, 1, 3328]
    - [56, 531.876]
  - - [256, 448, 1, 256]
    - [11, 3008.21]
  - - [1856, 1024, 1, 1280]
    - [15, 8778.49]
  - - [1024, 448, 1, 1]
    - [63, 39.2767]
  - - [4288, 3584, 1, 1280]
    - [15, 10124.4]
  - - [448, 1024, 1, 1280]
    - [15, 6847.04]
  - - [5056, 1856, 1, 1]
    - [59, 218.028]
  - - [5888, 2368, 1, 256]
    - [15, 9663.6]
  - - [1408, 1024, 1, 32]
    - [42, 1961.62]
  - - [32, 704, 1, 256]
    - [52, 166.489]
  - - [2944, 1, 1, 256]
    - [78, 19.2654]
  - - [704, 1024, 1, 32]
    - [50, 1322.74]
  - - [5056, 1856, 1, 32]
    - [42, 3393.83]
  - - [5056, 1856, 1, 1280]
    - [15, 10059.8]
  - - [1, 64, 1, 1]
    - [63, 0.0057971]
  - - [1408, 5888, 1, 3328]
    - [3, 10237.1]
  - - [1408, 704, 1, 3328]
    - [19, 8621.21]
  - - [5056, 704, 1, 3328]
    - [15, 9628.18]
  - - [704, 64, 1, 1280]
    - [21, 1897.09]
  - - [1, 704, 1, 1280]
    - [78, 6.98326]
  - - [1408, 256, 1, 1]
    - [66, 34.3939]
  - - [5888, 4288, 1, 32]
    - [42, 3554.77]
  - - [1408, 3584, 1, 256]
    - [16, 9350.36]
  - - [1408, 6784, 1, 1]
    - [62, 222.343]
  - - [2944, 1, 1, 1]
    - [59, 0.243709]
  - - [256, 1856, 1, 3328]
    - [15, 7282.85]
  - - [4288, 128, 1, 1280]
    - [12, 6855.44]
  - - [128, 128, 1, 1]
    - [69, 1.91402]
  - - [6784, 256, 1, 1280]
    - [15, 8903.32]
  - - [128, 4288, 1, 256]
    - [12, 5854.55]
  - - [2368, 6784, 1, 1280]
    - [3, 10115.8]
  - - [128, 128, 1, 32]
    - [52, 45.8294]
  - - [128, 128, 1, 3328]
    - [21, 765.814]
  - - [128, 1408, 1, 32]
    - [51, 351.657]
  - - [6784, 128, 1, 32]
    - [51, 1536.91]
  - - [1408, 448, 1, 1]
    - [61, 54.3779]
  - - [2368, 704, 1, 3328]
    - [15, 8677.45]
  - - [704, 128, 1, 3328]
    - [26, 3801.89]
  - - [2944, 1856, 1, 32]
    - [52, 2929.77]
  - - [5888, 1856, 1, 1]
    - [58, 201.181]
  - - [1408, 32, 1, 1280]
    - [56, 487.751]
  - - [704, 1, 1, 256]
    - [74, 4.79319]
  - - [1856, 2944, 1, 3328]
    - [15, 10177.1]
  - - [3584, 2944, 1, 1]
    - [62, 199.835]
  - - [5888, 64, 1, 256]
    - [2, 5456.39]
  - - [64, 5056, 1, 1280]
    - [13, 6407.6]
  - - [1408, 2944, 1, 1]
    - [59, 171.005]
  - - [4288, 1408, 1, 32]
    - [42, 3220.0]
  - - [5888, 2944, 1, 256]
    - [15, 9719.57]
  - - [128, 64, 1, 1280]
    - [8, 335.223]
  - - [1408, 2944, 1, 32]
    - [42, 2934.62]
  - - [1, 3584, 1, 1280]
    - [78, 37.4797]
  - - [64, 64, 1, 32]
    - [48, 8.03137]
  - - [448, 1408, 1, 32]
    - [50, 1236.83]
  - - [128, 5056, 1, 256]
    - [2, 6767.77]
  - - [1, 1, 1, 1280]
    - [78, 0.0101458]
  - - [64, 704, 1, 256]
    - [11, 1334.99]
  - - [3584, 1408, 1, 1280]
    - [16, 9615.37]
  - - [5888, 6784, 1, 256]
    - [3, 9947.18]
  - - [6784, 5888, 1, 1]
    - [65, 260.46]
  - - [64, 4288, 1, 256]
    - [1, 4503.5]
  - - [1, 448, 1, 1280]
    - [78, 4.56561]
  - - [1024, 1024, 1, 1]
    - [63, 73.636]
  - - [6784, 5888, 1, 1280]
    - [7, 10192.3]
  - - [1024, 4288, 1, 32]
    - [42, 2946.92]
  - - [1856, 1, 1, 1280]
    - [78, 17.4887]
  - - [3584, 5888, 1, 256]
    - [15, 9789.54]
  - - [5056, 2368, 1, 1]
    - [63, 229.185]
  - - [256, 1408, 1, 1280]
    - [15, 5399.97]
  - - [64, 256, 1, 32]
    - [48, 32.1255]
  - - [64, 5888, 1, 3328]
    - [14, 6930.24]
  - - [6784, 64, 1, 3328]
    - [12, 6790.12]
  - - [5056, 448, 1, 1]
    - [59, 128.116]
  - - [2944, 448, 1, 3328]
    - [15, 7918.41]
  - - [1856, 6784, 1, 256]
    - [15, 9616.12]
  - - [4288, 32, 1, 1280]
    - [56, 1053.48]
  - - [448, 1408, 1, 1280]
    - [15, 6879.72]
  - - [5056, 448, 1, 32]
    - [50, 2248.23]
  - - [3584, 2944, 1, 32]
    - [42, 3540.7]
  - - [2368, 128, 1, 1]
    - [61, 28.4872]
  - - [128, 3584, 1, 32]
    - [52, 970.904]
  - - [3584, 1856, 1, 32]
    - [42, 3233.0]
  - - [4288, 64, 1, 3328]
    - [13, 5682.61]
  - - [5056, 64, 1, 256]
    - [13, 5026.55]
  - - [1024, 1856, 1, 1]
    - [61, 113.669]
  - - [64, 448, 1, 3328]
    - [34, 1360.04]
  - - [4288, 1408, 1, 1280]
    - [3, 9639.75]
  - - [32, 5056, 1, 256]
    - [56, 1019.16]
  - - [704, 128, 1, 256]
    - [11, 2423.18]
  - - [704, 5056, 1, 1]
    - [63, 160.046]
  - - [256, 1024, 1, 32]
    - [52, 602.63]
  - - [256, 1024, 1, 1280]
    - [25, 6009.03]
  - - [2368, 128, 1, 256]
    - [13, 4825.54]
  - - [2368, 1408, 1, 1280]
    - [15, 9596.38]
  - - [128, 256, 1, 32]
    - [53, 67.5629]
  - - [64, 6784, 1, 32]
    - [51, 914.055]
  - - [6784, 32, 1, 256]
    - [56, 1346.28]
  - - [5056, 2944, 1, 1]
    - [63, 222.295]
  - - [3584, 128, 1, 1]
    - [61, 41.8569]
  - - [1024, 4288, 1, 1280]
    - [15, 9938.41]
  - - [1856, 4288, 1, 1]
    - [63, 193.921]
  - - [128, 2944, 1, 256]
    - [2, 5506.22]
  - - [3584, 4288, 1, 256]
    - [15, 9740.18]
  - - [3584, 128, 1, 32]
    - [50, 986.563]
  - - [3584, 128, 1, 3328]
    - [18, 7147.6]
  - - [704, 5056, 1, 256]
    - [15, 9178.21]
  - - [1856, 4288, 1, 32]
    - [42, 3379.42]
  - - [5056, 1, 1, 1280]
    - [78, 35.5431]
  - - [64, 256, 1, 1280]
    - [21, 714.289]
  - - [4288, 1024, 1, 1280]
    - [19, 9745.39]
  - - [1, 4288, 1, 256]
    - [74, 25.0391]
  - - [2944, 3584, 1, 1]
    - [58, 207.051]
  - - [4288, 6784, 1, 32]
    - [42, 3838.97]
  - - [4288, 4288, 1, 256]
    - [15, 9734.97]
  - - [3584, 3584, 1, 1]
    - [58, 232.364]
  - - [3584, 1408, 1, 256]
    - [3, 9201.18]
  - - [704, 3584, 1, 3328]
    - [15, 9579.49]
  - - [5056, 448, 1, 1280]
    - [15, 9210.0]
  - - [1408, 2944, 1, 1280]
    - [15, 9941.9]
  - - [5888, 704, 1, 1280]
    - [38, 9567.57]
  - - [64, 64, 1, 256]
    - [33, 121.363]
  - - [704, 1408, 1, 1280]
    - [15, 8454.0]
  - - [4288, 5888, 1, 256]
    - [3, 9835.97]
  - - [3584, 3584, 1, 3328]
    - [3, 10049.7]
  - - [2944, 6784, 1, 32]
    - [42, 3743.6]
  - - [448, 64, 1, 32]
    - [51, 74.9595]
  - - [5056, 256, 1, 1]
    - [62, 91.4079]
  - - [64, 6784, 1, 1280]
    - [13, 6572.2]
  - - [2944, 2368, 1, 3328]
    - [15, 9974.19]
  - - [1, 4288, 1, 1]
    - [66, 0.391241]
  - - [1408, 128, 1, 256]
    - [13, 3950.11]
  - - [1024, 1856, 1, 1280]
    - [19, 8760.79]
  - - [1024, 5888, 1, 256]
    - [15, 9598.9]
  - - [704, 1408, 1, 256]
    - [15, 7606.58]
  - - [6784, 2944, 1, 3328]
    - [7, 10051.4]
  - - [1408, 2368, 1, 256]
    - [15, 9173.91]
  - - [1024, 1408, 1, 1]
    - [61, 96.8946]
  - - [64, 128, 1, 1280]
    - [8, 336.946]
  - - [5888, 32, 1, 3328]
    - [56, 1500.69]
  - - [1408, 5056, 1, 256]
    - [3, 9567.54]
  - - [1024, 1408, 1, 32]
    - [42, 1948.37]
  - - [4288, 1024, 1, 1]
    - [59, 173.143]
  - - [448, 704, 1, 256]
    - [15, 4136.29]
  - - [704, 3584, 1, 32]
    - [42, 2455.61]
  - - [1856, 256, 1, 3328]
    - [15, 7298.99]
  - - [6784, 448, 1, 256]
    - [15, 8906.17]
  - - [4288, 4288, 1, 1]
    - [63, 243.729]
  - - [256, 2944, 1, 1]
    - [62, 62.8053]
  - - [64, 2368, 1, 3328]
    - [13, 4783.43]
  - - [256, 704, 1, 3328]
    - [25, 4366.52]
  - - [1, 2944, 1, 1]
    - [59, 0.221687]
  - - [1024, 1024, 1, 256]
    - [19, 7913.78]
  - - [4288, 704, 1, 1280]
    - [15, 9376.81]
  - - [3584, 1, 1, 1]
    - [61, 0.376471]
  - - [256, 2944, 1, 32]
    - [52, 1376.56]
  - - [6784, 4288, 1, 3328]
    - [19, 10278.1]
  - - [5056, 2944, 1, 3328]
    - [37, 9954.81]
  - - [704, 1024, 1, 1280]
    - [15, 7814.59]
  - - [256, 3584, 1, 1280]
    - [15, 7854.5]
  - - [2368, 1856, 1, 3328]
    - [15, 9863.1]
  - - [1856, 4288, 1, 1280]
    - [15, 10045.5]
  - - [1, 1024, 1, 256]
    - [78, 7.03176]
  - - [2944, 1024, 1, 3328]
    - [3, 9409.48]
  - - [2944, 256, 1, 32]
    - [50, 1389.24]
  - - [128, 1, 1, 3328]
    - [78, 1.39905]
  - - [5888, 5056, 1, 32]
    - [42, 3837.54]
  - - [4288, 1408, 1, 1]
    - [63, 192.522]
  - - [3584, 448, 1, 32]
    - [46, 1861.6]
  - - [3584, 448, 1, 1280]
    - [15, 8260.49]
  - - [2944, 6784, 1, 3328]
    - [3, 10068.6]
  - - [1024, 1408, 1, 3328]
    - [15, 8770.08]
  - - [6784, 1024, 1, 1280]
    - [35, 9580.97]
  - - [6784, 3584, 1, 1280]
    - [15, 10205.7]
  - - [1, 5056, 1, 3328]
    - [78, 36.108]
  - - [4288, 64, 1, 1]
    - [59, 27.011]
  - - [128, 2368, 1, 32]
    - [52, 713.186]
  - - [128, 1408, 1, 3328]
    - [13, 5658.35]
  - - [2944, 32, 1, 3328]
    - [56, 1118.77]
  - - [704, 1856, 1, 256]
    - [15, 8263.23]
  - - [2944, 2944, 1, 1]
    - [62, 216.678]
  - - [1408, 4288, 1, 256]
    - [3, 9401.47]
  - - [5888, 5056, 1, 256]
    - [15, 9857.51]
  - - [256, 5056, 1, 3328]
    - [15, 9262.75]
  - - [2368, 64, 1, 1280]
    - [13, 4549.4]
  - - [1856, 448, 1, 32]
    - [48, 1465.18]
  - - [1408, 448, 1, 256]
    - [15, 6098.21]
  - - [32, 128, 1, 256]
    - [52, 29.8569]
  - - [448, 1024, 1, 1]
    - [61, 41.2547]
  - - [448, 6784, 1, 1]
    - [63, 152.572]
  - - [704, 2944, 1, 256]
    - [3, 8866.64]
  - - [1408, 1408, 1, 256]
    - [15, 8515.28]
  - - [1, 64, 1, 1280]
    - [78, 0.6396]
  - - [2944, 2368, 1, 1]
    - [59, 203.129]
  - - [4288, 448, 1, 32]
    - [54, 2152.41]
  - - [4288, 448, 1, 1280]
    - [15, 8744.33]
  - - [2944, 704, 1, 32]
    - [52, 2216.66]
  - - [1024, 704, 1, 256]
    - [19, 6865.68]
  - - [6784, 256, 1, 1]
    - [58, 112.481]
  - - [3584, 5056, 1, 1]
    - [62, 229.725]
  - - [2368, 2368, 1, 1]
    - [59, 189.44]
  - - [64, 5888, 1, 1]
    - [74, 35.1522]
  - - [1408, 3584, 1, 1280]
    - [15, 9773.68]
  - - [6784, 448, 1, 1280]
    - [15, 9434.93]
  - - [3584, 5056, 1, 3328]
    - [3, 10155.3]
  - - [2368, 2368, 1, 32]
    - [42, 3093.75]
  - - [64, 5888, 1, 32]
    - [56, 842.083]
  - - [1856, 448, 1, 256]
    - [15, 6426.96]
  - - [3584, 2368, 1, 1280]
    - [15, 9917.5]
  - - [128, 1024, 1, 256]
    - [26, 3251.4]
  - - [3584, 64, 1, 3328]
    - [22, 6054.59]
  - - [5888, 2944, 1, 32]
    - [42, 3678.36]
  - - [2944, 1, 1, 1280]
    - [78, 29.0944]
  - - [1856, 2944, 1, 32]
    - [42, 3082.69]
  - - [5056, 1408, 1, 1]
    - [59, 202.701]
  - - [5888, 1408, 1, 3328]
    - [15, 10044.7]
  - - [448, 4288, 1, 256]
    - [15, 8284.74]
  - - [256, 448, 1, 1]
    - [59, 9.75238]
  - - [128, 5888, 1, 3328]
    - [15, 8383.0]
  - - [6784, 1024, 1, 32]
    - [42, 3269.09]
  - - [256, 448, 1, 32]
    - [51, 235.257]
  - - [6784, 3584, 1, 1]
    - [62, 249.731]
  - - [2944, 2368, 1, 32]
    - [42, 3269.12]
  - - [3584, 6784, 1, 3328]
    - [19, 10247.7]
  - - [448, 128, 1, 1280]
    - [31, 2433.7]
  - - [64, 3584, 1, 32]
    - [56, 527.301]
  - - [64, 3584, 1, 1280]
    - [14, 5872.03]
  - - [6784, 1408, 1, 256]
    - [15, 9575.81]
  - - [5056, 1024, 1, 32]
    - [42, 3068.06]
  - - [1024, 5056, 1, 1280]
    - [15, 10014.2]
  - - [4288, 3584, 1, 256]
    - [15, 9747.9]
  - - [1408, 1024, 1, 3328]
    - [15, 8779.06]
  - - [2368, 256, 1, 3328]
    - [15, 6687.42]
  - - [448, 6784, 1, 1280]
    - [15, 9596.94]
  - - [1856, 5888, 1, 1]
    - [63, 226.162]
  - - [256, 5888, 1, 32]
    - [42, 1983.33]
  - - [3584, 1, 1, 3328]
    - [78, 39.8861]
  - - [4288, 32, 1, 256]
    - [56, 883.483]
  - - [256, 64, 1, 1]
    - [66, 1.3932]
  - - [4288, 5056, 1, 32]
    - [42, 3768.82]
  - - [4288, 5056, 1, 3328]
    - [15, 10238.7]
  - - [1856, 5888, 1, 32]
    - [42, 3497.0]
  - - [1856, 5888, 1, 1280]
    - [3, 10278.0]
  - - [256, 256, 1, 1280]
    - [29, 2788.77]
  - - [704, 2368, 1, 1280]
    - [15, 8696.82]
  - - [5056, 32, 1, 1280]
    - [56, 1258.47]
  - - [4288, 2368, 1, 1280]
    - [15, 10061.5]
  - - [2944, 5056, 1, 256]
    - [15, 9766.56]
  - - [4288, 128, 1, 32]
    - [43, 1030.73]
  - - [64, 5888, 1, 1280]
    - [14, 6729.14]
  - - [1, 1856, 1, 1280]
    - [78, 18.9147]
  - - [2944, 4288, 1, 1]
    - [58, 233.085]
  - - [5056, 5888, 1, 32]
    - [42, 3788.7]
  - - [704, 4288, 1, 1]
    - [59, 147.4]
  - - [704, 1, 1, 3328]
    - [78, 7.71101]
  - - [448, 256, 1, 1280]
    - [26, 4277.41]
  - - [5888, 6784, 1, 1]
    - [62, 259.918]
  - - [2368, 5056, 1, 3328]
    - [15, 10145.4]
  - - [704, 704, 1, 1280]
    - [19, 7390.36]
  - - [128, 32, 1, 3328]
    - [56, 48.8934]
  - - [1024, 6784, 1, 32]
    - [42, 3296.24]
  - - [2368, 1408, 1, 256]
    - [15, 9064.79]
  - - [3584, 2944, 1, 3328]
    - [15, 10017.9]
  - - [128, 1856, 1, 256]
    - [12, 4663.91]
  - - [32, 32, 1, 1280]
    - [56, 11.2682]
  - - [1408, 5888, 1, 1]
    - [62, 215.444]
  - - [1, 3584, 1, 256]
    - [78, 28.1098]
  - - [704, 4288, 1, 32]
    - [42, 2636.46]
  - - [1408, 5888, 1, 32]
    - [42, 3309.5]
  - - [32, 1856, 1, 256]
    - [52, 403.513]
  - - [6784, 2368, 1, 1]
    - [62, 241.062]
  - - [1856, 1, 1, 3328]
    - [78, 20.4529]
  - - [5056, 1408, 1, 256]
    - [3, 9460.26]
  - - [1, 1, 1, 256]
    - [74, 0.0067086]
  - - [2944, 1408, 1, 256]
    - [3, 9328.05]
  - - [4288, 1, 1, 1]
    - [61, 0.432258]
  - - [2368, 2368, 1, 256]
    - [3, 9345.71]
  - - [1, 448, 1, 256]
    - [78, 3.05021]
  - - [1856, 704, 1, 1]
    - [66, 92.8]
  - - [3584, 32, 1, 3328]
    - [56, 1355.4]
  - - [128, 3584, 1, 1]
    - [61, 42.477]
  - - [1856, 1, 1, 256]
    - [78, 12.6098]
  - - [32, 5888, 1, 32]
    - [54, 430.665]
  - - [1024, 5888, 1, 1]
    - [62, 189.363]
  - - [6784, 32, 1, 3328]
    - [56, 1731.71]
  - - [2368, 704, 1, 1]
    - [63, 109.676]
  - - [1408, 32, 1, 256]
    - [52, 332.21]
  - - [448, 2368, 1, 1]
    - [62, 79.8843]
  - - [1856, 3584, 1, 256]
    - [3, 9596.98]
  - - [2944, 64, 1, 256]
    - [13, 3940.73]
  - - [2368, 704, 1, 32]
    - [54, 2026.84]
  - - [256, 5888, 1, 1280]
    - [15, 9039.45]
  - - [448, 2368, 1, 32]
    - [48, 1638.4]
  - - [448, 2368, 1, 3328]
    - [19, 7607.64]
  - - [64, 1408, 1, 256]
    - [11, 2485.85]
  - - [5056, 32, 1, 32]
    - [56, 387.526]
  - - [1024, 704, 1, 3328]
    - [15, 8007.82]
  - - [32, 5888, 1, 3328]
    - [56, 1511.69]
  - - [256, 64, 1, 3328]
    - [24, 765.814]
  - - [32, 1408, 1, 1280]
    - [56, 495.121]
  - - [64, 32, 1, 256]
    - [52, 14.9285]
  - - [1856, 1024, 1, 3328]
    - [15, 8884.44]
  - - [2368, 1, 1, 1]
    - [59, 0.208451]
  - - [5056, 2368, 1, 3328]
    - [15, 10142.1]
  - - [128, 1, 1, 1280]
    - [78, 1.3028]
  - - [704, 4288, 1, 1280]
    - [15, 9526.63]
  - - [704, 256, 1, 256]
    - [10, 3295.52]
- null
