library/src/blas3/Tensile/Logic/asm_full/vega10_Cijk_Ailk_Bljk_HB.yaml
- {MinimumRequiredVersion: 4.5.0}
- vega10
- gfx900
- [Device 6863, Device 6862, Device 687f, Device 6860, Device 6861, 'Vega 10 XTX [Radeon
    SolutionIndex: 0
    SolutionNameMin: Cijk_Ailk_Bljk_HB_MT016x016x08_PGR1_PLR1_TT02_02
    SolutionIndex: 1
    SolutionNameMin: Cijk_Ailk_Bljk_HB_MT064x016x16_PGR1_PLR1_TT04_04
    SolutionIndex: 2
    SolutionNameMin: Cijk_Ailk_Bljk_HB_MT032x016x16_PGR1_PLR1_TT02_02
    SolutionIndex: 3
    SolutionNameMin: Cijk_Ailk_Bljk_HB_MT064x016x16_PGR1_PLR1_TT04_02
    SolutionIndex: 4
    SolutionNameMin: Cijk_Ailk_Bljk_HB_MT064x032x16_PGR1_PLR1_TT04_04
    SolutionIndex: 5
    SolutionNameMin: Cijk_Ailk_Bljk_HB_MT128x128x16_PGR1_PLR1_TT08_08
    SolutionIndex: 6
    SolutionNameMin: Cijk_Ailk_Bljk_HB_MT032x008x32_PGR1_PLR1_TT02_02
    SolutionIndex: 7
    SolutionNameMin: Cijk_Ailk_Bljk_HB_MT064x008x32_PGR1_PLR1_TT02_02
    SolutionIndex: 8
    SolutionNameMin: Cijk_Ailk_Bljk_HB_MT064x016x32_PGR1_PLR1_TT02_02
    SolutionIndex: 9
    SolutionNameMin: Cijk_Ailk_Bljk_HB_MT032x008x64_PGR1_PLR1_TT02_02
    SolutionIndex: 10
    SolutionNameMin: Cijk_Ailk_Bljk_HB_MT256x032x16_PGR1_PLR1_TT08_04
    SolutionIndex: 11
    SolutionNameMin: Cijk_Ailk_Bljk_HB_MT064x032x16_PGR1_PLR1_TT08_04
    SolutionIndex: 12
    SolutionNameMin: Cijk_Ailk_Bljk_HB_MT064x016x16_PGR1_PLR1_TT04_02
    SolutionIndex: 13
    SolutionNameMin: Cijk_Ailk_Bljk_HB_MT064x032x16_PGR1_PLR1_TT04_04
    SolutionIndex: 14
    SolutionNameMin: Cijk_Ailk_Bljk_HB_MT064x016x16_PGR1_PLR1_TT04_04
    SolutionIndex: 15
    SolutionNameMin: Cijk_Ailk_Bljk_HB_MT032x032x24_PGR1_PLR1_TT04_04
    SolutionIndex: 16
    SolutionNameMin: Cijk_Ailk_Bljk_HB_MT032x016x32_PGR1_PLR1_TT02_02
    SolutionIndex: 17
    SolutionNameMin: Cijk_Ailk_Bljk_HB_MT064x016x32_PGR1_PLR1_TT04_02
    SolutionIndex: 18
    SolutionNameMin: Cijk_Ailk_Bljk_HB_MT064x016x32_PGR1_PLR1_TT02_02
    SolutionIndex: 19
    SolutionNameMin: Cijk_Ailk_Bljk_HB_MT128x032x32_PGR1_PLR1_TT04_04
    SolutionIndex: 20
    SolutionNameMin: Cijk_Ailk_Bljk_HB_MT064x008x32_PGR1_PLR1_TT02_02
    SolutionIndex: 21
    SolutionNameMin: Cijk_Ailk_Bljk_HB_MT128x064x08_PGR1_PLR1_TT08_04
    SolutionIndex: 22
    SolutionNameMin: Cijk_Ailk_Bljk_HB_MT128x128x08_PGR1_PLR1_TT08_08
    SolutionIndex: 23
    SolutionNameMin: Cijk_Ailk_Bljk_HB_MT064x064x16_PGR0_PLR1_TT08_08
    SolutionIndex: 24
    SolutionNameMin: Cijk_Ailk_Bljk_HB_MT064x064x16_PGR1_PLR1_TT04_04
    SolutionIndex: 25
    SolutionNameMin: Cijk_Ailk_Bljk_HB_MT064x128x16_PGR1_PLR1_TT04_08
    SolutionIndex: 26
    SolutionNameMin: Cijk_Ailk_Bljk_HB_MT128x064x16_PGR1_PLR1_TT08_04
    SolutionIndex: 27
    SolutionNameMin: Cijk_Ailk_Bljk_HB_MT128x128x16_PGR1_PLR1_TT08_08
    SolutionIndex: 28
    SolutionNameMin: Cijk_Ailk_Bljk_HB_MT128x064x32_PGR0_PLR1_TT08_04
    SolutionIndex: 29
    SolutionNameMin: Cijk_Ailk_Bljk_HB_MT128x064x32_PGR1_PLR1_TT08_04
    SolutionIndex: 30
    SolutionNameMin: Cijk_Ailk_Bljk_HB_MT128x128x32_PGR0_PLR1_TT08_08
    SolutionIndex: 31
    SolutionNameMin: Cijk_Ailk_Bljk_HB_MT128x128x32_PGR1_PLR1_TT08_08
    SolutionIndex: 32
    SolutionNameMin: Cijk_Ailk_Bljk_HB_MT064x032x16_PGR1_PLR1_TT04_02
    SolutionIndex: 33
    SolutionNameMin: Cijk_Ailk_Bljk_HB_MT064x032x16_PGR1_PLR1_TT02_04
    SolutionIndex: 34
    SolutionNameMin: Cijk_Ailk_Bljk_HB_MT064x064x16_PGR1_PLR1_TT04_04
    SolutionIndex: 35
    SolutionNameMin: Cijk_Ailk_Bljk_HB_MT128x064x16_PGR1_PLR1_TT04_08
    SolutionIndex: 36
    SolutionNameMin: Cijk_Ailk_Bljk_HB_MT128x064x16_PGR1_PLR1_TT04_04
    SolutionIndex: 37
    SolutionNameMin: Cijk_Ailk_Bljk_HB_MT256x064x16_PGR1_PLR1_TT08_04
    SolutionIndex: 38
    SolutionNameMin: Cijk_Ailk_Bljk_HB_MT128x064x16_PGR1_PLR1_TT08_04
    SolutionIndex: 39
    SolutionNameMin: Cijk_Ailk_Bljk_HB_MT128x064x32_PGR1_PLR1_TT04_08
    SolutionIndex: 40
    SolutionNameMin: Cijk_Ailk_Bljk_HB_MT128x064x16_PGR0_PLR0_TT08_04
    SolutionIndex: 41
    SolutionNameMin: Cijk_Ailk_Bljk_HB_MT128x032x16_PGR0_PLR0_TT04_04
    SolutionIndex: 42
    SolutionNameMin: Cijk_Ailk_Bljk_HB_MT128x064x16_PGR0_PLR0_TT08_04
    SolutionIndex: 43
    SolutionNameMin: Cijk_Ailk_Bljk_HB_MT256x032x16_PGR0_PLR0_TT08_04
    SolutionIndex: 44
    SolutionNameMin: Cijk_Ailk_Bljk_HB_MT064x064x08_PGR0_PLR0_TT04_04
    SolutionIndex: 45
    SolutionNameMin: Cijk_Ailk_Bljk_HB_MT064x128x08_PGR0_PLR1_TT04_08
    SolutionIndex: 46
    SolutionNameMin: Cijk_Ailk_Bljk_HB_MT064x064x16_PGR1_PLR1_TT04_04
    SolutionIndex: 47
    SolutionNameMin: Cijk_Ailk_Bljk_HB_MT064x128x04_PGR0_PLR0_TT04_08
    SolutionIndex: 48
    SolutionNameMin: Cijk_Ailk_Bljk_HB_MT064x064x04_PGR1_PLR1_TT04_04
    SolutionIndex: 49
    SolutionNameMin: Cijk_Ailk_Bljk_HB_MT064x064x08_PGR1_PLR1_TT04_04
- - - [4096, 7000, 1, 4096]
    - [30, 18864.6]
  - - [5124, 9124, 1, 1760]
    - [27, 20503.7]
  - - [1760, 32, 1, 1760]
    - [6, 3097.45]
  - - [1024, 1500, 1, 1536]
    - [26, 19151.7]
  - - [512, 24000, 1, 2048]
    - [30, 17395.9]
  - - [3072, 24000, 1, 1024]
    - [27, 21134.2]
  - - [1024, 3000, 1, 2560]
    - [27, 21813.1]
  - - [512, 3136, 1, 2048]
    - [37, 14806.8]
  - - [7680, 4, 1, 2560]
    - [20, 1482.73]
  - - [64, 193600, 1, 64]
    - [33, 11001.9]
  - - [8448, 1500, 1, 2816]
    - [26, 21291.5]
  - - [784, 512, 64, 128]
    - [42, 19019.2]
  - - [2560, 7000, 1, 2560]
    - [26, 20900.1]
  - - [3072, 16, 1, 1024]
    - [6, 2452.87]
  - - [512, 48000, 1, 2048]
    - [30, 18565.7]
  - - [1760, 64, 1, 1760]
    - [8, 5450.52]
  - - [1024, 16, 1, 512]
    - [7, 808.891]
  - - [196, 256, 64, 1024]
    - [41, 10579.3]
  - - [512, 48000, 1, 1536]
    - [27, 22047.7]
  - - [2560, 32, 1, 2560]
    - [2, 4225.4]
  - - [4608, 1500, 1, 1536]
    - [26, 21887.8]
  - - [2048, 128, 1, 2048]
    - [19, 9279.75]
  - - [1024, 24000, 1, 2560]
    - [27, 21401.4]
  - - [4608, 3000, 1, 1536]
    - [26, 21492.3]
  - - [5124, 9124, 1, 2048]
    - [30, 18911.3]
  - - [2048, 16, 1, 2048]
    - [6, 1883.44]
  - - [1024, 700, 1, 512]
    - [24, 12293.6]
  - - [3072, 1, 1, 128]
    - [0, 73.7257]
  - - [5124, 700, 1, 2560]
    - [27, 19211.8]
  - - [8448, 16, 1, 2816]
    - [17, 5253.92]
  - - [6144, 6000, 1, 2560]
    - [27, 20766.9]
  - - [4608, 32, 1, 1536]
    - [20, 5983.39]
  - - [3072, 64, 1, 1024]
    - [12, 7096.09]
  - - [512, 16, 1, 512]
    - [7, 416.329]
  - - [7680, 2, 1, 2560]
    - [7, 750.806]
  - - [4224, 1, 1, 128]
    - [0, 99.9856]
  - - [7680, 1, 1, 2560]
    - [7, 375.934]
  - - [128, 1500, 1, 1280]
    - [3, 7356.21]
  - - [1024, 1500, 1, 2816]
    - [26, 19746.5]
  - - [6144, 2, 1, 2560]
    - [6, 660.43]
  - - [8448, 48000, 1, 2816]
    - [27, 19940.9]
  - - [512, 6000, 1, 2048]
    - [29, 14553.0]
  - - [4224, 1500, 1, 176]
    - [26, 18358.3]
  - - [1024, 6000, 1, 2816]
    - [22, 22113.3]
  - - [1024, 48000, 1, 1536]
    - [27, 20959.0]
  - - [1024, 48000, 1, 2560]
    - [27, 20955.7]
  - - [4096, 32, 1, 4096]
    - [18, 6754.41]
  - - [512, 16, 1, 500000]
    - [9, 543.701]
  - - [2560, 128, 1, 2560]
    - [13, 9916.08]
  - - [4608, 24000, 1, 1536]
    - [27, 20859.5]
  - - [512, 2, 1, 500000]
    - [9, 67.9633]
  - - [7680, 48000, 1, 2560]
    - [27, 19990.5]
  - - [3072, 48000, 1, 1024]
    - [27, 20386.4]
  - - [1760, 16, 1, 1760]
    - [6, 1616.1]
  - - [1024, 1500, 1, 2048]
    - [28, 14424.5]
  - - [1024, 16, 1, 500000]
    - [9, 1087.43]
  - - [64, 193600, 1, 256]
    - [32, 13711.1]
  - - [1024, 3000, 1, 2048]
    - [28, 16905.1]
  - - [6144, 4, 1, 2560]
    - [6, 1316.77]
  - - [1024, 6000, 1, 2048]
    - [28, 17395.0]
  - - [512, 24000, 1, 2816]
    - [27, 22465.4]
  - - [6144, 48000, 1, 2560]
    - [27, 19983.4]
  - - [1760, 7000, 1, 1760]
    - [21, 21827.9]
  - - [8448, 3000, 1, 2816]
    - [27, 20775.0]
  - - [3072, 4, 1, 1024]
    - [6, 617.688]
  - - [4608, 48000, 1, 1536]
    - [27, 20230.0]
  - - [2048, 32, 1, 2048]
    - [18, 3545.76]
  - - [7680, 1500, 1, 2560]
    - [26, 20806.7]
  - - [4096, 128, 1, 4096]
    - [11, 14018.3]
  - - [4608, 16, 1, 1536]
    - [7, 3605.59]
  - - [512, 3000, 1, 1536]
    - [26, 19071.4]
  - - [3072, 2, 1, 1024]
    - [6, 314.557]
  - - [8448, 1, 1, 2816]
    - [20, 363.288]
  - - [1024, 3000, 1, 2816]
    - [27, 21901.8]
  - - [128, 1, 1, 1408]
    - [9, 7.7235]
  - - [64, 1, 1, 1216]
    - [2, 3.33522]
  - - [1024, 2, 1, 512]
    - [7, 102.57]
  - - [1024, 4, 1, 500000]
    - [9, 271.842]
  - - [6144, 1, 1, 2560]
    - [6, 330.729]
  - - [5124, 9124, 1, 2560]
    - [27, 19856.7]
  - - [512, 48000, 1, 2816]
    - [27, 20898.0]
  - - [512, 3000, 1, 2816]
    - [26, 19640.2]
  - - [1024, 24000, 1, 1536]
    - [27, 22529.2]
  - - [7680, 6000, 1, 2560]
    - [27, 20860.9]
  - - [1760, 128, 1, 1760]
    - [1, 8563.93]
  - - [512, 1500, 1, 2816]
    - [24, 16130.0]
  - - [512, 1, 1, 512]
    - [6, 26.0205]
  - - [512, 6000, 1, 2560]
    - [27, 21657.3]
  - - [512, 8, 1, 500000]
    - [9, 271.848]
  - - [512, 24000, 1, 2560]
    - [27, 21263.7]
  - - [6144, 3000, 1, 2560]
    - [27, 20858.7]
  - - [1024, 24000, 1, 2816]
    - [22, 20638.1]
  - - [2048, 7000, 1, 2048]
    - [26, 19160.1]
  - - [7680, 3000, 1, 2560]
    - [27, 20462.9]
  - - [1024, 4, 1, 512]
    - [7, 205.151]
  - - [5124, 700, 1, 2048]
    - [30, 16728.1]
  - - [5124, 9124, 1, 4096]
    - [30, 18315.6]
  - - [4096, 64, 1, 4096]
    - [14, 10428.0]
  - - [256, 193600, 1, 64]
    - [36, 17599.5]
  - - [7680, 32, 1, 2560]
    - [15, 9384.63]
  - - [2560, 64, 1, 2560]
    - [2, 6905.0]
  - - [3136, 2048, 1, 512]
    - [42, 20131.9]
  - - [3072, 128, 1, 1024]
    - [13, 10413.1]
  - - [8448, 6000, 1, 2816]
    - [27, 20569.8]
  - - [7680, 64, 1, 2560]
    - [13, 13743.0]
  - - [5124, 1500, 1, 2560]
    - [27, 21377.7]
  - - [1024, 1500, 1, 2560]
    - [26, 19652.7]
  - - [512, 4, 1, 512]
    - [9, 104.852]
  - - [1024, 6000, 1, 2560]
    - [27, 21982.4]
  - - [3072, 32, 1, 1024]
    - [8, 4411.96]
  - - [6144, 32, 1, 2560]
    - [15, 7836.83]
  - - [3136, 512, 1, 2048]
    - [43, 12603.9]
  - - [196, 1024, 64, 256]
    - [40, 16314.1]
  - - [512, 50176, 1, 128]
    - [5, 21867.3]
  - - [4608, 1, 1, 1536]
    - [6, 244.368]
  - - [1024, 32, 1, 512]
    - [2, 1561.98]
  - - [7680, 24000, 1, 2560]
    - [27, 20071.2]
  - - [8448, 4, 1, 2816]
    - [7, 1448.23]
  - - [512, 1, 1, 500000]
    - [9, 33.9803]
  - - [176, 1500, 1, 1408]
    - [4, 7626.03]
  - - [512, 3000, 1, 2560]
    - [26, 18924.1]
  - - [8448, 24000, 1, 2816]
    - [27, 20085.4]
  - - [4608, 2, 1, 1536]
    - [6, 487.491]
  - - [512, 6000, 1, 1536]
    - [27, 21218.7]
  - - [7680, 128, 1, 2560]
    - [10, 17253.7]
  - - [3072, 6000, 1, 1024]
    - [26, 21974.4]
  - - [3072, 1500, 1, 128]
    - [26, 16349.7]
  - - [2048, 3136, 1, 512]
    - [38, 20988.5]
  - - [1024, 3000, 1, 1536]
    - [26, 21239.9]
  - - [512, 4, 1, 500000]
    - [9, 135.928]
  - - [512, 6000, 1, 2816]
    - [26, 21742.8]
  - - [128, 50176, 1, 512]
    - [34, 16465.4]
  - - [256, 12544, 1, 1024]
    - [39, 15114.3]
  - - [1024, 12544, 1, 256]
    - [35, 22184.3]
  - - [512, 48000, 1, 2560]
    - [27, 21140.3]
  - - [2560, 16, 1, 2560]
    - [6, 2391.09]
  - - [2048, 64, 1, 2048]
    - [18, 6357.41]
  - - [512, 2, 1, 512]
    - [6, 52.4262]
  - - [1024, 1, 1, 512]
    - [2, 45.3693]
  - - [512, 1500, 1, 2560]
    - [24, 15105.9]
  - - [512, 24000, 1, 1536]
    - [27, 22802.4]
  - - [1024, 1, 1, 500000]
    - [9, 67.9633]
  - - [6144, 16, 1, 2560]
    - [16, 4867.15]
  - - [1024, 24000, 1, 2048]
    - [30, 19489.2]
  - - [4096, 16, 1, 4096]
    - [20, 3755.16]
  - - [512, 32, 1, 512]
    - [7, 808.891]
  - - [5124, 1500, 1, 2048]
    - [31, 18158.8]
  - - [3072, 1500, 1, 1024]
    - [26, 19924.5]
  - - [1024, 2, 1, 500000]
    - [9, 135.924]
  - - [1024, 8, 1, 500000]
    - [9, 543.706]
  - - [7680, 16, 1, 2560]
    - [8, 5677.24]
  - - [6144, 1500, 1, 2560]
    - [27, 22169.8]
  - - [3072, 1, 1, 1024]
    - [6, 155.552]
  - - [1024, 48000, 1, 2816]
    - [27, 20835.8]
  - - [8448, 2, 1, 2816]
    - [20, 724.933]
  - - [4608, 4, 1, 1536]
    - [6, 979.978]
  - - [1024, 6000, 1, 1536]
    - [27, 22966.8]
  - - [8448, 32, 1, 2816]
    - [4, 8022.41]
  - - [512, 3000, 1, 2048]
    - [31, 13742.9]
  - - [6144, 24000, 1, 2560]
    - [27, 20174.7]
  - - [4608, 6000, 1, 1536]
    - [27, 22083.4]
  - - [1024, 1024, 1, 1024]
    - [29, 15502.6]
  - - [512, 1500, 1, 2048]
    - [29, 10750.8]
  - - [512, 1500, 1, 1536]
    - [24, 13427.1]
  - - [128, 1, 1, 1024]
    - [6, 6.60229]
  - - [3072, 3000, 1, 1024]
    - [26, 21844.5]
  - - [1024, 48000, 1, 2048]
    - [30, 19283.9]
- - - -1
    - - - 1
        - - - 32
            - - [32, 48]
              - [128, 49]
              - [1408, 48]
              - [1856, 49]
              - [3584, 48]
              - [5056, 49]
              - [-1, 48]
          - - 64
            - - [448, 48]
              - [704, 49]
              - [-1, 48]
          - - 128
            - - [32, 48]
              - [64, 49]
              - [448, 48]
              - [1024, 49]
              - [1856, 48]
              - [2944, 49]
              - [5056, 48]
              - [-1, 47]
          - - 256
            - - [32, 48]
              - [64, 49]
              - [1408, 48]
              - [1856, 49]
              - [3584, 48]
              - [-1, 47]
          - - 448
            - - [32, 49]
              - [128, 48]
              - [256, 49]
              - [448, 48]
              - [704, 49]
              - [1024, 48]
              - [1408, 49]
              - [1856, 48]
              - [4288, 47]
              - [-1, 48]
          - - 704
            - - [64, 49]
              - [128, 48]
              - [704, 49]
              - [1024, 48]
              - [1408, 49]
              - [2944, 47]
              - [5056, 48]
              - [-1, 47]
          - - 1024
            - - [32, 49]
              - [64, 48]
              - [128, 49]
              - [704, 48]
              - [1024, 47]
              - [1408, 48]
              - [1856, 47]
              - [2944, 48]
              - [-1, 47]
          - - 1408
            - - [128, 48]
              - [256, 49]
              - [448, 48]
              - [704, 49]
              - [1408, 48]
              - [-1, 47]
          - - 1856
            - - [32, 49]
              - [704, 48]
              - [1024, 47]
              - [2368, 48]
              - [2944, 47]
              - [4288, 48]
              - [5056, 47]
              - [-1, 48]
          - - 2368
            - - [64, 49]
              - [256, 48]
              - [704, 47]
              - [-1, 48]
          - - 2944
            - - [1024, 48]
              - [-1, 47]
          - - 3584
            - - [256, 48]
              - [448, 47]
              - [1024, 48]
              - [-1, 47]
          - - 4288
            - - [128, 48]
              - [448, 47]
              - [-1, 48]
          - - 5056
            - - [128, 48]
              - [256, 47]
              - [704, 48]
              - [1024, 47]
              - [-1, 48]
          - - 5888
            - - [704, 48]
              - [-1, 47]
          - - -1
            - - [128, 48]
              - [-1, 47]
      - - 32
        - - - 128
            - - [-1, 44]
          - - 256
            - - [1024, 44]
              - [1408, 46]
              - [5888, 44]
              - [-1, 45]
          - - 448
            - - [3584, 44]
              - [4288, 45]
              - [-1, 44]
          - - 704
            - - [448, 44]
              - [704, 46]
              - [1408, 44]
              - [2944, 45]
              - [5056, 44]
              - [-1, 45]
          - - 1024
            - - [2944, 44]
              - [3584, 45]
              - [5888, 44]
              - [-1, 45]
          - - 1408
            - - [704, 44]
              - [1408, 45]
              - [2944, 44]
              - [-1, 45]
          - - 2368
            - - [1408, 44]
              - [-1, 45]
          - - 2944
            - - [256, 44]
              - [448, 45]
              - [1024, 44]
              - [1856, 45]
              - [2368, 44]
              - [-1, 45]
          - - 3584
            - - [1024, 44]
              - [1408, 45]
              - [1856, 44]
              - [-1, 45]
          - - 5056
            - - [128, 44]
              - [256, 45]
              - [448, 44]
              - [-1, 45]
          - - 5888
            - - [128, 44]
              - [256, 45]
              - [704, 44]
              - [-1, 45]
          - - -1
            - - [704, 44]
              - [-1, 45]
      - - 256
        - - - 1
            - - [32, 48]
              - [64, 49]
              - [128, 48]
              - [448, 49]
              - [704, 48]
              - [1856, 49]
              - [2368, 48]
              - [-1, 49]
          - - 32
            - - [-1, 46]
          - - 64
            - - [1, 49]
              - [32, 46]
              - [64, 2]
              - [256, 7]
              - [2368, 2]
              - [2944, 8]
              - [3584, 12]
              - [5056, 3]
              - [5888, 4]
              - [-1, 1]
          - - 128
            - - [1, 49]
              - [32, 46]
              - [64, 2]
              - [128, 7]
              - [1408, 2]
              - [1856, 12]
              - [2368, 3]
              - [2944, 4]
              - [3584, 1]
              - [5056, 4]
              - [5888, 24]
              - [-1, 13]
          - - 256
            - - [1, 49]
              - [32, 46]
              - [64, 0]
              - [256, 7]
              - [448, 2]
              - [2944, 24]
              - [3584, 26]
              - [5056, 24]
              - [5888, 26]
              - [-1, 24]
          - - 448
            - - [1, 49]
              - [32, 46]
              - [64, 0]
              - [256, 2]
              - [448, 3]
              - [1408, 24]
              - [1856, 21]
              - [2368, 24]
              - [2944, 21]
              - [3584, 24]
              - [4288, 25]
              - [5056, 26]
              - [5888, 21]
              - [-1, 25]
          - - 704
            - - [1, 49]
              - [32, 46]
              - [64, 8]
              - [128, 2]
              - [2368, 24]
              - [5888, 25]
              - [-1, 21]
          - - 1024
            - - [1, 49]
              - [32, 46]
              - [64, 8]
              - [128, 2]
              - [704, 24]
              - [1408, 21]
              - [3584, 26]
              - [4288, 21]
              - [5056, 22]
              - [-1, 27]
          - - 1408
            - - [1, 49]
              - [32, 46]
              - [128, 2]
              - [448, 24]
              - [1024, 21]
              - [4288, 26]
              - [5056, 21]
              - [5888, 27]
              - [-1, 21]
          - - 1856
            - - [1, 49]
              - [32, 46]
              - [64, 2]
              - [128, 12]
              - [704, 24]
              - [1024, 26]
              - [1408, 25]
              - [2944, 26]
              - [4288, 27]
              - [5056, 21]
              - [5888, 27]
              - [-1, 26]
          - - 2368
            - - [1, 49]
              - [32, 46]
              - [64, 2]
              - [128, 4]
              - [704, 24]
              - [2368, 21]
              - [2944, 27]
              - [4288, 21]
              - [5888, 27]
              - [-1, 21]
          - - 2944
            - - [1, 49]
              - [32, 44]
              - [64, 12]
              - [128, 13]
              - [256, 24]
              - [448, 21]
              - [704, 26]
              - [1024, 21]
              - [1408, 27]
              - [1856, 26]
              - [5056, 21]
              - [5888, 27]
              - [-1, 21]
          - - 3584
            - - [1, 48]
              - [32, 44]
              - [64, 12]
              - [128, 14]
              - [256, 24]
              - [448, 21]
              - [704, 26]
              - [1024, 25]
              - [1408, 27]
              - [4288, 21]
              - [-1, 27]
          - - 4288
            - - [1, 49]
              - [32, 46]
              - [64, 1]
              - [128, 4]
              - [256, 24]
              - [1024, 26]
              - [1408, 22]
              - [2944, 21]
              - [5056, 23]
              - [-1, 27]
          - - 5056
            - - [1, 49]
              - [32, 46]
              - [64, 3]
              - [128, 4]
              - [256, 24]
              - [704, 26]
              - [1024, 21]
              - [1408, 27]
              - [1856, 21]
              - [2944, 27]
              - [3584, 26]
              - [4288, 21]
              - [-1, 27]
          - - 5888
            - - [1, 49]
              - [32, 46]
              - [64, 4]
              - [128, 24]
              - [448, 26]
              - [2368, 21]
              - [2944, 23]
              - [3584, 27]
              - [4288, 23]
              - [5888, 27]
              - [-1, 21]
          - - -1
            - - [1, 49]
              - [32, 46]
              - [64, 1]
              - [128, 13]
              - [256, 24]
              - [704, 26]
              - [2368, 21]
              - [3584, 23]
              - [4288, 21]
              - [5888, 27]
              - [-1, 22]
      - - 1280
        - - - 1
            - - [-1, 49]
          - - 32
            - - [-1, 46]
          - - 64
            - - [1, 49]
              - [32, 46]
              - [64, 6]
              - [256, 9]
              - [704, 6]
              - [1408, 7]
              - [1856, 8]
              - [2368, 2]
              - [3584, 15]
              - [4288, 4]
              - [5056, 12]
              - [-1, 4]
          - - 128
            - - [1, 49]
              - [32, 46]
              - [128, 6]
              - [256, 9]
              - [448, 6]
              - [704, 7]
              - [1024, 8]
              - [1408, 3]
              - [1856, 1]
              - [2944, 4]
              - [3584, 14]
              - [5056, 4]
              - [5888, 24]
              - [-1, 26]
          - - 256
            - - [1, 49]
              - [32, 46]
              - [64, 2]
              - [256, 6]
              - [448, 8]
              - [2944, 24]
              - [3584, 26]
              - [5056, 24]
              - [-1, 26]
          - - 448
            - - [1, 49]
              - [32, 46]
              - [64, 9]
              - [128, 6]
              - [256, 8]
              - [448, 1]
              - [1408, 24]
              - [1856, 26]
              - [2368, 24]
              - [3584, 26]
              - [4288, 25]
              - [5056, 26]
              - [5888, 27]
              - [-1, 25]
          - - 704
            - - [1, 49]
              - [32, 46]
              - [128, 7]
              - [1024, 24]
              - [1408, 11]
              - [1856, 24]
              - [2368, 26]
              - [5056, 25]
              - [5888, 23]
              - [-1, 27]
          - - 1024
            - - [1, 49]
              - [32, 46]
              - [64, 7]
              - [128, 8]
              - [704, 24]
              - [2368, 26]
              - [2944, 22]
              - [4288, 21]
              - [-1, 27]
          - - 1408
            - - [1, 49]
              - [32, 46]
              - [64, 8]
              - [128, 3]
              - [448, 24]
              - [704, 26]
              - [1024, 21]
              - [1856, 26]
              - [2368, 21]
              - [4288, 27]
              - [5056, 22]
              - [5888, 27]
              - [-1, 26]
          - - 1856
            - - [1, 49]
              - [32, 46]
              - [64, 8]
              - [128, 1]
              - [256, 24]
              - [448, 11]
              - [704, 24]
              - [1024, 26]
              - [1408, 24]
              - [1856, 21]
              - [2368, 26]
              - [3584, 27]
              - [4288, 26]
              - [5056, 23]
              - [-1, 27]
          - - 2368
            - - [1, 49]
              - [32, 46]
              - [64, 2]
              - [128, 4]
              - [448, 24]
              - [1024, 26]
              - [1856, 21]
              - [2368, 26]
              - [2944, 22]
              - [4288, 21]
              - [5056, 22]
              - [5888, 27]
              - [-1, 22]
          - - 2944
            - - [1, 49]
              - [32, 46]
              - [64, 12]
              - [128, 4]
              - [256, 24]
              - [704, 26]
              - [1408, 27]
              - [1856, 21]
              - [2368, 27]
              - [4288, 21]
              - [5056, 27]
              - [5888, 22]
              - [-1, 26]
          - - 3584
            - - [1, 49]
              - [32, 46]
              - [64, 1]
              - [128, 13]
              - [256, 11]
              - [448, 26]
              - [704, 21]
              - [1024, 26]
              - [1408, 27]
              - [1856, 21]
              - [2368, 27]
              - [3584, 26]
              - [4288, 27]
              - [5888, 21]
              - [-1, 22]
          - - 4288
            - - [1, 49]
              - [32, 46]
              - [64, 13]
              - [128, 4]
              - [256, 24]
              - [448, 21]
              - [1024, 26]
              - [1408, 27]
              - [1856, 26]
              - [2368, 21]
              - [3584, 27]
              - [4288, 26]
              - [5056, 21]
              - [-1, 23]
          - - 5056
            - - [1, 49]
              - [32, 46]
              - [128, 13]
              - [256, 24]
              - [448, 26]
              - [704, 21]
              - [1024, 27]
              - [1408, 22]
              - [1856, 21]
              - [2368, 27]
              - [2944, 21]
              - [3584, 27]
              - [4288, 26]
              - [5888, 22]
              - [-1, 27]
          - - 5888
            - - [1, 49]
              - [32, 46]
              - [64, 13]
              - [128, 24]
              - [256, 21]
              - [704, 26]
              - [1024, 27]
              - [1408, 26]
              - [1856, 21]
              - [2368, 27]
              - [2944, 22]
              - [3584, 27]
              - [4288, 23]
              - [5056, 21]
              - [5888, 22]
              - [-1, 27]
          - - -1
            - - [1, 49]
              - [32, 46]
              - [64, 13]
              - [128, 26]
              - [256, 27]
              - [448, 26]
              - [704, 22]
              - [1024, 27]
              - [2368, 21]
              - [3584, 27]
              - [4288, 26]
              - [5056, 21]
              - [5888, 22]
              - [-1, 27]
      - - -1
        - - - 1
            - - [-1, 49]
          - - 32
            - - [-1, 46]
          - - 64
            - - [1, 49]
              - [32, 46]
              - [256, 9]
              - [1024, 6]
              - [1408, 7]
              - [1856, 8]
              - [2368, 2]
              - [3584, 15]
              - [-1, 4]
          - - 128
            - - [1, 49]
              - [32, 46]
              - [64, 9]
              - [448, 6]
              - [704, 2]
              - [1024, 8]
              - [1408, 3]
              - [1856, 15]
              - [2944, 4]
              - [4288, 14]
              - [5888, 24]
              - [-1, 26]
          - - 256
            - - [1, 49]
              - [32, 46]
              - [64, 9]
              - [256, 6]
              - [448, 18]
              - [2944, 24]
              - [3584, 26]
              - [5056, 24]
              - [-1, 26]
          - - 448
            - - [1, 49]
              - [32, 46]
              - [64, 7]
              - [128, 6]
              - [256, 8]
              - [448, 14]
              - [1408, 24]
              - [1856, 26]
              - [2368, 24]
              - [3584, 26]
              - [4288, 25]
              - [5888, 26]
              - [-1, 25]
          - - 704
            - - [1, 49]
              - [32, 46]
              - [64, 7]
              - [128, 6]
              - [1024, 24]
              - [1408, 11]
              - [1856, 24]
              - [2368, 26]
              - [4288, 25]
              - [5056, 21]
              - [5888, 25]
              - [-1, 27]
          - - 1024
            - - [1, 49]
              - [32, 46]
              - [64, 6]
              - [128, 8]
              - [704, 24]
              - [1024, 26]
              - [1408, 21]
              - [2368, 26]
              - [2944, 27]
              - [3584, 26]
              - [4288, 21]
              - [-1, 27]
          - - 1408
            - - [1, 49]
              - [32, 46]
              - [64, 6]
              - [128, 12]
              - [448, 24]
              - [1408, 26]
              - [1856, 21]
              - [2368, 26]
              - [2944, 22]
              - [5888, 27]
              - [-1, 21]
          - - 1856
            - - [1, 49]
              - [32, 46]
              - [64, 18]
              - [128, 15]
              - [256, 24]
              - [448, 26]
              - [704, 24]
              - [1024, 26]
              - [1408, 25]
              - [1856, 26]
              - [2368, 21]
              - [2944, 26]
              - [4288, 27]
              - [5056, 21]
              - [5888, 27]
              - [-1, 21]
          - - 2368
            - - [1, 49]
              - [32, 46]
              - [64, 2]
              - [128, 4]
              - [448, 24]
              - [2368, 26]
              - [2944, 27]
              - [4288, 21]
              - [5888, 27]
              - [-1, 22]
          - - 2944
            - - [1, 49]
              - [32, 46]
              - [64, 12]
              - [128, 4]
              - [256, 24]
              - [1024, 26]
              - [1408, 27]
              - [1856, 26]
              - [2368, 21]
              - [2944, 26]
              - [4288, 21]
              - [5056, 26]
              - [-1, 27]
          - - 3584
            - - [1, 49]
              - [32, 46]
              - [64, 1]
              - [128, 24]
              - [448, 26]
              - [704, 21]
              - [1024, 26]
              - [1408, 27]
              - [2368, 26]
              - [2944, 21]
              - [-1, 27]
          - - 4288
            - - [1, 49]
              - [32, 46]
              - [64, 13]
              - [128, 1]
              - [256, 24]
              - [704, 26]
              - [1024, 21]
              - [1408, 27]
              - [2368, 21]
              - [2944, 27]
              - [3584, 22]
              - [4288, 21]
              - [-1, 27]
          - - 5056
            - - [1, 49]
              - [32, 46]
              - [64, 13]
              - [128, 4]
              - [256, 24]
              - [448, 21]
              - [704, 26]
              - [1408, 27]
              - [1856, 22]
              - [2368, 21]
              - [2944, 27]
              - [3584, 21]
              - [-1, 27]
          - - 5888
            - - [1, 49]
              - [32, 46]
              - [64, 13]
              - [128, 24]
              - [256, 26]
              - [448, 22]
              - [704, 26]
              - [1024, 23]
              - [1408, 27]
              - [2368, 21]
              - [2944, 22]
              - [-1, 27]
          - - -1
            - - [1, 49]
              - [32, 46]
              - [64, 24]
              - [128, 10]
              - [448, 26]
              - [704, 22]
              - [1024, 27]
              - [1408, 21]
              - [1856, 26]
              - [2368, 21]
              - [-1, 27]
