library/src/blas3/Tensile/Logic/asm_full/vega10_Cijk_Alik_Bljk_SB.yaml
- {MinimumRequiredVersion: 3.6.0}
- vega10
- gfx900
- [Device 6863, Device 6862, Device 687f]
- - - [4096, 7000, 1, 4096]
    - [28, 7642.19]
  - - [7680, 12000, 1, 2560]
    - [40, 9881.63]
  - - [5124, 9124, 1, 1760]
    - [46, 11120.8]
  - - [1760, 32, 1, 1760]
    - [10, 3013.78]
  - - [512, 24000, 1, 1536]
    - [39, 9573.39]
  - - [3072, 24000, 1, 1024]
    - [40, 9277.1]
  - - [2048, 400, 1, 512]
    - [39, 4148.07]
  - - [2560, 7000, 1, 2560]
    - [42, 9722.52]
  - - [3072, 16, 1, 1024]
    - [12, 761.718]
  - - [512, 48000, 1, 2816]
    - [38, 11146.9]
  - - [512, 48000, 1, 2048]
    - [31, 7860.88]
  - - [1760, 64, 1, 1760]
    - [14, 4804.75]
  - - [35, 8457, 1, 4096]
    - [6, 3305.76]
  - - [2048, 1600, 1, 2048]
    - [28, 5581.2]
  - - [512, 48000, 1, 1536]
    - [38, 10551.2]
  - - [2560, 32, 1, 2560]
    - [13, 2496.54]
  - - [8448, 5984, 1, 2816]
    - [38, 11245.6]
  - - [4096, 3200, 1, 1024]
    - [40, 7967.81]
  - - [1024, 24000, 1, 2560]
    - [38, 9560.21]
  - - [1760, 6400, 1, 1760]
    - [44, 11212.2]
  - - [1024, 700, 1, 512]
    - [29, 4471.46]
  - - [4608, 32, 1, 1536]
    - [25, 2516.5]
  - - [3072, 64, 1, 1024]
    - [25, 2330.9]
  - - [16384, 3200, 1, 4096]
    - [31, 7429.89]
  - - [2560, 16, 1, 2560]
    - [12, 1466.87]
  - - [1024, 48000, 1, 2560]
    - [40, 9609.2]
  - - [35, 8457, 1, 2560]
    - [7, 3475.78]
  - - [8448, 48000, 1, 2816]
    - [38, 11572.7]
  - - [2048, 32, 1, 2048]
    - [13, 1743.87]
  - - [2560, 3200, 1, 2560]
    - [41, 8864.8]
  - - [16384, 800, 1, 4096]
    - [33, 6774.33]
  - - [4608, 24000, 1, 1536]
    - [41, 10660.1]
  - - [7680, 48000, 1, 2560]
    - [38, 10880.0]
  - - [3072, 48000, 1, 1024]
    - [40, 9415.39]
  - - [1760, 16, 1, 1760]
    - [12, 1600.62]
  - - [8192, 3200, 1, 2048]
    - [40, 7963.87]
  - - [512, 24000, 1, 2816]
    - [38, 10934.8]
  - - [4096, 400, 1, 1024]
    - [47, 4524.28]
  - - [6144, 48000, 1, 2560]
    - [38, 10286.0]
  - - [4608, 48000, 1, 1536]
    - [41, 10778.0]
  - - [35, 8457, 1, 2048]
    - [4, 2905.01]
  - - [4096, 128, 1, 4096]
    - [20, 4692.48]
  - - [2048, 800, 1, 512]
    - [38, 5515.95]
  - - [4608, 5984, 1, 1536]
    - [41, 10242.0]
  - - [2560, 128, 1, 2560]
    - [18, 4932.17]
  - - [6144, 5984, 1, 2048]
    - [40, 8070.51]
  - - [35, 8457, 1, 1760]
    - [5, 3894.03]
  - - [7680, 24000, 1, 2560]
    - [38, 10317.2]
  - - [6144, 48000, 1, 2048]
    - [40, 8995.24]
  - - [5124, 9124, 1, 2560]
    - [40, 9697.06]
  - - [2048, 3200, 1, 2048]
    - [33, 6562.64]
  - - [2048, 16, 1, 2048]
    - [9, 933.001]
  - - [1024, 24000, 1, 1536]
    - [38, 9915.39]
  - - [7680, 16, 1, 2560]
    - [8, 1692.54]
  - - [2560, 6400, 1, 2560]
    - [42, 9689.62]
  - - [2048, 128, 1, 2048]
    - [23, 3074.9]
  - - [512, 16, 1, 500000]
    - [3, 2270.16]
  - - [1024, 8, 1, 500000]
    - [0, 1165.81]
  - - [512, 24000, 1, 2560]
    - [43, 9504.68]
  - - [1024, 24000, 1, 2816]
    - [38, 11045.6]
  - - [7680, 5984, 1, 2560]
    - [40, 9819.2]
  - - [2048, 1600, 1, 512]
    - [41, 5481.25]
  - - [2048, 7000, 1, 2048]
    - [29, 7397.74]
  - - [1760, 800, 1, 1760]
    - [27, 8711.71]
  - - [5124, 9124, 1, 4096]
    - [28, 7934.9]
  - - [4096, 64, 1, 4096]
    - [21, 3275.72]
  - - [7680, 32, 1, 2560]
    - [10, 3146.79]
  - - [2560, 64, 1, 2560]
    - [14, 3782.32]
  - - [3072, 128, 1, 1024]
    - [25, 2756.41]
  - - [7680, 64, 1, 2560]
    - [21, 4867.16]
  - - [1760, 128, 1, 1760]
    - [14, 5836.96]
  - - [2560, 1600, 1, 2560]
    - [41, 8082.75]
  - - [2048, 3200, 1, 512]
    - [40, 6902.93]
  - - [2560, 800, 1, 2560]
    - [45, 7411.93]
  - - [3072, 32, 1, 1024]
    - [13, 1580.14]
  - - [6144, 32, 1, 2560]
    - [25, 2927.42]
  - - [4608, 12000, 1, 1536]
    - [41, 10479.7]
  - - [4096, 32, 1, 4096]
    - [10, 1964.1]
  - - [6144, 24000, 1, 2048]
    - [40, 8559.68]
  - - [8192, 800, 1, 2048]
    - [29, 6130.95]
  - - [4096, 1600, 1, 1024]
    - [40, 6458.54]
  - - [5124, 9124, 1, 2048]
    - [40, 8023.51]
  - - [8448, 24000, 1, 2816]
    - [38, 11525.6]
  - - [1024, 48000, 1, 1536]
    - [38, 9980.54]
  - - [7680, 128, 1, 2560]
    - [19, 6293.59]
  - - [8192, 1600, 1, 2048]
    - [40, 7262.92]
  - - [4096, 800, 1, 1024]
    - [47, 5446.97]
  - - [1024, 16, 1, 500000]
    - [2, 2297.75]
  - - [2048, 800, 1, 2048]
    - [33, 4925.73]
  - - [1760, 3200, 1, 1760]
    - [27, 10808.7]
  - - [512, 48000, 1, 2560]
    - [43, 9674.33]
  - - [8448, 16, 1, 2816]
    - [25, 1889.11]
  - - [2048, 64, 1, 2048]
    - [24, 2511.27]
  - - [512, 24000, 1, 2048]
    - [31, 7894.04]
  - - [16384, 1600, 1, 4096]
    - [33, 6780.16]
  - - [4608, 16, 1, 1536]
    - [13, 1363.75]
  - - [1024, 24000, 1, 2048]
    - [28, 7623.62]
  - - [8192, 400, 1, 2048]
    - [28, 5536.18]
  - - [2048, 6400, 1, 2048]
    - [31, 7307.0]
  - - [6144, 12000, 1, 2048]
    - [40, 8285.7]
  - - [512, 8, 1, 500000]
    - [1, 1154.61]
  - - [1760, 7000, 1, 1760]
    - [27, 10726.8]
  - - [1024, 48000, 1, 2816]
    - [38, 11348.3]
  - - [6144, 16, 1, 2560]
    - [26, 1619.3]
  - - [8448, 32, 1, 2816]
    - [17, 3401.77]
  - - [4096, 16, 1, 4096]
    - [15, 1087.89]
  - - [6144, 24000, 1, 2560]
    - [40, 9938.26]
  - - [1024, 1024, 1, 1024]
    - [43, 4539.63]
  - - [8448, 12000, 1, 2816]
    - [38, 11451.7]
  - - [16384, 400, 1, 4096]
    - [28, 6507.95]
  - - [1760, 1600, 1, 1760]
    - [44, 9615.69]
  - - [1024, 48000, 1, 2048]
    - [38, 7787.9]
- - - -1
    - - - -1
        - - - 4
            - - [704, 16]
              - [1856, 12]
              - [2944, 16]
              - [3584, 12]
              - [5056, 16]
              - [5888, 12]
              - [-1, 16]
          - - 64
            - - [128, 16]
              - [256, 24]
              - [448, 10]
              - [1024, 23]
              - [1408, 18]
              - [1856, 22]
              - [2368, 14]
              - [2944, 22]
              - [3584, 18]
              - [4288, 22]
              - [5056, 18]
              - [5888, 22]
              - [-1, 32]
          - - 128
            - - [64, 16]
              - [128, 26]
              - [256, 10]
              - [448, 23]
              - [704, 18]
              - [1408, 22]
              - [1856, 11]
              - [2944, 22]
              - [3584, 36]
              - [4288, 22]
              - [5056, 11]
              - [5888, 36]
              - [-1, 34]
          - - 256
            - - [4, 16]
              - [64, 26]
              - [128, 18]
              - [256, 8]
              - [448, 22]
              - [2944, 36]
              - [3584, 30]
              - [5056, 36]
              - [5888, 35]
              - [-1, 36]
          - - 448
            - - [4, 16]
              - [64, 10]
              - [448, 23]
              - [1408, 36]
              - [1856, 35]
              - [2368, 32]
              - [2944, 27]
              - [3584, 32]
              - [4288, 34]
              - [5056, 27]
              - [5888, 46]
              - [-1, 34]
          - - 704
            - - [4, 16]
              - [64, 23]
              - [128, 14]
              - [256, 36]
              - [1024, 32]
              - [1408, 34]
              - [2368, 32]
              - [5888, 34]
              - [-1, 46]
          - - 1024
            - - [4, 16]
              - [64, 10]
              - [128, 11]
              - [256, 32]
              - [704, 36]
              - [1408, 27]
              - [1856, 46]
              - [2368, 27]
              - [2944, 46]
              - [3584, 27]
              - [4288, 30]
              - [-1, 44]
          - - 1408
            - - [4, 12]
              - [64, 18]
              - [128, 23]
              - [256, 32]
              - [448, 36]
              - [704, 37]
              - [1024, 35]
              - [1408, 44]
              - [1856, 37]
              - [2368, 35]
              - [-1, 44]
          - - 1856
            - - [4, 16]
              - [64, 23]
              - [128, 11]
              - [256, 32]
              - [448, 27]
              - [704, 32]
              - [1024, 44]
              - [1408, 35]
              - [1856, 27]
              - [2368, 35]
              - [2944, 27]
              - [3584, 46]
              - [4288, 44]
              - [5056, 27]
              - [-1, 46]
          - - 2368
            - - [4, 16]
              - [64, 14]
              - [128, 22]
              - [256, 32]
              - [448, 36]
              - [704, 32]
              - [2368, 35]
              - [2944, 46]
              - [3584, 27]
              - [4288, 37]
              - [5056, 44]
              - [-1, 46]
          - - 2944
            - - [4, 16]
              - [64, 22]
              - [128, 11]
              - [256, 32]
              - [448, 35]
              - [704, 27]
              - [1024, 44]
              - [1408, 46]
              - [1856, 27]
              - [2368, 46]
              - [2944, 27]
              - [3584, 46]
              - [5056, 27]
              - [-1, 46]
          - - 3584
            - - [4, 12]
              - [64, 11]
              - [128, 32]
              - [256, 29]
              - [448, 32]
              - [704, 37]
              - [1024, 35]
              - [1408, 44]
              - [1856, 46]
              - [2368, 44]
              - [-1, 46]
          - - 4288
            - - [4, 16]
              - [64, 23]
              - [128, 14]
              - [256, 32]
              - [448, 37]
              - [704, 27]
              - [1024, 35]
              - [1856, 46]
              - [2368, 35]
              - [3584, 46]
              - [4288, 27]
              - [-1, 46]
          - - 5056
            - - [4, 16]
              - [64, 18]
              - [128, 11]
              - [256, 32]
              - [448, 35]
              - [704, 27]
              - [1408, 46]
              - [1856, 35]
              - [2368, 46]
              - [2944, 27]
              - [-1, 46]
          - - 5888
            - - [4, 12]
              - [64, 11]
              - [128, 32]
              - [256, 35]
              - [448, 46]
              - [704, 27]
              - [2944, 46]
              - [3584, 30]
              - [-1, 46]
          - - -1
            - - [4, 16]
              - [64, 36]
              - [128, 34]
              - [256, 32]
              - [448, 37]
              - [1024, 46]
              - [1408, 35]
              - [1856, 30]
              - [2368, 46]
              - [2944, 30]
              - [-1, 46]
