library/src/blas3/Tensile/Logic/asm_full/vega20_Cijk_Alik_Bljk_HB.yaml
- {MinimumRequiredVersion: 4.5.0}
- vega20
- gfx906
- [Device 66a0, Device 66a1, Device 66a7]
    SolutionIndex: 0
    SolutionNameMin: Cijk_Alik_Bljk_HB_MT016x016x16_PGR1_PLR1_TT02_02
    SolutionIndex: 1
    SolutionNameMin: Cijk_Alik_Bljk_HB_MT032x032x16_PGR1_PLR1_TT04_04
    SolutionIndex: 2
    SolutionNameMin: Cijk_Alik_Bljk_HB_MT064x016x16_PGR1_PLR1_TT04_04
    SolutionIndex: 3
    SolutionNameMin: Cijk_Alik_Bljk_HB_MT032x032x32_PGR1_PLR1_TT04_04
    SolutionIndex: 4
    SolutionNameMin: Cijk_Alik_Bljk_HB_MT064x064x32_PGR1_PLR1_TT08_08
    SolutionIndex: 5
    SolutionNameMin: Cijk_Alik_Bljk_HB_MT064x032x32_PGR1_PLR1_TT04_04
    SolutionIndex: 6
    SolutionNameMin: Cijk_Alik_Bljk_HB_MT032x032x16_PGR1_PLR1_TT04_04
    SolutionIndex: 7
    SolutionNameMin: Cijk_Alik_Bljk_HB_MT064x032x16_PGR1_PLR1_TT04_04
    SolutionIndex: 8
    SolutionNameMin: Cijk_Alik_Bljk_HB_MT016x016x24_PGR1_PLR1_TT02_02
    SolutionIndex: 9
    SolutionNameMin: Cijk_Alik_Bljk_HB_MT032x016x24_PGR1_PLR1_TT04_02
    SolutionIndex: 10
    SolutionNameMin: Cijk_Alik_Bljk_HB_MT032x032x24_PGR1_PLR1_TT04_04
    SolutionIndex: 11
    SolutionNameMin: Cijk_Alik_Bljk_HB_MT016x016x24_PGR1_PLR1_TT02_02
    SolutionIndex: 12
    SolutionNameMin: Cijk_Alik_Bljk_HB_MT032x032x24_PGR1_PLR1_TT04_04
    SolutionIndex: 13
    SolutionNameMin: Cijk_Alik_Bljk_HB_MT064x032x32_PGR1_PLR1_TT08_04
    SolutionIndex: 14
    SolutionNameMin: Cijk_Alik_Bljk_HB_MT032x032x32_PGR1_PLR1_TT04_04
    SolutionIndex: 15
    SolutionNameMin: Cijk_Alik_Bljk_HB_MT064x064x32_PGR1_PLR1_TT08_08
    SolutionIndex: 16
    SolutionNameMin: Cijk_Alik_Bljk_HB_MT032x016x32_PGR1_PLR1_TT02_02
    SolutionIndex: 17
    SolutionNameMin: Cijk_Alik_Bljk_HB_MT128x032x32_PGR1_PLR1_TT04_04
    SolutionIndex: 18
    SolutionNameMin: Cijk_Alik_Bljk_HB_MT256x064x32_PGR1_PLR1_TT08_08
    SolutionIndex: 19
    SolutionNameMin: Cijk_Alik_Bljk_HB_MT128x064x08_PGR1_PLR1_TT08_04
    SolutionIndex: 20
    SolutionNameMin: Cijk_Alik_Bljk_HB_MT128x128x08_PGR1_PLR1_TT08_08
    SolutionIndex: 21
    SolutionNameMin: Cijk_Alik_Bljk_HB_MT064x064x16_PGR1_PLR1_TT04_04
    SolutionIndex: 22
    SolutionNameMin: Cijk_Alik_Bljk_HB_MT064x128x16_PGR1_PLR1_TT04_08
    SolutionIndex: 23
    SolutionNameMin: Cijk_Alik_Bljk_HB_MT128x128x16_PGR1_PLR1_TT08_08
    SolutionIndex: 24
    SolutionNameMin: Cijk_Alik_Bljk_HB_MT064x064x32_PGR1_PLR1_TT04_04
    SolutionIndex: 25
    SolutionNameMin: Cijk_Alik_Bljk_HB_MT128x128x32_PGR1_PLR1_TT08_08
    SolutionIndex: 26
    SolutionNameMin: Cijk_Alik_Bljk_HB_MT064x128x08_PGR0_PLR0_TT04_08
    SolutionIndex: 27
    SolutionNameMin: Cijk_Alik_Bljk_HB_MT064x064x08_PGR1_PLR1_TT04_04
    SolutionIndex: 28
    SolutionNameMin: Cijk_Alik_Bljk_HB_MT064x064x04_PGR0_PLR0_TT04_04
    SolutionIndex: 29
    SolutionNameMin: Cijk_Alik_Bljk_HB_MT064x064x08_PGR1_PLR1_TT04_04
    SolutionIndex: 0
    SolutionNameMin: Cijk_Alik_Bljk_HB_MT128x032x16_GSU03_LPB00_NLCA01_NLCB01_PGR1_PLR1_TT08_08_WG16_04_04_WGM08
    SolutionIndex: 1
    SolutionNameMin: Cijk_Alik_Bljk_HB_MT128x032x16_GSU03_LPB08_NLCA01_NLCB01_PGR1_PLR1_TT08_08_WG16_04_04_WGM01
    SolutionIndex: 2
    SolutionNameMin: Cijk_Alik_Bljk_HB_MT128x032x16_GSU05_LPB08_NLCA01_NLCB01_PGR1_PLR1_TT08_08_WG16_04_04_WGM64
    SolutionIndex: 3
    SolutionNameMin: Cijk_Alik_Bljk_HB_MT128x032x32_GSU05_LPB08_NLCA01_NLCB01_PGR1_PLR1_TT08_08_WG16_04_04_WGM01
    SolutionIndex: 4
    SolutionNameMin: Cijk_Alik_Bljk_HB_MT128x032x32_GSU01_LPB08_NLCA01_NLCB01_PGR1_PLR1_TT08_08_WG16_04_04_WGM64
    SolutionIndex: 5
    SolutionNameMin: Cijk_Alik_Bljk_HB_MT128x032x32_GSU05_LPB08_NLCA01_NLCB01_PGR1_PLR1_TT08_08_WG16_04_04_WGM64
- - - [2560, 7000, 1, 2560]
    - [23, 18366.0]
  - - [7680, 12000, 1, 2560]
    - [25, 16838.9]
  - - [5124, 9124, 1, 1760]
    - [23, 19088.9]
  - - [1760, 32, 1, 1760]
    - [8, 2488.03]
  - - [512, 24000, 1, 1536]
    - [23, 17350.3]
  - - [3072, 24000, 1, 1024]
    - [23, 18192.9]
  - - [2048, 400, 1, 512]
    - [15, 9165.87]
  - - [2560, 128, 1, 2560]
    - [6, 6271.39]
  - - [3072, 16, 1, 1024]
    - [8, 1557.29]
  - - [512, 48000, 1, 2816]
    - [23, 19585.1]
  - - [512, 48000, 1, 2048]
    - [25, 15084.9]
  - - [1760, 64, 1, 1760]
    - [8, 4185.95]
  - - [2048, 1600, 1, 2048]
    - [24, 8663.23]
  - - [512, 48000, 1, 1536]
    - [23, 18674.2]
  - - [2560, 32, 1, 2560]
    - [11, 3102.3]
  - - [8448, 5984, 1, 2816]
    - [23, 19532.8]
  - - [4096, 3200, 1, 1024]
    - [25, 15263.1]
  - - [1024, 24000, 1, 2560]
    - [23, 18968.5]
  - - [1760, 6400, 1, 1760]
    - [23, 19059.2]
  - - [5124, 9124, 1, 2048]
    - [25, 15582.0]
  - - [1024, 700, 1, 512]
    - [15, 8672.06]
  - - [4608, 32, 1, 1536]
    - [12, 4423.68]
  - - [3072, 64, 1, 1024]
    - [14, 4007.3]
  - - [16384, 3200, 1, 4096]
    - [25, 16185.4]
  - - [2560, 16, 1, 2560]
    - [11, 1894.1]
  - - [1024, 48000, 1, 2560]
    - [23, 19697.0]
  - - [8448, 48000, 1, 2816]
    - [23, 15751.5]
  - - [2048, 32, 1, 2048]
    - [8, 2026.23]
  - - [2560, 3200, 1, 2560]
    - [23, 17052.2]
  - - [16384, 800, 1, 4096]
    - [25, 13539.6]
  - - [4608, 24000, 1, 1536]
    - [23, 19832.9]
  - - [7680, 48000, 1, 2560]
    - [25, 13844.1]
  - - [3072, 48000, 1, 1024]
    - [23, 19202.1]
  - - [1760, 16, 1, 1760]
    - [8, 1312.54]
  - - [8192, 3200, 1, 2048]
    - [25, 15123.8]
  - - [512, 24000, 1, 2816]
    - [23, 19249.6]
  - - [4096, 400, 1, 1024]
    - [25, 10821.2]
  - - [6144, 48000, 1, 2560]
    - [25, 14549.7]
  - - [4608, 48000, 1, 1536]
    - [23, 20004.8]
  - - [4096, 128, 1, 4096]
    - [18, 4571.45]
  - - [2048, 800, 1, 512]
    - [25, 11155.1]
  - - [4608, 5984, 1, 1536]
    - [23, 18786.6]
  - - [4096, 1600, 1, 1024]
    - [25, 13441.1]
  - - [6144, 5984, 1, 2048]
    - [25, 15563.2]
  - - [7680, 24000, 1, 2560]
    - [23, 15888.4]
  - - [6144, 48000, 1, 2048]
    - [25, 15680.2]
  - - [2048, 3200, 1, 2048]
    - [25, 10788.5]
  - - [5124, 9124, 1, 2560]
    - [23, 18835.5]
  - - [1024, 24000, 1, 1536]
    - [23, 18635.8]
  - - [7680, 16, 1, 2560]
    - [9, 3389.79]
  - - [2560, 6400, 1, 2560]
    - [23, 18466.7]
  - - [2048, 128, 1, 2048]
    - [3, 3437.95]
  - - [512, 16, 1, 500000]
    - [0, 403.045]
  - - [1024, 8, 1, 500000]
    - [0, 403.083]
  - - [512, 24000, 1, 2560]
    - [23, 18051.5]
  - - [1024, 24000, 1, 2816]
    - [23, 19525.0]
  - - [7680, 5984, 1, 2560]
    - [23, 19094.6]
  - - [2048, 1600, 1, 512]
    - [25, 11902.1]
  - - [2048, 7000, 1, 2048]
    - [25, 14016.8]
  - - [1760, 800, 1, 1760]
    - [19, 13081.1]
  - - [4096, 64, 1, 4096]
    - [3, 3777.59]
  - - [7680, 32, 1, 2560]
    - [1, 5744.57]
  - - [2560, 64, 1, 2560]
    - [12, 5105.04]
  - - [3072, 128, 1, 1024]
    - [17, 5221.13]
  - - [7680, 64, 1, 2560]
    - [13, 7391.28]
  - - [1760, 128, 1, 1760]
    - [10, 7020.06]
  - - [2560, 1600, 1, 2560]
    - [23, 13824.7]
  - - [2048, 3200, 1, 512]
    - [25, 14146.1]
  - - [2560, 800, 1, 2560]
    - [23, 11385.7]
  - - [3072, 32, 1, 1024]
    - [3, 2573.19]
  - - [6144, 32, 1, 2560]
    - [12, 5260.41]
  - - [4608, 12000, 1, 1536]
    - [23, 19522.7]
  - - [4096, 32, 1, 4096]
    - [5, 2302.19]
  - - [6144, 24000, 1, 2048]
    - [25, 16544.6]
  - - [8192, 800, 1, 2048]
    - [25, 11619.4]
  - - [5124, 9124, 1, 4096]
    - [25, 15816.1]
  - - [8448, 24000, 1, 2816]
    - [23, 14922.3]
  - - [1024, 48000, 1, 1536]
    - [23, 19499.1]
  - - [7680, 128, 1, 2560]
    - [4, 12876.5]
  - - [8192, 1600, 1, 2048]
    - [25, 13044.5]
  - - [4096, 800, 1, 1024]
    - [25, 11902.1]
  - - [1024, 16, 1, 500000]
    - [0, 806.078]
  - - [2048, 800, 1, 2048]
    - [25, 7444.63]
  - - [1760, 3200, 1, 1760]
    - [20, 17001.1]
  - - [512, 48000, 1, 2560]
    - [23, 19026.7]
  - - [8448, 16, 1, 2816]
    - [2, 3861.94]
  - - [2048, 64, 1, 2048]
    - [3, 2640.0]
  - - [512, 24000, 1, 2048]
    - [25, 13301.7]
  - - [16384, 1600, 1, 4096]
    - [25, 14829.9]
  - - [4608, 16, 1, 1536]
    - [8, 2675.95]
  - - [1024, 24000, 1, 2048]
    - [25, 15179.5]
  - - [8192, 400, 1, 2048]
    - [25, 8516.35]
  - - [2048, 6400, 1, 2048]
    - [25, 13767.6]
  - - [6144, 12000, 1, 2048]
    - [25, 16194.8]
  - - [512, 8, 1, 500000]
    - [0, 201.527]
  - - [1760, 7000, 1, 1760]
    - [20, 17879.8]
  - - [1024, 48000, 1, 2816]
    - [23, 20120.4]
  - - [6144, 16, 1, 2560]
    - [9, 3126.97]
  - - [8448, 32, 1, 2816]
    - [7, 5910.45]
  - - [4096, 7000, 1, 4096]
    - [25, 15932.7]
  - - [4096, 16, 1, 4096]
    - [16, 1385.97]
  - - [6144, 24000, 1, 2560]
    - [23, 18972.3]
  - - [1024, 1024, 1, 1024]
    - [25, 10412.5]
  - - [2048, 16, 1, 2048]
    - [11, 1103.76]
  - - [8448, 12000, 1, 2816]
    - [23, 19849.0]
  - - [16384, 400, 1, 4096]
    - [25, 10178.8]
  - - [1760, 1600, 1, 1760]
    - [20, 15832.4]
  - - [1024, 48000, 1, 2048]
    - [25, 16254.3]
  - - [512, 128, 1, 784]
    - [31, 2854.46]
  - - [1024, 256, 1, 196]
    - [34, 5221.57]
  - - [256, 64, 1, 3136]
    - [35, 1928.69]
  - - [256, 1024, 1, 196]
    - [34, 5221.57]
  - - [64, 256, 1, 3136]
    - [33, 2038.9]
  - - [128, 512, 1, 784]
    - [30, 2841.83]
  - - [64, 64, 1, 3136]
    - [32, 538.803]
- - - -1
    - - - 1
        - - - 32
            - - [32, 29]
              - [64, 28]
              - [128, 29]
              - [256, 28]
              - [704, 29]
              - [4288, 28]
              - [5056, 29]
              - [-1, 28]
          - - 64
            - - [4288, 28]
              - [5888, 29]
              - [-1, 28]
          - - 128
            - - [64, 28]
              - [128, 29]
              - [704, 28]
              - [1024, 29]
              - [1408, 28]
              - [2368, 29]
              - [2944, 28]
              - [4288, 29]
              - [-1, 28]
          - - 256
            - - [128, 28]
              - [448, 29]
              - [704, 28]
              - [1856, 29]
              - [2368, 28]
              - [3584, 29]
              - [4288, 28]
              - [5888, 29]
              - [-1, 28]
          - - 448
            - - [704, 28]
              - [1024, 29]
              - [-1, 28]
          - - 704
            - - [32, 29]
              - [448, 28]
              - [704, 29]
              - [1408, 28]
              - [1856, 29]
              - [2368, 28]
              - [2944, 29]
              - [-1, 28]
          - - 1024
            - - [64, 28]
              - [256, 29]
              - [448, 28]
              - [1024, 29]
              - [-1, 28]
          - - 1408
            - - [32, 28]
              - [64, 29]
              - [128, 28]
              - [256, 29]
              - [3584, 28]
              - [4288, 29]
              - [-1, 28]
          - - 1856
            - - [256, 28]
              - [704, 29]
              - [-1, 28]
          - - 2368
            - - [32, 28]
              - [128, 29]
              - [-1, 28]
          - - 2944
            - - [32, 28]
              - [128, 29]
              - [256, 28]
              - [448, 29]
              - [-1, 28]
          - - 3584
            - - [64, 29]
              - [-1, 28]
          - - 4288
            - - [128, 28]
              - [256, 29]
              - [-1, 28]
          - - 5056
            - - [64, 28]
              - [256, 29]
              - [-1, 28]
          - - 5888
            - - [32, 28]
              - [64, 29]
              - [-1, 28]
          - - -1
            - - [32, 28]
              - [64, 29]
              - [2368, 28]
              - [2944, 29]
              - [5056, 28]
              - [5888, 29]
              - [-1, 28]
      - - 32
        - - - 128
            - - [-1, 27]
          - - 256
            - - [3584, 27]
              - [-1, 26]
          - - 448
            - - [64, 27]
              - [128, 26]
              - [256, 27]
              - [448, 26]
              - [1408, 27]
              - [1856, 26]
              - [2368, 27]
              - [-1, 26]
          - - 704
            - - [704, 27]
              - [1024, 26]
              - [1408, 27]
              - [-1, 26]
          - - 1408
            - - [704, 27]
              - [-1, 26]
          - - 2368
            - - [448, 27]
              - [-1, 26]
          - - 2944
            - - [128, 27]
              - [-1, 26]
          - - 3584
            - - [64, 26]
              - [256, 27]
              - [-1, 26]
          - - 4288
            - - [256, 27]
              - [-1, 26]
          - - 5056
            - - [128, 27]
              - [-1, 26]
          - - -1
            - - [64, 27]
              - [-1, 26]
      - - 256
        - - - 1
            - - [-1, 29]
          - - 32
            - - [-1, 27]
          - - 64
            - - [1, 29]
              - [32, 27]
              - [704, 0]
              - [1024, 8]
              - [1856, 0]
              - [3584, 1]
              - [4288, 7]
              - [-1, 21]
          - - 128
            - - [1, 29]
              - [32, 27]
              - [704, 0]
              - [1024, 6]
              - [1856, 1]
              - [2368, 7]
              - [5888, 21]
              - [-1, 23]
          - - 256
            - - [1, 29]
              - [32, 27]
              - [256, 0]
              - [448, 9]
              - [704, 6]
              - [2944, 21]
              - [3584, 23]
              - [5888, 22]
              - [-1, 23]
          - - 448
            - - [1, 29]
              - [32, 27]
              - [128, 0]
              - [256, 1]
              - [448, 6]
              - [1408, 21]
              - [1856, 23]
              - [2944, 22]
              - [3584, 23]
              - [5056, 22]
              - [5888, 23]
              - [-1, 22]
          - - 704
            - - [1, 29]
              - [32, 27]
              - [64, 0]
              - [128, 11]
              - [256, 6]
              - [1024, 21]
              - [1856, 22]
              - [2368, 23]
              - [2944, 22]
              - [3584, 23]
              - [4288, 22]
              - [5056, 23]
              - [5888, 22]
              - [-1, 23]
          - - 1024
            - - [1, 29]
              - [32, 27]
              - [64, 8]
              - [128, 1]
              - [704, 21]
              - [1024, 23]
              - [1408, 22]
              - [-1, 23]
          - - 1408
            - - [1, 29]
              - [32, 27]
              - [64, 11]
              - [128, 6]
              - [448, 21]
              - [704, 15]
              - [1024, 22]
              - [-1, 23]
          - - 1856
            - - [1, 29]
              - [32, 27]
              - [64, 1]
              - [256, 21]
              - [448, 15]
              - [704, 22]
              - [-1, 23]
          - - 2368
            - - [1, 29]
              - [32, 27]
              - [64, 1]
              - [256, 21]
              - [448, 22]
              - [704, 23]
              - [1024, 22]
              - [-1, 23]
          - - 2944
            - - [1, 29]
              - [32, 27]
              - [64, 1]
              - [256, 21]
              - [448, 22]
              - [704, 21]
              - [-1, 23]
          - - 3584
            - - [1, 29]
              - [32, 27]
              - [128, 21]
              - [256, 22]
              - [-1, 23]
          - - 4288
            - - [1, 29]
              - [32, 27]
              - [64, 7]
              - [448, 21]
              - [-1, 23]
          - - 5056
            - - [1, 29]
              - [32, 27]
              - [128, 21]
              - [448, 22]
              - [-1, 23]
          - - 5888
            - - [1, 29]
              - [32, 27]
              - [128, 21]
              - [256, 22]
              - [-1, 23]
          - - -1
            - - [1, 29]
              - [32, 27]
              - [64, 21]
              - [128, 22]
              - [256, 23]
              - [448, 22]
              - [-1, 23]
      - - 1280
        - - - 1
            - - [-1, 29]
          - - 32
            - - [-1, 27]
          - - 64
            - - [1, 29]
              - [32, 27]
              - [1856, 8]
              - [2368, 10]
              - [2944, 12]
              - [3584, 1]
              - [5056, 10]
              - [-1, 21]
          - - 128
            - - [1, 29]
              - [32, 27]
              - [256, 8]
              - [448, 11]
              - [704, 8]
              - [1024, 11]
              - [1856, 10]
              - [2368, 7]
              - [2944, 10]
              - [5888, 21]
              - [-1, 4]
          - - 256
            - - [1, 29]
              - [32, 27]
              - [448, 8]
              - [1408, 12]
              - [2944, 21]
              - [3584, 23]
              - [5056, 21]
              - [5888, 22]
              - [-1, 23]
          - - 448
            - - [1, 29]
              - [32, 27]
              - [64, 8]
              - [256, 11]
              - [448, 12]
              - [1408, 21]
              - [1856, 23]
              - [2368, 21]
              - [2944, 22]
              - [3584, 23]
              - [5056, 22]
              - [5888, 23]
              - [-1, 22]
          - - 704
            - - [1, 29]
              - [32, 27]
              - [64, 8]
              - [128, 11]
              - [256, 12]
              - [1024, 21]
              - [1408, 15]
              - [1856, 21]
              - [2368, 23]
              - [4288, 22]
              - [5056, 23]
              - [5888, 22]
              - [-1, 23]
          - - 1024
            - - [1, 29]
              - [32, 27]
              - [64, 8]
              - [128, 11]
              - [256, 12]
              - [704, 21]
              - [1024, 23]
              - [1408, 22]
              - [1856, 23]
              - [2368, 22]
              - [-1, 23]
          - - 1408
            - - [1, 29]
              - [32, 27]
              - [64, 11]
              - [128, 6]
              - [256, 12]
              - [448, 21]
              - [704, 15]
              - [1024, 22]
              - [-1, 23]
          - - 1856
            - - [1, 29]
              - [32, 27]
              - [64, 11]
              - [128, 12]
              - [256, 21]
              - [448, 23]
              - [704, 21]
              - [1024, 23]
              - [1408, 22]
              - [-1, 23]
          - - 2368
            - - [1, 29]
              - [32, 27]
              - [64, 12]
              - [128, 7]
              - [448, 21]
              - [704, 23]
              - [1024, 22]
              - [-1, 23]
          - - 2944
            - - [1, 29]
              - [32, 27]
              - [64, 12]
              - [256, 21]
              - [448, 22]
              - [704, 21]
              - [-1, 23]
          - - 3584
            - - [1, 29]
              - [32, 27]
              - [64, 6]
              - [128, 21]
              - [-1, 23]
          - - 4288
            - - [1, 29]
              - [32, 27]
              - [64, 12]
              - [448, 21]
              - [-1, 23]
          - - 5056
            - - [1, 29]
              - [32, 27]
              - [64, 7]
              - [256, 21]
              - [448, 22]
              - [-1, 23]
          - - 5888
            - - [1, 29]
              - [32, 27]
              - [128, 21]
              - [256, 22]
              - [-1, 23]
          - - -1
            - - [1, 29]
              - [32, 27]
              - [64, 21]
              - [128, 4]
              - [-1, 23]
      - - -1
        - - - 1
            - - [-1, 29]
          - - 32
            - - [-1, 27]
          - - 64
            - - [1, 29]
              - [32, 27]
              - [64, 11]
              - [1856, 8]
              - [2368, 12]
              - [2944, 10]
              - [3584, 12]
              - [4288, 10]
              - [5056, 12]
              - [5888, 7]
              - [-1, 21]
          - - 128
            - - [1, 29]
              - [32, 27]
              - [1024, 8]
              - [1856, 12]
              - [2368, 10]
              - [2944, 12]
              - [5888, 21]
              - [-1, 23]
          - - 256
            - - [1, 29]
              - [32, 27]
              - [448, 8]
              - [1408, 12]
              - [2944, 21]
              - [3584, 23]
              - [5056, 21]
              - [5888, 22]
              - [-1, 23]
          - - 448
            - - [1, 29]
              - [32, 27]
              - [128, 8]
              - [256, 11]
              - [704, 12]
              - [1408, 21]
              - [1856, 23]
              - [2368, 21]
              - [2944, 22]
              - [3584, 23]
              - [5056, 22]
              - [5888, 23]
              - [-1, 22]
          - - 704
            - - [1, 29]
              - [32, 27]
              - [64, 8]
              - [128, 11]
              - [448, 12]
              - [1024, 21]
              - [1408, 15]
              - [1856, 21]
              - [2368, 23]
              - [4288, 22]
              - [5056, 23]
              - [5888, 22]
              - [-1, 23]
          - - 1024
            - - [1, 29]
              - [32, 27]
              - [128, 8]
              - [256, 12]
              - [704, 21]
              - [1024, 23]
              - [1408, 22]
              - [1856, 23]
              - [2368, 22]
              - [-1, 23]
          - - 1408
            - - [1, 29]
              - [32, 27]
              - [64, 11]
              - [256, 12]
              - [448, 21]
              - [704, 15]
              - [1024, 22]
              - [-1, 23]
          - - 1856
            - - [1, 29]
              - [32, 27]
              - [64, 11]
              - [128, 12]
              - [256, 21]
              - [448, 23]
              - [704, 21]
              - [1024, 23]
              - [1408, 22]
              - [-1, 23]
          - - 2368
            - - [1, 29]
              - [32, 27]
              - [64, 12]
              - [128, 7]
              - [448, 21]
              - [704, 23]
              - [1024, 22]
              - [-1, 23]
          - - 2944
            - - [1, 29]
              - [32, 27]
              - [64, 12]
              - [128, 7]
              - [256, 21]
              - [448, 22]
              - [704, 21]
              - [-1, 23]
          - - 3584
            - - [1, 29]
              - [32, 27]
              - [64, 10]
              - [128, 21]
              - [-1, 23]
          - - 4288
            - - [1, 29]
              - [32, 27]
              - [64, 12]
              - [448, 21]
              - [-1, 23]
          - - 5056
            - - [1, 29]
              - [32, 27]
              - [64, 7]
              - [256, 21]
              - [448, 22]
              - [-1, 23]
          - - 5888
            - - [1, 29]
              - [32, 27]
              - [64, 7]
              - [128, 21]
              - [256, 22]
              - [-1, 23]
          - - -1
            - - [1, 29]
              - [32, 27]
              - [64, 21]
              - [128, 4]
              - [1856, 23]
              - [2368, 25]
              - [5056, 23]
              - [5888, 25]
              - [-1, 23]
