library/src/blas3/Tensile/Logic/asm_full/vega10_Cijk_Alik_Bljk_HB.yaml
- {MinimumRequiredVersion: 4.5.0}
- vega10
- gfx900
- [Device 6863, Device 6862, Device 687f, Device 6860, Device 6861, 'Vega 10 XTX [Radeon
    SolutionIndex: 0
    SolutionNameMin: Cijk_Alik_Bljk_HB_MT016x016x16_PGR1_PLR1_TT02_02
    SolutionIndex: 1
    SolutionNameMin: Cijk_Alik_Bljk_HB_MT032x032x16_PGR1_PLR1_TT04_04
    SolutionIndex: 2
    SolutionNameMin: Cijk_Alik_Bljk_HB_MT032x016x16_PGR1_PLR1_TT02_02
    SolutionIndex: 3
    SolutionNameMin: Cijk_Alik_Bljk_HB_MT064x032x16_PGR1_PLR1_TT04_04
    SolutionIndex: 4
    SolutionNameMin: Cijk_Alik_Bljk_HB_MT016x016x32_PGR1_PLR1_TT02_02
    SolutionIndex: 5
    SolutionNameMin: Cijk_Alik_Bljk_HB_MT032x032x32_PGR1_PLR1_TT04_04
    SolutionIndex: 6
    SolutionNameMin: Cijk_Alik_Bljk_HB_MT032x016x32_PGR1_PLR1_TT02_02
    SolutionIndex: 7
    SolutionNameMin: Cijk_Alik_Bljk_HB_MT128x032x32_PGR1_PLR1_TT04_04
    SolutionIndex: 8
    SolutionNameMin: Cijk_Alik_Bljk_HB_MT256x064x32_PGR1_PLR1_TT08_08
    SolutionIndex: 9
    SolutionNameMin: Cijk_Alik_Bljk_HB_MT032x032x16_PGR1_PLR1_TT04_04
    SolutionIndex: 10
    SolutionNameMin: Cijk_Alik_Bljk_HB_MT016x016x24_PGR1_PLR1_TT02_02
    SolutionIndex: 11
    SolutionNameMin: Cijk_Alik_Bljk_HB_MT032x016x24_PGR1_PLR1_TT04_02
    SolutionIndex: 12
    SolutionNameMin: Cijk_Alik_Bljk_HB_MT032x032x24_PGR1_PLR1_TT04_04
    SolutionIndex: 13
    SolutionNameMin: Cijk_Alik_Bljk_HB_MT016x016x24_PGR1_PLR1_TT02_02
    SolutionIndex: 14
    SolutionNameMin: Cijk_Alik_Bljk_HB_MT032x032x24_PGR1_PLR1_TT04_04
    SolutionIndex: 15
    SolutionNameMin: Cijk_Alik_Bljk_HB_MT064x032x32_PGR1_PLR1_TT04_04
    SolutionIndex: 16
    SolutionNameMin: Cijk_Alik_Bljk_HB_MT128x064x32_PGR1_PLR1_TT08_08
    SolutionIndex: 17
    SolutionNameMin: Cijk_Alik_Bljk_HB_MT128x032x32_PGR1_PLR1_TT04_04
    SolutionIndex: 18
    SolutionNameMin: Cijk_Alik_Bljk_HB_MT032x032x64_PGR1_PLR1_TT04_04
    SolutionIndex: 19
    SolutionNameMin: Cijk_Alik_Bljk_HB_MT128x128x08_PGR1_PLR1_TT08_08
    SolutionIndex: 20
    SolutionNameMin: Cijk_Alik_Bljk_HB_MT064x064x16_PGR1_PLR1_TT04_04
    SolutionIndex: 21
    SolutionNameMin: Cijk_Alik_Bljk_HB_MT128x064x16_PGR1_PLR1_TT08_04
    SolutionIndex: 22
    SolutionNameMin: Cijk_Alik_Bljk_HB_MT128x128x16_PGR1_PLR1_TT08_08
    SolutionIndex: 23
    SolutionNameMin: Cijk_Alik_Bljk_HB_MT064x064x32_PGR1_PLR1_TT04_04
    SolutionIndex: 24
    SolutionNameMin: Cijk_Alik_Bljk_HB_MT128x128x32_PGR1_PLR1_TT08_08
    SolutionIndex: 25
    SolutionNameMin: Cijk_Alik_Bljk_HB_MT064x128x08_PGR0_PLR1_TT04_08
    SolutionIndex: 26
    SolutionNameMin: Cijk_Alik_Bljk_HB_MT064x064x08_PGR1_PLR1_TT04_04
    SolutionIndex: 27
    SolutionNameMin: Cijk_Alik_Bljk_HB_MT064x064x04_PGR0_PLR0_TT04_04
    SolutionIndex: 28
    SolutionNameMin: Cijk_Alik_Bljk_HB_MT064x064x08_PGR1_PLR1_TT04_04
    SolutionIndex: 0
    SolutionNameMin: Cijk_Alik_Bljk_HB_MT128x032x16_GSU03_LPB00_NLCA01_NLCB01_PGR1_PLR1_TT08_08_WG16_04_04_WGM01
    SolutionIndex: 1
    SolutionNameMin: Cijk_Alik_Bljk_HB_MT128x032x16_GSU03_LPB00_NLCA01_NLCB01_PGR1_PLR1_TT08_08_WG16_04_04_WGM08
    SolutionIndex: 2
    SolutionNameMin: Cijk_Alik_Bljk_HB_MT128x032x16_GSU05_LPB00_NLCA01_NLCB01_PGR1_PLR1_TT08_08_WG16_04_04_WGM64
    SolutionIndex: 3
    SolutionNameMin: Cijk_Alik_Bljk_HB_MT128x032x16_GSU01_LPB08_NLCA01_NLCB01_PGR0_PLR1_TT08_08_WG16_04_04_WGM01
    SolutionIndex: 4
    SolutionNameMin: Cijk_Alik_Bljk_HB_MT128x032x16_GSU05_LPB08_NLCA01_NLCB01_PGR1_PLR1_TT08_08_WG16_04_04_WGM01
    SolutionIndex: 5
    SolutionNameMin: Cijk_Alik_Bljk_HB_MT128x032x16_GSU05_LPB08_NLCA01_NLCB01_PGR1_PLR1_TT08_08_WG16_04_04_WGM08
- - - [2560, 7000, 1, 2560]
    - [24, 17587.0]
  - - [7680, 12000, 1, 2560]
    - [22, 19218.7]
  - - [5124, 9124, 1, 1760]
    - [22, 20034.4]
  - - [1760, 32, 1, 1760]
    - [13, 3000.23]
  - - [512, 24000, 1, 1536]
    - [22, 19387.8]
  - - [3072, 24000, 1, 1024]
    - [22, 17725.7]
  - - [2048, 400, 1, 512]
    - [22, 9073.87]
  - - [2560, 128, 1, 2560]
    - [3, 7135.57]
  - - [3072, 16, 1, 1024]
    - [11, 1213.29]
  - - [512, 48000, 1, 2816]
    - [22, 20216.1]
  - - [512, 48000, 1, 2048]
    - [24, 15071.1]
  - - [1760, 64, 1, 1760]
    - [13, 4992.92]
  - - [2048, 1600, 1, 2048]
    - [23, 9941.11]
  - - [512, 48000, 1, 1536]
    - [22, 19662.3]
  - - [2560, 32, 1, 2560]
    - [13, 3473.69]
  - - [8448, 5984, 1, 2816]
    - [22, 20308.4]
  - - [4096, 3200, 1, 1024]
    - [24, 16494.0]
  - - [1024, 24000, 1, 2560]
    - [22, 18382.6]
  - - [1760, 6400, 1, 1760]
    - [19, 22170.7]
  - - [5124, 9124, 1, 2048]
    - [24, 15759.3]
  - - [1024, 700, 1, 512]
    - [23, 9107.19]
  - - [4608, 32, 1, 1536]
    - [14, 4104.05]
  - - [3072, 64, 1, 1024]
    - [15, 3585.51]
  - - [16384, 3200, 1, 4096]
    - [24, 15036.8]
  - - [2560, 16, 1, 2560]
    - [10, 1925.88]
  - - [1024, 48000, 1, 2560]
    - [22, 18732.9]
  - - [8448, 48000, 1, 2816]
    - [22, 19510.8]
  - - [2048, 32, 1, 2048]
    - [10, 1709.31]
  - - [2560, 3200, 1, 2560]
    - [24, 17952.1]
  - - [16384, 800, 1, 4096]
    - [24, 13277.4]
  - - [4608, 24000, 1, 1536]
    - [22, 19775.3]
  - - [7680, 48000, 1, 2560]
    - [22, 19127.4]
  - - [3072, 48000, 1, 1024]
    - [22, 18587.7]
  - - [1760, 16, 1, 1760]
    - [13, 1541.6]
  - - [8192, 3200, 1, 2048]
    - [24, 15109.6]
  - - [512, 24000, 1, 2816]
    - [22, 20680.1]
  - - [4096, 400, 1, 1024]
    - [24, 10568.5]
  - - [6144, 48000, 1, 2560]
    - [24, 17391.1]
  - - [4608, 48000, 1, 1536]
    - [22, 19613.4]
  - - [4096, 128, 1, 4096]
    - [16, 5149.19]
  - - [2048, 800, 1, 512]
    - [22, 12098.5]
  - - [4608, 5984, 1, 1536]
    - [22, 19814.2]
  - - [4096, 1600, 1, 1024]
    - [24, 14800.4]
  - - [6144, 5984, 1, 2048]
    - [24, 15716.1]
  - - [7680, 24000, 1, 2560]
    - [22, 19141.5]
  - - [6144, 48000, 1, 2048]
    - [24, 16986.5]
  - - [2048, 3200, 1, 2048]
    - [24, 11317.1]
  - - [5124, 9124, 1, 2560]
    - [22, 18703.1]
  - - [1024, 24000, 1, 1536]
    - [22, 19644.1]
  - - [7680, 16, 1, 2560]
    - [2, 2761.09]
  - - [2560, 6400, 1, 2560]
    - [22, 18785.3]
  - - [2048, 128, 1, 2048]
    - [7, 3566.67]
  - - [512, 16, 1, 500000]
    - [0, 494.72]
  - - [1024, 8, 1, 500000]
    - [0, 494.627]
  - - [512, 24000, 1, 2560]
    - [24, 18685.9]
  - - [1024, 24000, 1, 2816]
    - [22, 20545.0]
  - - [7680, 5984, 1, 2560]
    - [22, 19278.2]
  - - [2048, 1600, 1, 512]
    - [24, 12927.1]
  - - [2048, 7000, 1, 2048]
    - [24, 13482.5]
  - - [1760, 800, 1, 1760]
    - [21, 15408.9]
  - - [4096, 64, 1, 4096]
    - [5, 4338.5]
  - - [7680, 32, 1, 2560]
    - [9, 4752.73]
  - - [2560, 64, 1, 2560]
    - [14, 5910.3]
  - - [3072, 128, 1, 1024]
    - [17, 5947.04]
  - - [7680, 64, 1, 2560]
    - [14, 7679.13]
  - - [1760, 128, 1, 1760]
    - [12, 8221.9]
  - - [2560, 1600, 1, 2560]
    - [24, 15030.0]
  - - [2048, 3200, 1, 512]
    - [24, 15533.8]
  - - [2560, 800, 1, 2560]
    - [22, 13913.1]
  - - [3072, 32, 1, 1024]
    - [4, 2342.94]
  - - [6144, 32, 1, 2560]
    - [14, 4572.34]
  - - [4608, 12000, 1, 1536]
    - [22, 19762.4]
  - - [4096, 32, 1, 4096]
    - [18, 2432.04]
  - - [6144, 24000, 1, 2048]
    - [24, 16911.1]
  - - [8192, 800, 1, 2048]
    - [24, 12174.1]
  - - [5124, 9124, 1, 4096]
    - [24, 15951.1]
  - - [8448, 24000, 1, 2816]
    - [22, 19641.1]
  - - [1024, 48000, 1, 1536]
    - [22, 19757.6]
  - - [7680, 128, 1, 2560]
    - [8, 11116.7]
  - - [8192, 1600, 1, 2048]
    - [24, 13333.8]
  - - [4096, 800, 1, 1024]
    - [24, 12727.4]
  - - [1024, 16, 1, 500000]
    - [0, 988.432]
  - - [2048, 800, 1, 2048]
    - [23, 8392.94]
  - - [1760, 3200, 1, 1760]
    - [19, 20888.4]
  - - [512, 48000, 1, 2560]
    - [22, 19957.1]
  - - [8448, 16, 1, 2816]
    - [11, 3531.51]
  - - [2048, 64, 1, 2048]
    - [15, 2546.55]
  - - [512, 24000, 1, 2048]
    - [24, 13313.7]
  - - [16384, 1600, 1, 4096]
    - [24, 14488.0]
  - - [4608, 16, 1, 1536]
    - [10, 2359.2]
  - - [1024, 24000, 1, 2048]
    - [24, 15166.0]
  - - [8192, 400, 1, 2048]
    - [23, 9262.18]
  - - [2048, 6400, 1, 2048]
    - [24, 14199.6]
  - - [6144, 12000, 1, 2048]
    - [24, 16506.7]
  - - [512, 8, 1, 500000]
    - [0, 247.084]
  - - [1760, 7000, 1, 1760]
    - [19, 21140.5]
  - - [1024, 48000, 1, 2816]
    - [22, 20246.3]
  - - [6144, 16, 1, 2560]
    - [4, 2645.83]
  - - [8448, 32, 1, 2816]
    - [1, 6146.33]
  - - [4096, 7000, 1, 4096]
    - [24, 15639.0]
  - - [4096, 16, 1, 4096]
    - [6, 1475.46]
  - - [6144, 24000, 1, 2560]
    - [22, 18446.9]
  - - [1024, 1024, 1, 1024]
    - [24, 10697.4]
  - - [2048, 16, 1, 2048]
    - [6, 906.846]
  - - [8448, 12000, 1, 2816]
    - [22, 19926.2]
  - - [16384, 400, 1, 4096]
    - [24, 10729.7]
  - - [1760, 1600, 1, 1760]
    - [22, 19115.9]
  - - [1024, 48000, 1, 2048]
    - [24, 16138.8]
  - - [512, 128, 1, 784]
    - [30, 3366.99]
  - - [1024, 256, 1, 196]
    - [32, 4989.82]
  - - [256, 64, 1, 3136]
    - [34, 2259.27]
  - - [256, 1024, 1, 196]
    - [32, 4816.52]
  - - [64, 256, 1, 3136]
    - [33, 2425.14]
  - - [128, 512, 1, 784]
    - [29, 3196.38]
  - - [64, 64, 1, 3136]
    - [31, 583.84]
- - - -1
    - - - 1
        - - - 32
            - - [32, 27]
              - [704, 28]
              - [-1, 27]
          - - 64
            - - [64, 28]
              - [1408, 27]
              - [1856, 28]
              - [2368, 27]
              - [2944, 28]
              - [5888, 27]
              - [-1, 28]
          - - 128
            - - [32, 27]
              - [64, 28]
              - [1856, 27]
              - [2944, 28]
              - [5888, 27]
              - [-1, 28]
          - - 256
            - - [32, 28]
              - [1024, 27]
              - [1856, 28]
              - [2368, 27]
              - [2944, 28]
              - [4288, 27]
              - [5056, 28]
              - [-1, 27]
          - - 448
            - - [64, 28]
              - [-1, 27]
          - - 704
            - - [704, 27]
              - [1024, 28]
              - [-1, 27]
          - - 1024
            - - [448, 27]
              - [704, 28]
              - [-1, 27]
          - - 1408
            - - [32, 27]
              - [64, 28]
              - [128, 27]
              - [256, 28]
              - [448, 27]
              - [704, 28]
              - [-1, 27]
          - - 1856
            - - [32, 27]
              - [64, 28]
              - [128, 27]
              - [448, 28]
              - [-1, 27]
          - - 2368
            - - [128, 27]
              - [256, 28]
              - [448, 27]
              - [704, 28]
              - [5056, 27]
              - [5888, 28]
              - [-1, 27]
          - - 2944
            - - [32, 28]
              - [64, 27]
              - [128, 28]
              - [-1, 27]
          - - 3584
            - - [64, 27]
              - [256, 28]
              - [-1, 27]
          - - 4288
            - - [64, 28]
              - [-1, 27]
          - - 5056
            - - [32, 28]
              - [128, 27]
              - [256, 28]
              - [-1, 27]
          - - -1
            - - [-1, 27]
      - - 32
        - - - 128
            - - [-1, 26]
          - - 256
            - - [5056, 26]
              - [-1, 25]
          - - 448
            - - [1856, 26]
              - [2368, 25]
              - [2944, 26]
              - [4288, 25]
              - [5888, 26]
              - [-1, 25]
          - - 704
            - - [1408, 26]
              - [2944, 25]
              - [3584, 26]
              - [-1, 25]
          - - 1024
            - - [1024, 26]
              - [-1, 25]
          - - 1408
            - - [704, 26]
              - [1408, 25]
              - [1856, 26]
              - [-1, 25]
          - - 2368
            - - [448, 26]
              - [-1, 25]
          - - 2944
            - - [128, 26]
              - [-1, 25]
          - - 3584
            - - [256, 26]
              - [448, 25]
              - [704, 26]
              - [-1, 25]
          - - 4288
            - - [704, 26]
              - [-1, 25]
          - - 5056
            - - [256, 26]
              - [-1, 25]
          - - 5888
            - - [32, 26]
              - [64, 25]
              - [128, 26]
              - [-1, 25]
          - - -1
            - - [64, 26]
              - [-1, 25]
      - - 256
        - - - 1
            - - [-1, 28]
          - - 32
            - - [-1, 26]
          - - 64
            - - [1, 28]
              - [32, 26]
              - [1408, 0]
              - [2368, 10]
              - [3584, 1]
              - [5056, 3]
              - [5888, 1]
              - [-1, 20]
          - - 128
            - - [1, 28]
              - [32, 26]
              - [256, 0]
              - [448, 10]
              - [704, 0]
              - [1024, 10]
              - [1856, 1]
              - [2368, 3]
              - [5888, 20]
              - [-1, 21]
          - - 256
            - - [1, 28]
              - [32, 26]
              - [448, 0]
              - [704, 9]
              - [2944, 20]
              - [3584, 21]
              - [4288, 20]
              - [5888, 21]
              - [-1, 22]
          - - 448
            - - [1, 28]
              - [32, 26]
              - [128, 0]
              - [256, 13]
              - [1408, 20]
              - [3584, 21]
              - [4288, 20]
              - [-1, 22]
          - - 704
            - - [1, 28]
              - [32, 26]
              - [64, 0]
              - [128, 2]
              - [256, 9]
              - [1408, 20]
              - [2368, 21]
              - [2944, 20]
              - [3584, 22]
              - [4288, 21]
              - [-1, 22]
          - - 1024
            - - [1, 28]
              - [32, 26]
              - [128, 0]
              - [704, 20]
              - [1408, 21]
              - [1856, 22]
              - [2368, 21]
              - [3584, 22]
              - [4288, 21]
              - [-1, 22]
          - - 1408
            - - [1, 28]
              - [32, 26]
              - [64, 2]
              - [128, 1]
              - [448, 20]
              - [1024, 21]
              - [-1, 22]
          - - 1856
            - - [1, 28]
              - [32, 26]
              - [64, 13]
              - [256, 20]
              - [448, 21]
              - [704, 20]
              - [1024, 21]
              - [-1, 22]
          - - 2368
            - - [1, 28]
              - [32, 26]
              - [64, 13]
              - [128, 3]
              - [256, 20]
              - [448, 21]
              - [704, 22]
              - [1024, 21]
              - [-1, 22]
          - - 2944
            - - [1, 28]
              - [32, 26]
              - [64, 1]
              - [256, 20]
              - [704, 21]
              - [-1, 22]
          - - 3584
            - - [1, 28]
              - [32, 26]
              - [128, 20]
              - [448, 21]
              - [1408, 22]
              - [1856, 21]
              - [-1, 22]
          - - 4288
            - - [1, 28]
              - [32, 26]
              - [64, 3]
              - [256, 20]
              - [1024, 21]
              - [-1, 22]
          - - 5056
            - - [1, 28]
              - [32, 26]
              - [256, 20]
              - [448, 21]
              - [-1, 22]
          - - 5888
            - - [1, 28]
              - [32, 26]
              - [128, 20]
              - [256, 21]
              - [448, 22]
              - [704, 21]
              - [-1, 22]
          - - -1
            - - [1, 28]
              - [32, 26]
              - [64, 20]
              - [128, 21]
              - [256, 22]
              - [448, 21]
              - [-1, 22]
      - - 1280
        - - - 1
            - - [-1, 28]
          - - 32
            - - [-1, 26]
          - - 64
            - - [1, 28]
              - [32, 26]
              - [64, 0]
              - [128, 10]
              - [256, 13]
              - [1856, 10]
              - [2944, 12]
              - [3584, 14]
              - [4288, 12]
              - [5888, 3]
              - [-1, 20]
          - - 128
            - - [1, 28]
              - [32, 26]
              - [64, 10]
              - [256, 13]
              - [704, 10]
              - [1024, 13]
              - [1408, 1]
              - [1856, 12]
              - [2368, 3]
              - [5888, 20]
              - [-1, 21]
          - - 256
            - - [1, 28]
              - [32, 26]
              - [64, 13]
              - [128, 10]
              - [256, 13]
              - [448, 10]
              - [704, 14]
              - [2944, 20]
              - [3584, 21]
              - [5056, 20]
              - [5888, 21]
              - [-1, 22]
          - - 448
            - - [1, 28]
              - [32, 26]
              - [128, 10]
              - [256, 13]
              - [1408, 20]
              - [2944, 21]
              - [3584, 22]
              - [4288, 20]
              - [5056, 21]
              - [5888, 22]
              - [-1, 21]
          - - 704
            - - [1, 28]
              - [32, 26]
              - [64, 10]
              - [128, 13]
              - [256, 14]
              - [1856, 20]
              - [2368, 22]
              - [2944, 20]
              - [-1, 22]
          - - 1024
            - - [1, 28]
              - [32, 26]
              - [128, 10]
              - [256, 9]
              - [704, 20]
              - [1024, 22]
              - [1408, 21]
              - [1856, 22]
              - [2368, 21]
              - [-1, 22]
          - - 1408
            - - [1, 28]
              - [32, 26]
              - [64, 13]
              - [128, 14]
              - [448, 20]
              - [1856, 21]
              - [-1, 22]
          - - 1856
            - - [1, 28]
              - [32, 26]
              - [64, 13]
              - [128, 14]
              - [256, 20]
              - [448, 21]
              - [704, 20]
              - [-1, 22]
          - - 2368
            - - [1, 28]
              - [32, 26]
              - [128, 14]
              - [448, 20]
              - [704, 22]
              - [1024, 21]
              - [-1, 22]
          - - 2944
            - - [1, 28]
              - [32, 26]
              - [64, 1]
              - [256, 20]
              - [704, 21]
              - [-1, 22]
          - - 3584
            - - [1, 28]
              - [32, 26]
              - [64, 14]
              - [128, 20]
              - [256, 21]
              - [448, 22]
              - [704, 21]
              - [-1, 22]
          - - 4288
            - - [1, 28]
              - [32, 26]
              - [64, 1]
              - [256, 20]
              - [704, 21]
              - [-1, 22]
          - - 5056
            - - [1, 28]
              - [32, 26]
              - [64, 9]
              - [256, 20]
              - [448, 21]
              - [-1, 22]
          - - 5888
            - - [1, 28]
              - [32, 26]
              - [64, 3]
              - [128, 20]
              - [256, 21]
              - [448, 22]
              - [704, 21]
              - [-1, 22]
          - - -1
            - - [1, 28]
              - [32, 26]
              - [64, 20]
              - [128, 21]
              - [256, 22]
              - [448, 21]
              - [-1, 22]
      - - -1
        - - - 1
            - - [-1, 28]
          - - 32
            - - [-1, 26]
          - - 64
            - - [1, 28]
              - [32, 26]
              - [448, 10]
              - [704, 13]
              - [1856, 10]
              - [2368, 12]
              - [3584, 14]
              - [4288, 12]
              - [5056, 14]
              - [5888, 3]
              - [-1, 20]
          - - 128
            - - [1, 28]
              - [32, 26]
              - [128, 10]
              - [256, 13]
              - [704, 10]
              - [1024, 13]
              - [2368, 12]
              - [2944, 3]
              - [5888, 20]
              - [-1, 21]
          - - 256
            - - [1, 28]
              - [32, 26]
              - [128, 10]
              - [256, 13]
              - [448, 10]
              - [1408, 14]
              - [2944, 20]
              - [3584, 22]
              - [5056, 20]
              - [5888, 21]
              - [-1, 22]
          - - 448
            - - [1, 28]
              - [32, 26]
              - [64, 10]
              - [256, 13]
              - [1408, 20]
              - [1856, 22]
              - [2368, 20]
              - [2944, 21]
              - [3584, 22]
              - [4288, 20]
              - [5056, 21]
              - [-1, 22]
          - - 704
            - - [1, 28]
              - [32, 26]
              - [64, 10]
              - [128, 13]
              - [448, 14]
              - [1856, 20]
              - [2368, 22]
              - [2944, 20]
              - [-1, 22]
          - - 1024
            - - [1, 28]
              - [32, 26]
              - [64, 13]
              - [128, 10]
              - [256, 14]
              - [448, 21]
              - [704, 20]
              - [1024, 22]
              - [1408, 21]
              - [1856, 22]
              - [2368, 21]
              - [-1, 22]
          - - 1408
            - - [1, 28]
              - [32, 26]
              - [64, 13]
              - [256, 14]
              - [448, 20]
              - [1024, 21]
              - [1408, 22]
              - [1856, 21]
              - [-1, 22]
          - - 1856
            - - [1, 28]
              - [32, 26]
              - [64, 13]
              - [128, 14]
              - [256, 20]
              - [448, 22]
              - [704, 20]
              - [-1, 22]
          - - 2368
            - - [1, 28]
              - [32, 26]
              - [64, 12]
              - [128, 3]
              - [448, 20]
              - [-1, 22]
          - - 2944
            - - [1, 28]
              - [32, 26]
              - [64, 12]
              - [128, 14]
              - [256, 20]
              - [704, 21]
              - [-1, 22]
          - - 3584
            - - [1, 28]
              - [32, 26]
              - [64, 1]
              - [128, 20]
              - [448, 22]
              - [704, 21]
              - [-1, 22]
          - - 4288
            - - [1, 28]
              - [32, 26]
              - [64, 14]
              - [256, 20]
              - [704, 21]
              - [-1, 22]
          - - 5056
            - - [1, 28]
              - [32, 26]
              - [64, 14]
              - [256, 20]
              - [448, 21]
              - [-1, 22]
          - - 5888
            - - [1, 28]
              - [32, 26]
              - [64, 3]
              - [128, 20]
              - [256, 21]
              - [448, 22]
              - [704, 21]
              - [-1, 22]
          - - -1
            - - [1, 28]
              - [32, 26]
              - [64, 20]
              - [128, 21]
              - [256, 22]
              - [448, 21]
              - [-1, 22]
