library/src/blas3/Tensile/Logic/asm_full/vega20_Cijk_Ailk_Bjlk_DB.yaml
- {MinimumRequiredVersion: 4.2.0}
- vega20
- gfx906
- [Device 66a0, Device 66a7]
    SolutionIndex: 0
    SolutionNameMin: Cijk_Ailk_Bjlk_DB_MT064x064x08_NLCA01_NLCB01_PBC0_TT04_04_USFGRO00_WG16_16_01
    SolutionIndex: 1
    SolutionNameMin: Cijk_Ailk_Bjlk_DB_MT064x064x08_NLCA01_NLCB01_PBC0_TT04_04_USFGRO00_WG16_16_01
    SolutionIndex: 2
    SolutionNameMin: Cijk_Ailk_Bjlk_DB_MT064x064x04_NLCA01_NLCB01_PBC0_TT04_04_USFGRO00_WG16_16_01
    SolutionIndex: 3
    SolutionNameMin: Cijk_Ailk_Bjlk_DB_MT064x032x08_NLCA01_NLCB01_PBC0_TT04_04_USFGRO00_WG16_08_01
- - - [6144, 6144, 1, 384]
    - [1, 4244.5]
  - - [6912, 6912, 1, 384]
    - [1, 4308.55]
  - - [10368, 10368, 1, 384]
    - [1, 4337.46]
  - - [3072, 3072, 1, 384]
    - [1, 4150.44]
  - - [5760, 5760, 1, 5760]
    - [1, 4413.64]
  - - [15360, 15360, 1, 384]
    - [1, 4277.22]
  - - [4224, 4224, 1, 384]
    - [1, 4289.14]
  - - [11136, 11136, 1, 384]
    - [1, 4335.02]
  - - [14592, 14592, 1, 384]
    - [1, 4327.21]
  - - [2688, 2688, 1, 384]
    - [1, 4235.09]
  - - [15744, 15744, 1, 384]
    - [1, 4338.74]
  - - [16128, 16128, 1, 384]
    - [1, 4328.43]
  - - [14208, 14208, 1, 384]
    - [1, 4338.73]
  - - [15396, 15396, 1, 400]
    - [1, 4327.82]
  - - [13824, 13824, 1, 384]
    - [1, 4272.33]
  - - [2304, 2304, 1, 384]
    - [1, 4121.32]
  - - [9600, 9600, 1, 384]
    - [1, 4328.67]
  - - [1060, 1060, 1, 400]
    - [1, 3460.37]
  - - [4132, 4132, 1, 400]
    - [1, 4228.76]
  - - [3840, 3840, 1, 384]
    - [1, 4267.59]
  - - [10752, 10752, 1, 384]
    - [1, 4272.41]
  - - [8228, 8228, 1, 400]
    - [1, 4306.77]
  - - [8832, 8832, 1, 384]
    - [1, 4332.63]
  - - [7744, 7744, 1, 7744]
    - [1, 4426.6]
  - - [14372, 14372, 1, 400]
    - [1, 4325.72]
  - - [6528, 6528, 1, 384]
    - [1, 4323.48]
  - - [11520, 11520, 1, 384]
    - [1, 4322.74]
  - - [4992, 4992, 1, 384]
    - [1, 4311.06]
  - - [8064, 8064, 1, 384]
    - [1, 4331.6]
  - - [6180, 6180, 1, 400]
    - [1, 4270.3]
  - - [1152, 1152, 1, 384]
    - [1, 3452.58]
  - - [3108, 3108, 1, 400]
    - [1, 4194.33]
  - - [384, 384, 1, 384]
    - [1, 1595.89]
  - - [4608, 4608, 1, 384]
    - [1, 4229.4]
  - - [7680, 7680, 1, 384]
    - [1, 4263.12]
  - - [9252, 9252, 1, 400]
    - [1, 4311.69]
  - - [2084, 2084, 1, 400]
    - [1, 3937.08]
  - - [9216, 9216, 1, 384]
    - [1, 4265.83]
  - - [12672, 12672, 1, 384]
    - [1, 4339.05]
  - - [12288, 12288, 1, 384]
    - [1, 4255.61]
  - - [7296, 7296, 1, 384]
    - [1, 4324.53]
  - - [13348, 13348, 1, 400]
    - [1, 4322.3]
  - - [9984, 9984, 1, 384]
    - [1, 4318.67]
  - - [768, 768, 1, 384]
    - [1, 2878.62]
  - - [10276, 10276, 1, 400]
    - [1, 4316.37]
  - - [8448, 8448, 1, 384]
    - [1, 4313.77]
  - - [11904, 11904, 1, 384]
    - [1, 4336.25]
  - - [7204, 7204, 1, 400]
    - [1, 4300.91]
  - - [5376, 5376, 1, 384]
    - [1, 4282.95]
  - - [1920, 1920, 1, 384]
    - [1, 3997.85]
  - - [13440, 13440, 1, 384]
    - [1, 4339.76]
  - - [11300, 11300, 1, 400]
    - [1, 4317.56]
  - - [5760, 5760, 1, 384]
    - [1, 4312.05]
  - - [1536, 1536, 1, 384]
    - [1, 3748.58]
  - - [13056, 13056, 1, 384]
    - [1, 4325.13]
  - - [12324, 12324, 1, 400]
    - [1, 4318.7]
  - - [5156, 5156, 1, 400]
    - [1, 4252.75]
  - - [36, 36, 1, 400]
    - [3, 14.8622]
  - - [3456, 3456, 1, 384]
    - [1, 4288.61]
  - - [14976, 14976, 1, 384]
    - [1, 4339.66]
- - - -1
    - - - -1
        - - - 1
            - - [-1, 2]
          - - -1
            - - [1, 2]
              - [-1, 0]
