library/src/blas3/Tensile/Logic/asm_full/vega20_Cijk_Ailk_Bljk_HBH.yaml
- {MinimumRequiredVersion: 4.6.0}
- vega20
- gfx906
- [Device 66a0, Device 66a1, Device 66a7]
    SolutionIndex: 0
    SolutionNameMin: Cijk_Ailk_Bljk_HBH_MT032x016x08_PGR1_PLR1_TT02_02
    SolutionIndex: 1
    SolutionNameMin: Cijk_Ailk_Bljk_HBH_MT064x016x08_PGR1_PLR1_TT04_02
    SolutionIndex: 2
    SolutionNameMin: Cijk_Ailk_Bljk_HBH_MT128x032x08_PGR1_PLR1_TT04_04
    SolutionIndex: 3
    SolutionNameMin: Cijk_Ailk_Bljk_HBH_MT016x016x16_PGR1_PLR1_TT02_02
    SolutionIndex: 4
    SolutionNameMin: Cijk_Ailk_Bljk_HBH_MT032x008x16_PGR1_PLR1_TT02_02
    SolutionIndex: 5
    SolutionNameMin: Cijk_Ailk_Bljk_HBH_MT032x016x16_PGR1_PLR1_TT02_02
    SolutionIndex: 6
    SolutionNameMin: Cijk_Ailk_Bljk_HBH_MT064x016x16_PGR1_PLR1_TT04_02
    SolutionIndex: 7
    SolutionNameMin: Cijk_Ailk_Bljk_HBH_MT064x064x16_PGR1_PLR1_TT04_04
    SolutionIndex: 8
    SolutionNameMin: Cijk_Ailk_Bljk_HBH_MT064x016x16_PGR1_PLR1_TT02_02
    SolutionIndex: 9
    SolutionNameMin: Cijk_Ailk_Bljk_HBH_MT128x016x16_PGR1_PLR1_TT04_02
    SolutionIndex: 10
    SolutionNameMin: Cijk_Ailk_Bljk_HBH_MT128x032x16_PGR1_PLR1_TT04_04
    SolutionIndex: 11
    SolutionNameMin: Cijk_Ailk_Bljk_HBH_MT016x016x32_PGR1_PLR1_TT02_02
    SolutionIndex: 12
    SolutionNameMin: Cijk_Ailk_Bljk_HBH_MT032x008x32_PGR1_PLR1_TT02_02
    SolutionIndex: 13
    SolutionNameMin: Cijk_Ailk_Bljk_HBH_MT064x008x32_PGR1_PLR1_TT02_02
    SolutionIndex: 14
    SolutionNameMin: Cijk_Ailk_Bljk_HBH_MT064x016x32_PGR1_PLR1_TT02_02
    SolutionIndex: 15
    SolutionNameMin: Cijk_Ailk_Bljk_HBH_MT128x016x32_PGR1_PLR1_TT04_02
    SolutionIndex: 16
    SolutionNameMin: Cijk_Ailk_Bljk_HBH_MT032x008x64_PGR1_PLR1_TT02_02
    SolutionIndex: 17
    SolutionNameMin: Cijk_Ailk_Bljk_HBH_MT064x032x08_PGR1_PLR1_TT08_04
    SolutionIndex: 18
    SolutionNameMin: Cijk_Ailk_Bljk_HBH_MT032x032x08_PGR1_PLR1_TT04_04
    SolutionIndex: 19
    SolutionNameMin: Cijk_Ailk_Bljk_HBH_MT064x032x08_PGR1_PLR1_TT08_04
    SolutionIndex: 20
    SolutionNameMin: Cijk_Ailk_Bljk_HBH_MT064x016x08_PGR1_PLR1_TT04_02
    SolutionIndex: 21
    SolutionNameMin: Cijk_Ailk_Bljk_HBH_MT032x032x16_PGR1_PLR1_TT04_04
    SolutionIndex: 22
    SolutionNameMin: Cijk_Ailk_Bljk_HBH_MT064x064x16_PGR1_PLR1_TT08_08
    SolutionIndex: 23
    SolutionNameMin: Cijk_Ailk_Bljk_HBH_MT032x016x16_PGR1_PLR1_TT02_02
    SolutionIndex: 24
    SolutionNameMin: Cijk_Ailk_Bljk_HBH_MT064x016x16_PGR1_PLR1_TT04_02
    SolutionIndex: 25
    SolutionNameMin: Cijk_Ailk_Bljk_HBH_MT064x016x16_PGR1_PLR1_TT02_02
    SolutionIndex: 26
    SolutionNameMin: Cijk_Ailk_Bljk_HBH_MT128x016x16_PGR1_PLR1_TT04_02
    SolutionIndex: 27
    SolutionNameMin: Cijk_Ailk_Bljk_HBH_MT128x032x16_PGR1_PLR1_TT04_04
    SolutionIndex: 28
    SolutionNameMin: Cijk_Ailk_Bljk_HBH_MT032x016x24_PGR1_PLR1_TT04_02
    SolutionIndex: 29
    SolutionNameMin: Cijk_Ailk_Bljk_HBH_MT016x016x24_PGR1_PLR1_TT02_02
    SolutionIndex: 30
    SolutionNameMin: Cijk_Ailk_Bljk_HBH_MT032x032x24_PGR1_PLR1_TT04_04
    SolutionIndex: 31
    SolutionNameMin: Cijk_Ailk_Bljk_HBH_MT016x016x32_PGR1_PLR1_TT02_02
    SolutionIndex: 32
    SolutionNameMin: Cijk_Ailk_Bljk_HBH_MT064x016x32_PGR1_PLR1_TT02_02
    SolutionIndex: 33
    SolutionNameMin: Cijk_Ailk_Bljk_HBH_MT128x016x32_PGR1_PLR1_TT04_02
    SolutionIndex: 34
    SolutionNameMin: Cijk_Ailk_Bljk_HBH_MT032x008x32_PGR1_PLR1_TT02_02
    SolutionIndex: 35
    SolutionNameMin: Cijk_Ailk_Bljk_HBH_MT064x008x32_PGR1_PLR1_TT02_02
    SolutionIndex: 36
    SolutionNameMin: Cijk_Ailk_Bljk_HBH_MT032x008x64_PGR1_PLR1_TT02_02
    SolutionIndex: 37
    SolutionNameMin: Cijk_Ailk_Bljk_HBH_MT064x064x08_PGR1_PLR1_TT04_04
    SolutionIndex: 38
    SolutionNameMin: Cijk_Ailk_Bljk_HBH_MT064x128x08_PGR1_PLR1_TT04_08
    SolutionIndex: 39
    SolutionNameMin: Cijk_Ailk_Bljk_HBH_MT128x064x08_PGR1_PLR1_TT08_04
    SolutionIndex: 40
    SolutionNameMin: Cijk_Ailk_Bljk_HBH_MT064x032x16_PGR0_PLR1_TT08_04
    SolutionIndex: 41
    SolutionNameMin: Cijk_Ailk_Bljk_HBH_MT064x064x16_PGR0_PLR1_TT04_04
    SolutionIndex: 42
    SolutionNameMin: Cijk_Ailk_Bljk_HBH_MT064x064x16_PGR1_PLR1_TT04_04
    SolutionIndex: 43
    SolutionNameMin: Cijk_Ailk_Bljk_HBH_MT128x064x16_PGR1_PLR1_TT08_04
    SolutionIndex: 44
    SolutionNameMin: Cijk_Ailk_Bljk_HBH_MT128x128x16_PGR1_PLR1_TT08_08
    SolutionIndex: 45
    SolutionNameMin: Cijk_Ailk_Bljk_HBH_MT064x064x32_PGR0_PLR1_TT08_08
    SolutionIndex: 46
    SolutionNameMin: Cijk_Ailk_Bljk_HBH_MT064x064x32_PGR1_PLR1_TT04_04
    SolutionIndex: 47
    SolutionNameMin: Cijk_Ailk_Bljk_HBH_MT128x064x32_PGR1_PLR1_TT08_04
    SolutionIndex: 48
    SolutionNameMin: Cijk_Ailk_Bljk_HBH_MT128x128x32_PGR0_PLR1_TT08_08
    SolutionIndex: 49
    SolutionNameMin: Cijk_Ailk_Bljk_HBH_MT128x128x32_PGR1_PLR1_TT08_08
    SolutionIndex: 50
    SolutionNameMin: Cijk_Ailk_Bljk_HBH_MT128x128x64_PGR0_PLR1_TT08_08
    SolutionIndex: 51
    SolutionNameMin: Cijk_Ailk_Bljk_HBH_MT064x128x08_PGR1_PLR1_TT04_08
    SolutionIndex: 52
    SolutionNameMin: Cijk_Ailk_Bljk_HBH_MT064x032x32_PGR1_PLR1_TT04_02
    SolutionIndex: 53
    SolutionNameMin: Cijk_Ailk_Bljk_HBH_MT064x064x08_PGR1_PLR1_TT04_04
    SolutionIndex: 54
    SolutionNameMin: Cijk_Ailk_Bljk_HBH_MT064x128x08_PGR1_PLR1_TT04_08
    SolutionIndex: 55
    SolutionNameMin: Cijk_Ailk_Bljk_HBH_MT064x064x16_PGR1_PLR1_TT04_04
    SolutionIndex: 56
    SolutionNameMin: Cijk_Ailk_Bljk_HBH_MT128x032x16_PGR1_PLR1_TT04_04
    SolutionIndex: 57
    SolutionNameMin: Cijk_Ailk_Bljk_HBH_MT064x064x16_PGR1_PLR0_TT04_04
    SolutionIndex: 58
    SolutionNameMin: Cijk_Ailk_Bljk_HBH_MT032x128x16_PGR0_PLR0_TT04_04
    SolutionIndex: 59
    SolutionNameMin: Cijk_Ailk_Bljk_HBH_MT128x032x16_PGR0_PLR0_TT04_04
    SolutionIndex: 60
    SolutionNameMin: Cijk_Ailk_Bljk_HBH_MT064x128x04_PGR0_PLR0_TT04_08
    SolutionIndex: 61
    SolutionNameMin: Cijk_Ailk_Bljk_HBH_MT064x064x04_PGR0_PLR0_TT04_04
    SolutionIndex: 62
    SolutionNameMin: Cijk_Ailk_Bljk_HBH_MT064x064x04_PGR1_PLR0_TT04_04
    SolutionIndex: 63
    SolutionNameMin: Cijk_Ailk_Bljk_HBH_MT064x064x04_PGR0_PLR1_TT04_04
    SolutionIndex: 64
    SolutionNameMin: Cijk_Ailk_Bljk_HBH_MT064x064x04_PGR1_PLR1_TT04_04
    SolutionIndex: 65
    SolutionNameMin: Cijk_Ailk_Bljk_HBH_MT064x064x08_PGR0_PLR0_TT04_04
    SolutionIndex: 66
    SolutionNameMin: Cijk_Ailk_Bljk_HBH_MT064x128x08_PGR1_PLR0_TT04_08
    SolutionIndex: 67
    SolutionNameMin: Cijk_Ailk_Bljk_HBH_MT064x064x08_PGR1_PLR0_TT04_04
    SolutionIndex: 68
    SolutionNameMin: Cijk_Ailk_Bljk_HBH_MT064x064x08_PGR0_PLR1_TT04_04
    SolutionIndex: 69
    SolutionNameMin: Cijk_Ailk_Bljk_HBH_MT064x128x08_PGR1_PLR1_TT04_08
    SolutionIndex: 70
    SolutionNameMin: Cijk_Ailk_Bljk_HBH_MT064x064x08_PGR1_PLR1_TT04_04
    SolutionIndex: 71
    SolutionNameMin: Cijk_Ailk_Bljk_HBH_MT128x128x16_PGR0_PLR0_TT08_08
    SolutionIndex: 72
    SolutionNameMin: Cijk_Ailk_Bljk_HBH_MT064x064x16_PGR0_PLR0_TT04_04
    SolutionIndex: 73
    SolutionNameMin: Cijk_Ailk_Bljk_HBH_MT064x064x16_PGR0_PLR1_TT04_04
    SolutionIndex: 74
    SolutionNameMin: Cijk_Ailk_Bljk_HBH_MT064x128x16_PGR1_PLR1_TT04_08
    SolutionIndex: 75
    SolutionNameMin: Cijk_Ailk_Bljk_HBH_MT064x064x16_PGR1_PLR1_TT04_04
    SolutionIndex: 76
    SolutionNameMin: Cijk_Ailk_Bljk_HBH_MT064x128x04_PGR0_PLR0_TT04_08
    SolutionIndex: 77
    SolutionNameMin: Cijk_Ailk_Bljk_HBH_MT064x064x04_PGR0_PLR0_TT04_04
    SolutionIndex: 78
    SolutionNameMin: Cijk_Ailk_Bljk_HBH_MT064x128x04_PGR1_PLR0_TT04_08
    SolutionIndex: 79
    SolutionNameMin: Cijk_Ailk_Bljk_HBH_MT064x064x04_PGR1_PLR0_TT04_04
    SolutionIndex: 80
    SolutionNameMin: Cijk_Ailk_Bljk_HBH_MT128x128x04_PGR0_PLR1_TT08_08
    SolutionIndex: 81
    SolutionNameMin: Cijk_Ailk_Bljk_HBH_MT064x128x04_PGR0_PLR1_TT04_08
    SolutionIndex: 82
    SolutionNameMin: Cijk_Ailk_Bljk_HBH_MT064x064x04_PGR0_PLR1_TT04_04
    SolutionIndex: 83
    SolutionNameMin: Cijk_Ailk_Bljk_HBH_MT128x128x04_PGR1_PLR1_TT08_08
    SolutionIndex: 84
    SolutionNameMin: Cijk_Ailk_Bljk_HBH_MT064x128x04_PGR1_PLR1_TT04_08
    SolutionIndex: 85
    SolutionNameMin: Cijk_Ailk_Bljk_HBH_MT064x064x04_PGR1_PLR1_TT04_04
    SolutionIndex: 86
    SolutionNameMin: Cijk_Ailk_Bljk_HBH_MT064x064x08_PGR0_PLR0_TT04_04
    SolutionIndex: 87
    SolutionNameMin: Cijk_Ailk_Bljk_HBH_MT064x128x08_PGR1_PLR0_TT04_08
    SolutionIndex: 88
    SolutionNameMin: Cijk_Ailk_Bljk_HBH_MT064x064x08_PGR1_PLR0_TT04_04
    SolutionIndex: 89
    SolutionNameMin: Cijk_Ailk_Bljk_HBH_MT128x128x08_PGR0_PLR1_TT08_08
    SolutionIndex: 90
    SolutionNameMin: Cijk_Ailk_Bljk_HBH_MT064x128x08_PGR0_PLR1_TT04_08
    SolutionIndex: 91
    SolutionNameMin: Cijk_Ailk_Bljk_HBH_MT064x064x08_PGR0_PLR1_TT04_04
    SolutionIndex: 92
    SolutionNameMin: Cijk_Ailk_Bljk_HBH_MT064x064x08_PGR1_PLR1_TT04_04
    SolutionIndex: 93
    SolutionNameMin: Cijk_Ailk_Bljk_HBH_MT064x064x16_PGR0_PLR0_TT04_04
    SolutionIndex: 94
    SolutionNameMin: Cijk_Ailk_Bljk_HBH_MT064x064x16_PGR0_PLR1_TT04_04
    SolutionIndex: 95
    SolutionNameMin: Cijk_Ailk_Bljk_HBH_MT128x128x16_PGR1_PLR1_TT08_08
    SolutionIndex: 96
    SolutionNameMin: Cijk_Ailk_Bljk_HBH_MT064x128x16_PGR1_PLR1_TT04_08
    SolutionIndex: 97
    SolutionNameMin: Cijk_Ailk_Bljk_HBH_MT064x064x16_PGR1_PLR1_TT04_04
    SolutionIndex: 0
    SolutionNameMin: Cijk_Ailk_Bljk_HBH_MT128x064x16_EPS1_GRVW08_LPB00_PGR1_PLR1_SNLL1_TT08_08_VW08_WG16_08_01_WGM01
    SolutionIndex: 1
    SolutionNameMin: Cijk_Ailk_Bljk_HBH_MT064x128x16_EPS1_GRVW04_LPB04_PGR1_PLR1_SNLL1_TT08_04_VW04_WG08_32_01_WGM01
    SolutionIndex: 2
    SolutionNameMin: Cijk_Ailk_Bljk_HBH_MT128x064x16_EPS1_GRVW04_LPB04_PGR1_PLR1_SNLL1_TT08_04_VW04_WG16_16_01_WGM01
    SolutionIndex: 3
    SolutionNameMin: Cijk_Ailk_Bljk_HBH_MT128x128x16_EPS1_GRVW04_LPB04_PGR1_PLR1_SNLL1_TT08_08_VW04_WG16_16_01_WGM01
    SolutionIndex: 4
    SolutionNameMin: Cijk_Ailk_Bljk_HBH_MT064x128x16_EPS1_GRVW04_LPB04_PGR1_PLR1_SNLL1_TT08_04_VW04_WG08_32_01_WGM08
    SolutionIndex: 5
    SolutionNameMin: Cijk_Ailk_Bljk_HBH_MT128x064x16_EPS1_GRVW04_LPB04_PGR1_PLR1_SNLL1_TT08_04_VW04_WG16_16_01_WGM08
    SolutionIndex: 6
    SolutionNameMin: Cijk_Ailk_Bljk_HBH_MT256x064x16_EPS1_GRVW04_LPB04_PGR1_PLR1_SNLL1_TT08_08_VW04_WG32_08_01_WGM64
    SolutionIndex: 7
    SolutionNameMin: Cijk_Ailk_Bljk_HBH_MT064x128x32_EPS0_GRVW04_LPB04_PGR0_PLR0_SNLL0_TT08_04_VW04_WG08_32_01_WGM01
    SolutionIndex: 8
    SolutionNameMin: Cijk_Ailk_Bljk_HBH_MT064x064x32_EPS0_GRVW04_LPB04_PGR0_PLR0_SNLL0_TT04_04_VW04_WG16_16_01_WGM01
    SolutionIndex: 9
    SolutionNameMin: Cijk_Ailk_Bljk_HBH_MT128x064x32_EPS1_GRVW04_LPB04_PGR1_PLR1_SNLL1_TT08_04_VW04_WG16_16_01_WGM01
    SolutionIndex: 10
    SolutionNameMin: Cijk_Ailk_Bljk_HBH_MT064x064x32_EPS0_GRVW04_LPB04_PGR0_PLR0_SNLL0_TT04_04_VW04_WG16_16_01_WGM08
    SolutionIndex: 11
    SolutionNameMin: Cijk_Ailk_Bljk_HBH_MT128x064x32_EPS0_GRVW08_LPB08_PGR0_PLR1_SNLL0_TT08_08_VW08_WG16_08_01_WGM01
    SolutionIndex: 0
    SolutionNameMin: Cijk_Ailk_Bljk_HBH_MT032x032x08_PGR0_PLR1_TT04_04
    SolutionIndex: 1
    SolutionNameMin: Cijk_Ailk_Bljk_HBH_MT032x032x16_PGR1_PLR1_TT04_04
    SolutionIndex: 2
    SolutionNameMin: Cijk_Ailk_Bljk_HBH_MT064x016x16_PGR1_PLR1_TT04_04
    SolutionIndex: 3
    SolutionNameMin: Cijk_Ailk_Bljk_HBH_MT064x032x16_PGR1_PLR1_TT04_04
    SolutionIndex: 4
    SolutionNameMin: Cijk_Ailk_Bljk_HBH_MT064x064x16_PGR1_PLR1_TT04_04
    SolutionIndex: 5
    SolutionNameMin: Cijk_Ailk_Bljk_HBH_MT032x032x32_PGR1_PLR1_TT04_04
    SolutionIndex: 6
    SolutionNameMin: Cijk_Ailk_Bljk_HBH_MT064x016x32_PGR1_PLR1_TT04_04
    SolutionIndex: 7
    SolutionNameMin: Cijk_Ailk_Bljk_HBH_MT064x032x32_PGR1_PLR1_TT04_04
    SolutionIndex: 8
    SolutionNameMin: Cijk_Ailk_Bljk_HBH_MT128x016x32_PGR1_PLR1_TT04_04
    SolutionIndex: 9
    SolutionNameMin: Cijk_Ailk_Bljk_HBH_MT128x032x32_PGR1_PLR1_TT04_04
    SolutionIndex: 10
    SolutionNameMin: Cijk_Ailk_Bljk_HBH_MT064x064x16_PGR1_PLR1_TT08_08
    SolutionIndex: 11
    SolutionNameMin: Cijk_Ailk_Bljk_HBH_MT128x128x16_PGR1_PLR1_TT08_08
    SolutionIndex: 12
    SolutionNameMin: Cijk_Ailk_Bljk_HBH_MT032x032x08_PGR1_PLR1_TT04_04
    SolutionIndex: 13
    SolutionNameMin: Cijk_Ailk_Bljk_HBH_MT064x032x08_PGR1_PLR1_TT08_04
    SolutionIndex: 14
    SolutionNameMin: Cijk_Ailk_Bljk_HBH_MT064x064x08_PGR1_PLR1_TT08_08
    SolutionIndex: 15
    SolutionNameMin: Cijk_Ailk_Bljk_HBH_MT128x128x08_PGR1_PLR1_TT08_08
    SolutionIndex: 16
    SolutionNameMin: Cijk_Ailk_Bljk_HBH_MT128x032x16_PGR1_PLR1_TT08_04
    SolutionIndex: 17
    SolutionNameMin: Cijk_Ailk_Bljk_HBH_MT032x032x16_PGR1_PLR1_TT04_04
    SolutionIndex: 18
    SolutionNameMin: Cijk_Ailk_Bljk_HBH_MT064x032x16_PGR1_PLR1_TT08_04
    SolutionIndex: 19
    SolutionNameMin: Cijk_Ailk_Bljk_HBH_MT064x064x16_PGR1_PLR1_TT04_04
    SolutionIndex: 20
    SolutionNameMin: Cijk_Ailk_Bljk_HBH_MT128x064x16_PGR1_PLR1_TT08_04
    SolutionIndex: 21
    SolutionNameMin: Cijk_Ailk_Bljk_HBH_MT128x128x16_PGR1_PLR1_TT08_08
    SolutionIndex: 22
    SolutionNameMin: Cijk_Ailk_Bljk_HBH_MT064x032x16_PGR1_PLR1_TT04_04
    SolutionIndex: 23
    SolutionNameMin: Cijk_Ailk_Bljk_HBH_MT128x032x16_PGR1_PLR1_TT08_04
    SolutionIndex: 24
    SolutionNameMin: Cijk_Ailk_Bljk_HBH_MT128x064x32_PGR1_PLR1_TT08_04
    SolutionIndex: 25
    SolutionNameMin: Cijk_Ailk_Bljk_HBH_MT128x032x32_PGR1_PLR1_TT04_04
    SolutionIndex: 26
    SolutionNameMin: Cijk_Ailk_Bljk_HBH_MT064x016x32_PGR1_PLR1_TT04_04
    SolutionIndex: 27
    SolutionNameMin: Cijk_Ailk_Bljk_HBH_MT064x064x16_PGR1_PLR1_TT08_08
    SolutionIndex: 28
    SolutionNameMin: Cijk_Ailk_Bljk_HBH_MT128x128x16_PGR1_PLR1_TT08_08
    SolutionIndex: 29
    SolutionNameMin: Cijk_Ailk_Bljk_HBH_MT064x064x32_PGR1_PLR1_TT08_08
    SolutionIndex: 30
    SolutionNameMin: Cijk_Ailk_Bljk_HBH_MT128x128x32_PGR1_PLR1_TT08_08
    SolutionIndex: 31
    SolutionNameMin: Cijk_Ailk_Bljk_HBH_MT064x032x16_PGR0_PLR1_TT08_04
    SolutionIndex: 32
    SolutionNameMin: Cijk_Ailk_Bljk_HBH_MT128x128x32_PGR0_PLR1_TT08_08
    SolutionIndex: 33
    SolutionNameMin: Cijk_Ailk_Bljk_HBH_MT064x128x16_PGR1_PLR1_TT04_08
    SolutionIndex: 34
    SolutionNameMin: Cijk_Ailk_Bljk_HBH_MT128x064x16_PGR1_PLR1_TT08_04
    SolutionIndex: 35
    SolutionNameMin: Cijk_Ailk_Bljk_HBH_MT128x128x16_PGR1_PLR1_TT08_08
    SolutionIndex: 36
    SolutionNameMin: Cijk_Ailk_Bljk_HBH_MT128x064x16_PGR1_PLR1_TT04_08
    SolutionIndex: 37
    SolutionNameMin: Cijk_Ailk_Bljk_HBH_MT128x064x16_PGR1_PLR1_TT04_08
    SolutionIndex: 38
    SolutionNameMin: Cijk_Ailk_Bljk_HBH_MT128x064x32_PGR1_PLR1_TT04_04
    SolutionIndex: 39
    SolutionNameMin: Cijk_Ailk_Bljk_HBH_MT256x128x32_PGR1_PLR1_TT08_08
    SolutionIndex: 40
    SolutionNameMin: Cijk_Ailk_Bljk_HBH_MT128x032x16_PGR0_PLR0_TT08_04
    SolutionIndex: 41
    SolutionNameMin: Cijk_Ailk_Bljk_HBH_MT064x128x16_PGR1_PLR0_TT04_08
    SolutionIndex: 42
    SolutionNameMin: Cijk_Ailk_Bljk_HBH_MT128x064x16_PGR1_PLR0_TT08_04
    SolutionIndex: 43
    SolutionNameMin: Cijk_Ailk_Bljk_HBH_MT128x064x16_PGR1_PLR0_TT04_08
    SolutionIndex: 44
    SolutionNameMin: Cijk_Ailk_Bljk_HBH_MT064x128x04_PGR0_PLR0_TT04_08
    SolutionIndex: 45
    SolutionNameMin: Cijk_Ailk_Bljk_HBH_MT064x064x04_PGR0_PLR0_TT04_04
    SolutionIndex: 46
    SolutionNameMin: Cijk_Ailk_Bljk_HBH_MT064x064x04_PGR1_PLR0_TT04_04
    SolutionIndex: 47
    SolutionNameMin: Cijk_Ailk_Bljk_HBH_MT064x064x04_PGR0_PLR1_TT04_04
    SolutionIndex: 48
    SolutionNameMin: Cijk_Ailk_Bljk_HBH_MT064x064x04_PGR1_PLR1_TT04_04
    SolutionIndex: 49
    SolutionNameMin: Cijk_Ailk_Bljk_HBH_MT064x128x08_PGR0_PLR0_TT04_08
    SolutionIndex: 50
    SolutionNameMin: Cijk_Ailk_Bljk_HBH_MT064x064x08_PGR0_PLR0_TT04_04
    SolutionIndex: 51
    SolutionNameMin: Cijk_Ailk_Bljk_HBH_MT064x128x08_PGR1_PLR0_TT04_08
    SolutionIndex: 52
    SolutionNameMin: Cijk_Ailk_Bljk_HBH_MT064x064x08_PGR1_PLR0_TT04_04
    SolutionIndex: 53
    SolutionNameMin: Cijk_Ailk_Bljk_HBH_MT064x128x08_PGR0_PLR1_TT04_08
    SolutionIndex: 54
    SolutionNameMin: Cijk_Ailk_Bljk_HBH_MT064x064x08_PGR0_PLR1_TT04_04
    SolutionIndex: 55
    SolutionNameMin: Cijk_Ailk_Bljk_HBH_MT064x064x08_PGR1_PLR1_TT04_04
    SolutionIndex: 56
    SolutionNameMin: Cijk_Ailk_Bljk_HBH_MT128x128x16_PGR0_PLR0_TT08_08
    SolutionIndex: 57
    SolutionNameMin: Cijk_Ailk_Bljk_HBH_MT064x128x16_PGR0_PLR0_TT04_08
    SolutionIndex: 58
    SolutionNameMin: Cijk_Ailk_Bljk_HBH_MT064x064x16_PGR1_PLR0_TT04_04
    SolutionIndex: 59
    SolutionNameMin: Cijk_Ailk_Bljk_HBH_MT064x064x16_PGR0_PLR1_TT04_04
    SolutionIndex: 60
    SolutionNameMin: Cijk_Ailk_Bljk_HBH_MT064x064x16_PGR1_PLR1_TT04_04
    SolutionIndex: 61
    SolutionNameMin: Cijk_Ailk_Bljk_HBH_MT128x128x04_PGR0_PLR0_TT08_08
    SolutionIndex: 62
    SolutionNameMin: Cijk_Ailk_Bljk_HBH_MT064x128x04_PGR0_PLR0_TT04_08
    SolutionIndex: 63
    SolutionNameMin: Cijk_Ailk_Bljk_HBH_MT064x064x04_PGR0_PLR0_TT04_04
    SolutionIndex: 64
    SolutionNameMin: Cijk_Ailk_Bljk_HBH_MT064x128x04_PGR1_PLR0_TT04_08
    SolutionIndex: 65
    SolutionNameMin: Cijk_Ailk_Bljk_HBH_MT064x064x04_PGR1_PLR0_TT04_04
    SolutionIndex: 66
    SolutionNameMin: Cijk_Ailk_Bljk_HBH_MT064x128x04_PGR0_PLR1_TT04_08
    SolutionIndex: 67
    SolutionNameMin: Cijk_Ailk_Bljk_HBH_MT064x064x04_PGR0_PLR1_TT04_04
    SolutionIndex: 68
    SolutionNameMin: Cijk_Ailk_Bljk_HBH_MT064x128x04_PGR1_PLR1_TT04_08
    SolutionIndex: 69
    SolutionNameMin: Cijk_Ailk_Bljk_HBH_MT064x064x04_PGR1_PLR1_TT04_04
    SolutionIndex: 70
    SolutionNameMin: Cijk_Ailk_Bljk_HBH_MT064x064x08_PGR0_PLR0_TT04_04
    SolutionIndex: 71
    SolutionNameMin: Cijk_Ailk_Bljk_HBH_MT064x128x08_PGR1_PLR0_TT04_08
    SolutionIndex: 72
    SolutionNameMin: Cijk_Ailk_Bljk_HBH_MT064x064x08_PGR1_PLR0_TT04_04
    SolutionIndex: 73
    SolutionNameMin: Cijk_Ailk_Bljk_HBH_MT064x128x08_PGR0_PLR1_TT04_08
    SolutionIndex: 74
    SolutionNameMin: Cijk_Ailk_Bljk_HBH_MT064x064x08_PGR0_PLR1_TT04_04
    SolutionIndex: 75
    SolutionNameMin: Cijk_Ailk_Bljk_HBH_MT064x064x08_PGR1_PLR1_TT04_04
    SolutionIndex: 76
    SolutionNameMin: Cijk_Ailk_Bljk_HBH_MT064x064x16_PGR0_PLR0_TT04_04
    SolutionIndex: 77
    SolutionNameMin: Cijk_Ailk_Bljk_HBH_MT128x128x16_PGR1_PLR0_TT08_08
    SolutionIndex: 78
    SolutionNameMin: Cijk_Ailk_Bljk_HBH_MT064x128x16_PGR1_PLR0_TT04_08
    SolutionIndex: 79
    SolutionNameMin: Cijk_Ailk_Bljk_HBH_MT064x064x16_PGR1_PLR1_TT04_04
- - - [1856, 3584, 1, 1]
    - [82, 200.359]
  - - [128, 256, 1, 1280]
    - [16, 1420.83]
  - - [448, 1, 1, 256]
    - [92, 3.15771]
  - - [5056, 1408, 1, 3328]
    - [39, 9833.76]
  - - [5056, 1856, 1, 3328]
    - [37, 10082.2]
  - - [5888, 128, 1, 1]
    - [77, 58.5143]
  - - [448, 3584, 1, 3328]
    - [42, 8495.84]
  - - [704, 64, 1, 3328]
    - [12, 2046.21]
  - - [5056, 4288, 1, 32]
    - [60, 3610.35]
  - - [5888, 256, 1, 256]
    - [19, 8093.04]
  - - [32, 5056, 1, 1280]
    - [70, 1235.05]
  - - [1856, 256, 1, 1]
    - [85, 42.7281]
  - - [448, 1, 1, 1]
    - [80, 0.0491228]
  - - [1408, 3584, 1, 3328]
    - [42, 9858.4]
  - - [448, 448, 1, 3328]
    - [15, 5338.42]
  - - [1024, 2368, 1, 3328]
    - [42, 9200.38]
  - - [4288, 64, 1, 3328]
    - [8, 5646.08]
  - - [1, 4288, 1, 1280]
    - [97, 30.7108]
  - - [2368, 64, 1, 1]
    - [77, 12.6293]
  - - [256, 128, 1, 256]
    - [5, 936.229]
  - - [448, 64, 1, 1]
    - [80, 2.63529]
  - - [32, 1408, 1, 32]
    - [65, 96.3765]
  - - [448, 3584, 1, 32]
    - [67, 2000.79]
  - - [64, 1024, 1, 1280]
    - [12, 2752.17]
  - - [704, 128, 1, 1280]
    - [13, 3449.26]
  - - [1, 1408, 1, 3328]
    - [97, 15.6319]
  - - [32, 3584, 1, 1280]
    - [70, 1229.9]
  - - [4288, 6784, 1, 3328]
    - [38, 10171.7]
  - - [2944, 128, 1, 32]
    - [67, 780.999]
  - - [64, 6784, 1, 1]
    - [86, 41.1152]
  - - [448, 128, 1, 256]
    - [34, 1668.19]
  - - [64, 5056, 1, 3328]
    - [8, 6618.04]
  - - [5888, 4288, 1, 3328]
    - [37, 10189.2]
  - - [1, 2368, 1, 1280]
    - [97, 23.5915]
  - - [704, 1024, 1, 1]
    - [82, 61.3007]
  - - [2368, 1408, 1, 32]
    - [60, 2710.69]
  - - [256, 1856, 1, 1280]
    - [42, 7071.79]
  - - [1024, 2944, 1, 1]
    - [76, 131.3]
  - - [2368, 2944, 1, 1280]
    - [42, 9887.62]
  - - [1, 1024, 1, 3328]
    - [97, 11.2278]
  - - [3584, 1408, 1, 32]
    - [60, 3053.72]
  - - [6784, 1856, 1, 32]
    - [60, 3483.02]
  - - [5056, 256, 1, 256]
    - [42, 8105.43]
  - - [1856, 2368, 1, 256]
    - [37, 9344.87]
  - - [2368, 1024, 1, 3328]
    - [42, 9046.91]
  - - [3584, 4288, 1, 32]
    - [60, 3648.24]
  - - [1024, 1024, 1, 1280]
    - [42, 8938.31]
  - - [3584, 3584, 1, 1]
    - [84, 237.169]
  - - [32, 2944, 1, 3328]
    - [75, 1118.13]
  - - [704, 1408, 1, 3328]
    - [42, 8632.04]
  - - [1408, 704, 1, 256]
    - [18, 7516.45]
  - - [704, 64, 1, 32]
    - [68, 89.2198]
  - - [2368, 32, 1, 256]
    - [70, 556.154]
  - - [2944, 256, 1, 1]
    - [76, 62.3894]
  - - [1408, 2368, 1, 1]
    - [82, 154.359]
  - - [32, 448, 1, 3328]
    - [75, 171.471]
  - - [5056, 1, 1, 3328]
    - [97, 36.726]
  - - [2944, 256, 1, 32]
    - [68, 1299.42]
  - - [5056, 6784, 1, 1280]
    - [19, 10163.3]
  - - [4288, 5056, 1, 1]
    - [77, 242.616]
  - - [5056, 4288, 1, 1]
    - [77, 242.616]
  - - [128, 4288, 1, 3328]
    - [24, 6976.09]
  - - [5056, 128, 1, 256]
    - [9, 6767.77]
  - - [1408, 4288, 1, 1280]
    - [43, 9784.27]
  - - [1856, 704, 1, 1280]
    - [42, 9173.31]
  - - [4288, 1024, 1, 3328]
    - [43, 9343.79]
  - - [1, 5888, 1, 3328]
    - [97, 42.5318]
  - - [1024, 128, 1, 32]
    - [65, 266.136]
  - - [1024, 2368, 1, 32]
    - [68, 2400.82]
  - - [256, 704, 1, 1]
    - [92, 13.4095]
  - - [128, 448, 1, 1280]
    - [12, 2440.17]
  - - [704, 3584, 1, 1280]
    - [42, 9441.11]
  - - [1856, 5056, 1, 256]
    - [19, 9643.09]
  - - [1408, 1024, 1, 1280]
    - [42, 8610.93]
  - - [2368, 3584, 1, 1]
    - [82, 214.316]
  - - [5056, 5888, 1, 3328]
    - [37, 10232.9]
  - - [3584, 3584, 1, 1280]
    - [43, 9987.88]
  - - [2368, 3584, 1, 32]
    - [60, 3404.98]
  - - [2944, 2368, 1, 1]
    - [82, 203.604]
  - - [704, 4288, 1, 1]
    - [77, 147.978]
  - - [1024, 6784, 1, 1280]
    - [42, 10036.9]
  - - [1024, 3584, 1, 1]
    - [76, 142.913]
  - - [6784, 128, 1, 256]
    - [1, 7088.59]
  - - [2944, 2368, 1, 1280]
    - [37, 9866.63]
  - - [32, 5056, 1, 32]
    - [70, 401.968]
  - - [5888, 32, 1, 32]
    - [70, 454.014]
  - - [64, 128, 1, 3328]
    - [12, 372.038]
  - - [256, 5056, 1, 32]
    - [61, 1849.05]
  - - [5056, 64, 1, 32]
    - [70, 752.521]
  - - [128, 6784, 1, 32]
    - [68, 1523.42]
  - - [64, 128, 1, 1]
    - [82, 0.678146]
  - - [64, 2368, 1, 1280]
    - [8, 4523.94]
  - - [128, 704, 1, 32]
    - [65, 182.044]
  - - [64, 6784, 1, 3328]
    - [6, 6762.16]
  - - [2944, 256, 1, 1280]
    - [42, 8098.47]
  - - [5056, 704, 1, 1]
    - [77, 162.382]
  - - [2944, 4288, 1, 256]
    - [37, 9568.07]
  - - [1024, 1024, 1, 3328]
    - [42, 9121.87]
  - - [5888, 1, 1, 256]
    - [97, 34.6991]
  - - [5056, 704, 1, 32]
    - [63, 2656.29]
  - - [5056, 704, 1, 1280]
    - [42, 9529.91]
  - - [1856, 4288, 1, 3328]
    - [37, 10093.4]
  - - [1, 1856, 1, 256]
    - [92, 13.1108]
  - - [6784, 4288, 1, 32]
    - [60, 3765.67]
  - - [448, 5888, 1, 256]
    - [42, 8415.79]
  - - [1408, 64, 1, 256]
    - [5, 2485.85]
  - - [5888, 5056, 1, 256]
    - [39, 9927.37]
  - - [3584, 448, 1, 3328]
    - [42, 8372.3]
  - - [2944, 448, 1, 256]
    - [42, 7214.56]
  - - [3584, 2368, 1, 3328]
    - [42, 9974.16]
  - - [4288, 1856, 1, 1]
    - [82, 209.435]
  - - [1856, 2944, 1, 1]
    - [77, 189.724]
  - - [32, 4288, 1, 3328]
    - [75, 1115.53]
  - - [1, 3584, 1, 3328]
    - [97, 39.1324]
  - - [256, 32, 1, 3328]
    - [75, 99.9083]
  - - [1856, 2368, 1, 32]
    - [60, 2896.22]
  - - [4288, 1856, 1, 32]
    - [60, 3278.49]
  - - [5056, 64, 1, 3328]
    - [8, 6618.04]
  - - [6784, 1, 1, 1280]
    - [97, 47.3578]
  - - [1408, 256, 1, 1280]
    - [42, 5405.03]
  - - [1408, 64, 1, 1]
    - [82, 7.50933]
  - - [1, 1, 1, 3328]
    - [97, 0.0109908]
  - - [5056, 2368, 1, 256]
    - [19, 9709.16]
  - - [704, 704, 1, 256]
    - [42, 6219.49]
  - - [5056, 6784, 1, 1]
    - [77, 254.753]
  - - [32, 448, 1, 1280]
    - [75, 157.647]
  - - [32, 448, 1, 32]
    - [63, 35.1804]
  - - [1856, 64, 1, 256]
    - [14, 3141.39]
  - - [1024, 1408, 1, 3328]
    - [42, 8770.08]
  - - [256, 5056, 1, 1280]
    - [42, 9099.02]
  - - [704, 2368, 1, 1]
    - [77, 108.533]
  - - [64, 1024, 1, 32]
    - [65, 133.068]
  - - [1024, 256, 1, 256]
    - [21, 4712.7]
  - - [128, 1, 1, 1]
    - [97, 0.0124031]
  - - [3584, 4288, 1, 1280]
    - [37, 10089.9]
  - - [2368, 5888, 1, 32]
    - [60, 3586.57]
  - - [1856, 128, 1, 32]
    - [75, 572.453]
  - - [1856, 128, 1, 1280]
    - [15, 5957.82]
  - - [128, 2944, 1, 3328]
    - [26, 6988.95]
  - - [1, 6784, 1, 3328]
    - [97, 48.767]
  - - [3584, 2368, 1, 1]
    - [81, 213.454]
  - - [4288, 32, 1, 3328]
    - [75, 1126.32]
  - - [32, 2944, 1, 256]
    - [70, 604.14]
  - - [256, 1856, 1, 1]
    - [82, 42.122]
  - - [1408, 3584, 1, 1]
    - [76, 184.44]
  - - [704, 6784, 1, 1280]
    - [37, 9696.1]
  - - [2368, 4288, 1, 32]
    - [60, 3495.35]
  - - [704, 5056, 1, 1280]
    - [42, 9688.8]
  - - [256, 3584, 1, 3328]
    - [42, 7998.36]
  - - [3584, 6784, 1, 32]
    - [60, 3720.56]
  - - [3584, 6784, 1, 1280]
    - [42, 10182.5]
  - - [4288, 4288, 1, 3328]
    - [37, 10111.7]
  - - [3584, 64, 1, 1280]
    - [15, 5825.42]
  - - [64, 1856, 1, 256]
    - [5, 3090.32]
  - - [3584, 64, 1, 32]
    - [73, 501.368]
  - - [448, 1, 1, 1280]
    - [97, 4.59487]
  - - [704, 128, 1, 3328]
    - [13, 3671.56]
  - - [64, 1856, 1, 1]
    - [82, 10.24]
  - - [4288, 1856, 1, 3328]
    - [42, 9944.56]
  - - [1856, 2944, 1, 1280]
    - [42, 10046.5]
  - - [4288, 256, 1, 256]
    - [42, 6955.9]
  - - [128, 5888, 1, 32]
    - [65, 1389.24]
  - - [128, 5888, 1, 1280]
    - [10, 8175.34]
  - - [1408, 128, 1, 3328]
    - [25, 5582.52]
  - - [3584, 256, 1, 256]
    - [42, 6973.9]
  - - [32, 6784, 1, 3328]
    - [75, 1743.41]
  - - [64, 64, 1, 1280]
    - [14, 176.647]
  - - [32, 3584, 1, 256]
    - [70, 784.191]
  - - [2944, 5056, 1, 3328]
    - [43, 10070.9]
  - - [704, 256, 1, 32]
    - [65, 343.284]
  - - [448, 128, 1, 3328]
    - [34, 2598.6]
  - - [64, 4288, 1, 3328]
    - [8, 5623.83]
  - - [5888, 32, 1, 256]
    - [75, 1179.9]
  - - [5056, 1024, 1, 3328]
    - [43, 9929.34]
  - - [2368, 64, 1, 3328]
    - [5, 4768.96]
  - - [1856, 256, 1, 256]
    - [42, 5985.97]
  - - [256, 704, 1, 256]
    - [21, 3295.52]
  - - [5888, 5888, 1, 256]
    - [39, 9850.76]
  - - [3584, 704, 1, 32]
    - [68, 2426.09]
  - - [448, 6784, 1, 3328]
    - [42, 9706.88]
  - - [6784, 4288, 1, 1]
    - [78, 249.398]
  - - [3584, 6784, 1, 1]
    - [81, 257.999]
  - - [1408, 2368, 1, 32]
    - [66, 2640.91]
  - - [448, 5056, 1, 32]
    - [70, 2311.31]
  - - [6784, 1408, 1, 1]
    - [76, 221.518]
  - - [1856, 5888, 1, 3328]
    - [42, 10122.9]
  - - [5056, 5888, 1, 1]
    - [77, 251.604]
  - - [2944, 1024, 1, 256]
    - [43, 8866.64]
  - - [448, 1408, 1, 3328]
    - [42, 7025.6]
  - - [5056, 32, 1, 3328]
    - [75, 1312.0]
  - - [2368, 4288, 1, 3328]
    - [37, 10087.5]
  - - [1024, 704, 1, 32]
    - [65, 1360.18]
  - - [448, 2944, 1, 256]
    - [37, 7264.23]
  - - [2944, 6784, 1, 256]
    - [39, 9699.61]
  - - [2368, 2368, 1, 1280]
    - [43, 9739.34]
  - - [5888, 128, 1, 3328]
    - [10, 8362.88]
  - - [256, 256, 1, 32]
    - [68, 131.072]
  - - [1024, 1, 1, 256]
    - [92, 7.26563]
  - - [3584, 3584, 1, 32]
    - [60, 3608.16]
  - - [2944, 448, 1, 1]
    - [77, 93.1435]
  - - [128, 32, 1, 32]
    - [65, 8.40205]
  - - [5056, 64, 1, 1280]
    - [8, 6368.2]
  - - [1024, 1, 1, 3328]
    - [97, 11.3203]
  - - [2944, 2944, 1, 1280]
    - [39, 9849.01]
  - - [1, 2368, 1, 256]
    - [92, 16.1915]
  - - [1408, 5056, 1, 1]
    - [84, 206.943]
  - - [2944, 32, 1, 1280]
    - [75, 1033.83]
  - - [64, 1408, 1, 3328]
    - [13, 3704.21]
  - - [256, 448, 1, 1280]
    - [32, 4218.41]
  - - [2368, 6784, 1, 1]
    - [91, 228.97]
  - - [6784, 4288, 1, 1280]
    - [42, 10217.9]
  - - [2944, 704, 1, 256]
    - [43, 8749.66]
  - - [5888, 1856, 1, 256]
    - [43, 9721.99]
  - - [704, 2944, 1, 3328]
    - [42, 9678.85]
  - - [5888, 256, 1, 1]
    - [82, 100.221]
  - - [704, 704, 1, 32]
    - [70, 1032.53]
  - - [256, 4288, 1, 256]
    - [42, 6983.56]
  - - [5056, 6784, 1, 32]
    - [60, 3866.96]
  - - [5056, 128, 1, 1]
    - [79, 58.6203]
  - - [448, 5056, 1, 1280]
    - [42, 9364.71]
  - - [448, 448, 1, 256]
    - [6, 4090.78]
  - - [256, 5888, 1, 3328]
    - [42, 9166.03]
  - - [704, 448, 1, 1280]
    - [42, 4707.34]
  - - [448, 64, 1, 256]
    - [12, 890.781]
  - - [5888, 1024, 1, 1]
    - [76, 200.443]
  - - [5888, 448, 1, 32]
    - [70, 2420.02]
  - - [6784, 2944, 1, 256]
    - [37, 9706.96]
  - - [1024, 256, 1, 1]
    - [77, 23.9182]
  - - [5888, 256, 1, 32]
    - [66, 2009.77]
  - - [2368, 448, 1, 256]
    - [37, 6749.04]
  - - [4288, 256, 1, 3328]
    - [42, 7772.85]
  - - [4288, 2944, 1, 256]
    - [37, 9559.01]
  - - [448, 5888, 1, 3328]
    - [42, 9155.91]
  - - [128, 256, 1, 3328]
    - [12, 1533.35]
  - - [2368, 5056, 1, 32]
    - [60, 3452.81]
  - - [32, 128, 1, 1280]
    - [75, 45.1661]
  - - [1408, 4288, 1, 1]
    - [76, 196.533]
  - - [1408, 1856, 1, 3328]
    - [42, 9900.83]
  - - [4288, 64, 1, 256]
    - [0, 4526.71]
  - - [3584, 1024, 1, 3328]
    - [42, 9914.45]
  - - [2944, 5888, 1, 3328]
    - [38, 9952.18]
  - - [128, 6784, 1, 3328]
    - [9, 8075.89]
  - - [448, 4288, 1, 3328]
    - [42, 8985.23]
  - - [704, 2368, 1, 256]
    - [37, 7997.95]
  - - [1, 64, 1, 3328]
    - [97, 0.704525]
  - - [4288, 128, 1, 1]
    - [77, 45.1368]
  - - [256, 2368, 1, 32]
    - [70, 1224.66]
  - - [4288, 3584, 1, 3328]
    - [42, 10174.5]
  - - [1408, 1024, 1, 1]
    - [82, 100.684]
  - - [64, 1024, 1, 1]
    - [82, 5.49799]
  - - [1408, 1024, 1, 256]
    - [43, 7900.23]
  - - [5056, 3584, 1, 1]
    - [77, 243.558]
  - - [448, 1024, 1, 256]
    - [42, 5802.4]
  - - [6784, 6784, 1, 3328]
    - [39, 10321.8]
  - - [6784, 32, 1, 32]
    - [70, 501.938]
  - - [2368, 2944, 1, 3328]
    - [42, 9974.2]
  - - [128, 3584, 1, 3328]
    - [24, 7144.92]
  - - [5056, 3584, 1, 32]
    - [60, 3728.54]
  - - [5056, 3584, 1, 1280]
    - [42, 10063.6]
  - - [1856, 1856, 1, 256]
    - [19, 8875.33]
  - - [32, 5888, 1, 256]
    - [75, 1116.54]
  - - [256, 1408, 1, 32]
    - [70, 833.406]
  - - [2944, 1, 1, 3328]
    - [97, 32.4941]
  - - [32, 704, 1, 3328]
    - [75, 268.991]
  - - [5888, 4288, 1, 1]
    - [76, 252.074]
  - - [1024, 128, 1, 256]
    - [8, 3437.95]
  - - [32, 1856, 1, 3328]
    - [70, 696.759]
  - - [5056, 704, 1, 256]
    - [43, 9025.48]
  - - [2368, 5056, 1, 256]
    - [19, 9716.55]
  - - [3584, 704, 1, 1]
    - [82, 137.726]
  - - [1024, 5056, 1, 256]
    - [43, 9521.55]
  - - [32, 1024, 1, 3328]
    - [75, 391.709]
  - - [5888, 448, 1, 256]
    - [42, 8340.95]
  - - [6784, 5056, 1, 1280]
    - [39, 10200.7]
  - - [4288, 6784, 1, 1280]
    - [42, 10212.5]
  - - [64, 1, 1, 256]
    - [92, 0.453097]
  - - [2944, 3584, 1, 3328]
    - [39, 9807.91]
  - - [128, 1408, 1, 1]
    - [82, 14.1686]
  - - [1024, 64, 1, 32]
    - [65, 131.731]
  - - [1024, 64, 1, 3328]
    - [12, 2979.56]
  - - [704, 6784, 1, 3328]
    - [42, 9814.7]
  - - [2944, 1856, 1, 1]
    - [77, 187.125]
  - - [5888, 4288, 1, 1280]
    - [42, 10142.2]
  - - [5888, 3584, 1, 1280]
    - [37, 10125.7]
  - - [3584, 1408, 1, 1280]
    - [39, 9592.53]
  - - [1024, 2944, 1, 256]
    - [43, 8932.31]
  - - [1, 2944, 1, 1280]
    - [97, 29.3849]
  - - [32, 1024, 1, 256]
    - [70, 244.423]
  - - [2944, 1856, 1, 1280]
    - [37, 9867.38]
  - - [3584, 1, 1, 1280]
    - [97, 37.6273]
  - - [256, 3584, 1, 32]
    - [65, 1575.11]
  - - [1024, 2368, 1, 1]
    - [77, 134.713]
  - - [2944, 3584, 1, 1280]
    - [43, 9755.03]
  - - [64, 1, 1, 1]
    - [97, 0.00661157]
  - - [1856, 4288, 1, 256]
    - [37, 9538.29]
  - - [256, 128, 1, 3328]
    - [12, 1536.81]
  - - [1, 1856, 1, 3328]
    - [97, 20.4366]
  - - [704, 5888, 1, 1]
    - [91, 165.541]
  - - [2368, 2944, 1, 32]
    - [60, 3276.8]
  - - [128, 4288, 1, 32]
    - [70, 1125.87]
  - - [448, 256, 1, 256]
    - [5, 3008.21]
  - - [64, 64, 1, 1]
    - [82, 0.341333]
  - - [1, 1408, 1, 1]
    - [82, 0.123944]
  - - [128, 2368, 1, 1280]
    - [8, 6009.5]
  - - [5888, 64, 1, 3328]
    - [26, 6973.4]
  - - [4288, 704, 1, 256]
    - [19, 8821.92]
  - - [1856, 1024, 1, 256]
    - [19, 8065.97]
  - - [448, 1856, 1, 32]
    - [65, 1484.8]
  - - [448, 1856, 1, 3328]
    - [42, 7246.99]
  - - [448, 448, 1, 32]
    - [68, 356.807]
  - - [1024, 448, 1, 256]
    - [42, 5689.95]
  - - [6784, 1, 1, 256]
    - [97, 39.7597]
  - - [704, 6784, 1, 32]
    - [60, 3042.0]
  - - [1024, 4288, 1, 1]
    - [84, 177.626]
  - - [704, 256, 1, 3328]
    - [21, 4228.61]
  - - [704, 1856, 1, 32]
    - [61, 1880.03]
  - - [1408, 5888, 1, 1280]
    - [43, 10156.6]
  - - [32, 704, 1, 1280]
    - [75, 244.041]
  - - [5056, 1856, 1, 256]
    - [19, 9661.71]
  - - [6784, 704, 1, 1280]
    - [42, 9542.32]
  - - [704, 1408, 1, 32]
    - [67, 1605.23]
  - - [5888, 1024, 1, 256]
    - [37, 9471.67]
  - - [64, 2944, 1, 1]
    - [77, 14.361]
  - - [64, 2944, 1, 32]
    - [64, 350.541]
  - - [64, 2944, 1, 1280]
    - [8, 5551.85]
  - - [6784, 1856, 1, 3328]
    - [37, 9994.83]
  - - [2368, 5888, 1, 1280]
    - [42, 10013.7]
  - - [1, 6784, 1, 256]
    - [97, 38.3548]
  - - [6784, 6784, 1, 32]
    - [60, 3878.86]
  - - [256, 1, 1, 1280]
    - [92, 2.6684]
  - - [5888, 128, 1, 32]
    - [68, 1357.95]
  - - [6784, 256, 1, 256]
    - [42, 8208.94]
  - - [2368, 3584, 1, 3328]
    - [42, 9969.65]
  - - [128, 4288, 1, 1280]
    - [6, 6823.48]
  - - [128, 128, 1, 256]
    - [12, 494.611]
  - - [5888, 1024, 1, 1280]
    - [37, 9965.79]
  - - [1856, 704, 1, 3328]
    - [42, 9342.65]
  - - [5888, 6784, 1, 3328]
    - [42, 10263.4]
  - - [6784, 448, 1, 1]
    - [82, 147.25]
  - - [6784, 1856, 1, 1]
    - [81, 231.454]
  - - [128, 32, 1, 1280]
    - [75, 45.1972]
  - - [32, 1856, 1, 32]
    - [61, 123.733]
  - - [128, 256, 1, 1]
    - [77, 2.76757]
  - - [6784, 448, 1, 32]
    - [65, 2532.69]
  - - [6784, 448, 1, 3328]
    - [42, 9523.35]
  - - [1, 6784, 1, 1]
    - [77, 0.718644]
  - - [448, 3584, 1, 1280]
    - [42, 8379.03]
  - - [1408, 6784, 1, 1280]
    - [37, 10123.2]
  - - [3584, 1856, 1, 3328]
    - [43, 9901.21]
  - - [32, 2944, 1, 32]
    - [68, 160.354]
  - - [5888, 704, 1, 1]
    - [77, 172.141]
  - - [3584, 1856, 1, 1]
    - [82, 198.921]
  - - [1, 256, 1, 256]
    - [92, 1.79256]
  - - [5056, 2944, 1, 32]
    - [66, 3535.6]
  - - [32, 6784, 1, 256]
    - [75, 1354.16]
  - - [64, 5056, 1, 256]
    - [8, 5075.83]
  - - [4288, 6784, 1, 1]
    - [82, 251.294]
  - - [2944, 64, 1, 256]
    - [8, 3992.92]
  - - [1, 4288, 1, 3328]
    - [97, 31.0822]
  - - [1024, 6784, 1, 1]
    - [81, 205.771]
  - - [256, 32, 1, 1280]
    - [70, 92.6304]
  - - [128, 3584, 1, 1280]
    - [6, 6924.56]
  - - [1, 256, 1, 1]
    - [82, 0.0233577]
  - - [3584, 4288, 1, 1]
    - [76, 232.008]
  - - [5888, 1024, 1, 3328]
    - [42, 10084.8]
  - - [6784, 5888, 1, 256]
    - [39, 9889.46]
  - - [4288, 6784, 1, 256]
    - [19, 9831.78]
  - - [2368, 3584, 1, 256]
    - [37, 9449.59]
  - - [32, 3584, 1, 3328]
    - [75, 1336.42]
  - - [1024, 1, 1, 1280]
    - [97, 10.516]
  - - [4288, 2368, 1, 32]
    - [60, 3462.57]
  - - [704, 3584, 1, 1]
    - [77, 135.945]
  - - [704, 1856, 1, 3328]
    - [42, 9358.74]
  - - [2944, 128, 1, 1280]
    - [26, 6759.32]
  - - [1, 2368, 1, 3328]
    - [97, 26.0743]
  - - [6784, 704, 1, 32]
    - [65, 2881.41]
  - - [4288, 1, 1, 1280]
    - [97, 30.7384]
  - - [704, 5888, 1, 256]
    - [37, 9334.61]
  - - [2368, 3584, 1, 1280]
    - [42, 9894.38]
  - - [64, 448, 1, 256]
    - [12, 873.813]
  - - [1408, 448, 1, 1280]
    - [42, 6879.72]
  - - [1408, 128, 1, 32]
    - [65, 348.259]
  - - [3584, 5056, 1, 32]
    - [60, 3646.02]
  - - [1024, 32, 1, 1280]
    - [75, 362.578]
  - - [128, 2368, 1, 1]
    - [82, 28.4872]
  - - [448, 448, 1, 1280]
    - [15, 5049.16]
  - - [6784, 1856, 1, 1280]
    - [37, 9940.66]
  - - [5056, 5056, 1, 3328]
    - [42, 10230.9]
  - - [128, 704, 1, 1280]
    - [13, 3441.03]
  - - [128, 2944, 1, 1280]
    - [26, 6662.22]
  - - [2368, 5056, 1, 1]
    - [77, 229.536]
  - - [5888, 1408, 1, 256]
    - [43, 9622.41]
  - - [2368, 1024, 1, 32]
    - [66, 2412.77]
  - - [256, 256, 1, 3328]
    - [12, 2979.56]
  - - [64, 4288, 1, 1]
    - [85, 25.7925]
  - - [4288, 1024, 1, 256]
    - [37, 9213.72]
  - - [3584, 32, 1, 32]
    - [72, 279.727]
  - - [3584, 64, 1, 1]
    - [92, 21.0824]
  - - [704, 32, 1, 1280]
    - [75, 244.537]
  - - [64, 64, 1, 3328]
    - [12, 185.21]
  - - [64, 1408, 1, 1]
    - [77, 7.61081]
  - - [4288, 5888, 1, 1280]
    - [42, 10137.6]
  - - [1856, 2944, 1, 3328]
    - [42, 10171.2]
  - - [256, 1024, 1, 256]
    - [42, 4766.25]
  - - [5056, 5888, 1, 256]
    - [19, 9886.16]
  - - [1408, 128, 1, 1280]
    - [8, 5349.88]
  - - [1024, 5888, 1, 1280]
    - [42, 10175.0]
  - - [1024, 448, 1, 1]
    - [82, 40.96]
  - - [32, 32, 1, 32]
    - [65, 2.07919]
  - - [5056, 1, 1, 1280]
    - [97, 35.7157]
  - - [5888, 5056, 1, 1280]
    - [39, 10248.6]
  - - [5888, 2944, 1, 1]
    - [78, 238.896]
  - - [64, 4288, 1, 1280]
    - [8, 5468.13]
  - - [448, 704, 1, 1280]
    - [42, 4716.14]
  - - [1408, 4288, 1, 3328]
    - [42, 9878.08]
  - - [704, 2944, 1, 32]
    - [60, 2341.89]
  - - [1, 5888, 1, 1280]
    - [97, 41.4283]
  - - [2944, 4288, 1, 3328]
    - [37, 10021.4]
  - - [256, 2944, 1, 256]
    - [42, 7135.28]
  - - [704, 448, 1, 32]
    - [70, 742.099]
  - - [5056, 2944, 1, 256]
    - [37, 9710.81]
  - - [704, 1024, 1, 256]
    - [42, 6906.79]
  - - [2368, 1856, 1, 256]
    - [37, 9204.21]
  - - [64, 3584, 1, 1]
    - [77, 16.6698]
  - - [1024, 128, 1, 1280]
    - [32, 4702.13]
  - - [2368, 4288, 1, 1280]
    - [42, 10042.9]
  - - [256, 6784, 1, 256]
    - [42, 8257.73]
  - - [1024, 32, 1, 32]
    - [65, 71.624]
  - - [1024, 1408, 1, 1]
    - [77, 100.684]
  - - [128, 64, 1, 32]
    - [72, 18.0044]
  - - [64, 1, 1, 1280]
    - [97, 0.654313]
  - - [6784, 5888, 1, 3328]
    - [42, 10264.2]
  - - [256, 5888, 1, 1]
    - [86, 102.4]
  - - [2944, 2944, 1, 1]
    - [78, 217.113]
  - - [6784, 3584, 1, 256]
    - [43, 9823.77]
  - - [1408, 1856, 1, 256]
    - [43, 9139.17]
  - - [128, 1408, 1, 256]
    - [8, 3923.24]
  - - [2944, 2944, 1, 32]
    - [60, 3442.76]
  - - [2944, 2944, 1, 3328]
    - [37, 9863.83]
  - - [1, 2944, 1, 256]
    - [92, 19.9593]
  - - [448, 32, 1, 1280]
    - [75, 158.409]
  - - [3584, 1, 1, 256]
    - [97, 28.1789]
  - - [704, 32, 1, 3328]
    - [75, 269.61]
  - - [256, 448, 1, 3328]
    - [14, 4518.01]
  - - [2368, 64, 1, 256]
    - [8, 3344.6]
  - - [64, 448, 1, 1280]
    - [16, 1253.42]
  - - [1408, 448, 1, 3328]
    - [42, 7012.46]
  - - [2368, 6784, 1, 3328]
    - [38, 10105.1]
  - - [4288, 3584, 1, 32]
    - [60, 3524.81]
  - - [256, 2368, 1, 1]
    - [85, 54.5151]
  - - [32, 4288, 1, 1280]
    - [75, 1074.1]
  - - [6784, 704, 1, 256]
    - [37, 9048.55]
  - - [3584, 704, 1, 1280]
    - [42, 9297.6]
  - - [448, 5056, 1, 3328]
    - [42, 9489.19]
  - - [4288, 448, 1, 256]
    - [19, 8131.32]
  - - [5056, 256, 1, 1280]
    - [42, 8968.98]
  - - [704, 448, 1, 3328]
    - [42, 4852.18]
  - - [2944, 5888, 1, 32]
    - [60, 3670.57]
  - - [3584, 5056, 1, 256]
    - [43, 9778.45]
  - - [6784, 1, 1, 3328]
    - [97, 48.1595]
  - - [4288, 256, 1, 1]
    - [82, 79.7767]
  - - [64, 256, 1, 1]
    - [82, 1.49489]
  - - [1856, 448, 1, 3328]
    - [42, 7251.55]
  - - [3584, 2368, 1, 256]
    - [37, 9433.18]
  - - [4288, 4288, 1, 256]
    - [37, 9670.97]
  - - [4288, 256, 1, 1280]
    - [42, 7629.73]
  - - [4288, 4288, 1, 1280]
    - [42, 10065.0]
  - - [4288, 704, 1, 1280]
    - [42, 9364.09]
  - - [128, 1856, 1, 32]
    - [75, 569.025]
  - - [256, 1856, 1, 32]
    - [70, 1016.33]
  - - [1408, 1856, 1, 1]
    - [77, 140.8]
  - - [2368, 704, 1, 1]
    - [77, 108.533]
  - - [3584, 32, 1, 256]
    - [70, 819.2]
  - - [6784, 128, 1, 3328]
    - [20, 8099.43]
  - - [3584, 256, 1, 1]
    - [79, 73.0497]
  - - [1408, 1856, 1, 1280]
    - [42, 9755.48]
  - - [3584, 4288, 1, 3328]
    - [22, 9837.75]
  - - [448, 4288, 1, 32]
    - [60, 2208.07]
  - - [448, 4288, 1, 1280]
    - [42, 8865.41]
  - - [64, 3584, 1, 256]
    - [6, 4503.09]
  - - [6784, 1408, 1, 1280]
    - [42, 9960.88]
  - - [3584, 704, 1, 256]
    - [43, 8709.85]
  - - [1, 6784, 1, 1280]
    - [97, 47.607]
  - - [5056, 1024, 1, 256]
    - [19, 9381.37]
  - - [2368, 448, 1, 32]
    - [67, 1632.1]
  - - [256, 1, 1, 256]
    - [97, 2.1672]
  - - [32, 2944, 1, 1280]
    - [75, 1005.56]
  - - [448, 3584, 1, 1]
    - [81, 107.328]
  - - [2368, 256, 1, 256]
    - [42, 5807.98]
  - - [1, 5056, 1, 1]
    - [91, 0.544828]
  - - [4288, 32, 1, 32]
    - [70, 356.405]
  - - [1856, 3584, 1, 32]
    - [60, 3093.91]
  - - [5056, 3584, 1, 3328]
    - [43, 10177.5]
  - - [1856, 256, 1, 32]
    - [68, 979.662]
  - - [4288, 5056, 1, 256]
    - [37, 9765.81]
  - - [1856, 5888, 1, 256]
    - [19, 9673.58]
  - - [256, 256, 1, 256]
    - [14, 1941.81]
  - - [128, 1856, 1, 1]
    - [77, 22.6687]
  - - [4288, 2368, 1, 256]
    - [37, 9601.88]
  - - [448, 1, 1, 3328]
    - [97, 4.91736]
  - - [1856, 256, 1, 1280]
    - [42, 7071.75]
  - - [256, 2944, 1, 1]
    - [76, 63.6541]
  - - [1408, 2944, 1, 3328]
    - [42, 10026.1]
  - - [4288, 128, 1, 256]
    - [6, 5854.55]
  - - [5888, 3584, 1, 1]
    - [76, 247.219]
  - - [256, 1, 1, 1]
    - [77, 0.0336842]
  - - [6784, 5056, 1, 3328]
    - [41, 10071.9]
  - - [6784, 5056, 1, 1]
    - [81, 257.044]
  - - [5888, 3584, 1, 32]
    - [60, 3743.25]
  - - [5888, 3584, 1, 3328]
    - [37, 10187.3]
  - - [32, 1024, 1, 1280]
    - [75, 361.329]
  - - [1, 256, 1, 3328]
    - [97, 2.83536]
  - - [1024, 6784, 1, 256]
    - [37, 9536.6]
  - - [6784, 5888, 1, 32]
    - [60, 3857.48]
  - - [1408, 1, 1, 1280]
    - [97, 14.1153]
  - - [2368, 6784, 1, 32]
    - [60, 3701.5]
  - - [6784, 64, 1, 1]
    - [82, 40.2015]
  - - [2368, 32, 1, 32]
    - [65, 157.867]
  - - [5056, 1408, 1, 1280]
    - [39, 9767.73]
  - - [3584, 1408, 1, 3328]
    - [42, 9678.41]
  - - [2944, 3584, 1, 1]
    - [76, 226.617]
  - - [2944, 1408, 1, 1280]
    - [43, 9776.3]
  - - [256, 1408, 1, 1]
    - [88, 33.3748]
  - - [3584, 1024, 1, 1]
    - [76, 165.019]
  - - [256, 32, 1, 256]
    - [75, 65.7002]
  - - [2944, 1856, 1, 3328]
    - [42, 9985.72]
  - - [128, 1024, 1, 3328]
    - [14, 5139.11]
  - - [1408, 128, 1, 1]
    - [82, 13.8209]
  - - [2944, 3584, 1, 32]
    - [60, 3522.97]
  - - [3584, 1024, 1, 32]
    - [60, 2872.81]
  - - [6784, 64, 1, 256]
    - [6, 5624.95]
  - - [256, 128, 1, 1280]
    - [36, 1428.58]
  - - [6784, 5056, 1, 256]
    - [43, 9893.6]
  - - [1408, 32, 1, 3328]
    - [75, 539.065]
  - - [1856, 3584, 1, 1280]
    - [19, 9971.0]
  - - [256, 5888, 1, 256]
    - [43, 8217.12]
  - - [5056, 32, 1, 256]
    - [75, 1039.63]
  - - [1024, 4288, 1, 3328]
    - [42, 10040.2]
  - - [448, 2368, 1, 256]
    - [42, 6844.28]
  - - [64, 1408, 1, 1280]
    - [13, 3449.26]
  - - [3584, 32, 1, 1280]
    - [75, 1245.76]
  - - [128, 2368, 1, 3328]
    - [8, 6214.45]
  - - [3584, 1024, 1, 256]
    - [43, 9298.54]
  - - [256, 64, 1, 256]
    - [12, 499.322]
  - - [32, 1408, 1, 256]
    - [70, 336.082]
  - - [2368, 448, 1, 3328]
    - [42, 7525.91]
  - - [2368, 1408, 1, 1]
    - [77, 158.467]
  - - [1, 1, 1, 1]
    - [93, 8.62069e-05]
  - - [1024, 1856, 1, 32]
    - [60, 2190.83]
  - - [32, 1024, 1, 32]
    - [65, 68.6241]
  - - [4288, 1, 1, 256]
    - [97, 25.6478]
  - - [1856, 128, 1, 3328]
    - [15, 6314.91]
  - - [5888, 2368, 1, 1]
    - [81, 215.699]
  - - [2368, 2368, 1, 1]
    - [82, 190.47]
  - - [704, 256, 1, 1280]
    - [21, 4049.98]
  - - [704, 4288, 1, 256]
    - [42, 8878.68]
  - - [5888, 2368, 1, 32]
    - [60, 3509.83]
  - - [5888, 2368, 1, 1280]
    - [43, 10064.7]
  - - [128, 256, 1, 256]
    - [12, 989.223]
  - - [32, 4288, 1, 32]
    - [75, 271.715]
  - - [6784, 704, 1, 3328]
    - [42, 9632.44]
  - - [1856, 1856, 1, 32]
    - [60, 2675.52]
  - - [4288, 2944, 1, 32]
    - [60, 3528.69]
  - - [256, 5056, 1, 1]
    - [81, 95.7349]
  - - [704, 64, 1, 256]
    - [12, 1360.18]
  - - [256, 2368, 1, 3328]
    - [42, 6748.26]
  - - [704, 1, 1, 1]
    - [77, 0.0642336]
  - - [64, 2944, 1, 3328]
    - [25, 5871.24]
  - - [5056, 5056, 1, 256]
    - [19, 9862.79]
  - - [5888, 64, 1, 1]
    - [93, 32.0435]
  - - [6784, 6784, 1, 256]
    - [43, 9975.1]
  - - [256, 1856, 1, 256]
    - [42, 5825.42]
  - - [5888, 64, 1, 32]
    - [67, 837.404]
  - - [2368, 2944, 1, 256]
    - [37, 9412.85]
  - - [448, 32, 1, 32]
    - [65, 30.023]
  - - [704, 64, 1, 1]
    - [92, 3.75467]
  - - [3584, 704, 1, 3328]
    - [43, 9401.02]
  - - [4288, 704, 1, 3328]
    - [42, 9466.3]
  - - [4288, 2944, 1, 1280]
    - [42, 9971.95]
  - - [448, 3584, 1, 256]
    - [42, 7703.18]
  - - [704, 32, 1, 256]
    - [70, 170.425]
  - - [6784, 256, 1, 32]
    - [61, 2055.27]
  - - [1856, 128, 1, 1]
    - [79, 22.6687]
  - - [1856, 32, 1, 32]
    - [68, 129.113]
  - - [2368, 5056, 1, 1280]
    - [42, 10067.4]
  - - [1408, 6784, 1, 3328]
    - [42, 10216.2]
  - - [1408, 1408, 1, 1280]
    - [42, 9125.27]
  - - [448, 1024, 1, 3328]
    - [42, 7023.95]
  - - [32, 704, 1, 32]
    - [65, 47.6783]
  - - [1024, 5056, 1, 1]
    - [77, 187.043]
  - - [5888, 1856, 1, 32]
    - [60, 3469.25]
  - - [5888, 704, 1, 3328]
    - [19, 9814.35]
  - - [5056, 1, 1, 256]
    - [97, 30.2415]
  - - [448, 6784, 1, 256]
    - [42, 8938.92]
  - - [1024, 128, 1, 1]
    - [82, 10.9227]
  - - [128, 64, 1, 256]
    - [5, 216.648]
  - - [1024, 64, 1, 1280]
    - [12, 2744.96]
  - - [1024, 256, 1, 1280]
    - [21, 5890.88]
  - - [128, 5056, 1, 32]
    - [70, 1262.77]
  - - [128, 5056, 1, 1280]
    - [9, 7904.34]
  - - [1856, 1408, 1, 32]
    - [60, 2555.74]
  - - [64, 704, 1, 32]
    - [65, 91.4843]
  - - [64, 704, 1, 3328]
    - [34, 2059.7]
  - - [64, 2368, 1, 32]
    - [68, 295.711]
  - - [2944, 32, 1, 3328]
    - [75, 1112.42]
  - - [2368, 256, 1, 1]
    - [79, 53.7418]
  - - [5888, 64, 1, 1280]
    - [26, 6744.2]
  - - [5056, 1, 1, 1]
    - [79, 0.513821]
  - - [5888, 2944, 1, 1280]
    - [42, 10060.5]
  - - [32, 2368, 1, 256]
    - [70, 551.098]
  - - [3584, 1408, 1, 1]
    - [81, 184.44]
  - - [32, 6784, 1, 1280]
    - [75, 1669.11]
  - - [32, 6784, 1, 32]
    - [70, 501.938]
  - - [448, 5888, 1, 32]
    - [70, 2414.48]
  - - [1856, 6784, 1, 1]
    - [82, 230.775]
  - - [5056, 64, 1, 1]
    - [77, 32.1016]
  - - [1, 5888, 1, 1]
    - [92, 0.598374]
  - - [2368, 1024, 1, 256]
    - [43, 8370.51]
  - - [1856, 6784, 1, 32]
    - [60, 3517.07]
  - - [1856, 6784, 1, 1280]
    - [42, 9953.93]
  - - [64, 3584, 1, 3328]
    - [28, 5986.22]
  - - [1408, 448, 1, 256]
    - [42, 6079.85]
  - - [5888, 5056, 1, 3328]
    - [38, 10062.4]
  - - [1, 2944, 1, 3328]
    - [97, 32.2121]
  - - [1408, 6784, 1, 32]
    - [60, 3435.93]
  - - [32, 5888, 1, 1280]
    - [75, 1449.35]
  - - [448, 256, 1, 1]
    - [77, 9.49404]
  - - [3584, 5888, 1, 3328]
    - [43, 10126.0]
  - - [4288, 1408, 1, 256]
    - [43, 9217.56]
  - - [448, 64, 1, 1280]
    - [16, 1260.31]
  - - [128, 448, 1, 32]
    - [65, 115.846]
  - - [6784, 2368, 1, 256]
    - [43, 9774.93]
  - - [1408, 448, 1, 32]
    - [68, 1249.08]
  - - [1856, 1408, 1, 1280]
    - [42, 9750.91]
  - - [448, 256, 1, 3328]
    - [14, 4522.29]
  - - [1856, 2368, 1, 1]
    - [82, 172.76]
  - - [1408, 5056, 1, 3328]
    - [42, 10016.0]
  - - [128, 704, 1, 3328]
    - [35, 3693.26]
  - - [5056, 128, 1, 1280]
    - [9, 7898.31]
  - - [5056, 4288, 1, 256]
    - [37, 9772.69]
  - - [5056, 5056, 1, 32]
    - [60, 3718.27]
  - - [1856, 704, 1, 256]
    - [42, 8230.7]
  - - [64, 256, 1, 256]
    - [11, 489.989]
  - - [448, 5888, 1, 1280]
    - [42, 9049.14]
  - - [704, 704, 1, 3328]
    - [42, 7588.38]
  - - [128, 6784, 1, 256]
    - [1, 7161.67]
  - - [5056, 448, 1, 256]
    - [42, 8487.45]
  - - [4288, 5888, 1, 1]
    - [77, 247.916]
  - - [1856, 5056, 1, 1280]
    - [42, 10046.4]
  - - [2368, 4288, 1, 1]
    - [82, 221.897]
  - - [2368, 32, 1, 3328]
    - [75, 906.87]
  - - [3584, 1856, 1, 256]
    - [43, 9401.98]
  - - [256, 3584, 1, 256]
    - [42, 7023.95]
  - - [64, 704, 1, 1]
    - [86, 3.80541]
  - - [4288, 5888, 1, 32]
    - [60, 3788.11]
  - - [4288, 5888, 1, 3328]
    - [43, 10118.1]
  - - [1, 1024, 1, 1]
    - [77, 0.0934307]
  - - [1024, 2944, 1, 3328]
    - [42, 9630.6]
  - - [1024, 5888, 1, 1]
    - [76, 180.302]
  - - [6784, 128, 1, 1280]
    - [9, 7966.53]
  - - [2944, 2368, 1, 256]
    - [37, 9424.78]
  - - [1024, 1856, 1, 256]
    - [42, 8108.99]
  - - [2944, 64, 1, 3328]
    - [25, 5880.05]
  - - [1024, 5888, 1, 32]
    - [71, 3029.8]
  - - [1024, 5888, 1, 3328]
    - [42, 10290.4]
  - - [5056, 2368, 1, 32]
    - [60, 3445.35]
  - - [1408, 2368, 1, 1280]
    - [42, 9722.31]
  - - [256, 1, 1, 3328]
    - [97, 2.87361]
  - - [128, 1024, 1, 32]
    - [65, 268.866]
  - - [5056, 6784, 1, 3328]
    - [42, 10284.6]
  - - [32, 64, 1, 32]
    - [65, 4.17959]
  - - [448, 704, 1, 32]
    - [75, 725.039]
  - - [448, 704, 1, 3328]
    - [42, 4839.66]
  - - [1408, 2944, 1, 256]
    - [39, 9400.77]
  - - [64, 6784, 1, 256]
    - [7, 5535.31]
  - - [1024, 704, 1, 1]
    - [79, 59.2842]
  - - [2368, 128, 1, 32]
    - [75, 713.186]
  - - [3584, 448, 1, 256]
    - [42, 7634.51]
  - - [2368, 128, 1, 3328]
    - [8, 6223.66]
  - - [704, 1856, 1, 1280]
    - [42, 9181.37]
  - - [704, 5056, 1, 32]
    - [60, 2808.22]
  - - [32, 2368, 1, 32]
    - [65, 152.314]
  - - [1408, 1, 1, 256]
    - [92, 9.99024]
  - - [4288, 256, 1, 32]
    - [63, 1708.53]
  - - [448, 1408, 1, 1]
    - [94, 54.3779]
  - - [5056, 4288, 1, 1280]
    - [42, 10165.6]
  - - [5888, 1, 1, 3328]
    - [97, 42.2822]
  - - [1408, 256, 1, 256]
    - [42, 4650.94]
  - - [4288, 448, 1, 1]
    - [79, 116.567]
  - - [1024, 448, 1, 32]
    - [68, 991.896]
  - - [5888, 6784, 1, 1280]
    - [37, 10190.5]
  - - [256, 256, 1, 1]
    - [77, 5.35425]
  - - [1856, 64, 1, 1280]
    - [14, 4329.26]
  - - [1408, 1, 1, 1]
    - [77, 0.127536]
  - - [448, 1408, 1, 256]
    - [42, 6116.69]
  - - [5888, 5888, 1, 1]
    - [84, 259.34]
  - - [128, 2944, 1, 32]
    - [65, 851.598]
  - - [448, 32, 1, 3328]
    - [75, 171.078]
  - - [32, 256, 1, 32]
    - [65, 17.156]
  - - [2944, 704, 1, 1280]
    - [42, 9388.79]
  - - [1024, 3584, 1, 1280]
    - [42, 9988.14]
  - - [1856, 448, 1, 1]
    - [79, 68.3789]
  - - [2368, 2944, 1, 1]
    - [77, 202.657]
  - - [5056, 256, 1, 32]
    - [63, 1849.05]
  - - [4288, 1, 1, 3328]
    - [97, 31.0606]
  - - [5056, 1024, 1, 1280]
    - [43, 9852.22]
  - - [704, 704, 1, 1]
    - [82, 44.5698]
  - - [1856, 448, 1, 1280]
    - [42, 7106.74]
  - - [3584, 6784, 1, 256]
    - [43, 9808.91]
  - - [1856, 1024, 1, 1]
    - [82, 119.984]
  - - [64, 1856, 1, 1280]
    - [14, 4349.07]
  - - [1856, 1408, 1, 256]
    - [19, 9040.43]
  - - [4288, 4288, 1, 32]
    - [60, 3582.45]
  - - [128, 1, 1, 256]
    - [92, 0.906195]
  - - [32, 64, 1, 3328]
    - [75, 24.6733]
  - - [5888, 448, 1, 1]
    - [77, 139.715]
  - - [128, 5888, 1, 256]
    - [10, 7177.75]
  - - [3584, 256, 1, 3328]
    - [42, 7885.97]
  - - [5056, 5056, 1, 1280]
    - [42, 10164.3]
  - - [2368, 1, 1, 256]
    - [92, 16.545]
  - - [6784, 1408, 1, 3328]
    - [42, 10034.3]
  - - [1408, 1408, 1, 1]
    - [85, 120.295]
  - - [32, 64, 1, 256]
    - [70, 15.2056]
  - - [2368, 1, 1, 1280]
    - [97, 23.889]
  - - [32, 3584, 1, 32]
    - [65, 215.377]
  - - [128, 6784, 1, 1]
    - [79, 70.9438]
  - - [1, 3584, 1, 1]
    - [91, 0.28535]
  - - [1, 128, 1, 3328]
    - [97, 1.41092]
  - - [32, 256, 1, 256]
    - [70, 60.4018]
  - - [5888, 1408, 1, 32]
    - [60, 3411.65]
  - - [704, 256, 1, 1]
    - [82, 13.9925]
  - - [448, 2944, 1, 3328]
    - [42, 8043.8]
  - - [1, 448, 1, 1]
    - [96, 0.0495575]
  - - [64, 5888, 1, 256]
    - [8, 5359.39]
  - - [1856, 1, 1, 1]
    - [82, 0.171852]
  - - [1024, 256, 1, 3328]
    - [30, 6171.58]
  - - [448, 1024, 1, 32]
    - [70, 965.794]
  - - [6784, 2368, 1, 1280]
    - [39, 10103.9]
  - - [128, 1856, 1, 1280]
    - [15, 6033.47]
  - - [256, 2368, 1, 256]
    - [37, 5790.64]
  - - [2944, 1408, 1, 1]
    - [76, 172.141]
  - - [6784, 1024, 1, 256]
    - [37, 9379.67]
  - - [5056, 1408, 1, 32]
    - [60, 3217.56]
  - - [2944, 1408, 1, 3328]
    - [43, 9875.62]
  - - [1856, 32, 1, 256]
    - [70, 451.436]
  - - [704, 2368, 1, 32]
    - [67, 2045.49]
  - - [448, 256, 1, 32]
    - [61, 228.235]
  - - [704, 6784, 1, 1]
    - [82, 179.817]
  - - [2368, 6784, 1, 256]
    - [19, 9734.22]
  - - [256, 1408, 1, 256]
    - [42, 4669.77]
  - - [256, 4288, 1, 1280]
    - [42, 7754.37]
  - - [1856, 1856, 1, 1]
    - [77, 156.579]
  - - [1856, 3584, 1, 3328]
    - [42, 10053.4]
  - - [1, 704, 1, 3328]
    - [97, 7.76622]
  - - [256, 128, 1, 1]
    - [87, 3.2]
  - - [64, 1, 1, 3328]
    - [97, 0.704898]
  - - [256, 2944, 1, 3328]
    - [42, 8374.04]
  - - [704, 1856, 1, 1]
    - [81, 93.8667]
  - - [704, 448, 1, 256]
    - [42, 4037.02]
  - - [448, 64, 1, 3328]
    - [12, 1337.17]
  - - [704, 6784, 1, 256]
    - [37, 9184.49]
  - - [2368, 448, 1, 1280]
    - [42, 7386.35]
  - - [6784, 2944, 1, 32]
    - [66, 3577.63]
  - - [64, 4288, 1, 32]
    - [70, 634.525]
  - - [128, 704, 1, 1]
    - [82, 7.66258]
  - - [128, 448, 1, 3328]
    - [12, 2612.83]
  - - [5888, 2368, 1, 3328]
    - [43, 10115.6]
  - - [2368, 704, 1, 1280]
    - [42, 8562.81]
  - - [1024, 1408, 1, 1280]
    - [42, 8627.03]
  - - [1408, 5888, 1, 256]
    - [39, 9728.26]
  - - [4288, 64, 1, 1280]
    - [8, 5441.03]
  - - [128, 5056, 1, 1]
    - [77, 57.7829]
  - - [2944, 5056, 1, 32]
    - [60, 3588.88]
  - - [448, 448, 1, 1]
    - [91, 14.5017]
  - - [256, 2368, 1, 1280]
    - [42, 6598.18]
  - - [704, 2368, 1, 3328]
    - [42, 8818.69]
  - - [3584, 2944, 1, 256]
    - [37, 9511.03]
  - - [5056, 256, 1, 3328]
    - [42, 9109.17]
  - - [3584, 1024, 1, 1280]
    - [43, 9829.3]
  - - [1408, 256, 1, 32]
    - [70, 833.406]
  - - [64, 1024, 1, 256]
    - [14, 1923.99]
  - - [1408, 32, 1, 32]
    - [68, 95.3566]
  - - [128, 3584, 1, 256]
    - [9, 5734.4]
  - - [704, 1408, 1, 1]
    - [77, 75.5512]
  - - [5056, 3584, 1, 256]
    - [19, 9753.77]
  - - [2368, 704, 1, 256]
    - [37, 7879.81]
  - - [1856, 1856, 1, 1280]
    - [43, 9360.7]
  - - [32, 5888, 1, 32]
    - [70, 376.832]
  - - [2368, 2368, 1, 3328]
    - [43, 9813.99]
  - - [4288, 704, 1, 1]
    - [85, 146.826]
  - - [4288, 2944, 1, 3328]
    - [42, 10052.5]
  - - [1024, 128, 1, 3328]
    - [32, 5129.44]
  - - [4288, 128, 1, 3328]
    - [6, 6961.2]
  - - [4288, 704, 1, 32]
    - [63, 2526.15]
  - - [1856, 1024, 1, 32]
    - [60, 2190.83]
  - - [1, 448, 1, 3328]
    - [97, 4.97379]
  - - [2944, 6784, 1, 1]
    - [81, 251.411]
  - - [6784, 2368, 1, 32]
    - [60, 3556.06]
  - - [5888, 5056, 1, 1]
    - [81, 255.227]
  - - [128, 6784, 1, 1280]
    - [1, 8054.28]
  - - [6784, 6784, 1, 1]
    - [76, 267.823]
  - - [1856, 32, 1, 1280]
    - [75, 659.453]
  - - [5888, 448, 1, 3328]
    - [37, 8909.1]
  - - [704, 5888, 1, 32]
    - [60, 2945.05]
  - - [704, 5888, 1, 1280]
    - [42, 9940.41]
  - - [1024, 6784, 1, 3328]
    - [42, 10136.0]
  - - [704, 2944, 1, 1280]
    - [42, 9545.54]
  - - [3584, 256, 1, 32]
    - [65, 1542.02]
  - - [1408, 1408, 1, 32]
    - [60, 2298.51]
  - - [1024, 64, 1, 256]
    - [3, 1872.46]
  - - [4288, 64, 1, 32]
    - [70, 673.453]
  - - [5888, 6784, 1, 32]
    - [60, 3800.59]
  - - [5888, 128, 1, 256]
    - [2, 7199.18]
  - - [64, 704, 1, 1280]
    - [12, 1937.89]
  - - [2944, 1856, 1, 256]
    - [37, 9390.44]
  - - [128, 5056, 1, 3328]
    - [9, 8099.33]
  - - [4288, 2944, 1, 1]
    - [77, 231.037]
  - - [6784, 5056, 1, 32]
    - [60, 3747.6]
  - - [64, 1024, 1, 3328]
    - [12, 2950.54]
  - - [3584, 128, 1, 1]
    - [92, 40.6695]
  - - [2944, 4288, 1, 1280]
    - [42, 9978.85]
  - - [64, 32, 1, 3328]
    - [75, 24.6661]
  - - [1024, 4288, 1, 256]
    - [37, 9317.58]
  - - [128, 2368, 1, 256]
    - [8, 4801.65]
  - - [2368, 64, 1, 32]
    - [68, 304.627]
  - - [1408, 1, 1, 3328]
    - [97, 15.5572]
  - - [64, 1408, 1, 32]
    - [68, 182.044]
  - - [2368, 5888, 1, 1]
    - [82, 219.502]
  - - [1408, 1856, 1, 32]
    - [70, 2252.8]
  - - [256, 4288, 1, 32]
    - [63, 1708.53]
  - - [1856, 6784, 1, 3328]
    - [42, 10026.6]
  - - [3584, 128, 1, 256]
    - [18, 5734.4]
  - - [1024, 448, 1, 1280]
    - [42, 6840.66]
  - - [128, 5888, 1, 1]
    - [84, 63.2268]
  - - [32, 2368, 1, 1280]
    - [75, 814.248]
  - - [64, 32, 1, 32]
    - [65, 4.26667]
  - - [1408, 704, 1, 1]
    - [79, 74.641]
  - - [64, 448, 1, 1]
    - [95, 2.54184]
  - - [3584, 5888, 1, 32]
    - [60, 3733.32]
  - - [3584, 5888, 1, 1280]
    - [42, 10136.9]
  - - [448, 5888, 1, 1]
    - [86, 111.395]
  - - [64, 5056, 1, 32]
    - [70, 743.871]
  - - [2944, 64, 1, 1]
    - [79, 15.0013]
  - - [1408, 704, 1, 32]
    - [68, 1645.2]
  - - [1408, 704, 1, 1280]
    - [42, 8449.47]
  - - [2368, 5888, 1, 256]
    - [19, 9680.39]
  - - [2944, 64, 1, 32]
    - [65, 307.618]
  - - [1, 1408, 1, 256]
    - [92, 9.79478]
  - - [64, 2944, 1, 256]
    - [8, 4019.54]
  - - [5888, 5888, 1, 32]
    - [60, 3855.27]
  - - [1856, 1408, 1, 3328]
    - [42, 9896.32]
  - - [1024, 1024, 1, 32]
    - [65, 1698.1]
  - - [4288, 1024, 1, 1]
    - [77, 174.797]
  - - [704, 4288, 1, 3328]
    - [42, 9640.72]
  - - [2944, 5056, 1, 1280]
    - [43, 10018.8]
  - - [6784, 2944, 1, 1280]
    - [39, 10023.0]
  - - [6784, 256, 1, 3328]
    - [42, 9041.02]
  - - [5056, 128, 1, 3328]
    - [9, 8062.95]
  - - [128, 128, 1, 1280]
    - [16, 722.16]
  - - [128, 4288, 1, 1]
    - [85, 49.0057]
  - - [1408, 5056, 1, 32]
    - [60, 3265.53]
  - - [2944, 128, 1, 3328]
    - [26, 6979.61]
  - - [5888, 1856, 1, 1280]
    - [43, 10094.1]
  - - [64, 128, 1, 256]
    - [3, 225.986]
  - - [5888, 256, 1, 1280]
    - [42, 8886.24]
  - - [1856, 5056, 1, 1]
    - [77, 220.074]
  - - [3584, 1856, 1, 1280]
    - [43, 9822.83]
  - - [704, 3584, 1, 256]
    - [42, 8766.6]
  - - [1856, 5056, 1, 32]
    - [60, 3421.67]
  - - [1856, 5056, 1, 3328]
    - [42, 10123.2]
  - - [1024, 2944, 1, 32]
    - [60, 2644.44]
  - - [1408, 6784, 1, 256]
    - [37, 9672.78]
  - - [1024, 2368, 1, 1280]
    - [42, 9083.89]
  - - [448, 6784, 1, 1]
    - [82, 150.756]
  - - [5888, 128, 1, 1280]
    - [10, 8175.34]
  - - [2944, 5888, 1, 1280]
    - [42, 10061.2]
  - - [1, 1856, 1, 1]
    - [77, 0.169343]
  - - [3584, 3584, 1, 256]
    - [37, 9710.41]
  - - [1856, 2368, 1, 3328]
    - [42, 10029.2]
  - - [5888, 704, 1, 256]
    - [19, 9275.86]
  - - [64, 448, 1, 32]
    - [68, 76.4587]
  - - [6784, 4288, 1, 256]
    - [43, 9872.44]
  - - [128, 64, 1, 3328]
    - [12, 371.633]
  - - [2944, 64, 1, 1280]
    - [8, 5562.1]
  - - [1, 5056, 1, 1280]
    - [97, 35.6999]
  - - [32, 64, 1, 1280]
    - [75, 22.583]
  - - [1408, 2368, 1, 3328]
    - [42, 9858.58]
  - - [1024, 3584, 1, 256]
    - [43, 9387.73]
  - - [2944, 128, 1, 256]
    - [9, 5506.22]
  - - [6784, 128, 1, 1]
    - [76, 66.5914]
  - - [1408, 256, 1, 3328]
    - [42, 5541.26]
  - - [448, 32, 1, 256]
    - [70, 107.942]
  - - [1, 5888, 1, 256]
    - [97, 34.8274]
  - - [64, 2368, 1, 256]
    - [25, 3344.6]
  - - [448, 1856, 1, 256]
    - [42, 6426.96]
  - - [2944, 256, 1, 256]
    - [42, 7114.23]
  - - [1, 128, 1, 256]
    - [92, 0.892375]
  - - [32, 256, 1, 1280]
    - [75, 88.4426]
  - - [32, 128, 1, 3328]
    - [75, 48.9496]
  - - [6784, 64, 1, 1280]
    - [6, 6616.02]
  - - [4288, 1024, 1, 32]
    - [60, 2912.71]
  - - [2944, 1, 1, 1280]
    - [92, 28.7395]
  - - [1408, 64, 1, 3328]
    - [35, 3693.26]
  - - [2944, 448, 1, 1280]
    - [42, 7827.37]
  - - [6784, 32, 1, 1280]
    - [75, 1686.94]
  - - [1024, 704, 1, 1280]
    - [42, 7835.83]
  - - [704, 448, 1, 1]
    - [91, 29.6421]
  - - [32, 128, 1, 32]
    - [65, 8.35918]
  - - [1, 128, 1, 1]
    - [77, 0.0115108]
  - - [5888, 1, 1, 1]
    - [85, 0.598374]
  - - [5888, 1856, 1, 3328]
    - [43, 9891.85]
  - - [32, 2368, 1, 3328]
    - [70, 883.735]
  - - [4288, 1408, 1, 3328]
    - [43, 9720.94]
  - - [1856, 64, 1, 1]
    - [79, 9.9651]
  - - [1856, 32, 1, 3328]
    - [75, 710.586]
  - - [2944, 32, 1, 256]
    - [70, 682.049]
  - - [128, 64, 1, 1]
    - [91, 0.726241]
  - - [256, 1024, 1, 3328]
    - [30, 6220.87]
  - - [32, 448, 1, 256]
    - [70, 105.703]
  - - [1856, 64, 1, 32]
    - [65, 241.186]
  - - [1856, 64, 1, 3328]
    - [14, 4683.81]
  - - [256, 5056, 1, 256]
    - [42, 8201.73]
  - - [5888, 2944, 1, 3328]
    - [38, 9955.75]
  - - [2368, 1408, 1, 3328]
    - [37, 9607.28]
  - - [5888, 704, 1, 32]
    - [63, 2772.68]
  - - [2944, 704, 1, 1]
    - [82, 123.958]
  - - [6784, 1856, 1, 256]
    - [37, 9552.28]
  - - [1, 704, 1, 256]
    - [92, 4.95121]
  - - [448, 5056, 1, 1]
    - [77, 129.879]
  - - [3584, 448, 1, 32]
    - [70, 2007.04]
  - - [2368, 1856, 1, 1]
    - [77, 176.648]
  - - [128, 704, 1, 256]
    - [13, 2464.6]
  - - [256, 1408, 1, 3328]
    - [42, 5535.12]
  - - [2944, 128, 1, 1]
    - [85, 36.5147]
  - - [32, 256, 1, 3328]
    - [75, 97.843]
  - - [2944, 704, 1, 3328]
    - [19, 9429.04]
  - - [704, 1024, 1, 32]
    - [67, 1334.99]
  - - [2368, 1856, 1, 32]
    - [60, 2901.0]
  - - [5056, 4288, 1, 3328]
    - [37, 10213.4]
  - - [256, 32, 1, 32]
    - [70, 24.4537]
  - - [64, 256, 1, 3328]
    - [16, 776.281]
  - - [256, 6784, 1, 1]
    - [83, 108.004]
  - - [704, 5056, 1, 256]
    - [37, 9097.57]
  - - [1024, 3584, 1, 32]
    - [60, 2861.61]
  - - [256, 6784, 1, 32]
    - [60, 2086.13]
  - - [2944, 1408, 1, 32]
    - [60, 2924.27]
  - - [1024, 32, 1, 256]
    - [70, 252.062]
  - - [4288, 3584, 1, 1]
    - [82, 228.421]
  - - [1, 704, 1, 1]
    - [82, 0.0637681]
  - - [5056, 448, 1, 3328]
    - [42, 9318.39]
  - - [3584, 64, 1, 256]
    - [6, 4421.71]
  - - [64, 1856, 1, 32]
    - [65, 239.968]
  - - [64, 1856, 1, 3328]
    - [14, 4670.52]
  - - [5888, 5888, 1, 3328]
    - [42, 10240.0]
  - - [4288, 1856, 1, 256]
    - [37, 9407.94]
  - - [1856, 2944, 1, 256]
    - [37, 9513.06]
  - - [128, 448, 1, 1]
    - [82, 4.81074]
  - - [64, 128, 1, 32]
    - [65, 16.0627]
  - - [704, 1, 1, 1280]
    - [92, 6.93169]
  - - [5056, 5888, 1, 1280]
    - [42, 10187.0]
  - - [2944, 5888, 1, 1]
    - [76, 239.954]
  - - [1024, 1856, 1, 3328]
    - [42, 8890.43]
  - - [5888, 1024, 1, 32]
    - [60, 3169.15]
  - - [3584, 256, 1, 1280]
    - [42, 7767.23]
  - - [1024, 1, 1, 1]
    - [77, 0.0920863]
  - - [1408, 5056, 1, 1280]
    - [39, 9937.32]
  - - [3584, 128, 1, 1280]
    - [24, 6944.21]
  - - [5056, 6784, 1, 256]
    - [19, 9857.17]
  - - [64, 4288, 1, 256]
    - [8, 4526.71]
  - - [5888, 32, 1, 1280]
    - [75, 1486.52]
  - - [256, 128, 1, 32]
    - [69, 71.2348]
  - - [32, 1856, 1, 1280]
    - [75, 655.812]
  - - [2944, 5056, 1, 1]
    - [76, 222.03]
  - - [448, 128, 1, 1]
    - [77, 4.74702]
  - - [256, 704, 1, 32]
    - [62, 335.3]
  - - [1, 2368, 1, 1]
    - [77, 0.205556]
  - - [5888, 5888, 1, 1280]
    - [43, 10157.0]
  - - [256, 2944, 1, 1280]
    - [42, 8192.0]
  - - [2944, 256, 1, 3328]
    - [42, 8265.86]
  - - [5056, 2944, 1, 1280]
    - [39, 10001.2]
  - - [704, 1024, 1, 3328]
    - [42, 8005.68]
  - - [2368, 1856, 1, 1280]
    - [42, 9758.55]
  - - [1856, 128, 1, 256]
    - [6, 4721.85]
  - - [6784, 2944, 1, 1]
    - [76, 251.918]
  - - [2944, 1024, 1, 32]
    - [60, 2679.69]
  - - [2944, 1024, 1, 1280]
    - [43, 9367.74]
  - - [1408, 64, 1, 32]
    - [68, 180.224]
  - - [5056, 5056, 1, 1]
    - [77, 247.513]
  - - [2368, 4288, 1, 256]
    - [37, 9601.88]
  - - [448, 1856, 1, 1280]
    - [42, 7129.59]
  - - [256, 3584, 1, 1]
    - [77, 73.9923]
  - - [448, 2944, 1, 32]
    - [70, 1844.63]
  - - [448, 2944, 1, 1280]
    - [42, 7924.37]
  - - [2944, 6784, 1, 1280]
    - [37, 10081.2]
  - - [256, 6784, 1, 1280]
    - [42, 9045.33]
  - - [3584, 2368, 1, 32]
    - [60, 3318.44]
  - - [704, 32, 1, 32]
    - [65, 46.6902]
  - - [6784, 3584, 1, 3328]
    - [42, 10257.0]
  - - [128, 32, 1, 256]
    - [70, 30.8405]
  - - [128, 1408, 1, 1280]
    - [25, 5339.97]
  - - [6784, 3584, 1, 32]
    - [60, 3688.11]
  - - [128, 1856, 1, 3328]
    - [15, 6310.87]
  - - [2944, 2944, 1, 256]
    - [43, 9475.52]
  - - [1408, 1024, 1, 3328]
    - [42, 8767.51]
  - - [5056, 2368, 1, 1280]
    - [19, 10069.5]
  - - [448, 128, 1, 32]
    - [65, 114.688]
  - - [32, 5056, 1, 3328]
    - [75, 1307.16]
  - - [1024, 5056, 1, 1280]
    - [43, 10010.6]
  - - [2944, 1024, 1, 1]
    - [84, 151.948]
  - - [2368, 128, 1, 1280]
    - [8, 6009.5]
  - - [2368, 5888, 1, 3328]
    - [19, 10066.1]
  - - [448, 5056, 1, 256]
    - [42, 8639.19]
  - - [4288, 2368, 1, 1]
    - [77, 222.285]
  - - [1408, 3584, 1, 32]
    - [60, 3039.92]
  - - [2944, 4288, 1, 32]
    - [66, 3449.15]
  - - [5888, 1408, 1, 1280]
    - [42, 9962.05]
  - - [3584, 5056, 1, 1280]
    - [43, 10113.0]
  - - [2368, 448, 1, 1]
    - [77, 79.8843]
  - - [448, 704, 1, 1]
    - [86, 28.9882]
  - - [704, 128, 1, 32]
    - [65, 184.845]
  - - [3584, 2944, 1, 1]
    - [76, 227.007]
  - - [2944, 5888, 1, 256]
    - [37, 9663.71]
  - - [2944, 32, 1, 32]
    - [65, 187.479]
  - - [256, 4288, 1, 3328]
    - [42, 7867.93]
  - - [4288, 64, 1, 1]
    - [86, 24.5029]
  - - [1, 1408, 1, 1280]
    - [97, 14.3673]
  - - [6784, 1408, 1, 32]
    - [60, 3445.22]
  - - [1856, 704, 1, 32]
    - [61, 1840.32]
  - - [1024, 1856, 1, 1]
    - [77, 118.784]
  - - [704, 5056, 1, 3328]
    - [42, 9811.94]
  - - [1024, 3584, 1, 3328]
    - [42, 10112.8]
  - - [5888, 256, 1, 3328]
    - [42, 9018.38]
  - - [2368, 256, 1, 1280]
    - [42, 6531.53]
  - - [1856, 1408, 1, 1]
    - [77, 139.003]
  - - [2944, 448, 1, 32]
    - [65, 1788.36]
  - - [128, 448, 1, 256]
    - [4, 1699.08]
  - - [128, 1024, 1, 1]
    - [82, 10.996]
  - - [32, 32, 1, 256]
    - [70, 7.7283]
  - - [4288, 5056, 1, 1280]
    - [42, 10163.2]
  - - [1856, 1856, 1, 3328]
    - [42, 9486.99]
  - - [1024, 2368, 1, 256]
    - [19, 8508.18]
  - - [4288, 2368, 1, 3328]
    - [43, 9898.66]
  - - [256, 64, 1, 32]
    - [70, 45.5111]
  - - [1, 1024, 1, 1280]
    - [97, 10.4824]
  - - [64, 32, 1, 1280]
    - [75, 22.5986]
  - - [1024, 32, 1, 3328]
    - [70, 388.251]
  - - [5888, 3584, 1, 256]
    - [39, 9755.6]
  - - [1024, 5056, 1, 32]
    - [60, 3068.06]
  - - [704, 5888, 1, 3328]
    - [42, 10051.8]
  - - [1024, 1408, 1, 256]
    - [42, 7846.49]
  - - [3584, 2944, 1, 1280]
    - [43, 9755.03]
  - - [1, 5056, 1, 256]
    - [97, 29.6322]
  - - [256, 1024, 1, 1]
    - [82, 23.9182]
  - - [32, 32, 1, 3328]
    - [75, 12.3366]
  - - [5056, 128, 1, 32]
    - [67, 1262.77]
  - - [2368, 1, 1, 3328]
    - [97, 26.1644]
  - - [4288, 1856, 1, 1280]
    - [42, 9868.74]
  - - [3584, 5888, 1, 1]
    - [81, 247.916]
  - - [5888, 4288, 1, 256]
    - [39, 9781.2]
  - - [1024, 2944, 1, 1280]
    - [42, 9494.98]
  - - [6784, 1, 1, 1]
    - [82, 0.695082]
  - - [1408, 64, 1, 1280]
    - [12, 3432.84]
  - - [1, 256, 1, 1280]
    - [92, 2.54252]
  - - [2944, 3584, 1, 256]
    - [37, 9503.0]
  - - [1, 128, 1, 1280]
    - [97, 1.30696]
  - - [1024, 256, 1, 32]
    - [70, 609.637]
  - - [2368, 32, 1, 1280]
    - [70, 829.854]
  - - [5888, 1856, 1, 1]
    - [76, 225.788]
  - - [1408, 1408, 1, 3328]
    - [42, 9261.15]
  - - [448, 2368, 1, 1280]
    - [42, 7490.65]
  - - [6784, 2368, 1, 3328]
    - [39, 10164.3]
  - - [1, 64, 1, 256]
    - [92, 0.449123]
  - - [704, 128, 1, 1]
    - [77, 7.61081]
  - - [1408, 4288, 1, 32]
    - [60, 3165.14]
  - - [256, 64, 1, 1280]
    - [16, 722.16]
  - - [256, 448, 1, 256]
    - [13, 3058.35]
  - - [1856, 1024, 1, 1280]
    - [42, 8740.64]
  - - [4288, 3584, 1, 1280]
    - [37, 10088.2]
  - - [448, 1024, 1, 1280]
    - [42, 6853.44]
  - - [1024, 448, 1, 3328]
    - [42, 7039.5]
  - - [5056, 1856, 1, 1]
    - [77, 202.94]
  - - [5888, 2368, 1, 256]
    - [43, 9709.87]
  - - [1408, 1024, 1, 32]
    - [60, 1948.37]
  - - [32, 704, 1, 256]
    - [75, 160.556]
  - - [2944, 1, 1, 256]
    - [92, 20.2163]
  - - [32, 4288, 1, 256]
    - [75, 817.675]
  - - [5056, 1856, 1, 32]
    - [60, 3384.65]
  - - [5056, 1856, 1, 1280]
    - [42, 10044.3]
  - - [1, 64, 1, 1]
    - [82, 0.0057971]
  - - [1408, 5888, 1, 3328]
    - [39, 10229.2]
  - - [1408, 704, 1, 3328]
    - [42, 8610.41]
  - - [5056, 704, 1, 3328]
    - [42, 9624.43]
  - - [704, 64, 1, 1280]
    - [12, 1932.7]
  - - [1, 704, 1, 1280]
    - [97, 7.20665]
  - - [5888, 6784, 1, 1]
    - [84, 262.101]
  - - [5888, 4288, 1, 32]
    - [60, 3661.75]
  - - [1408, 3584, 1, 256]
    - [39, 9307.25]
  - - [64, 5056, 1, 1]
    - [85, 30.6424]
  - - [6784, 256, 1, 1]
    - [78, 111.327]
  - - [2944, 1, 1, 1]
    - [77, 0.245333]
  - - [256, 1856, 1, 3328]
    - [42, 7293.6]
  - - [4288, 128, 1, 1280]
    - [6, 6818.19]
  - - [6784, 256, 1, 1280]
    - [42, 8903.3]
  - - [128, 4288, 1, 256]
    - [6, 6014.95]
  - - [2368, 6784, 1, 1280]
    - [19, 10062.7]
  - - [128, 128, 1, 32]
    - [75, 45.8294]
  - - [128, 1408, 1, 32]
    - [61, 344.926]
  - - [6784, 128, 1, 32]
    - [67, 1497.16]
  - - [1408, 448, 1, 1]
    - [79, 55.1385]
  - - [2368, 1024, 1, 1]
    - [82, 134.713]
  - - [2368, 704, 1, 3328]
    - [42, 8679.62]
  - - [5888, 1, 1, 1280]
    - [97, 41.4101]
  - - [2944, 1856, 1, 32]
    - [68, 2914.17]
  - - [1024, 64, 1, 1]
    - [79, 5.49799]
  - - [1408, 32, 1, 1280]
    - [75, 489.739]
  - - [704, 1, 1, 256]
    - [92, 5.03982]
  - - [2368, 1408, 1, 256]
    - [37, 9011.2]
  - - [128, 3584, 1, 1]
    - [82, 42.1647]
  - - [4288, 1408, 1, 1]
    - [77, 195.515]
  - - [5888, 64, 1, 256]
    - [26, 5531.48]
  - - [64, 5056, 1, 1280]
    - [8, 6329.27]
  - - [1408, 2944, 1, 1]
    - [76, 172.715]
  - - [4288, 1408, 1, 32]
    - [60, 3207.17]
  - - [5888, 2944, 1, 256]
    - [37, 9658.65]
  - - [128, 64, 1, 1280]
    - [3, 334.367]
  - - [1408, 2944, 1, 32]
    - [66, 2863.66]
  - - [1, 3584, 1, 1280]
    - [97, 35.1157]
  - - [64, 64, 1, 32]
    - [65, 8.03137]
  - - [448, 1408, 1, 32]
    - [68, 1224.82]
  - - [128, 5056, 1, 256]
    - [9, 6767.77]
  - - [1, 1, 1, 1280]
    - [97, 0.0102041]
  - - [64, 704, 1, 256]
    - [12, 1360.18]
  - - [5888, 6784, 1, 256]
    - [43, 9891.75]
  - - [6784, 5888, 1, 1]
    - [76, 264.601]
  - - [1, 448, 1, 1280]
    - [97, 4.58312]
  - - [1024, 1024, 1, 1]
    - [77, 79.4376]
  - - [1856, 704, 1, 1]
    - [86, 93.8667]
  - - [6784, 5888, 1, 1280]
    - [39, 10203.3]
  - - [1024, 4288, 1, 32]
    - [61, 2837.42]
  - - [1856, 1, 1, 1280]
    - [97, 19.0603]
  - - [3584, 5888, 1, 256]
    - [43, 9748.55]
  - - [5056, 2368, 1, 1]
    - [77, 228.834]
  - - [256, 1408, 1, 1280]
    - [42, 5399.97]
  - - [64, 256, 1, 32]
    - [65, 43.9839]
  - - [64, 5888, 1, 3328]
    - [8, 6684.95]
  - - [6784, 64, 1, 3328]
    - [24, 6774.84]
  - - [5056, 448, 1, 1]
    - [77, 131.081]
  - - [2944, 448, 1, 3328]
    - [42, 7922.99]
  - - [2368, 1024, 1, 1280]
    - [42, 8943.59]
  - - [1856, 6784, 1, 256]
    - [37, 9550.02]
  - - [4288, 32, 1, 1280]
    - [75, 1089.56]
  - - [448, 1408, 1, 1280]
    - [42, 6875.03]
  - - [5056, 448, 1, 32]
    - [63, 2253.82]
  - - [3584, 2944, 1, 32]
    - [60, 3511.25]
  - - [2368, 128, 1, 1]
    - [86, 29.1446]
  - - [3584, 1856, 1, 32]
    - [60, 3171.35]
  - - [128, 128, 1, 3328]
    - [16, 777.166]
  - - [5056, 64, 1, 256]
    - [8, 4954.4]
  - - [64, 448, 1, 3328]
    - [16, 1346.22]
  - - [4288, 1408, 1, 1280]
    - [43, 9637.83]
  - - [32, 5056, 1, 256]
    - [75, 1031.34]
  - - [704, 128, 1, 256]
    - [5, 2485.85]
  - - [704, 5056, 1, 1]
    - [89, 142.15]
  - - [256, 1024, 1, 32]
    - [75, 624.152]
  - - [256, 1024, 1, 1280]
    - [21, 5924.16]
  - - [2368, 128, 1, 256]
    - [8, 4801.65]
  - - [2368, 1408, 1, 1280]
    - [42, 9579.15]
  - - [128, 256, 1, 32]
    - [74, 71.2348]
  - - [64, 6784, 1, 32]
    - [70, 918.891]
  - - [6784, 32, 1, 256]
    - [75, 1364.8]
  - - [256, 4288, 1, 1]
    - [78, 84.1816]
  - - [5888, 1408, 1, 1]
    - [90, 190.494]
  - - [1024, 4288, 1, 1280]
    - [42, 9928.57]
  - - [1856, 4288, 1, 1]
    - [77, 190.213]
  - - [128, 2944, 1, 256]
    - [9, 5556.97]
  - - [3584, 4288, 1, 256]
    - [37, 9686.47]
  - - [3584, 128, 1, 32]
    - [70, 926.772]
  - - [3584, 128, 1, 3328]
    - [6, 7131.57]
  - - [4288, 448, 1, 3328]
    - [39, 8752.0]
  - - [1856, 4288, 1, 32]
    - [60, 3235.17]
  - - [64, 256, 1, 1280]
    - [16, 718.203]
  - - [4288, 1024, 1, 1280]
    - [37, 9710.37]
  - - [1, 4288, 1, 256]
    - [97, 25.3634]
  - - [64, 2368, 1, 1]
    - [82, 12.3817]
  - - [4288, 6784, 1, 32]
    - [60, 3826.35]
  - - [256, 6784, 1, 3328]
    - [42, 9173.04]
  - - [128, 2944, 1, 1]
    - [77, 35.6848]
  - - [3584, 1408, 1, 256]
    - [43, 9185.48]
  - - [704, 3584, 1, 3328]
    - [42, 9573.37]
  - - [5056, 448, 1, 1280]
    - [42, 9212.36]
  - - [1408, 2944, 1, 1280]
    - [43, 9916.63]
  - - [5888, 704, 1, 1280]
    - [43, 9777.73]
  - - [64, 64, 1, 256]
    - [3, 107.436]
  - - [704, 1408, 1, 1280]
    - [42, 8454.0]
  - - [4288, 5888, 1, 256]
    - [39, 9769.37]
  - - [6784, 64, 1, 32]
    - [68, 943.861]
  - - [3584, 3584, 1, 3328]
    - [42, 10217.9]
  - - [2944, 6784, 1, 32]
    - [60, 3715.74]
  - - [448, 64, 1, 32]
    - [65, 56.4965]
  - - [5056, 256, 1, 1]
    - [76, 93.5214]
  - - [64, 6784, 1, 1280]
    - [6, 6584.66]
  - - [2944, 2368, 1, 3328]
    - [37, 9938.31]
  - - [1, 4288, 1, 1]
    - [85, 0.432258]
  - - [1408, 128, 1, 256]
    - [8, 4061.39]
  - - [1024, 1856, 1, 1280]
    - [42, 8765.84]
  - - [1024, 5888, 1, 256]
    - [37, 9642.08]
  - - [704, 1408, 1, 256]
    - [42, 7516.45]
  - - [6784, 2944, 1, 3328]
    - [42, 10166.9]
  - - [1408, 2368, 1, 256]
    - [37, 9119.03]
  - - [64, 128, 1, 1280]
    - [3, 335.223]
  - - [5888, 32, 1, 3328]
    - [75, 1516.95]
  - - [1408, 5056, 1, 256]
    - [39, 9519.56]
  - - [1024, 1408, 1, 32]
    - [68, 1968.32]
  - - [4288, 128, 1, 32]
    - [67, 1143.47]
  - - [6784, 704, 1, 1]
    - [77, 179.817]
  - - [448, 704, 1, 256]
    - [42, 4086.05]
  - - [704, 3584, 1, 32]
    - [66, 2461.6]
  - - [1856, 256, 1, 3328]
    - [42, 7293.6]
  - - [6784, 448, 1, 256]
    - [43, 8914.34]
  - - [4288, 4288, 1, 1]
    - [77, 244.768]
  - - [5056, 2944, 1, 1]
    - [82, 237.02]
  - - [64, 2368, 1, 3328]
    - [5, 4758.16]
  - - [256, 704, 1, 3328]
    - [21, 4223.84]
  - - [1, 2944, 1, 1]
    - [82, 0.252055]
  - - [1024, 1024, 1, 256]
    - [42, 7895.16]
  - - [3584, 1, 1, 1]
    - [86, 0.367213]
  - - [256, 2944, 1, 32]
    - [68, 1382.87]
  - - [6784, 4288, 1, 3328]
    - [42, 10289.6]
  - - [5056, 2944, 1, 3328]
    - [42, 10199.3]
  - - [704, 1024, 1, 1280]
    - [42, 7835.83]
  - - [256, 3584, 1, 1280]
    - [42, 7829.37]
  - - [2368, 1856, 1, 3328]
    - [42, 9857.78]
  - - [1856, 4288, 1, 1280]
    - [37, 10024.1]
  - - [1, 1024, 1, 256]
    - [92, 7.20176]
  - - [3584, 448, 1, 1]
    - [82, 104.533]
  - - [2944, 1024, 1, 3328]
    - [42, 9460.59]
  - - [32, 1408, 1, 3328]
    - [75, 536.135]
  - - [128, 1, 1, 3328]
    - [97, 1.41316]
  - - [5888, 5056, 1, 32]
    - [60, 3744.62]
  - - [704, 2944, 1, 1]
    - [79, 122.783]
  - - [3584, 448, 1, 1280]
    - [42, 8244.58]
  - - [2944, 6784, 1, 3328]
    - [42, 10158.4]
  - - [1856, 2368, 1, 1280]
    - [42, 9904.24]
  - - [6784, 1024, 1, 1280]
    - [42, 9866.75]
  - - [6784, 3584, 1, 1280]
    - [42, 10186.5]
  - - [1, 5056, 1, 3328]
    - [97, 36.5156]
  - - [448, 1856, 1, 1]
    - [77, 67.0555]
  - - [128, 2368, 1, 32]
    - [70, 704.893]
  - - [128, 1408, 1, 3328]
    - [8, 5632.85]
  - - [704, 1856, 1, 256]
    - [42, 8230.7]
  - - [448, 2368, 1, 1]
    - [78, 80.3685]
  - - [1408, 4288, 1, 256]
    - [43, 9364.98]
  - - [256, 5056, 1, 3328]
    - [42, 9269.13]
  - - [2368, 64, 1, 1280]
    - [5, 4523.94]
  - - [1856, 448, 1, 32]
    - [67, 1465.18]
  - - [32, 128, 1, 256]
    - [70, 30.4111]
  - - [448, 1024, 1, 1]
    - [85, 40.96]
  - - [128, 1024, 1, 1280]
    - [14, 4821.04]
  - - [704, 2944, 1, 256]
    - [42, 8749.66]
  - - [1408, 1408, 1, 256]
    - [43, 8458.51]
  - - [448, 6784, 1, 32]
    - [60, 2677.74]
  - - [1, 64, 1, 1280]
    - [97, 0.653061]
  - - [448, 2944, 1, 1]
    - [76, 93.1435]
  - - [4288, 448, 1, 32]
    - [70, 2176.8]
  - - [4288, 448, 1, 1280]
    - [42, 8731.93]
  - - [2944, 704, 1, 32]
    - [61, 2210.75]
  - - [5888, 448, 1, 1280]
    - [42, 8900.28]
  - - [448, 4288, 1, 1]
    - [77, 119.467]
  - - [3584, 5056, 1, 1]
    - [81, 246.473]
  - - [64, 5888, 1, 1]
    - [85, 35.9573]
  - - [1408, 3584, 1, 1280]
    - [43, 9753.61]
  - - [6784, 448, 1, 1280]
    - [43, 9429.45]
  - - [3584, 5056, 1, 3328]
    - [42, 10129.8]
  - - [2368, 2368, 1, 32]
    - [60, 3123.91]
  - - [64, 5888, 1, 32]
    - [68, 846.813]
  - - [1856, 448, 1, 256]
    - [37, 6335.15]
  - - [3584, 2368, 1, 1280]
    - [42, 9894.38]
  - - [128, 1024, 1, 256]
    - [13, 3410.0]
  - - [3584, 64, 1, 3328]
    - [15, 6108.86]
  - - [5888, 2944, 1, 32]
    - [60, 3647.4]
  - - [1856, 2944, 1, 32]
    - [60, 3126.79]
  - - [5056, 1408, 1, 1]
    - [77, 202.701]
  - - [5888, 1408, 1, 3328]
    - [43, 10061.2]
  - - [448, 4288, 1, 256]
    - [42, 8174.57]
  - - [6784, 1024, 1, 1]
    - [81, 204.318]
  - - [256, 448, 1, 1]
    - [77, 9.36993]
  - - [128, 5888, 1, 3328]
    - [42, 8367.34]
  - - [6784, 1024, 1, 32]
    - [60, 3261.42]
  - - [256, 448, 1, 32]
    - [63, 229.376]
  - - [6784, 3584, 1, 1]
    - [76, 249.731]
  - - [2944, 2368, 1, 32]
    - [60, 3257.66]
  - - [3584, 6784, 1, 3328]
    - [19, 10139.6]
  - - [5056, 1024, 1, 1]
    - [77, 187.043]
  - - [448, 128, 1, 1280]
    - [12, 2446.68]
  - - [64, 3584, 1, 32]
    - [70, 527.301]
  - - [64, 3584, 1, 1280]
    - [6, 5752.38]
  - - [6784, 1408, 1, 256]
    - [37, 9510.26]
  - - [5056, 1024, 1, 32]
    - [60, 3100.21]
  - - [256, 704, 1, 1280]
    - [21, 4078.62]
  - - [4288, 3584, 1, 256]
    - [37, 9696.01]
  - - [2368, 256, 1, 32]
    - [70, 1224.66]
  - - [2368, 256, 1, 3328]
    - [42, 6699.85]
  - - [448, 6784, 1, 1280]
    - [42, 9593.16]
  - - [1856, 5888, 1, 1]
    - [82, 225.788]
  - - [256, 5888, 1, 32]
    - [66, 2016.49]
  - - [3584, 1, 1, 3328]
    - [97, 39.9931]
  - - [4288, 32, 1, 256]
    - [75, 888.849]
  - - [256, 64, 1, 1]
    - [79, 1.8963]
  - - [4288, 5056, 1, 32]
    - [60, 3723.51]
  - - [4288, 5056, 1, 3328]
    - [19, 10111.9]
  - - [1856, 5888, 1, 32]
    - [60, 3513.87]
  - - [1856, 5888, 1, 1280]
    - [42, 10050.6]
  - - [256, 256, 1, 1280]
    - [12, 2702.52]
  - - [704, 2368, 1, 1280]
    - [42, 8668.56]
  - - [5056, 32, 1, 1280]
    - [75, 1260.31]
  - - [4288, 2368, 1, 1280]
    - [43, 9834.36]
  - - [2944, 5056, 1, 256]
    - [37, 9706.86]
  - - [32, 1856, 1, 256]
    - [70, 443.017]
  - - [64, 5888, 1, 1280]
    - [8, 6469.22]
  - - [1, 1856, 1, 1280]
    - [97, 19.0115]
  - - [2944, 4288, 1, 1]
    - [76, 221.627]
  - - [5056, 5888, 1, 32]
    - [60, 3755.25]
  - - [704, 1, 1, 3328]
    - [97, 7.78273]
  - - [448, 256, 1, 1280]
    - [14, 4199.1]
  - - [1408, 256, 1, 1]
    - [91, 34.1333]
  - - [2368, 5056, 1, 3328]
    - [39, 9755.75]
  - - [1024, 5056, 1, 3328]
    - [42, 10114.9]
  - - [704, 704, 1, 1280]
    - [42, 7362.91]
  - - [128, 32, 1, 3328]
    - [75, 49.3608]
  - - [1024, 6784, 1, 32]
    - [60, 3125.68]
  - - [3584, 2944, 1, 3328]
    - [43, 9808.57]
  - - [128, 1856, 1, 256]
    - [6, 4663.91]
  - - [32, 32, 1, 1280]
    - [75, 11.1078]
  - - [1408, 5888, 1, 1]
    - [81, 214.998]
  - - [1, 3584, 1, 256]
    - [92, 23.5016]
  - - [704, 4288, 1, 32]
    - [60, 2695.31]
  - - [1408, 5888, 1, 32]
    - [60, 3408.14]
  - - [6784, 1024, 1, 3328]
    - [37, 9902.59]
  - - [6784, 2368, 1, 1]
    - [76, 234.04]
  - - [1856, 1, 1, 3328]
    - [97, 20.6498]
  - - [5056, 1408, 1, 256]
    - [19, 9363.06]
  - - [1, 1, 1, 256]
    - [92, 0.00694143]
  - - [2944, 1408, 1, 256]
    - [43, 9308.41]
  - - [4288, 1, 1, 1]
    - [79, 0.439344]
  - - [2368, 2368, 1, 256]
    - [19, 9273.26]
  - - [1, 448, 1, 256]
    - [92, 3.15771]
  - - [1408, 6784, 1, 1]
    - [76, 223.593]
  - - [3584, 32, 1, 3328]
    - [70, 1331.94]
  - - [1856, 1, 1, 256]
    - [92, 13.1108]
  - - [6784, 6784, 1, 1280]
    - [43, 10271.3]
  - - [128, 128, 1, 1]
    - [82, 1.93208]
  - - [6784, 32, 1, 3328]
    - [75, 1743.75]
  - - [1408, 32, 1, 256]
    - [70, 339.245]
  - - [128, 3584, 1, 32]
    - [68, 986.563]
  - - [1856, 3584, 1, 256]
    - [19, 9536.78]
  - - [1024, 704, 1, 256]
    - [42, 6784.9]
  - - [2368, 704, 1, 32]
    - [63, 2039.23]
  - - [256, 5888, 1, 1280]
    - [42, 9025.92]
  - - [448, 2368, 1, 32]
    - [61, 1664.1]
  - - [448, 2368, 1, 3328]
    - [42, 7631.32]
  - - [64, 1408, 1, 256]
    - [13, 2464.6]
  - - [5056, 32, 1, 32]
    - [70, 404.48]
  - - [1024, 704, 1, 3328]
    - [42, 8016.38]
  - - [32, 5888, 1, 3328]
    - [75, 1508.78]
  - - [256, 64, 1, 3328]
    - [16, 775.397]
  - - [32, 1408, 1, 1280]
    - [75, 487.421]
  - - [64, 32, 1, 256]
    - [70, 15.384]
  - - [1856, 1024, 1, 3328]
    - [42, 8872.48]
  - - [2368, 1, 1, 1]
    - [82, 0.209929]
  - - [5056, 2368, 1, 3328]
    - [42, 10144.0]
  - - [128, 1, 1, 1280]
    - [97, 1.28967]
  - - [704, 4288, 1, 1280]
    - [42, 9522.88]
  - - [704, 256, 1, 256]
    - [21, 3186.28]
  - - [3136, 64, 128, 64]
    - [106, 15223.8]
  - - [3136, 256, 64, 64]
    - [106, 18012.3]
  - - [12544, 1024, 1, 256]
    - [102, 20780.7]
  - - [784, 128, 128, 512]
    - [101, 19837.9]
  - - [784, 512, 256, 128]
    - [105, 18471.7]
  - - [3136, 64, 64, 256]
    - [103, 19306.8]
  - - [12544, 256, 1, 1024]
    - [107, 17648.9]
  - - [3136, 256, 256, 64]
    - [109, 18095.6]
  - - [3136, 64, 128, 256]
    - [100, 19910.0]
  - - [784, 128, 64, 512]
    - [101, 19325.0]
  - - [3136, 64, 256, 64]
    - [106, 15429.5]
  - - [784, 512, 128, 128]
    - [99, 19136.0]
  - - [3136, 64, 64, 64]
    - [108, 14680.1]
  - - [784, 128, 256, 512]
    - [101, 20166.4]
  - - [3136, 64, 256, 256]
    - [103, 20048.3]
  - - [3136, 256, 128, 64]
    - [98, 18309.2]
  - - [4096, 7000, 1, 4096]
    - [138, 17060.9]
  - - [5124, 9124, 1, 1760]
    - [137, 17597.3]
  - - [1760, 32, 1, 1760]
    - [116, 2065.07]
  - - [1024, 1500, 1, 1536]
    - [130, 14247.0]
  - - [512, 24000, 1, 2048]
    - [140, 15569.1]
  - - [3072, 24000, 1, 1024]
    - [138, 17692.8]
  - - [1024, 3000, 1, 2560]
    - [138, 16608.2]
  - - [512, 3136, 1, 2048]
    - [149, 12702.2]
  - - [7680, 4, 1, 2560]
    - [116, 1128.63]
  - - [64, 193600, 1, 64]
    - [137, 13431.3]
  - - [8448, 1500, 1, 2816]
    - [137, 16834.1]
  - - [784, 512, 64, 128]
    - [151, 14218.0]
  - - [2560, 7000, 1, 2560]
    - [137, 17276.5]
  - - [3072, 16, 1, 1024]
    - [111, 1695.81]
  - - [512, 48000, 1, 2048]
    - [140, 15995.8]
  - - [1760, 64, 1, 1760]
    - [132, 4157.85]
  - - [1024, 16, 1, 512]
    - [113, 440.578]
  - - [196, 256, 64, 1024]
    - [150, 8949.31]
  - - [512, 48000, 1, 1536]
    - [138, 17684.6]
  - - [2560, 32, 1, 2560]
    - [116, 3037.59]
  - - [4608, 1500, 1, 1536]
    - [138, 16508.3]
  - - [2048, 128, 1, 2048]
    - [135, 8473.34]
  - - [1024, 24000, 1, 2560]
    - [137, 17746.8]
  - - [4608, 3000, 1, 1536]
    - [138, 16899.3]
  - - [5124, 9124, 1, 2048]
    - [138, 16332.6]
  - - [2048, 16, 1, 2048]
    - [115, 1217.5]
  - - [1024, 700, 1, 512]
    - [129, 9400.66]
  - - [3072, 1, 1, 128]
    - [111, 57.8259]
  - - [5124, 700, 1, 2560]
    - [138, 14715.1]
  - - [8448, 16, 1, 2816]
    - [112, 4678.38]
  - - [6144, 6000, 1, 2560]
    - [131, 16507.6]
  - - [4608, 32, 1, 1536]
    - [111, 5128.9]
  - - [3072, 64, 1, 1024]
    - [127, 6403.52]
  - - [512, 16, 1, 512]
    - [113, 220.289]
  - - [7680, 2, 1, 2560]
    - [116, 566.267]
  - - [4224, 1, 1, 128]
    - [111, 78.586]
  - - [7680, 1, 1, 2560]
    - [116, 283.46]
  - - [128, 1500, 1, 1280]
    - [111, 6536.17]
  - - [1024, 1500, 1, 2816]
    - [130, 14522.5]
  - - [6144, 2, 1, 2560]
    - [116, 450.419]
  - - [8448, 48000, 1, 2816]
    - [138, 15518.5]
  - - [512, 6000, 1, 2048]
    - [142, 12121.3]
  - - [4224, 1500, 1, 176]
    - [123, 14023.3]
  - - [1024, 6000, 1, 2816]
    - [137, 17591.4]
  - - [1024, 48000, 1, 1536]
    - [138, 18080.3]
  - - [1024, 48000, 1, 2560]
    - [137, 18254.9]
  - - [4096, 32, 1, 4096]
    - [117, 4827.98]
  - - [512, 16, 1, 500000]
    - [113, 330.658]
  - - [2560, 128, 1, 2560]
    - [132, 8673.08]
  - - [4608, 24000, 1, 1536]
    - [137, 18298.6]
  - - [512, 2, 1, 500000]
    - [113, 41.3314]
  - - [7680, 48000, 1, 2560]
    - [138, 15645.3]
  - - [3072, 48000, 1, 1024]
    - [138, 17986.4]
  - - [1760, 16, 1, 1760]
    - [111, 1035.99]
  - - [1024, 1500, 1, 2048]
    - [134, 11136.1]
  - - [1024, 16, 1, 500000]
    - [113, 661.008]
  - - [64, 193600, 1, 256]
    - [143, 15677.8]
  - - [1024, 3000, 1, 2048]
    - [139, 12173.9]
  - - [6144, 4, 1, 2560]
    - [116, 904.985]
  - - [1024, 6000, 1, 2048]
    - [140, 14556.8]
  - - [512, 24000, 1, 2816]
    - [137, 17783.8]
  - - [6144, 48000, 1, 2560]
    - [140, 14434.6]
  - - [1760, 7000, 1, 1760]
    - [124, 16687.6]
  - - [8448, 3000, 1, 2816]
    - [137, 17630.2]
  - - [3072, 4, 1, 1024]
    - [111, 423.953]
  - - [4608, 48000, 1, 1536]
    - [137, 18437.1]
  - - [2048, 32, 1, 2048]
    - [136, 2407.06]
  - - [7680, 1500, 1, 2560]
    - [138, 16260.4]
  - - [4096, 128, 1, 4096]
    - [128, 11511.0]
  - - [4608, 16, 1, 1536]
    - [116, 2655.87]
  - - [512, 3000, 1, 1536]
    - [130, 14260.7]
  - - [3072, 2, 1, 1024]
    - [111, 214.872]
  - - [8448, 1, 1, 2816]
    - [112, 289.834]
  - - [1024, 3000, 1, 2816]
    - [137, 17002.3]
  - - [128, 1, 1, 1408]
    - [111, 4.75274]
  - - [64, 1, 1, 1216]
    - [113, 2.11939]
  - - [1024, 2, 1, 512]
    - [113, 55.0723]
  - - [1024, 4, 1, 500000]
    - [113, 165.084]
  - - [6144, 1, 1, 2560]
    - [116, 226.768]
  - - [5124, 9124, 1, 2560]
    - [138, 17113.5]
  - - [512, 48000, 1, 2816]
    - [137, 18060.4]
  - - [512, 3000, 1, 2816]
    - [130, 14530.3]
  - - [1024, 24000, 1, 1536]
    - [138, 17629.1]
  - - [7680, 6000, 1, 2560]
    - [137, 17726.0]
  - - [1760, 128, 1, 1760]
    - [135, 7497.97]
  - - [512, 1500, 1, 2816]
    - [129, 11273.4]
  - - [512, 1, 1, 512]
    - [118, 16.1419]
  - - [512, 6000, 1, 2560]
    - [138, 16656.0]
  - - [512, 8, 1, 500000]
    - [113, 165.328]
  - - [512, 24000, 1, 2560]
    - [138, 17561.4]
  - - [6144, 3000, 1, 2560]
    - [140, 16106.6]
  - - [1024, 24000, 1, 2816]
    - [137, 18138.0]
  - - [2048, 7000, 1, 2048]
    - [140, 15826.5]
  - - [7680, 3000, 1, 2560]
    - [131, 16179.8]
  - - [1024, 4, 1, 512]
    - [113, 110.609]
  - - [5124, 700, 1, 2048]
    - [140, 13074.5]
  - - [5124, 9124, 1, 4096]
    - [131, 15808.6]
  - - [4096, 64, 1, 4096]
    - [136, 8409.63]
  - - [256, 193600, 1, 64]
    - [120, 14460.0]
  - - [7680, 32, 1, 2560]
    - [119, 8501.97]
  - - [2560, 64, 1, 2560]
    - [127, 5877.67]
  - - [3136, 2048, 1, 512]
    - [152, 15303.1]
  - - [3072, 128, 1, 1024]
    - [132, 9514.49]
  - - [8448, 6000, 1, 2816]
    - [138, 17792.5]
  - - [7680, 64, 1, 2560]
    - [113, 11163.0]
  - - [5124, 1500, 1, 2560]
    - [138, 16136.5]
  - - [1024, 1500, 1, 2560]
    - [130, 14448.0]
  - - [512, 4, 1, 512]
    - [118, 64.251]
  - - [1024, 6000, 1, 2560]
    - [138, 17205.6]
  - - [3072, 32, 1, 1024]
    - [136, 3364.41]
  - - [6144, 32, 1, 2560]
    - [127, 6883.43]
  - - [3136, 512, 1, 2048]
    - [150, 9484.12]
  - - [196, 1024, 64, 256]
    - [153, 12380.8]
  - - [512, 50176, 1, 128]
    - [145, 15888.7]
  - - [4608, 1, 1, 1536]
    - [116, 165.681]
  - - [1024, 32, 1, 512]
    - [113, 907.858]
  - - [7680, 24000, 1, 2560]
    - [138, 17224.8]
  - - [8448, 4, 1, 2816]
    - [116, 1155.96]
  - - [512, 1, 1, 500000]
    - [113, 20.6657]
  - - [176, 1500, 1, 1408]
    - [113, 6743.69]
  - - [512, 3000, 1, 2560]
    - [130, 14469.2]
  - - [8448, 24000, 1, 2816]
    - [138, 14526.0]
  - - [4608, 2, 1, 1536]
    - [116, 329.511]
  - - [512, 6000, 1, 1536]
    - [138, 16415.9]
  - - [7680, 128, 1, 2560]
    - [121, 13827.4]
  - - [3072, 6000, 1, 1024]
    - [138, 16775.4]
  - - [3072, 1500, 1, 128]
    - [137, 12889.5]
  - - [2048, 3136, 1, 512]
    - [147, 15706.6]
  - - [1024, 3000, 1, 1536]
    - [138, 16365.8]
  - - [512, 4, 1, 500000]
    - [113, 82.6644]
  - - [512, 6000, 1, 2816]
    - [138, 16718.4]
  - - [128, 50176, 1, 512]
    - [144, 15938.0]
  - - [256, 12544, 1, 1024]
    - [148, 14000.1]
  - - [1024, 12544, 1, 256]
    - [146, 16382.7]
  - - [512, 48000, 1, 2560]
    - [138, 17747.2]
  - - [2560, 16, 1, 2560]
    - [111, 1534.8]
  - - [2048, 64, 1, 2048]
    - [136, 4719.33]
  - - [512, 2, 1, 512]
    - [118, 32.1255]
  - - [1024, 1, 1, 512]
    - [113, 27.5361]
  - - [512, 1500, 1, 2560]
    - [129, 11050.4]
  - - [512, 24000, 1, 1536]
    - [138, 17469.8]
  - - [1024, 1, 1, 500000]
    - [113, 41.1425]
  - - [6144, 16, 1, 2560]
    - [116, 3615.78]
  - - [1024, 24000, 1, 2048]
    - [140, 15988.1]
  - - [4096, 16, 1, 4096]
    - [117, 2507.81]
  - - [512, 32, 1, 512]
    - [113, 455.903]
  - - [5124, 1500, 1, 2048]
    - [140, 14375.8]
  - - [3072, 1500, 1, 1024]
    - [130, 14683.2]
  - - [1024, 2, 1, 500000]
    - [113, 82.5046]
  - - [1024, 8, 1, 500000]
    - [113, 330.528]
  - - [7680, 16, 1, 2560]
    - [116, 4514.54]
  - - [6144, 1500, 1, 2560]
    - [138, 16981.2]
  - - [3072, 1, 1, 1024]
    - [111, 107.143]
  - - [1024, 48000, 1, 2816]
    - [137, 18584.6]
  - - [8448, 2, 1, 2816]
    - [116, 579.103]
  - - [4608, 4, 1, 1536]
    - [116, 659.021]
  - - [1024, 6000, 1, 1536]
    - [138, 17098.8]
  - - [8448, 32, 1, 2816]
    - [113, 7214.43]
  - - [512, 3000, 1, 2048]
    - [140, 11148.7]
  - - [6144, 24000, 1, 2560]
    - [140, 15954.4]
  - - [4608, 6000, 1, 1536]
    - [138, 17669.4]
  - - [1024, 1024, 1, 1024]
    - [140, 13068.9]
  - - [512, 1500, 1, 2048]
    - [140, 9265.22]
  - - [512, 1500, 1, 1536]
    - [129, 10818.5]
  - - [128, 1, 1, 1024]
    - [111, 4.64136]
  - - [3072, 3000, 1, 1024]
    - [140, 15741.2]
  - - [1024, 48000, 1, 2048]
    - [138, 16800.7]
- null
