library/src/blas3/Tensile/Logic/asm_full/vega10_Cijk_Ailk_Bjlk_HBH.yaml
- {MinimumRequiredVersion: 4.5.0}
- vega10
- gfx900
- [Device 6863, Device 6862, Device 687f, Device 6860, Device 6861, 'Vega 10 XTX [Radeon
    SolutionIndex: 0
    SolutionNameMin: Cijk_Ailk_Bjlk_HBH_MT032x032x08_PGR1_PLR1_TT04_04
    SolutionIndex: 1
    SolutionNameMin: Cijk_Ailk_Bjlk_HBH_MT064x064x16_PGR1_PLR1_TT08_08
    SolutionIndex: 2
    SolutionNameMin: Cijk_Ailk_Bjlk_HBH_MT032x016x16_PGR1_PLR1_TT02_02
    SolutionIndex: 3
    SolutionNameMin: Cijk_Ailk_Bjlk_HBH_MT064x016x32_PGR1_PLR1_TT02_02
    SolutionIndex: 4
    SolutionNameMin: Cijk_Ailk_Bjlk_HBH_MT016x016x64_PGR1_PLR1_TT02_02
    SolutionIndex: 5
    SolutionNameMin: Cijk_Ailk_Bjlk_HBH_MT032x016x64_PGR1_PLR1_TT02_02
    SolutionIndex: 6
    SolutionNameMin: Cijk_Ailk_Bjlk_HBH_MT032x008x64_PGR1_PLR1_TT02_02
    SolutionIndex: 7
    SolutionNameMin: Cijk_Ailk_Bjlk_HBH_MT032x064x08_PGR1_PLR1_TT04_08
    SolutionIndex: 8
    SolutionNameMin: Cijk_Ailk_Bjlk_HBH_MT064x048x08_PGR1_PLR1_TT08_06
    SolutionIndex: 9
    SolutionNameMin: Cijk_Ailk_Bjlk_HBH_MT064x128x08_PGR1_PLR1_TT04_08
    SolutionIndex: 10
    SolutionNameMin: Cijk_Ailk_Bjlk_HBH_MT128x064x08_PGR1_PLR1_TT08_04
    SolutionIndex: 11
    SolutionNameMin: Cijk_Ailk_Bjlk_HBH_MT064x064x16_PGR1_PLR1_TT04_04
    SolutionIndex: 12
    SolutionNameMin: Cijk_Ailk_Bjlk_HBH_MT064x128x16_PGR1_PLR1_TT04_08
    SolutionIndex: 13
    SolutionNameMin: Cijk_Ailk_Bjlk_HBH_MT128x064x16_PGR1_PLR1_TT08_04
    SolutionIndex: 14
    SolutionNameMin: Cijk_Ailk_Bjlk_HBH_MT064x064x32_PGR1_PLR1_TT04_04
    SolutionIndex: 15
    SolutionNameMin: Cijk_Ailk_Bjlk_HBH_MT128x128x32_PGR1_PLR1_TT08_08
    SolutionIndex: 16
    SolutionNameMin: Cijk_Ailk_Bjlk_HBH_MT064x128x04_PGR0_PLR1_TT04_08
    SolutionIndex: 17
    SolutionNameMin: Cijk_Ailk_Bjlk_HBH_MT064x064x08_PGR1_PLR1_TT04_04
    SolutionIndex: 18
    SolutionNameMin: Cijk_Ailk_Bjlk_HBH_MT064x128x04_PGR1_PLR0_TT04_08
    SolutionIndex: 19
    SolutionNameMin: Cijk_Ailk_Bjlk_HBH_MT064x064x04_PGR1_PLR1_TT04_04
    SolutionIndex: 20
    SolutionNameMin: Cijk_Ailk_Bjlk_HBH_MT064x064x16_PGR1_PLR1_TT04_04
- - - [4096, 7133, 1, 4096]
    - [12, 10805.3]
  - - [512, 16, 1, 512]
    - [2, 339.043]
  - - [2048, 7133, 1, 2048]
    - [15, 10961.2]
  - - [2560, 7133, 1, 2560]
    - [10, 10899.6]
  - - [1024, 1024, 1, 1024]
    - [11, 10931.3]
  - - [3072, 7435, 1, 1024]
    - [7, 10995.4]
  - - [1024, 32, 1, 512]
    - [5, 1572.81]
  - - [1760, 7133, 1, 1760]
    - [12, 10913.0]
  - - [7680, 5481, 1, 2560]
    - [9, 10529.4]
  - - [1024, 16, 1, 512]
    - [6, 775.61]
  - - [512, 32, 1, 512]
    - [4, 786.407]
- - - -1
    - - - 1
        - - - 32
            - - [32, 19]
              - [128, 20]
              - [2944, 19]
              - [3584, 20]
              - [-1, 19]
          - - 64
            - - [256, 19]
              - [448, 18]
              - [704, 19]
              - [1024, 20]
              - [1408, 19]
              - [1856, 20]
              - [-1, 19]
          - - 128
            - - [64, 20]
              - [128, 19]
              - [256, 20]
              - [704, 19]
              - [1024, 20]
              - [1408, 19]
              - [1856, 20]
              - [5056, 19]
              - [-1, 18]
          - - 256
            - - [32, 20]
              - [64, 19]
              - [128, 18]
              - [256, 19]
              - [704, 20]
              - [2368, 19]
              - [2944, 18]
              - [3584, 19]
              - [5056, 18]
              - [5888, 19]
              - [-1, 18]
          - - 448
            - - [128, 19]
              - [256, 20]
              - [1408, 19]
              - [2944, 18]
              - [-1, 19]
          - - 704
            - - [128, 19]
              - [256, 20]
              - [1024, 19]
              - [1408, 18]
              - [1856, 19]
              - [2368, 18]
              - [-1, 19]
          - - 1024
            - - [64, 19]
              - [128, 20]
              - [704, 19]
              - [1024, 18]
              - [1856, 19]
              - [-1, 18]
          - - 1408
            - - [64, 19]
              - [128, 20]
              - [448, 19]
              - [704, 18]
              - [1024, 19]
              - [-1, 18]
          - - 1856
            - - [-1, 19]
          - - 2368
            - - [32, 19]
              - [128, 20]
              - [256, 19]
              - [448, 18]
              - [-1, 19]
          - - 2944
            - - [32, 19]
              - [64, 20]
              - [128, 19]
              - [256, 18]
              - [704, 19]
              - [-1, 18]
          - - 3584
            - - [704, 19]
              - [-1, 18]
          - - 4288
            - - [128, 19]
              - [256, 18]
              - [-1, 19]
          - - 5056
            - - [128, 19]
              - [256, 18]
              - [2944, 19]
              - [3584, 18]
              - [-1, 19]
          - - 5888
            - - [64, 19]
              - [128, 18]
              - [256, 19]
              - [448, 18]
              - [704, 19]
              - [-1, 18]
          - - -1
            - - [128, 19]
              - [256, 18]
              - [448, 19]
              - [-1, 18]
      - - 32
        - - - 256
            - - [-1, 17]
          - - 448
            - - [3584, 17]
              - [4288, 16]
              - [5056, 17]
              - [-1, 16]
          - - 704
            - - [1856, 17]
              - [-1, 16]
          - - 1024
            - - [2944, 17]
              - [-1, 16]
          - - 1408
            - - [2368, 17]
              - [-1, 16]
          - - 1856
            - - [704, 17]
              - [-1, 16]
          - - 2368
            - - [448, 17]
              - [704, 16]
              - [1024, 17]
              - [-1, 16]
          - - 2944
            - - [704, 17]
              - [1856, 16]
              - [2368, 17]
              - [-1, 16]
          - - 3584
            - - [64, 16]
              - [704, 17]
              - [-1, 16]
          - - 4288
            - - [704, 17]
              - [-1, 16]
          - - 5056
            - - [448, 17]
              - [-1, 16]
          - - 5888
            - - [704, 17]
              - [-1, 16]
          - - -1
            - - [1024, 17]
              - [-1, 16]
      - - 256
        - - - 1
            - - [2944, 19]
              - [-1, 20]
          - - 32
            - - [-1, 17]
          - - 64
            - - [1, 19]
              - [32, 17]
              - [64, 3]
              - [128, 2]
              - [448, 4]
              - [704, 5]
              - [1408, 3]
              - [1856, 5]
              - [2944, 3]
              - [3584, 11]
              - [4288, 2]
              - [5056, 3]
              - [5888, 2]
              - [-1, 14]
          - - 128
            - - [1, 19]
              - [32, 17]
              - [64, 2]
              - [128, 4]
              - [256, 5]
              - [1408, 3]
              - [1856, 14]
              - [2944, 2]
              - [3584, 11]
              - [4288, 3]
              - [-1, 14]
          - - 256
            - - [1, 19]
              - [32, 17]
              - [64, 4]
              - [128, 5]
              - [256, 3]
              - [448, 5]
              - [704, 0]
              - [1408, 14]
              - [2368, 11]
              - [2944, 14]
              - [3584, 12]
              - [4288, 14]
              - [5056, 11]
              - [5888, 13]
              - [-1, 14]
          - - 448
            - - [1, 19]
              - [32, 17]
              - [64, 4]
              - [128, 3]
              - [256, 5]
              - [448, 3]
              - [704, 14]
              - [1408, 11]
              - [1856, 1]
              - [2944, 14]
              - [3584, 11]
              - [4288, 1]
              - [5056, 11]
              - [5888, 14]
              - [-1, 1]
          - - 704
            - - [1, 19]
              - [32, 17]
              - [64, 4]
              - [128, 5]
              - [256, 0]
              - [448, 11]
              - [1024, 14]
              - [1408, 1]
              - [1856, 11]
              - [2368, 14]
              - [2944, 1]
              - [3584, 12]
              - [4288, 1]
              - [5056, 12]
              - [5888, 1]
              - [-1, 11]
          - - 1024
            - - [1, 19]
              - [32, 17]
              - [128, 3]
              - [256, 14]
              - [448, 11]
              - [704, 14]
              - [1024, 1]
              - [1408, 13]
              - [1856, 1]
              - [2368, 12]
              - [2944, 1]
              - [3584, 13]
              - [4288, 14]
              - [5056, 13]
              - [-1, 14]
          - - 1408
            - - [1, 19]
              - [32, 17]
              - [128, 3]
              - [256, 11]
              - [448, 14]
              - [704, 13]
              - [1024, 12]
              - [1408, 1]
              - [1856, 13]
              - [2368, 11]
              - [5888, 1]
              - [-1, 12]
          - - 1856
            - - [1, 19]
              - [32, 17]
              - [64, 5]
              - [128, 3]
              - [256, 11]
              - [448, 1]
              - [704, 14]
              - [1024, 1]
              - [1408, 12]
              - [1856, 7]
              - [2944, 14]
              - [3584, 12]
              - [4288, 14]
              - [5056, 1]
              - [-1, 12]
          - - 2368
            - - [1, 19]
              - [32, 17]
              - [128, 3]
              - [256, 11]
              - [704, 14]
              - [1024, 12]
              - [1856, 14]
              - [2368, 12]
              - [2944, 11]
              - [3584, 8]
              - [4288, 1]
              - [5056, 11]
              - [5888, 12]
              - [-1, 11]
          - - 2944
            - - [1, 19]
              - [32, 17]
              - [64, 3]
              - [128, 2]
              - [448, 14]
              - [1408, 1]
              - [2368, 11]
              - [3584, 12]
              - [5056, 13]
              - [5888, 12]
              - [-1, 9]
          - - 3584
            - - [1, 20]
              - [32, 17]
              - [128, 14]
              - [256, 12]
              - [448, 14]
              - [704, 13]
              - [1024, 12]
              - [1408, 1]
              - [1856, 13]
              - [2368, 8]
              - [3584, 13]
              - [4288, 1]
              - [5056, 13]
              - [-1, 12]
          - - 4288
            - - [1, 20]
              - [32, 17]
              - [128, 2]
              - [256, 11]
              - [704, 1]
              - [1024, 14]
              - [1408, 1]
              - [1856, 14]
              - [2368, 1]
              - [2944, 12]
              - [5056, 1]
              - [5888, 12]
              - [-1, 11]
          - - 5056
            - - [1, 20]
              - [32, 17]
              - [64, 3]
              - [256, 14]
              - [448, 11]
              - [704, 13]
              - [1856, 1]
              - [2368, 11]
              - [2944, 12]
              - [3584, 13]
              - [4288, 12]
              - [5056, 7]
              - [5888, 12]
              - [-1, 1]
          - - 5888
            - - [1, 20]
              - [32, 17]
              - [64, 2]
              - [128, 11]
              - [256, 13]
              - [448, 11]
              - [704, 1]
              - [1024, 11]
              - [2368, 13]
              - [2944, 7]
              - [4288, 13]
              - [5056, 10]
              - [-1, 12]
          - - -1
            - - [1, 20]
              - [32, 17]
              - [64, 11]
              - [128, 14]
              - [256, 11]
              - [448, 1]
              - [704, 14]
              - [1024, 11]
              - [1856, 13]
              - [2368, 10]
              - [2944, 12]
              - [4288, 13]
              - [5056, 7]
              - [-1, 13]
      - - 1280
        - - - 1
            - - [-1, 20]
          - - 32
            - - [-1, 17]
          - - 64
            - - [1, 20]
              - [32, 17]
              - [128, 2]
              - [256, 4]
              - [704, 5]
              - [1024, 3]
              - [1856, 5]
              - [2944, 3]
              - [4288, 2]
              - [-1, 3]
          - - 128
            - - [1, 20]
              - [32, 17]
              - [64, 2]
              - [128, 4]
              - [256, 5]
              - [448, 3]
              - [1024, 5]
              - [1408, 3]
              - [1856, 14]
              - [2944, 3]
              - [3584, 11]
              - [4288, 2]
              - [5056, 3]
              - [5888, 14]
              - [-1, 11]
          - - 256
            - - [1, 20]
              - [32, 17]
              - [64, 4]
              - [128, 5]
              - [256, 3]
              - [448, 5]
              - [704, 0]
              - [2368, 14]
              - [2944, 11]
              - [4288, 14]
              - [5056, 11]
              - [-1, 14]
          - - 448
            - - [1, 20]
              - [32, 17]
              - [64, 4]
              - [128, 3]
              - [256, 5]
              - [448, 2]
              - [1856, 11]
              - [3584, 14]
              - [4288, 1]
              - [5888, 0]
              - [-1, 1]
          - - 704
            - - [1, 20]
              - [32, 17]
              - [64, 4]
              - [128, 5]
              - [256, 0]
              - [1024, 11]
              - [1408, 12]
              - [2368, 14]
              - [2944, 11]
              - [3584, 7]
              - [4288, 1]
              - [5888, 12]
              - [-1, 11]
          - - 1024
            - - [1, 20]
              - [32, 17]
              - [64, 3]
              - [128, 5]
              - [256, 14]
              - [1024, 11]
              - [1856, 14]
              - [2368, 12]
              - [2944, 14]
              - [3584, 7]
              - [4288, 0]
              - [5888, 14]
              - [-1, 0]
          - - 1408
            - - [1, 20]
              - [32, 17]
              - [64, 5]
              - [128, 3]
              - [256, 11]
              - [704, 14]
              - [1024, 12]
              - [1408, 1]
              - [1856, 0]
              - [2368, 14]
              - [2944, 1]
              - [3584, 13]
              - [4288, 12]
              - [5888, 13]
              - [-1, 12]
          - - 1856
            - - [1, 20]
              - [32, 17]
              - [64, 5]
              - [128, 14]
              - [256, 11]
              - [1024, 14]
              - [1856, 12]
              - [2368, 0]
              - [2944, 11]
              - [3584, 9]
              - [5056, 14]
              - [5888, 12]
              - [-1, 11]
          - - 2368
            - - [1, 20]
              - [32, 17]
              - [128, 3]
              - [704, 14]
              - [1024, 12]
              - [1408, 14]
              - [1856, 11]
              - [2368, 13]
              - [2944, 0]
              - [3584, 14]
              - [4288, 11]
              - [5056, 14]
              - [5888, 11]
              - [-1, 12]
          - - 2944
            - - [1, 20]
              - [32, 17]
              - [128, 3]
              - [256, 14]
              - [448, 11]
              - [704, 1]
              - [1024, 13]
              - [1408, 14]
              - [2368, 11]
              - [2944, 7]
              - [3584, 12]
              - [4288, 11]
              - [5056, 7]
              - [-1, 11]
          - - 3584
            - - [1, 20]
              - [32, 17]
              - [64, 2]
              - [128, 11]
              - [448, 14]
              - [704, 7]
              - [1024, 12]
              - [1408, 10]
              - [2368, 14]
              - [2944, 11]
              - [4288, 14]
              - [5056, 12]
              - [5888, 8]
              - [-1, 11]
          - - 4288
            - - [1, 20]
              - [32, 17]
              - [64, 2]
              - [128, 3]
              - [256, 14]
              - [448, 11]
              - [704, 14]
              - [1024, 0]
              - [1408, 12]
              - [1856, 14]
              - [2368, 13]
              - [2944, 12]
              - [3584, 14]
              - [4288, 10]
              - [5056, 14]
              - [5888, 12]
              - [-1, 1]
          - - 5056
            - - [1, 20]
              - [32, 17]
              - [64, 3]
              - [128, 2]
              - [256, 11]
              - [704, 14]
              - [1408, 1]
              - [1856, 7]
              - [2368, 11]
              - [2944, 10]
              - [3584, 12]
              - [4288, 1]
              - [5888, 14]
              - [-1, 12]
          - - 5888
            - - [1, 20]
              - [32, 17]
              - [64, 3]
              - [128, 11]
              - [256, 14]
              - [448, 0]
              - [704, 1]
              - [1024, 14]
              - [1408, 13]
              - [2368, 14]
              - [3584, 11]
              - [4288, 14]
              - [-1, 13]
          - - -1
            - - [1, 20]
              - [32, 17]
              - [64, 3]
              - [1856, 14]
              - [2368, 13]
              - [2944, 11]
              - [3584, 14]
              - [4288, 10]
              - [5056, 13]
              - [5888, 8]
              - [-1, 12]
      - - -1
        - - - 1
            - - [-1, 20]
          - - 32
            - - [-1, 17]
          - - 64
            - - [1, 20]
              - [32, 17]
              - [64, 4]
              - [128, 2]
              - [256, 4]
              - [448, 5]
              - [1024, 4]
              - [1856, 5]
              - [2944, 3]
              - [5056, 2]
              - [5888, 3]
              - [-1, 0]
          - - 128
            - - [1, 20]
              - [32, 17]
              - [64, 2]
              - [128, 4]
              - [256, 5]
              - [448, 4]
              - [1024, 5]
              - [1408, 3]
              - [1856, 14]
              - [2944, 3]
              - [3584, 11]
              - [4288, 2]
              - [-1, 14]
          - - 256
            - - [1, 20]
              - [32, 17]
              - [64, 4]
              - [128, 5]
              - [256, 4]
              - [448, 5]
              - [704, 11]
              - [1024, 14]
              - [1408, 0]
              - [1856, 14]
              - [2368, 11]
              - [2944, 14]
              - [3584, 11]
              - [4288, 0]
              - [5056, 14]
              - [5888, 12]
              - [-1, 11]
          - - 448
            - - [1, 20]
              - [32, 17]
              - [64, 5]
              - [128, 4]
              - [256, 5]
              - [448, 2]
              - [704, 14]
              - [1024, 11]
              - [1856, 14]
              - [2368, 0]
              - [3584, 14]
              - [4288, 1]
              - [5888, 11]
              - [-1, 12]
          - - 704
            - - [1, 20]
              - [32, 17]
              - [64, 4]
              - [128, 5]
              - [704, 11]
              - [1856, 14]
              - [2368, 11]
              - [2944, 14]
              - [3584, 11]
              - [4288, 0]
              - [5056, 9]
              - [5888, 14]
              - [-1, 11]
          - - 1024
            - - [1, 20]
              - [32, 17]
              - [64, 4]
              - [128, 5]
              - [448, 14]
              - [704, 11]
              - [1024, 14]
              - [1408, 11]
              - [1856, 12]
              - [2368, 13]
              - [2944, 14]
              - [3584, 13]
              - [4288, 0]
              - [5056, 1]
              - [5888, 15]
              - [-1, 14]
          - - 1408
            - - [1, 20]
              - [32, 17]
              - [64, 5]
              - [128, 3]
              - [256, 7]
              - [704, 14]
              - [1024, 13]
              - [1408, 11]
              - [1856, 7]
              - [2368, 12]
              - [2944, 13]
              - [3584, 1]
              - [4288, 12]
              - [5888, 1]
              - [-1, 11]
          - - 1856
            - - [1, 20]
              - [32, 17]
              - [64, 5]
              - [128, 3]
              - [256, 11]
              - [448, 14]
              - [1408, 11]
              - [1856, 13]
              - [2368, 14]
              - [3584, 7]
              - [4288, 11]
              - [5056, 7]
              - [5888, 12]
              - [-1, 14]
          - - 2368
            - - [1, 20]
              - [32, 17]
              - [128, 3]
              - [256, 14]
              - [704, 11]
              - [1024, 14]
              - [1408, 12]
              - [1856, 14]
              - [2368, 13]
              - [4288, 11]
              - [5056, 14]
              - [5888, 9]
              - [-1, 12]
          - - 2944
            - - [1, 20]
              - [32, 17]
              - [128, 3]
              - [448, 11]
              - [704, 1]
              - [1024, 14]
              - [1408, 13]
              - [1856, 12]
              - [2368, 11]
              - [2944, 12]
              - [4288, 11]
              - [5056, 14]
              - [5888, 9]
              - [-1, 11]
          - - 3584
            - - [1, 20]
              - [32, 17]
              - [64, 2]
              - [128, 3]
              - [448, 14]
              - [1408, 13]
              - [1856, 11]
              - [2368, 14]
              - [2944, 11]
              - [3584, 14]
              - [4288, 11]
              - [5056, 14]
              - [5888, 8]
              - [-1, 11]
          - - 4288
            - - [1, 20]
              - [32, 17]
              - [128, 2]
              - [256, 0]
              - [448, 13]
              - [704, 1]
              - [1024, 14]
              - [1408, 15]
              - [1856, 11]
              - [2944, 14]
              - [3584, 12]
              - [4288, 14]
              - [5056, 13]
              - [5888, 14]
              - [-1, 12]
          - - 5056
            - - [1, 20]
              - [32, 17]
              - [64, 2]
              - [128, 3]
              - [448, 14]
              - [704, 10]
              - [1408, 12]
              - [1856, 14]
              - [2368, 7]
              - [2944, 14]
              - [4288, 13]
              - [5056, 14]
              - [5888, 8]
              - [-1, 12]
          - - 5888
            - - [1, 20]
              - [32, 17]
              - [64, 2]
              - [128, 14]
              - [448, 11]
              - [704, 10]
              - [1024, 15]
              - [1856, 13]
              - [2368, 14]
              - [2944, 15]
              - [3584, 14]
              - [4288, 10]
              - [5056, 13]
              - [-1, 12]
          - - -1
            - - [1, 19]
              - [32, 17]
              - [64, 3]
              - [128, 14]
              - [256, 0]
              - [448, 14]
              - [704, 11]
              - [1856, 14]
              - [2368, 13]
              - [2944, 8]
              - [3584, 14]
              - [4288, 13]
              - [5056, 14]
              - [5888, 8]
              - [-1, 15]
