library/src/blas3/Tensile/Logic/asm_full/vega10_Cijk_Alik_Bljk_SB.yaml
- {MinimumRequiredVersion: 4.1.1}
- vega10
- gfx900
- [Device 6863, Device 6862, Device 687f, Device 6860]
- - - [4096, 7000, 1, 4096]
    - [35, 8874.46]
  - - [7680, 12000, 1, 2560]
    - [35, 10887.1]
  - - [5124, 9124, 1, 1760]
    - [30, 10905.0]
  - - [1760, 32, 1, 1760]
    - [7, 3383.19]
  - - [512, 24000, 1, 1536]
    - [32, 10120.7]
  - - [3072, 24000, 1, 1024]
    - [35, 10007.1]
  - - [2048, 400, 1, 512]
    - [32, 5173.77]
  - - [2560, 7000, 1, 2560]
    - [35, 10249.3]
  - - [3072, 16, 1, 1024]
    - [10, 909.74]
  - - [512, 48000, 1, 2816]
    - [38, 10865.6]
  - - [512, 48000, 1, 2048]
    - [33, 8757.92]
  - - [1760, 64, 1, 1760]
    - [11, 4882.3]
  - - [35, 8457, 1, 4096]
    - [4, 3858.97]
  - - [2048, 1600, 1, 2048]
    - [40, 6569.86]
  - - [512, 48000, 1, 1536]
    - [32, 10624.9]
  - - [2560, 32, 1, 2560]
    - [11, 3000.05]
  - - [8448, 5984, 1, 2816]
    - [32, 10895.7]
  - - [4096, 3200, 1, 1024]
    - [34, 8069.22]
  - - [1024, 24000, 1, 2560]
    - [32, 10508.3]
  - - [1760, 6400, 1, 1760]
    - [24, 10931.6]
  - - [1024, 700, 1, 512]
    - [29, 5150.53]
  - - [4608, 32, 1, 1536]
    - [22, 2748.05]
  - - [3072, 64, 1, 1024]
    - [14, 2389.11]
  - - [16384, 3200, 1, 4096]
    - [32, 9075.96]
  - - [2560, 16, 1, 2560]
    - [10, 1716.55]
  - - [1024, 48000, 1, 2560]
    - [32, 10857.3]
  - - [35, 8457, 1, 2560]
    - [4, 3876.16]
  - - [8448, 48000, 1, 2816]
    - [38, 11300.3]
  - - [2048, 32, 1, 2048]
    - [10, 2027.26]
  - - [2560, 3200, 1, 2560]
    - [35, 9772.82]
  - - [16384, 800, 1, 4096]
    - [26, 7402.1]
  - - [4608, 24000, 1, 1536]
    - [35, 10928.5]
  - - [7680, 48000, 1, 2560]
    - [35, 10798.3]
  - - [3072, 48000, 1, 1024]
    - [35, 10146.8]
  - - [1760, 16, 1, 1760]
    - [23, 2043.81]
  - - [8192, 3200, 1, 2048]
    - [26, 8364.13]
  - - [512, 24000, 1, 2816]
    - [32, 10600.7]
  - - [4096, 400, 1, 1024]
    - [39, 4799.1]
  - - [6144, 48000, 1, 2560]
    - [32, 10388.3]
  - - [4608, 48000, 1, 1536]
    - [35, 10968.0]
  - - [35, 8457, 1, 2048]
    - [4, 3411.15]
  - - [4096, 128, 1, 4096]
    - [17, 5291.45]
  - - [2048, 800, 1, 512]
    - [35, 6779.42]
  - - [4608, 5984, 1, 1536]
    - [35, 10549.2]
  - - [2560, 128, 1, 2560]
    - [21, 4824.63]
  - - [6144, 5984, 1, 2048]
    - [26, 8984.44]
  - - [35, 8457, 1, 1760]
    - [3, 4207.76]
  - - [7680, 24000, 1, 2560]
    - [32, 10919.9]
  - - [6144, 48000, 1, 2048]
    - [32, 9691.49]
  - - [5124, 9124, 1, 2560]
    - [35, 10477.7]
  - - [2048, 3200, 1, 2048]
    - [26, 7847.12]
  - - [2048, 16, 1, 2048]
    - [15, 1285.69]
  - - [1024, 24000, 1, 1536]
    - [32, 10499.2]
  - - [7680, 16, 1, 2560]
    - [16, 2062.27]
  - - [2560, 6400, 1, 2560]
    - [35, 10406.9]
  - - [2048, 128, 1, 2048]
    - [17, 3483.88]
  - - [512, 16, 1, 500000]
    - [1, 2902.72]
  - - [1024, 8, 1, 500000]
    - [0, 1558.07]
  - - [512, 24000, 1, 2560]
    - [32, 10379.8]
  - - [1024, 24000, 1, 2816]
    - [36, 10736.0]
  - - [7680, 5984, 1, 2560]
    - [35, 10611.7]
  - - [2048, 1600, 1, 512]
    - [28, 6463.67]
  - - [2048, 7000, 1, 2048]
    - [26, 8315.88]
  - - [1760, 800, 1, 1760]
    - [24, 8561.95]
  - - [5124, 9124, 1, 4096]
    - [32, 9070.15]
  - - [4096, 64, 1, 4096]
    - [17, 4384.19]
  - - [7680, 32, 1, 2560]
    - [5, 3655.85]
  - - [2560, 64, 1, 2560]
    - [8, 3862.55]
  - - [3072, 128, 1, 1024]
    - [14, 2722.2]
  - - [7680, 64, 1, 2560]
    - [19, 5041.11]
  - - [1760, 128, 1, 1760]
    - [11, 5759.9]
  - - [2560, 1600, 1, 2560]
    - [35, 8165.49]
  - - [2048, 3200, 1, 512]
    - [35, 7901.0]
  - - [2560, 800, 1, 2560]
    - [37, 7290.24]
  - - [3072, 32, 1, 1024]
    - [10, 1794.09]
  - - [6144, 32, 1, 2560]
    - [22, 3147.05]
  - - [4608, 12000, 1, 1536]
    - [35, 10720.2]
  - - [4096, 32, 1, 4096]
    - [12, 2842.46]
  - - [6144, 24000, 1, 2048]
    - [26, 9191.32]
  - - [8192, 800, 1, 2048]
    - [26, 6839.1]
  - - [4096, 1600, 1, 1024]
    - [34, 6812.69]
  - - [5124, 9124, 1, 2048]
    - [34, 8860.55]
  - - [8448, 24000, 1, 2816]
    - [36, 11095.0]
  - - [1024, 48000, 1, 1536]
    - [32, 10799.8]
  - - [7680, 128, 1, 2560]
    - [18, 6103.59]
  - - [8192, 1600, 1, 2048]
    - [26, 7708.81]
  - - [4096, 800, 1, 1024]
    - [40, 5928.47]
  - - [1024, 16, 1, 500000]
    - [2, 2992.6]
  - - [2048, 800, 1, 2048]
    - [25, 5572.13]
  - - [1760, 3200, 1, 1760]
    - [24, 10563.7]
  - - [512, 48000, 1, 2560]
    - [32, 10652.4]
  - - [8448, 16, 1, 2816]
    - [22, 2121.49]
  - - [2048, 64, 1, 2048]
    - [13, 2709.83]
  - - [512, 24000, 1, 2048]
    - [33, 8479.35]
  - - [16384, 1600, 1, 4096]
    - [32, 8374.2]
  - - [4608, 16, 1, 1536]
    - [10, 1662.31]
  - - [1024, 24000, 1, 2048]
    - [32, 8679.63]
  - - [8192, 400, 1, 2048]
    - [40, 5715.55]
  - - [2048, 6400, 1, 2048]
    - [26, 8376.3]
  - - [6144, 12000, 1, 2048]
    - [32, 9143.97]
  - - [512, 8, 1, 500000]
    - [0, 1555.96]
  - - [1760, 7000, 1, 1760]
    - [24, 10561.6]
  - - [1024, 48000, 1, 2816]
    - [32, 10981.3]
  - - [6144, 16, 1, 2560]
    - [10, 1843.16]
  - - [8448, 32, 1, 2816]
    - [6, 3789.39]
  - - [4096, 16, 1, 4096]
    - [10, 1602.88]
  - - [6144, 24000, 1, 2560]
    - [35, 10533.9]
  - - [1024, 1024, 1, 1024]
    - [34, 4481.79]
  - - [8448, 12000, 1, 2816]
    - [32, 11083.5]
  - - [16384, 400, 1, 4096]
    - [31, 6261.03]
  - - [1760, 1600, 1, 1760]
    - [30, 9428.34]
  - - [1024, 48000, 1, 2048]
    - [32, 9251.37]
- - - -1
    - - - -1
        - - - 4
            - - [-1, 41]
          - - 64
            - - [4, 41]
              - [128, 10]
              - [256, 15]
              - [448, 8]
              - [1408, 21]
              - [2368, 11]
              - [2944, 20]
              - [3584, 28]
              - [5888, 20]
              - [-1, 28]
          - - 128
            - - [4, 41]
              - [64, 10]
              - [128, 15]
              - [256, 8]
              - [448, 21]
              - [704, 11]
              - [1408, 20]
              - [1856, 9]
              - [2368, 20]
              - [2944, 9]
              - [3584, 28]
              - [4288, 20]
              - [5056, 9]
              - [5888, 28]
              - [-1, 24]
          - - 256
            - - [4, 41]
              - [64, 15]
              - [256, 8]
              - [448, 20]
              - [2944, 28]
              - [3584, 24]
              - [5056, 28]
              - [5888, 24]
              - [-1, 38]
          - - 448
            - - [4, 41]
              - [64, 12]
              - [448, 21]
              - [1408, 28]
              - [1856, 24]
              - [2368, 28]
              - [2944, 24]
              - [3584, 28]
              - [4288, 29]
              - [5056, 24]
              - [5888, 36]
              - [-1, 29]
          - - 704
            - - [4, 41]
              - [64, 21]
              - [128, 11]
              - [1024, 28]
              - [1408, 30]
              - [1856, 28]
              - [2368, 36]
              - [5888, 29]
              - [-1, 36]
          - - 1024
            - - [4, 41]
              - [64, 6]
              - [128, 9]
              - [704, 28]
              - [1408, 24]
              - [1856, 38]
              - [2368, 24]
              - [2944, 38]
              - [4288, 24]
              - [-1, 38]
          - - 1408
            - - [4, 41]
              - [64, 11]
              - [128, 20]
              - [448, 28]
              - [704, 31]
              - [1024, 30]
              - [1408, 36]
              - [1856, 31]
              - [2368, 28]
              - [2944, 38]
              - [3584, 30]
              - [5056, 36]
              - [5888, 38]
              - [-1, 36]
          - - 1856
            - - [4, 41]
              - [64, 21]
              - [128, 9]
              - [256, 28]
              - [448, 24]
              - [704, 28]
              - [1024, 36]
              - [1408, 29]
              - [1856, 33]
              - [2944, 24]
              - [3584, 38]
              - [4288, 36]
              - [5056, 24]
              - [5888, 36]
              - [-1, 24]
          - - 2368
            - - [4, 41]
              - [64, 21]
              - [128, 20]
              - [448, 28]
              - [704, 38]
              - [1408, 30]
              - [1856, 24]
              - [2944, 38]
              - [-1, 36]
          - - 2944
            - - [4, 41]
              - [64, 20]
              - [128, 9]
              - [256, 28]
              - [448, 30]
              - [704, 24]
              - [1024, 36]
              - [2944, 38]
              - [4288, 36]
              - [5056, 24]
              - [-1, 36]
          - - 3584
            - - [4, 41]
              - [64, 9]
              - [128, 28]
              - [256, 24]
              - [448, 28]
              - [704, 24]
              - [1024, 30]
              - [1408, 36]
              - [1856, 38]
              - [2368, 24]
              - [2944, 36]
              - [5056, 38]
              - [5888, 36]
              - [-1, 38]
          - - 4288
            - - [4, 41]
              - [64, 21]
              - [128, 11]
              - [256, 28]
              - [448, 31]
              - [704, 24]
              - [1024, 30]
              - [1856, 38]
              - [2368, 24]
              - [2944, 38]
              - [3584, 36]
              - [5056, 24]
              - [5888, 38]
              - [-1, 36]
          - - 5056
            - - [4, 41]
              - [64, 20]
              - [128, 9]
              - [256, 28]
              - [448, 30]
              - [704, 24]
              - [1408, 38]
              - [1856, 30]
              - [2368, 36]
              - [3584, 38]
              - [4288, 27]
              - [5056, 38]
              - [5888, 36]
              - [-1, 27]
          - - 5888
            - - [4, 41]
              - [64, 9]
              - [128, 28]
              - [256, 30]
              - [448, 36]
              - [704, 31]
              - [2944, 38]
              - [4288, 27]
              - [5056, 38]
              - [5888, 27]
              - [-1, 38]
          - - -1
            - - [4, 41]
              - [64, 28]
              - [128, 24]
              - [256, 36]
              - [448, 31]
              - [1024, 38]
              - [1856, 27]
              - [2368, 38]
              - [2944, 27]
              - [3584, 38]
              - [5056, 27]
              - [-1, 38]
