library/src/blas3/Tensile/Logic/asm_full/vega10_Cijk_Alik_Bljk_SB.yaml
- {MinimumRequiredVersion: 4.5.0}
- vega10
- gfx900
- [Device 6863, Device 6862, Device 687f, Device 6860, Device 6861, 'Vega 10 XTX [Radeon
    SolutionIndex: 0
    SolutionNameMin: Cijk_Alik_Bljk_SB_MT064x016x64_GRVW04_GSU16_TT04_04_VW04_WG16_04_04
    SolutionIndex: 1
    SolutionNameMin: Cijk_Alik_Bljk_SB_MT032x016x64_GRVW04_GSU32_TT04_04_VW04_WG08_04_08
    SolutionIndex: 2
    SolutionNameMin: Cijk_Alik_Bljk_SB_MT048x072x16_GRVW02_GSU02_TT06_06_VW02_WG08_12_02
    SolutionIndex: 3
    SolutionNameMin: Cijk_Alik_Bljk_SB_MT048x048x16_GRVW02_GSU08_TT06_04_VW02_WG08_12_02
    SolutionIndex: 4
    SolutionNameMin: Cijk_Alik_Bljk_SB_MT048x072x32_GRVW02_GSU08_TT06_06_VW02_WG08_12_02
    SolutionIndex: 5
    SolutionNameMin: Cijk_Alik_Bljk_SB_MT032x032x08_GRVW04_GSU08_TT04_04_VW04_WG08_08_04
    SolutionIndex: 6
    SolutionNameMin: Cijk_Alik_Bljk_SB_MT032x032x16_GRVW04_GSU02_TT04_04_VW04_WG08_08_02
    SolutionIndex: 7
    SolutionNameMin: Cijk_Alik_Bljk_SB_MT032x032x16_GRVW04_GSU02_TT04_04_VW04_WG08_08_02
    SolutionIndex: 8
    SolutionNameMin: Cijk_Alik_Bljk_SB_MT016x016x16_GRVW02_GSU04_TT02_02_VW02_WG08_08_04
    SolutionIndex: 9
    SolutionNameMin: Cijk_Alik_Bljk_SB_MT032x032x16_GRVW04_GSU04_TT04_04_VW04_WG08_08_04
    SolutionIndex: 10
    SolutionNameMin: Cijk_Alik_Bljk_SB_MT032x016x16_GRVW02_GSU04_TT02_02_VW02_WG16_08_02
    SolutionIndex: 11
    SolutionNameMin: Cijk_Alik_Bljk_SB_MT128x064x16_GRVW04_GSU04_TT08_08_VW04_WG16_08_02
    SolutionIndex: 12
    SolutionNameMin: Cijk_Alik_Bljk_SB_MT032x032x16_GRVW04_GSU04_TT04_04_VW04_WG08_08_02
    SolutionIndex: 13
    SolutionNameMin: Cijk_Alik_Bljk_SB_MT064x032x16_GRVW04_GSU04_TT08_04_VW04_WG08_08_02
    SolutionIndex: 14
    SolutionNameMin: Cijk_Alik_Bljk_SB_MT016x016x16_GRVW02_GSU04_TT02_02_VW02_WG08_08_04
    SolutionIndex: 15
    SolutionNameMin: Cijk_Alik_Bljk_SB_MT032x016x16_GRVW02_GSU04_TT04_02_VW02_WG08_08_04
    SolutionIndex: 16
    SolutionNameMin: Cijk_Alik_Bljk_SB_MT032x016x16_GRVW02_GSU04_TT02_02_VW02_WG16_08_02
    SolutionIndex: 17
    SolutionNameMin: Cijk_Alik_Bljk_SB_MT128x064x16_GRVW04_GSU04_TT08_08_VW04_WG16_08_02
    SolutionIndex: 18
    SolutionNameMin: Cijk_Alik_Bljk_SB_MT032x032x32_GRVW04_GSU02_TT04_04_VW04_WG08_08_04
    SolutionIndex: 19
    SolutionNameMin: Cijk_Alik_Bljk_SB_MT064x064x32_GRVW04_GSU02_TT08_08_VW04_WG08_08_04
    SolutionIndex: 20
    SolutionNameMin: Cijk_Alik_Bljk_SB_MT128x016x32_GRVW04_GSU02_TT04_04_VW04_WG32_04_02
    SolutionIndex: 21
    SolutionNameMin: Cijk_Alik_Bljk_SB_MT016x016x32_GRVW02_GSU02_TT02_02_VW02_WG08_08_04
    SolutionIndex: 22
    SolutionNameMin: Cijk_Alik_Bljk_SB_MT032x032x32_GRVW04_GSU02_TT04_04_VW04_WG08_08_04
    SolutionIndex: 23
    SolutionNameMin: Cijk_Alik_Bljk_SB_MT032x032x32_GRVW04_GSU04_TT04_04_VW04_WG08_08_02
    SolutionIndex: 24
    SolutionNameMin: Cijk_Alik_Bljk_SB_MT064x032x32_GRVW04_GSU04_TT04_04_VW04_WG16_08_02
    SolutionIndex: 25
    SolutionNameMin: Cijk_Alik_Bljk_SB_MT064x064x08_GRVW04_GSU01_TT04_04_VW04_WG16_16_01
    SolutionIndex: 26
    SolutionNameMin: Cijk_Alik_Bljk_SB_MT064x064x16_GRVW04_GSU01_TT04_04_VW04_WG16_16_01
    SolutionIndex: 27
    SolutionNameMin: Cijk_Alik_Bljk_SB_MT064x128x16_GRVW04_GSU01_TT04_08_VW04_WG16_16_01
    SolutionIndex: 28
    SolutionNameMin: Cijk_Alik_Bljk_SB_MT064x064x16_GRVW04_GSU01_TT04_04_VW04_WG16_16_01
    SolutionIndex: 29
    SolutionNameMin: Cijk_Alik_Bljk_SB_MT064x128x16_GRVW04_GSU01_TT04_08_VW04_WG16_16_01
    SolutionIndex: 30
    SolutionNameMin: Cijk_Alik_Bljk_SB_MT064x064x08_GRVW04_GSU01_TT04_04_VW04_WG16_16_01
    SolutionIndex: 31
    SolutionNameMin: Cijk_Alik_Bljk_SB_MT128x128x08_GRVW04_GSU01_TT08_08_VW04_WG16_16_01
    SolutionIndex: 32
    SolutionNameMin: Cijk_Alik_Bljk_SB_MT064x128x08_GRVW04_GSU01_TT04_08_VW04_WG16_16_01
    SolutionIndex: 33
    SolutionNameMin: Cijk_Alik_Bljk_SB_MT128x064x08_GRVW04_GSU01_TT08_04_VW04_WG16_16_01
    SolutionIndex: 34
    SolutionNameMin: Cijk_Alik_Bljk_SB_MT128x128x08_GRVW04_GSU01_TT08_08_VW04_WG16_16_01
    SolutionIndex: 35
    SolutionNameMin: Cijk_Alik_Bljk_SB_MT064x128x16_GRVW04_GSU01_TT04_08_VW04_WG16_16_01
    SolutionIndex: 36
    SolutionNameMin: Cijk_Alik_Bljk_SB_MT096x128x16_GRVW02_GSU01_TT06_08_VW02_WG16_16_01
    SolutionIndex: 37
    SolutionNameMin: Cijk_Alik_Bljk_SB_MT128x064x16_GRVW04_GSU01_TT08_04_VW04_WG16_16_01
    SolutionIndex: 38
    SolutionNameMin: Cijk_Alik_Bljk_SB_MT128x128x16_GRVW04_GSU01_TT08_08_VW04_WG16_16_01
    SolutionIndex: 39
    SolutionNameMin: Cijk_Alik_Bljk_SB_MT064x064x16_GRVW04_GSU01_TT04_04_VW04_WG16_16_01
    SolutionIndex: 40
    SolutionNameMin: Cijk_Alik_Bljk_SB_MT064x128x16_GRVW04_GSU01_TT04_08_VW04_WG16_16_01
    SolutionIndex: 41
    SolutionNameMin: Cijk_Alik_Bljk_SB_MT096x128x16_GRVW02_GSU01_TT06_08_VW02_WG16_16_01
    SolutionIndex: 42
    SolutionNameMin: Cijk_Alik_Bljk_SB_MT128x064x16_GRVW04_GSU01_TT08_04_VW04_WG16_16_01
    SolutionIndex: 43
    SolutionNameMin: Cijk_Alik_Bljk_SB_MT128x096x16_GRVW02_GSU01_TT08_06_VW02_WG16_16_01
    SolutionIndex: 44
    SolutionNameMin: Cijk_Alik_Bljk_SB_MT128x128x16_GRVW04_GSU01_TT08_08_VW04_WG16_16_01
    SolutionIndex: 45
    SolutionNameMin: Cijk_Alik_Bljk_SB_MT128x128x24_GRVW04_GSU01_TT08_08_VW04_WG16_16_01
    SolutionIndex: 46
    SolutionNameMin: Cijk_Alik_Bljk_SB_MT128x128x24_GRVW04_GSU01_TT08_08_VW04_WG16_16_01
    SolutionIndex: 47
    SolutionNameMin: Cijk_Alik_Bljk_SB_MT128x128x32_GRVW04_GSU01_TT08_08_VW04_WG16_16_01
    SolutionIndex: 48
    SolutionNameMin: Cijk_Alik_Bljk_SB_MT064x064x32_GRVW04_GSU01_TT04_04_VW04_WG16_16_01
    SolutionIndex: 49
    SolutionNameMin: Cijk_Alik_Bljk_SB_MT128x064x32_GRVW04_GSU01_TT08_04_VW04_WG16_16_01
    SolutionIndex: 50
    SolutionNameMin: Cijk_Alik_Bljk_SB_MT128x128x32_GRVW04_GSU01_TT08_08_VW04_WG16_16_01
    SolutionIndex: 51
    SolutionNameMin: Cijk_Alik_Bljk_SB_MT016x016x04_GRVW02_GSU01_TT02_02_VW02_WG08_08_01
    SolutionIndex: 52
    SolutionNameMin: Cijk_Alik_Bljk_SB_MT032x032x02_GRVW04_GSU01_TT04_04_VW04_WG08_08_01
- - - [4096, 7000, 1, 4096]
    - [38, 8062.77]
  - - [7680, 12000, 1, 2560]
    - [44, 9051.38]
  - - [5124, 9124, 1, 1760]
    - [34, 9286.73]
  - - [1760, 32, 1, 1760]
    - [18, 3666.07]
  - - [512, 24000, 1, 1536]
    - [38, 8599.18]
  - - [3072, 24000, 1, 1024]
    - [44, 8358.89]
  - - [2048, 400, 1, 512]
    - [47, 4790.23]
  - - [2560, 7000, 1, 2560]
    - [44, 8564.85]
  - - [3072, 16, 1, 1024]
    - [8, 902.324]
  - - [512, 48000, 1, 2816]
    - [31, 9516.2]
  - - [512, 48000, 1, 2048]
    - [38, 7646.04]
  - - [1760, 64, 1, 1760]
    - [6, 5206.67]
  - - [35, 8457, 1, 4096]
    - [4, 2579.87]
  - - [2048, 1600, 1, 2048]
    - [43, 5310.58]
  - - [512, 48000, 1, 1536]
    - [44, 8961.19]
  - - [2560, 32, 1, 2560]
    - [15, 2862.54]
  - - [8448, 5984, 1, 2816]
    - [34, 9457.18]
  - - [4096, 3200, 1, 1024]
    - [36, 6068.07]
  - - [1024, 24000, 1, 2560]
    - [44, 9181.85]
  - - [1760, 6400, 1, 1760]
    - [31, 9754.75]
  - - [1024, 700, 1, 512]
    - [40, 5338.71]
  - - [4608, 32, 1, 1536]
    - [15, 2715.38]
  - - [3072, 64, 1, 1024]
    - [15, 2482.0]
  - - [16384, 3200, 1, 4096]
    - [38, 8222.53]
  - - [2560, 16, 1, 2560]
    - [8, 1695.23]
  - - [1024, 48000, 1, 2560]
    - [38, 9195.22]
  - - [35, 8457, 1, 2560]
    - [3, 2249.66]
  - - [8448, 48000, 1, 2816]
    - [34, 9340.38]
  - - [2048, 32, 1, 2048]
    - [14, 2026.69]
  - - [2560, 3200, 1, 2560]
    - [44, 8590.88]
  - - [16384, 800, 1, 4096]
    - [38, 6732.3]
  - - [4608, 24000, 1, 1536]
    - [44, 9093.92]
  - - [7680, 48000, 1, 2560]
    - [44, 9094.28]
  - - [3072, 48000, 1, 1024]
    - [44, 8822.37]
  - - [1760, 16, 1, 1760]
    - [10, 2039.82]
  - - [8192, 3200, 1, 2048]
    - [35, 7593.89]
  - - [512, 24000, 1, 2816]
    - [31, 9517.56]
  - - [4096, 400, 1, 1024]
    - [49, 2966.77]
  - - [6144, 48000, 1, 2560]
    - [38, 8988.44]
  - - [4608, 48000, 1, 1536]
    - [44, 9131.64]
  - - [35, 8457, 1, 2048]
    - [3, 1844.76]
  - - [4096, 128, 1, 4096]
    - [11, 3441.34]
  - - [2048, 800, 1, 512]
    - [44, 6756.67]
  - - [4608, 5984, 1, 1536]
    - [44, 8616.76]
  - - [2560, 128, 1, 2560]
    - [23, 2740.6]
  - - [6144, 5984, 1, 2048]
    - [44, 7827.2]
  - - [35, 8457, 1, 1760]
    - [2, 4023.22]
  - - [7680, 24000, 1, 2560]
    - [44, 9064.29]
  - - [6144, 48000, 1, 2048]
    - [44, 8220.66]
  - - [5124, 9124, 1, 2560]
    - [44, 8811.32]
  - - [2048, 3200, 1, 2048]
    - [46, 5905.11]
  - - [2048, 16, 1, 2048]
    - [10, 1187.33]
  - - [1024, 24000, 1, 1536]
    - [38, 8961.66]
  - - [7680, 16, 1, 2560]
    - [9, 1858.45]
  - - [2560, 6400, 1, 2560]
    - [44, 8983.57]
  - - [2048, 128, 1, 2048]
    - [17, 3254.36]
  - - [512, 16, 1, 500000]
    - [0, 2622.42]
  - - [1024, 8, 1, 500000]
    - [1, 1349.68]
  - - [512, 24000, 1, 2560]
    - [38, 8560.92]
  - - [1024, 24000, 1, 2816]
    - [34, 9422.24]
  - - [7680, 5984, 1, 2560]
    - [44, 9065.66]
  - - [2048, 1600, 1, 512]
    - [36, 3880.13]
  - - [2048, 7000, 1, 2048]
    - [45, 7162.14]
  - - [1760, 800, 1, 1760]
    - [33, 6855.07]
  - - [5124, 9124, 1, 4096]
    - [38, 8368.45]
  - - [4096, 64, 1, 4096]
    - [17, 2438.17]
  - - [7680, 32, 1, 2560]
    - [22, 1921.96]
  - - [2560, 64, 1, 2560]
    - [24, 3902.19]
  - - [3072, 128, 1, 1024]
    - [15, 2874.46]
  - - [7680, 64, 1, 2560]
    - [19, 3065.0]
  - - [1760, 128, 1, 1760]
    - [7, 5927.4]
  - - [2560, 1600, 1, 2560]
    - [35, 6892.53]
  - - [2048, 3200, 1, 512]
    - [38, 5753.41]
  - - [2560, 800, 1, 2560]
    - [41, 5995.93]
  - - [3072, 32, 1, 1024]
    - [14, 1649.15]
  - - [6144, 32, 1, 2560]
    - [20, 1607.41]
  - - [4608, 12000, 1, 1536]
    - [38, 9088.01]
  - - [4096, 32, 1, 4096]
    - [12, 1557.26]
  - - [6144, 24000, 1, 2048]
    - [44, 8189.01]
  - - [8192, 800, 1, 2048]
    - [36, 5461.7]
  - - [4096, 1600, 1, 1024]
    - [39, 5489.83]
  - - [5124, 9124, 1, 2048]
    - [44, 7952.95]
  - - [8448, 24000, 1, 2816]
    - [34, 9318.36]
  - - [1024, 48000, 1, 1536]
    - [44, 9347.31]
  - - [7680, 128, 1, 2560]
    - [13, 4451.32]
  - - [8192, 1600, 1, 2048]
    - [35, 6985.91]
  - - [4096, 800, 1, 1024]
    - [50, 4272.46]
  - - [1024, 16, 1, 500000]
    - [0, 2678.05]
  - - [2048, 800, 1, 2048]
    - [48, 4261.2]
  - - [1760, 3200, 1, 1760]
    - [32, 9310.52]
  - - [512, 48000, 1, 2560]
    - [38, 9018.44]
  - - [8448, 16, 1, 2816]
    - [21, 1113.64]
  - - [2048, 64, 1, 2048]
    - [15, 2873.69]
  - - [512, 24000, 1, 2048]
    - [37, 7282.73]
  - - [16384, 1600, 1, 4096]
    - [38, 7710.06]
  - - [4608, 16, 1, 1536]
    - [8, 1594.12]
  - - [1024, 24000, 1, 2048]
    - [44, 7754.41]
  - - [8192, 400, 1, 2048]
    - [50, 4901.44]
  - - [2048, 6400, 1, 2048]
    - [36, 7228.67]
  - - [6144, 12000, 1, 2048]
    - [44, 8116.09]
  - - [512, 8, 1, 500000]
    - [1, 1344.89]
  - - [1760, 7000, 1, 1760]
    - [34, 9282.4]
  - - [1024, 48000, 1, 2816]
    - [44, 9580.75]
  - - [6144, 16, 1, 2560]
    - [14, 1784.27]
  - - [8448, 32, 1, 2816]
    - [16, 2132.53]
  - - [4096, 16, 1, 4096]
    - [14, 894.308]
  - - [6144, 24000, 1, 2560]
    - [38, 8954.23]
  - - [1024, 1024, 1, 1024]
    - [41, 2886.29]
  - - [8448, 12000, 1, 2816]
    - [34, 9426.13]
  - - [16384, 400, 1, 4096]
    - [42, 5558.04]
  - - [1760, 1600, 1, 1760]
    - [34, 8678.87]
  - - [1024, 48000, 1, 2048]
    - [35, 7899.15]
- - - -1
    - - - 128
        - - - 4
            - - [4, 52]
              - [-1, 51]
          - - 64
            - - [4, 51]
              - [1024, 26]
              - [2944, 25]
              - [5888, 26]
              - [-1, 25]
          - - 128
            - - [4, 51]
              - [64, 25]
              - [1024, 26]
              - [1856, 25]
              - [2944, 26]
              - [3584, 25]
              - [4288, 26]
              - [5056, 25]
              - [5888, 26]
              - [-1, 25]
          - - 256
            - - [4, 51]
              - [64, 25]
              - [448, 26]
              - [1408, 25]
              - [1856, 26]
              - [2944, 25]
              - [3584, 27]
              - [-1, 26]
          - - 448
            - - [4, 51]
              - [256, 26]
              - [448, 25]
              - [704, 26]
              - [1024, 25]
              - [1408, 26]
              - [1856, 27]
              - [-1, 26]
          - - 704
            - - [4, 51]
              - [64, 25]
              - [128, 26]
              - [256, 25]
              - [1024, 26]
              - [1408, 27]
              - [-1, 26]
          - - 1024
            - - [4, 51]
              - [64, 26]
              - [128, 25]
              - [256, 28]
              - [448, 26]
              - [704, 28]
              - [1408, 29]
              - [5056, 26]
              - [5888, 27]
              - [-1, 28]
          - - 1408
            - - [4, 51]
              - [64, 28]
              - [128, 25]
              - [2944, 26]
              - [3584, 27]
              - [4288, 26]
              - [5888, 27]
              - [-1, 25]
          - - 1856
            - - [4, 51]
              - [64, 26]
              - [256, 25]
              - [448, 27]
              - [2368, 26]
              - [3584, 27]
              - [4288, 26]
              - [5056, 25]
              - [5888, 29]
              - [-1, 28]
          - - 2368
            - - [4, 51]
              - [64, 26]
              - [256, 25]
              - [2368, 26]
              - [2944, 27]
              - [3584, 26]
              - [4288, 28]
              - [5056, 26]
              - [5888, 29]
              - [-1, 25]
          - - 2944
            - - [4, 51]
              - [64, 26]
              - [128, 25]
              - [2368, 26]
              - [3584, 28]
              - [4288, 29]
              - [5056, 25]
              - [5888, 28]
              - [-1, 26]
          - - 3584
            - - [4, 51]
              - [128, 26]
              - [256, 29]
              - [448, 28]
              - [1408, 26]
              - [1856, 27]
              - [2368, 26]
              - [3584, 29]
              - [4288, 26]
              - [5056, 27]
              - [5888, 28]
              - [-1, 26]
          - - 4288
            - - [4, 51]
              - [704, 26]
              - [1408, 28]
              - [2368, 26]
              - [2944, 29]
              - [3584, 25]
              - [4288, 27]
              - [5056, 28]
              - [5888, 29]
              - [-1, 25]
          - - 5056
            - - [4, 51]
              - [64, 26]
              - [128, 25]
              - [256, 26]
              - [448, 28]
              - [704, 26]
              - [1024, 28]
              - [1408, 26]
              - [2368, 29]
              - [2944, 27]
              - [3584, 26]
              - [4288, 27]
              - [-1, 28]
          - - 5888
            - - [4, 51]
              - [64, 26]
              - [128, 25]
              - [448, 28]
              - [704, 26]
              - [1024, 29]
              - [1856, 28]
              - [2368, 27]
              - [2944, 29]
              - [3584, 28]
              - [4288, 29]
              - [5888, 27]
              - [-1, 29]
          - - -1
            - - [4, 51]
              - [64, 26]
              - [128, 27]
              - [448, 28]
              - [1024, 29]
              - [1408, 28]
              - [1856, 27]
              - [2944, 28]
              - [4288, 29]
              - [5056, 28]
              - [5888, 29]
              - [-1, 27]
      - - 256
        - - - 4
            - - [-1, 8]
          - - 64
            - - [704, 8]
              - [1408, 18]
              - [3584, 39]
              - [5056, 48]
              - [5888, 39]
              - [-1, 48]
          - - 128
            - - [64, 8]
              - [128, 14]
              - [256, 8]
              - [704, 18]
              - [5888, 39]
              - [-1, 35]
          - - 256
            - - [256, 8]
              - [2944, 39]
              - [3584, 35]
              - [5056, 36]
              - [5888, 43]
              - [-1, 38]
          - - 448
            - - [128, 8]
              - [1408, 39]
              - [1856, 35]
              - [2368, 42]
              - [2944, 43]
              - [3584, 42]
              - [4288, 35]
              - [5056, 42]
              - [5888, 44]
              - [-1, 37]
          - - 704
            - - [64, 8]
              - [128, 18]
              - [1024, 39]
              - [1408, 35]
              - [1856, 36]
              - [2368, 38]
              - [2944, 35]
              - [3584, 38]
              - [4288, 37]
              - [5056, 36]
              - [5888, 38]
              - [-1, 44]
          - - 1024
            - - [64, 8]
              - [704, 39]
              - [1024, 37]
              - [1408, 36]
              - [1856, 44]
              - [2368, 38]
              - [3584, 44]
              - [4288, 38]
              - [5056, 47]
              - [5888, 44]
              - [-1, 40]
          - - 1408
            - - [4, 8]
              - [64, 18]
              - [448, 39]
              - [704, 37]
              - [1024, 36]
              - [1408, 44]
              - [1856, 38]
              - [2368, 44]
              - [2944, 45]
              - [3584, 38]
              - [4288, 49]
              - [5056, 36]
              - [5888, 38]
              - [-1, 39]
          - - 1856
            - - [4, 8]
              - [256, 39]
              - [448, 37]
              - [704, 41]
              - [1408, 38]
              - [2368, 39]
              - [2944, 41]
              - [4288, 39]
              - [5056, 38]
              - [5888, 37]
              - [-1, 34]
          - - 2368
            - - [4, 8]
              - [256, 39]
              - [448, 41]
              - [704, 44]
              - [1024, 38]
              - [1408, 39]
              - [1856, 46]
              - [2368, 31]
              - [3584, 43]
              - [4288, 36]
              - [5056, 44]
              - [-1, 38]
          - - 2944
            - - [4, 8]
              - [256, 39]
              - [448, 40]
              - [704, 43]
              - [1408, 44]
              - [1856, 38]
              - [2368, 43]
              - [4288, 39]
              - [5056, 38]
              - [5888, 44]
              - [-1, 38]
          - - 3584
            - - [4, 8]
              - [128, 48]
              - [256, 42]
              - [704, 40]
              - [1024, 44]
              - [1408, 39]
              - [1856, 36]
              - [2368, 38]
              - [2944, 41]
              - [5056, 39]
              - [5888, 44]
              - [-1, 39]
          - - 4288
            - - [4, 8]
              - [64, 16]
              - [128, 37]
              - [256, 40]
              - [704, 39]
              - [1024, 46]
              - [1408, 44]
              - [1856, 39]
              - [2944, 43]
              - [3584, 39]
              - [4288, 44]
              - [5056, 36]
              - [5888, 44]
              - [-1, 43]
          - - 5056
            - - [4, 8]
              - [64, 15]
              - [128, 39]
              - [256, 43]
              - [448, 40]
              - [704, 44]
              - [1024, 41]
              - [1408, 43]
              - [2368, 39]
              - [2944, 44]
              - [3584, 39]
              - [4288, 48]
              - [5056, 44]
              - [5888, 34]
              - [-1, 38]
          - - 5888
            - - [4, 8]
              - [128, 39]
              - [256, 41]
              - [448, 40]
              - [704, 41]
              - [1024, 39]
              - [1408, 31]
              - [1856, 39]
              - [2368, 50]
              - [2944, 44]
              - [3584, 35]
              - [4288, 39]
              - [5056, 44]
              - [5888, 39]
              - [-1, 44]
          - - -1
            - - [4, 8]
              - [64, 15]
              - [128, 35]
              - [256, 38]
              - [448, 40]
              - [704, 33]
              - [1024, 41]
              - [1408, 39]
              - [1856, 43]
              - [2368, 41]
              - [2944, 38]
              - [4288, 39]
              - [5056, 35]
              - [5888, 33]
              - [-1, 39]
      - - 1280
        - - - 4
            - - [-1, 8]
          - - 64
            - - [128, 8]
              - [256, 15]
              - [448, 22]
              - [1408, 18]
              - [2944, 6]
              - [5888, 18]
              - [-1, 6]
          - - 128
            - - [64, 8]
              - [128, 15]
              - [256, 18]
              - [448, 22]
              - [1408, 6]
              - [1856, 39]
              - [2368, 6]
              - [2944, 39]
              - [3584, 40]
              - [4288, 6]
              - [5056, 37]
              - [5888, 39]
              - [-1, 30]
          - - 256
            - - [4, 8]
              - [64, 15]
              - [128, 22]
              - [256, 18]
              - [448, 6]
              - [704, 39]
              - [1024, 48]
              - [2944, 39]
              - [3584, 42]
              - [4288, 30]
              - [5056, 32]
              - [-1, 30]
          - - 448
            - - [4, 8]
              - [128, 18]
              - [448, 6]
              - [1408, 39]
              - [1856, 35]
              - [2944, 30]
              - [3584, 44]
              - [5056, 30]
              - [5888, 31]
              - [-1, 40]
          - - 704
            - - [4, 8]
              - [64, 18]
              - [128, 6]
              - [1024, 39]
              - [1408, 40]
              - [1856, 30]
              - [2368, 44]
              - [2944, 35]
              - [3584, 30]
              - [4288, 40]
              - [5056, 43]
              - [5888, 39]
              - [-1, 44]
          - - 1024
            - - [4, 8]
              - [64, 18]
              - [128, 19]
              - [256, 48]
              - [704, 39]
              - [1024, 47]
              - [1408, 41]
              - [1856, 30]
              - [2368, 39]
              - [2944, 44]
              - [3584, 42]
              - [4288, 44]
              - [5056, 38]
              - [5888, 35]
              - [-1, 31]
          - - 1408
            - - [4, 8]
              - [64, 6]
              - [128, 7]
              - [448, 39]
              - [704, 35]
              - [1024, 32]
              - [1856, 38]
              - [2368, 39]
              - [3584, 38]
              - [5888, 34]
              - [-1, 38]
          - - 1856
            - - [4, 8]
              - [64, 7]
              - [256, 39]
              - [448, 42]
              - [1408, 30]
              - [1856, 44]
              - [2368, 31]
              - [2944, 35]
              - [3584, 38]
              - [4288, 34]
              - [5056, 38]
              - [5888, 35]
              - [-1, 34]
          - - 2368
            - - [4, 8]
              - [64, 7]
              - [128, 22]
              - [256, 39]
              - [448, 32]
              - [704, 38]
              - [1024, 30]
              - [1856, 43]
              - [2368, 40]
              - [2944, 38]
              - [3584, 31]
              - [4288, 34]
              - [5056, 38]
              - [5888, 34]
              - [-1, 31]
          - - 2944
            - - [4, 8]
              - [64, 7]
              - [256, 39]
              - [448, 30]
              - [704, 42]
              - [1024, 44]
              - [1408, 40]
              - [1856, 39]
              - [2944, 44]
              - [3584, 38]
              - [4288, 31]
              - [-1, 34]
          - - 3584
            - - [4, 8]
              - [64, 22]
              - [128, 39]
              - [448, 38]
              - [704, 30]
              - [1856, 44]
              - [2368, 31]
              - [2944, 38]
              - [3584, 44]
              - [4288, 31]
              - [5056, 38]
              - [-1, 34]
          - - 4288
            - - [4, 8]
              - [64, 22]
              - [128, 7]
              - [448, 30]
              - [704, 40]
              - [1024, 44]
              - [1856, 38]
              - [2368, 39]
              - [2944, 31]
              - [3584, 34]
              - [4288, 31]
              - [-1, 34]
          - - 5056
            - - [4, 8]
              - [64, 22]
              - [128, 39]
              - [256, 31]
              - [448, 30]
              - [704, 41]
              - [1024, 44]
              - [1408, 34]
              - [2368, 31]
              - [2944, 44]
              - [5056, 34]
              - [5888, 44]
              - [-1, 31]
          - - 5888
            - - [4, 5]
              - [64, 7]
              - [128, 39]
              - [256, 30]
              - [448, 39]
              - [704, 42]
              - [1024, 39]
              - [1856, 31]
              - [3584, 34]
              - [4288, 38]
              - [-1, 34]
          - - -1
            - - [4, 8]
              - [64, 12]
              - [128, 42]
              - [448, 30]
              - [704, 31]
              - [1024, 44]
              - [1408, 42]
              - [1856, 31]
              - [2368, 44]
              - [3584, 34]
              - [4288, 38]
              - [5056, 34]
              - [5888, 31]
              - [-1, 34]
      - - -1
        - - - 4
            - - [1408, 8]
              - [1856, 5]
              - [2368, 8]
              - [-1, 5]
          - - 64
            - - [4, 8]
              - [128, 14]
              - [256, 10]
              - [448, 18]
              - [704, 12]
              - [1024, 22]
              - [2944, 6]
              - [3584, 23]
              - [5056, 30]
              - [5888, 12]
              - [-1, 35]
          - - 128
            - - [4, 8]
              - [64, 14]
              - [128, 16]
              - [448, 18]
              - [1024, 6]
              - [1408, 7]
              - [1856, 6]
              - [2368, 19]
              - [4288, 30]
              - [5056, 39]
              - [5888, 13]
              - [-1, 39]
          - - 256
            - - [4, 8]
              - [64, 15]
              - [256, 22]
              - [448, 6]
              - [704, 30]
              - [1024, 40]
              - [2368, 30]
              - [3584, 40]
              - [5056, 39]
              - [5888, 34]
              - [-1, 31]
          - - 448
            - - [4, 8]
              - [64, 9]
              - [128, 12]
              - [256, 13]
              - [448, 6]
              - [704, 40]
              - [1408, 30]
              - [1856, 40]
              - [2368, 39]
              - [2944, 41]
              - [3584, 39]
              - [4288, 40]
              - [5056, 42]
              - [5888, 34]
              - [-1, 35]
          - - 704
            - - [4, 8]
              - [64, 12]
              - [128, 6]
              - [448, 30]
              - [704, 36]
              - [1024, 30]
              - [1856, 39]
              - [2368, 31]
              - [2944, 39]
              - [3584, 40]
              - [4288, 39]
              - [5888, 40]
              - [-1, 34]
          - - 1024
            - - [4, 8]
              - [64, 18]
              - [128, 6]
              - [256, 30]
              - [448, 40]
              - [704, 30]
              - [1024, 50]
              - [1408, 41]
              - [1856, 34]
              - [2368, 37]
              - [2944, 44]
              - [3584, 42]
              - [4288, 35]
              - [5056, 44]
              - [5888, 34]
              - [-1, 38]
          - - 1408
            - - [4, 8]
              - [64, 6]
              - [128, 12]
              - [256, 39]
              - [448, 30]
              - [704, 39]
              - [1024, 41]
              - [1408, 35]
              - [1856, 42]
              - [2368, 39]
              - [5056, 31]
              - [-1, 34]
          - - 1856
            - - [4, 8]
              - [64, 7]
              - [128, 13]
              - [256, 30]
              - [448, 38]
              - [704, 39]
              - [1024, 34]
              - [1408, 40]
              - [1856, 42]
              - [2368, 35]
              - [2944, 42]
              - [4288, 31]
              - [5056, 44]
              - [5888, 38]
              - [-1, 31]
          - - 2368
            - - [4, 8]
              - [64, 7]
              - [256, 30]
              - [448, 39]
              - [704, 44]
              - [1024, 39]
              - [1408, 38]
              - [2368, 40]
              - [4288, 34]
              - [5056, 31]
              - [-1, 34]
          - - 2944
            - - [4, 8]
              - [64, 12]
              - [256, 30]
              - [448, 32]
              - [704, 36]
              - [1408, 38]
              - [2944, 31]
              - [-1, 34]
          - - 3584
            - - [4, 8]
              - [128, 30]
              - [256, 35]
              - [448, 31]
              - [704, 34]
              - [1024, 42]
              - [1408, 31]
              - [1856, 42]
              - [2368, 44]
              - [2944, 34]
              - [4288, 38]
              - [-1, 34]
          - - 4288
            - - [4, 8]
              - [128, 30]
              - [256, 37]
              - [448, 43]
              - [704, 42]
              - [1024, 35]
              - [1408, 38]
              - [1856, 31]
              - [2368, 35]
              - [2944, 34]
              - [3584, 44]
              - [5056, 34]
              - [5888, 44]
              - [-1, 34]
          - - 5056
            - - [4, 8]
              - [64, 30]
              - [128, 7]
              - [448, 39]
              - [704, 38]
              - [1024, 44]
              - [4288, 34]
              - [5056, 44]
              - [-1, 34]
          - - 5888
            - - [4, 8]
              - [64, 30]
              - [128, 41]
              - [256, 40]
              - [448, 44]
              - [704, 39]
              - [1408, 34]
              - [1856, 44]
              - [3584, 34]
              - [4288, 44]
              - [-1, 34]
          - - -1
            - - [4, 8]
              - [128, 13]
              - [256, 34]
              - [448, 42]
              - [704, 34]
              - [1024, 44]
              - [-1, 34]
