library/src/blas3/Tensile/Logic/asm_full/vega20_Cijk_Ailk_Bjlk_DB.yaml
- {MinimumRequiredVersion: 4.8.1}
- vega20
- gfx906
- [Device 66a0, Device 66a1, Device 66a7, Vega 20]
    SolutionIndex: 0
    SolutionNameMin: Cijk_Ailk_Bjlk_DB_MT064x064x08_PLR1_TT04_04_WG16_16_01
    SolutionIndex: 1
    SolutionNameMin: Cijk_Ailk_Bjlk_DB_MT064x064x04_PLR1_TT04_04_WG16_16_01
    SolutionIndex: 2
    SolutionNameMin: Cijk_Ailk_Bjlk_DB_MT064x032x04_PLR1_TT04_04_WG16_08_01
    SolutionIndex: 3
    SolutionNameMin: Cijk_Ailk_Bjlk_DB_MT096x032x04_PLR1_TT06_04_WG16_08_01
    SolutionIndex: 4
    SolutionNameMin: Cijk_Ailk_Bjlk_DB_MT064x048x04_PLR0_TT04_06_WG16_08_01
    SolutionIndex: 5
    SolutionNameMin: Cijk_Ailk_Bjlk_DB_MT064x048x04_PLR0_TT04_06_WG16_08_01
    SolutionIndex: 6
    SolutionNameMin: Cijk_Ailk_Bjlk_DB_MT064x128x04_PLR1_TT04_08_WG16_16_01
    SolutionIndex: 7
    SolutionNameMin: Cijk_Ailk_Bjlk_DB_MT064x128x04_PLR1_TT04_08_WG16_16_01
    SolutionIndex: 8
    SolutionNameMin: Cijk_Ailk_Bjlk_DB_MT064x048x04_PLR0_TT04_06_WG16_08_01
    SolutionIndex: 9
    SolutionNameMin: Cijk_Ailk_Bjlk_DB_MT064x048x04_PLR0_TT04_06_WG16_08_01
    SolutionIndex: 10
    SolutionNameMin: Cijk_Ailk_Bjlk_DB_MT064x064x04_PLR1_TT04_08_WG16_08_01
    SolutionIndex: 11
    SolutionNameMin: Cijk_Ailk_Bjlk_DB_MT064x064x04_PLR1_TT04_08_WG16_08_01
    SolutionIndex: 12
    SolutionNameMin: Cijk_Ailk_Bjlk_DB_MT064x064x04_PLR1_TT04_08_WG16_08_01
    SolutionIndex: 13
    SolutionNameMin: Cijk_Ailk_Bjlk_DB_MT048x064x04_PLR0_TT06_04_WG08_16_01
    SolutionIndex: 14
    SolutionNameMin: Cijk_Ailk_Bjlk_DB_MT048x064x04_PLR0_TT06_04_WG08_16_01
    SolutionIndex: 15
    SolutionNameMin: Cijk_Ailk_Bjlk_DB_MT064x064x04_PLR1_TT08_04_WG08_16_01
    SolutionIndex: 16
    SolutionNameMin: Cijk_Ailk_Bjlk_DB_MT096x064x04_PLR0_TT06_04_WG16_16_01
    SolutionIndex: 17
    SolutionNameMin: Cijk_Ailk_Bjlk_DB_MT096x096x04_PLR0_TT06_06_WG16_16_01
    SolutionIndex: 18
    SolutionNameMin: Cijk_Ailk_Bjlk_DB_MT064x128x04_PLR1_TT04_08_WG16_16_01
    SolutionIndex: 19
    SolutionNameMin: Cijk_Ailk_Bjlk_DB_MT064x032x08_PLR1_TT04_04_WG16_08_01
    SolutionIndex: 20
    SolutionNameMin: Cijk_Ailk_Bjlk_DB_MT096x048x08_PLR1_TT06_06_WG16_08_01
    SolutionIndex: 21
    SolutionNameMin: Cijk_Ailk_Bjlk_DB_MT064x064x08_PLR1_TT04_04_WG16_16_01
    SolutionIndex: 22
    SolutionNameMin: Cijk_Ailk_Bjlk_DB_MT064x064x08_PLR0_TT04_04_WG16_16_01
    SolutionIndex: 23
    SolutionNameMin: Cijk_Ailk_Bjlk_DB_MT064x064x08_PLR0_TT04_04_WG16_16_01
    SolutionIndex: 24
    SolutionNameMin: Cijk_Ailk_Bjlk_DB_MT064x064x08_PLR1_TT04_04_WG16_16_01
    SolutionIndex: 25
    SolutionNameMin: Cijk_Ailk_Bjlk_DB_MT064x064x08_PLR0_TT04_04_WG16_16_01
    SolutionIndex: 26
    SolutionNameMin: Cijk_Ailk_Bjlk_DB_MT064x064x08_PLR0_TT04_04_WG16_16_01
    SolutionIndex: 27
    SolutionNameMin: Cijk_Ailk_Bjlk_DB_MT064x096x08_PLR1_TT04_06_WG16_16_01
    SolutionIndex: 28
    SolutionNameMin: Cijk_Ailk_Bjlk_DB_MT064x064x08_PLR0_TT04_04_WG16_16_01
    SolutionIndex: 29
    SolutionNameMin: Cijk_Ailk_Bjlk_DB_MT064x064x08_PLR0_TT04_04_WG16_16_01
    SolutionIndex: 30
    SolutionNameMin: Cijk_Ailk_Bjlk_DB_MT064x032x04_PLR0_TT04_04_WG16_08_01
    SolutionIndex: 31
    SolutionNameMin: Cijk_Ailk_Bjlk_DB_MT096x032x04_PLR1_TT06_04_WG16_08_01
    SolutionIndex: 32
    SolutionNameMin: Cijk_Ailk_Bjlk_DB_MT064x048x04_PLR1_TT04_06_WG16_08_01
    SolutionIndex: 33
    SolutionNameMin: Cijk_Ailk_Bjlk_DB_MT032x064x04_PLR0_TT04_04_WG08_16_01
    SolutionIndex: 34
    SolutionNameMin: Cijk_Ailk_Bjlk_DB_MT048x064x04_PLR0_TT06_04_WG08_16_01
    SolutionIndex: 35
    SolutionNameMin: Cijk_Ailk_Bjlk_DB_MT096x064x04_PLR0_TT06_04_WG16_16_01
    SolutionIndex: 36
    SolutionNameMin: Cijk_Ailk_Bjlk_DB_MT064x032x08_PLR1_TT04_04_WG16_08_01
    SolutionIndex: 37
    SolutionNameMin: Cijk_Ailk_Bjlk_DB_MT064x064x08_PLR1_TT04_04_WG16_16_01
    SolutionIndex: 38
    SolutionNameMin: Cijk_Ailk_Bjlk_DB_MT064x064x08_PLR0_TT04_04_WG16_16_01
    SolutionIndex: 39
    SolutionNameMin: Cijk_Ailk_Bjlk_DB_MT064x032x12_PLR1_TT04_04_WG16_08_01
    SolutionIndex: 40
    SolutionNameMin: Cijk_Ailk_Bjlk_DB_MT064x032x04_PK00_PLR1_SNLL1_TT04_04_WG16_08_01_WGM01
    SolutionIndex: 41
    SolutionNameMin: Cijk_Ailk_Bjlk_DB_MT064x032x04_PK00_PLR0_SNLL1_TT04_04_WG16_08_01_WGM01
    SolutionIndex: 42
    SolutionNameMin: Cijk_Ailk_Bjlk_DB_MT064x032x04_PK00_PLR0_SNLL0_TT04_04_WG16_08_01_WGM01
    SolutionIndex: 43
    SolutionNameMin: Cijk_Ailk_Bjlk_DB_MT064x048x04_PK00_PLR0_SNLL1_TT04_06_WG16_08_01_WGM01
    SolutionIndex: 44
    SolutionNameMin: Cijk_Ailk_Bjlk_DB_MT064x048x04_PK00_PLR0_SNLL0_TT04_06_WG16_08_01_WGM01
    SolutionIndex: 45
    SolutionNameMin: Cijk_Ailk_Bjlk_DB_MT064x064x04_PK00_PLR1_SNLL1_TT04_08_WG16_08_01_WGM01
    SolutionIndex: 46
    SolutionNameMin: Cijk_Ailk_Bjlk_DB_MT096x064x04_PK00_PLR1_SNLL0_TT06_04_WG16_16_01_WGM01
    SolutionIndex: 47
    SolutionNameMin: Cijk_Ailk_Bjlk_DB_MT064x096x04_PK00_PLR0_SNLL0_TT04_06_WG16_16_01_WGM01
    SolutionIndex: 48
    SolutionNameMin: Cijk_Ailk_Bjlk_DB_MT064x128x04_PK00_PLR1_SNLL1_TT04_08_WG16_16_01_WGM01
    SolutionIndex: 49
    SolutionNameMin: Cijk_Ailk_Bjlk_DB_MT064x128x04_PK00_PLR1_SNLL0_TT04_08_WG16_16_01_WGM01
    SolutionIndex: 50
    SolutionNameMin: Cijk_Ailk_Bjlk_DB_MT064x032x04_PK00_PLR0_SNLL0_TT04_04_WG16_08_01_WGM08
    SolutionIndex: 51
    SolutionNameMin: Cijk_Ailk_Bjlk_DB_MT096x032x04_PK00_PLR1_SNLL1_TT06_04_WG16_08_01_WGM08
    SolutionIndex: 52
    SolutionNameMin: Cijk_Ailk_Bjlk_DB_MT096x032x04_PK04_PLR1_SNLL1_TT06_04_WG16_08_01_WGM08
    SolutionIndex: 53
    SolutionNameMin: Cijk_Ailk_Bjlk_DB_MT064x048x04_PK00_PLR0_SNLL1_TT04_06_WG16_08_01_WGM08
    SolutionIndex: 54
    SolutionNameMin: Cijk_Ailk_Bjlk_DB_MT064x048x04_PK00_PLR0_SNLL0_TT04_06_WG16_08_01_WGM08
    SolutionIndex: 55
    SolutionNameMin: Cijk_Ailk_Bjlk_DB_MT032x064x04_PK00_PLR0_SNLL1_TT04_04_WG08_16_01_WGM08
    SolutionIndex: 56
    SolutionNameMin: Cijk_Ailk_Bjlk_DB_MT048x064x04_PK00_PLR1_SNLL1_TT06_04_WG08_16_01_WGM08
    SolutionIndex: 57
    SolutionNameMin: Cijk_Ailk_Bjlk_DB_MT048x064x04_PK00_PLR0_SNLL1_TT06_04_WG08_16_01_WGM08
    SolutionIndex: 58
    SolutionNameMin: Cijk_Ailk_Bjlk_DB_MT048x064x04_PK00_PLR0_SNLL0_TT06_04_WG08_16_01_WGM08
    SolutionIndex: 59
    SolutionNameMin: Cijk_Ailk_Bjlk_DB_MT096x064x04_PK00_PLR0_SNLL1_TT06_04_WG16_16_01_WGM08
    SolutionIndex: 60
    SolutionNameMin: Cijk_Ailk_Bjlk_DB_MT096x064x04_PK04_PLR0_SNLL0_TT06_04_WG16_16_01_WGM08
    SolutionIndex: 61
    SolutionNameMin: Cijk_Ailk_Bjlk_DB_MT064x096x04_PK00_PLR0_SNLL1_TT04_06_WG16_16_01_WGM08
    SolutionIndex: 62
    SolutionNameMin: Cijk_Ailk_Bjlk_DB_MT064x032x08_PK00_PLR1_SNLL1_TT04_04_WG16_08_01_WGM01
    SolutionIndex: 63
    SolutionNameMin: Cijk_Ailk_Bjlk_DB_MT064x032x08_PK00_PLR1_SNLL0_TT04_04_WG16_08_01_WGM01
    SolutionIndex: 64
    SolutionNameMin: Cijk_Ailk_Bjlk_DB_MT096x032x08_PK04_PLR1_SNLL1_TT06_04_WG16_08_01_WGM01
    SolutionIndex: 65
    SolutionNameMin: Cijk_Ailk_Bjlk_DB_MT096x032x08_PK04_PLR1_SNLL0_TT06_04_WG16_08_01_WGM01
    SolutionIndex: 66
    SolutionNameMin: Cijk_Ailk_Bjlk_DB_MT032x064x08_PK00_PLR1_SNLL1_TT04_04_WG08_16_01_WGM01
    SolutionIndex: 67
    SolutionNameMin: Cijk_Ailk_Bjlk_DB_MT064x064x08_PK00_PLR1_SNLL1_TT04_04_WG16_16_01_WGM01
    SolutionIndex: 68
    SolutionNameMin: Cijk_Ailk_Bjlk_DB_MT064x064x08_PK02_PLR1_SNLL1_TT04_04_WG16_16_01_WGM01
    SolutionIndex: 69
    SolutionNameMin: Cijk_Ailk_Bjlk_DB_MT064x064x08_PK04_PLR0_SNLL1_TT04_04_WG16_16_01_WGM01
    SolutionIndex: 70
    SolutionNameMin: Cijk_Ailk_Bjlk_DB_MT064x064x08_PK00_PLR1_SNLL0_TT04_04_WG16_16_01_WGM01
    SolutionIndex: 71
    SolutionNameMin: Cijk_Ailk_Bjlk_DB_MT064x064x08_PK00_PLR0_SNLL0_TT04_04_WG16_16_01_WGM01
    SolutionIndex: 72
    SolutionNameMin: Cijk_Ailk_Bjlk_DB_MT064x064x08_PK04_PLR1_SNLL0_TT04_04_WG16_16_01_WGM01
    SolutionIndex: 73
    SolutionNameMin: Cijk_Ailk_Bjlk_DB_MT064x064x08_PK04_PLR0_SNLL0_TT04_04_WG16_16_01_WGM01
    SolutionIndex: 74
    SolutionNameMin: Cijk_Ailk_Bjlk_DB_MT096x064x08_PK02_PLR1_SNLL0_TT06_04_WG16_16_01_WGM01
    SolutionIndex: 75
    SolutionNameMin: Cijk_Ailk_Bjlk_DB_MT128x064x08_PK02_PLR0_SNLL0_TT08_04_WG16_16_01_WGM01
    SolutionIndex: 76
    SolutionNameMin: Cijk_Ailk_Bjlk_DB_MT096x032x08_PK00_PLR1_SNLL1_TT06_04_WG16_08_01_WGM08
    SolutionIndex: 77
    SolutionNameMin: Cijk_Ailk_Bjlk_DB_MT096x032x08_PK04_PLR1_SNLL1_TT06_04_WG16_08_01_WGM08
    SolutionIndex: 78
    SolutionNameMin: Cijk_Ailk_Bjlk_DB_MT096x048x08_PK00_PLR1_SNLL1_TT06_06_WG16_08_01_WGM08
    SolutionIndex: 79
    SolutionNameMin: Cijk_Ailk_Bjlk_DB_MT064x064x08_PK00_PLR1_SNLL1_TT04_04_WG16_16_01_WGM08
    SolutionIndex: 80
    SolutionNameMin: Cijk_Ailk_Bjlk_DB_MT064x064x08_PK00_PLR0_SNLL1_TT04_04_WG16_16_01_WGM08
    SolutionIndex: 81
    SolutionNameMin: Cijk_Ailk_Bjlk_DB_MT064x064x08_PK04_PLR1_SNLL1_TT04_04_WG16_16_01_WGM08
    SolutionIndex: 82
    SolutionNameMin: Cijk_Ailk_Bjlk_DB_MT064x064x08_PK00_PLR1_SNLL0_TT04_04_WG16_16_01_WGM08
    SolutionIndex: 83
    SolutionNameMin: Cijk_Ailk_Bjlk_DB_MT064x064x08_PK00_PLR0_SNLL0_TT04_04_WG16_16_01_WGM08
    SolutionIndex: 84
    SolutionNameMin: Cijk_Ailk_Bjlk_DB_MT064x064x08_PK04_PLR0_SNLL0_TT04_04_WG16_16_01_WGM08
    SolutionIndex: 85
    SolutionNameMin: Cijk_Ailk_Bjlk_DB_MT096x064x08_PK02_PLR1_SNLL1_TT06_04_WG16_16_01_WGM08
    SolutionIndex: 86
    SolutionNameMin: Cijk_Ailk_Bjlk_DB_MT096x064x08_PK02_PLR1_SNLL0_TT06_04_WG16_16_01_WGM08
    SolutionIndex: 87
    SolutionNameMin: Cijk_Ailk_Bjlk_DB_MT096x064x08_PK04_PLR1_SNLL0_TT06_04_WG16_16_01_WGM08
    SolutionIndex: 88
    SolutionNameMin: Cijk_Ailk_Bjlk_DB_MT064x048x04_PK04_PLR1_SNLL0_TT04_06_WG16_08_01_WGM01
    SolutionIndex: 89
    SolutionNameMin: Cijk_Ailk_Bjlk_DB_MT128x032x04_PK04_PLR0_SNLL1_TT08_04_WG16_08_01_WGM01
    SolutionIndex: 90
    SolutionNameMin: Cijk_Ailk_Bjlk_DB_MT128x032x04_PK00_PLR0_SNLL0_TT08_04_WG16_08_01_WGM01
    SolutionIndex: 91
    SolutionNameMin: Cijk_Ailk_Bjlk_DB_MT064x096x04_PK00_PLR0_SNLL0_TT04_06_WG16_16_01_WGM08
    SolutionIndex: 92
    SolutionNameMin: Cijk_Ailk_Bjlk_DB_MT064x064x08_PK04_PLR0_SNLL1_TT04_04_WG16_16_01_WGM08
    SolutionIndex: 93
    SolutionNameMin: Cijk_Ailk_Bjlk_DB_MT64x32x4_SE_PLR0_SNLL1_TT4_4_WG16_8_1_WGM1
    SolutionIndex: 94
    SolutionNameMin: Cijk_Ailk_Bjlk_DB_MT64x32x4_SE_PLR0_SNLL0_TT4_4_WG16_8_1_WGM1
    SolutionIndex: 95
    SolutionNameMin: Cijk_Ailk_Bjlk_DB_MT64x48x4_SE_PLR1_SNLL1_TT4_6_WG16_8_1_WGM1
    SolutionIndex: 96
    SolutionNameMin: Cijk_Ailk_Bjlk_DB_MT64x48x4_SE_PLR0_SNLL1_TT4_6_WG16_8_1_WGM1
    SolutionIndex: 97
    SolutionNameMin: Cijk_Ailk_Bjlk_DB_MT64x48x4_SE_PLR0_SNLL0_TT4_6_WG16_8_1_WGM1
    SolutionIndex: 98
    SolutionNameMin: Cijk_Ailk_Bjlk_DB_MT128x32x4_SE_PLR0_SNLL1_TT8_4_WG16_8_1_WGM1
    SolutionIndex: 99
    SolutionNameMin: Cijk_Ailk_Bjlk_DB_MT128x32x4_SE_PLR0_SNLL0_TT8_4_WG16_8_1_WGM1
    SolutionIndex: 100
    SolutionNameMin: Cijk_Ailk_Bjlk_DB_MT64x64x4_SE_PLR1_SNLL1_TT4_8_WG16_8_1_WGM1
    SolutionIndex: 101
    SolutionNameMin: Cijk_Ailk_Bjlk_DB_MT64x128x4_SE_PLR1_SNLL1_TT4_8_WG16_16_1_WGM1
    SolutionIndex: 102
    SolutionNameMin: Cijk_Ailk_Bjlk_DB_MT64x128x4_SE_PLR1_SNLL0_TT4_8_WG16_16_1_WGM1
    SolutionIndex: 103
    SolutionNameMin: Cijk_Ailk_Bjlk_DB_MT64x48x4_SE_PLR0_SNLL1_TT4_6_WG16_8_1_WGM4
    SolutionIndex: 104
    SolutionNameMin: Cijk_Ailk_Bjlk_DB_MT64x48x4_SE_PLR0_SNLL0_TT4_6_WG16_8_1_WGM4
    SolutionIndex: 105
    SolutionNameMin: Cijk_Ailk_Bjlk_DB_MT48x64x4_SE_PLR0_SNLL0_TT6_4_WG8_16_1_WGM4
    SolutionIndex: 106
    SolutionNameMin: Cijk_Ailk_Bjlk_DB_MT96x64x4_SE_PLR0_SNLL0_TT6_4_WG16_16_1_WGM4
    SolutionIndex: 107
    SolutionNameMin: Cijk_Ailk_Bjlk_DB_MT96x32x4_SE_PLR1_SNLL1_TT6_4_WG16_8_1_WGM8
    SolutionIndex: 108
    SolutionNameMin: Cijk_Ailk_Bjlk_DB_MT64x48x4_SE_PLR0_SNLL1_TT4_6_WG16_8_1_WGM8
    SolutionIndex: 109
    SolutionNameMin: Cijk_Ailk_Bjlk_DB_MT64x48x4_SE_PLR1_SNLL0_TT4_6_WG16_8_1_WGM8
    SolutionIndex: 110
    SolutionNameMin: Cijk_Ailk_Bjlk_DB_MT64x48x4_SE_PLR0_SNLL0_TT4_6_WG16_8_1_WGM8
    SolutionIndex: 111
    SolutionNameMin: Cijk_Ailk_Bjlk_DB_MT64x64x4_SE_PLR1_SNLL1_TT4_8_WG16_8_1_WGM8
    SolutionIndex: 112
    SolutionNameMin: Cijk_Ailk_Bjlk_DB_MT48x64x4_SE_PLR0_SNLL0_TT6_4_WG8_16_1_WGM8
    SolutionIndex: 113
    SolutionNameMin: Cijk_Ailk_Bjlk_DB_MT96x64x4_SE_PLR0_SNLL0_TT6_4_WG16_16_1_WGM8
    SolutionIndex: 114
    SolutionNameMin: Cijk_Ailk_Bjlk_DB_MT64x96x4_SE_PLR0_SNLL0_TT4_6_WG16_16_1_WGM8
    SolutionIndex: 115
    SolutionNameMin: Cijk_Ailk_Bjlk_DB_MT64x32x8_SE_PLR1_SNLL1_TT4_4_WG16_8_1_WGM1
    SolutionIndex: 116
    SolutionNameMin: Cijk_Ailk_Bjlk_DB_MT64x32x8_SE_PLR1_SNLL0_TT4_4_WG16_8_1_WGM1
    SolutionIndex: 117
    SolutionNameMin: Cijk_Ailk_Bjlk_DB_MT64x64x8_SE_PLR1_SNLL1_TT4_4_WG16_16_1_WGM1
    SolutionIndex: 118
    SolutionNameMin: Cijk_Ailk_Bjlk_DB_MT64x64x8_SE_PLR0_SNLL1_TT4_4_WG16_16_1_WGM1
    SolutionIndex: 119
    SolutionNameMin: Cijk_Ailk_Bjlk_DB_MT64x64x8_SE_PLR1_SNLL0_TT4_4_WG16_16_1_WGM1
    SolutionIndex: 120
    SolutionNameMin: Cijk_Ailk_Bjlk_DB_MT64x64x8_SE_PLR0_SNLL0_TT4_4_WG16_16_1_WGM1
    SolutionIndex: 121
    SolutionNameMin: Cijk_Ailk_Bjlk_DB_MT96x32x8_SE_PLR1_SNLL1_TT6_4_WG16_8_1_WGM4
    SolutionIndex: 122
    SolutionNameMin: Cijk_Ailk_Bjlk_DB_MT64x64x8_SE_PLR1_SNLL1_TT4_4_WG16_16_1_WGM4
    SolutionIndex: 123
    SolutionNameMin: Cijk_Ailk_Bjlk_DB_MT64x64x8_SE_PLR0_SNLL1_TT4_4_WG16_16_1_WGM4
    SolutionIndex: 124
    SolutionNameMin: Cijk_Ailk_Bjlk_DB_MT64x64x8_SE_PLR1_SNLL0_TT4_4_WG16_16_1_WGM4
    SolutionIndex: 125
    SolutionNameMin: Cijk_Ailk_Bjlk_DB_MT64x64x8_SE_PLR0_SNLL0_TT4_4_WG16_16_1_WGM4
    SolutionIndex: 126
    SolutionNameMin: Cijk_Ailk_Bjlk_DB_MT64x32x8_SE_PLR1_SNLL1_TT4_4_WG16_8_1_WGM8
    SolutionIndex: 127
    SolutionNameMin: Cijk_Ailk_Bjlk_DB_MT96x32x8_SE_PLR1_SNLL1_TT6_4_WG16_8_1_WGM8
    SolutionIndex: 128
    SolutionNameMin: Cijk_Ailk_Bjlk_DB_MT64x48x8_SE_PLR1_SNLL1_TT4_6_WG16_8_1_WGM8
    SolutionIndex: 129
    SolutionNameMin: Cijk_Ailk_Bjlk_DB_MT64x64x8_SE_PLR1_SNLL1_TT4_4_WG16_16_1_WGM8
    SolutionIndex: 130
    SolutionNameMin: Cijk_Ailk_Bjlk_DB_MT64x64x8_SE_PLR0_SNLL1_TT4_4_WG16_16_1_WGM8
    SolutionIndex: 131
    SolutionNameMin: Cijk_Ailk_Bjlk_DB_MT64x64x8_SE_PLR1_SNLL0_TT4_4_WG16_16_1_WGM8
    SolutionIndex: 132
    SolutionNameMin: Cijk_Ailk_Bjlk_DB_MT64x64x8_SE_PLR0_SNLL0_TT4_4_WG16_16_1_WGM8
- - - [38144, 38144, 1, 256]
    - [14, 4943.8]
  - - [29568, 128, 1, 384]
    - [37, 4500.02]
  - - [30848, 128, 1, 256]
    - [37, 4373.61]
  - - [25728, 128, 1, 384]
    - [37, 4474.18]
  - - [32256, 32256, 1, 256]
    - [14, 4916.49]
  - - [7680, 7680, 1, 256]
    - [9, 4862.77]
  - - [11648, 128, 1, 128]
    - [38, 3500.38]
  - - [41984, 41984, 1, 256]
    - [12, 4914.14]
  - - [40448, 40448, 1, 256]
    - [14, 4917.55]
  - - [25728, 128, 1, 256]
    - [37, 4361.84]
  - - [64, 64, 1, 64]
    - [0, 27.1934]
  - - [15104, 15104, 1, 256]
    - [9, 4937.66]
  - - [17280, 17280, 1, 384]
    - [9, 5028.89]
  - - [34688, 128, 1, 384]
    - [37, 4631.6]
  - - [27392, 27392, 1, 256]
    - [8, 4944.53]
  - - [6528, 128, 1, 256]
    - [33, 3504.42]
  - - [35328, 35328, 1, 256]
    - [9, 4913.01]
  - - [18432, 18432, 1, 384]
    - [14, 5016.36]
  - - [31232, 31232, 1, 256]
    - [14, 4912.53]
  - - [7808, 128, 1, 256]
    - [37, 3823.26]
  - - [38400, 38400, 1, 384]
    - [12, 5031.62]
  - - [16128, 16128, 1, 256]
    - [9, 4943.0]
  - - [9472, 9472, 1, 256]
    - [9, 4905.43]
  - - [21888, 21888, 1, 384]
    - [12, 5036.49]
  - - [37248, 128, 1, 128]
    - [37, 4144.74]
  - - [38656, 38656, 1, 256]
    - [9, 4955.08]
  - - [20224, 20224, 1, 256]
    - [9, 4937.41]
  - - [8960, 8960, 1, 256]
    - [9, 4907.66]
  - - [29952, 29952, 1, 384]
    - [12, 5037.48]
  - - [36864, 36864, 1, 384]
    - [12, 5032.98]
  - - [33408, 33408, 1, 384]
    - [12, 5043.49]
  - - [20608, 128, 1, 384]
    - [37, 4271.06]
  - - [23424, 23424, 1, 384]
    - [12, 5031.57]
  - - [4864, 4864, 1, 256]
    - [9, 4801.16]
  - - [25728, 128, 1, 128]
    - [37, 3991.74]
  - - [21504, 21504, 1, 384]
    - [9, 5021.86]
  - - [25600, 25600, 1, 256]
    - [14, 4903.23]
  - - [40960, 40960, 1, 256]
    - [10, 4912.97]
  - - [19200, 19200, 1, 384]
    - [9, 5039.59]
  - - [64, 1, 1, 64]
    - [1, 0.433898]
  - - [25088, 25088, 1, 256]
    - [14, 4917.16]
  - - [41728, 41728, 1, 256]
    - [9, 4950.97]
  - - [35840, 35840, 1, 256]
    - [12, 4913.98]
  - - [34560, 34560, 1, 256]
    - [9, 4938.35]
  - - [26368, 26368, 1, 256]
    - [9, 4930.11]
  - - [5888, 5888, 1, 256]
    - [9, 4847.58]
  - - [28032, 28032, 1, 384]
    - [8, 5039.79]
  - - [42496, 42496, 1, 256]
    - [14, 4913.66]
  - - [27008, 128, 1, 256]
    - [37, 4323.82]
  - - [38400, 38400, 1, 256]
    - [14, 4915.12]
  - - [11008, 11008, 1, 256]
    - [9, 4903.83]
  - - [19328, 128, 1, 128]
    - [37, 3802.47]
  - - [32000, 32000, 1, 256]
    - [14, 4933.59]
  - - [37248, 37248, 1, 384]
    - [12, 5048.12]
  - - [10496, 10496, 1, 256]
    - [9, 4921.39]
  - - [3328, 3328, 1, 256]
    - [9, 4642.33]
  - - [16640, 16640, 1, 256]
    - [9, 4936.05]
  - - [24960, 24960, 1, 384]
    - [9, 5038.33]
  - - [1536, 1536, 1, 384]
    - [4, 4666.1]
  - - [18688, 18688, 1, 256]
    - [9, 4946.22]
  - - [22272, 22272, 1, 384]
    - [12, 5031.77]
  - - [15488, 128, 1, 256]
    - [37, 4149.04]
  - - [28416, 28416, 1, 384]
    - [10, 5039.67]
  - - [3840, 3840, 1, 256]
    - [8, 4748.27]
  - - [19968, 19968, 1, 384]
    - [9, 5016.45]
  - - [43776, 43776, 1, 256]
    - [9, 4949.83]
  - - [35072, 35072, 1, 256]
    - [12, 4936.95]
  - - [20736, 20736, 1, 256]
    - [9, 4947.98]
  - - [7168, 7168, 1, 256]
    - [14, 4838.49]
  - - [18432, 18432, 1, 256]
    - [14, 4913.01]
  - - [38016, 38016, 1, 384]
    - [12, 5038.34]
  - - [35328, 35328, 1, 384]
    - [12, 5030.83]
  - - [38784, 38784, 1, 384]
    - [12, 5052.56]
  - - [26112, 26112, 1, 384]
    - [10, 5023.99]
  - - [43648, 128, 1, 128]
    - [38, 4199.72]
  - - [27264, 27264, 1, 384]
    - [9, 5038.76]
  - - [44928, 44928, 1, 384]
    - [12, 5044.23]
  - - [41088, 128, 1, 384]
    - [34, 4559.64]
  - - [42368, 128, 1, 256]
    - [37, 4531.65]
  - - [3072, 3072, 1, 384]
    - [16, 4787.42]
  - - [3456, 3072, 1, 384]
    - [16, 4812.85]
  - - [9216, 9216, 1, 384]
    - [14, 4982.57]
  - - [38528, 128, 1, 128]
    - [38, 4208.28]
  - - [10752, 10752, 1, 256]
    - [9, 4887.21]
  - - [9088, 128, 1, 384]
    - [34, 4442.06]
  - - [17152, 17152, 1, 256]
    - [9, 4931.31]
  - - [44928, 128, 1, 384]
    - [34, 4690.53]
  - - [18048, 128, 1, 128]
    - [37, 3789.06]
  - - [7808, 128, 1, 384]
    - [37, 4053.43]
  - - [29184, 29184, 1, 256]
    - [14, 4921.28]
  - - [11776, 11776, 1, 256]
    - [14, 4885.04]
  - - [1, 64, 1, 64]
    - [1, 0.433898]
  - - [27136, 27136, 1, 256]
    - [12, 4903.82]
  - - [30848, 128, 1, 128]
    - [37, 4062.81]
  - - [33408, 128, 1, 256]
    - [37, 4422.73]
  - - [33792, 33792, 1, 384]
    - [12, 5023.83]
  - - [4224, 4224, 1, 384]
    - [14, 4889.8]
  - - [43520, 43520, 1, 256]
    - [12, 4915.38]
  - - [14592, 14592, 1, 384]
    - [9, 5010.72]
  - - [41472, 41472, 1, 256]
    - [10, 4912.51]
  - - [14080, 14080, 1, 256]
    - [9, 4923.92]
  - - [34688, 128, 1, 256]
    - [37, 4509.11]
  - - [16896, 16896, 1, 256]
    - [14, 4908.48]
  - - [15744, 15744, 1, 384]
    - [9, 5029.34]
  - - [28416, 28416, 1, 256]
    - [9, 4935.51]
  - - [24448, 128, 1, 128]
    - [37, 3997.57]
  - - [23808, 23808, 1, 256]
    - [9, 4947.2]
  - - [27648, 27648, 1, 256]
    - [14, 4917.33]
  - - [1152, 3072, 1, 384]
    - [14, 4728.45]
  - - [21888, 128, 1, 256]
    - [37, 4327.94]
  - - [2688, 128, 1, 384]
    - [37, 2844.97]
  - - [34816, 34816, 1, 256]
    - [14, 4915.79]
  - - [43776, 43776, 1, 384]
    - [12, 5043.62]
  - - [36096, 36096, 1, 256]
    - [9, 4953.01]
  - - [24320, 24320, 1, 256]
    - [9, 4942.95]
  - - [12544, 12544, 1, 256]
    - [9, 4929.98]
  - - [29184, 29184, 1, 384]
    - [12, 5029.38]
  - - [29568, 29568, 1, 384]
    - [12, 5040.32]
  - - [12928, 128, 1, 384]
    - [37, 4086.94]
  - - [36480, 36480, 1, 384]
    - [12, 5046.82]
  - - [30720, 30720, 1, 256]
    - [14, 4918.08]
  - - [25728, 25728, 1, 384]
    - [9, 5038.88]
  - - [34048, 34048, 1, 256]
    - [9, 4947.82]
  - - [2304, 2048, 1, 256]
    - [25, 4456.76]
  - - [12928, 128, 1, 256]
    - [37, 3941.43]
  - - [9728, 9728, 1, 256]
    - [14, 4882.17]
  - - [128, 128, 1, 256]
    - [36, 186.912]
  - - [33024, 33024, 1, 256]
    - [9, 4946.58]
  - - [15488, 128, 1, 384]
    - [37, 4301.92]
  - - [23168, 128, 1, 128]
    - [37, 3897.17]
  - - [39808, 128, 1, 384]
    - [37, 4564.35]
  - - [18176, 18176, 1, 256]
    - [9, 4927.79]
  - - [21504, 21504, 1, 256]
    - [9, 4913.98]
  - - [41088, 128, 1, 128]
    - [37, 4181.28]
  - - [16384, 16384, 1, 256]
    - [9, 4903.36]
  - - [1920, 1920, 1, 384]
    - [24, 4414.31]
  - - [3968, 128, 1, 128]
    - [37, 2987.67]
  - - [27008, 128, 1, 384]
    - [34, 4595.96]
  - - [27904, 27904, 1, 256]
    - [8, 4934.31]
  - - [24448, 128, 1, 384]
    - [37, 4560.76]
  - - [7680, 7680, 1, 384]
    - [14, 4980.39]
  - - [35968, 128, 1, 384]
    - [34, 4651.88]
  - - [37632, 37632, 1, 256]
    - [9, 4941.1]
  - - [14848, 14848, 1, 256]
    - [9, 4898.96]
  - - [8832, 8832, 1, 384]
    - [9, 5012.35]
  - - [23552, 23552, 1, 256]
    - [14, 4906.6]
  - - [4608, 4608, 1, 50000]
    - [17, 5244.06]
  - - [13056, 13056, 1, 256]
    - [9, 4931.17]
  - - [38528, 128, 1, 256]
    - [37, 4508.88]
  - - [19584, 19584, 1, 384]
    - [9, 5045.62]
  - - [16768, 128, 1, 384]
    - [34, 4251.87]
  - - [22784, 22784, 1, 256]
    - [14, 4931.16]
  - - [44160, 44160, 1, 384]
    - [12, 5044.51]
  - - [28160, 28160, 1, 256]
    - [12, 4905.11]
  - - [14592, 14592, 1, 256]
    - [9, 4946.11]
  - - [20992, 20992, 1, 256]
    - [14, 4900.0]
  - - [41216, 41216, 1, 256]
    - [9, 4935.63]
  - - [21760, 21760, 1, 256]
    - [9, 4948.32]
  - - [25344, 25344, 1, 256]
    - [14, 4936.55]
  - - [35968, 128, 1, 128]
    - [38, 4143.0]
  - - [4608, 4608, 1, 256]
    - [14, 4771.78]
  - - [3456, 3456, 1, 384]
    - [8, 4829.09]
  - - [2560, 2048, 1, 256]
    - [25, 4438.42]
  - - [30464, 30464, 1, 256]
    - [9, 4943.45]
  - - [19200, 19200, 1, 256]
    - [9, 4945.89]
  - - [22272, 22272, 1, 256]
    - [14, 4936.92]
  - - [29952, 29952, 1, 256]
    - [9, 4944.13]
  - - [20480, 20480, 1, 256]
    - [14, 4908.02]
  - - [5376, 5376, 1, 384]
    - [8, 4947.28]
  - - [17408, 17408, 1, 256]
    - [14, 4913.04]
  - - [32768, 32768, 1, 256]
    - [10, 4905.13]
  - - [18816, 18816, 1, 384]
    - [10, 5032.61]
  - - [3840, 3840, 1, 384]
    - [9, 4870.39]
  - - [34944, 34944, 1, 384]
    - [12, 5043.57]
  - - [18048, 18048, 1, 384]
    - [11, 5025.03]
  - - [34560, 34560, 1, 384]
    - [12, 5042.24]
  - - [9088, 128, 1, 256]
    - [34, 4182.52]
  - - [24576, 24576, 1, 256]
    - [14, 4922.48]
  - - [32128, 128, 1, 384]
    - [37, 4573.55]
  - - [8448, 8448, 1, 256]
    - [9, 4918.8]
  - - [42752, 42752, 1, 256]
    - [8, 4942.02]
  - - [5376, 5376, 1, 256]
    - [9, 4841.23]
  - - [18048, 128, 1, 256]
    - [37, 4307.97]
  - - [3584, 3584, 1, 256]
    - [9, 4668.55]
  - - [37120, 37120, 1, 256]
    - [9, 4941.96]
  - - [39936, 39936, 1, 384]
    - [12, 5032.16]
  - - [20736, 20736, 1, 384]
    - [9, 5031.05]
  - - [35584, 35584, 1, 256]
    - [9, 4939.06]
  - - [26112, 26112, 1, 256]
    - [9, 4912.04]
  - - [16896, 16896, 1, 384]
    - [14, 5009.28]
  - - [40704, 40704, 1, 384]
    - [12, 5044.18]
  - - [33280, 33280, 1, 256]
    - [14, 4917.79]
  - - [32128, 128, 1, 128]
    - [38, 4099.57]
  - - [5632, 5632, 1, 256]
    - [9, 4794.28]
  - - [19456, 19456, 1, 256]
    - [14, 4903.62]
  - - [22016, 22016, 1, 256]
    - [14, 4909.78]
  - - [29568, 128, 1, 128]
    - [37, 4035.67]
  - - [14208, 128, 1, 256]
    - [37, 4244.78]
  - - [10368, 128, 1, 128]
    - [37, 3276.8]
  - - [13568, 13568, 1, 256]
    - [9, 4929.85]
  - - [30848, 128, 1, 384]
    - [37, 4442.81]
  - - [1408, 128, 1, 384]
    - [37, 2028.31]
  - - [5760, 5760, 1, 5760]
    - [18, 5159.55]
  - - [10752, 10752, 1, 384]
    - [14, 4998.43]
  - - [39936, 39936, 1, 256]
    - [14, 4913.67]
  - - [1920, 3072, 1, 384]
    - [5, 4825.97]
  - - [9984, 9984, 1, 256]
    - [9, 4920.05]
  - - [13056, 13056, 1, 384]
    - [9, 5023.78]
  - - [2816, 2048, 1, 256]
    - [29, 4480.45]
  - - [23168, 128, 1, 256]
    - [37, 4268.83]
  - - [19968, 19968, 1, 256]
    - [9, 4916.04]
  - - [44800, 44800, 1, 256]
    - [9, 4946.5]
  - - [11904, 11904, 1, 384]
    - [11, 5015.11]
  - - [14976, 14976, 1, 384]
    - [9, 5021.87]
  - - [35712, 35712, 1, 384]
    - [12, 5043.92]
  - - [12672, 12672, 1, 384]
    - [9, 5022.34]
  - - [43008, 43008, 1, 384]
    - [12, 5032.01]
  - - [41088, 41088, 1, 384]
    - [12, 5046.15]
  - - [10368, 128, 1, 384]
    - [31, 3879.48]
  - - [6912, 6912, 1, 384]
    - [14, 4979.18]
  - - [27008, 128, 1, 128]
    - [37, 4000.9]
  - - [16128, 16128, 1, 384]
    - [11, 5027.9]
  - - [5120, 5120, 1, 256]
    - [14, 4783.78]
  - - [25856, 25856, 1, 256]
    - [9, 4933.64]
  - - [12288, 12288, 1, 256]
    - [9, 4898.9]
  - - [6400, 6400, 1, 256]
    - [9, 4861.45]
  - - [2688, 128, 1, 256]
    - [37, 2678.84]
  - - [11648, 128, 1, 256]
    - [37, 4050.1]
  - - [43264, 43264, 1, 256]
    - [14, 4943.12]
  - - [19712, 19712, 1, 256]
    - [9, 4935.51]
  - - [34176, 34176, 1, 384]
    - [12, 5041.26]
  - - [31104, 31104, 1, 384]
    - [12, 5042.35]
  - - [36608, 36608, 1, 256]
    - [9, 4943.46]
  - - [39808, 128, 1, 256]
    - [37, 4481.34]
  - - [13824, 13824, 1, 384]
    - [14, 4995.07]
  - - [42624, 42624, 1, 384]
    - [12, 5050.28]
  - - [21120, 21120, 1, 384]
    - [12, 5030.83]
  - - [23296, 23296, 1, 256]
    - [9, 4939.59]
  - - [42240, 42240, 1, 256]
    - [9, 4947.45]
  - - [33408, 128, 1, 384]
    - [35, 4605.83]
  - - [43648, 128, 1, 256]
    - [37, 4512.42]
  - - [19328, 128, 1, 384]
    - [37, 4341.12]
  - - [33792, 33792, 1, 256]
    - [9, 4920.25]
  - - [31488, 31488, 1, 256]
    - [8, 4951.46]
  - - [1408, 128, 1, 128]
    - [37, 1624.55]
  - - [768, 3072, 1, 384]
    - [4, 4699.02]
  - - [6144, 6144, 1, 256]
    - [14, 4845.6]
  - - [20352, 20352, 1, 384]
    - [9, 5031.88]
  - - [23168, 128, 1, 384]
    - [34, 4385.22]
  - - [33536, 33536, 1, 256]
    - [8, 4934.85]
  - - [32640, 32640, 1, 384]
    - [12, 5043.9]
  - - [20608, 128, 1, 128]
    - [37, 3822.93]
  - - [10368, 10368, 1, 384]
    - [9, 5013.29]
  - - [34688, 128, 1, 128]
    - [38, 4159.31]
  - - [1536, 3072, 1, 384]
    - [14, 4745.29]
  - - [19328, 128, 1, 256]
    - [37, 4208.8]
  - - [2688, 3072, 1, 384]
    - [14, 4823.1]
  - - [24192, 24192, 1, 384]
    - [12, 5032.98]
  - - [6912, 6912, 1, 256]
    - [9, 4879.98]
  - - [28288, 128, 1, 128]
    - [38, 4052.73]
  - - [15360, 15360, 1, 256]
    - [9, 4908.22]
  - - [18944, 18944, 1, 256]
    - [14, 4911.54]
  - - [37376, 37376, 1, 256]
    - [12, 4913.61]
  - - [31488, 31488, 1, 384]
    - [12, 5043.19]
  - - [26880, 26880, 1, 256]
    - [9, 4947.07]
  - - [44928, 128, 1, 128]
    - [38, 4272.7]
  - - [24448, 128, 1, 256]
    - [37, 4426.03]
  - - [31872, 31872, 1, 384]
    - [12, 5041.26]
  - - [1408, 128, 1, 256]
    - [37, 1909.66]
  - - [38528, 128, 1, 384]
    - [37, 4629.24]
  - - [15488, 128, 1, 128]
    - [37, 3662.75]
  - - [15616, 15616, 1, 256]
    - [9, 4934.91]
  - - [39552, 39552, 1, 384]
    - [12, 5044.38]
  - - [4352, 4352, 1, 256]
    - [9, 4789.61]
  - - [28288, 128, 1, 384]
    - [37, 4562.32]
  - - [10368, 128, 1, 256]
    - [38, 3639.02]
  - - [32128, 128, 1, 256]
    - [37, 4456.36]
  - - [12288, 12288, 1, 384]
    - [14, 4999.49]
  - - [4608, 4608, 1, 4608]
    - [17, 5198.68]
  - - [5760, 5760, 1, 384]
    - [9, 4959.13]
  - - [8704, 8704, 1, 256]
    - [14, 4860.28]
  - - [17664, 17664, 1, 256]
    - [9, 4947.44]
  - - [6528, 128, 1, 128]
    - [33, 2872.04]
  - - [24576, 24576, 1, 384]
    - [12, 5023.03]
  - - [37248, 128, 1, 384]
    - [37, 4520.08]
  - - [34304, 34304, 1, 256]
    - [10, 4909.95]
  - - [14208, 128, 1, 128]
    - [38, 3718.59]
  - - [39808, 128, 1, 128]
    - [37, 4160.59]
  - - [42368, 128, 1, 384]
    - [35, 4629.78]
  - - [17664, 17664, 1, 384]
    - [9, 5030.74]
  - - [12800, 12800, 1, 256]
    - [14, 4888.6]
  - - [2304, 2304, 1, 384]
    - [5, 4626.5]
  - - [26624, 26624, 1, 256]
    - [14, 4915.5]
  - - [36864, 36864, 1, 256]
    - [12, 4910.35]
  - - [40704, 40704, 1, 256]
    - [9, 4938.45]
  - - [12032, 12032, 1, 256]
    - [9, 4919.1]
  - - [33024, 33024, 1, 384]
    - [12, 5042.28]
  - - [28800, 28800, 1, 384]
    - [9, 5039.88]
  - - [14208, 128, 1, 384]
    - [37, 4433.42]
  - - [22656, 22656, 1, 384]
    - [9, 5035.91]
  - - [41472, 41472, 1, 384]
    - [10, 5031.66]
  - - [39680, 39680, 1, 256]
    - [9, 4943.75]
  - - [44032, 44032, 1, 256]
    - [12, 4914.17]
  - - [43392, 43392, 1, 384]
    - [12, 5048.33]
  - - [42240, 42240, 1, 384]
    - [12, 5046.69]
  - - [38912, 38912, 1, 256]
    - [14, 4920.17]
  - - [23040, 23040, 1, 384]
    - [12, 5020.32]
  - - [13312, 13312, 1, 256]
    - [14, 4891.4]
  - - [128, 128, 1, 384]
    - [39, 209.995]
  - - [11136, 11136, 1, 384]
    - [14, 5012.59]
  - - [39168, 39168, 1, 256]
    - [9, 4949.46]
  - - [25344, 25344, 1, 384]
    - [9, 5040.0]
  - - [5248, 128, 1, 256]
    - [32, 3506.66]
  - - [30208, 30208, 1, 256]
    - [14, 4913.31]
  - - [40192, 40192, 1, 256]
    - [9, 4951.49]
  - - [15872, 15872, 1, 256]
    - [14, 4908.5]
  - - [44544, 44544, 1, 256]
    - [14, 4925.67]
  - - [11520, 11520, 1, 256]
    - [9, 4927.86]
  - - [15360, 15360, 1, 384]
    - [14, 5006.79]
  - - [23040, 23040, 1, 256]
    - [9, 4921.45]
  - - [26496, 26496, 1, 384]
    - [12, 5038.29]
  - - [11264, 11264, 1, 256]
    - [14, 4882.79]
  - - [18048, 128, 1, 384]
    - [34, 4501.2]
  - - [30976, 30976, 1, 256]
    - [8, 4933.07]
  - - [11648, 128, 1, 384]
    - [31, 4249.73]
  - - [2304, 3072, 1, 384]
    - [5, 4820.36]
  - - [6144, 6144, 1, 384]
    - [14, 4942.89]
  - - [28928, 28928, 1, 256]
    - [14, 4937.18]
  - - [11520, 11520, 1, 384]
    - [14, 5020.03]
  - - [43008, 43008, 1, 256]
    - [9, 4926.27]
  - - [3072, 3072, 1, 384]
    - [14, 4831.58]
  - - [29440, 29440, 1, 256]
    - [9, 4941.34]
  - - [36352, 36352, 1, 256]
    - [9, 4907.78]
  - - [32256, 32256, 1, 384]
    - [12, 5028.89]
  - - [23808, 23808, 1, 384]
    - [12, 5036.49]
  - - [9984, 9984, 1, 384]
    - [9, 5008.45]
  - - [37248, 128, 1, 256]
    - [37, 4453.89]
  - - [1, 1, 1, 64]
    - [1, 0.00647773]
  - - [6528, 6528, 1, 384]
    - [9, 4987.46]
  - - [7296, 7296, 1, 384]
    - [9, 4993.92]
  - - [37888, 37888, 1, 256]
    - [10, 4912.3]
  - - [35968, 128, 1, 256]
    - [37, 4465.07]
  - - [13824, 13824, 1, 256]
    - [14, 4909.04]
  - - [39168, 39168, 1, 384]
    - [12, 5040.56]
  - - [2688, 128, 1, 128]
    - [37, 2293.76]
  - - [37632, 37632, 1, 384]
    - [12, 5042.41]
  - - [29568, 128, 1, 256]
    - [37, 4399.23]
  - - [42368, 128, 1, 128]
    - [38, 4214.17]
  - - [14336, 14336, 1, 256]
    - [14, 4896.25]
  - - [8064, 8064, 1, 384]
    - [9, 5003.24]
  - - [28288, 128, 1, 256]
    - [37, 4432.59]
  - - [16512, 16512, 1, 384]
    - [9, 5032.46]
  - - [30720, 30720, 1, 384]
    - [12, 5032.58]
  - - [21888, 128, 1, 128]
    - [38, 3897.97]
  - - [21248, 21248, 1, 256]
    - [9, 4944.88]
  - - [12928, 128, 1, 128]
    - [38, 3495.25]
  - - [29696, 29696, 1, 256]
    - [14, 4913.27]
  - - [384, 3072, 1, 384]
    - [5, 4524.43]
  - - [28672, 28672, 1, 256]
    - [9, 4908.07]
  - - [32512, 32512, 1, 256]
    - [9, 4930.53]
  - - [2688, 2688, 1, 384]
    - [9, 4703.56]
  - - [9216, 9216, 1, 256]
    - [14, 4886.08]
  - - [6656, 6656, 1, 256]
    - [14, 4834.44]
  - - [6528, 128, 1, 384]
    - [30, 3598.75]
  - - [33408, 128, 1, 128]
    - [37, 4076.23]
  - - [30336, 30336, 1, 384]
    - [9, 5043.1]
  - - [16768, 128, 1, 128]
    - [37, 3704.52]
  - - [13440, 13440, 1, 384]
    - [9, 5026.95]
  - - [20608, 128, 1, 256]
    - [37, 4181.84]
  - - [4992, 4992, 1, 384]
    - [9, 4934.36]
  - - [7936, 7936, 1, 256]
    - [9, 4884.07]
  - - [41856, 41856, 1, 384]
    - [12, 5048.24]
  - - [44288, 44288, 1, 256]
    - [9, 4953.6]
  - - [7744, 7744, 1, 7744]
    - [15, 5184.91]
  - - [7424, 7424, 1, 256]
    - [9, 4881.42]
  - - [39424, 39424, 1, 256]
    - [10, 4913.75]
  - - [43648, 128, 1, 384]
    - [37, 4586.9]
  - - [14208, 14208, 1, 384]
    - [9, 5027.29]
  - - [36096, 36096, 1, 384]
    - [12, 5035.57]
  - - [44544, 44544, 1, 384]
    - [12, 5036.22]
  - - [22528, 22528, 1, 256]
    - [14, 4904.7]
  - - [4096, 4096, 1, 256]
    - [9, 4699.5]
  - - [4608, 4608, 1, 384]
    - [14, 4895.84]
  - - [7808, 128, 1, 128]
    - [38, 3297.07]
  - - [5248, 128, 1, 128]
    - [38, 2977.26]
  - - [9088, 128, 1, 128]
    - [35, 3396.39]
  - - [31744, 31744, 1, 256]
    - [14, 4909.71]
  - - [3968, 128, 1, 384]
    - [37, 3970.58]
  - - [17920, 17920, 1, 256]
    - [14, 4908.84]
  - - [5248, 128, 1, 384]
    - [32, 3773.4]
  - - [26880, 26880, 1, 384]
    - [12, 5036.35]
  - - [8192, 8192, 1, 256]
    - [14, 4865.66]
  - - [3968, 128, 1, 256]
    - [37, 3640.07]
  - - [41088, 128, 1, 256]
    - [37, 4463.51]
  - - [21888, 128, 1, 384]
    - [37, 4457.4]
  - - [16768, 128, 1, 256]
    - [37, 4102.86]
  - - [24064, 24064, 1, 256]
    - [14, 4908.54]
  - - [44928, 128, 1, 256]
    - [37, 4557.33]
  - - [9600, 9600, 1, 384]
    - [9, 5008.75]
  - - [27648, 27648, 1, 384]
    - [10, 5021.65]
  - - [24832, 24832, 1, 256]
    - [9, 4935.41]
  - - [8448, 8448, 1, 384]
    - [9, 4999.3]
  - - [128, 128, 1, 128]
    - [36, 153.75]
  - - [10240, 10240, 1, 256]
    - [14, 4871.33]
  - - [40320, 40320, 1, 384]
    - [12, 5041.89]
  - - [18048, 3072, 1, 384]
    - [53, 4976.0]
  - - [2304, 1153, 1, 384]
    - [73, 4220.18]
  - - [18432, 2688, 1, 384]
    - [54, 4980.46]
  - - [3840, 2304, 1, 384]
    - [53, 4762.52]
  - - [41856, 384, 1, 384]
    - [53, 4914.42]
  - - [30720, 1152, 1, 384]
    - [53, 4975.45]
  - - [43008, 2304, 1, 384]
    - [58, 5000.2]
  - - [26496, 768, 1, 384]
    - [53, 4924.0]
  - - [43776, 3072, 1, 384]
    - [54, 5014.4]
  - - [30336, 1536, 1, 384]
    - [58, 4974.95]
  - - [38400, 384, 1, 384]
    - [54, 4880.8]
  - - [28800, 384, 1, 384]
    - [53, 4796.4]
  - - [3840, 3072, 1, 384]
    - [54, 4825.56]
  - - [44160, 3072, 1, 384]
    - [54, 5014.27]
  - - [41472, 1153, 1, 384]
    - [54, 4774.86]
  - - [33408, 1920, 1, 384]
    - [54, 4993.44]
  - - [6912, 384, 1, 384]
    - [85, 4285.3]
  - - [21504, 1153, 1, 384]
    - [54, 4755.34]
  - - [24576, 1920, 1, 384]
    - [54, 4996.19]
  - - [23040, 3072, 1, 384]
    - [54, 4993.0]
  - - [28032, 1152, 1, 384]
    - [54, 4958.04]
  - - [35328, 1153, 1, 384]
    - [54, 4764.12]
  - - [33792, 2688, 1, 384]
    - [54, 5010.32]
  - - [8448, 768, 1, 384]
    - [54, 4666.98]
  - - [8064, 2688, 1, 384]
    - [54, 4918.57]
  - - [33408, 2304, 1, 384]
    - [54, 5005.26]
  - - [31872, 1536, 1, 384]
    - [53, 4961.7]
  - - [41088, 1920, 1, 384]
    - [54, 5004.32]
  - - [17280, 3072, 1, 384]
    - [58, 4974.84]
  - - [37632, 3072, 1, 384]
    - [54, 5005.85]
  - - [38016, 1153, 1, 384]
    - [54, 4766.18]
  - - [32640, 1152, 1, 384]
    - [54, 4988.29]
  - - [27264, 1153, 1, 384]
    - [54, 4754.61]
  - - [30336, 1153, 1, 384]
    - [54, 4774.67]
  - - [18048, 384, 1, 384]
    - [58, 4745.86]
  - - [26496, 3072, 1, 384]
    - [53, 4995.1]
  - - [41088, 2304, 1, 384]
    - [54, 5013.44]
  - - [3840, 1153, 1, 384]
    - [54, 4480.73]
  - - [16128, 2304, 1, 384]
    - [54, 4975.6]
  - - [5376, 1536, 1, 384]
    - [59, 4759.68]
  - - [39552, 3072, 1, 384]
    - [54, 5007.73]
  - - [23808, 3072, 1, 384]
    - [54, 4987.65]
  - - [24192, 1153, 1, 384]
    - [54, 4749.07]
  - - [16128, 1536, 1, 384]
    - [58, 4921.2]
  - - [5760, 1536, 1, 384]
    - [58, 4746.55]
  - - [36480, 2688, 1, 384]
    - [54, 5016.76]
  - - [21504, 1152, 1, 384]
    - [54, 4942.78]
  - - [38400, 1153, 1, 384]
    - [54, 4772.96]
  - - [39168, 1153, 1, 384]
    - [54, 4772.76]
  - - [21888, 1153, 1, 384]
    - [53, 4731.82]
  - - [19968, 1152, 1, 384]
    - [54, 4935.19]
  - - [28416, 2304, 1, 384]
    - [58, 4999.62]
  - - [26880, 768, 1, 384]
    - [54, 4925.95]
  - - [15360, 768, 1, 384]
    - [54, 4830.5]
  - - [42624, 768, 1, 384]
    - [58, 4943.89]
  - - [13056, 3072, 1, 384]
    - [57, 4961.56]
  - - [43008, 1920, 1, 384]
    - [54, 5006.56]
  - - [34944, 384, 1, 384]
    - [53, 4833.68]
  - - [19584, 384, 1, 384]
    - [53, 4684.91]
  - - [44160, 2688, 1, 384]
    - [54, 5024.47]
  - - [4992, 1536, 1, 384]
    - [58, 4711.65]
  - - [39168, 768, 1, 384]
    - [54, 4956.79]
  - - [16896, 1153, 1, 384]
    - [53, 4720.07]
  - - [6144, 1536, 1, 384]
    - [57, 4824.64]
  - - [26112, 1152, 1, 384]
    - [54, 4963.44]
  - - [1152, 384, 1, 384]
    - [68, 3538.94]
  - - [19968, 384, 1, 384]
    - [58, 4706.83]
  - - [43392, 1153, 1, 384]
    - [54, 4786.79]
  - - [29952, 1536, 1, 384]
    - [58, 4975.05]
  - - [17280, 1153, 1, 384]
    - [54, 4721.29]
  - - [10752, 2688, 1, 384]
    - [53, 4940.06]
  - - [33408, 1153, 1, 384]
    - [54, 4753.16]
  - - [42240, 2688, 1, 384]
    - [54, 5027.28]
  - - [36096, 1536, 1, 384]
    - [58, 4974.18]
  - - [1920, 384, 1, 384]
    - [46, 4086.56]
  - - [22272, 2304, 1, 384]
    - [54, 4978.49]
  - - [26496, 1536, 1, 384]
    - [54, 4967.0]
  - - [1536, 384, 1, 384]
    - [78, 3471.68]
  - - [42624, 2688, 1, 384]
    - [54, 5020.72]
  - - [29184, 3072, 1, 384]
    - [54, 5004.92]
  - - [9600, 1920, 1, 384]
    - [54, 4925.74]
  - - [27264, 3072, 1, 384]
    - [54, 5002.82]
  - - [7680, 1152, 1, 384]
    - [54, 4770.81]
  - - [24960, 1153, 1, 384]
    - [54, 4733.13]
  - - [18048, 1536, 1, 384]
    - [54, 4931.32]
  - - [17664, 1153, 1, 384]
    - [54, 4729.77]
  - - [20352, 1153, 1, 384]
    - [54, 4719.82]
  - - [29184, 1152, 1, 384]
    - [53, 4975.13]
  - - [17664, 2688, 1, 384]
    - [54, 4998.2]
  - - [15360, 1920, 1, 384]
    - [54, 4944.65]
  - - [3840, 384, 1, 384]
    - [46, 4211.78]
  - - [18816, 1920, 1, 384]
    - [54, 4976.13]
  - - [33024, 768, 1, 384]
    - [58, 4938.33]
  - - [40704, 1153, 1, 384]
    - [54, 4789.41]
  - - [21888, 1920, 1, 384]
    - [54, 4986.65]
  - - [18816, 3072, 1, 384]
    - [58, 4990.17]
  - - [37248, 1536, 1, 384]
    - [54, 4991.0]
  - - [34176, 2304, 1, 384]
    - [54, 5004.96]
  - - [16896, 2304, 1, 384]
    - [54, 4983.23]
  - - [40320, 3072, 1, 384]
    - [54, 5007.94]
  - - [32640, 1153, 1, 384]
    - [54, 4772.66]
  - - [6144, 1920, 1, 384]
    - [54, 4888.89]
  - - [14208, 1152, 1, 384]
    - [54, 4904.31]
  - - [8832, 1153, 1, 384]
    - [54, 4648.8]
  - - [22272, 1920, 1, 384]
    - [54, 4983.64]
  - - [32640, 3072, 1, 384]
    - [54, 5010.56]
  - - [33408, 1536, 1, 384]
    - [58, 4967.79]
  - - [5760, 3072, 1, 384]
    - [58, 4891.71]
  - - [27648, 3072, 1, 384]
    - [54, 4993.37]
  - - [17280, 384, 1, 384]
    - [53, 4769.11]
  - - [26880, 2688, 1, 384]
    - [54, 5005.72]
  - - [36864, 1153, 1, 384]
    - [54, 4769.78]
  - - [36864, 1920, 1, 384]
    - [54, 4992.34]
  - - [41088, 384, 1, 384]
    - [54, 4865.78]
  - - [4224, 1152, 1, 384]
    - [79, 4568.62]
  - - [12288, 1153, 1, 384]
    - [54, 4669.03]
  - - [384, 768, 1, 384]
    - [63, 2496.61]
  - - [27648, 1920, 1, 384]
    - [54, 5001.99]
  - - [5760, 1152, 1, 384]
    - [54, 4760.91]
  - - [33792, 1536, 1, 384]
    - [58, 4977.76]
  - - [40704, 2688, 1, 384]
    - [54, 5015.99]
  - - [37632, 2304, 1, 384]
    - [54, 5005.92]
  - - [24192, 1152, 1, 384]
    - [54, 4961.05]
  - - [42240, 3072, 1, 384]
    - [58, 5004.17]
  - - [16896, 1920, 1, 384]
    - [54, 4970.43]
  - - [18048, 1153, 1, 384]
    - [54, 4715.89]
  - - [32640, 2304, 1, 384]
    - [58, 5006.2]
  - - [13824, 384, 1, 384]
    - [54, 4631.54]
  - - [36096, 1152, 1, 384]
    - [54, 4988.85]
  - - [15744, 1920, 1, 384]
    - [54, 4952.28]
  - - [5760, 2304, 1, 384]
    - [58, 4873.84]
  - - [33408, 1152, 1, 384]
    - [54, 4965.87]
  - - [11904, 2304, 1, 384]
    - [58, 4939.36]
  - - [24576, 2304, 1, 384]
    - [58, 4975.94]
  - - [33024, 1536, 1, 384]
    - [54, 4974.96]
  - - [6528, 1152, 1, 384]
    - [53, 4680.05]
  - - [20736, 768, 1, 384]
    - [54, 4876.63]
  - - [37632, 1152, 1, 384]
    - [54, 4981.09]
  - - [12288, 1920, 1, 384]
    - [54, 4936.31]
  - - [36096, 2304, 1, 384]
    - [58, 5006.12]
  - - [6912, 1153, 1, 384]
    - [54, 4503.36]
  - - [13056, 2688, 1, 384]
    - [54, 4973.1]
  - - [20352, 2688, 1, 384]
    - [54, 4981.59]
  - - [14592, 2304, 1, 384]
    - [58, 4967.32]
  - - [16128, 1920, 1, 384]
    - [54, 4969.52]
  - - [9216, 1536, 1, 384]
    - [57, 4874.83]
  - - [16512, 1920, 1, 384]
    - [54, 4965.73]
  - - [35712, 1920, 1, 384]
    - [54, 5002.04]
  - - [9216, 2688, 1, 384]
    - [58, 4938.47]
  - - [16128, 2688, 1, 384]
    - [54, 4982.4]
  - - [19200, 3072, 1, 384]
    - [58, 4984.78]
  - - [23808, 2688, 1, 384]
    - [54, 4995.49]
  - - [18048, 768, 1, 384]
    - [58, 4844.52]
  - - [14592, 2688, 1, 384]
    - [54, 4985.88]
  - - [15360, 1152, 1, 384]
    - [54, 4899.89]
  - - [40320, 1152, 1, 384]
    - [54, 4980.48]
  - - [25344, 2688, 1, 384]
    - [54, 5000.78]
  - - [43008, 1152, 1, 384]
    - [54, 4980.46]
  - - [19200, 1152, 1, 384]
    - [54, 4923.07]
  - - [19584, 1152, 1, 384]
    - [53, 4918.1]
  - - [14208, 1920, 1, 384]
    - [54, 4945.28]
  - - [5376, 1152, 1, 384]
    - [54, 4716.35]
  - - [14976, 2688, 1, 384]
    - [54, 4967.39]
  - - [36480, 1152, 1, 384]
    - [54, 4981.47]
  - - [39936, 1920, 1, 384]
    - [54, 5004.42]
  - - [11136, 1152, 1, 384]
    - [54, 4862.99]
  - - [17280, 2304, 1, 384]
    - [58, 4970.17]
  - - [11520, 2304, 1, 384]
    - [54, 4938.06]
  - - [19968, 3072, 1, 384]
    - [58, 4982.79]
  - - [25344, 384, 1, 384]
    - [53, 4805.23]
  - - [19968, 1153, 1, 384]
    - [54, 4742.25]
  - - [26496, 1152, 1, 384]
    - [54, 4962.9]
  - - [18432, 768, 1, 384]
    - [53, 4868.36]
  - - [4608, 768, 1, 384]
    - [58, 4714.67]
  - - [34944, 1920, 1, 384]
    - [54, 5010.1]
  - - [13824, 2688, 1, 384]
    - [54, 4966.11]
  - - [8832, 3072, 1, 384]
    - [58, 4924.87]
  - - [39936, 2304, 1, 384]
    - [58, 4990.91]
  - - [16896, 3072, 1, 384]
    - [54, 4980.59]
  - - [7680, 2688, 1, 384]
    - [53, 4910.94]
  - - [19968, 2304, 1, 384]
    - [54, 4971.64]
  - - [27648, 2688, 1, 384]
    - [54, 5009.45]
  - - [4224, 768, 1, 384]
    - [79, 4421.17]
  - - [35328, 3072, 1, 384]
    - [54, 5004.8]
  - - [11520, 3072, 1, 384]
    - [54, 4953.11]
  - - [24192, 1920, 1, 384]
    - [54, 4988.39]
  - - [32640, 1920, 1, 384]
    - [53, 4990.67]
  - - [4992, 3072, 1, 384]
    - [58, 4872.74]
  - - [12672, 384, 1, 384]
    - [79, 4565.94]
  - - [34176, 2688, 1, 384]
    - [54, 5015.98]
  - - [35328, 1536, 1, 384]
    - [54, 4982.95]
  - - [20736, 1153, 1, 384]
    - [54, 4733.01]
  - - [3072, 1152, 1, 384]
    - [43, 4733.06]
  - - [20352, 3072, 1, 384]
    - [53, 4988.2]
  - - [26880, 1152, 1, 384]
    - [54, 4973.01]
  - - [8832, 2688, 1, 384]
    - [54, 4934.14]
  - - [18048, 1920, 1, 384]
    - [54, 4960.5]
  - - [31488, 768, 1, 384]
    - [58, 4934.42]
  - - [21504, 2304, 1, 384]
    - [54, 4970.73]
  - - [30720, 3072, 1, 384]
    - [54, 5006.94]
  - - [13440, 2688, 1, 384]
    - [53, 4976.92]
  - - [11136, 2688, 1, 384]
    - [54, 4947.1]
  - - [38784, 1153, 1, 384]
    - [54, 4766.9]
  - - [33024, 3072, 1, 384]
    - [58, 4997.81]
  - - [34944, 3072, 1, 384]
    - [54, 5008.65]
  - - [39552, 384, 1, 384]
    - [54, 4886.05]
  - - [31872, 1152, 1, 384]
    - [54, 4970.23]
  - - [768, 1152, 1, 384]
    - [50, 3812.15]
  - - [29184, 2688, 1, 384]
    - [54, 5006.03]
  - - [10752, 3072, 1, 384]
    - [58, 4946.18]
  - - [20352, 768, 1, 384]
    - [54, 4891.01]
  - - [4608, 2688, 1, 384]
    - [54, 4839.98]
  - - [36480, 1153, 1, 384]
    - [54, 4772.03]
  - - [7296, 1153, 1, 384]
    - [77, 4534.67]
  - - [21504, 2688, 1, 384]
    - [54, 5001.68]
  - - [34176, 768, 1, 384]
    - [54, 4961.76]
  - - [29568, 384, 1, 384]
    - [53, 4853.05]
  - - [3072, 1920, 1, 384]
    - [53, 4785.6]
  - - [21504, 1920, 1, 384]
    - [54, 4976.17]
  - - [23808, 1536, 1, 384]
    - [54, 4947.9]
  - - [15360, 1153, 1, 384]
    - [53, 4713.52]
  - - [30336, 3072, 1, 384]
    - [54, 5009.94]
  - - [26112, 3072, 1, 384]
    - [54, 4991.86]
  - - [8832, 1536, 1, 384]
    - [58, 4830.43]
  - - [11136, 1153, 1, 384]
    - [54, 4655.27]
  - - [43392, 1536, 1, 384]
    - [54, 4985.09]
  - - [42240, 384, 1, 384]
    - [53, 4864.07]
  - - [28800, 2688, 1, 384]
    - [54, 5002.11]
  - - [31488, 2688, 1, 384]
    - [54, 5003.77]
  - - [10368, 3072, 1, 384]
    - [58, 4939.74]
  - - [12672, 1920, 1, 384]
    - [54, 4953.88]
  - - [30720, 1536, 1, 384]
    - [58, 4974.52]
  - - [8064, 3072, 1, 384]
    - [53, 4916.83]
  - - [23424, 1153, 1, 384]
    - [54, 4739.18]
  - - [17280, 1152, 1, 384]
    - [54, 4912.42]
  - - [13824, 768, 1, 384]
    - [58, 4838.66]
  - - [9216, 1152, 1, 384]
    - [54, 4884.81]
  - - [6528, 1920, 1, 384]
    - [54, 4877.74]
  - - [28800, 3072, 1, 384]
    - [54, 5003.78]
  - - [10752, 384, 1, 384]
    - [79, 4575.87]
  - - [38016, 1536, 1, 384]
    - [58, 4975.98]
  - - [39552, 1152, 1, 384]
    - [54, 4977.34]
  - - [22272, 1153, 1, 384]
    - [54, 4743.23]
  - - [25344, 2304, 1, 384]
    - [58, 4997.0]
  - - [14592, 3072, 1, 384]
    - [58, 4964.13]
  - - [28032, 1920, 1, 384]
    - [54, 4998.51]
  - - [20736, 2688, 1, 384]
    - [54, 4999.38]
  - - [15744, 1536, 1, 384]
    - [54, 4925.53]
  - - [25728, 1152, 1, 384]
    - [54, 4961.4]
  - - [16512, 1536, 1, 384]
    - [58, 4916.69]
  - - [3072, 2304, 1, 384]
    - [57, 4795.53]
  - - [5760, 2688, 1, 384]
    - [53, 4885.8]
  - - [37248, 1153, 1, 384]
    - [54, 4778.69]
  - - [10368, 1153, 1, 384]
    - [54, 4650.73]
  - - [36864, 3072, 1, 384]
    - [54, 5011.29]
  - - [23040, 1152, 1, 384]
    - [54, 4941.03]
  - - [31872, 384, 1, 384]
    - [53, 4808.58]
  - - [9600, 3072, 1, 384]
    - [58, 4926.41]
  - - [10368, 1152, 1, 384]
    - [54, 4833.77]
  - - [36096, 3072, 1, 384]
    - [58, 4998.24]
  - - [24576, 1536, 1, 384]
    - [54, 4959.6]
  - - [31104, 2304, 1, 384]
    - [58, 5000.88]
  - - [2688, 1153, 1, 384]
    - [82, 4198.25]
  - - [38400, 2304, 1, 384]
    - [54, 5006.02]
  - - [32256, 384, 1, 384]
    - [54, 4850.44]
  - - [38016, 1152, 1, 384]
    - [54, 4980.77]
  - - [20352, 384, 1, 384]
    - [54, 4783.58]
  - - [15360, 2688, 1, 384]
    - [54, 4972.49]
  - - [10752, 1153, 1, 384]
    - [54, 4652.71]
  - - [29952, 2688, 1, 384]
    - [54, 4996.93]
  - - [7680, 384, 1, 384]
    - [57, 4390.07]
  - - [43008, 2688, 1, 384]
    - [54, 5016.71]
  - - [13440, 1920, 1, 384]
    - [54, 4949.38]
  - - [4992, 1152, 1, 384]
    - [58, 4706.52]
  - - [9984, 2304, 1, 384]
    - [58, 4929.36]
  - - [6528, 2688, 1, 384]
    - [54, 4895.06]
  - - [38016, 2688, 1, 384]
    - [54, 5022.4]
  - - [4608, 1152, 1, 384]
    - [54, 4639.97]
  - - [9600, 2304, 1, 384]
    - [58, 4915.54]
  - - [32640, 384, 1, 384]
    - [54, 4866.3]
  - - [7680, 3072, 1, 384]
    - [57, 4903.82]
  - - [2304, 1536, 1, 384]
    - [44, 4756.25]
  - - [40320, 1536, 1, 384]
    - [58, 4970.14]
  - - [13440, 1536, 1, 384]
    - [58, 4898.8]
  - - [18432, 1152, 1, 384]
    - [54, 4919.24]
  - - [40320, 2688, 1, 384]
    - [58, 5011.34]
  - - [30336, 2304, 1, 384]
    - [54, 5007.68]
  - - [24192, 2688, 1, 384]
    - [54, 4999.28]
  - - [16896, 1152, 1, 384]
    - [54, 4903.98]
  - - [38016, 3072, 1, 384]
    - [54, 5009.48]
  - - [43392, 2304, 1, 384]
    - [54, 5010.45]
  - - [13440, 1152, 1, 384]
    - [54, 4881.78]
  - - [1152, 769, 1, 384]
    - [45, 3758.09]
  - - [36096, 1153, 1, 384]
    - [54, 4767.94]
  - - [33792, 1920, 1, 384]
    - [54, 4995.58]
  - - [11520, 1153, 1, 384]
    - [54, 4618.18]
  - - [12288, 3072, 1, 384]
    - [58, 4967.49]
  - - [28416, 3072, 1, 384]
    - [58, 5006.26]
  - - [35328, 768, 1, 384]
    - [58, 4919.38]
  - - [22656, 2688, 1, 384]
    - [54, 5003.16]
  - - [25728, 2688, 1, 384]
    - [54, 5012.43]
  - - [23040, 768, 1, 384]
    - [58, 4897.63]
  - - [29952, 2304, 1, 384]
    - [54, 5000.57]
  - - [33024, 1920, 1, 384]
    - [54, 4997.81]
  - - [14976, 768, 1, 384]
    - [53, 4802.12]
  - - [42624, 1920, 1, 384]
    - [53, 5006.57]
  - - [32640, 2688, 1, 384]
    - [57, 4994.42]
  - - [33408, 384, 1, 384]
    - [54, 4866.26]
  - - [11520, 1536, 1, 384]
    - [58, 4894.24]
  - - [6912, 768, 1, 384]
    - [58, 4617.69]
  - - [28032, 3072, 1, 384]
    - [54, 5002.38]
  - - [39552, 1920, 1, 384]
    - [54, 5009.09]
  - - [11904, 384, 1, 384]
    - [54, 4660.46]
  - - [32256, 1920, 1, 384]
    - [58, 4980.59]
  - - [15360, 384, 1, 384]
    - [54, 4791.67]
  - - [42240, 1153, 1, 384]
    - [54, 4788.17]
  - - [10752, 1536, 1, 384]
    - [57, 4875.9]
  - - [16128, 1152, 1, 384]
    - [54, 4890.27]
  - - [6144, 1153, 1, 384]
    - [53, 4553.82]
  - - [24576, 2688, 1, 384]
    - [54, 5004.88]
  - - [12672, 2688, 1, 384]
    - [54, 4970.04]
  - - [5376, 768, 1, 384]
    - [82, 4567.96]
  - - [10752, 1920, 1, 384]
    - [54, 4908.99]
  - - [40704, 1536, 1, 384]
    - [58, 4983.48]
  - - [8832, 1152, 1, 384]
    - [54, 4844.5]
  - - [32256, 768, 1, 384]
    - [57, 4924.26]
  - - [11904, 1536, 1, 384]
    - [58, 4884.56]
  - - [35712, 1153, 1, 384]
    - [54, 4767.69]
  - - [32256, 1153, 1, 384]
    - [53, 4756.29]
  - - [18432, 1536, 1, 384]
    - [58, 4925.89]
  - - [34560, 3072, 1, 384]
    - [58, 4992.31]
  - - [18816, 2688, 1, 384]
    - [58, 4980.44]
  - - [28800, 1152, 1, 384]
    - [54, 4967.33]
  - - [28416, 1153, 1, 384]
    - [53, 4746.99]
  - - [26112, 1153, 1, 384]
    - [54, 4768.9]
  - - [11520, 2688, 1, 384]
    - [54, 4968.93]
  - - [19584, 3072, 1, 384]
    - [54, 4990.07]
  - - [28416, 384, 1, 384]
    - [54, 4851.91]
  - - [24960, 1152, 1, 384]
    - [53, 4941.95]
  - - [8448, 3072, 1, 384]
    - [58, 4934.77]
  - - [25344, 1153, 1, 384]
    - [54, 4737.68]
  - - [22272, 2688, 1, 384]
    - [54, 4997.56]
  - - [24960, 2304, 1, 384]
    - [53, 4978.18]
  - - [11520, 768, 1, 384]
    - [58, 4755.58]
  - - [35712, 2688, 1, 384]
    - [54, 5015.3]
  - - [23424, 1152, 1, 384]
    - [54, 4958.67]
  - - [24960, 3072, 1, 384]
    - [58, 4993.05]
  - - [29952, 1920, 1, 384]
    - [54, 5008.35]
  - - [30720, 384, 1, 384]
    - [54, 4814.28]
  - - [13440, 384, 1, 384]
    - [82, 4617.88]
  - - [26880, 1920, 1, 384]
    - [54, 4987.49]
  - - [25728, 3072, 1, 384]
    - [58, 4995.52]
  - - [33408, 2688, 1, 384]
    - [54, 5011.23]
  - - [40704, 3072, 1, 384]
    - [54, 5020.07]
  - - [38400, 1152, 1, 384]
    - [54, 4995.51]
  - - [3840, 1152, 1, 384]
    - [79, 4607.0]
  - - [7680, 1153, 1, 384]
    - [53, 4562.99]
  - - [35328, 2688, 1, 384]
    - [54, 5015.72]
  - - [21120, 1536, 1, 384]
    - [54, 4947.29]
  - - [21120, 2688, 1, 384]
    - [54, 4986.85]
  - - [40320, 1153, 1, 384]
    - [54, 4783.53]
  - - [38784, 1152, 1, 384]
    - [54, 4982.34]
  - - [19584, 1920, 1, 384]
    - [54, 4971.73]
  - - [11904, 1152, 1, 384]
    - [53, 4871.01]
  - - [43392, 1920, 1, 384]
    - [54, 5007.9]
  - - [17664, 1536, 1, 384]
    - [54, 4929.34]
  - - [34176, 1920, 1, 384]
    - [54, 5002.6]
  - - [16512, 2688, 1, 384]
    - [54, 4991.73]
  - - [18816, 2304, 1, 384]
    - [54, 4978.77]
  - - [36864, 768, 1, 384]
    - [58, 4945.52]
  - - [14592, 1536, 1, 384]
    - [57, 4917.67]
  - - [11136, 2304, 1, 384]
    - [54, 4927.99]
  - - [9600, 2688, 1, 384]
    - [54, 4942.66]
  - - [13824, 1153, 1, 384]
    - [54, 4659.56]
  - - [9216, 2304, 1, 384]
    - [58, 4909.87]
  - - [3456, 1920, 1, 384]
    - [54, 4778.06]
  - - [14208, 768, 1, 384]
    - [58, 4833.11]
  - - [38784, 384, 1, 384]
    - [54, 4909.29]
  - - [35712, 768, 1, 384]
    - [53, 4938.25]
  - - [21120, 768, 1, 384]
    - [58, 4857.7]
  - - [4992, 2688, 1, 384]
    - [54, 4838.95]
  - - [16128, 3072, 1, 384]
    - [53, 4973.38]
  - - [41472, 768, 1, 384]
    - [58, 4944.05]
  - - [4992, 1153, 1, 384]
    - [54, 4380.84]
  - - [3072, 1536, 1, 384]
    - [58, 4744.3]
  - - [43392, 3072, 1, 384]
    - [54, 5011.13]
  - - [44160, 1153, 1, 384]
    - [54, 4780.19]
  - - [37632, 1536, 1, 384]
    - [53, 4972.41]
  - - [15744, 1153, 1, 384]
    - [54, 4668.79]
  - - [17664, 768, 1, 384]
    - [54, 4864.53]
  - - [3456, 2304, 1, 384]
    - [58, 4725.6]
  - - [38784, 2304, 1, 384]
    - [54, 5006.74]
  - - [8448, 2688, 1, 384]
    - [54, 4950.25]
  - - [30720, 1153, 1, 384]
    - [54, 4756.85]
  - - [36864, 2304, 1, 384]
    - [54, 4996.22]
  - - [24192, 1536, 1, 384]
    - [58, 4961.97]
  - - [40704, 1920, 1, 384]
    - [54, 5013.97]
  - - [39552, 2688, 1, 384]
    - [54, 5012.93]
  - - [26112, 768, 1, 384]
    - [54, 4898.82]
  - - [31488, 384, 1, 384]
    - [54, 4885.0]
  - - [29184, 1536, 1, 384]
    - [58, 4965.74]
  - - [12288, 1152, 1, 384]
    - [58, 4860.18]
  - - [32640, 1536, 1, 384]
    - [54, 4977.11]
  - - [5376, 2688, 1, 384]
    - [54, 4891.8]
  - - [13056, 768, 1, 384]
    - [58, 4792.36]
  - - [13824, 2304, 1, 384]
    - [58, 4935.43]
  - - [29952, 768, 1, 384]
    - [54, 4924.85]
  - - [1536, 1152, 1, 384]
    - [72, 4337.83]
  - - [28032, 2304, 1, 384]
    - [53, 4997.69]
  - - [16896, 768, 1, 384]
    - [58, 4850.32]
  - - [30336, 1920, 1, 384]
    - [54, 4993.11]
  - - [14976, 384, 1, 384]
    - [82, 4675.04]
  - - [27264, 2304, 1, 384]
    - [54, 4996.78]
  - - [39552, 1153, 1, 384]
    - [54, 4779.56]
  - - [7680, 1536, 1, 384]
    - [57, 4825.15]
  - - [16896, 384, 1, 384]
    - [53, 4689.82]
  - - [30336, 1152, 1, 384]
    - [53, 4968.41]
  - - [30720, 2688, 1, 384]
    - [54, 5003.59]
  - - [37632, 1153, 1, 384]
    - [54, 4761.67]
  - - [1920, 1153, 1, 384]
    - [44, 4410.98]
  - - [36096, 2688, 1, 384]
    - [54, 5005.94]
  - - [5760, 1920, 1, 384]
    - [54, 4789.48]
  - - [39552, 1536, 1, 384]
    - [58, 4980.13]
  - - [40704, 2304, 1, 384]
    - [54, 5007.3]
  - - [9216, 1153, 1, 384]
    - [54, 4581.63]
  - - [25728, 384, 1, 384]
    - [54, 4761.95]
  - - [43776, 2304, 1, 384]
    - [54, 5018.37]
  - - [27648, 1152, 1, 384]
    - [54, 4975.02]
  - - [31488, 1152, 1, 384]
    - [54, 4966.8]
  - - [39168, 1152, 1, 384]
    - [54, 4993.91]
  - - [42240, 1536, 1, 384]
    - [58, 4989.22]
  - - [20352, 1152, 1, 384]
    - [58, 4919.18]
  - - [8448, 1920, 1, 384]
    - [54, 4868.33]
  - - [32256, 1536, 1, 384]
    - [58, 4973.64]
  - - [25344, 1152, 1, 384]
    - [54, 4952.11]
  - - [21888, 2304, 1, 384]
    - [53, 4979.92]
  - - [44160, 2304, 1, 384]
    - [58, 5006.17]
  - - [30336, 2688, 1, 384]
    - [54, 5003.67]
  - - [14208, 3072, 1, 384]
    - [58, 4960.88]
  - - [6144, 2688, 1, 384]
    - [54, 4907.9]
  - - [39168, 1536, 1, 384]
    - [58, 4985.33]
  - - [11904, 1920, 1, 384]
    - [54, 4911.57]
  - - [31104, 1920, 1, 384]
    - [54, 5006.15]
  - - [8064, 1536, 1, 384]
    - [57, 4812.75]
  - - [22272, 1152, 1, 384]
    - [54, 4946.29]
  - - [21120, 1920, 1, 384]
    - [54, 4983.79]
  - - [29952, 1152, 1, 384]
    - [54, 4972.01]
  - - [22656, 2304, 1, 384]
    - [54, 4996.56]
  - - [9600, 1152, 1, 384]
    - [54, 4791.42]
  - - [19968, 2688, 1, 384]
    - [54, 5002.09]
  - - [22656, 3072, 1, 384]
    - [53, 4993.93]
  - - [10752, 768, 1, 384]
    - [57, 4815.48]
  - - [41856, 768, 1, 384]
    - [54, 4963.18]
  - - [19584, 2688, 1, 384]
    - [54, 4996.85]
  - - [16128, 1153, 1, 384]
    - [54, 4690.92]
  - - [2304, 1152, 1, 384]
    - [70, 4291.81]
  - - [23424, 384, 1, 384]
    - [53, 4822.96]
  - - [14592, 768, 1, 384]
    - [58, 4803.5]
  - - [24576, 3072, 1, 384]
    - [53, 4985.87]
  - - [14592, 1152, 1, 384]
    - [54, 4921.5]
  - - [18432, 2304, 1, 384]
    - [58, 4958.54]
  - - [20736, 384, 1, 384]
    - [54, 4704.94]
  - - [9216, 1920, 1, 384]
    - [54, 4935.77]
  - - [31872, 2688, 1, 384]
    - [53, 5014.55]
  - - [41472, 1152, 1, 384]
    - [54, 4987.95]
  - - [14976, 1920, 1, 384]
    - [54, 4957.49]
  - - [13824, 1152, 1, 384]
    - [58, 4870.57]
  - - [33024, 2688, 1, 384]
    - [54, 5014.99]
  - - [43008, 1153, 1, 384]
    - [53, 4774.12]
  - - [1536, 768, 1, 384]
    - [58, 4513.6]
  - - [34176, 1153, 1, 384]
    - [54, 4761.81]
  - - [33024, 2304, 1, 384]
    - [54, 5008.01]
  - - [41856, 1153, 1, 384]
    - [54, 4781.96]
  - - [31488, 1153, 1, 384]
    - [54, 4765.83]
  - - [17280, 768, 1, 384]
    - [54, 4871.78]
  - - [29184, 1153, 1, 384]
    - [54, 4761.81]
  - - [21504, 3072, 1, 384]
    - [54, 4998.14]
  - - [3456, 1153, 1, 384]
    - [43, 4357.92]
  - - [37632, 2688, 1, 384]
    - [54, 5015.73]
  - - [14208, 2688, 1, 384]
    - [54, 4978.95]
  - - [38016, 2304, 1, 384]
    - [54, 5009.7]
  - - [16896, 2688, 1, 384]
    - [54, 4998.03]
  - - [4224, 1153, 1, 384]
    - [53, 4436.77]
  - - [31104, 768, 1, 384]
    - [54, 4937.32]
  - - [41472, 2304, 1, 384]
    - [54, 5011.85]
  - - [10752, 1152, 1, 384]
    - [53, 4835.45]
  - - [9216, 3072, 1, 384]
    - [57, 4928.13]
  - - [23424, 2688, 1, 384]
    - [54, 4997.16]
  - - [18048, 1152, 1, 384]
    - [53, 4933.06]
  - - [39936, 3072, 1, 384]
    - [54, 5007.46]
  - - [22656, 384, 1, 384]
    - [54, 4717.53]
  - - [10368, 2688, 1, 384]
    - [58, 4951.96]
  - - [41472, 384, 1, 384]
    - [54, 4885.2]
  - - [26496, 2688, 1, 384]
    - [54, 5010.88]
  - - [16512, 2304, 1, 384]
    - [54, 4977.77]
  - - [31104, 1153, 1, 384]
    - [54, 4761.88]
  - - [9600, 1153, 1, 384]
    - [54, 4598.23]
  - - [16512, 1153, 1, 384]
    - [54, 4701.43]
  - - [11520, 1920, 1, 384]
    - [54, 4923.98]
  - - [39552, 768, 1, 384]
    - [54, 4946.13]
  - - [5376, 1153, 1, 384]
    - [54, 4471.77]
  - - [26112, 384, 1, 384]
    - [54, 4788.78]
  - - [23808, 1152, 1, 384]
    - [54, 4955.54]
  - - [29568, 3072, 1, 384]
    - [58, 4988.31]
  - - [12672, 2304, 1, 384]
    - [54, 4937.98]
  - - [11136, 768, 1, 384]
    - [54, 4802.78]
  - - [1152, 1152, 1, 384]
    - [65, 3860.67]
  - - [6144, 2304, 1, 384]
    - [53, 4884.29]
  - - [14208, 2304, 1, 384]
    - [54, 4952.69]
  - - [19584, 2304, 1, 384]
    - [54, 4982.82]
  - - [34560, 2688, 1, 384]
    - [54, 5009.37]
  - - [38400, 3072, 1, 384]
    - [54, 5017.18]
  - - [36480, 768, 1, 384]
    - [53, 4934.23]
  - - [15744, 1152, 1, 384]
    - [53, 4883.63]
  - - [15744, 2688, 1, 384]
    - [54, 4982.54]
  - - [39168, 3072, 1, 384]
    - [54, 5013.87]
  - - [14976, 1536, 1, 384]
    - [54, 4920.57]
  - - [6144, 3072, 1, 384]
    - [58, 4887.76]
  - - [31872, 1153, 1, 384]
    - [54, 4770.65]
  - - [24576, 1153, 1, 384]
    - [54, 4744.43]
  - - [41088, 3072, 1, 384]
    - [58, 5002.19]
  - - [34176, 3072, 1, 384]
    - [58, 5001.42]
  - - [6144, 1152, 1, 384]
    - [58, 4818.3]
  - - [7296, 384, 1, 384]
    - [82, 4461.84]
  - - [36096, 384, 1, 384]
    - [54, 4861.68]
  - - [33792, 1153, 1, 384]
    - [54, 4772.04]
  - - [1920, 768, 1, 384]
    - [74, 4210.53]
  - - [34560, 1536, 1, 384]
    - [54, 4972.95]
  - - [8448, 2304, 1, 384]
    - [54, 4901.92]
  - - [9984, 2688, 1, 384]
    - [54, 4939.14]
  - - [16512, 1152, 1, 384]
    - [54, 4896.62]
  - - [8064, 1153, 1, 384]
    - [54, 4611.67]
  - - [8064, 768, 1, 384]
    - [54, 4704.03]
  - - [44160, 1152, 1, 384]
    - [54, 4989.47]
  - - [26112, 2688, 1, 384]
    - [54, 5000.26]
  - - [21120, 1152, 1, 384]
    - [54, 4958.4]
  - - [6528, 3072, 1, 384]
    - [54, 4903.31]
  - - [39936, 768, 1, 384]
    - [54, 4946.83]
  - - [20736, 1152, 1, 384]
    - [54, 4955.03]
  - - [19200, 1920, 1, 384]
    - [58, 4968.75]
  - - [38400, 768, 1, 384]
    - [58, 4947.5]
  - - [19200, 1153, 1, 384]
    - [54, 4733.84]
  - - [29952, 3072, 1, 384]
    - [54, 5005.19]
  - - [19200, 2304, 1, 384]
    - [53, 4973.81]
  - - [8448, 1536, 1, 384]
    - [58, 4863.01]
  - - [13824, 1536, 1, 384]
    - [58, 4902.08]
  - - [6912, 1152, 1, 384]
    - [58, 4722.38]
  - - [32640, 768, 1, 384]
    - [54, 4946.11]
  - - [9600, 768, 1, 384]
    - [58, 4743.89]
  - - [29568, 1152, 1, 384]
    - [54, 4970.94]
  - - [34560, 2304, 1, 384]
    - [54, 5003.32]
  - - [10368, 768, 1, 384]
    - [54, 4706.68]
  - - [28800, 1153, 1, 384]
    - [53, 4744.69]
  - - [768, 768, 1, 384]
    - [78, 3482.36]
  - - [2688, 1152, 1, 384]
    - [58, 4580.46]
  - - [20736, 1536, 1, 384]
    - [58, 4937.58]
  - - [19584, 1153, 1, 384]
    - [54, 4733.21]
  - - [28800, 768, 1, 384]
    - [54, 4919.76]
  - - [42240, 768, 1, 384]
    - [54, 4964.33]
  - - [34176, 384, 1, 384]
    - [54, 4844.7]
  - - [40320, 2304, 1, 384]
    - [53, 4996.6]
  - - [22656, 1153, 1, 384]
    - [54, 4730.71]
  - - [18816, 1153, 1, 384]
    - [54, 4724.3]
  - - [13440, 1153, 1, 384]
    - [54, 4651.66]
  - - [28416, 2688, 1, 384]
    - [58, 5004.98]
  - - [30720, 1920, 1, 384]
    - [54, 4998.82]
  - - [8064, 1152, 1, 384]
    - [58, 4796.25]
  - - [39936, 1536, 1, 384]
    - [54, 4982.15]
  - - [10368, 1536, 1, 384]
    - [53, 4857.73]
  - - [768, 769, 1, 384]
    - [42, 3419.59]
  - - [21888, 1536, 1, 384]
    - [53, 4949.57]
  - - [38784, 2688, 1, 384]
    - [53, 5006.9]
  - - [22272, 3072, 1, 384]
    - [54, 4984.17]
  - - [27648, 2304, 1, 384]
    - [58, 4997.34]
  - - [34944, 1153, 1, 384]
    - [54, 4789.65]
  - - [41088, 2688, 1, 384]
    - [54, 5018.71]
  - - [11136, 1920, 1, 384]
    - [54, 4929.72]
  - - [35712, 384, 1, 384]
    - [53, 4892.37]
  - - [22656, 1152, 1, 384]
    - [54, 4942.93]
  - - [36864, 1536, 1, 384]
    - [54, 4983.74]
  - - [14592, 1153, 1, 384]
    - [54, 4703.98]
  - - [15744, 3072, 1, 384]
    - [58, 4970.56]
  - - [14976, 1153, 1, 384]
    - [54, 4692.61]
  - - [37248, 768, 1, 384]
    - [58, 4956.36]
  - - [23424, 3072, 1, 384]
    - [58, 4997.56]
  - - [23040, 2688, 1, 384]
    - [54, 4992.59]
  - - [4224, 3072, 1, 384]
    - [58, 4867.95]
  - - [6912, 2304, 1, 384]
    - [54, 4878.5]
  - - [24192, 3072, 1, 384]
    - [58, 4992.8]
  - - [17664, 3072, 1, 384]
    - [54, 4983.33]
  - - [27648, 1153, 1, 384]
    - [54, 4756.01]
  - - [37632, 1920, 1, 384]
    - [54, 5001.9]
  - - [36096, 768, 1, 384]
    - [54, 4957.69]
  - - [4224, 2688, 1, 384]
    - [58, 4850.68]
  - - [40704, 1152, 1, 384]
    - [54, 4978.42]
  - - [8448, 1153, 1, 384]
    - [53, 4621.16]
  - - [7680, 768, 1, 384]
    - [54, 4763.85]
  - - [25344, 3072, 1, 384]
    - [54, 4995.46]
  - - [13440, 3072, 1, 384]
    - [58, 4957.5]
  - - [38016, 1920, 1, 384]
    - [54, 5010.41]
  - - [36864, 384, 1, 384]
    - [54, 4871.33]
  - - [35712, 2304, 1, 384]
    - [54, 5004.48]
  - - [34560, 1152, 1, 384]
    - [54, 4975.67]
  - - [42240, 1152, 1, 384]
    - [54, 4991.03]
  - - [31872, 3072, 1, 384]
    - [54, 5006.09]
  - - [43008, 3072, 1, 384]
    - [54, 5007.97]
  - - [37248, 2688, 1, 384]
    - [54, 5008.56]
  - - [42624, 1153, 1, 384]
    - [54, 4779.62]
  - - [29568, 1920, 1, 384]
    - [54, 4997.46]
  - - [4992, 384, 1, 384]
    - [53, 4455.81]
  - - [384, 385, 1, 384]
    - [67, 1699.72]
  - - [38400, 2688, 1, 384]
    - [54, 5028.21]
  - - [25728, 768, 1, 384]
    - [53, 4892.89]
  - - [9600, 384, 1, 384]
    - [82, 4418.71]
  - - [11136, 3072, 1, 384]
    - [54, 4953.38]
  - - [8832, 1920, 1, 384]
    - [53, 4869.19]
  - - [43776, 1920, 1, 384]
    - [54, 5004.77]
  - - [3072, 1153, 1, 384]
    - [87, 4208.86]
  - - [14976, 3072, 1, 384]
    - [53, 4964.71]
  - - [21120, 1153, 1, 384]
    - [53, 4722.78]
  - - [38784, 3072, 1, 384]
    - [58, 5003.44]
  - - [12288, 384, 1, 384]
    - [53, 4699.02]
  - - [38784, 768, 1, 384]
    - [54, 4953.34]
  - - [36480, 1536, 1, 384]
    - [58, 4979.68]
  - - [29184, 384, 1, 384]
    - [53, 4829.16]
  - - [15744, 768, 1, 384]
    - [58, 4854.56]
  - - [27264, 1920, 1, 384]
    - [54, 4996.32]
  - - [43392, 1152, 1, 384]
    - [54, 4985.1]
  - - [33792, 2304, 1, 384]
    - [54, 4992.42]
  - - [384, 384, 1, 384]
    - [79, 1705.52]
  - - [9984, 1153, 1, 384]
    - [54, 4637.86]
  - - [8832, 2304, 1, 384]
    - [58, 4918.67]
  - - [18432, 3072, 1, 384]
    - [54, 4992.21]
  - - [41088, 1152, 1, 384]
    - [54, 4977.11]
  - - [39168, 2688, 1, 384]
    - [54, 5027.17]
  - - [39936, 1152, 1, 384]
    - [54, 4980.38]
  - - [43776, 1153, 1, 384]
    - [54, 4784.95]
  - - [31104, 384, 1, 384]
    - [54, 4835.4]
  - - [16512, 3072, 1, 384]
    - [58, 4976.13]
  - - [39168, 384, 1, 384]
    - [54, 4873.07]
  - - [18816, 1152, 1, 384]
    - [54, 4909.98]
  - - [43776, 1152, 1, 384]
    - [54, 4989.26]
  - - [35328, 1920, 1, 384]
    - [54, 5000.27]
  - - [29952, 1153, 1, 384]
    - [54, 4764.22]
  - - [38016, 384, 1, 384]
    - [54, 4841.34]
  - - [41856, 1152, 1, 384]
    - [54, 4993.95]
  - - [43008, 1536, 1, 384]
    - [54, 4994.71]
  - - [35328, 2304, 1, 384]
    - [58, 4989.08]
  - - [11520, 1152, 1, 384]
    - [54, 4882.24]
  - - [36864, 1152, 1, 384]
    - [58, 4972.27]
  - - [37248, 2304, 1, 384]
    - [58, 4996.85]
  - - [26880, 3072, 1, 384]
    - [58, 4997.79]
  - - [28032, 1153, 1, 384]
    - [54, 4750.89]
  - - [29184, 768, 1, 384]
    - [54, 4918.57]
  - - [3456, 1152, 1, 384]
    - [70, 4454.1]
  - - [39936, 1153, 1, 384]
    - [53, 4763.76]
  - - [17664, 384, 1, 384]
    - [82, 4684.98]
  - - [18048, 2688, 1, 384]
    - [54, 4988.01]
  - - [7296, 2688, 1, 384]
    - [54, 4929.62]
  - - [13056, 2304, 1, 384]
    - [54, 4951.53]
  - - [42624, 1536, 1, 384]
    - [58, 4981.58]
  - - [2688, 1536, 1, 384]
    - [82, 4553.79]
  - - [29568, 1153, 1, 384]
    - [54, 4748.11]
  - - [32256, 2688, 1, 384]
    - [54, 5015.97]
  - - [18816, 1536, 1, 384]
    - [53, 4919.82]
  - - [32256, 3072, 1, 384]
    - [54, 5005.99]
  - - [33792, 3072, 1, 384]
    - [54, 5008.65]
  - - [9984, 3072, 1, 384]
    - [54, 4941.1]
  - - [34560, 1153, 1, 384]
    - [54, 4762.85]
  - - [13056, 1536, 1, 384]
    - [58, 4894.21]
  - - [35328, 384, 1, 384]
    - [54, 4863.98]
  - - [26496, 384, 1, 384]
    - [54, 4857.03]
  - - [34944, 1536, 1, 384]
    - [54, 4977.25]
  - - [23424, 768, 1, 384]
    - [58, 4900.42]
  - - [38400, 1920, 1, 384]
    - [54, 5014.41]
  - - [15360, 2304, 1, 384]
    - [54, 4941.01]
  - - [27264, 2688, 1, 384]
    - [54, 4997.74]
  - - [11136, 1536, 1, 384]
    - [58, 4862.51]
  - - [5760, 1153, 1, 384]
    - [54, 4539.43]
  - - [41472, 3072, 1, 384]
    - [54, 5016.11]
  - - [23040, 1153, 1, 384]
    - [54, 4738.31]
  - - [12288, 1536, 1, 384]
    - [58, 4905.89]
  - - [14592, 384, 1, 384]
    - [54, 4627.27]
  - - [6528, 2304, 1, 384]
    - [54, 4860.93]
  - - [25728, 1153, 1, 384]
    - [54, 4744.88]
  - - [30720, 2304, 1, 384]
    - [54, 4997.63]
  - - [24576, 1152, 1, 384]
    - [53, 4944.53]
  - - [4608, 1153, 1, 384]
    - [52, 4445.27]
  - - [4992, 768, 1, 384]
    - [86, 4537.11]
  - - [34944, 2688, 1, 384]
    - [53, 5015.17]
  - - [768, 385, 1, 384]
    - [62, 2498.7]
  - - [24960, 2688, 1, 384]
    - [54, 5006.67]
  - - [9984, 384, 1, 384]
    - [87, 4542.15]
  - - [12672, 3072, 1, 384]
    - [53, 4959.76]
  - - [18432, 1920, 1, 384]
    - [54, 4965.05]
  - - [3840, 2688, 1, 384]
    - [53, 4780.74]
  - - [26496, 1153, 1, 384]
    - [54, 4755.39]
  - - [13824, 1920, 1, 384]
    - [54, 4943.04]
  - - [26880, 1153, 1, 384]
    - [54, 4742.79]
  - - [17280, 2688, 1, 384]
    - [54, 4991.57]
  - - [5376, 3072, 1, 384]
    - [58, 4909.27]
  - - [15360, 1536, 1, 384]
    - [58, 4913.82]
  - - [43776, 2688, 1, 384]
    - [54, 5019.33]
  - - [24960, 1920, 1, 384]
    - [54, 4990.97]
  - - [31872, 768, 1, 384]
    - [54, 4936.78]
  - - [23808, 1153, 1, 384]
    - [54, 4751.73]
  - - [23040, 384, 1, 384]
    - [53, 4764.65]
  - - [1920, 1152, 1, 384]
    - [44, 4434.77]
  - - [11904, 2688, 1, 384]
    - [54, 4948.94]
  - - [17664, 1152, 1, 384]
    - [53, 4921.27]
  - - [12672, 1153, 1, 384]
    - [54, 4659.93]
  - - [7296, 1152, 1, 384]
    - [54, 4749.42]
  - - [7296, 768, 1, 384]
    - [53, 4618.53]
  - - [1152, 1153, 1, 384]
    - [64, 3859.34]
  - - [27264, 1152, 1, 384]
    - [54, 4970.13]
  - - [19200, 1536, 1, 384]
    - [58, 4924.18]
  - - [11904, 3072, 1, 384]
    - [58, 4934.55]
  - - [37248, 1152, 1, 384]
    - [54, 4983.1]
  - - [20736, 3072, 1, 384]
    - [58, 4980.86]
  - - [10368, 384, 1, 384]
    - [82, 4459.81]
  - - [11904, 1153, 1, 384]
    - [54, 4648.05]
  - - [12288, 768, 1, 384]
    - [58, 4831.07]
  - - [33792, 768, 1, 384]
    - [54, 4936.33]
  - - [21888, 2688, 1, 384]
    - [54, 4999.3]
  - - [15360, 3072, 1, 384]
    - [54, 4967.21]
  - - [2688, 1920, 1, 384]
    - [82, 4611.87]
  - - [21504, 1536, 1, 384]
    - [58, 4947.64]
  - - [19968, 768, 1, 384]
    - [58, 4886.98]
  - - [4608, 3072, 1, 384]
    - [58, 4872.38]
  - - [35328, 1152, 1, 384]
    - [54, 4964.92]
  - - [34176, 1152, 1, 384]
    - [54, 4976.68]
  - - [42624, 3072, 1, 384]
    - [54, 5009.18]
  - - [19200, 2688, 1, 384]
    - [58, 4986.14]
  - - [31104, 3072, 1, 384]
    - [58, 5003.6]
  - - [31488, 2304, 1, 384]
    - [54, 4993.86]
  - - [35712, 3072, 1, 384]
    - [58, 5009.56]
  - - [18432, 1153, 1, 384]
    - [54, 4706.24]
  - - [12288, 2688, 1, 384]
    - [53, 4956.38]
  - - [21120, 3072, 1, 384]
    - [58, 4982.52]
  - - [12288, 2304, 1, 384]
    - [53, 4931.88]
  - - [28416, 768, 1, 384]
    - [54, 4916.82]
  - - [33408, 3072, 1, 384]
    - [54, 4993.68]
  - - [36480, 384, 1, 384]
    - [54, 4863.47]
  - - [4224, 384, 1, 384]
    - [82, 4010.14]
  - - [27264, 1536, 1, 384]
    - [54, 4969.03]
  - - [12672, 1152, 1, 384]
    - [53, 4858.29]
  - - [28416, 1152, 1, 384]
    - [54, 4961.14]
  - - [6528, 1153, 1, 384]
    - [53, 4587.46]
  - - [9216, 384, 1, 384]
    - [57, 4671.87]
  - - [34944, 1152, 1, 384]
    - [58, 4972.63]
  - - [34560, 768, 1, 384]
    - [54, 4949.96]
  - - [31488, 3072, 1, 384]
    - [54, 5005.47]
  - - [39936, 2688, 1, 384]
    - [54, 5028.3]
  - - [8064, 1920, 1, 384]
    - [53, 4871.23]
  - - [13056, 1153, 1, 384]
    - [54, 4697.06]
  - - [9984, 1152, 1, 384]
    - [54, 4816.36]
  - - [26880, 1536, 1, 384]
    - [54, 4961.16]
  - - [33792, 384, 1, 384]
    - [54, 4853.35]
  - - [4608, 384, 1, 384]
    - [81, 4328.98]
  - - [28032, 2688, 1, 384]
    - [54, 5015.88]
  - - [7296, 3072, 1, 384]
    - [54, 4921.05]
  - - [41472, 2688, 1, 384]
    - [54, 5028.2]
  - - [29568, 2688, 1, 384]
    - [54, 5009.14]
  - - [37248, 1920, 1, 384]
    - [54, 4999.35]
  - - [6912, 2688, 1, 384]
    - [54, 4884.78]
  - - [33024, 1152, 1, 384]
    - [54, 4976.89]
  - - [31104, 1152, 1, 384]
    - [54, 4969.95]
  - - [31104, 2688, 1, 384]
    - [54, 5015.92]
  - - [5376, 1920, 1, 384]
    - [53, 4786.52]
  - - [21888, 1152, 1, 384]
    - [54, 4936.25]
  - - [40320, 1920, 1, 384]
    - [54, 4991.36]
  - - [41856, 3072, 1, 384]
    - [58, 5015.47]
  - - [37248, 3072, 1, 384]
    - [58, 5002.66]
  - - [41856, 2688, 1, 384]
    - [54, 5020.04]
  - - [14208, 1153, 1, 384]
    - [53, 4687.64]
  - - [9984, 768, 1, 384]
    - [58, 4729.51]
  - - [3456, 2688, 1, 384]
    - [58, 4804.52]
  - - [41088, 1153, 1, 384]
    - [54, 4777.86]
  - - [13056, 1152, 1, 384]
    - [54, 4846.24]
  - - [32256, 1152, 1, 384]
    - [54, 4982.06]
  - - [6912, 3072, 1, 384]
    - [58, 4906.92]
  - - [14976, 1152, 1, 384]
    - [54, 4920.46]
  - - [21888, 3072, 1, 384]
    - [54, 4980.16]
  - - [1536, 1153, 1, 384]
    - [44, 4196.91]
  - - [8064, 384, 1, 384]
    - [58, 4557.98]
  - - [16512, 384, 1, 384]
    - [53, 4610.65]
  - - [27648, 1536, 1, 384]
    - [54, 4974.7]
  - - [35712, 1152, 1, 384]
    - [53, 4970.19]
  - - [43392, 2688, 1, 384]
    - [54, 5026.27]
  - - [6528, 384, 1, 384]
    - [84, 4413.94]
  - - [13824, 3072, 1, 384]
    - [58, 4953.54]
  - - [11136, 384, 1, 384]
    - [54, 4702.92]
  - - [14208, 384, 1, 384]
    - [58, 4697.86]
  - - [36480, 1920, 1, 384]
    - [54, 5012.07]
  - - [36480, 3072, 1, 384]
    - [54, 4997.05]
  - - [29568, 1536, 1, 384]
    - [58, 4970.85]
  - - [33792, 1152, 1, 384]
    - [53, 4980.04]
  - - [36864, 2688, 1, 384]
    - [54, 5010.21]
  - - [23808, 768, 1, 384]
    - [54, 4895.19]
  - - [42624, 1152, 1, 384]
    - [54, 4985.64]
  - - [8448, 1152, 1, 384]
    - [53, 4837.08]
  - - [28032, 384, 1, 384]
    - [54, 4820.51]
  - - [29568, 768, 1, 384]
    - [58, 4926.64]
  - - [2304, 768, 1, 384]
    - [67, 4308.13]
  - - [33024, 1153, 1, 384]
    - [53, 4765.11]
  - - [12672, 768, 1, 384]
    - [58, 4817.37]
  - - [15744, 2304, 1, 384]
    - [54, 4966.59]
  - - [36096, 1281, 1, 256]
    - [110, 4686.88]
  - - [24064, 3072, 1, 256]
    - [112, 4806.79]
  - - [256, 512, 1, 256]
    - [115, 1412.22]
  - - [40960, 27648, 1, 256]
    - [112, 4849.11]
  - - [11264, 1792, 1, 256]
    - [105, 4705.84]
  - - [22016, 512, 1, 256]
    - [112, 4560.18]
  - - [31744, 3072, 1, 256]
    - [112, 4805.75]
  - - [13056, 1792, 1, 256]
    - [105, 4730.72]
  - - [35328, 22785, 1, 256]
    - [105, 4827.72]
  - - [28160, 15872, 1, 256]
    - [112, 4841.73]
  - - [39168, 1792, 1, 256]
    - [105, 4824.09]
  - - [2560, 2561, 1, 256]
    - [132, 4336.0]
  - - [35328, 1536, 1, 256]
    - [112, 4783.72]
  - - [37376, 3072, 1, 256]
    - [112, 4822.4]
  - - [23808, 11265, 1, 256]
    - [112, 4782.95]
  - - [36096, 2048, 1, 256]
    - [112, 4812.7]
  - - [27136, 1280, 1, 256]
    - [105, 4775.78]
  - - [28928, 3072, 1, 256]
    - [112, 4804.79]
  - - [13568, 1792, 1, 256]
    - [105, 4735.51]
  - - [16640, 4353, 1, 256]
    - [105, 4745.34]
  - - [33792, 1280, 1, 256]
    - [112, 4800.56]
  - - [12544, 2048, 1, 256]
    - [112, 4702.05]
  - - [38912, 26624, 1, 256]
    - [112, 4846.7]
  - - [6912, 3585, 1, 256]
    - [108, 4605.19]
  - - [32768, 1792, 1, 256]
    - [105, 4819.31]
  - - [30976, 18688, 1, 256]
    - [105, 4861.51]
  - - [32256, 512, 1, 256]
    - [112, 4646.61]
  - - [512, 2048, 1, 256]
    - [102, 3942.94]
  - - [13312, 2048, 1, 256]
    - [112, 4721.25]
  - - [10496, 3072, 1, 256]
    - [112, 4733.13]
  - - [15872, 3584, 1, 256]
    - [112, 4789.08]
  - - [33792, 512, 1, 256]
    - [112, 4653.68]
  - - [6400, 1792, 1, 256]
    - [105, 4582.65]
  - - [39680, 27393, 1, 256]
    - [105, 4847.82]
  - - [36864, 24577, 1, 256]
    - [112, 4801.26]
  - - [38400, 1280, 1, 256]
    - [105, 4806.01]
  - - [26112, 1536, 1, 256]
    - [112, 4767.32]
  - - [26368, 1536, 1, 256]
    - [112, 4766.96]
  - - [16896, 4353, 1, 256]
    - [105, 4734.69]
  - - [14336, 1793, 1, 256]
    - [110, 4576.93]
  - - [1280, 1025, 1, 256]
    - [95, 3510.37]
  - - [3840, 3072, 1, 256]
    - [112, 4594.27]
  - - [2560, 3072, 1, 256]
    - [132, 4510.01]
  - - [6656, 1536, 1, 256]
    - [132, 4550.15]
  - - [27136, 1792, 1, 256]
    - [105, 4797.26]
  - - [43776, 3072, 1, 256]
    - [112, 4830.08]
  - - [23296, 1792, 1, 256]
    - [105, 4789.92]
  - - [20224, 256, 1, 256]
    - [123, 4406.25]
  - - [42496, 2048, 1, 256]
    - [112, 4812.87]
  - - [11264, 7937, 1, 256]
    - [105, 4763.52]
  - - [768, 3072, 1, 256]
    - [105, 4332.71]
  - - [6912, 3841, 1, 256]
    - [105, 4655.93]
  - - [40960, 769, 1, 256]
    - [110, 4426.24]
  - - [39680, 1281, 1, 256]
    - [110, 4686.15]
  - - [9984, 1280, 1, 256]
    - [105, 4637.61]
  - - [41984, 1536, 1, 256]
    - [112, 4799.96]
  - - [34304, 1281, 1, 256]
    - [110, 4685.58]
  - - [34048, 256, 1, 256]
    - [112, 4499.45]
  - - [31232, 1024, 1, 256]
    - [112, 4745.15]
  - - [11264, 8192, 1, 256]
    - [112, 4817.07]
  - - [6400, 3072, 1, 256]
    - [112, 4658.1]
  - - [40448, 9216, 1, 256]
    - [112, 4847.45]
  - - [7680, 4353, 1, 256]
    - [105, 4688.27]
  - - [23296, 3072, 1, 256]
    - [112, 4802.59]
  - - [7936, 4609, 1, 256]
    - [112, 4645.16]
  - - [20736, 8448, 1, 256]
    - [105, 4854.4]
  - - [17408, 1792, 1, 256]
    - [105, 4751.74]
  - - [768, 1024, 1, 256]
    - [127, 3853.88]
  - - [1792, 1793, 1, 256]
    - [131, 4111.89]
  - - [38656, 3072, 1, 256]
    - [112, 4817.62]
  - - [12544, 9216, 1, 256]
    - [112, 4804.76]
  - - [28160, 1792, 1, 256]
    - [112, 4803.4]
  - - [13824, 3072, 1, 256]
    - [112, 4776.98]
  - - [42752, 1792, 1, 256]
    - [105, 4826.97]
  - - [35584, 23041, 1, 256]
    - [112, 4794.02]
  - - [13056, 3072, 1, 256]
    - [112, 4777.34]
  - - [40960, 1024, 1, 256]
    - [112, 4772.7]
  - - [2048, 2048, 1, 256]
    - [120, 4396.99]
  - - [9984, 512, 1, 256]
    - [132, 4380.18]
  - - [11264, 1024, 1, 256]
    - [112, 4570.6]
  - - [23552, 512, 1, 256]
    - [112, 4598.14]
  - - [37888, 768, 1, 256]
    - [112, 4753.6]
  - - [17664, 2048, 1, 256]
    - [112, 4757.34]
  - - [36608, 256, 1, 256]
    - [112, 4580.96]
  - - [42752, 1281, 1, 256]
    - [110, 4691.57]
  - - [19456, 3072, 1, 256]
    - [112, 4793.97]
  - - [22784, 1024, 1, 256]
    - [112, 4703.94]
  - - [15872, 9216, 1, 256]
    - [112, 4825.66]
  - - [39424, 1024, 1, 256]
    - [112, 4754.94]
  - - [30976, 1792, 1, 256]
    - [105, 4817.44]
  - - [26368, 14081, 1, 256]
    - [105, 4825.57]
  - - [21760, 1281, 1, 256]
    - [110, 4645.28]
  - - [35328, 23041, 1, 256]
    - [112, 4803.3]
  - - [16128, 1280, 1, 256]
    - [105, 4715.39]
  - - [22528, 1281, 1, 256]
    - [110, 4644.04]
  - - [27648, 15105, 1, 256]
    - [105, 4820.03]
  - - [25856, 13568, 1, 256]
    - [105, 4865.18]
  - - [36864, 768, 1, 256]
    - [112, 4744.54]
  - - [23296, 9216, 1, 256]
    - [112, 4833.37]
  - - [32000, 1281, 1, 256]
    - [110, 4678.78]
  - - [18176, 1281, 1, 256]
    - [110, 4617.3]
  - - [2048, 1024, 1, 256]
    - [111, 4128.51]
  - - [38144, 256, 1, 256]
    - [105, 4591.52]
  - - [21248, 1280, 1, 256]
    - [105, 4747.02]
  - - [19712, 1281, 1, 256]
    - [110, 4635.08]
  - - [1792, 1280, 1, 256]
    - [97, 4237.89]
  - - [12032, 1792, 1, 256]
    - [112, 4715.76]
  - - [23040, 3072, 1, 256]
    - [112, 4816.43]
  - - [11520, 1536, 1, 256]
    - [112, 4661.3]
  - - [16128, 768, 1, 256]
    - [112, 4619.33]
  - - [15360, 3072, 1, 256]
    - [112, 4780.97]
  - - [38912, 26369, 1, 256]
    - [105, 4821.94]
  - - [27392, 2048, 1, 256]
    - [112, 4783.91]
  - - [25344, 13056, 1, 256]
    - [105, 4861.4]
  - - [39168, 26880, 1, 256]
    - [105, 4869.85]
  - - [39424, 768, 1, 256]
    - [105, 4747.92]
  - - [16384, 1280, 1, 256]
    - [112, 4703.62]
  - - [10496, 1792, 1, 256]
    - [112, 4707.17]
  - - [28672, 3072, 1, 256]
    - [112, 4803.5]
  - - [5888, 1280, 1, 256]
    - [132, 4520.99]
  - - [27392, 768, 1, 256]
    - [105, 4727.93]
  - - [39680, 768, 1, 256]
    - [105, 4757.88]
  - - [11520, 8193, 1, 256]
    - [112, 4750.9]
  - - [17408, 4865, 1, 256]
    - [105, 4739.68]
  - - [35840, 1281, 1, 256]
    - [110, 4683.9]
  - - [14080, 1537, 1, 256]
    - [112, 4486.77]
  - - [29184, 768, 1, 256]
    - [105, 4722.32]
  - - [2560, 1280, 1, 256]
    - [120, 4237.53]
  - - [19200, 6913, 1, 256]
    - [105, 4786.8]
  - - [33536, 9216, 1, 256]
    - [112, 4838.6]
  - - [5632, 3072, 1, 256]
    - [112, 4634.01]
  - - [32768, 20480, 1, 256]
    - [112, 4838.3]
  - - [34560, 2048, 1, 256]
    - [112, 4802.74]
  - - [29440, 9216, 1, 256]
    - [112, 4831.11]
  - - [40960, 1792, 1, 256]
    - [105, 4817.73]
  - - [10240, 3072, 1, 256]
    - [112, 4728.98]
  - - [20992, 1792, 1, 256]
    - [105, 4779.79]
  - - [42240, 9216, 1, 256]
    - [112, 4847.62]
  - - [14080, 2048, 1, 256]
    - [112, 4723.56]
  - - [5120, 256, 1, 256]
    - [119, 3981.3]
  - - [6144, 512, 1, 256]
    - [113, 4254.58]
  - - [19200, 6912, 1, 256]
    - [105, 4851.5]
  - - [8704, 1280, 1, 256]
    - [105, 4568.37]
  - - [43264, 512, 1, 256]
    - [112, 4697.4]
  - - [27392, 1792, 1, 256]
    - [105, 4816.09]
  - - [43264, 1024, 1, 256]
    - [112, 4773.96]
  - - [2048, 2049, 1, 256]
    - [108, 4210.83]
  - - [42496, 1536, 1, 256]
    - [112, 4791.51]
  - - [20480, 512, 1, 256]
    - [132, 4569.58]
  - - [29440, 16897, 1, 256]
    - [112, 4792.23]
  - - [3584, 768, 1, 256]
    - [120, 4157.68]
  - - [20480, 8192, 1, 256]
    - [112, 4841.21]
  - - [15360, 1536, 1, 256]
    - [112, 4706.97]
  - - [11264, 8193, 1, 256]
    - [112, 4734.97]
  - - [27136, 2048, 1, 256]
    - [112, 4785.75]
  - - [19968, 1281, 1, 256]
    - [110, 4630.34]
  - - [26880, 14337, 1, 256]
    - [112, 4785.05]
  - - [28928, 16641, 1, 256]
    - [105, 4830.02]
  - - [15360, 2817, 1, 256]
    - [104, 4696.23]
  - - [15616, 1280, 1, 256]
    - [105, 4704.56]
  - - [1536, 1537, 1, 256]
    - [132, 3880.16]
  - - [44288, 1536, 1, 256]
    - [112, 4799.78]
  - - [7936, 1536, 1, 256]
    - [132, 4575.07]
  - - [18176, 5633, 1, 256]
    - [112, 4733.05]
  - - [44032, 1280, 1, 256]
    - [105, 4807.61]
  - - [38912, 1024, 1, 256]
    - [112, 4741.35]
  - - [8448, 3072, 1, 256]
    - [112, 4720.2]
  - - [17920, 5632, 1, 256]
    - [112, 4811.34]
  - - [19456, 512, 1, 256]
    - [130, 4499.82]
  - - [3328, 1281, 1, 256]
    - [110, 4125.86]
  - - [22528, 10240, 1, 256]
    - [112, 4838.15]
  - - [24576, 2048, 1, 256]
    - [112, 4789.0]
  - - [1792, 2048, 1, 256]
    - [118, 4381.29]
  - - [33280, 2048, 1, 256]
    - [112, 4797.92]
  - - [25600, 1536, 1, 256]
    - [112, 4757.87]
  - - [38400, 1281, 1, 256]
    - [110, 4683.13]
  - - [17664, 256, 1, 256]
    - [112, 4327.9]
  - - [39936, 3072, 1, 256]
    - [112, 4826.34]
  - - [7168, 4096, 1, 256]
    - [112, 4707.51]
  - - [10240, 768, 1, 256]
    - [132, 4535.2]
  - - [41216, 1280, 1, 256]
    - [112, 4805.19]
  - - [24832, 1024, 1, 256]
    - [112, 4716.66]
  - - [35328, 3072, 1, 256]
    - [112, 4821.88]
  - - [20480, 3072, 1, 256]
    - [112, 4793.95]
  - - [24832, 1792, 1, 256]
    - [112, 4787.33]
  - - [4352, 1280, 1, 256]
    - [132, 4388.97]
  - - [37376, 25088, 1, 256]
    - [112, 4838.25]
  - - [7168, 4097, 1, 256]
    - [110, 4624.21]
  - - [19200, 256, 1, 256]
    - [132, 4387.96]
  - - [21504, 768, 1, 256]
    - [112, 4671.67]
  - - [13312, 3072, 1, 256]
    - [112, 4759.84]
  - - [35072, 768, 1, 256]
    - [105, 4745.78]
  - - [22784, 2048, 1, 256]
    - [112, 4790.72]
  - - [40960, 1025, 1, 256]
    - [110, 4531.46]
  - - [28672, 256, 1, 256]
    - [112, 4491.89]
  - - [26880, 1280, 1, 256]
    - [105, 4781.47]
  - - [12032, 1536, 1, 256]
    - [112, 4665.12]
  - - [9216, 768, 1, 256]
    - [132, 4519.45]
  - - [44288, 27648, 1, 256]
    - [112, 4840.09]
  - - [23808, 1280, 1, 256]
    - [105, 4769.52]
  - - [32512, 1792, 1, 256]
    - [105, 4801.67]
  - - [39424, 256, 1, 256]
    - [112, 4582.96]
  - - [23808, 11520, 1, 256]
    - [105, 4864.68]
  - - [12032, 1281, 1, 256]
    - [110, 4572.11]
  - - [25600, 13057, 1, 256]
    - [105, 4806.69]
  - - [31744, 1281, 1, 256]
    - [110, 4674.03]
  - - [11520, 2048, 1, 256]
    - [112, 4696.14]
  - - [12032, 1280, 1, 256]
    - [105, 4659.9]
  - - [30208, 1281, 1, 256]
    - [110, 4667.93]
  - - [40448, 1792, 1, 256]
    - [105, 4827.86]
  - - [25088, 12800, 1, 256]
    - [112, 4843.84]
  - - [8448, 256, 1, 256]
    - [112, 4030.64]
  - - [22784, 10496, 1, 256]
    - [105, 4856.96]
  - - [38400, 26113, 1, 256]
    - [112, 4803.59]
  - - [32512, 2048, 1, 256]
    - [112, 4804.79]
  - - [9728, 3072, 1, 256]
    - [112, 4725.86]
  - - [5888, 1024, 1, 256]
    - [132, 4430.27]
  - - [20736, 1792, 1, 256]
    - [112, 4788.52]
  - - [11776, 1280, 1, 256]
    - [105, 4652.02]
  - - [7680, 3072, 1, 256]
    - [112, 4705.51]
  - - [5376, 2305, 1, 256]
    - [105, 4459.45]
  - - [6912, 3840, 1, 256]
    - [105, 4752.39]
  - - [18944, 1024, 1, 256]
    - [112, 4671.91]
  - - [11008, 2048, 1, 256]
    - [112, 4690.18]
  - - [35328, 256, 1, 256]
    - [112, 4555.08]
  - - [10752, 1024, 1, 256]
    - [132, 4562.86]
  - - [12800, 3072, 1, 256]
    - [112, 4743.88]
  - - [25856, 2048, 1, 256]
    - [112, 4776.13]
  - - [43520, 3584, 1, 256]
    - [112, 4823.02]
  - - [16640, 1024, 1, 256]
    - [112, 4645.65]
  - - [12288, 3072, 1, 256]
    - [112, 4776.34]
  - - [12800, 1536, 1, 256]
    - [112, 4651.21]
  - - [21504, 8961, 1, 256]
    - [105, 4791.57]
  - - [19456, 1281, 1, 256]
    - [110, 4637.27]
  - - [2816, 2816, 1, 256]
    - [132, 4486.89]
  - - [39680, 9216, 1, 256]
    - [112, 4838.39]
  - - [18432, 1281, 1, 256]
    - [110, 4625.58]
  - - [33024, 9216, 1, 256]
    - [112, 4849.55]
  - - [24576, 512, 1, 256]
    - [112, 4579.77]
  - - [3584, 513, 1, 256]
    - [100, 3685.25]
  - - [14336, 1024, 1, 256]
    - [112, 4612.52]
  - - [5888, 1281, 1, 256]
    - [108, 4358.66]
  - - [1280, 3072, 1, 256]
    - [120, 4396.55]
  - - [13056, 9216, 1, 256]
    - [112, 4817.3]
  - - [44032, 2048, 1, 256]
    - [112, 4816.89]
  - - [40448, 2048, 1, 256]
    - [112, 4807.27]
  - - [22016, 768, 1, 256]
    - [105, 4658.33]
  - - [33024, 1536, 1, 256]
    - [112, 4789.81]
  - - [36352, 1281, 1, 256]
    - [108, 4682.96]
  - - [26880, 9216, 1, 256]
    - [112, 4841.05]
  - - [23552, 1792, 1, 256]
    - [105, 4799.37]
  - - [38144, 1792, 1, 256]
    - [105, 4819.61]
  - - [44032, 27648, 1, 256]
    - [112, 4839.85]
  - - [7680, 768, 1, 256]
    - [112, 4493.36]
  - - [32000, 19712, 1, 256]
    - [105, 4865.45]
  - - [26880, 14593, 1, 256]
    - [105, 4830.64]
  - - [24064, 9216, 1, 256]
    - [112, 4833.01]
  - - [39424, 26881, 1, 256]
    - [105, 4827.41]
  - - [27392, 3072, 1, 256]
    - [112, 4815.09]
  - - [43264, 9216, 1, 256]
    - [112, 4839.72]
  - - [42752, 256, 1, 256]
    - [105, 4624.34]
  - - [10752, 1792, 1, 256]
    - [105, 4698.7]
  - - [8960, 5633, 1, 256]
    - [112, 4694.36]
  - - [4096, 1024, 1, 256]
    - [130, 4352.77]
  - - [11264, 2048, 1, 256]
    - [112, 4697.86]
  - - [5120, 2048, 1, 256]
    - [112, 4570.83]
  - - [34560, 3072, 1, 256]
    - [112, 4817.62]
  - - [23808, 9216, 1, 256]
    - [112, 4830.54]
  - - [29696, 17153, 1, 256]
    - [105, 4818.13]
  - - [24576, 256, 1, 256]
    - [130, 4444.79]
  - - [2560, 2305, 1, 256]
    - [130, 4254.27]
  - - [11776, 1536, 1, 256]
    - [110, 4645.94]
  - - [13568, 1536, 1, 256]
    - [112, 4675.2]
  - - [39936, 2048, 1, 256]
    - [112, 4814.26]
  - - [25856, 1792, 1, 256]
    - [105, 4795.47]
  - - [35072, 1281, 1, 256]
    - [104, 4679.31]
  - - [22272, 256, 1, 256]
    - [125, 4418.26]
  - - [23296, 256, 1, 256]
    - [132, 4438.16]
  - - [42752, 2048, 1, 256]
    - [112, 4820.42]
  - - [30208, 9216, 1, 256]
    - [112, 4835.5]
  - - [9728, 6656, 1, 256]
    - [112, 4789.0]
  - - [36608, 1536, 1, 256]
    - [112, 4785.71]
  - - [44288, 1280, 1, 256]
    - [105, 4803.49]
  - - [12800, 513, 1, 256]
    - [110, 4113.24]
  - - [7680, 1792, 1, 256]
    - [105, 4647.8]
  - - [42496, 2305, 1, 256]
    - [105, 4678.51]
  - - [37376, 1536, 1, 256]
    - [112, 4771.39]
  - - [20224, 1792, 1, 256]
    - [105, 4777.35]
  - - [43520, 1536, 1, 256]
    - [112, 4792.26]
  - - [9216, 1536, 1, 256]
    - [112, 4632.7]
  - - [1536, 1281, 1, 256]
    - [119, 3926.65]
  - - [26368, 768, 1, 256]
    - [105, 4716.3]
  - - [18176, 3072, 1, 256]
    - [112, 4787.97]
  - - [24320, 12033, 1, 256]
    - [105, 4817.3]
  - - [17408, 9216, 1, 256]
    - [112, 4828.91]
  - - [36352, 1792, 1, 256]
    - [105, 4811.75]
  - - [24832, 768, 1, 256]
    - [105, 4697.28]
  - - [20992, 8705, 1, 256]
    - [112, 4757.07]
  - - [19712, 7424, 1, 256]
    - [105, 4850.65]
  - - [38144, 768, 1, 256]
    - [105, 4767.71]
  - - [24576, 1280, 1, 256]
    - [112, 4771.11]
  - - [33536, 1536, 1, 256]
    - [112, 4785.91]
  - - [7168, 1281, 1, 256]
    - [110, 4463.48]
  - - [10752, 1536, 1, 256]
    - [112, 4648.86]
  - - [29696, 1280, 1, 256]
    - [105, 4791.79]
  - - [17152, 9216, 1, 256]
    - [112, 4827.32]
  - - [4096, 3072, 1, 256]
    - [110, 4557.23]
  - - [18176, 2048, 1, 256]
    - [112, 4744.71]
  - - [29696, 17409, 1, 256]
    - [112, 4788.39]
  - - [5888, 2816, 1, 256]
    - [105, 4656.86]
  - - [34304, 256, 1, 256]
    - [105, 4510.0]
  - - [36352, 1280, 1, 256]
    - [105, 4797.43]
  - - [10240, 6913, 1, 256]
    - [105, 4739.62]
  - - [17408, 1536, 1, 256]
    - [112, 4708.94]
  - - [24832, 512, 1, 256]
    - [112, 4593.0]
  - - [18944, 1536, 1, 256]
    - [112, 4728.26]
  - - [38656, 26113, 1, 256]
    - [112, 4804.27]
  - - [37376, 25089, 1, 256]
    - [112, 4797.76]
  - - [38400, 1536, 1, 256]
    - [112, 4779.83]
  - - [22528, 512, 1, 256]
    - [112, 4561.0]
  - - [8448, 1792, 1, 256]
    - [105, 4655.86]
  - - [22272, 512, 1, 256]
    - [112, 4568.44]
  - - [13056, 769, 1, 256]
    - [110, 4268.96]
  - - [24320, 11777, 1, 256]
    - [112, 4772.19]
  - - [5376, 2048, 1, 256]
    - [112, 4553.14]
  - - [17664, 9216, 1, 256]
    - [112, 4828.77]
  - - [8192, 4865, 1, 256]
    - [105, 4691.91]
  - - [17920, 1792, 1, 256]
    - [105, 4755.45]
  - - [32000, 19713, 1, 256]
    - [105, 4845.57]
  - - [8960, 768, 1, 256]
    - [112, 4451.65]
  - - [31232, 3072, 1, 256]
    - [112, 4817.52]
  - - [6656, 1024, 1, 256]
    - [130, 4494.67]
  - - [23296, 1280, 1, 256]
    - [112, 4749.88]
  - - [30208, 512, 1, 256]
    - [112, 4606.77]
  - - [12544, 257, 1, 256]
    - [110, 3622.89]
  - - [43776, 3585, 1, 256]
    - [112, 4720.09]
  - - [11008, 1792, 1, 256]
    - [105, 4684.2]
  - - [27648, 1281, 1, 256]
    - [108, 4665.8]
  - - [27648, 1536, 1, 256]
    - [112, 4762.58]
  - - [9472, 1024, 1, 256]
    - [112, 4532.4]
  - - [29696, 17408, 1, 256]
    - [112, 4855.03]
  - - [44800, 2048, 1, 256]
    - [112, 4809.31]
  - - [2560, 1281, 1, 256]
    - [110, 4153.56]
  - - [25344, 1024, 1, 256]
    - [112, 4716.72]
  - - [4096, 768, 1, 256]
    - [131, 4298.18]
  - - [34560, 22272, 1, 256]
    - [105, 4866.54]
  - - [38656, 1281, 1, 256]
    - [110, 4689.31]
  - - [256, 2048, 1, 256]
    - [119, 3615.78]
  - - [32768, 20481, 1, 256]
    - [112, 4792.43]
  - - [14336, 3072, 1, 256]
    - [112, 4768.35]
  - - [2304, 2049, 1, 256]
    - [132, 4213.33]
  - - [19456, 7168, 1, 256]
    - [112, 4813.92]
  - - [38656, 512, 1, 256]
    - [112, 4681.52]
  - - [13312, 9216, 1, 256]
    - [112, 4817.87]
  - - [10496, 7424, 1, 256]
    - [105, 4811.09]
  - - [22272, 768, 1, 256]
    - [105, 4693.3]
  - - [24064, 1792, 1, 256]
    - [105, 4799.49]
  - - [16896, 1792, 1, 256]
    - [105, 4765.43]
  - - [27904, 15616, 1, 256]
    - [105, 4860.86]
  - - [37888, 3072, 1, 256]
    - [112, 4826.13]
  - - [512, 257, 1, 256]
    - [122, 1380.55]
  - - [36096, 1792, 1, 256]
    - [105, 4826.77]
  - - [13056, 513, 1, 256]
    - [108, 4162.1]
  - - [12544, 768, 1, 256]
    - [105, 4539.56]
  - - [36608, 24065, 1, 256]
    - [112, 4793.08]
  - - [40704, 3072, 1, 256]
    - [112, 4819.3]
  - - [28928, 16640, 1, 256]
    - [105, 4868.2]
  - - [24576, 12288, 1, 256]
    - [112, 4838.38]
  - - [13056, 1536, 1, 256]
    - [112, 4687.23]
  - - [2304, 1024, 1, 256]
    - [105, 4301.86]
  - - [33280, 9216, 1, 256]
    - [112, 4840.44]
  - - [18944, 1280, 1, 256]
    - [105, 4740.48]
  - - [17152, 3072, 1, 256]
    - [112, 4776.45]
  - - [17152, 4864, 1, 256]
    - [105, 4836.15]
  - - [6912, 1280, 1, 256]
    - [132, 4547.31]
  - - [34304, 768, 1, 256]
    - [105, 4747.73]
  - - [33280, 1024, 1, 256]
    - [112, 4754.31]
  - - [13568, 1280, 1, 256]
    - [105, 4670.32]
  - - [32768, 768, 1, 256]
    - [112, 4735.84]
  - - [42496, 9216, 1, 256]
    - [112, 4844.37]
  - - [2304, 1280, 1, 256]
    - [119, 4168.37]
  - - [30464, 2048, 1, 256]
    - [112, 4796.37]
  - - [32256, 768, 1, 256]
    - [112, 4728.72]
  - - [4352, 1792, 1, 256]
    - [105, 4543.68]
  - - [5632, 768, 1, 256]
    - [132, 4338.26]
  - - [40704, 513, 1, 256]
    - [110, 4430.28]
  - - [30464, 1280, 1, 256]
    - [105, 4789.95]
  - - [27392, 1281, 1, 256]
    - [110, 4665.14]
  - - [22016, 1281, 1, 256]
    - [110, 4644.18]
  - - [20736, 768, 1, 256]
    - [105, 4673.8]
  - - [19712, 768, 1, 256]
    - [112, 4663.48]
  - - [13312, 1024, 1, 256]
    - [112, 4622.07]
  - - [33536, 20993, 1, 256]
    - [112, 4795.53]
  - - [11520, 8448, 1, 256]
    - [105, 4836.84]
  - - [25088, 1792, 1, 256]
    - [105, 4791.73]
  - - [2816, 3072, 1, 256]
    - [132, 4524.75]
  - - [3584, 3072, 1, 256]
    - [132, 4567.3]
  - - [4608, 1537, 1, 256]
    - [112, 4275.02]
  - - [24832, 1280, 1, 256]
    - [112, 4763.02]
  - - [44032, 9216, 1, 256]
    - [112, 4839.89]
  - - [41216, 1024, 1, 256]
    - [112, 4768.36]
  - - [33792, 21249, 1, 256]
    - [105, 4823.46]
  - - [15360, 1792, 1, 256]
    - [105, 4750.7]
  - - [16384, 768, 1, 256]
    - [110, 4600.7]
  - - [29184, 1280, 1, 256]
    - [105, 4781.7]
  - - [32512, 20225, 1, 256]
    - [105, 4824.05]
  - - [6400, 1281, 1, 256]
    - [110, 4367.02]
  - - [38656, 9216, 1, 256]
    - [112, 4841.72]
  - - [17664, 5377, 1, 256]
    - [105, 4767.55]
  - - [7168, 512, 1, 256]
    - [132, 4301.85]
  - - [19456, 7169, 1, 256]
    - [112, 4752.13]
  - - [32000, 2048, 1, 256]
    - [112, 4786.82]
  - - [8448, 5121, 1, 256]
    - [112, 4687.45]
  - - [23040, 9216, 1, 256]
    - [112, 4840.17]
  - - [29440, 17152, 1, 256]
    - [105, 4861.03]
  - - [19968, 2048, 1, 256]
    - [112, 4787.09]
  - - [18688, 1281, 1, 256]
    - [110, 4618.71]
  - - [40448, 513, 1, 256]
    - [110, 4421.03]
  - - [6912, 256, 1, 256]
    - [120, 4022.96]
  - - [41472, 1792, 1, 256]
    - [105, 4833.73]
  - - [17920, 3072, 1, 256]
    - [112, 4787.04]
  - - [30976, 768, 1, 256]
    - [105, 4728.36]
  - - [43008, 9216, 1, 256]
    - [112, 4844.15]
  - - [6144, 3072, 1, 256]
    - [112, 4674.95]
  - - [35072, 9216, 1, 256]
    - [112, 4837.7]
  - - [34816, 22273, 1, 256]
    - [105, 4818.09]
  - - [37120, 768, 1, 256]
    - [112, 4752.72]
  - - [35072, 22785, 1, 256]
    - [105, 4836.93]
  - - [23296, 1281, 1, 256]
    - [110, 4652.39]
  - - [39168, 9216, 1, 256]
    - [112, 4842.44]
  - - [35840, 1536, 1, 256]
    - [112, 4790.49]
  - - [42752, 2817, 1, 256]
    - [110, 4748.71]
  - - [11776, 3072, 1, 256]
    - [112, 4743.5]
  - - [17152, 1536, 1, 256]
    - [112, 4705.73]
  - - [24832, 256, 1, 256]
    - [125, 4404.06]
  - - [10752, 256, 1, 256]
    - [132, 4128.45]
  - - [21504, 2048, 1, 256]
    - [112, 4782.1]
  - - [24832, 12289, 1, 256]
    - [112, 4782.05]
  - - [35328, 2048, 1, 256]
    - [112, 4807.72]
  - - [22272, 1281, 1, 256]
    - [110, 4645.11]
  - - [6656, 3329, 1, 256]
    - [110, 4610.06]
  - - [34560, 1024, 1, 256]
    - [112, 4768.56]
  - - [24576, 12033, 1, 256]
    - [105, 4807.98]
  - - [6400, 1536, 1, 256]
    - [132, 4523.3]
  - - [32512, 3072, 1, 256]
    - [112, 4815.59]
  - - [22528, 2048, 1, 256]
    - [112, 4774.11]
  - - [41216, 256, 1, 256]
    - [112, 4610.7]
  - - [25088, 1024, 1, 256]
    - [112, 4715.54]
  - - [37120, 1024, 1, 256]
    - [112, 4757.12]
  - - [13056, 1281, 1, 256]
    - [110, 4572.14]
  - - [30976, 3072, 1, 256]
    - [112, 4800.63]
  - - [22016, 9473, 1, 256]
    - [105, 4789.78]
  - - [19968, 1792, 1, 256]
    - [105, 4778.09]
  - - [29440, 3072, 1, 256]
    - [112, 4818.67]
  - - [15872, 1280, 1, 256]
    - [105, 4704.35]
  - - [27904, 1280, 1, 256]
    - [105, 4778.01]
  - - [3840, 256, 1, 256]
    - [102, 3783.2]
  - - [39936, 1024, 1, 256]
    - [112, 4770.6]
  - - [10752, 512, 1, 256]
    - [132, 4384.84]
  - - [43776, 3840, 1, 256]
    - [105, 4858.66]
  - - [41472, 768, 1, 256]
    - [105, 4777.76]
  - - [8192, 1792, 1, 256]
    - [105, 4641.69]
  - - [35840, 3072, 1, 256]
    - [112, 4819.52]
  - - [8704, 3072, 1, 256]
    - [112, 4701.31]
  - - [34048, 512, 1, 256]
    - [112, 4652.56]
  - - [36864, 1280, 1, 256]
    - [105, 4807.23]
  - - [9728, 1792, 1, 256]
    - [112, 4665.02]
  - - [15872, 512, 1, 256]
    - [112, 4506.88]
  - - [38144, 1281, 1, 256]
    - [110, 4682.56]
  - - [22272, 9729, 1, 256]
    - [112, 4777.14]
  - - [28928, 2048, 1, 256]
    - [112, 4796.7]
  - - [21504, 1281, 1, 256]
    - [110, 4640.16]
  - - [32768, 3072, 1, 256]
    - [112, 4810.31]
  - - [3072, 2048, 1, 256]
    - [132, 4412.16]
  - - [256, 256, 1, 256]
    - [117, 635.501]
  - - [43520, 27648, 1, 256]
    - [112, 4850.68]
  - - [36864, 24576, 1, 256]
    - [112, 4846.4]
  - - [31232, 1281, 1, 256]
    - [110, 4668.49]
  - - [14080, 768, 1, 256]
    - [105, 4572.88]
  - - [27648, 2048, 1, 256]
    - [112, 4807.67]
  - - [9984, 1536, 1, 256]
    - [112, 4632.4]
  - - [31232, 2048, 1, 256]
    - [112, 4794.56]
  - - [11520, 1792, 1, 256]
    - [112, 4711.69]
  - - [10752, 2048, 1, 256]
    - [112, 4696.68]
  - - [12032, 8961, 1, 256]
    - [105, 4787.72]
  - - [11776, 256, 1, 256]
    - [122, 4152.78]
  - - [1792, 256, 1, 256]
    - [117, 3295.19]
  - - [38144, 2048, 1, 256]
    - [112, 4813.98]
  - - [37632, 2048, 1, 256]
    - [112, 4813.7]
  - - [4352, 768, 1, 256]
    - [132, 4300.56]
  - - [38400, 25857, 1, 256]
    - [105, 4832.21]
  - - [38144, 1024, 1, 256]
    - [112, 4755.55]
  - - [20224, 7937, 1, 256]
    - [105, 4797.82]
  - - [10240, 2048, 1, 256]
    - [112, 4667.31]
  - - [34304, 21761, 1, 256]
    - [105, 4825.04]
  - - [30720, 18432, 1, 256]
    - [112, 4852.56]
  - - [31744, 9216, 1, 256]
    - [112, 4835.26]
  - - [26368, 2048, 1, 256]
    - [112, 4790.5]
  - - [35072, 2048, 1, 256]
    - [112, 4803.06]
  - - [27136, 14848, 1, 256]
    - [112, 4842.57]
  - - [36096, 512, 1, 256]
    - [112, 4683.96]
  - - [29952, 2048, 1, 256]
    - [112, 4798.12]
  - - [34048, 9216, 1, 256]
    - [112, 4842.83]
  - - [20992, 2048, 1, 256]
    - [112, 4761.31]
  - - [32256, 2048, 1, 256]
    - [112, 4810.51]
  - - [3584, 257, 1, 256]
    - [99, 3502.65]
  - - [19200, 2048, 1, 256]
    - [112, 4761.21]
  - - [18688, 6145, 1, 256]
    - [112, 4735.09]
  - - [24320, 1280, 1, 256]
    - [105, 4765.8]
  - - [36352, 256, 1, 256]
    - [112, 4574.43]
  - - [36096, 768, 1, 256]
    - [105, 4757.95]
  - - [7168, 1536, 1, 256]
    - [132, 4567.01]
  - - [25344, 9216, 1, 256]
    - [112, 4847.3]
  - - [39168, 512, 1, 256]
    - [112, 4678.86]
  - - [36608, 9216, 1, 256]
    - [112, 4849.09]
  - - [14848, 1792, 1, 256]
    - [105, 4746.59]
  - - [35584, 9216, 1, 256]
    - [112, 4837.86]
  - - [29952, 17664, 1, 256]
    - [105, 4870.44]
  - - [34816, 1792, 1, 256]
    - [105, 4814.7]
  - - [38912, 1280, 1, 256]
    - [105, 4812.09]
  - - [24064, 2048, 1, 256]
    - [112, 4778.53]
  - - [24064, 11776, 1, 256]
    - [112, 4839.67]
  - - [18176, 512, 1, 256]
    - [112, 4534.38]
  - - [11264, 1280, 1, 256]
    - [105, 4655.17]
  - - [34048, 1792, 1, 256]
    - [105, 4823.18]
  - - [5376, 1792, 1, 256]
    - [105, 4564.43]
  - - [36608, 512, 1, 256]
    - [112, 4674.14]
  - - [6656, 1281, 1, 256]
    - [108, 4413.86]
  - - [18432, 1024, 1, 256]
    - [112, 4690.01]
  - - [40448, 3072, 1, 256]
    - [112, 4821.51]
  - - [18688, 6401, 1, 256]
    - [105, 4779.35]
  - - [20480, 1536, 1, 256]
    - [112, 4736.43]
  - - [18432, 3072, 1, 256]
    - [112, 4793.11]
  - - [20224, 768, 1, 256]
    - [105, 4665.15]
  - - [32512, 9216, 1, 256]
    - [112, 4841.95]
  - - [14080, 1281, 1, 256]
    - [104, 4580.87]
  - - [3072, 1536, 1, 256]
    - [130, 4406.69]
  - - [26112, 512, 1, 256]
    - [112, 4587.38]
  - - [10496, 1281, 1, 256]
    - [110, 4526.83]
  - - [15616, 2048, 1, 256]
    - [112, 4744.27]
  - - [12800, 1024, 1, 256]
    - [112, 4563.99]
  - - [12544, 256, 1, 256]
    - [125, 4112.89]
  - - [25344, 768, 1, 256]
    - [105, 4698.66]
  - - [10240, 512, 1, 256]
    - [130, 4395.97]
  - - [8448, 2048, 1, 256]
    - [112, 4669.38]
  - - [36608, 24320, 1, 256]
    - [105, 4865.85]
  - - [34816, 9216, 1, 256]
    - [112, 4830.36]
  - - [14080, 512, 1, 256]
    - [132, 4468.94]
  - - [3072, 1792, 1, 256]
    - [120, 4491.04]
  - - [41216, 27648, 1, 256]
    - [112, 4851.9]
  - - [30464, 9216, 1, 256]
    - [112, 4835.75]
  - - [33024, 1281, 1, 256]
    - [110, 4676.87]
  - - [31488, 1536, 1, 256]
    - [112, 4787.63]
  - - [7424, 3072, 1, 256]
    - [112, 4699.5]
  - - [37888, 512, 1, 256]
    - [112, 4672.97]
  - - [20480, 1792, 1, 256]
    - [105, 4781.1]
  - - [41984, 1793, 1, 256]
    - [110, 4663.84]
  - - [18688, 1792, 1, 256]
    - [105, 4754.41]
  - - [13824, 1792, 1, 256]
    - [105, 4736.35]
  - - [15360, 1280, 1, 256]
    - [105, 4703.89]
  - - [38144, 3072, 1, 256]
    - [112, 4829.95]
  - - [33280, 3072, 1, 256]
    - [112, 4815.26]
  - - [35584, 23296, 1, 256]
    - [105, 4864.83]
  - - [43520, 768, 1, 256]
    - [105, 4774.55]
  - - [25856, 256, 1, 256]
    - [112, 4491.83]
  - - [40704, 1536, 1, 256]
    - [112, 4793.61]
  - - [29696, 3072, 1, 256]
    - [112, 4805.72]
  - - [32256, 19969, 1, 256]
    - [112, 4804.26]
  - - [39424, 1281, 1, 256]
    - [108, 4687.72]
  - - [40960, 9216, 1, 256]
    - [112, 4840.74]
  - - [16640, 2048, 1, 256]
    - [112, 4750.17]
  - - [37632, 9216, 1, 256]
    - [112, 4838.04]
  - - [37888, 1281, 1, 256]
    - [110, 4681.76]
  - - [26112, 256, 1, 256]
    - [112, 4539.19]
  - - [42240, 2305, 1, 256]
    - [105, 4694.36]
  - - [43008, 1024, 1, 256]
    - [112, 4771.82]
  - - [7424, 1024, 1, 256]
    - [132, 4444.1]
  - - [17920, 5377, 1, 256]
    - [105, 4748.02]
  - - [2816, 1281, 1, 256]
    - [130, 4062.41]
  - - [37376, 1280, 1, 256]
    - [105, 4806.28]
  - - [41984, 2048, 1, 256]
    - [112, 4812.82]
  - - [27904, 9216, 1, 256]
    - [112, 4827.83]
  - - [20736, 1024, 1, 256]
    - [112, 4686.86]
  - - [34304, 22016, 1, 256]
    - [112, 4835.15]
  - - [33792, 256, 1, 256]
    - [105, 4501.57]
  - - [13824, 2048, 1, 256]
    - [112, 4724.25]
  - - [11776, 8705, 1, 256]
    - [112, 4745.32]
  - - [22272, 1536, 1, 256]
    - [112, 4755.59]
  - - [25856, 9216, 1, 256]
    - [112, 4832.94]
  - - [19712, 3072, 1, 256]
    - [112, 4800.56]
  - - [20480, 1281, 1, 256]
    - [110, 4626.71]
  - - [17408, 1280, 1, 256]
    - [105, 4724.88]
  - - [40192, 2048, 1, 256]
    - [112, 4808.23]
  - - [41472, 9216, 1, 256]
    - [112, 4841.51]
  - - [40704, 2048, 1, 256]
    - [112, 4804.63]
  - - [35840, 256, 1, 256]
    - [123, 4540.69]
  - - [42496, 27648, 1, 256]
    - [112, 4837.06]
  - - [21248, 2048, 1, 256]
    - [112, 4780.57]
  - - [35072, 3072, 1, 256]
    - [112, 4826.2]
  - - [4608, 1281, 1, 256]
    - [110, 4245.7]
  - - [44288, 4352, 1, 256]
    - [105, 4854.05]
  - - [8192, 512, 1, 256]
    - [132, 4396.26]
  - - [38400, 256, 1, 256]
    - [105, 4545.85]
  - - [5888, 512, 1, 256]
    - [132, 4165.33]
  - - [41984, 1792, 1, 256]
    - [105, 4823.55]
  - - [42496, 2561, 1, 256]
    - [112, 4666.84]
  - - [9984, 6657, 1, 256]
    - [112, 4729.24]
  - - [43008, 3073, 1, 256]
    - [112, 4690.13]
  - - [4096, 2048, 1, 256]
    - [132, 4526.74]
  - - [36352, 24065, 1, 256]
    - [112, 4792.81]
  - - [4608, 2048, 1, 256]
    - [130, 4546.33]
  - - [24832, 3072, 1, 256]
    - [112, 4805.24]
  - - [25088, 1280, 1, 256]
    - [105, 4771.79]
  - - [29184, 16641, 1, 256]
    - [105, 4818.9]
  - - [1024, 2048, 1, 256]
    - [120, 4178.64]
  - - [37888, 1024, 1, 256]
    - [112, 4751.84]
  - - [768, 768, 1, 256]
    - [94, 3218.14]
  - - [24832, 2048, 1, 256]
    - [112, 4775.63]
  - - [42240, 27648, 1, 256]
    - [112, 4847.28]
  - - [8192, 5120, 1, 256]
    - [112, 4752.0]
  - - [31744, 1280, 1, 256]
    - [105, 4784.06]
  - - [9984, 1792, 1, 256]
    - [105, 4691.65]
  - - [13312, 1280, 1, 256]
    - [112, 4658.94]
  - - [44288, 3072, 1, 256]
    - [112, 4819.65]
  - - [18432, 6144, 1, 256]
    - [112, 4822.03]
  - - [23808, 1792, 1, 256]
    - [105, 4797.15]
  - - [32512, 1280, 1, 256]
    - [105, 4791.03]
  - - [11008, 768, 1, 256]
    - [105, 4512.64]
  - - [10752, 1280, 1, 256]
    - [112, 4642.65]
  - - [28672, 16129, 1, 256]
    - [105, 4814.96]
  - - [17920, 9216, 1, 256]
    - [112, 4831.93]
  - - [33536, 256, 1, 256]
    - [112, 4556.0]
  - - [25088, 12801, 1, 256]
    - [112, 4782.81]
  - - [19712, 9216, 1, 256]
    - [112, 4830.57]
  - - [40192, 256, 1, 256]
    - [105, 4553.35]
  - - [7680, 2048, 1, 256]
    - [112, 4642.93]
  - - [15616, 1281, 1, 256]
    - [110, 4600.46]
  - - [31744, 19457, 1, 256]
    - [112, 4790.32]
  - - [36864, 1792, 1, 256]
    - [112, 4819.72]
  - - [42496, 1792, 1, 256]
    - [105, 4817.37]
  - - [41216, 3072, 1, 256]
    - [112, 4832.77]
  - - [39936, 9216, 1, 256]
    - [112, 4843.21]
  - - [3840, 512, 1, 256]
    - [131, 3986.99]
  - - [8960, 1792, 1, 256]
    - [105, 4677.31]
  - - [44288, 2048, 1, 256]
    - [112, 4816.12]
  - - [13824, 1281, 1, 256]
    - [110, 4548.67]
  - - [6144, 2048, 1, 256]
    - [112, 4613.09]
  - - [7936, 4864, 1, 256]
    - [105, 4776.76]
  - - [5632, 2048, 1, 256]
    - [112, 4558.19]
  - - [27648, 1280, 1, 256]
    - [105, 4774.49]
  - - [18176, 256, 1, 256]
    - [112, 4405.91]
  - - [17664, 5121, 1, 256]
    - [112, 4726.94]
  - - [8704, 5632, 1, 256]
    - [112, 4762.57]
  - - [38144, 25601, 1, 256]
    - [112, 4799.77]
  - - [27136, 14849, 1, 256]
    - [112, 4787.75]
  - - [31744, 19456, 1, 256]
    - [112, 4841.64]
  - - [5376, 1280, 1, 256]
    - [105, 4478.82]
  - - [33024, 3072, 1, 256]
    - [112, 4826.92]
  - - [37888, 9216, 1, 256]
    - [112, 4840.36]
  - - [17664, 1792, 1, 256]
    - [105, 4771.31]
  - - [6912, 1792, 1, 256]
    - [112, 4618.8]
  - - [28672, 768, 1, 256]
    - [105, 4723.92]
  - - [32768, 1281, 1, 256]
    - [110, 4672.58]
  - - [39168, 1024, 1, 256]
    - [112, 4760.33]
  - - [11520, 1281, 1, 256]
    - [108, 4544.59]
  - - [42240, 2049, 1, 256]
    - [108, 4655.95]
  - - [34048, 3072, 1, 256]
    - [112, 4830.19]
  - - [10752, 7680, 1, 256]
    - [112, 4809.94]
  - - [37120, 9216, 1, 256]
    - [112, 4840.86]
  - - [14080, 9216, 1, 256]
    - [112, 4819.75]
  - - [38400, 1792, 1, 256]
    - [105, 4829.76]
  - - [43776, 9216, 1, 256]
    - [112, 4846.38]
  - - [26624, 768, 1, 256]
    - [105, 4706.94]
  - - [14336, 2049, 1, 256]
    - [110, 4588.86]
  - - [32512, 1281, 1, 256]
    - [104, 4676.74]
  - - [37120, 24577, 1, 256]
    - [112, 4794.41]
  - - [38400, 1024, 1, 256]
    - [112, 4768.33]
  - - [6144, 1281, 1, 256]
    - [108, 4362.26]
  - - [32768, 2048, 1, 256]
    - [112, 4807.01]
  - - [28672, 1280, 1, 256]
    - [105, 4781.1]
  - - [30976, 18433, 1, 256]
    - [112, 4785.68]
  - - [5632, 1024, 1, 256]
    - [130, 4364.42]
  - - [37632, 3072, 1, 256]
    - [112, 4822.3]
  - - [34560, 1792, 1, 256]
    - [112, 4818.29]
  - - [5120, 3072, 1, 256]
    - [112, 4616.11]
  - - [21760, 9217, 1, 256]
    - [112, 4760.6]
  - - [5120, 1280, 1, 256]
    - [120, 4496.95]
  - - [24064, 11521, 1, 256]
    - [105, 4792.68]
  - - [10496, 512, 1, 256]
    - [130, 4389.14]
  - - [35328, 1280, 1, 256]
    - [105, 4810.22]
  - - [7936, 3072, 1, 256]
    - [112, 4697.38]
  - - [30720, 1280, 1, 256]
    - [105, 4793.4]
  - - [21760, 9472, 1, 256]
    - [105, 4850.7]
  - - [9216, 6145, 1, 256]
    - [112, 4715.37]
  - - [37376, 2048, 1, 256]
    - [112, 4807.6]
  - - [8192, 1536, 1, 256]
    - [112, 4594.66]
  - - [39936, 27648, 1, 256]
    - [112, 4842.17]
  - - [21248, 9216, 1, 256]
    - [112, 4827.26]
  - - [5376, 2049, 1, 256]
    - [110, 4438.63]
  - - [35072, 22529, 1, 256]
    - [112, 4800.07]
  - - [13312, 769, 1, 256]
    - [104, 4282.11]
  - - [35840, 9216, 1, 256]
    - [112, 4840.32]
  - - [7936, 1024, 1, 256]
    - [130, 4508.83]
  - - [12544, 512, 1, 256]
    - [132, 4441.77]
  - - [27392, 1280, 1, 256]
    - [105, 4773.66]
  - - [39424, 27136, 1, 256]
    - [112, 4851.49]
  - - [26368, 9216, 1, 256]
    - [112, 4831.01]
  - - [34048, 21505, 1, 256]
    - [112, 4795.22]
  - - [23040, 1024, 1, 256]
    - [112, 4724.65]
  - - [29440, 1536, 1, 256]
    - [112, 4773.96]
  - - [38912, 768, 1, 256]
    - [105, 4756.18]
  - - [7680, 512, 1, 256]
    - [132, 4335.2]
  - - [4096, 512, 1, 256]
    - [111, 4120.91]
  - - [38400, 2048, 1, 256]
    - [112, 4810.17]
  - - [26112, 1792, 1, 256]
    - [105, 4800.87]
  - - [23296, 768, 1, 256]
    - [105, 4687.62]
  - - [3328, 3072, 1, 256]
    - [132, 4546.99]
  - - [3584, 1281, 1, 256]
    - [97, 4290.76]
  - - [43264, 27648, 1, 256]
    - [112, 4839.73]
  - - [40960, 256, 1, 256]
    - [112, 4604.38]
  - - [18432, 9216, 1, 256]
    - [112, 4821.04]
  - - [29952, 1280, 1, 256]
    - [105, 4792.41]
  - - [43264, 1281, 1, 256]
    - [110, 4692.24]
  - - [38912, 3072, 1, 256]
    - [112, 4817.82]
  - - [9216, 6144, 1, 256]
    - [112, 4792.35]
  - - [30464, 17921, 1, 256]
    - [112, 4795.69]
  - - [37376, 9216, 1, 256]
    - [112, 4844.91]
  - - [256, 3072, 1, 256]
    - [118, 3821.69]
  - - [34048, 2048, 1, 256]
    - [112, 4794.73]
  - - [9472, 3072, 1, 256]
    - [112, 4723.46]
  - - [26624, 1280, 1, 256]
    - [105, 4778.16]
  - - [35840, 23552, 1, 256]
    - [112, 4842.03]
  - - [8960, 3072, 1, 256]
    - [112, 4709.05]
  - - [27904, 2048, 1, 256]
    - [112, 4787.03]
  - - [22016, 256, 1, 256]
    - [125, 4405.89]
  - - [34816, 3072, 1, 256]
    - [112, 4816.26]
  - - [11008, 3072, 1, 256]
    - [112, 4724.12]
  - - [36864, 1536, 1, 256]
    - [112, 4784.57]
  - - [24064, 1281, 1, 256]
    - [104, 4649.47]
  - - [23552, 9216, 1, 256]
    - [112, 4835.81]
  - - [31232, 18945, 1, 256]
    - [112, 4793.26]
  - - [27136, 9216, 1, 256]
    - [112, 4841.56]
  - - [19968, 7681, 1, 256]
    - [112, 4757.56]
  - - [31488, 18945, 1, 256]
    - [112, 4798.02]
  - - [33280, 1792, 1, 256]
    - [105, 4816.54]
  - - [38912, 1281, 1, 256]
    - [108, 4689.83]
  - - [42240, 2048, 1, 256]
    - [112, 4816.17]
  - - [14592, 3072, 1, 256]
    - [112, 4776.25]
  - - [30976, 18689, 1, 256]
    - [105, 4825.16]
  - - [4096, 769, 1, 256]
    - [105, 3955.83]
  - - [31488, 3072, 1, 256]
    - [112, 4817.4]
  - - [28416, 1281, 1, 256]
    - [110, 4668.65]
  - - [22528, 1024, 1, 256]
    - [112, 4709.54]
  - - [3584, 256, 1, 256]
    - [102, 3618.02]
  - - [33024, 1792, 1, 256]
    - [105, 4823.37]
  - - [42752, 2816, 1, 256]
    - [105, 4838.57]
  - - [11520, 8449, 1, 256]
    - [105, 4783.03]
  - - [4864, 1281, 1, 256]
    - [108, 4284.63]
  - - [14592, 768, 1, 256]
    - [105, 4605.57]
  - - [7424, 1792, 1, 256]
    - [105, 4656.77]
  - - [44544, 4353, 1, 256]
    - [105, 4762.08]
  - - [37120, 3072, 1, 256]
    - [112, 4814.81]
  - - [18176, 5889, 1, 256]
    - [105, 4767.63]
  - - [5632, 2305, 1, 256]
    - [108, 4478.65]
  - - [39936, 27393, 1, 256]
    - [105, 4823.81]
  - - [10240, 7169, 1, 256]
    - [112, 4715.91]
  - - [39168, 26625, 1, 256]
    - [112, 4800.56]
  - - [10752, 7681, 1, 256]
    - [112, 4734.51]
  - - [13824, 1536, 1, 256]
    - [112, 4691.55]
  - - [21760, 1280, 1, 256]
    - [105, 4748.73]
  - - [20480, 768, 1, 256]
    - [112, 4650.65]
  - - [18688, 768, 1, 256]
    - [105, 4660.57]
  - - [14336, 9216, 1, 256]
    - [112, 4820.44]
  - - [40960, 768, 1, 256]
    - [112, 4752.3]
  - - [37632, 25345, 1, 256]
    - [105, 4841.64]
  - - [35840, 23553, 1, 256]
    - [112, 4798.48]
  - - [21760, 1024, 1, 256]
    - [112, 4703.53]
  - - [6656, 3584, 1, 256]
    - [112, 4702.83]
  - - [44544, 2048, 1, 256]
    - [112, 4822.91]
  - - [16640, 1281, 1, 256]
    - [110, 4608.99]
  - - [4608, 3072, 1, 256]
    - [112, 4623.95]
  - - [34816, 1024, 1, 256]
    - [112, 4758.3]
  - - [35840, 1280, 1, 256]
    - [105, 4797.49]
  - - [23552, 3072, 1, 256]
    - [112, 4800.35]
  - - [2048, 512, 1, 256]
    - [100, 3949.92]
  - - [39680, 2048, 1, 256]
    - [112, 4812.61]
  - - [41984, 1280, 1, 256]
    - [105, 4807.76]
  - - [19712, 7169, 1, 256]
    - [112, 4749.37]
  - - [8448, 768, 1, 256]
    - [132, 4495.36]
  - - [5888, 2561, 1, 256]
    - [110, 4523.82]
  - - [27136, 768, 1, 256]
    - [112, 4705.05]
  - - [22272, 1792, 1, 256]
    - [105, 4792.73]
  - - [11008, 1281, 1, 256]
    - [108, 4541.24]
  - - [12800, 9216, 1, 256]
    - [112, 4817.75]
  - - [15616, 1536, 1, 256]
    - [112, 4701.88]
  - - [6912, 1281, 1, 256]
    - [108, 4439.62]
  - - [7424, 256, 1, 256]
    - [106, 4024.98]
  - - [3840, 769, 1, 256]
    - [109, 3926.65]
  - - [42240, 2304, 1, 256]
    - [112, 4829.67]
  - - [38144, 1280, 1, 256]
    - [105, 4796.18]
  - - [13056, 1280, 1, 256]
    - [105, 4684.83]
  - - [24576, 3072, 1, 256]
    - [112, 4804.98]
  - - [12288, 768, 1, 256]
    - [112, 4592.3]
  - - [36864, 2048, 1, 256]
    - [112, 4798.87]
  - - [26880, 1024, 1, 256]
    - [112, 4732.07]
  - - [27136, 1536, 1, 256]
    - [112, 4757.24]
  - - [25344, 12801, 1, 256]
    - [112, 4784.99]
  - - [32512, 20224, 1, 256]
    - [112, 4863.68]
  - - [17664, 3072, 1, 256]
    - [112, 4793.82]
  - - [7168, 1280, 1, 256]
    - [130, 4540.7]
  - - [38656, 256, 1, 256]
    - [132, 4530.65]
  - - [43520, 3329, 1, 256]
    - [105, 4730.25]
  - - [28160, 15873, 1, 256]
    - [112, 4784.3]
  - - [31488, 1281, 1, 256]
    - [110, 4672.08]
  - - [40960, 3072, 1, 256]
    - [112, 4827.6]
  - - [43520, 1024, 1, 256]
    - [112, 4777.03]
  - - [14592, 9216, 1, 256]
    - [112, 4830.16]
  - - [43008, 1281, 1, 256]
    - [110, 4685.42]
  - - [9472, 1792, 1, 256]
    - [112, 4658.94]
  - - [22784, 10497, 1, 256]
    - [105, 4820.66]
  - - [22272, 3072, 1, 256]
    - [112, 4808.33]
  - - [9728, 1280, 1, 256]
    - [105, 4616.6]
  - - [28416, 512, 1, 256]
    - [112, 4621.94]
  - - [8704, 512, 1, 256]
    - [130, 4326.65]
  - - [39680, 27137, 1, 256]
    - [112, 4795.51]
  - - [20992, 8704, 1, 256]
    - [112, 4828.92]
  - - [42240, 256, 1, 256]
    - [112, 4584.09]
  - - [24320, 1536, 1, 256]
    - [112, 4755.45]
  - - [7936, 4865, 1, 256]
    - [110, 4689.96]
  - - [17664, 5376, 1, 256]
    - [105, 4842.01]
  - - [25344, 2048, 1, 256]
    - [112, 4788.45]
  - - [3584, 2048, 1, 256]
    - [130, 4467.55]
  - - [30464, 1281, 1, 256]
    - [104, 4668.34]
  - - [37888, 25345, 1, 256]
    - [105, 4823.47]
  - - [8192, 1024, 1, 256]
    - [130, 4496.41]
  - - [23296, 10753, 1, 256]
    - [112, 4773.55]
  - - [28416, 15873, 1, 256]
    - [112, 4795.88]
  - - [27648, 15361, 1, 256]
    - [112, 4789.07]
  - - [19200, 1281, 1, 256]
    - [110, 4629.28]
  - - [30208, 1280, 1, 256]
    - [105, 4776.01]
  - - [27136, 3072, 1, 256]
    - [112, 4806.49]
  - - [29952, 1792, 1, 256]
    - [112, 4806.27]
  - - [16128, 1281, 1, 256]
    - [108, 4603.25]
  - - [18432, 1280, 1, 256]
    - [105, 4728.64]
  - - [16896, 1280, 1, 256]
    - [112, 4705.33]
  - - [26112, 1280, 1, 256]
    - [105, 4777.97]
  - - [36608, 3072, 1, 256]
    - [112, 4822.4]
  - - [39424, 1536, 1, 256]
    - [112, 4778.42]
  - - [12032, 256, 1, 256]
    - [105, 4231.21]
  - - [3584, 512, 1, 256]
    - [130, 4070.74]
  - - [15104, 2817, 1, 256]
    - [108, 4700.95]
  - - [25344, 1792, 1, 256]
    - [105, 4809.39]
  - - [19456, 9216, 1, 256]
    - [112, 4823.55]
  - - [24064, 11777, 1, 256]
    - [112, 4773.5]
  - - [13824, 256, 1, 256]
    - [105, 4348.93]
  - - [29696, 1792, 1, 256]
    - [112, 4811.3]
  - - [24576, 768, 1, 256]
    - [105, 4700.41]
  - - [42496, 512, 1, 256]
    - [112, 4669.71]
  - - [27904, 256, 1, 256]
    - [125, 4427.89]
  - - [40448, 1536, 1, 256]
    - [112, 4792.86]
  - - [22784, 1280, 1, 256]
    - [105, 4765.52]
  - - [37376, 1024, 1, 256]
    - [112, 4760.88]
  - - [4864, 1280, 1, 256]
    - [132, 4470.54]
  - - [14336, 512, 1, 256]
    - [132, 4504.38]
  - - [512, 3072, 1, 256]
    - [118, 4151.06]
  - - [34560, 1280, 1, 256]
    - [105, 4792.88]
  - - [5632, 2560, 1, 256]
    - [112, 4636.46]
  - - [38912, 9216, 1, 256]
    - [112, 4842.71]
  - - [18688, 1024, 1, 256]
    - [112, 4676.0]
  - - [35584, 256, 1, 256]
    - [125, 4537.74]
  - - [5632, 256, 1, 256]
    - [120, 3770.93]
  - - [22016, 1024, 1, 256]
    - [112, 4699.81]
  - - [20480, 2048, 1, 256]
    - [112, 4761.52]
  - - [7680, 1281, 1, 256]
    - [108, 4439.69]
  - - [19456, 6913, 1, 256]
    - [105, 4768.58]
  - - [17408, 2048, 1, 256]
    - [112, 4753.25]
  - - [43776, 1024, 1, 256]
    - [112, 4772.04]
  - - [15104, 1281, 1, 256]
    - [110, 4605.86]
  - - [22272, 9216, 1, 256]
    - [112, 4840.74]
  - - [14848, 1281, 1, 256]
    - [110, 4575.45]
  - - [19968, 1280, 1, 256]
    - [112, 4750.61]
  - - [29440, 1792, 1, 256]
    - [105, 4805.74]
  - - [41984, 9216, 1, 256]
    - [112, 4844.11]
  - - [14080, 1793, 1, 256]
    - [110, 4617.5]
  - - [20992, 8449, 1, 256]
    - [105, 4782.32]
  - - [26880, 512, 1, 256]
    - [112, 4605.99]
  - - [17920, 768, 1, 256]
    - [105, 4613.23]
  - - [34304, 1280, 1, 256]
    - [105, 4797.09]
  - - [10496, 7169, 1, 256]
    - [112, 4720.43]
  - - [40704, 1280, 1, 256]
    - [105, 4801.19]
  - - [23552, 2048, 1, 256]
    - [112, 4779.24]
  - - [3328, 2048, 1, 256]
    - [132, 4470.72]
  - - [40704, 27648, 1, 256]
    - [112, 4849.32]
  - - [19968, 1024, 1, 256]
    - [112, 4690.24]
  - - [22784, 1281, 1, 256]
    - [110, 4657.12]
  - - [29440, 2048, 1, 256]
    - [112, 4793.55]
  - - [17152, 2048, 1, 256]
    - [112, 4755.97]
  - - [16384, 2048, 1, 256]
    - [112, 4741.73]
  - - [13568, 1025, 1, 256]
    - [108, 4413.23]
  - - [38144, 9216, 1, 256]
    - [112, 4855.28]
  - - [20992, 256, 1, 256]
    - [112, 4400.93]
  - - [24064, 1280, 1, 256]
    - [105, 4759.24]
  - - [2304, 768, 1, 256]
    - [120, 4092.75]
  - - [35328, 1024, 1, 256]
    - [112, 4749.24]
  - - [27392, 15104, 1, 256]
    - [105, 4865.67]
  - - [2304, 3072, 1, 256]
    - [105, 4531.67]
  - - [9472, 6401, 1, 256]
    - [105, 4743.57]
  - - [39424, 1792, 1, 256]
    - [105, 4818.57]
  - - [40960, 512, 1, 256]
    - [112, 4695.23]
  - - [41728, 768, 1, 256]
    - [105, 4759.73]
  - - [5376, 256, 1, 256]
    - [107, 3650.24]
  - - [8960, 1280, 1, 256]
    - [132, 4578.08]
  - - [26624, 256, 1, 256]
    - [123, 4515.14]
  - - [11264, 3072, 1, 256]
    - [112, 4746.23]
  - - [25344, 3072, 1, 256]
    - [112, 4811.26]
  - - [23296, 2048, 1, 256]
    - [112, 4773.26]
  - - [22784, 768, 1, 256]
    - [105, 4683.92]
  - - [35584, 512, 1, 256]
    - [112, 4662.39]
  - - [24576, 1792, 1, 256]
    - [105, 4802.15]
  - - [27392, 14849, 1, 256]
    - [112, 4792.41]
  - - [14848, 2561, 1, 256]
    - [110, 4625.03]
  - - [28160, 3072, 1, 256]
    - [112, 4811.86]
  - - [4864, 1792, 1, 256]
    - [120, 4498.01]
  - - [20736, 1281, 1, 256]
    - [110, 4638.4]
  - - [23552, 11009, 1, 256]
    - [105, 4810.56]
  - - [11776, 8449, 1, 256]
    - [105, 4761.83]
  - - [16640, 1792, 1, 256]
    - [105, 4757.82]
  - - [24576, 12289, 1, 256]
    - [112, 4779.09]
  - - [38656, 26369, 1, 256]
    - [105, 4832.16]
  - - [25088, 512, 1, 256]
    - [112, 4617.67]
  - - [5376, 2304, 1, 256]
    - [105, 4601.1]
  - - [30720, 1024, 1, 256]
    - [112, 4737.32]
  - - [13824, 9216, 1, 256]
    - [112, 4821.32]
  - - [28928, 1792, 1, 256]
    - [105, 4818.66]
  - - [36864, 1281, 1, 256]
    - [108, 4681.9]
  - - [25600, 1280, 1, 256]
    - [105, 4762.47]
  - - [27904, 15361, 1, 256]
    - [112, 4788.63]
  - - [34816, 512, 1, 256]
    - [112, 4653.87]
  - - [3840, 1792, 1, 256]
    - [105, 4471.09]
  - - [14848, 3072, 1, 256]
    - [112, 4763.46]
  - - [14848, 1280, 1, 256]
    - [105, 4691.8]
  - - [27904, 1536, 1, 256]
    - [112, 4763.11]
  - - [39936, 1536, 1, 256]
    - [112, 4796.07]
  - - [34816, 1536, 1, 256]
    - [112, 4780.5]
  - - [14592, 2305, 1, 256]
    - [105, 4629.37]
  - - [22528, 9985, 1, 256]
    - [105, 4794.67]
  - - [22784, 3072, 1, 256]
    - [112, 4801.45]
  - - [26368, 13825, 1, 256]
    - [112, 4784.71]
  - - [4096, 1792, 1, 256]
    - [120, 4530.02]
  - - [17152, 1280, 1, 256]
    - [112, 4707.81]
  - - [30720, 18177, 1, 256]
    - [105, 4823.02]
  - - [37120, 24833, 1, 256]
    - [105, 4835.96]
  - - [3840, 768, 1, 256]
    - [131, 4140.94]
  - - [1792, 1537, 1, 256]
    - [130, 4079.51]
  - - [16128, 2048, 1, 256]
    - [112, 4755.75]
  - - [6656, 2048, 1, 256]
    - [112, 4620.6]
  - - [15360, 2048, 1, 256]
    - [112, 4740.89]
  - - [24320, 3072, 1, 256]
    - [112, 4803.27]
  - - [17664, 1280, 1, 256]
    - [105, 4724.55]
  - - [12800, 1280, 1, 256]
    - [105, 4661.37]
  - - [4352, 1536, 1, 256]
    - [130, 4441.19]
  - - [41472, 1024, 1, 256]
    - [112, 4769.68]
  - - [9984, 256, 1, 256]
    - [125, 4200.77]
  - - [14592, 1281, 1, 256]
    - [108, 4587.61]
  - - [21248, 1281, 1, 256]
    - [110, 4643.22]
  - - [2560, 1536, 1, 256]
    - [120, 4354.71]
  - - [8960, 2048, 1, 256]
    - [112, 4662.0]
  - - [44032, 4097, 1, 256]
    - [112, 4730.54]
  - - [256, 257, 1, 256]
    - [126, 718.547]
  - - [34048, 1281, 1, 256]
    - [108, 4674.52]
  - - [44544, 27648, 1, 256]
    - [112, 4849.49]
  - - [34048, 21761, 1, 256]
    - [105, 4838.63]
  - - [26368, 1280, 1, 256]
    - [105, 4768.99]
  - - [24064, 1536, 1, 256]
    - [112, 4743.41]
  - - [24832, 12545, 1, 256]
    - [105, 4817.29]
  - - [44032, 3841, 1, 256]
    - [105, 4748.09]
  - - [22528, 9216, 1, 256]
    - [112, 4826.54]
  - - [40448, 257, 1, 256]
    - [110, 4046.03]
  - - [14592, 1280, 1, 256]
    - [112, 4697.52]
  - - [26624, 14337, 1, 256]
    - [112, 4778.76]
  - - [26368, 512, 1, 256]
    - [112, 4599.07]
  - - [19456, 1280, 1, 256]
    - [105, 4728.64]
  - - [8192, 5121, 1, 256]
    - [110, 4674.48]
  - - [26880, 3072, 1, 256]
    - [112, 4818.31]
  - - [25600, 1281, 1, 256]
    - [110, 4651.68]
  - - [42240, 1536, 1, 256]
    - [112, 4790.45]
  - - [5888, 2817, 1, 256]
    - [110, 4602.37]
  - - [8704, 2048, 1, 256]
    - [112, 4661.1]
  - - [6144, 1792, 1, 256]
    - [105, 4576.2]
  - - [16384, 1792, 1, 256]
    - [105, 4748.43]
  - - [8704, 1024, 1, 256]
    - [132, 4534.75]
  - - [26880, 256, 1, 256]
    - [112, 4467.91]
  - - [35584, 23297, 1, 256]
    - [105, 4844.49]
  - - [36352, 24064, 1, 256]
    - [112, 4841.19]
  - - [38400, 512, 1, 256]
    - [112, 4679.05]
  - - [23040, 1536, 1, 256]
    - [112, 4738.34]
  - - [28160, 512, 1, 256]
    - [112, 4616.04]
  - - [8704, 1536, 1, 256]
    - [110, 4573.65]
  - - [18432, 6145, 1, 256]
    - [112, 4744.26]
  - - [19456, 256, 1, 256]
    - [132, 4405.29]
  - - [23040, 1281, 1, 256]
    - [110, 4650.66]
  - - [12032, 3072, 1, 256]
    - [112, 4743.89]
  - - [36096, 1024, 1, 256]
    - [112, 4768.85]
  - - [4864, 3072, 1, 256]
    - [112, 4615.36]
  - - [42752, 1280, 1, 256]
    - [105, 4809.19]
  - - [15104, 1024, 1, 256]
    - [112, 4648.96]
  - - [1536, 1536, 1, 256]
    - [105, 4333.95]
  - - [28416, 2048, 1, 256]
    - [112, 4792.07]
  - - [39168, 3072, 1, 256]
    - [112, 4824.85]
  - - [7680, 256, 1, 256]
    - [106, 4109.38]
  - - [24576, 1281, 1, 256]
    - [108, 4655.9]
  - - [43520, 1281, 1, 256]
    - [110, 4697.82]
  - - [28160, 1536, 1, 256]
    - [112, 4765.84]
  - - [41728, 27648, 1, 256]
    - [112, 4845.4]
  - - [28416, 1792, 1, 256]
    - [112, 4814.13]
  - - [42240, 1792, 1, 256]
    - [105, 4834.12]
  - - [4864, 1536, 1, 256]
    - [132, 4478.33]
  - - [26368, 3072, 1, 256]
    - [112, 4803.31]
  - - [41728, 1536, 1, 256]
    - [112, 4803.37]
  - - [2048, 768, 1, 256]
    - [120, 4147.64]
  - - [24320, 12032, 1, 256]
    - [105, 4859.94]
  - - [28928, 16385, 1, 256]
    - [112, 4792.95]
  - - [34816, 22528, 1, 256]
    - [112, 4842.42]
  - - [26368, 1792, 1, 256]
    - [105, 4798.55]
  - - [34816, 1281, 1, 256]
    - [110, 4677.35]
  - - [25856, 13569, 1, 256]
    - [105, 4821.02]
  - - [4608, 1536, 1, 256]
    - [132, 4481.45]
  - - [22784, 256, 1, 256]
    - [112, 4487.77]
  - - [25600, 13312, 1, 256]
    - [112, 4838.25]
  - - [31232, 18689, 1, 256]
    - [105, 4821.72]
  - - [20736, 9216, 1, 256]
    - [112, 4830.01]
  - - [34304, 9216, 1, 256]
    - [112, 4839.54]
  - - [41472, 512, 1, 256]
    - [112, 4699.66]
  - - [12288, 1024, 1, 256]
    - [112, 4618.64]
  - - [7680, 1280, 1, 256]
    - [112, 4556.39]
  - - [14080, 1280, 1, 256]
    - [105, 4716.75]
  - - [29696, 1536, 1, 256]
    - [112, 4778.27]
  - - [43264, 3073, 1, 256]
    - [112, 4697.14]
  - - [17408, 1281, 1, 256]
    - [108, 4606.62]
  - - [7424, 2048, 1, 256]
    - [112, 4627.54]
  - - [37120, 1281, 1, 256]
    - [103, 4674.08]
  - - [12800, 512, 1, 256]
    - [130, 4442.18]
  - - [6912, 2048, 1, 256]
    - [112, 4600.47]
  - - [36864, 512, 1, 256]
    - [112, 4680.2]
  - - [8704, 5633, 1, 256]
    - [110, 4674.85]
  - - [4864, 1793, 1, 256]
    - [110, 4424.88]
  - - [15872, 256, 1, 256]
    - [132, 4282.72]
  - - [41984, 3072, 1, 256]
    - [112, 4824.96]
  - - [13824, 1280, 1, 256]
    - [105, 4688.31]
  - - [34560, 256, 1, 256]
    - [112, 4542.2]
  - - [20992, 3072, 1, 256]
    - [112, 4797.56]
  - - [40192, 1281, 1, 256]
    - [108, 4689.73]
  - - [9728, 6401, 1, 256]
    - [105, 4734.78]
  - - [36608, 1024, 1, 256]
    - [112, 4759.73]
  - - [17152, 1281, 1, 256]
    - [104, 4605.02]
  - - [16640, 4097, 1, 256]
    - [112, 4690.24]
  - - [38400, 9216, 1, 256]
    - [112, 4853.68]
  - - [15616, 256, 1, 256]
    - [124, 4228.27]
  - - [33024, 768, 1, 256]
    - [105, 4744.8]
  - - [38656, 1536, 1, 256]
    - [112, 4791.74]
  - - [1536, 3072, 1, 256]
    - [105, 4457.42]
  - - [12544, 1792, 1, 256]
    - [105, 4706.38]
  - - [37632, 1792, 1, 256]
    - [105, 4832.65]
  - - [17152, 4609, 1, 256]
    - [112, 4708.64]
  - - [18944, 6656, 1, 256]
    - [112, 4819.54]
  - - [34560, 22017, 1, 256]
    - [112, 4801.94]
  - - [23296, 11008, 1, 256]
    - [105, 4855.67]
  - - [41472, 1281, 1, 256]
    - [108, 4660.14]
  - - [14848, 768, 1, 256]
    - [105, 4568.73]
  - - [38656, 1792, 1, 256]
    - [105, 4816.53]
  - - [7424, 4352, 1, 256]
    - [105, 4756.28]
  - - [8448, 5377, 1, 256]
    - [105, 4726.61]
  - - [37120, 1280, 1, 256]
    - [105, 4808.08]
  - - [29696, 1281, 1, 256]
    - [110, 4667.56]
  - - [36608, 2048, 1, 256]
    - [112, 4799.63]
  - - [14080, 256, 1, 256]
    - [130, 4268.81]
  - - [29952, 17665, 1, 256]
    - [105, 4833.28]
  - - [16128, 3072, 1, 256]
    - [112, 4782.65]
  - - [19456, 2048, 1, 256]
    - [112, 4761.36]
  - - [2304, 2304, 1, 256]
    - [105, 4385.43]
  - - [33792, 21504, 1, 256]
    - [112, 4848.87]
  - - [37376, 512, 1, 256]
    - [112, 4665.84]
  - - [27136, 512, 1, 256]
    - [112, 4614.15]
  - - [24576, 1536, 1, 256]
    - [112, 4760.15]
  - - [6400, 1024, 1, 256]
    - [132, 4454.44]
  - - [7424, 1281, 1, 256]
    - [110, 4464.53]
  - - [35840, 2048, 1, 256]
    - [112, 4806.83]
  - - [3072, 1280, 1, 256]
    - [120, 4407.33]
  - - [23808, 256, 1, 256]
    - [112, 4400.61]
  - - [11520, 1024, 1, 256]
    - [112, 4568.68]
  - - [37376, 1792, 1, 256]
    - [105, 4819.25]
  - - [42752, 768, 1, 256]
    - [105, 4770.58]
  - - [4096, 1025, 1, 256]
    - [114, 4161.34]
  - - [35840, 768, 1, 256]
    - [105, 4731.94]
  - - [2304, 2305, 1, 256]
    - [105, 4328.11]
  - - [19200, 3072, 1, 256]
    - [112, 4794.46]
  - - [43264, 768, 1, 256]
    - [105, 4770.85]
  - - [33536, 1792, 1, 256]
    - [105, 4825.09]
  - - [36864, 9216, 1, 256]
    - [112, 4837.49]
  - - [38656, 26368, 1, 256]
    - [105, 4867.44]
  - - [22016, 1280, 1, 256]
    - [105, 4760.59]
  - - [8448, 5376, 1, 256]
    - [105, 4804.55]
  - - [17920, 1281, 1, 256]
    - [108, 4617.66]
  - - [2048, 1281, 1, 256]
    - [132, 3960.92]
  - - [41472, 3072, 1, 256]
    - [112, 4822.04]
  - - [3328, 512, 1, 256]
    - [132, 3919.91]
  - - [4608, 1024, 1, 256]
    - [112, 4428.65]
  - - [44288, 9216, 1, 256]
    - [112, 4839.56]
  - - [37888, 2048, 1, 256]
    - [112, 4806.11]
  - - [15104, 1792, 1, 256]
    - [112, 4755.4]
  - - [36096, 256, 1, 256]
    - [112, 4548.86]
  - - [44288, 4097, 1, 256]
    - [112, 4724.48]
  - - [26112, 3072, 1, 256]
    - [112, 4804.21]
  - - [512, 768, 1, 256]
    - [119, 2946.82]
  - - [36096, 3072, 1, 256]
    - [112, 4820.65]
  - - [4864, 1537, 1, 256]
    - [132, 4300.79]
  - - [43264, 3329, 1, 256]
    - [105, 4745.23]
  - - [9984, 2048, 1, 256]
    - [112, 4681.01]
  - - [33792, 1536, 1, 256]
    - [112, 4784.17]
  - - [13568, 2048, 1, 256]
    - [112, 4725.47]
  - - [31232, 18944, 1, 256]
    - [112, 4845.2]
  - - [44288, 1792, 1, 256]
    - [105, 4827.68]
  - - [25344, 1536, 1, 256]
    - [112, 4773.29]
  - - [7936, 1281, 1, 256]
    - [108, 4455.73]
  - - [38656, 2048, 1, 256]
    - [112, 4798.62]
  - - [30976, 2048, 1, 256]
    - [112, 4792.42]
  - - [20224, 7681, 1, 256]
    - [112, 4752.82]
  - - [26112, 9216, 1, 256]
    - [112, 4841.32]
  - - [7936, 1280, 1, 256]
    - [105, 4595.12]
  - - [31488, 2048, 1, 256]
    - [112, 4795.77]
  - - [6912, 512, 1, 256]
    - [112, 4357.3]
  - - [20224, 1280, 1, 256]
    - [105, 4751.63]
  - - [8960, 5888, 1, 256]
    - [105, 4797.07]
  - - [32000, 1792, 1, 256]
    - [105, 4809.73]
  - - [37888, 1792, 1, 256]
    - [105, 4823.34]
  - - [21504, 3072, 1, 256]
    - [112, 4813.74]
  - - [43264, 2048, 1, 256]
    - [112, 4809.14]
  - - [40448, 1281, 1, 256]
    - [110, 4692.42]
  - - [12544, 3072, 1, 256]
    - [112, 4748.82]
  - - [32256, 19713, 1, 256]
    - [105, 4824.97]
  - - [40704, 1792, 1, 256]
    - [105, 4826.47]
  - - [7936, 256, 1, 256]
    - [124, 4049.31]
  - - [18176, 5888, 1, 256]
    - [105, 4832.37]
  - - [33792, 9216, 1, 256]
    - [112, 4846.67]
  - - [35584, 1536, 1, 256]
    - [112, 4788.57]
  - - [26624, 14336, 1, 256]
    - [112, 4839.8]
  - - [38912, 1792, 1, 256]
    - [105, 4823.59]
  - - [7936, 1792, 1, 256]
    - [112, 4627.4]
  - - [28672, 16385, 1, 256]
    - [112, 4782.0]
  - - [18944, 3072, 1, 256]
    - [112, 4787.7]
  - - [33280, 20993, 1, 256]
    - [112, 4800.41]
  - - [5888, 3072, 1, 256]
    - [112, 4646.68]
  - - [37120, 24832, 1, 256]
    - [105, 4864.61]
  - - [6400, 3329, 1, 256]
    - [110, 4627.57]
  - - [43520, 1792, 1, 256]
    - [112, 4827.19]
  - - [29184, 3072, 1, 256]
    - [112, 4809.08]
  - - [16896, 4609, 1, 256]
    - [112, 4716.94]
  - - [29440, 1024, 1, 256]
    - [112, 4738.16]
  - - [43776, 1280, 1, 256]
    - [105, 4815.67]
  - - [37632, 1536, 1, 256]
    - [112, 4791.63]
  - - [14336, 768, 1, 256]
    - [132, 4572.93]
  - - [41984, 1281, 1, 256]
    - [110, 4683.46]
  - - [41472, 1536, 1, 256]
    - [112, 4790.62]
  - - [26624, 1281, 1, 256]
    - [110, 4659.1]
  - - [39936, 768, 1, 256]
    - [112, 4763.59]
  - - [23296, 11009, 1, 256]
    - [105, 4810.24]
  - - [42496, 256, 1, 256]
    - [112, 4606.08]
  - - [21504, 512, 1, 256]
    - [132, 4571.45]
  - - [16128, 512, 1, 256]
    - [112, 4555.88]
  - - [29952, 1281, 1, 256]
    - [110, 4668.59]
  - - [26624, 9216, 1, 256]
    - [112, 4837.24]
  - - [29184, 9216, 1, 256]
    - [112, 4838.52]
  - - [5120, 1281, 1, 256]
    - [108, 4346.23]
  - - [36352, 9216, 1, 256]
    - [112, 4845.41]
  - - [37632, 25344, 1, 256]
    - [105, 4874.79]
  - - [1280, 256, 1, 256]
    - [119, 2505.56]
  - - [37888, 25600, 1, 256]
    - [112, 4847.13]
  - - [34560, 1281, 1, 256]
    - [110, 4685.19]
  - - [16640, 9216, 1, 256]
    - [112, 4824.31]
  - - [1792, 1281, 1, 256]
    - [97, 4195.19]
  - - [44544, 9216, 1, 256]
    - [112, 4847.99]
  - - [14080, 1792, 1, 256]
    - [112, 4729.82]
  - - [33536, 21249, 1, 256]
    - [105, 4829.71]
  - - [32256, 1281, 1, 256]
    - [110, 4670.9]
  - - [23552, 1280, 1, 256]
    - [105, 4762.72]
  - - [18432, 2048, 1, 256]
    - [112, 4764.09]
  - - [34048, 21760, 1, 256]
    - [105, 4864.94]
  - - [9984, 768, 1, 256]
    - [105, 4498.43]
  - - [40192, 1536, 1, 256]
    - [112, 4793.2]
  - - [11520, 256, 1, 256]
    - [105, 4148.21]
  - - [4608, 1280, 1, 256]
    - [105, 4473.67]
  - - [41728, 3072, 1, 256]
    - [112, 4824.27]
  - - [35328, 9216, 1, 256]
    - [112, 4841.16]
  - - [11264, 1536, 1, 256]
    - [112, 4639.45]
  - - [6912, 3072, 1, 256]
    - [112, 4677.67]
  - - [32512, 768, 1, 256]
    - [105, 4736.31]
  - - [14592, 2049, 1, 256]
    - [110, 4602.28]
  - - [14848, 9216, 1, 256]
    - [112, 4822.39]
  - - [36352, 512, 1, 256]
    - [112, 4654.15]
  - - [23808, 3072, 1, 256]
    - [112, 4806.58]
  - - [13568, 9216, 1, 256]
    - [112, 4822.61]
  - - [1024, 769, 1, 256]
    - [93, 3276.81]
  - - [42496, 2560, 1, 256]
    - [112, 4816.7]
  - - [18176, 1024, 1, 256]
    - [112, 4667.64]
  - - [42752, 3072, 1, 256]
    - [112, 4821.04]
  - - [39680, 27392, 1, 256]
    - [105, 4871.2]
  - - [14592, 1792, 1, 256]
    - [105, 4746.65]
  - - [25600, 13313, 1, 256]
    - [112, 4779.49]
  - - [26624, 1792, 1, 256]
    - [112, 4793.11]
  - - [20480, 8193, 1, 256]
    - [112, 4760.77]
  - - [36096, 23808, 1, 256]
    - [105, 4870.28]
  - - [20736, 2048, 1, 256]
    - [112, 4784.71]
  - - [28672, 2048, 1, 256]
    - [112, 4797.96]
  - - [15104, 2561, 1, 256]
    - [110, 4624.88]
  - - [11776, 1281, 1, 256]
    - [110, 4559.14]
  - - [43520, 3072, 1, 256]
    - [112, 4834.77]
  - - [1280, 2048, 1, 256]
    - [120, 4316.24]
  - - [33280, 1280, 1, 256]
    - [105, 4785.41]
  - - [43008, 1792, 1, 256]
    - [105, 4825.47]
  - - [19712, 512, 1, 256]
    - [112, 4553.24]
  - - [18688, 3072, 1, 256]
    - [112, 4792.87]
  - - [35328, 23040, 1, 256]
    - [112, 4853.32]
  - - [18944, 6401, 1, 256]
    - [105, 4766.21]
  - - [16640, 768, 1, 256]
    - [112, 4620.84]
  - - [16128, 3585, 1, 256]
    - [112, 4678.5]
  - - [4352, 2048, 1, 256]
    - [112, 4514.65]
  - - [24064, 256, 1, 256]
    - [125, 4421.49]
  - - [29952, 1536, 1, 256]
    - [112, 4778.09]
  - - [7936, 512, 1, 256]
    - [130, 4291.91]
  - - [24320, 512, 1, 256]
    - [112, 4613.13]
  - - [17408, 5121, 1, 256]
    - [112, 4718.11]
  - - [44032, 1536, 1, 256]
    - [112, 4797.37]
  - - [4608, 1792, 1, 256]
    - [112, 4553.53]
  - - [36608, 1792, 1, 256]
    - [105, 4831.97]
  - - [13056, 768, 1, 256]
    - [105, 4570.07]
  - - [35328, 1792, 1, 256]
    - [105, 4824.66]
  - - [40960, 1280, 1, 256]
    - [112, 4807.23]
  - - [1280, 1280, 1, 256]
    - [120, 3838.13]
  - - [26112, 13824, 1, 256]
    - [112, 4846.7]
  - - [6400, 1280, 1, 256]
    - [105, 4557.84]
  - - [43520, 3585, 1, 256]
    - [110, 4717.45]
  - - [40704, 9216, 1, 256]
    - [112, 4832.38]
  - - [20224, 1024, 1, 256]
    - [112, 4691.18]
  - - [2816, 2817, 1, 256]
    - [132, 4424.33]
  - - [27904, 15617, 1, 256]
    - [105, 4825.27]
  - - [21248, 3072, 1, 256]
    - [112, 4801.15]
  - - [32768, 512, 1, 256]
    - [112, 4661.35]
  - - [19712, 1280, 1, 256]
    - [105, 4736.75]
  - - [38912, 1536, 1, 256]
    - [112, 4792.17]
  - - [20480, 1280, 1, 256]
    - [105, 4759.09]
  - - [8960, 1536, 1, 256]
    - [112, 4599.5]
  - - [28672, 1792, 1, 256]
    - [112, 4803.08]
  - - [14592, 2048, 1, 256]
    - [112, 4731.47]
  - - [18432, 1792, 1, 256]
    - [105, 4778.75]
  - - [39680, 1280, 1, 256]
    - [105, 4810.27]
  - - [29952, 9216, 1, 256]
    - [112, 4845.1]
  - - [4352, 1025, 1, 256]
    - [108, 4187.32]
  - - [35328, 1281, 1, 256]
    - [110, 4675.72]
  - - [23808, 2048, 1, 256]
    - [112, 4778.15]
  - - [25600, 1792, 1, 256]
    - [112, 4803.14]
  - - [19712, 256, 1, 256]
    - [112, 4354.93]
  - - [34304, 22017, 1, 256]
    - [112, 4795.42]
  - - [21760, 256, 1, 256]
    - [132, 4359.45]
  - - [39168, 1281, 1, 256]
    - [110, 4683.91]
  - - [42752, 512, 1, 256]
    - [112, 4685.9]
  - - [24064, 512, 1, 256]
    - [132, 4573.04]
  - - [28160, 15617, 1, 256]
    - [105, 4813.45]
  - - [20224, 512, 1, 256]
    - [132, 4550.26]
  - - [17408, 256, 1, 256]
    - [132, 4325.34]
  - - [1536, 256, 1, 256]
    - [119, 2939.93]
  - - [11776, 8704, 1, 256]
    - [112, 4803.35]
  - - [19968, 9216, 1, 256]
    - [112, 4830.17]
  - - [5376, 512, 1, 256]
    - [130, 4150.83]
  - - [26624, 1024, 1, 256]
    - [112, 4711.17]
  - - [7424, 4353, 1, 256]
    - [110, 4703.28]
  - - [19200, 1792, 1, 256]
    - [105, 4777.84]
  - - [27648, 15360, 1, 256]
    - [112, 4847.1]
  - - [26624, 3072, 1, 256]
    - [112, 4808.11]
  - - [21248, 1536, 1, 256]
    - [112, 4738.68]
  - - [16640, 1280, 1, 256]
    - [105, 4710.75]
  - - [23040, 10497, 1, 256]
    - [105, 4809.84]
  - - [21248, 8961, 1, 256]
    - [105, 4807.92]
  - - [32256, 1792, 1, 256]
    - [105, 4813.07]
  - - [28928, 1024, 1, 256]
    - [112, 4729.63]
  - - [26112, 13569, 1, 256]
    - [105, 4816.2]
  - - [20992, 1024, 1, 256]
    - [112, 4677.61]
  - - [3840, 2048, 1, 256]
    - [132, 4531.53]
  - - [25856, 1024, 1, 256]
    - [112, 4716.77]
  - - [12288, 8961, 1, 256]
    - [105, 4781.28]
  - - [16896, 3072, 1, 256]
    - [112, 4786.38]
  - - [6656, 3585, 1, 256]
    - [108, 4593.77]
  - - [19968, 7425, 1, 256]
    - [105, 4775.77]
  - - [40960, 1281, 1, 256]
    - [110, 4682.71]
  - - [9472, 768, 1, 256]
    - [132, 4507.38]
  - - [29440, 1281, 1, 256]
    - [110, 4671.83]
  - - [33792, 3072, 1, 256]
    - [112, 4816.6]
  - - [15616, 3072, 1, 256]
    - [112, 4789.45]
  - - [26624, 2048, 1, 256]
    - [112, 4796.45]
  - - [16384, 1024, 1, 256]
    - [112, 4647.23]
  - - [8704, 5377, 1, 256]
    - [105, 4702.85]
  - - [26880, 2048, 1, 256]
    - [112, 4803.69]
  - - [11520, 3072, 1, 256]
    - [112, 4768.46]
  - - [41216, 2048, 1, 256]
    - [112, 4804.96]
  - - [3584, 1280, 1, 256]
    - [132, 4367.12]
  - - [33536, 2048, 1, 256]
    - [112, 4807.38]
  - - [25856, 1536, 1, 256]
    - [112, 4756.8]
  - - [15872, 1281, 1, 256]
    - [110, 4610.44]
  - - [33792, 2048, 1, 256]
    - [112, 4809.42]
  - - [42496, 1281, 1, 256]
    - [110, 4697.18]
  - - [35840, 1792, 1, 256]
    - [105, 4821.72]
  - - [28416, 768, 1, 256]
    - [105, 4722.1]
  - - [12800, 2048, 1, 256]
    - [112, 4713.63]
  - - [21248, 512, 1, 256]
    - [112, 4575.2]
  - - [2048, 1793, 1, 256]
    - [132, 4115.09]
  - - [13056, 1024, 1, 256]
    - [112, 4608.63]
  - - [9728, 2048, 1, 256]
    - [112, 4683.96]
  - - [34816, 2048, 1, 256]
    - [112, 4798.38]
  - - [32256, 3072, 1, 256]
    - [112, 4820.82]
  - - [18688, 1280, 1, 256]
    - [105, 4718.37]
  - - [20736, 1536, 1, 256]
    - [112, 4753.25]
  - - [25856, 1281, 1, 256]
    - [108, 4658.55]
  - - [36864, 1024, 1, 256]
    - [112, 4749.76]
  - - [22784, 10241, 1, 256]
    - [112, 4766.34]
  - - [36608, 24321, 1, 256]
    - [105, 4841.32]
  - - [36096, 9216, 1, 256]
    - [112, 4842.5]
  - - [10752, 768, 1, 256]
    - [105, 4571.25]
  - - [38400, 26112, 1, 256]
    - [112, 4852.19]
  - - [9216, 5889, 1, 256]
    - [105, 4732.77]
  - - [28160, 256, 1, 256]
    - [130, 4454.7]
  - - [9472, 256, 1, 256]
    - [130, 4000.75]
  - - [39168, 2048, 1, 256]
    - [112, 4809.93]
  - - [30976, 1281, 1, 256]
    - [110, 4677.98]
  - - [41472, 27648, 1, 256]
    - [112, 4845.65]
  - - [38144, 25856, 1, 256]
    - [105, 4870.9]
  - - [12288, 256, 1, 256]
    - [112, 4347.37]
  - - [32256, 1280, 1, 256]
    - [105, 4798.19]
  - - [8960, 256, 1, 256]
    - [105, 4190.71]
  - - [11008, 1536, 1, 256]
    - [112, 4632.41]
  - - [15360, 3073, 1, 256]
    - [112, 4654.96]
  - - [24576, 1024, 1, 256]
    - [112, 4707.74]
  - - [29184, 16896, 1, 256]
    - [112, 4849.14]
  - - [3072, 1281, 1, 256]
    - [130, 4141.68]
  - - [21760, 512, 1, 256]
    - [112, 4551.46]
  - - [15872, 2048, 1, 256]
    - [112, 4741.7]
  - - [16128, 1792, 1, 256]
    - [105, 4763.68]
  - - [32768, 20225, 1, 256]
    - [105, 4827.47]
  - - [26624, 512, 1, 256]
    - [112, 4617.91]
  - - [23040, 10752, 1, 256]
    - [112, 4837.81]
  - - [28160, 1280, 1, 256]
    - [105, 4780.48]
  - - [15872, 3585, 1, 256]
    - [110, 4671.51]
  - - [11008, 7681, 1, 256]
    - [112, 4723.19]
  - - [15360, 9216, 1, 256]
    - [112, 4830.01]
  - - [2048, 1280, 1, 256]
    - [120, 4327.37]
  - - [9728, 1024, 1, 256]
    - [132, 4558.38]
  - - [28672, 512, 1, 256]
    - [112, 4627.06]
  - - [44032, 1281, 1, 256]
    - [110, 4697.54]
  - - [512, 512, 1, 256]
    - [124, 2613.27]
  - - [28416, 16128, 1, 256]
    - [105, 4864.98]
  - - [12288, 9216, 1, 256]
    - [112, 4827.01]
  - - [30208, 1792, 1, 256]
    - [105, 4808.33]
  - - [13056, 2048, 1, 256]
    - [112, 4730.42]
  - - [41728, 1792, 1, 256]
    - [105, 4819.63]
  - - [32256, 19968, 1, 256]
    - [112, 4846.26]
  - - [15360, 1281, 1, 256]
    - [110, 4600.09]
  - - [34304, 1024, 1, 256]
    - [112, 4738.63]
  - - [27904, 1792, 1, 256]
    - [105, 4801.44]
  - - [23552, 1024, 1, 256]
    - [112, 4703.37]
  - - [10240, 7168, 1, 256]
    - [112, 4790.56]
  - - [18944, 1792, 1, 256]
    - [105, 4773.59]
  - - [19200, 1536, 1, 256]
    - [112, 4748.39]
  - - [33024, 1024, 1, 256]
    - [112, 4756.93]
  - - [10240, 1280, 1, 256]
    - [105, 4617.25]
  - - [40192, 1792, 1, 256]
    - [105, 4835.2]
  - - [41728, 1793, 1, 256]
    - [110, 4686.21]
  - - [9984, 6912, 1, 256]
    - [105, 4819.36]
  - - [12544, 1281, 1, 256]
    - [110, 4547.05]
  - - [31488, 19201, 1, 256]
    - [105, 4834.57]
  - - [40192, 257, 1, 256]
    - [110, 4073.19]
  - - [14336, 2048, 1, 256]
    - [112, 4726.33]
  - - [31488, 1280, 1, 256]
    - [112, 4792.56]
  - - [42752, 27648, 1, 256]
    - [112, 4839.56]
  - - [3328, 1280, 1, 256]
    - [112, 4332.28]
  - - [2560, 1024, 1, 256]
    - [118, 4217.51]
  - - [17920, 512, 1, 256]
    - [132, 4538.24]
  - - [40704, 768, 1, 256]
    - [105, 4763.53]
  - - [25088, 12545, 1, 256]
    - [105, 4811.89]
  - - [28928, 1280, 1, 256]
    - [105, 4777.11]
  - - [24576, 9216, 1, 256]
    - [112, 4840.83]
  - - [37376, 1281, 1, 256]
    - [104, 4679.51]
  - - [33024, 20737, 1, 256]
    - [105, 4834.87]
  - - [29696, 9216, 1, 256]
    - [112, 4834.63]
  - - [768, 769, 1, 256]
    - [94, 3184.32]
  - - [31232, 1536, 1, 256]
    - [112, 4767.44]
  - - [25600, 1024, 1, 256]
    - [112, 4716.15]
  - - [30208, 17920, 1, 256]
    - [112, 4846.65]
  - - [9216, 1792, 1, 256]
    - [105, 4686.17]
  - - [8448, 1280, 1, 256]
    - [105, 4586.52]
  - - [44544, 4609, 1, 256]
    - [112, 4733.05]
  - - [43520, 1280, 1, 256]
    - [112, 4808.62]
  - - [22016, 9728, 1, 256]
    - [112, 4832.58]
  - - [24320, 256, 1, 256]
    - [132, 4458.53]
  - - [9472, 6400, 1, 256]
    - [105, 4801.95]
  - - [16640, 3072, 1, 256]
    - [112, 4780.32]
  - - [20480, 1024, 1, 256]
    - [112, 4688.01]
  - - [30208, 17921, 1, 256]
    - [112, 4794.21]
  - - [6656, 256, 1, 256]
    - [125, 3921.32]
  - - [5376, 1281, 1, 256]
    - [110, 4400.42]
  - - [19200, 6657, 1, 256]
    - [112, 4751.22]
  - - [6400, 2048, 1, 256]
    - [112, 4580.19]
  - - [32768, 1024, 1, 256]
    - [112, 4749.81]
  - - [34560, 512, 1, 256]
    - [112, 4653.44]
  - - [22016, 9729, 1, 256]
    - [112, 4762.39]
  - - [18176, 768, 1, 256]
    - [105, 4635.91]
  - - [7168, 1792, 1, 256]
    - [105, 4634.59]
  - - [39424, 512, 1, 256]
    - [112, 4678.23]
  - - [21760, 1792, 1, 256]
    - [105, 4780.13]
  - - [19968, 512, 1, 256]
    - [132, 4558.39]
  - - [37120, 2048, 1, 256]
    - [112, 4801.72]
  - - [29184, 1792, 1, 256]
    - [112, 4811.34]
  - - [12288, 1792, 1, 256]
    - [105, 4733.12]
  - - [17664, 512, 1, 256]
    - [132, 4513.87]
  - - [15616, 3328, 1, 256]
    - [105, 4802.18]
  - - [22528, 1536, 1, 256]
    - [112, 4750.71]
  - - [14848, 2305, 1, 256]
    - [105, 4615.21]
  - - [41216, 1025, 1, 256]
    - [110, 4537.29]
  - - [10496, 2048, 1, 256]
    - [112, 4700.63]
  - - [41984, 1024, 1, 256]
    - [112, 4769.89]
  - - [25088, 256, 1, 256]
    - [125, 4424.09]
  - - [8192, 3072, 1, 256]
    - [112, 4696.08]
  - - [18432, 512, 1, 256]
    - [112, 4560.06]
  - - [5888, 1792, 1, 256]
    - [105, 4595.33]
  - - [21760, 3072, 1, 256]
    - [112, 4796.5]
  - - [22272, 9985, 1, 256]
    - [105, 4816.07]
  - - [29184, 1536, 1, 256]
    - [112, 4769.74]
  - - [19456, 1536, 1, 256]
    - [112, 4732.06]
  - - [34304, 512, 1, 256]
    - [112, 4676.24]
  - - [9728, 512, 1, 256]
    - [132, 4339.92]
  - - [26112, 1281, 1, 256]
    - [110, 4663.67]
  - - [18944, 1281, 1, 256]
    - [110, 4614.23]
  - - [22016, 3072, 1, 256]
    - [112, 4799.6]
  - - [30720, 9216, 1, 256]
    - [112, 4851.44]
  - - [13824, 512, 1, 256]
    - [112, 4463.34]
  - - [39168, 768, 1, 256]
    - [105, 4762.84]
  - - [39424, 1280, 1, 256]
    - [105, 4805.12]
  - - [39680, 1792, 1, 256]
    - [105, 4820.68]
  - - [28928, 1281, 1, 256]
    - [110, 4661.69]
  - - [12288, 2048, 1, 256]
    - [112, 4709.95]
  - - [9728, 1536, 1, 256]
    - [112, 4617.14]
  - - [5120, 1792, 1, 256]
    - [120, 4542.46]
  - - [30208, 256, 1, 256]
    - [105, 4500.57]
  - - [34560, 9216, 1, 256]
    - [112, 4848.67]
  - - [33536, 1281, 1, 256]
    - [110, 4673.17]
  - - [12032, 8705, 1, 256]
    - [112, 4745.31]
  - - [10752, 7425, 1, 256]
    - [105, 4762.81]
  - - [12288, 512, 1, 256]
    - [132, 4448.72]
  - - [44032, 1792, 1, 256]
    - [105, 4829.11]
  - - [18688, 1536, 1, 256]
    - [112, 4729.2]
  - - [16128, 3840, 1, 256]
    - [112, 4812.32]
  - - [38656, 768, 1, 256]
    - [105, 4753.85]
  - - [27136, 1024, 1, 256]
    - [112, 4729.24]
  - - [21248, 1792, 1, 256]
    - [105, 4792.88]
  - - [36352, 3072, 1, 256]
    - [112, 4809.94]
  - - [16896, 1281, 1, 256]
    - [108, 4608.58]
  - - [19968, 7680, 1, 256]
    - [112, 4825.83]
  - - [14848, 1536, 1, 256]
    - [112, 4674.22]
  - - [3840, 513, 1, 256]
    - [110, 3652.23]
  - - [21248, 256, 1, 256]
    - [105, 4427.97]
  - - [3584, 1792, 1, 256]
    - [132, 4459.13]
  - - [12032, 512, 1, 256]
    - [130, 4430.44]
  - - [38400, 3072, 1, 256]
    - [112, 4825.23]
  - - [5376, 768, 1, 256]
    - [131, 4338.22]
  - - [37888, 1280, 1, 256]
    - [105, 4799.27]
  - - [5888, 2048, 1, 256]
    - [112, 4597.05]
  - - [20224, 9216, 1, 256]
    - [112, 4834.93]
  - - [17408, 5120, 1, 256]
    - [112, 4812.9]
  - - [28928, 9216, 1, 256]
    - [112, 4834.26]
  - - [19456, 1792, 1, 256]
    - [105, 4782.7]
  - - [8192, 2048, 1, 256]
    - [112, 4635.99]
  - - [40960, 2048, 1, 256]
    - [112, 4809.85]
  - - [10752, 3072, 1, 256]
    - [112, 4766.58]
  - - [35072, 1792, 1, 256]
    - [105, 4821.73]
  - - [28672, 1281, 1, 256]
    - [110, 4664.35]
  - - [7168, 2048, 1, 256]
    - [112, 4611.62]
  - - [31488, 19200, 1, 256]
    - [105, 4859.12]
  - - [11008, 7937, 1, 256]
    - [105, 4756.64]
  - - [21248, 8705, 1, 256]
    - [112, 4769.8]
  - - [13568, 3072, 1, 256]
    - [112, 4753.18]
  - - [29696, 2048, 1, 256]
    - [112, 4794.67]
  - - [3328, 256, 1, 256]
    - [93, 3470.79]
  - - [28416, 1280, 1, 256]
    - [105, 4784.67]
  - - [39168, 1280, 1, 256]
    - [105, 4812.29]
  - - [15616, 3329, 1, 256]
    - [110, 4713.45]
  - - [36864, 3072, 1, 256]
    - [112, 4822.1]
  - - [34560, 22273, 1, 256]
    - [105, 4831.11]
  - - [11520, 1280, 1, 256]
    - [112, 4650.01]
  - - [34048, 768, 1, 256]
    - [105, 4751.5]
  - - [40448, 27648, 1, 256]
    - [112, 4842.87]
  - - [28416, 16129, 1, 256]
    - [105, 4834.06]
  - - [8960, 512, 1, 256]
    - [130, 4349.65]
  - - [34816, 22529, 1, 256]
    - [112, 4796.61]
  - - [22528, 3072, 1, 256]
    - [112, 4799.36]
  - - [27136, 14593, 1, 256]
    - [105, 4814.16]
  - - [5888, 256, 1, 256]
    - [125, 3927.89]
  - - [35584, 3072, 1, 256]
    - [112, 4820.51]
  - - [43008, 3072, 1, 256]
    - [112, 4821.42]
  - - [30208, 2048, 1, 256]
    - [112, 4798.95]
  - - [10496, 1024, 1, 256]
    - [132, 4568.72]
  - - [30464, 1792, 1, 256]
    - [105, 4806.51]
  - - [16384, 4097, 1, 256]
    - [112, 4692.23]
  - - [20992, 9216, 1, 256]
    - [112, 4831.63]
  - - [43776, 1536, 1, 256]
    - [112, 4798.57]
  - - [4864, 256, 1, 256]
    - [119, 3857.3]
  - - [14848, 2048, 1, 256]
    - [112, 4732.41]
  - - [9728, 256, 1, 256]
    - [132, 4066.94]
  - - [3072, 2817, 1, 256]
    - [108, 4424.74]
  - - [31488, 1792, 1, 256]
    - [112, 4812.17]
  - - [31488, 9216, 1, 256]
    - [112, 4844.13]
  - - [26368, 1281, 1, 256]
    - [103, 4658.45]
  - - [22272, 9984, 1, 256]
    - [112, 4859.96]
  - - [41728, 1537, 1, 256]
    - [112, 4579.76]
  - - [34560, 768, 1, 256]
    - [112, 4738.73]
  - - [26880, 1792, 1, 256]
    - [105, 4804.51]
  - - [30464, 768, 1, 256]
    - [105, 4732.06]
  - - [8448, 1281, 1, 256]
    - [110, 4490.7]
  - - [40704, 1281, 1, 256]
    - [110, 4685.52]
  - - [22784, 9216, 1, 256]
    - [112, 4842.37]
  - - [24320, 1281, 1, 256]
    - [110, 4657.44]
  - - [30720, 1281, 1, 256]
    - [110, 4673.67]
  - - [17920, 1280, 1, 256]
    - [112, 4730.01]
  - - [7936, 2048, 1, 256]
    - [112, 4626.35]
  - - [37632, 1281, 1, 256]
    - [110, 4687.29]
  - - [3328, 1792, 1, 256]
    - [132, 4466.73]
  - - [2816, 1792, 1, 256]
    - [119, 4367.3]
  - - [41472, 1537, 1, 256]
    - [112, 4581.41]
  - - [16896, 1024, 1, 256]
    - [112, 4661.71]
  - - [33536, 1280, 1, 256]
    - [105, 4794.62]
  - - [30720, 512, 1, 256]
    - [112, 4645.71]
  - - [28672, 1024, 1, 256]
    - [112, 4715.54]
  - - [43008, 27648, 1, 256]
    - [112, 4841.98]
  - - [39424, 27137, 1, 256]
    - [112, 4798.88]
  - - [24320, 1792, 1, 256]
    - [105, 4790.98]
  - - [34816, 1280, 1, 256]
    - [105, 4790.99]
  - - [21504, 256, 1, 256]
    - [125, 4444.02]
  - - [32000, 3072, 1, 256]
    - [112, 4828.33]
  - - [6144, 768, 1, 256]
    - [112, 4422.82]
  - - [12800, 1792, 1, 256]
    - [105, 4714.06]
  - - [41728, 1280, 1, 256]
    - [112, 4797.09]
  - - [15872, 3072, 1, 256]
    - [112, 4772.96]
  - - [23296, 512, 1, 256]
    - [112, 4574.32]
  - - [30720, 768, 1, 256]
    - [105, 4728.49]
  - - [43776, 27648, 1, 256]
    - [112, 4848.96]
  - - [33792, 1281, 1, 256]
    - [110, 4679.89]
  - - [22016, 2048, 1, 256]
    - [112, 4766.18]
  - - [15872, 1792, 1, 256]
    - [105, 4740.56]
  - - [36608, 1280, 1, 256]
    - [105, 4804.05]
  - - [39936, 1792, 1, 256]
    - [105, 4819.82]
  - - [10496, 7425, 1, 256]
    - [105, 4759.17]
  - - [16896, 4608, 1, 256]
    - [112, 4804.26]
  - - [9984, 6913, 1, 256]
    - [105, 4769.47]
  - - [21248, 8960, 1, 256]
    - [105, 4849.79]
  - - [37376, 256, 1, 256]
    - [112, 4538.75]
  - - [27392, 1536, 1, 256]
    - [112, 4770.56]
  - - [14336, 1792, 1, 256]
    - [112, 4720.55]
  - - [9472, 1280, 1, 256]
    - [112, 4623.96]
  - - [24832, 12544, 1, 256]
    - [105, 4860.23]
  - - [30464, 18176, 1, 256]
    - [105, 4860.12]
  - - [36096, 1280, 1, 256]
    - [105, 4797.26]
  - - [5632, 512, 1, 256]
    - [132, 4254.25]
  - - [31744, 19201, 1, 256]
    - [105, 4822.46]
  - - [11008, 1280, 1, 256]
    - [105, 4639.24]
  - - [27648, 1024, 1, 256]
    - [112, 4740.07]
  - - [41216, 768, 1, 256]
    - [105, 4760.1]
  - - [1792, 768, 1, 256]
    - [120, 3724.33]
  - - [26112, 2048, 1, 256]
    - [112, 4783.17]
  - - [20992, 1280, 1, 256]
    - [112, 4746.91]
  - - [41216, 1281, 1, 256]
    - [110, 4688.7]
  - - [35584, 2048, 1, 256]
    - [112, 4796.84]
  - - [23040, 1280, 1, 256]
    - [105, 4765.53]
  - - [33792, 1792, 1, 256]
    - [105, 4824.64]
  - - [9216, 1024, 1, 256]
    - [112, 4553.19]
  - - [16896, 9216, 1, 256]
    - [112, 4839.61]
  - - [1536, 2048, 1, 256]
    - [120, 4324.02]
  - - [31744, 256, 1, 256]
    - [105, 4520.2]
  - - [43264, 3328, 1, 256]
    - [112, 4840.79]
  - - [40192, 3072, 1, 256]
    - [112, 4823.69]
  - - [32000, 512, 1, 256]
    - [112, 4651.04]
  - - [42240, 3072, 1, 256]
    - [112, 4824.32]
  - - [7168, 256, 1, 256]
    - [120, 4080.63]
  - - [32256, 9216, 1, 256]
    - [112, 4837.82]
  - - [29952, 256, 1, 256]
    - [112, 4498.84]
  - - [41984, 2049, 1, 256]
    - [110, 4668.15]
  - - [6656, 1792, 1, 256]
    - [105, 4589.18]
  - - [13824, 1537, 1, 256]
    - [108, 4494.89]
  - - [20736, 3072, 1, 256]
    - [112, 4807.34]
  - - [8192, 768, 1, 256]
    - [130, 4489.89]
  - - [43008, 768, 1, 256]
    - [105, 4777.46]
  - - [8448, 1024, 1, 256]
    - [132, 4533.27]
  - - [36096, 23809, 1, 256]
    - [105, 4837.14]
  - - [41728, 9216, 1, 256]
    - [112, 4836.84]
  - - [28160, 1281, 1, 256]
    - [110, 4670.68]
  - - [25600, 768, 1, 256]
    - [112, 4685.5]
  - - [9216, 1281, 1, 256]
    - [110, 4506.53]
  - - [43776, 2048, 1, 256]
    - [112, 4818.69]
  - - [23040, 256, 1, 256]
    - [105, 4513.24]
  - - [44032, 4096, 1, 256]
    - [112, 4827.33]
  - - [37632, 768, 1, 256]
    - [105, 4761.47]
  - - [43008, 256, 1, 256]
    - [105, 4581.26]
  - - [34304, 2048, 1, 256]
    - [112, 4806.09]
  - - [10496, 256, 1, 256]
    - [132, 4061.56]
  - - [25600, 9216, 1, 256]
    - [112, 4829.57]
  - - [19968, 3072, 1, 256]
    - [112, 4793.72]
  - - [40448, 256, 1, 256]
    - [112, 4561.54]
  - - [18176, 1280, 1, 256]
    - [105, 4714.19]
  - - [15616, 9216, 1, 256]
    - [112, 4815.92]
  - - [29184, 16897, 1, 256]
    - [112, 4796.73]
  - - [7168, 3841, 1, 256]
    - [110, 4620.85]
  - - [40704, 769, 1, 256]
    - [110, 4442.57]
  - - [39936, 1281, 1, 256]
    - [110, 4694.61]
  - - [6144, 3073, 1, 256]
    - [112, 4545.93]
  - - [9984, 1281, 1, 256]
    - [108, 4535.54]
  - - [8192, 1281, 1, 256]
    - [110, 4502.33]
  - - [41728, 2048, 1, 256]
    - [112, 4809.51]
  - - [34304, 1792, 1, 256]
    - [105, 4816.97]
  - - [39936, 1280, 1, 256]
    - [105, 4805.6]
  - - [28160, 2048, 1, 256]
    - [112, 4789.07]
  - - [43520, 9216, 1, 256]
    - [112, 4839.39]
  - - [18688, 6400, 1, 256]
    - [112, 4838.81]
  - - [35840, 512, 1, 256]
    - [112, 4674.62]
  - - [39680, 512, 1, 256]
    - [112, 4676.6]
  - - [20992, 1536, 1, 256]
    - [112, 4739.11]
  - - [2816, 1280, 1, 256]
    - [118, 4347.66]
  - - [7680, 4608, 1, 256]
    - [112, 4754.55]
  - - [14592, 512, 1, 256]
    - [130, 4454.96]
  - - [21760, 768, 1, 256]
    - [112, 4680.32]
  - - [1536, 1280, 1, 256]
    - [117, 4006.02]
  - - [43264, 3072, 1, 256]
    - [112, 4828.1]
  - - [21760, 9216, 1, 256]
    - [112, 4829.37]
  - - [18432, 768, 1, 256]
    - [112, 4650.53]
  - - [9216, 512, 1, 256]
    - [130, 4403.47]
  - - [11264, 768, 1, 256]
    - [132, 4547.42]
  - - [42496, 3072, 1, 256]
    - [112, 4816.57]
  - - [19712, 2048, 1, 256]
    - [112, 4774.18]
  - - [34048, 1280, 1, 256]
    - [105, 4794.27]
  - - [43520, 2048, 1, 256]
    - [112, 4804.39]
  - - [12800, 1281, 1, 256]
    - [110, 4547.76]
  - - [15104, 1536, 1, 256]
    - [112, 4697.79]
  - - [30208, 17665, 1, 256]
    - [105, 4818.99]
  - - [27392, 15105, 1, 256]
    - [105, 4833.34]
  - - [512, 513, 1, 256]
    - [116, 2052.52]
  - - [17920, 256, 1, 256]
    - [112, 4368.42]
  - - [1792, 512, 1, 256]
    - [94, 3651.76]
  - - [13312, 1536, 1, 256]
    - [112, 4668.32]
  - - [29952, 17409, 1, 256]
    - [112, 4793.55]
  - - [9472, 2048, 1, 256]
    - [112, 4657.02]
  - - [43264, 1280, 1, 256]
    - [112, 4807.96]
  - - [44032, 3072, 1, 256]
    - [112, 4826.52]
  - - [28416, 256, 1, 256]
    - [125, 4490.86]
  - - [3840, 1280, 1, 256]
    - [132, 4423.13]
  - - [32768, 9216, 1, 256]
    - [112, 4852.41]
  - - [37632, 512, 1, 256]
    - [112, 4687.62]
  - - [41216, 9216, 1, 256]
    - [112, 4837.71]
  - - [8448, 1536, 1, 256]
    - [112, 4611.17]
  - - [41216, 512, 1, 256]
    - [112, 4697.62]
  - - [36352, 768, 1, 256]
    - [105, 4750.79]
  - - [2560, 2560, 1, 256]
    - [120, 4464.88]
  - - [12288, 1280, 1, 256]
    - [105, 4670.28]
  - - [768, 513, 1, 256]
    - [119, 2925.17]
  - - [36352, 2048, 1, 256]
    - [112, 4801.17]
  - - [23552, 768, 1, 256]
    - [105, 4680.5]
  - - [11264, 1281, 1, 256]
    - [110, 4531.02]
  - - [4096, 1281, 1, 256]
    - [103, 4236.77]
  - - [7168, 3072, 1, 256]
    - [112, 4672.39]
  - - [19712, 1792, 1, 256]
    - [105, 4777.84]
  - - [23040, 2048, 1, 256]
    - [112, 4778.02]
  - - [27136, 1281, 1, 256]
    - [108, 4662.12]
  - - [6144, 1024, 1, 256]
    - [132, 4398.18]
  - - [44288, 4353, 1, 256]
    - [103, 4773.42]
  - - [43776, 1281, 1, 256]
    - [110, 4695.1]
  - - [36608, 768, 1, 256]
    - [112, 4754.04]
  - - [34816, 768, 1, 256]
    - [105, 4744.45]
  - - [15616, 3073, 1, 256]
    - [112, 4650.77]
  - - [37376, 24833, 1, 256]
    - [105, 4830.05]
  - - [38144, 25857, 1, 256]
    - [105, 4844.84]
  - - [26880, 14592, 1, 256]
    - [105, 4865.07]
  - - [6144, 2817, 1, 256]
    - [105, 4561.4]
  - - [35584, 1280, 1, 256]
    - [105, 4808.79]
  - - [23808, 768, 1, 256]
    - [105, 4693.99]
  - - [33280, 1281, 1, 256]
    - [110, 4674.37]
  - - [29184, 2048, 1, 256]
    - [112, 4798.6]
  - - [35072, 1024, 1, 256]
    - [112, 4749.41]
  - - [39168, 26881, 1, 256]
    - [105, 4847.51]
  - - [20736, 1280, 1, 256]
    - [105, 4758.78]
  - - [5120, 1793, 1, 256]
    - [110, 4432.19]
  - - [32512, 19969, 1, 256]
    - [112, 4799.86]
  - - [17664, 1281, 1, 256]
    - [110, 4624.21]
  - - [3072, 256, 1, 256]
    - [121, 3847.99]
  - - [32512, 512, 1, 256]
    - [112, 4637.01]
  - - [5632, 1281, 1, 256]
    - [110, 4383.27]
  - - [25088, 9216, 1, 256]
    - [112, 4844.72]
  - - [42240, 1280, 1, 256]
    - [105, 4803.3]
  - - [43008, 2817, 1, 256]
    - [110, 4732.96]
  - - [26112, 13825, 1, 256]
    - [112, 4787.24]
  - - [38912, 512, 1, 256]
    - [112, 4686.55]
  - - [1024, 1024, 1, 256]
    - [101, 3959.24]
  - - [31744, 2048, 1, 256]
    - [112, 4789.52]
  - - [22272, 1024, 1, 256]
    - [112, 4712.85]
  - - [4352, 3072, 1, 256]
    - [132, 4595.02]
  - - [14336, 1280, 1, 256]
    - [105, 4700.82]
  - - [33536, 3072, 1, 256]
    - [112, 4818.29]
  - - [9728, 6657, 1, 256]
    - [112, 4709.61]
  - - [2048, 3072, 1, 256]
    - [120, 4489.89]
  - - [40448, 512, 1, 256]
    - [112, 4692.18]
  - - [24832, 9216, 1, 256]
    - [112, 4831.55]
  - - [37888, 1536, 1, 256]
    - [112, 4790.35]
  - - [5632, 2561, 1, 256]
    - [110, 4506.04]
  - - [41472, 1280, 1, 256]
    - [112, 4801.35]
  - - [3072, 3072, 1, 256]
    - [112, 4565.24]
  - - [29184, 1281, 1, 256]
    - [110, 4672.36]
  - - [33280, 20992, 1, 256]
    - [112, 4848.72]
  - - [25344, 1281, 1, 256]
    - [110, 4653.43]
  - - [4096, 1280, 1, 256]
    - [120, 4448.42]
  - - [20224, 7936, 1, 256]
    - [105, 4850.38]
  - - [4352, 1024, 1, 256]
    - [132, 4383.17]
  - - [28928, 512, 1, 256]
    - [112, 4637.54]
  - - [28672, 16384, 1, 256]
    - [112, 4858.25]
  - - [28416, 9216, 1, 256]
    - [112, 4844.95]
  - - [37120, 256, 1, 256]
    - [112, 4530.84]
  - - [7936, 768, 1, 256]
    - [130, 4398.13]
  - - [38912, 2048, 1, 256]
    - [112, 4817.31]
  - - [23552, 11265, 1, 256]
    - [112, 4775.79]
  - - [25088, 3072, 1, 256]
    - [112, 4800.44]
  - - [32000, 19457, 1, 256]
    - [112, 4794.68]
  - - [44800, 3072, 1, 256]
    - [112, 4829.58]
  - - [37120, 1792, 1, 256]
    - [105, 4817.17]
  - - [32512, 256, 1, 256]
    - [125, 4519.57]
  - - [30464, 18177, 1, 256]
    - [105, 4829.14]
  - - [4864, 2048, 1, 256]
    - [132, 4531.49]
  - - [44544, 4608, 1, 256]
    - [112, 4828.69]
  - - [29440, 1280, 1, 256]
    - [105, 4774.75]
  - - [7168, 768, 1, 256]
    - [132, 4410.64]
  - - [11008, 1024, 1, 256]
    - [112, 4572.9]
  - - [18944, 9216, 1, 256]
    - [112, 4824.77]
  - - [11776, 2048, 1, 256]
    - [112, 4701.36]
  - - [33280, 20737, 1, 256]
    - [105, 4819.91]
  - - [1536, 512, 1, 256]
    - [127, 3850.95]
  - - [25856, 3072, 1, 256]
    - [112, 4807.36]
  - - [9472, 1281, 1, 256]
    - [108, 4494.46]
  - - [8192, 1280, 1, 256]
    - [105, 4566.47]
  - - [24320, 768, 1, 256]
    - [105, 4700.29]
  - - [43008, 2048, 1, 256]
    - [112, 4816.67]
  - - [27648, 9216, 1, 256]
    - [112, 4845.69]
  - - [39168, 256, 1, 256]
    - [112, 4555.79]
  - - [42752, 9216, 1, 256]
    - [112, 4838.33]
  - - [5120, 2049, 1, 256]
    - [110, 4447.65]
  - - [28160, 9216, 1, 256]
    - [112, 4833.58]
  - - [37632, 25089, 1, 256]
    - [112, 4800.13]
  - - [28928, 768, 1, 256]
    - [105, 4725.39]
  - - [22016, 1792, 1, 256]
    - [105, 4788.49]
  - - [16384, 9216, 1, 256]
    - [112, 4826.53]
  - - [23040, 512, 1, 256]
    - [130, 4549.68]
  - - [21504, 9217, 1, 256]
    - [112, 4768.26]
  - - [20480, 7937, 1, 256]
    - [105, 4791.78]
  - - [33536, 21248, 1, 256]
    - [105, 4868.92]
  - - [41728, 1281, 1, 256]
    - [110, 4684.42]
  - - [12800, 768, 1, 256]
    - [105, 4508.71]
  - - [28672, 9216, 1, 256]
    - [112, 4836.98]
  - - [6144, 1280, 1, 256]
    - [105, 4537.25]
  - - [30976, 1280, 1, 256]
    - [105, 4780.53]
  - - [14592, 1024, 1, 256]
    - [112, 4635.04]
  - - [32000, 9216, 1, 256]
    - [112, 4838.76]
  - - [40448, 1280, 1, 256]
    - [105, 4805.24]
  - - [16384, 4096, 1, 256]
    - [112, 4800.08]
  - - [44544, 3072, 1, 256]
    - [112, 4822.47]
  - - [5376, 3072, 1, 256]
    - [110, 4626.28]
  - - [39680, 1024, 1, 256]
    - [112, 4764.07]
  - - [35584, 1792, 1, 256]
    - [105, 4817.97]
  - - [26368, 256, 1, 256]
    - [125, 4437.73]
  - - [35840, 23297, 1, 256]
    - [105, 4828.72]
  - - [23808, 11521, 1, 256]
    - [105, 4820.27]
  - - [13312, 1025, 1, 256]
    - [110, 4404.21]
  - - [18176, 9216, 1, 256]
    - [112, 4829.68]
  - - [17920, 5633, 1, 256]
    - [112, 4723.19]
  - - [23808, 1281, 1, 256]
    - [110, 4648.21]
  - - [33024, 1280, 1, 256]
    - [105, 4798.46]
  - - [27648, 3072, 1, 256]
    - [112, 4812.55]
  - - [27392, 1024, 1, 256]
    - [112, 4728.59]
  - - [1024, 3072, 1, 256]
    - [118, 4333.33]
  - - [22016, 9216, 1, 256]
    - [112, 4829.86]
  - - [20992, 1281, 1, 256]
    - [110, 4636.71]
  - - [3840, 1281, 1, 256]
    - [110, 4247.42]
  - - [21760, 9473, 1, 256]
    - [105, 4803.36]
  - - [10240, 256, 1, 256]
    - [129, 4141.5]
  - - [6144, 1536, 1, 256]
    - [112, 4509.34]
  - - [16896, 1536, 1, 256]
    - [112, 4702.56]
  - - [19968, 768, 1, 256]
    - [112, 4667.21]
  - - [23552, 11264, 1, 256]
    - [112, 4836.92]
  - - [27904, 3072, 1, 256]
    - [112, 4815.88]
  - - [19712, 7425, 1, 256]
    - [105, 4790.2]
  - - [26624, 14081, 1, 256]
    - [105, 4813.04]
  - - [31232, 1280, 1, 256]
    - [105, 4783.36]
  - - [3328, 257, 1, 256]
    - [98, 3323.57]
  - - [24320, 9216, 1, 256]
    - [112, 4835.7]
  - - [14080, 3072, 1, 256]
    - [112, 4766.91]
  - - [17408, 3072, 1, 256]
    - [112, 4781.17]
  - - [21504, 9216, 1, 256]
    - [112, 4830.07]
  - - [30976, 1024, 1, 256]
    - [112, 4738.66]
  - - [10752, 1281, 1, 256]
    - [110, 4531.16]
  - - [14848, 2560, 1, 256]
    - [112, 4735.08]
  - - [41728, 1024, 1, 256]
    - [112, 4762.69]
  - - [34304, 3072, 1, 256]
    - [112, 4820.66]
  - - [15104, 9216, 1, 256]
    - [112, 4819.55]
  - - [10496, 768, 1, 256]
    - [132, 4528.21]
  - - [17152, 4865, 1, 256]
    - [105, 4751.79]
  - - [41472, 2048, 1, 256]
    - [112, 4807.23]
  - - [38912, 26625, 1, 256]
    - [112, 4798.65]
  - - [25600, 2048, 1, 256]
    - [112, 4782.63]
  - - [44288, 1281, 1, 256]
    - [110, 4686.98]
  - - [41216, 1792, 1, 256]
    - [105, 4823.45]
  - - [39424, 3072, 1, 256]
    - [112, 4813.38]
  - - [30720, 18433, 1, 256]
    - [112, 4794.7]
  - - [14848, 1024, 1, 256]
    - [112, 4643.88]
  - - [39424, 2048, 1, 256]
    - [112, 4803.38]
  - - [21760, 2048, 1, 256]
    - [112, 4771.44]
  - - [18944, 6657, 1, 256]
    - [112, 4742.77]
  - - [5632, 1792, 1, 256]
    - [105, 4570.32]
  - - [24064, 1024, 1, 256]
    - [112, 4699.64]
  - - [2304, 1281, 1, 256]
    - [96, 4111.7]
  - - [18176, 1792, 1, 256]
    - [105, 4777.73]
  - - [31232, 9216, 1, 256]
    - [112, 4838.26]
  - - [31744, 1536, 1, 256]
    - [112, 4784.08]
  - - [42752, 2561, 1, 256]
    - [112, 4668.78]
  - - [18688, 9216, 1, 256]
    - [112, 4823.61]
  - - [13568, 256, 1, 256]
    - [112, 4329.92]
  - - [19968, 256, 1, 256]
    - [130, 4365.57]
  - - [12032, 2048, 1, 256]
    - [112, 4705.39]
  - - [10240, 1024, 1, 256]
    - [112, 4558.1]
  - - [18944, 2048, 1, 256]
    - [112, 4767.99]
  - - [43776, 1792, 1, 256]
    - [105, 4825.72]
  - - [25344, 1280, 1, 256]
    - [105, 4776.67]
  - - [10240, 1792, 1, 256]
    - [105, 4701.95]
  - - [33792, 21505, 1, 256]
    - [112, 4800.35]
  - - [35072, 1536, 1, 256]
    - [112, 4780.99]
  - - [43008, 512, 1, 256]
    - [112, 4688.24]
  - - [25856, 13313, 1, 256]
    - [112, 4786.85]
  - - [32000, 1280, 1, 256]
    - [105, 4779.55]
  - - [29952, 3072, 1, 256]
    - [112, 4822.38]
  - - [23296, 1536, 1, 256]
    - [112, 4759.52]
  - - [5888, 768, 1, 256]
    - [110, 4338.94]
  - - [20480, 9216, 1, 256]
    - [112, 4832.17]
  - - [21504, 1536, 1, 256]
    - [112, 4748.38]
  - - [7424, 1280, 1, 256]
    - [132, 4510.34]
  - - [33024, 2048, 1, 256]
    - [112, 4806.53]
  - - [19200, 1280, 1, 256]
    - [105, 4744.12]
  - - [11008, 7936, 1, 256]
    - [105, 4826.24]
  - - [17152, 1792, 1, 256]
    - [105, 4765.22]
  - - [38656, 1280, 1, 256]
    - [105, 4801.96]
  - - [22528, 768, 1, 256]
    - [105, 4679.64]
  - - [23040, 10753, 1, 256]
    - [112, 4786.57]
  - - [8960, 5889, 1, 256]
    - [110, 4739.3]
  - - [21504, 1280, 1, 256]
    - [112, 4758.53]
  - - [11008, 512, 1, 256]
    - [132, 4418.3]
  - - [16640, 4352, 1, 256]
    - [105, 4830.74]
  - - [30464, 3072, 1, 256]
    - [112, 4809.35]
  - - [7424, 512, 1, 256]
    - [132, 4275.39]
  - - [13312, 1281, 1, 256]
    - [108, 4571.38]
  - - [8960, 1281, 1, 256]
    - [110, 4500.81]
  - - [16128, 9216, 1, 256]
    - [112, 4827.99]
  - - [26880, 1281, 1, 256]
    - [110, 4661.51]
  - - [5632, 1280, 1, 256]
    - [130, 4447.4]
  - - [43008, 1280, 1, 256]
    - [105, 4815.18]
  - - [22528, 1280, 1, 256]
    - [105, 4750.67]
  - - [21504, 1792, 1, 256]
    - [105, 4801.52]
  - - [11776, 512, 1, 256]
    - [132, 4403.97]
  - - [6400, 768, 1, 256]
    - [132, 4420.64]
  - - [39680, 1536, 1, 256]
    - [112, 4793.79]
  - - [40704, 256, 1, 256]
    - [112, 4582.84]
  - - [25344, 13057, 1, 256]
    - [105, 4829.06]
  - - [16128, 256, 1, 256]
    - [132, 4311.33]
  - - [39424, 9216, 1, 256]
    - [112, 4835.89]
  - - [27648, 1792, 1, 256]
    - [105, 4810.94]
  - - [25600, 3072, 1, 256]
    - [112, 4801.63]
  - - [23808, 1024, 1, 256]
    - [112, 4716.69]
  - - [32000, 256, 1, 256]
    - [112, 4542.83]
  - - [28416, 3072, 1, 256]
    - [112, 4821.08]
  - - [24832, 1281, 1, 256]
    - [110, 4648.86]
  - - [12032, 8960, 1, 256]
    - [105, 4831.47]
  - - [25088, 1281, 1, 256]
    - [110, 4657.43]
  - - [12800, 257, 1, 256]
    - [128, 3633.04]
  - - [43264, 1792, 1, 256]
    - [105, 4828.92]
  - - [40192, 1280, 1, 256]
    - [105, 4805.49]
  - - [20736, 8193, 1, 256]
    - [112, 4761.56]
  - - [22272, 2048, 1, 256]
    - [112, 4786.89]
  - - [30976, 9216, 1, 256]
    - [112, 4834.66]
  - - [1280, 1281, 1, 256]
    - [118, 3804.92]
  - - [24320, 2048, 1, 256]
    - [112, 4785.79]
  - - [3840, 1024, 1, 256]
    - [130, 4355.46]
  - - [23552, 1536, 1, 256]
    - [112, 4759.4]
  - - [16384, 3072, 1, 256]
    - [112, 4779.55]
  - - [25856, 1280, 1, 256]
    - [105, 4769.58]
  - - [40192, 27648, 1, 256]
    - [112, 4849.22]
  - - [18688, 2048, 1, 256]
    - [112, 4751.28]
  - - [31232, 1792, 1, 256]
    - [105, 4808.55]
  - - [36352, 23809, 1, 256]
    - [105, 4817.56]
  - - [23552, 1281, 1, 256]
    - [110, 4641.11]
  - - [25344, 512, 1, 256]
    - [112, 4621.95]
  - - [15872, 3329, 1, 256]
    - [105, 4694.35]
  - - [1792, 1792, 1, 256]
    - [117, 4190.89]
  - - [31744, 1792, 1, 256]
    - [105, 4809.58]
  - - [14336, 1281, 1, 256]
    - [110, 4596.85]
  - - [9984, 3072, 1, 256]
    - [112, 4742.88]
  - - [11776, 1792, 1, 256]
    - [105, 4711.72]
  - - [7680, 1024, 1, 256]
    - [112, 4540.52]
  - - [37120, 1536, 1, 256]
    - [112, 4790.72]
  - - [14592, 2304, 1, 256]
    - [105, 4778.43]
  - - [16384, 1281, 1, 256]
    - [110, 4605.14]
  - - [7424, 768, 1, 256]
    - [132, 4466.94]
  - - [10240, 1536, 1, 256]
    - [112, 4625.43]
  - - [2816, 2561, 1, 256]
    - [108, 4356.75]
  - - [16896, 2048, 1, 256]
    - [112, 4751.84]
  - - [35072, 1280, 1, 256]
    - [112, 4788.82]
  - - [27392, 9216, 1, 256]
    - [112, 4846.42]
  - - [15104, 1280, 1, 256]
    - [105, 4695.53]
  - - [15104, 3072, 1, 256]
    - [112, 4772.92]
  - - [19200, 9216, 1, 256]
    - [112, 4849.38]
  - - [12544, 1024, 1, 256]
    - [112, 4591.36]
  - - [6656, 1280, 1, 256]
    - [105, 4530.62]
  - - [32256, 256, 1, 256]
    - [112, 4583.94]
  - - [36096, 23553, 1, 256]
    - [112, 4806.18]
  - - [14336, 256, 1, 256]
    - [130, 4315.29]
  - - [1024, 1025, 1, 256]
    - [97, 3814.56]
  - - [9216, 1280, 1, 256]
    - [112, 4591.75]
  - - [16128, 3841, 1, 256]
    - [105, 4722.75]
  - - [18432, 5889, 1, 256]
    - [105, 4767.36]
  - - [42496, 1280, 1, 256]
    - [105, 4808.39]
  - - [43776, 3841, 1, 256]
    - [105, 4758.56]
  - - [22528, 10241, 1, 256]
    - [112, 4767.75]
  - - [20224, 3072, 1, 256]
    - [112, 4793.32]
  - - [29184, 1024, 1, 256]
    - [112, 4725.63]
  - - [39680, 3072, 1, 256]
    - [112, 4819.07]
  - - [20736, 8449, 1, 256]
    - [105, 4798.62]
  - - [15104, 2816, 1, 256]
    - [105, 4789.82]
  - - [25088, 1536, 1, 256]
    - [112, 4750.1]
  - - [30720, 1792, 1, 256]
    - [105, 4815.24]
  - - [36864, 24321, 1, 256]
    - [105, 4826.54]
  - - [12288, 1281, 1, 256]
    - [110, 4561.97]
  - - [22784, 1536, 1, 256]
    - [112, 4750.38]
  - - [35584, 1281, 1, 256]
    - [110, 4680.97]
  - - [7424, 4097, 1, 256]
    - [110, 4620.54]
  - - [20224, 1281, 1, 256]
    - [108, 4629.99]
  - - [7680, 4609, 1, 256]
    - [112, 4654.26]
  - - [9216, 2048, 1, 256]
    - [112, 4677.48]
  - - [12032, 768, 1, 256]
    - [105, 4552.36]
  - - [1792, 3072, 1, 256]
    - [120, 4480.76]
  - - [6400, 3073, 1, 256]
    - [110, 4559.69]
  - - [29440, 17153, 1, 256]
    - [105, 4826.92]
  - - [8704, 1792, 1, 256]
    - [105, 4671.24]
  - - [20224, 2048, 1, 256]
    - [112, 4753.01]
  - - [30720, 3072, 1, 256]
    - [112, 4821.54]
  - - [37632, 256, 1, 256]
    - [105, 4565.44]
  - - [16384, 512, 1, 256]
    - [132, 4521.4]
  - - [38912, 256, 1, 256]
    - [125, 4540.52]
  - - [5120, 512, 1, 256]
    - [130, 4269.02]
  - - [17920, 2048, 1, 256]
    - [112, 4758.63]
  - - [30464, 256, 1, 256]
    - [105, 4545.33]
  - - [8704, 256, 1, 256]
    - [105, 4128.73]
  - - [16384, 3841, 1, 256]
    - [105, 4711.23]
  - - [40192, 9216, 1, 256]
    - [112, 4832.45]
  - - [15616, 1792, 1, 256]
    - [105, 4738.14]
  - - [32512, 1024, 1, 256]
    - [112, 4751.37]
  - - [23040, 1792, 1, 256]
    - [105, 4800.63]
  - - [42240, 1281, 1, 256]
    - [103, 4690.19]
  - - [6912, 1536, 1, 256]
    - [112, 4573.14]
  - - [37888, 25601, 1, 256]
    - [112, 4790.28]
  - - [26368, 14080, 1, 256]
    - [105, 4857.23]
  - - [37632, 1280, 1, 256]
    - [105, 4802.71]
  - - [30208, 3072, 1, 256]
    - [112, 4811.28]
  - - [36608, 1281, 1, 256]
    - [104, 4682.02]
  - - [30464, 512, 1, 256]
    - [112, 4650.35]
  - - [26880, 768, 1, 256]
    - [105, 4722.64]
  - - [33024, 20736, 1, 256]
    - [105, 4866.97]
  - - [35072, 22784, 1, 256]
    - [105, 4871.82]
  - - [9472, 6145, 1, 256]
    - [112, 4705.49]
  - - [22784, 1792, 1, 256]
    - [105, 4794.68]
  - - [22272, 1280, 1, 256]
    - [105, 4761.78]
  - - [13568, 1281, 1, 256]
    - [110, 4582.51]
  - - [5120, 1536, 1, 256]
    - [132, 4498.32]
  - - [25088, 2048, 1, 256]
    - [112, 4779.56]
  - - [6656, 3072, 1, 256]
    - [112, 4667.99]
  - - [32768, 1280, 1, 256]
    - [105, 4791.44]
  - - [768, 2048, 1, 256]
    - [120, 4134.03]
  - - [4352, 1281, 1, 256]
    - [105, 4253.13]
  - - [27904, 1281, 1, 256]
    - [110, 4670.36]
  - - [15104, 2048, 1, 256]
    - [112, 4734.57]
  - - [9728, 1281, 1, 256]
    - [108, 4499.02]
  - - [30720, 2048, 1, 256]
    - [112, 4798.86]
  - - [1024, 1280, 1, 256]
    - [119, 4056.39]
  - - [10496, 1280, 1, 256]
    - [112, 4609.87]
  - - [6400, 3328, 1, 256]
    - [105, 4702.95]
  - - [36352, 1024, 1, 256]
    - [112, 4739.61]
  - - [12544, 1280, 1, 256]
    - [105, 4649.79]
  - - [40704, 512, 1, 256]
    - [112, 4686.7]
  - - [10240, 1281, 1, 256]
    - [108, 4527.65]
  - - [8704, 1281, 1, 256]
    - [110, 4492.22]
  - - [40192, 1024, 1, 256]
    - [112, 4770.48]
  - - [13312, 1792, 1, 256]
    - [112, 4730.81]
  - - [41984, 27648, 1, 256]
    - [112, 4850.9]
  - - [33024, 20481, 1, 256]
    - [112, 4799.31]
  - - [33280, 1536, 1, 256]
    - [112, 4781.02]
  - - [9216, 3072, 1, 256]
    - [112, 4724.13]
  - - [2816, 1536, 1, 256]
    - [130, 4328.77]
  - - [22528, 1792, 1, 256]
    - [105, 4788.16]
  - - [25088, 768, 1, 256]
    - [105, 4695.12]
- null
