library/src/blas3/Tensile/Logic/asm_full/vega10_Cijk_Ailk_Bljk_SB.yaml
- {MinimumRequiredVersion: 3.6.0}
- vega10
- gfx900
- [Device 6863, Device 6862, Device 687f]
- - - [4096, 7000, 1, 4096]
    - [65, 11493.7]
  - - [5124, 9124, 1, 1760]
    - [67, 11449.9]
  - - [5124, 9124, 1, 2560]
    - [63, 10899.7]
  - - [1760, 32, 1, 1760]
    - [41, 2947.42]
  - - [1024, 1500, 1, 1536]
    - [70, 9076.52]
  - - [512, 24000, 1, 1536]
    - [65, 10956.1]
  - - [3072, 24000, 1, 1024]
    - [65, 11117.8]
  - - [1024, 3000, 1, 2560]
    - [68, 10566.8]
  - - [7680, 4, 1, 2560]
    - [33, 546.397]
  - - [35, 1500, 1, 2048]
    - [13, 2010.34]
  - - [8448, 1500, 1, 2816]
    - [67, 11382.3]
  - - [2560, 7000, 1, 2560]
    - [68, 11073.5]
  - - [3072, 16, 1, 1024]
    - [36, 1625.52]
  - - [512, 48000, 1, 2048]
    - [66, 9895.08]
  - - [1760, 64, 1, 1760]
    - [42, 4787.52]
  - - [1024, 16, 1, 512]
    - [39, 666.133]
  - - [512, 48000, 1, 1536]
    - [65, 11198.1]
  - - [2560, 32, 1, 2560]
    - [32, 3583.62]
  - - [4608, 1500, 1, 1536]
    - [65, 10288.8]
  - - [2048, 128, 1, 2048]
    - [23, 6080.15]
  - - [1024, 24000, 1, 2560]
    - [64, 11365.5]
  - - [4608, 3000, 1, 1536]
    - [67, 10708.1]
  - - [5124, 9124, 1, 2048]
    - [65, 10189.6]
  - - [1024, 700, 1, 512]
    - [60, 5774.32]
  - - [3072, 1, 1, 128]
    - [44, 34.695]
  - - [5124, 700, 1, 2560]
    - [60, 9844.8]
  - - [8448, 16, 1, 2816]
    - [34, 2076.95]
  - - [6144, 6000, 1, 2560]
    - [65, 11547.0]
  - - [4608, 32, 1, 1536]
    - [20, 3221.87]
  - - [35, 8457, 1, 2560]
    - [16, 3548.13]
  - - [3072, 64, 1, 1024]
    - [23, 3552.71]
  - - [512, 16, 1, 512]
    - [29, 380.005]
  - - [7680, 2, 1, 2560]
    - [26, 275.753]
  - - [4224, 1, 1, 128]
    - [35, 42.9343]
  - - [7680, 1, 1, 2560]
    - [26, 137.877]
  - - [128, 1500, 1, 1280]
    - [28, 4836.27]
  - - [35, 8457, 1, 4096]
    - [15, 3389.98]
  - - [1024, 1500, 1, 2816]
    - [67, 10086.5]
  - - [6144, 2, 1, 2560]
    - [31, 264.751]
  - - [8448, 48000, 1, 2816]
    - [72, 11957.6]
  - - [512, 6000, 1, 1536]
    - [63, 9688.06]
  - - [4224, 1500, 1, 176]
    - [61, 6539.49]
  - - [1024, 6000, 1, 2816]
    - [68, 11064.1]
  - - [512, 6000, 1, 2560]
    - [68, 10353.5]
  - - [512, 32, 1, 512]
    - [26, 712.197]
  - - [2560, 128, 1, 2560]
    - [19, 6434.24]
  - - [4608, 24000, 1, 1536]
    - [65, 11585.9]
  - - [512, 2, 1, 500000]
    - [7, 299.328]
  - - [7680, 48000, 1, 2560]
    - [65, 11950.8]
  - - [3072, 48000, 1, 1024]
    - [65, 11264.4]
  - - [1760, 16, 1, 1760]
    - [26, 1652.0]
  - - [512, 3000, 1, 2816]
    - [67, 10165.5]
  - - [1760, 7000, 1, 1760]
    - [67, 11019.2]
  - - [64, 193600, 1, 256]
    - [76, 303695.0]
  - - [1024, 3000, 1, 2048]
    - [66, 8764.01]
  - - [6144, 4, 1, 2560]
    - [54, 527.201]
  - - [1024, 6000, 1, 2048]
    - [66, 10057.7]
  - - [512, 24000, 1, 2816]
    - [65, 11434.0]
  - - [6144, 48000, 1, 2560]
    - [65, 11917.6]
  - - [8448, 3000, 1, 2816]
    - [67, 11497.5]
  - - [35, 1500, 1, 2560]
    - [12, 2577.21]
  - - [3072, 4, 1, 1024]
    - [25, 418.384]
  - - [4608, 48000, 1, 1536]
    - [67, 11474.8]
  - - [2048, 32, 1, 2048]
    - [43, 3040.07]
  - - [7680, 1500, 1, 2560]
    - [67, 11103.9]
  - - [4096, 128, 1, 4096]
    - [66, 7767.99]
  - - [4608, 16, 1, 1536]
    - [55, 1896.75]
  - - [1024, 1500, 1, 2048]
    - [66, 8542.74]
  - - [3072, 3000, 1, 1024]
    - [65, 9576.63]
  - - [3072, 2, 1, 1024]
    - [44, 209.192]
  - - [8448, 1, 1, 2816]
    - [56, 137.479]
  - - [1024, 48000, 1, 2560]
    - [65, 11670.0]
  - - [1024, 3000, 1, 2816]
    - [68, 10734.6]
  - - [128, 1, 1, 1408]
    - [45, 16.2196]
  - - [35, 8457, 1, 1760]
    - [18, 3920.08]
  - - [1024, 2, 1, 512]
    - [38, 85.2743]
  - - [1024, 4, 1, 500000]
    - [3, 597.492]
  - - [6144, 1, 1, 2560]
    - [38, 132.623]
  - - [1024, 48000, 1, 2816]
    - [65, 11843.4]
  - - [512, 48000, 1, 2816]
    - [67, 11744.1]
  - - [2048, 16, 1, 2048]
    - [39, 1759.13]
  - - [1024, 24000, 1, 1536]
    - [65, 10860.2]
  - - [64, 193600, 1, 64]
    - [73, 84961.2]
  - - [7680, 6000, 1, 2560]
    - [65, 11630.7]
  - - [1760, 128, 1, 1760]
    - [24, 5682.04]
  - - [35, 8457, 1, 2048]
    - [11, 3064.95]
  - - [512, 1500, 1, 2816]
    - [60, 9206.98]
  - - [512, 1, 1, 512]
    - [30, 24.921]
  - - [512, 16, 1, 500000]
    - [2, 2317.45]
  - - [512, 8, 1, 500000]
    - [10, 1197.78]
  - - [512, 24000, 1, 2560]
    - [64, 11271.1]
  - - [6144, 3000, 1, 2560]
    - [65, 11231.6]
  - - [1024, 24000, 1, 2816]
    - [64, 11544.7]
  - - [2048, 7000, 1, 2048]
    - [65, 10993.5]
  - - [7680, 3000, 1, 2560]
    - [67, 11474.6]
  - - [1024, 4, 1, 512]
    - [30, 171.581]
  - - [5124, 700, 1, 2048]
    - [63, 8570.84]
  - - [5124, 9124, 1, 4096]
    - [71, 9647.7]
  - - [4096, 64, 1, 4096]
    - [23, 6502.93]
  - - [512, 6000, 1, 2048]
    - [66, 7573.07]
  - - [7680, 32, 1, 2560]
    - [37, 3972.51]
  - - [2560, 64, 1, 2560]
    - [21, 4607.1]
  - - [3072, 128, 1, 1024]
    - [60, 5191.64]
  - - [8448, 6000, 1, 2816]
    - [65, 11747.8]
  - - [7680, 64, 1, 2560]
    - [49, 6588.98]
  - - [5124, 1500, 1, 2560]
    - [65, 10407.9]
  - - [1024, 1500, 1, 2560]
    - [63, 9683.06]
  - - [512, 4, 1, 512]
    - [46, 98.9876]
  - - [1024, 6000, 1, 2560]
    - [65, 10911.1]
  - - [3072, 32, 1, 1024]
    - [50, 2685.61]
  - - [35, 700, 1, 2560]
    - [17, 1937.51]
  - - [4608, 1, 1, 1536]
    - [1, 125.722]
  - - [4096, 32, 1, 4096]
    - [48, 3853.01]
  - - [7680, 24000, 1, 2560]
    - [65, 11935.0]
  - - [8448, 4, 1, 2816]
    - [56, 546.637]
  - - [64, 1, 1, 1216]
    - [45, 7.29577]
  - - [512, 1, 1, 500000]
    - [10, 154.446]
  - - [176, 1500, 1, 1408]
    - [20, 5141.35]
  - - [512, 3000, 1, 1536]
    - [63, 9048.15]
  - - [8448, 24000, 1, 2816]
    - [68, 11888.5]
  - - [4608, 2, 1, 1536]
    - [9, 250.126]
  - - [1024, 48000, 1, 1536]
    - [65, 11240.3]
  - - [7680, 128, 1, 2560]
    - [63, 8909.72]
  - - [3072, 6000, 1, 1024]
    - [65, 10254.6]
  - - [3072, 1500, 1, 128]
    - [58, 5014.08]
  - - [1024, 3000, 1, 1536]
    - [68, 9970.1]
  - - [512, 4, 1, 500000]
    - [10, 618.56]
  - - [35, 700, 1, 2048]
    - [14, 1438.12]
  - - [1024, 16, 1, 500000]
    - [8, 2301.24]
  - - [512, 24000, 1, 2048]
    - [66, 9776.62]
  - - [128, 50176, 1, 512]
    - [75, 386000.0]
  - - [1024, 32, 1, 512]
    - [25, 1185.79]
  - - [256, 193600, 1, 64]
    - [74, 146642.0]
  - - [512, 48000, 1, 2560]
    - [68, 11357.9]
  - - [2560, 16, 1, 2560]
    - [52, 1872.39]
  - - [2048, 64, 1, 2048]
    - [22, 4524.07]
  - - [512, 2, 1, 512]
    - [30, 49.842]
  - - [1024, 1, 1, 512]
    - [47, 42.6372]
  - - [512, 1500, 1, 2560]
    - [62, 8719.2]
  - - [6144, 32, 1, 2560]
    - [20, 3727.12]
  - - [1024, 1, 1, 500000]
    - [0, 149.564]
  - - [6144, 16, 1, 2560]
    - [53, 2079.12]
  - - [1024, 24000, 1, 2048]
    - [65, 9854.75]
  - - [4096, 16, 1, 4096]
    - [40, 2046.17]
  - - [5124, 1500, 1, 2048]
    - [65, 9842.32]
  - - [3072, 1500, 1, 1024]
    - [69, 8896.51]
  - - [1024, 2, 1, 500000]
    - [6, 298.475]
  - - [1024, 8, 1, 500000]
    - [5, 1175.8]
  - - [7680, 16, 1, 2560]
    - [41, 2116.95]
  - - [6144, 1500, 1, 2560]
    - [68, 11108.2]
  - - [3072, 1, 1, 1024]
    - [4, 106.431]
  - - [512, 6000, 1, 2816]
    - [65, 10716.8]
  - - [8448, 2, 1, 2816]
    - [57, 276.614]
  - - [4608, 4, 1, 1536]
    - [9, 495.07]
  - - [1024, 6000, 1, 1536]
    - [65, 10317.3]
  - - [8448, 32, 1, 2816]
    - [27, 3880.96]
  - - [512, 3000, 1, 2048]
    - [68, 7058.84]
  - - [6144, 24000, 1, 2560]
    - [65, 11808.2]
  - - [512, 3000, 1, 2560]
    - [63, 9741.69]
  - - [4608, 6000, 1, 1536]
    - [68, 11130.6]
  - - [256, 12544, 1, 1024]
    - [74, 431003.0]
  - - [512, 1500, 1, 2048]
    - [63, 6753.5]
  - - [512, 1500, 1, 1536]
    - [62, 7836.99]
  - - [128, 1, 1, 1024]
    - [51, 12.5494]
  - - [1024, 48000, 1, 2048]
    - [65, 10161.8]
- - - -1
    - - - -1
        - - - 4
            - - [1024, 47]
              - [1408, 38]
              - [3584, 36]
              - [4288, 47]
              - [5888, 38]
              - [-1, 47]
          - - 64
            - - [4, 47]
              - [128, 51]
              - [704, 27]
              - [1408, 20]
              - [1856, 42]
              - [2368, 20]
              - [3584, 28]
              - [4288, 20]
              - [5056, 19]
              - [5888, 28]
              - [-1, 60]
          - - 128
            - - [4, 47]
              - [64, 51]
              - [256, 27]
              - [704, 20]
              - [1408, 28]
              - [1856, 49]
              - [2944, 28]
              - [3584, 62]
              - [5056, 28]
              - [5888, 62]
              - [-1, 66]
          - - 256
            - - [4, 47]
              - [64, 39]
              - [128, 27]
              - [256, 20]
              - [448, 42]
              - [2944, 62]
              - [3584, 66]
              - [4288, 62]
              - [5056, 60]
              - [5888, 59]
              - [-1, 62]
          - - 448
            - - [4, 47]
              - [64, 27]
              - [128, 21]
              - [256, 42]
              - [448, 24]
              - [1024, 62]
              - [1408, 60]
              - [1856, 66]
              - [2368, 62]
              - [2944, 64]
              - [3584, 62]
              - [4288, 59]
              - [5888, 62]
              - [-1, 61]
          - - 704
            - - [4, 47]
              - [64, 27]
              - [128, 21]
              - [256, 60]
              - [1024, 62]
              - [1408, 61]
              - [1856, 62]
              - [2368, 60]
              - [2944, 61]
              - [5888, 59]
              - [-1, 64]
          - - 1024
            - - [4, 47]
              - [64, 50]
              - [128, 19]
              - [256, 60]
              - [448, 62]
              - [704, 60]
              - [1024, 63]
              - [1408, 67]
              - [1856, 68]
              - [2368, 64]
              - [2944, 68]
              - [4288, 67]
              - [5888, 65]
              - [-1, 68]
          - - 1408
            - - [4, 38]
              - [64, 21]
              - [128, 19]
              - [256, 60]
              - [448, 62]
              - [704, 66]
              - [1408, 59]
              - [1856, 67]
              - [2368, 59]
              - [2944, 61]
              - [4288, 59]
              - [5888, 61]
              - [-1, 59]
          - - 1856
            - - [4, 47]
              - [64, 42]
              - [128, 49]
              - [256, 62]
              - [448, 66]
              - [704, 62]
              - [1024, 67]
              - [1408, 61]
              - [2944, 64]
              - [3584, 61]
              - [4288, 64]
              - [5056, 67]
              - [5888, 59]
              - [-1, 67]
          - - 2368
            - - [4, 47]
              - [64, 21]
              - [128, 19]
              - [448, 62]
              - [704, 60]
              - [1856, 67]
              - [2368, 64]
              - [5056, 67]
              - [-1, 59]
          - - 2944
            - - [4, 47]
              - [64, 21]
              - [128, 19]
              - [256, 60]
              - [448, 61]
              - [704, 64]
              - [1024, 59]
              - [1856, 61]
              - [-1, 59]
          - - 3584
            - - [4, 47]
              - [128, 60]
              - [256, 66]
              - [448, 60]
              - [1024, 67]
              - [1408, 61]
              - [-1, 67]
          - - 4288
            - - [4, 54]
              - [64, 21]
              - [128, 19]
              - [256, 60]
              - [5888, 67]
              - [-1, 61]
          - - 5056
            - - [4, 47]
              - [64, 19]
              - [448, 60]
              - [5056, 67]
              - [-1, 61]
          - - 5888
            - - [4, 38]
              - [64, 19]
              - [128, 60]
              - [256, 59]
              - [448, 60]
              - [704, 67]
              - [1408, 68]
              - [2944, 67]
              - [3584, 59]
              - [5888, 67]
              - [-1, 61]
          - - -1
            - - [4, 38]
              - [64, 60]
              - [128, 66]
              - [256, 60]
              - [448, 67]
              - [704, 61]
              - [1024, 68]
              - [1856, 61]
              - [2368, 67]
              - [3584, 61]
              - [5056, 67]
              - [5888, 61]
              - [-1, 72]
