library/src/blas3/Tensile/Logic/asm_full/vega20_Cijk_Ailk_Bljk_HBH.yaml
- {MinimumRequiredVersion: 4.6.0}
- vega20
- gfx906
- [Device 66a0, Device 66a1, Device 66a7, Device 66af, Vega 20]
    SolutionIndex: 0
    SolutionNameMin: Cijk_Ailk_Bljk_HBH_MT032x032x16_PGR1_PLR1_TT04_04
    SolutionIndex: 1
    SolutionNameMin: Cijk_Ailk_Bljk_HBH_MT064x016x16_PGR1_PLR1_TT04_04
    SolutionIndex: 2
    SolutionNameMin: Cijk_Ailk_Bljk_HBH_MT032x016x16_PGR1_PLR1_TT02_02
    SolutionIndex: 3
    SolutionNameMin: Cijk_Ailk_Bljk_HBH_MT064x016x16_PGR1_PLR1_TT04_02
    SolutionIndex: 4
    SolutionNameMin: Cijk_Ailk_Bljk_HBH_MT064x008x16_PGR1_PLR1_TT02_02
    SolutionIndex: 5
    SolutionNameMin: Cijk_Ailk_Bljk_HBH_MT064x016x16_PGR1_PLR1_TT02_02
    SolutionIndex: 6
    SolutionNameMin: Cijk_Ailk_Bljk_HBH_MT128x016x16_PGR1_PLR1_TT04_02
    SolutionIndex: 7
    SolutionNameMin: Cijk_Ailk_Bljk_HBH_MT016x016x32_PGR1_PLR1_TT02_02
    SolutionIndex: 8
    SolutionNameMin: Cijk_Ailk_Bljk_HBH_MT032x008x32_PGR1_PLR1_TT02_02
    SolutionIndex: 9
    SolutionNameMin: Cijk_Ailk_Bljk_HBH_MT032x016x32_PGR1_PLR1_TT02_02
    SolutionIndex: 10
    SolutionNameMin: Cijk_Ailk_Bljk_HBH_MT064x016x32_PGR1_PLR1_TT04_02
    SolutionIndex: 11
    SolutionNameMin: Cijk_Ailk_Bljk_HBH_MT064x008x32_PGR1_PLR1_TT02_02
    SolutionIndex: 12
    SolutionNameMin: Cijk_Ailk_Bljk_HBH_MT064x016x32_PGR1_PLR1_TT02_02
    SolutionIndex: 13
    SolutionNameMin: Cijk_Ailk_Bljk_HBH_MT128x016x32_PGR1_PLR1_TT04_02
    SolutionIndex: 14
    SolutionNameMin: Cijk_Ailk_Bljk_HBH_MT032x008x64_PGR1_PLR1_TT02_02
    SolutionIndex: 15
    SolutionNameMin: Cijk_Ailk_Bljk_HBH_MT064x008x64_PGR1_PLR1_TT02_02
    SolutionIndex: 16
    SolutionNameMin: Cijk_Ailk_Bljk_HBH_MT032x032x08_PGR1_PLR1_TT04_04
    SolutionIndex: 17
    SolutionNameMin: Cijk_Ailk_Bljk_HBH_MT064x032x08_PGR1_PLR1_TT08_04
    SolutionIndex: 18
    SolutionNameMin: Cijk_Ailk_Bljk_HBH_MT032x016x16_PGR1_PLR1_TT04_02
    SolutionIndex: 19
    SolutionNameMin: Cijk_Ailk_Bljk_HBH_MT032x032x16_PGR1_PLR1_TT04_04
    SolutionIndex: 20
    SolutionNameMin: Cijk_Ailk_Bljk_HBH_MT064x064x16_PGR1_PLR1_TT08_08
    SolutionIndex: 21
    SolutionNameMin: Cijk_Ailk_Bljk_HBH_MT064x016x16_PGR1_PLR1_TT04_02
    SolutionIndex: 22
    SolutionNameMin: Cijk_Ailk_Bljk_HBH_MT064x016x16_PGR1_PLR1_TT02_02
    SolutionIndex: 23
    SolutionNameMin: Cijk_Ailk_Bljk_HBH_MT128x016x16_PGR1_PLR1_TT04_02
    SolutionIndex: 24
    SolutionNameMin: Cijk_Ailk_Bljk_HBH_MT064x016x16_PGR1_PLR1_TT04_04
    SolutionIndex: 25
    SolutionNameMin: Cijk_Ailk_Bljk_HBH_MT064x008x16_PGR1_PLR1_TT02_02
    SolutionIndex: 26
    SolutionNameMin: Cijk_Ailk_Bljk_HBH_MT016x016x24_PGR1_PLR1_TT02_02
    SolutionIndex: 27
    SolutionNameMin: Cijk_Ailk_Bljk_HBH_MT032x016x24_PGR1_PLR1_TT04_02
    SolutionIndex: 28
    SolutionNameMin: Cijk_Ailk_Bljk_HBH_MT032x032x24_PGR1_PLR1_TT04_04
    SolutionIndex: 29
    SolutionNameMin: Cijk_Ailk_Bljk_HBH_MT032x032x32_PGR1_PLR1_TT04_04
    SolutionIndex: 30
    SolutionNameMin: Cijk_Ailk_Bljk_HBH_MT064x016x32_PGR1_PLR1_TT02_02
    SolutionIndex: 31
    SolutionNameMin: Cijk_Ailk_Bljk_HBH_MT128x016x32_PGR1_PLR1_TT04_02
    SolutionIndex: 32
    SolutionNameMin: Cijk_Ailk_Bljk_HBH_MT032x008x32_PGR1_PLR1_TT02_02
    SolutionIndex: 33
    SolutionNameMin: Cijk_Ailk_Bljk_HBH_MT064x008x32_PGR1_PLR1_TT02_02
    SolutionIndex: 34
    SolutionNameMin: Cijk_Ailk_Bljk_HBH_MT032x008x64_PGR1_PLR1_TT02_02
    SolutionIndex: 35
    SolutionNameMin: Cijk_Ailk_Bljk_HBH_MT064x008x64_PGR1_PLR1_TT02_02
    SolutionIndex: 36
    SolutionNameMin: Cijk_Ailk_Bljk_HBH_MT064x064x08_PGR1_PLR1_TT04_04
    SolutionIndex: 37
    SolutionNameMin: Cijk_Ailk_Bljk_HBH_MT064x128x08_PGR1_PLR1_TT04_08
    SolutionIndex: 38
    SolutionNameMin: Cijk_Ailk_Bljk_HBH_MT128x064x08_PGR1_PLR1_TT08_04
    SolutionIndex: 39
    SolutionNameMin: Cijk_Ailk_Bljk_HBH_MT064x064x16_PGR1_PLR1_TT04_04
    SolutionIndex: 40
    SolutionNameMin: Cijk_Ailk_Bljk_HBH_MT064x128x16_PGR1_PLR1_TT04_08
    SolutionIndex: 41
    SolutionNameMin: Cijk_Ailk_Bljk_HBH_MT128x064x16_PGR1_PLR1_TT08_04
    SolutionIndex: 42
    SolutionNameMin: Cijk_Ailk_Bljk_HBH_MT128x128x16_PGR1_PLR1_TT08_08
    SolutionIndex: 43
    SolutionNameMin: Cijk_Ailk_Bljk_HBH_MT032x128x16_PGR0_PLR0_TT04_04
    SolutionIndex: 44
    SolutionNameMin: Cijk_Ailk_Bljk_HBH_MT064x064x04_PGR1_PLR1_TT04_04
    SolutionIndex: 45
    SolutionNameMin: Cijk_Ailk_Bljk_HBH_MT064x064x08_PGR1_PLR1_TT04_04
    SolutionIndex: 46
    SolutionNameMin: Cijk_Ailk_Bljk_HBH_MT064x064x16_PGR1_PLR1_TT04_04
    SolutionIndex: 47
    SolutionNameMin: Cijk_Ailk_Bljk_HBH_MT032x032x16_PGR1_PLR1_TT04_04
    SolutionIndex: 48
    SolutionNameMin: Cijk_Ailk_Bljk_HBH_MT064x016x16_PGR1_PLR1_TT04_04
    SolutionIndex: 49
    SolutionNameMin: Cijk_Ailk_Bljk_HBH_MT064x032x16_PGR1_PLR1_TT04_04
    SolutionIndex: 50
    SolutionNameMin: Cijk_Ailk_Bljk_HBH_MT032x032x32_PGR1_PLR1_TT04_04
    SolutionIndex: 51
    SolutionNameMin: Cijk_Ailk_Bljk_HBH_MT064x016x32_PGR1_PLR1_TT04_04
    SolutionIndex: 52
    SolutionNameMin: Cijk_Ailk_Bljk_HBH_MT064x032x32_PGR1_PLR1_TT04_04
    SolutionIndex: 53
    SolutionNameMin: Cijk_Ailk_Bljk_HBH_MT128x016x32_PGR1_PLR1_TT04_04
    SolutionIndex: 54
    SolutionNameMin: Cijk_Ailk_Bljk_HBH_MT128x032x32_PGR1_PLR1_TT04_04
    SolutionIndex: 55
    SolutionNameMin: Cijk_Ailk_Bljk_HBH_MT064x064x16_PGR1_PLR1_TT08_08
    SolutionIndex: 56
    SolutionNameMin: Cijk_Ailk_Bljk_HBH_MT128x128x16_PGR1_PLR1_TT08_08
    SolutionIndex: 57
    SolutionNameMin: Cijk_Ailk_Bljk_HBH_MT064x032x08_PGR1_PLR1_TT08_04
    SolutionIndex: 58
    SolutionNameMin: Cijk_Ailk_Bljk_HBH_MT064x064x08_PGR1_PLR1_TT08_08
    SolutionIndex: 59
    SolutionNameMin: Cijk_Ailk_Bljk_HBH_MT032x032x16_PGR1_PLR1_TT04_04
    SolutionIndex: 60
    SolutionNameMin: Cijk_Ailk_Bljk_HBH_MT064x032x16_PGR1_PLR1_TT08_04
    SolutionIndex: 61
    SolutionNameMin: Cijk_Ailk_Bljk_HBH_MT064x064x16_PGR1_PLR1_TT04_04
    SolutionIndex: 62
    SolutionNameMin: Cijk_Ailk_Bljk_HBH_MT128x064x16_PGR1_PLR1_TT08_04
    SolutionIndex: 63
    SolutionNameMin: Cijk_Ailk_Bljk_HBH_MT128x128x16_PGR1_PLR1_TT08_08
    SolutionIndex: 64
    SolutionNameMin: Cijk_Ailk_Bljk_HBH_MT064x032x16_PGR1_PLR1_TT04_04
    SolutionIndex: 65
    SolutionNameMin: Cijk_Ailk_Bljk_HBH_MT128x064x32_PGR1_PLR1_TT08_04
    SolutionIndex: 66
    SolutionNameMin: Cijk_Ailk_Bljk_HBH_MT128x032x32_PGR1_PLR1_TT04_04
    SolutionIndex: 67
    SolutionNameMin: Cijk_Ailk_Bljk_HBH_MT064x016x32_PGR1_PLR1_TT04_04
    SolutionIndex: 68
    SolutionNameMin: Cijk_Ailk_Bljk_HBH_MT064x064x16_PGR1_PLR1_TT08_08
    SolutionIndex: 69
    SolutionNameMin: Cijk_Ailk_Bljk_HBH_MT128x128x16_PGR1_PLR1_TT08_08
    SolutionIndex: 70
    SolutionNameMin: Cijk_Ailk_Bljk_HBH_MT064x064x32_PGR1_PLR1_TT08_08
    SolutionIndex: 71
    SolutionNameMin: Cijk_Ailk_Bljk_HBH_MT128x128x32_PGR1_PLR1_TT08_08
    SolutionIndex: 72
    SolutionNameMin: Cijk_Ailk_Bljk_HBH_MT128x128x32_PGR0_PLR1_TT08_08
    SolutionIndex: 73
    SolutionNameMin: Cijk_Ailk_Bljk_HBH_MT064x128x16_PGR1_PLR1_TT04_08
    SolutionIndex: 74
    SolutionNameMin: Cijk_Ailk_Bljk_HBH_MT128x064x16_PGR1_PLR1_TT08_04
    SolutionIndex: 75
    SolutionNameMin: Cijk_Ailk_Bljk_HBH_MT128x128x16_PGR1_PLR1_TT08_08
    SolutionIndex: 76
    SolutionNameMin: Cijk_Ailk_Bljk_HBH_MT128x064x16_PGR1_PLR1_TT04_08
    SolutionIndex: 77
    SolutionNameMin: Cijk_Ailk_Bljk_HBH_MT128x064x16_PGR1_PLR1_TT04_08
    SolutionIndex: 78
    SolutionNameMin: Cijk_Ailk_Bljk_HBH_MT128x064x32_PGR1_PLR1_TT04_04
    SolutionIndex: 79
    SolutionNameMin: Cijk_Ailk_Bljk_HBH_MT256x128x32_PGR1_PLR1_TT08_08
    SolutionIndex: 80
    SolutionNameMin: Cijk_Ailk_Bljk_HBH_MT128x032x16_PGR0_PLR0_TT08_04
    SolutionIndex: 81
    SolutionNameMin: Cijk_Ailk_Bljk_HBH_MT128x064x16_PGR1_PLR0_TT04_08
    SolutionIndex: 82
    SolutionNameMin: Cijk_Ailk_Bljk_HBH_MT064x064x04_PGR0_PLR1_TT04_04
    SolutionIndex: 83
    SolutionNameMin: Cijk_Ailk_Bljk_HBH_MT064x128x08_PGR1_PLR0_TT04_08
    SolutionIndex: 84
    SolutionNameMin: Cijk_Ailk_Bljk_HBH_MT064x064x08_PGR1_PLR1_TT04_04
    SolutionIndex: 85
    SolutionNameMin: Cijk_Ailk_Bljk_HBH_MT064x064x16_PGR0_PLR1_TT04_04
    SolutionIndex: 86
    SolutionNameMin: Cijk_Ailk_Bljk_HBH_MT064x064x04_PGR0_PLR0_TT04_04
    SolutionIndex: 87
    SolutionNameMin: Cijk_Ailk_Bljk_HBH_MT064x064x04_PGR0_PLR1_TT04_04
    SolutionIndex: 88
    SolutionNameMin: Cijk_Ailk_Bljk_HBH_MT064x128x08_PGR1_PLR0_TT04_08
    SolutionIndex: 89
    SolutionNameMin: Cijk_Ailk_Bljk_HBH_MT064x064x08_PGR1_PLR1_TT04_04
    SolutionIndex: 90
    SolutionNameMin: Cijk_Ailk_Bljk_HBH_MT064x064x16_PGR1_PLR1_TT04_04
    SolutionIndex: 91
    SolutionNameMin: Cijk_Ailk_Bljk_HBH_MT128x064x16_EPS1_GRVW08_LPB00_PGR1_PLR1_SNLL1_TT08_08_VW08_WG16_08_01_WGM01
    SolutionIndex: 92
    SolutionNameMin: Cijk_Ailk_Bljk_HBH_MT064x128x16_EPS1_GRVW04_LPB04_PGR1_PLR1_SNLL1_TT08_04_VW04_WG08_32_01_WGM01
    SolutionIndex: 93
    SolutionNameMin: Cijk_Ailk_Bljk_HBH_MT128x064x16_EPS1_GRVW04_LPB04_PGR1_PLR1_SNLL1_TT08_04_VW04_WG16_16_01_WGM01
    SolutionIndex: 94
    SolutionNameMin: Cijk_Ailk_Bljk_HBH_MT128x128x16_EPS1_GRVW04_LPB04_PGR1_PLR1_SNLL1_TT08_08_VW04_WG16_16_01_WGM01
    SolutionIndex: 95
    SolutionNameMin: Cijk_Ailk_Bljk_HBH_MT064x128x16_EPS1_GRVW04_LPB04_PGR1_PLR1_SNLL1_TT08_04_VW04_WG08_32_01_WGM08
    SolutionIndex: 96
    SolutionNameMin: Cijk_Ailk_Bljk_HBH_MT128x064x16_EPS1_GRVW04_LPB04_PGR1_PLR1_SNLL1_TT08_04_VW04_WG16_16_01_WGM08
    SolutionIndex: 97
    SolutionNameMin: Cijk_Ailk_Bljk_HBH_MT256x064x16_EPS1_GRVW04_LPB04_PGR1_PLR1_SNLL1_TT08_08_VW04_WG32_08_01_WGM64
    SolutionIndex: 98
    SolutionNameMin: Cijk_Ailk_Bljk_HBH_MT064x128x32_EPS0_GRVW04_LPB04_PGR0_PLR0_SNLL0_TT08_04_VW04_WG08_32_01_WGM01
    SolutionIndex: 99
    SolutionNameMin: Cijk_Ailk_Bljk_HBH_MT064x064x32_EPS0_GRVW04_LPB04_PGR0_PLR0_SNLL0_TT04_04_VW04_WG16_16_01_WGM01
    SolutionIndex: 100
    SolutionNameMin: Cijk_Ailk_Bljk_HBH_MT128x064x32_EPS1_GRVW04_LPB04_PGR1_PLR1_SNLL1_TT08_04_VW04_WG16_16_01_WGM01
    SolutionIndex: 101
    SolutionNameMin: Cijk_Ailk_Bljk_HBH_MT064x064x32_EPS0_GRVW04_LPB04_PGR0_PLR0_SNLL0_TT04_04_VW04_WG16_16_01_WGM08
    SolutionIndex: 102
    SolutionNameMin: Cijk_Ailk_Bljk_HBH_MT128x064x32_EPS0_GRVW08_LPB08_PGR0_PLR1_SNLL0_TT08_08_VW08_WG16_08_01_WGM01
    SolutionIndex: 103
    SolutionNameMin: Cijk_Ailk_Bljk_HBH_MT64x64x16_SE_GRVW4_LRVW4_TT4_4_VW4_WG16_16_1_WGM8
    SolutionIndex: 104
    SolutionNameMin: Cijk_Ailk_Bljk_HBH_MT128x64x16_SE_GRVW4_LRVW4_TT8_4_VW4_WG16_16_1_WGM1
    SolutionIndex: 105
    SolutionNameMin: Cijk_Ailk_Bljk_HBH_MT128x64x16_SE_GRVW4_LRVW4_TT8_4_VW4_WG16_16_1_WGM8
    SolutionIndex: 106
    SolutionNameMin: Cijk_Ailk_Bljk_HBH_MT64x64x32_SE_GRVW4_LRVW4_TT4_4_VW4_WG16_16_1_WGM8
    SolutionIndex: 107
    SolutionNameMin: Cijk_Ailk_Bljk_HBH_MT64x64x32_SE_GRVW4_LRVW4_TT4_4_VW4_WG16_16_1_WGM1
    SolutionIndex: 108
    SolutionNameMin: Cijk_Ailk_Bljk_HBH_MT96x64x24_SE_GRVW2_LRVW2_TT6_4_VW2_WG16_16_1_WGM1
    SolutionIndex: 109
    SolutionNameMin: Cijk_Ailk_Bljk_HBH_MT96x64x24_SE_GRVW2_LRVW2_TT6_4_VW2_WG16_16_1_WGM8
    SolutionIndex: 110
    SolutionNameMin: Cijk_Ailk_Bljk_HBH_MT64x64x16_SE_GRVW4_LRVW4_TT4_4_VW4_WG16_16_1_WGM1
    SolutionIndex: 111
    SolutionNameMin: Cijk_Ailk_Bljk_HBH_MT64x64x8_SE_GRVW4_LRVW4_TT4_4_VW4_WG16_16_1_WGM1
    SolutionIndex: 112
    SolutionNameMin: Cijk_Ailk_Bljk_HBH_MT64x32x8_SE_GRVW4_LRVW4_TT4_4_VW4_WG16_8_1_WGM1
    SolutionIndex: 113
    SolutionNameMin: Cijk_Ailk_Bljk_HBH_MT64x64x16_SE_GRVW4_LRVW4_TT4_4_VW4_WG16_16_1_WGM8
    SolutionIndex: 114
    SolutionNameMin: Cijk_Ailk_Bljk_HBH_MT64x32x16_SE_GRVW4_LRVW4_TT4_4_VW4_WG16_8_1_WGM8
    SolutionIndex: 115
    SolutionNameMin: Cijk_Ailk_Bljk_HBH_MT32x32x16_SE_GRVW4_LRVW4_TT4_4_VW4_WG8_8_1_WGM8
    SolutionIndex: 116
    SolutionNameMin: Cijk_Ailk_Bljk_HBH_MT128x64x16_SE_GRVW4_LRVW4_TT8_4_VW4_WG16_16_1_WGM1
    SolutionIndex: 117
    SolutionNameMin: Cijk_Ailk_Bljk_HBH_MT64x64x8_SE_GRVW2_LRVW2_TT4_4_VW2_WG16_16_1_WGM1
    SolutionIndex: 118
    SolutionNameMin: Cijk_Ailk_Bljk_HBH_MT96x32x8_SE_GRVW2_LRVW2_TT6_4_VW2_WG16_8_1_WGM1
    SolutionIndex: 119
    SolutionNameMin: Cijk_Ailk_Bljk_HBH_MT64x32x8_SE_GRVW2_LRVW2_TT4_8_VW2_WG16_4_1_WGM1
    SolutionIndex: 120
    SolutionNameMin: Cijk_Ailk_Bljk_HBH_MT64x64x8_SE_GRVW2_LRVW2_TT4_8_VW2_WG16_8_1_WGM8
    SolutionIndex: 121
    SolutionNameMin: Cijk_Ailk_Bljk_HBH_MT64x64x16_SE_GRVW4_LRVW4_TT4_8_VW4_WG16_8_1_WGM8
    SolutionIndex: 122
    SolutionNameMin: Cijk_Ailk_Bljk_HBH_MT64x32x8_SE_GRVW4_LRVW4_TT8_4_VW4_WG8_8_1_WGM1
    SolutionIndex: 123
    SolutionNameMin: Cijk_Ailk_Bljk_HBH_MT128x64x16_SE_GRVW4_LRVW4_TT8_4_VW4_WG16_16_1_WGM8
    SolutionIndex: 124
    SolutionNameMin: Cijk_Ailk_Bljk_HBH_MT64x64x16_SE_GRVW2_LRVW2_TT4_8_VW2_WG16_8_1_WGM1
    SolutionIndex: 125
    SolutionNameMin: Cijk_Ailk_Bljk_HBH_MT64x64x8_SE_GRVW2_LRVW2_TT4_8_VW2_WG16_8_1_WGM1
    SolutionIndex: 126
    SolutionNameMin: Cijk_Ailk_Bljk_HBH_MT64x64x8_SE_GRVW2_LRVW2_TT4_4_VW2_WG16_16_1_WGM8
    SolutionIndex: 127
    SolutionNameMin: Cijk_Ailk_Bljk_HBH_MT128x64x8_SE_GRVW4_LRVW4_TT8_4_VW4_WG16_16_1_WGM8
    SolutionIndex: 128
    SolutionNameMin: Cijk_Ailk_Bljk_HBH_MT64x32x8_SE_GRVW4_LRVW4_TT4_8_VW4_WG16_4_1_WGM1
    SolutionIndex: 129
    SolutionNameMin: Cijk_Ailk_Bljk_HBH_MT64x64x16_SE_GRVW2_LRVW2_TT4_4_VW2_WG16_16_1_WGM1
    SolutionIndex: 130
    SolutionNameMin: Cijk_Ailk_Bljk_HBH_MT128x64x16_SE_GRVW2_LRVW2_TT8_4_VW2_WG16_16_1_WGM1
    SolutionIndex: 131
    SolutionNameMin: Cijk_Ailk_Bljk_HBH_MT64x64x16_SE_GRVW4_LRVW4_TT4_8_VW4_WG16_8_1_WGM1
    SolutionIndex: 132
    SolutionNameMin: Cijk_Ailk_Bljk_HBH_MT64x64x16_SE_GRVW2_LRVW2_TT4_4_VW2_WG16_16_1_WGM8
    SolutionIndex: 133
    SolutionNameMin: Cijk_Ailk_Bljk_HBH_MT64x96x16_SE_GRVW2_LRVW2_TT4_6_VW2_WG16_16_1_WGM1
    SolutionIndex: 134
    SolutionNameMin: Cijk_Ailk_Bljk_HBH_MT128x32x8_SE_GRVW4_LRVW4_TT8_4_VW4_WG16_8_1_WGM1
    SolutionIndex: 135
    SolutionNameMin: Cijk_Ailk_Bljk_HBH_MT64x128x16_SE_GRVW4_LRVW4_TT4_8_VW4_WG16_16_1_WGM1
    SolutionIndex: 136
    SolutionNameMin: Cijk_Ailk_Bljk_HBH_MT128x64x8_SE_GRVW2_LRVW2_TT8_4_VW2_WG16_16_1_WGM1
    SolutionIndex: 137
    SolutionNameMin: Cijk_Ailk_Bljk_HBH_MT128x64x8_SE_GRVW4_LRVW4_TT8_4_VW4_WG16_16_1_WGM1
    SolutionIndex: 138
    SolutionNameMin: Cijk_Ailk_Bljk_HBH_MT64x64x8_SE_GRVW2_LRVW2_TT8_4_VW2_WG8_16_1_WGM1
    SolutionIndex: 139
    SolutionNameMin: Cijk_Ailk_Bljk_HBH_MT64x64x16_SE_GRVW4_LRVW4_TT8_4_VW4_WG8_16_1_WGM1
    SolutionIndex: 140
    SolutionNameMin: Cijk_Ailk_Bljk_HBH_MT128x32x8_SE_GRVW4_LRVW4_TT8_4_VW4_WG16_8_1_WGM8
    SolutionIndex: 141
    SolutionNameMin: Cijk_Ailk_Bljk_HBH_MT64x64x8_SE_GRVW4_LRVW4_TT4_8_VW4_WG16_8_1_WGM1
    SolutionIndex: 142
    SolutionNameMin: Cijk_Ailk_Bljk_HBH_MT64x32x8_SE_GRVW2_LRVW2_TT4_8_VW2_WG16_4_1_WGM8
    SolutionIndex: 143
    SolutionNameMin: Cijk_Ailk_Bljk_HBH_MT128x128x16_SE_GRVW8_LRVW8_TT8_8_VW8_WG16_16_1_WGM8
    SolutionIndex: 144
    SolutionNameMin: Cijk_Ailk_Bljk_HBH_MT64x128x8_SE_GRVW4_LRVW4_TT4_8_VW4_WG16_16_1_WGM1
    SolutionIndex: 145
    SolutionNameMin: Cijk_Ailk_Bljk_HBH_MT64x128x16_SE_GRVW2_LRVW2_TT4_8_VW2_WG16_16_1_WGM1
    SolutionIndex: 146
    SolutionNameMin: Cijk_Ailk_Bljk_HBH_MT64x64x8_SE_GRVW4_LRVW4_TT8_4_VW4_WG8_16_1_WGM1
    SolutionIndex: 147
    SolutionNameMin: Cijk_Ailk_Bljk_HBH_MT32x32x16_SE_GRVW4_LRVW4_TT4_4_VW4_WG8_8_1_WGM1
    SolutionIndex: 148
    SolutionNameMin: Cijk_Ailk_Bljk_HBH_MT64x64x8_SE_GRVW4_LRVW4_TT4_8_VW4_WG16_8_1_WGM8
    SolutionIndex: 149
    SolutionNameMin: Cijk_Ailk_Bljk_HBH_MT96x16x8_SE_GRVW2_LRVW2_TT6_4_VW2_WG16_4_1_WGM8
    SolutionIndex: 150
    SolutionNameMin: Cijk_Ailk_Bljk_HBH_MT96x64x8_SE_GRVW2_LRVW2_TT6_4_VW2_WG16_16_1_WGM1
    SolutionIndex: 151
    SolutionNameMin: Cijk_Ailk_Bljk_HBH_MT128x64x8_SE_GRVW2_LRVW2_TT8_4_VW2_WG16_16_1_WGM8
    SolutionIndex: 152
    SolutionNameMin: Cijk_Ailk_Bljk_HBH_MT64x32x8_SE_GRVW2_LRVW2_TT4_4_VW2_WG16_8_1_WGM1
    SolutionIndex: 153
    SolutionNameMin: Cijk_Ailk_Bljk_HBH_MT128x32x8_SE_GRVW2_LRVW2_TT8_4_VW2_WG16_8_1_WGM1
    SolutionIndex: 154
    SolutionNameMin: Cijk_Ailk_Bljk_HBH_MT96x32x8_SE_GRVW2_LRVW2_TT6_4_VW2_WG16_8_1_WGM8
    SolutionIndex: 155
    SolutionNameMin: Cijk_Ailk_Bljk_HBH_MT64x32x8_SE_GRVW4_LRVW4_TT4_8_VW4_WG16_4_1_WGM8
    SolutionIndex: 156
    SolutionNameMin: Cijk_Ailk_Bljk_HBH_MT128x32x8_SE_GRVW8_LRVW8_TT8_8_VW8_WG16_4_1_WGM1
    SolutionIndex: 157
    SolutionNameMin: Cijk_Ailk_Bljk_HBH_MT64x64x8_SE_GRVW8_LRVW8_TT8_8_VW8_WG8_8_1_WGM1
    SolutionIndex: 158
    SolutionNameMin: Cijk_Ailk_Bljk_HBH_MT32x32x8_SE_GRVW4_LRVW4_TT4_4_VW4_WG8_8_1_WGM1
    SolutionIndex: 159
    SolutionNameMin: Cijk_Ailk_Bljk_HBH_MT64x64x8_SE_GRVW4_LRVW4_TT8_4_VW4_WG8_16_1_WGM8
    SolutionIndex: 160
    SolutionNameMin: Cijk_Ailk_Bljk_HBH_MT96x64x8_SE_GRVW2_LRVW2_TT6_4_VW2_WG16_16_1_WGM8
    SolutionIndex: 161
    SolutionNameMin: Cijk_Ailk_Bljk_HBH_MT64x48x8_SE_GRVW2_LRVW2_TT4_6_VW2_WG16_8_1_WGM8
    SolutionIndex: 162
    SolutionNameMin: Cijk_Ailk_Bljk_HBH_MT48x64x8_SE_GRVW2_LRVW2_TT6_4_VW2_WG8_16_1_WGM8
    SolutionIndex: 163
    SolutionNameMin: Cijk_Ailk_Bljk_HBH_MT128x64x16_SE_GRVW2_LRVW2_TT8_4_VW2_WG16_16_1_WGM8
    SolutionIndex: 164
    SolutionNameMin: Cijk_Ailk_Bljk_HBH_MT96x32x16_SE_GRVW2_LRVW2_TT6_4_VW2_WG16_8_1_WGM1
    SolutionIndex: 165
    SolutionNameMin: Cijk_Ailk_Bljk_HBH_MT32x64x16_SE_GRVW4_LRVW4_TT4_4_VW4_WG8_16_1_WGM1
    SolutionIndex: 166
    SolutionNameMin: Cijk_Ailk_Bljk_HBH_MT64x64x8_SE_GRVW4_LRVW4_TT4_4_VW4_WG16_16_1_WGM8
    SolutionIndex: 167
    SolutionNameMin: Cijk_Ailk_Bljk_HBH_MT64x32x8_SE_GRVW4_LRVW4_TT4_4_VW4_WG16_8_1_WGM8
    SolutionIndex: 168
    SolutionNameMin: Cijk_Ailk_Bljk_HBH_MT64x64x16_SE_GRVW2_LRVW2_TT8_4_VW2_WG8_16_1_WGM1
    SolutionIndex: 169
    SolutionNameMin: Cijk_Ailk_Bljk_HBH_MT64x32x8_SE_GRVW2_LRVW2_TT4_4_VW2_WG16_8_1_WGM8
    SolutionIndex: 170
    SolutionNameMin: Cijk_Ailk_Bljk_HBH_MT64x64x16_SE_GRVW4_LRVW4_TT8_4_VW4_WG8_16_1_WGM8
    SolutionIndex: 171
    SolutionNameMin: Cijk_Ailk_Bljk_HBH_MT64x32x8_SE_GRVW2_LRVW2_TT8_4_VW2_WG8_8_1_WGM1
    SolutionIndex: 172
    SolutionNameMin: Cijk_Ailk_Bljk_HBH_MT128x64x8_SE_GRVW8_LRVW8_TT8_8_VW8_WG16_8_1_WGM1
    SolutionIndex: 173
    SolutionNameMin: Cijk_Ailk_Bljk_HBH_MT128x128x16_SE_GRVW8_LRVW8_TT8_8_VW8_WG16_16_1_WGM1
    SolutionIndex: 174
    SolutionNameMin: Cijk_Ailk_Bljk_HBH_MT128x64x8_SE_GRVW8_LRVW8_TT8_8_VW8_WG16_8_1_WGM8
    SolutionIndex: 175
    SolutionNameMin: Cijk_Ailk_Bljk_HBH_MT32x64x16_SE_GRVW4_LRVW4_TT4_4_VW4_WG8_16_1_WGM8
    SolutionIndex: 176
    SolutionNameMin: Cijk_Ailk_Bljk_HBH_MT64x64x8_SE_GRVW2_LRVW2_TT8_4_VW2_WG8_16_1_WGM8
    SolutionIndex: 177
    SolutionNameMin: Cijk_Ailk_Bljk_HBH_MT96x64x16_SE_GRVW2_LRVW2_TT6_4_VW2_WG16_16_1_WGM8
    SolutionIndex: 178
    SolutionNameMin: Cijk_Ailk_Bljk_HBH_MT64x128x16_SE_GRVW4_LRVW4_TT4_8_VW4_WG16_16_1_WGM8
    SolutionIndex: 179
    SolutionNameMin: Cijk_Ailk_Bljk_HBH_MT64x16x16_SE_GRVW4_LRVW4_TT4_4_VW4_WG16_4_1_WGM1
    SolutionIndex: 180
    SolutionNameMin: Cijk_Ailk_Bljk_HBH_MT64x16x16_SE_GRVW4_LRVW4_TT4_4_VW4_WG16_4_1_WGM8
    SolutionIndex: 181
    SolutionNameMin: Cijk_Ailk_Bljk_HBH_MT64x32x16_SE_GRVW4_LRVW4_TT4_4_VW4_WG16_8_1_WGM1
    SolutionIndex: 182
    SolutionNameMin: Cijk_Ailk_Bljk_HBH_MT32x32x16_SE_GRVW2_LRVW2_TT2_4_VW2_WG16_8_1_WGM1
    SolutionIndex: 183
    SolutionNameMin: Cijk_Ailk_Bljk_HBH_MT64x32x16_SE_GRVW2_LRVW2_TT4_2_VW2_WG16_16_1_WGM1
- - - [1024, 1024, 1, 3328]
    - [19, 9231.92]
  - - [2944, 4288, 1, 1280]
    - [39, 10205.8]
  - - [2368, 64, 1, 3328]
    - [33, 4925.44]
  - - [2368, 5888, 1, 256]
    - [37, 9906.08]
  - - [256, 704, 1, 1280]
    - [19, 4055.67]
  - - [128, 6784, 1, 3328]
    - [23, 8287.11]
  - - [5888, 1856, 1, 3328]
    - [39, 10356.5]
  - - [5888, 2944, 1, 3328]
    - [39, 10362.5]
  - - [1856, 4288, 1, 256]
    - [36, 9603.07]
  - - [5056, 5056, 1, 3328]
    - [39, 10474.1]
  - - [1408, 5888, 1, 1280]
    - [41, 10182.3]
  - - [1024, 3584, 1, 3328]
    - [39, 10158.6]
  - - [448, 3584, 1, 3328]
    - [39, 8554.62]
  - - [256, 4288, 1, 3328]
    - [39, 7929.43]
  - - [5888, 1408, 1, 1280]
    - [41, 10183.9]
  - - [704, 1856, 1, 3328]
    - [39, 9428.57]
  - - [1024, 2368, 1, 256]
    - [41, 8555.09]
  - - [5056, 6784, 1, 1280]
    - [36, 10454.9]
  - - [1408, 64, 1, 1280]
    - [11, 3482.64]
  - - [448, 1024, 1, 1280]
    - [28, 7017.24]
  - - [5056, 5056, 1, 1280]
    - [39, 10399.7]
  - - [4288, 6784, 1, 256]
    - [37, 10079.9]
  - - [6784, 448, 1, 256]
    - [41, 9055.44]
  - - [5056, 256, 1, 1280]
    - [39, 9187.86]
  - - [5888, 704, 1, 1280]
    - [39, 9985.33]
  - - [3584, 1024, 1, 256]
    - [41, 9463.38]
  - - [6784, 4288, 1, 3328]
    - [39, 10521.3]
  - - [1856, 2368, 1, 3328]
    - [39, 10084.5]
  - - [5888, 2944, 1, 1280]
    - [36, 10272.9]
  - - [5888, 1024, 1, 256]
    - [36, 9675.93]
  - - [448, 64, 1, 1280]
    - [15, 1267.27]
  - - [1024, 704, 1, 256]
    - [16, 6886.17]
  - - [1408, 2944, 1, 256]
    - [41, 9461.12]
  - - [256, 1856, 1, 1280]
    - [19, 7260.91]
  - - [6784, 5056, 1, 3328]
    - [39, 10529.9]
  - - [5056, 5056, 1, 256]
    - [17, 10065.5]
  - - [256, 2944, 1, 3328]
    - [39, 8471.35]
  - - [64, 1024, 1, 1280]
    - [30, 2766.69]
  - - [1024, 3584, 1, 1280]
    - [39, 10032.5]
  - - [2368, 2944, 1, 1280]
    - [39, 10114.5]
  - - [128, 3584, 1, 1280]
    - [1, 7154.03]
  - - [6784, 6784, 1, 1280]
    - [41, 10484.1]
  - - [1024, 256, 1, 3328]
    - [28, 6220.87]
  - - [1408, 4288, 1, 1280]
    - [39, 9838.09]
  - - [3584, 4288, 1, 1280]
    - [39, 10335.5]
  - - [2368, 704, 1, 1280]
    - [39, 8745.31]
  - - [5056, 4288, 1, 3328]
    - [39, 10473.3]
  - - [3584, 2368, 1, 3328]
    - [39, 10204.8]
  - - [5888, 6784, 1, 1280]
    - [36, 10431.2]
  - - [64, 704, 1, 1280]
    - [32, 1902.1]
  - - [4288, 256, 1, 256]
    - [39, 7082.12]
  - - [6784, 448, 1, 1280]
    - [39, 9642.63]
  - - [2944, 5888, 1, 256]
    - [36, 9864.8]
  - - [256, 128, 1, 256]
    - [15, 970.904]
  - - [4288, 2944, 1, 256]
    - [36, 9764.67]
  - - [5888, 64, 1, 3328]
    - [23, 7264.23]
  - - [2944, 256, 1, 3328]
    - [19, 8494.3]
  - - [5056, 2368, 1, 1280]
    - [36, 10288.5]
  - - [448, 3584, 1, 1280]
    - [39, 8434.07]
  - - [6784, 5888, 1, 256]
    - [37, 10103.7]
  - - [64, 1024, 1, 3328]
    - [30, 2973.06]
  - - [704, 128, 1, 1280]
    - [11, 3525.16]
  - - [1408, 448, 1, 1280]
    - [19, 7018.49]
  - - [1024, 1408, 1, 256]
    - [36, 7886.73]
  - - [2368, 2368, 1, 3328]
    - [39, 10020.6]
  - - [5056, 704, 1, 3328]
    - [39, 9847.2]
  - - [1408, 1856, 1, 256]
    - [41, 9199.55]
  - - [1408, 256, 1, 1280]
    - [19, 5615.55]
  - - [5888, 1856, 1, 256]
    - [41, 9920.59]
  - - [704, 5888, 1, 256]
    - [37, 9447.64]
  - - [6784, 64, 1, 256]
    - [24, 5717.54]
  - - [3584, 704, 1, 3328]
    - [39, 9619.89]
  - - [1408, 1408, 1, 256]
    - [42, 8538.2]
  - - [1024, 64, 1, 1280]
    - [8, 2781.37]
  - - [448, 4288, 1, 256]
    - [20, 8251.38]
  - - [64, 3584, 1, 3328]
    - [27, 6054.59]
  - - [704, 2368, 1, 1280]
    - [39, 8753.92]
  - - [1856, 2368, 1, 1280]
    - [39, 9984.42]
  - - [2368, 128, 1, 3328]
    - [22, 6190.07]
  - - [1408, 1408, 1, 3328]
    - [39, 9317.67]
  - - [2944, 128, 1, 256]
    - [6, 5582.7]
  - - [448, 1408, 1, 256]
    - [39, 6079.85]
  - - [64, 5056, 1, 3328]
    - [5, 6592.13]
  - - [1408, 1024, 1, 1280]
    - [39, 8698.61]
  - - [704, 6784, 1, 256]
    - [36, 9245.61]
  - - [6784, 704, 1, 256]
    - [36, 9228.9]
  - - [256, 3584, 1, 3328]
    - [39, 8072.81]
  - - [5056, 704, 1, 256]
    - [17, 9170.82]
  - - [1408, 3584, 1, 256]
    - [41, 9339.54]
  - - [3584, 4288, 1, 3328]
    - [39, 10417.8]
  - - [5888, 1856, 1, 1280]
    - [41, 10284.1]
  - - [256, 1408, 1, 256]
    - [39, 4669.77]
  - - [5056, 64, 1, 1280]
    - [22, 6313.83]
  - - [2368, 128, 1, 256]
    - [5, 4731.52]
  - - [2368, 3584, 1, 1280]
    - [39, 10118.5]
  - - [1024, 256, 1, 256]
    - [19, 4559.03]
  - - [448, 448, 1, 256]
    - [10, 4039.33]
  - - [2944, 3584, 1, 3328]
    - [39, 10241.4]
  - - [256, 256, 1, 3328]
    - [12, 2979.56]
  - - [128, 1024, 1, 3328]
    - [11, 5105.43]
  - - [6784, 2944, 1, 256]
    - [37, 9908.66]
  - - [64, 1856, 1, 1280]
    - [11, 4349.07]
  - - [448, 256, 1, 256]
    - [12, 3033.07]
  - - [1856, 2368, 1, 256]
    - [36, 9413.67]
  - - [3584, 6784, 1, 3328]
    - [39, 10494.6]
  - - [256, 1024, 1, 256]
    - [19, 4634.59]
  - - [1024, 128, 1, 1280]
    - [11, 4766.25]
  - - [4288, 128, 1, 1280]
    - [3, 6969.7]
  - - [5056, 4288, 1, 1280]
    - [39, 10401.0]
  - - [5888, 64, 1, 256]
    - [6, 5661.33]
  - - [6784, 1856, 1, 3328]
    - [39, 10256.5]
  - - [1408, 5056, 1, 1280]
    - [39, 9972.14]
  - - [1856, 256, 1, 1280]
    - [19, 7281.78]
  - - [64, 5888, 1, 3328]
    - [5, 6636.84]
  - - [6784, 5888, 1, 3328]
    - [39, 10508.3]
  - - [448, 256, 1, 3328]
    - [11, 4484.04]
  - - [2368, 5056, 1, 1280]
    - [39, 10294.6]
  - - [1024, 704, 1, 1280]
    - [19, 7982.24]
  - - [256, 1408, 1, 3328]
    - [19, 5791.69]
  - - [6784, 128, 1, 3328]
    - [23, 8277.61]
  - - [1024, 5056, 1, 1280]
    - [39, 10047.0]
  - - [4288, 1024, 1, 256]
    - [36, 9379.79]
  - - [2368, 1408, 1, 256]
    - [36, 9166.03]
  - - [704, 704, 1, 3328]
    - [19, 7851.36]
  - - [5888, 448, 1, 1280]
    - [39, 9092.04]
  - - [3584, 256, 1, 3328]
    - [19, 8139.96]
  - - [704, 5888, 1, 3328]
    - [39, 10094.2]
  - - [1024, 6784, 1, 1280]
    - [39, 10077.9]
  - - [128, 3584, 1, 3328]
    - [1, 7388.36]
  - - [128, 704, 1, 1280]
    - [11, 3491.02]
  - - [3584, 2944, 1, 1280]
    - [39, 10159.5]
  - - [1856, 128, 1, 3328]
    - [31, 6274.81]
  - - [128, 2944, 1, 1280]
    - [6, 6986.46]
  - - [448, 1856, 1, 1280]
    - [19, 7257.97]
  - - [1408, 5056, 1, 3328]
    - [39, 10056.2]
  - - [1856, 1856, 1, 3328]
    - [39, 9540.06]
  - - [3584, 128, 1, 256]
    - [24, 5991.86]
  - - [448, 1408, 1, 3328]
    - [19, 7181.35]
  - - [2368, 2368, 1, 256]
    - [17, 9444.08]
  - - [4288, 4288, 1, 1280]
    - [36, 10295.8]
  - - [64, 448, 1, 1280]
    - [14, 1270.78]
  - - [5888, 1024, 1, 1280]
    - [39, 10224.6]
  - - [704, 1024, 1, 256]
    - [39, 6886.17]
  - - [704, 6784, 1, 3328]
    - [39, 9846.33]
  - - [5888, 5888, 1, 3328]
    - [39, 10487.0]
  - - [5056, 1024, 1, 1280]
    - [39, 10055.6]
  - - [448, 5888, 1, 3328]
    - [39, 9194.28]
  - - [1024, 2944, 1, 1280]
    - [39, 9555.18]
  - - [5056, 5888, 1, 1280]
    - [37, 10439.1]
  - - [448, 6784, 1, 256]
    - [40, 9030.22]
  - - [256, 3584, 1, 256]
    - [39, 7057.72]
  - - [256, 448, 1, 256]
    - [33, 3058.35]
  - - [3584, 5888, 1, 256]
    - [36, 9964.35]
  - - [2944, 3584, 1, 256]
    - [36, 9705.15]
  - - [1408, 704, 1, 256]
    - [41, 7588.38]
  - - [6784, 1024, 1, 3328]
    - [39, 10169.2]
  - - [6784, 2944, 1, 3328]
    - [39, 10396.9]
  - - [64, 64, 1, 3328]
    - [11, 189.748]
  - - [6784, 2368, 1, 1280]
    - [41, 10298.6]
  - - [4288, 3584, 1, 256]
    - [36, 9895.03]
  - - [4288, 5888, 1, 1280]
    - [39, 10378.3]
  - - [448, 2944, 1, 3328]
    - [39, 8086.49]
  - - [4288, 1856, 1, 1280]
    - [39, 10082.9]
  - - [1856, 2944, 1, 3328]
    - [39, 10223.3]
  - - [256, 6784, 1, 3328]
    - [39, 9236.39]
  - - [64, 5888, 1, 256]
    - [18, 5407.45]
  - - [5056, 1024, 1, 256]
    - [37, 9582.13]
  - - [704, 64, 1, 3328]
    - [34, 2068.81]
  - - [5056, 1856, 1, 3328]
    - [39, 10358.6]
  - - [448, 448, 1, 3328]
    - [27, 5324.8]
  - - [448, 2368, 1, 1280]
    - [39, 7540.59]
  - - [1408, 128, 1, 1280]
    - [5, 5252.43]
  - - [5056, 256, 1, 3328]
    - [39, 9349.62]
  - - [704, 704, 1, 256]
    - [19, 6318.61]
  - - [1024, 5888, 1, 1280]
    - [39, 10225.7]
  - - [64, 128, 1, 256]
    - [2, 216.659]
  - - [128, 1856, 1, 1280]
    - [13, 5948.55]
  - - [5056, 3584, 1, 256]
    - [37, 9980.43]
  - - [1856, 1024, 1, 1280]
    - [39, 8821.8]
  - - [1856, 1856, 1, 1280]
    - [39, 9431.18]
  - - [128, 4288, 1, 3328]
    - [3, 7099.75]
  - - [1856, 1024, 1, 3328]
    - [39, 8937.69]
  - - [256, 2368, 1, 256]
    - [39, 5896.25]
  - - [1024, 448, 1, 3328]
    - [19, 7261.84]
  - - [1856, 704, 1, 1280]
    - [39, 9254.53]
  - - [6784, 1024, 1, 256]
    - [36, 9590.11]
  - - [5056, 5888, 1, 3328]
    - [39, 10492.0]
  - - [1856, 1024, 1, 256]
    - [20, 8174.38]
  - - [5056, 1408, 1, 3328]
    - [39, 10060.3]
  - - [1024, 1024, 1, 1280]
    - [19, 9034.58]
  - - [448, 5888, 1, 256]
    - [36, 8526.3]
  - - [1408, 6784, 1, 3328]
    - [39, 10265.0]
  - - [2944, 1408, 1, 3328]
    - [39, 10091.2]
  - - [2944, 4288, 1, 3328]
    - [39, 10280.8]
  - - [256, 2944, 1, 256]
    - [39, 7199.18]
  - - [5056, 2944, 1, 256]
    - [36, 9919.12]
  - - [2368, 1856, 1, 256]
    - [36, 9407.41]
  - - [128, 6784, 1, 1280]
    - [6, 8139.21]
  - - [1408, 3584, 1, 3328]
    - [39, 9900.27]
  - - [2368, 6784, 1, 256]
    - [37, 9970.23]
  - - [4288, 2368, 1, 3328]
    - [39, 10360.5]
  - - [704, 3584, 1, 1280]
    - [39, 9501.11]
  - - [1408, 5888, 1, 3328]
    - [39, 10271.9]
  - - [1856, 5056, 1, 256]
    - [17, 9835.79]
  - - [6784, 6784, 1, 256]
    - [37, 10190.5]
  - - [1408, 704, 1, 3328]
    - [39, 8714.14]
  - - [128, 5888, 1, 1280]
    - [0, 8310.56]
  - - [2368, 4288, 1, 1280]
    - [39, 10279.3]
  - - [3584, 1856, 1, 1280]
    - [39, 10009.5]
  - - [704, 1408, 1, 3328]
    - [39, 8714.14]
  - - [704, 64, 1, 1280]
    - [14, 1897.09]
  - - [3584, 448, 1, 256]
    - [39, 7749.66]
  - - [3584, 3584, 1, 1280]
    - [39, 10378.3]
  - - [256, 6784, 1, 256]
    - [36, 8332.01]
  - - [1856, 3584, 1, 3328]
    - [39, 10106.3]
  - - [128, 448, 1, 256]
    - [30, 1683.49]
  - - [3584, 3584, 1, 256]
    - [36, 9923.77]
  - - [6784, 4288, 1, 1280]
    - [36, 10453.6]
  - - [448, 704, 1, 1280]
    - [19, 4932.82]
  - - [3584, 5056, 1, 256]
    - [41, 9970.14]
  - - [6784, 128, 1, 256]
    - [6, 7198.77]
  - - [64, 1408, 1, 3328]
    - [11, 3790.35]
  - - [704, 448, 1, 256]
    - [19, 4102.66]
  - - [2944, 2368, 1, 1280]
    - [39, 10110.8]
  - - [448, 64, 1, 3328]
    - [35, 1390.16]
  - - [6784, 3584, 1, 256]
    - [37, 10018.6]
  - - [256, 1856, 1, 3328]
    - [28, 7593.43]
  - - [256, 704, 1, 256]
    - [19, 3134.33]
  - - [128, 1408, 1, 256]
    - [5, 3819.32]
  - - [64, 128, 1, 3328]
    - [33, 379.921]
  - - [1856, 1408, 1, 256]
    - [37, 9159.25]
  - - [2944, 2944, 1, 3328]
    - [39, 10119.4]
  - - [5056, 6784, 1, 256]
    - [37, 10104.0]
  - - [1408, 4288, 1, 3328]
    - [39, 9919.46]
  - - [6784, 256, 1, 1280]
    - [39, 9104.63]
  - - [1024, 704, 1, 3328]
    - [19, 8113.99]
  - - [2368, 704, 1, 3328]
    - [39, 8870.59]
  - - [128, 4288, 1, 256]
    - [3, 6056.43]
  - - [3584, 6784, 1, 256]
    - [36, 10010.9]
  - - [128, 128, 1, 3328]
    - [14, 795.303]
  - - [5056, 1856, 1, 256]
    - [17, 9845.46]
  - - [704, 4288, 1, 256]
    - [17, 8952.74]
  - - [256, 448, 1, 3328]
    - [11, 4492.49]
  - - [1408, 6784, 1, 1280]
    - [39, 10169.7]
  - - [64, 2368, 1, 1280]
    - [11, 4609.95]
  - - [64, 6784, 1, 3328]
    - [1, 6899.07]
  - - [2944, 256, 1, 1280]
    - [39, 8276.34]
  - - [5056, 2368, 1, 3328]
    - [39, 10374.6]
  - - [2944, 4288, 1, 256]
    - [36, 9759.95]
  - - [1408, 3584, 1, 1280]
    - [39, 9802.18]
  - - [2368, 64, 1, 256]
    - [11, 3439.48]
  - - [256, 256, 1, 256]
    - [12, 1872.46]
  - - [704, 128, 1, 3328]
    - [11, 3794.19]
  - - [1856, 704, 1, 256]
    - [16, 8279.6]
  - - [2368, 6784, 1, 3328]
    - [39, 10367.1]
  - - [5056, 704, 1, 1280]
    - [39, 9750.2]
  - - [1856, 4288, 1, 3328]
    - [39, 10171.9]
  - - [1408, 5888, 1, 256]
    - [37, 9792.93]
  - - [704, 2944, 1, 1280]
    - [39, 9589.73]
  - - [4288, 64, 1, 1280]
    - [25, 5441.03]
  - - [704, 1856, 1, 256]
    - [36, 8279.6]
  - - [3584, 704, 1, 1280]
    - [39, 9507.84]
  - - [5888, 5056, 1, 256]
    - [38, 10114.0]
  - - [3584, 448, 1, 3328]
    - [39, 8550.23]
  - - [704, 2368, 1, 3328]
    - [39, 8871.73]
  - - [2944, 448, 1, 256]
    - [39, 7289.32]
  - - [448, 5056, 1, 3328]
    - [39, 9533.37]
  - - [2368, 128, 1, 1280]
    - [5, 5957.82]
  - - [4288, 448, 1, 256]
    - [20, 8240.32]
  - - [64, 6784, 1, 256]
    - [1, 5741.17]
  - - [64, 5056, 1, 1280]
    - [5, 6329.27]
  - - [5888, 2368, 1, 256]
    - [41, 9892.9]
  - - [704, 448, 1, 3328]
    - [19, 5085.4]
  - - [6784, 704, 1, 3328]
    - [39, 9847.8]
  - - [128, 64, 1, 1280]
    - [26, 338.687]
  - - [2368, 256, 1, 1280]
    - [19, 6735.64]
  - - [1408, 2944, 1, 3328]
    - [39, 10087.1]
  - - [64, 1024, 1, 256]
    - [12, 1889.33]
  - - [2368, 448, 1, 1280]
    - [19, 7584.37]
  - - [128, 3584, 1, 256]
    - [1, 5943.35]
  - - [1856, 448, 1, 3328]
    - [19, 7376.83]
  - - [128, 5056, 1, 256]
    - [6, 6903.13]
  - - [4288, 4288, 1, 256]
    - [36, 9878.84]
  - - [2368, 704, 1, 256]
    - [36, 8022.0]
  - - [3584, 2368, 1, 256]
    - [36, 9644.24]
  - - [5888, 5056, 1, 1280]
    - [41, 10444.2]
  - - [128, 1024, 1, 1280]
    - [11, 4733.98]
  - - [64, 704, 1, 256]
    - [9, 1310.72]
  - - [4288, 256, 1, 1280]
    - [39, 7813.01]
  - - [3584, 3584, 1, 3328]
    - [39, 10460.7]
  - - [128, 1024, 1, 256]
    - [33, 3302.6]
  - - [5888, 6784, 1, 256]
    - [37, 10098.1]
  - - [4288, 2944, 1, 3328]
    - [39, 10283.8]
  - - [1856, 64, 1, 256]
    - [11, 3115.65]
  - - [4288, 128, 1, 3328]
    - [3, 7095.33]
  - - [256, 5056, 1, 1280]
    - [39, 9151.32]
  - - [6784, 5888, 1, 1280]
    - [39, 10437.8]
  - - [704, 128, 1, 256]
    - [12, 2363.59]
  - - [5888, 4288, 1, 1280]
    - [39, 10379.9]
  - - [448, 256, 1, 1280]
    - [11, 4218.41]
  - - [448, 2368, 1, 3328]
    - [39, 7672.47]
  - - [1, 1, 1, 1280]
    - [46, 0.00964436]
  - - [256, 1408, 1, 1280]
    - [19, 5632.0]
  - - [1408, 1856, 1, 1280]
    - [39, 9833.5]
  - - [5888, 448, 1, 3328]
    - [39, 9199.67]
  - - [704, 5888, 1, 1280]
    - [39, 9971.82]
  - - [256, 64, 1, 3328]
    - [34, 793.451]
  - - [128, 2368, 1, 256]
    - [5, 4801.65]
  - - [6784, 64, 1, 3328]
    - [24, 6997.97]
  - - [5056, 2944, 1, 3328]
    - [39, 10438.5]
  - - [448, 128, 1, 256]
    - [30, 1699.08]
  - - [1856, 128, 1, 1280]
    - [31, 5985.97]
  - - [448, 4288, 1, 1280]
    - [39, 8919.45]
  - - [64, 3584, 1, 256]
    - [10, 4475.63]
  - - [128, 2944, 1, 3328]
    - [23, 7250.81]
  - - [3584, 704, 1, 256]
    - [41, 8853.11]
  - - [2944, 448, 1, 3328]
    - [39, 8096.04]
  - - [3584, 1408, 1, 3328]
    - [39, 9900.27]
  - - [2368, 1024, 1, 1280]
    - [39, 9128.79]
  - - [2944, 6784, 1, 1280]
    - [39, 10317.5]
  - - [1856, 6784, 1, 256]
    - [36, 9744.04]
  - - [4288, 448, 1, 3328]
    - [39, 9035.02]
  - - [6784, 704, 1, 1280]
    - [39, 9748.07]
  - - [5888, 1024, 1, 3328]
    - [39, 10321.4]
  - - [704, 6784, 1, 1280]
    - [39, 9745.58]
  - - [5888, 128, 1, 256]
    - [19, 7220.73]
  - - [5056, 1024, 1, 3328]
    - [39, 10153.6]
  - - [704, 5056, 1, 1280]
    - [39, 9731.87]
  - - [64, 704, 1, 3328]
    - [14, 2068.8]
  - - [2944, 1856, 1, 256]
    - [36, 9575.58]
  - - [5056, 64, 1, 256]
    - [5, 5051.07]
  - - [5888, 5056, 1, 3328]
    - [41, 10498.2]
  - - [128, 5056, 1, 3328]
    - [6, 8281.22]
  - - [3584, 6784, 1, 1280]
    - [36, 10422.3]
  - - [1856, 5888, 1, 256]
    - [37, 9912.15]
  - - [64, 448, 1, 3328]
    - [35, 1395.05]
  - - [4288, 4288, 1, 3328]
    - [39, 10373.2]
  - - [4288, 1408, 1, 1280]
    - [39, 9836.09]
  - - [64, 1856, 1, 256]
    - [11, 3040.87]
  - - [4288, 2368, 1, 256]
    - [36, 9807.67]
  - - [2944, 5056, 1, 1280]
    - [36, 10356.5]
  - - [256, 4288, 1, 1280]
    - [39, 7809.54]
  - - [6784, 2368, 1, 3328]
    - [39, 10369.9]
  - - [256, 1024, 1, 1280]
    - [19, 5899.16]
  - - [4288, 128, 1, 256]
    - [3, 6014.95]
  - - [4288, 1856, 1, 3328]
    - [39, 10179.4]
  - - [1856, 2944, 1, 1280]
    - [39, 10117.5]
  - - [3584, 64, 1, 1280]
    - [13, 5761.41]
  - - [4288, 6784, 1, 3328]
    - [39, 10529.9]
  - - [3584, 1024, 1, 1280]
    - [39, 10037.7]
  - - [1024, 4288, 1, 256]
    - [36, 9373.53]
  - - [5888, 3584, 1, 3328]
    - [39, 10447.6]
  - - [5056, 3584, 1, 3328]
    - [39, 10371.9]
  - - [1408, 128, 1, 3328]
    - [5, 5541.26]
  - - [2368, 1408, 1, 1280]
    - [39, 9790.12]
  - - [5056, 2944, 1, 1280]
    - [36, 10358.8]
  - - [3584, 256, 1, 256]
    - [39, 7074.73]
  - - [1024, 6784, 1, 256]
    - [36, 9561.21]
  - - [2944, 5056, 1, 3328]
    - [39, 10442.9]
  - - [3584, 2944, 1, 256]
    - [36, 9719.12]
  - - [448, 128, 1, 3328]
    - [12, 2604.27]
  - - [64, 2944, 1, 3328]
    - [22, 5806.03]
  - - [64, 4288, 1, 3328]
    - [25, 5693.95]
  - - [5056, 6784, 1, 3328]
    - [39, 10526.2]
  - - [128, 2944, 1, 256]
    - [6, 5661.33]
  - - [3584, 4288, 1, 256]
    - [36, 9908.99]
  - - [1856, 6784, 1, 3328]
    - [39, 10257.1]
  - - [3584, 128, 1, 3328]
    - [24, 7354.19]
  - - [128, 256, 1, 1280]
    - [15, 1464.49]
  - - [64, 448, 1, 256]
    - [15, 873.813]
  - - [64, 256, 1, 1280]
    - [14, 728.178]
  - - [5056, 1408, 1, 1280]
    - [41, 9962.55]
  - - [5888, 5888, 1, 256]
    - [37, 10068.0]
  - - [4288, 1024, 1, 1280]
    - [39, 9977.95]
  - - [5888, 128, 1, 3328]
    - [0, 8494.3]
  - - [448, 6784, 1, 3328]
    - [39, 9751.06]
  - - [2944, 1408, 1, 1280]
    - [39, 9979.32]
  - - [64, 128, 1, 1280]
    - [11, 337.82]
  - - [2944, 1856, 1, 3328]
    - [39, 10220.6]
  - - [448, 5056, 1, 256]
    - [36, 8753.96]
  - - [64, 64, 1, 256]
    - [2, 109.227]
  - - [3584, 5888, 1, 1280]
    - [36, 10372.1]
  - - [6784, 1856, 1, 1280]
    - [36, 10176.2]
  - - [5888, 256, 1, 3328]
    - [39, 9232.18]
  - - [1856, 5888, 1, 3328]
    - [39, 10362.4]
  - - [3584, 1408, 1, 256]
    - [41, 9328.75]
  - - [704, 3584, 1, 3328]
    - [39, 9622.54]
  - - [5056, 448, 1, 1280]
    - [39, 9410.92]
  - - [3584, 1856, 1, 3328]
    - [39, 10106.3]
  - - [1408, 704, 1, 1280]
    - [19, 8549.71]
  - - [2944, 1024, 1, 256]
    - [41, 9015.79]
  - - [448, 1408, 1, 1280]
    - [19, 7028.23]
  - - [2368, 4288, 1, 3328]
    - [39, 10356.7]
  - - [1024, 1408, 1, 1280]
    - [39, 8701.9]
  - - [256, 128, 1, 1280]
    - [15, 1448.31]
  - - [704, 1408, 1, 1280]
    - [19, 8545.1]
  - - [6784, 5056, 1, 256]
    - [38, 10082.7]
  - - [4288, 5888, 1, 256]
    - [37, 9994.17]
  - - [448, 2944, 1, 256]
    - [36, 7340.03]
  - - [2944, 6784, 1, 256]
    - [36, 9896.38]
  - - [2368, 2368, 1, 1280]
    - [39, 9922.47]
  - - [1856, 3584, 1, 1280]
    - [39, 10013.2]
  - - [64, 2944, 1, 256]
    - [5, 3966.65]
  - - [3584, 1408, 1, 1280]
    - [39, 9800.98]
  - - [5056, 3584, 1, 1280]
    - [41, 10305.4]
  - - [256, 5888, 1, 256]
    - [41, 8245.21]
  - - [128, 256, 1, 3328]
    - [15, 1596.19]
  - - [1856, 1408, 1, 3328]
    - [39, 9965.29]
  - - [1024, 4288, 1, 3328]
    - [39, 10077.4]
  - - [448, 2368, 1, 256]
    - [39, 6858.11]
  - - [64, 1408, 1, 1280]
    - [11, 3533.86]
  - - [64, 6784, 1, 1280]
    - [24, 6810.6]
  - - [2944, 2368, 1, 3328]
    - [39, 10210.6]
  - - [704, 4288, 1, 3328]
    - [39, 9683.86]
  - - [1024, 1856, 1, 1280]
    - [39, 8821.8]
  - - [6784, 1856, 1, 256]
    - [36, 9739.33]
  - - [128, 2368, 1, 3328]
    - [5, 6202.25]
  - - [1024, 5888, 1, 256]
    - [36, 9651.76]
  - - [64, 2944, 1, 1280]
    - [22, 5441.62]
  - - [5056, 64, 1, 3328]
    - [22, 6595.34]
  - - [1408, 2368, 1, 256]
    - [36, 9142.47]
  - - [2944, 704, 1, 3328]
    - [39, 9743.39]
  - - [256, 64, 1, 256]
    - [14, 489.989]
  - - [2944, 2944, 1, 1280]
    - [41, 10039.4]
  - - [6784, 256, 1, 3328]
    - [39, 9241.11]
  - - [1408, 5056, 1, 256]
    - [41, 9571.56]
  - - [5056, 128, 1, 3328]
    - [23, 8263.43]
  - - [128, 128, 1, 1280]
    - [14, 728.178]
  - - [448, 704, 1, 256]
    - [39, 4119.41]
  - - [1856, 256, 1, 3328]
    - [28, 7495.53]
  - - [2944, 128, 1, 3328]
    - [23, 7230.72]
  - - [704, 256, 1, 256]
    - [19, 3203.98]
  - - [256, 448, 1, 1280]
    - [11, 4208.79]
  - - [704, 256, 1, 1280]
    - [29, 4096.0]
  - - [64, 2368, 1, 3328]
    - [33, 4933.15]
  - - [256, 704, 1, 3328]
    - [28, 4286.63]
  - - [1024, 1024, 1, 256]
    - [19, 7951.29]
  - - [1408, 4288, 1, 256]
    - [41, 9410.62]
  - - [5888, 2368, 1, 1280]
    - [41, 10247.8]
  - - [128, 256, 1, 256]
    - [9, 953.251]
  - - [256, 64, 1, 1280]
    - [14, 726.161]
  - - [2368, 5888, 1, 1280]
    - [36, 10235.1]
  - - [5888, 256, 1, 1280]
    - [39, 9080.31]
  - - [704, 1024, 1, 1280]
    - [39, 7921.93]
  - - [2368, 1856, 1, 3328]
    - [39, 10095.1]
  - - [2944, 704, 1, 256]
    - [20, 8890.41]
  - - [2368, 6784, 1, 1280]
    - [37, 10293.7]
  - - [2368, 1024, 1, 3328]
    - [39, 9250.18]
  - - [1856, 4288, 1, 1280]
    - [39, 10084.5]
  - - [704, 3584, 1, 256]
    - [36, 8833.74]
  - - [704, 2944, 1, 3328]
    - [39, 9740.1]
  - - [1856, 5056, 1, 3328]
    - [39, 10359.4]
  - - [3584, 5056, 1, 1280]
    - [41, 10309.8]
  - - [2944, 1024, 1, 3328]
    - [39, 9672.21]
  - - [256, 4288, 1, 256]
    - [39, 7067.87]
  - - [2368, 256, 1, 256]
    - [39, 5914.22]
  - - [1408, 6784, 1, 256]
    - [36, 9703.51]
  - - [6784, 1408, 1, 3328]
    - [39, 10265.0]
  - - [1024, 2368, 1, 1280]
    - [39, 9141.7]
  - - [704, 64, 1, 256]
    - [11, 1322.74]
  - - [256, 2368, 1, 3328]
    - [19, 6916.7]
  - - [6784, 2944, 1, 1280]
    - [39, 10319.8]
  - - [3584, 448, 1, 1280]
    - [39, 8428.51]
  - - [2944, 6784, 1, 3328]
    - [39, 10398.6]
  - - [448, 5056, 1, 1280]
    - [39, 9408.48]
  - - [4288, 5056, 1, 1280]
    - [36, 10402.5]
  - - [128, 448, 1, 1280]
    - [30, 2420.85]
  - - [4288, 704, 1, 256]
    - [17, 8969.37]
  - - [64, 64, 1, 1280]
    - [30, 179.06]
  - - [5888, 704, 1, 256]
    - [41, 9467.87]
  - - [256, 5888, 1, 3328]
    - [39, 9233.54]
  - - [6784, 4288, 1, 256]
    - [38, 10061.3]
  - - [5888, 256, 1, 256]
    - [36, 8217.12]
  - - [6784, 1024, 1, 1280]
    - [39, 10077.9]
  - - [704, 448, 1, 1280]
    - [19, 4942.48]
  - - [128, 64, 1, 3328]
    - [11, 379.921]
  - - [448, 64, 1, 256]
    - [33, 873.813]
  - - [2944, 704, 1, 1280]
    - [39, 9598.05]
  - - [6784, 3584, 1, 1280]
    - [36, 10419.5]
  - - [2944, 64, 1, 1280]
    - [5, 5471.24]
  - - [1408, 2944, 1, 1280]
    - [39, 9985.33]
  - - [256, 1856, 1, 256]
    - [39, 6009.63]
  - - [1408, 2368, 1, 3328]
    - [39, 9907.19]
  - - [128, 1408, 1, 3328]
    - [5, 5561.81]
  - - [2368, 2944, 1, 256]
    - [36, 9615.71]
  - - [64, 5056, 1, 256]
    - [5, 4978.22]
  - - [1408, 256, 1, 3328]
    - [28, 5776.07]
  - - [3584, 1856, 1, 256]
    - [41, 9592.65]
  - - [4288, 3584, 1, 1280]
    - [36, 10336.8]
  - - [2368, 448, 1, 256]
    - [19, 6885.93]
  - - [4288, 256, 1, 3328]
    - [39, 7934.94]
  - - [1408, 64, 1, 256]
    - [12, 2402.99]
  - - [4288, 2944, 1, 1280]
    - [39, 10206.3]
  - - [5056, 448, 1, 3328]
    - [39, 9539.16]
  - - [1024, 64, 1, 256]
    - [12, 1889.33]
  - - [64, 2368, 1, 256]
    - [11, 3391.37]
  - - [4288, 5056, 1, 3328]
    - [39, 10478.7]
  - - [2944, 256, 1, 256]
    - [16, 7135.28]
  - - [1024, 128, 1, 3328]
    - [33, 5076.9]
  - - [256, 5056, 1, 3328]
    - [39, 9341.52]
  - - [5056, 2368, 1, 256]
    - [17, 9915.22]
  - - [4288, 704, 1, 3328]
    - [39, 9682.37]
  - - [448, 3584, 1, 256]
    - [36, 7749.66]
  - - [2368, 64, 1, 1280]
    - [11, 4609.95]
  - - [1024, 1408, 1, 3328]
    - [39, 8838.59]
  - - [2944, 5888, 1, 1280]
    - [36, 10277.5]
  - - [5888, 3584, 1, 256]
    - [37, 9952.6]
  - - [1408, 1856, 1, 3328]
    - [39, 9969.86]
  - - [6784, 1408, 1, 1280]
    - [39, 10179.2]
  - - [704, 2944, 1, 256]
    - [20, 8866.64]
  - - [4288, 64, 1, 256]
    - [4, 4435.26]
  - - [2944, 5888, 1, 3328]
    - [39, 10357.6]
  - - [64, 4288, 1, 1280]
    - [4, 5481.79]
  - - [6784, 64, 1, 1280]
    - [1, 6810.6]
  - - [704, 1856, 1, 1280]
    - [39, 9262.73]
  - - [1408, 64, 1, 3328]
    - [11, 3778.89]
  - - [1408, 1408, 1, 1280]
    - [39, 9204.72]
  - - [448, 1024, 1, 3328]
    - [28, 7272.91]
  - - [448, 4288, 1, 3328]
    - [39, 9034.0]
  - - [704, 2368, 1, 256]
    - [36, 8058.35]
  - - [2944, 448, 1, 1280]
    - [19, 7996.45]
  - - [5888, 2368, 1, 3328]
    - [39, 10315.2]
  - - [4288, 5056, 1, 256]
    - [36, 9985.11]
  - - [4288, 448, 1, 1280]
    - [39, 8909.11]
  - - [5888, 704, 1, 3328]
    - [39, 10088.9]
  - - [4288, 3584, 1, 3328]
    - [39, 10417.3]
  - - [2944, 64, 1, 256]
    - [5, 3966.65]
  - - [1024, 6784, 1, 3328]
    - [39, 10171.3]
  - - [1408, 1024, 1, 256]
    - [39, 7927.38]
  - - [448, 1024, 1, 256]
    - [39, 5872.03]
  - - [6784, 6784, 1, 3328]
    - [41, 10535.5]
  - - [1024, 448, 1, 1280]
    - [28, 7050.94]
  - - [704, 5056, 1, 3328]
    - [39, 9853.75]
  - - [256, 2368, 1, 1280]
    - [19, 6749.71]
  - - [3584, 5056, 1, 3328]
    - [41, 10366.7]
  - - [2368, 2944, 1, 3328]
    - [39, 10203.7]
  - - [448, 448, 1, 1280]
    - [27, 5057.11]
  - - [2368, 3584, 1, 256]
    - [36, 9657.96]
  - - [1024, 256, 1, 1280]
    - [39, 5890.88]
  - - [128, 5056, 1, 1280]
    - [6, 8089.6]
  - - [3584, 2368, 1, 1280]
    - [39, 10126.1]
  - - [1856, 1856, 1, 256]
    - [41, 8875.33]
  - - [4288, 1408, 1, 3328]
    - [39, 9923.77]
  - - [3584, 64, 1, 3328]
    - [27, 6066.14]
  - - [1, 1, 1, 1]
    - [44, 9.12409e-05]
  - - [256, 1024, 1, 3328]
    - [28, 6210.27]
  - - [1856, 64, 1, 3328]
    - [11, 4644.19]
  - - [5888, 1408, 1, 3328]
    - [39, 10274.9]
  - - [256, 5056, 1, 256]
    - [36, 8185.52]
  - - [1856, 64, 1, 1280]
    - [33, 4359.05]
  - - [1408, 256, 1, 256]
    - [39, 4669.77]
  - - [2368, 5056, 1, 256]
    - [17, 9912.65]
  - - [128, 5888, 1, 3328]
    - [39, 8471.35]
  - - [1024, 5056, 1, 256]
    - [41, 9576.59]
  - - [2368, 1408, 1, 3328]
    - [39, 9902.24]
  - - [5888, 448, 1, 256]
    - [36, 8526.3]
  - - [6784, 5056, 1, 1280]
    - [39, 10451.5]
  - - [4288, 6784, 1, 1280]
    - [36, 10455.5]
  - - [2368, 448, 1, 3328]
    - [39, 7671.13]
  - - [1024, 128, 1, 256]
    - [12, 3355.44]
  - - [448, 128, 1, 1280]
    - [12, 2433.7]
  - - [1024, 64, 1, 3328]
    - [30, 2976.31]
  - - [64, 3584, 1, 1280]
    - [27, 5752.38]
  - - [6784, 1408, 1, 256]
    - [36, 9706.59]
  - - [5888, 4288, 1, 256]
    - [36, 9969.51]
  - - [5056, 5888, 1, 256]
    - [37, 10134.4]
  - - [2368, 1024, 1, 256]
    - [36, 8526.88]
  - - [1856, 6784, 1, 1280]
    - [36, 10169.0]
  - - [3584, 128, 1, 1280]
    - [24, 7161.01]
  - - [128, 64, 1, 256]
    - [2, 216.648]
  - - [1408, 448, 1, 256]
    - [39, 6098.21]
  - - [64, 256, 1, 3328]
    - [14, 794.382]
  - - [6784, 448, 1, 3328]
    - [39, 9745.05]
  - - [5056, 1856, 1, 1280]
    - [39, 10275.3]
  - - [1408, 1024, 1, 3328]
    - [39, 8838.59]
  - - [2368, 256, 1, 3328]
    - [19, 6914.81]
  - - [5888, 3584, 1, 1280]
    - [36, 10370.5]
  - - [5888, 128, 1, 1280]
    - [19, 8304.84]
  - - [1024, 2944, 1, 256]
    - [41, 8965.52]
  - - [448, 6784, 1, 1280]
    - [39, 9633.09]
  - - [256, 3584, 1, 1280]
    - [19, 7965.31]
  - - [704, 5056, 1, 256]
    - [17, 9163.49]
  - - [3584, 1024, 1, 3328]
    - [39, 10156.5]
  - - [2944, 1856, 1, 1280]
    - [39, 10115.1]
  - - [5056, 256, 1, 256]
    - [16, 8234.34]
  - - [128, 5888, 1, 256]
    - [0, 7199.18]
  - - [2368, 3584, 1, 3328]
    - [39, 10205.7]
  - - [3584, 5888, 1, 3328]
    - [39, 10445.7]
  - - [2944, 3584, 1, 1280]
    - [39, 10163.2]
  - - [1856, 5888, 1, 1280]
    - [39, 10268.4]
  - - [256, 256, 1, 1280]
    - [30, 2744.96]
  - - [4288, 1408, 1, 256]
    - [37, 9392.35]
  - - [3584, 64, 1, 256]
    - [21, 4475.63]
  - - [64, 1856, 1, 3328]
    - [11, 4639.83]
  - - [1408, 128, 1, 256]
    - [22, 3844.78]
  - - [4288, 2368, 1, 1280]
    - [39, 10265.6]
  - - [2944, 5056, 1, 256]
    - [36, 9919.14]
  - - [256, 128, 1, 3328]
    - [15, 1596.19]
  - - [6784, 2368, 1, 256]
    - [38, 9949.0]
  - - [1408, 448, 1, 3328]
    - [19, 7197.11]
  - - [4288, 1856, 1, 256]
    - [36, 9613.93]
  - - [1856, 2944, 1, 256]
    - [36, 9570.37]
  - - [64, 5888, 1, 1280]
    - [18, 6669.59]
  - - [1856, 1408, 1, 1280]
    - [39, 9819.66]
  - - [128, 704, 1, 256]
    - [8, 2383.13]
  - - [1024, 4288, 1, 1280]
    - [39, 9972.28]
  - - [2368, 5056, 1, 3328]
    - [39, 10382.1]
  - - [4288, 1024, 1, 3328]
    - [39, 10081.8]
  - - [1024, 5056, 1, 3328]
    - [39, 10156.0]
  - - [1024, 1856, 1, 3328]
    - [39, 8935.67]
  - - [704, 704, 1, 1280]
    - [19, 7602.93]
  - - [128, 2368, 1, 1280]
    - [5, 5957.82]
  - - [3584, 256, 1, 1280]
    - [19, 7978.3]
  - - [5888, 64, 1, 1280]
    - [23, 6978.37]
  - - [128, 704, 1, 3328]
    - [33, 3778.89]
  - - [3584, 2944, 1, 3328]
    - [39, 10245.7]
  - - [128, 1856, 1, 256]
    - [21, 4552.2]
  - - [64, 4288, 1, 256]
    - [4, 4412.98]
  - - [5888, 2944, 1, 256]
    - [36, 9861.3]
  - - [5056, 128, 1, 1280]
    - [6, 8083.28]
  - - [448, 1856, 1, 3328]
    - [19, 7386.28]
  - - [5056, 4288, 1, 256]
    - [36, 9982.24]
  - - [1024, 448, 1, 256]
    - [19, 5848.63]
  - - [1024, 3584, 1, 256]
    - [41, 9417.84]
  - - [2944, 128, 1, 1280]
    - [23, 6994.56]
  - - [64, 256, 1, 256]
    - [8, 480.998]
  - - [704, 256, 1, 3328]
    - [29, 4255.02]
  - - [5056, 1408, 1, 256]
    - [37, 9567.54]
  - - [5888, 5888, 1, 1280]
    - [39, 10410.0]
  - - [448, 5888, 1, 1280]
    - [39, 9092.04]
  - - [1, 1, 1, 256]
    - [45, 0.00688172]
  - - [4288, 704, 1, 1280]
    - [39, 9571.96]
  - - [2944, 1408, 1, 256]
    - [38, 9420.84]
  - - [256, 2944, 1, 1280]
    - [39, 8299.16]
  - - [2368, 5888, 1, 3328]
    - [39, 10318.3]
  - - [704, 1024, 1, 3328]
    - [19, 8122.79]
  - - [2368, 1856, 1, 1280]
    - [39, 9980.17]
  - - [1856, 448, 1, 1280]
    - [19, 7261.93]
  - - [128, 6784, 1, 256]
    - [6, 7255.16]
  - - [5888, 4288, 1, 3328]
    - [39, 10453.1]
  - - [1856, 128, 1, 256]
    - [3, 4663.91]
  - - [5056, 448, 1, 256]
    - [36, 8732.87]
  - - [1856, 5056, 1, 1280]
    - [39, 10268.3]
  - - [2944, 1024, 1, 1280]
    - [39, 9558.98]
  - - [2368, 4288, 1, 256]
    - [36, 9804.71]
  - - [1024, 2368, 1, 3328]
    - [39, 9252.72]
  - - [4288, 64, 1, 3328]
    - [25, 5657.29]
  - - [704, 1408, 1, 256]
    - [39, 7606.58]
  - - [4288, 5888, 1, 3328]
    - [39, 10451.0]
  - - [448, 2944, 1, 1280]
    - [39, 7966.27]
  - - [1024, 2944, 1, 3328]
    - [39, 9671.47]
  - - [256, 6784, 1, 1280]
    - [39, 9101.64]
  - - [1856, 3584, 1, 256]
    - [37, 9588.33]
  - - [128, 448, 1, 3328]
    - [8, 2609.97]
  - - [1856, 256, 1, 256]
    - [19, 6033.47]
  - - [5056, 128, 1, 256]
    - [6, 6949.45]
  - - [256, 5888, 1, 1280]
    - [39, 9087.15]
  - - [6784, 128, 1, 1280]
    - [23, 8143.98]
  - - [64, 1408, 1, 256]
    - [11, 2443.72]
  - - [2944, 2368, 1, 256]
    - [36, 9611.57]
  - - [1856, 448, 1, 256]
    - [39, 6489.66]
  - - [1024, 1856, 1, 256]
    - [20, 8163.41]
  - - [6784, 3584, 1, 3328]
    - [39, 10489.3]
  - - [2944, 64, 1, 3328]
    - [5, 5797.42]
  - - [1024, 5888, 1, 3328]
    - [39, 10324.8]
  - - [1408, 2368, 1, 1280]
    - [39, 9795.52]
  - - [128, 1408, 1, 1280]
    - [5, 5242.88]
  - - [128, 1856, 1, 3328]
    - [31, 6290.81]
  - - [2944, 2944, 1, 256]
    - [37, 9660.36]
  - - [6784, 256, 1, 256]
    - [36, 8307.1]
  - - [128, 4288, 1, 1280]
    - [3, 6975.24]
  - - [5888, 1408, 1, 256]
    - [41, 9778.49]
  - - [128, 128, 1, 256]
    - [7, 494.611]
  - - [448, 704, 1, 3328]
    - [19, 5075.57]
  - - [448, 1856, 1, 256]
    - [36, 6442.52]
  - - [1856, 704, 1, 3328]
    - [39, 9430.19]
  - - [5888, 6784, 1, 3328]
    - [39, 10508.0]
  - - [704, 4288, 1, 1280]
    - [39, 9571.96]
  - - [4096, 7000, 1, 4096]
    - [69, 17060.9]
  - - [5124, 9124, 1, 1760]
    - [68, 17597.3]
  - - [1760, 32, 1, 1760]
    - [51, 2065.07]
  - - [1024, 1500, 1, 1536]
    - [62, 14247.0]
  - - [512, 24000, 1, 2048]
    - [71, 15569.1]
  - - [3072, 24000, 1, 1024]
    - [69, 17692.8]
  - - [1024, 3000, 1, 2560]
    - [69, 16608.2]
  - - [512, 3136, 1, 2048]
    - [79, 12702.2]
  - - [7680, 4, 1, 2560]
    - [51, 1128.63]
  - - [64, 193600, 1, 64]
    - [68, 13431.3]
  - - [8448, 1500, 1, 2816]
    - [68, 16834.1]
  - - [2560, 7000, 1, 2560]
    - [68, 17276.5]
  - - [3072, 16, 1, 1024]
    - [47, 1695.81]
  - - [512, 48000, 1, 2048]
    - [71, 15995.8]
  - - [1760, 64, 1, 1760]
    - [64, 4157.85]
  - - [1024, 16, 1, 512]
    - [49, 440.578]
  - - [196, 256, 64, 1024]
    - [80, 8949.31]
  - - [512, 48000, 1, 1536]
    - [69, 17684.6]
  - - [2560, 32, 1, 2560]
    - [51, 3037.59]
  - - [4608, 1500, 1, 1536]
    - [69, 16508.3]
  - - [2048, 128, 1, 2048]
    - [66, 8473.34]
  - - [1024, 24000, 1, 2560]
    - [68, 17746.8]
  - - [4608, 3000, 1, 1536]
    - [69, 16899.3]
  - - [5124, 9124, 1, 2048]
    - [69, 16332.6]
  - - [2048, 16, 1, 2048]
    - [50, 1217.5]
  - - [1024, 700, 1, 512]
    - [61, 9400.66]
  - - [3072, 1, 1, 128]
    - [47, 57.8259]
  - - [5124, 700, 1, 2560]
    - [69, 14715.1]
  - - [8448, 16, 1, 2816]
    - [48, 4678.38]
  - - [6144, 6000, 1, 2560]
    - [63, 16507.6]
  - - [4608, 32, 1, 1536]
    - [47, 5128.9]
  - - [3072, 64, 1, 1024]
    - [59, 6403.52]
  - - [512, 16, 1, 512]
    - [49, 220.289]
  - - [7680, 2, 1, 2560]
    - [51, 566.267]
  - - [4224, 1, 1, 128]
    - [47, 78.586]
  - - [7680, 1, 1, 2560]
    - [51, 283.46]
  - - [128, 1500, 1, 1280]
    - [47, 6536.17]
  - - [1024, 1500, 1, 2816]
    - [62, 14522.5]
  - - [6144, 2, 1, 2560]
    - [51, 450.419]
  - - [8448, 48000, 1, 2816]
    - [69, 15518.5]
  - - [512, 6000, 1, 2048]
    - [72, 12121.3]
  - - [4224, 1500, 1, 176]
    - [57, 14023.3]
  - - [1024, 6000, 1, 2816]
    - [68, 17591.4]
  - - [1024, 48000, 1, 1536]
    - [69, 18080.3]
  - - [1024, 48000, 1, 2560]
    - [68, 18254.9]
  - - [4096, 32, 1, 4096]
    - [52, 4827.98]
  - - [512, 16, 1, 500000]
    - [49, 330.658]
  - - [2560, 128, 1, 2560]
    - [64, 8673.08]
  - - [4608, 24000, 1, 1536]
    - [68, 18298.6]
  - - [512, 2, 1, 500000]
    - [49, 41.3314]
  - - [7680, 48000, 1, 2560]
    - [69, 15645.3]
  - - [3072, 48000, 1, 1024]
    - [69, 17986.4]
  - - [1760, 16, 1, 1760]
    - [47, 1035.99]
  - - [1024, 1500, 1, 2048]
    - [65, 11136.1]
  - - [1024, 16, 1, 500000]
    - [49, 661.008]
  - - [64, 193600, 1, 256]
    - [73, 15677.8]
  - - [1024, 3000, 1, 2048]
    - [70, 12173.9]
  - - [6144, 4, 1, 2560]
    - [51, 904.985]
  - - [1024, 6000, 1, 2048]
    - [71, 14556.8]
  - - [512, 24000, 1, 2816]
    - [68, 17783.8]
  - - [6144, 48000, 1, 2560]
    - [71, 14434.6]
  - - [1760, 7000, 1, 1760]
    - [58, 16687.6]
  - - [8448, 3000, 1, 2816]
    - [68, 17630.2]
  - - [3072, 4, 1, 1024]
    - [47, 423.953]
  - - [4608, 48000, 1, 1536]
    - [68, 18437.1]
  - - [2048, 32, 1, 2048]
    - [67, 2407.06]
  - - [7680, 1500, 1, 2560]
    - [69, 16260.4]
  - - [4096, 128, 1, 4096]
    - [60, 11511.0]
  - - [4608, 16, 1, 1536]
    - [51, 2655.87]
  - - [512, 3000, 1, 1536]
    - [62, 14260.7]
  - - [3072, 2, 1, 1024]
    - [47, 214.872]
  - - [8448, 1, 1, 2816]
    - [48, 289.834]
  - - [1024, 3000, 1, 2816]
    - [68, 17002.3]
  - - [128, 1, 1, 1408]
    - [47, 4.75274]
  - - [64, 1, 1, 1216]
    - [49, 2.11939]
  - - [1024, 2, 1, 512]
    - [49, 55.0723]
  - - [1024, 4, 1, 500000]
    - [49, 165.084]
  - - [6144, 1, 1, 2560]
    - [51, 226.768]
  - - [5124, 9124, 1, 2560]
    - [69, 17113.5]
  - - [512, 48000, 1, 2816]
    - [68, 18060.4]
  - - [512, 3000, 1, 2816]
    - [62, 14530.3]
  - - [1024, 24000, 1, 1536]
    - [69, 17629.1]
  - - [7680, 6000, 1, 2560]
    - [68, 17726.0]
  - - [1760, 128, 1, 1760]
    - [66, 7497.97]
  - - [512, 1500, 1, 2816]
    - [61, 11273.4]
  - - [512, 1, 1, 512]
    - [53, 16.1419]
  - - [512, 6000, 1, 2560]
    - [69, 16656.0]
  - - [512, 8, 1, 500000]
    - [49, 165.328]
  - - [512, 24000, 1, 2560]
    - [69, 17561.4]
  - - [6144, 3000, 1, 2560]
    - [71, 16106.6]
  - - [1024, 24000, 1, 2816]
    - [68, 18138.0]
  - - [2048, 7000, 1, 2048]
    - [71, 15826.5]
  - - [7680, 3000, 1, 2560]
    - [63, 16179.8]
  - - [1024, 4, 1, 512]
    - [49, 110.609]
  - - [5124, 700, 1, 2048]
    - [71, 13074.5]
  - - [5124, 9124, 1, 4096]
    - [63, 15808.6]
  - - [4096, 64, 1, 4096]
    - [67, 8409.63]
  - - [256, 193600, 1, 64]
    - [55, 14460.0]
  - - [7680, 32, 1, 2560]
    - [54, 8501.97]
  - - [2560, 64, 1, 2560]
    - [59, 5877.67]
  - - [3072, 128, 1, 1024]
    - [64, 9514.49]
  - - [8448, 6000, 1, 2816]
    - [69, 17792.5]
  - - [7680, 64, 1, 2560]
    - [49, 11163.0]
  - - [5124, 1500, 1, 2560]
    - [69, 16136.5]
  - - [1024, 1500, 1, 2560]
    - [62, 14448.0]
  - - [512, 4, 1, 512]
    - [53, 64.251]
  - - [1024, 6000, 1, 2560]
    - [69, 17205.6]
  - - [3072, 32, 1, 1024]
    - [67, 3364.41]
  - - [6144, 32, 1, 2560]
    - [59, 6883.43]
  - - [196, 1024, 64, 256]
    - [81, 12380.8]
  - - [512, 50176, 1, 128]
    - [75, 15888.7]
  - - [4608, 1, 1, 1536]
    - [51, 165.681]
  - - [1024, 32, 1, 512]
    - [49, 907.858]
  - - [7680, 24000, 1, 2560]
    - [69, 17224.8]
  - - [8448, 4, 1, 2816]
    - [51, 1155.96]
  - - [512, 1, 1, 500000]
    - [49, 20.6657]
  - - [176, 1500, 1, 1408]
    - [49, 6743.69]
  - - [512, 3000, 1, 2560]
    - [62, 14469.2]
  - - [8448, 24000, 1, 2816]
    - [69, 14526.0]
  - - [4608, 2, 1, 1536]
    - [51, 329.511]
  - - [512, 6000, 1, 1536]
    - [69, 16415.9]
  - - [7680, 128, 1, 2560]
    - [56, 13827.4]
  - - [3072, 6000, 1, 1024]
    - [69, 16775.4]
  - - [3072, 1500, 1, 128]
    - [68, 12889.5]
  - - [2048, 3136, 1, 512]
    - [77, 15706.6]
  - - [1024, 3000, 1, 1536]
    - [69, 16365.8]
  - - [512, 4, 1, 500000]
    - [49, 82.6644]
  - - [512, 6000, 1, 2816]
    - [69, 16718.4]
  - - [128, 50176, 1, 512]
    - [74, 15938.0]
  - - [256, 12544, 1, 1024]
    - [78, 14000.1]
  - - [1024, 12544, 1, 256]
    - [76, 16382.7]
  - - [512, 48000, 1, 2560]
    - [69, 17747.2]
  - - [2560, 16, 1, 2560]
    - [47, 1534.8]
  - - [2048, 64, 1, 2048]
    - [67, 4719.33]
  - - [512, 2, 1, 512]
    - [53, 32.1255]
  - - [1024, 1, 1, 512]
    - [49, 27.5361]
  - - [512, 1500, 1, 2560]
    - [61, 11050.4]
  - - [512, 24000, 1, 1536]
    - [69, 17469.8]
  - - [1024, 1, 1, 500000]
    - [49, 41.1425]
  - - [6144, 16, 1, 2560]
    - [51, 3615.78]
  - - [1024, 24000, 1, 2048]
    - [71, 15988.1]
  - - [4096, 16, 1, 4096]
    - [52, 2507.81]
  - - [512, 32, 1, 512]
    - [49, 455.903]
  - - [5124, 1500, 1, 2048]
    - [71, 14375.8]
  - - [3072, 1500, 1, 1024]
    - [62, 14683.2]
  - - [1024, 2, 1, 500000]
    - [49, 82.5046]
  - - [1024, 8, 1, 500000]
    - [49, 330.528]
  - - [7680, 16, 1, 2560]
    - [51, 4514.54]
  - - [6144, 1500, 1, 2560]
    - [69, 16981.2]
  - - [3072, 1, 1, 1024]
    - [47, 107.143]
  - - [1024, 48000, 1, 2816]
    - [68, 18584.6]
  - - [8448, 2, 1, 2816]
    - [51, 579.103]
  - - [4608, 4, 1, 1536]
    - [51, 659.021]
  - - [1024, 6000, 1, 1536]
    - [69, 17098.8]
  - - [8448, 32, 1, 2816]
    - [49, 7214.43]
  - - [512, 3000, 1, 2048]
    - [71, 11148.7]
  - - [6144, 24000, 1, 2560]
    - [71, 15954.4]
  - - [4608, 6000, 1, 1536]
    - [69, 17669.4]
  - - [1024, 1024, 1, 1024]
    - [71, 13068.9]
  - - [512, 1500, 1, 2048]
    - [71, 9265.22]
  - - [512, 1500, 1, 1536]
    - [61, 10818.5]
  - - [128, 1, 1, 1024]
    - [47, 4.64136]
  - - [3072, 3000, 1, 1024]
    - [71, 15741.2]
  - - [1024, 48000, 1, 2048]
    - [69, 16800.7]
  - - [3136, 64, 128, 64]
    - [99, 15223.8]
  - - [784, 512, 64, 128]
    - [92, 18907.2]
  - - [3136, 256, 64, 64]
    - [99, 18012.3]
  - - [12544, 1024, 1, 256]
    - [95, 20780.7]
  - - [784, 128, 128, 512]
    - [94, 19837.9]
  - - [784, 512, 256, 128]
    - [98, 18471.7]
  - - [3136, 64, 64, 256]
    - [96, 19306.8]
  - - [3136, 512, 1, 2048]
    - [97, 15558.0]
  - - [12544, 256, 1, 1024]
    - [100, 17648.9]
  - - [3136, 2048, 1, 512]
    - [93, 19499.1]
  - - [3136, 256, 256, 64]
    - [102, 18095.6]
  - - [3136, 64, 128, 256]
    - [93, 19910.0]
  - - [784, 128, 64, 512]
    - [94, 19325.0]
  - - [3136, 64, 256, 64]
    - [99, 15429.5]
  - - [784, 512, 128, 128]
    - [92, 19136.0]
  - - [3136, 64, 64, 64]
    - [101, 14680.1]
  - - [784, 128, 256, 512]
    - [94, 20166.4]
  - - [3136, 64, 256, 256]
    - [96, 20048.3]
  - - [3136, 256, 128, 64]
    - [91, 18309.2]
  - - [512, 512, 64, 64]
    - [103, 11941.1]
  - - [512, 512, 256, 64]
    - [104, 12704.0]
  - - [512, 512, 128, 64]
    - [103, 12404.6]
  - - [512, 512, 40, 64]
    - [103, 11915.6]
  - - [1024, 1024, 64, 96]
    - [104, 13306.5]
  - - [1024, 1024, 128, 96]
    - [105, 13341.7]
  - - [1024, 1024, 256, 64]
    - [104, 12881.6]
  - - [1024, 1024, 32, 64]
    - [103, 12370.3]
  - - [1024, 1024, 64, 64]
    - [104, 12692.0]
  - - [64, 512, 64, 512]
    - [106, 11355.1]
  - - [64, 512, 256, 512]
    - [103, 12874.6]
  - - [64, 512, 128, 512]
    - [107, 12223.8]
  - - [64, 512, 40, 512]
    - [106, 10070.4]
  - - [96, 1024, 64, 1024]
    - [108, 11152.3]
  - - [96, 1024, 128, 1024]
    - [109, 12198.9]
  - - [64, 1024, 256, 1024]
    - [107, 12875.4]
  - - [64, 1024, 32, 1024]
    - [107, 10364.3]
  - - [64, 1024, 64, 1024]
    - [107, 11786.4]
  - - [1024, 26656, 1, 1024]
    - [110, 12851.6]
  - - [1024, 26624, 1, 1024]
    - [111, 12881.2]
  - - [1024, 484, 1, 1024]
    - [112, 7009.82]
  - - [1024, 23040, 1, 1024]
    - [111, 12882.4]
  - - [1024, 20480, 1, 1024]
    - [110, 12824.1]
  - - [1024, 428, 1, 1024]
    - [113, 7509.88]
  - - [1024, 18944, 1, 1024]
    - [111, 12822.9]
  - - [1024, 288, 1, 1024]
    - [114, 5115.0]
  - - [1024, 304, 1, 1024]
    - [114, 5377.31]
  - - [1024, 444, 1, 1024]
    - [114, 7637.27]
  - - [1024, 15360, 1, 1024]
    - [111, 12802.1]
  - - [1024, 308, 1, 1024]
    - [114, 5440.72]
  - - [1024, 404, 1, 1024]
    - [113, 7079.29]
  - - [1024, 14336, 1, 1024]
    - [111, 12753.1]
  - - [1024, 324, 1, 1024]
    - [113, 5762.19]
  - - [1024, 384, 1, 1024]
    - [110, 6710.89]
  - - [1024, 12800, 1, 1024]
    - [110, 12693.6]
  - - [1024, 344, 1, 1024]
    - [113, 6093.08]
  - - [1024, 464, 1, 1024]
    - [115, 7918.93]
  - - [1024, 340, 1, 1024]
    - [113, 6038.55]
  - - [1024, 436, 1, 1024]
    - [113, 7549.19]
  - - [1024, 460, 1, 1024]
    - [114, 8071.37]
  - - [1024, 336, 1, 1024]
    - [114, 5943.35]
  - - [1024, 440, 1, 1024]
    - [113, 7658.92]
  - - [1024, 10752, 1, 1024]
    - [111, 12664.3]
  - - [1024, 272, 1, 1024]
    - [114, 4785.45]
  - - [1024, 312, 1, 1024]
    - [114, 5518.82]
  - - [1024, 356, 1, 1024]
    - [110, 6229.86]
  - - [1024, 396, 1, 1024]
    - [113, 6883.89]
  - - [1024, 268, 1, 1024]
    - [113, 4753.36]
  - - [1024, 360, 1, 1024]
    - [113, 6342.19]
  - - [1024, 296, 1, 1024]
    - [113, 5221.71]
  - - [1024, 432, 1, 1024]
    - [113, 7509.7]
  - - [1024, 280, 1, 1024]
    - [113, 4952.79]
  - - [1024, 320, 1, 1024]
    - [114, 5691.05]
  - - [1024, 456, 1, 1024]
    - [114, 8011.91]
  - - [1024, 468, 1, 1024]
    - [114, 8008.05]
  - - [1024, 260, 1, 1024]
    - [113, 4642.88]
  - - [1024, 364, 1, 1024]
    - [113, 6404.05]
  - - [1024, 412, 1, 1024]
    - [113, 7143.08]
  - - [1024, 472, 1, 1024]
    - [114, 8270.85]
  - - [1024, 348, 1, 1024]
    - [113, 6180.63]
  - - [1024, 408, 1, 1024]
    - [113, 7197.49]
  - - [1024, 9280, 1, 4096]
    - [116, 12323.0]
  - - [4096, 2912, 1, 1024]
    - [117, 12263.8]
  - - [1024, 9312, 1, 1024]
    - [111, 11784.7]
  - - [4096, 7632, 1, 1024]
    - [118, 12445.1]
  - - [4096, 6512, 1, 1024]
    - [117, 12696.3]
  - - [4096, 1856, 1, 1024]
    - [113, 12246.1]
  - - [1024, 8024, 1, 1024]
    - [119, 11496.7]
  - - [4096, 7488, 1, 1024]
    - [120, 12544.7]
  - - [1024, 5984, 1, 33712]
    - [116, 11235.2]
  - - [4096, 8784, 1, 1024]
    - [118, 12322.9]
  - - [4096, 8320, 1, 1024]
    - [117, 12694.1]
  - - [1024, 10168, 1, 1024]
    - [117, 12420.7]
  - - [1024, 4472, 1, 1024]
    - [121, 10588.0]
  - - [4096, 5888, 1, 1024]
    - [122, 12217.5]
  - - [1024, 6976, 1, 33712]
    - [123, 11243.3]
  - - [1024, 1344, 1, 1024]
    - [110, 10663.5]
  - - [1024, 7424, 1, 1024]
    - [117, 11695.6]
  - - [1024, 7208, 1, 4096]
    - [124, 11368.3]
  - - [4096, 9960, 1, 1024]
    - [125, 12599.0]
  - - [1024, 8288, 1, 1024]
    - [126, 12367.0]
  - - [1024, 7344, 1, 33712]
    - [127, 10893.8]
  - - [1024, 10000, 1, 1024]
    - [111, 12592.1]
  - - [1024, 7560, 1, 4096]
    - [124, 10656.6]
  - - [4096, 7752, 1, 1024]
    - [128, 12330.5]
  - - [1024, 9176, 1, 33712]
    - [129, 10706.6]
  - - [1024, 9048, 1, 1024]
    - [111, 12558.9]
  - - [4096, 3600, 1, 1024]
    - [125, 11329.8]
  - - [1024, 9272, 1, 33712]
    - [130, 10546.5]
  - - [1024, 9760, 1, 1024]
    - [111, 12587.4]
  - - [1024, 9800, 1, 4096]
    - [131, 11015.6]
  - - [4096, 9800, 1, 1024]
    - [125, 12453.4]
  - - [1024, 7752, 1, 4096]
    - [117, 11645.8]
  - - [1024, 9800, 1, 1024]
    - [132, 12168.5]
  - - [1024, 9640, 1, 4096]
    - [133, 11919.0]
  - - [1024, 8616, 1, 4096]
    - [127, 12280.8]
  - - [4096, 4920, 1, 1024]
    - [117, 12598.2]
  - - [4096, 5760, 1, 1024]
    - [119, 12185.8]
  - - [1024, 9696, 1, 4096]
    - [134, 11243.2]
  - - [1024, 8288, 1, 4096]
    - [117, 11584.3]
  - - [4096, 2304, 1, 1024]
    - [117, 12306.0]
  - - [1024, 9696, 1, 33712]
    - [135, 10362.1]
  - - [1024, 276, 1, 1024]
    - [114, 4823.45]
  - - [1024, 9512, 1, 1024]
    - [117, 12486.3]
  - - [1024, 9512, 1, 4096]
    - [131, 11268.0]
  - - [1024, 5760, 1, 1024]
    - [117, 12352.3]
  - - [4096, 10200, 1, 1024]
    - [125, 12573.1]
  - - [1024, 7800, 1, 33712]
    - [123, 11123.3]
  - - [1024, 9968, 1, 4096]
    - [129, 12179.2]
  - - [1024, 284, 1, 1024]
    - [113, 5064.55]
  - - [4096, 9440, 1, 1024]
    - [125, 12685.5]
  - - [4096, 9520, 1, 1024]
    - [117, 12636.9]
  - - [1024, 9440, 1, 33712]
    - [136, 10426.1]
  - - [1024, 9752, 1, 1024]
    - [111, 12572.1]
  - - [4096, 8856, 1, 1024]
    - [120, 12412.0]
  - - [1024, 10000, 1, 4096]
    - [117, 12081.4]
  - - [1024, 8816, 1, 4096]
    - [127, 11396.3]
  - - [1024, 8424, 1, 4096]
    - [117, 11996.1]
  - - [1024, 3240, 1, 4096]
    - [129, 11607.0]
  - - [1024, 8568, 1, 4096]
    - [137, 11653.5]
  - - [1024, 9976, 1, 1024]
    - [117, 12485.1]
  - - [4096, 5640, 1, 1024]
    - [119, 12163.1]
  - - [1024, 8112, 1, 1024]
    - [134, 11753.8]
  - - [1024, 448, 1, 1024]
    - [114, 7665.83]
  - - [1024, 9840, 1, 4096]
    - [113, 11670.3]
  - - [4096, 9840, 1, 1024]
    - [125, 12590.5]
  - - [1024, 332, 1, 1024]
    - [114, 5880.53]
  - - [1024, 5104, 1, 1024]
    - [117, 11924.9]
  - - [1024, 8944, 1, 1024]
    - [138, 11189.3]
  - - [1024, 3400, 1, 1024]
    - [118, 10777.4]
  - - [1024, 4224, 1, 4096]
    - [137, 10930.3]
  - - [1024, 8648, 1, 4096]
    - [134, 11927.3]
  - - [4096, 8648, 1, 1024]
    - [117, 12623.6]
  - - [4096, 6128, 1, 1024]
    - [117, 12657.9]
  - - [1024, 7800, 1, 1024]
    - [119, 11751.2]
  - - [4096, 3360, 1, 1024]
    - [128, 11388.7]
  - - [4096, 9408, 1, 1024]
    - [125, 12629.3]
  - - [1024, 7392, 1, 1024]
    - [117, 12421.6]
  - - [1024, 3600, 1, 4096]
    - [139, 10609.5]
  - - [1024, 3600, 1, 1024]
    - [128, 10511.4]
  - - [4096, 3024, 1, 1024]
    - [125, 11303.6]
  - - [1024, 6400, 1, 33712]
    - [113, 11111.2]
  - - [1024, 8064, 1, 4096]
    - [129, 11947.1]
  - - [4096, 6816, 1, 1024]
    - [126, 12508.9]
  - - [1024, 9960, 1, 4096]
    - [134, 11903.9]
  - - [4096, 5984, 1, 1024]
    - [119, 12172.5]
  - - [4096, 8064, 1, 1024]
    - [128, 12283.5]
  - - [1024, 4608, 1, 33712]
    - [139, 11329.6]
  - - [1024, 4032, 1, 4096]
    - [110, 10939.9]
  - - [1024, 9240, 1, 4096]
    - [131, 10904.7]
  - - [4096, 6800, 1, 1024]
    - [117, 12274.1]
  - - [1024, 4536, 1, 4096]
    - [140, 11502.0]
  - - [1024, 6400, 1, 4096]
    - [135, 10476.9]
  - - [4096, 9176, 1, 1024]
    - [120, 12272.3]
  - - [1024, 5920, 1, 4096]
    - [117, 11947.2]
  - - [1024, 8960, 1, 33712]
    - [136, 10569.8]
  - - [4096, 5920, 1, 1024]
    - [117, 12625.2]
  - - [1024, 4160, 1, 4096]
    - [110, 10423.1]
  - - [1024, 2400, 1, 4096]
    - [129, 10125.4]
  - - [1024, 5920, 1, 1024]
    - [111, 12349.9]
  - - [1024, 6480, 1, 4096]
    - [117, 10759.4]
  - - [4096, 9656, 1, 1024]
    - [125, 12582.7]
  - - [1024, 392, 1, 1024]
    - [113, 6832.48]
  - - [1024, 6480, 1, 1024]
    - [117, 12038.9]
  - - [1024, 33792, 1, 1024]
    - [128, 12373.7]
  - - [1024, 8880, 1, 4096]
    - [117, 12116.9]
  - - [1024, 8008, 1, 1024]
    - [117, 12309.4]
  - - [1024, 8880, 1, 1024]
    - [141, 11342.0]
  - - [1024, 5984, 1, 4096]
    - [135, 11071.5]
  - - [1024, 7040, 1, 4096]
    - [134, 10725.5]
  - - [1024, 6960, 1, 33712]
    - [137, 11047.5]
  - - [4096, 8968, 1, 1024]
    - [117, 12663.8]
  - - [1024, 8120, 1, 1024]
    - [117, 12466.9]
  - - [1024, 9504, 1, 33712]
    - [136, 10592.1]
  - - [1024, 6816, 1, 4096]
    - [129, 11828.2]
  - - [1024, 9344, 1, 1024]
    - [111, 11832.0]
  - - [4096, 9384, 1, 1024]
    - [125, 12609.3]
  - - [4096, 10160, 1, 1024]
    - [117, 12653.5]
  - - [1024, 5760, 1, 4096]
    - [117, 10750.8]
  - - [1024, 6912, 1, 4096]
    - [134, 10458.5]
  - - [1024, 9168, 1, 4096]
    - [134, 11497.3]
  - - [1024, 10112, 1, 33712]
    - [129, 10289.2]
  - - [4096, 9168, 1, 1024]
    - [117, 12699.2]
  - - [4096, 2880, 1, 1024]
    - [117, 12558.8]
  - - [1024, 488, 1, 1024]
    - [112, 7075.57]
  - - [1024, 5400, 1, 1024]
    - [117, 12090.6]
  - - [1024, 6912, 1, 1024]
    - [119, 11738.4]
  - - [1024, 6816, 1, 1024]
    - [118, 11552.9]
  - - [1024, 9520, 1, 33712]
    - [136, 10585.6]
  - - [1024, 8352, 1, 4096]
    - [129, 12137.5]
  - - [1024, 9640, 1, 33712]
    - [134, 10242.5]
  - - [1024, 8568, 1, 1024]
    - [111, 12540.7]
  - - [4096, 4968, 1, 1024]
    - [142, 11934.8]
  - - [1024, 8448, 1, 1024]
    - [142, 11459.1]
  - - [1024, 8968, 1, 1024]
    - [138, 11254.8]
  - - [4096, 5800, 1, 1024]
    - [122, 12099.1]
  - - [1024, 5800, 1, 33712]
    - [113, 11083.1]
  - - [1024, 5440, 1, 1024]
    - [113, 11925.6]
  - - [4096, 9760, 1, 1024]
    - [125, 12646.2]
  - - [1024, 6624, 1, 33712]
    - [127, 11500.4]
  - - [1024, 5680, 1, 4096]
    - [129, 11741.8]
  - - [4096, 5680, 1, 1024]
    - [119, 12068.7]
  - - [1024, 8128, 1, 1024]
    - [125, 11368.6]
  - - [1024, 10040, 1, 4096]
    - [134, 11450.6]
  - - [1024, 8760, 1, 4096]
    - [118, 11071.4]
  - - [1024, 7872, 1, 1024]
    - [117, 12453.8]
  - - [1024, 6840, 1, 1024]
    - [119, 11626.6]
  - - [1024, 5680, 1, 1024]
    - [141, 12017.5]
  - - [1024, 9144, 1, 4096]
    - [117, 11342.6]
  - - [1024, 8512, 1, 4096]
    - [127, 11534.6]
  - - [4096, 7904, 1, 1024]
    - [117, 12682.7]
  - - [1024, 8512, 1, 1024]
    - [129, 12289.9]
  - - [1024, 7896, 1, 1024]
    - [119, 11335.6]
  - - [1024, 7296, 1, 4096]
    - [143, 10887.7]
  - - [1024, 9920, 1, 33712]
    - [129, 10134.1]
  - - [1024, 7168, 1, 33712]
    - [127, 11672.3]
  - - [1024, 2040, 1, 4096]
    - [113, 11531.5]
  - - [4096, 10040, 1, 1024]
    - [125, 12562.9]
  - - [1024, 8704, 1, 33712]
    - [134, 10748.9]
  - - [1024, 7192, 1, 4096]
    - [129, 12082.4]
  - - [1024, 8192, 1, 33712]
    - [123, 10822.9]
  - - [1024, 10064, 1, 1024]
    - [110, 12492.7]
  - - [1024, 5600, 1, 4096]
    - [134, 10435.0]
  - - [1024, 9408, 1, 1024]
    - [119, 10883.7]
  - - [1024, 2720, 1, 1024]
    - [144, 9914.2]
  - - [1024, 5600, 1, 1024]
    - [141, 11857.9]
  - - [1024, 8232, 1, 4096]
    - [116, 11308.3]
  - - [1024, 8648, 1, 1024]
    - [126, 12235.6]
  - - [1024, 7888, 1, 1024]
    - [119, 11311.7]
  - - [4096, 8232, 1, 1024]
    - [128, 12361.6]
  - - [1024, 8000, 1, 1024]
    - [126, 12292.8]
  - - [1024, 9440, 1, 4096]
    - [131, 11072.9]
  - - [4096, 4048, 1, 1024]
    - [117, 12422.1]
  - - [4096, 2392, 1, 1024]
    - [119, 10997.0]
  - - [1024, 7840, 1, 1024]
    - [119, 11836.0]
  - - [1024, 9024, 1, 4096]
    - [121, 11106.8]
  - - [1024, 8216, 1, 4096]
    - [117, 12115.1]
  - - [1024, 3120, 1, 33712]
    - [137, 9044.13]
  - - [4096, 8512, 1, 1024]
    - [118, 12417.2]
  - - [1024, 4488, 1, 33712]
    - [110, 11170.0]
  - - [1024, 5800, 1, 1024]
    - [142, 11207.7]
  - - [4096, 9048, 1, 1024]
    - [125, 12480.9]
  - - [1024, 800, 1, 1024]
    - [111, 9328.97]
  - - [1024, 9720, 1, 4096]
    - [113, 11569.3]
  - - [4096, 8096, 1, 1024]
    - [128, 12315.0]
  - - [1024, 6968, 1, 4096]
    - [129, 11866.5]
  - - [1024, 8096, 1, 33712]
    - [127, 10738.9]
  - - [1024, 6664, 1, 4096]
    - [129, 11944.8]
  - - [1024, 8976, 1, 1024]
    - [110, 11735.6]
  - - [1024, 8832, 1, 4096]
    - [118, 11053.9]
  - - [1024, 8840, 1, 4096]
    - [117, 12000.1]
  - - [4096, 8832, 1, 1024]
    - [117, 12708.6]
  - - [1024, 7392, 1, 4096]
    - [117, 11983.7]
  - - [4096, 5936, 1, 1024]
    - [132, 12176.9]
  - - [1024, 8832, 1, 33712]
    - [130, 10817.4]
  - - [4096, 9152, 1, 1024]
    - [117, 12742.0]
  - - [1024, 10168, 1, 4096]
    - [117, 12036.2]
  - - [1024, 8832, 1, 1024]
    - [117, 11714.5]
  - - [4096, 9512, 1, 1024]
    - [122, 12244.4]
  - - [1024, 4536, 1, 33712]
    - [129, 11165.8]
  - - [1024, 4560, 1, 1024]
    - [145, 11406.2]
  - - [1024, 6072, 1, 33712]
    - [127, 10925.0]
  - - [1024, 10152, 1, 1024]
    - [132, 12321.9]
  - - [4096, 6624, 1, 1024]
    - [122, 12242.2]
  - - [1024, 7632, 1, 4096]
    - [129, 11103.8]
  - - [1024, 7776, 1, 4096]
    - [129, 11152.0]
  - - [1024, 6072, 1, 1024]
    - [110, 12302.8]
  - - [4096, 7072, 1, 1024]
    - [119, 12284.7]
  - - [4096, 9072, 1, 1024]
    - [125, 12667.0]
  - - [1024, 4368, 1, 4096]
    - [129, 11741.6]
  - - [1024, 9656, 1, 4096]
    - [134, 11240.3]
  - - [1024, 7360, 1, 1024]
    - [117, 12347.2]
  - - [1024, 9072, 1, 1024]
    - [146, 11556.8]
  - - [1024, 328, 1, 1024]
    - [114, 5778.44]
  - - [1024, 4536, 1, 1024]
    - [117, 12188.2]
  - - [4096, 8400, 1, 1024]
    - [118, 12386.5]
  - - [4096, 9696, 1, 1024]
    - [117, 12695.4]
  - - [1024, 16384, 1, 1024]
    - [117, 12596.6]
  - - [1024, 9744, 1, 33712]
    - [134, 10202.8]
  - - [1024, 4704, 1, 4096]
    - [129, 11504.1]
  - - [1024, 8960, 1, 4096]
    - [134, 11466.2]
  - - [1024, 7680, 1, 33712]
    - [137, 11538.1]
  - - [4096, 7200, 1, 1024]
    - [117, 12648.2]
  - - [1024, 8024, 1, 4096]
    - [132, 11112.2]
  - - [1024, 8960, 1, 1024]
    - [129, 12269.1]
  - - [1024, 6800, 1, 4096]
    - [134, 10923.6]
  - - [1024, 9840, 1, 1024]
    - [110, 11659.2]
  - - [1024, 800, 1, 4096]
    - [147, 8811.54]
  - - [4096, 10224, 1, 1024]
    - [125, 12639.5]
  - - [1024, 8200, 1, 1024]
    - [126, 12241.3]
  - - [1024, 7040, 1, 33712]
    - [137, 11342.6]
  - - [4096, 6864, 1, 1024]
    - [117, 12633.2]
  - - [4096, 9272, 1, 1024]
    - [125, 12613.3]
  - - [1024, 9856, 1, 33712]
    - [129, 10413.0]
  - - [1024, 6864, 1, 1024]
    - [111, 12411.0]
  - - [1024, 8112, 1, 33712]
    - [137, 10733.0]
  - - [1024, 7744, 1, 1024]
    - [110, 12451.2]
  - - [4096, 2176, 1, 1024]
    - [119, 11796.6]
  - - [1024, 9016, 1, 4096]
    - [131, 11082.9]
  - - [1024, 7520, 1, 33712]
    - [127, 11278.6]
  - - [1024, 9016, 1, 1024]
    - [110, 12621.4]
  - - [1024, 9360, 1, 4096]
    - [131, 11009.1]
  - - [1024, 8536, 1, 1024]
    - [117, 12405.2]
  - - [1024, 7072, 1, 33712]
    - [127, 11318.5]
  - - [4096, 10032, 1, 1024]
    - [117, 12736.7]
  - - [1024, 9976, 1, 4096]
    - [117, 11789.5]
  - - [1024, 5936, 1, 1024]
    - [141, 11689.3]
  - - [4096, 2720, 1, 1024]
    - [117, 11616.6]
  - - [1024, 8736, 1, 4096]
    - [118, 11204.7]
  - - [1024, 9760, 1, 33712]
    - [123, 10414.9]
  - - [1024, 7896, 1, 4096]
    - [129, 12133.7]
  - - [4096, 9016, 1, 1024]
    - [120, 12533.7]
  - - [1024, 8280, 1, 4096]
    - [117, 11885.3]
  - - [4096, 7896, 1, 1024]
    - [117, 12623.5]
  - - [4096, 8216, 1, 1024]
    - [128, 12341.1]
  - - [1024, 8928, 1, 1024]
    - [129, 12222.8]
  - - [1024, 8976, 1, 4096]
    - [121, 10936.3]
  - - [1024, 9880, 1, 4096]
    - [117, 11937.6]
  - - [1024, 9040, 1, 1024]
    - [126, 12448.9]
  - - [1024, 6624, 1, 1024]
    - [148, 11262.4]
  - - [4096, 9504, 1, 1024]
    - [125, 12612.2]
  - - [1024, 3344, 1, 1024]
    - [111, 11396.3]
  - - [1024, 6600, 1, 1024]
    - [125, 11915.6]
  - - [4096, 8880, 1, 1024]
    - [118, 12364.3]
  - - [1024, 2912, 1, 1024]
    - [113, 11482.6]
  - - [4096, 800, 1, 1024]
    - [111, 10843.6]
  - - [4096, 9856, 1, 1024]
    - [125, 12617.2]
  - - [1024, 8128, 1, 4096]
    - [117, 11790.7]
  - - [4096, 7040, 1, 1024]
    - [126, 12559.5]
  - - [1024, 2400, 1, 1024]
    - [113, 10344.4]
  - - [4096, 9240, 1, 1024]
    - [125, 12397.1]
  - - [4096, 3240, 1, 1024]
    - [117, 12415.5]
  - - [1024, 10240, 1, 1024]
    - [135, 11422.7]
  - - [1024, 9216, 1, 33712]
    - [135, 10612.9]
  - - [1024, 2720, 1, 4096]
    - [110, 11742.9]
  - - [1024, 9936, 1, 33712]
    - [134, 10121.4]
  - - [1024, 4600, 1, 4096]
    - [129, 11782.9]
  - - [1024, 9112, 1, 4096]
    - [134, 11639.5]
  - - [1024, 7968, 1, 33712]
    - [136, 10831.8]
  - - [1024, 4920, 1, 1024]
    - [110, 12264.6]
  - - [1024, 3400, 1, 4096]
    - [134, 9939.63]
  - - [1024, 4392, 1, 4096]
    - [139, 10527.0]
  - - [1024, 3240, 1, 1024]
    - [149, 10240.5]
  - - [1024, 8856, 1, 4096]
    - [140, 11549.4]
  - - [1024, 9920, 1, 1024]
    - [117, 12384.3]
  - - [1024, 9760, 1, 4096]
    - [117, 11000.8]
  - - [1024, 8064, 1, 1024]
    - [111, 11674.0]
  - - [1024, 6240, 1, 4096]
    - [140, 10738.0]
  - - [1024, 8640, 1, 1024]
    - [150, 11202.5]
  - - [4096, 4864, 1, 1024]
    - [118, 11477.8]
  - - [4096, 5600, 1, 1024]
    - [122, 12152.8]
  - - [4096, 9568, 1, 1024]
    - [118, 12324.3]
  - - [1024, 10224, 1, 33712]
    - [135, 10062.4]
  - - [1024, 7920, 1, 4096]
    - [129, 12169.5]
  - - [1024, 9856, 1, 1024]
    - [132, 12241.5]
  - - [1024, 6656, 1, 1024]
    - [120, 11932.9]
  - - [1024, 8000, 1, 33712]
    - [151, 10862.2]
  - - [4096, 5200, 1, 1024]
    - [117, 12553.1]
  - - [1024, 2176, 1, 1024]
    - [152, 10371.3]
  - - [1024, 10184, 1, 1024]
    - [117, 11676.3]
  - - [1024, 8480, 1, 4096]
    - [127, 11441.8]
  - - [1024, 9568, 1, 4096]
    - [117, 12174.2]
  - - [1024, 8320, 1, 4096]
    - [117, 11690.5]
  - - [1024, 9504, 1, 1024]
    - [126, 12419.8]
  - - [1024, 9400, 1, 1024]
    - [138, 11288.9]
  - - [1024, 9600, 1, 33712]
    - [136, 10525.2]
  - - [1024, 7776, 1, 33712]
    - [123, 11107.5]
  - - [1024, 9240, 1, 1024]
    - [111, 12519.1]
  - - [1024, 8800, 1, 33712]
    - [116, 10673.1]
  - - [1024, 9472, 1, 33712]
    - [129, 10512.8]
  - - [4096, 5576, 1, 1024]
    - [117, 12611.8]
  - - [1024, 6840, 1, 4096]
    - [134, 10860.8]
  - - [1024, 7744, 1, 33712]
    - [123, 10843.9]
  - - [4096, 4704, 1, 1024]
    - [117, 12625.4]
  - - [1024, 10168, 1, 33712]
    - [135, 10085.3]
  - - [1024, 10192, 1, 4096]
    - [129, 12183.7]
  - - [1024, 6720, 1, 1024]
    - [125, 12122.2]
  - - [1024, 6800, 1, 1024]
    - [119, 11564.6]
  - - [1024, 9776, 1, 33712]
    - [130, 10294.4]
  - - [1024, 7040, 1, 1024]
    - [110, 12420.8]
  - - [1024, 10080, 1, 33712]
    - [134, 10194.5]
  - - [4096, 7696, 1, 1024]
    - [117, 12650.6]
  - - [1024, 10064, 1, 33712]
    - [134, 10438.1]
  - - [1024, 5832, 1, 4096]
    - [129, 12049.8]
  - - [1024, 10080, 1, 1024]
    - [153, 11044.1]
  - - [1024, 7176, 1, 1024]
    - [118, 11485.8]
  - - [1024, 7800, 1, 4096]
    - [140, 11061.8]
  - - [1024, 10200, 1, 33712]
    - [135, 10107.6]
  - - [4096, 9576, 1, 1024]
    - [117, 12742.6]
  - - [4096, 5280, 1, 1024]
    - [117, 12586.9]
  - - [4096, 3120, 1, 1024]
    - [125, 11176.4]
  - - [1024, 9112, 1, 33712]
    - [134, 10363.5]
  - - [1024, 3120, 1, 1024]
    - [110, 11458.2]
  - - [1024, 9984, 1, 4096]
    - [110, 11644.8]
  - - [1024, 9400, 1, 33712]
    - [136, 10316.4]
  - - [1024, 5784, 1, 4096]
    - [129, 11954.9]
  - - [1024, 5200, 1, 1024]
    - [127, 11252.6]
  - - [4096, 3864, 1, 1024]
    - [140, 11225.4]
  - - [1024, 2912, 1, 33712]
    - [133, 9560.41]
  - - [1024, 4160, 1, 33712]
    - [137, 9374.14]
  - - [1024, 9152, 1, 1024]
    - [119, 11081.4]
  - - [1024, 10176, 1, 33712]
    - [135, 9988.85]
  - - [1024, 9680, 1, 1024]
    - [110, 12580.8]
  - - [1024, 9216, 1, 1024]
    - [119, 11162.0]
  - - [1024, 6936, 1, 4096]
    - [134, 10578.5]
  - - [4096, 6912, 1, 1024]
    - [119, 12223.8]
  - - [1024, 9792, 1, 4096]
    - [129, 11424.0]
  - - [1024, 9184, 1, 33712]
    - [135, 10502.3]
  - - [1024, 8016, 1, 1024]
    - [110, 12515.4]
  - - [1024, 8712, 1, 4096]
    - [134, 10927.0]
  - - [1024, 4368, 1, 1024]
    - [113, 11992.5]
  - - [1024, 11264, 1, 1024]
    - [150, 11169.5]
  - - [1024, 8904, 1, 4096]
    - [118, 11075.6]
  - - [1024, 9728, 1, 4096]
    - [117, 12046.5]
  - - [1024, 8480, 1, 1024]
    - [117, 12306.1]
  - - [1024, 6496, 1, 1024]
    - [128, 11129.9]
  - - [4096, 8640, 1, 1024]
    - [118, 12358.0]
  - - [1024, 372, 1, 1024]
    - [110, 6458.12]
  - - [1024, 4048, 1, 33712]
    - [129, 11184.5]
  - - [1024, 3000, 1, 1024]
    - [154, 10578.8]
  - - [4096, 8976, 1, 1024]
    - [128, 12219.9]
  - - [1024, 5640, 1, 1024]
    - [111, 12231.0]
  - - [1024, 8664, 1, 4096]
    - [117, 11317.3]
  - - [1024, 9728, 1, 1024]
    - [117, 12470.1]
  - - [1024, 7560, 1, 1024]
    - [142, 11427.8]
  - - [1024, 7640, 1, 33712]
    - [127, 11409.6]
  - - [1024, 5800, 1, 4096]
    - [129, 12000.2]
  - - [1024, 3360, 1, 4096]
    - [110, 10087.6]
  - - [1024, 6976, 1, 1024]
    - [154, 11371.2]
  - - [1024, 4800, 1, 1024]
    - [155, 11047.3]
  - - [1024, 6976, 1, 4096]
    - [156, 10462.9]
  - - [1024, 6000, 1, 4096]
    - [137, 11162.5]
  - - [1024, 8520, 1, 4096]
    - [157, 10795.1]
  - - [1024, 492, 1, 1024]
    - [113, 7102.14]
  - - [4096, 8704, 1, 1024]
    - [118, 12446.5]
  - - [1024, 5600, 1, 33712]
    - [129, 11284.1]
  - - [4096, 2400, 1, 1024]
    - [113, 12446.0]
  - - [1024, 6720, 1, 33712]
    - [137, 11825.3]
  - - [1024, 9288, 1, 1024]
    - [111, 12551.7]
  - - [4096, 8568, 1, 1024]
    - [128, 12337.8]
  - - [1024, 10208, 1, 4096]
    - [117, 12139.4]
  - - [1024, 5504, 1, 1024]
    - [150, 11696.1]
  - - [1024, 9176, 1, 4096]
    - [137, 11279.6]
  - - [4096, 8208, 1, 1024]
    - [117, 12644.2]
  - - [1024, 8576, 1, 1024]
    - [126, 12424.8]
  - - [1024, 9312, 1, 33712]
    - [135, 10691.6]
  - - [1024, 9384, 1, 1024]
    - [110, 12502.3]
  - - [4096, 7480, 1, 1024]
    - [119, 12217.4]
  - - [1024, 6160, 1, 4096]
    - [129, 11042.9]
  - - [4096, 10240, 1, 1024]
    - [125, 12651.0]
  - - [4096, 9464, 1, 1024]
    - [118, 12427.9]
  - - [4096, 8008, 1, 1024]
    - [117, 12617.5]
  - - [1024, 5016, 1, 1024]
    - [113, 11960.3]
  - - [1024, 8464, 1, 4096]
    - [137, 11521.9]
  - - [1024, 8296, 1, 33712]
    - [116, 11083.7]
  - - [1024, 5280, 1, 1024]
    - [110, 12052.6]
  - - [1024, 10240, 1, 4096]
    - [134, 11294.9]
  - - [4096, 9640, 1, 1024]
    - [125, 12638.1]
  - - [4096, 9984, 1, 1024]
    - [125, 12630.5]
  - - [1024, 9072, 1, 33712]
    - [136, 10965.3]
  - - [1024, 10080, 1, 4096]
    - [129, 12318.6]
  - - [1024, 10176, 1, 4096]
    - [134, 11697.6]
  - - [4096, 7504, 1, 1024]
    - [128, 12286.1]
  - - [1024, 1344, 1, 4096]
    - [113, 10859.0]
  - - [1024, 368, 1, 1024]
    - [158, 6272.37]
  - - [4096, 8464, 1, 1024]
    - [128, 12340.3]
  - - [1024, 7056, 1, 33712]
    - [127, 11389.4]
  - - [4096, 8352, 1, 1024]
    - [117, 12696.3]
  - - [1024, 316, 1, 1024]
    - [114, 5544.68]
  - - [4096, 8800, 1, 1024]
    - [117, 12402.1]
  - - [1024, 9168, 1, 33712]
    - [134, 10558.6]
  - - [1024, 9632, 1, 1024]
    - [110, 12527.1]
  - - [4096, 4352, 1, 1024]
    - [159, 11520.8]
  - - [1024, 8904, 1, 1024]
    - [138, 11217.4]
  - - [4096, 7208, 1, 1024]
    - [119, 12152.9]
  - - [1024, 5832, 1, 1024]
    - [160, 11686.4]
  - - [4096, 7392, 1, 1024]
    - [119, 12270.1]
  - - [1024, 8096, 1, 4096]
    - [151, 11470.7]
  - - [4096, 7224, 1, 1024]
    - [117, 12677.6]
  - - [1024, 8976, 1, 33712]
    - [134, 10618.0]
  - - [1024, 10200, 1, 1024]
    - [111, 12542.7]
  - - [1024, 5880, 1, 1024]
    - [110, 11556.5]
  - - [1024, 8008, 1, 33712]
    - [136, 10881.8]
  - - [1024, 7224, 1, 1024]
    - [110, 12348.2]
  - - [1024, 7968, 1, 1024]
    - [142, 11409.0]
  - - [1024, 9952, 1, 33712]
    - [134, 10211.5]
  - - [1024, 9176, 1, 1024]
    - [110, 12529.6]
  - - [4096, 10064, 1, 1024]
    - [125, 12579.7]
  - - [4096, 8112, 1, 1024]
    - [117, 12355.1]
  - - [4096, 9776, 1, 1024]
    - [125, 12648.8]
  - - [1024, 8192, 1, 1024]
    - [126, 12214.1]
  - - [1024, 4920, 1, 4096]
    - [140, 11344.9]
  - - [1024, 2880, 1, 1024]
    - [141, 10636.4]
  - - [1024, 8528, 1, 4096]
    - [137, 11599.4]
  - - [4096, 5832, 1, 1024]
    - [117, 12549.3]
  - - [4096, 8192, 1, 1024]
    - [128, 12306.8]
  - - [4096, 7776, 1, 1024]
    - [117, 12644.5]
  - - [1024, 9424, 1, 33712]
    - [136, 10544.0]
  - - [4096, 9976, 1, 1024]
    - [117, 12741.2]
  - - [4096, 10120, 1, 1024]
    - [125, 12418.4]
  - - [1024, 7616, 1, 4096]
    - [117, 11834.9]
  - - [1024, 4704, 1, 33712]
    - [129, 10959.0]
  - - [1024, 8216, 1, 1024]
    - [119, 11742.3]
  - - [1024, 9976, 1, 33712]
    - [134, 10178.1]
  - - [1024, 9912, 1, 33712]
    - [134, 10190.7]
  - - [1024, 4608, 1, 1024]
    - [110, 12038.6]
  - - [1024, 9048, 1, 4096]
    - [134, 11713.8]
  - - [1024, 1232, 1, 1024]
    - [110, 9774.86]
  - - [4096, 6936, 1, 1024]
    - [119, 12248.9]
  - - [1024, 8208, 1, 4096]
    - [124, 11485.7]
  - - [1024, 9792, 1, 33712]
    - [130, 10199.2]
  - - [1024, 8208, 1, 1024]
    - [110, 12454.7]
  - - [1024, 5360, 1, 1024]
    - [119, 11305.8]
  - - [1024, 4032, 1, 1024]
    - [161, 10800.8]
  - - [4096, 6496, 1, 1024]
    - [122, 12293.8]
  - - [4096, 6888, 1, 1024]
    - [119, 12194.1]
  - - [1024, 6768, 1, 1024]
    - [110, 11519.2]
  - - [1024, 7744, 1, 4096]
    - [118, 10841.9]
  - - [4096, 3344, 1, 1024]
    - [126, 12334.4]
  - - [1024, 3040, 1, 1024]
    - [162, 10320.1]
  - - [1024, 8008, 1, 4096]
    - [127, 11523.5]
  - - [1024, 8944, 1, 4096]
    - [117, 11911.5]
  - - [1024, 9672, 1, 33712]
    - [130, 10184.2]
  - - [1024, 7752, 1, 1024]
    - [110, 12453.3]
  - - [1024, 9800, 1, 33712]
    - [136, 10147.0]
  - - [1024, 10152, 1, 4096]
    - [129, 12399.1]
  - - [4096, 7216, 1, 1024]
    - [128, 12173.4]
  - - [4096, 8200, 1, 1024]
    - [128, 12288.5]
  - - [1024, 7424, 1, 33712]
    - [163, 11088.5]
  - - [1024, 10000, 1, 33712]
    - [134, 10285.1]
  - - [1024, 9344, 1, 4096]
    - [129, 12251.9]
  - - [1024, 3344, 1, 4096]
    - [117, 11095.6]
  - - [1024, 6960, 1, 1024]
    - [154, 11301.5]
  - - [4096, 9360, 1, 1024]
    - [120, 12341.7]
  - - [4096, 9024, 1, 1024]
    - [117, 12550.8]
  - - [1024, 3696, 1, 4096]
    - [129, 11624.9]
  - - [1024, 9520, 1, 1024]
    - [141, 11546.2]
  - - [4096, 9880, 1, 1024]
    - [125, 12648.5]
  - - [1024, 416, 1, 1024]
    - [113, 7260.45]
  - - [4096, 6072, 1, 1024]
    - [117, 12470.0]
  - - [1024, 8464, 1, 1024]
    - [136, 11323.8]
  - - [1024, 9744, 1, 1024]
    - [150, 10955.2]
  - - [4096, 7168, 1, 1024]
    - [119, 12254.1]
  - - [1024, 6768, 1, 4096]
    - [129, 11315.7]
  - - [4096, 9672, 1, 1024]
    - [125, 12540.2]
  - - [1024, 3584, 1, 4096]
    - [117, 10825.8]
  - - [1024, 7872, 1, 33712]
    - [123, 11185.8]
  - - [1024, 5984, 1, 1024]
    - [110, 12133.9]
  - - [1024, 2304, 1, 1024]
    - [110, 10036.2]
  - - [1024, 7936, 1, 33712]
    - [116, 11314.9]
  - - [1024, 9792, 1, 1024]
    - [111, 12618.8]
  - - [1024, 9960, 1, 1024]
    - [125, 11356.9]
  - - [4096, 6400, 1, 1024]
    - [122, 12326.2]
  - - [1024, 7840, 1, 4096]
    - [129, 11246.9]
  - - [4096, 8000, 1, 1024]
    - [128, 12355.0]
  - - [4096, 3808, 1, 1024]
    - [122, 12165.5]
  - - [1024, 8704, 1, 1024]
    - [119, 11060.1]
  - - [4096, 4640, 1, 1024]
    - [164, 11571.6]
  - - [1024, 7728, 1, 4096]
    - [134, 11861.6]
  - - [4096, 8296, 1, 1024]
    - [128, 12287.7]
  - - [1024, 9648, 1, 4096]
    - [117, 12091.1]
  - - [4096, 7920, 1, 1024]
    - [128, 12244.8]
  - - [1024, 10064, 1, 4096]
    - [134, 11826.3]
  - - [1024, 9464, 1, 4096]
    - [113, 11638.5]
  - - [1024, 9408, 1, 4096]
    - [117, 11701.4]
  - - [1024, 292, 1, 1024]
    - [114, 5158.09]
  - - [4096, 9728, 1, 1024]
    - [125, 12471.6]
  - - [1024, 7200, 1, 1024]
    - [117, 12108.2]
  - - [4096, 9936, 1, 1024]
    - [125, 12408.1]
  - - [1024, 7224, 1, 4096]
    - [129, 11294.0]
  - - [4096, 8904, 1, 1024]
    - [125, 12595.1]
  - - [1024, 8096, 1, 1024]
    - [126, 12422.8]
  - - [1024, 9696, 1, 1024]
    - [119, 11179.4]
  - - [1024, 7936, 1, 1024]
    - [119, 11378.1]
  - - [1024, 9672, 1, 4096]
    - [110, 10950.8]
  - - [4096, 8480, 1, 1024]
    - [117, 12516.7]
  - - [1024, 380, 1, 1024]
    - [110, 6632.14]
  - - [1024, 8320, 1, 1024]
    - [117, 12414.8]
  - - [1024, 7296, 1, 1024]
    - [142, 11680.7]
  - - [1024, 6336, 1, 1024]
    - [119, 11519.9]
  - - [1024, 8280, 1, 1024]
    - [135, 11209.2]
  - - [1024, 10032, 1, 1024]
    - [119, 11059.9]
  - - [4096, 8840, 1, 1024]
    - [120, 12365.1]
  - - [4096, 9248, 1, 1024]
    - [117, 12706.0]
  - - [1024, 4368, 1, 33712]
    - [129, 11461.6]
  - - [4096, 6160, 1, 1024]
    - [119, 12105.4]
  - - [1024, 424, 1, 1024]
    - [115, 7226.86]
  - - [4096, 10208, 1, 1024]
    - [125, 12512.4]
  - - [1024, 9840, 1, 33712]
    - [129, 10232.9]
  - - [1024, 9576, 1, 4096]
    - [129, 12235.1]
  - - [1024, 9120, 1, 1024]
    - [119, 11799.2]
  - - [4096, 7680, 1, 1024]
    - [128, 12238.3]
  - - [4096, 9120, 1, 1024]
    - [118, 12442.7]
  - - [4096, 7744, 1, 1024]
    - [117, 12667.9]
  - - [1024, 8192, 1, 4096]
    - [129, 11411.2]
  - - [1024, 5776, 1, 1024]
    - [117, 11935.5]
  - - [1024, 8160, 1, 1024]
    - [118, 11655.9]
  - - [1024, 264, 1, 1024]
    - [165, 4607.59]
  - - [1024, 9600, 1, 4096]
    - [117, 11853.6]
  - - [1024, 8120, 1, 33712]
    - [151, 11100.1]
  - - [1024, 6072, 1, 4096]
    - [129, 12084.2]
  - - [1024, 7200, 1, 4096]
    - [123, 11920.5]
  - - [4096, 4080, 1, 1024]
    - [111, 11553.3]
  - - [4096, 7560, 1, 1024]
    - [119, 12186.3]
  - - [1024, 3240, 1, 33712]
    - [137, 10054.7]
  - - [4096, 4368, 1, 1024]
    - [129, 11474.5]
  - - [4096, 5400, 1, 1024]
    - [119, 12163.9]
  - - [1024, 2880, 1, 4096]
    - [136, 9885.72]
  - - [1024, 4640, 1, 4096]
    - [117, 10812.9]
  - - [1024, 5936, 1, 33712]
    - [127, 10902.8]
  - - [1024, 7072, 1, 1024]
    - [110, 12462.2]
  - - [1024, 9856, 1, 4096]
    - [134, 11382.9]
  - - [1024, 9384, 1, 33712]
    - [136, 10232.6]
  - - [1024, 8544, 1, 4096]
    - [129, 12093.0]
  - - [1024, 9936, 1, 1024]
    - [117, 12442.2]
  - - [4096, 3040, 1, 1024]
    - [135, 11078.3]
  - - [1024, 5104, 1, 4096]
    - [123, 10432.2]
  - - [1024, 6960, 1, 4096]
    - [116, 10566.5]
  - - [1024, 9936, 1, 4096]
    - [140, 11093.3]
  - - [1024, 8432, 1, 1024]
    - [166, 11559.4]
  - - [1024, 912, 1, 4096]
    - [167, 9225.34]
  - - [1024, 10192, 1, 1024]
    - [150, 11875.6]
  - - [1024, 6720, 1, 4096]
    - [140, 10815.7]
  - - [4096, 6000, 1, 1024]
    - [119, 12214.5]
  - - [1024, 9984, 1, 33712]
    - [134, 10269.0]
  - - [4096, 10192, 1, 1024]
    - [117, 12711.8]
  - - [1024, 8816, 1, 1024]
    - [126, 12445.1]
  - - [4096, 10080, 1, 1024]
    - [125, 12589.2]
  - - [1024, 5120, 1, 1024]
    - [117, 11941.0]
  - - [1024, 4488, 1, 4096]
    - [134, 10671.7]
  - - [1024, 10120, 1, 33712]
    - [135, 10088.8]
  - - [1024, 6936, 1, 1024]
    - [113, 12230.8]
  - - [1024, 10200, 1, 4096]
    - [134, 11505.2]
  - - [1024, 6528, 1, 1024]
    - [120, 11764.6]
  - - [1024, 9776, 1, 1024]
    - [144, 11045.2]
  - - [1024, 10192, 1, 33712]
    - [135, 10138.9]
  - - [1024, 5776, 1, 4096]
    - [129, 11950.1]
  - - [1024, 4640, 1, 1024]
    - [155, 10608.3]
  - - [1024, 9728, 1, 33712]
    - [135, 10271.9]
  - - [4096, 7448, 1, 1024]
    - [117, 12707.9]
  - - [4096, 10152, 1, 1024]
    - [125, 12646.3]
  - - [1024, 1232, 1, 4096]
    - [129, 9540.93]
  - - [1024, 6864, 1, 4096]
    - [123, 11111.6]
  - - [1024, 7424, 1, 4096]
    - [129, 11284.3]
  - - [4096, 9912, 1, 1024]
    - [125, 12676.2]
  - - [1024, 4048, 1, 1024]
    - [152, 11417.6]
  - - [1024, 10208, 1, 1024]
    - [145, 11258.7]
  - - [4096, 6664, 1, 1024]
    - [122, 12218.8]
  - - [1024, 9744, 1, 4096]
    - [134, 11560.9]
  - - [4096, 10168, 1, 1024]
    - [148, 12526.9]
  - - [1024, 3256, 1, 1024]
    - [132, 11562.4]
  - - [1024, 9472, 1, 1024]
    - [157, 11361.9]
  - - [1024, 8584, 1, 1024]
    - [111, 11760.4]
  - - [4096, 9296, 1, 1024]
    - [125, 12656.5]
  - - [1024, 7168, 1, 4096]
    - [117, 11989.8]
  - - [1024, 8184, 1, 1024]
    - [110, 11595.4]
  - - [1024, 4864, 1, 4096]
    - [168, 10126.0]
  - - [1024, 9576, 1, 33712]
    - [134, 10527.9]
  - - [1024, 8320, 1, 33712]
    - [130, 10803.9]
  - - [1024, 5888, 1, 4096]
    - [129, 12171.3]
  - - [4096, 6720, 1, 1024]
    - [119, 12253.8]
  - - [1024, 8232, 1, 1024]
    - [110, 11669.7]
  - - [1024, 6968, 1, 33712]
    - [127, 11204.8]
  - - [1024, 13312, 1, 1024]
    - [117, 12584.4]
  - - [1024, 7192, 1, 33712]
    - [127, 10909.0]
  - - [1024, 480, 1, 1024]
    - [114, 8399.81]
  - - [4096, 10112, 1, 1024]
    - [125, 12544.9]
  - - [1024, 8592, 1, 33712]
    - [136, 10963.4]
  - - [1024, 10112, 1, 4096]
    - [129, 12350.8]
  - - [1024, 8736, 1, 1024]
    - [138, 11796.0]
  - - [1024, 5720, 1, 4096]
    - [137, 10650.7]
  - - [1024, 3040, 1, 4096]
    - [113, 9817.25]
  - - [1024, 5280, 1, 33712]
    - [135, 10542.7]
  - - [4096, 8432, 1, 1024]
    - [128, 12326.2]
  - - [1024, 9520, 1, 4096]
    - [117, 11966.7]
  - - [1024, 5576, 1, 4096]
    - [117, 11537.2]
  - - [4096, 7840, 1, 1024]
    - [128, 12283.4]
  - - [1024, 2112, 1, 1024]
    - [111, 11529.5]
  - - [1024, 9880, 1, 33712]
    - [129, 10250.2]
  - - [4096, 9312, 1, 1024]
    - [117, 12714.6]
  - - [1024, 9504, 1, 4096]
    - [117, 11766.6]
  - - [1024, 9984, 1, 1024]
    - [117, 12472.5]
  - - [4096, 10184, 1, 1024]
    - [125, 12536.3]
  - - [1024, 9912, 1, 4096]
    - [110, 11825.8]
  - - [4096, 2112, 1, 1024]
    - [111, 11506.7]
  - - [1024, 8576, 1, 4096]
    - [140, 10959.3]
  - - [1024, 9576, 1, 1024]
    - [117, 12555.2]
  - - [1024, 8512, 1, 33712]
    - [136, 10862.8]
  - - [1024, 9912, 1, 1024]
    - [110, 12573.1]
  - - [4096, 7056, 1, 1024]
    - [119, 12246.3]
  - - [1024, 7560, 1, 33712]
    - [137, 11180.1]
  - - [4096, 1344, 1, 1024]
    - [110, 12216.4]
  - - [1024, 3024, 1, 4096]
    - [160, 10307.8]
  - - [4096, 9744, 1, 1024]
    - [125, 12625.8]
  - - [4096, 9920, 1, 1024]
    - [125, 12502.8]
  - - [1024, 420, 1, 1024]
    - [113, 7281.78]
  - - [1024, 8064, 1, 33712]
    - [151, 11058.2]
  - - [4096, 8928, 1, 1024]
    - [117, 12684.1]
  - - [1024, 6968, 1, 1024]
    - [117, 12092.0]
  - - [1024, 8928, 1, 4096]
    - [118, 10994.8]
  - - [1024, 5504, 1, 33712]
    - [129, 10864.1]
  - - [1024, 9768, 1, 1024]
    - [111, 11783.8]
  - - [4096, 10000, 1, 1024]
    - [125, 12649.9]
  - - [1024, 7920, 1, 33712]
    - [116, 10720.6]
  - - [1024, 5936, 1, 4096]
    - [132, 11801.0]
  - - [1024, 8904, 1, 33712]
    - [136, 10480.6]
  - - [1024, 9072, 1, 4096]
    - [129, 12192.6]
  - - [4096, 8664, 1, 1024]
    - [117, 12518.0]
  - - [1024, 9768, 1, 33712]
    - [130, 10311.9]
  - - [1024, 9768, 1, 4096]
    - [129, 12208.5]
  - - [1024, 9112, 1, 1024]
    - [126, 12070.0]
  - - [4096, 6768, 1, 1024]
    - [122, 12189.1]
  - - [1024, 8664, 1, 33712]
    - [130, 10467.9]
  - - [1024, 6160, 1, 1024]
    - [111, 12383.5]
  - - [1024, 8968, 1, 4096]
    - [134, 10998.6]
  - - [4096, 9112, 1, 1024]
    - [117, 12595.7]
  - - [1024, 5632, 1, 1024]
    - [126, 12075.8]
  - - [4096, 8160, 1, 1024]
    - [118, 12418.9]
  - - [1024, 3696, 1, 1024]
    - [113, 11958.5]
  - - [1024, 9120, 1, 4096]
    - [110, 11711.9]
  - - [1024, 8160, 1, 4096]
    - [117, 11776.2]
  - - [4096, 5880, 1, 1024]
    - [126, 12544.5]
  - - [1024, 11776, 1, 1024]
    - [125, 10562.5]
  - - [1024, 9920, 1, 4096]
    - [150, 11134.7]
  - - [1024, 5200, 1, 4096]
    - [117, 10979.4]
  - - [1024, 8400, 1, 1024]
    - [118, 11596.8]
  - - [1024, 912, 1, 1024]
    - [167, 10495.0]
  - - [1024, 8680, 1, 1024]
    - [117, 12266.3]
  - - [1024, 8640, 1, 4096]
    - [137, 11348.4]
  - - [1024, 2400, 1, 33712]
    - [133, 8895.94]
  - - [1024, 8640, 1, 33712]
    - [151, 10905.9]
  - - [4096, 10176, 1, 1024]
    - [117, 12763.2]
  - - [1024, 8736, 1, 33712]
    - [123, 10604.0]
  - - [4096, 9344, 1, 1024]
    - [117, 12749.0]
  - - [1024, 7904, 1, 1024]
    - [117, 12159.5]
  - - [1024, 10184, 1, 33712]
    - [134, 10018.6]
  - - [4096, 9400, 1, 1024]
    - [117, 12764.3]
  - - [1024, 10032, 1, 4096]
    - [117, 11903.9]
  - - [1024, 9400, 1, 4096]
    - [131, 11381.2]
  - - [4096, 4392, 1, 1024]
    - [117, 12567.1]
  - - [1024, 8040, 1, 1024]
    - [119, 11517.1]
  - - [1024, 8840, 1, 1024]
    - [119, 11442.6]
  - - [1024, 8400, 1, 4096]
    - [140, 11226.1]
  - - [4096, 7144, 1, 1024]
    - [117, 12641.8]
  - - [1024, 8664, 1, 1024]
    - [110, 12458.6]
  - - [1024, 8840, 1, 33712]
    - [136, 10471.2]
  - - [1024, 6912, 1, 33712]
    - [127, 11098.1]
  - - [1024, 5280, 1, 4096]
    - [129, 11826.5]
  - - [1024, 10032, 1, 33712]
    - [134, 10198.0]
  - - [4096, 9600, 1, 1024]
    - [117, 12767.4]
  - - [1024, 9864, 1, 1024]
    - [117, 12343.8]
  - - [4096, 9632, 1, 1024]
    - [125, 12629.2]
  - - [1024, 9952, 1, 4096]
    - [117, 11708.3]
  - - [1024, 8584, 1, 33712]
    - [136, 10983.8]
  - - [1024, 9024, 1, 1024]
    - [110, 12627.2]
  - - [1024, 4864, 1, 1024]
    - [169, 11251.9]
  - - [1024, 9360, 1, 1024]
    - [140, 10906.1]
  - - [4096, 8448, 1, 1024]
    - [118, 12370.6]
  - - [1024, 9360, 1, 33712]
    - [136, 10353.0]
  - - [1024, 9880, 1, 1024]
    - [113, 12550.8]
  - - [1024, 9312, 1, 4096]
    - [131, 11207.4]
  - - [1024, 5472, 1, 33712]
    - [170, 10748.1]
  - - [1024, 7968, 1, 4096]
    - [132, 11293.6]
  - - [1024, 8232, 1, 33712]
    - [123, 10881.1]
  - - [4096, 6960, 1, 1024]
    - [117, 12684.3]
  - - [1024, 9144, 1, 1024]
    - [110, 11657.6]
  - - [4096, 8496, 1, 1024]
    - [118, 12336.5]
  - - [1024, 9216, 1, 4096]
    - [117, 12090.4]
  - - [1024, 5824, 1, 1024]
    - [126, 12019.5]
  - - [1024, 9248, 1, 1024]
    - [119, 11193.6]
  - - [4096, 2040, 1, 1024]
    - [119, 11681.3]
  - - [4096, 8712, 1, 1024]
    - [118, 12364.5]
  - - [1024, 2112, 1, 4096]
    - [126, 10619.5]
  - - [1024, 4704, 1, 1024]
    - [127, 10324.2]
  - - [4096, 5824, 1, 1024]
    - [119, 12092.4]
  - - [4096, 6480, 1, 1024]
    - [122, 12278.2]
  - - [1024, 6880, 1, 1024]
    - [150, 11826.5]
  - - [1024, 1984, 1, 1024]
    - [167, 10138.3]
  - - [4096, 6120, 1, 1024]
    - [119, 12202.0]
  - - [1024, 8448, 1, 33712]
    - [136, 10711.2]
  - - [1024, 5456, 1, 4096]
    - [129, 11740.2]
  - - [4096, 9184, 1, 1024]
    - [120, 12364.3]
  - - [1024, 5824, 1, 4096]
    - [117, 11618.9]
  - - [1024, 8880, 1, 33712]
    - [136, 10464.0]
  - - [1024, 8160, 1, 33712]
    - [116, 10749.9]
  - - [4096, 5104, 1, 1024]
    - [117, 12596.3]
  - - [1024, 7696, 1, 1024]
    - [119, 11626.6]
  - - [4096, 6336, 1, 1024]
    - [122, 12255.6]
  - - [1024, 7696, 1, 4096]
    - [154, 10557.3]
  - - [4096, 8024, 1, 1024]
    - [128, 12385.5]
  - - [1024, 8600, 1, 1024]
    - [126, 12478.9]
  - - [4096, 8600, 1, 1024]
    - [128, 12381.2]
  - - [1024, 5720, 1, 1024]
    - [111, 12390.2]
  - - [1024, 8600, 1, 4096]
    - [137, 11692.2]
  - - [1024, 10184, 1, 4096]
    - [111, 12155.3]
  - - [1024, 8648, 1, 33712]
    - [130, 10392.9]
  - - [1024, 9464, 1, 33712]
    - [134, 10376.7]
  - - [1024, 5400, 1, 33712]
    - [129, 10831.0]
  - - [1024, 17408, 1, 1024]
    - [111, 11910.5]
  - - [1024, 5400, 1, 4096]
    - [140, 10590.5]
  - - [1024, 5456, 1, 1024]
    - [128, 10871.5]
  - - [4096, 6440, 1, 1024]
    - [119, 12186.1]
  - - [4096, 5456, 1, 1024]
    - [142, 12029.5]
  - - [1024, 8520, 1, 1024]
    - [119, 11587.9]
  - - [4096, 8520, 1, 1024]
    - [118, 12348.1]
  - - [1024, 8816, 1, 33712]
    - [130, 10619.2]
  - - [4096, 7936, 1, 1024]
    - [117, 12724.7]
  - - [4096, 7400, 1, 1024]
    - [129, 12285.8]
  - - [1024, 8784, 1, 33712]
    - [130, 10559.4]
  - - [1024, 8784, 1, 4096]
    - [129, 12116.4]
  - - [4096, 6656, 1, 1024]
    - [117, 12737.8]
  - - [1024, 2392, 1, 1024]
    - [154, 10574.2]
  - - [1024, 4352, 1, 4096]
    - [117, 11301.1]
  - - [1024, 9720, 1, 1024]
    - [126, 11669.0]
  - - [1024, 2392, 1, 4096]
    - [110, 10377.3]
  - - [1024, 3584, 1, 1024]
    - [111, 10573.1]
  - - [4096, 3584, 1, 1024]
    - [171, 11214.1]
  - - [1024, 5760, 1, 33712]
    - [136, 11191.6]
  - - [1024, 9272, 1, 1024]
    - [110, 12350.6]
  - - [4096, 7968, 1, 1024]
    - [128, 12302.4]
  - - [1024, 5040, 1, 1024]
    - [110, 12004.4]
  - - [1024, 452, 1, 1024]
    - [115, 7684.12]
  - - [4096, 3696, 1, 1024]
    - [117, 12313.4]
  - - [4096, 6528, 1, 1024]
    - [119, 12138.4]
  - - [1024, 6048, 1, 33712]
    - [113, 11219.8]
  - - [4096, 6048, 1, 1024]
    - [129, 12394.5]
  - - [1024, 8400, 1, 33712]
    - [123, 10775.2]
  - - [1024, 8520, 1, 33712]
    - [136, 10732.5]
  - - [1024, 3072, 1, 1024]
    - [111, 11937.5]
  - - [1024, 3072, 1, 33712]
    - [132, 9595.41]
  - - [1024, 10112, 1, 1024]
    - [119, 11163.1]
  - - [4096, 3072, 1, 1024]
    - [111, 10838.5]
  - - [1024, 3072, 1, 4096]
    - [124, 9855.63]
  - - [1024, 10160, 1, 1024]
    - [120, 11138.2]
  - - [1024, 10160, 1, 33712]
    - [129, 10069.5]
  - - [1024, 10160, 1, 4096]
    - [129, 12415.2]
  - - [1024, 7480, 1, 1024]
    - [129, 12092.0]
  - - [4096, 9040, 1, 1024]
    - [118, 12361.9]
  - - [1024, 9040, 1, 4096]
    - [117, 11883.3]
  - - [1024, 6000, 1, 1024]
    - [117, 11960.9]
  - - [1024, 8448, 1, 4096]
    - [172, 10972.8]
  - - [1024, 7448, 1, 1024]
    - [129, 12061.0]
  - - [1024, 8496, 1, 4096]
    - [140, 11315.2]
  - - [1024, 9328, 1, 4096]
    - [117, 12130.8]
  - - [1024, 6384, 1, 1024]
    - [117, 12262.0]
  - - [1024, 4480, 1, 4096]
    - [164, 9918.51]
  - - [1024, 6656, 1, 4096]
    - [117, 11039.7]
  - - [1024, 9184, 1, 4096]
    - [134, 11372.9]
  - - [4096, 6384, 1, 1024]
    - [117, 12699.4]
  - - [1024, 6384, 1, 4096]
    - [134, 11298.0]
  - - [1024, 6120, 1, 1024]
    - [148, 11887.4]
  - - [4096, 9752, 1, 1024]
    - [125, 12503.6]
  - - [1024, 9016, 1, 33712]
    - [136, 10630.8]
  - - [4096, 4032, 1, 1024]
    - [117, 12550.7]
  - - [1024, 9640, 1, 1024]
    - [142, 11117.7]
  - - [4096, 9424, 1, 1024]
    - [118, 12232.6]
  - - [1024, 5888, 1, 1024]
    - [117, 12172.7]
  - - [1024, 6120, 1, 4096]
    - [150, 10931.6]
  - - [1024, 9720, 1, 33712]
    - [130, 10207.7]
  - - [4096, 9720, 1, 1024]
    - [117, 12737.6]
  - - [1024, 5840, 1, 1024]
    - [126, 12065.9]
  - - [4096, 5840, 1, 1024]
    - [119, 12117.9]
  - - [1024, 5840, 1, 4096]
    - [139, 10830.3]
  - - [1024, 8624, 1, 1024]
    - [119, 11711.2]
  - - [4096, 8624, 1, 1024]
    - [118, 12345.9]
  - - [1024, 7384, 1, 1024]
    - [117, 12412.9]
  - - [1024, 8624, 1, 4096]
    - [140, 11386.7]
  - - [1024, 9464, 1, 1024]
    - [117, 12420.8]
  - - [4096, 9768, 1, 1024]
    - [125, 12644.7]
  - - [4096, 9952, 1, 1024]
    - [125, 12598.0]
  - - [1024, 6624, 1, 4096]
    - [129, 11078.1]
  - - [4096, 8120, 1, 1024]
    - [128, 12367.7]
  - - [1024, 9568, 1, 1024]
    - [126, 12392.2]
  - - [1024, 8256, 1, 1024]
    - [119, 11813.6]
  - - [1024, 8120, 1, 4096]
    - [140, 11583.0]
  - - [1024, 4968, 1, 1024]
    - [111, 12263.0]
  - - [4096, 6360, 1, 1024]
    - [122, 12296.1]
  - - [1024, 6336, 1, 33712]
    - [127, 11029.2]
  - - [1024, 6336, 1, 4096]
    - [129, 12169.4]
  - - [1024, 9776, 1, 4096]
    - [134, 10938.9]
  - - [1024, 9648, 1, 1024]
    - [126, 12144.2]
  - - [1024, 8432, 1, 4096]
    - [118, 11048.1]
  - - [1024, 9680, 1, 33712]
    - [133, 10157.5]
  - - [4096, 9648, 1, 1024]
    - [117, 12722.4]
  - - [1024, 5440, 1, 4096]
    - [117, 11609.5]
  - - [1024, 9184, 1, 1024]
    - [119, 11128.4]
  - - [1024, 8760, 1, 1024]
    - [142, 11105.4]
  - - [1024, 8536, 1, 4096]
    - [140, 10954.4]
  - - [4096, 8040, 1, 1024]
    - [117, 12660.7]
  - - [4096, 8760, 1, 1024]
    - [126, 12580.5]
  - - [1024, 8040, 1, 4096]
    - [117, 12054.6]
  - - [1024, 4968, 1, 4096]
    - [129, 11608.2]
  - - [1024, 9752, 1, 33712]
    - [130, 10111.4]
  - - [1024, 6032, 1, 33712]
    - [129, 11045.6]
  - - [4096, 6032, 1, 1024]
    - [132, 12360.3]
  - - [1024, 7688, 1, 4096]
    - [156, 10330.7]
  - - [1024, 6032, 1, 4096]
    - [129, 11774.4]
  - - [1024, 4216, 1, 4096]
    - [110, 10616.7]
  - - [1024, 7168, 1, 1024]
    - [125, 12076.1]
  - - [1024, 9152, 1, 33712]
    - [134, 10660.0]
  - - [1024, 9928, 1, 1024]
    - [110, 12608.1]
  - - [4096, 7616, 1, 1024]
    - [128, 12303.8]
  - - [1024, 10120, 1, 4096]
    - [129, 11534.6]
  - - [1024, 8800, 1, 4096]
    - [116, 11490.6]
  - - [4096, 9928, 1, 1024]
    - [117, 12680.9]
  - - [4096, 3256, 1, 1024]
    - [126, 12445.9]
  - - [1024, 9168, 1, 1024]
    - [119, 11112.1]
  - - [1024, 10240, 1, 33712]
    - [135, 10075.4]
  - - [1024, 4800, 1, 33712]
    - [131, 10676.8]
  - - [1024, 7488, 1, 33712]
    - [137, 11090.2]
  - - [4096, 4800, 1, 1024]
    - [117, 12702.9]
  - - [1024, 7992, 1, 1024]
    - [159, 11317.2]
  - - [1024, 4800, 1, 4096]
    - [140, 10403.4]
  - - [1024, 4048, 1, 4096]
    - [123, 10027.9]
  - - [1024, 9384, 1, 4096]
    - [121, 11043.3]
  - - [1024, 7504, 1, 1024]
    - [126, 12105.4]
  - - [1024, 7504, 1, 4096]
    - [127, 11317.7]
  - - [1024, 6496, 1, 4096]
    - [163, 11257.2]
  - - [1024, 6784, 1, 1024]
    - [119, 11561.4]
  - - [4096, 6784, 1, 1024]
    - [119, 12201.6]
  - - [1024, 4224, 1, 1024]
    - [110, 11391.9]
  - - [1024, 8760, 1, 33712]
    - [130, 10547.7]
  - - [1024, 7728, 1, 1024]
    - [110, 12425.4]
  - - [4096, 7728, 1, 1024]
    - [128, 12291.2]
  - - [1024, 9328, 1, 1024]
    - [111, 11815.2]
  - - [1024, 8592, 1, 4096]
    - [134, 11023.6]
  - - [1024, 7440, 1, 1024]
    - [126, 12144.1]
  - - [1024, 3808, 1, 4096]
    - [173, 10199.7]
  - - [4096, 9328, 1, 1024]
    - [125, 12659.6]
  - - [1024, 9968, 1, 1024]
    - [117, 12464.4]
  - - [1024, 7056, 1, 1024]
    - [125, 11702.4]
  - - [1024, 7056, 1, 4096]
    - [124, 10876.0]
  - - [1024, 9280, 1, 1024]
    - [111, 11760.1]
  - - [1024, 7688, 1, 1024]
    - [119, 11613.2]
  - - [4096, 9280, 1, 1024]
    - [120, 12515.4]
  - - [1024, 8712, 1, 33712]
    - [130, 10458.6]
  - - [1024, 7344, 1, 1024]
    - [111, 12447.8]
  - - [4096, 7344, 1, 1024]
    - [119, 12211.0]
  - - [1024, 9672, 1, 1024]
    - [110, 11740.4]
  - - [1024, 7344, 1, 4096]
    - [124, 10926.7]
  - - [1024, 7144, 1, 1024]
    - [125, 12049.6]
  - - [1024, 7616, 1, 33712]
    - [127, 11454.9]
  - - [1024, 6600, 1, 33712]
    - [127, 11043.0]
  - - [1024, 7144, 1, 4096]
    - [129, 12003.3]
  - - [1024, 5640, 1, 4096]
    - [132, 10611.8]
  - - [1024, 7400, 1, 1024]
    - [154, 11315.1]
  - - [1024, 7400, 1, 4096]
    - [174, 10731.4]
  - - [1024, 8800, 1, 1024]
    - [111, 11731.4]
  - - [1024, 7488, 1, 4096]
    - [174, 10850.3]
  - - [1024, 7488, 1, 1024]
    - [110, 11580.7]
  - - [1024, 9864, 1, 33712]
    - [129, 10206.9]
  - - [1024, 5568, 1, 1024]
    - [110, 12198.0]
  - - [1024, 8128, 1, 33712]
    - [127, 11081.2]
  - - [4096, 5568, 1, 1024]
    - [117, 12712.2]
  - - [4096, 7888, 1, 1024]
    - [128, 12291.8]
  - - [1024, 8432, 1, 33712]
    - [123, 11222.8]
  - - [1024, 5568, 1, 4096]
    - [129, 11971.9]
  - - [1024, 10040, 1, 1024]
    - [120, 11034.4]
  - - [1024, 2720, 1, 33712]
    - [137, 10133.0]
  - - [4096, 3400, 1, 1024]
    - [128, 11176.7]
  - - [1024, 7520, 1, 1024]
    - [125, 12001.2]
  - - [4096, 8944, 1, 1024]
    - [118, 12312.5]
  - - [4096, 7520, 1, 1024]
    - [117, 12719.4]
  - - [1024, 7520, 1, 4096]
    - [129, 11265.6]
  - - [1024, 476, 1, 1024]
    - [114, 8113.17]
  - - [1024, 8928, 1, 33712]
    - [136, 10416.9]
  - - [1024, 7680, 1, 1024]
    - [111, 12600.2]
  - - [1024, 7680, 1, 4096]
    - [174, 10975.3]
  - - [1024, 8296, 1, 1024]
    - [111, 12494.2]
  - - [1024, 9296, 1, 1024]
    - [157, 11148.7]
  - - [1024, 9296, 1, 33712]
    - [135, 10567.8]
  - - [1024, 9296, 1, 4096]
    - [129, 12185.3]
  - - [1024, 10120, 1, 1024]
    - [117, 12374.7]
  - - [1024, 5472, 1, 1024]
    - [131, 10900.1]
  - - [1024, 10152, 1, 33712]
    - [129, 10059.2]
  - - [4096, 5472, 1, 1024]
    - [117, 12630.0]
  - - [1024, 5472, 1, 4096]
    - [123, 10330.2]
  - - [1024, 7440, 1, 4096]
    - [172, 10795.7]
  - - [4096, 7440, 1, 1024]
    - [119, 12175.2]
  - - [1024, 7920, 1, 1024]
    - [110, 12375.9]
  - - [1024, 9648, 1, 33712]
    - [129, 10222.8]
  - - [1024, 6440, 1, 4096]
    - [129, 11951.0]
  - - [1024, 9928, 1, 33712]
    - [134, 10079.2]
  - - [1024, 7176, 1, 33712]
    - [137, 10900.2]
  - - [1024, 4896, 1, 1024]
    - [110, 12207.1]
  - - [1024, 400, 1, 1024]
    - [175, 6889.46]
  - - [4096, 8544, 1, 1024]
    - [118, 12363.4]
  - - [1024, 4896, 1, 33712]
    - [129, 11486.8]
  - - [1024, 1984, 1, 4096]
    - [110, 10429.0]
  - - [1024, 4896, 1, 4096]
    - [140, 10249.2]
  - - [1024, 6128, 1, 1024]
    - [141, 11218.0]
  - - [4096, 6880, 1, 1024]
    - [122, 12221.6]
  - - [4096, 4488, 1, 1024]
    - [140, 11149.5]
  - - [1024, 7144, 1, 33712]
    - [127, 11514.8]
  - - [4096, 8280, 1, 1024]
    - [117, 12671.8]
  - - [1024, 6128, 1, 4096]
    - [117, 11570.7]
  - - [4096, 8680, 1, 1024]
    - [118, 12418.3]
  - - [1024, 5632, 1, 4096]
    - [117, 11821.5]
  - - [1024, 7568, 1, 1024]
    - [146, 11345.6]
  - - [1024, 9200, 1, 4096]
    - [110, 10944.4]
  - - [4096, 7568, 1, 1024]
    - [117, 12688.8]
  - - [1024, 2176, 1, 4096]
    - [113, 10368.5]
  - - [1024, 6080, 1, 1024]
    - [141, 11862.4]
  - - [1024, 7568, 1, 4096]
    - [137, 10696.3]
  - - [1024, 500, 1, 1024]
    - [114, 7225.58]
  - - [4096, 9088, 1, 1024]
    - [117, 12250.8]
  - - [1024, 7992, 1, 33712]
    - [136, 10940.3]
  - - [4096, 9216, 1, 1024]
    - [117, 12727.4]
  - - [1024, 8208, 1, 33712]
    - [123, 10950.3]
  - - [4096, 7992, 1, 1024]
    - [117, 12690.3]
  - - [1024, 7992, 1, 4096]
    - [129, 11454.0]
  - - [1024, 8576, 1, 33712]
    - [136, 10936.6]
  - - [4096, 8576, 1, 1024]
    - [117, 12755.8]
  - - [1024, 1224, 1, 4096]
    - [110, 9938.46]
  - - [1024, 9928, 1, 4096]
    - [133, 11071.6]
  - - [4096, 7384, 1, 1024]
    - [119, 12255.3]
  - - [1024, 7384, 1, 4096]
    - [129, 11220.3]
  - - [1024, 2040, 1, 1024]
    - [167, 10416.3]
  - - [1024, 5784, 1, 1024]
    - [117, 11989.8]
  - - [1024, 8616, 1, 1024]
    - [119, 11697.9]
  - - [1024, 8616, 1, 33712]
    - [136, 11039.5]
  - - [1024, 1856, 1, 1024]
    - [110, 11480.4]
  - - [4096, 8736, 1, 1024]
    - [118, 12361.1]
  - - [4096, 8616, 1, 1024]
    - [117, 12729.0]
  - - [4096, 5784, 1, 1024]
    - [117, 12587.1]
  - - [4096, 5776, 1, 1024]
    - [119, 12200.5]
  - - [1024, 8016, 1, 33712]
    - [151, 10888.0]
  - - [4096, 8960, 1, 1024]
    - [117, 12718.9]
  - - [4096, 8288, 1, 1024]
    - [117, 12678.5]
  - - [1024, 8016, 1, 4096]
    - [117, 11814.2]
  - - [4096, 912, 1, 1024]
    - [111, 11591.5]
  - - [1024, 7776, 1, 1024]
    - [146, 11073.6]
  - - [4096, 9472, 1, 1024]
    - [125, 12722.3]
  - - [1024, 8624, 1, 33712]
    - [136, 11085.9]
  - - [4096, 6240, 1, 1024]
    - [117, 12662.3]
  - - [1024, 5040, 1, 33712]
    - [130, 11108.9]
  - - [4096, 5040, 1, 1024]
    - [122, 11317.5]
  - - [1024, 9440, 1, 1024]
    - [120, 11009.1]
  - - [1024, 5040, 1, 4096]
    - [116, 10328.7]
  - - [1024, 8360, 1, 33712]
    - [116, 11013.9]
  - - [1024, 7904, 1, 4096]
    - [129, 12133.9]
  - - [4096, 8360, 1, 1024]
    - [118, 12332.7]
  - - [1024, 5120, 1, 4096]
    - [129, 11883.4]
  - - [1024, 10224, 1, 1024]
    - [117, 10876.4]
  - - [1024, 8360, 1, 4096]
    - [118, 11013.2]
  - - [1024, 7176, 1, 4096]
    - [117, 11752.3]
  - - [1024, 388, 1, 1024]
    - [167, 6587.56]
  - - [1024, 5576, 1, 1024]
    - [117, 11995.0]
  - - [1024, 3024, 1, 1024]
    - [111, 10215.5]
  - - [1024, 10040, 1, 33712]
    - [134, 10346.7]
  - - [1024, 9000, 1, 1024]
    - [110, 12604.4]
  - - [1024, 9472, 1, 4096]
    - [134, 11548.4]
  - - [1024, 6240, 1, 1024]
    - [117, 11978.4]
  - - [4096, 7296, 1, 1024]
    - [119, 12273.6]
  - - [1024, 8528, 1, 1024]
    - [111, 11693.5]
  - - [4096, 8528, 1, 1024]
    - [118, 12390.5]
  - - [4096, 8184, 1, 1024]
    - [117, 12697.6]
  - - [1024, 8184, 1, 4096]
    - [129, 11398.3]
  - - [1024, 9328, 1, 33712]
    - [135, 10645.0]
  - - [1024, 6032, 1, 1024]
    - [110, 12235.0]
  - - [1024, 9120, 1, 33712]
    - [134, 10237.8]
  - - [1024, 4352, 1, 1024]
    - [110, 11941.0]
  - - [4096, 8128, 1, 1024]
    - [128, 12371.6]
  - - [1024, 6048, 1, 1024]
    - [110, 12252.3]
  - - [1024, 4352, 1, 33712]
    - [110, 10908.0]
  - - [1024, 8256, 1, 33712]
    - [116, 10875.5]
  - - [4096, 9680, 1, 1024]
    - [117, 12654.5]
  - - [1024, 4080, 1, 4096]
    - [117, 11530.2]
  - - [1024, 6496, 1, 33712]
    - [113, 11274.8]
  - - [1024, 5576, 1, 33712]
    - [135, 11350.3]
  - - [1024, 5880, 1, 33712]
    - [129, 11230.8]
  - - [1024, 5880, 1, 4096]
    - [129, 11179.3]
  - - [1024, 5120, 1, 33712]
    - [168, 10096.1]
  - - [4096, 5120, 1, 1024]
    - [142, 12012.1]
  - - [1024, 5504, 1, 4096]
    - [140, 10579.1]
  - - [4096, 7872, 1, 1024]
    - [128, 12349.1]
  - - [1024, 4608, 1, 4096]
    - [129, 11790.1]
  - - [1024, 7872, 1, 4096]
    - [116, 10587.4]
  - - [1024, 8352, 1, 33712]
    - [123, 10911.7]
  - - [1024, 9048, 1, 33712]
    - [136, 10672.6]
  - - [4096, 1232, 1, 1024]
    - [113, 11720.6]
  - - [1024, 7480, 1, 33712]
    - [127, 10947.9]
  - - [1024, 7888, 1, 4096]
    - [129, 12116.4]
  - - [1024, 8680, 1, 33712]
    - [134, 10656.6]
  - - [1024, 8680, 1, 4096]
    - [129, 12280.9]
  - - [1024, 8200, 1, 33712]
    - [116, 10572.2]
  - - [4096, 6272, 1, 1024]
    - [117, 12697.7]
  - - [1024, 10176, 1, 1024]
    - [142, 11191.3]
  - - [1024, 6696, 1, 1024]
    - [148, 11373.0]
  - - [1024, 3120, 1, 4096]
    - [124, 9951.17]
  - - [4096, 6696, 1, 1024]
    - [122, 12280.5]
  - - [1024, 6696, 1, 4096]
    - [134, 10852.7]
  - - [1024, 7072, 1, 4096]
    - [156, 10634.3]
  - - [1024, 6560, 1, 4096]
    - [134, 10629.0]
  - - [4096, 7800, 1, 1024]
    - [128, 12248.6]
  - - [1024, 8360, 1, 1024]
    - [111, 12581.9]
  - - [4096, 8536, 1, 1024]
    - [118, 12367.2]
  - - [1024, 5104, 1, 33712]
    - [129, 11355.5]
  - - [1024, 8712, 1, 1024]
    - [110, 11691.4]
  - - [1024, 8856, 1, 1024]
    - [118, 11023.5]
  - - [1024, 3808, 1, 1024]
    - [161, 10109.8]
  - - [1024, 9952, 1, 1024]
    - [176, 11305.5]
  - - [1024, 8704, 1, 4096]
    - [134, 11457.7]
  - - [4096, 6968, 1, 1024]
    - [117, 12647.5]
  - - [1024, 9152, 1, 4096]
    - [134, 11784.1]
  - - [1024, 8256, 1, 4096]
    - [117, 12091.5]
  - - [1024, 8600, 1, 33712]
    - [136, 10963.2]
  - - [1024, 9656, 1, 33712]
    - [129, 10286.1]
  - - [1024, 8000, 1, 4096]
    - [129, 12282.7]
  - - [1024, 3864, 1, 1024]
    - [113, 11805.6]
  - - [1024, 352, 1, 1024]
    - [115, 6054.77]
  - - [1024, 6272, 1, 1024]
    - [126, 12024.0]
  - - [1024, 6272, 1, 33712]
    - [113, 11276.3]
  - - [1024, 6272, 1, 4096]
    - [129, 12039.8]
  - - [1024, 5304, 1, 1024]
    - [123, 10657.7]
  - - [4096, 7424, 1, 1024]
    - [119, 12322.5]
  - - [1024, 9088, 1, 1024]
    - [166, 12526.9]
  - - [1024, 6880, 1, 4096]
    - [134, 11085.1]
  - - [1024, 8784, 1, 1024]
    - [111, 11713.6]
  - - [1024, 8352, 1, 1024]
    - [119, 11716.9]
  - - [1024, 9088, 1, 33712]
    - [136, 10804.5]
  - - [1024, 6360, 1, 1024]
    - [166, 12329.8]
  - - [1024, 1224, 1, 1024]
    - [112, 8907.92]
  - - [1024, 9088, 1, 4096]
    - [137, 11655.1]
  - - [1024, 7128, 1, 4096]
    - [117, 11924.0]
  - - [4096, 6976, 1, 1024]
    - [122, 12374.5]
  - - [1024, 6528, 1, 4096]
    - [134, 11378.9]
  - - [1024, 7616, 1, 1024]
    - [111, 11701.3]
  - - [1024, 4920, 1, 33712]
    - [168, 10467.7]
  - - [4096, 8584, 1, 1024]
    - [128, 12244.9]
  - - [1024, 9600, 1, 1024]
    - [117, 12590.4]
  - - [4096, 7688, 1, 1024]
    - [128, 12215.0]
  - - [4096, 5304, 1, 1024]
    - [129, 12411.6]
  - - [1024, 7400, 1, 33712]
    - [151, 10832.2]
  - - [4096, 5016, 1, 1024]
    - [117, 12549.2]
  - - [1024, 5016, 1, 4096]
    - [140, 10544.6]
  - - [1024, 7360, 1, 33712]
    - [127, 10952.2]
  - - [1024, 7360, 1, 4096]
    - [129, 11981.1]
  - - [1024, 9424, 1, 1024]
    - [129, 12276.1]
  - - [1024, 10224, 1, 4096]
    - [134, 11355.9]
  - - [1024, 9424, 1, 4096]
    - [117, 11356.5]
  - - [4096, 9792, 1, 1024]
    - [125, 12684.5]
  - - [1024, 7208, 1, 1024]
    - [117, 12109.3]
  - - [1024, 7128, 1, 1024]
    - [120, 11578.6]
  - - [1024, 4488, 1, 1024]
    - [128, 11367.1]
  - - [4096, 7128, 1, 1024]
    - [119, 12188.5]
  - - [1024, 3864, 1, 4096]
    - [129, 10775.2]
  - - [1024, 9248, 1, 4096]
    - [145, 11272.7]
  - - [1024, 5304, 1, 4096]
    - [117, 11451.2]
  - - [1024, 9288, 1, 33712]
    - [135, 10487.4]
  - - [4096, 4480, 1, 1024]
    - [117, 12618.5]
  - - [1024, 9200, 1, 1024]
    - [119, 11146.8]
  - - [4096, 9200, 1, 1024]
    - [118, 12166.3]
  - - [1024, 6560, 1, 1024]
    - [126, 12151.4]
  - - [4096, 6560, 1, 1024]
    - [122, 12244.8]
  - - [1024, 4480, 1, 1024]
    - [137, 11338.1]
  - - [1024, 6688, 1, 4096]
    - [116, 10987.1]
  - - [4096, 3000, 1, 1024]
    - [122, 12100.8]
  - - [1024, 3000, 1, 4096]
    - [129, 9924.65]
  - - [1024, 6840, 1, 33712]
    - [113, 11246.3]
  - - [1024, 7392, 1, 33712]
    - [123, 11154.5]
  - - [1024, 8584, 1, 4096]
    - [129, 12142.8]
  - - [1024, 5328, 1, 1024]
    - [111, 12036.4]
  - - [1024, 6784, 1, 4096]
    - [129, 10509.9]
  - - [1024, 7216, 1, 4096]
    - [124, 10765.3]
  - - [1024, 7192, 1, 1024]
    - [113, 12274.3]
  - - [1024, 9408, 1, 33712]
    - [134, 10361.3]
  - - [4096, 7192, 1, 1024]
    - [117, 12622.7]
  - - [1024, 9240, 1, 33712]
    - [135, 10566.1]
  - - [1024, 2592, 1, 1024]
    - [111, 11784.2]
  - - [4096, 7176, 1, 1024]
    - [119, 12105.1]
  - - [4096, 2592, 1, 1024]
    - [111, 11638.8]
  - - [1024, 2592, 1, 4096]
    - [177, 10084.2]
  - - [4096, 4536, 1, 1024]
    - [160, 12319.5]
  - - [4096, 9000, 1, 1024]
    - [118, 12246.5]
  - - [1024, 9000, 1, 4096]
    - [117, 11959.4]
  - - [1024, 7480, 1, 4096]
    - [117, 11884.2]
  - - [1024, 7216, 1, 1024]
    - [146, 11655.1]
  - - [1024, 8528, 1, 33712]
    - [116, 10625.6]
  - - [1024, 9680, 1, 4096]
    - [129, 12112.7]
  - - [4096, 4608, 1, 1024]
    - [117, 12646.1]
  - - [1024, 8112, 1, 4096]
    - [127, 11671.9]
  - - [1024, 7840, 1, 33712]
    - [151, 10646.7]
  - - [1024, 7656, 1, 1024]
    - [111, 12579.7]
  - - [1024, 7888, 1, 33712]
    - [116, 11005.3]
  - - [4096, 7656, 1, 1024]
    - [117, 12701.9]
  - - [1024, 7656, 1, 4096]
    - [129, 11298.9]
  - - [1024, 6528, 1, 33712]
    - [127, 11262.1]
  - - [1024, 4392, 1, 1024]
    - [110, 12043.2]
  - - [1024, 8496, 1, 1024]
    - [119, 11540.9]
  - - [4096, 4896, 1, 1024]
    - [154, 11503.6]
  - - [1024, 5568, 1, 33712]
    - [113, 10876.7]
  - - [1024, 4080, 1, 1024]
    - [123, 11488.1]
  - - [4096, 9864, 1, 1024]
    - [125, 12619.1]
  - - [1024, 9864, 1, 4096]
    - [113, 11615.2]
  - - [1024, 8544, 1, 1024]
    - [111, 11698.3]
  - - [1024, 9288, 1, 4096]
    - [121, 10939.7]
  - - [1024, 7208, 1, 33712]
    - [113, 10990.6]
  - - [1024, 8184, 1, 33712]
    - [116, 10837.9]
  - - [1024, 5824, 1, 33712]
    - [129, 11237.6]
  - - [4096, 5504, 1, 1024]
    - [132, 12424.3]
  - - [1024, 504, 1, 1024]
    - [112, 7259.37]
  - - [4096, 8256, 1, 1024]
    - [128, 12244.4]
  - - [1024, 1856, 1, 4096]
    - [129, 11189.9]
  - - [1024, 6864, 1, 33712]
    - [137, 11265.9]
  - - [1024, 8592, 1, 1024]
    - [111, 12570.2]
  - - [1024, 5016, 1, 33712]
    - [168, 10247.9]
  - - [1024, 6360, 1, 4096]
    - [156, 10280.1]
  - - [4096, 8592, 1, 1024]
    - [118, 12380.2]
  - - [1024, 3256, 1, 33712]
    - [127, 9698.91]
  - - [1024, 2912, 1, 4096]
    - [129, 11259.0]
  - - [1024, 9752, 1, 4096]
    - [134, 10907.6]
  - - [1024, 3256, 1, 4096]
    - [129, 10840.0]
  - - [1024, 6664, 1, 1024]
    - [148, 11235.7]
  - - [1024, 9656, 1, 1024]
    - [119, 11144.0]
  - - [1024, 6664, 1, 33712]
    - [137, 11758.2]
  - - [1024, 8296, 1, 4096]
    - [129, 11926.8]
  - - [4096, 6840, 1, 1024]
    - [126, 12479.1]
  - - [1024, 10208, 1, 33712]
    - [135, 10100.7]
  - - [1024, 6512, 1, 1024]
    - [110, 12284.7]
  - - [1024, 1584, 1, 4096]
    - [169, 9733.59]
  - - [1024, 6512, 1, 4096]
    - [150, 10909.2]
  - - [1024, 3360, 1, 1024]
    - [123, 10220.5]
  - - [1024, 9888, 1, 1024]
    - [119, 10931.5]
  - - [1024, 7688, 1, 33712]
    - [127, 10795.7]
  - - [1024, 3360, 1, 33712]
    - [134, 9380.34]
  - - [4096, 8816, 1, 1024]
    - [118, 12391.7]
  - - [1024, 9272, 1, 4096]
    - [117, 12037.4]
  - - [1024, 4160, 1, 1024]
    - [117, 11746.2]
  - - [4096, 4160, 1, 1024]
    - [150, 10773.2]
  - - [1024, 6048, 1, 4096]
    - [134, 10477.1]
  - - [1024, 9632, 1, 4096]
    - [131, 11850.4]
  - - [1024, 9144, 1, 33712]
    - [134, 10195.7]
  - - [4096, 9144, 1, 1024]
    - [117, 12714.7]
  - - [4096, 1224, 1, 1024]
    - [117, 11424.7]
  - - [1024, 9024, 1, 33712]
    - [136, 10722.3]
  - - [1024, 7632, 1, 1024]
    - [111, 12534.0]
  - - [4096, 4224, 1, 1024]
    - [122, 11245.0]
  - - [1024, 7568, 1, 33712]
    - [127, 11254.7]
  - - [1024, 9568, 1, 33712]
    - [136, 10458.5]
  - - [4096, 4472, 1, 1024]
    - [117, 12633.9]
  - - [1024, 4472, 1, 4096]
    - [123, 10842.1]
  - - [1024, 6888, 1, 1024]
    - [118, 11259.9]
  - - [1024, 6888, 1, 4096]
    - [140, 10478.1]
  - - [1024, 3864, 1, 33712]
    - [129, 9324.51]
  - - [1024, 7448, 1, 4096]
    - [140, 10682.8]
  - - [1024, 1584, 1, 1024]
    - [110, 10273.0]
  - - [1024, 6688, 1, 1024]
    - [154, 11411.2]
  - - [4096, 6688, 1, 1024]
    - [122, 12277.8]
  - - [4096, 5328, 1, 1024]
    - [122, 12270.0]
  - - [1024, 5328, 1, 4096]
    - [140, 10432.9]
  - - [1024, 4864, 1, 33712]
    - [130, 10651.9]
  - - [1024, 9512, 1, 33712]
    - [136, 10271.8]
  - - [1024, 4640, 1, 33712]
    - [137, 10724.2]
  - - [1024, 5720, 1, 33712]
    - [137, 11743.2]
  - - [4096, 5720, 1, 1024]
    - [119, 12129.6]
  - - [1024, 9000, 1, 33712]
    - [134, 10502.5]
  - - [4096, 6600, 1, 1024]
    - [117, 12657.4]
  - - [1024, 6600, 1, 4096]
    - [132, 11019.0]
  - - [4096, 7640, 1, 1024]
    - [128, 12340.3]
  - - [1024, 7640, 1, 4096]
    - [129, 11276.9]
  - - [1024, 4600, 1, 1024]
    - [113, 12012.9]
  - - [1024, 4600, 1, 33712]
    - [168, 10812.4]
  - - [4096, 4600, 1, 1024]
    - [129, 11620.5]
  - - [1024, 4216, 1, 1024]
    - [110, 11365.7]
  - - [4096, 4216, 1, 1024]
    - [128, 11244.8]
  - - [1024, 7936, 1, 4096]
    - [140, 10759.0]
  - - [1024, 8424, 1, 1024]
    - [111, 12338.2]
  - - [1024, 8968, 1, 33712]
    - [136, 10423.8]
  - - [4096, 8424, 1, 1024]
    - [117, 12715.5]
  - - [1024, 6440, 1, 1024]
    - [111, 12473.8]
  - - [4096, 4560, 1, 1024]
    - [140, 12067.2]
  - - [1024, 4560, 1, 4096]
    - [129, 10857.6]
  - - [1024, 7200, 1, 33712]
    - [113, 10951.7]
  - - [1024, 4760, 1, 1024]
    - [111, 12291.2]
  - - [1024, 512, 1, 1024]
    - [112, 7390.84]
  - - [1024, 7640, 1, 1024]
    - [117, 11675.3]
  - - [1024, 508, 1, 1024]
    - [112, 7308.95]
  - - [4096, 1584, 1, 1024]
    - [117, 12114.8]
  - - [1024, 5840, 1, 33712]
    - [131, 10686.4]
  - - [4096, 9288, 1, 1024]
    - [118, 12205.1]
  - - [4096, 9968, 1, 1024]
    - [117, 12617.3]
  - - [1024, 2304, 1, 4096]
    - [178, 10771.9]
  - - [4096, 1984, 1, 1024]
    - [119, 11350.8]
  - - [4096, 8016, 1, 1024]
    - [118, 12357.9]
  - - [4096, 7360, 1, 1024]
    - [129, 12305.9]
  - - [1024, 6400, 1, 1024]
    - [111, 12383.5]
  - - [4096, 5440, 1, 1024]
    - [119, 12248.2]
  - - [1024, 496, 1, 1024]
    - [114, 7152.0]
  - - [1024, 5632, 1, 33712]
    - [137, 11599.1]
  - - [4096, 5632, 1, 1024]
    - [119, 12161.9]
  - - [1024, 376, 1, 1024]
    - [175, 6459.12]
  - - [1024, 8200, 1, 4096]
    - [117, 11477.9]
  - - [1024, 216, 1, 1024]
    - [158, 4458.51]
  - - [1024, 232, 1, 1024]
    - [179, 4714.53]
  - - [1024, 236, 1, 1024]
    - [179, 4773.61]
  - - [1024, 256, 1, 1024]
    - [114, 4534.38]
  - - [1024, 240, 1, 1024]
    - [180, 4862.02]
  - - [1024, 224, 1, 1024]
    - [158, 4750.83]
  - - [1024, 208, 1, 1024]
    - [158, 4411.48]
  - - [1024, 252, 1, 1024]
    - [114, 4451.5]
  - - [1024, 228, 1, 1024]
    - [180, 4597.6]
  - - [1024, 212, 1, 1024]
    - [158, 4510.92]
  - - [1024, 244, 1, 1024]
    - [114, 4316.0]
  - - [1024, 248, 1, 1024]
    - [114, 4404.59]
  - - [1024, 148, 1, 1024]
    - [110, 3149.13]
  - - [1024, 176, 1, 1024]
    - [113, 3819.32]
  - - [1024, 96, 1, 1024]
    - [110, 2100.65]
  - - [1024, 168, 1, 1024]
    - [110, 3682.29]
  - - [1024, 156, 1, 1024]
    - [110, 3385.3]
  - - [1024, 204, 1, 1024]
    - [158, 4340.7]
  - - [1024, 132, 1, 1024]
    - [113, 2878.79]
  - - [1024, 200, 1, 1024]
    - [158, 4248.69]
  - - [1024, 28, 1, 1024]
    - [113, 616.809]
  - - [1024, 80, 1, 1024]
    - [110, 1756.41]
  - - [1024, 40, 1, 1024]
    - [110, 875.272]
  - - [1024, 68, 1, 1024]
    - [110, 1492.95]
  - - [1024, 124, 1, 1024]
    - [158, 2621.44]
  - - [1024, 52, 1, 1024]
    - [114, 1121.01]
  - - [1024, 192, 1, 1024]
    - [158, 4085.36]
  - - [1024, 24, 1, 1024]
    - [110, 523.416]
  - - [1024, 152, 1, 1024]
    - [110, 3293.05]
  - - [1024, 164, 1, 1024]
    - [113, 3582.63]
  - - [1024, 60, 1, 1024]
    - [181, 1291.35]
  - - [1024, 44, 1, 1024]
    - [113, 967.646]
  - - [1024, 112, 1, 1024]
    - [110, 2450.76]
  - - [1024, 32, 1, 1024]
    - [110, 700.218]
  - - [1024, 172, 1, 1024]
    - [113, 3782.61]
  - - [1024, 140, 1, 1024]
    - [113, 3078.87]
  - - [1024, 116, 1, 1024]
    - [158, 2464.24]
  - - [1024, 128, 1, 1024]
    - [158, 2736.9]
  - - [1024, 92, 1, 1024]
    - [113, 2026.66]
  - - [1024, 56, 1, 1024]
    - [114, 1209.23]
  - - [1024, 88, 1, 1024]
    - [110, 1928.82]
  - - [1024, 188, 1, 1024]
    - [158, 3968.04]
  - - [1024, 136, 1, 1024]
    - [110, 2951.29]
  - - [1024, 20, 1, 1024]
    - [110, 438.368]
  - - [1024, 120, 1, 1024]
    - [158, 2536.88]
  - - [1024, 108, 1, 1024]
    - [110, 2367.19]
  - - [1024, 76, 1, 1024]
    - [110, 1663.02]
  - - [1024, 104, 1, 1024]
    - [113, 2287.16]
  - - [1024, 64, 1, 1024]
    - [114, 1402.78]
  - - [1024, 184, 1, 1024]
    - [158, 3902.47]
  - - [1024, 100, 1, 1024]
    - [113, 2195.51]
  - - [1024, 48, 1, 1024]
    - [113, 1050.33]
  - - [1024, 180, 1, 1024]
    - [114, 3861.37]
  - - [1024, 160, 1, 1024]
    - [113, 3506.94]
  - - [1024, 144, 1, 1024]
    - [110, 3135.28]
  - - [1024, 84, 1, 1024]
    - [110, 1838.07]
  - - [1024, 72, 1, 1024]
    - [110, 1580.77]
  - - [1024, 36, 1, 1024]
    - [110, 787.745]
  - - [1024, 16, 1, 1024]
    - [182, 438.735]
  - - [1024, 12, 1, 1024]
    - [183, 346.446]
  - - [1024, 8, 1, 1024]
    - [183, 230.456]
  - - [1024, 4, 1, 1024]
    - [183, 115.228]
- null
