library/src/blas3/Tensile/Logic/asm_full/vega20_Cijk_Ailk_Bljk_HB.yaml
- {MinimumRequiredVersion: 4.5.0}
- vega20
- gfx906
- [Device 66a0, Device 66a1, Device 66a7]
    SolutionIndex: 0
    SolutionNameMin: Cijk_Ailk_Bljk_HB_MT256x064x08_PGR1_PLR1_TT08_08
    SolutionIndex: 1
    SolutionNameMin: Cijk_Ailk_Bljk_HB_MT016x016x16_PGR1_PLR1_TT02_02
    SolutionIndex: 2
    SolutionNameMin: Cijk_Ailk_Bljk_HB_MT032x008x16_PGR1_PLR1_TT02_02
    SolutionIndex: 3
    SolutionNameMin: Cijk_Ailk_Bljk_HB_MT032x016x16_PGR1_PLR1_TT02_02
    SolutionIndex: 4
    SolutionNameMin: Cijk_Ailk_Bljk_HB_MT064x016x16_PGR1_PLR1_TT04_02
    SolutionIndex: 5
    SolutionNameMin: Cijk_Ailk_Bljk_HB_MT064x032x16_PGR1_PLR1_TT04_04
    SolutionIndex: 6
    SolutionNameMin: Cijk_Ailk_Bljk_HB_MT128x128x16_PGR1_PLR1_TT08_08
    SolutionIndex: 7
    SolutionNameMin: Cijk_Ailk_Bljk_HB_MT016x016x32_PGR1_PLR1_TT02_02
    SolutionIndex: 8
    SolutionNameMin: Cijk_Ailk_Bljk_HB_MT032x008x32_PGR1_PLR1_TT02_02
    SolutionIndex: 9
    SolutionNameMin: Cijk_Ailk_Bljk_HB_MT032x016x32_PGR1_PLR1_TT02_02
    SolutionIndex: 10
    SolutionNameMin: Cijk_Ailk_Bljk_HB_MT064x008x32_PGR1_PLR1_TT02_02
    SolutionIndex: 11
    SolutionNameMin: Cijk_Ailk_Bljk_HB_MT064x016x32_PGR1_PLR1_TT02_02
    SolutionIndex: 12
    SolutionNameMin: Cijk_Ailk_Bljk_HB_MT032x008x64_PGR1_PLR1_TT02_02
    SolutionIndex: 13
    SolutionNameMin: Cijk_Ailk_Bljk_HB_MT032x016x16_PGR1_PLR1_TT02_02
    SolutionIndex: 14
    SolutionNameMin: Cijk_Ailk_Bljk_HB_MT064x016x16_PGR1_PLR1_TT04_02
    SolutionIndex: 15
    SolutionNameMin: Cijk_Ailk_Bljk_HB_MT064x032x16_PGR1_PLR1_TT04_04
    SolutionIndex: 16
    SolutionNameMin: Cijk_Ailk_Bljk_HB_MT032x008x16_PGR1_PLR1_TT02_02
    SolutionIndex: 17
    SolutionNameMin: Cijk_Ailk_Bljk_HB_MT064x016x16_PGR1_PLR1_TT04_04
    SolutionIndex: 18
    SolutionNameMin: Cijk_Ailk_Bljk_HB_MT016x016x24_PGR1_PLR1_TT02_02
    SolutionIndex: 19
    SolutionNameMin: Cijk_Ailk_Bljk_HB_MT032x032x24_PGR1_PLR1_TT04_04
    SolutionIndex: 20
    SolutionNameMin: Cijk_Ailk_Bljk_HB_MT032x032x24_PGR1_PLR1_TT04_04
    SolutionIndex: 21
    SolutionNameMin: Cijk_Ailk_Bljk_HB_MT064x016x32_PGR1_PLR1_TT02_02
    SolutionIndex: 22
    SolutionNameMin: Cijk_Ailk_Bljk_HB_MT128x032x32_PGR1_PLR1_TT04_04
    SolutionIndex: 23
    SolutionNameMin: Cijk_Ailk_Bljk_HB_MT032x008x32_PGR1_PLR1_TT02_02
    SolutionIndex: 24
    SolutionNameMin: Cijk_Ailk_Bljk_HB_MT128x064x08_PGR1_PLR1_TT08_04
    SolutionIndex: 25
    SolutionNameMin: Cijk_Ailk_Bljk_HB_MT128x128x08_PGR1_PLR1_TT08_08
    SolutionIndex: 26
    SolutionNameMin: Cijk_Ailk_Bljk_HB_MT064x064x16_PGR0_PLR1_TT08_08
    SolutionIndex: 27
    SolutionNameMin: Cijk_Ailk_Bljk_HB_MT064x064x16_PGR1_PLR1_TT04_04
    SolutionIndex: 28
    SolutionNameMin: Cijk_Ailk_Bljk_HB_MT128x064x16_PGR0_PLR1_TT08_04
    SolutionIndex: 29
    SolutionNameMin: Cijk_Ailk_Bljk_HB_MT128x064x16_PGR1_PLR1_TT08_04
    SolutionIndex: 30
    SolutionNameMin: Cijk_Ailk_Bljk_HB_MT128x128x16_PGR0_PLR1_TT08_08
    SolutionIndex: 31
    SolutionNameMin: Cijk_Ailk_Bljk_HB_MT128x128x16_PGR1_PLR1_TT08_08
    SolutionIndex: 32
    SolutionNameMin: Cijk_Ailk_Bljk_HB_MT128x064x32_PGR0_PLR1_TT08_04
    SolutionIndex: 33
    SolutionNameMin: Cijk_Ailk_Bljk_HB_MT128x064x32_PGR1_PLR1_TT08_04
    SolutionIndex: 34
    SolutionNameMin: Cijk_Ailk_Bljk_HB_MT128x128x32_PGR0_PLR1_TT08_08
    SolutionIndex: 35
    SolutionNameMin: Cijk_Ailk_Bljk_HB_MT128x128x32_PGR1_PLR1_TT08_08
    SolutionIndex: 36
    SolutionNameMin: Cijk_Ailk_Bljk_HB_MT128x128x64_PGR0_PLR1_TT08_08
    SolutionIndex: 37
    SolutionNameMin: Cijk_Ailk_Bljk_HB_MT064x128x16_PGR1_PLR1_TT04_08
    SolutionIndex: 38
    SolutionNameMin: Cijk_Ailk_Bljk_HB_MT128x064x16_PGR1_PLR1_TT08_04
    SolutionIndex: 39
    SolutionNameMin: Cijk_Ailk_Bljk_HB_MT256x064x16_PGR1_PLR1_TT08_04
    SolutionIndex: 40
    SolutionNameMin: Cijk_Ailk_Bljk_HB_MT064x128x16_PGR1_PLR1_TT04_08
    SolutionIndex: 41
    SolutionNameMin: Cijk_Ailk_Bljk_HB_MT128x064x16_PGR1_PLR1_TT04_08
    SolutionIndex: 42
    SolutionNameMin: Cijk_Ailk_Bljk_HB_MT128x064x32_PGR1_PLR1_TT04_04
    SolutionIndex: 43
    SolutionNameMin: Cijk_Ailk_Bljk_HB_MT064x128x16_PGR0_PLR0_TT04_08
    SolutionIndex: 44
    SolutionNameMin: Cijk_Ailk_Bljk_HB_MT128x064x16_PGR0_PLR0_TT08_04
    SolutionIndex: 45
    SolutionNameMin: Cijk_Ailk_Bljk_HB_MT256x032x16_PGR0_PLR0_TT08_04
    SolutionIndex: 46
    SolutionNameMin: Cijk_Ailk_Bljk_HB_MT064x128x08_PGR0_PLR0_TT04_08
    SolutionIndex: 47
    SolutionNameMin: Cijk_Ailk_Bljk_HB_MT064x064x08_PGR1_PLR1_TT04_04
    SolutionIndex: 48
    SolutionNameMin: Cijk_Ailk_Bljk_HB_MT064x128x04_PGR0_PLR1_TT04_08
    SolutionIndex: 49
    SolutionNameMin: Cijk_Ailk_Bljk_HB_MT064x064x08_PGR1_PLR1_TT04_04
    SolutionIndex: 0
    SolutionNameMin: Cijk_Ailk_Bljk_HB_MT256x064x08_GSU01_LPB00_NLCB01_PGR1_PLR1_TT08_08_WG32_08_01_WGM01
    SolutionIndex: 1
    SolutionNameMin: Cijk_Ailk_Bljk_HB_MT128x128x16_GSU01_LPB00_NLCB01_PGR1_PLR1_TT08_08_WG16_16_01_WGM01
    SolutionIndex: 2
    SolutionNameMin: Cijk_Ailk_Bljk_HB_MT128x128x16_GSU01_LPB00_NLCB01_PGR1_PLR1_TT08_08_WG16_16_01_WGM08
    SolutionIndex: 3
    SolutionNameMin: Cijk_Ailk_Bljk_HB_MT128x064x32_GSU03_LPB00_NLCB01_PGR1_PLR1_TT08_08_WG16_08_02_WGM01
    SolutionIndex: 4
    SolutionNameMin: Cijk_Ailk_Bljk_HB_MT256x064x08_GSU01_LPB08_NLCB01_PGR1_PLR1_TT08_08_WG32_08_01_WGM01
    SolutionIndex: 5
    SolutionNameMin: Cijk_Ailk_Bljk_HB_MT256x064x08_GSU01_LPB08_NLCB01_PGR1_PLR1_TT08_08_WG32_08_01_WGM64
    SolutionIndex: 6
    SolutionNameMin: Cijk_Ailk_Bljk_HB_MT128x032x32_GSU01_LPB08_NLCB01_PGR1_PLR1_TT08_08_WG16_04_04_WGM08
- - - [4096, 7000, 1, 4096]
    - [28, 17758.7]
  - - [5124, 9124, 1, 1760]
    - [26, 19191.5]
  - - [1760, 32, 1, 1760]
    - [23, 2647.52]
  - - [1024, 1500, 1, 1536]
    - [29, 15924.0]
  - - [512, 24000, 1, 2048]
    - [34, 17194.5]
  - - [3072, 24000, 1, 1024]
    - [31, 19918.9]
  - - [1024, 3000, 1, 2560]
    - [31, 17915.8]
  - - [512, 3136, 1, 2048]
    - [39, 13195.6]
  - - [7680, 4, 1, 2560]
    - [8, 1462.86]
  - - [64, 193600, 1, 64]
    - [37, 15156.5]
  - - [8448, 1500, 1, 2816]
    - [24, 18728.4]
  - - [2560, 7000, 1, 2560]
    - [31, 19227.5]
  - - [3072, 16, 1, 1024]
    - [8, 2125.49]
  - - [512, 48000, 1, 2048]
    - [34, 18280.6]
  - - [1760, 64, 1, 1760]
    - [11, 4640.6]
  - - [1024, 16, 1, 512]
    - [8, 631.672]
  - - [196, 256, 64, 1024]
    - [45, 11526.7]
  - - [512, 48000, 1, 1536]
    - [31, 19942.5]
  - - [2560, 32, 1, 2560]
    - [3, 3620.77]
  - - [4608, 1500, 1, 1536]
    - [31, 17997.1]
  - - [2048, 128, 1, 2048]
    - [17, 8659.21]
  - - [1024, 24000, 1, 2560]
    - [31, 19940.0]
  - - [4608, 3000, 1, 1536]
    - [31, 18580.4]
  - - [5124, 9124, 1, 2048]
    - [31, 18038.2]
  - - [2048, 16, 1, 2048]
    - [8, 1594.79]
  - - [1024, 700, 1, 512]
    - [27, 10845.2]
  - - [3072, 1, 1, 128]
    - [8, 65.536]
  - - [5124, 700, 1, 2560]
    - [31, 15928.0]
  - - [8448, 16, 1, 2816]
    - [3, 4815.7]
  - - [6144, 6000, 1, 2560]
    - [29, 18849.6]
  - - [4608, 32, 1, 1536]
    - [3, 5028.69]
  - - [3072, 64, 1, 1024]
    - [14, 6244.62]
  - - [512, 16, 1, 512]
    - [2, 312.076]
  - - [7680, 2, 1, 2560]
    - [8, 735.808]
  - - [4224, 1, 1, 128]
    - [2, 86.6462]
  - - [7680, 1, 1, 2560]
    - [8, 366.259]
  - - [128, 1500, 1, 1280]
    - [4, 6269.39]
  - - [1024, 1500, 1, 2816]
    - [29, 16197.5]
  - - [6144, 2, 1, 2560]
    - [8, 587.767]
  - - [8448, 48000, 1, 2816]
    - [34, 15705.4]
  - - [512, 6000, 1, 2048]
    - [32, 13838.3]
  - - [4224, 1500, 1, 176]
    - [24, 15858.0]
  - - [1024, 6000, 1, 2816]
    - [31, 19036.1]
  - - [1024, 48000, 1, 1536]
    - [31, 20447.6]
  - - [1024, 48000, 1, 2560]
    - [31, 20472.8]
  - - [4096, 32, 1, 4096]
    - [21, 5601.74]
  - - [512, 16, 1, 500000]
    - [12, 442.804]
  - - [2560, 128, 1, 2560]
    - [15, 8230.58]
  - - [4608, 24000, 1, 1536]
    - [31, 19518.7]
  - - [512, 2, 1, 500000]
    - [12, 55.3519]
  - - [7680, 48000, 1, 2560]
    - [35, 14279.9]
  - - [3072, 48000, 1, 1024]
    - [31, 20251.7]
  - - [1760, 16, 1, 1760]
    - [23, 1358.6]
  - - [1024, 1500, 1, 2048]
    - [32, 12117.6]
  - - [1024, 16, 1, 500000]
    - [12, 885.01]
  - - [64, 193600, 1, 256]
    - [40, 16929.6]
  - - [1024, 3000, 1, 2048]
    - [32, 13919.2]
  - - [6144, 4, 1, 2560]
    - [8, 1170.29]
  - - [1024, 6000, 1, 2048]
    - [34, 16080.8]
  - - [512, 24000, 1, 2816]
    - [31, 19698.4]
  - - [6144, 48000, 1, 2560]
    - [36, 13729.3]
  - - [1760, 7000, 1, 1760]
    - [24, 18317.2]
  - - [8448, 3000, 1, 2816]
    - [31, 19395.8]
  - - [3072, 4, 1, 1024]
    - [12, 553.825]
  - - [4608, 48000, 1, 1536]
    - [34, 18159.0]
  - - [2048, 32, 1, 2048]
    - [23, 3044.87]
  - - [7680, 1500, 1, 2560]
    - [31, 18043.1]
  - - [4096, 128, 1, 4096]
    - [22, 11983.7]
  - - [4608, 16, 1, 1536]
    - [3, 3124.9]
  - - [512, 3000, 1, 1536]
    - [29, 15889.7]
  - - [3072, 2, 1, 1024]
    - [12, 275.941]
  - - [8448, 1, 1, 2816]
    - [10, 378.815]
  - - [1024, 3000, 1, 2816]
    - [31, 17977.5]
  - - [128, 1, 1, 1408]
    - [18, 5.91286]
  - - [64, 1, 1, 1216]
    - [1, 2.89524]
  - - [1024, 2, 1, 512]
    - [7, 77.1012]
  - - [1024, 4, 1, 500000]
    - [12, 221.402]
  - - [6144, 1, 1, 2560]
    - [8, 294.323]
  - - [5124, 9124, 1, 2560]
    - [25, 18345.3]
  - - [512, 48000, 1, 2816]
    - [31, 20004.5]
  - - [512, 3000, 1, 2816]
    - [29, 16216.9]
  - - [1024, 24000, 1, 1536]
    - [31, 19866.9]
  - - [7680, 6000, 1, 2560]
    - [31, 19730.5]
  - - [1760, 128, 1, 1760]
    - [17, 7364.28]
  - - [512, 1500, 1, 2816]
    - [27, 13290.9]
  - - [512, 1, 1, 512]
    - [2, 19.2753]
  - - [512, 6000, 1, 2560]
    - [31, 17919.1]
  - - [512, 8, 1, 500000]
    - [12, 221.402]
  - - [512, 24000, 1, 2560]
    - [31, 19653.0]
  - - [6144, 3000, 1, 2560]
    - [30, 18518.8]
  - - [1024, 24000, 1, 2816]
    - [31, 19960.7]
  - - [2048, 7000, 1, 2048]
    - [34, 17695.4]
  - - [7680, 3000, 1, 2560]
    - [24, 18689.4]
  - - [1024, 4, 1, 512]
    - [7, 156.038]
  - - [5124, 700, 1, 2048]
    - [35, 13901.9]
  - - [5124, 9124, 1, 4096]
    - [29, 18289.2]
  - - [4096, 64, 1, 4096]
    - [17, 8853.41]
  - - [256, 193600, 1, 64]
    - [0, 18088.1]
  - - [7680, 32, 1, 2560]
    - [19, 8260.84]
  - - [2560, 64, 1, 2560]
    - [13, 5711.2]
  - - [3072, 128, 1, 1024]
    - [15, 9036.2]
  - - [8448, 6000, 1, 2816]
    - [31, 19938.0]
  - - [7680, 64, 1, 2560]
    - [5, 11616.4]
  - - [5124, 1500, 1, 2560]
    - [34, 16624.0]
  - - [1024, 1500, 1, 2560]
    - [29, 16115.4]
  - - [512, 4, 1, 512]
    - [2, 77.1012]
  - - [1024, 6000, 1, 2560]
    - [31, 18913.7]
  - - [3072, 32, 1, 1024]
    - [3, 3895.64]
  - - [6144, 32, 1, 2560]
    - [20, 6594.82]
  - - [196, 1024, 64, 256]
    - [44, 13919.5]
  - - [512, 50176, 1, 128]
    - [6, 18717.8]
  - - [4608, 1, 1, 1536]
    - [8, 215.264]
  - - [1024, 32, 1, 512]
    - [9, 1271.0]
  - - [7680, 24000, 1, 2560]
    - [36, 15770.0]
  - - [8448, 4, 1, 2816]
    - [10, 1511.41]
  - - [512, 1, 1, 500000]
    - [12, 27.6757]
  - - [176, 1500, 1, 1408]
    - [5, 6444.38]
  - - [512, 3000, 1, 2560]
    - [29, 16120.7]
  - - [8448, 24000, 1, 2816]
    - [36, 15292.2]
  - - [4608, 2, 1, 1536]
    - [23, 429.483]
  - - [512, 6000, 1, 1536]
    - [31, 17659.4]
  - - [7680, 128, 1, 2560]
    - [29, 14617.7]
  - - [3072, 6000, 1, 1024]
    - [31, 18437.8]
  - - [3072, 1500, 1, 128]
    - [29, 14716.2]
  - - [2048, 3136, 1, 512]
    - [41, 17263.4]
  - - [1024, 3000, 1, 1536]
    - [31, 17701.8]
  - - [512, 4, 1, 500000]
    - [12, 110.703]
  - - [512, 6000, 1, 2816]
    - [31, 17947.6]
  - - [128, 50176, 1, 512]
    - [38, 17234.5]
  - - [256, 12544, 1, 1024]
    - [42, 14914.4]
  - - [1024, 12544, 1, 256]
    - [38, 18333.7]
  - - [512, 48000, 1, 2560]
    - [31, 19983.5]
  - - [2560, 16, 1, 2560]
    - [8, 1956.3]
  - - [2048, 64, 1, 2048]
    - [21, 5275.85]
  - - [512, 2, 1, 512]
    - [2, 38.3251]
  - - [1024, 1, 1, 512]
    - [7, 39.2431]
  - - [512, 1500, 1, 2560]
    - [27, 12519.6]
  - - [512, 24000, 1, 1536]
    - [31, 19527.4]
  - - [1024, 1, 1, 500000]
    - [12, 55.35]
  - - [6144, 16, 1, 2560]
    - [3, 4279.9]
  - - [1024, 24000, 1, 2048]
    - [34, 18412.8]
  - - [4096, 16, 1, 4096]
    - [8, 3207.88]
  - - [512, 32, 1, 512]
    - [8, 639.376]
  - - [5124, 1500, 1, 2048]
    - [35, 14438.0]
  - - [3072, 1500, 1, 1024]
    - [29, 16230.7]
  - - [1024, 2, 1, 500000]
    - [12, 110.701]
  - - [1024, 8, 1, 500000]
    - [12, 442.804]
  - - [7680, 16, 1, 2560]
    - [21, 5201.27]
  - - [6144, 1500, 1, 2560]
    - [31, 18828.6]
  - - [3072, 1, 1, 1024]
    - [12, 138.456]
  - - [1024, 48000, 1, 2816]
    - [31, 20497.5]
  - - [8448, 2, 1, 2816]
    - [10, 751.883]
  - - [4608, 4, 1, 1536]
    - [8, 856.887]
  - - [1024, 6000, 1, 1536]
    - [31, 18736.5]
  - - [8448, 32, 1, 2816]
    - [5, 6831.18]
  - - [512, 3000, 1, 2048]
    - [35, 12155.1]
  - - [6144, 24000, 1, 2560]
    - [36, 15660.0]
  - - [4608, 6000, 1, 1536]
    - [31, 19538.5]
  - - [1024, 1024, 1, 1024]
    - [35, 14113.3]
  - - [512, 1500, 1, 2048]
    - [33, 10176.4]
  - - [512, 1500, 1, 1536]
    - [27, 12066.8]
  - - [128, 1, 1, 1024]
    - [16, 5.74877]
  - - [3072, 3000, 1, 1024]
    - [29, 17723.1]
  - - [1024, 48000, 1, 2048]
    - [34, 19113.1]
  - - [3136, 64, 128, 64]
    - [54, 16298.2]
  - - [784, 512, 64, 128]
    - [51, 16567.6]
  - - [3136, 256, 64, 64]
    - [51, 17694.4]
  - - [784, 128, 128, 512]
    - [51, 17166.1]
  - - [784, 128, 64, 512]
    - [51, 16494.5]
  - - [3136, 512, 1, 2048]
    - [53, 13830.5]
  - - [12544, 256, 1, 1024]
    - [56, 15791.1]
  - - [3136, 64, 128, 256]
    - [54, 18292.9]
  - - [3136, 64, 64, 256]
    - [55, 17910.3]
  - - [3136, 2048, 1, 512]
    - [52, 16587.6]
  - - [784, 512, 128, 128]
    - [51, 16897.9]
  - - [3136, 64, 64, 64]
    - [50, 15383.3]
  - - [12544, 1024, 1, 256]
    - [51, 18236.1]
  - - [3136, 256, 128, 64]
    - [51, 18091.6]
- - - -1
    - - - 1
        - - - 32
            - - [2944, 49]
              - [3584, 48]
              - [5888, 49]
              - [-1, 48]
          - - 64
            - - [2944, 49]
              - [3584, 48]
              - [-1, 49]
          - - 128
            - - [1024, 49]
              - [1408, 48]
              - [5056, 49]
              - [-1, 48]
          - - 256
            - - [64, 49]
              - [128, 48]
              - [1408, 49]
              - [2944, 48]
              - [4288, 49]
              - [-1, 48]
          - - 448
            - - [1024, 49]
              - [1408, 48]
              - [1856, 49]
              - [-1, 48]
          - - 704
            - - [128, 49]
              - [256, 48]
              - [704, 49]
              - [-1, 48]
          - - 1024
            - - [128, 49]
              - [256, 48]
              - [448, 49]
              - [704, 48]
              - [1024, 49]
              - [-1, 48]
          - - 1408
            - - [256, 49]
              - [448, 48]
              - [704, 49]
              - [-1, 48]
          - - 1856
            - - [448, 49]
              - [-1, 48]
          - - 2368
            - - [256, 49]
              - [-1, 48]
          - - 2944
            - - [128, 49]
              - [-1, 48]
          - - 3584
            - - [64, 48]
              - [256, 49]
              - [-1, 48]
          - - 4288
            - - [32, 48]
              - [128, 49]
              - [-1, 48]
          - - 5056
            - - [128, 49]
              - [4288, 48]
              - [5056, 49]
              - [-1, 48]
          - - 5888
            - - [32, 48]
              - [64, 49]
              - [-1, 48]
          - - -1
            - - [32, 49]
              - [64, 48]
              - [128, 49]
              - [-1, 48]
      - - 32
        - - - 64
            - - [256, 47]
              - [448, 46]
              - [-1, 47]
          - - 128
            - - [128, 47]
              - [256, 46]
              - [1024, 47]
              - [1408, 46]
              - [-1, 47]
          - - 256
            - - [1408, 47]
              - [1856, 46]
              - [4288, 47]
              - [-1, 46]
          - - 448
            - - [2368, 47]
              - [-1, 46]
          - - 704
            - - [1408, 47]
              - [-1, 46]
          - - 1024
            - - [1024, 47]
              - [-1, 46]
          - - 1408
            - - [704, 47]
              - [-1, 46]
          - - 1856
            - - [448, 47]
              - [1856, 46]
              - [2368, 47]
              - [-1, 46]
          - - 2368
            - - [448, 47]
              - [-1, 46]
          - - 2944
            - - [128, 47]
              - [256, 46]
              - [704, 47]
              - [-1, 46]
          - - 3584
            - - [704, 47]
              - [-1, 46]
          - - 4288
            - - [256, 47]
              - [704, 46]
              - [1024, 47]
              - [-1, 46]
          - - 5056
            - - [32, 46]
              - [448, 47]
              - [-1, 46]
          - - 5888
            - - [256, 47]
              - [-1, 46]
          - - -1
            - - [64, 47]
              - [256, 46]
              - [448, 47]
              - [-1, 46]
      - - 256
        - - - 1
            - - [-1, 49]
          - - 32
            - - [-1, 47]
          - - 64
            - - [1, 49]
              - [32, 47]
              - [64, 2]
              - [1024, 1]
              - [1408, 3]
              - [1856, 10]
              - [2368, 4]
              - [2944, 14]
              - [3584, 17]
              - [4288, 14]
              - [-1, 5]
          - - 128
            - - [1, 49]
              - [32, 47]
              - [64, 2]
              - [256, 8]
              - [448, 2]
              - [704, 11]
              - [1024, 21]
              - [1408, 4]
              - [1856, 27]
              - [5056, 5]
              - [5888, 27]
              - [-1, 29]
          - - 256
            - - [1, 49]
              - [32, 47]
              - [64, 7]
              - [256, 8]
              - [448, 3]
              - [704, 20]
              - [2944, 27]
              - [3584, 29]
              - [5056, 27]
              - [-1, 29]
          - - 448
            - - [1, 49]
              - [32, 47]
              - [64, 7]
              - [128, 11]
              - [256, 10]
              - [448, 4]
              - [1408, 27]
              - [1856, 29]
              - [2368, 27]
              - [2944, 29]
              - [3584, 27]
              - [4288, 26]
              - [5888, 29]
              - [-1, 26]
          - - 704
            - - [1, 49]
              - [32, 47]
              - [64, 1]
              - [128, 21]
              - [256, 20]
              - [1856, 27]
              - [2368, 29]
              - [2944, 26]
              - [3584, 27]
              - [4288, 26]
              - [5056, 31]
              - [5888, 26]
              - [-1, 31]
          - - 1024
            - - [1, 49]
              - [32, 47]
              - [64, 8]
              - [128, 11]
              - [704, 27]
              - [2368, 29]
              - [2944, 31]
              - [4288, 29]
              - [-1, 31]
          - - 1408
            - - [1, 49]
              - [32, 47]
              - [64, 3]
              - [128, 17]
              - [448, 27]
              - [2368, 29]
              - [5888, 31]
              - [-1, 29]
          - - 1856
            - - [1, 49]
              - [32, 47]
              - [64, 3]
              - [128, 17]
              - [256, 27]
              - [448, 29]
              - [704, 27]
              - [1024, 29]
              - [1408, 27]
              - [2944, 29]
              - [4288, 31]
              - [5056, 26]
              - [-1, 31]
          - - 2368
            - - [1, 49]
              - [32, 47]
              - [64, 4]
              - [128, 5]
              - [448, 27]
              - [1408, 29]
              - [2368, 24]
              - [2944, 31]
              - [4288, 24]
              - [-1, 31]
          - - 2944
            - - [1, 49]
              - [32, 47]
              - [64, 17]
              - [128, 5]
              - [256, 27]
              - [704, 29]
              - [1408, 31]
              - [1856, 24]
              - [2368, 31]
              - [2944, 24]
              - [3584, 31]
              - [5056, 24]
              - [-1, 31]
          - - 3584
            - - [1, 49]
              - [32, 47]
              - [64, 17]
              - [128, 15]
              - [1024, 29]
              - [1408, 31]
              - [2944, 24]
              - [-1, 31]
          - - 4288
            - - [1, 49]
              - [32, 47]
              - [64, 4]
              - [128, 5]
              - [256, 27]
              - [1024, 29]
              - [1856, 31]
              - [2944, 24]
              - [3584, 31]
              - [4288, 24]
              - [5056, 26]
              - [5888, 31]
              - [-1, 26]
          - - 5056
            - - [1, 49]
              - [32, 47]
              - [128, 5]
              - [256, 27]
              - [704, 29]
              - [1408, 31]
              - [1856, 26]
              - [2368, 31]
              - [2944, 24]
              - [3584, 31]
              - [4288, 26]
              - [5888, 31]
              - [-1, 26]
          - - 5888
            - - [1, 49]
              - [32, 47]
              - [64, 5]
              - [128, 27]
              - [704, 29]
              - [1408, 31]
              - [2368, 24]
              - [-1, 31]
          - - -1
            - - [1, 49]
              - [32, 47]
              - [64, 5]
              - [448, 29]
              - [704, 24]
              - [1024, 31]
              - [2368, 24]
              - [3584, 31]
              - [5056, 26]
              - [-1, 31]
      - - 1280
        - - - 1
            - - [-1, 49]
          - - 32
            - - [-1, 47]
          - - 64
            - - [1, 49]
              - [32, 47]
              - [64, 11]
              - [128, 8]
              - [256, 12]
              - [1024, 8]
              - [1408, 3]
              - [1856, 11]
              - [2368, 3]
              - [2944, 4]
              - [3584, 17]
              - [5888, 5]
              - [-1, 17]
          - - 128
            - - [1, 49]
              - [32, 47]
              - [448, 8]
              - [704, 3]
              - [1024, 11]
              - [1408, 4]
              - [1856, 20]
              - [2944, 5]
              - [3584, 15]
              - [5056, 5]
              - [5888, 27]
              - [-1, 29]
          - - 256
            - - [1, 49]
              - [32, 47]
              - [256, 8]
              - [448, 11]
              - [1024, 20]
              - [2944, 27]
              - [3584, 29]
              - [5056, 27]
              - [-1, 29]
          - - 448
            - - [1, 49]
              - [32, 47]
              - [128, 8]
              - [256, 21]
              - [448, 19]
              - [1408, 27]
              - [1856, 29]
              - [2368, 27]
              - [3584, 29]
              - [4288, 26]
              - [5056, 29]
              - [5888, 31]
              - [-1, 26]
          - - 704
            - - [1, 49]
              - [32, 47]
              - [64, 8]
              - [128, 3]
              - [256, 20]
              - [1856, 27]
              - [2368, 29]
              - [2944, 26]
              - [3584, 31]
              - [4288, 26]
              - [5056, 31]
              - [5888, 26]
              - [-1, 31]
          - - 1024
            - - [1, 49]
              - [32, 47]
              - [64, 8]
              - [128, 11]
              - [704, 27]
              - [2368, 29]
              - [2944, 31]
              - [3584, 29]
              - [4288, 24]
              - [-1, 31]
          - - 1408
            - - [1, 49]
              - [32, 47]
              - [64, 3]
              - [128, 4]
              - [448, 27]
              - [2368, 29]
              - [5888, 31]
              - [-1, 24]
          - - 1856
            - - [1, 49]
              - [32, 47]
              - [64, 11]
              - [128, 17]
              - [256, 27]
              - [448, 29]
              - [704, 27]
              - [1024, 29]
              - [1408, 31]
              - [1856, 29]
              - [2944, 24]
              - [4288, 31]
              - [5056, 26]
              - [-1, 31]
          - - 2368
            - - [1, 49]
              - [32, 47]
              - [64, 3]
              - [128, 5]
              - [448, 27]
              - [1024, 29]
              - [2368, 24]
              - [2944, 31]
              - [4288, 24]
              - [-1, 31]
          - - 2944
            - - [1, 49]
              - [32, 47]
              - [64, 4]
              - [128, 5]
              - [256, 27]
              - [704, 29]
              - [1408, 31]
              - [1856, 24]
              - [2368, 31]
              - [3584, 24]
              - [-1, 31]
          - - 3584
            - - [1, 49]
              - [32, 47]
              - [64, 17]
              - [128, 5]
              - [1024, 29]
              - [1408, 31]
              - [3584, 24]
              - [-1, 31]
          - - 4288
            - - [1, 49]
              - [32, 47]
              - [128, 5]
              - [256, 27]
              - [704, 29]
              - [1024, 24]
              - [1408, 31]
              - [1856, 25]
              - [2944, 24]
              - [3584, 31]
              - [4288, 26]
              - [5056, 24]
              - [5888, 29]
              - [-1, 24]
          - - 5056
            - - [1, 49]
              - [32, 47]
              - [64, 5]
              - [128, 15]
              - [256, 27]
              - [704, 29]
              - [1408, 31]
              - [1856, 26]
              - [3584, 31]
              - [4288, 24]
              - [5056, 31]
              - [5888, 25]
              - [-1, 26]
          - - 5888
            - - [1, 49]
              - [32, 47]
              - [64, 5]
              - [128, 27]
              - [704, 29]
              - [1024, 25]
              - [1408, 31]
              - [1856, 24]
              - [2944, 31]
              - [3584, 24]
              - [5056, 25]
              - [5888, 24]
              - [-1, 31]
          - - -1
            - - [1, 49]
              - [32, 47]
              - [64, 15]
              - [448, 29]
              - [1024, 31]
              - [1856, 24]
              - [2944, 31]
              - [3584, 24]
              - [5888, 31]
              - [-1, 26]
      - - -1
        - - - 1
            - - [-1, 49]
          - - 32
            - - [-1, 47]
          - - 64
            - - [1, 49]
              - [32, 47]
              - [128, 8]
              - [256, 12]
              - [448, 8]
              - [704, 23]
              - [1024, 8]
              - [1408, 10]
              - [1856, 21]
              - [2368, 3]
              - [2944, 4]
              - [3584, 19]
              - [4288, 5]
              - [5888, 15]
              - [-1, 5]
          - - 128
            - - [1, 49]
              - [32, 47]
              - [64, 8]
              - [128, 12]
              - [256, 8]
              - [448, 23]
              - [704, 3]
              - [1024, 11]
              - [1408, 14]
              - [1856, 20]
              - [2368, 5]
              - [2944, 15]
              - [3584, 27]
              - [4288, 5]
              - [5056, 15]
              - [5888, 27]
              - [-1, 29]
          - - 256
            - - [1, 49]
              - [32, 47]
              - [64, 12]
              - [128, 8]
              - [256, 23]
              - [448, 21]
              - [1024, 20]
              - [2944, 27]
              - [3584, 29]
              - [5056, 27]
              - [-1, 29]
          - - 448
            - - [1, 49]
              - [32, 47]
              - [128, 8]
              - [256, 11]
              - [448, 19]
              - [1408, 27]
              - [1856, 29]
              - [2368, 27]
              - [3584, 29]
              - [4288, 26]
              - [5056, 29]
              - [5888, 31]
              - [-1, 26]
          - - 704
            - - [1, 49]
              - [32, 47]
              - [64, 23]
              - [128, 3]
              - [256, 20]
              - [1856, 27]
              - [2368, 29]
              - [2944, 26]
              - [3584, 31]
              - [4288, 26]
              - [5056, 31]
              - [5888, 29]
              - [-1, 31]
          - - 1024
            - - [1, 49]
              - [32, 47]
              - [64, 8]
              - [128, 21]
              - [256, 20]
              - [704, 27]
              - [2368, 29]
              - [2944, 31]
              - [4288, 29]
              - [-1, 31]
          - - 1408
            - - [1, 49]
              - [32, 47]
              - [64, 3]
              - [128, 19]
              - [448, 27]
              - [1024, 29]
              - [1408, 31]
              - [2368, 29]
              - [5888, 31]
              - [-1, 24]
          - - 1856
            - - [1, 49]
              - [32, 47]
              - [64, 11]
              - [128, 19]
              - [256, 27]
              - [448, 29]
              - [704, 27]
              - [1408, 31]
              - [1856, 29]
              - [2944, 24]
              - [4288, 31]
              - [5056, 24]
              - [5888, 31]
              - [-1, 24]
          - - 2368
            - - [1, 49]
              - [32, 47]
              - [64, 3]
              - [128, 5]
              - [448, 27]
              - [1408, 29]
              - [2368, 24]
              - [2944, 31]
              - [4288, 24]
              - [-1, 31]
          - - 2944
            - - [1, 49]
              - [32, 47]
              - [64, 4]
              - [128, 5]
              - [256, 27]
              - [704, 29]
              - [1408, 31]
              - [1856, 24]
              - [2368, 31]
              - [5056, 24]
              - [-1, 31]
          - - 3584
            - - [1, 49]
              - [32, 47]
              - [64, 19]
              - [128, 17]
              - [1024, 29]
              - [1408, 31]
              - [2944, 24]
              - [3584, 29]
              - [5056, 25]
              - [5888, 31]
              - [-1, 30]
          - - 4288
            - - [1, 49]
              - [32, 47]
              - [128, 5]
              - [256, 27]
              - [448, 29]
              - [704, 24]
              - [1024, 29]
              - [1856, 31]
              - [2368, 24]
              - [2944, 25]
              - [3584, 29]
              - [5056, 24]
              - [5888, 31]
              - [-1, 25]
          - - 5056
            - - [1, 49]
              - [32, 47]
              - [128, 5]
              - [256, 27]
              - [704, 29]
              - [1024, 24]
              - [1408, 31]
              - [1856, 24]
              - [2944, 29]
              - [3584, 31]
              - [4288, 34]
              - [5888, 31]
              - [-1, 30]
          - - 5888
            - - [1, 49]
              - [32, 47]
              - [64, 5]
              - [128, 27]
              - [256, 29]
              - [448, 25]
              - [704, 29]
              - [1024, 31]
              - [1408, 25]
              - [1856, 30]
              - [2368, 31]
              - [2944, 25]
              - [4288, 24]
              - [-1, 31]
          - - -1
            - - [1, 49]
              - [32, 47]
              - [64, 5]
              - [448, 29]
              - [704, 25]
              - [1024, 31]
              - [1408, 29]
              - [1856, 31]
              - [2368, 24]
              - [3584, 31]
              - [4288, 25]
              - [5888, 31]
              - [-1, 30]
