library/src/blas3/Tensile/Logic/asm_full/vega20_Cijk_Ailk_Bjlk_DB.yaml
- {MinimumRequiredVersion: 4.7.2}
- vega20
- gfx906
- [Device 66a0, Device 66a1, Device 66a7]
    SolutionIndex: 0
    SolutionNameMin: Cijk_Ailk_Bjlk_DB_MT064x064x08_
    SolutionIndex: 1
    SolutionNameMin: Cijk_Ailk_Bjlk_DB_MT064x064x04_
    SolutionIndex: 2
    SolutionNameMin: Cijk_Ailk_Bjlk_DB_MT096x064x04_PK00_PLR1_TT06_04_WG16_16_01_WGM01
    SolutionIndex: 3
    SolutionNameMin: Cijk_Ailk_Bjlk_DB_MT096x064x04_PK00_PLR0_TT06_04_WG16_16_01_WGM01
    SolutionIndex: 4
    SolutionNameMin: Cijk_Ailk_Bjlk_DB_MT096x064x04_PK02_PLR1_TT06_04_WG16_16_01_WGM01
    SolutionIndex: 5
    SolutionNameMin: Cijk_Ailk_Bjlk_DB_MT064x096x04_PK00_PLR1_TT04_06_WG16_16_01_WGM01
    SolutionIndex: 6
    SolutionNameMin: Cijk_Ailk_Bjlk_DB_MT096x096x04_PK02_PLR0_TT06_06_WG16_16_01_WGM01
    SolutionIndex: 7
    SolutionNameMin: Cijk_Ailk_Bjlk_DB_MT128x064x04_PK00_PLR1_TT08_04_WG16_16_01_WGM01
    SolutionIndex: 8
    SolutionNameMin: Cijk_Ailk_Bjlk_DB_MT128x064x04_PK02_PLR1_TT08_04_WG16_16_01_WGM01
    SolutionIndex: 9
    SolutionNameMin: Cijk_Ailk_Bjlk_DB_MT096x064x04_PK00_PLR1_TT06_04_WG16_16_01_WGM08
    SolutionIndex: 10
    SolutionNameMin: Cijk_Ailk_Bjlk_DB_MT096x064x04_PK00_PLR0_TT06_04_WG16_16_01_WGM08
    SolutionIndex: 11
    SolutionNameMin: Cijk_Ailk_Bjlk_DB_MT096x064x04_PK02_PLR1_TT06_04_WG16_16_01_WGM08
    SolutionIndex: 12
    SolutionNameMin: Cijk_Ailk_Bjlk_DB_MT096x096x04_PK00_PLR0_TT06_06_WG16_16_01_WGM08
    SolutionIndex: 13
    SolutionNameMin: Cijk_Ailk_Bjlk_DB_MT096x096x04_PK02_PLR0_TT06_06_WG16_16_01_WGM08
    SolutionIndex: 14
    SolutionNameMin: Cijk_Ailk_Bjlk_DB_MT128x064x04_PK00_PLR1_TT08_04_WG16_16_01_WGM08
    SolutionIndex: 15
    SolutionNameMin: Cijk_Ailk_Bjlk_DB_MT128x064x04_PK02_PLR1_TT08_04_WG16_16_01_WGM08
    SolutionIndex: 16
    SolutionNameMin: Cijk_Ailk_Bjlk_DB_MT096x064x08_PK00_PLR1_TT06_04_WG16_16_01_WGM01
    SolutionIndex: 17
    SolutionNameMin: Cijk_Ailk_Bjlk_DB_MT096x064x08_PK02_PLR1_TT06_04_WG16_16_01_WGM01
    SolutionIndex: 18
    SolutionNameMin: Cijk_Ailk_Bjlk_DB_MT064x096x08_PK00_PLR1_TT04_06_WG16_16_01_WGM01
    SolutionIndex: 19
    SolutionNameMin: Cijk_Ailk_Bjlk_DB_MT064x096x08_PK02_PLR1_TT04_06_WG16_16_01_WGM01
    SolutionIndex: 20
    SolutionNameMin: Cijk_Ailk_Bjlk_DB_MT096x096x08_PK02_PLR0_TT06_06_WG16_16_01_WGM01
    SolutionIndex: 21
    SolutionNameMin: Cijk_Ailk_Bjlk_DB_MT128x064x08_PK00_PLR1_TT08_04_WG16_16_01_WGM01
    SolutionIndex: 22
    SolutionNameMin: Cijk_Ailk_Bjlk_DB_MT128x064x08_PK02_PLR0_TT08_04_WG16_16_01_WGM01
    SolutionIndex: 23
    SolutionNameMin: Cijk_Ailk_Bjlk_DB_MT128x128x08_PK02_PLR1_TT08_04_WG16_32_01_WGM01
    SolutionIndex: 24
    SolutionNameMin: Cijk_Ailk_Bjlk_DB_MT096x064x08_PK00_PLR1_TT06_04_WG16_16_01_WGM08
    SolutionIndex: 25
    SolutionNameMin: Cijk_Ailk_Bjlk_DB_MT096x064x08_PK02_PLR1_TT06_04_WG16_16_01_WGM08
    SolutionIndex: 26
    SolutionNameMin: Cijk_Ailk_Bjlk_DB_MT064x096x08_PK02_PLR1_TT04_06_WG16_16_01_WGM08
    SolutionIndex: 27
    SolutionNameMin: Cijk_Ailk_Bjlk_DB_MT096x096x08_PK02_PLR0_TT06_06_WG16_16_01_WGM08
    SolutionIndex: 28
    SolutionNameMin: Cijk_Ailk_Bjlk_DB_MT128x064x08_PK02_PLR0_TT08_04_WG16_16_01_WGM08
    SolutionIndex: 29
    SolutionNameMin: Cijk_Ailk_Bjlk_DB_MT064x096x04_PK00_PLR1_TT04_06_WG16_16_01_WGM01
    SolutionIndex: 30
    SolutionNameMin: Cijk_Ailk_Bjlk_DB_MT064x096x04_PK03_PLR0_TT04_06_WG16_16_01_WGM01
    SolutionIndex: 31
    SolutionNameMin: Cijk_Ailk_Bjlk_DB_MT096x096x04_PK00_PLR0_TT06_06_WG16_16_01_WGM01
    SolutionIndex: 32
    SolutionNameMin: Cijk_Ailk_Bjlk_DB_MT096x096x04_PK02_PLR0_TT06_06_WG16_16_01_WGM01
    SolutionIndex: 33
    SolutionNameMin: Cijk_Ailk_Bjlk_DB_MT128x064x04_PK00_PLR1_TT08_04_WG16_16_01_WGM01
    SolutionIndex: 34
    SolutionNameMin: Cijk_Ailk_Bjlk_DB_MT128x064x04_PK02_PLR1_TT08_04_WG16_16_01_WGM01
    SolutionIndex: 35
    SolutionNameMin: Cijk_Ailk_Bjlk_DB_MT128x064x04_PK04_PLR1_TT08_04_WG16_16_01_WGM01
    SolutionIndex: 36
    SolutionNameMin: Cijk_Ailk_Bjlk_DB_MT096x064x04_PK03_PLR0_TT06_04_WG16_16_01_WGM08
    SolutionIndex: 37
    SolutionNameMin: Cijk_Ailk_Bjlk_DB_MT096x096x04_PK00_PLR0_TT06_06_WG16_16_01_WGM08
    SolutionIndex: 38
    SolutionNameMin: Cijk_Ailk_Bjlk_DB_MT096x096x04_PK02_PLR0_TT06_06_WG16_16_01_WGM08
    SolutionIndex: 39
    SolutionNameMin: Cijk_Ailk_Bjlk_DB_MT096x096x04_PK04_PLR0_TT06_06_WG16_16_01_WGM08
    SolutionIndex: 40
    SolutionNameMin: Cijk_Ailk_Bjlk_DB_MT128x064x04_PK00_PLR1_TT08_04_WG16_16_01_WGM08
    SolutionIndex: 41
    SolutionNameMin: Cijk_Ailk_Bjlk_DB_MT128x064x04_PK02_PLR1_TT08_04_WG16_16_01_WGM08
    SolutionIndex: 42
    SolutionNameMin: Cijk_Ailk_Bjlk_DB_MT128x064x04_PK04_PLR1_TT08_04_WG16_16_01_WGM08
    SolutionIndex: 43
    SolutionNameMin: Cijk_Ailk_Bjlk_DB_MT064x064x08_PK00_PLR1_TT04_04_WG16_16_01_WGM01
    SolutionIndex: 44
    SolutionNameMin: Cijk_Ailk_Bjlk_DB_MT064x064x08_PK04_PLR0_TT04_04_WG16_16_01_WGM01
    SolutionIndex: 45
    SolutionNameMin: Cijk_Ailk_Bjlk_DB_MT096x064x08_PK00_PLR1_TT06_04_WG16_16_01_WGM01
    SolutionIndex: 46
    SolutionNameMin: Cijk_Ailk_Bjlk_DB_MT096x064x08_PK02_PLR1_TT06_04_WG16_16_01_WGM01
    SolutionIndex: 47
    SolutionNameMin: Cijk_Ailk_Bjlk_DB_MT064x096x08_PK02_PLR1_TT04_06_WG16_16_01_WGM01
    SolutionIndex: 48
    SolutionNameMin: Cijk_Ailk_Bjlk_DB_MT096x096x08_PK02_PLR0_TT06_06_WG16_16_01_WGM01
    SolutionIndex: 49
    SolutionNameMin: Cijk_Ailk_Bjlk_DB_MT128x064x08_PK02_PLR0_TT08_04_WG16_16_01_WGM01
    SolutionIndex: 50
    SolutionNameMin: Cijk_Ailk_Bjlk_DB_MT128x064x08_PK04_PLR0_TT08_04_WG16_16_01_WGM01
    SolutionIndex: 51
    SolutionNameMin: Cijk_Ailk_Bjlk_DB_MT128x128x08_PK02_PLR1_TT08_04_WG16_32_01_WGM01
    SolutionIndex: 52
    SolutionNameMin: Cijk_Ailk_Bjlk_DB_MT128x128x08_PK03_PLR1_TT08_04_WG16_32_01_WGM01
    SolutionIndex: 53
    SolutionNameMin: Cijk_Ailk_Bjlk_DB_MT128x128x08_PK04_PLR1_TT08_04_WG16_32_01_WGM01
    SolutionIndex: 54
    SolutionNameMin: Cijk_Ailk_Bjlk_DB_MT064x064x08_PK00_PLR1_TT04_04_WG16_16_01_WGM08
    SolutionIndex: 55
    SolutionNameMin: Cijk_Ailk_Bjlk_DB_MT096x064x08_PK02_PLR1_TT06_04_WG16_16_01_WGM08
    SolutionIndex: 56
    SolutionNameMin: Cijk_Ailk_Bjlk_DB_MT096x064x08_PK04_PLR1_TT06_04_WG16_16_01_WGM08
    SolutionIndex: 57
    SolutionNameMin: Cijk_Ailk_Bjlk_DB_MT064x096x08_PK02_PLR1_TT04_06_WG16_16_01_WGM08
    SolutionIndex: 58
    SolutionNameMin: Cijk_Ailk_Bjlk_DB_MT096x096x08_PK02_PLR0_TT06_06_WG16_16_01_WGM08
    SolutionIndex: 59
    SolutionNameMin: Cijk_Ailk_Bjlk_DB_MT096x096x08_PK04_PLR0_TT06_06_WG16_16_01_WGM08
    SolutionIndex: 60
    SolutionNameMin: Cijk_Ailk_Bjlk_DB_MT128x064x08_PK02_PLR0_TT08_04_WG16_16_01_WGM08
    SolutionIndex: 61
    SolutionNameMin: Cijk_Ailk_Bjlk_DB_MT128x064x08_PK04_PLR0_TT08_04_WG16_16_01_WGM08
    SolutionIndex: 62
    SolutionNameMin: Cijk_Ailk_Bjlk_DB_MT064x032x04_PLR0_TT04_04_WG16_08_01
    SolutionIndex: 63
    SolutionNameMin: Cijk_Ailk_Bjlk_DB_MT096x032x04_PLR1_TT06_04_WG16_08_01
    SolutionIndex: 64
    SolutionNameMin: Cijk_Ailk_Bjlk_DB_MT048x064x04_PLR1_TT06_04_WG08_16_01
    SolutionIndex: 65
    SolutionNameMin: Cijk_Ailk_Bjlk_DB_MT048x064x04_PLR0_TT06_04_WG08_16_01
    SolutionIndex: 66
    SolutionNameMin: Cijk_Ailk_Bjlk_DB_MT096x064x04_PLR1_TT06_04_WG16_16_01
    SolutionIndex: 67
    SolutionNameMin: Cijk_Ailk_Bjlk_DB_MT096x064x04_PLR0_TT06_04_WG16_16_01
    SolutionIndex: 68
    SolutionNameMin: Cijk_Ailk_Bjlk_DB_MT064x032x08_PLR1_TT04_04_WG16_08_01
    SolutionIndex: 69
    SolutionNameMin: Cijk_Ailk_Bjlk_DB_MT032x064x08_PLR1_TT04_04_WG08_16_01
    SolutionIndex: 70
    SolutionNameMin: Cijk_Ailk_Bjlk_DB_MT064x064x08_PLR1_TT04_04_WG16_16_01
    SolutionIndex: 71
    SolutionNameMin: Cijk_Ailk_Bjlk_DB_MT064x064x08_PLR0_TT04_04_WG16_16_01
    SolutionIndex: 72
    SolutionNameMin: Cijk_Ailk_Bjlk_DB_MT096x064x08_PLR1_TT06_04_WG16_16_01
    SolutionIndex: 73
    SolutionNameMin: Cijk_Ailk_Bjlk_DB_MT064x032x12_PLR1_TT04_04_WG16_08_01
- - - [1, 64, 1, 64]
    - [1, 0.441379]
  - - [64, 1, 1, 64]
    - [1, 0.453097]
  - - [1, 1, 1, 64]
    - [1, 0.00650406]
  - - [64, 64, 1, 64]
    - [0, 27.7695]
  - - [16640, 16640, 1, 256]
    - [8, 4903.31]
  - - [25728, 25728, 1, 384]
    - [6, 5016.52]
  - - [2688, 2688, 1, 384]
    - [8, 4840.43]
  - - [16896, 16896, 1, 256]
    - [22, 4853.08]
  - - [21120, 21120, 1, 384]
    - [6, 5016.38]
  - - [32640, 32640, 1, 384]
    - [6, 5012.65]
  - - [19200, 19200, 1, 256]
    - [8, 4907.46]
  - - [17408, 17408, 1, 256]
    - [22, 4853.05]
  - - [8704, 8704, 1, 256]
    - [22, 4856.39]
  - - [33408, 33408, 1, 384]
    - [6, 5022.01]
  - - [1280, 1280, 1, 256]
    - [3, 3803.33]
  - - [4992, 4992, 1, 384]
    - [8, 4915.61]
  - - [9984, 9984, 1, 256]
    - [15, 4897.39]
  - - [5760, 5760, 1, 5760]
    - [8, 5072.73]
  - - [28800, 28800, 1, 384]
    - [6, 5012.78]
  - - [33792, 33792, 1, 256]
    - [28, 4854.69]
  - - [23424, 23424, 1, 384]
    - [6, 5013.73]
  - - [9728, 9728, 1, 256]
    - [22, 4850.62]
  - - [4608, 4608, 1, 50000]
    - [12, 5157.37]
  - - [8192, 8192, 1, 256]
    - [22, 4828.63]
  - - [31744, 31744, 1, 256]
    - [22, 4860.56]
  - - [38656, 38656, 1, 256]
    - [6, 4910.42]
  - - [23296, 23296, 1, 256]
    - [8, 4915.15]
  - - [6528, 6528, 1, 384]
    - [17, 4934.29]
  - - [7680, 7680, 1, 384]
    - [8, 4945.12]
  - - [5376, 5376, 1, 384]
    - [13, 4938.65]
  - - [15104, 15104, 1, 256]
    - [8, 4904.1]
  - - [42240, 42240, 1, 256]
    - [8, 4904.59]
  - - [14848, 14848, 1, 256]
    - [22, 4849.06]
  - - [25344, 25344, 1, 384]
    - [6, 4988.02]
  - - [36480, 36480, 1, 384]
    - [13, 5014.1]
  - - [31488, 31488, 1, 384]
    - [6, 4999.03]
  - - [21504, 21504, 1, 256]
    - [22, 4850.98]
  - - [20736, 20736, 1, 256]
    - [6, 4915.41]
  - - [38400, 38400, 1, 384]
    - [14, 4940.95]
  - - [42240, 42240, 1, 384]
    - [6, 4983.05]
  - - [22656, 22656, 1, 384]
    - [6, 5026.84]
  - - [5632, 5632, 1, 256]
    - [8, 4834.71]
  - - [26880, 26880, 1, 256]
    - [8, 4913.06]
  - - [7424, 7424, 1, 256]
    - [15, 4852.55]
  - - [14592, 14592, 1, 384]
    - [13, 5001.81]
  - - [11264, 11264, 1, 256]
    - [8, 4849.46]
  - - [25088, 25088, 1, 256]
    - [14, 4852.2]
  - - [384, 384, 1, 384]
    - [24, 1266.18]
  - - [29952, 29952, 1, 256]
    - [8, 4916.93]
  - - [36352, 36352, 1, 256]
    - [13, 4852.23]
  - - [25600, 25600, 1, 256]
    - [28, 4846.18]
  - - [21248, 21248, 1, 256]
    - [8, 4913.93]
  - - [20352, 20352, 1, 384]
    - [6, 5033.85]
  - - [42624, 42624, 1, 384]
    - [6, 5012.04]
  - - [35712, 35712, 1, 384]
    - [6, 5017.48]
  - - [35072, 35072, 1, 256]
    - [6, 4911.87]
  - - [16896, 16896, 1, 384]
    - [28, 4932.54]
  - - [19584, 19584, 1, 384]
    - [6, 5033.22]
  - - [16128, 16128, 1, 256]
    - [8, 4905.84]
  - - [33536, 33536, 1, 256]
    - [8, 4905.61]
  - - [35584, 35584, 1, 256]
    - [8, 4918.18]
  - - [3840, 3840, 1, 384]
    - [27, 4840.09]
  - - [20224, 20224, 1, 256]
    - [8, 4915.84]
  - - [4608, 4608, 1, 4608]
    - [13, 5147.56]
  - - [7680, 7680, 1, 256]
    - [15, 4855.33]
  - - [38784, 38784, 1, 384]
    - [6, 5006.2]
  - - [23040, 23040, 1, 256]
    - [28, 4853.39]
  - - [18432, 18432, 1, 384]
    - [14, 4934.81]
  - - [27904, 27904, 1, 256]
    - [8, 4913.68]
  - - [4352, 4352, 1, 256]
    - [25, 4753.74]
  - - [768, 768, 1, 384]
    - [5, 3547.81]
  - - [37376, 37376, 1, 256]
    - [14, 4856.57]
  - - [4096, 4096, 1, 256]
    - [8, 4815.21]
  - - [36096, 36096, 1, 384]
    - [6, 4993.86]
  - - [24320, 24320, 1, 256]
    - [8, 4918.51]
  - - [40960, 40960, 1, 256]
    - [23, 4777.73]
  - - [40704, 40704, 1, 384]
    - [8, 4989.05]
  - - [41728, 41728, 1, 256]
    - [8, 4904.59]
  - - [24832, 24832, 1, 256]
    - [8, 4918.17]
  - - [44544, 44544, 1, 384]
    - [15, 4950.44]
  - - [13440, 13440, 1, 384]
    - [13, 5009.56]
  - - [9472, 9472, 1, 256]
    - [8, 4868.5]
  - - [6144, 6144, 1, 256]
    - [22, 4838.13]
  - - [9984, 9984, 1, 384]
    - [13, 4989.34]
  - - [29184, 29184, 1, 384]
    - [15, 4958.4]
  - - [39680, 39680, 1, 256]
    - [8, 4910.54]
  - - [41984, 41984, 1, 256]
    - [28, 4861.21]
  - - [31488, 31488, 1, 256]
    - [8, 4909.99]
  - - [34304, 34304, 1, 256]
    - [8, 4850.55]
  - - [12800, 12800, 1, 256]
    - [8, 4851.74]
  - - [26496, 26496, 1, 384]
    - [6, 5004.72]
  - - [29440, 29440, 1, 256]
    - [8, 4920.11]
  - - [30720, 30720, 1, 256]
    - [28, 4860.34]
  - - [17280, 17280, 1, 384]
    - [6, 5017.53]
  - - [1792, 1792, 1, 256]
    - [6, 4235.8]
  - - [23040, 23040, 1, 384]
    - [14, 4946.25]
  - - [3584, 3584, 1, 256]
    - [8, 4707.31]
  - - [31872, 31872, 1, 384]
    - [6, 5016.1]
  - - [29184, 29184, 1, 256]
    - [28, 4867.7]
  - - [32768, 32768, 1, 256]
    - [23, 4798.29]
  - - [16128, 16128, 1, 384]
    - [13, 5008.8]
  - - [256, 256, 1, 256]
    - [16, 560.736]
  - - [32256, 32256, 1, 384]
    - [15, 4962.76]
  - - [44160, 44160, 1, 384]
    - [6, 5017.74]
  - - [768, 768, 1, 256]
    - [5, 3410.0]
  - - [37632, 37632, 1, 256]
    - [14, 4907.84]
  - - [2560, 2560, 1, 256]
    - [10, 4527.05]
  - - [17664, 17664, 1, 384]
    - [6, 5001.81]
  - - [8448, 8448, 1, 256]
    - [6, 4895.82]
  - - [28416, 28416, 1, 384]
    - [6, 5004.58]
  - - [44544, 44544, 1, 256]
    - [15, 4867.77]
  - - [1024, 1024, 1, 256]
    - [7, 4462.03]
  - - [41216, 41216, 1, 256]
    - [8, 4911.73]
  - - [13824, 13824, 1, 384]
    - [13, 4939.05]
  - - [37888, 37888, 1, 256]
    - [28, 4853.24]
  - - [9216, 9216, 1, 256]
    - [8, 4853.45]
  - - [26880, 26880, 1, 384]
    - [6, 4988.04]
  - - [27264, 27264, 1, 384]
    - [6, 5017.13]
  - - [43264, 43264, 1, 256]
    - [14, 4904.52]
  - - [1536, 1536, 1, 256]
    - [26, 4508.67]
  - - [4864, 4864, 1, 256]
    - [17, 4773.32]
  - - [43008, 43008, 1, 256]
    - [28, 4851.85]
  - - [29696, 29696, 1, 256]
    - [22, 4860.24]
  - - [41472, 41472, 1, 256]
    - [14, 4848.78]
  - - [11776, 11776, 1, 256]
    - [8, 4855.22]
  - - [18048, 18048, 1, 384]
    - [6, 5010.58]
  - - [1536, 1536, 1, 384]
    - [26, 4676.7]
  - - [13568, 13568, 1, 256]
    - [8, 4899.12]
  - - [6912, 6912, 1, 256]
    - [13, 4881.77]
  - - [6400, 6400, 1, 256]
    - [8, 4869.22]
  - - [4608, 4608, 1, 384]
    - [8, 4872.79]
  - - [14080, 14080, 1, 256]
    - [8, 4904.7]
  - - [23552, 23552, 1, 256]
    - [22, 4849.97]
  - - [8448, 8448, 1, 384]
    - [13, 4979.11]
  - - [11136, 11136, 1, 384]
    - [6, 5007.22]
  - - [18688, 18688, 1, 256]
    - [8, 4911.71]
  - - [32000, 32000, 1, 256]
    - [8, 4916.61]
  - - [32256, 32256, 1, 256]
    - [28, 4857.14]
  - - [38400, 38400, 1, 256]
    - [28, 4852.33]
  - - [30720, 30720, 1, 384]
    - [28, 4953.54]
  - - [36608, 36608, 1, 256]
    - [8, 4921.13]
  - - [30208, 30208, 1, 256]
    - [22, 4856.2]
  - - [34944, 34944, 1, 384]
    - [6, 5020.1]
  - - [23808, 23808, 1, 384]
    - [8, 4984.21]
  - - [44288, 44288, 1, 256]
    - [8, 4904.12]
  - - [28416, 28416, 1, 256]
    - [8, 4911.98]
  - - [15872, 15872, 1, 256]
    - [14, 4853.96]
  - - [40704, 40704, 1, 256]
    - [8, 4909.88]
  - - [8064, 8064, 1, 384]
    - [8, 4974.66]
  - - [33024, 33024, 1, 256]
    - [8, 4915.48]
  - - [26112, 26112, 1, 384]
    - [14, 4934.09]
  - - [13824, 13824, 1, 256]
    - [15, 4865.79]
  - - [18816, 18816, 1, 384]
    - [6, 5023.71]
  - - [26624, 26624, 1, 256]
    - [23, 4837.65]
  - - [34560, 34560, 1, 384]
    - [6, 4998.14]
  - - [27392, 27392, 1, 256]
    - [8, 4923.16]
  - - [7936, 7936, 1, 256]
    - [8, 4870.97]
  - - [4608, 4608, 1, 256]
    - [8, 4789.11]
  - - [44800, 44800, 1, 256]
    - [6, 4909.99]
  - - [12672, 12672, 1, 384]
    - [6, 5010.51]
  - - [2816, 2816, 1, 256]
    - [8, 4546.37]
  - - [18432, 18432, 1, 256]
    - [14, 4846.48]
  - - [19712, 19712, 1, 256]
    - [8, 4912.13]
  - - [39936, 39936, 1, 384]
    - [28, 4941.2]
  - - [1152, 1152, 1, 384]
    - [4, 4039.39]
  - - [24960, 24960, 1, 384]
    - [6, 5017.19]
  - - [21888, 21888, 1, 384]
    - [13, 5009.98]
  - - [8960, 8960, 1, 256]
    - [15, 4873.26]
  - - [22272, 22272, 1, 256]
    - [8, 4914.71]
  - - [35328, 35328, 1, 384]
    - [14, 4952.59]
  - - [10240, 10240, 1, 256]
    - [8, 4840.51]
  - - [21504, 21504, 1, 384]
    - [14, 4932.21]
  - - [24576, 24576, 1, 256]
    - [23, 4827.89]
  - - [34816, 34816, 1, 256]
    - [28, 4866.3]
  - - [7744, 7744, 1, 7744]
    - [8, 5064.38]
  - - [19456, 19456, 1, 256]
    - [28, 4857.05]
  - - [9216, 9216, 1, 384]
    - [8, 4944.62]
  - - [27648, 27648, 1, 384]
    - [14, 4933.21]
  - - [13056, 13056, 1, 384]
    - [13, 4983.14]
  - - [6656, 6656, 1, 256]
    - [8, 4847.09]
  - - [37632, 37632, 1, 384]
    - [6, 4986.31]
  - - [39168, 39168, 1, 384]
    - [8, 4981.74]
  - - [11904, 11904, 1, 384]
    - [6, 4998.99]
  - - [35840, 35840, 1, 256]
    - [14, 4843.33]
  - - [3840, 3840, 1, 256]
    - [25, 4741.84]
  - - [43776, 43776, 1, 256]
    - [6, 4914.59]
  - - [10368, 10368, 1, 384]
    - [6, 5003.23]
  - - [17664, 17664, 1, 256]
    - [6, 4918.42]
  - - [43520, 43520, 1, 256]
    - [14, 4844.37]
  - - [13312, 13312, 1, 256]
    - [8, 4847.29]
  - - [11520, 11520, 1, 256]
    - [13, 4899.95]
  - - [14976, 14976, 1, 384]
    - [13, 5011.77]
  - - [26112, 26112, 1, 256]
    - [28, 4864.9]
  - - [18176, 18176, 1, 256]
    - [8, 4914.7]
  - - [34048, 34048, 1, 256]
    - [6, 4924.59]
  - - [15360, 15360, 1, 384]
    - [15, 4956.41]
  - - [36096, 36096, 1, 256]
    - [8, 4909.97]
  - - [19968, 19968, 1, 256]
    - [15, 4873.17]
  - - [39936, 39936, 1, 256]
    - [28, 4856.67]
  - - [30336, 30336, 1, 384]
    - [6, 5017.56]
  - - [15744, 15744, 1, 384]
    - [6, 5012.74]
  - - [41856, 41856, 1, 384]
    - [6, 5004.35]
  - - [10496, 10496, 1, 256]
    - [8, 4897.7]
  - - [31232, 31232, 1, 256]
    - [22, 4855.06]
  - - [22784, 22784, 1, 256]
    - [8, 4915.67]
  - - [33024, 33024, 1, 384]
    - [8, 4999.77]
  - - [14208, 14208, 1, 384]
    - [6, 5009.13]
  - - [34176, 34176, 1, 384]
    - [6, 5010.18]
  - - [14592, 14592, 1, 256]
    - [8, 4906.5]
  - - [43008, 43008, 1, 384]
    - [28, 4936.39]
  - - [27648, 27648, 1, 256]
    - [28, 4855.17]
  - - [7296, 7296, 1, 384]
    - [8, 4951.49]
  - - [13056, 13056, 1, 256]
    - [6, 4908.74]
  - - [19200, 19200, 1, 384]
    - [6, 4984.54]
  - - [512, 512, 1, 256]
    - [19, 2041.02]
  - - [14336, 14336, 1, 256]
    - [8, 4847.66]
  - - [20992, 20992, 1, 256]
    - [14, 4852.32]
  - - [39168, 39168, 1, 256]
    - [8, 4909.31]
  - - [11520, 11520, 1, 384]
    - [13, 4988.88]
  - - [28032, 28032, 1, 384]
    - [13, 5008.51]
  - - [24192, 24192, 1, 384]
    - [6, 5013.54]
  - - [12032, 12032, 1, 256]
    - [8, 4893.35]
  - - [41088, 41088, 1, 384]
    - [6, 5017.2]
  - - [38016, 38016, 1, 384]
    - [6, 5016.9]
  - - [2304, 2304, 1, 384]
    - [25, 4667.17]
  - - [22528, 22528, 1, 256]
    - [22, 4846.22]
  - - [22272, 22272, 1, 384]
    - [6, 5013.3]
  - - [5376, 5376, 1, 256]
    - [13, 4843.39]
  - - [8832, 8832, 1, 384]
    - [8, 4985.89]
  - - [37248, 37248, 1, 384]
    - [8, 5005.62]
  - - [15616, 15616, 1, 256]
    - [8, 4909.19]
  - - [28928, 28928, 1, 256]
    - [8, 4917.14]
  - - [24576, 24576, 1, 384]
    - [23, 4899.1]
  - - [12288, 12288, 1, 384]
    - [28, 4930.6]
  - - [23808, 23808, 1, 256]
    - [8, 4911.44]
  - - [24064, 24064, 1, 256]
    - [14, 4846.83]
  - - [40320, 40320, 1, 384]
    - [6, 5003.65]
  - - [43776, 43776, 1, 384]
    - [6, 5004.33]
  - - [9600, 9600, 1, 384]
    - [6, 4987.33]
  - - [30464, 30464, 1, 256]
    - [8, 4908.55]
  - - [20480, 20480, 1, 256]
    - [28, 4878.89]
  - - [39424, 39424, 1, 256]
    - [28, 4856.22]
  - - [4224, 4224, 1, 384]
    - [17, 4866.61]
  - - [29568, 29568, 1, 384]
    - [6, 5010.07]
  - - [40192, 40192, 1, 256]
    - [6, 4913.05]
  - - [7168, 7168, 1, 256]
    - [8, 4858.3]
  - - [10752, 10752, 1, 384]
    - [15, 4956.18]
  - - [44032, 44032, 1, 256]
    - [14, 4848.91]
  - - [31104, 31104, 1, 384]
    - [6, 5012.72]
  - - [33792, 33792, 1, 384]
    - [14, 4951.73]
  - - [32512, 32512, 1, 256]
    - [8, 4913.63]
  - - [27136, 27136, 1, 256]
    - [14, 4849.27]
  - - [15360, 15360, 1, 256]
    - [8, 4850.96]
  - - [21760, 21760, 1, 256]
    - [8, 4911.98]
  - - [22016, 22016, 1, 256]
    - [22, 4854.31]
  - - [19968, 19968, 1, 384]
    - [14, 4945.94]
  - - [35328, 35328, 1, 256]
    - [14, 4850.45]
  - - [2304, 2304, 1, 256]
    - [19, 4532.27]
  - - [29952, 29952, 1, 384]
    - [8, 4988.27]
  - - [5120, 5120, 1, 256]
    - [8, 4853.54]
  - - [16512, 16512, 1, 384]
    - [6, 5016.05]
  - - [39552, 39552, 1, 384]
    - [13, 5010.95]
  - - [12544, 12544, 1, 256]
    - [8, 4906.97]
  - - [38912, 38912, 1, 256]
    - [22, 4844.07]
  - - [40448, 40448, 1, 256]
    - [28, 4854.24]
  - - [38144, 38144, 1, 256]
    - [8, 4910.85]
  - - [25344, 25344, 1, 256]
    - [8, 4916.02]
  - - [12288, 12288, 1, 256]
    - [22, 4846.72]
  - - [37120, 37120, 1, 256]
    - [6, 4909.43]
  - - [43392, 43392, 1, 384]
    - [13, 5004.76]
  - - [42496, 42496, 1, 256]
    - [14, 4853.14]
  - - [34560, 34560, 1, 256]
    - [8, 4919.49]
  - - [25856, 25856, 1, 256]
    - [8, 4914.76]
  - - [28160, 28160, 1, 256]
    - [28, 4857.66]
  - - [36864, 36864, 1, 256]
    - [28, 4847.28]
  - - [5888, 5888, 1, 256]
    - [8, 4838.71]
  - - [20736, 20736, 1, 384]
    - [8, 4993.28]
  - - [17152, 17152, 1, 256]
    - [8, 4900.1]
  - - [18944, 18944, 1, 256]
    - [22, 4847.98]
  - - [6144, 6144, 1, 384]
    - [8, 4939.52]
  - - [30976, 30976, 1, 256]
    - [8, 4914.66]
  - - [41472, 41472, 1, 384]
    - [14, 4941.82]
  - - [11008, 11008, 1, 256]
    - [8, 4882.14]
  - - [26368, 26368, 1, 256]
    - [8, 4918.3]
  - - [3456, 3456, 1, 384]
    - [15, 4840.31]
  - - [10752, 10752, 1, 256]
    - [8, 4852.69]
  - - [28672, 28672, 1, 256]
    - [22, 4840.71]
  - - [36864, 36864, 1, 384]
    - [28, 4918.86]
  - - [44928, 44928, 1, 384]
    - [20, 5003.55]
  - - [1920, 1920, 1, 384]
    - [25, 4546.44]
  - - [3328, 3328, 1, 256]
    - [22, 4636.87]
  - - [42752, 42752, 1, 256]
    - [8, 4907.31]
  - - [17920, 17920, 1, 256]
    - [14, 4864.38]
  - - [33280, 33280, 1, 256]
    - [28, 4856.54]
  - - [6912, 6912, 1, 384]
    - [13, 4968.4]
  - - [5760, 5760, 1, 384]
    - [17, 4924.78]
  - - [16384, 16384, 1, 256]
    - [23, 4795.62]
  - - [33408, 2048, 1, 384]
    - [41, 4985.35]
  - - [39680, 2048, 1, 256]
    - [41, 4882.65]
  - - [36352, 3072, 1, 256]
    - [61, 4867.18]
  - - [11776, 3072, 1, 256]
    - [60, 4819.64]
  - - [4608, 2048, 1, 384]
    - [34, 4888.16]
  - - [9472, 3072, 1, 256]
    - [42, 4838.21]
  - - [11520, 2048, 1, 384]
    - [41, 4923.97]
  - - [2048, 2048, 1, 256]
    - [34, 4642.62]
  - - [1792, 2048, 1, 256]
    - [54, 4530.02]
  - - [34304, 3072, 1, 256]
    - [60, 4877.11]
  - - [17408, 2048, 1, 256]
    - [42, 4805.41]
  - - [5632, 2048, 1, 256]
    - [49, 4769.96]
  - - [6528, 2048, 1, 384]
    - [55, 4870.26]
  - - [38912, 3072, 1, 256]
    - [40, 4834.03]
  - - [9216, 2048, 1, 256]
    - [60, 4786.09]
  - - [30720, 2048, 1, 384]
    - [60, 4931.79]
  - - [20224, 3072, 1, 256]
    - [42, 4914.97]
  - - [20992, 2048, 1, 256]
    - [42, 4869.08]
  - - [2560, 3072, 1, 256]
    - [34, 4659.92]
  - - [7424, 3072, 1, 256]
    - [41, 4826.15]
  - - [24576, 2048, 1, 256]
    - [53, 4751.01]
  - - [25344, 3072, 1, 256]
    - [41, 4899.89]
  - - [26496, 2048, 1, 384]
    - [42, 4963.45]
  - - [9984, 3072, 1, 384]
    - [39, 4954.25]
  - - [14848, 3072, 1, 256]
    - [42, 4881.68]
  - - [12544, 3072, 1, 256]
    - [41, 4853.88]
  - - [43008, 3072, 1, 256]
    - [58, 4842.7]
  - - [42752, 2048, 1, 256]
    - [42, 4912.9]
  - - [42752, 3072, 1, 256]
    - [39, 4908.32]
  - - [3840, 2048, 1, 384]
    - [56, 4820.43]
  - - [3840, 3072, 1, 256]
    - [58, 4754.56]
  - - [30336, 2048, 1, 384]
    - [42, 4980.93]
  - - [39936, 2048, 1, 256]
    - [41, 4872.25]
  - - [7680, 3072, 1, 384]
    - [34, 4883.94]
  - - [30976, 2048, 1, 256]
    - [42, 4896.99]
  - - [19456, 3072, 1, 256]
    - [42, 4866.68]
  - - [23296, 3072, 1, 256]
    - [41, 4905.58]
  - - [1536, 2048, 1, 256]
    - [34, 4658.19]
  - - [20992, 3072, 1, 256]
    - [42, 4895.62]
  - - [28800, 3072, 1, 384]
    - [38, 5022.49]
  - - [42240, 2048, 1, 256]
    - [42, 4906.59]
  - - [7296, 3072, 1, 384]
    - [38, 4965.35]
  - - [32512, 3072, 1, 256]
    - [42, 4911.58]
  - - [27136, 3072, 1, 256]
    - [61, 4832.58]
  - - [16896, 2048, 1, 256]
    - [42, 4822.1]
  - - [20736, 2048, 1, 256]
    - [42, 4872.56]
  - - [14592, 3072, 1, 384]
    - [39, 4970.56]
  - - [39936, 3072, 1, 384]
    - [42, 4950.48]
  - - [4096, 2048, 1, 256]
    - [34, 4715.19]
  - - [37888, 3072, 1, 256]
    - [40, 4852.3]
  - - [35712, 2048, 1, 384]
    - [42, 4980.2]
  - - [4864, 3072, 1, 256]
    - [57, 4730.19]
  - - [25088, 3072, 1, 256]
    - [60, 4896.08]
  - - [10752, 3072, 1, 256]
    - [41, 4819.07]
  - - [36480, 2048, 1, 384]
    - [42, 4998.0]
  - - [24960, 2048, 1, 384]
    - [42, 4972.64]
  - - [25600, 3072, 1, 256]
    - [42, 4889.62]
  - - [15616, 2048, 1, 256]
    - [41, 4854.21]
  - - [34560, 2048, 1, 256]
    - [42, 4927.94]
  - - [22528, 3072, 1, 256]
    - [60, 4851.09]
  - - [41728, 2048, 1, 256]
    - [42, 4916.34]
  - - [22272, 3072, 1, 256]
    - [42, 4905.52]
  - - [6144, 2048, 1, 256]
    - [34, 4772.19]
  - - [39552, 2048, 1, 384]
    - [42, 5013.54]
  - - [16128, 2048, 1, 384]
    - [41, 4974.35]
  - - [24192, 2048, 1, 384]
    - [42, 4967.1]
  - - [44544, 2048, 1, 384]
    - [60, 4956.58]
  - - [11904, 3072, 1, 384]
    - [58, 4990.96]
  - - [34944, 3072, 1, 384]
    - [39, 5013.32]
  - - [26880, 2048, 1, 256]
    - [42, 4896.9]
  - - [10240, 2048, 1, 256]
    - [41, 4804.82]
  - - [9984, 3072, 1, 256]
    - [42, 4861.29]
  - - [9984, 2048, 1, 256]
    - [41, 4818.92]
  - - [34560, 3072, 1, 384]
    - [42, 5007.68]
  - - [41472, 3072, 1, 256]
    - [42, 4892.59]
  - - [13824, 2048, 1, 256]
    - [60, 4814.52]
  - - [30976, 3072, 1, 256]
    - [42, 4899.55]
  - - [21760, 2048, 1, 256]
    - [42, 4873.02]
  - - [43264, 3072, 1, 256]
    - [42, 4895.27]
  - - [31872, 3072, 1, 384]
    - [42, 5013.26]
  - - [6144, 2048, 1, 384]
    - [41, 4907.42]
  - - [33408, 3072, 1, 384]
    - [58, 4995.08]
  - - [36864, 3072, 1, 256]
    - [61, 4813.33]
  - - [28416, 3072, 1, 256]
    - [42, 4908.17]
  - - [29184, 2048, 1, 256]
    - [42, 4855.07]
  - - [21888, 3072, 1, 384]
    - [59, 4979.94]
  - - [26112, 2048, 1, 384]
    - [60, 4943.37]
  - - [15616, 3072, 1, 256]
    - [42, 4871.77]
  - - [40192, 3072, 1, 256]
    - [42, 4910.08]
  - - [13440, 3072, 1, 384]
    - [39, 4991.03]
  - - [35072, 2048, 1, 256]
    - [42, 4904.32]
  - - [21504, 3072, 1, 256]
    - [60, 4835.99]
  - - [22656, 2048, 1, 384]
    - [41, 4965.07]
  - - [768, 3072, 1, 256]
    - [38, 4586.74]
  - - [8832, 2048, 1, 384]
    - [56, 4899.26]
  - - [26112, 3072, 1, 384]
    - [42, 4976.1]
  - - [9984, 2048, 1, 384]
    - [41, 4912.26]
  - - [33024, 2048, 1, 384]
    - [41, 4995.88]
  - - [41472, 2048, 1, 384]
    - [60, 4936.64]
  - - [36096, 2048, 1, 256]
    - [42, 4904.21]
  - - [25728, 3072, 1, 384]
    - [42, 5014.05]
  - - [28032, 3072, 1, 384]
    - [39, 4997.91]
  - - [38144, 3072, 1, 256]
    - [39, 4888.68]
  - - [42496, 2048, 1, 256]
    - [42, 4881.98]
  - - [33792, 3072, 1, 384]
    - [42, 4969.28]
  - - [44160, 2048, 1, 384]
    - [42, 4993.37]
  - - [18176, 3072, 1, 256]
    - [42, 4903.54]
  - - [43520, 2048, 1, 256]
    - [42, 4874.82]
  - - [9216, 3072, 1, 256]
    - [42, 4833.65]
  - - [36864, 2048, 1, 384]
    - [61, 4918.48]
  - - [6400, 2048, 1, 256]
    - [60, 4727.58]
  - - [19968, 2048, 1, 256]
    - [42, 4840.75]
  - - [2560, 2048, 1, 256]
    - [35, 4680.5]
  - - [37888, 2048, 1, 256]
    - [42, 4886.85]
  - - [44288, 3072, 1, 256]
    - [39, 4916.65]
  - - [27648, 3072, 1, 256]
    - [42, 4838.64]
  - - [43392, 3072, 1, 384]
    - [39, 5005.98]
  - - [39552, 3072, 1, 384]
    - [39, 5017.52]
  - - [14336, 3072, 1, 256]
    - [42, 4806.66]
  - - [33280, 3072, 1, 256]
    - [61, 4857.48]
  - - [31488, 3072, 1, 256]
    - [41, 4911.43]
  - - [28928, 2048, 1, 256]
    - [41, 4873.79]
  - - [22784, 3072, 1, 256]
    - [39, 4900.69]
  - - [9728, 2048, 1, 256]
    - [42, 4805.06]
  - - [17664, 2048, 1, 256]
    - [42, 4851.05]
  - - [40960, 3072, 1, 256]
    - [52, 4804.02]
  - - [7936, 3072, 1, 256]
    - [42, 4798.22]
  - - [4352, 3072, 1, 256]
    - [42, 4725.46]
  - - [43776, 3072, 1, 384]
    - [42, 5013.2]
  - - [25088, 2048, 1, 256]
    - [42, 4848.77]
  - - [17152, 2048, 1, 256]
    - [60, 4855.3]
  - - [3840, 2048, 1, 256]
    - [36, 4691.63]
  - - [39936, 3072, 1, 256]
    - [42, 4845.06]
  - - [11520, 3072, 1, 256]
    - [42, 4846.22]
  - - [37120, 2048, 1, 256]
    - [42, 4910.04]
  - - [17408, 3072, 1, 256]
    - [38, 4838.15]
  - - [9216, 2048, 1, 384]
    - [42, 4915.34]
  - - [13056, 3072, 1, 256]
    - [42, 4856.71]
  - - [36864, 3072, 1, 384]
    - [60, 4935.38]
  - - [37632, 2048, 1, 384]
    - [42, 4987.0]
  - - [24832, 3072, 1, 256]
    - [42, 4877.25]
  - - [3584, 3072, 1, 256]
    - [34, 4718.08]
  - - [7680, 2048, 1, 256]
    - [60, 4795.1]
  - - [384, 2048, 1, 384]
    - [45, 4677.66]
  - - [28800, 2048, 1, 384]
    - [41, 4975.9]
  - - [10368, 2048, 1, 384]
    - [56, 4912.96]
  - - [30720, 3072, 1, 256]
    - [42, 4867.13]
  - - [3328, 3072, 1, 256]
    - [30, 4735.91]
  - - [30464, 3072, 1, 256]
    - [42, 4909.21]
  - - [37376, 2048, 1, 256]
    - [61, 4833.27]
  - - [25344, 3072, 1, 384]
    - [39, 4957.89]
  - - [23040, 2048, 1, 256]
    - [61, 4835.64]
  - - [27136, 2048, 1, 256]
    - [41, 4866.56]
  - - [36096, 3072, 1, 256]
    - [42, 4900.92]
  - - [2304, 2048, 1, 256]
    - [56, 4599.31]
  - - [7168, 3072, 1, 256]
    - [41, 4823.85]
  - - [43008, 3072, 1, 384]
    - [42, 4964.4]
  - - [1920, 3072, 1, 384]
    - [48, 4864.96]
  - - [35712, 3072, 1, 384]
    - [39, 5008.0]
  - - [27264, 2048, 1, 384]
    - [42, 4996.39]
  - - [35328, 2048, 1, 384]
    - [42, 4968.44]
  - - [44160, 3072, 1, 384]
    - [38, 4992.9]
  - - [29952, 2048, 1, 256]
    - [60, 4898.59]
  - - [20480, 3072, 1, 256]
    - [61, 4822.61]
  - - [28928, 3072, 1, 256]
    - [39, 4896.13]
  - - [21248, 2048, 1, 256]
    - [41, 4879.24]
  - - [39168, 2048, 1, 256]
    - [42, 4899.36]
  - - [22016, 3072, 1, 256]
    - [61, 4856.37]
  - - [38784, 2048, 1, 384]
    - [42, 4978.14]
  - - [4608, 2048, 1, 256]
    - [34, 4747.91]
  - - [1536, 2048, 1, 384]
    - [34, 4814.13]
  - - [33536, 3072, 1, 256]
    - [39, 4904.9]
  - - [24832, 2048, 1, 256]
    - [41, 4872.14]
  - - [34176, 3072, 1, 384]
    - [39, 5003.84]
  - - [42240, 2048, 1, 384]
    - [42, 4977.64]
  - - [30208, 3072, 1, 256]
    - [42, 4843.97]
  - - [8192, 2048, 1, 256]
    - [49, 4734.95]
  - - [39168, 3072, 1, 384]
    - [39, 5004.2]
  - - [31488, 2048, 1, 256]
    - [42, 4907.73]
  - - [28160, 3072, 1, 256]
    - [60, 4879.39]
  - - [8960, 3072, 1, 256]
    - [42, 4800.68]
  - - [5376, 3072, 1, 384]
    - [38, 4913.69]
  - - [3584, 2048, 1, 256]
    - [34, 4743.64]
  - - [16896, 2048, 1, 384]
    - [42, 4955.69]
  - - [12672, 2048, 1, 384]
    - [41, 4917.93]
  - - [34944, 2048, 1, 384]
    - [41, 4997.26]
  - - [1152, 3072, 1, 384]
    - [58, 4812.85]
  - - [26368, 3072, 1, 256]
    - [42, 4915.77]
  - - [256, 2048, 1, 256]
    - [43, 4023.31]
  - - [36864, 2048, 1, 256]
    - [51, 4798.83]
  - - [18944, 2048, 1, 256]
    - [60, 4824.98]
  - - [768, 2048, 1, 384]
    - [55, 4679.11]
  - - [14592, 2048, 1, 256]
    - [41, 4842.04]
  - - [8448, 3072, 1, 384]
    - [39, 4940.85]
  - - [19584, 2048, 1, 384]
    - [41, 4962.72]
  - - [35072, 3072, 1, 256]
    - [39, 4905.94]
  - - [14208, 3072, 1, 384]
    - [38, 4987.82]
  - - [22272, 3072, 1, 384]
    - [42, 4978.7]
  - - [39424, 3072, 1, 256]
    - [60, 4861.08]
  - - [41216, 2048, 1, 256]
    - [42, 4907.68]
  - - [25856, 2048, 1, 256]
    - [42, 4888.72]
  - - [26880, 2048, 1, 384]
    - [41, 4972.7]
  - - [16384, 3072, 1, 256]
    - [52, 4709.27]
  - - [28032, 2048, 1, 384]
    - [42, 4981.04]
  - - [38144, 2048, 1, 256]
    - [42, 4893.58]
  - - [16128, 3072, 1, 256]
    - [42, 4909.58]
  - - [19200, 3072, 1, 384]
    - [39, 4965.03]
  - - [512, 2048, 1, 256]
    - [33, 4525.23]
  - - [13824, 2048, 1, 384]
    - [42, 4939.42]
  - - [4352, 2048, 1, 256]
    - [36, 4676.78]
  - - [23296, 2048, 1, 256]
    - [41, 4864.83]
  - - [19968, 3072, 1, 256]
    - [42, 4879.41]
  - - [4224, 3072, 1, 384]
    - [32, 4925.9]
  - - [44288, 2048, 1, 256]
    - [42, 4908.16]
  - - [41472, 2048, 1, 256]
    - [42, 4874.48]
  - - [4992, 2048, 1, 384]
    - [56, 4868.16]
  - - [31744, 2048, 1, 256]
    - [42, 4845.53]
  - - [13568, 3072, 1, 256]
    - [42, 4884.7]
  - - [40704, 3072, 1, 256]
    - [42, 4910.39]
  - - [28416, 3072, 1, 384]
    - [42, 4988.86]
  - - [3072, 2048, 1, 256]
    - [34, 4696.22]
  - - [36480, 3072, 1, 384]
    - [59, 4989.66]
  - - [29184, 2048, 1, 384]
    - [60, 4925.63]
  - - [23808, 2048, 1, 256]
    - [60, 4895.93]
  - - [6144, 3072, 1, 256]
    - [34, 4795.97]
  - - [21504, 3072, 1, 384]
    - [41, 4965.98]
  - - [40448, 2048, 1, 256]
    - [61, 4842.98]
  - - [5888, 3072, 1, 256]
    - [41, 4762.93]
  - - [768, 3072, 1, 384]
    - [38, 4759.26]
  - - [31232, 2048, 1, 256]
    - [42, 4853.57]
  - - [10496, 2048, 1, 256]
    - [42, 4777.69]
  - - [36096, 2048, 1, 384]
    - [42, 4965.66]
  - - [10368, 3072, 1, 384]
    - [39, 4985.49]
  - - [18432, 3072, 1, 384]
    - [42, 4953.96]
  - - [8064, 2048, 1, 384]
    - [56, 4889.59]
  - - [2816, 3072, 1, 256]
    - [47, 4649.39]
  - - [2688, 2048, 1, 384]
    - [55, 4825.01]
  - - [6912, 3072, 1, 256]
    - [38, 4809.28]
  - - [41216, 3072, 1, 256]
    - [42, 4893.75]
  - - [5376, 2048, 1, 256]
    - [55, 4729.79]
  - - [15360, 3072, 1, 256]
    - [61, 4840.68]
  - - [37632, 2048, 1, 256]
    - [41, 4904.41]
  - - [28672, 3072, 1, 256]
    - [61, 4838.84]
  - - [27648, 3072, 1, 384]
    - [42, 4962.14]
  - - [34304, 2048, 1, 256]
    - [42, 4850.75]
  - - [12032, 3072, 1, 256]
    - [42, 4878.42]
  - - [31488, 3072, 1, 384]
    - [41, 4997.1]
  - - [12800, 2048, 1, 256]
    - [61, 4805.17]
  - - [18816, 3072, 1, 384]
    - [38, 5003.58]
  - - [43776, 2048, 1, 256]
    - [42, 4896.34]
  - - [17664, 2048, 1, 384]
    - [41, 4958.51]
  - - [5120, 3072, 1, 256]
    - [49, 4792.59]
  - - [5376, 3072, 1, 256]
    - [59, 4777.9]
  - - [40320, 3072, 1, 384]
    - [39, 4995.87]
  - - [42496, 3072, 1, 256]
    - [41, 4884.44]
  - - [24576, 2048, 1, 384]
    - [52, 4853.25]
  - - [11776, 2048, 1, 256]
    - [61, 4781.92]
  - - [19712, 2048, 1, 256]
    - [42, 4874.07]
  - - [11520, 3072, 1, 384]
    - [59, 4953.91]
  - - [23552, 2048, 1, 256]
    - [42, 4829.8]
  - - [12288, 2048, 1, 384]
    - [61, 4888.26]
  - - [512, 3072, 1, 256]
    - [57, 4415.06]
  - - [1792, 3072, 1, 256]
    - [47, 4642.54]
  - - [13056, 3072, 1, 384]
    - [39, 4949.9]
  - - [21120, 3072, 1, 384]
    - [38, 5003.34]
  - - [11136, 3072, 1, 384]
    - [39, 4985.65]
  - - [10496, 3072, 1, 256]
    - [42, 4833.47]
  - - [32640, 2048, 1, 384]
    - [42, 4979.21]
  - - [11264, 3072, 1, 256]
    - [42, 4844.89]
  - - [30720, 3072, 1, 384]
    - [42, 4933.81]
  - - [15104, 3072, 1, 256]
    - [42, 4880.15]
  - - [33024, 3072, 1, 256]
    - [39, 4880.7]
  - - [14976, 2048, 1, 384]
    - [42, 4932.09]
  - - [23040, 2048, 1, 384]
    - [40, 4929.54]
  - - [14208, 2048, 1, 384]
    - [41, 4938.06]
  - - [1280, 2048, 1, 256]
    - [44, 4491.91]
  - - [37248, 2048, 1, 384]
    - [42, 4973.59]
  - - [2304, 2048, 1, 384]
    - [56, 4778.84]
  - - [24576, 3072, 1, 256]
    - [52, 4784.24]
  - - [9600, 3072, 1, 384]
    - [59, 4963.2]
  - - [25344, 2048, 1, 256]
    - [41, 4890.25]
  - - [18176, 2048, 1, 256]
    - [41, 4871.32]
  - - [8704, 2048, 1, 256]
    - [41, 4833.71]
  - - [35584, 2048, 1, 256]
    - [42, 4908.93]
  - - [12544, 2048, 1, 256]
    - [60, 4827.7]
  - - [29952, 3072, 1, 256]
    - [42, 4899.38]
  - - [29952, 2048, 1, 384]
    - [41, 4970.47]
  - - [44032, 2048, 1, 256]
    - [61, 4833.36]
  - - [1024, 3072, 1, 256]
    - [34, 4646.37]
  - - [44800, 2048, 1, 256]
    - [42, 4921.25]
  - - [3840, 3072, 1, 384]
    - [38, 4887.42]
  - - [6912, 2048, 1, 256]
    - [56, 4747.04]
  - - [7680, 2048, 1, 384]
    - [34, 4895.77]
  - - [35328, 3072, 1, 256]
    - [60, 4873.38]
  - - [29568, 3072, 1, 384]
    - [58, 4993.89]
  - - [29696, 2048, 1, 256]
    - [42, 4841.02]
  - - [12288, 2048, 1, 256]
    - [61, 4770.5]
  - - [38656, 3072, 1, 256]
    - [42, 4915.05]
  - - [39424, 2048, 1, 256]
    - [61, 4848.1]
  - - [32000, 2048, 1, 256]
    - [41, 4916.32]
  - - [19456, 2048, 1, 256]
    - [60, 4824.06]
  - - [34816, 3072, 1, 256]
    - [40, 4834.33]
  - - [14080, 3072, 1, 256]
    - [42, 4883.22]
  - - [34176, 2048, 1, 384]
    - [42, 4978.98]
  - - [40704, 2048, 1, 384]
    - [42, 4980.92]
  - - [44544, 3072, 1, 256]
    - [60, 4884.37]
  - - [3456, 2048, 1, 384]
    - [56, 4845.46]
  - - [7296, 2048, 1, 384]
    - [56, 4890.41]
  - - [11008, 3072, 1, 256]
    - [41, 4832.03]
  - - [18688, 2048, 1, 256]
    - [60, 4885.47]
  - - [16896, 3072, 1, 256]
    - [61, 4843.47]
  - - [40704, 2048, 1, 256]
    - [42, 4925.01]
  - - [13568, 2048, 1, 256]
    - [41, 4833.5]
  - - [14592, 2048, 1, 384]
    - [41, 4936.27]
  - - [4096, 3072, 1, 256]
    - [34, 4773.61]
  - - [33024, 2048, 1, 256]
    - [41, 4876.89]
  - - [4864, 2048, 1, 256]
    - [34, 4680.88]
  - - [40448, 3072, 1, 256]
    - [61, 4852.67]
  - - [5760, 2048, 1, 384]
    - [56, 4869.35]
  - - [26112, 2048, 1, 256]
    - [42, 4848.78]
  - - [35840, 2048, 1, 256]
    - [42, 4863.32]
  - - [8448, 2048, 1, 256]
    - [41, 4792.46]
  - - [42624, 2048, 1, 384]
    - [42, 4994.99]
  - - [13312, 3072, 1, 256]
    - [61, 4839.23]
  - - [32256, 2048, 1, 384]
    - [60, 4926.25]
  - - [24320, 2048, 1, 256]
    - [42, 4900.2]
  - - [16128, 3072, 1, 384]
    - [39, 4976.67]
  - - [6912, 3072, 1, 384]
    - [39, 4929.71]
  - - [24192, 3072, 1, 384]
    - [39, 4979.43]
  - - [30208, 2048, 1, 256]
    - [41, 4868.23]
  - - [41088, 2048, 1, 384]
    - [42, 5001.33]
  - - [27904, 2048, 1, 256]
    - [41, 4872.62]
  - - [10240, 3072, 1, 256]
    - [42, 4805.86]
  - - [2304, 3072, 1, 256]
    - [59, 4692.7]
  - - [37632, 3072, 1, 256]
    - [42, 4904.82]
  - - [19200, 2048, 1, 256]
    - [41, 4910.7]
  - - [11904, 2048, 1, 384]
    - [56, 4914.38]
  - - [44928, 2048, 1, 384]
    - [42, 4993.26]
  - - [3072, 3072, 1, 384]
    - [41, 4881.05]
  - - [21760, 3072, 1, 256]
    - [42, 4891.55]
  - - [23808, 2048, 1, 384]
    - [42, 4981.49]
  - - [43776, 3072, 1, 256]
    - [41, 4906.24]
  - - [39168, 2048, 1, 384]
    - [41, 5006.38]
  - - [6144, 3072, 1, 384]
    - [61, 4916.14]
  - - [23552, 3072, 1, 256]
    - [42, 4891.33]
  - - [32640, 3072, 1, 384]
    - [38, 5001.35]
  - - [39680, 3072, 1, 256]
    - [42, 4907.05]
  - - [29184, 3072, 1, 256]
    - [42, 4886.25]
  - - [9472, 2048, 1, 256]
    - [41, 4784.45]
  - - [21504, 2048, 1, 256]
    - [42, 4831.21]
  - - [15360, 3072, 1, 384]
    - [42, 4919.64]
  - - [38400, 2048, 1, 384]
    - [42, 4972.9]
  - - [768, 2048, 1, 256]
    - [55, 4501.94]
  - - [18048, 2048, 1, 384]
    - [42, 4950.66]
  - - [42240, 3072, 1, 256]
    - [42, 4907.69]
  - - [5632, 3072, 1, 256]
    - [34, 4790.8]
  - - [41472, 3072, 1, 384]
    - [41, 4973.9]
  - - [6528, 3072, 1, 384]
    - [39, 4952.77]
  - - [5376, 2048, 1, 384]
    - [56, 4858.5]
  - - [25728, 2048, 1, 384]
    - [41, 4967.49]
  - - [33792, 2048, 1, 384]
    - [42, 4955.06]
  - - [41856, 3072, 1, 384]
    - [39, 4999.2]
  - - [41984, 2048, 1, 256]
    - [60, 4860.22]
  - - [20224, 2048, 1, 256]
    - [41, 4880.16]
  - - [6656, 2048, 1, 256]
    - [49, 4795.87]
  - - [16512, 3072, 1, 384]
    - [39, 4981.74]
  - - [7424, 2048, 1, 256]
    - [41, 4743.26]
  - - [37248, 3072, 1, 384]
    - [38, 4996.73]
  - - [27648, 2048, 1, 256]
    - [60, 4826.64]
  - - [31104, 2048, 1, 384]
    - [42, 4980.18]
  - - [9600, 2048, 1, 384]
    - [56, 4908.05]
  - - [32768, 3072, 1, 256]
    - [51, 4720.34]
  - - [14848, 2048, 1, 256]
    - [42, 4852.3]
  - - [8448, 3072, 1, 256]
    - [41, 4834.8]
  - - [35584, 3072, 1, 256]
    - [41, 4916.63]
  - - [17664, 3072, 1, 256]
    - [38, 4875.05]
  - - [43008, 2048, 1, 256]
    - [61, 4848.79]
  - - [44032, 3072, 1, 256]
    - [60, 4859.81]
  - - [34816, 2048, 1, 256]
    - [60, 4857.23]
  - - [29568, 2048, 1, 384]
    - [41, 4963.68]
  - - [43776, 2048, 1, 384]
    - [42, 5000.02]
  - - [43264, 2048, 1, 256]
    - [41, 4885.97]
  - - [42624, 3072, 1, 384]
    - [38, 4993.51]
  - - [16640, 2048, 1, 256]
    - [60, 4835.05]
  - - [3328, 2048, 1, 256]
    - [34, 4603.79]
  - - [38656, 2048, 1, 256]
    - [42, 4910.86]
  - - [12288, 3072, 1, 256]
    - [60, 4780.7]
  - - [34048, 3072, 1, 256]
    - [42, 4916.51]
  - - [13056, 2048, 1, 256]
    - [60, 4832.49]
  - - [1536, 3072, 1, 256]
    - [37, 4573.53]
  - - [32256, 2048, 1, 256]
    - [42, 4845.69]
  - - [33792, 2048, 1, 256]
    - [61, 4840.54]
  - - [32768, 2048, 1, 256]
    - [52, 4694.99]
  - - [24576, 3072, 1, 384]
    - [53, 4866.27]
  - - [29696, 3072, 1, 256]
    - [61, 4841.36]
  - - [32512, 2048, 1, 256]
    - [60, 4882.64]
  - - [30336, 3072, 1, 384]
    - [38, 5001.27]
  - - [25344, 2048, 1, 384]
    - [42, 4981.2]
  - - [19968, 2048, 1, 384]
    - [42, 4962.24]
  - - [23040, 3072, 1, 256]
    - [41, 4906.8]
  - - [18688, 3072, 1, 256]
    - [40, 4843.55]
  - - [20736, 3072, 1, 256]
    - [42, 4888.98]
  - - [35328, 3072, 1, 384]
    - [42, 4951.51]
  - - [19584, 3072, 1, 384]
    - [39, 5008.69]
  - - [7168, 2048, 1, 256]
    - [34, 4780.82]
  - - [27392, 2048, 1, 256]
    - [42, 4879.76]
  - - [256, 3072, 1, 256]
    - [29, 4391.97]
  - - [10752, 2048, 1, 256]
    - [49, 4780.33]
  - - [41728, 3072, 1, 256]
    - [42, 4912.56]
  - - [15872, 2048, 1, 256]
    - [42, 4835.39]
  - - [29440, 2048, 1, 256]
    - [41, 4895.11]
  - - [24960, 3072, 1, 384]
    - [42, 4991.1]
  - - [35840, 3072, 1, 256]
    - [42, 4875.62]
  - - [33024, 3072, 1, 384]
    - [39, 4972.02]
  - - [22528, 2048, 1, 256]
    - [60, 4833.2]
  - - [38784, 3072, 1, 384]
    - [38, 4995.56]
  - - [32256, 3072, 1, 384]
    - [39, 4967.81]
  - - [44928, 3072, 1, 384]
    - [39, 4995.6]
  - - [4608, 3072, 1, 256]
    - [34, 4760.25]
  - - [44544, 3072, 1, 384]
    - [42, 4978.39]
  - - [26880, 3072, 1, 256]
    - [42, 4880.89]
  - - [42240, 3072, 1, 384]
    - [42, 4990.79]
  - - [8192, 3072, 1, 256]
    - [50, 4778.28]
  - - [8960, 2048, 1, 256]
    - [41, 4785.3]
  - - [34560, 2048, 1, 384]
    - [41, 5009.57]
  - - [13824, 3072, 1, 256]
    - [42, 4860.71]
  - - [16896, 3072, 1, 384]
    - [41, 4996.13]
  - - [14336, 2048, 1, 256]
    - [61, 4789.96]
  - - [40960, 2048, 1, 256]
    - [53, 4776.14]
  - - [11008, 2048, 1, 256]
    - [41, 4853.81]
  - - [1152, 2048, 1, 384]
    - [46, 4740.33]
  - - [2048, 3072, 1, 256]
    - [49, 4702.8]
  - - [37376, 3072, 1, 256]
    - [61, 4857.96]
  - - [28416, 2048, 1, 256]
    - [42, 4887.92]
  - - [15744, 2048, 1, 384]
    - [42, 4942.84]
  - - [18944, 3072, 1, 256]
    - [41, 4898.79]
  - - [16640, 3072, 1, 256]
    - [58, 4868.76]
  - - [43392, 2048, 1, 384]
    - [42, 4991.71]
  - - [8448, 2048, 1, 384]
    - [55, 4882.7]
  - - [43520, 3072, 1, 256]
    - [60, 4895.13]
  - - [16512, 2048, 1, 384]
    - [41, 4928.72]
  - - [17280, 3072, 1, 384]
    - [39, 4998.76]
  - - [17920, 3072, 1, 256]
    - [60, 4834.08]
  - - [25856, 3072, 1, 256]
    - [39, 4889.96]
  - - [18432, 2048, 1, 256]
    - [42, 4828.18]
  - - [11136, 2048, 1, 384]
    - [42, 4915.87]
  - - [19200, 2048, 1, 384]
    - [41, 4957.95]
  - - [22016, 2048, 1, 256]
    - [42, 4854.05]
  - - [41856, 2048, 1, 384]
    - [42, 4971.3]
  - - [38016, 2048, 1, 384]
    - [41, 5009.16]
  - - [38400, 2048, 1, 256]
    - [42, 4888.38]
  - - [6400, 3072, 1, 256]
    - [42, 4796.61]
  - - [25600, 2048, 1, 256]
    - [42, 4862.41]
  - - [44800, 3072, 1, 256]
    - [42, 4919.41]
  - - [36608, 3072, 1, 256]
    - [42, 4908.37]
  - - [31104, 3072, 1, 384]
    - [38, 4991.71]
  - - [9728, 3072, 1, 256]
    - [60, 4833.23]
  - - [44544, 2048, 1, 256]
    - [42, 4869.26]
  - - [29184, 3072, 1, 384]
    - [41, 5000.28]
  - - [23808, 3072, 1, 256]
    - [42, 4899.01]
  - - [26624, 3072, 1, 256]
    - [42, 4842.55]
  - - [13440, 2048, 1, 384]
    - [55, 4912.65]
  - - [21504, 2048, 1, 384]
    - [42, 4953.27]
  - - [7936, 2048, 1, 256]
    - [34, 4742.58]
  - - [2304, 3072, 1, 384]
    - [58, 4844.42]
  - - [41984, 3072, 1, 256]
    - [60, 4856.25]
  - - [31232, 3072, 1, 256]
    - [61, 4845.01]
  - - [11520, 2048, 1, 256]
    - [60, 4824.13]
  - - [36096, 3072, 1, 384]
    - [38, 4987.1]
  - - [15360, 2048, 1, 256]
    - [60, 4787.8]
  - - [9216, 3072, 1, 384]
    - [42, 4953.01]
  - - [38400, 3072, 1, 384]
    - [42, 4966.25]
  - - [2816, 2048, 1, 256]
    - [54, 4573.16]
  - - [41088, 3072, 1, 384]
    - [38, 5001.39]
  - - [37632, 3072, 1, 384]
    - [42, 4991.48]
  - - [7680, 3072, 1, 256]
    - [34, 4799.44]
  - - [20736, 2048, 1, 384]
    - [41, 4975.5]
  - - [384, 3072, 1, 384]
    - [31, 4738.33]
  - - [30720, 2048, 1, 256]
    - [42, 4870.15]
  - - [32256, 3072, 1, 256]
    - [40, 4834.06]
  - - [27648, 2048, 1, 384]
    - [41, 4963.55]
  - - [30464, 2048, 1, 256]
    - [42, 4910.33]
  - - [31488, 2048, 1, 384]
    - [42, 4996.33]
  - - [17920, 2048, 1, 256]
    - [61, 4794.58]
  - - [19968, 3072, 1, 384]
    - [42, 4947.88]
  - - [18816, 2048, 1, 384]
    - [42, 4960.49]
  - - [17664, 3072, 1, 384]
    - [39, 4977.48]
  - - [5120, 2048, 1, 256]
    - [34, 4754.11]
  - - [43008, 2048, 1, 384]
    - [61, 4945.08]
  - - [1920, 2048, 1, 384]
    - [55, 4786.82]
  - - [36352, 2048, 1, 256]
    - [42, 4875.66]
  - - [27904, 3072, 1, 256]
    - [42, 4904.23]
  - - [4608, 3072, 1, 384]
    - [41, 4877.63]
  - - [27264, 3072, 1, 384]
    - [39, 4992.86]
  - - [18432, 3072, 1, 256]
    - [42, 4805.26]
  - - [19712, 3072, 1, 256]
    - [38, 4891.94]
  - - [29440, 3072, 1, 256]
    - [42, 4905.09]
  - - [39168, 3072, 1, 256]
    - [39, 4885.96]
  - - [17152, 3072, 1, 256]
    - [60, 4854.71]
  - - [12288, 3072, 1, 384]
    - [61, 4927.84]
  - - [10752, 3072, 1, 384]
    - [42, 4935.87]
  - - [20352, 3072, 1, 384]
    - [59, 4990.45]
  - - [13056, 2048, 1, 384]
    - [41, 4923.32]
  - - [20480, 2048, 1, 256]
    - [61, 4819.84]
  - - [21120, 2048, 1, 384]
    - [42, 4969.33]
  - - [1536, 3072, 1, 384]
    - [37, 4770.28]
  - - [11264, 2048, 1, 256]
    - [42, 4827.2]
  - - [33536, 2048, 1, 256]
    - [41, 4884.91]
  - - [15104, 2048, 1, 256]
    - [61, 4850.58]
  - - [33792, 3072, 1, 256]
    - [61, 4854.37]
  - - [8832, 3072, 1, 384]
    - [38, 4958.35]
  - - [23040, 3072, 1, 384]
    - [42, 4978.59]
  - - [12672, 3072, 1, 384]
    - [39, 4972.17]
  - - [24064, 3072, 1, 256]
    - [60, 4847.08]
  - - [20736, 3072, 1, 384]
    - [39, 4971.92]
  - - [26624, 2048, 1, 256]
    - [60, 4825.85]
  - - [1280, 3072, 1, 256]
    - [47, 4592.31]
  - - [26368, 2048, 1, 256]
    - [42, 4907.86]
  - - [8704, 3072, 1, 256]
    - [42, 4814.27]
  - - [10752, 2048, 1, 384]
    - [61, 4921.5]
  - - [14592, 3072, 1, 256]
    - [42, 4873.79]
  - - [29952, 3072, 1, 384]
    - [42, 4979.02]
  - - [1024, 2048, 1, 256]
    - [33, 4609.14]
  - - [23424, 3072, 1, 384]
    - [39, 5008.36]
  - - [12800, 3072, 1, 256]
    - [42, 4848.26]
  - - [22272, 2048, 1, 384]
    - [42, 4964.25]
  - - [21248, 3072, 1, 256]
    - [39, 4889.15]
  - - [32000, 3072, 1, 256]
    - [42, 4922.09]
  - - [26880, 3072, 1, 384]
    - [42, 4980.46]
  - - [28160, 2048, 1, 256]
    - [61, 4827.42]
  - - [16384, 2048, 1, 256]
    - [53, 4666.02]
  - - [16128, 2048, 1, 256]
    - [42, 4878.35]
  - - [40704, 3072, 1, 384]
    - [42, 4994.14]
  - - [15360, 2048, 1, 384]
    - [42, 4922.34]
  - - [27392, 3072, 1, 256]
    - [42, 4892.13]
  - - [6656, 3072, 1, 256]
    - [34, 4791.75]
  - - [13824, 3072, 1, 384]
    - [41, 4935.2]
  - - [3456, 3072, 1, 384]
    - [38, 4914.5]
  - - [3072, 3072, 1, 256]
    - [49, 4754.63]
  - - [38400, 3072, 1, 256]
    - [61, 4848.92]
  - - [4224, 2048, 1, 384]
    - [56, 4868.82]
  - - [4992, 3072, 1, 384]
    - [58, 4949.08]
  - - [38912, 2048, 1, 256]
    - [41, 4855.98]
  - - [17280, 2048, 1, 384]
    - [41, 4946.99]
  - - [28416, 2048, 1, 384]
    - [42, 4984.54]
  - - [15872, 3072, 1, 256]
    - [41, 4827.39]
  - - [22272, 2048, 1, 256]
    - [41, 4913.8]
  - - [40192, 2048, 1, 256]
    - [42, 4901.25]
  - - [22784, 2048, 1, 256]
    - [42, 4883.41]
  - - [39936, 2048, 1, 384]
    - [42, 4934.52]
  - - [22656, 3072, 1, 384]
    - [39, 5006.36]
  - - [3072, 2048, 1, 384]
    - [34, 4844.25]
  - - [33280, 2048, 1, 256]
    - [42, 4860.32]
  - - [5888, 2048, 1, 256]
    - [34, 4708.97]
  - - [6912, 2048, 1, 384]
    - [56, 4869.94]
  - - [5760, 3072, 1, 384]
    - [59, 4948.29]
  - - [40320, 2048, 1, 384]
    - [42, 4984.41]
  - - [34048, 2048, 1, 256]
    - [42, 4909.46]
  - - [34560, 3072, 1, 256]
    - [42, 4912.44]
  - - [35328, 2048, 1, 256]
    - [42, 4847.75]
  - - [13312, 2048, 1, 256]
    - [41, 4843.53]
  - - [18432, 2048, 1, 384]
    - [42, 4927.04]
  - - [24320, 3072, 1, 256]
    - [42, 4897.99]
  - - [18048, 3072, 1, 384]
    - [39, 4998.39]
  - - [26496, 3072, 1, 384]
    - [38, 4997.67]
  - - [2688, 3072, 1, 384]
    - [48, 4886.73]
  - - [21888, 2048, 1, 384]
    - [42, 4972.98]
  - - [20352, 2048, 1, 384]
    - [42, 4967.75]
  - - [31744, 3072, 1, 256]
    - [41, 4873.91]
  - - [28672, 2048, 1, 256]
    - [61, 4804.9]
  - - [8064, 3072, 1, 384]
    - [38, 4968.92]
  - - [19200, 3072, 1, 256]
    - [41, 4894.82]
  - - [12032, 2048, 1, 256]
    - [60, 4813.69]
  - - [37120, 3072, 1, 256]
    - [42, 4904.31]
  - - [14080, 2048, 1, 256]
    - [41, 4835.58]
  - - [14976, 3072, 1, 384]
    - [39, 4980.95]
  - - [24064, 2048, 1, 256]
    - [60, 4844.75]
  - - [23424, 2048, 1, 384]
    - [42, 4969.63]
  - - [36608, 2048, 1, 256]
    - [42, 4920.62]
  - - [38016, 3072, 1, 384]
    - [42, 5015.21]
  - - [15744, 3072, 1, 384]
    - [39, 4999.14]
  - - [23808, 3072, 1, 384]
    - [39, 4990.46]
  - - [26112, 3072, 1, 256]
    - [42, 4873.08]
  - - [31872, 2048, 1, 384]
    - [41, 4988.5]
  - - [2688, 128, 1, 128]
    - [70, 2525.24]
  - - [35968, 128, 1, 256]
    - [65, 4522.65]
  - - [39808, 128, 1, 128]
    - [70, 4356.23]
  - - [29568, 128, 1, 384]
    - [72, 4566.77]
  - - [43648, 128, 1, 256]
    - [70, 4485.83]
  - - [7808, 128, 1, 384]
    - [70, 4108.99]
  - - [11648, 128, 1, 256]
    - [72, 4267.47]
  - - [37248, 128, 1, 384]
    - [70, 4477.64]
  - - [15488, 128, 1, 384]
    - [70, 4339.19]
  - - [19328, 128, 1, 256]
    - [70, 4279.33]
  - - [5248, 128, 1, 128]
    - [63, 3369.28]
  - - [38528, 128, 1, 256]
    - [70, 4559.04]
  - - [23168, 128, 1, 384]
    - [72, 4462.91]
  - - [27008, 128, 1, 256]
    - [65, 4478.75]
  - - [42368, 128, 1, 384]
    - [65, 4721.74]
  - - [12928, 128, 1, 128]
    - [70, 3815.06]
  - - [30848, 128, 1, 384]
    - [65, 4422.08]
  - - [14208, 128, 1, 256]
    - [70, 4375.64]
  - - [20608, 128, 1, 128]
    - [70, 4054.3]
  - - [18048, 128, 1, 384]
    - [72, 4607.81]
  - - [21888, 128, 1, 256]
    - [70, 4413.16]
  - - [6528, 128, 1, 384]
    - [62, 3646.18]
  - - [25728, 128, 1, 384]
    - [70, 4481.8]
  - - [29568, 128, 1, 128]
    - [70, 4264.46]
  - - [21888, 128, 1, 128]
    - [70, 4209.08]
  - - [29568, 128, 1, 256]
    - [70, 4414.46]
  - - [7808, 128, 1, 256]
    - [70, 3975.35]
  - - [33408, 128, 1, 384]
    - [67, 4688.42]
  - - [37248, 128, 1, 256]
    - [70, 4437.7]
  - - [1408, 128, 1, 384]
    - [70, 2112.53]
  - - [19328, 128, 1, 128]
    - [70, 4097.7]
  - - [30848, 128, 1, 128]
    - [70, 4232.95]
  - - [21888, 128, 1, 384]
    - [70, 4486.41]
  - - [23168, 128, 1, 256]
    - [65, 4379.15]
  - - [27008, 128, 1, 128]
    - [70, 4204.67]
  - - [16768, 128, 1, 384]
    - [72, 4304.27]
  - - [30848, 128, 1, 256]
    - [70, 4357.02]
  - - [14208, 128, 1, 128]
    - [70, 4081.06]
  - - [3968, 128, 1, 128]
    - [70, 3480.28]
  - - [44928, 128, 1, 384]
    - [65, 4692.53]
  - - [18048, 128, 1, 256]
    - [65, 4446.6]
  - - [2688, 128, 1, 384]
    - [68, 3021.97]
  - - [11648, 128, 1, 384]
    - [72, 4450.59]
  - - [6528, 128, 1, 256]
    - [62, 3534.53]
  - - [25728, 128, 1, 256]
    - [70, 4411.13]
  - - [10368, 128, 1, 384]
    - [72, 4026.61]
  - - [128, 128, 1, 128]
    - [69, 157.444]
  - - [33408, 128, 1, 256]
    - [65, 4574.28]
  - - [37248, 128, 1, 128]
    - [70, 4294.06]
  - - [1408, 128, 1, 256]
    - [70, 1975.06]
  - - [28288, 128, 1, 128]
    - [70, 4328.27]
  - - [41088, 128, 1, 256]
    - [65, 4512.59]
  - - [34688, 128, 1, 128]
    - [70, 4379.85]
  - - [5248, 128, 1, 384]
    - [72, 4017.91]
  - - [16768, 128, 1, 256]
    - [64, 4152.47]
  - - [9088, 128, 1, 256]
    - [65, 4358.85]
  - - [35968, 128, 1, 128]
    - [71, 4298.95]
  - - [12928, 128, 1, 384]
    - [70, 4096.44]
  - - [34688, 128, 1, 384]
    - [70, 4630.61]
  - - [43648, 128, 1, 128]
    - [70, 4352.06]
  - - [41088, 128, 1, 128]
    - [70, 4319.73]
  - - [20608, 128, 1, 384]
    - [70, 4243.87]
  - - [44928, 128, 1, 256]
    - [70, 4602.94]
  - - [2688, 128, 1, 256]
    - [68, 2889.8]
  - - [6528, 128, 1, 128]
    - [62, 3272.81]
  - - [38528, 128, 1, 128]
    - [70, 4384.86]
  - - [10368, 128, 1, 256]
    - [66, 3878.31]
  - - [24448, 128, 1, 384]
    - [72, 4673.58]
  - - [1408, 128, 1, 128]
    - [70, 1652.48]
  - - [32128, 128, 1, 384]
    - [70, 4555.62]
  - - [5248, 128, 1, 256]
    - [72, 3852.3]
  - - [9088, 128, 1, 128]
    - [65, 3877.55]
  - - [39808, 128, 1, 384]
    - [70, 4539.36]
  - - [9088, 128, 1, 384]
    - [65, 4543.27]
  - - [12928, 128, 1, 256]
    - [70, 4031.46]
  - - [16768, 128, 1, 128]
    - [70, 3940.45]
  - - [10368, 128, 1, 128]
    - [70, 3562.7]
  - - [7808, 128, 1, 128]
    - [71, 3642.55]
  - - [20608, 128, 1, 256]
    - [70, 4200.57]
  - - [44928, 128, 1, 128]
    - [70, 4431.14]
  - - [25728, 128, 1, 128]
    - [70, 4227.11]
  - - [15488, 128, 1, 128]
    - [70, 4025.32]
  - - [23168, 128, 1, 128]
    - [70, 4149.37]
  - - [128, 128, 1, 384]
    - [73, 199.349]
  - - [41088, 128, 1, 384]
    - [65, 4608.35]
  - - [24448, 128, 1, 256]
    - [67, 4526.06]
  - - [3968, 128, 1, 256]
    - [70, 3998.26]
  - - [28288, 128, 1, 384]
    - [70, 4571.93]
  - - [32128, 128, 1, 256]
    - [70, 4499.03]
  - - [18048, 128, 1, 128]
    - [70, 4174.17]
  - - [35968, 128, 1, 384]
    - [67, 4654.82]
  - - [39808, 128, 1, 256]
    - [70, 4488.75]
  - - [3968, 128, 1, 384]
    - [70, 4178.13]
  - - [43648, 128, 1, 384]
    - [67, 4561.17]
  - - [33408, 128, 1, 128]
    - [70, 4290.97]
  - - [34688, 128, 1, 256]
    - [70, 4569.3]
  - - [19328, 128, 1, 384]
    - [70, 4344.3]
  - - [11648, 128, 1, 128]
    - [70, 3888.36]
  - - [38528, 128, 1, 384]
    - [70, 4611.21]
  - - [42368, 128, 1, 256]
    - [65, 4611.12]
  - - [27008, 128, 1, 384]
    - [67, 4599.79]
  - - [128, 128, 1, 256]
    - [68, 186.912]
  - - [24448, 128, 1, 128]
    - [70, 4320.07]
  - - [15488, 128, 1, 256]
    - [70, 4256.22]
  - - [14208, 128, 1, 384]
    - [70, 4472.03]
  - - [28288, 128, 1, 256]
    - [70, 4516.39]
  - - [42368, 128, 1, 128]
    - [70, 4394.51]
  - - [32128, 128, 1, 128]
    - [70, 4324.57]
- null
